number,value,datetime_start,datetime_complete,duration,params_activation1,params_activation2,params_activation3,params_activation4,params_batch_size,params_fl1,params_fl2,params_fl3,params_fl4,params_learning_rate,params_n_layers,params_num_epochs,params_train_size,params_weight_decay,state
415,0.39357176423072815,2023-09-03 16:50:05.310736,2023-09-03 16:50:07.224973,0 days 00:00:01.914237,ReLU,ReLU,,,16,21,21.0,,,0.0016820358188593064,2,100,0.26458675126776465,0.001437043425139205,COMPLETE
416,0.36915498971939087,2023-09-03 16:50:07.225262,2023-09-03 16:50:09.439557,0 days 00:00:02.214295,Leaky,ReLU,Tanh,ReLU,30,23,2.0,8.0,6.0,0.0013325776938805025,4,60,0.6369446683316558,0.00014494939586332008,COMPLETE
417,0.3033389449119568,2023-09-03 16:50:09.439870,2023-09-03 16:50:46.529378,0 days 00:00:37.089508,Leaky,ReLU,,,2,20,14.0,,,0.0030043898679046692,2,100,0.7595834979464285,0.0018223655885092475,COMPLETE
418,0.39960306882858276,2023-09-03 16:50:46.529687,2023-09-03 16:50:52.052286,0 days 00:00:05.522599,Tanh,ReLU,Tanh,Leaky,12,13,24.0,12.0,7.0,0.00017929093384385107,4,60,0.7153445194522755,0.00035976662137857373,COMPLETE
419,0.31939998269081116,2023-09-03 16:50:52.052603,2023-09-03 16:51:29.641987,0 days 00:00:37.589384,Leaky,Sigmoid,,,2,24,24.0,,,0.0017892278945571308,2,100,0.7718737197443982,0.0003095401094593346,COMPLETE
420,0.31778112053871155,2023-09-03 16:51:29.642293,2023-09-03 16:51:33.233875,0 days 00:00:03.591582,Leaky,ReLU,,,12,17,21.0,,,0.002521212878096923,2,60,0.6713662978223256,0.0013164295805209944,COMPLETE
421,0.3292676508426666,2023-09-03 16:51:33.234174,2023-09-03 16:52:02.584258,0 days 00:00:29.350084,Tanh,ReLU,,,2,22,24.0,,,0.0014655810983635923,2,100,0.6018291958763393,2.3883408817167197e-05,COMPLETE
422,0.28597787022590637,2023-09-03 16:52:02.584556,2023-09-03 16:52:10.181609,0 days 00:00:07.597053,Leaky,ReLU,Leaky,,10,23,15.0,11.0,,0.0020796394399418285,3,80,0.733462685246951,0.0004314651147863495,COMPLETE
423,0.31115901470184326,2023-09-03 16:52:10.181914,2023-09-03 16:52:18.820305,0 days 00:00:08.638391,Leaky,ReLU,Tanh,Sigmoid,10,24,14.0,9.0,12.0,0.00230651559701915,4,80,0.7016501077107461,0.00047999816770967995,COMPLETE
424,0.34910115599632263,2023-09-03 16:52:18.820627,2023-09-03 16:52:24.358649,0 days 00:00:05.538022,Leaky,ReLU,,,10,23,15.0,,,0.002047833258466014,2,80,0.6516909222218057,0.0016962480934020528,COMPLETE
425,0.4081675410270691,2023-09-03 16:52:24.358947,2023-09-03 16:52:26.421014,0 days 00:00:02.062067,Leaky,Tanh,ReLU,,10,23,14.0,13.0,,0.0018739263519512352,3,80,0.18498437085095817,0.014408231768125258,COMPLETE
426,0.38758060336112976,2023-09-03 16:52:26.421313,2023-09-03 16:52:32.600565,0 days 00:00:06.179252,Leaky,ReLU,Leaky,,10,23,13.0,11.0,,0.0028058707541112455,3,80,0.5624891974584296,0.019273878450543843,COMPLETE
427,0.313541054725647,2023-09-03 16:52:32.600869,2023-09-03 16:52:39.276121,0 days 00:00:06.675252,Leaky,ReLU,,,10,24,11.0,,,0.0036368154140018817,2,80,0.799368912958637,0.0004227475812274221,COMPLETE
428,0.3062611222267151,2023-09-03 16:52:39.276428,2023-09-03 16:52:46.660551,0 days 00:00:07.384123,Leaky,Leaky,Leaky,,10,23,16.0,11.0,,0.0016148851379326316,3,80,0.7278731818941941,0.00017445731338640874,COMPLETE
429,0.3935367166996002,2023-09-03 16:52:46.660875,2023-09-03 16:52:47.852234,0 days 00:00:01.191359,Leaky,Leaky,,,10,23,12.0,,,0.0025169059500890264,2,80,0.1381232525755417,0.0011067825816162844,COMPLETE
430,0.3576364815235138,2023-09-03 16:52:47.852538,2023-09-03 16:52:49.994007,0 days 00:00:02.141469,Leaky,Sigmoid,Leaky,,12,22,9.0,10.0,,0.002028754407042789,3,60,0.32400817676908467,0.0005647759377943312,COMPLETE
431,0.34883251786231995,2023-09-03 16:52:49.994329,2023-09-03 16:52:52.384351,0 days 00:00:02.390022,Leaky,,,,12,22,,,,0.0013151981758787903,1,80,0.4351365057139488,0.0019412070714351813,COMPLETE
432,0.5702390670776367,2023-09-03 16:52:52.384646,2023-09-03 16:52:57.711324,0 days 00:00:05.326678,Leaky,ReLU,Tanh,Tanh,12,24,17.0,13.0,4.0,0.0658362498588502,4,60,0.6848976078786129,0.0014571926161132467,COMPLETE
433,0.34299689531326294,2023-09-03 16:52:57.711650,2023-09-03 16:53:01.129054,0 days 00:00:03.417404,Leaky,Leaky,Leaky,,8,23,24.0,7.0,,0.004563184211697383,3,60,0.3621352584095937,0.0001255082779956611,COMPLETE
434,0.37077316641807556,2023-09-03 16:53:01.129369,2023-09-03 16:53:05.884740,0 days 00:00:04.755371,Leaky,Leaky,,,10,18,15.0,,,0.0011650529596762803,2,60,0.7693190355014204,0.002278967158042431,COMPLETE
435,0.4021788239479065,2023-09-03 16:53:05.885049,2023-09-03 16:53:27.888778,0 days 00:00:22.003729,Leaky,ReLU,Leaky,Leaky,4,22,24.0,12.0,3.0,0.001548832095592789,4,80,0.7324113210560267,0.013551704084216668,COMPLETE
436,0.3330076038837433,2023-09-03 16:53:27.889095,2023-09-03 16:53:30.690149,0 days 00:00:02.801054,Leaky,Leaky,,,12,22,23.0,,,0.001954451562819436,2,60,0.5251717585772433,0.0011845998820182693,COMPLETE
437,0.30361589789390564,2023-09-03 16:53:30.690459,2023-09-03 16:53:35.494535,0 days 00:00:04.804076,Leaky,ReLU,Tanh,,12,23,23.0,14.0,,0.002410389855030303,3,60,0.7066190520975957,0.0004898974873439085,COMPLETE
438,0.39078742265701294,2023-09-03 16:53:35.494846,2023-09-03 16:53:39.550526,0 days 00:00:04.055680,Leaky,Leaky,,,12,24,24.0,,,0.03005322787620564,2,60,0.7726231058426455,0.0008898121376905117,COMPLETE
439,0.3160232603549957,2023-09-03 16:53:39.550828,2023-09-03 16:53:47.571632,0 days 00:00:08.020804,Sigmoid,Leaky,Leaky,,12,22,22.0,11.0,,0.001229448368109619,3,100,0.7448379776723459,0.0006401527513087592,COMPLETE
440,0.41243091225624084,2023-09-03 16:53:47.571953,2023-09-03 16:53:51.521965,0 days 00:00:03.950012,Leaky,ReLU,Sigmoid,,10,5,24.0,18.0,,0.0028968167587182783,3,60,0.5070341561485429,0.0014432272194431143,COMPLETE
441,0.4354872703552246,2023-09-03 16:53:51.522295,2023-09-03 16:53:57.068505,0 days 00:00:05.546210,Leaky,Leaky,,,12,23,13.0,,,5.2465183017460074e-05,2,100,0.6317638677018484,0.00019837478941649525,COMPLETE
442,0.42590203881263733,2023-09-03 16:53:57.068818,2023-09-03 16:54:01.418106,0 days 00:00:04.349288,ReLU,ReLU,Leaky,Leaky,16,23,23.0,19.0,5.0,0.02068743755849181,4,60,0.6621253780378927,0.0025990450343184113,COMPLETE
443,0.4015279710292816,2023-09-03 16:54:01.418427,2023-09-03 16:54:04.310678,0 days 00:00:02.892251,Leaky,Leaky,,,12,22,24.0,,,0.0004163188490858914,2,80,0.4087617276526243,0.00039355714696281746,COMPLETE
444,0.3091191053390503,2023-09-03 16:54:04.310981,2023-09-03 16:54:06.974437,0 days 00:00:02.663456,Leaky,Leaky,Leaky,,12,22,22.0,10.0,,0.0015375417721101214,3,100,0.24227961658499897,0.0019040125673185479,COMPLETE
445,0.3590833246707916,2023-09-03 16:54:06.974764,2023-09-03 16:54:09.036952,0 days 00:00:02.062188,Leaky,ReLU,,,10,24,23.0,,,0.0033163636287135995,2,60,0.301207484518726,0.0010639706284932423,COMPLETE
446,0.34617355465888977,2023-09-03 16:54:09.037261,2023-09-03 16:54:12.209388,0 days 00:00:03.172127,Leaky,Leaky,Tanh,,12,21,24.0,12.0,,0.0018307736398857242,3,100,0.28716192972691623,9.46947217082631e-05,COMPLETE
447,0.3220014274120331,2023-09-03 16:54:12.209701,2023-09-03 16:54:14.280749,0 days 00:00:02.071048,Leaky,Tanh,Leaky,,30,23,18.0,10.0,,0.0012552427758118945,3,60,0.7032322010103056,0.0001418524000483707,COMPLETE
448,0.32969599962234497,2023-09-03 16:54:14.281064,2023-09-03 16:54:53.188687,0 days 00:00:38.907623,Leaky,ReLU,,,2,22,13.0,,,0.0010378432232690648,2,100,0.7996461904374489,0.0005496844318078631,COMPLETE
449,0.3019567131996155,2023-09-03 16:54:53.188991,2023-09-03 16:54:59.028461,0 days 00:00:05.839470,Leaky,Leaky,ReLU,Tanh,12,23,20.0,9.0,10.0,0.002166490391956604,4,60,0.7464001412350025,0.00024219199941407366,COMPLETE
450,0.34412717819213867,2023-09-03 16:54:59.028777,2023-09-03 16:55:35.677446,0 days 00:00:36.648669,Tanh,Leaky,Leaky,,2,21,22.0,8.0,,0.003794993322910066,3,100,0.6143495517412418,0.0007516436632692166,COMPLETE
451,0.35812970995903015,2023-09-03 16:55:35.677770,2023-09-03 16:55:37.152869,0 days 00:00:01.475099,Leaky,ReLU,,,12,22,23.0,,,0.0015667777878841486,2,60,0.25941255212992437,0.0015300703295350348,COMPLETE
452,0.37888696789741516,2023-09-03 16:55:37.153180,2023-09-03 16:55:39.388646,0 days 00:00:02.235466,Leaky,Leaky,Tanh,,12,23,7.0,14.0,,0.0024975610481460164,3,100,0.20122035499100355,0.001255436711029281,COMPLETE
453,0.3188587427139282,2023-09-03 16:55:39.388953,2023-09-03 16:55:59.303360,0 days 00:00:19.914407,Leaky,ReLU,,,2,24,24.0,,,0.0011327398868918746,2,60,0.6804449560583107,0.0009328805535721754,COMPLETE
454,0.32365161180496216,2023-09-03 16:55:59.303671,2023-09-03 16:56:08.161685,0 days 00:00:08.858014,Tanh,Leaky,Leaky,ReLU,10,22,22.0,11.0,9.0,0.0014507173239443846,4,80,0.7240105680395217,0.0017177859184688816,COMPLETE
455,0.5232791900634766,2023-09-03 16:56:08.161998,2023-09-03 16:56:11.445182,0 days 00:00:03.283184,Leaky,Sigmoid,Leaky,,12,8,21.0,3.0,,0.00031547633041167515,3,100,0.3051205455655656,0.0003002131448967433,COMPLETE
456,0.5285961031913757,2023-09-03 16:56:11.445490,2023-09-03 16:56:13.178151,0 days 00:00:01.732661,Leaky,Leaky,,,8,21,11.0,,,0.03808935604632792,2,60,0.2240196043881431,0.05573004936942481,COMPLETE
457,0.30864644050598145,2023-09-03 16:56:13.178453,2023-09-03 16:57:00.674251,0 days 00:00:47.495798,Tanh,ReLU,Leaky,,2,22,23.0,15.0,,0.0018721461215458024,3,100,0.7717689655998974,0.0004666675508902691,COMPLETE
458,0.5608583092689514,2023-09-03 16:57:00.674572,2023-09-03 16:57:07.903230,0 days 00:00:07.228658,Leaky,Leaky,,,12,24,24.0,,,0.0009791605664449924,2,100,0.7432621446993308,0.09635853564867125,COMPLETE
459,0.5215266346931458,2023-09-03 16:57:07.903527,2023-09-03 16:57:20.680905,0 days 00:00:12.777378,Leaky,ReLU,Tanh,,4,20,23.0,12.0,,2.061478627253698e-05,3,60,0.6972418937720722,0.0006389794989727104,COMPLETE
460,0.32220232486724854,2023-09-03 16:57:20.681231,2023-09-03 16:57:46.877340,0 days 00:00:26.196109,Tanh,Leaky,,,2,23,22.0,,,0.0030620378164015606,2,100,0.5431721722999111,0.00018121594888268497,COMPLETE
461,0.5131863951683044,2023-09-03 16:57:46.877648,2023-09-03 16:57:52.984462,0 days 00:00:06.106814,Sigmoid,Leaky,Leaky,Leaky,12,16,24.0,13.0,2.0,0.005099142816754994,4,60,0.7992004361162719,0.002475318968454895,COMPLETE
462,0.35542359948158264,2023-09-03 16:57:52.984777,2023-09-03 16:57:56.960482,0 days 00:00:03.975705,Leaky,ReLU,Leaky,,12,21,20.0,9.0,,0.0013326234659560535,3,80,0.4530920204281109,0.002990518923506095,COMPLETE
463,0.34751492738723755,2023-09-03 16:57:56.960797,2023-09-03 16:58:28.331838,0 days 00:00:31.371041,ReLU,Leaky,,,2,23,23.0,,,0.0022685990456992183,2,100,0.6476497649720364,0.010526265478929238,COMPLETE
464,0.30262255668640137,2023-09-03 16:58:28.332142,2023-09-03 16:58:31.585211,0 days 00:00:03.253069,Leaky,ReLU,Tanh,,10,23,21.0,10.0,,0.0018316236316059129,3,60,0.4030972137478943,0.0021498249433802496,COMPLETE
465,0.28619128465652466,2023-09-03 16:58:31.585527,2023-09-03 16:58:38.341169,0 days 00:00:06.755642,Tanh,Leaky,,,12,22,4.0,,,0.00111951594345969,2,100,0.7630423964449292,0.0008232354598837945,COMPLETE
466,0.3330442011356354,2023-09-03 16:58:38.341474,2023-09-03 16:58:45.187930,0 days 00:00:06.846456,Tanh,Leaky,,,12,22,24.0,,,0.0011576261809618888,2,100,0.7692873101134745,3.4707856640925186e-05,COMPLETE
467,0.3464218080043793,2023-09-03 16:58:45.188244,2023-09-03 16:58:48.631676,0 days 00:00:03.443432,Tanh,ReLU,,,12,22,5.0,,,0.0015815881356156202,2,100,0.3814841777991459,1.1758735040756222e-05,COMPLETE
468,0.4029097259044647,2023-09-03 16:58:48.631999,2023-09-03 16:58:50.106433,0 days 00:00:01.474434,Tanh,Leaky,,,12,23,24.0,,,0.001337524238592822,2,100,0.15883592588219336,0.00010795949509035286,COMPLETE
469,0.5750465989112854,2023-09-03 16:58:50.106726,2023-09-03 16:58:56.867426,0 days 00:00:06.760700,Tanh,ReLU,,,12,22,4.0,,,1.1367980903365618e-05,2,100,0.7665233924278753,0.0010779591278203607,COMPLETE
470,0.43218356370925903,2023-09-03 16:58:56.867735,2023-09-03 16:58:57.955434,0 days 00:00:01.087699,Tanh,Leaky,,,12,24,4.0,,,0.00212915626265636,2,100,0.1142363942771561,0.001341092681415214,COMPLETE
471,0.45366737246513367,2023-09-03 16:58:57.955737,2023-09-03 16:59:00.912891,0 days 00:00:02.957154,Tanh,Leaky,,,12,22,4.0,,,0.0010961496661047716,2,100,0.32946032399381797,0.0008432483941565945,COMPLETE
472,0.3298872113227844,2023-09-03 16:59:00.913193,2023-09-03 16:59:07.293041,0 days 00:00:06.379848,Tanh,Tanh,,,12,23,4.0,,,0.0027191537727530263,2,100,0.7301386147348903,0.0015548654204858288,COMPLETE
473,0.33021989464759827,2023-09-03 16:59:07.293340,2023-09-03 16:59:11.467700,0 days 00:00:04.174360,Tanh,ReLU,,,12,10,3.0,,,0.0016553831448189006,2,100,0.47424079833995064,8.32735693805882e-05,COMPLETE
474,0.3952140808105469,2023-09-03 16:59:11.468007,2023-09-03 16:59:48.891321,0 days 00:00:37.423314,Tanh,Leaky,,,2,23,3.0,,,0.00018436055126923488,2,100,0.775100803937219,0.004170450401019286,COMPLETE
475,0.3489590883255005,2023-09-03 16:59:48.891630,2023-09-03 16:59:52.271698,0 days 00:00:03.380068,Tanh,ReLU,,,12,22,24.0,,,0.00398035949493958,2,100,0.3694177890299951,0.00038209284364211087,COMPLETE
476,0.45124301314353943,2023-09-03 16:59:52.272005,2023-09-03 17:00:02.618921,0 days 00:00:10.346916,Tanh,Leaky,,,2,24,5.0,,,0.0009430770491611153,2,100,0.213533463619865,0.04152113727308128,COMPLETE
477,0.3558042347431183,2023-09-03 17:00:02.619225,2023-09-03 17:00:08.665217,0 days 00:00:06.045992,Tanh,Leaky,Tanh,Tanh,12,23,12.0,11.0,11.0,0.001362539931372959,4,80,0.5929359615346617,0.00023182103952761661,COMPLETE
478,0.39559128880500793,2023-09-03 17:00:08.665549,2023-09-03 17:00:13.766060,0 days 00:00:05.100511,Tanh,ReLU,,,16,22,24.0,,,7.943537738093556e-05,2,100,0.7425210484187312,0.00015355729000068367,COMPLETE
479,0.5220639109611511,2023-09-03 17:00:13.766368,2023-09-03 17:00:14.748132,0 days 00:00:00.981764,Leaky,Leaky,,,12,12,2.0,,,0.001990861053614361,2,40,0.271172628829803,0.0018515124118891647,COMPLETE
480,0.3259090781211853,2023-09-03 17:00:14.748445,2023-09-03 17:00:55.872615,0 days 00:00:41.124170,Leaky,ReLU,Sigmoid,Sigmoid,2,23,4.0,5.0,15.0,0.0011375290177985987,4,100,0.5729675609770715,0.0009979769761143278,COMPLETE
481,0.35723721981048584,2023-09-03 17:00:55.872941,2023-09-03 17:00:57.929733,0 days 00:00:02.056792,Leaky,Sigmoid,,,30,22,23.0,,,0.0004134714623665293,2,100,0.4981687993808329,0.0005554851972355184,COMPLETE
482,0.3578777313232422,2023-09-03 17:00:57.930032,2023-09-03 17:01:04.197564,0 days 00:00:06.267532,Tanh,Leaky,,,12,4,20.0,,,0.003211115086084406,2,100,0.7191706214923419,0.00028651386115928837,COMPLETE
483,0.31484296917915344,2023-09-03 17:01:04.197878,2023-09-03 17:01:50.235739,0 days 00:00:46.037861,Leaky,ReLU,ReLU,Leaky,2,21,10.0,21.0,5.0,0.0017211356183318087,4,80,0.7986115108047529,0.00044244749789345726,COMPLETE
484,0.37710458040237427,2023-09-03 17:01:50.236053,2023-09-03 17:01:56.788919,0 days 00:00:06.552866,Sigmoid,Leaky,,,12,7,16.0,,,0.0008902336280569573,2,100,0.7533760566227932,0.0012045362923930256,COMPLETE
485,0.34164178371429443,2023-09-03 17:01:56.789222,2023-09-03 17:02:02.688490,0 days 00:00:05.899268,Leaky,Leaky,,,12,23,23.0,,,0.011891255647738156,2,100,0.6736768941510306,0.000900622828880126,COMPLETE
486,0.314127117395401,2023-09-03 17:02:02.688803,2023-09-03 17:02:37.953399,0 days 00:00:35.264596,Tanh,ReLU,,,2,15,24.0,,,0.001387974581008174,2,100,0.7212709885534274,0.007608051163176807,COMPLETE
487,0.37964722514152527,2023-09-03 17:02:37.953714,2023-09-03 17:02:47.514340,0 days 00:00:09.560626,Leaky,Leaky,Tanh,Tanh,12,6,17.0,12.0,8.0,0.002400981273876163,4,100,0.7595175098949656,0.0006761686395249263,COMPLETE
488,0.47194167971611023,2023-09-03 17:02:47.514679,2023-09-03 17:03:10.065302,0 days 00:00:22.550623,Leaky,ReLU,,,2,24,5.0,,,1.526967966216536e-05,2,60,0.7749217410063202,0.0021315605072828136,COMPLETE
489,0.38031283020973206,2023-09-03 17:03:10.065620,2023-09-03 17:03:12.331965,0 days 00:00:02.266345,Tanh,Leaky,,,12,22,24.0,,,0.0011030131331258332,2,100,0.24578183459105907,0.0016230931452340688,COMPLETE
490,0.46270930767059326,2023-09-03 17:03:12.332269,2023-09-03 17:03:13.640609,0 days 00:00:01.308340,ReLU,Leaky,,,12,3,21.0,,,0.0027040609093710558,2,80,0.17764329521070557,0.024747092741713505,COMPLETE
491,0.31760820746421814,2023-09-03 17:03:13.640931,2023-09-03 17:03:43.411820,0 days 00:00:29.770889,Leaky,ReLU,Tanh,Leaky,2,21,8.0,7.0,18.0,0.0015769083422106465,4,60,0.6920971270253702,0.00011566778538327613,COMPLETE
492,0.4853188693523407,2023-09-03 17:03:43.412144,2023-09-03 17:03:49.911901,0 days 00:00:06.499757,Leaky,Leaky,Leaky,,8,23,23.0,10.0,,0.0006540759937004538,3,100,0.34614472891059306,0.03653003586321316,COMPLETE
493,0.3905494809150696,2023-09-03 17:03:49.912221,2023-09-03 17:03:53.848048,0 days 00:00:03.935827,Tanh,ReLU,,,12,22,24.0,,,0.0001197077838738525,2,60,0.7298473025258863,0.0012384018838120644,COMPLETE
494,0.3645477592945099,2023-09-03 17:03:53.848354,2023-09-03 17:04:30.775984,0 days 00:00:36.927630,Leaky,Leaky,Tanh,,2,14,23.0,8.0,,0.005749545244038077,3,100,0.6228411863147892,0.0032332115148113725,COMPLETE
495,0.3425830602645874,2023-09-03 17:04:30.776297,2023-09-03 17:04:40.596694,0 days 00:00:09.820397,Leaky,Leaky,,,4,22,22.0,,,0.0008799580884771915,2,60,0.6630238044649565,0.0005377228332962315,COMPLETE
496,0.305620014667511,2023-09-03 17:04:40.597011,2023-09-03 17:04:43.850530,0 days 00:00:03.253519,Tanh,Tanh,Leaky,,12,23,15.0,9.0,,0.001952997516328041,3,40,0.7462032524115978,6.23457275097926e-05,COMPLETE
497,0.31827858090400696,2023-09-03 17:04:43.850853,2023-09-03 17:04:54.060093,0 days 00:00:10.209240,Leaky,ReLU,Leaky,Tanh,12,21,9.0,23.0,6.0,0.0012907640383541424,4,100,0.7758207402791989,0.0026787471547859722,COMPLETE
498,0.2842385172843933,2023-09-03 17:04:54.060416,2023-09-03 17:05:27.749772,0 days 00:00:33.689356,Leaky,Leaky,,,2,22,24.0,,,0.0005406823618436178,2,100,0.7023689064889722,0.00020750663282064602,COMPLETE
499,0.2863865792751312,2023-09-03 17:05:27.750095,2023-09-03 17:05:46.350777,0 days 00:00:18.600682,Leaky,Leaky,,,2,23,23.0,,,0.0004554354082139033,2,60,0.6449130804314545,0.0002177868819185845,COMPLETE
