number,value,datetime_start,datetime_complete,duration,params_activation1,params_activation2,params_activation3,params_activation4,params_batch_size,params_fl1,params_fl2,params_fl3,params_fl4,params_learning_rate,params_n_layers,params_num_epochs,params_train_size,params_weight_decay,state
328,0.4964594542980194,2023-09-04 01:00:45.967021,2023-09-04 01:00:48.792562,0 days 00:00:02.825541,Sigmoid,,,,12,11,,,,0.031122781069292085,1,80,0.36570592788344247,2.4268391323835205e-05,COMPLETE
329,0.5161241888999939,2023-09-04 01:00:48.792845,2023-09-04 01:00:49.442974,0 days 00:00:00.650129,Sigmoid,,,,12,12,,,,0.08393756034546129,1,60,0.1452656566632583,0.0010332851482530144,COMPLETE
330,0.4845758080482483,2023-09-04 01:00:49.443260,2023-09-04 01:00:55.261509,0 days 00:00:05.818249,Sigmoid,,,,12,21,,,,0.01927240452169274,1,100,0.46580018780001275,0.00015311059314935006,COMPLETE
331,0.4893410801887512,2023-09-04 01:00:55.261809,2023-09-04 01:00:56.647647,0 days 00:00:01.385838,Leaky,,,,12,23,,,,0.04343844004694816,1,80,0.23319690860521752,1.8171180149178645e-05,COMPLETE
332,0.5032222867012024,2023-09-04 01:00:56.647958,2023-09-04 01:00:59.520137,0 days 00:00:02.872179,Tanh,,,,12,20,,,,0.01467843781758173,1,40,0.3985832574364661,0.0014289472379834574,COMPLETE
333,0.46771562099456787,2023-09-04 01:00:59.520422,2023-09-04 01:01:01.489416,0 days 00:00:01.968994,Sigmoid,,,,16,15,,,,0.07184939494733103,1,60,0.4981412856558096,7.362154369902317e-05,COMPLETE
334,0.7110940217971802,2023-09-04 01:01:01.489705,2023-09-04 01:01:02.728485,0 days 00:00:01.238780,ReLU,,,,12,24,,,,0.05358917895574356,1,80,0.20794348946862432,3.327051516528584e-05,COMPLETE
335,0.49037739634513855,2023-09-04 01:01:02.728784,2023-09-04 01:01:04.023399,0 days 00:00:01.294615,Sigmoid,,,,12,22,,,,0.0375618387765758,1,60,0.29207889111157453,4.6106326075312336e-05,COMPLETE
336,0.546699047088623,2023-09-04 01:01:04.023698,2023-09-04 01:01:07.815614,0 days 00:00:03.791916,Sigmoid,,,,2,22,,,,0.0092507798888538,1,40,0.24676674426737596,5.6553819441870945e-05,COMPLETE
337,0.451945960521698,2023-09-04 01:01:07.815917,2023-09-04 01:01:09.556129,0 days 00:00:01.740212,Sigmoid,,,,30,23,,,,0.006629494431124289,1,100,0.3091195645655258,0.00017788055714781787,COMPLETE
338,0.6400581002235413,2023-09-04 01:01:09.556603,2023-09-04 01:01:14.052172,0 days 00:00:04.495569,Sigmoid,,,,12,21,,,,0.0853781922593953,1,80,0.42403390148094877,9.377188944858722e-05,COMPLETE
339,0.46559426188468933,2023-09-04 01:01:14.052459,2023-09-04 01:01:16.341059,0 days 00:00:02.288600,Sigmoid,,,,12,24,,,,0.02719917009640072,1,60,0.5377398657421438,0.00011951061686782647,COMPLETE
340,0.5996350646018982,2023-09-04 01:01:16.341343,2023-09-04 01:01:17.003853,0 days 00:00:00.662510,Sigmoid,Tanh,,,12,11,6.0,,,0.062086057633204614,2,40,0.17314031733429625,1.3141348418740726e-05,COMPLETE
341,0.6507717370986938,2023-09-04 01:01:17.004146,2023-09-04 01:01:18.259313,0 days 00:00:01.255167,Sigmoid,,,,12,23,,,,0.0026936245018164837,1,80,0.21484000816392101,2.56893871526859e-05,COMPLETE
342,0.5226868987083435,2023-09-04 01:01:18.259600,2023-09-04 01:01:21.969872,0 days 00:00:03.710272,Tanh,,,,12,22,,,,0.09970020155144528,1,60,0.673660505252553,0.00027309842999945655,COMPLETE
343,0.4274241328239441,2023-09-04 01:01:21.970158,2023-09-04 01:01:26.691948,0 days 00:00:04.721790,Sigmoid,,,,16,10,,,,0.045761417612868914,1,100,0.4768084261392742,7.84516033103158e-05,COMPLETE
344,0.48835843801498413,2023-09-04 01:01:26.692435,2023-09-04 01:01:30.332411,0 days 00:00:03.639976,Sigmoid,,,,16,10,,,,0.04735079780623339,1,80,0.5143886403654737,7.721974896242147e-05,COMPLETE
345,0.4893311858177185,2023-09-04 01:01:30.332694,2023-09-04 01:01:31.337725,0 days 00:00:01.005031,Sigmoid,,,,16,10,,,,0.03537853736501247,1,40,0.4561004425346859,8.85172024102355e-05,COMPLETE
346,0.5731319189071655,2023-09-04 01:01:31.338030,2023-09-04 01:01:33.405818,0 days 00:00:02.067788,Sigmoid,,,,16,10,,,,6.142641732252524e-05,1,80,0.4762214693011773,0.0001005694385257503,COMPLETE
347,0.46537506580352783,2023-09-04 01:01:33.406096,2023-09-04 01:01:35.023818,0 days 00:00:01.617722,Sigmoid,,,,16,9,,,,0.04700679291984718,1,60,0.4954069867253713,6.905199853608205e-05,COMPLETE
348,0.6715707182884216,2023-09-04 01:01:35.024109,2023-09-04 01:01:36.299325,0 days 00:00:01.275216,Sigmoid,,,,16,11,,,,0.024130348437353417,1,100,0.2250322103617923,1.934028750857767e-05,COMPLETE
349,0.5616070032119751,2023-09-04 01:01:36.299617,2023-09-04 01:01:37.334176,0 days 00:00:01.034559,Sigmoid,,,,16,10,,,,0.004278591398880911,1,40,0.1947737198704362,0.00011504012033943569,COMPLETE
350,0.5755211114883423,2023-09-04 01:01:37.334657,2023-09-04 01:01:39.618252,0 days 00:00:02.283595,Sigmoid,,,,16,21,,,,0.00047404912208186603,1,80,0.26971369115226446,0.0001494922611186694,COMPLETE
351,0.5212401747703552,2023-09-04 01:01:39.618546,2023-09-04 01:01:44.617930,0 days 00:00:04.999384,Sigmoid,ReLU,,,8,11,11.0,,,0.0010636838678502807,2,60,0.48306725000876466,1.661873467726145e-05,COMPLETE
352,0.46148401498794556,2023-09-04 01:01:44.618219,2023-09-04 01:01:46.460727,0 days 00:00:01.842508,Sigmoid,,,,12,22,,,,0.017688549312939415,1,80,0.31835524988629277,0.00022678449572523086,COMPLETE
353,0.5992282629013062,2023-09-04 01:01:46.461019,2023-09-04 01:01:47.238674,0 days 00:00:00.777655,ReLU,,,,12,19,,,,0.030549781318841302,1,40,0.2624030173829961,0.00010509574402009572,COMPLETE
354,0.974214494228363,2023-09-04 01:01:47.238978,2023-09-04 01:01:49.231941,0 days 00:00:01.992963,Sigmoid,,,,10,21,,,,0.07519230993032884,1,100,0.2367954027125235,6.082480827340699e-05,COMPLETE
355,0.44962769746780396,2023-09-04 01:01:49.232238,2023-09-04 01:01:52.009772,0 days 00:00:02.777534,Sigmoid,,,,12,8,,,,0.010578035950791894,1,60,0.44469303477661504,8.095597148979589e-05,COMPLETE
356,0.49982893466949463,2023-09-04 01:01:52.010061,2023-09-04 01:01:53.803592,0 days 00:00:01.793531,Sigmoid,,,,12,20,,,,0.043513618528535254,1,80,0.2785357613449519,0.00019341050145894515,COMPLETE
357,0.8226031064987183,2023-09-04 01:01:53.803889,2023-09-04 01:01:55.245993,0 days 00:00:01.442104,Sigmoid,,,,12,22,,,,0.001395682558546262,1,40,0.38521819448018635,0.0008397425088750132,COMPLETE
358,0.5188335180282593,2023-09-04 01:01:55.246483,2023-09-04 01:01:58.914508,0 days 00:00:03.668025,Sigmoid,,,,12,12,,,,0.06309773149262374,1,60,0.29302261375929384,0.0003427673302552104,COMPLETE
359,0.7785567045211792,2023-09-04 01:01:58.914789,2023-09-04 01:01:59.831549,0 days 00:00:00.916760,Sigmoid,,,,16,9,,,,0.08692977437334662,1,80,0.2003316624746164,0.013084613910617344,COMPLETE
360,0.5680408477783203,2023-09-04 01:01:59.831831,2023-09-04 01:02:01.737373,0 days 00:00:01.905542,Sigmoid,,,,12,23,,,,0.0031238766139669704,1,100,0.257445004107795,0.00013770103402309565,COMPLETE
361,0.586191713809967,2023-09-04 01:02:01.737788,2023-09-04 01:02:02.724649,0 days 00:00:00.986861,Leaky,,,,12,21,,,,0.007799177358670726,1,40,0.3294878416973774,2.2099196320075227e-05,COMPLETE
362,0.4943999946117401,2023-09-04 01:02:02.724948,2023-09-04 01:02:05.386089,0 days 00:00:02.661141,Sigmoid,,,,12,22,,,,0.036286187816311405,1,80,0.4586575786432442,8.425952549259019e-05,COMPLETE
363,0.4324137568473816,2023-09-04 01:02:05.386385,2023-09-04 01:02:15.166956,0 days 00:00:09.780571,Sigmoid,,,,2,13,,,,0.0060909336106221715,1,60,0.35822006370221,5.507356079166727e-05,COMPLETE
364,0.9284261465072632,2023-09-04 01:02:15.167250,2023-09-04 01:02:16.556700,0 days 00:00:01.389450,Sigmoid,,,,12,10,,,,1.110114848140717e-05,1,80,0.24625470798140836,1.2860271464125227e-05,COMPLETE
365,0.4102725088596344,2023-09-04 01:02:16.556982,2023-09-04 01:02:18.135366,0 days 00:00:01.578384,Sigmoid,Leaky,ReLU,Leaky,30,23,16.0,9.0,18.0,0.05360918286559716,4,60,0.40615535046258133,0.00011783365738626949,COMPLETE
366,0.7703536748886108,2023-09-04 01:02:18.135675,2023-09-04 01:02:20.467373,0 days 00:00:02.331698,ReLU,Leaky,ReLU,,30,23,15.0,9.0,,0.0723752687758498,3,60,0.40441392408305116,0.00017633429687359406,COMPLETE
367,0.4530301094055176,2023-09-04 01:02:20.467841,2023-09-04 01:02:21.895554,0 days 00:00:01.427713,Sigmoid,Leaky,ReLU,,30,23,19.0,14.0,,0.01183542655131434,3,60,0.43755163501136035,0.0006175019259448234,COMPLETE
368,0.6273798942565918,2023-09-04 01:02:21.895862,2023-09-04 01:02:25.334587,0 days 00:00:03.438725,Sigmoid,Leaky,ReLU,Leaky,12,24,12.0,4.0,16.0,0.05659391094965374,4,60,0.40675057927517677,1.0062278112786882e-05,COMPLETE
369,0.39912062883377075,2023-09-04 01:02:25.334914,2023-09-04 01:02:26.338070,0 days 00:00:01.003156,Sigmoid,Leaky,,,30,23,18.0,,,0.015364160476104649,2,60,0.38396644842213307,0.00012721901663156042,COMPLETE
370,0.4680913984775543,2023-09-04 01:02:26.338381,2023-09-04 01:02:27.356531,0 days 00:00:01.018150,Sigmoid,Leaky,,,30,23,18.0,,,0.02432878470049553,2,60,0.3861297368338189,0.00012268194832701902,COMPLETE
371,0.49089744687080383,2023-09-04 01:02:27.356844,2023-09-04 01:02:28.765929,0 days 00:00:01.409085,Sigmoid,Leaky,ReLU,Leaky,30,17,22.0,10.0,17.0,0.017579093592495057,4,60,0.3652383424336645,0.00015323032374766338,COMPLETE
372,0.45471400022506714,2023-09-04 01:02:28.766239,2023-09-04 01:02:29.568795,0 days 00:00:00.802556,Sigmoid,Leaky,,,30,20,17.0,,,0.016180140136893284,2,60,0.30226212655821927,0.00012594964161126036,COMPLETE
373,0.6081012487411499,2023-09-04 01:02:29.569096,2023-09-04 01:02:31.490754,0 days 00:00:01.921658,Sigmoid,Leaky,ReLU,,12,11,15.0,7.0,,0.0016605862908639708,3,40,0.4211632662852711,0.00015178666284338204,COMPLETE
374,0.5182516574859619,2023-09-04 01:02:31.491065,2023-09-04 01:02:33.186448,0 days 00:00:01.695383,Sigmoid,Leaky,Sigmoid,,30,9,13.0,13.0,,0.013883781576915786,3,60,0.5065452908384204,0.00011145601447138683,COMPLETE
375,0.9148110151290894,2023-09-04 01:02:33.186978,2023-09-04 01:02:36.834677,0 days 00:00:03.647699,Sigmoid,Leaky,Leaky,ReLU,30,23,20.0,16.0,8.0,0.01931911351700247,4,100,0.27163771547540866,0.01919737430573359,COMPLETE
376,0.544898509979248,2023-09-04 01:02:36.834990,2023-09-04 01:02:37.678338,0 days 00:00:00.843348,Sigmoid,Leaky,,,30,24,18.0,,,0.0035967869379868265,2,60,0.2818676947811022,0.00020959850585514284,COMPLETE
377,0.5613237023353577,2023-09-04 01:02:37.678637,2023-09-04 01:02:38.351254,0 days 00:00:00.672617,Sigmoid,,,,30,23,,,,0.05087319818970108,1,40,0.4738506266323713,0.0019943065696299807,COMPLETE
378,0.4017707109451294,2023-09-04 01:02:38.351540,2023-09-04 01:02:40.756285,0 days 00:00:02.404745,Sigmoid,Leaky,,,30,22,23.0,,,0.012432402213657661,2,60,0.41530334492699583,7.419862297871737e-05,COMPLETE
379,0.5179060101509094,2023-09-04 01:02:40.756793,2023-09-04 01:02:41.867524,0 days 00:00:01.110731,Sigmoid,Leaky,,,30,22,23.0,,,0.00970059555695136,2,60,0.39918327471872767,3.636275211850262e-05,COMPLETE
380,0.5149893164634705,2023-09-04 01:02:41.867832,2023-09-04 01:02:42.547349,0 days 00:00:00.679517,Sigmoid,Leaky,,,30,23,21.0,,,0.012401958168395304,2,40,0.3759536625217875,6.997405499264015e-05,COMPLETE
381,0.42140325903892517,2023-09-04 01:02:42.547643,2023-09-04 01:02:45.886375,0 days 00:00:03.338732,ReLU,Leaky,,,30,22,19.0,,,0.01114928876377698,2,100,0.43040766684591825,0.0005364425186426644,COMPLETE
382,0.44843387603759766,2023-09-04 01:02:45.886664,2023-09-04 01:02:47.791812,0 days 00:00:01.905148,ReLU,Leaky,,,30,22,19.0,,,0.011235178732534759,2,100,0.4326490055593497,0.00039228459717822745,COMPLETE
383,0.5549904704093933,2023-09-04 01:02:47.792104,2023-09-04 01:02:49.601714,0 days 00:00:01.809610,ReLU,Leaky,,,30,22,17.0,,,0.015333426999042247,2,100,0.4133479914949914,0.0005487744860075001,COMPLETE
384,0.41106370091438293,2023-09-04 01:02:49.602012,2023-09-04 01:02:51.557170,0 days 00:00:01.955158,ReLU,Leaky,,,30,22,23.0,,,0.008366475395856462,2,100,0.44625247104167753,0.0009638000096004439,COMPLETE
385,0.46168363094329834,2023-09-04 01:02:51.557465,2023-09-04 01:02:54.891892,0 days 00:00:03.334427,ReLU,Leaky,,,30,22,23.0,,,0.012534204196184695,2,100,0.44542295601914056,0.0004684592859169271,COMPLETE
386,0.5860891938209534,2023-09-04 01:02:54.892393,2023-09-04 01:02:58.282831,0 days 00:00:03.390438,ReLU,Leaky,,,30,22,20.0,,,0.008208339886189672,2,100,0.4257437713775401,0.0007887316644467226,COMPLETE
387,0.3852953314781189,2023-09-04 01:02:58.283333,2023-09-04 01:03:00.470918,0 days 00:00:02.187585,ReLU,Leaky,,,30,23,22.0,,,0.009679594833580545,2,100,0.3969372442532411,0.0002534659760264692,COMPLETE
388,0.4663024842739105,2023-09-04 01:03:00.471214,2023-09-04 01:03:02.486681,0 days 00:00:02.015467,ReLU,Leaky,,,30,23,22.0,,,0.011648968624898072,2,100,0.39112943995841176,0.0006886846009422709,COMPLETE
389,0.5087790489196777,2023-09-04 01:03:02.486981,2023-09-04 01:03:06.558089,0 days 00:00:04.071108,ReLU,Leaky,,,30,23,21.0,,,0.009190600909541168,2,100,0.4101766698869638,0.0002677807472416161,COMPLETE
390,0.4108032286167145,2023-09-04 01:03:06.558396,2023-09-04 01:03:09.593800,0 days 00:00:03.035404,ReLU,Leaky,,,30,24,24.0,,,0.00750089861473539,2,100,0.43843345158608044,0.00029030599496914893,COMPLETE
391,0.4128614664077759,2023-09-04 01:03:09.594307,2023-09-04 01:03:12.245965,0 days 00:00:02.651658,ReLU,Leaky,,,30,24,24.0,,,0.008178217373540663,2,100,0.4394436872738988,0.0003220225294397267,COMPLETE
392,0.580694317817688,2023-09-04 01:03:12.246269,2023-09-04 01:03:14.142398,0 days 00:00:01.896129,ReLU,Leaky,,,30,24,24.0,,,0.006828548410534399,2,100,0.43760037223891035,0.00027601063653331714,COMPLETE
393,0.4545162618160248,2023-09-04 01:03:14.142705,2023-09-04 01:03:15.968998,0 days 00:00:01.826293,ReLU,Leaky,,,30,24,24.0,,,0.008637827161790363,2,100,0.4226276489849702,0.0003255003245149985,COMPLETE
394,0.41344526410102844,2023-09-04 01:03:15.969311,2023-09-04 01:03:17.884997,0 days 00:00:01.915686,ReLU,Leaky,,,30,24,23.0,,,0.010029526102776435,2,100,0.4460802177076256,0.00030498603332561813,COMPLETE
395,0.490770161151886,2023-09-04 01:03:17.885311,2023-09-04 01:03:19.834881,0 days 00:00:01.949570,ReLU,Leaky,,,30,24,23.0,,,0.007406057630321679,2,100,0.45533294724547935,0.00033273217228504276,COMPLETE
396,0.5498145222663879,2023-09-04 01:03:19.835183,2023-09-04 01:03:21.546715,0 days 00:00:01.711532,ReLU,Leaky,,,30,24,22.0,,,0.009679860075508459,2,100,0.3944605667454276,0.0010633942940585482,COMPLETE
397,0.5316941142082214,2023-09-04 01:03:21.547022,2023-09-04 01:03:23.464265,0 days 00:00:01.917243,ReLU,Leaky,,,30,24,24.0,,,0.008672739128961224,2,100,0.4476437957831709,0.00022550818892693545,COMPLETE
398,0.6647709012031555,2023-09-04 01:03:23.464575,2023-09-04 01:03:25.204555,0 days 00:00:01.739980,ReLU,Leaky,,,30,24,23.0,,,0.006925148317682646,2,100,0.40616104734918645,0.00027868793428578774,COMPLETE
399,0.46361276507377625,2023-09-04 01:03:25.204865,2023-09-04 01:03:26.836928,0 days 00:00:01.632063,ReLU,Leaky,,,30,24,22.0,,,0.005797468725459781,2,100,0.376433179043127,0.00033376268780546876,COMPLETE
400,0.4368981420993805,2023-09-04 01:03:26.837226,2023-09-04 01:03:28.732162,0 days 00:00:01.894936,ReLU,Leaky,,,30,24,21.0,,,0.00949425221081997,2,100,0.43715890516287553,0.0004116136373229672,COMPLETE
401,0.5516143441200256,2023-09-04 01:03:28.732474,2023-09-04 01:03:30.514431,0 days 00:00:01.781957,ReLU,Leaky,,,30,24,23.0,,,0.012891351791886172,2,100,0.4128298339632582,0.0003841112553686283,COMPLETE
402,0.48591309785842896,2023-09-04 01:03:30.514738,2023-09-04 01:03:32.464745,0 days 00:00:01.950007,ReLU,Leaky,,,30,24,24.0,,,0.0057547298712491545,2,100,0.45437056365442335,0.0012790265791587886,COMPLETE
403,0.512633204460144,2023-09-04 01:03:32.465046,2023-09-04 01:03:34.168813,0 days 00:00:01.703767,ReLU,Sigmoid,,,30,23,22.0,,,0.004405899427635926,2,100,0.39250472004970005,0.00024099895857035,COMPLETE
404,0.5168494582176208,2023-09-04 01:03:34.169122,2023-09-04 01:03:35.999723,0 days 00:00:01.830601,ReLU,Leaky,,,30,24,23.0,,,0.00957319827120569,2,100,0.42310277670571644,0.00028749234060645177,COMPLETE
405,0.5358180403709412,2023-09-04 01:03:36.000046,2023-09-04 01:03:38.001893,0 days 00:00:02.001847,ReLU,Tanh,,,30,23,20.0,,,0.008239224660797176,2,100,0.4632992423144048,0.00021694457379846596,COMPLETE
406,0.4519234001636505,2023-09-04 01:03:38.002187,2023-09-04 01:03:39.612783,0 days 00:00:01.610596,ReLU,Leaky,,,30,23,24.0,,,0.005097358386735899,2,100,0.36754080596251243,0.005180861185788195,COMPLETE
407,0.6346506476402283,2023-09-04 01:03:39.613097,2023-09-04 01:03:41.365666,0 days 00:00:01.752569,ReLU,Leaky,,,30,24,21.0,,,0.007649136190328365,2,100,0.4062867995559681,0.00018749037440679293,COMPLETE
408,0.4165719449520111,2023-09-04 01:03:41.365971,2023-09-04 01:03:43.375206,0 days 00:00:02.009235,ReLU,ReLU,,,30,23,22.0,,,0.009965732693241917,2,100,0.4350547287609561,0.0003199329391387893,COMPLETE
409,0.48805731534957886,2023-09-04 01:03:43.375510,2023-09-04 01:03:44.847683,0 days 00:00:01.472173,ReLU,Leaky,,,30,24,23.0,,,0.0008266494441620079,2,100,0.3362398790645195,0.00023596846244492965,COMPLETE
410,0.49942582845687866,2023-09-04 01:03:44.847997,2023-09-04 01:03:45.945838,0 days 00:00:01.097841,ReLU,Leaky,,,30,23,24.0,,,0.011413265161675063,2,60,0.41903063491138537,0.0015654242133666114,COMPLETE
411,0.49493876099586487,2023-09-04 01:03:45.946146,2023-09-04 01:03:47.569671,0 days 00:00:01.623525,ReLU,Sigmoid,,,30,24,16.0,,,0.013693349716194497,2,100,0.3775332127540017,0.00018041299495264959,COMPLETE
412,0.5368761420249939,2023-09-04 01:03:47.569978,2023-09-04 01:03:48.761825,0 days 00:00:01.191847,ReLU,Leaky,,,30,23,20.0,,,0.006690618558150329,2,60,0.45660136842590093,0.0004813834695337719,COMPLETE
413,0.42746850848197937,2023-09-04 01:03:48.762137,2023-09-04 01:03:49.708775,0 days 00:00:00.946638,ReLU,Tanh,,,30,24,22.0,,,0.014941463457257439,2,60,0.3561442702294461,0.0027528613202824075,COMPLETE
414,0.7047334909439087,2023-09-04 01:03:49.709077,2023-09-04 01:03:51.413488,0 days 00:00:01.704411,ReLU,Leaky,,,30,23,18.0,,,2.3871131709748284e-05,2,100,0.39507461034368746,0.0032919517318484508,COMPLETE
415,0.5834845304489136,2023-09-04 01:03:51.413786,2023-09-04 01:03:52.573590,0 days 00:00:01.159804,ReLU,Leaky,,,30,23,21.0,,,0.008030034151080315,2,60,0.43851978042628126,0.000724961539831261,COMPLETE
416,0.6223911046981812,2023-09-04 01:03:52.573899,2023-09-04 01:03:54.341321,0 days 00:00:01.767422,ReLU,Leaky,,,30,24,15.0,,,0.07762854984676178,2,100,0.40869728871516897,0.0002573508192572283,COMPLETE
417,0.6318853497505188,2023-09-04 01:03:54.341635,2023-09-04 01:03:55.816402,0 days 00:00:01.474767,Leaky,ReLU,Tanh,Leaky,30,23,24.0,5.0,24.0,0.08707181176924242,4,60,0.38592237378604205,0.00037628205747918843,COMPLETE
418,0.44771575927734375,2023-09-04 01:03:55.816727,2023-09-04 01:03:57.853475,0 days 00:00:02.036748,ReLU,Leaky,,,30,24,14.0,,,0.010151633722667162,2,100,0.47468871930911916,0.0010557236693751256,COMPLETE
419,0.7900503277778625,2023-09-04 01:03:57.853784,2023-09-04 01:04:04.382459,0 days 00:00:06.528675,ReLU,Leaky,,,4,18,23.0,,,0.09948573501175118,2,60,0.42738860300396797,0.0002049256636047429,COMPLETE
420,0.6980280876159668,2023-09-04 01:04:04.382773,2023-09-04 01:04:06.311616,0 days 00:00:01.928843,ReLU,Leaky,,,30,23,19.0,,,0.0002936639581398274,2,100,0.4471102135563654,0.0003019672745184354,COMPLETE
421,0.5350539088249207,2023-09-04 01:04:06.311927,2023-09-04 01:04:08.644611,0 days 00:00:02.332684,ReLU,Sigmoid,,,10,24,17.0,,,0.06855472754123336,2,60,0.3551265024107565,0.0004920677034969775,COMPLETE
422,0.49577516317367554,2023-09-04 01:04:08.644941,2023-09-04 01:04:11.195599,0 days 00:00:02.550658,ReLU,Tanh,,,8,23,21.0,,,0.005536007872758002,2,60,0.31148987704923853,0.0001944873460234848,COMPLETE
423,0.5100418329238892,2023-09-04 01:04:11.195939,2023-09-04 01:04:13.473422,0 days 00:00:02.277483,Leaky,Leaky,ReLU,,30,24,23.0,22.0,,0.0020301642256374437,3,100,0.41229976916591965,0.0013008549766630863,COMPLETE
424,0.5955929160118103,2023-09-04 01:04:13.473740,2023-09-04 01:04:14.396895,0 days 00:00:00.923155,ReLU,Leaky,,,30,23,20.0,,,0.011996913138491178,2,60,0.3461286728419345,0.0026037462427449397,COMPLETE
425,0.6275071501731873,2023-09-04 01:04:14.397198,2023-09-04 01:04:16.124580,0 days 00:00:01.727382,ReLU,Leaky,,,30,24,22.0,,,0.014850265139156583,2,100,0.39511995902294966,0.0005964415919920049,COMPLETE
426,0.5422903299331665,2023-09-04 01:04:16.124895,2023-09-04 01:04:28.871709,0 days 00:00:12.746814,ReLU,Leaky,,,2,8,24.0,,,0.003982999676430981,2,60,0.42522659913556154,0.002137932362860815,COMPLETE
427,1.2262507677078247,2023-09-04 01:04:28.872021,2023-09-04 01:04:50.458733,0 days 00:00:21.586712,ReLU,ReLU,,,4,23,18.0,,,0.06447612500501115,2,100,0.3724204219806927,0.00042001056210098627,COMPLETE
428,0.50376957654953,2023-09-04 01:04:50.459042,2023-09-04 01:04:52.208636,0 days 00:00:01.749594,ReLU,Leaky,,,30,24,21.0,,,0.007126294701188859,2,60,0.6204375279971155,0.0009915980316965672,COMPLETE
429,0.458261638879776,2023-09-04 01:04:52.208948,2023-09-04 01:04:54.308338,0 days 00:00:02.099390,Sigmoid,Leaky,,,30,23,19.0,,,0.02003732764547706,2,100,0.4670049284839032,0.0001600336812131249,COMPLETE
430,0.38457322120666504,2023-09-04 01:04:54.308850,2023-09-04 01:04:56.398010,0 days 00:00:02.089160,Tanh,Leaky,Sigmoid,,30,23,23.0,3.0,,0.002375439787540238,3,60,0.48772018668124073,0.0009001680596925213,COMPLETE
431,0.4658617675304413,2023-09-04 01:04:56.398323,2023-09-04 01:04:58.630938,0 days 00:00:02.232615,Tanh,Leaky,Sigmoid,,30,24,23.0,3.0,,0.003170850716617192,3,60,0.49561198890378755,0.0008309376005659707,COMPLETE
432,0.5842817425727844,2023-09-04 01:04:58.631270,2023-09-04 01:05:00.852494,0 days 00:00:02.221224,Tanh,Leaky,Sigmoid,Leaky,30,7,22.0,7.0,6.0,0.00264461676425431,4,60,0.4832664322761288,0.0016487377480741744,COMPLETE
433,0.4155607521533966,2023-09-04 01:05:00.852822,2023-09-04 01:05:02.093127,0 days 00:00:01.240305,Tanh,Leaky,,,30,22,24.0,,,0.004643321604026919,2,60,0.45808358976719804,0.0009500110144756111,COMPLETE
434,0.6583806872367859,2023-09-04 01:05:02.093426,2023-09-04 01:05:03.980996,0 days 00:00:01.887570,Tanh,Leaky,Sigmoid,,30,6,23.0,3.0,,0.005128007032676481,3,60,0.2954297280501814,0.001251468620304166,COMPLETE
