number,value,datetime_start,datetime_complete,duration,params_activation1,params_activation2,params_activation3,params_activation4,params_batch_size,params_fl1,params_fl2,params_fl3,params_fl4,params_learning_rate,params_n_layers,params_num_epochs,params_train_size,params_weight_decay,state
298,0.11337172240018845,2023-09-03 15:52:04.539308,2023-09-03 15:52:07.910022,0 days 00:00:03.370714,Leaky,Leaky,Leaky,Leaky,30,16,11.0,23.0,10.0,0.00417079487300054,4,80,0.7159198023436156,0.0003027688355742142,COMPLETE
299,0.13639289140701294,2023-09-03 15:52:07.910347,2023-09-03 15:52:11.466463,0 days 00:00:03.556116,ReLU,Tanh,Sigmoid,Tanh,16,13,23.0,23.0,8.0,0.003313783302728137,4,100,0.33454224403167643,3.5588424742129094e-05,COMPLETE
300,0.12142429500818253,2023-09-03 15:52:11.466793,2023-09-03 15:52:21.728826,0 days 00:00:10.262033,ReLU,Tanh,Tanh,ReLU,8,17,12.0,22.0,10.0,0.013854341909894752,4,80,0.6348287652568124,0.0005108551541962917,COMPLETE
301,0.1143290176987648,2023-09-03 15:52:21.729150,2023-09-03 15:52:26.025242,0 days 00:00:04.296092,ReLU,ReLU,ReLU,Sigmoid,16,15,10.0,24.0,13.0,0.005168943566501813,4,60,0.6696025735607157,0.0005671928284412161,COMPLETE
302,0.11832576245069504,2023-09-03 15:52:26.025576,2023-09-03 15:52:31.310538,0 days 00:00:05.284962,ReLU,Sigmoid,Sigmoid,ReLU,16,12,13.0,23.0,11.0,0.007115676164345867,4,80,0.4476928558990536,0.00022794993362460278,COMPLETE
303,0.11466396600008011,2023-09-03 15:52:31.310868,2023-09-03 15:52:44.208886,0 days 00:00:12.898018,Sigmoid,Tanh,Tanh,Leaky,12,14,14.0,21.0,9.0,0.0015448991368123526,4,100,0.7427502763277986,1.782894406626285e-05,COMPLETE
304,0.12335237860679626,2023-09-03 15:52:44.209444,2023-09-03 15:52:57.787734,0 days 00:00:13.578290,ReLU,Leaky,ReLU,,10,16,24.0,22.0,,0.016888069932608097,3,80,0.6030540392505285,2.7621521387070144e-05,COMPLETE
305,0.10534900426864624,2023-09-03 15:52:57.788083,2023-09-03 15:53:01.247601,0 days 00:00:03.459518,ReLU,Tanh,Leaky,ReLU,30,18,11.0,24.0,15.0,0.00256777384983877,4,80,0.697619984044033,1.4611245733504869e-05,COMPLETE
306,0.10561728477478027,2023-09-03 15:53:01.247935,2023-09-03 15:53:37.780300,0 days 00:00:36.532365,Tanh,Tanh,Tanh,ReLU,4,13,8.0,19.0,8.0,0.011981090591301001,4,80,0.7719412362330775,6.36932565181632e-05,COMPLETE
307,0.1255536824464798,2023-09-03 15:53:37.780636,2023-09-03 15:53:44.947301,0 days 00:00:07.166665,ReLU,Tanh,Sigmoid,Leaky,16,19,10.0,11.0,7.0,0.03166458172570519,4,100,0.7229770288068551,2.118720813701566e-05,COMPLETE
308,0.11035869270563126,2023-09-03 15:53:44.947637,2023-09-03 15:53:53.105937,0 days 00:00:08.158300,ReLU,Tanh,Tanh,ReLU,16,15,19.0,13.0,16.0,0.008661203628346712,4,80,0.48487846505499793,8.121404823655638e-05,COMPLETE
309,0.11155329644680023,2023-09-03 15:53:53.106534,2023-09-03 15:53:58.805574,0 days 00:00:05.699040,ReLU,Leaky,ReLU,Tanh,30,13,9.0,23.0,11.0,0.005771029741784423,4,40,0.6826768061782591,1.0076121192461102e-05,COMPLETE
310,0.12043558061122894,2023-09-03 15:53:58.806155,2023-09-03 15:54:09.359331,0 days 00:00:10.553176,ReLU,Tanh,Sigmoid,ReLU,16,12,7.0,20.0,18.0,0.003829288946629953,4,60,0.5669319608431896,4.952330000732569e-05,COMPLETE
311,0.12403275817632675,2023-09-03 15:54:09.359908,2023-09-03 15:54:19.864768,0 days 00:00:10.504860,ReLU,,,,10,16,,,,0.0030061057450593664,1,80,0.5153913786771808,0.00017442462877670603,COMPLETE
312,0.10864328593015671,2023-09-03 15:54:19.865316,2023-09-03 15:54:37.506022,0 days 00:00:17.640706,ReLU,ReLU,Tanh,Leaky,16,10,13.0,24.0,12.0,0.004661585559500757,4,100,0.6540294392286226,3.224213293635121e-05,COMPLETE
313,0.10533199459314346,2023-09-03 15:54:37.506598,2023-09-03 15:54:47.629043,0 days 00:00:10.122445,ReLU,Sigmoid,Leaky,ReLU,16,18,12.0,23.0,10.0,0.011348531013939431,4,80,0.7705652948778616,4.075217185539892e-05,COMPLETE
314,0.1503516137599945,2023-09-03 15:54:47.629382,2023-09-03 15:55:00.296273,0 days 00:00:12.666891,ReLU,Tanh,ReLU,Sigmoid,8,17,10.0,22.0,9.0,0.026142175237043482,4,80,0.740081989139143,2.3810126481377635e-05,COMPLETE
315,0.11268161237239838,2023-09-03 15:55:00.296603,2023-09-03 15:55:03.467430,0 days 00:00:03.170827,ReLU,Tanh,Tanh,Leaky,30,14,22.0,24.0,13.0,0.0012373158588601396,4,100,0.5447231752383235,1.7632592967751286e-05,COMPLETE
316,0.1392914056777954,2023-09-03 15:55:03.467764,2023-09-03 15:55:05.416909,0 days 00:00:01.949145,ReLU,Leaky,Sigmoid,ReLU,16,12,11.0,21.0,12.0,0.02058848305435941,4,80,0.2261965773030984,0.0007082813338790546,COMPLETE
317,0.13847306370735168,2023-09-03 15:55:05.417238,2023-09-03 15:55:12.045609,0 days 00:00:06.628371,Sigmoid,Tanh,ReLU,ReLU,16,15,12.0,23.0,10.0,0.001960747594155702,4,80,0.7988464011578822,0.0017416214265279363,COMPLETE
318,0.1589728593826294,2023-09-03 15:55:12.045940,2023-09-03 15:55:24.186112,0 days 00:00:12.140172,ReLU,Tanh,Tanh,Leaky,10,11,11.0,24.0,14.0,0.036319246749314,4,100,0.7117548737510673,0.00040609895626771505,COMPLETE
319,0.11087945103645325,2023-09-03 15:55:24.186439,2023-09-03 15:55:43.705415,0 days 00:00:19.518976,ReLU,Tanh,Leaky,Tanh,4,13,20.0,6.0,9.0,0.006786219123319665,4,80,0.6220111531871915,0.00012327263895084688,COMPLETE
320,0.1494193822145462,2023-09-03 15:55:43.705743,2023-09-03 15:55:44.582429,0 days 00:00:00.876686,ReLU,ReLU,Sigmoid,ReLU,16,14,9.0,22.0,17.0,0.0008910946117365074,4,60,0.13474557403822707,0.0002448070552816117,COMPLETE
321,0.18966105580329895,2023-09-03 15:55:44.582758,2023-09-03 15:55:47.998236,0 days 00:00:03.415478,ReLU,Sigmoid,Tanh,ReLU,30,1,21.0,20.0,11.0,0.009280147029946059,4,80,0.7466685305302191,1.293752175552832e-05,COMPLETE
322,0.11693733185529709,2023-09-03 15:55:47.998567,2023-09-03 15:55:55.133779,0 days 00:00:07.135212,ReLU,Tanh,ReLU,Leaky,16,17,13.0,23.0,15.0,0.003694627245643742,4,100,0.6824540473263567,2.7816292792801037e-05,COMPLETE
323,0.1177598237991333,2023-09-03 15:55:55.134107,2023-09-03 15:56:32.954471,0 days 00:00:37.820364,Leaky,Leaky,Sigmoid,ReLU,2,16,24.0,10.0,8.0,0.015226979090176554,4,80,0.6561410056989806,1.877951651059992e-05,COMPLETE
324,0.12141933292150497,2023-09-03 15:56:32.954809,2023-09-03 15:56:36.145750,0 days 00:00:03.190941,ReLU,Tanh,Tanh,ReLU,16,18,10.0,24.0,8.0,0.0023368420007243763,4,80,0.3905871591584839,0.0010897973046182221,COMPLETE
325,0.12288318574428558,2023-09-03 15:56:36.146075,2023-09-03 15:56:37.996657,0 days 00:00:01.850582,ReLU,Tanh,ReLU,Leaky,30,15,11.0,21.0,9.0,0.004696009942870389,4,100,0.3003339995576636,0.00020421746002285737,COMPLETE
326,0.12144596129655838,2023-09-03 15:56:37.996981,2023-09-03 15:56:43.859279,0 days 00:00:05.862298,ReLU,Tanh,Leaky,ReLU,16,12,12.0,22.0,10.0,0.005602353201569383,4,80,0.7177542264965145,0.0027879543683325195,COMPLETE
327,0.10659370571374893,2023-09-03 15:56:43.859609,2023-09-03 15:56:53.149247,0 days 00:00:09.289638,ReLU,Leaky,Tanh,Sigmoid,10,16,23.0,23.0,13.0,0.0016849958748864668,4,80,0.755065811782883,1.5537114542278552e-05,COMPLETE
328,0.12913504242897034,2023-09-03 15:56:53.149587,2023-09-03 15:56:56.693140,0 days 00:00:03.543553,ReLU,Tanh,Sigmoid,Tanh,16,15,10.0,24.0,16.0,0.0026964610083201478,4,60,0.5923483758113112,1.18455566465154e-05,COMPLETE
329,0.11040433496236801,2023-09-03 15:56:56.693481,2023-09-03 15:57:01.520641,0 days 00:00:04.827160,ReLU,Tanh,Tanh,ReLU,16,13,14.0,19.0,18.0,0.007841752447442823,4,100,0.4631027025005076,0.0001456628314629535,COMPLETE
330,0.14015936851501465,2023-09-03 15:57:01.520967,2023-09-03 15:57:18.250122,0 days 00:00:16.729155,Sigmoid,ReLU,ReLU,Leaky,8,13,9.0,22.0,20.0,0.000646707042862798,4,80,0.706229073992873,3.481014429124034e-05,COMPLETE
331,0.12397179007530212,2023-09-03 15:57:18.250683,2023-09-03 15:57:21.757589,0 days 00:00:03.506906,Tanh,Sigmoid,Sigmoid,,30,14,13.0,23.0,,0.009985352482814293,3,80,0.7718542334834463,0.00027309527216326263,COMPLETE
332,0.12274542450904846,2023-09-03 15:57:21.757910,2023-09-03 15:57:30.611323,0 days 00:00:08.853413,ReLU,Tanh,Tanh,ReLU,12,11,8.0,24.0,12.0,0.0034428589070302647,4,100,0.6818375837660627,2.3861472234386524e-05,COMPLETE
333,0.10406216233968735,2023-09-03 15:57:30.611657,2023-09-03 15:57:36.548034,0 days 00:00:05.936377,ReLU,Tanh,Leaky,ReLU,16,17,11.0,24.0,9.0,0.004227354191393204,4,80,0.7268739311954796,4.10413943124332e-05,COMPLETE
334,0.12568452954292297,2023-09-03 15:57:36.548367,2023-09-03 15:57:42.436507,0 days 00:00:05.888140,ReLU,Tanh,ReLU,Leaky,16,16,11.0,24.0,9.0,0.0041390356948977245,4,80,0.7243804401924997,5.12262984084215e-05,COMPLETE
335,0.10754552483558655,2023-09-03 15:57:42.436839,2023-09-03 15:57:45.024246,0 days 00:00:02.587407,ReLU,Tanh,Tanh,ReLU,16,15,12.0,23.0,10.0,0.004947336039770751,4,40,0.6403752820168276,4.090091530635277e-05,COMPLETE
336,0.11116036772727966,2023-09-03 15:57:45.024581,2023-09-03 15:57:50.463115,0 days 00:00:05.438534,ReLU,Tanh,Leaky,ReLU,16,17,11.0,24.0,11.0,0.0031061822572989763,4,80,0.6651596518561712,5.760341491599776e-05,COMPLETE
337,0.14730943739414215,2023-09-03 15:57:50.463446,2023-09-03 15:57:52.356278,0 days 00:00:01.892832,ReLU,Tanh,Sigmoid,Leaky,16,12,17.0,23.0,19.0,0.0013597750605018272,4,100,0.18026025687088254,3.216522638279975e-05,COMPLETE
338,0.11732480674982071,2023-09-03 15:57:52.356622,2023-09-03 15:57:58.923083,0 days 00:00:06.566461,ReLU,Tanh,ReLU,ReLU,16,16,11.0,24.0,9.0,0.005951384959904262,4,80,0.6899856327247952,4.6555512175125544e-05,COMPLETE
339,0.1110837459564209,2023-09-03 15:57:58.923422,2023-09-03 15:58:03.281702,0 days 00:00:04.358280,ReLU,Tanh,Tanh,Tanh,16,17,10.0,24.0,10.0,0.0041637847032172754,4,60,0.7340611619208579,2.034504446390651e-05,COMPLETE
340,0.11660227179527283,2023-09-03 15:58:03.282033,2023-09-03 15:58:06.762601,0 days 00:00:03.480568,ReLU,Leaky,Sigmoid,ReLU,16,14,4.0,23.0,17.0,0.019192844359698952,4,80,0.4058140822407193,6.770341162090675e-05,COMPLETE
341,0.12122374773025513,2023-09-03 15:58:06.762936,2023-09-03 15:58:21.958655,0 days 00:00:15.195719,ReLU,Tanh,Tanh,Leaky,4,13,16.0,21.0,13.0,0.00347615762756199,4,100,0.3558457819039274,0.0009258164797312729,COMPLETE
342,0.11278343200683594,2023-09-03 15:58:21.958999,2023-09-03 15:58:30.945316,0 days 00:00:08.986317,ReLU,Tanh,ReLU,ReLU,16,15,12.0,20.0,9.0,0.0021643817652017023,4,80,0.5862635005379716,2.8492755276520343e-05,COMPLETE
343,0.11561910063028336,2023-09-03 15:58:30.945661,2023-09-03 15:58:34.435674,0 days 00:00:03.490013,ReLU,Tanh,Leaky,Sigmoid,30,16,8.0,24.0,10.0,0.027001870469316343,4,80,0.5505228985782598,1.518290899412334e-05,COMPLETE
344,0.1329696774482727,2023-09-03 15:58:34.436014,2023-09-03 15:58:38.688367,0 days 00:00:04.252353,Sigmoid,Tanh,,,16,12,10.0,,,0.004976898979073368,2,100,0.6156057483487648,3.920484789847405e-05,COMPLETE
345,0.11073068529367447,2023-09-03 15:58:38.688693,2023-09-03 15:58:44.520228,0 days 00:00:05.831535,ReLU,Leaky,Tanh,ReLU,16,11,9.0,22.0,11.0,0.006732093045929959,4,80,0.7030127273612042,0.0005549469184597983,COMPLETE
346,0.11492300033569336,2023-09-03 15:58:44.520561,2023-09-03 15:58:48.593070,0 days 00:00:04.072509,ReLU,ReLU,Sigmoid,Leaky,30,17,11.0,22.0,14.0,0.0011325765676232407,4,80,0.7427251527415477,0.0003699475424981604,COMPLETE
347,0.12816451489925385,2023-09-03 15:58:48.593431,2023-09-03 15:58:52.105292,0 days 00:00:03.511861,ReLU,Tanh,ReLU,ReLU,16,15,3.0,21.0,10.0,0.00033997304521887653,4,60,0.5258192359974634,2.5163420740358074e-05,COMPLETE
348,0.11825557053089142,2023-09-03 15:58:52.105652,2023-09-03 15:59:07.190268,0 days 00:00:15.084616,ReLU,Tanh,Tanh,Tanh,16,14,12.0,23.0,12.0,0.0027417819965184793,4,100,0.5028940005230161,1.274927846501723e-05,COMPLETE
349,0.10758752375841141,2023-09-03 15:59:07.190898,2023-09-03 15:59:27.277283,0 days 00:00:20.086385,ReLU,Tanh,Sigmoid,ReLU,8,10,13.0,16.0,9.0,0.004228117858314601,4,80,0.653652238241504,1.0035294717071488e-05,COMPLETE
350,0.11532168835401535,2023-09-03 15:59:27.277634,2023-09-03 15:59:35.152129,0 days 00:00:07.874495,Leaky,Leaky,Leaky,Leaky,16,13,10.0,24.0,13.0,0.0015507962501984808,4,80,0.7103440493548935,1.758053000740249e-05,COMPLETE
351,0.11615698784589767,2023-09-03 15:59:35.152468,2023-09-03 15:59:39.756032,0 days 00:00:04.603564,ReLU,Tanh,Tanh,ReLU,30,16,11.0,23.0,15.0,0.005692227685141675,4,100,0.758224145239106,0.0007894393147765244,COMPLETE
352,0.1604049652814865,2023-09-03 15:59:39.756400,2023-09-03 15:59:46.023884,0 days 00:00:06.267484,ReLU,Tanh,ReLU,ReLU,16,17,7.0,24.0,14.0,5.987231298167901e-05,4,80,0.780313146812667,3.1863605908514276e-05,COMPLETE
353,0.12603816390037537,2023-09-03 15:59:46.024228,2023-09-03 15:59:51.538580,0 days 00:00:05.514352,ReLU,Tanh,Sigmoid,Leaky,16,11,12.0,18.0,10.0,0.01610732190760593,4,80,0.6843468737522448,0.0004675856495884639,COMPLETE
354,0.10767565667629242,2023-09-03 15:59:51.538958,2023-09-03 16:00:21.453663,0 days 00:00:29.914705,ReLU,ReLU,Tanh,ReLU,4,12,21.0,23.0,8.0,0.003114539913184021,4,100,0.7282696207263702,2.4885480535622022e-05,COMPLETE
355,0.19903217256069183,2023-09-03 16:00:21.454004,2023-09-03 16:00:25.422712,0 days 00:00:03.968708,Tanh,Tanh,ReLU,Sigmoid,16,16,19.0,22.0,16.0,0.03757977135651398,4,80,0.48494813208654514,1.9742451069129187e-05,COMPLETE
356,0.1970532238483429,2023-09-03 16:00:25.423054,2023-09-03 16:01:02.331123,0 days 00:00:36.908069,ReLU,Leaky,Tanh,ReLU,2,13,20.0,24.0,12.0,0.023490244567343554,4,60,0.5731296549669929,8.334369535763694e-05,COMPLETE
357,0.1283193677663803,2023-09-03 16:01:02.331462,2023-09-03 16:01:07.984634,0 days 00:00:05.653172,ReLU,Tanh,Sigmoid,Leaky,30,14,14.0,21.0,9.0,0.007493416789561695,4,80,0.6301473473179526,1.4146292448584133e-05,COMPLETE
358,0.12477310746908188,2023-09-03 16:01:07.984985,2023-09-03 16:01:17.944817,0 days 00:00:09.959832,Sigmoid,Tanh,Leaky,Tanh,16,15,9.0,23.0,11.0,0.0023692020770033255,4,100,0.7992755158724391,0.0003109892785447587,COMPLETE
359,0.176205575466156,2023-09-03 16:01:17.945174,2023-09-03 16:01:21.815968,0 days 00:00:03.870794,ReLU,Tanh,Tanh,ReLU,16,12,22.0,24.0,7.0,0.05052609004671796,4,40,0.6984783907079375,4.9968441500571975e-05,COMPLETE
360,0.1086483746767044,2023-09-03 16:01:21.816567,2023-09-03 16:01:27.919830,0 days 00:00:06.103263,ReLU,Leaky,ReLU,Leaky,16,13,13.0,22.0,8.0,0.0038713699702497186,4,80,0.6731841517566812,3.745825461245539e-05,COMPLETE
361,0.1231066882610321,2023-09-03 16:01:27.920170,2023-09-03 16:01:30.424112,0 days 00:00:02.503942,ReLU,Tanh,,,30,15,10.0,,,0.0010285638176918052,2,80,0.7515605576448697,1.6130776395209817e-05,COMPLETE
362,0.11660521477460861,2023-09-03 16:01:30.424433,2023-09-03 16:01:37.408183,0 days 00:00:06.983750,ReLU,Tanh,Sigmoid,ReLU,16,14,5.0,20.0,16.0,0.005252236413593765,4,80,0.7352563293844123,2.114143941592058e-05,COMPLETE
363,0.11942478269338608,2023-09-03 16:01:37.408530,2023-09-03 16:01:41.764022,0 days 00:00:04.355492,ReLU,Tanh,Tanh,ReLU,12,16,11.0,24.0,17.0,0.006643146107828618,4,100,0.318978347519649,2.7796916289191494e-05,COMPLETE
364,0.11925950646400452,2023-09-03 16:01:41.764363,2023-09-03 16:01:47.106305,0 days 00:00:05.341942,ReLU,ReLU,ReLU,Leaky,16,17,12.0,22.0,9.0,0.012251163612839783,4,80,0.6482316312687774,6.206042328901175e-05,COMPLETE
365,0.16211842000484467,2023-09-03 16:01:47.106645,2023-09-03 16:01:54.098877,0 days 00:00:06.992232,ReLU,Tanh,Tanh,ReLU,8,16,10.0,23.0,11.0,0.030907952195138685,4,80,0.4541813324877675,0.005422776513282692,COMPLETE
366,0.1281328797340393,2023-09-03 16:01:54.099210,2023-09-03 16:01:55.427840,0 days 00:00:01.328630,ReLU,Leaky,Leaky,,30,12,12.0,23.0,,0.004582036826110857,3,100,0.26177335647498423,0.0006750527405604632,COMPLETE
367,0.12406077235937119,2023-09-03 16:01:55.428178,2023-09-03 16:01:59.052133,0 days 00:00:03.623955,ReLU,Tanh,Sigmoid,ReLU,16,13,13.0,24.0,10.0,0.008082709697346889,4,60,0.6027156113391773,9.635413362253005e-05,COMPLETE
368,0.11801272630691528,2023-09-03 16:01:59.052474,2023-09-03 16:02:04.903066,0 days 00:00:05.850592,ReLU,Tanh,ReLU,Tanh,16,18,18.0,23.0,13.0,0.003310460105393705,4,80,0.7135928335035899,1.1931890992147803e-05,COMPLETE
369,0.10094480216503143,2023-09-03 16:02:04.903409,2023-09-03 16:02:27.648348,0 days 00:00:22.744939,ReLU,Tanh,Tanh,Leaky,4,14,11.0,22.0,12.0,0.0018444495263358592,4,80,0.7753516371726473,4.3692203027951176e-05,COMPLETE
370,0.10375836491584778,2023-09-03 16:02:27.648745,2023-09-03 16:02:57.208375,0 days 00:00:29.559630,ReLU,Tanh,Tanh,Leaky,4,14,11.0,22.0,12.0,0.0018967468327841899,4,100,0.7996689615757041,4.359130162150445e-05,COMPLETE
371,0.11261345446109772,2023-09-03 16:02:57.208730,2023-09-03 16:03:16.182529,0 days 00:00:18.973799,Sigmoid,,,,4,14,,,,0.0017317039354942285,1,80,0.7994515287156576,4.422084421208613e-05,COMPLETE
372,0.11854881048202515,2023-09-03 16:03:16.182843,2023-09-03 16:03:38.678093,0 days 00:00:22.495250,ReLU,Tanh,Tanh,Leaky,4,14,11.0,22.0,12.0,0.0018075133224935839,4,80,0.7631544361340704,5.316892736135404e-05,COMPLETE
373,0.0927579402923584,2023-09-03 16:03:38.678440,2023-09-03 16:04:07.282071,0 days 00:00:28.603631,ReLU,Tanh,Tanh,Leaky,4,14,12.0,22.0,12.0,0.0021436984598197937,4,100,0.7738411245796517,4.4112523465783626e-05,COMPLETE
374,0.11119518429040909,2023-09-03 16:04:07.282422,2023-09-03 16:04:36.401817,0 days 00:00:29.119395,Leaky,Tanh,Tanh,Leaky,4,14,12.0,22.0,12.0,0.0019464873069845272,4,100,0.7949219354260446,4.4302821047141384e-05,COMPLETE
375,0.1052897498011589,2023-09-03 16:04:36.402166,2023-09-03 16:05:04.903235,0 days 00:00:28.501069,ReLU,Tanh,Tanh,Leaky,4,14,11.0,22.0,12.0,0.0021150085355875134,4,100,0.7729906261516464,3.6595845501227636e-05,COMPLETE
376,0.12073662132024765,2023-09-03 16:05:04.903586,2023-09-03 16:05:23.717062,0 days 00:00:18.813476,ReLU,Tanh,Tanh,Leaky,4,13,12.0,21.0,3.0,0.002467369624209109,4,100,0.5118214921514499,6.48606426258951e-05,COMPLETE
377,0.11465378105640411,2023-09-03 16:05:23.717395,2023-09-03 16:05:52.292024,0 days 00:00:28.574629,ReLU,Tanh,Tanh,Leaky,4,20,12.0,23.0,11.0,0.001699404685902099,4,100,0.7807275057970272,3.965338536073415e-05,COMPLETE
378,0.09754743427038193,2023-09-03 16:05:52.292360,2023-09-03 16:06:19.556021,0 days 00:00:27.263661,ReLU,Tanh,Tanh,Leaky,4,14,11.0,22.0,12.0,0.0022368461873276675,4,100,0.7456093946852326,3.532890757673286e-05,COMPLETE
379,0.11970871686935425,2023-09-03 16:06:19.556354,2023-09-03 16:06:48.033658,0 days 00:00:28.477304,ReLU,ReLU,Tanh,Leaky,4,14,11.0,21.0,12.0,0.0021611444642157733,4,100,0.7615824817248082,3.1654155139517835e-05,COMPLETE
380,0.10979806631803513,2023-09-03 16:06:48.034063,2023-09-03 16:07:25.097421,0 days 00:00:37.063358,ReLU,Leaky,Tanh,Leaky,4,14,13.0,22.0,11.0,0.001374655520847041,4,100,0.7995162024903717,3.310096829919557e-05,COMPLETE
381,0.11224678158760071,2023-09-03 16:07:25.097771,2023-09-03 16:07:47.728760,0 days 00:00:22.630989,ReLU,Tanh,Tanh,Leaky,4,14,6.0,22.0,12.0,0.0019501099445342273,4,100,0.5463223306955479,0.00020940202707508525,COMPLETE
382,0.11474364250898361,2023-09-03 16:07:47.729100,2023-09-03 16:08:14.822128,0 days 00:00:27.093028,Tanh,Tanh,Tanh,Leaky,4,13,12.0,22.0,12.0,0.0014034152554064116,4,100,0.746771001361907,4.9828092093795824e-05,COMPLETE
383,0.13122928142547607,2023-09-03 16:08:14.822463,2023-09-03 16:08:25.212827,0 days 00:00:10.390364,ReLU,Tanh,Tanh,Leaky,4,13,14.0,21.0,12.0,0.0026225003486748657,4,100,0.2813724083555294,0.0010498663615275989,COMPLETE
384,0.10778941214084625,2023-09-03 16:08:25.213158,2023-09-03 16:08:45.915855,0 days 00:00:20.702697,ReLU,Tanh,Tanh,Leaky,4,14,12.0,22.0,13.0,0.0016283078610104704,4,100,0.5650260380199716,0.001196140845269834,COMPLETE
385,0.14718720316886902,2023-09-03 16:08:45.916213,2023-09-03 16:08:50.469495,0 days 00:00:04.553282,ReLU,Leaky,Tanh,Leaky,4,13,16.0,23.0,13.0,0.0022770973289850042,4,100,0.12159142821442637,8.014022379500668e-05,COMPLETE
386,0.12149755656719208,2023-09-03 16:08:50.469841,2023-09-03 16:09:08.221540,0 days 00:00:17.751699,Sigmoid,Tanh,ReLU,Leaky,4,14,13.0,21.0,11.0,0.0019010048026624185,4,100,0.4735842763230376,3.0919050553346584e-05,COMPLETE
387,0.11610455811023712,2023-09-03 16:09:08.221884,2023-09-03 16:09:26.757427,0 days 00:00:18.535543,ReLU,Tanh,,,4,13,11.0,,,0.0026212300241395324,2,100,0.7396823022846749,0.0003584265818870848,COMPLETE
388,0.0997668132185936,2023-09-03 16:09:26.757751,2023-09-03 16:09:55.180488,0 days 00:00:28.422737,ReLU,ReLU,Tanh,Leaky,4,15,12.0,23.0,11.0,0.0014830372246915705,4,100,0.7706731556608541,0.00011121290818679006,COMPLETE
389,0.11565008014440536,2023-09-03 16:09:55.180825,2023-09-03 16:10:23.412647,0 days 00:00:28.231822,ReLU,ReLU,Tanh,Leaky,4,15,12.0,23.0,11.0,0.0014031988883215227,4,100,0.7596648684520065,0.0013894706568860788,COMPLETE
390,0.11023550480604172,2023-09-03 16:10:23.412987,2023-09-03 16:10:52.815780,0 days 00:00:29.402793,ReLU,ReLU,Tanh,Leaky,4,15,12.0,23.0,12.0,0.0012145594721960776,4,100,0.7819975501591223,0.00016085107187122286,COMPLETE
391,0.12493403255939484,2023-09-03 16:10:52.816121,2023-09-03 16:10:58.753378,0 days 00:00:05.937257,ReLU,ReLU,ReLU,Leaky,4,15,13.0,22.0,11.0,0.0016278394179564772,4,100,0.1578117084404151,3.551936483387566e-05,COMPLETE
392,0.12494613230228424,2023-09-03 16:10:58.753732,2023-09-03 16:11:28.090022,0 days 00:00:29.336290,ReLU,ReLU,Tanh,Leaky,4,14,11.0,22.0,12.0,0.001953815259401098,4,100,0.7967126540845262,0.00019366080071425007,COMPLETE
393,1.0599273443222046,2023-09-03 16:11:28.090358,2023-09-03 16:11:43.929933,0 days 00:00:15.839575,ReLU,ReLU,ReLU,Leaky,4,15,12.0,23.0,11.0,0.002675446168762852,4,100,0.39670100762662824,0.07339315421716669,COMPLETE
394,0.11071247607469559,2023-09-03 16:11:43.930278,2023-09-03 16:12:04.174984,0 days 00:00:20.244706,ReLU,ReLU,Tanh,Leaky,4,13,11.0,23.0,13.0,0.0012466721958780092,4,100,0.38078773328157056,0.00025920300344720384,COMPLETE
395,0.09930987656116486,2023-09-03 16:12:04.175319,2023-09-03 16:12:30.447766,0 days 00:00:26.272447,ReLU,ReLU,Tanh,Leaky,4,15,17.0,23.0,12.0,0.0010007707907594742,4,100,0.716755849748299,0.00012172806302461931,COMPLETE
396,0.12742163240909576,2023-09-03 16:12:30.448102,2023-09-03 16:12:43.538177,0 days 00:00:13.090075,ReLU,ReLU,ReLU,Leaky,4,15,17.0,23.0,12.0,0.0011520879730774589,4,100,0.3511322161126363,0.00013173053167957527,COMPLETE
