number,value,datetime_start,datetime_complete,duration,params_activation1,params_activation2,params_activation3,params_activation4,params_batch_size,params_fl1,params_fl2,params_fl3,params_fl4,params_learning_rate,params_n_layers,params_num_epochs,params_train_size,params_weight_decay,state
0,0.5590088963508606,2023-09-03 22:29:23.395149,2023-09-03 22:29:25.973039,0 days 00:00:02.577890,Tanh,,,,12,4,,,,0.003085775755942217,1,60,0.5875432930896912,0.0003858310049580242,COMPLETE
1,0.5780916213989258,2023-09-03 22:29:25.973334,2023-09-03 22:29:28.702623,0 days 00:00:02.729289,Leaky,ReLU,,,12,13,11.0,,,0.00036453715880400576,2,80,0.35325424743586786,0.029351672236741056,COMPLETE
2,0.5215446949005127,2023-09-03 22:29:28.702905,2023-09-03 22:29:30.298668,0 days 00:00:01.595763,Tanh,ReLU,,,8,5,8.0,,,0.009669289633774758,2,100,0.11095358199305072,1.1258760367324057e-05,COMPLETE
3,0.4800862967967987,2023-09-03 22:29:30.299130,2023-09-03 22:29:35.008272,0 days 00:00:04.709142,Leaky,Leaky,ReLU,Leaky,10,3,13.0,1.0,19.0,0.005339781744586626,4,80,0.34852557293938125,0.0025861424745274365,COMPLETE
4,0.45051735639572144,2023-09-03 22:29:35.008587,2023-09-03 22:29:40.814071,0 days 00:00:05.805484,ReLU,Leaky,,,12,16,19.0,,,0.0031500244338529475,2,100,0.6078568379505005,0.005469973373749808,COMPLETE
5,0.7169619202613831,2023-09-03 22:29:40.814354,2023-09-03 22:29:41.521908,0 days 00:00:00.707554,Sigmoid,,,,12,8,,,,0.07496470292667515,1,60,0.1544845097911599,0.0017518714555962215,COMPLETE
6,0.9673041701316833,2023-09-03 22:29:41.522189,2023-09-03 22:29:47.872247,0 days 00:00:06.350058,Tanh,ReLU,Sigmoid,Leaky,10,3,2.0,5.0,21.0,0.04934967797885457,4,60,0.423949032926401,0.07402246351278123,COMPLETE
7,0.573637068271637,2023-09-03 22:29:47.872739,2023-09-03 22:30:01.849162,0 days 00:00:13.976423,Leaky,,,,2,16,,,,2.580883698083666e-05,1,100,0.32341571895849963,0.0007151762981504142,COMPLETE
8,0.6719955801963806,2023-09-03 22:30:01.849438,2023-09-03 22:30:02.738553,0 days 00:00:00.889115,Sigmoid,ReLU,,,8,22,5.0,,,0.01754615388446855,2,60,0.10395872096044144,0.00031931984664062684,COMPLETE
9,0.5883257389068604,2023-09-03 22:30:02.738814,2023-09-03 22:30:06.452294,0 days 00:00:03.713480,Tanh,Sigmoid,Tanh,Leaky,12,12,5.0,12.0,22.0,0.033366539723525664,4,80,0.3414225149771751,3.746225297412083e-05,COMPLETE
10,0.5299080610275269,2023-09-03 22:30:06.452574,2023-09-03 22:30:07.993449,0 days 00:00:01.540875,ReLU,Leaky,Leaky,,30,19,24.0,23.0,,0.0005628036340220972,3,40,0.7334486508243332,0.00865788575583165,COMPLETE
11,0.5609042048454285,2023-09-03 22:30:07.993730,2023-09-03 22:30:25.795310,0 days 00:00:17.801580,ReLU,Leaky,ReLU,,4,10,19.0,1.0,,0.003421533712053145,3,100,0.5005090746374485,0.005088891544590734,COMPLETE
12,0.4888180196285248,2023-09-03 22:30:25.795587,2023-09-03 22:30:27.766527,0 days 00:00:01.970940,ReLU,Leaky,ReLU,,16,16,17.0,10.0,,0.002538396618521852,3,80,0.23008420945502817,0.006601045048722023,COMPLETE
13,0.460263729095459,2023-09-03 22:30:27.766803,2023-09-03 22:30:33.026469,0 days 00:00:05.259666,Leaky,Tanh,ReLU,Sigmoid,10,24,16.0,18.0,4.0,0.008312428795107085,4,40,0.7165613268743796,0.002224378351794581,COMPLETE
14,0.5579864978790283,2023-09-03 22:30:33.026749,2023-09-03 22:30:37.429909,0 days 00:00:04.403160,ReLU,Tanh,Leaky,,10,24,19.0,21.0,,0.013585935792178911,3,40,0.7951593299688156,0.021456013110470233,COMPLETE
15,0.40362441539764404,2023-09-03 22:30:37.430189,2023-09-03 22:30:38.435247,0 days 00:00:01.005058,Leaky,Tanh,,,30,20,24.0,,,0.0012069476486715007,2,40,0.5743811175416159,0.0015658912470239612,COMPLETE
16,0.5346052646636963,2023-09-03 22:30:38.435502,2023-09-03 22:30:39.384452,0 days 00:00:00.948950,Leaky,Tanh,,,30,19,24.0,,,0.0007230023183325571,2,40,0.5437716946482122,0.0008335080521381448,COMPLETE
17,0.5446195602416992,2023-09-03 22:30:39.384711,2023-09-03 22:30:41.388380,0 days 00:00:02.003669,ReLU,Sigmoid,,,30,18,21.0,,,0.00016312448182359513,2,100,0.45900328198356777,0.00014112945586007572,COMPLETE
18,0.6647047400474548,2023-09-03 22:30:41.388647,2023-09-03 22:30:42.779168,0 days 00:00:01.390521,Sigmoid,,,,16,21,,,,0.0013726429473368573,1,40,0.6063435915396492,0.013528214085626924,COMPLETE
19,0.4350392520427704,2023-09-03 22:30:42.779419,2023-09-03 22:30:54.594576,0 days 00:00:11.815157,Leaky,Tanh,,,4,15,22.0,,,0.0014898794305060852,2,100,0.42343607403839717,0.004557287283548798,COMPLETE
20,0.49951860308647156,2023-09-03 22:30:54.594838,2023-09-03 22:30:58.030429,0 days 00:00:03.435591,Leaky,Tanh,Tanh,,4,13,22.0,17.0,,0.00019930673169256738,3,40,0.2651569219612726,0.0016545752373261324,COMPLETE
21,0.4255141615867615,2023-09-03 22:30:58.030704,2023-09-03 22:31:09.736175,0 days 00:00:11.705471,Leaky,Tanh,,,4,16,21.0,,,0.001483003807814062,2,100,0.44860191717870995,0.003923309903570549,COMPLETE
22,0.45642969012260437,2023-09-03 22:31:09.736442,2023-09-03 22:31:31.653013,0 days 00:00:21.916571,Leaky,Tanh,,,4,15,22.0,,,0.001291758707446438,2,100,0.41469349111444176,0.005230500632092658,COMPLETE
23,0.6088724732398987,2023-09-03 22:31:31.653500,2023-09-03 22:31:50.907396,0 days 00:00:19.253896,Leaky,Tanh,,,4,20,15.0,,,0.0014658704870960887,2,100,0.47061536064821147,0.0028705147140634124,COMPLETE
24,0.5317283868789673,2023-09-03 22:31:50.907666,2023-09-03 22:32:03.089437,0 days 00:00:12.181771,Leaky,,,,4,10,,,,0.0008197804925558874,1,100,0.40587371301284236,0.0009398544059548274,COMPLETE
25,0.5753812789916992,2023-09-03 22:32:03.089847,2023-09-03 22:32:33.259746,0 days 00:00:30.169899,Leaky,Tanh,,,2,18,24.0,,,0.0003806891013425881,2,100,0.5459833566802398,0.012631169754970922,COMPLETE
26,0.4280838966369629,2023-09-03 22:32:33.260017,2023-09-03 22:32:36.732849,0 days 00:00:03.472832,Leaky,Tanh,Sigmoid,,30,14,21.0,8.0,,0.0014811235175083374,3,100,0.6786328342452729,0.0034240239084609267,COMPLETE
27,0.5475300550460815,2023-09-03 22:32:36.733128,2023-09-03 22:32:38.148810,0 days 00:00:01.415682,Leaky,Tanh,Sigmoid,,30,22,20.0,8.0,,0.00566006391073417,3,40,0.6766638319677998,0.0013000694641500323,COMPLETE
28,0.5097987651824951,2023-09-03 22:32:38.149082,2023-09-03 22:32:41.367384,0 days 00:00:03.218302,Leaky,Tanh,Sigmoid,,30,10,18.0,15.0,,0.019718348670626665,3,100,0.6268169958093643,0.003339229877141831,COMPLETE
29,0.5667269825935364,2023-09-03 22:32:41.367662,2023-09-03 22:32:42.930627,0 days 00:00:01.562965,Leaky,,,,30,6,,,,0.0022773271040878915,1,60,0.7851445028358155,0.00043465531368822757,COMPLETE
30,0.5854086875915527,2023-09-03 22:32:42.930884,2023-09-03 22:32:44.000334,0 days 00:00:01.069450,Sigmoid,Sigmoid,Sigmoid,,30,14,12.0,6.0,,0.005725951086277558,3,40,0.5234178931525088,0.001708394382160997,COMPLETE
31,0.369064062833786,2023-09-03 22:32:44.000613,2023-09-03 22:33:04.380537,0 days 00:00:20.379924,Leaky,Tanh,,,4,17,22.0,,,0.0016910050504626661,2,100,0.5806828604914339,0.003199508397722056,COMPLETE
32,0.4763981103897095,2023-09-03 22:33:04.380811,2023-09-03 22:33:21.996641,0 days 00:00:17.615830,Leaky,Tanh,,,4,17,22.0,,,0.0008346534435783317,2,100,0.6455522066344583,0.003229971404130274,COMPLETE
33,0.4310881197452545,2023-09-03 22:33:21.996911,2023-09-03 22:33:29.642559,0 days 00:00:07.645648,Leaky,Tanh,,,8,12,21.0,,,0.0020910416125255113,2,100,0.5696828348580649,0.010147880255104345,COMPLETE
34,0.5794020891189575,2023-09-03 22:33:29.642837,2023-09-03 22:33:32.546176,0 days 00:00:02.903339,Tanh,Tanh,,,30,18,23.0,,,0.003972888300733991,2,100,0.6802095522792441,0.024621176730147208,COMPLETE
35,0.5960182547569275,2023-09-03 22:33:32.546435,2023-09-03 22:33:44.439705,0 days 00:00:11.893270,Leaky,Tanh,,,4,1,17.0,,,0.00044196441578066807,2,80,0.5818340369674753,0.0028638623980906846,COMPLETE
36,0.4549817144870758,2023-09-03 22:33:44.439984,2023-09-03 22:33:49.530049,0 days 00:00:05.090065,Leaky,Tanh,Sigmoid,,16,14,15.0,13.0,,0.00101514635858714,3,100,0.5064284132941069,0.0074795932715051834,COMPLETE
37,0.5321096777915955,2023-09-03 22:33:49.530335,2023-09-03 22:34:16.518427,0 days 00:00:26.988092,Leaky,,,,2,21,,,,0.002358613064860587,1,100,0.6430037180116117,0.0013550379767000595,COMPLETE
38,0.4847373962402344,2023-09-03 22:34:16.518691,2023-09-03 22:34:17.733996,0 days 00:00:01.215305,Tanh,Tanh,,,30,17,21.0,,,0.00428580745642978,2,60,0.4637395303991139,0.046619061348620004,COMPLETE
39,0.5118062496185303,2023-09-03 22:34:17.734255,2023-09-03 22:34:22.852492,0 days 00:00:05.118237,Leaky,ReLU,,,8,11,10.0,,,0.0005717538392454165,2,100,0.37550909411295486,0.004027721822211875,COMPLETE
40,0.49907559156417847,2023-09-03 22:34:22.852757,2023-09-03 22:34:26.141572,0 days 00:00:03.288815,Sigmoid,,,,12,14,,,,0.007711820368053413,1,80,0.5669486132919539,0.002044775970293236,COMPLETE
41,0.46204647421836853,2023-09-03 22:34:26.141837,2023-09-03 22:34:35.050242,0 days 00:00:08.908405,Leaky,Tanh,,,8,8,20.0,,,0.0020378068165939267,2,100,0.5843183140309643,0.011735511431150291,COMPLETE
42,0.5349376201629639,2023-09-03 22:34:35.050513,2023-09-03 22:34:44.663412,0 days 00:00:09.612899,Leaky,Tanh,,,8,12,23.0,,,0.0016715198001407425,2,100,0.7121825254136199,0.008106643595877643,COMPLETE
43,0.409725546836853,2023-09-03 22:34:44.663691,2023-09-03 22:34:51.533280,0 days 00:00:06.869589,Leaky,Tanh,,,8,15,21.0,,,0.002852218498784058,2,100,0.5015218564309604,0.0045201218112584365,COMPLETE
44,0.38197746872901917,2023-09-03 22:34:51.533554,2023-09-03 22:34:59.506158,0 days 00:00:07.972604,Leaky,Tanh,Tanh,,8,15,20.0,4.0,,0.0032351715685285166,3,100,0.483397287772851,0.004278355073076134,COMPLETE
45,0.5169041752815247,2023-09-03 22:34:59.506431,2023-09-03 22:35:06.362284,0 days 00:00:06.855853,Tanh,ReLU,,,8,17,18.0,,,0.0031663088903115914,2,100,0.49016634792709046,0.005550641279894333,COMPLETE
46,0.5534819960594177,2023-09-03 22:35:06.362549,2023-09-03 22:35:10.314888,0 days 00:00:03.952339,Leaky,Sigmoid,,,8,16,23.0,,,0.0039810735993101596,2,60,0.37331398205237265,0.0011552566845622865,COMPLETE
47,0.6080310940742493,2023-09-03 22:35:10.315150,2023-09-03 22:35:13.855814,0 days 00:00:03.540664,Leaky,Tanh,Tanh,Tanh,8,19,20.0,3.0,3.0,0.009581147413914677,4,40,0.4517842874014902,0.0021510024746527186,COMPLETE
48,0.4593324661254883,2023-09-03 22:35:13.856089,2023-09-03 22:35:19.422507,0 days 00:00:05.566418,Leaky,Tanh,Tanh,,10,15,24.0,5.0,,0.002792857208540875,3,80,0.5175950528881403,0.01640784496534011,COMPLETE
49,0.6499585509300232,2023-09-03 22:35:19.422778,2023-09-03 22:35:22.486561,0 days 00:00:03.063783,Sigmoid,Leaky,,,12,20,19.0,,,0.0010536269914732243,2,100,0.32652031778819274,0.00791515518516633,COMPLETE
50,0.3576902747154236,2023-09-03 22:35:22.486819,2023-09-03 22:36:08.506985,0 days 00:00:46.020166,ReLU,ReLU,Tanh,,4,23,7.0,10.0,,0.005268641874700959,3,100,0.5243158093671244,0.004479077307812261,COMPLETE
51,0.48408591747283936,2023-09-03 22:36:08.507448,2023-09-03 22:37:02.146520,0 days 00:00:53.639072,ReLU,ReLU,Tanh,,4,22,1.0,10.0,,0.005780355324601108,3,100,0.5283631769663768,0.004529014751097524,COMPLETE
52,0.4342106580734253,2023-09-03 22:37:02.146994,2023-09-03 22:37:48.246767,0 days 00:00:46.099773,ReLU,ReLU,Tanh,,4,24,3.0,8.0,,0.0027458380077841063,3,100,0.44544150987890985,0.006183864693842606,COMPLETE
53,0.483621746301651,2023-09-03 22:37:48.247239,2023-09-03 22:38:14.158974,0 days 00:00:25.911735,ReLU,ReLU,Tanh,ReLU,4,23,8.0,3.0,12.0,0.00429672336545931,4,100,0.4908071479187038,0.0023406066522782625,COMPLETE
54,0.49155393242836,2023-09-03 22:38:14.159265,2023-09-03 22:38:21.978514,0 days 00:00:07.819249,ReLU,ReLU,Tanh,,4,20,5.0,12.0,,0.012288105161808786,3,40,0.604974573198154,0.00385235873422024,COMPLETE
55,0.4796968102455139,2023-09-03 22:38:21.978802,2023-09-03 22:38:27.272604,0 days 00:00:05.293802,ReLU,Leaky,,,8,16,10.0,,,0.0073005669833637625,2,100,0.3924910925750067,0.001685189688127996,COMPLETE
56,0.51083904504776,2023-09-03 22:38:27.272870,2023-09-03 22:38:30.594788,0 days 00:00:03.321918,Leaky,Tanh,,,16,19,7.0,,,0.0010459143490563663,2,100,0.43116452431620955,0.005979376927432637,COMPLETE
57,0.47372475266456604,2023-09-03 22:38:30.595064,2023-09-03 22:39:08.381672,0 days 00:00:37.786608,Leaky,Sigmoid,Leaky,,2,21,13.0,15.0,,0.001808769848724168,3,100,0.5467126087259737,0.017406229806710267,COMPLETE
58,0.5583978891372681,2023-09-03 22:39:08.381947,2023-09-03 22:39:13.536331,0 days 00:00:05.154384,Tanh,ReLU,,,4,23,23.0,,,0.0030837244026680898,2,40,0.4849158896363885,0.0007867400146162267,COMPLETE
59,0.4327465891838074,2023-09-03 22:39:13.536625,2023-09-03 22:39:24.264884,0 days 00:00:10.728259,ReLU,Tanh,Tanh,,10,17,20.0,3.0,,0.0007142747276208369,3,60,0.43645992087705493,0.002498387938994746,COMPLETE
60,0.4221494197845459,2023-09-03 22:39:24.265336,2023-09-03 22:39:44.156984,0 days 00:00:19.891648,Leaky,Tanh,,,4,15,22.0,,,0.0019089355319131514,2,100,0.6117681830778515,0.004761986803965193,COMPLETE
61,0.6014963984489441,2023-09-03 22:39:44.157342,2023-09-03 22:40:02.510800,0 days 00:00:18.353458,Leaky,Tanh,,,4,15,22.0,,,0.0012694411499479346,2,100,0.5614163188411616,0.004405200026337548,COMPLETE
62,0.42042097449302673,2023-09-03 22:40:02.511068,2023-09-03 22:40:23.831757,0 days 00:00:21.320689,Leaky,Tanh,,,4,13,24.0,,,0.0018815822895493083,2,100,0.6201787245294789,0.0027816931921383512,COMPLETE
63,0.43480396270751953,2023-09-03 22:40:23.832032,2023-09-03 22:40:39.531255,0 days 00:00:15.699223,Leaky,Tanh,,,4,11,23.0,,,0.0020471691044725944,2,100,0.6085935635126964,0.0025548124353642833,COMPLETE
64,0.4699496328830719,2023-09-03 22:40:39.531528,2023-09-03 22:40:58.665862,0 days 00:00:19.134334,Leaky,Tanh,,,4,13,24.0,,,0.0035874750027425507,2,100,0.7427934704299641,0.009835732864947001,COMPLETE
65,0.38070279359817505,2023-09-03 22:40:58.666145,2023-09-03 22:41:07.380990,0 days 00:00:08.714845,Leaky,Tanh,,,8,15,24.0,,,0.005022262819544177,2,100,0.6466714952551513,0.006011867638333552,COMPLETE
66,0.3592533767223358,2023-09-03 22:41:07.381261,2023-09-03 22:41:11.803585,0 days 00:00:04.422324,Leaky,Leaky,Tanh,,8,13,24.0,10.0,,0.00582315081821351,3,40,0.6607742715858432,0.0012643994403317438,COMPLETE
67,0.4621080160140991,2023-09-03 22:41:11.803872,2023-09-03 22:41:16.294558,0 days 00:00:04.490686,Leaky,Leaky,Tanh,,8,18,23.0,10.0,,0.013215505329082961,3,40,0.67407909535227,0.001082064897407474,COMPLETE
68,0.48706552386283875,2023-09-03 22:41:16.294843,2023-09-03 22:41:23.839851,0 days 00:00:07.545008,Sigmoid,Leaky,Tanh,,8,14,24.0,6.0,,0.005598280185017694,3,40,0.7547048406286079,0.0017754430807467231,COMPLETE
69,0.5365947484970093,2023-09-03 22:41:23.840142,2023-09-03 22:41:28.851099,0 days 00:00:05.010957,Leaky,Leaky,Tanh,,8,16,21.0,14.0,,0.019890351305244497,3,40,0.5241115338736838,0.0006476127585487755,COMPLETE
70,0.37297236919403076,2023-09-03 22:41:28.851384,2023-09-03 22:41:36.538475,0 days 00:00:07.687091,Leaky,Leaky,Tanh,Tanh,8,13,22.0,11.0,12.0,0.006587242504889861,4,40,0.7090690604163528,0.006809004425508928,COMPLETE
71,0.4046929180622101,2023-09-03 22:41:36.538767,2023-09-03 22:41:42.947459,0 days 00:00:06.408692,Leaky,Leaky,Tanh,Tanh,8,13,22.0,11.0,12.0,0.007110294123696599,4,40,0.799404950565299,0.0071818608301879635,COMPLETE
72,0.41204679012298584,2023-09-03 22:41:42.947762,2023-09-03 22:41:50.393210,0 days 00:00:07.445448,Leaky,Leaky,Tanh,Tanh,8,12,22.0,11.0,11.0,0.007003095164267705,4,40,0.7255460142194475,0.006174371848760579,COMPLETE
73,0.5070527195930481,2023-09-03 22:41:50.393511,2023-09-03 22:41:56.628082,0 days 00:00:06.234571,Leaky,Leaky,Tanh,Tanh,8,11,23.0,9.0,9.0,0.00470237659103528,4,40,0.7971340669660962,0.007216853439666869,COMPLETE
74,0.36121731996536255,2023-09-03 22:41:56.628387,2023-09-03 22:42:04.348934,0 days 00:00:07.720547,Leaky,Leaky,Tanh,Tanh,8,9,24.0,13.0,17.0,0.00895626849768169,4,40,0.6711070047559367,0.01286687858058718,COMPLETE
75,0.5061061382293701,2023-09-03 22:42:04.349222,2023-09-03 22:42:09.544483,0 days 00:00:05.195261,Leaky,Leaky,Tanh,Tanh,8,8,24.0,17.0,17.0,0.010903303467738035,4,40,0.6586275623496105,0.012633725240764778,COMPLETE
76,0.529125988483429,2023-09-03 22:42:09.544780,2023-09-03 22:42:15.052230,0 days 00:00:05.507450,ReLU,Leaky,Tanh,Sigmoid,8,13,24.0,13.0,7.0,0.009164088963651083,4,40,0.6871058699253093,0.009788744628377394,COMPLETE
77,0.6120721697807312,2023-09-03 22:42:15.052525,2023-09-03 22:42:18.847854,0 days 00:00:03.795329,Leaky,Leaky,Tanh,ReLU,12,7,23.0,7.0,16.0,0.016049761472150523,4,40,0.7020491488754794,0.003726207394548646,COMPLETE
78,0.5693255662918091,2023-09-03 22:42:18.848145,2023-09-03 22:42:23.900309,0 days 00:00:05.052164,Leaky,Leaky,Tanh,Tanh,8,10,19.0,15.0,15.0,0.005735463305883807,4,40,0.6457114074378495,0.0015383544018717514,COMPLETE
79,0.40312379598617554,2023-09-03 22:42:23.900600,2023-09-03 22:42:25.948344,0 days 00:00:02.047744,Leaky,Leaky,Leaky,,16,9,24.0,12.0,,0.003533487143870252,3,40,0.5860400411525515,0.0032980563186678935,COMPLETE
80,0.5240750908851624,2023-09-03 22:42:25.948635,2023-09-03 22:42:27.976795,0 days 00:00:02.028160,Leaky,Leaky,Leaky,,16,9,14.0,12.0,,0.0035751251308096424,3,40,0.5873211544064488,0.003148263733160317,COMPLETE
81,0.42506229877471924,2023-09-03 22:42:27.977093,2023-09-03 22:42:29.897118,0 days 00:00:01.920025,Leaky,Leaky,Leaky,,16,9,24.0,11.0,,0.0050080618273827876,3,40,0.5513001054522666,0.005382392036257981,COMPLETE
82,0.4504145681858063,2023-09-03 22:42:29.897408,2023-09-03 22:42:32.127987,0 days 00:00:02.230579,Leaky,Leaky,Leaky,,16,4,23.0,14.0,,0.010044126130427856,3,40,0.6448332751019641,0.0032811938608422616,COMPLETE
83,0.5520592331886292,2023-09-03 22:42:32.128276,2023-09-03 22:42:34.500726,0 days 00:00:02.372450,Tanh,Sigmoid,ReLU,,30,6,22.0,1.0,,0.002607491215444483,3,80,0.5789673045805406,0.0020383497899726043,COMPLETE
84,0.5662283897399902,2023-09-03 22:42:34.501007,2023-09-03 22:43:01.620611,0 days 00:00:27.119604,Leaky,Leaky,Leaky,Tanh,2,9,23.0,9.0,15.0,0.004303196327919322,4,40,0.7088361363520896,0.001256740014688728,COMPLETE
85,0.44355857372283936,2023-09-03 22:43:01.620902,2023-09-03 22:43:08.161894,0 days 00:00:06.540992,Leaky,Leaky,ReLU,,8,23,24.0,19.0,,0.008208657139593642,3,40,0.7505386372143319,0.009106042992886228,COMPLETE
86,0.4344657361507416,2023-09-03 22:43:08.162179,2023-09-03 22:43:11.085062,0 days 00:00:02.922883,Leaky,ReLU,Tanh,Tanh,16,12,21.0,10.0,7.0,0.003200271095526997,4,40,0.6297570216585838,0.003938035227506757,COMPLETE
87,0.3985661268234253,2023-09-03 22:43:11.085360,2023-09-03 22:43:18.404217,0 days 00:00:07.318857,Sigmoid,Leaky,Leaky,,8,14,20.0,13.0,,0.00656265087561151,3,60,0.6662456180702331,0.00253013757888291,COMPLETE
88,0.42052096128463745,2023-09-03 22:43:18.404503,2023-09-03 22:43:24.958077,0 days 00:00:06.553574,Sigmoid,Leaky,Leaky,,8,11,17.0,14.0,,0.006905947615894168,3,60,0.6619211485135946,0.005171499397839044,COMPLETE
89,0.49117690324783325,2023-09-03 22:43:24.958363,2023-09-03 22:43:30.959027,0 days 00:00:06.000664,Sigmoid,Leaky,Leaky,,8,14,18.0,24.0,,0.005367190396596297,3,60,0.6017570484814231,0.0029533722330543533,COMPLETE
90,0.5037079453468323,2023-09-03 22:43:30.959319,2023-09-03 22:43:37.948211,0 days 00:00:06.988892,Sigmoid,Leaky,Leaky,,8,14,20.0,12.0,,0.003757587780947985,3,60,0.7015667013366684,0.0020615248403598784,COMPLETE
91,0.5410652160644531,2023-09-03 22:43:37.948504,2023-09-03 22:43:43.441380,0 days 00:00:05.492876,Sigmoid,Leaky,Leaky,,8,15,22.0,16.0,,0.002563025614905017,3,60,0.5478281756280341,0.0014535055356147029,COMPLETE
92,0.4893101155757904,2023-09-03 22:43:43.441671,2023-09-03 22:43:46.751017,0 days 00:00:03.309346,Sigmoid,ReLU,Tanh,,10,17,4.0,11.0,,0.00481580704570224,3,40,0.5797893907502871,0.006952656863458629,COMPLETE
93,0.4724431037902832,2023-09-03 22:43:46.751315,2023-09-03 22:43:49.444348,0 days 00:00:02.693033,ReLU,Tanh,ReLU,,30,21,21.0,13.0,,0.006348296168470659,3,80,0.6206928965411251,0.0025083089571537103,COMPLETE
94,0.433186411857605,2023-09-03 22:43:49.444644,2023-09-03 22:43:57.244079,0 days 00:00:07.799435,Leaky,Sigmoid,Tanh,Sigmoid,8,16,7.0,9.0,24.0,0.008657983598561203,4,60,0.6674630932879455,0.0035445745022893464,COMPLETE
95,0.5251511335372925,2023-09-03 22:43:57.244372,2023-09-03 22:44:00.790158,0 days 00:00:03.545786,Leaky,Leaky,Sigmoid,,8,22,23.0,13.0,,0.004557641027326091,3,40,0.5329289698314125,0.0019368062287129421,COMPLETE
96,0.5946764349937439,2023-09-03 22:44:00.790446,2023-09-03 22:44:02.938066,0 days 00:00:02.147620,Leaky,,,,12,20,,,,0.010899794577024797,1,40,0.7474134575922704,0.0009283036804161341,COMPLETE
97,0.47489944100379944,2023-09-03 22:44:02.938354,2023-09-03 22:44:04.613902,0 days 00:00:01.675548,Tanh,Tanh,Leaky,,16,14,24.0,7.0,,0.0023744420237339307,3,40,0.4735661891215582,0.005459510420780699,COMPLETE
98,0.6246298551559448,2023-09-03 22:44:04.614192,2023-09-03 22:44:06.782750,0 days 00:00:02.168558,Leaky,Leaky,,,30,11,20.0,,,0.006658255293970794,2,100,0.5152781156825348,0.004346835894961886,COMPLETE
99,0.4063991606235504,2023-09-03 22:44:06.783031,2023-09-03 22:44:13.033059,0 days 00:00:06.250028,ReLU,Tanh,Tanh,,8,12,23.0,11.0,,0.00358435340178641,3,60,0.6318301501652329,0.008909028973227845,COMPLETE
100,0.5747179985046387,2023-09-03 22:44:13.033352,2023-09-03 22:44:58.897431,0 days 00:00:45.864079,Leaky,ReLU,Tanh,ReLU,2,18,21.0,16.0,19.0,0.008172091834819135,4,100,0.5680383110765002,0.002538316901969929,COMPLETE
101,0.4987705945968628,2023-09-03 22:44:58.897723,2023-09-03 22:45:04.958840,0 days 00:00:06.061117,Leaky,Leaky,Tanh,Tanh,8,13,22.0,10.0,13.0,0.006528322883010373,4,40,0.775028627246367,0.00638264626029907,COMPLETE
102,0.3680671155452728,2023-09-03 22:45:04.959136,2023-09-03 22:45:18.175041,0 days 00:00:13.215905,Leaky,Leaky,Tanh,Tanh,8,13,11.0,11.0,10.0,0.003010687584739579,4,40,0.7204581357083899,0.01123949458411598,COMPLETE
