number,value,datetime_start,datetime_complete,duration,params_activation1,params_activation2,params_activation3,params_activation4,params_batch_size,params_fl1,params_fl2,params_fl3,params_fl4,params_learning_rate,params_n_layers,params_num_epochs,params_train_size,params_weight_decay,state
423,0.12253480404615402,2023-09-04 00:39:33.371321,2023-09-04 00:39:38.991838,0 days 00:00:05.620517,ReLU,ReLU,,,10,11,13.0,,,0.0012871973492997724,2,100,0.3178837075976189,0.0003572743037611245,COMPLETE
424,0.11456926167011261,2023-09-04 00:39:38.992151,2023-09-04 00:39:44.940420,0 days 00:00:05.948269,ReLU,Tanh,,,12,12,16.0,,,0.015094421707274088,2,80,0.7997015129673942,1.0299048766251256e-05,COMPLETE
425,0.16122129559516907,2023-09-04 00:39:44.940730,2023-09-04 00:39:51.009754,0 days 00:00:06.069024,ReLU,ReLU,,,10,13,17.0,,,4.328089360607138e-05,2,80,0.7046348420260645,1.5651838337884667e-05,COMPLETE
426,0.11851079016923904,2023-09-04 00:39:51.010076,2023-09-04 00:39:52.775719,0 days 00:00:01.765643,ReLU,Leaky,,,12,23,17.0,,,0.0032681066774070504,2,80,0.23036675084203612,0.00015807221719598788,COMPLETE
427,0.10778932273387909,2023-09-04 00:39:52.776049,2023-09-04 00:39:59.055185,0 days 00:00:06.279136,ReLU,ReLU,,,10,12,16.0,,,0.0018599710104393189,2,80,0.7328985486629992,0.0002195531185391751,COMPLETE
428,0.15897607803344727,2023-09-04 00:39:59.055499,2023-09-04 00:40:00.206480,0 days 00:00:01.150981,ReLU,Tanh,,,30,11,10.0,,,0.00042374354802711986,2,60,0.44360015400663777,3.728907019033579e-05,COMPLETE
429,0.11479691416025162,2023-09-04 00:40:00.206797,2023-09-04 00:40:12.365909,0 days 00:00:12.159112,ReLU,ReLU,,,2,10,20.0,,,0.0062412035202065175,2,80,0.3038803124329311,0.00028099764482878467,COMPLETE
430,0.13796807825565338,2023-09-04 00:40:12.366226,2023-09-04 00:40:13.836642,0 days 00:00:01.470416,ReLU,Leaky,,,12,14,18.0,,,0.012807647778251708,2,80,0.1932564634576225,0.009682963680377478,COMPLETE
431,0.1152733638882637,2023-09-04 00:40:13.836968,2023-09-04 00:40:19.612573,0 days 00:00:05.775605,Tanh,ReLU,,,10,11,16.0,,,0.003924566626344156,2,80,0.665430120802124,1.8028573215215193e-05,COMPLETE
432,0.10747425258159637,2023-09-04 00:40:19.612897,2023-09-04 00:40:28.045163,0 days 00:00:08.432266,ReLU,Tanh,,,12,9,19.0,,,0.021308608893080973,2,100,0.7712152449282651,6.055353260336328e-05,COMPLETE
433,0.11607486754655838,2023-09-04 00:40:28.045480,2023-09-04 00:40:33.247521,0 days 00:00:05.202041,ReLU,ReLU,,,10,12,17.0,,,0.009739127426039879,2,80,0.6003844783132414,2.7085557346860344e-05,COMPLETE
434,0.21182917058467865,2023-09-04 00:40:33.247855,2023-09-04 00:40:34.402417,0 days 00:00:01.154562,Sigmoid,Tanh,,,30,11,15.0,,,0.00028495509449413836,2,80,0.3313199801047684,3.130924501022123e-05,COMPLETE
435,0.24032239615917206,2023-09-04 00:40:34.402733,2023-09-04 00:40:37.824048,0 days 00:00:03.421315,ReLU,ReLU,,,12,13,11.0,,,2.671740997758571e-05,2,80,0.4700413549629642,1.3675544671699106e-05,COMPLETE
436,0.1154308170080185,2023-09-04 00:40:37.824374,2023-09-04 00:40:46.112923,0 days 00:00:08.288549,ReLU,Leaky,,,10,12,17.0,,,0.005214332191211601,2,80,0.799592652075574,0.00012736706475641939,COMPLETE
437,0.13023194670677185,2023-09-04 00:40:46.113238,2023-09-04 00:40:48.233843,0 days 00:00:02.120605,ReLU,ReLU,,,12,11,14.0,,,0.007843037085748693,2,80,0.2810922601986517,2.2810100971383073e-05,COMPLETE
438,0.12287229299545288,2023-09-04 00:40:48.234158,2023-09-04 00:40:52.430628,0 days 00:00:04.196470,ReLU,Tanh,,,10,10,16.0,,,0.002130735728165131,2,80,0.4037181642559841,0.0001825645266386802,COMPLETE
439,0.12157214432954788,2023-09-04 00:40:52.430941,2023-09-04 00:41:06.458784,0 days 00:00:14.027843,ReLU,ReLU,,,4,12,12.0,,,0.0162839345648249,2,60,0.715960473411413,0.000260493449431995,COMPLETE
440,0.13107170164585114,2023-09-04 00:41:06.459346,2023-09-04 00:41:13.424087,0 days 00:00:06.964741,Tanh,ReLU,,,30,13,8.0,,,0.0008408860845218121,2,80,0.6822732092639429,8.594115045743175e-05,COMPLETE
441,0.1402864009141922,2023-09-04 00:41:13.424649,2023-09-04 00:41:29.359613,0 days 00:00:15.934964,ReLU,,,,12,12,,,,0.012066635668762442,1,100,0.7444008633093406,0.00036204364973062216,COMPLETE
442,0.1119842529296875,2023-09-04 00:41:29.360164,2023-09-04 00:41:34.060550,0 days 00:00:04.700386,ReLU,Leaky,,,10,14,9.0,,,0.006810508577594786,2,40,0.7564721214200234,2.0293433973967548e-05,COMPLETE
443,0.12006393074989319,2023-09-04 00:41:34.060876,2023-09-04 00:41:40.240655,0 days 00:00:06.179779,ReLU,Tanh,,,10,11,18.0,,,0.00911737058951285,2,80,0.7112225828793706,0.0009054944844054676,COMPLETE
444,0.10306032001972198,2023-09-04 00:41:40.240977,2023-09-04 00:41:45.617434,0 days 00:00:05.376457,ReLU,ReLU,,,12,13,15.0,,,0.0014511500632888503,2,80,0.7357172146617932,1.612027831760948e-05,COMPLETE
445,0.1005273088812828,2023-09-04 00:41:45.617761,2023-09-04 00:41:50.613881,0 days 00:00:04.996120,ReLU,ReLU,,,12,13,15.0,,,0.0011504209746595615,2,80,0.6850712997623689,1.4967358723565356e-05,COMPLETE
446,0.13100764155387878,2023-09-04 00:41:50.614212,2023-09-04 00:41:52.381028,0 days 00:00:01.766816,ReLU,ReLU,,,12,13,15.0,,,0.0010892492877388937,2,80,0.23730762033955802,1.455067135915879e-05,COMPLETE
447,0.12394025176763535,2023-09-04 00:41:52.381352,2023-09-04 00:41:54.516200,0 days 00:00:02.134848,ReLU,ReLU,,,12,14,14.0,,,0.001433884105701419,2,80,0.2883567290906215,1.32805730513655e-05,COMPLETE
448,0.12252087146043777,2023-09-04 00:41:54.516521,2023-09-04 00:41:56.933922,0 days 00:00:02.417401,ReLU,ReLU,,,12,13,15.0,,,0.001266959632296571,2,80,0.3289228508266798,1.5297467338618877e-05,COMPLETE
449,0.14337363839149475,2023-09-04 00:41:56.934262,2023-09-04 00:41:58.079405,0 days 00:00:01.145143,Tanh,ReLU,,,12,15,15.0,,,0.0010458595250724654,2,80,0.15038302354642002,1.8123450357843956e-05,COMPLETE
450,0.12589018046855927,2023-09-04 00:41:58.079733,2023-09-04 00:42:01.152533,0 days 00:00:03.072800,ReLU,ReLU,,,12,14,15.0,,,0.001440573909368393,2,80,0.4083143445814969,1.2674253571796204e-05,COMPLETE
451,0.10751400142908096,2023-09-04 00:42:01.152860,2023-09-04 00:42:07.475020,0 days 00:00:06.322160,ReLU,ReLU,,,12,13,14.0,,,0.0012080102466164727,2,100,0.6907743947820115,0.00046396957974024567,COMPLETE
452,0.1140432134270668,2023-09-04 00:42:07.475335,2023-09-04 00:42:13.323917,0 days 00:00:05.848582,ReLU,ReLU,Leaky,,12,12,15.0,3.0,,0.0015378891629035931,3,80,0.6518954538425351,2.2618195190530395e-05,COMPLETE
453,0.13532546162605286,2023-09-04 00:42:13.324243,2023-09-04 00:42:18.661680,0 days 00:00:05.337437,ReLU,ReLU,,,12,13,15.0,,,0.0008860742876798426,2,80,0.7285232552111435,1.796827613113411e-05,COMPLETE
454,0.12515424191951752,2023-09-04 00:42:18.662102,2023-09-04 00:42:22.004146,0 days 00:00:03.342044,ReLU,ReLU,,,8,12,16.0,,,0.0016295860121168996,2,80,0.31344174091334215,0.00030714088800557924,COMPLETE
455,0.13054949045181274,2023-09-04 00:42:22.004485,2023-09-04 00:42:24.020746,0 days 00:00:02.016261,ReLU,ReLU,,,30,13,14.0,,,0.0018378875856040913,2,60,0.7997266366307161,1.1141942095731719e-05,COMPLETE
456,0.11441709846258163,2023-09-04 00:42:24.021083,2023-09-04 00:42:28.195635,0 days 00:00:04.174552,ReLU,Leaky,,,16,17,15.0,,,0.0009973218968045044,2,80,0.689503063885722,2.9596356033222407e-05,COMPLETE
457,0.1695312261581421,2023-09-04 00:42:28.195964,2023-09-04 00:42:34.029888,0 days 00:00:05.833924,Sigmoid,ReLU,,,12,21,14.0,,,0.018562797412504047,2,80,0.7357738011636591,0.0032747631288783208,COMPLETE
458,0.14194969832897186,2023-09-04 00:42:34.030434,2023-09-04 00:42:35.614612,0 days 00:00:01.584178,Tanh,ReLU,,,12,12,16.0,,,0.013682881543893858,2,80,0.17175914595107836,3.846117709673438e-05,COMPLETE
459,0.12100721895694733,2023-09-04 00:42:35.614938,2023-09-04 00:42:36.848427,0 days 00:00:01.233489,ReLU,ReLU,,,30,9,15.0,,,0.0011748771186521475,2,80,0.36311183381383627,1.6660896093357235e-05,COMPLETE
460,0.12312610447406769,2023-09-04 00:42:36.848749,2023-09-04 00:42:41.366493,0 days 00:00:04.517744,ReLU,Leaky,,,12,14,16.0,,,0.011045565244938816,2,100,0.34532071098457895,0.0005533922830881071,COMPLETE
461,0.10128077864646912,2023-09-04 00:42:41.366815,2023-09-04 00:42:49.052048,0 days 00:00:07.685233,ReLU,ReLU,,,12,15,16.0,,,0.0007311786132243879,2,80,0.7667162073331639,2.5291439173565135e-05,COMPLETE
462,0.1146966740489006,2023-09-04 00:42:49.052388,2023-09-04 00:43:24.005201,0 days 00:00:34.952813,ReLU,ReLU,,,2,11,16.0,,,0.0006609235348751011,2,80,0.7679818572295596,2.4230743115855943e-05,COMPLETE
463,0.13768719136714935,2023-09-04 00:43:24.005542,2023-09-04 00:43:25.533902,0 days 00:00:01.528360,ReLU,ReLU,,,12,15,16.0,,,0.00041711665559177356,2,80,0.20612666279482678,3.079112580302675e-05,COMPLETE
464,0.10466614365577698,2023-09-04 00:43:25.534225,2023-09-04 00:43:28.130376,0 days 00:00:02.596151,ReLU,Leaky,,,30,15,17.0,,,0.013856457896829818,2,80,0.7705381289674729,0.0014581962027139675,COMPLETE
465,0.14570781588554382,2023-09-04 00:43:28.130695,2023-09-04 00:43:29.624640,0 days 00:00:01.493945,ReLU,ReLU,,,12,16,16.0,,,0.000560000190170665,2,80,0.19648175553710437,0.019563455587640628,COMPLETE
466,0.11240993440151215,2023-09-04 00:43:29.624948,2023-09-04 00:43:31.604373,0 days 00:00:01.979425,Tanh,ReLU,,,12,10,17.0,,,0.009934977420619603,2,80,0.2619068508162486,0.0004015236432033467,COMPLETE
467,0.1257333606481552,2023-09-04 00:43:31.604724,2023-09-04 00:43:33.392401,0 days 00:00:01.787677,ReLU,ReLU,,,30,16,16.0,,,0.0007237102035190448,2,60,0.7114372221891467,0.00021108026196508186,COMPLETE
468,0.12404787540435791,2023-09-04 00:43:33.392743,2023-09-04 00:43:35.008948,0 days 00:00:01.616205,ReLU,Leaky,,,12,15,17.0,,,0.0009465571559784472,2,40,0.4322327626324614,2.701246536377543e-05,COMPLETE
469,0.1351921707391739,2023-09-04 00:43:35.009285,2023-09-04 00:43:38.292776,0 days 00:00:03.283491,ReLU,ReLU,,,10,15,18.0,,,0.0007978784196285515,2,80,0.21864845995251136,3.9671573119071495e-05,COMPLETE
470,0.16471226513385773,2023-09-04 00:43:38.293096,2023-09-04 00:43:39.456191,0 days 00:00:01.163095,ReLU,ReLU,,,12,12,13.0,,,0.0006243629329405297,2,100,0.12009354399318249,0.000301620745594854,COMPLETE
471,0.12167315930128098,2023-09-04 00:43:39.456512,2023-09-04 00:43:55.399984,0 days 00:00:15.943472,ReLU,ReLU,,,4,11,17.0,,,0.02242642552364698,2,80,0.7734796483153806,2.213832335162636e-05,COMPLETE
472,0.11758245527744293,2023-09-04 00:43:55.400308,2023-09-04 00:44:01.166592,0 days 00:00:05.766284,ReLU,Leaky,,,10,14,16.0,,,0.016403814722048014,2,80,0.6682170893303822,2.0266860454942014e-05,COMPLETE
473,0.11658743023872375,2023-09-04 00:44:01.166920,2023-09-04 00:44:03.681651,0 days 00:00:02.514731,ReLU,ReLU,,,30,16,19.0,,,0.0008648493059290621,2,80,0.746504426949918,4.4484724700315894e-05,COMPLETE
474,0.12565483152866364,2023-09-04 00:44:03.681978,2023-09-04 00:44:11.454520,0 days 00:00:07.772542,Tanh,ReLU,,,12,10,18.0,,,0.0005693364973591318,2,80,0.7989704002702268,0.00023087957926029365,COMPLETE
475,0.2151271104812622,2023-09-04 00:44:11.454863,2023-09-04 00:44:17.601587,0 days 00:00:06.146724,ReLU,ReLU,,,10,11,16.0,,,0.011154905943358993,2,80,0.7063290146415957,0.09920241165806543,COMPLETE
476,0.11588269472122192,2023-09-04 00:44:17.601897,2023-09-04 00:44:25.572164,0 days 00:00:07.970267,ReLU,Leaky,Leaky,Sigmoid,12,12,15.0,23.0,11.0,0.008085698820275716,4,80,0.7471607959910248,0.00026605700664627396,COMPLETE
477,0.1518602967262268,2023-09-04 00:44:25.572501,2023-09-04 00:44:27.063426,0 days 00:00:01.490925,ReLU,ReLU,,,16,9,17.0,,,0.0025790557933529543,2,80,0.2540521169613161,0.032310930755714236,COMPLETE
478,0.1172737404704094,2023-09-04 00:44:27.063749,2023-09-04 00:44:32.935039,0 days 00:00:05.871290,ReLU,Tanh,,,10,11,16.0,,,0.019326565627510086,2,80,0.6746079684085635,3.4649546913148e-05,COMPLETE
479,0.12924715876579285,2023-09-04 00:44:32.935370,2023-09-04 00:44:38.805526,0 days 00:00:05.870156,Sigmoid,ReLU,,,12,12,18.0,,,0.0007437294753357897,2,100,0.6299756691809618,1.0002435060999024e-05,COMPLETE
480,0.12686927616596222,2023-09-04 00:44:38.805848,2023-09-04 00:44:42.046608,0 days 00:00:03.240760,ReLU,ReLU,,,8,10,14.0,,,0.025664299421932876,2,80,0.30260635981769174,2.628717343374304e-05,COMPLETE
481,0.1077287420630455,2023-09-04 00:44:42.046926,2023-09-04 00:44:44.002158,0 days 00:00:01.955232,ReLU,Tanh,,,30,12,17.0,,,0.013676810129157413,2,60,0.7687537190188627,0.00036098650514218897,COMPLETE
482,0.12165279686450958,2023-09-04 00:44:44.002475,2023-09-04 00:44:48.227939,0 days 00:00:04.225464,ReLU,Leaky,,,10,15,15.0,,,0.008851630019852435,2,80,0.47526577195090075,0.0071673991179357355,COMPLETE
483,0.1162511333823204,2023-09-04 00:44:48.228252,2023-09-04 00:44:50.367958,0 days 00:00:02.139706,ReLU,ReLU,,,12,11,18.0,,,0.0117066812128062,2,80,0.28609491408148185,0.00018247797210539977,COMPLETE
484,0.1846274435520172,2023-09-04 00:44:50.368281,2023-09-04 00:44:52.762421,0 days 00:00:02.394140,Tanh,ReLU,,,10,14,17.0,,,8.23164470853132e-05,2,80,0.27416764282231365,5.4976651220879126e-05,COMPLETE
485,0.11632338911294937,2023-09-04 00:44:52.762751,2023-09-04 00:44:58.634078,0 days 00:00:05.871327,ReLU,Tanh,,,12,11,16.0,,,0.0021521001575150497,2,80,0.799930162005433,2.05515414345592e-05,COMPLETE
486,0.1147521436214447,2023-09-04 00:44:58.634426,2023-09-04 00:45:01.987857,0 days 00:00:03.353431,ReLU,ReLU,,,10,12,16.0,,,0.006830951030737856,2,80,0.38455621589710876,0.0007057818316820514,COMPLETE
487,0.12918241322040558,2023-09-04 00:45:01.988171,2023-09-04 00:45:04.413265,0 days 00:00:02.425094,ReLU,Leaky,,,30,13,15.0,,,0.047872975375016565,2,80,0.7194386179094256,0.0004313280582950084,COMPLETE
488,0.13090775907039642,2023-09-04 00:45:04.413578,2023-09-04 00:45:41.129120,0 days 00:00:36.715542,ReLU,ReLU,Leaky,,2,11,17.0,3.0,,0.01637867849675483,3,80,0.7394838096358162,2.9225454464533472e-05,COMPLETE
489,0.1174379512667656,2023-09-04 00:45:41.129450,2023-09-04 00:45:48.898032,0 days 00:00:07.768582,ReLU,Tanh,,,12,12,14.0,,,0.03263951315483773,2,100,0.6985681871938645,1.2984499433352123e-05,COMPLETE
490,0.11316680908203125,2023-09-04 00:45:48.898359,2023-09-04 00:45:55.949312,0 days 00:00:07.050953,ReLU,ReLU,,,10,20,18.0,,,0.001058525354679108,2,80,0.7674747493113485,0.00016236041094901192,COMPLETE
491,0.37007012963294983,2023-09-04 00:45:55.949636,2023-09-04 00:45:58.651372,0 days 00:00:02.701736,ReLU,ReLU,,,12,14,17.0,,,1.3837144716376742e-05,2,80,0.36379740903092667,1.8476254307540582e-05,COMPLETE
492,0.19649329781532288,2023-09-04 00:45:58.651772,2023-09-04 00:46:00.380227,0 days 00:00:01.728455,Tanh,Sigmoid,,,10,15,16.0,,,0.0004731451229420245,2,40,0.19119829955657974,0.00025652854779032054,COMPLETE
493,0.11055239289999008,2023-09-04 00:46:00.380550,2023-09-04 00:46:02.804727,0 days 00:00:02.424177,ReLU,Tanh,,,30,10,13.0,,,0.0102926518844526,2,80,0.6524519068737957,2.451322008431961e-05,COMPLETE
494,0.11981155723333359,2023-09-04 00:46:02.805052,2023-09-04 00:46:07.030982,0 days 00:00:04.225930,ReLU,Leaky,,,12,17,15.0,,,0.00774541507117451,2,80,0.5778602800236985,0.00034576603149396234,COMPLETE
495,0.16084162890911102,2023-09-04 00:46:07.031305,2023-09-04 00:46:10.680329,0 days 00:00:03.649024,ReLU,ReLU,,,10,12,17.0,,,0.00015886331867076537,2,80,0.421182923485947,0.00020665239172349036,COMPLETE
496,0.1603011190891266,2023-09-04 00:46:10.680657,2023-09-04 00:46:11.943273,0 days 00:00:01.262616,ReLU,ReLU,,,12,11,15.0,,,0.0002522110518202304,2,60,0.22525312816995013,6.912264561272347e-05,COMPLETE
497,0.11331451684236526,2023-09-04 00:46:11.943595,2023-09-04 00:46:18.195104,0 days 00:00:06.251509,ReLU,Tanh,,,10,11,19.0,,,0.012850371983574735,2,80,0.7231343300508979,4.987866670911781e-05,COMPLETE
498,0.157381072640419,2023-09-04 00:46:18.195426,2023-09-04 00:46:38.559264,0 days 00:00:20.363838,ReLU,ReLU,,,4,13,16.0,,,2.2449005320283078e-05,2,100,0.7996112014324395,3.3468808439441366e-05,COMPLETE
499,0.13960634171962738,2023-09-04 00:46:38.559584,2023-09-04 00:46:39.978910,0 days 00:00:01.419326,ReLU,Leaky,,,12,12,18.0,,,0.003069634717210016,2,80,0.18523549721034385,9.451364111885552e-05,COMPLETE
