number,value,datetime_start,datetime_complete,duration,params_activation1,params_activation2,params_activation3,params_activation4,params_batch_size,params_fl1,params_fl2,params_fl3,params_fl4,params_learning_rate,params_n_layers,params_num_epochs,params_train_size,params_weight_decay,state
0,0.7877335548400879,2023-09-04 00:39:25.717530,2023-09-04 00:39:37.070605,0 days 00:00:11.353075,Leaky,ReLU,,,2,1,10.0,,,0.002208703826754932,2,60,0.12059145773652785,0.008344021625343057,COMPLETE
1,0.7656978368759155,2023-09-04 00:39:37.071099,2023-09-04 00:40:15.966824,0 days 00:00:38.895725,ReLU,Leaky,Tanh,,2,12,12.0,5.0,,0.029344768409584186,3,80,0.24182737080952832,5.3707090508529165e-05,COMPLETE
2,0.6685774326324463,2023-09-04 00:40:15.967323,2023-09-04 00:40:16.819992,0 days 00:00:00.852669,Tanh,,,,16,21,,,,0.0005607871670292549,1,40,0.12384135004768704,0.0004390736464681325,COMPLETE
3,0.5602699518203735,2023-09-04 00:40:16.820419,2023-09-04 00:40:32.706410,0 days 00:00:15.885991,Leaky,Leaky,,,10,3,11.0,,,0.035654810666113486,2,80,0.5964412280784948,1.934919229820428e-05,COMPLETE
4,0.5265763401985168,2023-09-04 00:40:32.706870,2023-09-04 00:40:43.884069,0 days 00:00:11.177199,Sigmoid,,,,8,7,,,,0.04467610557242862,1,60,0.5995298536105025,6.343864579948221e-05,COMPLETE
5,0.65500807762146,2023-09-04 00:40:43.884493,2023-09-04 00:40:46.897347,0 days 00:00:03.012854,ReLU,Leaky,,,10,24,1.0,,,0.0001827881050942097,2,60,0.14719770355808634,3.169295772140629e-05,COMPLETE
6,0.5696130394935608,2023-09-04 00:40:46.897779,2023-09-04 00:41:21.662595,0 days 00:00:34.764816,ReLU,Leaky,,,4,12,14.0,,,0.0033828780730723565,2,100,0.42815430433241913,0.0034923476542879205,COMPLETE
7,0.5789793133735657,2023-09-04 00:41:21.663085,2023-09-04 00:41:27.640090,0 days 00:00:05.977005,Sigmoid,,,,30,7,,,,0.0009881099861266415,1,100,0.5983605540326435,0.003881650761796227,COMPLETE
8,0.5343643426895142,2023-09-04 00:41:27.640513,2023-09-04 00:41:33.887785,0 days 00:00:06.247272,ReLU,Tanh,Tanh,ReLU,12,23,21.0,19.0,11.0,0.012640123021182437,4,100,0.12244806601542571,0.004746203697714864,COMPLETE
9,1.1190813779830933,2023-09-04 00:41:33.888244,2023-09-04 00:42:05.312094,0 days 00:00:31.423850,Tanh,Leaky,Tanh,Sigmoid,12,6,14.0,24.0,20.0,0.00015235242561197987,4,80,0.5943440215557362,0.028746070692278223,COMPLETE
10,0.5124595761299133,2023-09-04 00:42:05.312560,2023-09-04 00:42:19.742831,0 days 00:00:14.430271,Sigmoid,,,,8,18,,,,0.0819738603253753,1,60,0.7693936850066444,0.00021263058702280518,COMPLETE
11,0.5771551728248596,2023-09-04 00:42:19.743241,2023-09-04 00:42:34.261563,0 days 00:00:14.518322,Sigmoid,,,,8,18,,,,0.08648203785536225,1,60,0.7704908717594577,0.00023219285438199193,COMPLETE
12,0.6052929162979126,2023-09-04 00:42:34.261964,2023-09-04 00:42:49.074698,0 days 00:00:14.812734,Sigmoid,,,,8,16,,,,0.09932021052760306,1,60,0.7862743145773942,0.00014462863391110522,COMPLETE
13,0.9957196712493896,2023-09-04 00:42:49.075104,2023-09-04 00:43:00.697029,0 days 00:00:11.621925,Sigmoid,Sigmoid,Leaky,,8,16,24.0,1.0,,1.2654809595737597e-05,3,60,0.3772679492284897,1.1660190774382916e-05,COMPLETE
14,0.48193708062171936,2023-09-04 00:43:00.697467,2023-09-04 00:43:05.877241,0 days 00:00:05.179774,Sigmoid,,,,8,9,,,,0.010633662470985168,1,40,0.40648552674455,0.0008094087515310058,COMPLETE
15,0.4531562030315399,2023-09-04 00:43:05.877648,2023-09-04 00:43:09.635329,0 days 00:00:03.757681,Sigmoid,,,,8,11,,,,0.013467272100057475,1,40,0.2925388882219447,0.0006024689751853289,COMPLETE
16,0.5926515460014343,2023-09-04 00:43:09.635740,2023-09-04 00:43:19.931652,0 days 00:00:10.295912,Sigmoid,Sigmoid,Sigmoid,,4,10,1.0,11.0,,0.009428171776221038,3,40,0.2558837822866922,0.0008375315947351909,COMPLETE
17,0.6907914876937866,2023-09-04 00:43:19.932095,2023-09-04 00:43:22.751542,0 days 00:00:02.819447,Sigmoid,Tanh,,,16,9,6.0,,,0.010001275506672876,2,40,0.3133825950390927,0.0010075845008018223,COMPLETE
18,0.48077937960624695,2023-09-04 00:43:22.751982,2023-09-04 00:43:23.651766,0 days 00:00:00.899784,Leaky,,,,30,14,,,,0.003994979216657891,1,40,0.21332874552402004,0.001160123196111137,COMPLETE
19,0.4921250641345978,2023-09-04 00:43:23.652188,2023-09-04 00:43:24.663128,0 days 00:00:01.010940,Leaky,ReLU,,,30,14,18.0,,,0.005298188742240854,2,40,0.18466402171233182,0.001981508901785836,COMPLETE
20,0.47119998931884766,2023-09-04 00:43:24.663555,2023-09-04 00:43:25.533905,0 days 00:00:00.870350,Leaky,,,,30,14,,,,0.0025065202597209352,1,40,0.20581136551498683,0.09021461903150148,COMPLETE
21,0.7685636281967163,2023-09-04 00:43:25.534293,2023-09-04 00:43:26.406773,0 days 00:00:00.872480,Leaky,,,,30,13,,,,0.0022393332452473763,1,40,0.2072598807829407,0.09006013479811886,COMPLETE
22,0.8368018865585327,2023-09-04 00:43:26.407173,2023-09-04 00:43:27.224829,0 days 00:00:00.817656,Leaky,,,,30,15,,,,0.0042220606055421075,1,40,0.19320228336304396,0.022313359467076986,COMPLETE
23,0.7810755968093872,2023-09-04 00:43:27.225223,2023-09-04 00:43:27.931009,0 days 00:00:00.705786,Leaky,,,,30,18,,,,0.01640859250991196,1,40,0.1660797173325797,0.00155492618845376,COMPLETE
24,0.6109470129013062,2023-09-04 00:43:27.931409,2023-09-04 00:43:29.154441,0 days 00:00:01.223032,Leaky,ReLU,,,30,11,6.0,,,0.004872168085770804,2,40,0.2293685220425401,0.0004683773610172461,COMPLETE
25,0.5348300337791443,2023-09-04 00:43:29.154857,2023-09-04 00:43:30.372999,0 days 00:00:01.218142,Leaky,,,,30,14,,,,0.0017158121708561848,1,40,0.29240696238473834,0.014299106232591478,COMPLETE
26,0.7724326848983765,2023-09-04 00:43:30.373396,2023-09-04 00:43:31.544521,0 days 00:00:01.171125,Tanh,Sigmoid,,,30,20,17.0,,,0.02263611194205417,2,40,0.21351034167079752,0.09406428444999487,COMPLETE
27,0.6415777206420898,2023-09-04 00:43:31.544942,2023-09-04 00:43:34.070816,0 days 00:00:02.525874,Leaky,,,,4,16,,,,0.006105191233242451,1,40,0.10007150736967907,0.044512146340650496,COMPLETE
28,0.5473352670669556,2023-09-04 00:43:34.071216,2023-09-04 00:43:37.150686,0 days 00:00:03.079470,Leaky,Tanh,ReLU,,16,5,7.0,12.0,,0.019068443519574842,3,40,0.27509294436237497,0.011156208694588872,COMPLETE
29,0.5897577404975891,2023-09-04 00:43:37.151129,2023-09-04 00:43:48.123955,0 days 00:00:10.972826,Leaky,Sigmoid,,,2,10,23.0,,,0.002279583727566861,2,40,0.17070628587214082,0.008884688582033964,COMPLETE
30,0.568182110786438,2023-09-04 00:43:48.124379,2023-09-04 00:43:53.020505,0 days 00:00:04.896126,Tanh,,,,10,1,,,,0.006957448159410029,1,80,0.2409314887860828,0.0038019352214094305,COMPLETE
31,0.5014323592185974,2023-09-04 00:43:53.020905,2023-09-04 00:43:57.725914,0 days 00:00:04.705009,Sigmoid,,,,8,9,,,,0.011872945648261782,1,40,0.3682853635572403,0.001564264889100403,COMPLETE
32,0.5612519383430481,2023-09-04 00:43:57.726325,2023-09-04 00:44:00.642832,0 days 00:00:02.916507,Sigmoid,,,,8,13,,,,0.00953367634641588,1,40,0.2238197449955819,0.0006354393756573228,COMPLETE
33,0.47947198152542114,2023-09-04 00:44:00.643264,2023-09-04 00:44:12.992787,0 days 00:00:12.349523,Sigmoid,,,,2,8,,,,0.027691322751811978,1,40,0.26163882160635976,0.0003833746245583334,COMPLETE
34,0.6899566650390625,2023-09-04 00:44:12.993202,2023-09-04 00:44:24.887154,0 days 00:00:11.893952,Leaky,,,,2,11,,,,0.04404715472413885,1,40,0.25257041001302266,0.0003154990748078614,COMPLETE
35,0.7097517848014832,2023-09-04 00:44:24.887558,2023-09-04 00:44:52.946919,0 days 00:00:28.059361,ReLU,,,,2,8,,,,0.02457779063282715,1,80,0.2984732404686674,8.630654378040724e-05,COMPLETE
36,0.5075612664222717,2023-09-04 00:44:52.947327,2023-09-04 00:45:26.924052,0 days 00:00:33.976725,Leaky,ReLU,,,2,5,19.0,,,0.030936856768659083,2,100,0.20966474412644123,0.00038447825813568427,COMPLETE
37,0.5166108012199402,2023-09-04 00:45:26.924473,2023-09-04 00:45:36.402878,0 days 00:00:09.478405,Tanh,Tanh,,,2,3,8.0,,,0.0030744166826892124,2,40,0.1495502003178021,0.00013721755748436198,COMPLETE
38,0.4284569323062897,2023-09-04 00:45:36.403301,2023-09-04 00:45:38.824015,0 days 00:00:02.420714,Sigmoid,,,,12,11,,,,0.04719817400920012,1,40,0.2687077264110388,4.9394690096412166e-05,COMPLETE
39,0.5718607902526855,2023-09-04 00:45:38.824429,2023-09-04 00:45:44.907807,0 days 00:00:06.083378,Sigmoid,,,,12,11,,,,0.052715841792402046,1,100,0.27407672239587316,7.288600983135968e-05,COMPLETE
40,0.6903279423713684,2023-09-04 00:45:44.908216,2023-09-04 00:45:52.718478,0 days 00:00:07.810262,Sigmoid,ReLU,,,12,7,4.0,,,0.030230246846360373,2,80,0.33349308579173,3.3520567312264336e-05,COMPLETE
41,0.5924975872039795,2023-09-04 00:45:52.718905,2023-09-04 00:45:54.980065,0 days 00:00:02.261160,Sigmoid,,,,12,12,,,,0.044793553343848075,1,40,0.25283610059708495,0.0005063884527972182,COMPLETE
42,0.6273332834243774,2023-09-04 00:45:54.980476,2023-09-04 00:45:57.472666,0 days 00:00:02.492190,ReLU,,,,10,14,,,,0.01584118066941604,1,40,0.23324606632904046,0.005404661834489247,COMPLETE
43,0.5105540752410889,2023-09-04 00:45:57.473075,2023-09-04 00:45:59.925224,0 days 00:00:02.452149,Sigmoid,,,,12,12,,,,0.019729016066423653,1,40,0.27091859571109383,3.883205543029787e-05,COMPLETE
44,0.47888505458831787,2023-09-04 00:45:59.925651,2023-09-04 00:46:01.307978,0 days 00:00:01.382327,Sigmoid,,,,30,15,,,,0.0627782321483932,1,40,0.3272739204562088,2.182272723734103e-05,COMPLETE
45,0.5761486887931824,2023-09-04 00:46:01.308393,2023-09-04 00:46:03.657699,0 days 00:00:02.349306,Sigmoid,,,,16,17,,,,0.07632220616485269,1,40,0.33690151016460984,2.0282502954515377e-05,COMPLETE
46,0.6523431539535522,2023-09-04 00:46:03.658113,2023-09-04 00:47:16.601979,0 days 00:01:12.943866,Sigmoid,Tanh,Leaky,Leaky,2,10,16.0,18.0,1.0,0.059267216091850025,4,100,0.3078154983686902,4.691350359541625e-05,COMPLETE
47,0.4291890263557434,2023-09-04 00:47:16.602444,2023-09-04 00:47:20.380805,0 days 00:00:03.778361,Sigmoid,,,,12,21,,,,0.034890744616371226,1,60,0.27593349376199633,0.00010462331345611357,COMPLETE
48,0.4618700444698334,2023-09-04 00:47:20.381218,2023-09-04 00:47:26.443448,0 days 00:00:06.062230,Sigmoid,,,,12,22,,,,0.06555977867724376,1,60,0.451282561420976,2.6447097851263794e-05,COMPLETE
49,0.5212073922157288,2023-09-04 00:47:26.443873,2023-09-04 00:47:34.503736,0 days 00:00:08.059863,Sigmoid,Sigmoid,,,12,22,21.0,,,0.03763380723341412,2,60,0.4568085031433212,5.537507060766381e-05,COMPLETE
50,0.40961068868637085,2023-09-04 00:47:34.504178,2023-09-04 00:47:40.667233,0 days 00:00:06.163055,ReLU,,,,12,20,,,,0.08899683335985523,1,60,0.46323162357243297,9.30516441573508e-05,COMPLETE
51,0.6262685656547546,2023-09-04 00:47:40.667655,2023-09-04 00:47:46.811771,0 days 00:00:06.144116,ReLU,,,,12,20,,,,0.08138165128758175,1,60,0.4624271672704755,9.290698105549339e-05,COMPLETE
52,0.6105588674545288,2023-09-04 00:47:46.812182,2023-09-04 00:47:53.405514,0 days 00:00:06.593332,ReLU,,,,12,24,,,,0.04293453074112666,1,60,0.4938778119776175,0.00012136603187708287,COMPLETE
53,0.6069557070732117,2023-09-04 00:47:53.405917,2023-09-04 00:48:00.581993,0 days 00:00:07.176076,ReLU,,,,12,22,,,,0.0569735792048793,1,60,0.5476491160470714,0.00018763357619434819,COMPLETE
54,0.5414266586303711,2023-09-04 00:48:00.582405,2023-09-04 00:48:05.592532,0 days 00:00:05.010127,ReLU,,,,12,19,,,,0.03314534464941248,1,60,0.3767488692516311,5.9795885763678766e-05,COMPLETE
55,0.4113258123397827,2023-09-04 00:48:05.592939,2023-09-04 00:48:11.021722,0 days 00:00:05.428783,Sigmoid,,,,12,21,,,,0.07110223692194532,1,60,0.41020827394557113,2.9804208065104603e-05,COMPLETE
56,0.42928001284599304,2023-09-04 00:48:11.022136,2023-09-04 00:48:16.454391,0 days 00:00:05.432255,Sigmoid,,,,12,23,,,,0.09466099583533531,1,60,0.4079830526303069,1.274032194958094e-05,COMPLETE
57,0.5341900587081909,2023-09-04 00:48:16.454804,2023-09-04 00:48:21.887931,0 days 00:00:05.433127,Sigmoid,,,,12,23,,,,0.09584162961756566,1,60,0.40595018353692786,1.3037004983044163e-05,COMPLETE
58,0.5349523425102234,2023-09-04 00:48:21.888346,2023-09-04 00:48:27.969100,0 days 00:00:06.080754,Sigmoid,Sigmoid,,,12,21,3.0,,,0.09646418192730119,2,60,0.3515490438497564,1.4756505258195e-05,COMPLETE
59,0.5714914798736572,2023-09-04 00:48:27.969527,2023-09-04 00:48:31.922169,0 days 00:00:03.952642,Sigmoid,,,,12,20,,,,0.043238720636215734,1,60,0.2919521300794963,4.1248785995545825e-05,COMPLETE
60,0.4059029817581177,2023-09-04 00:48:31.922582,2023-09-04 00:48:37.324489,0 days 00:00:05.401907,Sigmoid,,,,12,23,,,,0.06931952709819907,1,60,0.4035699284546953,1.652609432534468e-05,COMPLETE
61,0.5976302027702332,2023-09-04 00:48:37.324898,2023-09-04 00:48:42.732133,0 days 00:00:05.407235,Sigmoid,,,,12,23,,,,0.0649410412789871,1,60,0.3996478094336478,2.7565103316617215e-05,COMPLETE
62,0.9275578260421753,2023-09-04 00:48:42.732545,2023-09-04 00:48:54.131275,0 days 00:00:11.398730,Sigmoid,Leaky,ReLU,,12,21,9.0,7.0,,0.09948417908946068,3,60,0.42178296510465046,1.7100344898392444e-05,COMPLETE
63,0.5250151753425598,2023-09-04 00:48:54.131724,2023-09-04 00:49:07.357623,0 days 00:00:13.225899,Sigmoid,,,,4,24,,,,0.052586704216586115,1,60,0.35883544219145624,1.1790995266119748e-05,COMPLETE
64,0.5202765464782715,2023-09-04 00:49:07.358038,2023-09-04 00:49:12.587952,0 days 00:00:05.229914,Sigmoid,,,,12,19,,,,0.03601509355676565,1,60,0.38946156816758853,2.849625445712205e-05,COMPLETE
65,0.5111920833587646,2023-09-04 00:49:12.588383,2023-09-04 00:49:18.834927,0 days 00:00:06.246544,Sigmoid,,,,8,23,,,,0.0710898682943558,1,60,0.32359577722777083,1.768029787705109e-05,COMPLETE
66,0.5079917311668396,2023-09-04 00:49:18.835348,2023-09-04 00:49:23.617157,0 days 00:00:04.781809,Tanh,,,,12,22,,,,0.02348769892058716,1,60,0.35130642848363614,3.897929352952014e-05,COMPLETE
67,0.5110467672348022,2023-09-04 00:49:23.617582,2023-09-04 00:49:27.794817,0 days 00:00:04.177235,Sigmoid,,,,12,21,,,,0.01486807791284067,1,60,0.30522706664439975,1.037101987070641e-05,COMPLETE
68,0.5009473562240601,2023-09-04 00:49:27.795241,2023-09-04 00:49:36.005719,0 days 00:00:08.210478,ReLU,,,,8,19,,,,0.025862133030837856,1,60,0.42618117572891717,5.4534850910428656e-05,COMPLETE
69,0.4898492395877838,2023-09-04 00:49:36.006142,2023-09-04 00:49:41.935313,0 days 00:00:05.929171,Sigmoid,,,,10,24,,,,0.07511689021473296,1,60,0.3781793920046059,2.229487247612512e-05,COMPLETE
70,0.41194435954093933,2023-09-04 00:49:41.935739,2023-09-04 00:49:47.166517,0 days 00:00:05.230778,Sigmoid,,,,12,23,,,,0.049687017333886765,1,80,0.29030040966176646,0.00011008866698398626,COMPLETE
71,0.47283899784088135,2023-09-04 00:49:47.166931,2023-09-04 00:49:53.387257,0 days 00:00:06.220326,Sigmoid,,,,12,23,,,,0.049680479842971054,1,80,0.3462116984636908,0.00010225496640131954,COMPLETE
72,0.49951377511024475,2023-09-04 00:49:53.387680,2023-09-04 00:49:59.203448,0 days 00:00:05.815768,Sigmoid,,,,12,21,,,,0.03534855016070112,1,80,0.3232166021079158,7.16539830606397e-05,COMPLETE
73,0.41500124335289,2023-09-04 00:49:59.203871,2023-09-04 00:50:04.304328,0 days 00:00:05.100457,Sigmoid,,,,12,24,,,,0.07768735691575407,1,80,0.28268344507915705,0.0001745947488228941,COMPLETE
74,0.5228769779205322,2023-09-04 00:50:04.304746,2023-09-04 00:50:09.369105,0 days 00:00:05.064359,Sigmoid,,,,12,24,,,,0.07728807928209776,1,80,0.28198675359093195,0.00016153335071795495,COMPLETE
75,0.5526076555252075,2023-09-04 00:50:09.369522,2023-09-04 00:50:19.282132,0 days 00:00:09.912610,Sigmoid,Tanh,Sigmoid,Tanh,12,23,14.0,18.0,23.0,0.04841003746643596,4,80,0.2841521117043607,0.00023779850097385062,COMPLETE
76,0.47142326831817627,2023-09-04 00:50:19.282611,2023-09-04 00:50:23.701677,0 days 00:00:04.419066,Sigmoid,,,,12,22,,,,0.09826591690201417,1,80,0.24484254082409618,7.679523521475381e-05,COMPLETE
77,0.5572209358215332,2023-09-04 00:50:23.702106,2023-09-04 00:50:28.284257,0 days 00:00:04.582151,Tanh,,,,16,20,,,,0.05705620152435713,1,80,0.5065045201774449,4.7679316632037716e-05,COMPLETE
78,0.5358278751373291,2023-09-04 00:50:28.284661,2023-09-04 00:50:34.527689,0 days 00:00:06.243028,Sigmoid,,,,4,24,,,,0.029876617292155242,1,80,0.26644997092537265,0.00011306472213898164,COMPLETE
79,0.4676230251789093,2023-09-04 00:50:34.527953,2023-09-04 00:50:36.309020,0 days 00:00:01.781067,ReLU,ReLU,,,12,21,4.0,,,0.021050625052697607,2,60,0.31180425985568316,3.466545322804648e-05,COMPLETE
80,0.5311508178710938,2023-09-04 00:50:36.309282,2023-09-04 00:50:39.183147,0 days 00:00:02.873865,Sigmoid,,,,12,22,,,,0.0726726377201993,1,100,0.39765252687071645,9.058493247120337e-05,COMPLETE
81,0.5181173086166382,2023-09-04 00:50:39.183400,2023-09-04 00:50:41.583628,0 days 00:00:02.400228,Sigmoid,,,,8,23,,,,0.04944676498737964,1,80,0.2907416111870717,0.00015232202992545104,COMPLETE
82,0.44693610072135925,2023-09-04 00:50:41.583888,2023-09-04 00:50:42.712952,0 days 00:00:01.129064,Sigmoid,,,,12,10,,,,0.03947415700893043,1,60,0.258059943475188,0.00012133528479957934,COMPLETE
83,0.668544590473175,2023-09-04 00:50:42.713209,2023-09-04 00:50:43.843320,0 days 00:00:01.130111,Sigmoid,,,,12,20,,,,0.03824381154016749,1,60,0.25546008646026036,6.272026085997145e-05,COMPLETE
84,0.5466392040252686,2023-09-04 00:50:43.843577,2023-09-04 00:50:45.019922,0 days 00:00:01.176345,Sigmoid,,,,12,23,,,,0.06134811991752444,1,60,0.2640235114699113,0.00012161540349973778,COMPLETE
85,0.4938510060310364,2023-09-04 00:50:45.020175,2023-09-04 00:50:46.595892,0 days 00:00:01.575717,Sigmoid,,,,12,9,,,,0.08042101210844668,1,60,0.3663510310285053,1.549025402993401e-05,COMPLETE
86,0.647618293762207,2023-09-04 00:50:46.596144,2023-09-04 00:50:48.070870,0 days 00:00:01.474726,Sigmoid,,,,12,24,,,,0.028168309511426255,1,60,0.2357022880963016,7.460840299128307e-05,COMPLETE
87,0.5410040020942688,2023-09-04 00:50:48.071132,2023-09-04 00:50:49.060856,0 days 00:00:00.989724,Sigmoid,,,,12,18,,,,0.018139792632222207,1,60,0.22671320620810115,4.744342054867037e-05,COMPLETE
88,0.5232698917388916,2023-09-04 00:50:49.061107,2023-09-04 00:50:51.304842,0 days 00:00:02.243735,ReLU,,,,10,22,,,,0.04020324132735158,1,80,0.33206949407055625,2.5137843596178525e-05,COMPLETE
89,0.5085826516151428,2023-09-04 00:50:51.305094,2023-09-04 00:50:52.604575,0 days 00:00:01.299481,Sigmoid,,,,12,10,,,,0.06258432006372762,1,60,0.30257426784939706,0.000226571239767727,COMPLETE
90,0.6467313766479492,2023-09-04 00:50:52.604839,2023-09-04 00:50:54.594411,0 days 00:00:01.989572,Tanh,,,,12,13,,,,0.08475531126040534,1,100,0.2782564962433037,3.3255557252947345e-05,COMPLETE
91,0.6122204661369324,2023-09-04 00:50:54.594673,2023-09-04 00:50:56.081469,0 days 00:00:01.486796,Sigmoid,,,,8,8,,,,0.04591712025743892,1,60,0.244146078231895,0.0001025059989424216,COMPLETE
92,0.5496190190315247,2023-09-04 00:50:56.081724,2023-09-04 00:50:57.763463,0 days 00:00:01.681739,Sigmoid,,,,12,12,,,,0.0339652916488484,1,80,0.29554792118854945,0.00015003898502925802,COMPLETE
93,0.4437757432460785,2023-09-04 00:50:57.763715,2023-09-04 00:50:58.678024,0 days 00:00:00.914309,Sigmoid,,,,16,11,,,,0.02523043172853235,1,60,0.2703766260464787,0.00028486384498713284,COMPLETE
94,0.760057806968689,2023-09-04 00:50:58.678293,2023-09-04 00:50:59.552408,0 days 00:00:00.874115,Sigmoid,,,,16,11,,,,0.023468221475068655,1,60,0.25936176527020843,0.00018449914501150944,COMPLETE
95,0.47527897357940674,2023-09-04 00:50:59.552673,2023-09-04 00:51:00.599078,0 days 00:00:01.046405,Sigmoid,,,,16,10,,,,0.05653591790739144,1,60,0.3140844255354759,0.00012263057505635918,COMPLETE
96,0.645298421382904,2023-09-04 00:51:00.599336,2023-09-04 00:51:01.439623,0 days 00:00:00.840287,Sigmoid,,,,16,11,,,,0.0683413320351318,1,60,0.24768233113730956,8.686853799944794e-05,COMPLETE
97,0.4814883768558502,2023-09-04 00:51:01.439891,2023-09-04 00:51:02.377531,0 days 00:00:00.937640,Sigmoid,,,,16,21,,,,0.0411075800848216,1,60,0.27196012747003934,0.0003210308565300744,COMPLETE
98,0.5882519483566284,2023-09-04 00:51:02.377785,2023-09-04 00:51:03.884643,0 days 00:00:01.506858,ReLU,,,,12,22,,,,0.02899746299213403,1,60,0.34396010446973235,6.0796126538068176e-05,COMPLETE
99,0.5797740817070007,2023-09-04 00:51:03.884906,2023-09-04 00:51:06.475878,0 days 00:00:02.590972,Sigmoid,,,,4,12,,,,0.08105914720264361,1,60,0.22346058836395316,2.1228051707552174e-05,COMPLETE
100,0.5287744402885437,2023-09-04 00:51:06.476153,2023-09-04 00:51:08.369623,0 days 00:00:01.893470,Sigmoid,,,,12,23,,,,0.05255288061517262,1,60,0.43996921237764913,0.00025764313341371714,COMPLETE
101,0.6448878049850464,2023-09-04 00:51:08.369886,2023-09-04 00:51:09.538668,0 days 00:00:01.168782,Sigmoid,,,,8,9,,,,0.03387385764926637,1,40,0.28612262279439465,0.0001916978187638758,COMPLETE
102,0.48915404081344604,2023-09-04 00:51:09.538918,2023-09-04 00:51:11.517378,0 days 00:00:01.978460,Sigmoid,Sigmoid,ReLU,,12,13,20.0,24.0,,0.018722132338734994,3,60,0.2638205522089767,0.0001363394372758038,COMPLETE
103,0.558172345161438,2023-09-04 00:51:11.517657,2023-09-04 00:51:12.437071,0 days 00:00:00.919414,Sigmoid,,,,12,11,,,,0.013648591554592197,1,40,0.3182567446926829,9.80792269488577e-05,COMPLETE
104,0.514907956123352,2023-09-04 00:51:12.437330,2023-09-04 00:51:14.186921,0 days 00:00:01.749591,Sigmoid,,,,12,24,,,,0.09891717151385293,1,80,0.30019124446894563,0.0005991622125382067,COMPLETE
105,0.4828045070171356,2023-09-04 00:51:14.187180,2023-09-04 00:51:15.448438,0 days 00:00:01.261258,Sigmoid,,,,16,10,,,,0.02538139114958751,1,60,0.3776551080456224,1.372967369005715e-05,COMPLETE
106,0.4474983513355255,2023-09-04 00:51:15.448688,2023-09-04 00:51:18.358550,0 days 00:00:02.909862,Sigmoid,,,,12,9,,,,0.06553744046117968,1,100,0.4150329223987687,0.00016739622256170306,COMPLETE
107,0.49471187591552734,2023-09-04 00:51:18.358811,2023-09-04 00:51:21.332594,0 days 00:00:02.973783,Sigmoid,,,,12,22,,,,0.06980540500246732,1,100,0.4162129628347518,0.00016584733173275634,COMPLETE
