number,value,datetime_start,datetime_complete,duration,params_activation1,params_activation2,params_activation3,params_activation4,params_batch_size,params_fl1,params_fl2,params_fl3,params_fl4,params_learning_rate,params_n_layers,params_num_epochs,params_train_size,params_weight_decay,state
499,0.12618088722229004,2023-09-03 16:28:58.042358,2023-09-03 16:29:00.405245,0 days 00:00:02.362887,ReLU,ReLU,ReLU,Tanh,16,20,8.0,23.0,11.0,0.003390861264978528,4,80,0.28908926473497537,5.6933609191279065e-05,COMPLETE
