number,value,datetime_start,datetime_complete,duration,params_activation1,params_activation2,params_activation3,params_activation4,params_batch_size,params_fl1,params_fl2,params_fl3,params_fl4,params_learning_rate,params_n_layers,params_num_epochs,params_train_size,params_weight_decay,state
414,0.44505295157432556,2023-09-04 00:13:15.777537,2023-09-04 00:13:20.240981,0 days 00:00:04.463444,Leaky,Leaky,ReLU,,30,23,12.0,3.0,,0.0035883322819680575,3,40,0.698030776360283,0.005379861895359915,COMPLETE
415,0.6401873826980591,2023-09-04 00:13:20.241554,2023-09-04 00:13:30.036340,0 days 00:00:09.794786,Leaky,Sigmoid,Tanh,,8,13,22.0,9.0,,0.00035240150660862,3,100,0.18776964676719235,4.25166338293056e-05,COMPLETE
416,0.48694637417793274,2023-09-04 00:13:30.036929,2023-09-04 00:14:23.726405,0 days 00:00:53.689476,Leaky,Tanh,Leaky,ReLU,2,8,5.0,5.0,8.0,0.0006836955380908938,4,80,0.28211679961693087,0.002243036228344399,COMPLETE
417,0.6796625852584839,2023-09-04 00:14:23.727022,2023-09-04 00:14:43.546368,0 days 00:00:19.819346,Sigmoid,ReLU,,,12,15,23.0,,,8.959564678256601e-05,2,100,0.662077398806265,0.0017084581228299003,COMPLETE
418,0.4990016222000122,2023-09-04 00:14:43.546935,2023-09-04 00:15:06.996652,0 days 00:00:23.449717,Tanh,Leaky,Tanh,,4,14,7.0,7.0,,0.0001423794768935104,3,40,0.580738479128899,0.01469993309894163,COMPLETE
419,1.1262489557266235,2023-09-04 00:15:06.997243,2023-09-04 00:15:59.813703,0 days 00:00:52.816460,Leaky,Tanh,Tanh,Tanh,8,13,24.0,6.0,21.0,0.010498823597207847,4,100,0.7429761737257925,0.06130445857228965,COMPLETE
420,0.577045738697052,2023-09-04 00:15:59.814296,2023-09-04 00:16:25.722178,0 days 00:00:25.907882,Leaky,Leaky,Tanh,,8,14,23.0,4.0,,0.00029692901592712196,3,100,0.44770265613882543,0.03147015749921806,COMPLETE
421,0.7321678996086121,2023-09-04 00:16:25.722766,2023-09-04 00:16:34.123025,0 days 00:00:08.400259,Leaky,ReLU,,,4,12,6.0,,,0.0003765772752750888,2,40,0.25912494666296304,0.011137349350954381,COMPLETE
422,0.42087888717651367,2023-09-04 00:16:34.123598,2023-09-04 00:16:41.826537,0 days 00:00:07.702939,Leaky,Tanh,Tanh,,30,15,15.0,13.0,,0.0030524047312140523,3,80,0.6100465860096359,0.004743345007417204,COMPLETE
423,0.5468292236328125,2023-09-04 00:16:41.827112,2023-09-04 00:16:57.157988,0 days 00:00:15.330876,Leaky,Leaky,Tanh,,8,9,20.0,10.0,,0.0002415942986044591,3,100,0.29299116250811735,0.0026543089768060876,COMPLETE
424,0.469728022813797,2023-09-04 00:16:57.158587,2023-09-04 00:17:14.791829,0 days 00:00:17.633242,Leaky,Leaky,Tanh,Tanh,8,20,22.0,11.0,18.0,0.001821643125022727,4,40,0.7075242711445979,0.006563544932752545,COMPLETE
425,0.4527346193790436,2023-09-04 00:17:14.792412,2023-09-04 00:18:55.807963,0 days 00:01:41.015551,Leaky,Tanh,,,2,11,9.0,,,0.0001920338623958423,2,100,0.6431797479691257,0.0011619736667236873,COMPLETE
426,0.44493183493614197,2023-09-04 00:18:55.808529,2023-09-04 00:19:37.834381,0 days 00:00:42.025852,Leaky,ReLU,Sigmoid,Leaky,4,7,5.0,12.0,11.0,0.007890102546205632,4,100,0.3502653640496143,0.00017383470971296796,COMPLETE
427,0.7102699279785156,2023-09-04 00:19:37.834975,2023-09-04 00:19:49.007053,0 days 00:00:11.172078,Sigmoid,Leaky,Tanh,,8,14,4.0,11.0,,0.0008207688647681288,3,40,0.5404922995669507,0.003562883639597102,COMPLETE
428,0.44836342334747314,2023-09-04 00:19:49.007626,2023-09-04 00:19:58.441408,0 days 00:00:09.433782,Leaky,Tanh,Tanh,,30,13,24.0,9.0,,0.005147786935952285,3,80,0.7545847903855308,0.009513676368642629,COMPLETE
429,0.36352941393852234,2023-09-04 00:19:58.442000,2023-09-04 00:20:26.470101,0 days 00:00:28.028101,ReLU,Leaky,,,8,15,7.0,,,0.003927197283331733,2,100,0.6815011827260267,0.0009371747035822226,COMPLETE
430,0.5562173128128052,2023-09-04 00:20:26.470656,2023-09-04 00:20:54.207067,0 days 00:00:27.736411,ReLU,Leaky,,,8,15,6.0,,,0.00399685936382674,2,100,0.6803457206053817,0.0009375225469237582,COMPLETE
431,0.42034777998924255,2023-09-04 00:20:54.207621,2023-09-04 00:21:19.608188,0 days 00:00:25.400567,ReLU,Leaky,,,8,15,7.0,,,0.0029191638921132884,2,100,0.6233391904226214,0.0013547162941426815,COMPLETE
432,0.4766177833080292,2023-09-04 00:21:19.608765,2023-09-04 00:21:40.807893,0 days 00:00:21.199128,ReLU,Leaky,,,8,24,7.0,,,0.0044113006136903,2,100,0.5123586212002157,0.0009216730086217972,COMPLETE
433,0.46761617064476013,2023-09-04 00:21:40.808440,2023-09-04 00:22:07.034859,0 days 00:00:26.226419,ReLU,Leaky,,,8,15,6.0,,,0.005891523993075057,2,100,0.6503512045463754,0.0007777072550111075,COMPLETE
434,0.5317388772964478,2023-09-04 00:22:07.035416,2023-09-04 00:22:26.954756,0 days 00:00:19.919340,ReLU,Leaky,,,8,14,5.0,,,0.0035271887244926418,2,100,0.4870655595076818,0.00026420764345809255,COMPLETE
435,0.526006817817688,2023-09-04 00:22:26.955316,2023-09-04 00:22:43.957155,0 days 00:00:17.001839,ReLU,Leaky,,,8,16,6.0,,,0.002194086642443584,2,100,0.41420700244398934,0.0010516520007814078,COMPLETE
436,0.47703441977500916,2023-09-04 00:22:43.957734,2023-09-04 00:22:57.307931,0 days 00:00:13.350197,ReLU,Leaky,,,8,13,23.0,,,0.004654906571962091,2,100,0.3265313229684766,0.00159801743665439,COMPLETE
437,0.4585345387458801,2023-09-04 00:22:57.308482,2023-09-04 00:23:24.746476,0 days 00:00:27.437994,ReLU,Leaky,,,8,14,24.0,,,0.002908956640325693,2,100,0.678002147573316,0.00030275708879985296,COMPLETE
438,0.42642438411712646,2023-09-04 00:23:24.747029,2023-09-04 00:23:37.415050,0 days 00:00:12.668021,ReLU,Tanh,,,16,15,21.0,,,0.003809059108496179,2,100,0.5831446224946699,0.01370850257547067,COMPLETE
439,0.3986242115497589,2023-09-04 00:23:37.415599,2023-09-04 00:24:01.792123,0 days 00:00:24.376524,Tanh,Leaky,ReLU,,12,14,7.0,12.0,,0.0057637197644383785,3,100,0.7063843001269996,0.0022093134743809647,COMPLETE
440,0.5119250416755676,2023-09-04 00:24:01.792686,2023-09-04 00:24:23.330261,0 days 00:00:21.537575,ReLU,Leaky,,,8,12,6.0,,,0.00857634088526291,2,80,0.6639659701594334,0.00021832411977624227,COMPLETE
441,0.4973183274269104,2023-09-04 00:24:23.330816,2023-09-04 00:26:05.632450,0 days 00:01:42.301634,ReLU,Tanh,Tanh,,2,15,11.0,13.0,,0.002505397399548213,3,100,0.6095121550148379,0.0012076129996173152,COMPLETE
442,0.6046528816223145,2023-09-04 00:26:05.633067,2023-09-04 00:26:18.208902,0 days 00:00:12.575835,Sigmoid,Leaky,Tanh,,8,13,5.0,24.0,,0.006769733560822763,3,100,0.7194718963389758,0.004192139106537906,COMPLETE
443,0.5453954935073853,2023-09-04 00:26:18.209236,2023-09-04 00:26:20.236228,0 days 00:00:02.026992,ReLU,Tanh,,,30,16,22.0,,,0.0040766742615688505,2,100,0.4796437684340596,0.0014127498042768255,COMPLETE
444,0.7034564018249512,2023-09-04 00:26:20.236548,2023-09-04 00:26:25.020927,0 days 00:00:04.784379,Leaky,Leaky,Leaky,,8,14,7.0,2.0,,0.005155703708219082,3,80,0.3757030405350284,2.8532004263290032e-05,COMPLETE
445,0.5421959757804871,2023-09-04 00:26:25.021269,2023-09-04 00:26:33.193379,0 days 00:00:08.172110,ReLU,Sigmoid,,,8,13,20.0,,,0.003225305358323298,2,100,0.6336420142926533,0.007731160183092712,COMPLETE
446,0.4848387837409973,2023-09-04 00:26:33.193700,2023-09-04 00:26:41.694658,0 days 00:00:08.500958,Leaky,Leaky,Tanh,,8,14,6.0,8.0,,0.001584184194187231,3,100,0.5328476313121945,0.0019989941498333996,COMPLETE
447,0.521818995475769,2023-09-04 00:26:41.694995,2023-09-04 00:26:53.407094,0 days 00:00:11.712099,Leaky,Tanh,Tanh,,8,12,24.0,14.0,,0.002024877703710259,3,100,0.6892383327672195,0.0007796072955012846,COMPLETE
448,0.4237183630466461,2023-09-04 00:26:53.407434,2023-09-04 00:26:57.061371,0 days 00:00:03.653937,ReLU,Leaky,Tanh,,30,13,7.0,14.0,,0.00128305825983627,3,80,0.46176732364617273,0.005853036346409896,COMPLETE
449,0.7369229793548584,2023-09-04 00:26:57.061956,2023-09-04 00:27:07.011813,0 days 00:00:09.949857,Leaky,Tanh,,,2,15,5.0,,,0.004672460389571621,2,100,0.10625379624982392,0.02110582537356661,COMPLETE
450,0.5311363935470581,2023-09-04 00:27:07.012136,2023-09-04 00:27:11.472097,0 days 00:00:04.459961,Leaky,Leaky,Tanh,,12,15,23.0,5.0,,0.0027501931013134673,3,100,0.39683170728738093,0.0030518626122189173,COMPLETE
451,0.4750770628452301,2023-09-04 00:27:11.472439,2023-09-04 00:27:30.475748,0 days 00:00:19.003309,ReLU,Leaky,,,8,14,6.0,,,0.0034589411485965657,2,100,0.5654291374924313,0.0011023118637894108,COMPLETE
452,0.4513002932071686,2023-09-04 00:27:30.476087,2023-09-04 00:27:40.320433,0 days 00:00:09.844346,Leaky,Tanh,Tanh,,8,16,7.0,12.0,,0.006182735228149778,3,80,0.7732177220151893,0.011425326418063828,COMPLETE
453,0.46198874711990356,2023-09-04 00:27:40.320774,2023-09-04 00:27:45.249183,0 days 00:00:04.928409,Sigmoid,Leaky,Tanh,,8,12,23.0,11.0,,0.010751020635172524,3,100,0.30811653997921246,0.0025221342631230456,COMPLETE
454,0.465484082698822,2023-09-04 00:27:45.249519,2023-09-04 00:27:54.661110,0 days 00:00:09.411591,Leaky,Tanh,,,8,14,6.0,,,0.0023511915139351877,2,100,0.7245355930101856,0.0016691129143182083,COMPLETE
455,0.6610833406448364,2023-09-04 00:27:54.661521,2023-09-04 00:27:55.306074,0 days 00:00:00.644553,ReLU,Leaky,Tanh,,30,13,24.0,13.0,,0.00044314144756959253,3,100,0.111137797199717,0.08270750132070744,COMPLETE
456,0.41876885294914246,2023-09-04 00:27:55.306415,2023-09-04 00:28:03.151609,0 days 00:00:07.845194,Leaky,Leaky,Sigmoid,,8,15,5.0,7.0,,0.004132622527813784,3,80,0.5000013179572546,0.004601387925755008,COMPLETE
457,0.5470604300498962,2023-09-04 00:28:03.151961,2023-09-04 00:28:24.923085,0 days 00:00:21.771124,Leaky,Tanh,,,2,13,8.0,,,0.014603358172017588,2,100,0.43501394664291615,0.003369753261981245,COMPLETE
458,0.6419125199317932,2023-09-04 00:28:24.923442,2023-09-04 00:28:29.343932,0 days 00:00:04.420490,ReLU,Leaky,Tanh,,8,14,17.0,3.0,,5.7195024724336304e-05,3,100,0.2743020112904465,1.0188334825092395e-05,COMPLETE
459,0.5362761616706848,2023-09-04 00:28:29.344283,2023-09-04 00:28:31.208400,0 days 00:00:01.864117,Leaky,Tanh,,,16,15,20.0,,,0.007788494988340087,2,40,0.6554845445052698,0.005854614371830883,COMPLETE
460,0.42568376660346985,2023-09-04 00:28:31.208743,2023-09-04 00:28:37.153031,0 days 00:00:05.944288,Tanh,Leaky,Tanh,,8,23,7.0,12.0,,0.0019318812815388388,3,80,0.338665310707576,0.007311808848992167,COMPLETE
461,0.48225677013397217,2023-09-04 00:28:37.153373,2023-09-04 00:28:40.362510,0 days 00:00:03.209137,Leaky,Leaky,,,30,9,22.0,,,0.005140669760955633,2,100,0.6820662136621729,0.009717719291253509,COMPLETE
462,0.46835124492645264,2023-09-04 00:28:40.362834,2023-09-04 00:28:47.062170,0 days 00:00:06.699336,ReLU,Tanh,Tanh,,12,16,4.0,4.0,,0.003131756246644128,3,100,0.6033078215055243,0.01692596951795269,COMPLETE
463,0.4150908887386322,2023-09-04 00:28:47.062508,2023-09-04 00:28:51.569404,0 days 00:00:04.506896,Leaky,Leaky,Tanh,,8,13,21.0,9.0,,0.0039553167058170744,3,40,0.7061758069300689,0.0004129166790828437,COMPLETE
464,0.5641998648643494,2023-09-04 00:28:51.569739,2023-09-04 00:28:56.274363,0 days 00:00:04.704624,Leaky,Sigmoid,,,8,14,23.0,,,0.0025782663636912755,2,100,0.35844794421783294,0.09221688343785597,COMPLETE
465,0.8454410433769226,2023-09-04 00:28:56.274696,2023-09-04 00:29:19.903032,0 days 00:00:23.628336,ReLU,Tanh,Tanh,Sigmoid,4,12,6.0,10.0,14.0,0.045979981823127146,4,80,0.7717003457847013,0.0018970333364045236,COMPLETE
466,0.4720691442489624,2023-09-04 00:29:19.903627,2023-09-04 00:29:31.119495,0 days 00:00:11.215868,Leaky,Leaky,Tanh,,8,8,13.0,6.0,,0.009135269268740795,3,100,0.5634894562640566,0.0008726132029831529,COMPLETE
467,0.48987942934036255,2023-09-04 00:29:31.119852,2023-09-04 00:29:48.854254,0 days 00:00:17.734402,Sigmoid,Leaky,Tanh,,2,4,24.0,11.0,,0.005906023861219327,3,40,0.7338626706626674,6.460207898810195e-05,COMPLETE
468,0.5603078007698059,2023-09-04 00:29:48.854599,2023-09-04 00:29:57.087806,0 days 00:00:08.233207,Leaky,Tanh,,,8,14,6.0,,,0.0002603002115146049,2,100,0.6301930905284617,0.0012028879083723703,COMPLETE
469,0.4188780188560486,2023-09-04 00:29:57.088137,2023-09-04 00:30:01.085142,0 days 00:00:03.997005,ReLU,Leaky,ReLU,Leaky,30,22,5.0,12.0,10.0,0.0015868051793186367,4,100,0.6834112041178992,0.0037779578980537388,COMPLETE
470,0.49943435192108154,2023-09-04 00:30:01.085479,2023-09-04 00:30:07.558300,0 days 00:00:06.472821,Leaky,Tanh,Leaky,,4,13,7.0,13.0,,0.003391937204996982,3,40,0.5212060762507107,0.0023910268880442277,COMPLETE
471,0.36839044094085693,2023-09-04 00:30:07.558647,2023-09-04 00:30:16.119788,0 days 00:00:08.561141,Leaky,Leaky,,,8,15,24.0,,,0.00017089489720609698,2,80,0.797086348740883,0.024692875689992542,COMPLETE
472,0.5181364417076111,2023-09-04 00:30:16.120122,2023-09-04 00:30:26.690316,0 days 00:00:10.570194,Leaky,ReLU,,,8,15,24.0,,,0.00019322366260526573,2,100,0.7995573209328011,0.022949997843583352,COMPLETE
473,0.6090747117996216,2023-09-04 00:30:26.690639,2023-09-04 00:30:30.252043,0 days 00:00:03.561404,Leaky,Leaky,,,8,16,24.0,,,0.00015322289744280521,2,100,0.23767019312528154,0.037828661333742845,COMPLETE
474,0.8642897605895996,2023-09-04 00:30:30.252387,2023-09-04 00:30:35.406016,0 days 00:00:05.153629,Leaky,Tanh,,,8,15,24.0,,,0.000173862465874281,2,40,0.7590806264523299,0.013267783253073276,COMPLETE
475,0.553277850151062,2023-09-04 00:30:35.406340,2023-09-04 00:30:37.769239,0 days 00:00:02.362899,Leaky,Leaky,,,8,15,23.0,,,0.00012366998290349072,2,80,0.225977047837671,0.027374457414820842,COMPLETE
476,0.5928822159767151,2023-09-04 00:30:37.769560,2023-09-04 00:30:49.883875,0 days 00:00:12.114315,Leaky,Leaky,,,8,16,23.0,,,0.00032669564072125985,2,100,0.7929376210207519,0.020047886800406662,COMPLETE
477,0.4899613857269287,2023-09-04 00:30:49.884200,2023-09-04 00:30:59.565521,0 days 00:00:09.681321,Leaky,ReLU,,,8,15,24.0,,,0.0005803964850543157,2,100,0.730597624126197,0.022890014070440712,COMPLETE
478,0.6267349123954773,2023-09-04 00:30:59.565849,2023-09-04 00:31:02.984555,0 days 00:00:03.418706,Leaky,Tanh,,,8,16,24.0,,,0.00021511109273304464,2,40,0.6577268077000099,0.04263269277051312,COMPLETE
479,0.6073071956634521,2023-09-04 00:31:02.984879,2023-09-04 00:31:13.150630,0 days 00:00:10.165751,Leaky,Leaky,,,8,15,23.0,,,0.00010299380842137737,2,100,0.5987738415211373,0.0266319072721461,COMPLETE
480,0.39455917477607727,2023-09-04 00:31:13.150962,2023-09-04 00:31:18.545214,0 days 00:00:05.394252,Leaky,Tanh,,,8,14,19.0,,,0.00018305060070420866,2,80,0.2948415583078066,0.016038523582530537,COMPLETE
481,0.677577555179596,2023-09-04 00:31:18.545782,2023-09-04 00:31:24.473189,0 days 00:00:05.927407,Leaky,Leaky,Sigmoid,,8,15,22.0,7.0,,0.00011359538186933688,3,100,0.25453515204338373,0.03569153255885813,COMPLETE
482,0.6664338707923889,2023-09-04 00:31:24.473536,2023-09-04 00:31:41.003761,0 days 00:00:16.530225,Leaky,ReLU,,,2,14,23.0,,,0.007441482736072035,2,40,0.7707478080991936,0.09961638544598098,COMPLETE
483,0.5701987743377686,2023-09-04 00:31:41.004077,2023-09-04 00:31:58.064636,0 days 00:00:17.060559,Leaky,Leaky,Tanh,,8,15,14.0,4.0,,4.2514568778400016e-05,3,100,0.5489098369716608,0.018758236666868603,COMPLETE
484,0.4960666596889496,2023-09-04 00:31:58.064983,2023-09-04 00:32:08.202104,0 days 00:00:10.137121,Leaky,Tanh,Tanh,,12,14,24.0,13.0,,0.012458328909794831,3,100,0.6987608908628199,0.029721585879884535,COMPLETE
485,0.7013083696365356,2023-09-04 00:32:08.202435,2023-09-04 00:32:09.140225,0 days 00:00:00.937790,Leaky,Leaky,,,30,16,21.0,,,0.002097592821680077,2,80,0.2758784136668734,0.008938531483125874,COMPLETE
486,0.36781275272369385,2023-09-04 00:32:09.140544,2023-09-04 00:32:15.302824,0 days 00:00:06.162280,Sigmoid,Leaky,Tanh,,8,15,7.0,6.0,,0.005011754970599466,3,40,0.7456812380517815,0.0073934358840005154,COMPLETE
487,0.3613884747028351,2023-09-04 00:32:15.303158,2023-09-04 00:32:19.196719,0 days 00:00:03.893561,Sigmoid,Leaky,,,8,15,8.0,,,0.004945662182253475,2,40,0.7413647231228336,0.010704834125713686,COMPLETE
488,0.6237925291061401,2023-09-04 00:32:19.197040,2023-09-04 00:32:24.253382,0 days 00:00:05.056342,Sigmoid,Leaky,Tanh,,8,16,8.0,6.0,,0.005910229859311207,3,40,0.7464859736553371,0.012207382716782298,COMPLETE
489,0.48975619673728943,2023-09-04 00:32:24.253724,2023-09-04 00:32:28.934819,0 days 00:00:04.681095,Sigmoid,Leaky,,,8,15,10.0,,,0.0068078876145721955,2,40,0.7752306135227753,0.0069992331033431904,COMPLETE
490,0.7738168239593506,2023-09-04 00:32:28.935163,2023-09-04 00:32:34.374792,0 days 00:00:05.439629,Sigmoid,Leaky,Tanh,,8,15,8.0,8.0,,1.5209390891871346e-05,3,40,0.7400662825669418,0.011484047740819844,COMPLETE
491,0.5348554253578186,2023-09-04 00:32:34.375384,2023-09-04 00:32:39.526469,0 days 00:00:05.151085,Sigmoid,Leaky,Tanh,,8,16,24.0,16.0,,0.005401757648015735,3,40,0.7976348775095895,0.005554501008927872,COMPLETE
492,0.5747030973434448,2023-09-04 00:32:39.526811,2023-09-04 00:32:43.288808,0 days 00:00:03.761997,Sigmoid,Leaky,,,8,15,8.0,,,0.0011090817866339063,2,40,0.7198063031538625,0.014800743055494036,COMPLETE
493,0.7228929400444031,2023-09-04 00:32:43.289144,2023-09-04 00:32:48.147399,0 days 00:00:04.858255,Sigmoid,Leaky,Tanh,,8,21,8.0,11.0,,0.004806166164696413,3,40,0.7541180005923658,0.0367245979452142,COMPLETE
494,0.3889111876487732,2023-09-04 00:32:48.147736,2023-09-04 00:32:51.874419,0 days 00:00:03.726683,Sigmoid,Leaky,,,8,16,9.0,,,0.008681043824186028,2,40,0.7141668844201917,0.0080782149661495,COMPLETE
495,0.623327374458313,2023-09-04 00:32:51.874751,2023-09-04 00:32:53.747309,0 days 00:00:01.872558,Sigmoid,Leaky,Tanh,,8,15,22.0,20.0,,7.630264984579076e-05,3,40,0.25967794782509435,0.04310680262872616,COMPLETE
496,0.6255254745483398,2023-09-04 00:32:53.747895,2023-09-04 00:32:59.868863,0 days 00:00:06.120968,Sigmoid,Leaky,ReLU,,8,15,7.0,12.0,,0.024974200981264443,3,40,0.7718432663335939,0.004703065039624705,COMPLETE
497,0.566752552986145,2023-09-04 00:32:59.869209,2023-09-04 00:33:04.266955,0 days 00:00:04.397746,Sigmoid,Leaky,,,8,16,18.0,,,0.006275912648986976,2,40,0.7370985894706604,0.006071954362702738,COMPLETE
498,0.42138388752937317,2023-09-04 00:33:04.267522,2023-09-04 00:33:09.497934,0 days 00:00:05.230412,Sigmoid,Leaky,Leaky,,8,15,9.0,9.0,,0.017263098439246373,3,40,0.7096108097543607,0.0029597039668952485,COMPLETE
499,0.6725588440895081,2023-09-04 00:33:09.498278,2023-09-04 00:33:29.128552,0 days 00:00:19.630274,Sigmoid,Leaky,Tanh,,2,24,20.0,14.0,,4.104850266339328e-05,3,40,0.7987751760050115,0.009960298003885945,COMPLETE
