number,value,datetime_start,datetime_complete,duration,params_activation1,params_activation2,params_activation3,params_activation4,params_batch_size,params_fl1,params_fl2,params_fl3,params_fl4,params_learning_rate,params_n_layers,params_num_epochs,params_train_size,params_weight_decay,state
435,0.6530277729034424,2023-09-04 01:05:03.981539,2023-09-04 01:05:05.793739,0 days 00:00:01.812200,Tanh,Leaky,Tanh,ReLU,30,23,24.0,5.0,16.0,0.000814143151136134,4,60,0.3249270569140158,0.0018260167093771661,COMPLETE
436,0.5037509799003601,2023-09-04 01:05:05.794068,2023-09-04 01:05:06.608910,0 days 00:00:00.814842,Tanh,Leaky,Sigmoid,,30,19,11.0,10.0,,0.002017732262292249,3,60,0.24394279292424398,0.0001305524979053165,COMPLETE
437,0.49248364567756653,2023-09-04 01:05:06.609226,2023-09-04 01:05:08.096534,0 days 00:00:01.487308,Tanh,Leaky,Tanh,,30,24,23.0,1.0,,0.002060609903793899,3,60,0.44147304640688345,0.0009163422199845857,COMPLETE
438,0.5006684064865112,2023-09-04 01:05:08.096855,2023-09-04 01:05:09.889888,0 days 00:00:01.793033,ReLU,Sigmoid,Sigmoid,Tanh,30,23,22.0,6.0,19.0,0.006454047027918924,4,60,0.4884482423317419,0.0002576330026236683,COMPLETE
439,0.5341047048568726,2023-09-04 01:05:09.890213,2023-09-04 01:05:12.947479,0 days 00:00:03.057266,Tanh,Leaky,,,8,22,20.0,,,0.0038423329037060023,2,100,0.2243447654850646,0.0013796018781412366,COMPLETE
440,0.586716890335083,2023-09-04 01:05:12.947793,2023-09-04 01:05:13.575314,0 days 00:00:00.627521,Leaky,Tanh,,,30,24,16.0,,,0.0015905011368438887,2,60,0.2288831620457933,0.0006308987679245989,COMPLETE
441,0.5663254857063293,2023-09-04 01:05:13.575614,2023-09-04 01:05:18.151875,0 days 00:00:04.576261,Tanh,Leaky,Leaky,Sigmoid,10,14,13.0,12.0,13.0,0.0026745265552564753,4,100,0.2589768126730752,0.00017285597382765876,COMPLETE
442,0.6065168380737305,2023-09-04 01:05:18.152434,2023-09-04 01:05:21.498816,0 days 00:00:03.346382,ReLU,Leaky,,,30,23,21.0,,,0.001537596326953559,2,60,0.46639042564077365,0.0001323765655475061,COMPLETE
443,0.5348653197288513,2023-09-04 01:05:21.499126,2023-09-04 01:05:22.858700,0 days 00:00:01.359574,ReLU,Leaky,,,12,22,22.0,,,0.0006164888332670074,2,60,0.23789500663486793,0.0007596947097301567,COMPLETE
444,0.4047550857067108,2023-09-04 01:05:22.859010,2023-09-04 01:05:23.552495,0 days 00:00:00.693485,Sigmoid,ReLU,Tanh,,30,24,23.0,2.0,,0.07774528730446457,3,100,0.12300910423289634,0.001139736756795735,COMPLETE
445,0.5063045620918274,2023-09-04 01:05:23.552809,2023-09-04 01:05:24.523542,0 days 00:00:00.970733,Sigmoid,ReLU,Tanh,,30,23,23.0,2.0,,0.08164752728346081,3,100,0.1669867157208535,0.0011029121717544492,COMPLETE
446,0.4566976726055145,2023-09-04 01:05:24.523862,2023-09-04 01:05:25.358501,0 days 00:00:00.834639,Sigmoid,ReLU,Tanh,,30,24,24.0,3.0,,0.0009434018594791884,3,100,0.15260638378055538,0.000766218947879361,COMPLETE
447,0.5206354260444641,2023-09-04 01:05:25.358816,2023-09-04 01:05:26.076553,0 days 00:00:00.717737,ReLU,ReLU,Tanh,,30,9,24.0,6.0,,0.010051297222257928,3,100,0.12972798217797107,0.0014002952749352059,COMPLETE
448,0.5170112252235413,2023-09-04 01:05:26.076868,2023-09-04 01:05:27.813844,0 days 00:00:01.736976,Sigmoid,ReLU,Tanh,Leaky,30,21,22.0,9.0,6.0,0.0010621099310357974,4,100,0.2172757695129488,0.001214249446861031,COMPLETE
449,0.4679454565048218,2023-09-04 01:05:27.814175,2023-09-04 01:05:31.868147,0 days 00:00:04.053972,Sigmoid,ReLU,Tanh,,30,24,23.0,2.0,,0.008412765097797394,3,100,0.3388475389234727,2.9627484270068293e-05,COMPLETE
450,0.48470741510391235,2023-09-04 01:05:31.868468,2023-09-04 01:05:33.525373,0 days 00:00:01.656905,Tanh,Leaky,ReLU,,30,23,21.0,11.0,,0.0014177326849637315,3,100,0.1786328451077111,0.0015999066639489556,COMPLETE
451,0.5100935101509094,2023-09-04 01:05:33.525688,2023-09-04 01:05:34.907927,0 days 00:00:01.382239,Sigmoid,Leaky,,,30,22,8.0,,,0.06633095055307037,2,100,0.202746782647466,0.00010859506657747472,COMPLETE
452,0.6250689029693604,2023-09-04 01:05:34.908236,2023-09-04 01:05:35.796731,0 days 00:00:00.888495,ReLU,ReLU,,,30,23,24.0,,,0.0012241933982836191,2,100,0.19101282443659834,0.0003656183343245383,COMPLETE
453,0.37624967098236084,2023-09-04 01:05:35.797035,2023-09-04 01:05:36.313385,0 days 00:00:00.516350,Sigmoid,Leaky,Sigmoid,,30,22,23.0,5.0,,0.07755076198673669,3,60,0.15227750379256708,0.0005738864215748802,COMPLETE
454,0.5650076866149902,2023-09-04 01:05:36.313700,2023-09-04 01:05:36.935813,0 days 00:00:00.622113,Sigmoid,Leaky,Sigmoid,,30,24,23.0,5.0,,0.0812829398719728,3,60,0.18447892664949284,0.000947679188548455,COMPLETE
455,0.7803997993469238,2023-09-04 01:05:36.936130,2023-09-04 01:05:37.386235,0 days 00:00:00.450105,Sigmoid,Leaky,Sigmoid,,30,21,22.0,8.0,,0.09153167738239662,3,60,0.12445043485883284,0.00043837362980953367,COMPLETE
456,0.3889249563217163,2023-09-04 01:05:37.386558,2023-09-04 01:05:37.800021,0 days 00:00:00.413463,ReLU,Leaky,Sigmoid,,30,22,23.0,4.0,,0.07562504099050402,3,60,0.1116110277765353,0.0003003428242856619,COMPLETE
457,0.5057709217071533,2023-09-04 01:05:37.800332,2023-09-04 01:05:38.208740,0 days 00:00:00.408408,Sigmoid,Leaky,Sigmoid,,30,22,24.0,4.0,,0.06762640466989117,3,60,0.11335779424530007,0.007022983006312316,COMPLETE
458,0.9401866793632507,2023-09-04 01:05:38.209058,2023-09-04 01:05:38.594428,0 days 00:00:00.385370,Sigmoid,Leaky,Sigmoid,,30,22,23.0,1.0,,0.09939998144939043,3,60,0.10869845245338958,0.0005660460638354187,COMPLETE
459,0.46565014123916626,2023-09-04 01:05:38.594753,2023-09-04 01:05:38.968194,0 days 00:00:00.373441,Sigmoid,Leaky,Sigmoid,,30,20,22.0,2.0,,0.07683824796137913,3,60,0.10160475390345095,1.883869556835167e-05,COMPLETE
460,0.719218909740448,2023-09-04 01:05:38.968520,2023-09-04 01:05:44.361029,0 days 00:00:05.392509,Tanh,Sigmoid,Sigmoid,,2,22,24.0,6.0,,0.056563138516589076,3,60,0.1454590472533599,1.5802562121212e-05,COMPLETE
461,0.8028742074966431,2023-09-04 01:05:44.361353,2023-09-04 01:05:45.008541,0 days 00:00:00.647188,ReLU,Leaky,Sigmoid,,30,21,21.0,4.0,,0.07330063223594173,3,60,0.19033195488092103,0.0006783664282994123,COMPLETE
462,0.5635910630226135,2023-09-04 01:05:45.008857,2023-09-04 01:05:45.422737,0 days 00:00:00.413880,Leaky,Tanh,Sigmoid,,30,22,23.0,3.0,,0.08425523072177712,3,60,0.11087545670103391,0.0004738048565127043,COMPLETE
463,0.5468448996543884,2023-09-04 01:05:45.423050,2023-09-04 01:05:46.356763,0 days 00:00:00.933713,Sigmoid,Leaky,Leaky,,30,21,17.0,8.0,,0.06408863440605361,3,60,0.1027182501268554,0.001131382732426995,COMPLETE
464,0.40329107642173767,2023-09-04 01:05:46.357325,2023-09-04 01:05:47.585905,0 days 00:00:01.228580,Sigmoid,Leaky,ReLU,,30,23,22.0,7.0,,0.09919159695198626,3,60,0.11803637651896501,0.00023801798869673652,COMPLETE
465,0.4188114404678345,2023-09-04 01:05:47.586444,2023-09-04 01:05:48.129969,0 days 00:00:00.543525,Sigmoid,Leaky,ReLU,,30,22,20.0,6.0,,0.09797540246692824,3,60,0.11400538958476729,0.0008416997494652381,COMPLETE
466,0.909497857093811,2023-09-04 01:05:48.130287,2023-09-04 01:05:48.873104,0 days 00:00:00.742817,Sigmoid,Leaky,ReLU,Leaky,30,23,22.0,5.0,21.0,0.08386180229398811,4,60,0.11798465205026012,0.010749400136679537,COMPLETE
467,0.43490445613861084,2023-09-04 01:05:48.873659,2023-09-04 01:05:49.975907,0 days 00:00:01.102248,Sigmoid,Leaky,ReLU,,30,22,21.0,7.0,,0.06987338908723989,3,60,0.10720846328686404,0.00022951345874857332,COMPLETE
468,0.6078614592552185,2023-09-04 01:05:49.976462,2023-09-04 01:05:51.616172,0 days 00:00:01.639710,Sigmoid,ReLU,ReLU,,8,16,15.0,2.0,,0.08333012913567535,3,60,0.12605836933090342,0.0009796915755418167,COMPLETE
469,0.7466546893119812,2023-09-04 01:05:51.616493,2023-09-04 01:05:52.606561,0 days 00:00:00.990068,Sigmoid,Leaky,ReLU,,10,22,19.0,9.0,,0.09829259496389654,3,60,0.11625742359048764,2.5143497338943187e-05,COMPLETE
470,0.5719298124313354,2023-09-04 01:05:52.606882,2023-09-04 01:05:53.060452,0 days 00:00:00.453570,Sigmoid,Leaky,Sigmoid,,30,23,22.0,4.0,,0.05645310601878156,3,60,0.1303907021351012,3.315580787042594e-05,COMPLETE
471,0.8581458330154419,2023-09-04 01:05:53.060777,2023-09-04 01:05:55.091342,0 days 00:00:02.030565,Sigmoid,Leaky,ReLU,,12,19,5.0,7.0,,0.07299926408132708,3,60,0.18259101129064878,0.07366809034831699,COMPLETE
472,0.7726658582687378,2023-09-04 01:05:55.091662,2023-09-04 01:05:55.582944,0 days 00:00:00.491282,Sigmoid,Leaky,Sigmoid,,30,23,20.0,8.0,,0.06039611150919759,3,60,0.13203947438109692,0.03873675770233907,COMPLETE
473,0.7390735745429993,2023-09-04 01:05:55.583262,2023-09-04 01:05:56.616568,0 days 00:00:01.033306,Sigmoid,Sigmoid,Leaky,,12,21,23.0,10.0,,0.0820709120518235,3,60,0.1450775323875573,0.00020079525771152812,COMPLETE
474,1.0841753482818604,2023-09-04 01:05:56.616909,2023-09-04 01:05:57.745402,0 days 00:00:01.128493,Sigmoid,Leaky,ReLU,,12,23,14.0,3.0,,0.06093505049358377,3,60,0.1202997631420806,0.0006851049937887535,COMPLETE
475,0.7104569673538208,2023-09-04 01:05:57.745716,2023-09-04 01:05:58.176024,0 days 00:00:00.430308,Sigmoid,Tanh,Sigmoid,,30,22,21.0,1.0,,0.09987102715252452,3,60,0.12195633034953646,0.00025985203848732366,COMPLETE
476,0.5491234064102173,2023-09-04 01:05:58.176342,2023-09-04 01:06:04.204905,0 days 00:00:06.028563,Sigmoid,Leaky,Tanh,,2,9,1.0,4.0,,0.06992696922780743,3,60,0.1494951073022437,2.1202320496592266e-05,COMPLETE
477,0.540433406829834,2023-09-04 01:06:04.205233,2023-09-04 01:06:05.263893,0 days 00:00:01.058660,Sigmoid,ReLU,ReLU,,12,23,23.0,5.0,,0.05503431851470272,3,60,0.13945369620397174,0.005934927568613474,COMPLETE
478,0.8604376316070557,2023-09-04 01:06:05.264210,2023-09-04 01:06:05.699317,0 days 00:00:00.435107,Tanh,Leaky,Sigmoid,,30,22,12.0,11.0,,0.001309899157359237,3,60,0.1170400198485999,9.682780229371685e-05,COMPLETE
479,0.4474962651729584,2023-09-04 01:06:05.699649,2023-09-04 01:06:06.527531,0 days 00:00:00.827882,Sigmoid,Leaky,Tanh,,12,23,22.0,6.0,,0.002838911454333335,3,60,0.11176725805252843,0.0011523633125558336,COMPLETE
480,0.6204288601875305,2023-09-04 01:06:06.527859,2023-09-04 01:06:07.105266,0 days 00:00:00.577407,Sigmoid,Leaky,Sigmoid,,30,20,18.0,2.0,,0.0023362286780908895,3,60,0.17004185154172358,0.00015155805064786618,COMPLETE
481,0.48816221952438354,2023-09-04 01:06:07.105582,2023-09-04 01:06:08.001923,0 days 00:00:00.896341,Sigmoid,Leaky,Leaky,,12,21,24.0,8.0,,0.07867915535803653,3,60,0.1241776265300483,4.358566907879386e-05,COMPLETE
482,0.42172953486442566,2023-09-04 01:06:08.002242,2023-09-04 01:06:09.172545,0 days 00:00:01.170303,Sigmoid,Leaky,ReLU,,12,22,23.0,17.0,,0.09966255961312834,3,60,0.1618056235589452,1.4817687668066022e-05,COMPLETE
483,0.6185275912284851,2023-09-04 01:06:09.172874,2023-09-04 01:06:09.434099,0 days 00:00:00.261225,Sigmoid,ReLU,Tanh,,30,23,21.0,3.0,,0.06699114194298676,3,40,0.10037176697335685,0.0009385180389654423,COMPLETE
484,0.5353623032569885,2023-09-04 01:06:09.434419,2023-09-04 01:06:10.208172,0 days 00:00:00.773753,Sigmoid,Leaky,Sigmoid,,12,10,24.0,14.0,,0.08328030405026958,3,60,0.1061964325471571,0.00024177386789397596,COMPLETE
485,0.6742791533470154,2023-09-04 01:06:10.208486,2023-09-04 01:06:10.778422,0 days 00:00:00.569936,Tanh,Leaky,ReLU,,30,23,20.0,5.0,,0.004587704386862327,3,60,0.1650500025168221,0.0017590112636285424,COMPLETE
486,0.5432146787643433,2023-09-04 01:06:10.778738,2023-09-04 01:06:11.372511,0 days 00:00:00.593773,Sigmoid,Sigmoid,Sigmoid,,12,21,22.0,7.0,,0.0004640371340833432,3,40,0.11986250017465559,2.8096077383503915e-05,COMPLETE
487,0.8956814408302307,2023-09-04 01:06:11.372838,2023-09-04 01:06:12.194831,0 days 00:00:00.821993,Sigmoid,Leaky,Tanh,ReLU,30,22,23.0,20.0,14.0,0.05340615284873279,4,60,0.1585720486884433,0.020576907015191565,COMPLETE
488,0.6148574948310852,2023-09-04 01:06:12.195169,2023-09-04 01:06:13.003119,0 days 00:00:00.807950,Sigmoid,Tanh,ReLU,,12,23,19.0,1.0,,0.021418382503632462,3,60,0.10918096147782727,3.7461452143451395e-05,COMPLETE
489,0.6550039052963257,2023-09-04 01:06:13.003440,2023-09-04 01:06:14.000078,0 days 00:00:00.996638,Sigmoid,Leaky,Sigmoid,,12,22,22.0,12.0,,0.06691644624451334,3,60,0.13905809231685504,0.0005295054750190038,COMPLETE
490,0.6663420796394348,2023-09-04 01:06:14.000400,2023-09-04 01:06:14.363091,0 days 00:00:00.362691,Sigmoid,Leaky,Leaky,Sigmoid,30,20,21.0,9.0,9.0,0.0032292579534235603,4,40,0.12542374652374796,0.00029289506288702777,COMPLETE
491,0.7145992517471313,2023-09-04 01:06:14.363425,2023-09-04 01:06:15.643394,0 days 00:00:01.279969,Tanh,ReLU,Sigmoid,,8,23,16.0,23.0,,0.07670933410941741,3,60,0.11523913621102076,1.8272243369260248e-05,COMPLETE
492,0.49885094165802,2023-09-04 01:06:15.643755,2023-09-04 01:06:16.878742,0 days 00:00:01.234987,Sigmoid,Leaky,Tanh,,12,21,24.0,6.0,,0.05314247419315757,3,60,0.17202920491478488,0.016213259713616052,COMPLETE
493,0.8891934156417847,2023-09-04 01:06:16.879072,2023-09-04 01:06:17.098648,0 days 00:00:00.219576,Leaky,,,,30,9,,,,0.00013090279566657181,1,40,0.13395139351122304,0.00017185664274936994,COMPLETE
494,0.7745315432548523,2023-09-04 01:06:17.098958,2023-09-04 01:06:17.669199,0 days 00:00:00.570241,Sigmoid,,,,12,22,,,,0.0018814306895718576,1,60,0.11238892311126272,1.2062049116690167e-05,COMPLETE
495,0.5729934573173523,2023-09-04 01:06:17.669515,2023-09-04 01:06:18.691593,0 days 00:00:01.022078,Sigmoid,Leaky,ReLU,,10,8,18.0,5.0,,0.0036871123718850026,3,60,0.12064312745342994,0.00020921344407489782,COMPLETE
496,0.42220214009284973,2023-09-04 01:06:18.691922,2023-09-04 01:06:19.156135,0 days 00:00:00.464213,Sigmoid,,,,30,23,,,,0.09970326257023145,1,60,0.21009960212756673,0.0003862107712828901,COMPLETE
497,0.8621318340301514,2023-09-04 01:06:19.156443,2023-09-04 01:06:19.640691,0 days 00:00:00.484248,Sigmoid,,,,12,10,,,,0.0059545780877571395,1,40,0.15982480640847185,9.182660548835044e-05,COMPLETE
498,0.8460491299629211,2023-09-04 01:06:19.641019,2023-09-04 01:06:19.960342,0 days 00:00:00.319323,Sigmoid,,,,30,22,,,,2.1463816184922156e-05,1,60,0.13234201732527962,0.0001276672432515502,COMPLETE
499,0.36019158363342285,2023-09-04 01:06:19.960657,2023-09-04 01:06:20.819195,0 days 00:00:00.858538,Tanh,Leaky,Sigmoid,,12,11,23.0,4.0,,0.01695926421403681,3,60,0.11817291774176286,0.000684905221391876,COMPLETE
