number,value,datetime_start,datetime_complete,duration,params_activation1,params_activation2,params_activation3,params_activation4,params_batch_size,params_fl1,params_fl2,params_fl3,params_fl4,params_learning_rate,params_n_layers,params_num_epochs,params_train_size,params_weight_decay,state
0,0.1963101476430893,2023-09-03 23:49:14.356782,2023-09-03 23:49:16.930051,0 days 00:00:02.573269,Sigmoid,Sigmoid,Tanh,,30,9,7.0,3.0,,0.0009180437361663629,3,80,0.20425214273450118,0.0003561405604582129,COMPLETE
1,0.23357033729553223,2023-09-03 23:49:16.930568,2023-09-03 23:49:18.374774,0 days 00:00:01.444206,Sigmoid,,,,30,23,,,,0.051551010463501204,1,40,0.3600052864614343,0.02213287071971982,COMPLETE
2,0.9373146295547485,2023-09-03 23:49:18.375242,2023-09-03 23:49:19.362272,0 days 00:00:00.987030,Leaky,Sigmoid,,,30,21,7.0,,,2.6223617124020064e-05,2,40,0.19011733812202256,0.0008488668071613806,COMPLETE
3,0.16280442476272583,2023-09-03 23:49:19.362746,2023-09-03 23:49:27.044201,0 days 00:00:07.681455,Sigmoid,Leaky,Tanh,,12,13,11.0,23.0,,0.0010202156636572653,3,80,0.27355095876667185,1.4108182330359155e-05,COMPLETE
4,0.26460176706314087,2023-09-03 23:49:27.044675,2023-09-03 23:49:40.381678,0 days 00:00:13.337003,Tanh,Tanh,,,4,18,10.0,,,2.148100210554328e-05,2,60,0.2834589322710934,8.250864721459919e-05,COMPLETE
5,0.8625236749649048,2023-09-03 23:49:40.382149,2023-09-03 23:49:46.051478,0 days 00:00:05.669329,ReLU,Leaky,Leaky,,10,9,21.0,5.0,,1.8769016384276398e-05,3,40,0.3470941881531167,0.00428677687658199,COMPLETE
6,0.9583532810211182,2023-09-03 23:49:46.051980,2023-09-03 23:49:48.404308,0 days 00:00:02.352328,Sigmoid,ReLU,Tanh,Sigmoid,30,1,21.0,14.0,21.0,6.598307602319691e-05,4,60,0.21243890827594616,0.027519986411781043,COMPLETE
7,1.0707042217254639,2023-09-03 23:49:48.404826,2023-09-03 23:49:52.719707,0 days 00:00:04.314881,Sigmoid,Tanh,Leaky,Sigmoid,8,6,9.0,14.0,4.0,1.1443798430151405e-05,4,40,0.1801766435292151,0.011994400499594491,COMPLETE
8,0.24327318370342255,2023-09-03 23:49:52.720193,2023-09-03 23:49:56.923428,0 days 00:00:04.203235,ReLU,,,,8,1,,,,0.0019318255361680458,1,100,0.1396484625566262,9.486620243695096e-05,COMPLETE
9,0.9352051019668579,2023-09-03 23:49:56.923857,2023-09-03 23:49:58.091335,0 days 00:00:01.167478,ReLU,Tanh,Leaky,Tanh,30,23,14.0,16.0,9.0,1.598734329081777e-05,4,40,0.15703853459699518,0.020163932897142432,COMPLETE
10,0.12556234002113342,2023-09-03 23:49:58.091795,2023-09-03 23:50:15.346112,0 days 00:00:17.254317,Leaky,Leaky,ReLU,,12,15,2.0,23.0,,0.0004214238833904732,3,80,0.6255917224629213,2.0132456391548983e-05,COMPLETE
11,0.11606737226247787,2023-09-03 23:50:15.346581,2023-09-03 23:50:32.694230,0 days 00:00:17.347649,Leaky,Leaky,ReLU,,12,16,2.0,24.0,,0.0004971973578196745,3,80,0.6183111251665409,1.1334445244358513e-05,COMPLETE
12,0.13353870809078217,2023-09-03 23:50:32.694694,2023-09-03 23:50:53.833349,0 days 00:00:21.138655,Leaky,Leaky,ReLU,,12,16,2.0,24.0,,0.00020379017137599027,3,80,0.7635568976640604,1.0682522349466251e-05,COMPLETE
13,0.15080752968788147,2023-09-03 23:50:53.833810,2023-09-03 23:51:08.569053,0 days 00:00:14.735243,Leaky,Leaky,,,12,16,1.0,,,0.00033050221758924484,2,80,0.667591489227481,2.4195171785462182e-05,COMPLETE
14,0.11322021484375,2023-09-03 23:51:08.569497,2023-09-03 23:51:19.713468,0 days 00:00:11.143971,Leaky,Leaky,ReLU,,16,12,4.0,20.0,,0.004079316193611464,3,80,0.5145192047401224,7.902035069166356e-05,COMPLETE
15,0.11096272617578506,2023-09-03 23:51:19.713910,2023-09-03 23:51:30.545415,0 days 00:00:10.831505,Leaky,ReLU,,,16,10,5.0,,,0.00495971312820003,2,100,0.5037330887346632,6.586135109336156e-05,COMPLETE
16,0.11551498621702194,2023-09-03 23:51:30.545837,2023-09-03 23:51:41.073263,0 days 00:00:10.527426,Tanh,ReLU,,,16,9,15.0,,,0.0056946884576529865,2,100,0.4842476018433174,9.332784972680301e-05,COMPLETE
17,0.13596977293491364,2023-09-03 23:51:41.073688,2023-09-03 23:51:48.215266,0 days 00:00:07.141578,Leaky,,,,16,5,,,,0.005957938225589774,1,100,0.43502776924066205,0.0003194180020453309,COMPLETE
18,0.2425999790430069,2023-09-03 23:51:48.215675,2023-09-03 23:52:04.591907,0 days 00:00:16.376232,Leaky,ReLU,,,2,12,7.0,,,0.018401865414825087,2,100,0.10022678773226285,0.07015027125050739,COMPLETE
19,0.15638597309589386,2023-09-03 23:52:04.592345,2023-09-03 23:52:15.126934,0 days 00:00:10.534589,Leaky,ReLU,,,16,11,5.0,,,0.09239957952940903,2,100,0.49584910677862337,4.703575383059073e-05,COMPLETE
20,0.13912837207317352,2023-09-03 23:52:15.127374,2023-09-03 23:52:22.680925,0 days 00:00:07.553551,Tanh,,,,16,5,,,,0.004054553464014035,1,60,0.7750718292872275,0.00024394100689090667,COMPLETE
21,0.12349867820739746,2023-09-03 23:52:22.681344,2023-09-03 23:52:33.553909,0 days 00:00:10.872565,Tanh,ReLU,,,16,8,16.0,,,0.008513728454110043,2,100,0.5062816380699109,5.8000899719477984e-05,COMPLETE
22,0.11938632279634476,2023-09-03 23:52:33.554348,2023-09-03 23:52:44.478566,0 days 00:00:10.924218,Tanh,ReLU,,,16,10,16.0,,,0.002921121063987347,2,100,0.5048899381751236,0.0001460993070494872,COMPLETE
23,0.11557766050100327,2023-09-03 23:52:44.478999,2023-09-03 23:52:53.760606,0 days 00:00:09.281607,Tanh,ReLU,,,16,13,14.0,,,0.012132560085362678,2,100,0.41614919936569833,3.440499640050558e-05,COMPLETE
24,0.11741472780704498,2023-09-03 23:52:53.761045,2023-09-03 23:53:07.655270,0 days 00:00:13.894225,Tanh,ReLU,Sigmoid,,16,7,5.0,18.0,,0.02167846754874465,3,100,0.5252855712665966,0.00012000108469372612,COMPLETE
25,0.14108426868915558,2023-09-03 23:53:07.655726,2023-09-03 23:54:39.327177,0 days 00:01:31.671451,Leaky,ReLU,,,2,3,18.0,,,0.004931710713554338,2,100,0.5917251194811018,5.284670430915016e-05,COMPLETE
26,0.11722587794065475,2023-09-03 23:54:39.327623,2023-09-03 23:54:50.083840,0 days 00:00:10.756217,Leaky,,,,10,14,,,,0.0023110800424539805,1,100,0.4234480544923256,2.9250046771510384e-05,COMPLETE
27,0.11122863739728928,2023-09-03 23:54:50.084252,2023-09-03 23:55:46.107710,0 days 00:00:56.023458,Tanh,Sigmoid,Sigmoid,,4,11,24.0,9.0,,0.008431643989728243,3,80,0.7159831749976979,0.0006664362648717249,COMPLETE
28,0.12379243969917297,2023-09-03 23:55:46.108156,2023-09-03 23:56:24.614400,0 days 00:00:38.506244,ReLU,Sigmoid,Sigmoid,Leaky,4,19,24.0,8.0,24.0,0.012052478373085967,4,80,0.6805895393232716,0.0006142176501925798,COMPLETE
29,0.12710286676883698,2023-09-03 23:56:24.614691,2023-09-03 23:56:39.488246,0 days 00:00:14.873555,Leaky,Sigmoid,Sigmoid,,4,11,5.0,9.0,,0.0014557658496277008,3,80,0.5903006267984118,0.0018195111910460607,COMPLETE
30,0.1214725449681282,2023-09-03 23:56:39.488529,2023-09-03 23:57:05.553061,0 days 00:00:26.064532,Tanh,Sigmoid,ReLU,ReLU,4,10,24.0,19.0,15.0,0.0032862259679716185,4,80,0.7666023435446209,0.00019539532746835444,COMPLETE
31,0.1260659098625183,2023-09-03 23:57:05.553342,2023-09-03 23:57:14.821778,0 days 00:00:09.268436,Tanh,Sigmoid,Sigmoid,,16,8,21.0,10.0,,0.006681464865564126,3,80,0.5152877137192485,0.0003928388518134469,COMPLETE
32,0.12617246806621552,2023-09-03 23:57:14.822239,2023-09-03 23:57:29.662190,0 days 00:00:14.839951,Tanh,ReLU,ReLU,,16,12,19.0,12.0,,0.027852116956932422,3,80,0.567875160624454,0.00016650889634730476,COMPLETE
33,0.11858140677213669,2023-09-03 23:57:29.662676,2023-09-03 23:57:51.886319,0 days 00:00:22.223643,Tanh,ReLU,,,4,9,12.0,,,0.007701949228735406,2,60,0.7119113506041223,8.059866865815717e-05,COMPLETE
34,0.1597769856452942,2023-09-03 23:57:51.886587,2023-09-03 23:57:54.472333,0 days 00:00:02.585746,Sigmoid,Leaky,,,16,14,4.0,,,0.0013968231894597493,2,80,0.4588499250404812,0.00047410572641438595,COMPLETE
35,0.13879308104515076,2023-09-03 23:57:54.472611,2023-09-03 23:57:59.121684,0 days 00:00:04.649073,Tanh,Sigmoid,Sigmoid,,16,11,8.0,20.0,,0.0031173404825749805,3,100,0.37461787826215326,0.0012270643062906874,COMPLETE
36,0.12201090902090073,2023-09-03 23:57:59.122137,2023-09-03 23:58:09.663133,0 days 00:00:10.540996,Leaky,Sigmoid,,,10,7,4.0,,,0.035750715612389385,2,80,0.6677213398444871,0.00025825682577660893,COMPLETE
37,0.13109414279460907,2023-09-03 23:58:09.663403,2023-09-03 23:58:16.951363,0 days 00:00:07.287960,Tanh,Tanh,ReLU,,4,9,7.0,5.0,,0.014019940240262221,3,60,0.3634924572856796,0.00010798824347129186,COMPLETE
38,0.20826591551303864,2023-09-03 23:58:16.951635,2023-09-03 23:58:20.897791,0 days 00:00:03.946156,Sigmoid,Sigmoid,Sigmoid,,8,14,13.0,1.0,,0.0008996749769726885,3,40,0.5572230227684319,6.22772195376699e-05,COMPLETE
39,0.11817753314971924,2023-09-03 23:58:20.898073,2023-09-03 23:58:37.823485,0 days 00:00:16.925412,ReLU,Leaky,,,2,10,11.0,,,0.00496597431112227,2,100,0.29462296008936517,0.0007188497377298754,COMPLETE
40,0.10985752940177917,2023-09-03 23:58:37.823768,2023-09-03 23:58:38.974425,0 days 00:00:01.150657,Leaky,ReLU,Sigmoid,Tanh,30,18,17.0,11.0,1.0,0.009333681990583702,4,40,0.4754859401925249,0.0001622487863329683,COMPLETE
41,0.11520426720380783,2023-09-03 23:58:38.974715,2023-09-03 23:58:40.087320,0 days 00:00:01.112605,Leaky,ReLU,Sigmoid,Tanh,30,18,16.0,7.0,1.0,0.009911257883159089,4,40,0.4621495116747156,0.00015719149796300313,COMPLETE
42,0.12393172830343246,2023-09-03 23:58:40.087616,2023-09-03 23:58:41.048385,0 days 00:00:00.960769,Leaky,ReLU,Sigmoid,Tanh,30,19,19.0,7.0,2.0,0.009650389985141552,4,40,0.39867385108442116,0.0002215706721800121,COMPLETE
43,0.12184511125087738,2023-09-03 23:58:41.048670,2023-09-03 23:58:42.154028,0 days 00:00:01.105358,Leaky,ReLU,Sigmoid,Tanh,30,21,17.0,11.0,1.0,0.01698967340323972,4,40,0.4511748839543429,0.00016816185232462167,COMPLETE
44,0.12099674344062805,2023-09-03 23:58:42.154320,2023-09-03 23:58:42.945291,0 days 00:00:00.790971,Leaky,ReLU,Sigmoid,Tanh,30,18,20.0,7.0,9.0,0.010672089981748487,4,40,0.31816986922482393,0.00038532186001708965,COMPLETE
45,0.12716154754161835,2023-09-03 23:58:42.945592,2023-09-03 23:58:44.313394,0 days 00:00:01.367802,Leaky,Tanh,Sigmoid,Tanh,30,24,22.0,13.0,6.0,0.03065414925454773,4,40,0.5640974597121204,1.9394477922507692e-05,COMPLETE
46,0.11477246135473251,2023-09-03 23:58:44.313721,2023-09-03 23:58:45.452198,0 days 00:00:01.138477,Leaky,Leaky,Sigmoid,ReLU,30,21,10.0,5.0,15.0,0.0038191124246208233,4,40,0.4664552661500125,0.00013297095249124936,COMPLETE
47,0.12775181233882904,2023-09-03 23:58:45.452498,2023-09-03 23:58:46.420777,0 days 00:00:00.968279,Leaky,Leaky,Sigmoid,ReLU,30,21,10.0,5.0,15.0,0.0020912984974862307,4,40,0.39273994014777336,3.72325777528099e-05,COMPLETE
48,0.11305015534162521,2023-09-03 23:58:46.421075,2023-09-03 23:58:50.758413,0 days 00:00:04.337338,Leaky,Leaky,Sigmoid,,8,20,9.0,16.0,,0.00424519761093148,3,40,0.6138975722918695,8.794583784692624e-05,COMPLETE
49,0.11102622747421265,2023-09-03 23:58:50.758714,2023-09-03 23:58:57.718914,0 days 00:00:06.960200,Sigmoid,Leaky,ReLU,,8,17,6.0,16.0,,0.006451039847216789,3,40,0.6318393699734345,7.468929120201155e-05,COMPLETE
50,0.13383466005325317,2023-09-03 23:58:57.719213,2023-09-03 23:59:01.799464,0 days 00:00:04.080251,Sigmoid,Leaky,Tanh,,8,17,8.0,16.0,,0.006159646898349918,3,40,0.6159739343041999,7.12258606923684e-05,COMPLETE
51,0.12210371345281601,2023-09-03 23:59:01.799761,2023-09-03 23:59:06.527276,0 days 00:00:04.727515,Sigmoid,Leaky,ReLU,,8,20,6.0,16.0,,0.004515121933950624,3,40,0.7093944894242767,7.98846697398584e-05,COMPLETE
52,0.1252795159816742,2023-09-03 23:59:06.527579,2023-09-03 23:59:10.756222,0 days 00:00:04.228643,Sigmoid,Leaky,ReLU,,8,22,4.0,20.0,,0.00858191689245054,3,40,0.6342157312712393,4.394722715328444e-05,COMPLETE
53,0.1336633712053299,2023-09-03 23:59:10.756526,2023-09-03 23:59:14.266233,0 days 00:00:03.509707,Sigmoid,Leaky,ReLU,,8,15,3.0,17.0,,0.0025571672613730802,3,40,0.5341183376830229,8.9126854219989e-05,COMPLETE
54,0.11223187297582626,2023-09-03 23:59:14.266526,2023-09-03 23:59:24.745841,0 days 00:00:10.479315,Leaky,Leaky,Tanh,,8,17,6.0,21.0,,0.015594829076242187,3,80,0.7978098503825534,1.63105921396509e-05,COMPLETE
55,0.11292625218629837,2023-09-03 23:59:24.746133,2023-09-03 23:59:29.898668,0 days 00:00:05.152535,ReLU,Leaky,Tanh,,8,17,8.0,14.0,,0.01577798726105529,3,40,0.7818778751522377,1.6020446448924937e-05,COMPLETE
56,0.12897557020187378,2023-09-03 23:59:29.898961,2023-09-03 23:59:40.364160,0 days 00:00:10.465199,ReLU,Leaky,Tanh,,8,17,6.0,14.0,,0.018791684014003267,3,80,0.7955500933103817,1.53057050742456e-05,COMPLETE
57,0.27287429571151733,2023-09-03 23:59:40.364455,2023-09-03 23:59:47.536924,0 days 00:00:07.172469,ReLU,Tanh,Tanh,,8,17,7.0,12.0,,0.05294254534523883,3,60,0.7349113631548593,2.4466106631750046e-05,COMPLETE
58,0.13858212530612946,2023-09-03 23:59:47.537215,2023-09-03 23:59:52.766226,0 days 00:00:05.229011,ReLU,Leaky,Tanh,,8,15,6.0,10.0,,0.016867399307455913,3,40,0.7988647434038398,1.3535613522019812e-05,COMPLETE
59,0.10710373520851135,2023-09-03 23:59:52.766526,2023-09-03 23:59:59.156356,0 days 00:00:06.389830,ReLU,Leaky,Tanh,,12,16,8.0,14.0,,0.012618075596514214,3,80,0.7133887012059466,3.0279036755056378e-05,COMPLETE
60,0.11521772295236588,2023-09-03 23:59:59.156636,2023-09-04 00:00:05.111740,0 days 00:00:05.955104,Sigmoid,Sigmoid,Leaky,,12,16,1.0,21.0,,0.00690718294298101,3,80,0.6714440419287585,1.0761596676822941e-05,COMPLETE
61,0.10708330571651459,2023-09-04 00:00:05.112032,2023-09-04 00:00:11.647178,0 days 00:00:06.535146,ReLU,Leaky,Tanh,,12,19,8.0,13.0,,0.01301054582239002,3,80,0.7203315524687498,3.228921799829888e-05,COMPLETE
62,0.12951356172561646,2023-09-04 00:00:11.647479,2023-09-04 00:00:18.273508,0 days 00:00:06.626029,ReLU,Leaky,Tanh,,12,19,3.0,13.0,,0.012889116357528208,3,80,0.7276936686880477,3.092907553455147e-05,COMPLETE
63,0.11263547837734222,2023-09-04 00:00:18.273800,2023-09-04 00:00:24.095171,0 days 00:00:05.821371,ReLU,Leaky,Tanh,,12,13,9.0,11.0,,0.007838214014526565,3,80,0.6473205716380398,4.8791621593340596e-05,COMPLETE
64,0.12041476368904114,2023-09-04 00:00:24.095463,2023-09-04 00:00:30.298266,0 days 00:00:06.202803,ReLU,Leaky,Tanh,,12,15,23.0,15.0,,0.021882140601201725,3,80,0.6830921187053585,2.4389970432195695e-05,COMPLETE
65,0.10414490103721619,2023-09-04 00:00:30.298560,2023-09-04 00:00:35.613902,0 days 00:00:05.315342,ReLU,Leaky,,,12,18,6.0,,,0.011997166349116363,2,80,0.7238966528088274,4.4013278104926986e-05,COMPLETE
66,0.11705078929662704,2023-09-04 00:00:35.614185,2023-09-04 00:00:40.901967,0 days 00:00:05.287782,ReLU,ReLU,,,12,20,9.0,,,0.010917382864896519,2,80,0.720010534711283,3.8959591630045055e-05,COMPLETE
67,0.11023678630590439,2023-09-04 00:00:40.902240,2023-09-04 00:00:45.349683,0 days 00:00:04.447443,ReLU,Leaky,,,12,18,5.0,,,0.006116736857213698,2,80,0.6023309629227507,5.5325748735782016e-05,COMPLETE
68,0.12665005028247833,2023-09-04 00:00:45.349956,2023-09-04 00:00:48.695345,0 days 00:00:03.345389,ReLU,,,,12,19,,,,0.006039468540389692,1,80,0.5843980467522556,3.176530113424592e-05,COMPLETE
69,0.11441763490438461,2023-09-04 00:00:48.695628,2023-09-04 00:00:53.389092,0 days 00:00:04.693464,ReLU,Leaky,,,12,18,5.0,,,0.005236388870793481,2,80,0.6348889717092051,5.65597318749373e-05,COMPLETE
70,0.12712103128433228,2023-09-04 00:00:53.389370,2023-09-04 00:01:01.279753,0 days 00:00:07.890383,ReLU,Leaky,,,12,16,7.0,,,0.003318605202561827,2,80,0.546547647742668,4.590902677594649e-05,COMPLETE
71,0.1165633350610733,2023-09-04 00:01:01.280198,2023-09-04 00:01:07.840193,0 days 00:00:06.559995,ReLU,Leaky,,,12,18,3.0,,,0.008475404612642966,2,80,0.603822258851655,6.096100810365863e-05,COMPLETE
72,0.11747977882623672,2023-09-04 00:01:07.840459,2023-09-04 00:01:12.817689,0 days 00:00:04.977230,ReLU,Sigmoid,,,12,20,5.0,,,0.0121338475981081,2,80,0.6777780371646253,0.00012466136431059767,COMPLETE
73,0.0990905910730362,2023-09-04 00:01:12.817961,2023-09-04 00:01:19.142809,0 days 00:00:06.324848,ReLU,Leaky,,,10,12,11.0,,,0.0069248663104712616,2,80,0.7257914735579758,2.2899285536709615e-05,COMPLETE
74,0.11063668876886368,2023-09-04 00:01:19.143085,2023-09-04 00:01:27.399645,0 days 00:00:08.256560,ReLU,Leaky,,,10,16,13.0,,,0.006337325314860937,2,80,0.7466144546360726,3.022598290809552e-05,COMPLETE
75,0.12377765029668808,2023-09-04 00:01:27.399931,2023-09-04 00:01:34.434843,0 days 00:00:07.034912,ReLU,Leaky,,,10,14,13.0,,,0.023021425581121666,2,80,0.7350183214466203,2.8504686723595558e-05,COMPLETE
76,0.11776022613048553,2023-09-04 00:01:34.435118,2023-09-04 00:01:40.922949,0 days 00:00:06.487831,ReLU,Leaky,,,10,12,11.0,,,0.013037682925695087,2,80,0.7497024569271633,2.1197572444978756e-05,COMPLETE
77,0.11539848148822784,2023-09-04 00:01:40.923225,2023-09-04 00:01:45.992685,0 days 00:00:05.069460,ReLU,Leaky,,,10,19,12.0,,,0.004815546033570161,2,80,0.5775475734641328,4.5532633356437795e-05,COMPLETE
78,0.10894379019737244,2023-09-04 00:01:45.992963,2023-09-04 00:01:51.967715,0 days 00:00:05.974752,ReLU,ReLU,,,10,13,14.0,,,0.009829933064254169,2,80,0.6904106599924297,3.7617027816369714e-05,COMPLETE
79,0.12129852920770645,2023-09-04 00:01:51.967989,2023-09-04 00:01:56.597897,0 days 00:00:04.629908,ReLU,,,,10,13,,,,0.009483856377249252,1,80,0.6975370356988602,3.8204984348473204e-05,COMPLETE
80,0.10462378710508347,2023-09-04 00:01:56.598160,2023-09-04 00:02:02.359599,0 days 00:00:05.761439,ReLU,Tanh,,,10,15,15.0,,,0.007623049371253303,2,80,0.6622945957498049,2.0985759516868543e-05,COMPLETE
81,0.0960611030459404,2023-09-04 00:02:02.359880,2023-09-04 00:02:08.967553,0 days 00:00:06.607673,ReLU,Tanh,,,10,15,15.0,,,0.010751014410350443,2,80,0.7565955332736684,2.0336263907358314e-05,COMPLETE
82,0.110663503408432,2023-09-04 00:02:08.967832,2023-09-04 00:02:14.682622,0 days 00:00:05.714790,ReLU,Tanh,,,10,15,15.0,,,0.015575437868553591,2,80,0.6538048370966466,2.0331301208316426e-05,COMPLETE
83,0.11401356011629105,2023-09-04 00:02:14.682911,2023-09-04 00:02:20.602428,0 days 00:00:05.919517,ReLU,Tanh,,,10,14,15.0,,,0.012687239027846698,2,80,0.6768782232397299,1.2541877333315906e-05,COMPLETE
84,0.11897732317447662,2023-09-04 00:02:20.602712,2023-09-04 00:02:26.642124,0 days 00:00:06.039412,ReLU,Tanh,,,10,13,17.0,,,0.010121787128193938,2,80,0.6978363156657866,2.400794156762746e-05,COMPLETE
85,0.11813225597143173,2023-09-04 00:02:26.642423,2023-09-04 00:02:35.458403,0 days 00:00:08.815980,ReLU,Tanh,,,10,18,17.0,,,0.007522861713387245,2,80,0.7623703076728714,1.041622980139945e-05,COMPLETE
86,0.13541211187839508,2023-09-04 00:02:35.458674,2023-09-04 00:03:08.643156,0 days 00:00:33.184482,ReLU,Tanh,,,2,16,14.0,,,0.02051396613965868,2,80,0.6314430320817002,1.7543960841445604e-05,COMPLETE
87,0.12482709437608719,2023-09-04 00:03:08.643461,2023-09-04 00:03:12.445558,0 days 00:00:03.802097,ReLU,Tanh,,,10,15,14.0,,,0.02363646199441727,2,60,0.5841404503526335,3.936905569861556e-05,COMPLETE
88,0.10948862135410309,2023-09-04 00:03:12.445844,2023-09-04 00:03:17.213753,0 days 00:00:04.767909,ReLU,ReLU,,,12,14,16.0,,,0.0038179461497832934,2,80,0.6544399354267307,1.9731733322075753e-05,COMPLETE
89,0.13884791731834412,2023-09-04 00:03:17.214039,2023-09-04 00:03:22.845019,0 days 00:00:05.630980,ReLU,ReLU,,,10,14,16.0,,,0.00950060492374622,2,80,0.6537981375365678,1.2995487400073343e-05,COMPLETE
90,0.11717537045478821,2023-09-04 00:03:22.845298,2023-09-04 00:03:26.756084,0 days 00:00:03.910786,ReLU,,,,12,12,,,,0.0041154067666020295,1,80,0.5455511977276668,1.967674290259352e-05,COMPLETE
91,0.10641323029994965,2023-09-04 00:03:26.756355,2023-09-04 00:03:34.745608,0 days 00:00:07.989253,ReLU,ReLU,,,12,16,18.0,,,0.007444149079250482,2,80,0.7073190750480409,2.5557085388025124e-05,COMPLETE
92,0.10503817349672318,2023-09-04 00:03:34.745887,2023-09-04 00:03:44.562411,0 days 00:00:09.816524,ReLU,ReLU,,,12,16,19.0,,,0.007772887713918717,2,80,0.7570506176557243,2.6027430021507613e-05,COMPLETE
93,0.10926015675067902,2023-09-04 00:03:44.562685,2023-09-04 00:03:50.589456,0 days 00:00:06.026771,ReLU,ReLU,,,12,16,18.0,,,0.007136151825380645,2,80,0.7623042935388527,2.681785299211714e-05,COMPLETE
94,0.1190536767244339,2023-09-04 00:03:50.589725,2023-09-04 00:03:58.896860,0 days 00:00:08.307135,ReLU,ReLU,,,12,16,19.0,,,0.007481594423177043,2,80,0.7668472052436534,2.6675955597855787e-05,COMPLETE
95,0.11874515563249588,2023-09-04 00:03:58.897137,2023-09-04 00:04:09.256975,0 days 00:00:10.359838,ReLU,ReLU,,,12,16,18.0,,,0.014333137439497299,2,80,0.7127726806137411,1.51807416932703e-05,COMPLETE
96,0.10505802929401398,2023-09-04 00:04:09.257250,2023-09-04 00:04:16.104990,0 days 00:00:06.847740,ReLU,ReLU,,,12,13,18.0,,,0.011376023787800813,2,80,0.7637524472138468,3.5508302754993126e-05,COMPLETE
97,0.11147880554199219,2023-09-04 00:04:16.105262,2023-09-04 00:04:21.252022,0 days 00:00:05.146760,ReLU,ReLU,,,12,13,20.0,,,0.011470921056671754,2,80,0.6995458469753472,3.365420052439914e-05,COMPLETE
98,0.10189740359783173,2023-09-04 00:04:21.252313,2023-09-04 00:04:30.256023,0 days 00:00:09.003710,ReLU,ReLU,,,10,11,15.0,,,0.017377110467557532,2,80,0.7426961060560217,2.255173489627295e-05,COMPLETE
99,0.11466632038354874,2023-09-04 00:04:30.256293,2023-09-04 00:04:36.123165,0 days 00:00:05.866872,ReLU,Tanh,,,12,15,11.0,,,0.018753546757156053,2,80,0.7962072471660695,2.300511615191177e-05,COMPLETE
100,0.11937932670116425,2023-09-04 00:04:36.123455,2023-09-04 00:04:44.017177,0 days 00:00:07.893722,ReLU,ReLU,,,10,11,20.0,,,0.025738329353293447,2,80,0.7528193357964544,1.7009466558209533e-05,COMPLETE
101,0.12764668464660645,2023-09-04 00:04:44.017456,2023-09-04 00:04:52.235040,0 days 00:00:08.217584,ReLU,ReLU,,,10,10,14.0,,,0.01723909957958804,2,80,0.7240695101355362,3.562731350643086e-05,COMPLETE
102,0.11800764501094818,2023-09-04 00:04:52.235313,2023-09-04 00:04:58.145396,0 days 00:00:05.910083,ReLU,ReLU,,,10,11,15.0,,,0.013820001162713376,2,80,0.6837235711493185,1.3570614282618064e-05,COMPLETE
