number,value,datetime_start,datetime_complete,duration,params_activation1,params_activation2,params_activation3,params_activation4,params_batch_size,params_fl1,params_fl2,params_fl3,params_fl4,params_learning_rate,params_n_layers,params_num_epochs,params_train_size,params_weight_decay,state
0,0.18315696716308594,2023-09-02 12:22:38.331452,2023-09-02 12:22:39.925737,0 days 00:00:01.594285,Leaky,Sigmoid,Tanh,,16,12,17.0,14.0,,0.010849005267379216,3,80,0.11163505981224009,0.045385857386913656,COMPLETE
1,0.11997469514608383,2023-09-02 12:22:39.926055,2023-09-02 12:22:41.397391,0 days 00:00:01.471336,Leaky,Leaky,Leaky,,8,7,19.0,12.0,,0.003609903848364029,3,40,0.11255848475082884,3.6890761719475406e-05,COMPLETE
2,0.17407730221748352,2023-09-02 12:22:41.397692,2023-09-02 12:22:45.383635,0 days 00:00:03.985943,ReLU,,,,2,23,,,,0.025143224140246483,1,40,0.13140300039296882,0.0012317171570461602,COMPLETE
3,0.9953277111053467,2023-09-02 12:22:45.383915,2023-09-02 12:22:49.196485,0 days 00:00:03.812570,ReLU,Sigmoid,Tanh,Sigmoid,16,8,16.0,22.0,6.0,0.04800711047879637,4,100,0.1751234087140309,0.014420156008790376,COMPLETE
4,0.35442134737968445,2023-09-02 12:22:49.196776,2023-09-02 12:22:53.310158,0 days 00:00:04.113382,Leaky,Leaky,ReLU,Tanh,12,5,17.0,7.0,2.0,4.108280089905122e-05,4,100,0.15646383666681088,7.7739787371594e-05,COMPLETE
5,0.13866202533245087,2023-09-02 12:22:53.310463,2023-09-02 12:23:03.100835,0 days 00:00:09.790372,Leaky,Sigmoid,,,8,21,22.0,,,0.00018747565987087893,2,60,0.6068356368349143,0.0027963751905474015,COMPLETE
6,0.11950470507144928,2023-09-02 12:23:03.101106,2023-09-02 12:23:22.732490,0 days 00:00:19.631384,ReLU,ReLU,Leaky,,4,21,16.0,3.0,,7.5657791851483e-05,3,100,0.3092601591162015,0.0005068344325954069,COMPLETE
7,0.1659257858991623,2023-09-02 12:23:22.732792,2023-09-02 12:23:30.493410,0 days 00:00:07.760618,Leaky,Sigmoid,Leaky,Leaky,12,10,15.0,9.0,22.0,6.970929353571011e-05,4,80,0.3645207316389372,0.004974416594682059,COMPLETE
8,0.23926907777786255,2023-09-02 12:23:30.493706,2023-09-02 12:23:33.029191,0 days 00:00:02.535485,Sigmoid,,,,10,5,,,,0.0073543785320508625,1,40,0.3879794333864206,0.04601418880914235,COMPLETE
9,0.1555827409029007,2023-09-02 12:23:33.029443,2023-09-02 12:23:39.490778,0 days 00:00:06.461335,Tanh,Tanh,Tanh,,8,12,23.0,19.0,,0.00011581171289102858,3,100,0.1982321264084024,0.0035988869397324628,COMPLETE
10,0.24364112317562103,2023-09-02 12:23:39.491042,2023-09-02 12:23:47.415718,0 days 00:00:07.924676,ReLU,ReLU,,,4,18,7.0,,,1.0793921060772868e-05,2,60,0.2594868229179298,0.00023770431397639435,COMPLETE
11,0.1608313024044037,2023-09-02 12:23:47.415982,2023-09-02 12:23:48.337824,0 days 00:00:00.921842,Sigmoid,Leaky,Leaky,,30,16,9.0,3.0,,0.0011257859809600096,3,40,0.22648418635431988,1.4882061067236975e-05,COMPLETE
12,0.4014408588409424,2023-09-02 12:23:48.338108,2023-09-02 12:23:54.784424,0 days 00:00:06.446316,Tanh,ReLU,Leaky,,4,16,1.0,1.0,,0.001127636928325401,3,100,0.10369463615578721,0.00026254857257676,COMPLETE
13,0.19387777149677277,2023-09-02 12:23:54.784706,2023-09-02 12:24:00.900543,0 days 00:00:06.115837,ReLU,Leaky,,,4,1,20.0,,,0.002959456008422741,2,40,0.3058768225088636,1.3753802743033238e-05,COMPLETE
14,0.12492503970861435,2023-09-02 12:24:00.900808,2023-09-02 12:24:05.914158,0 days 00:00:05.013350,Leaky,ReLU,Sigmoid,,8,24,11.0,14.0,,0.00040453476337459543,3,100,0.15085399791912713,6.654675478138948e-05,COMPLETE
15,0.20109175145626068,2023-09-02 12:24:05.914438,2023-09-02 12:24:07.753088,0 days 00:00:01.838650,ReLU,Tanh,,,10,7,20.0,,,0.08949366316494448,2,40,0.21052884454915866,0.0005590125645669056,COMPLETE
16,0.18825243413448334,2023-09-02 12:24:07.753351,2023-09-02 12:24:19.034319,0 days 00:00:11.280968,Sigmoid,ReLU,Leaky,ReLU,2,1,13.0,8.0,24.0,0.00033960693081090947,4,60,0.12675967036123004,6.60645422065028e-05,COMPLETE
17,0.09932861477136612,2023-09-02 12:24:19.034609,2023-09-02 12:24:21.334083,0 days 00:00:02.299474,Tanh,Leaky,Leaky,,30,19,19.0,18.0,,0.0021647326779793224,3,80,0.2806466443060531,0.0009207576799588481,COMPLETE
18,0.11322533339262009,2023-09-02 12:24:21.334354,2023-09-02 12:24:24.335533,0 days 00:00:03.001179,Tanh,Leaky,,,30,20,24.0,,,0.0006393762359962208,2,80,0.4448619601796188,0.0009350168105011293,COMPLETE
19,0.14267365634441376,2023-09-02 12:24:24.335794,2023-09-02 12:24:26.988890,0 days 00:00:02.653096,Tanh,,,,30,18,,,,0.0006055882793838758,1,80,0.4997331954213837,0.0014223761448014561,COMPLETE
20,0.0963810384273529,2023-09-02 12:24:26.989139,2023-09-02 12:24:31.947506,0 days 00:00:04.958367,Tanh,Leaky,,,30,15,24.0,,,0.0020966042296096258,2,80,0.7449557726662892,0.0017365529619701812,COMPLETE
21,0.09619835019111633,2023-09-02 12:24:31.947756,2023-09-02 12:24:37.119235,0 days 00:00:05.171479,Tanh,Leaky,,,30,15,24.0,,,0.0020256914190616266,2,80,0.7773218625528161,0.0014464373896716056,COMPLETE
22,0.11672145873308182,2023-09-02 12:24:37.119488,2023-09-02 12:24:42.554485,0 days 00:00:05.434997,Tanh,Leaky,,,30,15,24.0,,,0.0021255098562857648,2,80,0.7777389477121842,0.008082750922772415,COMPLETE
23,0.11514496058225632,2023-09-02 12:24:42.554737,2023-09-02 12:24:47.374689,0 days 00:00:04.819952,Tanh,Leaky,,,30,14,21.0,,,0.0020048804963821412,2,80,0.7228557086050866,0.00201561902813539,COMPLETE
24,0.12776008248329163,2023-09-02 12:24:47.374941,2023-09-02 12:24:50.581000,0 days 00:00:03.206059,Tanh,,,,30,18,,,,0.006079287993462465,1,80,0.6041061749650745,0.0020164861110581116,COMPLETE
25,0.1038268432021141,2023-09-02 12:24:50.581247,2023-09-02 12:24:54.827270,0 days 00:00:04.246023,Tanh,Leaky,,,30,14,24.0,,,0.013209947296056523,2,80,0.6353586431346949,0.0007260171683252822,COMPLETE
26,0.12448073923587799,2023-09-02 12:24:54.827569,2023-09-02 12:25:00.170226,0 days 00:00:05.342657,Tanh,Leaky,,,30,19,19.0,,,0.0015725328366697163,2,80,0.7943376419237692,0.004731592965936226,COMPLETE
27,0.12208029627799988,2023-09-02 12:25:00.170478,2023-09-02 12:25:03.278034,0 days 00:00:03.107556,Tanh,,,,30,10,,,,0.004655701209951724,1,80,0.5928040748680693,0.0003571978796860048,COMPLETE
28,0.10591130703687668,2023-09-02 12:25:03.278282,2023-09-02 12:25:07.441040,0 days 00:00:04.162758,Tanh,Leaky,Sigmoid,,30,16,22.0,24.0,,0.0027641008620770406,3,80,0.5120391585605468,0.0008186780888062062,COMPLETE
29,0.15903620421886444,2023-09-02 12:25:07.441303,2023-09-02 12:25:15.041575,0 days 00:00:07.600272,Tanh,Tanh,,,16,13,22.0,,,0.014250067183423462,2,80,0.6813158663425244,0.01593955641533497,COMPLETE
30,0.10945970565080643,2023-09-02 12:25:15.041831,2023-09-02 12:25:21.801314,0 days 00:00:06.759483,Tanh,Leaky,ReLU,,30,22,18.0,18.0,,0.004718560104877255,3,80,0.7983919553594164,0.0021006045530571078,COMPLETE
31,0.10808074474334717,2023-09-02 12:25:21.801575,2023-09-02 12:25:26.130800,0 days 00:00:04.329225,Tanh,Leaky,,,30,14,24.0,,,0.011993522069508041,2,80,0.6480884276926631,0.0007680194057967432,COMPLETE
32,0.09610483795404434,2023-09-02 12:25:26.131064,2023-09-02 12:25:30.754613,0 days 00:00:04.623549,Tanh,Leaky,,,30,11,24.0,,,0.009869087373657775,2,80,0.6946798665190783,0.001364311156874205,COMPLETE
33,0.12025788426399231,2023-09-02 12:25:30.754868,2023-09-02 12:26:26.866435,0 days 00:00:56.111567,Tanh,Leaky,ReLU,,2,11,21.0,18.0,,0.007553009546404039,3,80,0.5487684508127334,0.0012087911587498543,COMPLETE
34,0.10765041410923004,2023-09-02 12:26:26.866714,2023-09-02 12:26:34.963295,0 days 00:00:08.096581,Tanh,Leaky,,,16,17,21.0,,,0.003136843453488478,2,80,0.7079521686630211,0.001718764223202049,COMPLETE
35,0.13679452240467072,2023-09-02 12:26:34.963548,2023-09-02 12:26:40.076195,0 days 00:00:05.112647,Tanh,,,,12,9,,,,0.0012579658994003352,1,80,0.4559800976584047,0.003405076011464948,COMPLETE
36,0.12590721249580383,2023-09-02 12:26:40.076440,2023-09-02 12:26:43.639703,0 days 00:00:03.563263,Sigmoid,Leaky,,,30,12,23.0,,,0.022678659609282985,2,60,0.7110872930791697,0.0011990538361720301,COMPLETE
37,0.10352109372615814,2023-09-02 12:26:43.639957,2023-09-02 12:26:55.585579,0 days 00:00:11.945622,Tanh,Leaky,Sigmoid,,10,20,19.0,21.0,,0.0038278791908763926,3,80,0.5595639397842557,0.00040828467776853115,COMPLETE
38,0.09452774375677109,2023-09-02 12:26:55.585839,2023-09-02 12:27:01.911913,0 days 00:00:06.326074,Leaky,Leaky,Leaky,ReLU,30,13,5.0,16.0,13.0,0.0018743554343316608,4,80,0.6538944980047292,0.00019168191530989875,COMPLETE
39,0.12079297006130219,2023-09-02 12:27:01.912198,2023-09-02 12:27:09.315258,0 days 00:00:07.403060,Leaky,,,,12,11,,,,0.008158186884485082,1,80,0.6629587221597736,0.00019038767225680722,COMPLETE
40,0.11645986139774323,2023-09-02 12:27:09.315521,2023-09-02 12:27:13.594273,0 days 00:00:04.278752,Leaky,Sigmoid,ReLU,ReLU,30,13,4.0,11.0,13.0,0.0007479609621498375,4,60,0.5965499810486531,0.0001640275574394331,COMPLETE
41,0.10572539269924164,2023-09-02 12:27:13.594553,2023-09-02 12:27:20.653808,0 days 00:00:07.059255,Leaky,Leaky,Leaky,ReLU,30,15,14.0,16.0,14.0,0.002036487264063291,4,80,0.7417582933433854,0.00043810823902054743,COMPLETE
42,0.09962883591651917,2023-09-02 12:27:20.654097,2023-09-02 12:27:26.801650,0 days 00:00:06.147553,Leaky,Leaky,Leaky,Leaky,30,9,6.0,17.0,17.0,0.001705673850272501,4,80,0.6706354273359207,0.0006252611607523808,COMPLETE
43,0.10550060123205185,2023-09-02 12:27:26.801939,2023-09-02 12:27:31.602572,0 days 00:00:04.800633,Leaky,Leaky,,,30,11,10.0,,,0.004183496829656825,2,80,0.732784538682184,0.0027065987981071678,COMPLETE
44,0.11703404784202576,2023-09-02 12:27:31.602842,2023-09-02 12:28:12.767544,0 days 00:00:41.164702,Tanh,Leaky,Leaky,Sigmoid,2,6,1.0,15.0,8.0,0.0009685183720212152,4,80,0.35641927354326663,0.0011836132951503525,COMPLETE
45,0.1403602957725525,2023-09-02 12:28:12.767830,2023-09-02 12:28:29.182377,0 days 00:00:16.414547,Sigmoid,Sigmoid,Leaky,,8,17,17.0,20.0,,0.005809148290824661,3,80,0.6318055747370619,0.0009437437166834756,COMPLETE
46,0.09290819615125656,2023-09-02 12:28:29.182651,2023-09-02 12:28:40.405866,0 days 00:00:11.223215,ReLU,Leaky,,,16,15,3.0,,,0.002767050428990952,2,100,0.797869539079559,0.0003088605058466632,COMPLETE
47,0.10285192728042603,2023-09-02 12:28:40.406121,2023-09-02 12:28:51.527262,0 days 00:00:11.121141,ReLU,Tanh,,,16,15,3.0,,,0.002670673971278162,2,100,0.7897341427161764,0.00014474361474013924,COMPLETE
48,0.09638763964176178,2023-09-02 12:28:51.527517,2023-09-02 12:29:01.216840,0 days 00:00:09.689323,ReLU,Leaky,,,16,12,5.0,,,0.00864840264888887,2,100,0.7018145849297281,0.0003061491631155591,COMPLETE
49,0.10222571343183517,2023-09-02 12:29:01.217094,2023-09-02 12:29:08.728364,0 days 00:00:07.511270,ReLU,Leaky,,,16,13,8.0,,,0.0014515598803569727,2,100,0.5406840619623708,0.0004884183030199548,COMPLETE
50,0.10163484513759613,2023-09-02 12:29:08.728619,2023-09-02 12:29:38.745920,0 days 00:00:30.017301,ReLU,Sigmoid,,,4,16,3.0,,,0.000979111603329227,2,100,0.593093046889116,0.00026305901855370843,COMPLETE
51,0.10346364229917526,2023-09-02 12:29:38.746193,2023-09-02 12:29:48.476675,0 days 00:00:09.730482,ReLU,Leaky,,,16,12,6.0,,,0.009570996851481228,2,100,0.697782533229103,0.0003205391778942183,COMPLETE
52,0.1031586080789566,2023-09-02 12:29:48.476935,2023-09-02 12:29:57.593739,0 days 00:00:09.116804,ReLU,Leaky,,,16,10,5.0,,,0.003543518853446148,2,100,0.6574066706080433,0.0001445436108673387,COMPLETE
53,0.11746637523174286,2023-09-02 12:29:57.593998,2023-09-02 12:30:07.998720,0 days 00:00:10.404722,ReLU,Leaky,,,16,14,3.0,,,0.020288718129469717,2,100,0.7402711345612597,0.0005463176011410188,COMPLETE
54,0.10391341894865036,2023-09-02 12:30:07.998973,2023-09-02 12:30:12.327675,0 days 00:00:04.328702,ReLU,Leaky,,,16,15,5.0,,,0.005483214598847431,2,40,0.7649881022192704,0.00011871703498178241,COMPLETE
55,0.13116949796676636,2023-09-02 12:30:12.327935,2023-09-02 12:30:26.564924,0 days 00:00:14.236989,ReLU,ReLU,,,10,8,1.0,,,0.04044162836625891,2,100,0.6820720423816388,0.00023369004046054281,COMPLETE
56,0.10313746333122253,2023-09-02 12:30:26.565210,2023-09-02 12:30:37.774612,0 days 00:00:11.209402,Leaky,Leaky,,,16,17,11.0,,,0.008843982141705918,2,100,0.7960687021182614,0.00011017937704922992,COMPLETE
57,0.1215462014079094,2023-09-02 12:30:37.774879,2023-09-02 12:30:42.835410,0 days 00:00:05.060531,ReLU,,,,8,12,,,,0.002841466682812638,1,40,0.6222685280103575,0.00032222426230331283,COMPLETE
58,0.13955818116664886,2023-09-02 12:30:42.835668,2023-09-02 12:30:55.873666,0 days 00:00:13.037998,Sigmoid,Tanh,,,12,13,8.0,,,0.006800601595021502,2,100,0.7200265622598734,0.001481737032067591,COMPLETE
59,0.14537915587425232,2023-09-02 12:30:55.873928,2023-09-02 12:31:24.718301,0 days 00:00:28.844373,ReLU,Leaky,,,4,3,2.0,,,0.0017871624987646079,2,100,0.5718466980731571,0.0005245714491204184,COMPLETE
60,0.09781591594219208,2023-09-02 12:31:24.718567,2023-09-02 12:32:02.058547,0 days 00:00:37.339980,Leaky,Leaky,,,2,10,23.0,,,0.004053251646435426,2,60,0.6270855170107468,8.076053403803045e-05,COMPLETE
61,0.10053157061338425,2023-09-02 12:32:02.058810,2023-09-02 12:32:39.092444,0 days 00:00:37.033634,Leaky,Leaky,,,2,10,23.0,,,0.0038198156505374666,2,60,0.6235111286552797,5.222197329956082e-05,COMPLETE
62,0.1020013839006424,2023-09-02 12:32:39.092713,2023-09-02 12:33:23.604138,0 days 00:00:44.511425,Leaky,Leaky,,,2,9,23.0,,,0.005496264156031423,2,60,0.7487711122192537,3.837899542461359e-05,COMPLETE
63,0.10047092288732529,2023-09-02 12:33:23.604409,2023-09-02 12:34:04.349894,0 days 00:00:40.745485,Leaky,Leaky,,,2,11,22.0,,,0.0024256784743525396,2,60,0.6789452647961639,9.586407082332992e-05,COMPLETE
64,0.10472849756479263,2023-09-02 12:34:04.350166,2023-09-02 12:34:06.980361,0 days 00:00:02.630195,Leaky,Leaky,,,30,14,23.0,,,0.0013360768101849689,2,60,0.5226613346675091,0.0001912778788570353,COMPLETE
65,0.13324075937271118,2023-09-02 12:34:06.980625,2023-09-02 12:34:41.375405,0 days 00:00:34.394780,Leaky,ReLU,,,2,7,24.0,,,0.014386433710409418,2,60,0.5700962641840573,0.0007150355866583569,COMPLETE
66,0.1301402747631073,2023-09-02 12:34:41.375669,2023-09-02 12:34:43.065705,0 days 00:00:01.690036,Tanh,,,,30,8,,,,0.003282161596312094,1,40,0.64065076429097,0.0003162462708495339,COMPLETE
67,0.11104964464902878,2023-09-02 12:34:43.065951,2023-09-02 12:34:49.554738,0 days 00:00:06.488787,Tanh,Leaky,Sigmoid,,16,12,5.0,6.0,,0.00464312086702835,3,80,0.47674535899024173,7.209859270958909e-05,COMPLETE
68,0.10834105312824249,2023-09-02 12:34:49.555006,2023-09-02 12:35:05.683978,0 days 00:00:16.128972,ReLU,Leaky,,,10,15,4.0,,,0.009670408470314059,2,100,0.7499389746840645,8.818842095391724e-05,COMPLETE
69,0.09642603248357773,2023-09-02 12:35:05.684245,2023-09-02 12:35:10.371621,0 days 00:00:04.687376,Tanh,Leaky,,,30,14,22.0,,,0.001763051522953001,2,80,0.6943046041415166,0.0009969063752199988,COMPLETE
70,0.12008406221866608,2023-09-02 12:35:10.371882,2023-09-02 12:35:16.035275,0 days 00:00:05.663393,Tanh,Sigmoid,Tanh,,30,13,20.0,10.0,,0.0020304157443201457,3,80,0.704684015705214,0.0010745920413094984,COMPLETE
71,0.11153923720121384,2023-09-02 12:35:16.035541,2023-09-02 12:35:20.117407,0 days 00:00:04.081866,Tanh,Leaky,,,30,16,24.0,,,0.0026475190156615576,2,80,0.6083400979262642,0.0014891208056587815,COMPLETE
72,0.1096901074051857,2023-09-02 12:35:20.117670,2023-09-02 12:35:25.447476,0 days 00:00:05.329806,Tanh,Leaky,,,30,14,22.0,,,0.0014437666915776077,2,80,0.793109620075693,0.002096782296625365,COMPLETE
73,0.09783362597227097,2023-09-02 12:35:25.447738,2023-09-02 12:35:29.931652,0 days 00:00:04.483914,Tanh,Leaky,,,30,16,23.0,,,0.0022925308803948175,2,80,0.6652656855173635,0.0006718407268511563,COMPLETE
74,0.09928660839796066,2023-09-02 12:35:29.931918,2023-09-02 12:35:34.646691,0 days 00:00:04.714773,Tanh,Leaky,,,30,12,21.0,,,0.0037107045043207358,2,80,0.7034662422707085,0.00040224469855623874,COMPLETE
75,0.11263890564441681,2023-09-02 12:35:34.646956,2023-09-02 12:35:39.500144,0 days 00:00:04.853188,Sigmoid,Leaky,,,30,11,15.0,,,0.0017321762282042452,2,80,0.7313046525614044,0.0008473078715312846,COMPLETE
76,0.10932470113039017,2023-09-02 12:35:39.500404,2023-09-02 12:35:49.845675,0 days 00:00:10.345271,Tanh,Leaky,,,8,17,24.0,,,0.0008687833821859681,2,60,0.6426042591502321,0.0024650791912597687,COMPLETE
77,0.12406278401613235,2023-09-02 12:35:49.845944,2023-09-02 12:35:56.452834,0 days 00:00:06.606890,Leaky,,,,12,10,,,,0.007126583708674799,1,80,0.5905799680174594,0.001591184193667684,COMPLETE
78,0.12509620189666748,2023-09-02 12:35:56.453089,2023-09-02 12:36:00.077621,0 days 00:00:03.624532,Tanh,Tanh,,,30,14,22.0,,,0.0005733359883925196,2,80,0.5364818567835933,0.0010250867388810036,COMPLETE
79,0.10775140672922134,2023-09-02 12:36:00.077878,2023-09-02 12:37:00.248479,0 days 00:01:00.170601,Leaky,Leaky,,,2,15,7.0,,,0.0012831064995846577,2,80,0.7575082872655624,0.0034998568802390305,COMPLETE
80,0.09979159384965897,2023-09-02 12:37:00.248737,2023-09-02 12:37:08.950952,0 days 00:00:08.702215,Tanh,ReLU,Sigmoid,,16,13,21.0,24.0,,0.001108336548718233,3,100,0.5009806562229895,0.00025956347792875325,COMPLETE
81,0.10076300799846649,2023-09-02 12:37:08.951225,2023-09-02 12:37:13.497207,0 days 00:00:04.545982,Tanh,Leaky,,,30,15,23.0,,,0.003110210342563441,2,80,0.6802062788378413,0.0006547801211198792,COMPLETE
82,0.10778019577264786,2023-09-02 12:37:13.497468,2023-09-02 12:37:17.916220,0 days 00:00:04.418752,Tanh,Leaky,,,30,16,23.0,,,0.0022455810979224076,2,80,0.6565025137071664,0.0006220862491271246,COMPLETE
83,0.09874255210161209,2023-09-02 12:37:17.916489,2023-09-02 12:37:22.605999,0 days 00:00:04.689510,Tanh,Leaky,,,30,18,24.0,,,0.004693167731908203,2,80,0.6976768325622066,0.00046051397914213533,COMPLETE
84,0.10864739865064621,2023-09-02 12:37:22.606262,2023-09-02 12:37:27.708224,0 days 00:00:05.101962,Tanh,Leaky,,,30,16,20.0,,,0.0021808851143749735,2,80,0.7609282738455291,0.0008623024063406455,COMPLETE
85,0.1099843978881836,2023-09-02 12:37:27.708482,2023-09-02 12:37:33.098864,0 days 00:00:05.390382,ReLU,Leaky,,,30,19,22.0,,,0.0016632128282195275,2,80,0.7992406427975746,0.0017942659793429108,COMPLETE
86,0.11865925788879395,2023-09-02 12:37:33.099133,2023-09-02 12:37:56.181767,0 days 00:00:23.082634,Tanh,Leaky,,,4,11,2.0,,,0.006004836496861887,2,80,0.5685314470797883,0.0013256809716689919,COMPLETE
87,0.11049002408981323,2023-09-02 12:37:56.182046,2023-09-02 12:37:58.424562,0 days 00:00:02.242516,Tanh,Leaky,,,30,13,23.0,,,0.0024700995107365177,2,40,0.6602935897706299,0.0003919639803588647,COMPLETE
88,0.10458522289991379,2023-09-02 12:37:58.424824,2023-09-02 12:38:03.815842,0 days 00:00:05.391018,ReLU,Leaky,,,16,17,18.0,,,0.004208046627555326,2,60,0.6228830482419156,0.0011923645301056484,COMPLETE
89,0.11926820129156113,2023-09-02 12:38:03.816121,2023-09-02 12:38:09.764627,0 days 00:00:05.948506,Sigmoid,Leaky,,,30,14,4.0,,,0.003314785853242564,2,100,0.7202825184939714,0.0006735245958249409,COMPLETE
90,0.09838151931762695,2023-09-02 12:38:09.764888,2023-09-02 12:38:20.122822,0 days 00:00:10.357934,Leaky,Sigmoid,,,10,12,24.0,,,0.011257249989002292,2,80,0.5972700087830422,0.0002060638747976004,COMPLETE
91,0.10235463827848434,2023-09-02 12:38:20.123094,2023-09-02 12:38:32.003941,0 days 00:00:11.880847,Leaky,Sigmoid,,,10,12,24.0,,,0.011855406909968646,2,80,0.6840181779913017,0.0001985322463069334,COMPLETE
92,0.09800928086042404,2023-09-02 12:38:32.004201,2023-09-02 12:38:42.646954,0 days 00:00:10.642753,Leaky,Sigmoid,,,10,9,23.0,,,0.0067750910368200865,2,80,0.6157696967746201,0.0002968821468860055,COMPLETE
93,0.10816385596990585,2023-09-02 12:38:42.647220,2023-09-02 12:38:55.586667,0 days 00:00:12.939447,Leaky,Sigmoid,,,10,10,22.0,,,0.007385617919764211,2,80,0.7503286848658491,0.000573773074880675,COMPLETE
94,0.12415667623281479,2023-09-02 12:38:55.586933,2023-09-02 12:39:06.538713,0 days 00:00:10.951780,Leaky,Sigmoid,,,10,6,23.0,,,0.0018781623256147423,2,80,0.6369236442749264,0.0002494536404836393,COMPLETE
95,0.11086399108171463,2023-09-02 12:39:06.538975,2023-09-02 12:39:14.690261,0 days 00:00:08.151286,Leaky,Tanh,,,16,9,21.0,,,0.004920317542067469,2,80,0.7166538866973658,0.0002995422502813741,COMPLETE
96,0.10511556267738342,2023-09-02 12:39:14.690520,2023-09-02 12:40:20.845089,0 days 00:01:06.154569,Tanh,Leaky,,,2,14,6.0,,,0.0029322239812403835,2,100,0.6640756125316088,0.0003532232585791341,COMPLETE
97,0.09679531306028366,2023-09-02 12:40:20.845364,2023-09-02 12:40:25.909306,0 days 00:00:05.063942,Leaky,Leaky,,,30,8,13.0,,,0.00606378338909479,2,80,0.768605109786726,0.0004655272514128058,COMPLETE
98,0.10190310329198837,2023-09-02 12:40:25.909574,2023-09-02 12:40:33.011075,0 days 00:00:07.101501,ReLU,Leaky,Tanh,Tanh,30,8,13.0,5.0,19.0,0.003744734444519573,4,80,0.7635264427268306,0.0005106666260525249,COMPLETE
99,0.11102823913097382,2023-09-02 12:40:33.011355,2023-09-02 12:40:36.888586,0 days 00:00:03.877231,Tanh,Leaky,,,30,15,12.0,,,0.001248787382315685,2,60,0.7717490546620744,0.0008574254316415121,COMPLETE
100,0.10582917183637619,2023-09-02 12:40:36.888850,2023-09-02 12:40:42.960141,0 days 00:00:06.071291,ReLU,Leaky,,,30,11,9.0,,,0.002547021632490346,2,100,0.7281783921596968,0.0010539626792117737,COMPLETE
101,0.1172918975353241,2023-09-02 12:40:42.960403,2023-09-02 12:40:47.490798,0 days 00:00:04.530395,Leaky,Leaky,,,30,9,2.0,,,0.005799407294305398,2,80,0.6930208958865146,0.00014273877288627365,COMPLETE
102,0.10201999545097351,2023-09-02 12:40:47.491065,2023-09-02 12:40:51.563228,0 days 00:00:04.072163,Leaky,Leaky,,,30,10,16.0,,,0.007270216535710791,2,80,0.6186221238427168,0.00039650777906034596,COMPLETE
103,0.11216168850660324,2023-09-02 12:40:51.563526,2023-09-02 12:41:05.685488,0 days 00:00:14.121962,Leaky,Sigmoid,,,8,16,22.0,,,0.008494985371034984,2,80,0.6624669057770036,0.000741753362110254,COMPLETE
