number,value,datetime_start,datetime_complete,duration,params_activation1,params_activation2,params_activation3,params_batch_size,params_fl1,params_fl2,params_fl3,params_learning_rate,params_n_layers,params_num_epochs,params_train_size,params_weight_decay,state
0,0.3636987507343292,2023-09-02 12:22:21.718753,2023-09-02 12:22:24.305666,0 days 00:00:02.586913,Tanh,Sigmoid,,12,20,16.0,,1.5651104896716228e-05,2,80,0.17522503142833917,0.002474792968285349,COMPLETE
1,0.1661221981048584,2023-09-02 12:22:24.305966,2023-09-02 12:22:30.704671,0 days 00:00:06.398705,ReLU,,,2,12,,,0.007091993106137377,1,60,0.14256691787786072,0.029198397928803795,COMPLETE
2,0.12297170609235764,2023-09-02 12:22:30.704929,2023-09-02 12:22:36.023329,0 days 00:00:05.318400,Leaky,Tanh,,8,16,2.0,,0.0005286142661181802,2,100,0.2021090297644788,0.0019418636349661192,COMPLETE
3,0.24068892002105713,2023-09-02 12:22:36.023611,2023-09-02 12:22:47.658149,0 days 00:00:11.634538,Sigmoid,Sigmoid,Leaky,12,22,19.0,11.0,2.2467187292894623e-05,3,100,0.5183610129012222,0.0001495246318384443,COMPLETE
4,0.12459174543619156,2023-09-02 12:22:47.658432,2023-09-02 12:22:49.317906,0 days 00:00:01.659474,ReLU,ReLU,ReLU,16,13,5.0,7.0,0.008919285262278805,3,80,0.12117913729205443,6.38263501866268e-05,COMPLETE
5,0.9627452492713928,2023-09-02 12:22:49.318193,2023-09-02 12:22:51.175886,0 days 00:00:01.857693,Sigmoid,ReLU,Sigmoid,12,7,1.0,6.0,0.0035500519355913572,3,40,0.20005382712219327,7.989608141607686e-05,COMPLETE
6,0.13282844424247742,2023-09-02 12:22:51.176179,2023-09-02 12:22:53.179921,0 days 00:00:02.003742,ReLU,Tanh,,16,10,1.0,,0.0013681831353686976,2,60,0.24226990884624391,7.550143631965661e-05,COMPLETE
7,0.6799757480621338,2023-09-02 12:22:53.180206,2023-09-02 12:23:00.424421,0 days 00:00:07.244215,Tanh,ReLU,Sigmoid,16,9,4.0,2.0,1.1381967005828204e-05,3,80,0.5455195792460517,0.0008970137248790988,COMPLETE
8,0.23475228250026703,2023-09-02 12:23:00.424686,2023-09-02 12:23:04.978477,0 days 00:00:04.553791,Tanh,Sigmoid,,30,17,3.0,,0.003972787524424704,2,80,0.6944504870903401,0.05930367756779023,COMPLETE
9,0.19844573736190796,2023-09-02 12:23:04.978723,2023-09-02 12:23:32.366212,0 days 00:00:27.387489,Leaky,Sigmoid,Sigmoid,4,2,4.0,12.0,6.51288739460049e-05,3,60,0.7466717612408429,3.8749154097341717e-05,COMPLETE
10,0.18471379578113556,2023-09-02 12:23:32.366487,2023-09-02 12:23:38.819308,0 days 00:00:06.452821,Leaky,,,8,17,,,0.0820731924470877,1,100,0.3210951903912722,1.1119842895931981e-05,COMPLETE
11,0.16974490880966187,2023-09-02 12:23:38.819565,2023-09-02 12:23:41.013346,0 days 00:00:02.193781,ReLU,Tanh,,10,15,10.0,,0.00013351071035305794,2,100,0.1014000127767291,0.0006299121396690814,COMPLETE
12,0.15307161211967468,2023-09-02 12:23:41.013600,2023-09-02 12:23:41.996477,0 days 00:00:00.982877,Leaky,,,8,24,,,0.0003763965506025218,1,40,0.11906295558669142,0.005781587854757813,COMPLETE
13,0.1383020132780075,2023-09-02 12:23:41.996736,2023-09-02 12:23:45.152399,0 days 00:00:03.155663,ReLU,Leaky,,8,14,9.0,,0.0006748340015054351,2,80,0.14699250247969436,0.0003748604655199256,COMPLETE
14,0.14733143150806427,2023-09-02 12:23:45.152651,2023-09-02 12:23:47.132035,0 days 00:00:01.979384,Leaky,Tanh,ReLU,16,5,8.0,20.0,0.016489246058077455,3,100,0.10131479501404075,0.003296696298996185,COMPLETE
15,0.10639616847038269,2023-09-02 12:23:47.132301,2023-09-02 12:23:51.897258,0 days 00:00:04.764957,ReLU,ReLU,,10,19,23.0,,0.0012352210112579138,2,80,0.2739672605820252,0.00023441160810318604,COMPLETE
16,0.11001025885343552,2023-09-02 12:23:51.897517,2023-09-02 12:23:58.445385,0 days 00:00:06.547868,Leaky,Leaky,,10,19,24.0,,0.0002409321596669037,2,100,0.30146087626875456,0.0003884780488208375,COMPLETE
17,0.21091312170028687,2023-09-02 12:23:58.445648,2023-09-02 12:24:00.605790,0 days 00:00:02.160142,Sigmoid,,,10,20,,,0.00012308871456131088,1,40,0.3201441001719656,0.00023065633873268799,COMPLETE
18,0.11220018565654755,2023-09-02 12:24:00.606045,2023-09-02 12:24:05.335059,0 days 00:00:04.729014,ReLU,Leaky,,10,19,24.0,,0.0018932208163856456,2,80,0.2672026476997242,0.00043388252317549226,COMPLETE
19,0.12053036689758301,2023-09-02 12:24:05.335322,2023-09-02 12:24:11.729443,0 days 00:00:06.394121,Leaky,,,10,24,,,0.00030931606924092014,1,100,0.38331787942703577,0.00021893329264107103,COMPLETE
20,0.1010497510433197,2023-09-02 12:24:11.729689,2023-09-02 12:24:18.684135,0 days 00:00:06.954446,ReLU,Leaky,,10,21,24.0,,0.0007284831832399385,2,80,0.3963615397316613,0.0010642456173391864,COMPLETE
21,0.10086961835622787,2023-09-02 12:24:18.684387,2023-09-02 12:24:25.709832,0 days 00:00:07.025445,ReLU,Leaky,,10,22,23.0,,0.000983976115988858,2,80,0.3973480956993136,0.0009477950262408713,COMPLETE
22,0.09779755026102066,2023-09-02 12:24:25.710095,2023-09-02 12:24:32.686886,0 days 00:00:06.976791,ReLU,Leaky,,10,22,20.0,,0.0009714509822790194,2,80,0.3971131237556583,0.0013266477056030472,COMPLETE
23,0.102876216173172,2023-09-02 12:24:32.687143,2023-09-02 12:24:39.869630,0 days 00:00:07.182487,ReLU,Leaky,,10,22,20.0,,0.0007501207727258078,2,80,0.40821088852750265,0.0010856307418048868,COMPLETE
24,0.11144433170557022,2023-09-02 12:24:39.869889,2023-09-02 12:24:56.853561,0 days 00:00:16.983672,ReLU,Leaky,,4,22,20.0,,0.0019436986725668074,2,80,0.40478095763783867,0.004589116569990858,COMPLETE
25,0.09786608815193176,2023-09-02 12:24:56.853833,2023-09-02 12:24:59.960008,0 days 00:00:03.106175,ReLU,Leaky,,30,24,17.0,,0.0009827047772296166,2,80,0.45941642995426774,0.0010552097155704593,COMPLETE
26,0.1183127760887146,2023-09-02 12:24:59.960262,2023-09-02 12:25:02.698469,0 days 00:00:02.738207,ReLU,,,30,24,,,0.0011234990905484386,1,80,0.511472274380899,0.0016386250755822168,COMPLETE
27,0.13276199996471405,2023-09-02 12:25:02.698715,2023-09-02 12:25:05.745123,0 days 00:00:03.046408,ReLU,Leaky,,30,23,15.0,,0.00028554143110267726,2,80,0.44986615368367455,0.008337004065987894,COMPLETE
28,0.10807744413614273,2023-09-02 12:25:05.745378,2023-09-02 12:25:55.180612,0 days 00:00:49.435234,ReLU,Leaky,,2,18,17.0,,0.0028321953798888795,2,80,0.61330762750415,0.0015360665676455302,COMPLETE
29,0.14313557744026184,2023-09-02 12:25:55.180879,2023-09-02 12:25:57.052141,0 days 00:00:01.871262,Tanh,,,30,21,,,0.0005847017993203108,1,80,0.34619625632320766,0.0026299966586623216,COMPLETE
30,0.10081694275140762,2023-09-02 12:25:57.052384,2023-09-02 12:26:00.928699,0 days 00:00:03.876315,ReLU,Leaky,Tanh,30,21,21.0,24.0,0.001239879145641713,3,80,0.46719944646457257,0.0006954277147093211,COMPLETE
31,0.11003626883029938,2023-09-02 12:26:00.928964,2023-09-02 12:26:04.778552,0 days 00:00:03.849588,ReLU,Leaky,Tanh,30,21,21.0,24.0,0.001115389264413863,3,80,0.4655565951140826,0.0008286746018776917,COMPLETE
32,0.10363747924566269,2023-09-02 12:26:04.778826,2023-09-02 12:26:07.189008,0 days 00:00:02.410182,ReLU,Leaky,,30,24,18.0,,0.0019555848617834252,2,80,0.35338942962952474,0.0006518633717938597,COMPLETE
33,0.12682577967643738,2023-09-02 12:26:07.189267,2023-09-02 12:26:34.992681,0 days 00:00:27.803414,ReLU,Leaky,,2,20,14.0,,0.0005550836511616169,2,60,0.45099347753465907,0.010146698076855894,COMPLETE
34,0.09942635148763657,2023-09-02 12:26:34.992951,2023-09-02 12:26:40.066376,0 days 00:00:05.073425,ReLU,Leaky,Tanh,30,22,22.0,18.0,0.005071277227179231,3,80,0.590174896835741,0.0020953978348109024,COMPLETE
35,0.12000187486410141,2023-09-02 12:26:40.066643,2023-09-02 12:26:45.065661,0 days 00:00:04.999018,Sigmoid,Leaky,Tanh,30,23,21.0,18.0,0.004890809960453919,3,80,0.607806733175925,0.0015485228300041473,COMPLETE
36,0.11751794070005417,2023-09-02 12:26:45.065925,2023-09-02 12:26:47.420013,0 days 00:00:02.354088,ReLU,Leaky,Tanh,30,16,12.0,24.0,0.008561310171281486,3,40,0.5749163548357037,0.0024628723941652973,COMPLETE
37,0.1264754980802536,2023-09-02 12:26:47.420285,2023-09-02 12:26:54.047189,0 days 00:00:06.626904,Tanh,Leaky,Tanh,12,12,17.0,18.0,0.005485991624436295,3,60,0.4913897910696194,0.004120146058531925,COMPLETE
38,0.13059517741203308,2023-09-02 12:26:54.047457,2023-09-02 12:26:59.467135,0 days 00:00:05.419678,Sigmoid,Leaky,Tanh,30,20,22.0,20.0,0.0029705388520305694,3,80,0.6548652982020629,0.001879359606061167,COMPLETE
39,0.14334170520305634,2023-09-02 12:26:59.467434,2023-09-02 12:27:04.822863,0 days 00:00:05.355429,ReLU,Leaky,Leaky,30,23,16.0,16.0,0.011869811363922891,3,80,0.5406467381578871,0.016700287564574166,COMPLETE
40,0.11820583045482635,2023-09-02 12:27:04.823161,2023-09-02 12:27:19.380726,0 days 00:00:14.557565,ReLU,Sigmoid,Tanh,12,18,19.0,22.0,0.0018263998989158955,3,80,0.7988041734560247,0.002933173882044781,COMPLETE
41,0.09870431572198868,2023-09-02 12:27:19.381000,2023-09-02 12:27:39.916072,0 days 00:00:20.535072,ReLU,Leaky,,4,22,22.0,,0.0008670123391768711,2,80,0.49740203776081765,0.0012747666647580577,COMPLETE
42,0.10184862464666367,2023-09-02 12:27:39.916338,2023-09-02 12:28:01.656810,0 days 00:00:21.740472,ReLU,Leaky,,4,22,22.0,,0.00039682993483086806,2,80,0.5237567284449851,0.0013258238514242742,COMPLETE
43,0.1135159507393837,2023-09-02 12:28:01.657080,2023-09-02 12:28:25.335249,0 days 00:00:23.678169,ReLU,Leaky,,4,10,19.0,,0.0009212039501605049,2,80,0.5844876055037476,0.0005974018582933636,COMPLETE
44,0.1062619760632515,2023-09-02 12:28:25.335509,2023-09-02 12:28:44.587881,0 days 00:00:19.252372,ReLU,Leaky,,4,21,21.0,,0.003024108332461999,2,80,0.46408646303021583,0.001894297735631825,COMPLETE
45,0.12825152277946472,2023-09-02 12:28:44.588137,2023-09-02 12:28:48.827613,0 days 00:00:04.239476,Tanh,Tanh,Tanh,30,23,18.0,15.0,0.001502659614612802,3,60,0.7069558182602919,0.0029697519208780948,COMPLETE
46,0.0998271033167839,2023-09-02 12:28:48.827896,2023-09-02 12:29:09.028613,0 days 00:00:20.200717,ReLU,ReLU,,2,17,22.0,,0.0005393670214258216,2,40,0.5044675587820906,0.0006387893220896675,COMPLETE
47,0.13031041622161865,2023-09-02 12:29:09.028881,2023-09-02 12:29:31.546875,0 days 00:00:22.517994,ReLU,ReLU,,2,14,22.0,,0.0004930086979285768,2,40,0.555906871129601,0.005839786595086192,COMPLETE
48,0.1304457038640976,2023-09-02 12:29:31.547136,2023-09-02 12:29:57.336359,0 days 00:00:25.789223,Sigmoid,ReLU,,2,17,20.0,,0.00042298467160387484,2,40,0.6389922029209878,0.001158823307273536,COMPLETE
49,0.11046924442052841,2023-09-02 12:29:57.336624,2023-09-02 12:30:24.659506,0 days 00:00:27.322882,ReLU,ReLU,,2,16,19.0,,0.00022214280722388852,2,40,0.6853301151243214,0.00047192337946769746,COMPLETE
50,0.11380017548799515,2023-09-02 12:30:24.659765,2023-09-02 12:30:27.563525,0 days 00:00:02.903760,ReLU,ReLU,,16,18,13.0,,0.0007851555287092987,2,40,0.5157050755851601,0.0019468804549848478,COMPLETE
51,0.11554455012083054,2023-09-02 12:30:27.563782,2023-09-02 12:30:45.818001,0 days 00:00:18.254219,ReLU,Sigmoid,,4,20,23.0,,0.0012672638955355028,2,80,0.4401208476258719,0.0007553739844874259,COMPLETE
52,0.10030914843082428,2023-09-02 12:30:45.818282,2023-09-02 12:30:52.440407,0 days 00:00:06.622125,ReLU,ReLU,Tanh,8,23,21.0,21.0,0.0005428118930516714,3,40,0.49583524061316314,0.0005582961102838066,COMPLETE
53,0.10328194499015808,2023-09-02 12:30:52.440680,2023-09-02 12:30:57.765731,0 days 00:00:05.325051,ReLU,ReLU,,8,24,22.0,,0.0005606942409992424,2,40,0.4997893374510361,0.0003046729776471076,COMPLETE
54,0.21937453746795654,2023-09-02 12:30:57.766004,2023-09-02 12:31:03.517776,0 days 00:00:05.751772,ReLU,ReLU,,8,1,20.0,,0.00019349212048647938,2,40,0.5598517715442262,0.0005123559199891794,COMPLETE
55,0.1151575818657875,2023-09-02 12:31:03.518048,2023-09-02 12:31:08.030596,0 days 00:00:04.512548,ReLU,ReLU,,8,23,18.0,,0.0003659555157767244,2,40,0.42212962145728944,0.0009975753410800593,COMPLETE
56,0.11836665868759155,2023-09-02 12:31:08.030866,2023-09-02 12:31:14.476344,0 days 00:00:06.445478,Leaky,Tanh,Leaky,8,7,23.0,14.0,0.0008483988003665972,3,40,0.49613625140025547,0.00031686122959940274,COMPLETE
57,0.09558549523353577,2023-09-02 12:31:14.476627,2023-09-02 12:32:00.736414,0 days 00:00:46.259787,Tanh,ReLU,ReLU,2,19,24.0,20.0,0.0006375669725355911,3,100,0.3666226974825364,0.00012265332866825957,COMPLETE
58,0.10236600041389465,2023-09-02 12:32:00.736692,2023-09-02 12:32:37.950583,0 days 00:00:37.213891,Tanh,Sigmoid,,2,19,24.0,,0.0021561953353688617,2,100,0.370655913246639,0.00011479991242342845,COMPLETE
59,0.09889211505651474,2023-09-02 12:32:37.950854,2023-09-02 12:33:19.077317,0 days 00:00:41.126463,Tanh,ReLU,,2,19,6.0,,0.0007901988578614354,2,100,0.41027020224276195,0.00015021612209833714,COMPLETE
60,0.1036393940448761,2023-09-02 12:33:19.077582,2023-09-02 12:33:54.833809,0 days 00:00:35.756227,Tanh,Tanh,,2,20,6.0,,0.001518907371203313,2,100,0.35866659992574024,6.046486034404694e-05,COMPLETE
61,0.09562948346138,2023-09-02 12:33:54.834165,2023-09-02 12:34:38.231329,0 days 00:00:43.397164,Tanh,ReLU,,2,19,11.0,,0.0007325746732111883,2,100,0.43321571740985587,0.0001548590126909704,COMPLETE
62,0.1033017635345459,2023-09-02 12:34:38.231592,2023-09-02 12:35:19.874173,0 days 00:00:41.642581,Tanh,ReLU,,2,22,11.0,,0.0007851684769997574,2,100,0.41160985650662335,0.00013517079500747212,COMPLETE
63,0.1026928573846817,2023-09-02 12:35:19.874477,2023-09-02 12:35:57.560257,0 days 00:00:37.685780,Tanh,ReLU,,2,19,8.0,,0.0009307159402024896,2,100,0.3767586361875803,0.00018058956536478666,COMPLETE
64,0.11650341004133224,2023-09-02 12:35:57.560529,2023-09-02 12:36:03.548313,0 days 00:00:05.987784,Tanh,ReLU,,16,15,6.0,,0.0007138680226325606,2,100,0.4249567371775659,0.0002721839539753189,COMPLETE
65,0.10622674226760864,2023-09-02 12:36:03.548580,2023-09-02 12:36:37.794214,0 days 00:00:34.245634,Tanh,ReLU,,2,18,9.0,,0.0003165421621652041,2,100,0.3393116159920957,0.00010466347681050545,COMPLETE
66,0.10207457840442657,2023-09-02 12:36:37.794507,2023-09-02 12:36:46.225282,0 days 00:00:08.430775,Tanh,Leaky,,10,21,2.0,,0.0011117462499968768,2,100,0.38769559276991694,0.00037697443081314923,COMPLETE
67,0.11496592313051224,2023-09-02 12:36:46.225556,2023-09-02 12:36:58.842318,0 days 00:00:12.616762,Tanh,,,4,22,,,0.0016022421310969313,1,100,0.3206688516675597,4.2125667293339685e-05,COMPLETE
68,0.09645453095436096,2023-09-02 12:36:58.842590,2023-09-02 12:37:06.964526,0 days 00:00:08.121936,Tanh,ReLU,,12,19,24.0,,0.0022734925349053967,2,100,0.4279920784252706,0.00019463829117825015,COMPLETE
69,0.09641584753990173,2023-09-02 12:37:06.964794,2023-09-02 12:37:15.072874,0 days 00:00:08.108080,Tanh,ReLU,,12,17,24.0,,0.002462087365766206,2,100,0.43529293827989907,0.0001766459294734538,COMPLETE
70,0.10402387380599976,2023-09-02 12:37:15.073140,2023-09-02 12:37:23.247447,0 days 00:00:08.174307,Tanh,ReLU,,12,15,24.0,,0.0024566662570168984,2,100,0.4353465921347075,0.00010128902222341511,COMPLETE
71,0.1038636714220047,2023-09-02 12:37:23.247719,2023-09-02 12:37:30.929411,0 days 00:00:07.681692,Tanh,ReLU,,12,19,23.0,,0.0037214374216697813,2,100,0.4002796801933352,0.00017017171936470032,COMPLETE
72,0.10156954824924469,2023-09-02 12:37:30.929679,2023-09-02 12:37:38.040861,0 days 00:00:07.111182,Tanh,ReLU,,12,20,24.0,,0.0022438771179027124,2,100,0.37092004255733557,0.00021495106868079733,COMPLETE
73,0.09937664866447449,2023-09-02 12:37:38.041133,2023-09-02 12:37:46.643529,0 days 00:00:08.602396,Tanh,ReLU,,12,18,23.0,,0.0013491761772720988,2,100,0.46341444940501797,0.00014476967489677374,COMPLETE
74,0.10030645877122879,2023-09-02 12:37:46.643802,2023-09-02 12:37:54.448046,0 days 00:00:07.804244,Tanh,ReLU,,12,16,15.0,,0.0006592150721706336,2,100,0.4263699106442801,7.357619693662234e-05,COMPLETE
75,0.10395854711532593,2023-09-02 12:37:54.448322,2023-09-02 12:38:01.791603,0 days 00:00:07.343281,Tanh,ReLU,,12,19,4.0,,0.0011364031486381361,2,100,0.39748463680687923,0.00019858135799718198,COMPLETE
76,0.10884352773427963,2023-09-02 12:38:01.791907,2023-09-02 12:38:08.268005,0 days 00:00:06.476098,Tanh,ReLU,,10,12,24.0,,0.0016336568174449538,2,100,0.29825002784447174,0.00024175624049431663,COMPLETE
77,0.10465794056653976,2023-09-02 12:38:08.268279,2023-09-02 12:38:42.974924,0 days 00:00:34.706645,Tanh,ReLU,,2,21,10.0,,0.000967850228306999,2,100,0.3415218096680901,0.0003838081945531193,COMPLETE
78,0.09947521239519119,2023-09-02 12:38:42.975198,2023-09-02 12:38:51.621826,0 days 00:00:08.646628,Leaky,Sigmoid,,12,17,7.0,,0.0027186317991178973,2,100,0.4737560198699849,0.0001620641094450386,COMPLETE
79,0.10328342765569687,2023-09-02 12:38:51.622101,2023-09-02 12:39:05.289262,0 days 00:00:13.667161,Tanh,ReLU,,4,24,23.0,,0.00044858484630358664,2,60,0.4364438229956581,0.00030269276612298235,COMPLETE
80,0.104562908411026,2023-09-02 12:39:05.289538,2023-09-02 12:39:59.251215,0 days 00:00:53.961677,Tanh,Leaky,,2,20,21.0,,0.0018873005565100379,2,100,0.5299451603532135,8.43930603946653e-05,COMPLETE
81,0.10082831233739853,2023-09-02 12:39:59.251490,2023-09-02 12:40:07.870729,0 days 00:00:08.619239,Tanh,ReLU,,12,18,23.0,,0.0013587557237015107,2,100,0.46221099823078476,0.00011650585746284558,COMPLETE
82,0.10030414909124374,2023-09-02 12:40:07.871007,2023-09-02 12:40:16.718584,0 days 00:00:08.847577,Tanh,ReLU,,12,17,24.0,,0.0006651023400997504,2,100,0.47778152581255073,0.00016714915990364825,COMPLETE
83,0.11736457794904709,2023-09-02 12:40:16.718853,2023-09-02 12:40:24.914899,0 days 00:00:08.196046,Sigmoid,ReLU,,12,18,23.0,,0.0013399054448582038,2,100,0.4180177343089919,0.0002130443959546099,COMPLETE
84,0.10710027068853378,2023-09-02 12:40:24.915186,2023-09-02 12:40:33.377847,0 days 00:00:08.462661,Tanh,ReLU,,12,19,13.0,,0.001065357723390515,2,100,0.4570412903165577,0.0012829688704808166,COMPLETE
85,0.10101494193077087,2023-09-02 12:40:33.378128,2023-09-02 12:40:41.855075,0 days 00:00:08.476947,Tanh,Leaky,,10,20,22.0,,0.003235942202218278,2,100,0.38767436368707286,0.0008478150486011277,COMPLETE
86,0.10439247637987137,2023-09-02 12:40:41.855352,2023-09-02 12:40:49.962878,0 days 00:00:08.107526,Tanh,Tanh,,12,13,16.0,,0.0023242121308578523,2,100,0.4507933088963677,0.0001244342704581662,COMPLETE
87,0.10120583325624466,2023-09-02 12:40:49.963149,2023-09-02 12:40:56.134501,0 days 00:00:06.171352,Tanh,ReLU,,16,21,20.0,,0.0008206401592375736,2,80,0.5361256593982373,0.00014295939680591756,COMPLETE
88,0.09926431626081467,2023-09-02 12:40:56.134766,2023-09-02 12:41:25.096171,0 days 00:00:28.961405,Tanh,Leaky,,2,16,21.0,,0.0016928527859374112,2,60,0.48147338638017895,0.0004701385782362342,COMPLETE
89,0.10517973452806473,2023-09-02 12:41:25.096448,2023-09-02 12:41:53.627673,0 days 00:00:28.531225,Leaky,Leaky,,2,16,15.0,,0.00395634918863441,2,60,0.4824191395526146,0.0004525583310816757,COMPLETE
90,0.13891012966632843,2023-09-02 12:41:53.627948,2023-09-02 12:42:15.708100,0 days 00:00:22.080152,Sigmoid,Leaky,,2,23,21.0,,0.0004459298427215727,2,60,0.36172867977245005,0.0007145439819466137,COMPLETE
91,0.10324913263320923,2023-09-02 12:42:15.708383,2023-09-02 12:42:40.523727,0 days 00:00:24.815344,Tanh,Leaky,,2,15,23.0,,0.001737890169388323,2,60,0.4122803450475044,0.0002500115760477958,COMPLETE
92,0.09745568037033081,2023-09-02 12:42:40.524004,2023-09-02 12:43:07.339849,0 days 00:00:26.815845,Tanh,Leaky,,2,17,22.0,,0.001369702659863202,2,60,0.4422253988181801,0.00016256883995455866,COMPLETE
93,0.09723510593175888,2023-09-02 12:43:07.340126,2023-09-02 12:43:34.451578,0 days 00:00:27.111452,Tanh,Leaky,,2,17,22.0,,0.0009341995306789174,2,60,0.4477310336553823,0.00019053501258446708,COMPLETE
94,0.10332445055246353,2023-09-02 12:43:34.451853,2023-09-02 12:44:01.395614,0 days 00:00:26.943761,Tanh,Leaky,,2,17,22.0,,0.0006453663690259506,2,60,0.4426664528790466,0.00019142411652618523,COMPLETE
95,0.10760587453842163,2023-09-02 12:44:01.395894,2023-09-02 12:44:25.314377,0 days 00:00:23.918483,Tanh,Leaky,,2,14,24.0,,0.0009068545148031445,2,60,0.39824383574670724,9.486765112587284e-05,COMPLETE
96,0.10240241140127182,2023-09-02 12:44:25.314654,2023-09-02 12:44:48.225562,0 days 00:00:22.910908,Tanh,Leaky,,2,22,20.0,,0.0010094716686923323,2,60,0.3740736396859653,0.00014658322199983476,COMPLETE
97,0.12413619458675385,2023-09-02 12:44:48.225843,2023-09-02 12:45:05.295549,0 days 00:00:17.069706,Tanh,Leaky,,4,4,17.0,,0.0005815689767879738,2,80,0.4247671501038523,6.762892414801675e-05,COMPLETE
98,0.10336455702781677,2023-09-02 12:45:05.295827,2023-09-02 12:45:35.986445,0 days 00:00:30.690618,Tanh,Leaky,,2,11,19.0,,0.0007916810605609098,2,80,0.3847623238347292,0.0003293168282758702,COMPLETE
99,0.09885433316230774,2023-09-02 12:45:35.986722,2023-09-02 12:45:42.685822,0 days 00:00:06.699100,Tanh,Leaky,,10,19,22.0,,0.0012209076033334498,2,60,0.5103387683818494,9.086029367678347e-05,COMPLETE
100,0.10775892436504364,2023-09-02 12:45:42.686103,2023-09-02 12:45:49.331544,0 days 00:00:06.645441,Leaky,Leaky,,10,18,11.0,,0.0011691747170175194,2,60,0.5185982016940481,0.0008753834161289905,COMPLETE
101,0.10751692950725555,2023-09-02 12:45:49.331817,2023-09-02 12:45:55.204018,0 days 00:00:05.872201,Tanh,Leaky,,10,19,22.0,,0.0014296810456986974,2,60,0.4482060156906551,9.533919782893579e-05,COMPLETE
102,0.09833487123250961,2023-09-02 12:45:55.204296,2023-09-02 12:46:01.801214,0 days 00:00:06.596918,Tanh,Leaky,,10,20,22.0,,0.002023856061816882,2,60,0.5031589318156907,5.720529889676558e-05,COMPLETE
103,0.0989096462726593,2023-09-02 12:46:01.801491,2023-09-02 12:46:08.400161,0 days 00:00:06.598670,Tanh,Leaky,,10,20,22.0,,0.00212947223884412,2,60,0.5031715306828188,6.252403872858963e-05,COMPLETE
104,0.0948493704199791,2023-09-02 12:46:08.400444,2023-09-02 12:46:15.676677,0 days 00:00:07.276233,Tanh,Leaky,,10,21,23.0,,0.0026599748381719423,2,60,0.5494935178552283,8.25902459971797e-05,COMPLETE
105,0.09895770996809006,2023-09-02 12:46:15.676947,2023-09-02 12:46:22.051883,0 days 00:00:06.374936,ReLU,Leaky,,10,21,21.0,,0.002618499315306734,2,60,0.4851890605884479,5.1843109430979596e-05,COMPLETE
