number,value,datetime_start,datetime_complete,duration,params_activation1,params_activation2,params_activation3,params_activation4,params_batch_size,params_fl1,params_fl2,params_fl3,params_fl4,params_learning_rate,params_n_layers,params_num_epochs,params_train_size,params_weight_decay,user_attrs_mre,state
286,0.3121587634086609,2023-09-04 18:20:27.248230,2023-09-04 18:20:29.712867,0 days 00:00:02.464637,ReLU,Sigmoid,,,60,21,24.0,,,0.009334496952959102,2,365,0.743266139615193,0.00010661805885575229,198.7251139156154,COMPLETE
287,0.31238484382629395,2023-09-04 18:20:29.713368,2023-09-04 18:20:31.489069,0 days 00:00:01.775701,ReLU,Sigmoid,,,61,21,23.0,,,0.009530664681057682,2,364,0.736553902721439,0.0001191850517789304,310.7090878244174,COMPLETE
288,0.3548850417137146,2023-09-04 18:20:31.489378,2023-09-04 18:20:33.539208,0 days 00:00:02.049830,ReLU,Sigmoid,,,61,21,23.0,,,0.0082134469414824,2,364,0.7139521309211784,0.00010553297907422468,213.85042973568565,COMPLETE
289,0.3343327045440674,2023-09-04 18:20:33.539632,2023-09-04 18:20:36.455601,0 days 00:00:02.915969,ReLU,Sigmoid,,,60,21,23.0,,,0.006531558243512107,2,367,0.7317574278144016,0.00010125022071657456,231.3603542469166,COMPLETE
290,0.32268399000167847,2023-09-04 18:20:36.455901,2023-09-04 18:20:38.568930,0 days 00:00:02.113029,ReLU,Sigmoid,,,63,21,23.0,,,0.008676620783265976,2,357,0.6886655844250767,8.050517752411013e-05,336.9292846328911,COMPLETE
291,0.32073473930358887,2023-09-04 18:20:38.569344,2023-09-04 18:20:40.736615,0 days 00:00:02.167271,ReLU,Sigmoid,,,67,20,23.0,,,0.004923430213345405,2,373,0.7472477283450655,6.262457887394737e-05,1050.9333374023438,COMPLETE
292,0.3914220631122589,2023-09-04 18:20:40.736906,2023-09-04 18:20:41.416459,0 days 00:00:00.679553,ReLU,Sigmoid,,,60,20,24.0,,,0.009099731734707347,2,366,0.23003272173887312,0.0001238603208811784,202.74894693162707,COMPLETE
293,0.355775386095047,2023-09-04 18:20:41.416762,2023-09-04 18:20:42.503114,0 days 00:00:01.086352,ReLU,Sigmoid,,,62,21,23.0,,,0.005979258652490078,2,352,0.3324955064937287,0.00016850865706046498,403.2212174155495,COMPLETE
294,0.3627822697162628,2023-09-04 18:20:42.503562,2023-09-04 18:20:43.613235,0 days 00:00:01.109673,ReLU,Sigmoid,,,57,21,24.0,,,0.01114124919246415,2,373,0.26434517996177026,9.531333774697699e-05,162.8265684567965,COMPLETE
295,0.3396265506744385,2023-09-04 18:20:43.613558,2023-09-04 18:20:45.500694,0 days 00:00:01.887136,ReLU,Sigmoid,,,61,20,23.0,,,0.007169963297388521,2,358,0.709519033605404,5.227148361404187e-05,1064.8071477184558,COMPLETE
296,0.3611546456813812,2023-09-04 18:20:45.501092,2023-09-04 18:20:47.124941,0 days 00:00:01.623849,ReLU,Sigmoid,,,64,17,24.0,,,0.005111267085452804,2,365,0.7714781408925294,0.0006461367353538802,182.0138847351074,COMPLETE
297,0.3440585434436798,2023-09-04 18:20:47.125247,2023-09-04 18:20:49.418165,0 days 00:00:02.292918,ReLU,Sigmoid,,,58,22,24.0,,,0.006388176669120259,2,348,0.7367548252849719,0.0001128960972169482,481.01489802769254,COMPLETE
298,0.3471263349056244,2023-09-04 18:20:49.418459,2023-09-04 18:20:58.009252,0 days 00:00:08.590793,ReLU,Sigmoid,,,69,16,23.0,,,0.000823634581581217,2,375,0.6927466392550056,3.881195166723886e-05,161.80232509358723,COMPLETE
299,0.3396885395050049,2023-09-04 18:20:58.009554,2023-09-04 18:21:00.468445,0 days 00:00:02.458891,ReLU,Sigmoid,,,85,19,24.0,,,0.004570311030673101,2,360,0.7995834046596125,0.00014520458148285065,171.4523868934781,COMPLETE
300,0.6475905776023865,2023-09-04 18:21:00.468829,2023-09-04 18:21:12.373407,0 days 00:00:11.904578,ReLU,Sigmoid,,,65,16,23.0,,,1.2291255280444446e-05,2,378,0.7467053808241868,6.327197537415769e-05,139.88878086635046,COMPLETE
301,0.35706305503845215,2023-09-04 18:21:12.373707,2023-09-04 18:21:13.667464,0 days 00:00:01.293757,ReLU,Sigmoid,,,63,15,24.0,,,0.0139267490012648,2,395,0.4316875104039354,0.00044829269668228785,114.9206482115246,COMPLETE
302,0.3253018260002136,2023-09-04 18:21:13.667920,2023-09-04 18:21:15.244014,0 days 00:00:01.576094,Tanh,Sigmoid,,,56,17,23.0,,,0.009594466487729311,2,369,0.7123197595541294,0.00013093174952593812,164.82226278014102,COMPLETE
303,0.31908419728279114,2023-09-04 18:21:15.244310,2023-09-04 18:21:18.854287,0 days 00:00:03.609977,ReLU,Sigmoid,,,60,21,24.0,,,0.007553284463753419,2,350,0.7734841844874619,0.00019368756522846945,314.4589100713315,COMPLETE
304,0.30851781368255615,2023-09-04 18:21:18.854602,2023-09-04 18:21:22.352113,0 days 00:00:03.497511,ReLU,Sigmoid,,,67,17,24.0,,,0.005563974090308422,2,382,0.7396382546681747,7.587420443000877e-05,190.66529039655413,COMPLETE
305,0.31620925664901733,2023-09-04 18:21:22.352412,2023-09-04 18:21:25.009628,0 days 00:00:02.657216,ReLU,Sigmoid,,,70,18,24.0,,,0.0055338631363209614,2,359,0.7437810957093353,8.81307387353373e-05,250.07230272205598,COMPLETE
306,0.321917325258255,2023-09-04 18:21:25.009943,2023-09-04 18:21:27.306861,0 days 00:00:02.296918,ReLU,Sigmoid,,,66,18,24.0,,,0.005442502231898334,2,380,0.7310176555252695,8.773458742884398e-05,205.91540875642195,COMPLETE
307,0.3270610570907593,2023-09-04 18:21:27.307208,2023-09-04 18:21:30.043158,0 days 00:00:02.735950,ReLU,Sigmoid,,,69,18,24.0,,,0.004425478717504254,2,413,0.6900132981981669,9.460002317975958e-05,163.02420173257084,COMPLETE
308,0.34350791573524475,2023-09-04 18:21:30.043476,2023-09-04 18:21:32.205069,0 days 00:00:02.161593,ReLU,Sigmoid,,,74,17,17.0,,,0.005902833047023479,2,368,0.7471721047008221,5.644144981671245e-05,239.53604310423464,COMPLETE
309,0.32783982157707214,2023-09-04 18:21:32.205383,2023-09-04 18:21:34.225685,0 days 00:00:02.020302,ReLU,ReLU,,,72,18,23.0,,,0.0038471877928846184,2,388,0.7155412187723685,8.379648128619671e-05,171.78710883004325,COMPLETE
310,0.3678761422634125,2023-09-04 18:21:34.226135,2023-09-04 18:21:43.217356,0 days 00:00:08.991221,ReLU,Sigmoid,,,70,17,24.0,,,0.0007108816349725382,2,336,0.520358844163368,0.00011245167247621597,196.09482408705213,COMPLETE
311,0.44892096519470215,2023-09-04 18:21:43.217645,2023-09-04 18:21:43.880259,0 days 00:00:00.662614,ReLU,Sigmoid,,,77,19,23.0,,,0.004824852935227108,2,361,0.11690781941000959,2.9334277047589996e-05,1470.8084099762632,COMPLETE
312,0.34870895743370056,2023-09-04 18:21:43.880553,2023-09-04 18:21:53.101790,0 days 00:00:09.221237,ReLU,Sigmoid,,,66,16,24.0,,,0.0005416386047730796,2,375,0.7650734339050893,3.8649960698409404e-05,144.50719000044325,COMPLETE
313,0.4610068202018738,2023-09-04 18:21:53.102115,2023-09-04 18:21:56.671050,0 days 00:00:03.568935,ReLU,Sigmoid,,,68,24,24.0,,,0.00022928168976592953,2,397,0.21891293265584907,0.0007456383202333559,169.7173852800422,COMPLETE
314,0.34563833475112915,2023-09-04 18:21:56.671362,2023-09-04 18:21:58.792421,0 days 00:00:02.121059,ReLU,Sigmoid,,,70,17,23.0,,,0.004032065529714988,2,344,0.6854137836867217,0.00023078123330691654,141.69561553582912,COMPLETE
315,0.35111740231513977,2023-09-04 18:21:58.792716,2023-09-04 18:22:00.654596,0 days 00:00:01.861880,ReLU,Sigmoid,,,72,22,22.0,,,0.005626669113978866,2,385,0.4067333365942567,0.00013118061807552506,257.89983577113,COMPLETE
316,0.32934701442718506,2023-09-04 18:22:00.655084,2023-09-04 18:22:13.840497,0 days 00:00:13.185413,ReLU,Sigmoid,,,75,18,24.0,,,0.001028241263472704,2,368,0.7435319558149752,4.687138571282198e-05,4453.1369640516195,COMPLETE
317,0.5319439172744751,2023-09-04 18:22:13.840810,2023-09-04 18:22:19.477807,0 days 00:00:05.636997,ReLU,Sigmoid,,,67,17,23.0,,,0.00010565504955300888,2,327,0.47196284889001683,0.00016714086751517808,268.3688015952387,COMPLETE
318,0.319243460893631,2023-09-04 18:22:19.478114,2023-09-04 18:22:21.144902,0 days 00:00:01.666788,ReLU,Sigmoid,,,56,19,24.0,,,0.011754364765096857,2,408,0.7683295900208592,7.127712729151511e-05,259.23544520957796,COMPLETE
319,0.32383793592453003,2023-09-04 18:22:21.145199,2023-09-04 18:22:23.690729,0 days 00:00:02.545530,ReLU,Sigmoid,,,58,15,22.0,,,0.005015905528542341,2,358,0.7168791321561585,2.169363137459357e-05,173.2178702460395,COMPLETE
320,0.3438529670238495,2023-09-04 18:22:23.691154,2023-09-04 18:22:31.623058,0 days 00:00:07.931904,ReLU,Sigmoid,,,54,17,23.0,,,0.003483853151455984,2,380,0.4382687898826533,0.0004141966928885639,183.84697740728205,COMPLETE
321,0.3986181914806366,2023-09-04 18:22:31.623618,2023-09-04 18:22:34.183006,0 days 00:00:02.559388,ReLU,Sigmoid,,,62,16,24.0,,,0.006193891599248914,2,398,0.18802498383550728,0.00011454556746308007,223.82406107584634,COMPLETE
322,0.33796489238739014,2023-09-04 18:22:34.183563,2023-09-04 18:22:40.381680,0 days 00:00:06.198117,ReLU,ReLU,,,18,22,23.0,,,0.004368727182735833,2,370,0.741099091537913,0.0011067740823115387,263.81579303741455,COMPLETE
323,0.30969226360321045,2023-09-04 18:22:40.381985,2023-09-04 18:22:43.459695,0 days 00:00:03.077710,ReLU,Sigmoid,,,61,18,24.0,,,0.007882294134990232,2,351,0.7743067418393649,3.5216705143538764e-05,191.26338774028576,COMPLETE
324,0.33650490641593933,2023-09-04 18:22:43.460018,2023-09-04 18:22:45.266810,0 days 00:00:01.806792,ReLU,Sigmoid,,,60,18,22.0,,,0.009841205956566276,2,345,0.7782735782446766,3.040516472048542e-05,143.90816405723834,COMPLETE
325,0.653207540512085,2023-09-04 18:22:45.267161,2023-09-04 18:22:45.702124,0 days 00:00:00.434963,ReLU,Sigmoid,,,63,2,23.0,,,0.009125970799520058,2,352,0.16613553273383733,3.743851401725866e-05,602.0499722664816,COMPLETE
326,0.3222520053386688,2023-09-04 18:22:45.702436,2023-09-04 18:22:49.220450,0 days 00:00:03.518014,Leaky,Sigmoid,,,61,18,24.0,,,0.008515642297818588,2,342,0.7992755698130114,3.486601888849611e-05,238.13853285047742,COMPLETE
327,0.32186654210090637,2023-09-04 18:22:49.220774,2023-09-04 18:22:51.304319,0 days 00:00:02.083545,ReLU,Sigmoid,,,65,19,24.0,,,0.007474377311433016,2,334,0.7634423874054096,4.738287916800595e-05,324.27757922513985,COMPLETE
328,0.35803186893463135,2023-09-04 18:22:51.304631,2023-09-04 18:22:52.489167,0 days 00:00:01.184536,ReLU,Sigmoid,,,58,18,23.0,,,0.013860795443001624,2,359,0.5161785594823259,5.499123996048504e-05,199.66570281982422,COMPLETE
329,0.34678080677986145,2023-09-04 18:22:52.489484,2023-09-04 18:22:55.005089,0 days 00:00:02.515605,ReLU,Sigmoid,,,68,18,22.0,,,0.003839013876235427,2,321,0.7279766569127428,2.8259607426871624e-05,192.6629207317646,COMPLETE
330,0.30884307622909546,2023-09-04 18:22:55.005420,2023-09-04 18:22:58.902601,0 days 00:00:03.897181,ReLU,Sigmoid,,,60,17,18.0,,,0.007141092766204625,2,351,0.7672949747854957,1.8713141367192165e-05,173.3095298299984,COMPLETE
331,0.34457284212112427,2023-09-04 18:22:58.903221,2023-09-04 18:23:00.576590,0 days 00:00:01.673369,ReLU,Sigmoid,,,59,16,22.0,,,0.011241454201406785,2,352,0.7708256920989047,1.8743401266229642e-05,236.6525374821254,COMPLETE
332,0.35200244188308716,2023-09-04 18:23:00.576903,2023-09-04 18:23:03.102460,0 days 00:00:02.525557,ReLU,Sigmoid,,,59,17,18.0,,,0.007619542225898024,2,347,0.5005475105175035,0.0005260304552952694,180.29373072064112,COMPLETE
333,0.34801721572875977,2023-09-04 18:23:03.102775,2023-09-04 18:23:05.046628,0 days 00:00:01.943853,ReLU,Sigmoid,,,61,17,18.0,,,0.006993229425323542,2,335,0.5378050152531283,2.2671022095510236e-05,183.7442769801363,COMPLETE
334,0.3172149062156677,2023-09-04 18:23:05.046936,2023-09-04 18:23:07.221239,0 days 00:00:02.174303,ReLU,Sigmoid,,,62,16,16.0,,,0.00996003889988539,2,368,0.798962542567647,1.6019837044625504e-05,225.54972546721157,COMPLETE
335,0.36998966336250305,2023-09-04 18:23:07.221611,2023-09-04 18:23:17.118360,0 days 00:00:09.896749,ReLU,Sigmoid,,,57,9,23.0,,,0.0011462504912408242,2,392,0.7685902101523703,2.0231115539167626e-05,136.43675556182862,COMPLETE
336,0.35138610005378723,2023-09-04 18:23:17.118678,2023-09-04 18:23:25.769634,0 days 00:00:08.650956,ReLU,Sigmoid,,,57,17,23.0,,,0.0014035035229468002,2,362,0.42171850585811693,2.7101305275208338e-05,173.02482672616947,COMPLETE
337,0.333326131105423,2023-09-04 18:23:25.769941,2023-09-04 18:23:31.155157,0 days 00:00:05.385216,ReLU,Sigmoid,,,63,16,22.0,,,0.003303159176579631,2,375,0.6757607080896173,1.7381958536345564e-05,181.2475328648344,COMPLETE
338,0.3928375840187073,2023-09-04 18:23:31.155476,2023-09-04 18:23:32.909031,0 days 00:00:01.753555,ReLU,Sigmoid,,,16,15,23.0,,,0.04703830131011703,2,407,0.7239604501013899,3.3122725625023784e-05,201.69264899359808,COMPLETE
339,0.34855324029922485,2023-09-04 18:23:32.909587,2023-09-04 18:23:35.306880,0 days 00:00:02.397293,ReLU,Tanh,,,54,17,24.0,,,0.0171988785439732,2,350,0.7480279436255516,4.0925412534825337e-05,182.08674512590682,COMPLETE
340,0.3430439829826355,2023-09-04 18:23:35.307415,2023-09-04 18:23:37.304868,0 days 00:00:01.997453,ReLU,Sigmoid,,,60,24,13.0,,,0.008267769893197219,2,389,0.708032836141357,2.5803526763827253e-05,317.3428463406033,COMPLETE
341,1.0037345886230469,2023-09-04 18:23:37.305199,2023-09-04 18:23:37.488764,0 days 00:00:00.183565,ReLU,Sigmoid,,,64,17,22.0,,,0.0029701060635441397,2,418,0.3416858916534588,0.06077168622467383,108.02419153849284,COMPLETE
342,0.3517601191997528,2023-09-04 18:23:37.489125,2023-09-04 18:23:39.105274,0 days 00:00:01.616149,ReLU,Leaky,,,37,18,24.0,,,0.013856448343291848,2,364,0.7997748023621063,1.5908065375908863e-05,150.81781913138724,COMPLETE
343,0.33099448680877686,2023-09-04 18:23:39.105613,2023-09-04 18:23:42.843328,0 days 00:00:03.737715,ReLU,Sigmoid,,,23,19,23.0,,,0.0066179207446947,2,343,0.7683527834783349,2.03309666414261e-05,145.60719505188956,COMPLETE
344,0.404137521982193,2023-09-04 18:23:42.843651,2023-09-04 18:23:43.389022,0 days 00:00:00.545371,ReLU,Sigmoid,,,61,17,21.0,,,0.09794577564666583,2,374,0.29786805428937335,6.296442580537802e-05,288.6067262732464,COMPLETE
345,0.42923539876937866,2023-09-04 18:23:43.389357,2023-09-04 18:23:44.927289,0 days 00:00:01.537932,Leaky,,,,18,14,,,,0.004781680270111013,1,328,0.7400271114562359,0.00028686901166932553,412.9081883923761,COMPLETE
346,0.3370952010154724,2023-09-04 18:23:44.927593,2023-09-04 18:23:56.860326,0 days 00:00:11.932733,ReLU,Leaky,,,21,16,20.0,,,0.0004316080976371004,2,384,0.684726648464746,4.301314253149544e-05,319.8817871664172,COMPLETE
347,0.4023861885070801,2023-09-04 18:23:56.860635,2023-09-04 18:23:57.463117,0 days 00:00:00.602482,ReLU,ReLU,,,56,23,24.0,,,0.010565034274297327,2,401,0.2718386785976807,2.3723968806373846e-05,178.87429187915944,COMPLETE
348,0.33923104405403137,2023-09-04 18:23:57.463439,2023-09-04 18:23:59.846933,0 days 00:00:02.383494,ReLU,Sigmoid,,,58,17,18.0,,,0.005901577856709597,2,354,0.7703876754774177,1.4411599956887237e-05,263.776582694348,COMPLETE
349,0.32504934072494507,2023-09-04 18:23:59.847250,2023-09-04 18:24:01.578743,0 days 00:00:01.731493,ReLU,Tanh,,,46,21,23.0,,,0.008280516562688217,2,365,0.7173240005317676,3.319124664097815e-05,148.89056137372862,COMPLETE
350,0.31701967120170593,2023-09-04 18:24:01.579062,2023-09-04 18:24:05.776662,0 days 00:00:04.197600,Tanh,Leaky,,,15,18,24.0,,,0.004226607751995447,2,375,0.7449609905926297,4.999245857375894e-05,201.68281375660615,COMPLETE
351,0.33524081110954285,2023-09-04 18:24:05.776991,2023-09-04 18:24:10.404643,0 days 00:00:04.627652,ReLU,Sigmoid,,,60,16,22.0,,,0.0025757685649032136,2,337,0.698481210457348,0.00035547423776485543,288.1943575680911,COMPLETE
352,0.3527175188064575,2023-09-04 18:24:10.404974,2023-09-04 18:24:12.402281,0 days 00:00:01.997307,ReLU,Leaky,,,18,19,23.0,,,0.00501910504259129,2,393,0.3937114459205287,7.67729091969648e-05,158.46514525236907,COMPLETE
353,0.3115139901638031,2023-09-04 18:24:12.402594,2023-09-04 18:24:15.323742,0 days 00:00:02.921148,ReLU,Sigmoid,,,20,20,24.0,,,0.007033950846842351,2,355,0.7983713029761021,1.8140498688199878e-05,154.2315223507765,COMPLETE
354,0.30877256393432617,2023-09-04 18:24:15.324045,2023-09-04 18:24:18.956948,0 days 00:00:03.632903,ReLU,Sigmoid,,,20,20,24.0,,,0.006621665800477308,2,355,0.656520000870695,1.4654804314663458e-05,176.6590943769975,COMPLETE
355,0.35417982935905457,2023-09-04 18:24:18.957269,2023-09-04 18:24:22.268782,0 days 00:00:03.311513,ReLU,Sigmoid,,,18,20,5.0,,,0.006469186557079197,2,355,0.681642704695117,1.4399481591540376e-05,173.62528639573318,COMPLETE
356,0.3201940059661865,2023-09-04 18:24:22.269106,2023-09-04 18:24:25.105822,0 days 00:00:02.836716,ReLU,Sigmoid,,,19,20,24.0,,,0.005387086647322758,2,362,0.49107539779523807,1.6513160898416975e-05,195.83599019050598,COMPLETE
357,0.334938108921051,2023-09-04 18:24:25.106151,2023-09-04 18:24:28.235704,0 days 00:00:03.129553,ReLU,Sigmoid,,,20,20,24.0,,,0.008995220021881436,2,351,0.6568710965030348,1.1498862502652158e-05,141.40902151380266,COMPLETE
358,0.3514266610145569,2023-09-04 18:24:28.236039,2023-09-04 18:24:31.928340,0 days 00:00:03.692301,Tanh,Sigmoid,,,22,19,24.0,,,0.0038223311420352147,2,367,0.3861277976165472,1.8448970471543286e-05,591.4801442021909,COMPLETE
359,0.5674657821655273,2023-09-04 18:24:31.928680,2023-09-04 18:25:01.462594,0 days 00:00:29.533914,Sigmoid,Sigmoid,,,14,20,24.0,,,4.902245891155856e-05,2,357,0.7159819029289618,0.00024646729260225807,398.8953284683014,COMPLETE
360,0.3918266296386719,2023-09-04 18:25:01.462900,2023-09-04 18:25:19.414478,0 days 00:00:17.951578,ReLU,Sigmoid,,,17,19,23.0,,,0.0007562180403848896,2,372,0.6527738826368366,0.0019259138286226482,209.8130653406864,COMPLETE
361,0.3352923095226288,2023-09-04 18:25:19.414795,2023-09-04 18:25:22.212248,0 days 00:00:02.797453,ReLU,Sigmoid,,,21,20,23.0,,,0.007714595612380883,2,347,0.7422705921380308,1.396952045993197e-05,424.8851318359375,COMPLETE
362,0.3222105801105499,2023-09-04 18:25:22.212573,2023-09-04 18:25:25.415932,0 days 00:00:03.203359,ReLU,Sigmoid,,,16,19,19.0,,,0.012072659740865905,2,360,0.670772656264074,0.0001415760103558402,197.67437993263712,COMPLETE
363,0.30967602133750916,2023-09-04 18:25:25.416256,2023-09-04 18:25:28.212657,0 days 00:00:02.796401,ReLU,Sigmoid,,,23,24,24.0,,,0.0058574289814302665,2,380,0.7042283904242316,0.00010331148559950748,140.6118857643821,COMPLETE
364,0.36888232827186584,2023-09-04 18:25:28.212991,2023-09-04 18:25:29.385045,0 days 00:00:01.172054,ReLU,Sigmoid,,,23,24,24.0,,,0.021443094923944275,2,381,0.6942537264471076,0.00012045700083046474,269.94263425080675,COMPLETE
365,0.31386712193489075,2023-09-04 18:25:29.385362,2023-09-04 18:25:32.218010,0 days 00:00:02.832648,ReLU,Sigmoid,,,20,24,24.0,,,0.006397230804542551,2,282,0.7126537027338767,9.83341321846228e-05,221.35574568078874,COMPLETE
366,0.34812384843826294,2023-09-04 18:25:32.218399,2023-09-04 18:25:34.295350,0 days 00:00:02.076951,ReLU,Sigmoid,,,20,23,24.0,,,0.006274362186301732,2,319,0.372392383528709,9.788110736399278e-05,145.66443169116974,COMPLETE
367,0.37324902415275574,2023-09-04 18:25:34.295670,2023-09-04 18:25:48.834102,0 days 00:00:14.538432,ReLU,Sigmoid,,,20,24,24.0,,,0.0003521851542724402,2,281,0.6437722410163564,0.00010060024638533636,271.6425044375382,COMPLETE
368,0.37627267837524414,2023-09-04 18:25:48.834413,2023-09-04 18:25:50.273132,0 days 00:00:01.438719,ReLU,Sigmoid,,,17,24,24.0,,,0.007301595955792568,2,278,0.2550547340202102,7.158495469227635e-05,242.05567983853615,COMPLETE
369,0.30595487356185913,2023-09-04 18:25:50.273449,2023-09-04 18:25:53.553806,0 days 00:00:03.280357,ReLU,Sigmoid,,,23,24,24.0,,,0.005659993071562458,2,339,0.702189734905715,7.628529732182457e-05,183.23391270637512,COMPLETE
370,0.3120221793651581,2023-09-04 18:25:53.554141,2023-09-04 18:25:58.730922,0 days 00:00:05.176781,ReLU,Sigmoid,,,24,24,24.0,,,0.005889007650836763,2,302,0.6687271080528785,8.433889018590758e-05,152.476742068204,COMPLETE
371,0.41487792134284973,2023-09-04 18:25:58.731453,2023-09-04 18:25:59.158623,0 days 00:00:00.427170,ReLU,Sigmoid,,,24,24,24.0,,,0.009166426230743228,2,309,0.1025749342068775,7.683410900538293e-05,225.30828539530435,COMPLETE
372,0.3240748345851898,2023-09-04 18:25:59.158982,2023-09-04 18:26:03.100293,0 days 00:00:03.941311,ReLU,Sigmoid,,,21,24,24.0,,,0.006070640882751768,2,328,0.605857626005275,8.659351660550664e-05,128.59779999895792,COMPLETE
373,0.36342209577560425,2023-09-04 18:26:03.100638,2023-09-04 18:26:04.693153,0 days 00:00:01.592515,ReLU,Sigmoid,,,22,24,24.0,,,0.007469157069740982,2,296,0.3113095742678133,6.246147946066816e-05,177.13275678230053,COMPLETE
374,0.35816630721092224,2023-09-04 18:26:04.693492,2023-09-04 18:26:06.110413,0 days 00:00:01.416921,ReLU,Sigmoid,,,19,24,24.0,,,0.0056573737579327325,2,299,0.32976599200481144,0.00010247438755809172,164.14411499023439,COMPLETE
375,0.3380550444126129,2023-09-04 18:26:06.110737,2023-09-04 18:26:09.208856,0 days 00:00:03.098119,ReLU,Sigmoid,,,23,24,23.0,,,0.00837635319134734,2,293,0.6635708189906103,9.171966780620609e-05,206.10540278508114,COMPLETE
376,0.33061251044273376,2023-09-04 18:26:09.209173,2023-09-04 18:26:11.353870,0 days 00:00:02.144697,ReLU,Sigmoid,,,14,24,24.0,,,0.010167882733017181,2,267,0.6260063029351619,7.697371050469574e-05,281.63473215410784,COMPLETE
377,0.31996238231658936,2023-09-04 18:26:11.354195,2023-09-04 18:26:14.580115,0 days 00:00:03.225920,ReLU,Sigmoid,,,21,23,24.0,,,0.00663376631543964,2,317,0.6890139442765816,6.355787720908001e-05,149.22395570399397,COMPLETE
378,0.3547225892543793,2023-09-04 18:26:14.580428,2023-09-04 18:26:16.389598,0 days 00:00:01.809170,ReLU,Sigmoid,,,19,24,23.0,,,0.005206412600210762,2,338,0.35104615040362025,0.00010880643183483501,183.68474203853285,COMPLETE
379,0.32955315709114075,2023-09-04 18:26:16.389948,2023-09-04 18:26:19.281472,0 days 00:00:02.891524,ReLU,Sigmoid,,,24,24,24.0,,,0.007562038823834983,2,290,0.6545304622006516,7.743969328383983e-05,179.98111979166666,COMPLETE
380,0.3131132125854492,2023-09-04 18:26:19.281798,2023-09-04 18:26:22.137502,0 days 00:00:02.855704,ReLU,Sigmoid,,,18,23,23.0,,,0.006214181174173769,2,308,0.7015461652609574,0.00011146810521439042,173.28951860510784,COMPLETE
381,0.34614333510398865,2023-09-04 18:26:22.137821,2023-09-04 18:26:24.163349,0 days 00:00:02.025528,ReLU,Sigmoid,,,16,23,24.0,,,0.005414128972130604,2,302,0.3069108402912786,0.00012404294442558831,214.94007295550722,COMPLETE
