number,value,datetime_start,datetime_complete,duration,params_activation1,params_activation2,params_activation3,params_activation4,params_batch_size,params_fl1,params_fl2,params_fl3,params_fl4,params_learning_rate,params_n_layers,params_num_epochs,params_train_size,params_weight_decay,user_attrs_mre,state
367,0.321073055267334,2023-09-04 18:14:01.808656,2023-09-04 18:14:03.452374,0 days 00:00:01.643718,ReLU,Leaky,Leaky,ReLU,62,23,24.0,12.0,11.0,0.001541066482532423,4,470,0.6900020856136171,0.0009856958968981174,102.48209586510292,COMPLETE
368,0.3050881028175354,2023-09-04 18:14:03.452724,2023-09-04 18:14:04.705562,0 days 00:00:01.252838,ReLU,Tanh,Leaky,ReLU,57,22,16.0,15.0,12.0,0.0028459450001614723,4,419,0.7357095786372368,0.0034904812387604816,102.2859048282399,COMPLETE
369,0.40205374360084534,2023-09-04 18:14:04.705904,2023-09-04 18:14:08.017345,0 days 00:00:03.311441,Tanh,Leaky,Leaky,Leaky,56,4,23.0,10.0,9.0,0.002328572361419896,4,436,0.7683655771833481,0.0005807986194983909,103.63922348022462,COMPLETE
370,0.32229480147361755,2023-09-04 18:14:08.017690,2023-09-04 18:14:09.964039,0 days 00:00:01.946349,ReLU,Tanh,Leaky,ReLU,67,19,22.0,13.0,11.0,0.003303070153188434,4,428,0.7122773262008981,0.00020650526836287408,99.19522082616412,COMPLETE
371,0.3660986125469208,2023-09-04 18:14:09.964385,2023-09-04 18:14:10.362930,0 days 00:00:00.398545,Leaky,Leaky,Leaky,ReLU,46,21,14.0,16.0,10.0,0.012355075759706832,4,407,0.1899019226060043,0.0004425012277019449,456.0210928916931,COMPLETE
372,0.712742269039154,2023-09-04 18:14:10.363280,2023-09-04 18:14:13.935913,0 days 00:00:03.572633,ReLU,ReLU,Leaky,ReLU,82,20,17.0,9.0,11.0,1.195434299209078e-05,4,282,0.33576126781981214,0.002374502573917928,139.63253481168275,COMPLETE
373,0.30401483178138733,2023-09-04 18:14:13.936256,2023-09-04 18:14:17.607265,0 days 00:00:03.671009,ReLU,Tanh,Tanh,ReLU,64,22,18.0,11.0,8.0,0.0006189300288812697,4,252,0.5864839802825049,0.00011799306103540585,105.9422427969919,COMPLETE
374,0.36138594150543213,2023-09-04 18:14:17.607609,2023-09-04 18:14:19.931898,0 days 00:00:02.324289,Leaky,,,,80,21,,,,0.0012701233705614925,1,392,0.6644367020377706,0.005862409197944538,98.54228371341212,COMPLETE
375,0.333297461271286,2023-09-04 18:14:19.932212,2023-09-04 18:14:22.724708,0 days 00:00:02.792496,ReLU,Leaky,Leaky,ReLU,61,23,24.0,14.0,12.0,0.001683555091782893,4,324,0.5713623729941235,0.01682318366424106,100.2169768234779,COMPLETE
376,0.30902397632598877,2023-09-04 18:14:22.725074,2023-09-04 18:14:26.210539,0 days 00:00:03.485465,Tanh,Sigmoid,Tanh,Tanh,59,19,15.0,10.0,9.0,0.0019728622507933272,4,415,0.7450576922437044,0.0007714481750894948,99.88153265018275,COMPLETE
377,0.33027783036231995,2023-09-04 18:14:26.210874,2023-09-04 18:14:27.547452,0 days 00:00:01.336578,ReLU,Tanh,Leaky,ReLU,85,21,21.0,13.0,7.0,0.002672593083481856,4,442,0.774954174718207,0.0010340039971156144,95.17184049432927,COMPLETE
378,0.3621688783168793,2023-09-04 18:14:27.548038,2023-09-04 18:14:33.915029,0 days 00:00:06.366991,ReLU,Leaky,Leaky,ReLU,79,20,19.0,12.0,10.0,0.0004994065211924941,4,426,0.35016485043880263,0.008214770355270497,106.26238420540263,COMPLETE
379,0.34044647216796875,2023-09-04 18:14:33.915398,2023-09-04 18:14:35.251347,0 days 00:00:01.335949,Leaky,Tanh,Tanh,ReLU,83,22,16.0,12.0,11.0,0.03638296685830864,4,340,0.7035897294281614,0.004043887369291622,134.8912287902832,COMPLETE
380,0.32985129952430725,2023-09-04 18:14:35.251707,2023-09-04 18:14:37.912623,0 days 00:00:02.660916,ReLU,Leaky,Leaky,ReLU,52,19,23.0,11.0,12.0,0.0010563544682844215,4,399,0.7970202232039248,0.00016302151308748643,110.28557645357571,COMPLETE
381,0.9811144471168518,2023-09-04 18:14:37.912962,2023-09-04 18:14:38.124595,0 days 00:00:00.211633,Sigmoid,Tanh,Sigmoid,Sigmoid,55,21,15.0,14.0,15.0,0.0014379884155025717,4,408,0.2639860207386822,0.002757558357397958,100.08170890808105,COMPLETE
382,0.2976655066013336,2023-09-04 18:14:38.124937,2023-09-04 18:14:39.594314,0 days 00:00:01.469377,ReLU,Leaky,Leaky,ReLU,81,18,22.0,12.0,13.0,0.0021859317907573957,4,462,0.7465380446554987,0.0005970369061982656,118.48747502840482,COMPLETE
383,0.34852340817451477,2023-09-04 18:14:39.594664,2023-09-04 18:14:41.382964,0 days 00:00:01.788300,Leaky,Tanh,Tanh,ReLU,86,20,24.0,10.0,10.0,0.0034129961709422067,4,418,0.6152829111860911,0.0013392265892027285,99.67601071871243,COMPLETE
384,0.29173216223716736,2023-09-04 18:14:41.383309,2023-09-04 18:14:43.085267,0 days 00:00:01.701958,ReLU,Leaky,Leaky,ReLU,82,22,23.0,11.0,11.0,0.020712450651367183,4,431,0.6747006393147605,0.00023059771789990071,89.45060313831677,COMPLETE
385,0.31952229142189026,2023-09-04 18:14:43.085626,2023-09-04 18:14:44.331814,0 days 00:00:01.246188,ReLU,Sigmoid,Leaky,Leaky,83,23,22.0,11.0,11.0,0.007562031013572979,4,452,0.661420967093997,0.00023504870291512882,97.32334121704102,COMPLETE
386,0.55340576171875,2023-09-04 18:14:44.332176,2023-09-04 18:14:44.782368,0 days 00:00:00.450192,ReLU,ReLU,Tanh,ReLU,80,22,21.0,10.0,11.0,0.04436539726945448,4,435,0.6363041934827399,0.0001257821154471598,139.19529454848345,COMPLETE
387,0.34615910053253174,2023-09-04 18:14:44.782707,2023-09-04 18:14:46.242974,0 days 00:00:01.460267,ReLU,Tanh,Leaky,ReLU,84,22,17.0,11.0,10.0,0.018725576789230917,4,428,0.6829769980692462,0.00013615781610503075,90.86465304238456,COMPLETE
388,0.36346250772476196,2023-09-04 18:14:46.243325,2023-09-04 18:14:47.118474,0 days 00:00:00.875149,ReLU,Leaky,Leaky,ReLU,82,23,23.0,9.0,9.0,0.018092996844821754,4,443,0.705917056938399,0.00019062362482574456,160.46015977859497,COMPLETE
389,0.3131312429904938,2023-09-04 18:14:47.118827,2023-09-04 18:14:48.132999,0 days 00:00:01.014172,ReLU,Tanh,Tanh,ReLU,76,22,23.0,8.0,11.0,0.006482268355111997,4,131,0.37743605347752945,0.0003738890499955086,96.61032378673553,COMPLETE
390,0.3668428957462311,2023-09-04 18:14:48.133371,2023-09-04 18:14:48.608233,0 days 00:00:00.474862,ReLU,Leaky,Leaky,ReLU,81,23,16.0,11.0,10.0,0.02824941251954993,4,423,0.7227990364548306,0.0007440667219941604,104.8228645324707,COMPLETE
391,0.33338692784309387,2023-09-04 18:14:48.608580,2023-09-04 18:14:49.370321,0 days 00:00:00.761741,ReLU,Tanh,Leaky,ReLU,79,22,14.0,10.0,9.0,0.0100475992270523,4,431,0.35432518640614225,0.0005019526779803973,114.69341336763821,COMPLETE
392,0.33182764053344727,2023-09-04 18:14:49.370656,2023-09-04 18:14:50.622702,0 days 00:00:01.252046,Tanh,Leaky,Tanh,ReLU,86,17,16.0,11.0,11.0,0.011940602423063796,4,412,0.7729139777109008,0.0008803165374011333,103.1940992528742,COMPLETE
393,0.31370115280151367,2023-09-04 18:14:50.623056,2023-09-04 18:14:51.977438,0 days 00:00:01.354382,ReLU,Tanh,Leaky,ReLU,84,19,22.0,11.0,10.0,0.012297197569299863,4,438,0.6549279447883714,0.00028440950136692585,88.88827655933521,COMPLETE
394,0.45124056935310364,2023-09-04 18:14:51.977816,2023-09-04 18:14:53.614945,0 days 00:00:01.637129,ReLU,Leaky,Leaky,ReLU,82,18,18.0,10.0,2.0,0.0038845508759187625,4,451,0.798803534795721,0.00010213066024196753,121.29854032728407,COMPLETE
395,0.3237681984901428,2023-09-04 18:14:53.615303,2023-09-04 18:14:54.842690,0 days 00:00:01.227387,ReLU,Sigmoid,Tanh,ReLU,78,21,23.0,13.0,8.0,0.013463134876009733,4,419,0.6889473557205447,0.0006692197180697482,124.9391613430447,COMPLETE
396,0.3562614619731903,2023-09-04 18:14:54.843057,2023-09-04 18:14:59.754759,0 days 00:00:04.911702,ReLU,Tanh,Leaky,ReLU,63,20,12.0,7.0,11.0,0.000386375463783282,4,191,0.7321908273149608,0.0001661719607200661,107.67846709803531,COMPLETE
397,0.33836883306503296,2023-09-04 18:14:59.755124,2023-09-04 18:15:04.522469,0 days 00:00:04.767345,Tanh,Leaky,Leaky,ReLU,68,23,20.0,12.0,12.0,0.0007391522049283475,4,401,0.7553542875170879,0.001155563119805056,89.88195137813173,COMPLETE
398,0.3481128513813019,2023-09-04 18:15:04.522804,2023-09-04 18:15:05.244957,0 days 00:00:00.722153,ReLU,Tanh,Tanh,Leaky,80,22,15.0,9.0,10.0,0.014149445914439377,4,273,0.39841153977242566,0.0009106706505858412,95.44017028808594,COMPLETE
399,0.31024226546287537,2023-09-04 18:15:05.245292,2023-09-04 18:15:05.962356,0 days 00:00:00.717064,ReLU,Leaky,Leaky,ReLU,84,20,17.0,11.0,10.0,0.019995367730862277,4,431,0.7280637491550621,0.0005826852037319542,110.99963283538818,COMPLETE
400,0.3264205753803253,2023-09-04 18:15:05.962713,2023-09-04 18:15:07.780384,0 days 00:00:01.817671,ReLU,ReLU,Leaky,ReLU,65,21,14.0,10.0,11.0,0.0031307446745453284,4,411,0.4162553554992833,0.0013208886121041053,126.04970350719634,COMPLETE
401,0.3573671579360962,2023-09-04 18:15:07.780994,2023-09-04 18:15:09.426185,0 days 00:00:01.645191,ReLU,Tanh,Tanh,Tanh,82,22,22.0,13.0,13.0,0.0270937599731151,4,420,0.36347897819787656,0.0010549826816596696,107.53295533553414,COMPLETE
402,0.31229063868522644,2023-09-04 18:15:09.426526,2023-09-04 18:15:10.803307,0 days 00:00:01.376781,Tanh,Leaky,Leaky,,77,19,7.0,11.0,,0.014321450331137775,3,440,0.7725505337406225,0.00042756812126231846,91.07843062456917,COMPLETE
403,0.3370092809200287,2023-09-04 18:15:10.803643,2023-09-04 18:15:12.464118,0 days 00:00:01.660475,ReLU,Tanh,Leaky,ReLU,85,23,16.0,12.0,12.0,0.0023291756669142957,4,288,0.47988906983861684,0.0007755876025328968,99.06754059843965,COMPLETE
404,0.2921781539916992,2023-09-04 18:15:12.464466,2023-09-04 18:15:15.607990,0 days 00:00:03.143524,ReLU,Leaky,Tanh,ReLU,79,21,23.0,11.0,9.0,0.0009414528822390722,4,396,0.6772923083796383,0.0001446819723362766,101.69643254640724,COMPLETE
405,0.32778510451316833,2023-09-04 18:15:15.608324,2023-09-04 18:15:20.237053,0 days 00:00:04.628729,ReLU,Leaky,Sigmoid,ReLU,79,21,22.0,10.0,9.0,0.0009080041592073767,4,385,0.6324982754870697,0.00015552111498365434,134.82600867939504,COMPLETE
406,0.3326619267463684,2023-09-04 18:15:20.237429,2023-09-04 18:15:22.650924,0 days 00:00:02.413495,ReLU,Leaky,Tanh,ReLU,81,21,23.0,11.0,9.0,0.0008175718667615115,4,393,0.4967514157939536,7.127047034925e-05,141.237796843998,COMPLETE
407,0.35933351516723633,2023-09-04 18:15:22.651308,2023-09-04 18:15:24.757757,0 days 00:00:02.106449,ReLU,Leaky,Leaky,ReLU,87,20,2.0,10.0,8.0,0.0011729380286050464,4,378,0.6716100070368756,0.00013067626111692052,143.54069106880274,COMPLETE
408,0.3484465777873993,2023-09-04 18:15:24.758100,2023-09-04 18:15:27.575397,0 days 00:00:02.817297,Tanh,Leaky,Leaky,ReLU,83,21,23.0,9.0,9.0,0.0006590625275669592,4,394,0.6097905853277076,0.00034464395560775693,116.2803074286236,COMPLETE
409,0.3314463496208191,2023-09-04 18:15:27.575757,2023-09-04 18:15:36.807547,0 days 00:00:09.231790,ReLU,Leaky,Tanh,ReLU,78,21,15.0,11.0,9.0,0.0002600653757516885,4,403,0.6829885078609671,0.00019983850276680424,115.22713511698954,COMPLETE
410,0.3317679166793823,2023-09-04 18:15:36.807918,2023-09-04 18:15:38.791092,0 days 00:00:01.983174,Sigmoid,Leaky,Leaky,Sigmoid,80,20,19.0,8.0,10.0,0.017328084856636596,4,409,0.7106187486079304,9.619333967523582e-05,263.5100133190416,COMPLETE
411,0.3402501046657562,2023-09-04 18:15:38.791479,2023-09-04 18:15:40.196016,0 days 00:00:01.404537,ReLU,Leaky,Leaky,ReLU,82,18,21.0,14.0,14.0,0.0009517449711470703,4,400,0.3120045582812135,0.0002264309379071245,119.50498008728027,COMPLETE
412,0.32342955470085144,2023-09-04 18:15:40.196385,2023-09-04 18:15:42.145115,0 days 00:00:01.948730,ReLU,Sigmoid,Tanh,ReLU,58,19,23.0,10.0,10.0,0.00528155711289042,4,387,0.6405174537813622,0.00010717090587188004,98.00942808581937,COMPLETE
413,0.39077049493789673,2023-09-04 18:15:42.145473,2023-09-04 18:15:42.615075,0 days 00:00:00.469602,ReLU,Leaky,Leaky,ReLU,85,20,22.0,11.0,8.0,0.004108934342233525,4,414,0.22646913576057076,0.0005102816188866032,152.20623047497807,COMPLETE
414,0.35570013523101807,2023-09-04 18:15:42.615428,2023-09-04 18:15:43.448340,0 days 00:00:00.832912,Tanh,Leaky,Leaky,Leaky,61,22,17.0,12.0,11.0,0.05496357510975892,4,294,0.3667122360103253,0.0006445571997400001,529.6707834879558,COMPLETE
415,0.3380952775478363,2023-09-04 18:15:43.448722,2023-09-04 18:15:44.704878,0 days 00:00:01.256156,ReLU,Leaky,Tanh,ReLU,79,21,15.0,11.0,12.0,0.0028203934963798153,4,407,0.696314113427251,0.0007453165904353407,97.37225494384765,COMPLETE
416,0.3386262357234955,2023-09-04 18:15:44.705227,2023-09-04 18:15:45.855647,0 days 00:00:01.150420,ReLU,Leaky,Leaky,ReLU,51,20,18.0,10.0,9.0,0.020930130526402635,4,426,0.5660747987274612,0.0001525229008646194,101.59529670509133,COMPLETE
417,0.2765488624572754,2023-09-04 18:15:45.856007,2023-09-04 18:15:47.765062,0 days 00:00:01.909055,ReLU,ReLU,Leaky,ReLU,82,21,16.0,9.0,10.0,0.008162681631324746,4,395,0.6687151384817156,0.00017778951250881428,109.34472887139572,COMPLETE
418,0.3239022195339203,2023-09-04 18:15:47.765427,2023-09-04 18:15:48.682357,0 days 00:00:00.916930,ReLU,ReLU,Leaky,ReLU,83,22,16.0,21.0,10.0,0.015546062194020627,4,279,0.5947216695610817,0.0009259150870597667,93.81412029266357,COMPLETE
419,0.36285194754600525,2023-09-04 18:15:48.682719,2023-09-04 18:15:49.007392,0 days 00:00:00.324673,ReLU,ReLU,Leaky,ReLU,87,19,16.0,9.0,11.0,0.015636968754390548,4,412,0.2372364016904664,0.00023258824979782272,215.73373293876648,COMPLETE
420,0.36463382840156555,2023-09-04 18:15:49.007747,2023-09-04 18:15:50.163858,0 days 00:00:01.156111,Leaky,Sigmoid,Leaky,ReLU,38,22,17.0,8.0,10.0,0.007260082277267094,4,424,0.5302808845789367,0.0018226129601708549,124.23283076286316,COMPLETE
421,0.34462907910346985,2023-09-04 18:15:50.164200,2023-09-04 18:15:51.006806,0 days 00:00:00.842606,Tanh,ReLU,Leaky,ReLU,86,21,16.0,9.0,13.0,0.0056417904955908165,4,263,0.43813735085790934,0.0005646943045520712,106.95223485207072,COMPLETE
422,0.32830777764320374,2023-09-04 18:15:51.007139,2023-09-04 18:15:51.482132,0 days 00:00:00.474993,ReLU,ReLU,Leaky,ReLU,84,22,15.0,9.0,11.0,0.024348457814883918,4,401,0.5148243583356595,0.0002846134212260209,103.82598180356233,COMPLETE
423,0.34228500723838806,2023-09-04 18:15:51.482480,2023-09-04 18:15:51.942160,0 days 00:00:00.459680,ReLU,ReLU,Leaky,,82,20,16.0,13.0,,0.010244434404031345,3,475,0.2714688349925553,0.00020012156169417494,128.19004245334202,COMPLETE
424,0.3271026015281677,2023-09-04 18:15:51.942492,2023-09-04 18:15:53.380277,0 days 00:00:01.437785,Leaky,ReLU,Leaky,ReLU,81,18,14.0,8.0,10.0,0.00865352770895227,4,459,0.7257883203706925,0.00018043407622187588,107.77420058617226,COMPLETE
425,0.40270355343818665,2023-09-04 18:15:53.380634,2023-09-04 18:15:53.668995,0 days 00:00:00.288361,ReLU,ReLU,Leaky,ReLU,59,14,17.0,9.0,12.0,0.009207960687916973,4,418,0.1640999169841969,1.8043371244165194e-05,116.3344024132038,COMPLETE
426,0.3195277452468872,2023-09-04 18:15:53.669357,2023-09-04 18:15:55.483991,0 days 00:00:01.814634,ReLU,ReLU,Leaky,ReLU,84,17,16.0,15.0,11.0,0.004247932944039006,4,387,0.6588744363061713,0.0004352271838996043,115.5287675857544,COMPLETE
427,0.32080140709877014,2023-09-04 18:15:55.484336,2023-09-04 18:15:59.307242,0 days 00:00:03.822906,Tanh,Sigmoid,Leaky,Leaky,87,21,13.0,14.0,10.0,0.0031750987557651444,4,431,0.7488716553253992,0.002189899054887538,131.33042114257813,COMPLETE
428,0.37908118963241577,2023-09-04 18:15:59.307862,2023-09-04 18:16:00.372690,0 days 00:00:01.064828,ReLU,Tanh,Leaky,Tanh,55,19,15.0,10.0,11.0,0.006960627452045446,4,315,0.21563828368516214,0.0006606655337067222,108.38841944727405,COMPLETE
429,1.0101691484451294,2023-09-04 18:16:00.373071,2023-09-04 18:16:01.019942,0 days 00:00:00.646871,Leaky,ReLU,Leaky,ReLU,63,22,16.0,7.0,12.0,0.031061038180370776,4,246,0.7999136205721517,0.08743882968842225,99.00782267252605,COMPLETE
430,0.3331606090068817,2023-09-04 18:16:01.020298,2023-09-04 18:16:01.871274,0 days 00:00:00.850976,ReLU,Tanh,Leaky,ReLU,81,20,22.0,13.0,10.0,0.012666159113528893,4,447,0.7110343156680422,0.0014099188774217774,95.71754534491177,COMPLETE
431,0.46246200799942017,2023-09-04 18:16:01.871619,2023-09-04 18:16:02.514833,0 days 00:00:00.643214,Sigmoid,Tanh,Leaky,ReLU,85,21,17.0,12.0,13.0,0.008922206499077368,4,407,0.2412778394961672,0.0008148988068018435,141.52704288113503,COMPLETE
432,0.3800288140773773,2023-09-04 18:16:02.515191,2023-09-04 18:16:03.080982,0 days 00:00:00.565791,ReLU,Sigmoid,Leaky,ReLU,53,18,14.0,10.0,11.0,0.02178653980894703,4,296,0.19694181531604243,0.0010048428562692174,127.33037778164478,COMPLETE
433,0.3194822072982788,2023-09-04 18:16:03.081324,2023-09-04 18:16:08.222103,0 days 00:00:05.140779,ReLU,Tanh,Leaky,Sigmoid,57,20,21.0,12.0,12.0,0.0063260366778522155,4,420,0.6192482126342723,0.0005112244277966434,113.48074278960357,COMPLETE
434,0.3346543312072754,2023-09-04 18:16:08.222711,2023-09-04 18:16:11.199332,0 days 00:00:02.976621,Leaky,Leaky,Sigmoid,ReLU,83,22,16.0,9.0,10.0,0.003620810970210953,4,436,0.465642435954312,0.0011153847167765269,109.66995445130364,COMPLETE
435,0.33098676800727844,2023-09-04 18:16:11.199697,2023-09-04 18:16:14.036377,0 days 00:00:02.836680,Tanh,Tanh,Leaky,ReLU,49,16,15.0,11.0,11.0,0.002726493896098009,4,304,0.759051391177029,0.0003217310824247632,105.90724016272503,COMPLETE
436,0.35713112354278564,2023-09-04 18:16:14.036742,2023-09-04 18:16:14.492193,0 days 00:00:00.455451,ReLU,,,,76,19,,,,0.02305534268110692,1,415,0.7302960479075933,0.0016053924462163523,103.43098799387614,COMPLETE
437,0.3056453466415405,2023-09-04 18:16:14.492533,2023-09-04 18:16:15.657428,0 days 00:00:01.164895,ReLU,Leaky,Leaky,ReLU,80,21,18.0,10.0,11.0,0.004840577470234298,4,399,0.6554626190422655,0.0007077411506448391,97.75765719943577,COMPLETE
438,0.3261108100414276,2023-09-04 18:16:15.657824,2023-09-04 18:16:17.264297,0 days 00:00:01.606473,ReLU,ReLU,Leaky,ReLU,66,22,15.0,13.0,12.0,0.0014729930517324906,4,446,0.3249752477105216,0.0008486728644512282,99.7239192356573,COMPLETE
439,0.29991891980171204,2023-09-04 18:16:17.264646,2023-09-04 18:16:18.131271,0 days 00:00:00.866625,Leaky,Tanh,Leaky,ReLU,88,21,17.0,12.0,10.0,0.016154927655887375,4,426,0.7714717578618243,0.004414829444540581,118.9155268351237,COMPLETE
440,0.37259721755981445,2023-09-04 18:16:18.131628,2023-09-04 18:16:19.693602,0 days 00:00:01.561974,ReLU,Leaky,Leaky,ReLU,61,20,23.0,8.0,13.0,0.0019685343498942664,4,280,0.692828866861763,0.0019141135019328935,108.92907285690308,COMPLETE
441,0.33434024453163147,2023-09-04 18:16:19.693949,2023-09-04 18:16:21.404226,0 days 00:00:01.710277,ReLU,Tanh,Leaky,ReLU,83,22,20.0,11.0,9.0,0.0012565066994049072,4,406,0.4470362938627948,0.00011958092368552465,140.3423867517588,COMPLETE
442,0.3689541816711426,2023-09-04 18:16:21.404569,2023-09-04 18:16:22.190438,0 days 00:00:00.785869,Tanh,Leaky,Tanh,Leaky,81,21,17.0,12.0,11.0,0.032562379786486906,4,375,0.7340169001944284,0.0005909952701074595,105.07111754240813,COMPLETE
443,0.6117696166038513,2023-09-04 18:16:22.190788,2023-09-04 18:16:23.057617,0 days 00:00:00.866829,ReLU,Sigmoid,Leaky,ReLU,86,19,22.0,13.0,10.0,0.0024572459773617686,4,430,0.2544584305671805,0.028996374494765692,132.19119226364862,COMPLETE
444,0.3228486180305481,2023-09-04 18:16:23.057965,2023-09-04 18:16:24.356217,0 days 00:00:01.298252,Leaky,Tanh,Leaky,ReLU,57,23,16.0,10.0,12.0,0.0035465675129494243,4,394,0.7669829188516429,7.528004714751011e-05,99.12380442899816,COMPLETE
445,0.5741046071052551,2023-09-04 18:16:24.356587,2023-09-04 18:16:25.620451,0 days 00:00:01.263864,ReLU,Leaky,Tanh,ReLU,17,20,23.0,9.0,11.0,0.07930533557998835,4,416,0.7099122821906909,0.0012735592148142968,154.47858781080978,COMPLETE
446,0.3319971263408661,2023-09-04 18:16:25.620799,2023-09-04 18:16:27.585670,0 days 00:00:01.964871,ReLU,Tanh,Leaky,ReLU,54,18,15.0,14.0,10.0,0.04374308184043886,4,269,0.7469500402003931,0.00099406952186146,112.51455508961396,COMPLETE
447,0.3606310784816742,2023-09-04 18:16:27.586030,2023-09-04 18:16:28.573765,0 days 00:00:00.987735,ReLU,Leaky,Leaky,ReLU,79,21,22.0,11.0,12.0,0.0015779459005520378,4,313,0.3041034922974677,0.0001729116321361556,115.12120554997371,COMPLETE
448,0.3668733239173889,2023-09-04 18:16:28.574112,2023-09-04 18:16:36.279948,0 days 00:00:07.705836,Leaky,ReLU,Tanh,ReLU,77,23,18.0,11.0,14.0,0.00010601607753578103,4,290,0.6795498079716129,0.0007507068546220464,97.4184417987692,COMPLETE
449,0.31918632984161377,2023-09-04 18:16:36.280305,2023-09-04 18:16:36.854305,0 days 00:00:00.574000,Tanh,Tanh,ReLU,ReLU,85,19,14.0,12.0,11.0,0.008260581297157642,4,453,0.2909270463267859,0.0023378769507255035,169.67878691355386,COMPLETE
450,0.2957912087440491,2023-09-04 18:16:36.854658,2023-09-04 18:16:37.641143,0 days 00:00:00.786485,ReLU,Leaky,Leaky,ReLU,83,22,19.0,9.0,10.0,0.033086432398827186,4,442,0.7996577078811278,0.0004007548285208638,122.43990539550781,COMPLETE
451,0.3311702013015747,2023-09-04 18:16:37.641555,2023-09-04 18:16:38.784913,0 days 00:00:01.143358,ReLU,Leaky,Leaky,ReLU,74,20,23.0,10.0,9.0,0.01838225875913823,4,464,0.547685155657027,0.003145932161115539,104.9348013305664,COMPLETE
452,0.5270739197731018,2023-09-04 18:16:38.785268,2023-09-04 18:16:39.354994,0 days 00:00:00.569726,ReLU,Tanh,Leaky,ReLU,59,22,24.0,13.0,15.0,0.0020772125804015087,4,421,0.13508640691662943,0.0014784434908460245,527.9215144327242,COMPLETE
453,0.29731714725494385,2023-09-04 18:16:39.355355,2023-09-04 18:16:41.221104,0 days 00:00:01.865749,Leaky,Sigmoid,Tanh,ReLU,81,21,17.0,12.0,13.0,0.004872097887876631,4,407,0.7617958741993501,0.000590656059872232,103.65826694549077,COMPLETE
454,0.27849093079566956,2023-09-04 18:16:41.221464,2023-09-04 18:16:42.576015,0 days 00:00:01.354551,ReLU,Leaky,Leaky,ReLU,78,20,21.0,11.0,11.0,0.002913586212308859,4,385,0.7140877192184651,0.0009013624240332357,107.00515617208278,COMPLETE
455,0.3156164884567261,2023-09-04 18:16:42.576404,2023-09-04 18:16:44.269459,0 days 00:00:01.693055,Tanh,Tanh,Sigmoid,ReLU,75,20,15.0,10.0,10.0,0.0029493683108223435,4,384,0.3757893189734666,5.159341833990923e-05,162.2739153261538,COMPLETE
456,0.35248494148254395,2023-09-04 18:16:44.269820,2023-09-04 18:16:44.977803,0 days 00:00:00.707983,ReLU,Leaky,Leaky,Tanh,78,20,21.0,14.0,12.0,0.0026521917284199445,4,393,0.30015085946020215,0.0009036308396508127,108.72845303570783,COMPLETE
457,0.4200971722602844,2023-09-04 18:16:44.978151,2023-09-04 18:16:47.827786,0 days 00:00:02.849635,Sigmoid,Tanh,Tanh,Leaky,77,19,21.0,12.0,11.0,0.001749365419625425,4,354,0.7207380626827916,0.0012220673556618007,116.46588029011642,COMPLETE
