number,value,datetime_start,datetime_complete,duration,params_activation1,params_activation2,params_activation3,params_activation4,params_batch_size,params_fl1,params_fl2,params_fl3,params_fl4,params_learning_rate,params_n_layers,params_num_epochs,params_train_size,params_weight_decay,user_attrs_mre,state
283,0.33121055364608765,2023-09-04 18:15:04.354751,2023-09-04 18:15:10.952412,0 days 00:00:06.597661,Leaky,ReLU,ReLU,,11,24,24.0,10.0,,0.0025774753080572248,3,258,0.507284576936102,0.0010845989773468447,160.1491146603146,COMPLETE
284,0.3517477214336395,2023-09-04 18:15:10.952728,2023-09-04 18:15:23.935903,0 days 00:00:12.983175,Leaky,ReLU,ReLU,Tanh,15,23,9.0,19.0,18.0,0.0006400995886150183,4,264,0.6839861024089438,0.0005029245005466951,290.4518992726396,COMPLETE
285,0.334183007478714,2023-09-04 18:15:23.936504,2023-09-04 18:15:40.078756,0 days 00:00:16.142252,Leaky,ReLU,ReLU,Tanh,13,23,23.0,21.0,21.0,0.004308701161816197,4,140,0.7389497606932798,0.0023225187687848643,209.73866734360203,COMPLETE
286,0.980548620223999,2023-09-04 18:15:40.079345,2023-09-04 18:15:49.067047,0 days 00:00:08.987702,Leaky,ReLU,Sigmoid,Tanh,16,23,24.0,24.0,16.0,0.003683837234150156,4,81,0.6506065062503288,0.014544747325046806,113.54773254394532,COMPLETE
287,0.49636101722717285,2023-09-04 18:15:49.067375,2023-09-04 18:16:31.695784,0 days 00:00:42.628409,Leaky,ReLU,ReLU,Sigmoid,11,22,22.0,22.0,20.0,3.272938774500562e-05,4,286,0.7734638551276902,0.0023905165455086713,208.23034993418446,COMPLETE
288,0.3970277011394501,2023-09-04 18:16:31.696116,2023-09-04 18:16:32.682809,0 days 00:00:00.986693,Leaky,ReLU,ReLU,Sigmoid,15,22,23.0,23.0,22.0,0.00608066297276032,4,274,0.1522654974634874,0.000897913487985829,306.4983516786157,COMPLETE
289,0.35876649618148804,2023-09-04 18:16:32.683136,2023-09-04 18:16:36.800671,0 days 00:00:04.117535,Leaky,ReLU,Leaky,Sigmoid,23,21,22.0,24.0,22.0,0.002840056815027812,4,253,0.48390835214658634,0.0014635720254513207,209.23318612234934,COMPLETE
290,0.3555932939052582,2023-09-04 18:16:36.801002,2023-09-04 18:16:40.349944,0 days 00:00:03.548942,Leaky,ReLU,ReLU,Leaky,20,22,23.0,21.0,19.0,0.004571857295728964,4,264,0.7991944325844634,0.0032783362987612308,1012.5853237575955,COMPLETE
291,0.3212307393550873,2023-09-04 18:16:40.350282,2023-09-04 18:16:48.243928,0 days 00:00:07.893646,Leaky,ReLU,ReLU,Tanh,13,23,24.0,22.0,20.0,0.001664850989572039,4,279,0.7100884595123429,0.0005673928321810589,183.60509551517546,COMPLETE
292,0.35515567660331726,2023-09-04 18:16:48.244261,2023-09-04 18:16:52.144639,0 days 00:00:03.900378,Leaky,ReLU,Tanh,ReLU,17,24,23.0,16.0,21.0,0.0032803248136031157,4,300,0.4722272973313095,0.002015146432160892,146.6926474649398,COMPLETE
293,0.3342607021331787,2023-09-04 18:16:52.144966,2023-09-04 18:16:58.199131,0 days 00:00:06.054165,Tanh,ReLU,ReLU,Sigmoid,10,21,21.0,22.0,23.0,0.0050969832000905355,4,270,0.7424226998741703,0.00038136934362241747,210.65908532393607,COMPLETE
294,0.34665539860725403,2023-09-04 18:16:58.199466,2023-09-04 18:17:03.629739,0 days 00:00:05.430273,Leaky,ReLU,ReLU,Sigmoid,21,22,22.0,13.0,19.0,0.0023217448512773287,4,294,0.7734996038575702,0.0007448222741045895,217.89855346679687,COMPLETE
295,0.33108624815940857,2023-09-04 18:17:03.630072,2023-09-04 18:17:15.929328,0 days 00:00:12.299256,Leaky,ReLU,ReLU,Sigmoid,15,23,24.0,20.0,21.0,0.0014471567603076205,4,254,0.735320322075552,0.0012181541309475839,141.84772158536043,COMPLETE
296,0.35601770877838135,2023-09-04 18:17:15.929649,2023-09-04 18:17:18.507200,0 days 00:00:02.577551,Leaky,ReLU,Leaky,Tanh,18,22,23.0,23.0,18.0,0.0039657258501295785,4,284,0.3882230159510597,0.0010105041308803178,634.2051526583158,COMPLETE
297,0.34145477414131165,2023-09-04 18:17:18.507537,2023-09-04 18:17:25.453467,0 days 00:00:06.945930,Leaky,ReLU,ReLU,Sigmoid,12,21,22.0,24.0,22.0,0.002664801001261953,4,243,0.6814878593617473,0.000510716515791099,181.18272972106934,COMPLETE
298,0.3506201505661011,2023-09-04 18:17:25.453790,2023-09-04 18:17:40.765163,0 days 00:00:15.311373,Leaky,ReLU,ReLU,Leaky,16,23,23.0,21.0,23.0,0.00033060654783311394,4,261,0.7697650667387002,0.0006806097821648874,172.29700275177652,COMPLETE
299,0.3433118462562561,2023-09-04 18:17:40.765497,2023-09-04 18:17:45.892691,0 days 00:00:05.127194,Leaky,ReLU,ReLU,Sigmoid,19,24,24.0,23.0,17.0,0.0035785411363193523,4,272,0.711176000144093,0.0008723106959853515,3102.1022338867188,COMPLETE
300,1.0059541463851929,2023-09-04 18:17:45.893030,2023-09-04 18:17:47.626678,0 days 00:00:01.733648,Leaky,ReLU,ReLU,Sigmoid,14,22,23.0,1.0,20.0,0.001928576179309338,4,234,0.6644737177212995,0.0004689575992429493,107.28244018554688,COMPLETE
301,0.33948126435279846,2023-09-04 18:17:47.627028,2023-09-04 18:17:51.996159,0 days 00:00:04.369131,Leaky,ReLU,ReLU,Tanh,22,21,21.0,22.0,8.0,0.0010680176863884158,4,216,0.7983937734285941,0.005149955151758159,203.25335957453802,COMPLETE
302,1.007175326347351,2023-09-04 18:17:51.996493,2023-09-04 18:17:54.368297,0 days 00:00:02.371804,Leaky,ReLU,Leaky,Sigmoid,17,22,1.0,18.0,24.0,0.005445497036448266,4,268,0.7521293266042237,0.0006073247199778006,124.67769171974875,COMPLETE
303,0.3412339389324188,2023-09-04 18:17:54.368628,2023-09-04 18:17:56.102422,0 days 00:00:01.733794,Leaky,ReLU,ReLU,,97,23,22.0,24.0,,0.0031172262909398406,3,56,0.7672853774421455,0.001372521282744797,198.9015233176095,COMPLETE
304,0.9459169507026672,2023-09-04 18:17:56.102963,2023-09-04 18:18:00.292283,0 days 00:00:04.189320,Leaky,ReLU,Sigmoid,Leaky,19,21,24.0,19.0,23.0,0.004070525050777457,4,389,0.7271874973037019,0.04653688315852138,103.54363536834717,COMPLETE
305,0.5162555575370789,2023-09-04 18:18:00.292615,2023-09-04 18:18:13.089433,0 days 00:00:12.796818,Sigmoid,ReLU,ReLU,Sigmoid,14,3,23.0,24.0,22.0,0.0024335061857699482,4,289,0.4290443567167069,0.0007340379276718075,197.57401879882812,COMPLETE
306,0.3933379352092743,2023-09-04 18:18:13.089771,2023-09-04 18:18:15.218075,0 days 00:00:02.128304,Leaky,ReLU,ReLU,Sigmoid,17,22,22.0,23.0,21.0,0.006025001301418499,4,253,0.3481534625964899,0.0017992945206661078,272.3404768123183,COMPLETE
307,0.7078191637992859,2023-09-04 18:18:15.218401,2023-09-04 18:18:17.566073,0 days 00:00:02.347672,Leaky,ReLU,Tanh,Tanh,24,23,23.0,21.0,1.0,0.0031512098436939193,4,282,0.46486836094894135,0.0010315906267285076,162.06351862198267,COMPLETE
308,0.3352108299732208,2023-09-04 18:18:17.566404,2023-09-04 18:18:23.181538,0 days 00:00:05.615134,Leaky,ReLU,ReLU,Sigmoid,12,22,24.0,22.0,20.0,0.004602990743793,4,263,0.7695366090563316,0.0004078789104061989,142.2035864805564,COMPLETE
309,0.34860748052597046,2023-09-04 18:18:23.181863,2023-09-04 18:18:28.718669,0 days 00:00:05.536806,Leaky,ReLU,Leaky,ReLU,20,21,22.0,20.0,22.0,0.0020119527617698855,4,273,0.6935048182925809,0.0008286749557279523,143.94949056587967,COMPLETE
310,0.3392643332481384,2023-09-04 18:18:28.719004,2023-09-04 18:18:34.856288,0 days 00:00:06.137284,Leaky,ReLU,ReLU,Sigmoid,15,22,23.0,23.0,24.0,0.0026637107963800102,4,245,0.7365938474868888,0.0005813686338211854,144.20158461028456,COMPLETE
311,0.37359607219696045,2023-09-04 18:18:34.856628,2023-09-04 18:18:48.858257,0 days 00:00:14.001629,Leaky,ReLU,ReLU,Leaky,18,23,21.0,22.0,23.0,0.0004504254002289177,4,259,0.7984607653390859,0.0006957940228991278,148.3551246469671,COMPLETE
312,0.43101292848587036,2023-09-04 18:18:48.858596,2023-09-04 18:18:50.741973,0 days 00:00:01.883377,Leaky,,,,21,20,,,,0.003762791072992625,1,278,0.5261205823153485,0.001471944180694174,194.98096720377603,COMPLETE
313,0.32188844680786133,2023-09-04 18:18:50.742359,2023-09-04 18:18:55.383316,0 days 00:00:04.640957,Leaky,ReLU,ReLU,Sigmoid,26,24,24.0,24.0,21.0,0.005100574784318408,4,298,0.7180574321081267,0.001153444629858967,174.94046089865944,COMPLETE
314,0.333126038312912,2023-09-04 18:18:55.383703,2023-09-04 18:19:01.929863,0 days 00:00:06.546160,Leaky,ReLU,ReLU,Sigmoid,16,21,23.0,23.0,22.0,0.003059658547249686,4,225,0.6297947537969564,0.00048212447936289596,119.61164774576822,COMPLETE
315,0.35079410672187805,2023-09-04 18:19:01.930191,2023-09-04 18:19:07.718492,0 days 00:00:05.788301,Leaky,ReLU,ReLU,Tanh,13,22,22.0,4.0,23.0,0.0015788224755435725,4,287,0.7632709590540715,0.0009805403611470047,201.46128777398005,COMPLETE
316,0.3212302327156067,2023-09-04 18:19:07.718820,2023-09-04 18:19:13.218284,0 days 00:00:05.499464,Tanh,ReLU,Leaky,Sigmoid,10,23,23.0,21.0,11.0,0.006158686191832845,4,397,0.799907806214868,0.00037502345052065625,179.52920866012573,COMPLETE
317,0.40626296401023865,2023-09-04 18:19:13.218623,2023-09-04 18:19:31.379480,0 days 00:00:18.160857,Leaky,ReLU,ReLU,Sigmoid,23,22,24.0,23.0,15.0,0.00015056909934676253,4,266,0.6649387431848859,0.0008398055648738038,352.99815403070664,COMPLETE
318,0.3340514302253723,2023-09-04 18:19:31.379809,2023-09-04 18:19:36.030146,0 days 00:00:04.650337,Leaky,ReLU,ReLU,Leaky,18,21,22.0,20.0,19.0,0.002270793514258144,4,252,0.5066834953001211,0.0006183777533805571,160.75883978766365,COMPLETE
319,0.3745684027671814,2023-09-04 18:19:36.030481,2023-09-04 18:19:38.767375,0 days 00:00:02.736894,Leaky,ReLU,ReLU,Sigmoid,15,23,23.0,24.0,21.0,0.003906542227397706,4,239,0.27382138151321983,0.0005150799354358572,139.47126957820012,COMPLETE
320,0.3277701139450073,2023-09-04 18:19:38.767700,2023-09-04 18:19:42.031170,0 days 00:00:03.263470,Leaky,ReLU,ReLU,Tanh,20,22,24.0,22.0,24.0,0.0067493469143802285,4,275,0.744464141914142,0.0009246122347160872,197.04180908203125,COMPLETE
321,0.3153209090232849,2023-09-04 18:19:42.031498,2023-09-04 18:19:50.349251,0 days 00:00:08.317753,Leaky,ReLU,Leaky,Sigmoid,12,21,23.0,23.0,16.0,0.002710774942542308,4,260,0.7009400480847668,0.0012956654224602548,532.7441258285985,COMPLETE
322,0.34079709649086,2023-09-04 18:19:50.349580,2023-09-04 18:19:56.448351,0 days 00:00:06.098771,Leaky,ReLU,Leaky,Sigmoid,12,21,22.0,6.0,15.0,0.0033460354209461345,4,254,0.4090016544837744,0.0010920565604954008,221.53177047357326,COMPLETE
323,0.3700430989265442,2023-09-04 18:19:56.448682,2023-09-04 18:20:02.144650,0 days 00:00:05.695968,Leaky,ReLU,Leaky,Sigmoid,10,20,23.0,22.0,16.0,0.004606518253037171,4,293,0.6980265773278697,0.0013498666437005155,170.19889510305305,COMPLETE
324,0.3363893926143646,2023-09-04 18:20:02.144981,2023-09-04 18:20:08.573468,0 days 00:00:06.428487,Leaky,ReLU,Leaky,Sigmoid,13,21,24.0,21.0,16.0,0.0027606332449060965,4,244,0.572519965040482,0.0006667624092024446,194.37881310306378,COMPLETE
325,0.34107521176338196,2023-09-04 18:20:08.573792,2023-09-04 18:20:12.991248,0 days 00:00:04.417456,Leaky,ReLU,Leaky,Sigmoid,17,20,21.0,23.0,22.0,0.004017581156400642,4,280,0.6307580028737136,0.00037167497897322665,2715.1146491555605,COMPLETE
326,0.34381499886512756,2023-09-04 18:20:12.991573,2023-09-04 18:20:33.867057,0 days 00:00:20.875484,Leaky,ReLU,Sigmoid,Sigmoid,22,21,23.0,22.0,20.0,0.0014088353973384787,4,261,0.7690143648485838,0.0007583790806068187,175.73961073352444,COMPLETE
327,0.3099221885204315,2023-09-04 18:20:33.867661,2023-09-04 18:20:58.605551,0 days 00:00:24.737890,Leaky,ReLU,Leaky,Sigmoid,27,22,22.0,21.0,23.0,0.0019411068798744946,4,271,0.7995433038621264,0.001137115442395078,160.18123258863176,COMPLETE
328,0.34068813920021057,2023-09-04 18:20:58.606141,2023-09-04 18:21:11.278670,0 days 00:00:12.672529,Leaky,ReLU,Leaky,Leaky,12,21,22.0,20.0,21.0,0.0017144002935777986,4,274,0.5991698515772306,0.0011908396181429662,151.58289753306997,COMPLETE
329,0.4387356638908386,2023-09-04 18:21:11.279024,2023-09-04 18:21:19.788598,0 days 00:00:08.509574,Sigmoid,ReLU,Leaky,Sigmoid,27,22,21.0,19.0,23.0,0.0019348748869608867,4,287,0.6973633689767958,0.0015936160462618988,225.85869495288745,COMPLETE
330,0.6102963089942932,2023-09-04 18:21:19.789210,2023-09-04 18:21:35.241364,0 days 00:00:15.452154,Leaky,ReLU,Leaky,,28,21,22.0,21.0,,1.4085353679090748e-05,3,269,0.3078063109533615,0.000968961828015621,254.50836890692162,COMPLETE
331,0.362924724817276,2023-09-04 18:21:35.241977,2023-09-04 18:21:40.633391,0 days 00:00:05.391414,Leaky,ReLU,Leaky,Sigmoid,25,20,22.0,23.0,22.0,0.0021775138439444103,4,281,0.44395619949214465,0.0013041765433230818,151.67218961420747,COMPLETE
332,0.34659668803215027,2023-09-04 18:21:40.633764,2023-09-04 18:21:46.888667,0 days 00:00:06.254903,Leaky,ReLU,Tanh,Sigmoid,28,22,23.0,23.0,17.0,0.0027016674785342782,4,300,0.7524797986684667,0.0008249895316748751,186.71649033682687,COMPLETE
333,0.3374041020870209,2023-09-04 18:21:46.889048,2023-09-04 18:21:49.918005,0 days 00:00:03.028957,Leaky,ReLU,Leaky,ReLU,24,19,24.0,21.0,18.0,0.005319761745343677,4,262,0.7160442883667302,0.0012222321330315176,190.73194846128806,COMPLETE
334,0.3474297821521759,2023-09-04 18:21:49.918371,2023-09-04 18:21:55.573260,0 days 00:00:05.654889,Leaky,ReLU,Leaky,Sigmoid,14,22,22.0,24.0,22.0,0.0067813902062925134,4,272,0.6613439531075122,0.0009908752960548538,427.8843734741211,COMPLETE
335,0.33661556243896484,2023-09-04 18:21:55.573653,2023-09-04 18:21:59.222980,0 days 00:00:03.649327,Leaky,ReLU,ReLU,Leaky,20,21,21.0,22.0,14.0,0.0016675123217400865,4,291,0.7672848896959676,0.0015597075460800358,271.77726209485854,COMPLETE
336,0.3823440670967102,2023-09-04 18:21:59.223361,2023-09-04 18:22:04.552740,0 days 00:00:05.329379,Leaky,ReLU,ReLU,Sigmoid,16,21,23.0,23.0,21.0,0.0011046517430703493,4,384,0.2592581322145203,0.000729154127621762,159.56911422957236,COMPLETE
337,0.3504185974597931,2023-09-04 18:22:04.553104,2023-09-04 18:22:31.516408,0 days 00:00:26.963304,Leaky,ReLU,Leaky,Sigmoid,11,13,22.0,24.0,23.0,0.001223229383175384,4,282,0.7377584756415251,0.0011183345515803854,204.2301730782645,COMPLETE
338,0.3559843599796295,2023-09-04 18:22:31.516775,2023-09-04 18:22:34.977661,0 days 00:00:03.460886,Leaky,ReLU,ReLU,Sigmoid,29,22,24.0,20.0,20.0,0.002232689697749616,4,263,0.5399723142549006,0.0001478147498883847,189.4815226963588,COMPLETE
339,0.3390430212020874,2023-09-04 18:22:34.978018,2023-09-04 18:22:42.671703,0 days 00:00:07.693685,Leaky,ReLU,ReLU,Sigmoid,13,23,23.0,18.0,21.0,0.0030212293674586423,4,256,0.7723056397103679,0.0008743369990495181,172.01623959011502,COMPLETE
340,0.34051430225372314,2023-09-04 18:22:42.672122,2023-09-04 18:22:46.569664,0 days 00:00:03.897542,Tanh,ReLU,Sigmoid,Leaky,26,20,21.0,12.0,22.0,0.004640897622077151,4,275,0.7976379116792146,0.0006320682939171116,160.67900695800782,COMPLETE
341,0.7526641488075256,2023-09-04 18:22:46.570018,2023-09-04 18:22:48.075617,0 days 00:00:01.505599,Leaky,ReLU,ReLU,Sigmoid,22,22,22.0,21.0,23.0,0.06988551597421075,4,237,0.6907243893285656,0.0004071152300742932,195.3256940339741,COMPLETE
342,0.3390989899635315,2023-09-04 18:22:48.075984,2023-09-04 18:22:54.740969,0 days 00:00:06.664985,Leaky,ReLU,Leaky,Sigmoid,19,21,24.0,23.0,24.0,0.0037087058617962096,4,248,0.7232169752406029,0.0005740643312103481,225.38109715779623,COMPLETE
343,0.418972373008728,2023-09-04 18:22:54.741336,2023-09-04 18:23:02.023867,0 days 00:00:07.282531,Leaky,ReLU,ReLU,Sigmoid,16,23,20.0,22.0,4.0,0.0007684039712982941,4,269,0.3253322751073996,0.0007860880691485793,201.24839737540796,COMPLETE
344,0.3411685824394226,2023-09-04 18:23:02.024231,2023-09-04 18:23:08.934746,0 days 00:00:06.910515,Leaky,ReLU,ReLU,Sigmoid,14,22,23.0,22.0,20.0,0.0026532426344423694,4,290,0.49113067992313547,0.0010672435741778785,155.62328568424087,COMPLETE
345,0.3498065173625946,2023-09-04 18:23:08.935105,2023-09-04 18:23:11.709319,0 days 00:00:02.774214,Leaky,ReLU,Tanh,Leaky,17,24,24.0,24.0,22.0,0.005654490356704702,4,304,0.3774555181722963,0.0004644769877618643,165.73815379423255,COMPLETE
346,0.355170875787735,2023-09-04 18:23:11.709671,2023-09-04 18:23:18.150487,0 days 00:00:06.440816,Leaky,ReLU,ReLU,Sigmoid,20,22,22.0,23.0,21.0,0.0013459530358540704,4,280,0.7472001683493255,0.0014176403591110557,181.86488778250558,COMPLETE
347,0.3260969817638397,2023-09-04 18:23:18.150858,2023-09-04 18:23:27.536732,0 days 00:00:09.385874,Leaky,ReLU,ReLU,Sigmoid,10,21,23.0,24.0,23.0,0.003432732420643732,4,261,0.7983051889455979,0.0009064367091264461,149.1003498840332,COMPLETE
348,0.40687474608421326,2023-09-04 18:23:27.537113,2023-09-04 18:23:33.493090,0 days 00:00:05.955977,Leaky,,,,23,23,,,,0.0019954462944869124,1,375,0.6530326002752077,0.00032751394858752595,290.0568857629315,COMPLETE
349,0.3267015516757965,2023-09-04 18:23:33.493479,2023-09-04 18:23:45.446255,0 days 00:00:11.952776,Leaky,Tanh,Leaky,ReLU,12,22,23.0,23.0,18.0,0.004183933764334595,4,269,0.589675441079572,9.853302818110196e-05,135.7264530475323,COMPLETE
350,0.671392023563385,2023-09-04 18:23:45.446632,2023-09-04 18:23:55.599547,0 days 00:00:10.152915,Leaky,Sigmoid,ReLU,Tanh,18,20,23.0,21.0,21.0,1.9530726043727063e-05,4,254,0.23911271263029363,0.0006819457225442267,131.5553754971722,COMPLETE
351,0.34812837839126587,2023-09-04 18:23:55.599916,2023-09-04 18:24:12.292618,0 days 00:00:16.692702,Leaky,ReLU,ReLU,,15,22,22.0,22.0,,0.005078816289774076,3,285,0.7678226382302403,0.0005510517540200672,139.46969468253,COMPLETE
352,0.38595008850097656,2023-09-04 18:24:12.293217,2023-09-04 18:24:41.702056,0 days 00:00:29.408839,Sigmoid,ReLU,ReLU,Sigmoid,32,21,24.0,19.0,22.0,0.0025414153236429206,4,272,0.7038482455814437,0.0017784739915103916,383.06414622886507,COMPLETE
353,0.3620622158050537,2023-09-04 18:24:41.702675,2023-09-04 18:24:56.472363,0 days 00:00:14.769688,Leaky,ReLU,Leaky,Sigmoid,25,23,21.0,21.0,23.0,0.0009612291063293264,4,294,0.7406510259816287,0.001244806943478869,179.78435316539947,COMPLETE
354,0.3392670154571533,2023-09-04 18:24:56.472765,2023-09-04 18:25:06.036964,0 days 00:00:09.564199,Leaky,ReLU,ReLU,Leaky,14,21,23.0,24.0,24.0,0.006536994278723444,4,247,0.4590657093313351,0.000785847102001466,229.8841150795541,COMPLETE
355,0.3449460566043854,2023-09-04 18:25:06.037583,2023-09-04 18:25:14.840566,0 days 00:00:08.802983,Leaky,ReLU,ReLU,Sigmoid,21,24,22.0,20.0,20.0,0.003160631404444591,4,260,0.39559909365019,0.00014237948611012135,151.4224564124798,COMPLETE
356,0.4486842751502991,2023-09-04 18:25:14.841157,2023-09-04 18:25:20.557589,0 days 00:00:05.716432,Leaky,ReLU,ReLU,Tanh,19,22,24.0,23.0,22.0,0.0017798256415266025,4,283,0.10040105639306793,0.007694550731387363,306.954983744128,COMPLETE
357,0.3881808817386627,2023-09-04 18:25:20.558198,2023-09-04 18:25:30.065501,0 days 00:00:09.507303,Leaky,ReLU,Leaky,Sigmoid,16,23,24.0,22.0,12.0,0.00230966226225363,4,232,0.33729849334196266,1.2198530489247994e-05,147.90229143415178,COMPLETE
358,0.3329433500766754,2023-09-04 18:25:30.066125,2023-09-04 18:26:00.914856,0 days 00:00:30.848731,Leaky,Sigmoid,ReLU,Sigmoid,12,22,22.0,24.0,19.0,0.004133317682126036,4,266,0.7715182110303856,0.00018696287285832638,150.42858704524255,COMPLETE
359,0.33126693964004517,2023-09-04 18:26:00.915469,2023-09-04 18:26:08.348474,0 days 00:00:07.433005,Leaky,ReLU,Sigmoid,Sigmoid,17,21,23.0,22.0,21.0,0.0029585220291727435,4,276,0.7152242838869792,0.0009711908203498668,165.2851305764819,COMPLETE
360,0.35938504338264465,2023-09-04 18:26:08.348820,2023-09-04 18:26:10.354563,0 days 00:00:02.005743,Leaky,ReLU,,,21,20,23.0,,,0.008468425025759587,2,391,0.416150584872995,0.0004474760821125394,125.23056082889951,COMPLETE
361,0.3706061542034149,2023-09-04 18:26:10.354891,2023-09-04 18:26:13.057613,0 days 00:00:02.702722,Leaky,ReLU,ReLU,Sigmoid,27,22,22.0,15.0,22.0,0.0035643644134358598,4,408,0.3582586655338172,0.000664592522940773,192.03126169179941,COMPLETE
362,0.30054938793182373,2023-09-04 18:26:13.057980,2023-09-04 18:26:19.612001,0 days 00:00:06.554021,Leaky,ReLU,,,14,23,23.0,,,0.005200486561543896,2,257,0.7990490710690398,0.0003609543278820967,257.40141540527344,COMPLETE
363,0.3170788288116455,2023-09-04 18:26:19.612331,2023-09-04 18:26:23.999110,0 days 00:00:04.386779,Leaky,ReLU,ReLU,Leaky,14,23,21.0,23.0,23.0,0.005294636602142643,4,247,0.7720963572199823,0.0003190865034994749,203.71653951009114,COMPLETE
364,0.32762131094932556,2023-09-04 18:26:23.999688,2023-09-04 18:26:30.362573,0 days 00:00:06.362885,Leaky,ReLU,ReLU,Leaky,13,24,21.0,23.0,23.0,0.004564893662321747,4,240,0.7693552366569861,0.0003636726114162241,344.19562585013256,COMPLETE
365,0.3092680871486664,2023-09-04 18:26:30.362909,2023-09-04 18:26:36.264201,0 days 00:00:05.901292,Leaky,ReLU,ReLU,Leaky,11,23,20.0,8.0,24.0,0.004714100850860355,4,249,0.7964082239285818,0.00033301576610197974,510.0746957879317,COMPLETE
366,0.3299347758293152,2023-09-04 18:26:36.264530,2023-09-04 18:26:41.631172,0 days 00:00:05.366642,Tanh,ReLU,ReLU,Leaky,13,24,19.0,9.0,24.0,0.005323893149341706,4,226,0.7707482444086491,0.0003103460345064745,223.94237648568503,COMPLETE
367,0.34193435311317444,2023-09-04 18:26:41.631520,2023-09-04 18:26:53.271737,0 days 00:00:11.640217,Leaky,ReLU,ReLU,Leaky,10,23,20.0,14.0,24.0,0.007006899709969718,4,248,0.7973928210645471,0.00022240038575101838,207.6730113173976,COMPLETE
368,0.332594096660614,2023-09-04 18:26:53.272093,2023-09-04 18:27:02.332374,0 days 00:00:09.060281,Leaky,ReLU,ReLU,Leaky,11,23,20.0,9.0,23.0,0.00503573031949087,4,240,0.798402403594872,0.00032116913988441655,366.4828078658492,COMPLETE
369,0.347446471452713,2023-09-04 18:27:02.332832,2023-09-04 18:27:08.766798,0 days 00:00:06.433966,Leaky,ReLU,ReLU,Leaky,14,19,21.0,8.0,23.0,0.005938985754947428,4,254,0.7395941150286778,0.0003503554940999433,146.6965582505712,COMPLETE
370,0.34371259808540344,2023-09-04 18:27:08.767173,2023-09-04 18:27:16.623358,0 days 00:00:07.856185,Leaky,ReLU,Leaky,Leaky,12,23,21.0,6.0,24.0,0.004479740214477382,4,247,0.7993312601553267,0.00040534393179037805,233.92621454202904,COMPLETE
371,0.3563452661037445,2023-09-04 18:27:16.623816,2023-09-04 18:27:27.179200,0 days 00:00:10.555384,Leaky,ReLU,Tanh,Leaky,10,24,21.0,21.0,22.0,0.0031573199634378998,4,209,0.7467987539861358,0.00110286737841442,179.2385074781335,COMPLETE
372,0.3118469715118408,2023-09-04 18:27:27.179551,2023-09-04 18:27:32.793068,0 days 00:00:05.613517,Leaky,ReLU,ReLU,Leaky,15,23,20.0,23.0,17.0,0.0020322214226603896,4,256,0.7991693029465874,0.00027321785919221214,165.43598583132723,COMPLETE
