number,value,datetime_start,datetime_complete,duration,params_activation1,params_activation2,params_activation3,params_activation4,params_batch_size,params_fl1,params_fl2,params_fl3,params_fl4,params_learning_rate,params_n_layers,params_num_epochs,params_train_size,params_weight_decay,user_attrs_mre,state
364,114.5308837890625,2023-09-04 19:57:45.424438,2023-09-04 19:57:48.687016,0 days 00:00:03.262578,Sigmoid,Sigmoid,Leaky,,53,14,24.0,12.0,,4.141772961268968e-05,3,186,0.2381609238582127,0.0009319674743138454,1.0054491758346558,COMPLETE
365,123.10476214476306,2023-09-04 19:57:48.687350,2023-09-04 19:57:50.589143,0 days 00:00:01.901793,Sigmoid,Tanh,Leaky,,99,11,23.0,14.0,,0.00010724197985264261,3,198,0.22694767298611326,0.008954035195804459,0.7511307001113892,COMPLETE
366,106.36105110531761,2023-09-04 19:57:50.589469,2023-09-04 19:57:54.176990,0 days 00:00:03.587521,Sigmoid,Sigmoid,Leaky,Leaky,48,10,22.0,15.0,7.0,1.259297074301505e-05,4,168,0.2844808690690017,0.0020319774734522786,0.9286341667175293,COMPLETE
367,126.24004261145431,2023-09-04 19:57:54.177329,2023-09-04 19:57:58.185375,0 days 00:00:04.008046,Sigmoid,Sigmoid,Leaky,Leaky,94,14,23.0,14.0,5.0,0.0002976308971214572,4,178,0.525015507984272,0.007390038039483381,0.6907435059547424,COMPLETE
368,115.84277103091246,2023-09-04 19:57:58.185709,2023-09-04 19:58:00.236129,0 days 00:00:02.050420,ReLU,Sigmoid,Leaky,Sigmoid,51,15,21.0,16.0,6.0,2.0853718325825293e-05,4,206,0.2522500301116758,0.009425687203886951,0.9765123724937439,COMPLETE
369,112.7259616261905,2023-09-04 19:58:00.236470,2023-09-04 19:58:05.810452,0 days 00:00:05.573982,Sigmoid,Tanh,Leaky,,56,8,22.0,16.0,,1.7010052517865695e-05,3,194,0.5589250666617678,0.0017248908995509613,0.7932735085487366,COMPLETE
370,99.80688430786132,2023-09-04 19:58:05.810787,2023-09-04 19:58:06.965869,0 days 00:00:01.155082,Sigmoid,Sigmoid,Leaky,Leaky,91,9,24.0,15.0,6.0,2.8887434368816238e-05,4,179,0.6645001037697456,0.006295267738117534,1.0419344902038574,COMPLETE
371,114.28990614557841,2023-09-04 19:58:06.966210,2023-09-04 19:58:09.349412,0 days 00:00:02.383202,Sigmoid,Sigmoid,Leaky,Leaky,49,15,23.0,14.0,15.0,8.397275490968521e-05,4,166,0.26719252134520155,0.004962184699737755,0.7206907272338867,COMPLETE
372,113.83205086844308,2023-09-04 19:58:09.349749,2023-09-04 19:58:13.203094,0 days 00:00:03.853345,Sigmoid,Sigmoid,Leaky,,87,14,24.0,9.0,,5.20917658588808e-05,3,189,0.49935843150788484,0.0016066832028865288,0.6327883005142212,COMPLETE
373,96.24029767458842,2023-09-04 19:58:13.203427,2023-09-04 19:58:15.150798,0 days 00:00:01.947371,Sigmoid,Sigmoid,Leaky,Leaky,75,10,21.0,14.0,4.0,1.3394275931045419e-05,4,219,0.20670536471137538,0.007315417922531782,1.1429851055145264,COMPLETE
374,174.70568149244014,2023-09-04 19:58:15.151129,2023-09-04 19:58:16.928204,0 days 00:00:01.777075,Sigmoid,Tanh,Leaky,Leaky,76,10,21.0,13.0,5.0,1.3211626323015442e-05,4,201,0.21368407111916632,0.0026381462761940247,0.999036967754364,COMPLETE
375,169.31168379739066,2023-09-04 19:58:16.928541,2023-09-04 19:58:19.321780,0 days 00:00:02.393239,Sigmoid,Sigmoid,Leaky,Leaky,53,10,21.0,15.0,4.0,1.62655196579e-05,4,214,0.2146011815677676,0.009763480770924596,0.9513402581214905,COMPLETE
376,162.3312368774414,2023-09-04 19:58:19.322121,2023-09-04 19:58:21.808883,0 days 00:00:02.486762,Leaky,Sigmoid,Leaky,Leaky,51,9,22.0,16.0,11.0,1.3124285009744882e-05,4,225,0.20731285670102675,0.007342968903720457,1.0070453882217407,COMPLETE
377,105.89046170926207,2023-09-04 19:58:21.809216,2023-09-04 19:58:23.560822,0 days 00:00:01.751606,Sigmoid,Sigmoid,Leaky,Leaky,77,11,21.0,17.0,7.0,1.9824247731583093e-05,4,211,0.2017923960927469,0.0058752892653941065,1.0752158164978027,COMPLETE
378,113.67596156343501,2023-09-04 19:58:23.561158,2023-09-04 19:58:26.869951,0 days 00:00:03.308793,Sigmoid,Tanh,Leaky,Leaky,75,11,22.0,14.0,12.0,1.5103785971802037e-05,4,235,0.30605077733302916,0.012586180460419347,1.0656969547271729,COMPLETE
379,96.02050416365914,2023-09-04 19:58:26.870283,2023-09-04 19:58:27.427770,0 days 00:00:00.557487,Sigmoid,Sigmoid,Leaky,ReLU,84,6,21.0,16.0,4.0,2.403918777664983e-05,4,219,0.19824091979116584,0.004171369293714576,0.8878145217895508,COMPLETE
380,257.67189559936526,2023-09-04 19:58:27.428107,2023-09-04 19:58:31.620911,0 days 00:00:04.192804,Sigmoid,Sigmoid,Leaky,ReLU,85,7,21.0,15.0,5.0,2.344466476113317e-05,4,220,0.19265908961563832,0.0037902514692867537,1.288200855255127,COMPLETE
381,197.98217740409817,2023-09-04 19:58:31.621482,2023-09-04 19:58:33.536983,0 days 00:00:01.915501,ReLU,Sigmoid,Leaky,ReLU,84,8,21.0,16.0,3.0,1.8713463784962575e-05,4,231,0.19531905045139808,0.0007949136005052235,1.0356974601745605,COMPLETE
382,220.88346698572818,2023-09-04 19:58:33.537315,2023-09-04 19:58:35.483547,0 days 00:00:01.946232,Sigmoid,Sigmoid,Leaky,ReLU,88,9,21.0,16.0,4.0,2.384608096247207e-05,4,223,0.22627936823223535,0.005164254593560624,1.0727373361587524,COMPLETE
383,100.52102557258426,2023-09-04 19:58:35.483884,2023-09-04 19:58:37.206609,0 days 00:00:01.722725,Sigmoid,Tanh,Leaky,ReLU,86,6,22.0,15.0,3.0,2.9223826442330313e-05,4,213,0.2072706782209314,0.001131226339763229,0.9075029492378235,COMPLETE
384,282.9072389324892,2023-09-04 19:58:37.206948,2023-09-04 19:58:39.388226,0 days 00:00:02.181278,Sigmoid,Sigmoid,Leaky,ReLU,48,6,21.0,14.0,4.0,1.2112871711301057e-05,4,206,0.1898803092185438,0.004242484666562039,1.0067801475524902,COMPLETE
385,91.65549853332061,2023-09-04 19:58:39.388569,2023-09-04 19:58:40.788202,0 days 00:00:01.399633,Sigmoid,Sigmoid,Leaky,Leaky,54,10,22.0,16.0,6.0,1.725360760097852e-05,4,216,0.20393341316220137,0.002499796824658121,0.8923892974853516,COMPLETE
386,114.27803261259682,2023-09-04 19:58:40.788557,2023-09-04 19:58:42.027950,0 days 00:00:01.239393,Sigmoid,Sigmoid,Leaky,Leaky,55,9,22.0,16.0,6.0,0.000377212332683922,4,203,0.2079259918087623,0.0025055304985194433,0.5632072687149048,COMPLETE
387,125.2921324412028,2023-09-04 19:58:42.028278,2023-09-04 19:58:42.740151,0 days 00:00:00.711873,Sigmoid,Sigmoid,Leaky,Leaky,54,10,22.0,12.0,5.0,1.698976452370174e-05,4,216,0.2212078872280469,0.003519834828508545,1.1013938188552856,COMPLETE
388,114.7264797315685,2023-09-04 19:58:42.740488,2023-09-04 19:58:44.922489,0 days 00:00:02.182001,Tanh,Tanh,Leaky,Leaky,57,5,21.0,17.0,5.0,1.4376051939957578e-05,4,218,0.19760074101409025,0.0029006742088117294,0.9077129364013672,COMPLETE
389,146.18885383255986,2023-09-04 19:58:44.922833,2023-09-04 19:58:45.967794,0 days 00:00:01.044961,Sigmoid,Sigmoid,Leaky,Leaky,52,8,21.0,16.0,6.0,1.8232377975756987e-05,4,231,0.17926474184663851,0.0022834234982770573,1.1387548446655273,COMPLETE
390,98.25625859552892,2023-09-04 19:58:45.968127,2023-09-04 19:58:48.178868,0 days 00:00:02.210741,Sigmoid,Sigmoid,Leaky,Leaky,50,10,22.0,16.0,8.0,1.2118362054669755e-05,4,199,0.2016181566945983,0.004860581164993941,1.0686687231063843,COMPLETE
391,144.60612205096655,2023-09-04 19:58:48.179224,2023-09-04 19:58:55.876868,0 days 00:00:07.697644,Sigmoid,Tanh,Leaky,ReLU,26,7,22.0,17.0,4.0,1.5828979812379152e-05,4,224,0.3869051013589023,0.003526103012279219,0.7666902542114258,COMPLETE
392,103.26500438821726,2023-09-04 19:58:55.877213,2023-09-04 19:58:56.605361,0 days 00:00:00.728148,Sigmoid,Sigmoid,Leaky,Leaky,90,6,22.0,15.0,7.0,3.46622480837716e-05,4,87,0.21844291023223822,0.005901505387997747,0.9795082211494446,COMPLETE
393,189.30527440239402,2023-09-04 19:58:56.605700,2023-09-04 19:58:57.910442,0 days 00:00:01.304742,Sigmoid,Sigmoid,Leaky,Leaky,53,19,21.0,16.0,4.0,0.0006604835537686678,4,68,0.37273122081979443,0.0013082845899910103,0.6603891253471375,COMPLETE
394,115.01674161382684,2023-09-04 19:58:57.910780,2023-09-04 19:59:00.427887,0 days 00:00:02.517107,ReLU,Sigmoid,Leaky,Leaky,55,6,22.0,13.0,6.0,2.2034540055122546e-05,4,213,0.2366139132746684,0.0020138900470795026,0.8373689651489258,COMPLETE
395,324.70024228563494,2023-09-04 19:59:00.428221,2023-09-04 19:59:02.764977,0 days 00:00:02.336756,Sigmoid,Tanh,Leaky,ReLU,50,10,21.0,17.0,3.0,1.2204110741647257e-05,4,204,0.20471731264704718,0.007811099744024025,1.2207396030426025,COMPLETE
396,134.25169637928838,2023-09-04 19:59:02.765318,2023-09-04 19:59:04.057355,0 days 00:00:01.292037,Tanh,ReLU,Leaky,Leaky,60,7,21.0,16.0,5.0,0.002821612000668071,4,194,0.3959904783679773,0.006662221448624149,0.3327293395996094,COMPLETE
397,103.35564450183547,2023-09-04 19:59:04.057683,2023-09-04 19:59:05.402410,0 days 00:00:01.344727,Sigmoid,Sigmoid,Leaky,Leaky,88,15,22.0,14.0,9.0,1.4276540165592414e-05,4,209,0.2127899677843187,0.010553281026317626,0.9108262062072754,COMPLETE
398,100.35206463100674,2023-09-04 19:59:05.402741,2023-09-04 19:59:06.881474,0 days 00:00:01.478733,Sigmoid,Sigmoid,Leaky,ReLU,93,10,23.0,15.0,5.0,1.978202267761793e-05,4,222,0.18292701122321478,0.004543350034275843,0.9879342317581177,COMPLETE
399,107.82898426565895,2023-09-04 19:59:06.881827,2023-09-04 19:59:08.317766,0 days 00:00:01.435939,Sigmoid,Sigmoid,,,96,9,22.0,,,2.6927776786860402e-05,2,187,0.29501312428096893,0.003228418030670888,1.0921677350997925,COMPLETE
400,110.73886027919592,2023-09-04 19:59:08.318089,2023-09-04 19:59:15.965181,0 days 00:00:07.647092,Sigmoid,Tanh,Sigmoid,Leaky,52,15,23.0,13.0,4.0,1.1917121953827189e-05,4,237,0.6450600102812827,0.0015005148693142158,0.933724582195282,COMPLETE
401,177.65105764664227,2023-09-04 19:59:15.965528,2023-09-04 19:59:17.789933,0 days 00:00:01.824405,Sigmoid,,,,48,8,,,,1.649483255467476e-05,1,201,0.28167873369499064,0.014377244150653678,0.9130004048347473,COMPLETE
402,121.64129664245264,2023-09-04 19:59:17.790245,2023-09-04 19:59:19.425435,0 days 00:00:01.635190,Leaky,Sigmoid,Leaky,Leaky,85,14,21.0,17.0,6.0,1.4451640609401554e-05,4,179,0.2459553361430871,0.008361727266996657,0.9461274147033691,COMPLETE
403,320.37315635414393,2023-09-04 19:59:19.425772,2023-09-04 19:59:21.511199,0 days 00:00:02.085427,Sigmoid,Sigmoid,Leaky,Sigmoid,83,5,21.0,16.0,7.0,1.9349545396460162e-05,4,286,0.19030660508354605,0.004443856411081333,0.9751901626586914,COMPLETE
404,100.07429059346516,2023-09-04 19:59:21.511543,2023-09-04 19:59:21.716160,0 days 00:00:00.204617,Sigmoid,Sigmoid,Leaky,ReLU,56,15,22.0,23.0,10.0,0.0007346169154805544,4,193,0.2642866624761631,0.005896821208477398,0.8612536787986755,COMPLETE
405,151.3501836406111,2023-09-04 19:59:21.716495,2023-09-04 19:59:25.547989,0 days 00:00:03.831494,Tanh,Tanh,Leaky,Leaky,53,9,23.0,14.0,8.0,3.584545012389671e-05,4,211,0.36028042390743975,0.006992314319051498,0.7303783893585205,COMPLETE
406,97.22179997315881,2023-09-04 19:59:25.548332,2023-09-04 19:59:29.195547,0 days 00:00:03.647215,Sigmoid,Sigmoid,Leaky,Leaky,50,19,22.0,15.0,5.0,2.5499453406158153e-05,4,171,0.40758482770311844,0.0024949027417121806,0.8835591673851013,COMPLETE
407,131.55609609974937,2023-09-04 19:59:29.195904,2023-09-04 19:59:31.608907,0 days 00:00:02.413003,Sigmoid,Sigmoid,Leaky,Leaky,90,11,1.0,16.0,4.0,1.2156139059697687e-05,4,293,0.23015204002121004,0.016968015015732734,0.9581068158149719,COMPLETE
408,230.5687387002481,2023-09-04 19:59:31.609256,2023-09-04 19:59:34.802265,0 days 00:00:03.193009,Sigmoid,Sigmoid,Leaky,ReLU,47,7,23.0,14.0,2.0,0.0010341810703827885,4,185,0.31016636799197067,0.0005162948432266747,0.7162742018699646,COMPLETE
409,102.058726438542,2023-09-04 19:59:34.802609,2023-09-04 19:59:35.880086,0 days 00:00:01.077477,Sigmoid,Tanh,Sigmoid,Leaky,51,10,21.0,15.0,6.0,1.7029853575672525e-05,4,97,0.19816277939526125,0.0107267600649316,1.0326176881790161,COMPLETE
410,110.2116126344915,2023-09-04 19:59:35.880430,2023-09-04 19:59:36.482621,0 days 00:00:00.602191,ReLU,Sigmoid,Leaky,Leaky,49,15,22.0,17.0,13.0,0.001774705410392546,4,229,0.17461694402651687,3.727980906709922e-05,0.37586310505867004,COMPLETE
411,99.95239243813612,2023-09-04 19:59:36.482963,2023-09-04 19:59:38.813383,0 days 00:00:02.330420,Sigmoid,Sigmoid,Leaky,ReLU,59,14,12.0,13.0,17.0,2.0674115044911574e-05,4,218,0.22146170378863198,0.0001985663323504252,1.0803544521331787,COMPLETE
412,1233.753034379747,2023-09-04 19:59:38.813732,2023-09-04 19:59:39.901277,0 days 00:00:01.087545,Sigmoid,Tanh,Leaky,Leaky,54,12,13.0,17.0,7.0,0.01130133865473149,4,198,0.2908980087742511,0.00885443101986005,0.5188248753547668,COMPLETE
413,144.20635892138068,2023-09-04 19:59:39.901624,2023-09-04 19:59:42.056372,0 days 00:00:02.154748,Sigmoid,Sigmoid,Leaky,Leaky,87,6,23.0,15.0,6.0,1.4375875038432543e-05,4,162,0.37489958940727913,0.004147504549123811,0.9564219117164612,COMPLETE
414,95.16589978899275,2023-09-04 19:59:42.056717,2023-09-04 19:59:44.679211,0 days 00:00:02.622494,Sigmoid,Sigmoid,Leaky,ReLU,91,8,20.0,16.0,5.0,3.063429346825288e-05,4,175,0.4335638171738788,0.0008344865193070154,1.0167829990386963,COMPLETE
415,174.77512579449152,2023-09-04 19:59:44.679559,2023-09-04 19:59:47.310780,0 days 00:00:02.631221,Tanh,Sigmoid,Leaky,ReLU,92,8,20.0,16.0,5.0,3.2578763375512676e-05,4,177,0.4284216234360935,0.0008738082651500394,1.0151466131210327,COMPLETE
416,671.4213982906068,2023-09-04 19:59:47.311130,2023-09-04 19:59:49.739850,0 days 00:00:02.428720,Sigmoid,Sigmoid,Leaky,ReLU,51,9,20.0,16.0,5.0,2.8051817752630977e-05,4,209,0.21104546701055343,0.0020192371585781898,0.9960150122642517,COMPLETE
417,118.54164224698398,2023-09-04 19:59:49.740191,2023-09-04 19:59:51.804554,0 days 00:00:02.064363,Sigmoid,Leaky,Sigmoid,ReLU,93,7,20.0,14.0,4.0,0.0001579430681113139,4,188,0.2548979657689628,0.005428761079689669,0.9012081623077393,COMPLETE
418,94.7218970072638,2023-09-04 19:59:51.804893,2023-09-04 19:59:54.847688,0 days 00:00:03.042795,Sigmoid,Tanh,Leaky,ReLU,47,8,21.0,15.0,11.0,2.43582537764774e-05,4,194,0.2757842548680243,0.000752877072222654,0.9416788816452026,COMPLETE
419,155.35789724496695,2023-09-04 19:59:54.848038,2023-09-04 19:59:57.838068,0 days 00:00:02.990030,Sigmoid,Tanh,Leaky,ReLU,47,8,20.0,17.0,15.0,2.3777628172500016e-05,4,195,0.26937585824429083,0.0008169569707790872,0.6426995396614075,COMPLETE
420,107.91282807899813,2023-09-04 19:59:57.838414,2023-09-04 20:00:01.027224,0 days 00:00:03.188810,Sigmoid,Tanh,Leaky,ReLU,47,8,21.0,12.0,12.0,2.1316714313693916e-05,4,203,0.2807156150609564,0.0009833945589477822,0.6788613200187683,COMPLETE
421,213.58856799151445,2023-09-04 20:00:01.027573,2023-09-04 20:00:04.163792,0 days 00:00:03.136219,Sigmoid,Tanh,Leaky,ReLU,48,8,21.0,15.0,14.0,0.0004511303751805585,4,185,0.3028366803167128,0.0010908580521478883,0.49802079796791077,COMPLETE
422,109.75196705528752,2023-09-04 20:00:04.164139,2023-09-04 20:00:06.377732,0 days 00:00:02.213593,Sigmoid,Tanh,,,49,7,11.0,,,1.7912824943397224e-05,2,201,0.27653213704950413,0.0014350560132879897,0.831977903842926,COMPLETE
423,101.07059224446614,2023-09-04 20:00:06.378060,2023-09-04 20:00:08.172313,0 days 00:00:01.794253,ReLU,Tanh,Leaky,ReLU,96,9,20.0,16.0,3.0,2.3910170382402272e-05,4,192,0.2657388140321431,0.0006774664157785764,0.8194096088409424,COMPLETE
424,118.87095499038696,2023-09-04 20:00:08.172658,2023-09-04 20:00:10.013853,0 days 00:00:01.841195,Sigmoid,Tanh,Leaky,ReLU,95,8,21.0,14.0,5.0,0.00011639245548432752,4,211,0.2502424415887987,0.000754087847971658,0.5694522261619568,COMPLETE
425,137.16778529774058,2023-09-04 20:00:10.014187,2023-09-04 20:00:12.870940,0 days 00:00:02.856753,Sigmoid,Tanh,Leaky,ReLU,52,9,20.0,13.0,22.0,2.8776680754713478e-05,4,220,0.23872408437432532,0.0006216726119675013,0.866784930229187,COMPLETE
426,153.6208191760996,2023-09-04 20:00:12.871290,2023-09-04 20:00:16.585212,0 days 00:00:03.713922,Tanh,Tanh,Leaky,ReLU,55,7,21.0,15.0,11.0,0.00026841365657653306,4,181,0.40716999627757056,0.0011723242562762162,0.4016662538051605,COMPLETE
427,118.8182633620042,2023-09-04 20:00:16.585559,2023-09-04 20:00:19.671015,0 days 00:00:03.085456,Leaky,ReLU,Tanh,Sigmoid,50,8,21.0,17.0,4.0,1.4462947703977477e-05,4,195,0.29799376142780604,0.0010440135163678637,0.9253509640693665,COMPLETE
428,133.40348597935267,2023-09-04 20:00:19.671367,2023-09-04 20:00:25.468159,0 days 00:00:05.796792,Sigmoid,Tanh,Sigmoid,ReLU,53,9,21.0,16.0,3.0,1.176936246362798e-05,4,497,0.22348935570407508,0.0007420240626307819,0.9788019061088562,COMPLETE
429,103.17315053632183,2023-09-04 20:00:25.468513,2023-09-04 20:00:28.721065,0 days 00:00:03.252552,Sigmoid,Tanh,Leaky,ReLU,91,18,22.0,15.0,16.0,1.8395616346468992e-05,4,310,0.2891892428778677,0.0035806197283093835,0.7935614585876465,COMPLETE
430,108.4494031270345,2023-09-04 20:00:28.721418,2023-09-04 20:00:29.023657,0 days 00:00:00.302239,Sigmoid,Sigmoid,Leaky,ReLU,49,8,22.0,14.0,6.0,0.00034656312045966306,4,418,0.39822173334830785,0.016503462360341645,0.9952735304832458,COMPLETE
431,130.64338598064347,2023-09-04 20:00:29.023996,2023-09-04 20:00:32.055922,0 days 00:00:03.031926,Sigmoid,Tanh,Leaky,ReLU,47,15,21.0,16.0,7.0,2.1594910566483895e-05,4,204,0.259157057750352,0.00058906439884421,0.8354403972625732,COMPLETE
432,100.23540941874187,2023-09-04 20:00:32.056273,2023-09-04 20:00:32.346726,0 days 00:00:00.290453,Sigmoid,Sigmoid,Leaky,ReLU,94,16,20.0,17.0,5.0,0.0002834365953778538,4,174,0.6012833093399799,0.011223239260500544,0.992184579372406,COMPLETE
433,162.20584947634967,2023-09-04 20:00:32.347057,2023-09-04 20:00:35.850876,0 days 00:00:03.503819,Sigmoid,Sigmoid,Leaky,Tanh,51,20,22.0,15.0,4.0,0.00014818168517398224,4,226,0.4339958369159443,0.007031031090293232,0.6917749047279358,COMPLETE
434,358.34444499465656,2023-09-04 20:00:35.851224,2023-09-04 20:00:36.701544,0 days 00:00:00.850320,Sigmoid,Tanh,Leaky,ReLU,57,9,20.0,16.0,6.0,1.646485821817975e-05,4,53,0.31204710797729535,0.0004779050814101865,1.1392674446105957,COMPLETE
435,103.82370318054522,2023-09-04 20:00:36.701885,2023-09-04 20:00:38.944030,0 days 00:00:02.242145,Tanh,Sigmoid,Leaky,Sigmoid,46,6,22.0,13.0,3.0,1.3557902848632464e-05,4,189,0.20384292466418769,0.0029369279887811574,0.8734318614006042,COMPLETE
436,100.37293518914117,2023-09-04 20:00:38.944372,2023-09-04 20:00:41.102231,0 days 00:00:02.157859,Sigmoid,Sigmoid,,,54,10,21.0,,,1.1755244201260738e-05,2,216,0.27402371225892874,0.0009226699075700087,0.9503834247589111,COMPLETE
437,96.89253823416574,2023-09-04 20:00:41.102554,2023-09-04 20:00:42.228011,0 days 00:00:01.125457,ReLU,Sigmoid,Sigmoid,Tanh,52,15,6.0,14.0,5.0,3.131393773182547e-05,4,239,0.6250509920012937,0.008919144790328489,0.9603778719902039,COMPLETE
438,3103.485779674341,2023-09-04 20:00:42.228344,2023-09-04 20:00:45.420859,0 days 00:00:03.192515,Sigmoid,Tanh,Leaky,Leaky,48,8,22.0,16.0,11.0,0.0005808188644007413,4,207,0.34013116509426267,0.014637345458837776,0.6653175950050354,COMPLETE
439,235.65233176095145,2023-09-04 20:00:45.421190,2023-09-04 20:00:49.437872,0 days 00:00:04.016682,Sigmoid,Sigmoid,Leaky,ReLU,51,7,21.0,14.0,20.0,0.0011960853473637094,4,182,0.37793087338994996,0.001656172632906452,0.40187060832977295,COMPLETE
440,147.2820309054467,2023-09-04 20:00:49.438228,2023-09-04 20:00:52.613225,0 days 00:00:03.174997,Sigmoid,Sigmoid,Leaky,Leaky,18,14,20.0,15.0,6.0,0.0004545282987446466,4,286,0.4152533131540149,0.005185890277547889,0.5943017601966858,COMPLETE
441,125.48095430646624,2023-09-04 20:00:52.613561,2023-09-04 20:00:52.782008,0 days 00:00:00.168447,Sigmoid,Tanh,Leaky,Tanh,91,16,22.0,17.0,4.0,0.09178420175559389,4,173,0.2312624209452016,0.011713603689665814,0.9616008996963501,COMPLETE
442,97.28007973189902,2023-09-04 20:00:52.782340,2023-09-04 20:00:54.808526,0 days 00:00:02.026186,Sigmoid,Sigmoid,Leaky,Leaky,54,19,21.0,16.0,7.0,2.3827826305762994e-05,4,195,0.3588979165580282,0.022281628929493844,0.973779022693634,COMPLETE
443,125.95215548744684,2023-09-04 20:00:54.808866,2023-09-04 20:00:55.963256,0 days 00:00:01.154390,Sigmoid,Sigmoid,Leaky,ReLU,56,9,21.0,15.0,13.0,1.6931991856721983e-05,4,199,0.28620172345783057,0.007187150913297922,1.062828779220581,COMPLETE
444,126.9310089762177,2023-09-04 20:00:55.963595,2023-09-04 20:00:58.911649,0 days 00:00:02.948054,Tanh,Leaky,Leaky,Leaky,44,15,22.0,5.0,22.0,0.00040361760958596373,4,211,0.23984325239503979,0.002667399732210246,0.37666815519332886,COMPLETE
445,105.41802022154901,2023-09-04 20:00:58.912004,2023-09-04 20:00:59.796127,0 days 00:00:00.884123,Sigmoid,Sigmoid,Sigmoid,ReLU,49,8,22.0,14.0,6.0,0.0002427010614624226,4,166,0.21573456116099543,0.0058637407251339755,0.9644561409950256,COMPLETE
446,109.95617207236911,2023-09-04 20:00:59.796460,2023-09-04 20:01:01.516597,0 days 00:00:01.720137,Sigmoid,ReLU,Leaky,Leaky,93,5,21.0,17.0,12.0,1.9797828669508108e-05,4,184,0.26492845295866585,0.020334686986068946,0.9635260105133057,COMPLETE
447,118.15815711587162,2023-09-04 20:01:01.516938,2023-09-04 20:01:06.119381,0 days 00:00:04.602443,Sigmoid,Tanh,Leaky,Tanh,52,14,10.0,16.0,2.0,1.4555988355306675e-05,4,295,0.3098357849620344,2.0671993917052315e-05,0.7313260436058044,COMPLETE
448,96.38375155541205,2023-09-04 20:01:06.119722,2023-09-04 20:01:07.834141,0 days 00:00:01.714419,Sigmoid,Sigmoid,Leaky,Leaky,46,10,20.0,17.0,21.0,1.1475502536643147e-05,4,155,0.1921784400031696,0.004224865598643434,1.0925341844558716,COMPLETE
449,97.28136703957637,2023-09-04 20:01:07.834496,2023-09-04 20:01:10.493187,0 days 00:00:02.658691,Sigmoid,Sigmoid,Leaky,Leaky,43,10,20.0,13.0,18.0,1.0460335323040854e-05,4,229,0.19182254683127586,0.0034445792515752282,1.048417568206787,COMPLETE
450,97.35804724081969,2023-09-04 20:01:10.493542,2023-09-04 20:01:12.115495,0 days 00:00:01.621953,ReLU,Sigmoid,Tanh,ReLU,46,9,21.0,15.0,20.0,1.2366125757488302e-05,4,156,0.17287503319234723,0.004228201825645189,1.2208245992660522,COMPLETE
451,175.59779914365996,2023-09-04 20:01:12.115837,2023-09-04 20:01:14.503477,0 days 00:00:02.387640,Sigmoid,Tanh,Leaky,Leaky,46,21,2.0,15.0,22.0,0.00021930443557015576,4,218,0.18495435599239998,0.004609495831418332,0.6513150930404663,COMPLETE
452,135.64051564534506,2023-09-04 20:01:14.503820,2023-09-04 20:01:17.514384,0 days 00:00:03.010564,Sigmoid,Sigmoid,Leaky,Tanh,50,10,9.0,16.0,21.0,0.00017924926080031234,4,282,0.19826967050387068,0.003943308798213828,0.6869248151779175,COMPLETE
