number,value,datetime_start,datetime_complete,duration,params_activation1,params_activation2,params_activation3,params_activation4,params_batch_size,params_fl1,params_fl2,params_fl3,params_fl4,params_learning_rate,params_n_layers,params_num_epochs,params_train_size,params_weight_decay,user_attrs_mre,state
464,0.3888586759567261,2023-09-04 18:40:12.602494,2023-09-04 18:40:15.027525,0 days 00:00:02.425031,Leaky,Tanh,,,16,23,23.0,,,0.033271744515091795,2,280,0.7717486953405367,0.000405683059127767,175.83470831976996,COMPLETE
465,0.38219180703163147,2023-09-04 18:40:15.027925,2023-09-04 18:40:19.318563,0 days 00:00:04.290638,Leaky,ReLU,Sigmoid,Leaky,10,20,23.0,8.0,19.0,0.002602819327660365,4,262,0.2507305066146597,0.0001098575648943347,206.11651386934167,COMPLETE
466,0.3439391553401947,2023-09-04 18:40:19.318972,2023-09-04 18:40:25.244592,0 days 00:00:05.925620,Leaky,ReLU,Leaky,Tanh,14,21,24.0,24.0,20.0,0.0020021389819782093,4,230,0.6898868147808583,0.0011864087076848928,3645.9297113833222,COMPLETE
467,0.3821069598197937,2023-09-04 18:40:25.245011,2023-09-04 18:40:27.830523,0 days 00:00:02.585512,Leaky,ReLU,ReLU,Sigmoid,19,22,22.0,2.0,22.0,0.005516154955193818,4,240,0.27027351414092965,0.0006454280400819355,148.36829388141632,COMPLETE
468,0.35388702154159546,2023-09-04 18:40:27.830932,2023-09-04 18:40:38.713108,0 days 00:00:10.882176,Leaky,ReLU,,,17,21,4.0,,,0.0009439867001179443,2,318,0.7288460417199045,0.00045337559461860913,196.0427624629094,COMPLETE
469,0.3507765829563141,2023-09-04 18:40:38.713485,2023-09-04 18:40:42.649901,0 days 00:00:03.936416,ReLU,ReLU,Tanh,Sigmoid,43,11,21.0,23.0,23.0,0.003834077965235737,4,256,0.7762912909709253,0.0007740203645783307,155.00064792633057,COMPLETE
470,0.3867359459400177,2023-09-04 18:40:42.650339,2023-09-04 18:41:07.738799,0 days 00:00:25.088460,Leaky,ReLU,ReLU,Leaky,13,23,15.0,16.0,21.0,0.00018728690449466306,4,274,0.42437704942218657,0.002090649716423425,168.77766838909065,COMPLETE
471,0.34411123394966125,2023-09-04 18:41:07.739178,2023-09-04 18:41:10.388174,0 days 00:00:02.648996,Leaky,ReLU,,,15,23,22.0,,,0.0028819740165200686,2,267,0.2923647185915368,0.0012888824834876545,774.8017158967903,COMPLETE
472,0.3517143428325653,2023-09-04 18:41:10.388658,2023-09-04 18:41:13.745091,0 days 00:00:03.356433,Leaky,ReLU,ReLU,Sigmoid,24,22,23.0,21.0,21.0,0.008290520355199725,4,285,0.5508233932835119,2.8070635759974943e-05,166.95302703857422,COMPLETE
473,0.3318839371204376,2023-09-04 18:41:13.745754,2023-09-04 18:41:29.744049,0 days 00:00:15.998295,Leaky,ReLU,Leaky,Sigmoid,12,21,24.0,24.0,24.0,0.0007286469570154514,4,222,0.7526741656932832,0.0003348060445182931,151.10523856313606,COMPLETE
474,0.3520474135875702,2023-09-04 18:41:29.744702,2023-09-04 18:41:42.956892,0 days 00:00:13.212190,Leaky,ReLU,,,19,24,23.0,,,0.004405946958703906,2,297,0.7116005439824122,0.0016583059423687988,165.47150692994566,COMPLETE
475,0.46645671129226685,2023-09-04 18:41:42.957361,2023-09-04 18:41:54.736450,0 days 00:00:11.779089,Sigmoid,ReLU,ReLU,Leaky,17,22,22.0,23.0,22.0,0.0024270834070466334,4,262,0.12385647632572473,0.0009445209789739966,248.35302956688483,COMPLETE
476,0.30352839827537537,2023-09-04 18:41:54.736862,2023-09-04 18:42:00.530544,0 days 00:00:05.793682,Leaky,ReLU,ReLU,Tanh,14,23,21.0,22.0,17.0,0.006158782682280118,4,248,0.7965501128104306,0.0005571851799338326,143.8793786701403,COMPLETE
477,0.31847015023231506,2023-09-04 18:42:00.530935,2023-09-04 18:42:14.043261,0 days 00:00:13.512326,Leaky,ReLU,ReLU,Tanh,10,23,21.0,22.0,17.0,0.0013045309726673303,4,244,0.778900166699215,0.0005004842940459848,145.9719373359055,COMPLETE
478,0.31435397267341614,2023-09-04 18:42:14.043756,2023-09-04 18:42:17.799129,0 days 00:00:03.755373,Leaky,ReLU,ReLU,Tanh,21,24,20.0,20.0,17.0,0.003389416421989688,4,249,0.7997138713885726,3.585924783966809e-05,265.9761161804199,COMPLETE
479,0.503272294998169,2023-09-04 18:42:17.799759,2023-09-04 18:42:39.427493,0 days 00:00:21.627734,Leaky,ReLU,ReLU,Tanh,23,24,20.0,20.0,16.0,2.265292954986133e-05,4,237,0.7971047443689886,0.0002610356113250566,188.4344234868947,COMPLETE
480,0.3504122495651245,2023-09-04 18:42:39.427880,2023-09-04 18:42:48.360905,0 days 00:00:08.933025,Leaky,ReLU,ReLU,Tanh,14,24,19.0,20.0,16.0,0.00215686580150419,4,245,0.7993335242936787,0.0036325700298199433,144.19157492897727,COMPLETE
481,0.3140769302845001,2023-09-04 18:42:48.361285,2023-09-04 18:42:51.488059,0 days 00:00:03.126774,Leaky,Tanh,ReLU,Tanh,21,24,20.0,21.0,17.0,0.0063339203502009766,4,251,0.7411930016761487,5.033165111610742e-05,154.22149568445542,COMPLETE
482,0.342514306306839,2023-09-04 18:42:51.488459,2023-09-04 18:42:55.945322,0 days 00:00:04.456863,Leaky,Tanh,ReLU,Tanh,21,24,20.0,19.0,17.0,0.0075721099731223965,4,230,0.6796675481294941,6.292925720854669e-05,217.05894524710519,COMPLETE
483,0.35608091950416565,2023-09-04 18:42:55.945713,2023-09-04 18:42:57.464657,0 days 00:00:01.518944,Leaky,Tanh,ReLU,Tanh,23,24,19.0,21.0,18.0,0.007585641908154096,4,215,0.4018035360405496,2.3342233512894362e-05,278.07841012137277,COMPLETE
484,0.31975579261779785,2023-09-04 18:42:57.465033,2023-09-04 18:43:00.075167,0 days 00:00:02.610134,Leaky,Tanh,ReLU,Tanh,21,24,20.0,21.0,17.0,0.010026761007184398,4,252,0.6540210700369171,8.526040641485298e-05,178.25758743286133,COMPLETE
485,0.3202113211154938,2023-09-04 18:43:00.075551,2023-09-04 18:43:04.242807,0 days 00:00:04.167256,Leaky,Tanh,ReLU,Tanh,19,24,20.0,20.0,16.0,0.006346976157330704,4,252,0.733849654315426,4.888464104261339e-05,351.2893650785406,COMPLETE
486,0.3482798635959625,2023-09-04 18:43:04.243191,2023-09-04 18:43:06.618222,0 days 00:00:02.375031,Leaky,Tanh,ReLU,Tanh,26,24,19.0,21.0,17.0,0.005922648709311019,4,257,0.7063651190622161,4.87923083572514e-05,175.55301121303015,COMPLETE
487,0.3395555019378662,2023-09-04 18:43:06.618607,2023-09-04 18:43:12.188908,0 days 00:00:05.570301,Tanh,Tanh,ReLU,Tanh,23,23,20.0,20.0,15.0,0.001830225397456749,4,266,0.7450328326601278,1.8457717816536194e-05,143.02421325683594,COMPLETE
488,0.3601278066635132,2023-09-04 18:43:12.189323,2023-09-04 18:43:13.759764,0 days 00:00:01.570441,Leaky,Tanh,ReLU,Tanh,25,24,20.0,22.0,17.0,0.008343021989295138,4,240,0.4375364144938755,4.09409294761022e-05,214.9878191266741,COMPLETE
489,0.36838334798812866,2023-09-04 18:43:13.760174,2023-09-04 18:43:29.147646,0 days 00:00:15.387472,Leaky,Leaky,ReLU,Tanh,12,24,20.0,18.0,18.0,0.0001144453881398058,4,117,0.7474628558675565,3.212576114772458e-05,207.29775948809763,COMPLETE
490,0.3347885310649872,2023-09-04 18:43:29.148022,2023-09-04 18:43:41.738096,0 days 00:00:12.590074,Leaky,Tanh,ReLU,Tanh,16,24,21.0,21.0,17.0,0.00055449162303716,4,247,0.6976741172819143,4.2965679795465795e-05,156.01153277633782,COMPLETE
491,0.4330553114414215,2023-09-04 18:43:41.738489,2023-09-04 18:44:20.543134,0 days 00:00:38.804645,Leaky,Tanh,ReLU,Tanh,13,23,19.0,22.0,16.0,2.898119790756596e-05,4,274,0.7682895119796792,0.00012731260973445873,171.84690403068151,COMPLETE
492,0.48605847358703613,2023-09-04 18:44:20.543499,2023-09-04 18:44:29.930045,0 days 00:00:09.386546,Leaky,ReLU,Leaky,Tanh,18,23,20.0,22.0,18.0,5.419353743497114e-05,4,260,0.28168846900670785,2.2941952782323245e-05,260.2028033916767,COMPLETE
493,0.3688657581806183,2023-09-04 18:44:29.930424,2023-09-04 18:44:31.815930,0 days 00:00:01.885506,Leaky,ReLU,ReLU,Tanh,21,23,21.0,20.0,17.0,0.0016642443402293556,4,269,0.22933713951813223,0.002581370377020883,124.84911061756647,COMPLETE
494,0.3473018407821655,2023-09-04 18:44:31.816319,2023-09-04 18:44:35.448511,0 days 00:00:03.632192,Leaky,ReLU,ReLU,,11,23,20.0,21.0,,0.006622844786612386,3,249,0.6287893869161308,2.6762641489223227e-05,170.92978552616003,COMPLETE
495,0.3354082405567169,2023-09-04 18:44:35.449000,2023-09-04 18:44:40.632854,0 days 00:00:05.183854,Leaky,ReLU,ReLU,Tanh,15,24,21.0,19.0,18.0,0.0030643608797060345,4,259,0.516462451473937,5.281227356027279e-05,195.7270332105232,COMPLETE
496,0.34024161100387573,2023-09-04 18:44:40.633340,2023-09-04 18:44:43.142326,0 days 00:00:02.508986,ReLU,ReLU,ReLU,Tanh,16,23,19.0,22.0,18.0,0.004923644373404083,4,278,0.3579804179302425,3.526506355418666e-05,216.8235358413385,COMPLETE
497,0.3228164315223694,2023-09-04 18:44:43.142827,2023-09-04 18:44:49.067370,0 days 00:00:05.924543,Leaky,ReLU,Leaky,Leaky,13,23,21.0,23.0,15.0,0.0023251241727142618,4,229,0.7261803494923864,3.806992186185081e-05,154.77929438376913,COMPLETE
498,0.3294961154460907,2023-09-04 18:44:49.067746,2023-09-04 18:44:55.109803,0 days 00:00:06.042057,Leaky,ReLU,ReLU,ReLU,18,24,20.0,23.0,14.0,0.002729102072548965,4,264,0.7669881234956545,1.827985160194634e-05,253.94495367234754,COMPLETE
499,0.40999454259872437,2023-09-04 18:44:55.110193,2023-09-04 18:45:01.160634,0 days 00:00:06.050441,Leaky,ReLU,ReLU,Tanh,20,23,21.0,21.0,16.0,0.00037782267064927043,4,236,0.21791984545305187,1.0147973052359797e-05,3028.262105650821,COMPLETE
