number,value,datetime_start,datetime_complete,duration,params_activation1,params_activation2,params_activation3,params_activation4,params_batch_size,params_fl1,params_fl2,params_fl3,params_fl4,params_learning_rate,params_n_layers,params_num_epochs,params_train_size,params_weight_decay,user_attrs_mre,state
0,441.2063642261985,2023-09-04 19:27:46.156801,2023-09-04 19:27:51.094322,0 days 00:00:04.937521,Tanh,Sigmoid,ReLU,,28,2,23.0,13.0,,6.939977393624326e-05,3,360,0.15072170923074577,0.0004604403069594314,0.7063053250312805,COMPLETE
1,100.1306020563299,2023-09-04 19:27:51.094661,2023-09-04 19:27:51.747195,0 days 00:00:00.652534,Sigmoid,Leaky,ReLU,Leaky,25,9,24.0,24.0,17.0,0.0006351768537107217,4,113,0.6359070209160329,0.03353997998297318,0.9656926393508911,COMPLETE
2,145.6750114171645,2023-09-04 19:27:51.747520,2023-09-04 19:28:04.585105,0 days 00:00:12.837585,Sigmoid,ReLU,Tanh,Leaky,37,11,4.0,24.0,18.0,7.701349595251937e-05,4,425,0.3912930195430159,0.0014784174566787808,0.5148566961288452,COMPLETE
3,134.04383194614465,2023-09-04 19:28:04.585440,2023-09-04 19:28:05.225066,0 days 00:00:00.639626,Tanh,Sigmoid,,,84,9,15.0,,,0.0006994514395857991,2,453,0.14878576162106616,0.09551787590343334,0.6819272041320801,COMPLETE
4,142.36825122833253,2023-09-04 19:28:05.225363,2023-09-04 19:28:06.077243,0 days 00:00:00.851880,Tanh,ReLU,Tanh,,17,18,16.0,21.0,,0.01778739289796409,3,263,0.17936098894328725,0.03852848701783558,0.5294451713562012,COMPLETE
5,90.78041699058132,2023-09-04 19:28:06.077550,2023-09-04 19:28:08.734860,0 days 00:00:02.657310,Tanh,Tanh,Leaky,,16,16,9.0,20.0,,0.00240824500754675,3,494,0.5911336588842635,0.00091991511819112,0.3320750594139099,COMPLETE
6,266.5470063807601,2023-09-04 19:28:08.735166,2023-09-04 19:28:09.134594,0 days 00:00:00.399428,Leaky,Leaky,,,32,4,18.0,,,0.005242560886450809,2,360,0.11334155382685042,0.001173043452484147,0.4174807369709015,COMPLETE
7,101.19257930999106,2023-09-04 19:28:09.134908,2023-09-04 19:28:11.703878,0 days 00:00:02.568970,Leaky,Sigmoid,Tanh,,73,10,21.0,8.0,,0.001284605707877775,3,437,0.7729770972413568,0.0020217677777362685,0.3731299340724945,COMPLETE
8,120.33601360735686,2023-09-04 19:28:11.704169,2023-09-04 19:28:19.476609,0 days 00:00:07.772440,Tanh,Sigmoid,Leaky,Sigmoid,42,4,22.0,7.0,5.0,2.3688257342945802e-05,4,368,0.34878201480425264,7.217571684117592e-05,0.6378822326660156,COMPLETE
9,145.8151132436899,2023-09-04 19:28:19.476911,2023-09-04 19:28:25.906358,0 days 00:00:06.429447,ReLU,,,,20,2,,,,5.591016881244488e-05,1,195,0.5367073400704341,0.02211860033356023,0.7005320191383362,COMPLETE
10,137.68598543364425,2023-09-04 19:28:25.906615,2023-09-04 19:28:26.136016,0 days 00:00:00.229401,ReLU,,,,59,24,,,,0.08605261677515237,1,57,0.2531015086643005,1.4585272393276417e-05,0.4155057966709137,COMPLETE
11,110.66327520517203,2023-09-04 19:28:26.136299,2023-09-04 19:28:34.944407,0 days 00:00:08.808108,Sigmoid,Tanh,Leaky,ReLU,10,16,9.0,17.0,24.0,0.0005710969797666548,4,90,0.7847516999309583,0.00809321029591508,0.5844205617904663,COMPLETE
12,121.54040294223361,2023-09-04 19:28:34.944698,2023-09-04 19:28:40.461424,0 days 00:00:05.516726,Sigmoid,Tanh,ReLU,Leaky,51,17,9.0,19.0,13.0,0.0025024151682150313,4,144,0.5356481481339286,0.005515551536391435,0.40165525674819946,COMPLETE
13,155.13124732009504,2023-09-04 19:28:40.461917,2023-09-04 19:29:09.170518,0 days 00:00:28.708601,Sigmoid,Leaky,Sigmoid,,10,14,2.0,24.0,,0.0003091785248330455,3,238,0.5412121609985737,0.00024473387193102534,0.45130616426467896,COMPLETE
14,115.92612528063587,2023-09-04 19:29:09.170803,2023-09-04 19:29:10.866379,0 days 00:00:01.695576,Tanh,Leaky,,,97,21,11.0,,,0.004292694376475581,2,494,0.643321137588016,0.005220723593272835,0.3490516245365143,COMPLETE
15,106.60622360229492,2023-09-04 19:29:10.866665,2023-09-04 19:29:11.982473,0 days 00:00:01.115808,Sigmoid,Tanh,ReLU,Tanh,47,8,6.0,2.0,4.0,0.00024104246072245936,4,160,0.4063495383752344,0.013449133777849342,0.9600980877876282,COMPLETE
16,104.02566429876512,2023-09-04 19:29:11.982761,2023-09-04 19:29:20.277265,0 days 00:00:08.294504,ReLU,Leaky,Leaky,,25,14,14.0,16.0,,1.1991953368956542e-05,3,310,0.2946288525378574,0.08839125852982446,0.6866969466209412,COMPLETE
17,124.944106787966,2023-09-04 19:29:20.277551,2023-09-04 19:29:21.473930,0 days 00:00:01.196379,Leaky,Tanh,Sigmoid,Leaky,61,7,19.0,21.0,16.0,0.009660421513512285,4,109,0.4545754950406809,0.0033665218960243866,0.3625451624393463,COMPLETE
18,141.83488658055123,2023-09-04 19:29:21.474216,2023-09-04 19:29:28.836880,0 days 00:00:07.362664,Sigmoid,Leaky,Leaky,,35,21,7.0,14.0,,0.0013764550072257386,3,214,0.6461217506152784,0.0005839666348472454,0.3386659026145935,COMPLETE
19,106.52323506290752,2023-09-04 19:29:28.837185,2023-09-04 19:29:39.010818,0 days 00:00:10.173633,Tanh,Tanh,,,20,13,11.0,,,0.00025006820421421416,2,320,0.4803618751670575,0.022323681643962937,0.4276472330093384,COMPLETE
20,109.94244450160436,2023-09-04 19:29:39.011093,2023-09-04 19:29:39.943869,0 days 00:00:00.932776,Tanh,ReLU,ReLU,ReLU,70,19,13.0,21.0,22.0,0.0023015828578771083,4,499,0.6217065552772154,0.0026472642970867943,0.3668350875377655,COMPLETE
21,135.84490146766714,2023-09-04 19:29:39.944167,2023-09-04 19:29:45.272537,0 days 00:00:05.328370,Leaky,Sigmoid,Tanh,,70,10,24.0,8.0,,0.0010263263383794062,3,432,0.7849112062647164,0.002621399486462661,0.405917763710022,COMPLETE
22,104.95185396851612,2023-09-04 19:29:45.272822,2023-09-04 19:29:48.232495,0 days 00:00:02.959673,Leaky,Sigmoid,Tanh,,81,6,21.0,9.0,,0.0012703790225760652,3,401,0.7678347126030416,0.009774873466109904,0.4420273005962372,COMPLETE
23,128.13130725327358,2023-09-04 19:29:48.232775,2023-09-04 19:29:57.167690,0 days 00:00:08.934915,Leaky,Sigmoid,Leaky,,67,12,20.0,2.0,,0.0005075400212226636,3,466,0.661213451131791,0.0014552444528154306,0.29505595564842224,COMPLETE
24,101.09451724636939,2023-09-04 19:29:57.167972,2023-09-04 19:29:59.260738,0 days 00:00:02.092766,Leaky,Tanh,,,81,15,17.0,,,0.00244177852368762,2,398,0.5894446703293699,0.0006204149673001734,0.33784815669059753,COMPLETE
25,93.97093797766644,2023-09-04 19:29:59.261017,2023-09-04 19:30:00.719169,0 days 00:00:01.458152,Leaky,Tanh,,,97,16,18.0,,,0.0033073781435347185,2,306,0.4859902785385181,0.0005501399258952426,0.31428998708724976,COMPLETE
26,112.69047621606101,2023-09-04 19:30:00.719451,2023-09-04 19:30:01.490514,0 days 00:00:00.771063,Sigmoid,,,,92,19,,,,0.01415503621063281,1,316,0.477764923095214,0.00022910391307022878,0.3856489956378937,COMPLETE
27,104.48854796740474,2023-09-04 19:30:01.490770,2023-09-04 19:30:03.308473,0 days 00:00:01.817703,ReLU,Tanh,,,43,12,11.0,,,0.00456538993437191,2,278,0.43278811055097255,0.0007122940835704393,0.3349728286266327,COMPLETE
28,163.82551310013753,2023-09-04 19:30:03.308743,2023-09-04 19:30:09.464681,0 days 00:00:06.155938,Sigmoid,Tanh,,,15,21,24.0,,,0.00016688508746484635,2,147,0.36414082092761113,0.004440353160254251,0.5407217741012573,COMPLETE
29,251.47771004570856,2023-09-04 19:30:09.464959,2023-09-04 19:30:11.394805,0 days 00:00:01.929846,Tanh,,,,100,15,,,,0.0005143808880528429,1,180,0.5067634159380052,0.0003752723342774535,0.4330419898033142,COMPLETE
30,173.9728389686262,2023-09-04 19:30:11.395077,2023-09-04 19:30:22.805409,0 days 00:00:11.410332,Leaky,Leaky,ReLU,,27,17,18.0,24.0,,0.00012856994934988192,3,355,0.4328857323042763,0.0010800531907393185,0.3109838366508484,COMPLETE
31,89.73688636027592,2023-09-04 19:30:22.805688,2023-09-04 19:30:26.037707,0 days 00:00:03.232019,Leaky,Tanh,,,89,15,18.0,,,0.0022164009743338427,2,399,0.5797674707878561,0.0006754131983804837,0.3286949396133423,COMPLETE
32,97.84964681352888,2023-09-04 19:30:26.038137,2023-09-04 19:30:32.372164,0 days 00:00:06.334027,Leaky,Tanh,,,89,16,14.0,,,0.0018945444868835903,2,399,0.5697570544382435,0.0003159767158233667,0.342348575592041,COMPLETE
33,103.57768197344919,2023-09-04 19:30:32.372596,2023-09-04 19:30:37.444807,0 days 00:00:05.072211,Leaky,Tanh,,,90,16,15.0,,,0.002216523591597987,2,400,0.5506521466199717,0.000327905952586883,0.3334423303604126,COMPLETE
34,102.15083315583314,2023-09-04 19:30:37.445228,2023-09-04 19:30:55.005582,0 days 00:00:17.560354,Leaky,Tanh,,,77,19,16.0,,,0.0009705636924663917,2,472,0.6947853023628193,0.0001602145734572991,0.31481048464775085,COMPLETE
35,122.22791277776,2023-09-04 19:30:55.006012,2023-09-04 19:30:57.863256,0 days 00:00:02.857244,Leaky,Tanh,,,89,13,13.0,,,0.006830442041488169,2,344,0.584066995171599,0.0010197730334121711,0.32537582516670227,COMPLETE
36,113.53124360956697,2023-09-04 19:30:57.863692,2023-09-04 19:31:02.329931,0 days 00:00:04.466239,Leaky,Tanh,,,96,17,9.0,,,0.003607181071655657,2,386,0.5041732955075423,0.0005184850425163654,0.29214316606521606,COMPLETE
37,108.61258645491166,2023-09-04 19:31:02.330359,2023-09-04 19:31:04.367287,0 days 00:00:02.036928,Leaky,,,,87,15,,,,0.0068464628865426615,1,288,0.6909393742324836,0.0016719302859682299,0.38669922947883606,COMPLETE
38,93.70830638068063,2023-09-04 19:31:04.367687,2023-09-04 19:31:09.411593,0 days 00:00:05.043906,Tanh,Tanh,,,95,23,19.0,,,0.001987654972173488,2,445,0.5784788500577411,0.00012964825829127438,0.31950053572654724,COMPLETE
39,101.92506617745437,2023-09-04 19:31:09.412036,2023-09-04 19:31:20.714151,0 days 00:00:11.302115,Tanh,Tanh,,,95,23,19.0,,,0.000807640028283921,2,451,0.40015112151242854,8.304484216276014e-05,0.3392959535121918,COMPLETE
40,98.51881720314563,2023-09-04 19:31:20.714583,2023-09-04 19:31:23.503179,0 days 00:00:02.788596,Tanh,ReLU,,,83,22,22.0,,,0.0030561159997962626,2,433,0.4628391035059884,0.0008328684279630956,0.3236163258552551,COMPLETE
41,92.45454265721037,2023-09-04 19:31:23.503625,2023-09-04 19:31:32.785305,0 days 00:00:09.281680,Tanh,Tanh,,,100,20,17.0,,,0.001570163262156391,2,482,0.5829284529639082,0.00044714317050697063,0.3035447895526886,COMPLETE
42,91.45552107431357,2023-09-04 19:31:32.785744,2023-09-04 19:31:38.222271,0 days 00:00:05.436527,Tanh,Tanh,,,100,24,17.0,,,0.0015901773724295036,2,482,0.7050397767843668,0.00014455038417905816,0.31561708450317383,COMPLETE
43,109.38853303776231,2023-09-04 19:31:38.222709,2023-09-04 19:31:43.613391,0 days 00:00:05.390682,Tanh,Tanh,,,77,24,16.0,,,0.0017426155187916217,2,476,0.7162729233225992,0.00013983238509246285,0.30431222915649414,COMPLETE
44,96.78291875924637,2023-09-04 19:31:43.613827,2023-09-04 19:31:53.833967,0 days 00:00:10.220140,Tanh,,,,99,23,,,,0.001413948504449772,1,451,0.6060667522823027,6.94962177647959e-05,0.38815176486968994,COMPLETE
45,135.74286740446743,2023-09-04 19:31:53.834391,2023-09-04 19:32:22.058178,0 days 00:00:28.223787,Tanh,Tanh,Sigmoid,,93,20,20.0,5.0,,0.000715906122787207,3,485,0.7118744156573146,0.0004019919599851055,0.34525343775749207,COMPLETE
46,108.56202997225468,2023-09-04 19:32:22.058630,2023-09-04 19:32:27.080200,0 days 00:00:05.021570,Tanh,Tanh,,,100,23,17.0,,,0.0018907763864934762,2,421,0.6187375667362582,0.0015094521696742387,0.33396878838539124,COMPLETE
47,107.51999452379015,2023-09-04 19:32:27.080650,2023-09-04 19:32:29.941924,0 days 00:00:02.861274,Tanh,ReLU,Leaky,,86,22,17.0,11.0,,0.005001030627535278,3,457,0.5317380822014418,0.0007978196714227275,0.3417678773403168,COMPLETE
48,105.43476646968297,2023-09-04 19:32:29.942391,2023-09-04 19:32:40.276588,0 days 00:00:10.334197,Tanh,,,,93,18,,,,0.0009829214091811715,1,500,0.5741444131055906,0.00022529009297415304,0.40094226598739624,COMPLETE
49,127.01505890333584,2023-09-04 19:32:40.277014,2023-09-04 19:33:02.545526,0 days 00:00:22.268512,Tanh,Tanh,,,63,24,22.0,,,0.0003911364602473101,2,419,0.6486972882510997,0.00011677822063965908,0.3568297028541565,COMPLETE
50,93.01826123838072,2023-09-04 19:33:02.545963,2023-09-04 19:33:16.105369,0 days 00:00:13.559406,Tanh,Tanh,,,54,20,19.0,,,0.0007940084977145067,2,448,0.7015867117980261,4.676920338074735e-05,0.34333160519599915,COMPLETE
51,96.04678732661877,2023-09-04 19:33:16.105658,2023-09-04 19:33:21.335845,0 days 00:00:05.230187,Tanh,Tanh,,,56,20,19.0,,,0.000665097771780948,2,449,0.7338590011884376,2.1644427717542514e-05,0.36540451645851135,COMPLETE
52,90.10033693621236,2023-09-04 19:33:21.336129,2023-09-04 19:33:27.044347,0 days 00:00:05.708218,Tanh,Tanh,,,32,22,20.0,,,0.0013437355193325693,2,482,0.6631316882708709,6.024325292487446e-05,0.30822986364364624,COMPLETE
53,101.91628889000934,2023-09-04 19:33:27.044615,2023-09-04 19:33:32.671009,0 days 00:00:05.626394,Tanh,Tanh,,,38,20,21.0,,,0.0013707464555047513,2,475,0.7892213805019028,4.5261457029679326e-05,0.27617672085762024,COMPLETE
54,103.40180250314566,2023-09-04 19:33:32.671382,2023-09-04 19:33:34.952130,0 days 00:00:02.280748,Tanh,Tanh,Leaky,,33,22,15.0,16.0,,0.003026959846970999,3,482,0.6739846616852353,3.385758833974958e-05,0.32333338260650635,COMPLETE
55,103.25207748854092,2023-09-04 19:33:34.952407,2023-09-04 19:33:40.247155,0 days 00:00:05.294748,ReLU,Tanh,,,50,18,7.0,,,0.0008165363236117176,2,465,0.7481546605877621,5.490792188975326e-05,0.3453359305858612,COMPLETE
56,91.8726422627767,2023-09-04 19:33:40.247428,2023-09-04 19:33:44.983435,0 days 00:00:04.736007,Tanh,Tanh,,,15,21,4.0,,,0.0013324837466910638,2,423,0.7978141507092452,9.662534660020367e-05,0.264995276927948,COMPLETE
57,125.53984903734784,2023-09-04 19:33:44.983742,2023-09-04 19:33:51.631991,0 days 00:00:06.648249,Tanh,Tanh,,,13,21,1.0,,,0.001183283015931944,2,419,0.62605446658784,0.00019013248289162876,0.48521506786346436,COMPLETE
58,94.98297909573392,2023-09-04 19:33:51.632268,2023-09-04 19:33:57.608073,0 days 00:00:05.975805,Tanh,ReLU,Sigmoid,,21,24,3.0,11.0,,0.002909783622964043,3,381,0.5304459586020529,0.00010725501602786454,0.34169843792915344,COMPLETE
59,98.05759591767283,2023-09-04 19:33:57.608522,2023-09-04 19:34:01.796905,0 days 00:00:04.188383,Tanh,Tanh,,,23,18,5.0,,,0.0015574397412189377,2,491,0.7961318174087456,0.0002632547124763495,0.3208497166633606,COMPLETE
60,98.08772016608197,2023-09-04 19:34:01.797177,2023-09-04 19:34:11.599747,0 days 00:00:09.802570,ReLU,Tanh,,,28,22,10.0,,,0.0004541131173677851,2,432,0.6558177972860646,0.00044487836369905016,0.3198614716529846,COMPLETE
61,209.88291026384402,2023-09-04 19:34:11.600014,2023-09-04 19:34:22.226345,0 days 00:00:10.626331,Tanh,Tanh,,,17,1,20.0,,,0.0009458639032238808,2,466,0.7202376713014952,8.602185579724975e-05,0.5362753868103027,COMPLETE
62,101.12679195404053,2023-09-04 19:34:22.226791,2023-09-04 19:34:29.445879,0 days 00:00:07.219088,Tanh,Tanh,,,41,20,18.0,,,0.0006577631232861138,2,414,0.6778463700814792,3.412707591627221e-05,0.3371898829936981,COMPLETE
63,92.80116544451032,2023-09-04 19:34:29.446153,2023-09-04 19:34:33.421329,0 days 00:00:03.975176,Tanh,Tanh,,,30,21,5.0,,,0.001331367522334,2,499,0.7356320631556724,0.00017720518020560247,0.34496113657951355,COMPLETE
64,93.88221582636103,2023-09-04 19:34:33.421600,2023-09-04 19:34:39.408029,0 days 00:00:05.986429,Tanh,Sigmoid,,,30,21,5.0,,,0.003988168695086708,2,497,0.7502377846878097,0.0002094961921504293,0.30658257007598877,COMPLETE
65,102.96686229299992,2023-09-04 19:34:39.408364,2023-09-04 19:34:43.929682,0 days 00:00:04.521318,Tanh,Tanh,Leaky,,12,14,3.0,19.0,,0.002204201376162516,3,486,0.6093502707459563,0.0001813719117562947,0.3208335340023041,COMPLETE
66,95.94408840603299,2023-09-04 19:34:43.929954,2023-09-04 19:34:49.566751,0 days 00:00:05.636797,Tanh,,,,17,19,,,,0.0011724921950621837,1,465,0.7942405509083621,0.0003447027413959294,0.34194549918174744,COMPLETE
67,132.91951592413935,2023-09-04 19:34:49.567168,2023-09-04 19:35:01.684462,0 days 00:00:12.117294,Tanh,Leaky,,,23,22,6.0,,,0.0016597659254333646,2,236,0.6394700600674434,0.00015671340586799636,0.3211918771266937,COMPLETE
68,96.05924011940179,2023-09-04 19:35:01.684897,2023-09-04 19:35:08.782135,0 days 00:00:07.097238,Tanh,Tanh,,,36,17,8.0,,,0.00257704279902653,2,438,0.5711254956893748,0.0002628612005107404,0.30013546347618103,COMPLETE
69,99.20067912134631,2023-09-04 19:35:08.782606,2023-09-04 19:35:17.577491,0 days 00:00:08.794885,Sigmoid,Tanh,,,46,10,4.0,,,0.003839394160798742,2,372,0.7499994982934344,0.0004991501411434251,0.3710649013519287,COMPLETE
70,110.22621002197266,2023-09-04 19:35:17.577756,2023-09-04 19:35:21.509703,0 days 00:00:03.931947,ReLU,Tanh,Leaky,,31,23,3.0,19.0,,0.0013024492623107255,3,499,0.5128093967358953,0.00010266497527200898,0.3016431927680969,COMPLETE
71,89.44177051412647,2023-09-04 19:35:21.509981,2023-09-04 19:35:29.608564,0 days 00:00:08.098583,Tanh,Tanh,,,19,20,16.0,,,0.0007957549225645779,2,477,0.6949367801653751,0.0006495374952778285,0.34790778160095215,COMPLETE
72,97.15591513026844,2023-09-04 19:35:29.608821,2023-09-04 19:35:47.334298,0 days 00:00:17.725477,Tanh,Tanh,,,10,21,15.0,,,0.0005376912351755695,2,482,0.6767139639488239,0.0006536326549109659,0.32595667243003845,COMPLETE
73,99.6733772402904,2023-09-04 19:35:47.334559,2023-09-04 19:35:49.836434,0 days 00:00:02.501875,Tanh,Tanh,,,25,24,12.0,,,0.0016973780520461426,2,464,0.6338598481700999,0.0011341374108710229,0.3181293308734894,COMPLETE
74,161.3550609513825,2023-09-04 19:35:49.836725,2023-09-04 19:35:54.910578,0 days 00:00:05.073853,Tanh,Tanh,,,17,19,17.0,,,0.0010724509693960363,2,338,0.5586887800094378,0.0007491173695318442,0.31027790904045105,COMPLETE
75,1057.0654647962183,2023-09-04 19:35:54.910859,2023-09-04 19:36:01.160098,0 days 00:00:06.249239,Tanh,Sigmoid,,,20,21,14.0,,,0.0025485116008602893,2,477,0.6033779335789305,0.00046188799452688805,0.29315364360809326,COMPLETE
76,111.70584130588966,2023-09-04 19:36:01.160372,2023-09-04 19:36:12.530014,0 days 00:00:11.369642,Tanh,Tanh,,,15,18,16.0,,,0.00037437444735047976,2,408,0.7153093886454618,0.00032523626105253735,0.34470275044441223,COMPLETE
77,103.5724883747992,2023-09-04 19:36:12.530285,2023-09-04 19:36:20.794456,0 days 00:00:08.264171,Tanh,Leaky,,,13,22,5.0,,,0.002051120535720477,2,436,0.6641991636872083,0.00015634392503882937,0.3091123700141907,COMPLETE
78,101.50211940789075,2023-09-04 19:36:20.794729,2023-09-04 19:36:30.170318,0 days 00:00:09.375589,Tanh,Tanh,,,24,13,18.0,,,0.000623512455529157,2,458,0.7578986020170875,0.0008830798130454255,0.36165428161621094,COMPLETE
79,117.21599157851617,2023-09-04 19:36:30.170580,2023-09-04 19:36:34.984032,0 days 00:00:04.813452,Sigmoid,,,,98,15,,,,0.0014781690448821567,1,488,0.5956615392823936,0.0006808240187814928,0.3879418969154358,COMPLETE
80,179.8622844462492,2023-09-04 19:36:34.984293,2023-09-04 19:36:37.299322,0 days 00:00:02.315029,Leaky,ReLU,Sigmoid,Tanh,27,23,1.0,14.0,8.0,0.003182002207838077,4,475,0.5480997907238433,0.0002797020046577042,0.4788535535335541,COMPLETE
81,108.89681297436096,2023-09-04 19:36:37.299602,2023-09-04 19:36:45.368157,0 days 00:00:08.068555,Tanh,Tanh,,,39,20,20.0,,,0.0008168942559610401,2,443,0.7118898971504716,0.001259709323692737,0.32176804542541504,COMPLETE
82,101.18127020200093,2023-09-04 19:36:45.368422,2023-09-04 19:36:52.028081,0 days 00:00:06.659659,Tanh,Tanh,,,65,19,19.0,,,0.0009305435405667859,2,462,0.6878997540443471,6.828381375009581e-05,0.33524978160858154,COMPLETE
83,100.23571249643962,2023-09-04 19:36:52.028358,2023-09-04 19:36:55.350451,0 days 00:00:03.322093,Tanh,Tanh,,,55,17,18.0,,,0.0011505131443325526,2,487,0.7420844140749846,9.75830125417703e-05,0.321293443441391,COMPLETE
84,100.38140362706677,2023-09-04 19:36:55.350723,2023-09-04 19:37:03.677440,0 days 00:00:08.326717,Tanh,Tanh,,,20,20,17.0,,,0.0007740360838414755,2,428,0.798866723754236,0.0001332006167439818,0.32064077258110046,COMPLETE
85,103.09947094726563,2023-09-04 19:37:03.677712,2023-09-04 19:37:06.262972,0 days 00:00:02.585260,Tanh,Tanh,,,76,21,16.0,,,0.002004416934821648,2,448,0.6922935259320857,0.00039289006815686894,0.28739675879478455,COMPLETE
86,98.44686173659105,2023-09-04 19:37:06.263247,2023-09-04 19:37:11.076443,0 days 00:00:04.813196,Tanh,Tanh,Leaky,,16,19,23.0,5.0,,0.0015180877422276311,3,391,0.6260789290657739,7.379834780336039e-05,0.33203375339508057,COMPLETE
87,100.91232169301887,2023-09-04 19:37:11.076732,2023-09-04 19:37:15.862437,0 days 00:00:04.785705,Tanh,Tanh,,,34,16,21.0,,,0.000593385163035987,2,454,0.5966595087686215,0.000555413121173173,0.3689824342727661,COMPLETE
88,97.76538761326525,2023-09-04 19:37:15.862726,2023-09-04 19:37:17.507425,0 days 00:00:01.644699,Leaky,Tanh,,,47,23,12.0,,,0.0026521978142968546,2,473,0.6517224696148735,0.0019557377353714277,0.3090730607509613,COMPLETE
89,99.15855432325795,2023-09-04 19:37:17.507724,2023-09-04 19:37:19.034617,0 days 00:00:01.526893,ReLU,Tanh,,,91,14,14.0,,,0.0010526502596007702,2,62,0.7209741067481087,0.00011983773280830287,0.39002418518066406,COMPLETE
90,118.78593958486425,2023-09-04 19:37:19.035055,2023-09-04 19:37:23.520965,0 days 00:00:04.485910,Tanh,Sigmoid,,,30,22,7.0,,,0.0018375517133131212,2,492,0.7633614738048351,0.00017122143406988872,0.33721819519996643,COMPLETE
91,89.89222296598916,2023-09-04 19:37:23.521241,2023-09-04 19:37:25.161054,0 days 00:00:01.639813,Tanh,Tanh,,,96,24,19.0,,,0.002239036488172856,2,441,0.5795323062102672,0.00012882681641041666,0.3358544409275055,COMPLETE
92,180.52719234496124,2023-09-04 19:37:25.161322,2023-09-04 19:37:28.904895,0 days 00:00:03.743573,Tanh,Tanh,,,100,24,20.0,,,0.0012065958363214522,2,444,0.5644058804216864,0.0002120907516031234,0.32603582739830017,COMPLETE
93,93.46860546535916,2023-09-04 19:37:28.905161,2023-09-04 19:37:32.339665,0 days 00:00:03.434504,Tanh,Tanh,,,22,24,19.0,,,0.002317816889354808,2,427,0.6620249959597814,0.0009322898358355155,0.33174416422843933,COMPLETE
94,100.44267517843365,2023-09-04 19:37:32.339937,2023-09-04 19:37:34.538331,0 days 00:00:02.198394,Tanh,Tanh,,,96,23,18.0,,,0.0014715423981006615,2,473,0.5213198617326505,5.903570912587677e-05,0.3340322971343994,COMPLETE
