number,value,datetime_start,datetime_complete,duration,params_activation1,params_activation2,params_activation3,params_activation4,params_batch_size,params_fl1,params_fl2,params_fl3,params_fl4,params_learning_rate,params_n_layers,params_num_epochs,params_train_size,params_weight_decay,user_attrs_mre,state
478,0.3023398220539093,2023-09-04 18:41:51.586182,2023-09-04 18:41:55.269558,0 days 00:00:03.683376,ReLU,Leaky,,,23,16,19.0,,,0.007320694214523101,2,377,0.7991743305058988,1.3321546704497592e-05,158.9100842475891,COMPLETE
479,0.338588148355484,2023-09-04 18:41:55.269905,2023-09-04 18:41:57.176270,0 days 00:00:01.906365,ReLU,Leaky,,,24,16,18.0,,,0.0074166077010316455,2,379,0.7974641725000418,1.259901287854453e-05,147.88099535773782,COMPLETE
480,0.3708480894565582,2023-09-04 18:41:57.176612,2023-09-04 18:41:58.365933,0 days 00:00:01.189321,ReLU,Leaky,,,28,16,21.0,,,0.012666882823804813,2,398,0.7011476683467591,1.4486212054264112e-05,608.6765837492766,COMPLETE
481,0.37241801619529724,2023-09-04 18:41:58.366279,2023-09-04 18:42:02.162961,0 days 00:00:03.796682,ReLU,Leaky,,,11,15,18.0,,,0.009741622647004844,2,437,0.42653098371144305,1.6595472883037916e-05,280.51070242217094,COMPLETE
482,0.4112685024738312,2023-09-04 18:42:02.163310,2023-09-04 18:42:02.594606,0 days 00:00:00.431296,ReLU,Leaky,,,59,24,17.0,,,0.008252272208159795,2,387,0.15252011802883225,0.0032627285075512505,140.17562795785759,COMPLETE
483,0.3349382281303406,2023-09-04 18:42:02.594937,2023-09-04 18:42:06.740557,0 days 00:00:04.145620,ReLU,Leaky,,,15,15,13.0,,,0.006673164320570052,2,411,0.7676061157991475,1.002132054946241e-05,150.57226929297815,COMPLETE
484,0.707298994064331,2023-09-04 18:42:06.740908,2023-09-04 18:42:07.655864,0 days 00:00:00.914956,ReLU,Leaky,,,21,23,20.0,,,0.0061323861303679995,2,377,0.6621632790644718,0.0948549301036539,196.06654088637407,COMPLETE
485,0.5511448979377747,2023-09-04 18:42:07.656207,2023-09-04 18:42:08.247361,0 days 00:00:00.591154,ReLU,Leaky,,,61,21,17.0,,,0.008200188221584309,2,329,0.33793716712321686,0.021784862137302376,181.00456204621688,COMPLETE
486,0.3506964147090912,2023-09-04 18:42:08.247710,2023-09-04 18:42:09.369318,0 days 00:00:01.121608,ReLU,Leaky,,,55,20,24.0,,,0.015496658042546503,2,347,0.7330220509449669,1.322104392037876e-05,153.71804676055908,COMPLETE
487,0.3262041211128235,2023-09-04 18:42:09.369660,2023-09-04 18:42:10.553520,0 days 00:00:01.183860,ReLU,Leaky,,,23,22,19.0,,,0.010063738716288306,2,372,0.5722570942141831,1.6557592620970425e-05,250.10679517473494,COMPLETE
488,0.3591064512729645,2023-09-04 18:42:10.553876,2023-09-04 18:42:12.899882,0 days 00:00:02.346006,ReLU,Leaky,,,18,19,24.0,,,0.007287856209217576,2,387,0.7711125369961358,2.3335623890516915e-05,250.64858111213235,COMPLETE
489,0.33085259795188904,2023-09-04 18:42:12.900231,2023-09-04 18:42:17.200854,0 days 00:00:04.300623,Sigmoid,Leaky,,,25,16,24.0,,,0.005410393929538684,2,358,0.7121781316410088,3.0575055974875374e-05,187.06084112687543,COMPLETE
490,0.37813860177993774,2023-09-04 18:42:17.201215,2023-09-04 18:42:18.163997,0 days 00:00:00.962782,ReLU,Leaky,,,64,18,16.0,,,0.007103796084674094,2,304,0.2784414731662052,0.004914804380854308,144.60983260305304,COMPLETE
491,0.3494267165660858,2023-09-04 18:42:18.164332,2023-09-04 18:42:19.791902,0 days 00:00:01.627570,ReLU,Tanh,,,67,24,19.0,,,0.011519090762654068,2,320,0.797817999637549,2.0752027358100656e-05,214.2801883095189,COMPLETE
492,0.5233286619186401,2023-09-04 18:42:19.792251,2023-09-04 18:42:22.962431,0 days 00:00:03.170180,ReLU,Sigmoid,,,58,23,24.0,,,0.0015566532454444671,2,403,0.6812060131921692,0.0070876871137921325,2382.56981458162,COMPLETE
493,0.32171395421028137,2023-09-04 18:42:22.962758,2023-09-04 18:42:28.470014,0 days 00:00:05.507256,ReLU,Sigmoid,,,20,21,22.0,,,0.0021246559843890464,2,339,0.5130493281260433,1.2106411189186294e-05,3247.5872414572195,COMPLETE
494,0.43765297532081604,2023-09-04 18:42:28.470458,2023-09-04 18:42:30.120455,0 days 00:00:01.649997,ReLU,Leaky,,,17,24,24.0,,,0.03452685644483893,2,378,0.7500807291444352,0.0010475784667209698,182.66363906860352,COMPLETE
495,0.3965663015842438,2023-09-04 18:42:30.120799,2023-09-04 18:42:31.544199,0 days 00:00:01.423400,ReLU,Sigmoid,,,22,20,15.0,,,0.005907630238406553,2,365,0.17256188088085014,3.977545330172111e-05,202.3599962736431,COMPLETE
496,0.3535630404949188,2023-09-04 18:42:31.544566,2023-09-04 18:42:34.092322,0 days 00:00:02.547756,ReLU,Sigmoid,,,62,17,23.0,,,0.004935765887916052,2,393,0.41183808286857954,1.4596394712109235e-05,153.54478046992054,COMPLETE
497,0.3508855104446411,2023-09-04 18:42:34.092803,2023-09-04 18:42:35.468532,0 days 00:00:01.375729,ReLU,Leaky,,,71,22,23.0,,,0.008471432130250258,2,295,0.7994448211474285,0.002062198934607229,392.47671763102215,COMPLETE
498,0.40964558720588684,2023-09-04 18:42:35.468978,2023-09-04 18:42:54.002213,0 days 00:00:18.533235,ReLU,Sigmoid,,,13,10,24.0,,,0.0007316067075123034,2,416,0.3616694847533285,0.0012152678011257871,153.37011401549628,COMPLETE
499,0.39324063062667847,2023-09-04 18:42:54.002567,2023-09-04 18:42:56.861818,0 days 00:00:02.859251,ReLU,Sigmoid,Sigmoid,,27,16,9.0,3.0,,0.0066067364329853405,3,349,0.6367251280055702,2.8233306499863293e-05,188.06797614464392,COMPLETE
