number,value,datetime_start,datetime_complete,duration,params_activation1,params_activation2,params_activation3,params_activation4,params_batch_size,params_fl1,params_fl2,params_fl3,params_fl4,params_learning_rate,params_n_layers,params_num_epochs,params_train_size,params_weight_decay,user_attrs_mre,state
471,0.39899393916130066,2023-09-04 18:51:34.419628,2023-09-04 18:51:44.140805,0 days 00:00:09.721177,ReLU,ReLU,Tanh,Sigmoid,64,23,6.0,8.0,17.0,5.424793500415743e-05,4,301,0.7728045346438588,0.0010146403895996722,131.19459303035293,COMPLETE
472,0.31137919425964355,2023-09-04 18:51:44.141135,2023-09-04 18:51:46.195303,0 days 00:00:02.054168,ReLU,ReLU,ReLU,ReLU,72,21,7.0,9.0,23.0,0.00329107582917323,4,273,0.7004020386026314,0.0006681365814754324,92.40261210123698,COMPLETE
473,0.3004099130630493,2023-09-04 18:51:46.195623,2023-09-04 18:51:47.819843,0 days 00:00:01.624220,ReLU,ReLU,ReLU,Tanh,58,23,8.0,9.0,15.0,0.005959595620550218,4,289,0.7376707814859711,0.0008764437198775069,110.82010555267334,COMPLETE
474,0.4802945852279663,2023-09-04 18:51:47.820173,2023-09-04 18:51:49.262283,0 days 00:00:01.442110,ReLU,ReLU,ReLU,Tanh,62,3,5.0,10.0,16.0,0.002360629786211676,4,279,0.7622481810749314,0.0007281343893583344,119.22873989371367,COMPLETE
475,0.31906190514564514,2023-09-04 18:51:49.262615,2023-09-04 18:51:50.251051,0 days 00:00:00.988436,ReLU,ReLU,ReLU,ReLU,67,22,6.0,11.0,14.0,0.0040538784225777336,4,243,0.7970989317244458,0.0005674521527486703,104.70132013956706,COMPLETE
476,0.39399096369743347,2023-09-04 18:51:50.251376,2023-09-04 18:51:51.045827,0 days 00:00:00.794451,ReLU,ReLU,ReLU,Tanh,60,23,6.0,9.0,21.0,0.0028636846350553356,4,324,0.3191319882740587,0.00028814642859201114,109.66786472613995,COMPLETE
477,0.3020954132080078,2023-09-04 18:51:51.046162,2023-09-04 18:51:52.879430,0 days 00:00:01.833268,ReLU,ReLU,ReLU,ReLU,63,22,7.0,8.0,20.0,0.0014634640973158282,4,267,0.6565779024610602,0.0013078352464627981,284.99422044020434,COMPLETE
478,0.3900730311870575,2023-09-04 18:51:52.879764,2023-09-04 18:51:53.298103,0 days 00:00:00.418339,ReLU,ReLU,ReLU,Tanh,59,23,8.0,10.0,13.0,0.0022374082490068214,4,309,0.1347169308421567,0.0018572762472378781,131.5273991634971,COMPLETE
479,0.3056924641132355,2023-09-04 18:51:53.298428,2023-09-04 18:51:55.034594,0 days 00:00:01.736166,ReLU,ReLU,ReLU,Sigmoid,65,24,11.0,9.0,15.0,0.004767602973252533,4,258,0.7209498831643802,0.0002364245944037832,98.10800811222622,COMPLETE
480,0.34033840894699097,2023-09-04 18:51:55.034924,2023-09-04 18:51:56.025063,0 days 00:00:00.990139,ReLU,ReLU,Sigmoid,Leaky,61,23,7.0,10.0,16.0,0.0036840301081545066,4,235,0.265998770380459,0.0004487383980879105,118.07922542242356,COMPLETE
481,0.291830450296402,2023-09-04 18:51:56.025394,2023-09-04 18:51:58.818135,0 days 00:00:02.792741,ReLU,ReLU,ReLU,Tanh,58,22,5.0,8.0,17.0,0.00125168714794059,4,249,0.7981572647380607,0.00101241402966744,88.84164210728237,COMPLETE
482,0.3833461105823517,2023-09-04 18:51:58.818466,2023-09-04 18:52:00.190685,0 days 00:00:01.372219,ReLU,ReLU,ReLU,ReLU,63,24,6.0,24.0,18.0,0.04978984055467787,4,126,0.6849672569620278,0.00016598402628691526,110.54096459282769,COMPLETE
483,0.32464179396629333,2023-09-04 18:52:00.191021,2023-09-04 18:52:01.392880,0 days 00:00:01.201859,ReLU,Leaky,ReLU,Tanh,66,24,9.0,11.0,15.0,0.0027629928893508717,4,293,0.7481276595599723,0.000828603130987208,100.21311348362973,COMPLETE
484,0.30870485305786133,2023-09-04 18:52:01.393208,2023-09-04 18:52:02.553853,0 days 00:00:01.160645,ReLU,ReLU,ReLU,ReLU,55,21,7.0,9.0,13.0,0.018431721506650872,4,272,0.7656505434563702,0.004043586862612462,125.20238518714905,COMPLETE
485,0.345727801322937,2023-09-04 18:52:02.554176,2023-09-04 18:52:06.373387,0 days 00:00:03.819211,Sigmoid,ReLU,ReLU,Tanh,60,23,6.0,15.0,14.0,0.002048038736104885,4,282,0.7177338281536013,0.0015219529330298379,129.47698735382596,COMPLETE
486,0.3091808259487152,2023-09-04 18:52:06.373721,2023-09-04 18:52:10.665974,0 days 00:00:04.292253,ReLU,ReLU,Tanh,Tanh,64,24,5.0,9.0,16.0,0.00036055875877250856,4,260,0.7432542659869076,0.0011562096287080364,97.26195547766719,COMPLETE
487,0.3482430577278137,2023-09-04 18:52:10.666309,2023-09-04 18:52:11.535111,0 days 00:00:00.868802,ReLU,ReLU,ReLU,ReLU,62,21,8.0,10.0,15.0,0.0024947587373459414,4,267,0.30362716718680244,9.5595968453444e-05,105.50525677204132,COMPLETE
488,0.3503987789154053,2023-09-04 18:52:11.535445,2023-09-04 18:52:13.257666,0 days 00:00:01.722221,ReLU,ReLU,Leaky,Sigmoid,58,23,7.0,9.0,14.0,0.0013951935815271113,4,250,0.6915989786789244,0.0001402612435070403,118.16527557373047,COMPLETE
489,0.336467444896698,2023-09-04 18:52:13.258011,2023-09-04 18:52:15.619498,0 days 00:00:02.361487,ReLU,ReLU,ReLU,Tanh,53,22,6.0,7.0,15.0,0.0034424815417592055,4,275,0.7610271074523506,0.0005825939656395762,93.22473216056824,COMPLETE
490,0.34049248695373535,2023-09-04 18:52:15.619836,2023-09-04 18:52:23.901628,0 days 00:00:08.281792,ReLU,ReLU,ReLU,ReLU,68,24,7.0,9.0,17.0,0.00016525742818429917,4,304,0.6503276582765447,0.010072360228407767,95.61817528072156,COMPLETE
491,0.3388402760028839,2023-09-04 18:52:23.901960,2023-09-04 18:52:27.899769,0 days 00:00:03.997809,ReLU,ReLU,ReLU,Tanh,56,23,15.0,8.0,14.0,0.0005106387138057635,4,238,0.7212379882980573,0.0009465640329278935,98.82075381669841,COMPLETE
492,0.293653666973114,2023-09-04 18:52:27.900101,2023-09-04 18:52:30.546432,0 days 00:00:02.646331,ReLU,ReLU,ReLU,ReLU,60,24,5.0,10.0,16.0,0.0018948431331833058,4,284,0.7975843015027759,0.002028416851960519,92.38955708821615,COMPLETE
493,0.329241544008255,2023-09-04 18:52:30.546757,2023-09-04 18:52:32.135196,0 days 00:00:01.588439,ReLU,ReLU,ReLU,Tanh,70,22,6.0,11.0,13.0,0.002949804482457673,4,254,0.7714177795571666,0.0007351298398767373,92.1659107208252,COMPLETE
494,0.4213765561580658,2023-09-04 18:52:32.135515,2023-09-04 18:52:34.355846,0 days 00:00:02.220331,ReLU,ReLU,ReLU,Tanh,62,24,8.0,12.0,15.0,0.0003002915742085373,4,294,0.1634995517724092,0.0004929563702128576,101.48578698294503,COMPLETE
495,0.3407960832118988,2023-09-04 18:52:34.356182,2023-09-04 18:52:36.340239,0 days 00:00:01.984057,ReLU,ReLU,Sigmoid,ReLU,65,23,6.0,19.0,19.0,0.002374447260354433,4,229,0.7387970829403004,0.0004024722546006498,121.21722049400455,COMPLETE
496,0.31648537516593933,2023-09-04 18:52:36.340598,2023-09-04 18:52:38.912793,0 days 00:00:02.572195,ReLU,ReLU,ReLU,Tanh,57,23,7.0,13.0,12.0,0.0016360371234045992,4,263,0.6737775323662818,0.0013279960982361472,94.31583829469318,COMPLETE
497,0.32810765504837036,2023-09-04 18:52:38.913144,2023-09-04 18:52:43.065663,0 days 00:00:04.152519,ReLU,,,,59,24,,,,0.0012151914718715752,1,245,0.7054775857243619,0.00032973404353230497,101.15975980018372,COMPLETE
498,0.6317732930183411,2023-09-04 18:52:43.065977,2023-09-04 18:52:43.806864,0 days 00:00:00.740887,ReLU,ReLU,ReLU,Sigmoid,64,20,5.0,10.0,14.0,0.09280731695485099,4,276,0.7993354891975643,0.001028337370784235,141.33028717041014,COMPLETE
499,0.31438225507736206,2023-09-04 18:52:43.807355,2023-09-04 18:52:46.381359,0 days 00:00:02.574004,ReLU,ReLU,ReLU,ReLU,61,22,13.0,8.0,15.0,0.005256375424618455,4,269,0.7649371743466461,0.0016763422441500632,92.33227852599262,COMPLETE
