number,value,datetime_start,datetime_complete,duration,params_activation1,params_activation2,params_activation3,params_activation4,params_batch_size,params_fl1,params_fl2,params_fl3,params_fl4,params_learning_rate,params_n_layers,params_num_epochs,params_train_size,params_weight_decay,user_attrs_mre,state
362,0.314618855714798,2023-09-04 18:52:31.706903,2023-09-04 18:52:34.635776,0 days 00:00:02.928873,Tanh,Leaky,ReLU,Tanh,35,14,20.0,24.0,20.0,0.0023417258859990578,4,158,0.6028988328926846,0.00028174898127492683,176.7372960909991,COMPLETE
363,0.3256010413169861,2023-09-04 18:52:34.636356,2023-09-04 18:52:38.278966,0 days 00:00:03.642610,ReLU,Leaky,ReLU,Tanh,33,14,20.0,21.0,20.0,0.0033583245518305316,4,160,0.6119458387860695,0.00026025307715184595,193.70105388802543,COMPLETE
364,0.36458879709243774,2023-09-04 18:52:38.279301,2023-09-04 18:52:39.774387,0 days 00:00:01.495086,Tanh,Leaky,ReLU,Tanh,35,14,21.0,23.0,19.0,0.0024850172738514055,4,131,0.30715062148580025,0.00031271565995418774,219.61180877685547,COMPLETE
365,0.31918126344680786,2023-09-04 18:52:39.774714,2023-09-04 18:52:42.113418,0 days 00:00:02.338704,Tanh,Leaky,ReLU,Tanh,34,19,21.0,22.0,20.0,0.008536852133712252,4,153,0.5963720902249919,0.0002674832475327158,172.86670879289215,COMPLETE
366,0.3299010396003723,2023-09-04 18:52:42.113745,2023-09-04 18:52:44.311004,0 days 00:00:02.197259,Tanh,Leaky,ReLU,Tanh,38,19,20.0,22.0,21.0,0.009206363936355917,4,151,0.6023125011021595,0.00030573013696347516,171.01123718261718,COMPLETE
367,0.3370346128940582,2023-09-04 18:52:44.311353,2023-09-04 18:52:45.956345,0 days 00:00:01.644992,Tanh,Leaky,ReLU,Tanh,35,18,21.0,22.0,20.0,0.013437311344471483,4,155,0.5931533958390464,0.00024164263013141008,167.18735263222143,COMPLETE
368,0.3752375543117523,2023-09-04 18:52:45.956671,2023-09-04 18:52:48.536824,0 days 00:00:02.580153,Tanh,Leaky,ReLU,Tanh,36,19,22.0,22.0,20.0,0.011093901806600488,4,155,0.6301965755131107,0.003951947163024556,295.35512556596234,COMPLETE
369,0.35222411155700684,2023-09-04 18:52:48.537146,2023-09-04 18:52:52.548801,0 days 00:00:04.011655,Sigmoid,Leaky,ReLU,Tanh,34,14,21.0,23.0,20.0,0.007140338386678812,4,149,0.566563862202359,0.00022466180635556917,160.33282210406136,COMPLETE
370,0.3423716723918915,2023-09-04 18:52:52.549126,2023-09-04 18:52:58.017165,0 days 00:00:05.468039,Tanh,Leaky,ReLU,Tanh,34,13,20.0,24.0,21.0,0.0007565819004751014,4,172,0.6210345159943704,0.0003894684521341898,149.06528833007812,COMPLETE
371,0.345933198928833,2023-09-04 18:52:58.017514,2023-09-04 18:52:59.023079,0 days 00:00:01.005565,Tanh,Leaky,ReLU,Tanh,32,19,21.0,23.0,19.0,0.008073273058788664,4,131,0.3164833965734004,0.0002582585293173954,179.44207572937012,COMPLETE
372,0.40721991658210754,2023-09-04 18:52:59.023428,2023-09-04 18:53:00.653283,0 days 00:00:01.629855,Tanh,Leaky,ReLU,Tanh,32,13,22.0,22.0,20.0,0.001723811690793426,4,137,0.22682538282424888,0.0003651515786479098,163.31789670671736,COMPLETE
373,0.3598369359970093,2023-09-04 18:53:00.653623,2023-09-04 18:53:04.688350,0 days 00:00:04.034727,Leaky,Leaky,Leaky,Tanh,30,19,17.0,21.0,3.0,0.0010037916689614073,4,162,0.6488601969033728,0.000469741036047852,268.00626875714556,COMPLETE
374,0.36645397543907166,2023-09-04 18:53:04.688685,2023-09-04 18:53:09.568681,0 days 00:00:04.879996,Tanh,Leaky,ReLU,Tanh,37,11,16.0,22.0,18.0,0.0013523693576990908,4,180,0.6752065240904469,0.00027836887511591656,187.46591663360596,COMPLETE
375,0.3558472990989685,2023-09-04 18:53:09.569003,2023-09-04 18:53:12.677469,0 days 00:00:03.108466,Tanh,Leaky,ReLU,Tanh,51,7,20.0,24.0,19.0,0.002933680858768932,4,145,0.584538393766562,0.00020083625780516952,180.8708566387048,COMPLETE
376,0.48742058873176575,2023-09-04 18:53:12.677793,2023-09-04 18:53:13.992111,0 days 00:00:01.314318,Tanh,Sigmoid,ReLU,Tanh,49,14,18.0,21.0,18.0,0.0021395126818374998,4,166,0.12531383544747302,0.0004360187217471955,274.661140993417,COMPLETE
377,0.39552149176597595,2023-09-04 18:53:13.992428,2023-09-04 18:53:14.617982,0 days 00:00:00.625554,Tanh,Leaky,Leaky,Tanh,37,20,17.0,23.0,20.0,0.006395112702200901,4,170,0.10620240440739921,0.002650009064770071,222.7676764153815,COMPLETE
378,0.4283856451511383,2023-09-04 18:53:14.618306,2023-09-04 18:53:16.471072,0 days 00:00:01.852766,Tanh,Tanh,ReLU,Tanh,34,15,19.0,22.0,19.0,0.0016087954170527791,4,186,0.14333724432605052,0.0003357307203659524,257.9661224910191,COMPLETE
379,0.37078580260276794,2023-09-04 18:53:16.471406,2023-09-04 18:53:18.043866,0 days 00:00:01.572460,Sigmoid,Leaky,ReLU,Tanh,53,18,20.0,23.0,18.0,0.003903393873008369,4,158,0.3930551519961627,0.0006030604946467888,153.36986844967572,COMPLETE
380,0.554053544998169,2023-09-04 18:53:18.044189,2023-09-04 18:53:23.493368,0 days 00:00:05.449179,Tanh,Leaky,ReLU,Tanh,51,20,1.0,21.0,21.0,0.0005940077523189375,4,206,0.48378878215215115,0.00027431070214117164,246.15872296083322,COMPLETE
381,0.9931067228317261,2023-09-04 18:53:23.493706,2023-09-04 18:53:24.257810,0 days 00:00:00.764104,Tanh,Leaky,ReLU,Tanh,66,14,19.0,22.0,19.0,0.009260115762154379,4,173,0.5297287583519739,0.054256853620332605,101.0585140991211,COMPLETE
382,0.3807908296585083,2023-09-04 18:53:24.258140,2023-09-04 18:53:26.629289,0 days 00:00:02.371149,Tanh,Leaky,Leaky,Tanh,47,19,18.0,3.0,8.0,0.002666892201007855,4,194,0.43757753980373437,0.0003894348131046804,242.79943243347773,COMPLETE
383,0.33660537004470825,2023-09-04 18:53:26.629627,2023-09-04 18:53:29.244602,0 days 00:00:02.614975,Tanh,Leaky,ReLU,Leaky,59,13,17.0,24.0,18.0,0.0018199845206069232,4,214,0.6548786830497921,0.0004959397106013515,178.5901140485491,COMPLETE
384,0.3214453160762787,2023-09-04 18:53:29.244925,2023-09-04 18:53:30.556118,0 days 00:00:01.311193,Tanh,Leaky,ReLU,Tanh,56,20,16.0,22.0,20.0,0.01656244426903852,4,187,0.6263383426944867,0.0006458265220965223,175.34496076716934,COMPLETE
385,0.4513701796531677,2023-09-04 18:53:30.556438,2023-09-04 18:53:31.633952,0 days 00:00:01.077514,Tanh,Leaky,Sigmoid,Leaky,50,19,17.0,23.0,10.0,0.0021277407096359155,4,179,0.255079985346679,0.0003265213938047276,157.04932634454025,COMPLETE
386,0.33035945892333984,2023-09-04 18:53:31.634282,2023-09-04 18:53:32.532141,0 days 00:00:00.897859,Tanh,Leaky,ReLU,Tanh,53,12,18.0,18.0,22.0,0.011755119435138663,4,154,0.7077003421805407,6.004655562946797e-05,586.1368383789063,COMPLETE
387,0.3896079659461975,2023-09-04 18:53:32.532470,2023-09-04 18:53:35.092261,0 days 00:00:02.559791,Sigmoid,Leaky,Leaky,ReLU,36,15,21.0,21.0,17.0,0.021025540138502562,4,292,0.6811098149114133,0.00014748556428188602,200.10081751206343,COMPLETE
388,0.35239237546920776,2023-09-04 18:53:35.092586,2023-09-04 18:53:38.051783,0 days 00:00:02.959197,ReLU,Leaky,ReLU,Leaky,39,20,19.0,23.0,18.0,0.003140042139634971,4,201,0.5491985300747836,0.00021035193918521937,164.61173619979468,COMPLETE
389,0.3137563467025757,2023-09-04 18:53:38.052107,2023-09-04 18:53:40.295488,0 days 00:00:02.243381,Tanh,Leaky,ReLU,Tanh,45,18,20.0,22.0,19.0,0.008039487623186629,4,109,0.7989191484222102,0.00042269807953639065,279.8113336977751,COMPLETE
390,0.3116547763347626,2023-09-04 18:53:40.295821,2023-09-04 18:53:41.284143,0 days 00:00:00.988322,Tanh,Leaky,ReLU,Tanh,55,18,22.0,21.0,19.0,0.00787705642018681,4,306,0.7988670327932136,0.0005493171791955888,142.90517578125,COMPLETE
391,0.3323204219341278,2023-09-04 18:53:41.284466,2023-09-04 18:53:42.816653,0 days 00:00:01.532187,Tanh,Leaky,ReLU,Leaky,55,17,23.0,21.0,19.0,0.009972681564742151,4,321,0.7759175503946086,0.00044631848352986216,816.1872057792468,COMPLETE
392,0.33514028787612915,2023-09-04 18:53:42.816973,2023-09-04 18:53:43.998443,0 days 00:00:01.181470,Tanh,Leaky,ReLU,Tanh,55,18,21.0,20.0,20.0,0.008498375263920598,4,91,0.7905780175319717,0.0007130455799287476,186.55062182196255,COMPLETE
393,0.33566442131996155,2023-09-04 18:53:43.998761,2023-09-04 18:53:44.907940,0 days 00:00:00.909179,Tanh,Leaky,ReLU,ReLU,58,18,23.0,21.0,19.0,0.014056554185126855,4,55,0.7951816674417417,0.0018636056374647673,253.54588890075684,COMPLETE
394,0.3169707953929901,2023-09-04 18:53:44.908265,2023-09-04 18:53:46.203552,0 days 00:00:01.295287,Tanh,Leaky,ReLU,Leaky,52,18,20.0,24.0,20.0,0.0074095635555353635,4,301,0.7990742467012338,0.0005855588861638698,216.25526809692383,COMPLETE
395,0.34908226132392883,2023-09-04 18:53:46.203882,2023-09-04 18:53:47.879103,0 days 00:00:01.675221,Tanh,Leaky,ReLU,Leaky,52,18,20.0,24.0,21.0,0.0013318874490981106,4,119,0.7663614592000433,0.0005819948940141536,292.3884270246639,COMPLETE
396,0.33594465255737305,2023-09-04 18:53:47.879439,2023-09-04 18:53:49.213935,0 days 00:00:01.334496,Tanh,Leaky,ReLU,Leaky,53,17,20.0,24.0,19.0,0.006769085480999008,4,327,0.7973427857857354,0.000534939531319636,343.3582694313743,COMPLETE
397,0.7468968033790588,2023-09-04 18:53:49.214266,2023-09-04 18:53:50.411719,0 days 00:00:01.197453,Tanh,Leaky,ReLU,Leaky,57,17,16.0,24.0,1.0,0.0999526060610083,4,305,0.7355589779976862,0.000747897517115303,188.70372881208147,COMPLETE
398,0.39227402210235596,2023-09-04 18:53:50.412048,2023-09-04 18:53:53.165887,0 days 00:00:02.753839,Sigmoid,Leaky,ReLU,Leaky,50,18,17.0,24.0,9.0,0.007683660869669731,4,305,0.7986417450510911,0.0006522351568767974,174.39640482918162,COMPLETE
399,0.3259713649749756,2023-09-04 18:53:53.166210,2023-09-04 18:53:55.362437,0 days 00:00:02.196227,Leaky,Leaky,ReLU,Leaky,55,17,20.0,24.0,4.0,0.010799679204908645,4,315,0.747212981551352,0.0009466095706804767,690.9208435058594,COMPLETE
400,0.6622921824455261,2023-09-04 18:53:55.362772,2023-09-04 18:53:56.248168,0 days 00:00:00.885396,Tanh,Sigmoid,,,51,18,20.0,,,0.001091166010945731,2,297,0.7579632496671744,0.0315126832819097,168.71875762939453,COMPLETE
401,0.3418024182319641,2023-09-04 18:53:56.248488,2023-09-04 18:53:59.612745,0 days 00:00:03.364257,Tanh,Leaky,ReLU,,48,18,17.0,23.0,,0.0024844604025616454,3,486,0.7201153104388572,0.0005054581761901523,488.5412232049621,COMPLETE
402,0.344594269990921,2023-09-04 18:53:59.613060,2023-09-04 18:54:03.654607,0 days 00:00:04.041547,Tanh,Leaky,ReLU,Leaky,53,9,24.0,20.0,20.0,0.0016482154093067295,4,314,0.7992443297531276,0.0008679556722008819,391.58591302550667,COMPLETE
403,0.3180907964706421,2023-09-04 18:54:03.654960,2023-09-04 18:54:06.323266,0 days 00:00:02.668306,Tanh,Tanh,ReLU,Leaky,54,18,15.0,23.0,19.0,0.0019541512471908666,4,109,0.7622232556945432,0.00044721573389455146,148.98409881591797,COMPLETE
404,0.31578004360198975,2023-09-04 18:54:06.323608,2023-09-04 18:54:08.914476,0 days 00:00:02.590868,Tanh,Tanh,ReLU,Leaky,57,18,22.0,23.0,19.0,0.001958028544731957,4,90,0.7588833693838589,2.0175219392273272e-05,158.26290642725277,COMPLETE
405,0.32050439715385437,2023-09-04 18:54:08.914808,2023-09-04 18:54:11.081153,0 days 00:00:02.166345,Tanh,Tanh,ReLU,Leaky,60,18,22.0,23.0,19.0,0.0019443091233280689,4,76,0.7315419233064802,7.010290075972793e-05,138.96614462045522,COMPLETE
406,0.3226795494556427,2023-09-04 18:54:11.081477,2023-09-04 18:54:12.930969,0 days 00:00:01.849492,Tanh,Tanh,ReLU,Leaky,56,18,23.0,23.0,19.0,0.0023097507713081113,4,103,0.7633863889312498,1.870770693489107e-05,250.2841339111328,COMPLETE
407,0.33376652002334595,2023-09-04 18:54:12.931294,2023-09-04 18:54:16.595457,0 days 00:00:03.664163,Tanh,Tanh,ReLU,Leaky,58,19,22.0,23.0,19.0,0.0015249528699630178,4,103,0.745394774644638,0.0001645503658971812,241.54440677976146,COMPLETE
408,0.5263891220092773,2023-09-04 18:54:16.595796,2023-09-04 18:54:18.988536,0 days 00:00:02.392740,Tanh,Tanh,ReLU,Leaky,56,18,21.0,23.0,19.0,0.002111915120141605,4,114,0.7186271772587489,0.016533817933690496,212.1112315586635,COMPLETE
409,0.3534219563007355,2023-09-04 18:54:18.988861,2023-09-04 18:54:21.357100,0 days 00:00:02.368239,Tanh,Leaky,ReLU,Leaky,54,18,22.0,22.0,20.0,0.001943442508078103,4,99,0.4638833417304034,0.0020248617519403895,130.10148472939767,COMPLETE
410,0.32314833998680115,2023-09-04 18:54:21.357428,2023-09-04 18:54:24.388530,0 days 00:00:03.031102,Tanh,Tanh,ReLU,Leaky,54,19,22.0,23.0,19.0,0.0015305343911784697,4,98,0.7686339233281769,0.00013963154330214116,188.36060497428798,COMPLETE
411,0.3279731571674347,2023-09-04 18:54:24.388852,2023-09-04 18:54:26.933652,0 days 00:00:02.544800,Tanh,Tanh,ReLU,Leaky,57,19,21.0,22.0,19.0,0.002536498268128618,4,75,0.7415026091982914,8.780009421696502e-05,318.2953150981181,COMPLETE
412,0.31289753317832947,2023-09-04 18:54:26.933977,2023-09-04 18:54:30.361563,0 days 00:00:03.427586,Tanh,Tanh,ReLU,Sigmoid,51,18,23.0,22.0,18.0,0.0018507196303477725,4,89,0.7650523024170848,3.8842386215390817e-05,182.75023642550693,COMPLETE
413,0.3410474956035614,2023-09-04 18:54:30.361905,2023-09-04 18:54:32.804863,0 days 00:00:02.442958,Tanh,Tanh,ReLU,Sigmoid,52,17,23.0,22.0,18.0,0.0011829577324752511,4,69,0.7050523832428021,2.482554893616871e-05,453.065540700719,COMPLETE
414,0.6689121127128601,2023-09-04 18:54:32.805199,2023-09-04 18:54:33.372864,0 days 00:00:00.567665,Tanh,Tanh,ReLU,Sigmoid,49,19,23.0,21.0,18.0,0.06751399030811184,4,92,0.7683280982373883,1.0334541964318025e-05,377.41483248197113,COMPLETE
415,0.3202419877052307,2023-09-04 18:54:33.373190,2023-09-04 18:54:36.453775,0 days 00:00:03.080585,Tanh,Tanh,Tanh,Sigmoid,51,18,23.0,21.0,18.0,0.001376474593898042,4,84,0.7266713716787583,1.4486706329253837e-05,165.54657436552503,COMPLETE
416,0.3416200876235962,2023-09-04 18:54:36.454104,2023-09-04 18:54:38.912173,0 days 00:00:02.458069,Tanh,Tanh,ReLU,Sigmoid,50,19,22.0,10.0,17.0,0.002806676732754008,4,61,0.7670315391663486,4.452746319516933e-05,195.33061968693968,COMPLETE
417,0.32015159726142883,2023-09-04 18:54:38.912502,2023-09-04 18:54:41.438471,0 days 00:00:02.525969,Tanh,Tanh,ReLU,Sigmoid,62,18,24.0,22.0,18.0,0.0017727397463481965,4,81,0.706889293351579,2.8119158850505788e-05,157.0741640255775,COMPLETE
418,0.3311363458633423,2023-09-04 18:54:41.438810,2023-09-04 18:54:44.707763,0 days 00:00:03.268953,Tanh,Tanh,ReLU,Sigmoid,52,17,22.0,22.0,18.0,0.0009163045638754717,4,89,0.7371899363027258,2.1166222235674142e-05,247.5778695438685,COMPLETE
419,0.3541976809501648,2023-09-04 18:54:44.708107,2023-09-04 18:54:46.043175,0 days 00:00:01.335068,Tanh,Tanh,ReLU,ReLU,48,20,23.0,22.0,17.0,0.003284274827421669,4,302,0.36522319495024025,3.9042643658753944e-05,205.38670067420372,COMPLETE
420,0.31750884652137756,2023-09-04 18:54:46.043531,2023-09-04 18:54:49.488568,0 days 00:00:03.445037,Tanh,Tanh,Sigmoid,Sigmoid,59,24,20.0,21.0,20.0,0.002245968973451266,4,287,0.7744314382930979,5.411399370188895e-05,205.6132247301997,COMPLETE
421,0.4125870168209076,2023-09-04 18:54:49.488902,2023-09-04 18:54:51.037410,0 days 00:00:01.548508,Tanh,Sigmoid,Tanh,Sigmoid,60,23,20.0,21.0,20.0,0.0022433582742466093,4,289,0.15473524763682098,1.9421609274717222e-05,2274.21093638738,COMPLETE
422,0.33261704444885254,2023-09-04 18:54:51.037758,2023-09-04 18:54:55.154353,0 days 00:00:04.116595,ReLU,Tanh,Sigmoid,Sigmoid,58,20,20.0,22.0,19.0,0.0016291756092193755,4,407,0.7998629195789202,5.627791800165541e-05,205.20340994426184,COMPLETE
423,0.6740861535072327,2023-09-04 18:54:55.154681,2023-09-04 18:55:06.771524,0 days 00:00:11.616843,Tanh,Tanh,Sigmoid,Sigmoid,60,24,21.0,17.0,20.0,1.4210563387618583e-05,4,339,0.7721721118240852,1.4552395087667476e-05,220.5478795594522,COMPLETE
424,0.34012359380722046,2023-09-04 18:55:06.771868,2023-09-04 18:55:08.482283,0 days 00:00:01.710415,Tanh,Tanh,Tanh,Sigmoid,56,24,20.0,23.0,20.0,0.002388440573800186,4,299,0.4008181537254084,0.00012091961388314215,141.09601113962572,COMPLETE
425,0.42269882559776306,2023-09-04 18:55:08.482622,2023-09-04 18:55:10.221164,0 days 00:00:01.738542,Tanh,Tanh,Sigmoid,Sigmoid,58,24,19.0,22.0,19.0,0.0019127072917047945,4,307,0.1498900591880546,9.330847230758988e-05,238.69650566633356,COMPLETE
426,0.4065327048301697,2023-09-04 18:55:10.221511,2023-09-04 18:55:11.195074,0 days 00:00:00.973563,Tanh,Tanh,Sigmoid,Sigmoid,53,23,24.0,23.0,20.0,0.0027555077832123725,4,92,0.18969927674740353,3.29209642220509e-05,188.0095339236052,COMPLETE
427,0.36913570761680603,2023-09-04 18:55:11.195420,2023-09-04 18:55:12.867376,0 days 00:00:01.671956,Tanh,Tanh,Sigmoid,Sigmoid,50,19,20.0,21.0,18.0,0.0013804234441481072,4,67,0.4738435130969059,3.815147859835336e-05,289.0169728976577,COMPLETE
428,0.33937937021255493,2023-09-04 18:55:12.867704,2023-09-04 18:55:17.237720,0 days 00:00:04.370016,Tanh,Tanh,ReLU,Sigmoid,63,19,19.0,22.0,18.0,0.0022489724488333556,4,285,0.7984685282758852,4.659816898572361e-05,159.437100118842,COMPLETE
429,0.3735381066799164,2023-09-04 18:55:17.239025,2023-09-04 18:55:23.180994,0 days 00:00:05.941969,Tanh,,,,55,21,,,,0.0017042657564996107,1,291,0.7377271566675251,1.6079614126419846e-05,157.78039687020438,COMPLETE
430,0.38957658410072327,2023-09-04 18:55:23.181310,2023-09-04 18:55:27.106647,0 days 00:00:03.925337,Tanh,Tanh,Sigmoid,Sigmoid,52,18,21.0,21.0,20.0,0.0012291635869930663,4,104,0.7702535014375433,3.199200457172675e-05,192.86730296795184,COMPLETE
431,0.36329635977745056,2023-09-04 18:55:27.106976,2023-09-04 18:55:29.476287,0 days 00:00:02.369311,Tanh,ReLU,Sigmoid,Sigmoid,47,20,22.0,22.0,19.0,0.002977569953820606,4,351,0.7440016603596722,4.963155992524957e-05,165.5282256562831,COMPLETE
432,0.3250923454761505,2023-09-04 18:55:29.476634,2023-09-04 18:55:32.750046,0 days 00:00:03.273412,Leaky,Leaky,ReLU,Leaky,49,19,20.0,24.0,17.0,0.0024018976445819343,4,123,0.7998771252659291,7.614491393729854e-05,173.34807695661272,COMPLETE
433,0.38134536147117615,2023-09-04 18:55:32.750377,2023-09-04 18:55:34.200999,0 days 00:00:01.450622,Tanh,Tanh,ReLU,Leaky,65,17,19.0,23.0,17.0,0.0018524568720727705,4,279,0.27718999764003416,2.4300037629468092e-05,149.82902938179348,COMPLETE
434,0.3671967089176178,2023-09-04 18:55:34.201327,2023-09-04 18:55:38.625841,0 days 00:00:04.424514,Tanh,Leaky,Sigmoid,Sigmoid,54,20,22.0,22.0,21.0,0.0006676615489580602,4,295,0.2996445526866122,2.786931682551147e-05,340.01998151358913,COMPLETE
435,0.5334678888320923,2023-09-04 18:55:38.626180,2023-09-04 18:55:41.837749,0 days 00:00:03.211569,Tanh,Leaky,ReLU,Leaky,51,18,18.0,23.0,19.0,8.455187999948245e-05,4,326,0.18080034126688135,5.911556645385275e-05,268.43618222102066,COMPLETE
436,0.3571006953716278,2023-09-04 18:55:41.838100,2023-09-04 18:55:44.764375,0 days 00:00:02.926275,Tanh,Leaky,Tanh,Leaky,58,19,20.0,21.0,24.0,0.0015392200265467173,4,424,0.7219909947139791,0.0011053019183398201,188.42213194397675,COMPLETE
437,0.5954124331474304,2023-09-04 18:55:44.764715,2023-09-04 18:55:54.510365,0 days 00:00:09.745650,Tanh,Leaky,ReLU,Sigmoid,56,24,19.0,7.0,18.0,2.3795075665683007e-05,4,273,0.7675355847034249,1.8012368036937395e-05,244.97078190618382,COMPLETE
438,0.40056806802749634,2023-09-04 18:55:54.510708,2023-09-04 18:55:55.767083,0 days 00:00:01.256375,Tanh,Leaky,ReLU,Tanh,46,21,21.0,24.0,19.0,0.0010442196626505513,4,82,0.24929255004244935,3.975388431977495e-05,169.30563959261266,COMPLETE
439,0.34230226278305054,2023-09-04 18:55:55.767424,2023-09-04 18:55:57.962539,0 days 00:00:02.195115,Tanh,Tanh,ReLU,Leaky,49,19,19.0,22.0,18.0,0.0020917041192774475,4,258,0.41051256713623496,9.993217890207995e-05,163.41557342837555,COMPLETE
440,0.37610313296318054,2023-09-04 18:55:57.962877,2023-09-04 18:55:58.748479,0 days 00:00:00.785602,Tanh,Leaky,ReLU,Tanh,52,18,20.0,23.0,17.0,0.0034426797081728547,4,282,0.3473477024030862,6.778652209805635e-05,181.64460100446428,COMPLETE
441,0.35619041323661804,2023-09-04 18:55:58.748814,2023-09-04 18:56:23.109071,0 days 00:00:24.360257,Tanh,Leaky,ReLU,Leaky,11,20,18.0,22.0,20.0,0.00024272938901638512,4,295,0.7028027291410137,0.0014604934858272606,148.93988629604908,COMPLETE
442,0.33662524819374084,2023-09-04 18:56:23.109415,2023-09-04 18:56:25.990378,0 days 00:00:02.880963,ReLU,Leaky,Tanh,Tanh,18,20,23.0,17.0,18.0,0.0025341283712135205,4,314,0.7480609761454811,1.3020869879903666e-05,234.02671909332275,COMPLETE
443,0.3421134650707245,2023-09-04 18:56:25.990714,2023-09-04 18:56:28.942773,0 days 00:00:02.952059,Tanh,Leaky,ReLU,Sigmoid,62,21,20.0,21.0,20.0,0.001817539140899704,4,263,0.7721986674908266,2.2261270673559266e-05,223.83513071345186,COMPLETE
444,0.3435725271701813,2023-09-04 18:56:28.943106,2023-09-04 18:56:31.438717,0 days 00:00:02.495611,Tanh,Leaky,ReLU,Leaky,55,19,19.0,24.0,19.0,0.0013462953021249728,4,286,0.5205967445316761,0.00011264115164990827,156.6088163057963,COMPLETE
445,0.3624967038631439,2023-09-04 18:56:31.439046,2023-09-04 18:56:32.963132,0 days 00:00:01.524086,Tanh,Leaky,ReLU,,50,18,21.0,23.0,,0.003021080651091696,3,270,0.6915306616135495,2.712331206239214e-05,176.898542688248,COMPLETE
446,0.33548703789711,2023-09-04 18:56:32.963463,2023-09-04 18:56:35.160571,0 days 00:00:02.197108,Tanh,Leaky,ReLU,Tanh,54,19,18.0,22.0,18.0,0.0022163536121640294,4,277,0.7333829367978211,4.708593281068363e-05,259.20283172090177,COMPLETE
447,0.4056641459465027,2023-09-04 18:56:35.160920,2023-09-04 18:56:36.603169,0 days 00:00:01.442249,Tanh,Tanh,Tanh,Leaky,52,20,19.0,9.0,19.0,0.001551763078290918,4,300,0.17031281474881135,1.1510517890589557e-05,192.83006256103516,COMPLETE
448,0.34284210205078125,2023-09-04 18:56:36.603505,2023-09-04 18:56:39.101380,0 days 00:00:02.497875,Tanh,Leaky,ReLU,Sigmoid,48,17,20.0,21.0,17.0,0.0027311100187510417,4,251,0.755904139759707,2.0540564551901917e-05,318.6218960669733,COMPLETE
449,0.3410247564315796,2023-09-04 18:56:39.101715,2023-09-04 18:56:42.522784,0 days 00:00:03.421069,Tanh,Leaky,ReLU,Tanh,60,19,20.0,23.0,19.0,0.0007932986599115472,4,282,0.712638315086787,2.997522366612916e-05,180.23373569951994,COMPLETE
450,0.44545868039131165,2023-09-04 18:56:42.523117,2023-09-04 18:56:53.614059,0 days 00:00:11.090942,Tanh,Leaky,Sigmoid,Leaky,53,18,18.0,21.0,18.0,0.00013884111688650406,4,290,0.7950489289573168,1.649559504576778e-05,274.2737612494107,COMPLETE
451,0.5110309720039368,2023-09-04 18:56:53.614400,2023-09-04 18:56:54.627043,0 days 00:00:01.012643,Tanh,Sigmoid,ReLU,Tanh,57,22,21.0,22.0,19.0,0.0011388038089364286,4,91,0.2074017822052155,1.816946253270827e-05,376.4816062005012,COMPLETE
