number,value,datetime_start,datetime_complete,duration,params_activation1,params_activation2,params_activation3,params_activation4,params_batch_size,params_fl1,params_fl2,params_fl3,params_fl4,params_learning_rate,params_n_layers,params_num_epochs,params_train_size,params_weight_decay,user_attrs_mre,state
190,0.35467082262039185,2023-09-04 18:09:58.599212,2023-09-04 18:10:12.363915,0 days 00:00:13.764703,Sigmoid,Leaky,,,19,18,23.0,,,0.006726757120214073,2,361,0.7031591355871301,0.0004539125506610153,206.17092333341898,COMPLETE
191,0.39046022295951843,2023-09-04 18:10:12.364401,2023-09-04 18:10:16.309288,0 days 00:00:03.944887,ReLU,Leaky,,,58,17,8.0,,,0.002257749872426831,2,340,0.6275588842607528,0.00016402783481068352,253.8237739175053,COMPLETE
192,0.3129289448261261,2023-09-04 18:10:16.309767,2023-09-04 18:10:33.001107,0 days 00:00:16.691340,ReLU,Leaky,,,12,16,22.0,,,0.005578266855809977,2,323,0.7424584390600272,1.2579059919452539e-05,262.06985210550243,COMPLETE
193,0.35616040229797363,2023-09-04 18:10:33.001624,2023-09-04 18:10:44.245633,0 days 00:00:11.244009,Sigmoid,Leaky,,,14,16,22.0,,,0.008213066264763463,2,319,0.7408535796124274,5.140366697200636e-05,332.2355929904514,COMPLETE
194,0.3471711277961731,2023-09-04 18:10:44.246122,2023-09-04 18:10:49.493390,0 days 00:00:05.247268,ReLU,Leaky,,,60,16,24.0,,,0.00612926969454375,2,375,0.7925171233792493,0.0013339462811552817,240.16659951210022,COMPLETE
195,0.32969751954078674,2023-09-04 18:10:49.493882,2023-09-04 18:10:56.267358,0 days 00:00:06.773476,ReLU,Leaky,,,22,18,22.0,,,0.005485865494374289,2,402,0.6746773300571774,1.5874098780182192e-05,184.19481832330877,COMPLETE
196,0.33743545413017273,2023-09-04 18:10:56.267862,2023-09-04 18:10:59.427088,0 days 00:00:03.159226,ReLU,Leaky,,,61,23,23.0,,,0.016874728013483466,2,369,0.7065217428767031,0.0006011952328041815,183.16499647983284,COMPLETE
197,0.32812467217445374,2023-09-04 18:10:59.427576,2023-09-04 18:11:10.465604,0 days 00:00:11.038028,ReLU,Sigmoid,,,55,22,24.0,,,0.003845273951022044,2,356,0.7547541318355558,1.2435744935292065e-05,212.79974076242158,COMPLETE
198,0.3154709041118622,2023-09-04 18:11:10.466085,2023-09-04 18:11:20.978399,0 days 00:00:10.512314,ReLU,Leaky,,,27,17,22.0,,,0.00205344120269053,2,391,0.7981793150837693,2.0585201743080737e-05,311.2025971343552,COMPLETE
199,0.35610640048980713,2023-09-04 18:11:20.978905,2023-09-04 18:11:32.635167,0 days 00:00:11.656262,ReLU,Leaky,,,28,17,22.0,,,0.0016820140877635312,2,388,0.7963198413281367,2.131916077010955e-05,188.6341593295713,COMPLETE
200,0.31987035274505615,2023-09-04 18:11:32.635689,2023-09-04 18:11:42.270486,0 days 00:00:09.634797,ReLU,Leaky,,,26,19,22.0,,,0.002051569927562007,2,394,0.7397599253888401,9.182445096418018e-05,167.29814633456144,COMPLETE
201,0.32361578941345215,2023-09-04 18:11:42.270975,2023-09-04 18:11:56.597891,0 days 00:00:14.326916,ReLU,Leaky,,,26,19,22.0,,,0.0019848675040607024,2,396,0.7497277708645098,9.949550413366101e-05,179.01863727372947,COMPLETE
202,0.3393609821796417,2023-09-04 18:11:56.598386,2023-09-04 18:12:04.140824,0 days 00:00:07.542438,ReLU,Leaky,,,30,18,21.0,,,0.00228340675198286,2,387,0.7290368140160889,6.865501566337767e-05,122.933209694038,COMPLETE
203,0.360213965177536,2023-09-04 18:12:04.141330,2023-09-04 18:12:14.404970,0 days 00:00:10.263640,ReLU,Leaky,,,24,17,22.0,,,0.0025594062990439395,2,374,0.7597630097968305,5.7538532605739436e-05,349.3112177848816,COMPLETE
204,0.3528798818588257,2023-09-04 18:12:14.405468,2023-09-04 18:12:32.791666,0 days 00:00:18.386198,ReLU,Leaky,,,26,18,23.0,,,0.0018867396286472318,2,380,0.7967094732154114,1.4257919675434912e-05,159.30571358890856,COMPLETE
205,0.34602656960487366,2023-09-04 18:12:32.792172,2023-09-04 18:12:43.309436,0 days 00:00:10.517264,ReLU,Leaky,,,24,16,23.0,,,0.002971605849509097,2,419,0.7050786284100242,8.724838776165874e-05,242.7345869037467,COMPLETE
206,0.32025033235549927,2023-09-04 18:12:43.309916,2023-09-04 18:12:56.501906,0 days 00:00:13.191990,ReLU,Leaky,,,21,19,21.0,,,0.0021042316993046314,2,403,0.7336934134330286,0.0002146922596648024,607.6966119063528,COMPLETE
207,0.34873250126838684,2023-09-04 18:12:56.502397,2023-09-04 18:13:11.597003,0 days 00:00:15.094606,ReLU,Leaky,,,21,19,21.0,,,0.0016262343352641973,2,409,0.6856402071845513,0.0001305643560372395,727.0109571091672,COMPLETE
208,0.3381427228450775,2023-09-04 18:13:11.597489,2023-09-04 18:13:33.119642,0 days 00:00:21.522153,ReLU,Sigmoid,,,19,19,24.0,,,0.0020997613788133478,2,395,0.7258183842842216,0.00019451589904110513,161.49815421726393,COMPLETE
209,0.35461726784706116,2023-09-04 18:13:33.120146,2023-09-04 18:13:50.372413,0 days 00:00:17.252267,ReLU,Leaky,,,21,18,21.0,,,0.001598498468059386,2,361,0.6528569876817243,0.0001046044300213462,164.12676470620292,COMPLETE
210,0.3069995045661926,2023-09-04 18:13:50.372894,2023-09-04 18:14:01.446460,0 days 00:00:11.073566,ReLU,Leaky,,,67,18,24.0,,,0.0026148009519562105,2,403,0.7709344919103929,0.00021784247734700916,215.90697041829426,COMPLETE
211,0.32900115847587585,2023-09-04 18:14:01.446950,2023-09-04 18:14:09.433137,0 days 00:00:07.986187,ReLU,Leaky,,,72,18,24.0,,,0.002557948366865188,2,406,0.7700413483721469,0.0002088665301168918,199.97278889438562,COMPLETE
212,0.34145668148994446,2023-09-04 18:14:09.433625,2023-09-04 18:14:19.749164,0 days 00:00:10.315539,ReLU,Leaky,,,28,17,24.0,,,0.001996169380935232,2,399,0.7985107629942554,0.00026366358788063824,169.70622362409318,COMPLETE
213,0.3352072834968567,2023-09-04 18:14:19.749661,2023-09-04 18:14:26.197879,0 days 00:00:06.448218,ReLU,Leaky,,,57,20,23.0,,,0.0026433944754003145,2,421,0.727451295696889,0.00015843294259832724,227.75077783056054,COMPLETE
214,0.3463769853115082,2023-09-04 18:14:26.198353,2023-09-04 18:14:37.764484,0 days 00:00:11.566131,ReLU,Leaky,,,48,19,24.0,,,0.002270569950769709,2,348,0.7685304090323833,0.00023268180879371418,148.77063932872954,COMPLETE
215,0.34792569279670715,2023-09-04 18:14:37.764963,2023-09-04 18:14:45.265341,0 days 00:00:07.500378,Tanh,Leaky,,,69,17,23.0,,,0.0029508370166124102,2,379,0.6952549496437521,1.828802490708187e-05,1202.9430215949685,COMPLETE
216,0.31454554200172424,2023-09-04 18:14:45.265845,2023-09-04 18:15:10.592823,0 days 00:00:25.326978,ReLU,Sigmoid,,,75,18,22.0,,,0.0013376244837680702,2,391,0.7369756034471288,0.00017494589129733804,161.81730757223065,COMPLETE
217,0.38651010394096375,2023-09-04 18:15:10.593314,2023-09-04 18:15:20.725015,0 days 00:00:10.131701,ReLU,Leaky,,,74,17,22.0,,,0.001055744417497169,2,393,0.29636985455908627,0.00015886513502664997,159.40993512028345,COMPLETE
218,0.3330850303173065,2023-09-04 18:15:20.725504,2023-09-04 18:15:38.086578,0 days 00:00:17.361074,ReLU,Sigmoid,,,78,18,21.0,,,0.0014362263696291828,2,412,0.7316439152068381,0.00029507341301155955,1274.1145182510431,COMPLETE
219,0.33184245228767395,2023-09-04 18:15:38.087063,2023-09-04 18:15:46.435757,0 days 00:00:08.348694,ReLU,Leaky,,,66,16,22.0,,,0.0012154693216274847,2,404,0.7631552384643803,0.0003104761470931915,170.68861586472084,COMPLETE
220,0.35345542430877686,2023-09-04 18:15:46.436241,2023-09-04 18:15:54.990006,0 days 00:00:08.553765,ReLU,Leaky,,,25,18,24.0,,,0.00175090758859238,2,390,0.7160436061848479,0.0001823187320638622,191.26665852864582,COMPLETE
221,0.33177706599235535,2023-09-04 18:15:54.990478,2023-09-04 18:16:05.817074,0 days 00:00:10.826596,ReLU,Sigmoid,,,76,18,23.0,,,0.00203414732188609,2,368,0.6760165816793561,0.00020873113827241018,174.55051234444196,COMPLETE
222,0.3451341390609741,2023-09-04 18:16:05.817568,2023-09-04 18:16:10.267645,0 days 00:00:04.450077,ReLU,Sigmoid,,,66,19,22.0,,,0.007291609457788759,2,381,0.737805356881991,0.00013261973980452133,251.27186971997457,COMPLETE
223,0.46909746527671814,2023-09-04 18:16:10.268139,2023-09-04 18:17:15.439528,0 days 00:01:05.171389,Tanh,Sigmoid,,,18,17,23.0,,,5.7741076822072156e-05,2,399,0.7996048932288219,0.0002202336473000597,404.0787782597363,COMPLETE
224,0.32850131392478943,2023-09-04 18:17:15.439826,2023-09-04 18:17:19.112171,0 days 00:00:03.672345,ReLU,Sigmoid,,,21,18,23.0,,,0.0035683796459952378,2,371,0.698836994722416,9.701318841100628e-05,144.02368971230328,COMPLETE
225,0.631237268447876,2023-09-04 18:17:19.112449,2023-09-04 18:17:24.259664,0 days 00:00:05.147215,ReLU,Sigmoid,,,54,1,24.0,,,0.0016200038051578777,2,388,0.7681394936576531,0.00018162197201984973,525.8447039599088,COMPLETE
226,0.3355877101421356,2023-09-04 18:17:24.259942,2023-09-04 18:17:30.268237,0 days 00:00:06.008295,ReLU,Leaky,,,15,18,21.0,,,0.0024907942851903524,2,359,0.6591202182351226,0.0001390247172288591,167.89752926296657,COMPLETE
227,0.3711073398590088,2023-09-04 18:17:30.268516,2023-09-04 18:17:35.258912,0 days 00:00:04.990396,Sigmoid,Leaky,,,71,17,22.0,,,0.00416261362916552,2,373,0.744986957540611,4.557577742433054e-05,172.052341426815,COMPLETE
228,0.3489347994327545,2023-09-04 18:17:35.259189,2023-09-04 18:17:39.332789,0 days 00:00:04.073600,Tanh,Sigmoid,,,12,19,24.0,,,0.0031711824389875232,2,345,0.36040642113556903,2.701803610658145e-05,200.33618532956302,COMPLETE
229,0.3199971914291382,2023-09-04 18:17:39.333079,2023-09-04 18:17:41.153050,0 days 00:00:01.819971,ReLU,Leaky,,,51,16,23.0,,,0.005617323796195527,2,326,0.7121453204121824,1.2276351893117383e-05,176.96887047611065,COMPLETE
230,0.33469560742378235,2023-09-04 18:17:41.153334,2023-09-04 18:17:43.169598,0 days 00:00:02.016264,ReLU,Leaky,,,67,16,21.0,,,0.008300912592016367,2,327,0.7064423029249246,1.180857383163655e-05,167.84906531439887,COMPLETE
231,0.40283846855163574,2023-09-04 18:17:43.169883,2023-09-04 18:17:43.633492,0 days 00:00:00.463609,ReLU,Leaky,,,51,15,23.0,,,0.005717981852377069,2,332,0.14255020010106184,1.41815589346619e-05,826.1659625327751,COMPLETE
232,0.3575941324234009,2023-09-04 18:17:43.633791,2023-09-04 18:17:44.744868,0 days 00:00:01.111077,ReLU,Leaky,,,42,16,22.0,,,0.005363960678536857,2,309,0.4170303608352961,1.584878205830167e-05,447.409644175384,COMPLETE
233,0.5303515195846558,2023-09-04 18:17:44.745169,2023-09-04 18:17:45.701902,0 days 00:00:00.956733,ReLU,Leaky,,,23,17,23.0,,,0.07344580244679694,2,316,0.7331484912392146,1.2639518671813287e-05,205.06138186984592,COMPLETE
234,0.3312217891216278,2023-09-04 18:17:45.702185,2023-09-04 18:17:48.046635,0 days 00:00:02.344450,ReLU,Leaky,,,20,24,24.0,,,0.006580934071257133,2,297,0.6842769472286985,0.00032175635238621496,161.47306859216025,COMPLETE
235,0.3357993960380554,2023-09-04 18:17:48.046919,2023-09-04 18:17:51.501436,0 days 00:00:03.454517,ReLU,Leaky,,,17,16,22.0,,,0.00423721565286651,2,381,0.7616571552225827,1.1629858974008977e-05,309.64722595214846,COMPLETE
236,0.3391875624656677,2023-09-04 18:17:51.501725,2023-09-04 18:17:55.556619,0 days 00:00:04.054894,Tanh,Sigmoid,,,80,18,23.0,,,0.001957701834597429,2,394,0.6002701582856814,7.52904905893308e-05,155.92469710010593,COMPLETE
237,0.3610519468784332,2023-09-04 18:17:55.557094,2023-09-04 18:18:01.169634,0 days 00:00:05.612540,ReLU,Leaky,,,12,17,24.0,,,0.0026173720459115313,2,353,0.6317014256756064,0.0028670397672006524,190.5523092481825,COMPLETE
238,0.3378940224647522,2023-09-04 18:18:01.169921,2023-09-04 18:18:02.781287,0 days 00:00:01.611366,ReLU,Leaky,,,59,19,22.0,,,0.010411619630217684,2,402,0.725908844078878,3.514587026202193e-05,348.37776613235474,COMPLETE
239,0.31378912925720215,2023-09-04 18:18:02.781571,2023-09-04 18:18:08.493640,0 days 00:00:05.712069,ReLU,Sigmoid,,,22,17,23.0,,,0.003586566621464842,2,365,0.772216981602997,0.00012087137234451374,251.33133629525062,COMPLETE
240,0.355448842048645,2023-09-04 18:18:08.493912,2023-09-04 18:18:10.460791,0 days 00:00:01.966879,ReLU,Leaky,,,22,17,23.0,,,0.004833087322903902,2,379,0.4507977161022661,0.00011599364007248143,172.37506905248608,COMPLETE
241,0.327260285615921,2023-09-04 18:18:10.461118,2023-09-04 18:18:13.553393,0 days 00:00:03.092275,ReLU,Sigmoid,,,24,18,23.0,,,0.0034518522070370026,2,365,0.7716020813182551,6.488695805861928e-05,239.46140172926047,COMPLETE
242,0.30683228373527527,2023-09-04 18:18:13.553693,2023-09-04 18:18:22.420226,0 days 00:00:08.866533,ReLU,Sigmoid,,,26,17,24.0,,,0.002195257131665679,2,390,0.7988596990354354,0.00014189230972209505,268.3179469548219,COMPLETE
243,0.35455507040023804,2023-09-04 18:18:22.420509,2023-09-04 18:18:23.255149,0 days 00:00:00.834640,ReLU,Sigmoid,,,28,16,24.0,,,0.030194953134762254,2,388,0.79755405838392,0.00019078464675665804,193.50766799029182,COMPLETE
244,0.34491223096847534,2023-09-04 18:18:23.255433,2023-09-04 18:18:28.842583,0 days 00:00:05.587150,ReLU,Sigmoid,,,25,17,24.0,,,0.002214416865076095,2,415,0.7663943563087802,0.00015548611654572845,12754.374571104307,COMPLETE
245,0.3241485357284546,2023-09-04 18:18:28.842865,2023-09-04 18:18:33.620711,0 days 00:00:04.777846,ReLU,Sigmoid,,,22,16,24.0,,,0.00399035100287245,2,394,0.7449877024808752,0.00011603824933747312,343.42087545512635,COMPLETE
246,0.34749865531921387,2023-09-04 18:18:33.620993,2023-09-04 18:18:37.252485,0 days 00:00:03.631492,ReLU,Leaky,,,26,17,22.0,,,0.007225778786223734,2,382,0.719379917242655,8.976880228521093e-05,146.930703125,COMPLETE
247,0.29006457328796387,2023-09-04 18:18:37.252784,2023-09-04 18:18:44.841018,0 days 00:00:07.588234,ReLU,Sigmoid,,,19,23,23.0,,,0.0029512788313689467,2,374,0.7735716145774375,0.0001361443569563427,145.6282208306449,COMPLETE
248,0.35446518659591675,2023-09-04 18:18:44.841308,2023-09-04 18:18:49.364950,0 days 00:00:04.523642,ReLU,Sigmoid,,,19,23,23.0,,,0.003032518667192441,2,404,0.40354298347996503,0.00014675458156874306,192.01802325248718,COMPLETE
249,0.3255276679992676,2023-09-04 18:18:49.365258,2023-09-04 18:18:52.380467,0 days 00:00:03.015209,ReLU,Sigmoid,,,23,23,23.0,,,0.003549341875559958,2,373,0.48834515775364645,0.00011903374121366865,152.64286576194326,COMPLETE
250,0.3317934572696686,2023-09-04 18:18:52.380769,2023-09-04 18:18:53.922582,0 days 00:00:01.541813,ReLU,Sigmoid,,,82,24,24.0,,,0.005051188600380776,2,390,0.7451864143220814,0.00016951971675648083,172.05986806508656,COMPLETE
251,0.3607388734817505,2023-09-04 18:18:53.922867,2023-09-04 18:18:56.998384,0 days 00:00:03.075517,ReLU,Sigmoid,,,20,23,22.0,,,0.002857210344400666,2,401,0.31674897832387894,0.00024644540392749505,173.19191413090147,COMPLETE
252,0.3167894780635834,2023-09-04 18:18:56.998693,2023-09-04 18:18:58.811195,0 days 00:00:01.812502,ReLU,Leaky,,,26,21,24.0,,,0.006016887660813006,2,381,0.7041658745400228,0.00015550585113420292,160.10147857666016,COMPLETE
253,0.34304946660995483,2023-09-04 18:18:58.811486,2023-09-04 18:19:00.530682,0 days 00:00:01.719196,ReLU,Sigmoid,,,27,22,24.0,,,0.0057476129261162575,2,383,0.37737985999156687,0.00013902143431898483,1978.8194289434523,COMPLETE
254,0.32373306155204773,2023-09-04 18:19:00.530967,2023-09-04 18:19:03.411807,0 days 00:00:02.880840,ReLU,Leaky,,,29,21,24.0,,,0.008240281086792488,2,376,0.6969124554380424,0.00013716627421391422,176.64417325533353,COMPLETE
255,0.34542137384414673,2023-09-04 18:19:03.412099,2023-09-04 18:19:06.417523,0 days 00:00:03.005424,Sigmoid,Leaky,,,25,21,23.0,,,0.006665817007793751,2,369,0.7734049980648421,0.00010247385136465885,173.3111435195147,COMPLETE
256,0.3279842436313629,2023-09-04 18:19:06.417816,2023-09-04 18:19:09.454885,0 days 00:00:03.037069,ReLU,Sigmoid,,,27,22,23.0,,,0.004384164415090686,2,341,0.704390958700938,8.522378435916251e-05,183.64402574811663,COMPLETE
257,0.33899569511413574,2023-09-04 18:19:09.455184,2023-09-04 18:19:11.562324,0 days 00:00:02.107140,ReLU,Leaky,,,32,15,24.0,,,0.005514142032678786,2,391,0.6726872085141716,0.0001615168163907897,1536.0757383149246,COMPLETE
258,0.33874207735061646,2023-09-04 18:19:11.562608,2023-09-04 18:19:14.464794,0 days 00:00:02.902186,ReLU,Leaky,,,55,24,24.0,,,0.003665988417819475,2,359,0.7699090640217914,0.00011912692327735093,233.2723473768968,COMPLETE
259,0.33216166496276855,2023-09-04 18:19:14.465077,2023-09-04 18:19:16.428471,0 days 00:00:01.963394,ReLU,Sigmoid,,,24,23,23.0,,,0.0047543706019777645,2,380,0.7136862282967599,2.446402613105985e-05,208.0700241088867,COMPLETE
260,0.3138851821422577,2023-09-04 18:19:16.428750,2023-09-04 18:19:19.342912,0 days 00:00:02.914162,ReLU,Leaky,,,18,20,23.0,,,0.006513969276982246,2,367,0.7461071811168276,5.5128554065171786e-05,155.27828911675348,COMPLETE
261,0.3291427195072174,2023-09-04 18:19:19.343203,2023-09-04 18:19:21.891198,0 days 00:00:02.547995,ReLU,Leaky,,,19,22,22.0,,,0.009197587148660672,2,366,0.7474337612931911,5.531380996503054e-05,143.6862912061738,COMPLETE
262,0.31899702548980713,2023-09-04 18:19:21.891485,2023-09-04 18:19:24.655986,0 days 00:00:02.764501,ReLU,Sigmoid,,,17,20,24.0,,,0.007439199913355075,2,354,0.7991841865748034,4.0356245629595187e-05,311.3103364643298,COMPLETE
263,0.2892415225505829,2023-09-04 18:19:24.656274,2023-09-04 18:19:28.126159,0 days 00:00:03.469885,ReLU,Sigmoid,,,17,20,24.0,,,0.007573194045817061,2,359,0.7999187935782314,3.823584338461384e-05,159.89215215047201,COMPLETE
264,0.32705995440483093,2023-09-04 18:19:28.126440,2023-09-04 18:19:31.391596,0 days 00:00:03.265156,ReLU,Sigmoid,,,16,21,24.0,,,0.011340523892765454,2,372,0.7617779276990254,4.245750825435658e-05,904.2340833875868,COMPLETE
265,0.3235357105731964,2023-09-04 18:19:31.391878,2023-09-04 18:19:33.714282,0 days 00:00:02.322404,ReLU,Sigmoid,,,17,20,24.0,,,0.008750629627673558,2,350,0.7966348122305492,3.1815218962278775e-05,173.6679654121399,COMPLETE
266,0.33298972249031067,2023-09-04 18:19:33.714567,2023-09-04 18:19:36.791771,0 days 00:00:03.077204,ReLU,Sigmoid,,,19,21,24.0,,,0.006771500885557711,2,362,0.7752176301860177,4.986685763099775e-05,339.764492670695,COMPLETE
267,0.35128578543663025,2023-09-04 18:19:36.792063,2023-09-04 18:19:41.966225,0 days 00:00:05.174162,Sigmoid,Sigmoid,,,21,22,23.0,,,0.006094192260933382,2,379,0.6614740744377032,3.349674778151136e-05,126.20721611609825,COMPLETE
268,0.3731864094734192,2023-09-04 18:19:41.966511,2023-09-04 18:19:44.671600,0 days 00:00:02.705089,ReLU,Sigmoid,,,15,17,24.0,,,0.004291521244240675,2,364,0.3838088948842787,0.0003560212693338216,133.1967317885247,COMPLETE
269,0.32868415117263794,2023-09-04 18:19:44.671893,2023-09-04 18:19:48.795797,0 days 00:00:04.123904,ReLU,Sigmoid,,,22,21,23.0,,,0.008465242941091675,2,374,0.7445607361122011,2.6133697910672117e-05,169.29465846011513,COMPLETE
270,0.4834526777267456,2023-09-04 18:19:48.796082,2023-09-04 18:19:50.368190,0 days 00:00:01.572108,ReLU,ReLU,,,19,21,23.0,,,0.0032662503605224266,2,385,0.44879210990171076,0.0152275252756887,221.70226069859095,COMPLETE
271,0.3169773519039154,2023-09-04 18:19:50.368474,2023-09-04 18:19:52.138427,0 days 00:00:01.769953,ReLU,Sigmoid,,,64,20,24.0,,,0.007033682650412015,2,356,0.799763806831225,7.055891857332001e-05,186.08706754796646,COMPLETE
272,0.3153604567050934,2023-09-04 18:19:52.138712,2023-09-04 18:19:53.720507,0 days 00:00:01.581795,ReLU,Sigmoid,,,63,21,24.0,,,0.007034024914115042,2,343,0.7967047668703009,3.9259888525014664e-05,729.8106455485026,COMPLETE
273,0.3313751518726349,2023-09-04 18:19:53.720781,2023-09-04 18:19:56.176356,0 days 00:00:02.455575,ReLU,Sigmoid,,,65,20,24.0,,,0.007143851351568302,2,343,0.7987948020021031,6.774480259247014e-05,176.94838645241478,COMPLETE
274,0.3346789479255676,2023-09-04 18:19:56.176647,2023-09-04 18:19:58.509588,0 days 00:00:02.332941,ReLU,Sigmoid,,,59,20,24.0,,,0.010528846547159418,2,336,0.7995979470597626,5.541347021017619e-05,133.89108530680338,COMPLETE
275,0.3407161235809326,2023-09-04 18:19:58.509884,2023-09-04 18:20:00.254731,0 days 00:00:01.744847,ReLU,Sigmoid,,,62,20,24.0,,,0.008220079208293332,2,350,0.7594271051320534,3.238367179188857e-05,666.0317795973558,COMPLETE
276,0.31220942735671997,2023-09-04 18:20:00.255025,2023-09-04 18:20:01.907070,0 days 00:00:01.652045,ReLU,Sigmoid,,,62,21,24.0,,,0.006321214177896293,2,357,0.7701132528231757,4.99246150429507e-05,141.97191953659058,COMPLETE
277,0.3113016188144684,2023-09-04 18:20:01.907354,2023-09-04 18:20:05.876173,0 days 00:00:03.968819,Sigmoid,Sigmoid,,,63,21,24.0,,,0.0065079252604502025,2,357,0.7760329017032412,5.342567859177584e-05,145.2151728279983,COMPLETE
278,0.3480900526046753,2023-09-04 18:20:05.876464,2023-09-04 18:20:09.479840,0 days 00:00:03.603376,Sigmoid,Sigmoid,,,58,20,24.0,,,0.0063339307219313955,2,356,0.7686782113859362,5.632047146468344e-05,190.83837924786468,COMPLETE
279,0.35130831599235535,2023-09-04 18:20:09.480139,2023-09-04 18:20:11.958114,0 days 00:00:02.477975,Sigmoid,Sigmoid,,,64,21,24.0,,,0.006673389961688257,2,348,0.7711182863407811,4.8466804713480936e-05,163.79285073787608,COMPLETE
280,0.3391130566596985,2023-09-04 18:20:11.958412,2023-09-04 18:20:15.032866,0 days 00:00:03.074454,Sigmoid,Sigmoid,,,61,21,24.0,,,0.009597010329560217,2,344,0.764663027478434,7.750558492537936e-05,192.476184055723,COMPLETE
281,0.4177878499031067,2023-09-04 18:20:15.033151,2023-09-04 18:20:15.969962,0 days 00:00:00.936811,ReLU,,,,62,20,,,,0.0072367945877225255,1,356,0.7993317119151919,6.436133661850721e-05,174.8005598019331,COMPLETE
282,0.3356357514858246,2023-09-04 18:20:15.970247,2023-09-04 18:20:19.400033,0 days 00:00:03.429786,Sigmoid,Sigmoid,,,68,21,24.0,,,0.00561909781787233,2,333,0.7486956419833741,4.514610921784844e-05,130.59004598345075,COMPLETE
283,0.33891916275024414,2023-09-04 18:20:19.400324,2023-09-04 18:20:21.270835,0 days 00:00:01.870511,Sigmoid,Sigmoid,,,65,20,23.0,,,0.013335812361298688,2,359,0.7298788105305672,4.671519963917248e-05,178.48431594650467,COMPLETE
284,0.35814791917800903,2023-09-04 18:20:21.271151,2023-09-04 18:20:24.393187,0 days 00:00:03.122036,Sigmoid,Sigmoid,,,64,20,24.0,,,0.00784886403095409,2,340,0.7700598924349596,4.068370960432285e-05,150.3731585820516,COMPLETE
285,0.3922213613986969,2023-09-04 18:20:24.393492,2023-09-04 18:20:27.247919,0 days 00:00:02.854427,ReLU,Sigmoid,,,63,5,23.0,,,0.005321365906346434,2,351,0.7998465677713625,7.361272717117073e-05,238.2886146619482,COMPLETE
