number,value,datetime_start,datetime_complete,duration,params_activation1,params_activation2,params_activation3,params_activation4,params_batch_size,params_fl1,params_fl2,params_fl3,params_fl4,params_learning_rate,params_n_layers,params_num_epochs,params_train_size,params_weight_decay,user_attrs_mre,state
380,0.3494805693626404,2023-09-04 18:47:45.442741,2023-09-04 18:47:54.766918,0 days 00:00:09.324177,ReLU,Sigmoid,ReLU,ReLU,63,23,4.0,10.0,20.0,0.00046535402856431597,4,260,0.7730174750418622,0.001442060944705466,97.47144241333008,COMPLETE
381,0.3616389036178589,2023-09-04 18:47:54.767256,2023-09-04 18:48:01.725746,0 days 00:00:06.958490,ReLU,,,,46,24,,,,0.0002363370358800914,1,268,0.7956708284674638,0.0008687780389643959,113.77171818178091,COMPLETE
382,0.35314860939979553,2023-09-04 18:48:01.726062,2023-09-04 18:48:06.274401,0 days 00:00:04.548339,ReLU,ReLU,Leaky,ReLU,56,24,5.0,9.0,17.0,0.0003707416119108589,4,244,0.6839196590401323,0.0012252639830106688,147.8208671790966,COMPLETE
383,0.4246404469013214,2023-09-04 18:48:06.274741,2023-09-04 18:48:07.959359,0 days 00:00:01.684618,ReLU,ReLU,ReLU,ReLU,68,23,5.0,9.0,13.0,0.0005722546381868747,4,232,0.19813765055556792,0.0009756903990120242,131.76629527853854,COMPLETE
384,0.32987454533576965,2023-09-04 18:48:07.959699,2023-09-04 18:48:14.955560,0 days 00:00:06.995861,ReLU,ReLU,ReLU,Tanh,49,24,5.0,10.0,19.0,0.0004402358050743442,4,263,0.7308898929017128,0.0003080907817291873,105.04885474404136,COMPLETE
385,0.2818683683872223,2023-09-04 18:48:14.955907,2023-09-04 18:48:17.751641,0 days 00:00:02.795734,ReLU,ReLU,ReLU,ReLU,45,23,6.0,9.0,14.0,0.0024998952254807376,4,246,0.7991698199378244,0.0012596981854777678,97.0714457111974,COMPLETE
386,0.3258596360683441,2023-09-04 18:48:17.751990,2023-09-04 18:48:20.844531,0 days 00:00:03.092541,ReLU,ReLU,ReLU,,45,22,6.0,8.0,,0.002394565571377087,3,255,0.7618502635446085,0.001094349512293596,81.96537263052804,COMPLETE
387,0.2616457939147949,2023-09-04 18:48:20.844858,2023-09-04 18:48:22.972372,0 days 00:00:02.127514,ReLU,ReLU,ReLU,ReLU,62,23,6.0,9.0,14.0,0.002316103928651696,4,275,0.7999022371481218,0.0008279078256580959,100.0968999226888,COMPLETE
388,0.2857857942581177,2023-09-04 18:48:22.972717,2023-09-04 18:48:25.490466,0 days 00:00:02.517749,ReLU,ReLU,ReLU,ReLU,62,22,6.0,9.0,15.0,0.0025755046220090156,4,277,0.7933568249034452,0.0008707739966866672,89.44063186645508,COMPLETE
389,0.2384173423051834,2023-09-04 18:48:25.490805,2023-09-04 18:48:28.112754,0 days 00:00:02.621949,ReLU,ReLU,ReLU,ReLU,61,22,6.0,9.0,15.0,0.002433785340761767,4,285,0.7944444515954762,0.0007935798968768095,85.88974113986917,COMPLETE
390,0.31116461753845215,2023-09-04 18:48:28.113079,2023-09-04 18:48:29.994418,0 days 00:00:01.881339,ReLU,ReLU,ReLU,ReLU,62,22,6.0,9.0,15.0,0.002513321998614755,4,289,0.7851384966050616,0.0006644741666665678,108.11643909958174,COMPLETE
391,0.362537682056427,2023-09-04 18:48:29.994750,2023-09-04 18:48:31.417043,0 days 00:00:01.422293,ReLU,ReLU,ReLU,ReLU,66,23,4.0,9.0,14.0,0.0020855764000651386,4,278,0.7966882608495204,0.000817513328751205,107.5980611528669,COMPLETE
392,0.28315815329551697,2023-09-04 18:48:31.417383,2023-09-04 18:48:32.907146,0 days 00:00:01.489763,ReLU,ReLU,ReLU,ReLU,64,22,6.0,9.0,15.0,0.0023509659706281182,4,281,0.7955880607689,0.0007585865751553363,112.01007009107013,COMPLETE
393,0.31562769412994385,2023-09-04 18:48:32.907479,2023-09-04 18:48:34.709420,0 days 00:00:01.801941,ReLU,ReLU,ReLU,ReLU,61,22,6.0,8.0,15.0,0.002451437483115562,4,286,0.7912899012944401,0.000664143062174688,94.72313385009765,COMPLETE
394,0.27791720628738403,2023-09-04 18:48:34.709759,2023-09-04 18:48:38.308862,0 days 00:00:03.599103,ReLU,ReLU,Sigmoid,ReLU,64,22,7.0,9.0,14.0,0.002825698398678233,4,281,0.7999804248032079,0.0007261701842515798,89.48586280529315,COMPLETE
395,0.3142974376678467,2023-09-04 18:48:38.309200,2023-09-04 18:48:40.696496,0 days 00:00:02.387296,ReLU,ReLU,Sigmoid,ReLU,65,21,9.0,9.0,14.0,0.0025562947968900728,4,284,0.7882827565966422,0.0007963660659371996,96.28834980555943,COMPLETE
396,0.3121938407421112,2023-09-04 18:48:40.696833,2023-09-04 18:48:42.337267,0 days 00:00:01.640434,ReLU,ReLU,ReLU,ReLU,67,22,6.0,8.0,14.0,0.0025473532937305755,4,289,0.7684444471654507,0.0007112455798351981,104.26247161865234,COMPLETE
397,0.30780184268951416,2023-09-04 18:48:42.337599,2023-09-04 18:48:45.237033,0 days 00:00:02.899434,ReLU,ReLU,Sigmoid,ReLU,65,22,7.0,10.0,23.0,0.002967886683245082,4,276,0.7944604429361674,0.0009154488287706157,101.60861403521369,COMPLETE
398,0.31567734479904175,2023-09-04 18:48:45.237362,2023-09-04 18:48:49.358718,0 days 00:00:04.121356,ReLU,Leaky,Sigmoid,ReLU,63,21,6.0,9.0,15.0,0.0017698416241386612,4,279,0.7984843464061313,0.0008242721648417489,97.87763440406928,COMPLETE
399,0.32624921202659607,2023-09-04 18:48:49.359056,2023-09-04 18:48:51.223796,0 days 00:00:01.864740,ReLU,ReLU,ReLU,ReLU,64,22,7.0,9.0,13.0,0.0021149575866694624,4,294,0.7996561201904716,0.0009084469523608992,93.92046543337264,COMPLETE
400,0.3335378170013428,2023-09-04 18:48:51.224128,2023-09-04 18:48:53.189679,0 days 00:00:01.965551,ReLU,ReLU,Sigmoid,ReLU,59,22,5.0,22.0,12.0,0.002865175083915823,4,274,0.7583002952276733,0.0005562453184793215,121.12700694691051,COMPLETE
401,0.29964175820350647,2023-09-04 18:48:53.190019,2023-09-04 18:48:55.675513,0 days 00:00:02.485494,ReLU,ReLU,ReLU,ReLU,62,22,6.0,10.0,15.0,0.0018245933051074551,4,273,0.7431679348430406,0.0007125604810462837,134.00772481421902,COMPLETE
402,0.37863630056381226,2023-09-04 18:48:55.675857,2023-09-04 18:48:56.227979,0 days 00:00:00.552122,ReLU,ReLU,ReLU,Leaky,58,22,8.0,8.0,14.0,0.002233134827659653,4,289,0.21761039063726176,0.0005979444296272032,155.86334524349292,COMPLETE
403,0.3212680220603943,2023-09-04 18:48:56.228314,2023-09-04 18:48:57.522838,0 days 00:00:01.294524,ReLU,ReLU,ReLU,,53,22,7.0,9.0,,0.002635854721815001,3,305,0.7552108173985356,0.0010278506154957538,94.48790134527745,COMPLETE
404,0.30248454213142395,2023-09-04 18:48:57.523164,2023-09-04 18:49:00.433501,0 days 00:00:02.910337,ReLU,ReLU,ReLU,ReLU,63,22,5.0,10.0,15.0,0.001833215205352789,4,282,0.7289610137592348,0.0004968291525385653,106.20526936848958,COMPLETE
405,0.5853592753410339,2023-09-04 18:49:00.433828,2023-09-04 18:49:09.682577,0 days 00:00:09.248749,ReLU,ReLU,ReLU,ReLU,60,23,6.0,8.0,13.0,1.0415168405961e-05,4,270,0.7660333312066077,0.0013396950444678052,122.7288688659668,COMPLETE
406,0.8457579016685486,2023-09-04 18:49:09.682923,2023-09-04 18:49:11.945358,0 days 00:00:02.262435,ReLU,ReLU,Tanh,ReLU,66,21,7.0,9.0,14.0,1.2800255508296832e-05,4,283,0.17788353485707228,0.0007873384997624438,111.63008023319311,COMPLETE
407,0.30311116576194763,2023-09-04 18:49:11.945692,2023-09-04 18:49:13.194080,0 days 00:00:01.248388,ReLU,ReLU,Leaky,Tanh,69,23,6.0,10.0,14.0,0.0033660733616623826,4,265,0.7235564393642075,0.0009783161968414218,107.19642266994569,COMPLETE
408,0.2907814681529999,2023-09-04 18:49:13.194412,2023-09-04 18:49:17.473197,0 days 00:00:04.278785,ReLU,Sigmoid,ReLU,ReLU,61,23,8.0,8.0,15.0,0.0016164932968069092,4,277,0.7666219632921187,0.0002461587389401159,95.16099238201855,COMPLETE
409,0.3521660268306732,2023-09-04 18:49:17.473532,2023-09-04 18:49:20.007047,0 days 00:00:02.533515,ReLU,Sigmoid,ReLU,ReLU,61,22,12.0,8.0,15.0,0.0016361761759187844,4,274,0.7687882987705882,0.00038147741407590846,105.5309592352973,COMPLETE
410,0.3614419996738434,2023-09-04 18:49:20.007386,2023-09-04 18:49:22.156723,0 days 00:00:02.149337,ReLU,Sigmoid,ReLU,ReLU,58,23,10.0,9.0,15.0,0.0021765160117621853,4,291,0.29108250462319685,0.00027136728411549584,101.52609288533529,COMPLETE
411,0.38397178053855896,2023-09-04 18:49:22.157058,2023-09-04 18:49:22.854180,0 days 00:00:00.697122,ReLU,ReLU,ReLU,ReLU,56,23,8.0,8.0,21.0,0.07776527413217212,4,300,0.740241777586685,0.0004688430689062785,109.96168558221115,COMPLETE
412,1.0930840969085693,2023-09-04 18:49:22.854513,2023-09-04 18:49:23.419654,0 days 00:00:00.565141,ReLU,Sigmoid,ReLU,Tanh,64,23,7.0,7.0,14.0,0.03981367996124838,4,281,0.765416998010279,0.0783599243576422,101.2774424235026,COMPLETE
413,0.2802506983280182,2023-09-04 18:49:23.419991,2023-09-04 18:49:25.304745,0 days 00:00:01.884754,ReLU,ReLU,ReLU,Sigmoid,62,22,8.0,9.0,16.0,0.002778327005172285,4,269,0.7946368776861878,0.0002229939325567638,106.72743268282909,COMPLETE
414,0.31592610478401184,2023-09-04 18:49:25.305074,2023-09-04 18:49:29.398077,0 days 00:00:04.093003,ReLU,Sigmoid,ReLU,Sigmoid,61,21,8.0,10.0,16.0,0.0025555474199501446,4,271,0.7980649177569021,0.00022268225750574167,97.67614679169236,COMPLETE
415,0.3590259850025177,2023-09-04 18:49:29.398409,2023-09-04 18:49:32.017278,0 days 00:00:02.618869,ReLU,Sigmoid,ReLU,Sigmoid,59,22,9.0,9.0,16.0,0.003000496683091282,4,278,0.7990123481958697,0.0003281979386181639,110.06473410470146,COMPLETE
416,0.3201461136341095,2023-09-04 18:49:32.017614,2023-09-04 18:49:35.065036,0 days 00:00:03.047422,Sigmoid,ReLU,ReLU,Sigmoid,63,22,9.0,9.0,15.0,0.002051323218685269,4,264,0.7624273829503186,0.00027134924094935806,100.63358109720637,COMPLETE
417,0.37952470779418945,2023-09-04 18:49:35.065378,2023-09-04 18:49:38.544846,0 days 00:00:03.479468,ReLU,Sigmoid,ReLU,Tanh,62,21,8.0,10.0,13.0,0.0016124750170931007,4,292,0.799218812731206,0.000198467562203265,105.98418457654057,COMPLETE
418,0.31817933917045593,2023-09-04 18:49:38.545182,2023-09-04 18:49:40.494586,0 days 00:00:01.949404,ReLU,Sigmoid,ReLU,Tanh,65,22,7.0,11.0,14.0,0.0030781072878308586,4,270,0.7285681552716744,0.0006018307418362854,105.45563957339428,COMPLETE
419,0.3021280765533447,2023-09-04 18:49:40.494918,2023-09-04 18:49:42.387476,0 days 00:00:01.892558,ReLU,ReLU,ReLU,Sigmoid,67,22,5.0,8.0,16.0,0.002361884214274486,4,260,0.7621132895170192,0.0007355169810977181,123.24469123452397,COMPLETE
420,0.32657894492149353,2023-09-04 18:49:42.387843,2023-09-04 18:49:51.606817,0 days 00:00:09.218974,ReLU,ReLU,ReLU,ReLU,60,23,14.0,9.0,15.0,0.00018129047889933495,4,284,0.7131418869856796,0.0005359701432623116,104.86439839215346,COMPLETE
421,0.3129737377166748,2023-09-04 18:49:51.607175,2023-09-04 18:49:54.084387,0 days 00:00:02.477212,ReLU,ReLU,ReLU,Tanh,57,23,7.0,8.0,14.0,0.0018054972967991884,4,271,0.7425826040473478,0.0008544015580538573,97.38821787229726,COMPLETE
422,0.38509756326675415,2023-09-04 18:49:54.084737,2023-09-04 18:49:57.397963,0 days 00:00:03.313226,ReLU,ReLU,Sigmoid,ReLU,55,23,6.0,10.0,13.0,0.001473325218600071,4,262,0.24431493232555576,0.00037779228077106195,121.22223595578699,COMPLETE
423,0.32914942502975464,2023-09-04 18:49:57.398314,2023-09-04 18:49:58.935981,0 days 00:00:01.537667,ReLU,ReLU,ReLU,Tanh,50,22,8.0,9.0,15.0,0.002836896061373174,4,279,0.7995618895723061,0.0002389020070204212,98.41343583001031,COMPLETE
424,0.34001633524894714,2023-09-04 18:49:58.936345,2023-09-04 18:50:01.442438,0 days 00:00:02.506093,ReLU,Leaky,ReLU,Tanh,62,22,8.0,12.0,16.0,0.0021696836721737775,4,298,0.7584464256172163,0.0011767803625132305,87.31579244953312,COMPLETE
425,0.3222231864929199,2023-09-04 18:50:01.442769,2023-09-04 18:50:03.066806,0 days 00:00:01.624037,ReLU,ReLU,ReLU,ReLU,58,23,6.0,9.0,14.0,0.0032881852731010226,4,256,0.7161366527682511,0.0006613689049595585,91.82577374516701,COMPLETE
426,0.26326680183410645,2023-09-04 18:50:03.067156,2023-09-04 18:50:04.708399,0 days 00:00:01.641243,ReLU,ReLU,ReLU,Tanh,64,21,7.0,10.0,15.0,0.0015296100455011732,4,311,0.7631070756152559,0.00017966937962058,118.61402737364477,COMPLETE
427,0.30194470286369324,2023-09-04 18:50:04.708736,2023-09-04 18:50:05.696995,0 days 00:00:00.988259,ReLU,ReLU,ReLU,Leaky,64,21,7.0,10.0,15.0,0.022620216385496217,4,309,0.7331779388954788,0.0002900329675072427,114.44363733927409,COMPLETE
428,0.3615652024745941,2023-09-04 18:50:05.697338,2023-09-04 18:50:07.042183,0 days 00:00:01.344845,ReLU,ReLU,ReLU,Tanh,67,21,7.0,11.0,16.0,0.0019515056130934452,4,304,0.26277122672024633,0.00025570434753697645,113.70997318468596,COMPLETE
429,0.48749369382858276,2023-09-04 18:50:07.042524,2023-09-04 18:50:09.920252,0 days 00:00:02.877728,ReLU,ReLU,ReLU,Sigmoid,64,21,8.0,2.0,22.0,0.0012753255405088134,4,288,0.7107545506413504,0.0001900541453935029,147.297154550967,COMPLETE
430,0.31472018361091614,2023-09-04 18:50:09.920588,2023-09-04 18:50:11.802645,0 days 00:00:01.882057,ReLU,ReLU,ReLU,ReLU,61,21,7.0,7.0,20.0,0.0025362480019381784,4,310,0.7646854014934599,0.000459032679369801,93.71256880326705,COMPLETE
431,0.2862143814563751,2023-09-04 18:50:11.802987,2023-09-04 18:50:14.895854,0 days 00:00:03.092867,ReLU,Sigmoid,ReLU,Tanh,59,20,5.0,10.0,15.0,0.003577294713894878,4,294,0.7364738882385796,0.00020714418670305358,102.35475031534831,COMPLETE
432,0.30757972598075867,2023-09-04 18:50:14.896190,2023-09-04 18:50:17.032963,0 days 00:00:02.136773,ReLU,Sigmoid,ReLU,Tanh,59,20,6.0,10.0,15.0,0.0034313017234369214,4,276,0.7379284680654267,0.00020764401678747735,106.25411474509318,COMPLETE
433,0.2889675199985504,2023-09-04 18:50:17.033299,2023-09-04 18:50:18.846427,0 days 00:00:01.813128,ReLU,Sigmoid,ReLU,Tanh,60,22,5.0,11.0,16.0,0.0040406853006795555,4,287,0.7627141754899096,0.0001914378498312578,101.41121468177208,COMPLETE
434,0.38661128282546997,2023-09-04 18:50:18.846764,2023-09-04 18:50:20.757226,0 days 00:00:01.910462,ReLU,Sigmoid,ReLU,Tanh,56,22,5.0,11.0,16.0,0.004056240289202599,4,294,0.7154923489232289,0.00034611250133288827,111.56443277994792,COMPLETE
435,0.32957497239112854,2023-09-04 18:50:20.757567,2023-09-04 18:50:24.945661,0 days 00:00:04.188094,ReLU,Sigmoid,ReLU,Tanh,59,22,4.0,10.0,4.0,0.0036383378110309756,4,287,0.7418047747353009,0.00016262453086864342,119.3344536142901,COMPLETE
436,0.28998324275016785,2023-09-04 18:50:24.945996,2023-09-04 18:50:28.042860,0 days 00:00:03.096864,ReLU,Sigmoid,ReLU,Tanh,63,21,5.0,11.0,17.0,0.0041810983685095565,4,317,0.6983209560984116,0.00021650809345430115,117.33930480957031,COMPLETE
437,0.32020318508148193,2023-09-04 18:50:28.043206,2023-09-04 18:50:30.721086,0 days 00:00:02.677880,ReLU,Sigmoid,Leaky,Tanh,53,22,4.0,9.0,14.0,0.004900361318230344,4,267,0.7642019810754249,0.00014856212998323314,122.48297271728515,COMPLETE
438,0.4056445062160492,2023-09-04 18:50:30.721425,2023-09-04 18:50:31.775416,0 days 00:00:01.053991,ReLU,ReLU,ReLU,Tanh,66,20,5.0,13.0,15.0,0.003190851676580447,4,250,0.15188948071141214,0.005089400436413945,122.82273833605709,COMPLETE
439,0.3414869010448456,2023-09-04 18:50:31.775761,2023-09-04 18:50:33.906691,0 days 00:00:02.130930,ReLU,ReLU,Sigmoid,Tanh,71,22,6.0,10.0,16.0,0.0028876934422351727,4,296,0.7693660803765446,0.00017888682400897497,152.79851122869962,COMPLETE
440,0.47482311725616455,2023-09-04 18:50:33.907032,2023-09-04 18:50:35.191039,0 days 00:00:01.284007,ReLU,Sigmoid,Tanh,Tanh,58,23,5.0,10.0,14.0,0.0038201526005002466,4,112,0.2314049865411188,0.0009109028743559029,153.7754056794303,COMPLETE
441,0.33025848865509033,2023-09-04 18:50:35.191377,2023-09-04 18:50:36.814084,0 days 00:00:01.622707,ReLU,ReLU,ReLU,Tanh,62,22,7.0,12.0,13.0,0.0026411652562961393,4,286,0.73027747127394,0.0007301693619153726,95.34974685668945,COMPLETE
442,0.3221310079097748,2023-09-04 18:50:36.814420,2023-09-04 18:50:38.176654,0 days 00:00:01.362234,ReLU,ReLU,ReLU,Tanh,60,23,5.0,9.0,15.0,0.0044385206195466514,4,266,0.704601541084201,0.0005956298457969236,130.49342273530505,COMPLETE
443,0.27735936641693115,2023-09-04 18:50:38.176989,2023-09-04 18:50:39.555132,0 days 00:00:01.378143,ReLU,ReLU,ReLU,Tanh,64,21,6.0,11.0,14.0,0.0022566659803373757,4,252,0.7997574969577036,0.001343068757059897,93.39150824913612,COMPLETE
444,0.5422012209892273,2023-09-04 18:50:39.555470,2023-09-04 18:50:40.933445,0 days 00:00:01.377975,Sigmoid,ReLU,ReLU,Sigmoid,65,21,6.0,10.0,14.0,0.0023035940057263274,4,247,0.2023341898978623,0.001335327295118345,241.5370141447877,COMPLETE
445,0.35528767108917236,2023-09-04 18:50:40.933787,2023-09-04 18:50:41.905811,0 days 00:00:00.972024,ReLU,ReLU,ReLU,Tanh,68,21,7.0,9.0,13.0,0.002153025355522737,4,253,0.27808339855703523,0.0010788818039804667,120.40305154534835,COMPLETE
446,0.3244670331478119,2023-09-04 18:50:41.906157,2023-09-04 18:50:43.440105,0 days 00:00:01.533948,ReLU,ReLU,ReLU,ReLU,64,23,6.0,11.0,14.0,0.0027861015763487327,4,262,0.7687761826255326,0.0008392050396944875,85.18316268920898,COMPLETE
447,0.4412306845188141,2023-09-04 18:50:43.440440,2023-09-04 18:50:43.963332,0 days 00:00:00.522892,ReLU,ReLU,ReLU,Tanh,63,20,6.0,9.0,15.0,0.0018361536587476787,4,252,0.10401499629295072,0.001019575781877563,181.72289106580945,COMPLETE
448,0.3012734353542328,2023-09-04 18:50:43.963664,2023-09-04 18:50:46.552282,0 days 00:00:02.588618,ReLU,ReLU,ReLU,ReLU,54,21,7.0,10.0,14.0,0.0021350753043972493,4,239,0.6734199980479245,0.001234215203154347,102.88828886007961,COMPLETE
449,0.3282157778739929,2023-09-04 18:50:46.552618,2023-09-04 18:50:47.986931,0 days 00:00:01.434313,ReLU,ReLU,ReLU,Tanh,66,20,7.0,9.0,12.0,0.0024767690630992383,4,257,0.7964354203187356,0.02050625554722694,112.34647532871791,COMPLETE
450,0.546715497970581,2023-09-04 18:50:47.987260,2023-09-04 18:50:49.452523,0 days 00:00:01.465263,ReLU,,,,62,23,,,,0.00010926552760928935,1,269,0.1902726217546982,0.00048890840120394,227.5469961060024,COMPLETE
451,0.4281582534313202,2023-09-04 18:50:49.452831,2023-09-04 18:50:50.311399,0 days 00:00:00.858568,ReLU,ReLU,ReLU,Tanh,57,23,6.0,8.0,15.0,0.0019318113470186955,4,146,0.20946250632111035,0.0007117312418148642,181.3831923279581,COMPLETE
452,0.3354663550853729,2023-09-04 18:50:50.311734,2023-09-04 18:50:51.631291,0 days 00:00:01.319557,ReLU,ReLU,Sigmoid,ReLU,64,23,7.0,9.0,13.0,0.003128745516614221,4,246,0.2746254515919348,0.0009295715447776537,320.18464063248547,COMPLETE
453,0.6234946250915527,2023-09-04 18:50:51.631645,2023-09-04 18:50:52.127763,0 days 00:00:00.496118,ReLU,ReLU,ReLU,Sigmoid,62,22,3.0,10.0,21.0,0.085084569287827,4,261,0.7392613824355313,0.001372587332272132,156.70197405133928,COMPLETE
454,0.461040198802948,2023-09-04 18:50:52.128093,2023-09-04 18:51:01.993111,0 days 00:00:09.865018,ReLU,ReLU,ReLU,Tanh,60,24,8.0,9.0,18.0,2.0967462852014973e-05,4,276,0.7979809999618843,0.0007873306936119865,134.54729400855908,COMPLETE
455,0.335304856300354,2023-09-04 18:51:01.993446,2023-09-04 18:51:03.859512,0 days 00:00:01.866066,ReLU,ReLU,ReLU,Leaky,55,21,4.0,10.0,14.0,0.0024777682711715847,4,251,0.7096481648249561,0.0003895703968829419,117.88585704456676,COMPLETE
456,0.324215292930603,2023-09-04 18:51:03.859850,2023-09-04 18:51:06.372672,0 days 00:00:02.512822,ReLU,ReLU,ReLU,ReLU,51,20,6.0,8.0,17.0,0.0015964744826900063,4,241,0.7422186849115487,0.0006516936398624503,110.81465763832206,COMPLETE
457,0.2800823748111725,2023-09-04 18:51:06.373008,2023-09-04 18:51:07.892170,0 days 00:00:01.519162,ReLU,ReLU,ReLU,Tanh,69,23,7.0,9.0,14.0,0.002210140318980913,4,273,0.762998411919666,0.0005649500492739259,100.70858494440715,COMPLETE
458,0.3083774149417877,2023-09-04 18:51:07.892508,2023-09-04 18:51:10.111205,0 days 00:00:02.218697,ReLU,ReLU,ReLU,Tanh,70,22,9.0,10.0,15.0,0.003069445397928344,4,270,0.7718539343156049,0.000526976705683807,83.81118097439618,COMPLETE
459,0.30383726954460144,2023-09-04 18:51:10.111532,2023-09-04 18:51:12.003794,0 days 00:00:01.892262,ReLU,Leaky,ReLU,ReLU,69,23,7.0,11.0,16.0,0.0022905101319087465,4,281,0.7997239702553706,0.0004145631678673571,103.91549564230031,COMPLETE
460,0.311252623796463,2023-09-04 18:51:12.004118,2023-09-04 18:51:13.265085,0 days 00:00:01.260967,ReLU,ReLU,ReLU,Tanh,66,22,7.0,9.0,13.0,0.0027147150831362795,4,273,0.6780542353817945,0.00010376702699405689,102.27289261928824,COMPLETE
461,0.611072838306427,2023-09-04 18:51:13.265418,2023-09-04 18:51:21.695150,0 days 00:00:08.429732,ReLU,ReLU,ReLU,ReLU,59,1,8.0,8.0,14.0,4.63387477157547e-05,4,263,0.7099385939936939,0.0005362201268758577,149.91532857336472,COMPLETE
462,0.3469589948654175,2023-09-04 18:51:21.695495,2023-09-04 18:51:23.345397,0 days 00:00:01.649902,ReLU,ReLU,Leaky,Sigmoid,74,23,10.0,9.0,15.0,0.001810017659629411,4,282,0.2865289305095516,0.00034342997246334533,106.12668863932292,COMPLETE
463,0.35969629883766174,2023-09-04 18:51:23.345732,2023-09-04 18:51:24.279117,0 days 00:00:00.933385,ReLU,ReLU,ReLU,Tanh,56,23,7.0,10.0,14.0,0.029942918032240196,4,266,0.79972979832331,0.00030583413941741007,106.05942662556966,COMPLETE
464,0.28787657618522644,2023-09-04 18:51:24.279449,2023-09-04 18:51:26.132719,0 days 00:00:01.853270,ReLU,ReLU,Tanh,ReLU,62,23,6.0,10.0,23.0,0.0035366757970420777,4,294,0.7688566020324087,0.0014211196263268628,108.590333726671,COMPLETE
465,0.4266393184661865,2023-09-04 18:51:26.133051,2023-09-04 18:51:27.750032,0 days 00:00:01.616981,Sigmoid,ReLU,Tanh,ReLU,63,22,6.0,12.0,24.0,0.004826547204987449,4,304,0.3323957622820632,0.0014124495961479527,124.88693400791713,COMPLETE
466,0.3178258538246155,2023-09-04 18:51:27.750380,2023-09-04 18:51:29.193101,0 days 00:00:01.442721,ReLU,ReLU,Tanh,ReLU,68,22,6.0,11.0,22.0,0.003557421643388329,4,296,0.7733969017343751,0.0001291549719326349,103.84239756266275,COMPLETE
467,0.3139006793498993,2023-09-04 18:51:29.193446,2023-09-04 18:51:32.223682,0 days 00:00:03.030236,ReLU,ReLU,Tanh,ReLU,61,21,6.0,10.0,16.0,0.0033555786121840098,4,295,0.7668876449164224,0.0006053953576805148,96.46519204073174,COMPLETE
468,0.5004540681838989,2023-09-04 18:51:32.224016,2023-09-04 18:51:32.597980,0 days 00:00:00.373964,ReLU,ReLU,Tanh,ReLU,65,23,6.0,10.0,23.0,0.06461596023546051,4,315,0.3018428074773497,0.0004482652555610603,119.78539642333985,COMPLETE
469,0.4253465533256531,2023-09-04 18:51:32.598309,2023-09-04 18:51:33.659904,0 days 00:00:01.061595,ReLU,ReLU,Sigmoid,ReLU,57,23,8.0,11.0,19.0,0.05524248246859713,4,287,0.7424383550143014,0.001216125644808853,126.01529337565104,COMPLETE
470,0.3655967712402344,2023-09-04 18:51:33.660239,2023-09-04 18:51:34.419297,0 days 00:00:00.759058,ReLU,ReLU,ReLU,ReLU,61,22,7.0,10.0,15.0,0.0027733636224276086,4,279,0.18466997979143152,0.001469662418984846,117.10373445398668,COMPLETE
