number,value,datetime_start,datetime_complete,duration,params_activation1,params_activation2,params_activation3,params_activation4,params_batch_size,params_fl1,params_fl2,params_fl3,params_fl4,params_learning_rate,params_n_layers,params_num_epochs,params_train_size,params_weight_decay,user_attrs_mre,state
373,0.35684192180633545,2023-09-04 18:27:32.793520,2023-09-04 18:27:37.299232,0 days 00:00:04.505712,Leaky,ReLU,ReLU,Leaky,14,23,20.0,23.0,17.0,0.0015330854301269855,4,233,0.7641957146603849,0.0003173068920648703,146.48563429888557,COMPLETE
374,0.43086186051368713,2023-09-04 18:27:37.299601,2023-09-04 18:27:38.328921,0 days 00:00:01.029320,Leaky,ReLU,ReLU,Leaky,15,23,20.0,24.0,16.0,0.0019549256295767216,4,255,0.13725001414497426,0.0003585120582335677,120.28283558721128,COMPLETE
375,0.5605894923210144,2023-09-04 18:27:38.329268,2023-09-04 18:27:45.622843,0 days 00:00:07.293575,Leaky,ReLU,ReLU,Leaky,12,24,19.0,22.0,17.0,0.002306511011375478,4,245,0.20432878032460605,0.023394580892448,184.76912256876628,COMPLETE
376,0.9969518184661865,2023-09-04 18:27:45.623181,2023-09-04 18:27:49.929942,0 days 00:00:04.306761,Leaky,ReLU,ReLU,Leaky,15,20,19.0,23.0,18.0,0.0020265564953543956,4,115,0.7991853131891927,0.07581016803772402,100.97501490666316,COMPLETE
377,0.3939773440361023,2023-09-04 18:27:49.930338,2023-09-04 18:27:52.642648,0 days 00:00:02.712310,Leaky,ReLU,ReLU,Leaky,12,23,20.0,5.0,14.0,0.0013139733549062441,4,258,0.16161301226845362,0.00137307437654108,216.3487670204856,COMPLETE
378,0.3245284855365753,2023-09-04 18:27:52.643046,2023-09-04 18:27:56.010768,0 days 00:00:03.367722,Leaky,ReLU,ReLU,Tanh,16,21,21.0,12.0,21.0,0.0026471325085144215,4,222,0.7425374317310313,0.000872891546673551,227.59483337402344,COMPLETE
379,0.35678744316101074,2023-09-04 18:27:56.011111,2023-09-04 18:28:02.008853,0 days 00:00:05.997742,Sigmoid,ReLU,Leaky,Leaky,14,22,20.0,22.0,19.0,0.003842375508541405,4,261,0.296810171987063,0.00026110904215739567,155.69111730697307,COMPLETE
380,0.3296206593513489,2023-09-04 18:28:02.009199,2023-09-04 18:28:08.140776,0 days 00:00:06.131577,Leaky,ReLU,ReLU,ReLU,10,22,22.0,24.0,15.0,0.0028069443601462483,4,250,0.7684105624332489,0.0015874537762688317,212.68232776272683,COMPLETE
381,0.398255318403244,2023-09-04 18:28:08.141137,2023-09-04 18:28:09.897081,0 days 00:00:01.755944,Leaky,ReLU,ReLU,Tanh,16,21,21.0,17.0,22.0,0.001678494852482665,4,240,0.2538814168209714,0.0004452227646429105,317.0677859284157,COMPLETE
382,0.4504757523536682,2023-09-04 18:28:09.897455,2023-09-04 18:28:37.632050,0 days 00:00:27.734595,Leaky,ReLU,ReLU,,13,23,22.0,3.0,,8.444634545722601e-05,3,264,0.7307159882573343,0.0010757642110943036,198.53206102775806,COMPLETE
383,0.3360394239425659,2023-09-04 18:28:37.632395,2023-09-04 18:28:43.328399,0 days 00:00:05.696004,Leaky,ReLU,Leaky,Leaky,17,24,21.0,23.0,16.0,0.002328890742673678,4,255,0.7999053960651905,0.0005321965629055027,149.3867794672648,COMPLETE
384,0.28667545318603516,2023-09-04 18:28:43.328739,2023-09-04 18:28:52.126981,0 days 00:00:08.798242,Leaky,ReLU,ReLU,Sigmoid,14,22,22.0,20.0,20.0,0.003450204004527733,4,184,0.7612671321301443,0.0007517741877133676,251.36698091947116,COMPLETE
385,0.35235434770584106,2023-09-04 18:28:52.127310,2023-09-04 18:29:18.124642,0 days 00:00:25.997332,Leaky,ReLU,ReLU,Sigmoid,12,21,21.0,20.0,20.0,0.0004136239756030633,4,183,0.7473014508704294,0.003045197832769778,175.1599685755153,COMPLETE
386,0.3693787157535553,2023-09-04 18:29:18.125000,2023-09-04 18:29:25.083934,0 days 00:00:06.958934,Leaky,ReLU,ReLU,Sigmoid,14,9,22.0,23.0,23.0,0.00500729525106416,4,268,0.7999328329326041,0.0012768869460250323,415.3809955073338,COMPLETE
387,0.3501618206501007,2023-09-04 18:29:25.084273,2023-09-04 18:29:32.453575,0 days 00:00:07.369302,Leaky,ReLU,Leaky,Leaky,11,23,8.0,24.0,19.0,0.003535873626621053,4,167,0.7119917381288017,0.0019483895221128972,585.3710676339956,COMPLETE
388,0.34417960047721863,2023-09-04 18:29:32.453950,2023-09-04 18:29:37.431330,0 days 00:00:04.977380,Leaky,ReLU,ReLU,Sigmoid,15,22,22.0,5.0,20.0,0.004274615311149181,4,232,0.7664084311942592,0.00040101840459190734,242.3506526503452,COMPLETE
389,0.3446047008037567,2023-09-04 18:29:37.431673,2023-09-04 18:29:40.570161,0 days 00:00:03.138488,Tanh,ReLU,ReLU,Sigmoid,13,20,22.0,22.0,21.0,0.00599949648995493,4,191,0.28426002981100545,0.0009391534646341635,147.96503300820626,COMPLETE
390,0.3232385218143463,2023-09-04 18:29:40.570516,2023-09-04 18:29:44.284176,0 days 00:00:03.713660,Leaky,Tanh,ReLU,Tanh,15,21,20.0,21.0,24.0,0.003055429791434385,4,151,0.6840360834803785,0.000195170617094094,178.59907616509332,COMPLETE
391,0.42014679312705994,2023-09-04 18:29:44.284749,2023-09-04 18:29:55.433217,0 days 00:00:11.148468,Leaky,ReLU,Leaky,Sigmoid,10,23,2.0,24.0,18.0,0.0041756256745601955,4,309,0.7298108741485557,0.0007003721727943206,176.9781494140625,COMPLETE
392,0.3757065236568451,2023-09-04 18:29:55.433830,2023-09-04 18:30:04.946609,0 days 00:00:09.512779,Leaky,ReLU,ReLU,Leaky,17,14,22.0,23.0,21.0,0.005224973167118063,4,204,0.7645143690202623,0.0002983619036848196,166.41004782012016,COMPLETE
393,0.4004075825214386,2023-09-04 18:30:04.946976,2023-09-04 18:30:07.334355,0 days 00:00:02.387379,Leaky,ReLU,Sigmoid,Sigmoid,13,22,18.0,22.0,20.0,0.003388457700658097,4,276,0.19417546126491464,0.00049103319108019,1646.4244315993617,COMPLETE
394,0.3747524619102478,2023-09-04 18:30:07.334694,2023-09-04 18:30:14.407045,0 days 00:00:07.072351,Leaky,,,,15,23,,,,0.0009579709127304177,1,260,0.7682790832937773,0.00022394552639316346,397.35282519739917,COMPLETE
395,0.3167715072631836,2023-09-04 18:30:14.407389,2023-09-04 18:30:21.769989,0 days 00:00:07.362600,Leaky,ReLU,ReLU,Sigmoid,12,22,19.0,20.0,23.0,0.006933964582299902,4,250,0.7217634759782825,0.0005994473760148277,199.02449078030057,COMPLETE
396,0.7754674553871155,2023-09-04 18:30:21.770580,2023-09-04 18:30:23.001124,0 days 00:00:01.230544,Leaky,ReLU,Tanh,Sigmoid,11,22,19.0,20.0,24.0,0.09074913728587662,4,266,0.31265441406125827,0.0006522611564394793,149.86724736140326,COMPLETE
397,0.33198919892311096,2023-09-04 18:30:23.001490,2023-09-04 18:30:29.820076,0 days 00:00:06.818586,Leaky,ReLU,ReLU,Sigmoid,12,20,20.0,20.0,22.0,0.007335126278739953,4,301,0.6863411649009867,0.0008483030280943345,189.3494362464318,COMPLETE
398,0.3329012095928192,2023-09-04 18:30:29.820414,2023-09-04 18:30:40.624032,0 days 00:00:10.803618,Leaky,ReLU,Leaky,Sigmoid,10,21,23.0,19.0,20.0,0.001971714782097368,4,102,0.7194723947725329,0.0005750005853010139,213.97638571602957,COMPLETE
399,0.3280239701271057,2023-09-04 18:30:40.624372,2023-09-04 18:30:44.687087,0 days 00:00:04.062715,Leaky,ReLU,ReLU,Sigmoid,17,22,19.0,18.0,19.0,0.006666798805311707,4,275,0.7345438595502368,0.0007388869592963014,182.63410242592417,COMPLETE
400,0.3305054008960724,2023-09-04 18:30:44.687427,2023-09-04 18:30:55.562651,0 days 00:00:10.875224,Leaky,ReLU,ReLU,Sigmoid,13,21,23.0,21.0,22.0,0.001567567327687646,4,251,0.7990634303517975,0.0010210582191228364,123.56625698774289,COMPLETE
401,0.366353303194046,2023-09-04 18:30:55.563012,2023-09-04 18:31:00.090526,0 days 00:00:04.527514,Leaky,ReLU,ReLU,Sigmoid,16,22,22.0,10.0,23.0,0.0027994322582922436,4,259,0.6721218310736969,0.001603841337629818,215.34804121653238,COMPLETE
402,0.3454314172267914,2023-09-04 18:31:00.090882,2023-09-04 18:31:09.697684,0 days 00:00:09.606802,Sigmoid,ReLU,Leaky,Tanh,18,22,23.0,20.0,17.0,0.0023525528879133795,4,295,0.7093257019571567,0.0005792030120573026,204.6767593383789,COMPLETE
403,0.3506302237510681,2023-09-04 18:31:09.698041,2023-09-04 18:31:14.775167,0 days 00:00:05.077126,Leaky,ReLU,ReLU,Sigmoid,12,21,24.0,19.0,21.0,0.003523618409228646,4,159,0.7455671373918765,0.0011374039823767944,163.16984078543527,COMPLETE
404,0.33323565125465393,2023-09-04 18:31:14.775522,2023-09-04 18:31:16.803200,0 days 00:00:02.027678,Leaky,ReLU,ReLU,,15,21,22.0,21.0,,0.004212125188408182,3,285,0.32409291706410637,4.2685003444672365e-05,173.5321226119995,COMPLETE
405,0.3696114122867584,2023-09-04 18:31:16.803562,2023-09-04 18:31:17.571404,0 days 00:00:00.767842,Leaky,ReLU,ReLU,Sigmoid,56,22,23.0,22.0,23.0,0.007953661456893468,4,268,0.2811532767190934,0.0008025952376396239,333.6360617244945,COMPLETE
406,0.321485698223114,2023-09-04 18:31:17.571769,2023-09-04 18:31:25.274145,0 days 00:00:07.702376,Leaky,ReLU,Leaky,Sigmoid,14,18,21.0,19.0,10.0,0.0014463347163947463,4,134,0.7497352352835571,0.00047930028067712856,966.3690509218159,COMPLETE
407,0.37038329243659973,2023-09-04 18:31:25.274496,2023-09-04 18:31:33.055340,0 days 00:00:07.780844,Leaky,ReLU,ReLU,ReLU,18,22,24.0,24.0,20.0,0.0006769465626960554,4,238,0.772149139325554,0.0006306815798993214,160.99242948874448,COMPLETE
408,0.592540979385376,2023-09-04 18:31:33.055710,2023-09-04 18:31:36.327545,0 days 00:00:03.271835,Leaky,ReLU,ReLU,Sigmoid,11,2,23.0,20.0,21.0,0.0019065068195214733,4,275,0.7107699065288599,0.0009175132377806981,459.69855134383494,COMPLETE
409,0.6278772354125977,2023-09-04 18:31:36.327913,2023-09-04 18:32:02.369983,0 days 00:00:26.042070,Leaky,ReLU,ReLU,Sigmoid,16,21,22.0,22.0,22.0,1.0983695521673341e-05,4,254,0.7412744938439445,0.0023316931280314476,182.80971827469472,COMPLETE
410,0.3432229161262512,2023-09-04 18:32:02.370363,2023-09-04 18:32:09.454517,0 days 00:00:07.084154,Leaky,ReLU,Sigmoid,Tanh,12,22,23.0,21.0,24.0,0.0030157208572271508,4,262,0.7996116258995177,0.0012014677611668148,179.87577689962185,COMPLETE
411,0.3950708210468292,2023-09-04 18:32:09.454872,2023-09-04 18:32:18.558158,0 days 00:00:09.103286,Leaky,ReLU,Leaky,Sigmoid,13,20,22.0,24.0,13.0,0.005985563722337567,4,177,0.7682100491625019,0.0050389336176031065,160.87436866760254,COMPLETE
412,0.32396820187568665,2023-09-04 18:32:18.558515,2023-09-04 18:32:24.029450,0 days 00:00:05.470935,Tanh,Tanh,ReLU,Sigmoid,17,23,24.0,23.0,22.0,0.0024302411334470742,4,290,0.7994223158829187,0.0007480143890551931,401.6970733642578,COMPLETE
413,0.34631413221359253,2023-09-04 18:32:24.029798,2023-09-04 18:32:38.784904,0 days 00:00:14.755106,Leaky,ReLU,ReLU,Sigmoid,10,19,21.0,22.0,21.0,0.001171176095977551,4,215,0.644304960000888,0.0014769681011890493,192.3588974141629,COMPLETE
414,0.3280107080936432,2023-09-04 18:32:38.785258,2023-09-04 18:32:44.772895,0 days 00:00:05.987637,Leaky,ReLU,,,14,22,23.0,,,0.003828229121723681,2,244,0.6787647550995459,0.0003975588005669272,166.49611654399354,COMPLETE
415,0.3574923872947693,2023-09-04 18:32:44.773236,2023-09-04 18:32:46.067486,0 days 00:00:01.294250,Leaky,Leaky,Tanh,Tanh,16,21,23.0,13.0,23.0,0.004807006639910023,4,277,0.26322823141760676,0.0005366156219495996,293.4774627685547,COMPLETE
416,0.3642679452896118,2023-09-04 18:32:46.067852,2023-09-04 18:32:49.573963,0 days 00:00:03.506111,Leaky,ReLU,ReLU,Sigmoid,14,24,22.0,7.0,19.0,0.003058837306919543,4,266,0.345651700404411,1.0693902104664419e-05,273.5385727882385,COMPLETE
417,0.38743528723716736,2023-09-04 18:32:49.574331,2023-09-04 18:32:51.199937,0 days 00:00:01.625606,Leaky,ReLU,,,17,20,24.0,,,0.0021289418374469482,2,254,0.2342900337595474,0.0009688176260210343,158.69661137829087,COMPLETE
418,0.3842962384223938,2023-09-04 18:32:51.200281,2023-09-04 18:33:20.058277,0 days 00:00:28.857996,Leaky,ReLU,Leaky,Sigmoid,18,23,20.0,21.0,24.0,0.00026312958951715424,4,284,0.7170565302327826,0.0042406488564113035,167.31902796785596,COMPLETE
419,0.3308882415294647,2023-09-04 18:33:20.058617,2023-09-04 18:33:22.274359,0 days 00:00:02.215742,Leaky,ReLU,ReLU,,19,22,22.0,23.0,,0.006829614726082445,3,272,0.7468689631836557,0.0006723625425316296,143.6481478554862,COMPLETE
420,0.33501243591308594,2023-09-04 18:33:22.274702,2023-09-04 18:33:29.388273,0 days 00:00:07.113571,Leaky,ReLU,ReLU,Sigmoid,12,21,23.0,24.0,18.0,0.0035189529902096197,4,246,0.7994627193051919,0.0013448949338317267,500.1055161496426,COMPLETE
421,0.4018259644508362,2023-09-04 18:33:29.388624,2023-09-04 18:33:34.049467,0 days 00:00:04.660843,ReLU,ReLU,,,15,6,21.0,,,0.0026206977931662895,2,260,0.35280046075930027,0.000819512204233575,352.76497206577034,COMPLETE
422,0.3232993483543396,2023-09-04 18:33:34.049788,2023-09-04 18:33:41.513460,0 days 00:00:07.463672,Leaky,ReLU,ReLU,Sigmoid,10,23,24.0,23.0,23.0,0.00436686576563588,4,229,0.7656898468032142,0.0004464805913017689,134.00168991088867,COMPLETE
423,0.32690921425819397,2023-09-04 18:33:41.513803,2023-09-04 18:33:47.295894,0 days 00:00:05.782091,Leaky,ReLU,Leaky,Tanh,13,22,23.0,22.0,16.0,0.005259469050495705,4,269,0.6895259794580989,0.0010993449971114012,188.0368113615075,COMPLETE
424,0.30930060148239136,2023-09-04 18:33:47.296249,2023-09-04 18:34:02.539448,0 days 00:00:15.243199,Leaky,ReLU,ReLU,Leaky,15,21,18.0,23.0,17.0,0.0008137381236762533,4,291,0.7291693199814734,0.0005755014971863594,173.41857739029643,COMPLETE
425,0.3629753887653351,2023-09-04 18:34:02.539820,2023-09-04 18:34:08.814590,0 days 00:00:06.274770,Leaky,ReLU,,,19,21,17.0,,,0.0011259206310782418,2,306,0.7688447219569569,0.006767864471278477,174.82695941535795,COMPLETE
426,0.3929539918899536,2023-09-04 18:34:08.814938,2023-09-04 18:34:18.995814,0 days 00:00:10.180876,Leaky,ReLU,ReLU,Leaky,16,19,22.0,24.0,17.0,0.0008717632833320706,4,316,0.7447253581835915,0.0104224783903109,233.37812371687457,COMPLETE
427,0.5454321503639221,2023-09-04 18:34:18.996203,2023-09-04 18:34:22.473566,0 days 00:00:03.477363,Sigmoid,ReLU,ReLU,Leaky,18,20,23.0,23.0,17.0,0.0005405411871218562,4,299,0.12085322912150083,0.0019546680106566623,225.53565265821373,COMPLETE
428,0.391012966632843,2023-09-04 18:34:22.473926,2023-09-04 18:34:24.431372,0 days 00:00:01.957446,Leaky,ReLU,Leaky,Leaky,15,20,16.0,23.0,18.0,0.001878771105752326,4,293,0.22518250624532538,0.0005052926233298111,167.9439239501953,COMPLETE
429,0.3418320417404175,2023-09-04 18:34:24.431810,2023-09-04 18:34:27.755736,0 days 00:00:03.323926,Leaky,ReLU,,,45,21,22.0,,,0.002681209664340438,2,288,0.7043492470374307,0.0007424020798730622,160.85094584893744,COMPLETE
430,0.3365551233291626,2023-09-04 18:34:27.756082,2023-09-04 18:34:38.243239,0 days 00:00:10.487157,Leaky,ReLU,ReLU,Leaky,17,21,18.0,24.0,20.0,0.0009634124258700919,4,279,0.6265181931517633,0.0009176749252194632,8404.713755289713,COMPLETE
431,0.33331024646759033,2023-09-04 18:34:38.243599,2023-09-04 18:34:48.726381,0 days 00:00:10.482782,Leaky,ReLU,,,15,21,23.0,,,0.0008312431520458769,2,286,0.7705860070892404,0.00037359272216971103,232.49139768685868,COMPLETE
432,0.9833800196647644,2023-09-04 18:34:48.726708,2023-09-04 18:34:51.649477,0 days 00:00:02.922769,Leaky,ReLU,ReLU,Leaky,20,15,24.0,23.0,15.0,0.0007651889421830165,4,298,0.7353858662875192,0.0388199865650341,100.0746394190295,COMPLETE
433,0.33532342314720154,2023-09-04 18:34:51.649867,2023-09-04 18:35:03.411492,0 days 00:00:11.761625,Leaky,Tanh,Leaky,Leaky,14,22,22.0,22.0,16.0,0.0005838158695059935,4,279,0.7992108733542622,0.0013635709472133376,140.12460416428587,COMPLETE
434,0.3560718595981598,2023-09-04 18:35:03.411840,2023-09-04 18:35:04.599922,0 days 00:00:01.188082,Leaky,ReLU,,,91,20,23.0,,,0.0033053902134839,2,199,0.3353696857391346,0.0005804523888227898,205.2922337229659,COMPLETE
435,0.34470683336257935,2023-09-04 18:35:04.600253,2023-09-04 18:35:10.261779,0 days 00:00:05.661526,Leaky,ReLU,ReLU,ReLU,18,23,21.0,24.0,19.0,0.001608666170194939,4,270,0.4409504201709017,0.0002879431396066545,143.51689756238784,COMPLETE
436,0.3942487835884094,2023-09-04 18:35:10.262123,2023-09-04 18:35:15.022153,0 days 00:00:04.760030,Leaky,ReLU,ReLU,Leaky,14,24,22.0,22.0,17.0,0.0014010703193346216,4,262,0.2966629351697438,0.0010524597101325475,174.18347231547037,COMPLETE
437,0.34782078862190247,2023-09-04 18:35:15.022502,2023-09-04 18:35:36.107699,0 days 00:00:21.085197,Leaky,Leaky,Sigmoid,Tanh,19,8,24.0,23.0,21.0,0.002099022696286576,4,293,0.7682576438876821,0.000712994190549548,166.13792538930136,COMPLETE
438,0.3331263065338135,2023-09-04 18:35:36.108343,2023-09-04 18:35:49.596901,0 days 00:00:13.488558,Leaky,ReLU,,,16,21,23.0,,,0.003849555728981376,2,279,0.7285283143005785,1.4466438774186037e-05,276.55139480098603,COMPLETE
439,0.3198014497756958,2023-09-04 18:35:49.597503,2023-09-04 18:35:57.279460,0 days 00:00:07.681957,Tanh,ReLU,ReLU,Leaky,22,22,24.0,22.0,22.0,0.0024665409311349002,4,309,0.6586193436488763,2.0611364846042764e-05,1795.103853113511,COMPLETE
440,0.9472480416297913,2023-09-04 18:35:57.280101,2023-09-04 18:36:06.246290,0 days 00:00:08.966189,Leaky,ReLU,Leaky,Sigmoid,16,23,23.0,21.0,18.0,0.002935163728178342,4,270,0.6939237189464409,0.0975813601285725,114.1166499211238,COMPLETE
441,0.4018051326274872,2023-09-04 18:36:06.246949,2023-09-04 18:37:28.080171,0 days 00:01:21.833222,Leaky,ReLU,,,12,21,21.0,,,5.74454263150961e-05,2,285,0.7434833695239746,2.592355443392505e-05,203.1578718218887,COMPLETE
442,0.3836827576160431,2023-09-04 18:37:28.080751,2023-09-04 18:37:35.251024,0 days 00:00:07.170273,Leaky,ReLU,ReLU,Leaky,13,22,22.0,24.0,6.0,0.004293082769804187,4,257,0.25044732397737984,0.001772435534344468,145.48059052112055,COMPLETE
443,0.3186161518096924,2023-09-04 18:37:35.251637,2023-09-04 18:37:49.294966,0 days 00:00:14.043329,Leaky,ReLU,Tanh,Sigmoid,17,23,24.0,23.0,21.0,0.0033862074168185966,4,275,0.7997855862231709,0.00040105174791774833,148.898525326751,COMPLETE
444,0.3395042419433594,2023-09-04 18:37:49.295581,2023-09-04 18:38:11.002564,0 days 00:00:21.706983,Leaky,ReLU,ReLU,Tanh,49,20,22.0,21.0,20.0,0.0007150840270904243,4,265,0.7614971629891485,0.0008571475042980498,238.93806870778403,COMPLETE
445,0.39775291085243225,2023-09-04 18:38:11.003160,2023-09-04 18:38:14.449852,0 days 00:00:03.446692,ReLU,ReLU,,,20,22,23.0,,,0.0018228710633140012,2,240,0.11440453828175177,0.00023621961312679784,118.069154178395,COMPLETE
446,0.39127013087272644,2023-09-04 18:38:14.450432,2023-09-04 18:38:24.082084,0 days 00:00:09.631652,Leaky,ReLU,ReLU,Sigmoid,15,24,23.0,11.0,21.0,0.0024216846328173696,4,286,0.18321237910063487,0.00018834127583473214,203.82772153966567,COMPLETE
447,0.33387964963912964,2023-09-04 18:38:24.082747,2023-09-04 18:38:31.845878,0 days 00:00:07.763131,Leaky,ReLU,Leaky,Leaky,10,21,24.0,15.0,22.0,0.004699817625067668,4,258,0.7155883758935605,1.727840928798546e-05,156.6144035093246,COMPLETE
448,0.3762783706188202,2023-09-04 18:38:31.846230,2023-09-04 18:38:41.196481,0 days 00:00:09.350251,Leaky,ReLU,,,18,23,22.0,,,0.00028612126132814144,2,277,0.3824734499907234,0.0011895969032389927,259.11622713274903,COMPLETE
449,0.3949660360813141,2023-09-04 18:38:41.196814,2023-09-04 18:38:44.129510,0 days 00:00:02.932696,Leaky,ReLU,ReLU,Sigmoid,13,22,20.0,23.0,17.0,0.0037312166951425476,4,299,0.31786071447387465,0.0004800837843464757,577.7361755371094,COMPLETE
450,0.33345305919647217,2023-09-04 18:38:44.129886,2023-09-04 18:38:54.767878,0 days 00:00:10.637992,Leaky,ReLU,ReLU,Sigmoid,16,21,23.0,22.0,20.0,0.0010869533228953293,4,252,0.7689583746931785,0.0006159125466325359,182.62198696341565,COMPLETE
451,0.3878682553768158,2023-09-04 18:38:54.768306,2023-09-04 18:39:01.716790,0 days 00:00:06.948484,Sigmoid,ReLU,ReLU,Leaky,21,22,21.0,10.0,19.0,0.002828583741904922,4,266,0.5704029857802599,0.000912471390964683,210.04514356591235,COMPLETE
452,0.4896250367164612,2023-09-04 18:39:01.717183,2023-09-04 18:39:03.088903,0 days 00:00:01.371720,Leaky,ReLU,,,14,21,18.0,,,0.043915746689435965,2,290,0.5001243609721308,0.0003490355454072731,487.15934614701706,COMPLETE
453,0.3342870771884918,2023-09-04 18:39:03.089352,2023-09-04 18:39:10.959001,0 days 00:00:07.869649,Leaky,ReLU,Leaky,ReLU,11,23,22.0,24.0,22.0,0.0013779593802951786,4,276,0.6120921210462764,0.0007158495392846961,239.205613992982,COMPLETE
454,0.5440277457237244,2023-09-04 18:39:10.959391,2023-09-04 18:39:18.808701,0 days 00:00:07.849310,Leaky,,,,18,22,,,,0.0004818333838289457,1,237,0.7443291465617938,0.023820651667191987,215.57669576009116,COMPLETE
455,0.3888528347015381,2023-09-04 18:39:18.809076,2023-09-04 18:39:32.006796,0 days 00:00:13.197720,Leaky,ReLU,ReLU,Sigmoid,16,23,24.0,22.0,18.0,0.0005994014594135792,4,262,0.38768709397990725,0.0028825188672676576,388.5782238006592,COMPLETE
456,0.34019964933395386,2023-09-04 18:39:32.007230,2023-09-04 18:39:38.533255,0 days 00:00:06.526025,Leaky,ReLU,ReLU,Tanh,12,21,23.0,23.0,24.0,0.002207222178772709,4,247,0.48236347765546767,0.0015194949698683015,211.33173155784607,COMPLETE
457,0.32548052072525024,2023-09-04 18:39:38.533655,2023-09-04 18:39:44.870374,0 days 00:00:06.336719,Leaky,ReLU,,,14,24,22.0,,,0.0030990481833345217,2,270,0.7994269134332992,9.013593965714092e-05,153.29789447784424,COMPLETE
458,0.3447503447532654,2023-09-04 18:39:44.870867,2023-09-04 18:39:48.761410,0 days 00:00:03.890543,Leaky,ReLU,ReLU,Sigmoid,18,20,23.0,23.0,16.0,0.005819961967617181,4,256,0.6699343485536496,0.0005294121912524156,226.8700139899003,COMPLETE
459,0.39570480585098267,2023-09-04 18:39:48.761819,2023-09-04 18:39:50.469509,0 days 00:00:01.707690,Leaky,ReLU,Leaky,Leaky,20,5,21.0,21.0,23.0,0.009404795550030227,4,283,0.4696814969632169,0.0008168618861928787,227.81275098077182,COMPLETE
460,0.3389520049095154,2023-09-04 18:39:50.470065,2023-09-04 18:39:55.576053,0 days 00:00:05.105988,Leaky,Leaky,ReLU,Sigmoid,15,22,22.0,16.0,21.0,0.004017865357302798,4,305,0.7146338637692505,0.0002668392301806209,234.0061772664388,COMPLETE
461,0.34838271141052246,2023-09-04 18:39:55.576502,2023-09-04 18:40:07.250314,0 days 00:00:11.673812,Tanh,ReLU,,,12,22,23.0,,,0.00170722552346083,2,270,0.7693418329706307,4.8506339669883386e-05,388.4847013927641,COMPLETE
462,0.39583972096443176,2023-09-04 18:40:07.250697,2023-09-04 18:40:10.225673,0 days 00:00:02.974976,Leaky,ReLU,ReLU,Sigmoid,22,10,9.0,24.0,22.0,0.004783088822829973,4,293,0.7422253198415042,0.00015875310001038935,181.22038459777832,COMPLETE
463,0.3753680884838104,2023-09-04 18:40:10.226138,2023-09-04 18:40:12.602098,0 days 00:00:02.375960,Leaky,ReLU,ReLU,Sigmoid,36,19,24.0,22.0,24.0,0.0033307388681126783,4,250,0.3095954692255575,0.0010306218979969257,196.79172034885573,COMPLETE
