number,value,datetime_start,datetime_complete,duration,params_activation1,params_activation2,params_activation3,params_activation4,params_batch_size,params_fl1,params_fl2,params_fl3,params_fl4,params_learning_rate,params_n_layers,params_num_epochs,params_train_size,params_weight_decay,user_attrs_mre,state
452,0.625693142414093,2023-09-04 18:56:54.627378,2023-09-04 18:57:00.106472,0 days 00:00:05.479094,Tanh,ReLU,ReLU,Sigmoid,46,23,24.0,22.0,17.0,4.89301293367008e-05,4,303,0.3179633271465424,5.698308499755809e-05,172.71194186068996,COMPLETE
453,0.4508074223995209,2023-09-04 18:57:00.106815,2023-09-04 18:57:00.854217,0 days 00:00:00.747402,Leaky,Leaky,ReLU,Leaky,51,20,2.0,24.0,16.0,0.003770072211206863,4,265,0.2139687587774879,8.374467931412774e-05,157.46075808617377,COMPLETE
454,0.4563288986682892,2023-09-04 18:57:00.854562,2023-09-04 18:57:02.009589,0 days 00:00:01.155027,Tanh,Leaky,Tanh,Tanh,49,21,5.0,23.0,18.0,0.0018639428742650431,4,273,0.26569000253102554,1.0524446841121372e-05,304.2325996985802,COMPLETE
455,0.32822170853614807,2023-09-04 18:57:02.009940,2023-09-04 18:57:02.858844,0 days 00:00:00.848904,Tanh,Leaky,,,51,19,19.0,,,0.01977402613688165,2,118,0.7687251412633652,1.3377082562008866e-05,232.1282132905105,COMPLETE
456,0.34888434410095215,2023-09-04 18:57:02.859180,2023-09-04 18:57:03.732106,0 days 00:00:00.872926,Tanh,Tanh,ReLU,Leaky,54,18,19.0,22.0,20.0,0.013036341644501678,4,50,0.3847984417007167,0.0001158234393522425,208.77475188499272,COMPLETE
457,0.41673749685287476,2023-09-04 18:57:03.732432,2023-09-04 18:57:04.326887,0 days 00:00:00.594455,Tanh,Leaky,ReLU,Tanh,47,17,18.0,21.0,21.0,0.03124902067682553,4,111,0.506178420425193,2.404656242657694e-05,185.3746368408203,COMPLETE
458,0.3585907518863678,2023-09-04 18:57:04.327226,2023-09-04 18:57:06.027967,0 days 00:00:01.700741,Tanh,Leaky,ReLU,Sigmoid,56,20,22.0,23.0,16.0,0.002277795048766456,4,317,0.4224405522836832,3.4140532668969624e-05,939.8710941221656,COMPLETE
459,0.3373849391937256,2023-09-04 18:57:06.028301,2023-09-04 18:57:08.186863,0 days 00:00:02.158562,Tanh,Leaky,ReLU,Leaky,53,19,19.0,22.0,20.0,0.0015057115194845319,4,309,0.683521958573974,3.601052639469205e-05,226.8103907108307,COMPLETE
460,0.3542822003364563,2023-09-04 18:57:08.187199,2023-09-04 18:57:09.706655,0 days 00:00:01.519456,Tanh,Leaky,ReLU,Tanh,78,12,18.0,20.0,19.0,0.003927189607477718,4,290,0.3679532275671732,5.1657353067125846e-05,148.3203099568685,COMPLETE
461,0.35040849447250366,2023-09-04 18:57:09.706991,2023-09-04 18:57:11.379365,0 days 00:00:01.672374,Tanh,Leaky,Tanh,Leaky,59,22,20.0,24.0,17.0,0.0027562642889730066,4,330,0.7299153676222974,3.846713313991256e-05,136.7908104098573,COMPLETE
462,0.3506481945514679,2023-09-04 18:57:11.379708,2023-09-04 18:57:21.403387,0 days 00:00:10.023679,Tanh,Leaky,ReLU,Tanh,50,18,20.0,22.0,18.0,0.0002605037781378196,4,255,0.7689202358230233,3.0327271190188154e-05,276.75999513513904,COMPLETE
463,0.34277939796447754,2023-09-04 18:57:21.403744,2023-09-04 18:57:25.778335,0 days 00:00:04.374591,Tanh,Tanh,Sigmoid,Sigmoid,37,20,23.0,23.0,18.0,0.001778946793157881,4,264,0.7142452975994452,0.0001764269153770218,199.11883285197806,COMPLETE
464,0.33096370100975037,2023-09-04 18:57:25.778694,2023-09-04 18:57:27.656472,0 days 00:00:01.877778,Tanh,Leaky,ReLU,Leaky,45,21,21.0,21.0,19.0,0.003183964670484731,4,277,0.4884249159620921,1.534290369435933e-05,221.08776308885263,COMPLETE
465,0.3478654623031616,2023-09-04 18:57:27.656848,2023-09-04 18:57:31.010674,0 days 00:00:03.353826,ReLU,Leaky,ReLU,Tanh,48,17,19.0,22.0,18.0,0.0009391154583681229,4,211,0.7459433861486623,2.4582484071021477e-05,216.91300449601138,COMPLETE
466,0.4199744164943695,2023-09-04 18:57:31.011017,2023-09-04 18:57:31.355081,0 days 00:00:00.344064,Tanh,Leaky,ReLU,ReLU,74,19,18.0,23.0,20.0,0.047952957775262546,4,298,0.13110761528495252,0.0006037519542907159,128.11595363242952,COMPLETE
467,0.48129919171333313,2023-09-04 18:57:31.355429,2023-09-04 18:57:32.138480,0 days 00:00:00.783051,Tanh,Leaky,ReLU,Sigmoid,55,20,20.0,21.0,17.0,0.001305549579489788,4,79,0.17684585760338903,0.0007253405114182878,222.9980395353293,COMPLETE
468,0.41453513503074646,2023-09-04 18:57:32.138814,2023-09-04 18:57:35.667588,0 days 00:00:03.528774,Tanh,Leaky,Tanh,Leaky,33,18,19.0,16.0,21.0,0.002172599728621326,4,128,0.7963044650085155,0.010717120547898315,301.6412208432057,COMPLETE
469,0.45513415336608887,2023-09-04 18:57:35.667939,2023-09-04 18:57:37.466101,0 days 00:00:01.798162,Tanh,Tanh,ReLU,Tanh,51,19,19.0,24.0,19.0,0.00048752806326539925,4,229,0.13893286593419876,4.582109494991079e-05,199.2712873433875,COMPLETE
470,0.6864473223686218,2023-09-04 18:57:37.466445,2023-09-04 18:57:41.024475,0 days 00:00:03.558030,Tanh,Leaky,ReLU,Leaky,57,21,17.0,22.0,17.0,1.7552715856188777e-05,4,99,0.7704895835390018,6.0050393625711815e-05,134.23512530086018,COMPLETE
471,0.36115407943725586,2023-09-04 18:57:41.024831,2023-09-04 18:57:42.374857,0 days 00:00:01.350026,Tanh,Leaky,ReLU,Tanh,30,20,20.0,23.0,18.0,0.01003600988435999,4,284,0.4511836272263936,7.44685439418015e-05,272.207982656118,COMPLETE
472,0.350587397813797,2023-09-04 18:57:42.375198,2023-09-04 18:57:43.282163,0 days 00:00:00.906965,Tanh,Leaky,ReLU,Sigmoid,53,19,21.0,21.0,19.0,0.0043386036110410935,4,196,0.28770895030821086,0.0001330300041421347,148.33041795633608,COMPLETE
473,0.3421984314918518,2023-09-04 18:57:43.282509,2023-09-04 18:57:53.538395,0 days 00:00:10.255886,Tanh,Leaky,ReLU,Leaky,48,18,18.0,22.0,20.0,0.00018083069796366694,4,273,0.7997605371805915,0.0005489289752328205,157.5743515265822,COMPLETE
474,0.3476586639881134,2023-09-04 18:57:53.538734,2023-09-04 18:57:57.164681,0 days 00:00:03.625947,Tanh,Sigmoid,Tanh,Tanh,35,21,22.0,24.0,18.0,0.001967357298780128,4,243,0.7094841644376949,9.763132311110761e-05,166.42536376953126,COMPLETE
475,0.35109350085258484,2023-09-04 18:57:57.165025,2023-09-04 18:58:00.613887,0 days 00:00:03.448862,Leaky,Leaky,Sigmoid,ReLU,50,20,17.0,23.0,19.0,0.002547417435862254,4,293,0.6796664119527942,0.002237260459511713,183.51755555470785,COMPLETE
476,0.3929655849933624,2023-09-04 18:58:00.614226,2023-09-04 18:58:01.307213,0 days 00:00:00.692987,Tanh,ReLU,ReLU,Leaky,52,19,18.0,22.0,17.0,0.03757564890986453,4,258,0.35450443527424585,0.0008277170374369649,142.41371263776506,COMPLETE
477,0.33423498272895813,2023-09-04 18:58:01.307550,2023-09-04 18:58:03.407068,0 days 00:00:02.099518,Tanh,Tanh,ReLU,Tanh,55,17,19.0,21.0,18.0,0.006118100371913586,4,220,0.43599365302469734,0.0006795379571426248,163.40032606858475,COMPLETE
478,0.472939670085907,2023-09-04 18:58:03.407407,2023-09-04 18:58:05.261695,0 days 00:00:01.854288,Tanh,Leaky,ReLU,Sigmoid,59,18,21.0,20.0,19.0,0.01654635012669437,4,288,0.7438693350499138,0.007444881710078381,241.0577156498747,COMPLETE
479,0.3395843803882599,2023-09-04 18:58:05.262042,2023-09-04 18:58:08.316759,0 days 00:00:03.054717,Tanh,Leaky,ReLU,Leaky,46,12,20.0,23.0,20.0,0.003403810189097729,4,266,0.7697160223254295,0.001098870893658215,206.40462615524513,COMPLETE
480,0.5418134927749634,2023-09-04 18:58:08.317100,2023-09-04 18:58:09.882824,0 days 00:00:01.565724,Tanh,Leaky,Tanh,Tanh,39,20,19.0,12.0,18.0,0.05133620013984155,4,64,0.7334235141908153,0.004867104099228046,216.83083567899817,COMPLETE
481,0.3197315037250519,2023-09-04 18:58:09.883168,2023-09-04 18:58:13.459357,0 days 00:00:03.576189,Tanh,Leaky,ReLU,Sigmoid,54,19,23.0,22.0,16.0,0.0016894121343678983,4,307,0.7998365053747539,0.00047903282721507173,185.1855518506921,COMPLETE
482,0.4074198305606842,2023-09-04 18:58:13.459703,2023-09-04 18:58:17.279945,0 days 00:00:03.820242,Tanh,Leaky,ReLU,Leaky,49,11,18.0,22.0,19.0,0.00046423694028266274,4,281,0.24202064931119832,7.047444296076826e-05,169.28732164050336,COMPLETE
483,0.3485949635505676,2023-09-04 18:58:17.280286,2023-09-04 18:58:20.648024,0 days 00:00:03.367738,Tanh,Leaky,ReLU,Tanh,52,24,14.0,21.0,17.0,0.0007859581093123588,4,205,0.6919820030603684,1.2508827874712471e-05,164.84707967440286,COMPLETE
484,0.45204949378967285,2023-09-04 18:58:20.648435,2023-09-04 18:58:23.923585,0 days 00:00:03.275150,Tanh,Tanh,ReLU,ReLU,57,18,20.0,13.0,18.0,0.007206050717108246,4,253,0.7391938088697101,0.008673309040914083,163.79522819929227,COMPLETE
485,0.3300643265247345,2023-09-04 18:58:23.923923,2023-09-04 18:58:26.385337,0 days 00:00:02.461414,Tanh,Leaky,ReLU,Leaky,70,22,19.0,24.0,19.0,0.0012996764091643942,4,194,0.768536441896475,0.0005996687038450371,162.5534712962615,COMPLETE
486,0.6011965870857239,2023-09-04 18:58:26.385677,2023-09-04 18:58:35.054921,0 days 00:00:08.669244,Tanh,Leaky,Sigmoid,Tanh,44,21,15.0,23.0,20.0,3.754854994773348e-05,4,273,0.5626436911830743,0.0015809754184641569,164.7098572559846,COMPLETE
487,0.48385196924209595,2023-09-04 18:58:35.055269,2023-09-04 18:58:39.355816,0 days 00:00:04.300547,ReLU,Leaky,Tanh,Sigmoid,37,3,18.0,22.0,17.0,0.002353665386354084,4,285,0.6585589006180155,0.0009773840567222198,504.463270000383,COMPLETE
488,0.3934060335159302,2023-09-04 18:58:39.356164,2023-09-04 18:58:41.714042,0 days 00:00:02.357878,Tanh,Leaky,ReLU,Leaky,50,19,22.0,6.0,18.0,0.0010661467660311966,4,298,0.26628112719490266,0.0004225811588815996,156.9554431337299,COMPLETE
489,0.321108877658844,2023-09-04 18:58:41.714383,2023-09-04 18:58:43.565341,0 days 00:00:01.850958,Tanh,Leaky,ReLU,Tanh,54,20,20.0,21.0,15.0,0.005295777913700261,4,72,0.7100594698082998,0.0026156150512297227,255.66139340868185,COMPLETE
490,0.4258451759815216,2023-09-04 18:58:43.565677,2023-09-04 18:58:44.110295,0 days 00:00:00.544618,Tanh,Tanh,ReLU,,61,19,21.0,15.0,,0.01241810951445104,3,243,0.1391805689278913,0.003075468112092842,128.78629119137685,COMPLETE
491,0.4398891031742096,2023-09-04 18:58:44.110641,2023-09-04 18:58:44.694676,0 days 00:00:00.584035,Tanh,Leaky,ReLU,Leaky,49,18,17.0,17.0,19.0,0.02613237702704117,4,110,0.23708959184728637,0.003926176881916397,249.04867263067337,COMPLETE
492,0.3636954724788666,2023-09-04 18:58:44.695019,2023-09-04 18:58:46.400206,0 days 00:00:01.705187,Tanh,Leaky,ReLU,Tanh,32,23,19.0,11.0,16.0,0.003026367972746803,4,97,0.3221387039294918,4.059866313176327e-05,187.46227373395647,COMPLETE
493,0.40538081526756287,2023-09-04 18:58:46.400542,2023-09-04 18:58:48.076041,0 days 00:00:01.675499,Tanh,Leaky,Tanh,Sigmoid,46,20,24.0,23.0,20.0,0.0015925516209668983,4,304,0.16131197593732524,0.001253235340989087,267.00754796808417,COMPLETE
494,0.3310382068157196,2023-09-04 18:58:48.076378,2023-09-04 18:58:51.595272,0 days 00:00:03.518894,Tanh,Leaky,ReLU,ReLU,51,17,20.0,22.0,18.0,0.0019234040784896266,4,89,0.7495249971482567,0.0007900157866745255,135.0364111568151,COMPLETE
495,0.41996532678604126,2023-09-04 18:58:51.595609,2023-09-04 18:58:52.837875,0 days 00:00:01.242266,Tanh,,,,35,21,,,,0.002667584112408271,1,264,0.3022709982453862,0.0005339503152053889,157.87248918121935,COMPLETE
496,0.3385380804538727,2023-09-04 18:58:52.838186,2023-09-04 18:58:54.340073,0 days 00:00:01.501887,Tanh,Leaky,ReLU,Leaky,56,20,13.0,24.0,21.0,0.004309093593194487,4,277,0.6814738042278986,0.00013241486784115785,191.43167611827022,COMPLETE
497,0.3304016888141632,2023-09-04 18:58:54.340415,2023-09-04 18:58:55.749715,0 days 00:00:01.409300,Tanh,Leaky,ReLU,Tanh,53,19,18.0,20.0,19.0,0.008959366941706515,4,316,0.7993279137127665,6.657103136793257e-05,258.3459925932043,COMPLETE
498,0.3270915448665619,2023-09-04 18:58:55.750068,2023-09-04 18:59:00.281256,0 days 00:00:04.531188,Leaky,Leaky,Leaky,Sigmoid,22,18,17.0,18.0,18.0,0.0021449638734710205,4,229,0.7118599848171274,1.8342119762515577e-05,145.79481494610127,COMPLETE
499,0.3602451682090759,2023-09-04 18:59:00.281601,2023-09-04 18:59:03.067066,0 days 00:00:02.785465,Sigmoid,Tanh,ReLU,Leaky,48,19,19.0,23.0,17.0,0.003690043014622509,4,189,0.7668862266482297,0.00068618277699786,184.76878153483074,COMPLETE
