number,value,datetime_start,datetime_complete,duration,params_activation1,params_activation2,params_activation3,params_activation4,params_batch_size,params_fl1,params_fl2,params_fl3,params_fl4,params_learning_rate,params_n_layers,params_num_epochs,params_train_size,params_weight_decay,user_attrs_mre,state
455,0.31004223227500916,2023-09-04 18:37:23.961784,2023-09-04 18:37:25.452579,0 days 00:00:01.490795,ReLU,ReLU,,,35,21,15.0,,,0.004777110285770195,2,176,0.7423547494388903,0.00020436522608202368,84.52820045717301,COMPLETE
456,0.5054253935813904,2023-09-04 18:37:25.452941,2023-09-04 18:37:28.374590,0 days 00:00:02.921649,ReLU,Sigmoid,Tanh,Sigmoid,43,15,14.0,20.0,1.0,0.0036160317240084877,4,267,0.6473279695737711,0.00025628256173608444,169.05489540100098,COMPLETE
457,0.5944554805755615,2023-09-04 18:37:28.374960,2023-09-04 18:37:29.027912,0 days 00:00:00.652952,Tanh,Tanh,Tanh,Sigmoid,48,24,13.0,20.0,1.0,0.005612749606824633,4,301,0.7482397092823453,0.030132954816779804,146.5366633097331,COMPLETE
458,0.36611396074295044,2023-09-04 18:37:29.028269,2023-09-04 18:37:30.879224,0 days 00:00:01.850955,ReLU,Tanh,Tanh,Sigmoid,24,23,15.0,22.0,11.0,0.007698262476611265,4,262,0.2753540293202627,3.1538252663403765e-05,100.3819128036499,COMPLETE
459,0.32888302206993103,2023-09-04 18:37:30.879594,2023-09-04 18:37:32.760962,0 days 00:00:01.881368,ReLU,Tanh,Tanh,,70,23,17.0,22.0,,0.002438700458027664,3,186,0.7015525528818861,4.7361478017301926e-05,98.11500609154795,COMPLETE
460,0.35239776968955994,2023-09-04 18:37:32.761312,2023-09-04 18:37:33.905387,0 days 00:00:01.144075,ReLU,Tanh,Tanh,Sigmoid,44,19,16.0,19.0,6.0,0.0030292825759792668,4,286,0.4251107160765392,3.7813429229974425e-05,124.14174979073661,COMPLETE
461,0.5368794202804565,2023-09-04 18:37:33.905740,2023-09-04 18:37:34.754554,0 days 00:00:00.848814,ReLU,Tanh,Tanh,Sigmoid,50,18,15.0,21.0,2.0,0.004339833284454158,4,166,0.2660715412702266,0.00012960240887279007,138.12197655897873,COMPLETE
462,0.2977687120437622,2023-09-04 18:37:34.754969,2023-09-04 18:37:36.978008,0 days 00:00:02.223039,ReLU,Tanh,Tanh,Sigmoid,46,21,9.0,21.0,5.0,0.013879353660125143,4,193,0.7696568690073198,0.00017815534288516443,97.99955619649684,COMPLETE
463,0.4026105999946594,2023-09-04 18:37:36.978358,2023-09-04 18:37:39.722550,0 days 00:00:02.744192,Leaky,ReLU,Tanh,ReLU,38,24,14.0,20.0,11.0,0.0005607200026833165,4,376,0.24740407368710515,9.845110774546317e-05,111.36495750690328,COMPLETE
464,0.30602899193763733,2023-09-04 18:37:39.722944,2023-09-04 18:37:40.710392,0 days 00:00:00.987448,ReLU,Tanh,Tanh,,41,21,13.0,22.0,,0.02138205477637219,3,178,0.7202749975882231,2.6091347231346854e-05,93.05416074006453,COMPLETE
465,0.3722897171974182,2023-09-04 18:37:40.710748,2023-09-04 18:37:41.299261,0 days 00:00:00.588513,ReLU,Tanh,Tanh,Tanh,62,22,16.0,18.0,3.0,0.006579088434204813,4,193,0.22093757337073264,5.8198002626391665e-05,103.66348079759247,COMPLETE
466,0.47073104977607727,2023-09-04 18:37:41.299644,2023-09-04 18:37:41.891112,0 days 00:00:00.591468,ReLU,Tanh,ReLU,ReLU,48,20,15.0,21.0,6.0,0.001486820235138905,4,255,0.10101069472561047,4.5554617716742216e-05,113.9396598815918,COMPLETE
467,0.3302428424358368,2023-09-04 18:37:41.891494,2023-09-04 18:37:43.407471,0 days 00:00:01.515977,Tanh,Sigmoid,Tanh,ReLU,44,19,14.0,16.0,4.0,0.041136248133088346,4,148,0.6747713452601307,3.2747925119105355e-05,91.05628182547433,COMPLETE
468,0.34225553274154663,2023-09-04 18:37:43.407838,2023-09-04 18:37:44.093256,0 days 00:00:00.685418,ReLU,Tanh,Tanh,Sigmoid,51,23,24.0,20.0,21.0,0.003653630393590284,4,183,0.20948703204396513,0.00026561049379783254,433.0807418823242,COMPLETE
469,0.34521445631980896,2023-09-04 18:37:44.093631,2023-09-04 18:37:44.928916,0 days 00:00:00.835285,ReLU,Tanh,Tanh,ReLU,60,24,15.0,22.0,10.0,0.005378231310692064,4,275,0.3562883315370442,8.546498612551738e-05,113.87370648591414,COMPLETE
470,0.5724907517433167,2023-09-04 18:37:44.929268,2023-09-04 18:37:54.787543,0 days 00:00:09.858275,ReLU,Tanh,Tanh,ReLU,30,19,16.0,21.0,1.0,0.0011527905173647052,4,173,0.7540982492967276,2.8002458850408485e-05,124.95679988861085,COMPLETE
471,0.2750449478626251,2023-09-04 18:37:54.788169,2023-09-04 18:37:57.915420,0 days 00:00:03.127251,ReLU,ReLU,Tanh,ReLU,46,20,13.0,22.0,11.0,0.002721852212475079,4,200,0.7990661309228099,0.0011914930115432146,100.9682739612668,COMPLETE
472,0.351777583360672,2023-09-04 18:37:57.915784,2023-09-04 18:38:02.263723,0 days 00:00:04.347939,ReLU,ReLU,Tanh,ReLU,45,20,4.0,22.0,10.0,0.0020610416160519625,4,202,0.7169969100878453,0.0024217565868923405,95.65334134224133,COMPLETE
473,0.32060202956199646,2023-09-04 18:38:02.264135,2023-09-04 18:38:07.438700,0 days 00:00:05.174565,ReLU,ReLU,Tanh,ReLU,20,20,14.0,22.0,11.0,0.0029381122681296063,4,200,0.38578393065274535,0.0014414200454492228,92.4352293667728,COMPLETE
474,0.35264554619789124,2023-09-04 18:38:07.439081,2023-09-04 18:38:08.818864,0 days 00:00:01.379783,ReLU,,,,41,18,,,,0.002626784381954298,1,296,0.7725273554121459,0.0009739820651830069,101.09922728246572,COMPLETE
475,0.3024626672267914,2023-09-04 18:38:08.819200,2023-09-04 18:38:11.677245,0 days 00:00:02.858045,Tanh,ReLU,Tanh,ReLU,43,19,15.0,22.0,12.0,0.002676925523574994,4,210,0.6820897099201649,0.0013179001675903358,232.4023180150274,COMPLETE
476,0.362090140581131,2023-09-04 18:38:11.677613,2023-09-04 18:38:12.586968,0 days 00:00:00.909355,ReLU,ReLU,Tanh,,64,17,5.0,23.0,,0.0021218105563815715,3,196,0.2623341423815784,0.0015520334216724617,165.78434964834926,COMPLETE
477,0.31270238757133484,2023-09-04 18:38:12.587329,2023-09-04 18:38:15.715780,0 days 00:00:03.128451,ReLU,ReLU,Tanh,ReLU,39,20,17.0,23.0,17.0,0.0034865160961782874,4,188,0.7396895346429616,0.001726076570683432,118.79230779012045,COMPLETE
478,0.5180505514144897,2023-09-04 18:38:15.716146,2023-09-04 18:38:29.528497,0 days 00:00:13.812351,ReLU,ReLU,Tanh,Sigmoid,46,19,13.0,22.0,24.0,2.6693959431970818e-05,4,307,0.7780660517553101,0.0009696211654612153,155.23137572844564,COMPLETE
479,0.30697575211524963,2023-09-04 18:38:29.528863,2023-09-04 18:38:30.084373,0 days 00:00:00.555510,ReLU,ReLU,,,53,23,18.0,,,0.015659615771645298,2,269,0.30158147162289,0.0013188669453117507,105.68917422824435,COMPLETE
480,0.41755080223083496,2023-09-04 18:38:30.084727,2023-09-04 18:38:30.715320,0 days 00:00:00.630593,ReLU,ReLU,Tanh,ReLU,49,24,16.0,21.0,11.0,0.004443259350343963,4,207,0.17459704543981264,0.0011541624244551531,113.58417918764312,COMPLETE
481,0.5848775506019592,2023-09-04 18:38:30.715683,2023-09-04 18:38:31.255623,0 days 00:00:00.539940,ReLU,ReLU,Tanh,ReLU,43,18,15.0,23.0,10.0,0.0625799862141874,4,282,0.6399845100596508,0.00015276953607712556,136.72090324988733,COMPLETE
482,0.32282233238220215,2023-09-04 18:38:31.255989,2023-09-04 18:38:35.725800,0 days 00:00:04.469811,ReLU,Sigmoid,Tanh,ReLU,47,19,14.0,6.0,3.0,0.003274356250117881,4,194,0.7212470384443226,0.0010831055811825888,131.78128223029935,COMPLETE
483,0.36109912395477295,2023-09-04 18:38:35.726170,2023-09-04 18:38:37.505365,0 days 00:00:01.779195,ReLU,ReLU,Tanh,Tanh,66,24,16.0,23.0,12.0,0.003868545649182946,4,206,0.7971016420021102,0.00022567170880998734,99.9682799694585,COMPLETE
484,0.2911701798439026,2023-09-04 18:38:37.505733,2023-09-04 18:38:45.837949,0 days 00:00:08.332216,Tanh,Tanh,Tanh,ReLU,61,20,15.0,22.0,11.0,0.0015483797969776856,4,217,0.7470866488422949,0.0001137788110007296,91.41426357003145,COMPLETE
485,0.3340701460838318,2023-09-04 18:38:45.838429,2023-09-04 18:39:09.617981,0 days 00:00:23.779552,ReLU,Tanh,Tanh,ReLU,12,18,14.0,20.0,11.0,0.0007447170227255042,4,260,0.6924401443936975,0.0007980643261471013,96.50358014787946,COMPLETE
486,0.39360693097114563,2023-09-04 18:39:09.618628,2023-09-04 18:39:11.652621,0 days 00:00:02.033993,ReLU,Tanh,Tanh,ReLU,58,23,13.0,21.0,12.0,0.002645763690863217,4,184,0.24294978034134918,2.161515847433447e-05,112.40475555419921,COMPLETE
487,0.3245552182197571,2023-09-04 18:39:11.653474,2023-09-04 18:39:13.815702,0 days 00:00:02.162228,Leaky,Tanh,Tanh,,56,19,16.0,22.0,,0.03345247863172306,3,199,0.5332766599789149,5.8784874195135475e-05,149.02602254933325,COMPLETE
488,0.34375137090682983,2023-09-04 18:39:13.816365,2023-09-04 18:39:17.237794,0 days 00:00:03.421429,ReLU,ReLU,Tanh,Sigmoid,45,24,17.0,19.0,20.0,0.012359757339877053,4,162,0.4793295763130158,0.00019329541894568255,107.6309174431695,COMPLETE
489,0.3506948947906494,2023-09-04 18:39:17.238466,2023-09-04 18:39:22.113113,0 days 00:00:04.874647,ReLU,Tanh,Tanh,ReLU,40,20,15.0,23.0,4.0,0.0010278371267778783,4,287,0.32686906652542425,9.774065036876203e-05,110.91154140896268,COMPLETE
490,0.3826216459274292,2023-09-04 18:39:22.113793,2023-09-04 18:39:59.456784,0 days 00:00:37.342991,ReLU,Tanh,Tanh,ReLU,42,23,14.0,20.0,5.0,3.9844696871323024e-05,4,255,0.7564476054936565,0.00014195871963677427,116.3216786702474,COMPLETE
491,0.2945362627506256,2023-09-04 18:39:59.457449,2023-09-04 18:40:05.503228,0 days 00:00:06.045779,ReLU,Leaky,Tanh,ReLU,36,24,12.0,21.0,7.0,0.0022646614164768294,4,190,0.7089604862971379,0.0006429125795528619,85.41302696434227,COMPLETE
492,0.32036107778549194,2023-09-04 18:40:05.503880,2023-09-04 18:40:10.390007,0 days 00:00:04.886127,ReLU,Tanh,Tanh,ReLU,51,19,15.0,23.0,2.0,0.004804403781139536,4,50,0.5687316982086146,7.908030994211578e-05,144.5993246459961,COMPLETE
493,0.30466997623443604,2023-09-04 18:40:10.390665,2023-09-04 18:40:21.666628,0 days 00:00:11.275963,Sigmoid,Tanh,Tanh,ReLU,48,22,13.0,22.0,16.0,0.003179392204615381,4,216,0.7985491446320534,4.0871674683084705e-05,100.59211586617134,COMPLETE
494,0.33865886926651,2023-09-04 18:40:21.667301,2023-09-04 18:40:24.253110,0 days 00:00:02.585809,Tanh,Sigmoid,Tanh,Sigmoid,46,17,16.0,17.0,13.0,0.008356389125415878,4,276,0.28286677095732604,1.9426875900403274e-05,122.10915082566281,COMPLETE
495,0.3704657256603241,2023-09-04 18:40:24.253767,2023-09-04 18:40:27.424335,0 days 00:00:03.170568,ReLU,Tanh,ReLU,ReLU,54,18,5.0,20.0,10.0,0.003945079029033706,4,201,0.39556805124396693,0.008578197753133272,98.82290931369947,COMPLETE
496,0.6200765371322632,2023-09-04 18:40:27.425016,2023-09-04 18:40:28.855050,0 days 00:00:01.430034,ReLU,ReLU,Tanh,,63,20,14.0,21.0,,0.08952376700786065,3,179,0.6653949492429106,0.03885986596491444,144.56561756134033,COMPLETE
497,0.37148329615592957,2023-09-04 18:40:28.855691,2023-09-04 18:40:33.919823,0 days 00:00:05.064132,ReLU,Tanh,Tanh,ReLU,44,23,8.0,23.0,10.0,0.0017773152643386326,4,267,0.7509392561045157,0.00011965058266705516,198.5634880065918,COMPLETE
498,0.307646244764328,2023-09-04 18:40:33.920464,2023-09-04 18:40:40.414421,0 days 00:00:06.493957,ReLU,Leaky,,,60,16,21.0,,,0.00588918942677452,2,192,0.7254717477383427,2.4040629829153492e-05,96.8556733972886,COMPLETE
499,0.29341429471969604,2023-09-04 18:40:40.415051,2023-09-04 18:40:53.383058,0 days 00:00:12.968007,ReLU,Tanh,Tanh,ReLU,42,19,15.0,19.0,11.0,0.004363796453827555,4,440,0.7693690831224292,1.2968307641664503e-05,128.94213696648092,COMPLETE
