number,value,datetime_start,datetime_complete,duration,params_activation1,params_activation2,params_activation3,params_activation4,params_batch_size,params_fl1,params_fl2,params_fl3,params_fl4,params_learning_rate,params_n_layers,params_num_epochs,params_train_size,params_weight_decay,user_attrs_mre,state
192,110.27020417515634,2023-09-04 19:48:39.468947,2023-09-04 19:48:44.736138,0 days 00:00:05.267191,Sigmoid,Tanh,,,26,23,17.0,,,0.0018856471066743467,2,406,0.336757013464352,9.364228155738328e-05,0.3401866555213928,COMPLETE
193,114.90625046884547,2023-09-04 19:48:44.736436,2023-09-04 19:48:47.946383,0 days 00:00:03.209947,Tanh,Tanh,,,98,24,18.0,,,0.001544260586066066,2,432,0.7087927768473588,0.00018507972327415324,0.32160502672195435,COMPLETE
194,103.43575179271208,2023-09-04 19:48:47.946665,2023-09-04 19:48:50.589503,0 days 00:00:02.642838,Leaky,Tanh,,,41,23,17.0,,,0.0010093034600533236,2,226,0.7645415586755695,5.145387214001436e-05,0.3218647241592407,COMPLETE
195,104.5667666582994,2023-09-04 19:48:50.589800,2023-09-04 19:48:53.102808,0 days 00:00:02.513008,Tanh,Tanh,,,22,20,19.0,,,0.0028417100188070617,2,475,0.4849716674629007,0.001532360625883689,0.346075177192688,COMPLETE
196,105.29489288330078,2023-09-04 19:48:53.103105,2023-09-04 19:48:55.110025,0 days 00:00:02.006920,Leaky,Tanh,,,79,22,18.0,,,0.0021139200485642265,2,411,0.6569415957697321,0.00048780380875154287,0.34112289547920227,COMPLETE
197,148.7103142511277,2023-09-04 19:48:55.110299,2023-09-04 19:48:58.250403,0 days 00:00:03.140104,Tanh,Tanh,,,66,14,17.0,,,0.0013873435329318988,2,433,0.7999490707785466,0.0008226424122071154,0.3567562401294708,COMPLETE
198,92.07241821289062,2023-09-04 19:48:58.250681,2023-09-04 19:49:03.179147,0 days 00:00:04.928466,Leaky,Tanh,,,19,21,19.0,,,0.0011664118026689227,2,482,0.7566826086593915,0.00010908661923629834,0.3297993540763855,COMPLETE
199,88.91637889317104,2023-09-04 19:49:03.179431,2023-09-04 19:49:05.671820,0 days 00:00:02.492389,Leaky,Tanh,,,33,24,16.0,,,0.000868459737508779,2,449,0.6830382240785702,4.299150632900097e-05,0.3088133931159973,COMPLETE
200,119.54668333472276,2023-09-04 19:49:05.672107,2023-09-04 19:49:08.663377,0 days 00:00:02.991270,Leaky,Tanh,,,60,17,16.0,,,0.0008543818944803332,2,196,0.6821196051522569,4.2969270550950114e-05,0.35440152883529663,COMPLETE
201,89.22103826146926,2023-09-04 19:49:08.663668,2023-09-04 19:49:13.435586,0 days 00:00:04.771918,Leaky,Tanh,,,36,24,15.0,,,0.0007000355001251917,2,447,0.7158647800479859,5.925011181098134e-05,0.3203691840171814,COMPLETE
202,91.19512440202423,2023-09-04 19:49:13.435881,2023-09-04 19:49:22.546875,0 days 00:00:09.110994,Leaky,Tanh,,,32,24,15.0,,,0.0005174492250565305,2,447,0.6398067478335153,5.587643477559095e-05,0.29803216457366943,COMPLETE
203,102.0836938059228,2023-09-04 19:49:22.547162,2023-09-04 19:49:29.881905,0 days 00:00:07.334743,Leaky,Tanh,,,35,24,15.0,,,0.0005101985160202686,2,445,0.6198702621065809,5.886789222705617e-05,0.31201714277267456,COMPLETE
204,103.18902486165365,2023-09-04 19:49:29.882195,2023-09-04 19:49:33.645636,0 days 00:00:03.763441,Leaky,Tanh,,,32,23,14.0,,,0.0007039053622215682,2,447,0.5868788754623924,3.153813896719154e-05,0.3353467285633087,COMPLETE
205,94.1966290222971,2023-09-04 19:49:33.645953,2023-09-04 19:49:36.989505,0 days 00:00:03.343552,Leaky,Tanh,,,33,24,15.0,,,0.00037006086561118014,2,152,0.4141684450822217,4.887725909370463e-05,0.3863793909549713,COMPLETE
206,121.29603781419642,2023-09-04 19:49:36.989797,2023-09-04 19:49:45.258056,0 days 00:00:08.268259,Leaky,Tanh,,,38,9,16.0,,,0.0005637762118438431,2,452,0.6605373893141462,6.068712246564003e-05,0.3315095603466034,COMPLETE
207,93.63670355081558,2023-09-04 19:49:45.258347,2023-09-04 19:49:50.151186,0 days 00:00:04.892839,Leaky,Leaky,,,30,23,15.0,,,0.0004482422529038146,2,438,0.6900761620439663,7.140415621881437e-05,0.3369632661342621,COMPLETE
208,107.74225187301636,2023-09-04 19:49:50.151475,2023-09-04 19:49:53.567531,0 days 00:00:03.416056,Leaky,Tanh,,,34,19,16.0,,,0.0006758940278185176,2,464,0.5231149584799585,4.389793126296405e-05,0.32918423414230347,COMPLETE
209,135.02893817653145,2023-09-04 19:49:53.567822,2023-09-04 19:50:02.456298,0 days 00:00:08.888476,Leaky,Tanh,,,31,6,11.0,,,0.0008322061798374268,2,279,0.6362143671354249,3.69406028894868e-05,0.3319341242313385,COMPLETE
210,107.86182216976,2023-09-04 19:50:02.456587,2023-09-04 19:50:08.951830,0 days 00:00:06.495243,Leaky,Sigmoid,,,36,22,15.0,,,0.0005966287639411554,2,436,0.7288566532744758,3.018296514237943e-05,0.3519631326198578,COMPLETE
211,99.91484478822689,2023-09-04 19:50:08.952116,2023-09-04 19:50:16.825383,0 days 00:00:07.873267,Leaky,Tanh,,,13,24,16.0,,,0.0009415480732936398,2,472,0.7134286727077503,7.918373327031855e-05,0.3043734133243561,COMPLETE
212,99.65739178915003,2023-09-04 19:50:16.825674,2023-09-04 19:50:35.276911,0 days 00:00:18.451237,Leaky,Tanh,,,28,24,17.0,,,6.270120138900975e-05,2,463,0.671946064896642,5.556245707747655e-05,0.4318041205406189,COMPLETE
213,130.2783396560534,2023-09-04 19:50:35.277200,2023-09-04 19:50:48.163910,0 days 00:00:12.886710,Leaky,Tanh,,,34,23,17.0,,,2.884237728457189e-05,2,452,0.5571596450818161,6.782078789570481e-05,0.41510292887687683,COMPLETE
214,116.18519704095249,2023-09-04 19:50:48.164200,2023-09-04 19:50:51.803892,0 days 00:00:03.639692,Leaky,Tanh,,,33,15,18.0,,,0.000761065418531312,2,491,0.6019970518749159,5.39217964786366e-05,0.3762896656990051,COMPLETE
215,87.10171348571777,2023-09-04 19:50:51.804180,2023-09-04 19:50:56.170567,0 days 00:00:04.366387,Leaky,Tanh,,,29,24,16.0,,,0.0010710158070619802,2,445,0.6472709743472227,4.6605270376758626e-05,0.3244115710258484,COMPLETE
216,212.36836579266716,2023-09-04 19:50:56.170857,2023-09-04 19:51:02.371770,0 days 00:00:06.200913,Leaky,Tanh,,,30,24,16.0,,,0.0010844589514964068,2,442,0.6474211766382143,4.842454182798694e-05,0.3077825605869293,COMPLETE
217,101.52968618802934,2023-09-04 19:51:02.372058,2023-09-04 19:51:19.872355,0 days 00:00:17.500297,Leaky,Tanh,,,29,19,16.0,,,0.0003020801166143338,2,428,0.6181178223730253,4.554097074763726e-05,0.3246901333332062,COMPLETE
218,117.20394675187238,2023-09-04 19:51:19.872643,2023-09-04 19:51:27.612394,0 days 00:00:07.739751,Leaky,Tanh,,,26,23,14.0,,,0.0009373764473366408,2,419,0.6966716892812209,2.7636999609194627e-05,0.3078061044216156,COMPLETE
219,131.41742695553202,2023-09-04 19:51:27.612691,2023-09-04 19:51:33.307449,0 days 00:00:05.694758,Leaky,Tanh,,,31,20,17.0,,,0.000484479157136268,2,447,0.7368841542247266,3.878785071634066e-05,0.33869069814682007,COMPLETE
220,107.44995987206174,2023-09-04 19:51:33.307750,2023-09-04 19:51:35.662967,0 days 00:00:02.355217,Leaky,Tanh,,,56,18,23.0,,,0.0007072807820703382,2,200,0.5753413898850152,8.357611999582335e-05,0.3287185728549957,COMPLETE
221,101.38204860687256,2023-09-04 19:51:35.663256,2023-09-04 19:51:37.582683,0 days 00:00:01.919427,Leaky,Tanh,,,87,24,17.0,,,0.0018296755432887757,2,461,0.6834922669944872,0.00016277716419163364,0.3275581896305084,COMPLETE
222,90.57000805958208,2023-09-04 19:51:37.582963,2023-09-04 19:51:40.310190,0 days 00:00:02.727227,ReLU,Tanh,,,39,24,18.0,,,0.0022894553660236052,2,455,0.7155015430994536,6.016225706170749e-05,0.3123728334903717,COMPLETE
223,117.22735200445337,2023-09-04 19:51:40.310485,2023-09-04 19:51:40.878676,0 days 00:00:00.568191,ReLU,Tanh,,,38,24,15.0,,,0.0024552411672008902,2,455,0.12845574287516923,6.193212174752976e-05,0.41232845187187195,COMPLETE
224,104.41753464710864,2023-09-04 19:51:40.878959,2023-09-04 19:51:43.206721,0 days 00:00:02.327762,ReLU,Tanh,,,40,23,18.0,,,0.002220231103784727,2,439,0.6493289504412767,3.962834065682422e-05,0.2776311933994293,COMPLETE
225,182.36433549360797,2023-09-04 19:51:43.207019,2023-09-04 19:51:44.369378,0 days 00:00:01.162359,ReLU,ReLU,,,37,22,18.0,,,0.0032715235448571274,2,429,0.7304756737714971,2.624993978314847e-05,0.3269852101802826,COMPLETE
226,89.87118983268738,2023-09-04 19:51:44.369670,2023-09-04 19:51:45.734588,0 days 00:00:01.364918,ReLU,Leaky,,,35,23,21.0,,,0.0027583148054896737,2,447,0.7635582482093023,5.205312224506673e-05,0.3260781168937683,COMPLETE
227,101.8880607142593,2023-09-04 19:51:45.734885,2023-09-04 19:51:47.947754,0 days 00:00:02.212869,ReLU,Leaky,,,42,23,21.0,,,0.00248633768412168,2,182,0.7692285824611037,7.285489361659407e-05,0.2990081012248993,COMPLETE
228,102.70745340983073,2023-09-04 19:51:47.948045,2023-09-04 19:51:52.204789,0 days 00:00:04.256744,ReLU,Leaky,,,10,22,20.0,,,0.003022049540310685,2,469,0.7529510522086033,0.0005772292024782789,0.33856773376464844,COMPLETE
229,97.31539983916701,2023-09-04 19:51:52.205079,2023-09-04 19:51:54.242214,0 days 00:00:02.037135,ReLU,Leaky,,,35,23,21.0,,,0.001687005578680542,2,454,0.7115626174949558,4.633401458911337e-05,0.3118739128112793,COMPLETE
230,91.21455805509993,2023-09-04 19:51:54.242498,2023-09-04 19:51:58.897242,0 days 00:00:04.654744,ReLU,Tanh,,,36,22,19.0,,,0.0019486755911270405,2,440,0.7720897023863736,3.536935309161225e-05,0.32005590200424194,COMPLETE
231,86.7749967956543,2023-09-04 19:51:58.897531,2023-09-04 19:52:01.274283,0 days 00:00:02.376752,ReLU,Leaky,,,32,24,22.0,,,0.002613316911744905,2,446,0.679916546473331,5.296423686739384e-05,0.33135467767715454,COMPLETE
232,87.19561212713069,2023-09-04 19:52:01.274579,2023-09-04 19:52:03.300435,0 days 00:00:02.025856,ReLU,Leaky,,,33,24,22.0,,,0.0027655616962042997,2,435,0.6994472511447788,5.132878778773228e-05,0.2872430980205536,COMPLETE
233,97.59001879422169,2023-09-04 19:52:03.300724,2023-09-04 19:52:05.206216,0 days 00:00:01.905492,ReLU,Leaky,,,33,24,22.0,,,0.0037882178856394827,2,434,0.6796650362166086,6.656842282923555e-05,0.3027152419090271,COMPLETE
234,100.86089825630188,2023-09-04 19:52:05.206497,2023-09-04 19:52:07.641905,0 days 00:00:02.435408,ReLU,Leaky,,,32,24,22.0,,,0.0027026207256723492,2,420,0.7080331592450925,0.0006703520456546471,0.3226364254951477,COMPLETE
235,107.79278087615967,2023-09-04 19:52:07.642195,2023-09-04 19:52:09.710219,0 days 00:00:02.068024,ReLU,Leaky,,,35,24,22.0,,,0.003409746359862029,2,446,0.7343540313585109,5.3258973215832945e-05,0.27510151267051697,COMPLETE
236,105.04652531941731,2023-09-04 19:52:09.710506,2023-09-04 19:52:11.459619,0 days 00:00:01.749113,ReLU,Leaky,,,39,23,23.0,,,0.002362137001774537,2,458,0.6994249056390014,8.740371552966925e-05,0.32208284735679626,COMPLETE
237,89.9098208392108,2023-09-04 19:52:11.459909,2023-09-04 19:52:13.377989,0 days 00:00:01.918080,ReLU,Leaky,,,33,24,22.0,,,0.0029775065980532536,2,429,0.6726134271206967,0.0017693944055605084,0.2985481023788452,COMPLETE
238,87.6142060563371,2023-09-04 19:52:13.378283,2023-09-04 19:52:14.642772,0 days 00:00:01.264489,ReLU,Leaky,,,34,24,21.0,,,0.004618600157152026,2,437,0.6575271217840227,6.137685533570812e-05,0.2823508679866791,COMPLETE
239,112.92987823486328,2023-09-04 19:52:14.643065,2023-09-04 19:52:15.660783,0 days 00:00:01.017718,ReLU,Leaky,,,35,24,21.0,,,0.0037329738955042832,2,435,0.6640255267211397,6.425341927269402e-05,0.3270806670188904,COMPLETE
240,92.25388097763062,2023-09-04 19:52:15.661090,2023-09-04 19:52:16.812688,0 days 00:00:01.151598,ReLU,Leaky,,,33,24,21.0,,,0.00732661360015291,2,442,0.6762522607688557,5.1256457856504295e-05,0.3033585846424103,COMPLETE
241,98.70833691683683,2023-09-04 19:52:16.812989,2023-09-04 19:52:18.119990,0 days 00:00:01.307001,ReLU,Leaky,,,37,24,22.0,,,0.005572509333221876,2,450,0.6079880515553412,8.09346873836344e-05,0.326669842004776,COMPLETE
242,93.72445002469149,2023-09-04 19:52:18.120296,2023-09-04 19:52:20.696505,0 days 00:00:02.576209,ReLU,Leaky,,,30,23,21.0,,,0.004644801980653616,2,434,0.6498819671624387,6.229343129283102e-05,0.2825712263584137,COMPLETE
243,95.3889481977983,2023-09-04 19:52:20.696801,2023-09-04 19:52:23.096620,0 days 00:00:02.399819,ReLU,Leaky,,,28,24,22.0,,,0.0028277743045985984,2,414,0.7304607815536358,4.462461452022872e-05,0.31133154034614563,COMPLETE
244,86.97929544159861,2023-09-04 19:52:23.096903,2023-09-04 19:52:25.388210,0 days 00:00:02.291307,ReLU,Leaky,,,31,24,20.0,,,0.003268484039406946,2,426,0.6311379576820898,0.0007994517978416713,0.38290148973464966,COMPLETE
245,86.32199185136436,2023-09-04 19:52:25.388493,2023-09-04 19:52:28.820717,0 days 00:00:03.432224,Leaky,Leaky,,,32,24,20.0,,,0.0031000925657778114,2,422,0.6265746224429383,0.0008129630957731807,0.3136572539806366,COMPLETE
246,100.96454685292345,2023-09-04 19:52:28.821006,2023-09-04 19:52:30.454523,0 days 00:00:01.633517,ReLU,Leaky,,,31,23,21.0,,,0.0032219804381084078,2,422,0.6263808986362037,0.000798328980448355,0.3015776574611664,COMPLETE
247,88.25717699969256,2023-09-04 19:52:30.454809,2023-09-04 19:52:31.396478,0 days 00:00:00.941669,ReLU,Leaky,,,33,24,20.0,,,0.005385683962660516,2,401,0.6494077807308575,0.0010520602230124011,0.320379376411438,COMPLETE
248,94.19837905883789,2023-09-04 19:52:31.396765,2023-09-04 19:52:33.122483,0 days 00:00:01.725718,ReLU,Leaky,,,29,24,20.0,,,0.004596357163503864,2,393,0.5935103711677666,0.0009426531221384911,0.3500547707080841,COMPLETE
249,96.46484422683716,2023-09-04 19:52:33.122762,2023-09-04 19:52:34.728345,0 days 00:00:01.605583,ReLU,Leaky,,,33,24,20.0,,,0.003951788122145774,2,401,0.6350687678393494,0.0007365618998832397,0.2918586730957031,COMPLETE
250,99.01741418173147,2023-09-04 19:52:34.728632,2023-09-04 19:52:36.249959,0 days 00:00:01.521327,ReLU,Leaky,,,32,12,20.0,,,0.005282203111934597,2,406,0.6597958194333696,0.0010927530777591653,0.3343588709831238,COMPLETE
251,94.93126602172852,2023-09-04 19:52:36.250250,2023-09-04 19:52:37.837748,0 days 00:00:01.587498,ReLU,Leaky,,,34,24,20.0,,,0.003114989042766353,2,415,0.6167557865811144,0.000998610311059695,0.299682080745697,COMPLETE
252,95.01189696114018,2023-09-04 19:52:37.838040,2023-09-04 19:52:39.873730,0 days 00:00:02.035690,ReLU,Leaky,,,30,24,22.0,,,0.005765539972936765,2,428,0.67709716554576,0.0019488119294593484,0.2894304394721985,COMPLETE
253,83.14585723876954,2023-09-04 19:52:39.874019,2023-09-04 19:52:41.343353,0 days 00:00:01.469334,ReLU,Leaky,,,27,23,21.0,,,0.0036056763513178224,2,429,0.7945864748669853,0.0005879676685655254,0.31636470556259155,COMPLETE
254,108.41916073885831,2023-09-04 19:52:41.343650,2023-09-04 19:52:42.852559,0 days 00:00:01.508909,ReLU,Leaky,,,26,23,21.0,,,0.004315477769929291,2,388,0.42704818907445546,0.00040711448870229026,0.33594810962677,COMPLETE
255,110.5797170690588,2023-09-04 19:52:42.852862,2023-09-04 19:52:44.643510,0 days 00:00:01.790648,ReLU,Leaky,,,27,23,21.0,,,0.003509083057467555,2,424,0.7867653552141818,0.0015313711263817103,0.3238222897052765,COMPLETE
256,139.90971412033332,2023-09-04 19:52:44.643838,2023-09-04 19:52:47.304865,0 days 00:00:02.661027,ReLU,Leaky,,,29,24,20.0,,,0.002976298204081234,2,414,0.7561298752048621,0.000693620323179457,0.29089584946632385,COMPLETE
257,94.62617643255936,2023-09-04 19:52:47.305170,2023-09-04 19:52:50.846289,0 days 00:00:03.541119,ReLU,Leaky,,,32,23,21.0,,,0.0026226691993316968,2,431,0.6420302963257178,0.0008370642837288995,0.30409231781959534,COMPLETE
258,82.05955807667858,2023-09-04 19:52:50.846568,2023-09-04 19:52:53.209378,0 days 00:00:02.362810,ReLU,Leaky,,,31,24,22.0,,,0.003983799674818123,2,440,0.7960429060246713,0.0026738881331520425,0.3368922770023346,COMPLETE
259,96.4625304201816,2023-09-04 19:52:53.209649,2023-09-04 19:52:57.344202,0 days 00:00:04.134553,ReLU,Leaky,,,34,24,22.0,,,0.004188008638166565,2,425,0.7903846542351992,0.003439895625607423,0.30908718705177307,COMPLETE
260,88.58391855277267,2023-09-04 19:52:57.344479,2023-09-04 19:53:00.419780,0 days 00:00:03.075301,ReLU,Leaky,,,31,24,22.0,,,0.0037145500038761005,2,436,0.7993356312347258,0.0021589966401640713,0.2690727412700653,COMPLETE
261,94.13602997535882,2023-09-04 19:53:00.420256,2023-09-04 19:53:02.384518,0 days 00:00:01.964262,ReLU,Leaky,,,30,24,22.0,,,0.0037327471717188048,2,437,0.7957561561668346,0.0019561896150900216,0.3399813175201416,COMPLETE
262,94.29976451396942,2023-09-04 19:53:02.384795,2023-09-04 19:53:03.702476,0 days 00:00:01.317681,ReLU,Leaky,,,32,24,22.0,,,0.005174257209368789,2,403,0.3736220174724698,0.0022318839830811465,0.34136971831321716,COMPLETE
263,85.2183512934932,2023-09-04 19:53:03.702764,2023-09-04 19:53:05.845572,0 days 00:00:02.142808,ReLU,Leaky,,,35,23,21.0,,,0.004540331801561524,2,413,0.792443237139866,0.0025359807606442695,0.3367396891117096,COMPLETE
264,88.97964398066203,2023-09-04 19:53:05.845858,2023-09-04 19:53:07.722411,0 days 00:00:01.876553,ReLU,Leaky,,,36,23,21.0,,,0.004426725720647534,2,410,0.7978420900871297,0.002915663323473452,0.34445443749427795,COMPLETE
265,82.39580041009026,2023-09-04 19:53:07.722691,2023-09-04 19:53:09.163454,0 days 00:00:01.440763,ReLU,Leaky,,,36,23,21.0,,,0.0045701339598821205,2,406,0.7915338507978943,0.0022031737845368605,0.34251585602760315,COMPLETE
266,103.85338550143771,2023-09-04 19:53:09.163753,2023-09-04 19:53:11.263529,0 days 00:00:02.099776,ReLU,Leaky,,,36,23,21.0,,,0.006571309278285436,2,407,0.7975138584515051,0.0029173734977719005,0.3115190863609314,COMPLETE
267,93.33082641601563,2023-09-04 19:53:11.263819,2023-09-04 19:53:13.143934,0 days 00:00:01.880115,ReLU,Leaky,,,38,23,21.0,,,0.004837984194774818,2,393,0.7985500093187123,0.002326405219938958,0.2967480421066284,COMPLETE
268,90.27022311561986,2023-09-04 19:53:13.144225,2023-09-04 19:53:14.753707,0 days 00:00:01.609482,ReLU,Leaky,,,31,23,23.0,,,0.006162806855938102,2,398,0.7633027014610706,0.0030989449823434945,0.36447378993034363,COMPLETE
269,92.91060256958008,2023-09-04 19:53:14.753995,2023-09-04 19:53:15.984184,0 days 00:00:01.230189,ReLU,Leaky,,,37,24,21.0,,,0.004252576262970979,2,407,0.7399205428589212,0.002639413932800835,0.3166736960411072,COMPLETE
270,90.146326026138,2023-09-04 19:53:15.984459,2023-09-04 19:53:18.556882,0 days 00:00:02.572423,ReLU,Leaky,,,25,23,21.0,,,0.007881036339945989,2,417,0.7981948789019175,0.003402088663584895,0.3254830539226532,COMPLETE
271,109.85792870615043,2023-09-04 19:53:18.557185,2023-09-04 19:53:20.470085,0 days 00:00:01.912900,ReLU,Leaky,,,35,11,22.0,,,0.00554486629090042,2,381,0.7566609697238407,0.00251637083666258,0.3298377990722656,COMPLETE
272,92.40381349836078,2023-09-04 19:53:20.470367,2023-09-04 19:53:21.407392,0 days 00:00:00.937025,ReLU,Leaky,,,31,24,23.0,,,0.004673039179682083,2,414,0.3931694096949837,0.0028105143670973916,0.3445659279823303,COMPLETE
273,92.64881015353733,2023-09-04 19:53:21.407682,2023-09-04 19:53:23.467626,0 days 00:00:02.059944,ReLU,Leaky,,,28,23,22.0,,,0.0036308646395379913,2,420,0.7653904663153028,0.002346587405374583,0.304795503616333,COMPLETE
274,90.7329570225307,2023-09-04 19:53:23.467923,2023-09-04 19:53:24.910477,0 days 00:00:01.442554,ReLU,Leaky,,,34,24,20.0,,,0.005121994388933692,2,402,0.7980789028363344,0.0004776280102238247,0.3453686833381653,COMPLETE
275,93.74694478736734,2023-09-04 19:53:24.910762,2023-09-04 19:53:26.826205,0 days 00:00:01.915443,ReLU,Leaky,,,36,23,21.0,,,0.0041959447306989675,2,412,0.7339519706312301,0.004048634442194053,0.29995810985565186,COMPLETE
276,123.08081638813019,2023-09-04 19:53:26.826489,2023-09-04 19:53:28.008230,0 days 00:00:01.181741,Sigmoid,Leaky,,,29,24,22.0,,,0.006985515986405147,2,425,0.30878224442407753,0.003955131543884672,0.4749971330165863,COMPLETE
277,85.35818523060192,2023-09-04 19:53:28.008520,2023-09-04 19:53:31.535558,0 days 00:00:03.527038,ReLU,Leaky,,,31,23,23.0,,,0.005616754706082589,2,392,0.7690018849861422,0.002114247986377836,0.2861786484718323,COMPLETE
278,93.73892182570238,2023-09-04 19:53:31.535848,2023-09-04 19:53:33.634449,0 days 00:00:02.098601,ReLU,Leaky,,,32,23,23.0,,,0.008510706196697693,2,386,0.7560044157161265,0.002019011770589087,0.32718661427497864,COMPLETE
279,107.02216682434081,2023-09-04 19:53:33.634745,2023-09-04 19:53:35.002925,0 days 00:00:01.368180,ReLU,,,,30,23,,,,0.0057776616121076015,1,130,0.7646572765688859,0.0028806720467497425,0.3705734610557556,COMPLETE
280,97.80545568466187,2023-09-04 19:53:35.003202,2023-09-04 19:53:35.832626,0 days 00:00:00.829424,ReLU,Leaky,,,33,24,23.0,,,0.010505447499608071,2,95,0.4760960823318741,0.002417898290387046,0.35691526532173157,COMPLETE
281,95.42147589789496,2023-09-04 19:53:35.832910,2023-09-04 19:53:37.533511,0 days 00:00:01.700601,ReLU,Leaky,,,34,24,22.0,,,0.004721559923224421,2,395,0.7311178981501688,0.0016875356055433108,0.2538817822933197,COMPLETE
282,79.06140825225086,2023-09-04 19:53:37.533986,2023-09-04 19:53:40.677120,0 days 00:00:03.143134,ReLU,Leaky,,,27,23,21.0,,,0.003713390344546729,2,435,0.7753891920571753,0.00027260231881650704,0.29950952529907227,COMPLETE
283,90.7735586455374,2023-09-04 19:53:40.677409,2023-09-04 19:53:41.678330,0 days 00:00:01.000921,ReLU,Leaky,,,26,23,21.0,,,0.006168199075105627,2,434,0.46435419836647057,0.0021111886521260705,0.312206506729126,COMPLETE
284,90.59169251578194,2023-09-04 19:53:41.678619,2023-09-04 19:53:45.438256,0 days 00:00:03.759637,ReLU,Leaky,,,28,23,20.0,,,0.004083899636184291,2,420,0.7981727898120029,0.002982397198282517,0.3123825788497925,COMPLETE
285,115.24437183444783,2023-09-04 19:53:45.438734,2023-09-04 19:53:46.910318,0 days 00:00:01.471584,ReLU,Leaky,,,31,23,22.0,,,0.0035650925748494278,2,436,0.2170259984406238,0.0002320339667127164,0.36123597621917725,COMPLETE
286,268.2793533890336,2023-09-04 19:53:46.910601,2023-09-04 19:53:48.865987,0 days 00:00:01.955386,ReLU,Leaky,,,29,24,21.0,,,0.005216831141245036,2,410,0.7718726874506179,0.004608281507639377,0.3398714065551758,COMPLETE
287,101.17315315713688,2023-09-04 19:53:48.866469,2023-09-04 19:53:51.627784,0 days 00:00:02.761315,ReLU,Leaky,,,24,23,23.0,,,0.0038524050505651347,2,440,0.7406808172534828,0.0003133044265982003,0.30996549129486084,COMPLETE
288,98.21117156982422,2023-09-04 19:53:51.628075,2023-09-04 19:53:52.606607,0 days 00:00:00.978532,ReLU,Leaky,,,32,24,21.0,,,0.022959523657982497,2,426,0.7147930931087674,0.0014296758748023987,0.3628799617290497,COMPLETE
