number,value,datetime_start,datetime_complete,duration,params_activation1,params_activation2,params_activation3,params_activation4,params_batch_size,params_fl1,params_fl2,params_fl3,params_fl4,params_learning_rate,params_n_layers,params_num_epochs,params_train_size,params_weight_decay,user_attrs_mre,state
289,98.29044511583116,2023-09-04 19:53:52.606899,2023-09-04 19:53:54.383254,0 days 00:00:01.776355,ReLU,Leaky,,,27,22,22.0,,,0.00333710074699484,2,419,0.4536022769704099,0.0003519580140596005,0.31239742040634155,COMPLETE
290,90.75474236935986,2023-09-04 19:53:54.383552,2023-09-04 19:53:56.050122,0 days 00:00:01.666570,ReLU,Leaky,,,36,24,23.0,,,0.005016263674993569,2,432,0.5013613653411263,0.0002953757883202488,0.32508280873298645,COMPLETE
291,107.90639251708984,2023-09-04 19:53:56.050613,2023-09-04 19:53:58.702084,0 days 00:00:02.651471,ReLU,Leaky,,,30,22,20.0,,,0.00438944489661285,2,442,0.7730357821302426,1.9424449408083568e-05,0.28810757398605347,COMPLETE
292,92.44773356119792,2023-09-04 19:53:58.702374,2023-09-04 19:54:00.765843,0 days 00:00:02.063469,ReLU,Leaky,,,34,23,21.0,,,0.0033235504677879076,2,407,0.7397545521178697,0.00018307270400944723,0.3397277593612671,COMPLETE
293,95.99476835462782,2023-09-04 19:54:00.766131,2023-09-04 19:54:02.543774,0 days 00:00:01.777643,ReLU,Leaky,,,27,23,22.0,,,0.006256362380339849,2,425,0.7981020981834978,0.0020506069332123303,0.3490737974643707,COMPLETE
294,91.6504355085657,2023-09-04 19:54:02.544073,2023-09-04 19:54:04.912552,0 days 00:00:02.368479,ReLU,Leaky,,,38,24,23.0,,,0.0039865592225880086,2,399,0.5289945660665105,0.000267358803096197,0.2969527840614319,COMPLETE
295,92.88282246743479,2023-09-04 19:54:04.912837,2023-09-04 19:54:07.320575,0 days 00:00:02.407738,ReLU,Leaky,,,31,24,20.0,,,0.002925353948486306,2,442,0.7080743803496062,0.0016914844029721993,0.31250691413879395,COMPLETE
296,221.76456599765353,2023-09-04 19:54:07.320859,2023-09-04 19:54:07.980784,0 days 00:00:00.659925,ReLU,Sigmoid,,,33,23,21.0,,,0.00460590774462485,2,415,0.1562409528900839,0.002580673312067286,0.3934610188007355,COMPLETE
297,106.96408765966243,2023-09-04 19:54:07.981076,2023-09-04 19:54:11.041761,0 days 00:00:03.060685,Sigmoid,Leaky,,,40,24,22.0,,,0.003593333491909365,2,430,0.7707843738765308,0.00327944370945026,0.42307689785957336,COMPLETE
298,99.26068878173828,2023-09-04 19:54:11.042049,2023-09-04 19:54:13.237892,0 days 00:00:02.195843,ReLU,Leaky,,,36,22,21.0,,,0.002636132793106736,2,372,0.7395625496159746,1.1306073760519478e-05,0.31389036774635315,COMPLETE
299,94.3118974071438,2023-09-04 19:54:13.238188,2023-09-04 19:54:14.575806,0 days 00:00:01.337618,ReLU,Leaky,,,25,23,20.0,,,0.005585506724363485,2,436,0.33902763077825293,0.00013041557975168323,0.3351151943206787,COMPLETE
300,101.33590668322994,2023-09-04 19:54:14.576108,2023-09-04 19:54:17.016108,0 days 00:00:02.440000,ReLU,Leaky,,,29,24,21.0,,,0.003350894470361195,2,420,0.7086027179947834,9.792517974358038e-05,0.28563833236694336,COMPLETE
301,95.87084493001302,2023-09-04 19:54:17.016597,2023-09-04 19:54:28.981437,0 days 00:00:11.964840,ReLU,ReLU,,,33,24,22.0,,,0.00028076434391466516,2,448,0.7961291589604714,3.9074908199864955e-05,0.30420154333114624,COMPLETE
302,118.4102276217553,2023-09-04 19:54:28.981735,2023-09-04 19:54:30.314284,0 days 00:00:01.332549,ReLU,Leaky,,,31,22,13.0,,,0.002183302320089588,2,412,0.7621297418175044,0.06380136885962819,0.5259754657745361,COMPLETE
303,85.7294670267308,2023-09-04 19:54:30.314571,2023-09-04 19:54:33.090912,0 days 00:00:02.776341,Leaky,Leaky,,,34,23,23.0,,,0.006627200309923217,2,387,0.7284519749439968,0.0014085108938274812,0.2931814193725586,COMPLETE
304,98.38946125119232,2023-09-04 19:54:33.091408,2023-09-04 19:54:34.908222,0 days 00:00:01.816814,ReLU,Leaky,,,35,23,23.0,,,0.00689664438819234,2,384,0.6987919834784099,0.001349954449816146,0.2826281487941742,COMPLETE
305,93.5918810045397,2023-09-04 19:54:34.908534,2023-09-04 19:54:36.231970,0 days 00:00:01.323436,Leaky,Leaky,,,37,23,24.0,,,0.0061682056817103335,2,391,0.7268079332573647,0.0016921944165066284,0.2912580370903015,COMPLETE
306,99.46323127746582,2023-09-04 19:54:36.232284,2023-09-04 19:54:38.318617,0 days 00:00:02.086333,ReLU,Leaky,,,34,24,24.0,,,0.004656181908634709,2,320,0.6624956490085099,0.0012803180405478733,0.31651103496551514,COMPLETE
307,91.24002573441486,2023-09-04 19:54:38.318922,2023-09-04 19:54:40.931065,0 days 00:00:02.612143,Leaky,Leaky,,,27,24,22.0,,,0.004083300706900382,2,405,0.6886720075973075,0.0020226932903135747,0.3088093101978302,COMPLETE
308,97.15685951926491,2023-09-04 19:54:40.931364,2023-09-04 19:54:44.524093,0 days 00:00:03.592729,ReLU,Leaky,,,32,23,23.0,,,0.007783232968626353,2,364,0.7437890085059594,0.002372009642162613,0.34331798553466797,COMPLETE
309,89.74495435442243,2023-09-04 19:54:44.524379,2023-09-04 19:54:46.980265,0 days 00:00:02.455886,Leaky,Leaky,,,30,24,23.0,,,0.0053597138227874245,2,395,0.6271858406606649,0.0015297420407793612,0.33520397543907166,COMPLETE
310,92.01507615845233,2023-09-04 19:54:46.980561,2023-09-04 19:54:55.859945,0 days 00:00:08.879384,ReLU,Leaky,,,34,23,22.0,,,0.00025145448928785277,2,429,0.7129827604586766,0.00039664674592543834,0.31725138425827026,COMPLETE
311,89.19100247896634,2023-09-04 19:54:55.860234,2023-09-04 19:54:57.259353,0 days 00:00:01.399119,Leaky,Leaky,,,23,24,21.0,,,0.009126589014891901,2,442,0.7667711327354263,0.00021029616123556213,0.34584060311317444,COMPLETE
312,102.93077189127604,2023-09-04 19:54:57.259639,2023-09-04 19:54:57.638169,0 days 00:00:00.378530,Leaky,Leaky,,,25,23,21.0,,,0.009155691889552158,2,440,0.11136522691292561,0.0002471877158077488,0.4305972158908844,COMPLETE
313,208.09927972757592,2023-09-04 19:54:57.638474,2023-09-04 19:54:59.098928,0 days 00:00:01.460454,ReLU,Leaky,,,23,24,20.0,,,0.007428014520092886,2,421,0.38480897957409677,0.00017274494849745816,0.3056577146053314,COMPLETE
314,103.06660455386682,2023-09-04 19:54:59.099224,2023-09-04 19:55:19.779903,0 days 00:00:20.680679,Sigmoid,Leaky,,,22,23,21.0,,,0.00018288258674484158,2,379,0.7637523861697144,0.0002365135204614657,0.3857353627681732,COMPLETE
315,91.14969082536369,2023-09-04 19:55:19.780198,2023-09-04 19:55:21.066959,0 days 00:00:01.286761,Leaky,Leaky,,,29,24,20.0,,,0.0092264684060152,2,354,0.7661543883955588,0.00018324620112196007,0.3195928931236267,COMPLETE
316,98.12133192582564,2023-09-04 19:55:21.067252,2023-09-04 19:55:23.090204,0 days 00:00:02.022952,ReLU,Leaky,,,27,23,22.0,,,0.002988670325482431,2,400,0.59538469959391,0.0049307488546439186,0.3122313320636749,COMPLETE
317,171.26917175292968,2023-09-04 19:55:23.090482,2023-09-04 19:55:24.555973,0 days 00:00:01.465491,Leaky,,,,16,24,,,,0.006422191261612732,1,433,0.7997268764917824,0.00014892022254014344,0.32964324951171875,COMPLETE
318,125.89468525731286,2023-09-04 19:55:24.556256,2023-09-04 19:55:26.653355,0 days 00:00:02.097099,ReLU,Leaky,,,24,1,21.0,,,0.0035845478547734204,2,411,0.7374967235213964,0.00020991295956112859,0.5786670446395874,COMPLETE
319,101.0134288778908,2023-09-04 19:55:26.653661,2023-09-04 19:55:36.238945,0 days 00:00:09.585284,Leaky,Leaky,,,31,24,22.0,,,8.80752492870008e-05,2,427,0.41259795431934565,0.007102503445857925,0.39081069827079773,COMPLETE
320,114.33811569213867,2023-09-04 19:55:36.239243,2023-09-04 19:55:37.755638,0 days 00:00:01.516395,ReLU,Leaky,,,28,22,21.0,,,0.004858665332801144,2,442,0.4424814742476522,0.018410764757449488,0.39284271001815796,COMPLETE
321,89.7789552961077,2023-09-04 19:55:37.755940,2023-09-04 19:55:39.868309,0 days 00:00:02.112369,ReLU,Leaky,,,32,23,20.0,,,0.002416963857426663,2,388,0.5585341544998652,0.0036227099227638775,0.2963721752166748,COMPLETE
322,102.18987601143974,2023-09-04 19:55:39.868587,2023-09-04 19:55:40.969586,0 days 00:00:01.100999,Leaky,Leaky,,,20,24,23.0,,,0.012371579441906524,2,414,0.6622145594275322,0.0003084007214174828,0.3170056641101837,COMPLETE
323,109.38524199695122,2023-09-04 19:55:40.969870,2023-09-04 19:55:44.405174,0 days 00:00:03.435304,ReLU,Sigmoid,,,30,23,22.0,,,0.004132210332387872,2,297,0.7445467114910442,0.0012180725641988506,0.292474627494812,COMPLETE
324,109.53897481724836,2023-09-04 19:55:44.405468,2023-09-04 19:55:54.767965,0 days 00:00:10.362497,Leaky,Leaky,,,13,24,21.0,,,0.00018331113364815683,2,434,0.26619828202736356,0.000574091397864203,0.3847528100013733,COMPLETE
325,99.82887770000256,2023-09-04 19:55:54.768257,2023-09-04 19:55:56.142026,0 days 00:00:01.373769,ReLU,Leaky,,,33,22,23.0,,,0.007457864100975997,2,65,0.6827903187315427,0.0018108552765472923,0.30807337164878845,COMPLETE
326,154.42754782399822,2023-09-04 19:55:56.142316,2023-09-04 19:55:56.738372,0 days 00:00:00.596056,Leaky,Leaky,Tanh,Sigmoid,29,23,22.0,6.0,10.0,0.0028242122627485256,4,451,0.10416440477346857,0.0027527391172543062,0.5489994883537292,COMPLETE
327,90.49706609321363,2023-09-04 19:55:56.738675,2023-09-04 19:56:03.061569,0 days 00:00:06.322894,ReLU,ReLU,,,26,24,20.0,,,0.00034674269625435005,2,422,0.7714290570923612,0.00010927276763900383,0.33585748076438904,COMPLETE
328,97.87834488718133,2023-09-04 19:56:03.061868,2023-09-04 19:56:05.499305,0 days 00:00:02.437437,Leaky,Leaky,,,35,23,21.0,,,0.005585839508501114,2,402,0.6468456779688152,0.0010137535926247093,0.29398757219314575,COMPLETE
329,111.49864360018893,2023-09-04 19:56:05.499591,2023-09-04 19:56:22.118285,0 days 00:00:16.618694,ReLU,Leaky,,,32,24,24.0,,,1.1732994330220209e-05,2,444,0.7110468981395761,0.0004385178778366877,0.5034124851226807,COMPLETE
330,119.4354649885477,2023-09-04 19:56:22.118594,2023-09-04 19:56:37.263557,0 days 00:00:15.144963,Leaky,Leaky,,,28,23,22.0,,,1.5004527980733758e-05,2,427,0.6099482891874813,0.001422458031384683,0.42902320623397827,COMPLETE
331,86.89205917046995,2023-09-04 19:56:37.263861,2023-09-04 19:56:41.185895,0 days 00:00:03.922034,ReLU,Leaky,,,15,24,23.0,,,0.0034708213150061343,2,458,0.7996917606714548,0.002209345962270266,0.33691248297691345,COMPLETE
332,97.99932810465495,2023-09-04 19:56:41.186190,2023-09-04 19:56:43.739515,0 days 00:00:02.553325,ReLU,Leaky,,,14,22,23.0,,,0.002908032026018532,2,267,0.796318759320003,0.0021901495375111755,0.3323436975479126,COMPLETE
333,101.99411630630493,2023-09-04 19:56:43.739814,2023-09-04 19:56:45.876195,0 days 00:00:02.136381,ReLU,Leaky,,,17,24,24.0,,,0.0035159400057330997,2,463,0.7382239622308089,0.002879775681270739,0.31614232063293457,COMPLETE
334,89.13021469116211,2023-09-04 19:56:45.876484,2023-09-04 19:56:49.045413,0 days 00:00:03.168929,ReLU,Leaky,,,14,23,23.0,,,0.004443742368287523,2,458,0.49595029224392373,0.00183749683482123,0.3292502462863922,COMPLETE
335,92.14252959357367,2023-09-04 19:56:49.045704,2023-09-04 19:56:50.848444,0 days 00:00:01.802740,ReLU,Leaky,,,15,23,23.0,,,0.004492457395079341,2,457,0.4943396172621618,0.0022843100273073355,0.3324371874332428,COMPLETE
336,89.6423692703247,2023-09-04 19:56:50.848733,2023-09-04 19:56:52.503083,0 days 00:00:01.654350,ReLU,Leaky,,,37,23,24.0,,,0.004258236068965567,2,457,0.5360349561157636,3.206809929199437e-05,0.3372292220592499,COMPLETE
337,111.10283138133862,2023-09-04 19:56:52.503381,2023-09-04 19:56:55.182428,0 days 00:00:02.679047,ReLU,Leaky,,,18,22,23.0,,,0.003477392969295731,2,451,0.5729976994788216,0.001959473472751458,0.3086910545825958,COMPLETE
338,91.34059164864676,2023-09-04 19:56:55.182718,2023-09-04 19:56:57.084448,0 days 00:00:01.901730,ReLU,Leaky,,,12,23,23.0,,,0.004941267345100339,2,378,0.43548678432739285,0.0032424090372197858,0.34823355078697205,COMPLETE
339,108.61433009683651,2023-09-04 19:56:57.084743,2023-09-04 19:57:10.087832,0 days 00:00:13.003089,ReLU,Leaky,,,34,24,23.0,,,0.00021771524257813187,2,465,0.4851732847629523,0.0016409214952243793,0.325284868478775,COMPLETE
340,107.51157772179806,2023-09-04 19:57:10.088145,2023-09-04 19:57:11.277685,0 days 00:00:01.189540,ReLU,Leaky,,,39,24,22.0,,,0.006017821857448663,2,450,0.7714616212049858,0.00416865936880729,0.34892892837524414,COMPLETE
341,100.17909188184909,2023-09-04 19:57:11.277977,2023-09-04 19:57:24.067820,0 days 00:00:12.789843,ReLU,Leaky,,,31,23,24.0,,,0.00011873135362349229,2,436,0.6878187311657645,0.002534650537706804,0.35573190450668335,COMPLETE
342,90.2592887878418,2023-09-04 19:57:24.068114,2023-09-04 19:57:26.147921,0 days 00:00:02.079807,ReLU,Leaky,,,33,23,22.0,,,0.003802858591080622,2,409,0.7365375411779351,0.0007765688313110898,0.27741649746894836,COMPLETE
343,96.73812332153321,2023-09-04 19:57:26.148217,2023-09-04 19:57:29.809737,0 days 00:00:03.661520,ReLU,Leaky,,,16,13,23.0,,,0.004986444797778398,2,392,0.5313138767096532,0.001176534519041138,0.3191451132297516,COMPLETE
344,186.5116725248449,2023-09-04 19:57:29.810229,2023-09-04 19:57:34.055122,0 days 00:00:04.244893,ReLU,Sigmoid,,,42,22,22.0,,,0.0030690018634777615,2,435,0.506658501978314,2.592976694215644e-05,0.30694299936294556,COMPLETE
345,107.34621913258623,2023-09-04 19:57:34.055423,2023-09-04 19:57:36.118758,0 days 00:00:02.063335,ReLU,Leaky,,,35,8,23.0,,,0.0025686506127298014,2,459,0.47268762697509986,0.0006419421161785743,0.35627052187919617,COMPLETE
346,127.35236485799153,2023-09-04 19:57:36.119047,2023-09-04 19:57:37.558542,0 days 00:00:01.439495,ReLU,Leaky,,,30,24,20.0,,,0.0037565259791304847,2,446,0.41584027806743223,0.00035710527440294116,0.32184842228889465,COMPLETE
347,103.08743591308594,2023-09-04 19:57:37.558835,2023-09-04 19:57:39.187515,0 days 00:00:01.628680,ReLU,Leaky,,,32,22,22.0,,,0.0015443570339979422,2,417,0.31283588758103004,7.51335526333403e-05,0.32646435499191284,COMPLETE
348,109.15520922342937,2023-09-04 19:57:39.187811,2023-09-04 19:57:42.590101,0 days 00:00:03.402290,ReLU,Leaky,,,12,24,22.0,,,0.004259611445534181,2,428,0.767599131869875,4.1814701406327926e-05,0.27787888050079346,COMPLETE
349,96.70145225524902,2023-09-04 19:57:42.590397,2023-09-04 19:57:47.152333,0 days 00:00:04.561936,Sigmoid,ReLU,,,30,23,21.0,,,0.0012499645253010348,2,400,0.7969931325446394,0.001855524284173964,0.39762797951698303,COMPLETE
350,98.62102113921067,2023-09-04 19:57:47.152631,2023-09-04 19:57:48.179690,0 days 00:00:01.027059,ReLU,Leaky,,,36,24,19.0,,,0.006334572479811276,2,440,0.707327541666398,0.0005375196118198192,0.3632289171218872,COMPLETE
351,93.13301761333759,2023-09-04 19:57:48.179988,2023-09-04 19:57:51.472686,0 days 00:00:03.292698,ReLU,Leaky,,,33,23,23.0,,,0.0004227582490394328,2,460,0.3979896335164662,0.0022588221682999982,0.34985074400901794,COMPLETE
352,95.18592058602026,2023-09-04 19:57:51.472979,2023-09-04 19:57:53.672014,0 days 00:00:02.199035,ReLU,Leaky,,,28,24,21.0,,,0.0032605700126251986,2,242,0.6216122494996266,0.0009435864820592441,0.3241797387599945,COMPLETE
353,89.03802998860677,2023-09-04 19:57:53.672317,2023-09-04 19:57:55.746441,0 days 00:00:02.074124,ReLU,Leaky,,,14,23,20.0,,,0.005417286254921163,2,447,0.7986546948372686,0.001480767314779916,0.340181827545166,COMPLETE
354,85.41678739848889,2023-09-04 19:57:55.746733,2023-09-04 19:57:57.581381,0 days 00:00:01.834648,ReLU,Leaky,,,38,24,20.0,,,0.005187352965152308,2,428,0.7666426220624893,0.0013293964031836742,0.29841145873069763,COMPLETE
355,118.7887215247521,2023-09-04 19:57:57.581671,2023-09-04 19:57:58.337167,0 days 00:00:00.755496,ReLU,Leaky,,,38,24,19.0,,,0.07872656780121742,2,421,0.7449737944297992,0.001104696298505744,0.4472648799419403,COMPLETE
356,91.07893042470894,2023-09-04 19:57:58.337454,2023-09-04 19:58:00.328422,0 days 00:00:01.990968,ReLU,Leaky,,,40,24,20.0,,,0.002045084038027233,2,412,0.7559306848148154,0.0008094973526711852,0.3468802273273468,COMPLETE
357,84.85794580178182,2023-09-04 19:58:00.328715,2023-09-04 19:58:02.527499,0 days 00:00:02.198784,ReLU,Leaky,,,35,24,20.0,,,0.0024291740966862715,2,431,0.712282612595181,4.6191542117804165e-05,0.28097933530807495,COMPLETE
358,85.92941409024326,2023-09-04 19:58:02.527811,2023-09-04 19:58:04.707419,0 days 00:00:02.179608,ReLU,Leaky,,,34,24,20.0,,,0.002234593510302961,2,433,0.6797428877615864,4.7330783912202955e-05,0.3434300720691681,COMPLETE
359,89.3896168854277,2023-09-04 19:58:04.707718,2023-09-04 19:58:07.192218,0 days 00:00:02.484500,ReLU,Leaky,,,35,24,20.0,,,0.0022361461681310504,2,434,0.7115500476846077,3.387430943522512e-05,0.34029823541641235,COMPLETE
360,98.73116758058397,2023-09-04 19:58:07.192514,2023-09-04 19:58:11.478388,0 days 00:00:04.285874,ReLU,Leaky,,,38,4,19.0,,,0.0024809380303508514,2,428,0.6696394066954694,4.7518236981347396e-05,0.3770308196544647,COMPLETE
361,93.12887673299821,2023-09-04 19:58:11.478687,2023-09-04 19:58:13.320079,0 days 00:00:01.841392,ReLU,Leaky,,,45,24,20.0,,,0.0017100417109547571,2,427,0.7218163212884797,5.143489801733181e-05,0.31160086393356323,COMPLETE
362,96.13176015218099,2023-09-04 19:58:13.320372,2023-09-04 19:58:14.157111,0 days 00:00:00.836739,ReLU,Leaky,,,34,24,20.0,,,0.0027438670484513763,2,434,0.2578126660129104,9.748337423091864e-05,0.38163456320762634,COMPLETE
363,109.27043296813964,2023-09-04 19:58:14.157414,2023-09-04 19:58:15.384241,0 days 00:00:01.226827,ReLU,Leaky,,,31,24,19.0,,,0.0019374441099751177,2,421,0.21052542098457214,0.0013344672701406954,0.3619893491268158,COMPLETE
364,129.36461463903848,2023-09-04 19:58:15.384536,2023-09-04 19:58:20.107577,0 days 00:00:04.723041,ReLU,Leaky,,,36,24,20.0,,,0.0003402746983098744,2,440,0.3034822328197951,6.809509279055802e-05,0.3574914038181305,COMPLETE
365,106.71674390939566,2023-09-04 19:58:20.107878,2023-09-04 19:58:21.063758,0 days 00:00:00.955880,ReLU,Leaky,,,32,24,19.0,,,0.002312374248360538,2,427,0.3313202750273543,7.90466964135817e-05,0.32774755358695984,COMPLETE
366,99.98992361341205,2023-09-04 19:58:21.064061,2023-09-04 19:58:24.061967,0 days 00:00:02.997906,ReLU,Leaky,,,34,17,20.0,,,0.003200889222687409,2,436,0.6917405122039194,0.010766707651300344,0.33105435967445374,COMPLETE
367,103.08513169947679,2023-09-04 19:58:24.062475,2023-09-04 19:58:29.573406,0 days 00:00:05.510931,Sigmoid,Sigmoid,,,29,24,19.0,,,0.0025829320949345798,2,419,0.6401342999029511,3.96320217979965e-05,0.3503662645816803,COMPLETE
368,90.56358746514805,2023-09-04 19:58:29.573705,2023-09-04 19:58:32.053809,0 days 00:00:02.480104,ReLU,Leaky,,,37,23,21.0,,,0.0016118484806169765,2,404,0.7471464920091477,0.00013256719133320725,0.29793503880500793,COMPLETE
369,102.95665228856753,2023-09-04 19:58:32.054106,2023-09-04 19:58:35.352225,0 days 00:00:03.298119,ReLU,Leaky,,,26,5,20.0,,,0.0020774280863102967,2,332,0.7235528524492053,0.0004921869808719024,0.3774041533470154,COMPLETE
370,99.89306790220971,2023-09-04 19:58:35.352517,2023-09-04 19:58:37.615474,0 days 00:00:02.262957,ReLU,Leaky,,,31,24,21.0,,,0.002943818797158179,2,386,0.6662028222926348,0.0010246457309191286,0.30290916562080383,COMPLETE
371,169.82780572454405,2023-09-04 19:58:37.615991,2023-09-04 19:58:55.086366,0 days 00:00:17.470375,ReLU,Leaky,,,34,23,20.0,,,4.423608097964447e-05,2,441,0.7705200156646124,4.9435464585683845e-05,0.332393616437912,COMPLETE
372,93.07772769019718,2023-09-04 19:58:55.086669,2023-09-04 19:58:59.015421,0 days 00:00:03.928752,ReLU,Leaky,,,32,24,21.0,,,0.0013526529319711955,2,416,0.6990950507116064,0.0008928157402255285,0.3089880049228668,COMPLETE
373,92.10178149585992,2023-09-04 19:58:59.015721,2023-09-04 19:59:00.123966,0 days 00:00:01.108245,ReLU,ReLU,,,41,22,22.0,,,0.0035427133112708228,2,429,0.3423699527155442,0.0012742103065011049,0.3391770124435425,COMPLETE
374,79.64667925627336,2023-09-04 19:59:00.124260,2023-09-04 19:59:02.075507,0 days 00:00:01.951247,ReLU,Leaky,,,29,24,21.0,,,0.00691721746449377,2,136,0.7310730148699272,0.00026104622306007884,0.30821532011032104,COMPLETE
375,122.21075241654007,2023-09-04 19:59:02.075803,2023-09-04 19:59:02.862035,0 days 00:00:00.786232,ReLU,Leaky,,,27,24,21.0,,,0.007425979179124178,2,115,0.4524536756749756,0.000386698203922836,0.3129144012928009,COMPLETE
376,124.22453059706577,2023-09-04 19:59:02.862327,2023-09-04 19:59:04.324240,0 days 00:00:01.461913,ReLU,,,,29,23,,,,0.00626863531426466,1,138,0.73867984960447,0.00031909809531968295,0.3778859078884125,COMPLETE
377,91.33205695774244,2023-09-04 19:59:04.324525,2023-09-04 19:59:06.645532,0 days 00:00:02.321007,ReLU,Leaky,,,25,24,21.0,,,0.005518324370083627,2,103,0.7686069174732544,0.0002572388577219631,0.3066833019256592,COMPLETE
378,91.6580113949983,2023-09-04 19:59:06.645884,2023-09-04 19:59:08.533247,0 days 00:00:01.887363,ReLU,Leaky,,,30,24,22.0,,,0.006741064340409502,2,148,0.7244304297093809,0.0003018170424010572,0.2712118625640869,COMPLETE
379,108.72637631030793,2023-09-04 19:59:08.533544,2023-09-04 19:59:09.231155,0 days 00:00:00.697611,ReLU,Leaky,,,28,23,20.0,,,0.003928120098805753,2,52,0.23033547677325128,0.00021364412311474456,0.3393194079399109,COMPLETE
380,91.5267696051762,2023-09-04 19:59:09.231451,2023-09-04 19:59:18.817692,0 days 00:00:09.586241,ReLU,Leaky,,,33,23,21.0,,,0.0002306321497527748,2,450,0.799714753344312,0.0006825851492949232,0.34124964475631714,COMPLETE
381,106.21063468569801,2023-09-04 19:59:18.817987,2023-09-04 19:59:20.411590,0 days 00:00:01.593603,ReLU,Leaky,,,35,24,22.0,,,0.007439154285752914,2,71,0.7514315080922245,6.356911274532614e-05,0.29437872767448425,COMPLETE
382,114.8855787765148,2023-09-04 19:59:20.411902,2023-09-04 19:59:21.114675,0 days 00:00:00.702773,ReLU,Leaky,,,31,24,19.0,,,0.005090063774877113,2,440,0.280274759200064,0.00015585112128246845,0.34881460666656494,COMPLETE
383,104.7953079737974,2023-09-04 19:59:21.114969,2023-09-04 19:59:22.237439,0 days 00:00:01.122470,ReLU,Leaky,,,27,23,20.0,,,0.0033335532264545543,2,435,0.19599581483597062,3.3924414296272455e-05,0.3552131652832031,COMPLETE
384,90.64295220562792,2023-09-04 19:59:22.237739,2023-09-04 19:59:30.320142,0 days 00:00:08.082403,ReLU,Leaky,,,39,24,21.0,,,0.00039737723110323,2,312,0.70145575438472,9.316845649837743e-05,0.319546639919281,COMPLETE
385,133.61143419219226,2023-09-04 19:59:30.320441,2023-09-04 19:59:31.150185,0 days 00:00:00.829744,ReLU,Leaky,,,30,22,12.0,,,0.0026311686509778317,2,162,0.16671406074118753,0.00028244765636306455,0.36740919947624207,COMPLETE
