number,value,datetime_start,datetime_complete,duration,params_activation1,params_activation2,params_activation3,params_activation4,params_batch_size,params_fl1,params_fl2,params_fl3,params_fl4,params_learning_rate,params_n_layers,params_num_epochs,params_train_size,params_weight_decay,user_attrs_mre,state
382,0.3465504050254822,2023-09-04 18:26:24.163672,2023-09-04 18:26:26.902285,0 days 00:00:02.738613,Leaky,Sigmoid,,,21,23,24.0,,,0.009396974452627048,2,321,0.6786069781840142,9.138924175605448e-05,828.2703546377329,COMPLETE
383,0.3228118419647217,2023-09-04 18:26:26.902597,2023-09-04 18:26:31.334941,0 days 00:00:04.432344,ReLU,Sigmoid,,,66,24,23.0,,,0.0047281497225239435,2,309,0.7050836620077533,0.00011034099554891957,181.00215584891183,COMPLETE
384,0.3434717059135437,2023-09-04 18:26:31.335341,2023-09-04 18:26:32.163623,0 days 00:00:00.828282,ReLU,Sigmoid,,,22,23,23.0,,,0.012033971718896235,2,311,0.28283798186337283,0.00014187261420425825,174.5868852403429,COMPLETE
385,0.49787041544914246,2023-09-04 18:26:32.163949,2023-09-04 18:26:35.885598,0 days 00:00:03.721649,ReLU,Sigmoid,,,17,24,2.0,,,0.006328319167692739,2,284,0.7172354313920803,0.00011978134442810916,238.49420629228865,COMPLETE
386,0.32362204790115356,2023-09-04 18:26:35.885904,2023-09-04 18:26:39.758354,0 days 00:00:03.872450,ReLU,Sigmoid,,,19,23,24.0,,,0.007908477948970398,2,288,0.6280934008852307,8.784248561165254e-05,978.6292399088542,COMPLETE
387,0.6424819827079773,2023-09-04 18:26:39.758676,2023-09-04 18:26:48.844852,0 days 00:00:09.086176,Sigmoid,Sigmoid,,,13,23,24.0,,,2.3733094005088488e-05,2,307,0.25121024706827616,0.0005120952148082026,127.40670386199454,COMPLETE
388,0.32336682081222534,2023-09-04 18:26:48.845183,2023-09-04 18:26:54.246684,0 days 00:00:05.401501,ReLU,Sigmoid,,,23,24,23.0,,,0.005286651977078732,2,317,0.6696801621341236,0.00010424613446796517,161.63604354858398,COMPLETE
389,0.3770730197429657,2023-09-04 18:26:54.247004,2023-09-04 18:26:55.327192,0 days 00:00:01.080188,ReLU,Sigmoid,,,25,24,24.0,,,0.006764877649755885,2,335,0.22054494855920456,0.00013588945089651138,147.43543417794365,COMPLETE
390,0.40446972846984863,2023-09-04 18:26:55.327507,2023-09-04 18:26:55.968463,0 days 00:00:00.640956,ReLU,Sigmoid,,,20,23,23.0,,,0.009942402623061883,2,330,0.16255534772364508,0.0007871791866310473,205.84982638888889,COMPLETE
391,0.3257259130477905,2023-09-04 18:26:55.968772,2023-09-04 18:26:58.810652,0 days 00:00:02.841880,ReLU,ReLU,,,17,22,24.0,,,0.00858398313957299,2,270,0.6033444455825469,6.899227678866082e-05,155.74065294452743,COMPLETE
392,0.3322795331478119,2023-09-04 18:26:58.810982,2023-09-04 18:27:02.110407,0 days 00:00:03.299425,ReLU,Sigmoid,,,15,24,23.0,,,0.004677256356402993,2,322,0.5283359648646617,0.0001586585590188041,148.64704432252978,COMPLETE
393,0.3180367052555084,2023-09-04 18:27:02.110737,2023-09-04 18:27:04.861656,0 days 00:00:02.750919,ReLU,Sigmoid,,,23,24,24.0,,,0.006042531233592823,2,328,0.7069134161797926,0.00017984882463336778,191.0511940850152,COMPLETE
394,0.30111730098724365,2023-09-04 18:27:04.861977,2023-09-04 18:27:09.219102,0 days 00:00:04.357125,ReLU,Sigmoid,,,20,23,14.0,,,0.0075589007465807,2,340,0.7702237175752853,8.559053885634095e-05,280.4430661882673,COMPLETE
395,0.35297858715057373,2023-09-04 18:27:09.219408,2023-09-04 18:27:11.408405,0 days 00:00:02.188997,ReLU,Sigmoid,,,18,22,14.0,,,0.007804311957558101,2,340,0.765216132319281,8.762895633448923e-05,163.68966436386108,COMPLETE
396,0.39759311079978943,2023-09-04 18:27:11.408714,2023-09-04 18:27:12.085762,0 days 00:00:00.677048,ReLU,Sigmoid,,,65,23,12.0,,,0.01054734620375531,2,344,0.23778061734957293,5.866886638627655e-05,177.9203939998851,COMPLETE
397,0.3606574237346649,2023-09-04 18:27:12.086302,2023-09-04 18:27:14.685340,0 days 00:00:02.599038,ReLU,Sigmoid,,,62,22,23.0,,,0.003998225833449124,2,331,0.32866925162877536,7.407171760640892e-05,283.0989036886101,COMPLETE
398,0.3985629081726074,2023-09-04 18:27:14.685667,2023-09-04 18:27:15.759505,0 days 00:00:01.073838,ReLU,,,,25,23,,,,0.008344480402413135,1,348,0.5786502560421359,0.00012072934511470313,175.10706463982078,COMPLETE
399,0.569107174873352,2023-09-04 18:27:15.759813,2023-09-04 18:27:17.145982,0 days 00:00:01.386169,Sigmoid,Sigmoid,,,22,22,23.0,,,0.012201906369860682,2,338,0.3648882233761352,0.003724832832278888,198.782021484375,COMPLETE
400,0.34505510330200195,2023-09-04 18:27:17.146307,2023-09-04 18:27:35.291773,0 days 00:00:18.145466,ReLU,Sigmoid,,,13,21,6.0,,,0.0008568554170761666,2,352,0.7714880935713444,5.06948617622451e-05,313.1317807365866,COMPLETE
401,0.32771173119544983,2023-09-04 18:27:35.292080,2023-09-04 18:27:39.521776,0 days 00:00:04.229696,ReLU,Sigmoid,,,59,23,8.0,,,0.00315222194297579,2,342,0.7740322830891246,0.00020725980286528112,193.29762649536133,COMPLETE
402,0.33667394518852234,2023-09-04 18:27:39.522091,2023-09-04 18:27:41.350183,0 days 00:00:01.828092,ReLU,Sigmoid,,,67,21,13.0,,,0.005147958146015003,2,313,0.4488708973085656,7.96922046941297e-05,176.0455279951336,COMPLETE
403,0.36607950925827026,2023-09-04 18:27:41.350495,2023-09-04 18:27:45.354981,0 days 00:00:04.004486,ReLU,Sigmoid,,,21,7,24.0,,,0.007177002322401366,2,126,0.5424214061238046,0.0006336581271080059,171.51268467150237,COMPLETE
404,0.33113864064216614,2023-09-04 18:27:45.355478,2023-09-04 18:27:49.099747,0 days 00:00:03.744269,ReLU,Sigmoid,,,64,23,23.0,,,0.004456563915462261,2,350,0.7986743113130204,0.00013818112924200154,167.19573241241218,COMPLETE
405,0.3449844419956207,2023-09-04 18:27:49.100043,2023-09-04 18:27:50.930738,0 days 00:00:01.830695,Leaky,Sigmoid,Leaky,,19,22,24.0,8.0,,0.014083228497307435,3,326,0.739122783812057,0.0004370304411718247,175.0403289794922,COMPLETE
406,0.3428977429866791,2023-09-04 18:27:50.931256,2023-09-04 18:27:53.688157,0 days 00:00:02.756901,ReLU,Sigmoid,,,15,18,23.0,,,0.0095881856767748,2,334,0.758819263905748,0.00010259896357397294,148.81155811656606,COMPLETE
407,0.4361661672592163,2023-09-04 18:27:53.688558,2023-09-04 18:27:54.519523,0 days 00:00:00.830965,ReLU,Sigmoid,,,24,22,24.0,,,0.0055202842211565,2,356,0.21014760995597265,6.059600599000482e-05,461.93296691894534,COMPLETE
408,0.3270416557788849,2023-09-04 18:27:54.519888,2023-09-04 18:27:56.303460,0 days 00:00:01.783572,ReLU,Sigmoid,,,61,23,10.0,,,0.007015461263208079,2,344,0.6916748082719941,2.9624137219322977e-05,320.1621852201574,COMPLETE
409,0.3611503541469574,2023-09-04 18:27:56.303797,2023-09-04 18:27:57.808514,0 days 00:00:01.504717,ReLU,ReLU,,,18,20,23.0,,,0.003494661960010228,2,361,0.5588677207234631,0.0003260775420251493,178.21394926926186,COMPLETE
410,0.34678927063941956,2023-09-04 18:27:57.808831,2023-09-04 18:28:00.628857,0 days 00:00:02.820026,ReLU,Sigmoid,,,20,21,24.0,,,0.0060015491067718545,2,367,0.4799706437745509,4.477727112575742e-05,153.70924246651785,COMPLETE
411,0.32846692204475403,2023-09-04 18:28:00.629191,2023-09-04 18:28:52.977015,0 days 00:00:52.347824,ReLU,Sigmoid,,,22,19,15.0,,,0.0006652662185722601,2,352,0.7241578148276007,6.773657973357041e-05,169.329680074345,COMPLETE
412,0.6516948938369751,2023-09-04 18:28:52.977573,2023-09-04 18:28:58.316541,0 days 00:00:05.338968,Sigmoid,Sigmoid,,,16,18,23.0,,,0.00013114666717248103,2,89,0.1967112331709094,0.00010995105643973756,134.55439072512507,COMPLETE
413,0.321338951587677,2023-09-04 18:28:58.317101,2023-09-04 18:29:06.017805,0 days 00:00:07.700704,ReLU,Sigmoid,,,26,24,17.0,,,0.007799061059394221,2,338,0.6494438528093603,2.4751801307395336e-05,540.588921101888,COMPLETE
414,0.5447099208831787,2023-09-04 18:29:06.018352,2023-09-04 18:29:10.850082,0 days 00:00:04.831730,ReLU,Sigmoid,,,63,17,24.0,,,0.000282466235696773,2,62,0.7730326681578937,3.556594267514651e-05,264.8135289838237,COMPLETE
415,0.3589032292366028,2023-09-04 18:29:10.850627,2023-09-04 18:29:18.498243,0 days 00:00:07.647616,ReLU,Sigmoid,,,12,23,24.0,,,0.004439738017314164,2,323,0.32007253290844645,8.69776809845503e-05,316.1697877977715,COMPLETE
416,0.35876500606536865,2023-09-04 18:29:18.498780,2023-09-04 18:29:46.901057,0 days 00:00:28.402277,ReLU,Sigmoid,,,60,18,15.0,,,0.0005929370401348876,2,376,0.7385726957927721,0.00017104413941883157,165.9059954095394,COMPLETE
417,0.3762392997741699,2023-09-04 18:29:46.901595,2023-09-04 18:29:49.279921,0 days 00:00:02.378326,ReLU,Sigmoid,,,23,21,23.0,,,0.010912276479292797,2,361,0.23591599037980399,1.7564857219777925e-05,155.33926010131836,COMPLETE
418,0.359794944524765,2023-09-04 18:29:49.280472,2023-09-04 18:30:03.465105,0 days 00:00:14.184633,ReLU,Sigmoid,,,18,22,24.0,,,0.0028151730351376816,2,347,0.6750255817305505,0.0009175493396697016,309.7112546089368,COMPLETE
419,0.35230353474617004,2023-09-04 18:30:03.465641,2023-09-04 18:30:58.875214,0 days 00:00:55.409573,ReLU,Sigmoid,,,21,19,23.0,,,0.00042289727356672135,2,371,0.799849914913997,0.00012801279019402048,175.76845031635528,COMPLETE
420,0.3386143445968628,2023-09-04 18:30:58.875774,2023-09-04 18:31:05.157347,0 days 00:00:06.281573,ReLU,Sigmoid,,,58,20,23.0,,,0.0090891828356852,2,356,0.7042247000192113,0.00025937830566618247,203.41724977039155,COMPLETE
421,0.3468984067440033,2023-09-04 18:31:05.157902,2023-09-04 18:31:08.099809,0 days 00:00:02.941907,ReLU,Sigmoid,,,65,17,17.0,,,0.006117472500740555,2,332,0.4404107091899052,2.1806739814781242e-05,244.8068634957978,COMPLETE
422,0.5505149960517883,2023-09-04 18:31:08.100370,2023-09-04 18:31:21.877209,0 days 00:00:13.776839,ReLU,Sigmoid,,,62,24,24.0,,,0.0005411464067130182,2,383,0.3599048358541196,0.012588221934446392,263.54777741939466,COMPLETE
423,0.3631579279899597,2023-09-04 18:31:21.877761,2023-09-04 18:31:31.992059,0 days 00:00:10.114298,ReLU,Sigmoid,,,14,18,24.0,,,0.00377643878120348,2,410,0.3995069920352537,5.1098342148541586e-05,160.8356103515625,COMPLETE
424,0.35798197984695435,2023-09-04 18:31:31.992624,2023-09-04 18:31:44.455985,0 days 00:00:12.463361,Sigmoid,Sigmoid,,,34,21,23.0,,,0.005221390065212606,2,426,0.7525800746781924,9.432468547281152e-05,174.23540678478423,COMPLETE
425,0.344135046005249,2023-09-04 18:31:44.456535,2023-09-04 18:31:53.578088,0 days 00:00:09.121553,ReLU,Sigmoid,,,25,23,24.0,,,0.00716922505180927,2,364,0.7192936020928832,0.00020745849002709536,286.06981363604143,COMPLETE
426,0.3206283152103424,2023-09-04 18:31:53.578638,2023-09-04 18:32:07.257073,0 days 00:00:13.678435,ReLU,Sigmoid,,,16,24,16.0,,,0.008737097642866076,2,306,0.7654531121351846,1.520897732598763e-05,285.8977767944336,COMPLETE
427,0.35262084007263184,2023-09-04 18:32:07.257630,2023-09-04 18:32:14.757263,0 days 00:00:07.499633,ReLU,ReLU,,,20,22,24.0,,,0.014574820807120538,2,346,0.6295054090027757,0.00037029323139508045,450.9185485839844,COMPLETE
428,0.3529113531112671,2023-09-04 18:32:14.757832,2023-09-04 18:33:03.039046,0 days 00:00:48.281214,ReLU,Sigmoid,,,27,17,23.0,,,0.00033613077645066507,2,375,0.6806984955646023,0.00014531960280794894,157.91572056070964,COMPLETE
429,0.33280646800994873,2023-09-04 18:33:03.039599,2023-09-04 18:33:11.172629,0 days 00:00:08.133030,ReLU,Sigmoid,,,29,20,24.0,,,0.004871871566615615,2,356,0.46188159093499365,7.502480745415077e-05,5379.255466736469,COMPLETE
430,0.36944594979286194,2023-09-04 18:33:11.173187,2023-09-04 18:34:05.232633,0 days 00:00:54.059446,ReLU,Leaky,,,23,18,24.0,,,0.00017299206681258372,2,340,0.7318342716293503,4.1628333186442644e-05,152.56986440770766,COMPLETE
431,0.42170602083206177,2023-09-04 18:34:05.233178,2023-09-04 18:34:11.082645,0 days 00:00:05.849467,ReLU,Sigmoid,,,68,23,23.0,,,0.0024362958331504135,2,319,0.18076752458135126,0.001553695302014124,170.52158487254175,COMPLETE
432,0.3544955551624298,2023-09-04 18:34:11.083192,2023-09-04 18:34:16.024852,0 days 00:00:04.941660,Leaky,Sigmoid,,,18,19,24.0,,,0.01936378731689266,2,400,0.5025117603584425,2.7786763094241345e-05,173.37303712632922,COMPLETE
433,0.35783180594444275,2023-09-04 18:34:16.025412,2023-09-04 18:34:18.245586,0 days 00:00:02.220174,ReLU,Leaky,,,41,22,23.0,,,0.011229970570259644,2,369,0.28143928363749504,1.2004407388673103e-05,156.03435197310014,COMPLETE
434,0.32260453701019287,2023-09-04 18:34:18.246153,2023-09-04 18:34:24.616684,0 days 00:00:06.370531,ReLU,Sigmoid,,,59,24,24.0,,,0.006283314483699259,2,382,0.7694641525809254,0.00011712773054186847,161.8948111232323,COMPLETE
435,0.3160974681377411,2023-09-04 18:34:24.617322,2023-09-04 18:34:43.552740,0 days 00:00:18.935418,ReLU,Sigmoid,,,20,17,23.0,,,0.0031095706978276866,2,330,0.7043096842895686,5.754693584896071e-05,148.2510446721857,COMPLETE
436,0.4098021388053894,2023-09-04 18:34:43.553301,2023-09-04 18:34:51.974564,0 days 00:00:08.421263,ReLU,Sigmoid,,,61,5,14.0,,,0.004195584365419522,2,354,0.7972043432240651,1.894445534614426e-05,284.7291607084728,COMPLETE
437,0.32502424716949463,2023-09-04 18:34:51.975112,2023-09-04 18:34:55.911167,0 days 00:00:03.936055,ReLU,Leaky,,,55,19,24.0,,,0.007585716820383552,2,368,0.6510383565167815,3.330388214228714e-05,206.10896725124783,COMPLETE
438,0.4230872094631195,2023-09-04 18:34:55.911742,2023-09-04 18:35:25.716262,0 days 00:00:29.804520,Sigmoid,Sigmoid,,,17,21,23.0,,,0.0008938178734014599,2,344,0.304587533219064,8.58153634995081e-05,152.62157721852148,COMPLETE
439,0.3851204812526703,2023-09-04 18:35:25.716822,2023-09-04 18:35:31.426198,0 days 00:00:05.709376,ReLU,Sigmoid,,,10,18,24.0,,,0.005778222437659662,2,363,0.26800112790064323,6.72512221933045e-05,280.1930157205333,COMPLETE
440,0.31979864835739136,2023-09-04 18:35:31.426766,2023-09-04 18:35:52.911287,0 days 00:00:21.484521,ReLU,Sigmoid,,,22,17,22.0,,,0.0016728285661325166,2,381,0.7492017782419944,0.00010998442635229346,255.0902057557594,COMPLETE
441,0.3455796539783478,2023-09-04 18:35:52.911851,2023-09-04 18:35:54.465524,0 days 00:00:01.553673,ReLU,Leaky,,,64,23,23.0,,,0.00915624242852604,2,412,0.38622505535533025,1.3629302165469508e-05,310.07828240645557,COMPLETE
442,0.6036261916160583,2023-09-04 18:35:54.466082,2023-09-04 18:36:20.935044,0 days 00:00:26.468962,ReLU,Sigmoid,,,24,20,24.0,,,2.2466510154931748e-05,2,352,0.3524294059546112,0.008274539455693697,272.25505087592387,COMPLETE
443,0.32531067728996277,2023-09-04 18:36:20.935692,2023-09-04 18:36:29.362275,0 days 00:00:08.426583,ReLU,Sigmoid,,,19,24,24.0,,,0.0070862056933361514,2,302,0.7216156559040632,0.00017355184234659442,579.101917860243,COMPLETE
444,0.3805488049983978,2023-09-04 18:36:29.362839,2023-09-04 18:36:32.181191,0 days 00:00:02.818352,ReLU,Leaky,,,66,21,24.0,,,0.0036888384080322957,2,393,0.29339830967631214,0.0001429833917038183,202.52171079574092,COMPLETE
445,0.3520214259624481,2023-09-04 18:36:32.181757,2023-09-04 18:36:39.472195,0 days 00:00:07.290438,ReLU,Sigmoid,,,15,18,23.0,,,0.005229399253132127,2,335,0.5841418110689012,4.652356373943525e-05,184.3821485470503,COMPLETE
446,0.3304579555988312,2023-09-04 18:36:39.472772,2023-09-04 18:36:51.766493,0 days 00:00:12.293721,ReLU,Sigmoid,,,12,17,22.0,,,0.007917279137353891,2,358,0.7708639216089718,1.717542241022773e-05,233.21677268423684,COMPLETE
447,0.3288128674030304,2023-09-04 18:36:51.767055,2023-09-04 18:37:05.464764,0 days 00:00:13.697709,ReLU,Sigmoid,,,21,23,16.0,,,0.0025144181367449158,2,374,0.6865991290093817,1.024218058704293e-05,250.89767043169806,COMPLETE
448,0.34349602460861206,2023-09-04 18:37:05.465332,2023-09-04 18:37:10.678353,0 days 00:00:05.213021,ReLU,Leaky,,,44,19,23.0,,,0.006328626976476581,2,314,0.7990494396154325,0.0006870573726566617,362.5206628417969,COMPLETE
449,0.36239391565322876,2023-09-04 18:37:10.678938,2023-09-04 18:37:18.553987,0 days 00:00:07.875049,ReLU,Sigmoid,,,57,17,24.0,,,0.004554080179910019,2,364,0.42569939883584323,0.0009692734620530266,198.36088552929107,COMPLETE
450,0.3446179926395416,2023-09-04 18:37:18.554551,2023-09-04 18:37:28.948507,0 days 00:00:10.393956,ReLU,ReLU,,,63,22,23.0,,,0.0010833474059996138,2,387,0.7427297686201083,2.1575919004081486e-05,165.76969812271443,COMPLETE
451,0.39315637946128845,2023-09-04 18:37:28.949065,2023-09-04 18:37:35.353892,0 days 00:00:06.404827,Sigmoid,Sigmoid,,,60,24,24.0,,,0.01103104141130763,2,345,0.666372943911374,0.0008333847922427299,156.31783377605936,COMPLETE
452,0.4005312919616699,2023-09-04 18:37:35.354450,2023-09-04 18:37:40.219360,0 days 00:00:04.864910,ReLU,Sigmoid,,,19,20,24.0,,,0.008729777473190495,2,326,0.3430747851176746,0.0012572083929296182,243.10107563160085,COMPLETE
453,0.3641390800476074,2023-09-04 18:37:40.219925,2023-09-04 18:37:50.022441,0 days 00:00:09.802516,Leaky,Leaky,,,24,16,23.0,,,0.003002370855724565,2,398,0.7206368420318396,9.914610900950761e-05,190.9179666372446,COMPLETE
454,0.3353210687637329,2023-09-04 18:37:50.023017,2023-09-04 18:38:03.529620,0 days 00:00:13.506603,ReLU,Sigmoid,,,17,21,24.0,,,0.005437961881410143,2,351,0.5521748555833986,2.5298737522619224e-05,590.1229255143986,COMPLETE
455,0.3711378872394562,2023-09-04 18:38:03.530186,2023-09-04 18:38:07.929753,0 days 00:00:04.399567,ReLU,Sigmoid,,,22,18,22.0,,,0.05125330807012132,2,377,0.7669544975307114,7.606070675451304e-05,446.7391082763672,COMPLETE
456,0.361985445022583,2023-09-04 18:38:07.930302,2023-09-04 18:39:22.420224,0 days 00:01:14.489922,ReLU,Sigmoid,,,14,23,23.0,,,0.00022293627333644256,2,361,0.6088501614777354,0.0001243550587234534,179.4636221169765,COMPLETE
457,0.4239639639854431,2023-09-04 18:39:22.420809,2023-09-04 18:39:25.915352,0 days 00:00:03.494543,ReLU,,,,26,24,,,,0.00707113845762558,1,340,0.6972975310355028,0.000472634072384572,172.5231237411499,COMPLETE
458,0.39366382360458374,2023-09-04 18:39:25.915939,2023-09-04 18:39:32.229248,0 days 00:00:06.313309,ReLU,Leaky,,,61,11,24.0,,,0.003505818330428044,2,422,0.7415559820918883,5.73614656723239e-05,197.0716269888529,COMPLETE
459,0.5049881935119629,2023-09-04 18:39:32.229865,2023-09-04 18:40:02.846966,0 days 00:00:30.617101,ReLU,Sigmoid,,,67,20,23.0,,,9.257212484380991e-05,2,406,0.7726161370546075,0.0022690780127780914,245.14201144514413,COMPLETE
460,0.32572925090789795,2023-09-04 18:40:02.847559,2023-09-04 18:40:11.256835,0 days 00:00:08.409276,ReLU,Sigmoid,,,20,18,24.0,,,0.0156151932280943,2,385,0.7276837043188812,3.3976828575943786e-05,136.0409987076469,COMPLETE
461,0.459465354681015,2023-09-04 18:40:11.257437,2023-09-04 18:40:16.238612,0 days 00:00:04.981175,ReLU,Sigmoid,,,16,17,7.0,,,0.004531247035066618,2,370,0.12604691785990677,1.5430417442241486e-05,357.9947081066313,COMPLETE
462,0.3810192048549652,2023-09-04 18:40:16.239199,2023-09-04 18:40:18.824764,0 days 00:00:02.585565,ReLU,Leaky,,,21,19,24.0,,,0.006013015297979857,2,352,0.22062854901067866,3.902345835629113e-05,184.31903368361452,COMPLETE
463,0.35303187370300293,2023-09-04 18:40:18.825371,2023-09-04 18:40:23.251897,0 days 00:00:04.426526,ReLU,Sigmoid,,,59,21,23.0,,,0.012046650203373695,2,335,0.7987724982211969,0.0003919981253877431,215.6577881457759,COMPLETE
464,0.7785441875457764,2023-09-04 18:40:23.252478,2023-09-04 18:40:27.579988,0 days 00:00:04.327510,Sigmoid,Sigmoid,ReLU,,62,17,22.0,2.0,,0.009501809584503973,3,372,0.65372718258348,0.00029235489865632106,164.80758461585413,COMPLETE
465,0.37699949741363525,2023-09-04 18:40:27.580586,2023-09-04 18:40:30.311765,0 days 00:00:02.731179,ReLU,Leaky,,,19,22,24.0,,,0.006838829958443564,2,324,0.234125118649241,8.452924505327053e-05,297.5992240018623,COMPLETE
466,0.3635594844818115,2023-09-04 18:40:30.312416,2023-09-04 18:40:37.198041,0 days 00:00:06.885625,ReLU,Sigmoid,,,57,23,11.0,,,0.002377726360351287,2,364,0.49809816786396777,0.00015746210757368822,184.19001110839844,COMPLETE
467,0.5993524789810181,2023-09-04 18:40:37.198665,2023-09-04 18:41:27.673514,0 days 00:00:50.474849,ReLU,Sigmoid,,,24,18,23.0,,,1.0425300440406654e-05,2,346,0.6858633694462634,0.00022290312640778364,805.2092512715069,COMPLETE
468,0.38780975341796875,2023-09-04 18:41:27.674323,2023-09-04 18:41:30.028529,0 days 00:00:02.354206,ReLU,Sigmoid,,,65,16,24.0,,,0.0018505200059692555,2,393,0.20583176210470053,1.179513840706021e-05,145.05072687784832,COMPLETE
469,0.3777460753917694,2023-09-04 18:41:30.028875,2023-09-04 18:41:31.460143,0 days 00:00:01.431268,ReLU,Leaky,,,13,24,23.0,,,0.021199748985617498,2,357,0.4036505640560724,0.00010084348546433969,290.6901181977371,COMPLETE
470,0.36721718311309814,2023-09-04 18:41:31.460489,2023-09-04 18:41:34.900440,0 days 00:00:03.439951,ReLU,Sigmoid,,,53,22,24.0,,,0.0013473326695857843,2,380,0.4741073042719497,0.0006400124277697525,199.28595120789575,COMPLETE
471,0.8328508138656616,2023-09-04 18:41:34.900874,2023-09-04 18:41:35.422083,0 days 00:00:00.521209,ReLU,Sigmoid,,,17,21,24.0,,,0.005265664813076078,2,401,0.24886546738221352,0.039326532615470665,137.70428924560548,COMPLETE
472,0.41366061568260193,2023-09-04 18:41:35.422421,2023-09-04 18:41:37.934059,0 days 00:00:02.511638,ReLU,Sigmoid,,,69,20,23.0,,,0.004087651130026751,2,338,0.7503445424194836,0.0015738217455698892,267.5661042468383,COMPLETE
473,0.35597389936447144,2023-09-04 18:41:37.934412,2023-09-04 18:41:39.797300,0 days 00:00:01.862888,ReLU,Leaky,,,22,17,22.0,,,0.008109936169899712,2,314,0.7072843378161704,1.929507164863825e-05,144.931656108183,COMPLETE
474,0.3653143346309662,2023-09-04 18:41:39.797649,2023-09-04 18:41:42.512847,0 days 00:00:02.715198,ReLU,ReLU,,,26,19,24.0,,,0.0033668137856864423,2,369,0.24174893967905342,0.0005679484745597487,182.60216589819026,COMPLETE
475,0.32365161180496216,2023-09-04 18:41:42.513178,2023-09-04 18:41:45.316000,0 days 00:00:02.802822,Leaky,Sigmoid,,,19,24,23.0,,,0.010063728563941332,2,352,0.6312248616727797,6.52838963919014e-05,191.63431637103741,COMPLETE
476,0.3223530948162079,2023-09-04 18:41:45.316340,2023-09-04 18:41:48.327232,0 days 00:00:03.010892,ReLU,Sigmoid,,,30,23,24.0,,,0.005933629523167525,2,388,0.7607334299176206,0.00019230254770945607,158.75420610832447,COMPLETE
477,0.35963091254234314,2023-09-04 18:41:48.327554,2023-09-04 18:41:51.585818,0 days 00:00:03.258264,Sigmoid,Sigmoid,,,63,18,23.0,,,0.004739376824168841,2,361,0.7323889300587961,5.036462822354635e-05,381.98056238347834,COMPLETE
