number,value,datetime_start,datetime_complete,duration,params_activation1,params_activation2,params_activation3,params_activation4,params_batch_size,params_fl1,params_fl2,params_fl3,params_fl4,params_learning_rate,params_n_layers,params_num_epochs,params_train_size,params_weight_decay,user_attrs_mre,state
453,111.08823160311071,2023-09-04 20:01:17.514722,2023-09-04 20:01:19.824313,0 days 00:00:02.309591,Sigmoid,Sigmoid,Leaky,ReLU,48,7,20.0,17.0,21.0,1.4417337755432503e-05,4,205,0.19483771333863703,0.00845721092183012,1.0118987560272217,COMPLETE
454,154.5184858282315,2023-09-04 20:01:19.824657,2023-09-04 20:01:35.456864,0 days 00:00:15.632207,Tanh,Tanh,Leaky,,45,8,20.0,13.0,,1.1688364155310814e-05,3,431,0.764141482228577,0.0004271723811909797,0.5268049240112305,COMPLETE
455,91.77959242321197,2023-09-04 20:01:35.457205,2023-09-04 20:01:36.001626,0 days 00:00:00.544421,Leaky,Sigmoid,Sigmoid,Leaky,47,16,20.0,15.0,21.0,1.7053070170103256e-05,4,192,0.21142867818205208,0.005706994338398213,0.9674798846244812,COMPLETE
456,117.82747650146484,2023-09-04 20:01:36.001968,2023-09-04 20:01:38.210307,0 days 00:00:02.208339,Leaky,Sigmoid,Sigmoid,Leaky,49,9,20.0,14.0,10.0,1.974518642149007e-05,4,192,0.21239248371717634,0.0063942705246975914,0.9673451781272888,COMPLETE
457,169.8310426565317,2023-09-04 20:01:38.210648,2023-09-04 20:01:38.579778,0 days 00:00:00.369130,Tanh,Sigmoid,Sigmoid,Leaky,44,15,20.0,22.0,20.0,0.004684963895841949,4,484,0.20156467325299185,0.005132838280942372,0.6552405953407288,COMPLETE
458,105.89492356149773,2023-09-04 20:01:38.580121,2023-09-04 20:01:40.470813,0 days 00:00:01.890692,Leaky,Tanh,Sigmoid,,52,18,19.0,15.0,,2.45967076687712e-05,3,190,0.2085519969252527,9.440714041507515e-05,0.8592468500137329,COMPLETE
459,104.60696658095873,2023-09-04 20:01:40.471145,2023-09-04 20:01:42.314535,0 days 00:00:01.843390,Leaky,Sigmoid,Sigmoid,Leaky,58,14,21.0,14.0,21.0,1.6854591224507484e-05,4,173,0.21769792016519754,0.006084228247843889,0.9884650707244873,COMPLETE
460,102.945790170253,2023-09-04 20:01:42.314870,2023-09-04 20:01:43.327735,0 days 00:00:01.012865,Leaky,Sigmoid,Sigmoid,Leaky,54,7,20.0,15.0,4.0,1.9703049061696896e-05,4,200,0.2233334952995959,0.003149363531694805,0.8802852630615234,COMPLETE
461,104.5240478515625,2023-09-04 20:01:43.328080,2023-09-04 20:01:43.500471,0 days 00:00:00.172391,Leaky,Sigmoid,Sigmoid,Leaky,47,10,22.0,16.0,22.0,2.7706678492745262e-05,4,182,0.19127315804385384,0.005064493337797099,1.0634782314300537,COMPLETE
462,119.42188179847038,2023-09-04 20:01:43.500805,2023-09-04 20:01:44.527048,0 days 00:00:01.026243,Leaky,Tanh,Sigmoid,,50,19,21.0,15.0,,0.0008859263206242021,3,146,0.20640925332142376,0.007882971026721048,0.3809703588485718,COMPLETE
463,137.73744440078735,2023-09-04 20:01:44.527366,2023-09-04 20:01:45.836396,0 days 00:00:01.309030,ReLU,Sigmoid,Leaky,Leaky,81,16,22.0,14.0,5.0,0.0013587836618456277,4,211,0.23214182876871386,0.002333158429747764,0.4346335828304291,COMPLETE
464,108.1575910780165,2023-09-04 20:01:45.836730,2023-09-04 20:01:46.068601,0 days 00:00:00.231871,Leaky,Sigmoid,Sigmoid,Leaky,49,9,20.0,16.0,3.0,0.0007106209782265867,4,198,0.18005482498598088,0.00977345784995182,1.045535683631897,COMPLETE
465,156.49151431389575,2023-09-04 20:01:46.068940,2023-09-04 20:01:47.385210,0 days 00:00:01.316270,Leaky,Tanh,Leaky,,53,10,19.0,14.0,,0.00031918304650488107,3,106,0.2766179381901758,0.004073620403472679,0.4131017327308655,COMPLETE
466,109.83232866780142,2023-09-04 20:01:47.385538,2023-09-04 20:01:53.459779,0 days 00:00:06.074241,Leaky,Sigmoid,Leaky,Leaky,56,15,8.0,15.0,5.0,1.63296506814495e-05,4,178,0.739213130287536,0.001318215172852952,0.8211943507194519,COMPLETE
467,94.12134547965236,2023-09-04 20:01:53.460119,2023-09-04 20:01:56.015060,0 days 00:00:02.554941,Sigmoid,Leaky,Leaky,ReLU,51,14,22.0,21.0,11.0,1.0064197011856204e-05,4,189,0.25026648962474685,0.006538936367250472,1.0720174312591553,COMPLETE
468,106.59841083727385,2023-09-04 20:01:56.015402,2023-09-04 20:01:58.501044,0 days 00:00:02.485642,Sigmoid,Leaky,Leaky,ReLU,51,14,22.0,15.0,11.0,1.0023739413766984e-05,4,190,0.2483213992059575,0.006585869359177187,1.141740083694458,COMPLETE
469,99.97277561310798,2023-09-04 20:01:58.501389,2023-09-04 20:02:00.576498,0 days 00:00:02.075109,Sigmoid,Leaky,Leaky,,55,14,22.0,21.0,,1.4298473483258119e-05,3,186,0.2535995053994629,0.007466202045655959,0.9796876907348633,COMPLETE
470,102.55630384706983,2023-09-04 20:02:00.576841,2023-09-04 20:02:02.067362,0 days 00:00:01.490521,Sigmoid,,,,53,14,,,,2.2394496133824717e-05,1,204,0.23951566173671335,0.0005710375476730273,0.8707646131515503,COMPLETE
471,136.75660412720958,2023-09-04 20:02:02.067684,2023-09-04 20:02:04.787989,0 days 00:00:02.720305,Sigmoid,Leaky,Leaky,ReLU,51,15,23.0,20.0,12.0,1.6818775789347964e-05,4,198,0.2571719035748177,0.009072908040729797,0.9992944598197937,COMPLETE
472,147.29763416007714,2023-09-04 20:02:04.788336,2023-09-04 20:02:12.515993,0 days 00:00:07.727657,Sigmoid,Leaky,Sigmoid,ReLU,53,15,23.0,21.0,10.0,3.8378627378508164e-05,4,216,0.6988205411077867,0.0007604546569425459,0.649167001247406,COMPLETE
473,109.24171455742801,2023-09-04 20:02:12.516335,2023-09-04 20:02:15.175333,0 days 00:00:02.658998,Tanh,Leaky,Leaky,ReLU,50,16,22.0,22.0,9.0,2.877044767159709e-05,4,191,0.24782737074303515,0.00637087941864748,0.6156521439552307,COMPLETE
474,114.58915210274411,2023-09-04 20:02:15.175693,2023-09-04 20:02:21.105146,0 days 00:00:05.929453,Sigmoid,Leaky,Leaky,,48,14,22.0,13.0,,1.4123343985426311e-05,3,331,0.3907566589952961,0.010225464966726617,0.7285333871841431,COMPLETE
475,98.04799733536967,2023-09-04 20:02:21.105485,2023-09-04 20:02:23.881983,0 days 00:00:02.776498,Sigmoid,Leaky,Leaky,ReLU,52,8,21.0,12.0,13.0,2.1309685885046664e-05,4,178,0.2934456061547106,0.0018228261995069243,0.9922860264778137,COMPLETE
476,191.13247348951256,2023-09-04 20:02:23.882325,2023-09-04 20:02:24.209488,0 days 00:00:00.327163,Leaky,Leaky,Leaky,,50,15,23.0,14.0,,0.034479418759755756,3,205,0.27138096329693984,0.00851135917910506,0.42428484559059143,COMPLETE
477,142.57927472663647,2023-09-04 20:02:24.209814,2023-09-04 20:02:26.437682,0 days 00:00:02.227868,Sigmoid,Tanh,Leaky,ReLU,54,16,22.0,22.0,11.0,0.00020176093943922543,4,221,0.23036925338187741,0.012858595008825635,0.6361784934997559,COMPLETE
478,125.08316163093814,2023-09-04 20:02:26.438019,2023-09-04 20:02:28.259651,0 days 00:00:01.821632,ReLU,Tanh,Leaky,ReLU,89,15,21.0,16.0,10.0,1.8443253965548925e-05,4,186,0.26458516491034084,0.004955148934326252,0.7792125344276428,COMPLETE
479,101.35976274364491,2023-09-04 20:02:28.259998,2023-09-04 20:02:30.469844,0 days 00:00:02.209846,Sigmoid,ReLU,Sigmoid,ReLU,56,20,22.0,14.0,8.0,2.5230310693465422e-05,4,197,0.2221221985157127,0.0009276481616014103,0.8517907857894897,COMPLETE
480,100.02346992492676,2023-09-04 20:02:30.470180,2023-09-04 20:02:30.781891,0 days 00:00:00.311711,Sigmoid,Leaky,Leaky,Sigmoid,52,14,23.0,15.0,4.0,0.000493473023011345,4,234,0.43227205818694864,0.09996713854205398,1.2380528450012207,COMPLETE
481,125.71599534841684,2023-09-04 20:02:30.782222,2023-09-04 20:02:34.203283,0 days 00:00:03.421061,Sigmoid,Tanh,,,48,17,21.0,,,1.359037476182948e-05,2,208,0.41719469892649264,0.005861266588049501,0.8967563509941101,COMPLETE
482,116.05394060858364,2023-09-04 20:02:34.203610,2023-09-04 20:02:36.461137,0 days 00:00:02.257527,Sigmoid,Tanh,Leaky,,50,7,22.0,15.0,,3.262819650760478e-05,3,174,0.2803914259772329,0.007351806552886241,0.8027486801147461,COMPLETE
483,117.29583484398391,2023-09-04 20:02:36.461473,2023-09-04 20:02:38.075737,0 days 00:00:01.614264,Tanh,Sigmoid,Leaky,ReLU,79,6,22.0,23.0,11.0,1.5889198839102593e-05,4,167,0.2424324141934306,0.0006956271031524026,0.9440733790397644,COMPLETE
484,96.52705295750353,2023-09-04 20:02:38.076073,2023-09-04 20:02:40.754082,0 days 00:00:02.678009,Sigmoid,Sigmoid,Leaky,ReLU,59,4,21.0,16.0,12.0,1.2237444100626538e-05,4,183,0.3048264915989892,0.012077660754893516,1.1337684392929077,COMPLETE
485,158.46298661950516,2023-09-04 20:02:40.754424,2023-09-04 20:02:43.544508,0 days 00:00:02.790084,Sigmoid,Tanh,Tanh,ReLU,55,15,14.0,23.0,4.0,1.999596101295033e-05,4,194,0.3840456230696264,0.058041576559940626,1.0152240991592407,COMPLETE
486,98.40678617689345,2023-09-04 20:02:43.544848,2023-09-04 20:02:43.841928,0 days 00:00:00.297080,Sigmoid,Sigmoid,Leaky,ReLU,52,19,23.0,15.0,5.0,8.681752899455879e-05,4,212,0.25688539937561244,0.015961035604296202,1.1221164464950562,COMPLETE
487,115.586744011773,2023-09-04 20:02:43.842284,2023-09-04 20:02:46.153607,0 days 00:00:02.311323,Sigmoid,Sigmoid,Leaky,,47,8,22.0,13.0,,9.916742073341056e-05,3,225,0.21361365929549367,0.005611824980262458,0.6136307716369629,COMPLETE
488,3088.027122587316,2023-09-04 20:02:46.153942,2023-09-04 20:02:47.759069,0 days 00:00:01.605127,Sigmoid,Tanh,Sigmoid,Leaky,50,16,23.0,14.0,3.0,1.0060058924492312e-05,4,85,0.3523246726622779,0.000133820579599993,1.187989354133606,COMPLETE
489,101.9241778704585,2023-09-04 20:02:47.759415,2023-09-04 20:02:51.116476,0 days 00:00:03.357061,Sigmoid,Sigmoid,Leaky,ReLU,68,14,21.0,16.0,14.0,2.4527826327548495e-05,4,196,0.4013166539569248,0.001422858683405444,0.9546502828598022,COMPLETE
490,111.26814929258477,2023-09-04 20:02:51.116816,2023-09-04 20:02:53.738809,0 days 00:00:02.621993,Sigmoid,Sigmoid,Leaky,,54,18,21.0,15.0,,1.684318192088618e-05,3,206,0.2935224417114934,0.0021545994216429177,0.9550105333328247,COMPLETE
491,177.413797502687,2023-09-04 20:02:53.739148,2023-09-04 20:02:55.384431,0 days 00:00:01.645283,ReLU,Leaky,Leaky,Sigmoid,73,15,22.0,16.0,5.0,0.00037944628769047466,4,169,0.2341100536359699,0.0029098667580014794,0.5212541818618774,COMPLETE
492,150.31320286845113,2023-09-04 20:02:55.384775,2023-09-04 20:03:00.820940,0 days 00:00:05.436165,Tanh,Tanh,Leaky,Leaky,48,9,12.0,14.0,6.0,1.2079551142964884e-05,4,182,0.5756962104729082,0.007744436078443524,0.6735123991966248,COMPLETE
493,115.27370095252991,2023-09-04 20:03:00.821289,2023-09-04 20:03:02.805227,0 days 00:00:01.983938,Leaky,Sigmoid,Leaky,,89,8,23.0,15.0,,1.003549044038368e-05,3,192,0.329780976170338,0.010313803975977425,1.0976061820983887,COMPLETE
494,159.98299588655172,2023-09-04 20:03:02.805565,2023-09-04 20:03:03.577456,0 days 00:00:00.771891,Sigmoid,Sigmoid,Sigmoid,Leaky,51,7,21.0,16.0,6.0,4.207637773103361e-05,4,200,0.37159978987323555,0.006595470014526643,1.1332985162734985,COMPLETE
495,151.88539382579714,2023-09-04 20:03:03.577794,2023-09-04 20:03:05.499164,0 days 00:00:01.921370,Sigmoid,Tanh,Leaky,,57,14,22.0,15.0,,0.0007457851339882863,3,215,0.20257200198164116,7.432613411602076e-05,0.453525573015213,COMPLETE
496,144.40827457972935,2023-09-04 20:03:05.499504,2023-09-04 20:03:08.359201,0 days 00:00:02.859697,Sigmoid,Sigmoid,Leaky,ReLU,45,16,21.0,13.0,9.0,1.4360433634909427e-05,4,175,0.2809663779159457,0.0037188417229868623,0.9356179237365723,COMPLETE
497,99.68250950993718,2023-09-04 20:03:08.359550,2023-09-04 20:03:10.921891,0 days 00:00:02.562341,Sigmoid,ReLU,Leaky,Leaky,53,6,22.0,14.0,7.0,2.173961666143111e-05,4,185,0.2646130000707452,0.0010823512756860587,0.9562267661094666,COMPLETE
498,135.96245532302382,2023-09-04 20:03:10.922244,2023-09-04 20:03:13.137369,0 days 00:00:02.215125,Sigmoid,Sigmoid,Leaky,ReLU,48,15,21.0,2.0,4.0,3.197217828867279e-05,4,161,0.24517690803313627,0.0004940205080704729,1.1077640056610107,COMPLETE
499,95.02779452006023,2023-09-04 20:03:13.137719,2023-09-04 20:03:13.297419,0 days 00:00:00.159700,Sigmoid,Sigmoid,Leaky,Leaky,81,19,23.0,16.0,8.0,0.0001142315115703762,4,241,0.2232579997856492,0.004645881984101963,0.9223048090934753,COMPLETE
