number,value,datetime_start,datetime_complete,duration,params_activation1,params_activation2,params_activation3,params_activation4,params_batch_size,params_fl1,params_fl2,params_fl3,params_fl4,params_learning_rate,params_n_layers,params_num_epochs,params_train_size,params_weight_decay,user_attrs_mre,state
181,0.33702898025512695,2023-09-04 18:26:47.010868,2023-09-04 18:26:48.054249,0 days 00:00:01.043381,ReLU,Tanh,Tanh,ReLU,48,23,14.0,22.0,13.0,0.005347897946799464,4,200,0.7725275474111166,0.00040492041249914397,101.38568941752116,COMPLETE
182,0.30048516392707825,2023-09-04 18:26:48.054561,2023-09-04 18:26:50.467124,0 days 00:00:02.412563,ReLU,Tanh,Tanh,ReLU,40,20,13.0,21.0,13.0,0.0034363200089124204,4,184,0.71596807171098,0.00021533471523883403,99.34560336706774,COMPLETE
183,0.30863386392593384,2023-09-04 18:26:50.467441,2023-09-04 18:26:53.114599,0 days 00:00:02.647158,ReLU,Tanh,Tanh,ReLU,47,9,15.0,23.0,12.0,0.0044588729796594785,4,165,0.7423381310716535,9.591951537437369e-05,108.15165298704117,COMPLETE
184,0.3059978187084198,2023-09-04 18:26:53.114924,2023-09-04 18:26:58.503001,0 days 00:00:05.388077,ReLU,Tanh,Tanh,ReLU,49,18,2.0,20.0,14.0,0.0006076685370455333,4,271,0.7990248290635098,0.0001245330453036755,94.25857396028479,COMPLETE
185,0.32334816455841064,2023-09-04 18:26:58.503308,2023-09-04 18:27:00.217404,0 days 00:00:01.714096,ReLU,Tanh,Sigmoid,Tanh,58,21,12.0,22.0,11.0,0.006919824984227873,4,190,0.5534919720304923,0.0012764909834148059,142.93707287897828,COMPLETE
186,0.3337547183036804,2023-09-04 18:27:00.217718,2023-09-04 18:27:02.242546,0 days 00:00:02.024828,Leaky,Leaky,Tanh,ReLU,53,19,14.0,23.0,16.0,0.0026924642762123675,4,201,0.7065951000124757,2.2781299763428175e-05,90.68137868245442,COMPLETE
187,0.35354191064834595,2023-09-04 18:27:02.242869,2023-09-04 18:27:04.587227,0 days 00:00:02.344358,Sigmoid,Tanh,Tanh,Leaky,44,12,17.0,21.0,13.0,0.005700131967504283,4,477,0.7711494118320784,5.583575391203833e-05,131.8790963864794,COMPLETE
188,0.29803359508514404,2023-09-04 18:27:04.587551,2023-09-04 18:27:07.143381,0 days 00:00:02.555830,ReLU,Tanh,Sigmoid,ReLU,41,20,16.0,24.0,12.0,0.0031779995297494335,4,177,0.7364053250336021,0.00014879227793771047,108.82185867597472,COMPLETE
189,0.3400084972381592,2023-09-04 18:27:07.143699,2023-09-04 18:27:08.938111,0 days 00:00:01.794412,ReLU,Tanh,Tanh,ReLU,45,21,14.0,20.0,11.0,0.004045178876940119,4,216,0.411458620506252,3.835753329263005e-05,99.71137688865124,COMPLETE
190,0.34637993574142456,2023-09-04 18:27:08.938436,2023-09-04 18:27:10.191707,0 days 00:00:01.253271,ReLU,ReLU,Leaky,ReLU,56,24,13.0,22.0,8.0,0.007936225083853107,4,186,0.6848980580113038,1.8396092271026318e-05,86.56693755255804,COMPLETE
191,0.33665284514427185,2023-09-04 18:27:10.192035,2023-09-04 18:27:12.570871,0 days 00:00:02.378836,ReLU,Tanh,Tanh,ReLU,62,19,12.0,24.0,10.0,0.005087823458864312,4,239,0.7982720367363082,1.534858673577297e-05,123.18597975510818,COMPLETE
192,0.31254494190216064,2023-09-04 18:27:12.571201,2023-09-04 18:27:14.103795,0 days 00:00:01.532594,ReLU,Tanh,Tanh,ReLU,84,18,15.0,24.0,11.0,0.01138475590896204,4,449,0.7993483559347059,2.5872335325079534e-05,91.35481277166629,COMPLETE
193,0.31151843070983887,2023-09-04 18:27:14.104116,2023-09-04 18:27:15.584036,0 days 00:00:01.479920,ReLU,Tanh,Tanh,ReLU,60,19,16.0,23.0,8.0,0.009537251639773318,4,221,0.7547942081511583,1.3551655290763202e-05,163.0701595399438,COMPLETE
194,0.3084466755390167,2023-09-04 18:27:15.584375,2023-09-04 18:27:16.389263,0 days 00:00:00.804888,ReLU,Tanh,Tanh,ReLU,58,19,14.0,24.0,12.0,0.017110574216427473,4,197,0.7686423199575648,3.093997098573667e-05,87.92811729794457,COMPLETE
195,0.3035721480846405,2023-09-04 18:27:16.389591,2023-09-04 18:27:18.816433,0 days 00:00:02.426842,ReLU,Tanh,Tanh,ReLU,65,22,13.0,23.0,7.0,0.006339346366477784,4,205,0.7241596803530381,0.00034495123997895893,88.46799092610676,COMPLETE
196,0.3132122755050659,2023-09-04 18:27:18.816745,2023-09-04 18:27:21.125611,0 days 00:00:02.308866,ReLU,Tanh,Tanh,ReLU,63,18,8.0,22.0,9.0,0.0021578307754105187,4,171,0.746148649963857,2.0244114150371394e-05,100.74778824958248,COMPLETE
197,0.34940460324287415,2023-09-04 18:27:21.125915,2023-09-04 18:27:23.244487,0 days 00:00:02.118572,Tanh,Leaky,Sigmoid,ReLU,47,20,15.0,21.0,10.0,0.003601576439045184,4,234,0.7732732422349878,0.0006127353434768402,94.62192138036092,COMPLETE
198,0.3453311026096344,2023-09-04 18:27:23.244805,2023-09-04 18:27:26.693950,0 days 00:00:03.449145,Sigmoid,Sigmoid,Tanh,Sigmoid,42,17,13.0,24.0,14.0,0.004584941025571862,4,155,0.7997556806562897,1.7252558770309906e-05,146.33791544739628,COMPLETE
199,0.3372759521007538,2023-09-04 18:27:26.694278,2023-09-04 18:27:27.788103,0 days 00:00:01.093825,ReLU,Tanh,Tanh,ReLU,49,18,16.0,23.0,12.0,0.007565241056902078,4,228,0.7131833075422414,2.6102452919351663e-05,98.47925313313802,COMPLETE
200,0.28981658816337585,2023-09-04 18:27:27.788437,2023-09-04 18:27:29.844564,0 days 00:00:02.056127,ReLU,Tanh,Sigmoid,Leaky,53,23,17.0,24.0,13.0,0.002665266770169871,4,253,0.6859162723098071,2.233804771234924e-05,131.67921093532019,COMPLETE
201,0.31276392936706543,2023-09-04 18:27:29.844890,2023-09-04 18:27:32.133544,0 days 00:00:02.288654,ReLU,Tanh,Sigmoid,Leaky,53,23,17.0,24.0,13.0,0.0030175034843190848,4,246,0.6551705765723639,2.266315084575155e-05,97.12334257183653,COMPLETE
202,0.3244059979915619,2023-09-04 18:27:32.133871,2023-09-04 18:27:35.643015,0 days 00:00:03.509144,ReLU,Tanh,Sigmoid,Leaky,55,23,9.0,24.0,13.0,0.0023679284206028603,4,255,0.6862840381192185,1.5884458603044953e-05,122.10550315856933,COMPLETE
203,0.3257477283477783,2023-09-04 18:27:35.643376,2023-09-04 18:27:38.445910,0 days 00:00:02.802534,ReLU,Tanh,Sigmoid,Leaky,51,24,17.0,23.0,11.0,0.0037146092917608267,4,275,0.7416688389025642,3.4737221147454186e-05,99.48494278175244,COMPLETE
204,0.2938579022884369,2023-09-04 18:27:38.446246,2023-09-04 18:27:41.921837,0 days 00:00:03.475591,ReLU,Tanh,Sigmoid,Leaky,44,22,15.0,23.0,14.0,0.002725373561113073,4,184,0.7692283899222973,2.077150476486439e-05,123.45236937640465,COMPLETE
205,0.3545815944671631,2023-09-04 18:27:41.922175,2023-09-04 18:27:42.377641,0 days 00:00:00.455466,ReLU,Tanh,ReLU,ReLU,81,19,18.0,24.0,15.0,0.03647576441556301,4,208,0.5900055091350541,1.2625275854003242e-05,100.27947716963918,COMPLETE
206,0.29810717701911926,2023-09-04 18:27:42.377965,2023-09-04 18:27:43.828671,0 days 00:00:01.450706,ReLU,Tanh,Sigmoid,ReLU,56,20,5.0,20.0,12.0,0.005639620196999794,4,195,0.7180966044388285,0.00015298412572316888,109.71741065979003,COMPLETE
207,0.3846047520637512,2023-09-04 18:27:43.828995,2023-09-04 18:27:44.429609,0 days 00:00:00.600614,ReLU,Tanh,Tanh,ReLU,46,21,16.0,20.0,13.0,0.015171583509062888,4,252,0.3931832007593262,4.301442161195752e-05,114.82715320587158,COMPLETE
208,0.2897184491157532,2023-09-04 18:27:44.429943,2023-09-04 18:27:48.732973,0 days 00:00:04.303030,ReLU,Tanh,Tanh,Leaky,50,23,14.0,22.0,11.0,0.0044277654686226435,4,263,0.7700785228739493,2.8178448700720934e-05,83.9648453394572,COMPLETE
209,0.3009825050830841,2023-09-04 18:27:48.733537,2023-09-04 18:27:54.580090,0 days 00:00:05.846553,ReLU,Tanh,Tanh,Leaky,50,23,14.0,21.0,12.0,0.00449632157921208,4,269,0.6949427002231012,2.9765345833026523e-05,88.91224890488844,COMPLETE
210,0.35426241159439087,2023-09-04 18:27:54.580636,2023-09-04 18:28:00.517276,0 days 00:00:05.936640,Sigmoid,Leaky,Sigmoid,Leaky,48,24,14.0,22.0,11.0,0.0018736928876290726,4,260,0.3702078950062398,0.0001760459515082704,118.89807291314153,COMPLETE
211,0.3344745934009552,2023-09-04 18:28:00.517594,2023-09-04 18:28:01.782323,0 days 00:00:01.264729,ReLU,Tanh,Tanh,Leaky,53,23,14.0,22.0,10.0,0.003380077594944087,4,175,0.4594400308103606,2.4797059373792273e-05,98.97707836444562,COMPLETE
212,0.27891805768013,2023-09-04 18:28:01.782656,2023-09-04 18:28:03.025187,0 days 00:00:01.242531,ReLU,Tanh,Tanh,Leaky,51,23,15.0,23.0,11.0,0.004315023799884025,4,263,0.754661750795266,1.765625072858263e-05,90.60792147728705,COMPLETE
213,0.3323334753513336,2023-09-04 18:28:03.025518,2023-09-04 18:28:05.265561,0 days 00:00:02.240043,ReLU,Tanh,Tanh,Leaky,52,22,15.0,11.0,11.0,0.004144065597977378,4,263,0.747257170434717,1.8886256346195337e-05,88.30473186351635,COMPLETE
214,0.2713538706302643,2023-09-04 18:28:05.266092,2023-09-04 18:28:09.172410,0 days 00:00:03.906318,ReLU,Tanh,Tanh,Leaky,50,23,15.0,23.0,5.0,0.005019952809519398,4,282,0.7657123902375893,2.9920031948318202e-05,77.31257824781464,COMPLETE
215,0.342471718788147,2023-09-04 18:28:09.172739,2023-09-04 18:28:10.575283,0 days 00:00:01.402544,ReLU,Tanh,Tanh,Leaky,50,23,15.0,23.0,5.0,0.00505260817558325,4,277,0.7299985923152578,3.105793457719636e-05,173.33397042410715,COMPLETE
216,0.30339810252189636,2023-09-04 18:28:10.575609,2023-09-04 18:28:11.992247,0 days 00:00:01.416638,ReLU,Tanh,Tanh,Leaky,48,22,16.0,21.0,10.0,0.006034252070116177,4,59,0.7608300461977829,4.68410210490316e-05,99.24441158410275,COMPLETE
217,0.3829185664653778,2023-09-04 18:28:11.992576,2023-09-04 18:28:13.915019,0 days 00:00:01.922443,ReLU,Tanh,Tanh,Leaky,51,23,15.0,22.0,4.0,0.0038667536515407577,4,377,0.672890713467024,2.8068758648076383e-05,117.20542582759151,COMPLETE
218,0.30589282512664795,2023-09-04 18:28:13.915367,2023-09-04 18:28:16.075853,0 days 00:00:02.160486,ReLU,Tanh,Tanh,Leaky,46,22,16.0,23.0,6.0,0.0027673097956543093,4,495,0.7189821178799682,0.00023496335801489064,102.17195215765035,COMPLETE
219,0.29047900438308716,2023-09-04 18:28:16.076172,2023-09-04 18:28:18.682146,0 days 00:00:02.605974,ReLU,Tanh,Sigmoid,Leaky,94,23,16.0,21.0,3.0,0.0048105597971350045,4,287,0.6355627229820412,4.1564104543045076e-05,98.85919859351182,COMPLETE
220,0.30779895186424255,2023-09-04 18:28:18.682682,2023-09-04 18:28:20.478193,0 days 00:00:01.795511,ReLU,Tanh,Tanh,Leaky,43,22,17.0,22.0,11.0,0.003301203192201071,4,160,0.7708985385958333,3.4909573098988886e-05,137.84449791185784,COMPLETE
221,0.28340718150138855,2023-09-04 18:28:20.478513,2023-09-04 18:28:21.744226,0 days 00:00:01.265713,ReLU,Tanh,Tanh,Leaky,54,24,14.0,23.0,12.0,0.0064912421822072176,4,250,0.7741290143569193,2.3033016815214664e-05,90.39340209960938,COMPLETE
222,0.3019673228263855,2023-09-04 18:28:21.744549,2023-09-04 18:28:23.880029,0 days 00:00:02.135480,ReLU,Tanh,Tanh,Leaky,54,24,14.0,23.0,12.0,0.005840535078799186,4,258,0.7423102964556239,2.4327260138864364e-05,92.1127461215906,COMPLETE
223,0.30039697885513306,2023-09-04 18:28:23.880337,2023-09-04 18:28:25.133544,0 days 00:00:01.253207,ReLU,Tanh,Tanh,Leaky,88,24,13.0,23.0,12.0,0.006811702437453501,4,264,0.798336466445938,2.091841051402599e-05,102.57497579401189,COMPLETE
224,0.3317194879055023,2023-09-04 18:28:25.133863,2023-09-04 18:28:26.252620,0 days 00:00:01.118757,ReLU,Tanh,Tanh,Leaky,49,23,15.0,22.0,11.0,0.004257302768800563,4,245,0.5062696921165423,0.00011791527517576194,94.42915344238281,COMPLETE
225,0.37719932198524475,2023-09-04 18:28:26.252937,2023-09-04 18:28:27.434981,0 days 00:00:01.182044,ReLU,Tanh,Tanh,Leaky,45,12,15.0,21.0,12.0,0.005229246944228196,4,279,0.7704621182521353,0.0028360201138843315,101.77812400230995,COMPLETE
226,0.361211359500885,2023-09-04 18:28:27.435302,2023-09-04 18:28:28.655568,0 days 00:00:01.220266,Leaky,,,,52,24,,,,0.0036758623564554795,1,188,0.7028375917506687,1.7500726044578474e-05,98.37286826542446,COMPLETE
227,0.39474570751190186,2023-09-04 18:28:28.655957,2023-09-04 18:28:29.682387,0 days 00:00:01.026430,ReLU,Tanh,Tanh,Leaky,47,23,13.0,23.0,4.0,0.0012521137803662365,4,179,0.11337040597772198,2.842982066272244e-05,125.46920109501592,COMPLETE
228,0.3158568739891052,2023-09-04 18:28:29.682717,2023-09-04 18:28:31.043507,0 days 00:00:01.360790,ReLU,Leaky,Tanh,Tanh,57,10,14.0,19.0,5.0,0.0022925084331303497,4,251,0.5395199962030676,6.966659100418619e-05,144.23701705932618,COMPLETE
229,0.3071528375148773,2023-09-04 18:28:31.043854,2023-09-04 18:28:34.418149,0 days 00:00:03.374295,Sigmoid,Tanh,Sigmoid,Leaky,54,20,15.0,23.0,13.0,0.00307698259376309,4,171,0.7410781484031594,1.4980439176894896e-05,88.72593148906579,COMPLETE
230,0.30369529128074646,2023-09-04 18:28:34.418461,2023-09-04 18:28:36.245929,0 days 00:00:01.827468,ReLU,Tanh,Leaky,ReLU,50,19,14.0,22.0,11.0,0.007118590500850674,4,265,0.7738273314976519,3.529988825230207e-05,87.19839458930784,COMPLETE
231,0.3107217252254486,2023-09-04 18:28:36.246263,2023-09-04 18:28:38.010110,0 days 00:00:01.763847,ReLU,Tanh,Tanh,ReLU,56,24,14.0,24.0,13.0,0.008369469486860433,4,409,0.7726602723676679,2.2689205164875932e-05,88.18707377115885,COMPLETE
232,0.33297455310821533,2023-09-04 18:28:38.010465,2023-09-04 18:28:40.142081,0 days 00:00:02.131616,ReLU,Tanh,Tanh,ReLU,54,24,13.0,24.0,12.0,0.004933368538180002,4,192,0.737874912460209,1.9463699404846006e-05,91.37324192838848,COMPLETE
233,0.29620352387428284,2023-09-04 18:28:40.142424,2023-09-04 18:28:41.697808,0 days 00:00:01.555384,ReLU,Tanh,Tanh,ReLU,58,23,14.0,23.0,13.0,0.006214018670058537,4,240,0.7767456542603024,2.6042668035917714e-05,107.87237827952315,COMPLETE
234,0.31155925989151,2023-09-04 18:28:41.698128,2023-09-04 18:28:43.117485,0 days 00:00:01.419357,ReLU,Tanh,Tanh,ReLU,52,24,15.0,24.0,14.0,0.004077928165143475,4,238,0.7177566485964186,0.00017835480715545202,98.77923047864759,COMPLETE
235,0.3646979331970215,2023-09-04 18:28:43.117812,2023-09-04 18:28:44.838884,0 days 00:00:01.721072,ReLU,ReLU,Tanh,ReLU,42,21,15.0,21.0,12.0,0.00921465732047843,4,252,0.7987455709508826,2.200665275245558e-05,114.51327471051897,COMPLETE
236,0.36681807041168213,2023-09-04 18:28:44.839210,2023-09-04 18:28:45.758204,0 days 00:00:00.918994,ReLU,Tanh,Tanh,Leaky,48,23,16.0,23.0,11.0,0.03197143160582069,4,165,0.7493552401660983,0.000252866167792535,104.86132703508649,COMPLETE
237,0.31182757019996643,2023-09-04 18:28:45.758624,2023-09-04 18:28:47.459687,0 days 00:00:01.701063,ReLU,Tanh,Sigmoid,ReLU,45,24,13.0,24.0,9.0,0.004605269902843213,4,185,0.7073928108395598,5.655895053843784e-05,101.20294803526343,COMPLETE
238,0.313310831785202,2023-09-04 18:28:47.460112,2023-09-04 18:28:50.247383,0 days 00:00:02.787271,Tanh,Tanh,Tanh,ReLU,55,20,14.0,20.0,13.0,0.0028061663869982066,4,199,0.7512289640091081,1.1800759137795345e-05,87.99488627115885,COMPLETE
239,0.36152881383895874,2023-09-04 18:28:50.247814,2023-09-04 18:28:52.231113,0 days 00:00:01.983299,ReLU,Tanh,Tanh,ReLU,50,19,3.0,22.0,12.0,0.005743354618987137,4,219,0.34465949415688063,1.690297461445281e-05,103.1949489886944,COMPLETE
240,0.29000967741012573,2023-09-04 18:28:52.231474,2023-09-04 18:28:53.758737,0 days 00:00:01.527263,ReLU,Tanh,,,44,18,19.0,,,0.003358140807853628,2,181,0.7732418425384605,3.109655330642158e-05,115.98985572483228,COMPLETE
241,0.30442050099372864,2023-09-04 18:28:53.759055,2023-09-04 18:28:56.340193,0 days 00:00:02.581138,ReLU,Tanh,,,44,18,19.0,,,0.003511311826721986,2,178,0.7691406278975857,3.2059118148196236e-05,92.85475158691406,COMPLETE
242,0.44617077708244324,2023-09-04 18:28:56.340504,2023-09-04 18:29:04.156025,0 days 00:00:07.815521,ReLU,Tanh,,,43,17,16.0,,,7.272737168682781e-05,2,191,0.7972712409524036,3.903801918827846e-05,126.44499681882209,COMPLETE
243,0.3063657581806183,2023-09-04 18:29:04.156335,2023-09-04 18:29:06.510152,0 days 00:00:02.353817,ReLU,Tanh,,,47,18,19.0,,,0.00313662986521227,2,178,0.7999127996207978,2.8666469931427884e-05,86.15587143159249,COMPLETE
244,0.2899201512336731,2023-09-04 18:29:06.510470,2023-09-04 18:29:09.046407,0 days 00:00:02.535937,ReLU,Tanh,,,41,18,14.0,,,0.004099790229150135,2,206,0.7355129173155703,2.4420420854763175e-05,86.50631794176604,COMPLETE
245,0.2810983657836914,2023-09-04 18:29:09.046713,2023-09-04 18:29:12.368383,0 days 00:00:03.321670,ReLU,Sigmoid,,,40,18,15.0,,,0.004009654662392391,2,205,0.7269415497259414,8.877404747426817e-05,89.09453285217285,COMPLETE
246,0.43911078572273254,2023-09-04 18:29:12.368699,2023-09-04 18:29:13.348033,0 days 00:00:00.979334,ReLU,Leaky,,,38,18,15.0,,,0.059180765612636646,2,81,0.6728201495007535,8.34922126224243e-05,110.91672134399414,COMPLETE
247,0.3005269169807434,2023-09-04 18:29:13.348333,2023-09-04 18:29:15.945279,0 days 00:00:02.596946,ReLU,Sigmoid,,,41,19,15.0,,,0.004116828171368696,2,212,0.7228316173026155,0.00011649050314018165,90.20514408546158,COMPLETE
248,0.34501683712005615,2023-09-04 18:29:15.945578,2023-09-04 18:29:20.823665,0 days 00:00:04.878087,Sigmoid,Sigmoid,Sigmoid,Leaky,40,18,14.0,21.0,8.0,0.004750036334836565,4,203,0.6949903618653531,4.7644305730732905e-05,167.85076629363738,COMPLETE
249,0.31517836451530457,2023-09-04 18:29:20.823992,2023-09-04 18:29:23.937545,0 days 00:00:03.113553,ReLU,Sigmoid,,,37,17,13.0,,,0.0053638145569986475,2,203,0.7354693321464281,0.00031348117803497967,99.23149738755338,COMPLETE
250,0.40201953053474426,2023-09-04 18:29:23.937842,2023-09-04 18:29:24.718446,0 days 00:00:00.780604,ReLU,Sigmoid,,,41,19,16.0,,,0.09960768558913134,2,195,0.7402158563912062,0.0005628983258908434,124.68294004960494,COMPLETE
251,0.336137056350708,2023-09-04 18:29:24.718745,2023-09-04 18:29:28.135794,0 days 00:00:03.417049,ReLU,Tanh,,,46,17,7.0,,,0.002674121110475722,2,210,0.651518132837336,0.0001412545257140127,117.97745314888333,COMPLETE
252,0.3075484335422516,2023-09-04 18:29:28.136297,2023-09-04 18:29:31.961534,0 days 00:00:03.825237,ReLU,Tanh,ReLU,Leaky,33,19,14.0,21.0,10.0,0.003961944408557785,4,445,0.6951797632736173,2.463651946591932e-05,198.1012431751598,COMPLETE
253,0.33885475993156433,2023-09-04 18:29:31.961853,2023-09-04 18:29:37.104133,0 days 00:00:05.142280,ReLU,Sigmoid,Sigmoid,Sigmoid,43,20,17.0,20.0,6.0,0.0021178676928594506,4,271,0.4953614065454562,0.00021111391681454482,125.79401781405622,COMPLETE
254,0.32061493396759033,2023-09-04 18:29:37.104468,2023-09-04 18:29:38.047209,0 days 00:00:00.942741,ReLU,,,,39,18,,,,0.04232975105280519,1,191,0.7489790239321121,8.958978937207474e-05,128.54972195625305,COMPLETE
255,0.3637654781341553,2023-09-04 18:29:38.047505,2023-09-04 18:29:40.088658,0 days 00:00:02.041153,ReLU,Tanh,Tanh,ReLU,61,22,4.0,22.0,9.0,0.001612310520819692,4,168,0.614016096172998,1.973753879676763e-05,115.10155818773353,COMPLETE
256,0.2854069471359253,2023-09-04 18:29:40.089076,2023-09-04 18:29:42.551678,0 days 00:00:02.462602,Sigmoid,Tanh,Sigmoid,Leaky,42,21,12.0,19.0,11.0,0.02419759519777331,4,204,0.7138148710515289,5.5467090919064496e-05,95.72689569646661,COMPLETE
257,0.4916366636753082,2023-09-04 18:29:42.552005,2023-09-04 18:29:42.847699,0 days 00:00:00.295694,Sigmoid,Leaky,Sigmoid,Leaky,97,21,15.0,20.0,11.0,0.022102425626111002,4,211,0.3016871522732099,5.797071930481046e-05,132.2933464050293,COMPLETE
258,0.36236461997032166,2023-09-04 18:29:42.848038,2023-09-04 18:29:46.040291,0 days 00:00:03.192253,Sigmoid,Tanh,Sigmoid,Leaky,41,22,16.0,19.0,10.0,0.0063403191843629456,4,219,0.7559715914722263,5.17657017459144e-05,114.96320660909016,COMPLETE
259,0.3147391676902771,2023-09-04 18:29:46.040627,2023-09-04 18:29:47.875487,0 days 00:00:01.834860,Sigmoid,Tanh,Sigmoid,Leaky,42,21,15.0,16.0,11.0,0.02390766720575538,4,201,0.731160395320607,4.1741649788367826e-05,104.14920304461224,COMPLETE
260,0.2901519536972046,2023-09-04 18:29:47.875822,2023-09-04 18:29:52.465621,0 days 00:00:04.589799,Sigmoid,Tanh,Sigmoid,Leaky,45,20,16.0,20.0,11.0,0.004119120476750074,4,260,0.7104185032073043,6.591093008395182e-05,104.66410476549537,COMPLETE
261,0.3435925245285034,2023-09-04 18:29:52.465954,2023-09-04 18:29:56.725092,0 days 00:00:04.259138,Sigmoid,Tanh,Sigmoid,Leaky,38,23,15.0,7.0,7.0,0.005050713458589038,4,198,0.4209165157454009,3.703155652615602e-05,103.80004650393859,COMPLETE
262,0.5254075527191162,2023-09-04 18:29:56.725439,2023-09-04 18:29:57.589871,0 days 00:00:00.864432,Sigmoid,Sigmoid,Sigmoid,Leaky,43,22,17.0,19.0,10.0,0.031669133307862335,4,208,0.7717641579709605,0.0003571575483705789,138.75776714748807,COMPLETE
263,0.3179168105125427,2023-09-04 18:29:57.590189,2023-09-04 18:29:58.513336,0 days 00:00:00.923147,Leaky,Tanh,Sigmoid,,46,21,14.0,21.0,,0.026646448972472703,3,223,0.4394670830879835,7.847779047958142e-05,102.10493049621581,COMPLETE
264,0.5634871125221252,2023-09-04 18:29:58.513691,2023-09-04 18:29:59.218475,0 days 00:00:00.704784,ReLU,Tanh,Leaky,Tanh,40,23,12.0,22.0,16.0,0.04986945251501783,4,306,0.7196310325784393,0.00010389726046796418,151.81469399588448,COMPLETE
265,0.3219703733921051,2023-09-04 18:29:59.218803,2023-09-04 18:30:00.994126,0 days 00:00:01.775323,ReLU,ReLU,Tanh,Leaky,59,21,16.0,21.0,12.0,0.007560659013778214,4,186,0.7629375655843517,0.012249822336344512,162.60364731498387,COMPLETE
266,0.3366447687149048,2023-09-04 18:30:00.994454,2023-09-04 18:30:02.527334,0 days 00:00:01.532880,ReLU,Tanh,Tanh,ReLU,42,20,14.0,20.0,14.0,0.003551486702178834,4,244,0.5215589867471389,0.00028580770501664246,94.97116949203166,COMPLETE
267,0.299532026052475,2023-09-04 18:30:02.527657,2023-09-04 18:30:06.712546,0 days 00:00:04.184889,Tanh,Leaky,Sigmoid,ReLU,44,11,15.0,23.0,10.0,0.005680344975378282,4,283,0.6752799896766988,4.3853162058625825e-05,102.4588633107615,COMPLETE
268,0.3564069867134094,2023-09-04 18:30:06.712870,2023-09-04 18:30:09.077499,0 days 00:00:02.364629,ReLU,Tanh,Tanh,Leaky,72,17,14.0,20.0,14.0,0.002688755296609432,4,331,0.7994667290713839,0.00042274289544904075,91.12162268502372,COMPLETE
269,0.525688111782074,2023-09-04 18:30:09.077839,2023-09-04 18:30:10.936846,0 days 00:00:01.859007,ReLU,Tanh,Tanh,ReLU,57,19,11.0,22.0,11.0,0.004542914753758125,4,253,0.7302205396420715,0.01671893551654388,150.91388777190565,COMPLETE
270,0.322022020816803,2023-09-04 18:30:10.937180,2023-09-04 18:30:13.363015,0 days 00:00:02.425835,ReLU,Tanh,Sigmoid,Sigmoid,47,22,6.0,21.0,13.0,0.0065563332781752946,4,365,0.7557445829778344,3.350385561396911e-05,179.3247004726477,COMPLETE
271,0.33323103189468384,2023-09-04 18:30:13.363344,2023-09-04 18:30:15.409222,0 days 00:00:02.045878,Sigmoid,Tanh,Tanh,ReLU,52,14,13.0,24.0,12.0,0.0030370899170216437,4,230,0.23362874127001373,2.498177804833777e-05,112.73549523291649,COMPLETE
