number,value,datetime_start,datetime_complete,duration,params_activation1,params_activation2,params_activation3,params_activation4,params_batch_size,params_fl1,params_fl2,params_fl3,params_fl4,params_learning_rate,params_n_layers,params_num_epochs,params_train_size,params_weight_decay,user_attrs_mre,state
0,0.6264618635177612,2023-09-04 17:54:28.320578,2023-09-04 17:54:29.109216,0 days 00:00:00.788638,ReLU,Leaky,,,56,2,8.0,,,0.014173695150017535,2,407,0.21238876738159537,0.02793773174371925,129.2664797041151,COMPLETE
1,1.002049446105957,2023-09-04 17:54:29.109502,2023-09-04 17:54:31.163244,0 days 00:00:02.053742,ReLU,Tanh,Sigmoid,Sigmoid,10,12,12.0,20.0,12.0,0.0008229572746051517,4,377,0.7410738707676934,0.028782499301591186,101.54548835754395,COMPLETE
2,0.32025599479675293,2023-09-04 17:54:31.163546,2023-09-04 17:54:33.374126,0 days 00:00:02.210580,ReLU,Leaky,,,23,16,19.0,,,0.002717443717771419,2,416,0.5714767431819621,1.1317072356418292e-05,89.40666918484669,COMPLETE
3,0.40417391061782837,2023-09-04 17:54:33.374399,2023-09-04 17:54:35.394464,0 days 00:00:02.020065,Tanh,,,,41,20,,,,0.010214295409593345,1,438,0.5040440489240101,0.006616633690603389,104.46733499687409,COMPLETE
4,0.4035498797893524,2023-09-04 17:54:35.394736,2023-09-04 17:54:35.930765,0 days 00:00:00.536029,Tanh,Sigmoid,,,37,17,8.0,,,0.007459455547109948,2,303,0.12361634474412929,0.0009675682842798658,117.57935738269194,COMPLETE
5,0.318845272064209,2023-09-04 17:54:35.931034,2023-09-04 17:54:36.636652,0 days 00:00:00.705618,ReLU,ReLU,Leaky,Leaky,68,24,19.0,24.0,6.0,0.009139236092749758,4,430,0.6798661141727577,0.0011240940567095483,113.09188493092854,COMPLETE
6,0.41075292229652405,2023-09-04 17:54:36.636957,2023-09-04 17:54:38.523066,0 days 00:00:01.886109,Leaky,Leaky,Tanh,,54,23,5.0,21.0,,0.0015256427991597857,3,383,0.7602772473680889,0.024288373948102238,101.82771394963851,COMPLETE
7,0.35049763321876526,2023-09-04 17:54:38.523390,2023-09-04 17:54:42.422117,0 days 00:00:03.898727,ReLU,Sigmoid,,,41,5,17.0,,,0.003700373207413568,2,391,0.45217068854572506,7.45162615458409e-05,111.75547634657993,COMPLETE
8,0.38266709446907043,2023-09-04 17:54:42.422394,2023-09-04 17:54:43.945613,0 days 00:00:01.523219,ReLU,Tanh,,,50,14,22.0,,,0.0006815646266211669,2,87,0.4439985795880177,1.4619814984015312e-05,130.81048215668778,COMPLETE
9,0.983414351940155,2023-09-04 17:54:43.945885,2023-09-04 17:54:44.243434,0 days 00:00:00.297549,ReLU,Sigmoid,Tanh,,94,1,9.0,4.0,,0.012731835122345506,3,207,0.49299639448331684,0.05785116873868563,100.10075645446777,COMPLETE
10,0.4092974066734314,2023-09-04 17:54:44.243707,2023-09-04 17:54:44.791163,0 days 00:00:00.547456,Sigmoid,ReLU,Leaky,Leaky,79,24,24.0,10.0,1.0,0.09508514303188112,4,256,0.29354249576206776,0.0010474957935356912,129.54107666015625,COMPLETE
11,0.4173739552497864,2023-09-04 17:54:44.791460,2023-09-04 17:55:21.973099,0 days 00:00:37.181639,Sigmoid,,,,13,8,,,,0.00017178600395490926,1,488,0.7795520908763943,1.3055961586285501e-05,120.05836685368273,COMPLETE
12,0.543664813041687,2023-09-04 17:55:21.973367,2023-09-04 17:55:28.200284,0 days 00:00:06.226917,Leaky,Leaky,Leaky,,72,19,18.0,24.0,,1.1451684548600806e-05,3,498,0.324349530674787,0.00020268983058914527,157.80678397488882,COMPLETE
13,0.5054653882980347,2023-09-04 17:55:28.200571,2023-09-04 17:55:29.605449,0 days 00:00:01.404878,ReLU,ReLU,ReLU,ReLU,24,13,18.0,14.0,7.0,0.03921849872371148,4,281,0.5914550191821504,8.75476504716743e-05,118.47740300496419,COMPLETE
14,0.3053988814353943,2023-09-04 17:55:29.605750,2023-09-04 17:55:30.884194,0 days 00:00:01.278444,ReLU,ReLU,Leaky,,70,16,15.0,15.0,,0.0033754209848230713,3,334,0.6077726623707308,0.001323043306782617,111.76371160046807,COMPLETE
15,0.348753958940506,2023-09-04 17:55:30.884474,2023-09-04 17:55:31.538876,0 days 00:00:00.654402,ReLU,ReLU,Leaky,Leaky,72,9,13.0,15.0,21.0,0.03747861252788602,4,327,0.3982322895513091,0.002873660833170962,124.86266659467648,COMPLETE
16,0.3735805153846741,2023-09-04 17:55:31.539163,2023-09-04 17:55:32.557990,0 days 00:00:01.018827,Sigmoid,ReLU,Leaky,,89,21,14.0,8.0,,0.004016855889809504,3,185,0.6090312110152596,0.0006927561878497469,125.81693973181383,COMPLETE
17,0.4829595386981964,2023-09-04 17:55:32.558273,2023-09-04 17:55:39.079648,0 days 00:00:06.521375,Leaky,ReLU,Leaky,Tanh,65,17,21.0,18.0,1.0,0.0004704434522144404,4,351,0.3762711002786645,0.005997506957706417,164.48065452464468,COMPLETE
18,0.3743513822555542,2023-09-04 17:55:39.079937,2023-09-04 17:55:44.258621,0 days 00:00:05.178684,Tanh,ReLU,Sigmoid,,84,21,2.0,23.0,,0.0014339405668083664,3,459,0.6376849921290987,0.0003274705612872734,108.49213145573934,COMPLETE
19,0.4574245810508728,2023-09-04 17:55:44.258897,2023-09-04 17:55:46.345181,0 days 00:00:02.086284,ReLU,ReLU,ReLU,Leaky,98,9,15.0,17.0,22.0,0.00025510813546256406,4,246,0.22530023303269778,0.003021694488569695,344.1258804197234,COMPLETE
20,0.33100447058677673,2023-09-04 17:55:46.345462,2023-09-04 17:55:47.519821,0 days 00:00:01.174359,ReLU,ReLU,Leaky,,64,24,11.0,11.0,,0.005688712290480015,3,118,0.6442814095573526,0.001905020722485103,94.07527176877285,COMPLETE
21,0.30142396688461304,2023-09-04 17:55:47.520094,2023-09-04 17:55:49.173294,0 days 00:00:01.653200,ReLU,Leaky,,,22,16,21.0,,,0.0021498738966434375,2,431,0.5253221591355872,0.0003950669671643476,127.67512603033157,COMPLETE
22,0.38021165132522583,2023-09-04 17:55:49.173566,2023-09-04 17:55:50.392954,0 days 00:00:01.219388,ReLU,,,,63,15,,,,0.0034261718041180113,1,346,0.5386263100766557,0.0005155765262651997,100.48251528856231,COMPLETE
23,0.3057492971420288,2023-09-04 17:55:50.393200,2023-09-04 17:55:52.469376,0 days 00:00:02.076176,ReLU,Leaky,,,76,11,21.0,,,0.0019717424379743155,2,454,0.7963571360808265,0.0002961268654887275,4318.419483531605,COMPLETE
24,0.3395361304283142,2023-09-04 17:55:52.469629,2023-09-04 17:55:54.852082,0 days 00:00:02.382453,ReLU,Leaky,,,80,11,24.0,,,0.001591006098812771,2,462,0.6957047662092823,0.00019784939194169524,98.66355889638265,COMPLETE
25,0.3170705735683441,2023-09-04 17:55:54.852350,2023-09-04 17:55:56.970394,0 days 00:00:02.118044,ReLU,Leaky,,,28,11,21.0,,,0.00216782279904372,2,317,0.529774876378845,0.00036207734594059565,103.10807704925537,COMPLETE
26,0.36216291785240173,2023-09-04 17:55:56.970807,2023-09-04 17:56:08.378035,0 days 00:00:11.407228,Sigmoid,,,,76,18,,,,0.0009504526545237695,1,466,0.7440681560608153,0.00013321760617285422,104.26629013257988,COMPLETE
27,0.3119997978210449,2023-09-04 17:56:08.378281,2023-09-04 17:56:11.502933,0 days 00:00:03.124652,Leaky,Leaky,,,87,6,16.0,,,0.0024309639321961622,2,365,0.7936499637960384,0.00037132829144578307,96.39851900557397,COMPLETE
28,0.5591092705726624,2023-09-04 17:56:11.503196,2023-09-04 17:56:22.825265,0 days 00:00:11.322069,Tanh,Leaky,Sigmoid,,55,14,22.0,1.0,,0.00044676358960040965,3,431,0.594883861541391,5.68186291515926e-05,142.0799058294662,COMPLETE
29,0.4046339988708496,2023-09-04 17:56:22.825534,2023-09-04 17:56:24.585703,0 days 00:00:01.760169,ReLU,,,,48,5,,,,0.01844682942636094,1,408,0.4527364740466208,0.0006001794535900908,112.63997784176388,COMPLETE
30,0.317857950925827,2023-09-04 17:56:24.586117,2023-09-04 17:56:27.154698,0 days 00:00:02.568581,ReLU,Leaky,,,16,15,20.0,,,0.0057517701901439915,2,291,0.36555400163444873,0.0015899984857964094,262.6613765898205,COMPLETE
31,0.3501715660095215,2023-09-04 17:56:27.154959,2023-09-04 17:56:29.292959,0 days 00:00:02.138000,Leaky,Leaky,,,87,6,16.0,,,0.001633032490459804,2,358,0.7946531248306344,0.00034620317340505383,102.39265740778028,COMPLETE
32,0.3520672917366028,2023-09-04 17:56:29.293220,2023-09-04 17:56:30.330157,0 days 00:00:01.036937,Leaky,Leaky,,,94,12,16.0,,,0.0023490864802182413,2,380,0.6998385621439014,0.0005294498795366192,105.10007142184074,COMPLETE
33,0.4059899151325226,2023-09-04 17:56:30.330415,2023-09-04 17:56:33.017078,0 days 00:00:02.686663,Leaky,Tanh,,,60,3,14.0,,,0.004054866349443135,2,406,0.7988690108596513,0.0002023453302941558,135.2105115640043,COMPLETE
34,0.32255977392196655,2023-09-04 17:56:33.017338,2023-09-04 17:56:34.789307,0 days 00:00:01.771969,Leaky,Leaky,Tanh,,72,10,23.0,7.0,,0.0027457580766088053,3,360,0.6471144798247347,0.0008364140696214841,98.34027039377312,COMPLETE
35,0.473376989364624,2023-09-04 17:56:34.789601,2023-09-04 17:56:37.839740,0 days 00:00:03.050139,ReLU,Leaky,,,84,7,11.0,,,0.0010825663025381478,2,445,0.5557821059040876,0.0003517724860812615,192.6855442162716,COMPLETE
36,0.4792773425579071,2023-09-04 17:56:37.840013,2023-09-04 17:56:39.739761,0 days 00:00:01.899748,Tanh,,,,32,3,,,,0.005136817343051474,1,325,0.699391727410778,0.0014198046155311122,136.7251900434494,COMPLETE
37,0.33572492003440857,2023-09-04 17:56:39.740044,2023-09-04 17:56:40.949771,0 days 00:00:01.209727,Leaky,Leaky,,,100,16,17.0,,,0.008299719447961608,2,412,0.5039693334115454,0.0008325805316722861,99.6464445415296,COMPLETE
38,0.32453280687332153,2023-09-04 17:56:40.950027,2023-09-04 17:56:43.820744,0 days 00:00:02.870717,ReLU,Tanh,,,76,13,20.0,,,0.003174605529529505,2,479,0.5853470792699991,0.00014735446093234198,93.71701579307442,COMPLETE
39,0.31446945667266846,2023-09-04 17:56:43.821159,2023-09-04 17:56:46.359075,0 days 00:00:02.537916,ReLU,Leaky,ReLU,,42,18,19.0,14.0,,0.008294480161065553,3,388,0.7067732765979103,0.002423186758424785,102.6898675101144,COMPLETE
40,0.3379333019256592,2023-09-04 17:56:46.359437,2023-09-04 17:56:52.315091,0 days 00:00:05.955654,ReLU,Sigmoid,,,91,16,12.0,,,0.0020870716319761244,2,429,0.6231689721552768,0.0011606048901578881,93.24431810880962,COMPLETE
41,0.3324941396713257,2023-09-04 17:56:52.315348,2023-09-04 17:56:53.219602,0 days 00:00:00.904254,ReLU,Leaky,ReLU,,40,20,19.0,14.0,,0.00814219061329675,3,387,0.7117938555014296,0.0022689243813681405,92.86584437977184,COMPLETE
42,0.32178398966789246,2023-09-04 17:56:53.219873,2023-09-04 17:56:54.806655,0 days 00:00:01.586782,ReLU,Leaky,ReLU,,47,17,18.0,17.0,,0.013087280497465947,3,398,0.6967070517991147,0.005816966849721993,109.11146081012228,COMPLETE
43,0.3283543884754181,2023-09-04 17:56:54.806923,2023-09-04 17:56:56.981876,0 days 00:00:02.174953,ReLU,Leaky,ReLU,,19,18,20.0,10.0,,0.007271426468840329,3,338,0.7999324486925908,0.0033823472124482603,91.09800309401292,COMPLETE
44,0.3374517560005188,2023-09-04 17:56:56.982140,2023-09-04 17:57:00.451923,0 days 00:00:03.469783,ReLU,Leaky,,,33,14,16.0,,,0.0011233598589316203,2,368,0.540864106721537,0.0011901702714207107,114.12361602783203,COMPLETE
45,0.3102231025695801,2023-09-04 17:57:00.452216,2023-09-04 17:57:05.921522,0 days 00:00:05.469306,Sigmoid,Leaky,ReLU,,82,19,22.0,12.0,,0.002707792612202615,3,445,0.6680409151949606,0.001823615594291858,117.72097316709888,COMPLETE
46,0.6141189336776733,2023-09-04 17:57:05.921952,2023-09-04 17:57:09.339373,0 days 00:00:03.417421,Sigmoid,Sigmoid,,,69,21,22.0,,,0.002547275528016397,2,440,0.660993211392401,0.012460324626736586,139.4104528550978,COMPLETE
47,0.366078644990921,2023-09-04 17:57:09.339635,2023-09-04 17:57:11.971411,0 days 00:00:02.631776,Sigmoid,Tanh,ReLU,,80,19,23.0,5.0,,0.00501143774615964,3,494,0.46376277350873873,0.0007042950527241097,121.78033998277452,COMPLETE
48,0.42783477902412415,2023-09-04 17:57:11.971675,2023-09-04 17:57:16.716791,0 days 00:00:04.745116,Sigmoid,Leaky,,,84,15,9.0,,,0.0006989653903416937,2,305,0.563760421135134,0.0012817204762049796,110.50662208932346,COMPLETE
49,0.5987436175346375,2023-09-04 17:57:16.717051,2023-09-04 17:57:23.622678,0 days 00:00:06.905627,Sigmoid,Leaky,Sigmoid,,10,1,21.0,11.0,,0.001622689083343364,3,264,0.4897609663916887,0.0004410962413488246,210.18610642831536,COMPLETE
50,0.32845965027809143,2023-09-04 17:57:23.622947,2023-09-04 17:57:24.974577,0 days 00:00:01.351630,Tanh,Leaky,,,77,22,24.0,,,0.0036429198654894276,2,426,0.7458293881011168,0.000829037121887111,90.69285596211752,COMPLETE
51,0.3097432553768158,2023-09-04 17:57:24.974846,2023-09-04 17:57:26.717819,0 days 00:00:01.742973,ReLU,Leaky,ReLU,,58,18,19.0,15.0,,0.002679762005715554,3,451,0.6489359482309237,0.0020341178552890546,93.85957503318787,COMPLETE
52,0.3091215193271637,2023-09-04 17:57:26.718096,2023-09-04 17:57:28.322508,0 days 00:00:01.604412,Leaky,Leaky,ReLU,,58,19,17.0,16.0,,0.0022480446196645426,3,464,0.6215260268113633,0.0017921154779363035,95.76722628275553,COMPLETE
53,0.33943966031074524,2023-09-04 17:57:28.322779,2023-09-04 17:57:32.678153,0 days 00:00:04.355374,Sigmoid,Leaky,ReLU,,59,20,19.0,16.0,,0.0014021298606627854,3,471,0.6092736981471877,0.0016785287456149527,96.23059937300955,COMPLETE
54,0.3597366511821747,2023-09-04 17:57:32.678414,2023-09-04 17:57:37.693714,0 days 00:00:05.015300,ReLU,Sigmoid,ReLU,,51,19,17.0,19.0,,0.0008373882212480027,3,451,0.6465159461853629,0.004193199755832109,103.22014293931935,COMPLETE
55,0.3134583830833435,2023-09-04 17:57:37.693990,2023-09-04 17:57:38.437485,0 days 00:00:00.743495,ReLU,Leaky,ReLU,,69,16,18.0,12.0,,0.003687857768027667,3,480,0.5780304135560218,0.00180092895841339,96.50073062672334,COMPLETE
56,0.2986941337585449,2023-09-04 17:57:38.437763,2023-09-04 17:57:40.700385,0 days 00:00:02.262622,Leaky,ReLU,ReLU,Tanh,60,22,23.0,13.0,16.0,0.001785912332673504,4,455,0.5212369308760799,0.004394044593946802,94.5244384039016,COMPLETE
57,0.34945157170295715,2023-09-04 17:57:40.700698,2023-09-04 17:57:42.051943,0 days 00:00:01.351245,Leaky,ReLU,ReLU,Tanh,60,23,14.0,16.0,16.0,0.0018600232992928344,4,497,0.4147716291445838,0.00963959767089685,97.76095387473035,COMPLETE
58,0.32791152596473694,2023-09-04 17:57:42.052251,2023-09-04 17:57:43.988211,0 days 00:00:01.935960,Leaky,ReLU,ReLU,Tanh,52,17,23.0,20.0,16.0,0.0012271028954547924,4,234,0.5066528826592029,0.004361852255042909,91.26164095166703,COMPLETE
59,0.32409781217575073,2023-09-04 17:57:43.988514,2023-09-04 17:57:45.872601,0 days 00:00:01.884087,Leaky,ReLU,ReLU,ReLU,64,20,21.0,13.0,17.0,0.0019830532195604027,4,145,0.5260504996839495,0.0026825035250736913,112.06217605189273,COMPLETE
60,0.32024824619293213,2023-09-04 17:57:45.872906,2023-09-04 17:57:50.591441,0 days 00:00:04.718535,Leaky,ReLU,Tanh,Sigmoid,57,22,20.0,16.0,11.0,0.0005304529766628952,4,418,0.6125916130759455,0.0010493831677752094,151.9842040233123,COMPLETE
61,0.32812079787254333,2023-09-04 17:57:50.591746,2023-09-04 17:57:52.038997,0 days 00:00:01.447251,ReLU,ReLU,ReLU,,66,18,22.0,13.0,,0.0028094501094049376,3,444,0.6647257480146676,0.0020846988433158046,95.3624386703759,COMPLETE
62,0.3993537127971649,2023-09-04 17:57:52.039305,2023-09-04 17:57:55.303037,0 days 00:00:03.263732,Sigmoid,ReLU,ReLU,,72,19,23.0,12.0,,0.0011662578717259965,3,452,0.7390443964889897,0.0038121007177304043,169.6984470814198,COMPLETE
63,0.33412712812423706,2023-09-04 17:57:55.303328,2023-09-04 17:57:56.720625,0 days 00:00:01.417297,Leaky,Leaky,ReLU,,62,22,22.0,15.0,,0.004481389827418878,3,466,0.5654476389603705,0.0016294411229847152,94.01814838991326,COMPLETE
64,0.325242817401886,2023-09-04 17:57:56.720919,2023-09-04 17:57:57.837864,0 days 00:00:01.116945,ReLU,Leaky,Leaky,,56,23,21.0,9.0,,0.002999698382746647,3,476,0.476217820823825,0.002570408563022211,100.52232629281504,COMPLETE
65,0.3177797496318817,2023-09-04 17:57:57.838156,2023-09-04 17:58:01.224549,0 days 00:00:03.386393,Tanh,Tanh,Tanh,Tanh,44,12,2.0,18.0,24.0,0.00183937621739536,4,421,0.6237885471320183,0.0006752112862043855,101.9454133865681,COMPLETE
66,0.31869250535964966,2023-09-04 17:58:01.224867,2023-09-04 17:58:02.297193,0 days 00:00:01.072326,ReLU,ReLU,ReLU,,67,17,15.0,15.0,,0.00598756313826153,3,456,0.4397002075521548,0.0009861946905261865,97.58515130905877,COMPLETE
67,0.3097727596759796,2023-09-04 17:58:02.297487,2023-09-04 17:58:05.134607,0 days 00:00:02.837120,Leaky,Leaky,Leaky,Tanh,53,21,6.0,13.0,19.0,0.0009637568048888693,4,487,0.6645003792350428,0.0005101250692770221,90.27346783806296,COMPLETE
68,0.3268461227416992,2023-09-04 17:58:05.134914,2023-09-04 17:58:07.967416,0 days 00:00:02.832502,Leaky,Leaky,Leaky,Tanh,23,21,6.0,21.0,20.0,0.0006848489168192668,4,54,0.5203327505237323,0.0002895363083046253,102.56546868218317,COMPLETE
69,0.35667887330055237,2023-09-04 17:58:07.967714,2023-09-04 17:58:10.481336,0 days 00:00:02.513622,Leaky,ReLU,Leaky,Tanh,53,14,4.0,14.0,18.0,0.001361575560453248,4,482,0.7278919501890002,0.0005334803051780507,105.20504727083095,COMPLETE
70,0.3337555527687073,2023-09-04 17:58:10.481635,2023-09-04 17:58:14.210333,0 days 00:00:03.728698,Leaky,Leaky,Leaky,Tanh,48,24,1.0,18.0,14.0,0.0009470062624118375,4,499,0.577545153175948,0.00048518966957897014,108.5195518720268,COMPLETE
71,0.3224249482154846,2023-09-04 17:58:14.210633,2023-09-04 17:58:16.454910,0 days 00:00:02.244277,Leaky,Leaky,Leaky,Tanh,74,20,7.0,12.0,19.0,0.0023467232478144176,4,437,0.6665808740519916,0.0014120904346768576,88.06413874906652,COMPLETE
72,0.289542019367218,2023-09-04 17:58:16.455216,2023-09-04 17:58:17.870225,0 days 00:00:01.415009,Leaky,Leaky,Leaky,ReLU,81,19,18.0,11.0,9.0,0.0034001750910237502,4,404,0.7524901664142507,0.000677341023262411,92.77677310242944,COMPLETE
73,0.3366234004497528,2023-09-04 17:58:17.870536,2023-09-04 17:58:19.338173,0 days 00:00:01.467637,Leaky,Leaky,Leaky,ReLU,70,10,18.0,9.0,7.0,0.0041430638366479824,4,463,0.7560374763903407,0.00023770867868960522,104.07999631191822,COMPLETE
74,0.27566826343536377,2023-09-04 17:58:19.338556,2023-09-04 17:58:20.788084,0 days 00:00:01.449528,Leaky,Leaky,Leaky,ReLU,63,21,17.0,13.0,10.0,0.001613131075038938,4,398,0.7502726850115045,0.0006507586780518444,125.72370733216752,COMPLETE
75,0.28855985403060913,2023-09-04 17:58:20.788445,2023-09-04 17:58:25.924220,0 days 00:00:05.135775,Leaky,Sigmoid,Leaky,ReLU,57,18,15.0,11.0,11.0,0.001655298969293144,4,405,0.7550359760139653,0.0007545682957526828,105.88825573730469,COMPLETE
76,0.2913542687892914,2023-09-04 17:58:25.924524,2023-09-04 17:58:30.582666,0 days 00:00:04.658142,Leaky,Sigmoid,Leaky,ReLU,63,22,15.0,11.0,9.0,0.0015260641141504462,4,404,0.7671155043067152,0.0007027409450575741,99.698864837191,COMPLETE
77,0.3652832508087158,2023-09-04 17:58:30.582983,2023-09-04 17:58:32.523467,0 days 00:00:01.940484,Leaky,Sigmoid,Leaky,ReLU,61,22,14.0,7.0,10.0,0.0015313039434598009,4,401,0.7713323545185803,0.0006461116165442293,114.72934070933948,COMPLETE
78,0.33879750967025757,2023-09-04 17:58:32.523769,2023-09-04 17:58:35.487750,0 days 00:00:02.963981,Leaky,Sigmoid,Leaky,ReLU,65,11,13.0,9.0,9.0,0.0017485361998340482,4,375,0.7474777508350173,0.0003934850677619637,100.82933301511018,COMPLETE
79,0.33956462144851685,2023-09-04 17:58:35.488056,2023-09-04 17:58:38.327597,0 days 00:00:02.839541,Leaky,Sigmoid,Leaky,ReLU,73,24,15.0,11.0,14.0,0.00133689970904561,4,397,0.7083398749519163,0.0002715473611484729,102.53234004974365,COMPLETE
80,0.3466201722621918,2023-09-04 17:58:38.327902,2023-09-04 17:58:40.271167,0 days 00:00:01.943265,Leaky,Sigmoid,Leaky,ReLU,77,23,16.0,10.0,9.0,0.0034837724074078466,4,339,0.7978608484404609,0.0008546642183763733,250.44022201279464,COMPLETE
81,0.301614373922348,2023-09-04 17:58:40.271647,2023-09-04 17:58:50.147963,0 days 00:00:09.876316,Leaky,Sigmoid,Leaky,ReLU,63,20,17.0,11.0,4.0,0.002140313457461519,4,409,0.7288329473819224,0.0006585541960242168,101.61512007668753,COMPLETE
82,0.3426464796066284,2023-09-04 17:58:50.148472,2023-09-04 17:59:00.569318,0 days 00:00:10.420846,Leaky,Sigmoid,Leaky,ReLU,63,20,15.0,11.0,4.0,0.0019931896392218025,4,372,0.72624745196446,0.0004069762098793953,107.76117437453497,COMPLETE
83,0.3597821295261383,2023-09-04 17:59:00.569831,2023-09-04 17:59:07.895077,0 days 00:00:07.325246,Leaky,Sigmoid,Leaky,ReLU,68,15,17.0,10.0,13.0,0.0031477883886821298,4,412,0.7604886537230896,0.0006791900376277596,102.98352704729352,COMPLETE
84,0.329824835062027,2023-09-04 17:59:07.895583,2023-09-04 17:59:11.814940,0 days 00:00:03.919357,Leaky,Sigmoid,Leaky,ReLU,55,21,15.0,8.0,5.0,0.004698260019140419,4,388,0.69505562089233,0.0003149346016846883,118.08472648826805,COMPLETE
85,0.3783332109451294,2023-09-04 17:59:11.815449,2023-09-04 17:59:34.651146,0 days 00:00:22.835697,Leaky,Sigmoid,Sigmoid,ReLU,75,13,11.0,14.0,9.0,0.0012262024378793775,4,429,0.6874013724481688,0.0010648196864994491,124.21364271818702,COMPLETE
86,0.3518919050693512,2023-09-04 17:59:34.651683,2023-09-04 17:59:38.427791,0 days 00:00:03.776108,Leaky,Sigmoid,Leaky,Sigmoid,70,21,18.0,11.0,12.0,0.006279837695949326,4,353,0.7307411570152172,0.0004518329471067197,109.6297666968369,COMPLETE
87,0.319038063287735,2023-09-04 17:59:38.428313,2023-09-04 17:59:47.584229,0 days 00:00:09.155916,Tanh,Sigmoid,Leaky,ReLU,80,22,16.0,13.0,11.0,0.0020061000873571656,4,407,0.5962650267067189,0.0005627917383935495,148.92559814453125,COMPLETE
88,0.3225012421607971,2023-09-04 17:59:47.584748,2023-09-04 17:59:57.766025,0 days 00:00:10.181277,Leaky,Sigmoid,Leaky,ReLU,66,18,13.0,10.0,3.0,0.0007989826025467758,4,416,0.7708418736944149,0.0007889024530077418,106.4728100346584,COMPLETE
89,0.3113514482975006,2023-09-04 17:59:57.766535,2023-09-04 18:00:06.294044,0 days 00:00:08.527509,Leaky,Tanh,Leaky,ReLU,78,17,12.0,7.0,7.0,0.0014885101841704412,4,384,0.632466052670743,0.0013114440243426815,100.17004818386502,COMPLETE
90,0.3698756694793701,2023-09-04 18:00:06.294581,2023-09-04 18:00:09.434806,0 days 00:00:03.140225,ReLU,,,,62,23,,,,0.003216417534434026,1,435,0.6830323834323476,0.0009692228597345043,92.01074954441616,COMPLETE
91,0.29929864406585693,2023-09-04 18:00:09.435272,2023-09-04 18:00:19.013646,0 days 00:00:09.578374,Leaky,Sigmoid,Leaky,ReLU,58,19,17.0,12.0,10.0,0.002344398236258865,4,398,0.6132498045845379,0.0005830256478072609,98.83758193371342,COMPLETE
92,0.3188769519329071,2023-09-04 18:00:19.014151,2023-09-04 18:00:25.450327,0 days 00:00:06.436176,Leaky,Sigmoid,Leaky,ReLU,60,19,17.0,12.0,10.0,0.0023566088113874777,4,364,0.7949122067011088,0.0004109111130429301,94.94030625479562,COMPLETE
