number,value,datetime_start,datetime_complete,duration,params_activation1,params_activation2,params_activation3,params_activation4,params_batch_size,params_fl1,params_fl2,params_fl3,params_fl4,params_learning_rate,params_n_layers,params_num_epochs,params_train_size,params_weight_decay,user_attrs_mre,state
272,0.5442975163459778,2023-09-04 18:30:15.409560,2023-09-04 18:30:16.376704,0 days 00:00:00.967144,ReLU,Tanh,,,48,18,1.0,,,0.0184700800820857,2,194,0.6987033998793661,1.4536696590882888e-05,136.19839342902688,COMPLETE
273,0.3125309646129608,2023-09-04 18:30:16.377036,2023-09-04 18:30:18.887838,0 days 00:00:02.510802,ReLU,Tanh,ReLU,Leaky,45,9,15.0,23.0,11.0,0.003716835410936977,4,269,0.7989119656408661,5.245079786557128e-05,82.51140345059909,COMPLETE
274,0.3358888030052185,2023-09-04 18:30:18.888177,2023-09-04 18:30:21.356927,0 days 00:00:02.468750,ReLU,Tanh,Tanh,ReLU,55,23,10.0,22.0,15.0,0.004922951325092885,4,212,0.7484113429122724,2.8081505909299528e-05,91.80442484871286,COMPLETE
275,0.3353700637817383,2023-09-04 18:30:21.357257,2023-09-04 18:30:25.480507,0 days 00:00:04.123250,ReLU,Tanh,Tanh,ReLU,50,20,16.0,18.0,15.0,0.004203162198189376,4,184,0.7203976092058533,0.00072637836770308,108.19920531796737,COMPLETE
276,0.34232890605926514,2023-09-04 18:30:25.480829,2023-09-04 18:30:27.926787,0 days 00:00:02.445958,ReLU,Leaky,Sigmoid,Leaky,40,16,15.0,20.0,9.0,0.002348325155834887,4,203,0.7701837427471909,2.1339575127451983e-05,91.05242411295573,COMPLETE
277,0.3278852105140686,2023-09-04 18:30:27.927191,2023-09-04 18:30:29.096712,0 days 00:00:01.169521,ReLU,Tanh,Tanh,ReLU,59,19,14.0,21.0,12.0,0.007986147341695187,4,190,0.650822496359914,0.0005015123831684716,90.15506043305268,COMPLETE
278,0.3564980626106262,2023-09-04 18:30:29.097067,2023-09-04 18:30:32.426431,0 days 00:00:03.329364,Sigmoid,Tanh,Tanh,ReLU,43,20,16.0,22.0,18.0,0.0032751973919376773,4,295,0.5921437845547319,0.0011988655793708854,105.86363283045152,COMPLETE
279,0.32046574354171753,2023-09-04 18:30:32.426771,2023-09-04 18:30:33.797489,0 days 00:00:01.370718,ReLU,Tanh,Sigmoid,Leaky,53,18,17.0,24.0,10.0,0.005581262638422469,4,171,0.6912981021631006,6.354624229765037e-05,93.51653992502312,COMPLETE
280,0.31496158242225647,2023-09-04 18:30:33.797820,2023-09-04 18:30:36.479516,0 days 00:00:02.681696,ReLU,Sigmoid,Tanh,ReLU,46,23,13.0,23.0,13.0,0.011339741427856289,4,151,0.7708314265248523,0.00016786873473541723,142.55776622377593,COMPLETE
281,0.5954663753509521,2023-09-04 18:30:36.479857,2023-09-04 18:30:39.315641,0 days 00:00:02.835784,ReLU,Tanh,Tanh,ReLU,37,1,12.0,19.0,11.0,0.00663511272400537,4,245,0.7265968673807665,3.473202897400598e-05,114.29642236643824,COMPLETE
282,0.34268918633461,2023-09-04 18:30:39.315985,2023-09-04 18:30:41.451982,0 days 00:00:02.135997,ReLU,Tanh,Sigmoid,Leaky,48,13,14.0,21.0,12.0,0.03571604851444819,4,260,0.7988138449063409,1.0061921562869674e-05,96.67108689977768,COMPLETE
283,0.31718987226486206,2023-09-04 18:30:41.452308,2023-09-04 18:30:44.107172,0 days 00:00:02.654864,ReLU,Tanh,Tanh,ReLU,57,24,15.0,23.0,3.0,0.004368322714208185,4,220,0.7462397032123838,1.7649837222290332e-05,90.59099444827518,COMPLETE
284,0.5479536652565002,2023-09-04 18:30:44.107494,2023-09-04 18:30:44.753213,0 days 00:00:00.645719,ReLU,Tanh,Tanh,ReLU,42,22,15.0,24.0,8.0,0.08392508733801117,4,199,0.704684339679601,2.6185621151285166e-05,131.7398316519601,COMPLETE
285,0.3164297938346863,2023-09-04 18:30:44.753538,2023-09-04 18:30:48.395550,0 days 00:00:03.642012,Sigmoid,Leaky,,,78,21,16.0,,,0.002990078370558768,2,235,0.6752793099165719,1.337234768051367e-05,94.17117974065965,COMPLETE
286,0.44400474429130554,2023-09-04 18:30:48.395871,2023-09-04 18:30:51.429348,0 days 00:00:03.033477,ReLU,Tanh,Tanh,Leaky,23,2,14.0,23.0,7.0,0.0038673427312985367,4,160,0.5669153006757393,4.1484394644283945e-05,138.41708330838185,COMPLETE
287,0.3900713622570038,2023-09-04 18:30:51.429692,2023-09-04 18:30:52.834234,0 days 00:00:01.404542,Leaky,Tanh,Sigmoid,ReLU,51,19,14.0,22.0,13.0,0.0019862278591727196,4,184,0.27596521161505466,2.2416346929475464e-05,185.87738426871923,COMPLETE
288,0.33831682801246643,2023-09-04 18:30:52.834700,2023-09-04 18:30:55.435265,0 days 00:00:02.600565,ReLU,Tanh,Tanh,Tanh,45,10,17.0,20.0,10.0,0.002454168521662447,4,206,0.7692203316715063,0.0003680855338487975,110.04266659966831,COMPLETE
289,0.4825895428657532,2023-09-04 18:30:55.435606,2023-09-04 18:30:57.185926,0 days 00:00:01.750320,ReLU,Tanh,Leaky,ReLU,60,17,13.0,21.0,4.0,0.004951621877570926,4,171,0.7355789709074735,3.083451624716292e-05,133.89457986869064,COMPLETE
290,0.2997211813926697,2023-09-04 18:30:57.186317,2023-09-04 18:30:59.102384,0 days 00:00:01.916067,ReLU,ReLU,Tanh,Leaky,35,20,8.0,24.0,11.0,0.007175916498673098,4,193,0.4928533875486992,4.899339171108752e-05,129.21917724609375,COMPLETE
291,0.423197865486145,2023-09-04 18:30:59.102745,2023-09-04 18:31:01.200250,0 days 00:00:02.097505,ReLU,Tanh,Sigmoid,ReLU,39,18,15.0,23.0,9.0,0.02633978000551376,4,274,0.7698060984797895,1.6780036813188703e-05,128.33013897407346,COMPLETE
292,0.3211544156074524,2023-09-04 18:31:01.200593,2023-09-04 18:31:02.357981,0 days 00:00:01.157388,Tanh,Tanh,Tanh,ReLU,55,23,18.0,20.0,12.0,0.0035568631181326998,4,216,0.33810909448890203,2.0379037640672998e-05,105.55082104022686,COMPLETE
293,0.37718814611434937,2023-09-04 18:31:02.358315,2023-09-04 18:31:04.158178,0 days 00:00:01.799863,ReLU,Sigmoid,Tanh,Leaky,43,21,15.0,22.0,14.0,0.005901041972788331,4,183,0.7992240772268284,0.0057909313829979416,122.26292233853727,COMPLETE
294,1.0174812078475952,2023-09-04 18:31:04.158509,2023-09-04 18:31:05.425913,0 days 00:00:01.267404,Sigmoid,Tanh,Sigmoid,ReLU,16,19,13.0,21.0,13.0,0.009512250287852827,4,143,0.7213632412840064,0.038270278586565475,100.2052494395863,COMPLETE
295,0.34318655729293823,2023-09-04 18:31:05.426265,2023-09-04 18:31:06.293396,0 days 00:00:00.867131,ReLU,Leaky,,,48,22,16.0,,,0.004705067508950436,2,252,0.36283330309330847,0.0002325550310171898,109.41102736336845,COMPLETE
296,0.5627351999282837,2023-09-04 18:31:06.293696,2023-09-04 18:31:08.597107,0 days 00:00:02.303411,ReLU,Tanh,Tanh,Leaky,53,18,14.0,23.0,11.0,0.002972579588868132,4,204,0.632918344788023,0.07279131841259434,126.5364423639634,COMPLETE
297,0.4990890622138977,2023-09-04 18:31:08.597430,2023-09-04 18:31:17.776824,0 days 00:00:09.179394,ReLU,Tanh,Tanh,,41,24,2.0,24.0,,1.4012246687702133e-05,3,228,0.7483410043810146,3.832784674421892e-05,144.86593701546653,COMPLETE
298,0.35016363859176636,2023-09-04 18:31:17.777154,2023-09-04 18:31:19.061207,0 days 00:00:01.284053,ReLU,Tanh,Sigmoid,ReLU,45,20,10.0,20.0,5.0,0.01932034277245146,4,163,0.46751553382138034,0.00012363010363693766,96.64974361917247,COMPLETE
299,0.3013885021209717,2023-09-04 18:31:19.061531,2023-09-04 18:31:20.596761,0 days 00:00:01.535230,ReLU,Tanh,ReLU,Sigmoid,50,19,16.0,19.0,12.0,0.0037061875041757876,4,264,0.7035012976393885,2.7308654237023304e-05,104.32746325041118,COMPLETE
300,0.3026258647441864,2023-09-04 18:31:20.597097,2023-09-04 18:31:23.180660,0 days 00:00:02.583563,Sigmoid,Tanh,Tanh,ReLU,44,23,14.0,22.0,12.0,0.005146277221544796,4,177,0.7700498894954814,2.3399175696230545e-05,100.36859478866845,COMPLETE
301,0.3600044250488281,2023-09-04 18:31:23.180984,2023-09-04 18:31:25.366492,0 days 00:00:02.185508,ReLU,Tanh,Tanh,Leaky,47,18,15.0,21.0,10.0,0.0026792517076533596,4,193,0.32045420025354965,0.00019325402320365944,126.66231873075841,COMPLETE
302,0.3465498089790344,2023-09-04 18:31:25.366818,2023-09-04 18:31:26.429823,0 days 00:00:01.063005,ReLU,Tanh,Sigmoid,ReLU,52,17,14.0,24.0,9.0,0.007798842871457383,4,214,0.6586196161565161,0.0009498478156953232,117.76884994506835,COMPLETE
303,0.35341688990592957,2023-09-04 18:31:26.430144,2023-09-04 18:31:28.805764,0 days 00:00:02.375620,ReLU,Leaky,Tanh,ReLU,63,22,16.0,22.0,11.0,0.0008069197862767639,4,240,0.446086272962141,1.4323914005202588e-05,105.84196090698242,COMPLETE
304,0.2799874544143677,2023-09-04 18:31:28.806094,2023-09-04 18:31:30.190110,0 days 00:00:01.384016,ReLU,Tanh,Tanh,Leaky,57,21,17.0,23.0,21.0,0.006171066569625231,4,200,0.7327965493879132,9.398511027358385e-05,102.23817624543842,COMPLETE
305,0.35733333230018616,2023-09-04 18:31:30.190464,2023-09-04 18:31:31.241339,0 days 00:00:01.050875,ReLU,Tanh,Tanh,Leaky,58,21,17.0,23.0,21.0,0.0064168599957452515,4,190,0.421842548676012,6.665265928015022e-05,103.1587958822445,COMPLETE
306,0.4962097108364105,2023-09-04 18:31:31.241694,2023-09-04 18:31:31.655603,0 days 00:00:00.413909,ReLU,Tanh,Tanh,Leaky,56,15,7.0,23.0,22.0,0.05782512056664573,4,179,0.5363843613598658,8.56258965308333e-05,178.98528289794922,COMPLETE
307,0.3573240339756012,2023-09-04 18:31:31.656032,2023-09-04 18:31:34.205622,0 days 00:00:02.549590,Sigmoid,Sigmoid,Tanh,Leaky,54,21,17.0,23.0,8.0,0.016247686591689178,4,255,0.6812594797326766,0.00010734830110416248,109.06570362400365,COMPLETE
308,0.31714749336242676,2023-09-04 18:31:34.205949,2023-09-04 18:31:36.838563,0 days 00:00:02.632614,ReLU,Tanh,Tanh,Leaky,60,20,16.0,24.0,17.0,0.0010686490190888107,4,196,0.77071596890005,7.756551860581421e-05,102.39023830466074,COMPLETE
309,0.3169030249118805,2023-09-04 18:31:36.839007,2023-09-04 18:31:37.735100,0 days 00:00:00.896093,Leaky,Tanh,Tanh,Leaky,56,22,17.0,22.0,2.0,0.009811548530134877,4,171,0.7102993673164711,9.813353531944123e-05,111.2404931640625,COMPLETE
310,0.3299281895160675,2023-09-04 18:31:37.735441,2023-09-04 18:31:39.269813,0 days 00:00:01.534372,ReLU,Tanh,Tanh,ReLU,58,21,15.0,24.0,7.0,0.008289496740892124,4,283,0.4664375424164027,5.6067358563227006e-05,96.73142379077512,COMPLETE
311,0.2889534533023834,2023-09-04 18:31:39.270176,2023-09-04 18:31:41.390194,0 days 00:00:02.120018,ReLU,Tanh,Sigmoid,Leaky,49,23,12.0,23.0,12.0,0.001811092476586338,4,479,0.7998334771368459,0.0007613155661214047,117.40637865933505,COMPLETE
312,0.3306092619895935,2023-09-04 18:31:41.390560,2023-09-04 18:31:43.637688,0 days 00:00:02.247128,ReLU,Tanh,Tanh,ReLU,49,20,11.0,14.0,20.0,0.001872607968745298,4,465,0.7986850341667722,0.0005456701293507818,115.3435259598952,COMPLETE
313,0.53599613904953,2023-09-04 18:31:43.638063,2023-09-04 18:31:43.905738,0 days 00:00:00.267675,ReLU,Leaky,Tanh,Leaky,61,24,12.0,23.0,12.0,0.07296816169948916,4,491,0.37376568867833276,0.0004770024429869036,237.21089553833008,COMPLETE
314,0.3179304599761963,2023-09-04 18:31:43.906115,2023-09-04 18:31:46.675528,0 days 00:00:02.769413,ReLU,Tanh,Sigmoid,ReLU,46,23,12.0,21.0,18.0,0.0015309481598830053,4,484,0.7515633998657896,7.120458970221472e-05,116.89156316941784,COMPLETE
315,0.3972319960594177,2023-09-04 18:31:46.675922,2023-09-04 18:31:49.210091,0 days 00:00:02.534169,Sigmoid,,,,49,21,,,,0.00571149988387245,1,183,0.7770732694619122,0.0007614758044491692,123.89809840740544,COMPLETE
316,0.32610979676246643,2023-09-04 18:31:49.210447,2023-09-04 18:31:50.627015,0 days 00:00:01.416568,ReLU,ReLU,Tanh,ReLU,51,22,9.0,22.0,11.0,0.0069913973992751614,4,160,0.7998771108333822,0.0009629786987067453,94.303884267807,COMPLETE
317,0.3439009189605713,2023-09-04 18:31:50.627362,2023-09-04 18:31:51.840744,0 days 00:00:01.213382,Tanh,Tanh,Tanh,Leaky,47,20,13.0,13.0,19.0,0.02221650689322013,4,479,0.7418130058005717,0.0006413797585784381,116.48754856504243,COMPLETE
318,0.30002251267433167,2023-09-04 18:31:51.841071,2023-09-04 18:31:55.620221,0 days 00:00:03.779150,ReLU,Tanh,Sigmoid,ReLU,44,19,12.0,22.0,11.0,0.0013092736821397487,4,201,0.7515225311906726,0.0004639887101770581,166.080807640439,COMPLETE
319,0.3591805398464203,2023-09-04 18:31:55.620551,2023-09-04 18:31:58.093566,0 days 00:00:02.473015,ReLU,Tanh,Tanh,Leaky,46,24,5.0,23.0,10.0,0.04018024979854457,4,471,0.72251968985284,0.0007480825337165779,137.19222348531088,COMPLETE
320,0.3328477442264557,2023-09-04 18:31:58.093904,2023-09-04 18:31:59.267109,0 days 00:00:01.173205,ReLU,Tanh,Leaky,ReLU,48,12,13.0,21.0,12.0,0.03137995008411134,4,456,0.7720524298364805,0.00024360329942424444,128.44299344663267,COMPLETE
321,0.3270989954471588,2023-09-04 18:31:59.267445,2023-09-04 18:32:01.841671,0 days 00:00:02.574226,ReLU,Tanh,Tanh,Tanh,58,11,11.0,20.0,12.0,0.004758975686364213,4,185,0.7440627658190864,4.742145112143548e-05,99.76045760063276,COMPLETE
322,0.4462044835090637,2023-09-04 18:32:01.842012,2023-09-04 18:32:03.136910,0 days 00:00:01.294898,Sigmoid,Sigmoid,Sigmoid,ReLU,50,23,15.0,17.0,13.0,0.005737796834923606,4,113,0.25628240103070105,0.0011258051066616274,130.14708770405161,COMPLETE
323,0.33732935786247253,2023-09-04 18:32:03.137251,2023-09-04 18:32:04.613012,0 days 00:00:01.475761,ReLU,Tanh,Tanh,Leaky,43,20,12.0,23.0,6.0,0.0034301462057730113,4,415,0.5491439085993283,1.195658205333439e-05,101.59857214064826,COMPLETE
324,0.3150612413883209,2023-09-04 18:32:04.613374,2023-09-04 18:32:05.922600,0 days 00:00:01.309226,ReLU,Tanh,Tanh,ReLU,55,21,15.0,2.0,9.0,0.01134100982082348,4,209,0.7756388918888616,0.00038611882240694085,121.8580190485174,COMPLETE
325,0.3992898166179657,2023-09-04 18:32:05.922936,2023-09-04 18:32:06.715534,0 days 00:00:00.792598,ReLU,Tanh,Sigmoid,ReLU,45,19,16.0,20.0,11.0,0.004279689036040644,4,194,0.19245548422299352,3.504665571153492e-05,224.4140727519989,COMPLETE
326,0.3750707507133484,2023-09-04 18:32:06.715895,2023-09-04 18:32:08.757426,0 days 00:00:02.041531,ReLU,Leaky,Tanh,Leaky,51,22,13.0,22.0,10.0,0.0022075642630506667,4,167,0.7272381619936567,0.0014805760911529716,112.25089014493503,COMPLETE
327,0.41118550300598145,2023-09-04 18:32:08.757768,2023-09-04 18:32:11.035425,0 days 00:00:02.277657,ReLU,Tanh,Tanh,ReLU,61,24,3.0,21.0,12.0,0.04470334185218099,4,500,0.7746351733571206,0.0006806555833543149,181.41867942810057,COMPLETE
328,0.44034963846206665,2023-09-04 18:32:11.035779,2023-09-04 18:32:13.408145,0 days 00:00:02.372366,ReLU,Tanh,Sigmoid,Sigmoid,47,23,4.0,19.0,8.0,0.006680681458743449,4,224,0.7988489960023771,0.00014950611479404259,159.45233327037883,COMPLETE
329,0.3363018333911896,2023-09-04 18:32:13.408519,2023-09-04 18:32:16.758057,0 days 00:00:03.349538,Sigmoid,Tanh,Tanh,Leaky,42,21,15.0,23.0,13.0,0.005316171896062316,4,438,0.7116586312678767,6.0328623167326615e-05,96.40194487235915,COMPLETE
330,0.29263705015182495,2023-09-04 18:32:16.758400,2023-09-04 18:32:20.939552,0 days 00:00:04.181152,ReLU,Tanh,ReLU,ReLU,57,20,14.0,22.0,11.0,0.0032093839697202725,4,173,0.799956110401899,0.0018751680395016938,100.48393973918876,COMPLETE
331,0.3276706337928772,2023-09-04 18:32:20.939911,2023-09-04 18:32:21.728160,0 days 00:00:00.788249,ReLU,Tanh,Tanh,ReLU,90,19,16.0,23.0,23.0,0.00861379581082751,4,197,0.5789598500967129,4.071749182750903e-05,104.5927177005344,COMPLETE
332,0.29307499527931213,2023-09-04 18:32:21.728613,2023-09-04 18:32:23.266130,0 days 00:00:01.537517,ReLU,Tanh,Sigmoid,Leaky,74,22,14.0,20.0,12.0,0.004148880875093329,4,186,0.7470218305047013,3.094156780795473e-05,104.86909469604493,COMPLETE
333,0.3313102126121521,2023-09-04 18:32:23.266572,2023-09-04 18:32:24.206563,0 days 00:00:00.939991,ReLU,Leaky,Tanh,ReLU,53,20,13.0,21.0,5.0,0.002333074807726682,4,485,0.3244148965276581,1.6458949372377313e-05,109.88664850198998,COMPLETE
334,0.34261107444763184,2023-09-04 18:32:24.206906,2023-09-04 18:32:28.162027,0 days 00:00:03.955121,Leaky,Tanh,Tanh,,49,23,18.0,23.0,,0.0006602974853040509,3,216,0.5169410990148353,0.00020012567561663054,95.42177290916443,COMPLETE
335,0.3154270350933075,2023-09-04 18:32:28.162354,2023-09-04 18:32:34.598649,0 days 00:00:06.436295,ReLU,Sigmoid,Sigmoid,ReLU,44,19,15.0,24.0,10.0,0.0017410705648394098,4,390,0.6981794074930608,0.0005554900492462343,107.79407263749482,COMPLETE
336,0.3115229904651642,2023-09-04 18:32:34.599002,2023-09-04 18:32:37.348039,0 days 00:00:02.749037,Sigmoid,Tanh,Tanh,Leaky,46,21,16.0,22.0,13.0,0.004827679841189625,4,178,0.7496960556703911,0.00015613291481519564,100.90315115451813,COMPLETE
337,0.31507351994514465,2023-09-04 18:32:37.348377,2023-09-04 18:32:39.570159,0 days 00:00:02.221782,ReLU,Tanh,Tanh,ReLU,38,24,14.0,21.0,11.0,0.014545460801574834,4,205,0.7198213828589632,1.8777524055241063e-05,304.03403738270634,COMPLETE
338,0.3587160110473633,2023-09-04 18:32:39.570499,2023-09-04 18:32:40.215296,0 days 00:00:00.644797,ReLU,Tanh,Tanh,Leaky,59,18,13.0,20.0,12.0,0.006637196873488906,4,270,0.285077688047531,0.00010103100017695058,96.59854125976562,COMPLETE
339,0.33518457412719727,2023-09-04 18:32:40.215637,2023-09-04 18:32:42.693763,0 days 00:00:02.478126,ReLU,Tanh,Sigmoid,ReLU,40,22,15.0,19.0,11.0,0.003698323845823764,4,154,0.667741583573618,0.00012576063809167744,102.13960429600307,COMPLETE
340,0.339481383562088,2023-09-04 18:32:42.694107,2023-09-04 18:32:45.867838,0 days 00:00:03.173731,ReLU,Tanh,Tanh,ReLU,54,20,6.0,23.0,12.0,0.005487257284151282,4,233,0.613848289925769,0.0008834773810852507,98.22719377087009,COMPLETE
341,0.2480808049440384,2023-09-04 18:32:45.868190,2023-09-04 18:32:48.362185,0 days 00:00:02.493995,Tanh,ReLU,Tanh,Leaky,62,19,12.0,9.0,14.0,0.0010309874432914347,4,190,0.7633765767675696,0.0003807860371482869,113.9081957075331,COMPLETE
342,0.29891252517700195,2023-09-04 18:32:48.362518,2023-09-04 18:32:52.027337,0 days 00:00:03.664819,Tanh,ReLU,Sigmoid,Tanh,65,19,11.0,8.0,14.0,0.0012182022141450832,4,195,0.7596863545703426,0.00034799092020253543,157.95446229414506,COMPLETE
343,0.3368788957595825,2023-09-04 18:32:52.027798,2023-09-04 18:32:55.766464,0 days 00:00:03.738666,Sigmoid,ReLU,Tanh,ReLU,59,19,12.0,24.0,14.0,0.0009171406559489994,4,185,0.6930738845027972,0.00029346218625656657,105.07693496259671,COMPLETE
344,0.28769436478614807,2023-09-04 18:32:55.766797,2023-09-04 18:32:57.837707,0 days 00:00:02.070910,Tanh,ReLU,Leaky,Leaky,68,20,10.0,11.0,14.0,0.0013858896605521197,4,341,0.7399476319439561,0.0003155696394235479,100.72202046712239,COMPLETE
345,0.3344404399394989,2023-09-04 18:32:57.838070,2023-09-04 18:33:00.372206,0 days 00:00:02.534136,Tanh,ReLU,Leaky,ReLU,69,20,9.0,10.0,15.0,0.0010720189449314578,4,349,0.7245367112305786,0.00030266360717524113,100.09705278350086,COMPLETE
346,0.3260500431060791,2023-09-04 18:33:00.372546,2023-09-04 18:33:03.527492,0 days 00:00:03.154946,Tanh,ReLU,Leaky,Leaky,67,20,8.0,10.0,14.0,0.0009553171111004999,4,327,0.6423805911327523,0.00031158830364648465,117.69447286505448,COMPLETE
347,0.33922797441482544,2023-09-04 18:33:03.527840,2023-09-04 18:33:06.046303,0 days 00:00:02.518463,Tanh,Leaky,Leaky,ReLU,63,19,16.0,12.0,15.0,0.0007991970491080995,4,210,0.36220605847576354,0.0002554797936385604,92.269956743395,COMPLETE
348,0.3557102382183075,2023-09-04 18:33:06.046645,2023-09-04 18:33:06.705225,0 days 00:00:00.658580,Tanh,ReLU,Leaky,ReLU,62,19,11.0,10.0,14.0,0.007428249228906188,4,189,0.377856552517119,0.00041247471060027797,109.03838326590402,COMPLETE
349,0.2760339081287384,2023-09-04 18:33:06.705562,2023-09-04 18:33:08.266823,0 days 00:00:01.561261,Tanh,ReLU,Tanh,Leaky,64,18,15.0,18.0,13.0,0.0011931580255374794,4,316,0.6907582353321619,5.006202921034274e-05,98.7277067565918,COMPLETE
350,0.33598053455352783,2023-09-04 18:33:08.267167,2023-09-04 18:33:10.282288,0 days 00:00:02.015121,Tanh,ReLU,Leaky,Leaky,65,18,13.0,9.0,13.0,0.001369668884798236,4,205,0.6795714876001073,5.176392744457052e-05,126.66612220878032,COMPLETE
351,0.31567227840423584,2023-09-04 18:33:10.282686,2023-09-04 18:33:12.668729,0 days 00:00:02.386043,Tanh,ReLU,Tanh,ReLU,65,20,15.0,11.0,13.0,0.0012538645020013452,4,302,0.657434249077538,4.45531692007985e-05,92.05837174403814,COMPLETE
352,0.4749757647514343,2023-09-04 18:33:12.669083,2023-09-04 18:33:17.112536,0 days 00:00:04.443453,Tanh,ReLU,Tanh,ReLU,63,8,10.0,11.0,14.0,0.0004103649542301786,4,222,0.41687937732998265,6.634365303616567e-05,174.3785111710832,COMPLETE
353,0.31935590505599976,2023-09-04 18:33:17.112871,2023-09-04 18:33:20.381394,0 days 00:00:03.268523,Tanh,ReLU,Tanh,Leaky,63,21,15.0,7.0,14.0,0.0010311189715802465,4,357,0.7033141130198935,5.794129264958146e-05,94.6141287794391,COMPLETE
354,0.3079056739807129,2023-09-04 18:33:20.381743,2023-09-04 18:33:22.151083,0 days 00:00:01.769340,Tanh,ReLU,Leaky,Sigmoid,67,19,14.0,18.0,13.0,0.0015689882684261503,4,312,0.7230914816129846,8.644697897990966e-05,90.61610902030513,COMPLETE
355,0.36820459365844727,2023-09-04 18:33:22.151440,2023-09-04 18:33:23.214134,0 days 00:00:01.062694,Tanh,Leaky,Tanh,ReLU,62,20,12.0,8.0,13.0,0.0012360622993954982,4,316,0.1416152811756566,0.0004234184572625473,109.39671303077981,COMPLETE
356,0.36255568265914917,2023-09-04 18:33:23.214513,2023-09-04 18:33:24.031833,0 days 00:00:00.817320,Tanh,ReLU,Tanh,ReLU,66,18,7.0,18.0,19.0,0.024919226695897124,4,322,0.433719342222908,3.7431911109048235e-05,101.36563053131104,COMPLETE
357,0.33627140522003174,2023-09-04 18:33:24.032185,2023-09-04 18:33:33.572152,0 days 00:00:09.539967,Tanh,ReLU,Tanh,Leaky,61,19,15.0,19.0,13.0,0.0001340890658390929,4,297,0.6935122046511988,0.00036908194153141956,96.55896152791752,COMPLETE
358,0.33091506361961365,2023-09-04 18:33:33.572488,2023-09-04 18:33:40.210432,0 days 00:00:06.637944,Tanh,ReLU,Tanh,ReLU,68,20,10.0,14.0,15.0,0.0015788387660894832,4,200,0.46094299164141983,7.477998925008538e-05,89.28711307410038,COMPLETE
359,0.351841002702713,2023-09-04 18:33:40.211004,2023-09-04 18:33:42.513182,0 days 00:00:02.302178,Tanh,ReLU,Tanh,Leaky,82,21,14.0,12.0,16.0,0.0009729772808077547,4,385,0.40210606709699187,0.0002851083043925979,112.31239218240256,COMPLETE
360,0.31564581394195557,2023-09-04 18:33:42.513535,2023-09-04 18:33:43.680524,0 days 00:00:01.166989,Tanh,ReLU,Tanh,ReLU,71,17,11.0,8.0,14.0,0.013220703308917604,4,339,0.7437177022015168,4.6576592024618886e-05,98.24742317199707,COMPLETE
361,0.5433488488197327,2023-09-04 18:33:43.680878,2023-09-04 18:33:53.780042,0 days 00:00:10.099164,Tanh,ReLU,Tanh,ReLU,60,20,15.0,9.0,13.0,2.4593260677782586e-05,4,287,0.6615320532040091,0.00018148427260995204,122.3133591708406,COMPLETE
362,0.3052750825881958,2023-09-04 18:33:53.780453,2023-09-04 18:33:54.818260,0 days 00:00:01.037807,Tanh,ReLU,Tanh,Leaky,62,19,13.0,19.0,4.0,0.019826879965608276,4,167,0.7300217706728229,3.3724542804239617e-05,94.02095090425931,COMPLETE
