number,value,datetime_start,datetime_complete,duration,params_activation1,params_activation2,params_activation3,params_activation4,params_batch_size,params_fl1,params_fl2,params_fl3,params_fl4,params_learning_rate,params_n_layers,params_num_epochs,params_train_size,params_weight_decay,user_attrs_mre,state
386,107.64447931142954,2023-09-04 19:59:31.150479,2023-09-04 19:59:33.090992,0 days 00:00:01.940513,ReLU,Leaky,,,37,23,22.0,,,0.004089587533032598,2,177,0.7747397758207967,4.433401020232215e-05,0.27552181482315063,COMPLETE
387,90.05192411158008,2023-09-04 19:59:33.091294,2023-09-04 19:59:43.697358,0 days 00:00:10.606064,ReLU,Leaky,,,33,24,20.0,,,0.0002783721995455044,2,395,0.7306659167288952,0.00012245496529664053,0.28812792897224426,COMPLETE
388,89.35054884285762,2023-09-04 19:59:43.697649,2023-09-04 19:59:44.716523,0 days 00:00:01.018874,ReLU,Leaky,,,35,24,22.0,,,0.005656667797126072,2,252,0.6846101453137022,2.6915064521976458e-05,0.3262980878353119,COMPLETE
389,128.42985741719383,2023-09-04 19:59:44.716829,2023-09-04 19:59:59.560041,0 days 00:00:14.843212,Sigmoid,Leaky,,,29,23,21.0,,,0.00015770920204357446,2,375,0.7650460314151569,0.0005784518765334787,0.4380801022052765,COMPLETE
390,106.47558560578719,2023-09-04 19:59:59.560344,2023-09-04 20:00:00.318167,0 days 00:00:00.757823,ReLU,Leaky,,,32,24,24.0,,,0.008138320989070795,2,285,0.5899419958468356,0.000458574220802844,0.3183633089065552,COMPLETE
391,119.13822148851126,2023-09-04 20:00:00.318461,2023-09-04 20:00:02.987326,0 days 00:00:02.668865,ReLU,Leaky,,,31,23,20.0,,,0.0010806523482980942,2,446,0.3970132172450724,5.579294906296683e-05,0.3327002227306366,COMPLETE
392,83.78587556921917,2023-09-04 20:00:02.987633,2023-09-04 20:00:05.044007,0 days 00:00:02.056374,ReLU,Leaky,,,27,24,21.0,,,0.0029628257883812003,2,427,0.7217530958014574,0.00020438923131214438,0.3265592157840729,COMPLETE
393,96.7258729098136,2023-09-04 20:00:05.044304,2023-09-04 20:00:06.398300,0 days 00:00:01.353996,ReLU,Leaky,,,27,23,21.0,,,0.0023983783997554298,2,80,0.3767349585760774,0.00023317170602267317,0.347432404756546,COMPLETE
394,103.39505220809073,2023-09-04 20:00:06.398592,2023-09-04 20:00:07.717768,0 days 00:00:01.319176,ReLU,Leaky,,,25,22,21.0,,,0.010426036815592194,2,125,0.36916352879443654,0.00033048855848920224,0.32213616371154785,COMPLETE
395,88.4012703528771,2023-09-04 20:00:07.718067,2023-09-04 20:00:09.471709,0 days 00:00:01.753642,ReLU,Leaky,,,24,16,19.0,,,0.0029909794852265676,2,409,0.6694765233707762,0.00018014387605458444,0.303483247756958,COMPLETE
396,95.5987203817452,2023-09-04 20:00:09.472009,2023-09-04 20:00:14.642729,0 days 00:00:05.170720,ReLU,Sigmoid,,,22,16,19.0,,,0.0029585908826526936,2,411,0.6463270681154109,0.00016799447824238187,0.2934856116771698,COMPLETE
397,96.97539283133843,2023-09-04 20:00:14.643053,2023-09-04 20:00:15.965256,0 days 00:00:01.322203,ReLU,Leaky,,,23,14,19.0,,,0.003071970734894359,2,425,0.24799200537264912,0.0002043128228969383,0.371494323015213,COMPLETE
398,115.03718913685192,2023-09-04 20:00:15.965555,2023-09-04 20:00:16.823551,0 days 00:00:00.857996,ReLU,Leaky,,,26,15,20.0,,,0.002610067685131395,2,417,0.12586303842114271,0.0001725431176272889,0.4228973388671875,COMPLETE
399,94.65182827680539,2023-09-04 20:00:16.823849,2023-09-04 20:00:18.537028,0 days 00:00:01.713179,ReLU,Leaky,,,25,24,19.0,,,0.00489485056221737,2,406,0.6653147704281103,0.00026596157683012175,0.3044273853302002,COMPLETE
400,99.32658540634881,2023-09-04 20:00:18.537328,2023-09-04 20:00:20.418680,0 days 00:00:01.881352,ReLU,ReLU,,,24,16,19.0,,,0.0034943151884075712,2,428,0.32866881249269647,0.0002161468180500465,0.3442995548248291,COMPLETE
401,97.31235610382467,2023-09-04 20:00:20.418981,2023-09-04 20:00:23.314922,0 days 00:00:02.895941,ReLU,Leaky,,,28,15,20.0,,,0.002152878267379875,2,419,0.6187480801825724,0.0001466170421714542,0.35864439606666565,COMPLETE
402,92.31806226046581,2023-09-04 20:00:23.315224,2023-09-04 20:00:25.573456,0 days 00:00:02.258232,ReLU,Leaky,,,28,24,20.0,,,0.004359204414412882,2,405,0.7138816689296547,0.0001172005493399455,0.3092804253101349,COMPLETE
403,97.84117376804352,2023-09-04 20:00:25.573749,2023-09-04 20:00:27.798376,0 days 00:00:02.224627,ReLU,Leaky,,,26,16,21.0,,,0.0029748777660945436,2,433,0.5495490464116004,3.7360764504520685e-05,0.3175760805606842,COMPLETE
404,90.42881041999877,2023-09-04 20:00:27.798674,2023-09-04 20:00:36.019287,0 days 00:00:08.220613,ReLU,Leaky,ReLU,,20,24,19.0,1.0,,0.0017357394112135745,3,445,0.6826043180144087,0.006322923945346211,0.31827840209007263,COMPLETE
405,91.64266223442263,2023-09-04 20:00:36.019594,2023-09-04 20:00:38.048250,0 days 00:00:02.028656,ReLU,Leaky,,,24,12,20.0,,,0.003770514349353919,2,424,0.7352680540540104,0.0001855895734175703,0.2914736866950989,COMPLETE
406,91.31052743234942,2023-09-04 20:00:38.048546,2023-09-04 20:00:39.051367,0 days 00:00:01.002821,ReLU,Leaky,,,36,23,21.0,,,0.006671231466133854,2,416,0.6434630939793212,7.375657477563336e-05,0.3086828887462616,COMPLETE
407,99.71096333095005,2023-09-04 20:00:39.051660,2023-09-04 20:00:40.408413,0 days 00:00:01.356753,ReLU,Leaky,,,29,23,21.0,,,0.002374110830914995,2,453,0.32302486465314645,0.00037661678025968935,0.3797192871570587,COMPLETE
408,98.01446617974176,2023-09-04 20:00:40.408707,2023-09-04 20:00:41.738336,0 days 00:00:01.329629,ReLU,Leaky,,,34,24,20.0,,,0.004756325189257,2,430,0.7147231726964043,0.0008382492410584334,0.3170669376850128,COMPLETE
409,88.80789786118727,2023-09-04 20:00:41.738642,2023-09-04 20:00:44.635083,0 days 00:00:02.896441,ReLU,Leaky,,,21,24,19.0,,,0.003200354211219821,2,441,0.7441162445543478,0.00065837850022947,0.31417450308799744,COMPLETE
410,129.1584836269947,2023-09-04 20:00:44.635391,2023-09-04 20:00:45.183804,0 days 00:00:00.548413,ReLU,Leaky,,,30,17,21.0,,,0.005763076443269349,2,398,0.18871428055437825,0.0002535782046687863,0.3523033559322357,COMPLETE
411,94.616073290507,2023-09-04 20:00:45.184098,2023-09-04 20:00:46.956893,0 days 00:00:01.772795,ReLU,Leaky,,,27,13,20.0,,,0.003999988355598792,2,470,0.6008754776833224,5.301434772811937e-05,0.36061930656433105,COMPLETE
412,106.12547603072576,2023-09-04 20:00:46.957193,2023-09-04 20:00:59.128886,0 days 00:00:12.171693,ReLU,Leaky,,,43,23,20.0,,,3.921539662284226e-05,2,421,0.6857660903267921,9.911580805210377e-05,0.4220220744609833,COMPLETE
413,95.04533990823998,2023-09-04 20:00:59.129189,2023-09-04 20:01:04.759800,0 days 00:00:05.630611,ReLU,Sigmoid,,,38,24,18.0,,,0.001938756073097712,2,409,0.7665753779319047,7.013126696973063e-05,0.28807419538497925,COMPLETE
414,225.09601200648717,2023-09-04 20:01:04.760106,2023-09-04 20:01:05.443980,0 days 00:00:00.683874,Sigmoid,Leaky,,,33,23,21.0,,,0.0026720698981576073,2,433,0.34991308390492065,0.09343815525156057,0.623616099357605,COMPLETE
415,112.83419059984612,2023-09-04 20:01:05.444273,2023-09-04 20:01:05.763831,0 days 00:00:00.319558,ReLU,Leaky,,,29,22,19.0,,,0.008689808287105447,2,452,0.13927045296707394,0.00014480954948768281,0.37194210290908813,COMPLETE
416,89.68827130717617,2023-09-04 20:01:05.764131,2023-09-04 20:01:07.762616,0 days 00:00:01.998485,ReLU,Leaky,,,36,24,20.0,,,0.003286378644766242,2,427,0.6551888927265122,0.0010260030711277011,0.2877257764339447,COMPLETE
417,118.63533988365761,2023-09-04 20:01:07.762917,2023-09-04 20:01:08.310988,0 days 00:00:00.548071,ReLU,Leaky,,,32,24,21.0,,,0.0047818555605055385,2,442,0.17653014377126286,0.00020843216269277688,0.377611368894577,COMPLETE
418,89.45806620380667,2023-09-04 20:01:08.311288,2023-09-04 20:01:10.041211,0 days 00:00:01.729923,ReLU,Leaky,,,48,23,22.0,,,0.002200446398248943,2,416,0.4238810465336834,4.313311585934285e-05,0.33816757798194885,COMPLETE
419,116.3102533199169,2023-09-04 20:01:10.041518,2023-09-04 20:01:17.561699,0 days 00:00:07.520181,ReLU,ReLU,,,26,22,9.0,,,7.918706018732051e-05,2,432,0.27761926472700693,2.0513624750256216e-05,0.43209728598594666,COMPLETE
420,102.47878654635683,2023-09-04 20:01:17.562018,2023-09-04 20:01:19.314352,0 days 00:00:01.752334,ReLU,Leaky,,,35,24,22.0,,,0.0015069098597513004,2,403,0.7090161554949554,8.690584699032152e-05,0.3040339946746826,COMPLETE
421,124.9826968432011,2023-09-04 20:01:19.314658,2023-09-04 20:01:37.617628,0 days 00:00:18.302970,ReLU,Leaky,,,30,23,20.0,,,1.4346038032052903e-05,2,443,0.7450394110452134,0.0007195442337755794,0.422825425863266,COMPLETE
422,81.35963857741584,2023-09-04 20:01:37.617933,2023-09-04 20:01:39.780219,0 days 00:00:02.162286,ReLU,Leaky,,,24,24,21.0,,,0.0064996109358339965,2,456,0.7633899368744873,1.4004377797903127e-05,0.3223250210285187,COMPLETE
423,81.88373565673828,2023-09-04 20:01:39.780519,2023-09-04 20:01:41.570204,0 days 00:00:01.789685,ReLU,Leaky,,,40,24,21.0,,,0.00687838630995075,2,464,0.7726352462107996,1.0826279892281074e-05,0.28983962535858154,COMPLETE
424,87.99255053202312,2023-09-04 20:01:41.570518,2023-09-04 20:01:42.422852,0 days 00:00:00.852334,ReLU,Leaky,,,41,24,21.0,,,0.007095720228964751,2,463,0.7748851950982784,1.0813496257050804e-05,0.32569658756256104,COMPLETE
425,90.16356262207032,2023-09-04 20:01:42.423152,2023-09-04 20:01:44.153835,0 days 00:00:01.730683,ReLU,Leaky,,,41,24,21.0,,,0.009843320747742699,2,473,0.7753019415180676,1.1292721925614068e-05,0.29764309525489807,COMPLETE
426,89.70772393544515,2023-09-04 20:01:44.154143,2023-09-04 20:01:45.857296,0 days 00:00:01.703153,ReLU,Leaky,,,41,24,22.0,,,0.008571760569931303,2,464,0.7967032030803342,1.4761569757072268e-05,0.24987007677555084,COMPLETE
427,109.74219204829289,2023-09-04 20:01:45.857593,2023-09-04 20:01:47.519887,0 days 00:00:01.662294,ReLU,Leaky,,,44,24,21.0,,,0.007756621042469235,2,466,0.7520053230858501,1.0330899041862659e-05,0.26704004406929016,COMPLETE
428,83.06643086559367,2023-09-04 20:01:47.520193,2023-09-04 20:01:49.440608,0 days 00:00:01.920415,ReLU,Leaky,,,38,24,21.0,,,0.007481058530535519,2,462,0.7719464205337507,1.4417172959024252e-05,0.29984453320503235,COMPLETE
429,95.36239751180013,2023-09-04 20:01:49.440920,2023-09-04 20:01:50.477439,0 days 00:00:01.036519,ReLU,Leaky,,,39,24,21.0,,,0.0069068891926810485,2,471,0.7353332730868072,1.2835899295549273e-05,0.30511558055877686,COMPLETE
430,92.72267615276834,2023-09-04 20:01:50.477742,2023-09-04 20:01:51.302526,0 days 00:00:00.824784,ReLU,Leaky,,,42,24,21.0,,,0.010281292897345574,2,462,0.7992590916932751,1.0087501662034813e-05,0.305395245552063,COMPLETE
431,100.97733998298645,2023-09-04 20:01:51.302830,2023-09-04 20:01:52.926143,0 days 00:00:01.623313,ReLU,Leaky,Tanh,Tanh,38,24,22.0,3.0,20.0,0.008066355373188392,4,458,0.7670592812631716,1.5045220526172592e-05,0.3022949993610382,COMPLETE
432,94.09002271379744,2023-09-04 20:01:52.926465,2023-09-04 20:01:54.116918,0 days 00:00:01.190453,ReLU,Leaky,,,39,24,22.0,,,0.012612936256975293,2,475,0.7250454632209118,1.2737969958488284e-05,0.34235450625419617,COMPLETE
433,86.7925968170166,2023-09-04 20:01:54.117218,2023-09-04 20:01:55.854833,0 days 00:00:01.737615,ReLU,Leaky,,,40,11,21.0,,,0.005934309053083137,2,454,0.7999504454967622,1.6305467091148553e-05,0.3374176025390625,COMPLETE
434,98.47367377030223,2023-09-04 20:01:55.855137,2023-09-04 20:01:56.395555,0 days 00:00:00.540418,ReLU,Leaky,,,40,23,21.0,,,0.0060752651275867275,2,454,0.28807522326331203,1.7829454905487447e-05,0.3302396535873413,COMPLETE
435,102.93819116086377,2023-09-04 20:01:56.395864,2023-09-04 20:01:57.374987,0 days 00:00:00.979123,ReLU,Leaky,,,43,8,22.0,,,0.0062208127769816995,2,455,0.4549823848229957,1.478655567747164e-05,0.3372013568878174,COMPLETE
436,290.43598022460935,2023-09-04 20:01:57.375291,2023-09-04 20:01:57.941034,0 days 00:00:00.565743,ReLU,Leaky,,,46,10,21.0,,,0.005692604802539558,2,452,0.2340811942573278,1.7899843992890813e-05,0.3340073525905609,COMPLETE
437,102.50465611049107,2023-09-04 20:01:57.941335,2023-09-04 20:01:59.861637,0 days 00:00:01.920302,ReLU,Leaky,,,39,23,21.0,,,0.007034469005324079,2,461,0.7412719105861573,2.350068467690302e-05,0.2908571660518646,COMPLETE
438,110.56254810757108,2023-09-04 20:01:59.861938,2023-09-04 20:02:00.504508,0 days 00:00:00.642570,ReLU,Leaky,,,38,24,22.0,,,0.008533864031890834,2,466,0.35880328550650226,1.81845846161018e-05,0.33913636207580566,COMPLETE
439,88.68915854560004,2023-09-04 20:02:00.504811,2023-09-04 20:02:02.483206,0 days 00:00:01.978395,ReLU,Leaky,,,37,9,21.0,,,0.005382282805171742,2,478,0.7709713653023371,1.3102818738900127e-05,0.32691511511802673,COMPLETE
440,81.77636249248798,2023-09-04 20:02:02.483508,2023-09-04 20:02:03.986555,0 days 00:00:01.503047,ReLU,Leaky,,,37,24,22.0,,,0.004629431328158221,2,451,0.7984020855355893,1.627778307593382e-05,0.3098786771297455,COMPLETE
441,99.8368177593879,2023-09-04 20:02:03.986857,2023-09-04 20:02:04.731619,0 days 00:00:00.744762,ReLU,Leaky,,,40,10,23.0,,,0.015942625682746736,2,451,0.29737395769275815,1.5287360614789435e-05,0.38635924458503723,COMPLETE
442,94.9669436500186,2023-09-04 20:02:04.731930,2023-09-04 20:02:05.498927,0 days 00:00:00.766997,ReLU,Leaky,,,37,23,22.0,,,0.006897380205519027,2,467,0.3623776228241275,1.3063702084676066e-05,0.31991514563560486,COMPLETE
443,139.65101687113443,2023-09-04 20:02:05.499236,2023-09-04 20:02:06.799345,0 days 00:00:01.300109,ReLU,Leaky,,,40,12,23.0,,,0.004958510513027429,2,448,0.7929609574757261,2.333251168133778e-05,0.3018205165863037,COMPLETE
444,238.10160931086136,2023-09-04 20:02:06.799655,2023-09-04 20:02:07.670632,0 days 00:00:00.870977,ReLU,Leaky,,,37,24,22.0,,,0.00987756036538778,2,456,0.29407693802863377,2.0993102598241786e-05,0.32363927364349365,COMPLETE
445,86.80595461527507,2023-09-04 20:02:07.670939,2023-09-04 20:02:08.892401,0 days 00:00:01.221462,ReLU,Leaky,,,42,23,22.0,,,0.011514027005119137,2,448,0.7700266998155928,1.6712706257850615e-05,0.30132803320884705,COMPLETE
446,96.5362813980853,2023-09-04 20:02:08.892699,2023-09-04 20:02:10.959211,0 days 00:00:02.066512,Sigmoid,Leaky,,,43,11,23.0,,,0.010938654925119877,2,471,0.7985276667367991,1.4164506062919541e-05,0.299760103225708,COMPLETE
447,85.87049020303262,2023-09-04 20:02:10.959512,2023-09-04 20:02:12.277279,0 days 00:00:01.317767,ReLU,Leaky,,,39,23,22.0,,,0.014497631098654179,2,458,0.7643795987374868,1.728435624010911e-05,0.32363608479499817,COMPLETE
448,124.63736324310302,2023-09-04 20:02:12.277571,2023-09-04 20:02:13.682760,0 days 00:00:01.405189,ReLU,Leaky,,,42,23,22.0,,,0.014631690921029747,2,459,0.7998867848851348,1.549800481410361e-05,0.291350394487381,COMPLETE
449,105.18731689453125,2023-09-04 20:02:13.683063,2023-09-04 20:02:14.761633,0 days 00:00:01.078570,ReLU,Leaky,,,40,9,22.0,,,0.011834643719088494,2,476,0.7586725183616332,1.232891654459493e-05,0.33297303318977356,COMPLETE
450,136.9366675711967,2023-09-04 20:02:14.761941,2023-09-04 20:02:15.957268,0 days 00:00:01.195327,ReLU,Leaky,,,44,11,23.0,,,0.02232629458257258,2,461,0.7620446471019188,1.97192436996842e-05,0.3502041697502136,COMPLETE
451,83.80261484781902,2023-09-04 20:02:15.957575,2023-09-04 20:02:16.859003,0 days 00:00:00.901428,ReLU,Leaky,,,42,23,22.0,,,0.008833440661770654,2,452,0.7447901406648118,1.5890713779117394e-05,0.3256833851337433,COMPLETE
452,92.57227813720704,2023-09-04 20:02:16.859308,2023-09-04 20:02:17.688207,0 days 00:00:00.828899,ReLU,Leaky,,,42,22,22.0,,,0.009017125239121418,2,454,0.7387024847367504,1.7382724276897996e-05,0.3132433593273163,COMPLETE
453,93.51409996880426,2023-09-04 20:02:17.688517,2023-09-04 20:02:18.642772,0 days 00:00:00.954255,ReLU,Leaky,,,40,11,22.0,,,0.01010407159079065,2,482,0.7690577069489315,1.680008482485447e-05,0.3004815876483917,COMPLETE
454,98.08176875758815,2023-09-04 20:02:18.643106,2023-09-04 20:02:19.760927,0 days 00:00:01.117821,ReLU,Leaky,,,46,12,23.0,,,0.017172554043201588,2,470,0.7338719073458468,2.144099415309282e-05,0.33401525020599365,COMPLETE
455,83.02563959757487,2023-09-04 20:02:19.761236,2023-09-04 20:02:20.865989,0 days 00:00:01.104753,ReLU,Leaky,,,38,23,22.0,,,0.012645849716192597,2,447,0.7702674906090524,1.628598345592133e-05,0.3049347996711731,COMPLETE
456,88.21712646484374,2023-09-04 20:02:20.866300,2023-09-04 20:02:21.838367,0 days 00:00:00.972067,ReLU,Leaky,,,42,23,22.0,,,0.013834933439791213,2,448,0.7232330927951697,1.66816401022604e-05,0.3282712697982788,COMPLETE
457,96.7399398803711,2023-09-04 20:02:21.838674,2023-09-04 20:02:22.817544,0 days 00:00:00.978870,ReLU,Leaky,,,44,22,21.0,,,0.01218667717641513,2,447,0.7592735586994799,1.2438141443703772e-05,0.3008148670196533,COMPLETE
458,93.25577253453872,2023-09-04 20:02:22.817844,2023-09-04 20:02:24.032702,0 days 00:00:01.214858,ReLU,Leaky,,,38,23,22.0,,,0.012210903661686671,2,446,0.7478547601921577,2.6069676455491618e-05,0.2745908498764038,COMPLETE
459,112.57238101959229,2023-09-04 20:02:24.033022,2023-09-04 20:02:25.744128,0 days 00:00:01.711106,ReLU,Sigmoid,,,39,22,22.0,,,0.013398283351354078,2,466,0.7700888140366328,1.644485575944593e-05,0.3121762275695801,COMPLETE
460,85.99827620562385,2023-09-04 20:02:25.744439,2023-09-04 20:02:26.824498,0 days 00:00:01.080059,ReLU,Leaky,,,42,23,21.0,,,0.008508643360954643,2,456,0.7153289819620494,2.427140553639671e-05,0.2901056408882141,COMPLETE
461,105.43085888453892,2023-09-04 20:02:26.824801,2023-09-04 20:02:27.253330,0 days 00:00:00.428529,ReLU,Leaky,,,41,23,21.0,,,0.008814791660361433,2,455,0.313025902164259,1.9495664263922485e-05,0.33104026317596436,COMPLETE
462,93.44709396362305,2023-09-04 20:02:27.253631,2023-09-04 20:02:28.129675,0 days 00:00:00.876044,ReLU,ReLU,,,39,22,21.0,,,0.008428835924524983,2,467,0.71526103572176,2.4966580957710366e-05,0.3443216383457184,COMPLETE
463,80.46665445963542,2023-09-04 20:02:28.129976,2023-09-04 20:02:29.231964,0 days 00:00:01.101988,ReLU,Leaky,,,44,23,21.0,,,0.007610837490174871,2,458,0.710722291493196,2.2703448357596322e-05,0.3288680911064148,COMPLETE
464,575.3593650640444,2023-09-04 20:02:29.232260,2023-09-04 20:02:29.879174,0 days 00:00:00.646914,ReLU,Leaky,,,47,23,21.0,,,0.0076503301226672,2,484,0.3502174552509929,1.9281236395753284e-05,0.2861718237400055,COMPLETE
465,126.52193204439604,2023-09-04 20:02:29.879477,2023-09-04 20:02:31.412901,0 days 00:00:01.533424,ReLU,,,,45,23,,,,0.010122589386739378,1,475,0.7099877119919318,2.1603542106648704e-05,0.35318490862846375,COMPLETE
466,126.90260668768398,2023-09-04 20:02:31.413198,2023-09-04 20:02:33.912237,0 days 00:00:02.499039,ReLU,Leaky,Sigmoid,,43,23,21.0,10.0,,0.0075243888647691685,3,442,0.7098230883157114,2.597438942338625e-05,0.32573363184928894,COMPLETE
467,188.0540475284352,2023-09-04 20:02:33.912547,2023-09-04 20:02:34.796766,0 days 00:00:00.884219,ReLU,Leaky,,,37,22,22.0,,,0.01895628428834414,2,465,0.5190568066530326,2.9904444954094268e-05,0.28957346081733704,COMPLETE
468,81.0464956405315,2023-09-04 20:02:34.797076,2023-09-04 20:02:36.165284,0 days 00:00:01.368208,ReLU,Leaky,,,49,23,21.0,,,0.009855605854230533,2,457,0.7303940531430954,1.3205425812656707e-05,0.2829328179359436,COMPLETE
469,86.15026550292968,2023-09-04 20:02:36.165587,2023-09-04 20:02:37.091325,0 days 00:00:00.925738,ReLU,Leaky,,,46,22,21.0,,,0.010247538589232824,2,462,0.7319776065375115,1.0155658094500263e-05,0.3194347620010376,COMPLETE
470,88.14911073626894,2023-09-04 20:02:37.091634,2023-09-04 20:02:38.070815,0 days 00:00:00.979181,ReLU,Leaky,,,48,22,21.0,,,0.009693777192025186,2,474,0.7286874500881536,1.1940194089623907e-05,0.28531384468078613,COMPLETE
471,91.99116243634906,2023-09-04 20:02:38.071116,2023-09-04 20:02:38.929602,0 days 00:00:00.858486,ReLU,Leaky,,,47,23,21.0,,,0.013236282156782082,2,343,0.7365069253993772,1.3404612721489213e-05,0.2923392951488495,COMPLETE
472,180.52042284198836,2023-09-04 20:02:38.929905,2023-09-04 20:02:40.413811,0 days 00:00:01.483906,ReLU,Leaky,,,45,22,8.0,,,0.01521246560702967,2,462,0.7011812785427494,1.0123579690162264e-05,0.3011000454425812,COMPLETE
473,124.64491565410907,2023-09-04 20:02:40.414112,2023-09-04 20:02:40.868898,0 days 00:00:00.454786,ReLU,Leaky,,,45,23,21.0,,,0.011155384742983165,2,459,0.2510887674875906,1.3959579538278201e-05,0.33143240213394165,COMPLETE
474,102.39949471609933,2023-09-04 20:02:40.869204,2023-09-04 20:02:41.516009,0 days 00:00:00.646805,ReLU,Leaky,,,47,23,21.0,,,0.008438548359556734,2,469,0.7305414987572643,1.1701725624286704e-05,0.336590051651001,COMPLETE
475,102.27895518711635,2023-09-04 20:02:41.516323,2023-09-04 20:02:42.664216,0 days 00:00:01.147893,ReLU,Leaky,,,50,23,20.0,,,0.011803315583345887,2,486,0.6980131557531349,1.013426600650061e-05,0.3228462338447571,COMPLETE
476,132.0860790453459,2023-09-04 20:02:42.664526,2023-09-04 20:02:43.337109,0 days 00:00:00.672583,ReLU,Leaky,,,42,22,2.0,,,0.007025153720984177,2,452,0.38869469841382187,2.110501341076884e-05,0.32769131660461426,COMPLETE
477,84.1927802141975,2023-09-04 20:02:43.337415,2023-09-04 20:02:44.452261,0 days 00:00:01.114846,ReLU,Leaky,,,43,23,21.0,,,0.01009076846823507,2,440,0.7473588323407476,1.3714250559595849e-05,0.3392923176288605,COMPLETE
478,95.82822251753373,2023-09-04 20:02:44.452565,2023-09-04 20:02:46.175299,0 days 00:00:01.722734,ReLU,Leaky,,,44,7,21.0,,,0.009498582428247667,2,441,0.7484446042394666,1.4038139338965276e-05,0.3076803684234619,COMPLETE
479,180.5430450439453,2023-09-04 20:02:46.175605,2023-09-04 20:02:47.332068,0 days 00:00:01.156463,ReLU,Leaky,,,44,22,21.0,,,0.009412952590572997,2,456,0.7500086351513428,1.4349479889497958e-05,0.30120494961738586,COMPLETE
480,102.3287046843884,2023-09-04 20:02:47.332378,2023-09-04 20:02:47.803318,0 days 00:00:00.470940,ReLU,Leaky,,,48,23,22.0,,,0.016186429105412896,2,464,0.20581522553886908,1.5759753766369206e-05,0.36204850673675537,COMPLETE
481,97.04992188347711,2023-09-04 20:02:47.803632,2023-09-04 20:02:48.806695,0 days 00:00:01.003063,ReLU,Leaky,,,52,22,21.0,,,0.011216056877459394,2,441,0.7210758968422268,2.349400389541987e-05,0.3017118573188782,COMPLETE
482,95.13565916173599,2023-09-04 20:02:48.807002,2023-09-04 20:02:50.432698,0 days 00:00:01.625696,ReLU,Leaky,,,46,23,22.0,,,0.008450258479873955,2,478,0.7727977435299347,1.1883368032164405e-05,0.32436859607696533,COMPLETE
