number,value,datetime_start,datetime_complete,duration,params_activation1,params_activation2,params_activation3,params_activation4,params_batch_size,params_fl1,params_fl2,params_fl3,params_fl4,params_learning_rate,params_n_layers,params_num_epochs,params_train_size,params_weight_decay,user_attrs_mre,state
272,0.352496862411499,2023-09-04 18:48:26.173126,2023-09-04 18:48:27.610970,0 days 00:00:01.437844,Tanh,Leaky,Leaky,Leaky,44,20,17.0,21.0,17.0,0.003180329251330016,4,248,0.2736938977795128,0.0014744595701175287,349.0420546098189,COMPLETE
273,0.3314089775085449,2023-09-04 18:48:27.611282,2023-09-04 18:48:29.609206,0 days 00:00:01.997924,Leaky,Leaky,ReLU,Sigmoid,48,22,19.0,22.0,18.0,0.0041332843795519065,4,179,0.76375486532852,0.0006985618357163569,188.226668065908,COMPLETE
274,0.30452942848205566,2023-09-04 18:48:29.609518,2023-09-04 18:48:31.501586,0 days 00:00:01.892068,Tanh,Leaky,ReLU,Leaky,51,19,17.0,21.0,18.0,0.005464301162161551,4,289,0.7980647980303348,0.00047838994048600745,235.1328582763672,COMPLETE
275,0.4339512884616852,2023-09-04 18:48:31.501912,2023-09-04 18:48:31.979884,0 days 00:00:00.477972,Tanh,Leaky,Leaky,Tanh,55,19,17.0,21.0,19.0,0.0051980185302656174,4,302,0.1547077672944435,0.0004235231541013242,146.55081063729745,COMPLETE
276,0.3568570911884308,2023-09-04 18:48:31.980190,2023-09-04 18:48:33.848285,0 days 00:00:01.868095,Tanh,Leaky,,,52,18,18.0,,,0.0066714603239941914,2,290,0.6720762018677366,0.0004435848351184055,114.36457377115886,COMPLETE
277,0.36992567777633667,2023-09-04 18:48:33.848580,2023-09-04 18:48:35.574353,0 days 00:00:01.725773,Tanh,Leaky,ReLU,Leaky,58,10,19.0,20.0,15.0,0.0043606767378089805,4,313,0.4750377628869372,0.001201971496324852,145.87324875279478,COMPLETE
278,0.3401092290878296,2023-09-04 18:48:35.574665,2023-09-04 18:48:37.410515,0 days 00:00:01.835850,Tanh,Leaky,ReLU,Sigmoid,38,19,18.0,24.0,17.0,0.005803524880763374,4,288,0.7203117730681655,0.0005163130255583586,182.46913694724057,COMPLETE
279,0.35046568512916565,2023-09-04 18:48:37.410826,2023-09-04 18:48:42.479693,0 days 00:00:05.068867,Tanh,Tanh,Leaky,Tanh,48,12,20.0,21.0,20.0,0.001007457358167091,4,295,0.798066685165841,0.00038046067021681374,244.66250546773276,COMPLETE
280,0.3203166127204895,2023-09-04 18:48:42.480011,2023-09-04 18:48:44.388579,0 days 00:00:01.908568,Tanh,Leaky,ReLU,Leaky,42,21,19.0,20.0,16.0,0.00522997278077537,4,277,0.7435022176227053,0.0008150787866412312,901.4309763353924,COMPLETE
281,0.37869659066200256,2023-09-04 18:48:44.388900,2023-09-04 18:48:46.132974,0 days 00:00:01.744074,Tanh,Sigmoid,ReLU,Leaky,41,21,18.0,20.0,15.0,0.0076430105600367925,4,282,0.7500800767770395,0.0008723141487042886,253.26948299923458,COMPLETE
282,0.3053935766220093,2023-09-04 18:48:46.133285,2023-09-04 18:48:48.609073,0 days 00:00:02.475788,Tanh,Leaky,ReLU,Tanh,39,22,17.0,20.0,16.0,0.005460527753652738,4,271,0.7332637443162038,0.0007619627134710069,160.38237892006927,COMPLETE
283,0.6806085109710693,2023-09-04 18:48:48.609376,2023-09-04 18:48:49.170920,0 days 00:00:00.561544,Tanh,Leaky,ReLU,Tanh,37,23,20.0,19.0,15.0,0.09018672884603095,4,274,0.7297241275147698,0.0007731345419696314,2272.5641590465198,COMPLETE
284,0.36284106969833374,2023-09-04 18:48:49.171237,2023-09-04 18:48:50.107366,0 days 00:00:00.936129,Tanh,Leaky,ReLU,Tanh,39,22,19.0,19.0,16.0,0.006629546781073374,4,276,0.3021568000076251,0.0010819555145200434,278.84918843144953,COMPLETE
285,0.328197717666626,2023-09-04 18:48:50.107693,2023-09-04 18:48:52.104365,0 days 00:00:01.996672,Tanh,Leaky,ReLU,Tanh,78,20,17.0,20.0,16.0,0.005283905750748627,4,265,0.7507698039430849,0.000694148461043108,163.90192211375518,COMPLETE
286,0.41209498047828674,2023-09-04 18:48:52.104671,2023-09-04 18:48:53.592387,0 days 00:00:01.487716,Tanh,Leaky,Sigmoid,Tanh,42,21,18.0,5.0,14.0,0.0412969793716687,4,287,0.6967949980162657,0.000985953841922393,182.2229995727539,COMPLETE
287,0.4646054804325104,2023-09-04 18:48:53.592695,2023-09-04 18:48:54.681200,0 days 00:00:01.088505,Tanh,Leaky,ReLU,Leaky,43,22,19.0,20.0,16.0,0.0016707973444747436,4,281,0.1180183615035238,0.000578699639684131,177.54360322391287,COMPLETE
288,0.3539310097694397,2023-09-04 18:48:54.681524,2023-09-04 18:48:57.346142,0 days 00:00:02.664618,ReLU,Leaky,ReLU,Sigmoid,40,21,20.0,21.0,17.0,0.005943834583065548,4,301,0.7726569846537974,0.0008496867274808508,307.7369935171945,COMPLETE
289,0.38572171330451965,2023-09-04 18:48:57.346455,2023-09-04 18:48:58.391356,0 days 00:00:01.044901,Tanh,Leaky,ReLU,Tanh,44,18,18.0,23.0,16.0,0.002039648670728379,4,271,0.38016206370291955,7.811617332853023e-05,738.4129300324813,COMPLETE
290,0.3430245518684387,2023-09-04 18:48:58.391670,2023-09-04 18:49:00.609655,0 days 00:00:02.217985,Tanh,Leaky,ReLU,Leaky,40,19,17.0,21.0,20.0,0.00862825559333374,4,264,0.7192985866857189,0.0005185894320276936,360.5058994293213,COMPLETE
291,0.44834691286087036,2023-09-04 18:49:00.609974,2023-09-04 18:49:01.872779,0 days 00:00:01.262805,Tanh,Leaky,ReLU,Tanh,36,21,6.0,20.0,10.0,0.0013872777321516858,4,190,0.1827470078398555,0.0012471790237001466,155.50084033454817,COMPLETE
292,0.36188146471977234,2023-09-04 18:49:01.873087,2023-09-04 18:49:05.117226,0 days 00:00:03.244139,Sigmoid,Leaky,ReLU,Leaky,63,22,19.0,23.0,19.0,0.003344497897032309,4,289,0.7426378433118045,0.000759328080351621,200.26468264401615,COMPLETE
293,0.3375057280063629,2023-09-04 18:49:05.117528,2023-09-04 18:49:06.872870,0 days 00:00:01.755342,Tanh,Leaky,ReLU,Sigmoid,53,20,19.0,22.0,17.0,0.005144418433440124,4,163,0.6917134994319765,2.1246286056561887e-05,197.28463928222655,COMPLETE
294,0.3537088632583618,2023-09-04 18:49:06.873187,2023-09-04 18:49:08.477455,0 days 00:00:01.604268,Tanh,Leaky,ReLU,Leaky,46,19,20.0,22.0,17.0,0.02173532691634941,4,308,0.795661870900145,0.0006258718088994145,164.56624137030707,COMPLETE
295,0.35820120573043823,2023-09-04 18:49:08.477767,2023-09-04 18:49:10.744222,0 days 00:00:02.266455,Tanh,Leaky,Tanh,Tanh,51,20,18.0,21.0,18.0,0.0018988840847466608,4,279,0.7989850501652247,0.0009571655424194616,157.77262714930944,COMPLETE
296,0.3391522765159607,2023-09-04 18:49:10.744541,2023-09-04 18:49:12.953209,0 days 00:00:02.208668,Tanh,Leaky,ReLU,Leaky,42,21,16.0,24.0,16.0,0.0027261598784459025,4,259,0.7454156409886566,0.0016721331637753775,199.47948991491438,COMPLETE
297,0.32768508791923523,2023-09-04 18:49:12.953522,2023-09-04 18:49:14.611720,0 days 00:00:01.658198,Tanh,Leaky,ReLU,Sigmoid,53,18,17.0,22.0,19.0,0.010659730185011826,4,298,0.7087743428475606,0.0004957063233644463,230.76250181806847,COMPLETE
298,0.3456268310546875,2023-09-04 18:49:14.612036,2023-09-04 18:49:16.663341,0 days 00:00:02.051305,Tanh,Leaky,Tanh,Tanh,56,22,19.0,23.0,19.0,0.007439777082375411,4,269,0.6777998989740812,0.0006815316229440766,186.22989690871466,COMPLETE
299,0.3744218349456787,2023-09-04 18:49:16.663655,2023-09-04 18:49:22.503443,0 days 00:00:05.839788,Leaky,Leaky,ReLU,Leaky,39,19,3.0,11.0,14.0,0.0022748006780828607,4,183,0.7638530124317534,0.0008467978145428651,813.0548275925044,COMPLETE
300,0.32056674361228943,2023-09-04 18:49:22.503762,2023-09-04 18:49:25.445242,0 days 00:00:02.941480,Tanh,Leaky,ReLU,Tanh,49,20,18.0,21.0,18.0,0.0016042666602019413,4,281,0.7253110474596148,0.0011894990094328181,202.9632810934996,COMPLETE
301,0.33464255928993225,2023-09-04 18:49:25.445558,2023-09-04 18:49:28.348808,0 days 00:00:02.903250,Tanh,Leaky,ReLU,Tanh,50,20,17.0,21.0,18.0,0.0013310989509189432,4,284,0.7250505946782607,0.0008256896235256151,183.90199621100174,COMPLETE
302,0.42216530442237854,2023-09-04 18:49:28.349135,2023-09-04 18:49:29.193694,0 days 00:00:00.844559,Tanh,Leaky,ReLU,Tanh,45,20,18.0,21.0,17.0,0.0016219576242743044,4,277,0.16670736949805678,0.0010105904212741454,131.35130630304783,COMPLETE
303,0.40511947870254517,2023-09-04 18:49:29.194006,2023-09-04 18:49:33.513753,0 days 00:00:04.319747,Tanh,Sigmoid,ReLU,Tanh,48,21,18.0,20.0,18.0,0.001119447480820819,4,296,0.23854120823361147,0.0014202319266870185,320.54021897552707,COMPLETE
304,0.35500603914260864,2023-09-04 18:49:33.514067,2023-09-04 18:49:34.959561,0 days 00:00:01.445494,Tanh,Tanh,ReLU,Tanh,51,20,18.0,10.0,18.0,0.004501589440823074,4,320,0.42518101112196005,0.001222886523111058,234.8203996600527,COMPLETE
305,0.3311614990234375,2023-09-04 18:49:34.959881,2023-09-04 18:49:38.440298,0 days 00:00:03.480417,Tanh,Leaky,ReLU,Leaky,54,19,21.0,22.0,17.0,0.0016328325766296356,4,261,0.7660393564387035,0.001458523410650511,203.54017130533853,COMPLETE
306,0.38756063580513,2023-09-04 18:49:38.440620,2023-09-04 18:49:39.110798,0 days 00:00:00.670178,Tanh,Leaky,ReLU,Tanh,49,19,20.0,19.0,18.0,0.006498644614891837,4,274,0.2722778523746978,0.00010576834360196889,356.469285831895,COMPLETE
307,0.45434439182281494,2023-09-04 18:49:39.111117,2023-09-04 18:49:48.367269,0 days 00:00:09.256152,Tanh,Leaky,Tanh,Sigmoid,60,21,19.0,21.0,2.0,0.0005850217002909184,4,286,0.7339761443610837,0.001115730665052616,205.25914753733815,COMPLETE
308,0.35149651765823364,2023-09-04 18:49:48.367585,2023-09-04 18:49:49.697803,0 days 00:00:01.330218,Tanh,Leaky,ReLU,Leaky,46,20,17.0,23.0,17.0,0.00549513931667361,4,271,0.6994587380344739,0.0010670302103046832,182.69438402580494,COMPLETE
309,0.41735097765922546,2023-09-04 18:49:49.698117,2023-09-04 18:49:51.246377,0 days 00:00:01.548260,Tanh,Leaky,Sigmoid,Tanh,44,20,19.0,22.0,16.0,0.0033877414119220816,4,257,0.21044477207813306,0.0027867555811799246,173.69769917637848,COMPLETE
310,0.33806112408638,2023-09-04 18:49:51.246695,2023-09-04 18:49:53.920963,0 days 00:00:02.674268,Tanh,Leaky,ReLU,Leaky,51,12,18.0,18.0,18.0,0.001181194161460495,4,297,0.7663287304188997,0.0006460864796515493,173.9788475036621,COMPLETE
311,0.3748248517513275,2023-09-04 18:49:53.921281,2023-09-04 18:49:59.507950,0 days 00:00:05.586669,Tanh,Leaky,Tanh,Sigmoid,48,13,16.0,22.0,19.0,0.0019317108859861665,4,282,0.6587925513760491,0.0019093109714241648,181.37342918723638,COMPLETE
312,0.33488693833351135,2023-09-04 18:49:59.508256,2023-09-04 18:50:01.746273,0 days 00:00:02.238017,Tanh,Leaky,ReLU,Tanh,42,19,19.0,20.0,15.0,0.003914060212497695,4,292,0.7996395073849202,0.0003607280280336183,200.4904830607962,COMPLETE
313,0.3326875865459442,2023-09-04 18:50:01.746583,2023-09-04 18:50:04.313049,0 days 00:00:02.566466,ReLU,Leaky,ReLU,Leaky,55,21,18.0,21.0,16.0,0.0014005744637444197,4,262,0.7206655490300578,0.0007402474780993552,994.3546012369792,COMPLETE
314,0.3570174276828766,2023-09-04 18:50:04.313414,2023-09-04 18:50:05.786705,0 days 00:00:01.473291,Tanh,Leaky,ReLU,,52,14,17.0,23.0,,0.004706247779449757,3,270,0.7499811707020242,0.0009004533789199469,160.09961434297784,COMPLETE
315,0.33548080921173096,2023-09-04 18:50:05.787012,2023-09-04 18:50:11.702726,0 days 00:00:05.915714,Tanh,Leaky,Tanh,Tanh,49,8,19.0,22.0,17.0,0.0026911475054534006,4,251,0.6849054403460193,0.0012971495984190292,175.50947669534122,COMPLETE
316,0.34802109003067017,2023-09-04 18:50:11.703050,2023-09-04 18:50:13.034502,0 days 00:00:01.331452,Tanh,Leaky,ReLU,Leaky,46,18,20.0,22.0,19.0,0.0036080034921156918,4,280,0.6461654064519208,0.0022246982183409076,164.49856649862753,COMPLETE
317,0.32887721061706543,2023-09-04 18:50:13.034816,2023-09-04 18:50:20.498803,0 days 00:00:07.463987,Tanh,Leaky,ReLU,Sigmoid,53,20,19.0,21.0,18.0,0.0009116843720979562,4,237,0.7094527933440574,0.0005692253333223978,182.6298617237019,COMPLETE
318,0.3166615068912506,2023-09-04 18:50:20.499112,2023-09-04 18:50:23.678844,0 days 00:00:03.179732,Sigmoid,Leaky,ReLU,Tanh,40,13,17.0,24.0,18.0,0.009483215503656325,4,172,0.7608188229520033,0.0004207785633874528,240.03279514000064,COMPLETE
319,0.4239344894886017,2023-09-04 18:50:23.679156,2023-09-04 18:50:24.144168,0 days 00:00:00.465012,Leaky,Leaky,ReLU,Tanh,38,13,17.0,24.0,19.0,0.00900455470899416,4,177,0.13373117644546573,0.000436216805299146,163.51294840937075,COMPLETE
320,0.31864526867866516,2023-09-04 18:50:24.144491,2023-09-04 18:50:27.845764,0 days 00:00:03.701273,Sigmoid,Leaky,ReLU,Tanh,41,13,16.0,24.0,13.0,0.008250154103921246,4,170,0.7998689322841293,0.00037195227815435653,160.09827122218172,COMPLETE
321,0.3404541015625,2023-09-04 18:50:27.846078,2023-09-04 18:50:31.616635,0 days 00:00:03.770557,Sigmoid,Leaky,ReLU,Tanh,40,13,16.0,24.0,12.0,0.00793126245527431,4,160,0.769227453576259,0.00033067717342211026,197.35886425442166,COMPLETE
322,0.3700428307056427,2023-09-04 18:50:31.616942,2023-09-04 18:50:33.811051,0 days 00:00:02.194109,Sigmoid,Leaky,ReLU,Tanh,37,12,16.0,24.0,15.0,0.011029094167441156,4,169,0.7964847748137796,0.00038436422426242877,181.00016503585013,COMPLETE
323,0.3803770840167999,2023-09-04 18:50:33.811359,2023-09-04 18:50:36.072039,0 days 00:00:02.260680,Sigmoid,Leaky,ReLU,Tanh,41,13,15.0,24.0,13.0,0.00970119572873671,4,147,0.7674194335206018,0.001602737861322225,195.89302859099016,COMPLETE
324,0.339263916015625,2023-09-04 18:50:36.072346,2023-09-04 18:50:38.540069,0 days 00:00:02.467723,Tanh,Leaky,ReLU,Tanh,43,11,18.0,24.0,16.0,0.006894881736825285,4,169,0.7996372669183761,0.0009666145567557192,179.60940610445462,COMPLETE
325,0.35249996185302734,2023-09-04 18:50:38.540382,2023-09-04 18:50:41.551303,0 days 00:00:03.010921,Sigmoid,Leaky,ReLU,Tanh,39,13,16.0,23.0,17.0,0.013593414555598211,4,157,0.7390673378394644,0.0002946106469082154,201.70056810050175,COMPLETE
326,0.34381958842277527,2023-09-04 18:50:41.551604,2023-09-04 18:50:44.716254,0 days 00:00:03.164650,Sigmoid,Leaky,ReLU,Tanh,41,23,17.0,24.0,18.0,0.008740472421545537,4,137,0.7426703660343411,0.0007220503662266024,368.3883732722356,COMPLETE
327,0.36581316590309143,2023-09-04 18:50:44.716564,2023-09-04 18:50:47.614417,0 days 00:00:02.897853,Sigmoid,Leaky,ReLU,Tanh,36,14,18.0,23.0,11.0,0.011890014271628087,4,176,0.7677242801305321,0.0003947142684625186,138.6014238504263,COMPLETE
328,0.39267733693122864,2023-09-04 18:50:47.614729,2023-09-04 18:50:51.022729,0 days 00:00:03.408000,Sigmoid,Sigmoid,ReLU,Tanh,44,12,16.0,23.0,17.0,0.0072478668415255935,4,193,0.7256633881267011,0.0006115318936385772,222.33336751302085,COMPLETE
329,0.6636492609977722,2023-09-04 18:50:51.023041,2023-09-04 18:50:52.755128,0 days 00:00:01.732087,Sigmoid,Leaky,ReLU,Tanh,39,1,19.0,24.0,18.0,0.005918103778387884,4,185,0.200641151965602,0.0011529734831024077,174.28949818244348,COMPLETE
330,0.44169512391090393,2023-09-04 18:50:52.755461,2023-09-04 18:50:55.489650,0 days 00:00:02.734189,Sigmoid,Tanh,,,57,21,18.0,,,0.0016831941230828894,2,173,0.45739646383927285,0.0008579291850363908,208.7420916254121,COMPLETE
331,0.35944533348083496,2023-09-04 18:50:55.489944,2023-09-04 18:50:59.652116,0 days 00:00:04.162172,Sigmoid,Leaky,ReLU,Sigmoid,42,14,21.0,23.0,16.0,0.010569106421797104,4,310,0.5167340597431213,0.0005199021607707705,254.8149307713364,COMPLETE
332,0.3636741042137146,2023-09-04 18:50:59.652434,2023-09-04 18:51:02.451691,0 days 00:00:02.799257,Sigmoid,Leaky,ReLU,Tanh,34,22,20.0,20.0,18.0,0.002146963828700859,4,289,0.7657029692724999,0.0003166761548153249,237.00675684091996,COMPLETE
333,0.34278255701065063,2023-09-04 18:51:02.452013,2023-09-04 18:51:09.840853,0 days 00:00:07.388840,Sigmoid,Leaky,ReLU,Tanh,51,13,17.0,22.0,18.0,0.001438639247418507,4,181,0.7983035443827113,0.0007615604267536862,1324.403559987138,COMPLETE
334,0.36669158935546875,2023-09-04 18:51:09.841162,2023-09-04 18:51:13.503092,0 days 00:00:03.661930,Sigmoid,Leaky,Sigmoid,Sigmoid,43,20,19.0,21.0,19.0,0.005692924119765047,4,165,0.7085110776187963,0.0004534511646870304,231.94550091287365,COMPLETE
335,0.4511328339576721,2023-09-04 18:51:13.503398,2023-09-04 18:51:15.247232,0 days 00:00:01.743834,Tanh,Leaky,Leaky,Tanh,55,5,18.0,23.0,13.0,0.017412336210980383,4,153,0.7445109777927408,0.0066201494294276225,330.0832815170288,COMPLETE
336,0.37658795714378357,2023-09-04 18:51:15.247541,2023-09-04 18:51:17.675894,0 days 00:00:02.428353,Tanh,Leaky,ReLU,Tanh,38,21,15.0,22.0,17.0,0.0017991691386050922,4,272,0.2859258064302492,3.246524290158293e-05,284.3080647385965,COMPLETE
337,0.3482551872730255,2023-09-04 18:51:17.676216,2023-09-04 18:51:19.140208,0 days 00:00:01.463992,Tanh,Leaky,ReLU,Leaky,50,14,17.0,20.0,19.0,0.007983625173209784,4,300,0.5052976214434798,0.0013044849303278376,210.02808338512074,COMPLETE
338,0.3498656451702118,2023-09-04 18:51:19.140517,2023-09-04 18:51:23.565376,0 days 00:00:04.424859,ReLU,Leaky,ReLU,Sigmoid,76,20,16.0,21.0,16.0,0.0012248248672752891,4,197,0.7336073787195373,0.0010013059675658006,181.30204474407694,COMPLETE
339,0.3366301357746124,2023-09-04 18:51:23.565688,2023-09-04 18:51:25.571895,0 days 00:00:02.006207,Tanh,Leaky,Leaky,Tanh,53,13,20.0,22.0,15.0,0.006334805630902218,4,291,0.7688539587462447,0.0005970778560505884,174.07020484076605,COMPLETE
340,0.344305157661438,2023-09-04 18:51:25.572212,2023-09-04 18:51:27.628696,0 days 00:00:02.056484,Tanh,Leaky,ReLU,Leaky,48,21,18.0,23.0,17.0,0.0022106927090163597,4,278,0.7018278454032503,0.0016152018506429035,185.68176410816335,COMPLETE
341,0.3436116874217987,2023-09-04 18:51:27.629016,2023-09-04 18:51:29.869810,0 days 00:00:02.240794,Tanh,Leaky,ReLU,Tanh,41,12,8.0,24.0,20.0,0.004989078476697883,4,266,0.7661751835760897,0.0007827636693164744,290.5857830436862,COMPLETE
342,0.3467757999897003,2023-09-04 18:51:29.870124,2023-09-04 18:51:33.631819,0 days 00:00:03.761695,Tanh,Leaky,ReLU,Sigmoid,45,18,19.0,21.0,18.0,0.0014562040412674471,4,283,0.4451727572970139,0.00038251830116002334,215.4751454807768,COMPLETE
343,0.33329105377197266,2023-09-04 18:51:33.632147,2023-09-04 18:51:37.068618,0 days 00:00:03.436471,Tanh,Leaky,Leaky,Leaky,58,22,17.0,22.0,19.0,0.0008926224533519887,4,451,0.6948447717104952,0.0006242040147486764,214.35739274458453,COMPLETE
344,0.45564672350883484,2023-09-04 18:51:37.068931,2023-09-04 18:51:43.035239,0 days 00:00:05.966308,Tanh,Leaky,ReLU,Tanh,39,19,5.0,23.0,17.0,0.00029074347299208066,4,186,0.49153694988963065,0.0052802732654066925,367.58394606395433,COMPLETE
345,0.31050345301628113,2023-09-04 18:51:43.035557,2023-09-04 18:51:46.459990,0 days 00:00:03.424433,Tanh,Leaky,ReLU,Leaky,50,20,20.0,22.0,18.0,0.0017852929087872297,4,172,0.7996591875787069,0.00048633497593213843,157.10105483111212,COMPLETE
346,0.3310568630695343,2023-09-04 18:51:46.460300,2023-09-04 18:51:47.970620,0 days 00:00:01.510320,Tanh,Leaky,Tanh,Leaky,52,14,20.0,22.0,18.0,0.00273436946183343,4,175,0.7995684109328559,0.0004745577678220445,140.0314363178454,COMPLETE
347,0.32940155267715454,2023-09-04 18:51:47.970929,2023-09-04 18:51:50.697304,0 days 00:00:02.726375,Tanh,Leaky,ReLU,Leaky,54,19,20.0,23.0,14.0,0.0019926588456871098,4,162,0.5376147715286429,0.00035842623927399,186.0435893719013,COMPLETE
348,0.6737164855003357,2023-09-04 18:51:50.697611,2023-09-04 18:51:58.931802,0 days 00:00:08.234191,Sigmoid,Leaky,Leaky,Leaky,36,20,21.0,24.0,19.0,2.7768265821427826e-05,4,165,0.7622220178646122,0.00329297315625857,189.65218256170098,COMPLETE
349,0.4309931695461273,2023-09-04 18:51:58.932118,2023-09-04 18:52:00.637875,0 days 00:00:01.705757,Leaky,Leaky,ReLU,Leaky,61,21,19.0,22.0,20.0,0.007275225429959803,4,196,0.7978028382788694,0.012208164919720734,182.34197511064247,COMPLETE
350,0.40529078245162964,2023-09-04 18:52:00.638202,2023-09-04 18:52:01.096293,0 days 00:00:00.458091,Tanh,Leaky,ReLU,Leaky,72,14,20.0,23.0,16.0,0.03515841411026807,4,144,0.3776172217643104,0.000444482508475531,193.51250839233398,COMPLETE
351,0.4613687992095947,2023-09-04 18:52:01.096602,2023-09-04 18:52:04.892149,0 days 00:00:03.795547,Tanh,Tanh,Tanh,Leaky,41,13,15.0,12.0,2.0,0.0023660411882824146,4,183,0.411038721410283,0.0005260908629311576,571.5743478179737,COMPLETE
352,0.4513266384601593,2023-09-04 18:52:04.892462,2023-09-04 18:52:05.864507,0 days 00:00:00.972045,Tanh,Leaky,ReLU,Sigmoid,44,20,7.0,22.0,18.0,0.009660397205545516,4,172,0.23382174291284966,0.0006683049116771055,229.30940650491152,COMPLETE
353,0.3770154118537903,2023-09-04 18:52:05.864818,2023-09-04 18:52:06.640071,0 days 00:00:00.775253,Tanh,Leaky,ReLU,Leaky,50,18,19.0,19.0,17.0,0.02992264472059192,4,189,0.34829656043057117,0.0003038017847366912,195.56808620545922,COMPLETE
354,0.5817335844039917,2023-09-04 18:52:06.640411,2023-09-04 18:52:09.960791,0 days 00:00:03.320380,Tanh,Leaky,Leaky,Leaky,52,19,20.0,23.0,19.0,0.004664183363449984,4,178,0.25846033922991735,0.02463304506166294,212.5142221051062,COMPLETE
355,0.3804432451725006,2023-09-04 18:52:09.961104,2023-09-04 18:52:14.735579,0 days 00:00:04.774475,Tanh,Sigmoid,ReLU,Sigmoid,47,13,19.0,22.0,17.0,0.0029118322641837158,4,202,0.7460813932286732,0.0005668950201999211,160.90619712040342,COMPLETE
356,0.4726705849170685,2023-09-04 18:52:14.735904,2023-09-04 18:52:15.174315,0 days 00:00:00.438411,Tanh,Leaky,Tanh,Leaky,81,15,21.0,22.0,18.0,0.001143270744604687,4,83,0.11247150440247097,0.0008678563315995873,271.65933972094433,COMPLETE
357,0.3571952283382416,2023-09-04 18:52:15.174635,2023-09-04 18:52:16.762505,0 days 00:00:01.587870,Tanh,Leaky,ReLU,,54,20,16.0,21.0,,0.005784980040334147,3,265,0.7670964000992758,0.0004130990813261715,171.94479338976802,COMPLETE
358,1.0086966753005981,2023-09-04 18:52:16.762807,2023-09-04 18:52:17.439655,0 days 00:00:00.676848,Tanh,Leaky,ReLU,Leaky,42,12,15.0,24.0,23.0,0.0019316253987263388,4,167,0.3684569084576293,0.07822801248993025,101.1938831495202,COMPLETE
359,0.402885764837265,2023-09-04 18:52:17.439988,2023-09-04 18:52:19.202212,0 days 00:00:01.762224,Tanh,,,,56,23,,,,0.0036359605063958043,1,308,0.574654029184397,0.0007213978421636637,205.0336060700593,COMPLETE
360,0.6010999083518982,2023-09-04 18:52:19.202510,2023-09-04 18:52:30.852144,0 days 00:00:11.649634,Sigmoid,Leaky,Sigmoid,Sigmoid,38,22,19.0,23.0,15.0,0.00010683350317313273,4,271,0.6755698410249507,0.0003407670910072984,169.91284264145742,COMPLETE
361,0.3686974346637726,2023-09-04 18:52:30.852464,2023-09-04 18:52:31.706588,0 days 00:00:00.854124,Tanh,Leaky,Leaky,Leaky,40,21,24.0,22.0,19.0,0.004669272871595264,4,256,0.2932848799346823,0.0005072927250549305,147.1739512125651,COMPLETE
