number,value,datetime_start,datetime_complete,duration,params_activation1,params_activation2,params_activation3,params_activation4,params_batch_size,params_fl1,params_fl2,params_fl3,params_fl4,params_learning_rate,params_n_layers,params_num_epochs,params_train_size,params_weight_decay,user_attrs_mre,state
483,102.71885114397321,2023-09-04 20:02:50.433006,2023-09-04 20:02:52.432262,0 days 00:00:01.999256,ReLU,Leaky,,,50,23,21.0,,,0.006738116158445375,2,449,0.7409052685276306,1.895131057861539e-05,0.30800098180770874,COMPLETE
484,142.00557176994556,2023-09-04 20:02:52.432567,2023-09-04 20:02:53.627651,0 days 00:00:01.195084,ReLU,Leaky,,,43,23,22.0,,,0.013913859871988527,2,439,0.4113166753768448,1.1815570310141433e-05,0.32847505807876587,COMPLETE
485,105.70575714111328,2023-09-04 20:02:53.627963,2023-09-04 20:02:54.747276,0 days 00:00:01.119313,ReLU,Leaky,,,41,22,21.0,,,0.007973415602156139,2,460,0.7715006010219908,1.3856982972756203e-05,0.28852662444114685,COMPLETE
486,96.44045581239642,2023-09-04 20:02:54.747581,2023-09-04 20:02:55.367912,0 days 00:00:00.620331,ReLU,Leaky,,,39,23,22.0,,,0.010606419244028182,2,451,0.3804177761020996,2.981781744830838e-05,0.31274914741516113,COMPLETE
487,95.98977858020413,2023-09-04 20:02:55.368220,2023-09-04 20:02:56.350241,0 days 00:00:00.982021,ReLU,Leaky,,,42,23,21.0,,,0.006639149016803045,2,469,0.7078736071922556,1.7630674086401358e-05,0.30281516909599304,COMPLETE
488,83.0453602717473,2023-09-04 20:02:56.350543,2023-09-04 20:02:57.963640,0 days 00:00:01.613097,ReLU,Leaky,,,45,23,21.0,,,0.013896864220713217,2,439,0.7439017100467108,2.1520950472487717e-05,0.31408390402793884,COMPLETE
489,119.04838018902278,2023-09-04 20:02:57.963952,2023-09-04 20:02:59.198819,0 days 00:00:01.234867,ReLU,Sigmoid,,,41,23,22.0,,,0.014654649687721677,2,438,0.4553395612179834,2.2073501368141018e-05,0.2919740378856659,COMPLETE
490,107.86994445323944,2023-09-04 20:02:59.199124,2023-09-04 20:03:00.050569,0 days 00:00:00.851445,Sigmoid,Leaky,,,38,23,20.0,,,0.016231895822111923,2,437,0.2683425755728032,2.595593180912042e-05,0.3566122055053711,COMPLETE
491,101.36436049143474,2023-09-04 20:03:00.050875,2023-09-04 20:03:00.912846,0 days 00:00:00.861971,ReLU,Leaky,,,40,23,21.0,,,0.019379244593790364,2,444,0.7695956219130031,1.883830473230687e-05,0.3533238172531128,COMPLETE
492,96.34219863566946,2023-09-04 20:03:00.913160,2023-09-04 20:03:02.490704,0 days 00:00:01.577544,ReLU,Leaky,,,37,22,20.0,,,0.006228912632410337,2,434,0.6990194725924734,2.164295183563664e-05,0.28999003767967224,COMPLETE
493,106.09946162884052,2023-09-04 20:03:02.491016,2023-09-04 20:03:03.077559,0 days 00:00:00.586543,ReLU,Leaky,,,44,23,22.0,,,0.018711216790257838,2,448,0.2404002052637807,1.6966789517377548e-05,0.3527286648750305,COMPLETE
494,91.89830943516323,2023-09-04 20:03:03.077864,2023-09-04 20:03:04.066302,0 days 00:00:00.988438,ReLU,ReLU,,,39,23,21.0,,,0.012387852836392271,2,454,0.7488354490607647,3.2040227993263806e-05,0.3030397593975067,COMPLETE
495,103.93558525316644,2023-09-04 20:03:04.066605,2023-09-04 20:03:04.728116,0 days 00:00:00.661511,ReLU,Leaky,,,43,22,22.0,,,0.007870181956781172,2,433,0.4429289759486389,1.5059633268291107e-05,0.3086225092411041,COMPLETE
496,97.7593225479126,2023-09-04 20:03:04.728426,2023-09-04 20:03:06.117168,0 days 00:00:01.388742,ReLU,Leaky,,,41,23,21.0,,,0.00567555244411212,2,446,0.7747431162116242,2.2935425364096217e-05,0.30195152759552,COMPLETE
497,163.85930078679866,2023-09-04 20:03:06.117478,2023-09-04 20:03:06.951671,0 days 00:00:00.834193,ReLU,Leaky,,,38,3,23.0,,,0.007446351440258088,2,440,0.7989438458251751,1.4446654633281663e-05,0.5304579734802246,COMPLETE
498,117.0763134347867,2023-09-04 20:03:06.951986,2023-09-04 20:03:19.004195,0 days 00:00:12.052209,ReLU,Leaky,,,49,23,20.0,,,2.2600857267936882e-05,2,431,0.7256440797300159,2.8588511526316498e-05,0.44000154733657837,COMPLETE
499,100.64186803306022,2023-09-04 20:03:19.004513,2023-09-04 20:03:20.522823,0 days 00:00:01.518310,ReLU,Leaky,,,36,23,22.0,,,0.013121563597510271,2,454,0.7509518603440076,1.9370440733599802e-05,0.3014601171016693,COMPLETE
