number,value,datetime_start,datetime_complete,duration,params_activation1,params_activation2,params_activation3,params_activation4,params_batch_size,params_fl1,params_fl2,params_fl3,params_fl4,params_learning_rate,params_n_layers,params_num_epochs,params_train_size,params_weight_decay,user_attrs_mre,state
363,0.3486793041229248,2023-09-04 18:33:54.818611,2023-09-04 18:33:57.457105,0 days 00:00:02.638494,Tanh,Sigmoid,Tanh,ReLU,80,18,16.0,12.0,10.0,0.002089428594535255,4,215,0.47873286108623947,1.3788964778984735e-05,134.32258110046388,COMPLETE
364,0.34260129928588867,2023-09-04 18:33:57.457471,2023-09-04 18:33:59.497443,0 days 00:00:02.039972,ReLU,ReLU,ReLU,Leaky,65,21,14.0,19.0,14.0,0.000765053269484082,4,176,0.6216610984178002,4.057259817898073e-05,102.30632803175185,COMPLETE
365,0.3731191158294678,2023-09-04 18:33:59.497868,2023-09-04 18:34:01.284974,0 days 00:00:01.787106,Leaky,,,,76,18,,,,0.00296229502403656,1,196,0.7570889987188717,5.322582579097447e-05,89.84171509742737,COMPLETE
366,0.33812811970710754,2023-09-04 18:34:01.285400,2023-09-04 18:34:02.983989,0 days 00:00:01.698589,ReLU,ReLU,Tanh,ReLU,42,19,13.0,18.0,24.0,0.030855396657068292,4,227,0.6895837702489771,0.0004922811264428558,124.08742461333404,COMPLETE
367,0.3193913698196411,2023-09-04 18:34:02.984413,2023-09-04 18:34:05.093120,0 days 00:00:02.108707,ReLU,Leaky,Leaky,,43,20,15.0,10.0,,0.001342767128371809,3,243,0.5581421931636075,1.1830255429082638e-05,102.61765686894806,COMPLETE
368,0.32820942997932434,2023-09-04 18:34:05.093447,2023-09-04 18:34:06.427545,0 days 00:00:01.334098,Tanh,Sigmoid,Tanh,ReLU,64,21,16.0,6.0,12.0,0.05766375010265632,4,191,0.7156491427128079,2.902936035343738e-05,120.15034112697694,COMPLETE
369,0.358783096075058,2023-09-04 18:34:06.427965,2023-09-04 18:34:08.283614,0 days 00:00:01.855649,ReLU,ReLU,Tanh,Tanh,41,19,14.0,20.0,13.0,0.0027316009755218957,4,280,0.7686194685579716,0.00014419704304867193,116.39076293142219,COMPLETE
370,0.3048827350139618,2023-09-04 18:34:08.283966,2023-09-04 18:34:09.156102,0 days 00:00:00.872136,ReLU,Tanh,Tanh,Leaky,60,17,15.0,13.0,6.0,0.009643511083679493,4,179,0.7423286839171406,0.0002051776717629645,91.1306339899699,COMPLETE
371,0.2942914664745331,2023-09-04 18:34:09.156461,2023-09-04 18:34:10.497640,0 days 00:00:01.341179,ReLU,Tanh,Tanh,ReLU,44,18,14.0,11.0,21.0,0.0035045343792294665,4,400,0.5079682222502794,0.00011450019293607068,108.62062622780023,COMPLETE
372,0.28375062346458435,2023-09-04 18:34:10.497999,2023-09-04 18:34:12.094957,0 days 00:00:01.596958,ReLU,Leaky,Tanh,Leaky,86,20,6.0,24.0,9.0,0.0018227937266067679,4,209,0.7696697908511464,7.405273913804285e-05,102.62533255985805,COMPLETE
373,0.3175985813140869,2023-09-04 18:34:12.095311,2023-09-04 18:34:13.368720,0 days 00:00:01.273409,ReLU,Leaky,Tanh,ReLU,87,21,6.0,24.0,10.0,0.0024054242133022376,4,211,0.7721153171116484,7.21423220364769e-05,113.40607070922852,COMPLETE
374,0.29652106761932373,2023-09-04 18:34:13.369070,2023-09-04 18:34:15.946498,0 days 00:00:02.577428,ReLU,Leaky,Tanh,ReLU,95,16,4.0,24.0,9.0,0.0019237631773532714,4,204,0.7070991594705868,9.002115975548405e-05,110.25490768139178,COMPLETE
375,0.33221685886383057,2023-09-04 18:34:15.946853,2023-09-04 18:34:17.691318,0 days 00:00:01.744465,ReLU,Leaky,Tanh,Leaky,57,20,5.0,24.0,9.0,0.017730806428589086,4,219,0.7693171788248389,5.931485951972455e-05,106.7892074584961,COMPLETE
376,0.3590223491191864,2023-09-04 18:34:17.691685,2023-09-04 18:34:19.133185,0 days 00:00:01.441500,ReLU,Leaky,Tanh,ReLU,86,14,5.0,24.0,10.0,0.004233877034654866,4,201,0.6753381727888643,7.814230491564353e-05,97.3868970003995,COMPLETE
377,0.3511599600315094,2023-09-04 18:34:19.133561,2023-09-04 18:34:19.716357,0 days 00:00:00.582796,ReLU,Leaky,Tanh,Leaky,90,19,4.0,23.0,10.0,0.02692330780787649,4,234,0.5850909667099088,4.7299981878023714e-05,125.14851350050706,COMPLETE
378,0.34393051266670227,2023-09-04 18:34:19.716703,2023-09-04 18:34:20.374932,0 days 00:00:00.658229,ReLU,Leaky,Tanh,ReLU,39,21,17.0,5.0,8.0,0.006206468022431446,4,214,0.28995173962275667,0.000101992194523796,111.49916887283325,COMPLETE
379,0.5049802660942078,2023-09-04 18:34:20.375273,2023-09-04 18:34:21.452972,0 days 00:00:01.077699,ReLU,Tanh,Tanh,Sigmoid,85,18,16.0,20.0,9.0,0.0030021242118420002,4,190,0.40352488851106194,1.980706255607592e-05,164.00126109403723,COMPLETE
380,0.3511979281902313,2023-09-04 18:34:21.453388,2023-09-04 18:34:22.358206,0 days 00:00:00.904818,ReLU,Leaky,Tanh,ReLU,36,19,7.0,24.0,11.0,0.0050158851221116215,4,162,0.27154192676005595,1.5088591896698487e-05,119.07257478887385,COMPLETE
381,0.31187528371810913,2023-09-04 18:34:22.358583,2023-09-04 18:34:23.504485,0 days 00:00:01.145902,ReLU,Tanh,Tanh,Leaky,45,17,5.0,20.0,9.0,0.012346164290224648,4,200,0.7740550922614823,2.4140022604837746e-05,99.80609252929688,COMPLETE
382,0.5033761262893677,2023-09-04 18:34:23.504847,2023-09-04 18:34:34.488000,0 days 00:00:10.983153,ReLU,Tanh,Tanh,ReLU,42,4,15.0,19.0,12.0,4.5934380615589526e-05,4,225,0.799788557460949,3.469888957604264e-05,124.02656477186414,COMPLETE
383,0.3380076587200165,2023-09-04 18:34:34.488347,2023-09-04 18:34:36.144711,0 days 00:00:01.656364,ReLU,Tanh,Tanh,ReLU,46,20,6.0,23.0,10.0,0.008379340975847523,4,147,0.7334000638821434,6.17616576093166e-05,89.87120721279047,COMPLETE
384,0.32586193084716797,2023-09-04 18:34:36.145050,2023-09-04 18:34:39.007917,0 days 00:00:02.862867,ReLU,Sigmoid,Tanh,Leaky,92,5,15.0,16.0,11.0,0.003829203652758431,4,209,0.6335920488405616,3.0219435972745735e-05,106.64823494248718,COMPLETE
385,0.33120933175086975,2023-09-04 18:34:39.008262,2023-09-04 18:34:41.978125,0 days 00:00:02.969863,ReLU,Tanh,Tanh,ReLU,44,7,14.0,24.0,8.0,0.0024983351059677814,4,177,0.7122370917358828,4.028611234099249e-05,97.62313219527124,COMPLETE
386,0.4359702467918396,2023-09-04 18:34:41.978483,2023-09-04 18:34:43.017388,0 days 00:00:01.038905,ReLU,Tanh,Tanh,Leaky,59,22,13.0,24.0,12.0,0.047399005592747345,4,188,0.7509063939468427,1.745961923111527e-05,104.51819774082729,COMPLETE
387,0.3504370450973511,2023-09-04 18:34:43.017736,2023-09-04 18:34:43.580450,0 days 00:00:00.562714,ReLU,Leaky,Tanh,ReLU,47,19,17.0,15.0,11.0,0.0059010629692917305,4,170,0.2302969327613,0.00012952393199194522,110.61602763640575,COMPLETE
388,0.5988418459892273,2023-09-04 18:34:43.580799,2023-09-04 18:34:43.881550,0 days 00:00:00.300751,ReLU,Tanh,Tanh,ReLU,43,20,18.0,21.0,7.0,0.0738233283157128,4,247,0.17462815849916377,1.1608831970647593e-05,197.98657087846235,COMPLETE
389,0.27767568826675415,2023-09-04 18:34:43.881902,2023-09-04 18:34:46.521390,0 days 00:00:02.639488,ReLU,Tanh,Tanh,,40,24,5.0,23.0,,0.003329411347179932,3,197,0.7707185613546659,4.936222698494796e-05,101.9550287155878,COMPLETE
390,0.35368984937667847,2023-09-04 18:34:46.521722,2023-09-04 18:34:47.349389,0 days 00:00:00.827667,ReLU,Tanh,ReLU,,39,24,5.0,23.0,,0.0370729620002564,3,219,0.678577345330949,5.097623675973514e-05,108.03921654110863,COMPLETE
391,0.33688223361968994,2023-09-04 18:34:47.349740,2023-09-04 18:34:48.735080,0 days 00:00:01.385340,ReLU,Tanh,Tanh,,40,24,4.0,23.0,,0.004575714680869574,3,206,0.732674457616801,6.909374539602284e-05,95.6605680061109,COMPLETE
392,0.26653608679771423,2023-09-04 18:34:48.735429,2023-09-04 18:34:50.313666,0 days 00:00:01.578237,ReLU,Tanh,Tanh,,99,24,6.0,23.0,,0.0076310311180011565,3,195,0.7707165510260933,4.2705602108218995e-05,159.96921662723318,COMPLETE
393,0.30175647139549255,2023-09-04 18:34:50.314020,2023-09-04 18:34:52.466483,0 days 00:00:02.152463,ReLU,Tanh,Tanh,,56,24,6.0,23.0,,0.007738231481712288,3,184,0.7710759890216378,4.04840321494708e-05,110.10002727508545,COMPLETE
394,0.3119271695613861,2023-09-04 18:34:52.467065,2023-09-04 18:34:54.289593,0 days 00:00:01.822528,ReLU,Leaky,Tanh,,61,24,5.0,22.0,,0.009410310617294554,3,197,0.7735441359449935,3.591196067726016e-05,96.8568344116211,COMPLETE
395,0.3082279562950134,2023-09-04 18:34:54.290006,2023-09-04 18:34:54.968493,0 days 00:00:00.678487,ReLU,Tanh,Tanh,,94,24,6.0,23.0,,0.010664716106889427,3,194,0.7991631393717571,2.6034519685727474e-05,108.26478774459274,COMPLETE
396,0.32004833221435547,2023-09-04 18:34:54.968838,2023-09-04 18:34:55.767850,0 days 00:00:00.799012,ReLU,Tanh,Tanh,,96,24,6.0,24.0,,0.0074897395671812686,3,157,0.4551408515738089,1.0062818943062338e-05,94.80637609308417,COMPLETE
397,0.5611087679862976,2023-09-04 18:34:55.768202,2023-09-04 18:34:56.137315,0 days 00:00:00.369113,ReLU,Tanh,Tanh,,78,23,5.0,23.0,,0.09719300314574915,3,261,0.7464976058127974,2.1092973792943496e-05,141.67709096272787,COMPLETE
398,0.306796133518219,2023-09-04 18:34:56.137667,2023-09-04 18:34:58.700611,0 days 00:00:02.562944,ReLU,Sigmoid,Tanh,,93,24,6.0,22.0,,0.003568790598926535,3,180,0.7998248904288913,3.219530652381588e-05,99.78292424470476,COMPLETE
399,0.3140384256839752,2023-09-04 18:34:58.700950,2023-09-04 18:35:00.062051,0 days 00:00:01.361101,Leaky,Tanh,Tanh,,100,24,5.0,23.0,,0.005839022747150467,3,175,0.7657766841991496,4.224519290476667e-05,86.17695907066609,COMPLETE
400,0.3159532845020294,2023-09-04 18:35:00.062429,2023-09-04 18:35:00.841858,0 days 00:00:00.779429,ReLU,Tanh,,,100,23,16.0,,,0.0066834723811082354,2,236,0.33017209657542607,5.074955803252451e-05,165.72386357813707,COMPLETE
401,0.32409757375717163,2023-09-04 18:35:00.842203,2023-09-04 18:35:05.131030,0 days 00:00:04.288827,ReLU,Tanh,Tanh,ReLU,83,24,5.0,24.0,13.0,0.00203499812921797,4,188,0.43255614062604597,2.6726005278866534e-05,105.70368364879063,COMPLETE
402,0.3339575529098511,2023-09-04 18:35:05.131377,2023-09-04 18:35:05.855490,0 days 00:00:00.724113,ReLU,Leaky,,,98,23,7.0,,,0.004983699332302271,2,211,0.7244598012198628,1.5031932880727711e-05,101.7955890454744,COMPLETE
403,0.3324154019355774,2023-09-04 18:35:05.855829,2023-09-04 18:35:07.346815,0 days 00:00:01.490986,ReLU,Tanh,Tanh,ReLU,58,18,4.0,22.0,9.0,0.003919823490811777,4,198,0.7478864315878712,2.2245443692845226e-05,96.1126100449335,COMPLETE
404,0.32071352005004883,2023-09-04 18:35:07.347157,2023-09-04 18:35:09.502096,0 days 00:00:02.154939,ReLU,Tanh,Tanh,Tanh,56,24,16.0,24.0,9.0,0.00324208530164145,4,168,0.5454457086703367,4.6710332182427146e-05,113.98423100725005,COMPLETE
405,0.3544761836528778,2023-09-04 18:35:09.502449,2023-09-04 18:35:10.300995,0 days 00:00:00.798546,ReLU,Tanh,Tanh,,90,19,15.0,23.0,,0.004570100465205087,3,248,0.25776322071489294,3.1263088100648686e-05,98.16120664808486,COMPLETE
406,0.3579447269439697,2023-09-04 18:35:10.301340,2023-09-04 18:35:10.827019,0 days 00:00:00.525679,ReLU,Tanh,Tanh,ReLU,73,18,6.0,24.0,23.0,0.007608088208157989,4,272,0.31873258728838244,9.16905552605787e-05,119.81583606495576,COMPLETE
407,0.3067656457424164,2023-09-04 18:35:10.827392,2023-09-04 18:35:12.462928,0 days 00:00:01.635536,ReLU,Tanh,Tanh,ReLU,61,23,16.0,17.0,10.0,0.006474981581067193,4,223,0.7045082516367017,6.35090251198763e-05,107.31148420061383,COMPLETE
408,0.34203672409057617,2023-09-04 18:35:12.463281,2023-09-04 18:35:13.180692,0 days 00:00:00.717411,ReLU,Leaky,Tanh,ReLU,88,24,15.0,23.0,12.0,0.0017994489585944058,4,139,0.34021312925137676,1.8353114419290505e-05,175.9475239973802,COMPLETE
409,0.4962996244430542,2023-09-04 18:35:13.181036,2023-09-04 18:35:23.927904,0 days 00:00:10.746868,ReLU,Tanh,Tanh,ReLU,34,17,7.0,22.0,2.0,1.4936075084321455e-05,4,187,0.7989062222871957,3.784742178865116e-05,142.60565703692922,COMPLETE
410,0.3659095764160156,2023-09-04 18:35:23.928268,2023-09-04 18:35:27.483131,0 days 00:00:03.554863,ReLU,Sigmoid,Tanh,ReLU,48,18,4.0,24.0,18.0,0.0011626439582459404,4,202,0.6610571630179571,0.005390844938268874,112.40535227457683,COMPLETE
411,0.3282061219215393,2023-09-04 18:35:27.483482,2023-09-04 18:35:29.136559,0 days 00:00:01.653077,ReLU,Tanh,Tanh,ReLU,52,19,8.0,22.0,8.0,0.0027896889914492563,4,258,0.6061244001977523,2.632338825340453e-05,104.25019264221191,COMPLETE
412,0.42718613147735596,2023-09-04 18:35:29.136934,2023-09-04 18:35:29.390150,0 days 00:00:00.253216,ReLU,Tanh,Tanh,ReLU,59,23,16.0,23.0,7.0,0.06379976853851232,4,214,0.14373316257811664,1.2522654163199605e-05,169.61072342484087,COMPLETE
413,0.4980012774467468,2023-09-04 18:35:29.390512,2023-09-04 18:35:30.539788,0 days 00:00:01.149276,ReLU,Tanh,Tanh,Sigmoid,31,19,17.0,23.0,10.0,0.011811270880517307,4,231,0.7494966062933055,8.038792490085289e-05,147.6814334267064,COMPLETE
414,0.31476348638534546,2023-09-04 18:35:30.540154,2023-09-04 18:35:32.294169,0 days 00:00:01.754015,ReLU,Leaky,Tanh,ReLU,37,22,15.0,22.0,12.0,0.005405610139033075,4,194,0.5057717461625284,2.1361260159515673e-05,107.52179802788629,COMPLETE
415,0.3823803663253784,2023-09-04 18:35:32.294519,2023-09-04 18:35:33.374819,0 days 00:00:01.080300,ReLU,,,,63,20,,,,0.008964773022438907,1,180,0.6976964914744501,5.459236517536898e-05,103.90528433663505,COMPLETE
416,0.36416128277778625,2023-09-04 18:35:33.375164,2023-09-04 18:35:34.888009,0 days 00:00:01.512845,ReLU,Tanh,Tanh,ReLU,46,24,14.0,24.0,13.0,0.004285403716201068,4,165,0.770051373130711,0.010029296362550967,96.72101794972139,COMPLETE
417,0.31847408413887024,2023-09-04 18:35:34.888465,2023-09-04 18:35:37.977372,0 days 00:00:03.088907,ReLU,Tanh,Tanh,ReLU,57,19,20.0,24.0,9.0,0.0015932614931312736,4,208,0.7320444290161366,1.6165513036486868e-05,91.86961968000546,COMPLETE
418,0.34621167182922363,2023-09-04 18:35:37.977806,2023-09-04 18:35:39.738874,0 days 00:00:01.761068,ReLU,Tanh,ReLU,,45,18,15.0,23.0,,0.0022789054501547537,3,240,0.7676411006850811,3.3158283136049095e-05,103.87799241807726,COMPLETE
419,0.31949418783187866,2023-09-04 18:35:39.739229,2023-09-04 18:35:44.292954,0 days 00:00:04.553725,Leaky,Tanh,Tanh,ReLU,54,16,16.0,23.0,11.0,0.003921532624735066,4,173,0.7085554492889268,4.362685261381923e-05,106.45479310233638,COMPLETE
420,0.34531641006469727,2023-09-04 18:35:44.293315,2023-09-04 18:35:45.515722,0 days 00:00:01.222407,ReLU,Tanh,Tanh,ReLU,81,20,6.0,22.0,12.0,0.015513670427567737,4,189,0.7992444303247831,0.0005934704565584395,87.34206411000845,COMPLETE
421,0.27682939171791077,2023-09-04 18:35:45.516124,2023-09-04 18:35:47.955842,0 days 00:00:02.439718,ReLU,Leaky,Tanh,ReLU,41,23,14.0,21.0,3.0,0.0030368282085445194,4,200,0.7387946588426307,0.00016281409146007568,95.43327002431832,COMPLETE
422,1.0132124423980713,2023-09-04 18:35:47.956217,2023-09-04 18:35:48.274990,0 days 00:00:00.318773,ReLU,Leaky,Tanh,ReLU,40,23,3.0,21.0,2.0,0.003132667013997974,4,215,0.11251263267515224,0.00020295109617334662,122.43820078232709,COMPLETE
423,0.31738078594207764,2023-09-04 18:35:48.275337,2023-09-04 18:35:54.987979,0 days 00:00:06.712642,ReLU,Leaky,Tanh,Tanh,41,23,5.0,21.0,3.0,0.00024614856205500287,4,202,0.5260506965235026,0.00014173968562691485,98.91849472499129,COMPLETE
424,0.31495073437690735,2023-09-04 18:35:54.988321,2023-09-04 18:35:56.134658,0 days 00:00:01.146337,ReLU,Leaky,Tanh,ReLU,37,22,17.0,21.0,10.0,0.002426039377557628,4,223,0.48045868725666485,0.00011858747669148721,101.6161870320638,COMPLETE
425,0.38150548934936523,2023-09-04 18:35:56.135022,2023-09-04 18:35:57.008876,0 days 00:00:00.873854,ReLU,Leaky,,,39,22,14.0,,,0.0060630372666450735,2,267,0.2969285582007954,0.00023133813486959115,98.31780163447063,COMPLETE
426,0.48123207688331604,2023-09-04 18:35:57.009285,2023-09-04 18:35:58.743931,0 days 00:00:01.734646,ReLU,Leaky,Tanh,ReLU,42,23,15.0,4.0,3.0,0.0051546270226086365,4,199,0.31665304527815125,0.00017146720965696997,124.01748741997613,COMPLETE
427,0.32853037118911743,2023-09-04 18:35:58.744544,2023-09-04 18:36:02.212812,0 days 00:00:03.468268,ReLU,Leaky,Tanh,ReLU,44,24,16.0,21.0,5.0,0.0010699239872996459,4,206,0.648913327309746,0.00010431198707311424,92.54610675314198,COMPLETE
428,0.6306595206260681,2023-09-04 18:36:02.213188,2023-09-04 18:36:12.513374,0 days 00:00:10.300186,ReLU,Leaky,Tanh,ReLU,48,23,15.0,22.0,11.0,1.0776480173241798e-05,4,253,0.6826113779556036,6.953687679198923e-05,118.8701156194031,COMPLETE
429,1.0145258903503418,2023-09-04 18:36:12.513730,2023-09-04 18:36:12.792526,0 days 00:00:00.278796,ReLU,Sigmoid,Tanh,ReLU,45,23,13.0,21.0,5.0,0.010709449542201687,4,277,0.31288387153611497,0.015732879572460973,100.91922690651633,COMPLETE
430,0.2992119789123535,2023-09-04 18:36:12.792885,2023-09-04 18:36:15.960558,0 days 00:00:03.167673,ReLU,Leaky,Tanh,ReLU,47,22,14.0,24.0,7.0,0.00344193412047098,4,426,0.73186947163239,9.16304287838099e-05,94.83704833984375,COMPLETE
431,1.073265552520752,2023-09-04 18:36:15.961044,2023-09-04 18:36:16.543423,0 days 00:00:00.582379,ReLU,Leaky,Tanh,ReLU,41,24,16.0,22.0,4.0,0.0785766274981925,4,196,0.3432401109962303,0.09349531749294716,100.74575671027688,COMPLETE
432,0.2726476192474365,2023-09-04 18:36:16.543811,2023-09-04 18:36:18.756879,0 days 00:00:02.213068,ReLU,Tanh,Tanh,Sigmoid,50,24,15.0,20.0,11.0,0.008428981227737694,4,292,0.7486154776585623,0.0001784643271246049,114.9832647572393,COMPLETE
433,0.45676448941230774,2023-09-04 18:36:18.757379,2023-09-04 18:36:20.045489,0 days 00:00:01.288110,ReLU,Tanh,Tanh,Sigmoid,51,24,15.0,20.0,2.0,0.009013196181674102,4,272,0.6909378479280668,0.0001729799225927596,158.26398849487305,COMPLETE
434,0.30928725004196167,2023-09-04 18:36:20.045849,2023-09-04 18:36:21.800454,0 days 00:00:01.754605,ReLU,Tanh,Tanh,Sigmoid,50,24,15.0,20.0,6.0,0.0075417861480517046,4,302,0.7232138144086322,0.0001648392673586599,121.11355992367393,COMPLETE
435,0.35352808237075806,2023-09-04 18:36:21.800931,2023-09-04 18:36:29.864640,0 days 00:00:08.063709,ReLU,Tanh,Tanh,Sigmoid,49,24,14.0,21.0,11.0,0.0007002332163176769,4,291,0.737160679701342,0.00021682809005170212,123.05821515627557,COMPLETE
436,0.3712347745895386,2023-09-04 18:36:29.865033,2023-09-04 18:36:31.925173,0 days 00:00:02.060140,ReLU,Tanh,Tanh,Sigmoid,52,23,16.0,20.0,12.0,0.0008562549139141032,4,291,0.24436799064263603,0.0002427124137389898,149.70923235663054,COMPLETE
437,0.2653917670249939,2023-09-04 18:36:31.925586,2023-09-04 18:36:37.822491,0 days 00:00:05.896905,ReLU,Tanh,Tanh,Sigmoid,26,24,15.0,21.0,1.0,0.0067345729599175095,4,275,0.7502209016292658,0.00012415224897073087,132.76690916173598,COMPLETE
438,0.3299357295036316,2023-09-04 18:36:37.822876,2023-09-04 18:36:39.287855,0 days 00:00:01.464979,ReLU,Tanh,,,20,24,15.0,,,0.008917284198960738,2,287,0.6724509115060893,0.0001053178700302031,92.79254091702975,COMPLETE
439,0.47973698377609253,2023-09-04 18:36:39.288217,2023-09-04 18:36:47.173851,0 days 00:00:07.885634,ReLU,Tanh,Tanh,Sigmoid,23,23,16.0,21.0,4.0,0.0005560465789274462,4,275,0.49006108858959707,0.00012740060764968058,131.05733683139462,COMPLETE
440,0.973136305809021,2023-09-04 18:36:47.174211,2023-09-04 18:36:47.956811,0 days 00:00:00.782600,Leaky,Tanh,Tanh,Sigmoid,29,24,18.0,21.0,3.0,0.007225613332263094,4,296,0.6361909915917052,0.020015543141328484,99.06651178995769,COMPLETE
441,0.5595319271087646,2023-09-04 18:36:47.957180,2023-09-04 18:36:48.530661,0 days 00:00:00.573481,Tanh,Tanh,Tanh,Sigmoid,47,23,15.0,21.0,1.0,0.010481425988818857,4,281,0.44848151239579875,0.00017672751606887717,167.46025848388672,COMPLETE
442,0.25881442427635193,2023-09-04 18:36:48.531073,2023-09-04 18:36:51.034280,0 days 00:00:02.503207,ReLU,Tanh,Tanh,,45,23,15.0,20.0,,0.005216582411451013,3,267,0.7097311933139883,0.00014640188861101682,91.54792660385814,COMPLETE
443,0.3294081687927246,2023-09-04 18:36:51.034643,2023-09-04 18:36:52.673678,0 days 00:00:01.639035,ReLU,Tanh,Tanh,,12,22,15.0,20.0,,0.00449498453827903,3,278,0.29294504570367397,0.00019336966453794684,107.03502415248326,COMPLETE
444,0.40862640738487244,2023-09-04 18:36:52.674154,2023-09-04 18:36:54.655553,0 days 00:00:01.981399,ReLU,Sigmoid,Tanh,,32,23,16.0,20.0,,0.0055497276497688255,3,266,0.7039500475436382,0.006792975251102048,105.55846237554783,COMPLETE
445,0.3269418179988861,2023-09-04 18:36:54.655956,2023-09-04 18:36:56.100436,0 days 00:00:01.444480,ReLU,Tanh,ReLU,,45,17,15.0,20.0,,0.0047003520498528064,3,291,0.6629600559889861,0.00014284307077698773,94.81017139979771,COMPLETE
446,0.3307587802410126,2023-09-04 18:36:56.100799,2023-09-04 18:36:57.572630,0 days 00:00:01.471831,ReLU,Tanh,Tanh,,27,24,17.0,20.0,,0.006110820782205102,3,277,0.7049228976846028,0.0001470654110616199,146.5933301007306,COMPLETE
447,0.578934907913208,2023-09-04 18:36:57.573000,2023-09-04 18:36:59.626163,0 days 00:00:02.053163,ReLU,Tanh,Tanh,,16,22,16.0,21.0,,0.04951083492296052,3,264,0.7431037150179373,0.00012384988551798886,169.16193854290506,COMPLETE
448,0.33040961623191833,2023-09-04 18:36:59.626523,2023-09-04 18:37:01.199468,0 days 00:00:01.572945,ReLU,ReLU,Tanh,,49,24,15.0,21.0,,0.003814081437366295,3,280,0.6850122719795686,0.00015009444732472438,89.58094414605034,COMPLETE
449,0.2885904312133789,2023-09-04 18:37:01.199920,2023-09-04 18:37:03.804117,0 days 00:00:02.604197,Tanh,Tanh,Tanh,,26,18,15.0,19.0,,0.002779792159734537,3,312,0.6118914873121043,0.00011019976291897705,103.428361788663,COMPLETE
450,0.3454434275627136,2023-09-04 18:37:03.804480,2023-09-04 18:37:05.520102,0 days 00:00:01.715622,ReLU,Tanh,Tanh,,43,24,17.0,20.0,,0.005366531827351241,3,85,0.595609568574661,0.00013105342255185116,88.4824895505552,COMPLETE
451,0.3325185179710388,2023-09-04 18:37:05.520467,2023-09-04 18:37:07.669317,0 days 00:00:02.148850,ReLU,Tanh,Tanh,,47,23,14.0,21.0,,0.0031903141545593866,3,270,0.7186147456058462,0.002630132685466015,102.1026170094808,COMPLETE
452,0.3471970856189728,2023-09-04 18:37:07.669795,2023-09-04 18:37:08.718689,0 days 00:00:01.048894,ReLU,Tanh,Tanh,,64,22,16.0,22.0,,0.0041576361537770615,3,156,0.300164189191815,0.00015798420318933307,98.59330107526081,COMPLETE
453,0.35670557618141174,2023-09-04 18:37:08.719051,2023-09-04 18:37:23.183898,0 days 00:00:14.464847,ReLU,Tanh,Tanh,Sigmoid,18,18,14.0,19.0,2.0,0.0009253430676525357,4,284,0.5665218811100661,3.776766060181807e-05,145.65155957316796,COMPLETE
454,0.5099508166313171,2023-09-04 18:37:23.184264,2023-09-04 18:37:23.961425,0 days 00:00:00.777161,ReLU,Tanh,Tanh,Sigmoid,46,17,16.0,21.0,1.0,0.006677288335889205,4,186,0.35708824464891264,2.8220267921335936e-05,132.90385076734754,COMPLETE
