number,value,datetime_start,datetime_complete,duration,params_activation1,params_activation2,params_activation3,params_activation4,params_batch_size,params_fl1,params_fl2,params_fl3,params_fl4,params_learning_rate,params_n_layers,params_num_epochs,params_train_size,params_weight_decay,user_attrs_mre,state
274,126.31139136562828,2023-09-04 19:53:20.416245,2023-09-04 19:53:24.963338,0 days 00:00:04.547093,ReLU,ReLU,ReLU,Tanh,48,16,22.0,20.0,23.0,1.7362535857672255e-05,4,238,0.3386340954204067,0.015770431621733635,0.5891097187995911,COMPLETE
275,115.24735483546166,2023-09-04 19:53:24.963659,2023-09-04 19:53:27.918704,0 days 00:00:02.955045,ReLU,Sigmoid,ReLU,Tanh,44,17,21.0,19.0,21.0,1.4460957089748892e-05,4,276,0.304278012977374,0.027269586912424697,0.9868515729904175,COMPLETE
276,100.73620394193209,2023-09-04 19:53:27.919018,2023-09-04 19:53:32.359856,0 days 00:00:04.440838,ReLU,Sigmoid,ReLU,Tanh,41,18,22.0,19.0,13.0,1.0045122342019077e-05,4,264,0.34755816512300874,0.024014197390368315,0.9783070683479309,COMPLETE
277,149.80535811084812,2023-09-04 19:53:32.360170,2023-09-04 19:53:36.168311,0 days 00:00:03.808141,ReLU,Sigmoid,ReLU,Tanh,46,17,21.0,1.0,24.0,1.2731963555151138e-05,4,290,0.3695583393384023,0.03399045463502241,0.9854705929756165,COMPLETE
278,150.1352453165121,2023-09-04 19:53:36.168626,2023-09-04 19:53:41.384285,0 days 00:00:05.215659,Leaky,Sigmoid,ReLU,Tanh,49,16,20.0,18.0,22.0,1.6037828196613864e-05,4,286,0.31986966469349837,0.002377728639393126,0.8302672505378723,COMPLETE
279,138.95086211555088,2023-09-04 19:53:41.384603,2023-09-04 19:53:46.711075,0 days 00:00:05.326472,ReLU,Sigmoid,ReLU,Sigmoid,51,16,22.0,17.0,19.0,7.130989886031295e-05,4,253,0.33603630249455574,0.0027717162171821924,0.5367526412010193,COMPLETE
280,104.3170030055902,2023-09-04 19:53:46.711458,2023-09-04 19:53:48.395416,0 days 00:00:01.683958,Sigmoid,Sigmoid,ReLU,Tanh,47,17,19.0,13.0,21.0,1.839240378396589e-05,4,267,0.38395977886537785,0.0177678915173965,0.9023540019989014,COMPLETE
281,197.44723785854183,2023-09-04 19:53:48.395726,2023-09-04 19:53:54.348612,0 days 00:00:05.952886,Sigmoid,Sigmoid,ReLU,ReLU,44,15,18.0,18.0,8.0,0.000111560359795678,4,269,0.3497866928213552,1.190618018358398e-05,0.6494226455688477,COMPLETE
282,99.79683269153942,2023-09-04 19:53:54.348929,2023-09-04 19:53:54.596913,0 days 00:00:00.247984,Sigmoid,Sigmoid,ReLU,Tanh,45,16,22.0,17.0,23.0,8.646626429978534e-05,4,301,0.3198244184460322,0.040909608379344875,0.993311882019043,COMPLETE
283,106.47801780700684,2023-09-04 19:53:54.597219,2023-09-04 19:53:55.189180,0 days 00:00:00.591961,Sigmoid,Sigmoid,Tanh,ReLU,40,15,14.0,17.0,7.0,1.231872760371646e-05,4,259,0.369556204777057,0.033382284246840074,1.0349085330963135,COMPLETE
284,109.39207753268155,2023-09-04 19:53:55.189500,2023-09-04 19:53:58.873054,0 days 00:00:03.683554,Sigmoid,Sigmoid,ReLU,Tanh,48,16,8.0,19.0,10.0,1.474767474832751e-05,4,232,0.29901720237115287,0.03994851105000818,1.031844139099121,COMPLETE
285,103.88335694937871,2023-09-04 19:53:58.873375,2023-09-04 19:54:00.035001,0 days 00:00:01.161626,Sigmoid,Sigmoid,ReLU,Tanh,42,18,20.0,20.0,19.0,6.271049003600278e-05,4,280,0.31245953549241706,0.026971086420867877,0.9930368661880493,COMPLETE
286,153.16488736347088,2023-09-04 19:54:00.035317,2023-09-04 19:54:02.527044,0 days 00:00:02.491727,Sigmoid,ReLU,ReLU,ReLU,50,17,13.0,18.0,22.0,0.0021398402822097344,4,247,0.3352617886149542,0.0103372534013772,0.4549109935760498,COMPLETE
287,98.39107344491141,2023-09-04 19:54:02.527350,2023-09-04 19:54:05.282885,0 days 00:00:02.755535,Sigmoid,Sigmoid,Tanh,Tanh,54,15,21.0,7.0,6.0,1.2491430908301648e-05,4,315,0.3839089265339203,0.04473996197597074,1.0031206607818604,COMPLETE
288,100.9242178875467,2023-09-04 19:54:05.283199,2023-09-04 19:54:05.782403,0 days 00:00:00.499204,Sigmoid,Sigmoid,ReLU,Sigmoid,46,18,18.0,14.0,24.0,0.00016079716736610222,4,262,0.3592224151697797,0.032326262415957,1.0268644094467163,COMPLETE
289,88.76346308390299,2023-09-04 19:54:05.782712,2023-09-04 19:54:06.844753,0 days 00:00:01.062041,Sigmoid,Sigmoid,Leaky,ReLU,51,7,11.0,17.0,11.0,1.803147432380246e-05,4,277,0.32907643733759917,0.02125225187892832,0.8321941494941711,COMPLETE
290,141.09227493662894,2023-09-04 19:54:06.845081,2023-09-04 19:54:09.901262,0 days 00:00:03.056181,Sigmoid,Sigmoid,Leaky,ReLU,48,8,11.0,17.0,8.0,1.9699067906784693e-05,4,294,0.3467126394409181,0.021722892653605688,0.9947143197059631,COMPLETE
291,114.05713179843877,2023-09-04 19:54:09.901585,2023-09-04 19:54:12.589619,0 days 00:00:02.688034,Sigmoid,Sigmoid,Leaky,ReLU,51,6,23.0,21.0,11.0,1.6638915910725744e-05,4,277,0.3272306098388054,0.017833606121326968,0.949313223361969,COMPLETE
292,101.97746797241916,2023-09-04 19:54:12.589940,2023-09-04 19:54:16.769269,0 days 00:00:04.179329,Sigmoid,Sigmoid,Leaky,ReLU,43,9,12.0,17.0,9.0,1.6775338654054806e-05,4,287,0.4017270466634683,0.024403945708166806,0.9108065366744995,COMPLETE
293,98.44230253046209,2023-09-04 19:54:16.769590,2023-09-04 19:54:17.735435,0 days 00:00:00.965845,Sigmoid,Sigmoid,Leaky,ReLU,44,4,10.0,18.0,9.0,0.00010275174774308036,4,275,0.36622278348144727,0.015110650760385145,1.1211103200912476,COMPLETE
294,101.77492657998451,2023-09-04 19:54:17.735760,2023-09-04 19:54:23.712142,0 days 00:00:05.976382,Sigmoid,Sigmoid,Leaky,Tanh,49,7,10.0,17.0,6.0,1.3636436687002407e-05,4,266,0.4168760028754472,0.00844646525641087,0.9456948637962341,COMPLETE
295,110.02391463991195,2023-09-04 19:54:23.712472,2023-09-04 19:54:26.131248,0 days 00:00:02.418776,Sigmoid,Sigmoid,Leaky,ReLU,47,17,23.0,19.0,13.0,2.142080198563024e-05,4,253,0.3326561143711682,0.011564208794617005,0.9455326199531555,COMPLETE
296,115.50865790071387,2023-09-04 19:54:26.131563,2023-09-04 19:54:31.247715,0 days 00:00:05.116152,Sigmoid,Sigmoid,Leaky,Tanh,74,10,19.0,16.0,12.0,1.0002351079002985e-05,4,287,0.3521371507827729,6.561430261172887e-05,0.9627675414085388,COMPLETE
297,109.27970465298357,2023-09-04 19:54:31.248054,2023-09-04 19:54:31.923541,0 days 00:00:00.675487,Sigmoid,Sigmoid,ReLU,Leaky,46,5,21.0,18.0,10.0,0.00025235550701513236,4,272,0.3087588123372204,0.0388284920679931,0.8954322338104248,COMPLETE
298,103.8108757019043,2023-09-04 19:54:31.923877,2023-09-04 19:54:32.420534,0 days 00:00:00.496657,ReLU,Sigmoid,Leaky,ReLU,50,17,20.0,17.0,20.0,0.059549289562396066,4,262,0.3944307085642744,0.006387402435260305,0.9631072878837585,COMPLETE
299,116.09071746127296,2023-09-04 19:54:32.420892,2023-09-04 19:54:36.390513,0 days 00:00:03.969621,Sigmoid,Sigmoid,Leaky,Tanh,45,16,22.0,16.0,23.0,1.2297085288759029e-05,4,158,0.42833988076170243,0.019460525489412628,1.0061990022659302,COMPLETE
300,182.9060822950428,2023-09-04 19:54:36.390850,2023-09-04 19:54:51.192469,0 days 00:00:14.801619,Sigmoid,Sigmoid,Leaky,Leaky,52,9,23.0,19.0,7.0,1.876297873708361e-05,4,323,0.7969209799434431,0.003414245076704357,0.759314775466919,COMPLETE
301,101.29609807332356,2023-09-04 19:54:51.192795,2023-09-04 19:54:51.486259,0 days 00:00:00.293464,Sigmoid,Sigmoid,ReLU,Tanh,42,22,24.0,16.0,22.0,0.013032904501338243,4,278,0.33678565231283486,0.028138968742907857,0.9093762636184692,COMPLETE
302,173.7584070478167,2023-09-04 19:54:51.486581,2023-09-04 19:54:52.444538,0 days 00:00:00.957957,Sigmoid,Sigmoid,Leaky,Leaky,48,19,21.0,18.0,11.0,7.891770970175375e-05,4,173,0.29917950263554144,0.04407878086215891,1.0100412368774414,COMPLETE
303,264.9297873581512,2023-09-04 19:54:52.444863,2023-09-04 19:54:54.888106,0 days 00:00:02.443243,Sigmoid,Sigmoid,Tanh,ReLU,76,18,23.0,17.0,23.0,1.4433563786053018e-05,4,158,0.38208564811813667,0.033646372266507615,1.0249332189559937,COMPLETE
304,113.23015477107121,2023-09-04 19:54:54.888438,2023-09-04 19:54:57.079336,0 days 00:00:02.190898,Leaky,Sigmoid,Leaky,Tanh,89,24,19.0,15.0,21.0,0.00031792677503504017,4,255,0.27818687135399106,0.0014320317306241225,0.39235514402389526,COMPLETE
305,97.75080591318559,2023-09-04 19:54:57.079661,2023-09-04 19:54:58.013323,0 days 00:00:00.933662,Sigmoid,Sigmoid,Leaky,Leaky,45,16,20.0,16.0,6.0,6.078883517391311e-05,4,303,0.3194810566527729,0.04836248452186853,1.040091633796692,COMPLETE
306,97.95915499600497,2023-09-04 19:54:58.013644,2023-09-04 19:54:58.274937,0 days 00:00:00.261293,Sigmoid,Sigmoid,Leaky,Leaky,46,16,20.0,17.0,24.0,0.0004351260539343118,4,272,0.35586059330635045,0.0380116378449743,0.9759281277656555,COMPLETE
307,262.345813800337,2023-09-04 19:54:58.275260,2023-09-04 19:55:00.900002,0 days 00:00:02.624742,Sigmoid,,,,43,7,,,,0.0001755660485890111,1,302,0.32057357400668507,0.04756317597173902,0.7200611233711243,COMPLETE
308,104.5730467765562,2023-09-04 19:55:00.900285,2023-09-04 19:55:01.511253,0 days 00:00:00.610968,Sigmoid,Sigmoid,Leaky,Tanh,45,16,20.0,16.0,17.0,0.0001318795573810303,4,315,0.3194908025251272,0.024519175775673228,0.8495633602142334,COMPLETE
309,126.29212188720703,2023-09-04 19:55:01.511574,2023-09-04 19:55:02.634419,0 days 00:00:01.122845,Sigmoid,Sigmoid,Leaky,ReLU,41,3,24.0,18.0,8.0,1.5951049033671387e-05,4,295,0.3408216845412847,0.030379995241715096,1.143408179283142,COMPLETE
310,93.12787127885662,2023-09-04 19:55:02.634759,2023-09-04 19:55:03.939147,0 days 00:00:01.304388,Sigmoid,Sigmoid,Leaky,Leaky,48,15,22.0,16.0,5.0,1.197085058534963e-05,4,61,0.3028312809036133,0.007894254944510995,1.070441484451294,COMPLETE
311,90.73112191094293,2023-09-04 19:55:03.939719,2023-09-04 19:55:05.178702,0 days 00:00:01.238983,Sigmoid,Sigmoid,Leaky,Leaky,50,15,22.0,16.0,5.0,1.2291252256240344e-05,4,205,0.2929566006878729,0.0018703738428272113,0.9749526977539062,COMPLETE
312,99.77060865319294,2023-09-04 19:55:05.179033,2023-09-04 19:55:06.237461,0 days 00:00:01.058428,Sigmoid,Sigmoid,Leaky,Leaky,52,15,22.0,16.0,4.0,1.2152562763566472e-05,4,69,0.2875690074500133,0.013908792013860402,0.9984292984008789,COMPLETE
313,89.2664571126302,2023-09-04 19:55:06.237799,2023-09-04 19:55:06.871669,0 days 00:00:00.633870,Sigmoid,Sigmoid,Leaky,,51,15,22.0,16.0,,1.024566997776765e-05,3,201,0.294331369240209,0.00493628941289571,0.8144670128822327,COMPLETE
314,102.7520484366068,2023-09-04 19:55:06.871991,2023-09-04 19:55:09.484385,0 days 00:00:02.612394,Sigmoid,Sigmoid,Leaky,,55,15,22.0,16.0,,2.2689830454429483e-05,3,205,0.2957758155515882,0.00858210836276104,0.9692927002906799,COMPLETE
315,101.56337432086771,2023-09-04 19:55:09.484712,2023-09-04 19:55:11.964677,0 days 00:00:02.479965,Sigmoid,Sigmoid,Leaky,,50,20,22.0,16.0,,1.1915854522501775e-05,3,197,0.2724794775587954,0.005860124355933051,0.9499667286872864,COMPLETE
316,99.73294143676758,2023-09-04 19:55:11.965012,2023-09-04 19:55:14.914450,0 days 00:00:02.949438,Sigmoid,Sigmoid,Leaky,,50,15,22.0,16.0,,1.8880136463462315e-05,3,210,0.3039989325920943,0.005392182151356681,1.0575029850006104,COMPLETE
317,166.4328605555281,2023-09-04 19:55:14.914778,2023-09-04 19:55:15.957451,0 days 00:00:01.042673,Sigmoid,Sigmoid,Leaky,,53,15,3.0,15.0,,1.4946586465925802e-05,3,79,0.2888420316868278,0.003986252679938922,1.0246038436889648,COMPLETE
318,168.2119520801609,2023-09-04 19:55:15.957772,2023-09-04 19:55:16.772798,0 days 00:00:00.815026,ReLU,Sigmoid,Leaky,,50,15,23.0,16.0,,1.2402712536925603e-05,3,59,0.28104879213234907,0.0018211767392735804,1.102105975151062,COMPLETE
319,134.52985183397928,2023-09-04 19:55:16.773125,2023-09-04 19:55:19.409098,0 days 00:00:02.635973,Sigmoid,Sigmoid,Leaky,,53,11,23.0,17.0,,0.00023311014237301615,3,192,0.30063972848988396,0.007763564463989857,0.7767024040222168,COMPLETE
320,101.02145123373869,2023-09-04 19:55:19.409415,2023-09-04 19:55:26.644624,0 days 00:00:07.235209,Sigmoid,Sigmoid,Leaky,,48,20,22.0,15.0,,1.000513035578681e-05,3,221,0.4100714724434469,0.006809134874030879,1.063183069229126,COMPLETE
321,93.39107121866216,2023-09-04 19:55:26.644962,2023-09-04 19:55:28.946974,0 days 00:00:02.302012,Sigmoid,Sigmoid,Leaky,,52,15,22.0,14.0,,1.6317009981061523e-05,3,189,0.26903272484739604,0.05607134263273388,1.0106643438339233,COMPLETE
322,98.49454575396598,2023-09-04 19:55:28.947294,2023-09-04 19:55:32.904214,0 days 00:00:03.956920,Sigmoid,Sigmoid,Leaky,,56,15,11.0,14.0,,1.802061887210053e-05,3,188,0.2706554500623871,0.010019844852025252,1.0459989309310913,COMPLETE
323,87.93045163395429,2023-09-04 19:55:32.904767,2023-09-04 19:55:36.688319,0 days 00:00:03.783552,Sigmoid,Tanh,Leaky,,53,15,22.0,14.0,,2.2492877986029214e-05,3,198,0.22564292181739481,0.008035892021114311,0.7460446357727051,COMPLETE
324,131.48197720655753,2023-09-04 19:55:36.688633,2023-09-04 19:55:56.525986,0 days 00:00:19.837353,Sigmoid,Tanh,Leaky,,14,15,22.0,14.0,,2.2018747619706264e-05,3,201,0.7509620150763427,0.009494328082579277,0.6947198510169983,COMPLETE
325,122.2152583195613,2023-09-04 19:55:56.526308,2023-09-04 19:55:58.853986,0 days 00:00:02.327678,Sigmoid,Tanh,Leaky,Leaky,54,15,22.0,13.0,5.0,1.0016120393437478e-05,4,195,0.23013181440721,0.0077713716605937455,1.022209882736206,COMPLETE
326,95.2022442045666,2023-09-04 19:55:58.854318,2023-09-04 19:56:00.947670,0 days 00:00:02.093352,Sigmoid,Tanh,Leaky,,53,15,21.0,13.0,,1.7450520848219525e-05,3,210,0.21452786336437163,0.0044247022908007515,1.0567156076431274,COMPLETE
327,111.13349319959471,2023-09-04 19:56:00.947986,2023-09-04 19:56:04.379165,0 days 00:00:03.431179,Sigmoid,Tanh,Leaky,,53,15,21.0,13.0,,2.589299986386716e-05,3,213,0.2707409686370869,0.004847922004011487,0.7247599363327026,COMPLETE
328,100.89951592225295,2023-09-04 19:56:04.379474,2023-09-04 19:56:06.204900,0 days 00:00:01.825426,Sigmoid,Tanh,Leaky,,52,15,22.0,13.0,,2.2300383023052575e-05,3,208,0.18576833026278342,0.004903396392592123,0.8867152333259583,COMPLETE
329,113.16075251362112,2023-09-04 19:56:06.205218,2023-09-04 19:56:08.074272,0 days 00:00:01.869054,Sigmoid,Tanh,Leaky,,55,15,21.0,12.0,,1.9920056714070478e-05,3,202,0.206276088185805,0.00396179080445958,0.8275550007820129,COMPLETE
330,109.52403696963661,2023-09-04 19:56:08.074592,2023-09-04 19:56:10.348268,0 days 00:00:02.273676,ReLU,Tanh,Leaky,,52,14,22.0,12.0,,1.765437721980029e-05,3,190,0.2616012012401513,0.003275401259022085,0.6167839765548706,COMPLETE
331,103.89065084822191,2023-09-04 19:56:10.348597,2023-09-04 19:56:12.128181,0 days 00:00:01.779584,Leaky,Tanh,Leaky,,57,15,23.0,3.0,,1.4125397804292487e-05,3,183,0.22724913947313113,0.0030311159179192827,0.7537837028503418,COMPLETE
332,146.86405710958357,2023-09-04 19:56:12.128498,2023-09-04 19:56:17.432809,0 days 00:00:05.304311,Sigmoid,Tanh,Leaky,,50,16,22.0,14.0,,9.744229199961838e-05,3,398,0.2869504170703338,0.0054629704256682465,0.6407288908958435,COMPLETE
333,107.68703218264001,2023-09-04 19:56:17.433124,2023-09-04 19:56:19.588503,0 days 00:00:02.155379,Sigmoid,Tanh,Leaky,,54,16,23.0,13.0,,2.3711348769259926e-05,3,214,0.21970717926261354,0.007238669083432644,0.8102125525474548,COMPLETE
334,101.59876393636068,2023-09-04 19:56:19.588827,2023-09-04 19:56:21.774294,0 days 00:00:02.185467,Sigmoid,Tanh,Leaky,,51,15,21.0,14.0,,1.6532016108325652e-05,3,225,0.19788723055788612,0.0063133637602209355,0.9579392671585083,COMPLETE
335,93.07858537070116,2023-09-04 19:56:21.774824,2023-09-04 19:56:25.264645,0 days 00:00:03.489821,Sigmoid,Tanh,Leaky,,51,8,22.0,14.0,,1.4836503889812508e-05,3,199,0.25573096693261294,0.010782352354791878,0.8347680568695068,COMPLETE
336,117.35392360876102,2023-09-04 19:56:25.264953,2023-09-04 19:56:27.527474,0 days 00:00:02.262521,Sigmoid,Tanh,Leaky,,51,8,22.0,14.0,,1.5685200006771734e-05,3,202,0.23981688605237889,0.010872404754229245,0.9006926417350769,COMPLETE
337,123.59846705013943,2023-09-04 19:56:27.527795,2023-09-04 19:56:30.510243,0 days 00:00:02.982448,Sigmoid,Tanh,Leaky,,49,8,21.0,13.0,,1.3451104643706517e-05,3,194,0.29422111097173975,0.012729766192321393,0.9787769317626953,COMPLETE
338,94.92249065541967,2023-09-04 19:56:30.510557,2023-09-04 19:56:32.883457,0 days 00:00:02.372900,Sigmoid,Tanh,Leaky,Leaky,53,8,22.0,14.0,5.0,1.884382110854282e-05,4,187,0.2426624875977747,0.008463969123169808,1.0224158763885498,COMPLETE
339,106.57998421892005,2023-09-04 19:56:32.883785,2023-09-04 19:56:35.291538,0 days 00:00:02.407753,Sigmoid,Tanh,Leaky,,54,8,22.0,14.0,,1.9461765936315402e-05,3,201,0.26998849927319657,0.0081080343126314,0.9968408942222595,COMPLETE
340,105.69101653560516,2023-09-04 19:56:35.291867,2023-09-04 19:56:37.732233,0 days 00:00:02.440366,Sigmoid,Tanh,Leaky,Leaky,52,7,22.0,13.0,5.0,1.8158520239277816e-05,4,186,0.24852328311015723,0.008498180013371059,0.960391640663147,COMPLETE
341,167.61295459581459,2023-09-04 19:56:37.732566,2023-09-04 19:56:39.760160,0 days 00:00:02.027594,Sigmoid,Tanh,Leaky,,55,9,23.0,14.0,,0.0010561870827731324,3,184,0.2167226890823251,0.009831176275815761,0.6629951596260071,COMPLETE
342,134.88171277004005,2023-09-04 19:56:39.760478,2023-09-04 19:56:49.979107,0 days 00:00:10.218629,Sigmoid,Tanh,Leaky,Leaky,50,8,22.0,14.0,5.0,2.596023420398307e-05,4,452,0.25989238989130725,0.0017889576301298481,0.7355194091796875,COMPLETE
343,115.12868075200021,2023-09-04 19:56:49.979430,2023-09-04 19:56:54.585343,0 days 00:00:04.605913,ReLU,Tanh,Leaky,Leaky,53,9,23.0,14.0,7.0,2.2369547511391824e-05,4,363,0.24534488186284328,0.011641113828882797,0.5895785093307495,COMPLETE
344,125.32880641138831,2023-09-04 19:56:54.585671,2023-09-04 19:56:55.790826,0 days 00:00:01.205155,Sigmoid,Tanh,Leaky,Leaky,52,11,22.0,15.0,3.0,0.00020136179861219233,4,208,0.2620963388463794,0.007366395335819841,0.5741059184074402,COMPLETE
345,103.06921348221805,2023-09-04 19:56:55.791137,2023-09-04 19:56:58.162359,0 days 00:00:02.371222,Sigmoid,Tanh,Leaky,,57,6,23.0,15.0,,1.5915331685796097e-05,3,218,0.2501202229665548,0.006169671650193886,0.8464073538780212,COMPLETE
346,87.19801721620799,2023-09-04 19:56:58.162679,2023-09-04 19:57:00.731610,0 days 00:00:02.568931,Sigmoid,Tanh,Leaky,Leaky,56,10,21.0,14.0,4.0,2.0225735475781758e-05,4,199,0.2617212450740627,0.006739355779196092,0.7953789830207825,COMPLETE
347,124.11131393909454,2023-09-04 19:57:00.731942,2023-09-04 19:57:03.208218,0 days 00:00:02.476276,Sigmoid,Tanh,Leaky,Leaky,56,10,21.0,13.0,4.0,2.1692356112041353e-05,4,192,0.2578769213884246,0.001259887287221685,0.8814173340797424,COMPLETE
348,141.91116972018014,2023-09-04 19:57:03.208546,2023-09-04 19:57:06.693315,0 days 00:00:03.484769,Sigmoid,Tanh,Leaky,,51,9,9.0,14.0,,2.6115913519069048e-05,3,197,0.2348415765412726,0.004312303582002445,0.8957774043083191,COMPLETE
349,133.29204851909748,2023-09-04 19:57:06.693869,2023-09-04 19:57:10.216378,0 days 00:00:03.522509,Sigmoid,Tanh,Leaky,Leaky,77,10,21.0,15.0,6.0,1.858284543536287e-05,4,206,0.24775053151963064,0.006755614665811593,0.9533072710037231,COMPLETE
350,143.26523861355253,2023-09-04 19:57:10.216717,2023-09-04 19:57:13.366395,0 days 00:00:03.149678,Sigmoid,Tanh,Leaky,,54,7,22.0,24.0,,0.00015856283858706413,3,180,0.2772354078665111,0.0022885427653898767,0.6866179704666138,COMPLETE
351,324.5559869042055,2023-09-04 19:57:13.366949,2023-09-04 19:57:17.625692,0 days 00:00:04.258743,Sigmoid,Tanh,Leaky,Leaky,75,7,23.0,11.0,4.0,7.394439900791178e-05,4,187,0.257490600438704,0.0056441527903425635,0.7074020504951477,COMPLETE
352,181.3747978018756,2023-09-04 19:57:17.626022,2023-09-04 19:57:21.466496,0 days 00:00:03.840474,Sigmoid,Tanh,Leaky,Leaky,49,10,10.0,14.0,4.0,2.817975314306265e-05,4,199,0.2333758509875677,0.008391937916076292,1.1300874948501587,COMPLETE
353,113.69722501693234,2023-09-04 19:57:21.466825,2023-09-04 19:57:26.295594,0 days 00:00:04.828769,Leaky,Tanh,Leaky,,51,8,22.0,13.0,,1.8632890670467315e-05,3,217,0.2550430803432432,0.009754238951074346,0.7868092656135559,COMPLETE
354,114.035461164202,2023-09-04 19:57:26.295923,2023-09-04 19:57:28.295491,0 days 00:00:01.999568,Sigmoid,Tanh,Leaky,Leaky,72,9,24.0,14.0,5.0,1.5157151570302671e-05,4,175,0.239508334495363,0.003812247338751592,0.9326485991477966,COMPLETE
355,237.38459561040492,2023-09-04 19:57:28.295834,2023-09-04 19:57:31.673225,0 days 00:00:03.377391,Sigmoid,Tanh,Leaky,Leaky,53,10,22.0,15.0,3.0,2.0831183209596156e-05,4,183,0.22615335002274523,0.007084842679717925,0.9106484055519104,COMPLETE
356,169.65364528749046,2023-09-04 19:57:31.673811,2023-09-04 19:57:34.550668,0 days 00:00:02.876857,ReLU,Tanh,Leaky,,48,11,21.0,14.0,,0.00013073014650115132,3,205,0.28157493211620516,0.004540068291646763,0.4380151927471161,COMPLETE
357,119.72183131167763,2023-09-04 19:57:34.550994,2023-09-04 19:57:36.844806,0 days 00:00:02.293812,Sigmoid,Tanh,Leaky,Sigmoid,78,10,23.0,15.0,14.0,5.1804994338850285e-05,4,190,0.24423432839173972,3.350255275895988e-05,0.7172993421554565,COMPLETE
358,131.79767225017656,2023-09-04 19:57:36.845144,2023-09-04 19:57:38.926398,0 days 00:00:02.081254,Sigmoid,Tanh,Leaky,Leaky,51,9,24.0,15.0,9.0,3.340745486284956e-05,4,177,0.21548589057755022,0.011226190644849199,0.8955771327018738,COMPLETE
359,121.96528219479566,2023-09-04 19:57:38.926726,2023-09-04 19:57:39.824773,0 days 00:00:00.898047,Sigmoid,Tanh,Leaky,,58,11,21.0,14.0,,1.385430781950425e-05,3,171,0.10592302206239151,0.014487133637690391,1.0192320346832275,COMPLETE
360,108.274146877191,2023-09-04 19:57:39.825099,2023-09-04 19:57:41.751625,0 days 00:00:01.926526,Sigmoid,Tanh,Leaky,Leaky,97,8,24.0,13.0,6.0,1.620404216823863e-05,4,195,0.25805951577116415,0.00024499483179998784,1.0621933937072754,COMPLETE
361,198.74681831808653,2023-09-04 19:57:41.752209,2023-09-04 19:57:43.518822,0 days 00:00:01.766613,Sigmoid,Sigmoid,Leaky,,55,7,23.0,15.0,,0.03138416372971508,3,168,0.5458793695827083,0.005364321019024254,0.5084338784217834,COMPLETE
362,268.2802040793679,2023-09-04 19:57:43.519141,2023-09-04 19:57:43.729850,0 days 00:00:00.210709,Sigmoid,Sigmoid,Leaky,Leaky,49,11,22.0,15.0,10.0,2.4823389462713855e-05,4,225,0.2721007717249989,0.00292854007814093,1.3017069101333618,COMPLETE
363,138.4165887378511,2023-09-04 19:57:43.730178,2023-09-04 19:57:45.424111,0 days 00:00:01.693933,Sigmoid,Sigmoid,Leaky,Leaky,80,19,12.0,13.0,5.0,6.8767283242834e-05,4,211,0.527819519789396,0.01281722949223421,0.9782202839851379,COMPLETE
