number,value,datetime_start,datetime_complete,duration,params_activation1,params_activation2,params_activation3,params_activation4,params_batch_size,params_fl1,params_fl2,params_fl3,params_fl4,params_learning_rate,params_n_layers,params_num_epochs,params_train_size,params_weight_decay,user_attrs_mre,state
289,0.32820677757263184,2023-09-04 18:38:54.724769,2023-09-04 18:39:05.621620,0 days 00:00:10.896851,ReLU,ReLU,ReLU,Sigmoid,38,24,23.0,5.0,20.0,0.000702180853771696,4,201,0.6609288473563936,0.001794336197997631,154.84178896452252,COMPLETE
290,0.2978092133998871,2023-09-04 18:39:05.622067,2023-09-04 18:39:16.068070,0 days 00:00:10.446003,ReLU,ReLU,ReLU,Tanh,42,24,23.0,7.0,13.0,0.00040574984506149307,4,233,0.7005024761702875,0.0011610103959226827,93.1679086285437,COMPLETE
291,0.34755823016166687,2023-09-04 18:39:16.068544,2023-09-04 18:39:22.109107,0 days 00:00:06.040563,ReLU,ReLU,ReLU,Tanh,44,24,23.0,7.0,13.0,0.0004725450306404749,4,232,0.7232917995756272,0.0012231725952428596,97.08347145080566,COMPLETE
292,0.3324240446090698,2023-09-04 18:39:22.109556,2023-09-04 18:39:27.663972,0 days 00:00:05.554416,ReLU,ReLU,ReLU,,46,24,22.0,10.0,,0.0004404254023408764,3,176,0.7638172832480665,0.0008766003204523307,94.04322422572545,COMPLETE
293,0.3132321238517761,2023-09-04 18:39:27.664373,2023-09-04 18:39:32.663109,0 days 00:00:04.998736,ReLU,ReLU,ReLU,Tanh,43,24,23.0,12.0,9.0,0.0006411683883252706,4,244,0.7009011859588699,0.0016094328426851587,93.68434694588902,COMPLETE
294,0.276048868894577,2023-09-04 18:39:32.663685,2023-09-04 18:39:37.089120,0 days 00:00:04.425435,ReLU,ReLU,ReLU,Tanh,40,24,22.0,8.0,21.0,0.000970540096498976,4,237,0.6411948506915078,0.0011822540728626712,88.92233657836914,COMPLETE
295,0.31606563925743103,2023-09-04 18:39:37.089689,2023-09-04 18:39:41.843020,0 days 00:00:04.753331,ReLU,ReLU,ReLU,Tanh,41,24,22.0,8.0,21.0,0.0010653919820632991,4,238,0.6519867835977678,0.0020987548112591514,91.83470888835627,COMPLETE
296,0.3308783769607544,2023-09-04 18:39:41.843499,2023-09-04 18:39:46.083897,0 days 00:00:04.240398,ReLU,ReLU,ReLU,Tanh,42,24,22.0,10.0,16.0,0.0009290690230452936,4,229,0.7909240377962653,0.0013451917888400496,96.19160129177955,COMPLETE
297,0.3295411765575409,2023-09-04 18:39:46.084361,2023-09-04 18:39:49.867803,0 days 00:00:03.783442,ReLU,ReLU,ReLU,Tanh,39,24,22.0,8.0,21.0,0.0014661953132191932,4,223,0.6845715916663709,0.0012343549318125898,102.90125167578982,COMPLETE
298,0.31599295139312744,2023-09-04 18:39:49.868166,2023-09-04 18:40:03.302382,0 days 00:00:13.434216,ReLU,ReLU,ReLU,Tanh,41,24,24.0,4.0,16.0,0.0002537732808745076,4,248,0.63936992711727,0.0010510888284913343,98.11251814540846,COMPLETE
299,0.31614986062049866,2023-09-04 18:40:03.302715,2023-09-04 18:40:08.973434,0 days 00:00:05.670719,ReLU,ReLU,Tanh,Tanh,34,24,22.0,11.0,18.0,0.0011437932011581378,4,238,0.6699177151944108,0.0015646064817467988,127.7406823007684,COMPLETE
300,0.38213080167770386,2023-09-04 18:40:08.973795,2023-09-04 18:40:11.462729,0 days 00:00:02.488934,ReLU,ReLU,Sigmoid,,38,23,23.0,6.0,,0.048622892011499136,3,226,0.7131015006305741,0.0008459745163339151,125.47216424709413,COMPLETE
301,0.33064672350883484,2023-09-04 18:40:11.463110,2023-09-04 18:40:17.695610,0 days 00:00:06.232500,ReLU,ReLU,ReLU,Tanh,36,24,23.0,9.0,22.0,0.0009156042262490954,4,249,0.62972945698113,0.001260417893656772,90.4983495871226,COMPLETE
302,0.3525235950946808,2023-09-04 18:40:17.696011,2023-09-04 18:40:20.210862,0 days 00:00:02.514851,ReLU,ReLU,ReLU,,45,24,24.0,7.0,,0.001327103890471814,3,237,0.66090897747357,0.0010835008204077442,106.61452270507813,COMPLETE
303,0.3043651282787323,2023-09-04 18:40:20.211235,2023-09-04 18:40:27.918822,0 days 00:00:07.707587,ReLU,ReLU,ReLU,Sigmoid,40,23,22.0,16.0,14.0,0.000711176254851735,4,209,0.6970071301447938,0.0006681732503751074,125.34467513688648,COMPLETE
304,0.3632122576236725,2023-09-04 18:40:27.919170,2023-09-04 18:40:36.058164,0 days 00:00:08.138994,ReLU,ReLU,ReLU,Sigmoid,40,23,22.0,16.0,13.0,0.0006126950727436627,4,212,0.6981107864416468,0.0006938687898676889,107.68682103723913,COMPLETE
305,0.34407278895378113,2023-09-04 18:40:36.058628,2023-09-04 18:40:40.583026,0 days 00:00:04.524398,ReLU,ReLU,ReLU,Sigmoid,42,23,23.0,10.0,14.0,0.000707454039443234,4,218,0.6331127035705687,0.0009704697715765606,102.53216448332134,COMPLETE
306,0.3099595904350281,2023-09-04 18:40:40.583384,2023-09-04 18:40:45.104586,0 days 00:00:04.521202,ReLU,ReLU,ReLU,Sigmoid,49,24,22.0,11.0,18.0,0.00107061018518985,4,180,0.7559070837456172,0.0017174193316153168,100.96727400559645,COMPLETE
307,0.37763142585754395,2023-09-04 18:40:45.105023,2023-09-04 18:40:47.711531,0 days 00:00:02.606508,ReLU,ReLU,ReLU,Sigmoid,38,23,22.0,11.0,18.0,0.028538938659566443,4,167,0.7638031383539119,0.0019528015010257698,142.862987317537,COMPLETE
308,0.3659740388393402,2023-09-04 18:40:47.711892,2023-09-04 18:40:56.271077,0 days 00:00:08.559185,Tanh,ReLU,ReLU,Sigmoid,51,8,21.0,13.0,17.0,0.0003709309603326077,4,181,0.7182923391601216,0.0015912843183461156,102.07912255387279,COMPLETE
309,0.3463682234287262,2023-09-04 18:40:56.271427,2023-09-04 18:40:59.347104,0 days 00:00:03.075677,ReLU,ReLU,Tanh,Sigmoid,47,24,22.0,16.0,20.0,0.0006221924752969918,4,206,0.6786384172454264,0.001306921978456693,112.04209989659927,COMPLETE
310,0.30698883533477783,2023-09-04 18:40:59.347453,2023-09-04 18:41:05.198796,0 days 00:00:05.851343,ReLU,ReLU,ReLU,Sigmoid,49,23,21.0,9.0,11.0,0.0008681274612612288,4,190,0.7481943240447873,0.0023324209042735085,124.09470472028178,COMPLETE
311,0.34033435583114624,2023-09-04 18:41:05.199149,2023-09-04 18:41:13.119546,0 days 00:00:07.920397,ReLU,ReLU,ReLU,Sigmoid,50,23,21.0,9.0,10.0,0.0009349192440890051,4,175,0.7345708593053306,0.0028562312573003476,115.59358193533761,COMPLETE
312,0.3252318799495697,2023-09-04 18:41:13.119892,2023-09-04 18:41:18.337161,0 days 00:00:05.217269,ReLU,ReLU,ReLU,Sigmoid,46,23,21.0,12.0,8.0,0.0016072158864572795,4,155,0.7625652136343808,0.0023032816688126827,269.23183089036206,COMPLETE
313,0.35182660818099976,2023-09-04 18:41:18.337650,2023-09-04 18:41:22.630881,0 days 00:00:04.293231,ReLU,ReLU,ReLU,Sigmoid,48,6,22.0,8.0,12.0,0.0013292683438783665,4,191,0.7375829707922449,0.0017397448762077913,121.86295143954725,COMPLETE
314,0.32891085743904114,2023-09-04 18:41:22.631341,2023-09-04 18:41:25.449772,0 days 00:00:02.818431,ReLU,ReLU,ReLU,Leaky,54,23,22.0,6.0,14.0,0.0010726812719313254,4,190,0.7095958884023705,0.001920719442856766,90.48852594347967,COMPLETE
315,0.3284139335155487,2023-09-04 18:41:25.450132,2023-09-04 18:41:33.507456,0 days 00:00:08.057324,ReLU,ReLU,ReLU,Sigmoid,40,24,21.0,11.0,19.0,0.0009579459442636641,4,181,0.6865954124244092,0.0032763535562623978,113.3537981480728,COMPLETE
316,0.3368242084980011,2023-09-04 18:41:33.507829,2023-09-04 18:41:38.654277,0 days 00:00:05.146448,ReLU,Leaky,Sigmoid,ReLU,43,7,22.0,18.0,8.0,0.0008602771208520377,4,194,0.7828493340073429,0.0007490075612637607,122.81585722988092,COMPLETE
317,0.4778389036655426,2023-09-04 18:41:38.654759,2023-09-04 18:41:50.200432,0 days 00:00:11.545673,ReLU,ReLU,ReLU,Leaky,38,23,24.0,10.0,22.0,2.1221692580895553e-05,4,202,0.7984311012485676,0.0009073968884925683,125.14818807167582,COMPLETE
318,0.5538641810417175,2023-09-04 18:41:50.200804,2023-09-04 18:41:51.300818,0 days 00:00:01.100014,ReLU,ReLU,ReLU,Tanh,42,23,23.0,7.0,5.0,0.07090858253613504,4,170,0.6577965176037491,0.0005683859317858568,157.92106384277344,COMPLETE
319,0.28726527094841003,2023-09-04 18:41:51.301176,2023-09-04 18:41:56.138168,0 days 00:00:04.836992,ReLU,ReLU,ReLU,Sigmoid,56,24,22.0,9.0,15.0,0.0012707989780726921,4,232,0.7388429425662459,0.001047660050182056,95.25674146946852,COMPLETE
320,0.3350360095500946,2023-09-04 18:41:56.138521,2023-09-04 18:42:01.013692,0 days 00:00:04.875171,ReLU,ReLU,ReLU,Sigmoid,36,24,22.0,9.0,15.0,0.0016341099534250476,4,232,0.7430947142195051,0.0012053152506182935,94.47309641404586,COMPLETE
321,0.3381991386413574,2023-09-04 18:42:01.014295,2023-09-04 18:42:23.467194,0 days 00:00:22.452899,ReLU,ReLU,ReLU,Sigmoid,53,23,21.0,8.0,12.0,0.0005124792636673536,4,251,0.7481652766782413,0.0014727409764583477,112.21028710399885,COMPLETE
322,0.2969874441623688,2023-09-04 18:42:23.467803,2023-09-04 18:42:38.394289,0 days 00:00:14.926486,ReLU,ReLU,ReLU,ReLU,45,24,22.0,10.0,17.0,0.0008089374779729999,4,245,0.7405549618283688,0.001022075950438206,93.79996164562633,COMPLETE
323,0.32740694284439087,2023-09-04 18:42:38.394889,2023-09-04 18:42:53.967239,0 days 00:00:15.572350,ReLU,ReLU,ReLU,ReLU,57,24,21.0,10.0,17.0,0.000769220288712164,4,253,0.7478712606564347,0.0010991886902379287,84.42758976017032,COMPLETE
324,0.3368854820728302,2023-09-04 18:42:53.967860,2023-09-04 18:43:06.817636,0 days 00:00:12.849776,ReLU,ReLU,ReLU,ReLU,49,24,10.0,11.0,15.0,0.0005724104412474387,4,211,0.718828311390605,0.0022387539206044325,99.26331560539477,COMPLETE
325,0.2956627309322357,2023-09-04 18:43:06.818258,2023-09-04 18:43:24.016333,0 days 00:00:17.198075,ReLU,ReLU,ReLU,ReLU,44,24,5.0,9.0,17.0,0.000750358025691699,4,258,0.6833161119149352,0.0015568841870310236,101.0647821207993,COMPLETE
326,0.40696677565574646,2023-09-04 18:43:24.016928,2023-09-04 18:43:33.727608,0 days 00:00:09.710680,ReLU,ReLU,ReLU,ReLU,44,24,1.0,9.0,17.0,0.0007660481963125136,4,248,0.7731049259337196,0.0016638937068718799,117.76349418394027,COMPLETE
327,0.33359435200691223,2023-09-04 18:43:33.728224,2023-09-04 18:43:50.920819,0 days 00:00:17.192595,ReLU,ReLU,ReLU,ReLU,46,23,22.0,10.0,19.0,0.0004373070776454716,4,254,0.6797400089569386,0.0014189532640485243,99.23298198558666,COMPLETE
328,0.2847858965396881,2023-09-04 18:43:50.921409,2023-09-04 18:44:13.251133,0 days 00:00:22.329724,ReLU,ReLU,ReLU,ReLU,45,24,21.0,9.0,14.0,0.0005858722052501747,4,257,0.7306402763135913,0.0010774009341256575,86.18643989562989,COMPLETE
329,0.3211807906627655,2023-09-04 18:44:13.251726,2023-09-04 18:44:35.667381,0 days 00:00:22.415655,ReLU,ReLU,ReLU,ReLU,45,24,3.0,9.0,14.0,0.000624478302739476,4,260,0.7064242690120047,0.001127887333775394,95.5543836815957,COMPLETE
330,0.34792476892471313,2023-09-04 18:44:35.668005,2023-09-04 18:44:49.465812,0 days 00:00:13.797807,ReLU,ReLU,ReLU,ReLU,45,24,21.0,7.0,11.0,0.0005284242728179996,4,244,0.6699674458574062,0.0009448185323422633,103.19651585131619,COMPLETE
331,0.3135741055011749,2023-09-04 18:44:49.466416,2023-09-04 18:45:00.403966,0 days 00:00:10.937550,ReLU,ReLU,ReLU,ReLU,42,24,21.0,8.0,15.0,0.0006937150007898242,4,258,0.7331801308169714,0.0007673033689573648,98.42679927223607,COMPLETE
332,0.3279242515563965,2023-09-04 18:45:00.404575,2023-09-04 18:45:07.467072,0 days 00:00:07.062497,ReLU,ReLU,ReLU,Tanh,43,23,4.0,9.0,13.0,0.0002867362775254312,4,246,0.694024484568454,0.0004861547259570546,106.0174019415647,COMPLETE
333,0.33407139778137207,2023-09-04 18:45:07.467413,2023-09-04 18:45:11.935907,0 days 00:00:04.468494,ReLU,Leaky,Tanh,ReLU,41,23,22.0,10.0,16.0,0.0003956454002580738,4,232,0.6441703022292955,0.0013668921560597048,105.05807883522728,COMPLETE
334,0.30561813712120056,2023-09-04 18:45:11.936249,2023-09-04 18:45:15.055625,0 days 00:00:03.119376,ReLU,ReLU,ReLU,Tanh,43,24,7.0,8.0,14.0,0.001822222119828149,4,262,0.798162184462859,0.0010231614989242848,99.12742221355438,COMPLETE
335,0.376601904630661,2023-09-04 18:45:15.056024,2023-09-04 18:45:21.180268,0 days 00:00:06.124244,ReLU,ReLU,ReLU,Tanh,43,10,7.0,8.0,15.0,0.0005523584249732481,4,264,0.785742130144509,0.0009801387840093767,95.0280774630033,COMPLETE
336,0.28866684436798096,2023-09-04 18:45:21.180600,2023-09-04 18:45:25.428294,0 days 00:00:04.247694,ReLU,ReLU,ReLU,Tanh,45,24,7.0,9.0,14.0,0.001720871350709557,4,258,0.7273364098334922,0.0011168680484667736,90.35978652954101,COMPLETE
337,0.28832119703292847,2023-09-04 18:45:25.428623,2023-09-04 18:45:27.844550,0 days 00:00:02.415927,ReLU,ReLU,ReLU,Tanh,48,24,7.0,9.0,14.0,0.0017829172578239065,4,256,0.7925719022427646,0.001137119062308855,99.97906161221592,COMPLETE
338,0.2938380837440491,2023-09-04 18:45:27.844882,2023-09-04 18:45:30.065298,0 days 00:00:02.220416,ReLU,ReLU,ReLU,Tanh,47,24,6.0,9.0,14.0,0.00162188841738336,4,259,0.7975794787566223,0.0011124709658756604,92.83317098812181,COMPLETE
339,0.34240663051605225,2023-09-04 18:45:30.065645,2023-09-04 18:45:32.235251,0 days 00:00:02.169606,ReLU,ReLU,ReLU,Tanh,48,24,6.0,9.0,14.0,0.0018347748286829042,4,263,0.795234280006251,0.001142168194007613,99.53844156070632,COMPLETE
340,0.3335036039352417,2023-09-04 18:45:32.235612,2023-09-04 18:45:35.855597,0 days 00:00:03.619985,ReLU,ReLU,ReLU,Tanh,46,24,6.0,8.0,13.0,0.0015651308631669419,4,257,0.7690422679832684,0.0010202051623778932,141.7124785468692,COMPLETE
341,0.28887733817100525,2023-09-04 18:45:35.855955,2023-09-04 18:45:38.116365,0 days 00:00:02.260410,ReLU,ReLU,ReLU,Tanh,47,24,5.0,9.0,14.0,0.001976710679190584,4,255,0.7441114765717758,0.0008287021847545804,100.22643703884549,COMPLETE
342,0.2885269224643707,2023-09-04 18:45:38.116714,2023-09-04 18:45:40.876718,0 days 00:00:02.760004,ReLU,ReLU,ReLU,Tanh,56,24,8.0,10.0,14.0,0.0017964947238171454,4,254,0.7359581089330834,0.0008133446003423007,99.50966307696174,COMPLETE
343,0.3334274888038635,2023-09-04 18:45:40.877058,2023-09-04 18:45:44.428693,0 days 00:00:03.551635,ReLU,ReLU,ReLU,Tanh,58,24,5.0,10.0,14.0,0.0019263070923398256,4,267,0.7876195476432294,0.0006568376899524677,87.59107971191406,COMPLETE
344,0.2789311408996582,2023-09-04 18:45:44.429142,2023-09-04 18:45:46.349730,0 days 00:00:01.920588,ReLU,ReLU,ReLU,Tanh,56,24,8.0,9.0,14.0,0.0018006117251474338,4,255,0.7176560413156097,0.0007337089702577458,102.91640161584925,COMPLETE
345,0.32015854120254517,2023-09-04 18:45:46.350116,2023-09-04 18:45:48.377401,0 days 00:00:02.027285,ReLU,ReLU,ReLU,Tanh,57,24,8.0,9.0,14.0,0.001996349028975737,4,258,0.7987081441166698,0.0008102744229205775,482.626303878485,COMPLETE
346,0.30490273237228394,2023-09-04 18:45:48.377756,2023-09-04 18:45:52.072521,0 days 00:00:03.694765,ReLU,ReLU,ReLU,Tanh,55,24,8.0,10.0,13.0,0.001334527413301338,4,254,0.7196942428732567,0.0008072128955622041,86.53637746664194,COMPLETE
347,0.3120187819004059,2023-09-04 18:45:52.072881,2023-09-04 18:45:54.254276,0 days 00:00:02.181395,ReLU,ReLU,ReLU,Tanh,60,24,6.0,10.0,13.0,0.001461871053174827,4,253,0.7300432880263862,0.000596724505120658,99.51564538478851,COMPLETE
348,0.3339458107948303,2023-09-04 18:45:54.254725,2023-09-04 18:45:57.378686,0 days 00:00:03.123961,ReLU,ReLU,ReLU,Tanh,56,24,9.0,10.0,13.0,0.001470484789162695,4,254,0.7242818666781409,0.0008514315575513313,89.60524974149816,COMPLETE
349,0.36500996351242065,2023-09-04 18:45:57.379131,2023-09-04 18:45:59.193698,0 days 00:00:01.814567,ReLU,ReLU,ReLU,Tanh,55,24,5.0,9.0,15.0,0.0013132383372946848,4,237,0.7017846706282825,0.0007687194437696617,118.32589467366536,COMPLETE
350,0.30203503370285034,2023-09-04 18:45:59.194146,2023-09-04 18:46:02.175073,0 days 00:00:02.980927,ReLU,ReLU,ReLU,Tanh,60,24,7.0,11.0,16.0,0.0013744946976709904,4,253,0.750204282698653,0.0005793577852939595,91.14194438496574,COMPLETE
351,0.31413906812667847,2023-09-04 18:46:02.175669,2023-09-04 18:46:08.293705,0 days 00:00:06.118036,ReLU,ReLU,ReLU,Tanh,51,24,8.0,11.0,17.0,0.0017157802977304196,4,255,0.752356013455547,0.0005623073535068837,90.84112121582031,COMPLETE
352,0.2823305130004883,2023-09-04 18:46:08.294313,2023-09-04 18:46:15.232739,0 days 00:00:06.938426,ReLU,ReLU,ReLU,Tanh,62,24,7.0,10.0,16.0,0.0013221145943467937,4,264,0.7271279917556582,0.0006090325861317593,98.38421155404353,COMPLETE
353,0.28089120984077454,2023-09-04 18:46:15.233324,2023-09-04 18:46:20.745098,0 days 00:00:05.511774,ReLU,ReLU,ReLU,Tanh,62,24,7.0,9.0,16.0,0.001965895039775972,4,264,0.751440919114625,0.0003918759608494539,86.39260331639704,COMPLETE
354,0.285273015499115,2023-09-04 18:46:20.745714,2023-09-04 18:46:25.113251,0 days 00:00:04.367537,ReLU,ReLU,ReLU,Tanh,59,24,7.0,9.0,16.0,0.002129515034621429,4,266,0.7507603643307983,0.0004991429975927045,98.85795555114746,COMPLETE
355,0.3185250461101532,2023-09-04 18:46:25.113848,2023-09-04 18:46:33.381287,0 days 00:00:08.267439,ReLU,ReLU,ReLU,Tanh,63,24,7.0,9.0,16.0,0.002135515328460594,4,265,0.7349051948487788,0.000522388595484992,94.88322246505554,COMPLETE
356,0.29437997937202454,2023-09-04 18:46:33.381880,2023-09-04 18:46:39.002636,0 days 00:00:05.620756,ReLU,ReLU,ReLU,Tanh,61,24,7.0,9.0,16.0,0.002014370720027524,4,266,0.7607807731409165,0.00041239107390405813,95.20191618112418,COMPLETE
357,0.31256282329559326,2023-09-04 18:46:39.003216,2023-09-04 18:46:42.765561,0 days 00:00:03.762345,ReLU,ReLU,ReLU,Tanh,60,24,7.0,9.0,16.0,0.001953710642607744,4,269,0.7618203454544661,0.0004334350412829381,103.26012755276864,COMPLETE
358,0.3608507812023163,2023-09-04 18:46:42.765930,2023-09-04 18:46:45.275277,0 days 00:00:02.509347,ReLU,ReLU,ReLU,Tanh,62,24,6.0,8.0,17.0,0.0019204740557156195,4,267,0.7626155923201352,0.00040012875365499906,102.8548920322472,COMPLETE
359,0.3135414719581604,2023-09-04 18:46:45.275627,2023-09-04 18:46:47.320450,0 days 00:00:02.044823,ReLU,ReLU,ReLU,Tanh,65,24,5.0,10.0,16.0,0.002278815401444953,4,261,0.7613514650905883,0.0003469777360844048,105.800115331014,COMPLETE
360,0.3467560410499573,2023-09-04 18:46:47.320793,2023-09-04 18:46:49.004299,0 days 00:00:01.683506,ReLU,ReLU,ReLU,Tanh,57,24,7.0,9.0,15.0,0.0017788706205720867,4,267,0.7412779449559727,0.0004991580586609454,99.49129926893445,COMPLETE
361,0.3554845452308655,2023-09-04 18:46:49.004705,2023-09-04 18:46:51.271174,0 days 00:00:02.266469,ReLU,ReLU,ReLU,Tanh,58,23,8.0,9.0,16.0,0.002171370183965855,4,248,0.7255777180030786,0.0006231362321708804,95.75299365703876,COMPLETE
362,0.3288467228412628,2023-09-04 18:46:51.271519,2023-09-04 18:46:52.874412,0 days 00:00:01.602893,ReLU,ReLU,ReLU,Tanh,53,24,6.0,11.0,15.0,0.0016251646528362433,4,256,0.7709093144294922,0.0006275144082985072,111.61752204895019,COMPLETE
363,0.3428041636943817,2023-09-04 18:46:52.874783,2023-09-04 18:46:55.683011,0 days 00:00:02.808228,ReLU,ReLU,ReLU,Tanh,62,24,7.0,10.0,18.0,0.001648849251125214,4,260,0.7211650424572218,0.0004373237226417459,90.15152205543957,COMPLETE
364,0.34560680389404297,2023-09-04 18:46:55.683357,2023-09-04 18:46:56.848922,0 days 00:00:01.165565,ReLU,ReLU,ReLU,Tanh,59,23,5.0,8.0,17.0,0.002214092917787192,4,273,0.7958512651497687,0.0007965097136433693,96.66936148366621,COMPLETE
365,0.325431764125824,2023-09-04 18:46:56.849282,2023-09-04 18:46:58.331738,0 days 00:00:01.482456,ReLU,ReLU,ReLU,Tanh,59,24,7.0,10.0,16.0,0.0013940422340664742,4,248,0.7464207893298925,0.0002927254180139954,100.76598939441499,COMPLETE
366,0.38853394985198975,2023-09-04 18:46:58.332093,2023-09-04 18:47:02.117440,0 days 00:00:03.785347,ReLU,ReLU,ReLU,Tanh,59,24,8.0,9.0,15.0,0.0003513347717596368,4,243,0.7173410051945727,0.0004959190622092865,97.08055958705665,COMPLETE
367,0.3182085156440735,2023-09-04 18:47:02.117796,2023-09-04 18:47:04.365618,0 days 00:00:02.247822,ReLU,ReLU,ReLU,Tanh,61,23,6.0,12.0,14.0,0.002042851610117122,4,261,0.762852366621021,0.0009463263497180421,90.81331515312195,COMPLETE
368,0.33751586079597473,2023-09-04 18:47:04.365957,2023-09-04 18:47:06.849180,0 days 00:00:02.483223,ReLU,ReLU,Sigmoid,Tanh,65,24,7.0,7.0,18.0,0.0016452736320137827,4,270,0.6915322147047198,0.0003491346645499968,102.09827377135495,COMPLETE
369,0.3911079466342926,2023-09-04 18:47:06.849527,2023-09-04 18:47:15.446723,0 days 00:00:08.597196,ReLU,ReLU,ReLU,Tanh,61,23,7.0,11.0,17.0,4.613816693402041e-05,4,255,0.7465114630782826,0.0011937389735498982,139.72986988740809,COMPLETE
370,0.3152453303337097,2023-09-04 18:47:15.447077,2023-09-04 18:47:17.834353,0 days 00:00:02.387276,ReLU,Leaky,ReLU,Tanh,63,24,9.0,8.0,15.0,0.0014017996895178252,4,250,0.713471167992398,0.0007481983100300717,103.44756564578495,COMPLETE
371,0.30254092812538147,2023-09-04 18:47:17.834808,2023-09-04 18:47:23.205563,0 days 00:00:05.370755,ReLU,ReLU,ReLU,Leaky,47,24,6.0,10.0,24.0,0.0012600078204284928,4,241,0.7739754003057803,0.0006507890464406429,96.55613803075364,COMPLETE
372,0.3061102628707886,2023-09-04 18:47:23.206016,2023-09-04 18:47:25.410595,0 days 00:00:02.204579,ReLU,ReLU,ReLU,Tanh,55,23,7.0,9.0,12.0,0.0018501983535133693,4,267,0.6858507174044135,0.0011610368386804335,89.3244624211238,COMPLETE
373,0.3432501554489136,2023-09-04 18:47:25.410943,2023-09-04 18:47:27.450509,0 days 00:00:02.039566,ReLU,ReLU,ReLU,Tanh,60,24,2.0,10.0,14.0,0.0021135770403398124,4,277,0.7390352142837237,0.0009154079573206949,95.5074073791504,COMPLETE
374,0.3635149598121643,2023-09-04 18:47:27.450966,2023-09-04 18:47:28.526479,0 days 00:00:01.075513,ReLU,ReLU,ReLU,ReLU,57,23,8.0,7.0,19.0,0.0011203434206368873,4,86,0.25818874482162935,0.0005428991724355302,119.60019883655366,COMPLETE
375,0.46593204140663147,2023-09-04 18:47:28.526940,2023-09-04 18:47:29.604382,0 days 00:00:01.077442,ReLU,ReLU,ReLU,,64,24,8.0,9.0,,0.00042031692264830667,3,251,0.12389852643828243,0.00042940186565771537,127.11055722120332,COMPLETE
376,0.4213593006134033,2023-09-04 18:47:29.604814,2023-09-04 18:47:34.777768,0 days 00:00:05.172954,ReLU,ReLU,ReLU,Tanh,52,24,4.0,11.0,16.0,0.0002947687377292972,4,464,0.23154778398790019,0.0012566631260001052,103.29189107481871,COMPLETE
377,0.3333198130130768,2023-09-04 18:47:34.778223,2023-09-04 18:47:37.243554,0 days 00:00:02.465331,ReLU,ReLU,ReLU,Tanh,47,23,6.0,8.0,14.0,0.0015423321164882854,4,237,0.7071526749381782,0.0007072347913647082,92.4678190946579,COMPLETE
378,0.2561103105545044,2023-09-04 18:47:37.243970,2023-09-04 18:47:41.688481,0 days 00:00:04.444511,ReLU,ReLU,ReLU,ReLU,61,24,5.0,10.0,18.0,0.0004727023589436474,4,260,0.7953335820773338,0.0010048703855982876,97.71268994690942,COMPLETE
379,0.3152715265750885,2023-09-04 18:47:41.688829,2023-09-04 18:47:45.442388,0 days 00:00:03.753559,ReLU,ReLU,Tanh,ReLU,45,24,6.0,8.0,18.0,0.0005201179825735662,4,281,0.7892778980897084,0.0010269561346036634,108.36916060674758,COMPLETE
