number,value,datetime_start,datetime_complete,duration,params_activation1,params_activation2,params_activation3,params_activation4,params_batch_size,params_fl1,params_fl2,params_fl3,params_fl4,params_learning_rate,params_n_layers,params_num_epochs,params_train_size,params_weight_decay,user_attrs_mre,state
458,0.3345986306667328,2023-09-04 18:16:47.828135,2023-09-04 18:16:48.715306,0 days 00:00:00.887171,ReLU,Leaky,Leaky,ReLU,78,19,20.0,22.0,9.0,0.002170565995470055,4,369,0.32518136436972966,0.006626425486566234,123.40432380907464,COMPLETE
459,0.3250424265861511,2023-09-04 18:16:48.715652,2023-09-04 18:16:54.538257,0 days 00:00:05.822605,Leaky,ReLU,Leaky,ReLU,52,20,21.0,13.0,10.0,0.0004717025533043605,4,380,0.7722805599479412,0.0010656349935074824,91.61727994721511,COMPLETE
460,0.328441858291626,2023-09-04 18:16:54.538603,2023-09-04 18:16:57.093970,0 days 00:00:02.555367,ReLU,Tanh,Tanh,ReLU,80,19,20.0,15.0,13.0,0.0012634688267674178,4,391,0.7392331862486912,0.0007202825610444978,91.01729480871994,COMPLETE
461,0.2989051342010498,2023-09-04 18:16:57.094320,2023-09-04 18:16:58.273300,0 days 00:00:01.178980,ReLU,Leaky,Leaky,Sigmoid,64,20,21.0,10.0,11.0,0.0033365673590066724,4,401,0.7111959540538676,0.0008590352198526869,103.6059267255995,COMPLETE
462,0.33581918478012085,2023-09-04 18:16:58.273665,2023-09-04 18:16:59.496624,0 days 00:00:01.222959,Leaky,Sigmoid,Leaky,ReLU,61,18,16.0,11.0,12.0,0.00250463511393807,4,406,0.33591241959610046,4.431257782601782e-05,105.79342829038019,COMPLETE
463,0.30467864871025085,2023-09-04 18:16:59.496983,2023-09-04 18:17:03.196906,0 days 00:00:03.699923,ReLU,Tanh,Tanh,ReLU,55,21,13.0,8.0,9.0,0.001077396469047899,4,387,0.7993069135964539,0.0018814159264005886,91.1233884933147,COMPLETE
464,0.3354712724685669,2023-09-04 18:17:03.197323,2023-09-04 18:17:03.857328,0 days 00:00:00.660005,Tanh,Leaky,Leaky,ReLU,79,17,16.0,9.0,10.0,0.004031759235643217,4,414,0.2742292064036374,3.258174996165165e-05,123.75141518332741,COMPLETE
465,0.3416922390460968,2023-09-04 18:17:03.857695,2023-09-04 18:17:06.332724,0 days 00:00:02.475029,ReLU,Tanh,Leaky,ReLU,77,13,22.0,11.0,8.0,0.0014852240953653207,4,302,0.7438853724580055,0.0005052742387192836,99.15795611213235,COMPLETE
466,0.34684324264526367,2023-09-04 18:17:06.333091,2023-09-04 18:17:07.286789,0 days 00:00:00.953698,ReLU,Leaky,Leaky,ReLU,57,20,21.0,3.0,11.0,0.0018092296302046759,4,398,0.21791127202434663,0.001559787463838963,128.07037511686,COMPLETE
467,0.31875693798065186,2023-09-04 18:17:07.287144,2023-09-04 18:17:08.779306,0 days 00:00:01.492162,Leaky,Tanh,Tanh,ReLU,68,21,15.0,12.0,12.0,0.0031331045473043085,4,286,0.415666579222577,0.0006430136483091981,121.76627898797756,COMPLETE
468,0.33322471380233765,2023-09-04 18:17:08.779663,2023-09-04 18:17:09.579688,0 days 00:00:00.800025,ReLU,Leaky,Leaky,ReLU,80,20,14.0,10.0,10.0,0.0022717090329798756,4,411,0.2944114239422651,7.02704869814134e-05,104.11239219434333,COMPLETE
469,0.313101589679718,2023-09-04 18:17:09.580057,2023-09-04 18:17:10.969605,0 days 00:00:01.389548,ReLU,ReLU,Leaky,Leaky,82,21,18.0,7.0,11.0,0.0014272687114641385,4,401,0.7052307344473429,9.13456653996789e-05,111.8399216578557,COMPLETE
470,0.2734536826610565,2023-09-04 18:17:10.969971,2023-09-04 18:17:13.984757,0 days 00:00:03.014786,Tanh,Tanh,Tanh,ReLU,84,19,16.0,13.0,12.0,0.0018923632916820143,4,316,0.7765199667471143,0.0011194596073210257,94.60186500919676,COMPLETE
471,0.3458555042743683,2023-09-04 18:17:13.985094,2023-09-04 18:17:18.755941,0 days 00:00:04.770847,Tanh,Tanh,Tanh,ReLU,32,18,19.0,13.0,13.0,0.001921740873028784,4,323,0.7718197711691838,0.0009964305393607117,92.71572956285979,COMPLETE
472,0.3279423117637634,2023-09-04 18:17:18.756296,2023-09-04 18:17:23.220473,0 days 00:00:04.464177,Tanh,Tanh,Tanh,ReLU,84,19,11.0,13.0,12.0,0.0011665236594057982,4,318,0.5826991005387022,0.0048776138639082395,111.89941596984863,COMPLETE
473,0.29746150970458984,2023-09-04 18:17:23.220819,2023-09-04 18:17:25.800577,0 days 00:00:02.579758,Tanh,Tanh,Tanh,ReLU,81,18,17.0,14.0,7.0,0.001928787754647958,4,335,0.6429721991686457,0.0008278760727308619,94.17554481356751,COMPLETE
474,0.34293124079704285,2023-09-04 18:17:25.800920,2023-09-04 18:17:28.088747,0 days 00:00:02.287827,Tanh,Tanh,Tanh,ReLU,83,19,3.0,13.0,13.0,0.0016735062567695995,4,310,0.7416274017621977,0.0006962428032066259,108.67258267789273,COMPLETE
475,0.3152107000350952,2023-09-04 18:17:28.089097,2023-09-04 18:17:31.362960,0 days 00:00:03.273863,Tanh,Tanh,Tanh,ReLU,76,17,22.0,14.0,14.0,0.001336848223075368,4,260,0.6941461410470502,0.0011735674265722072,109.97514709472657,COMPLETE
476,0.3057291507720947,2023-09-04 18:17:31.363562,2023-09-04 18:17:33.826337,0 days 00:00:02.462775,Tanh,Tanh,Tanh,ReLU,59,24,15.0,13.0,12.0,0.0024672563637091766,4,419,0.7998626624770322,0.0009935703906950259,95.28972612108502,COMPLETE
477,0.328938364982605,2023-09-04 18:17:33.826698,2023-09-04 18:17:40.967382,0 days 00:00:07.140684,Tanh,Tanh,Tanh,ReLU,79,19,16.0,12.0,9.0,0.001555592156714518,4,344,0.7690371887002382,0.007796986992522248,100.99463807819971,COMPLETE
478,0.3101955056190491,2023-09-04 18:17:40.967734,2023-09-04 18:17:47.602168,0 days 00:00:06.634434,Tanh,Tanh,Tanh,ReLU,51,18,24.0,9.0,12.0,0.0007261212700244236,4,381,0.7160833581969634,0.0004938103798879167,97.19590235080848,COMPLETE
479,0.348941832780838,2023-09-04 18:17:47.602513,2023-09-04 18:17:54.595233,0 days 00:00:06.992720,Tanh,Sigmoid,Tanh,ReLU,73,22,20.0,13.0,11.0,0.0006147610188611681,4,407,0.7408834525988902,7.949117801068668e-05,107.84042953622752,COMPLETE
480,0.3109423518180847,2023-09-04 18:17:54.595583,2023-09-04 18:17:57.667739,0 days 00:00:03.072156,Leaky,Tanh,ReLU,Tanh,62,19,18.0,12.0,8.0,0.002185672674765547,4,391,0.6790142013668702,0.0008107237243367689,137.09572173138054,COMPLETE
481,0.38625678420066833,2023-09-04 18:17:57.668095,2023-09-04 18:17:58.661434,0 days 00:00:00.993339,Leaky,Tanh,Tanh,ReLU,85,23,21.0,14.0,10.0,0.0011136445102957124,4,423,0.264492287531033,0.0011739592828110797,103.8721421983507,COMPLETE
482,0.3667052388191223,2023-09-04 18:17:58.661799,2023-09-04 18:17:59.816938,0 days 00:00:01.155139,Tanh,Tanh,Tanh,,81,21,15.0,12.0,,0.002864245638217421,3,364,0.6189083097204003,0.003195324751872605,109.93970192803278,COMPLETE
483,0.331211119890213,2023-09-04 18:17:59.817309,2023-09-04 18:18:03.926912,0 days 00:00:04.109603,Sigmoid,ReLU,Leaky,ReLU,54,18,17.0,13.0,12.0,0.0015772779682776581,4,331,0.7713166159920514,0.0006272846276849873,134.4072716382085,COMPLETE
484,0.4966959059238434,2023-09-04 18:18:03.927272,2023-09-04 18:18:05.470657,0 days 00:00:01.543385,Leaky,Tanh,Tanh,Sigmoid,83,19,16.0,10.0,13.0,0.001986393415432032,4,319,0.7996975896129426,0.0003629754564632772,158.12362820494408,COMPLETE
485,0.3513783812522888,2023-09-04 18:18:05.471020,2023-09-04 18:18:23.691670,0 days 00:00:18.220650,Tanh,Sigmoid,Sigmoid,Leaky,12,21,22.0,11.0,9.0,0.0008924647449184561,4,438,0.4579585044948199,0.0009136473321155631,113.86601257324219,COMPLETE
486,0.35695603489875793,2023-09-04 18:18:23.692061,2023-09-04 18:18:26.108583,0 days 00:00:02.416522,ReLU,Tanh,Leaky,ReLU,56,12,24.0,19.0,10.0,0.002504690100094698,4,414,0.7263106499370849,0.00010834913337598677,87.47306436567165,COMPLETE
487,0.4205982983112335,2023-09-04 18:18:26.109059,2023-09-04 18:18:26.900126,0 days 00:00:00.791067,Leaky,Tanh,Leaky,ReLU,65,20,15.0,8.0,11.0,0.0012917624707326097,4,427,0.17031991618464226,0.001338036122413203,116.80602811730427,COMPLETE
488,0.30801713466644287,2023-09-04 18:18:26.900587,2023-09-04 18:18:30.854761,0 days 00:00:03.954174,ReLU,ReLU,Leaky,ReLU,43,22,14.0,12.0,12.0,0.0017451429422544052,4,402,0.7504141643099423,0.005342254137303919,103.99459054436483,COMPLETE
489,0.3629852831363678,2023-09-04 18:18:30.855140,2023-09-04 18:18:31.682719,0 days 00:00:00.827579,ReLU,Tanh,Tanh,ReLU,80,23,22.0,9.0,10.0,0.0021693859611478994,4,436,0.2385125039247625,0.0007567873365403468,106.83091622811777,COMPLETE
490,0.34445568919181824,2023-09-04 18:18:31.683073,2023-09-04 18:18:35.914286,0 days 00:00:04.231213,Tanh,Tanh,Leaky,ReLU,78,21,24.0,16.0,11.0,0.0010408685760817822,4,395,0.4037761071718506,0.0036502534490563997,94.07473058770172,COMPLETE
491,0.4419611096382141,2023-09-04 18:18:35.914667,2023-09-04 18:18:41.545477,0 days 00:00:05.630810,ReLU,Sigmoid,Leaky,ReLU,82,22,16.0,11.0,12.0,0.0003444767025748868,4,413,0.34314872951039643,0.000578635257980687,121.74720535093589,COMPLETE
492,0.3231101632118225,2023-09-04 18:18:41.545834,2023-09-04 18:18:42.677270,0 days 00:00:01.131436,Leaky,Tanh,Tanh,ReLU,85,20,23.0,12.0,11.0,0.006092954879149217,4,456,0.6467642857747642,0.00042872849288836025,96.43184744793436,COMPLETE
493,0.4046941101551056,2023-09-04 18:18:42.677633,2023-09-04 18:18:43.889058,0 days 00:00:01.211425,ReLU,Leaky,Leaky,ReLU,58,19,19.0,14.0,9.0,0.0005309834081474619,4,159,0.14690483148360262,2.528546449294878e-05,153.06011180757727,COMPLETE
494,0.3398362994194031,2023-09-04 18:18:43.889425,2023-09-04 18:18:47.093271,0 days 00:00:03.203846,ReLU,Tanh,Leaky,ReLU,84,21,23.0,13.0,10.0,0.0008030924389195481,4,424,0.7140547133026117,0.00013776423667690859,106.00472423458888,COMPLETE
495,0.4317776560783386,2023-09-04 18:18:47.093622,2023-09-04 18:18:50.354197,0 days 00:00:03.260575,ReLU,Leaky,Tanh,ReLU,75,22,17.0,10.0,13.0,8.591560619511309e-05,4,238,0.27791907247001296,0.002171409977431038,119.64671338506106,COMPLETE
496,0.35448774695396423,2023-09-04 18:18:50.354841,2023-09-04 18:18:58.409674,0 days 00:00:08.054833,Tanh,ReLU,Leaky,ReLU,69,23,16.0,11.0,14.0,0.00022887475920943434,4,404,0.6937852813207367,0.0010258920066880943,100.22174795804449,COMPLETE
497,0.341693252325058,2023-09-04 18:18:58.410037,2023-09-04 18:19:00.798170,0 days 00:00:02.388133,Leaky,Tanh,ReLU,Leaky,80,20,20.0,9.0,11.0,0.0027440952879269026,4,269,0.557512865370756,0.0013383598625647509,93.61748046875,COMPLETE
498,0.3351818025112152,2023-09-04 18:19:00.798528,2023-09-04 18:19:03.130635,0 days 00:00:02.332107,ReLU,Leaky,Leaky,ReLU,54,18,23.0,12.0,10.0,0.0013710342964177408,4,420,0.7720340160450402,0.00029252308061467096,112.78133444352584,COMPLETE
499,0.3128790557384491,2023-09-04 18:19:03.130987,2023-09-04 18:19:05.220526,0 days 00:00:02.089539,ReLU,Sigmoid,Tanh,ReLU,86,21,15.0,10.0,12.0,0.003901639728552175,4,446,0.6635969266365543,6.0295266260838096e-05,101.20405931472779,COMPLETE
