number,value,datetime_start,datetime_complete,duration,params_activation1,params_activation2,params_activation3,params_activation4,params_batch_size,params_fl1,params_fl2,params_fl3,params_fl4,params_learning_rate,params_n_layers,params_num_epochs,params_train_size,params_weight_decay,user_attrs_mre,state
1534,0.2709790766239166,2023-09-04 22:32:14.947721,2023-09-04 22:32:16.870927,0 days 00:00:01.923206,Leaky,Sigmoid,Tanh,,22,16,4.0,4.0,,0.0031449839674025054,3,237,0.7681303669569488,0.00012178845366811775,103.97775468092698,COMPLETE
1535,0.2896178066730499,2023-09-04 22:32:16.871428,2023-09-04 22:32:17.759074,0 days 00:00:00.887646,Leaky,,,,26,15,,,,0.0034669623284873706,1,231,0.7732186749163312,4.348128743400776e-05,93.34326411228554,COMPLETE
1536,1.092547059059143,2023-09-04 22:32:17.759549,2023-09-04 22:32:18.851209,0 days 00:00:01.091660,Leaky,Sigmoid,Tanh,,25,16,4.0,1.0,,4.61479878255372e-05,3,221,0.12531659136538123,0.0016018179426747312,185.29501632759474,COMPLETE
1537,0.25673550367355347,2023-09-04 22:32:18.851735,2023-09-04 22:32:21.131368,0 days 00:00:02.279633,Leaky,Sigmoid,,,21,15,3.0,,,0.004041271206826211,2,209,0.7992179647722963,0.00012428688450987993,79.57369578968395,COMPLETE
1538,0.3478712737560272,2023-09-04 22:32:21.131876,2023-09-04 22:32:22.312056,0 days 00:00:01.180180,Leaky,Sigmoid,,,22,16,3.0,,,0.0035978469622616293,2,197,0.5528676461692632,0.00013421473026080873,104.26514066060385,COMPLETE
1539,0.3384561240673065,2023-09-04 22:32:22.312655,2023-09-04 22:32:23.146225,0 days 00:00:00.833570,Leaky,Sigmoid,,,22,15,3.0,,,0.004106509949717466,2,211,0.46457806773309185,0.0001162161209125685,128.44185594411996,COMPLETE
1540,0.31297630071640015,2023-09-04 22:32:23.146729,2023-09-04 22:32:25.721043,0 days 00:00:02.574314,Leaky,Sigmoid,Tanh,,22,15,3.0,3.0,,0.0028956116432686707,3,206,0.7720966091126463,9.900734041111668e-05,113.27469248453777,COMPLETE
1541,0.35433465242385864,2023-09-04 22:32:25.721551,2023-09-04 22:32:26.411507,0 days 00:00:00.689956,Leaky,,,,22,15,,,,0.0044774946656745964,1,206,0.7726226175246468,0.03806325837443231,91.60479927062988,COMPLETE
1542,0.3661706745624542,2023-09-04 22:32:26.412082,2023-09-04 22:32:27.154997,0 days 00:00:00.742915,Leaky,Sigmoid,,,20,17,2.0,,,0.0032509094651157373,2,190,0.32251645528664397,0.0001297190209686931,127.70079870391311,COMPLETE
1543,0.3119586408138275,2023-09-04 22:32:27.155490,2023-09-04 22:32:29.126830,0 days 00:00:01.971340,Leaky,Sigmoid,,,23,16,2.0,,,0.0038088104605213144,2,211,0.7968328089933634,8.793663022393258e-05,103.42620763778686,COMPLETE
1544,0.3865986466407776,2023-09-04 22:32:29.127326,2023-09-04 22:32:29.643261,0 days 00:00:00.515935,Leaky,Sigmoid,Tanh,,24,15,2.0,4.0,,0.004272854042625304,3,197,0.19338600162764408,0.00015240762448946848,256.86894011915774,COMPLETE
1545,0.356477826833725,2023-09-04 22:32:29.643846,2023-09-04 22:32:30.836197,0 days 00:00:01.192351,Leaky,Sigmoid,,,25,15,3.0,,,0.0036606384839509088,2,216,0.7473370765350825,0.00019913569386344836,121.6178955377317,COMPLETE
1546,0.32965415716171265,2023-09-04 22:32:30.836683,2023-09-04 22:32:33.895240,0 days 00:00:03.058557,Sigmoid,,,,20,15,,,,0.0028349157595320036,1,216,0.7465592793117238,0.0001048924102336432,107.95512925185166,COMPLETE
1547,0.38231730461120605,2023-09-04 22:32:33.895739,2023-09-04 22:32:34.526847,0 days 00:00:00.631108,Leaky,Sigmoid,,,22,16,3.0,,,0.004793817912183018,2,226,0.23925867541084217,0.00018441201582683196,110.61356948403751,COMPLETE
1548,0.31842270493507385,2023-09-04 22:32:34.527338,2023-09-04 22:32:35.409981,0 days 00:00:00.882643,Leaky,Sigmoid,Tanh,,24,14,3.0,4.0,,0.004432058502250506,3,205,0.5703907999729428,0.00013239156516063185,103.11536231407753,COMPLETE
1549,0.41679200530052185,2023-09-04 22:32:35.410483,2023-09-04 22:32:36.004263,0 days 00:00:00.593780,Leaky,Sigmoid,,,21,16,1.0,,,0.003540634968671901,2,216,0.14252939510921794,0.0001503639365022365,124.15755277467005,COMPLETE
1550,0.3079632818698883,2023-09-04 22:32:36.004735,2023-09-04 22:32:38.026281,0 days 00:00:02.021546,Leaky,Sigmoid,,,19,15,3.0,,,0.005288786014492485,2,225,0.7995444268942486,0.0001029260180401114,112.44803200305348,COMPLETE
1551,0.37899675965309143,2023-09-04 22:32:38.026758,2023-09-04 22:32:38.812491,0 days 00:00:00.785733,Leaky,Sigmoid,Tanh,,27,15,3.0,2.0,,0.003183130436741354,3,190,0.7989567582745517,0.04723170975342628,96.334676389341,COMPLETE
1552,0.2969004809856415,2023-09-04 22:32:38.813021,2023-09-04 22:32:39.860728,0 days 00:00:01.047707,Leaky,Sigmoid,,,24,16,4.0,,,0.003042321251965052,2,202,0.7999234934242763,7.585628958252002e-05,92.27624148414249,COMPLETE
1553,0.3304014205932617,2023-09-04 22:32:39.861227,2023-09-04 22:32:40.442409,0 days 00:00:00.581182,Leaky,,,,20,14,,,,0.004838794504767689,1,451,0.6505296336811961,0.00012212187859295608,129.79424387613932,COMPLETE
1554,0.30080121755599976,2023-09-04 22:32:40.442910,2023-09-04 22:32:41.713971,0 days 00:00:01.271061,Leaky,Sigmoid,,,23,14,4.0,,,0.005708382029742159,2,210,0.7267090794102348,0.00017520962547431574,112.45201696668353,COMPLETE
1555,0.3840722441673279,2023-09-04 22:32:41.714595,2023-09-04 22:32:42.486572,0 days 00:00:00.771977,Leaky,Sigmoid,Tanh,,21,15,2.0,5.0,,0.002460050666713881,3,220,0.23614483056356408,9.053889748730072e-05,146.43627787998744,COMPLETE
1556,0.3366318643093109,2023-09-04 22:32:42.487072,2023-09-04 22:32:43.163920,0 days 00:00:00.676848,Leaky,Sigmoid,,,26,16,4.0,,,0.003936279210393043,2,216,0.3478340912075563,0.00024895443258086714,108.81796417236328,COMPLETE
1557,0.288643479347229,2023-09-04 22:32:43.164411,2023-09-04 22:32:47.520721,0 days 00:00:04.356310,Leaky,Sigmoid,,,19,16,4.0,,,0.0010389423225048726,2,237,0.756744570931562,0.000750712224068927,86.26530410304214,COMPLETE
1558,0.885881781578064,2023-09-04 22:32:47.521247,2023-09-04 22:32:50.522784,0 days 00:00:03.001537,Leaky,Sigmoid,Tanh,,22,15,3.0,3.0,,3.410137190525452e-05,3,184,0.4233269565488703,0.009836216860885176,101.53486376223357,COMPLETE
1559,0.9682422280311584,2023-09-04 22:32:50.523298,2023-09-04 22:32:56.295897,0 days 00:00:05.772599,Leaky,Sigmoid,,,19,15,2.0,,,2.8746705392476034e-05,2,229,0.7053914266223882,0.06769116905413601,191.07181748969066,COMPLETE
1560,0.34112951159477234,2023-09-04 22:32:56.296458,2023-09-04 22:32:57.189205,0 days 00:00:00.892747,Leaky,,,,21,14,,,,0.0021313964691614005,1,224,0.48738437466943746,0.00011820151538698153,110.3880342425722,COMPLETE
1561,0.3863283097743988,2023-09-04 22:32:57.189682,2023-09-04 22:32:57.839811,0 days 00:00:00.650129,Leaky,Sigmoid,,,24,15,3.0,,,0.005526141346675971,2,199,0.2549547018706672,0.00015376613077354505,120.59218554429604,COMPLETE
1562,0.31617462635040283,2023-09-04 22:32:57.840297,2023-09-04 22:33:00.572453,0 days 00:00:02.732156,Leaky,Sigmoid,Tanh,,19,14,3.0,5.0,,0.004415681319216605,3,169,0.7671052908493159,6.938976889097713e-05,93.42193873335675,COMPLETE
1563,0.37298348546028137,2023-09-04 22:33:00.572982,2023-09-04 22:33:02.875646,0 days 00:00:02.302664,Leaky,Sigmoid,,,25,15,2.0,,,0.0031806173224394386,2,234,0.6769147289248139,0.000211520714085424,151.77355264027912,COMPLETE
1564,0.3662679195404053,2023-09-04 22:33:02.876132,2023-09-04 22:33:03.476254,0 days 00:00:00.600122,Leaky,Sigmoid,,,23,16,4.0,,,0.005878517994040447,2,209,0.38988802416894064,0.00032801570455235284,108.89431526547386,COMPLETE
1565,0.38311395049095154,2023-09-04 22:33:03.476756,2023-09-04 22:33:03.773125,0 days 00:00:00.296369,Leaky,,,,18,14,,,,0.0037149559202181268,1,218,0.10986040454191533,0.0005995007596142397,240.52861328125,COMPLETE
1566,0.5289180874824524,2023-09-04 22:33:03.773617,2023-09-04 22:33:04.130149,0 days 00:00:00.356532,Leaky,Sigmoid,,,20,17,4.0,,,0.002776014970722923,2,229,0.1230974541922075,1.3644099271975817e-05,128.977815083095,COMPLETE
1567,0.3768480718135834,2023-09-04 22:33:04.130654,2023-09-04 22:33:04.626283,0 days 00:00:00.495629,Leaky,Sigmoid,Tanh,,21,15,4.0,6.0,,0.006962011229326482,3,175,0.19381362803005373,0.02716992268921261,486.68471251142785,COMPLETE
1568,0.36912477016448975,2023-09-04 22:33:04.626812,2023-09-04 22:33:04.993752,0 days 00:00:00.366940,Leaky,Sigmoid,,,23,14,3.0,,,0.0069562870010099415,2,238,0.17966019249211995,0.0032917525089997453,1573.6078828852228,COMPLETE
1569,0.38638952374458313,2023-09-04 22:33:04.994268,2023-09-04 22:33:07.627459,0 days 00:00:02.633191,Leaky,,,,18,16,,,,6.176375711572489e-05,1,209,0.4335431302361136,0.013398547414165825,113.92802597118907,COMPLETE
1570,0.35304227471351624,2023-09-04 22:33:07.627926,2023-09-04 22:33:08.645127,0 days 00:00:01.017201,Leaky,Sigmoid,,,18,14,4.0,,,0.005299158164271246,2,407,0.7297040375535278,0.0056482584493729665,114.78638850620814,COMPLETE
1571,0.3751463294029236,2023-09-04 22:33:08.645658,2023-09-04 22:33:09.077028,0 days 00:00:00.431370,Leaky,Sigmoid,Tanh,,21,15,3.0,20.0,,0.00361460052316282,3,219,0.22652499453698388,5.570968593237992e-05,123.63716798670151,COMPLETE
1572,0.35871410369873047,2023-09-04 22:33:09.077564,2023-09-04 22:33:09.818439,0 days 00:00:00.740875,Leaky,Sigmoid,,,16,14,4.0,,,0.005185101083648954,2,161,0.21164264714650313,0.001044511629852638,127.73102736799684,COMPLETE
1573,0.34668993949890137,2023-09-04 22:33:09.818933,2023-09-04 22:33:11.216481,0 days 00:00:01.397548,Leaky,Sigmoid,,,26,15,2.0,,,0.004672764094847345,2,198,0.7681165148954249,0.001898843791918392,118.84181162516276,COMPLETE
1574,0.34999945759773254,2023-09-04 22:33:11.216970,2023-09-04 22:33:12.432414,0 days 00:00:01.215444,Leaky,,,,21,15,,,,0.0031796466486730857,1,149,0.733105948837294,0.0001806709638366428,97.86555432516431,COMPLETE
1575,0.45237064361572266,2023-09-04 22:33:12.432894,2023-09-04 22:33:18.133892,0 days 00:00:05.700998,Leaky,Sigmoid,Tanh,,23,16,3.0,2.0,,0.00010738467192623056,3,226,0.6998351334813901,0.04176119887075675,108.91068514258461,COMPLETE
1576,0.37196090817451477,2023-09-04 22:33:18.134404,2023-09-04 22:33:20.069232,0 days 00:00:01.934828,Leaky,Sigmoid,,,17,14,1.0,,,0.0023015129688897513,2,235,0.2944754312444424,1.2320433430149846e-05,109.63690802491742,COMPLETE
1577,0.41749024391174316,2023-09-04 22:33:20.069733,2023-09-04 22:33:21.034491,0 days 00:00:00.964758,Leaky,Sigmoid,,,20,15,4.0,,,0.007854280044794954,2,216,0.6020821652812495,0.03974059519165389,111.14337569016676,COMPLETE
1578,0.3478286862373352,2023-09-04 22:33:21.035348,2023-09-04 22:33:22.535885,0 days 00:00:01.500537,Leaky,Sigmoid,,,19,16,4.0,,,0.0612851421349647,2,184,0.7647767625040883,0.00011909516897085044,108.57642059326172,COMPLETE
1579,0.35292038321495056,2023-09-04 22:33:22.536353,2023-09-04 22:33:23.154041,0 days 00:00:00.617688,Leaky,,,,22,17,,,,0.00221252785451003,1,156,0.3154152428951361,9.477928328357997e-05,102.09007538689508,COMPLETE
1580,0.3099701702594757,2023-09-04 22:33:23.154513,2023-09-04 22:33:24.145886,0 days 00:00:00.991373,Leaky,Sigmoid,Tanh,,24,14,4.0,19.0,,0.006082296412721671,3,244,0.7988270949943395,7.602450700042189e-05,100.96397467220531,COMPLETE
1581,0.3704703450202942,2023-09-04 22:33:24.146392,2023-09-04 22:33:28.951929,0 days 00:00:04.805537,Leaky,Sigmoid,,,17,16,3.0,,,0.0003897406888278391,2,206,0.6431145111153769,0.00015987998320561125,149.1578096926791,COMPLETE
1582,0.32997196912765503,2023-09-04 22:33:28.952385,2023-09-04 22:33:30.580579,0 days 00:00:01.628194,Leaky,Sigmoid,,,21,15,3.0,,,0.0024939559126438272,2,223,0.7458746599921642,0.002673815828097106,119.05455669458361,COMPLETE
1583,0.32729044556617737,2023-09-04 22:33:30.581054,2023-09-04 22:33:32.269025,0 days 00:00:01.687971,Leaky,Sigmoid,Tanh,,18,13,4.0,1.0,,0.05045425129400314,3,230,0.6677319129333961,0.00038723863756243273,133.9717917191355,COMPLETE
1584,0.33746686577796936,2023-09-04 22:33:32.269551,2023-09-04 22:33:34.818282,0 days 00:00:02.548731,Leaky,Sigmoid,,,14,14,4.0,,,0.00123761888242521,2,127,0.7168238733085825,1.554002077559118e-05,117.37413668942142,COMPLETE
1585,0.34443455934524536,2023-09-04 22:33:34.818770,2023-09-04 22:33:35.405267,0 days 00:00:00.586497,Leaky,,,,28,15,,,,0.004410201704875068,1,194,0.40515532966310097,0.00012761768232182007,122.52783486150926,COMPLETE
1586,0.3605075478553772,2023-09-04 22:33:35.405779,2023-09-04 22:33:36.143813,0 days 00:00:00.738034,Leaky,Sigmoid,,,25,15,11.0,,,0.07536188785682402,2,169,0.7665416743823075,0.0008202837821612561,103.37540334065756,COMPLETE
1587,0.34274953603744507,2023-09-04 22:33:36.144358,2023-09-04 22:33:36.955984,0 days 00:00:00.811626,Leaky,Sigmoid,Tanh,,20,16,5.0,4.0,,0.006895676521986976,3,208,0.27995083897348544,1.901597098135667e-05,124.77572606404622,COMPLETE
1588,0.2877340018749237,2023-09-04 22:33:36.956531,2023-09-04 22:33:38.183231,0 days 00:00:01.226700,Leaky,Sigmoid,,,23,15,2.0,,,0.0085157156118094,2,239,0.7996557735005956,5.573681226942699e-05,93.41403134663899,COMPLETE
1589,0.28546321392059326,2023-09-04 22:33:38.183772,2023-09-04 22:33:40.287744,0 days 00:00:02.103972,Leaky,Sigmoid,,,15,14,24.0,,,0.0032421966597353242,2,118,0.7414005526156738,0.00046043220046456204,98.01596520163797,COMPLETE
1590,0.32544010877609253,2023-09-04 22:33:40.288251,2023-09-04 22:33:42.906287,0 days 00:00:02.618036,Sigmoid,Sigmoid,Tanh,,19,15,9.0,8.0,,0.003956708144567513,3,215,0.6951152728779856,0.00010500421593604084,108.93011121852423,COMPLETE
1591,0.6098623871803284,2023-09-04 22:33:42.906807,2023-09-04 22:33:44.496613,0 days 00:00:01.589806,Leaky,Sigmoid,,,71,13,4.0,,,7.313116039650808e-05,2,225,0.540518372914551,0.0002858997010025819,95.30232771131728,COMPLETE
1592,0.47957196831703186,2023-09-04 22:33:44.497101,2023-09-04 22:33:45.077879,0 days 00:00:00.580778,Leaky,Sigmoid,Tanh,Sigmoid,16,16,5.0,4.0,1.0,0.04584778349877205,4,158,0.25817938849598965,8.2469504052845e-05,137.85350405785346,COMPLETE
1593,0.45648401975631714,2023-09-04 22:33:45.078363,2023-09-04 22:33:45.541486,0 days 00:00:00.463123,Sigmoid,,,,22,16,,,,0.010008055577466937,1,139,0.7691236893315537,0.0368321474433618,122.53701088645242,COMPLETE
1594,0.3752569556236267,2023-09-04 22:33:45.541945,2023-09-04 22:33:48.822864,0 days 00:00:03.280919,Leaky,Sigmoid,,,17,15,3.0,,,0.000938068233197608,2,202,0.32601880624896407,0.004309589098580237,115.29694234262598,COMPLETE
1595,0.4039715528488159,2023-09-04 22:33:48.823780,2023-09-04 22:33:52.612795,0 days 00:00:03.789015,Tanh,Sigmoid,Tanh,,27,14,3.0,7.0,,0.0006710762452483419,3,107,0.7192971410925553,0.0013758574852633415,113.73215092454001,COMPLETE
1596,0.8905206322669983,2023-09-04 22:33:52.613273,2023-09-04 22:33:54.687431,0 days 00:00:02.074158,Tanh,Sigmoid,,,10,17,5.0,,,3.168725712045595e-05,2,148,0.10354498881040121,0.00014335411562563615,102.41894845704775,COMPLETE
1597,0.36679571866989136,2023-09-04 22:33:54.687898,2023-09-04 22:33:55.096373,0 days 00:00:00.408475,Leaky,,,,75,15,,,,0.0059153420360607695,1,426,0.3565443352200749,4.787947185367024e-05,112.53091012863885,COMPLETE
1598,0.3957340717315674,2023-09-04 22:33:55.096909,2023-09-04 22:33:59.648004,0 days 00:00:04.551095,Tanh,Sigmoid,,,29,13,2.0,,,0.000274095994513093,2,231,0.7466267152346842,0.0002211547587012035,122.42694326293417,COMPLETE
1599,0.4225066602230072,2023-09-04 22:33:59.648514,2023-09-04 22:34:00.499368,0 days 00:00:00.850854,Sigmoid,Sigmoid,Tanh,,34,15,2.0,11.0,,0.01997909305890297,3,247,0.7998397071523884,0.0040915647055825574,143.67903797046557,COMPLETE
1600,0.3804768919944763,2023-09-04 22:34:00.499866,2023-09-04 22:34:01.717521,0 days 00:00:01.217655,Tanh,Leaky,,,19,18,5.0,,,0.0014630673238239555,2,214,0.2053772252564799,0.007483797397028659,104.23197174072266,COMPLETE
1601,0.3717612326145172,2023-09-04 22:34:01.718030,2023-09-04 22:34:05.213803,0 days 00:00:03.495773,Tanh,Sigmoid,Tanh,,12,16,3.0,5.0,,0.0019153717093189169,3,183,0.44594049361942173,0.0001909206597364615,164.1747882596908,COMPLETE
1602,0.3795003890991211,2023-09-04 22:34:05.214479,2023-09-04 22:34:05.553050,0 days 00:00:00.338571,Tanh,,,,36,14,,,,0.024763469415554233,1,220,0.45972691628686224,6.236798131025703e-05,136.79740973079905,COMPLETE
1603,0.36059868335723877,2023-09-04 22:34:05.553591,2023-09-04 22:34:13.983677,0 days 00:00:08.430086,Tanh,Sigmoid,,,22,14,4.0,,,0.00045914458983907275,2,193,0.47885165780327954,4.2577492517038474e-05,260.0638637641551,COMPLETE
1604,0.4481080174446106,2023-09-04 22:34:13.984626,2023-09-04 22:34:18.238051,0 days 00:00:04.253425,Leaky,Sigmoid,,,15,17,14.0,,,0.002925035723952145,2,129,0.36781162673282125,0.05911173838579716,116.7906363476282,COMPLETE
1605,0.5536854267120361,2023-09-04 22:34:18.238989,2023-09-04 22:34:20.974547,0 days 00:00:02.735558,Tanh,Sigmoid,Tanh,Sigmoid,25,14,23.0,9.0,2.0,0.0005730567806630589,4,101,0.1994111068752787,0.0028863430740784283,124.43190115749246,COMPLETE
1606,0.3826100528240204,2023-09-04 22:34:20.975506,2023-09-04 22:34:36.583324,0 days 00:00:15.607818,Tanh,Sigmoid,,,20,16,10.0,,,0.00015909036910011475,2,236,0.6728403365982654,3.490569168550343e-05,101.12979488049524,COMPLETE
1607,0.8024342060089111,2023-09-04 22:34:36.584248,2023-09-04 22:34:38.664942,0 days 00:00:02.080694,Tanh,Sigmoid,Tanh,,58,3,4.0,10.0,,0.00016541693507636472,3,177,0.18841933450122675,0.00010869821983854869,136.8707870224775,COMPLETE
1608,0.5749566555023193,2023-09-04 22:34:38.665908,2023-09-04 22:34:49.922802,0 days 00:00:11.256894,Tanh,Leaky,,,33,23,5.0,,,1.3579413964055832e-05,2,226,0.7681631896290769,1.5416851669786645e-05,119.17288852792926,COMPLETE
1609,0.3350308835506439,2023-09-04 22:34:49.923740,2023-09-04 22:34:50.711364,0 days 00:00:00.787624,Leaky,,,,82,15,,,,0.05751394503733715,1,211,0.5591498477639191,1.1431421442343983e-05,112.95845451354981,COMPLETE
1610,0.3067202568054199,2023-09-04 22:34:50.712275,2023-09-04 22:34:54.091072,0 days 00:00:03.378797,Tanh,Sigmoid,,,18,12,14.0,,,0.008743234339642412,2,243,0.6269892466210643,1.9104962502411772e-05,100.21279986699422,COMPLETE
1611,0.42681217193603516,2023-09-04 22:34:54.091998,2023-09-04 22:34:55.792417,0 days 00:00:01.700419,Sigmoid,Sigmoid,Leaky,,21,14,15.0,6.0,,0.014433003260464641,3,112,0.7215237542111353,0.01780719355855314,126.57804361979167,COMPLETE
1612,0.7044455409049988,2023-09-04 22:34:55.793393,2023-09-04 22:35:01.702016,0 days 00:00:05.908623,Tanh,Sigmoid,Tanh,Leaky,14,13,5.0,18.0,4.0,3.553460827668546e-05,4,165,0.1710000422147868,8.690023700061454e-05,638.5264062592478,COMPLETE
1613,0.375003457069397,2023-09-04 22:35:01.702977,2023-09-04 22:35:22.062018,0 days 00:00:20.359041,Tanh,Sigmoid,,,12,22,11.0,,,0.000848760350513033,2,202,0.6993406047106028,0.009071246133529326,110.79450563129626,COMPLETE
1614,0.7674832344055176,2023-09-04 22:35:22.062936,2023-09-04 22:35:35.207612,0 days 00:00:13.144676,Tanh,Sigmoid,,,10,15,4.0,,,1.1231129402280656e-05,2,96,0.7494398784765103,0.0001413148572685943,98.68472703297932,COMPLETE
1615,0.4372813403606415,2023-09-04 22:35:35.208549,2023-09-04 22:35:41.427931,0 days 00:00:06.219382,Tanh,,,,18,18,,,,0.000130106095050134,1,141,0.5202833515566672,0.0001770803861704081,1118.093179256358,COMPLETE
1616,0.38213324546813965,2023-09-04 22:35:41.428840,2023-09-04 22:35:44.430854,0 days 00:00:03.002014,Leaky,Sigmoid,Leaky,,20,23,3.0,3.0,,0.0016551576788841561,3,219,0.14080236605769,6.817577449605571e-05,110.56292191050412,COMPLETE
1617,0.44609466195106506,2023-09-04 22:35:44.431822,2023-09-04 22:36:00.702870,0 days 00:00:16.271048,Tanh,Leaky,,,24,22,15.0,,,1.525207624902341e-05,2,252,0.7694146927836524,4.99013688234078e-05,113.37890400962225,COMPLETE
1618,0.36362460255622864,2023-09-04 22:36:00.703847,2023-09-04 22:36:11.452452,0 days 00:00:10.748605,Tanh,Sigmoid,,,38,14,5.0,,,0.00021512521292817632,2,234,0.799982150516977,2.33937874638635e-05,114.02360955262796,COMPLETE
1619,0.34946927428245544,2023-09-04 22:36:11.453382,2023-09-04 22:36:13.082854,0 days 00:00:01.629472,Tanh,Sigmoid,Sigmoid,,16,16,3.0,22.0,,0.03508921622395803,3,50,0.5002573712639544,0.0001195649802644897,116.55092420076069,COMPLETE
1620,0.3772219121456146,2023-09-04 22:36:13.083816,2023-09-04 22:36:20.844180,0 days 00:00:07.760364,Sigmoid,Sigmoid,,,30,22,14.0,,,0.0006813970178466757,2,152,0.727314653354016,0.0002598271382104493,110.0162911666067,COMPLETE
1621,0.4410233199596405,2023-09-04 22:36:20.845095,2023-09-04 22:36:22.119448,0 days 00:00:01.274353,Tanh,,,,23,15,,,,0.00030658332844382317,1,120,0.14844159170218407,0.0010759550357056316,110.04405753126422,COMPLETE
1622,0.3485621511936188,2023-09-04 22:36:22.120380,2023-09-04 22:36:23.836698,0 days 00:00:01.716318,Leaky,Sigmoid,,,12,14,9.0,,,0.007329672231319745,2,385,0.17423195447872913,3.0007908140519635e-05,123.44913205233487,COMPLETE
1623,0.3854842782020569,2023-09-04 22:36:23.837735,2023-09-04 22:36:25.590937,0 days 00:00:01.753202,Tanh,Sigmoid,Leaky,ReLU,36,23,4.0,2.0,9.0,0.004937531714913976,4,224,0.3042647636336235,0.00014245069526979757,160.56990446363176,COMPLETE
1624,0.35428306460380554,2023-09-04 22:36:25.591895,2023-09-04 22:36:28.999760,0 days 00:00:03.407865,Tanh,Sigmoid,Tanh,,14,18,23.0,21.0,,0.04313264431161588,3,209,0.6837930445877948,3.876476408297944e-05,115.80341638837542,COMPLETE
1625,0.35235702991485596,2023-09-04 22:36:29.000697,2023-09-04 22:36:30.254733,0 days 00:00:01.254036,Tanh,Sigmoid,,,26,22,4.0,,,0.011617040510192503,2,59,0.3274216193517361,0.0005551274840505348,109.74202098846436,COMPLETE
1626,0.902205765247345,2023-09-04 22:36:30.255653,2023-09-04 22:36:37.771232,0 days 00:00:07.515579,Tanh,Sigmoid,,,17,13,10.0,,,1.2229353609122866e-05,2,101,0.6520825741200522,0.00033993647858470474,108.76714521351427,COMPLETE
1627,0.3242983818054199,2023-09-04 22:36:37.772165,2023-09-04 22:36:40.790130,0 days 00:00:03.017965,Leaky,Leaky,,,10,22,22.0,,,0.01691180031247555,2,164,0.7458078382434712,9.914469471004848e-05,87.94886380150204,COMPLETE
1628,0.3707953095436096,2023-09-04 22:36:40.791049,2023-09-04 22:36:41.769020,0 days 00:00:00.977971,Tanh,,,,22,15,,,,0.02995196641331259,1,230,0.3470564022175789,0.00022359156095048252,811.0516227953361,COMPLETE
