number,value,datetime_start,datetime_complete,duration,params_activation1,params_activation2,params_activation3,params_activation4,params_batch_size,params_fl1,params_fl2,params_fl3,params_fl4,params_learning_rate,params_n_layers,params_num_epochs,params_train_size,params_weight_decay,user_attrs_mre,state
751,0.46472448110580444,2023-09-04 21:41:00.624960,2023-09-04 21:41:00.908502,0 days 00:00:00.283542,Tanh,Leaky,,,28,10,19.0,,,0.007084287485679917,2,360,0.3973035214436007,0.08878519214418223,112.1147106004798,COMPLETE
752,0.3714842200279236,2023-09-04 21:41:00.908902,2023-09-04 21:41:01.282987,0 days 00:00:00.374085,Tanh,ReLU,Leaky,,25,22,15.0,24.0,,0.011494800059740951,3,393,0.7394486155674935,0.0013281714311112881,131.38556729830228,COMPLETE
753,0.3698466420173645,2023-09-04 21:41:01.283373,2023-09-04 21:41:02.113212,0 days 00:00:00.829839,ReLU,Leaky,Leaky,,21,11,17.0,22.0,,0.050617080705819294,3,341,0.6638815078401616,0.0043482443273268724,109.16257381439209,COMPLETE
754,0.4964267909526825,2023-09-04 21:41:02.113611,2023-09-04 21:41:02.277482,0 days 00:00:00.163871,Tanh,Sigmoid,,,23,12,5.0,,,0.019909943965600602,2,375,0.15197632105237643,0.05024141507628215,137.94870525857678,COMPLETE
755,0.32852622866630554,2023-09-04 21:41:02.277859,2023-09-04 21:41:03.705022,0 days 00:00:01.427163,Tanh,Leaky,ReLU,,18,13,16.0,21.0,,0.0010131059760499607,3,325,0.44314537964989426,0.0007074804928747792,105.70440945559984,COMPLETE
756,0.5639403462409973,2023-09-04 21:41:03.705400,2023-09-04 21:41:06.041543,0 days 00:00:02.336143,Tanh,Leaky,Leaky,,27,23,14.0,8.0,,4.0156675237098894e-05,3,351,0.21124740442289888,0.07543162257128509,112.26584299201639,COMPLETE
757,0.4209633767604828,2023-09-04 21:41:06.041944,2023-09-04 21:41:06.184549,0 days 00:00:00.142605,ReLU,Sigmoid,,,43,11,15.0,,,0.014750579106686413,2,403,0.1252361164735996,5.94796333052208e-05,442.8407454057173,COMPLETE
758,0.3143247663974762,2023-09-04 21:41:06.184919,2023-09-04 21:41:07.140466,0 days 00:00:00.955547,Tanh,Leaky,Leaky,,30,10,16.0,4.0,,0.010088248662391467,3,367,0.6999626403534572,0.00019857736082326,86.96757094065349,COMPLETE
759,0.3795427680015564,2023-09-04 21:41:07.140845,2023-09-04 21:41:07.522603,0 days 00:00:00.381758,Leaky,Tanh,Leaky,,21,24,18.0,23.0,,0.012975029066766702,3,417,0.2867451987347772,1.8890960168577574e-05,146.35430750353584,COMPLETE
760,0.36081114411354065,2023-09-04 21:41:07.523015,2023-09-04 21:41:08.586095,0 days 00:00:01.063080,Tanh,Leaky,ReLU,,15,17,20.0,10.0,,0.008329521733331943,3,99,0.5034419422903476,0.00024343239401151474,99.83117980957032,COMPLETE
761,0.4180960953235626,2023-09-04 21:41:08.586480,2023-09-04 21:41:09.222840,0 days 00:00:00.636360,Tanh,Leaky,,,24,2,17.0,,,0.023871201253290685,2,438,0.4753615712202321,0.00035983709400412095,149.68428649902344,COMPLETE
762,0.3299001157283783,2023-09-04 21:41:09.223207,2023-09-04 21:41:15.660787,0 days 00:00:06.437580,Tanh,Sigmoid,Tanh,,17,11,19.0,7.0,,0.0007112988239455118,3,385,0.7705097882196049,2.751186161863898e-05,96.52842468741052,COMPLETE
763,0.4634438753128052,2023-09-04 21:41:15.661192,2023-09-04 21:41:16.576481,0 days 00:00:00.915289,ReLU,Leaky,Leaky,,27,12,14.0,6.0,,0.0003474829734004725,3,359,0.15232098536172908,0.0005450668172331416,109.70684885424237,COMPLETE
764,0.3704909384250641,2023-09-04 21:41:16.576863,2023-09-04 21:41:16.710071,0 days 00:00:00.133208,Tanh,Leaky,Leaky,,32,12,16.0,24.0,,0.015955007682058785,3,346,0.11338882585215852,0.00011784008673197175,108.1073501586914,COMPLETE
765,0.305782675743103,2023-09-04 21:41:16.710452,2023-09-04 21:41:18.954266,0 days 00:00:02.243814,Tanh,Sigmoid,,,38,8,15.0,,,0.00191444462012965,2,379,0.7998453399743417,3.733936084145979e-05,89.2117956788748,COMPLETE
766,0.39182743430137634,2023-09-04 21:41:18.954634,2023-09-04 21:41:19.302956,0 days 00:00:00.348322,Tanh,Leaky,Leaky,,19,11,17.0,23.0,,0.003999519763127232,3,394,0.18626914249503648,4.879842138041762e-05,112.00779427422418,COMPLETE
767,0.3931923508644104,2023-09-04 21:41:19.303340,2023-09-04 21:41:19.598410,0 days 00:00:00.295070,ReLU,Leaky,ReLU,,22,10,18.0,7.0,,0.09088422787180622,3,407,0.20644631237069422,8.326063580065354e-05,678.1601791381836,COMPLETE
768,0.4680505096912384,2023-09-04 21:41:19.598805,2023-09-04 21:41:19.806365,0 days 00:00:00.207560,Tanh,Sigmoid,,,13,9,16.0,,,0.03201730279756669,2,332,0.10551238462620202,0.00018387124789217513,184.703430720738,COMPLETE
769,0.4157157838344574,2023-09-04 21:41:19.806745,2023-09-04 21:41:20.129965,0 days 00:00:00.323220,Tanh,Leaky,Leaky,,25,13,15.0,8.0,,0.003081378561078663,3,448,0.1241033134160663,0.0022688135839863404,131.213782119751,COMPLETE
770,0.2764149010181427,2023-09-04 21:41:20.130360,2023-09-04 21:41:21.110301,0 days 00:00:00.979941,Tanh,Leaky,Leaky,,73,6,17.0,22.0,,0.005635742978460804,3,366,0.7386561905532412,0.00014528754250926182,123.53831289006375,COMPLETE
771,0.3414040803909302,2023-09-04 21:41:21.110693,2023-09-04 21:41:21.736068,0 days 00:00:00.625375,Tanh,Leaky,Leaky,,81,5,17.0,21.0,,0.0054973834962354215,3,368,0.742939750942382,0.00013306604842055393,117.99255445891735,COMPLETE
772,0.314436674118042,2023-09-04 21:41:21.736494,2023-09-04 21:41:23.008693,0 days 00:00:01.272199,ReLU,Sigmoid,,,80,6,17.0,,,0.006440342631577623,2,422,0.7187081908310587,0.00015224806052898797,245.1749600404061,COMPLETE
773,0.2977237403392792,2023-09-04 21:41:23.009181,2023-09-04 21:41:24.923866,0 days 00:00:01.914685,Sigmoid,Leaky,Leaky,,35,6,18.0,22.0,,0.0043368036673794115,3,379,0.7694457030728921,9.659777955538606e-05,106.42204481068224,COMPLETE
774,0.3994123339653015,2023-09-04 21:41:24.924361,2023-09-04 21:41:28.968004,0 days 00:00:04.043643,Tanh,Leaky,Leaky,,74,7,17.0,22.0,,6.928053888525613e-05,3,387,0.7463072343308186,0.00013579965767384724,129.86601785664718,COMPLETE
775,0.3340362012386322,2023-09-04 21:41:28.968423,2023-09-04 21:41:29.556437,0 days 00:00:00.588014,Tanh,Leaky,Leaky,,79,6,17.0,22.0,,0.005482884097521875,3,373,0.6851131144126918,0.0001805368796135034,719.9673494037829,COMPLETE
776,0.44669216871261597,2023-09-04 21:41:29.556942,2023-09-04 21:41:30.634049,0 days 00:00:01.077107,Tanh,Sigmoid,,,54,6,18.0,,,0.00016626398581810636,2,432,0.142850801162621,0.00024224586910919592,117.5349935249046,COMPLETE
777,0.324123352766037,2023-09-04 21:41:30.634428,2023-09-04 21:41:31.079982,0 days 00:00:00.445554,Tanh,Leaky,Leaky,,49,5,18.0,22.0,,0.00707761224298175,3,399,0.7702338917012186,6.980404470815604e-05,109.61084806002103,COMPLETE
778,0.3602410554885864,2023-09-04 21:41:31.080380,2023-09-04 21:41:31.418392,0 days 00:00:00.338012,ReLU,ReLU,Leaky,,86,6,17.0,20.0,,0.009672681528905594,3,411,0.31604690740922864,0.014783517185464385,114.44393545297476,COMPLETE
779,0.5309986472129822,2023-09-04 21:41:31.418773,2023-09-04 21:41:39.671187,0 days 00:00:08.252414,Tanh,Leaky,Leaky,,70,5,19.0,21.0,,1.8228025419821513e-05,3,355,0.7069007141326126,0.0003039185738085663,99.98235922799984,COMPLETE
780,0.34387919306755066,2023-09-04 21:41:39.671596,2023-09-04 21:41:40.202052,0 days 00:00:00.530456,Tanh,Sigmoid,,,71,7,17.0,,,0.0629330013193303,2,365,0.7986609578426525,0.00011189949781036969,170.43077596028647,COMPLETE
781,0.3110787272453308,2023-09-04 21:41:40.202450,2023-09-04 21:41:41.089499,0 days 00:00:00.887049,Tanh,Leaky,Leaky,,28,7,17.0,23.0,,0.008348678825864465,3,343,0.4496845813124683,0.00015684865200250937,112.17383451240008,COMPLETE
782,0.3128035068511963,2023-09-04 21:41:41.090152,2023-09-04 21:41:41.614360,0 days 00:00:00.524208,ReLU,Leaky,Leaky,,83,19,18.0,22.0,,0.011756796799326865,3,391,0.2741305432171185,0.00021367054273553214,109.16151966768153,COMPLETE
783,0.45163556933403015,2023-09-04 21:41:41.615023,2023-09-04 21:41:43.763351,0 days 00:00:02.148328,Tanh,Sigmoid,Leaky,,76,11,12.0,23.0,,4.8287873447048155e-05,3,373,0.36814308890309105,2.110940847781123e-05,113.65004402958355,COMPLETE
784,0.3894374370574951,2023-09-04 21:41:43.763771,2023-09-04 21:41:44.064389,0 days 00:00:00.300618,Leaky,Leaky,,,29,6,19.0,,,0.01910256979691776,2,421,0.2657483205061912,0.018501949626126415,193.25563691791734,COMPLETE
785,0.37425780296325684,2023-09-04 21:41:44.064792,2023-09-04 21:41:44.747487,0 days 00:00:00.682695,Tanh,,,,66,12,,,,0.004245040439150386,1,350,0.7377606722411764,2.9896550468555795e-05,111.93041038513184,COMPLETE
786,0.36580690741539,2023-09-04 21:41:44.747932,2023-09-04 21:41:45.084151,0 days 00:00:00.336219,Tanh,Leaky,Leaky,,24,15,18.0,12.0,,0.04607392976665954,3,322,0.2599738461806207,0.0004260814400996328,124.19024327596028,COMPLETE
787,0.32381510734558105,2023-09-04 21:41:45.084549,2023-09-04 21:41:45.680825,0 days 00:00:00.596276,Tanh,Tanh,,,77,6,16.0,,,0.004951525149318444,2,304,0.6588317423597323,0.00010309280278160835,96.87620798746745,COMPLETE
788,0.3224598467350006,2023-09-04 21:41:45.681223,2023-09-04 21:41:47.297876,0 days 00:00:01.616653,ReLU,Leaky,Leaky,,56,7,17.0,24.0,,0.0002802674996849903,3,359,0.7997737005852136,0.0005995209582579777,99.27775149138077,COMPLETE
789,0.3564320206642151,2023-09-04 21:41:47.298273,2023-09-04 21:41:48.462291,0 days 00:00:01.164018,Tanh,Sigmoid,Leaky,,74,5,16.0,21.0,,0.013516741121639666,3,221,0.6213524722677111,0.0007652395231208818,99.08947556594322,COMPLETE
790,0.2775668799877167,2023-09-04 21:41:48.462961,2023-09-04 21:41:50.359618,0 days 00:00:01.896657,Tanh,Leaky,Leaky,,26,14,17.0,23.0,,0.009998260346576892,3,339,0.7149139094031441,4.4965487793951364e-05,89.58012927020037,COMPLETE
791,0.3255825936794281,2023-09-04 21:41:50.360301,2023-09-04 21:41:51.539323,0 days 00:00:01.179022,Tanh,Leaky,Sigmoid,,31,11,18.0,14.0,,0.011768368811637226,3,383,0.43028987696307647,0.00014302293676780807,108.05470403035481,COMPLETE
792,0.4158494472503662,2023-09-04 21:41:51.539998,2023-09-04 21:41:51.858688,0 days 00:00:00.318690,ReLU,Sigmoid,,,23,12,16.0,,,0.007672667768217854,2,482,0.11241720494116017,0.0001770900440134973,126.66520195007324,COMPLETE
793,0.33024170994758606,2023-09-04 21:41:51.859344,2023-09-04 21:41:55.393527,0 days 00:00:03.534183,Tanh,Leaky,Leaky,,60,10,17.0,22.0,,0.0001471454476598151,3,404,0.7516356828649154,7.910148426385379e-05,118.03725181277103,COMPLETE
794,0.3224640488624573,2023-09-04 21:41:55.394206,2023-09-04 21:41:56.517000,0 days 00:00:01.122794,Tanh,Leaky,Leaky,,26,11,18.0,24.0,,0.006282113562623979,3,366,0.3997409353701545,1.1374067007585317e-05,147.30478159586588,COMPLETE
795,0.35588905215263367,2023-09-04 21:41:56.517405,2023-09-04 21:41:56.848322,0 days 00:00:00.330917,Tanh,Sigmoid,,,21,10,19.0,,,0.015082589072914657,2,397,0.24092144485612013,6.29494413597983e-05,139.38150133405412,COMPLETE
796,0.41679254174232483,2023-09-04 21:41:56.848744,2023-09-04 21:41:57.765556,0 days 00:00:00.916812,ReLU,Leaky,Leaky,,29,16,21.0,13.0,,0.018251496858936362,3,427,0.7707290453312269,0.061926776505021444,91.96649482922676,COMPLETE
797,0.29060935974121094,2023-09-04 21:41:57.765958,2023-09-04 21:41:58.628446,0 days 00:00:00.862488,Tanh,Leaky,Leaky,,23,12,16.0,15.0,,0.009275856137245598,3,415,0.6972695654292679,0.0009231102392517765,101.12381026324104,COMPLETE
798,0.4281144142150879,2023-09-04 21:41:58.628874,2023-09-04 21:42:01.865667,0 days 00:00:03.236793,Sigmoid,Leaky,,,69,18,20.0,,,0.00021492499204585192,2,380,0.4663823255733146,0.0001229819529316027,972.47214148672,COMPLETE
799,0.4462031424045563,2023-09-04 21:42:01.866024,2023-09-04 21:42:07.739566,0 days 00:00:05.873542,Tanh,Sigmoid,Leaky,,57,11,13.0,21.0,,4.175789057413441e-05,3,441,0.7316172688665389,0.00032150769024486643,110.75256295755607,COMPLETE
800,0.45421627163887024,2023-09-04 21:42:07.739965,2023-09-04 21:42:08.602615,0 days 00:00:00.862650,Tanh,Leaky,Leaky,,73,3,17.0,23.0,,0.00023031730482912856,3,258,0.19786472067115435,0.010717581603177515,124.98351122242536,COMPLETE
801,0.3256838917732239,2023-09-04 21:42:08.602984,2023-09-04 21:42:10.529014,0 days 00:00:01.926030,Tanh,Leaky,Leaky,,33,13,18.0,19.0,,0.0005000155914755711,3,354,0.6746479643280726,0.0002522361019760181,107.31735330257776,COMPLETE
802,0.466139018535614,2023-09-04 21:42:10.529387,2023-09-04 21:42:18.044310,0 days 00:00:07.514923,ReLU,ReLU,,,20,8,16.0,,,2.4173353104363983e-05,2,372,0.588268538361078,2.4432660874502346e-05,136.2826786246351,COMPLETE
803,0.49411487579345703,2023-09-04 21:42:18.044714,2023-09-04 21:42:18.194704,0 days 00:00:00.149990,Tanh,Sigmoid,Leaky,,72,12,19.0,24.0,,0.09746672385384296,3,333,0.1031942977023331,1.4619499488881525e-05,155.83694731883514,COMPLETE
804,0.2532697021961212,2023-09-04 21:42:18.195118,2023-09-04 21:42:20.358449,0 days 00:00:02.163331,Tanh,Leaky,Tanh,,25,10,17.0,23.0,,0.027581065421249808,3,363,0.770396817431115,0.00019839853979505996,103.73091494652533,COMPLETE
805,0.3144851624965668,2023-09-04 21:42:20.359115,2023-09-04 21:42:20.900203,0 days 00:00:00.541088,Tanh,Leaky,Tanh,,26,9,18.0,16.0,,0.02870037486267671,3,346,0.7699105819223342,0.00021310779651220307,103.78599281311035,COMPLETE
806,0.33542972803115845,2023-09-04 21:42:20.900590,2023-09-04 21:42:21.447774,0 days 00:00:00.547184,ReLU,Sigmoid,,,24,10,16.0,,,0.03761861652102322,2,235,0.7681252306721635,0.000398964795855603,91.46864318847656,COMPLETE
807,0.3467240631580353,2023-09-04 21:42:21.448147,2023-09-04 21:42:22.198453,0 days 00:00:00.750306,Tanh,Leaky,Tanh,,25,9,22.0,23.0,,0.021804211047793037,3,357,0.774915619474554,0.00020979455024969817,105.71944727216449,COMPLETE
808,0.30327343940734863,2023-09-04 21:42:22.198838,2023-09-04 21:42:22.785181,0 days 00:00:00.586343,Tanh,Leaky,Tanh,,27,9,17.0,24.0,,0.029984421713966224,3,339,0.7975838930099579,0.0003040058344496414,101.09734413840555,COMPLETE
809,0.3939509987831116,2023-09-04 21:42:22.785573,2023-09-04 21:42:22.998214,0 days 00:00:00.212641,Tanh,Leaky,,,22,10,16.0,,,0.024563351622309222,2,410,0.1918370557535292,0.014037563121818683,231.5073488675631,COMPLETE
810,0.3845100998878479,2023-09-04 21:42:22.998618,2023-09-04 21:42:23.633848,0 days 00:00:00.635230,Leaky,Sigmoid,Tanh,,24,10,18.0,23.0,,0.016156113451401596,3,395,0.4906278711354374,0.03951455565879836,117.79501364571708,COMPLETE
811,0.420022577047348,2023-09-04 21:42:23.634293,2023-09-04 21:42:23.858795,0 days 00:00:00.224502,Tanh,Tanh,Tanh,,28,11,17.0,24.0,,0.021422652607675036,3,316,0.10898305375272592,0.0004947880862840509,874.7069616983104,COMPLETE
812,0.33357974886894226,2023-09-04 21:42:23.859195,2023-09-04 21:42:25.816387,0 days 00:00:01.957192,ReLU,Leaky,,,26,10,13.0,,,0.0026077116707970234,2,455,0.7235791477587635,0.0002533632182954482,100.34961143699852,COMPLETE
813,0.3656945526599884,2023-09-04 21:42:25.816769,2023-09-04 21:42:26.246649,0 days 00:00:00.429880,Tanh,Leaky,Tanh,,30,11,15.0,12.0,,0.013559898177795078,3,350,0.7997006943737719,3.888407087462789e-05,100.51879613539752,COMPLETE
814,0.4431913197040558,2023-09-04 21:42:26.247049,2023-09-04 21:42:26.476301,0 days 00:00:00.229252,Tanh,Sigmoid,Tanh,,23,9,20.0,24.0,,0.0016875202275555563,3,383,0.1319718649952057,3.294270695849856e-05,350.1689672470093,COMPLETE
815,0.36920008063316345,2023-09-04 21:42:26.476678,2023-09-04 21:42:26.864677,0 days 00:00:00.387999,Tanh,Leaky,Tanh,,22,11,19.0,14.0,,0.018393403520904524,3,434,0.23219330889952552,0.006983295443626261,129.8159531303074,COMPLETE
816,0.3199799358844757,2023-09-04 21:42:26.865358,2023-09-04 21:42:27.581285,0 days 00:00:00.715927,ReLU,Leaky,Sigmoid,,62,10,16.0,23.0,,0.02596619938764528,3,361,0.7498098546107912,0.00018421757650320943,106.19209355893342,COMPLETE
817,0.41956382989883423,2023-09-04 21:42:27.581693,2023-09-04 21:42:27.757767,0 days 00:00:00.176074,Tanh,Sigmoid,,,28,11,17.0,,,0.01187892165769574,2,328,0.10674683509297832,4.994782513136295e-05,166.11264135898688,COMPLETE
818,0.30494457483291626,2023-09-04 21:42:27.758150,2023-09-04 21:42:29.687344,0 days 00:00:01.929194,Tanh,Leaky,Tanh,,25,12,18.0,3.0,,0.0021852329912333077,3,402,0.6504032236306673,0.005100726593099397,119.69389271286299,COMPLETE
819,0.33488157391548157,2023-09-04 21:42:29.688007,2023-09-04 21:42:31.534625,0 days 00:00:01.846618,Tanh,Leaky,,,21,10,14.0,,,0.03314584154845335,2,415,0.6980204007472006,0.0006911496656501715,101.28027697971889,COMPLETE
820,0.3804936707019806,2023-09-04 21:42:31.535300,2023-09-04 21:42:34.670229,0 days 00:00:03.134929,ReLU,Leaky,Tanh,,30,11,15.0,18.0,,0.0013215603755879419,3,249,0.7523162030357496,0.0003561603687967652,114.50907951023268,COMPLETE
821,0.33276399970054626,2023-09-04 21:42:34.670667,2023-09-04 21:42:35.374167,0 days 00:00:00.703500,Tanh,Sigmoid,Tanh,,27,12,17.0,13.0,,0.039940030677151864,3,370,0.7206168195408246,0.00029558059550833073,107.62993385051858,COMPLETE
822,0.7179337739944458,2023-09-04 21:42:35.374611,2023-09-04 21:42:38.302625,0 days 00:00:02.928014,Sigmoid,Leaky,Tanh,,24,10,2.0,23.0,,3.2168789383942945e-05,3,389,0.16657718403009794,0.00373108214934654,136.04057062928658,COMPLETE
823,0.2823607325553894,2023-09-04 21:42:38.303319,2023-09-04 21:42:39.400961,0 days 00:00:01.097642,Tanh,Leaky,,,19,13,12.0,,,0.014675259256738448,2,345,0.7716637492711653,0.00022400351426452389,100.76497947878954,COMPLETE
824,0.5010255575180054,2023-09-04 21:42:39.401415,2023-09-04 21:42:42.437941,0 days 00:00:03.036526,Tanh,Sigmoid,Tanh,,20,11,18.0,11.0,,2.7014359148971836e-05,3,360,0.20550521289243573,2.7196120927164592e-05,114.26008243560791,COMPLETE
825,0.31871557235717773,2023-09-04 21:42:42.438626,2023-09-04 21:42:43.164819,0 days 00:00:00.726193,Tanh,Leaky,Tanh,,25,12,16.0,24.0,,0.011154752309744626,3,377,0.6072233900681686,8.35306132846743e-05,100.06347601754325,COMPLETE
826,0.37529128789901733,2023-09-04 21:42:43.165233,2023-09-04 21:42:43.435697,0 days 00:00:00.270464,ReLU,Leaky,Tanh,,22,10,17.0,9.0,,0.017303137097743265,3,336,0.169310091870355,1.7517598969138308e-05,142.09475564956665,COMPLETE
827,0.35854974389076233,2023-09-04 21:42:43.436102,2023-09-04 21:42:48.964670,0 days 00:00:05.528568,Tanh,ReLU,,,32,9,19.0,,,0.0008230687702065376,2,429,0.6857360183850694,0.0010014735797446886,109.47562677886849,COMPLETE
828,0.3614161014556885,2023-09-04 21:42:48.965048,2023-09-04 21:42:49.646854,0 days 00:00:00.681806,Tanh,Sigmoid,Leaky,,27,12,16.0,15.0,,0.01317465924670607,3,421,0.3398057594907114,3.667737071485723e-05,133.80842820653376,COMPLETE
829,0.47535595297813416,2023-09-04 21:42:49.647256,2023-09-04 21:42:49.895851,0 days 00:00:00.248595,Tanh,Leaky,,,29,11,15.0,,,0.00269924435034895,2,351,0.2887312689051431,0.08395207898323645,134.59044336389613,COMPLETE
830,0.4283968210220337,2023-09-04 21:42:49.896220,2023-09-04 21:42:50.341464,0 days 00:00:00.445244,ReLU,Leaky,Leaky,,23,19,16.0,13.0,,0.021149328468976575,3,391,0.744253048169844,0.04369390323615655,132.36551818847656,COMPLETE
831,0.32740518450737,2023-09-04 21:42:50.341841,2023-09-04 21:42:51.731270,0 days 00:00:01.389429,Tanh,Leaky,Leaky,,18,11,18.0,14.0,,0.010868229224108497,3,366,0.7166151454584251,5.8987709713334206e-05,107.02273975719105,COMPLETE
832,0.39541250467300415,2023-09-04 21:42:51.731670,2023-09-04 21:42:52.324756,0 days 00:00:00.593086,Leaky,Sigmoid,Tanh,,25,12,17.0,23.0,,0.0031291660595210596,3,408,0.3071089131128876,0.00018347035115052077,124.6844217637006,COMPLETE
833,0.45358750224113464,2023-09-04 21:42:52.325131,2023-09-04 21:42:58.697203,0 days 00:00:06.372072,Tanh,Leaky,,,20,13,14.0,,,1.5183870130908449e-05,2,377,0.43920934474631584,0.0004545985727244397,164.1831213346527,COMPLETE
834,0.30571380257606506,2023-09-04 21:42:58.697581,2023-09-04 21:42:59.461802,0 days 00:00:00.764221,Tanh,Tanh,Leaky,,26,10,18.0,24.0,,0.01518906629600704,3,355,0.774236748057725,1.0198038818436446e-05,91.22528915405273,COMPLETE
835,0.334974467754364,2023-09-04 21:42:59.462195,2023-09-04 21:43:05.449023,0 days 00:00:05.986828,Tanh,Leaky,Sigmoid,,34,11,15.0,10.0,,0.00010551822586660595,3,296,0.6424323501875951,2.269709899640549e-05,127.5787621317683,COMPLETE
836,0.26860353350639343,2023-09-04 21:43:05.449408,2023-09-04 21:43:12.345331,0 days 00:00:06.895923,ReLU,Sigmoid,,,31,12,16.0,,,0.00038545780957667715,2,400,0.7392659586998256,0.0005458106041584818,98.52634267807007,COMPLETE
837,0.4825534224510193,2023-09-04 21:43:12.345715,2023-09-04 21:43:14.009006,0 days 00:00:01.663291,ReLU,Sigmoid,,,32,12,3.0,,,0.0003584483415909733,2,415,0.17131462416426615,0.02256108007515344,111.9945385852492,COMPLETE
838,0.39628562331199646,2023-09-04 21:43:14.009372,2023-09-04 21:43:14.472630,0 days 00:00:00.463258,ReLU,Sigmoid,,,35,12,16.0,,,0.001017665426811816,2,406,0.161591058528281,0.0005882339226160246,118.23073976533907,COMPLETE
839,0.4434303939342499,2023-09-04 21:43:14.473001,2023-09-04 21:43:17.051473,0 days 00:00:02.578472,ReLU,Sigmoid,,,33,13,16.0,,,0.0006460819181068407,2,427,0.6854480247869311,0.07070674612973445,102.84383392333984,COMPLETE
840,0.282988041639328,2023-09-04 21:43:17.051870,2023-09-04 21:43:23.473581,0 days 00:00:06.421711,ReLU,Sigmoid,,,30,12,15.0,,,0.00033222583453053605,2,343,0.7994579917725066,0.0006220765693155311,115.12871794161082,COMPLETE
841,0.3491920530796051,2023-09-04 21:43:23.473957,2023-09-04 21:43:24.731076,0 days 00:00:01.257119,ReLU,Sigmoid,,,31,12,16.0,,,0.0006732659385530788,2,400,0.3614057714481831,0.0001050466288055582,177.91876571242875,COMPLETE
842,0.3142178952693939,2023-09-04 21:43:24.731440,2023-09-04 21:43:27.763473,0 days 00:00:03.032033,ReLU,Sigmoid,,,41,11,16.0,,,0.0002927624219051915,2,447,0.7172186808321679,0.00016900341327554815,106.3879661883338,COMPLETE
843,0.2970181703567505,2023-09-04 21:43:27.763840,2023-09-04 21:43:29.394865,0 days 00:00:01.631025,ReLU,Sigmoid,,,31,12,15.0,,,0.0018187611739786413,2,419,0.7417834128260087,7.255439572202498e-05,101.20269098970078,COMPLETE
844,0.36033397912979126,2023-09-04 21:43:29.395238,2023-09-04 21:43:31.125562,0 days 00:00:01.730324,ReLU,Sigmoid,,,36,13,16.0,,,0.0004538571993331328,2,327,0.21542174665791405,0.0008607602395105479,107.27029612596611,COMPLETE
845,0.3875678479671478,2023-09-04 21:43:31.126220,2023-09-04 21:43:35.844459,0 days 00:00:04.718239,ReLU,Sigmoid,,,33,11,15.0,,,0.0001791270325219344,2,409,0.5479574718549052,4.576845209089758e-05,134.2271878451587,COMPLETE
