number,value,datetime_start,datetime_complete,duration,params_activation1,params_activation2,params_activation3,params_activation4,params_batch_size,params_fl1,params_fl2,params_fl3,params_fl4,params_learning_rate,params_n_layers,params_num_epochs,params_train_size,params_weight_decay,user_attrs_mre,state
1067,0.4761963486671448,2023-09-04 21:29:26.837216,2023-09-04 21:29:28.393087,0 days 00:00:01.555871,Tanh,Sigmoid,,,79,19,10.0,,,0.00029167041014900873,2,256,0.48146479814785587,5.78432798672564e-05,238.78101778030396,COMPLETE
1068,0.574649453163147,2023-09-04 21:29:28.393483,2023-09-04 21:29:28.734341,0 days 00:00:00.340858,Tanh,Tanh,,,76,19,10.0,,,0.004505059539308975,2,238,0.4200015374589854,0.05081379452348178,210.5692533605239,COMPLETE
1069,0.2958972752094269,2023-09-04 21:29:28.734739,2023-09-04 21:29:29.282586,0 days 00:00:00.547847,Tanh,ReLU,,,74,20,11.0,,,0.03383202281249386,2,190,0.797866090497629,8.293042917291297e-05,120.42187606811524,COMPLETE
1070,0.40007418394088745,2023-09-04 21:29:29.282986,2023-09-04 21:29:29.516627,0 days 00:00:00.233641,ReLU,Tanh,,,80,19,9.0,,,0.021730787996629024,2,251,0.20563679691594655,0.0034281497592101775,177.7206979567005,COMPLETE
1071,0.41362136602401733,2023-09-04 21:29:29.517029,2023-09-04 21:29:29.763858,0 days 00:00:00.246829,Tanh,Tanh,,,78,19,9.0,,,0.018281910761072887,2,213,0.24668218391848226,0.00023863970039514812,171.40911008600602,COMPLETE
1072,0.3251868486404419,2023-09-04 21:29:29.764265,2023-09-04 21:29:30.061085,0 days 00:00:00.296820,Tanh,Sigmoid,,,75,19,21.0,,,0.02801023115832166,2,261,0.5989147911002811,0.0004209835794645391,2030.6672875189013,COMPLETE
1073,0.5087152719497681,2023-09-04 21:29:30.061506,2023-09-04 21:29:30.258767,0 days 00:00:00.197261,Tanh,ReLU,,,82,19,16.0,,,0.022234586949635135,2,305,0.12156047716788457,0.06620593304743727,184.0675742995571,COMPLETE
1074,0.7393520474433899,2023-09-04 21:29:30.259190,2023-09-04 21:29:30.910127,0 days 00:00:00.650937,Tanh,Tanh,,,78,18,11.0,,,4.1569920683415053e-05,2,335,0.1151620873702705,0.004447889124215362,118.29697165418027,COMPLETE
1075,0.41322851181030273,2023-09-04 21:29:30.910536,2023-09-04 21:29:33.811761,0 days 00:00:02.901225,Tanh,Tanh,,,73,20,18.0,,,0.00013757641497560242,2,271,0.753828424644689,0.00010638060001308103,169.20013410842728,COMPLETE
1076,0.6538305282592773,2023-09-04 21:29:33.812185,2023-09-04 21:29:34.605801,0 days 00:00:00.793616,ReLU,ReLU,,,81,19,10.0,,,6.953398863350002e-05,2,317,0.18613859081552242,0.00013468287948984638,165.20524659743444,COMPLETE
1077,0.4512101709842682,2023-09-04 21:29:34.606186,2023-09-04 21:29:37.409640,0 days 00:00:02.803454,Tanh,Tanh,,,80,18,9.0,,,0.00010205230440425314,2,301,0.7992924919062406,7.34720146059492e-05,174.44814434875286,COMPLETE
1078,0.43110108375549316,2023-09-04 21:29:37.410036,2023-09-04 21:29:37.554717,0 days 00:00:00.144681,Tanh,Sigmoid,,,76,18,24.0,,,0.0343319899062403,2,292,0.1093059127843374,0.0001794768298922599,160.2806632632301,COMPLETE
1079,0.3269260823726654,2023-09-04 21:29:37.555110,2023-09-04 21:29:37.907026,0 days 00:00:00.351916,Tanh,Tanh,,,79,18,9.0,,,0.025860563519122328,2,243,0.7549367330964585,8.99679619542517e-05,412.51166248321533,COMPLETE
1080,0.6152137517929077,2023-09-04 21:29:37.907449,2023-09-04 21:29:39.521193,0 days 00:00:01.613744,Tanh,ReLU,,,87,19,11.0,,,5.0915213906973714e-05,2,261,0.2897782065311057,0.0002577166830926947,124.46687989216655,COMPLETE
1081,0.5711603164672852,2023-09-04 21:29:39.521923,2023-09-04 21:29:43.208411,0 days 00:00:03.686488,Tanh,Tanh,,,45,19,3.0,,,3.6700400566612436e-05,2,376,0.3867351344491302,0.00021586146034023937,146.83175894554626,COMPLETE
1082,0.32691842317581177,2023-09-04 21:29:43.208808,2023-09-04 21:29:43.634688,0 days 00:00:00.425880,ReLU,ReLU,,,83,18,10.0,,,0.017619288383467952,2,360,0.713427474407717,0.0027561947260857094,651.5211649576823,COMPLETE
1083,0.8102657794952393,2023-09-04 21:29:43.635153,2023-09-04 21:29:44.679862,0 days 00:00:01.044709,Tanh,Tanh,,,78,20,9.0,,,2.125316014498715e-05,2,285,0.27027987823547633,0.00012640133173423998,214.53057261684484,COMPLETE
1084,0.3250919282436371,2023-09-04 21:29:44.680283,2023-09-04 21:29:44.955727,0 days 00:00:00.275444,Tanh,Tanh,,,74,18,10.0,,,0.039852759836198785,2,134,0.7673396785643793,0.00015931236974447608,396.10279707475144,COMPLETE
1085,0.5299118161201477,2023-09-04 21:29:44.956177,2023-09-04 21:29:45.132345,0 days 00:00:00.176168,Tanh,Sigmoid,Tanh,Tanh,81,19,14.0,8.0,4.0,0.06320035281445967,4,313,0.12917534878217185,0.0003311912801681323,924.9815542432997,COMPLETE
1086,0.30923762917518616,2023-09-04 21:29:45.132767,2023-09-04 21:29:46.504536,0 days 00:00:01.371769,Tanh,ReLU,,,76,18,6.0,,,0.0006968598883296957,2,209,0.7461971311767229,0.00010793099023011423,841.190821848759,COMPLETE
1087,0.4829958379268646,2023-09-04 21:29:46.504943,2023-09-04 21:29:46.992145,0 days 00:00:00.487202,Tanh,Tanh,,,33,18,11.0,,,0.019355219172566062,2,223,0.7996979316690701,0.060153889176086654,126.69881317138672,COMPLETE
1088,0.3359565734863281,2023-09-04 21:29:46.992540,2023-09-04 21:29:48.143813,0 days 00:00:01.151273,ReLU,Tanh,,,83,19,9.0,,,0.002264206823013261,2,272,0.6913422963983246,9.544122071978279e-05,133.34781056424998,COMPLETE
1089,0.3397570550441742,2023-09-04 21:29:48.144231,2023-09-04 21:29:48.806643,0 days 00:00:00.662412,Tanh,ReLU,,,16,20,24.0,,,0.08111004952060107,2,301,0.5142271951504241,5.060927692391768e-05,155.51421864827475,COMPLETE
1090,0.31177547574043274,2023-09-04 21:29:48.807086,2023-09-04 21:29:49.273922,0 days 00:00:00.466836,Tanh,Tanh,,,80,19,10.0,,,0.0054531135264743995,2,127,0.3511268265557964,6.223127509754512e-05,154.97804799287215,COMPLETE
1091,0.3175221383571625,2023-09-04 21:29:49.274349,2023-09-04 21:29:49.659022,0 days 00:00:00.384673,Tanh,Sigmoid,,,86,18,8.0,,,0.02827836482685932,2,291,0.7207769592655491,0.00017384706720469345,153.43611634083283,COMPLETE
1092,0.3290042281150818,2023-09-04 21:29:49.659594,2023-09-04 21:29:50.094182,0 days 00:00:00.434588,Tanh,ReLU,,,89,17,11.0,,,0.023248707538136668,2,324,0.7686041162260348,0.00013968054770339657,305.3079639781605,COMPLETE
1093,0.29301917552948,2023-09-04 21:29:50.094600,2023-09-04 21:29:50.381100,0 days 00:00:00.286500,Tanh,Tanh,,,77,15,10.0,,,0.05297461290521215,2,305,0.5248480065542085,0.00020364745432607147,127.92962232317244,COMPLETE
1094,0.3029816448688507,2023-09-04 21:29:50.381528,2023-09-04 21:29:50.867556,0 days 00:00:00.486028,ReLU,Tanh,,,73,18,22.0,,,0.016438155841751824,2,252,0.7421411407084586,7.592393827549696e-05,134.9372551812066,COMPLETE
1095,0.541234016418457,2023-09-04 21:29:50.867980,2023-09-04 21:29:52.950478,0 days 00:00:02.082498,Tanh,ReLU,,,85,18,9.0,,,4.036843314023656e-05,2,266,0.6734698875549203,0.01746095881615037,153.18709977228838,COMPLETE
1096,0.2727838158607483,2023-09-04 21:29:52.950906,2023-09-04 21:29:53.409164,0 days 00:00:00.458258,Tanh,Tanh,,,82,19,24.0,,,0.03016279133941251,2,279,0.7675910831100629,0.00011780543362006312,167.04183663262262,COMPLETE
1097,0.6997351050376892,2023-09-04 21:29:53.409592,2023-09-04 21:29:53.988293,0 days 00:00:00.578701,Tanh,Sigmoid,,,78,17,17.0,,,0.0013291877582005545,2,157,0.7990452452242996,0.04002808562733412,158.75598299944843,COMPLETE
1098,0.2941208481788635,2023-09-04 21:29:53.988709,2023-09-04 21:29:54.360470,0 days 00:00:00.371761,Tanh,Tanh,,,80,18,19.0,,,0.01985419650148032,2,316,0.6314502019228995,0.00030880580960637234,432.9318016052246,COMPLETE
1099,0.6732081770896912,2023-09-04 21:29:54.360884,2023-09-04 21:29:56.399098,0 days 00:00:02.038214,Tanh,ReLU,,,75,20,11.0,,,6.523048727231112e-05,2,230,0.7202768207167188,0.0863490912529172,239.18707361635956,COMPLETE
1100,0.34754034876823425,2023-09-04 21:29:56.399513,2023-09-04 21:29:56.740206,0 days 00:00:00.340693,ReLU,Tanh,Leaky,,84,13,9.0,21.0,,0.007077580411185467,3,286,0.3012929482930204,3.670925721472157e-05,144.848442196846,COMPLETE
1101,0.4231555461883545,2023-09-04 21:29:56.740654,2023-09-04 21:29:56.868064,0 days 00:00:00.127410,Tanh,Tanh,,,73,18,7.0,,,0.0392630441580372,2,298,0.12215354135307113,0.008960715318786484,286.90589658675657,COMPLETE
1102,0.3114653527736664,2023-09-04 21:29:56.868470,2023-09-04 21:29:57.376231,0 days 00:00:00.507761,Tanh,ReLU,,,82,19,8.0,,,0.023299083780051796,2,309,0.7407611512657472,0.00048400553942662487,714.1861818753756,COMPLETE
1103,0.41141968965530396,2023-09-04 21:29:57.376647,2023-09-04 21:29:58.394345,0 days 00:00:01.017698,Tanh,Tanh,,,79,17,21.0,,,0.0011269440342396662,2,276,0.3063277844953426,0.006627088042756469,117.11601519874233,COMPLETE
1104,0.5872550010681152,2023-09-04 21:29:58.394767,2023-09-04 21:30:00.323990,0 days 00:00:01.929223,Tanh,Sigmoid,,,77,16,23.0,,,2.4447247969390242e-05,2,196,0.7673104224931921,0.003104316815574333,107.56916505463269,COMPLETE
1105,0.9894665479660034,2023-09-04 21:30:00.324393,2023-09-04 21:30:02.088715,0 days 00:00:01.764322,Leaky,ReLU,,,87,17,10.0,,,1.0849116478626127e-05,2,420,0.31006560905514824,0.005532063918416314,127.08720256260463,COMPLETE
1106,0.3762042820453644,2023-09-04 21:30:02.089105,2023-09-04 21:30:02.319670,0 days 00:00:00.230565,Tanh,Tanh,,,84,18,9.0,,,0.014439080953003761,2,248,0.21187115801667705,0.0003778110559475538,124.53824628632644,COMPLETE
1107,0.3266680836677551,2023-09-04 21:30:02.320102,2023-09-04 21:30:02.610790,0 days 00:00:00.290688,Leaky,Tanh,,,81,17,20.0,,,0.0344996023909186,2,268,0.5520720136530842,0.0002447954805851097,134.0158810335047,COMPLETE
1108,0.7067941427230835,2023-09-04 21:30:02.611208,2023-09-04 21:30:03.794354,0 days 00:00:01.183146,Tanh,ReLU,,,79,18,15.0,,,2.1394043719410205e-05,2,492,0.16934184540117708,0.00014850537797729226,447.95192346340275,COMPLETE
1109,0.5316217541694641,2023-09-04 21:30:03.794758,2023-09-04 21:30:06.356056,0 days 00:00:02.561298,ReLU,Tanh,,,76,19,11.0,,,3.058112921859174e-05,2,293,0.7063401249732467,8.689644691380185e-05,944.437328455798,COMPLETE
1110,0.3859231770038605,2023-09-04 21:30:06.356470,2023-09-04 21:30:09.257200,0 days 00:00:02.900730,Tanh,Sigmoid,,,72,19,18.0,,,0.00042941892129429155,2,261,0.7720365089788567,0.00011918204526754264,175.72680699140176,COMPLETE
1111,0.7170519232749939,2023-09-04 21:30:09.257608,2023-09-04 21:30:11.590826,0 days 00:00:02.333218,Leaky,Tanh,,,75,16,10.0,,,1.5131160247967234e-05,2,284,0.6713997037256245,0.0023646338891885384,141.65223470875915,COMPLETE
1112,0.5714147090911865,2023-09-04 21:30:11.591245,2023-09-04 21:30:12.250243,0 days 00:00:00.658998,Tanh,ReLU,,,81,18,8.0,,,0.0035763213464552117,2,116,0.7409130334429922,0.0970616818164607,199.42996651785714,COMPLETE
1113,0.459764301776886,2023-09-04 21:30:12.250647,2023-09-04 21:30:12.459708,0 days 00:00:00.209061,Tanh,,,,27,20,,,,0.008268934692885775,1,500,0.1452775913429419,0.00018574321041527606,134.79315042495728,COMPLETE
1114,0.3421739935874939,2023-09-04 21:30:12.460115,2023-09-04 21:30:16.540153,0 days 00:00:04.080038,Leaky,Tanh,,,78,17,7.0,,,0.00034258796566586763,2,406,0.7983788792911042,0.0006000703818777103,135.0689782547624,COMPLETE
1115,0.48301661014556885,2023-09-04 21:30:16.540553,2023-09-04 21:30:18.990843,0 days 00:00:02.450290,Tanh,Tanh,,,83,18,12.0,,,8.522636719497506e-05,2,300,0.7011909772423777,0.0001559077873695158,187.58879870096843,COMPLETE
1116,0.3325830399990082,2023-09-04 21:30:18.991251,2023-09-04 21:30:19.498096,0 days 00:00:00.506845,ReLU,ReLU,,,48,14,23.0,,,0.017173826348272605,2,273,0.3746670418015217,6.471654743976043e-05,178.96713518415177,COMPLETE
1117,0.28175294399261475,2023-09-04 21:30:19.498832,2023-09-04 21:30:20.240445,0 days 00:00:00.741613,Leaky,Tanh,,,85,15,8.0,,,0.025612440304334558,2,318,0.7440283524450214,9.721855750875497e-05,170.9811074393136,COMPLETE
1118,0.3175853490829468,2023-09-04 21:30:20.240853,2023-09-04 21:30:20.695876,0 days 00:00:00.455023,Tanh,Sigmoid,,,80,17,6.0,,,0.04574663087345389,2,238,0.7683537705317675,0.00022508777693516132,211.84940719604492,COMPLETE
1119,0.39962586760520935,2023-09-04 21:30:20.696278,2023-09-04 21:30:21.473264,0 days 00:00:00.776986,Tanh,ReLU,,,77,19,9.0,,,0.011601493585332317,2,309,0.6445634212102814,0.027705331717784203,377.02105221218534,COMPLETE
1120,0.43210315704345703,2023-09-04 21:30:21.473659,2023-09-04 21:30:25.479426,0 days 00:00:04.005767,Leaky,Tanh,,,89,16,11.0,,,0.00025374154628942893,2,328,0.7262617615300679,4.467587107843448e-05,155.9912335000387,COMPLETE
1121,0.29298684000968933,2023-09-04 21:30:25.479863,2023-09-04 21:30:25.880860,0 days 00:00:00.400997,Tanh,Tanh,,,74,18,13.0,,,0.020346425562089772,2,259,0.40963883226918796,0.0001191575674598,215.24309268240202,COMPLETE
1122,0.3689040243625641,2023-09-04 21:30:25.881366,2023-09-04 21:30:26.197287,0 days 00:00:00.315921,Tanh,ReLU,,,82,17,24.0,,,0.02905994626093712,2,341,0.45241516253716796,0.00016956762572381057,155.1231475830078,COMPLETE
1123,0.353500097990036,2023-09-04 21:30:26.197746,2023-09-04 21:30:26.547760,0 days 00:00:00.350014,Leaky,Tanh,,,71,18,9.0,,,0.014113971209510053,2,283,0.5666598565250085,8.054125500616129e-05,161.0868705543312,COMPLETE
1124,0.4594406187534332,2023-09-04 21:30:26.548245,2023-09-04 21:30:26.871008,0 days 00:00:00.322763,Tanh,Sigmoid,,,87,19,22.0,,,0.02178386944238478,2,179,0.6042359697842317,0.007430756713851693,190.91744864327566,COMPLETE
1125,0.5549291372299194,2023-09-04 21:30:26.871519,2023-09-04 21:30:27.031035,0 days 00:00:00.159516,ReLU,Tanh,,,79,17,10.0,,,0.03261611621375043,2,296,0.18991670778080924,0.039604821776721894,322.3859410439768,COMPLETE
1126,0.43248382210731506,2023-09-04 21:30:27.031542,2023-09-04 21:30:27.411287,0 days 00:00:00.379745,Tanh,ReLU,,,84,18,16.0,,,0.004460793653401991,2,291,0.2537688181619415,0.015300067558910925,321.7588381423164,COMPLETE
1127,0.3585908114910126,2023-09-04 21:30:27.411680,2023-09-04 21:30:27.722124,0 days 00:00:00.310444,Leaky,Tanh,,,75,20,8.0,,,0.017526340838951555,2,276,0.7999503057421982,0.00014255691496448906,185.65284538269043,COMPLETE
1128,0.3128032684326172,2023-09-04 21:30:27.722522,2023-09-04 21:30:27.980529,0 days 00:00:00.258007,Tanh,ReLU,,,82,19,23.0,,,0.025064527878332053,2,305,0.7715436912457809,0.0001020768435893553,901.443246459961,COMPLETE
1129,0.5841963887214661,2023-09-04 21:30:27.980943,2023-09-04 21:30:29.217320,0 days 00:00:01.236377,Leaky,Tanh,,,77,18,11.0,,,4.327572728202223e-05,2,271,0.3321484086053623,0.0002660946007008802,292.82376194352156,COMPLETE
1130,0.43111056089401245,2023-09-04 21:30:29.217734,2023-09-04 21:30:29.743894,0 days 00:00:00.526160,Tanh,Sigmoid,,,80,17,7.0,,,0.002822659791406298,2,186,0.13597254868000425,0.0037866839438164893,175.54438273111978,COMPLETE
1131,0.3541954457759857,2023-09-04 21:30:29.744286,2023-09-04 21:30:30.141679,0 days 00:00:00.397393,Tanh,Tanh,,,73,16,8.0,,,0.06551619665583934,2,283,0.5533412510552262,0.000201373189885474,170.48803774515787,COMPLETE
1132,0.2964114546775818,2023-09-04 21:30:30.142091,2023-09-04 21:30:30.739198,0 days 00:00:00.597107,Leaky,ReLU,,,85,18,5.0,,,0.009672580656799065,2,248,0.6908515553306473,0.004817798098665079,306.64795275701994,COMPLETE
1133,0.614920437335968,2023-09-04 21:30:30.739600,2023-09-04 21:30:31.862809,0 days 00:00:01.123209,Tanh,Tanh,,,80,19,10.0,,,2.4442205614196592e-05,2,205,0.44112939237716264,0.00012793477653954424,163.14038703732373,COMPLETE
1134,0.4037388265132904,2023-09-04 21:30:31.863210,2023-09-04 21:30:33.389205,0 days 00:00:01.525995,ReLU,Tanh,,,77,17,12.0,,,0.000553626201691343,2,262,0.48711761162888867,5.5875478645489816e-05,308.03236511230466,COMPLETE
1135,0.46576541662216187,2023-09-04 21:30:33.389603,2023-09-04 21:30:33.877436,0 days 00:00:00.487833,Tanh,ReLU,,,71,19,7.0,,,0.01257690227833955,2,387,0.7285701049297257,0.038234761293259104,194.07325545601222,COMPLETE
1136,0.5264264941215515,2023-09-04 21:30:33.877855,2023-09-04 21:30:33.989022,0 days 00:00:00.111167,Leaky,Tanh,,,82,18,11.0,,,0.0455129022258759,2,306,0.10956687304272175,0.0019687338991900842,229.14990107218424,COMPLETE
1137,0.4090413451194763,2023-09-04 21:30:33.989476,2023-09-04 21:30:34.236597,0 days 00:00:00.247121,Tanh,Sigmoid,,,42,16,9.0,,,0.01591448681203145,2,298,0.22870457215684828,6.939119921778822e-05,144.2823912457722,COMPLETE
1138,0.7667659521102905,2023-09-04 21:30:34.237039,2023-09-04 21:30:35.044315,0 days 00:00:00.807276,Tanh,Tanh,,,79,11,1.0,,,4.763743747032742e-05,2,223,0.2699831858196045,0.00017472942313452683,172.48605723017533,COMPLETE
1139,0.4025213122367859,2023-09-04 21:30:35.044730,2023-09-04 21:30:35.252636,0 days 00:00:00.207906,Leaky,ReLU,,,75,17,24.0,,,0.0057159226980154736,2,315,0.15462049264016517,2.850734632434283e-05,154.50733402797155,COMPLETE
1140,0.4333796501159668,2023-09-04 21:30:35.253387,2023-09-04 21:30:35.701881,0 days 00:00:00.448494,Tanh,Tanh,,,86,18,9.0,,,0.03646956918571844,2,293,0.2203891880180258,0.0004992151249024606,398.85923767089844,COMPLETE
1141,0.515236496925354,2023-09-04 21:30:35.702620,2023-09-04 21:30:38.107550,0 days 00:00:02.404930,Leaky,ReLU,,,83,15,9.0,,,0.00017757677131604427,2,166,0.7564216237839623,0.03235593299754092,132.6534693154944,COMPLETE
1142,0.32934659719467163,2023-09-04 21:30:38.107945,2023-09-04 21:30:38.313551,0 days 00:00:00.205606,Tanh,Tanh,,,73,18,10.0,,,0.02084681718047318,2,107,0.35975930105974663,0.0002940306888837408,149.99691062137998,COMPLETE
1143,0.5110385417938232,2023-09-04 21:30:38.313947,2023-09-04 21:30:38.453580,0 days 00:00:00.139633,ReLU,Sigmoid,,,78,17,8.0,,,0.029514146367482334,2,352,0.15215312400769207,0.000145081186420707,418.56968049080143,COMPLETE
1144,0.31426310539245605,2023-09-04 21:30:38.453971,2023-09-04 21:30:38.874089,0 days 00:00:00.420118,Tanh,Tanh,,,88,19,23.0,,,0.024730514112974392,2,283,0.7198425163577784,0.00010816062701884306,166.98860931396484,COMPLETE
1145,0.41652971506118774,2023-09-04 21:30:38.874512,2023-09-04 21:30:39.357596,0 days 00:00:00.483084,Leaky,ReLU,,,14,17,17.0,,,0.001757288475655969,2,232,0.14839439564236798,0.00021778384654644702,130.36438013712566,COMPLETE
1146,0.36366188526153564,2023-09-04 21:30:39.358004,2023-09-04 21:30:39.648635,0 days 00:00:00.290631,Tanh,Tanh,,,62,18,11.0,,,0.05588392124003692,2,332,0.3872904806604738,0.002938152095003452,165.10787086486818,COMPLETE
1147,0.7917907238006592,2023-09-04 21:30:39.649090,2023-09-04 21:30:40.434801,0 days 00:00:00.785711,Tanh,Tanh,,,80,20,22.0,,,1.0323809288207008e-05,2,268,0.19743015628505592,0.0003877565756804356,157.02896972200764,COMPLETE
1148,0.26806333661079407,2023-09-04 21:30:40.435218,2023-09-04 21:30:40.871094,0 days 00:00:00.435876,Leaky,ReLU,,,90,18,12.0,,,0.01736026049481548,2,491,0.761961313301139,2.1882880821545233e-05,117.62334563515402,COMPLETE
1149,0.30760741233825684,2023-09-04 21:30:40.871522,2023-09-04 21:30:41.428327,0 days 00:00:00.556805,Tanh,Sigmoid,,,77,19,8.0,,,0.020552419226271275,2,287,0.7995230492273238,0.0006748550439802441,123.73818426865797,COMPLETE
1150,0.47466790676116943,2023-09-04 21:30:41.428757,2023-09-04 21:30:41.892279,0 days 00:00:00.463522,Tanh,Tanh,,,82,16,10.0,,,0.01078432964482641,2,255,0.6647492841056672,0.045864849695474774,186.1570088313176,COMPLETE
1151,0.3242943286895752,2023-09-04 21:30:41.892685,2023-09-04 21:30:42.500996,0 days 00:00:00.608311,Leaky,Tanh,,,70,17,13.0,,,0.008371601183277708,2,320,0.7023623536078292,8.827953480391719e-05,143.65896175753684,COMPLETE
1152,0.4375635087490082,2023-09-04 21:30:42.501427,2023-09-04 21:30:43.785894,0 days 00:00:01.284467,Tanh,ReLU,,,84,19,6.0,,,0.0006567108538948105,2,275,0.47050069238403125,0.009447939928252618,162.98365868873967,COMPLETE
1153,0.3347417712211609,2023-09-04 21:30:43.786364,2023-09-04 21:30:44.678921,0 days 00:00:00.892557,ReLU,Tanh,,,75,18,24.0,,,0.0016197111076345961,2,303,0.7995812641487464,0.024367552515267524,234.40826775045957,COMPLETE
1154,0.46799740195274353,2023-09-04 21:30:44.679365,2023-09-04 21:30:44.916892,0 days 00:00:00.237527,Tanh,ReLU,,,81,16,7.0,,,0.014662330658609012,2,241,0.2929374022013492,0.00012642568926521955,152.7506795030959,COMPLETE
1155,0.28277498483657837,2023-09-04 21:30:44.917321,2023-09-04 21:30:45.352862,0 days 00:00:00.435541,Leaky,Tanh,,,72,17,23.0,,,0.03147490971929347,2,291,0.7470249513595281,0.00016741579756078485,152.63398938301282,COMPLETE
1156,0.6229445338249207,2023-09-04 21:30:45.353314,2023-09-04 21:30:47.005300,0 days 00:00:01.651986,Tanh,,,,79,18,,,,8.142802217670171e-05,1,214,0.7665122079045975,0.0023103044918978085,278.9426122291066,COMPLETE
1157,0.2862035632133484,2023-09-04 21:30:47.005714,2023-09-04 21:30:47.552370,0 days 00:00:00.546656,Leaky,Sigmoid,,,85,20,11.0,,,0.04207311132152975,2,313,0.7248939200190643,0.00010002889943881,161.15656021894034,COMPLETE
1158,0.4411773979663849,2023-09-04 21:30:47.552799,2023-09-04 21:30:48.412512,0 days 00:00:00.859713,Tanh,Tanh,,,78,17,9.0,,,0.0008800763711092922,2,98,0.6835420799198293,0.01879533300954878,228.9189991853675,COMPLETE
1159,0.8967737555503845,2023-09-04 21:30:48.412928,2023-09-04 21:30:49.133603,0 days 00:00:00.720675,Tanh,ReLU,,,75,19,8.0,,,1.3848760919757276e-05,2,373,0.11656856694792526,0.0017661157297024202,136.01820868525365,COMPLETE
1160,0.29551926255226135,2023-09-04 21:30:49.134028,2023-09-04 21:30:50.652403,0 days 00:00:01.518375,Leaky,Tanh,,,37,18,10.0,,,0.023734084786692946,2,264,0.7488128900476875,1.1365158615618607e-05,241.59990189715128,COMPLETE
1161,0.5075457692146301,2023-09-04 21:30:50.652862,2023-09-04 21:30:51.146070,0 days 00:00:00.493208,ReLU,Tanh,,,81,16,20.0,,,0.0022885799967780887,2,439,0.5924297535201949,0.07148305800842313,332.93769963582355,COMPLETE
1162,0.4470674693584442,2023-09-04 21:30:51.146492,2023-09-04 21:30:54.113061,0 days 00:00:02.966569,Tanh,ReLU,,,87,17,9.0,,,0.0003074212571358422,2,279,0.7745043273349121,0.03702279411733026,311.2018025169236,COMPLETE
1163,0.4210914373397827,2023-09-04 21:30:54.113472,2023-09-04 21:30:54.299482,0 days 00:00:00.186010,Tanh,Sigmoid,,,76,18,8.0,,,0.08128713142231149,2,253,0.16112406852406008,0.0002490147129972427,139.08596206665038,COMPLETE
