number,value,datetime_start,datetime_complete,duration,params_activation1,params_activation2,params_activation3,params_activation4,params_batch_size,params_fl1,params_fl2,params_fl3,params_fl4,params_learning_rate,params_n_layers,params_num_epochs,params_train_size,params_weight_decay,user_attrs_mre,state
841,0.4223809540271759,2023-09-04 22:15:33.961787,2023-09-04 22:15:34.618325,0 days 00:00:00.656538,Tanh,Sigmoid,Tanh,Leaky,58,16,14.0,16.0,9.0,0.016237728842630042,4,223,0.19994141391795767,0.00023833539306491607,142.68681373596192,COMPLETE
842,0.35215434432029724,2023-09-04 22:15:34.619072,2023-09-04 22:15:35.122095,0 days 00:00:00.503023,ReLU,ReLU,Tanh,,91,23,18.0,8.0,,0.05159818913594031,3,239,0.5417434705750244,0.014407407965356726,111.61951022677951,COMPLETE
843,0.3442668914794922,2023-09-04 22:15:35.122828,2023-09-04 22:15:37.136910,0 days 00:00:02.014082,Tanh,ReLU,ReLU,,28,22,13.0,24.0,,0.012825756815760462,3,272,0.7245733633172817,0.0008768039026827153,89.4041282390726,COMPLETE
844,0.3203664720058441,2023-09-04 22:15:37.137682,2023-09-04 22:15:38.564000,0 days 00:00:01.426318,ReLU,ReLU,Tanh,ReLU,30,21,15.0,9.0,9.0,0.008169323748853445,4,258,0.32284398804935965,0.003998692510124757,103.48389806502905,COMPLETE
845,0.33371907472610474,2023-09-04 22:15:38.564737,2023-09-04 22:15:40.697786,0 days 00:00:02.133049,Tanh,ReLU,Sigmoid,,21,24,17.0,15.0,,0.006458133462762183,3,248,0.33856239643959296,2.0788064602583e-05,446.7443341064453,COMPLETE
846,0.34970521926879883,2023-09-04 22:15:40.698557,2023-09-04 22:15:43.190682,0 days 00:00:02.492125,ReLU,ReLU,ReLU,,24,23,11.0,6.0,,0.02056329142079822,3,233,0.7449463134029294,1.537325586342425e-05,95.78770742108745,COMPLETE
847,0.4311380088329315,2023-09-04 22:15:43.191413,2023-09-04 22:15:44.132562,0 days 00:00:00.941149,Sigmoid,ReLU,Leaky,,26,22,19.0,7.0,,0.03211697760996412,3,262,0.13434361975442072,3.236725934862791e-05,169.402717456483,COMPLETE
848,0.3347734808921814,2023-09-04 22:15:44.133375,2023-09-04 22:15:44.946702,0 days 00:00:00.813327,Tanh,ReLU,Tanh,Tanh,93,11,16.0,14.0,21.0,0.010217628147591957,4,250,0.6420653046751309,0.0011775413914944333,112.42601172129314,COMPLETE
849,0.35130059719085693,2023-09-04 22:15:44.947459,2023-09-04 22:15:49.191264,0 days 00:00:04.243805,ReLU,ReLU,Tanh,,35,20,8.0,17.0,,0.0006201241297226753,3,271,0.6984893333359855,6.135080370045161e-05,115.59071073532104,COMPLETE
850,0.3206595182418823,2023-09-04 22:15:49.192030,2023-09-04 22:15:50.729465,0 days 00:00:01.537435,Tanh,ReLU,ReLU,,29,19,18.0,16.0,,0.005250316159714585,3,240,0.49014389910095274,0.0001362954745025883,94.67955687551787,COMPLETE
851,0.4096181392669678,2023-09-04 22:15:50.730218,2023-09-04 22:15:51.549826,0 days 00:00:00.819608,ReLU,ReLU,Tanh,Leaky,22,18,13.0,23.0,4.0,0.013474648905899155,4,153,0.1627350910529313,2.5917316043575275e-05,131.49275944150727,COMPLETE
852,0.34206119179725647,2023-09-04 22:15:51.550595,2023-09-04 22:15:53.164058,0 days 00:00:01.613463,Tanh,Leaky,Sigmoid,,24,13,20.0,22.0,,0.025284545884432255,3,183,0.7989598480631386,3.5471487816985116e-05,98.4440188937717,COMPLETE
853,0.3396112620830536,2023-09-04 22:15:53.164807,2023-09-04 22:15:56.594917,0 days 00:00:03.430110,ReLU,ReLU,ReLU,,33,23,9.0,8.0,,0.001302503769211985,3,225,0.4593196509556754,1.909198009944676e-05,118.76076731474504,COMPLETE
854,0.3051987886428833,2023-09-04 22:15:56.595652,2023-09-04 22:16:02.682722,0 days 00:00:06.087070,Tanh,ReLU,,,95,21,16.0,,,0.0008475046606775491,2,255,0.7678110787449999,0.0001532707462679173,127.84970676197725,COMPLETE
855,0.32390570640563965,2023-09-04 22:16:02.683475,2023-09-04 22:16:06.394627,0 days 00:00:03.711152,Tanh,Tanh,Tanh,ReLU,28,24,14.0,6.0,8.0,0.01702231702475164,4,244,0.7220036964417829,0.00236997985530255,101.8991819341132,COMPLETE
856,0.28225573897361755,2023-09-04 22:16:06.395387,2023-09-04 22:16:07.466137,0 days 00:00:01.070750,ReLU,ReLU,Tanh,,61,22,18.0,13.0,,0.007013646852585373,3,276,0.7675943428500195,4.6650374468264505e-05,105.00631103515624,COMPLETE
857,0.33405494689941406,2023-09-04 22:16:07.466883,2023-09-04 22:16:16.902903,0 days 00:00:09.436020,Tanh,ReLU,ReLU,,26,24,17.0,9.0,,0.00031680947431095844,3,263,0.6697660494893936,9.528395076217629e-05,104.40524763531155,COMPLETE
858,0.34270915389060974,2023-09-04 22:16:16.903656,2023-09-04 22:16:18.211169,0 days 00:00:01.307513,ReLU,Tanh,Tanh,Leaky,45,21,15.0,24.0,10.0,0.03434494724721199,4,231,0.741448526516726,7.628367648073752e-05,82.65197095003995,COMPLETE
859,0.345601886510849,2023-09-04 22:16:18.211927,2023-09-04 22:16:19.470242,0 days 00:00:01.258315,Tanh,ReLU,ReLU,,30,23,10.0,16.0,,0.008451039626100736,3,253,0.7013177613668913,0.00017517900516317338,104.6350262290553,COMPLETE
860,0.42949557304382324,2023-09-04 22:16:19.470989,2023-09-04 22:16:20.378218,0 days 00:00:00.907229,ReLU,ReLU,Sigmoid,Tanh,18,19,12.0,15.0,6.0,0.011852777137825803,4,216,0.11571349783729212,1.4411062627621566e-05,165.31726150512696,COMPLETE
861,0.33715930581092834,2023-09-04 22:16:20.378998,2023-09-04 22:16:21.416220,0 days 00:00:01.037222,Tanh,Tanh,Tanh,,25,22,11.0,6.0,,0.02245830100894833,3,242,0.2596825446433738,0.0006784391750216256,182.62729869169348,COMPLETE
862,0.3990357220172882,2023-09-04 22:16:21.416969,2023-09-04 22:16:21.934583,0 days 00:00:00.517614,ReLU,Sigmoid,Leaky,,91,20,14.0,12.0,,0.001926788678759564,3,262,0.11175385273824394,2.1730243947401603e-05,127.38178393715306,COMPLETE
863,0.4577537775039673,2023-09-04 22:16:21.935319,2023-09-04 22:16:23.578037,0 days 00:00:01.642718,Tanh,ReLU,Tanh,ReLU,32,21,13.0,7.0,5.0,0.06136151051096714,4,142,0.7987444676025237,3.144493638009962e-05,113.81661529541016,COMPLETE
864,0.35651925206184387,2023-09-04 22:16:23.578810,2023-09-04 22:16:24.506439,0 days 00:00:00.927629,ReLU,ReLU,ReLU,,36,23,7.0,16.0,,0.014884642995976395,3,237,0.7686589804923192,0.0014783142122862787,138.2673819405692,COMPLETE
865,0.3409477174282074,2023-09-04 22:16:24.507192,2023-09-04 22:16:25.811124,0 days 00:00:01.303932,Tanh,Tanh,Tanh,,27,24,19.0,17.0,,0.04144662181196424,3,251,0.7324912863636014,5.573047771643649e-05,137.14051729090073,COMPLETE
866,0.403898149728775,2023-09-04 22:16:25.811900,2023-09-04 22:16:26.670374,0 days 00:00:00.858474,ReLU,ReLU,ReLU,Leaky,22,22,16.0,14.0,19.0,0.004502430471048289,4,228,0.1308727142548624,0.0035053526195364436,140.03279192019733,COMPLETE
867,0.2703622281551361,2023-09-04 22:16:26.671166,2023-09-04 22:16:29.115940,0 days 00:00:02.444774,Tanh,ReLU,Tanh,,29,20,10.0,19.0,,0.005848303778689086,3,267,0.7112711265864711,2.6048524474199597e-05,91.664353288923,COMPLETE
868,0.3466559946537018,2023-09-04 22:16:29.116734,2023-09-04 22:16:31.631184,0 days 00:00:02.514450,Tanh,Tanh,Sigmoid,,29,20,10.0,18.0,,0.005862927845036619,3,269,0.7511700117344657,1.725768788628763e-05,107.74871190388997,COMPLETE
869,0.34296298027038574,2023-09-04 22:16:31.632043,2023-09-04 22:16:32.881213,0 days 00:00:01.249170,Tanh,ReLU,Tanh,,30,20,9.0,20.0,,0.005066963513110196,3,278,0.30762540774957026,2.3908505056973578e-05,110.8259902581936,COMPLETE
870,0.37968406081199646,2023-09-04 22:16:32.881977,2023-09-04 22:16:35.041238,0 days 00:00:02.159261,Tanh,ReLU,ReLU,Sigmoid,28,20,10.0,19.0,23.0,0.006996798283598753,4,299,0.5075067920808297,0.012287225813615608,109.53320889859586,COMPLETE
871,0.42393040657043457,2023-09-04 22:16:35.042008,2023-09-04 22:16:36.176164,0 days 00:00:01.134156,Tanh,Tanh,Tanh,,31,20,10.0,19.0,,0.005877319285757054,3,283,0.15285613818588856,0.05859333599152338,130.5555016801164,COMPLETE
872,0.3336411714553833,2023-09-04 22:16:36.176937,2023-09-04 22:16:40.753487,0 days 00:00:04.576550,Tanh,ReLU,Tanh,,27,19,11.0,19.0,,0.004098972873674722,3,289,0.7126009054189958,2.7338103270585407e-05,108.64901868034812,COMPLETE
873,0.2690408527851105,2023-09-04 22:16:40.754223,2023-09-04 22:16:42.718982,0 days 00:00:01.964759,Tanh,ReLU,ReLU,Tanh,30,20,11.0,19.0,7.0,0.008556263423011601,4,273,0.7703990725735936,1.2314834325799818e-05,91.9701280593872,COMPLETE
874,0.3085188567638397,2023-09-04 22:16:42.719761,2023-09-04 22:16:45.339044,0 days 00:00:02.619283,Tanh,ReLU,ReLU,Tanh,32,20,11.0,19.0,8.0,0.00831137753678276,4,280,0.7724487573300014,1.231762595732967e-05,89.99840096866383,COMPLETE
875,0.30661389231681824,2023-09-04 22:16:45.339825,2023-09-04 22:16:50.632059,0 days 00:00:05.292234,Tanh,ReLU,ReLU,Tanh,31,21,11.0,19.0,7.0,0.006841558125153386,4,291,0.7698062336601841,1.3022627417504237e-05,111.242663839589,COMPLETE
876,0.36898279190063477,2023-09-04 22:16:50.632834,2023-09-04 22:16:51.756458,0 days 00:00:01.123624,Tanh,ReLU,ReLU,Tanh,29,20,10.0,19.0,7.0,0.008896291119982405,4,275,0.28698667951623896,1.2329705098230154e-05,133.30583572387695,COMPLETE
877,0.31028270721435547,2023-09-04 22:16:51.757270,2023-09-04 22:16:54.628803,0 days 00:00:02.871533,Tanh,ReLU,ReLU,Tanh,25,21,11.0,20.0,9.0,0.00990588837415327,4,313,0.7969806953421459,0.0007734419546428457,75.42061825456291,COMPLETE
878,0.3645699918270111,2023-09-04 22:16:54.629603,2023-09-04 22:16:55.393481,0 days 00:00:00.763878,Tanh,ReLU,ReLU,Tanh,33,21,11.0,18.0,6.0,0.007457425603942663,4,275,0.2714366605681678,1.4962177321756215e-05,1144.0042830757473,COMPLETE
879,0.292721152305603,2023-09-04 22:16:55.394266,2023-09-04 22:16:57.261711,0 days 00:00:01.867445,Tanh,ReLU,ReLU,Tanh,24,20,10.0,20.0,11.0,0.005302177835953641,4,285,0.7458113774381626,1.1229525586595918e-05,90.91067223799855,COMPLETE
880,0.29776981472969055,2023-09-04 22:16:57.262496,2023-09-04 22:17:01.778832,0 days 00:00:04.516336,Tanh,ReLU,ReLU,Tanh,27,20,11.0,18.0,7.0,0.008894046008673896,4,266,0.7653776937941844,1.0048557017672058e-05,98.4059454000221,COMPLETE
881,0.3138534128665924,2023-09-04 22:17:01.779603,2023-09-04 22:17:03.593184,0 days 00:00:01.813581,Tanh,ReLU,ReLU,Tanh,30,21,12.0,21.0,8.0,0.006500641325784102,4,271,0.36901187603434116,0.0010681965992734332,103.8323952568902,COMPLETE
882,0.34163880348205566,2023-09-04 22:17:03.593963,2023-09-04 22:17:15.426099,0 days 00:00:11.832136,Tanh,ReLU,ReLU,Tanh,26,20,3.0,18.0,9.0,0.00039252153355664543,4,276,0.7240928456119455,1.562404320853183e-05,116.00159895760673,COMPLETE
883,0.3330661654472351,2023-09-04 22:17:15.426883,2023-09-04 22:17:16.104097,0 days 00:00:00.677214,Tanh,ReLU,ReLU,Tanh,96,21,10.0,18.0,6.0,0.00590749416042346,4,301,0.2371750091435707,1.8139371962145916e-05,2351.143622865068,COMPLETE
884,0.38593533635139465,2023-09-04 22:17:16.104881,2023-09-04 22:17:16.958108,0 days 00:00:00.853227,Tanh,ReLU,ReLU,ReLU,51,21,9.0,20.0,8.0,0.0045528304764777105,4,270,0.12701737932751903,0.00023946835872606204,146.92269270387413,COMPLETE
885,0.3000839352607727,2023-09-04 22:17:16.958904,2023-09-04 22:17:19.202095,0 days 00:00:02.243191,Tanh,ReLU,ReLU,Leaky,93,22,12.0,19.0,4.0,0.010559652311826201,4,282,0.7737848657763352,0.003203332512118653,103.4739031791687,COMPLETE
886,0.32686254382133484,2023-09-04 22:17:19.202863,2023-09-04 22:17:22.069171,0 days 00:00:02.866308,Tanh,ReLU,ReLU,Tanh,20,20,10.0,19.0,9.0,0.0076277260720869254,4,169,0.7979117183575887,0.00018879756849110813,103.10175482432048,COMPLETE
887,0.30533209443092346,2023-09-04 22:17:22.069922,2023-09-04 22:17:23.706516,0 days 00:00:01.636594,Tanh,ReLU,ReLU,ReLU,74,21,11.0,17.0,5.0,0.010237377805741122,4,293,0.5477948970500115,1.2892320493307572e-05,105.19569072016964,COMPLETE
888,0.2952958345413208,2023-09-04 22:17:23.707280,2023-09-04 22:17:37.454882,0 days 00:00:13.747602,Tanh,ReLU,Sigmoid,Leaky,28,23,11.0,21.0,10.0,0.0005495340020395456,4,261,0.7426817974302967,0.0003386137828428177,88.75640664236886,COMPLETE
889,0.5319992303848267,2023-09-04 22:17:37.455636,2023-09-04 22:17:45.478735,0 days 00:00:08.023099,Tanh,ReLU,Leaky,Tanh,22,22,10.0,18.0,11.0,2.061954927834749e-05,4,270,0.2132039455198952,0.0005002574701137289,303.8334276552554,COMPLETE
890,0.3344666659832001,2023-09-04 22:17:45.479522,2023-09-04 22:17:48.105541,0 days 00:00:02.626019,Tanh,Leaky,ReLU,ReLU,24,20,12.0,20.0,7.0,0.0077467364055443565,4,265,0.3491664003112728,0.0009577454584035926,105.29543462292901,COMPLETE
891,0.38216668367385864,2023-09-04 22:17:48.106331,2023-09-04 22:17:53.731801,0 days 00:00:05.625470,Tanh,ReLU,ReLU,Leaky,30,24,9.0,19.0,8.0,0.0037660033688439267,4,194,0.7419922064478804,0.02330395139595014,107.0049450465611,COMPLETE
892,0.3016439378261566,2023-09-04 22:17:53.732586,2023-09-04 22:17:55.715938,0 days 00:00:01.983352,Tanh,ReLU,ReLU,Sigmoid,33,23,9.0,19.0,9.0,0.052956060580892715,4,260,0.7673963133716842,1.575431982368577e-05,105.64205551147461,COMPLETE
893,0.3872392475605011,2023-09-04 22:17:55.716724,2023-09-04 22:17:56.484852,0 days 00:00:00.768128,Tanh,ReLU,Sigmoid,Tanh,28,21,12.0,21.0,3.0,0.005549268427538581,4,278,0.14031553304921265,0.0018983373828331668,226.47361403245193,COMPLETE
894,0.3459082245826721,2023-09-04 22:17:56.485615,2023-09-04 22:18:01.716758,0 days 00:00:05.231143,Tanh,ReLU,ReLU,ReLU,26,22,10.0,18.0,6.0,0.006315331018910581,4,205,0.7028281866467464,3.842353114464461e-05,97.116698234312,COMPLETE
895,0.6695215702056885,2023-09-04 22:18:01.717560,2023-09-04 22:18:13.581711,0 days 00:00:11.864151,Tanh,ReLU,ReLU,Leaky,31,24,11.0,17.0,12.0,1.0358333426628816e-05,4,287,0.4232848956531029,0.000604730712129939,106.60113926797794,COMPLETE
896,0.38884201645851135,2023-09-04 22:18:13.582500,2023-09-04 22:18:14.198758,0 days 00:00:00.616258,Tanh,ReLU,Leaky,ReLU,80,20,11.0,22.0,7.0,0.008853896657768659,4,259,0.2027638429390136,1.9967210770192627e-05,731.8465033242869,COMPLETE
897,0.29923349618911743,2023-09-04 22:18:14.199523,2023-09-04 22:18:15.980025,0 days 00:00:01.780502,Tanh,Sigmoid,,,23,23,12.0,,,0.01141939364127757,2,161,0.7712032539043947,2.9714598461125112e-05,107.70983306884766,COMPLETE
898,0.3422837555408478,2023-09-04 22:18:15.980767,2023-09-04 22:18:19.754063,0 days 00:00:03.773296,Tanh,ReLU,Sigmoid,Tanh,29,22,8.0,22.0,17.0,0.0006534363818809363,4,268,0.7220808418413339,0.0003009405234827266,101.16752344248246,COMPLETE
899,0.3130570650100708,2023-09-04 22:18:19.754828,2023-09-04 22:18:21.273769,0 days 00:00:01.518941,Tanh,ReLU,ReLU,Leaky,68,24,10.0,18.0,10.0,0.0028482945194213552,4,256,0.6691313401423227,2.348744156230237e-05,157.5641166491386,COMPLETE
900,0.3278011381626129,2023-09-04 22:18:21.274557,2023-09-04 22:18:23.116847,0 days 00:00:01.842290,Tanh,ReLU,ReLU,ReLU,49,21,9.0,17.0,8.0,0.004882603588792183,4,174,0.7999009424817152,1.3877581449753255e-05,98.64030241966248,COMPLETE
901,0.34983882308006287,2023-09-04 22:18:23.117617,2023-09-04 22:18:24.361056,0 days 00:00:01.243439,Sigmoid,,,,34,23,,,,0.036995210505476085,1,251,0.7994310628775769,0.0004126902206702996,117.33048274599273,COMPLETE
902,0.3125789165496826,2023-09-04 22:18:24.361778,2023-09-04 22:18:30.903321,0 days 00:00:06.541543,Tanh,ReLU,Sigmoid,Tanh,26,19,13.0,20.0,22.0,0.0016021563126740936,4,268,0.7453654773433782,4.555633276878233e-05,93.56854408665707,COMPLETE
903,0.3721805214881897,2023-09-04 22:18:30.904171,2023-09-04 22:18:31.562071,0 days 00:00:00.657900,Tanh,ReLU,ReLU,,90,20,14.0,5.0,,0.007060330309940164,3,214,0.1862957939456463,9.211106245772843e-05,136.67884192833534,COMPLETE
904,0.38360631465911865,2023-09-04 22:18:31.562829,2023-09-04 22:18:36.864251,0 days 00:00:05.301422,Tanh,ReLU,ReLU,Leaky,20,22,9.0,6.0,1.0,0.0021251887904239343,4,278,0.6899092585198883,0.00010967788259149449,115.77951654398217,COMPLETE
905,0.33621591329574585,2023-09-04 22:18:36.865016,2023-09-04 22:18:37.776740,0 days 00:00:00.911724,Tanh,ReLU,Leaky,,96,24,12.0,23.0,,0.009088416027528511,3,260,0.5759817981792048,0.0012702482552009535,90.51118596394856,COMPLETE
906,0.45776495337486267,2023-09-04 22:18:37.777481,2023-09-04 22:18:38.064004,0 days 00:00:00.286523,Tanh,ReLU,ReLU,,93,21,11.0,16.0,,0.04410390911371585,3,253,0.1214520873975909,0.0381302191972157,112.86238919771634,COMPLETE
907,0.49263039231300354,2023-09-04 22:18:38.064772,2023-09-04 22:18:39.377693,0 days 00:00:01.312921,Tanh,ReLU,Sigmoid,,25,23,12.0,21.0,,0.07802679801006639,3,182,0.7422890001420669,0.01038612589548307,121.80751037597656,COMPLETE
908,0.3220386505126953,2023-09-04 22:18:39.378443,2023-09-04 22:18:42.334421,0 days 00:00:02.955978,Tanh,Leaky,Tanh,ReLU,28,22,13.0,19.0,11.0,0.0012993996211683742,4,244,0.3824883623426365,7.504151191822324e-05,114.44146562659222,COMPLETE
909,0.5167674422264099,2023-09-04 22:18:42.335192,2023-09-04 22:18:53.602586,0 days 00:00:11.267394,Tanh,ReLU,ReLU,,32,20,10.0,5.0,,1.5763754028762214e-05,3,221,0.6350300745568297,0.004863964707572091,112.8958647369799,COMPLETE
910,0.7044336795806885,2023-09-04 22:18:53.603361,2023-09-04 22:19:03.045379,0 days 00:00:09.442018,Tanh,ReLU,Tanh,Sigmoid,23,19,13.0,7.0,5.0,2.27473296568466e-05,4,293,0.2535538535018935,1.820401348782883e-05,130.58000435682695,COMPLETE
911,0.4053577780723572,2023-09-04 22:19:03.046163,2023-09-04 22:19:05.231049,0 days 00:00:02.184886,Sigmoid,ReLU,ReLU,,84,21,11.0,17.0,,0.004577657761801368,3,264,0.379200945898249,0.0007893578525130723,120.2704316844111,COMPLETE
912,0.3396964371204376,2023-09-04 22:19:05.231822,2023-09-04 22:19:08.078356,0 days 00:00:02.846534,Tanh,ReLU,Tanh,,30,24,10.0,16.0,,0.011415880226958022,3,151,0.717616308174377,0.008191292834005928,114.26941805107649,COMPLETE
913,0.3171350061893463,2023-09-04 22:19:08.079136,2023-09-04 22:19:11.792606,0 days 00:00:03.713470,Tanh,ReLU,Sigmoid,,27,20,14.0,5.0,,0.0037146194553586095,3,233,0.799272644912576,3.882509945417443e-05,146.07237430494658,COMPLETE
914,0.2538987696170807,2023-09-04 22:19:11.793387,2023-09-04 22:19:16.852375,0 days 00:00:05.058988,Tanh,ReLU,ReLU,Leaky,21,22,8.0,6.0,10.0,0.006235177800732928,4,248,0.7680156542980315,1.1799512498371417e-05,81.23971621195476,COMPLETE
915,0.37730562686920166,2023-09-04 22:19:16.853154,2023-09-04 22:19:18.204175,0 days 00:00:01.351021,Tanh,ReLU,ReLU,Leaky,16,22,7.0,20.0,10.0,0.005334298151491209,4,240,0.16598221966597212,1.1354691290303575e-05,152.9717254638672,COMPLETE
916,0.36129656434059143,2023-09-04 22:19:18.204957,2023-09-04 22:19:19.636178,0 days 00:00:01.431221,Tanh,ReLU,Tanh,Leaky,14,22,8.0,6.0,9.0,0.006360325678354897,4,246,0.19114121526755776,1.1434648936746161e-05,167.24243927001953,COMPLETE
917,0.44148460030555725,2023-09-04 22:19:19.636967,2023-09-04 22:19:22.831352,0 days 00:00:03.194385,Tanh,ReLU,Tanh,Leaky,20,21,7.0,18.0,12.0,6.927818656019628e-05,4,135,0.1535897513046253,1.020097024585529e-05,289.6198238796658,COMPLETE
918,0.4181113839149475,2023-09-04 22:19:22.832139,2023-09-04 22:19:36.641385,0 days 00:00:13.809246,Tanh,Sigmoid,ReLU,Leaky,22,22,8.0,7.0,10.0,0.00014768619247191003,4,238,0.4370318513448756,1.3923075351445405e-05,121.11337818818934,COMPLETE
919,0.3565344512462616,2023-09-04 22:19:36.642203,2023-09-04 22:19:37.811033,0 days 00:00:01.168830,Tanh,ReLU,Leaky,Leaky,17,22,9.0,17.0,8.0,0.006963812952951652,4,229,0.2230268446941948,1.552210529234146e-05,126.65618783456308,COMPLETE
920,0.4266797602176666,2023-09-04 22:19:37.811815,2023-09-04 22:19:38.561587,0 days 00:00:00.749772,Tanh,ReLU,Tanh,Leaky,21,21,8.0,16.0,11.0,0.0075133498678768935,4,247,0.11014285735816769,0.018464576359480046,338.2633861965603,COMPLETE
921,0.3129129111766815,2023-09-04 22:19:38.562354,2023-09-04 22:19:43.044467,0 days 00:00:04.482113,Tanh,ReLU,Sigmoid,Leaky,22,21,8.0,15.0,9.0,0.005415571237813687,4,252,0.7637889138922317,1.288558735562794e-05,100.83075939525257,COMPLETE
922,0.318668395280838,2023-09-04 22:19:43.045312,2023-09-04 22:19:45.707884,0 days 00:00:02.662572,ReLU,ReLU,ReLU,Leaky,20,22,8.0,23.0,9.0,0.008484423530096319,4,236,0.7689916132636233,1.5445584229044085e-05,100.29719244915506,COMPLETE
923,0.33715471625328064,2023-09-04 22:19:45.708661,2023-09-04 22:20:03.297130,0 days 00:00:17.588469,Tanh,ReLU,Tanh,Leaky,17,22,7.0,6.0,6.0,0.00013985862355735617,4,218,0.7998595930315876,0.00014935631404810033,90.33317215530961,COMPLETE
924,0.32127735018730164,2023-09-04 22:20:03.297917,2023-09-04 22:20:05.990403,0 days 00:00:02.692486,Tanh,ReLU,ReLU,Leaky,23,22,9.0,7.0,7.0,0.004279975333905182,4,225,0.4654601634389877,1.975001475632228e-05,111.81799653519032,COMPLETE
925,0.4056938588619232,2023-09-04 22:20:05.991288,2023-09-04 22:20:13.854898,0 days 00:00:07.863610,ReLU,ReLU,Tanh,Tanh,21,21,8.0,17.0,10.0,0.00011826256340623725,4,248,0.23987184935038314,1.1858068329965171e-05,121.88501493809586,COMPLETE
926,0.31993791460990906,2023-09-04 22:20:13.855680,2023-09-04 22:20:16.597875,0 days 00:00:02.742195,Tanh,ReLU,Tanh,Leaky,18,21,9.0,21.0,8.0,0.006226003059252669,4,239,0.7224227297275639,1.7133327942122294e-05,89.53121881899627,COMPLETE
927,1.0031368732452393,2023-09-04 22:20:16.598661,2023-09-04 22:20:17.985496,0 days 00:00:01.386835,Sigmoid,Leaky,ReLU,ReLU,19,20,8.0,18.0,7.0,0.009877977127260476,4,258,0.6866799837672525,0.04041794926570034,100.49688998135653,COMPLETE
928,0.37739890813827515,2023-09-04 22:20:17.986279,2023-09-04 22:20:19.136620,0 days 00:00:01.150341,ReLU,ReLU,Sigmoid,Tanh,24,22,9.0,6.0,8.0,0.007974239820109912,4,230,0.1703212206685928,0.0005293509478508958,126.02158919624661,COMPLETE
929,0.31006407737731934,2023-09-04 22:20:19.137442,2023-09-04 22:20:22.474402,0 days 00:00:03.336960,Tanh,Tanh,Tanh,Leaky,25,21,8.0,16.0,10.0,0.003011252968822533,4,247,0.4939077948922235,2.2660435798839198e-05,97.70811012813023,COMPLETE
930,0.3995969891548157,2023-09-04 22:20:22.475190,2023-09-04 22:20:24.767789,0 days 00:00:02.292599,Tanh,ReLU,ReLU,ReLU,24,20,11.0,22.0,12.0,0.0048017410428286035,4,209,0.2662762574246352,1.363798961392679e-05,88.37112510204315,COMPLETE
931,0.2800034284591675,2023-09-04 22:20:24.768572,2023-09-04 22:20:41.974233,0 days 00:00:17.205661,ReLU,ReLU,Tanh,Tanh,26,23,10.0,19.0,11.0,0.00019190441193812967,4,255,0.7463819155240696,1.6729900698924917e-05,87.60315076042625,COMPLETE
932,0.31962841749191284,2023-09-04 22:20:41.975033,2023-09-04 22:20:46.548344,0 days 00:00:04.573311,Tanh,Tanh,ReLU,Leaky,22,19,7.0,23.0,9.0,0.01157395092451485,4,189,0.7713107130088815,0.00011860920596851896,108.18606047196822,COMPLETE
