number,value,datetime_start,datetime_complete,duration,params_activation1,params_activation2,params_activation3,params_activation4,params_batch_size,params_fl1,params_fl2,params_fl3,params_fl4,params_learning_rate,params_n_layers,params_num_epochs,params_train_size,params_weight_decay,user_attrs_mre,state
179,0.5063363313674927,2023-09-04 22:10:57.757738,2023-09-04 22:10:58.216133,0 days 00:00:00.458395,Leaky,Sigmoid,Sigmoid,Leaky,23,20,24.0,17.0,17.0,0.024110991804960832,4,226,0.2118675994619769,0.0001273988564883764,488.37476535373264,COMPLETE
180,0.4780288338661194,2023-09-04 22:10:58.216445,2023-09-04 22:10:58.438136,0 days 00:00:00.221691,Leaky,Tanh,Sigmoid,Sigmoid,95,24,21.0,23.0,13.0,0.09230520577938511,4,324,0.7152052172189205,0.00048312771461833,157.19999270968967,COMPLETE
181,0.37436002492904663,2023-09-04 22:10:58.438466,2023-09-04 22:10:59.036055,0 days 00:00:00.597589,Leaky,Leaky,Sigmoid,Leaky,43,15,20.0,16.0,16.0,0.008838380373851868,4,275,0.6568085459533386,0.00024352201892275852,125.00904911586217,COMPLETE
182,0.25954669713974,2023-09-04 22:10:59.036370,2023-09-04 22:11:01.075920,0 days 00:00:02.039550,Leaky,Leaky,Sigmoid,Leaky,41,12,19.0,16.0,16.0,0.0051851705933256085,4,272,0.6956341251216658,0.00017185597824900264,101.4835160628609,COMPLETE
183,0.33089977502822876,2023-09-04 22:11:01.076268,2023-09-04 22:11:02.282965,0 days 00:00:01.206697,Leaky,Leaky,Sigmoid,Leaky,37,12,19.0,16.0,17.0,0.005832595139905824,4,254,0.7688474210962003,0.00016416660340127715,134.72465612238105,COMPLETE
184,0.3031022250652313,2023-09-04 22:11:02.283293,2023-09-04 22:11:03.266166,0 days 00:00:00.982873,Leaky,Leaky,Sigmoid,Leaky,40,8,18.0,22.0,15.0,0.006932728662822264,4,238,0.6890694722542059,0.0001918306111513749,145.6174677722859,COMPLETE
185,0.33769187331199646,2023-09-04 22:11:03.266506,2023-09-04 22:11:03.553307,0 days 00:00:00.286801,Leaky,Leaky,Sigmoid,Leaky,85,11,19.0,21.0,10.0,0.014407047198016965,4,291,0.6213887592127529,8.817306807567418e-05,136.45793999565973,COMPLETE
186,0.4217948615550995,2023-09-04 22:11:03.553630,2023-09-04 22:11:03.929016,0 days 00:00:00.375386,Tanh,Leaky,Tanh,Leaky,37,18,17.0,17.0,17.0,0.0193301630131378,4,268,0.7200416337932493,0.00015360409429495246,127.09251852596508,COMPLETE
187,0.4541814625263214,2023-09-04 22:11:03.929335,2023-09-04 22:11:04.891965,0 days 00:00:00.962630,Leaky,Leaky,Sigmoid,Sigmoid,41,22,20.0,16.0,12.0,0.00478990394248342,4,285,0.7485427915086686,0.000645449200162538,115.72445370288605,COMPLETE
188,0.35501083731651306,2023-09-04 22:11:04.892295,2023-09-04 22:11:06.589206,0 days 00:00:01.696911,Leaky,Sigmoid,Sigmoid,ReLU,26,20,19.0,16.0,7.0,0.011315248927499699,4,120,0.6529675005203659,0.00029379350679415675,109.72983676284107,COMPLETE
189,0.4146261513233185,2023-09-04 22:11:06.589544,2023-09-04 22:11:06.911982,0 days 00:00:00.322438,Sigmoid,Tanh,Leaky,Leaky,98,14,23.0,15.0,11.0,0.015839249185066035,4,298,0.43634392372657294,0.0001102738733014027,156.44910481770833,COMPLETE
190,0.47010114789009094,2023-09-04 22:11:06.912323,2023-09-04 22:11:07.979282,0 days 00:00:01.066959,Leaky,ReLU,Sigmoid,Leaky,92,9,18.0,14.0,8.0,0.00048411667278002563,4,199,0.7723251994220891,0.00020424981330571958,136.05564278050474,COMPLETE
191,0.30861198902130127,2023-09-04 22:11:07.979602,2023-09-04 22:11:08.708813,0 days 00:00:00.729211,Leaky,Leaky,Sigmoid,Leaky,42,12,20.0,16.0,16.0,0.00917776339510303,4,273,0.6956262352665669,0.00023035957449689306,125.21167087554932,COMPLETE
192,0.32274603843688965,2023-09-04 22:11:08.709130,2023-09-04 22:11:09.665940,0 days 00:00:00.956810,Leaky,Leaky,Sigmoid,Leaky,39,13,21.0,17.0,16.0,0.010494086852210366,4,260,0.6852287746366617,0.00026992163331838114,166.3199090576172,COMPLETE
193,0.26993459463119507,2023-09-04 22:11:09.666279,2023-09-04 22:11:10.638467,0 days 00:00:00.972188,Leaky,Leaky,Sigmoid,Leaky,42,12,20.0,16.0,16.0,0.007965503572504282,4,281,0.7267784724188076,0.00016764092853968718,162.61673384446365,COMPLETE
194,0.45778194069862366,2023-09-04 22:11:10.638891,2023-09-04 22:11:12.614280,0 days 00:00:01.975389,Leaky,Leaky,Sigmoid,Leaky,35,12,22.0,15.0,18.0,0.005185554739110092,4,307,0.7720248681927029,0.00017456409139261826,127.54892860759388,COMPLETE
195,0.25125378370285034,2023-09-04 22:11:12.614595,2023-09-04 22:11:14.230812,0 days 00:00:01.616217,Leaky,Leaky,Sigmoid,Sigmoid,38,11,19.0,22.0,9.0,0.0037941823785220714,4,99,0.7307609129254931,0.00013255406928205587,171.3799627350598,COMPLETE
196,0.3334178626537323,2023-09-04 22:11:14.231130,2023-09-04 22:11:15.440638,0 days 00:00:01.209508,Tanh,Leaky,Sigmoid,Sigmoid,31,11,19.0,22.0,9.0,0.0040506372543609075,4,318,0.7991178067591711,0.00012999557679655016,102.65096365887186,COMPLETE
197,0.3206893503665924,2023-09-04 22:11:15.440956,2023-09-04 22:11:15.901512,0 days 00:00:00.460556,Leaky,Leaky,Tanh,Sigmoid,62,21,18.0,22.0,10.0,0.0036984530436676047,4,213,0.736149461923527,0.0005582353061083693,128.26064128260458,COMPLETE
198,0.35839900374412537,2023-09-04 22:11:15.901839,2023-09-04 22:11:17.123344,0 days 00:00:01.221505,Leaky,Sigmoid,Sigmoid,Sigmoid,34,10,17.0,21.0,8.0,0.00587038980209451,4,334,0.6588535205459115,0.0009623493367394369,163.960455222208,COMPLETE
199,0.3127325177192688,2023-09-04 22:11:17.123667,2023-09-04 22:11:17.520257,0 days 00:00:00.396590,Leaky,Leaky,Sigmoid,Sigmoid,37,11,11.0,23.0,9.0,0.012997188136025503,4,90,0.3485379208751775,0.0001361957048726867,109.17109102816195,COMPLETE
200,0.48266375064849854,2023-09-04 22:11:17.520570,2023-09-04 22:11:18.083571,0 days 00:00:00.563001,Leaky,Tanh,Sigmoid,Sigmoid,88,10,19.0,22.0,10.0,0.01897083824776823,4,109,0.7032664507444211,0.0003764875214330668,137.38323181750727,COMPLETE
201,0.3338399827480316,2023-09-04 22:11:18.083916,2023-09-04 22:11:18.886734,0 days 00:00:00.802818,Leaky,Leaky,Sigmoid,Tanh,42,12,20.0,21.0,15.0,0.006861128865365603,4,283,0.7277638416499235,0.00016759723423395562,190.56303429603577,COMPLETE
202,0.3871614336967468,2023-09-04 22:11:18.887058,2023-09-04 22:11:19.727694,0 days 00:00:00.840636,Leaky,Leaky,Sigmoid,Leaky,39,11,20.0,16.0,6.0,0.008095370777149747,4,70,0.7451542878470263,0.00020244328554203206,130.83945445525342,COMPLETE
203,0.34463807940483093,2023-09-04 22:11:19.728025,2023-09-04 22:11:21.119093,0 days 00:00:01.391068,Leaky,Leaky,Sigmoid,Leaky,38,12,19.0,15.0,12.0,0.014637556227628683,4,163,0.7662921568378919,0.000156876114147197,95.43383922274151,COMPLETE
204,0.419219970703125,2023-09-04 22:11:21.119418,2023-09-04 22:11:21.975207,0 days 00:00:00.855789,ReLU,Leaky,Sigmoid,Sigmoid,47,13,21.0,9.0,21.0,0.000896940700549379,4,50,0.7196377241530758,0.00012321783465860055,154.59843964272358,COMPLETE
205,0.31560924649238586,2023-09-04 22:11:21.975662,2023-09-04 22:11:22.840458,0 days 00:00:00.864796,Leaky,Leaky,Sigmoid,Leaky,35,11,5.0,14.0,8.0,0.021571024754987848,4,293,0.635673973590772,0.0002337901004399662,117.03023333882176,COMPLETE
206,0.44727569818496704,2023-09-04 22:11:22.840799,2023-09-04 22:11:23.837188,0 days 00:00:00.996389,Leaky,Leaky,Sigmoid,Sigmoid,44,20,20.0,20.0,11.0,0.0012002453724596865,4,100,0.6003749308372803,0.0007768783088033239,123.38722105949155,COMPLETE
207,0.3009021580219269,2023-09-04 22:11:23.837516,2023-09-04 22:11:25.928088,0 days 00:00:02.090572,Tanh,ReLU,Sigmoid,Leaky,40,21,19.0,13.0,10.0,0.00241560038275798,4,234,0.6708944323802185,9.53852045474731e-05,100.12767973733604,COMPLETE
208,0.3661474883556366,2023-09-04 22:11:25.928453,2023-09-04 22:11:26.185052,0 days 00:00:00.256599,Leaky,Leaky,Tanh,Leaky,90,22,19.0,8.0,7.0,0.027329787850567243,4,265,0.4188825233654606,0.00018178312761818713,124.76777267456055,COMPLETE
209,0.30451270937919617,2023-09-04 22:11:26.185366,2023-09-04 22:11:27.138074,0 days 00:00:00.952708,Leaky,Sigmoid,,,32,19,18.0,,,0.012252295078358256,2,328,0.7756537197104164,0.00044350043372009103,139.28131408691405,COMPLETE
210,0.33725112676620483,2023-09-04 22:11:27.138395,2023-09-04 22:11:28.163483,0 days 00:00:01.025088,Leaky,Tanh,Leaky,ReLU,36,13,22.0,24.0,9.0,0.007857891898362734,4,315,0.7999156621937433,0.000308485727216694,628.2204002380371,COMPLETE
211,0.25797387957572937,2023-09-04 22:11:28.163813,2023-09-04 22:11:31.050699,0 days 00:00:02.886886,Leaky,Leaky,Sigmoid,Leaky,42,12,20.0,16.0,15.0,0.009481829919067469,4,251,0.69421000894429,0.00020407366124098288,112.26711038442758,COMPLETE
212,0.34054288268089294,2023-09-04 22:11:31.051247,2023-09-04 22:11:33.102504,0 days 00:00:02.051257,Leaky,Leaky,Sigmoid,Leaky,43,12,20.0,16.0,14.0,0.010004351437659865,4,248,0.7134662772340741,0.00021303796919588413,121.43964606837223,COMPLETE
213,0.2781236469745636,2023-09-04 22:11:33.103148,2023-09-04 22:11:35.772308,0 days 00:00:02.669160,Leaky,Leaky,Sigmoid,Leaky,38,12,21.0,17.0,15.0,0.00648453181859384,4,256,0.6823186614154167,0.00014632847699867711,119.69892552693685,COMPLETE
214,0.22068186104297638,2023-09-04 22:11:35.772641,2023-09-04 22:11:36.480527,0 days 00:00:00.707886,Leaky,Leaky,Sigmoid,Leaky,41,11,20.0,16.0,16.0,0.016002259051603174,4,280,0.742116611117375,0.00018555599701734673,96.1886226109096,COMPLETE
215,0.5114946961402893,2023-09-04 22:11:36.480871,2023-09-04 22:11:37.419857,0 days 00:00:00.938986,Leaky,Leaky,Sigmoid,Sigmoid,39,10,19.0,15.0,15.0,0.016645015290882467,4,226,0.7487197851847929,0.00022768860802000333,125.53381152863199,COMPLETE
216,0.35207098722457886,2023-09-04 22:11:37.420178,2023-09-04 22:11:38.584282,0 days 00:00:01.164104,Leaky,Leaky,Sigmoid,Leaky,41,11,21.0,17.0,11.0,0.015199748703389828,4,270,0.6429965755477411,0.0006679070563573276,204.206310215281,COMPLETE
217,0.32261714339256287,2023-09-04 22:11:38.584826,2023-09-04 22:11:39.315923,0 days 00:00:00.731097,Leaky,Leaky,Sigmoid,Leaky,70,20,20.0,15.0,9.0,0.012813261211112665,4,249,0.6949559202142812,0.00026371019457888795,103.58405031476703,COMPLETE
218,0.30788654088974,2023-09-04 22:11:39.316271,2023-09-04 22:11:39.956592,0 days 00:00:00.640321,Tanh,Leaky,ReLU,Sigmoid,84,10,17.0,3.0,14.0,0.019625382720890417,4,345,0.526462143449906,0.0005213872419703337,166.06914249219392,COMPLETE
219,0.2863388955593109,2023-09-04 22:11:39.956969,2023-09-04 22:11:40.434266,0 days 00:00:00.477297,Leaky,ReLU,Sigmoid,Leaky,86,21,19.0,22.0,13.0,0.03506364494339945,4,242,0.7652132043654128,0.00018827037173513704,96.84985478719075,COMPLETE
220,0.3602185547351837,2023-09-04 22:11:40.434600,2023-09-04 22:11:41.296183,0 days 00:00:00.861583,Leaky,Sigmoid,Sigmoid,Sigmoid,37,11,18.0,12.0,10.0,0.024003161066852324,4,306,0.37228754240123674,0.00033357036198023354,138.59120761023627,COMPLETE
221,0.31506970524787903,2023-09-04 22:11:41.296506,2023-09-04 22:11:42.151651,0 days 00:00:00.855145,Leaky,Leaky,Sigmoid,Leaky,44,11,20.0,16.0,16.0,0.008870692646087865,4,279,0.7311661370792076,0.00016339658242293446,150.41090545654296,COMPLETE
222,0.2779366374015808,2023-09-04 22:11:42.151986,2023-09-04 22:11:42.881883,0 days 00:00:00.729897,Leaky,Leaky,Sigmoid,Leaky,41,13,20.0,16.0,16.0,0.010979443378264248,4,285,0.729765922588214,0.0001519087959698997,118.75608537003801,COMPLETE
223,0.2590138912200928,2023-09-04 22:11:42.882200,2023-09-04 22:11:45.468756,0 days 00:00:02.586556,Leaky,Leaky,Sigmoid,Leaky,41,12,21.0,16.0,16.0,0.005287661460495749,4,298,0.7022657594850934,0.0001918459336822532,124.7769454833,COMPLETE
224,0.3173361122608185,2023-09-04 22:11:45.469174,2023-09-04 22:11:46.386296,0 days 00:00:00.917122,Leaky,Leaky,Sigmoid,Leaky,40,16,21.0,15.0,17.0,0.0033982819235389085,4,302,0.6625825278820268,0.00020389602520629746,126.45898503842561,COMPLETE
225,0.3047010004520416,2023-09-04 22:11:46.386748,2023-09-04 22:11:47.369751,0 days 00:00:00.983003,Leaky,Leaky,Sigmoid,Leaky,34,12,22.0,17.0,11.0,0.005281335275361376,4,294,0.3982782910627344,0.0001115303911920385,107.19343522666158,COMPLETE
226,0.2735714018344879,2023-09-04 22:11:47.370186,2023-09-04 22:11:48.330219,0 days 00:00:00.960033,Leaky,Leaky,Sigmoid,Leaky,46,23,21.0,21.0,15.0,0.018123745034574232,4,324,0.6966054715405715,0.00024818062745765937,128.5011872636511,COMPLETE
227,0.3014741539955139,2023-09-04 22:11:48.330662,2023-09-04 22:11:49.322106,0 days 00:00:00.991444,Leaky,Tanh,Tanh,ReLU,97,21,23.0,23.0,2.0,0.004762972527322133,4,133,0.769481369113363,0.00019238108562366206,118.48330678025337,COMPLETE
228,0.3574596345424652,2023-09-04 22:11:49.322529,2023-09-04 22:11:50.657705,0 days 00:00:01.335176,Sigmoid,Leaky,Sigmoid,Sigmoid,29,19,22.0,16.0,17.0,0.014132243819089988,4,179,0.6220833747871553,0.00013351337052001282,119.5871746665553,COMPLETE
229,0.3822867274284363,2023-09-04 22:11:50.658042,2023-09-04 22:11:51.279672,0 days 00:00:00.621630,Tanh,Leaky,Sigmoid,Leaky,38,22,20.0,14.0,7.0,0.01641022899388663,4,314,0.5777430237060087,0.00030189073964609364,133.09810071672712,COMPLETE
230,0.37669140100479126,2023-09-04 22:11:51.280009,2023-09-04 22:11:52.848643,0 days 00:00:01.568634,Leaky,Sigmoid,Sigmoid,Leaky,36,24,19.0,16.0,8.0,0.002922039159360776,4,261,0.6739088081669458,0.00043096110222676204,115.9350797753585,COMPLETE
231,0.41575419902801514,2023-09-04 22:11:52.848972,2023-09-04 22:11:53.531760,0 days 00:00:00.682788,Leaky,Leaky,Sigmoid,Leaky,43,12,20.0,16.0,16.0,0.007472072374758454,4,276,0.7231369636818691,0.00016745102471783308,118.15207737513951,COMPLETE
232,0.2490055412054062,2023-09-04 22:11:53.532092,2023-09-04 22:11:58.410606,0 days 00:00:04.878514,Leaky,Leaky,Sigmoid,Leaky,42,12,21.0,16.0,16.0,0.0002628552012113462,4,291,0.7428445829346744,0.00022209834459143327,141.78406185227996,COMPLETE
233,0.3744489252567291,2023-09-04 22:11:58.410932,2023-09-04 22:12:00.527019,0 days 00:00:02.116087,Leaky,Leaky,Sigmoid,Leaky,40,13,21.0,17.0,15.0,0.0006184426157004223,4,291,0.7555232905165983,0.0002308786613576733,112.9447147662823,COMPLETE
234,1.1024954319000244,2023-09-04 22:12:00.527360,2023-09-04 22:12:00.790442,0 days 00:00:00.263082,Leaky,Leaky,Sigmoid,Leaky,67,11,21.0,17.0,16.0,0.011458158423435586,4,304,0.7970294858992356,0.04460124716974824,99.02211999893188,COMPLETE
235,0.3504126965999603,2023-09-04 22:12:00.790780,2023-09-04 22:12:02.907905,0 days 00:00:02.117125,Leaky,Leaky,Sigmoid,Sigmoid,39,12,22.0,16.0,17.0,0.0015020782942485194,4,216,0.706254872344226,0.0001910035188742749,202.21608470310676,COMPLETE
236,0.4496575593948364,2023-09-04 22:12:02.908245,2023-09-04 22:12:04.153225,0 days 00:00:01.244980,Leaky,Leaky,Leaky,Leaky,87,20,18.0,15.0,12.0,0.0002658698088704023,4,296,0.7540049706854649,0.0005751146513691721,131.21034289273348,COMPLETE
237,0.522322952747345,2023-09-04 22:12:04.153664,2023-09-04 22:12:07.482037,0 days 00:00:03.328373,Leaky,Tanh,Sigmoid,Tanh,41,13,20.0,7.0,18.0,9.268880869102e-05,4,156,0.7976163579495054,0.00026658287544105273,144.33074442545572,COMPLETE
238,0.34915274381637573,2023-09-04 22:12:07.482362,2023-09-04 22:12:08.360801,0 days 00:00:00.878439,Leaky,ReLU,Sigmoid,Leaky,44,12,21.0,15.0,9.0,0.02037191731211318,4,267,0.6808546076127788,0.0007176378285292702,299.9452797783746,COMPLETE
239,0.4044726490974426,2023-09-04 22:12:08.361238,2023-09-04 22:12:10.378393,0 days 00:00:02.017155,Leaky,Leaky,Sigmoid,Sigmoid,33,17,19.0,16.0,15.0,0.004096127681878653,4,287,0.7446698395343442,0.00023182568665423088,156.82621925755552,COMPLETE
240,0.4946092367172241,2023-09-04 22:12:10.379091,2023-09-04 22:12:10.553420,0 days 00:00:00.174329,Tanh,Leaky,Tanh,Leaky,37,11,20.0,21.0,10.0,0.05040167621619601,4,333,0.14129842785564484,0.0053388355114801144,146.0053614863643,COMPLETE
241,0.41366058588027954,2023-09-04 22:12:10.553824,2023-09-04 22:12:11.933622,0 days 00:00:01.379798,Leaky,Leaky,Sigmoid,Leaky,42,12,20.0,2.0,16.0,0.005931915978461289,4,280,0.7115170190866597,0.00014990572557837685,133.81605258053295,COMPLETE
242,0.3512604534626007,2023-09-04 22:12:11.933944,2023-09-04 22:12:12.366654,0 days 00:00:00.432710,Leaky,Leaky,Sigmoid,Leaky,42,12,20.0,13.0,16.0,0.008992854037654992,4,283,0.49928024017792316,0.0001808018987379711,110.49373675930885,COMPLETE
243,0.42164623737335205,2023-09-04 22:12:12.366984,2023-09-04 22:12:12.613790,0 days 00:00:00.246806,Leaky,Leaky,Sigmoid,Leaky,100,12,19.0,16.0,14.0,0.012971321107233372,4,270,0.7349707600358023,0.00021343684609345632,153.66624704996744,COMPLETE
244,0.44502416253089905,2023-09-04 22:12:12.614125,2023-09-04 22:12:13.017748,0 days 00:00:00.403623,Leaky,Leaky,Sigmoid,Leaky,45,13,21.0,16.0,16.0,0.006308107335064714,4,300,0.2947697225578492,0.00013190406180153545,147.91900151570638,COMPLETE
245,0.34051600098609924,2023-09-04 22:12:13.018302,2023-09-04 22:12:15.355637,0 days 00:00:02.337335,Leaky,Leaky,Sigmoid,Leaky,39,20,19.0,17.0,11.0,0.01023642406706941,4,316,0.7699030051809048,0.00016509439931338757,124.33409640663548,COMPLETE
246,0.34058427810668945,2023-09-04 22:12:15.356213,2023-09-04 22:12:17.704357,0 days 00:00:02.348144,Leaky,Leaky,Sigmoid,Sigmoid,43,19,23.0,15.0,17.0,0.0275043847227667,4,290,0.7058914210943426,0.00018992724372584924,95.5941160413954,COMPLETE
247,0.25999417901039124,2023-09-04 22:12:17.704949,2023-09-04 22:12:18.498303,0 days 00:00:00.793354,ReLU,Sigmoid,Sigmoid,Leaky,41,11,20.0,24.0,10.0,0.01642328034238221,4,207,0.6451447689768379,2.4693300735669378e-05,98.34692631597105,COMPLETE
248,0.23912379145622253,2023-09-04 22:12:18.498634,2023-09-04 22:12:19.212352,0 days 00:00:00.713718,ReLU,Sigmoid,Sigmoid,Leaky,35,10,21.0,24.0,10.0,0.016224177577834047,4,189,0.6429423681878589,4.522107572679332e-05,115.26383601008234,COMPLETE
249,0.38453739881515503,2023-09-04 22:12:19.212705,2023-09-04 22:12:22.026725,0 days 00:00:02.814020,ReLU,Sigmoid,Sigmoid,ReLU,35,10,21.0,24.0,10.0,0.016570772191259256,4,183,0.6371236693910088,2.22266661873758e-05,118.32677601959746,COMPLETE
250,0.39667850732803345,2023-09-04 22:12:22.027290,2023-09-04 22:12:23.860185,0 days 00:00:01.832895,ReLU,Sigmoid,Sigmoid,Sigmoid,32,10,22.0,24.0,10.0,0.021769264663674317,4,221,0.5975488862298389,1.4870140429375183e-05,135.13126921653748,COMPLETE
251,0.4130306541919708,2023-09-04 22:12:23.860746,2023-09-04 22:12:25.283947,0 days 00:00:01.423201,ReLU,Sigmoid,Sigmoid,Leaky,89,9,21.0,24.0,9.0,0.01478271148698495,4,204,0.6185496496229369,8.732725220910869e-05,135.5573875576842,COMPLETE
252,0.32925018668174744,2023-09-04 22:12:25.284520,2023-09-04 22:12:26.926697,0 days 00:00:01.642177,ReLU,Sigmoid,Sigmoid,Leaky,36,10,20.0,23.0,11.0,0.017129393655901427,4,196,0.6501612423142932,3.197178539814114e-05,113.69322624206544,COMPLETE
253,0.2664518654346466,2023-09-04 22:12:26.927137,2023-09-04 22:12:27.403721,0 days 00:00:00.476584,ReLU,Sigmoid,Leaky,,93,9,16.0,24.0,,0.022750965010172628,3,209,0.671212967202293,0.00033429891782680004,111.80609229758933,COMPLETE
254,0.33645927906036377,2023-09-04 22:12:27.404151,2023-09-04 22:12:27.630105,0 days 00:00:00.225954,ReLU,Sigmoid,Leaky,,94,9,16.0,24.0,,0.01979686516882039,3,195,0.5521990796516625,5.6124500249252944e-05,155.90300124032157,COMPLETE
255,0.4235312044620514,2023-09-04 22:12:27.630455,2023-09-04 22:12:27.935068,0 days 00:00:00.304613,ReLU,,,,96,11,,,,0.01319983864275948,1,192,0.6684450623761893,0.00038955257571168377,224.80467159190076,COMPLETE
256,0.35226258635520935,2023-09-04 22:12:27.935383,2023-09-04 22:12:28.768361,0 days 00:00:00.832978,ReLU,Sigmoid,Leaky,,91,8,16.0,23.0,,0.02367051802767321,3,207,0.6397949177144203,7.913345637453578e-05,113.39872055824357,COMPLETE
257,0.3791315257549286,2023-09-04 22:12:28.768697,2023-09-04 22:12:29.083550,0 days 00:00:00.314853,ReLU,Sigmoid,Leaky,,94,10,22.0,24.0,,0.015393882164588745,3,230,0.5993799649737214,2.5158086968008026e-05,126.74098687422902,COMPLETE
258,0.31098562479019165,2023-09-04 22:12:29.083899,2023-09-04 22:12:29.504115,0 days 00:00:00.420216,ReLU,Sigmoid,,,98,9,20.0,,,0.018049197666019347,2,211,0.6648379897206496,0.00010652035916221127,159.81257361696478,COMPLETE
259,0.294921875,2023-09-04 22:12:29.504420,2023-09-04 22:12:29.957906,0 days 00:00:00.453486,ReLU,Sigmoid,Leaky,Leaky,86,11,17.0,24.0,4.0,0.03923500052567628,4,174,0.4527683953147079,3.9305892182652434e-05,873.1599863688151,COMPLETE
260,0.3180599510669708,2023-09-04 22:12:29.958231,2023-09-04 22:12:30.535989,0 days 00:00:00.577758,ReLU,Sigmoid,Tanh,Leaky,82,11,21.0,23.0,10.0,0.01252197385992767,4,202,0.6230973571002135,0.00029398389681959465,104.49098232814244,COMPLETE
261,0.31252992153167725,2023-09-04 22:12:30.536349,2023-09-04 22:12:31.295952,0 days 00:00:00.759603,ReLU,Sigmoid,ReLU,Leaky,89,20,21.0,24.0,12.0,0.001774069233453168,4,212,0.5713430745967962,1.57763525173598e-05,117.35466480255127,COMPLETE
262,0.3481583595275879,2023-09-04 22:12:31.296307,2023-09-04 22:12:32.149294,0 days 00:00:00.852987,ReLU,Sigmoid,Leaky,Leaky,34,19,20.0,11.0,11.0,0.06654064273385664,4,187,0.7745128249221525,1.0932926028145193e-05,156.31106927659778,COMPLETE
263,0.3483008146286011,2023-09-04 22:12:32.149637,2023-09-04 22:12:33.182752,0 days 00:00:01.033115,Tanh,Tanh,Sigmoid,Leaky,38,18,17.0,23.0,10.0,0.021214441317463056,4,218,0.6776452147675454,7.568649070776544e-05,137.96213045987216,COMPLETE
264,0.38370034098625183,2023-09-04 22:12:33.183107,2023-09-04 22:12:33.960496,0 days 00:00:00.777389,ReLU,Sigmoid,Sigmoid,Leaky,50,9,22.0,23.0,9.0,0.013634674104321457,4,233,0.7958258923602907,0.00030250342747096794,103.51997393231059,COMPLETE
265,0.3004395067691803,2023-09-04 22:12:33.960847,2023-09-04 22:12:34.393097,0 days 00:00:00.432250,Tanh,ReLU,Tanh,ReLU,93,21,21.0,24.0,9.0,0.017275128084321276,4,342,0.6969161283829974,0.00034403212703102033,111.14371490478516,COMPLETE
266,0.36877456307411194,2023-09-04 22:12:34.393421,2023-09-04 22:12:35.164743,0 days 00:00:00.771322,Sigmoid,Sigmoid,Sigmoid,Leaky,40,10,20.0,5.0,11.0,0.02992599070019998,4,223,0.6496989458177201,0.0002569979621390064,146.81694134798917,COMPLETE
267,0.36265021562576294,2023-09-04 22:12:35.165097,2023-09-04 22:12:35.330015,0 days 00:00:00.164918,ReLU,Tanh,Sigmoid,Tanh,85,20,20.0,6.0,6.0,0.011557337733895329,4,79,0.31178070480862075,6.780556325224672e-05,143.5719601557805,COMPLETE
