number,value,datetime_start,datetime_complete,duration,params_activation1,params_activation2,params_activation3,params_activation4,params_batch_size,params_fl1,params_fl2,params_fl3,params_fl4,params_learning_rate,params_n_layers,params_num_epochs,params_train_size,params_weight_decay,user_attrs_mre,state
1961,0.3470381200313568,2023-09-04 22:53:49.448726,2023-09-04 22:53:50.057218,0 days 00:00:00.608492,Tanh,Leaky,Sigmoid,Leaky,85,18,19.0,23.0,5.0,0.0032182313667470748,4,305,0.5220655724860462,0.0002117739638772312,169.17334907933287,COMPLETE
1962,0.34076130390167236,2023-09-04 22:53:50.057763,2023-09-04 22:53:50.946435,0 days 00:00:00.888672,Sigmoid,Leaky,Sigmoid,Leaky,29,19,21.0,18.0,19.0,0.014710318634601746,4,249,0.40684966491161734,8.73006497975027e-05,110.6205735206604,COMPLETE
1963,0.34198057651519775,2023-09-04 22:53:50.946983,2023-09-04 22:53:51.838084,0 days 00:00:00.891101,Tanh,Leaky,Sigmoid,Sigmoid,32,18,23.0,15.0,6.0,0.009935129015965369,4,266,0.48146141188370123,1.0019981396017332e-05,151.48595153808594,COMPLETE
1964,0.5629191398620605,2023-09-04 22:53:51.838642,2023-09-04 22:53:52.370119,0 days 00:00:00.531477,ReLU,Leaky,ReLU,Leaky,44,10,20.0,24.0,18.0,0.07519267863940438,4,204,0.6745453421694374,0.02659539542578834,269.66230906610906,COMPLETE
1965,0.25589480996131897,2023-09-04 22:53:52.370663,2023-09-04 22:53:53.289257,0 days 00:00:00.918594,Tanh,Leaky,Sigmoid,ReLU,82,19,21.0,13.0,2.0,0.017517913411375586,4,229,0.709751139537405,0.00041855198129240603,130.67373190985785,COMPLETE
1966,0.9110358953475952,2023-09-04 22:53:53.289804,2023-09-04 22:53:53.981288,0 days 00:00:00.691484,Leaky,Leaky,Sigmoid,Sigmoid,79,11,20.0,14.0,8.0,1.9223871634302335e-05,4,286,0.10723804208008826,0.006138409781691524,88.59451304615794,COMPLETE
1967,0.43172240257263184,2023-09-04 22:53:53.981817,2023-09-04 22:53:55.309420,0 days 00:00:01.327603,Sigmoid,Leaky,Tanh,Leaky,84,21,19.0,16.0,20.0,0.0007264919157560489,4,253,0.4109537234570357,0.0008697061329781705,266.050394957093,COMPLETE
1968,0.4635641574859619,2023-09-04 22:53:55.309980,2023-09-04 22:53:55.861588,0 days 00:00:00.551608,Tanh,Leaky,Sigmoid,Leaky,20,17,19.0,23.0,5.0,0.011091983077208236,4,242,0.24066612352262728,0.0002704229431589577,349.8917584138758,COMPLETE
1969,0.8706672787666321,2023-09-04 22:53:55.862127,2023-09-04 22:53:56.164100,0 days 00:00:00.301973,ReLU,Tanh,Sigmoid,Sigmoid,92,20,21.0,16.0,7.0,0.013823656959772147,4,276,0.5160765738747436,0.030947836686531734,101.16966205173068,COMPLETE
1970,0.31125932931900024,2023-09-04 22:53:56.164671,2023-09-04 22:53:56.590096,0 days 00:00:00.425425,Tanh,Leaky,ReLU,Leaky,89,18,20.0,12.0,4.0,0.021615477972622317,4,179,0.4299073995045572,0.0006968045168036687,113.72482539585658,COMPLETE
1971,0.31753212213516235,2023-09-04 22:53:56.591152,2023-09-04 22:54:00.501379,0 days 00:00:03.910227,Leaky,ReLU,Sigmoid,Leaky,87,19,22.0,22.0,19.0,0.00018618060822312847,4,226,0.7671995992596357,2.4155168082101038e-05,104.44474792480469,COMPLETE
1972,0.31181591749191284,2023-09-04 22:54:00.501918,2023-09-04 22:54:03.173193,0 days 00:00:02.671275,Sigmoid,Leaky,Sigmoid,Sigmoid,31,16,18.0,15.0,6.0,0.007813828840092758,4,236,0.7421669833856653,4.137604761624306e-05,162.33145405421746,COMPLETE
1973,0.4020693302154541,2023-09-04 22:54:03.173737,2023-09-04 22:54:03.491849,0 days 00:00:00.318112,Tanh,Leaky,Sigmoid,Leaky,39,10,21.0,24.0,5.0,0.026603425049213623,4,309,0.20689224615016272,0.00108704396267507,154.82436136099008,COMPLETE
1974,0.37235769629478455,2023-09-04 22:54:03.492389,2023-09-04 22:54:04.623958,0 days 00:00:01.131569,Tanh,Sigmoid,ReLU,Sigmoid,81,21,20.0,23.0,18.0,0.0023434133224880384,4,258,0.6566709609805885,0.00015038542646917647,147.31956560587145,COMPLETE
1975,0.30125412344932556,2023-09-04 22:54:04.624487,2023-09-04 22:54:05.314617,0 days 00:00:00.690130,ReLU,Leaky,Sigmoid,Tanh,34,18,19.0,17.0,17.0,0.017100029855456434,4,216,0.6915695377362037,0.00018401107249581999,111.69003149179312,COMPLETE
1976,0.9675769209861755,2023-09-04 22:54:05.315164,2023-09-04 22:54:06.297806,0 days 00:00:00.982642,Sigmoid,Leaky,Sigmoid,Leaky,90,19,21.0,24.0,1.0,0.0003732719875135563,4,294,0.17386507496721051,0.00010236986329694518,791.9324734746193,COMPLETE
1977,0.33193814754486084,2023-09-04 22:54:06.298342,2023-09-04 22:54:06.871179,0 days 00:00:00.572837,Tanh,Leaky,Sigmoid,Leaky,85,15,17.0,22.0,15.0,0.041346148816221354,4,244,0.7718842940078471,6.000129300032553e-05,162.9102139192469,COMPLETE
1978,1.0648541450500488,2023-09-04 22:54:06.871720,2023-09-04 22:54:08.937422,0 days 00:00:02.065702,Leaky,Leaky,ReLU,Sigmoid,83,22,20.0,23.0,3.0,1.655287346286107e-05,4,265,0.46171156158384247,0.0003105462887356975,459.46438771373823,COMPLETE
1979,0.46580028533935547,2023-09-04 22:54:08.937943,2023-09-04 22:54:17.494355,0 days 00:00:08.556412,Tanh,Leaky,Sigmoid,Leaky,26,9,20.0,16.0,4.0,9.882923060158202e-05,4,328,0.7286110896209627,1.294614699380114e-05,133.93143311942495,COMPLETE
1980,0.7447891235351562,2023-09-04 22:54:17.494900,2023-09-04 22:54:20.114010,0 days 00:00:02.619110,ReLU,Leaky,Sigmoid,ReLU,78,20,19.0,15.0,6.0,6.710271879426766e-05,4,254,0.6353059627450669,0.00013394777269815913,168.73116828137495,COMPLETE
1981,0.6090207695960999,2023-09-04 22:54:20.114539,2023-09-04 22:54:28.837592,0 days 00:00:08.723053,Sigmoid,Leaky,Sigmoid,Sigmoid,28,17,22.0,21.0,12.0,8.090519364414533e-05,4,317,0.7986680665226066,7.518040943255841e-05,218.83683326793394,COMPLETE
1982,0.26461562514305115,2023-09-04 22:54:28.838145,2023-09-04 22:54:29.533019,0 days 00:00:00.694874,Tanh,Leaky,Sigmoid,Leaky,87,19,18.0,23.0,16.0,0.010980235053377788,4,225,0.7513342272361719,0.00020274687360111637,122.29836631307796,COMPLETE
1983,0.4508976936340332,2023-09-04 22:54:29.533566,2023-09-04 22:54:29.785577,0 days 00:00:00.252011,Leaky,Leaky,ReLU,Leaky,81,18,20.0,15.0,8.0,0.014155732294462318,4,498,0.13510225049630126,5.1881028733001865e-05,174.2505296649355,COMPLETE
1984,0.29733800888061523,2023-09-04 22:54:29.786125,2023-09-04 22:54:30.685798,0 days 00:00:00.899673,Tanh,ReLU,Sigmoid,Sigmoid,84,20,19.0,19.0,21.0,0.00611396017725986,4,207,0.7025760096601528,1.7344540260561117e-05,115.98640397666158,COMPLETE
1985,0.683804452419281,2023-09-04 22:54:30.686355,2023-09-04 22:54:31.977302,0 days 00:00:01.290947,Tanh,Leaky,Sigmoid,Leaky,37,17,16.0,14.0,2.0,0.002824073861414638,4,233,0.7279168640008568,0.0002622602251325032,179.73715132373874,COMPLETE
1986,0.3843859136104584,2023-09-04 22:54:31.977847,2023-09-04 22:54:32.870307,0 days 00:00:00.892460,Sigmoid,Leaky,Leaky,Sigmoid,86,18,22.0,24.0,6.0,0.003914583722307071,4,279,0.4425979985313083,0.00011651936124784118,178.76472663879395,COMPLETE
1987,0.5330181121826172,2023-09-04 22:54:32.870869,2023-09-04 22:54:33.193206,0 days 00:00:00.322337,ReLU,Leaky,Sigmoid,,31,21,21.0,16.0,,0.020079160117340403,3,240,0.183188318555122,8.935113582818093e-05,200.18763329001035,COMPLETE
1988,0.3290235698223114,2023-09-04 22:54:33.193748,2023-09-04 22:54:33.621474,0 days 00:00:00.427726,Tanh,Leaky,ReLU,Leaky,90,10,18.0,22.0,7.0,0.004736802857032156,4,189,0.7719971431256298,0.00015948757208847722,92.47678724924724,COMPLETE
1989,0.4650004208087921,2023-09-04 22:54:33.622023,2023-09-04 22:54:39.434110,0 days 00:00:05.812087,Leaky,Leaky,Tanh,Leaky,34,23,20.0,23.0,20.0,4.100859033475918e-05,4,248,0.7989611968599931,0.0005275350439037803,208.98473976504417,COMPLETE
1990,0.29330888390541077,2023-09-04 22:54:39.434673,2023-09-04 22:54:40.210567,0 days 00:00:00.775894,Tanh,Leaky,Sigmoid,Sigmoid,80,19,21.0,24.0,9.0,0.009223043488168698,4,293,0.53294242992264,2.7891779684606016e-05,134.91125833171688,COMPLETE
1991,0.25387948751449585,2023-09-04 22:54:40.211115,2023-09-04 22:54:41.461720,0 days 00:00:01.250605,Sigmoid,Leaky,Sigmoid,Leaky,83,12,20.0,22.0,19.0,0.011898425654683893,4,220,0.5472150334766357,0.00023004790348703718,147.04730824955175,COMPLETE
1992,0.28972092270851135,2023-09-04 22:54:41.462257,2023-09-04 22:54:42.337600,0 days 00:00:00.875343,ReLU,Leaky,Sigmoid,ReLU,92,20,19.0,24.0,3.0,0.007158709255233197,4,271,0.7497963454301689,0.0003564346223264757,104.19320612368377,COMPLETE
1993,0.5474457144737244,2023-09-04 22:54:42.338148,2023-09-04 22:54:43.180109,0 days 00:00:00.841961,Tanh,Tanh,Sigmoid,Leaky,88,19,21.0,23.0,18.0,0.01652092931269061,4,260,0.6847956183166736,0.017561812053256208,187.3062655683877,COMPLETE
1994,0.3364185690879822,2023-09-04 22:54:43.180667,2023-09-04 22:54:43.645095,0 days 00:00:00.464428,Leaky,Leaky,ReLU,Sigmoid,85,22,20.0,17.0,17.0,0.023795323488323656,4,198,0.5041269312232843,6.746572265703045e-05,468.9733528137207,COMPLETE
1995,0.661533772945404,2023-09-04 22:54:43.645712,2023-09-04 22:54:43.944199,0 days 00:00:00.298487,Tanh,Leaky,Sigmoid,Leaky,82,8,21.0,4.0,5.0,0.03141666685289298,4,169,0.12378290841937245,0.001636479255229518,372.6440398018315,COMPLETE
1996,0.4887878894805908,2023-09-04 22:54:43.944731,2023-09-04 22:54:44.672118,0 days 00:00:00.727387,Sigmoid,Leaky,Sigmoid,Sigmoid,64,18,22.0,14.0,10.0,0.014123873743197216,4,247,0.285715752249594,1.1883711458071458e-05,362.4549777691181,COMPLETE
1997,0.539908230304718,2023-09-04 22:54:44.672690,2023-09-04 22:54:45.077904,0 days 00:00:00.405214,Tanh,Sigmoid,Sigmoid,Leaky,41,11,19.0,16.0,5.0,0.02003480534353121,4,232,0.3267244202568342,0.00013864739714773035,139.6070601851852,COMPLETE
1998,0.3100169599056244,2023-09-04 22:54:45.078598,2023-09-04 22:54:45.815592,0 days 00:00:00.736994,ReLU,Leaky,ReLU,Leaky,57,13,20.0,23.0,19.0,0.01007500993871938,4,301,0.7999078450663769,2.2002241265303885e-05,128.07464133368597,COMPLETE
1999,0.4060567021369934,2023-09-04 22:54:45.816156,2023-09-04 22:54:46.792681,0 days 00:00:00.976525,Tanh,ReLU,,,29,17,21.0,,,0.012365250066564203,2,284,0.6180882670801016,0.001984939669503873,147.10847098367256,COMPLETE
