number,value,datetime_start,datetime_complete,duration,params_activation1,params_activation2,params_activation3,params_activation4,params_batch_size,params_fl1,params_fl2,params_fl3,params_fl4,params_learning_rate,params_n_layers,params_num_epochs,params_train_size,params_weight_decay,user_attrs_mre,state
1998,0.48073258996009827,2023-09-04 22:44:51.988044,2023-09-04 22:44:54.801844,0 days 00:00:02.813800,Sigmoid,ReLU,Leaky,,29,10,23.0,7.0,,6.0902975029272985e-05,3,140,0.6697128954342628,1.5119936244879952e-05,110.68968500409808,COMPLETE
1999,0.8684212565422058,2023-09-04 22:44:54.802391,2023-09-04 22:44:55.998376,0 days 00:00:01.195985,Tanh,Sigmoid,Sigmoid,Sigmoid,40,20,11.0,13.0,2.0,0.00010650070225173783,4,104,0.3562329099003873,3.972625879351669e-05,100.18724536895752,COMPLETE
