number,value,datetime_start,datetime_complete,duration,params_activation1,params_activation2,params_activation3,params_activation4,params_batch_size,params_fl1,params_fl2,params_fl3,params_fl4,params_learning_rate,params_n_layers,params_num_epochs,params_train_size,params_weight_decay,user_attrs_mre,state
1390,0.33761242032051086,2023-09-04 21:59:22.576676,2023-09-04 21:59:33.357367,0 days 00:00:10.780691,ReLU,Tanh,ReLU,ReLU,14,22,18.0,21.0,22.0,0.0011717441731673493,4,190,0.6852236227071098,0.00021402918037935522,8187.576911584655,COMPLETE
1391,0.4359138309955597,2023-09-04 21:59:33.358460,2023-09-04 21:59:47.860190,0 days 00:00:14.501730,Sigmoid,Leaky,Leaky,Leaky,29,21,22.0,8.0,16.0,0.00027844318556638004,4,180,0.7676169375992848,0.0001121590590136005,202.1344529469808,COMPLETE
1392,0.36258599162101746,2023-09-04 21:59:47.861137,2023-09-04 21:59:49.846664,0 days 00:00:01.985527,ReLU,Leaky,Leaky,Leaky,33,20,23.0,17.0,15.0,0.0035009705914719395,4,158,0.3451330172291483,0.00040355131735435133,116.3263357480367,COMPLETE
1393,0.34788450598716736,2023-09-04 21:59:49.847630,2023-09-04 21:59:52.922564,0 days 00:00:03.074934,ReLU,Tanh,Tanh,Tanh,25,20,16.0,20.0,6.0,0.0025217898990254426,4,95,0.4225479557444119,0.0002699900999750756,148.70501273018974,COMPLETE
1394,0.40605565905570984,2023-09-04 21:59:52.923556,2023-09-04 21:59:54.850445,0 days 00:00:01.926889,ReLU,Leaky,,,36,22,22.0,,,0.005099532679823237,2,201,0.7214508712327292,0.008530803529480255,157.5278081649389,COMPLETE
1395,0.3706214725971222,2023-09-04 21:59:54.851415,2023-09-04 21:59:57.780472,0 days 00:00:02.929057,ReLU,Leaky,Leaky,ReLU,31,24,10.0,8.0,9.0,0.0007373019517027081,4,189,0.3273624428293542,2.368251666642087e-05,135.19907416366948,COMPLETE
1396,0.3282921612262726,2023-09-04 21:59:57.781424,2023-09-04 22:00:00.731033,0 days 00:00:02.949609,ReLU,Tanh,Sigmoid,Leaky,59,19,4.0,18.0,7.0,0.0065102130564076485,4,70,0.6471300826337383,0.0009473283617574825,832.0796561104911,COMPLETE
1397,0.2830927073955536,2023-09-04 22:00:00.732354,2023-09-04 22:00:04.767472,0 days 00:00:04.035118,ReLU,Leaky,Leaky,Leaky,34,21,24.0,16.0,1.0,0.01254557477400489,4,168,0.7669330751238806,0.0014151061364329296,146.70681273262457,COMPLETE
1398,0.6135731339454651,2023-09-04 22:00:04.768483,2023-09-04 22:00:05.904830,0 days 00:00:01.136347,Sigmoid,Sigmoid,ReLU,Sigmoid,29,20,11.0,21.0,10.0,0.009757441484889646,4,212,0.17066868879215377,0.0001545699422515927,840.0967583550347,COMPLETE
1399,0.2796597480773926,2023-09-04 22:00:05.905880,2023-09-04 22:00:08.627013,0 days 00:00:02.721133,ReLU,Leaky,Leaky,ReLU,47,19,23.0,8.0,24.0,0.0035552103173628036,4,203,0.7484630865796064,0.00013871975820854156,263.3903868993123,COMPLETE
1400,0.6451371312141418,2023-09-04 22:00:08.627982,2023-09-04 22:00:11.481238,0 days 00:00:02.853256,ReLU,Tanh,,,32,19,12.0,,,2.4370770296750026e-05,2,50,0.7997716701460785,0.0006308353637544699,157.3951123046875,COMPLETE
1401,0.30378258228302,2023-09-04 22:00:11.482256,2023-09-04 22:00:14.933929,0 days 00:00:03.451673,ReLU,Leaky,Leaky,Leaky,50,23,9.0,5.0,8.0,0.0020620513980037698,4,190,0.7178534779931511,9.997138247174557e-05,3863.28940189246,COMPLETE
1402,0.44901376962661743,2023-09-04 22:00:14.934801,2023-09-04 22:00:23.355672,0 days 00:00:08.420871,ReLU,Leaky,Tanh,,35,22,22.0,22.0,,2.618334002419681e-05,3,212,0.6876032769116347,0.00021212938792269657,180.76645714381957,COMPLETE
1403,0.5454666614532471,2023-09-04 22:00:23.356365,2023-09-04 22:00:24.717557,0 days 00:00:01.361192,ReLU,Tanh,Leaky,,27,21,17.0,19.0,,6.190644875906444e-05,3,152,0.15843680282050193,0.0011683297587111133,168.36216228886656,COMPLETE
1404,0.42209598422050476,2023-09-04 22:00:24.718127,2023-09-04 22:00:30.924649,0 days 00:00:06.206522,Sigmoid,Leaky,Leaky,Leaky,36,20,22.0,15.0,2.0,0.0004594840273826797,4,181,0.7714528599616741,0.00012365274639569325,158.10888108583254,COMPLETE
1405,0.3298998177051544,2023-09-04 22:00:30.926070,2023-09-04 22:00:34.500803,0 days 00:00:03.574733,ReLU,Leaky,Sigmoid,,33,20,18.0,6.0,,0.0028953841559146458,3,174,0.738702659640122,2.9073633796274992e-05,219.97202944074357,COMPLETE
1406,0.5820544362068176,2023-09-04 22:00:34.505296,2023-09-04 22:00:43.917811,0 days 00:00:09.412515,ReLU,Tanh,ReLU,,31,19,24.0,7.0,,7.313634995651991e-05,3,194,0.6658613333274371,0.04415335246907772,231.56125581878976,COMPLETE
1407,0.4938460886478424,2023-09-04 22:00:43.919199,2023-09-04 22:00:44.371389,0 days 00:00:00.452190,ReLU,Leaky,Leaky,,29,21,23.0,8.0,,0.008596203132958906,3,129,0.10130718227888817,0.0003736288130852207,165.11138534545898,COMPLETE
1408,0.3126625120639801,2023-09-04 22:00:44.372562,2023-09-04 22:00:47.565246,0 days 00:00:03.192684,ReLU,Leaky,Leaky,,36,19,8.0,8.0,,0.0009985700784111938,3,203,0.6002743324798593,4.296006996844798e-05,254.1359740299965,COMPLETE
1409,0.2752695381641388,2023-09-04 22:00:47.566165,2023-09-04 22:00:50.922323,0 days 00:00:03.356158,ReLU,Leaky,Tanh,Tanh,34,20,22.0,9.0,4.0,0.004676831620996694,4,217,0.7995508071710267,0.0005336559556619055,472.0236458002135,COMPLETE
1410,0.358833909034729,2023-09-04 22:00:50.923286,2023-09-04 22:00:56.918289,0 days 00:00:05.995003,ReLU,Tanh,Leaky,,32,23,22.0,7.0,,0.0016028013147076933,3,185,0.7048800765827609,0.00017557139565803952,143.85032176008127,COMPLETE
1411,0.5948783159255981,2023-09-04 22:00:56.919412,2023-09-04 22:01:06.125661,0 days 00:00:09.206249,Sigmoid,Sigmoid,Sigmoid,,17,20,23.0,6.0,,0.00011120517455002698,3,162,0.4031297832080649,0.001720988773715827,111.57696952348874,COMPLETE
1412,0.3503665030002594,2023-09-04 22:01:06.126615,2023-09-04 22:01:10.162167,0 days 00:00:04.035552,ReLU,Leaky,Leaky,,37,19,10.0,21.0,,0.0005911917055015964,3,200,0.3807118643259026,2.4586964581946216e-05,152.87198263056138,COMPLETE
1413,0.38371211290359497,2023-09-04 22:01:10.163083,2023-09-04 22:01:11.970197,0 days 00:00:01.807114,ReLU,,,,30,21,,,,0.012054384811623735,1,221,0.7515687977922648,0.0002647385711356019,175.44959761456747,COMPLETE
1414,0.41766539216041565,2023-09-04 22:01:11.971101,2023-09-04 22:01:14.924586,0 days 00:00:02.953485,ReLU,Leaky,Leaky,Leaky,53,7,2.0,22.0,3.0,0.007041224496623215,4,209,0.7716621011943429,0.053110553104109906,198.8170611940581,COMPLETE
1415,0.9263102412223816,2023-09-04 22:01:14.925510,2023-09-04 22:01:16.855864,0 days 00:00:01.930354,ReLU,Tanh,ReLU,,34,20,22.0,16.0,,1.0543219881089263e-05,3,173,0.11806530193636693,6.792839268841524e-05,111.51150715557826,COMPLETE
1416,0.3683490753173828,2023-09-04 22:01:16.856798,2023-09-04 22:01:19.072164,0 days 00:00:02.215366,ReLU,Leaky,Leaky,,57,22,24.0,20.0,,0.0013304104639222448,3,191,0.36417861093415216,1.0008912430484554e-05,163.64602394823757,COMPLETE
1417,0.3825945556163788,2023-09-04 22:01:19.073093,2023-09-04 22:01:20.945163,0 days 00:00:01.872070,Sigmoid,Leaky,Tanh,,87,18,22.0,8.0,,0.003855252916713925,3,194,0.43692171807706387,8.756159321951261e-05,225.08424702257213,COMPLETE
1418,0.3655567467212677,2023-09-04 22:01:20.946188,2023-09-04 22:01:22.348926,0 days 00:00:01.402738,ReLU,Tanh,Leaky,,32,21,23.0,9.0,,0.0023370290615550605,3,182,0.3006547115619072,3.5282319727856744e-05,136.62980190912882,COMPLETE
1419,1.0247656106948853,2023-09-04 22:01:22.349815,2023-09-04 22:01:23.675711,0 days 00:00:01.325896,ReLU,Leaky,Sigmoid,ReLU,28,19,23.0,13.0,18.0,0.005643847730944512,4,207,0.7221590973800336,0.04282297873645861,99.99966782789964,COMPLETE
1420,0.4956831932067871,2023-09-04 22:01:23.676613,2023-09-04 22:01:24.347424,0 days 00:00:00.670811,ReLU,Leaky,Leaky,,36,20,11.0,7.0,,0.010621961044464346,3,217,0.24860417193416118,0.0023381297938015744,152.371968905131,COMPLETE
1421,0.4717382490634918,2023-09-04 22:01:24.348544,2023-09-04 22:01:29.584848,0 days 00:00:05.236304,ReLU,Tanh,Leaky,,48,19,18.0,22.0,,8.185439431825702e-05,3,167,0.7387036144821977,0.00013963733178062906,225.15763708788478,COMPLETE
1422,0.47556397318840027,2023-09-04 22:01:29.585303,2023-09-04 22:01:30.169680,0 days 00:00:00.584377,ReLU,Leaky,ReLU,,33,18,22.0,9.0,,0.00275340072173559,3,149,0.17619794239993525,0.028438645051201486,137.0201906476702,COMPLETE
1423,0.44602158665657043,2023-09-04 22:01:30.170147,2023-09-04 22:01:30.457627,0 days 00:00:00.287480,ReLU,Leaky,Leaky,,30,20,23.0,8.0,,0.00886503699611552,3,202,0.14151161142178476,5.1889694645583226e-05,131.39755397372775,COMPLETE
1424,0.3021288514137268,2023-09-04 22:01:30.458302,2023-09-04 22:01:34.376720,0 days 00:00:03.918418,Sigmoid,Sigmoid,Tanh,Leaky,26,19,24.0,18.0,13.0,0.0018488260340392823,4,196,0.7999000337637201,0.00018776259025774463,141.26744626262996,COMPLETE
1425,0.3727472424507141,2023-09-04 22:01:34.377457,2023-09-04 22:01:35.379081,0 days 00:00:01.001624,ReLU,Tanh,Leaky,,46,21,22.0,9.0,,0.0008125669199229985,3,59,0.6960852447130963,0.00032399297106137904,1294.4707998502051,COMPLETE
1426,0.3431394100189209,2023-09-04 22:01:35.380057,2023-09-04 22:01:45.643054,0 days 00:00:10.262997,ReLU,Leaky,Sigmoid,,37,10,19.0,19.0,,0.0003465101213820855,3,186,0.7716907152124162,0.00021775803138822248,433.8399447369319,COMPLETE
1427,0.44719815254211426,2023-09-04 22:01:45.644209,2023-09-04 22:01:45.937823,0 days 00:00:00.293614,ReLU,Leaky,,,35,13,23.0,,,0.0032785369746410045,2,223,0.10361600576734745,1.8801417451069882e-05,323.1541255263032,COMPLETE
1428,0.34728896617889404,2023-09-04 22:01:45.938330,2023-09-04 22:01:49.380670,0 days 00:00:03.442340,ReLU,Tanh,Leaky,,31,18,10.0,21.0,,0.001129260276770167,3,214,0.34261563671503864,4.44329261557979e-05,326.73472685325805,COMPLETE
1429,0.5282820463180542,2023-09-04 22:01:49.381597,2023-09-04 22:01:50.556747,0 days 00:00:01.175150,ReLU,Leaky,Leaky,Sigmoid,28,20,21.0,17.0,23.0,0.044038527631163504,4,175,0.6372958366978734,0.0038003786161071047,200.3320584978376,COMPLETE
1430,0.9183632135391235,2023-09-04 22:01:50.557785,2023-09-04 22:01:51.838225,0 days 00:00:01.280440,Sigmoid,Leaky,ReLU,,34,22,22.0,22.0,,0.0949298629046518,3,207,0.74526980596682,0.020585506435136288,375.82175003854854,COMPLETE
1431,0.8786117434501648,2023-09-04 22:01:51.839143,2023-09-04 22:01:56.033649,0 days 00:00:04.194506,ReLU,Tanh,Leaky,,37,11,18.0,8.0,,1.0168617700255832e-05,3,74,0.7704042028523945,0.00011188108881959425,134.4233891255147,COMPLETE
1432,0.5727470517158508,2023-09-04 22:01:56.034570,2023-09-04 22:02:00.760564,0 days 00:00:04.725994,ReLU,Leaky,Tanh,,31,24,21.0,24.0,,1.5625296464668878e-05,3,196,0.6656534536596862,0.009336075486780676,212.0732984737474,COMPLETE
1433,0.3280932605266571,2023-09-04 22:02:00.761097,2023-09-04 22:02:01.821965,0 days 00:00:01.060868,ReLU,Leaky,Leaky,,33,19,24.0,22.0,,0.004418448777114327,3,157,0.46833963852539306,0.002991049790199974,158.26706213700143,COMPLETE
1434,0.415815532207489,2023-09-04 22:02:01.822460,2023-09-04 22:02:02.237976,0 days 00:00:00.415516,ReLU,Tanh,Leaky,Leaky,35,21,22.0,9.0,6.0,0.011846139170876683,4,181,0.24042683535270398,2.803633494737895e-05,408.94124974959936,COMPLETE
1435,0.5428217053413391,2023-09-04 22:02:02.238482,2023-09-04 22:02:02.424967,0 days 00:00:00.186485,ReLU,Leaky,Sigmoid,,37,18,23.0,21.0,,0.013662477471467205,3,137,0.1149259542027642,0.0007342961982848885,275.6017466458407,COMPLETE
1436,0.9270403981208801,2023-09-04 22:02:02.425454,2023-09-04 22:02:05.801248,0 days 00:00:03.375794,ReLU,Sigmoid,Leaky,,30,20,21.0,7.0,,1.4217497723180133e-05,3,222,0.7198857456017569,0.05980382954819878,117.4201029880791,COMPLETE
1437,0.579261302947998,2023-09-04 22:02:05.801809,2023-09-04 22:02:06.743854,0 days 00:00:00.942045,Sigmoid,Leaky,ReLU,,25,19,22.0,8.0,,0.006923542511858203,3,189,0.31417129853039705,0.028168983845644556,216.9415940123719,COMPLETE
1438,0.3384203612804413,2023-09-04 22:02:06.744377,2023-09-04 22:02:08.110719,0 days 00:00:01.366342,ReLU,Tanh,Leaky,,46,17,17.0,24.0,,0.002333995382979187,3,201,0.5598425975143321,0.0001683444968146086,104.84485333879417,COMPLETE
1439,0.5342827439308167,2023-09-04 22:02:08.111314,2023-09-04 22:02:10.699855,0 days 00:00:02.588541,ReLU,Leaky,Tanh,ReLU,51,16,10.0,9.0,7.0,3.9812565109237885e-05,4,166,0.6953606786452354,0.014944513908094557,197.92846004072442,COMPLETE
1440,0.3671911954879761,2023-09-04 22:02:10.700369,2023-09-04 22:02:11.258099,0 days 00:00:00.557730,ReLU,Leaky,Leaky,,32,19,19.0,20.0,,0.005216927107121731,3,209,0.1808794519424489,1.3928677427465305e-05,144.8600201962599,COMPLETE
1441,0.41881224513053894,2023-09-04 22:02:11.258717,2023-09-04 22:02:12.006925,0 days 00:00:00.748208,ReLU,Tanh,Leaky,,28,20,9.0,17.0,,0.0029544603352997956,3,178,0.22180580748478804,0.011548069256132297,1830.2187556124281,COMPLETE
1442,0.4461168050765991,2023-09-04 22:02:12.007453,2023-09-04 22:02:14.028402,0 days 00:00:02.020949,ReLU,Leaky,Sigmoid,,38,8,23.0,15.0,,0.0005185375349493215,3,87,0.7672358727637356,0.001520350711346578,161.01730223907822,COMPLETE
1443,0.4521220028400421,2023-09-04 22:02:14.029323,2023-09-04 22:02:16.273455,0 days 00:00:02.244132,Sigmoid,Leaky,Leaky,,55,21,21.0,18.0,,0.0014937765782127728,3,217,0.7399955988088861,0.0019634067443910276,174.10500435602097,COMPLETE
1444,0.40122291445732117,2023-09-04 22:02:16.274168,2023-09-04 22:02:16.846856,0 days 00:00:00.572688,ReLU,Tanh,ReLU,Leaky,34,20,22.0,22.0,11.0,0.0038320361344789306,4,196,0.23558385290165643,0.0002447109732555948,160.05797701748935,COMPLETE
1445,0.4115148186683655,2023-09-04 22:02:16.847429,2023-09-04 22:02:17.333485,0 days 00:00:00.486056,ReLU,Leaky,Leaky,,35,23,23.0,3.0,,0.01017500503576936,3,389,0.2682688034631586,5.7377169365728246e-05,168.69618744545795,COMPLETE
1446,0.35575148463249207,2023-09-04 22:02:17.334000,2023-09-04 22:02:18.373916,0 days 00:00:01.039916,ReLU,Leaky,Tanh,,31,22,14.0,23.0,,0.002024246951234919,3,229,0.7700274988443038,1.1885512033185436e-05,168.18261923441074,COMPLETE
1447,0.5631503462791443,2023-09-04 22:02:18.374434,2023-09-04 22:02:18.614626,0 days 00:00:00.240192,ReLU,Leaky,Leaky,,38,18,24.0,7.0,,0.0007013201431190573,3,185,0.1068519332703588,7.586536697122727e-05,130.81978868756974,COMPLETE
1448,0.2680823802947998,2023-09-04 22:02:18.615208,2023-09-04 22:02:19.373158,0 days 00:00:00.757950,ReLU,Tanh,Leaky,,36,19,22.0,9.0,,0.008159161886504448,3,211,0.7224333704845624,3.2781050463873006e-05,118.89957890366063,COMPLETE
1449,0.6235305070877075,2023-09-04 22:02:19.373837,2023-09-04 22:02:19.799140,0 days 00:00:00.425303,ReLU,Sigmoid,Sigmoid,Tanh,30,20,11.0,14.0,19.0,0.06722219897885487,4,175,0.20382588844634864,0.0005157294066173364,148.82159649884258,COMPLETE
1450,0.5232439637184143,2023-09-04 22:02:19.799681,2023-09-04 22:02:21.709719,0 days 00:00:01.910038,Sigmoid,Leaky,Leaky,,32,21,21.0,24.0,,0.00021293342728638268,3,201,0.28358029233993876,0.0001502221877581716,208.46191986994958,COMPLETE
1451,0.3633066415786743,2023-09-04 22:02:21.710254,2023-09-04 22:02:23.776525,0 days 00:00:02.066271,ReLU,Leaky,ReLU,,27,5,22.0,8.0,,0.003310142960578378,3,166,0.5422694125203149,9.449753649632454e-05,140.01821002625582,COMPLETE
1452,0.5047082901000977,2023-09-04 22:02:23.777065,2023-09-04 22:02:24.230832,0 days 00:00:00.453767,ReLU,Tanh,Leaky,,45,18,19.0,22.0,,0.0009294667360602995,3,190,0.10482552949406732,2.285733934880592e-05,205.4788898500074,COMPLETE
1453,0.33278414607048035,2023-09-04 22:02:24.231460,2023-09-04 22:02:25.170125,0 days 00:00:00.938665,ReLU,Leaky,Leaky,,33,17,23.0,23.0,,0.013094739296676833,3,220,0.7993889802379252,4.1369768953861966e-05,140.23528691342003,COMPLETE
1454,0.441809743642807,2023-09-04 22:02:25.170748,2023-09-04 22:02:25.566780,0 days 00:00:00.396032,ReLU,Leaky,Tanh,Leaky,38,19,21.0,8.0,5.0,0.0026633623134576017,4,210,0.15057405330389648,0.0025738382965107163,309.44892225594356,COMPLETE
1455,0.4018687903881073,2023-09-04 22:02:25.567449,2023-09-04 22:02:26.123835,0 days 00:00:00.556386,ReLU,Tanh,Leaky,,29,20,9.0,7.0,,0.006190977492202427,3,110,0.1938883946355365,0.0002718556485442891,170.2928892953055,COMPLETE
1456,1.1024547815322876,2023-09-04 22:02:26.124535,2023-09-04 22:02:26.473689,0 days 00:00:00.349154,Sigmoid,Leaky,Sigmoid,,34,23,22.0,24.0,,0.05760375567208124,3,142,0.440034418644385,0.03450254671039692,235.19277351780943,COMPLETE
1457,0.7976462244987488,2023-09-04 22:02:26.474344,2023-09-04 22:02:27.295527,0 days 00:00:00.821183,ReLU,Leaky,Leaky,,48,21,18.0,16.0,,4.916580160189467e-05,3,67,0.4930816625091673,0.001077374095518349,185.36455444791423,COMPLETE
1458,0.33064645528793335,2023-09-04 22:02:27.296032,2023-09-04 22:02:28.254060,0 days 00:00:00.958028,ReLU,Tanh,ReLU,ReLU,36,19,23.0,21.0,4.0,0.004370796446045995,4,196,0.5241345347479022,0.00013046280795279597,133.49616990266023,COMPLETE
1459,0.36955726146698,2023-09-04 22:02:28.254741,2023-09-04 22:02:28.891530,0 days 00:00:00.636789,ReLU,Leaky,Leaky,,33,14,21.0,8.0,,0.010773788637303142,3,185,0.29928615079652326,0.0033398778360676793,153.78815564922257,COMPLETE
1460,0.3639559745788574,2023-09-04 22:02:28.892111,2023-09-04 22:02:29.960402,0 days 00:00:01.068291,ReLU,Leaky,,,39,22,24.0,,,0.0011997860166311897,2,157,0.5791263589660337,0.0001876453395651036,141.32248439559018,COMPLETE
1461,0.31826022267341614,2023-09-04 22:02:29.960990,2023-09-04 22:02:31.728436,0 days 00:00:01.767446,ReLU,Sigmoid,Leaky,,44,19,22.0,9.0,,0.00784665941514234,3,227,0.6294935011229732,1.6842776382275112e-05,170.59291445414226,COMPLETE
1462,0.5949788689613342,2023-09-04 22:02:31.728928,2023-09-04 22:02:32.507373,0 days 00:00:00.778445,Sigmoid,Tanh,Tanh,,31,21,19.0,23.0,,0.00017963916597871102,3,208,0.17759256493850561,0.0008376876240121355,129.3403270984518,COMPLETE
1463,0.3443298637866974,2023-09-04 22:02:32.507875,2023-09-04 22:02:32.984893,0 days 00:00:00.477018,ReLU,Leaky,Leaky,,29,18,21.0,9.0,,0.0018505571517610587,3,174,0.16993999901469228,0.0003653867012551102,567.5554098275992,COMPLETE
1464,0.5511174201965332,2023-09-04 22:02:32.985393,2023-09-04 22:02:33.929736,0 days 00:00:00.944343,ReLU,Leaky,Sigmoid,Leaky,22,20,23.0,13.0,8.0,0.00038803669266077387,4,201,0.12443210330693842,7.09037276617697e-05,179.74823443094888,COMPLETE
1465,0.28923091292381287,2023-09-04 22:02:33.930368,2023-09-04 22:02:34.706835,0 days 00:00:00.776467,ReLU,Tanh,Leaky,,67,20,10.0,8.0,,0.009181265181136095,3,192,0.752064526460386,4.994442448541178e-05,143.5837765780362,COMPLETE
1466,0.4186439514160156,2023-09-04 22:02:34.707346,2023-09-04 22:02:38.740739,0 days 00:00:04.033393,ReLU,Leaky,ReLU,,36,18,22.0,22.0,,0.00031744760318762224,3,182,0.6943793043510841,0.04971473260727549,207.42142453036465,COMPLETE
1467,0.3553685247898102,2023-09-04 22:02:38.741318,2023-09-04 22:02:39.306239,0 days 00:00:00.564921,ReLU,Leaky,Leaky,,34,19,20.0,6.0,,0.014196880243564377,3,226,0.7717557164815741,0.001347797080796561,145.8944539156827,COMPLETE
1468,0.44005781412124634,2023-09-04 22:02:39.306729,2023-09-04 22:02:39.580464,0 days 00:00:00.273735,ReLU,Tanh,Leaky,,38,19,13.0,23.0,,0.005312645366162775,3,216,0.1284679485485223,3.569379711528541e-05,129.68753633045014,COMPLETE
1469,0.4150288701057434,2023-09-04 22:02:39.581019,2023-09-04 22:02:41.702958,0 days 00:00:02.121939,Sigmoid,Leaky,Tanh,Sigmoid,32,20,24.0,20.0,1.0,0.003499351997219032,4,163,0.7271211103639269,0.0002138293063857288,263.1782447171498,COMPLETE
1470,0.3228395879268646,2023-09-04 22:02:41.703591,2023-09-04 22:02:42.609657,0 days 00:00:00.906066,ReLU,Leaky,Leaky,,42,22,22.0,17.0,,0.0028046069270453384,3,202,0.6714219460342751,0.000150382341780271,128.90974296713776,COMPLETE
1471,0.3846927285194397,2023-09-04 22:02:42.610154,2023-09-04 22:02:43.427665,0 days 00:00:00.817511,ReLU,Tanh,Sigmoid,,27,17,23.0,21.0,,0.0023994817617890465,3,192,0.32594002231882946,0.0003053823930469764,278.41993975639343,COMPLETE
1472,0.3132464587688446,2023-09-04 22:02:43.428296,2023-09-04 22:02:45.325474,0 days 00:00:01.897178,ReLU,Leaky,Leaky,,50,21,21.0,24.0,,0.0006259050408148235,3,122,0.7513499554425769,0.00011344061553637226,153.58944420736344,COMPLETE
1473,0.3605354130268097,2023-09-04 22:02:45.325961,2023-09-04 22:02:46.269074,0 days 00:00:00.943113,ReLU,Sigmoid,ReLU,,35,19,22.0,9.0,,0.011714376704331897,3,177,0.4780631087499521,1.0068067151656745e-05,228.47883998986447,COMPLETE
1474,1.001616358757019,2023-09-04 22:02:46.269637,2023-09-04 22:02:46.735975,0 days 00:00:00.466338,ReLU,Leaky,Leaky,Leaky,30,20,18.0,7.0,9.0,0.004151780148201646,4,148,0.7991731337616411,0.09295803294795794,99.9036636352539,COMPLETE
1475,0.39058783650398254,2023-09-04 22:02:46.736478,2023-09-04 22:02:47.968032,0 days 00:00:01.231554,Sigmoid,Tanh,Leaky,,37,21,19.0,22.0,,0.0015539125428036661,3,214,0.7129301085376405,2.794056634760294e-05,369.8927323818207,COMPLETE
1476,0.3395356833934784,2023-09-04 22:02:47.968560,2023-09-04 22:02:50.700198,0 days 00:00:02.731638,ReLU,Leaky,Tanh,,39,18,21.0,8.0,,0.0007889408981463361,3,377,0.7734562642497145,1.489955690013523e-05,113.74188043002425,COMPLETE
1477,0.46739497780799866,2023-09-04 22:02:50.700730,2023-09-04 22:03:00.162856,0 days 00:00:09.462126,ReLU,Leaky,Leaky,,32,20,20.0,23.0,,3.106702483957321e-05,3,450,0.7447292417636462,1.8597543217008046e-05,237.94357565985786,COMPLETE
1478,0.3569064438343048,2023-09-04 22:03:00.163345,2023-09-04 22:03:01.183418,0 days 00:00:01.020073,ReLU,Tanh,Sigmoid,,54,18,23.0,19.0,,0.0067878299109691235,3,234,0.39864952417909344,8.578177064141117e-05,200.29682581765312,COMPLETE
1479,0.3020787835121155,2023-09-04 22:03:01.183903,2023-09-04 22:03:03.341651,0 days 00:00:02.157748,ReLU,Leaky,Leaky,Leaky,35,12,24.0,8.0,6.0,0.0010684303749568691,4,169,0.6546028600141114,6.22345305422398e-05,150.0836043357849,COMPLETE
1480,0.3741929233074188,2023-09-04 22:03:03.342326,2023-09-04 22:03:03.926993,0 days 00:00:00.584667,ReLU,Leaky,ReLU,,46,19,22.0,9.0,,0.08323932047354053,3,203,0.714866872032726,0.00016312283792356067,240.53167183168472,COMPLETE
1481,0.3549387454986572,2023-09-04 22:03:03.927539,2023-09-04 22:03:04.931971,0 days 00:00:01.004432,ReLU,Tanh,Leaky,,29,22,21.0,18.0,,0.009012904534104575,3,190,0.6026327626988661,0.00013067249042905015,185.17095220656623,COMPLETE
