number,value,datetime_start,datetime_complete,duration,params_activation1,params_activation2,params_activation3,params_activation4,params_batch_size,params_fl1,params_fl2,params_fl3,params_fl4,params_learning_rate,params_n_layers,params_num_epochs,params_train_size,params_weight_decay,user_attrs_mre,state
285,0.29223278164863586,2023-09-04 21:17:20.598189,2023-09-04 21:17:21.455544,0 days 00:00:00.857355,Leaky,Sigmoid,,,86,24,14.0,,,0.015365729993767202,2,126,0.7731414470783139,0.0006030438496987269,136.42259861267718,COMPLETE
286,0.31564220786094666,2023-09-04 21:17:21.455841,2023-09-04 21:17:22.102347,0 days 00:00:00.646506,Leaky,Sigmoid,,,94,24,13.0,,,0.013605797263323352,2,126,0.7743513021143235,0.000609809833674993,119.79736418473094,COMPLETE
287,0.33705076575279236,2023-09-04 21:17:22.102639,2023-09-04 21:17:23.157261,0 days 00:00:01.054622,Leaky,Sigmoid,,,86,24,15.0,,,0.006733659524979478,2,148,0.7712853608427477,0.00033226517952413025,216.88417803446453,COMPLETE
288,0.3673946261405945,2023-09-04 21:17:23.157546,2023-09-04 21:17:24.035901,0 days 00:00:00.878355,Leaky,Sigmoid,,,91,23,15.0,,,0.0030975156337619014,2,135,0.5834851154516897,0.0005793608845878779,346.0691025345414,COMPLETE
289,0.49852117896080017,2023-09-04 21:17:24.036189,2023-09-04 21:17:24.270499,0 days 00:00:00.234310,Leaky,Sigmoid,,,88,24,15.0,,,0.008194594132417118,2,122,0.14934863390394737,0.0009800655318814198,497.34822096914615,COMPLETE
290,0.32942989468574524,2023-09-04 21:17:24.270792,2023-09-04 21:17:25.389264,0 days 00:00:01.118472,Leaky,Sigmoid,,,84,21,14.0,,,0.01537283088980738,2,159,0.7140302228188737,1.0079225317622519e-05,133.15294332352894,COMPLETE
291,0.4519188702106476,2023-09-04 21:17:25.389764,2023-09-04 21:17:26.621495,0 days 00:00:01.231731,Leaky,Sigmoid,Sigmoid,,80,24,16.0,7.0,,0.0012757359263181926,3,103,0.643939196675807,0.0005455089147163952,430.2985402079462,COMPLETE
292,0.31959792971611023,2023-09-04 21:17:26.621787,2023-09-04 21:17:28.173619,0 days 00:00:01.551832,Leaky,Sigmoid,,,60,22,14.0,,,0.004360371086863376,2,385,0.7449084420667095,0.0007456433989360876,142.17548617658943,COMPLETE
293,0.445639967918396,2023-09-04 21:17:28.173912,2023-09-04 21:17:28.343615,0 days 00:00:00.169703,Leaky,Tanh,,,55,23,21.0,,,0.009798969847816707,2,88,0.10110274452220985,3.460749904696052e-05,241.946736323369,COMPLETE
294,0.7192447185516357,2023-09-04 21:17:28.343928,2023-09-04 21:17:29.138322,0 days 00:00:00.794394,Leaky,Sigmoid,ReLU,Leaky,57,23,20.0,19.0,1.0,0.012344231636496719,4,109,0.3983654923888951,0.0002957984596762968,147.9595242375913,COMPLETE
295,0.5263913869857788,2023-09-04 21:17:29.138634,2023-09-04 21:17:30.000629,0 days 00:00:00.861995,Leaky,Sigmoid,,,41,5,22.0,,,0.005897066534808329,2,395,0.7944330472538695,0.0007654343230088885,252.10034916318696,COMPLETE
296,0.37811076641082764,2023-09-04 21:17:30.000934,2023-09-04 21:17:30.755467,0 days 00:00:00.754533,Leaky,Sigmoid,,,67,21,14.0,,,0.007584956821866255,2,226,0.5102631729316679,0.0008877481482795919,139.96684920113043,COMPLETE
297,0.30450859665870667,2023-09-04 21:17:30.755770,2023-09-04 21:17:31.280120,0 days 00:00:00.524350,Leaky,Tanh,,,92,20,19.0,,,0.010006091626579504,2,64,0.6969496574606584,0.00041965022052374085,108.0915937423706,COMPLETE
298,0.32789182662963867,2023-09-04 21:17:31.280425,2023-09-04 21:17:31.700697,0 days 00:00:00.420272,Leaky,Tanh,,,92,19,19.0,,,0.015182018482868775,2,51,0.694823822213723,2.8059556255489543e-05,143.91476051480163,COMPLETE
299,0.315792441368103,2023-09-04 21:17:31.700999,2023-09-04 21:17:32.179435,0 days 00:00:00.478436,Leaky,Tanh,,,62,11,19.0,,,0.01216393506559176,2,65,0.7253036753248095,0.0003894230523537144,135.70233391655816,COMPLETE
300,0.35639363527297974,2023-09-04 21:17:32.179768,2023-09-04 21:17:32.624564,0 days 00:00:00.444796,Leaky,Tanh,,,86,20,20.0,,,0.010777507589535953,2,57,0.6742001135033114,0.0004606133387799409,144.47216782479916,COMPLETE
301,0.3370237350463867,2023-09-04 21:17:32.624867,2023-09-04 21:17:33.381863,0 days 00:00:00.756996,Leaky,Tanh,,,93,24,20.0,,,0.005344107502975848,2,132,0.7686368241297273,0.0004031768036040656,158.0869301882657,COMPLETE
302,0.3390968441963196,2023-09-04 21:17:33.382162,2023-09-04 21:17:34.410619,0 days 00:00:01.028457,Leaky,Tanh,,,46,20,19.0,,,0.009435618781217145,2,75,0.7991856679535686,0.0005143882096920149,797.4996256510417,COMPLETE
303,0.34420621395111084,2023-09-04 21:17:34.410910,2023-09-04 21:17:35.004187,0 days 00:00:00.593277,Leaky,Tanh,,,89,22,20.0,,,0.006554846761980678,2,71,0.7064161209946155,5.150027160714941e-05,184.14047542088468,COMPLETE
304,0.34201475977897644,2023-09-04 21:17:35.004481,2023-09-04 21:17:36.229103,0 days 00:00:01.224622,Leaky,Sigmoid,,,92,19,19.0,,,0.013721247482516519,2,81,0.7441282539976602,0.00020534443189476278,253.09402626439146,COMPLETE
305,0.702846884727478,2023-09-04 21:17:36.229599,2023-09-04 21:17:36.910427,0 days 00:00:00.680828,Leaky,,,,90,1,,,,0.004449271401444559,1,138,0.763122570086708,2.275504608673789e-05,276.9076959710372,COMPLETE
306,0.2876179814338684,2023-09-04 21:17:36.910792,2023-09-04 21:17:37.419019,0 days 00:00:00.508227,Leaky,Sigmoid,,,98,24,19.0,,,0.01686374334984799,2,172,0.7270122403787995,0.0001524550704185671,132.38664553242344,COMPLETE
307,0.32497814297676086,2023-09-04 21:17:37.419319,2023-09-04 21:17:37.799177,0 days 00:00:00.379858,Leaky,Leaky,,,96,24,20.0,,,0.022413383447200057,2,171,0.6574114464427697,0.00022898324937861624,114.96947748520795,COMPLETE
308,1.0048654079437256,2023-09-04 21:17:37.799469,2023-09-04 21:17:39.345972,0 days 00:00:01.546503,Leaky,Sigmoid,Leaky,Tanh,97,24,19.0,10.0,5.0,1.2725866080862146e-05,4,162,0.691747692259037,0.00015076325763389219,139.31348334418402,COMPLETE
309,0.35029372572898865,2023-09-04 21:17:39.346294,2023-09-04 21:17:39.680317,0 days 00:00:00.334023,Sigmoid,Tanh,,,94,23,21.0,,,0.03434774154550617,2,153,0.7311400801670794,9.799527054256784e-05,144.31889851888022,COMPLETE
310,0.3792576491832733,2023-09-04 21:17:39.680617,2023-09-04 21:17:39.864981,0 days 00:00:00.184364,Leaky,Sigmoid,,,87,23,20.0,,,0.0188196225230662,2,145,0.23467102698419945,0.00010923624033386042,136.42486544008608,COMPLETE
311,0.37640541791915894,2023-09-04 21:17:39.865293,2023-09-04 21:17:40.459417,0 days 00:00:00.594124,Leaky,Sigmoid,,,50,24,19.0,,,0.015567490997401652,2,117,0.6178932923807167,0.00017175681121687244,124.19358799375337,COMPLETE
312,0.3853459656238556,2023-09-04 21:17:40.459715,2023-09-04 21:17:41.222074,0 days 00:00:00.762359,Leaky,Tanh,,,100,23,22.0,,,0.0036069681945264803,2,171,0.7152376915544454,0.00012441214905732254,147.63973485207072,COMPLETE
313,0.48501524329185486,2023-09-04 21:17:41.222366,2023-09-04 21:17:41.367431,0 days 00:00:00.145065,Leaky,Sigmoid,,,64,24,19.0,,,0.01756634096781387,2,125,0.11528908549465225,0.0001659663558118498,237.1528573414636,COMPLETE
314,0.3532410264015198,2023-09-04 21:17:41.367724,2023-09-04 21:17:42.022778,0 days 00:00:00.655054,Tanh,Sigmoid,,,53,22,18.0,,,0.0046976587242596205,2,61,0.6756601785514651,7.159192291492879e-05,145.01722267025806,COMPLETE
315,0.3316717743873596,2023-09-04 21:17:42.023078,2023-09-04 21:17:43.699962,0 days 00:00:01.676884,ReLU,Tanh,,,99,13,21.0,,,0.0029605526784900744,2,295,0.7522983652006776,0.0005777854207364227,367.91929798394864,COMPLETE
316,0.30785679817199707,2023-09-04 21:17:43.700275,2023-09-04 21:17:44.297989,0 days 00:00:00.597714,Leaky,Sigmoid,,,97,23,20.0,,,0.012029470559014505,2,178,0.7230791148239831,8.434601405905182e-05,163.82598794473185,COMPLETE
317,0.29614555835723877,2023-09-04 21:17:44.298302,2023-09-04 21:17:44.762810,0 days 00:00:00.464508,Leaky,Sigmoid,,,98,23,20.0,,,0.012821320650033816,2,174,0.6460488826570968,0.00012963317418505316,164.01725030323817,COMPLETE
318,0.3620893657207489,2023-09-04 21:17:44.763135,2023-09-04 21:17:45.396348,0 days 00:00:00.633213,Leaky,Sigmoid,Sigmoid,Leaky,98,23,20.0,23.0,16.0,0.024052767254297246,4,183,0.642446575630891,9.77136678348135e-05,170.04374501242566,COMPLETE
319,0.3330431878566742,2023-09-04 21:17:45.396670,2023-09-04 21:17:46.479406,0 days 00:00:01.082736,Leaky,Sigmoid,,,98,23,20.0,,,0.013845939482721961,2,165,0.6512420185721183,0.00014570765141134047,362.52896711561414,COMPLETE
320,0.624005913734436,2023-09-04 21:17:46.479917,2023-09-04 21:17:47.082744,0 days 00:00:00.602827,Leaky,Sigmoid,,,94,24,20.0,,,0.016886637914225913,2,180,0.6899988837773364,0.0366578098756504,151.91843208899866,COMPLETE
321,0.40124621987342834,2023-09-04 21:17:47.083251,2023-09-04 21:17:50.324403,0 days 00:00:03.241152,Tanh,Sigmoid,,,96,23,20.0,,,0.002009024951438678,2,174,0.6155236108108689,0.00013223229244973842,139.25870009674423,COMPLETE
322,0.3437964618206024,2023-09-04 21:17:50.324911,2023-09-04 21:17:51.160217,0 days 00:00:00.835306,Leaky,Sigmoid,,,96,23,19.0,,,0.011914132136822731,2,188,0.6674883029176658,7.887320920029076e-05,128.2300889258291,COMPLETE
323,0.36663389205932617,2023-09-04 21:17:51.160519,2023-09-04 21:17:51.554085,0 days 00:00:00.393566,Leaky,Sigmoid,,,100,24,12.0,,,0.021924356632740845,2,155,0.7113721915351165,0.00021896246229060015,171.60253734977877,COMPLETE
324,0.3755631744861603,2023-09-04 21:17:51.554383,2023-09-04 21:17:52.081723,0 days 00:00:00.527340,Leaky,Sigmoid,,,82,22,19.0,,,0.014450799140284944,2,308,0.597488467024224,0.0002741332139582897,225.9944004542391,COMPLETE
325,0.29924795031547546,2023-09-04 21:17:52.082029,2023-09-04 21:17:52.563302,0 days 00:00:00.481273,Leaky,Tanh,,,99,23,19.0,,,0.011535522945114639,2,153,0.716694520702076,0.00012444105884872874,145.91827799479168,COMPLETE
326,0.34664031863212585,2023-09-04 21:17:52.563627,2023-09-04 21:17:53.125543,0 days 00:00:00.561916,Tanh,Sigmoid,,,100,23,20.0,,,0.012335940814014198,2,175,0.6885176989724394,0.0001232035322245358,146.3393282503695,COMPLETE
327,0.3114924430847168,2023-09-04 21:17:53.125846,2023-09-04 21:17:53.419909,0 days 00:00:00.294063,Leaky,Tanh,,,97,23,19.0,,,0.017031526692930513,2,159,0.7112543529800087,0.0001551393586800593,138.09980970110212,COMPLETE
328,0.3236217200756073,2023-09-04 21:17:53.420212,2023-09-04 21:17:53.990505,0 days 00:00:00.570293,Leaky,Tanh,,,99,24,20.0,,,0.011947808757759157,2,275,0.6308546026899833,0.00010803827135326127,235.5881788253784,COMPLETE
329,0.3702291250228882,2023-09-04 21:17:53.990807,2023-09-04 21:17:54.361494,0 days 00:00:00.370687,Leaky,Tanh,,,96,22,19.0,,,0.007689014035477083,2,150,0.5596221860032268,0.00012244355562010236,199.21997724260603,COMPLETE
330,0.831916332244873,2023-09-04 21:17:54.361787,2023-09-04 21:17:54.565596,0 days 00:00:00.203809,Leaky,Tanh,,,98,23,1.0,,,0.010394681210187003,2,170,0.34370872362095034,0.00017271115376861558,168.08329441236413,COMPLETE
331,0.31303492188453674,2023-09-04 21:17:54.565901,2023-09-04 21:17:54.916336,0 days 00:00:00.350435,Tanh,Tanh,,,100,24,20.0,,,0.02046583329143819,2,164,0.7300201678279066,8.923604355141716e-05,133.17653855823335,COMPLETE
332,0.35766398906707764,2023-09-04 21:17:54.916664,2023-09-04 21:17:55.608903,0 days 00:00:00.692239,Leaky,Tanh,,,98,22,19.0,,,0.008750911558496046,2,99,0.6612770362969352,0.00018508796209640258,200.46538792660363,COMPLETE
333,0.3180999159812927,2023-09-04 21:17:55.609222,2023-09-04 21:17:56.045635,0 days 00:00:00.436413,Leaky,Tanh,,,66,23,21.0,,,0.014655995085442058,2,186,0.6911615994255362,0.00014473136160325767,123.55885488336736,COMPLETE
334,0.35298052430152893,2023-09-04 21:17:56.045957,2023-09-04 21:17:56.764139,0 days 00:00:00.718182,Leaky,Leaky,,,72,24,19.0,,,0.006472342153947874,2,176,0.7328240876808951,8.659159708311193e-05,215.34617838541666,COMPLETE
335,0.5886349678039551,2023-09-04 21:17:56.764451,2023-09-04 21:17:58.675191,0 days 00:00:01.910740,Sigmoid,Tanh,,,97,22,15.0,,,0.00017050879853935236,2,204,0.583087157131211,0.00011932087732358438,144.03127748825972,COMPLETE
336,0.3241695761680603,2023-09-04 21:17:58.675488,2023-09-04 21:17:59.176435,0 days 00:00:00.500947,Leaky,Tanh,ReLU,,95,23,16.0,9.0,,0.01085364270237278,3,159,0.6404440994800757,0.00023254831690383985,141.06088053385417,COMPLETE
337,0.4029169976711273,2023-09-04 21:17:59.176741,2023-09-04 21:17:59.323657,0 days 00:00:00.146916,Leaky,Sigmoid,,,70,24,20.0,,,0.029090408475197522,2,86,0.18936619037354552,6.134649449497149e-05,164.00115257085756,COMPLETE
338,0.3589005470275879,2023-09-04 21:17:59.323963,2023-09-04 21:17:59.569309,0 days 00:00:00.245346,ReLU,Tanh,,,68,22,19.0,,,0.013280523761093411,2,148,0.4511099456043221,0.0007426900870896546,163.96986301967075,COMPLETE
339,0.37529832124710083,2023-09-04 21:17:59.569605,2023-09-04 21:18:01.319205,0 days 00:00:01.749600,Tanh,Sigmoid,,,61,17,21.0,,,0.007881620132161921,2,194,0.7447869888183026,0.00032555783886395966,147.03627030928055,COMPLETE
340,0.3601636290550232,2023-09-04 21:18:01.319717,2023-09-04 21:18:02.503940,0 days 00:00:01.184223,Leaky,ReLU,Leaky,Tanh,65,23,18.0,8.0,9.0,0.005695691984725093,4,167,0.6725971172665434,2.701784640048844e-05,141.3466600321107,COMPLETE
341,0.33664777874946594,2023-09-04 21:18:02.504373,2023-09-04 21:18:02.961827,0 days 00:00:00.457454,Leaky,Sigmoid,,,59,22,14.0,,,0.018211616082378,2,316,0.7989194196429134,0.000192262000730039,166.14477666219076,COMPLETE
342,0.2973335385322571,2023-09-04 21:18:02.962140,2023-09-04 21:18:03.568960,0 days 00:00:00.606820,Leaky,Tanh,,,78,23,20.0,,,0.010186371400268918,2,65,0.7204484909388876,0.0008752380596374552,352.6393837928772,COMPLETE
343,0.8102007508277893,2023-09-04 21:18:03.569286,2023-09-04 21:18:04.207251,0 days 00:00:00.637965,Leaky,Tanh,,,76,22,19.0,,,2.9699630193012095e-05,2,64,0.7677470593217013,0.000647742131430088,146.31194257736206,COMPLETE
344,0.32477110624313354,2023-09-04 21:18:04.207545,2023-09-04 21:18:04.918167,0 days 00:00:00.710622,Tanh,Tanh,,,78,24,19.0,,,0.009469704561720412,2,82,0.6995566083437307,0.0010859374669285446,166.64031930697166,COMPLETE
345,0.32403701543807983,2023-09-04 21:18:04.918482,2023-09-04 21:18:05.698828,0 days 00:00:00.780346,Leaky,Tanh,,,63,23,18.0,,,0.006893556090696329,2,343,0.7703258983496529,0.0004367893642114883,188.28372289264013,COMPLETE
346,0.34367987513542175,2023-09-04 21:18:05.699344,2023-09-04 21:18:06.845197,0 days 00:00:01.145853,Leaky,Tanh,,,75,22,23.0,,,0.008629860881156014,2,94,0.7210739512563441,0.0007484057006497903,150.5336948741566,COMPLETE
347,0.3951376676559448,2023-09-04 21:18:06.845517,2023-09-04 21:18:07.315581,0 days 00:00:00.470064,Leaky,Tanh,,,85,24,20.0,,,0.005137591055727138,2,140,0.3171438186201757,0.0009046284504658735,640.0489095052084,COMPLETE
348,0.33804208040237427,2023-09-04 21:18:07.315889,2023-09-04 21:18:07.715160,0 days 00:00:00.399271,Leaky,Tanh,,,78,21,18.0,,,0.015568408098810533,2,78,0.6176193015453099,0.0005307290093418972,167.24999906578842,COMPLETE
349,0.3657671809196472,2023-09-04 21:18:07.715479,2023-09-04 21:18:08.425485,0 days 00:00:00.710006,Tanh,ReLU,Sigmoid,,80,23,21.0,7.0,,0.009791512611726855,3,152,0.6620983015349842,1.9170421982123257e-05,194.697998046875,COMPLETE
350,0.40171101689338684,2023-09-04 21:18:08.425805,2023-09-04 21:18:09.056853,0 days 00:00:00.631048,Leaky,,,,77,23,,,,0.006395383271761276,1,66,0.5247694244526538,0.0012360370790589143,163.44859822591147,COMPLETE
351,0.5344361662864685,2023-09-04 21:18:09.057363,2023-09-04 21:18:09.658436,0 days 00:00:00.601073,Leaky,Tanh,,,82,22,4.0,,,0.0005354886784417216,2,59,0.38336180022585564,2.1572542408474814e-05,143.0222510644945,COMPLETE
352,0.32081738114356995,2023-09-04 21:18:09.658810,2023-09-04 21:18:10.156436,0 days 00:00:00.497626,Leaky,ReLU,,,72,24,20.0,,,0.025224194574991244,2,72,0.7532949636246565,4.222793657185849e-05,123.48833038330078,COMPLETE
353,0.33584871888160706,2023-09-04 21:18:10.156757,2023-09-04 21:18:12.288489,0 days 00:00:02.131732,Leaky,Tanh,ReLU,Leaky,68,21,16.0,22.0,6.0,0.0011798835553713891,4,428,0.7991324985119176,3.218893756477468e-05,163.6434220486,COMPLETE
354,0.399478554725647,2023-09-04 21:18:12.288830,2023-09-04 21:18:13.032938,0 days 00:00:00.744108,Leaky,ReLU,,,65,23,19.0,,,0.0016047161202237252,2,413,0.28459351756872714,1.1291678949469724e-05,224.98339963762947,COMPLETE
355,0.3351227343082428,2023-09-04 21:18:13.033264,2023-09-04 21:18:13.929895,0 days 00:00:00.896631,Tanh,Leaky,,,28,22,18.0,,,0.007480682320358176,2,52,0.6919527242458462,0.0007653432184235311,148.34301200279822,COMPLETE
356,0.3314076066017151,2023-09-04 21:18:13.930198,2023-09-04 21:18:14.299664,0 days 00:00:00.369466,Leaky,Tanh,,,61,24,21.0,,,0.03851942090988369,2,141,0.737604345274397,1.7133164293651255e-05,120.64540608723958,COMPLETE
357,0.39184147119522095,2023-09-04 21:18:14.299990,2023-09-04 21:18:14.577648,0 days 00:00:00.277658,Leaky,ReLU,,,59,21,19.0,,,0.011897454676379171,2,283,0.3042164198073353,0.00027130765714646966,126.87663401090182,COMPLETE
358,0.4038829505443573,2023-09-04 21:18:14.577966,2023-09-04 21:18:15.726693,0 days 00:00:01.148727,Sigmoid,Tanh,,,67,23,13.0,,,0.004876658789248522,2,70,0.7122812481053229,1.0203208995677947e-05,179.11978846958706,COMPLETE
359,0.36119598150253296,2023-09-04 21:18:15.726999,2023-09-04 21:18:16.131176,0 days 00:00:00.404177,Leaky,ReLU,,,63,22,19.0,,,0.010252450795153112,2,330,0.767188332405923,0.000377602546665096,117.68969811333551,COMPLETE
360,0.3607438802719116,2023-09-04 21:18:16.131506,2023-09-04 21:18:16.737288,0 days 00:00:00.605782,Leaky,Sigmoid,,,31,24,20.0,,,0.015360946726562604,2,111,0.6410533842570333,2.7815996993168613e-05,159.91502952575684,COMPLETE
361,0.42618826031684875,2023-09-04 21:18:16.737659,2023-09-04 21:18:17.058976,0 days 00:00:00.321317,Tanh,Tanh,,,74,22,18.0,,,0.0059698271220377415,2,90,0.25333241727405736,0.0008852919057746434,217.40567107427688,COMPLETE
362,0.33262282609939575,2023-09-04 21:18:17.059286,2023-09-04 21:18:17.880241,0 days 00:00:00.820955,Leaky,Sigmoid,,,57,21,20.0,,,0.00750042007603116,2,130,0.6783990147533977,0.0005937536341355668,127.12221190508674,COMPLETE
363,0.425108402967453,2023-09-04 21:18:17.880769,2023-09-04 21:18:19.015760,0 days 00:00:01.134991,Leaky,ReLU,,,80,23,22.0,,,0.004011203223210804,2,152,0.41502178091118713,0.00048124737671676203,10882.207710884713,COMPLETE
364,0.4787060618400574,2023-09-04 21:18:19.016285,2023-09-04 21:18:19.720831,0 days 00:00:00.704546,ReLU,Sigmoid,,,66,16,17.0,,,0.013429290719241902,2,361,0.1614164464960393,6.724309990172295e-05,169.9562161504006,COMPLETE
365,0.34866634011268616,2023-09-04 21:18:19.721135,2023-09-04 21:18:20.310584,0 days 00:00:00.589449,Leaky,Tanh,,,69,23,15.0,,,0.01968808233371366,2,137,0.7263110374812738,2.4081977326902897e-05,119.31073560871062,COMPLETE
366,0.32935449481010437,2023-09-04 21:18:20.310894,2023-09-04 21:18:20.962006,0 days 00:00:00.651112,Leaky,ReLU,,,89,24,19.0,,,0.008629626265801042,2,401,0.7757804329002422,1.6008982537498722e-05,108.17552061338682,COMPLETE
367,0.3185690939426422,2023-09-04 21:18:20.962306,2023-09-04 21:18:21.843735,0 days 00:00:00.881429,Tanh,Sigmoid,,,64,22,18.0,,,0.010939724748124742,2,260,0.74580708548486,1.2636421378788086e-05,418.9189873190487,COMPLETE
368,0.33585110306739807,2023-09-04 21:18:21.844051,2023-09-04 21:18:22.290443,0 days 00:00:00.446392,Leaky,Sigmoid,,,71,21,20.0,,,0.01317967459519583,2,99,0.4937570502554863,1.8715060460431078e-05,178.6719810962677,COMPLETE
369,0.33622977137565613,2023-09-04 21:18:22.290747,2023-09-04 21:18:23.685864,0 days 00:00:01.395117,Leaky,Tanh,,,94,23,21.0,,,0.005300285482635685,2,162,0.5487138684985761,0.001603401069071593,168.55996607730262,COMPLETE
370,0.3529910445213318,2023-09-04 21:18:23.686389,2023-09-04 21:18:25.172338,0 days 00:00:01.485949,Leaky,ReLU,,,84,22,19.0,,,0.0022329399083140427,2,121,0.7000492667640932,0.00014317156301711856,246.2562074025472,COMPLETE
371,0.3956103026866913,2023-09-04 21:18:25.172682,2023-09-04 21:18:25.462505,0 days 00:00:00.289823,Leaky,Sigmoid,,,60,24,18.0,,,0.016675338776313102,2,147,0.4646789388347987,1.462076633566164e-05,168.79359083909256,COMPLETE
372,0.3411974012851715,2023-09-04 21:18:25.462823,2023-09-04 21:18:30.680458,0 days 00:00:05.217635,Tanh,Tanh,,,44,23,17.0,,,0.0008070848589301999,2,292,0.4363155121220357,2.227342627153334e-05,134.0555439256642,COMPLETE
373,0.3281387388706207,2023-09-04 21:18:30.680763,2023-09-04 21:18:31.161808,0 days 00:00:00.481045,Leaky,ReLU,,,76,21,16.0,,,0.00844462390232838,2,64,0.5881511277555669,4.418744720916399e-05,134.50745737552643,COMPLETE
374,0.3849251866340637,2023-09-04 21:18:31.162109,2023-09-04 21:18:32.652129,0 days 00:00:01.490020,Leaky,Sigmoid,Leaky,Tanh,33,11,19.0,4.0,13.0,0.006751354034505622,4,75,0.6664211123323961,3.2431903719056235e-05,156.58789591471353,COMPLETE
375,0.4904024004936218,2023-09-04 21:18:32.652477,2023-09-04 21:18:37.093268,0 days 00:00:04.440791,Leaky,Sigmoid,,,62,22,20.0,,,0.00010406093456436808,2,436,0.7479462090217522,0.00017974241310725377,146.06261188612072,COMPLETE
376,0.3280677795410156,2023-09-04 21:18:37.093566,2023-09-04 21:18:38.218934,0 days 00:00:01.125368,Leaky,Tanh,,,39,18,18.0,,,0.010351366852979629,2,384,0.7727946055926459,0.00011474114190840939,208.76703061555563,COMPLETE
377,0.4524914026260376,2023-09-04 21:18:38.219244,2023-09-04 21:18:39.127418,0 days 00:00:00.908174,Leaky,ReLU,,,87,23,15.0,,,0.00046270801693660586,2,113,0.7141115398456294,1.176219099123702e-05,153.76611449655178,COMPLETE
378,0.3562381863594055,2023-09-04 21:18:39.127722,2023-09-04 21:18:39.803181,0 days 00:00:00.675459,Tanh,Leaky,,,67,22,20.0,,,0.00401844720556502,2,128,0.6116112108693261,5.980579045974984e-05,310.64582203052663,COMPLETE
379,0.47994813323020935,2023-09-04 21:18:39.803480,2023-09-04 21:18:40.536340,0 days 00:00:00.732860,Leaky,Sigmoid,,,92,21,19.0,,,0.0008702383991433455,2,84,0.7952398249306988,0.000323730600200228,149.18320546831404,COMPLETE
380,0.30338793992996216,2023-09-04 21:18:40.536642,2023-09-04 21:18:41.080380,0 days 00:00:00.543738,Leaky,Tanh,,,47,24,11.0,,,0.020191153414253517,2,156,0.7994645661896105,0.00024311967892591928,167.78369531876,COMPLETE
