number,value,datetime_start,datetime_complete,duration,params_activation1,params_activation2,params_activation3,params_activation4,params_batch_size,params_fl1,params_fl2,params_fl3,params_fl4,params_learning_rate,params_n_layers,params_num_epochs,params_train_size,params_weight_decay,user_attrs_mre,state
1250,0.2946525812149048,2023-09-04 22:28:32.025277,2023-09-04 22:28:34.236350,0 days 00:00:02.211073,ReLU,Leaky,Sigmoid,Sigmoid,32,17,21.0,23.0,17.0,0.0012201072336819262,4,186,0.7978754009249261,7.655533033135483e-05,97.64129196513782,COMPLETE
1251,0.3351439833641052,2023-09-04 22:28:34.236801,2023-09-04 22:28:34.910459,0 days 00:00:00.673658,Sigmoid,Leaky,Sigmoid,Sigmoid,30,17,16.0,23.0,18.0,0.02549802606380225,4,228,0.7992041871370994,0.00012367312777016455,189.43363554581353,COMPLETE
1252,0.2649447023868561,2023-09-04 22:28:34.910903,2023-09-04 22:28:36.249389,0 days 00:00:01.338486,Tanh,Leaky,ReLU,Sigmoid,26,18,20.0,24.0,7.0,0.020042524393049852,4,234,0.7557143949203771,9.127806017555169e-05,101.53196161443537,COMPLETE
1253,0.2866069972515106,2023-09-04 22:28:36.249836,2023-09-04 22:28:37.398470,0 days 00:00:01.148634,Tanh,Leaky,Sigmoid,Sigmoid,30,16,18.0,22.0,19.0,0.031078968153398105,4,218,0.7438579777962822,5.8028085872394584e-05,173.38181762695314,COMPLETE
1254,0.537497878074646,2023-09-04 22:28:37.398915,2023-09-04 22:28:38.175650,0 days 00:00:00.776735,ReLU,Leaky,Sigmoid,Sigmoid,31,17,20.0,23.0,6.0,0.021929472718974333,4,240,0.20613008700422905,3.5167238115438795e-05,308.31000403201944,COMPLETE
1255,0.15734900534152985,2023-09-04 22:28:38.176493,2023-09-04 22:28:39.905335,0 days 00:00:01.728842,Sigmoid,Leaky,Sigmoid,Sigmoid,34,18,19.0,24.0,4.0,0.004694954320166226,4,248,0.7993786799564156,7.137187525937604e-05,128.3739354682691,COMPLETE
1256,0.5588896870613098,2023-09-04 22:28:39.905781,2023-09-04 22:28:40.503535,0 days 00:00:00.597754,Sigmoid,Leaky,Sigmoid,Sigmoid,31,18,19.0,24.0,4.0,0.003558574303384719,4,242,0.3461334723942608,7.121636379843063e-05,205.1752466837565,COMPLETE
1257,0.5563552975654602,2023-09-04 22:28:40.503985,2023-09-04 22:28:41.452050,0 days 00:00:00.948065,Sigmoid,Leaky,ReLU,Sigmoid,30,18,21.0,24.0,4.0,0.006267780502388621,4,229,0.7995067845140652,7.514860519282922e-05,249.03456393155184,COMPLETE
1258,0.6014314293861389,2023-09-04 22:28:41.452505,2023-09-04 22:28:43.200750,0 days 00:00:01.748245,Sigmoid,Leaky,Sigmoid,Sigmoid,32,17,20.0,24.0,5.0,0.0044363295486871315,4,235,0.7358872731214589,5.928719762075837e-05,222.14385294596354,COMPLETE
1259,0.37536880373954773,2023-09-04 22:28:43.201188,2023-09-04 22:28:44.263678,0 days 00:00:01.062490,Sigmoid,Leaky,Sigmoid,Sigmoid,27,18,19.0,24.0,2.0,0.008029901897841033,4,247,0.7043331696441084,8.207601933714361e-05,173.1398801803589,COMPLETE
1260,0.5791620016098022,2023-09-04 22:28:44.264124,2023-09-04 22:28:44.926137,0 days 00:00:00.662013,Sigmoid,Leaky,Sigmoid,Sigmoid,31,18,20.0,24.0,3.0,0.0021388888205453502,4,224,0.6112958312775618,5.2924158419193017e-05,163.2071424630972,COMPLETE
1261,0.6014319658279419,2023-09-04 22:28:44.926596,2023-09-04 22:28:45.311227,0 days 00:00:00.384631,Sigmoid,Leaky,Sigmoid,Sigmoid,32,17,19.0,24.0,5.0,0.004954342804315592,4,237,0.5028770720508802,6.905462098436027e-05,192.7473136054145,COMPLETE
1262,0.306495726108551,2023-09-04 22:28:45.311686,2023-09-04 22:28:46.602298,0 days 00:00:01.290612,Sigmoid,Leaky,ReLU,Sigmoid,29,18,21.0,24.0,4.0,0.005300651121218459,4,249,0.32724480233687986,4.442300836789677e-05,108.64899302337129,COMPLETE
1263,0.5970809459686279,2023-09-04 22:28:46.602756,2023-09-04 22:28:47.005825,0 days 00:00:00.403069,Sigmoid,Leaky,Sigmoid,Sigmoid,34,18,20.0,23.0,4.0,0.0038558933114185255,4,215,0.12214629189179219,8.331554956667844e-05,184.9916399362925,COMPLETE
1264,1.1257736682891846,2023-09-04 22:28:47.006274,2023-09-04 22:28:47.752134,0 days 00:00:00.745860,Sigmoid,Leaky,Sigmoid,Sigmoid,34,17,21.0,24.0,5.0,0.002794465989243451,4,231,0.7703453278699367,0.00553470661884126,102.69891385678892,COMPLETE
1265,0.6688975691795349,2023-09-04 22:28:47.752657,2023-09-04 22:28:48.257502,0 days 00:00:00.504845,Sigmoid,Leaky,Sigmoid,Sigmoid,29,18,20.0,24.0,4.0,0.005919549424748255,4,243,0.23791187131500083,0.00010355971137279952,200.04109477996826,COMPLETE
1266,0.31837043166160583,2023-09-04 22:28:48.257946,2023-09-04 22:28:54.611388,0 days 00:00:06.353442,Sigmoid,Leaky,ReLU,Sigmoid,32,18,19.0,23.0,5.0,0.0035365283691342433,4,221,0.54685298464,6.55513646384859e-05,632.8465097661604,COMPLETE
1267,0.26650550961494446,2023-09-04 22:28:54.611859,2023-09-04 22:28:56.650470,0 days 00:00:02.038611,Sigmoid,Leaky,Sigmoid,Sigmoid,33,17,20.0,23.0,2.0,0.008935277778818805,4,184,0.745376014241773,8.817883648600604e-05,178.04303732263037,COMPLETE
1268,0.5499392151832581,2023-09-04 22:28:56.650976,2023-09-04 22:28:57.241686,0 days 00:00:00.590710,Sigmoid,Leaky,Leaky,Sigmoid,28,18,3.0,24.0,3.0,0.006561271155321359,4,240,0.3767673831166177,4.7644914190446935e-05,256.0125155978733,COMPLETE
1269,0.7465775609016418,2023-09-04 22:28:57.242133,2023-09-04 22:28:59.562545,0 days 00:00:02.320412,Sigmoid,Leaky,Sigmoid,Sigmoid,25,18,18.0,23.0,1.0,0.0022061930578131934,4,251,0.251058278470136,0.00010410740980673905,1652.47266939138,COMPLETE
1270,0.4371653199195862,2023-09-04 22:28:59.563010,2023-09-04 22:29:01.251673,0 days 00:00:01.688663,Sigmoid,Leaky,Sigmoid,Sigmoid,32,19,21.0,23.0,5.0,0.003229114467665885,4,230,0.43030443698333026,0.0006984146100799066,153.019875730787,COMPLETE
1271,1.0914949178695679,2023-09-04 22:29:01.252128,2023-09-04 22:29:01.707387,0 days 00:00:00.455259,Sigmoid,Leaky,Sigmoid,Sigmoid,30,18,21.0,24.0,6.0,0.007293096970743347,4,209,0.662523643088088,0.02948654502237617,104.59140110015869,COMPLETE
1272,0.7049187421798706,2023-09-04 22:29:01.707835,2023-09-04 22:29:02.292011,0 days 00:00:00.584176,Sigmoid,Leaky,ReLU,Sigmoid,33,16,20.0,24.0,6.0,0.004841617735319258,4,237,0.3274708332087526,7.15828828088254e-05,170.11423333485922,COMPLETE
1273,0.5578011870384216,2023-09-04 22:29:02.292467,2023-09-04 22:29:03.307327,0 days 00:00:01.014860,Sigmoid,Leaky,Sigmoid,Sigmoid,30,17,19.0,23.0,5.0,0.010004437614953116,4,225,0.7164470245122345,5.37429328023771e-05,229.46441668998904,COMPLETE
1274,0.586185097694397,2023-09-04 22:29:03.307779,2023-09-04 22:29:04.474303,0 days 00:00:01.166524,Sigmoid,Leaky,Sigmoid,Sigmoid,26,17,20.0,24.0,4.0,0.00287903083115328,4,248,0.799807129469542,4.118645703761136e-05,209.6266023736251,COMPLETE
1275,0.6755879521369934,2023-09-04 22:29:04.474757,2023-09-04 22:29:04.688414,0 days 00:00:00.213657,Sigmoid,Leaky,Sigmoid,Sigmoid,34,18,20.0,22.0,6.0,0.01859380904479687,4,174,0.1253748068928107,0.00011863266613005137,208.2780322265625,COMPLETE
1276,0.6646794676780701,2023-09-04 22:29:04.688920,2023-09-04 22:29:05.568360,0 days 00:00:00.879440,Sigmoid,Leaky,ReLU,Sigmoid,33,19,19.0,23.0,5.0,0.0019071878572634831,4,258,0.4031394735038383,0.007275560621073964,168.3379184353736,COMPLETE
1277,0.33769410848617554,2023-09-04 22:29:05.568815,2023-09-04 22:29:06.411773,0 days 00:00:00.842958,Tanh,Leaky,Sigmoid,Sigmoid,88,16,21.0,21.0,3.0,0.008900847661708646,4,216,0.585206245842075,0.0004291530060962492,120.98947275095972,COMPLETE
1278,0.6286444067955017,2023-09-04 22:29:06.412230,2023-09-04 22:29:07.324924,0 days 00:00:00.912694,Sigmoid,Leaky,Sigmoid,Sigmoid,28,19,20.0,24.0,4.0,0.004573501611061326,4,243,0.749822730273497,6.25764615083676e-05,257.56892681121826,COMPLETE
1279,0.4327180087566376,2023-09-04 22:29:07.325369,2023-09-04 22:29:07.683437,0 days 00:00:00.358068,Tanh,Leaky,Sigmoid,Sigmoid,91,19,15.0,23.0,5.0,0.01146076552466511,4,226,0.2187216774833673,9.146402056363359e-05,245.06398893083846,COMPLETE
1280,0.4231967329978943,2023-09-04 22:29:07.683891,2023-09-04 22:29:08.088347,0 days 00:00:00.404456,Tanh,Leaky,Sigmoid,Sigmoid,30,18,21.0,23.0,6.0,0.015095962436766764,4,190,0.19221569409749856,7.535994723555058e-05,120.11321241959281,COMPLETE
1281,0.8069946765899658,2023-09-04 22:29:08.088794,2023-09-04 22:29:08.464610,0 days 00:00:00.375816,ReLU,Leaky,ReLU,Sigmoid,34,17,19.0,22.0,5.0,0.0038539953642508407,4,235,0.6883888365473639,0.021878916111047527,99.60748995267429,COMPLETE
1282,0.1768008917570114,2023-09-04 22:29:08.465055,2023-09-04 22:29:09.677013,0 days 00:00:01.211958,Tanh,Leaky,Sigmoid,Sigmoid,28,19,20.0,24.0,16.0,0.0192587162179764,4,307,0.7710155254267237,0.0001352446430431696,121.36763651778058,COMPLETE
1283,0.8166331052780151,2023-09-04 22:29:09.677478,2023-09-04 22:29:17.439212,0 days 00:00:07.761734,Sigmoid,Leaky,Sigmoid,Sigmoid,29,19,20.0,24.0,17.0,4.204802527377569e-05,4,307,0.7714797852573662,0.0001500195050190497,145.10306551557412,COMPLETE
1284,0.2481420934200287,2023-09-04 22:29:17.439661,2023-09-04 22:29:19.092071,0 days 00:00:01.652410,Tanh,Leaky,Sigmoid,Sigmoid,29,19,18.0,24.0,16.0,0.0058919885799137055,4,292,0.7714029483295793,0.00012943834674800534,108.07443815662015,COMPLETE
1285,0.25767841935157776,2023-09-04 22:29:19.092519,2023-09-04 22:29:20.461420,0 days 00:00:01.368901,Tanh,Leaky,Sigmoid,ReLU,25,19,21.0,24.0,16.0,0.02344839308196311,4,297,0.7679144817874024,0.00011172773659368947,214.74693593111905,COMPLETE
1286,0.2789834141731262,2023-09-04 22:29:20.461872,2023-09-04 22:29:22.259081,0 days 00:00:01.797209,ReLU,Leaky,ReLU,Sigmoid,26,18,20.0,24.0,17.0,0.019097943261677193,4,313,0.7996075855622682,0.0015182701567836047,207.87195434570313,COMPLETE
1287,0.545883059501648,2023-09-04 22:29:22.259529,2023-09-04 22:29:22.568016,0 days 00:00:00.308487,Tanh,Leaky,Sigmoid,Sigmoid,27,19,19.0,24.0,15.0,0.012959436252768875,4,312,0.1261466406282658,0.00013333762988573052,165.70442884396283,COMPLETE
1288,0.25742554664611816,2023-09-04 22:29:22.568469,2023-09-04 22:29:24.734689,0 days 00:00:02.166220,Sigmoid,Leaky,Leaky,Sigmoid,26,19,21.0,24.0,15.0,0.007892689949370339,4,305,0.7342007210141401,0.00016398218478144542,177.3037735178501,COMPLETE
1289,0.3674127161502838,2023-09-04 22:29:24.735151,2023-09-04 22:29:25.455020,0 days 00:00:00.719869,Tanh,,,,24,18,,,,0.026915116033176242,1,292,0.7473651478327153,0.00010829703827782115,232.77651577904112,COMPLETE
1290,0.34626129269599915,2023-09-04 22:29:25.455451,2023-09-04 22:29:27.252120,0 days 00:00:01.796669,ReLU,Leaky,Sigmoid,Sigmoid,27,19,19.0,24.0,16.0,0.015986202152439764,4,305,0.7710215829347714,0.00014246479731837286,130.58546629406158,COMPLETE
1291,0.82292240858078,2023-09-04 22:29:27.252570,2023-09-04 22:29:35.278959,0 days 00:00:08.026389,Tanh,Leaky,Sigmoid,Sigmoid,28,18,20.0,24.0,16.0,1.868661961403862e-05,4,295,0.7989267044943196,0.00019358835400557577,143.3380247471696,COMPLETE
1292,0.3462238311767578,2023-09-04 22:29:35.279423,2023-09-04 22:29:36.452497,0 days 00:00:01.173074,Sigmoid,Leaky,ReLU,ReLU,31,18,21.0,23.0,16.0,0.010286214361576925,4,314,0.7119637447127567,0.001104604100759391,114.53098621774227,COMPLETE
1293,0.4511222839355469,2023-09-04 22:29:36.452943,2023-09-04 22:29:45.017531,0 days 00:00:08.564588,Tanh,Leaky,Sigmoid,Sigmoid,29,19,13.0,23.0,16.0,7.589601870252803e-05,4,309,0.7400748278780328,9.981536589233594e-05,151.16264404988212,COMPLETE
1294,0.3411908745765686,2023-09-04 22:29:45.017986,2023-09-04 22:29:47.452772,0 days 00:00:02.434786,Tanh,Leaky,Sigmoid,Sigmoid,24,18,20.0,24.0,17.0,0.002306056875870736,4,301,0.7170965011000265,0.002829730265227886,294.49955513363795,COMPLETE
1295,0.2712182104587555,2023-09-04 22:29:47.453224,2023-09-04 22:29:48.443034,0 days 00:00:00.989810,ReLU,Leaky,Tanh,Sigmoid,31,19,4.0,23.0,16.0,0.013071106226961447,4,307,0.7717012334919479,0.000128367994472763,2143.618599556588,COMPLETE
1296,0.5891163349151611,2023-09-04 22:29:48.443497,2023-09-04 22:29:55.671359,0 days 00:00:07.227862,Sigmoid,Leaky,Sigmoid,Sigmoid,28,18,17.0,24.0,16.0,0.00011689062199299394,4,286,0.7496333022333306,0.00016585251380508718,175.55888452063073,COMPLETE
1297,0.3766229450702667,2023-09-04 22:29:55.671836,2023-09-04 22:29:56.839953,0 days 00:00:01.168117,Tanh,Leaky,ReLU,Sigmoid,30,17,20.0,23.0,17.0,0.019157523285574705,4,299,0.6872799999176489,0.00031905587879829623,262.43079051565616,COMPLETE
1298,0.4220212996006012,2023-09-04 22:29:56.840409,2023-09-04 22:29:57.902112,0 days 00:00:01.061703,Tanh,Leaky,Sigmoid,ReLU,32,19,19.0,24.0,15.0,0.015509425589126501,4,256,0.4534815668218066,0.013329193506494145,213.79414057731628,COMPLETE
1299,0.39828747510910034,2023-09-04 22:29:57.902568,2023-09-04 22:29:59.122046,0 days 00:00:01.219478,Sigmoid,Leaky,Sigmoid,Sigmoid,30,18,21.0,23.0,18.0,0.006708057914517833,4,312,0.6558130520739281,0.00023454327866132522,202.2763304533782,COMPLETE
1300,0.3421156108379364,2023-09-04 22:29:59.122489,2023-09-04 22:30:00.581008,0 days 00:00:01.458519,ReLU,Leaky,Sigmoid,Sigmoid,24,19,20.0,23.0,17.0,0.0016901362414193084,4,252,0.4371097672914728,0.0005820315610325988,99.35463256835938,COMPLETE
1301,0.3999497890472412,2023-09-04 22:30:00.581457,2023-09-04 22:30:03.168500,0 days 00:00:02.587043,Tanh,Tanh,Sigmoid,Sigmoid,26,17,19.0,24.0,16.0,0.0008388773267282607,4,259,0.7700739415284867,9.601999109484006e-05,237.57193588424514,COMPLETE
1302,0.4156365394592285,2023-09-04 22:30:03.168966,2023-09-04 22:30:03.823237,0 days 00:00:00.654271,Tanh,Leaky,ReLU,Leaky,27,19,18.0,22.0,19.0,0.022571613178022636,4,285,0.632393862355282,0.005216434482051063,127.27242787679036,COMPLETE
1303,0.7406975030899048,2023-09-04 22:30:03.823792,2023-09-04 22:30:11.156755,0 days 00:00:07.332963,Sigmoid,Leaky,Sigmoid,Leaky,23,17,21.0,24.0,18.0,2.850182045146467e-05,4,248,0.7244837095445554,0.00018809668638172499,211.9909195130871,COMPLETE
1304,0.8485551476478577,2023-09-04 22:30:11.157232,2023-09-04 22:30:14.231301,0 days 00:00:03.074069,Tanh,Leaky,Sigmoid,Sigmoid,28,18,20.0,23.0,15.0,2.172595994558095e-05,4,280,0.3058266616198927,0.00011939782374141318,130.82854101998464,COMPLETE
1305,0.36589908599853516,2023-09-04 22:30:14.231778,2023-09-04 22:30:15.246872,0 days 00:00:01.015094,ReLU,Leaky,Sigmoid,Leaky,33,18,19.0,23.0,20.0,0.00026845263716153704,4,300,0.157328699283846,0.00015070957605459504,145.57975508949974,COMPLETE
1306,0.3060474097728729,2023-09-04 22:30:15.247315,2023-09-04 22:30:17.099631,0 days 00:00:01.852316,Tanh,Leaky,ReLU,Sigmoid,35,19,20.0,24.0,18.0,0.010846449827568137,4,242,0.46155499893093477,0.0002692002862107549,141.05725808870994,COMPLETE
1307,0.3681448698043823,2023-09-04 22:30:17.100143,2023-09-04 22:30:18.474703,0 days 00:00:01.374560,Sigmoid,Leaky,Sigmoid,Leaky,31,18,19.0,22.0,1.0,0.009201853830479823,4,253,0.7997417922304793,0.00045758084566912405,168.21041092218138,COMPLETE
1308,1.2082750797271729,2023-09-04 22:30:18.475222,2023-09-04 22:30:18.739661,0 days 00:00:00.264439,Tanh,Leaky,Sigmoid,ReLU,94,17,21.0,24.0,2.0,0.004208430941018555,4,174,0.7452050525543669,0.01025370595564172,108.9523173740932,COMPLETE
1309,0.4226178824901581,2023-09-04 22:30:18.740153,2023-09-04 22:30:19.210626,0 days 00:00:00.470473,ReLU,Leaky,Sigmoid,Leaky,31,19,7.0,23.0,16.0,0.013870116737427263,4,263,0.2683100384448547,8.544565234194215e-05,147.21674905172208,COMPLETE
1310,0.4278111457824707,2023-09-04 22:30:19.211107,2023-09-04 22:30:19.706626,0 days 00:00:00.495519,Tanh,Leaky,Sigmoid,Sigmoid,28,16,20.0,22.0,17.0,0.017429760813245584,4,290,0.2760890596264832,0.0002032954840811075,130.9552156548751,COMPLETE
1311,0.5318650603294373,2023-09-04 22:30:19.707158,2023-09-04 22:30:22.166853,0 days 00:00:02.459695,Tanh,Leaky,ReLU,Leaky,34,19,21.0,24.0,19.0,5.170021579161021e-05,4,244,0.3121059973968742,0.01422887958635281,135.349636484365,COMPLETE
1312,0.29245302081108093,2023-09-04 22:30:22.167330,2023-09-04 22:30:23.230945,0 days 00:00:01.063615,Sigmoid,Leaky,Sigmoid,Sigmoid,35,18,20.0,23.0,7.0,0.02727277970484154,4,271,0.6977526744189497,0.0003479634978020851,207.42506090799967,COMPLETE
1313,0.6312952637672424,2023-09-04 22:30:23.231422,2023-09-04 22:30:26.797608,0 days 00:00:03.566186,Tanh,Leaky,Sigmoid,Leaky,90,19,20.0,23.0,18.0,3.0320766470571878e-05,4,314,0.7721175562991122,0.00335810307183089,137.76670572560303,COMPLETE
1314,0.2845989465713501,2023-09-04 22:30:26.798081,2023-09-04 22:30:27.628594,0 days 00:00:00.830513,ReLU,Leaky,Leaky,Leaky,30,17,19.0,24.0,15.0,0.01162603478501248,4,239,0.6043226607642372,2.4995027844261473e-05,126.39985223718591,COMPLETE
1315,0.2939645051956177,2023-09-04 22:30:27.629049,2023-09-04 22:30:28.160972,0 days 00:00:00.531923,Tanh,Leaky,Sigmoid,Sigmoid,45,18,21.0,21.0,17.0,0.020021836405238042,4,252,0.37191551295651026,0.00011068813889313067,117.26400176338528,COMPLETE
1316,0.8244878053665161,2023-09-04 22:30:28.161447,2023-09-04 22:30:35.774558,0 days 00:00:07.613111,Sigmoid,Leaky,ReLU,Leaky,32,19,19.0,23.0,2.0,1.205023896021429e-05,4,234,0.7993945225279482,0.00016244792805532107,177.73972428150665,COMPLETE
1317,0.2838096618652344,2023-09-04 22:30:35.775024,2023-09-04 22:30:36.410893,0 days 00:00:00.635869,Tanh,Leaky,Sigmoid,Sigmoid,89,18,18.0,22.0,20.0,0.008056885913221986,4,299,0.7256521256131656,0.00023828499691968578,531.4215352583905,COMPLETE
1318,0.41523370146751404,2023-09-04 22:30:36.411364,2023-09-04 22:30:37.354332,0 days 00:00:00.942968,ReLU,Leaky,Sigmoid,Leaky,58,18,20.0,24.0,19.0,0.003236956606864429,4,180,0.5790418422479302,2.1917277937088587e-05,128.10990768008762,COMPLETE
1319,0.44067269563674927,2023-09-04 22:30:37.354797,2023-09-04 22:30:38.797132,0 days 00:00:01.442335,Tanh,Leaky,Tanh,Sigmoid,33,20,21.0,23.0,1.0,0.0010587191911585463,4,247,0.16598662208356393,0.00013104970761068435,151.51202476941623,COMPLETE
1320,0.8128430843353271,2023-09-04 22:30:38.797973,2023-09-04 22:30:48.603785,0 days 00:00:09.805812,Sigmoid,Leaky,Sigmoid,Leaky,29,16,20.0,24.0,21.0,1.1138343390872128e-05,4,261,0.7491127714002571,8.000092406646169e-05,128.75651661372277,COMPLETE
1321,0.3379921317100525,2023-09-04 22:30:48.604243,2023-09-04 22:30:49.224189,0 days 00:00:00.619946,Tanh,Leaky,ReLU,Leaky,87,17,2.0,23.0,18.0,0.005632171216699584,4,280,0.4103648951096235,3.0681576854921333e-05,746.7225041043931,COMPLETE
1322,0.30255556106567383,2023-09-04 22:30:49.224676,2023-09-04 22:30:49.866900,0 days 00:00:00.642224,Tanh,Leaky,Sigmoid,ReLU,92,19,21.0,22.0,17.0,0.014852059552664458,4,234,0.6715271609209673,9.597909046442347e-05,119.65794658660889,COMPLETE
1323,0.6751800775527954,2023-09-04 22:30:49.867365,2023-09-04 22:30:51.807483,0 days 00:00:01.940118,Sigmoid,Tanh,Sigmoid,Sigmoid,32,18,19.0,24.0,3.0,0.00010815405716253398,4,269,0.2064845184554562,0.00021015323168734832,129.31164508238157,COMPLETE
1324,0.32086804509162903,2023-09-04 22:30:51.807947,2023-09-04 22:30:52.514820,0 days 00:00:00.706873,ReLU,Leaky,Sigmoid,Leaky,26,15,19.0,12.0,7.0,0.011993824346427031,4,243,0.3311071326945657,0.0002882545014190695,111.4832295009068,COMPLETE
1325,0.963681697845459,2023-09-04 22:30:52.515303,2023-09-04 22:30:53.303955,0 days 00:00:00.788652,Tanh,Leaky,Sigmoid,Sigmoid,35,1,20.0,23.0,8.0,0.023118989137757225,4,255,0.7143818608164489,0.06105924440173108,116.8934428691864,COMPLETE
1326,0.3984447717666626,2023-09-04 22:30:53.304420,2023-09-04 22:30:53.733015,0 days 00:00:00.428595,Tanh,Leaky,ReLU,Leaky,28,20,20.0,11.0,19.0,0.016454108426869108,4,232,0.22763874077298624,0.004164991418968047,158.8700390865928,COMPLETE
1327,0.8295444250106812,2023-09-04 22:30:53.733481,2023-09-04 22:30:54.011318,0 days 00:00:00.277837,Sigmoid,Leaky,Sigmoid,Sigmoid,65,19,21.0,22.0,6.0,0.009169524042669018,4,167,0.1498043425465363,0.0009704026732396372,321.074709777832,COMPLETE
1328,0.87986159324646,2023-09-04 22:30:54.011854,2023-09-04 22:30:55.384847,0 days 00:00:01.372993,Tanh,Leaky,Sigmoid,Leaky,89,18,18.0,21.0,16.0,4.720548954303285e-05,4,241,0.34159758890578296,0.00017994799188670771,146.98157513883598,COMPLETE
1329,0.9856475591659546,2023-09-04 22:30:55.385302,2023-09-04 22:30:55.682801,0 days 00:00:00.297499,ReLU,Leaky,Sigmoid,Leaky,63,17,8.0,24.0,20.0,0.0312621394969676,4,301,0.54251074623157,0.0022855775734393867,100.48598395453558,COMPLETE
1330,0.6806513667106628,2023-09-04 22:30:55.683257,2023-09-04 22:30:57.000652,0 days 00:00:01.317395,Tanh,Leaky,ReLU,Sigmoid,86,20,20.0,23.0,7.0,8.682026361816873e-05,4,287,0.2629394762757644,0.002025280649832553,166.2600104302064,COMPLETE
1331,0.3568170964717865,2023-09-04 22:30:57.001105,2023-09-04 22:30:58.122856,0 days 00:00:01.121751,Sigmoid,Leaky,Sigmoid,Leaky,47,19,21.0,24.0,17.0,0.006709977603471013,4,307,0.45576296885208706,0.00014294926870610683,182.43474507331848,COMPLETE
1332,0.3029451072216034,2023-09-04 22:30:58.123330,2023-09-04 22:31:00.348051,0 days 00:00:02.224721,Tanh,Leaky,Sigmoid,Sigmoid,31,18,19.0,23.0,18.0,0.013534865495409658,4,262,0.558962929786817,0.0003783046001175094,117.88411100287186,COMPLETE
1333,0.2966313064098358,2023-09-04 22:31:00.348508,2023-09-04 22:31:00.783416,0 days 00:00:00.434908,ReLU,Leaky,Sigmoid,ReLU,87,19,20.0,20.0,19.0,0.01831402572395627,4,251,0.3587083964004176,0.0006099398648295442,120.66792122262423,COMPLETE
1334,0.599259078502655,2023-09-04 22:31:00.783876,2023-09-04 22:31:01.087299,0 days 00:00:00.303423,Tanh,Leaky,Sigmoid,Leaky,85,17,11.0,24.0,6.0,0.039034850315758846,4,228,0.5271787702318876,7.45374132942028e-05,178.4034620920817,COMPLETE
1335,0.46702322363853455,2023-09-04 22:31:01.087768,2023-09-04 22:31:01.433515,0 days 00:00:00.345747,Sigmoid,Leaky,ReLU,Sigmoid,90,18,21.0,22.0,6.0,0.02240217581137213,4,276,0.1772696676724634,0.00010534936578300138,484.9843852703388,COMPLETE
1336,0.36923372745513916,2023-09-04 22:31:01.433969,2023-09-04 22:31:02.136686,0 days 00:00:00.702717,Tanh,Leaky,Sigmoid,Leaky,88,20,18.0,23.0,18.0,0.010739083080681734,4,238,0.7681427229322829,6.166702001331207e-05,253.42836520546362,COMPLETE
1337,0.6217272877693176,2023-09-04 22:31:02.137154,2023-09-04 22:31:09.281412,0 days 00:00:07.144258,Tanh,Leaky,Sigmoid,Leaky,33,19,20.0,24.0,3.0,3.9439922990011026e-05,4,249,0.7994443461211337,1.0000024794497553e-05,151.59123692646563,COMPLETE
