number,value,datetime_start,datetime_complete,duration,params_activation1,params_activation2,params_activation3,params_activation4,params_batch_size,params_fl1,params_fl2,params_fl3,params_fl4,params_learning_rate,params_n_layers,params_num_epochs,params_train_size,params_weight_decay,user_attrs_mre,state
714,0.3259042799472809,2023-09-04 22:19:02.710649,2023-09-04 22:19:04.316646,0 days 00:00:01.605997,Sigmoid,Sigmoid,Sigmoid,Sigmoid,28,18,22.0,23.0,16.0,0.017902347822123982,4,348,0.6744390264597667,0.00020072092469696637,137.60105520581442,COMPLETE
715,0.37499484419822693,2023-09-04 22:19:04.317071,2023-09-04 22:19:07.027535,0 days 00:00:02.710464,Leaky,Leaky,ReLU,Leaky,86,19,21.0,24.0,5.0,0.00011357836620952991,4,275,0.6219415145160784,0.0051481398332337445,154.49905287309127,COMPLETE
716,0.2284863442182541,2023-09-04 22:19:07.027941,2023-09-04 22:19:07.657364,0 days 00:00:00.629423,Tanh,Leaky,Sigmoid,Tanh,82,22,20.0,16.0,7.0,0.015062769993170202,4,121,0.7290906366214892,1.3825156215662317e-05,87.12503682012144,COMPLETE
717,0.28753411769866943,2023-09-04 22:19:07.657814,2023-09-04 22:19:08.396801,0 days 00:00:00.738987,Tanh,Leaky,Sigmoid,Tanh,81,23,19.0,16.0,7.0,0.01209641505906789,4,264,0.7496542148663717,1.3122600893767796e-05,113.42713334825304,COMPLETE
718,0.3470296859741211,2023-09-04 22:19:08.397309,2023-09-04 22:19:09.930448,0 days 00:00:01.533139,Tanh,Leaky,Sigmoid,Tanh,82,23,19.0,16.0,7.0,0.0011979323839079025,4,127,0.7260982722628381,1.156394678175251e-05,174.93573791023314,COMPLETE
719,0.4615851044654846,2023-09-04 22:19:09.930849,2023-09-04 22:19:10.137043,0 days 00:00:00.206194,Tanh,Leaky,Sigmoid,Tanh,79,22,14.0,17.0,7.0,0.0096063996760889,4,120,0.2778694519559133,1.5104209279510208e-05,1385.4444127965855,COMPLETE
720,0.2818603515625,2023-09-04 22:19:10.137463,2023-09-04 22:19:10.968966,0 days 00:00:00.831503,Tanh,Leaky,Sigmoid,Tanh,83,22,24.0,16.0,8.0,0.006551847821785615,4,259,0.7770037282172112,1.3754302850926604e-05,181.32961433164536,COMPLETE
721,0.33827105164527893,2023-09-04 22:19:10.969376,2023-09-04 22:19:11.347449,0 days 00:00:00.378073,Tanh,Leaky,Sigmoid,Tanh,84,22,20.0,18.0,7.0,0.01474770863611352,4,119,0.4690326586615633,0.0028445249818657777,176.0017120361328,COMPLETE
722,0.3596620559692383,2023-09-04 22:19:11.347854,2023-09-04 22:19:11.806419,0 days 00:00:00.458565,Tanh,Leaky,Sigmoid,Tanh,82,23,19.0,16.0,6.0,0.020476353156201162,4,326,0.35372849959861086,1.196742939191018e-05,117.04224076911585,COMPLETE
723,0.4209582507610321,2023-09-04 22:19:11.806823,2023-09-04 22:19:12.013840,0 days 00:00:00.207017,Tanh,Leaky,Sigmoid,Tanh,77,21,20.0,15.0,7.0,0.015459038290944081,4,109,0.3040034402699376,1.9790857210785975e-05,226.2944415165828,COMPLETE
724,1.1034622192382812,2023-09-04 22:19:12.014252,2023-09-04 22:19:12.336441,0 days 00:00:00.322189,Tanh,Leaky,Sigmoid,Sigmoid,80,22,20.0,5.0,13.0,0.03309714780975373,4,118,0.7454499001578154,0.007175042915623824,110.9097172130238,COMPLETE
725,0.32691916823387146,2023-09-04 22:19:12.336829,2023-09-04 22:19:12.702701,0 days 00:00:00.365872,Tanh,Leaky,ReLU,Tanh,84,23,20.0,17.0,6.0,0.011643643313936814,4,105,0.7108229942236246,1.0487918931184882e-05,320.9674190945095,COMPLETE
726,0.4383750855922699,2023-09-04 22:19:12.703132,2023-09-04 22:19:13.961171,0 days 00:00:01.258039,Tanh,Leaky,,,86,22,19.0,,,0.00031185548517722266,2,141,0.7656229527009443,1.0123436215848175e-05,403.022917835425,COMPLETE
727,0.8534952998161316,2023-09-04 22:19:13.961558,2023-09-04 22:19:15.007532,0 days 00:00:01.045974,Tanh,Leaky,Tanh,Tanh,88,21,18.0,17.0,7.0,5.360514628028388e-05,4,96,0.72207296021944,0.0014474849737362147,116.41688267389934,COMPLETE
728,0.3408832848072052,2023-09-04 22:19:15.007934,2023-09-04 22:19:15.467650,0 days 00:00:00.459716,Tanh,Leaky,Sigmoid,Tanh,90,21,20.0,16.0,6.0,0.025023991910914287,4,242,0.7734422736994897,1.643986859923858e-05,102.5190789964464,COMPLETE
729,0.3591171205043793,2023-09-04 22:19:15.468051,2023-09-04 22:19:15.826319,0 days 00:00:00.358268,Tanh,Leaky,Sigmoid,Tanh,85,21,19.0,15.0,8.0,0.018477253688632664,4,110,0.4326122526399821,0.00015644866245462566,201.68316196259997,COMPLETE
730,0.4499012529850006,2023-09-04 22:19:15.826722,2023-09-04 22:19:16.045904,0 days 00:00:00.219182,Leaky,Leaky,Leaky,Tanh,82,22,20.0,14.0,5.0,0.013619451614799827,4,253,0.2555914987877266,0.00010397431001110829,507.8055945502387,COMPLETE
731,0.3246881067752838,2023-09-04 22:19:16.046302,2023-09-04 22:19:16.951281,0 days 00:00:00.904979,Tanh,ReLU,Sigmoid,Sigmoid,79,23,20.0,16.0,6.0,0.003256488488499697,4,295,0.698781360673035,0.0002501550450177049,122.22293437610973,COMPLETE
732,0.6859915852546692,2023-09-04 22:19:16.951676,2023-09-04 22:19:17.437797,0 days 00:00:00.486121,Sigmoid,Leaky,Sigmoid,Sigmoid,81,21,19.0,10.0,1.0,0.01015545493995417,4,284,0.7431124262064819,0.0003221387588238305,168.0141844498484,COMPLETE
733,0.40999823808670044,2023-09-04 22:19:17.438184,2023-09-04 22:19:17.963000,0 days 00:00:00.524816,Leaky,Tanh,Sigmoid,Sigmoid,83,22,20.0,15.0,5.0,0.0157350380805731,4,117,0.39395235367706904,0.00017668237159209097,295.5452228892933,COMPLETE
734,0.3860636055469513,2023-09-04 22:19:17.963392,2023-09-04 22:19:18.232766,0 days 00:00:00.269374,Tanh,Leaky,Sigmoid,ReLU,86,20,18.0,14.0,7.0,0.021555404131026593,4,151,0.22620060581347803,0.00040422679162048356,106.67347787927699,COMPLETE
735,0.45339566469192505,2023-09-04 22:19:18.233157,2023-09-04 22:19:18.848375,0 days 00:00:00.615218,Tanh,Leaky,ReLU,Sigmoid,84,20,21.0,16.0,4.0,0.0016007226790442715,4,134,0.23764972036528498,0.0011981278927610567,170.5004156311946,COMPLETE
736,0.2900485694408417,2023-09-04 22:19:18.848761,2023-09-04 22:19:19.484148,0 days 00:00:00.635387,Leaky,Leaky,Sigmoid,Sigmoid,88,20,19.0,15.0,17.0,0.0074033920425378525,4,126,0.5258817024671606,0.0007024906537036245,187.76526029486405,COMPLETE
737,0.4263470470905304,2023-09-04 22:19:19.484545,2023-09-04 22:19:19.913238,0 days 00:00:00.428693,Sigmoid,Leaky,Sigmoid,Sigmoid,81,22,21.0,13.0,13.0,0.004921669683935911,4,340,0.14899453412125116,0.00013126411576190895,193.7303573820326,COMPLETE
738,1.134956955909729,2023-09-04 22:19:19.913634,2023-09-04 22:19:20.566724,0 days 00:00:00.653090,Tanh,Leaky,Sigmoid,Sigmoid,91,16,20.0,15.0,19.0,1.1638700940517071e-05,4,236,0.14495711362430802,8.821305082005768e-05,115.65524078627764,COMPLETE
739,0.367801308631897,2023-09-04 22:19:20.567105,2023-09-04 22:19:21.161749,0 days 00:00:00.594644,Leaky,Leaky,Sigmoid,Tanh,85,21,20.0,16.0,6.0,0.012256061418938171,4,129,0.7692145015615593,0.00046194015127044055,150.74693980115526,COMPLETE
740,0.8327986598014832,2023-09-04 22:19:21.162137,2023-09-04 22:19:21.328816,0 days 00:00:00.166679,Tanh,Leaky,Tanh,Sigmoid,83,21,19.0,17.0,3.0,0.02696128278340115,4,130,0.17297224781388695,0.012677678282130499,355.1654790242513,COMPLETE
741,0.23619344830513,2023-09-04 22:19:21.329209,2023-09-04 22:19:21.942751,0 days 00:00:00.613542,Leaky,Leaky,Sigmoid,,78,13,22.0,15.0,,0.008770262247500184,3,271,0.7992471951227289,1.4600927347455891e-05,91.40175598742915,COMPLETE
742,0.8643792271614075,2023-09-04 22:19:21.943151,2023-09-04 22:19:24.969786,0 days 00:00:03.026635,Leaky,Leaky,Sigmoid,,77,12,22.0,16.0,,1.790746089397662e-05,3,278,0.798814682817247,1.2617471609624775e-05,98.67291849808727,COMPLETE
743,0.34179410338401794,2023-09-04 22:19:24.970170,2023-09-04 22:19:25.488830,0 days 00:00:00.518660,Leaky,ReLU,Sigmoid,,77,13,22.0,15.0,,0.009756673473680068,3,306,0.7759256079780666,0.00020388980732661535,116.77977566602753,COMPLETE
744,0.35688725113868713,2023-09-04 22:19:25.489261,2023-09-04 22:19:26.165366,0 days 00:00:00.676105,Leaky,Leaky,Sigmoid,,77,14,23.0,17.0,,0.01033634710366507,3,138,0.7528492992590567,1.3824031981950544e-05,150.30052800764116,COMPLETE
745,0.3847736716270447,2023-09-04 22:19:26.165803,2023-09-04 22:19:26.476276,0 days 00:00:00.310473,Leaky,Tanh,Sigmoid,,78,13,23.0,18.0,,0.008492238490490293,3,272,0.31668596008893857,1.7181958461616775e-05,156.23674549775964,COMPLETE
746,0.5406527519226074,2023-09-04 22:19:26.476688,2023-09-04 22:19:26.613447,0 days 00:00:00.136759,Leaky,Leaky,,,80,14,23.0,,,0.007975994673923298,2,148,0.11216148712981314,1.474876412626395e-05,130.7771581566852,COMPLETE
747,1.290870189666748,2023-09-04 22:19:26.613825,2023-09-04 22:19:29.524014,0 days 00:00:02.910189,Leaky,Leaky,Sigmoid,,78,12,22.0,21.0,,1.0291311945900098e-05,3,287,0.74760630083769,2.0661539397705288e-05,167.00784386824233,COMPLETE
748,0.6869362592697144,2023-09-04 22:19:29.524406,2023-09-04 22:19:31.153787,0 days 00:00:01.629381,Leaky,Leaky,Sigmoid,,79,20,22.0,17.0,,0.0005576197821071966,3,225,0.7847051043335999,0.034098478305824506,137.28162257718725,COMPLETE
749,0.3413683772087097,2023-09-04 22:19:31.154163,2023-09-04 22:19:31.657317,0 days 00:00:00.503154,Leaky,Leaky,Sigmoid,,81,12,24.0,16.0,,0.007299257005038924,3,331,0.7313207058360596,1.5042484859659933e-05,121.5524326822032,COMPLETE
750,0.3425274193286896,2023-09-04 22:19:31.657735,2023-09-04 22:19:32.128747,0 days 00:00:00.471012,Leaky,Leaky,Sigmoid,,79,13,19.0,15.0,,0.011880443853860476,3,319,0.799671908461341,1.0399101071168069e-05,120.73099056043122,COMPLETE
751,0.518014669418335,2023-09-04 22:19:32.129138,2023-09-04 22:19:32.364371,0 days 00:00:00.235233,Leaky,Leaky,Sigmoid,,59,14,23.0,16.0,,0.004790843032553683,3,268,0.13837872173373422,1.9113419432248744e-05,163.24788253033748,COMPLETE
752,0.3545054495334625,2023-09-04 22:19:32.364782,2023-09-04 22:19:32.582627,0 days 00:00:00.217845,Leaky,Leaky,,,94,19,21.0,,,0.0062462585929978194,2,248,0.23010779775478685,1.1861348404442887e-05,104.52948166152179,COMPLETE
753,0.3670930564403534,2023-09-04 22:19:32.583008,2023-09-04 22:19:34.162934,0 days 00:00:01.579926,Leaky,Leaky,Sigmoid,,80,13,18.0,19.0,,0.0003327325548873321,3,295,0.7966437578491977,0.000145530120735699,133.17896589514328,COMPLETE
754,0.36528050899505615,2023-09-04 22:19:34.163319,2023-09-04 22:19:34.490216,0 days 00:00:00.326897,Leaky,Leaky,Sigmoid,,82,18,20.0,15.0,,0.008978312671291643,3,347,0.41296559416194367,0.0002608388023429789,154.06211073855135,COMPLETE
755,0.5779329538345337,2023-09-04 22:19:34.490600,2023-09-04 22:19:34.702501,0 days 00:00:00.211901,Sigmoid,ReLU,,,76,19,22.0,,,0.013207275264487969,2,230,0.20801156058125028,0.04259459034811678,132.42711547325396,COMPLETE
756,0.861344039440155,2023-09-04 22:19:34.702881,2023-09-04 22:19:34.814051,0 days 00:00:00.111170,Leaky,Leaky,Sigmoid,ReLU,75,14,20.0,16.0,8.0,0.014564183390233026,4,313,0.16853628546356866,0.07946578669895273,99.2164421081543,COMPLETE
757,0.4020792543888092,2023-09-04 22:19:34.814447,2023-09-04 22:19:35.421166,0 days 00:00:00.606719,Leaky,Leaky,Sigmoid,Tanh,82,13,19.0,11.0,18.0,0.011451748521097276,4,242,0.6844695241417204,0.00010795960806416404,115.4740047454834,COMPLETE
758,0.36467650532722473,2023-09-04 22:19:35.421560,2023-09-04 22:19:35.930093,0 days 00:00:00.508533,Sigmoid,Leaky,Sigmoid,ReLU,80,17,21.0,15.0,14.0,0.016337786896934693,4,257,0.7487583255013052,0.000349878103699556,171.23981455752724,COMPLETE
759,0.3636529743671417,2023-09-04 22:19:35.930498,2023-09-04 22:19:36.813557,0 days 00:00:00.883059,Leaky,Leaky,Sigmoid,Leaky,84,13,21.0,22.0,12.0,0.0008082377781637277,4,277,0.7217767449257696,0.0005803119864649645,130.29143866514548,COMPLETE
760,0.6364730596542358,2023-09-04 22:19:36.813950,2023-09-04 22:19:37.229701,0 days 00:00:00.415751,Leaky,Tanh,Sigmoid,Leaky,82,20,20.0,16.0,17.0,9.463450050784914e-05,4,144,0.12365424506632781,0.0001644285945811652,96.51083442899916,COMPLETE
761,0.3496819734573364,2023-09-04 22:19:37.230089,2023-09-04 22:19:37.817135,0 days 00:00:00.587046,Sigmoid,Leaky,Sigmoid,Leaky,84,21,22.0,8.0,16.0,0.009895398539506916,4,364,0.7612592727537603,1.735911735021601e-05,169.02870746369058,COMPLETE
762,0.31313347816467285,2023-09-04 22:19:37.817536,2023-09-04 22:19:39.484601,0 days 00:00:01.667065,Leaky,Leaky,Sigmoid,Leaky,100,18,19.0,20.0,12.0,0.03372888942574895,4,112,0.799321235403118,0.00021701691428988425,126.73196792602539,COMPLETE
763,0.5085155963897705,2023-09-04 22:19:39.485002,2023-09-04 22:19:44.766315,0 days 00:00:05.281313,Leaky,Leaky,Sigmoid,Tanh,80,20,20.0,15.0,2.0,0.000176704908933324,4,334,0.704979294564819,0.0007568154017769282,112.42856916899466,COMPLETE
764,0.8889693021774292,2023-09-04 22:19:44.766737,2023-09-04 22:19:44.905982,0 days 00:00:00.139245,Sigmoid,Leaky,Sigmoid,Leaky,42,21,23.0,17.0,23.0,0.01328174546016474,4,355,0.11712635761509074,0.005791217631400153,101.55309719509549,COMPLETE
765,0.48906564712524414,2023-09-04 22:19:44.906378,2023-09-04 22:19:45.415515,0 days 00:00:00.509137,Leaky,Leaky,Sigmoid,,83,1,21.0,15.0,,0.018282335532236363,3,292,0.727679866307004,8.766158295015245e-05,214.54595655076048,COMPLETE
766,0.4790516197681427,2023-09-04 22:19:45.415929,2023-09-04 22:19:45.796415,0 days 00:00:00.380486,Leaky,Leaky,Sigmoid,Sigmoid,78,12,20.0,14.0,7.0,0.0026530813059521883,4,305,0.15147704163003356,1.0077915482617576e-05,153.10492606474975,COMPLETE
767,0.806892991065979,2023-09-04 22:19:45.796820,2023-09-04 22:19:46.048570,0 days 00:00:00.251750,Sigmoid,ReLU,Leaky,ReLU,48,18,21.0,18.0,15.0,0.008490287647446514,4,235,0.10307368572454309,2.5829014952471234e-05,299.9050066398852,COMPLETE
768,0.49150484800338745,2023-09-04 22:19:46.048998,2023-09-04 22:19:49.149213,0 days 00:00:03.100215,Leaky,Leaky,Sigmoid,Leaky,87,19,19.0,16.0,8.0,6.670192690813333e-05,4,323,0.6656954176958026,0.00013314170486092942,160.34115284072357,COMPLETE
769,0.3909303843975067,2023-09-04 22:19:49.149616,2023-09-04 22:19:49.860111,0 days 00:00:00.710495,Leaky,Tanh,Tanh,Sigmoid,97,20,18.0,9.0,12.0,0.021826362163661288,4,218,0.7644332150807722,0.008481504480827169,138.99460890486435,COMPLETE
770,0.4030318856239319,2023-09-04 22:19:49.860507,2023-09-04 22:19:51.551668,0 days 00:00:01.691161,Sigmoid,Leaky,Sigmoid,Sigmoid,75,12,22.0,16.0,22.0,0.0009363620833583602,4,270,0.3594831236701933,0.0001856649147111582,211.19897573965568,COMPLETE
771,0.4382929503917694,2023-09-04 22:19:51.552104,2023-09-04 22:19:53.489315,0 days 00:00:01.937211,Leaky,Leaky,Sigmoid,Leaky,56,13,20.0,14.0,11.0,0.0005183591559333163,4,283,0.5574040818410081,1.3508806541190807e-05,122.80059929114546,COMPLETE
772,0.3221402168273926,2023-09-04 22:19:53.489737,2023-09-04 22:19:53.996119,0 days 00:00:00.506382,Leaky,Leaky,Sigmoid,Sigmoid,85,21,19.0,17.0,16.0,0.01541152749121044,4,254,0.5850672711974176,0.0002867825661981773,186.8201889337278,COMPLETE
773,0.34955310821533203,2023-09-04 22:19:53.996512,2023-09-04 22:19:54.606877,0 days 00:00:00.610365,Tanh,Leaky,Sigmoid,Leaky,81,19,20.0,5.0,17.0,0.011228070580839215,4,205,0.7989352107471662,0.0008970867575725176,143.7324691772461,COMPLETE
774,0.6418588161468506,2023-09-04 22:19:54.607285,2023-09-04 22:19:54.795906,0 days 00:00:00.188621,Sigmoid,Leaky,Sigmoid,Sigmoid,83,20,21.0,15.0,7.0,0.0134679503404313,4,263,0.1306201134276601,7.276357981099038e-05,189.85728853399104,COMPLETE
775,0.3652336597442627,2023-09-04 22:19:54.796311,2023-09-04 22:19:55.374771,0 days 00:00:00.578460,Leaky,Leaky,Sigmoid,Leaky,79,18,20.0,16.0,13.0,0.0019767921910466323,4,249,0.345782630019872,0.0004964132594056469,99.3221214082506,COMPLETE
776,0.3298030197620392,2023-09-04 22:19:55.375484,2023-09-04 22:19:56.581491,0 days 00:00:01.206007,Tanh,Leaky,Sigmoid,Sigmoid,54,21,22.0,15.0,18.0,0.018557763629242302,4,227,0.696793486984711,0.0001124723870268806,199.10698896838772,COMPLETE
777,0.4233928918838501,2023-09-04 22:19:56.581898,2023-09-04 22:19:56.825606,0 days 00:00:00.243708,Leaky,Leaky,Sigmoid,Tanh,86,9,8.0,16.0,2.0,0.0038080266989386677,4,161,0.12667874021363276,0.0002348848969467611,96.68032116957114,COMPLETE
778,0.7608963251113892,2023-09-04 22:19:56.825992,2023-09-04 22:19:56.942001,0 days 00:00:00.116009,Tanh,Leaky,Sigmoid,Sigmoid,89,16,20.0,15.0,11.0,0.0015421770452733138,4,126,0.1763947966654456,0.0016580014636476904,95.67806478647086,COMPLETE
779,0.3533841669559479,2023-09-04 22:19:56.942409,2023-09-04 22:19:57.195028,0 days 00:00:00.252619,Sigmoid,ReLU,Sigmoid,Leaky,82,19,19.0,17.0,1.0,0.02750988586452976,4,92,0.10895153192213722,0.0003911642129775612,101.52076704423506,COMPLETE
780,0.461381733417511,2023-09-04 22:19:57.195429,2023-09-04 22:19:57.495466,0 days 00:00:00.300037,Leaky,Leaky,Tanh,,87,17,21.0,21.0,,0.006164056262635011,3,240,0.49359792917329653,0.052236748518709804,155.32904222276477,COMPLETE
781,0.29760757088661194,2023-09-04 22:19:57.495861,2023-09-04 22:20:03.490616,0 days 00:00:05.994755,Tanh,Tanh,Sigmoid,ReLU,63,21,21.0,14.0,7.0,0.0004689922022923934,4,338,0.7419854047517976,0.0001727658406914508,300.24898401134743,COMPLETE
782,0.7372867465019226,2023-09-04 22:20:03.491334,2023-09-04 22:20:09.415182,0 days 00:00:05.923848,Leaky,,,,84,2,,,,8.211258149176226e-05,1,301,0.7689153132538095,0.0006018677508670665,141.52856414896308,COMPLETE
783,0.3971852660179138,2023-09-04 22:20:09.415851,2023-09-04 22:20:12.701599,0 days 00:00:03.285748,Tanh,Leaky,Sigmoid,Sigmoid,40,11,19.0,15.0,14.0,0.0012116592204161596,4,278,0.24778148319035886,1.5516817149965977e-05,150.8666500723435,COMPLETE
784,0.42828625440597534,2023-09-04 22:20:12.702298,2023-09-04 22:20:13.100647,0 days 00:00:00.398349,Leaky,Leaky,,,45,20,18.0,,,0.010193655986324471,2,313,0.15510302413159271,9.99490051446085e-05,513.912171307732,COMPLETE
785,1.0381126403808594,2023-09-04 22:20:13.101343,2023-09-04 22:20:16.753293,0 days 00:00:03.651950,Sigmoid,Leaky,Sigmoid,Leaky,85,8,2.0,16.0,8.0,2.5198670306779017e-05,4,219,0.668015589994641,6.226695485389756e-05,112.82564367006903,COMPLETE
786,1.3458930253982544,2023-09-04 22:20:16.753696,2023-09-04 22:20:16.901577,0 days 00:00:00.147881,Tanh,Leaky,Sigmoid,Sigmoid,82,19,20.0,13.0,20.0,0.015853189621932825,4,248,0.28973795224113597,0.022758816266102152,124.75462995256696,COMPLETE
787,0.3156701624393463,2023-09-04 22:20:16.901978,2023-09-04 22:20:19.532807,0 days 00:00:02.630829,Leaky,Leaky,Sigmoid,Leaky,80,20,20.0,23.0,3.0,0.00021935571993475376,4,232,0.7197432096054401,2.2038032225640543e-05,115.7910476553029,COMPLETE
788,0.2990280091762543,2023-09-04 22:20:19.533225,2023-09-04 22:20:21.764231,0 days 00:00:02.231006,Tanh,Leaky,Sigmoid,Sigmoid,32,18,22.0,16.0,6.0,0.001814799279988797,4,329,0.764952025476584,0.0010197523674100337,347.57702689335264,COMPLETE
789,0.47664734721183777,2023-09-04 22:20:21.764645,2023-09-04 22:20:22.083209,0 days 00:00:00.318564,Leaky,Leaky,Sigmoid,Sigmoid,77,21,21.0,1.0,16.0,0.022540631693718508,4,262,0.3840663560892636,7.775177306459671e-05,508.3221633911133,COMPLETE
790,0.41630005836486816,2023-09-04 22:20:22.083618,2023-09-04 22:20:22.307866,0 days 00:00:00.224248,Tanh,Leaky,Sigmoid,Leaky,84,14,19.0,14.0,9.0,0.012411440630540269,4,345,0.18193402752683502,0.00034758865060348745,175.6686307589213,COMPLETE
791,0.5385750532150269,2023-09-04 22:20:22.308256,2023-09-04 22:20:23.665841,0 days 00:00:01.357585,Sigmoid,Leaky,Sigmoid,Sigmoid,91,20,20.0,22.0,15.0,0.002371580046811735,4,102,0.694575372221395,0.00013399527824870246,296.13275520474303,COMPLETE
792,0.5211358666419983,2023-09-04 22:20:23.666608,2023-09-04 22:20:25.971509,0 days 00:00:02.304901,Leaky,Leaky,Leaky,Leaky,81,22,22.0,15.0,11.0,0.0002509380098776023,4,210,0.727606735479051,0.00020703060622557622,121.36317387333622,COMPLETE
793,0.860733687877655,2023-09-04 22:20:25.971908,2023-09-04 22:20:27.060405,0 days 00:00:01.088497,Tanh,ReLU,Sigmoid,Tanh,88,11,21.0,16.0,18.0,1.9077669405111207e-05,4,272,0.24176148150297813,0.000278776776584735,116.73003701602711,COMPLETE
794,0.41206735372543335,2023-09-04 22:20:27.060794,2023-09-04 22:20:27.537738,0 days 00:00:00.476944,Leaky,Tanh,Sigmoid,Sigmoid,86,9,23.0,17.0,17.0,0.008312194328193984,4,289,0.47353553310277136,0.006164392954732913,154.63658444386607,COMPLETE
795,0.24191996455192566,2023-09-04 22:20:27.538332,2023-09-04 22:20:28.390432,0 days 00:00:00.852100,Tanh,Leaky,Tanh,Leaky,83,19,20.0,2.0,12.0,0.019161410866358034,4,258,0.7484615431518175,0.00016195423074159512,110.69723793768114,COMPLETE
796,0.3377436399459839,2023-09-04 22:20:28.390968,2023-09-04 22:20:29.468474,0 days 00:00:01.077506,Sigmoid,Leaky,Sigmoid,ReLU,79,15,19.0,14.0,13.0,0.014793774094867495,4,321,0.7992330684468609,8.736652091546653e-05,236.72399478488498,COMPLETE
797,0.3946397602558136,2023-09-04 22:20:29.469186,2023-09-04 22:20:30.538661,0 days 00:00:01.069475,Leaky,Leaky,Sigmoid,Sigmoid,93,18,21.0,23.0,6.0,0.0007096083524152441,4,238,0.27490945748005785,5.899800491160693e-05,121.15256628009121,COMPLETE
798,0.4467255771160126,2023-09-04 22:20:30.539059,2023-09-04 22:20:31.913642,0 days 00:00:01.374583,Tanh,Leaky,Sigmoid,Leaky,84,21,20.0,15.0,4.0,0.00030813402825304726,4,135,0.6156124534364795,1.8884195836465887e-05,258.528596383554,COMPLETE
799,0.2987443804740906,2023-09-04 22:20:31.914210,2023-09-04 22:20:32.174007,0 days 00:00:00.259797,Leaky,Leaky,Sigmoid,Sigmoid,38,20,21.0,16.0,12.0,0.010899392136914267,4,245,0.16113351202250853,2.6774696246359308e-05,112.56654453277588,COMPLETE
800,0.7046442627906799,2023-09-04 22:20:32.174454,2023-09-04 22:20:32.320881,0 days 00:00:00.146427,Tanh,Leaky,Sigmoid,,82,21,18.0,20.0,,0.024860375948730622,3,225,0.16620728970153062,0.03653631503319489,190.40619261368462,COMPLETE
801,0.4422464072704315,2023-09-04 22:20:32.321329,2023-09-04 22:20:33.027885,0 days 00:00:00.706556,Sigmoid,Leaky,Sigmoid,Sigmoid,87,13,22.0,17.0,7.0,0.03720000684551825,4,284,0.5380502775691999,0.0028805464844933286,164.51901074459678,COMPLETE
802,0.3493478298187256,2023-09-04 22:20:33.028390,2023-09-04 22:20:33.527878,0 days 00:00:00.499488,Leaky,Leaky,Sigmoid,Leaky,96,22,20.0,11.0,6.0,0.017376383699815316,4,353,0.675960479223756,0.00024192661514227073,130.9275342364644,COMPLETE
803,0.24857808649539948,2023-09-04 22:20:33.528312,2023-09-04 22:20:34.412927,0 days 00:00:00.884615,Tanh,Leaky,Sigmoid,Sigmoid,90,19,23.0,19.0,8.0,0.006834641556710689,4,169,0.7688577018259616,0.00012083226474091816,222.74517005598042,COMPLETE
