number,value,datetime_start,datetime_complete,duration,params_activation1,params_activation2,params_activation3,params_activation4,params_batch_size,params_fl1,params_fl2,params_fl3,params_fl4,params_learning_rate,params_n_layers,params_num_epochs,params_train_size,params_weight_decay,user_attrs_mre,state
448,0.35175636410713196,2023-09-04 21:02:36.176742,2023-09-04 21:02:36.872219,0 days 00:00:00.695477,ReLU,Sigmoid,,,31,20,18.0,,,0.005696166349079475,2,207,0.6245445782102742,1.4422971146411654e-05,105.02089301907286,COMPLETE
449,1.0080151557922363,2023-09-04 21:02:36.872536,2023-09-04 21:02:37.066158,0 days 00:00:00.193622,Leaky,Leaky,Sigmoid,Tanh,65,21,12.0,22.0,12.0,0.007482751668898303,4,137,0.7623266267008806,0.07675176507929007,101.9606864235618,COMPLETE
450,0.3438711166381836,2023-09-04 21:02:37.066495,2023-09-04 21:02:37.986101,0 days 00:00:00.919606,Tanh,Sigmoid,Sigmoid,Sigmoid,36,24,10.0,20.0,13.0,0.01446151894959971,4,226,0.710373960162048,5.854661166581729e-05,108.47693747662484,COMPLETE
451,0.4608680307865143,2023-09-04 21:02:37.986436,2023-09-04 21:02:39.685394,0 days 00:00:01.698958,Sigmoid,Leaky,Leaky,Sigmoid,12,23,16.0,16.0,15.0,0.0003724250536490859,4,370,0.20610467938353505,0.0034786067243099406,136.8457753004226,COMPLETE
452,0.35380080342292786,2023-09-04 21:02:39.685741,2023-09-04 21:02:41.816307,0 days 00:00:02.130566,Sigmoid,ReLU,Sigmoid,Tanh,82,23,18.0,21.0,15.0,0.0033741915692979446,4,239,0.6588467137594819,3.4214673749097753e-05,128.0108087203082,COMPLETE
453,0.34674394130706787,2023-09-04 21:02:41.816653,2023-09-04 21:02:43.716415,0 days 00:00:01.899762,Sigmoid,Sigmoid,Sigmoid,Sigmoid,44,22,9.0,19.0,16.0,0.010816805663100318,4,180,0.7392576606339417,0.00019188192744302987,118.73975104254646,COMPLETE
454,0.27779120206832886,2023-09-04 21:02:43.716782,2023-09-04 21:02:44.172057,0 days 00:00:00.455275,ReLU,Leaky,Leaky,,51,18,13.0,20.0,,0.05264520841745946,3,356,0.7718533506285794,0.0003224955711630142,89.18838195800781,COMPLETE
455,0.44712936878204346,2023-09-04 21:02:44.172398,2023-09-04 21:02:44.332942,0 days 00:00:00.160544,ReLU,Leaky,Leaky,,51,20,13.0,21.0,,0.0024230384694291884,3,338,0.10020957221127012,0.00012403146088351685,271.1659878540039,COMPLETE
456,0.3295801281929016,2023-09-04 21:02:44.333272,2023-09-04 21:02:44.736524,0 days 00:00:00.403252,ReLU,Leaky,Leaky,,52,21,13.0,20.0,,0.03567601929596881,3,356,0.7992964692691876,8.630894559336518e-05,90.88102172851562,COMPLETE
457,0.30536729097366333,2023-09-04 21:02:44.736869,2023-09-04 21:02:45.277058,0 days 00:00:00.540189,ReLU,Leaky,Leaky,,54,18,13.0,14.0,,0.05033441886570211,3,344,0.7674778142802937,0.0010108507100074122,84.05334713584499,COMPLETE
458,0.28445151448249817,2023-09-04 21:02:45.277392,2023-09-04 21:02:46.227133,0 days 00:00:00.949741,ReLU,Leaky,Leaky,,48,11,14.0,20.0,,0.05604538624354996,3,352,0.7189301811069652,0.0008409739310149413,105.76697892409105,COMPLETE
459,0.4105600118637085,2023-09-04 21:02:46.227466,2023-09-04 21:02:46.613212,0 days 00:00:00.385746,ReLU,Leaky,Leaky,,49,9,14.0,21.0,,0.07477365136277829,3,335,0.7156220261544348,0.0006172664097079829,111.61210397573618,COMPLETE
460,0.3423601984977722,2023-09-04 21:02:46.613535,2023-09-04 21:02:46.932446,0 days 00:00:00.318911,ReLU,Leaky,Leaky,,52,10,14.0,20.0,,0.04018624335500627,3,351,0.7408895666326091,0.00028915258291518095,90.42652929396857,COMPLETE
461,0.31512415409088135,2023-09-04 21:02:46.932782,2023-09-04 21:02:47.434358,0 days 00:00:00.501576,ReLU,Leaky,Leaky,,47,11,5.0,15.0,,0.032809877371001654,3,360,0.6942689573102541,0.0007582539111360308,127.36425410679408,COMPLETE
462,0.38104215264320374,2023-09-04 21:02:47.434686,2023-09-04 21:02:48.130053,0 days 00:00:00.695367,ReLU,Leaky,Leaky,,49,11,13.0,21.0,,0.04389924424914757,3,347,0.7649511353709068,0.00048502844427751574,104.31934483846028,COMPLETE
463,0.3392831087112427,2023-09-04 21:02:48.130454,2023-09-04 21:02:48.518678,0 days 00:00:00.388224,ReLU,Leaky,Leaky,,53,19,13.0,19.0,,0.05874398580361769,3,312,0.725295573146479,0.0015080406805936008,119.18395289668331,COMPLETE
464,0.3583565652370453,2023-09-04 21:02:48.519010,2023-09-04 21:02:49.992049,0 days 00:00:01.473039,ReLU,Leaky,Leaky,,49,10,14.0,20.0,,0.0007475803735532903,3,365,0.772312925466362,0.0006282876648445289,118.68525856419613,COMPLETE
465,0.31869131326675415,2023-09-04 21:02:49.992370,2023-09-04 21:02:50.373011,0 days 00:00:00.380641,ReLU,Leaky,ReLU,,50,24,12.0,14.0,,0.04831263031412437,3,379,0.7079010575695539,0.00028991692168009713,105.876585153433,COMPLETE
466,0.3011940121650696,2023-09-04 21:02:50.373342,2023-09-04 21:02:50.773240,0 days 00:00:00.399898,ReLU,Leaky,Leaky,,52,21,14.0,22.0,,0.07084922495871503,3,357,0.674971754597319,7.185898421537717e-05,89.96310556345972,COMPLETE
467,0.2991141676902771,2023-09-04 21:02:50.773583,2023-09-04 21:02:52.630659,0 days 00:00:01.857076,ReLU,Leaky,Leaky,,26,22,12.0,20.0,,0.0040254486585913395,3,372,0.7466974973206868,0.00010641681129522533,100.17175559997558,COMPLETE
468,0.29227572679519653,2023-09-04 21:02:52.631003,2023-09-04 21:02:53.503709,0 days 00:00:00.872706,ReLU,Leaky,,,47,23,13.0,,,0.057708792154096154,2,338,0.7756652658641884,0.0001666864440929207,87.02864090277224,COMPLETE
469,0.35875019431114197,2023-09-04 21:02:53.504037,2023-09-04 21:02:54.211005,0 days 00:00:00.706968,ReLU,Leaky,Leaky,,28,20,12.0,21.0,,0.05176219247010942,3,350,0.797868028572668,0.0009825450204673121,120.35278905232748,COMPLETE
470,0.2878287434577942,2023-09-04 21:02:54.211339,2023-09-04 21:02:55.137048,0 days 00:00:00.925709,ReLU,Leaky,Tanh,,51,22,12.0,15.0,,0.0012485936646612046,3,329,0.7346741333631382,0.00032358824508762997,137.75146472987845,COMPLETE
471,0.36552131175994873,2023-09-04 21:02:55.137615,2023-09-04 21:02:55.486697,0 days 00:00:00.349082,ReLU,,,,55,23,,,,0.05736974447103001,1,356,0.3012416603185419,0.0002097438220550786,127.03866449991862,COMPLETE
472,0.3388999402523041,2023-09-04 21:02:55.487012,2023-09-04 21:03:00.458784,0 days 00:00:04.971772,Tanh,Leaky,Sigmoid,,50,24,13.0,23.0,,6.78257444060555e-05,3,390,0.7072862045322406,0.0008883795865824119,108.69121882120768,COMPLETE
473,0.32165029644966125,2023-09-04 21:03:00.459118,2023-09-04 21:03:01.111220,0 days 00:00:00.652102,ReLU,Tanh,Sigmoid,,30,20,15.0,20.0,,0.02791113200343007,3,366,0.6675654629654495,0.0004024829235111383,121.30205266615924,COMPLETE
474,0.31162843108177185,2023-09-04 21:03:01.111548,2023-09-04 21:03:01.427479,0 days 00:00:00.315931,Tanh,,,,33,21,,,,0.047643405954315085,1,383,0.746866653458058,5.161881643364852e-05,89.94755189315133,COMPLETE
475,0.3366093337535858,2023-09-04 21:03:01.427794,2023-09-04 21:03:03.165609,0 days 00:00:01.737815,ReLU,Leaky,Leaky,,91,18,14.0,19.0,,0.0015999836274925806,3,373,0.6949874191698461,0.00012148386374071308,103.68031613189395,COMPLETE
476,0.3282984495162964,2023-09-04 21:03:03.165931,2023-09-04 21:03:04.618756,0 days 00:00:01.452825,Leaky,ReLU,,,84,22,13.0,,,0.00012634810896696493,2,114,0.7582111519750359,0.0011397810160198474,105.6278335838987,COMPLETE
477,0.3640705943107605,2023-09-04 21:03:04.619073,2023-09-04 21:03:05.366967,0 days 00:00:00.747894,ReLU,Leaky,Sigmoid,Leaky,53,11,11.0,21.0,10.0,0.06775840621236108,4,363,0.7990219081352984,0.000914363614892827,92.69576755099827,COMPLETE
478,0.36261510848999023,2023-09-04 21:03:05.367300,2023-09-04 21:03:06.491740,0 days 00:00:01.124440,Tanh,Leaky,ReLU,Sigmoid,25,24,6.0,13.0,17.0,0.0062423530718171095,4,403,0.7216253488988048,0.0007985022662989034,92.65393922387099,COMPLETE
479,0.35237839818000793,2023-09-04 21:03:06.492087,2023-09-04 21:03:07.277835,0 days 00:00:00.785748,ReLU,ReLU,Leaky,Sigmoid,55,23,4.0,16.0,12.0,0.0019218534608492713,4,343,0.6511098694269531,0.0002606537894647935,290.7273903539625,COMPLETE
480,0.34027597308158875,2023-09-04 21:03:07.278169,2023-09-04 21:03:07.880967,0 days 00:00:00.602798,Tanh,Leaky,Sigmoid,Sigmoid,51,19,15.0,3.0,16.0,0.004991564562297686,4,323,0.33996618176671356,8.296490636044934e-05,128.59226674397786,COMPLETE
481,0.37437885999679565,2023-09-04 21:03:07.881309,2023-09-04 21:03:09.342575,0 days 00:00:01.461266,ReLU,Leaky,Sigmoid,,57,21,11.0,20.0,,0.00035654472586809315,3,354,0.23120872136730708,0.005422968102263309,950.6012834236446,COMPLETE
482,0.40918466448783875,2023-09-04 21:03:09.342896,2023-09-04 21:03:11.543603,0 days 00:00:02.200707,Leaky,,,,46,23,,,,4.388972932833667e-05,1,363,0.44895440381626694,0.0004245806436324166,104.97578114911545,COMPLETE
483,0.35490813851356506,2023-09-04 21:03:11.543928,2023-09-04 21:03:13.020791,0 days 00:00:01.476863,ReLU,Tanh,Leaky,Sigmoid,48,22,12.0,17.0,6.0,0.0009789645449325619,4,376,0.773543712249991,0.03302066682192893,123.86193537157635,COMPLETE
484,0.3327047526836395,2023-09-04 21:03:13.021145,2023-09-04 21:03:13.727617,0 days 00:00:00.706472,Tanh,ReLU,Sigmoid,Sigmoid,27,24,16.0,19.0,13.0,0.038942339192583095,4,347,0.6922602210660356,0.0002446968888557398,95.3772463117327,COMPLETE
485,0.3454038202762604,2023-09-04 21:03:13.727959,2023-09-04 21:03:13.949924,0 days 00:00:00.221965,ReLU,Leaky,Sigmoid,Leaky,67,22,13.0,20.0,11.0,0.02222568590061564,4,82,0.4395281136087687,0.0033585004112962626,114.55322230945934,COMPLETE
486,0.3036901652812958,2023-09-04 21:03:13.950256,2023-09-04 21:03:14.717240,0 days 00:00:00.766984,Tanh,Leaky,Leaky,Sigmoid,89,21,17.0,22.0,15.0,0.002171854389877323,4,267,0.7316418185962167,2.20714940063257e-05,99.48484221982284,COMPLETE
487,0.30126500129699707,2023-09-04 21:03:14.717578,2023-09-04 21:03:15.870984,0 days 00:00:01.153406,ReLU,Leaky,Sigmoid,Sigmoid,49,24,19.0,21.0,17.0,0.0034210141181937053,4,448,0.7706007469406511,0.001332687175214588,103.51801516404792,COMPLETE
488,0.4741167724132538,2023-09-04 21:03:15.871331,2023-09-04 21:03:22.294714,0 days 00:00:06.423383,Sigmoid,ReLU,Sigmoid,Sigmoid,53,23,18.0,18.0,16.0,0.00010964607738328314,4,380,0.7991627380651987,0.0004651232887725384,124.06932927181846,COMPLETE
489,0.34041786193847656,2023-09-04 21:03:22.295062,2023-09-04 21:03:24.810633,0 days 00:00:02.515571,ReLU,Leaky,,,32,23,12.0,,,0.0003066554539332086,2,394,0.680063744016417,6.3368166696628e-05,114.30668415223931,COMPLETE
490,0.4016123116016388,2023-09-04 21:03:24.810955,2023-09-04 21:03:25.002116,0 days 00:00:00.191161,Leaky,Leaky,Leaky,Sigmoid,87,11,20.0,15.0,15.0,0.00941274531805426,4,425,0.19404263950591982,0.0006480778873419785,123.1791094516186,COMPLETE
491,0.5137090086936951,2023-09-04 21:03:25.002437,2023-09-04 21:03:25.714516,0 days 00:00:00.712079,Sigmoid,ReLU,Sigmoid,Leaky,92,20,15.0,13.0,11.0,0.00021688508777349842,4,283,0.13507014842914195,4.416541699094141e-05,105.84625295362709,COMPLETE
492,0.3566588759422302,2023-09-04 21:03:25.714854,2023-09-04 21:03:27.015511,0 days 00:00:01.300657,Tanh,Leaky,ReLU,Sigmoid,95,16,13.0,14.0,13.0,0.0005633848881084585,4,131,0.7421028426630706,0.00034964160631863894,116.4039127262494,COMPLETE
493,0.3232133090496063,2023-09-04 21:03:27.015855,2023-09-04 21:03:28.630254,0 days 00:00:01.614399,Sigmoid,Tanh,Sigmoid,Sigmoid,24,10,11.0,23.0,16.0,0.00794186281995947,4,256,0.7228080576024248,0.0010650498435693105,115.2361685542737,COMPLETE
494,0.3107627332210541,2023-09-04 21:03:28.630593,2023-09-04 21:03:29.107002,0 days 00:00:00.476409,ReLU,Leaky,Leaky,Sigmoid,51,21,14.0,20.0,14.0,0.01851252255256848,4,96,0.6483831399650558,1.7981320836615606e-05,116.17895007133484,COMPLETE
495,0.383876770734787,2023-09-04 21:03:29.107345,2023-09-04 21:03:30.016501,0 days 00:00:00.909156,Sigmoid,ReLU,Sigmoid,Sigmoid,10,22,17.0,21.0,17.0,0.025611526509814284,4,356,0.27709428100620587,0.00021380102875106428,114.05913151921453,COMPLETE
496,0.3354286551475525,2023-09-04 21:03:30.016838,2023-09-04 21:03:31.414771,0 days 00:00:01.397933,Sigmoid,Leaky,Leaky,Leaky,29,23,12.0,19.0,18.0,0.01381930026446063,4,364,0.7577851463641229,0.0014660630532022335,120.89364396480092,COMPLETE
497,0.36517417430877686,2023-09-04 21:03:31.415104,2023-09-04 21:03:31.630229,0 days 00:00:00.215125,Tanh,Leaky,Sigmoid,,63,24,17.0,17.0,,0.08320691676556027,3,372,0.32419221928021535,0.0005090821332060853,106.5800035538212,COMPLETE
498,0.36569952964782715,2023-09-04 21:03:31.630564,2023-09-04 21:03:32.119149,0 days 00:00:00.488585,ReLU,ReLU,Tanh,Sigmoid,59,22,16.0,22.0,15.0,0.0006691587675832573,4,343,0.1855609302138084,0.0001399861177849137,130.4528813119662,COMPLETE
499,0.5053279399871826,2023-09-04 21:03:32.119486,2023-09-04 21:03:33.342072,0 days 00:00:01.222586,Sigmoid,Leaky,Sigmoid,Sigmoid,81,24,11.0,21.0,9.0,0.0004411738372730721,4,213,0.3689628015423629,2.5379850745044438e-05,267.48017138270706,COMPLETE
