number,value,datetime_start,datetime_complete,duration,params_activation1,params_activation2,params_activation3,params_activation4,params_batch_size,params_fl1,params_fl2,params_fl3,params_fl4,params_learning_rate,params_n_layers,params_num_epochs,params_train_size,params_weight_decay,user_attrs_mre,state
1022,0.45609942078590393,2023-09-04 21:48:47.198100,2023-09-04 21:48:47.665273,0 days 00:00:00.467173,Sigmoid,Leaky,ReLU,,43,24,20.0,8.0,,0.004942149902515114,3,240,0.13752953960307512,0.0001585738897181228,148.29518451840858,COMPLETE
1023,0.26386570930480957,2023-09-04 21:48:47.665686,2023-09-04 21:48:48.894349,0 days 00:00:01.228663,ReLU,Leaky,Leaky,,34,17,24.0,9.0,,0.0030110398108579056,3,177,0.7179022459626757,2.446611705757127e-05,133.28257219719166,COMPLETE
1024,0.32048070430755615,2023-09-04 21:48:48.894740,2023-09-04 21:48:49.474606,0 days 00:00:00.579866,ReLU,Tanh,Sigmoid,,38,19,21.0,10.0,,0.02259913420846661,3,398,0.7481376697978631,4.229001861490769e-05,162.36794942220052,COMPLETE
1025,0.3304238021373749,2023-09-04 21:48:49.475010,2023-09-04 21:48:50.209786,0 days 00:00:00.734776,ReLU,Leaky,Leaky,,31,20,22.0,22.0,,0.015965054085457498,3,415,0.6224441919024492,1.3167398042567254e-05,753.6865425109863,COMPLETE
1026,0.33912795782089233,2023-09-04 21:48:50.210205,2023-09-04 21:48:50.727923,0 days 00:00:00.517718,ReLU,ReLU,Tanh,,56,22,19.0,21.0,,0.010827413777179822,3,300,0.7676889759401196,5.86229981157387e-05,281.55461838666133,COMPLETE
1027,0.3942837119102478,2023-09-04 21:48:50.728324,2023-09-04 21:48:51.975333,0 days 00:00:01.247009,Sigmoid,Leaky,Leaky,,36,7,22.0,18.0,,0.008673628323849266,3,227,0.3062267158339745,0.0001122797942260225,142.98421898371058,COMPLETE
1028,0.46275341510772705,2023-09-04 21:48:51.975741,2023-09-04 21:48:52.422842,0 days 00:00:00.447101,ReLU,Leaky,Leaky,,40,21,21.0,23.0,,0.000520799112266795,3,356,0.15269543444186845,0.0009472959457261995,134.65385219029017,COMPLETE
1029,0.3764684796333313,2023-09-04 21:48:52.423250,2023-09-04 21:48:53.008433,0 days 00:00:00.585183,Leaky,Tanh,Sigmoid,,35,18,20.0,8.0,,0.017809671124679245,3,188,0.37535158786133554,0.0018608675548255173,233.5913939299407,COMPLETE
1030,0.34117478132247925,2023-09-04 21:48:53.008834,2023-09-04 21:48:53.756928,0 days 00:00:00.748094,ReLU,Leaky,Leaky,,30,19,22.0,9.0,,0.04619307516336127,3,211,0.7067012661869959,0.00014580226776562095,254.86080540248327,COMPLETE
1031,0.3116733133792877,2023-09-04 21:48:53.757328,2023-09-04 21:48:54.193715,0 days 00:00:00.436387,ReLU,Leaky,ReLU,,41,20,23.0,22.0,,0.01326199787965808,3,221,0.666693801724267,0.00023006162657534715,159.36288391113283,COMPLETE
1032,0.3212986886501312,2023-09-04 21:48:54.194115,2023-09-04 21:48:55.209460,0 days 00:00:01.015345,Sigmoid,Sigmoid,Tanh,,38,19,20.0,20.0,,0.0064626354365774985,3,252,0.7978268535468115,3.739960070349836e-05,139.7154584200877,COMPLETE
1033,0.4560449719429016,2023-09-04 21:48:55.209858,2023-09-04 21:48:55.618134,0 days 00:00:00.408276,ReLU,Tanh,Leaky,,33,22,21.0,23.0,,0.0017166403471634579,3,204,0.21318202890535737,0.007223469706971208,181.59445148814808,COMPLETE
1034,0.37404972314834595,2023-09-04 21:48:55.618532,2023-09-04 21:48:57.702356,0 days 00:00:02.083824,ReLU,ReLU,Leaky,,45,17,22.0,24.0,,0.0006938690958005941,3,194,0.7339043132849589,6.978300367891959e-05,170.80432852863396,COMPLETE
1035,0.4269305169582367,2023-09-04 21:48:57.702768,2023-09-04 21:48:58.281056,0 days 00:00:00.578288,ReLU,Leaky,Sigmoid,,36,20,21.0,22.0,,0.0023231358056052323,3,174,0.21002479619808243,0.0001760453645352196,197.7698752220641,COMPLETE
1036,0.5677027106285095,2023-09-04 21:48:58.281464,2023-09-04 21:48:58.659979,0 days 00:00:00.378515,Sigmoid,Leaky,Leaky,,43,21,10.0,7.0,,0.029107762680607687,3,233,0.20253448193256154,0.012887450107134052,196.73160024789664,COMPLETE
1037,0.510974645614624,2023-09-04 21:48:58.660406,2023-09-04 21:49:02.637037,0 days 00:00:03.976631,ReLU,Tanh,Tanh,,34,19,23.0,8.0,,2.915551755916353e-05,3,208,0.7683829879513594,1.767934465608193e-05,282.66122553898737,COMPLETE
1038,0.343837171792984,2023-09-04 21:49:02.637456,2023-09-04 21:49:03.526297,0 days 00:00:00.888841,ReLU,Leaky,Leaky,,37,21,20.0,11.0,,0.007470635457217643,3,188,0.7493062404836106,8.425013330227512e-05,153.9646765526305,COMPLETE
1039,0.40540656447410583,2023-09-04 21:49:03.526705,2023-09-04 21:49:04.062518,0 days 00:00:00.535813,ReLU,Leaky,Leaky,,39,18,23.0,6.0,,0.004225980073419438,3,165,0.24006763030608952,0.03159785762246234,439.0321634551625,COMPLETE
1040,0.5450115203857422,2023-09-04 21:49:04.062938,2023-09-04 21:49:04.771171,0 days 00:00:00.708233,Sigmoid,ReLU,ReLU,,83,20,8.0,10.0,,0.010340902443730758,3,311,0.7993023641320247,0.017735039611799824,182.63804244995117,COMPLETE
1041,0.3810841143131256,2023-09-04 21:49:04.771593,2023-09-04 21:49:06.659009,0 days 00:00:01.887416,Leaky,Tanh,Sigmoid,,32,20,21.0,23.0,,0.0011345820094024797,3,342,0.6866449188387732,0.010352976144078142,155.2912011240043,COMPLETE
1042,0.3256189525127411,2023-09-04 21:49:06.659498,2023-09-04 21:49:07.525996,0 days 00:00:00.866498,ReLU,Leaky,Leaky,,41,18,18.0,10.0,,0.0032803309380786253,3,241,0.7188802842123628,0.0024639195812993816,178.78631943922775,COMPLETE
1043,0.3500068783760071,2023-09-04 21:49:07.526415,2023-09-04 21:49:08.388796,0 days 00:00:00.862381,ReLU,Leaky,Tanh,,37,19,9.0,14.0,,0.004915162597653956,3,94,0.4795315973292777,4.691935100280033e-05,191.89779227120536,COMPLETE
1044,0.34364673495292664,2023-09-04 21:49:08.389196,2023-09-04 21:49:09.094156,0 days 00:00:00.704960,ReLU,Leaky,Leaky,,34,21,22.0,24.0,,0.06276972333575974,3,112,0.7672898212823568,0.0011944370258957088,180.5267729325728,COMPLETE
1045,0.5865421295166016,2023-09-04 21:49:09.094562,2023-09-04 21:49:09.773367,0 days 00:00:00.678805,Sigmoid,Tanh,Leaky,,30,22,11.0,22.0,,0.020050347022602652,3,218,0.7407278948384793,0.028465978933112653,272.3433868408203,COMPLETE
1046,0.5309343338012695,2023-09-04 21:49:09.773794,2023-09-04 21:49:09.996906,0 days 00:00:00.223112,ReLU,Sigmoid,Sigmoid,,40,19,19.0,9.0,,0.014713368786222064,3,497,0.10967962681363656,3.159734924794155e-05,387.92137836960126,COMPLETE
1047,0.35463055968284607,2023-09-04 21:49:09.997317,2023-09-04 21:49:10.489557,0 days 00:00:00.492240,ReLU,Leaky,Leaky,,35,20,16.0,21.0,,0.0056445002514860666,3,141,0.25390390386406336,0.003545807055262139,621.9600182166466,COMPLETE
1048,0.45396801829338074,2023-09-04 21:49:10.489979,2023-09-04 21:49:13.274487,0 days 00:00:02.784508,ReLU,ReLU,Tanh,,32,20,24.0,23.0,,5.779862020907575e-05,3,199,0.5172029604296422,0.00012370473277179504,193.1882252142058,COMPLETE
1049,0.5672948360443115,2023-09-04 21:49:13.274890,2023-09-04 21:49:15.176227,0 days 00:00:01.901337,Sigmoid,Leaky,Leaky,,38,21,20.0,9.0,,0.00023178757736551297,3,268,0.2961921067709032,0.00020599644752633452,259.9950455053529,COMPLETE
1050,0.27731212973594666,2023-09-04 21:49:15.176630,2023-09-04 21:49:15.885898,0 days 00:00:00.709268,ReLU,Tanh,ReLU,,36,16,22.0,8.0,,0.011817015572622772,3,182,0.7987905689627092,2.5201157703502917e-05,329.2917224659639,COMPLETE
1051,0.32260677218437195,2023-09-04 21:49:15.886311,2023-09-04 21:49:16.677520,0 days 00:00:00.791209,ReLU,Leaky,Leaky,,33,19,21.0,7.0,,0.008892980200166477,3,251,0.602964079857853,0.00028222379115972466,116.08502603084483,COMPLETE
1052,0.36066219210624695,2023-09-04 21:49:16.677931,2023-09-04 21:49:17.209761,0 days 00:00:00.531830,ReLU,Leaky,Sigmoid,,43,18,23.0,22.0,,0.023984867990483567,3,225,0.39271942644614066,4.051127328293757e-05,1170.7471069335938,COMPLETE
1053,0.3948379158973694,2023-09-04 21:49:17.210167,2023-09-04 21:49:18.231210,0 days 00:00:01.021043,Leaky,Tanh,Leaky,,59,20,21.0,23.0,,0.0005898301625529772,3,322,0.707428170490873,2.0051718550080088e-05,201.27124381359712,COMPLETE
1054,0.3766089081764221,2023-09-04 21:49:18.231645,2023-09-04 21:49:19.332723,0 days 00:00:01.101078,Sigmoid,Leaky,Tanh,,39,23,20.0,24.0,,0.0024735915409213266,3,235,0.6445982501098878,0.0004039979295812606,157.93142233954535,COMPLETE
1055,0.3171749711036682,2023-09-04 21:49:19.333125,2023-09-04 21:49:20.117775,0 days 00:00:00.784650,ReLU,ReLU,Leaky,,41,17,19.0,9.0,,0.0037811546402491646,3,208,0.7674844527586964,5.446886859015335e-05,126.45506425337358,COMPLETE
1056,0.3940795063972473,2023-09-04 21:49:20.118193,2023-09-04 21:49:20.377109,0 days 00:00:00.258916,ReLU,Leaky,Leaky,,62,21,22.0,21.0,,0.017397290673848265,3,153,0.42986729447304806,0.0044678723675830095,144.55403533935547,COMPLETE
1057,0.38393208384513855,2023-09-04 21:49:20.377527,2023-09-04 21:49:23.118526,0 days 00:00:02.740999,ReLU,Tanh,Leaky,,30,19,24.0,22.0,,0.0008641128558524581,3,190,0.7383494880014938,0.0005977304378621446,251.05799461133552,COMPLETE
1058,0.89790278673172,2023-09-04 21:49:23.118927,2023-09-04 21:49:23.571939,0 days 00:00:00.453012,Sigmoid,Leaky,Sigmoid,,35,18,22.0,23.0,,0.007333518140470057,3,81,0.7995769353374563,0.07218388276291375,106.95161861843533,COMPLETE
1059,0.3297307789325714,2023-09-04 21:49:23.572337,2023-09-04 21:49:24.401080,0 days 00:00:00.828743,ReLU,Sigmoid,ReLU,,38,21,21.0,19.0,,0.013838213985930485,3,217,0.6764382224250621,2.9942365797560413e-05,410.8090144566127,COMPLETE
1060,0.2965226173400879,2023-09-04 21:49:24.401492,2023-09-04 21:49:25.381783,0 days 00:00:00.980291,ReLU,Leaky,Tanh,,33,20,20.0,23.0,,0.01007586116979494,3,199,0.7244435314443789,0.00014441108152397412,2787.119998854034,COMPLETE
1061,0.31181734800338745,2023-09-04 21:49:25.382201,2023-09-04 21:49:26.342958,0 days 00:00:00.960757,ReLU,Leaky,Leaky,,36,20,23.0,11.0,,0.002781649649677995,3,227,0.7701470032350547,0.00010140503363847105,147.8299991841219,COMPLETE
1062,0.4526543617248535,2023-09-04 21:49:26.343360,2023-09-04 21:49:30.006138,0 days 00:00:03.662778,Sigmoid,ReLU,Leaky,,31,22,21.0,8.0,,0.0002675966766072378,3,179,0.7998876920901489,3.5496159609922406e-05,203.83439413509012,COMPLETE
1063,0.4547830820083618,2023-09-04 21:49:30.006548,2023-09-04 21:49:30.200715,0 days 00:00:00.194167,ReLU,Tanh,Leaky,,40,19,20.0,24.0,,0.01120535293912116,3,245,0.14570326049816235,0.0008830842369037165,145.21251392364502,COMPLETE
1064,0.384183794260025,2023-09-04 21:49:30.201116,2023-09-04 21:49:31.935857,0 days 00:00:01.734741,ReLU,Leaky,Sigmoid,ReLU,45,3,22.0,10.0,23.0,0.0012225657855322051,4,261,0.6973032650315693,8.444794999140798e-05,173.0717866604145,COMPLETE
1065,0.29340317845344543,2023-09-04 21:49:31.936303,2023-09-04 21:49:32.580889,0 days 00:00:00.644586,ReLU,Leaky,Tanh,,55,18,20.0,22.0,,0.00603794790388316,3,279,0.7500004083167866,0.004838371724918096,147.1835479736328,COMPLETE
1066,0.3047636151313782,2023-09-04 21:49:32.581304,2023-09-04 21:49:33.157851,0 days 00:00:00.576547,Leaky,Tanh,Leaky,,37,10,13.0,23.0,,0.018420275572137323,3,209,0.7485825448431965,0.00017960186582610983,295.0546848691743,COMPLETE
1067,0.46465015411376953,2023-09-04 21:49:33.158269,2023-09-04 21:49:38.257344,0 days 00:00:05.099075,Sigmoid,Leaky,Leaky,,34,22,21.0,7.0,,0.00016461931733116673,3,290,0.7112753769823704,4.497070560748106e-05,157.60534347008016,COMPLETE
1068,0.38547495007514954,2023-09-04 21:49:38.257753,2023-09-04 21:49:38.758885,0 days 00:00:00.501132,ReLU,ReLU,ReLU,,42,21,22.0,21.0,,0.007882439553357865,3,163,0.6543047556260245,0.020193121985876167,225.3099335701235,COMPLETE
1069,0.21429415047168732,2023-09-04 21:49:38.759321,2023-09-04 21:49:40.147014,0 days 00:00:01.387693,ReLU,Leaky,Leaky,,48,20,19.0,9.0,,0.0018253099835187233,3,197,0.7732683391262963,0.00022330525766555142,126.32981794530696,COMPLETE
1070,0.458119660615921,2023-09-04 21:49:40.147418,2023-09-04 21:49:40.452504,0 days 00:00:00.305086,ReLU,Leaky,Leaky,,53,19,18.0,9.0,,0.0031361548690025,3,204,0.1314836950626504,0.0003365447897679229,365.7723843609845,COMPLETE
1071,0.4287058115005493,2023-09-04 21:49:40.453256,2023-09-04 21:49:40.832620,0 days 00:00:00.379364,ReLU,Tanh,Leaky,,40,19,18.0,9.0,,0.0018913255080803722,3,215,0.16737172655377552,0.00047521313111975984,464.53626926967075,COMPLETE
1072,0.33224090933799744,2023-09-04 21:49:40.833016,2023-09-04 21:49:41.610787,0 days 00:00:00.777771,ReLU,Leaky,Leaky,,51,20,19.0,10.0,,0.0017863412607079655,3,373,0.6876942403636709,0.0002974041992476993,142.48338849203927,COMPLETE
1073,0.368918776512146,2023-09-04 21:49:41.611198,2023-09-04 21:49:42.525841,0 days 00:00:00.914643,ReLU,Sigmoid,Leaky,,48,20,18.0,9.0,,0.0013702997460664568,3,198,0.31603222944295206,1.4919591039833372e-05,142.10089776010224,COMPLETE
1074,0.5452084541320801,2023-09-04 21:49:42.526254,2023-09-04 21:49:42.974912,0 days 00:00:00.448658,ReLU,Leaky,Leaky,,46,19,18.0,8.0,,0.05475482573984652,3,223,0.725395240065114,0.055581010851606924,273.41248086782605,COMPLETE
1075,0.32439351081848145,2023-09-04 21:49:42.975335,2023-09-04 21:49:44.012015,0 days 00:00:01.036680,ReLU,Tanh,Leaky,,46,20,19.0,9.0,,0.001961271659912746,3,211,0.5628879342102591,6.88676716724049e-05,171.95815135157386,COMPLETE
1076,0.4979378581047058,2023-09-04 21:49:44.012422,2023-09-04 21:49:44.370191,0 days 00:00:00.357769,ReLU,Leaky,Leaky,,43,19,19.0,9.0,,0.002138094636809514,3,195,0.11422548746601915,0.001896486490162667,1341.3418969840648,COMPLETE
1077,0.3438405394554138,2023-09-04 21:49:44.370589,2023-09-04 21:49:45.370411,0 days 00:00:00.999822,ReLU,ReLU,Leaky,,44,19,17.0,8.0,,0.0026316663191376013,3,205,0.5447970424074813,0.0002570390124047671,165.2766071917063,COMPLETE
1078,0.31553229689598083,2023-09-04 21:49:45.370811,2023-09-04 21:49:45.904064,0 days 00:00:00.533253,ReLU,Leaky,Leaky,,44,20,5.0,10.0,,0.0374215763173646,3,333,0.7595639869249601,2.593956374835538e-05,179.7204121907552,COMPLETE
1079,0.8256489634513855,2023-09-04 21:49:45.904473,2023-09-04 21:49:47.771426,0 days 00:00:01.866953,ReLU,Tanh,Leaky,,48,18,19.0,9.0,,2.557906035064408e-05,3,302,0.2897402831828424,0.0002169856770324618,133.5640886066765,COMPLETE
1080,0.327898770570755,2023-09-04 21:49:47.771850,2023-09-04 21:49:48.139633,0 days 00:00:00.367783,ReLU,Leaky,Leaky,,52,20,23.0,13.0,,0.014911293403238926,3,232,0.40777234681038466,5.8619805850381246e-05,451.9867306271115,COMPLETE
1081,0.30345892906188965,2023-09-04 21:49:48.140049,2023-09-04 21:49:48.788970,0 days 00:00:00.648921,ReLU,Leaky,Leaky,,48,19,24.0,8.0,,0.0015414051751385905,3,221,0.7352916472962843,0.0015575128764195574,720.2252249368807,COMPLETE
1082,0.4121946096420288,2023-09-04 21:49:48.789384,2023-09-04 21:49:49.365268,0 days 00:00:00.575884,ReLU,Tanh,Leaky,,47,18,4.0,10.0,,0.002372245065090631,3,131,0.2707391824088864,3.740668543370654e-05,183.7877934773763,COMPLETE
1083,0.36186566948890686,2023-09-04 21:49:49.365690,2023-09-04 21:49:52.589521,0 days 00:00:03.223831,ReLU,ReLU,Leaky,,42,20,22.0,10.0,,0.0001417461092771966,3,212,0.6208893783666083,2.2746358244486548e-05,158.90072059631348,COMPLETE
1084,0.5016685128211975,2023-09-04 21:49:52.590287,2023-09-04 21:49:53.329279,0 days 00:00:00.738992,ReLU,Leaky,Leaky,,44,19,19.0,9.0,,0.09412319912713638,3,244,0.7669271888131448,5.06401841671891e-05,137.14439861591046,COMPLETE
1085,0.33517664670944214,2023-09-04 21:49:53.330033,2023-09-04 21:49:53.865662,0 days 00:00:00.535629,ReLU,Leaky,Leaky,,46,20,23.0,9.0,,0.02130400248680555,3,191,0.6729729257611683,3.096815652271504e-05,209.5539291381836,COMPLETE
1086,0.29059359431266785,2023-09-04 21:49:53.866090,2023-09-04 21:49:55.203068,0 days 00:00:01.336978,ReLU,Sigmoid,,,43,17,10.0,,,0.012627352951444168,2,198,0.7147219453444803,0.00012049125096908268,138.98778555943414,COMPLETE
1087,0.3616132438182831,2023-09-04 21:49:55.203474,2023-09-04 21:49:55.855830,0 days 00:00:00.652356,ReLU,Leaky,Leaky,,50,20,22.0,8.0,,0.0010301604289917098,3,257,0.238272624947469,1.0256385976977255e-05,137.47439606721736,COMPLETE
1088,0.36283642053604126,2023-09-04 21:49:55.856234,2023-09-04 21:49:56.096068,0 days 00:00:00.239834,ReLU,Tanh,Leaky,,41,19,21.0,10.0,,0.016160358358701044,3,236,0.17215868925638908,0.00024938172483966536,238.76228167559648,COMPLETE
1089,0.34121930599212646,2023-09-04 21:49:56.096482,2023-09-04 21:49:56.573794,0 days 00:00:00.477312,ReLU,,,,41,18,,,,0.02750719777986253,1,218,0.7644659698042311,0.0007094339254497634,236.60513188288763,COMPLETE
1090,0.7472468614578247,2023-09-04 21:49:56.574181,2023-09-04 21:49:58.107784,0 days 00:00:01.533603,ReLU,Leaky,Tanh,,50,14,9.0,9.0,,1.7703512431373582e-05,3,206,0.37656175547874704,7.712277190530118e-05,236.7699404225766,COMPLETE
1091,0.9219106435775757,2023-09-04 21:49:58.108198,2023-09-04 21:49:59.115933,0 days 00:00:01.007735,ReLU,ReLU,Leaky,,45,19,23.0,8.0,,1.1803775817065564e-05,3,272,0.159076040057819,0.009356464179670409,120.792297335232,COMPLETE
1092,0.3585362136363983,2023-09-04 21:49:59.116337,2023-09-04 21:49:59.761372,0 days 00:00:00.645035,ReLU,Leaky,Leaky,,39,17,22.0,8.0,,0.003112040028495235,3,227,0.4804754500664629,0.001284806874582302,156.5995903734891,COMPLETE
1093,0.44739001989364624,2023-09-04 21:49:59.761789,2023-09-04 21:49:59.950272,0 days 00:00:00.188483,ReLU,Tanh,Leaky,,54,20,18.0,20.0,,0.014012129689038718,3,348,0.22632501602618996,1.702977805499147e-05,391.65852024244225,COMPLETE
1094,0.3756566643714905,2023-09-04 21:49:59.950679,2023-09-04 21:50:00.277505,0 days 00:00:00.326826,ReLU,Leaky,Leaky,,42,20,22.0,9.0,,0.019861824832861145,3,310,0.27817951510679356,1.3156735104276313e-05,197.05508761935764,COMPLETE
1095,0.43075093626976013,2023-09-04 21:50:00.277928,2023-09-04 21:50:00.584843,0 days 00:00:00.306915,Leaky,Leaky,Tanh,,40,19,19.0,10.0,,0.0038705229765116926,3,250,0.1928930342209514,3.9863849116313694e-05,129.62635211555326,COMPLETE
1096,0.34957972168922424,2023-09-04 21:50:00.585252,2023-09-04 21:50:01.081167,0 days 00:00:00.495915,ReLU,Tanh,ReLU,,38,18,24.0,7.0,,0.012115332660926542,3,440,0.36418045799306265,0.00016206361656572138,137.73471007055167,COMPLETE
1097,0.46657121181488037,2023-09-04 21:50:01.081575,2023-09-04 21:50:01.230888,0 days 00:00:00.149313,ReLU,Leaky,Leaky,,43,20,23.0,11.0,,0.051680745851055566,3,318,0.10243594696638902,0.003870927118112649,162.10447057088217,COMPLETE
1098,0.38158297538757324,2023-09-04 21:50:01.231322,2023-09-04 21:50:03.019436,0 days 00:00:01.788114,Tanh,ReLU,Leaky,,58,18,21.0,8.0,,0.0012885206456867504,3,195,0.31345282057491375,0.006223476027468869,152.73560196314102,COMPLETE
1099,0.6393054127693176,2023-09-04 21:50:03.019842,2023-09-04 21:50:03.529733,0 days 00:00:00.509891,ReLU,Leaky,Leaky,,39,1,21.0,9.0,,0.02370978915485149,3,237,0.7997667629450762,0.00034024731640609843,201.24678283691406,COMPLETE
1100,0.28569555282592773,2023-09-04 21:50:03.530140,2023-09-04 21:50:05.187107,0 days 00:00:01.656967,ReLU,Tanh,Tanh,,38,20,22.0,8.0,,0.002757035717542534,3,204,0.6948877918547212,0.0005349510353511619,198.792044097302,COMPLETE
1101,0.39474180340766907,2023-09-04 21:50:05.187520,2023-09-04 21:50:05.561815,0 days 00:00:00.374295,ReLU,Sigmoid,Leaky,,49,21,20.0,11.0,,0.018419248902445836,3,186,0.59189430028073,0.0026459160030600022,163.87807288536658,COMPLETE
1102,0.3119695484638214,2023-09-04 21:50:05.562226,2023-09-04 21:50:06.796094,0 days 00:00:01.233868,ReLU,Leaky,Leaky,,41,19,19.0,9.0,,0.0021467737952164576,3,214,0.7392159842013126,0.0010401229568150828,239.13724208522487,COMPLETE
1103,0.4118785560131073,2023-09-04 21:50:06.796522,2023-09-04 21:50:07.895960,0 days 00:00:01.099438,ReLU,Leaky,ReLU,,37,20,22.0,10.0,,0.00163936717165151,3,265,0.7727739492413161,2.8318551408262338e-05,149.19749371758823,COMPLETE
1104,0.5756394267082214,2023-09-04 21:50:07.896379,2023-09-04 21:50:08.385528,0 days 00:00:00.489149,ReLU,Leaky,Leaky,,45,19,20.0,9.0,,0.016304660289792522,3,221,0.7165479288486559,0.08178277792358289,481.1736734324488,COMPLETE
1105,0.38251814246177673,2023-09-04 21:50:08.385943,2023-09-04 21:50:09.158239,0 days 00:00:00.772296,ReLU,Tanh,Tanh,,56,17,21.0,21.0,,0.012202761218878882,3,200,0.45553576575843935,9.9301911145299e-05,196.59762982624332,COMPLETE
1106,0.300184041261673,2023-09-04 21:50:09.158655,2023-09-04 21:50:11.852704,0 days 00:00:02.694049,Tanh,ReLU,Leaky,,39,18,11.0,9.0,,0.0007727100151497683,3,242,0.6688667196373125,6.219113306596278e-05,143.20908480012014,COMPLETE
1107,0.7365994453430176,2023-09-04 21:50:11.853122,2023-09-04 21:50:15.233711,0 days 00:00:03.380589,Leaky,Leaky,Leaky,,36,21,17.0,12.0,,1.2557829129101226e-05,3,190,0.7450120043376587,4.7084095073625444e-05,111.50704699064556,COMPLETE
1108,0.291461318731308,2023-09-04 21:50:15.234121,2023-09-04 21:50:16.378548,0 days 00:00:01.144427,ReLU,Leaky,Leaky,,32,20,22.0,8.0,,0.0034435079449352166,3,224,0.7725582474409418,2.1917001832572096e-05,148.03810486970124,COMPLETE
1109,0.26428067684173584,2023-09-04 21:50:16.378961,2023-09-04 21:50:18.400169,0 days 00:00:02.021208,ReLU,Tanh,Tanh,,42,19,23.0,7.0,,0.001015890941326537,3,210,0.6404161918127557,0.00022049422596577453,193.7683523243871,COMPLETE
1110,0.2816249430179596,2023-09-04 21:50:18.400571,2023-09-04 21:50:19.144369,0 days 00:00:00.743798,ReLU,Leaky,Leaky,,30,21,21.0,22.0,,0.03319176375021315,3,231,0.7002525037314743,3.273256730601037e-05,239.33445390973773,COMPLETE
1111,0.24137376248836517,2023-09-04 21:50:19.144779,2023-09-04 21:50:20.091585,0 days 00:00:00.946806,ReLU,Leaky,ReLU,Leaky,47,20,23.0,17.0,21.0,0.014323064262217963,4,61,0.740795693997434,0.00013852377737707416,164.57674378615158,COMPLETE
1112,0.529984176158905,2023-09-04 21:50:20.092008,2023-09-04 21:50:23.939543,0 days 00:00:03.847535,ReLU,Leaky,Leaky,Leaky,49,20,19.0,10.0,21.0,7.769620676025468e-05,4,118,0.7275260027102989,0.028908293861895588,160.0613017324674,COMPLETE
1113,0.3794195353984833,2023-09-04 21:50:23.939981,2023-09-04 21:50:24.755978,0 days 00:00:00.815997,ReLU,ReLU,ReLU,Leaky,47,19,24.0,16.0,22.0,0.014610114739897664,4,110,0.7996025077410501,0.00042123966426171856,168.66044393399866,COMPLETE
1114,0.4079202711582184,2023-09-04 21:50:24.756397,2023-09-04 21:50:24.981479,0 days 00:00:00.225082,ReLU,Tanh,Leaky,Leaky,47,21,24.0,17.0,14.0,0.022583526951572383,4,82,0.20723774996471686,0.0001717864823262698,3336.2738084059497,COMPLETE
