number,value,datetime_start,datetime_complete,duration,params_activation1,params_activation2,params_activation3,params_activation4,params_batch_size,params_fl1,params_fl2,params_fl3,params_fl4,params_learning_rate,params_n_layers,params_num_epochs,params_train_size,params_weight_decay,user_attrs_mre,state
1763,0.3269427418708801,2023-09-04 22:58:59.850678,2023-09-04 22:59:01.395098,0 days 00:00:01.544420,Leaky,ReLU,Sigmoid,,29,22,13.0,5.0,,0.001057110970707867,3,256,0.7211145581850126,0.0001814852215745788,117.88099776373969,COMPLETE
1764,0.34018823504447937,2023-09-04 22:59:01.395598,2023-09-04 22:59:04.792516,0 days 00:00:03.396918,ReLU,ReLU,,,16,20,8.0,,,0.00010061769886372141,2,245,0.3626151108266837,3.300715239088919e-05,110.50595201764789,COMPLETE
1765,0.4417217969894409,2023-09-04 22:59:04.792994,2023-09-04 22:59:05.439626,0 days 00:00:00.646632,Sigmoid,ReLU,Tanh,,24,21,20.0,15.0,,0.01653688269301851,3,225,0.7704994039430394,0.004907692517779837,104.25519416445778,COMPLETE
1766,0.36765557527542114,2023-09-04 22:59:05.440121,2023-09-04 22:59:05.693624,0 days 00:00:00.253503,Tanh,ReLU,ReLU,ReLU,59,23,9.0,16.0,18.0,0.008059096519477974,4,264,0.23105329062378221,6.633104936467387e-05,139.5503314336141,COMPLETE
1767,0.3623207211494446,2023-09-04 22:59:05.694119,2023-09-04 22:59:06.924027,0 days 00:00:01.229908,ReLU,Tanh,Leaky,,43,18,14.0,16.0,,0.000689036938741312,3,239,0.6964747569935378,2.6876934319048864e-05,112.76637973061091,COMPLETE
1768,0.32791292667388916,2023-09-04 22:59:06.924532,2023-09-04 22:59:07.956380,0 days 00:00:01.031848,Tanh,Leaky,Tanh,Leaky,32,21,15.0,17.0,11.0,0.005621095393878726,4,253,0.6726850277214554,0.0012540264805939647,92.38498869396392,COMPLETE
1769,0.3337593376636505,2023-09-04 22:59:07.956890,2023-09-04 22:59:08.531826,0 days 00:00:00.574936,ReLU,ReLU,ReLU,,27,22,22.0,7.0,,0.002617035458288966,3,231,0.43126846733360125,1.356959517483923e-05,116.00797653198242,COMPLETE
1770,0.29604294896125793,2023-09-04 22:59:08.532333,2023-09-04 22:59:09.752118,0 days 00:00:01.219785,Leaky,ReLU,Tanh,Leaky,36,19,18.0,14.0,14.0,0.00684456227819766,4,274,0.7494153591034607,0.004049105199706974,101.95108164273776,COMPLETE
1771,0.4384728968143463,2023-09-04 22:59:09.752614,2023-09-04 22:59:16.876064,0 days 00:00:07.123450,Tanh,ReLU,Sigmoid,,20,20,13.0,6.0,,4.4082501231964905e-05,3,246,0.7676698162500487,0.011821491456689393,132.38135714647245,COMPLETE
1772,0.35583364963531494,2023-09-04 22:59:16.876549,2023-09-04 22:59:17.347793,0 days 00:00:00.471244,ReLU,ReLU,ReLU,ReLU,22,23,12.0,13.0,17.0,0.021062282982544676,4,256,0.22288092844032253,3.869748473998165e-05,205.18927350725446,COMPLETE
1773,0.40919527411460876,2023-09-04 22:59:17.348302,2023-09-04 22:59:17.504222,0 days 00:00:00.155920,Tanh,ReLU,,,34,22,16.0,,,0.028203971558498478,2,237,0.12195128938106936,1.904339286448132e-05,1553.189244887408,COMPLETE
1774,0.38876673579216003,2023-09-04 22:59:17.504697,2023-09-04 22:59:17.759321,0 days 00:00:00.254624,ReLU,Sigmoid,Leaky,,26,21,15.0,5.0,,0.012021281322036979,3,218,0.17926848198319045,0.00046526139870285883,322.5858417857777,COMPLETE
1775,0.34156715869903564,2023-09-04 22:59:17.759831,2023-09-04 22:59:18.039238,0 days 00:00:00.279407,Tanh,Tanh,ReLU,,67,19,19.0,23.0,,0.004068276845724718,3,202,0.19950618048221194,0.0011117545515101602,121.38542344835069,COMPLETE
1776,0.3752520978450775,2023-09-04 22:59:18.039749,2023-09-04 22:59:18.634610,0 days 00:00:00.594861,Leaky,ReLU,Tanh,Leaky,29,20,17.0,15.0,12.0,0.0008762391303891939,4,263,0.21650328703863608,5.820513049704127e-05,118.9958489840148,COMPLETE
1777,0.365442156791687,2023-09-04 22:59:18.635154,2023-09-04 22:59:18.900437,0 days 00:00:00.265283,ReLU,,,,32,19,,,,0.008758609721500787,1,247,0.18691976208290104,2.2446404006965176e-05,112.79988738029233,COMPLETE
1778,0.35416460037231445,2023-09-04 22:59:18.900926,2023-09-04 22:59:23.078852,0 days 00:00:04.177926,Sigmoid,ReLU,ReLU,ReLU,23,23,14.0,8.0,12.0,0.0003571369424401303,4,229,0.5799610254034397,0.00015549851449578477,120.15410195486886,COMPLETE
1779,0.3090076148509979,2023-09-04 22:59:23.079389,2023-09-04 22:59:23.857071,0 days 00:00:00.777682,Tanh,ReLU,Tanh,,81,22,10.0,16.0,,0.002246155848121692,3,242,0.728863892678573,4.4972536208236953e-05,111.04122537806414,COMPLETE
1780,0.5136038661003113,2023-09-04 22:59:23.857588,2023-09-04 22:59:31.876524,0 days 00:00:08.018936,ReLU,ReLU,Sigmoid,,19,23,21.0,17.0,,1.4807967425355273e-05,3,255,0.7991050698524911,1.5292063173145604e-05,118.51167306339039,COMPLETE
1781,0.32622721791267395,2023-09-04 22:59:31.877012,2023-09-04 22:59:32.545515,0 days 00:00:00.668503,Tanh,ReLU,ReLU,Leaky,25,20,15.0,18.0,23.0,0.014229842304403106,4,269,0.30465159441826145,3.1330308345603926e-05,336.1965272322945,COMPLETE
1782,0.32071465253829956,2023-09-04 22:59:32.546058,2023-09-04 22:59:33.439244,0 days 00:00:00.893186,ReLU,Leaky,Tanh,,31,21,16.0,4.0,,0.0049085268957931435,3,236,0.7997069228761176,0.000118447119098228,103.3364779498126,COMPLETE
1783,0.3496536612510681,2023-09-04 22:59:33.439761,2023-09-04 22:59:33.815896,0 days 00:00:00.376135,Tanh,Tanh,Leaky,ReLU,38,22,18.0,6.0,13.0,0.01045330003387234,4,251,0.3960452977365457,0.00036870162754575807,118.23678415471858,COMPLETE
1784,0.33508816361427307,2023-09-04 22:59:33.816415,2023-09-04 22:59:35.400743,0 days 00:00:01.584328,ReLU,ReLU,ReLU,,28,20,14.0,22.0,,0.007584751590271854,3,276,0.6768015838080376,9.335306521405841e-05,177.9527732551872,COMPLETE
1785,0.3192023038864136,2023-09-04 22:59:35.401231,2023-09-04 22:59:36.238332,0 days 00:00:00.837101,Leaky,ReLU,Tanh,,41,22,17.0,17.0,,0.0032441248354344644,3,135,0.6302571255690614,2.4520197729282006e-05,105.07591837757039,COMPLETE
1786,0.3206302523612976,2023-09-04 22:59:36.238908,2023-09-04 22:59:37.191446,0 days 00:00:00.952538,Tanh,ReLU,Sigmoid,Leaky,21,21,16.0,14.0,24.0,0.018574768884671883,4,261,0.5085231773026783,0.0015256253652269302,105.72116666226773,COMPLETE
1787,0.3323421776294708,2023-09-04 22:59:37.191977,2023-09-04 22:59:38.053002,0 days 00:00:00.861025,ReLU,ReLU,ReLU,,35,14,13.0,16.0,,0.005845732093657126,3,244,0.7452436283169035,0.0002604290816443377,102.84045906954033,COMPLETE
1788,0.32623347640037537,2023-09-04 22:59:38.053504,2023-09-04 22:59:38.932190,0 days 00:00:00.878686,Tanh,ReLU,Tanh,ReLU,24,17,12.0,15.0,11.0,0.00948942815854081,4,228,0.709695157272707,1.840075350631115e-05,1285.54466683524,COMPLETE
1789,0.3525528907775879,2023-09-04 22:59:38.932699,2023-09-04 22:59:39.373751,0 days 00:00:00.441052,ReLU,Tanh,Leaky,,18,18,7.0,18.0,,0.05169779906349926,3,252,0.2869044521614091,1.0084687804094257e-05,115.26871147155762,COMPLETE
1790,0.4211101830005646,2023-09-04 22:59:39.374280,2023-09-04 22:59:39.613307,0 days 00:00:00.239027,Leaky,ReLU,ReLU,Leaky,27,19,8.0,9.0,18.0,0.034902347395767946,4,386,0.13498802719986747,3.758674333858522e-05,110.56569591321443,COMPLETE
1791,0.3206830322742462,2023-09-04 22:59:39.613816,2023-09-04 22:59:42.564632,0 days 00:00:02.950816,ReLU,ReLU,Tanh,,12,6,19.0,16.0,,0.0013741078724433307,3,212,0.7636119958731427,0.000779757501431212,116.81858050823212,COMPLETE
1792,0.31121405959129333,2023-09-04 22:59:42.565174,2023-09-04 22:59:44.203542,0 days 00:00:01.638368,Sigmoid,ReLU,ReLU,,33,23,14.0,7.0,,0.004565385153447001,3,238,0.7687745548920965,7.496804350418289e-05,113.40360005696614,COMPLETE
1793,0.3787615895271301,2023-09-04 22:59:44.204064,2023-09-04 22:59:44.892111,0 days 00:00:00.688047,Tanh,ReLU,Sigmoid,ReLU,70,22,9.0,24.0,16.0,0.0027718698697482905,4,262,0.41774922394037667,2.8753678188490708e-05,104.54805272742163,COMPLETE
1794,0.30207493901252747,2023-09-04 22:59:44.892628,2023-09-04 22:59:46.075192,0 days 00:00:01.182564,ReLU,Leaky,Tanh,Leaky,22,21,15.0,15.0,22.0,0.0037910879817475364,4,245,0.7335238621701164,1.3530783327753632e-05,111.89475860595704,COMPLETE
1795,0.2372969388961792,2023-09-04 22:59:46.075719,2023-09-04 22:59:47.655493,0 days 00:00:01.579774,Tanh,ReLU,ReLU,,37,20,13.0,17.0,,0.0008674389731621826,3,227,0.7704276957881877,0.00020157128395555715,97.51250539507184,COMPLETE
1796,0.35868558287620544,2023-09-04 22:59:47.656018,2023-09-04 22:59:48.761492,0 days 00:00:01.105474,Tanh,ReLU,,,36,20,13.0,,,0.001009038632864039,2,211,0.30564108563849823,0.00015344958834723505,96.92114696502685,COMPLETE
1797,0.2902257442474365,2023-09-04 22:59:48.761997,2023-09-04 22:59:50.948286,0 days 00:00:02.186289,ReLU,Tanh,Leaky,,35,20,13.0,18.0,,0.0006714132133928601,3,218,0.7715264031102894,0.00021818060111188976,97.21677124291135,COMPLETE
1798,0.26891493797302246,2023-09-04 22:59:50.948793,2023-09-04 22:59:53.695119,0 days 00:00:02.746326,Tanh,ReLU,ReLU,Leaky,37,20,13.0,18.0,19.0,0.0007487339978613496,4,205,0.7998351293477944,0.0002126991506056727,97.22232212004114,COMPLETE
1799,0.31762680411338806,2023-09-04 22:59:53.695622,2023-09-04 22:59:55.672447,0 days 00:00:01.976825,Leaky,ReLU,Tanh,,34,19,13.0,18.0,,0.0016536375172986856,3,223,0.7703406463311563,0.0002032028393912335,93.21419540559403,COMPLETE
1800,0.38893502950668335,2023-09-04 22:59:55.672945,2023-09-04 22:59:55.987266,0 days 00:00:00.314321,ReLU,ReLU,ReLU,,37,20,13.0,17.0,,0.07485085767832492,3,195,0.5406261468605748,0.00014719476658228275,112.31206970214843,COMPLETE
1801,0.3343502879142761,2023-09-04 22:59:55.987789,2023-09-04 22:59:56.314879,0 days 00:00:00.327090,Tanh,,,,34,20,,,,0.012068713312512486,1,215,0.3252749906855074,0.0003032134589543445,130.81699232621625,COMPLETE
1802,0.3560117781162262,2023-09-04 22:59:56.315366,2023-09-04 22:59:59.064881,0 days 00:00:02.749515,ReLU,Sigmoid,Sigmoid,ReLU,34,20,13.0,17.0,12.0,0.0008146281373801248,4,225,0.7436486255422777,0.00016745949836041076,101.54541439480252,COMPLETE
1803,0.3502967655658722,2023-09-04 22:59:59.065393,2023-09-04 23:00:00.473002,0 days 00:00:01.407609,Tanh,ReLU,Tanh,,32,19,13.0,18.0,,0.0007821100375921275,3,223,0.7720938295267435,0.00026654172454426505,91.5219363550986,COMPLETE
1804,0.3388324975967407,2023-09-04 23:00:00.473518,2023-09-04 23:00:01.610681,0 days 00:00:01.137163,ReLU,ReLU,ReLU,Leaky,35,19,14.0,17.0,10.0,0.0014088287186512516,4,216,0.7988315732198905,0.0001780510928322295,103.66931683084239,COMPLETE
1805,0.3073977828025818,2023-09-04 23:00:01.611178,2023-09-04 23:00:05.304603,0 days 00:00:03.693425,Sigmoid,Tanh,Leaky,,35,20,14.0,18.0,,0.0008904589163145043,3,201,0.745947538633699,0.0001250073330640685,111.42157859232888,COMPLETE
1806,0.36046308279037476,2023-09-04 23:00:05.305095,2023-09-04 23:00:06.989047,0 days 00:00:01.683952,Leaky,ReLU,Tanh,ReLU,36,20,13.0,17.0,15.0,0.0005018855062963796,4,207,0.3377451575258392,0.00016666956954586564,108.76310620307922,COMPLETE
1807,0.28009819984436035,2023-09-04 23:00:06.989557,2023-09-04 23:00:09.287680,0 days 00:00:02.298123,Tanh,ReLU,ReLU,,31,19,14.0,17.0,,0.0005071546710756479,3,233,0.7720943985954857,0.0001039728096984408,85.74164147333268,COMPLETE
1808,0.4561970829963684,2023-09-04 23:00:09.288194,2023-09-04 23:00:10.260619,0 days 00:00:00.972425,ReLU,ReLU,Sigmoid,Leaky,33,20,13.0,18.0,1.0,0.0006215830930428952,4,225,0.145515849508116,0.00012351459368470814,304.2106628417969,COMPLETE
1809,0.3141419291496277,2023-09-04 23:00:10.261122,2023-09-04 23:00:11.620946,0 days 00:00:01.359824,Tanh,ReLU,ReLU,,78,19,14.0,17.0,,0.0007914742364814526,3,230,0.5707436610407657,0.00020297454503385992,102.67555459537861,COMPLETE
1810,0.32914674282073975,2023-09-04 23:00:11.621446,2023-09-04 23:00:11.985142,0 days 00:00:00.363696,ReLU,Leaky,Tanh,ReLU,33,20,13.0,17.0,12.0,0.01539134009041323,4,217,0.20548347851139506,0.00023736941231621892,121.36323412726907,COMPLETE
1811,0.3258754312992096,2023-09-04 23:00:11.985660,2023-09-04 23:00:13.582354,0 days 00:00:01.596694,Tanh,ReLU,Leaky,,36,19,14.0,7.0,,0.0011611639808004517,3,232,0.435354221957083,0.00065035901793334,108.18232544375138,COMPLETE
1812,0.3859614431858063,2023-09-04 23:00:13.582855,2023-09-04 23:00:14.017056,0 days 00:00:00.434201,ReLU,Tanh,ReLU,,38,20,13.0,19.0,,0.0006074573656121927,3,228,0.11630472301543096,0.00020041621877165194,134.97684338023362,COMPLETE
1813,0.3903513252735138,2023-09-04 23:00:14.017577,2023-09-04 23:00:15.026036,0 days 00:00:01.008459,Leaky,ReLU,,,15,20,14.0,,,0.0005841356851931379,2,219,0.17130383088186515,0.00037976972054857064,202.21194219589233,COMPLETE
1814,0.3406127691268921,2023-09-04 23:00:15.026520,2023-09-04 23:00:16.501086,0 days 00:00:01.474566,Tanh,ReLU,Tanh,Leaky,37,20,13.0,6.0,11.0,0.0005764203240186136,4,236,0.7422848049286582,0.009227767699541561,104.35079159943953,COMPLETE
1815,0.32878348231315613,2023-09-04 23:00:16.501584,2023-09-04 23:00:19.704125,0 days 00:00:03.202541,ReLU,ReLU,ReLU,,30,19,24.0,5.0,,0.0009458079781958703,3,238,0.7704178709493309,0.00013990973697768452,444.3769033277357,COMPLETE
1816,0.37863689661026,2023-09-04 23:00:19.704629,2023-09-04 23:00:20.500931,0 days 00:00:00.796302,ReLU,ReLU,Tanh,ReLU,21,18,14.0,18.0,23.0,0.0011009255590550865,4,188,0.2823996892132276,0.00018295911293065483,113.43015087775464,COMPLETE
1817,0.49108970165252686,2023-09-04 23:00:20.501452,2023-09-04 23:00:21.615735,0 days 00:00:01.114283,Tanh,ReLU,Sigmoid,,25,19,1.0,17.0,,0.001218688975898236,3,228,0.24819742549137855,0.024480090599120402,279.48098570300687,COMPLETE
1818,0.36586713790893555,2023-09-04 23:00:21.616234,2023-09-04 23:00:23.117214,0 days 00:00:01.500980,Sigmoid,Tanh,ReLU,Leaky,32,20,15.0,8.0,21.0,0.007260059958747585,4,209,0.7185283295845355,1.5477787542485372e-05,126.2945571172805,COMPLETE
1819,0.4004339277744293,2023-09-04 23:00:23.117722,2023-09-04 23:00:23.767356,0 days 00:00:00.649634,ReLU,ReLU,Leaky,,17,18,14.0,17.0,,0.0008350003585446814,3,241,0.1664054941472908,0.0004920409378406445,128.66982567828634,COMPLETE
1820,0.37269535660743713,2023-09-04 23:00:23.767862,2023-09-04 23:00:27.675472,0 days 00:00:03.907610,Tanh,ReLU,Tanh,,23,20,13.0,7.0,,0.00014200916020689583,3,225,0.48841030090900484,0.006699840768965487,176.97448235405815,COMPLETE
1821,0.3491904139518738,2023-09-04 23:00:27.676000,2023-09-04 23:00:29.532146,0 days 00:00:01.856146,Leaky,ReLU,ReLU,ReLU,10,19,18.0,6.0,10.0,0.0010219164488305221,4,236,0.3716769314278681,1.202775952790732e-05,155.83020702161286,COMPLETE
1822,0.4434083104133606,2023-09-04 23:00:29.532656,2023-09-04 23:00:31.254191,0 days 00:00:01.721535,ReLU,Leaky,Tanh,,20,20,16.0,18.0,,4.435669163215366e-05,3,247,0.1615976204177143,0.00034252820039792345,141.07962131886347,COMPLETE
1823,0.42956334352493286,2023-09-04 23:00:31.254697,2023-09-04 23:00:37.560251,0 days 00:00:06.305554,Tanh,Sigmoid,Sigmoid,Leaky,30,21,15.0,5.0,24.0,5.614549040119342e-05,4,253,0.7981625871555157,1.6195690465254348e-05,111.70629900905925,COMPLETE
1824,0.4318375885486603,2023-09-04 23:00:37.560751,2023-09-04 23:00:38.105629,0 days 00:00:00.544878,ReLU,ReLU,ReLU,,26,21,15.0,17.0,,0.04219793351283828,3,219,0.7398508176259319,0.06051710570825367,124.73510581568668,COMPLETE
1825,0.34053710103034973,2023-09-04 23:00:38.106135,2023-09-04 23:00:38.556183,0 days 00:00:00.450048,Tanh,,,,35,19,,,,0.09638071464838754,1,270,0.7694011900663869,1.974155848993961e-05,104.1248654683431,COMPLETE
1826,0.3100064992904663,2023-09-04 23:00:38.556674,2023-09-04 23:00:39.773683,0 days 00:00:01.217009,ReLU,ReLU,Tanh,ReLU,28,19,13.0,6.0,14.0,0.026939215627620857,4,243,0.7126355837212719,0.00013723254259515887,103.69448391226835,COMPLETE
1827,0.3109186291694641,2023-09-04 23:00:39.774193,2023-09-04 23:00:40.373249,0 days 00:00:00.599056,Leaky,Tanh,,,24,20,14.0,,,0.010882220232167015,2,234,0.7715815499861453,0.0023507591117008174,91.58299763997395,COMPLETE
1828,0.3390175998210907,2023-09-04 23:00:40.373737,2023-09-04 23:00:40.840837,0 days 00:00:00.467100,Tanh,ReLU,Leaky,,33,21,19.0,7.0,,0.008874226916027433,3,277,0.3508368368344453,0.00030940872068170176,109.03562803526182,COMPLETE
1829,0.9180914759635925,2023-09-04 23:00:40.841333,2023-09-04 23:00:43.389406,0 days 00:00:02.548073,ReLU,ReLU,ReLU,Leaky,37,20,17.0,23.0,9.0,0.0004491403567461821,4,257,0.4031689775473601,0.09263421789698019,99.52899034772601,COMPLETE
1830,0.39164119958877563,2023-09-04 23:00:43.389920,2023-09-04 23:00:43.664701,0 days 00:00:00.274781,Tanh,ReLU,Tanh,,20,21,21.0,8.0,,0.019810476309488425,3,247,0.11444416247929141,0.000592067914358189,530.3370361328125,COMPLETE
1831,0.27198371291160583,2023-09-04 23:00:43.665218,2023-09-04 23:00:44.548926,0 days 00:00:00.883708,ReLU,ReLU,ReLU,,22,20,12.0,9.0,,0.012989543675270292,3,192,0.7444636857285511,1.2155284309798743e-05,1846.8339029947917,COMPLETE
1832,0.3444138765335083,2023-09-04 23:00:44.549445,2023-09-04 23:00:49.922984,0 days 00:00:05.373539,Tanh,ReLU,Sigmoid,Leaky,29,21,20.0,17.0,13.0,8.725293806191041e-05,4,205,0.798570680700925,0.0002312358387152927,118.8619607320646,COMPLETE
1833,0.44652023911476135,2023-09-04 23:00:49.923495,2023-09-04 23:00:50.193496,0 days 00:00:00.270001,Sigmoid,Tanh,Tanh,,55,17,13.0,17.0,,0.006364159678735592,3,236,0.13812585549835932,0.00044198678606411257,135.5784730911255,COMPLETE
1834,0.31141653656959534,2023-09-04 23:00:50.194012,2023-09-04 23:00:51.287636,0 days 00:00:01.093624,ReLU,ReLU,ReLU,ReLU,31,18,15.0,19.0,11.0,0.009132699912208865,4,264,0.6990806543298793,0.0008548766015585213,96.49002210828993,COMPLETE
1835,0.3014953136444092,2023-09-04 23:00:51.288175,2023-09-04 23:00:53.252817,0 days 00:00:01.964642,Leaky,ReLU,Leaky,,27,19,16.0,4.0,,0.0010184129228718805,3,223,0.7994564553042616,9.774528225692532e-05,365.23646375868054,COMPLETE
1836,0.24626828730106354,2023-09-04 23:00:53.253329,2023-09-04 23:00:54.142127,0 days 00:00:00.888798,Tanh,ReLU,Tanh,,24,20,18.0,16.0,,0.016804883225553714,3,251,0.7476938859958702,0.00017008859130345579,94.25657820701599,COMPLETE
1837,0.28085607290267944,2023-09-04 23:00:54.142621,2023-09-04 23:00:55.000200,0 days 00:00:00.857579,Tanh,Leaky,ReLU,Leaky,22,20,18.0,16.0,6.0,0.01745133714744003,4,279,0.6759114790798724,0.00016334650589751927,99.13421454796425,COMPLETE
1838,0.39719992876052856,2023-09-04 23:00:55.000701,2023-09-04 23:00:55.262102,0 days 00:00:00.261401,Tanh,ReLU,Tanh,,19,20,18.0,16.0,,0.02560919885491454,3,260,0.15569079706518427,0.00019027081394971872,110.78268890380859,COMPLETE
1839,0.3085809051990509,2023-09-04 23:00:55.262599,2023-09-04 23:00:55.844649,0 days 00:00:00.582050,Tanh,ReLU,Sigmoid,,22,20,18.0,16.0,,0.016861801105027434,3,267,0.5928789548831004,0.0001470644788813959,107.3037556734952,COMPLETE
1840,0.3340262472629547,2023-09-04 23:00:55.845169,2023-09-04 23:00:56.574553,0 days 00:00:00.729384,Tanh,ReLU,ReLU,ReLU,23,20,18.0,16.0,22.0,0.034647226790914865,4,256,0.5463750166946865,0.00025335737621099314,116.70026365915935,COMPLETE
1841,0.5581270456314087,2023-09-04 23:00:56.575061,2023-09-04 23:00:57.217722,0 days 00:00:00.642661,Tanh,Tanh,Tanh,Leaky,21,19,18.0,16.0,20.0,6.396376818255257e-05,4,101,0.10599587318805552,0.00018613213222554167,112.44287645698773,COMPLETE
1842,0.2718464434146881,2023-09-04 23:00:57.218240,2023-09-04 23:00:57.994779,0 days 00:00:00.776539,Tanh,ReLU,Leaky,,18,20,18.0,16.0,,0.021829256029870136,3,123,0.7097154062494028,0.00013116473586077012,80.03105579723011,COMPLETE
1843,0.41161713004112244,2023-09-04 23:00:57.995276,2023-09-04 23:00:58.211234,0 days 00:00:00.215958,Tanh,,,,23,19,,,,0.021046506164515994,1,251,0.24931422283243548,0.00018750954622295213,123.65944740988992,COMPLETE
1844,0.3552677631378174,2023-09-04 23:00:58.211737,2023-09-04 23:00:58.493932,0 days 00:00:00.282195,Tanh,ReLU,ReLU,,20,19,19.0,16.0,,0.015117864611272971,3,267,0.1938866812452643,0.00012897687175693573,293.18759797748766,COMPLETE
1845,0.3504420816898346,2023-09-04 23:00:58.494439,2023-09-04 23:00:59.343520,0 days 00:00:00.849081,Tanh,ReLU,Tanh,ReLU,24,20,18.0,17.0,2.0,0.02295053661446321,4,253,0.7174977009816608,0.0001691132898349123,451.0018052321214,COMPLETE
1846,0.3825704753398895,2023-09-04 23:00:59.344024,2023-09-04 23:00:59.772303,0 days 00:00:00.428279,Tanh,ReLU,Sigmoid,,24,20,19.0,15.0,,0.05827259168698598,3,247,0.6407215266265269,0.00012164973224665356,100.93209130423409,COMPLETE
1847,0.9668554663658142,2023-09-04 23:00:59.772808,2023-09-04 23:01:01.029372,0 days 00:00:01.256564,Tanh,ReLU,ReLU,Leaky,20,19,19.0,16.0,10.0,2.7400679181022294e-05,4,258,0.2121243045065391,0.09804620419744386,102.25589665004185,COMPLETE
1848,0.33153462409973145,2023-09-04 23:01:01.029899,2023-09-04 23:01:04.112790,0 days 00:00:03.082891,Tanh,Tanh,,,18,20,17.0,,,0.0009646598962042002,2,276,0.7375167914852817,0.0001544146284094076,105.00074124927363,COMPLETE
1849,0.39511623978614807,2023-09-04 23:01:04.113310,2023-09-04 23:01:04.769006,0 days 00:00:00.655696,Tanh,ReLU,Tanh,,16,20,18.0,17.0,,0.02766163020122433,3,334,0.6853387452817464,0.00022691153868987135,516.6623337689568,COMPLETE
1850,0.4046657979488373,2023-09-04 23:01:04.769545,2023-09-04 23:01:05.427109,0 days 00:00:00.657564,Tanh,Sigmoid,Leaky,ReLU,22,20,17.0,15.0,17.0,0.0017094682357382165,4,114,0.1239625210390733,0.00011193970188862613,118.67072514125279,COMPLETE
1851,0.34724581241607666,2023-09-04 23:01:05.427671,2023-09-04 23:01:06.011640,0 days 00:00:00.583969,Tanh,ReLU,ReLU,,62,19,18.0,16.0,,0.007153077911542973,3,247,0.7427926586030058,0.00026908319133679356,92.49763019268329,COMPLETE
1852,0.339122474193573,2023-09-04 23:01:06.012163,2023-09-04 23:01:06.464628,0 days 00:00:00.452465,Tanh,Leaky,Tanh,,36,20,19.0,15.0,,0.005674788636773378,3,263,0.4419006886079136,0.0002094242341725324,107.73091666929183,COMPLETE
1853,0.31968924403190613,2023-09-04 23:01:06.465164,2023-09-04 23:01:07.331882,0 days 00:00:00.866718,Tanh,ReLU,ReLU,Leaky,25,19,18.0,17.0,8.0,0.018518128211377754,4,240,0.4610959303429566,0.00010477266428755734,130.9287916484632,COMPLETE
1854,0.3157673478126526,2023-09-04 23:01:07.332417,2023-09-04 23:01:09.606434,0 days 00:00:02.274017,Tanh,ReLU,Sigmoid,,38,19,19.0,16.0,,0.0013162547357952472,3,253,0.7273225060613858,8.535935582297882e-05,187.28640946345544,COMPLETE
