number,value,datetime_start,datetime_complete,duration,params_activation1,params_activation2,params_activation3,params_activation4,params_batch_size,params_fl1,params_fl2,params_fl3,params_fl4,params_learning_rate,params_n_layers,params_num_epochs,params_train_size,params_weight_decay,user_attrs_mre,state
1516,0.6403421759605408,2023-09-04 22:37:05.170208,2023-09-04 22:37:06.349961,0 days 00:00:01.179753,Sigmoid,Leaky,Sigmoid,Sigmoid,86,19,19.0,22.0,3.0,0.01665352203323896,4,320,0.7995369047321221,2.2226473224348044e-05,158.776121873122,COMPLETE
1517,1.0192923545837402,2023-09-04 22:37:06.350931,2023-09-04 22:37:08.561554,0 days 00:00:02.210623,Tanh,Leaky,Sigmoid,Leaky,90,20,22.0,21.0,16.0,4.0586085655162895e-05,4,214,0.19644633575108467,0.00010707126398763518,156.17496476217966,COMPLETE
1518,0.7798290848731995,2023-09-04 22:37:08.562542,2023-09-04 22:37:11.869066,0 days 00:00:03.306524,ReLU,Leaky,Sigmoid,Sigmoid,82,18,21.0,24.0,4.0,0.00011097192397777171,4,252,0.25896781293133514,0.0029000027891515814,97.37257097637843,COMPLETE
1519,0.3725484609603882,2023-09-04 22:37:11.870017,2023-09-04 22:37:21.202776,0 days 00:00:09.332759,Leaky,Leaky,ReLU,Leaky,36,20,20.0,23.0,8.0,0.0005706347243284879,4,228,0.7278985419398383,0.030675318841781443,107.59809291673743,COMPLETE
1520,0.472175657749176,2023-09-04 22:37:21.203743,2023-09-04 22:37:22.104560,0 days 00:00:00.900817,Tanh,,,,30,10,,,,0.03156360255392511,1,293,0.26688819974533,2.9367148068170994e-05,178.54480361938477,COMPLETE
1521,0.2623843550682068,2023-09-04 22:37:22.105496,2023-09-04 22:37:25.592169,0 days 00:00:03.486673,Sigmoid,Leaky,Tanh,ReLU,84,18,21.0,15.0,22.0,0.008597013837397303,4,202,0.7487586026913611,0.00020969252859249016,129.64402222633362,COMPLETE
1522,0.3920464813709259,2023-09-04 22:37:25.593126,2023-09-04 22:37:27.397256,0 days 00:00:01.804130,Tanh,Leaky,Sigmoid,Sigmoid,32,17,20.0,23.0,6.0,0.02491492062245587,4,238,0.679307722186868,0.00025556056445223864,154.21054553985596,COMPLETE
1523,0.456667959690094,2023-09-04 22:37:27.398228,2023-09-04 22:37:34.145195,0 days 00:00:06.746967,ReLU,Leaky,Sigmoid,Leaky,47,16,19.0,23.0,17.0,0.00025621758127532566,4,271,0.5298987729507542,1.729336259505464e-05,137.88626111419507,COMPLETE
1524,0.24015982449054718,2023-09-04 22:37:34.146161,2023-09-04 22:37:42.117939,0 days 00:00:07.971778,Tanh,Leaky,Sigmoid,Leaky,88,19,20.0,14.0,7.0,0.0008887961093435121,4,253,0.7723619873220975,4.92967493107664e-05,174.9562994226233,COMPLETE
1525,1.040292501449585,2023-09-04 22:37:42.118898,2023-09-04 22:37:42.833445,0 days 00:00:00.714547,Sigmoid,Leaky,ReLU,Sigmoid,77,14,18.0,22.0,20.0,0.013470344552460293,4,243,0.7091053566462138,0.013526961285492222,111.98470247708835,COMPLETE
1526,0.3153843879699707,2023-09-04 22:37:42.834409,2023-09-04 22:37:44.171584,0 days 00:00:01.337175,Leaky,Leaky,Sigmoid,Leaky,81,21,21.0,24.0,19.0,0.005848450350934642,4,223,0.7443083904515118,0.0005232757604482583,127.18417382240295,COMPLETE
1527,0.3092212975025177,2023-09-04 22:37:44.172568,2023-09-04 22:37:46.503200,0 days 00:00:02.330632,Tanh,Leaky,Sigmoid,Sigmoid,64,18,19.0,15.0,5.0,0.01791844142448834,4,282,0.7689006241589165,0.0008868030609876142,246.82913970947266,COMPLETE
1528,0.26292240619659424,2023-09-04 22:37:46.504151,2023-09-04 22:37:48.972856,0 days 00:00:02.468705,Tanh,Leaky,Sigmoid,Leaky,86,19,23.0,23.0,16.0,0.0038817389211519867,4,311,0.7233739174087106,0.00013596724910005915,115.37546362393144,COMPLETE
1529,0.28487083315849304,2023-09-04 22:37:48.973807,2023-09-04 22:37:51.896359,0 days 00:00:02.922552,ReLU,Leaky,Sigmoid,Sigmoid,28,20,20.0,17.0,18.0,0.011486426497233642,4,301,0.6659194512329459,0.00016143117672140375,167.10746595594617,COMPLETE
1530,0.5398816466331482,2023-09-04 22:37:51.897318,2023-09-04 22:37:53.722146,0 days 00:00:01.824828,Sigmoid,Leaky,ReLU,Leaky,84,11,22.0,22.0,5.0,0.00031557777542915854,4,260,0.19638750764435234,6.546260080993332e-05,117.86851910006615,COMPLETE
1531,0.5729286670684814,2023-09-04 22:37:53.723104,2023-09-04 22:37:57.181012,0 days 00:00:03.457908,Tanh,Leaky,Sigmoid,Leaky,80,17,21.0,24.0,6.0,9.890198741000106e-05,4,233,0.291398682818254,0.0007396230014066296,138.09494362368605,COMPLETE
1532,0.3002232313156128,2023-09-04 22:37:57.181989,2023-09-04 22:38:02.373634,0 days 00:00:05.191645,Leaky,Tanh,Sigmoid,Sigmoid,34,19,20.0,16.0,15.0,0.003115002600508342,4,215,0.7714527966051404,2.5978439799934824e-05,258.8404145770603,COMPLETE
1533,0.8538239598274231,2023-09-04 22:38:02.374592,2023-09-04 22:38:02.848954,0 days 00:00:00.474362,Tanh,Leaky,Sigmoid,ReLU,52,20,19.0,23.0,4.0,0.007285280695843758,4,267,0.1184372059405204,8.400399802440828e-05,105.68070888519287,COMPLETE
1534,0.321153849363327,2023-09-04 22:38:02.849976,2023-09-04 22:38:14.954826,0 days 00:00:12.104850,Sigmoid,Leaky,ReLU,Leaky,26,18,21.0,24.0,7.0,0.0014799582134598953,4,248,0.6069622587676053,0.00031942242784889523,108.78100080818966,COMPLETE
1535,0.3135400712490082,2023-09-04 22:38:14.955811,2023-09-04 22:38:17.111875,0 days 00:00:02.156064,ReLU,Sigmoid,Sigmoid,Sigmoid,74,21,19.0,15.0,17.0,0.01498923962148597,4,239,0.7077335285178326,0.00019543467986373546,138.9595606667655,COMPLETE
1536,0.9973324537277222,2023-09-04 22:38:17.112840,2023-09-04 22:38:18.264779,0 days 00:00:01.151939,Tanh,ReLU,Sigmoid,Leaky,85,16,20.0,23.0,8.0,0.00012661532464351225,4,227,0.12185816320777977,0.035270716102258515,128.83644662691853,COMPLETE
1537,0.43830499053001404,2023-09-04 22:38:18.265748,2023-09-04 22:38:18.921276,0 days 00:00:00.655528,Leaky,Leaky,Sigmoid,Sigmoid,88,17,20.0,20.0,2.0,0.022592478018066856,4,274,0.24588237622474476,0.0001075947462743563,379.9814443588257,COMPLETE
1538,0.33051684498786926,2023-09-04 22:38:18.922259,2023-09-04 22:38:23.411061,0 days 00:00:04.488802,Tanh,Leaky,Leaky,Leaky,82,18,22.0,22.0,19.0,0.0002157315487229687,4,253,0.7987139042128331,1.4331764052604546e-05,128.95377721541968,COMPLETE
1539,0.42417657375335693,2023-09-04 22:38:23.412060,2023-09-04 22:38:25.204670,0 days 00:00:01.792610,Sigmoid,Leaky,ReLU,Leaky,91,10,19.0,24.0,5.0,0.00947009753925348,4,397,0.7370041183828718,5.114276703787015e-05,206.69912567138672,COMPLETE
1540,0.27425241470336914,2023-09-04 22:38:25.205635,2023-09-04 22:38:29.028625,0 days 00:00:03.822990,Tanh,Leaky,Sigmoid,Sigmoid,31,19,18.0,14.0,9.0,0.012268584348226629,4,288,0.687696481637792,0.001103906505928744,137.6238003483525,COMPLETE
1541,0.7893702387809753,2023-09-04 22:38:29.029593,2023-09-04 22:38:29.753997,0 days 00:00:00.724404,ReLU,Leaky,Sigmoid,Leaky,86,19,21.0,16.0,18.0,6.666018369027385e-05,4,233,0.7998171142624975,0.002018160021682425,106.57891787015475,COMPLETE
1542,0.401458740234375,2023-09-04 22:38:29.754987,2023-09-04 22:38:31.057966,0 days 00:00:01.302979,Tanh,Leaky,Sigmoid,Sigmoid,83,21,20.0,23.0,6.0,0.01915500546679782,4,244,0.7477294047044983,0.00022985753634741841,141.48566190658076,COMPLETE
1543,0.40473473072052,2023-09-04 22:38:31.058947,2023-09-04 22:38:32.653504,0 days 00:00:01.594557,Leaky,Leaky,Tanh,Leaky,40,18,22.0,21.0,17.0,0.004802348024789915,4,220,0.3396148801845916,0.0161856857633418,133.18517147764868,COMPLETE
1544,0.5923583507537842,2023-09-04 22:38:32.654522,2023-09-04 22:38:33.199870,0 days 00:00:00.545348,Sigmoid,Leaky,Sigmoid,Leaky,89,20,21.0,15.0,20.0,0.01489672290117949,4,257,0.13771013241023264,0.00012668006333178676,130.40734361347398,COMPLETE
1545,0.5658639669418335,2023-09-04 22:38:33.200828,2023-09-04 22:38:33.758027,0 days 00:00:00.557199,Tanh,Leaky,ReLU,Sigmoid,95,17,20.0,11.0,1.0,0.026986560260357593,4,207,0.16627902243724824,7.977709233124606e-05,313.4140812800481,COMPLETE
1546,0.29730603098869324,2023-09-04 22:38:33.759005,2023-09-04 22:38:37.022051,0 days 00:00:03.263046,ReLU,Leaky,Sigmoid,Leaky,80,9,21.0,24.0,6.0,0.010915940599518986,4,297,0.770603448706962,0.0004364791777769179,127.65624071603798,COMPLETE
1547,0.7544139623641968,2023-09-04 22:38:37.023028,2023-09-04 22:38:56.573613,0 days 00:00:19.550585,Tanh,Leaky,Sigmoid,Sigmoid,29,18,19.0,22.0,3.0,1.3544721661490595e-05,4,262,0.7279731648793458,0.00015697214671220902,105.5561338526602,COMPLETE
1548,1.1069079637527466,2023-09-04 22:38:56.574622,2023-09-04 22:38:57.031705,0 days 00:00:00.457083,Leaky,Leaky,Sigmoid,ReLU,84,19,20.0,23.0,4.0,0.016637461266839442,4,238,0.1824570149825979,4.02152667033768e-05,104.54770698547364,COMPLETE
1549,0.44927799701690674,2023-09-04 22:38:57.032710,2023-09-04 22:38:58.131181,0 days 00:00:01.098471,Sigmoid,Leaky,ReLU,Leaky,87,21,21.0,10.0,5.0,0.00837056762633116,4,320,0.6402122543286308,9.914454430035351e-05,215.42722136398842,COMPLETE
1550,0.44391027092933655,2023-09-04 22:38:58.132174,2023-09-04 22:39:00.999874,0 days 00:00:02.867700,Tanh,Leaky,Sigmoid,,34,19,18.0,16.0,,0.00263539827025353,3,307,0.30507842814072716,0.00027242911759032466,141.69118286682678,COMPLETE
1551,0.3452549874782562,2023-09-04 22:39:01.000829,2023-09-04 22:39:02.821666,0 days 00:00:01.820837,Tanh,Leaky,Sigmoid,Sigmoid,78,18,23.0,12.0,19.0,0.042623887645763865,4,481,0.6941924589712679,1.0051355756647519e-05,155.38094802129837,COMPLETE
1552,0.35249751806259155,2023-09-04 22:39:02.822661,2023-09-04 22:39:04.189565,0 days 00:00:01.366904,ReLU,Leaky,Sigmoid,Leaky,36,21,19.0,13.0,7.0,0.020794159575418334,4,275,0.38070430931752386,0.0034521263494264876,748.655829036937,COMPLETE
1553,0.7211546897888184,2023-09-04 22:39:04.190535,2023-09-04 22:39:05.010261,0 days 00:00:00.819726,Tanh,Leaky,Sigmoid,Leaky,85,10,22.0,24.0,6.0,0.001965082332042369,4,247,0.1346704712055708,6.417236134022258e-05,430.3881111640435,COMPLETE
1554,0.37391066551208496,2023-09-04 22:39:05.011236,2023-09-04 22:39:06.127672,0 days 00:00:01.116436,Leaky,Leaky,ReLU,Sigmoid,82,15,20.0,15.0,5.0,0.013178340901834432,4,227,0.4801681850010671,1.1774084185486074e-05,109.60584532908904,COMPLETE
1555,0.3508053421974182,2023-09-04 22:39:06.128656,2023-09-04 22:39:10.149652,0 days 00:00:04.020996,Sigmoid,Tanh,Sigmoid,Leaky,32,11,20.0,23.0,18.0,0.005771939819676246,4,215,0.4832667927716593,2.0289568898904417e-05,589.2609695066889,COMPLETE
1556,0.3779609501361847,2023-09-04 22:39:10.150658,2023-09-04 22:39:13.076039,0 days 00:00:02.925381,Tanh,Leaky,Sigmoid,Sigmoid,56,20,21.0,17.0,16.0,0.001310358216345841,4,266,0.7541110558008788,0.0001941694577546429,146.70811074467028,COMPLETE
1557,1.0269908905029297,2023-09-04 22:39:13.077014,2023-09-04 22:39:18.931716,0 days 00:00:05.854702,ReLU,Sigmoid,Sigmoid,Leaky,49,17,20.0,22.0,17.0,2.0097292769273916e-05,4,235,0.35705321368455,0.00012591633859164556,102.49811271505153,COMPLETE
1558,0.35628658533096313,2023-09-04 22:39:18.932695,2023-09-04 22:39:19.466092,0 days 00:00:00.533397,Tanh,Leaky,ReLU,Sigmoid,90,18,18.0,14.0,21.0,0.024906355578562023,4,250,0.1057785734618652,7.74290071013316e-05,122.66390828883394,COMPLETE
1559,0.45105043053627014,2023-09-04 22:39:19.467096,2023-09-04 22:39:20.950270,0 days 00:00:01.483174,Sigmoid,Leaky,Sigmoid,Leaky,87,19,19.0,18.0,8.0,0.03309955760642505,4,281,0.3230191481129743,0.0003794051162526627,1080.136962890625,COMPLETE
1560,0.46912288665771484,2023-09-04 22:39:20.951250,2023-09-04 22:39:22.877782,0 days 00:00:01.926532,Leaky,ReLU,Sigmoid,ReLU,38,20,11.0,24.0,5.0,0.0032387077837205784,4,201,0.21831068766984274,0.000645923326051011,269.26868845621743,COMPLETE
1561,0.29631656408309937,2023-09-04 22:39:22.878753,2023-09-04 22:39:24.997016,0 days 00:00:02.118263,Tanh,Leaky,Sigmoid,Leaky,93,18,20.0,23.0,20.0,0.006934292133631595,4,224,0.7189059934952703,0.0001795609661062369,112.54460955423022,COMPLETE
1562,0.4481620788574219,2023-09-04 22:39:24.997976,2023-09-04 22:39:26.815058,0 days 00:00:01.817082,Tanh,Leaky,ReLU,Sigmoid,82,19,1.0,23.0,24.0,0.010136887283219018,4,291,0.7699615060854264,4.4196607729306666e-05,162.7350899300924,COMPLETE
1563,0.28396084904670715,2023-09-04 22:39:26.816060,2023-09-04 22:39:28.544747,0 days 00:00:01.728687,ReLU,Leaky,Leaky,Leaky,30,9,21.0,21.0,2.0,0.016695585377394486,4,241,0.5728012390489228,3.1678605296992295e-05,81.76905925457294,COMPLETE
1564,1.0499247312545776,2023-09-04 22:39:28.545705,2023-09-04 22:39:28.930978,0 days 00:00:00.385273,Sigmoid,Leaky,Sigmoid,Sigmoid,84,17,22.0,22.0,4.0,0.014214826041221535,4,255,0.1119206787637671,0.024235714054896773,102.84898336310135,COMPLETE
1565,0.5307123064994812,2023-09-04 22:39:28.931957,2023-09-04 22:39:30.761403,0 days 00:00:01.829446,Tanh,Leaky,Sigmoid,Leaky,86,18,19.0,16.0,19.0,0.00030224496943380354,4,231,0.16006237692672598,5.491276280159957e-05,111.88894736701674,COMPLETE
1566,0.464478075504303,2023-09-04 22:39:30.762381,2023-09-04 22:39:31.962185,0 days 00:00:01.199804,Leaky,Leaky,Sigmoid,Sigmoid,27,20,21.0,24.0,7.0,0.0043044754267414,4,245,0.1278904325852616,9.882219141565137e-05,491.2448305223809,COMPLETE
1567,0.25843551754951477,2023-09-04 22:39:31.963175,2023-09-04 22:39:33.452053,0 days 00:00:01.488878,Tanh,Leaky,Tanh,Leaky,80,19,20.0,15.0,6.0,0.01960855663512569,4,304,0.5412178285600698,0.00031105392623880315,118.86639575568996,COMPLETE
1568,0.7305670380592346,2023-09-04 22:39:33.453013,2023-09-04 22:39:36.863852,0 days 00:00:03.410839,Sigmoid,Leaky,Sigmoid,Leaky,89,16,23.0,23.0,17.0,0.0010001054646509686,4,263,0.6680378889551004,0.005947016871629446,180.93046842802556,COMPLETE
1569,0.4619339108467102,2023-09-04 22:39:36.864823,2023-09-04 22:39:37.639380,0 days 00:00:00.774557,ReLU,Leaky,ReLU,Sigmoid,24,18,19.0,24.0,18.0,0.07022025963500315,4,220,0.2758954257074349,1.5803656955174195e-05,139.49876131330217,COMPLETE
1570,0.32528531551361084,2023-09-04 22:39:37.640423,2023-09-04 22:39:39.473606,0 days 00:00:01.833183,Tanh,Leaky,,,83,21,20.0,,,0.012081296985221401,2,236,0.7431275362183336,0.00015107780915891826,686.3935005881569,COMPLETE
1571,1.1846293210983276,2023-09-04 22:39:39.474563,2023-09-04 22:39:45.844531,0 days 00:00:06.369968,Leaky,Leaky,Sigmoid,Leaky,33,22,22.0,16.0,5.0,3.1183181302221957e-05,4,315,0.19951686030338087,0.011963311349686893,434.2846411326575,COMPLETE
1572,0.42873188853263855,2023-09-04 22:39:45.845607,2023-09-04 22:39:46.936709,0 days 00:00:01.091102,Tanh,Leaky,Sigmoid,Sigmoid,85,20,17.0,23.0,6.0,0.008657417347905203,4,277,0.3523814152716037,0.00021808243705398193,146.1606715520223,COMPLETE
1573,0.316376268863678,2023-09-04 22:39:46.937691,2023-09-04 22:39:48.946883,0 days 00:00:02.009192,Sigmoid,Leaky,Sigmoid,ReLU,88,19,21.0,22.0,9.0,0.05821468682193109,4,211,0.7073575174415824,8.158117711480705e-05,189.12226131506134,COMPLETE
1574,0.384511262178421,2023-09-04 22:39:48.947894,2023-09-04 22:39:51.416402,0 days 00:00:02.468508,Tanh,Leaky,ReLU,Leaky,42,18,20.0,15.0,3.0,0.0017047411373251069,4,294,0.7737457953425878,6.684389420766299e-05,131.23610305786133,COMPLETE
1575,1.0568140745162964,2023-09-04 22:39:51.417381,2023-09-04 22:39:58.751639,0 days 00:00:07.334258,ReLU,Leaky,Sigmoid,Sigmoid,82,19,21.0,19.0,7.0,1.5411611453842727e-05,4,252,0.6246080748338263,2.7125221482742803e-05,359.4138412475586,COMPLETE
1576,0.7693317532539368,2023-09-04 22:39:58.752716,2023-09-04 22:40:06.320716,0 days 00:00:07.568000,Tanh,Leaky,Sigmoid,Leaky,31,17,19.0,24.0,16.0,7.781468029789396e-05,4,271,0.519820417315868,0.00132109968620786,199.60934620687405,COMPLETE
1577,0.3999358117580414,2023-09-04 22:40:06.321693,2023-09-04 22:40:07.695060,0 days 00:00:01.373367,Leaky,Leaky,Sigmoid,Leaky,29,20,20.0,23.0,13.0,0.005170952124950818,4,242,0.39108338790719516,0.00011575850787902685,145.0127286557798,COMPLETE
1578,0.7789365649223328,2023-09-04 22:40:07.696034,2023-09-04 22:40:09.212678,0 days 00:00:01.516644,Sigmoid,Leaky,Sigmoid,Sigmoid,78,18,14.0,14.0,5.0,0.022628480608271485,4,227,0.799724590962006,0.046873932617590465,104.1735596195344,COMPLETE
1579,0.38088175654411316,2023-09-04 22:40:09.213736,2023-09-04 22:40:10.039050,0 days 00:00:00.825314,Tanh,Tanh,ReLU,Leaky,84,10,22.0,21.0,19.0,0.01618585710919625,4,260,0.428657045632094,0.0002474422648448769,133.46451568603516,COMPLETE
1580,0.4143752455711365,2023-09-04 22:40:10.040058,2023-09-04 22:40:17.833839,0 days 00:00:07.793781,ReLU,Leaky,Sigmoid,Sigmoid,35,21,5.0,17.0,20.0,0.00017007556795552088,4,283,0.4050332872087235,0.002578883225393815,135.96172172909692,COMPLETE
1581,1.1886934041976929,2023-09-04 22:40:17.834820,2023-09-04 22:40:18.679681,0 days 00:00:00.844861,Tanh,Sigmoid,Sigmoid,Leaky,45,19,21.0,15.0,15.0,0.030123740046455415,4,232,0.7370896250541983,0.08968308427201778,102.41964582963423,COMPLETE
1582,0.33550360798835754,2023-09-04 22:40:18.680681,2023-09-04 22:40:20.105448,0 days 00:00:01.424767,Leaky,Leaky,Sigmoid,Leaky,80,11,18.0,23.0,4.0,0.01094366467224801,4,250,0.6807727791741853,0.00017589593387957694,218.3915260933541,COMPLETE
1583,0.4867928922176361,2023-09-04 22:40:20.106446,2023-09-04 22:40:21.340828,0 days 00:00:01.234382,Sigmoid,Leaky,ReLU,Sigmoid,86,17,20.0,22.0,1.0,0.013211030324092876,4,219,0.752300677733379,0.0005071142546632648,260.3956874978953,COMPLETE
1584,0.22355948388576508,2023-09-04 22:40:21.341819,2023-09-04 22:40:23.567060,0 days 00:00:02.225241,Tanh,ReLU,Sigmoid,Leaky,91,18,19.0,24.0,6.0,0.006922772812240227,4,240,0.7146332181961266,0.0001380949969737872,98.48518347740173,COMPLETE
1585,0.2906803786754608,2023-09-04 22:40:23.568037,2023-09-04 22:40:25.673296,0 days 00:00:02.105259,Tanh,ReLU,Sigmoid,Leaky,92,19,18.0,24.0,18.0,0.008336112204801061,4,227,0.6683035542768594,0.0001422536639217065,116.29355413263494,COMPLETE
1586,0.41939276456832886,2023-09-04 22:40:25.674298,2023-09-04 22:40:27.210251,0 days 00:00:01.535953,ReLU,ReLU,Sigmoid,Leaky,95,20,18.0,24.0,17.0,0.009861044736635457,4,199,0.7104963279355835,0.00013534149784347557,125.38423848706623,COMPLETE
1587,0.36937201023101807,2023-09-04 22:40:27.211225,2023-09-04 22:40:27.754358,0 days 00:00:00.543133,Tanh,ReLU,Leaky,Leaky,91,21,18.0,24.0,8.0,0.007505530119558846,4,300,0.18637237177878915,0.00017220412375784663,104.34959284464519,COMPLETE
1588,0.7726061940193176,2023-09-04 22:40:27.755343,2023-09-04 22:40:29.539926,0 days 00:00:01.784583,Sigmoid,Tanh,Sigmoid,Leaky,92,15,19.0,24.0,7.0,0.00018250031664218637,4,211,0.1386870675681495,0.00014770498734579507,102.10026322495881,COMPLETE
1589,0.8193364143371582,2023-09-04 22:40:29.540926,2023-09-04 22:40:36.159753,0 days 00:00:06.618827,Leaky,ReLU,ReLU,Leaky,93,22,19.0,24.0,6.0,2.3715985061971553e-05,4,234,0.6552741609902946,0.00011545351218173247,141.55250937306982,COMPLETE
1590,0.37295520305633545,2023-09-04 22:40:36.160764,2023-09-04 22:40:37.320034,0 days 00:00:01.159270,Tanh,ReLU,Sigmoid,Leaky,93,18,19.0,24.0,19.0,0.010056875291709256,4,221,0.5984275066548522,0.00021884047558550746,194.5925233629015,COMPLETE
1591,0.6044774055480957,2023-09-04 22:40:37.321001,2023-09-04 22:40:37.943571,0 days 00:00:00.622570,Tanh,ReLU,Sigmoid,Leaky,92,17,18.0,24.0,18.0,0.012503875858511558,4,239,0.14262454156144838,0.0001901351637552459,247.54265785217285,COMPLETE
1592,0.8036282062530518,2023-09-04 22:40:37.944552,2023-09-04 22:40:47.080662,0 days 00:00:09.136110,ReLU,Sigmoid,Sigmoid,Leaky,90,19,18.0,24.0,2.0,3.130154760138788e-05,4,309,0.6903071218028817,0.00016106858820903158,184.45735728933587,COMPLETE
1593,0.2647206485271454,2023-09-04 22:40:47.081643,2023-09-04 22:40:49.313749,0 days 00:00:02.232106,Sigmoid,ReLU,Tanh,Leaky,95,14,19.0,24.0,3.0,0.00848596382814563,4,291,0.7120892611863401,0.0001235262961984798,132.4062522774312,COMPLETE
1594,0.4488160014152527,2023-09-04 22:40:49.314746,2023-09-04 22:40:54.321176,0 days 00:00:05.006430,Leaky,ReLU,ReLU,Leaky,94,18,19.0,24.0,6.0,0.0004934827947421577,4,248,0.4647338208743037,0.00027731994595854223,139.84938906808185,COMPLETE
1595,0.9300469160079956,2023-09-04 22:40:54.322174,2023-09-04 22:40:58.067014,0 days 00:00:03.744840,Tanh,ReLU,Sigmoid,Leaky,93,16,19.0,24.0,5.0,5.299099233130495e-05,4,267,0.2900656357827557,1.3189442972889371e-05,166.61330713850728,COMPLETE
1596,0.1978132724761963,2023-09-04 22:40:58.068057,2023-09-04 22:41:01.149237,0 days 00:00:03.081180,Tanh,ReLU,Sigmoid,Leaky,91,10,17.0,16.0,4.0,0.014933206419209775,4,257,0.7711414213860448,0.00014844911076160205,110.75097690929066,COMPLETE
1597,0.3827832043170929,2023-09-04 22:41:01.150273,2023-09-04 22:41:03.763899,0 days 00:00:02.613626,Sigmoid,ReLU,Sigmoid,Leaky,90,10,18.0,17.0,4.0,0.01657564366196324,4,263,0.3360926876618231,0.00019983204637921174,183.73216741225298,COMPLETE
1598,0.34688684344291687,2023-09-04 22:41:03.764889,2023-09-04 22:41:04.882065,0 days 00:00:01.117176,ReLU,ReLU,ReLU,Leaky,89,9,18.0,16.0,4.0,0.018604419410856225,4,275,0.36198622424689764,0.00016979562306199144,101.03845131613991,COMPLETE
1599,0.31931039690971375,2023-09-04 22:41:04.883062,2023-09-04 22:41:07.756921,0 days 00:00:02.873859,Tanh,ReLU,Sigmoid,Leaky,88,10,22.0,16.0,3.0,0.014984221385890414,4,259,0.7715034487587127,0.0040570300839157586,100.11926015218098,COMPLETE
1600,0.3663230836391449,2023-09-04 22:41:07.757907,2023-09-04 22:41:08.974125,0 days 00:00:01.216218,Leaky,ReLU,Sigmoid,Leaky,91,10,18.0,17.0,3.0,0.020681831068972974,4,272,0.7728515217989078,0.0003687544222534088,136.70511969204605,COMPLETE
1601,0.29585808515548706,2023-09-04 22:41:08.975131,2023-09-04 22:41:10.656519,0 days 00:00:01.681388,Tanh,ReLU,Sigmoid,,89,10,18.0,16.0,,0.014334080755375457,3,266,0.7762853062652676,0.0002283231295022822,158.691681656183,COMPLETE
1602,0.6087707877159119,2023-09-04 22:41:10.657550,2023-09-04 22:41:11.380614,0 days 00:00:00.723064,Sigmoid,ReLU,Sigmoid,Leaky,95,9,17.0,16.0,4.0,0.018109404040343297,4,275,0.21619658477864223,0.0002909549249875182,179.90062145476645,COMPLETE
1603,0.2989446818828583,2023-09-04 22:41:11.381635,2023-09-04 22:41:12.875491,0 days 00:00:01.493856,Tanh,ReLU,ReLU,Leaky,96,11,18.0,17.0,4.0,0.023493688669903742,4,283,0.7996914884654102,0.00019365345429749365,132.2826552519927,COMPLETE
1604,0.3353855609893799,2023-09-04 22:41:12.876528,2023-09-04 22:41:15.095042,0 days 00:00:02.218514,ReLU,Leaky,Sigmoid,Leaky,92,10,17.0,16.0,3.0,0.013683863109596581,4,277,0.7485189202932099,2.2894321281638624e-05,173.66236298659751,COMPLETE
