number,value,datetime_start,datetime_complete,duration,params_activation1,params_activation2,params_activation3,params_activation4,params_batch_size,params_fl1,params_fl2,params_fl3,params_fl4,params_learning_rate,params_n_layers,params_num_epochs,params_train_size,params_weight_decay,user_attrs_mre,state
1624,0.39100268483161926,2023-09-04 21:49:40.830802,2023-09-04 21:49:41.544038,0 days 00:00:00.713236,Leaky,ReLU,,,40,24,20.0,,,0.009447362902070109,2,202,0.7706553985894663,0.00043864175277174867,121.16397759853265,COMPLETE
1625,0.36895084381103516,2023-09-04 21:49:41.544493,2023-09-04 21:49:42.468493,0 days 00:00:00.924000,Leaky,ReLU,,,37,21,20.0,,,0.004260225572677726,2,200,0.7176526065146368,0.000363937804459252,124.79805251299325,COMPLETE
1626,0.38335949182510376,2023-09-04 21:49:42.468956,2023-09-04 21:49:42.943287,0 days 00:00:00.474331,Leaky,ReLU,,,42,22,21.0,,,0.005523576094421724,2,191,0.29256903971935067,0.0005233716593319896,133.1485432866794,COMPLETE
1627,0.5831285119056702,2023-09-04 21:49:42.943751,2023-09-04 21:49:46.408545,0 days 00:00:03.464794,Leaky,ReLU,,,39,23,23.0,,,2.579612216374252e-05,2,244,0.7489481445849381,0.00047654955570737296,134.97518342440245,COMPLETE
1628,0.6131038069725037,2023-09-04 21:49:46.408997,2023-09-04 21:49:47.699358,0 days 00:00:01.290361,Leaky,ReLU,,,36,24,22.0,,,4.128449944525645e-05,2,430,0.11870068857916706,0.0003331100187499183,220.19425155284793,COMPLETE
1629,0.5084444284439087,2023-09-04 21:49:47.699826,2023-09-04 21:49:47.923424,0 days 00:00:00.223598,Leaky,ReLU,,,44,22,21.0,,,0.08263617274122328,2,376,0.19953603776031614,0.0003934362746542303,153.21046493992662,COMPLETE
1630,0.6111937165260315,2023-09-04 21:49:47.923883,2023-09-04 21:49:48.282639,0 days 00:00:00.358756,Leaky,ReLU,,,41,20,10.0,,,0.0002215949444428706,2,119,0.10319039347584362,0.00028292227356303167,147.05517885865282,COMPLETE
1631,0.36512190103530884,2023-09-04 21:49:48.283089,2023-09-04 21:49:49.110183,0 days 00:00:00.827094,Leaky,ReLU,,,38,21,16.0,,,0.0070856076985130875,2,223,0.7734848736685161,0.005494759376005536,187.8523324584961,COMPLETE
1632,0.34368816018104553,2023-09-04 21:49:49.110649,2023-09-04 21:49:50.262824,0 days 00:00:01.152175,Leaky,ReLU,,,37,23,22.0,,,0.00855917215373271,2,182,0.7106740792610801,0.0006404665860276397,167.76403220040459,COMPLETE
1633,0.3391602337360382,2023-09-04 21:49:50.263280,2023-09-04 21:49:55.446075,0 days 00:00:05.182795,Leaky,ReLU,,,40,22,14.0,,,0.0003622778965005578,2,418,0.7467012122576355,0.0042025551477806785,136.90326230069425,COMPLETE
1634,0.7167854309082031,2023-09-04 21:49:55.446527,2023-09-04 21:49:56.385017,0 days 00:00:00.938490,ReLU,ReLU,,,35,24,24.0,,,4.360552459007575e-05,2,206,0.19173305527917392,0.000367147225468367,116.94832092581443,COMPLETE
1635,0.3878526985645294,2023-09-04 21:49:56.385490,2023-09-04 21:49:57.658037,0 days 00:00:01.272547,Sigmoid,ReLU,,,42,20,20.0,,,0.011041859888230534,2,240,0.7738103533923949,0.0008051055232307466,126.3269410680552,COMPLETE
1636,0.3640691041946411,2023-09-04 21:49:57.658575,2023-09-04 21:49:59.059679,0 days 00:00:01.401104,Leaky,ReLU,,,39,23,15.0,,,0.001517641557454803,2,256,0.4791966736354309,0.0002881350328278335,195.37286855133488,COMPLETE
1637,0.32034435868263245,2023-09-04 21:49:59.060219,2023-09-04 21:50:00.586084,0 days 00:00:01.525865,Leaky,ReLU,,,36,21,23.0,,,0.0022751459121727997,2,236,0.7037838826859512,0.003015999393658664,134.8293544769287,COMPLETE
1638,0.5178896188735962,2023-09-04 21:50:00.586566,2023-09-04 21:50:00.948047,0 days 00:00:00.361481,Leaky,ReLU,,,45,22,21.0,,,0.00363570478108257,2,194,0.15975301407413658,0.00045065511627966526,299.13506117321197,COMPLETE
1639,0.3710186779499054,2023-09-04 21:50:00.948518,2023-09-04 21:50:01.706275,0 days 00:00:00.757757,Leaky,ReLU,,,41,24,22.0,,,0.005014948771969303,2,494,0.41817780973922,0.0017943208217260872,168.03530469352816,COMPLETE
1640,0.3091346025466919,2023-09-04 21:50:01.706741,2023-09-04 21:50:02.632726,0 days 00:00:00.925985,Leaky,ReLU,,,38,23,22.0,,,0.00626061854445533,2,482,0.7975751334856341,0.0004940401952594,118.3911436431262,COMPLETE
1641,0.3910733759403229,2023-09-04 21:50:02.633204,2023-09-04 21:50:03.205015,0 days 00:00:00.571811,Leaky,ReLU,,,34,22,20.0,,,0.01009625428257444,2,211,0.2873607022948586,0.011203944312052076,292.2443152533637,COMPLETE
1642,0.36428478360176086,2023-09-04 21:50:03.205470,2023-09-04 21:50:09.600784,0 days 00:00:06.395314,Leaky,ReLU,,,37,21,21.0,,,0.0006190086460232228,2,346,0.7381114773315769,1.440260323682522e-05,205.37951262970543,COMPLETE
1643,0.300893634557724,2023-09-04 21:50:09.601710,2023-09-04 21:50:10.597163,0 days 00:00:00.995453,Leaky,ReLU,,,44,24,21.0,,,0.022326276183246303,2,176,0.7982704843562941,4.988036322028885e-05,153.90812999797316,COMPLETE
1644,0.5594494342803955,2023-09-04 21:50:10.597642,2023-09-04 21:50:12.843927,0 days 00:00:02.246285,Leaky,ReLU,,,42,23,23.0,,,5.1957699462153044e-05,2,223,0.3704559432666877,0.0006087787733398974,150.73979542822048,COMPLETE
1645,0.38038554787635803,2023-09-04 21:50:12.844382,2023-09-04 21:50:14.103291,0 days 00:00:01.258909,Leaky,ReLU,,,39,20,22.0,,,0.0011418582954603482,2,200,0.4314554174674808,5.948790211022054e-05,249.4204070147346,COMPLETE
1646,0.5381284952163696,2023-09-04 21:50:14.103782,2023-09-04 21:50:24.938354,0 days 00:00:10.834572,ReLU,ReLU,,,30,21,20.0,,,1.4220031395482422e-05,2,444,0.7259190243094499,0.0024056418039210955,253.61596569714246,COMPLETE
1647,0.3837519884109497,2023-09-04 21:50:24.939272,2023-09-04 21:50:25.857195,0 days 00:00:00.917923,Leaky,ReLU,,,34,22,15.0,,,0.007833950007657128,2,131,0.5368010849892223,0.00038585325431577874,142.63128465924945,COMPLETE
1648,0.38193416595458984,2023-09-04 21:50:25.857662,2023-09-04 21:50:26.144329,0 days 00:00:00.286667,Leaky,ReLU,,,43,23,24.0,,,0.011768305491892242,2,425,0.24023106298858243,2.542766234190415e-05,196.81850112111945,COMPLETE
1649,0.4096357822418213,2023-09-04 21:50:26.144809,2023-09-04 21:50:26.562193,0 days 00:00:00.417384,Tanh,ReLU,,,40,24,16.0,,,0.008562659112009511,2,459,0.457333158027919,0.000270151996200193,1578.5065950960727,COMPLETE
1650,0.45278099179267883,2023-09-04 21:50:26.562655,2023-09-04 21:50:26.850349,0 days 00:00:00.287694,Leaky,ReLU,,,50,21,21.0,,,0.015439719451591515,2,139,0.17739609362615133,1.192145530323643e-05,130.03425866204338,COMPLETE
1651,0.34962064027786255,2023-09-04 21:50:26.850831,2023-09-04 21:50:27.469436,0 days 00:00:00.618605,Leaky,Leaky,,,36,22,23.0,,,0.041689686283071715,2,411,0.5676808114744687,2.2594885476312025e-05,248.57349097210428,COMPLETE
1652,0.4253945052623749,2023-09-04 21:50:27.469894,2023-09-04 21:50:27.882117,0 days 00:00:00.412223,Leaky,ReLU,,,46,23,20.0,,,0.03080925235179948,2,121,0.32192352184740675,0.00033815993562091086,315.78609759990985,COMPLETE
1653,0.38834694027900696,2023-09-04 21:50:27.883008,2023-09-04 21:50:28.780565,0 days 00:00:00.897557,Leaky,ReLU,,,32,24,21.0,,,0.004534879212695072,2,250,0.3445377957251503,1.5515995874307332e-05,124.57984577525745,COMPLETE
1654,0.332498699426651,2023-09-04 21:50:28.781034,2023-09-04 21:50:29.429598,0 days 00:00:00.648564,Leaky,ReLU,,,41,23,22.0,,,0.012942152931489018,2,179,0.7652322383932245,0.0005523166726309331,122.89480037689209,COMPLETE
1655,0.4298875033855438,2023-09-04 21:50:29.430072,2023-09-04 21:50:34.347202,0 days 00:00:04.917130,Leaky,ReLU,,,28,20,22.0,,,0.00011992985824639414,2,401,0.4912784343551306,0.0007284636181540675,162.55930086739937,COMPLETE
1656,0.3696114718914032,2023-09-04 21:50:34.347670,2023-09-04 21:50:34.680242,0 days 00:00:00.332572,Leaky,ReLU,,,38,19,23.0,,,0.0068667657859208635,2,225,0.27840517512759055,0.00042216291972242253,140.42381867908296,COMPLETE
1657,0.3662373721599579,2023-09-04 21:50:34.680722,2023-09-04 21:50:35.941473,0 days 00:00:01.260751,Sigmoid,ReLU,,,35,22,16.0,,,0.010307257314783743,2,211,0.6946503224453229,3.0946368462002505e-05,135.5568300078187,COMPLETE
1658,0.4438607692718506,2023-09-04 21:50:35.941942,2023-09-04 21:50:36.293882,0 days 00:00:00.351940,Tanh,Leaky,,,37,7,22.0,,,0.017390272284666754,2,262,0.20483113320685442,1.984598803566008e-05,135.6777278163977,COMPLETE
1659,0.4562671482563019,2023-09-04 21:50:36.294361,2023-09-04 21:50:36.667959,0 days 00:00:00.373598,Leaky,ReLU,,,33,21,20.0,,,0.005850777885472498,2,233,0.1548219116050779,3.93131524652894e-05,482.6395421808416,COMPLETE
1660,0.3403785526752472,2023-09-04 21:50:36.668445,2023-09-04 21:50:37.289916,0 days 00:00:00.621471,ReLU,ReLU,,,43,24,23.0,,,0.020623498668881232,2,186,0.7998811533745392,0.0002584812668674745,323.73777730841385,COMPLETE
1661,0.3910119831562042,2023-09-04 21:50:37.290400,2023-09-04 21:50:37.674244,0 days 00:00:00.383844,Leaky,ReLU,,,39,22,21.0,,,0.05115902622965129,2,430,0.505281803556764,0.0009998640319538621,126.60577734585466,COMPLETE
1662,0.33081817626953125,2023-09-04 21:50:37.674723,2023-09-04 21:50:38.457354,0 days 00:00:00.782631,Leaky,ReLU,,,41,23,21.0,,,0.013748415398950425,2,145,0.7439909212873294,1.3082882052673171e-05,124.20024273442287,COMPLETE
1663,0.2964940071105957,2023-09-04 21:50:38.457833,2023-09-04 21:50:39.895705,0 days 00:00:01.437872,Leaky,ReLU,,,29,21,14.0,,,0.008796961361556296,2,440,0.7151173326182872,0.00032955164672726774,140.43086757659913,COMPLETE
1664,0.5602332353591919,2023-09-04 21:50:39.896181,2023-09-04 21:50:43.351855,0 days 00:00:03.455674,Leaky,ReLU,,,36,22,20.0,,,0.00026829927104150727,2,369,0.4790361020524851,0.032668207308781005,148.9373062727694,COMPLETE
1665,0.31457802653312683,2023-09-04 21:50:43.352322,2023-09-04 21:50:44.560577,0 days 00:00:01.208255,Leaky,Leaky,,,40,23,21.0,,,0.0032357805131585215,2,471,0.7679936959066624,1.7376423742303115e-05,139.08047885894774,COMPLETE
1666,0.5450183749198914,2023-09-04 21:50:44.561067,2023-09-04 21:50:46.145716,0 days 00:00:01.584649,Leaky,ReLU,,,26,24,16.0,,,0.00017633877058324967,2,500,0.1069328981170603,0.00021900962930336565,158.19649099731444,COMPLETE
1667,0.3583250045776367,2023-09-04 21:50:46.146199,2023-09-04 21:50:49.295511,0 days 00:00:03.149312,Tanh,ReLU,,,22,21,24.0,,,0.000900958018234491,2,218,0.6756466617063052,0.000530164866570668,265.63241045551916,COMPLETE
1668,0.43420886993408203,2023-09-04 21:50:49.295982,2023-09-04 21:50:50.336540,0 days 00:00:01.040558,Leaky,,,,32,20,,,,0.011702283545441575,1,171,0.7460202435334752,7.312395181280407e-05,138.1746465410505,COMPLETE
1669,0.5720295906066895,2023-09-04 21:50:50.337010,2023-09-04 21:50:50.697506,0 days 00:00:00.360496,Leaky,ReLU,,,34,10,20.0,,,0.002345529845848374,2,382,0.10423181780109304,1.2757579695145065e-05,371.43640914330115,COMPLETE
1670,0.3866156339645386,2023-09-04 21:50:50.697977,2023-09-04 21:50:51.434624,0 days 00:00:00.736647,Leaky,ReLU,,,44,23,23.0,,,0.001691252152686376,2,160,0.21589921828049613,1.0023173996546565e-05,137.21679558753968,COMPLETE
1671,0.33442315459251404,2023-09-04 21:50:51.435088,2023-09-04 21:50:51.964863,0 days 00:00:00.529775,Leaky,ReLU,,,38,22,22.0,,,0.02602960712176039,2,128,0.7713376815322409,0.0014085802888956825,145.30987969760238,COMPLETE
1672,0.4591464698314667,2023-09-04 21:50:51.965317,2023-09-04 21:50:52.406697,0 days 00:00:00.441380,Leaky,Leaky,,,47,24,22.0,,,0.007760887599169756,2,454,0.22792155323112365,0.0020164268012121296,2983.545038200827,COMPLETE
1673,0.5594653487205505,2023-09-04 21:50:52.407159,2023-09-04 21:50:53.880467,0 days 00:00:01.473308,Leaky,ReLU,,,30,22,15.0,,,8.302744944246782e-05,2,196,0.2998852175396456,0.000291017340797816,146.270109682667,COMPLETE
1674,0.32052963972091675,2023-09-04 21:50:53.880956,2023-09-04 21:50:54.541234,0 days 00:00:00.660278,ReLU,ReLU,,,36,15,21.0,,,0.016045193915938855,2,323,0.43358518946008895,0.0006640859243271588,116.3455468416214,COMPLETE
1675,0.7706890106201172,2023-09-04 21:50:54.541691,2023-09-04 21:50:55.103852,0 days 00:00:00.562161,Leaky,ReLU,,,42,20,20.0,,,6.417370868679307e-05,2,205,0.11546250147198688,0.000399066753139327,105.1350819285323,COMPLETE
1676,0.3325236439704895,2023-09-04 21:50:55.104314,2023-09-04 21:50:56.178920,0 days 00:00:01.074606,Tanh,ReLU,,,40,23,22.0,,,0.0038657757071403373,2,233,0.7141868621026204,2.5143632458327504e-05,268.97464763254357,COMPLETE
1677,0.31341540813446045,2023-09-04 21:50:56.179382,2023-09-04 21:50:57.341508,0 days 00:00:01.162126,Leaky,ReLU,,,45,21,17.0,,,0.004987854550111204,2,251,0.7424804465308389,0.0009204300623433456,123.07604377214298,COMPLETE
1678,0.38173332810401917,2023-09-04 21:50:57.341986,2023-09-04 21:50:57.744088,0 days 00:00:00.402102,Leaky,ReLU,,,67,24,23.0,,,0.07150690996387114,2,154,0.6850366922126142,1.5448806955821116e-05,197.35678378018466,COMPLETE
1679,0.610325038433075,2023-09-04 21:50:57.744550,2023-09-04 21:50:59.721949,0 days 00:00:01.977399,Leaky,Leaky,,,38,3,20.0,,,0.00016616409644189118,2,401,0.2372032801786903,3.279452796976288e-05,167.30686960196556,COMPLETE
1680,0.46535947918891907,2023-09-04 21:50:59.722439,2023-09-04 21:50:59.946773,0 days 00:00:00.224334,Leaky,ReLU,,,33,23,21.0,,,0.010175703432897816,2,137,0.13372159349631543,4.941065706681133e-05,150.44133477461966,COMPLETE
1681,0.7051974534988403,2023-09-04 21:50:59.947241,2023-09-04 21:51:00.146221,0 days 00:00:00.198980,Sigmoid,ReLU,,,43,22,17.0,,,0.019338111901754645,2,115,0.26320583328567165,0.038527876303880666,130.2703813251696,COMPLETE
1682,0.34993594884872437,2023-09-04 21:51:00.146675,2023-09-04 21:51:00.727016,0 days 00:00:00.580341,Leaky,ReLU,,,37,21,22.0,,,0.006651612036410162,2,420,0.7699656551407053,1.9957876659561864e-05,174.25840091705322,COMPLETE
1683,0.3930172920227051,2023-09-04 21:51:00.727481,2023-09-04 21:51:01.188139,0 days 00:00:00.460658,Leaky,ReLU,,,35,24,16.0,,,0.014429937376140603,2,356,0.2441915736902556,0.00046634673358142556,146.0186710357666,COMPLETE
1684,0.41759470105171204,2023-09-04 21:51:01.188607,2023-09-04 21:51:02.765625,0 days 00:00:01.577018,Leaky,ReLU,Leaky,,40,23,21.0,4.0,,0.0019585621749437492,3,262,0.7988832362068921,0.0003324652909706408,113.45528860653148,COMPLETE
1685,0.6401920914649963,2023-09-04 21:51:02.766105,2023-09-04 21:51:05.379214,0 days 00:00:02.613109,Leaky,ReLU,,,49,21,23.0,,,2.9370391237369743e-05,2,218,0.721107423130789,0.0002124453298162468,132.17953274228157,COMPLETE
1686,0.3930899500846863,2023-09-04 21:51:05.379688,2023-09-04 21:51:08.471858,0 days 00:00:03.092170,Tanh,Leaky,,,32,20,11.0,,,0.0013417997377853732,2,449,0.7436321644864582,0.001582874789410463,175.724499612882,COMPLETE
1687,0.4372917711734772,2023-09-04 21:51:08.472322,2023-09-04 21:51:08.951620,0 days 00:00:00.479298,ReLU,ReLU,,,39,24,15.0,,,0.011934699272852973,2,169,0.47235377479875584,0.017558737179092905,149.34896559942337,COMPLETE
1688,0.34691348671913147,2023-09-04 21:51:08.952085,2023-09-04 21:51:09.653232,0 days 00:00:00.701147,Leaky,ReLU,,,36,19,14.0,,,0.03651088778791558,2,143,0.6966267572596161,0.0002553189610740088,204.12883888802878,COMPLETE
1689,0.6201249957084656,2023-09-04 21:51:09.653775,2023-09-04 21:51:10.076597,0 days 00:00:00.422822,Leaky,ReLU,,,28,22,20.0,,,0.08777582794214654,2,183,0.799727377564507,0.000745606598772207,178.15603828430176,COMPLETE
1690,0.4138239324092865,2023-09-04 21:51:10.077068,2023-09-04 21:51:10.461958,0 days 00:00:00.384890,Leaky,ReLU,,,31,23,22.0,,,0.00945276653056973,2,413,0.17013124496508725,0.006603803061756712,321.365332883947,COMPLETE
1691,0.3522910475730896,2023-09-04 21:51:10.462424,2023-09-04 21:51:12.559944,0 days 00:00:02.097520,Leaky,ReLU,,,42,18,22.0,,,0.005679968667572509,2,225,0.7997459067575273,0.0034203073132528915,149.0043096339449,COMPLETE
1692,0.33764374256134033,2023-09-04 21:51:12.560452,2023-09-04 21:51:14.749640,0 days 00:00:02.189188,Leaky,Sigmoid,,,34,22,21.0,,,0.002584993319525996,2,191,0.7522769494983811,5.5691400399943974e-05,139.19377868406235,COMPLETE
1693,0.3883165717124939,2023-09-04 21:51:14.750219,2023-09-04 21:51:15.159639,0 days 00:00:00.409420,Leaky,ReLU,,,41,21,24.0,,,0.007524855646146948,2,209,0.3516674887561941,1.1852785715753767e-05,161.59670630166696,COMPLETE
1694,0.32188791036605835,2023-09-04 21:51:15.160169,2023-09-04 21:51:15.808748,0 days 00:00:00.648579,Tanh,ReLU,,,38,23,20.0,,,0.016173832895461128,2,243,0.7271127631448888,0.0005608731755814334,207.91020523874383,COMPLETE
1695,0.30387023091316223,2023-09-04 21:51:15.809303,2023-09-04 21:51:16.692657,0 days 00:00:00.883354,Leaky,Leaky,,,43,24,19.0,,,0.022971136248971284,2,433,0.77112879036111,3.927942795143454e-05,232.06830399124712,COMPLETE
1696,0.9983103275299072,2023-09-04 21:51:16.693146,2023-09-04 21:51:16.855069,0 days 00:00:00.161923,Leaky,Sigmoid,,,26,22,23.0,,,0.010593817538903857,2,386,0.129995496663023,0.0838137781892827,107.89865239461263,COMPLETE
1697,0.3651702105998993,2023-09-04 21:51:16.855569,2023-09-04 21:51:20.522024,0 days 00:00:03.666455,Leaky,ReLU,,,24,21,22.0,,,0.0029426226764167024,2,342,0.6725063545452942,1.0011595382343582e-05,307.3954126694623,COMPLETE
1698,0.3916000425815582,2023-09-04 21:51:20.523015,2023-09-04 21:51:21.981808,0 days 00:00:01.458793,Leaky,Sigmoid,,,45,20,21.0,,,0.008821921936938697,2,129,0.5411068508643948,0.00037929383418367055,167.00846273248845,COMPLETE
1699,0.47190630435943604,2023-09-04 21:51:21.982762,2023-09-04 21:51:29.292060,0 days 00:00:07.309298,Leaky,ReLU,,,35,23,17.0,,,0.00010655392544835847,2,162,0.7063137066792153,2.4153265441300376e-05,138.44899302353093,COMPLETE
1700,0.3320419192314148,2023-09-04 21:51:29.293035,2023-09-04 21:51:31.237318,0 days 00:00:01.944283,ReLU,ReLU,,,40,24,19.0,,,0.013090307793221906,2,230,0.7478395178144263,0.003772015054529167,307.42740267799013,COMPLETE
1701,0.3517477512359619,2023-09-04 21:51:31.238277,2023-09-04 21:51:34.500573,0 days 00:00:03.262296,Leaky,Sigmoid,,,31,17,13.0,,,0.006855967583457864,2,202,0.396694945042471,1.6111263718820292e-05,107.49409079762687,COMPLETE
1702,0.346922904253006,2023-09-04 21:51:34.501529,2023-09-04 21:51:36.229389,0 days 00:00:01.727860,Leaky,ReLU,,,38,22,16.0,,,0.004686494221863861,2,148,0.4452814368255693,0.00030946986400356134,201.44532644337622,COMPLETE
1703,0.3301089406013489,2023-09-04 21:51:36.230373,2023-09-04 21:51:38.135825,0 days 00:00:01.905452,Leaky,Sigmoid,,,48,23,21.0,,,0.017507071969831978,2,271,0.6536075060674899,2.8712952572586977e-05,199.6725472504238,COMPLETE
1704,1.053910493850708,2023-09-04 21:51:38.136793,2023-09-04 21:51:39.140414,0 days 00:00:01.003621,Tanh,ReLU,Sigmoid,,36,21,20.0,1.0,,0.026572794341662986,3,178,0.7599922358585481,0.04658986093126105,101.48224367414203,COMPLETE
1705,0.32753786444664,2023-09-04 21:51:39.141393,2023-09-04 21:51:41.972390,0 days 00:00:02.830997,Leaky,Leaky,,,41,22,23.0,,,0.011954900040599943,2,216,0.714690356695229,1.337868497595895e-05,12483.838831284467,COMPLETE
1706,0.6165351271629333,2023-09-04 21:51:41.973358,2023-09-04 21:51:43.645711,0 days 00:00:01.672353,Sigmoid,ReLU,,,44,20,18.0,,,0.02121003156448167,2,442,0.7697036100952597,0.009871190243982867,181.72745860706675,COMPLETE
1707,0.3802279531955719,2023-09-04 21:51:43.646723,2023-09-04 21:51:53.227333,0 days 00:00:09.580610,Leaky,Sigmoid,,,33,24,15.0,,,0.0010958671910603077,2,476,0.6857069625562874,0.000430853925984586,223.48326855700162,COMPLETE
1708,0.41513100266456604,2023-09-04 21:51:53.228309,2023-09-04 21:51:56.864627,0 days 00:00:03.636318,Leaky,ReLU,,,37,23,22.0,,,0.0006051085277863045,2,155,0.37008573662170274,0.002532419897896187,162.4240193520823,COMPLETE
1709,0.4361388087272644,2023-09-04 21:51:56.865596,2023-09-04 21:51:57.528570,0 days 00:00:00.662974,Leaky,ReLU,,,64,22,20.0,,,0.0055822610396780645,2,115,0.14606429809363886,0.00024420022526682226,154.7283763885498,COMPLETE
1710,0.3158419132232666,2023-09-04 21:51:57.529536,2023-09-04 21:52:01.231853,0 days 00:00:03.702317,Leaky,Sigmoid,,,34,24,23.0,,,0.008709802175608456,2,463,0.7280567754667209,1.9739801750505936e-05,193.67614987021997,COMPLETE
1711,0.5988597869873047,2023-09-04 21:52:01.232818,2023-09-04 21:52:08.720625,0 days 00:00:07.487807,Leaky,ReLU,,,40,23,21.0,,,1.1688073430454556e-05,2,487,0.5970412187435309,0.0006288438480560574,143.19914416366043,COMPLETE
1712,0.5851239562034607,2023-09-04 21:52:08.721100,2023-09-04 21:52:10.618727,0 days 00:00:01.897627,Leaky,Sigmoid,,,46,21,22.0,,,9.086774971225087e-05,2,330,0.3158141031272278,0.0008425786187561402,138.88295394435073,COMPLETE
1713,0.4110388457775116,2023-09-04 21:52:10.619201,2023-09-04 21:52:11.463593,0 days 00:00:00.844392,Tanh,ReLU,,,42,19,18.0,,,0.010457690546708977,2,297,0.7651532223597641,0.008434850662165809,177.8978690407493,COMPLETE
1714,0.4227404296398163,2023-09-04 21:52:11.464071,2023-09-04 21:52:11.745855,0 days 00:00:00.281784,ReLU,ReLU,,,30,21,16.0,,,0.014869904795811016,2,372,0.18227520345459888,6.603245915843276e-05,192.22750412790398,COMPLETE
1715,0.33290159702301025,2023-09-04 21:52:11.746355,2023-09-04 21:52:14.273404,0 days 00:00:02.527049,Leaky,Sigmoid,,,38,24,9.0,,,0.003677833613632903,2,197,0.7992707794939994,0.0005000578694677618,255.45243136682242,COMPLETE
1716,0.4788251519203186,2023-09-04 21:52:14.273979,2023-09-04 21:52:15.148026,0 days 00:00:00.874047,Leaky,Leaky,,,36,22,24.0,,,0.0004884334056505183,2,123,0.28340564145205444,4.513435449330562e-05,149.95125455778788,COMPLETE
1717,0.35096198320388794,2023-09-04 21:52:15.148503,2023-09-04 21:52:15.813221,0 days 00:00:00.664718,Leaky,ReLU,,,34,23,19.0,,,0.032558923596426974,2,394,0.7322969794269467,0.00035813829352520325,185.30838274274552,COMPLETE
1718,0.30367711186408997,2023-09-04 21:52:15.813743,2023-09-04 21:52:17.074037,0 days 00:00:01.260294,Leaky,Sigmoid,,,52,20,20.0,,,0.007373967521977203,2,141,0.5542716059849199,8.668618351087483e-05,126.24862428413805,COMPLETE
1719,0.34774404764175415,2023-09-04 21:52:17.074540,2023-09-04 21:52:17.541486,0 days 00:00:00.466946,Leaky,ReLU,,,29,21,22.0,,,0.018696745315227938,2,251,0.6942799752455169,0.0002838190189084732,584.9289042154948,COMPLETE
