number,value,datetime_start,datetime_complete,duration,params_activation1,params_activation2,params_activation3,params_activation4,params_batch_size,params_fl1,params_fl2,params_fl3,params_fl4,params_learning_rate,params_n_layers,params_num_epochs,params_train_size,params_weight_decay,user_attrs_mre,state
679,0.39182522892951965,2023-09-04 21:23:30.104528,2023-09-04 21:23:35.693401,0 days 00:00:05.588873,Leaky,ReLU,,,17,16,5.0,,,0.00026579869136158927,2,281,0.4893806761899093,4.7060456782367295e-05,281.4112873552533,COMPLETE
680,0.3440301716327667,2023-09-04 21:23:35.693752,2023-09-04 21:23:36.111768,0 days 00:00:00.418016,Leaky,Leaky,,,33,18,15.0,,,0.027739753458508397,2,294,0.6663958135873909,7.351157732855194e-05,126.14115905761719,COMPLETE
681,0.33351024985313416,2023-09-04 21:23:36.112131,2023-09-04 21:23:36.971067,0 days 00:00:00.858936,Leaky,Tanh,,,37,21,11.0,,,0.021945297313340745,2,299,0.7491141107659599,0.00304852254112614,188.88805089678084,COMPLETE
682,0.2894045114517212,2023-09-04 21:23:36.971413,2023-09-04 21:23:37.622573,0 days 00:00:00.651160,Leaky,Tanh,,,28,15,23.0,,,0.012823266995654567,2,184,0.6970758354711485,2.5264476573934237e-05,144.98675107955933,COMPLETE
683,0.35279279947280884,2023-09-04 21:23:37.623196,2023-09-04 21:23:38.621441,0 days 00:00:00.998245,Leaky,Tanh,,,38,20,19.0,,,0.03159900479934272,2,221,0.7719512776733806,4.1778465557914565e-05,169.4737627947772,COMPLETE
684,0.4122909903526306,2023-09-04 21:23:38.621796,2023-09-04 21:23:39.091923,0 days 00:00:00.470127,Leaky,Leaky,,,22,12,12.0,,,0.024246802081933406,2,279,0.1667847104968839,0.0002931421490739055,119.22537558419364,COMPLETE
685,0.3528894782066345,2023-09-04 21:23:39.092539,2023-09-04 21:23:40.341206,0 days 00:00:01.248667,Tanh,Tanh,,,24,19,16.0,,,0.01768987745145994,2,493,0.7994040565807105,5.9543902972604514e-05,155.27127159966363,COMPLETE
686,0.4401648938655853,2023-09-04 21:23:40.341824,2023-09-04 21:23:40.930219,0 days 00:00:00.588395,Leaky,ReLU,,,74,17,21.0,,,0.0020223481498994923,2,263,0.14373682426328815,0.00023895953253563892,223.89239756266275,COMPLETE
687,0.5948975086212158,2023-09-04 21:23:40.930835,2023-09-04 21:23:42.886199,0 days 00:00:01.955364,Tanh,Tanh,,,84,18,11.0,,,9.146122073320454e-05,2,403,0.1927899427465983,0.0072349397370528295,167.51956519417965,COMPLETE
688,0.37336239218711853,2023-09-04 21:23:42.886540,2023-09-04 21:23:43.907537,0 days 00:00:01.020997,Tanh,Tanh,,,77,13,11.0,,,0.0011506809839179585,2,317,0.3581468177307578,8.12829212866713e-05,174.90673872140738,COMPLETE
689,0.42268049716949463,2023-09-04 21:23:43.908173,2023-09-04 21:23:44.239770,0 days 00:00:00.331597,Leaky,Leaky,,,81,18,22.0,,,0.04224238848928099,2,74,0.7187209469441392,0.014475348569539045,223.23392925840434,COMPLETE
690,0.5341171622276306,2023-09-04 21:23:44.240137,2023-09-04 21:23:44.475257,0 days 00:00:00.235120,Tanh,Tanh,,,41,19,12.0,,,0.0009746419040670623,2,62,0.14038413116652723,0.00017146497331434782,220.9528542795489,COMPLETE
691,0.39834174513816833,2023-09-04 21:23:44.475691,2023-09-04 21:23:44.817209,0 days 00:00:00.341518,Tanh,Tanh,,,72,16,16.0,,,0.014950273535388952,2,242,0.4264190005343798,0.011395996809825263,427.9736932718529,COMPLETE
692,0.5178335309028625,2023-09-04 21:23:44.817561,2023-09-04 21:23:44.935261,0 days 00:00:00.117700,Leaky,ReLU,,,86,17,10.0,,,0.028575495387466922,2,500,0.10188425974867102,0.00015255974411856999,140.77190087058327,COMPLETE
693,0.3854624927043915,2023-09-04 21:23:44.935603,2023-09-04 21:23:45.118323,0 days 00:00:00.182720,Tanh,Leaky,,,75,18,11.0,,,0.02064165908376825,2,286,0.24410052070540667,9.021142178990181e-05,131.21399006090667,COMPLETE
694,0.39164698123931885,2023-09-04 21:23:45.118685,2023-09-04 21:23:48.451651,0 days 00:00:03.332966,Tanh,Tanh,,,79,20,12.0,,,7.813484500033051e-05,2,370,0.7548160905251162,0.00012726683641356833,2705.080312862912,COMPLETE
695,0.268963098526001,2023-09-04 21:23:48.451992,2023-09-04 21:23:48.947131,0 days 00:00:00.495139,Leaky,Tanh,,,73,18,20.0,,,0.034851664292557816,2,170,0.6814593508701725,2.8774578388958258e-05,108.57163627474915,COMPLETE
696,0.7909960746765137,2023-09-04 21:23:48.947508,2023-09-04 21:23:49.757761,0 days 00:00:00.810253,Tanh,Tanh,,,78,19,7.0,,,2.7287350719763257e-05,2,86,0.7466936791128779,0.00021166691333761374,169.53991575019305,COMPLETE
697,0.4058195650577545,2023-09-04 21:23:49.758105,2023-09-04 21:23:51.177668,0 days 00:00:01.419563,ReLU,Leaky,,,13,17,11.0,,,0.012098283064676458,2,232,0.4037030553935035,4.936540001695005e-05,171.8226964738634,COMPLETE
698,0.3647392988204956,2023-09-04 21:23:51.178038,2023-09-04 21:23:51.809492,0 days 00:00:00.631454,Tanh,ReLU,,,72,18,6.0,,,0.0030585996689412582,2,266,0.7094573490416994,0.0005148771103105839,179.51347851753235,COMPLETE
699,0.7504135370254517,2023-09-04 21:23:51.809857,2023-09-04 21:23:52.597096,0 days 00:00:00.787239,Leaky,Tanh,,,75,19,10.0,,,4.959785197386972e-05,2,252,0.20834021238630845,1.9280407106336454e-05,113.51314777798123,COMPLETE
700,0.31720635294914246,2023-09-04 21:23:52.597474,2023-09-04 21:23:53.040339,0 days 00:00:00.442865,Tanh,Tanh,,,70,17,24.0,,,0.023697379962432166,2,306,0.7709603856964042,0.001070646647670298,136.54401664733888,COMPLETE
701,0.30524685978889465,2023-09-04 21:23:53.040711,2023-09-04 21:23:53.613527,0 days 00:00:00.572816,Tanh,Tanh,,,21,18,16.0,,,0.01642841024666606,2,291,0.6524225490657006,0.0013801980166207738,444.47318209134613,COMPLETE
702,0.4713777005672455,2023-09-04 21:23:53.613896,2023-09-04 21:23:54.419069,0 days 00:00:00.805173,Leaky,Leaky,,,25,17,12.0,,,0.0007057091617224048,2,76,0.3596069642703775,0.050819468445069974,2728.6311292146383,COMPLETE
703,0.32307466864585876,2023-09-04 21:23:54.419424,2023-09-04 21:23:54.842026,0 days 00:00:00.422602,Tanh,ReLU,,,81,18,10.0,,,0.029162135185697498,2,258,0.7338129717922021,0.0007684555053590715,126.32334155128116,COMPLETE
704,0.36947742104530334,2023-09-04 21:23:54.842379,2023-09-04 21:23:55.156178,0 days 00:00:00.313799,Tanh,Tanh,,,93,19,7.0,,,0.038806373340223514,2,273,0.595581974693918,9.778735309127996e-05,177.40893325805663,COMPLETE
705,0.41970062255859375,2023-09-04 21:23:55.156538,2023-09-04 21:23:55.604887,0 days 00:00:00.448349,Leaky,Tanh,,,74,16,11.0,,,0.004460986598264436,2,61,0.5208912444701465,0.038073362060412626,218.75073042072233,COMPLETE
706,0.3176317512989044,2023-09-04 21:23:55.605224,2023-09-04 21:23:56.088601,0 days 00:00:00.483377,Tanh,Tanh,,,77,19,10.0,,,0.019413956285520444,2,285,0.7723265832936199,7.007730835771999e-05,146.41616257377294,COMPLETE
707,0.3582366108894348,2023-09-04 21:23:56.088952,2023-09-04 21:23:56.272881,0 days 00:00:00.183929,Tanh,Leaky,,,83,18,11.0,,,0.026795244264037878,2,69,0.3676866614019893,0.00015139589078598718,133.64849248425713,COMPLETE
708,0.4118727147579193,2023-09-04 21:23:56.273228,2023-09-04 21:23:57.351890,0 days 00:00:01.078662,Leaky,Tanh,,,80,17,12.0,,,0.0008431210552279678,2,298,0.7000219401021196,0.014420093008890304,254.19123703871315,COMPLETE
709,0.3336009085178375,2023-09-04 21:23:57.352252,2023-09-04 21:23:58.286616,0 days 00:00:00.934364,Tanh,ReLU,,,15,18,10.0,,,0.032949813257801705,2,80,0.7350480729487447,0.00019590835272662255,231.40521555933458,COMPLETE
710,0.5652174949645996,2023-09-04 21:23:58.286973,2023-09-04 21:23:58.728830,0 days 00:00:00.441857,Tanh,Tanh,,,71,19,12.0,,,0.00018661771012189418,2,92,0.3142407773790091,0.00089948138661701,138.61086132215416,COMPLETE
711,0.48310211300849915,2023-09-04 21:23:58.729183,2023-09-04 21:24:00.138573,0 days 00:00:01.409390,Leaky,Sigmoid,,,69,20,13.0,,,0.00027787369886567024,2,138,0.7641496771657311,0.00012016195344568977,242.0250131358271,COMPLETE
712,0.2887018024921417,2023-09-04 21:24:00.138928,2023-09-04 21:24:00.503372,0 days 00:00:00.364444,Tanh,Leaky,,,76,16,11.0,,,0.04550239456793679,2,489,0.7992086128841894,0.002070002379759006,196.15413226503316,COMPLETE
713,0.32719293236732483,2023-09-04 21:24:00.503721,2023-09-04 21:24:01.818548,0 days 00:00:01.314827,Tanh,Tanh,,,20,18,8.0,,,0.0026318347876866962,2,275,0.32340617900404484,0.0002682909601044421,156.94697024027508,COMPLETE
714,0.410846084356308,2023-09-04 21:24:01.818895,2023-09-04 21:24:02.680811,0 days 00:00:00.861916,Leaky,Tanh,,,11,19,10.0,,,0.001770629028624366,2,338,0.17229731462560588,5.770901438126049e-05,140.82811988272317,COMPLETE
715,0.33817270398139954,2023-09-04 21:24:02.681178,2023-09-04 21:24:03.118440,0 days 00:00:00.437262,Tanh,Sigmoid,,,72,11,14.0,,,0.02243328693369041,2,309,0.6666662431979263,0.0001748664689160775,169.79986775716145,COMPLETE
716,0.28376951813697815,2023-09-04 21:24:03.118793,2023-09-04 21:24:03.848239,0 days 00:00:00.729446,Tanh,ReLU,,,78,17,9.0,,,0.010862114737601328,2,81,0.7992576515513371,3.3432977473178944e-05,117.63997574927102,COMPLETE
717,0.3777722716331482,2023-09-04 21:24:03.848590,2023-09-04 21:24:04.426885,0 days 00:00:00.578295,Leaky,Tanh,,,74,18,17.0,,,0.014800884904995643,2,223,0.7206451119194759,1.0679833384768646e-05,267.20053669557734,COMPLETE
718,0.3415577709674835,2023-09-04 21:24:04.427232,2023-09-04 21:24:04.741007,0 days 00:00:00.313775,Tanh,Leaky,,,85,18,11.0,,,0.02000075528610635,2,158,0.4269943766044038,0.0004183318703921462,214.83152506901666,COMPLETE
719,0.3896145820617676,2023-09-04 21:24:04.741376,2023-09-04 21:24:04.857375,0 days 00:00:00.115999,ReLU,Tanh,,,70,17,10.0,,,0.03707474821257598,2,483,0.147011137660017,8.379232641946824e-05,142.50351088387626,COMPLETE
720,0.5827606916427612,2023-09-04 21:24:04.857744,2023-09-04 21:24:05.235987,0 days 00:00:00.378243,Tanh,Sigmoid,,,82,19,6.0,,,0.006416893028228586,2,324,0.6939863474789321,0.0409361705069781,199.85518245697023,COMPLETE
721,0.35317689180374146,2023-09-04 21:24:05.236340,2023-09-04 21:24:05.625058,0 days 00:00:00.388718,Leaky,Tanh,,,36,20,18.0,,,0.026837749854441276,2,196,0.7510414570070401,0.0024710552689322994,174.67666140469638,COMPLETE
722,0.3711703419685364,2023-09-04 21:24:05.625407,2023-09-04 21:24:06.073806,0 days 00:00:00.448399,Tanh,ReLU,,,68,17,12.0,,,0.017943487419798787,2,243,0.29799304660203313,0.00013878504395785615,207.42972427759415,COMPLETE
723,0.4655899107456207,2023-09-04 21:24:06.074434,2023-09-04 21:24:06.417637,0 days 00:00:00.343203,Leaky,Tanh,,,73,18,8.0,,,0.03333256259828343,2,500,0.13251780711360703,0.00010302192047892103,245.61931999362244,COMPLETE
724,0.45935502648353577,2023-09-04 21:24:06.418266,2023-09-04 21:24:06.897621,0 days 00:00:00.479355,Tanh,,,,34,18,,,,0.0087806459809597,1,252,0.11476666606953119,1.5750866777088557e-05,144.68001174926758,COMPLETE
725,0.5449100732803345,2023-09-04 21:24:06.898233,2023-09-04 21:24:08.777553,0 days 00:00:01.879320,Tanh,Leaky,,,76,14,9.0,,,0.00036628443667412506,2,124,0.5536824383946141,0.00023037310686358233,220.8973793522004,COMPLETE
726,0.31368136405944824,2023-09-04 21:24:08.777925,2023-09-04 21:24:09.149897,0 days 00:00:00.371972,Leaky,Sigmoid,,,80,19,11.0,,,0.02408274197917154,2,286,0.770755625531707,4.0898174212534366e-05,191.7164702544341,COMPLETE
727,0.4234529137611389,2023-09-04 21:24:09.150255,2023-09-04 21:24:09.341250,0 days 00:00:00.190995,Tanh,Tanh,,,89,17,13.0,,,0.04821764040742069,2,260,0.340664376052148,6.631875362089175e-05,271.4333042689732,COMPLETE
728,0.40775227546691895,2023-09-04 21:24:09.341611,2023-09-04 21:24:09.584645,0 days 00:00:00.243034,Tanh,Tanh,,,39,18,10.0,,,0.003867156946456288,2,87,0.16132224641293066,0.0003214622651974719,141.37988268534343,COMPLETE
729,0.5482221841812134,2023-09-04 21:24:09.584996,2023-09-04 21:24:09.738765,0 days 00:00:00.153769,Leaky,Sigmoid,,,71,15,7.0,,,0.013500903710186063,2,66,0.27188194034144947,0.0001301730627785413,400.0063160083912,COMPLETE
730,0.3471522927284241,2023-09-04 21:24:09.739107,2023-09-04 21:24:10.016412,0 days 00:00:00.277305,Tanh,Leaky,,,78,16,11.0,,,0.029617259358720865,2,299,0.37647889509504695,0.00018121712522907378,176.37535173065808,COMPLETE
731,0.37123411893844604,2023-09-04 21:24:10.016759,2023-09-04 21:24:10.335660,0 days 00:00:00.318901,Tanh,Tanh,,,74,19,9.0,,,0.04173165136828781,2,208,0.4600901016679637,0.007614835547607728,157.1406415574094,COMPLETE
732,0.36257460713386536,2023-09-04 21:24:10.336006,2023-09-04 21:24:11.061128,0 days 00:00:00.725122,Leaky,ReLU,,,68,18,10.0,,,0.016557817260601196,2,73,0.7279566805800007,0.017063127759090344,188.43142177634044,COMPLETE
733,0.49323078989982605,2023-09-04 21:24:11.061478,2023-09-04 21:24:11.817783,0 days 00:00:00.756305,Tanh,Tanh,Leaky,,76,17,12.0,6.0,,0.02043532237903664,3,278,0.6770182916532583,0.02771290344134274,164.71037618001301,COMPLETE
734,0.547343373298645,2023-09-04 21:24:11.818140,2023-09-04 21:24:11.962022,0 days 00:00:00.143882,Tanh,Tanh,,,73,18,9.0,,,0.000613627867764645,2,51,0.12245385024225794,0.00011270552022715409,130.92013669481466,COMPLETE
735,0.43377476930618286,2023-09-04 21:24:11.962375,2023-09-04 21:24:12.062150,0 days 00:00:00.099775,Leaky,Sigmoid,,,70,19,11.0,,,0.023541746700381214,2,266,0.12582222023224146,8.086132942783977e-05,512.3154085599459,COMPLETE
736,0.4297296106815338,2023-09-04 21:24:12.062502,2023-09-04 21:24:15.104327,0 days 00:00:03.041825,Tanh,Leaky,,,80,16,10.0,,,0.0005292261829720156,2,381,0.6219736666315301,0.00016357234667819474,157.09521003391433,COMPLETE
737,0.40480178594589233,2023-09-04 21:24:15.104953,2023-09-04 21:24:18.014326,0 days 00:00:02.909373,Tanh,Tanh,,,83,17,16.0,,,0.0011979954301687783,2,290,0.30042443541293484,0.0005580213956558885,149.50615176496834,COMPLETE
738,0.9320141673088074,2023-09-04 21:24:18.015032,2023-09-04 21:24:18.796370,0 days 00:00:00.781338,Leaky,ReLU,,,87,19,8.0,,,3.1393979373647206e-05,2,103,0.3368212043814164,9.361578772657794e-05,159.37648765786182,COMPLETE
739,0.44323650002479553,2023-09-04 21:24:18.796717,2023-09-04 21:24:18.911296,0 days 00:00:00.114579,Tanh,Tanh,,,72,20,20.0,,,0.033367501149262103,2,89,0.10801533273971159,0.00014500379874923184,196.1153959386489,COMPLETE
740,0.9398200511932373,2023-09-04 21:24:18.911631,2023-09-04 21:24:20.428449,0 days 00:00:01.516818,Tanh,Sigmoid,,,67,21,12.0,,,1.6728189431828642e-05,2,233,0.4724487483243339,0.027807108724170904,945.1772770042584,COMPLETE
741,0.6718616485595703,2023-09-04 21:24:20.428808,2023-09-04 21:24:22.837711,0 days 00:00:02.408903,Leaky,Tanh,,,78,18,9.0,,,1.1728371488130336e-05,2,274,0.7486267652242968,0.00020936003979537776,185.4620590766851,COMPLETE
742,0.3309828042984009,2023-09-04 21:24:22.838058,2023-09-04 21:24:23.182808,0 days 00:00:00.344750,ReLU,Leaky,,,75,18,11.0,,,0.005385511826715467,2,490,0.21762762139419428,0.0018044208268339847,144.52277503967287,COMPLETE
743,0.22647996246814728,2023-09-04 21:24:23.183170,2023-09-04 21:24:23.747675,0 days 00:00:00.564505,Tanh,Tanh,,,69,17,19.0,,,0.02740064287322136,2,306,0.7724152901149873,0.00011453149668997237,176.8657792898325,COMPLETE
744,0.883085310459137,2023-09-04 21:24:23.748033,2023-09-04 21:24:24.463001,0 days 00:00:00.714968,Tanh,Tanh,,,67,20,19.0,,,1.289693742677535e-05,2,312,0.13152202939311358,5.275838265173215e-05,111.72155243311173,COMPLETE
745,0.26879435777664185,2023-09-04 21:24:24.463345,2023-09-04 21:24:25.301069,0 days 00:00:00.837724,Tanh,Sigmoid,,,65,18,22.0,,,0.00704711555086816,2,315,0.7998926591541944,2.5112786516665408e-05,919.6324568684896,COMPLETE
746,0.3467867076396942,2023-09-04 21:24:25.301451,2023-09-04 21:24:27.750917,0 days 00:00:02.449466,Tanh,ReLU,,,69,21,16.0,,,0.0004808099193801884,2,310,0.771047585999098,3.472321556010799e-05,151.5902643320512,COMPLETE
747,0.2658078372478485,2023-09-04 21:24:27.751261,2023-09-04 21:24:28.126838,0 days 00:00:00.375577,Tanh,Tanh,,,68,19,23.0,,,0.02622558488746952,2,321,0.7668018615696356,0.00025009328577734076,274.54514243386006,COMPLETE
748,0.5082679390907288,2023-09-04 21:24:28.127181,2023-09-04 21:24:29.233544,0 days 00:00:01.106363,Tanh,Tanh,,,66,19,21.0,,,5.046346119659624e-05,2,319,0.23548350554275527,0.00030023895514874285,162.82883847992997,COMPLETE
749,0.2861465513706207,2023-09-04 21:24:29.233897,2023-09-04 21:24:29.912678,0 days 00:00:00.678781,Tanh,Tanh,,,64,20,15.0,,,0.019753733053461245,2,329,0.7737493935881509,0.0002480078859958411,600.7055266333408,COMPLETE
750,0.4989188015460968,2023-09-04 21:24:29.913036,2023-09-04 21:24:30.085454,0 days 00:00:00.172418,Tanh,Tanh,,,69,20,15.0,,,0.011489763357782859,2,308,0.13856250750990054,0.0003685749151144844,200.58320504647713,COMPLETE
751,0.28454190492630005,2023-09-04 21:24:30.085825,2023-09-04 21:24:32.178066,0 days 00:00:02.092241,Tanh,Tanh,,,65,19,22.0,,,0.0001782855566878368,2,304,0.7703152171168649,0.00020316755382991154,123.11303842478785,COMPLETE
752,0.46867355704307556,2023-09-04 21:24:32.178430,2023-09-04 21:24:35.468543,0 days 00:00:03.290113,Tanh,Tanh,,,62,19,22.0,,,0.00011173015302321953,2,319,0.7427639527311675,0.00026685729241847784,170.70911586845182,COMPLETE
753,0.3607371747493744,2023-09-04 21:24:35.468893,2023-09-04 21:24:35.795538,0 days 00:00:00.326645,Tanh,Tanh,,,67,19,22.0,,,0.016381240820001704,2,281,0.42227902364536807,0.0001784428774430721,170.88850116729736,COMPLETE
754,0.5464617013931274,2023-09-04 21:24:35.795990,2023-09-04 21:24:37.168333,0 days 00:00:01.372343,Tanh,Tanh,,,82,19,23.0,,,0.00012013258115348297,2,327,0.22359557756375334,0.0031168164642150983,196.08897227249378,COMPLETE
755,0.322081595659256,2023-09-04 21:24:37.168984,2023-09-04 21:24:38.704695,0 days 00:00:01.535711,Tanh,Tanh,,,67,19,24.0,,,0.026734289649451293,2,295,0.76931624102934,0.00022285196059968303,113.61180458816827,COMPLETE
756,0.4506765305995941,2023-09-04 21:24:38.705325,2023-09-04 21:24:39.611253,0 days 00:00:00.905928,Tanh,Tanh,,,69,20,23.0,,,0.0018281974109279468,2,302,0.15633750750859776,0.00014280573308453524,165.89110500128695,COMPLETE
757,0.34780335426330566,2023-09-04 21:24:39.611890,2023-09-04 21:24:41.563752,0 days 00:00:01.951862,Tanh,Tanh,,,28,20,23.0,,,0.022481572137380612,2,359,0.799905961874878,0.0012533586698015436,201.84370596749443,COMPLETE
758,0.44243815541267395,2023-09-04 21:24:41.564128,2023-09-04 21:24:42.813421,0 days 00:00:01.249293,Tanh,Tanh,,,66,17,23.0,,,0.0003658033440260914,2,305,0.2918803858810109,0.0001651381287823028,172.35874931206138,COMPLETE
759,0.3263930082321167,2023-09-04 21:24:42.813775,2023-09-04 21:24:43.235185,0 days 00:00:00.421410,Tanh,Tanh,,,85,18,19.0,,,0.013703898425494259,2,295,0.7381356397444538,0.00023737346471445063,681.6534823947483,COMPLETE
760,0.34951233863830566,2023-09-04 21:24:43.235537,2023-09-04 21:24:43.526985,0 days 00:00:00.291448,Tanh,Tanh,,,80,19,24.0,,,0.030117193694661933,2,300,0.5003405265622087,0.0003426193153452352,273.7954559326172,COMPLETE
761,0.2936553955078125,2023-09-04 21:24:43.527341,2023-09-04 21:24:46.857042,0 days 00:00:03.329701,Tanh,Leaky,,,63,18,23.0,,,0.0002210120318307585,2,312,0.7988351456097057,0.00012169378836101147,196.07516420804538,COMPLETE
762,0.3600042760372162,2023-09-04 21:24:46.857408,2023-09-04 21:24:47.040425,0 days 00:00:00.183017,Tanh,Tanh,,,69,19,24.0,,,0.03978305835383968,2,334,0.24975078275277807,0.00018590631970542235,752.0094114604749,COMPLETE
763,0.3022861182689667,2023-09-04 21:24:47.040799,2023-09-04 21:24:47.475213,0 days 00:00:00.434414,Tanh,Tanh,,,79,17,13.0,,,0.019252496467511763,2,320,0.7998245873003512,0.00015224846784547884,180.63068817883004,COMPLETE
764,0.3733190596103668,2023-09-04 21:24:47.475589,2023-09-04 21:24:47.782106,0 days 00:00:00.306517,Tanh,Tanh,,,68,22,24.0,,,0.04709972333450309,2,345,0.5659327843977843,0.0044991174988101,207.2280254941998,COMPLETE
765,0.42956289649009705,2023-09-04 21:24:47.782483,2023-09-04 21:24:48.088491,0 days 00:00:00.306008,Tanh,Leaky,,,81,18,18.0,,,0.02396011569625341,2,299,0.7524878279377574,0.052052404773666246,521.1163056472252,COMPLETE
766,0.31629103422164917,2023-09-04 21:24:48.088862,2023-09-04 21:24:48.498709,0 days 00:00:00.409847,Tanh,ReLU,,,84,19,17.0,,,0.01599310672639718,2,297,0.7175824975664047,0.00011842446699553375,133.13987090370873,COMPLETE
767,0.2930144667625427,2023-09-04 21:24:48.499101,2023-09-04 21:24:48.832931,0 days 00:00:00.333830,Tanh,Tanh,,,42,18,12.0,,,0.035521498079947,2,289,0.7680049768247451,0.0004085254268057758,175.08018784295945,COMPLETE
768,0.41402965784072876,2023-09-04 21:24:48.833297,2023-09-04 21:24:48.968772,0 days 00:00:00.135475,Tanh,Tanh,,,71,17,22.0,,,0.02867889678573503,2,309,0.11750144930556253,0.0002019332104432767,245.33308202570134,COMPLETE
769,0.3236495852470398,2023-09-04 21:24:48.969143,2023-09-04 21:24:49.251442,0 days 00:00:00.282299,Tanh,Tanh,,,65,13,12.0,,,0.054519534141852136,2,287,0.7350507841651359,0.00028414037109920773,137.76486428578696,COMPLETE
770,0.593374490737915,2023-09-04 21:24:49.251836,2023-09-04 21:24:51.559945,0 days 00:00:02.308109,Tanh,Leaky,,,67,20,13.0,,,7.154172892032933e-05,2,305,0.5245930101031604,9.558041469758453e-05,350.0643080914607,COMPLETE
771,0.25494563579559326,2023-09-04 21:24:51.560320,2023-09-04 21:24:52.338749,0 days 00:00:00.778429,ReLU,ReLU,,,77,19,23.0,,,0.021067459198990102,2,318,0.7704608156164232,0.00013768965463250419,313.269177183813,COMPLETE
772,0.43034088611602783,2023-09-04 21:24:52.339379,2023-09-04 21:24:56.694663,0 days 00:00:04.355284,Leaky,ReLU,,,78,20,23.0,,,0.0001279610802027622,2,331,0.7661876855202379,0.0015534004633007757,207.49547666797466,COMPLETE
773,0.3247183561325073,2023-09-04 21:24:56.695018,2023-09-04 21:24:57.105291,0 days 00:00:00.410273,ReLU,ReLU,,,80,19,16.0,,,0.019108554331863228,2,315,0.7987019964473663,0.005644193346800806,1969.8856670673076,COMPLETE
774,0.5528146624565125,2023-09-04 21:24:57.105635,2023-09-04 21:24:57.240307,0 days 00:00:00.134672,ReLU,,,,78,19,,,,0.0035585925243703962,1,319,0.1889095025175204,0.00012823946316483867,546.2956475978945,COMPLETE
775,0.37852227687835693,2023-09-04 21:24:57.240654,2023-09-04 21:24:57.733420,0 days 00:00:00.492766,ReLU,ReLU,,,82,20,23.0,,,0.0021516807004957695,2,319,0.3951176285927222,0.00013958411114994474,170.6194828696873,COMPLETE
