number,value,datetime_start,datetime_complete,duration,params_activation1,params_activation2,params_activation3,params_activation4,params_batch_size,params_fl1,params_fl2,params_fl3,params_fl4,params_learning_rate,params_n_layers,params_num_epochs,params_train_size,params_weight_decay,user_attrs_mre,state
1299,0.45165184140205383,2023-09-04 21:54:14.401582,2023-09-04 21:54:14.617248,0 days 00:00:00.215666,ReLU,Tanh,Leaky,,34,19,23.0,22.0,,0.008815769198604507,3,148,0.12571366285116942,0.00023515788498234064,285.7692464192708,COMPLETE
1300,0.4033699035644531,2023-09-04 21:54:14.617728,2023-09-04 21:54:15.395859,0 days 00:00:00.778131,ReLU,Leaky,Sigmoid,,53,2,22.0,21.0,,0.01314027676183931,3,225,0.7382456474075203,0.0001203239138412159,548.5953881835937,COMPLETE
1301,0.26406800746917725,2023-09-04 21:54:15.396357,2023-09-04 21:54:16.925603,0 days 00:00:01.529246,ReLU,Sigmoid,Leaky,ReLU,24,21,21.0,13.0,18.0,0.0047111407166859085,4,212,0.7691778804726845,5.5145795650052585e-05,838.9755954318576,COMPLETE
1302,0.46323561668395996,2023-09-04 21:54:16.926101,2023-09-04 21:54:17.132597,0 days 00:00:00.206496,ReLU,Leaky,Leaky,,37,18,20.0,24.0,,0.03895926551544724,3,203,0.22794131029211195,7.140501735876964e-05,161.69251505533853,COMPLETE
1303,0.43232473731040955,2023-09-04 21:54:17.133081,2023-09-04 21:54:17.406835,0 days 00:00:00.273754,ReLU,Tanh,Leaky,,43,20,10.0,2.0,,0.014791938887700052,3,176,0.3595359513704991,0.00020117911918503901,1072.3348010835193,COMPLETE
1304,0.3586951196193695,2023-09-04 21:54:17.407282,2023-09-04 21:54:18.017669,0 days 00:00:00.610387,ReLU,Leaky,ReLU,,40,20,12.0,9.0,,0.003243218685336224,3,229,0.4172452834833732,1.280505078828548e-05,118.75568870261863,COMPLETE
1305,0.3872550129890442,2023-09-04 21:54:18.018160,2023-09-04 21:54:18.593177,0 days 00:00:00.575017,ReLU,Leaky,Leaky,,30,19,9.0,23.0,,0.017838988572598843,3,65,0.31052610214163057,0.0001509888133168335,129.4303865785952,COMPLETE
1306,0.3197096884250641,2023-09-04 21:54:18.593699,2023-09-04 21:54:20.565595,0 days 00:00:01.971896,ReLU,Tanh,Leaky,,32,21,22.0,8.0,,0.00099493886238228,3,188,0.697198046798248,0.007940665159758237,268.1587711409027,COMPLETE
1307,0.3118204176425934,2023-09-04 21:54:20.566185,2023-09-04 21:54:21.990645,0 days 00:00:01.424460,ReLU,Leaky,Sigmoid,,48,19,21.0,22.0,,0.0014715473256280672,3,214,0.6320835841396135,1.682743424494449e-05,235.1076720908836,COMPLETE
1308,0.40668371319770813,2023-09-04 21:54:21.991244,2023-09-04 21:54:22.480540,0 days 00:00:00.489296,ReLU,Leaky,Leaky,,36,20,20.0,23.0,,0.01129524966453665,3,245,0.7730070009083282,0.00010465509660126162,188.7190428234282,COMPLETE
1309,0.3803738057613373,2023-09-04 21:54:22.481097,2023-09-04 21:54:23.264944,0 days 00:00:00.783847,ReLU,Tanh,Leaky,Leaky,39,18,19.0,7.0,14.0,0.007016095714101793,4,196,0.7290145465229381,0.011650750694702727,288.5539059109158,COMPLETE
1310,0.37091729044914246,2023-09-04 21:54:23.265387,2023-09-04 21:54:24.029470,0 days 00:00:00.764083,ReLU,Leaky,Leaky,,34,18,22.0,24.0,,0.002325943892790325,3,219,0.26929826416526603,0.0003050991826592437,115.31385942684707,COMPLETE
1311,0.43080148100852966,2023-09-04 21:54:24.030043,2023-09-04 21:54:26.441230,0 days 00:00:02.411187,ReLU,,,,28,21,,,,0.0004526602414846553,1,167,0.7454512839688539,0.01807689484152764,180.10521072113585,COMPLETE
1312,0.4431079626083374,2023-09-04 21:54:26.441703,2023-09-04 21:54:26.927247,0 days 00:00:00.485544,ReLU,Leaky,ReLU,,50,17,18.0,10.0,,0.003937007289644668,3,206,0.2138525996642521,0.06731702768898187,501.02596706814234,COMPLETE
1313,0.5441975593566895,2023-09-04 21:54:26.927846,2023-09-04 21:54:34.914423,0 days 00:00:07.986577,ReLU,Tanh,Leaky,,32,19,23.0,9.0,,3.5010672531925114e-05,3,278,0.7739423948412546,0.0004571414172858097,227.01997485263743,COMPLETE
1314,0.5292038321495056,2023-09-04 21:54:34.914948,2023-09-04 21:54:35.982715,0 days 00:00:01.067767,ReLU,Sigmoid,Sigmoid,,61,20,20.0,16.0,,0.00016353666220145043,3,261,0.20623396818780151,4.70036450681272e-05,138.61123037520954,COMPLETE
1315,0.3327041268348694,2023-09-04 21:54:35.983195,2023-09-04 21:54:36.451221,0 days 00:00:00.468026,ReLU,Leaky,Leaky,,44,19,21.0,20.0,,0.02353649388284899,3,239,0.3430951193681329,0.00017181420996629585,164.87834945379518,COMPLETE
1316,0.2835221290588379,2023-09-04 21:54:36.451770,2023-09-04 21:54:37.236243,0 days 00:00:00.784473,ReLU,Leaky,Leaky,,38,20,24.0,8.0,,0.00901987204476619,3,185,0.6647105652074125,0.0020659182497194677,161.40390353732639,COMPLETE
1317,0.2991942763328552,2023-09-04 21:54:37.236770,2023-09-04 21:54:37.858589,0 days 00:00:00.621819,ReLU,Tanh,Leaky,,57,16,19.0,6.0,,0.005491591802924844,3,197,0.6999705796995408,0.0011791802101280078,152.68510250515408,COMPLETE
1318,0.26203835010528564,2023-09-04 21:54:37.859145,2023-09-04 21:54:39.265974,0 days 00:00:01.406829,ReLU,Leaky,Leaky,Sigmoid,42,18,21.0,21.0,16.0,0.00268399363847448,4,178,0.7998723551484297,6.136519662974384e-05,292.3969300682865,COMPLETE
1319,0.5436878204345703,2023-09-04 21:54:39.266517,2023-09-04 21:54:43.197788,0 days 00:00:03.931271,ReLU,Leaky,Sigmoid,,36,19,10.0,22.0,,2.033413791159194e-05,3,226,0.7272646155567624,0.000782573727454452,163.02819044400104,COMPLETE
1320,0.4361608624458313,2023-09-04 21:54:43.198275,2023-09-04 21:54:44.248871,0 days 00:00:01.050596,ReLU,Tanh,Leaky,,30,20,22.0,23.0,,0.011324098613811593,3,156,0.7997882862425991,0.05488173542851002,207.00716204975927,COMPLETE
1321,0.7982427477836609,2023-09-04 21:54:44.249439,2023-09-04 21:54:45.351394,0 days 00:00:01.101955,ReLU,Leaky,ReLU,,97,21,19.0,7.0,,2.568280576998722e-05,3,209,0.3893112819607634,0.0050712572383527325,1634.3116536847713,COMPLETE
1322,0.3742430806159973,2023-09-04 21:54:45.351903,2023-09-04 21:54:45.597295,0 days 00:00:00.245392,ReLU,Leaky,Leaky,,40,22,21.0,8.0,,0.015119763482333874,3,249,0.2960487463288768,2.0655696591304124e-05,190.05457632882255,COMPLETE
1323,0.5411749482154846,2023-09-04 21:54:45.597835,2023-09-04 21:54:46.068272,0 days 00:00:00.470437,ReLU,Tanh,Leaky,,77,20,23.0,24.0,,0.0007082761083858804,3,192,0.1334379831295757,7.977264116221576e-05,1765.9289743999052,COMPLETE
1324,0.629795491695404,2023-09-04 21:54:46.068823,2023-09-04 21:54:49.759334,0 days 00:00:03.690511,ReLU,Leaky,Leaky,,34,17,20.0,14.0,,4.427979900378391e-05,3,80,0.7510156002460893,0.05477862717180974,192.56802291870116,COMPLETE
1325,0.39152321219444275,2023-09-04 21:54:49.759788,2023-09-04 21:54:51.947477,0 days 00:00:02.187689,Sigmoid,Leaky,Leaky,,37,18,22.0,10.0,,0.001111233296324177,3,232,0.5744882266901719,0.00014215905269487745,162.58729186615386,COMPLETE
1326,0.6494371294975281,2023-09-04 21:54:51.947963,2023-09-04 21:54:52.154417,0 days 00:00:00.206454,ReLU,Sigmoid,Sigmoid,ReLU,31,19,20.0,9.0,11.0,0.008090121097109581,4,217,0.10899794498782797,1.2026298852256528e-05,163.90343873397163,COMPLETE
1327,0.35370296239852905,2023-09-04 21:54:52.154884,2023-09-04 21:54:52.810112,0 days 00:00:00.655228,ReLU,Tanh,Leaky,,40,19,21.0,23.0,,0.0016298753248454904,3,362,0.6862306163027793,0.0002245404066265664,154.6674551827567,COMPLETE
1328,0.2773756682872772,2023-09-04 21:54:52.810618,2023-09-04 21:54:55.361440,0 days 00:00:02.550822,ReLU,Leaky,Leaky,,26,21,15.0,9.0,,0.0035345087751234142,3,204,0.7228887896804577,0.00017835630091486487,185.92334123091265,COMPLETE
1329,0.2551978826522827,2023-09-04 21:54:55.362328,2023-09-04 21:54:59.927621,0 days 00:00:04.565293,ReLU,Leaky,ReLU,,35,20,23.0,17.0,,0.002879577517343966,3,187,0.7713197898044257,0.0013654861570913737,386.1838696289062,COMPLETE
1330,0.519612729549408,2023-09-04 21:54:59.928516,2023-09-04 21:55:10.870839,0 days 00:00:10.942323,ReLU,Leaky,ReLU,,33,20,24.0,17.0,,3.33800275731277e-05,3,180,0.7734503472178489,0.002147526577737797,221.6906621721056,COMPLETE
1331,0.3657156825065613,2023-09-04 21:55:10.871712,2023-09-04 21:55:14.729039,0 days 00:00:03.857327,ReLU,Leaky,ReLU,,35,19,23.0,16.0,,0.0027020491823709332,3,169,0.48859550361379467,0.035443889439066546,156.43947794245577,COMPLETE
1332,0.32603421807289124,2023-09-04 21:55:14.729922,2023-09-04 21:55:24.908931,0 days 00:00:10.179009,Sigmoid,Leaky,ReLU,,33,18,24.0,15.0,,0.0021613464648690696,3,182,0.7515493970647118,0.00012112361053963085,122.53224065568712,COMPLETE
1333,0.2937312126159668,2023-09-04 21:55:24.909816,2023-09-04 21:55:27.491647,0 days 00:00:02.581831,ReLU,Leaky,ReLU,,35,20,23.0,20.0,,0.0032594961921427468,3,189,0.5355399937126124,0.0011010564721290637,133.14978632433662,COMPLETE
1334,0.2357795685529709,2023-09-04 21:55:27.492527,2023-09-04 21:55:33.538582,0 days 00:00:06.046055,ReLU,Leaky,ReLU,Leaky,32,23,23.0,18.0,6.0,0.0027567902452651045,4,172,0.7730391050490708,0.0014913700155884436,294.1894752100894,COMPLETE
1335,0.2015124261379242,2023-09-04 21:55:33.539468,2023-09-04 21:55:37.297551,0 days 00:00:03.758083,ReLU,Leaky,ReLU,Leaky,32,22,23.0,17.0,6.0,0.0027228630317013766,4,155,0.7997440291234066,0.0012768751909064964,96.69822124724692,COMPLETE
1336,0.28974485397338867,2023-09-04 21:55:37.298431,2023-09-04 21:55:42.706685,0 days 00:00:05.408254,ReLU,Leaky,ReLU,Leaky,30,23,24.0,16.0,8.0,0.00231147016153324,4,136,0.7971923406371063,0.0015114755834767276,139.43922248253455,COMPLETE
1337,0.308431476354599,2023-09-04 21:55:42.707584,2023-09-04 21:55:46.330048,0 days 00:00:03.622464,ReLU,Leaky,ReLU,Leaky,29,24,24.0,18.0,6.0,0.001879664390352084,4,147,0.7989299247103447,0.0016040492059795615,395.45879037039623,COMPLETE
1338,0.346973717212677,2023-09-04 21:55:46.330990,2023-09-04 21:55:47.901627,0 days 00:00:01.570637,ReLU,Leaky,ReLU,Leaky,31,24,23.0,18.0,4.0,0.0026937448626831763,4,144,0.39789280076952044,0.001688689241314755,227.5076176234654,COMPLETE
1339,0.28429973125457764,2023-09-04 21:55:47.902521,2023-09-04 21:55:59.453504,0 days 00:00:11.550983,Sigmoid,Leaky,ReLU,Leaky,32,23,23.0,19.0,7.0,0.002502514676796845,4,153,0.774451466424674,0.0012428508293826795,169.9868156540562,COMPLETE
1340,0.32478058338165283,2023-09-04 21:55:59.454413,2023-09-04 21:56:04.145122,0 days 00:00:04.690709,ReLU,Leaky,ReLU,Leaky,29,23,24.0,18.0,6.0,0.0032144490847234716,4,161,0.7730330727563918,0.0020598636855508577,125.89800737488945,COMPLETE
1341,0.4244396686553955,2023-09-04 21:56:04.146038,2023-09-04 21:56:06.461491,0 days 00:00:02.315453,ReLU,Leaky,ReLU,Leaky,30,23,23.0,17.0,5.0,0.0019402108590093926,4,166,0.24251272659516715,0.0013407410389734975,130.14460490998766,COMPLETE
1342,0.5353715419769287,2023-09-04 21:56:06.462419,2023-09-04 21:56:08.944056,0 days 00:00:02.481637,ReLU,Leaky,ReLU,Leaky,32,22,23.0,17.0,3.0,0.0036803904390181395,4,161,0.745761512851949,0.0488451530216994,514.0352497716104,COMPLETE
1343,0.3868084251880646,2023-09-04 21:56:08.944964,2023-09-04 21:56:10.998729,0 days 00:00:02.053765,ReLU,Leaky,ReLU,Leaky,28,22,24.0,17.0,5.0,0.0027577137500965966,4,162,0.4003146840064217,0.0009644303413002949,348.35930815197173,COMPLETE
1344,0.3375539779663086,2023-09-04 21:56:10.999684,2023-09-04 21:56:15.409745,0 days 00:00:04.410061,ReLU,Leaky,ReLU,Leaky,31,21,23.0,17.0,4.0,0.0022836789036413483,4,161,0.7672632227365358,0.001670139015728257,129.02514553070068,COMPLETE
1345,0.26529645919799805,2023-09-04 21:56:15.410654,2023-09-04 21:56:19.773154,0 days 00:00:04.362500,ReLU,Leaky,ReLU,Leaky,32,24,23.0,18.0,9.0,0.0032251285959987402,4,176,0.748661959978196,0.0014604799087713552,168.79122121710526,COMPLETE
1346,0.6317192316055298,2023-09-04 21:56:19.774063,2023-09-04 21:56:21.034419,0 days 00:00:01.260356,Sigmoid,Leaky,Sigmoid,Leaky,28,23,23.0,16.0,6.0,0.003676732091572361,4,158,0.19402301908547406,0.001974074713197394,213.89406309736535,COMPLETE
1347,0.3000602424144745,2023-09-04 21:56:21.035350,2023-09-04 21:56:27.340503,0 days 00:00:06.305153,ReLU,Leaky,ReLU,Leaky,30,23,24.0,18.0,9.0,0.00204343306627683,4,155,0.7987965408884294,0.002030048097257,479.2429681075247,COMPLETE
1348,0.4558180570602417,2023-09-04 21:56:27.341413,2023-09-04 21:56:29.808909,0 days 00:00:02.467496,ReLU,Leaky,ReLU,Leaky,32,23,23.0,19.0,2.0,0.004770242467923622,4,172,0.72912807072446,0.038003870528053874,308.87322187423706,COMPLETE
1349,0.6629377007484436,2023-09-04 21:56:29.809826,2023-09-04 21:56:40.838153,0 days 00:00:11.028327,ReLU,Leaky,ReLU,Leaky,33,24,23.0,16.0,7.0,1.3408153481417743e-05,4,154,0.773192782684544,0.001111648021974324,315.86831110174006,COMPLETE
1350,0.5279994010925293,2023-09-04 21:56:40.839087,2023-09-04 21:56:43.938868,0 days 00:00:03.099781,ReLU,Leaky,ReLU,Leaky,30,23,24.0,18.0,8.0,0.00010134738513138672,4,148,0.18689717788468926,0.0009313085438480658,202.50067922231312,COMPLETE
1351,0.29164445400238037,2023-09-04 21:56:43.939801,2023-09-04 21:56:48.419837,0 days 00:00:04.480036,ReLU,Leaky,ReLU,Leaky,27,24,23.0,17.0,10.0,0.0029558603762994042,4,169,0.7702035340619774,0.0014727503814091936,596.7524929046631,COMPLETE
1352,0.9088255763053894,2023-09-04 21:56:48.420772,2023-09-04 21:56:52.297660,0 days 00:00:03.876888,Sigmoid,Leaky,ReLU,Leaky,32,23,24.0,16.0,3.0,0.004290848972419646,4,144,0.7268938679088582,0.0028602464972211274,109.61479880593039,COMPLETE
1353,0.34147781133651733,2023-09-04 21:56:52.298590,2023-09-04 21:56:59.293317,0 days 00:00:06.994727,ReLU,Tanh,ReLU,Tanh,31,22,23.0,17.0,5.0,0.001633914228228333,4,170,0.3749197731505409,0.025468698487532776,139.26417837644877,COMPLETE
1354,0.27593371272087097,2023-09-04 21:56:59.294257,2023-09-04 21:57:06.427890,0 days 00:00:07.133633,ReLU,Leaky,Sigmoid,Leaky,33,22,23.0,19.0,6.0,0.0021271760709549517,4,163,0.5642686893306659,0.0023638398993842008,177.9812212857333,COMPLETE
1355,0.3185540437698364,2023-09-04 21:57:06.428804,2023-09-04 21:57:09.921697,0 days 00:00:03.492893,ReLU,Leaky,ReLU,ReLU,29,23,24.0,17.0,12.0,0.0024523982795662674,4,169,0.7967378512374891,0.0012958977460310582,172.54334591596555,COMPLETE
1356,0.29014506936073303,2023-09-04 21:57:09.922622,2023-09-04 21:57:13.892047,0 days 00:00:03.969425,ReLU,Tanh,Sigmoid,Leaky,33,22,23.0,18.0,11.0,0.004001844588840279,4,142,0.748126977192258,0.001280132819582236,146.55008457325124,COMPLETE
1357,0.6431559920310974,2023-09-04 21:57:13.893003,2023-09-04 21:57:15.223546,0 days 00:00:01.330543,ReLU,Leaky,ReLU,Sigmoid,31,22,23.0,17.0,20.0,0.0031766802794565533,4,154,0.1495688588324776,0.019192315848223604,143.85922557285855,COMPLETE
1358,0.34077155590057373,2023-09-04 21:57:15.224455,2023-09-04 21:57:18.548996,0 days 00:00:03.324541,ReLU,Leaky,Sigmoid,Leaky,25,23,24.0,19.0,24.0,0.006231582175694197,4,174,0.44725101928369876,0.0017567833511759029,189.77574054265426,COMPLETE
1359,0.4096834659576416,2023-09-04 21:57:18.549941,2023-09-04 21:57:26.135216,0 days 00:00:07.585275,Sigmoid,Tanh,ReLU,ReLU,27,23,23.0,16.0,4.0,0.0014176575646101378,4,174,0.5191498168047797,0.001729481230851813,347.0564834331644,COMPLETE
1360,0.3542693555355072,2023-09-04 21:57:26.136132,2023-09-04 21:57:29.657484,0 days 00:00:03.521352,ReLU,Leaky,Tanh,Leaky,29,24,22.0,19.0,7.0,0.001694736795682931,4,165,0.7154411630836559,0.0003364905448430285,143.56430308024088,COMPLETE
1361,0.5213414430618286,2023-09-04 21:57:29.658432,2023-09-04 21:57:34.466137,0 days 00:00:04.807705,ReLU,Sigmoid,Sigmoid,Tanh,34,22,22.0,18.0,2.0,0.0025834532772725347,4,157,0.7449879770909099,0.0006330076752590883,253.9703858969868,COMPLETE
1362,0.37351807951927185,2023-09-04 21:57:34.467065,2023-09-04 21:57:35.379928,0 days 00:00:00.912863,ReLU,Leaky,Leaky,ReLU,33,22,23.0,18.0,9.0,0.004658389729862824,4,135,0.14446317433573824,0.027562681528140752,148.57031558422332,COMPLETE
1363,0.46506258845329285,2023-09-04 21:57:35.380849,2023-09-04 21:57:38.409263,0 days 00:00:03.028414,ReLU,Tanh,Tanh,Leaky,31,23,22.0,20.0,1.0,0.002974072382338532,4,170,0.41576183932932076,0.0010696354015147349,350.89176783842197,COMPLETE
1364,0.3907766044139862,2023-09-04 21:57:38.410166,2023-09-04 21:57:41.565786,0 days 00:00:03.155620,ReLU,Leaky,ReLU,Leaky,34,24,22.0,17.0,10.0,0.0008173687229115627,4,178,0.504344301353594,0.0002722973860520512,184.86443853378296,COMPLETE
1365,0.48761650919914246,2023-09-04 21:57:41.566707,2023-09-04 21:57:44.343610,0 days 00:00:02.776903,Sigmoid,Leaky,Leaky,Sigmoid,29,23,23.0,20.0,8.0,0.003663225095262747,4,180,0.5869372907970672,0.0001939458258894938,218.9059021359398,COMPLETE
1366,1.0262773036956787,2023-09-04 21:57:44.344535,2023-09-04 21:57:44.900762,0 days 00:00:00.556227,ReLU,Tanh,Sigmoid,ReLU,32,21,24.0,18.0,8.0,0.0019406443331510582,4,153,0.27265383703773227,0.03520949563091439,102.25476773579915,COMPLETE
1367,0.4513106644153595,2023-09-04 21:57:44.901693,2023-09-04 21:57:45.582151,0 days 00:00:00.680458,ReLU,Leaky,Leaky,Leaky,31,22,22.0,17.0,6.0,0.00243015968554167,4,176,0.12321719993177765,0.00014414940486573145,137.2575927734375,COMPLETE
1368,0.42406249046325684,2023-09-04 21:57:45.583073,2023-09-04 21:57:54.832216,0 days 00:00:09.249143,ReLU,Leaky,ReLU,Tanh,34,22,23.0,16.0,5.0,0.00014078536482335158,4,162,0.7732634552656692,9.564662043937448e-05,451.0438296100286,COMPLETE
1369,0.5110934972763062,2023-09-04 21:57:54.833155,2023-09-04 21:57:55.591587,0 days 00:00:00.758432,ReLU,Tanh,Leaky,Leaky,26,22,22.0,21.0,4.0,0.005373001049046869,4,187,0.18248022141269177,0.0002305943312233352,370.92489687601727,COMPLETE
1370,0.33231791853904724,2023-09-04 21:57:55.592517,2023-09-04 21:57:59.081264,0 days 00:00:03.488747,ReLU,Leaky,Leaky,ReLU,28,22,23.0,16.0,13.0,0.004149220704498297,4,180,0.700888208703172,0.0008202156968379974,137.49309884934198,COMPLETE
1371,0.3874884247779846,2023-09-04 21:57:59.082199,2023-09-04 21:58:11.608017,0 days 00:00:12.525818,ReLU,Leaky,Tanh,Leaky,34,22,17.0,17.0,7.0,9.349410501919227e-05,4,172,0.798281481404021,0.00016940018918159042,156.73586330857387,COMPLETE
1372,0.4554736018180847,2023-09-04 21:58:11.608927,2023-09-04 21:58:14.799865,0 days 00:00:03.190938,Sigmoid,Leaky,Leaky,Sigmoid,30,22,22.0,18.0,3.0,0.007519437583533625,4,185,0.4570662419668509,0.0001277918015458713,245.06546092033386,COMPLETE
1373,0.5448768734931946,2023-09-04 21:58:14.800791,2023-09-04 21:58:17.227558,0 days 00:00:02.426767,ReLU,Tanh,Sigmoid,Leaky,33,23,24.0,19.0,19.0,0.0013314504114872588,4,167,0.2859691962832138,0.0022420544386310337,428.6251183969003,COMPLETE
1374,0.937167763710022,2023-09-04 21:58:17.228508,2023-09-04 21:58:18.242679,0 days 00:00:01.014171,ReLU,Sigmoid,Leaky,Leaky,30,23,23.0,20.0,8.0,0.00953883919091555,4,148,0.5174443507367055,0.0433702647406321,112.87246246337891,COMPLETE
1375,0.3981166481971741,2023-09-04 21:58:18.243606,2023-09-04 21:58:20.548499,0 days 00:00:02.304893,ReLU,Leaky,ReLU,ReLU,35,24,13.0,15.0,6.0,0.0005605992722701773,4,192,0.15606183042093733,0.00011230459706946258,131.7510900628077,COMPLETE
1376,0.3395853042602539,2023-09-04 21:58:20.549459,2023-09-04 21:58:26.045427,0 days 00:00:05.495968,ReLU,Leaky,Leaky,Tanh,23,23,9.0,21.0,9.0,0.0031630586265543005,4,183,0.7479550742260164,0.015357180280884257,229.02711331402813,COMPLETE
1377,0.2667778432369232,2023-09-04 21:58:26.046363,2023-09-04 21:58:30.357854,0 days 00:00:04.311491,ReLU,Tanh,Leaky,Leaky,32,22,23.0,15.0,17.0,0.006127666079766377,4,160,0.7997850900091564,0.00240810407332131,1615.6534582067418,COMPLETE
1378,0.4940468966960907,2023-09-04 21:58:30.358843,2023-09-04 21:58:36.636436,0 days 00:00:06.277593,ReLU,Leaky,Tanh,Leaky,35,21,22.0,19.0,2.0,0.0009280286196010733,4,123,0.7997400719486732,0.0013598902184391805,196.28986776442756,COMPLETE
1379,0.5956133008003235,2023-09-04 21:58:36.637684,2023-09-04 21:58:44.163207,0 days 00:00:07.525523,Sigmoid,Leaky,Leaky,ReLU,27,22,11.0,7.0,12.0,5.582842081197127e-05,4,197,0.3147678369032957,0.0010610071094698508,157.8486457863435,COMPLETE
1380,0.5152125954627991,2023-09-04 21:58:44.164160,2023-09-04 21:58:45.004791,0 days 00:00:00.840631,ReLU,Tanh,Sigmoid,Sigmoid,33,21,22.0,20.0,21.0,0.0028815821112253585,4,174,0.10969051838508156,0.0002493271347161719,168.08932915512398,COMPLETE
1381,0.42774221301078796,2023-09-04 21:58:45.005748,2023-09-04 21:58:49.728709,0 days 00:00:04.722961,ReLU,Leaky,Leaky,Leaky,30,21,10.0,8.0,10.0,0.00024859526703463106,4,199,0.210252887053377,0.0016870272166786009,178.253549393697,COMPLETE
1382,0.4893301725387573,2023-09-04 21:58:49.729826,2023-09-04 21:58:54.377136,0 days 00:00:04.647310,ReLU,Leaky,ReLU,Leaky,52,22,22.0,14.0,11.0,0.00019425853750496385,4,184,0.34867267166028504,0.00019856681110170998,140.17001143745753,COMPLETE
1383,0.38311052322387695,2023-09-04 21:58:54.378068,2023-09-04 21:58:58.247232,0 days 00:00:03.869164,ReLU,Tanh,Leaky,ReLU,35,23,24.0,21.0,4.0,0.002195235069211076,4,140,0.6160353180482623,0.0001536585664727155,149.76253739614336,COMPLETE
1384,0.4325309693813324,2023-09-04 21:58:58.248192,2023-09-04 21:58:59.537647,0 days 00:00:01.289455,ReLU,Leaky,Leaky,Leaky,28,21,23.0,8.0,5.0,0.010167251108795404,4,60,0.22654785996767635,0.00031494669995751494,275.0719153994606,COMPLETE
1385,0.8008378744125366,2023-09-04 21:58:59.538569,2023-09-04 21:59:13.027165,0 days 00:00:13.488596,Sigmoid,Sigmoid,Tanh,Leaky,32,23,22.0,17.0,7.0,2.2259096374917254e-05,4,191,0.721789556729169,0.0028968937442349703,117.09358183376452,COMPLETE
1386,0.4008616805076599,2023-09-04 21:59:13.028118,2023-09-04 21:59:16.007806,0 days 00:00:02.979688,ReLU,Leaky,Leaky,Tanh,36,21,23.0,7.0,14.0,0.004186673001239794,4,168,0.7487833572195838,8.484802282253435e-05,148.6995119367327,COMPLETE
1387,0.41327881813049316,2023-09-04 21:59:16.008848,2023-09-04 21:59:19.394454,0 days 00:00:03.385606,ReLU,Tanh,Sigmoid,Leaky,31,22,23.0,8.0,5.0,0.0017733525279551039,4,178,0.4829513748818507,0.0004305722983189381,164.32432579271722,COMPLETE
1388,0.9545351266860962,2023-09-04 21:59:19.395626,2023-09-04 21:59:20.951502,0 days 00:00:01.555876,ReLU,Leaky,,,55,21,24.0,,,1.5955357474016705e-05,2,199,0.13312599219955534,0.0007483774486539147,140.09865443550763,COMPLETE
1389,0.5259023904800415,2023-09-04 21:59:20.952455,2023-09-04 21:59:22.575713,0 days 00:00:01.623258,ReLU,Leaky,Leaky,Sigmoid,34,21,22.0,7.0,3.0,0.008097096096767568,4,207,0.25107660482259,0.00017772333358356221,222.28208227324905,COMPLETE
