number,value,datetime_start,datetime_complete,duration,params_activation1,params_activation2,params_activation3,params_activation4,params_batch_size,params_fl1,params_fl2,params_fl3,params_fl4,params_learning_rate,params_n_layers,params_num_epochs,params_train_size,params_weight_decay,user_attrs_mre,state
1851,0.3288169801235199,2023-09-04 22:19:41.266476,2023-09-04 22:19:43.959876,0 days 00:00:02.693400,ReLU,Leaky,Leaky,,43,19,11.0,8.0,,0.027657296528381465,3,200,0.7258282115695125,6.681995668730336e-05,200.87189596670646,COMPLETE
1852,0.35548776388168335,2023-09-04 22:19:43.960938,2023-09-04 22:19:45.361422,0 days 00:00:01.400484,Leaky,Leaky,Leaky,,39,20,23.0,9.0,,0.0069445603122170714,3,210,0.3060961549409476,3.690389832049174e-05,159.66792165316068,COMPLETE
1853,0.3519292175769806,2023-09-04 22:19:45.362471,2023-09-04 22:19:46.665055,0 days 00:00:01.302584,ReLU,Tanh,ReLU,,50,23,22.0,23.0,,0.008479536906635454,3,378,0.5070662660686529,0.00016502323412673038,153.6063971383231,COMPLETE
1854,0.5198314189910889,2023-09-04 22:19:46.666226,2023-09-04 22:19:49.949898,0 days 00:00:03.283672,ReLU,ReLU,Leaky,Tanh,37,20,21.0,22.0,5.0,0.002969074767812575,4,181,0.751599017952785,0.07884850561161659,229.74442049352135,COMPLETE
1855,0.49172288179397583,2023-09-04 22:19:49.950951,2023-09-04 22:19:51.482459,0 days 00:00:01.531508,Sigmoid,Leaky,Tanh,,34,18,20.0,8.0,,0.0023596645654142463,3,191,0.17649199197042925,4.7607179763125636e-05,191.8253389829165,COMPLETE
1856,0.3933858275413513,2023-09-04 22:19:51.483518,2023-09-04 22:19:57.797801,0 days 00:00:06.314283,ReLU,Leaky,Leaky,,84,21,22.0,7.0,,0.000680741689727378,3,232,0.6717017958219083,0.00022854890686652582,124.92803866287758,COMPLETE
1857,0.4922954738140106,2023-09-04 22:19:57.798857,2023-09-04 22:19:58.484031,0 days 00:00:00.685174,ReLU,Sigmoid,Sigmoid,,36,22,19.0,23.0,,0.0125266558026081,3,167,0.15410164056437023,5.6789809910881424e-05,161.4031772035541,COMPLETE
1858,0.5427559018135071,2023-09-04 22:19:58.485071,2023-09-04 22:19:59.958195,0 days 00:00:01.473124,Tanh,Leaky,Leaky,Leaky,30,17,23.0,10.0,16.0,0.010744411355954664,4,220,0.21679589100875293,0.022395474534818383,329.45292116561023,COMPLETE
1859,0.4610496759414673,2023-09-04 22:19:59.959252,2023-09-04 22:20:00.915692,0 days 00:00:00.956440,ReLU,Tanh,ReLU,,33,19,22.0,11.0,,0.05636729633138575,3,207,0.5318157250566122,7.47860166973417e-05,158.15630769729614,COMPLETE
1860,0.5093275904655457,2023-09-04 22:20:00.916760,2023-09-04 22:20:02.315369,0 days 00:00:01.398609,Sigmoid,Leaky,Leaky,,42,19,20.0,21.0,,0.0007839650889640066,3,154,0.16025287495491758,2.7880655192338606e-05,152.3938067236612,COMPLETE
1861,0.31663641333580017,2023-09-04 22:20:02.316453,2023-09-04 22:20:04.449101,0 days 00:00:02.132648,ReLU,Leaky,Tanh,,39,20,14.0,23.0,,0.0037386709580851294,3,197,0.3833126627281924,0.00012059128862083213,144.42443128945172,COMPLETE
1862,0.4991344213485718,2023-09-04 22:20:04.450163,2023-09-04 22:20:05.595513,0 days 00:00:01.145350,ReLU,Tanh,Leaky,,60,24,21.0,16.0,,0.08108753519279631,3,246,0.7678773134951862,3.4843840528015026e-05,255.76456948985225,COMPLETE
1863,0.39475780725479126,2023-09-04 22:20:05.596595,2023-09-04 22:20:08.730347,0 days 00:00:03.133752,ReLU,Leaky,ReLU,ReLU,35,18,23.0,9.0,6.0,0.0010544398479224476,4,176,0.25108279345074247,2.2173367035460506e-05,149.34487594120085,COMPLETE
1864,0.26765966415405273,2023-09-04 22:20:08.731436,2023-09-04 22:20:11.756542,0 days 00:00:03.025106,Sigmoid,Leaky,Sigmoid,,32,19,18.0,19.0,,0.053050639990121766,3,229,0.7188171300805144,1.8470246339057735e-05,393.32092030843097,COMPLETE
1865,0.31214433908462524,2023-09-04 22:20:11.757625,2023-09-04 22:20:13.134762,0 days 00:00:01.377137,ReLU,Leaky,Leaky,,44,22,19.0,7.0,,0.023187197786507387,3,215,0.7443186323940584,0.0008035213352984236,110.30746078491211,COMPLETE
1866,0.4084279537200928,2023-09-04 22:20:13.135874,2023-09-04 22:20:14.310763,0 days 00:00:01.174889,ReLU,Tanh,Leaky,,53,20,21.0,22.0,,0.0018529888064380837,3,188,0.17012415469250905,0.0015600378498172713,140.09838712668116,COMPLETE
1867,0.3694041669368744,2023-09-04 22:20:14.311824,2023-09-04 22:20:15.705907,0 days 00:00:01.394083,ReLU,ReLU,Leaky,,29,18,22.0,8.0,,0.0050766409047535155,3,204,0.4090459564795585,0.013389352098147645,132.73362731933594,COMPLETE
1868,0.30644461512565613,2023-09-04 22:20:15.707022,2023-09-04 22:20:17.898829,0 days 00:00:02.191807,ReLU,Leaky,,,37,21,20.0,,,0.006264199076867235,2,225,0.770415315324355,0.0001888098795879945,104.88324081066042,COMPLETE
1869,0.8576446175575256,2023-09-04 22:20:17.899859,2023-09-04 22:20:23.966124,0 days 00:00:06.066265,Sigmoid,Leaky,ReLU,Leaky,41,21,23.0,9.0,8.0,1.6878645748920668e-05,4,161,0.4543727966439466,0.00014329260310769353,128.50760105678015,COMPLETE
1870,0.35265055298805237,2023-09-04 22:20:23.967210,2023-09-04 22:20:25.228205,0 days 00:00:01.260995,ReLU,Sigmoid,Tanh,,35,20,22.0,21.0,,0.013802350829948053,3,181,0.21844282473608212,0.00035434359732805363,139.74957770632025,COMPLETE
1871,0.4718962609767914,2023-09-04 22:20:25.229238,2023-09-04 22:20:35.983055,0 days 00:00:10.753817,ReLU,Leaky,Leaky,,31,19,20.0,8.0,,9.658400133148212e-05,3,200,0.6351662041524346,0.0002597196736507379,210.7359203338623,COMPLETE
1872,0.2811875641345978,2023-09-04 22:20:35.984121,2023-09-04 22:20:40.863543,0 days 00:00:04.879422,ReLU,Tanh,Sigmoid,,39,20,21.0,18.0,,0.001430120263817339,3,211,0.6976818245059963,4.3946228586546395e-05,325.86698459057095,COMPLETE
1873,0.9764483571052551,2023-09-04 22:20:40.864632,2023-09-04 22:20:41.762065,0 days 00:00:00.897433,Sigmoid,Leaky,Leaky,Sigmoid,46,23,18.0,17.0,7.0,0.002781105530624871,4,190,0.7718245621095661,0.07444140743723168,100.69405018199573,COMPLETE
1874,0.2901964485645294,2023-09-04 22:20:41.763179,2023-09-04 22:20:44.201899,0 days 00:00:02.438720,ReLU,Leaky,ReLU,,28,18,17.0,23.0,,0.008866516914427738,3,257,0.7266414042173913,9.825972184747488e-05,624.3879376035748,COMPLETE
1875,0.5804651379585266,2023-09-04 22:20:44.202944,2023-09-04 22:20:44.726699,0 days 00:00:00.523755,ReLU,Tanh,Leaky,,33,17,23.0,10.0,,0.01943663928247967,3,240,0.11167805745019695,1.0020089540275706e-05,152.06551011403403,COMPLETE
1876,0.5011289715766907,2023-09-04 22:20:44.727790,2023-09-04 22:20:45.452681,0 days 00:00:00.724891,ReLU,Leaky,Leaky,,38,19,22.0,6.0,,0.00230815597415418,3,219,0.11678949943807723,1.32189563068554e-05,170.88842681884765,COMPLETE
1877,0.37721332907676697,2023-09-04 22:20:45.453730,2023-09-04 22:20:51.823269,0 days 00:00:06.369539,ReLU,Leaky,Tanh,,48,21,19.0,22.0,,0.00017697411921271418,3,172,0.6574691928983625,3.1686333894242714e-05,185.55507042757264,COMPLETE
1878,0.31513121724128723,2023-09-04 22:20:51.824470,2023-09-04 22:20:54.423738,0 days 00:00:02.599268,Leaky,Leaky,Leaky,Leaky,30,20,22.0,9.0,24.0,0.0031728528849810987,4,193,0.7726697910661599,0.0002062399885079067,178.21964518229166,COMPLETE
1879,0.5782882571220398,2023-09-04 22:20:54.424841,2023-09-04 22:21:01.126367,0 days 00:00:06.701526,Sigmoid,Tanh,Sigmoid,,36,22,21.0,8.0,,0.0002557046623254025,3,120,0.7398230756065188,5.085406068440201e-05,225.99566459655762,COMPLETE
1880,0.36285126209259033,2023-09-04 22:21:01.127463,2023-09-04 22:21:02.232453,0 days 00:00:01.104990,ReLU,ReLU,ReLU,,23,16,16.0,23.0,,0.01041161297276526,3,231,0.14299869066430457,0.002273323737422099,180.58361053466797,COMPLETE
1881,0.4708581566810608,2023-09-04 22:21:02.233508,2023-09-04 22:21:14.909431,0 days 00:00:12.675923,ReLU,Leaky,Leaky,,34,19,13.0,20.0,,2.618062681751013e-05,3,205,0.7998434330760922,0.008285732421393398,207.68945840975132,COMPLETE
1882,0.3923397660255432,2023-09-04 22:21:14.910500,2023-09-04 22:21:15.796314,0 days 00:00:00.885814,Tanh,Leaky,Leaky,ReLU,42,18,20.0,15.0,10.0,0.008005932555529323,4,65,0.13144623695546326,0.005735110969481957,164.1766998856156,COMPLETE
1883,0.2793095111846924,2023-09-04 22:21:15.797387,2023-09-04 22:21:22.062737,0 days 00:00:06.265350,ReLU,Sigmoid,ReLU,,26,20,10.0,8.0,,0.004012481884062476,3,221,0.5933256318078115,0.0011147492906496354,131.19710284013016,COMPLETE
1884,0.42146608233451843,2023-09-04 22:21:22.063790,2023-09-04 22:21:22.878634,0 days 00:00:00.814844,Sigmoid,Tanh,Tanh,,33,21,23.0,7.0,,0.015147921296432217,3,211,0.19562425592851962,7.942201313577052e-05,155.1329938103171,COMPLETE
1885,0.3807266354560852,2023-09-04 22:21:22.879704,2023-09-04 22:21:27.731011,0 days 00:00:04.851307,ReLU,Leaky,Leaky,,31,19,9.0,21.0,,0.0005546521029175977,3,178,0.35650167329686855,0.001788329494680038,340.91100765053744,COMPLETE
1886,0.41812434792518616,2023-09-04 22:21:27.732082,2023-09-04 22:21:37.276294,0 days 00:00:09.544212,ReLU,Leaky,Sigmoid,,40,22,21.0,22.0,,0.00022166007324208437,3,196,0.7014483098114732,0.00012363695597725316,184.03836487750618,COMPLETE
1887,0.4344135820865631,2023-09-04 22:21:37.277335,2023-09-04 22:21:46.046320,0 days 00:00:08.768985,ReLU,Leaky,Leaky,,37,20,22.0,24.0,,9.351241496155817e-05,3,149,0.799618899615614,0.0004582300587220006,194.06127525175978,COMPLETE
1888,0.79764324426651,2023-09-04 22:21:46.047411,2023-09-04 22:21:46.956864,0 days 00:00:00.909453,Sigmoid,Tanh,Leaky,Leaky,44,18,19.0,9.0,12.0,0.004427973282315647,4,164,0.7481378455148339,0.026276698714374002,100.81205888227983,COMPLETE
1889,0.30900269746780396,2023-09-04 22:21:46.957949,2023-09-04 22:21:50.144358,0 days 00:00:03.186409,ReLU,Leaky,ReLU,,34,23,22.0,8.0,,0.01198040102639883,3,347,0.7186641449896625,0.0003092527454185382,137.53027748575016,COMPLETE
1890,0.23659461736679077,2023-09-04 22:21:50.145443,2023-09-04 22:21:55.136322,0 days 00:00:04.990879,ReLU,Leaky,Leaky,,27,20,21.0,7.0,,0.0019404923689548897,3,186,0.7711950878563488,1.6616466844497404e-05,431.68930608575994,COMPLETE
1891,0.3360288441181183,2023-09-04 22:21:55.137471,2023-09-04 22:22:01.606601,0 days 00:00:06.469130,ReLU,Leaky,Leaky,,22,20,20.0,7.0,,0.0015798875313598087,3,197,0.7741429780508737,1.4769514018757278e-05,158.76029362090645,COMPLETE
1892,0.3390510082244873,2023-09-04 22:22:01.607708,2023-09-04 22:22:09.011960,0 days 00:00:07.404252,ReLU,Tanh,Tanh,,20,20,20.0,6.0,,0.00198395624969904,3,190,0.541561219947334,1.8766634790379403e-05,210.09286430290155,COMPLETE
1893,0.34905725717544556,2023-09-04 22:22:09.013041,2023-09-04 22:22:11.844145,0 days 00:00:02.831104,ReLU,,,,30,20,,,,0.0017193999263397798,1,201,0.7994360529833687,1.658453884191501e-05,285.4337118825605,COMPLETE
1894,0.2777588963508606,2023-09-04 22:22:11.845174,2023-09-04 22:22:19.776488,0 days 00:00:07.931314,Sigmoid,Leaky,Leaky,,23,20,20.0,6.0,,0.0021002573900550867,3,204,0.7486041503021268,1.4704562362571043e-05,187.20128086635046,COMPLETE
1895,0.4518117606639862,2023-09-04 22:22:19.777604,2023-09-04 22:22:21.075915,0 days 00:00:01.298311,ReLU,ReLU,Sigmoid,Tanh,26,20,21.0,7.0,11.0,0.0016969124317098958,4,189,0.12187560940981726,2.1559954995655985e-05,236.5960524422782,COMPLETE
1896,0.32371756434440613,2023-09-04 22:22:21.077063,2023-09-04 22:22:23.293871,0 days 00:00:02.216808,ReLU,Leaky,ReLU,,24,19,21.0,7.0,,0.002254162292566083,3,211,0.2800239013323935,1.744873628090625e-05,416.38350030147666,COMPLETE
1897,0.5545090436935425,2023-09-04 22:22:23.295042,2023-09-04 22:22:26.579037,0 days 00:00:03.283995,ReLU,Tanh,Leaky,,25,20,20.0,6.0,,0.0014723119249764373,3,196,0.3378922628989057,0.0834766264634102,294.91343610936946,COMPLETE
1898,0.35951557755470276,2023-09-04 22:22:26.580166,2023-09-04 22:22:31.035578,0 days 00:00:04.455412,Sigmoid,Leaky,Leaky,,24,19,21.0,6.0,,0.00118987352959387,3,83,0.4964523848489065,1.2302248974108857e-05,206.81942491646274,COMPLETE
1899,0.9771283864974976,2023-09-04 22:22:31.036661,2023-09-04 22:22:32.272274,0 days 00:00:01.235613,ReLU,Sigmoid,ReLU,,26,20,20.0,6.0,,0.0025150045780989827,3,185,0.772538205258,0.06206086101273867,107.43181492732121,COMPLETE
1900,0.3866315484046936,2023-09-04 22:22:32.273349,2023-09-04 22:22:39.416606,0 days 00:00:07.143257,ReLU,Leaky,Tanh,Leaky,26,19,21.0,7.0,21.0,0.002154961417310502,4,220,0.751930805914138,0.00017533157132159244,139.17591524124146,COMPLETE
1901,0.525997519493103,2023-09-04 22:22:39.417691,2023-09-04 22:22:47.425829,0 days 00:00:08.008138,Leaky,Leaky,Leaky,,27,20,20.0,7.0,,5.0338990551058656e-05,3,207,0.4002909818748046,0.00014696372423240154,177.24312123469107,COMPLETE
1902,0.523749589920044,2023-09-04 22:22:47.426970,2023-09-04 22:22:49.275863,0 days 00:00:01.848893,ReLU,Tanh,Sigmoid,,25,19,21.0,7.0,,0.09620677541122098,3,249,0.6000911634767343,0.00025337409380486,466.13392228346606,COMPLETE
1903,0.3113081455230713,2023-09-04 22:22:49.277020,2023-09-04 22:22:59.292589,0 days 00:00:10.015569,Sigmoid,Leaky,Leaky,,28,20,20.0,5.0,,0.001910517075982815,3,285,0.7214473738369015,1.425584499161552e-05,522.1134729953791,COMPLETE
1904,0.3494572639465332,2023-09-04 22:22:59.293721,2023-09-04 22:23:04.605890,0 days 00:00:05.312169,ReLU,Leaky,Leaky,,26,19,21.0,7.0,,0.0013911472690342366,3,265,0.7735311594677835,2.3693492708683655e-05,134.1917297805565,COMPLETE
1905,0.44564202427864075,2023-09-04 22:23:04.606955,2023-09-04 22:23:05.684947,0 days 00:00:01.077992,ReLU,Tanh,ReLU,ReLU,27,19,20.0,7.0,13.0,0.0025092684067112656,4,198,0.16516877235481478,0.00010566173624591401,184.07978363037108,COMPLETE
1906,0.3025549650192261,2023-09-04 22:23:05.686071,2023-09-04 22:23:09.695878,0 days 00:00:04.009807,ReLU,Leaky,,,21,20,19.0,,,0.002883327601001509,2,229,0.6736353324602486,1.1456297893368708e-05,236.5067664837015,COMPLETE
1907,0.3335232734680176,2023-09-04 22:23:09.696995,2023-09-04 22:23:11.892868,0 days 00:00:02.195873,ReLU,Leaky,Leaky,,27,20,21.0,7.0,,0.0018261681863845681,3,186,0.25904354072062324,0.012506231907707308,156.5629234796838,COMPLETE
1908,0.3301689326763153,2023-09-04 22:23:11.893926,2023-09-04 22:23:16.959382,0 days 00:00:05.065456,Tanh,ReLU,Tanh,,30,20,21.0,6.0,,0.0008901650503463685,3,213,0.7487093654496002,0.00022555638195759852,182.01045548288445,COMPLETE
1909,0.516865611076355,2023-09-04 22:23:16.960450,2023-09-04 22:23:18.191948,0 days 00:00:01.231498,Sigmoid,Leaky,Leaky,,24,19,19.0,7.0,,0.00324270013589536,3,240,0.12983282890799747,1.7841443824223332e-05,214.78938337685406,COMPLETE
1910,0.5513812899589539,2023-09-04 22:23:18.193000,2023-09-04 22:23:19.891244,0 days 00:00:01.698244,ReLU,Tanh,Sigmoid,Leaky,28,19,21.0,6.0,1.0,0.0024974269533128484,4,202,0.47888055703970633,0.00019312549782125554,173.5095952351888,COMPLETE
1911,0.297561377286911,2023-09-04 22:23:19.892324,2023-09-04 22:23:26.014283,0 days 00:00:06.121959,ReLU,Leaky,ReLU,,28,20,11.0,7.0,,0.0014046715005152253,3,387,0.7980254293112242,0.0001540786455108503,170.12421436309813,COMPLETE
1912,0.7883155941963196,2023-09-04 22:23:26.015393,2023-09-04 22:23:41.607063,0 days 00:00:15.591670,ReLU,Sigmoid,Leaky,,25,17,10.0,13.0,,1.1507757557558058e-05,3,224,0.7007328742844943,2.7626541354896928e-05,112.97894140652248,COMPLETE
1913,0.28375929594039917,2023-09-04 22:23:41.608180,2023-09-04 22:23:50.874265,0 days 00:00:09.266085,Sigmoid,Leaky,Leaky,,28,18,18.0,14.0,,0.0028402669165395883,3,213,0.770033133467628,0.0006103084460919567,181.8742139411695,COMPLETE
1914,0.5446411371231079,2023-09-04 22:23:50.875337,2023-09-04 22:23:51.831077,0 days 00:00:00.955740,ReLU,Leaky,Tanh,Sigmoid,27,19,20.0,8.0,19.0,0.0011815411714371866,4,191,0.1818224276322485,0.00013339600307515396,744.7991192725397,COMPLETE
1915,0.42544955015182495,2023-09-04 22:23:51.832194,2023-09-04 22:23:54.143201,0 days 00:00:02.311007,ReLU,Tanh,Leaky,,29,20,21.0,7.0,,0.0019582764523407,3,236,0.30373422549522067,0.006917387051579663,194.58558278401694,COMPLETE
1916,0.38894596695899963,2023-09-04 22:23:54.144258,2023-09-04 22:23:55.701638,0 days 00:00:01.557380,ReLU,Leaky,ReLU,,29,19,20.0,12.0,,0.005462979294457233,3,185,0.20842590430740518,0.0001708124781632518,238.35317387300378,COMPLETE
1917,0.4913474917411804,2023-09-04 22:23:55.702715,2023-09-04 22:23:56.918016,0 days 00:00:01.215301,ReLU,Leaky,Sigmoid,,29,20,19.0,8.0,,0.003714209432395389,3,204,0.1506388204891208,0.0004362886514494253,220.8570055280413,COMPLETE
1918,0.330811083316803,2023-09-04 22:23:56.919104,2023-09-04 22:23:58.840583,0 days 00:00:01.921479,Sigmoid,Tanh,Leaky,,27,18,5.0,24.0,,0.03909621306098204,3,92,0.2650790441849832,0.00035546739574960896,157.7421885563777,COMPLETE
1919,0.5261461138725281,2023-09-04 22:23:58.841660,2023-09-04 22:24:00.519838,0 days 00:00:01.678178,ReLU,Leaky,Leaky,Leaky,24,20,12.0,8.0,15.0,0.0017032266019464317,4,57,0.19038143309248529,2.0830417034059997e-05,119.5120745207134,COMPLETE
1920,0.3969804644584656,2023-09-04 22:24:00.520925,2023-09-04 22:24:02.799456,0 days 00:00:02.278531,ReLU,Leaky,ReLU,,30,21,21.0,8.0,,0.0034237110886841753,3,214,0.23317445287278193,0.04102490237518604,331.8232722331568,COMPLETE
1921,0.34311604499816895,2023-09-04 22:24:02.800540,2023-09-04 22:24:11.346106,0 days 00:00:08.545566,ReLU,Leaky,Leaky,,29,19,20.0,8.0,,0.0009298090590901699,3,197,0.5542087595362709,1.3096432484789095e-05,853.6447334069048,COMPLETE
1922,0.4491335451602936,2023-09-04 22:24:11.347169,2023-09-04 22:24:13.782137,0 days 00:00:02.434968,Sigmoid,Tanh,Tanh,,51,21,7.0,7.0,,0.0023266810606604373,3,50,0.7354732131166316,0.0002838684226050613,176.385528717041,COMPLETE
1923,0.3282054364681244,2023-09-04 22:24:13.783214,2023-09-04 22:24:17.266967,0 days 00:00:03.483753,ReLU,ReLU,Leaky,,45,18,21.0,6.0,,0.0012766501284271767,3,225,0.7984426429160124,9.509703986319406e-05,167.33953857421875,COMPLETE
1924,0.30467480421066284,2023-09-04 22:24:17.268042,2023-09-04 22:24:23.981087,0 days 00:00:06.713045,ReLU,Leaky,Sigmoid,Leaky,31,19,18.0,24.0,4.0,0.0026848586956911315,4,182,0.7157936508718732,0.00011441429655633603,165.51690977363177,COMPLETE
1925,0.4808575510978699,2023-09-04 22:24:23.982167,2023-09-04 22:24:25.359198,0 days 00:00:01.377031,Leaky,Sigmoid,ReLU,,26,20,11.0,13.0,,0.004331275013098755,3,295,0.16660434806292584,6.214752733180451e-05,224.62149583047895,COMPLETE
1926,0.44823750853538513,2023-09-04 22:24:25.360432,2023-09-04 22:24:30.195034,0 days 00:00:04.834602,ReLU,Leaky,Leaky,,43,18,17.0,8.0,,0.00012817450466038547,3,219,0.3174750407587924,1.6153868678063366e-05,146.0307690694452,COMPLETE
1927,0.3959006369113922,2023-09-04 22:24:30.196114,2023-09-04 22:24:35.695996,0 days 00:00:05.499882,Sigmoid,Tanh,Leaky,,55,21,20.0,7.0,,0.0007939770843449483,3,205,0.4634570014795209,0.0007833601175830439,234.93241480385385,COMPLETE
1928,0.4730440676212311,2023-09-04 22:24:35.697075,2023-09-04 22:24:40.804139,0 days 00:00:05.107064,ReLU,Leaky,Leaky,,28,20,21.0,11.0,,0.00014708074277586572,3,190,0.27865097409066814,0.030205726803137177,174.7383210834704,COMPLETE
1929,0.3638739287853241,2023-09-04 22:24:40.805233,2023-09-04 22:24:43.352854,0 days 00:00:02.547621,ReLU,Leaky,Tanh,ReLU,41,19,9.0,9.0,17.0,0.00041685981784444305,4,231,0.7998784158825014,0.017029151820294918,769.4046558498108,COMPLETE
1930,0.527866780757904,2023-09-04 22:24:43.353399,2023-09-04 22:24:43.751433,0 days 00:00:00.398034,ReLU,Leaky,ReLU,,31,13,19.0,10.0,,0.09758995041183417,3,193,0.42821219423974755,0.026007328753324965,206.14130292619978,COMPLETE
1931,0.27598267793655396,2023-09-04 22:24:43.751966,2023-09-04 22:24:44.581380,0 days 00:00:00.829414,ReLU,Tanh,Leaky,,49,17,20.0,9.0,,0.05247443471715694,3,254,0.7414760122552971,3.7073298917310584e-05,287.3589648811185,COMPLETE
1932,0.546446681022644,2023-09-04 22:24:44.581948,2023-09-04 22:24:46.170533,0 days 00:00:01.588585,Tanh,Leaky,Sigmoid,,29,12,21.0,8.0,,0.0005896047573754713,3,210,0.6435453585648296,0.00022920167828509614,443.63478069063984,COMPLETE
1933,0.2846246659755707,2023-09-04 22:24:46.171100,2023-09-04 22:24:47.132292,0 days 00:00:00.961192,Sigmoid,Leaky,Leaky,,58,19,18.0,23.0,,0.0068441449131614535,3,181,0.7706818498246155,2.7050431090413085e-05,1778.8253578975282,COMPLETE
1934,0.298435777425766,2023-09-04 22:24:47.132828,2023-09-04 22:24:48.653594,0 days 00:00:01.520766,ReLU,Tanh,ReLU,Tanh,31,20,8.0,16.0,8.0,0.0034258713208890528,4,245,0.6889734248020238,4.109914818203277e-05,120.93177783300006,COMPLETE
1935,0.41788920760154724,2023-09-04 22:24:48.654197,2023-09-04 22:24:48.889954,0 days 00:00:00.235757,ReLU,Leaky,Leaky,,46,20,21.0,7.0,,0.044335207389987336,3,73,0.11214179344092792,8.020397908029339e-05,166.57953135172525,COMPLETE
1936,0.28513213992118835,2023-09-04 22:24:48.890608,2023-09-04 22:24:50.707464,0 days 00:00:01.816856,ReLU,ReLU,Tanh,,43,18,19.0,24.0,,0.0010854579865055298,3,273,0.745821321607828,0.00020336357748665054,461.44148150694025,COMPLETE
1937,0.28863611817359924,2023-09-04 22:24:50.708018,2023-09-04 22:24:53.604278,0 days 00:00:02.896260,Sigmoid,Leaky,Leaky,,25,21,22.0,8.0,,0.0021217019751338458,3,220,0.769951357631641,1.1516458282610692e-05,203.08196137330242,COMPLETE
1938,1.1279674768447876,2023-09-04 22:24:53.604823,2023-09-04 22:24:54.237910,0 days 00:00:00.633087,ReLU,Sigmoid,Sigmoid,Leaky,22,19,10.0,9.0,20.0,0.004885369768618432,4,199,0.5798674738147767,0.07732403365670872,101.22231006622314,COMPLETE
1939,0.31528598070144653,2023-09-04 22:24:54.238446,2023-09-04 22:24:55.122802,0 days 00:00:00.884356,ReLU,Leaky,Leaky,,27,18,21.0,5.0,,0.006196801070533591,3,427,0.7173385997555976,0.00016584951611800373,149.6888458251953,COMPLETE
1940,0.418478399515152,2023-09-04 22:24:55.123340,2023-09-04 22:24:56.304264,0 days 00:00:01.180924,ReLU,Tanh,ReLU,,32,20,20.0,7.0,,0.0015915550264075469,3,233,0.6674431922811634,0.02111649783134206,170.97453587849935,COMPLETE
1941,0.36603662371635437,2023-09-04 22:24:56.304780,2023-09-04 22:24:57.263988,0 days 00:00:00.959208,ReLU,Leaky,Leaky,,41,19,2.0,23.0,,0.0029258855278525833,3,210,0.7702085025567296,2.2762696481303942e-05,365.0817874085669,COMPLETE
1942,1.0105301141738892,2023-09-04 22:24:57.264542,2023-09-04 22:24:59.545139,0 days 00:00:02.280597,Sigmoid,Leaky,Leaky,,29,11,16.0,8.0,,1.8076456014234953e-05,3,178,0.2933646723506083,3.0515001752257026e-05,116.23003987515911,COMPLETE
