number,value,datetime_start,datetime_complete,duration,params_activation1,params_activation2,params_activation3,params_activation4,params_batch_size,params_fl1,params_fl2,params_fl3,params_fl4,params_learning_rate,params_n_layers,params_num_epochs,params_train_size,params_weight_decay,user_attrs_mre,state
188,0.33301615715026855,2023-09-04 21:54:01.024232,2023-09-04 21:54:01.565674,0 days 00:00:00.541442,ReLU,Tanh,Tanh,Sigmoid,98,24,14.0,5.0,20.0,0.00654460360220127,4,199,0.6643274409300626,1.960821257623027e-05,87.4148300433981,COMPLETE
189,0.3477456569671631,2023-09-04 21:54:01.565979,2023-09-04 21:54:03.570042,0 days 00:00:02.004063,Sigmoid,ReLU,ReLU,,14,21,15.0,8.0,,0.004398969634771412,3,378,0.7585238754504018,1.4160300975236971e-05,101.58710388183594,COMPLETE
190,0.31929442286491394,2023-09-04 21:54:03.570338,2023-09-04 21:54:04.298559,0 days 00:00:00.728221,Tanh,Tanh,Tanh,,58,22,16.0,20.0,,0.0022340075953687028,3,218,0.6852668531186707,4.61817029349128e-05,95.44013570970104,COMPLETE
191,0.3283366560935974,2023-09-04 21:54:04.298860,2023-09-04 21:54:05.209927,0 days 00:00:00.911067,Leaky,ReLU,Tanh,,100,19,13.0,23.0,,0.0013628165337238863,3,178,0.7311170660034799,1.0033359714303344e-05,104.71522595332219,COMPLETE
192,0.3149687647819519,2023-09-04 21:54:05.210229,2023-09-04 21:54:05.427009,0 days 00:00:00.216780,ReLU,ReLU,Tanh,,97,20,14.0,24.0,,0.03063613324802062,3,205,0.7398677526768423,1.347401403383652e-05,103.38477034795852,COMPLETE
193,0.2817505896091461,2023-09-04 21:54:05.427314,2023-09-04 21:54:05.688856,0 days 00:00:00.261542,Leaky,ReLU,Tanh,,94,19,14.0,15.0,,0.026263452039183226,3,232,0.7555158343890751,1.6347059906171516e-05,79.86770141601562,COMPLETE
194,0.3286602795124054,2023-09-04 21:54:05.689155,2023-09-04 21:54:06.389075,0 days 00:00:00.699920,Tanh,ReLU,Tanh,,94,5,15.0,14.0,,0.015220379543096818,3,231,0.7623800960037435,2.1167712866015664e-05,94.61817169189453,COMPLETE
195,0.3402821123600006,2023-09-04 21:54:06.389377,2023-09-04 21:54:06.583708,0 days 00:00:00.194331,Leaky,ReLU,Tanh,,91,11,13.0,16.0,,0.03440810946652154,3,240,0.7085741367461168,2.9734350077662815e-05,89.37827702572471,COMPLETE
196,0.3585708737373352,2023-09-04 21:54:06.584013,2023-09-04 21:54:06.936258,0 days 00:00:00.352245,Leaky,Tanh,Sigmoid,,88,18,14.0,15.0,,0.009870092963361313,3,265,0.5294397712623069,1.6434250264759066e-05,118.77515759675398,COMPLETE
197,0.3093484342098236,2023-09-04 21:54:06.936566,2023-09-04 21:54:07.513461,0 days 00:00:00.576895,Leaky,Leaky,Tanh,,93,20,8.0,15.0,,0.0025454311871312934,3,250,0.76882677232228,2.4459530090346032e-05,109.44373461405436,COMPLETE
198,0.3200806975364685,2023-09-04 21:54:07.513778,2023-09-04 21:54:07.729175,0 days 00:00:00.215397,ReLU,ReLU,ReLU,,95,19,13.0,10.0,,0.05051809614910479,3,226,0.336211837924789,3.644587525710318e-05,108.76531566273083,COMPLETE
199,0.33058708906173706,2023-09-04 21:54:07.729484,2023-09-04 21:54:08.608734,0 days 00:00:00.879250,Tanh,Tanh,Tanh,,86,17,17.0,13.0,,0.0007545367610787248,3,276,0.7990459793022753,1.215745160861926e-05,130.73441709955054,COMPLETE
200,0.3035321533679962,2023-09-04 21:54:08.609035,2023-09-04 21:54:09.717794,0 days 00:00:01.108759,ReLU,ReLU,Tanh,Sigmoid,11,12,15.0,11.0,3.0,0.023157278939354348,4,356,0.7119146576929101,1.7564599889602477e-05,117.91536827087403,COMPLETE
201,0.27959153056144714,2023-09-04 21:54:09.718107,2023-09-04 21:54:10.086705,0 days 00:00:00.368598,Leaky,ReLU,Tanh,,99,19,14.0,19.0,,0.024481191889015298,3,214,0.7401739452477778,1.4303720590021453e-05,83.36613444278115,COMPLETE
202,0.3154105842113495,2023-09-04 21:54:10.087021,2023-09-04 21:54:10.675677,0 days 00:00:00.588656,Leaky,ReLU,Tanh,,96,20,14.0,19.0,,0.029413595912928713,3,214,0.7424725239606528,1.176071755586016e-05,104.25713678995768,COMPLETE
203,0.32628732919692993,2023-09-04 21:54:10.676198,2023-09-04 21:54:11.524092,0 days 00:00:00.847894,Leaky,ReLU,Tanh,,92,19,14.0,17.0,,0.018655455805498447,3,234,0.761038435956709,1.5216223859933869e-05,91.44264399210611,COMPLETE
204,0.28037944436073303,2023-09-04 21:54:11.524601,2023-09-04 21:54:12.105462,0 days 00:00:00.580861,Leaky,ReLU,Tanh,,99,21,15.0,20.0,,0.04223377197523388,3,256,0.6822955266446697,2.0197831283765334e-05,98.83283432670261,COMPLETE
205,0.3141125440597534,2023-09-04 21:54:12.105966,2023-09-04 21:54:12.682823,0 days 00:00:00.576857,Leaky,ReLU,,,99,21,9.0,,,0.04031591493092283,2,257,0.6835588408283065,2.0054733889282236e-05,126.94756183624267,COMPLETE
206,0.3251761496067047,2023-09-04 21:54:12.683123,2023-09-04 21:54:12.963336,0 days 00:00:00.280213,Leaky,Tanh,ReLU,,90,22,13.0,19.0,,0.03567206586080145,3,245,0.6387439283466687,0.003788849548213364,260.5955564437374,COMPLETE
207,0.31433534622192383,2023-09-04 21:54:12.963652,2023-09-04 21:54:13.335604,0 days 00:00:00.371952,Tanh,Tanh,Tanh,,94,23,12.0,20.0,,0.057861120108857744,3,266,0.6605153166607866,5.934407183590866e-05,115.16865612211681,COMPLETE
208,0.35191115736961365,2023-09-04 21:54:13.335933,2023-09-04 21:54:13.607894,0 days 00:00:00.271961,ReLU,ReLU,Tanh,,100,21,16.0,21.0,,0.04843255237841445,3,236,0.5801295837997752,3.013305036750822e-05,123.8525161743164,COMPLETE
209,0.3686966300010681,2023-09-04 21:54:13.608221,2023-09-04 21:54:13.934201,0 days 00:00:00.325980,Tanh,Tanh,Tanh,,97,22,15.0,20.0,,0.02871489321094169,3,252,0.7091633557858997,0.011067676016071391,188.47699105398996,COMPLETE
210,0.33499816060066223,2023-09-04 21:54:13.934509,2023-09-04 21:54:14.736810,0 days 00:00:00.802301,Sigmoid,ReLU,ReLU,,89,21,14.0,18.0,,0.0071928674201114,3,334,0.5164841060082218,2.4796599142030864e-05,105.34606784885213,COMPLETE
211,0.3149687945842743,2023-09-04 21:54:14.737127,2023-09-04 21:54:14.950491,0 days 00:00:00.213364,Leaky,ReLU,Tanh,,99,20,15.0,21.0,,0.021284507230715982,3,215,0.7712665555443837,1.4799085510035757e-05,91.16192436218262,COMPLETE
212,0.2886843979358673,2023-09-04 21:54:14.950809,2023-09-04 21:54:15.367387,0 days 00:00:00.416578,Leaky,ReLU,Tanh,,98,18,15.0,22.0,,0.039397368220356464,3,225,0.7346246143257388,1.8286561063118407e-05,107.55249942432751,COMPLETE
213,0.33034685254096985,2023-09-04 21:54:15.367709,2023-09-04 21:54:15.626103,0 days 00:00:00.258394,Leaky,ReLU,Tanh,,95,18,14.0,22.0,,0.04086735604005101,3,228,0.4798893582604313,1.943071861143568e-05,129.7045385898688,COMPLETE
214,0.302595853805542,2023-09-04 21:54:15.626436,2023-09-04 21:54:16.216159,0 days 00:00:00.589723,Leaky,ReLU,Tanh,,97,18,15.0,10.0,,0.005872027685207183,3,243,0.7309025360830531,4.722830755290528e-05,96.01636117788462,COMPLETE
215,0.3028510510921478,2023-09-04 21:54:16.216478,2023-09-04 21:54:16.444459,0 days 00:00:00.227981,Leaky,ReLU,Tanh,,92,19,14.0,21.0,,0.034080518467961306,3,222,0.6876686884992622,0.0005813647042789106,105.68433844524881,COMPLETE
216,0.35726404190063477,2023-09-04 21:54:16.444768,2023-09-04 21:54:16.859534,0 days 00:00:00.414766,Tanh,Sigmoid,Leaky,,94,17,20.0,21.0,,0.04393310457812164,3,259,0.7299288681442003,1.0099798381670107e-05,101.42585424943404,COMPLETE
217,0.27419203519821167,2023-09-04 21:54:16.859860,2023-09-04 21:54:17.228667,0 days 00:00:00.368807,ReLU,Tanh,Tanh,,98,18,9.0,9.0,,0.025889965023791813,3,235,0.7997951407205895,3.454994245516339e-05,81.72250283730996,COMPLETE
218,0.4156772494316101,2023-09-04 21:54:17.228982,2023-09-04 21:54:17.341159,0 days 00:00:00.112177,Leaky,Tanh,Tanh,,98,17,9.0,22.0,,0.025815188696242403,3,275,0.16408457415864766,3.752187404245922e-05,99.42460545131138,COMPLETE
219,0.34936463832855225,2023-09-04 21:54:17.341466,2023-09-04 21:54:17.539118,0 days 00:00:00.197652,ReLU,Leaky,ReLU,,100,18,16.0,9.0,,0.030937863428330912,3,248,0.7438745524236055,2.6933324773323125e-05,101.01140072471217,COMPLETE
220,0.3329252600669861,2023-09-04 21:54:17.539444,2023-09-04 21:54:17.736272,0 days 00:00:00.196828,Tanh,ReLU,,,96,24,13.0,,,0.06333610119095338,2,234,0.7059413245970877,2.2405454523406437e-05,99.55715942382812,COMPLETE
221,0.35522332787513733,2023-09-04 21:54:17.736580,2023-09-04 21:54:19.167459,0 days 00:00:01.430879,ReLU,Tanh,Tanh,,12,15,10.0,10.0,,0.0031665438268759843,3,227,0.7978777129718488,3.298091598000974e-05,103.75608753022694,COMPLETE
222,0.3351055085659027,2023-09-04 21:54:19.167972,2023-09-04 21:54:20.133097,0 days 00:00:00.965125,ReLU,Tanh,Tanh,,98,19,8.0,9.0,,0.024906444331887396,3,240,0.7727114799594916,0.008612609012959073,95.67578442891438,COMPLETE
223,0.33290785551071167,2023-09-04 21:54:20.133411,2023-09-04 21:54:21.074195,0 days 00:00:00.940784,ReLU,Tanh,Tanh,,10,19,9.0,12.0,,0.011662530157890365,3,217,0.7725170827220365,1.2754362935307313e-05,99.21023649327896,COMPLETE
224,0.32151463627815247,2023-09-04 21:54:21.074510,2023-09-04 21:54:21.526781,0 days 00:00:00.452271,ReLU,Tanh,Tanh,,24,18,14.0,14.0,,0.0364638318816634,3,251,0.7272056339045465,1.750198863521856e-05,101.72589959038629,COMPLETE
225,0.35058948397636414,2023-09-04 21:54:21.527091,2023-09-04 21:54:21.671813,0 days 00:00:00.144722,ReLU,Tanh,Tanh,,87,16,7.0,8.0,,0.031398253246447655,3,260,0.4412549263531455,0.00016289685347221523,147.49900416324013,COMPLETE
226,0.32102882862091064,2023-09-04 21:54:21.672139,2023-09-04 21:54:22.557030,0 days 00:00:00.884891,Tanh,Tanh,Tanh,ReLU,95,20,11.0,6.0,10.0,0.017030235689051113,4,205,0.7425530493220928,3.926761252516408e-05,93.4224023992365,COMPLETE
227,0.3322920799255371,2023-09-04 21:54:22.557567,2023-09-04 21:54:23.593819,0 days 00:00:01.036252,ReLU,ReLU,ReLU,,92,23,13.0,7.0,,0.00894955392939182,3,232,0.7977343766617433,1.4027881561268085e-05,105.71877016339984,COMPLETE
228,0.3455407917499542,2023-09-04 21:54:23.594133,2023-09-04 21:54:23.851462,0 days 00:00:00.257329,Leaky,Tanh,Tanh,,96,18,15.0,4.0,,0.04607840328508676,3,223,0.6810429959992965,0.00010639683209500328,113.47829873221261,COMPLETE
229,0.33264100551605225,2023-09-04 21:54:23.851790,2023-09-04 21:54:24.165147,0 days 00:00:00.313357,Tanh,ReLU,Tanh,,90,18,9.0,22.0,,0.023149854919669616,3,242,0.7645152306873862,5.16694726923809e-05,97.25855458577475,COMPLETE
230,0.3366624414920807,2023-09-04 21:54:24.165477,2023-09-04 21:54:24.383465,0 days 00:00:00.217988,ReLU,,,,99,19,,,,0.03974492009648359,1,268,0.714067517592358,8.305051936746388e-05,104.59399604797363,COMPLETE
231,0.3724929392337799,2023-09-04 21:54:24.383777,2023-09-04 21:54:25.343023,0 days 00:00:00.959246,Leaky,ReLU,Tanh,,98,20,15.0,20.0,,0.015405875770489116,3,199,0.7628454900397106,1.7860968516642376e-05,95.05741846838663,COMPLETE
232,0.3371966481208801,2023-09-04 21:54:25.343541,2023-09-04 21:54:25.981078,0 days 00:00:00.637537,Leaky,ReLU,Tanh,,97,20,14.0,9.0,,0.0274859293800823,3,213,0.7745720000429419,1.5881495400397902e-05,95.78985233306885,COMPLETE
233,0.3463098406791687,2023-09-04 21:54:25.981376,2023-09-04 21:54:26.182937,0 days 00:00:00.201561,Leaky,ReLU,Tanh,,100,19,16.0,10.0,,0.020982413946515777,3,210,0.7444520177722963,1.1517335190284503e-05,101.02363706889905,COMPLETE
234,0.2675718367099762,2023-09-04 21:54:26.183255,2023-09-04 21:54:26.733862,0 days 00:00:00.550607,Leaky,ReLU,Tanh,,27,22,15.0,23.0,,0.013232790531994774,3,196,0.799629481962272,2.181433494255583e-05,85.15315827869233,COMPLETE
235,0.3044161796569824,2023-09-04 21:54:26.734189,2023-09-04 21:54:27.634943,0 days 00:00:00.900754,Leaky,ReLU,Tanh,,17,22,14.0,23.0,,0.012302010433043473,3,256,0.7967106891381778,2.194228870346687e-05,111.47487958272298,COMPLETE
236,0.3849955201148987,2023-09-04 21:54:27.635278,2023-09-04 21:54:28.693134,0 days 00:00:01.057856,Sigmoid,Tanh,Tanh,,93,21,15.0,23.0,,0.0015803253307885069,3,191,0.4161186905605172,0.00022465598893784785,124.03494809934607,COMPLETE
237,0.27340012788772583,2023-09-04 21:54:28.693449,2023-09-04 21:54:29.152946,0 days 00:00:00.459497,Tanh,ReLU,ReLU,,41,22,10.0,22.0,,0.008046576027348842,3,236,0.7428994681299061,3.0138744248152177e-05,91.35472341684195,COMPLETE
238,0.3205413222312927,2023-09-04 21:54:29.153252,2023-09-04 21:54:33.020155,0 days 00:00:03.866903,Tanh,ReLU,ReLU,,33,22,12.0,22.0,,0.005982037459746947,3,248,0.698395604034744,3.171432862437893e-05,88.52953546697444,COMPLETE
239,0.3970022201538086,2023-09-04 21:54:33.020672,2023-09-04 21:54:45.792539,0 days 00:00:12.771867,Tanh,ReLU,ReLU,,31,23,10.0,22.0,,3.1927066480568454e-05,3,236,0.6615700427316733,2.7384502409574864e-05,108.2883879128149,COMPLETE
240,0.29463136196136475,2023-09-04 21:54:45.793070,2023-09-04 21:54:47.397887,0 days 00:00:01.604817,Tanh,ReLU,ReLU,,41,22,10.0,21.0,,0.013748171746540784,3,223,0.7361391748175623,4.257766032990566e-05,109.79858756065369,COMPLETE
241,0.36252984404563904,2023-09-04 21:54:47.398420,2023-09-04 21:54:49.331379,0 days 00:00:01.932959,Tanh,ReLU,ReLU,,37,24,15.0,23.0,,0.009922871258871273,3,231,0.7690314378284218,0.03635879678436514,149.5494546329274,COMPLETE
242,0.26256585121154785,2023-09-04 21:54:49.331913,2023-09-04 21:54:52.794884,0 days 00:00:03.462971,Tanh,Tanh,Sigmoid,,28,22,11.0,16.0,,0.004279073830800054,3,242,0.799564095657181,3.365088910404283e-05,98.16823498408,COMPLETE
243,0.33682048320770264,2023-09-04 21:54:52.795404,2023-09-04 21:54:54.765634,0 days 00:00:01.970230,Tanh,ReLU,Sigmoid,,27,22,10.0,16.0,,0.004464429432307789,3,262,0.7439441003872894,3.5250946776836146e-05,97.14557139078777,COMPLETE
244,0.3765157461166382,2023-09-04 21:54:54.765953,2023-09-04 21:54:55.103117,0 days 00:00:00.337164,Tanh,Tanh,Sigmoid,,27,23,10.0,15.0,,0.0027421404787783587,3,417,0.23595421835687283,2.5585133079292652e-05,128.12395421470083,COMPLETE
245,0.2677561342716217,2023-09-04 21:54:55.103535,2023-09-04 21:54:56.086273,0 days 00:00:00.982738,Tanh,ReLU,ReLU,,40,22,11.0,16.0,,0.003608950660930936,3,245,0.7148646615660859,3.2834573163439844e-05,103.97531331380209,COMPLETE
246,0.3062882423400879,2023-09-04 21:54:56.086577,2023-09-04 21:54:56.629862,0 days 00:00:00.543285,Tanh,ReLU,Sigmoid,,41,22,12.0,16.0,,0.004526414898399237,3,245,0.7085791416203816,3.140955652781095e-05,106.56058132287228,COMPLETE
247,0.29503852128982544,2023-09-04 21:54:56.630176,2023-09-04 21:54:57.728531,0 days 00:00:01.098355,Tanh,Tanh,ReLU,,45,22,11.0,6.0,,0.004048998269455123,3,257,0.7973387235403192,4.38518961461491e-05,90.76958315300219,COMPLETE
248,0.3531365990638733,2023-09-04 21:54:57.728835,2023-09-04 21:54:58.383814,0 days 00:00:00.654979,Tanh,Leaky,Sigmoid,,36,23,11.0,17.0,,0.003344777552431445,3,269,0.3264426219016298,3.635601568594271e-05,310.01629899677476,COMPLETE
249,0.306746244430542,2023-09-04 21:54:58.384121,2023-09-04 21:54:59.279229,0 days 00:00:00.895108,Leaky,ReLU,,,29,13,11.0,,,0.0028633603945658367,2,241,0.7439096702039947,2.867941603042521e-05,99.86154842376709,COMPLETE
250,0.30220744013786316,2023-09-04 21:54:59.279558,2023-09-04 21:55:00.533361,0 days 00:00:01.253803,Tanh,Tanh,ReLU,,41,23,12.0,22.0,,0.0050568505255771164,3,254,0.771564856842813,6.490658931144042e-05,89.66118644265568,COMPLETE
251,0.31110867857933044,2023-09-04 21:55:00.533875,2023-09-04 21:55:00.922461,0 days 00:00:00.388586,Tanh,ReLU,ReLU,,39,22,14.0,18.0,,0.03558629655911553,3,248,0.4851745001730075,2.2237723144953868e-05,111.2614109205163,COMPLETE
252,0.2770938575267792,2023-09-04 21:55:00.922767,2023-09-04 21:55:01.623910,0 days 00:00:00.701143,Leaky,Tanh,ReLU,Leaky,39,21,14.0,16.0,13.0,0.0035210878264075366,4,276,0.721037338528417,0.0003201167022751668,98.04643184116908,COMPLETE
253,0.3153289556503296,2023-09-04 21:55:01.624221,2023-09-04 21:55:02.699761,0 days 00:00:01.075540,Leaky,Tanh,ReLU,,37,21,13.0,16.0,,0.003310756913940106,3,63,0.7209114173288305,5.273318223543063e-05,92.79739179767546,COMPLETE
254,0.3291358947753906,2023-09-04 21:55:02.700064,2023-09-04 21:55:03.305855,0 days 00:00:00.605791,Leaky,ReLU,ReLU,,44,21,11.0,15.0,,0.0036333177607489717,3,235,0.7501913279931339,0.00041668249703875947,137.52239227294922,COMPLETE
255,0.32213863730430603,2023-09-04 21:55:03.306152,2023-09-04 21:55:04.640151,0 days 00:00:01.333999,Leaky,Tanh,ReLU,,33,24,13.0,21.0,,0.002591431117865308,3,387,0.77226812421268,0.0009536224446974943,93.29032264122596,COMPLETE
256,0.284490704536438,2023-09-04 21:55:04.640645,2023-09-04 21:55:05.788193,0 days 00:00:01.147548,Leaky,ReLU,Sigmoid,,40,22,12.0,17.0,,0.007213146045691493,3,223,0.7987066832234436,0.00017703163016737303,103.64165472605872,COMPLETE
257,0.3192223012447357,2023-09-04 21:55:05.788499,2023-09-04 21:55:06.385242,0 days 00:00:00.596743,Leaky,Tanh,Sigmoid,,40,22,12.0,17.0,,0.006500679378437704,3,241,0.7997794220539926,0.00017962375179899988,105.87398290634155,COMPLETE
258,0.3674299716949463,2023-09-04 21:55:06.385558,2023-09-04 21:55:07.104560,0 days 00:00:00.719002,Leaky,Sigmoid,ReLU,,42,22,12.0,16.0,,0.007708756679831707,3,204,0.7999759837797881,0.00015767335097032574,98.77724628448486,COMPLETE
259,0.33252114057540894,2023-09-04 21:55:07.104859,2023-09-04 21:55:08.524700,0 days 00:00:01.419841,Sigmoid,ReLU,Sigmoid,Leaky,40,21,11.0,16.0,13.0,0.005258178818546958,4,252,0.3852995403089202,6.791000158478435e-05,688.7201044096364,COMPLETE
260,0.3395596742630005,2023-09-04 21:55:08.525023,2023-09-04 21:55:09.042326,0 days 00:00:00.517303,Leaky,Tanh,Sigmoid,,39,22,12.0,17.0,,0.005903620125707562,3,218,0.4976941986843046,0.0005583279499758374,110.07349359421502,COMPLETE
261,0.35426080226898193,2023-09-04 21:55:09.042663,2023-09-04 21:55:12.092829,0 days 00:00:03.050166,Leaky,ReLU,Sigmoid,,21,23,4.0,16.0,,0.003966326154238206,3,282,0.7603985894746579,0.0003014694111303282,101.45523803710938,COMPLETE
262,0.33781197667121887,2023-09-04 21:55:12.093350,2023-09-04 21:55:12.953155,0 days 00:00:00.859805,ReLU,Leaky,,,43,21,14.0,,,0.008399204073549037,2,231,0.3636185815337329,0.0002098340989502916,109.21954905986786,COMPLETE
263,0.2833506464958191,2023-09-04 21:55:12.953453,2023-09-04 21:55:15.028619,0 days 00:00:02.075166,Tanh,Tanh,Sigmoid,,34,23,13.0,15.0,,0.0039449484394498795,3,368,0.6949113232328822,0.00011850479969417183,92.48144837998852,COMPLETE
264,0.31684112548828125,2023-09-04 21:55:15.028923,2023-09-04 21:55:16.189909,0 days 00:00:01.160986,Tanh,Tanh,Sigmoid,,44,23,13.0,15.0,,0.004108385003550179,3,366,0.6050473910359804,0.0002827637992665306,107.02901626419235,COMPLETE
265,0.2950091063976288,2023-09-04 21:55:16.190216,2023-09-04 21:55:16.761750,0 days 00:00:00.571534,Tanh,ReLU,Sigmoid,,36,24,13.0,15.0,,0.005105964568275351,3,365,0.6948892665446548,0.00014069128563004484,96.44847798347473,COMPLETE
266,0.3432937264442444,2023-09-04 21:55:16.762055,2023-09-04 21:55:17.582889,0 days 00:00:00.820834,Tanh,Tanh,ReLU,,34,23,13.0,17.0,,0.00355011961413422,3,189,0.6615034581445657,0.00018716915069698147,101.55134403959234,COMPLETE
267,0.299064964056015,2023-09-04 21:55:17.583191,2023-09-04 21:55:19.745398,0 days 00:00:02.162207,Tanh,ReLU,Sigmoid,,38,24,14.0,8.0,,0.0029995920907384096,3,374,0.7166113309939725,4.1995496743358436e-05,97.47562343318288,COMPLETE
268,0.3815361261367798,2023-09-04 21:55:19.745931,2023-09-04 21:55:20.781627,0 days 00:00:01.035696,Tanh,Tanh,Sigmoid,,35,22,12.0,20.0,,0.002475840733495612,3,393,0.6859722178419029,0.00024214996581001095,113.35272802308549,COMPLETE
269,0.3538443148136139,2023-09-04 21:55:20.781964,2023-09-04 21:55:20.939824,0 days 00:00:00.157860,Leaky,ReLU,Leaky,,39,22,9.0,19.0,,0.007183053889276187,3,354,0.11025267373247387,0.0001370275957188826,213.50106923173112,COMPLETE
270,0.34517109394073486,2023-09-04 21:55:20.940140,2023-09-04 21:55:23.483496,0 days 00:00:02.543356,Tanh,Tanh,Sigmoid,,32,11,13.0,15.0,,0.0019961552889376528,3,261,0.6325774557725822,8.005146951290572e-05,104.48831870786606,COMPLETE
271,0.35855644941329956,2023-09-04 21:55:23.483811,2023-09-04 21:55:26.589656,0 days 00:00:03.105845,Leaky,ReLU,ReLU,,25,24,11.0,16.0,,0.000408420649508245,3,333,0.7218955269125631,9.862544795669092e-05,105.24061979864635,COMPLETE
272,0.34902799129486084,2023-09-04 21:55:26.589968,2023-09-04 21:55:27.298497,0 days 00:00:00.708529,Tanh,Tanh,Sigmoid,,43,23,14.0,18.0,,0.004551654507025015,3,243,0.46989280580319925,0.00011838271556287006,148.50773326328823,COMPLETE
273,0.35992884635925293,2023-09-04 21:55:27.298808,2023-09-04 21:55:28.337904,0 days 00:00:01.039096,Sigmoid,ReLU,Tanh,,72,7,14.0,14.0,,0.0035795930017188554,3,341,0.7522228366068707,0.0001049299861872007,130.8601417541504,COMPLETE
274,0.30387941002845764,2023-09-04 21:55:28.338208,2023-09-04 21:55:29.126530,0 days 00:00:00.788322,Tanh,Tanh,ReLU,,46,22,12.0,17.0,,0.005867634989943208,3,274,0.7064179719282024,9.04822013938713e-05,103.50785799893465,COMPLETE
275,0.30294227600097656,2023-09-04 21:55:29.126841,2023-09-04 21:55:29.620004,0 days 00:00:00.493163,Leaky,Leaky,Tanh,,38,23,13.0,9.0,,0.026975420302645464,3,403,0.5732982060861428,2.304028478659316e-05,81.89997227986653,COMPLETE
276,0.30100217461586,2023-09-04 21:55:29.620310,2023-09-04 21:55:30.208267,0 days 00:00:00.587957,Tanh,ReLU,Tanh,,28,21,16.0,7.0,,0.007276196476663121,3,252,0.5332893122351294,4.815270146743745e-05,97.0475222269694,COMPLETE
277,0.3258853256702423,2023-09-04 21:55:30.208602,2023-09-04 21:55:30.766994,0 days 00:00:00.558392,Leaky,Tanh,ReLU,Leaky,30,22,15.0,23.0,19.0,0.029182893260820846,4,210,0.4219689830375299,0.0001293363253684193,195.56248219807944,COMPLETE
278,0.37739139795303345,2023-09-04 21:55:30.767320,2023-09-04 21:55:31.795638,0 days 00:00:01.028318,Tanh,ReLU,Tanh,,35,23,14.0,13.0,,0.00020065576738999182,3,262,0.1945983257529784,0.00040321330192405377,114.74318802292282,COMPLETE
279,0.37727391719818115,2023-09-04 21:55:31.795954,2023-09-04 21:55:32.202136,0 days 00:00:00.406182,Tanh,Tanh,Tanh,,52,12,13.0,24.0,,0.004316345771383499,3,179,0.37388825647508495,5.7468660301196905e-05,111.71717517780807,COMPLETE
280,0.31113094091415405,2023-09-04 21:55:32.202452,2023-09-04 21:55:34.121908,0 days 00:00:01.919456,Leaky,ReLU,ReLU,,40,22,15.0,19.0,,0.0005470174392222405,3,424,0.7607981721654444,0.00011351121727333117,100.6356930432019,COMPLETE
281,0.3512905538082123,2023-09-04 21:55:34.122226,2023-09-04 21:55:35.419966,0 days 00:00:01.297740,Tanh,Tanh,Tanh,,95,24,11.0,8.0,,0.0008872433680201671,3,410,0.680566421755115,3.494549074103323e-05,112.59021759033203,COMPLETE
