number,value,datetime_start,datetime_complete,duration,params_activation1,params_activation2,params_activation3,params_activation4,params_batch_size,params_fl1,params_fl2,params_fl3,params_fl4,params_learning_rate,params_n_layers,params_num_epochs,params_train_size,params_weight_decay,user_attrs_mre,state
846,0.32508584856987,2023-09-04 21:43:35.844825,2023-09-04 21:43:37.296550,0 days 00:00:01.451725,ReLU,Sigmoid,,,29,11,14.0,,,0.0014630676689683234,2,437,0.6723958848459873,0.0011770683102063821,90.64100990714607,COMPLETE
847,0.2906573712825775,2023-09-04 21:43:37.296926,2023-09-04 21:43:40.885402,0 days 00:00:03.588476,ReLU,Sigmoid,,,31,12,16.0,,,0.0006474611604577588,2,350,0.7041659490099299,0.0008175735033658117,110.48055011929361,COMPLETE
848,0.3731229305267334,2023-09-04 21:43:40.885764,2023-09-04 21:43:43.238552,0 days 00:00:02.352788,ReLU,Sigmoid,,,28,12,17.0,,,0.00047364856494689126,2,338,0.5745432784167419,0.00012324947920879743,108.30504341802653,COMPLETE
849,0.40318650007247925,2023-09-04 21:43:43.238924,2023-09-04 21:43:44.452066,0 days 00:00:01.213142,ReLU,Sigmoid,,,34,11,16.0,,,0.0004427381984705335,2,398,0.15394890750409204,9.729737793717549e-05,127.75522848617199,COMPLETE
850,0.39128974080085754,2023-09-04 21:43:44.452444,2023-09-04 21:43:48.896378,0 days 00:00:04.443934,ReLU,Sigmoid,,,29,11,15.0,,,0.00013368367140027636,2,421,0.4191654570115122,0.0006792810160831379,101.23368831824803,COMPLETE
851,0.34297963976860046,2023-09-04 21:43:48.896766,2023-09-04 21:43:52.893311,0 days 00:00:03.996545,ReLU,Sigmoid,,,17,10,17.0,,,0.0005288602452945735,2,366,0.6201857997557105,0.00015178321166804578,104.69852987512365,COMPLETE
852,0.358708918094635,2023-09-04 21:43:52.893687,2023-09-04 21:43:56.007327,0 days 00:00:03.113640,ReLU,Sigmoid,,,65,12,16.0,,,0.00037994671744428664,2,356,0.7999002970673428,0.0005032741615475259,108.7253581132039,COMPLETE
853,0.33190637826919556,2023-09-04 21:43:56.007700,2023-09-04 21:44:00.687604,0 days 00:00:04.679904,ReLU,Sigmoid,,,31,13,15.0,,,0.0002245716731151993,2,409,0.7552434543898785,3.0480683484008322e-05,163.9423589204487,COMPLETE
854,0.4122633635997772,2023-09-04 21:44:00.687998,2023-09-04 21:44:01.907247,0 days 00:00:01.219249,Sigmoid,Sigmoid,,,20,11,13.0,,,0.0023267310094495053,2,309,0.20274031385273908,0.00022362632398524577,258.25197749546595,COMPLETE
855,0.38444796204566956,2023-09-04 21:44:01.907632,2023-09-04 21:44:02.650257,0 days 00:00:00.742625,ReLU,Sigmoid,,,96,12,14.0,,,0.0015437042143542398,2,319,0.3273570422938223,0.028634929231568722,112.5832236039011,COMPLETE
856,0.34298235177993774,2023-09-04 21:44:02.650722,2023-09-04 21:44:08.347954,0 days 00:00:05.697232,ReLU,Sigmoid,,,18,10,16.0,,,0.000255256644871011,2,384,0.7299507334040466,1.2976247884154144e-05,153.9097098634954,COMPLETE
857,0.3392414450645447,2023-09-04 21:44:08.348321,2023-09-04 21:44:12.814976,0 days 00:00:04.466655,Leaky,ReLU,,,22,11,17.0,,,0.00039908596424063594,2,430,0.6637224507600493,6.215553837696344e-05,258.6881969158466,COMPLETE
858,0.3760387599468231,2023-09-04 21:44:12.815364,2023-09-04 21:44:13.968468,0 days 00:00:01.153104,Tanh,Sigmoid,,,29,13,16.0,,,0.001173011872874012,2,348,0.20092755447522626,9.018591832077155e-05,288.1648758802369,COMPLETE
859,0.32921263575553894,2023-09-04 21:44:13.968841,2023-09-04 21:44:16.045349,0 days 00:00:02.076508,ReLU,Tanh,,,37,12,12.0,,,0.0005673316996167503,2,265,0.7496516588518914,0.000273582011586812,110.1160593447478,COMPLETE
860,0.35399216413497925,2023-09-04 21:44:16.046027,2023-09-04 21:44:16.924050,0 days 00:00:00.878023,Tanh,Leaky,,,62,11,15.0,,,0.003779307650905222,2,361,0.3501041422944946,2.065963198328428e-05,108.94522288807651,COMPLETE
861,0.3707359731197357,2023-09-04 21:44:16.924430,2023-09-04 21:44:18.663227,0 days 00:00:01.738797,Tanh,Leaky,Leaky,,59,14,17.0,12.0,,0.00011489404455526323,3,335,0.29634945672937946,0.0030091084023434393,117.86309926047254,COMPLETE
862,0.4305932819843292,2023-09-04 21:44:18.663641,2023-09-04 21:44:19.432721,0 days 00:00:00.769080,Tanh,Sigmoid,Leaky,,21,11,17.0,22.0,,0.0009541391925752251,3,371,0.18453352400681422,0.012153137839119576,192.043168703715,COMPLETE
863,0.28383973240852356,2023-09-04 21:44:19.433104,2023-09-04 21:44:21.227521,0 days 00:00:01.794417,ReLU,Leaky,Leaky,,27,12,21.0,2.0,,0.002203883930413549,3,399,0.772725481197658,0.00011885543746485464,93.9524179378026,COMPLETE
864,0.35777756571769714,2023-09-04 21:44:21.227904,2023-09-04 21:44:31.896486,0 days 00:00:10.668582,Tanh,Leaky,,,19,9,14.0,,,0.00013985902983013954,2,417,0.5346994691626746,0.00512225563834705,110.89573901791653,COMPLETE
865,0.3891298174858093,2023-09-04 21:44:31.897170,2023-09-04 21:44:40.109632,0 days 00:00:08.212462,Tanh,Sigmoid,Leaky,,33,10,16.0,16.0,,0.0002588761368823653,3,390,0.2692848884271911,0.00019523189560126733,142.1131195263985,COMPLETE
866,0.3507057726383209,2023-09-04 21:44:40.110328,2023-09-04 21:44:45.187050,0 days 00:00:05.076722,Tanh,Leaky,Leaky,,16,12,15.0,1.0,,0.0032570926078273697,3,442,0.7137734732709352,0.0066219936551709414,136.40267305958028,COMPLETE
867,0.35824981331825256,2023-09-04 21:44:45.187755,2023-09-04 21:45:01.183489,0 days 00:00:15.995734,ReLU,Leaky,,,23,8,17.0,,,0.00015278686269250746,2,360,0.5220481526939056,3.765671414337417e-05,95.60176118214925,COMPLETE
868,0.647327721118927,2023-09-04 21:45:01.184169,2023-09-04 21:45:04.542330,0 days 00:00:03.358161,Tanh,Sigmoid,Leaky,,30,11,16.0,23.0,,4.785411260804724e-05,3,343,0.10002915284956289,0.00015298384375753282,137.15727391812962,COMPLETE
869,0.3222275376319885,2023-09-04 21:45:04.543037,2023-09-04 21:45:10.935619,0 days 00:00:06.392582,Tanh,Leaky,Leaky,,27,10,15.0,24.0,,0.0008057635832812535,3,377,0.4648403846877654,0.00055011482395202,106.22631072998047,COMPLETE
870,0.4633335769176483,2023-09-04 21:45:10.936321,2023-09-04 21:45:17.737583,0 days 00:00:06.801262,Sigmoid,Leaky,,,24,12,17.0,,,0.0001858619596387429,2,354,0.22693014692517466,5.101551757212458e-05,765.2200800577799,COMPLETE
871,0.4936303496360779,2023-09-04 21:45:17.738260,2023-09-04 21:45:24.255590,0 days 00:00:06.517330,Tanh,Sigmoid,Leaky,,18,13,13.0,11.0,,5.6857780970575144e-05,3,329,0.1450203020307884,7.229481658543952e-05,113.54868687684775,COMPLETE
872,0.35366055369377136,2023-09-04 21:45:24.256292,2023-09-04 21:45:30.522327,0 days 00:00:06.266035,ReLU,Leaky,Tanh,,20,11,16.0,15.0,,0.00040069701987272585,3,402,0.6931473860038702,0.0013590182197057304,98.38673240260074,COMPLETE
873,0.29153260588645935,2023-09-04 21:45:30.523025,2023-09-04 21:45:50.440834,0 days 00:00:19.917809,Tanh,Leaky,Leaky,,26,12,14.0,23.0,,0.0002855161796841552,3,425,0.7421344070237025,3.0751525660299506e-05,96.98791183365717,COMPLETE
874,0.344164103269577,2023-09-04 21:45:50.441540,2023-09-04 21:45:58.044444,0 days 00:00:07.602904,Tanh,,,,22,11,,,,0.0005585241126230384,1,373,0.6443871285843804,0.018252809062484433,99.94980249072528,COMPLETE
875,0.31964921951293945,2023-09-04 21:45:58.044812,2023-09-04 21:45:59.736608,0 days 00:00:01.691796,Tanh,Sigmoid,,,28,10,20.0,,,0.0011111708697704795,2,364,0.776401724493881,0.000772300699116172,186.85633402857286,COMPLETE
876,0.3814551532268524,2023-09-04 21:45:59.737001,2023-09-04 21:46:00.159470,0 days 00:00:00.422469,ReLU,Leaky,Leaky,,31,10,15.0,22.0,,0.001993503557728505,3,412,0.16466959835833384,0.00024362496852903563,133.33085168374552,COMPLETE
877,0.33839473128318787,2023-09-04 21:46:00.159867,2023-09-04 21:46:01.189351,0 days 00:00:01.029484,Tanh,ReLU,Leaky,,24,11,16.0,17.0,,0.0013510744817239804,3,388,0.393927148473876,2.569817486466684e-05,118.06310325198703,COMPLETE
878,0.3458986282348633,2023-09-04 21:46:01.189749,2023-09-04 21:46:02.367623,0 days 00:00:01.177874,Tanh,Leaky,,,17,13,17.0,,,0.0024423079349770492,2,346,0.2604782058130659,0.0009898178650528005,119.1571055650711,COMPLETE
879,0.38302773237228394,2023-09-04 21:46:02.368290,2023-09-04 21:46:04.710214,0 days 00:00:02.341924,ReLU,Sigmoid,Leaky,,21,12,16.0,14.0,,0.0003097247517844088,3,259,0.72833078287836,0.004226954652632011,114.53296220158956,COMPLETE
880,0.35607877373695374,2023-09-04 21:46:04.710612,2023-09-04 21:46:06.506341,0 days 00:00:01.795729,Tanh,Leaky,Leaky,,29,11,17.0,12.0,,0.000775149293520566,3,339,0.7699991029870566,0.00013290120667550553,96.87114641143054,COMPLETE
881,0.2687649130821228,2023-09-04 21:46:06.506735,2023-09-04 21:46:07.423807,0 days 00:00:00.917072,Tanh,Leaky,,,26,12,15.0,,,0.027332587353600543,2,435,0.6898400953848346,4.4225856617324896e-05,90.49367736816406,COMPLETE
882,0.3141028583049774,2023-09-04 21:46:07.424194,2023-09-04 21:46:17.152710,0 days 00:00:09.728516,Leaky,Sigmoid,,,26,13,15.0,,,8.426303473118578e-05,2,451,0.6666076209951726,4.3130557067563616e-05,97.80942608141847,COMPLETE
883,0.3247673213481903,2023-09-04 21:46:17.153080,2023-09-04 21:46:17.528864,0 days 00:00:00.375784,Tanh,Leaky,,,27,12,14.0,,,0.033858172253159874,2,428,0.5929365384191068,4.151845713675109e-05,107.1178144975142,COMPLETE
884,0.3930779695510864,2023-09-04 21:46:17.529249,2023-09-04 21:46:26.131855,0 days 00:00:08.602606,Tanh,Tanh,,,24,12,15.0,,,7.036300736800896e-05,2,438,0.683898000179227,4.9425005564055e-05,142.0480491080785,COMPLETE
885,0.3005654811859131,2023-09-04 21:46:26.132238,2023-09-04 21:46:26.917317,0 days 00:00:00.785079,ReLU,Leaky,,,28,13,15.0,,,0.028389418160178932,2,353,0.6199091861586974,5.8855058162948624e-05,90.26546571692641,COMPLETE
886,0.3465414047241211,2023-09-04 21:46:26.917699,2023-09-04 21:46:27.982792,0 days 00:00:01.065093,Tanh,Sigmoid,,,25,12,14.0,,,0.0242610440469034,2,361,0.6989717239988219,3.938777948620262e-05,97.65286077771869,COMPLETE
887,0.46729233860969543,2023-09-04 21:46:27.983190,2023-09-04 21:46:35.247705,0 days 00:00:07.264515,Tanh,Leaky,,,26,12,15.0,,,1.1259865117522526e-05,2,445,0.6463161555632538,3.492755856546742e-05,116.35769836768675,COMPLETE
888,0.37237730622291565,2023-09-04 21:46:35.248097,2023-09-04 21:46:36.404161,0 days 00:00:01.156064,ReLU,Leaky,,,23,13,15.0,,,0.043724475746370096,2,371,0.6687069239464362,7.545346091620384e-05,101.74937505307405,COMPLETE
889,0.35600200295448303,2023-09-04 21:46:36.404836,2023-09-04 21:46:46.021948,0 days 00:00:09.617112,Tanh,Sigmoid,,,32,12,14.0,,,0.00011277470320278057,2,465,0.7131925803070094,5.803890073261858e-05,122.18924537576655,COMPLETE
890,0.3550226390361786,2023-09-04 21:46:46.022623,2023-09-04 21:46:47.233639,0 days 00:00:01.211016,Tanh,Leaky,,,29,11,15.0,,,0.02610052531159221,2,458,0.6321380267702698,0.00837848522254354,106.07400747445914,COMPLETE
891,0.5936063528060913,2023-09-04 21:46:47.234029,2023-09-04 21:46:50.250899,0 days 00:00:03.016870,Tanh,Leaky,,,25,11,16.0,,,1.2073594116035444e-05,2,443,0.248887329283035,0.001729267796490187,107.18675424821221,COMPLETE
892,0.32966697216033936,2023-09-04 21:46:50.251269,2023-09-04 21:46:50.854306,0 days 00:00:00.603037,ReLU,Sigmoid,,,22,12,14.0,,,0.03188327802174403,2,433,0.7349561733707659,9.266337605739919e-05,108.91946499164288,COMPLETE
893,0.29870888590812683,2023-09-04 21:46:50.854722,2023-09-04 21:46:51.431051,0 days 00:00:00.576329,Tanh,Leaky,,,27,11,16.0,,,0.03789869140272354,2,330,0.7052453282662174,0.00017631552984712247,99.9162836710612,COMPLETE
894,0.4544874131679535,2023-09-04 21:46:51.431444,2023-09-04 21:46:51.532656,0 days 00:00:00.101212,Tanh,Leaky,,,30,12,15.0,,,0.01980535737456067,2,379,0.10973955065865924,2.8878349531210856e-05,114.52476011003766,COMPLETE
895,0.9575486779212952,2023-09-04 21:46:51.533050,2023-09-04 21:46:51.877446,0 days 00:00:00.344396,Sigmoid,Sigmoid,,,19,11,16.0,,,0.008799510275292534,2,350,0.7989071114670396,0.06496303193227342,101.93968547474255,COMPLETE
896,0.37046676874160767,2023-09-04 21:46:51.877835,2023-09-04 21:46:54.695333,0 days 00:00:02.817498,Tanh,Leaky,,,24,13,13.0,,,0.0005116316111766064,2,436,0.44011056090365536,1.577721481541568e-05,116.47191372080746,COMPLETE
897,0.35318687558174133,2023-09-04 21:46:54.695745,2023-09-04 21:46:55.070804,0 days 00:00:00.375059,ReLU,Leaky,,,35,9,15.0,,,0.023477248622312433,2,320,0.6778883233628833,0.00011150802001466803,117.05930062998895,COMPLETE
898,0.41617098450660706,2023-09-04 21:46:55.071187,2023-09-04 21:46:55.760772,0 days 00:00:00.689585,Tanh,Sigmoid,,,27,10,15.0,,,0.000227787196827881,2,365,0.1021507856800547,4.325747849671421e-05,121.57807257867628,COMPLETE
899,0.3199772238731384,2023-09-04 21:46:55.761160,2023-09-04 21:47:04.284019,0 days 00:00:08.522859,Tanh,Leaky,,,21,12,14.0,,,0.0003156187955066781,2,452,0.5681551066733591,5.310774483388207e-05,112.86048018193878,COMPLETE
900,0.3435487449169159,2023-09-04 21:47:04.284394,2023-09-04 21:47:13.625531,0 days 00:00:09.341137,Tanh,Leaky,,,15,11,16.0,,,0.00019963540974422041,2,385,0.7420594623752248,2.1978941495457597e-05,125.30291884654277,COMPLETE
901,0.34749045968055725,2023-09-04 21:47:13.625920,2023-09-04 21:47:19.936949,0 days 00:00:06.311029,ReLU,ReLU,,,29,13,8.0,,,7.841036488907794e-05,2,356,0.7676802046241564,0.009932982063602146,105.71231610587473,COMPLETE
902,0.3746154308319092,2023-09-04 21:47:19.937363,2023-09-04 21:47:20.583759,0 days 00:00:00.646396,Tanh,Sigmoid,,,23,12,16.0,,,0.004601147775388405,2,339,0.3104541841242215,3.3676848639957434e-05,178.49134685809796,COMPLETE
903,0.3488081693649292,2023-09-04 21:47:20.584136,2023-09-04 21:47:20.876459,0 days 00:00:00.292323,Tanh,Leaky,,,25,10,15.0,,,0.007774100858421229,2,244,0.1468580134909519,0.002698118989524884,135.628433908735,COMPLETE
904,0.3891024887561798,2023-09-04 21:47:20.876847,2023-09-04 21:47:24.068419,0 days 00:00:03.191572,Tanh,Leaky,,,31,11,16.0,,,8.886344282598491e-05,2,290,0.7132620414657416,0.00021028355060683461,104.7346560545642,COMPLETE
905,0.3761720061302185,2023-09-04 21:47:24.068804,2023-09-04 21:47:24.285906,0 days 00:00:00.217102,ReLU,Sigmoid,,,19,11,12.0,,,0.018274475128023417,2,395,0.23658278991625872,0.00015463703110363516,127.51375579833984,COMPLETE
906,0.33686763048171997,2023-09-04 21:47:24.286283,2023-09-04 21:47:25.118867,0 days 00:00:00.832584,Leaky,Leaky,,,28,12,15.0,,,0.009705519134132113,2,372,0.7400761921082754,0.005892381881404579,100.72571360270182,COMPLETE
907,0.46986740827560425,2023-09-04 21:47:25.119257,2023-09-04 21:47:25.892005,0 days 00:00:00.772748,Tanh,Leaky,,,16,10,14.0,,,0.0004140325499398488,2,347,0.13269321263271186,6.811796917331746e-05,204.58479645672966,COMPLETE
908,0.3610863983631134,2023-09-04 21:47:25.892414,2023-09-04 21:47:26.576396,0 days 00:00:00.683982,Tanh,Tanh,Sigmoid,,22,11,16.0,10.0,,0.027410431796119447,3,278,0.7995121209002892,9.319932892778979e-05,105.86095463145863,COMPLETE
909,0.42604926228523254,2023-09-04 21:47:26.576785,2023-09-04 21:47:26.797008,0 days 00:00:00.220223,ReLU,Sigmoid,,,26,12,14.0,,,0.0038063469838205853,2,363,0.11951024104938167,0.0001163381612645987,149.95169432957968,COMPLETE
910,0.303324818611145,2023-09-04 21:47:26.797380,2023-09-04 21:47:27.313922,0 days 00:00:00.516542,Tanh,Leaky,Leaky,,33,13,16.0,18.0,,0.05492274646141875,3,385,0.688458285872535,0.0002484869514374883,100.2641595693735,COMPLETE
911,0.45774030685424805,2023-09-04 21:47:27.314342,2023-09-04 21:47:27.936309,0 days 00:00:00.621967,Tanh,Leaky,Leaky,,21,12,17.0,11.0,,0.016293140284083848,3,375,0.3882116908309933,0.0588858270755781,130.9834967719184,COMPLETE
912,0.3417246639728546,2023-09-04 21:47:27.936996,2023-09-04 21:47:29.720449,0 days 00:00:01.783453,Tanh,Sigmoid,,,24,10,15.0,,,0.012819061283495498,2,353,0.6501479899556898,4.8248004974733695e-05,111.42479431152344,COMPLETE
913,0.34383097290992737,2023-09-04 21:47:29.720852,2023-09-04 21:47:30.734903,0 days 00:00:01.014051,ReLU,Leaky,Leaky,,18,11,17.0,4.0,,0.0032084495090057103,3,305,0.7998379436128932,0.030901971908228548,106.58461419467268,COMPLETE
914,0.32986071705818176,2023-09-04 21:47:30.735288,2023-09-04 21:47:31.337016,0 days 00:00:00.601728,Tanh,Leaky,Tanh,,30,11,13.0,13.0,,0.02165704269000998,3,436,0.517784017354821,2.5200706555185344e-05,95.68775417930202,COMPLETE
915,0.384453147649765,2023-09-04 21:47:31.337402,2023-09-04 21:47:32.028241,0 days 00:00:00.690839,Tanh,Sigmoid,,,20,9,16.0,,,0.007360484863593254,2,331,0.4668184167171856,0.003346222390629492,123.02708186659702,COMPLETE
916,0.33032655715942383,2023-09-04 21:47:32.028619,2023-09-04 21:47:34.342340,0 days 00:00:02.313721,Tanh,Leaky,Leaky,,27,12,15.0,3.0,,0.002625980380690534,3,341,0.4963701902593532,0.00018067132481811588,101.11026964432153,COMPLETE
917,0.48567306995391846,2023-09-04 21:47:34.342722,2023-09-04 21:47:39.225002,0 days 00:00:04.882280,ReLU,Leaky,,,23,11,16.0,,,1.4723722047973018e-05,2,396,0.36156330007650295,0.00013660144285024538,99.33378479697488,COMPLETE
918,0.3887801766395569,2023-09-04 21:47:39.225382,2023-09-04 21:47:41.831651,0 days 00:00:02.606269,Tanh,Sigmoid,Leaky,,32,10,17.0,16.0,,0.0005894549217714471,3,426,0.6039202780635405,0.0019862240069270904,121.48629591736612,COMPLETE
919,0.31159549951553345,2023-09-04 21:47:41.832044,2023-09-04 21:47:42.776595,0 days 00:00:00.944551,Tanh,Leaky,Leaky,,25,13,15.0,13.0,,0.010895800894973207,3,368,0.7519158048336644,0.0010297503358460544,92.12074568464949,COMPLETE
920,0.5207284688949585,2023-09-04 21:47:42.776990,2023-09-04 21:47:42.936824,0 days 00:00:00.159834,Sigmoid,Leaky,,,28,14,16.0,,,0.031037957789047138,2,406,0.2197198393250133,0.044931598038747994,392.8676280975342,COMPLETE
921,0.3476344347000122,2023-09-04 21:47:42.937224,2023-09-04 21:47:47.562702,0 days 00:00:04.625478,Tanh,Sigmoid,Leaky,,16,21,14.0,10.0,,0.0003519893165079511,3,360,0.3315641929414261,8.155670059399467e-05,122.07873317557322,COMPLETE
922,0.3872571587562561,2023-09-04 21:47:47.563119,2023-09-04 21:47:48.698686,0 days 00:00:01.135567,ReLU,Leaky,Leaky,,22,12,21.0,5.0,,0.001737451314451351,3,268,0.719051060108987,0.037875458824657295,157.01141059689405,COMPLETE
923,0.3175012171268463,2023-09-04 21:47:48.699111,2023-09-04 21:47:49.717105,0 days 00:00:01.017994,Tanh,Leaky,,,18,11,17.0,,,0.015517408446893312,2,447,0.7617958604355092,3.4742770960193656e-05,101.53926664410216,COMPLETE
924,0.4200986325740814,2023-09-04 21:47:49.717808,2023-09-04 21:47:55.011931,0 days 00:00:05.294123,Tanh,Sigmoid,Leaky,,26,12,15.0,9.0,,0.00016297326512395386,3,179,0.692991354254364,0.0012047940787262587,98.64563891874346,COMPLETE
925,0.38415685296058655,2023-09-04 21:47:55.012323,2023-09-04 21:47:55.305699,0 days 00:00:00.293376,Tanh,ReLU,Tanh,,30,10,16.0,4.0,,0.008660127594158356,3,379,0.18157662803973984,0.0015854169454057711,201.88935356140138,COMPLETE
926,0.39231884479522705,2023-09-04 21:47:55.306087,2023-09-04 21:47:56.300249,0 days 00:00:00.994162,ReLU,Leaky,Leaky,,24,11,13.0,15.0,,0.006396584244213677,3,349,0.6652094588810712,0.08105837202841028,98.97508010864257,COMPLETE
927,0.32138878107070923,2023-09-04 21:47:56.300932,2023-09-04 21:47:57.045224,0 days 00:00:00.744292,Tanh,Leaky,,,20,9,15.0,,,0.04411781123470318,2,142,0.5458195671661641,0.0002131014504291667,101.85586095739293,COMPLETE
928,0.5420607328414917,2023-09-04 21:47:57.045606,2023-09-04 21:47:58.509422,0 days 00:00:01.463816,Tanh,Sigmoid,Leaky,,27,22,17.0,17.0,,4.375063596329836e-05,3,55,0.7286242220988536,0.0002678741547937523,97.4577509099787,COMPLETE
929,0.3650996685028076,2023-09-04 21:47:58.509810,2023-09-04 21:47:58.788650,0 days 00:00:00.278840,Leaky,Leaky,,,14,12,20.0,,,0.012506749099168287,2,391,0.1973501100323794,6.152160472686718e-05,433.3639801025391,COMPLETE
930,0.35851559042930603,2023-09-04 21:47:58.789031,2023-09-04 21:48:08.767193,0 days 00:00:09.978162,ReLU,Leaky,Leaky,,23,11,14.0,14.0,,3.20990535958761e-05,3,358,0.7741855260254714,0.0008796952065835016,110.81870926159054,COMPLETE
931,0.3883243501186371,2023-09-04 21:48:08.767603,2023-09-04 21:48:13.009101,0 days 00:00:04.241498,Tanh,,,,34,20,,,,0.00012501198593581317,1,323,0.7997815772401012,1.8272425112529702e-05,111.41721053463017,COMPLETE
932,0.3122074007987976,2023-09-04 21:48:13.009481,2023-09-04 21:48:13.578384,0 days 00:00:00.568903,Tanh,Sigmoid,,,20,13,16.0,,,0.019134766514780726,2,337,0.633202078004943,0.00010434052586448978,126.04385464008038,COMPLETE
933,0.3398270905017853,2023-09-04 21:48:13.578783,2023-09-04 21:48:21.873240,0 days 00:00:08.294457,Tanh,Tanh,Sigmoid,,29,12,17.0,5.0,,0.00021871920364582837,3,382,0.7447101512949118,0.00016097520351820226,134.83593835723534,COMPLETE
934,0.30140143632888794,2023-09-04 21:48:21.873631,2023-09-04 21:48:23.236554,0 days 00:00:01.362923,ReLU,Leaky,Leaky,,25,11,12.0,15.0,,0.010141441626425654,3,421,0.7048682916493374,0.0025571224231213953,100.64035913499735,COMPLETE
935,0.4362429976463318,2023-09-04 21:48:23.236933,2023-09-04 21:48:23.410052,0 days 00:00:00.173119,Tanh,Leaky,,,17,10,15.0,,,0.014362828201306943,2,368,0.16637777030240058,0.0313588475109,166.68553251378677,COMPLETE
936,0.347677618265152,2023-09-04 21:48:23.410419,2023-09-04 21:48:23.903963,0 days 00:00:00.493544,Tanh,Sigmoid,Leaky,,32,12,16.0,12.0,,0.023525107775345562,3,347,0.3163716907116206,0.000328253713134903,115.87324966430664,COMPLETE
937,0.3617379367351532,2023-09-04 21:48:23.904344,2023-09-04 21:48:26.799779,0 days 00:00:02.895435,Tanh,Leaky,Leaky,,22,11,11.0,21.0,,0.0007108813538433552,3,254,0.7685597963319414,3.0190818972206634e-05,95.7698412481344,COMPLETE
938,0.35688093304634094,2023-09-04 21:48:26.800175,2023-09-04 21:48:27.156691,0 days 00:00:00.356516,ReLU,Leaky,Leaky,,28,10,17.0,12.0,,0.00472548150642644,3,403,0.4115640862430593,4.264187173199954e-05,112.39296468098958,COMPLETE
939,0.44555577635765076,2023-09-04 21:48:27.157082,2023-09-04 21:48:27.507139,0 days 00:00:00.350057,Tanh,Sigmoid,,,25,13,14.0,,,0.03341239001752673,2,432,0.4502311860213847,0.011427912429708913,132.44391059875488,COMPLETE
940,0.33798661828041077,2023-09-04 21:48:27.507505,2023-09-04 21:48:30.452791,0 days 00:00:02.945286,Tanh,Leaky,Tanh,,19,12,16.0,13.0,,0.0008675280558476688,3,371,0.7278447281434993,7.887066412124894e-05,90.34595134470723,COMPLETE
