number,value,datetime_start,datetime_complete,duration,params_activation1,params_activation2,params_activation3,params_activation4,params_batch_size,params_fl1,params_fl2,params_fl3,params_fl4,params_learning_rate,params_n_layers,params_num_epochs,params_train_size,params_weight_decay,user_attrs_mre,state
1783,0.2746013104915619,2023-09-04 22:50:04.373098,2023-09-04 22:50:06.131462,0 days 00:00:01.758364,Leaky,Leaky,Sigmoid,Leaky,28,18,22.0,13.0,4.0,0.0035562634148453382,4,280,0.7008968254204311,0.00015262713320291751,94.91943624745245,COMPLETE
1784,0.451216459274292,2023-09-04 22:50:06.132014,2023-09-04 22:50:06.751221,0 days 00:00:00.619207,Tanh,Leaky,Sigmoid,Leaky,86,20,21.0,14.0,16.0,0.000576117727725633,4,304,0.5432478962283359,0.00021054714339810665,134.73157953811904,COMPLETE
1785,1.1289126873016357,2023-09-04 22:50:06.751770,2023-09-04 22:50:07.119213,0 days 00:00:00.367443,Sigmoid,Leaky,Sigmoid,Sigmoid,83,17,18.0,16.0,6.0,0.012893163293490101,4,187,0.770455520119116,0.033867332437787084,108.14400442023026,COMPLETE
1786,0.3686715364456177,2023-09-04 22:50:07.119777,2023-09-04 22:50:08.125243,0 days 00:00:01.005466,ReLU,Leaky,Leaky,Leaky,37,21,20.0,17.0,19.0,0.009266299649206446,4,211,0.5932071266237884,0.00028765830899242576,98.87526453757772,COMPLETE
1787,0.8610103130340576,2023-09-04 22:50:08.125766,2023-09-04 22:50:08.370663,0 days 00:00:00.244897,Tanh,Leaky,ReLU,Sigmoid,90,20,19.0,23.0,2.0,0.02457873147969659,4,248,0.14926348533667452,6.654092061489216e-05,674.8137944539388,COMPLETE
1788,0.3428403437137604,2023-09-04 22:50:08.371183,2023-09-04 22:50:08.798480,0 days 00:00:00.427297,Tanh,Leaky,Sigmoid,Leaky,87,18,17.0,12.0,20.0,0.007732240766670866,4,230,0.2110284784219363,9.121870695386771e-05,142.67718486544453,COMPLETE
1789,0.38937970995903015,2023-09-04 22:50:08.799022,2023-09-04 22:50:09.212771,0 days 00:00:00.413749,Leaky,Leaky,Sigmoid,Leaky,76,10,20.0,22.0,18.0,0.015879051529308744,4,264,0.7240081331394547,0.00013244494495574344,124.5605528458305,COMPLETE
1790,1.1907308101654053,2023-09-04 22:50:09.213296,2023-09-04 22:50:11.874659,0 days 00:00:02.661363,Sigmoid,Leaky,Sigmoid,Sigmoid,92,19,22.0,15.0,8.0,1.0137969997795908e-05,4,241,0.6865111482746582,1.9239358393903696e-05,92.19750403566479,COMPLETE
1791,1.0293937921524048,2023-09-04 22:50:11.875192,2023-09-04 22:50:12.307172,0 days 00:00:00.431980,Tanh,Leaky,Tanh,Leaky,85,22,21.0,24.0,7.0,0.010965212720287743,4,271,0.7465460103268192,0.07878552509130007,102.37983534071181,COMPLETE
1792,0.32477352023124695,2023-09-04 22:50:12.307695,2023-09-04 22:50:13.109202,0 days 00:00:00.801507,ReLU,Leaky,ReLU,Leaky,29,18,19.0,19.0,17.0,0.004520563402990204,4,297,0.6451571565473349,3.8881640501053754e-05,94.52838897705078,COMPLETE
1793,0.23942312598228455,2023-09-04 22:50:13.109735,2023-09-04 22:50:14.509393,0 days 00:00:01.399658,Tanh,Leaky,Sigmoid,Sigmoid,35,19,21.0,6.0,4.0,0.020425816154675664,4,222,0.7680948602758033,7.611082836079475e-05,91.6194990772312,COMPLETE
1794,0.4087819457054138,2023-09-04 22:50:14.509913,2023-09-04 22:50:15.038625,0 days 00:00:00.528712,Sigmoid,ReLU,Sigmoid,Leaky,82,16,20.0,23.0,6.0,0.03113373929996553,4,253,0.48552031350648756,0.0007896457829914453,237.35209984872856,COMPLETE
1795,0.22586995363235474,2023-09-04 22:50:15.039204,2023-09-04 22:50:15.824629,0 days 00:00:00.785425,Leaky,Leaky,Sigmoid,ReLU,84,17,19.0,22.0,5.0,0.013727078395592323,4,237,0.7995091878559016,0.00017137030236436825,107.12210027521307,COMPLETE
1796,0.3764680325984955,2023-09-04 22:50:15.825150,2023-09-04 22:50:17.049174,0 days 00:00:01.224024,Tanh,Leaky,Sigmoid,Sigmoid,80,18,20.0,24.0,3.0,0.002019139924297446,4,318,0.7191530734750844,1.382155072880479e-05,701.9533310707169,COMPLETE
1797,0.9302660822868347,2023-09-04 22:50:17.049678,2023-09-04 22:50:20.138480,0 days 00:00:03.088802,ReLU,Leaky,ReLU,Leaky,49,20,21.0,23.0,1.0,1.6838800344243597e-05,4,180,0.7470377803633881,1.0042767416432037e-05,268.065304268731,COMPLETE
1798,0.6337177753448486,2023-09-04 22:50:20.139016,2023-09-04 22:50:21.735517,0 days 00:00:01.596501,Tanh,Tanh,Sigmoid,Leaky,88,19,20.0,16.0,17.0,6.88657355822288e-05,4,197,0.4876039833636415,0.0002421057795508772,169.81759310494826,COMPLETE
1799,0.6533644795417786,2023-09-04 22:50:21.736065,2023-09-04 22:50:28.287472,0 days 00:00:06.551407,Sigmoid,Leaky,Sigmoid,Tanh,33,3,23.0,11.0,14.0,4.742175066056273e-05,4,280,0.7990398476781314,5.3523230940740275e-05,333.2059116091047,COMPLETE
1800,0.507773756980896,2023-09-04 22:50:28.288043,2023-09-04 22:50:28.739407,0 days 00:00:00.451364,Leaky,Leaky,Sigmoid,Sigmoid,30,21,18.0,23.0,7.0,0.01738928126505765,4,247,0.15287354013544746,0.0029012354545363238,320.5557252389413,COMPLETE
1801,0.41485854983329773,2023-09-04 22:50:28.739967,2023-09-04 22:50:29.844996,0 days 00:00:01.105029,Tanh,Sigmoid,ReLU,Leaky,26,8,22.0,17.0,18.0,0.012112868638873377,4,214,0.6747723850631692,0.00012145286318050375,131.9237500240928,COMPLETE
1802,0.5641963481903076,2023-09-04 22:50:29.845518,2023-09-04 22:50:30.206758,0 days 00:00:00.361240,Tanh,Leaky,Sigmoid,Sigmoid,84,20,16.0,21.0,19.0,0.009393449878101569,4,259,0.19543991930707616,2.9525141221776175e-05,171.2808264655036,COMPLETE
1803,0.4484725296497345,2023-09-04 22:50:30.207322,2023-09-04 22:50:30.530968,0 days 00:00:00.323646,ReLU,Leaky,Sigmoid,Leaky,88,9,20.0,24.0,5.0,0.04961430696291787,4,228,0.3418396452502976,0.00014958607862313575,495.6961555480957,COMPLETE
1804,0.6045491099357605,2023-09-04 22:50:30.531512,2023-09-04 22:50:33.704272,0 days 00:00:03.172760,Sigmoid,Leaky,Sigmoid,Leaky,82,13,19.0,15.0,6.0,0.00011093295761167804,4,295,0.7141627924100109,0.00020191689111582616,188.37663413872153,COMPLETE
1805,0.2587764263153076,2023-09-04 22:50:33.704802,2023-09-04 22:50:34.483353,0 days 00:00:00.778551,Tanh,Leaky,ReLU,Sigmoid,86,19,21.0,16.0,20.0,0.006377483173653615,4,307,0.765929091347828,0.0007187126453038813,115.85665566580636,COMPLETE
1806,0.43981701135635376,2023-09-04 22:50:34.483909,2023-09-04 22:50:35.570608,0 days 00:00:01.086699,Leaky,Leaky,Sigmoid,,31,18,20.0,14.0,,0.024213254441592065,3,272,0.7345311215394641,0.0005983081767718442,136.038390045166,COMPLETE
1807,0.4138873219490051,2023-09-04 22:50:35.571121,2023-09-04 22:50:36.542260,0 days 00:00:00.971139,Tanh,Leaky,Sigmoid,Leaky,84,10,19.0,23.0,16.0,0.002973302688451863,4,243,0.695804519640013,0.0003369727586462743,130.23539975323254,COMPLETE
1808,1.2818526029586792,2023-09-04 22:50:36.542770,2023-09-04 22:50:36.851133,0 days 00:00:00.308363,Sigmoid,ReLU,Sigmoid,Leaky,91,12,18.0,22.0,5.0,8.730816927391396e-05,4,287,0.21061444662047055,9.873790984641971e-05,153.27875934947622,COMPLETE
1809,0.5741392970085144,2023-09-04 22:50:36.851685,2023-09-04 22:50:37.796099,0 days 00:00:00.944414,Tanh,Leaky,Leaky,Sigmoid,78,17,21.0,24.0,4.0,0.014764432178927917,4,253,0.7693732321280286,0.02686448054696202,199.02028864080256,COMPLETE
1810,0.9077478051185608,2023-09-04 22:50:37.796610,2023-09-04 22:50:38.215786,0 days 00:00:00.419176,ReLU,Leaky,Sigmoid,ReLU,81,19,20.0,15.0,19.0,0.020700094637020133,4,233,0.7375428925489532,0.03169700798810529,102.10488287607829,COMPLETE
1811,0.27045804262161255,2023-09-04 22:50:38.216386,2023-09-04 22:50:38.853624,0 days 00:00:00.637238,Leaky,Leaky,ReLU,Leaky,41,23,21.0,23.0,8.0,0.01127181752468985,4,265,0.3948246868789134,8.180315970486475e-05,116.46324858373525,COMPLETE
1812,0.38435450196266174,2023-09-04 22:50:38.854232,2023-09-04 22:50:39.133118,0 days 00:00:00.278886,Tanh,Leaky,Sigmoid,Sigmoid,63,21,20.0,13.0,7.0,0.0170062975919559,4,223,0.14188747946061198,6.14226011115749e-05,133.8032488141741,COMPLETE
1813,0.35562628507614136,2023-09-04 22:50:39.133714,2023-09-04 22:50:39.871566,0 days 00:00:00.737852,Sigmoid,Leaky,Sigmoid,Leaky,89,15,22.0,22.0,6.0,0.007704559050130764,4,238,0.5737430775220758,0.0002499415141583527,186.87055569007748,COMPLETE
1814,0.3319399654865265,2023-09-04 22:50:39.872115,2023-09-04 22:50:41.078951,0 days 00:00:01.206836,Tanh,Leaky,Sigmoid,Leaky,35,22,19.0,24.0,18.0,0.00521977467171382,4,208,0.6546387637921399,0.0001819682928150181,110.04760782342208,COMPLETE
1815,0.34110572934150696,2023-09-04 22:50:41.079501,2023-09-04 22:50:43.104366,0 days 00:00:02.024865,ReLU,Leaky,ReLU,Sigmoid,38,18,21.0,15.0,9.0,0.0013644712887654075,4,251,0.7979249164912771,0.015145714659768442,104.19795692257765,COMPLETE
1816,0.57814621925354,2023-09-04 22:50:43.104868,2023-09-04 22:50:44.324478,0 days 00:00:01.219610,Tanh,Leaky,Tanh,Leaky,87,20,19.0,16.0,3.0,0.0001835473472622591,4,170,0.43720204567621734,0.008181941332529629,264.16248887005975,COMPLETE
1817,0.34818384051322937,2023-09-04 22:50:44.324982,2023-09-04 22:50:45.823969,0 days 00:00:01.498987,Leaky,Leaky,Sigmoid,Sigmoid,45,17,20.0,23.0,17.0,0.028054663444338518,4,219,0.7152863267778257,4.1059028723301496e-05,316.9946783742597,COMPLETE
1818,0.5067796111106873,2023-09-04 22:50:45.824988,2023-09-04 22:50:47.149858,0 days 00:00:01.324870,Sigmoid,Leaky,Sigmoid,Leaky,53,19,22.0,22.0,5.0,0.038109134497476785,4,261,0.5030093897646728,0.0024165224637263927,188.66876644558377,COMPLETE
1819,0.3248458802700043,2023-09-04 22:50:47.150401,2023-09-04 22:50:48.656105,0 days 00:00:01.505704,Tanh,Leaky,Sigmoid,Leaky,86,10,23.0,14.0,15.0,0.0038199252996326833,4,231,0.7989819543860779,0.0004298238991850112,113.44831789954235,COMPLETE
1820,0.3591548800468445,2023-09-04 22:50:48.656644,2023-09-04 22:50:49.974829,0 days 00:00:01.318185,Tanh,ReLU,Sigmoid,Sigmoid,32,21,21.0,24.0,20.0,0.013343028972600889,4,243,0.5558055323820226,0.0010837774857703458,136.2515603233786,COMPLETE
1821,0.34329718351364136,2023-09-04 22:50:49.975375,2023-09-04 22:50:50.408195,0 days 00:00:00.432820,ReLU,Leaky,ReLU,Leaky,27,11,20.0,16.0,4.0,0.009893828376413519,4,282,0.19931093305552203,0.00010885517578889432,99.04609499479595,COMPLETE
1822,0.331854909658432,2023-09-04 22:50:50.408727,2023-09-04 22:50:51.117417,0 days 00:00:00.708690,Leaky,Leaky,Sigmoid,Tanh,83,18,17.0,17.0,6.0,0.01951224966125221,4,293,0.7502800863395273,0.002111254430067159,130.47305956073836,COMPLETE
1823,0.7961947321891785,2023-09-04 22:50:51.117947,2023-09-04 22:50:52.977719,0 days 00:00:01.859772,Tanh,,,,79,20,,,,1.4822618695144812e-05,1,273,0.684009036920958,1.7680802017547647e-05,190.75023285023894,COMPLETE
1824,0.5128611922264099,2023-09-04 22:50:52.978206,2023-09-04 22:50:54.052365,0 days 00:00:01.074159,Sigmoid,Leaky,Sigmoid,ReLU,85,19,19.0,23.0,17.0,0.015048619312538264,4,321,0.312171292235865,1.5644475975102625e-05,3529.503077754268,COMPLETE
1825,1.060355544090271,2023-09-04 22:50:54.053352,2023-09-04 22:50:54.504729,0 days 00:00:00.451377,Tanh,Tanh,Sigmoid,Sigmoid,90,18,21.0,18.0,19.0,0.09475360593928406,4,308,0.380114337650143,0.041544874376281474,161.82172075907388,COMPLETE
1826,0.33466291427612305,2023-09-04 22:50:54.505268,2023-09-04 22:50:54.909195,0 days 00:00:00.403927,ReLU,Sigmoid,ReLU,Leaky,82,16,20.0,24.0,21.0,0.011812256893449235,4,252,0.4671220331586256,0.0001331413682222627,96.0378500994514,COMPLETE
1827,0.4405173063278198,2023-09-04 22:50:54.909747,2023-09-04 22:50:55.710494,0 days 00:00:00.800747,Tanh,Leaky,Sigmoid,Leaky,93,19,18.0,23.0,16.0,0.0023062664896336153,4,237,0.2619057538658658,0.004746700883413838,162.5011467769228,COMPLETE
1828,0.7486035227775574,2023-09-04 22:50:55.711026,2023-09-04 22:50:56.052963,0 days 00:00:00.341937,Sigmoid,Leaky,Sigmoid,Sigmoid,29,24,22.0,15.0,6.0,0.017795929441608335,4,222,0.34055285441284505,7.10269666725344e-05,310.2116689682007,COMPLETE
1829,0.4257779121398926,2023-09-04 22:50:56.053495,2023-09-04 22:51:02.001305,0 days 00:00:05.947810,Leaky,Leaky,Sigmoid,Leaky,34,18,19.0,11.0,7.0,0.00011301791684856149,4,264,0.771893054228143,0.00021084786171456096,466.42927837371826,COMPLETE
1830,0.23811130225658417,2023-09-04 22:51:02.001833,2023-09-04 22:51:02.720187,0 days 00:00:00.718354,Tanh,Leaky,ReLU,Leaky,88,17,20.0,16.0,5.0,0.023852828052692447,4,150,0.722778838916858,0.00028475006124586717,130.0141590663365,COMPLETE
1831,0.8712380528450012,2023-09-04 22:51:02.720733,2023-09-04 22:51:03.706849,0 days 00:00:00.986116,Tanh,Leaky,Sigmoid,Sigmoid,84,22,21.0,22.0,18.0,2.2248310082607097e-05,4,201,0.2659260012120808,0.00014731277867596724,88.04144769165646,COMPLETE
1832,0.26827874779701233,2023-09-04 22:51:03.707375,2023-09-04 22:51:08.013998,0 days 00:00:04.306623,ReLU,Leaky,,,22,20,18.0,,,0.0005629339873932327,2,247,0.7497804900159483,8.584914621882729e-05,500.19884823023347,COMPLETE
1833,0.6179993748664856,2023-09-04 22:51:08.014536,2023-09-04 22:51:08.588946,0 days 00:00:00.574410,Sigmoid,Leaky,Sigmoid,Leaky,80,21,20.0,24.0,2.0,0.006235861701608626,4,229,0.24881065689660553,0.003092070683467094,217.12737317766462,COMPLETE
1834,0.37668415904045105,2023-09-04 22:51:08.589471,2023-09-04 22:51:09.321826,0 days 00:00:00.732355,Leaky,Leaky,Sigmoid,Sigmoid,32,19,24.0,23.0,4.0,0.008796193490027625,4,258,0.6413537138633146,5.6447563473938146e-05,126.08407465616862,COMPLETE
1835,0.42817333340644836,2023-09-04 22:51:09.322366,2023-09-04 22:51:09.656304,0 days 00:00:00.333938,Tanh,Leaky,Leaky,Leaky,86,18,12.0,15.0,8.0,0.014125102283994845,4,214,0.2958275687554883,2.2443070767631035e-05,354.18508089505707,COMPLETE
1836,0.36767590045928955,2023-09-04 22:51:09.656843,2023-09-04 22:51:10.401252,0 days 00:00:00.744409,Tanh,ReLU,Sigmoid,Leaky,67,5,22.0,21.0,3.0,0.011269729681966904,4,285,0.3657399849995076,1.256865357301924e-05,131.3040771484375,COMPLETE
1837,0.6597246527671814,2023-09-04 22:51:10.401810,2023-09-04 22:51:10.869491,0 days 00:00:00.467681,Sigmoid,Leaky,ReLU,Sigmoid,83,20,19.0,24.0,6.0,0.03318225670107017,4,236,0.15770307250260995,0.00017107894444528033,177.46066164970398,COMPLETE
1838,0.5053402781486511,2023-09-04 22:51:10.870531,2023-09-04 22:51:11.590806,0 days 00:00:00.720275,ReLU,Leaky,Sigmoid,ReLU,24,19,20.0,20.0,19.0,0.0017892572982680102,4,299,0.1780663530703766,3.296702781938215e-05,169.34684788903525,COMPLETE
1839,0.5257227420806885,2023-09-04 22:51:11.591335,2023-09-04 22:51:11.894786,0 days 00:00:00.303451,Tanh,Leaky,Sigmoid,Leaky,30,11,21.0,23.0,17.0,0.021062545550848542,4,271,0.10733369885366532,0.00011000666561503278,215.38758520177893,COMPLETE
1840,0.39346498250961304,2023-09-04 22:51:11.895319,2023-09-04 22:51:12.249451,0 days 00:00:00.354132,Leaky,Leaky,Sigmoid,Sigmoid,90,10,20.0,17.0,5.0,0.01606592622348451,4,240,0.18273603432480148,4.561468133510786e-05,375.4268851209043,COMPLETE
1841,0.39084476232528687,2023-09-04 22:51:12.250064,2023-09-04 22:51:12.569755,0 days 00:00:00.319691,Tanh,Leaky,Tanh,Leaky,87,9,19.0,5.0,13.0,0.004075372248601797,4,188,0.21526259021523556,0.00021533324392632142,114.63890991210937,COMPLETE
1842,0.3951071798801422,2023-09-04 22:51:12.570301,2023-09-04 22:51:13.020995,0 days 00:00:00.450694,Sigmoid,Leaky,ReLU,Leaky,81,18,21.0,12.0,5.0,0.026425176655721933,4,257,0.6994280833880512,0.0012319934546106022,142.0798314412435,COMPLETE
1843,0.23346121609210968,2023-09-04 22:51:13.021527,2023-09-04 22:51:14.428023,0 days 00:00:01.406496,Tanh,Leaky,Sigmoid,Sigmoid,37,21,21.0,22.0,18.0,0.007385901982878248,4,245,0.799506960329972,7.012013495557125e-05,972.4517080372777,COMPLETE
1844,1.030313491821289,2023-09-04 22:51:14.428596,2023-09-04 22:51:14.666615,0 days 00:00:00.238019,ReLU,Leaky,Sigmoid,Leaky,43,17,19.0,14.0,7.0,0.010599511072001187,4,313,0.2739623822762965,0.021880224140884138,104.25988561456853,COMPLETE
1845,0.9153092503547668,2023-09-04 22:51:14.667150,2023-09-04 22:51:16.085368,0 days 00:00:01.418218,Tanh,Leaky,Sigmoid,Leaky,27,22,20.0,23.0,20.0,0.013382430520725387,4,226,0.606835712629317,0.05347072316822948,106.56319832801819,COMPLETE
1846,0.4652695655822754,2023-09-04 22:51:16.086378,2023-09-04 22:51:16.559034,0 days 00:00:00.472656,Leaky,Leaky,Sigmoid,Sigmoid,84,21,20.0,16.0,16.0,0.018546939808046725,4,275,0.16881709782835408,0.0034264385147004524,162.1991483415876,COMPLETE
1847,0.3079417645931244,2023-09-04 22:51:16.559554,2023-09-04 22:51:17.324601,0 days 00:00:00.765047,Sigmoid,Tanh,ReLU,Leaky,85,19,22.0,24.0,2.0,0.004876455363748847,4,252,0.7691340165046319,9.220631612049171e-05,174.58472993638782,COMPLETE
1848,0.718284010887146,2023-09-04 22:51:17.325164,2023-09-04 22:51:18.868451,0 days 00:00:01.543287,Tanh,Leaky,Sigmoid,Sigmoid,94,20,20.0,16.0,1.0,0.001118738224314683,4,204,0.7323670887896311,0.00030396402852283713,157.99461568196614,COMPLETE
1849,1.112776279449463,2023-09-04 22:51:18.868991,2023-09-04 22:51:19.144671,0 days 00:00:00.275680,ReLU,ReLU,Sigmoid,Tanh,88,18,21.0,21.0,4.0,0.0031711327377359115,4,265,0.6733308848840873,0.03646496636861231,98.8564453125,COMPLETE
1850,1.0737425088882446,2023-09-04 22:51:19.145218,2023-09-04 22:51:19.379932,0 days 00:00:00.234714,Tanh,Sigmoid,Sigmoid,Leaky,33,17,18.0,15.0,18.0,0.008464602396474603,4,177,0.2258772139176294,0.017341398252788173,9673.67251586914,COMPLETE
1851,0.5815881490707397,2023-09-04 22:51:19.380478,2023-09-04 22:51:20.056002,0 days 00:00:00.675524,Leaky,Leaky,ReLU,Leaky,58,19,19.0,22.0,6.0,0.0002545552589126231,4,231,0.10352211708397843,2.6201891836647594e-05,142.2600554759368,COMPLETE
1852,0.41531431674957275,2023-09-04 22:51:20.056523,2023-09-04 22:51:21.024889,0 days 00:00:00.968366,Sigmoid,Leaky,Sigmoid,ReLU,79,10,21.0,13.0,10.0,0.01589297340650121,4,219,0.7688160848513567,0.00016544500856204751,138.99482323782786,COMPLETE
1853,0.23449251055717468,2023-09-04 22:51:21.025423,2023-09-04 22:51:21.769987,0 days 00:00:00.744564,Tanh,Leaky,Sigmoid,Sigmoid,92,15,19.0,24.0,17.0,0.02253507887235118,4,285,0.7145516625132289,0.0001222214403276519,85.35774569241505,COMPLETE
1854,0.34086260199546814,2023-09-04 22:51:21.770523,2023-09-04 22:51:22.514827,0 days 00:00:00.744304,Tanh,Leaky,Sigmoid,Leaky,82,14,20.0,23.0,20.0,0.002570024551421442,4,249,0.7994811490049668,0.0002394087114731453,205.4896128128986,COMPLETE
1855,0.3375781178474426,2023-09-04 22:51:22.515393,2023-09-04 22:51:23.871696,0 days 00:00:01.356303,ReLU,Leaky,ReLU,Sigmoid,35,18,18.0,23.0,19.0,0.0014984787705420316,4,303,0.7528709546946303,0.0004093044710495005,1112.6319438135902,COMPLETE
1856,0.36236363649368286,2023-09-04 22:51:23.872232,2023-09-04 22:51:24.404595,0 days 00:00:00.532363,Sigmoid,Leaky,Sigmoid,Leaky,86,16,23.0,17.0,8.0,0.012584192355296559,4,160,0.7344535955886926,0.0001926374357101162,182.7998066493443,COMPLETE
1857,0.33626002073287964,2023-09-04 22:51:24.405147,2023-09-04 22:51:25.058315,0 days 00:00:00.653168,Tanh,Leaky,Sigmoid,Leaky,30,12,22.0,14.0,5.0,0.009796783346450209,4,241,0.4476754577355301,1.5143536683633812e-05,128.33045034697562,COMPLETE
1858,0.5511614084243774,2023-09-04 22:51:25.058853,2023-09-04 22:51:25.932720,0 days 00:00:00.873867,Leaky,Leaky,Sigmoid,Sigmoid,89,1,19.0,15.0,4.0,0.019433465077730326,4,296,0.691150203677981,1.1527200708501265e-05,188.07240942752722,COMPLETE
1859,0.4421709179878235,2023-09-04 22:51:25.933267,2023-09-04 22:51:26.350123,0 days 00:00:00.416856,Tanh,Leaky,Sigmoid,Leaky,47,19,20.0,24.0,15.0,0.015335855481576434,4,235,0.33198714730654627,0.00014245211045543264,353.0807237625122,COMPLETE
1860,0.40821215510368347,2023-09-04 22:51:26.350649,2023-09-04 22:51:26.735921,0 days 00:00:00.385272,ReLU,Leaky,Leaky,Sigmoid,81,18,21.0,23.0,6.0,0.029885438800617392,4,263,0.2455871202406009,5.9227791061730295e-05,208.93472520360407,COMPLETE
1861,0.5056553483009338,2023-09-04 22:51:26.736472,2023-09-04 22:51:27.098152,0 days 00:00:00.361680,Sigmoid,Leaky,ReLU,Leaky,83,20,20.0,22.0,18.0,0.042019924319721874,4,278,0.14762451596109874,9.697769901776715e-05,359.88482089572483,COMPLETE
1862,1.059731125831604,2023-09-04 22:51:27.099162,2023-09-04 22:51:27.469314,0 days 00:00:00.370152,Tanh,ReLU,Sigmoid,Leaky,76,21,21.0,16.0,7.0,0.01292849913262113,4,210,0.11422679118043207,0.09927900450926852,103.89813509854403,COMPLETE
1863,1.1271990537643433,2023-09-04 22:51:27.470315,2023-09-04 22:51:30.008517,0 days 00:00:02.538202,Leaky,Leaky,Sigmoid,Sigmoid,96,19,17.0,15.0,5.0,3.3600525833099546e-05,4,228,0.7694291605843844,0.06276055383762681,116.85811350638406,COMPLETE
1864,0.37790215015411377,2023-09-04 22:51:30.009037,2023-09-04 22:51:30.341264,0 days 00:00:00.332227,Tanh,Leaky,Sigmoid,Leaky,51,20,22.0,24.0,3.0,0.005640885086322714,4,247,0.130673039737858,0.00034358052230519466,154.80772484673395,COMPLETE
1865,0.34152424335479736,2023-09-04 22:51:30.341797,2023-09-04 22:51:33.737788,0 days 00:00:03.395991,Tanh,Leaky,ReLU,ReLU,85,17,19.0,23.0,16.0,0.0001662887535385542,4,290,0.7394781258581912,0.0006772927754595796,122.90518038519498,COMPLETE
1866,0.4147768020629883,2023-09-04 22:51:33.738315,2023-09-04 22:51:34.392242,0 days 00:00:00.653927,Sigmoid,Leaky,Tanh,Leaky,39,18,20.0,22.0,19.0,0.010374488229640938,4,195,0.5829045732553222,5.2288151179163e-05,151.01999294396603,COMPLETE
1867,0.414292573928833,2023-09-04 22:51:34.392769,2023-09-04 22:51:36.848822,0 days 00:00:02.456053,ReLU,Leaky,Sigmoid,Sigmoid,28,23,18.0,15.0,17.0,0.000750510748845317,4,221,0.6671652446089075,7.794713981532351e-05,116.39662243769719,COMPLETE
1868,0.973080039024353,2023-09-04 22:51:36.849355,2023-09-04 22:51:39.314422,0 days 00:00:02.465067,Tanh,Leaky,Sigmoid,,87,10,21.0,24.0,,1.3431195045255887e-05,3,255,0.7061132915841668,1.9646407745566482e-05,102.85917935838886,COMPLETE
1869,0.6224538683891296,2023-09-04 22:51:39.314927,2023-09-04 22:51:39.704087,0 days 00:00:00.389160,Leaky,Leaky,Sigmoid,Leaky,36,11,23.0,16.0,5.0,0.0070474695353120904,4,269,0.290169293696707,0.00026749363333824973,154.54483713422502,COMPLETE
1870,0.2627621591091156,2023-09-04 22:51:39.704623,2023-09-04 22:51:41.197161,0 days 00:00:01.492538,Tanh,Leaky,Sigmoid,Sigmoid,31,19,20.0,23.0,7.0,0.01773141485492173,4,236,0.7725351687318043,3.8333267799597656e-05,103.68722643171039,COMPLETE
1871,0.4039933383464813,2023-09-04 22:51:41.197689,2023-09-04 22:51:41.567591,0 days 00:00:00.369902,Sigmoid,Tanh,ReLU,Leaky,90,22,22.0,19.0,6.0,0.023944293850092977,4,243,0.17365015161001632,0.00017051607503481845,232.2187742150348,COMPLETE
