number,value,datetime_start,datetime_complete,duration,params_activation1,params_activation2,params_activation3,params_activation4,params_batch_size,params_fl1,params_fl2,params_fl3,params_fl4,params_learning_rate,params_n_layers,params_num_epochs,params_train_size,params_weight_decay,user_attrs_mre,state
1338,0.3320438861846924,2023-09-04 22:31:09.281871,2023-09-04 22:31:11.218605,0 days 00:00:01.936734,ReLU,Leaky,Leaky,Sigmoid,29,18,21.0,19.0,16.0,0.0004732362137724685,4,315,0.5007180005243583,0.00012473614391196052,125.11355116760846,COMPLETE
1339,0.8947962522506714,2023-09-04 22:31:11.219072,2023-09-04 22:31:14.512166,0 days 00:00:03.293094,Sigmoid,Leaky,Sigmoid,Leaky,67,17,20.0,23.0,14.0,2.254384607211559e-05,4,258,0.6950085445716935,3.414346692147204e-05,106.13685690709787,COMPLETE
1340,0.28363093733787537,2023-09-04 22:31:14.512621,2023-09-04 22:31:15.428781,0 days 00:00:00.916160,Tanh,Leaky,ReLU,Sigmoid,36,16,16.0,22.0,22.0,0.015816317902906663,4,182,0.7461601172366988,9.126703427546717e-05,110.53546018858214,COMPLETE
1341,0.5090658068656921,2023-09-04 22:31:15.429268,2023-09-04 22:31:15.642070,0 days 00:00:00.212802,Tanh,Leaky,Sigmoid,Leaky,85,20,22.0,24.0,15.0,0.02520822293067992,4,292,0.21452057090023968,0.00023940194145091414,416.09642791748047,COMPLETE
1342,0.3805992901325226,2023-09-04 22:31:15.642724,2023-09-04 22:31:17.575624,0 days 00:00:01.932900,ReLU,Leaky,Sigmoid,Sigmoid,26,19,19.0,23.0,17.0,0.0023532103022383196,4,223,0.6386291202227938,2.0782660902968768e-05,134.9174272664388,COMPLETE
1343,0.841537356376648,2023-09-04 22:31:17.576111,2023-09-04 22:31:23.241400,0 days 00:00:05.665289,Tanh,Leaky,Tanh,Leaky,31,18,21.0,24.0,2.0,1.5016369145852342e-05,4,234,0.7284408837398633,0.0001687636077687356,89.23694447574452,COMPLETE
1344,0.39659783244132996,2023-09-04 22:31:23.241874,2023-09-04 22:31:24.031846,0 days 00:00:00.789972,Sigmoid,Leaky,Sigmoid,Leaky,23,20,19.0,23.0,7.0,0.012821441211895719,4,245,0.7714309030393098,0.00020799971985064562,189.85866074335007,COMPLETE
1345,0.7967260479927063,2023-09-04 22:31:24.032322,2023-09-04 22:31:24.363446,0 days 00:00:00.331124,Tanh,Tanh,ReLU,Sigmoid,84,19,20.0,24.0,8.0,0.00972523326883482,4,197,0.7030067782752909,0.09488939415596012,102.74050100226151,COMPLETE
1346,1.0917747020721436,2023-09-04 22:31:24.363944,2023-09-04 22:31:24.599648,0 days 00:00:00.235704,Tanh,Leaky,Sigmoid,ReLU,86,18,20.0,23.0,6.0,0.0014081113228247388,4,272,0.30256398405900986,0.046177912313167514,148.13309578273606,COMPLETE
1347,0.5050240755081177,2023-09-04 22:31:24.600110,2023-09-04 22:31:24.869262,0 days 00:00:00.269152,ReLU,Leaky,Sigmoid,Leaky,80,17,17.0,12.0,19.0,0.018607958685319007,4,261,0.22440164619411174,7.972843423591439e-05,233.19081899282094,COMPLETE
1348,1.4616369009017944,2023-09-04 22:31:24.869723,2023-09-04 22:31:25.012494,0 days 00:00:00.142771,Sigmoid,Leaky,Sigmoid,Sigmoid,88,20,20.0,22.0,21.0,0.0026881532618021494,4,225,0.10321114180617069,0.0012115991108629788,145.01079686482748,COMPLETE
1349,0.31625059247016907,2023-09-04 22:31:25.012949,2023-09-04 22:31:25.372582,0 days 00:00:00.359633,Tanh,Leaky,Sigmoid,Leaky,74,10,19.0,23.0,20.0,0.008026648150015565,4,242,0.20892022916920708,0.0002733233572684398,92.95899555600923,COMPLETE
1350,0.30971530079841614,2023-09-04 22:31:25.373049,2023-09-04 22:31:26.210218,0 days 00:00:00.837169,Tanh,Leaky,ReLU,Leaky,34,18,21.0,24.0,4.0,0.013979849097295277,4,254,0.7462564589914779,0.008323416089495305,124.30918335914612,COMPLETE
1351,0.3818601667881012,2023-09-04 22:31:26.210679,2023-09-04 22:31:28.321947,0 days 00:00:02.111268,Sigmoid,Leaky,Sigmoid,Sigmoid,83,19,22.0,24.0,17.0,0.0037620877136589673,4,189,0.7993717241212424,0.00015085085186410333,156.30365434892337,COMPLETE
1352,0.8231740593910217,2023-09-04 22:31:28.322399,2023-09-04 22:31:28.988299,0 days 00:00:00.665900,ReLU,Leaky,Sigmoid,Leaky,55,18,20.0,23.0,15.0,0.011377669454151225,4,306,0.6681061337698156,0.04429794242128152,101.59914276123047,COMPLETE
1353,0.6122140884399414,2023-09-04 22:31:28.988770,2023-09-04 22:31:29.400520,0 days 00:00:00.411750,Tanh,Leaky,Sigmoid,Sigmoid,91,20,18.0,22.0,5.0,0.00517145358458136,4,280,0.12775587291863483,0.000793516001097047,150.46391102419062,COMPLETE
1354,0.3757844865322113,2023-09-04 22:31:29.401389,2023-09-04 22:31:30.163914,0 days 00:00:00.762525,Tanh,Leaky,ReLU,Leaky,81,19,21.0,13.0,6.0,0.019612317078598628,4,234,0.2848834351362117,0.00011407361913349698,249.33765020603087,COMPLETE
1355,0.44364646077156067,2023-09-04 22:31:30.164783,2023-09-04 22:31:33.522211,0 days 00:00:03.357428,Sigmoid,Leaky,Sigmoid,Sigmoid,86,15,19.0,24.0,3.0,0.00189592047331481,4,219,0.7678497863467226,0.0004205482630576939,166.25362087342796,COMPLETE
1356,0.3097188472747803,2023-09-04 22:31:33.522690,2023-09-04 22:31:34.638572,0 days 00:00:01.115882,Tanh,Leaky,Sigmoid,Leaky,30,16,20.0,22.0,18.0,0.0161587559101655,4,294,0.5104772694400298,6.327000054424984e-05,164.1100536073957,COMPLETE
1357,0.3108624517917633,2023-09-04 22:31:34.639056,2023-09-04 22:31:35.525978,0 days 00:00:00.886922,ReLU,Leaky,Sigmoid,Leaky,84,17,21.0,24.0,19.0,0.032462626726791004,4,267,0.7269706827177587,0.0014332260786642545,256.8864178864852,COMPLETE
1358,0.3614579439163208,2023-09-04 22:31:35.526464,2023-09-04 22:31:36.049248,0 days 00:00:00.522784,Tanh,Leaky,Sigmoid,Sigmoid,93,10,18.0,21.0,4.0,0.023991964200796287,4,245,0.6994354466106998,0.0003295482731864403,124.56694954320004,COMPLETE
1359,0.320908784866333,2023-09-04 22:31:36.049724,2023-09-04 22:31:36.637870,0 days 00:00:00.588146,Sigmoid,Leaky,ReLU,ReLU,28,18,19.0,23.0,16.0,0.00992217371960315,4,172,0.18585595608083672,5.077853053222713e-05,110.79405430385044,COMPLETE
1360,0.8799188733100891,2023-09-04 22:31:36.638351,2023-09-04 22:31:37.789382,0 days 00:00:01.151031,Tanh,Leaky,Sigmoid,Leaky,87,19,22.0,23.0,7.0,1.647022392452024e-05,4,233,0.24731081395720925,0.017164371511808274,96.98748379817847,COMPLETE
1361,0.46598201990127563,2023-09-04 22:31:37.789844,2023-09-04 22:31:38.159723,0 days 00:00:00.369879,ReLU,Leaky,Sigmoid,Sigmoid,83,19,20.0,24.0,20.0,0.012543015748993764,4,203,0.2822260777779144,0.0007141458706153315,151.45721482257454,COMPLETE
1362,0.34259384870529175,2023-09-04 22:31:38.160235,2023-09-04 22:31:38.951210,0 days 00:00:00.790975,Tanh,,,,33,18,,,,0.050913324928954104,1,252,0.7482464381763623,9.001088777337506e-05,142.09455446096567,COMPLETE
1363,0.3517104983329773,2023-09-04 22:31:38.951676,2023-09-04 22:31:39.678038,0 days 00:00:00.726362,Sigmoid,Leaky,Leaky,Leaky,89,20,20.0,23.0,18.0,0.006876195234621403,4,161,0.5737283462229248,0.00018818308256895053,173.78960043485048,COMPLETE
1364,0.8900113105773926,2023-09-04 22:31:39.678565,2023-09-04 22:31:39.879958,0 days 00:00:00.201393,Tanh,Leaky,Sigmoid,Sigmoid,77,17,19.0,24.0,5.0,0.016692050701825986,4,241,0.11488465717658046,0.0586330303619562,98.96436397845929,COMPLETE
1365,0.3447889983654022,2023-09-04 22:31:39.880476,2023-09-04 22:31:40.725426,0 days 00:00:00.844950,Tanh,Leaky,ReLU,Leaky,45,18,21.0,11.0,7.0,0.020935282686661696,4,214,0.7712678811952904,2.6060100807048965e-05,142.2176604800754,COMPLETE
1366,0.6533174514770508,2023-09-04 22:31:40.725903,2023-09-04 22:31:42.096255,0 days 00:00:01.370352,ReLU,Leaky,Sigmoid,Leaky,82,20,20.0,22.0,17.0,3.428422388530624e-05,4,227,0.33020676916851305,0.0001422450290744494,95.79344842717511,COMPLETE
1367,1.2984336614608765,2023-09-04 22:31:42.096756,2023-09-04 22:31:43.206995,0 days 00:00:01.110239,Sigmoid,Leaky,Sigmoid,Sigmoid,85,19,21.0,23.0,1.0,0.0003479131154635345,4,267,0.23395510736322564,0.036305351643521284,1686.2195564870085,COMPLETE
1368,0.2641235888004303,2023-09-04 22:31:43.207499,2023-09-04 22:31:44.209105,0 days 00:00:01.001606,Tanh,Tanh,Sigmoid,Leaky,80,17,19.0,24.0,19.0,0.014495759706573946,4,290,0.7287749409126416,3.900316928547654e-05,127.87978444417318,COMPLETE
1369,0.39642900228500366,2023-09-04 22:31:44.209601,2023-09-04 22:31:45.537390,0 days 00:00:01.327789,Tanh,Leaky,ReLU,Sigmoid,36,19,20.0,22.0,6.0,0.0012230815108739467,4,259,0.6710029685333224,7.189896365045111e-05,148.3318140130294,COMPLETE
1370,0.3383532166481018,2023-09-04 22:31:45.537944,2023-09-04 22:31:47.360515,0 days 00:00:01.822571,ReLU,Leaky,Tanh,Leaky,86,18,21.0,23.0,2.0,0.0001223453063654822,4,248,0.4154192033990028,1.932113481492469e-05,118.23273083471483,COMPLETE
1371,0.5950632691383362,2023-09-04 22:31:47.361117,2023-09-04 22:31:47.627918,0 days 00:00:00.266801,Sigmoid,Leaky,Sigmoid,Sigmoid,84,20,20.0,24.0,4.0,0.02766379991566065,4,316,0.3466449074108781,0.00022419774497729286,273.98407563709077,COMPLETE
1372,0.6791213154792786,2023-09-04 22:31:47.628436,2023-09-04 22:31:48.920583,0 days 00:00:01.292147,Tanh,Leaky,Sigmoid,Leaky,32,17,22.0,14.0,8.0,0.0006418323211787423,4,237,0.7704542932181571,0.012851240415415476,138.1090685822243,COMPLETE
1373,0.23540809750556946,2023-09-04 22:31:48.921229,2023-09-04 22:31:49.530129,0 days 00:00:00.608900,Tanh,Leaky,Sigmoid,Leaky,82,19,20.0,23.0,9.0,0.008906741996281081,4,227,0.7107470219463721,0.00010266335688230495,125.11707796369281,COMPLETE
1374,0.34789079427719116,2023-09-04 22:31:49.530653,2023-09-04 22:31:50.045027,0 days 00:00:00.514374,Tanh,Leaky,Sigmoid,ReLU,88,18,19.0,23.0,5.0,0.011650945852760978,4,282,0.4768005534730767,0.0001254638589740703,129.1428325359638,COMPLETE
1375,0.5146856904029846,2023-09-04 22:31:50.045552,2023-09-04 22:31:51.099033,0 days 00:00:01.053481,Sigmoid,Leaky,ReLU,Sigmoid,30,18,21.0,24.0,6.0,0.004168244930200948,4,299,0.7998439972800624,0.00016799188527441105,156.3540496826172,COMPLETE
1376,0.7940260767936707,2023-09-04 22:31:51.099541,2023-09-04 22:31:51.850183,0 days 00:00:00.750642,ReLU,Leaky,Sigmoid,Leaky,35,19,17.0,22.0,17.0,6.698614213268389e-05,4,253,0.17310867991189227,0.023465525814627335,104.25136244924445,COMPLETE
1377,0.6117644309997559,2023-09-04 22:31:51.850709,2023-09-04 22:31:52.129375,0 days 00:00:00.278666,Tanh,Leaky,Sigmoid,Sigmoid,79,20,19.0,12.0,18.0,0.0031433743025276813,4,181,0.1476678331791405,5.9607980700972715e-05,177.11035405034605,COMPLETE
1378,0.4213649332523346,2023-09-04 22:31:52.129910,2023-09-04 22:31:55.022681,0 days 00:00:02.892771,Tanh,Leaky,Sigmoid,Leaky,25,17,20.0,20.0,20.0,0.0003951436770161195,4,210,0.6131070758477258,0.0002589433811332913,137.09077575683594,COMPLETE
1379,0.6239717602729797,2023-09-04 22:31:55.023194,2023-09-04 22:31:58.809741,0 days 00:00:03.786547,Sigmoid,Leaky,ReLU,Sigmoid,28,18,18.0,24.0,5.0,0.00015304975423869225,4,238,0.3955244267778873,8.311299190952668e-05,164.9104497893518,COMPLETE
1380,0.48734283447265625,2023-09-04 22:31:58.810240,2023-09-04 22:31:59.513513,0 days 00:00:00.703273,ReLU,Leaky,Sigmoid,Leaky,90,10,22.0,23.0,6.0,0.0015988671294858046,4,275,0.31464102133272287,0.006346485915458672,187.44604430327544,COMPLETE
1381,0.3650398850440979,2023-09-04 22:31:59.514004,2023-09-04 22:32:00.298481,0 days 00:00:00.784477,Tanh,Leaky,Sigmoid,Leaky,85,19,21.0,23.0,16.0,0.018511505655265645,4,308,0.7480513849991127,0.0004682754510117653,119.14085388183594,COMPLETE
1382,0.3506167232990265,2023-09-04 22:32:00.299006,2023-09-04 22:32:01.047397,0 days 00:00:00.748391,Tanh,Leaky,Sigmoid,Sigmoid,82,14,20.0,22.0,18.0,0.012778660856502215,4,222,0.4555775569754919,0.0001919699188604425,170.28508155728565,COMPLETE
1383,0.2942143380641937,2023-09-04 22:32:01.047929,2023-09-04 22:32:01.839827,0 days 00:00:00.791898,Sigmoid,Leaky,Sigmoid,Leaky,87,16,19.0,21.0,7.0,0.015683216337619658,4,243,0.6386760899572586,5.029200412896084e-05,183.5122173854283,COMPLETE
1384,0.38312771916389465,2023-09-04 22:32:01.840368,2023-09-04 22:32:02.399880,0 days 00:00:00.559512,Tanh,Leaky,ReLU,Sigmoid,84,20,21.0,13.0,5.0,0.02228484570205507,4,263,0.6969705213601041,0.0001136244767285135,280.55413505358575,COMPLETE
1385,0.32209524512290955,2023-09-04 22:32:02.400419,2023-09-04 22:32:04.334399,0 days 00:00:01.933980,ReLU,Leaky,Sigmoid,Leaky,22,19,20.0,24.0,19.0,0.0010394171968018653,4,191,0.7727238614418641,1.1964411218578778e-05,127.98258425154776,COMPLETE
1386,0.349223256111145,2023-09-04 22:32:04.334901,2023-09-04 22:32:04.713760,0 days 00:00:00.378859,Tanh,Leaky,Sigmoid,ReLU,81,18,20.0,23.0,4.0,0.01063414328058807,4,461,0.14455421316463252,0.0016507273072509734,129.85350690569197,COMPLETE
1387,0.5982496738433838,2023-09-04 22:32:04.714462,2023-09-04 22:32:05.047692,0 days 00:00:00.333230,Leaky,Leaky,Sigmoid,Leaky,33,20,19.0,14.0,3.0,0.005574385764616915,4,231,0.13130951573979943,2.9887768663396775e-05,629.359584974206,COMPLETE
1388,0.4725051522254944,2023-09-04 22:32:05.048352,2023-09-04 22:32:05.814806,0 days 00:00:00.766454,Sigmoid,Leaky,Leaky,Sigmoid,52,18,6.0,24.0,17.0,0.007647774714076293,4,248,0.18958816027580008,6.517176220214799e-05,159.81916190482474,COMPLETE
1389,0.30883798003196716,2023-09-04 22:32:05.815462,2023-09-04 22:32:06.243271,0 days 00:00:00.427809,Tanh,Leaky,ReLU,Leaky,86,18,21.0,23.0,6.0,0.014213858772353124,4,217,0.7288633272120834,0.0001442647403236764,411.5541020146123,COMPLETE
1390,0.36953234672546387,2023-09-04 22:32:06.243778,2023-09-04 22:32:06.829857,0 days 00:00:00.586079,ReLU,Tanh,Sigmoid,Sigmoid,31,17,22.0,22.0,5.0,0.02715704228707044,4,254,0.3690022526527383,0.0025994428938687555,199.93120513091216,COMPLETE
1391,0.29748979210853577,2023-09-04 22:32:06.830348,2023-09-04 22:32:07.673275,0 days 00:00:00.842927,Tanh,Leaky,Sigmoid,Leaky,43,19,14.0,24.0,16.0,0.0186511981921995,4,232,0.7506560625499764,0.00031446937924832946,189.12737900171524,COMPLETE
1392,0.8463943600654602,2023-09-04 22:32:07.673790,2023-09-04 22:32:07.966358,0 days 00:00:00.292568,Sigmoid,Leaky,Tanh,Sigmoid,78,20,20.0,23.0,19.0,0.04008743228486483,4,284,0.6880911904598478,0.08106668820720234,118.54562432425362,COMPLETE
1393,0.39486458897590637,2023-09-04 22:32:07.966833,2023-09-04 22:32:09.314543,0 days 00:00:01.347710,Leaky,Leaky,Sigmoid,Leaky,37,16,21.0,14.0,2.0,0.009420821782382256,4,171,0.7205358232033428,9.54839809661241e-05,131.15680571525328,COMPLETE
1394,0.31291434168815613,2023-09-04 22:32:09.315053,2023-09-04 22:32:09.942343,0 days 00:00:00.627290,Tanh,Leaky,ReLU,Leaky,89,19,19.0,24.0,18.0,0.01587561064990983,4,268,0.7686506145151062,0.0008481882684525743,124.30452277443625,COMPLETE
1395,0.22395221889019012,2023-09-04 22:32:09.942837,2023-09-04 22:32:11.066581,0 days 00:00:01.123744,Tanh,Leaky,Sigmoid,Sigmoid,83,18,20.0,23.0,6.0,0.004633032238617061,4,243,0.7427467775051187,7.348929636551712e-05,108.67381437325183,COMPLETE
1396,0.878362238407135,2023-09-04 22:32:11.067097,2023-09-04 22:32:11.244173,0 days 00:00:00.177076,Tanh,Leaky,Sigmoid,Sigmoid,84,17,20.0,22.0,7.0,0.0042913406958771634,4,225,0.1087113091674027,0.03265060120276227,103.24331188201904,COMPLETE
1397,0.3190891742706299,2023-09-04 22:32:11.244700,2023-09-04 22:32:12.517922,0 days 00:00:01.273222,ReLU,Leaky,Sigmoid,Leaky,81,18,19.0,22.0,7.0,0.004220350683750503,4,206,0.798876079859667,8.863661939840596e-05,103.48468075627866,COMPLETE
1398,0.33235228061676025,2023-09-04 22:32:12.518426,2023-09-04 22:32:13.717495,0 days 00:00:01.199069,Sigmoid,Leaky,Sigmoid,Sigmoid,87,18,21.0,22.0,7.0,0.0067908632406722,4,239,0.6533969193968691,7.13073154753808e-05,216.05236147527825,COMPLETE
1399,0.31382474303245544,2023-09-04 22:32:13.718392,2023-09-04 22:32:15.479173,0 days 00:00:01.760781,Leaky,Leaky,Sigmoid,ReLU,48,17,18.0,21.0,6.0,0.003161208216192453,4,305,0.7261466284517111,0.00011960864143416335,146.36322339375815,COMPLETE
1400,0.37881141901016235,2023-09-04 22:32:15.479698,2023-09-04 22:32:16.009788,0 days 00:00:00.530090,Tanh,Leaky,ReLU,Leaky,92,18,20.0,22.0,6.0,0.003667485916166855,4,230,0.4777803801240901,7.996791822359826e-05,114.67761046798141,COMPLETE
1401,0.3902626931667328,2023-09-04 22:32:16.010285,2023-09-04 22:32:17.202756,0 days 00:00:01.192471,Tanh,Leaky,Sigmoid,Leaky,30,18,21.0,23.0,7.0,0.002835636318777054,4,216,0.5262756078053972,0.00021735889128206583,168.13591448465982,COMPLETE
1402,0.7059807777404785,2023-09-04 22:32:17.203251,2023-09-04 22:32:24.203440,0 days 00:00:07.000189,Sigmoid,Leaky,Sigmoid,Sigmoid,34,18,20.0,22.0,8.0,2.4527670452394666e-05,4,296,0.7491941984846471,0.00010385183320872567,141.001180236404,COMPLETE
1403,0.4060375690460205,2023-09-04 22:32:24.203933,2023-09-04 22:32:24.503546,0 days 00:00:00.299613,ReLU,Leaky,Sigmoid,Leaky,85,17,22.0,23.0,6.0,0.005197380134376894,4,244,0.13963342872144158,0.00017591422759701992,121.1811819637523,COMPLETE
1404,0.28246253728866577,2023-09-04 22:32:24.504040,2023-09-04 22:32:26.565622,0 days 00:00:02.061582,Tanh,Leaky,ReLU,Sigmoid,27,18,20.0,23.0,6.0,0.003528076174581269,4,237,0.6854796463882203,0.00013784591278853312,102.42502483423205,COMPLETE
1405,0.331423819065094,2023-09-04 22:32:26.566134,2023-09-04 22:32:27.554987,0 days 00:00:00.988853,Leaky,Leaky,Sigmoid,Leaky,83,18,18.0,23.0,7.0,0.002307455133728203,4,197,0.44522541680590777,0.00027054347839805233,121.52739099870648,COMPLETE
1406,0.32229724526405334,2023-09-04 22:32:27.555895,2023-09-04 22:32:30.056506,0 days 00:00:02.500611,Tanh,Leaky,Sigmoid,Sigmoid,79,17,19.0,18.0,8.0,0.0053073927734345275,4,256,0.7752058095652401,0.0059323423628842645,131.83035107955192,COMPLETE
1407,0.20792843401432037,2023-09-04 22:32:30.057024,2023-09-04 22:32:31.442079,0 days 00:00:01.385055,Sigmoid,Leaky,Sigmoid,Leaky,88,19,22.0,22.0,17.0,0.004889756115759196,4,275,0.7116134795059464,1.605702633435296e-05,138.6592283982497,COMPLETE
1408,0.350033700466156,2023-09-04 22:32:31.442627,2023-09-04 22:32:32.145605,0 days 00:00:00.702978,Tanh,Leaky,Sigmoid,Leaky,91,19,23.0,21.0,20.0,0.004198822434689059,4,277,0.424564381952124,1.5545452015628674e-05,141.44786224365234,COMPLETE
1409,0.326948344707489,2023-09-04 22:32:32.146120,2023-09-04 22:32:32.603164,0 days 00:00:00.457044,ReLU,Leaky,ReLU,Sigmoid,93,19,22.0,21.0,6.0,0.005217234945824392,4,275,0.4925000262911646,1.7492929427488078e-05,111.53926589272238,COMPLETE
1410,0.42890310287475586,2023-09-04 22:32:32.603704,2023-09-04 22:32:33.198582,0 days 00:00:00.594878,Sigmoid,Leaky,Sigmoid,Leaky,91,19,22.0,21.0,15.0,0.0047181685590951695,4,287,0.25782510028303995,1.2808720338907396e-05,184.7511107246831,COMPLETE
1411,0.2992195785045624,2023-09-04 22:32:33.199083,2023-09-04 22:32:33.613681,0 days 00:00:00.414598,Leaky,Leaky,,,91,19,24.0,,,0.005733277056602184,2,284,0.6338635388381935,1.2191231823543794e-05,88.86930756341843,COMPLETE
1412,0.30117306113243103,2023-09-04 22:32:33.614309,2023-09-04 22:32:35.201596,0 days 00:00:01.587287,Tanh,Leaky,Sigmoid,Leaky,90,19,23.0,22.0,7.0,0.004039999908469921,4,274,0.6687366702468185,1.4324355228849964e-05,153.395584570395,COMPLETE
1413,0.38219496607780457,2023-09-04 22:32:35.202159,2023-09-04 22:32:35.822229,0 days 00:00:00.620070,Tanh,Leaky,Leaky,Sigmoid,87,19,22.0,22.0,6.0,0.006155567721411594,4,269,0.702256824388361,0.0005351788561056825,155.41002521514892,COMPLETE
1414,0.48638373613357544,2023-09-04 22:32:35.822810,2023-09-04 22:32:36.471819,0 days 00:00:00.649009,Sigmoid,Tanh,Sigmoid,ReLU,94,19,22.0,21.0,14.0,0.003262815634968992,4,288,0.21560093489963275,1.1690215775767132e-05,178.3839994631939,COMPLETE
1415,0.39422836899757385,2023-09-04 22:32:36.472329,2023-09-04 22:32:36.892568,0 days 00:00:00.420239,ReLU,Leaky,ReLU,Leaky,87,19,22.0,22.0,19.0,0.006450323723628736,4,280,0.29236535458862417,0.021953808927137854,126.37643691032163,COMPLETE
1416,0.262954980134964,2023-09-04 22:32:36.893073,2023-09-04 22:32:38.805541,0 days 00:00:01.912468,Tanh,Sigmoid,Sigmoid,Sigmoid,90,19,10.0,22.0,18.0,0.002885031800918633,4,267,0.6022621874286089,1.0994989882195007e-05,128.44725892150285,COMPLETE
1417,0.4141438603401184,2023-09-04 22:32:38.806048,2023-09-04 22:32:39.326432,0 days 00:00:00.520384,Leaky,Leaky,Sigmoid,Leaky,57,10,22.0,22.0,16.0,0.005217677434484698,4,263,0.7118023173242655,2.0770203196312467e-05,149.0915481022426,COMPLETE
1418,0.3906404674053192,2023-09-04 22:32:39.326949,2023-09-04 22:32:39.951699,0 days 00:00:00.624750,Tanh,Leaky,Sigmoid,Sigmoid,89,19,22.0,22.0,17.0,0.002117026388725116,4,289,0.6761853891027853,0.0002163426144523344,135.23242706298828,COMPLETE
1419,0.4302331805229187,2023-09-04 22:32:39.952218,2023-09-04 22:32:40.424615,0 days 00:00:00.472397,Sigmoid,Leaky,Sigmoid,Leaky,89,19,23.0,22.0,23.0,0.004332186958459403,4,276,0.258713538506133,1.7925555063041237e-05,145.19567530988212,COMPLETE
1420,0.2895400822162628,2023-09-04 22:32:40.425115,2023-09-04 22:32:43.183874,0 days 00:00:02.758759,Tanh,Leaky,Tanh,Leaky,32,2,22.0,21.0,6.0,0.00696488543816703,4,296,0.7459303995340165,1.4966294195853555e-05,343.7694537353516,COMPLETE
1421,0.37361040711402893,2023-09-04 22:32:43.184393,2023-09-04 22:32:44.515197,0 days 00:00:01.330804,ReLU,Leaky,ReLU,Sigmoid,88,18,22.0,22.0,1.0,0.0031208340948781334,4,262,0.7731145069374037,0.000340702675581266,129.8897503602852,COMPLETE
1422,0.2687765657901764,2023-09-04 22:32:44.515693,2023-09-04 22:32:45.819294,0 days 00:00:01.303601,Tanh,Leaky,Sigmoid,Leaky,35,19,23.0,23.0,19.0,0.004359703113456647,4,269,0.7218522683096072,0.00016845118871478855,121.24551552992601,COMPLETE
1423,1.0549724102020264,2023-09-04 22:32:45.819822,2023-09-04 22:32:46.199671,0 days 00:00:00.379849,Leaky,Leaky,Sigmoid,Sigmoid,30,20,22.0,23.0,8.0,0.004994210287045099,4,257,0.5552750499553657,0.01856266888660678,108.7601547241211,COMPLETE
1424,0.6231157779693604,2023-09-04 22:32:46.200178,2023-09-04 22:32:47.136013,0 days 00:00:00.935835,Sigmoid,Leaky,Sigmoid,Leaky,88,18,24.0,21.0,17.0,0.0019139182148402976,4,281,0.44360323729744,0.003468261064882823,200.16352850543566,COMPLETE
1425,0.29264554381370544,2023-09-04 22:32:47.136504,2023-09-04 22:32:47.769174,0 days 00:00:00.632670,Tanh,Leaky,ReLU,Leaky,28,18,21.0,22.0,7.0,0.008245561015280081,4,303,0.6576165811296241,1.7946768696332533e-05,100.14059484572638,COMPLETE
1426,0.2991228401660919,2023-09-04 22:32:47.769668,2023-09-04 22:32:49.136469,0 days 00:00:01.366801,ReLU,Leaky,Sigmoid,Sigmoid,37,15,22.0,23.0,21.0,0.005744482766101592,4,319,0.6969872971111546,0.0002514803140234642,153.38879215717316,COMPLETE
