number,value,datetime_start,datetime_complete,duration,params_activation1,params_activation2,params_activation3,params_activation4,params_batch_size,params_fl1,params_fl2,params_fl3,params_fl4,params_learning_rate,params_n_layers,params_num_epochs,params_train_size,params_weight_decay,user_attrs_mre,state
836,0.4239974021911621,2023-09-04 21:44:51.153599,2023-09-04 21:44:54.627289,0 days 00:00:03.473690,ReLU,Leaky,Sigmoid,,37,20,21.0,22.0,,0.00012663274102983903,3,190,0.7712666665340527,0.00021695772404636463,165.68378127248664,COMPLETE
837,0.4135459363460541,2023-09-04 21:44:54.627673,2023-09-04 21:44:55.193283,0 days 00:00:00.565610,Sigmoid,Leaky,Leaky,,32,21,24.0,8.0,,0.013795538483382748,3,279,0.2363065534514404,0.000366487209422162,296.3084098197318,COMPLETE
838,0.37438929080963135,2023-09-04 21:44:55.193659,2023-09-04 21:44:56.521130,0 days 00:00:01.327471,ReLU,ReLU,Tanh,,40,16,20.0,9.0,,0.0007736399097595084,3,200,0.3116018277968209,0.023816328532110912,976.2801847197319,COMPLETE
839,0.28815802931785583,2023-09-04 21:44:56.521537,2023-09-04 21:44:57.534921,0 days 00:00:01.013384,ReLU,Leaky,Leaky,,34,19,20.0,23.0,,0.0040727268219616355,3,169,0.7991350238991058,0.00026530006106405594,143.93839041392008,COMPLETE
840,0.35152536630630493,2023-09-04 21:44:57.535330,2023-09-04 21:44:58.800250,0 days 00:00:01.264920,ReLU,Tanh,Leaky,,38,18,22.0,8.0,,0.0025690490733531034,3,232,0.7476745909324368,3.313754941110037e-05,139.60464499030314,COMPLETE
841,0.35442930459976196,2023-09-04 21:44:58.800639,2023-09-04 21:45:00.399764,0 days 00:00:01.599125,Leaky,Leaky,Sigmoid,,29,20,21.0,22.0,,0.00100219558726008,3,213,0.2872021577146269,0.00013249542896920233,127.43283485454289,COMPLETE
842,0.45816752314567566,2023-09-04 21:45:00.400134,2023-09-04 21:45:01.253793,0 days 00:00:00.853659,Sigmoid,Leaky,Leaky,,31,21,22.0,20.0,,0.0050283778208190435,3,180,0.1734010225875206,0.0011086752764149822,173.72016272487411,COMPLETE
843,1.1301008462905884,2023-09-04 21:45:01.254180,2023-09-04 21:45:01.406597,0 days 00:00:00.152417,ReLU,Tanh,Leaky,,24,17,19.0,2.0,,0.01629852838433468,3,222,0.10545180897425184,0.029157658319070225,144.98798294067382,COMPLETE
844,0.3278976380825043,2023-09-04 21:45:01.406984,2023-09-04 21:45:02.159409,0 days 00:00:00.752425,ReLU,Leaky,Tanh,,36,19,21.0,19.0,,0.010415819409034964,3,300,0.6452149799767619,4.59164672855396e-05,169.69168819080699,COMPLETE
845,0.6573988795280457,2023-09-04 21:45:02.159817,2023-09-04 21:45:03.983215,0 days 00:00:01.823398,Sigmoid,Leaky,Sigmoid,,50,20,22.0,7.0,,0.00021853346757834738,3,195,0.7012355688135603,0.014723906173366129,191.9277044597425,COMPLETE
846,0.35201412439346313,2023-09-04 21:45:03.983607,2023-09-04 21:45:05.375851,0 days 00:00:01.392244,ReLU,ReLU,Leaky,,90,20,3.0,21.0,,0.0016060470209408831,3,243,0.7692907262623871,0.0024041412077559564,239.12014770507812,COMPLETE
847,0.3719123899936676,2023-09-04 21:45:05.376547,2023-09-04 21:45:07.350698,0 days 00:00:01.974151,ReLU,Leaky,Leaky,,34,18,23.0,9.0,,0.003328764653051593,3,208,0.4356824328227899,8.230699284253966e-05,138.89245051963655,COMPLETE
848,0.6042710542678833,2023-09-04 21:45:07.351118,2023-09-04 21:45:08.874734,0 days 00:00:01.523616,Sigmoid,Tanh,Leaky,,38,21,24.0,23.0,,0.00010802341719495067,3,236,0.2530881132087499,3.900873790807038e-05,242.34474702608787,COMPLETE
849,0.2867172062397003,2023-09-04 21:45:08.875124,2023-09-04 21:45:09.683935,0 days 00:00:00.808811,ReLU,Leaky,Sigmoid,,40,19,20.0,8.0,,0.01300586643700093,3,318,0.7298154981872014,0.00011711292103117216,220.42100524902344,COMPLETE
850,0.3443765938282013,2023-09-04 21:45:09.684338,2023-09-04 21:45:10.252321,0 days 00:00:00.567983,ReLU,Leaky,Tanh,,32,20,21.0,24.0,,0.02273283626516537,3,157,0.6799238427402299,0.000669055426402727,174.44068091256278,COMPLETE
851,0.3429173529148102,2023-09-04 21:45:10.252728,2023-09-04 21:45:14.356588,0 days 00:00:04.103860,ReLU,Leaky,Leaky,,27,21,19.0,23.0,,0.0003119467640410568,3,186,0.7529497417132107,1.9562560616062165e-05,5395.85215809581,COMPLETE
852,0.2896523177623749,2023-09-04 21:45:14.356972,2023-09-04 21:45:15.420411,0 days 00:00:01.063439,Sigmoid,ReLU,Leaky,,36,20,22.0,21.0,,0.033301304134438096,3,222,0.7728987316633399,0.0004455733277216747,172.09904978825494,COMPLETE
853,0.38958898186683655,2023-09-04 21:45:15.420802,2023-09-04 21:45:16.141543,0 days 00:00:00.720741,Leaky,Tanh,Sigmoid,,30,21,20.0,7.0,,0.04125381712950295,3,345,0.7223451352216932,2.2563218846508126e-05,278.65282786976206,COMPLETE
854,0.45588964223861694,2023-09-04 21:45:16.141950,2023-09-04 21:45:16.478490,0 days 00:00:00.336540,ReLU,Leaky,Leaky,,34,18,21.0,22.0,,0.002063949704995137,3,274,0.1453394620022364,1.1404235147368524e-05,158.67550589821556,COMPLETE
855,0.4604909420013428,2023-09-04 21:45:16.478888,2023-09-04 21:45:16.675343,0 days 00:00:00.196455,ReLU,Leaky,Leaky,,41,19,17.0,22.0,,0.0059753443580872435,3,336,0.10979793110811786,0.0012823571538604255,143.024275110123,COMPLETE
856,0.5829491019248962,2023-09-04 21:45:16.675791,2023-09-04 21:45:17.382926,0 days 00:00:00.707135,Sigmoid,Leaky,Tanh,,38,19,23.0,1.0,,0.004642229443418054,3,286,0.7991110491628969,0.0020742676402764385,207.317010667589,COMPLETE
857,0.5746296048164368,2023-09-04 21:45:17.383322,2023-09-04 21:45:19.269909,0 days 00:00:01.886587,ReLU,Tanh,Leaky,,55,20,18.0,23.0,,6.261430780031489e-05,3,175,0.6016303650298369,0.0001659983360223411,161.65200064522878,COMPLETE
858,0.5001774430274963,2023-09-04 21:45:19.270303,2023-09-04 21:45:19.466965,0 days 00:00:00.196662,ReLU,Leaky,Sigmoid,,35,21,21.0,9.0,,0.018149336813075363,3,198,0.12339626651491821,0.001604679478726537,310.0452033595035,COMPLETE
859,1.1220998764038086,2023-09-04 21:45:19.467347,2023-09-04 21:45:20.767281,0 days 00:00:01.299934,Sigmoid,ReLU,Leaky,,33,19,20.0,8.0,,1.2250613350294173e-05,3,238,0.18423612917509596,2.73551578135354e-05,146.29278641388197,COMPLETE
860,0.3433076739311218,2023-09-04 21:45:20.767683,2023-09-04 21:45:21.494319,0 days 00:00:00.726636,ReLU,Leaky,Leaky,,36,20,23.0,9.0,,0.00878582835996396,3,214,0.7438409274318378,0.009884684120597323,152.76131037661904,COMPLETE
861,0.3618394732475281,2023-09-04 21:45:21.494707,2023-09-04 21:45:21.871720,0 days 00:00:00.377013,ReLU,Tanh,Sigmoid,ReLU,39,18,22.0,21.0,21.0,0.014277185089860719,4,201,0.29981793160442094,3.517029584057348e-05,155.545166015625,COMPLETE
862,0.3862378001213074,2023-09-04 21:45:21.872132,2023-09-04 21:45:23.103432,0 days 00:00:01.231300,ReLU,Leaky,Leaky,,31,17,20.0,10.0,,0.0011941031607261192,3,228,0.5663466146321171,0.00028668159830799327,720.2564709472656,COMPLETE
863,0.38601866364479065,2023-09-04 21:45:23.103846,2023-09-04 21:45:25.450869,0 days 00:00:02.347023,Sigmoid,Leaky,Tanh,,29,21,19.0,23.0,,0.0007167670662422023,3,187,0.6890741143495107,5.275451488046939e-05,1584.557273400348,COMPLETE
864,0.5283182263374329,2023-09-04 21:45:25.451288,2023-09-04 21:45:26.204831,0 days 00:00:00.753543,Leaky,Leaky,Leaky,,37,21,22.0,22.0,,0.00025490492899222876,3,166,0.15408021582366657,0.0028826857874005222,7253.340735010354,COMPLETE
865,0.39410191774368286,2023-09-04 21:45:26.205208,2023-09-04 21:45:30.747532,0 days 00:00:04.542324,ReLU,ReLU,Leaky,,41,20,21.0,22.0,,5.294490248972078e-05,3,208,0.7736680115859024,9.394595757663183e-05,384.51948496011585,COMPLETE
866,0.5602728724479675,2023-09-04 21:45:30.747933,2023-09-04 21:45:31.352330,0 days 00:00:00.604397,ReLU,Tanh,Sigmoid,,33,19,22.0,8.0,,0.003800661237808171,3,246,0.7124173482593283,0.005504410244120442,209.89671681722004,COMPLETE
867,0.4550030529499054,2023-09-04 21:45:31.352702,2023-09-04 21:45:33.219022,0 days 00:00:01.866320,Sigmoid,Leaky,Leaky,,35,20,20.0,24.0,,0.0003708776832460452,3,263,0.659221009754855,4.322311012297375e-05,129.32472229003906,COMPLETE
868,0.569924533367157,2023-09-04 21:45:33.219409,2023-09-04 21:45:36.612943,0 days 00:00:03.393534,ReLU,Leaky,Leaky,,38,21,24.0,10.0,,5.623743055807885e-05,3,217,0.2767362903886508,0.0001491698625583231,1508.323970460672,COMPLETE
869,0.4717794358730316,2023-09-04 21:45:36.613346,2023-09-04 21:45:36.876043,0 days 00:00:00.262697,ReLU,Leaky,Tanh,,31,19,21.0,7.0,,0.011127683118163412,3,118,0.19539730947689113,3.134428745520699e-05,156.76124101526597,COMPLETE
870,0.34767383337020874,2023-09-04 21:45:36.876422,2023-09-04 21:45:39.981324,0 days 00:00:03.104902,Sigmoid,Tanh,Leaky,,26,20,23.0,9.0,,0.0026773294165862503,3,228,0.7987046519019083,7.280929607290869e-05,140.75883917236328,COMPLETE
871,0.5225542187690735,2023-09-04 21:45:39.981718,2023-09-04 21:45:43.433002,0 days 00:00:03.451284,ReLU,Leaky,Sigmoid,,33,18,22.0,23.0,,7.897810250467151e-05,3,364,0.3561258508383545,0.00020468421459389198,331.2751660399385,COMPLETE
872,0.33831584453582764,2023-09-04 21:45:43.433389,2023-09-04 21:45:44.297408,0 days 00:00:00.864019,ReLU,ReLU,Leaky,,37,21,19.0,8.0,,0.005659976008048178,3,193,0.749898812770579,4.8255633639087554e-05,206.96731666896653,COMPLETE
873,0.3181941509246826,2023-09-04 21:45:44.297802,2023-09-04 21:45:44.811716,0 days 00:00:00.513914,ReLU,Leaky,Leaky,,35,20,18.0,22.0,,0.020540918915790286,3,310,0.7693160740216045,1.3822983829150204e-05,165.9318733215332,COMPLETE
874,0.35810938477516174,2023-09-04 21:45:44.812133,2023-09-04 21:45:48.365580,0 days 00:00:03.553447,Sigmoid,Leaky,Sigmoid,,40,20,21.0,20.0,,0.0018665451733530503,3,178,0.730671734919714,2.5099248809830457e-05,168.21224212646484,COMPLETE
875,0.4755576550960541,2023-09-04 21:45:48.365964,2023-09-04 21:45:50.159971,0 days 00:00:01.794007,ReLU,Tanh,Leaky,,28,17,23.0,21.0,,0.00019471569960020373,3,242,0.37379872551937116,0.00011396805992283859,460.0951251481709,COMPLETE
876,0.4026084840297699,2023-09-04 21:45:50.160368,2023-09-04 21:45:50.444773,0 days 00:00:00.284405,Leaky,Leaky,Tanh,,53,18,20.0,9.0,,0.015486088340832092,3,205,0.3261979691772023,1.7091257747669317e-05,193.801072038923,COMPLETE
877,0.2936566174030304,2023-09-04 21:45:50.445178,2023-09-04 21:45:51.635982,0 days 00:00:01.190804,ReLU,Leaky,ReLU,,57,19,21.0,23.0,,0.0005820956930602115,3,234,0.5465906326704474,0.0010068162374671729,113.31576105978637,COMPLETE
878,0.3020288944244385,2023-09-04 21:45:51.636381,2023-09-04 21:45:52.510697,0 days 00:00:00.874316,Sigmoid,ReLU,Leaky,,31,21,22.0,9.0,,0.007826199742476574,3,270,0.4120879678644164,0.0005357326485625265,117.86485247544839,COMPLETE
879,0.591989278793335,2023-09-04 21:45:52.511082,2023-09-04 21:45:52.852120,0 days 00:00:00.341038,ReLU,Tanh,Leaky,,34,20,19.0,8.0,,0.0009564484840394,3,220,0.10699425776336803,0.001415400726236447,124.47051792354374,COMPLETE
880,0.5532534718513489,2023-09-04 21:45:52.852512,2023-09-04 21:45:53.327749,0 days 00:00:00.475237,ReLU,Leaky,Sigmoid,,42,19,21.0,22.0,,0.00996206497810286,3,254,0.7005521762897687,0.03895905752090467,186.65307645444517,COMPLETE
881,0.45182088017463684,2023-09-04 21:45:53.328134,2023-09-04 21:45:53.483475,0 days 00:00:00.155341,ReLU,Leaky,Leaky,,38,20,22.0,10.0,,0.0777181856852005,3,195,0.13406536068057828,3.647342293156751e-05,203.61548461914063,COMPLETE
882,0.6386580467224121,2023-09-04 21:45:53.483872,2023-09-04 21:45:53.629661,0 days 00:00:00.145789,Sigmoid,Leaky,Leaky,,36,21,24.0,24.0,,0.026150324912676153,3,184,0.1166391145473004,0.014901658958370164,236.0832043602353,COMPLETE
883,0.5677376389503479,2023-09-04 21:45:53.630071,2023-09-04 21:45:56.646932,0 days 00:00:03.016861,ReLU,Tanh,Tanh,,32,19,23.0,22.0,,2.0111970589946323e-05,3,147,0.7749878480505914,0.0003635810259151683,558.2854270675556,COMPLETE
884,0.46854808926582336,2023-09-04 21:45:56.647337,2023-09-04 21:45:56.828284,0 days 00:00:00.180947,ReLU,Leaky,Sigmoid,,80,18,20.0,7.0,,0.08824667074647022,3,212,0.4769832815210203,5.860795197218513e-05,163.3115930557251,COMPLETE
885,0.3861886262893677,2023-09-04 21:45:56.828676,2023-09-04 21:45:57.225337,0 days 00:00:00.396661,Sigmoid,ReLU,Leaky,,40,21,22.0,23.0,,0.013145105935472514,3,229,0.21215994680402256,0.00013933778133179753,140.5312623977661,COMPLETE
886,0.38631317019462585,2023-09-04 21:45:57.225715,2023-09-04 21:46:04.577650,0 days 00:00:07.351935,Tanh,Leaky,ReLU,,29,20,21.0,21.0,,0.00012158425597019889,3,326,0.7990248226962295,8.438176640768332e-05,161.4295505219442,COMPLETE
887,0.26556313037872314,2023-09-04 21:46:04.578042,2023-09-04 21:46:05.424374,0 days 00:00:00.846332,ReLU,Leaky,Leaky,,34,19,20.0,23.0,,0.004525035396911708,3,173,0.7277527398581133,2.100370259987621e-05,798.7691515545513,COMPLETE
888,0.35702037811279297,2023-09-04 21:46:05.424769,2023-09-04 21:46:06.896876,0 days 00:00:01.472107,ReLU,Tanh,Leaky,,36,17,20.0,8.0,,0.0013738850910944003,3,248,0.6347160451080812,0.00022530963536588437,197.81437174479166,COMPLETE
889,0.3334365785121918,2023-09-04 21:46:06.897261,2023-09-04 21:46:07.716640,0 days 00:00:00.819379,Leaky,Leaky,Sigmoid,,39,21,21.0,3.0,,0.017910083470380225,3,284,0.7423775889412434,3.02049447658297e-05,298.93774082349694,COMPLETE
890,0.5954904556274414,2023-09-04 21:46:07.717036,2023-09-04 21:46:08.213501,0 days 00:00:00.496465,Sigmoid,Leaky,Tanh,,32,20,22.0,9.0,,0.006790219191272349,3,261,0.6802458341714768,0.04604421982966972,277.4963963826497,COMPLETE
891,0.327500581741333,2023-09-04 21:46:08.213884,2023-09-04 21:46:08.798886,0 days 00:00:00.585002,ReLU,ReLU,Leaky,,37,20,19.0,21.0,,0.003244093619269096,3,221,0.768261351976681,4.173746588085194e-05,145.38761770314184,COMPLETE
892,0.6307129859924316,2023-09-04 21:46:08.799270,2023-09-04 21:46:09.032730,0 days 00:00:00.233460,ReLU,Leaky,Leaky,,30,18,21.0,22.0,,0.011388019940511999,3,238,0.24393189658011283,0.09810013584422907,365.4446676503057,COMPLETE
893,0.25516995787620544,2023-09-04 21:46:09.033130,2023-09-04 21:46:09.699453,0 days 00:00:00.666323,ReLU,Tanh,Leaky,,43,19,10.0,24.0,,0.008763112211244786,3,201,0.7005804450298388,0.00018636825491921195,261.92811100657394,COMPLETE
894,0.32430922985076904,2023-09-04 21:46:09.699845,2023-09-04 21:46:10.508920,0 days 00:00:00.809075,ReLU,Tanh,Sigmoid,,43,18,7.0,24.0,,0.009150384600035555,3,190,0.7463018418092363,0.0001696920616052437,390.3409162248884,COMPLETE
895,0.6021493077278137,2023-09-04 21:46:10.509309,2023-09-04 21:46:13.350492,0 days 00:00:02.841183,ReLU,Tanh,Leaky,,45,16,12.0,24.0,,2.2654358725094917e-05,3,197,0.7112387014298044,0.00019189482504565787,171.381908784663,COMPLETE
896,0.29283997416496277,2023-09-04 21:46:13.350886,2023-09-04 21:46:14.239903,0 days 00:00:00.889017,ReLU,Tanh,ReLU,,40,19,10.0,24.0,,0.012165994587572998,3,183,0.7738950498932728,0.0002508150350269359,222.04655767946826,COMPLETE
897,0.358670175075531,2023-09-04 21:46:14.240290,2023-09-04 21:46:14.535983,0 days 00:00:00.295693,ReLU,Tanh,Leaky,,41,14,20.0,23.0,,0.00927171802459924,3,205,0.22388905059254496,0.0002864284000253868,175.5048231645064,COMPLETE
898,0.2271248698234558,2023-09-04 21:46:14.536368,2023-09-04 21:46:15.213392,0 days 00:00:00.677024,ReLU,Tanh,Tanh,,43,18,10.0,24.0,,0.014318117864457535,3,192,0.7489424983868548,0.00015071440552886226,282.8638011932373,COMPLETE
899,0.3164854049682617,2023-09-04 21:46:15.213776,2023-09-04 21:46:15.603443,0 days 00:00:00.389667,ReLU,,,,49,17,,,,0.010865316232345445,1,188,0.7026159256471876,0.00015632693468277167,192.9799700285259,COMPLETE
900,0.3896341323852539,2023-09-04 21:46:15.603824,2023-09-04 21:46:15.969483,0 days 00:00:00.365659,ReLU,Tanh,Tanh,,46,18,10.0,24.0,,0.014384942304524364,3,199,0.673578077987578,0.0001265817392478006,884.5812433416194,COMPLETE
901,0.36301738023757935,2023-09-04 21:46:15.969887,2023-09-04 21:46:16.822293,0 days 00:00:00.852406,ReLU,Tanh,Tanh,,42,18,11.0,24.0,,0.007928978570903173,3,192,0.7331684091036631,0.00018990076468808952,171.2844323378343,COMPLETE
902,0.39008185267448425,2023-09-04 21:46:16.822705,2023-09-04 21:46:19.561050,0 days 00:00:02.738345,ReLU,Tanh,Tanh,,44,18,10.0,24.0,,0.00015306172518147264,3,202,0.6510962558516132,0.00014270441433358625,422.1802057700582,COMPLETE
903,0.2768132984638214,2023-09-04 21:46:19.561448,2023-09-04 21:46:20.096142,0 days 00:00:00.534694,ReLU,Tanh,Tanh,,43,18,10.0,24.0,,0.012060768734769627,3,182,0.7092396150971514,0.00021913996857068335,302.29597520828247,COMPLETE
904,0.2985302805900574,2023-09-04 21:46:20.096552,2023-09-04 21:46:20.492354,0 days 00:00:00.395802,ReLU,Tanh,Tanh,,47,17,24.0,24.0,,0.00984919483084627,3,174,0.3816583425154236,0.00017741554936298354,147.7751096089681,COMPLETE
905,0.3437599539756775,2023-09-04 21:46:20.492777,2023-09-04 21:46:20.888604,0 days 00:00:00.395827,ReLU,Tanh,Tanh,,45,18,10.0,24.0,,0.014961900833053128,3,197,0.38064986043856663,0.00010962273796365868,2671.5958073313645,COMPLETE
906,0.4893573522567749,2023-09-04 21:46:20.889009,2023-09-04 21:46:22.163221,0 days 00:00:01.274212,ReLU,Tanh,Tanh,,42,19,9.0,23.0,,0.0004800529864566531,3,163,0.14328097946251991,0.00017418065151235553,1327.7434250533215,COMPLETE
907,0.4162638187408447,2023-09-04 21:46:22.163942,2023-09-04 21:46:23.760703,0 days 00:00:01.596761,ReLU,Tanh,Tanh,,42,18,9.0,23.0,,0.000819292961268742,3,189,0.3491148831822006,0.029684239125095414,363.3535799389043,COMPLETE
908,0.29316532611846924,2023-09-04 21:46:23.761121,2023-09-04 21:46:24.818959,0 days 00:00:01.057838,ReLU,Tanh,Tanh,,44,19,10.0,24.0,,0.002231504398087636,3,303,0.7459475758944327,0.00011053159251057099,120.75845876840445,COMPLETE
909,0.3466814160346985,2023-09-04 21:46:24.819380,2023-09-04 21:46:26.149066,0 days 00:00:01.329686,ReLU,Tanh,Tanh,,41,17,10.0,24.0,,0.008076279982598168,3,206,0.21717828520695606,0.00014479977424053546,129.1608160486761,COMPLETE
910,0.3010998070240021,2023-09-04 21:46:26.149814,2023-09-04 21:46:26.780135,0 days 00:00:00.630321,ReLU,Tanh,Leaky,,44,19,9.0,24.0,,0.012234049227206112,3,188,0.7534507892482428,9.308432023735708e-05,159.64732869466147,COMPLETE
911,0.4654596745967865,2023-09-04 21:46:26.780556,2023-09-04 21:46:27.091004,0 days 00:00:00.310448,ReLU,Tanh,Tanh,,40,18,13.0,24.0,,0.010211352820697128,3,174,0.2658126631641516,0.049226317961743385,270.22821446468953,COMPLETE
912,0.26451945304870605,2023-09-04 21:46:27.091386,2023-09-04 21:46:28.216059,0 days 00:00:01.124673,ReLU,ReLU,Tanh,,48,18,12.0,24.0,,0.0014220459421267623,3,205,0.7201231302565951,0.007572161386660601,104.10192509186574,COMPLETE
913,0.3677932024002075,2023-09-04 21:46:28.216459,2023-09-04 21:46:29.243993,0 days 00:00:01.027534,ReLU,Tanh,Tanh,,40,19,11.0,24.0,,0.0011045832263764834,3,177,0.7708305927454708,0.00012195399612117491,137.06825243193526,COMPLETE
914,0.40052130818367004,2023-09-04 21:46:29.244390,2023-09-04 21:46:31.524585,0 days 00:00:02.280195,ReLU,ReLU,Tanh,,39,19,15.0,23.0,,0.0006342929718197214,3,193,0.5807346906230039,0.00017850886586163155,147.71520317257858,COMPLETE
915,0.8289511799812317,2023-09-04 21:46:31.525282,2023-09-04 21:46:33.507654,0 days 00:00:01.982372,ReLU,Tanh,Tanh,Leaky,42,17,11.0,24.0,4.0,1.5240755320649469e-05,4,210,0.3027947630832611,0.00023221064146690165,157.27804282052176,COMPLETE
916,0.323574423789978,2023-09-04 21:46:33.508381,2023-09-04 21:46:34.145447,0 days 00:00:00.637066,ReLU,Tanh,Leaky,,38,18,8.0,23.0,,0.016235941649034216,3,184,0.6751883394217696,0.0001262917565564981,637.5466317070855,COMPLETE
917,0.29111939668655396,2023-09-04 21:46:34.145848,2023-09-04 21:46:34.820926,0 days 00:00:00.675078,ReLU,ReLU,Leaky,,43,19,21.0,23.0,,0.0027585760866411088,3,199,0.7992175071958233,0.00027232115899348543,140.69185329127956,COMPLETE
918,0.36692872643470764,2023-09-04 21:46:34.821320,2023-09-04 21:46:35.601896,0 days 00:00:00.780576,ReLU,Tanh,Tanh,,39,17,6.0,23.0,,0.013193892650094132,3,163,0.6049497676176293,0.004105265012990403,177.78825608739314,COMPLETE
919,0.30746588110923767,2023-09-04 21:46:35.602307,2023-09-04 21:46:36.101930,0 days 00:00:00.499623,ReLU,Tanh,Leaky,,41,19,14.0,24.0,,0.008865199595802852,3,294,0.49124438901197826,0.0002044137516308779,709.3859245104668,COMPLETE
920,0.30496746301651,2023-09-04 21:46:36.102327,2023-09-04 21:46:36.547377,0 days 00:00:00.445050,ReLU,ReLU,ReLU,,39,19,10.0,23.0,,0.006646973981128318,3,314,0.7425330807286841,0.0003175061492288276,827.6355086616848,COMPLETE
921,0.3325389325618744,2023-09-04 21:46:36.547790,2023-09-04 21:46:37.026132,0 days 00:00:00.478342,ReLU,Leaky,Leaky,,37,18,11.0,23.0,,0.0035102257010111706,3,194,0.4004446735615828,7.196083538745623e-05,472.1273211102153,COMPLETE
922,0.8699409365653992,2023-09-04 21:46:37.026540,2023-09-04 21:46:39.509527,0 days 00:00:02.482987,ReLU,Leaky,Leaky,,43,19,9.0,24.0,,1.0829247663557288e-05,3,211,0.5538327830755903,0.00014941708456292526,111.10691949202551,COMPLETE
923,0.29297736287117004,2023-09-04 21:46:39.509937,2023-09-04 21:46:40.007154,0 days 00:00:00.497217,ReLU,Tanh,Tanh,,45,18,11.0,24.0,,0.015276407756943331,3,182,0.7041574566106596,0.00040991997928565595,465.43120930989585,COMPLETE
924,0.4342246949672699,2023-09-04 21:46:40.007574,2023-09-04 21:46:40.337708,0 days 00:00:00.330134,ReLU,Leaky,Leaky,,38,16,10.0,23.0,,0.003963657981060912,3,204,0.2081299888218619,0.0007970163934053463,131.91112327575684,COMPLETE
925,0.3003210723400116,2023-09-04 21:46:40.338135,2023-09-04 21:46:42.053960,0 days 00:00:01.715825,ReLU,Sigmoid,,,41,19,10.0,,,0.010893614232207742,2,214,0.7667965111192123,6.357620641518924e-05,156.92346048355103,COMPLETE
926,0.5150294303894043,2023-09-04 21:46:42.054671,2023-09-04 21:46:43.142925,0 days 00:00:01.088254,ReLU,Leaky,Leaky,,37,8,10.0,23.0,,7.897964310862555e-05,3,193,0.16422157876921661,9.478682353182295e-05,122.86951157960249,COMPLETE
927,0.32616886496543884,2023-09-04 21:46:43.143323,2023-09-04 21:46:44.813232,0 days 00:00:01.669909,ReLU,ReLU,Leaky,,39,17,13.0,10.0,,0.0008558573598575227,3,319,0.6313564990445031,0.0018319349535324467,212.60254921291187,COMPLETE
928,0.5681543946266174,2023-09-04 21:46:44.813626,2023-09-04 21:46:47.774094,0 days 00:00:02.960468,ReLU,Tanh,ReLU,,36,18,23.0,11.0,,3.5440366862832925e-05,3,172,0.727180994845619,0.00020816689285727433,471.2327010576115,COMPLETE
