number,value,datetime_start,datetime_complete,duration,params_activation1,params_activation2,params_activation3,params_activation4,params_batch_size,params_fl1,params_fl2,params_fl3,params_fl4,params_learning_rate,params_n_layers,params_num_epochs,params_train_size,params_weight_decay,user_attrs_mre,state
959,0.46743011474609375,2023-09-04 22:14:28.477284,2023-09-04 22:14:30.696424,0 days 00:00:02.219140,Tanh,,,,52,20,,,,0.000226329092803367,1,206,0.7979304043097606,0.052884741252244245,104.3648534350925,COMPLETE
960,0.31488683819770813,2023-09-04 22:14:30.697126,2023-09-04 22:14:32.891480,0 days 00:00:02.194354,Tanh,ReLU,Leaky,ReLU,34,22,7.0,6.0,19.0,0.011119812793923146,4,170,0.7554554140270594,0.0001403598407683595,102.85736541748047,COMPLETE
961,0.38950684666633606,2023-09-04 22:14:32.892238,2023-09-04 22:14:54.029799,0 days 00:00:21.137561,Sigmoid,Sigmoid,Sigmoid,,15,21,4.0,1.0,,0.0012493693634860411,3,192,0.7180251947962,0.000305089245091382,131.10069104035696,COMPLETE
962,0.3632960617542267,2023-09-04 22:14:54.030550,2023-09-04 22:14:55.528150,0 days 00:00:01.497600,ReLU,,,,11,20,,,,0.004279513264327757,1,236,0.40085250044762855,8.062373964365485e-05,98.24305640326605,COMPLETE
963,0.3423094153404236,2023-09-04 22:14:55.528851,2023-09-04 22:14:56.265873,0 days 00:00:00.737022,Tanh,Tanh,Tanh,,37,22,15.0,4.0,,0.02522340699954767,3,150,0.31885136627789645,5.6910906821044676e-05,369.72369201660155,COMPLETE
964,0.9838278889656067,2023-09-04 22:14:56.266620,2023-09-04 22:14:58.438544,0 days 00:00:02.171924,Tanh,Sigmoid,Leaky,,66,21,6.0,10.0,,3.251549725073423e-05,3,123,0.3290795155719346,0.0016871937499423294,122.34023266303831,COMPLETE
965,0.3584079444408417,2023-09-04 22:14:58.439311,2023-09-04 22:14:59.380094,0 days 00:00:00.940783,Tanh,ReLU,ReLU,Sigmoid,39,20,3.0,3.0,16.0,0.033502569862956945,4,224,0.26364153196988666,0.00017300756320858419,113.35943751864963,COMPLETE
966,0.3892846703529358,2023-09-04 22:14:59.380917,2023-09-04 22:14:59.705934,0 days 00:00:00.325017,ReLU,,,,100,19,,,,0.073010622281802,1,216,0.36669738839841415,0.047777971648832795,97.2985513860529,COMPLETE
967,0.4052841365337372,2023-09-04 22:14:59.706664,2023-09-04 22:15:04.166080,0 days 00:00:04.459416,Tanh,Leaky,Leaky,,14,21,17.0,7.0,,0.00042765112231459116,3,202,0.2156860218008885,4.124272565593734e-05,119.32351530700171,COMPLETE
968,1.009682297706604,2023-09-04 22:15:04.166829,2023-09-04 22:15:07.444847,0 days 00:00:03.278018,Leaky,Sigmoid,,,49,22,5.0,,,2.834485408450679e-05,2,212,0.30236638391717596,0.00025530656500901837,178.1327814066185,COMPLETE
969,0.8947792053222656,2023-09-04 22:15:07.445577,2023-09-04 22:15:20.911286,0 days 00:00:13.465709,Tanh,Tanh,ReLU,,41,20,13.0,2.0,,2.1536944202869697e-05,3,257,0.7993472060726925,2.4270760851562573e-05,166.9321838260161,COMPLETE
970,0.3800751566886902,2023-09-04 22:15:20.912036,2023-09-04 22:15:21.710851,0 days 00:00:00.798815,Tanh,,,,45,21,,,,0.005339078571826595,1,230,0.1725403647823778,1.756893553159884e-05,135.62064241559318,COMPLETE
971,0.3924286365509033,2023-09-04 22:15:21.711608,2023-09-04 22:15:22.227431,0 days 00:00:00.515823,ReLU,ReLU,,,51,16,8.0,,,0.003259510290420567,2,177,0.12345590085941627,3.1707703895853564e-05,232.82793018735688,COMPLETE
972,0.37211957573890686,2023-09-04 22:15:22.228203,2023-09-04 22:15:39.301844,0 days 00:00:17.073641,Tanh,Sigmoid,Leaky,Tanh,12,19,12.0,5.0,23.0,0.0006012690994340177,4,159,0.6753259713801713,0.0006609331738616719,94.7186892397769,COMPLETE
973,0.3581264317035675,2023-09-04 22:15:39.302636,2023-09-04 22:15:40.893003,0 days 00:00:01.590367,Tanh,,,,17,15,,,,0.016136531918262066,1,111,0.46699519425464914,0.00011720515118209,112.46888918490023,COMPLETE
974,0.39673855900764465,2023-09-04 22:15:40.893705,2023-09-04 22:15:44.236882,0 days 00:00:03.343177,Sigmoid,Sigmoid,Sigmoid,,59,21,7.0,6.0,,0.0025197945414977864,3,85,0.7675562986835011,0.0010004904857570203,108.321642258588,COMPLETE
975,0.326511949300766,2023-09-04 22:15:44.237638,2023-09-04 22:15:46.143124,0 days 00:00:01.905486,Tanh,ReLU,,,36,20,15.0,,,0.006765394299825615,2,144,0.7435558683283074,4.561293356836109e-05,112.35553398132325,COMPLETE
976,0.40810316801071167,2023-09-04 22:15:46.143855,2023-09-04 22:15:46.880625,0 days 00:00:00.736770,Tanh,Tanh,,,14,21,6.0,,,0.009288561966154572,2,104,0.1287996476756537,1.3686440084042993e-05,141.48997946346506,COMPLETE
977,0.32987549901008606,2023-09-04 22:15:46.881360,2023-09-04 22:15:47.747798,0 days 00:00:00.866438,ReLU,Sigmoid,Leaky,Tanh,87,22,3.0,3.0,21.0,0.012890518047759737,4,197,0.7023409513993871,6.584052207238982e-05,142.66459821618122,COMPLETE
978,0.31430739164352417,2023-09-04 22:15:47.748550,2023-09-04 22:15:48.988624,0 days 00:00:01.240074,Tanh,ReLU,,,33,20,4.0,,,0.022478711998976005,2,188,0.5681599039719308,0.00021031985832131546,129.52300567626952,COMPLETE
979,0.3443795442581177,2023-09-04 22:15:48.989348,2023-09-04 22:15:50.949245,0 days 00:00:01.959897,Tanh,,,,30,21,,,,0.02908958442923416,1,245,0.7996251185884761,0.0034871024561115354,97.33998995049055,COMPLETE
980,0.40710464119911194,2023-09-04 22:15:50.949964,2023-09-04 22:15:51.991010,0 days 00:00:01.041046,Tanh,Tanh,ReLU,,10,22,16.0,4.0,,0.03912976652271322,3,153,0.1381544359617456,3.493988167540324e-05,123.44460841587612,COMPLETE
981,0.4420415163040161,2023-09-04 22:15:51.991793,2023-09-04 22:15:56.346838,0 days 00:00:04.355045,ReLU,Sigmoid,,,19,21,5.0,,,0.00031854218387125004,2,94,0.4441924173265139,8.974422759911741e-05,206.31943666174055,COMPLETE
982,0.31487059593200684,2023-09-04 22:15:56.347580,2023-09-04 22:15:57.629675,0 days 00:00:01.282095,Leaky,ReLU,,,47,20,5.0,,,0.011014623763451196,2,169,0.7502766018422681,1.1731953341714015e-05,113.27502810570502,COMPLETE
983,0.4153960347175598,2023-09-04 22:15:57.630395,2023-09-04 22:16:06.458503,0 days 00:00:08.828108,Tanh,Sigmoid,Leaky,,42,21,14.0,5.0,,0.000124408140423766,3,222,0.6094391334559868,2.1182824836506173e-05,110.67875585470114,COMPLETE
984,0.35121241211891174,2023-09-04 22:16:06.459266,2023-09-04 22:16:07.390475,0 days 00:00:00.931209,Tanh,,,,39,22,,,,0.01756025882993671,1,234,0.547970570381207,0.00016817049920269986,113.34559492631392,COMPLETE
985,0.43979567289352417,2023-09-04 22:16:07.391186,2023-09-04 22:16:09.428271,0 days 00:00:02.037085,Tanh,Tanh,,,16,19,9.0,,,0.0078958974729812,2,130,0.7708748753883018,0.062290536001965977,107.3279535202753,COMPLETE
986,0.3518051505088806,2023-09-04 22:16:09.428992,2023-09-04 22:16:11.243308,0 days 00:00:01.814316,ReLU,Sigmoid,ReLU,Sigmoid,54,21,2.0,7.0,13.0,0.005116035815539587,4,80,0.5832991794766684,2.8703383095524697e-05,119.58099978903066,COMPLETE
987,0.9806941747665405,2023-09-04 22:16:11.244089,2023-09-04 22:16:14.094837,0 days 00:00:02.850748,Tanh,ReLU,,,18,15,6.0,,,1.0095371110294783e-05,2,160,0.156342394190599,1.0143562950525925e-05,186.42227487564088,COMPLETE
988,0.33866336941719055,2023-09-04 22:16:14.095555,2023-09-04 22:16:21.106314,0 days 00:00:07.010759,Sigmoid,Sigmoid,Sigmoid,,57,20,4.0,12.0,,0.0016574308070225084,3,213,0.6367615331693737,0.0003818825190213269,144.61942402297902,COMPLETE
989,0.43703988194465637,2023-09-04 22:16:21.107074,2023-09-04 22:16:21.506950,0 days 00:00:00.399876,Tanh,Tanh,,,64,22,14.0,,,0.0063046831052981445,2,102,0.15256646660081763,0.0015314217333544581,211.8163125174386,COMPLETE
990,0.34495094418525696,2023-09-04 22:16:21.507668,2023-09-04 22:16:22.803351,0 days 00:00:01.295683,Tanh,,,,22,16,,,,0.015461270374345804,1,180,0.35961956229677694,1.632171037309895e-05,105.52463320468334,COMPLETE
991,0.4526834189891815,2023-09-04 22:16:22.804093,2023-09-04 22:16:26.886535,0 days 00:00:04.082442,ReLU,ReLU,,,12,20,7.0,,,0.00010157300459580156,2,87,0.2942918026212829,0.00010627362091188616,148.7253252226731,COMPLETE
992,0.25611916184425354,2023-09-04 22:16:26.887303,2023-09-04 22:16:28.738994,0 days 00:00:01.851691,Tanh,Leaky,Tanh,Tanh,44,21,13.0,8.0,3.0,0.003676662212781714,4,75,0.7233637511237675,0.002917288572180371,99.66353750228882,COMPLETE
993,0.35138335824012756,2023-09-04 22:16:28.739806,2023-09-04 22:16:30.491351,0 days 00:00:01.751545,Tanh,Leaky,Tanh,Tanh,44,22,12.0,9.0,1.0,0.013104159092068109,4,76,0.720507183471431,0.003184314840039138,100.69285634358724,COMPLETE
994,0.3185824453830719,2023-09-04 22:16:30.492246,2023-09-04 22:16:33.526385,0 days 00:00:03.034139,Tanh,Leaky,Tanh,Tanh,44,21,13.0,8.0,2.0,0.045731051558777845,4,69,0.7691490650742391,0.0018038882421834222,109.96805557550168,COMPLETE
995,0.49442151188850403,2023-09-04 22:16:33.527153,2023-09-04 22:16:33.901023,0 days 00:00:00.373870,Leaky,Leaky,Tanh,Tanh,42,20,13.0,10.0,3.0,0.020362877102164098,4,74,0.1285399843604412,0.00174355498198495,173.98910352918836,COMPLETE
996,0.3689499795436859,2023-09-04 22:16:33.901801,2023-09-04 22:16:34.693673,0 days 00:00:00.791872,ReLU,Leaky,Tanh,Tanh,42,18,15.0,9.0,5.0,0.008960924537418776,4,88,0.30842174948205375,0.0008834426020342641,125.31110880925105,COMPLETE
997,0.33348706364631653,2023-09-04 22:16:34.694448,2023-09-04 22:16:36.445779,0 days 00:00:01.751331,Tanh,Leaky,Tanh,Tanh,46,21,13.0,11.0,3.0,0.027273427537635727,4,60,0.7351237582988839,0.0038472369290913624,108.03741873464277,COMPLETE
998,0.33337268233299255,2023-09-04 22:16:36.446555,2023-09-04 22:16:39.546163,0 days 00:00:03.099608,Tanh,Sigmoid,Tanh,Tanh,44,20,14.0,8.0,8.0,0.003845489742761985,4,78,0.6804335180902336,0.0007346878091608013,104.22919756571451,COMPLETE
999,0.3242180049419403,2023-09-04 22:16:39.546934,2023-09-04 22:16:42.067339,0 days 00:00:02.520405,Tanh,Leaky,Tanh,Tanh,47,21,13.0,6.0,6.0,0.03392837836703663,4,67,0.7738012617094258,0.0023555911488753823,270.3149861653646,COMPLETE
1000,0.3573073446750641,2023-09-04 22:16:42.068160,2023-09-04 22:16:42.850136,0 days 00:00:00.781976,ReLU,Leaky,Tanh,Tanh,46,22,14.0,7.0,10.0,0.007292755180839918,4,95,0.5326570745139015,0.0011456588610261817,105.65619039535522,COMPLETE
1001,0.33478817343711853,2023-09-04 22:16:42.850899,2023-09-04 22:16:44.656002,0 days 00:00:01.805103,Tanh,Leaky,Tanh,Tanh,48,23,14.0,8.0,4.0,0.010705670751207269,4,79,0.7432115243802931,0.0033810744929811108,107.1192636200876,COMPLETE
1002,0.4369356334209442,2023-09-04 22:16:44.656826,2023-09-04 22:16:47.394218,0 days 00:00:02.737392,Sigmoid,Leaky,Tanh,Tanh,45,19,13.0,7.0,7.0,0.02280003934318634,4,119,0.7047122058823364,0.005912872282057123,117.3678602330825,COMPLETE
1003,0.35320740938186646,2023-09-04 22:16:47.395049,2023-09-04 22:16:48.298628,0 days 00:00:00.903579,Tanh,Leaky,Tanh,Tanh,40,21,13.0,6.0,14.0,0.005797750263814551,4,278,0.23221444864212992,0.004777793558519823,120.49115271317332,COMPLETE
1004,0.3455618917942047,2023-09-04 22:16:48.299394,2023-09-04 22:16:50.080991,0 days 00:00:01.781597,Tanh,Leaky,Tanh,Leaky,43,15,14.0,10.0,15.0,0.01420116817678527,4,88,0.6520382255964181,5.649026465724166e-05,115.37764111687156,COMPLETE
1005,0.3430919945240021,2023-09-04 22:16:50.081772,2023-09-04 22:16:52.562746,0 days 00:00:02.480974,Tanh,Leaky,Tanh,Tanh,49,22,12.0,14.0,5.0,0.004643279494703107,4,62,0.7746619392844769,0.0030265508628892312,127.97026587592231,COMPLETE
1006,0.3520236611366272,2023-09-04 22:16:52.563510,2023-09-04 22:16:53.408839,0 days 00:00:00.845329,ReLU,Leaky,Tanh,ReLU,45,20,14.0,5.0,11.0,0.01932487395929607,4,81,0.24872173408832185,0.0024354157208752963,265.53883579799106,COMPLETE
1007,0.5364362001419067,2023-09-04 22:16:53.409624,2023-09-04 22:16:53.836097,0 days 00:00:00.426473,Tanh,Leaky,ReLU,Sigmoid,41,24,12.0,11.0,19.0,0.055931129009858804,4,71,0.15144385142998637,0.0021286289379000194,246.93729739718967,COMPLETE
1008,0.44674310088157654,2023-09-04 22:16:53.836883,2023-09-04 22:16:55.024057,0 days 00:00:01.187174,Tanh,Leaky,Tanh,Tanh,38,19,11.0,1.0,17.0,0.08569066293554713,4,50,0.729710604854066,0.008372882047425494,113.77853842342601,COMPLETE
1009,0.3628939092159271,2023-09-04 22:16:55.024842,2023-09-04 22:16:56.712954,0 days 00:00:01.688112,Tanh,Leaky,ReLU,Tanh,50,21,12.0,8.0,24.0,0.011871761200647235,4,96,0.7982257741761339,0.007626687983508093,113.9113172333816,COMPLETE
1010,0.296178936958313,2023-09-04 22:16:56.713724,2023-09-04 22:16:58.899490,0 days 00:00:02.185766,Leaky,Leaky,Sigmoid,Sigmoid,43,23,21.0,9.0,16.0,0.008989952809819866,4,108,0.7994915624588428,0.0044128565374747545,104.59661932552562,COMPLETE
1011,0.34399402141571045,2023-09-04 22:16:58.900284,2023-09-04 22:17:00.221862,0 days 00:00:01.321578,ReLU,Tanh,ReLU,Leaky,40,22,13.0,7.0,20.0,0.02845205550840817,4,87,0.6838547621996458,0.0037263628491121608,254.58999924432663,COMPLETE
1012,0.6468830704689026,2023-09-04 22:17:00.222624,2023-09-04 22:17:02.851892,0 days 00:00:02.629268,Tanh,,,,35,16,,,,2.393016934092574e-05,1,70,0.752857964945344,0.005799948447723679,104.9104857308524,COMPLETE
1013,0.27397581934928894,2023-09-04 22:17:02.852624,2023-09-04 22:17:04.380509,0 days 00:00:01.527885,Tanh,Sigmoid,,,47,21,15.0,,,0.04054031313517724,2,264,0.7178066093840233,0.00014062429503770244,104.71703358185597,COMPLETE
1014,0.2535179853439331,2023-09-04 22:17:04.381271,2023-09-04 22:17:05.502550,0 days 00:00:01.121279,Tanh,Sigmoid,,,47,20,15.0,,,0.03979708508971616,2,240,0.6672862323998786,0.00013461403345478934,91.07855936686198,COMPLETE
1015,0.3017759919166565,2023-09-04 22:17:05.503278,2023-09-04 22:17:06.720518,0 days 00:00:01.217240,Tanh,Sigmoid,,,48,7,16.0,,,0.05131960149482359,2,264,0.6783524520163375,0.00014042501276447742,98.50109909520005,COMPLETE
1016,0.34407997131347656,2023-09-04 22:17:06.721275,2023-09-04 22:17:07.539010,0 days 00:00:00.817735,Tanh,Sigmoid,,,47,19,15.0,,,0.0443250925596643,2,273,0.4218029817515216,0.00013295189993448614,102.32221123480028,COMPLETE
1017,0.37431082129478455,2023-09-04 22:17:07.539812,2023-09-04 22:17:08.569449,0 days 00:00:01.029637,Tanh,Sigmoid,,,49,19,15.0,,,0.03880174017064826,2,259,0.6487041999707049,0.00515702563289992,111.23653548104423,COMPLETE
1018,0.387954980134964,2023-09-04 22:17:08.570204,2023-09-04 22:17:09.047727,0 days 00:00:00.477523,Tanh,Sigmoid,,,47,20,15.0,,,0.09794143444289087,2,264,0.19557240007313845,0.00016994859272900133,436.06077306410845,COMPLETE
1019,0.3258045017719269,2023-09-04 22:17:09.048566,2023-09-04 22:17:10.379170,0 days 00:00:01.330604,Tanh,Sigmoid,,,46,20,15.0,,,0.04420670433308587,2,248,0.6980261675607771,0.00012130601836311561,117.05237070719402,COMPLETE
1020,0.3272400498390198,2023-09-04 22:17:10.379940,2023-09-04 22:17:11.180321,0 days 00:00:00.800381,Tanh,Sigmoid,,,48,19,16.0,,,0.03768048482723068,2,284,0.6661624209025163,0.00014921832544200332,112.54878997802734,COMPLETE
1021,0.3601272702217102,2023-09-04 22:17:11.181079,2023-09-04 22:17:12.027568,0 days 00:00:00.846489,Tanh,Sigmoid,,,45,20,15.0,,,0.03527521048723689,2,254,0.28481136422424835,0.0001178437592368479,104.76965494358794,COMPLETE
1022,0.3345184028148651,2023-09-04 22:17:12.028371,2023-09-04 22:17:13.127371,0 days 00:00:01.099000,Tanh,Sigmoid,,,50,18,14.0,,,0.06002924825572932,2,254,0.7070157122390525,0.00021285571723995476,112.93342984955886,COMPLETE
1023,0.30709072947502136,2023-09-04 22:17:13.128108,2023-09-04 22:17:14.477494,0 days 00:00:01.349386,Tanh,Sigmoid,,,46,20,15.0,,,0.051245869390396034,2,283,0.7196800493802585,0.00010878456868334023,121.7014169404001,COMPLETE
1024,0.5340420007705688,2023-09-04 22:17:14.478237,2023-09-04 22:17:18.569425,0 days 00:00:04.091188,Tanh,Sigmoid,,,48,20,16.0,,,4.6477349045308406e-05,2,245,0.3240599089232318,9.632716190473243e-05,100.81332291583625,COMPLETE
1025,0.3412691056728363,2023-09-04 22:17:18.570172,2023-09-04 22:17:19.313181,0 days 00:00:00.743009,Tanh,Sigmoid,,,45,19,15.0,,,0.042388450315165395,2,252,0.4083933037821374,0.00016013593791745597,105.5139912196568,COMPLETE
1026,0.4384535551071167,2023-09-04 22:17:19.313980,2023-09-04 22:17:20.151104,0 days 00:00:00.837124,Tanh,Sigmoid,,,50,20,14.0,,,0.03205499826304409,2,241,0.6363649873756129,0.019263786113266627,129.74549865722656,COMPLETE
1027,0.3190857768058777,2023-09-04 22:17:20.151851,2023-09-04 22:17:21.799104,0 days 00:00:01.647253,Tanh,Sigmoid,,,46,20,15.0,,,0.03553397441760022,2,267,0.6699219985295357,0.0005697406113922086,101.64940422905816,COMPLETE
1028,0.4278797507286072,2023-09-04 22:17:21.799857,2023-09-04 22:17:22.319150,0 days 00:00:00.519293,Tanh,Sigmoid,,,47,15,14.0,,,0.04175075847048604,2,256,0.2606473202574363,0.011791044812113353,123.42491573757596,COMPLETE
1029,0.3536291718482971,2023-09-04 22:17:22.319886,2023-09-04 22:17:23.085643,0 days 00:00:00.765757,Tanh,Sigmoid,,,44,21,16.0,,,0.029412617253704313,2,247,0.269250717335855,0.00013247202887474996,113.4635127839588,COMPLETE
1030,0.3866797983646393,2023-09-04 22:17:23.086398,2023-09-04 22:17:23.507684,0 days 00:00:00.421286,Tanh,Sigmoid,,,51,17,15.0,,,0.04895916943764363,2,304,0.23270900249627632,0.00020176700179540784,181.50865745544434,COMPLETE
1031,0.7390673756599426,2023-09-04 22:17:23.508445,2023-09-04 22:17:25.390166,0 days 00:00:01.881721,Tanh,Sigmoid,,,49,23,16.0,,,5.776306343885643e-05,2,262,0.11389199684222666,0.009177833194992926,102.77303803422069,COMPLETE
1032,0.45677557587623596,2023-09-04 22:17:25.390912,2023-09-04 22:17:25.693006,0 days 00:00:00.302094,Tanh,Sigmoid,,,44,20,14.0,,,0.03215069822853498,2,240,0.10549054499087086,8.163950818798264e-05,116.15993698783542,COMPLETE
1033,0.42724737524986267,2023-09-04 22:17:25.693761,2023-09-04 22:17:28.022483,0 days 00:00:02.328722,Sigmoid,Tanh,,,48,21,14.0,,,0.002045600971892626,2,264,0.4699873353413071,0.009812373732670028,124.58487092687729,COMPLETE
1034,0.3313373923301697,2023-09-04 22:17:28.023286,2023-09-04 22:17:29.054919,0 days 00:00:01.031633,Tanh,Sigmoid,,,46,19,17.0,,,0.026021802791519104,2,242,0.5042387752229324,0.00017258283145194154,107.76455950055804,COMPLETE
1035,0.31480279564857483,2023-09-04 22:17:29.055674,2023-09-04 22:17:35.651231,0 days 00:00:06.595557,Tanh,Tanh,,,50,20,16.0,,,0.001095055716413946,2,271,0.7018323074140589,0.00012792930953676226,110.79939134471913,COMPLETE
1036,0.44055262207984924,2023-09-04 22:17:35.652007,2023-09-04 22:17:38.267618,0 days 00:00:02.615611,Tanh,Sigmoid,,,44,22,14.0,,,0.0014508424954461968,2,242,0.6208583249822964,0.030644655763626114,131.2410542872045,COMPLETE
1037,0.37633663415908813,2023-09-04 22:17:38.268376,2023-09-04 22:17:38.629768,0 days 00:00:00.361392,Tanh,Sigmoid,,,48,19,15.0,,,0.05934434555280345,2,253,0.15905286573107005,0.0067056380537903965,120.0051383972168,COMPLETE
1038,0.3410235643386841,2023-09-04 22:17:38.630540,2023-09-04 22:17:39.694174,0 days 00:00:01.063634,Tanh,Tanh,,,43,21,15.0,,,0.04039710519524887,2,239,0.7229611936182339,0.00010343098363084297,98.19860649108887,COMPLETE
1039,0.39180412888526917,2023-09-04 22:17:39.694973,2023-09-04 22:17:40.239572,0 days 00:00:00.544599,Leaky,Sigmoid,,,51,15,15.0,,,0.031649000466210546,2,277,0.17832465872353714,0.014234932454338878,111.94411231146918,COMPLETE
1040,0.47133371233940125,2023-09-04 22:17:40.240342,2023-09-04 22:17:40.611434,0 days 00:00:00.371092,Tanh,Leaky,,,46,3,16.0,,,0.024585493275498787,2,233,0.13235129458287978,7.385569358492183e-05,162.57807057698568,COMPLETE
1041,0.5402511954307556,2023-09-04 22:17:40.612189,2023-09-04 22:17:41.403093,0 days 00:00:00.790904,Tanh,Sigmoid,,,48,17,14.0,,,0.04832833549922645,2,235,0.685389102227716,0.09708566170830746,135.83759990491365,COMPLETE
1042,0.2729378342628479,2023-09-04 22:17:41.403837,2023-09-04 22:17:43.082451,0 days 00:00:01.678614,Tanh,Tanh,,,52,20,13.0,,,0.03545646156202644,2,230,0.7333708598729333,0.0002228980408674213,102.12347445280656,COMPLETE
1043,0.3635205030441284,2023-09-04 22:17:43.083193,2023-09-04 22:17:43.611806,0 days 00:00:00.528613,Tanh,Tanh,,,51,21,13.0,,,0.03578654044742094,2,230,0.14361711823057752,0.00031291714644563726,130.32135959547392,COMPLETE
1044,0.3564591705799103,2023-09-04 22:17:43.612555,2023-09-04 22:17:44.669525,0 days 00:00:01.056970,Tanh,Tanh,,,54,24,13.0,,,0.06548499192094313,2,235,0.6518274010597062,0.0002480106272159044,113.91913260183027,COMPLETE
1045,0.2950819730758667,2023-09-04 22:17:44.670305,2023-09-04 22:17:45.791787,0 days 00:00:01.121482,Sigmoid,Tanh,,,53,20,13.0,,,0.03724746224832534,2,232,0.7188577070158131,0.0002643062019345321,99.50923461914063,COMPLETE
1046,0.36384084820747375,2023-09-04 22:17:45.792525,2023-09-04 22:17:46.277089,0 days 00:00:00.484564,Tanh,Tanh,,,49,23,12.0,,,0.029294862875888117,2,249,0.16687434057027656,0.00018665137609165632,142.56516446565328,COMPLETE
1047,0.3839529752731323,2023-09-04 22:17:46.277820,2023-09-04 22:17:46.745391,0 days 00:00:00.467571,Tanh,Tanh,,,50,22,13.0,,,0.042643823032299286,2,225,0.2757495740958156,0.0002352006328193421,278.2265027364095,COMPLETE
1048,0.3445377051830292,2023-09-04 22:17:46.746121,2023-09-04 22:17:47.911701,0 days 00:00:01.165580,Tanh,Tanh,,,52,20,6.0,,,0.05288688613316797,2,295,0.6986955162641971,0.0002136925940639441,106.06697750091553,COMPLETE
1049,0.2954232096672058,2023-09-04 22:17:47.912456,2023-09-04 22:17:49.153553,0 days 00:00:01.241097,Tanh,Tanh,,,54,14,12.0,,,0.025465282964400107,2,241,0.736014580396044,0.00016582201823535692,98.24253979851218,COMPLETE
1050,0.3495197892189026,2023-09-04 22:17:49.154291,2023-09-04 22:17:49.721651,0 days 00:00:00.567360,Tanh,Tanh,,,50,21,6.0,,,0.03687931928550043,2,250,0.1855017725779424,0.0002812470390192666,127.45595532794331,COMPLETE
1051,0.39581799507141113,2023-09-04 22:17:49.722392,2023-09-04 22:17:49.987124,0 days 00:00:00.264732,Leaky,Tanh,,,51,21,13.0,,,0.03267693529095325,2,233,0.12202564936833216,0.00013864736094163204,389.01576502182905,COMPLETE
1052,0.30501481890678406,2023-09-04 22:17:49.987864,2023-09-04 22:17:50.825432,0 days 00:00:00.837568,Tanh,Tanh,,,52,16,17.0,,,0.02783019079097727,2,224,0.6629068747753709,0.00018664129559085475,96.08397740903108,COMPLETE
1053,0.337893545627594,2023-09-04 22:17:50.826180,2023-09-04 22:17:51.484914,0 days 00:00:00.658734,Tanh,Tanh,,,56,20,17.0,,,0.04876866800451117,2,246,0.3399208692837566,0.00023137599179805688,113.12998083866003,COMPLETE
