number,value,datetime_start,datetime_complete,duration,params_activation1,params_activation2,params_activation3,params_activation4,params_batch_size,params_fl1,params_fl2,params_fl3,params_fl4,params_learning_rate,params_n_layers,params_num_epochs,params_train_size,params_weight_decay,user_attrs_mre,state
190,0.31566235423088074,2023-09-04 21:55:24.231362,2023-09-04 21:55:24.749303,0 days 00:00:00.517941,ReLU,Sigmoid,,,53,9,23.0,,,0.011765393015477644,2,64,0.5851951225039681,2.318211099169946e-05,93.28315096768466,COMPLETE
191,0.35853785276412964,2023-09-04 21:55:24.749582,2023-09-04 21:55:25.507110,0 days 00:00:00.757528,Tanh,Sigmoid,,,24,13,8.0,,,0.007749599371981656,2,96,0.7742996469056236,7.344272770803212e-05,102.68587101527623,COMPLETE
192,0.34394481778144836,2023-09-04 21:55:25.507391,2023-09-04 21:55:26.591083,0 days 00:00:01.083692,Tanh,Sigmoid,,,28,13,7.0,,,0.0062299800231092285,2,88,0.49879942970254165,5.4708592983308024e-05,118.27339432456277,COMPLETE
193,0.25457918643951416,2023-09-04 21:55:26.591350,2023-09-04 21:55:27.571945,0 days 00:00:00.980595,Tanh,Sigmoid,,,21,14,5.0,,,0.007214950473478669,2,98,0.761976400060172,0.00011407446222998091,96.84502174740746,COMPLETE
194,0.28847482800483704,2023-09-04 21:55:27.572226,2023-09-04 21:55:28.355133,0 days 00:00:00.782907,Tanh,Sigmoid,Leaky,,22,15,3.0,23.0,,0.023172783622749146,3,115,0.739556929433376,4.264098484630926e-05,90.87453513309873,COMPLETE
195,0.30669668316841125,2023-09-04 21:55:28.355441,2023-09-04 21:55:29.054097,0 days 00:00:00.698656,Tanh,Sigmoid,Leaky,,22,15,5.0,23.0,,0.025008161632648938,3,111,0.7331909182525604,9.353563804271192e-05,92.04043579101562,COMPLETE
196,0.31488171219825745,2023-09-04 21:55:29.054409,2023-09-04 21:55:30.061949,0 days 00:00:01.007540,Tanh,Leaky,Leaky,,22,14,1.0,22.0,,0.03855971304016719,3,121,0.6960951361113041,1.170863459545112e-05,93.94681586288824,COMPLETE
197,0.3160823583602905,2023-09-04 21:55:30.062249,2023-09-04 21:55:30.775379,0 days 00:00:00.713130,Tanh,Sigmoid,Leaky,Tanh,26,15,3.0,24.0,19.0,0.020701597542008864,4,154,0.656245838632409,0.00018722796944365067,168.9481122247104,COMPLETE
198,0.2931664288043976,2023-09-04 21:55:30.775688,2023-09-04 21:55:32.091765,0 days 00:00:01.316077,Leaky,Sigmoid,Leaky,,20,14,4.0,23.0,,0.016913579008142148,3,133,0.7990496464335095,0.0001091235831434887,117.02866878065952,COMPLETE
199,0.29606467485427856,2023-09-04 21:55:32.092071,2023-09-04 21:55:32.629546,0 days 00:00:00.537475,Leaky,Sigmoid,Leaky,,20,14,4.0,21.0,,0.013427140363167505,3,138,0.7979328790142931,0.00014382665574952058,122.16418726303998,COMPLETE
200,0.347770631313324,2023-09-04 21:55:32.629851,2023-09-04 21:55:33.499084,0 days 00:00:00.869233,Leaky,Tanh,Leaky,,18,15,3.0,23.0,,0.02838321269508037,3,130,0.7499426706267491,6.804120498571417e-05,74.45548220033999,COMPLETE
201,0.30964896082878113,2023-09-04 21:55:33.499378,2023-09-04 21:55:35.186295,0 days 00:00:01.686917,Leaky,Sigmoid,Leaky,Tanh,20,14,5.0,24.0,1.0,0.01641203275915074,4,146,0.7169842645691853,0.0001053501964490438,84.97251305213341,COMPLETE
202,0.34057363867759705,2023-09-04 21:55:35.186601,2023-09-04 21:55:36.109172,0 days 00:00:00.922571,Leaky,Sigmoid,Leaky,,22,16,4.0,20.0,,0.023399939239556685,3,114,0.7476203412199648,4.068828376880918e-05,93.17500709084904,COMPLETE
203,0.31847161054611206,2023-09-04 21:55:36.109466,2023-09-04 21:55:37.039198,0 days 00:00:00.929732,Leaky,Sigmoid,Leaky,,17,15,3.0,21.0,,0.01784186730921359,3,102,0.7632935698623671,0.00023996832795817466,96.97246184172454,COMPLETE
204,0.3486553728580475,2023-09-04 21:55:37.039492,2023-09-04 21:55:37.539429,0 days 00:00:00.499937,Tanh,,,,66,14,,,,0.009912485948508276,1,125,0.6744067890790306,0.00013058688792294003,141.75470792330228,COMPLETE
205,0.3073437809944153,2023-09-04 21:55:37.539716,2023-09-04 21:55:38.808186,0 days 00:00:01.268470,Tanh,Sigmoid,Leaky,ReLU,31,13,4.0,23.0,21.0,0.01357981541713053,4,80,0.722904226540418,0.0001072174985490219,101.47735171847873,COMPLETE
206,0.30760565400123596,2023-09-04 21:55:38.808685,2023-09-04 21:55:41.433192,0 days 00:00:02.624507,Sigmoid,Sigmoid,Leaky,Leaky,13,17,5.0,22.0,11.0,0.021914511633549096,4,106,0.7969871417154758,0.00012221262175398523,107.24323216880241,COMPLETE
207,0.3790230453014374,2023-09-04 21:55:41.433503,2023-09-04 21:55:41.635381,0 days 00:00:00.201878,Tanh,,,,36,21,,,,0.031765044989947,1,50,0.525030651602745,8.446680630077493e-05,115.8912117367699,COMPLETE
208,0.3126755356788635,2023-09-04 21:55:41.635683,2023-09-04 21:55:43.149986,0 days 00:00:01.514303,ReLU,Sigmoid,Tanh,,11,14,2.0,24.0,,0.015622080125697478,3,69,0.6316515123191457,1.5064337886290817e-05,101.65157296922472,COMPLETE
209,0.2815057635307312,2023-09-04 21:55:43.150302,2023-09-04 21:55:43.934973,0 days 00:00:00.784671,Tanh,Sigmoid,,,19,15,14.0,,,0.011183331054812187,2,156,0.7029035980339324,5.437921499791426e-05,98.04236186634411,COMPLETE
210,0.3168395757675171,2023-09-04 21:55:43.935279,2023-09-04 21:55:45.062499,0 days 00:00:01.127220,Tanh,Sigmoid,,,19,15,14.0,,,0.011076266832242557,2,154,0.6879115949989258,5.226056912638531e-05,87.85867309570312,COMPLETE
211,0.335149884223938,2023-09-04 21:55:45.062793,2023-09-04 21:55:46.246112,0 days 00:00:01.183319,Tanh,Sigmoid,,,21,15,3.0,,,0.017994981897194128,2,159,0.7400344821702128,6.307430885471066e-05,101.73744700505183,COMPLETE
212,0.3145606815814972,2023-09-04 21:55:46.246410,2023-09-04 21:55:48.908674,0 days 00:00:02.662264,Tanh,Sigmoid,,,16,16,15.0,,,0.012137787383472765,2,133,0.7989491542946047,3.637587425393302e-05,90.63240312275134,COMPLETE
213,0.3578648567199707,2023-09-04 21:55:48.908979,2023-09-04 21:55:49.277948,0 days 00:00:00.368969,Tanh,Sigmoid,,,19,14,14.0,,,0.08460107422701998,2,141,0.7075345961668975,0.0003705176971725716,112.28564126150948,COMPLETE
214,0.35359111428260803,2023-09-04 21:55:49.278257,2023-09-04 21:55:50.156996,0 days 00:00:00.878739,Tanh,Sigmoid,,,17,16,13.0,,,0.009744515621132538,2,83,0.7640433975601838,5.050364728963655e-05,101.40028652068108,COMPLETE
215,0.3433200418949127,2023-09-04 21:55:50.157291,2023-09-04 21:55:50.764284,0 days 00:00:00.606993,Tanh,Sigmoid,,,24,11,24.0,,,0.01554507839930208,2,164,0.7336947605596605,1.2263359801174456e-05,103.88836038523706,COMPLETE
216,0.34755298495292664,2023-09-04 21:55:50.764588,2023-09-04 21:55:52.693544,0 days 00:00:01.928956,Tanh,,,,33,12,,,,0.0005935438367500076,1,170,0.6578163640827445,2.7499854035236826e-05,234.4076281379251,COMPLETE
217,0.3641451299190521,2023-09-04 21:55:52.693840,2023-09-04 21:55:53.306108,0 days 00:00:00.612268,Tanh,Sigmoid,,,13,23,17.0,,,0.026272588349043027,2,97,0.768967216724167,1.8667605417975392e-05,112.29122543334961,COMPLETE
218,0.32317519187927246,2023-09-04 21:55:53.306408,2023-09-04 21:55:54.093818,0 days 00:00:00.787410,Tanh,ReLU,Leaky,Tanh,15,20,18.0,3.0,17.0,0.021280248716750425,4,72,0.5546966868076848,0.0022568589129254614,109.3798884516177,COMPLETE
219,0.32667821645736694,2023-09-04 21:55:54.094138,2023-09-04 21:55:54.656260,0 days 00:00:00.562122,Sigmoid,Sigmoid,,,58,13,12.0,,,0.012827304824729976,2,149,0.7019482989903525,6.183940837155261e-05,120.87276656539352,COMPLETE
220,0.3516959547996521,2023-09-04 21:55:54.656557,2023-09-04 21:55:57.820257,0 days 00:00:03.163700,ReLU,Sigmoid,Sigmoid,Tanh,21,14,22.0,1.0,23.0,0.0007850273085214824,4,112,0.6155995141987481,1.004622757043037e-05,118.82289493785186,COMPLETE
221,0.36196765303611755,2023-09-04 21:55:57.820559,2023-09-04 21:55:58.693071,0 days 00:00:00.872512,Tanh,Sigmoid,,,18,15,5.0,,,0.007760315732241634,2,85,0.7643372112086502,4.3061294617372375e-05,92.2755412226138,COMPLETE
222,0.3224480152130127,2023-09-04 21:55:58.693551,2023-09-04 21:56:01.695977,0 days 00:00:03.002426,Tanh,Sigmoid,,,16,13,15.0,,,0.003918794696851874,2,89,0.7985071791482932,4.738003860801125e-05,107.59515062967937,COMPLETE
223,0.3343709111213684,2023-09-04 21:56:01.696273,2023-09-04 21:56:03.109061,0 days 00:00:01.412788,Tanh,Sigmoid,,,10,22,6.0,,,0.005274570874257468,2,97,0.45629202867839364,3.7949753593779866e-05,107.03980180328968,COMPLETE
224,0.35259413719177246,2023-09-04 21:56:03.109371,2023-09-04 21:56:04.891265,0 days 00:00:01.781894,Tanh,Sigmoid,,,15,8,4.0,,,0.004446821748429165,2,77,0.7397136112953833,5.3033763957234664e-05,113.34240218340341,COMPLETE
225,0.31865906715393066,2023-09-04 21:56:04.891584,2023-09-04 21:56:05.440188,0 days 00:00:00.548604,Tanh,Sigmoid,,,18,15,6.0,,,0.018856505581142716,2,102,0.330545645611574,8.566071587774543e-05,100.62600436740452,COMPLETE
226,0.3060271739959717,2023-09-04 21:56:05.440493,2023-09-04 21:56:11.469103,0 days 00:00:06.028610,Tanh,Sigmoid,,,12,14,24.0,,,0.0017292256535827253,2,91,0.7750910197214942,3.174527002146463e-05,104.33789473313551,COMPLETE
227,0.34649768471717834,2023-09-04 21:56:11.469400,2023-09-04 21:56:12.635875,0 days 00:00:01.166475,Tanh,,,,20,13,,,,0.0011887598788640722,1,64,0.7295714547426273,1.47714402053348e-05,130.23142850399017,COMPLETE
228,0.3319323658943176,2023-09-04 21:56:12.636165,2023-09-04 21:56:13.708008,0 days 00:00:01.071843,Leaky,Sigmoid,,,23,14,16.0,,,0.006504035583919285,2,116,0.6851449051929267,7.204617623001327e-05,109.02592107599432,COMPLETE
229,0.311125248670578,2023-09-04 21:56:13.708312,2023-09-04 21:56:14.422426,0 days 00:00:00.714114,Tanh,,,,29,24,,,,0.009212463528884184,1,80,0.7624868295466513,4.3626126387510204e-05,106.26350200419523,COMPLETE
230,0.27830713987350464,2023-09-04 21:56:14.422723,2023-09-04 21:56:14.868519,0 days 00:00:00.445796,Tanh,Tanh,,,26,21,10.0,,,0.014058003115749828,2,90,0.7099874459850865,6.120848469168948e-05,106.30235257356063,COMPLETE
231,0.3633893132209778,2023-09-04 21:56:14.868821,2023-09-04 21:56:15.777431,0 days 00:00:00.908610,Tanh,Tanh,,,27,22,10.0,,,0.015709037922365044,2,89,0.708097858017747,5.8714591473430496e-05,94.37775665283203,COMPLETE
232,0.37678709626197815,2023-09-04 21:56:15.777725,2023-09-04 21:56:16.131767,0 days 00:00:00.354042,Tanh,Tanh,,,31,21,14.0,,,0.011755408968894139,2,106,0.4831845374043132,5.032084866420715e-05,235.61650492350262,COMPLETE
233,0.3743087351322174,2023-09-04 21:56:16.132094,2023-09-04 21:56:16.279692,0 days 00:00:00.147598,Tanh,Tanh,,,26,21,13.0,,,0.013464990827471858,2,98,0.15830702383720624,6.460509558671676e-05,120.92064490685097,COMPLETE
234,0.2985675036907196,2023-09-04 21:56:16.279985,2023-09-04 21:56:16.988430,0 days 00:00:00.708445,Tanh,Tanh,,,22,12,23.0,,,0.018900282420172585,2,84,0.7499472920700363,1.2676250645678043e-05,93.77425433743385,COMPLETE
235,0.322221040725708,2023-09-04 21:56:16.988724,2023-09-04 21:56:17.355353,0 days 00:00:00.366629,Tanh,Tanh,,,25,21,9.0,,,0.023853848720348958,2,70,0.6746733621298983,3.922988097063899e-05,141.26127825285258,COMPLETE
236,0.35203441977500916,2023-09-04 21:56:17.355658,2023-09-04 21:56:17.876693,0 days 00:00:00.521035,Tanh,Sigmoid,ReLU,ReLU,74,17,5.0,18.0,19.0,0.015299803327516138,4,201,0.7162428413735865,2.071351640127636e-05,113.45787102835519,COMPLETE
237,0.33712196350097656,2023-09-04 21:56:17.877009,2023-09-04 21:56:19.098672,0 days 00:00:01.221663,Sigmoid,Leaky,,,29,18,6.0,,,0.011066239552368446,2,123,0.7991986112350745,7.81940651308736e-05,138.02816326434797,COMPLETE
238,0.3138576149940491,2023-09-04 21:56:19.098963,2023-09-04 21:56:20.443301,0 days 00:00:01.344338,ReLU,Sigmoid,,,14,20,11.0,,,0.01917059671661162,2,76,0.7669733091434218,0.0001064810907609169,104.01685752868653,COMPLETE
239,0.3360890746116638,2023-09-04 21:56:20.443596,2023-09-04 21:56:21.469981,0 days 00:00:01.026385,Tanh,,,,17,19,,,,0.005570627886434632,1,60,0.6429734075507535,1.734214633844841e-05,90.1319847800515,COMPLETE
240,0.3045331835746765,2023-09-04 21:56:21.470286,2023-09-04 21:56:22.111870,0 days 00:00:00.641584,Tanh,Sigmoid,,,35,13,12.0,,,0.008713583254493514,2,92,0.7294503316218972,4.3811502147771204e-05,125.31759970528739,COMPLETE
241,0.3296457827091217,2023-09-04 21:56:22.112169,2023-09-04 21:56:23.156600,0 days 00:00:01.044431,Tanh,Sigmoid,,,23,13,7.0,,,0.0069840879009661185,2,99,0.7677923700714026,7.793518827567991e-05,99.34074099858601,COMPLETE
242,0.4163052439689636,2023-09-04 21:56:23.156896,2023-09-04 21:56:25.334968,0 days 00:00:02.178072,Tanh,Sigmoid,,,25,14,23.0,,,0.000457766472995914,2,107,0.7716760157591891,5.550665279382439e-05,114.05351221672842,COMPLETE
243,0.30418968200683594,2023-09-04 21:56:25.335267,2023-09-04 21:56:26.178268,0 days 00:00:00.843001,Tanh,Sigmoid,,,20,12,8.0,,,0.007377729304877456,2,92,0.7993867057768489,6.806909721151679e-05,109.9664868441495,COMPLETE
244,0.33990997076034546,2023-09-04 21:56:26.178572,2023-09-04 21:56:26.847312,0 days 00:00:00.668740,Tanh,Sigmoid,,,24,13,5.0,,,0.015373984147157555,2,86,0.742764014264605,9.249987112891077e-05,96.06235599517822,COMPLETE
245,0.3449929654598236,2023-09-04 21:56:26.847638,2023-09-04 21:56:27.377903,0 days 00:00:00.530265,Tanh,Sigmoid,,,27,15,4.0,,,0.010087970532897913,2,143,0.6985013699803196,0.00015566622921372132,106.76445770263672,COMPLETE
246,0.32537686824798584,2023-09-04 21:56:27.378209,2023-09-04 21:56:27.761497,0 days 00:00:00.383288,Tanh,Sigmoid,Leaky,Sigmoid,85,16,24.0,20.0,9.0,0.013350920542013154,4,98,0.7692458690661472,3.3780144920141586e-05,104.48931663267074,COMPLETE
247,0.3507964313030243,2023-09-04 21:56:27.761815,2023-09-04 21:56:28.979304,0 days 00:00:01.217489,Tanh,Sigmoid,,,21,14,7.0,,,0.0052917970996082765,2,78,0.7214254345810897,1.3831223947254435e-05,96.01377424760298,COMPLETE
248,0.36296695470809937,2023-09-04 21:56:28.979619,2023-09-04 21:56:30.288125,0 days 00:00:01.308506,Tanh,Tanh,Leaky,,19,22,24.0,2.0,,0.0032090932863997105,3,134,0.6719999474649497,1.1560932588407899e-05,108.29636478424072,COMPLETE
249,0.3416149616241455,2023-09-04 21:56:30.288428,2023-09-04 21:56:31.395556,0 days 00:00:01.107128,Leaky,Sigmoid,,,12,13,8.0,,,0.007929801880628624,2,115,0.747585671212007,4.837215628004733e-05,86.66844863891602,COMPLETE
250,0.5492235422134399,2023-09-04 21:56:31.395868,2023-09-04 21:56:31.655646,0 days 00:00:00.259778,Tanh,,,,94,12,,,,0.0001819624109430833,1,70,0.3537933163370647,6.11002708809934e-05,122.32643628801618,COMPLETE
251,0.971873939037323,2023-09-04 21:56:31.656014,2023-09-04 21:56:32.026383,0 days 00:00:00.370369,Sigmoid,Sigmoid,ReLU,Tanh,23,9,19.0,9.0,7.0,0.02542399586865877,4,106,0.703914211172597,0.00012121456246950723,102.59662946065266,COMPLETE
252,0.2440364956855774,2023-09-04 21:56:32.026708,2023-09-04 21:56:32.642850,0 days 00:00:00.616142,ReLU,Sigmoid,,,16,15,9.0,,,0.03367246720041573,2,93,0.7733929034441412,2.482315203014596e-05,92.99590606689453,COMPLETE
253,0.4377240240573883,2023-09-04 21:56:32.643181,2023-09-04 21:56:33.042883,0 days 00:00:00.399702,ReLU,,,,16,15,,,,0.03282424986757255,1,88,0.7986372139790519,0.033512205896918223,101.28276014328003,COMPLETE
254,0.31459417939186096,2023-09-04 21:56:33.043164,2023-09-04 21:56:33.501620,0 days 00:00:00.458456,ReLU,Sigmoid,,,14,16,10.0,,,0.04944323981310687,2,60,0.5904977286801569,2.7688186938412795e-05,109.00596573773552,COMPLETE
255,0.3245875835418701,2023-09-04 21:56:33.501926,2023-09-04 21:56:34.803780,0 days 00:00:01.301854,ReLU,Sigmoid,Leaky,Leaky,18,15,9.0,7.0,20.0,0.02821925798768907,4,79,0.7378582392932264,2.2421480288567073e-05,89.91161128452846,COMPLETE
256,0.3220280706882477,2023-09-04 21:56:34.804108,2023-09-04 21:56:36.672989,0 days 00:00:01.868881,ReLU,ReLU,,,10,20,11.0,,,0.03649074616108359,2,157,0.672514775634112,1.6843790382518377e-05,99.21383326104346,COMPLETE
257,0.35877329111099243,2023-09-04 21:56:36.673299,2023-09-04 21:56:37.304402,0 days 00:00:00.631103,ReLU,Sigmoid,ReLU,,16,14,9.0,4.0,,0.020520144750450664,3,126,0.4440962059356001,3.472673036845524e-05,104.05963345231682,COMPLETE
258,0.3486354649066925,2023-09-04 21:56:37.304735,2023-09-04 21:56:37.880843,0 days 00:00:00.576108,ReLU,Sigmoid,,,33,16,10.0,,,0.015961286075538053,2,85,0.7168020247565907,1.4401748252454474e-05,103.47925164964464,COMPLETE
259,0.304633229970932,2023-09-04 21:56:37.881151,2023-09-04 21:56:39.097837,0 days 00:00:01.216686,Tanh,Tanh,,,38,15,3.0,,,0.002159038783994826,2,179,0.7619872504967998,2.5921959172671432e-05,107.3108347029913,COMPLETE
260,0.3311050236225128,2023-09-04 21:56:39.098160,2023-09-04 21:56:42.094357,0 days 00:00:02.996197,Sigmoid,,,,13,14,,,,0.002605511343789459,1,348,0.645093894123743,1.0010444925595059e-05,114.70136801652082,COMPLETE
261,0.32747358083724976,2023-09-04 21:56:42.094721,2023-09-04 21:56:43.722354,0 days 00:00:01.627633,Tanh,Sigmoid,Leaky,Sigmoid,18,21,10.0,22.0,13.0,0.02296647263716237,4,100,0.6898350866323495,4.090976093153196e-05,93.91740434434679,COMPLETE
262,0.3155874013900757,2023-09-04 21:56:43.722669,2023-09-04 21:56:44.514436,0 days 00:00:00.791767,Tanh,Sigmoid,,,15,23,23.0,,,0.012185155237679816,2,66,0.7994300222304372,1.9258796911649582e-05,97.59255517047384,COMPLETE
263,0.36993294954299927,2023-09-04 21:56:44.514740,2023-09-04 21:56:44.769920,0 days 00:00:00.255180,Leaky,,,,21,15,,,,0.017663650423267778,1,113,0.41653271253059426,4.9373677558321064e-05,104.85274713689631,COMPLETE
264,0.3414800763130188,2023-09-04 21:56:44.770204,2023-09-04 21:56:46.287994,0 days 00:00:01.517790,Tanh,Sigmoid,,,11,11,20.0,,,0.010484078216584253,2,147,0.5109373922723986,3.256661424623994e-05,182.158921151791,COMPLETE
265,0.3244200050830841,2023-09-04 21:56:46.288302,2023-09-04 21:56:46.941759,0 days 00:00:00.653457,Tanh,Sigmoid,Tanh,Tanh,17,14,4.0,14.0,24.0,0.02993919856967034,4,386,0.5402485228153512,1.3264765107090265e-05,104.54567972819011,COMPLETE
266,0.3361061215400696,2023-09-04 21:56:46.942079,2023-09-04 21:56:47.333162,0 days 00:00:00.391083,ReLU,Sigmoid,,,79,14,21.0,,,0.01375780406350129,2,74,0.7381793408275712,1.6196620955559093e-05,119.59711605165063,COMPLETE
267,0.4783569574356079,2023-09-04 21:56:47.333463,2023-09-04 21:56:48.665442,0 days 00:00:01.331979,Tanh,Leaky,,,30,17,24.0,,,3.496557738987102e-05,2,91,0.6102103253903858,0.00018147771738476117,119.18741222004314,COMPLETE
268,0.38366222381591797,2023-09-04 21:56:48.665856,2023-09-04 21:56:49.026598,0 days 00:00:00.360742,Tanh,,,,19,22,,,,0.0438372743824379,1,105,0.769520794456206,0.001252712326919658,114.15212917327881,COMPLETE
269,0.3507956266403198,2023-09-04 21:56:49.026894,2023-09-04 21:56:50.790761,0 days 00:00:01.763867,Sigmoid,Sigmoid,,,13,16,9.0,,,0.0015931972232323716,2,53,0.7125737670663177,4.583621643198061e-05,354.96062282346327,COMPLETE
270,0.3836723566055298,2023-09-04 21:56:50.791074,2023-09-04 21:56:51.191936,0 days 00:00:00.400862,Tanh,Sigmoid,ReLU,,15,12,22.0,23.0,,0.021543160206671984,3,81,0.2646628002280467,5.672491236308752e-05,117.53665219820462,COMPLETE
271,0.4346727728843689,2023-09-04 21:56:51.192247,2023-09-04 21:56:51.799439,0 days 00:00:00.607192,Tanh,Tanh,Leaky,Sigmoid,32,23,23.0,19.0,15.0,0.018017355985228523,4,93,0.7462922241168891,0.011206346841835349,126.95598030090332,COMPLETE
272,0.34926554560661316,2023-09-04 21:56:51.799778,2023-09-04 21:56:52.150088,0 days 00:00:00.350310,Tanh,Sigmoid,,,68,15,14.0,,,0.025573933305593877,2,73,0.6693049550956834,2.510399108031129e-05,2541.773508707682,COMPLETE
273,0.3413037955760956,2023-09-04 21:56:52.150387,2023-09-04 21:56:52.544749,0 days 00:00:00.394362,ReLU,,,,20,21,,,,0.014264102033537163,1,120,0.3047341306108478,1.1941633986135845e-05,123.8510262383355,COMPLETE
274,0.3250560462474823,2023-09-04 21:56:52.545082,2023-09-04 21:56:53.254680,0 days 00:00:00.709598,Tanh,Sigmoid,,,35,14,24.0,,,0.011506364778988604,2,135,0.42584656088334966,3.9997289227079254e-05,119.22311102377402,COMPLETE
275,0.32568249106407166,2023-09-04 21:56:53.255061,2023-09-04 21:56:54.971928,0 days 00:00:01.716867,Tanh,Sigmoid,,,10,18,3.0,,,0.0042429511908369365,2,97,0.7691085970555677,2.03065345566631e-05,88.8647456813503,COMPLETE
276,0.32866328954696655,2023-09-04 21:56:54.972254,2023-09-04 21:56:56.574415,0 days 00:00:01.602161,Tanh,Sigmoid,Sigmoid,Tanh,28,10,5.0,16.0,21.0,0.0010924135710384298,4,64,0.7194372603612912,6.834122992226406e-05,97.65284311771393,COMPLETE
277,0.3609904944896698,2023-09-04 21:56:56.574727,2023-09-04 21:56:57.035087,0 days 00:00:00.460360,Leaky,,,,16,13,,,,0.009231141497536224,1,109,0.38672369802439027,9.07527168022755e-05,98.9318899206213,COMPLETE
278,0.2890048921108246,2023-09-04 21:56:57.035383,2023-09-04 21:56:57.833721,0 days 00:00:00.798338,Tanh,Sigmoid,,,53,15,6.0,,,0.03658257869881198,2,85,0.798116911022066,0.00012698263775986923,96.44627237319946,COMPLETE
279,0.9965009689331055,2023-09-04 21:56:57.834040,2023-09-04 21:56:58.052159,0 days 00:00:00.218119,Sigmoid,Sigmoid,Leaky,ReLU,53,15,12.0,12.0,5.0,0.036562982719116885,4,81,0.7999835889180165,0.00012661393513975044,100.79244995117188,COMPLETE
280,0.4801504611968994,2023-09-04 21:56:58.052482,2023-09-04 21:56:58.316335,0 days 00:00:00.263853,Tanh,Tanh,,,63,16,11.0,,,0.047501925536138065,2,85,0.6355286374396346,0.09200622929575794,115.02763479727285,COMPLETE
281,0.32049423456192017,2023-09-04 21:56:58.316640,2023-09-04 21:56:58.607630,0 days 00:00:00.290990,Tanh,Sigmoid,,,50,15,16.0,,,0.03785805566707284,2,69,0.6899904025523895,0.00015124200746671946,109.40781004532523,COMPLETE
282,0.27131009101867676,2023-09-04 21:56:58.607948,2023-09-04 21:56:59.126513,0 days 00:00:00.518565,ReLU,ReLU,ReLU,,44,20,18.0,5.0,,0.03127744386062033,3,241,0.749854500524688,0.0001223683183471368,87.64854278564454,COMPLETE
283,0.2865893542766571,2023-09-04 21:56:59.126822,2023-09-04 21:56:59.551655,0 days 00:00:00.424833,ReLU,Tanh,ReLU,,39,19,18.0,5.0,,0.02906769727601657,3,218,0.7450436289188636,0.00012731211401972007,118.1715837561566,COMPLETE
284,0.30652984976768494,2023-09-04 21:56:59.551964,2023-09-04 21:57:00.017595,0 days 00:00:00.465631,ReLU,ReLU,ReLU,,44,20,19.0,3.0,,0.036121171816359855,3,254,0.5671394625336785,0.00023641353488573644,172.40774748060437,COMPLETE
285,0.3111902177333832,2023-09-04 21:57:00.017893,2023-09-04 21:57:00.685541,0 days 00:00:00.667648,ReLU,ReLU,ReLU,,41,18,20.0,5.0,,0.029006179023378237,3,57,0.7440340887072124,0.0001277168280160356,107.82785234953228,COMPLETE
