number,value,datetime_start,datetime_complete,duration,params_activation1,params_activation2,params_activation3,params_activation4,params_batch_size,params_fl1,params_fl2,params_fl3,params_fl4,params_learning_rate,params_n_layers,params_num_epochs,params_train_size,params_weight_decay,user_attrs_mre,state
536,0.35037070512771606,2023-09-04 22:16:01.573787,2023-09-04 22:16:01.763129,0 days 00:00:00.189342,Tanh,Leaky,Tanh,Sigmoid,95,11,16.0,14.0,6.0,0.01884839312632062,4,340,0.17080874349549457,0.00014889724818639745,107.4458951366191,COMPLETE
537,0.5605389475822449,2023-09-04 22:16:01.763589,2023-09-04 22:16:02.128867,0 days 00:00:00.365278,ReLU,Leaky,Sigmoid,Sigmoid,100,18,21.0,16.0,14.0,0.00048021421199645893,4,271,0.68466379830287,6.458754935093887e-05,156.6439224691952,COMPLETE
538,0.3812744915485382,2023-09-04 22:16:02.129385,2023-09-04 22:16:02.994428,0 days 00:00:00.865043,Sigmoid,Leaky,Sigmoid,Tanh,84,19,20.0,13.0,12.0,0.011694564271801442,4,311,0.768986812361171,0.0006447512187639608,152.6714301639133,COMPLETE
539,0.31591999530792236,2023-09-04 22:16:02.994793,2023-09-04 22:16:03.413837,0 days 00:00:00.419044,Leaky,Leaky,Sigmoid,Leaky,79,21,19.0,10.0,5.0,0.013676099179682977,4,144,0.6265232897943773,1.4997765189715338e-05,129.1356404622396,COMPLETE
540,0.30387505888938904,2023-09-04 22:16:03.414229,2023-09-04 22:16:04.500698,0 days 00:00:01.086469,Tanh,ReLU,Sigmoid,Sigmoid,36,20,21.0,12.0,11.0,0.009697451140112282,4,285,0.7087595287823104,2.0105082806085046e-05,108.94988609762753,COMPLETE
541,0.43091076612472534,2023-09-04 22:16:04.501145,2023-09-04 22:16:04.877560,0 days 00:00:00.376415,Leaky,Sigmoid,Sigmoid,Leaky,32,9,23.0,17.0,9.0,0.023425877332394943,4,240,0.2604412183772256,0.000205947023695138,157.76600750072583,COMPLETE
542,1.1242848634719849,2023-09-04 22:16:04.878063,2023-09-04 22:16:05.029153,0 days 00:00:00.151090,Leaky,Leaky,Sigmoid,Sigmoid,82,11,20.0,16.0,6.0,0.016782827192420496,4,260,0.13631469374942215,0.005221354300770957,110.40948867797852,COMPLETE
543,0.6093162894248962,2023-09-04 22:16:05.029651,2023-09-04 22:16:05.276556,0 days 00:00:00.246905,Tanh,Tanh,Sigmoid,Leaky,88,21,22.0,15.0,7.0,0.005651208785839569,4,251,0.2350500633043295,5.433609465230961e-05,552.021354519591,COMPLETE
544,0.36665570735931396,2023-09-04 22:16:05.277067,2023-09-04 22:16:05.584229,0 days 00:00:00.307162,Leaky,Leaky,Sigmoid,Sigmoid,84,10,21.0,23.0,6.0,0.03465626857226719,4,223,0.28779048380240013,0.0004705489037082412,218.31902745084943,COMPLETE
545,0.34844791889190674,2023-09-04 22:16:05.584732,2023-09-04 22:16:05.823596,0 days 00:00:00.238864,Tanh,Leaky,Sigmoid,Sigmoid,73,20,18.0,16.0,5.0,0.014312093697110104,4,295,0.1945316951210158,0.0033744794077278043,90.13187363568474,COMPLETE
546,0.4039502739906311,2023-09-04 22:16:05.824022,2023-09-04 22:16:06.198304,0 days 00:00:00.374282,Leaky,Leaky,Sigmoid,Leaky,81,18,19.0,19.0,10.0,0.007088480063859549,4,165,0.3402332438074986,7.74668259530574e-05,135.68844509124756,COMPLETE
547,0.4128068685531616,2023-09-04 22:16:06.198671,2023-09-04 22:16:10.085761,0 days 00:00:03.887090,Tanh,Leaky,Tanh,Sigmoid,86,19,20.0,19.0,12.0,7.241470809292311e-05,4,234,0.7399566695410134,0.001628668813839055,134.24129404573358,COMPLETE
548,0.2811736762523651,2023-09-04 22:16:10.086135,2023-09-04 22:16:11.183895,0 days 00:00:01.097760,ReLU,Sigmoid,Sigmoid,Leaky,90,15,24.0,24.0,8.0,0.01924509490728777,4,331,0.7662534347756665,3.689356567907614e-05,103.34101947985198,COMPLETE
549,0.3878406286239624,2023-09-04 22:16:11.184261,2023-09-04 22:16:11.965809,0 days 00:00:00.781548,Leaky,Leaky,Sigmoid,ReLU,34,10,20.0,9.0,13.0,0.01209393996480642,4,244,0.3703143692839657,9.84294952474243e-05,2091.779460261418,COMPLETE
550,0.3199980556964874,2023-09-04 22:16:11.966192,2023-09-04 22:16:12.492603,0 days 00:00:00.526411,Tanh,Leaky,Sigmoid,Sigmoid,37,22,21.0,14.0,19.0,0.026813115094053177,4,275,0.23130374274667861,0.00013160780270195103,133.36621516301082,COMPLETE
551,0.4168090522289276,2023-09-04 22:16:12.492974,2023-09-04 22:16:12.831634,0 days 00:00:00.338660,Leaky,Leaky,Sigmoid,Leaky,77,21,15.0,15.0,5.0,0.08100327606304576,4,196,0.6714545142408084,0.0002533722896149364,216.95605977376303,COMPLETE
552,0.5849183201789856,2023-09-04 22:16:12.832021,2023-09-04 22:16:13.274268,0 days 00:00:00.442247,Sigmoid,Leaky,Sigmoid,Sigmoid,80,9,19.0,24.0,6.0,0.009268626656400936,4,221,0.5023284614924145,0.00017888848078982753,145.36255203247072,COMPLETE
553,0.34083089232444763,2023-09-04 22:16:13.274643,2023-09-04 22:16:13.559759,0 days 00:00:00.285116,Tanh,Leaky,Leaky,Sigmoid,83,19,20.0,13.0,7.0,0.015868675435460708,4,363,0.32972491176249547,1.2090604595475641e-05,130.27191616240003,COMPLETE
554,0.3874625265598297,2023-09-04 22:16:13.560126,2023-09-04 22:16:14.074515,0 days 00:00:00.514389,Leaky,Sigmoid,Sigmoid,Leaky,39,11,22.0,18.0,11.0,0.019998067974791228,4,254,0.7211606415373908,4.636464001472562e-05,172.091451327006,COMPLETE
555,0.3805270195007324,2023-09-04 22:16:14.074886,2023-09-04 22:16:14.502736,0 days 00:00:00.427850,Leaky,ReLU,Sigmoid,Sigmoid,85,20,21.0,23.0,9.0,0.011338286517300272,4,267,0.7740994951300787,3.0889937200520026e-05,143.4955005645752,COMPLETE
556,0.4176792800426483,2023-09-04 22:16:14.503138,2023-09-04 22:16:14.931353,0 days 00:00:00.428215,Tanh,Leaky,Sigmoid,Leaky,83,21,11.0,12.0,7.0,0.023230353765398393,4,205,0.6974376588190251,0.0011287678481740515,155.92967965262278,COMPLETE
557,0.40737882256507874,2023-09-04 22:16:14.931713,2023-09-04 22:16:15.248398,0 days 00:00:00.316685,ReLU,Tanh,Sigmoid,Sigmoid,75,10,17.0,16.0,6.0,0.0027190510842592126,4,308,0.21062307376210881,0.0005591275634270242,115.50927734375,COMPLETE
558,0.3580501973628998,2023-09-04 22:16:15.248762,2023-09-04 22:16:15.569539,0 days 00:00:00.320777,Leaky,Leaky,Sigmoid,Leaky,87,19,20.0,15.0,10.0,0.0396621489067377,4,229,0.40867019108859215,0.00039053487627249174,127.25660378592355,COMPLETE
559,0.3570041060447693,2023-09-04 22:16:15.569908,2023-09-04 22:16:16.649721,0 days 00:00:01.079813,Tanh,Leaky,Tanh,Sigmoid,80,20,23.0,4.0,5.0,0.0008518687275057696,4,240,0.6051865636746522,0.00015189362591834675,131.09609717291755,COMPLETE
560,1.3439120054244995,2023-09-04 22:16:16.650135,2023-09-04 22:16:16.772818,0 days 00:00:00.122683,Leaky,Leaky,Sigmoid,Sigmoid,82,9,21.0,17.0,11.0,0.0005491381729111779,4,339,0.18964899701395013,0.00024134406291040957,201.72028350830078,COMPLETE
561,0.43387728929519653,2023-09-04 22:16:16.773222,2023-09-04 22:16:18.275185,0 days 00:00:01.501963,Tanh,Leaky,Sigmoid,,78,20,22.0,11.0,,0.0013551067138832845,3,324,0.7992315929965708,0.008070614818719912,147.4112424195268,COMPLETE
562,0.3468530774116516,2023-09-04 22:16:18.275561,2023-09-04 22:16:18.700299,0 days 00:00:00.424738,Leaky,Sigmoid,Sigmoid,Leaky,66,13,18.0,24.0,12.0,0.053843787299643286,4,262,0.46132601864664663,0.0003063786088082222,165.49056847150936,COMPLETE
563,0.3608694076538086,2023-09-04 22:16:18.700719,2023-09-04 22:16:19.739522,0 days 00:00:01.038803,Tanh,Leaky,Sigmoid,Tanh,32,19,19.0,5.0,6.0,0.0038197060124271587,4,214,0.6446267808688135,6.193436073546175e-05,116.31802243602519,COMPLETE
564,0.20097661018371582,2023-09-04 22:16:19.739915,2023-09-04 22:16:21.158753,0 days 00:00:01.418838,Sigmoid,Leaky,Sigmoid,Sigmoid,86,18,20.0,15.0,17.0,0.014074543795137734,4,180,0.7411229558032576,8.209058131288404e-05,194.8752484268017,COMPLETE
565,0.378288209438324,2023-09-04 22:16:21.159407,2023-09-04 22:16:22.663137,0 days 00:00:01.503730,Sigmoid,Leaky,Sigmoid,Leaky,89,17,13.0,16.0,10.0,0.01609679855673054,4,183,0.746661967819431,7.859305023431607e-05,225.50367109510634,COMPLETE
566,0.457691490650177,2023-09-04 22:16:22.663823,2023-09-04 22:16:23.500547,0 days 00:00:00.836724,Sigmoid,Leaky,Sigmoid,Sigmoid,87,19,20.0,15.0,17.0,0.01311948195393422,4,166,0.39447084308163655,8.872146092129936e-05,173.699571653854,COMPLETE
567,0.22605440020561218,2023-09-04 22:16:23.501191,2023-09-04 22:16:24.585899,0 days 00:00:01.084708,Sigmoid,Leaky,Sigmoid,Leaky,85,18,20.0,15.0,17.0,0.01765481635194395,4,177,0.7410040030260308,9.814996172966346e-05,309.19539457378966,COMPLETE
568,0.35640713572502136,2023-09-04 22:16:24.586298,2023-09-04 22:16:26.784008,0 days 00:00:02.197710,Sigmoid,Leaky,Sigmoid,Sigmoid,92,17,20.0,15.0,17.0,0.01852604275855803,4,195,0.7292440022010064,7.8294922289529e-05,140.83062865768653,COMPLETE
569,0.4033631980419159,2023-09-04 22:16:26.784454,2023-09-04 22:16:27.275875,0 days 00:00:00.491421,Sigmoid,ReLU,Sigmoid,Leaky,85,18,2.0,15.0,17.0,0.01521763328060721,4,175,0.2428803463929075,0.00010699810885678246,258.7668142513353,COMPLETE
570,0.5405412912368774,2023-09-04 22:16:27.276260,2023-09-04 22:16:27.512350,0 days 00:00:00.236090,Sigmoid,Sigmoid,Sigmoid,Sigmoid,88,17,20.0,16.0,11.0,0.02134043988013022,4,177,0.29012767970904285,0.00010036427490305655,128.78249577113561,COMPLETE
571,0.4116246998310089,2023-09-04 22:16:27.512805,2023-09-04 22:16:27.955637,0 days 00:00:00.442832,Sigmoid,Leaky,Sigmoid,Leaky,86,18,20.0,15.0,18.0,0.017626782338326527,4,181,0.7479133001730123,0.0001191070453109812,166.79567602908972,COMPLETE
572,0.25513994693756104,2023-09-04 22:16:27.956050,2023-09-04 22:16:28.900387,0 days 00:00:00.944337,Sigmoid,Tanh,Tanh,Sigmoid,84,18,21.0,16.0,18.0,0.013691489717591331,4,167,0.7130501001087708,6.792608766972455e-05,123.3038788807543,COMPLETE
573,0.694609522819519,2023-09-04 22:16:28.900898,2023-09-04 22:16:29.388863,0 days 00:00:00.487965,Sigmoid,Leaky,,,86,18,20.0,,,0.000725694955013687,2,160,0.15978298643429656,5.376974409369386e-05,158.92787535085617,COMPLETE
574,0.21779407560825348,2023-09-04 22:16:29.389360,2023-09-04 22:16:30.444001,0 days 00:00:01.054641,Sigmoid,Leaky,Sigmoid,ReLU,90,18,21.0,15.0,17.0,0.021385891113630894,4,176,0.7768908195297656,7.45926164388446e-05,241.34745054978592,COMPLETE
575,0.32943180203437805,2023-09-04 22:16:30.444411,2023-09-04 22:16:31.044060,0 days 00:00:00.599649,Sigmoid,Leaky,Sigmoid,ReLU,91,18,20.0,15.0,16.0,0.02066909781735107,4,156,0.7973281102660353,7.869523900976118e-05,203.6789785531851,COMPLETE
576,0.3986113965511322,2023-09-04 22:16:31.044577,2023-09-04 22:16:31.409237,0 days 00:00:00.364660,Sigmoid,Leaky,Sigmoid,ReLU,90,18,21.0,15.0,17.0,0.024839298080522085,4,172,0.30392484122543545,8.535839993508106e-05,146.20444538554207,COMPLETE
577,1.0407518148422241,2023-09-04 22:16:31.409728,2023-09-04 22:16:31.610880,0 days 00:00:00.201152,Sigmoid,Sigmoid,Sigmoid,ReLU,88,17,19.0,14.0,17.0,0.01708414095112529,4,181,0.773139392738658,6.583205458453968e-05,99.93020884195964,COMPLETE
578,0.34473392367362976,2023-09-04 22:16:31.611285,2023-09-04 22:16:32.247858,0 days 00:00:00.636573,Sigmoid,Leaky,Leaky,ReLU,94,16,20.0,15.0,18.0,0.021144030051825604,4,169,0.7701455663823793,9.532504922676055e-05,123.51026874118381,COMPLETE
579,0.368216872215271,2023-09-04 22:16:32.248286,2023-09-04 22:16:32.645912,0 days 00:00:00.397626,Sigmoid,Leaky,Sigmoid,Leaky,89,17,7.0,16.0,17.0,0.014766113433444243,4,156,0.7987420576421853,4.312689609243162e-05,175.7149605586611,COMPLETE
580,0.6107926964759827,2023-09-04 22:16:32.646390,2023-09-04 22:16:34.297596,0 days 00:00:01.651206,Sigmoid,Leaky,Sigmoid,ReLU,90,18,21.0,14.0,17.0,0.00020482892693875765,4,145,0.7428567101873725,6.551892325159108e-05,173.5066815606479,COMPLETE
581,0.3424614369869232,2023-09-04 22:16:34.297961,2023-09-04 22:16:34.602118,0 days 00:00:00.304157,Sigmoid,Leaky,ReLU,ReLU,96,18,20.0,16.0,18.0,0.017841011294523732,4,183,0.5450137286048116,0.00012140215213986404,161.19466843143587,COMPLETE
582,0.45151105523109436,2023-09-04 22:16:34.602495,2023-09-04 22:16:34.805964,0 days 00:00:00.203469,Sigmoid,Leaky,Sigmoid,ReLU,92,18,21.0,15.0,16.0,0.01203724316662428,4,172,0.11978439956876674,5.354421381637956e-05,174.12015969412667,COMPLETE
583,0.41382142901420593,2023-09-04 22:16:34.806345,2023-09-04 22:16:35.200270,0 days 00:00:00.393925,Sigmoid,ReLU,Sigmoid,ReLU,87,18,19.0,15.0,17.0,0.026431447642522147,4,160,0.7487226533231474,0.00010276407135146332,159.95025634765625,COMPLETE
584,0.6881167888641357,2023-09-04 22:16:35.200694,2023-09-04 22:16:35.377535,0 days 00:00:00.176841,Sigmoid,Tanh,Sigmoid,ReLU,85,17,22.0,2.0,18.0,0.014591848169494957,4,184,0.1236704080173326,2.4070210570706567e-05,157.16101909819105,COMPLETE
585,0.4405832588672638,2023-09-04 22:16:35.377941,2023-09-04 22:16:36.031496,0 days 00:00:00.653555,Sigmoid,Sigmoid,Sigmoid,Leaky,86,17,20.0,16.0,17.0,0.0188930217837504,4,190,0.48758430776240963,7.081411877987575e-05,151.61319427490236,COMPLETE
586,0.24819426238536835,2023-09-04 22:16:36.031866,2023-09-04 22:16:37.013733,0 days 00:00:00.981867,Sigmoid,Leaky,Tanh,ReLU,88,21,21.0,14.0,17.0,0.0024644321478147855,4,170,0.7661700361881897,8.036415826987845e-05,131.41921997070312,COMPLETE
587,0.4060420095920563,2023-09-04 22:16:37.014136,2023-09-04 22:16:37.443369,0 days 00:00:00.429233,Sigmoid,Leaky,Sigmoid,Leaky,85,19,19.0,15.0,16.0,0.01101168002412966,4,177,0.3769846669213134,5.2693092515443106e-05,151.883910886703,COMPLETE
588,1.041673183441162,2023-09-04 22:16:37.443786,2023-09-04 22:16:37.908746,0 days 00:00:00.464960,Sigmoid,Leaky,Sigmoid,,84,17,20.0,16.0,,0.0001269862176783177,3,188,0.14255983111179155,0.013993830024827535,96.21408998205307,COMPLETE
589,0.4595048427581787,2023-09-04 22:16:37.909105,2023-09-04 22:16:38.286335,0 days 00:00:00.377230,Sigmoid,Leaky,Sigmoid,Leaky,87,18,21.0,17.0,18.0,0.021925971028596083,4,139,0.4411802428697294,1.9692124180110755e-05,159.53699808535367,COMPLETE
590,0.43767502903938293,2023-09-04 22:16:38.286722,2023-09-04 22:16:38.954938,0 days 00:00:00.668216,Sigmoid,Leaky,ReLU,Leaky,83,21,20.0,15.0,16.0,0.0006971927374590157,4,165,0.21841431435128966,0.00013338512808240782,179.22270748254024,COMPLETE
591,0.4086700975894928,2023-09-04 22:16:38.955315,2023-09-04 22:16:40.040666,0 days 00:00:01.085351,Sigmoid,Sigmoid,Sigmoid,Leaky,84,8,22.0,9.0,19.0,0.0162446867898818,4,175,0.7197008453091233,4.414190617344349e-05,148.32551204796994,COMPLETE
592,0.4033845365047455,2023-09-04 22:16:40.041067,2023-09-04 22:16:40.577327,0 days 00:00:00.536260,Sigmoid,Leaky,Sigmoid,Leaky,82,19,9.0,16.0,17.0,0.012691902022204283,4,284,0.7389347250357334,9.286531148579038e-05,161.01051573319867,COMPLETE
593,0.6870592832565308,2023-09-04 22:16:40.577703,2023-09-04 22:16:55.739114,0 days 00:00:15.161411,Sigmoid,Leaky,Sigmoid,Tanh,17,22,19.0,14.0,18.0,2.6863317313485976e-05,4,349,0.7699394335221162,1.0398282892132404e-05,131.17350318711945,COMPLETE
594,0.3467017412185669,2023-09-04 22:16:55.739502,2023-09-04 22:16:56.308500,0 days 00:00:00.568998,Sigmoid,Leaky,Sigmoid,Leaky,89,20,21.0,14.0,15.0,0.014489096908760846,4,299,0.5231540644678825,1.6474356219450914e-05,208.23057197122012,COMPLETE
595,0.2610692083835602,2023-09-04 22:16:56.308875,2023-09-04 22:16:57.162686,0 days 00:00:00.853811,Tanh,Leaky,Sigmoid,ReLU,86,19,20.0,15.0,17.0,0.0033476187067799255,4,278,0.7144381985795661,3.531404571184663e-05,256.54795879207245,COMPLETE
596,0.2984081506729126,2023-09-04 22:16:57.163156,2023-09-04 22:16:57.732666,0 days 00:00:00.569510,ReLU,ReLU,Sigmoid,Sigmoid,98,18,20.0,17.0,9.0,0.028291072327895392,4,188,0.799347805659739,1.2032368189388262e-05,117.86392500135634,COMPLETE
597,0.2995060086250305,2023-09-04 22:16:57.733143,2023-09-04 22:16:58.162575,0 days 00:00:00.429432,Tanh,Leaky,Sigmoid,Leaky,92,15,21.0,15.0,16.0,0.018114773900196595,4,318,0.6771428888715932,5.979531333290848e-05,228.6051214117753,COMPLETE
598,0.3399359881877899,2023-09-04 22:16:58.162947,2023-09-04 22:17:00.651152,0 days 00:00:02.488205,Sigmoid,Leaky,ReLU,Sigmoid,84,21,23.0,16.0,13.0,0.0004935178510197862,4,255,0.7427953751154818,0.00011328747604835785,142.22005702539818,COMPLETE
599,1.0299991369247437,2023-09-04 22:17:00.651554,2023-09-04 22:17:02.382671,0 days 00:00:01.731117,Tanh,,,,29,20,,,,1.0699869640118054e-05,1,120,0.7683315312329345,0.00014480282260769385,135.70490519205728,COMPLETE
600,0.765800952911377,2023-09-04 22:17:02.383034,2023-09-04 22:17:03.860080,0 days 00:00:01.477046,Tanh,Tanh,Sigmoid,Sigmoid,88,21,19.0,15.0,12.0,0.00037254551685008086,4,268,0.3474644761098684,0.0001743017730325111,316.71234444006166,COMPLETE
601,0.42264524102211,2023-09-04 22:17:03.860463,2023-09-04 22:17:04.031771,0 days 00:00:00.171308,ReLU,Sigmoid,Tanh,Leaky,90,22,21.0,16.0,10.0,0.010357866510780581,4,290,0.2187842219732388,2.99681331954967e-05,113.2852279663086,COMPLETE
602,0.2982882559299469,2023-09-04 22:17:04.032153,2023-09-04 22:17:04.713959,0 days 00:00:00.681806,Tanh,Leaky,Sigmoid,Sigmoid,82,19,22.0,18.0,1.0,0.023658742942829148,4,249,0.6595804182449527,7.253428835010476e-05,172.19936879475912,COMPLETE
603,0.5325183868408203,2023-09-04 22:17:04.714338,2023-09-04 22:17:06.788508,0 days 00:00:02.074170,Sigmoid,Leaky,Leaky,Leaky,85,18,20.0,17.0,11.0,0.00033365082694750625,4,309,0.7139957189913501,4.166990647170401e-05,141.27537195306076,COMPLETE
604,0.3110586106777191,2023-09-04 22:17:06.788911,2023-09-04 22:17:08.322107,0 days 00:00:01.533196,Tanh,Leaky,Sigmoid,Sigmoid,26,20,19.0,16.0,18.0,0.013396629585068605,4,259,0.6930970863886652,0.0019696354149525194,179.3275854928153,COMPLETE
605,0.4674077332019806,2023-09-04 22:17:08.322496,2023-09-04 22:17:08.552530,0 days 00:00:00.230034,Tanh,Leaky,Sigmoid,Leaky,87,21,22.0,15.0,15.0,0.016560614477279745,4,335,0.273752454478085,0.0002064257736115412,322.7754376385663,COMPLETE
606,0.3767196536064148,2023-09-04 22:17:08.552924,2023-09-04 22:17:10.344109,0 days 00:00:01.791185,Sigmoid,Leaky,Sigmoid,Sigmoid,82,18,20.0,14.0,17.0,0.0011194276137593934,4,152,0.742873089339088,2.185631364119534e-05,185.55170290093673,COMPLETE
607,0.9238457679748535,2023-09-04 22:17:10.344497,2023-09-04 22:17:10.499064,0 days 00:00:00.154567,Tanh,Sigmoid,Sigmoid,Sigmoid,84,14,21.0,15.0,12.0,0.020375084898267875,4,179,0.25426607357419456,0.009732782536948117,111.31825837634858,COMPLETE
608,0.284123957157135,2023-09-04 22:17:10.499440,2023-09-04 22:17:11.069250,0 days 00:00:00.569810,ReLU,Leaky,Sigmoid,Leaky,31,8,20.0,16.0,16.0,0.010876221509807165,4,329,0.3002662048613402,9.051039634520817e-05,86.3584976196289,COMPLETE
609,0.2873450219631195,2023-09-04 22:17:11.069676,2023-09-04 22:17:11.543241,0 days 00:00:00.473565,Tanh,Leaky,ReLU,Sigmoid,81,17,21.0,14.0,14.0,0.013091802177537333,4,275,0.5705415296807937,5.7891334468474135e-05,181.26547597249348,COMPLETE
610,0.3168293833732605,2023-09-04 22:17:11.543639,2023-09-04 22:17:12.039005,0 days 00:00:00.495366,Sigmoid,Leaky,Sigmoid,ReLU,87,19,19.0,3.0,9.0,0.02358589846601423,4,355,0.7794854192407136,0.00014887393055688637,135.44506092560596,COMPLETE
611,0.37668463587760925,2023-09-04 22:17:12.039406,2023-09-04 22:17:12.333977,0 days 00:00:00.294571,Tanh,ReLU,,,34,20,20.0,,,0.016031153829651243,2,130,0.2699657624541931,0.00011545190992910764,165.7887361107803,COMPLETE
612,0.5648231506347656,2023-09-04 22:17:12.334352,2023-09-04 22:17:13.734645,0 days 00:00:01.400293,Tanh,Leaky,Sigmoid,,85,12,22.0,20.0,,0.00016987172552173336,3,162,0.6269316164469453,1.4993081946731475e-05,185.67603090074329,COMPLETE
613,0.2481292337179184,2023-09-04 22:17:13.735017,2023-09-04 22:17:14.277169,0 days 00:00:00.542152,ReLU,Tanh,Sigmoid,Leaky,83,21,21.0,17.0,10.0,0.008943553361373209,4,345,0.7289770687667975,4.6070522729964455e-05,158.31420933923056,COMPLETE
614,0.356523334980011,2023-09-04 22:17:14.277549,2023-09-04 22:17:14.605227,0 days 00:00:00.327678,Tanh,Leaky,Sigmoid,Sigmoid,90,6,20.0,15.0,11.0,0.030675982591356937,4,298,0.3965010386566938,2.7808736486245113e-05,179.115522257487,COMPLETE
615,0.6865681409835815,2023-09-04 22:17:14.605620,2023-09-04 22:17:15.197141,0 days 00:00:00.591521,Sigmoid,Sigmoid,Tanh,Tanh,81,19,19.0,16.0,17.0,0.0016330142297240127,4,263,0.2174625377217358,0.0033013466416807855,145.0270217895508,COMPLETE
616,0.5607640743255615,2023-09-04 22:17:15.197549,2023-09-04 22:17:18.194939,0 days 00:00:02.997390,Tanh,Leaky,Sigmoid,Leaky,86,22,22.0,23.0,11.0,6.905010556664375e-05,4,247,0.7978398073025849,0.003722046590067906,198.35496789723754,COMPLETE
617,0.32410675287246704,2023-09-04 22:17:18.195329,2023-09-04 22:17:18.630103,0 days 00:00:00.434774,Tanh,Leaky,Sigmoid,Sigmoid,95,11,23.0,15.0,4.0,0.01933240320553385,4,195,0.6760848947213975,7.242451616249002e-05,223.871248626709,COMPLETE
618,0.7111979126930237,2023-09-04 22:17:18.630495,2023-09-04 22:17:21.860768,0 days 00:00:03.230273,Sigmoid,Leaky,Sigmoid,Leaky,83,21,21.0,16.0,12.0,8.333544329520228e-05,4,289,0.7467483371502471,0.00024651583846230495,147.93417891664075,COMPLETE
619,0.7040486335754395,2023-09-04 22:17:21.861161,2023-09-04 22:17:24.874619,0 days 00:00:03.013458,Tanh,Leaky,ReLU,Sigmoid,80,16,20.0,17.0,10.0,4.9598169452916e-05,4,271,0.7030367969274114,0.0012715443372208503,255.54764897533008,COMPLETE
620,0.43701067566871643,2023-09-04 22:17:24.875014,2023-09-04 22:17:27.130786,0 days 00:00:02.255772,ReLU,Leaky,Sigmoid,Sigmoid,33,20,19.0,16.0,13.0,0.0002273826462095914,4,175,0.41601927535107225,1.3577662356036276e-05,310.9574965994699,COMPLETE
621,0.536910891532898,2023-09-04 22:17:27.131191,2023-09-04 22:17:31.158170,0 days 00:00:04.026979,Tanh,Sigmoid,Sigmoid,Leaky,89,18,20.0,15.0,2.0,0.0004331157394132214,4,321,0.4712905868476414,0.00017923204995687293,218.3541282582506,COMPLETE
622,1.0480811595916748,2023-09-04 22:17:31.158836,2023-09-04 22:17:33.360145,0 days 00:00:02.201309,Sigmoid,Leaky,Sigmoid,Sigmoid,85,3,10.0,14.0,12.0,4.673017243594562e-05,4,258,0.3243113752022767,8.860673114764511e-05,151.24339749831563,COMPLETE
623,0.6211346983909607,2023-09-04 22:17:33.360527,2023-09-04 22:17:33.812214,0 days 00:00:00.451687,Tanh,Leaky,Sigmoid,Leaky,93,20,21.0,16.0,18.0,0.0008098334951323632,4,248,0.23482611900581626,0.014378226275184269,142.3183901085044,COMPLETE
624,0.4205823838710785,2023-09-04 22:17:33.812599,2023-09-04 22:17:34.057912,0 days 00:00:00.245313,Tanh,ReLU,Sigmoid,Sigmoid,35,19,21.0,23.0,9.0,0.0119805399353064,4,186,0.12644091955519834,0.00033729967771316694,117.28117862277561,COMPLETE
