number,value,datetime_start,datetime_complete,duration,params_activation1,params_activation2,params_activation3,params_activation4,params_batch_size,params_fl1,params_fl2,params_fl3,params_fl4,params_learning_rate,params_n_layers,params_num_epochs,params_train_size,params_weight_decay,user_attrs_mre,state
268,0.27240195870399475,2023-09-04 22:12:35.330355,2023-09-04 22:12:36.900421,0 days 00:00:01.570066,Tanh,Sigmoid,Leaky,Leaky,37,11,23.0,24.0,10.0,0.0048299581459652794,4,125,0.7519850547610567,3.492334036558355e-05,111.61476176493876,COMPLETE
269,0.2866170406341553,2023-09-04 22:12:36.900813,2023-09-04 22:12:37.349219,0 days 00:00:00.448406,Leaky,ReLU,,,46,11,19.0,,,0.024195501924811128,2,144,0.7122675623764873,0.0008665458717116682,107.2283702305385,COMPLETE
270,0.5574510097503662,2023-09-04 22:12:37.349536,2023-09-04 22:12:37.695740,0 days 00:00:00.346204,Leaky,Tanh,Sigmoid,Sigmoid,40,21,16.0,12.0,13.0,0.07906327489191067,4,205,0.6125137470190293,0.00022276730482763478,172.42860412597656,COMPLETE
271,0.40201058983802795,2023-09-04 22:12:37.696078,2023-09-04 22:12:38.037249,0 days 00:00:00.341171,Leaky,Sigmoid,Sigmoid,Leaky,54,19,22.0,24.0,12.0,0.015781485270536442,4,327,0.39781227020090376,1.8505089389628237e-05,168.90638894745797,COMPLETE
272,0.3813415765762329,2023-09-04 22:12:38.037606,2023-09-04 22:12:42.249109,0 days 00:00:04.211503,Leaky,Sigmoid,Sigmoid,Leaky,34,24,21.0,10.0,5.0,0.0003183603638674745,4,170,0.7684622076862456,2.6193619613618316e-05,156.14329735251033,COMPLETE
273,0.42188912630081177,2023-09-04 22:12:42.249446,2023-09-04 22:12:42.504897,0 days 00:00:00.255451,ReLU,ReLU,Sigmoid,Sigmoid,91,23,19.0,14.0,10.0,0.01921315124819191,4,95,0.799916199313102,0.00011031321281725125,128.60599093967014,COMPLETE
274,0.2984068989753723,2023-09-04 22:12:42.505240,2023-09-04 22:12:43.553988,0 days 00:00:01.048748,Leaky,Tanh,Sigmoid,Leaky,36,4,17.0,22.0,11.0,0.014504329212002525,4,186,0.6773454082182246,6.34272257855723e-05,129.90101959228517,COMPLETE
275,0.49638330936431885,2023-09-04 22:12:43.554366,2023-09-04 22:12:43.731969,0 days 00:00:00.177603,Tanh,Sigmoid,Tanh,Leaky,88,20,20.0,18.0,9.0,0.060806223225979554,4,198,0.3711695471591646,4.8701138742973985e-05,234.29002137617633,COMPLETE
276,0.5037233829498291,2023-09-04 22:12:43.732297,2023-09-04 22:12:44.108687,0 days 00:00:00.376390,Leaky,Leaky,Sigmoid,Sigmoid,96,8,18.0,15.0,12.0,0.011309356127419738,4,237,0.22311567865080822,0.00045914168436913297,175.55841835869683,COMPLETE
277,0.3668716549873352,2023-09-04 22:12:44.109026,2023-09-04 22:12:44.635473,0 days 00:00:00.526447,Leaky,Tanh,Sigmoid,Leaky,41,10,24.0,23.0,8.0,0.025423956171827636,4,310,0.7337756632573516,4.974072932238737e-05,113.07387969970704,COMPLETE
278,0.5890589952468872,2023-09-04 22:12:44.635900,2023-09-04 22:12:45.387119,0 days 00:00:00.751219,Leaky,Leaky,Sigmoid,ReLU,99,1,20.0,17.0,1.0,0.004236840304756085,4,254,0.6418980470418284,0.00035690719469247075,154.15601377849336,COMPLETE
279,0.29231202602386475,2023-09-04 22:12:45.387458,2023-09-04 22:12:46.640994,0 days 00:00:01.253536,Leaky,Sigmoid,Leaky,Leaky,38,22,15.0,22.0,10.0,0.003239385553870858,4,115,0.4420822108556287,0.00024725862619609133,334.9319774195091,COMPLETE
280,0.5371446013450623,2023-09-04 22:12:46.641455,2023-09-04 22:12:47.022585,0 days 00:00:00.381130,Leaky,Leaky,Sigmoid,Sigmoid,43,21,21.0,16.0,7.0,0.04675479486515662,4,322,0.2773838293128684,3.536235806064805e-05,183.04332682291667,COMPLETE
281,0.28170496225357056,2023-09-04 22:12:47.023100,2023-09-04 22:12:48.195179,0 days 00:00:01.172079,Tanh,Leaky,Sigmoid,Leaky,48,20,19.0,13.0,10.0,0.010197750601792536,4,217,0.7006828991683328,0.0012616540904938365,143.99879164922805,COMPLETE
282,0.30340489745140076,2023-09-04 22:12:48.195533,2023-09-04 22:12:50.050035,0 days 00:00:01.854502,Leaky,ReLU,ReLU,Leaky,31,18,20.0,19.0,9.0,0.0072352213083596885,4,224,0.7470542019469788,0.00020689650454789257,95.06473648716026,COMPLETE
283,0.32489725947380066,2023-09-04 22:12:50.050468,2023-09-04 22:12:50.889814,0 days 00:00:00.839346,ReLU,Sigmoid,Sigmoid,Sigmoid,35,11,21.0,1.0,11.0,0.02067509890722592,4,163,0.4959269013869433,4.4064591726446505e-05,201.9268048150199,COMPLETE
284,0.38817861676216125,2023-09-04 22:12:50.890243,2023-09-04 22:12:51.373827,0 days 00:00:00.483584,Leaky,Leaky,Sigmoid,Leaky,39,19,18.0,17.0,8.0,0.03190832214276497,4,335,0.6676949229298681,0.009274580782190393,439.5426661173503,COMPLETE
285,0.6221210956573486,2023-09-04 22:12:51.374162,2023-09-04 22:12:54.900220,0 days 00:00:03.526058,Leaky,Tanh,Sigmoid,,84,12,22.0,24.0,,3.257077403285047e-05,3,354,0.7192170966715925,1.308031183861826e-05,134.73361115536449,COMPLETE
286,0.28961506485939026,2023-09-04 22:12:54.900541,2023-09-04 22:12:55.884489,0 days 00:00:00.983948,Leaky,Leaky,Tanh,Leaky,41,9,19.0,15.0,15.0,0.013970761458491989,4,243,0.7691241561374815,0.0005767393974205121,125.88492942342953,COMPLETE
287,0.3284606635570526,2023-09-04 22:12:55.884836,2023-09-04 22:12:56.397553,0 days 00:00:00.512717,Leaky,Leaky,Sigmoid,Sigmoid,33,21,20.0,16.0,13.0,0.01673516552770986,4,180,0.6922577577100617,1.9519162891257056e-05,144.09323919387091,COMPLETE
288,0.3598977029323578,2023-09-04 22:12:56.397880,2023-09-04 22:12:57.507211,0 days 00:00:01.109331,Sigmoid,Sigmoid,Sigmoid,Leaky,37,10,18.0,20.0,14.0,0.011899155071104003,4,66,0.5918504847097081,0.00013907183539438642,167.01387601910216,COMPLETE
289,0.30685970187187195,2023-09-04 22:12:57.507545,2023-09-04 22:12:58.459836,0 days 00:00:00.952291,Tanh,Leaky,Sigmoid,Leaky,87,20,20.0,23.0,4.0,0.0007721508269967611,4,315,0.5365769220856171,0.0002681322217015058,102.62625095300507,COMPLETE
290,0.5955881476402283,2023-09-04 22:12:58.460184,2023-09-04 22:12:58.712483,0 days 00:00:00.252299,Leaky,ReLU,Leaky,Sigmoid,44,11,21.0,16.0,11.0,0.09561641772048841,4,211,0.7987388239630953,6.136418337947863e-05,121.66025612571023,COMPLETE
291,0.43374255299568176,2023-09-04 22:12:58.712824,2023-09-04 22:12:59.046544,0 days 00:00:00.333720,ReLU,Leaky,Sigmoid,Leaky,92,14,23.0,15.0,9.0,0.00887438308672654,4,193,0.3570473255435164,9.41678921375121e-05,347.8167358398438,COMPLETE
292,0.3211551904678345,2023-09-04 22:12:59.046882,2023-09-04 22:12:59.895707,0 days 00:00:00.848825,Leaky,Sigmoid,Sigmoid,Tanh,97,18,19.0,14.0,10.0,0.005315725619117155,4,329,0.7387068295989277,0.00041615780862693153,160.05874106324748,COMPLETE
293,0.33124294877052307,2023-09-04 22:12:59.896044,2023-09-04 22:13:01.726286,0 days 00:00:01.830242,Leaky,Leaky,Sigmoid,ReLU,38,23,21.0,16.0,12.0,0.020021793276461437,4,255,0.6531948935902336,0.00033171820272139544,110.98359217409228,COMPLETE
294,0.35353559255599976,2023-09-04 22:13:01.726622,2023-09-04 22:13:02.239252,0 days 00:00:00.512630,Leaky,Tanh,Sigmoid,Leaky,41,6,17.0,17.0,16.0,0.024076944418269144,4,309,0.7106695931581088,0.0006848610979844535,117.51168441772461,COMPLETE
295,0.3472443222999573,2023-09-04 22:13:02.239589,2023-09-04 22:13:02.538227,0 days 00:00:00.298638,Leaky,Leaky,Tanh,Sigmoid,72,13,22.0,4.0,8.0,0.037594695730244924,4,300,0.6199379838441176,0.0001931867199260401,292.9104000727336,COMPLETE
296,0.25127270817756653,2023-09-04 22:13:02.538557,2023-09-04 22:13:03.283467,0 days 00:00:00.744910,Tanh,Sigmoid,Sigmoid,Leaky,90,19,17.0,23.0,24.0,0.01449223396675588,4,228,0.7706184290806741,0.00023277567931935574,143.90085335383338,COMPLETE
297,0.25508934259414673,2023-09-04 22:13:03.283896,2023-09-04 22:13:03.858966,0 days 00:00:00.575070,Tanh,Leaky,Sigmoid,Leaky,85,19,20.0,22.0,6.0,0.013213992486411684,4,229,0.75230746546445,0.00014469170649568998,114.97167757724193,COMPLETE
298,0.19242581725120544,2023-09-04 22:13:03.859379,2023-09-04 22:13:04.637334,0 days 00:00:00.777955,Tanh,Leaky,Sigmoid,Leaky,83,19,20.0,23.0,6.0,0.013192578958070304,4,231,0.7657656648541858,0.00012851959597295654,116.13339352607727,COMPLETE
299,0.3104483485221863,2023-09-04 22:13:04.637782,2023-09-04 22:13:05.133050,0 days 00:00:00.495268,Tanh,Leaky,Sigmoid,Leaky,79,19,20.0,22.0,5.0,0.013738654323785456,4,234,0.7685042597665591,0.00011126367731010222,109.73242328041478,COMPLETE
300,0.3079317808151245,2023-09-04 22:13:05.133470,2023-09-04 22:13:05.701856,0 days 00:00:00.568386,Tanh,Leaky,Sigmoid,Leaky,83,19,21.0,23.0,23.0,0.0025802887924707566,4,238,0.7446228295437056,0.00013596894766020723,108.14100962099822,COMPLETE
301,0.248482808470726,2023-09-04 22:13:05.702265,2023-09-04 22:13:06.238234,0 days 00:00:00.535969,Tanh,Leaky,Sigmoid,Leaky,59,19,20.0,23.0,6.0,0.01107868460628014,4,226,0.7558805220679947,0.0001526816622154811,164.04739222807044,COMPLETE
302,0.3084961473941803,2023-09-04 22:13:06.238679,2023-09-04 22:13:07.232895,0 days 00:00:00.994216,Tanh,Leaky,Sigmoid,Leaky,56,18,8.0,23.0,6.0,0.010892949185635168,4,229,0.7774605417242966,0.00014357239560494842,398.99891219600556,COMPLETE
303,0.48479604721069336,2023-09-04 22:13:07.233317,2023-09-04 22:13:08.102625,0 days 00:00:00.869308,Tanh,Leaky,Sigmoid,Leaky,82,19,20.0,22.0,24.0,0.00205993766854275,4,245,0.7515943745206985,0.00012173608505593724,169.0496384302775,COMPLETE
304,0.3617297410964966,2023-09-04 22:13:08.102972,2023-09-04 22:13:08.372358,0 days 00:00:00.269386,Tanh,Leaky,Sigmoid,Leaky,85,17,20.0,23.0,21.0,0.01274714578234143,4,232,0.38434738432532795,0.00016178732272963768,153.70436276887594,COMPLETE
305,0.3285112977027893,2023-09-04 22:13:08.372680,2023-09-04 22:13:09.303258,0 days 00:00:00.930578,Tanh,Leaky,Sigmoid,Leaky,80,18,21.0,23.0,5.0,0.01023785873458622,4,224,0.7709281535817981,9.269167702400607e-05,174.01573753356934,COMPLETE
306,0.35545653104782104,2023-09-04 22:13:09.303582,2023-09-04 22:13:09.575927,0 days 00:00:00.272345,Tanh,ReLU,Sigmoid,Leaky,59,19,22.0,22.0,6.0,0.015025852847996273,4,223,0.3373019895533737,0.0001575948205397315,124.88909588438092,COMPLETE
307,0.3282710611820221,2023-09-04 22:13:09.576262,2023-09-04 22:13:10.173667,0 days 00:00:00.597405,Tanh,Tanh,Sigmoid,Leaky,84,19,21.0,22.0,6.0,0.0087684015852755,4,246,0.7248223615929993,0.00012048568233014273,168.33774475097655,COMPLETE
308,0.2750798761844635,2023-09-04 22:13:10.174012,2023-09-04 22:13:11.531981,0 days 00:00:01.357969,Tanh,Leaky,Sigmoid,Leaky,77,18,19.0,23.0,6.0,0.001119245003293166,4,228,0.741236805542147,0.00022574447040230142,148.4467177681301,COMPLETE
309,0.21664652228355408,2023-09-04 22:13:11.532332,2023-09-04 22:13:12.015344,0 days 00:00:00.483012,Tanh,Leaky,Sigmoid,Leaky,81,20,20.0,23.0,5.0,0.012601365061761469,4,217,0.7966589271435294,0.0001838463507222924,95.27043342590332,COMPLETE
310,0.2751743793487549,2023-09-04 22:13:12.015726,2023-09-04 22:13:12.765571,0 days 00:00:00.749845,Tanh,Leaky,Sigmoid,Leaky,81,20,20.0,23.0,4.0,0.012525649338088711,4,215,0.766993082248942,0.00017330379886302343,169.0591722081919,COMPLETE
311,0.286900132894516,2023-09-04 22:13:12.765915,2023-09-04 22:13:14.395803,0 days 00:00:01.629888,Tanh,Leaky,Sigmoid,Leaky,52,20,20.0,23.0,20.0,0.015233484550155246,4,237,0.7004245597535229,0.0001359604096706435,150.03095813130224,COMPLETE
312,0.2886282503604889,2023-09-04 22:13:14.396359,2023-09-04 22:13:15.318253,0 days 00:00:00.921894,Tanh,Leaky,Sigmoid,Leaky,80,20,20.0,22.0,5.0,0.016618450056611358,4,217,0.7254663156853315,0.00011315164934616512,167.63840220524713,COMPLETE
313,0.2711230218410492,2023-09-04 22:13:15.318818,2023-09-04 22:13:17.153961,0 days 00:00:01.835143,Tanh,Leaky,Sigmoid,Leaky,82,20,17.0,24.0,6.0,0.006836499041575095,4,226,0.7732659316685631,0.00019152848477169544,145.59465933537138,COMPLETE
314,0.33352240920066833,2023-09-04 22:13:17.154339,2023-09-04 22:13:17.658197,0 days 00:00:00.503858,Tanh,Leaky,Sigmoid,Leaky,54,12,19.0,23.0,5.0,0.012149954312999485,4,207,0.43229036165081425,0.00016009880226394122,104.32748596191406,COMPLETE
315,0.17901286482810974,2023-09-04 22:13:17.658596,2023-09-04 22:13:18.395705,0 days 00:00:00.737109,Tanh,Leaky,Sigmoid,Leaky,78,19,20.0,22.0,6.0,0.01411770761798099,4,238,0.6984561610266112,7.523223099021883e-05,96.16189672076513,COMPLETE
316,0.43785321712493896,2023-09-04 22:13:18.396035,2023-09-04 22:13:18.687418,0 days 00:00:00.291383,Tanh,Leaky,Sigmoid,Leaky,76,19,20.0,22.0,5.0,0.0033953042032554845,4,247,0.1850166306991338,8.163311219583428e-05,173.79279660506987,COMPLETE
317,0.4435758888721466,2023-09-04 22:13:18.687807,2023-09-04 22:13:19.007572,0 days 00:00:00.319765,Tanh,Leaky,Sigmoid,Leaky,83,19,19.0,21.0,6.0,0.010095274722197331,4,237,0.5199439362750214,0.003721938943165776,156.45264434814453,COMPLETE
318,0.26687946915626526,2023-09-04 22:13:19.007926,2023-09-04 22:13:19.575935,0 days 00:00:00.568009,Tanh,Leaky,Sigmoid,Leaky,78,19,18.0,22.0,7.0,0.01350845318025929,4,257,0.69665227153865,0.00010156710446162139,229.74787425994873,COMPLETE
319,0.30077850818634033,2023-09-04 22:13:19.576313,2023-09-04 22:13:20.402598,0 days 00:00:00.826285,Tanh,Leaky,Sigmoid,Leaky,81,20,21.0,22.0,6.0,0.00876609440887279,4,230,0.7398421190245007,7.086893326869715e-05,99.72061509352464,COMPLETE
320,0.27388688921928406,2023-09-04 22:13:20.402964,2023-09-04 22:13:21.344968,0 days 00:00:00.942004,Tanh,Leaky,Sigmoid,Leaky,61,18,20.0,23.0,6.0,0.0040144617880434625,4,241,0.7126210635558499,0.0010621183909751454,111.77143609345849,COMPLETE
321,0.28836387395858765,2023-09-04 22:13:21.345315,2023-09-04 22:13:22.066468,0 days 00:00:00.721153,Tanh,Leaky,Sigmoid,Leaky,83,20,19.0,8.0,7.0,0.013831890114440425,4,251,0.7992291299517802,0.00020453537726931246,217.53423068397925,COMPLETE
322,0.3898419439792633,2023-09-04 22:13:22.066796,2023-09-04 22:13:22.356895,0 days 00:00:00.290099,Tanh,Leaky,Sigmoid,Leaky,86,19,21.0,21.0,5.0,0.011514577105315015,4,262,0.7520096593509247,0.0021894668335652482,370.6389429001581,COMPLETE
323,0.6963361501693726,2023-09-04 22:13:22.357243,2023-09-04 22:13:22.443621,0 days 00:00:00.086378,Tanh,Tanh,ReLU,Leaky,79,24,20.0,18.0,7.0,0.007716653117947908,4,240,0.10543710444103128,0.00014170689353358538,146.37541694641112,COMPLETE
324,0.3461626172065735,2023-09-04 22:13:22.443958,2023-09-04 22:13:22.680718,0 days 00:00:00.236760,Tanh,Leaky,Sigmoid,Leaky,81,18,19.0,22.0,6.0,0.053943555429164,4,219,0.6855565660090905,5.771988870987656e-05,114.06999206542969,COMPLETE
325,0.2923203110694885,2023-09-04 22:13:22.681071,2023-09-04 22:13:23.205356,0 days 00:00:00.524285,Tanh,Leaky,Sigmoid,Leaky,57,20,21.0,23.0,3.0,0.0057418506917629114,4,251,0.725017786617771,0.0001822592567377123,106.99841016881606,COMPLETE
326,0.31074902415275574,2023-09-04 22:13:23.205678,2023-09-04 22:13:24.038441,0 days 00:00:00.832763,Tanh,Leaky,Sigmoid,Leaky,51,13,20.0,17.0,6.0,0.01669499331019881,4,230,0.799026062208211,0.00012832190159749654,96.16718064977768,COMPLETE
327,0.3613632023334503,2023-09-04 22:13:24.038771,2023-09-04 22:13:24.284895,0 days 00:00:00.246124,Tanh,Leaky,Sigmoid,Sigmoid,85,12,11.0,21.0,22.0,0.01074956656049166,4,240,0.763732514780157,0.00022163310369625883,209.44379297892252,COMPLETE
328,0.32970207929611206,2023-09-04 22:13:24.285223,2023-09-04 22:13:25.173252,0 days 00:00:00.888029,Tanh,Leaky,Sigmoid,Leaky,47,19,17.0,23.0,14.0,0.0014256736825172338,4,266,0.4043638472972149,0.0016383149544586392,95.60193464491103,COMPLETE
329,0.3201286792755127,2023-09-04 22:13:25.173605,2023-09-04 22:13:26.934063,0 days 00:00:01.760458,Tanh,Tanh,Sigmoid,Tanh,45,20,19.0,22.0,18.0,0.0005975276963467739,4,104,0.7035714405813221,0.00016247656970839357,143.38541434361383,COMPLETE
330,0.6429163813591003,2023-09-04 22:13:26.934421,2023-09-04 22:13:28.435813,0 days 00:00:01.501392,Sigmoid,Leaky,Sigmoid,Leaky,78,14,20.0,15.0,19.0,0.00013914628428152363,4,220,0.42695963514441787,9.587758051519664e-05,175.5252813165838,COMPLETE
331,0.36471521854400635,2023-09-04 22:13:28.436143,2023-09-04 22:13:28.923779,0 days 00:00:00.487636,Tanh,Leaky,Sigmoid,Leaky,83,19,21.0,16.0,13.0,0.018583323182101125,4,249,0.6781570743345517,0.0008082294479210487,140.47858983820134,COMPLETE
332,0.18935510516166687,2023-09-04 22:13:28.924121,2023-09-04 22:13:30.013027,0 days 00:00:01.088906,Tanh,Leaky,Sigmoid,Sigmoid,49,21,21.0,15.0,2.0,0.015342700618075697,4,258,0.745486597433614,0.00021604023534362715,144.85119676589966,COMPLETE
333,0.2228650152683258,2023-09-04 22:13:30.013369,2023-09-04 22:13:30.859822,0 days 00:00:00.846453,Tanh,Leaky,Sigmoid,Sigmoid,86,21,21.0,15.0,2.0,0.014550900081218494,4,232,0.7734546255982074,0.00023647798142963932,196.20300261179605,COMPLETE
334,0.5440963506698608,2023-09-04 22:13:30.860182,2023-09-04 22:13:31.277035,0 days 00:00:00.416853,Tanh,Tanh,Sigmoid,Sigmoid,86,21,21.0,15.0,3.0,0.001994687662739351,4,88,0.7709574595423397,0.00024112798397377052,178.80600437973484,COMPLETE
335,0.3017148971557617,2023-09-04 22:13:31.277395,2023-09-04 22:13:32.092160,0 days 00:00:00.814765,Tanh,Leaky,Sigmoid,Sigmoid,50,21,22.0,15.0,2.0,0.014099454919741856,4,235,0.747747463790297,0.00027544339404515214,124.25509389241536,COMPLETE
336,0.2876145541667938,2023-09-04 22:13:32.092499,2023-09-04 22:13:32.721337,0 days 00:00:00.628838,Tanh,Leaky,Sigmoid,Sigmoid,89,21,16.0,14.0,1.0,0.015250311982349083,4,228,0.7711485271964877,0.00022654074804189498,137.30389260346035,COMPLETE
337,0.334338515996933,2023-09-04 22:13:32.721679,2023-09-04 22:13:33.873413,0 days 00:00:01.151734,Tanh,Leaky,Sigmoid,Sigmoid,53,21,21.0,23.0,2.0,0.012420368616337983,4,258,0.7489479685886223,8.302609151835796e-05,179.71266078948975,COMPLETE
338,0.5288655757904053,2023-09-04 22:13:33.874060,2023-09-04 22:13:34.266188,0 days 00:00:00.392128,Tanh,Leaky,Sigmoid,Sigmoid,49,20,20.0,22.0,1.0,0.016864369351023614,4,245,0.7975884817442846,0.00014346317738286467,163.4548528570878,COMPLETE
339,0.22766700387001038,2023-09-04 22:13:34.266549,2023-09-04 22:13:34.721291,0 days 00:00:00.454742,Tanh,Leaky,Sigmoid,Sigmoid,84,21,20.0,15.0,5.0,0.018612912836473563,4,219,0.7307706027176136,5.357714656169489e-05,109.18851885114397,COMPLETE
340,0.3583356440067291,2023-09-04 22:13:34.721643,2023-09-04 22:13:35.188579,0 days 00:00:00.466936,Tanh,Leaky,Sigmoid,Sigmoid,85,20,20.0,15.0,2.0,0.01919326197865943,4,229,0.24544403957053812,5.273952099597459e-05,150.10213895277545,COMPLETE
341,0.31769025325775146,2023-09-04 22:13:35.188959,2023-09-04 22:13:35.516856,0 days 00:00:00.327897,Tanh,Leaky,Sigmoid,Sigmoid,84,21,21.0,24.0,3.0,0.010535760629659302,4,215,0.4875341940792755,4.5109831778376324e-05,130.73049693637424,COMPLETE
342,0.2542249858379364,2023-09-04 22:13:35.517188,2023-09-04 22:13:35.911470,0 days 00:00:00.394282,Tanh,Leaky,Sigmoid,Sigmoid,88,21,21.0,23.0,4.0,0.013493128487639202,4,222,0.7427900651735849,5.980679181270325e-05,142.47487429914804,COMPLETE
343,0.27484843134880066,2023-09-04 22:13:35.911859,2023-09-04 22:13:36.483566,0 days 00:00:00.571707,Tanh,Leaky,Sigmoid,Sigmoid,87,22,22.0,23.0,4.0,0.018469594205623302,4,224,0.7303145700903445,5.981853357240249e-05,119.24513130999625,COMPLETE
344,0.3184058964252472,2023-09-04 22:13:36.484007,2023-09-04 22:13:37.164816,0 days 00:00:00.680809,Tanh,Leaky,Sigmoid,Sigmoid,89,21,21.0,23.0,5.0,0.01439487968808164,4,222,0.774210335200093,4.07626214323824e-05,143.30152239118303,COMPLETE
345,0.24687767028808594,2023-09-04 22:13:37.165317,2023-09-04 22:13:37.853232,0 days 00:00:00.687915,Tanh,Leaky,ReLU,Sigmoid,87,21,21.0,24.0,4.0,0.021542970659167427,4,213,0.7407860763312039,7.027328476168482e-05,106.68221651274582,COMPLETE
346,0.2746160626411438,2023-09-04 22:13:37.853553,2023-09-04 22:13:38.243998,0 days 00:00:00.390445,Tanh,Leaky,ReLU,Sigmoid,88,22,22.0,24.0,4.0,0.021558935635281957,4,215,0.7462641940219159,7.131823101299573e-05,279.0708465576172,COMPLETE
347,0.3148186504840851,2023-09-04 22:13:38.244470,2023-09-04 22:13:38.590763,0 days 00:00:00.346293,Tanh,Leaky,ReLU,Sigmoid,86,21,21.0,24.0,4.0,0.02996425512514965,4,234,0.4610445950510937,6.822864616497635e-05,163.12752737650058,COMPLETE
348,0.46462786197662354,2023-09-04 22:13:38.591212,2023-09-04 22:13:39.289135,0 days 00:00:00.697923,Tanh,Leaky,ReLU,Sigmoid,90,21,22.0,24.0,3.0,0.018223741362542616,4,204,0.46552905705418773,4.905347011852264e-05,238.13087701797485,COMPLETE
349,0.32135313749313354,2023-09-04 22:13:39.289738,2023-09-04 22:13:40.142739,0 days 00:00:00.853001,Tanh,,,,84,22,,,,0.022522216294855586,1,215,0.769244069511651,7.789029959578229e-05,214.91567396684127,COMPLETE
350,0.5809224247932434,2023-09-04 22:13:40.143071,2023-09-04 22:13:40.719311,0 days 00:00:00.576240,Tanh,Leaky,ReLU,Sigmoid,87,20,21.0,23.0,2.0,0.026847137641189487,4,237,0.7388619568035988,6.526924220506875e-05,212.24645103292264,COMPLETE
351,0.31365862488746643,2023-09-04 22:13:40.719655,2023-09-04 22:13:41.589603,0 days 00:00:00.869948,Tanh,Leaky,ReLU,Sigmoid,80,21,20.0,24.0,2.0,0.0022873298067759406,4,226,0.7946175446314739,5.008108249666766e-05,120.01074842973189,COMPLETE
352,0.2782016098499298,2023-09-04 22:13:41.590201,2023-09-04 22:13:42.819420,0 days 00:00:01.229219,Tanh,Leaky,ReLU,Sigmoid,82,22,21.0,20.0,3.0,0.01272409513982652,4,204,0.7990470565659975,5.749997039436011e-05,162.25913645426434,COMPLETE
353,0.4030227065086365,2023-09-04 22:13:42.819781,2023-09-04 22:13:43.040270,0 days 00:00:00.220489,Tanh,Leaky,Sigmoid,Sigmoid,85,20,12.0,21.0,5.0,0.016242752455777266,4,230,0.2634426280423739,4.2678921707458024e-05,147.28986258255807,COMPLETE
354,0.29614606499671936,2023-09-04 22:13:43.040627,2023-09-04 22:13:43.564035,0 days 00:00:00.523408,Tanh,Leaky,Sigmoid,Sigmoid,87,16,22.0,14.0,4.0,0.04052741109092453,4,240,0.7319027012405487,7.603431791391351e-05,131.3848694202512,COMPLETE
355,1.0788438320159912,2023-09-04 22:13:43.564375,2023-09-04 22:13:44.139418,0 days 00:00:00.575043,Tanh,Leaky,Sigmoid,Sigmoid,90,19,21.0,22.0,4.0,0.0003436260859138442,4,212,0.13619904538200278,0.0002977542649181092,978.06632531364,COMPLETE
356,0.4930327534675598,2023-09-04 22:13:44.139769,2023-09-04 22:13:44.353382,0 days 00:00:00.213613,Tanh,Leaky,Sigmoid,Sigmoid,81,24,6.0,22.0,3.0,0.0823179750341448,4,224,0.3197580327263574,0.00010789223248584385,163.17874193191528,COMPLETE
