number,value,datetime_start,datetime_complete,duration,params_activation1,params_activation2,params_activation3,params_activation4,params_batch_size,params_fl1,params_fl2,params_fl3,params_fl4,params_learning_rate,params_n_layers,params_num_epochs,params_train_size,params_weight_decay,user_attrs_mre,state
278,0.2893976867198944,2023-09-04 21:21:44.483281,2023-09-04 21:21:46.723526,0 days 00:00:02.240245,Sigmoid,Tanh,Sigmoid,,36,20,22.0,12.0,,0.004427772270985494,3,229,0.7697646271479467,4.930889446043155e-05,271.95780356985625,COMPLETE
279,0.3815809190273285,2023-09-04 21:21:46.723851,2023-09-04 21:21:47.023519,0 days 00:00:00.299668,ReLU,ReLU,Tanh,,48,21,19.0,9.0,,0.009599210821612601,3,258,0.3362056724473631,9.90759506622936e-05,166.73486015124197,COMPLETE
280,0.31204453110694885,2023-09-04 21:21:47.023843,2023-09-04 21:21:48.668869,0 days 00:00:01.645026,Sigmoid,Leaky,Leaky,,38,19,22.0,8.0,,0.006844202739125315,3,246,0.6991945227967228,7.228999617908922e-05,211.64630565076772,COMPLETE
281,0.3399731516838074,2023-09-04 21:21:48.669194,2023-09-04 21:21:49.720964,0 days 00:00:01.051770,ReLU,Sigmoid,Sigmoid,,33,20,4.0,10.0,,0.005436063742604923,3,270,0.5022491580473734,3.8330789703089156e-05,344.6294697628746,COMPLETE
282,0.6224951148033142,2023-09-04 21:21:49.721283,2023-09-04 21:21:50.143364,0 days 00:00:00.422081,Sigmoid,ReLU,Leaky,,96,21,24.0,13.0,,0.01198983419762175,3,240,0.7995717660150733,0.03416022999737227,200.97470664978027,COMPLETE
283,0.2876793146133423,2023-09-04 21:21:50.143692,2023-09-04 21:21:50.991199,0 days 00:00:00.847507,Sigmoid,ReLU,Sigmoid,,46,18,21.0,24.0,,0.0191393776011036,3,287,0.7470774297883833,5.5343930213484476e-05,367.3048500754617,COMPLETE
284,0.29868510365486145,2023-09-04 21:21:50.991530,2023-09-04 21:21:51.674395,0 days 00:00:00.682865,ReLU,Leaky,Leaky,,42,19,24.0,4.0,,0.007751816208512093,3,306,0.6528594140138657,2.9881896883778604e-05,1568.1398747762044,COMPLETE
285,0.36235907673835754,2023-09-04 21:21:51.674725,2023-09-04 21:21:52.736498,0 days 00:00:01.061773,Tanh,Sigmoid,ReLU,,30,22,23.0,11.0,,0.02922953024819367,3,224,0.7726363914477712,2.0163220346781518e-05,192.34188652038574,COMPLETE
286,0.2779791057109833,2023-09-04 21:21:52.736821,2023-09-04 21:21:54.887415,0 days 00:00:02.150594,Sigmoid,ReLU,Sigmoid,,25,20,20.0,8.0,,0.014391807524817564,3,253,0.721952228701314,8.160709292841231e-05,159.49958589993992,COMPLETE
287,0.3946790397167206,2023-09-04 21:21:54.887724,2023-09-04 21:21:55.750254,0 days 00:00:00.862530,ReLU,Leaky,Tanh,,28,20,21.0,16.0,,0.00359061365172632,3,207,0.6194310226938176,4.369282669454513e-05,332.7714148627387,COMPLETE
288,0.3555329144001007,2023-09-04 21:21:55.750570,2023-09-04 21:21:56.758958,0 days 00:00:01.008388,Sigmoid,Sigmoid,Leaky,,40,21,23.0,23.0,,0.010529776207214913,3,274,0.4166693446878172,6.265235759214755e-05,2976.5059920090894,COMPLETE
289,0.3548084497451782,2023-09-04 21:21:56.759283,2023-09-04 21:22:02.161947,0 days 00:00:05.402664,Leaky,ReLU,Sigmoid,,34,18,22.0,9.0,,0.00022246775255035828,3,232,0.6883440338870237,0.0006053169448075105,193.19076146750615,COMPLETE
290,0.3150383234024048,2023-09-04 21:22:02.162258,2023-09-04 21:22:02.911609,0 days 00:00:00.749351,ReLU,Tanh,ReLU,,36,19,20.0,11.0,,0.005471095052599825,3,262,0.749324801850443,0.0001225667160796217,364.7611728668213,COMPLETE
291,0.2981298863887787,2023-09-04 21:22:02.911998,2023-09-04 21:22:04.036303,0 days 00:00:01.124305,Sigmoid,Leaky,Leaky,,32,8,24.0,7.0,,0.008647150422601549,3,215,0.7256629191305256,3.407242474570074e-05,153.20150032690015,COMPLETE
292,0.6302038431167603,2023-09-04 21:22:04.036639,2023-09-04 21:22:04.345148,0 days 00:00:00.308509,Sigmoid,ReLU,Sigmoid,,37,17,21.0,9.0,,0.06425764845580118,3,249,0.7975230368424008,5.153600641800736e-05,315.6658599853516,COMPLETE
293,0.26651209592819214,2023-09-04 21:22:04.345480,2023-09-04 21:22:05.669563,0 days 00:00:01.324083,ReLU,Sigmoid,Leaky,,44,19,23.0,10.0,,0.012677930996531236,3,238,0.7657646425647933,1.0080384326472016e-05,140.17439083177217,COMPLETE
294,0.32096216082572937,2023-09-04 21:22:05.669878,2023-09-04 21:22:06.734765,0 days 00:00:01.064887,ReLU,Sigmoid,Leaky,,44,19,22.0,10.0,,0.013034810272369683,3,239,0.6965938588476044,1.6647914361961853e-05,416.08188501993817,COMPLETE
295,0.3042858839035034,2023-09-04 21:22:06.735080,2023-09-04 21:22:07.353246,0 days 00:00:00.618166,ReLU,Sigmoid,Leaky,,45,20,23.0,10.0,,0.017281341338300678,3,278,0.6683356447140123,1.0515393992530224e-05,198.29278582195903,COMPLETE
296,0.31563347578048706,2023-09-04 21:22:07.353569,2023-09-04 21:22:08.107443,0 days 00:00:00.753874,ReLU,Sigmoid,Leaky,,50,20,19.0,11.0,,0.011272169717631397,3,296,0.7433250725044667,1.9279588127033215e-05,350.74681267371545,COMPLETE
297,0.44423556327819824,2023-09-04 21:22:08.107764,2023-09-04 21:22:08.258322,0 days 00:00:00.150558,ReLU,Sigmoid,Leaky,,43,21,22.0,12.0,,0.0221681580791624,3,257,0.10540554424230972,6.586716159921143e-05,239.75930165135583,COMPLETE
298,0.3351103961467743,2023-09-04 21:22:08.258638,2023-09-04 21:22:08.909440,0 days 00:00:00.650802,ReLU,Sigmoid,Leaky,,42,19,23.0,24.0,,0.014316535367823515,3,242,0.51536611071553,9.467432960446472e-05,176.92584228515625,COMPLETE
299,0.3414284288883209,2023-09-04 21:22:08.909777,2023-09-04 21:22:09.659415,0 days 00:00:00.749638,ReLU,Sigmoid,Leaky,,53,20,6.0,10.0,,0.010178383400885312,3,231,0.6387187999962685,1.826961545432959e-05,301.5320039779421,COMPLETE
300,0.2820640504360199,2023-09-04 21:22:09.659794,2023-09-04 21:22:11.214026,0 days 00:00:01.554232,Leaky,ReLU,ReLU,,39,21,21.0,11.0,,0.001424088982363881,3,251,0.7684197560007296,2.288549363647668e-05,170.46827782524957,COMPLETE
301,0.29541102051734924,2023-09-04 21:22:11.214366,2023-09-04 21:22:12.497181,0 days 00:00:01.282815,Tanh,Sigmoid,Tanh,,41,19,22.0,13.0,,0.017203603249359177,3,263,0.5757838413717374,1.0367346435699674e-05,181.15556899360988,COMPLETE
302,0.4329327344894409,2023-09-04 21:22:12.497709,2023-09-04 21:22:13.613781,0 days 00:00:01.116072,ReLU,ReLU,Leaky,,56,22,23.0,8.0,,0.00749940396377389,3,286,0.7205749273193175,1.2860400046794345e-05,141.18663747687089,COMPLETE
303,0.28935298323631287,2023-09-04 21:22:13.614112,2023-09-04 21:22:14.400629,0 days 00:00:00.786517,ReLU,ReLU,Leaky,,38,21,21.0,23.0,,0.011912888937218783,3,236,0.544152170354895,1.5472006482032793e-05,115.23449783325195,COMPLETE
304,0.3365735411643982,2023-09-04 21:22:14.400945,2023-09-04 21:22:15.058902,0 days 00:00:00.657957,Leaky,Sigmoid,ReLU,,44,19,23.0,9.0,,0.009488757729108978,3,249,0.6910400395860405,1.154709931333137e-05,223.4392887462269,COMPLETE
305,0.25560978055000305,2023-09-04 21:22:15.059225,2023-09-04 21:22:16.244071,0 days 00:00:01.184846,ReLU,ReLU,Leaky,,40,20,20.0,10.0,,0.01956995136515262,3,270,0.7593765850239852,1.5546036286183605e-05,273.7323373934118,COMPLETE
306,0.28742051124572754,2023-09-04 21:22:16.244386,2023-09-04 21:22:16.849663,0 days 00:00:00.605277,ReLU,ReLU,Leaky,,41,20,20.0,8.0,,0.02495139466114628,3,274,0.7689732080358864,1.3830579083973681e-05,170.58368137904577,COMPLETE
307,0.3491554260253906,2023-09-04 21:22:16.849990,2023-09-04 21:22:17.561860,0 days 00:00:00.711870,ReLU,Sigmoid,Tanh,,47,21,20.0,10.0,,0.02160624101234185,3,280,0.751166390787239,1.0667140786106031e-05,398.78184541742854,COMPLETE
308,0.46180132031440735,2023-09-04 21:22:17.562181,2023-09-04 21:22:17.723806,0 days 00:00:00.161625,ReLU,Tanh,ReLU,,40,20,19.0,11.0,,0.01762079213736557,3,269,0.12285609406531962,1.5617203941291954e-05,123.03374402950972,COMPLETE
309,0.5059335231781006,2023-09-04 21:22:17.724120,2023-09-04 21:22:18.205321,0 days 00:00:00.481201,ReLU,ReLU,Sigmoid,,46,4,19.0,9.0,,0.014488603847458625,3,301,0.20658578812930706,1.200380494659232e-05,765.5904760360718,COMPLETE
310,0.38321158289909363,2023-09-04 21:22:18.205674,2023-09-04 21:22:19.416918,0 days 00:00:01.211244,ReLU,Sigmoid,Leaky,,39,20,20.0,7.0,,0.0017997088441145661,3,261,0.46899943057826204,5.261210178092842e-05,147.73195884011008,COMPLETE
311,0.3383325934410095,2023-09-04 21:22:19.417238,2023-09-04 21:22:20.096799,0 days 00:00:00.679561,ReLU,ReLU,Sigmoid,,43,21,21.0,12.0,,0.01953320445189988,3,292,0.768061036678081,7.490880225551501e-05,237.54283447265624,COMPLETE
312,0.2776719629764557,2023-09-04 21:22:20.097114,2023-09-04 21:22:20.854175,0 days 00:00:00.757061,Tanh,Sigmoid,Leaky,,34,22,22.0,24.0,,0.03713751587325379,3,220,0.7181324198524821,4.408871331150012e-05,160.66339721679688,COMPLETE
313,0.35105788707733154,2023-09-04 21:22:20.854491,2023-09-04 21:22:21.608524,0 days 00:00:00.754033,ReLU,ReLU,ReLU,,42,20,21.0,10.0,,0.031429647984893026,3,266,0.606962665813512,0.00014980625551473006,192.99577985491072,COMPLETE
314,0.3221195638179779,2023-09-04 21:22:21.608831,2023-09-04 21:22:23.143058,0 days 00:00:01.534227,Leaky,Sigmoid,Sigmoid,,27,16,21.0,9.0,,0.016157314228707212,3,229,0.7957240727255821,0.00027359219894784785,315.6134811659991,COMPLETE
315,0.3114590048789978,2023-09-04 21:22:23.143365,2023-09-04 21:22:23.740140,0 days 00:00:00.596775,ReLU,ReLU,Leaky,,38,18,20.0,8.0,,0.013075896969498938,3,280,0.6689690777024054,0.0007315593858482066,119.50137307303292,COMPLETE
316,0.9880414009094238,2023-09-04 21:22:23.740464,2023-09-04 21:22:25.999252,0 days 00:00:02.258788,ReLU,Leaky,Sigmoid,,58,14,13.0,23.0,,1.439238421708644e-05,3,178,0.7390432854351893,5.9312882688353546e-05,103.63279634111383,COMPLETE
317,0.34157463908195496,2023-09-04 21:22:25.999577,2023-09-04 21:22:26.632654,0 days 00:00:00.633077,Tanh,ReLU,Tanh,,31,21,22.0,10.0,,0.025623238667442504,3,200,0.6979256168090183,1.42193399730427e-05,461.0064963063886,COMPLETE
318,0.32965222001075745,2023-09-04 21:22:26.633005,2023-09-04 21:22:27.676773,0 days 00:00:01.043768,ReLU,Sigmoid,Leaky,,35,19,20.0,11.0,,0.02014833819982409,3,236,0.7716705993599328,0.0016524619662938846,339.6391056605748,COMPLETE
319,0.3187861144542694,2023-09-04 21:22:27.677311,2023-09-04 21:22:29.611554,0 days 00:00:01.934243,Leaky,Tanh,ReLU,,40,20,21.0,7.0,,0.0066644600173509936,3,255,0.6446414855412631,1.0042176314081061e-05,167.6353638388894,COMPLETE
320,0.3841896951198578,2023-09-04 21:22:29.612108,2023-09-04 21:22:35.576445,0 days 00:00:05.964337,ReLU,ReLU,Sigmoid,,29,20,22.0,24.0,,0.0009638000825343257,3,125,0.7416481397282914,3.9839738664494624e-05,159.23874041748047,COMPLETE
321,0.2578095495700836,2023-09-04 21:22:35.576760,2023-09-04 21:22:36.665770,0 days 00:00:01.089010,ReLU,Leaky,Leaky,,37,21,23.0,8.0,,0.0026196798525514827,3,244,0.79651676190026,8.192596688443955e-05,319.9668989510372,COMPLETE
322,0.31857234239578247,2023-09-04 21:22:36.666171,2023-09-04 21:22:37.303521,0 days 00:00:00.637350,ReLU,Leaky,Leaky,,37,22,23.0,8.0,,0.0029905897462037803,3,247,0.7009967364479707,0.00011001492964950266,209.59663143673458,COMPLETE
323,0.2497638612985611,2023-09-04 21:22:37.303861,2023-09-04 21:22:38.184242,0 days 00:00:00.880381,ReLU,Leaky,Leaky,,38,21,23.0,8.0,,0.004151308383642527,3,222,0.7634637760671021,8.535632336226576e-05,2480.327766262755,COMPLETE
324,0.33924558758735657,2023-09-04 21:22:38.184652,2023-09-04 21:22:38.966425,0 days 00:00:00.781773,ReLU,Leaky,Leaky,,40,21,22.0,8.0,,0.0030689561738945037,3,241,0.769919679169802,8.458325790015781e-05,137.10577392578125,COMPLETE
325,0.385832279920578,2023-09-04 21:22:38.966830,2023-09-04 21:22:39.984479,0 days 00:00:01.017649,ReLU,Leaky,Leaky,,44,21,23.0,7.0,,0.0024514773171850452,3,220,0.7980542940099646,0.00013605872562367277,144.43538228019338,COMPLETE
326,0.3432460427284241,2023-09-04 21:22:39.984912,2023-09-04 21:22:40.596035,0 days 00:00:00.611123,ReLU,Leaky,Leaky,,38,22,23.0,15.0,,0.003821665097018461,3,215,0.7476192933559126,0.0004119947529447797,160.05560773961685,COMPLETE
327,0.34435760974884033,2023-09-04 21:22:40.596463,2023-09-04 21:22:41.330755,0 days 00:00:00.734292,ReLU,Leaky,Leaky,,41,21,22.0,8.0,,0.004250026505261468,3,454,0.7173055513061382,4.954009167331133e-05,148.04952545166014,COMPLETE
328,0.3593098223209381,2023-09-04 21:22:41.331072,2023-09-04 21:22:41.774152,0 days 00:00:00.443080,ReLU,Leaky,Leaky,,36,22,23.0,8.0,,0.0042919211957460025,3,231,0.4479782129836281,7.227575938130477e-05,478.97952352987755,COMPLETE
329,0.3169090449810028,2023-09-04 21:22:41.774485,2023-09-04 21:22:42.411140,0 days 00:00:00.636655,ReLU,Leaky,Leaky,,38,21,22.0,9.0,,0.00308811034444057,3,312,0.42406737408561246,3.476478895023246e-05,144.10014155653656,COMPLETE
330,0.29338186979293823,2023-09-04 21:22:42.411472,2023-09-04 21:22:42.940918,0 days 00:00:00.529446,ReLU,Leaky,ReLU,,42,18,23.0,7.0,,0.01710043275120927,3,241,0.758859877193672,0.00010118130350421966,129.65106151949973,COMPLETE
331,0.2567017674446106,2023-09-04 21:22:42.941346,2023-09-04 21:22:44.304966,0 days 00:00:01.363620,ReLU,Leaky,Tanh,,34,18,22.0,9.0,,0.004823501190490562,3,211,0.7999704039004282,2.9353693314047136e-05,90.74102912315955,COMPLETE
332,0.3365248739719391,2023-09-04 21:22:44.305531,2023-09-04 21:22:46.095714,0 days 00:00:01.790183,ReLU,Leaky,Tanh,,34,17,22.0,9.0,,0.0035127768985329364,3,206,0.7770622480663754,2.8799844398629655e-05,125.65885670979817,COMPLETE
333,0.4495084881782532,2023-09-04 21:22:46.096287,2023-09-04 21:22:47.315660,0 days 00:00:01.219373,ReLU,Leaky,Tanh,,33,18,21.0,6.0,,0.02639927682062661,3,189,0.7984775717842915,2.5472271430421185e-05,347.04647666529604,COMPLETE
334,0.46534907817840576,2023-09-04 21:22:47.316222,2023-09-04 21:22:48.138716,0 days 00:00:00.822494,ReLU,Leaky,Tanh,,35,15,22.0,8.0,,0.0026095378061476923,3,211,0.1606622176105351,2.0437230739032798e-05,336.43311515687003,COMPLETE
335,0.33168235421180725,2023-09-04 21:22:48.139287,2023-09-04 21:22:48.686913,0 days 00:00:00.547626,ReLU,Leaky,Tanh,,54,22,21.0,8.0,,0.004619329295131786,3,225,0.5427370479968034,0.0002196319548501341,232.94381268819174,COMPLETE
336,0.3988572657108307,2023-09-04 21:22:48.687237,2023-09-04 21:22:49.269638,0 days 00:00:00.582401,ReLU,Leaky,Tanh,,45,17,15.0,9.0,,0.0018835625984838136,3,217,0.4008675160884248,8.994955513619805e-05,167.18546491680723,COMPLETE
337,0.24606473743915558,2023-09-04 21:22:49.269957,2023-09-04 21:22:50.680409,0 days 00:00:01.410452,ReLU,Leaky,Tanh,,40,18,22.0,9.0,,0.003600877966251393,3,201,0.7997513260774041,3.141701870563552e-05,158.28954962235463,COMPLETE
338,0.3897201716899872,2023-09-04 21:22:50.680741,2023-09-04 21:22:51.138772,0 days 00:00:00.458031,ReLU,Leaky,Tanh,,40,21,22.0,9.0,,0.0036307898095592037,3,193,0.29876626095667974,2.353050390579105e-05,120.74955762227377,COMPLETE
339,0.42210549116134644,2023-09-04 21:22:51.139102,2023-09-04 21:22:51.477689,0 days 00:00:00.338587,ReLU,Leaky,Tanh,,43,18,22.0,9.0,,0.002494525596970225,3,205,0.26775653971609187,3.177739085297223e-05,146.85610647762522,COMPLETE
340,0.3199107348918915,2023-09-04 21:22:51.478004,2023-09-04 21:22:53.689936,0 days 00:00:02.211932,ReLU,Leaky,Tanh,,40,22,23.0,7.0,,0.0032009370119697664,3,196,0.7979284217698013,1.612174702799872e-05,120.05437434803356,COMPLETE
341,0.29733651876449585,2023-09-04 21:22:53.690302,2023-09-04 21:22:54.338736,0 days 00:00:00.648434,Tanh,Leaky,Tanh,,48,21,22.0,8.0,,0.004065785717160258,3,167,0.7342828859170519,0.00029885329469228465,239.54976565338845,COMPLETE
342,0.31951504945755005,2023-09-04 21:22:54.339069,2023-09-04 21:22:55.375739,0 days 00:00:01.036670,ReLU,Leaky,Tanh,,39,19,22.0,9.0,,0.005012148774844111,3,185,0.767823027089814,1.3252162868675833e-05,149.33497264467437,COMPLETE
343,0.2665563225746155,2023-09-04 21:22:55.376075,2023-09-04 21:22:56.122673,0 days 00:00:00.746598,ReLU,Leaky,Tanh,,42,21,23.0,17.0,,0.0047535835638603694,3,211,0.6023179986332333,2.9316843543580295e-05,141.61929293032046,COMPLETE
344,0.3259463310241699,2023-09-04 21:22:56.123071,2023-09-04 21:22:57.401958,0 days 00:00:01.278887,ReLU,Leaky,Tanh,,42,17,23.0,14.0,,0.0021384958122455866,3,202,0.5855046702920629,2.742111395697025e-05,171.2198523696588,COMPLETE
345,0.3183542788028717,2023-09-04 21:22:57.402301,2023-09-04 21:22:58.082901,0 days 00:00:00.680600,ReLU,Leaky,Tanh,,38,21,22.0,8.0,,0.004193845849826986,3,211,0.40549023195756706,3.5271786643003566e-05,142.01063341082948,COMPLETE
346,0.3485153913497925,2023-09-04 21:22:58.083326,2023-09-04 21:22:58.898325,0 days 00:00:00.814999,ReLU,Leaky,Tanh,,41,21,21.0,16.0,,0.005288339890358719,3,212,0.6044566471008814,2.9160273037847318e-05,187.57254975417564,COMPLETE
347,0.34149330854415894,2023-09-04 21:22:58.898686,2023-09-04 21:23:00.635337,0 days 00:00:01.736651,ReLU,Leaky,Tanh,,37,22,23.0,20.0,,0.0004928737611392769,3,222,0.6276187110745062,2.1286959536624075e-05,164.56308421259342,COMPLETE
348,0.382237046957016,2023-09-04 21:23:00.635695,2023-09-04 21:23:01.130821,0 days 00:00:00.495126,ReLU,Leaky,Tanh,,43,18,22.0,15.0,,0.0033557043684974796,3,194,0.5675335663002804,3.788973680528382e-05,169.55575200131065,COMPLETE
349,0.26852723956108093,2023-09-04 21:23:01.131157,2023-09-04 21:23:02.023453,0 days 00:00:00.892296,ReLU,Leaky,ReLU,,36,21,23.0,8.0,,0.0026926215031761163,3,209,0.6572786136563394,0.00017049367372383719,107.81179512871637,COMPLETE
350,0.30359208583831787,2023-09-04 21:23:02.023786,2023-09-04 21:23:02.665752,0 days 00:00:00.641966,ReLU,Leaky,ReLU,,35,22,16.0,17.0,,0.002885961731069784,3,210,0.6593360040392507,0.00014714210272388702,118.18668506019993,COMPLETE
351,0.2829943299293518,2023-09-04 21:23:02.666113,2023-09-04 21:23:03.611250,0 days 00:00:00.945137,ReLU,Leaky,Tanh,,36,21,23.0,8.0,,0.0022323693653666233,3,219,0.6769083426334856,2.653874403270872e-05,141.66800716945104,COMPLETE
352,0.3194010853767395,2023-09-04 21:23:03.611569,2023-09-04 21:23:04.566360,0 days 00:00:00.954791,ReLU,Leaky,Tanh,,32,21,23.0,7.0,,0.0025296936638634815,3,183,0.6379796277706697,3.169625654342298e-05,180.04390010127315,COMPLETE
353,0.27816319465637207,2023-09-04 21:23:04.566708,2023-09-04 21:23:05.798377,0 days 00:00:01.231669,ReLU,Leaky,ReLU,,39,23,11.0,19.0,,0.0017143797965598249,3,203,0.7118515501126993,0.00010467950288536411,124.85961059570313,COMPLETE
354,0.3985389471054077,2023-09-04 21:23:05.798693,2023-09-04 21:23:06.468018,0 days 00:00:00.669325,Tanh,Leaky,Tanh,,36,21,22.0,18.0,,0.0034804481804280437,3,202,0.34516338021850124,0.00017816288877693328,139.30531909014726,COMPLETE
355,0.42316344380378723,2023-09-04 21:23:06.468345,2023-09-04 21:23:09.006874,0 days 00:00:02.538529,ReLU,Leaky,ReLU,,34,22,23.0,17.0,,0.00041602638148969243,3,222,0.3800439319196748,0.00012192180641941874,240.3602475983104,COMPLETE
356,0.30603134632110596,2023-09-04 21:23:09.007295,2023-09-04 21:23:10.503951,0 days 00:00:01.496656,ReLU,Leaky,Tanh,,31,20,23.0,8.0,,0.013062874062637656,3,228,0.4996885504982658,3.93067167931738e-05,152.1982283592224,COMPLETE
357,0.3435576558113098,2023-09-04 21:23:10.504510,2023-09-04 21:23:11.232089,0 days 00:00:00.727579,ReLU,Leaky,ReLU,,38,21,22.0,9.0,,0.0456127304419986,3,217,0.7334592084104267,0.0001763412416541163,852.9152781168619,COMPLETE
358,0.3519101142883301,2023-09-04 21:23:11.232420,2023-09-04 21:23:12.267805,0 days 00:00:01.035385,ReLU,Leaky,Tanh,,41,20,8.0,8.0,,0.001474901723770708,3,199,0.46790042671303067,1.7352618829901506e-05,134.9269307194924,COMPLETE
359,0.3837762176990509,2023-09-04 21:23:12.268146,2023-09-04 21:23:12.932637,0 days 00:00:00.664491,Tanh,Leaky,ReLU,,33,22,21.0,7.0,,0.0027742038374657346,3,155,0.37177043537849336,2.2232543709798094e-05,180.50266956147692,COMPLETE
360,0.30491772294044495,2023-09-04 21:23:12.932967,2023-09-04 21:23:13.515155,0 days 00:00:00.582188,ReLU,Leaky,Leaky,,45,21,22.0,9.0,,0.003912411827946096,3,208,0.7983077932078647,0.00024744663611783014,164.00004039091223,COMPLETE
361,0.4204641878604889,2023-09-04 21:23:13.515502,2023-09-04 21:23:16.225070,0 days 00:00:02.709568,ReLU,Leaky,Tanh,,35,23,23.0,8.0,,0.00014341572672080184,3,232,0.45239528385319344,4.3976678555739064e-05,186.4139785108895,COMPLETE
362,0.41747424006462097,2023-09-04 21:23:16.225390,2023-09-04 21:23:19.610049,0 days 00:00:03.384659,ReLU,Tanh,Sigmoid,,37,20,22.0,9.0,,0.0007944746713104478,3,212,0.6709620626298511,3.394220070708312e-05,347.708035738963,COMPLETE
363,0.33149707317352295,2023-09-04 21:23:19.610374,2023-09-04 21:23:20.281285,0 days 00:00:00.670911,ReLU,Leaky,ReLU,,39,21,23.0,6.0,,0.015064874489044698,3,224,0.7623499524498748,0.005591270585991785,168.47497517353779,COMPLETE
364,0.25105488300323486,2023-09-04 21:23:20.281602,2023-09-04 21:23:21.849764,0 days 00:00:01.568162,ReLU,Leaky,Leaky,,30,20,21.0,8.0,,0.005013348946197122,3,234,0.713408681153841,5.8195478560998556e-05,3465.5206479673034,COMPLETE
365,0.3177332878112793,2023-09-04 21:23:21.850327,2023-09-04 21:23:23.684544,0 days 00:00:01.834217,Tanh,Leaky,Leaky,,26,20,21.0,8.0,,0.0048269059560363346,3,234,0.7129953382885457,5.511071853460391e-05,125.9900842813345,COMPLETE
366,0.3436773419380188,2023-09-04 21:23:23.684875,2023-09-04 21:23:25.433890,0 days 00:00:01.749015,ReLU,Leaky,Leaky,Leaky,29,19,21.0,14.0,1.0,0.004798705040569213,4,236,0.7995583954132078,1.8018892348579668e-05,197.3860809803009,COMPLETE
367,0.33906129002571106,2023-09-04 21:23:25.434220,2023-09-04 21:23:27.094291,0 days 00:00:01.660071,ReLU,Tanh,Leaky,,30,20,21.0,9.0,,0.011336095469078631,3,226,0.43801704002015973,6.681252110624379e-05,259.1952246841119,COMPLETE
368,0.373379111289978,2023-09-04 21:23:27.094868,2023-09-04 21:23:30.048367,0 days 00:00:02.953499,ReLU,Leaky,Leaky,,24,20,21.0,9.0,,0.03216193137954318,3,240,0.7401261421372559,2.421062864508064e-05,154.6758250186318,COMPLETE
369,0.380368709564209,2023-09-04 21:23:30.048933,2023-09-04 21:23:31.694512,0 days 00:00:01.645579,ReLU,Leaky,Leaky,,27,19,22.0,7.0,,0.022480265863655584,3,229,0.34380282262488704,4.4201977098127105e-05,151.9241762745137,COMPLETE
370,0.25995057821273804,2023-09-04 21:23:31.695088,2023-09-04 21:23:34.322746,0 days 00:00:02.627658,Tanh,Leaky,Leaky,,31,20,22.0,21.0,,0.005798942899269561,3,222,0.6925725012320428,2.980524553796073e-05,132.4004894680447,COMPLETE
