number,value,datetime_start,datetime_complete,duration,params_activation1,params_activation2,params_activation3,params_activation4,params_batch_size,params_fl1,params_fl2,params_fl3,params_fl4,params_learning_rate,params_n_layers,params_num_epochs,params_train_size,params_weight_decay,user_attrs_mre,state
1544,0.3804894983768463,2023-09-04 21:36:22.079291,2023-09-04 21:36:22.863067,0 days 00:00:00.783776,Tanh,Tanh,,,83,19,23.0,,,0.00174437883911288,2,129,0.7723735101171972,0.0006730064927264992,166.66239997668143,COMPLETE
1545,0.8965488076210022,2023-09-04 21:36:22.863524,2023-09-04 21:36:24.265725,0 days 00:00:01.402201,Tanh,ReLU,ReLU,,97,18,24.0,23.0,,1.012147171266221e-05,3,268,0.3824632139281236,0.0002212980541967739,109.60473496166628,COMPLETE
1546,0.5509474277496338,2023-09-04 21:36:24.266201,2023-09-04 21:36:24.498361,0 days 00:00:00.232160,Leaky,Sigmoid,,,76,17,9.0,,,0.023123517237718095,2,282,0.17763765014802615,0.0022655328635866226,165.03122838338217,COMPLETE
1547,0.8255821466445923,2023-09-04 21:36:24.498841,2023-09-04 21:36:25.126930,0 days 00:00:00.628089,Tanh,Tanh,,,57,16,23.0,,,3.069572083433991e-05,2,256,0.12654953830941293,0.00013721800441459834,120.65022590756416,COMPLETE
1548,0.44782543182373047,2023-09-04 21:36:25.127392,2023-09-04 21:36:25.317050,0 days 00:00:00.189658,Tanh,ReLU,,,79,18,12.0,,,0.01923419581512503,2,378,0.14348336113665275,9.322808886228604e-05,186.14361159006754,COMPLETE
1549,0.5053847432136536,2023-09-04 21:36:25.317518,2023-09-04 21:36:25.644373,0 days 00:00:00.326855,ReLU,Tanh,,,81,19,24.0,,,0.07495259083161492,2,300,0.7219817516629046,0.01689650784508493,200.927367316352,COMPLETE
1550,0.34250617027282715,2023-09-04 21:36:25.644965,2023-09-04 21:36:26.470944,0 days 00:00:00.825979,Tanh,Sigmoid,,,85,11,9.0,,,0.029344283891290845,2,448,0.6420189052480413,0.0003578607760737265,232.8552534315321,COMPLETE
1551,1.0326353311538696,2023-09-04 21:36:26.471420,2023-09-04 21:36:26.921784,0 days 00:00:00.450364,Leaky,Leaky,Sigmoid,,78,21,10.0,1.0,,0.016022792878537306,3,143,0.7988491456429604,0.05095763402614583,100.990235359438,COMPLETE
1552,0.40392276644706726,2023-09-04 21:36:26.922306,2023-09-04 21:36:28.023060,0 days 00:00:01.100754,Tanh,ReLU,,,74,18,11.0,,,0.002684300056937771,2,316,0.6879784154426708,0.003617933086469401,142.78196088005515,COMPLETE
1553,0.3771970570087433,2023-09-04 21:36:28.023522,2023-09-04 21:36:28.474505,0 days 00:00:00.450983,Sigmoid,Tanh,,,80,20,1.0,,,0.012980524839435499,2,174,0.2108829905902681,0.00017857386262721408,160.9877926296658,COMPLETE
1554,0.31852322816848755,2023-09-04 21:36:28.474961,2023-09-04 21:36:29.032448,0 days 00:00:00.557487,Tanh,Sigmoid,,,77,19,10.0,,,0.025340053335117792,2,289,0.5750814147389471,0.00011994176942522221,108.86063593084162,COMPLETE
1555,0.6097789406776428,2023-09-04 21:36:29.032918,2023-09-04 21:36:31.891489,0 days 00:00:02.858571,Tanh,Tanh,Sigmoid,,82,16,12.0,12.0,,9.673856517722806e-05,3,391,0.7435958418163557,0.04322398303765754,864.3167890001844,COMPLETE
1556,0.6599717140197754,2023-09-04 21:36:31.892009,2023-09-04 21:36:35.728352,0 days 00:00:03.836343,Tanh,ReLU,,,84,10,11.0,,,2.3486360922768812e-05,2,308,0.7647660377053309,1.8204696891384413e-05,267.53394926987687,COMPLETE
1557,0.35765695571899414,2023-09-04 21:36:35.728815,2023-09-04 21:36:37.038649,0 days 00:00:01.309834,Leaky,Tanh,,,59,17,24.0,,,0.0022974471870781214,2,275,0.7258344150993072,0.00025271054525254213,204.79717867715019,COMPLETE
1558,0.4320017695426941,2023-09-04 21:36:37.039134,2023-09-04 21:36:40.353177,0 days 00:00:03.314043,Tanh,ReLU,,,75,17,19.0,,,0.00011713160793305749,2,263,0.6165289132885773,0.00016053386729198563,274.02186210255206,COMPLETE
1559,0.38138237595558167,2023-09-04 21:36:40.353661,2023-09-04 21:36:44.695586,0 days 00:00:04.341925,ReLU,Leaky,Tanh,ReLU,54,18,9.0,11.0,21.0,0.00013301276320857596,4,243,0.48751313186178136,0.0004899247444521058,166.71043399135763,COMPLETE
1560,0.4037480354309082,2023-09-04 21:36:44.696583,2023-09-04 21:36:46.188219,0 days 00:00:01.491636,Tanh,Sigmoid,,,79,19,22.0,,,0.004679707436270745,2,297,0.42362921898492795,5.739758800907389e-05,127.35451953913889,COMPLETE
1561,0.5696613788604736,2023-09-04 21:36:46.188852,2023-09-04 21:36:46.573006,0 days 00:00:00.384154,Tanh,Tanh,Sigmoid,,87,19,23.0,16.0,,0.05440615185595062,3,286,0.5466243688960594,0.03332577840486362,232.63529332478842,COMPLETE
1562,0.32706311345100403,2023-09-04 21:36:46.573649,2023-09-04 21:36:47.033323,0 days 00:00:00.459674,Leaky,ReLU,,,82,17,9.0,,,0.010425702326420538,2,326,0.7740412222875693,8.442458519388814e-05,166.29715670072116,COMPLETE
1563,0.340989351272583,2023-09-04 21:36:47.033928,2023-09-04 21:36:47.564756,0 days 00:00:00.530828,Tanh,Tanh,,,77,18,17.0,,,0.034716039518661285,2,276,0.7029477634333674,0.0001324057456611985,206.4987762451172,COMPLETE
1564,0.31471914052963257,2023-09-04 21:36:47.565381,2023-09-04 21:36:48.402556,0 days 00:00:00.837175,Tanh,Sigmoid,,,80,20,11.0,,,0.0071098938022289525,2,254,0.658460236446555,0.0011013890710672718,135.9968002483409,COMPLETE
1565,0.4414269030094147,2023-09-04 21:36:48.403022,2023-09-04 21:36:48.699124,0 days 00:00:00.296102,Tanh,ReLU,,,84,18,13.0,,,0.020562473233513092,2,339,0.22130360373649827,0.00018501826306424783,128.7904937301857,COMPLETE
1566,0.35619625449180603,2023-09-04 21:36:48.699690,2023-09-04 21:36:49.212205,0 days 00:00:00.512515,Leaky,,,,74,17,,,,0.014172759665732742,1,306,0.7464372912425713,0.00010902807796474867,196.07998014751234,COMPLETE
1567,0.3541259169578552,2023-09-04 21:36:49.212817,2023-09-04 21:36:49.432420,0 days 00:00:00.219603,Tanh,Tanh,,,76,16,10.0,,,0.0414725667596853,2,293,0.16924023205375613,0.0030371286882510925,141.8348129272461,COMPLETE
1568,0.28494834899902344,2023-09-04 21:36:49.432912,2023-09-04 21:36:49.951191,0 days 00:00:00.518279,ReLU,ReLU,Leaky,,79,19,18.0,6.0,,0.025412670714727158,3,267,0.7989734877239664,0.00014737983950514783,199.92990903501158,COMPLETE
1569,0.38196811079978943,2023-09-04 21:36:49.952134,2023-09-04 21:36:50.358315,0 days 00:00:00.406181,Tanh,Tanh,,,86,18,24.0,,,0.017330170360887638,2,317,0.3535708065594417,0.007982034257759995,805.8998239305284,COMPLETE
1570,0.3583638072013855,2023-09-04 21:36:50.358792,2023-09-04 21:36:50.689336,0 days 00:00:00.330544,Tanh,Leaky,,,83,17,23.0,,,0.032645632734695965,2,104,0.5888845515996028,7.100924700372089e-05,310.4670607622932,COMPLETE
1571,0.5093600749969482,2023-09-04 21:36:50.689810,2023-09-04 21:36:53.830485,0 days 00:00:03.140675,Leaky,Sigmoid,,,81,18,20.0,,,7.595719202483209e-05,2,280,0.7227383846677252,9.891575686645049e-05,1017.2008217947823,COMPLETE
1572,0.7316165566444397,2023-09-04 21:36:53.831366,2023-09-04 21:36:55.708394,0 days 00:00:01.877028,Tanh,Tanh,Sigmoid,,78,20,12.0,3.0,,8.843457719159233e-05,3,164,0.7741763165389415,1.8531016294997635e-05,215.94876787139148,COMPLETE
1573,0.38747113943099976,2023-09-04 21:36:55.708870,2023-09-04 21:36:57.168593,0 days 00:00:01.459723,Tanh,ReLU,,,89,18,10.0,,,0.001004139525608932,2,358,0.6851299304864752,0.0127902250463139,130.5521652802177,COMPLETE
1574,0.39331674575805664,2023-09-04 21:36:57.169056,2023-09-04 21:36:58.061859,0 days 00:00:00.892803,Tanh,Tanh,,,55,15,8.0,,,0.021535327861074868,2,120,0.7991577008877396,0.004371958260020936,186.75086931501116,COMPLETE
1575,0.35833901166915894,2023-09-04 21:36:58.062777,2023-09-04 21:36:58.396074,0 days 00:00:00.333297,Leaky,Sigmoid,,,51,19,9.0,,,0.011063365637104208,2,402,0.15051418371258002,0.00020992024057232229,203.00065373265465,COMPLETE
1576,0.36748334765434265,2023-09-04 21:36:58.396547,2023-09-04 21:36:59.138555,0 days 00:00:00.742008,Sigmoid,ReLU,,,80,17,21.0,,,0.018578125559430614,2,371,0.7543064744657834,0.00013015711674140766,182.43256732779489,COMPLETE
1577,0.28622201085090637,2023-09-04 21:36:59.139038,2023-09-04 21:37:00.906213,0 days 00:00:01.767175,Tanh,Tanh,Tanh,,75,16,11.0,10.0,,0.0015672827534014564,3,270,0.7210818953935341,0.0001620679685279552,224.26685874245385,COMPLETE
1578,0.3230210244655609,2023-09-04 21:37:00.906710,2023-09-04 21:37:01.348553,0 days 00:00:00.441843,ReLU,ReLU,,,77,18,11.0,,,0.029129181875751448,2,301,0.7451185244656171,0.0002479105732661235,231.42326395135177,COMPLETE
1579,0.5072744488716125,2023-09-04 21:37:01.349049,2023-09-04 21:37:01.747624,0 days 00:00:00.398575,Tanh,Leaky,,,85,17,10.0,,,0.0036866541935556647,2,286,0.10329030243307147,0.010526115841839611,264.27421439321415,COMPLETE
1580,0.3011417090892792,2023-09-04 21:37:01.748127,2023-09-04 21:37:02.507267,0 days 00:00:00.759140,Tanh,Sigmoid,,,62,19,22.0,,,0.009219289591916903,2,149,0.5433754790088182,0.00010228945894807005,513.7274445683123,COMPLETE
1581,0.34917986392974854,2023-09-04 21:37:02.507758,2023-09-04 21:37:02.868769,0 days 00:00:00.361011,Leaky,Tanh,ReLU,,82,17,24.0,14.0,,0.014403560488551239,3,173,0.2957093720656969,8.413387209329756e-05,175.43674788041548,COMPLETE
1582,0.3383815586566925,2023-09-04 21:37:02.869288,2023-09-04 21:37:03.349789,0 days 00:00:00.480501,Tanh,ReLU,,,73,18,9.0,,,0.06725593832499616,2,385,0.7996777249425121,0.0001918580621720496,132.66449677316766,COMPLETE
1583,0.25491946935653687,2023-09-04 21:37:03.350303,2023-09-04 21:37:03.758567,0 days 00:00:00.408264,Tanh,Tanh,,,94,13,23.0,,,0.04558790085572052,2,320,0.7663169100701658,1.1779016423598877e-05,637.3609734612543,COMPLETE
1584,0.4290597438812256,2023-09-04 21:37:03.759085,2023-09-04 21:37:03.983919,0 days 00:00:00.224834,Tanh,Tanh,,,91,13,22.0,,,0.0527495332280479,2,319,0.3023879957073162,7.86086926177367e-05,433.3380479812622,COMPLETE
1585,0.3113492727279663,2023-09-04 21:37:03.984426,2023-09-04 21:37:04.349119,0 days 00:00:00.364693,Leaky,Sigmoid,,,92,14,23.0,,,0.047411687303249864,2,316,0.4411145705164063,6.349259667318972e-05,155.96563002642463,COMPLETE
1586,0.4714049994945526,2023-09-04 21:37:04.349602,2023-09-04 21:37:04.497786,0 days 00:00:00.148184,Tanh,ReLU,,,96,13,23.0,,,0.048007407975639196,2,327,0.13876359369591354,2.7226263870914044e-05,322.6576186470364,COMPLETE
1587,0.4820778965950012,2023-09-04 21:37:04.498273,2023-09-04 21:37:05.062651,0 days 00:00:00.564378,ReLU,Tanh,Sigmoid,,94,11,23.0,5.0,,0.05584982723558649,3,338,0.6989770287978696,1.4480310897038816e-05,235.77185668945313,COMPLETE
1588,0.32977503538131714,2023-09-04 21:37:05.063185,2023-09-04 21:37:05.546048,0 days 00:00:00.482863,Tanh,Leaky,,,79,14,22.0,,,0.046092438267296885,2,320,0.6657707229820382,1.8940671726700825e-05,202.11770077969166,COMPLETE
1589,0.4047434329986572,2023-09-04 21:37:05.546544,2023-09-04 21:37:05.814384,0 days 00:00:00.267840,Tanh,ReLU,,,80,14,23.0,,,0.0627873524641698,2,332,0.3436787939637037,2.135849068343e-05,1050.338306323902,COMPLETE
1590,0.3697335124015808,2023-09-04 21:37:05.814885,2023-09-04 21:37:06.420778,0 days 00:00:00.605893,Leaky,Sigmoid,,,92,14,22.0,,,0.040524060271782694,2,315,0.7252067651496144,2.7369447887396765e-05,203.01526051647258,COMPLETE
1591,0.442701131105423,2023-09-04 21:37:06.421279,2023-09-04 21:37:06.623530,0 days 00:00:00.202251,Tanh,Tanh,,,95,13,23.0,,,0.04223292084555219,2,332,0.18830787836600105,1.2239785433556457e-05,143.24007568359374,COMPLETE
1592,0.3587563931941986,2023-09-04 21:37:06.624026,2023-09-04 21:37:06.884987,0 days 00:00:00.260961,Tanh,ReLU,,,96,14,23.0,,,0.038530381714751594,2,323,0.3815769982114001,1.3899630395613552e-05,119.59623696463449,COMPLETE
1593,0.5611303448677063,2023-09-04 21:37:06.885484,2023-09-04 21:37:07.050135,0 days 00:00:00.164651,Tanh,Tanh,Sigmoid,,97,12,23.0,15.0,,0.06120944363107558,3,310,0.115755621303112,3.7414592829338975e-05,218.9593107804008,COMPLETE
1594,0.4594891667366028,2023-09-04 21:37:07.050678,2023-09-04 21:37:07.228657,0 days 00:00:00.177979,Leaky,Sigmoid,,,100,14,24.0,,,0.034944397860539475,2,328,0.10658019920347586,1.2294750215158045e-05,169.72353503168847,COMPLETE
1595,0.3224028944969177,2023-09-04 21:37:07.229196,2023-09-04 21:37:07.522393,0 days 00:00:00.293197,Tanh,ReLU,,,97,12,22.0,,,0.08031800876988335,2,338,0.7693566218203435,1.512804780898008e-05,264.58993596616,COMPLETE
1596,0.3457200825214386,2023-09-04 21:37:07.522901,2023-09-04 21:37:07.996484,0 days 00:00:00.473583,ReLU,Tanh,,,99,15,23.0,,,0.03329660103335513,2,308,0.7495866876202921,2.5612133017889226e-05,166.91856417448625,COMPLETE
1597,0.335019052028656,2023-09-04 21:37:07.997010,2023-09-04 21:37:08.666049,0 days 00:00:00.669039,Tanh,Leaky,Sigmoid,,100,15,24.0,9.0,,0.05019497634098923,3,321,0.7016971266136479,3.1298704817987066e-05,654.3706302966102,COMPLETE
1598,0.6448160409927368,2023-09-04 21:37:08.666994,2023-09-04 21:37:11.764296,0 days 00:00:03.097302,Tanh,Tanh,,,97,20,23.0,,,6.424414437098166e-05,2,316,0.2845921136070378,0.0008714625918731256,216.53527455390255,COMPLETE
1599,0.4705343246459961,2023-09-04 21:37:11.765205,2023-09-04 21:37:13.738872,0 days 00:00:01.973667,Leaky,ReLU,,,90,21,22.0,,,0.00043524659195066695,2,316,0.2531885968933899,2.1997319994142786e-05,525.3707147987144,COMPLETE
1600,0.39932841062545776,2023-09-04 21:37:13.739794,2023-09-04 21:37:14.201393,0 days 00:00:00.461599,Tanh,Sigmoid,,,77,13,24.0,,,0.03637823223185157,2,348,0.17236937079982367,4.3396430754427125e-05,2754.0625523158483,COMPLETE
1601,0.3549663722515106,2023-09-04 21:37:14.202322,2023-09-04 21:37:14.849411,0 days 00:00:00.647089,Tanh,Tanh,,,81,12,23.0,,,0.029134219586955473,2,308,0.32441009222320716,4.9714061133429e-05,355.1581413455126,COMPLETE
1602,0.618434727191925,2023-09-04 21:37:14.850317,2023-09-04 21:37:19.173436,0 days 00:00:04.323119,Tanh,ReLU,,,98,11,23.0,,,2.7713397682959687e-05,2,327,0.4106572709967461,4.435533423754601e-05,119.03611918691466,COMPLETE
1603,0.464038610458374,2023-09-04 21:37:19.174370,2023-09-04 21:37:19.886913,0 days 00:00:00.712543,Sigmoid,Tanh,Tanh,,96,13,24.0,8.0,,0.09559262054661223,3,309,0.26281765150972325,2.7245030710966753e-05,305.6419476729173,COMPLETE
1604,0.37634479999542236,2023-09-04 21:37:19.887845,2023-09-04 21:37:27.533154,0 days 00:00:07.645309,Tanh,Sigmoid,,,78,19,21.0,,,0.0011863790199118428,2,300,0.7495460472373139,2.1117993442134618e-05,184.0382143910726,COMPLETE
1605,0.32787299156188965,2023-09-04 21:37:27.534098,2023-09-04 21:37:28.606311,0 days 00:00:01.072213,Leaky,ReLU,,,92,15,24.0,,,0.02760034169830525,2,335,0.629685230416096,1.7432600221510916e-05,159.80562458867612,COMPLETE
1606,0.4975714385509491,2023-09-04 21:37:28.607242,2023-09-04 21:37:29.432596,0 days 00:00:00.825354,ReLU,Tanh,Leaky,,94,15,22.0,2.0,,0.03678027476199783,3,324,0.5611601829663101,2.4473071944321195e-05,211.34471099853516,COMPLETE
1607,0.3737594485282898,2023-09-04 21:37:29.433566,2023-09-04 21:37:29.919002,0 days 00:00:00.485436,Tanh,Leaky,,,100,19,23.0,,,0.040718751065989774,2,301,0.2559242295787935,1.0258415803062092e-05,192.4866149902344,COMPLETE
1608,0.2517865002155304,2023-09-04 21:37:29.919916,2023-09-04 21:37:32.234555,0 days 00:00:02.314639,Tanh,ReLU,,,92,13,24.0,,,0.005008142028154618,2,310,0.7684711200004715,1.2220095265361705e-05,178.2628183888865,COMPLETE
1609,0.377673864364624,2023-09-04 21:37:32.235463,2023-09-04 21:37:32.799252,0 days 00:00:00.563789,Tanh,Tanh,,,97,13,24.0,,,0.009838076962315732,2,310,0.20418379220573912,1.425299543592904e-05,202.2423737137406,COMPLETE
1610,0.3269716203212738,2023-09-04 21:37:32.800157,2023-09-04 21:37:34.537797,0 days 00:00:01.737640,Leaky,Sigmoid,,,94,13,24.0,,,0.00983105392105042,2,319,0.799324512845173,1.2669675570395883e-05,330.14663766714244,COMPLETE
1611,0.40978577733039856,2023-09-04 21:37:34.538701,2023-09-04 21:37:35.221856,0 days 00:00:00.683155,Tanh,ReLU,,,92,11,24.0,,,0.004600481441404753,2,326,0.15995933615272634,3.32025507084812e-05,209.3633258526142,COMPLETE
1612,0.30435073375701904,2023-09-04 21:37:35.222751,2023-09-04 21:37:36.973044,0 days 00:00:01.750293,Tanh,Tanh,Sigmoid,,94,13,24.0,13.0,,0.008410820524145025,3,315,0.7246988173732092,1.3993416706563147e-05,248.51290193151254,COMPLETE
1613,0.28405997157096863,2023-09-04 21:37:36.973968,2023-09-04 21:37:38.091129,0 days 00:00:01.117161,Tanh,ReLU,,,89,12,24.0,,,0.008280899898009519,2,305,0.6715735151409286,1.822875528653132e-05,196.71657250144264,COMPLETE
1614,0.43020597100257874,2023-09-04 21:37:38.092043,2023-09-04 21:37:38.918131,0 days 00:00:00.826088,ReLU,Sigmoid,,,94,13,24.0,,,0.06836224607932027,2,308,0.453326070809703,1.3224334191749385e-05,189.67699211968315,COMPLETE
1615,0.29330554604530334,2023-09-04 21:37:38.919056,2023-09-04 21:37:40.910648,0 days 00:00:01.991592,Leaky,Tanh,,,96,12,24.0,,,0.004213966030883279,2,320,0.7703347925145212,1.542609037876349e-05,188.8587646484375,COMPLETE
1616,0.3459528088569641,2023-09-04 21:37:40.911588,2023-09-04 21:37:43.039389,0 days 00:00:02.127801,Tanh,ReLU,,,95,13,24.0,,,0.004606615674733826,2,341,0.7265930570576117,3.949177940883623e-05,177.4145253499349,COMPLETE
1617,0.2881329357624054,2023-09-04 21:37:43.040312,2023-09-04 21:37:45.197832,0 days 00:00:02.157520,Tanh,Leaky,,,91,15,12.0,,,0.0012933896125818453,2,300,0.7732354698137941,1.2177149839941626e-05,187.0452523004441,COMPLETE
1618,0.3231542706489563,2023-09-04 21:37:45.198740,2023-09-04 21:37:47.032778,0 days 00:00:01.834038,Tanh,Tanh,ReLU,,91,12,24.0,7.0,,0.002718091993459232,3,306,0.7998891018320968,1.7934642861694286e-05,137.39353968999157,COMPLETE
1619,0.6197127103805542,2023-09-04 21:37:47.033263,2023-09-04 21:37:48.722693,0 days 00:00:01.689430,Leaky,Sigmoid,,,99,12,24.0,,,8.832414476461058e-05,2,331,0.42509342506437053,1.2786171058787077e-05,162.91308526906363,COMPLETE
1620,0.42855727672576904,2023-09-04 21:37:48.723243,2023-09-04 21:37:48.950536,0 days 00:00:00.227293,Tanh,Tanh,,,92,13,11.0,,,0.0076451145811964275,2,321,0.14053956874265416,6.030725438241026e-05,141.83811744811044,COMPLETE
1621,0.3176555335521698,2023-09-04 21:37:48.951082,2023-09-04 21:37:49.579018,0 days 00:00:00.627936,Tanh,ReLU,,,98,14,24.0,,,0.008418974217229825,2,311,0.6884353085334869,2.257481490755431e-05,873.6510602678571,COMPLETE
1622,0.3166626989841461,2023-09-04 21:37:49.579613,2023-09-04 21:37:50.807065,0 days 00:00:01.227452,Tanh,Tanh,Sigmoid,,95,13,24.0,11.0,,0.005675760706367455,3,300,0.7446344514176795,1.6441900616006513e-05,170.0063992516469,COMPLETE
1623,0.43004074692726135,2023-09-04 21:37:50.807567,2023-09-04 21:37:51.079157,0 days 00:00:00.271590,ReLU,ReLU,,,92,14,24.0,,,0.005082041981167973,2,297,0.19558477925867424,1.9754529626739798e-05,135.00079574584962,COMPLETE
1624,0.37134984135627747,2023-09-04 21:37:51.079688,2023-09-04 21:37:52.495295,0 days 00:00:01.415607,Tanh,,,,93,20,,,,0.0025757342326001,1,309,0.7085836207344633,3.845985629690338e-05,158.72573093636325,COMPLETE
1625,0.5302870273590088,2023-09-04 21:37:52.495839,2023-09-04 21:37:52.761869,0 days 00:00:00.266030,Leaky,Sigmoid,,,94,14,24.0,,,0.002921306863084154,2,315,0.13222007340152564,1.11361932546727e-05,154.23815536499023,COMPLETE
1626,0.32457879185676575,2023-09-04 21:37:52.762437,2023-09-04 21:37:53.435167,0 days 00:00:00.672730,Tanh,Tanh,,,92,12,3.0,,,0.011623729321424843,2,331,0.7704948431321954,2.9704924894728627e-05,179.00274057099313,COMPLETE
1627,0.3756088614463806,2023-09-04 21:37:53.435680,2023-09-04 21:37:54.561571,0 days 00:00:01.125891,Sigmoid,Leaky,,,89,13,11.0,,,0.006488684021405912,2,324,0.7439970304950589,1.5718041908073567e-05,135.77711424280386,COMPLETE
1628,0.8129409551620483,2023-09-04 21:37:54.562218,2023-09-04 21:37:55.653680,0 days 00:00:01.091462,Tanh,ReLU,Tanh,,98,14,13.0,12.0,,1.6170853660481922e-05,3,300,0.23117541053094193,4.499858611421564e-05,101.54969698588053,COMPLETE
1629,0.37337589263916016,2023-09-04 21:37:55.654306,2023-09-04 21:37:56.313633,0 days 00:00:00.659327,Tanh,Tanh,,,95,13,10.0,,,0.005783345140535338,2,344,0.3090287927443155,1.379900985585592e-05,287.1659476261011,COMPLETE
1630,0.812905490398407,2023-09-04 21:37:56.314279,2023-09-04 21:37:56.469768,0 days 00:00:00.155489,Leaky,Sigmoid,Sigmoid,Tanh,92,13,24.0,6.0,18.0,0.000304055155714771,4,296,0.12090257732630136,1.0898347470905631e-05,106.2738765369762,COMPLETE
1631,0.5182293653488159,2023-09-04 21:37:56.470355,2023-09-04 21:37:57.052176,0 days 00:00:00.581821,Tanh,ReLU,,,95,20,12.0,,,0.005956336206070646,2,113,0.24031941256432868,2.1988948977319276e-05,131.72037680489677,COMPLETE
1632,0.3458559811115265,2023-09-04 21:37:57.053094,2023-09-04 21:37:58.351686,0 days 00:00:01.298592,Tanh,Tanh,,,90,13,10.0,,,0.0023414052281069252,2,133,0.6504974734485025,3.3112751114779075e-05,139.8610100423483,COMPLETE
1633,0.4452657103538513,2023-09-04 21:37:58.352178,2023-09-04 21:37:58.628962,0 days 00:00:00.276784,ReLU,ReLU,,,86,12,24.0,,,0.0033598777526020617,2,309,0.15097727516749684,1.1359484171013346e-05,279.0557535643219,COMPLETE
1634,0.40096110105514526,2023-09-04 21:37:58.629470,2023-09-04 21:37:59.751528,0 days 00:00:01.122058,Tanh,Tanh,Sigmoid,,95,13,12.0,10.0,,0.000822944542315666,3,314,0.2410388699755517,1.6283501201819806e-05,141.03671757886363,COMPLETE
1635,0.4750669598579407,2023-09-04 21:37:59.752043,2023-09-04 21:38:00.101406,0 days 00:00:00.349363,Leaky,Sigmoid,,,94,12,11.0,,,0.006557272782163069,2,292,0.18267553483241628,1.6967855905997897e-05,192.9736228942871,COMPLETE
1636,0.4595843255519867,2023-09-04 21:38:00.101920,2023-09-04 21:38:00.724823,0 days 00:00:00.622903,Tanh,Leaky,,,90,15,23.0,,,0.0006947632922400123,2,321,0.21568626031516241,1.0449980525595762e-05,262.14954597591736,COMPLETE
1637,0.33725059032440186,2023-09-04 21:38:00.725308,2023-09-04 21:38:01.152150,0 days 00:00:00.426842,Tanh,Tanh,,,94,14,10.0,,,0.006755996936564555,2,298,0.5095513851332254,6.209471750648673e-05,333.44907633463544,COMPLETE
1638,0.3521546721458435,2023-09-04 21:38:01.152639,2023-09-04 21:38:01.815036,0 days 00:00:00.662397,Tanh,ReLU,,,91,14,10.0,,,0.005068314430032187,2,303,0.7102203296616381,2.6711476715228076e-05,119.78412445068359,COMPLETE
1639,0.3933986723423004,2023-09-04 21:38:01.815548,2023-09-04 21:38:02.289203,0 days 00:00:00.473655,Leaky,Sigmoid,,,93,15,23.0,,,0.005595443963762813,2,91,0.3759544903678491,1.5806850668014234e-05,261.85511461195057,COMPLETE
