number,value,datetime_start,datetime_complete,duration,params_activation1,params_activation2,params_activation3,params_activation4,params_batch_size,params_fl1,params_fl2,params_fl3,params_fl4,params_learning_rate,params_n_layers,params_num_epochs,params_train_size,params_weight_decay,user_attrs_mre,state
1576,0.2958659529685974,2023-09-04 22:52:27.130546,2023-09-04 22:52:28.323316,0 days 00:00:01.192770,Tanh,ReLU,Tanh,,24,18,10.0,14.0,,0.010083423437483953,3,264,0.7999570147291637,0.009836373063160188,92.90634862388053,COMPLETE
1577,0.9207910895347595,2023-09-04 22:52:28.323832,2023-09-04 22:52:28.530138,0 days 00:00:00.206306,Sigmoid,ReLU,Sigmoid,,35,19,10.0,15.0,,0.00015430090843217474,3,248,0.14423123014037678,0.06518907003839215,103.53970718383789,COMPLETE
1578,0.36007755994796753,2023-09-04 22:52:28.530618,2023-09-04 22:52:29.014461,0 days 00:00:00.483843,ReLU,ReLU,ReLU,,65,18,10.0,15.0,,0.0045306748451718806,3,232,0.27160235304034075,0.007708431087239455,181.4595782433027,COMPLETE
1579,0.3041071891784668,2023-09-04 22:52:29.014952,2023-09-04 22:52:30.501750,0 days 00:00:01.486798,Leaky,ReLU,Tanh,,22,20,11.0,16.0,,0.00576059384263081,3,254,0.7227625139500119,3.6224658049810264e-05,102.84491258101029,COMPLETE
1580,0.3030243217945099,2023-09-04 22:52:30.502232,2023-09-04 22:52:31.435452,0 days 00:00:00.933220,Tanh,ReLU,Leaky,,32,17,8.0,14.0,,0.008338375255766126,3,226,0.7536879643167869,4.264564073512111e-05,78.6936633087868,COMPLETE
1581,0.4000413715839386,2023-09-04 22:52:31.436016,2023-09-04 22:52:31.746247,0 days 00:00:00.310231,ReLU,ReLU,ReLU,,30,20,12.0,15.0,,0.024071916875723215,3,244,0.1245591086968565,5.4189829379370506e-05,216.7258059593939,COMPLETE
1582,0.330157995223999,2023-09-04 22:52:31.746739,2023-09-04 22:52:32.705324,0 days 00:00:00.958585,Tanh,ReLU,Tanh,,26,19,11.0,13.0,,0.011804290940435041,3,262,0.6510360525945473,2.2697366488788552e-05,105.75119355667469,COMPLETE
1583,0.37581026554107666,2023-09-04 22:52:32.705832,2023-09-04 22:52:33.073693,0 days 00:00:00.367861,ReLU,ReLU,ReLU,,20,19,9.0,12.0,,0.0033418389179977717,3,237,0.23010003794080122,1.6714277403073273e-05,250.58059481916757,COMPLETE
1584,1.0220201015472412,2023-09-04 22:52:33.074192,2023-09-04 22:52:33.501437,0 days 00:00:00.427245,Tanh,ReLU,Sigmoid,,24,20,8.0,16.0,,0.0005032705712287046,3,251,0.6920632680096173,0.06970698431774472,99.72540174211774,COMPLETE
1585,0.37174442410469055,2023-09-04 22:52:33.502001,2023-09-04 22:52:33.992231,0 days 00:00:00.490230,ReLU,ReLU,Tanh,,34,20,9.0,15.0,,0.0068432822027589815,3,110,0.7692111220039196,1.0263985290280357e-05,115.5410758972168,COMPLETE
1586,0.34674206376075745,2023-09-04 22:52:33.992720,2023-09-04 22:52:34.872749,0 days 00:00:00.880029,Leaky,ReLU,ReLU,,29,20,9.0,14.0,,0.004357159818274982,3,269,0.5754628914148007,0.00012564968917991109,98.63998444875081,COMPLETE
1587,0.2799592614173889,2023-09-04 22:52:34.873247,2023-09-04 22:52:35.725289,0 days 00:00:00.852042,Tanh,ReLU,Leaky,,23,10,10.0,16.0,,0.002714248020332215,3,212,0.7218549178365317,1.2458491063493288e-05,115.6309329617408,COMPLETE
1588,0.33075815439224243,2023-09-04 22:52:35.725777,2023-09-04 22:52:36.232943,0 days 00:00:00.507166,ReLU,ReLU,Tanh,,40,20,12.0,16.0,,0.009290313291859672,3,226,0.7679219616290304,3.156499453615005e-05,98.8876543045044,COMPLETE
1589,0.3309132754802704,2023-09-04 22:52:36.233430,2023-09-04 22:52:36.746163,0 days 00:00:00.512733,Tanh,Leaky,ReLU,,26,19,11.0,15.0,,0.041987709503894,3,247,0.39403294427030416,1.9086092171030397e-05,105.83194617069128,COMPLETE
1590,0.4348689913749695,2023-09-04 22:52:36.746661,2023-09-04 22:52:39.759766,0 days 00:00:03.013105,ReLU,ReLU,Tanh,,31,19,14.0,16.0,,1.6888871585023204e-05,3,238,0.4598820888558925,6.974518922719146e-05,114.55128677752839,COMPLETE
1591,0.3403509259223938,2023-09-04 22:52:39.760262,2023-09-04 22:52:41.523267,0 days 00:00:01.763005,Sigmoid,ReLU,,,21,21,11.0,,,0.005295792382447067,2,257,0.7392486949235905,0.00015324369602251492,102.70014726793444,COMPLETE
1592,0.40315353870391846,2023-09-04 22:52:41.523763,2023-09-04 22:52:42.957688,0 days 00:00:01.433925,Tanh,ReLU,ReLU,,18,18,12.0,15.0,,0.020452112325666287,3,272,0.6991185717905369,0.011495372256519703,100.36996542889139,COMPLETE
1593,0.4457518756389618,2023-09-04 22:52:42.958177,2023-09-04 22:52:43.211274,0 days 00:00:00.253097,Leaky,ReLU,Sigmoid,,38,21,13.0,16.0,,0.010590651007862316,3,243,0.12276979238893439,2.6499282850418765e-05,19524.43440551758,COMPLETE
1594,0.4278687536716461,2023-09-04 22:52:43.211791,2023-09-04 22:52:43.517074,0 days 00:00:00.305283,ReLU,ReLU,Leaky,,29,20,15.0,15.0,,0.0022356358417943024,3,232,0.10285541327014087,1.453442761499101e-05,125.82617174345872,COMPLETE
1595,0.3475690186023712,2023-09-04 22:52:43.517640,2023-09-04 22:52:48.669683,0 days 00:00:05.152043,ReLU,ReLU,,,25,20,14.0,,,8.794553884883125e-05,2,255,0.7718594857694842,0.00029523795048456953,109.20304703057981,COMPLETE
1596,0.3397614359855652,2023-09-04 22:52:48.670175,2023-09-04 22:52:49.030877,0 days 00:00:00.360702,Tanh,,,,36,21,,,,0.007838365419935838,1,264,0.5173377570019176,2.236589882980167e-05,96.30829328649185,COMPLETE
1597,0.35706886649131775,2023-09-04 22:52:49.031360,2023-09-04 22:52:50.899819,0 days 00:00:01.868459,ReLU,ReLU,Tanh,,33,19,10.0,16.0,,0.00031277571385077694,3,223,0.4274753127128533,0.0035852169843057905,276.1318060752073,COMPLETE
1598,0.38960006833076477,2023-09-04 22:52:50.900311,2023-09-04 22:52:51.416209,0 days 00:00:00.515898,Tanh,ReLU,ReLU,,46,22,9.0,14.0,,0.01367122193349411,3,247,0.16984776991486805,4.1084200281611034e-05,579.8756757463727,COMPLETE
1599,0.3497926592826843,2023-09-04 22:52:51.417171,2023-09-04 22:52:53.024473,0 days 00:00:01.607302,ReLU,ReLU,Sigmoid,,23,18,12.0,17.0,,0.006312734940656685,3,237,0.4873808287927268,1.796174855655462e-05,103.17422400580512,COMPLETE
1600,0.34019365906715393,2023-09-04 22:52:53.025007,2023-09-04 22:52:56.337506,0 days 00:00:03.312499,Leaky,ReLU,ReLU,,27,20,15.0,13.0,,0.00045015354310303093,3,254,0.6681106060526455,0.0004085064098436904,112.1116615617779,COMPLETE
1601,0.3301739990711212,2023-09-04 22:52:56.338033,2023-09-04 22:52:59.273023,0 days 00:00:02.934990,Tanh,Sigmoid,Tanh,,19,21,13.0,16.0,,0.0015749172209124336,3,266,0.7314156715606949,8.722890846954326e-05,109.50600589051538,COMPLETE
1602,0.36239954829216003,2023-09-04 22:52:59.273545,2023-09-04 22:52:59.771378,0 days 00:00:00.497833,ReLU,ReLU,Leaky,,31,17,15.0,15.0,,0.030485280566768712,3,241,0.2777521513002562,0.0002399489673745255,106.3184871673584,COMPLETE
1603,0.2860666513442993,2023-09-04 22:52:59.772332,2023-09-04 22:53:04.373881,0 days 00:00:04.601549,Tanh,Leaky,ReLU,,28,19,7.0,16.0,,0.0009429071562543471,3,274,0.7709556550010351,3.311277260861732e-05,104.57757908282893,COMPLETE
1604,0.7608968615531921,2023-09-04 22:53:04.374373,2023-09-04 22:53:07.940027,0 days 00:00:03.565654,Sigmoid,ReLU,Tanh,,41,22,8.0,14.0,,1.3374182959908672e-05,3,206,0.7994896675944331,0.00011163279881414976,100.01990079416812,COMPLETE
1605,0.38093990087509155,2023-09-04 22:53:07.940509,2023-09-04 22:53:08.334136,0 days 00:00:00.393627,ReLU,ReLU,ReLU,,21,20,11.0,17.0,,0.001116758777309243,3,220,0.2124382188355041,1.3177353931738807e-05,114.55382472446986,COMPLETE
1606,0.35702723264694214,2023-09-04 22:53:08.334651,2023-09-04 22:53:08.723418,0 days 00:00:00.388767,Tanh,ReLU,,,25,15,14.0,,,0.08500241594338205,2,250,0.7451106492816298,2.534033057099521e-05,125.36993764241537,COMPLETE
1607,0.3688638210296631,2023-09-04 22:53:08.723913,2023-09-04 22:53:08.937520,0 days 00:00:00.213607,Leaky,ReLU,Tanh,,34,21,16.0,15.0,,0.0038475875048174335,3,230,0.10065436310281968,5.184912496286082e-05,506.1068623860677,COMPLETE
1608,0.3887052834033966,2023-09-04 22:53:08.938019,2023-09-04 22:53:09.475214,0 days 00:00:00.537195,ReLU,ReLU,Sigmoid,,30,22,13.0,21.0,,0.05888256093067459,3,258,0.7130406419467563,0.01592485288011592,118.38425168124112,COMPLETE
1609,0.29343804717063904,2023-09-04 22:53:09.475736,2023-09-04 22:53:10.516003,0 days 00:00:01.040267,Tanh,ReLU,ReLU,,27,21,9.0,16.0,,0.005333992339294634,3,244,0.799474055087174,7.855206197854812e-05,92.28567600250244,COMPLETE
1610,0.305738627910614,2023-09-04 22:53:10.516478,2023-09-04 22:53:11.378540,0 days 00:00:00.862062,ReLU,ReLU,Leaky,,22,22,11.0,16.0,,0.010138742796398767,3,237,0.7512820128239549,2.1746999504641397e-05,93.04971900353065,COMPLETE
1611,0.33518728613853455,2023-09-04 22:53:11.379047,2023-09-04 22:53:11.664090,0 days 00:00:00.285043,Tanh,,,,24,20,,,,0.01687848960356402,1,262,0.31943574848131534,0.0001876278546639396,151.48323032773774,COMPLETE
1612,0.347381055355072,2023-09-04 22:53:11.664576,2023-09-04 22:53:11.923122,0 days 00:00:00.258546,ReLU,ReLU,Tanh,,32,20,10.0,17.0,,0.007619899187388829,3,251,0.20772567836070072,1.6788114148094744e-05,314.18107986450195,COMPLETE
1613,0.3710721433162689,2023-09-04 22:53:11.923630,2023-09-04 22:53:12.517405,0 days 00:00:00.593775,Tanh,ReLU,ReLU,,36,6,15.0,15.0,,0.003003353869674621,3,234,0.4046638834731275,2.9494561277009495e-05,169.10399139404296,COMPLETE
1614,0.4833018481731415,2023-09-04 22:53:12.517916,2023-09-04 22:53:14.943636,0 days 00:00:02.425720,Leaky,Leaky,Tanh,,20,19,16.0,8.0,,2.5470182882958196e-05,3,246,0.24649231870523247,1.0122280385431443e-05,143.99228640300473,COMPLETE
1615,0.3457326292991638,2023-09-04 22:53:14.944140,2023-09-04 22:53:15.385133,0 days 00:00:00.440993,ReLU,ReLU,Sigmoid,,28,21,12.0,16.0,,0.004592928765901336,3,218,0.31409960752159977,2.0085097312855797e-05,118.41379874093192,COMPLETE
1616,0.31931072473526,2023-09-04 22:53:15.385641,2023-09-04 22:53:15.997376,0 days 00:00:00.611735,Tanh,ReLU,,,18,22,14.0,,,0.026085808377665918,2,276,0.681022616224848,0.00014284828090352478,154.69008775190875,COMPLETE
1617,0.4839841425418854,2023-09-04 22:53:15.997859,2023-09-04 22:53:17.356086,0 days 00:00:01.358227,ReLU,ReLU,ReLU,,26,21,16.0,17.0,,4.5182511547472644e-05,3,258,0.151397060034992,0.00035694591756840044,104.49775048189385,COMPLETE
1618,0.36076995730400085,2023-09-04 22:53:17.356570,2023-09-04 22:53:18.604118,0 days 00:00:01.247548,Tanh,ReLU,Tanh,,55,19,15.0,18.0,,0.0007056113822681424,3,228,0.6380335973636059,6.360796627022748e-05,102.12805946056659,COMPLETE
1619,0.4751865267753601,2023-09-04 22:53:18.604605,2023-09-04 22:53:20.382930,0 days 00:00:01.778325,Sigmoid,ReLU,Leaky,,30,20,12.0,16.0,,5.791601550763607e-05,3,242,0.2358449031284698,4.1060127142272516e-05,113.87843146205934,COMPLETE
1620,0.32807719707489014,2023-09-04 22:53:20.383418,2023-09-04 22:53:20.984733,0 days 00:00:00.601315,ReLU,ReLU,ReLU,,44,22,13.0,14.0,,0.011944457269542096,3,266,0.5846998771521564,1.438219569792949e-05,108.3515636920929,COMPLETE
1621,0.3358553647994995,2023-09-04 22:53:20.985492,2023-09-04 22:53:27.559857,0 days 00:00:06.574365,Leaky,ReLU,Tanh,,23,21,10.0,17.0,,0.00020792571472531628,3,253,0.769582341277173,3.282350123379784e-05,102.1639443982032,COMPLETE
1622,0.3230479657649994,2023-09-04 22:53:27.560358,2023-09-04 22:53:28.057589,0 days 00:00:00.497231,Tanh,,,,34,22,,,,0.006632035165369195,1,233,0.716729503179043,2.565278264604165e-05,89.62990188598633,COMPLETE
1623,0.2940225601196289,2023-09-04 22:53:28.058076,2023-09-04 22:53:28.752137,0 days 00:00:00.694061,ReLU,ReLU,ReLU,,38,19,11.0,20.0,,0.009042838505880018,3,247,0.7502697341848067,9.656203428115261e-05,97.27769425336052,COMPLETE
1624,0.31488704681396484,2023-09-04 22:53:28.752714,2023-09-04 22:53:29.506278,0 days 00:00:00.753564,Tanh,Sigmoid,Sigmoid,,25,20,14.0,22.0,,0.01427709267459252,3,272,0.48456500692150944,0.00025659617199281836,115.8205135345459,COMPLETE
1625,0.2957145869731903,2023-09-04 22:53:29.506784,2023-09-04 22:53:30.456341,0 days 00:00:00.949557,ReLU,Leaky,,,21,21,14.0,,,0.0034640982044655366,2,258,0.7746467476555096,0.00016981887907283128,117.3146292368571,COMPLETE
1626,0.3947329819202423,2023-09-04 22:53:30.456852,2023-09-04 22:53:30.871557,0 days 00:00:00.414705,ReLU,ReLU,Tanh,,33,18,8.0,15.0,,0.002409827922654397,3,224,0.30067631316743865,1.2062722474679114e-05,104.99142971554318,COMPLETE
1627,0.3126668632030487,2023-09-04 22:53:30.872117,2023-09-04 22:53:31.693964,0 days 00:00:00.821847,Tanh,ReLU,ReLU,,28,22,15.0,15.0,,0.04764390384774347,3,241,0.6990711199061603,1.71442268299033e-05,107.74635684105658,COMPLETE
1628,0.3049955666065216,2023-09-04 22:53:31.694529,2023-09-04 22:53:32.712594,0 days 00:00:01.018065,Leaky,ReLU,Leaky,,61,21,16.0,22.0,,0.005773159417540267,3,249,0.7419506519828459,0.0003141569415832541,114.06361018000422,COMPLETE
1629,0.3947158455848694,2023-09-04 22:53:32.713108,2023-09-04 22:53:35.844598,0 days 00:00:03.131490,ReLU,ReLU,Tanh,,31,20,15.0,16.0,,0.00014472573138202616,3,213,0.4524089981985581,0.0025964427940165587,135.83019661343712,COMPLETE
1630,0.3691936731338501,2023-09-04 22:53:35.845086,2023-09-04 22:53:36.740285,0 days 00:00:00.895199,Tanh,ReLU,ReLU,Leaky,26,19,10.0,17.0,18.0,0.00789241251500162,4,234,0.7779167537977254,0.020146618810616815,101.85886710030692,COMPLETE
1631,0.37157121300697327,2023-09-04 22:53:36.740778,2023-09-04 22:53:37.043572,0 days 00:00:00.302794,ReLU,ReLU,Sigmoid,,35,22,12.0,13.0,,0.01110879384863799,3,262,0.19731910692704802,4.3689185451289966e-05,216.48159705268012,COMPLETE
1632,0.3351345360279083,2023-09-04 22:53:37.044076,2023-09-04 22:53:38.656834,0 days 00:00:01.612758,Tanh,ReLU,ReLU,ReLU,23,20,6.0,19.0,14.0,0.020541164561963778,4,252,0.7229698613485424,2.3278475710403757e-05,111.47247340761382,COMPLETE
1633,0.30729901790618896,2023-09-04 22:53:38.657356,2023-09-04 22:53:40.675483,0 days 00:00:02.018127,Sigmoid,ReLU,Tanh,,30,22,23.0,18.0,,0.004793895870270342,3,124,0.7739423713098433,3.6245286775209526e-05,113.19554227358336,COMPLETE
1634,0.31072670221328735,2023-09-04 22:53:40.676015,2023-09-04 22:53:42.728170,0 days 00:00:02.052155,ReLU,ReLU,Leaky,Leaky,20,21,13.0,24.0,16.0,0.0038374118664257243,4,267,0.672375604460577,0.00013151034914107957,119.02425760122446,COMPLETE
1635,0.31331393122673035,2023-09-04 22:53:42.728691,2023-09-04 22:53:45.865049,0 days 00:00:03.136358,Leaky,ReLU,ReLU,Leaky,18,20,11.0,8.0,5.0,0.0020581454089226093,4,239,0.7489206998875677,2.8052937478669792e-05,84.03960831586052,COMPLETE
1636,0.36818018555641174,2023-09-04 22:53:45.865565,2023-09-04 22:53:46.122201,0 days 00:00:00.256636,Tanh,Leaky,Tanh,,25,19,16.0,14.0,,0.034963643876902706,3,225,0.1046789051676304,5.368065869665494e-05,174.3464101155599,COMPLETE
1637,0.3234070837497711,2023-09-04 22:53:46.122699,2023-09-04 22:53:47.394460,0 days 00:00:01.271761,ReLU,ReLU,ReLU,,29,17,14.0,16.0,,0.009132571485552769,3,276,0.7988410691260439,0.010840768880816887,116.43752044101932,COMPLETE
1638,0.30920732021331787,2023-09-04 22:53:47.394947,2023-09-04 22:53:48.155635,0 days 00:00:00.760688,Tanh,ReLU,,,27,22,15.0,,,0.006649271246907121,2,202,0.6170544744299421,0.0004442591450367611,89.3129562031139,COMPLETE
1639,0.4533924162387848,2023-09-04 22:53:48.156144,2023-09-04 22:53:50.541005,0 days 00:00:02.384861,ReLU,,,,32,23,,,,1.924909008880725e-05,1,246,0.5547054792841047,0.005491796867708085,104.61434638790968,COMPLETE
1640,0.3244410753250122,2023-09-04 22:53:50.541477,2023-09-04 22:53:51.289884,0 days 00:00:00.748407,Tanh,ReLU,Sigmoid,ReLU,23,22,13.0,16.0,24.0,0.014707385134374138,4,256,0.716474821570726,0.00022613822401256031,110.63818047263406,COMPLETE
1641,0.36215972900390625,2023-09-04 22:53:51.290384,2023-09-04 22:53:51.926721,0 days 00:00:00.636337,ReLU,ReLU,Tanh,,36,20,12.0,17.0,,0.018141229209519934,3,232,0.7471908429777555,0.006168076053426812,116.29187342325847,COMPLETE
1642,0.3761706054210663,2023-09-04 22:53:51.927244,2023-09-04 22:53:53.357490,0 days 00:00:01.430246,Leaky,ReLU,Leaky,Leaky,21,21,24.0,15.0,15.0,0.00039784770084426473,4,242,0.4132848853697942,1.5728007700274154e-05,205.48960360965214,COMPLETE
1643,0.21049924194812775,2023-09-04 22:53:53.358023,2023-09-04 22:53:58.286937,0 days 00:00:04.928914,Tanh,ReLU,ReLU,,42,19,20.0,17.0,,0.002808045890316831,3,254,0.7996035882337962,1.9448215974881748e-05,87.3928010818806,COMPLETE
1644,0.3165498971939087,2023-09-04 22:53:58.287915,2023-09-04 22:54:01.191834,0 days 00:00:02.903919,ReLU,ReLU,Tanh,,39,18,20.0,17.0,,0.0026274716087292334,3,250,0.7739083885630303,2.109143363637392e-05,96.54465998136081,COMPLETE
1645,1.020647644996643,2023-09-04 22:54:01.192797,2023-09-04 22:54:01.697663,0 days 00:00:00.504866,Sigmoid,Sigmoid,ReLU,,44,18,8.0,17.0,,0.0030520961153339935,3,243,0.352032607764172,0.026566026075675594,99.57448323567708,COMPLETE
1646,0.4151858389377594,2023-09-04 22:54:01.698605,2023-09-04 22:54:02.452222,0 days 00:00:00.753617,Tanh,ReLU,Tanh,,41,19,20.0,17.0,,0.0026418325599848603,3,237,0.13375523486552168,2.478845823185644e-05,110.96592751527444,COMPLETE
1647,0.3460933566093445,2023-09-04 22:54:02.453178,2023-09-04 22:54:04.644850,0 days 00:00:02.191672,ReLU,ReLU,Sigmoid,,42,18,22.0,17.0,,0.002203166061039702,3,254,0.25298712268596807,1.9571639038671307e-05,109.69511130760456,COMPLETE
1648,0.35453110933303833,2023-09-04 22:54:04.645877,2023-09-04 22:54:05.380044,0 days 00:00:00.734167,Tanh,ReLU,ReLU,,42,18,20.0,16.0,,0.0029957487810000315,3,248,0.16550088197861676,2.8466403653682705e-05,254.45350248163396,COMPLETE
1649,0.3583558201789856,2023-09-04 22:54:05.381075,2023-09-04 22:54:07.238094,0 days 00:00:01.857019,ReLU,Leaky,Leaky,,40,19,21.0,17.0,,0.003409113904561078,3,232,0.7988734024271363,0.061910820713810384,95.51336466471354,COMPLETE
1650,0.3305642008781433,2023-09-04 22:54:07.239065,2023-09-04 22:54:11.708364,0 days 00:00:04.469299,Leaky,ReLU,Tanh,,39,8,20.0,16.0,,0.0025171114743347107,3,256,0.7697727755084353,2.095992848511857e-05,99.2917772775673,COMPLETE
1651,0.3420941233634949,2023-09-04 22:54:11.709337,2023-09-04 22:54:13.233056,0 days 00:00:01.523719,Tanh,ReLU,ReLU,,48,18,21.0,17.0,,0.00374315525121539,3,225,0.3837837518428953,3.4202798330246706e-05,125.03653395803352,COMPLETE
1652,0.27346745133399963,2023-09-04 22:54:13.234022,2023-09-04 22:54:16.762977,0 days 00:00:03.528955,ReLU,ReLU,ReLU,,43,19,19.0,12.0,,0.0019711303647558043,3,242,0.746574908259881,2.4222011186615913e-05,104.25647184583876,COMPLETE
1653,0.34206125140190125,2023-09-04 22:54:16.763960,2023-09-04 22:54:18.964583,0 days 00:00:02.200623,Tanh,ReLU,Tanh,,41,19,19.0,16.0,,0.0030797387054361277,3,237,0.7750562945882628,2.8216051164336282e-05,120.28546502855089,COMPLETE
1654,0.4169972836971283,2023-09-04 22:54:18.965557,2023-09-04 22:54:20.819459,0 days 00:00:01.853902,ReLU,ReLU,Sigmoid,,45,18,20.0,17.0,,0.003996990864112694,3,249,0.35062114232975866,0.034812518166061665,109.16489350168328,COMPLETE
1655,0.3986451029777527,2023-09-04 22:54:20.820426,2023-09-04 22:54:22.165201,0 days 00:00:01.344775,Tanh,ReLU,ReLU,,43,19,21.0,13.0,,0.0014474876343875329,3,214,0.27271635634349956,7.696044373329133e-05,108.0704593961201,COMPLETE
1656,0.3810296058654785,2023-09-04 22:54:22.166165,2023-09-04 22:54:35.636720,0 days 00:00:13.470555,Leaky,ReLU,Tanh,,41,18,19.0,12.0,,3.109602780858207e-05,3,257,0.7980983745944482,1.85972338568593e-05,94.8035031329797,COMPLETE
1657,0.47368866205215454,2023-09-04 22:54:35.637745,2023-09-04 22:54:36.568606,0 days 00:00:00.930861,ReLU,ReLU,Leaky,,42,19,21.0,18.0,,0.0024110355638717385,3,245,0.11888710628255043,4.4373559652303e-05,190.77842409182819,COMPLETE
1658,0.45556968450546265,2023-09-04 22:54:36.569566,2023-09-04 22:54:37.228434,0 days 00:00:00.658868,Sigmoid,ReLU,ReLU,,41,19,19.0,16.0,,0.004292396322779125,3,233,0.292931698611399,2.2960202146154945e-05,240.73144458589098,COMPLETE
1659,0.3292827606201172,2023-09-04 22:54:37.229385,2023-09-04 22:54:40.498942,0 days 00:00:03.269557,Tanh,Leaky,Tanh,,42,23,22.0,3.0,,0.0017471870533485936,3,262,0.6978637663663378,0.00019590252023740553,99.77137262680951,COMPLETE
1660,0.970487117767334,2023-09-04 22:54:40.499907,2023-09-04 22:54:41.984291,0 days 00:00:01.484384,ReLU,ReLU,Sigmoid,,38,23,22.0,15.0,,0.0001140150218987405,3,220,0.326188693163464,0.07853511853190444,112.98468844095866,COMPLETE
1661,0.370831161737442,2023-09-04 22:54:41.985280,2023-09-04 22:54:42.861150,0 days 00:00:00.875870,Tanh,ReLU,ReLU,,22,19,20.0,16.0,,0.003320771669543362,3,251,0.15865530011629506,0.00010895174602605924,150.63846915108817,COMPLETE
1662,0.3957536518573761,2023-09-04 22:54:42.862125,2023-09-04 22:54:43.545811,0 days 00:00:00.683686,ReLU,ReLU,Tanh,,47,22,20.0,17.0,,0.0018583294541631298,3,239,0.10905937894760012,3.05015989859615e-05,236.3734749385289,COMPLETE
1663,0.29899758100509644,2023-09-04 22:54:43.546823,2023-09-04 22:54:45.658524,0 days 00:00:02.111701,Tanh,ReLU,Leaky,,38,23,19.0,8.0,,0.02387925359456899,3,228,0.6579577106597374,3.865978323353974e-05,101.14429976300495,COMPLETE
1664,0.3165634274482727,2023-09-04 22:54:45.659592,2023-09-04 22:54:49.177930,0 days 00:00:03.518338,Leaky,Sigmoid,ReLU,,38,22,14.0,18.0,,0.004311046757508505,3,256,0.7258896111765802,6.241898888010551e-05,79.03609686186819,COMPLETE
1665,0.3433811068534851,2023-09-04 22:54:49.178908,2023-09-04 22:54:50.413491,0 days 00:00:01.234583,ReLU,ReLU,Tanh,,45,19,20.0,14.0,,0.07229353642857599,3,242,0.7999748428953103,0.00016378868923582818,127.43031420026507,COMPLETE
1666,0.27636539936065674,2023-09-04 22:54:50.414503,2023-09-04 22:54:52.941554,0 days 00:00:02.527051,Tanh,ReLU,ReLU,,39,23,19.0,16.0,,0.002986433500116569,3,247,0.7453607115562857,1.8659423515058332e-05,103.51162504113239,COMPLETE
1667,0.3214341402053833,2023-09-04 22:54:52.942544,2023-09-04 22:54:56.295547,0 days 00:00:03.353003,ReLU,ReLU,Sigmoid,,44,18,21.0,15.0,,0.0012474499858962198,3,235,0.7707768595338933,2.668407312516362e-05,107.51914548873901,COMPLETE
1668,0.3276335895061493,2023-09-04 22:54:56.296544,2023-09-04 22:54:57.883629,0 days 00:00:01.587085,Tanh,ReLU,Tanh,,50,22,20.0,17.0,,0.005230848358959123,3,262,0.798255695907853,3.39063416927095e-05,101.59718199699155,COMPLETE
1669,0.343147873878479,2023-09-04 22:54:57.884633,2023-09-04 22:54:59.506484,0 days 00:00:01.621851,ReLU,ReLU,ReLU,,40,17,23.0,15.0,,0.003650090778841705,3,252,0.44716041560638864,0.00040602457862334206,979.5469672020446,COMPLETE
