number,value,datetime_start,datetime_complete,duration,params_activation1,params_activation2,params_activation3,params_activation4,params_batch_size,params_fl1,params_fl2,params_fl3,params_fl4,params_learning_rate,params_n_layers,params_num_epochs,params_train_size,params_weight_decay,user_attrs_mre,state
1054,0.4114946722984314,2023-09-04 22:17:51.485689,2023-09-04 22:17:59.618216,0 days 00:00:08.132527,Tanh,Tanh,,,48,22,14.0,,,7.637493756956735e-05,2,225,0.7355011456495474,0.0003146389003126437,99.62089986165364,COMPLETE
1055,0.3354945778846741,2023-09-04 22:17:59.618969,2023-09-04 22:18:01.431827,0 days 00:00:01.812858,Tanh,Tanh,,,51,21,16.0,,,0.002318448425709962,2,256,0.38095409410027165,0.0003929666330458004,166.33350581913203,COMPLETE
1056,0.3222143352031708,2023-09-04 22:18:01.432596,2023-09-04 22:18:02.830979,0 days 00:00:01.398383,Sigmoid,Tanh,,,52,20,13.0,,,0.06714484149329021,2,237,0.6847036976596276,0.00045354900076830516,109.10906734466553,COMPLETE
1057,0.3917217254638672,2023-09-04 22:18:02.831741,2023-09-04 22:18:03.794880,0 days 00:00:00.963139,Tanh,Tanh,,,44,19,6.0,,,0.0226287679222824,2,241,0.3561564065558664,0.04001142731508829,134.56544130498713,COMPLETE
1058,0.31381720304489136,2023-09-04 22:18:03.795637,2023-09-04 22:18:04.955067,0 days 00:00:01.159430,Tanh,Tanh,,,47,18,7.0,,,0.041668368854668736,2,232,0.7366029837883361,0.0001390508537629583,97.80690056937081,COMPLETE
1059,0.3881068229675293,2023-09-04 22:18:04.955829,2023-09-04 22:18:09.467903,0 days 00:00:04.512074,Tanh,Tanh,,,55,22,6.0,,,0.0003545407977002272,2,221,0.48560319029997645,0.00015768898703237333,95.32010008557008,COMPLETE
1060,0.3773851990699768,2023-09-04 22:18:09.468652,2023-09-04 22:18:09.880031,0 days 00:00:00.411379,Tanh,Sigmoid,,,49,21,15.0,,,0.031118055530590213,2,287,0.20034237676240269,3.736993113730416e-05,116.93834216778095,COMPLETE
1061,0.4055851697921753,2023-09-04 22:18:09.880768,2023-09-04 22:18:11.554958,0 days 00:00:01.674190,Leaky,Sigmoid,,,52,21,12.0,,,0.0007876158883084265,2,225,0.13946561719394251,0.007052112016122948,173.09487280951606,COMPLETE
1062,0.32425549626350403,2023-09-04 22:18:11.555690,2023-09-04 22:18:12.440446,0 days 00:00:00.884756,Tanh,Tanh,,,42,23,15.0,,,0.022806961797724363,2,250,0.5969543586899835,4.889691756112377e-05,98.09227586829144,COMPLETE
1063,0.40623319149017334,2023-09-04 22:18:12.441209,2023-09-04 22:18:14.874917,0 days 00:00:02.433708,Tanh,Sigmoid,,,79,24,14.0,,,0.0010104283471855445,2,229,0.4366129959454349,0.00010934838662269624,125.8706276151869,COMPLETE
1064,0.34529808163642883,2023-09-04 22:18:14.875694,2023-09-04 22:18:16.149953,0 days 00:00:01.274259,Tanh,Tanh,,,46,20,16.0,,,0.07338288321466892,2,259,0.7034344598052477,9.533226058577746e-05,100.95477724075317,COMPLETE
1065,0.35274264216423035,2023-09-04 22:18:16.150716,2023-09-04 22:18:17.298930,0 days 00:00:01.148214,Tanh,Sigmoid,,,53,9,7.0,,,0.017735536844649444,2,102,0.24430759334680224,0.00020961981735121677,130.93127917121438,COMPLETE
1066,0.39339280128479004,2023-09-04 22:18:17.299678,2023-09-04 22:18:18.251204,0 days 00:00:00.951526,Tanh,Leaky,,,45,21,14.0,,,0.035973778675445725,2,243,0.7531646032910289,0.024967677920366874,124.95235152471633,COMPLETE
1067,0.30596160888671875,2023-09-04 22:18:18.251953,2023-09-04 22:18:21.496764,0 days 00:00:03.244811,Sigmoid,Sigmoid,,,43,22,21.0,,,0.025179994817798423,2,222,0.7178499173118372,6.407074684052816e-05,131.8675362191549,COMPLETE
1068,0.36651289463043213,2023-09-04 22:18:21.497566,2023-09-04 22:18:22.654887,0 days 00:00:01.157321,Tanh,Tanh,,,45,15,13.0,,,0.030275413883724664,2,236,0.4536222075056737,0.002730944998267057,122.76453642411666,COMPLETE
1069,0.338045209646225,2023-09-04 22:18:22.655674,2023-09-04 22:18:24.418203,0 days 00:00:01.762529,Tanh,Sigmoid,,,48,14,6.0,,,0.01031821424509966,2,215,0.6722393419607432,3.9909444850795e-05,132.20929931640626,COMPLETE
1070,0.3705735206604004,2023-09-04 22:18:24.418958,2023-09-04 22:18:24.813957,0 days 00:00:00.394999,Tanh,Sigmoid,,,49,19,5.0,,,0.0427297284715298,2,118,0.18374143252419584,0.0001758332760764098,121.9173714319865,COMPLETE
1071,0.29739853739738464,2023-09-04 22:18:24.814718,2023-09-04 22:18:25.522330,0 days 00:00:00.707612,Tanh,Tanh,,,55,20,15.0,,,0.05051189799202652,2,108,0.6315787658455225,7.751047660229018e-05,120.7673152923584,COMPLETE
1072,0.5158635973930359,2023-09-04 22:18:25.523088,2023-09-04 22:18:27.174025,0 days 00:00:01.650937,Tanh,Sigmoid,,,42,22,12.0,,,0.00022249802401134075,2,228,0.10915174821501371,0.0040109040691809865,380.041774381671,COMPLETE
1073,0.3683280944824219,2023-09-04 22:18:27.174775,2023-09-04 22:18:28.974232,0 days 00:00:01.799457,Leaky,Tanh,,,93,21,7.0,,,0.0018848189157334837,2,274,0.7513232508250057,0.00012768370382684863,129.47699909478845,COMPLETE
1074,0.9398154020309448,2023-09-04 22:18:28.974991,2023-09-04 22:18:32.378375,0 days 00:00:03.403384,Tanh,Sigmoid,,,50,20,16.0,,,1.6092801254373114e-05,2,96,0.7215848970381338,0.004914835011915495,149.41941022872925,COMPLETE
1075,0.4048256278038025,2023-09-04 22:18:32.379152,2023-09-04 22:18:33.411951,0 days 00:00:01.032799,Tanh,Leaky,,,98,21,5.0,,,0.020359827177878247,2,259,0.7534889591259314,0.01867802963662229,127.45189353747246,COMPLETE
1076,0.30643975734710693,2023-09-04 22:18:33.412712,2023-09-04 22:18:35.213844,0 days 00:00:01.801132,Tanh,Sigmoid,,,53,22,6.0,,,0.014880572601172688,2,84,0.6925644311530886,4.723034909358431e-05,98.04697979621167,COMPLETE
1077,0.3920765221118927,2023-09-04 22:18:35.214610,2023-09-04 22:18:44.389412,0 days 00:00:09.174802,Tanh,Tanh,,,47,16,13.0,,,0.0005564381766261793,2,244,0.766479527038635,2.676935158779224e-05,101.44364022426917,COMPLETE
1078,0.5170126557350159,2023-09-04 22:18:44.390181,2023-09-04 22:18:45.009367,0 days 00:00:00.619186,Sigmoid,Sigmoid,,,46,20,14.0,,,0.01282417820775609,2,230,0.5779450892643324,0.012951791617039132,115.586660861969,COMPLETE
1079,0.33670908212661743,2023-09-04 22:18:45.010122,2023-09-04 22:18:47.491809,0 days 00:00:02.481687,Tanh,Tanh,,,41,15,6.0,,,0.0025086277352297116,2,219,0.7282383018443049,0.00015290270134693437,102.59293607076009,COMPLETE
1080,0.45884546637535095,2023-09-04 22:18:47.492569,2023-09-04 22:18:51.226273,0 days 00:00:03.733704,Tanh,Sigmoid,,,44,13,21.0,,,0.00013540451446218083,2,113,0.6109116808896958,3.363509296975566e-05,137.18915389069414,COMPLETE
1081,0.4482574760913849,2023-09-04 22:18:51.227018,2023-09-04 22:18:57.288235,0 days 00:00:06.061217,Tanh,Sigmoid,,,70,21,15.0,,,0.00012511542243851974,2,239,0.6625601900653159,0.0029758497375840065,107.92442755918623,COMPLETE
1082,0.32963019609451294,2023-09-04 22:18:57.288999,2023-09-04 22:18:57.950279,0 days 00:00:00.661280,Tanh,Tanh,,,48,23,5.0,,,0.028210468425862,2,250,0.39312564711190656,0.0005826157471927573,106.47837653526894,COMPLETE
1083,0.46229153871536255,2023-09-04 22:18:57.951032,2023-09-04 22:19:01.668999,0 days 00:00:03.717967,Tanh,Sigmoid,,,53,24,17.0,,,0.00010080497714364584,2,99,0.7723452057081857,5.863314946351887e-05,114.27349514431424,COMPLETE
1084,0.3769321143627167,2023-09-04 22:19:01.669782,2023-09-04 22:19:02.635938,0 days 00:00:00.966156,Leaky,Leaky,,,51,19,13.0,,,0.008019436096095147,2,266,0.5479405369529121,0.02229585820781003,113.53675866127014,COMPLETE
1085,0.4151427447795868,2023-09-04 22:19:02.636772,2023-09-04 22:19:05.992965,0 days 00:00:03.356193,Tanh,Sigmoid,,,42,21,14.0,,,0.0004447353164795581,2,85,0.7028826109936409,0.004640569965122122,107.89027638154872,COMPLETE
1086,0.36077749729156494,2023-09-04 22:19:05.993761,2023-09-04 22:19:06.874175,0 days 00:00:00.880414,Tanh,Tanh,,,47,20,15.0,,,0.03720658801133382,2,215,0.25727543484085547,0.007424616850688851,119.30900165012905,COMPLETE
1087,0.405360609292984,2023-09-04 22:19:06.874941,2023-09-04 22:19:08.621179,0 days 00:00:01.746238,Tanh,Sigmoid,,,51,22,7.0,,,0.00965180402215404,2,227,0.7336306059434523,9.79359781656792e-05,96.54601190445271,COMPLETE
1088,0.38780736923217773,2023-09-04 22:19:08.621952,2023-09-04 22:19:11.629815,0 days 00:00:03.007863,Tanh,Tanh,,,72,23,6.0,,,8.961274378802021e-05,2,102,0.7700500595786369,0.00025080416869017173,92.00833832983876,COMPLETE
1089,0.32218629121780396,2023-09-04 22:19:11.630581,2023-09-04 22:19:13.928749,0 days 00:00:02.298168,Sigmoid,Sigmoid,,,49,8,12.0,,,0.01704577470398829,2,92,0.741140667364894,0.0001856971138976548,127.96514165969123,COMPLETE
1090,0.2704252004623413,2023-09-04 22:19:13.929502,2023-09-04 22:19:15.790501,0 days 00:00:01.860999,Tanh,Sigmoid,,,45,21,14.0,,,0.021570901009898735,2,57,0.6902353068964241,0.00012106822110330335,83.85257393973214,COMPLETE
1091,0.29693326354026794,2023-09-04 22:19:15.791267,2023-09-04 22:19:16.955197,0 days 00:00:01.163930,Tanh,Tanh,,,43,22,14.0,,,0.02155293628336363,2,58,0.6375199757599995,0.00069783224267703,85.74288914998372,COMPLETE
1092,0.30873945355415344,2023-09-04 22:19:16.955979,2023-09-04 22:19:19.052110,0 days 00:00:02.096131,Tanh,Sigmoid,,,40,20,13.0,,,0.01741834038892009,2,51,0.6861195142503794,7.840278880166136e-05,96.20212749406403,COMPLETE
1093,0.40722405910491943,2023-09-04 22:19:19.052848,2023-09-04 22:19:19.395248,0 days 00:00:00.342400,Tanh,Leaky,,,84,21,14.0,,,0.020534618603528725,2,55,0.15134916729143288,0.00011334815180017963,298.1165044447955,COMPLETE
1094,0.3627190589904785,2023-09-04 22:19:19.396020,2023-09-04 22:19:21.912990,0 days 00:00:02.516970,Leaky,Tanh,,,45,20,13.0,,,0.023118932850190666,2,59,0.7998920625616135,5.032657583974974e-05,163.28498517052603,COMPLETE
1095,0.3073730170726776,2023-09-04 22:19:21.913740,2023-09-04 22:19:23.418041,0 days 00:00:01.504301,Tanh,Sigmoid,,,42,21,13.0,,,0.015077378668625652,2,61,0.6597778099506619,4.251985316849108e-05,90.12624298898797,COMPLETE
1096,0.33423683047294617,2023-09-04 22:19:23.418791,2023-09-04 22:19:25.256408,0 days 00:00:01.837617,Tanh,Sigmoid,,,44,14,5.0,,,0.011686152256112548,2,50,0.687091515925598,0.00035752864542448824,100.67572379598812,COMPLETE
1097,0.4957766830921173,2023-09-04 22:19:25.257192,2023-09-04 22:19:28.524501,0 days 00:00:03.267309,Tanh,Tanh,Tanh,,40,19,14.0,9.0,,0.00020782850126105476,3,63,0.7533524066927699,0.045828709829591203,105.3222176688058,COMPLETE
1098,0.3159451484680176,2023-09-04 22:19:28.525301,2023-09-04 22:19:31.312032,0 days 00:00:02.786731,Tanh,Sigmoid,,,43,22,12.0,,,0.01852496906896839,2,70,0.7718707849668912,8.378611373341239e-05,94.19292954664964,COMPLETE
1099,0.3617752194404602,2023-09-04 22:19:31.312796,2023-09-04 22:19:32.500798,0 days 00:00:01.188002,Tanh,Tanh,ReLU,,76,21,11.0,13.0,,0.001569378086402429,3,59,0.4107112024901015,6.757035439574556e-05,231.49643655550682,COMPLETE
1100,0.36525821685791016,2023-09-04 22:19:32.501603,2023-09-04 22:19:33.332550,0 days 00:00:00.830947,Sigmoid,Sigmoid,,,41,12,6.0,,,0.0232846635366347,2,74,0.2893946599835736,2.5957299726440162e-05,168.0180435180664,COMPLETE
1101,0.6117391586303711,2023-09-04 22:19:33.333317,2023-09-04 22:19:34.311502,0 days 00:00:00.978185,Tanh,Sigmoid,,,74,20,13.0,,,0.00016164411322736177,2,53,0.41663554997526764,3.3658047922265e-05,100.03113354377027,COMPLETE
1102,0.3336911201477051,2023-09-04 22:19:34.312282,2023-09-04 22:19:35.720836,0 days 00:00:01.408554,Tanh,Tanh,,,56,16,22.0,,,0.02663014490610838,2,62,0.7074922655631718,0.014027234045912818,115.08916380347276,COMPLETE
1103,1.0236589908599854,2023-09-04 22:19:35.721611,2023-09-04 22:19:38.729017,0 days 00:00:03.007406,Tanh,Leaky,Sigmoid,,10,21,5.0,12.0,,1.9598555832369143e-05,3,67,0.18873414581810907,0.0002905909490098329,128.11014511336143,COMPLETE
1104,0.3429207503795624,2023-09-04 22:19:38.729830,2023-09-04 22:19:41.303383,0 days 00:00:02.573553,Tanh,Sigmoid,,,45,24,20.0,,,0.003002505716949417,2,76,0.6235549740492873,0.00010115466324056891,120.83720327678479,COMPLETE
1105,1.0383307933807373,2023-09-04 22:19:41.304164,2023-09-04 22:19:42.568283,0 days 00:00:01.264119,Tanh,Sigmoid,,,68,22,7.0,,,3.643142025638992e-05,2,51,0.5630339525168957,0.0001176210951180993,128.56890659706266,COMPLETE
1106,0.3846791386604309,2023-09-04 22:19:42.569056,2023-09-04 22:19:43.537422,0 days 00:00:00.968366,Tanh,Tanh,,,40,23,14.0,,,0.013791698684475263,2,62,0.2981263909427333,5.4568932398108066e-05,346.7160241958943,COMPLETE
1107,0.3524518311023712,2023-09-04 22:19:43.538177,2023-09-04 22:19:45.053541,0 days 00:00:01.515364,Leaky,Sigmoid,,,45,15,21.0,,,0.010629584109557718,2,75,0.7985063542894606,3.667375641713579e-05,105.29033099903779,COMPLETE
1108,0.3127400875091553,2023-09-04 22:19:45.054288,2023-09-04 22:19:48.190543,0 days 00:00:03.136255,Tanh,Tanh,ReLU,,42,18,6.0,8.0,,0.008294292523844811,3,63,0.7436039297606689,2.330694232195721e-05,92.82207428462921,COMPLETE
1109,0.30022522807121277,2023-09-04 22:19:48.191349,2023-09-04 22:19:50.677451,0 days 00:00:02.486102,Tanh,Sigmoid,,,53,20,13.0,,,0.017034335178517986,2,70,0.771448182861398,0.006002091933111982,100.29200632431927,COMPLETE
1110,0.3475877046585083,2023-09-04 22:19:50.678214,2023-09-04 22:19:51.102493,0 days 00:00:00.424279,Tanh,Sigmoid,Tanh,,61,20,7.0,10.0,,0.02802460189353271,3,82,0.11989800922936428,2.9793961257963338e-05,160.48228475782605,COMPLETE
1111,0.42927423119544983,2023-09-04 22:19:51.103274,2023-09-04 22:19:51.775667,0 days 00:00:00.672393,Sigmoid,Tanh,,,39,13,14.0,,,0.012077893910830197,2,67,0.2136445861130847,0.010162050007646889,118.62780107770648,COMPLETE
1112,0.36768561601638794,2023-09-04 22:19:51.776438,2023-09-04 22:19:52.654837,0 days 00:00:00.878399,Tanh,Leaky,,,55,21,5.0,,,0.02443722834678607,2,84,0.3213677981942925,0.00014538533315541866,108.35936294555664,COMPLETE
1113,0.3465738594532013,2023-09-04 22:19:52.655631,2023-09-04 22:19:53.604861,0 days 00:00:00.949230,ReLU,Sigmoid,,,58,22,6.0,,,0.020029104027904605,2,51,0.6526028129784901,0.0009310364747002049,97.42601802431304,COMPLETE
1114,0.35418274998664856,2023-09-04 22:19:53.605622,2023-09-04 22:19:58.370690,0 days 00:00:04.765068,Tanh,Tanh,Sigmoid,,10,19,13.0,6.0,,0.009295891175061253,3,89,0.7161631377991803,9.091875081014995e-05,116.17607827022158,COMPLETE
1115,0.37974417209625244,2023-09-04 22:19:58.371473,2023-09-04 22:20:00.195689,0 days 00:00:01.824216,Tanh,Sigmoid,,,44,21,14.0,,,0.015247225661351338,2,75,0.7382444163504871,0.0002083331706426341,87.97628749500622,COMPLETE
1116,0.28426089882850647,2023-09-04 22:20:00.196458,2023-09-04 22:20:02.594368,0 days 00:00:02.397910,Tanh,Sigmoid,,,38,22,3.0,,,0.007179824509288238,2,58,0.6753882185993362,6.476563575517476e-05,106.34710417122676,COMPLETE
1117,0.3642413914203644,2023-09-04 22:20:02.595146,2023-09-04 22:20:03.232548,0 days 00:00:00.637402,Tanh,Tanh,ReLU,,46,14,6.0,15.0,,0.03143480051390644,3,80,0.20949535494444443,4.3779571852534044e-05,106.55674192640517,COMPLETE
1118,0.3242162764072418,2023-09-04 22:20:03.233347,2023-09-04 22:20:10.162661,0 days 00:00:06.929314,Leaky,,,,42,20,,,,0.00046166469880988987,1,212,0.771696809671265,0.00048205702609640074,107.59303272895093,COMPLETE
1119,0.3596470355987549,2023-09-04 22:20:10.163425,2023-09-04 22:20:10.983229,0 days 00:00:00.819804,ReLU,Sigmoid,,,52,21,12.0,,,0.002729786747158101,2,68,0.20335584366305287,0.00025091704544816956,108.50954198125584,COMPLETE
1120,0.4059939980506897,2023-09-04 22:20:10.984008,2023-09-04 22:20:13.558448,0 days 00:00:02.574440,Tanh,Tanh,,,49,20,6.0,,,0.0011668529125719426,2,203,0.24587411605144296,0.0026165730811749948,112.67856496425685,COMPLETE
1121,1.0307536125183105,2023-09-04 22:20:13.559231,2023-09-04 22:20:17.748680,0 days 00:00:04.189449,Tanh,Sigmoid,ReLU,,50,5,4.0,7.0,,3.0936399756186544e-05,3,92,0.7999544592144289,0.0001156809546333085,111.99693256875743,COMPLETE
1122,0.3281991183757782,2023-09-04 22:20:17.749450,2023-09-04 22:20:19.077364,0 days 00:00:01.327914,Tanh,,,,47,23,,,,0.012589289457860768,1,219,0.5043739345234239,0.0003485867701571113,100.77015177408855,COMPLETE
1123,0.36149799823760986,2023-09-04 22:20:19.078120,2023-09-04 22:20:19.575763,0 days 00:00:00.497643,ReLU,Leaky,,,39,22,5.0,,,0.01896182130189696,2,76,0.13074972991451894,0.00015631145098934137,132.41944531696598,COMPLETE
1124,0.31499722599983215,2023-09-04 22:20:19.576529,2023-09-04 22:20:23.145408,0 days 00:00:03.568879,Tanh,Sigmoid,,,66,21,7.0,,,0.0021793414833995387,2,126,0.7026302513797265,0.00041998071656112253,96.20553057861328,COMPLETE
1125,0.40613847970962524,2023-09-04 22:20:23.146182,2023-09-04 22:20:27.464785,0 days 00:00:04.318603,Sigmoid,Tanh,,,44,21,14.0,,,0.0002866017294266264,2,107,0.7524123503821339,0.0037051024743640047,113.73942915301457,COMPLETE
1126,0.37574151158332825,2023-09-04 22:20:27.465584,2023-09-04 22:20:28.695349,0 days 00:00:01.229765,Tanh,Sigmoid,Sigmoid,,54,24,13.0,9.0,,0.006951604152034297,3,208,0.34834702183851346,7.074299575097368e-05,128.5102917597844,COMPLETE
1127,0.6989529132843018,2023-09-04 22:20:28.696231,2023-09-04 22:20:30.432585,0 days 00:00:01.736354,Tanh,,,,10,15,,,,2.46218156239324e-05,1,67,0.16743712943114916,0.06127642937729251,105.62964482093925,COMPLETE
1128,0.4102342128753662,2023-09-04 22:20:30.433431,2023-09-04 22:20:32.694221,0 days 00:00:02.260790,Tanh,Tanh,,,46,19,2.0,,,0.0007155508227218875,2,58,0.7302318940578247,2.742821025697696e-05,142.45173263549805,COMPLETE
1129,0.321494996547699,2023-09-04 22:20:32.695246,2023-09-04 22:20:34.308940,0 days 00:00:01.613694,ReLU,Sigmoid,,,41,20,18.0,,,0.010093390922729685,2,222,0.6070562489162672,4.6317133513223064e-05,104.9095089934593,COMPLETE
1130,0.9540273547172546,2023-09-04 22:20:34.309813,2023-09-04 22:20:36.149502,0 days 00:00:01.839689,Tanh,Sigmoid,ReLU,,37,21,22.0,5.0,,1.3066194426891289e-05,3,50,0.4568525822017291,5.61816738873992e-05,102.52338973999024,COMPLETE
1131,0.3082840144634247,2023-09-04 22:20:36.150367,2023-09-04 22:20:37.563210,0 days 00:00:01.412843,Tanh,Tanh,,,43,22,11.0,,,0.02476237425027781,2,94,0.6888443801372888,3.63949676816004e-05,109.42703530447824,COMPLETE
1132,0.2831498086452484,2023-09-04 22:20:37.563987,2023-09-04 22:20:38.656832,0 days 00:00:01.092845,Tanh,Sigmoid,,,63,23,20.0,,,0.03159999405641833,2,81,0.5280127738501769,0.0006838037495984282,96.66078700575717,COMPLETE
1133,0.44382643699645996,2023-09-04 22:20:38.657687,2023-09-04 22:20:39.146111,0 days 00:00:00.488424,Leaky,Leaky,,,52,20,8.0,,,0.003333352480645102,2,118,0.11514288095700977,0.002089303057453124,184.56011212882348,COMPLETE
1134,0.36875006556510925,2023-09-04 22:20:39.146890,2023-09-04 22:20:39.639086,0 days 00:00:00.492196,Tanh,,,,48,21,,,,0.016164375454395953,1,74,0.2324843828828388,0.00018025280694049443,245.852090534411,COMPLETE
1135,0.7618312835693359,2023-09-04 22:20:39.639906,2023-09-04 22:20:43.370103,0 days 00:00:03.730197,ReLU,Sigmoid,Tanh,,50,19,5.0,8.0,,6.15915303875472e-05,3,216,0.2792308824451889,3.076374428023441e-05,99.3654449250963,COMPLETE
1136,0.2767990529537201,2023-09-04 22:20:43.370928,2023-09-04 22:20:54.325466,0 days 00:00:10.954538,Tanh,Tanh,,,11,22,7.0,,,0.0012577276252248011,2,87,0.7549214346062062,8.457071138280008e-05,144.0165417550624,COMPLETE
1137,0.38815009593963623,2023-09-04 22:20:54.326237,2023-09-04 22:20:57.204473,0 days 00:00:02.878236,Tanh,Sigmoid,,,38,20,12.0,,,0.008167323508115679,2,227,0.7699194791298726,0.008520074407262733,120.45491165411276,COMPLETE
1138,0.4934574365615845,2023-09-04 22:20:57.205267,2023-09-04 22:20:58.565849,0 days 00:00:01.360582,Sigmoid,,,,12,17,,,,0.0006083334960577618,1,65,0.1590856509389856,0.00012657587933167792,111.33553431584285,COMPLETE
1139,0.3422110378742218,2023-09-04 22:20:58.566607,2023-09-04 22:20:59.168561,0 days 00:00:00.601954,Tanh,Tanh,,,60,21,14.0,,,0.020398885120133957,2,93,0.32740194354939495,2.004906304266586e-05,115.24952721595764,COMPLETE
1140,0.3381645977497101,2023-09-04 22:20:59.169331,2023-09-04 22:21:01.583669,0 days 00:00:02.414338,Tanh,Sigmoid,ReLU,,46,21,15.0,6.0,,0.0136493187035063,3,232,0.6458296380218082,0.00022060908841712744,99.9677454192063,COMPLETE
1141,0.3610420823097229,2023-09-04 22:21:01.584478,2023-09-04 22:21:04.312678,0 days 00:00:02.728200,ReLU,Sigmoid,Sigmoid,ReLU,57,15,6.0,7.0,12.0,0.0018158921501211802,4,206,0.5875435215538914,2.4316299589338278e-05,98.00251986529376,COMPLETE
1142,0.42718568444252014,2023-09-04 22:21:04.313491,2023-09-04 22:21:06.653942,0 days 00:00:02.340451,Tanh,Tanh,,,41,20,18.0,,,0.00025567654029571565,2,57,0.7149098307536706,0.004870237957870556,122.9813426502964,COMPLETE
1143,0.3280213177204132,2023-09-04 22:21:06.654743,2023-09-04 22:21:08.082901,0 days 00:00:01.428158,Tanh,Sigmoid,,,43,22,4.0,,,0.011181835426877068,2,104,0.4795918197398453,9.701741458926461e-05,105.94432250976563,COMPLETE
1144,0.3394165337085724,2023-09-04 22:21:08.083688,2023-09-04 22:21:09.381084,0 days 00:00:01.297396,Tanh,Tanh,ReLU,,49,23,5.0,10.0,,0.09904567998004098,3,137,0.7409475102085423,0.0005503613558492666,106.4305323848018,COMPLETE
1145,0.3758848309516907,2023-09-04 22:21:09.381866,2023-09-04 22:21:09.931708,0 days 00:00:00.549842,Leaky,,,,45,19,,,,0.027408072530612566,1,83,0.433221832703706,0.07858138858214787,350.9641274844899,COMPLETE
1146,0.2958557605743408,2023-09-04 22:21:09.932477,2023-09-04 22:21:13.087994,0 days 00:00:03.155517,Tanh,Leaky,,,81,21,3.0,,,0.005887874987243602,2,112,0.7990803867901701,0.00030184711411069827,104.16718557902745,COMPLETE
1147,0.3646247684955597,2023-09-04 22:21:13.088774,2023-09-04 22:21:13.824222,0 days 00:00:00.735448,ReLU,Sigmoid,Tanh,Sigmoid,88,16,14.0,6.0,8.0,0.03205050503651318,4,74,0.23804916993140726,0.00015706296759756573,113.21877154181985,COMPLETE
1148,0.35832202434539795,2023-09-04 22:21:13.825035,2023-09-04 22:21:15.564481,0 days 00:00:01.739446,Tanh,Sigmoid,,,39,21,13.0,,,0.00933735631085926,2,236,0.518789362244337,5.1334250999090354e-05,2298.5845037389686,COMPLETE
1149,0.4296989142894745,2023-09-04 22:21:15.565260,2023-09-04 22:21:19.225272,0 days 00:00:03.660012,Tanh,Tanh,ReLU,,55,22,16.0,11.0,,0.00015401313860908451,3,100,0.6684618019721283,3.881203775184148e-05,110.55585136413575,COMPLETE
