number,value,datetime_start,datetime_complete,duration,params_activation1,params_activation2,params_activation3,params_activation4,params_batch_size,params_fl1,params_fl2,params_fl3,params_fl4,params_learning_rate,params_n_layers,params_num_epochs,params_train_size,params_weight_decay,user_attrs_mre,state
1670,0.36960354447364807,2023-09-04 22:54:59.507430,2023-09-04 22:54:59.999726,0 days 00:00:00.492296,Leaky,ReLU,Leaky,,37,22,20.0,16.0,,0.040570050311854046,3,227,0.19555416463107433,2.2022064972097997e-05,117.02406041762409,COMPLETE
1671,0.39167022705078125,2023-09-04 22:55:00.000711,2023-09-04 22:55:01.263239,0 days 00:00:01.262528,Sigmoid,Leaky,Tanh,,40,23,20.0,17.0,,0.002579061415688384,3,243,0.18124447460620485,0.000548528763589261,105.30985855474705,COMPLETE
1672,0.32363077998161316,2023-09-04 22:55:01.264203,2023-09-04 22:55:02.419074,0 days 00:00:01.154871,ReLU,ReLU,ReLU,,40,19,19.0,14.0,,0.02806514868861656,3,207,0.31653725360143253,4.689478367186858e-05,155.1811076319495,COMPLETE
1673,0.394861102104187,2023-09-04 22:55:02.420049,2023-09-04 22:55:04.010007,0 days 00:00:01.589958,Tanh,ReLU,Sigmoid,,36,19,19.0,8.0,,0.0021568112293671887,3,256,0.23688088860661882,0.004520693961193071,212.92204726369758,COMPLETE
1674,0.462070494890213,2023-09-04 22:55:04.010974,2023-09-04 22:55:12.577328,0 days 00:00:08.566354,ReLU,ReLU,Tanh,,43,22,15.0,18.0,,2.3795464197556602e-05,3,263,0.49765721580116,0.00012486670741583382,114.69004467866267,COMPLETE
1675,0.3178868889808655,2023-09-04 22:55:12.578298,2023-09-04 22:55:15.760510,0 days 00:00:03.182212,Tanh,ReLU,ReLU,,37,23,19.0,15.0,,0.004871294639299703,3,235,0.7992829345247449,0.0022799227909963762,86.4740763250387,COMPLETE
1676,0.2923831641674042,2023-09-04 22:55:15.761462,2023-09-04 22:55:20.967319,0 days 00:00:05.205857,ReLU,ReLU,Leaky,,19,21,15.0,16.0,,0.005603863392061714,3,250,0.722770118256575,0.00414411816030052,104.25219594515286,COMPLETE
1677,0.3802579641342163,2023-09-04 22:55:20.968292,2023-09-04 22:55:30.126554,0 days 00:00:09.158262,Tanh,ReLU,Tanh,,46,18,21.0,17.0,,3.687097196672658e-05,3,227,0.6869322069044863,1.6974574679091864e-05,112.19592836354798,COMPLETE
1678,0.30401596426963806,2023-09-04 22:55:30.127530,2023-09-04 22:55:32.239294,0 days 00:00:02.111764,Leaky,ReLU,ReLU,,24,16,22.0,7.0,,0.01566041414187861,3,243,0.6326515107481596,5.626997897854659e-05,102.44811426798502,COMPLETE
1679,0.341310054063797,2023-09-04 22:55:32.240261,2023-09-04 22:55:33.559122,0 days 00:00:01.318861,ReLU,ReLU,Sigmoid,,39,22,9.0,16.0,,0.004076140069884274,3,262,0.2579304435458348,8.79623796579623e-05,118.74530558432302,COMPLETE
1680,0.3200208246707916,2023-09-04 22:55:33.560090,2023-09-04 22:55:36.210271,0 days 00:00:02.650181,Tanh,ReLU,ReLU,,74,22,14.0,8.0,,0.0015844091217483683,3,221,0.7472561704921918,2.4874184794261276e-05,109.41525288632042,COMPLETE
1681,0.301860511302948,2023-09-04 22:55:36.211325,2023-09-04 22:55:37.805422,0 days 00:00:01.594097,ReLU,Leaky,Tanh,,21,19,7.0,15.0,,0.03175393416630442,3,238,0.605107777760771,0.0002832100462344896,140.8323184967041,COMPLETE
1682,0.29979825019836426,2023-09-04 22:55:37.806386,2023-09-04 22:55:39.543359,0 days 00:00:01.736973,Tanh,ReLU,Leaky,,19,21,19.0,16.0,,0.017986516361805722,3,249,0.4711870066723809,0.00015714047907518502,92.95998294536884,COMPLETE
1683,0.3401808738708496,2023-09-04 22:55:39.544334,2023-09-04 22:55:41.588942,0 days 00:00:02.044608,ReLU,ReLU,ReLU,,17,23,16.0,17.0,,0.003011479077620411,3,254,0.4203126937226369,3.183082357198189e-05,127.50019240379333,COMPLETE
1684,0.30278730392456055,2023-09-04 22:55:41.589894,2023-09-04 22:55:44.047219,0 days 00:00:02.457325,Leaky,ReLU,Tanh,,23,20,14.0,13.0,,0.012970164106699942,3,232,0.7996841441814161,0.0002211375391698271,79.53516190140336,COMPLETE
1685,0.9910001158714294,2023-09-04 22:55:44.048178,2023-09-04 22:55:46.761943,0 days 00:00:02.713765,Sigmoid,,,,44,22,,,,1.1918501009319045e-05,1,266,0.2257063924310099,0.00032852054138665036,152.7647030765849,COMPLETE
1686,0.3421223759651184,2023-09-04 22:55:46.762882,2023-09-04 22:55:48.563485,0 days 00:00:01.800603,Tanh,Sigmoid,,,37,21,15.0,,,0.0035857089770049743,2,242,0.7508580051628498,7.03416553289264e-05,100.16441716374578,COMPLETE
1687,0.3728484809398651,2023-09-04 22:55:48.564428,2023-09-04 22:55:56.715613,0 days 00:00:08.151185,ReLU,ReLU,ReLU,,10,23,16.0,7.0,,0.005108664549947244,3,218,0.7033768353000013,0.011633441324682877,136.79759282651156,COMPLETE
1688,0.3610785901546478,2023-09-04 22:55:56.716590,2023-09-04 22:55:57.691241,0 days 00:00:00.974651,Tanh,ReLU,Tanh,,42,19,13.0,17.0,,0.024087568769911315,3,254,0.7653277822046236,0.003276125713554038,112.14455795288086,COMPLETE
1689,0.5861073136329651,2023-09-04 22:55:57.691808,2023-09-04 22:56:04.129017,0 days 00:00:06.437209,ReLU,ReLU,Sigmoid,,22,20,21.0,14.0,,1.060322170746187e-05,3,245,0.7227366789037996,0.013265351865696157,100.77947384581275,COMPLETE
1690,0.4135884940624237,2023-09-04 22:56:04.129499,2023-09-04 22:56:04.411368,0 days 00:00:00.281869,Tanh,ReLU,ReLU,,24,23,19.0,18.0,,0.052091701260316335,3,229,0.14469335717495854,1.9737205980733607e-05,120.31432970832375,COMPLETE
1691,0.3798491656780243,2023-09-04 22:56:04.412331,2023-09-04 22:56:05.928712,0 days 00:00:01.516381,ReLU,ReLU,Leaky,,35,22,20.0,16.0,,0.0007490004692430613,3,197,0.7725688266152202,0.08380201399959865,136.27226525964872,COMPLETE
1692,0.4010211229324341,2023-09-04 22:56:05.929216,2023-09-04 22:56:08.284783,0 days 00:00:02.355567,Leaky,ReLU,Tanh,,20,21,15.0,4.0,,0.00024628565188653944,3,257,0.18810645092185643,1.664295498463554e-05,190.69611663818358,COMPLETE
1693,0.3362728953361511,2023-09-04 22:56:08.285802,2023-09-04 22:56:09.781820,0 days 00:00:01.496018,Tanh,ReLU,,,25,20,17.0,,,0.006149154237010904,2,237,0.6638188137007867,0.00010357875300642817,103.28797435760498,COMPLETE
1694,0.33649250864982605,2023-09-04 22:56:09.782322,2023-09-04 22:56:11.434067,0 days 00:00:01.651745,ReLU,ReLU,ReLU,,12,19,8.0,15.0,,0.021296068263975457,3,262,0.740769249493481,0.007944259811873895,127.1516832624163,COMPLETE
1695,0.4057655930519104,2023-09-04 22:56:11.434557,2023-09-04 22:56:11.730077,0 days 00:00:00.295520,Tanh,Leaky,Tanh,,17,21,14.0,7.0,,0.01105828825504318,3,245,0.1325873084738113,3.9685111143655664e-05,120.26559584481376,COMPLETE
1696,0.2961861491203308,2023-09-04 22:56:11.730572,2023-09-04 22:56:13.548460,0 days 00:00:01.817888,ReLU,ReLU,Sigmoid,,39,22,18.0,16.0,,0.0025530984330684892,3,267,0.7718276749846117,2.2595065452297224e-05,103.78247209028764,COMPLETE
1697,0.38537338376045227,2023-09-04 22:56:13.548945,2023-09-04 22:56:14.055751,0 days 00:00:00.506806,Tanh,ReLU,ReLU,,21,23,13.0,17.0,,0.09057423120615754,3,249,0.5094277860387065,2.7764781359762747e-05,109.48248036702473,COMPLETE
1698,0.6397524476051331,2023-09-04 22:56:14.056307,2023-09-04 22:56:15.900048,0 days 00:00:01.843741,ReLU,ReLU,Tanh,,23,18,22.0,15.0,,1.915278564018099e-05,3,95,0.5473983407395342,0.0006739910344675088,120.89314245926707,COMPLETE
1699,0.3241339325904846,2023-09-04 22:56:15.900534,2023-09-04 22:56:20.085927,0 days 00:00:04.185393,Sigmoid,ReLU,Leaky,,19,22,16.0,18.0,,0.0007951667883530559,3,230,0.6906618009326422,1.5474622163675777e-05,104.58050861874142,COMPLETE
1700,0.3558330833911896,2023-09-04 22:56:20.086416,2023-09-04 22:56:20.763430,0 days 00:00:00.677014,Leaky,ReLU,ReLU,,25,20,14.0,17.0,,0.004336722925626407,3,54,0.3876385748723656,0.00044466424396144224,111.7809773320737,COMPLETE
1701,0.39132899045944214,2023-09-04 22:56:20.763942,2023-09-04 22:56:21.012988,0 days 00:00:00.249046,ReLU,ReLU,,,22,19,18.0,,,0.006851577295124698,2,211,0.13733846370397246,0.026049630837639053,106.98001210829791,COMPLETE
1702,0.3860994875431061,2023-09-04 22:56:21.013450,2023-09-04 22:56:23.947257,0 days 00:00:02.933807,Tanh,,,,37,21,,,,0.0001496309542324029,1,240,0.7987868086525987,3.3684834073084306e-05,111.51176010767618,COMPLETE
1703,0.35888394713401794,2023-09-04 22:56:23.947752,2023-09-04 22:56:24.197654,0 days 00:00:00.249902,ReLU,ReLU,Tanh,,35,22,15.0,16.0,,0.0034964281049622912,3,87,0.14826808424422497,1.960295932938168e-05,131.75969004631042,COMPLETE
1704,0.3334166705608368,2023-09-04 22:56:24.198136,2023-09-04 22:56:25.314999,0 days 00:00:01.116863,Tanh,ReLU,ReLU,,40,20,7.0,6.0,,0.0021026652734836074,3,258,0.7257288912732095,0.0020814093803743147,105.0861824498032,COMPLETE
1705,0.42613667249679565,2023-09-04 22:56:25.315487,2023-09-04 22:56:25.782286,0 days 00:00:00.466799,ReLU,ReLU,Sigmoid,,25,23,16.0,5.0,,0.01529364200417396,3,251,0.15561044404394592,5.101282380054208e-05,319.6116915616122,COMPLETE
1706,0.32906708121299744,2023-09-04 22:56:25.783229,2023-09-04 22:56:27.040239,0 days 00:00:01.257010,Leaky,Leaky,Tanh,,23,18,23.0,16.0,,0.03913629070598849,3,222,0.7528130325202431,0.0001280380446986989,113.50506431178043,COMPLETE
1707,0.4805443286895752,2023-09-04 22:56:27.041176,2023-09-04 22:56:27.411380,0 days 00:00:00.370204,Tanh,Sigmoid,ReLU,,21,9,14.0,17.0,,0.01330516533596322,3,239,0.3404047254682719,0.052873205097464855,120.77260996500651,COMPLETE
1708,0.3527860641479492,2023-09-04 22:56:27.411867,2023-09-04 22:56:35.414506,0 days 00:00:08.002639,ReLU,ReLU,Leaky,,26,22,9.0,8.0,,0.00010671631822827775,3,267,0.7097588053267033,0.00019862324791657292,97.7802183172676,COMPLETE
1709,0.32297348976135254,2023-09-04 22:56:35.415463,2023-09-04 22:56:36.445387,0 days 00:00:01.029924,Tanh,ReLU,Tanh,,18,20,13.0,15.0,,0.005796049904073321,3,233,0.4077732218304189,0.0016384692640333178,98.47091576360887,COMPLETE
1710,0.3625592291355133,2023-09-04 22:56:36.445894,2023-09-04 22:56:37.374591,0 days 00:00:00.928697,ReLU,ReLU,ReLU,,35,21,15.0,14.0,,0.001165362745628368,3,250,0.7705866126149764,2.636896737570842e-05,104.26207427978515,COMPLETE
1711,0.32789281010627747,2023-09-04 22:56:37.375092,2023-09-04 22:56:38.049332,0 days 00:00:00.674240,Sigmoid,ReLU,Sigmoid,,24,19,17.0,7.0,,0.058325135282446094,3,362,0.4892375016062473,0.0005331984664870654,109.84123475211007,COMPLETE
1712,0.3786013424396515,2023-09-04 22:56:38.049846,2023-09-04 22:56:38.418535,0 days 00:00:00.368689,Tanh,,,,42,23,,,,0.007724631378755562,1,258,0.1836373958583702,1.3882004951125495e-05,108.9123291507844,COMPLETE
1713,0.3515339493751526,2023-09-04 22:56:38.419471,2023-09-04 22:56:39.294886,0 days 00:00:00.875415,ReLU,ReLU,ReLU,,20,21,19.0,16.0,,0.00997837157578413,3,244,0.3343903673828479,8.247732689491583e-05,105.59653507579456,COMPLETE
1714,0.3534806966781616,2023-09-04 22:56:39.295386,2023-09-04 22:56:39.709397,0 days 00:00:00.414011,Leaky,ReLU,Tanh,,37,22,15.0,4.0,,0.004780041509327984,3,217,0.4314876591113761,3.535270982860406e-05,116.80662264142718,COMPLETE
1715,0.4000464081764221,2023-09-04 22:56:39.709890,2023-09-04 22:56:42.526569,0 days 00:00:02.816679,Tanh,ReLU,Leaky,,27,20,16.0,17.0,,3.2126092996560475e-05,3,236,0.37542206578074294,0.00628165840108288,114.62066886384608,COMPLETE
1716,0.32769477367401123,2023-09-04 22:56:42.527052,2023-09-04 22:56:43.220648,0 days 00:00:00.693596,ReLU,ReLU,,,34,23,18.0,,,0.0028840330116841344,2,226,0.7393206232436548,2.2455378213863102e-05,92.00958593268143,COMPLETE
1717,0.33394137024879456,2023-09-04 22:56:43.221208,2023-09-04 22:56:43.860455,0 days 00:00:00.639247,Tanh,ReLU,ReLU,,23,21,5.0,6.0,,0.030486053183029816,3,267,0.29025316391331946,0.0007986645969633332,133.68787384033203,COMPLETE
1718,0.38177019357681274,2023-09-04 22:56:43.861017,2023-09-04 22:56:44.351417,0 days 00:00:00.490400,ReLU,Leaky,Tanh,,25,20,14.0,18.0,,0.06789530072177516,3,250,0.7698436461171726,0.00014309400209494788,107.0838633219401,COMPLETE
1719,0.2926828861236572,2023-09-04 22:56:44.351968,2023-09-04 22:56:45.592562,0 days 00:00:01.240594,Tanh,ReLU,ReLU,,44,17,13.0,7.0,,0.019048382300519633,3,257,0.6760339556378293,0.0027575318989028195,94.35304946899414,COMPLETE
1720,0.3437142074108124,2023-09-04 22:56:45.593065,2023-09-04 22:56:46.437969,0 days 00:00:00.844904,Leaky,ReLU,Sigmoid,,52,19,6.0,15.0,,0.004264740645642014,3,242,0.5723221471226495,1.8169704472637467e-05,138.5320975780487,COMPLETE
1721,0.3525305390357971,2023-09-04 22:56:46.438450,2023-09-04 22:56:47.987083,0 days 00:00:01.548633,ReLU,ReLU,Tanh,,21,22,17.0,13.0,,0.006972614307119676,3,235,0.6469653423474063,0.04115692981048218,106.27586525364926,COMPLETE
1722,0.2691531479358673,2023-09-04 22:56:47.987617,2023-09-04 22:56:48.943910,0 days 00:00:00.956293,Tanh,ReLU,Leaky,ReLU,27,22,21.0,16.0,22.0,0.009188700826945392,4,201,0.725367815993126,2.9357846742030296e-05,99.94238924980164,COMPLETE
1723,0.2926355004310608,2023-09-04 22:56:48.944405,2023-09-04 22:56:50.323915,0 days 00:00:01.379510,ReLU,ReLU,ReLU,,17,19,14.0,8.0,,0.011213552228940405,3,248,0.7694797147628376,4.8428316823280865e-05,103.75180595799496,COMPLETE
1724,1.018363118171692,2023-09-04 22:56:50.324397,2023-09-04 22:56:50.517853,0 days 00:00:00.193456,Sigmoid,ReLU,Tanh,Leaky,40,21,15.0,5.0,13.0,0.016912744270385822,4,267,0.1260733010213833,0.03755398895929135,99.89273997715541,COMPLETE
1725,0.3166714310646057,2023-09-04 22:56:50.518334,2023-09-04 22:56:53.279618,0 days 00:00:02.761284,Tanh,ReLU,ReLU,,36,23,20.0,17.0,,0.00044490886176469594,3,229,0.7987319753209674,0.00024634420320460853,112.7539778236005,COMPLETE
1726,0.35177144408226013,2023-09-04 22:56:53.280108,2023-09-04 22:56:53.895990,0 days 00:00:00.615882,ReLU,Sigmoid,Tanh,,19,22,16.0,12.0,,0.00568169481420807,3,257,0.31437440872116734,6.188122385207602e-05,115.1038423018022,COMPLETE
1727,0.3655187487602234,2023-09-04 22:56:53.896492,2023-09-04 22:56:54.398340,0 days 00:00:00.501848,Leaky,ReLU,Sigmoid,ReLU,38,20,19.0,16.0,21.0,0.003734022949557442,4,241,0.26925184791462364,0.00010579763011921218,166.0346760749817,COMPLETE
1728,0.5010666251182556,2023-09-04 22:56:54.398832,2023-09-04 22:56:54.766453,0 days 00:00:00.367621,Tanh,ReLU,ReLU,,22,21,17.0,14.0,,0.025772158445075428,3,274,0.35082963134261375,0.09585663863248131,121.55938279001336,COMPLETE
1729,0.3340283930301666,2023-09-04 22:56:54.766931,2023-09-04 22:56:55.745772,0 days 00:00:00.978841,ReLU,Leaky,Leaky,Leaky,33,23,13.0,18.0,20.0,0.0014807028034370367,4,251,0.45381519604424025,0.000384671848387119,103.21157653243453,COMPLETE
1730,0.3152933716773987,2023-09-04 22:56:55.746751,2023-09-04 22:56:56.908790,0 days 00:00:01.162039,ReLU,,,,24,22,,,,0.007814519143320427,1,221,0.799208626374389,1.5819017345335958e-05,86.991646964595,COMPLETE
1731,0.2700135409832001,2023-09-04 22:56:56.909264,2023-09-04 22:57:00.314732,0 days 00:00:03.405468,Tanh,ReLU,Tanh,,26,21,8.0,24.0,,0.0006219725447390409,3,260,0.698443240792099,0.00017679590940724546,122.14447056619744,COMPLETE
1732,0.3554188311100006,2023-09-04 22:57:00.315293,2023-09-04 22:57:04.282155,0 days 00:00:03.966862,ReLU,ReLU,,,13,15,16.0,,,0.0003304508324948676,2,128,0.7418438045421322,2.428692107937e-05,146.13521452031583,COMPLETE
1733,0.2999317944049835,2023-09-04 22:57:04.282650,2023-09-04 22:57:05.151659,0 days 00:00:00.869009,Tanh,ReLU,ReLU,ReLU,28,19,9.0,15.0,13.0,0.012719329147438408,4,234,0.7519188838485661,1.9806611723881426e-05,81.38212174635667,COMPLETE
1734,0.3089936673641205,2023-09-04 22:57:05.152157,2023-09-04 22:57:07.911751,0 days 00:00:02.759594,Leaky,ReLU,Tanh,,16,20,18.0,17.0,,0.0019688808469075164,3,211,0.617972615070087,4.007715480152653e-05,100.24602174758911,COMPLETE
1735,0.33254778385162354,2023-09-04 22:57:07.912716,2023-09-04 22:57:16.291364,0 days 00:00:08.378648,ReLU,ReLU,Sigmoid,Leaky,34,23,7.0,16.0,14.0,0.0002504310447017651,4,245,0.7202489769864887,3.188202257284008e-05,99.96168913877099,COMPLETE
1736,0.3778858780860901,2023-09-04 22:57:16.292327,2023-09-04 22:57:18.724792,0 days 00:00:02.432465,Tanh,ReLU,ReLU,,24,5,15.0,6.0,,0.002560402039863821,3,261,0.2853343191399923,2.5861699214491853e-05,110.55834550857544,COMPLETE
1737,0.389170378446579,2023-09-04 22:57:18.725743,2023-09-04 22:57:19.389980,0 days 00:00:00.664237,ReLU,ReLU,Leaky,ReLU,20,20,14.0,15.0,15.0,0.09310846223854975,4,240,0.20490667617016595,1.4503247814929134e-05,132.76408222743444,COMPLETE
1738,0.5550437569618225,2023-09-04 22:57:19.390929,2023-09-04 22:57:25.154426,0 days 00:00:05.763497,Sigmoid,ReLU,Tanh,,22,18,15.0,5.0,,5.9658235619532305e-05,3,228,0.22203863276574573,0.00027856119135612504,127.04065747846637,COMPLETE
1739,0.6403706669807434,2023-09-04 22:57:25.155372,2023-09-04 22:57:31.103282,0 days 00:00:05.947910,Tanh,Tanh,ReLU,,26,22,13.0,7.0,,2.1281311586077074e-05,3,251,0.24332491551222696,7.602555415600492e-05,123.09362640988779,COMPLETE
1740,0.6434111595153809,2023-09-04 22:57:31.104254,2023-09-04 22:57:45.338239,0 days 00:00:14.233985,ReLU,ReLU,Tanh,Leaky,33,19,16.0,3.0,21.0,1.030954420188178e-05,4,266,0.5950429916368343,0.0006247656546362969,95.30275780814034,COMPLETE
1741,0.4259684681892395,2023-09-04 22:57:45.339216,2023-09-04 22:57:46.033816,0 days 00:00:00.694600,Tanh,ReLU,ReLU,,28,21,19.0,6.0,,0.004883431840520893,3,244,0.1712898733908051,2.0910411175056508e-05,143.1424516950335,COMPLETE
1742,0.33424171805381775,2023-09-04 22:57:46.034821,2023-09-04 22:57:47.982033,0 days 00:00:01.947212,Leaky,Leaky,Sigmoid,Leaky,36,20,18.0,17.0,12.0,0.045405125769379794,4,254,0.5287603945261227,0.00011649637935361053,103.02835611196664,COMPLETE
1743,0.3382895588874817,2023-09-04 22:57:47.983005,2023-09-04 22:57:49.785953,0 days 00:00:01.802948,ReLU,ReLU,ReLU,,46,22,8.0,16.0,,0.006298076878070149,3,273,0.7713321185724794,3.906302892892265e-05,98.83137512207031,COMPLETE
1744,0.4532119035720825,2023-09-04 22:57:49.786914,2023-09-04 22:58:03.776865,0 days 00:00:13.989951,Tanh,ReLU,Tanh,ReLU,24,22,14.0,7.0,16.0,1.6842697510962836e-05,4,232,0.5146617687147149,1.8024760933737013e-05,101.97981186570793,COMPLETE
1745,0.32296887040138245,2023-09-04 22:58:03.777828,2023-09-04 22:58:11.790948,0 days 00:00:08.013120,ReLU,ReLU,,,19,23,15.0,,,0.0003167944966814478,2,247,0.7998495633172394,0.0005158286365722947,92.56481155694699,COMPLETE
1746,0.4068472385406494,2023-09-04 22:58:11.791890,2023-09-04 22:58:13.445485,0 days 00:00:01.653595,Tanh,Tanh,Leaky,,38,19,20.0,16.0,,0.009875716078807962,3,238,0.7497875470426378,0.007039545407883541,171.8422157024515,COMPLETE
1747,0.3575568199157715,2023-09-04 22:58:13.446443,2023-09-04 22:58:14.125654,0 days 00:00:00.679211,ReLU,ReLU,ReLU,Leaky,41,21,17.0,15.0,24.0,0.003213820501844651,4,218,0.15232122762655595,2.90388597276358e-05,234.06620094992897,COMPLETE
1748,0.3227193355560303,2023-09-04 22:58:14.126804,2023-09-04 22:58:16.387632,0 days 00:00:02.260828,Leaky,ReLU,Tanh,,26,23,15.0,17.0,,0.001723549902116031,3,257,0.6927613162766081,0.01898637365015071,102.06551313400269,COMPLETE
1749,0.33530864119529724,2023-09-04 22:58:16.388592,2023-09-04 22:58:19.313866,0 days 00:00:02.925274,Tanh,,,,22,20,,,,0.02238031057912964,1,248,0.7995331844373701,1.2568330512184589e-05,108.9183418567364,COMPLETE
1750,0.6194682121276855,2023-09-04 22:58:19.314814,2023-09-04 22:58:33.150342,0 days 00:00:13.835528,ReLU,Sigmoid,Sigmoid,,29,18,9.0,15.0,,2.967977450760325e-05,3,228,0.7260110254133332,0.0003296169676515676,100.6825115806178,COMPLETE
1751,0.3619149923324585,2023-09-04 22:58:33.151301,2023-09-04 22:58:38.626797,0 days 00:00:05.475496,Sigmoid,ReLU,ReLU,ReLU,31,21,4.0,18.0,19.0,0.008297775764195206,4,264,0.7680254785271267,9.162301722497733e-05,102.229700922966,COMPLETE
1752,0.41038644313812256,2023-09-04 22:58:38.627774,2023-09-04 22:58:39.812344,0 days 00:00:01.184570,Tanh,ReLU,Tanh,,14,20,13.0,8.0,,0.03494344620939522,3,276,0.6495523819763662,0.0001440105765229693,118.92697416033063,COMPLETE
1753,0.33672040700912476,2023-09-04 22:58:39.812847,2023-09-04 22:58:40.386778,0 days 00:00:00.573931,ReLU,ReLU,Leaky,Leaky,64,22,16.0,16.0,23.0,0.013415233232025913,4,237,0.4689501089096814,2.2691195309227934e-05,91.9329106257512,COMPLETE
1754,0.31625431776046753,2023-09-04 22:58:40.387299,2023-09-04 22:58:44.919079,0 days 00:00:04.531780,Tanh,Tanh,ReLU,,48,23,14.0,6.0,,0.00021558056541557495,3,257,0.7545841929880774,0.0008697703327925419,99.55543514819855,COMPLETE
1755,0.36411747336387634,2023-09-04 22:58:44.919574,2023-09-04 22:58:45.358902,0 days 00:00:00.439328,ReLU,ReLU,Tanh,ReLU,35,19,18.0,14.0,13.0,0.005013501512609915,4,118,0.36485110509783264,0.0018553601959734232,100.16216278076172,COMPLETE
1756,0.3086493909358978,2023-09-04 22:58:45.359409,2023-09-04 22:58:48.891795,0 days 00:00:03.532386,Leaky,Leaky,ReLU,,18,21,12.0,17.0,,0.0040934262813120325,3,242,0.7063024954973726,0.014780039148083107,107.19248449980323,COMPLETE
1757,0.34605008363723755,2023-09-04 22:58:48.892294,2023-09-04 22:58:49.281728,0 days 00:00:00.389434,Tanh,ReLU,Sigmoid,,27,22,17.0,16.0,,0.006487896765146713,3,250,0.26801801274298503,4.881768046953034e-05,600.6864423751831,COMPLETE
1758,0.3284582495689392,2023-09-04 22:58:49.282243,2023-09-04 22:58:51.111269,0 days 00:00:01.829026,ReLU,ReLU,Tanh,Leaky,23,19,15.0,7.0,20.0,0.0011155849499337688,4,223,0.7692026415670707,0.00022418581408375658,109.96114938300953,COMPLETE
1759,0.5103166699409485,2023-09-04 22:58:51.111775,2023-09-04 22:58:52.031356,0 days 00:00:00.919581,Tanh,ReLU,ReLU,ReLU,33,20,14.0,17.0,22.0,5.0153970330968244e-05,4,211,0.11376070362439827,0.009457111876556465,102.53241722504674,COMPLETE
1760,0.2990560829639435,2023-09-04 22:58:52.031851,2023-09-04 22:58:52.919640,0 days 00:00:00.887789,ReLU,ReLU,Leaky,,21,23,19.0,8.0,,0.010863707061176278,3,194,0.5505580270712642,1.6682886098964406e-05,112.2021185222425,COMPLETE
1761,0.3338930308818817,2023-09-04 22:58:52.920146,2023-09-04 22:58:58.736733,0 days 00:00:05.816587,ReLU,Tanh,Tanh,,25,22,16.0,6.0,,2.8216006798760277e-05,3,235,0.7996949256862665,0.0032535908572369474,112.51393280029296,COMPLETE
1762,0.33753785490989685,2023-09-04 22:58:58.737225,2023-09-04 22:58:59.850180,0 days 00:00:01.112955,Tanh,ReLU,ReLU,Leaky,39,21,23.0,18.0,11.0,0.003276372385588015,4,268,0.7362953916913801,0.0174739383283272,133.5352875636174,COMPLETE
