number,value,datetime_start,datetime_complete,duration,params_activation1,params_activation2,params_activation3,params_activation4,params_batch_size,params_fl1,params_fl2,params_fl3,params_fl4,params_learning_rate,params_n_layers,params_num_epochs,params_train_size,params_weight_decay,user_attrs_mre,state
186,0.30784741044044495,2023-09-04 21:21:25.272888,2023-09-04 21:21:26.735024,0 days 00:00:01.462136,Tanh,Leaky,Leaky,,15,11,13.0,2.0,,0.009347089620765914,3,256,0.7748556205486061,0.0004323614088517168,118.19496175977919,COMPLETE
187,0.3272797465324402,2023-09-04 21:21:26.735420,2023-09-04 21:21:29.344252,0 days 00:00:02.608832,Tanh,Sigmoid,Sigmoid,,59,13,18.0,4.0,,0.0012341096295630115,3,373,0.7991816665146318,0.0002722349472099073,106.34117818433185,COMPLETE
188,0.30898961424827576,2023-09-04 21:21:29.344554,2023-09-04 21:21:30.075376,0 days 00:00:00.730822,Tanh,Leaky,Leaky,,31,11,14.0,11.0,,0.00688186189828359,3,342,0.7204011779988735,0.0003498046213680584,83.46968882792704,COMPLETE
189,0.3259217143058777,2023-09-04 21:21:30.075781,2023-09-04 21:21:33.157951,0 days 00:00:03.082170,Leaky,Leaky,Leaky,,56,10,15.0,13.0,,0.0009445249809538028,3,320,0.658283413043896,0.00017803028769628555,97.90692959000579,COMPLETE
190,0.34422579407691956,2023-09-04 21:21:33.158248,2023-09-04 21:21:34.425512,0 days 00:00:01.267264,Tanh,Leaky,Leaky,,24,9,16.0,15.0,,0.0006679766759042354,3,271,0.42106825877314574,0.0005805253443571416,99.37017307924421,COMPLETE
191,0.30696752667427063,2023-09-04 21:21:34.425809,2023-09-04 21:21:35.698238,0 days 00:00:01.272429,Tanh,Leaky,Leaky,,25,12,15.0,13.0,,0.010567688815483986,3,343,0.7989378633531653,0.0002453650040975495,88.60383438110351,COMPLETE
192,0.2627159655094147,2023-09-04 21:21:35.698536,2023-09-04 21:21:36.322399,0 days 00:00:00.623863,Tanh,Leaky,Leaky,,22,12,14.0,12.0,,0.01333897240521847,3,348,0.7464010099438569,0.00024627690296683723,105.86375991157864,COMPLETE
193,0.28340551257133484,2023-09-04 21:21:36.322704,2023-09-04 21:21:37.090172,0 days 00:00:00.767468,Tanh,Leaky,Leaky,,22,12,14.0,12.0,,0.014898360158161506,3,348,0.7348969862386621,0.00032876973254775436,102.2699211383688,COMPLETE
194,0.32452142238616943,2023-09-04 21:21:37.090498,2023-09-04 21:21:37.976431,0 days 00:00:00.885933,Tanh,Leaky,Leaky,,19,12,14.0,12.0,,0.017210982848885822,3,362,0.698777069882163,0.00030064585157862423,86.51713463567918,COMPLETE
195,0.31914952397346497,2023-09-04 21:21:37.976741,2023-09-04 21:21:38.675098,0 days 00:00:00.698357,Tanh,Leaky,Leaky,,22,13,13.0,11.0,,0.019854320953574478,3,351,0.7397656866455731,0.00021739351982467256,90.57077936025766,COMPLETE
196,0.35290148854255676,2023-09-04 21:21:38.675399,2023-09-04 21:21:38.928590,0 days 00:00:00.253191,Tanh,Leaky,Leaky,,17,11,14.0,11.0,,0.011642254216999619,3,333,0.15612933312236982,0.0003922106457737193,120.93881004087386,COMPLETE
197,0.30464938282966614,2023-09-04 21:21:38.928912,2023-09-04 21:21:40.320570,0 days 00:00:01.391658,Tanh,Leaky,Leaky,,21,12,14.0,12.0,,0.015147695408856075,3,357,0.6833237748964601,0.00031661619692604923,87.22222595214843,COMPLETE
198,0.299529492855072,2023-09-04 21:21:40.320875,2023-09-04 21:21:40.711059,0 days 00:00:00.390184,Tanh,Leaky,Leaky,,67,22,13.0,8.0,,0.02181243415361014,3,365,0.7564278415970626,0.00014848703231745328,95.0351665019989,COMPLETE
199,0.3313167095184326,2023-09-04 21:21:40.711382,2023-09-04 21:21:41.259578,0 days 00:00:00.548196,ReLU,Leaky,Leaky,,23,14,16.0,7.0,,0.012914739512437892,3,350,0.49007061493354004,0.00025714158357814394,106.67555433704007,COMPLETE
200,0.31629982590675354,2023-09-04 21:21:41.259898,2023-09-04 21:21:42.061304,0 days 00:00:00.801406,Tanh,Leaky,Leaky,,28,13,17.0,21.0,,0.009051173376388234,3,377,0.7217473650919966,0.00019481169699772137,241.38117156157622,COMPLETE
201,0.3104793131351471,2023-09-04 21:21:42.061616,2023-09-04 21:21:42.880281,0 days 00:00:00.818665,Tanh,Leaky,Leaky,,19,10,15.0,13.0,,0.0153386058815944,3,343,0.46037695191819983,0.00043391536681027025,162.20035783634629,COMPLETE
202,0.3129803240299225,2023-09-04 21:21:42.880596,2023-09-04 21:21:43.864773,0 days 00:00:00.984177,Tanh,Leaky,Leaky,,16,11,15.0,6.0,,0.007974374303218353,3,332,0.7471537433664714,0.0008024186689574691,89.64262281145368,COMPLETE
203,0.34218040108680725,2023-09-04 21:21:43.865095,2023-09-04 21:21:45.415553,0 days 00:00:01.550458,Tanh,Sigmoid,Leaky,,54,23,16.0,14.0,,0.001699483120054362,3,355,0.708715456681699,0.0003387694030693196,118.23844669711205,COMPLETE
204,0.29982495307922363,2023-09-04 21:21:45.415876,2023-09-04 21:21:47.489925,0 days 00:00:02.074049,Tanh,Leaky,Leaky,,30,12,15.0,17.0,,0.0010773066655290866,3,297,0.7576899178985599,0.0029466772322254797,107.50882621765136,COMPLETE
205,0.33297398686408997,2023-09-04 21:21:47.490231,2023-09-04 21:21:49.091253,0 days 00:00:01.601022,Tanh,Leaky,Leaky,,57,22,14.0,12.0,,0.0013495566144318169,3,325,0.6437621703263462,0.0005185474880130733,137.50861954362426,COMPLETE
206,0.29853004217147827,2023-09-04 21:21:49.091557,2023-09-04 21:21:50.377618,0 days 00:00:01.286061,Sigmoid,ReLU,Leaky,,26,7,14.0,7.0,,0.013606366007816754,3,240,0.6826522809462694,0.0002453678572966616,92.05626386006674,COMPLETE
207,0.3449552357196808,2023-09-04 21:21:50.377923,2023-09-04 21:21:52.189062,0 days 00:00:01.811139,Tanh,Leaky,Sigmoid,,14,11,15.0,23.0,,0.002339698114324999,3,224,0.36800265582410885,0.00038992008831873837,110.29350030244287,COMPLETE
208,0.3174205422401428,2023-09-04 21:21:52.189364,2023-09-04 21:21:53.245973,0 days 00:00:01.056609,ReLU,Leaky,,,22,12,16.0,,,0.0037273879888210073,2,365,0.7715191117129709,0.0002778894316221731,107.00476721058722,COMPLETE
209,0.3187551498413086,2023-09-04 21:21:53.246264,2023-09-04 21:21:53.680240,0 days 00:00:00.433976,Tanh,Leaky,Leaky,,38,10,17.0,6.0,,0.02886893390397283,3,340,0.720037041675709,0.000669707315718331,89.21601226806641,COMPLETE
210,0.3505816161632538,2023-09-04 21:21:53.680540,2023-09-04 21:21:54.331044,0 days 00:00:00.650504,Tanh,Sigmoid,Leaky,,33,21,16.0,5.0,,0.023466183452411197,3,389,0.7986567957390108,0.0022309292117938828,104.42122404036984,COMPLETE
211,0.287988543510437,2023-09-04 21:21:54.331369,2023-09-04 21:21:55.210591,0 days 00:00:00.879222,Tanh,Leaky,Leaky,,24,12,15.0,13.0,,0.011843419630692848,3,351,0.7757697659211564,0.00024389130340278192,93.94572875078987,COMPLETE
212,0.26811933517456055,2023-09-04 21:21:55.210915,2023-09-04 21:21:56.162013,0 days 00:00:00.951098,Tanh,Leaky,Leaky,,20,12,15.0,14.0,,0.011121983717181393,3,352,0.7387499916506277,0.00019429893328049344,104.3793734926166,COMPLETE
213,0.28411489725112915,2023-09-04 21:21:56.162319,2023-09-04 21:21:57.642560,0 days 00:00:01.480241,Tanh,Leaky,Leaky,,21,12,15.0,14.0,,0.01058324464823158,3,352,0.7282343450772013,0.0001738686742548383,87.7846690784801,COMPLETE
214,0.3622610569000244,2023-09-04 21:21:57.642890,2023-09-04 21:21:57.972913,0 days 00:00:00.330023,Tanh,Leaky,Leaky,,20,13,15.0,14.0,,0.010799334751939914,3,350,0.31740739501908966,0.00016786969110891287,114.89019203186035,COMPLETE
215,0.29807528853416443,2023-09-04 21:21:57.973231,2023-09-04 21:21:58.882689,0 days 00:00:00.909458,Tanh,Leaky,Leaky,,18,14,14.0,13.0,,0.00784730338392969,3,336,0.7344864232613393,0.00019364447512783465,96.14342235696726,COMPLETE
216,0.30825328826904297,2023-09-04 21:21:58.882992,2023-09-04 21:21:59.485010,0 days 00:00:00.602018,Tanh,Leaky,Leaky,,24,12,18.0,14.0,,0.01194603700765048,3,348,0.6950806694490442,0.00014647693074488843,98.48952392578126,COMPLETE
217,0.34298065304756165,2023-09-04 21:21:59.485317,2023-09-04 21:22:00.449377,0 days 00:00:00.964060,Tanh,Leaky,Tanh,,21,11,16.0,13.0,,0.009636519913174255,3,370,0.6705634715115476,0.00021754819068121238,101.72254705429077,COMPLETE
218,0.3082427382469177,2023-09-04 21:22:00.449703,2023-09-04 21:22:01.636885,0 days 00:00:01.187182,ReLU,Leaky,Leaky,,22,13,15.0,12.0,,0.017387791762959983,3,359,0.7193616112960932,0.00017473740354469983,105.76031659997028,COMPLETE
219,0.28448545932769775,2023-09-04 21:22:01.637212,2023-09-04 21:22:02.656933,0 days 00:00:01.019721,Tanh,Leaky,Leaky,,18,12,13.0,13.0,,0.010096157968179233,3,345,0.7465151954602374,0.00022993088257941137,94.90025448799133,COMPLETE
220,0.2915474772453308,2023-09-04 21:22:02.657311,2023-09-04 21:22:03.617945,0 days 00:00:00.960634,Tanh,Leaky,Leaky,,17,12,13.0,13.0,,0.006835192549261771,3,345,0.7498379645830965,0.00012676277862847478,98.18889170679553,COMPLETE
221,0.2567826509475708,2023-09-04 21:22:03.618261,2023-09-04 21:22:04.673238,0 days 00:00:01.054977,Tanh,Leaky,Leaky,,19,11,12.0,14.0,,0.009960893854066328,3,335,0.7687755850739113,0.0002376363090997533,123.00124944051107,COMPLETE
222,0.29196080565452576,2023-09-04 21:22:04.673529,2023-09-04 21:22:05.734671,0 days 00:00:01.061142,Tanh,Leaky,Leaky,,21,11,13.0,14.0,,0.009763642774817418,3,415,0.7694930353545034,0.000226830861340378,104.81799605086043,COMPLETE
223,0.29704463481903076,2023-09-04 21:22:05.734987,2023-09-04 21:22:06.467831,0 days 00:00:00.732844,Tanh,Leaky,Leaky,,19,12,12.0,14.0,,0.01109716991332783,3,334,0.7378727776534568,0.00025026379808514466,97.78683090209961,COMPLETE
224,0.25210440158843994,2023-09-04 21:22:06.468140,2023-09-04 21:22:07.739147,0 days 00:00:01.271007,Tanh,Leaky,Leaky,,24,11,14.0,13.0,,0.012123490179861696,3,351,0.7619235192221803,0.00018775033278198584,82.86103332519531,COMPLETE
225,0.3043532073497772,2023-09-04 21:22:07.739478,2023-09-04 21:22:09.013267,0 days 00:00:01.273789,Tanh,Leaky,Leaky,,15,11,11.0,12.0,,0.008560022297804382,3,357,0.7134953274123627,0.00010225649694757855,124.50956514146593,COMPLETE
226,0.29291608929634094,2023-09-04 21:22:09.013566,2023-09-04 21:22:09.590888,0 days 00:00:00.577322,Tanh,Leaky,Leaky,,26,11,12.0,14.0,,0.013473970136641108,3,342,0.7421314208858216,0.00019018976426750988,87.35727945963542,COMPLETE
227,0.30854594707489014,2023-09-04 21:22:09.591199,2023-09-04 21:22:10.380055,0 days 00:00:00.788856,Tanh,Leaky,Leaky,,18,10,14.0,13.0,,0.007767500554053526,3,378,0.5273674908805834,0.00016946193904963938,91.69146055333755,COMPLETE
228,0.2836556136608124,2023-09-04 21:22:10.380377,2023-09-04 21:22:11.447436,0 days 00:00:01.067059,Tanh,Leaky,Leaky,,21,11,13.0,12.0,,0.00513678889554855,3,367,0.6934059408452281,0.00020572905348043932,106.81837035388482,COMPLETE
229,0.31329774856567383,2023-09-04 21:22:11.447770,2023-09-04 21:22:12.348373,0 days 00:00:00.900603,Tanh,Leaky,Leaky,,22,11,12.0,12.0,,0.01715225020944768,3,364,0.7713717441275775,0.00015125824478754362,91.75353980064392,COMPLETE
230,0.3116963505744934,2023-09-04 21:22:12.348693,2023-09-04 21:22:14.411671,0 days 00:00:02.062978,Tanh,Leaky,Leaky,,20,10,13.0,11.0,,0.006302225081695128,3,286,0.7984189608005988,0.00021343741035474454,86.22986961813534,COMPLETE
231,0.3360196352005005,2023-09-04 21:22:14.411989,2023-09-04 21:22:15.217576,0 days 00:00:00.805587,Tanh,Leaky,Leaky,,23,11,13.0,12.0,,0.009556111402994354,3,370,0.696486465777655,0.0002734081079600838,99.24932861328125,COMPLETE
232,0.3282943069934845,2023-09-04 21:22:15.217892,2023-09-04 21:22:16.548934,0 days 00:00:01.331042,Tanh,Leaky,Leaky,,16,11,14.0,15.0,,0.004498011721855574,3,352,0.7207461303700728,0.0001978773912584625,101.03221678122496,COMPLETE
233,0.2955596148967743,2023-09-04 21:22:16.549249,2023-09-04 21:22:18.006390,0 days 00:00:01.457141,Tanh,Leaky,Leaky,,20,12,13.0,13.0,,0.00510314273103171,3,339,0.6945668969480843,0.0003003190281245041,98.67016573305483,COMPLETE
234,0.29351237416267395,2023-09-04 21:22:18.006702,2023-09-04 21:22:19.066668,0 days 00:00:01.059966,Tanh,Leaky,Sigmoid,,18,11,12.0,14.0,,0.010449619225022926,3,359,0.7466841379085513,0.00022257522766866487,95.90681318803267,COMPLETE
235,0.33240774273872375,2023-09-04 21:22:19.066977,2023-09-04 21:22:19.961173,0 days 00:00:00.894196,Tanh,Leaky,Leaky,,27,12,14.0,12.0,,0.00855489280210047,3,278,0.7266730464013207,0.002510202537261035,89.39774905934053,COMPLETE
236,0.32607409358024597,2023-09-04 21:22:19.961685,2023-09-04 21:22:21.916603,0 days 00:00:01.954918,Leaky,Leaky,Leaky,,25,18,14.0,13.0,,0.012269251988614687,3,351,0.671486816097889,0.0003302652383782081,109.92480709678249,COMPLETE
237,0.3005127012729645,2023-09-04 21:22:21.916985,2023-09-04 21:22:25.971626,0 days 00:00:04.054641,Tanh,Sigmoid,Leaky,,23,13,13.0,14.0,,0.006854433408999887,3,330,0.7701612987670253,0.00016532214033758343,109.65596701882102,COMPLETE
238,0.34954118728637695,2023-09-04 21:22:25.971942,2023-09-04 21:22:27.131946,0 days 00:00:01.160004,Tanh,Leaky,Leaky,,13,10,15.0,13.0,,0.015006447164527873,3,375,0.7074316113725834,0.00026225719302301766,93.03308421167834,COMPLETE
239,0.28091925382614136,2023-09-04 21:22:27.132279,2023-09-04 21:22:29.500818,0 days 00:00:02.368539,Tanh,Leaky,Leaky,,21,11,12.0,22.0,,0.005647379988765226,3,383,0.750427104478377,0.00013441106416965705,90.73596523509306,COMPLETE
240,0.29847365617752075,2023-09-04 21:22:29.501144,2023-09-04 21:22:30.880136,0 days 00:00:01.378992,Tanh,Leaky,Leaky,,17,11,11.0,23.0,,0.005932709845775673,3,363,0.7497264107656489,0.00012638171657401007,90.19368762504763,COMPLETE
241,0.3055110275745392,2023-09-04 21:22:30.880455,2023-09-04 21:22:32.688800,0 days 00:00:01.808345,Tanh,Leaky,Leaky,,21,10,12.0,24.0,,0.007605376065260798,3,399,0.7413740165310501,0.00019086788404794816,112.78008582375266,COMPLETE
242,0.3045726418495178,2023-09-04 21:22:32.689119,2023-09-04 21:22:33.658674,0 days 00:00:00.969555,Tanh,Leaky,Leaky,,20,12,14.0,22.0,,0.00969167827695606,3,385,0.7983225600521218,0.00012266388944059994,79.19957733154297,COMPLETE
243,0.3086804151535034,2023-09-04 21:22:33.659051,2023-09-04 21:22:35.509075,0 days 00:00:01.850024,Tanh,Leaky,Leaky,,19,11,13.0,21.0,,0.0011120670492729074,3,344,0.7137893191105906,0.0031842019458760006,113.86168015003204,COMPLETE
244,0.34848377108573914,2023-09-04 21:22:35.509395,2023-09-04 21:22:36.172369,0 days 00:00:00.662974,Tanh,Leaky,Leaky,,23,12,10.0,15.0,,0.004871351150451429,3,392,0.40344954237861447,0.001869637869869893,113.48068305121528,COMPLETE
245,0.2795548141002655,2023-09-04 21:22:36.172689,2023-09-04 21:22:36.947401,0 days 00:00:00.774712,Tanh,Leaky,Leaky,,28,11,11.0,11.0,,0.013210980791205465,3,380,0.7679567455568463,9.785140038276775e-05,94.02227401733398,COMPLETE
246,0.36756429076194763,2023-09-04 21:22:36.947723,2023-09-04 21:22:37.953959,0 days 00:00:01.006236,Tanh,Leaky,Leaky,,29,11,11.0,11.0,,0.002909358000180106,3,372,0.7654627381447572,0.0001427342111574266,113.39402190498684,COMPLETE
247,0.3407672047615051,2023-09-04 21:22:37.954281,2023-09-04 21:22:38.776586,0 days 00:00:00.822305,Tanh,Leaky,Leaky,,25,9,11.0,22.0,,0.012608259644987104,3,355,0.43582373047917045,0.00016994793080817643,102.55743060195655,COMPLETE
248,0.286418080329895,2023-09-04 21:22:38.776915,2023-09-04 21:22:39.422890,0 days 00:00:00.645975,Tanh,Leaky,Leaky,,27,10,12.0,12.0,,0.019091014319154893,3,365,0.7763928316794343,9.91587657500973e-05,88.41721146195023,COMPLETE
249,0.3168743848800659,2023-09-04 21:22:39.423201,2023-09-04 21:22:40.290912,0 days 00:00:00.867711,Tanh,Leaky,Leaky,,27,10,12.0,12.0,,0.019520181685522,3,367,0.7524598107003492,8.413139803967037e-05,95.78872399581105,COMPLETE
250,0.35925909876823425,2023-09-04 21:22:40.291232,2023-09-04 21:22:41.085330,0 days 00:00:00.794098,Tanh,Sigmoid,Leaky,,30,10,11.0,10.0,,0.01578348098967414,3,269,0.6845944350266635,9.101384391312793e-05,112.51998045386338,COMPLETE
251,0.29094040393829346,2023-09-04 21:22:41.085647,2023-09-04 21:22:41.895390,0 days 00:00:00.809743,Tanh,Leaky,Leaky,,25,11,10.0,12.0,,0.021404639246771214,3,348,0.4774314654719223,7.548292955554818e-05,126.68262691123813,COMPLETE
252,0.33058857917785645,2023-09-04 21:22:41.895701,2023-09-04 21:22:42.950533,0 days 00:00:01.054832,Sigmoid,ReLU,Leaky,,29,10,12.0,11.0,,0.014506904970509523,3,338,0.6119112021118648,0.00012119496603446858,154.4462081133309,COMPLETE
253,0.3166348338127136,2023-09-04 21:22:42.950842,2023-09-04 21:22:44.745402,0 days 00:00:01.794560,Tanh,Leaky,Leaky,,27,11,12.0,12.0,,0.0009181342440375273,3,377,0.7675964873723642,0.00015073324210104538,125.33887706658778,COMPLETE
254,0.3237743079662323,2023-09-04 21:22:44.745720,2023-09-04 21:22:45.212847,0 days 00:00:00.467127,Tanh,Leaky,Leaky,,24,9,12.0,14.0,,0.003311700966809983,3,382,0.5028119193198369,0.00010966107148487434,98.34193508441632,COMPLETE
255,0.33173564076423645,2023-09-04 21:22:45.213172,2023-09-04 21:22:46.116751,0 days 00:00:00.903579,Tanh,Leaky,Leaky,,28,10,9.0,13.0,,0.01730968551707585,3,364,0.7355269331574956,6.848698679860524e-05,115.94334151105183,COMPLETE
256,0.4664470851421356,2023-09-04 21:22:46.117088,2023-09-04 21:22:46.897610,0 days 00:00:00.780522,Tanh,Leaky,Leaky,,22,11,11.0,12.0,,0.0012934274757388272,3,281,0.6605630291833711,0.07246707209881324,103.50879263877869,COMPLETE
257,0.28132909536361694,2023-09-04 21:22:46.897935,2023-09-04 21:22:48.963176,0 days 00:00:02.065241,Tanh,Leaky,Leaky,,21,11,18.0,11.0,,0.0041190234868034225,3,328,0.7265732707277551,0.00010336104145904273,84.48639588606984,COMPLETE
258,0.28927847743034363,2023-09-04 21:22:48.963487,2023-09-04 21:22:50.292888,0 days 00:00:01.329401,Tanh,Leaky,Leaky,,21,12,18.0,11.0,,0.004388909289381327,3,312,0.6924040004189957,0.00020729011393628052,87.31180378035003,COMPLETE
259,0.3388941287994385,2023-09-04 21:22:50.293202,2023-09-04 21:22:54.961169,0 days 00:00:04.667967,Tanh,,,,22,11,,,,0.0007798693609867534,1,322,0.5801308955262071,0.00014263734064748362,104.62752605128932,COMPLETE
260,0.48398253321647644,2023-09-04 21:22:54.961663,2023-09-04 21:22:55.839308,0 days 00:00:00.877645,Tanh,Sigmoid,Leaky,,20,1,18.0,7.0,,0.0040272801045789,3,329,0.724610324431219,0.03284357956156438,123.35345628526476,COMPLETE
261,0.3396011292934418,2023-09-04 21:22:55.839620,2023-09-04 21:22:56.280012,0 days 00:00:00.440392,Tanh,Leaky,Tanh,,59,11,17.0,19.0,,0.0018644185595207154,3,257,0.2767615354378923,0.0022114122200245705,107.47205334174924,COMPLETE
262,0.3393009603023529,2023-09-04 21:22:56.280340,2023-09-04 21:22:58.128633,0 days 00:00:01.848293,Leaky,Leaky,Leaky,,23,12,18.0,10.0,,0.0014601353239948615,3,348,0.6880318537634348,0.00022211494892125557,91.04860629311091,COMPLETE
263,0.33343493938446045,2023-09-04 21:22:58.128953,2023-09-04 21:22:59.278700,0 days 00:00:01.149747,Tanh,Leaky,,,15,11,13.0,,,0.011917537568537345,2,337,0.6424287037365437,1.2872616361950017e-05,99.59132021123713,COMPLETE
264,0.3221612870693207,2023-09-04 21:22:59.279021,2023-09-04 21:23:00.054375,0 days 00:00:00.775354,Tanh,Leaky,Leaky,,18,12,19.0,11.0,,0.005455757770821587,3,344,0.7364414865091535,0.0037428527036151298,116.63814798990886,COMPLETE
265,0.324017733335495,2023-09-04 21:23:00.054700,2023-09-04 21:23:01.252984,0 days 00:00:01.198284,Tanh,Leaky,Leaky,,20,13,17.0,14.0,,0.002586768119363627,3,333,0.5469332772613746,0.0001798443983262984,117.06845392499652,COMPLETE
266,0.31404247879981995,2023-09-04 21:23:01.253317,2023-09-04 21:23:03.275685,0 days 00:00:02.022368,ReLU,Leaky,Leaky,,25,11,14.0,20.0,,0.0010637453715433968,3,290,0.7098643338771776,0.000260198597349995,1499.3391137017145,COMPLETE
267,0.31370657682418823,2023-09-04 21:23:03.276006,2023-09-04 21:23:03.918642,0 days 00:00:00.642636,Tanh,Leaky,Leaky,,61,12,4.0,24.0,,0.010923862972508074,3,355,0.7567189878976376,0.0028929382838373957,107.13038635253906,COMPLETE
268,0.29942941665649414,2023-09-04 21:23:03.918971,2023-09-04 21:23:05.001208,0 days 00:00:01.082237,Tanh,Leaky,Leaky,,31,11,15.0,22.0,,0.0038461946935583703,3,272,0.6705667520110346,0.0014949238741011302,100.41258575956701,COMPLETE
269,0.44286754727363586,2023-09-04 21:23:05.001522,2023-09-04 21:23:23.822746,0 days 00:00:18.821224,Tanh,Sigmoid,Leaky,,16,10,16.0,2.0,,4.0023480903084085e-05,3,345,0.7982256008125375,0.0002347199940985013,135.39115275507388,COMPLETE
270,0.3376321792602539,2023-09-04 21:23:23.823065,2023-09-04 21:23:28.039406,0 days 00:00:04.216341,Tanh,Leaky,Leaky,,22,13,14.0,15.0,,0.0006237409824413378,3,322,0.6356457378901825,0.0017357384403804037,102.24507556744476,COMPLETE
271,0.30662086606025696,2023-09-04 21:23:28.039940,2023-09-04 21:23:29.369082,0 days 00:00:01.329142,Tanh,Leaky,Leaky,,58,11,18.0,13.0,,0.012977421873645147,3,359,0.7246625829922021,0.0002968306947610842,98.45405726962619,COMPLETE
272,0.3189579248428345,2023-09-04 21:23:29.369616,2023-09-04 21:23:31.486137,0 days 00:00:02.116521,ReLU,Leaky,Leaky,,17,12,13.0,14.0,,0.0021584134484342937,3,264,0.5152227770194713,0.00017910000449208738,98.0467723608017,COMPLETE
273,0.36108216643333435,2023-09-04 21:23:31.486447,2023-09-04 21:23:34.971776,0 days 00:00:03.485329,Tanh,Leaky,Leaky,,19,10,15.0,3.0,,0.0015618570491933656,3,299,0.7553073807907411,0.00036768644808581275,93.68316519973625,COMPLETE
274,0.34919244050979614,2023-09-04 21:23:34.972093,2023-09-04 21:23:37.356766,0 days 00:00:02.384673,Tanh,Leaky,Leaky,,24,22,14.0,7.0,,0.0008550528761077028,3,335,0.6918001922980648,0.0026322827010230336,95.73065105619885,COMPLETE
275,0.35216742753982544,2023-09-04 21:23:37.357091,2023-09-04 21:23:41.074765,0 days 00:00:03.717674,Sigmoid,Leaky,Leaky,,21,11,17.0,16.0,,0.001239427655295001,3,354,0.7220084887693359,0.00011944650496877205,107.1876974508796,COMPLETE
276,0.3509066700935364,2023-09-04 21:23:41.075076,2023-09-04 21:23:42.311707,0 days 00:00:01.236631,Tanh,ReLU,Leaky,,55,12,16.0,11.0,,0.006084100691472495,3,248,0.7754978704608572,0.0070800832058568845,140.77378919850224,COMPLETE
277,0.33777567744255066,2023-09-04 21:23:42.312033,2023-09-04 21:23:42.947591,0 days 00:00:00.635558,Tanh,Leaky,Leaky,,13,16,15.0,9.0,,0.009846010059928169,3,372,0.45137188285963015,0.0010735325935358453,98.6396640141805,COMPLETE
278,0.3353162407875061,2023-09-04 21:23:42.947910,2023-09-04 21:23:44.997909,0 days 00:00:02.049999,Tanh,Sigmoid,Leaky,,34,15,19.0,4.0,,0.0010074580875313601,3,339,0.66761071409674,0.0002085016627246447,103.10911659302751,COMPLETE
