number,value,datetime_start,datetime_complete,duration,params_activation1,params_activation2,params_activation3,params_activation4,params_batch_size,params_fl1,params_fl2,params_fl3,params_fl4,params_learning_rate,params_n_layers,params_num_epochs,params_train_size,params_weight_decay,user_attrs_mre,state
1575,0.5525221824645996,2023-09-04 22:06:33.992481,2023-09-04 22:06:41.940524,0 days 00:00:07.948043,ReLU,Tanh,Sigmoid,,35,19,24.0,16.0,,8.338766342268093e-05,3,209,0.4885107930427283,0.0006144692845668858,440.56114948765514,COMPLETE
1576,0.30562329292297363,2023-09-04 22:06:41.941510,2023-09-04 22:06:44.398526,0 days 00:00:02.457016,ReLU,Leaky,Leaky,,28,9,23.0,22.0,,0.010540546398598962,3,370,0.753192833608134,2.8516725161183756e-05,208.76138259425306,COMPLETE
1577,0.483319491147995,2023-09-04 22:06:44.399505,2023-09-04 22:06:45.247197,0 days 00:00:00.847692,ReLU,Leaky,ReLU,,43,21,22.0,24.0,,0.07614604827759681,3,171,0.6833034181784945,0.0002832663655347828,152.22332872663225,COMPLETE
1578,0.3191186189651489,2023-09-04 22:06:45.248163,2023-09-04 22:06:53.128237,0 days 00:00:07.880074,Sigmoid,Tanh,Leaky,,37,22,21.0,9.0,,0.0028215501639517805,3,191,0.7719026189285687,5.0738613846859615e-05,451.21729964661085,COMPLETE
1579,0.479839026927948,2023-09-04 22:06:53.129223,2023-09-04 22:06:53.828411,0 days 00:00:00.699188,ReLU,Leaky,Leaky,Leaky,33,20,20.0,23.0,13.0,0.0073060098230684975,4,203,0.13470835551747437,1.3406783364489192e-05,211.48538069291547,COMPLETE
1580,0.39395222067832947,2023-09-04 22:06:53.829442,2023-09-04 22:07:07.105865,0 days 00:00:13.276423,ReLU,Leaky,Tanh,,30,20,3.0,15.0,,0.00010283601567794034,3,237,0.6562350473772839,0.00021584156642577457,194.4654568056517,COMPLETE
1581,0.35906699299812317,2023-09-04 22:07:07.106861,2023-09-04 22:07:08.592471,0 days 00:00:01.485610,ReLU,Tanh,Leaky,,40,23,23.0,8.0,,0.00917492522901588,3,115,0.5337681871296801,7.071399319861589e-05,1340.5730321547564,COMPLETE
1582,0.9537296891212463,2023-09-04 22:07:08.593455,2023-09-04 22:07:09.579267,0 days 00:00:00.985812,ReLU,Leaky,Sigmoid,,35,17,22.0,20.0,,0.0023930719120799013,3,435,0.72742232523013,0.06287997132509206,101.12465529008345,COMPLETE
1583,0.44187793135643005,2023-09-04 22:07:09.580269,2023-09-04 22:07:16.734870,0 days 00:00:07.154601,ReLU,Leaky,Leaky,,45,18,21.0,10.0,,0.00019827663553252653,3,147,0.7710486243456861,0.0001290779570007877,771.2752805956367,COMPLETE
1584,0.5285372138023376,2023-09-04 22:07:16.735847,2023-09-04 22:07:18.050721,0 days 00:00:01.314874,Sigmoid,Tanh,ReLU,,32,19,19.0,8.0,,0.02053602609436414,3,180,0.15601577741753528,0.010648361753117676,195.7212697982788,COMPLETE
1585,0.2733966112136841,2023-09-04 22:07:18.051678,2023-09-04 22:07:22.562652,0 days 00:00:04.510974,ReLU,Leaky,Leaky,Leaky,42,21,22.0,22.0,6.0,0.0012022682486303787,4,209,0.7027582217787663,0.00017170103317483854,218.7980646133423,COMPLETE
1586,0.43926799297332764,2023-09-04 22:07:22.563637,2023-09-04 22:07:31.135184,0 days 00:00:08.571547,ReLU,Leaky,Leaky,,38,19,20.0,7.0,,0.00036273135547135876,3,226,0.7457702628762042,8.892459130257109e-05,138.89954088996438,COMPLETE
1587,0.36784645915031433,2023-09-04 22:07:31.136607,2023-09-04 22:07:32.168836,0 days 00:00:01.032229,ReLU,Sigmoid,Tanh,,52,20,18.0,23.0,,0.005022404292889463,3,192,0.25629326098163563,0.002224089333803999,1074.5958367919923,COMPLETE
1588,0.32292640209198,2023-09-04 22:07:32.169846,2023-09-04 22:07:37.663862,0 days 00:00:05.494016,ReLU,Tanh,Leaky,,29,18,23.0,18.0,,0.0008262127663454491,3,219,0.7716903148747366,1.8610549722379833e-05,150.30517085518423,COMPLETE
1589,0.9645674824714661,2023-09-04 22:07:37.664492,2023-09-04 22:07:38.302600,0 days 00:00:00.638108,Leaky,Leaky,Sigmoid,Sigmoid,36,15,10.0,9.0,5.0,0.00016443710469131294,4,73,0.20443344456308457,3.3601028576544e-05,114.09182248050219,COMPLETE
1590,0.3259449303150177,2023-09-04 22:07:38.303120,2023-09-04 22:07:39.359749,0 days 00:00:01.056629,ReLU,Leaky,Leaky,,25,22,21.0,17.0,,0.013110554493045353,3,166,0.7296570263413369,0.00034267999034111524,135.7792929572028,COMPLETE
1591,0.6867454051971436,2023-09-04 22:07:39.360279,2023-09-04 22:07:39.742695,0 days 00:00:00.382416,Tanh,Tanh,ReLU,,34,19,24.0,22.0,,0.001857539612865549,3,198,0.13817682951022964,0.0017064607411145486,191.56120313677872,COMPLETE
1592,0.2824426293373108,2023-09-04 22:07:39.743202,2023-09-04 22:07:40.912461,0 days 00:00:01.169259,ReLU,Leaky,Leaky,,31,21,23.0,21.0,,0.004175251548167514,3,185,0.6284104534426816,0.005979410774955506,116.5866543856534,COMPLETE
1593,0.3296527862548828,2023-09-04 22:07:40.912958,2023-09-04 22:07:41.874968,0 days 00:00:00.962010,Sigmoid,Leaky,Leaky,ReLU,48,20,11.0,19.0,10.0,0.0029900165916832587,4,208,0.2909428754386135,4.3601309025926625e-05,178.08559770343683,COMPLETE
1594,0.30979496240615845,2023-09-04 22:07:41.875491,2023-09-04 22:07:42.424395,0 days 00:00:00.548904,ReLU,Leaky,Tanh,,39,22,22.0,10.0,,0.005893839783427745,3,177,0.5904006529362976,0.00127846054269509,181.8099217414856,COMPLETE
1595,0.34193798899650574,2023-09-04 22:07:42.424880,2023-09-04 22:07:43.714631,0 days 00:00:01.289751,ReLU,Tanh,Leaky,,36,18,21.0,8.0,,0.0013687653860066566,3,233,0.7999631747349005,0.0002409528958172037,510.5805898030599,COMPLETE
1596,0.3061450719833374,2023-09-04 22:07:43.715168,2023-09-04 22:07:44.260016,0 days 00:00:00.544848,ReLU,Leaky,Sigmoid,,57,19,22.0,24.0,,0.017222943605490672,3,156,0.6898208643166338,0.0008163209389088639,157.67067173549108,COMPLETE
1597,0.5609090924263,2023-09-04 22:07:44.260500,2023-09-04 22:07:46.660244,0 days 00:00:02.399744,ReLU,Leaky,Leaky,,64,20,8.0,14.0,,6.0676987168282414e-05,3,198,0.7473133445579278,0.000148386045209819,603.6761249580769,COMPLETE
1598,0.31548166275024414,2023-09-04 22:07:46.660817,2023-09-04 22:07:48.535944,0 days 00:00:01.875127,ReLU,Tanh,ReLU,Leaky,33,20,20.0,23.0,1.0,0.0036457380755130038,4,132,0.7726947124368191,1.2000523020275593e-05,323.12580037434896,COMPLETE
1599,0.6740111708641052,2023-09-04 22:07:48.536463,2023-09-04 22:07:49.641794,0 days 00:00:01.105331,Sigmoid,Sigmoid,Leaky,,41,19,21.0,7.0,,0.000504870052776385,3,99,0.4172066513360929,0.022818938694945244,296.3090125103386,COMPLETE
1600,0.43252021074295044,2023-09-04 22:07:49.642332,2023-09-04 22:07:51.411898,0 days 00:00:01.769566,ReLU,Leaky,Leaky,,27,21,12.0,9.0,,0.00012968180842221,3,217,0.24630437010974002,1.6598922326044294e-05,141.1148939704016,COMPLETE
1601,0.4241616129875183,2023-09-04 22:07:51.412421,2023-09-04 22:07:51.752803,0 days 00:00:00.340382,ReLU,Leaky,Tanh,,30,18,23.0,5.0,,0.011427876657058557,3,187,0.14178350221219146,0.0001739110781270029,158.0591573300569,COMPLETE
1602,0.4706912636756897,2023-09-04 22:07:51.753319,2023-09-04 22:07:52.112091,0 days 00:00:00.358772,ReLU,Tanh,Leaky,,37,17,19.0,8.0,,0.007932528107408555,3,209,0.18900186241389158,2.1005255566704243e-05,156.56575824903405,COMPLETE
1603,0.3650329113006592,2023-09-04 22:07:52.112606,2023-09-04 22:07:53.071064,0 days 00:00:00.958458,ReLU,Leaky,Sigmoid,,32,20,17.0,24.0,,0.014642141130730743,3,245,0.7152264316089899,0.0004870505569650141,366.75338866493917,COMPLETE
1604,0.3234674334526062,2023-09-04 22:07:53.071598,2023-09-04 22:07:53.613169,0 days 00:00:00.541571,ReLU,Leaky,Leaky,Leaky,35,19,22.0,22.0,8.0,0.029421278689097986,4,175,0.5039580582922704,2.6812565871807098e-05,216.5123545328776,COMPLETE
1605,0.3847152590751648,2023-09-04 22:07:53.613690,2023-09-04 22:07:58.289360,0 days 00:00:04.675670,Sigmoid,Tanh,Leaky,,43,21,20.0,23.0,,0.0007115273329145327,3,228,0.7486950689411931,6.086028928316819e-05,241.7935337035124,COMPLETE
1606,0.4637511968612671,2023-09-04 22:07:58.289863,2023-09-04 22:07:58.629507,0 days 00:00:00.339644,ReLU,Leaky,ReLU,,39,20,9.0,9.0,,0.0025259767209136934,3,196,0.13099884796536612,0.00010837536756470075,232.58703913833156,COMPLETE
1607,0.41743820905685425,2023-09-04 22:07:58.630023,2023-09-04 22:07:59.097869,0 days 00:00:00.467846,ReLU,Leaky,Leaky,,29,23,18.0,6.0,,0.010181377883882186,3,163,0.2207726455496652,0.00013173591008455444,344.2154319331331,COMPLETE
1608,0.5378791093826294,2023-09-04 22:07:59.098397,2023-09-04 22:07:59.427723,0 days 00:00:00.329326,ReLU,Tanh,Tanh,Tanh,33,19,22.0,16.0,5.0,0.001001017656511138,4,50,0.11984611909192582,3.661119732486408e-05,216.47719177246094,COMPLETE
1609,0.31767261028289795,2023-09-04 22:07:59.428295,2023-09-04 22:08:00.295028,0 days 00:00:00.866733,Leaky,Leaky,,,45,18,21.0,,,0.0032168694921009557,2,203,0.6565859141405084,0.0002065444886930186,117.2780249152385,COMPLETE
1610,0.521573007106781,2023-09-04 22:08:00.295501,2023-09-04 22:08:05.323297,0 days 00:00:05.027796,ReLU,Leaky,Leaky,,31,21,23.0,8.0,,5.007308491907294e-05,3,223,0.7981895918426317,0.007756247015374836,583.1638386131937,COMPLETE
1611,0.5108551383018494,2023-09-04 22:08:05.323794,2023-09-04 22:08:05.866660,0 days 00:00:00.542866,ReLU,Sigmoid,Sigmoid,,23,20,24.0,7.0,,0.0016326174695778658,3,184,0.36190752878990196,8.303803690546245e-05,1789.7451245857008,COMPLETE
1612,0.31076738238334656,2023-09-04 22:08:05.867171,2023-09-04 22:08:07.340069,0 days 00:00:01.472898,ReLU,Tanh,Leaky,,37,19,19.0,10.0,,0.002101569791032521,3,171,0.7094144270383832,0.0002819384758791858,140.5367438233929,COMPLETE
1613,0.236981600522995,2023-09-04 22:08:07.340577,2023-09-04 22:08:08.594546,0 days 00:00:01.253969,Sigmoid,Leaky,ReLU,,42,19,10.0,22.0,,0.009023414988340505,3,215,0.7691594409092735,4.649378348995799e-05,480.75338610480816,COMPLETE
1614,0.7125197649002075,2023-09-04 22:08:08.595058,2023-09-04 22:08:13.180801,0 days 00:00:04.585743,Sigmoid,Leaky,ReLU,Leaky,39,17,20.0,22.0,12.0,4.7029939260075085e-05,4,221,0.7706314866325155,4.9029349574202445e-05,156.94055593499232,COMPLETE
1615,0.2816654443740845,2023-09-04 22:08:13.181458,2023-09-04 22:08:14.282060,0 days 00:00:01.100602,Sigmoid,Leaky,ReLU,,41,24,21.0,21.0,,0.01404522394282709,3,240,0.7652985299899753,5.08309843706318e-05,210.713213001598,COMPLETE
1616,0.37261947989463806,2023-09-04 22:08:14.282572,2023-09-04 22:08:16.234993,0 days 00:00:01.952421,Sigmoid,Leaky,ReLU,,35,20,22.0,22.0,,0.004678145630259557,3,235,0.7994756090721027,6.164153044944426e-05,233.00941449542378,COMPLETE
1617,0.5771400928497314,2023-09-04 22:08:16.235509,2023-09-04 22:08:17.061377,0 days 00:00:00.825868,Sigmoid,Leaky,ReLU,,40,22,14.0,21.0,,0.00014375287604347165,3,228,0.1284173151929766,4.147131669595499e-05,184.66343960009124,COMPLETE
1618,0.26141253113746643,2023-09-04 22:08:17.061890,2023-09-04 22:08:20.348469,0 days 00:00:03.286579,Sigmoid,Leaky,ReLU,,38,18,23.0,21.0,,0.01974486910462164,3,215,0.7998930684209937,4.145451470451417e-05,146.8532718365009,COMPLETE
1619,0.891183078289032,2023-09-04 22:08:20.349415,2023-09-04 22:08:22.605234,0 days 00:00:02.255819,Sigmoid,Leaky,ReLU,,34,20,21.0,22.0,,1.024918663671767e-05,3,225,0.21428711999848213,3.192228713864937e-05,104.07128495958116,COMPLETE
1620,0.5667864084243774,2023-09-04 22:08:22.605707,2023-09-04 22:08:31.455279,0 days 00:00:08.849572,Sigmoid,Leaky,ReLU,ReLU,29,21,23.0,22.0,23.0,3.4048971750369343e-05,4,234,0.745989170029465,5.3618755579178143e-05,243.30861129108658,COMPLETE
1621,0.30736738443374634,2023-09-04 22:08:31.455825,2023-09-04 22:08:32.118567,0 days 00:00:00.662742,Sigmoid,Leaky,ReLU,,37,19,22.0,22.0,,0.011821404733306671,3,218,0.3088433701363343,6.692590032354251e-05,152.7172652024489,COMPLETE
1622,0.30375203490257263,2023-09-04 22:08:32.119137,2023-09-04 22:08:37.131167,0 days 00:00:05.012030,Sigmoid,Leaky,ReLU,,32,19,24.0,21.0,,0.0005890185162233284,3,215,0.7676854234105602,3.482697250672117e-05,280.99301793298054,COMPLETE
1623,0.39194566011428833,2023-09-04 22:08:37.131774,2023-09-04 22:08:37.631368,0 days 00:00:00.499594,Sigmoid,Leaky,ReLU,,27,18,20.0,22.0,,0.006896376685366292,3,244,0.17742451080415683,4.783953293849381e-05,600.1902196851827,COMPLETE
1624,0.4390741288661957,2023-09-04 22:08:37.632338,2023-09-04 22:08:38.526477,0 days 00:00:00.894139,Sigmoid,Leaky,ReLU,Leaky,41,20,22.0,22.0,9.0,0.0028110054538597507,4,62,0.3843665634045969,4.0211894154297437e-05,257.0036218704716,COMPLETE
1625,0.2406151443719864,2023-09-04 22:08:38.527019,2023-09-04 22:08:39.583657,0 days 00:00:01.056638,Sigmoid,Leaky,ReLU,,34,22,16.0,21.0,,0.00944320978108683,3,222,0.7423468970483553,2.4951248580292776e-05,128.602993177331,COMPLETE
1626,0.3501110076904297,2023-09-04 22:08:39.584266,2023-09-04 22:08:40.799792,0 days 00:00:01.215526,Sigmoid,Leaky,ReLU,,36,23,16.0,21.0,,0.008742301310563494,3,233,0.4280705598386001,2.80006961612313e-05,433.62225107046277,COMPLETE
1627,0.3466445505619049,2023-09-04 22:08:40.800344,2023-09-04 22:08:42.215393,0 days 00:00:01.415049,Sigmoid,Leaky,ReLU,,39,23,17.0,22.0,,0.009043064632788452,3,227,0.7993671717155015,3.20040803943932e-05,143.44600522518158,COMPLETE
1628,0.3641304075717926,2023-09-04 22:08:42.215961,2023-09-04 22:08:42.794500,0 days 00:00:00.578539,Sigmoid,Leaky,ReLU,,38,22,16.0,22.0,,0.007372883592247768,3,224,0.19540341499901318,2.554436468561958e-05,138.79344102812976,COMPLETE
1629,0.6855487823486328,2023-09-04 22:08:42.795094,2023-09-04 22:08:43.177517,0 days 00:00:00.382423,Sigmoid,Leaky,,,36,22,17.0,,,0.006682867412241527,2,216,0.7486590390563641,0.09953924723405481,184.0169049431296,COMPLETE
1630,0.3403867483139038,2023-09-04 22:08:43.178113,2023-09-04 22:08:44.048535,0 days 00:00:00.870422,Sigmoid,Leaky,ReLU,Sigmoid,34,22,15.0,22.0,17.0,0.009591995882467431,4,231,0.3524688980675071,2.325079298502784e-05,149.57596838474274,COMPLETE
1631,0.49238893389701843,2023-09-04 22:08:44.049050,2023-09-04 22:08:44.464413,0 days 00:00:00.415363,Sigmoid,Leaky,ReLU,,54,23,16.0,20.0,,0.005924381968115649,3,246,0.21549533613830366,3.2118960838632616e-05,1052.5087275071578,COMPLETE
1632,0.3586837351322174,2023-09-04 22:08:44.465236,2023-09-04 22:08:45.191166,0 days 00:00:00.725930,Sigmoid,Leaky,ReLU,,42,22,14.0,21.0,,0.01039644961966779,3,226,0.7707898483934509,3.8640723810203955e-05,295.96651593376606,COMPLETE
1633,0.3866329789161682,2023-09-04 22:08:45.191678,2023-09-04 22:08:45.741099,0 days 00:00:00.549421,Sigmoid,Leaky,ReLU,,40,22,18.0,21.0,,0.007288707262497299,3,232,0.39032144667901736,1.0049816686701015e-05,132.66653069784476,COMPLETE
1634,0.5440024733543396,2023-09-04 22:08:45.741765,2023-09-04 22:08:50.492655,0 days 00:00:04.750890,Sigmoid,Leaky,ReLU,,35,23,18.0,20.0,,3.470996670904941e-05,3,235,0.7427362094944403,4.7086705239179585e-05,204.86916185744266,COMPLETE
1635,0.47207221388816833,2023-09-04 22:08:50.493179,2023-09-04 22:08:54.881718,0 days 00:00:04.388539,Sigmoid,Leaky,ReLU,Leaky,37,22,17.0,22.0,7.0,0.00025496049844495706,4,239,0.5733123770097359,5.92917442492056e-05,192.30931206228345,COMPLETE
1636,0.3382704555988312,2023-09-04 22:08:54.882376,2023-09-04 22:08:55.847933,0 days 00:00:00.965557,Sigmoid,Leaky,ReLU,,33,22,19.0,15.0,,0.008161794565090592,3,223,0.44972562981675435,2.3195627007424846e-05,155.3102770608569,COMPLETE
1637,0.2917325794696808,2023-09-04 22:08:55.848511,2023-09-04 22:08:57.305594,0 days 00:00:01.457083,Sigmoid,Leaky,ReLU,,39,23,19.0,21.0,,0.003881794428520828,3,240,0.7712197769793667,3.126260583719129e-05,181.08588270707563,COMPLETE
1638,0.2887393534183502,2023-09-04 22:08:57.306221,2023-09-04 22:08:58.674955,0 days 00:00:01.368734,Sigmoid,Leaky,ReLU,,35,22,17.0,9.0,,0.010453433110726907,3,221,0.7292937289249515,4.601072144470709e-05,279.3607813517253,COMPLETE
1639,0.29653847217559814,2023-09-04 22:08:58.675517,2023-09-04 22:09:00.323485,0 days 00:00:01.647968,Sigmoid,Leaky,ReLU,,42,22,18.0,8.0,,0.005379680152133431,3,217,0.7740590447577949,3.7587447800432265e-05,177.78277115594773,COMPLETE
1640,0.31935930252075195,2023-09-04 22:09:00.324054,2023-09-04 22:09:01.858847,0 days 00:00:01.534793,Sigmoid,Leaky,ReLU,ReLU,31,24,18.0,18.0,16.0,0.001978092548222597,4,226,0.4599868758136939,2.7608050717175987e-05,381.32141592336257,COMPLETE
1641,0.40209895372390747,2023-09-04 22:09:01.859565,2023-09-04 22:09:02.954962,0 days 00:00:01.095397,Sigmoid,Leaky,ReLU,,37,23,17.0,22.0,,0.0014071931910198052,3,247,0.3989361904352681,3.805452144660831e-05,137.0937053135463,COMPLETE
1642,0.32304197549819946,2023-09-04 22:09:02.955524,2023-09-04 22:09:05.158343,0 days 00:00:02.202819,Sigmoid,Leaky,ReLU,,33,22,17.0,19.0,,0.0034406818825425843,3,210,0.7991439552191183,6.881870987827547e-05,384.905379570855,COMPLETE
1643,0.528444766998291,2023-09-04 22:09:05.159277,2023-09-04 22:09:09.471406,0 days 00:00:04.312129,Sigmoid,Leaky,ReLU,,38,23,18.0,7.0,,9.775456902168018e-05,3,229,0.745204465567404,5.674380415841907e-05,237.25763032738297,COMPLETE
1644,0.388363242149353,2023-09-04 22:09:09.471928,2023-09-04 22:09:10.943200,0 days 00:00:01.471272,Sigmoid,Leaky,ReLU,Leaky,30,22,16.0,22.0,4.0,0.0024483949584534316,4,213,0.3327325580689536,2.9484760745814973e-05,169.6275656457041,COMPLETE
1645,0.3027351498603821,2023-09-04 22:09:10.943762,2023-09-04 22:09:14.449895,0 days 00:00:03.506133,Sigmoid,Leaky,ReLU,,40,22,19.0,17.0,,0.0008370249197889729,3,221,0.7238402850372606,5.014135645125347e-05,220.67979576276696,COMPLETE
1646,0.5435216426849365,2023-09-04 22:09:14.450447,2023-09-04 22:09:17.826035,0 days 00:00:03.375588,Sigmoid,Leaky,ReLU,,51,22,16.0,8.0,,7.661830573346195e-05,3,215,0.770040544915633,1.3465173404227537e-05,253.88942555272303,COMPLETE
1647,1.0161306858062744,2023-09-04 22:09:17.826584,2023-09-04 22:09:18.162609,0 days 00:00:00.336025,Sigmoid,ReLU,ReLU,,59,23,15.0,6.0,,0.011943507432808819,3,87,0.7466204988411654,7.594213513035149e-05,100.47931569417318,COMPLETE
1648,0.36606383323669434,2023-09-04 22:09:18.163123,2023-09-04 22:09:18.842314,0 days 00:00:00.679191,Sigmoid,Leaky,ReLU,,35,22,13.0,9.0,,0.08249004189277474,3,397,0.7714559008384668,2.474257145484292e-05,156.74850576895255,COMPLETE
1649,0.48050281405448914,2023-09-04 22:09:18.842985,2023-09-04 22:09:20.308720,0 days 00:00:01.465735,Sigmoid,Leaky,ReLU,Leaky,25,5,19.0,9.0,3.0,0.009400262618123927,4,253,0.7164204140235703,0.010098660843058717,218.5239314203677,COMPLETE
1650,0.42537781596183777,2023-09-04 22:09:20.309289,2023-09-04 22:09:32.161309,0 days 00:00:11.852020,Sigmoid,Sigmoid,ReLU,,12,21,18.0,21.0,,0.00031574153215670534,3,234,0.7395440474571631,4.5840571888677875e-05,220.68801680143298,COMPLETE
1651,0.3879212737083435,2023-09-04 22:09:32.161880,2023-09-04 22:09:32.761152,0 days 00:00:00.599272,Sigmoid,Leaky,ReLU,,32,21,20.0,8.0,,0.005605204700197288,3,211,0.23885137990787597,2.0174909339541014e-05,145.76691535667138,COMPLETE
1652,0.4129987061023712,2023-09-04 22:09:32.761740,2023-09-04 22:09:33.992247,0 days 00:00:01.230507,Sigmoid,Leaky,ReLU,,28,18,15.0,18.0,,0.004230597568100229,3,145,0.24652334350428912,3.466473840563612e-05,192.83922754332076,COMPLETE
1653,0.2749702036380768,2023-09-04 22:09:33.992946,2023-09-04 22:09:36.232294,0 days 00:00:02.239348,Sigmoid,Leaky,ReLU,,34,17,20.0,11.0,,0.008250886777408916,3,222,0.7724429957580464,5.9974171817067605e-05,120.10717442059757,COMPLETE
1654,0.5098845362663269,2023-09-04 22:09:36.232804,2023-09-04 22:09:37.162185,0 days 00:00:00.929381,Sigmoid,Leaky,ReLU,Tanh,43,14,19.0,10.0,14.0,0.00042933740567699716,4,231,0.10456424467025216,0.0014654793228258362,153.94244599445557,COMPLETE
1655,0.3091602921485901,2023-09-04 22:09:37.162698,2023-09-04 22:09:40.759082,0 days 00:00:03.596384,Sigmoid,Leaky,ReLU,,37,22,20.0,22.0,,0.0010881544578487238,3,240,0.6880006516994915,1.1520710937998565e-05,870.3001900809152,COMPLETE
1656,0.4531690180301666,2023-09-04 22:09:40.759638,2023-09-04 22:09:42.115390,0 days 00:00:01.355752,Sigmoid,,,,40,18,,,,0.0029228995934305582,1,210,0.7730814130763994,0.0031165586982381107,2484.246191660563,COMPLETE
1657,0.2961469292640686,2023-09-04 22:09:42.115937,2023-09-04 22:09:43.430479,0 days 00:00:01.314542,Sigmoid,Leaky,ReLU,,30,21,21.0,8.0,,0.011602162377565535,3,219,0.7252009064525378,8.965049085090655e-05,178.04304879171806,COMPLETE
1658,0.2794055938720703,2023-09-04 22:09:43.431031,2023-09-04 22:09:44.894248,0 days 00:00:01.463217,Sigmoid,ReLU,ReLU,,36,21,12.0,22.0,,0.00467426222428527,3,250,0.7485952831754347,0.0010182810669376278,161.66550525266732,COMPLETE
1659,0.823168158531189,2023-09-04 22:09:44.894805,2023-09-04 22:09:50.187077,0 days 00:00:05.292272,Sigmoid,Leaky,ReLU,ReLU,33,16,18.0,20.0,8.0,1.9997620815502865e-05,4,209,0.7973386103593633,4.079984712074912e-05,136.7607936220306,COMPLETE
1660,0.3770025372505188,2023-09-04 22:09:50.187641,2023-09-04 22:09:51.303341,0 days 00:00:01.115700,Sigmoid,Leaky,ReLU,,31,18,19.0,23.0,,0.0022972722752692045,3,240,0.47768673601842965,0.0006070648436204666,167.10522172257706,COMPLETE
1661,1.0236750841140747,2023-09-04 22:09:51.303888,2023-09-04 22:09:51.908076,0 days 00:00:00.604188,Sigmoid,Sigmoid,ReLU,,56,22,21.0,9.0,,0.0016104411389769172,3,78,0.4825939196330748,1.6237995375780488e-05,105.22853238242013,COMPLETE
1662,0.3827168941497803,2023-09-04 22:09:51.908622,2023-09-04 22:09:52.776944,0 days 00:00:00.868322,Sigmoid,Leaky,ReLU,,38,23,11.0,7.0,,0.006999259935158552,3,216,0.32813977027602115,3.0048409814846742e-05,196.24424752523734,COMPLETE
1663,0.4770452380180359,2023-09-04 22:09:52.777593,2023-09-04 22:09:53.654088,0 days 00:00:00.876495,Sigmoid,Leaky,ReLU,,44,21,20.0,9.0,,0.0034390244559399535,3,206,0.2719684011289466,0.0019046888573879866,166.46142578125,COMPLETE
1664,0.622626543045044,2023-09-04 22:09:53.654777,2023-09-04 22:09:54.712287,0 days 00:00:01.057510,Sigmoid,Leaky,ReLU,Leaky,28,17,19.0,8.0,2.0,0.0007011087735052525,4,223,0.16159120692535703,2.2567374109616416e-05,152.5371634630653,COMPLETE
1665,0.8673787713050842,2023-09-04 22:09:54.712896,2023-09-04 22:09:55.763905,0 days 00:00:01.051009,Sigmoid,Leaky,ReLU,,41,18,10.0,17.0,,2.269851778368683e-05,3,228,0.16113953167191242,0.0043103249809828955,100.07064391019051,COMPLETE
1666,0.3640231788158417,2023-09-04 22:09:55.764469,2023-09-04 22:09:56.239071,0 days 00:00:00.474602,Sigmoid,Leaky,ReLU,,34,24,21.0,21.0,,0.057837332216761704,3,137,0.7151437163022074,5.4861934800010256e-05,166.83242543538412,COMPLETE
