number,value,datetime_start,datetime_complete,duration,params_activation1,params_activation2,params_activation3,params_activation4,params_batch_size,params_fl1,params_fl2,params_fl3,params_fl4,params_learning_rate,params_n_layers,params_num_epochs,params_train_size,params_weight_decay,user_attrs_mre,state
1927,0.39106687903404236,2023-09-04 21:42:59.567863,2023-09-04 21:42:59.947781,0 days 00:00:00.379918,Leaky,ReLU,Tanh,,73,4,10.0,11.0,,0.023890376266550332,3,374,0.3150550707164587,0.00039630935072271483,366.3015545654297,COMPLETE
1928,0.34094539284706116,2023-09-04 21:42:59.948301,2023-09-04 21:43:00.857792,0 days 00:00:00.909491,Leaky,ReLU,Tanh,,78,6,9.0,9.0,,0.004554970207463007,3,393,0.641699308387012,0.0004973469661832062,540.329213515572,COMPLETE
1929,0.40907689929008484,2023-09-04 21:43:00.858302,2023-09-04 21:43:01.181172,0 days 00:00:00.322870,Leaky,ReLU,Tanh,,77,7,9.0,8.0,,0.018312645932017806,3,384,0.19224195958006274,0.00011056103677934598,175.79563982058795,COMPLETE
1930,0.5830272436141968,2023-09-04 21:43:01.181705,2023-09-04 21:43:03.020623,0 days 00:00:01.838918,Leaky,Sigmoid,Tanh,,75,2,8.0,12.0,,0.001196549862582426,3,364,0.5364717918275111,3.0344139149294107e-05,474.6553941108811,COMPLETE
1931,0.3605007827281952,2023-09-04 21:43:03.021149,2023-09-04 21:43:03.316633,0 days 00:00:00.295484,Leaky,ReLU,Tanh,,78,11,10.0,14.0,,0.026206526602263507,3,380,0.2611747580510391,0.0007990872183030075,171.9620063418434,COMPLETE
1932,0.2970624268054962,2023-09-04 21:43:03.317158,2023-09-04 21:43:04.116877,0 days 00:00:00.799719,Leaky,ReLU,Tanh,,76,10,10.0,11.0,,0.0038814447364687575,3,399,0.6833380622180006,0.00013117085241519418,127.99714851379395,COMPLETE
1933,0.3314031958580017,2023-09-04 21:43:04.117389,2023-09-04 21:43:05.755784,0 days 00:00:01.638395,Leaky,Sigmoid,Tanh,,79,19,8.0,9.0,,0.0023623669614079314,3,359,0.6600907384303282,0.002985953775452063,135.8843640876539,COMPLETE
1934,0.3452918231487274,2023-09-04 21:43:05.756314,2023-09-04 21:43:06.284727,0 days 00:00:00.528413,Leaky,ReLU,Tanh,,73,8,9.0,10.0,,0.005218203467966,3,378,0.7050116923227278,0.0001841789473237245,264.48569742838544,COMPLETE
1935,0.45159125328063965,2023-09-04 21:43:06.285238,2023-09-04 21:43:09.712314,0 days 00:00:03.427076,Leaky,ReLU,Tanh,,74,4,10.0,8.0,,0.00026304779609697494,3,364,0.6223470140035157,9.088087790653596e-05,172.58277515788654,COMPLETE
1936,0.3585144877433777,2023-09-04 21:43:09.712837,2023-09-04 21:43:10.598340,0 days 00:00:00.885503,Leaky,Sigmoid,Tanh,,77,8,10.0,13.0,,0.001905572710773885,3,372,0.6082858459860249,0.00107653947877357,871.4293332903572,COMPLETE
1937,0.9518723487854004,2023-09-04 21:43:10.598893,2023-09-04 21:43:13.146415,0 days 00:00:02.547522,Leaky,ReLU,Tanh,,78,4,9.0,7.0,,1.751497255052678e-05,3,389,0.45944472100977,0.00015085018768705273,102.39497448055788,COMPLETE
1938,0.5448712706565857,2023-09-04 21:43:13.146936,2023-09-04 21:43:16.588588,0 days 00:00:03.441652,Leaky,Sigmoid,Tanh,,74,9,9.0,12.0,,6.867427648192005e-05,3,397,0.5995970689670151,0.00010565605007913587,207.86843476187371,COMPLETE
1939,0.5991172194480896,2023-09-04 21:43:16.589121,2023-09-04 21:43:19.375364,0 days 00:00:02.786243,Leaky,ReLU,Tanh,,79,5,10.0,14.0,,4.464668545273459e-05,3,352,0.512479872228137,0.00022245621701559985,173.7727192098444,COMPLETE
1940,0.9326460957527161,2023-09-04 21:43:19.375929,2023-09-04 21:43:20.341809,0 days 00:00:00.965880,Leaky,ReLU,Tanh,,76,4,10.0,10.0,,3.7190507641325e-05,3,368,0.13457585841190323,5.5785977903999675e-05,106.83742054649021,COMPLETE
1941,0.445919930934906,2023-09-04 21:43:20.342321,2023-09-04 21:43:21.245003,0 days 00:00:00.902682,Leaky,Sigmoid,Sigmoid,,79,3,18.0,11.0,,0.006390465618096137,3,377,0.2169947167881162,0.00012388076391734102,139.82778227798582,COMPLETE
1942,0.4453139007091522,2023-09-04 21:43:21.245517,2023-09-04 21:43:22.064417,0 days 00:00:00.818900,Leaky,ReLU,Tanh,,76,2,8.0,8.0,,0.02278612553193663,3,385,0.40435400615100925,0.0018109625996309824,199.24989536830358,COMPLETE
1943,0.5596956014633179,2023-09-04 21:43:22.065411,2023-09-04 21:43:24.536551,0 days 00:00:02.471140,Leaky,Sigmoid,Sigmoid,,74,7,10.0,9.0,,0.0009411290394588914,3,399,0.24567391162522265,0.0014447060159794778,752.8109508443762,COMPLETE
1944,0.38919153809547424,2023-09-04 21:43:24.537063,2023-09-04 21:43:24.929093,0 days 00:00:00.392030,Leaky,ReLU,Leaky,,80,7,9.0,9.0,,0.01469798075621499,3,374,0.28372472382504327,0.00018379984015826566,176.00571233575994,COMPLETE
1945,0.46761882305145264,2023-09-04 21:43:24.929605,2023-09-04 21:43:25.234824,0 days 00:00:00.305219,Leaky,ReLU,Tanh,,71,5,9.0,13.0,,0.02795449701013915,3,357,0.6610345856620835,0.00028102937945677706,174.92843882242838,COMPLETE
1946,0.3174287974834442,2023-09-04 21:43:25.235326,2023-09-04 21:43:26.553170,0 days 00:00:01.317844,Leaky,Sigmoid,Sigmoid,,77,5,8.0,10.0,,0.018712651320223546,3,387,0.7131433890681163,8.155254427444906e-05,299.5758299992002,COMPLETE
1947,0.574782133102417,2023-09-04 21:43:26.553688,2023-09-04 21:43:27.123580,0 days 00:00:00.569892,Leaky,ReLU,ReLU,,80,1,10.0,15.0,,0.007455280535310387,3,365,0.7503626235099619,0.00015826846842926403,231.16311357286241,COMPLETE
1948,0.3974352777004242,2023-09-04 21:43:27.124107,2023-09-04 21:43:27.968338,0 days 00:00:00.844231,Leaky,ReLU,Sigmoid,,78,5,10.0,6.0,,0.0014624349964554172,3,394,0.4678141167664312,0.0006284438567746046,211.17249090021306,COMPLETE
1949,0.3696388900279999,2023-09-04 21:43:27.968839,2023-09-04 21:43:28.516434,0 days 00:00:00.547595,Leaky,Sigmoid,Tanh,,75,21,9.0,11.0,,0.003042045898722603,3,378,0.3865991522810758,0.00010221049285306312,129.42159610324435,COMPLETE
1950,0.4256512522697449,2023-09-04 21:43:28.516999,2023-09-04 21:43:28.925880,0 days 00:00:00.408881,Leaky,ReLU,Sigmoid,,78,8,10.0,12.0,,0.011618783647209053,3,405,0.331277439431131,2.3100786751404502e-05,140.86494840894426,COMPLETE
1951,0.3553425371646881,2023-09-04 21:43:28.926449,2023-09-04 21:43:29.584961,0 days 00:00:00.658512,Leaky,Sigmoid,Tanh,,74,6,9.0,7.0,,0.021193408419760505,3,358,0.5748115602988111,0.004154874119303515,265.48093106453877,COMPLETE
1952,0.4465829133987427,2023-09-04 21:43:29.585494,2023-09-04 21:43:30.097119,0 days 00:00:00.511625,Leaky,ReLU,Sigmoid,,72,10,10.0,14.0,,0.014686968756298867,3,372,0.6898940463465403,0.0001300859633727056,280.8966303116236,COMPLETE
1953,0.6064118146896362,2023-09-04 21:43:30.097665,2023-09-04 21:43:33.889493,0 days 00:00:03.791828,Leaky,ReLU,Tanh,,80,8,10.0,11.0,,3.067447406187484e-05,3,370,0.7705688561887247,6.939599796581534e-05,167.85682968964448,COMPLETE
1954,0.3414013683795929,2023-09-04 21:43:33.890020,2023-09-04 21:43:34.577782,0 days 00:00:00.687762,Leaky,Sigmoid,Leaky,,76,6,8.0,5.0,,0.008996675975401153,3,390,0.7222287811240519,4.019222372412718e-05,237.26682505114326,COMPLETE
1955,1.0167803764343262,2023-09-04 21:43:34.578334,2023-09-04 21:43:38.637274,0 days 00:00:04.058940,Leaky,ReLU,Sigmoid,,81,5,9.0,8.0,,1.247514842120861e-05,3,383,0.7990414175069231,0.00023185274312647938,128.98309744493767,COMPLETE
1956,0.4321163594722748,2023-09-04 21:43:38.637824,2023-09-04 21:43:39.030475,0 days 00:00:00.392651,Leaky,ReLU,Tanh,,79,8,11.0,12.0,,0.029751375980892274,3,394,0.7996244270314035,0.0003312204415456514,216.43361473083496,COMPLETE
1957,0.903108537197113,2023-09-04 21:43:39.031025,2023-09-04 21:43:39.264795,0 days 00:00:00.233770,Leaky,Sigmoid,Sigmoid,,77,7,9.0,7.0,,0.016559723392213465,3,350,0.10156379834082631,0.061425259341233225,103.85747887106503,COMPLETE
1958,0.3501393795013428,2023-09-04 21:43:39.265342,2023-09-04 21:43:45.232115,0 days 00:00:05.966773,Leaky,ReLU,ReLU,,71,7,10.0,10.0,,0.0003022802953354628,3,364,0.7422076305536989,0.0004614857469472648,225.58088323572179,COMPLETE
1959,0.3471944034099579,2023-09-04 21:43:45.232646,2023-09-04 21:43:45.839634,0 days 00:00:00.606988,Leaky,Sigmoid,Tanh,,78,6,8.0,24.0,,0.02523485965307149,3,377,0.6571541095628575,0.00018901431872293768,227.50511961716873,COMPLETE
1960,0.5067000389099121,2023-09-04 21:43:45.840191,2023-09-04 21:43:46.825973,0 days 00:00:00.985782,Leaky,ReLU,Sigmoid,,74,10,9.0,9.0,,0.0005513651464486459,3,353,0.297706590936145,3.263499042167552e-05,196.96925163269043,COMPLETE
1961,0.2716158330440521,2023-09-04 21:43:46.826529,2023-09-04 21:43:47.352800,0 days 00:00:00.526271,Leaky,ReLU,Tanh,,82,19,10.0,13.0,,0.02100947094600436,3,404,0.7197804200243095,4.9526413376012016e-05,391.66155708126905,COMPLETE
1962,0.49029794335365295,2023-09-04 21:43:47.353340,2023-09-04 21:43:47.624781,0 days 00:00:00.271441,Leaky,Sigmoid,Sigmoid,,76,5,17.0,2.0,,0.01220589881681357,3,368,0.33832667887108214,0.0001459049713892856,181.23289271763392,COMPLETE
1963,0.4181441366672516,2023-09-04 21:43:47.625317,2023-09-04 21:43:48.159858,0 days 00:00:00.534541,Leaky,ReLU,Tanh,,79,4,20.0,11.0,,0.002128088483955784,3,391,0.2735369400056566,0.00010955355512261656,175.1859269318757,COMPLETE
1964,0.4825948178768158,2023-09-04 21:43:48.160444,2023-09-04 21:43:48.667692,0 days 00:00:00.507248,Leaky,ReLU,Sigmoid,,81,5,11.0,8.0,,0.03274462600936929,3,383,0.7688771310415327,9.614874459377221e-05,153.70563300880227,COMPLETE
1965,0.3705233335494995,2023-09-04 21:43:48.668260,2023-09-04 21:43:49.241731,0 days 00:00:00.573471,Leaky,Sigmoid,Tanh,,73,19,10.0,10.0,,0.01650376718742627,3,376,0.6804437309662504,0.0001677843868204609,166.89492441813152,COMPLETE
1966,0.37725362181663513,2023-09-04 21:43:49.242270,2023-09-04 21:43:51.617934,0 days 00:00:02.375664,Leaky,ReLU,Sigmoid,,76,20,11.0,14.0,,0.003322414695755351,3,387,0.750621403397509,0.01576722784661057,357.5118095048892,COMPLETE
1967,0.36120712757110596,2023-09-04 21:43:51.618482,2023-09-04 21:43:52.165473,0 days 00:00:00.546991,Leaky,Sigmoid,Leaky,,78,11,9.0,12.0,,0.009666615372590908,3,364,0.23338590552902774,0.00012164054210374501,232.48899992635427,COMPLETE
1968,0.6107372641563416,2023-09-04 21:43:52.166066,2023-09-04 21:43:52.461119,0 days 00:00:00.295053,Leaky,ReLU,ReLU,,82,2,9.0,13.0,,0.02475979945428564,3,346,0.1090392386571171,0.012690619960560003,192.0485719721368,COMPLETE
1969,0.3195323348045349,2023-09-04 21:43:52.461660,2023-09-04 21:43:53.197792,0 days 00:00:00.736132,Leaky,ReLU,Tanh,,80,3,8.0,15.0,,0.01389006822369958,3,387,0.7106510603726703,0.0002080964920928634,198.44017731197297,COMPLETE
1970,0.5901888608932495,2023-09-04 21:43:53.198351,2023-09-04 21:43:53.553380,0 days 00:00:00.355029,Leaky,Sigmoid,Sigmoid,,84,9,13.0,6.0,,0.00631102642421171,3,376,0.18418782239498427,0.0049164163082969295,360.4432988913662,COMPLETE
1971,0.3836475908756256,2023-09-04 21:43:53.553925,2023-09-04 21:43:56.239862,0 days 00:00:02.685937,Leaky,ReLU,Tanh,,70,6,10.0,9.0,,0.0008016834656843669,3,359,0.7748622225366616,8.087806341620093e-05,156.18681013584137,COMPLETE
1972,0.5512813925743103,2023-09-04 21:43:56.240888,2023-09-04 21:43:56.752831,0 days 00:00:00.511943,Leaky,Tanh,Sigmoid,,75,19,10.0,9.0,,0.02038508831809471,3,372,0.11652470761924727,0.022690593212134545,174.76936865912543,COMPLETE
1973,0.47653764486312866,2023-09-04 21:43:56.753953,2023-09-04 21:43:57.166759,0 days 00:00:00.412806,Leaky,Sigmoid,Tanh,,77,9,11.0,4.0,,0.029779933228529263,3,381,0.14710793100796338,0.00014231388302077613,173.32241124692172,COMPLETE
1974,0.38465452194213867,2023-09-04 21:43:57.167799,2023-09-04 21:43:57.734614,0 days 00:00:00.566815,Leaky,ReLU,Sigmoid,,79,19,10.0,5.0,,0.011779747066507987,3,402,0.22236170731254337,0.0002707985718274887,203.23199040339543,COMPLETE
1975,0.4425903856754303,2023-09-04 21:43:57.735139,2023-09-04 21:43:58.031073,0 days 00:00:00.295934,Leaky,Tanh,Leaky,,73,10,9.0,10.0,,0.017380985105767747,3,393,0.1834691165469003,0.020232676257659024,199.3517320421007,COMPLETE
1976,0.41013357043266296,2023-09-04 21:43:58.031589,2023-09-04 21:44:00.360283,0 days 00:00:02.328694,Leaky,ReLU,Tanh,,81,20,11.0,12.0,,0.0006741140071736243,3,353,0.3736396296291361,0.002330464360788804,156.02329610412866,COMPLETE
1977,0.49722206592559814,2023-09-04 21:44:00.361285,2023-09-04 21:44:00.887336,0 days 00:00:00.526051,Leaky,Tanh,Sigmoid,,83,8,9.0,7.0,,0.00772203738405577,3,366,0.13771438506277814,0.006961576650599606,138.09034967422485,COMPLETE
1978,0.4755359888076782,2023-09-04 21:44:00.887864,2023-09-04 21:44:01.101788,0 days 00:00:00.213924,Leaky,Sigmoid,Tanh,,85,18,8.0,6.0,,0.02354774073593054,3,344,0.24699151444252493,0.0003623485825104171,162.0401961586692,COMPLETE
1979,0.24193350970745087,2023-09-04 21:44:01.102303,2023-09-04 21:44:02.515436,0 days 00:00:01.413133,Leaky,ReLU,ReLU,,77,19,10.0,8.0,,0.0038460407152633674,3,404,0.7423883843334865,2.6093723886324265e-05,311.0740974062965,COMPLETE
1980,0.33509284257888794,2023-09-04 21:44:02.516018,2023-09-04 21:44:03.164608,0 days 00:00:00.648590,Leaky,ReLU,ReLU,,75,20,13.0,11.0,,0.004019201855847129,3,402,0.6441958591361826,0.00892103268560776,139.93739399157073,COMPLETE
1981,0.3416752815246582,2023-09-04 21:44:03.165179,2023-09-04 21:44:03.675378,0 days 00:00:00.510199,Leaky,ReLU,ReLU,,77,19,11.0,8.0,,0.00464430109959723,3,412,0.36430609861656127,3.3534450024179516e-05,190.2642001299791,COMPLETE
1982,0.3473276197910309,2023-09-04 21:44:03.675928,2023-09-04 21:44:04.258995,0 days 00:00:00.583067,Leaky,ReLU,ReLU,,76,20,9.0,8.0,,0.003480520831010416,3,413,0.42427147846466007,1.719013266787809e-05,161.50349008220516,COMPLETE
1983,0.3157910406589508,2023-09-04 21:44:04.259541,2023-09-04 21:44:05.774476,0 days 00:00:01.514935,Leaky,ReLU,ReLU,,74,19,10.0,7.0,,0.004844931987873424,3,410,0.6839535404890951,4.456805615966512e-05,194.8246811342911,COMPLETE
1984,0.42202475666999817,2023-09-04 21:44:05.775000,2023-09-04 21:44:06.063418,0 days 00:00:00.288418,Leaky,ReLU,ReLU,,77,20,24.0,10.0,,0.0048849691791221115,3,414,0.12241427554486621,2.5596296216879208e-05,186.49846781855044,COMPLETE
1985,0.2591956853866577,2023-09-04 21:44:06.063988,2023-09-04 21:44:07.370414,0 days 00:00:01.306426,Leaky,ReLU,ReLU,,78,19,11.0,9.0,,0.0024405052630052174,3,407,0.7257397260772595,4.03239641329118e-05,143.60818205939398,COMPLETE
1986,0.3475990891456604,2023-09-04 21:44:07.370959,2023-09-04 21:44:07.849641,0 days 00:00:00.478682,Leaky,ReLU,ReLU,,75,19,10.0,8.0,,0.004224974332768604,3,378,0.29214127819305213,2.5625354201576506e-05,133.89231631630346,COMPLETE
1987,0.30287688970565796,2023-09-04 21:44:07.850261,2023-09-04 21:44:08.894728,0 days 00:00:01.044467,Leaky,ReLU,ReLU,,72,19,9.0,10.0,,0.0029414341525175916,3,407,0.6993035153962368,2.1687470396716117e-05,168.93478260040283,COMPLETE
1988,0.25316447019577026,2023-09-04 21:44:08.895288,2023-09-04 21:44:09.613474,0 days 00:00:00.718186,Leaky,ReLU,ReLU,,78,21,10.0,9.0,,0.00527514834739135,3,397,0.7335706643966987,2.0711498482514088e-05,128.44325618420618,COMPLETE
1989,0.45002350211143494,2023-09-04 21:44:09.614001,2023-09-04 21:44:09.967886,0 days 00:00:00.353885,Leaky,ReLU,ReLU,,76,19,18.0,7.0,,0.005602893098045113,3,402,0.16375059384923163,0.02282084863004742,315.94736058852254,COMPLETE
1990,0.4860139489173889,2023-09-04 21:44:09.968452,2023-09-04 21:44:10.617244,0 days 00:00:00.648792,Leaky,ReLU,ReLU,,41,20,8.0,11.0,,0.006329527540655901,3,395,0.5899731677859632,0.051326427046312226,184.66527448381697,COMPLETE
1991,0.4009281098842621,2023-09-04 21:44:10.617765,2023-09-04 21:44:11.225347,0 days 00:00:00.607582,Leaky,ReLU,ReLU,,79,19,24.0,9.0,,0.0028812117810063367,3,409,0.4986216601505674,3.1033456239513765e-05,161.63596952134284,COMPLETE
1992,0.40239477157592773,2023-09-04 21:44:11.225874,2023-09-04 21:44:11.835034,0 days 00:00:00.609160,Leaky,ReLU,ReLU,,74,20,12.0,5.0,,0.004394423061664146,3,396,0.6168100427265755,0.01609192159994936,226.43255728262443,COMPLETE
1993,0.49282506108283997,2023-09-04 21:44:11.835573,2023-09-04 21:44:12.148092,0 days 00:00:00.312519,Leaky,ReLU,ReLU,,77,19,11.0,6.0,,0.003622145179650704,3,391,0.10099549488177417,0.006380073382214929,134.81243445656517,COMPLETE
1994,0.30289915204048157,2023-09-04 21:44:12.148619,2023-09-04 21:44:12.723398,0 days 00:00:00.574779,Leaky,ReLU,ReLU,,79,20,24.0,8.0,,0.003907811805282636,3,399,0.6653673438616413,0.0029201883076406467,409.620464714206,COMPLETE
1995,0.3672826588153839,2023-09-04 21:44:12.723930,2023-09-04 21:44:15.035909,0 days 00:00:02.311979,Leaky,ReLU,ReLU,,75,19,10.0,10.0,,0.0002131158581674435,3,421,0.3493251602360219,0.00017494683786714067,153.01395374578988,COMPLETE
1996,0.5456868410110474,2023-09-04 21:44:15.036466,2023-09-04 21:44:15.441716,0 days 00:00:00.405250,Leaky,ReLU,Sigmoid,,77,19,9.0,7.0,,0.002129192018772098,3,403,0.6979712802791235,0.0001614758450259002,334.92235908508303,COMPLETE
1997,0.9806778430938721,2023-09-04 21:44:15.442231,2023-09-04 21:44:15.671848,0 days 00:00:00.229617,Sigmoid,ReLU,Tanh,,72,20,8.0,13.0,,0.09623219199903456,3,418,0.4097335575858528,0.09738156762557203,250.1355242047991,COMPLETE
1998,0.4870572090148926,2023-09-04 21:44:15.672395,2023-09-04 21:44:16.354784,0 days 00:00:00.682389,Leaky,ReLU,Sigmoid,,80,2,10.0,11.0,,0.0030825204802180607,3,386,0.1747637120795761,0.007397706881671759,221.58582933372426,COMPLETE
1999,0.33489668369293213,2023-09-04 21:44:16.355343,2023-09-04 21:44:17.593008,0 days 00:00:01.237665,Leaky,ReLU,Tanh,,76,19,24.0,12.0,,0.006174890416532463,3,403,0.7427188085090194,0.0012904579523408551,186.16508440290178,COMPLETE
