number,value,datetime_start,datetime_complete,duration,params_activation1,params_activation2,params_activation3,params_activation4,params_batch_size,params_fl1,params_fl2,params_fl3,params_fl4,params_learning_rate,params_n_layers,params_num_epochs,params_train_size,params_weight_decay,user_attrs_mre,state
1629,0.4262467622756958,2023-09-04 22:36:41.769918,2023-09-04 22:36:44.732189,0 days 00:00:02.962271,Tanh,Sigmoid,Leaky,,84,15,24.0,8.0,,0.0004911960627606044,3,89,0.799483054614356,0.00536568695571447,105.52500144015538,COMPLETE
1630,0.35948312282562256,2023-09-04 22:36:44.733125,2023-09-04 22:36:50.490339,0 days 00:00:05.757214,Tanh,Sigmoid,,,20,17,15.0,,,0.0026751898449644423,2,195,0.5957227302693622,0.0007363837750899302,123.00675948122715,COMPLETE
1631,0.3476184606552124,2023-09-04 22:36:50.491287,2023-09-04 22:36:52.371649,0 days 00:00:01.880362,Tanh,Sigmoid,Tanh,,18,22,14.0,7.0,,0.010048510045075182,3,217,0.27868097841183903,6.006791725890995e-05,130.64598915793678,COMPLETE
1632,0.38875454664230347,2023-09-04 22:36:52.372610,2023-09-04 22:36:53.282638,0 days 00:00:00.910028,Sigmoid,Sigmoid,,,73,16,5.0,,,0.003921902696865221,2,111,0.16475093550140052,0.0017283860095168454,120.71423779736769,COMPLETE
1633,0.38389894366264343,2023-09-04 22:36:53.283582,2023-09-04 22:36:55.434573,0 days 00:00:02.150991,Tanh,,,,15,23,,,,0.02334058578024823,1,132,0.7701892627225628,0.021959319858929773,131.8633987991898,COMPLETE
1634,0.3023051917552948,2023-09-04 22:36:55.435502,2023-09-04 22:37:00.522502,0 days 00:00:05.087000,Leaky,Sigmoid,,,21,21,2.0,,,0.006784035418002531,2,173,0.7092263852727575,1.9823158769793194e-05,85.22366343317805,COMPLETE
1635,0.3552541732788086,2023-09-04 22:37:00.523450,2023-09-04 22:37:03.651796,0 days 00:00:03.128346,Tanh,Leaky,Sigmoid,Sigmoid,38,21,3.0,6.0,6.0,0.06913400110027808,4,240,0.7371169344123712,1.2126632911186893e-05,101.5121823946635,COMPLETE
1636,0.2824536859989166,2023-09-04 22:37:03.652813,2023-09-04 22:37:05.855715,0 days 00:00:02.202902,Tanh,Sigmoid,,,13,10,4.0,,,0.019432221930500027,2,94,0.770315543140494,0.00016751559782077622,99.87366885230655,COMPLETE
1637,0.44069549441337585,2023-09-04 22:37:05.856194,2023-09-04 22:37:08.247092,0 days 00:00:02.390898,Tanh,Sigmoid,Leaky,,35,22,5.0,12.0,,0.00036717473709784777,3,208,0.6927662116127963,0.03345618682796669,114.04557891119094,COMPLETE
1638,0.31989434361457825,2023-09-04 22:37:08.247590,2023-09-04 22:37:08.838252,0 days 00:00:00.590662,Tanh,Sigmoid,,,23,11,8.0,,,0.014961453918742443,2,224,0.38767447496904656,7.809268291095409e-05,163.21239108131044,COMPLETE
1639,0.3855728209018707,2023-09-04 22:37:08.838735,2023-09-04 22:37:09.069814,0 days 00:00:00.231079,Leaky,Sigmoid,,,39,15,14.0,,,0.0372752410298682,2,144,0.21096569160392975,3.346543977305731e-05,211.59873471941268,COMPLETE
1640,0.4361661374568939,2023-09-04 22:37:09.070349,2023-09-04 22:37:09.512349,0 days 00:00:00.442000,Tanh,Sigmoid,Leaky,,59,22,5.0,5.0,,0.0056546726023953015,3,58,0.726513886818481,0.025549661555351964,117.68052086463341,COMPLETE
1641,0.3539694547653198,2023-09-04 22:37:09.512920,2023-09-04 22:37:09.775093,0 days 00:00:00.262173,Tanh,,,,19,14,,,,0.010998267707655338,1,187,0.21771666187819874,1.4935581514001318e-05,111.6634592516669,COMPLETE
1642,0.38334137201309204,2023-09-04 22:37:09.775604,2023-09-04 22:37:10.501240,0 days 00:00:00.725636,Tanh,Sigmoid,,,16,21,15.0,,,0.008491052923845355,2,360,0.26505606168731904,0.0024616484319835838,231.67527074981155,COMPLETE
1643,0.30387768149375916,2023-09-04 22:37:10.501709,2023-09-04 22:37:18.563487,0 days 00:00:08.061778,Sigmoid,Leaky,Tanh,Leaky,12,21,3.0,1.0,11.0,0.001457019111091287,4,103,0.7661917156134944,2.5378688283307176e-05,101.33707163285236,COMPLETE
1644,0.2939232885837555,2023-09-04 22:37:18.564007,2023-09-04 22:37:19.641022,0 days 00:00:01.077015,Tanh,Sigmoid,Sigmoid,,33,23,9.0,5.0,,0.028358855528211355,3,87,0.6715631312755368,5.395262993950758e-05,96.62163690935101,COMPLETE
1645,0.3165999948978424,2023-09-04 22:37:19.641562,2023-09-04 22:37:20.796097,0 days 00:00:01.154535,Leaky,Sigmoid,,,27,15,4.0,,,0.003347970615238594,2,258,0.7473007292460061,4.34834864472557e-05,92.66380408958152,COMPLETE
1646,0.36982306838035583,2023-09-04 22:37:20.796587,2023-09-04 22:37:21.252404,0 days 00:00:00.455817,Tanh,Sigmoid,,,24,13,1.0,,,0.012842895030104143,2,157,0.22861032622122213,0.00012468254031894216,113.82825747403231,COMPLETE
1647,0.32755324244499207,2023-09-04 22:37:21.252897,2023-09-04 22:37:21.606429,0 days 00:00:00.353532,Tanh,,,,86,12,,,,0.023820113049733,1,121,0.6326857199130953,0.0012203907994428292,383.81390753851997,COMPLETE
1648,0.3042994737625122,2023-09-04 22:37:21.606904,2023-09-04 22:37:22.166325,0 days 00:00:00.559421,Tanh,Sigmoid,,,37,22,11.0,,,0.044726900650372665,2,229,0.7113320503449465,8.662289589785726e-05,135.3707730842359,COMPLETE
1649,0.39126017689704895,2023-09-04 22:37:22.166831,2023-09-04 22:37:23.090892,0 days 00:00:00.924061,Tanh,Sigmoid,Leaky,,22,16,15.0,3.0,,0.002285753382319473,3,214,0.23579150858715958,0.00019425831682456932,179.2175067368374,COMPLETE
1650,0.3898184299468994,2023-09-04 22:37:23.091382,2023-09-04 22:37:23.361427,0 days 00:00:00.270045,Leaky,Sigmoid,,,57,21,5.0,,,0.004400999384848552,2,70,0.1531094519555246,0.008319665665424568,127.06181640625,COMPLETE
1651,0.47809460759162903,2023-09-04 22:37:23.361911,2023-09-04 22:37:25.946926,0 days 00:00:02.585015,Tanh,Sigmoid,,,10,14,14.0,,,4.62560136164484e-05,2,78,0.4156720523517738,0.0003991132077974545,107.02736409505208,COMPLETE
1652,0.30775025486946106,2023-09-04 22:37:25.947422,2023-09-04 22:37:26.806299,0 days 00:00:00.858877,Tanh,Leaky,,,20,21,6.0,,,0.017437388656197476,2,245,0.7997980716546476,1.7209919605917885e-05,104.35458119710286,COMPLETE
1653,0.34719234704971313,2023-09-04 22:37:26.806803,2023-09-04 22:37:27.730249,0 days 00:00:00.923446,Tanh,,,,15,22,,,,0.007699657766934019,1,275,0.7716654435611495,0.0002776318482394807,96.19571590423584,COMPLETE
1654,0.4436343312263489,2023-09-04 22:37:27.730778,2023-09-04 22:37:29.619083,0 days 00:00:01.888305,Sigmoid,Sigmoid,Leaky,,18,21,3.0,4.0,,0.0011620141293306747,3,200,0.11729212996508886,6.690407239490367e-05,135.31574306488037,COMPLETE
1655,0.33263280987739563,2023-09-04 22:37:29.619581,2023-09-04 22:37:33.449960,0 days 00:00:03.830379,Tanh,Sigmoid,,,13,17,6.0,,,0.0007567896650743359,2,111,0.7419145362840192,0.0004588225215534979,127.60393427943325,COMPLETE
1656,0.411852091550827,2023-09-04 22:37:33.450432,2023-09-04 22:37:33.601562,0 days 00:00:00.151130,Tanh,,,,69,19,,,,0.03373698835295292,1,236,0.110996581307729,2.8315060243508447e-05,173.52252960205078,COMPLETE
1657,0.4086596667766571,2023-09-04 22:37:33.602029,2023-09-04 22:37:33.951850,0 days 00:00:00.349821,Leaky,Sigmoid,Tanh,,40,23,7.0,9.0,,0.057602169486137555,3,341,0.7010942467520617,0.01467097419627176,110.6308115641276,COMPLETE
1658,0.657970130443573,2023-09-04 22:37:33.952340,2023-09-04 22:37:39.250273,0 days 00:00:05.297933,Tanh,Sigmoid,Leaky,Sigmoid,21,15,24.0,6.0,3.0,0.00012511057575030702,4,98,0.47792426049086356,0.0009343316982866365,120.7114620597995,COMPLETE
1659,1.2255314588546753,2023-09-04 22:37:39.251212,2023-09-04 22:37:40.134741,0 days 00:00:00.883529,Tanh,Sigmoid,,,25,22,5.0,,,1.5916675598540106e-05,2,62,0.13110305826064367,0.00014761465452039504,188.37936524421937,COMPLETE
1660,0.5736283659934998,2023-09-04 22:37:40.135694,2023-09-04 22:37:41.189627,0 days 00:00:01.053933,Tanh,Sigmoid,,,11,23,14.0,,,0.010003742015240121,2,220,0.7671613410845075,0.0957755201318406,110.85251778050473,COMPLETE
1661,1.008711814880371,2023-09-04 22:37:41.190125,2023-09-04 22:37:41.889716,0 days 00:00:00.699591,Tanh,Leaky,Sigmoid,,17,16,4.0,8.0,,0.006325889342161912,3,84,0.7256667612192684,0.0689708662868379,99.9253667195638,COMPLETE
1662,0.3856488764286041,2023-09-04 22:37:41.890207,2023-09-04 22:37:42.303845,0 days 00:00:00.413638,Leaky,Sigmoid,,,39,21,6.0,,,0.005125361727929901,2,231,0.11602896311286207,2.2341544683681095e-05,238.1040051367975,COMPLETE
1663,0.3036068081855774,2023-09-04 22:37:42.304332,2023-09-04 22:37:42.871646,0 days 00:00:00.567314,Tanh,Sigmoid,,,35,20,13.0,,,0.020219034420774502,2,202,0.6541661433810998,0.00010241453776598745,104.91441258021763,COMPLETE
1664,0.321819931268692,2023-09-04 22:37:42.872141,2023-09-04 22:37:43.667281,0 days 00:00:00.795140,Tanh,Sigmoid,,,19,14,2.0,,,0.014057915695372286,2,136,0.6103289495710148,3.48296496737167e-05,96.93998020717076,COMPLETE
1665,0.43019407987594604,2023-09-04 22:37:43.667775,2023-09-04 22:37:47.308642,0 days 00:00:03.640867,Sigmoid,,,,23,22,,,,0.0001899268795854407,1,212,0.7695423089978559,0.0020542232487969266,98.70313748773539,COMPLETE
1666,0.3601148724555969,2023-09-04 22:37:47.309127,2023-09-04 22:37:47.517573,0 days 00:00:00.208446,Tanh,Sigmoid,Leaky,,94,21,8.0,14.0,,0.026844780121624383,3,152,0.12637159163912587,4.743483074792294e-05,274.5195723553093,COMPLETE
1667,0.31155312061309814,2023-09-04 22:37:47.518067,2023-09-04 22:37:48.474252,0 days 00:00:00.956185,Tanh,Sigmoid,,,32,13,10.0,,,0.0041956411038574955,2,93,0.7999296144854033,1.019576187729232e-05,93.52550384521484,COMPLETE
1668,0.3439525067806244,2023-09-04 22:37:48.475153,2023-09-04 22:37:49.841907,0 days 00:00:01.366754,Leaky,Sigmoid,,,37,15,4.0,,,0.011756426847788461,2,68,0.29529625768524354,0.00349510930260344,102.77846269046559,COMPLETE
1669,0.9965541958808899,2023-09-04 22:37:49.842808,2023-09-04 22:37:50.382691,0 days 00:00:00.539883,Tanh,Sigmoid,Tanh,ReLU,97,21,5.0,7.0,5.0,0.08286204919316532,4,250,0.19417455033571876,0.09815696164079972,101.03675231933593,COMPLETE
1670,0.37196001410484314,2023-09-04 22:37:50.383605,2023-09-04 22:37:51.125703,0 days 00:00:00.742098,Tanh,,,,56,18,,,,0.0027670523272323414,1,178,0.27567811352034716,0.00023365897362478657,105.85618261272988,COMPLETE
1671,0.37315288186073303,2023-09-04 22:37:51.126162,2023-09-04 22:37:52.107085,0 days 00:00:00.980923,Tanh,Leaky,Leaky,,10,20,15.0,4.0,,0.015954365700574624,3,79,0.5878777336604275,0.004558328859929985,117.43977864583333,COMPLETE
1672,0.3846850097179413,2023-09-04 22:37:52.107567,2023-09-04 22:37:52.427575,0 days 00:00:00.320008,Tanh,Sigmoid,,,41,22,7.0,,,0.04097190261992749,2,50,0.37162769891229713,0.00016790477187389222,108.45118565713206,COMPLETE
1673,0.45192471146583557,2023-09-04 22:37:52.428064,2023-09-04 22:37:57.153175,0 days 00:00:04.725111,Tanh,Sigmoid,,,21,21,16.0,,,0.00010500490880164521,2,437,0.34078882187610904,0.011970594133729154,109.43269135149993,COMPLETE
1674,0.31952551007270813,2023-09-04 22:37:57.153660,2023-09-04 22:37:59.658627,0 days 00:00:02.504967,Leaky,Sigmoid,Sigmoid,,15,21,21.0,17.0,,0.0008655957250119382,3,105,0.6818044601625096,0.0001221951635120666,96.38438356839694,COMPLETE
1675,0.3617691099643707,2023-09-04 22:37:59.659155,2023-09-04 22:38:00.211211,0 days 00:00:00.552056,Tanh,Sigmoid,,,17,14,14.0,,,0.008486636391257362,2,222,0.261864904829988,1.8479948041816394e-05,135.75033320551333,COMPLETE
1676,1.074188232421875,2023-09-04 22:38:00.211716,2023-09-04 22:38:00.715006,0 days 00:00:00.503290,Sigmoid,Sigmoid,,,12,19,23.0,,,0.031647050976715205,2,162,0.745075370513664,0.07277879380232431,105.63596135919744,COMPLETE
1677,0.4906027019023895,2023-09-04 22:38:00.715526,2023-09-04 22:38:02.414504,0 days 00:00:01.698978,Tanh,,,,20,22,,,,2.4430058231153594e-05,1,87,0.7198667388061211,0.0013449139250676036,119.01088530441811,COMPLETE
1678,0.30905672907829285,2023-09-04 22:38:02.414998,2023-09-04 22:38:06.754201,0 days 00:00:04.339203,ReLU,Sigmoid,Tanh,,39,20,6.0,10.0,,0.00025931637008752567,3,241,0.7993454736025709,3.8456308970161283e-05,104.3929433545631,COMPLETE
1679,0.9879577159881592,2023-09-04 22:38:06.754719,2023-09-04 22:38:07.826155,0 days 00:00:01.071436,Tanh,Leaky,,,22,16,4.0,,,1.0516340058670668e-05,2,61,0.5519501822471092,8.344735455932893e-05,112.07349996097753,COMPLETE
1680,0.4785540699958801,2023-09-04 22:38:07.826648,2023-09-04 22:38:08.194492,0 days 00:00:00.367844,Tanh,Sigmoid,,,36,15,3.0,,,0.02219689731400396,2,190,0.7571003632167665,0.05533992949887811,124.6389397515191,COMPLETE
1681,0.8913323283195496,2023-09-04 22:38:08.194981,2023-09-04 22:38:15.464111,0 days 00:00:07.269130,Leaky,Sigmoid,Leaky,Sigmoid,14,22,9.0,2.0,8.0,2.4578387740294276e-05,4,122,0.7032592160321367,1.3333604907705758e-05,96.5618353671715,COMPLETE
1682,0.28070318698883057,2023-09-04 22:38:15.465061,2023-09-04 22:38:18.709370,0 days 00:00:03.244309,Tanh,,,,19,20,,,,0.0037383132645230073,1,211,0.7433964842537706,2.8996218265181528e-05,189.54102913538614,COMPLETE
1683,0.440239280462265,2023-09-04 22:38:18.709869,2023-09-04 22:38:19.155449,0 days 00:00:00.445580,Tanh,Sigmoid,Leaky,,26,21,13.0,5.0,,0.0099749242530308,3,227,0.1563339957228873,0.006733066197648737,117.52859738667806,COMPLETE
1684,0.3244593143463135,2023-09-04 22:38:19.155952,2023-09-04 22:38:19.897110,0 days 00:00:00.741158,ReLU,Sigmoid,,,41,14,14.0,,,0.013428589100160742,2,72,0.5046575298412687,0.0006119153487124921,106.02089666551159,COMPLETE
1685,0.3348414897918701,2023-09-04 22:38:19.897712,2023-09-04 22:38:20.339990,0 days 00:00:00.442278,Tanh,Tanh,,,89,23,12.0,,,0.006772492156114189,2,100,0.5304064982580358,0.0015491353900760456,104.64785070586623,COMPLETE
1686,0.4791162610054016,2023-09-04 22:38:20.340617,2023-09-04 22:38:27.517373,0 days 00:00:07.176756,Tanh,Sigmoid,Tanh,,24,13,22.0,3.0,,0.00010190654463318889,3,145,0.772090487344295,6.631161633687293e-05,111.01408733499461,COMPLETE
1687,0.36387935280799866,2023-09-04 22:38:27.517854,2023-09-04 22:38:27.758124,0 days 00:00:00.240270,Leaky,Sigmoid,,,30,22,7.0,,,0.05086927406225745,2,220,0.16071833030807428,0.00010469958457380425,189.01460820978338,COMPLETE
1688,0.3806517720222473,2023-09-04 22:38:27.758610,2023-09-04 22:38:28.181827,0 days 00:00:00.423217,Tanh,,,,16,15,,,,0.017211424321267984,1,168,0.6578481216754718,2.2296476135304237e-05,104.04216407327091,COMPLETE
1689,0.4108666181564331,2023-09-04 22:38:28.182310,2023-09-04 22:38:32.308860,0 days 00:00:04.126550,ReLU,Leaky,,,13,21,5.0,,,5.6941193056144505e-05,2,114,0.7270092897702972,0.00019810205339600544,99.6873510260331,COMPLETE
1690,0.406988263130188,2023-09-04 22:38:32.309340,2023-09-04 22:38:32.550934,0 days 00:00:00.241594,Sigmoid,Tanh,,,42,20,15.0,,,0.025987897818774135,2,202,0.1202523924681575,5.208817445011819e-05,178.2424366789044,COMPLETE
1691,0.4093128442764282,2023-09-04 22:38:32.551431,2023-09-04 22:38:36.107362,0 days 00:00:03.555931,Tanh,Sigmoid,Sigmoid,,10,21,6.0,6.0,,0.0017121633165380554,3,236,0.40245090813827655,0.006034920120332766,990.3421463262839,COMPLETE
1692,0.5289369821548462,2023-09-04 22:38:36.107849,2023-09-04 22:38:39.441475,0 days 00:00:03.333626,Tanh,Sigmoid,Leaky,Leaky,18,8,10.0,15.0,14.0,5.344704692366158e-05,4,89,0.5751891433709546,0.0050056283304436636,102.01783589566692,COMPLETE
1693,0.3609670400619507,2023-09-04 22:38:39.441993,2023-09-04 22:38:40.061770,0 days 00:00:00.619777,Tanh,Sigmoid,,,20,11,8.0,,,0.005067126056537834,2,78,0.43779138593666944,0.0032352891944224505,118.73114261111698,COMPLETE
1694,0.30236318707466125,2023-09-04 22:38:40.062252,2023-09-04 22:38:40.540971,0 days 00:00:00.478719,ReLU,Tanh,Leaky,,34,12,2.0,16.0,,0.0312534574036125,3,60,0.7726499446593638,0.00014542486660562933,107.48228615208676,COMPLETE
1695,0.30828139185905457,2023-09-04 22:38:40.541469,2023-09-04 22:38:41.154780,0 days 00:00:00.613311,Tanh,Sigmoid,,,38,16,3.0,,,0.03766381247030447,2,214,0.6778842483644283,0.0006860196328714924,101.73074607849121,COMPLETE
1696,0.352428674697876,2023-09-04 22:38:41.155293,2023-09-04 22:38:42.167111,0 days 00:00:01.011818,Leaky,,,,12,22,,,,0.007841391958989584,1,129,0.3135761368309247,0.0003121765013390021,257.54190545333057,COMPLETE
1697,0.4472362697124481,2023-09-04 22:38:42.168002,2023-09-04 22:38:43.693821,0 days 00:00:01.525819,Tanh,Sigmoid,,,23,20,5.0,,,0.0006491879056143592,2,231,0.17513231426025014,4.0526535100485966e-05,127.37177435144201,COMPLETE
1698,0.3261142671108246,2023-09-04 22:38:43.694283,2023-09-04 22:38:45.025000,0 days 00:00:01.330717,Tanh,Sigmoid,,,21,21,16.0,,,0.003152991551648025,2,100,0.6278705950522774,1.6478228494621055e-05,113.68398237228394,COMPLETE
1699,0.36539673805236816,2023-09-04 22:38:45.025520,2023-09-04 22:38:45.851826,0 days 00:00:00.826306,Tanh,Tanh,Tanh,,55,10,13.0,4.0,,0.0020907820290047003,3,84,0.4926020125398557,3.2667603131879256e-05,107.45118350074405,COMPLETE
1700,0.3314366638660431,2023-09-04 22:38:45.852348,2023-09-04 22:38:46.240703,0 days 00:00:00.388355,ReLU,,,,59,15,,,,0.02140441472184172,1,252,0.7441600184413514,0.00011742467473961713,114.79413943820529,COMPLETE
1701,0.37450388073921204,2023-09-04 22:38:46.241151,2023-09-04 22:38:46.702892,0 days 00:00:00.461741,Tanh,Sigmoid,,,17,23,14.0,,,0.01094453593266281,2,71,0.27025524262885725,2.6541363045345782e-05,5171.177052525111,COMPLETE
1702,0.3353329598903656,2023-09-04 22:38:46.703376,2023-09-04 22:38:47.386473,0 days 00:00:00.683097,Leaky,Leaky,Leaky,Sigmoid,43,19,4.0,13.0,4.0,0.0657750445393285,4,154,0.7051098459783574,0.00015751268932249988,117.34099758372588,COMPLETE
1703,0.30095386505126953,2023-09-04 22:38:47.386979,2023-09-04 22:38:47.841116,0 days 00:00:00.454137,Sigmoid,Sigmoid,Sigmoid,,76,20,15.0,7.0,,0.0859387447371561,3,204,0.7987129519254131,0.000249291210301437,134.2340324155746,COMPLETE
1704,0.31110069155693054,2023-09-04 22:38:47.841654,2023-09-04 22:38:48.530136,0 days 00:00:00.688482,Tanh,Tanh,,,15,21,5.0,,,0.015184844988338227,2,108,0.7703217743839093,7.430076097883389e-05,94.91729896946957,COMPLETE
1705,0.43246904015541077,2023-09-04 22:38:48.530618,2023-09-04 22:38:51.891749,0 days 00:00:03.361131,Tanh,Sigmoid,,,39,22,6.0,,,4.501030851331781e-05,2,222,0.7996572380269479,0.002455213762108202,98.26324256690773,COMPLETE
1706,0.7381185293197632,2023-09-04 22:38:51.892223,2023-09-04 22:38:54.399630,0 days 00:00:02.507407,ReLU,Sigmoid,,,25,16,6.0,,,2.1758632147773035e-05,2,191,0.46096207687947677,5.7406495235213677e-05,107.36150400051896,COMPLETE
1707,0.39351317286491394,2023-09-04 22:38:54.400148,2023-09-04 22:38:54.838984,0 days 00:00:00.438836,Tanh,ReLU,Tanh,,36,14,7.0,1.0,,0.012248699416195689,3,95,0.7214473083970584,0.029594263543804355,116.60186285721629,COMPLETE
1708,0.5218778848648071,2023-09-04 22:38:54.839482,2023-09-04 22:38:55.391956,0 days 00:00:00.552474,Tanh,,,,19,21,,,,8.773814737238805e-05,1,58,0.3041210155930218,9.53241389044607e-05,112.26108814107961,COMPLETE
1709,0.45941030979156494,2023-09-04 22:38:55.392447,2023-09-04 22:39:00.196193,0 days 00:00:04.803746,Leaky,Sigmoid,,,28,22,14.0,,,1.9483230115246343e-05,2,266,0.7463005618372309,2.0346668751297986e-05,110.02915346532836,COMPLETE
1710,0.3219352960586548,2023-09-04 22:39:00.196678,2023-09-04 22:39:00.863419,0 days 00:00:00.666741,Tanh,Tanh,,,22,20,12.0,,,0.04587200568672365,2,232,0.6925223914583147,4.499794823211452e-05,109.34188624790737,COMPLETE
1711,0.34842026233673096,2023-09-04 22:39:00.863905,2023-09-04 22:39:01.481800,0 days 00:00:00.617895,Tanh,Sigmoid,Leaky,,41,21,3.0,5.0,,0.002576482697570468,3,243,0.32846935318713993,0.00018094998416597475,152.51334336224724,COMPLETE
1712,0.39123111963272095,2023-09-04 22:39:01.482338,2023-09-04 22:39:03.764350,0 days 00:00:02.282012,ReLU,Sigmoid,,,91,15,4.0,,,0.00024030134427739918,2,179,0.7705054350198292,1.1863183696949592e-05,119.80433254135387,COMPLETE
1713,0.5560711622238159,2023-09-04 22:39:03.764855,2023-09-04 22:39:04.525694,0 days 00:00:00.760839,Tanh,,,,61,21,,,,5.42174954522187e-05,1,80,0.7305817096328805,0.001769591703738898,94.95452308654785,COMPLETE
1714,0.36516568064689636,2023-09-04 22:39:04.526199,2023-09-04 22:39:06.395653,0 days 00:00:01.869454,Tanh,Leaky,Leaky,ReLU,13,19,7.0,3.0,10.0,0.00878379775850529,4,220,0.6758452230442147,0.007957065324690111,100.56580841846956,COMPLETE
1715,0.3050302267074585,2023-09-04 22:39:06.396213,2023-09-04 22:39:07.803513,0 days 00:00:01.407300,Leaky,Sigmoid,,,10,22,5.0,,,0.005762283897962866,2,70,0.5222875783036687,0.00036497866262854005,116.00806906056958,COMPLETE
1716,0.26764971017837524,2023-09-04 22:39:07.804010,2023-09-04 22:39:08.267465,0 days 00:00:00.463455,Tanh,ReLU,Tanh,,44,23,24.0,8.0,,0.018926552479986244,3,139,0.799374974412526,0.00013613698154502633,96.35652669270833,COMPLETE
1717,0.3053959310054779,2023-09-04 22:39:08.267961,2023-09-04 22:39:08.802000,0 days 00:00:00.534039,Tanh,ReLU,,,43,23,24.0,,,0.018211367722882118,2,135,0.776953873132847,0.0002171383998977692,88.83938500189012,COMPLETE
1718,0.36802423000335693,2023-09-04 22:39:08.802543,2023-09-04 22:39:08.992729,0 days 00:00:00.190186,Tanh,,,,45,23,,,,0.02054248529247587,1,133,0.19780088273911398,2.5057557737758556e-05,222.6421573523319,COMPLETE
1719,0.3124715983867645,2023-09-04 22:39:08.993222,2023-09-04 22:39:09.582222,0 days 00:00:00.589000,Tanh,ReLU,,,44,23,24.0,,,0.025305079174605172,2,146,0.7710738667502136,0.00014932803220001992,85.3463872273763,COMPLETE
1720,0.325055330991745,2023-09-04 22:39:09.582704,2023-09-04 22:39:10.268251,0 days 00:00:00.685547,Tanh,ReLU,Sigmoid,,43,24,24.0,10.0,,0.017701293604345424,3,139,0.6121956066727162,0.0004997787210980023,107.95926666259766,COMPLETE
1721,0.3218787610530853,2023-09-04 22:39:10.268762,2023-09-04 22:39:10.944911,0 days 00:00:00.676149,Tanh,ReLU,,,45,23,15.0,,,0.022865259157379067,2,124,0.7992083163281981,0.00018346978327999928,89.53938493274507,COMPLETE
1722,0.3624570667743683,2023-09-04 22:39:10.945406,2023-09-04 22:39:11.235326,0 days 00:00:00.289920,Tanh,ReLU,,,46,23,23.0,,,0.01634385065236508,2,142,0.28879163434100513,0.0009791073330706116,684.7612885974702,COMPLETE
1723,0.2869913578033447,2023-09-04 22:39:11.235818,2023-09-04 22:39:11.903432,0 days 00:00:00.667614,Tanh,ReLU,Leaky,,42,23,24.0,9.0,,0.019373548719608474,3,124,0.799751136400081,3.432532712278355e-05,90.84443473815918,COMPLETE
