number,value,datetime_start,datetime_complete,duration,params_activation1,params_activation2,params_activation3,params_activation4,params_batch_size,params_fl1,params_fl2,params_fl3,params_fl4,params_learning_rate,params_n_layers,params_num_epochs,params_train_size,params_weight_decay,user_attrs_mre,state
669,0.36416083574295044,2023-09-04 22:05:45.691372,2023-09-04 22:05:45.938945,0 days 00:00:00.247573,ReLU,Sigmoid,,,18,22,8.0,,,0.006801188954405141,2,78,0.3029838879943752,5.061387195981199e-05,139.88461213953354,COMPLETE
670,0.34456518292427063,2023-09-04 22:05:45.939320,2023-09-04 22:05:46.446815,0 days 00:00:00.507495,Leaky,,,,14,24,,,,0.041989308599117064,1,88,0.6749998875890184,0.00011705323147245976,127.15036201477051,COMPLETE
671,0.3225269615650177,2023-09-04 22:05:46.447202,2023-09-04 22:05:46.992625,0 days 00:00:00.545423,Tanh,ReLU,,,41,14,5.0,,,0.015411167469297533,2,110,0.7694920076717539,2.2281047411122848e-05,99.26751730782645,COMPLETE
672,0.5068081617355347,2023-09-04 22:05:46.992982,2023-09-04 22:05:48.215389,0 days 00:00:01.222407,Tanh,Sigmoid,Leaky,ReLU,23,21,18.0,21.0,8.0,7.16536415126102e-05,4,156,0.1690394736522217,4.046103486051198e-05,131.24797121683756,COMPLETE
673,0.3341244161128998,2023-09-04 22:05:48.216134,2023-09-04 22:05:49.223210,0 days 00:00:01.007076,Tanh,Sigmoid,ReLU,,20,15,9.0,18.0,,0.009791695383950284,3,58,0.7171481737354679,0.00017667615059633408,88.80128479003906,COMPLETE
674,0.3955836296081543,2023-09-04 22:05:49.223670,2023-09-04 22:05:49.952030,0 days 00:00:00.728360,Tanh,Tanh,,,12,19,13.0,,,0.003025988713048823,2,99,0.1803555446155588,3.199959928363387e-05,232.3022232055664,COMPLETE
675,0.3519933819770813,2023-09-04 22:05:49.952385,2023-09-04 22:05:50.494458,0 days 00:00:00.542073,Sigmoid,Sigmoid,Leaky,,34,16,16.0,13.0,,0.027703061244310018,3,166,0.5737714022263265,9.540833409676233e-05,218.31594108812737,COMPLETE
676,0.4551045298576355,2023-09-04 22:05:50.494870,2023-09-04 22:05:51.638875,0 days 00:00:01.144005,Tanh,ReLU,,,16,23,20.0,,,0.00010868586886719586,2,133,0.194904474428527,1.4184272091316753e-05,116.03070768198573,COMPLETE
677,0.26912617683410645,2023-09-04 22:05:51.639287,2023-09-04 22:05:53.002415,0 days 00:00:01.363128,ReLU,Sigmoid,Sigmoid,Sigmoid,19,11,23.0,5.0,13.0,0.012078111967220322,4,215,0.7459973236891702,0.00022919599601246276,99.21373336379592,COMPLETE
678,0.28472211956977844,2023-09-04 22:05:53.002816,2023-09-04 22:05:54.626775,0 days 00:00:01.623959,Tanh,Sigmoid,Sigmoid,Sigmoid,24,11,23.0,5.0,11.0,0.00803463561329403,4,223,0.754436617896831,0.0002242149363262725,114.4247473950656,COMPLETE
679,0.6938578486442566,2023-09-04 22:05:54.627173,2023-09-04 22:05:57.209715,0 days 00:00:02.582542,Tanh,ReLU,Sigmoid,Sigmoid,88,10,24.0,4.0,10.0,5.24916831353841e-05,4,214,0.7995964165777054,0.000303944334768326,95.71966944899515,COMPLETE
680,0.3180181682109833,2023-09-04 22:05:57.210102,2023-09-04 22:05:57.960950,0 days 00:00:00.750848,Tanh,Leaky,Sigmoid,Sigmoid,22,11,22.0,6.0,13.0,0.011549037914996946,4,204,0.7471624138583749,0.00017269963778318296,105.96391369047619,COMPLETE
681,0.3699778616428375,2023-09-04 22:05:57.961371,2023-09-04 22:05:58.518246,0 days 00:00:00.556875,Tanh,Sigmoid,Sigmoid,Sigmoid,66,10,23.0,5.0,12.0,0.005092160223903448,4,215,0.20784711633697409,0.00024009599071637847,249.8528375705751,COMPLETE
682,0.4210284650325775,2023-09-04 22:05:58.518682,2023-09-04 22:06:04.181189,0 days 00:00:05.662507,Tanh,Tanh,Sigmoid,Sigmoid,58,11,23.0,7.0,14.0,0.0008216401913451771,4,197,0.7743808762182284,0.009064169534258214,107.47752752158847,COMPLETE
683,0.9332568645477295,2023-09-04 22:06:04.181829,2023-09-04 22:06:05.935985,0 days 00:00:01.754156,Leaky,Sigmoid,Sigmoid,Sigmoid,21,12,24.0,3.0,7.0,0.0004305137712442493,4,235,0.4647419168791751,0.0020722759113180364,156.67255615234376,COMPLETE
684,0.339212030172348,2023-09-04 22:06:05.936629,2023-09-04 22:06:08.343847,0 days 00:00:02.407218,ReLU,ReLU,Sigmoid,Sigmoid,26,11,22.0,6.0,19.0,0.03679034991679403,4,226,0.7395401444673277,0.0002149419000844583,86.58843994140625,COMPLETE
685,0.3565792441368103,2023-09-04 22:06:08.344601,2023-09-04 22:06:10.637352,0 days 00:00:02.292751,Tanh,Sigmoid,Sigmoid,Sigmoid,36,11,23.0,8.0,22.0,0.009837624593249132,4,207,0.7993756776366231,0.00027805065123052264,130.4970464706421,COMPLETE
686,0.3386091887950897,2023-09-04 22:06:10.638031,2023-09-04 22:06:14.924700,0 days 00:00:04.286669,Tanh,Sigmoid,Sigmoid,Sigmoid,19,10,21.0,14.0,20.0,0.02353774052554629,4,243,0.7703586907174983,0.00014356683864943974,113.67251133274388,COMPLETE
687,0.5243130326271057,2023-09-04 22:06:14.925406,2023-09-04 22:06:23.478669,0 days 00:00:08.553263,Tanh,Tanh,Sigmoid,Leaky,61,12,23.0,4.0,15.0,3.300719742657675e-05,4,213,0.7276290329712175,0.00017822136219754092,102.88010700207921,COMPLETE
688,0.34412261843681335,2023-09-04 22:06:23.479328,2023-09-04 22:06:28.769400,0 days 00:00:05.290072,Tanh,Sigmoid,Leaky,Tanh,39,11,22.0,2.0,4.0,0.001890966960855026,4,195,0.6895516636113027,0.001307674190496748,112.2241383975314,COMPLETE
689,1.083410382270813,2023-09-04 22:06:28.770086,2023-09-04 22:06:30.493557,0 days 00:00:01.723471,Sigmoid,ReLU,Leaky,Sigmoid,17,9,24.0,4.0,23.0,0.000608919821832091,4,230,0.7507292428566291,0.07995989200494946,99.71424630972055,COMPLETE
690,0.3227147161960602,2023-09-04 22:06:30.494235,2023-09-04 22:06:32.529170,0 days 00:00:02.034935,Tanh,Sigmoid,Leaky,ReLU,23,20,4.0,5.0,6.0,0.005990066042671162,4,225,0.42787912837470793,1.1653386743969735e-05,102.38143899705675,COMPLETE
691,0.3434602618217468,2023-09-04 22:06:32.529848,2023-09-04 22:06:33.149778,0 days 00:00:00.619930,ReLU,Sigmoid,,,21,21,23.0,,,0.05655923105280794,2,173,0.4178252808097756,0.000771858672792607,128.52374971829929,COMPLETE
692,0.3668832778930664,2023-09-04 22:06:33.150423,2023-09-04 22:06:33.937790,0 days 00:00:00.787367,Tanh,,,,28,22,,,,0.0027517799088959114,1,147,0.2565198544724551,6.443416805281941e-05,108.43758194534867,COMPLETE
693,0.3721502423286438,2023-09-04 22:06:33.938141,2023-09-04 22:06:35.140873,0 days 00:00:01.202732,Tanh,ReLU,,,19,12,15.0,,,0.001213962685138169,2,184,0.18361789954743452,0.00011615692026166557,118.59380892048712,COMPLETE
694,0.2937374413013458,2023-09-04 22:06:35.141274,2023-09-04 22:06:36.114737,0 days 00:00:00.973463,Tanh,Sigmoid,Sigmoid,Tanh,46,21,17.0,3.0,21.0,0.03013776090140944,4,218,0.7757552903914804,1.5069885792015865e-05,110.6434515439547,COMPLETE
695,0.47327980399131775,2023-09-04 22:06:36.115344,2023-09-04 22:06:37.780252,0 days 00:00:01.664908,Tanh,Tanh,,,14,10,24.0,,,4.020078853295896e-05,2,157,0.2318025631331879,7.475119749660008e-05,116.37348233362671,COMPLETE
696,0.3446592688560486,2023-09-04 22:06:37.780626,2023-09-04 22:06:38.051971,0 days 00:00:00.271345,Leaky,Sigmoid,,,34,22,6.0,,,0.011973545248093726,2,251,0.22277432437127548,5.11919134187428e-05,149.28269902671255,COMPLETE
697,0.40126439929008484,2023-09-04 22:06:38.052350,2023-09-04 22:06:40.798482,0 days 00:00:02.746132,Tanh,,,,31,20,,,,0.00029973434240857715,1,209,0.7176682703570518,0.00013712207155963942,114.36045961516896,COMPLETE
698,0.35788393020629883,2023-09-04 22:06:40.798842,2023-09-04 22:06:41.075363,0 days 00:00:00.276521,ReLU,ReLU,,,11,23,14.0,,,0.01984821842036736,2,238,0.11525109866026531,0.00032537733930497546,123.69656811338483,COMPLETE
699,0.33570224046707153,2023-09-04 22:06:41.075735,2023-09-04 22:06:42.681537,0 days 00:00:01.605802,Tanh,Sigmoid,Leaky,Tanh,25,21,22.0,7.0,18.0,0.002421402516130766,4,137,0.6619459268123176,9.302313247502134e-05,110.46702525654777,COMPLETE
700,0.3688619136810303,2023-09-04 22:06:42.681961,2023-09-04 22:06:43.039101,0 days 00:00:00.357140,Tanh,Sigmoid,,,78,12,3.0,,,0.008545294565271505,2,321,0.33791022479340516,1.7349781948765293e-05,335.21219473825374,COMPLETE
701,0.4087868630886078,2023-09-04 22:06:43.039453,2023-09-04 22:06:43.499320,0 days 00:00:00.459867,Tanh,,,,51,24,,,,0.0005222855638093129,1,186,0.162590468252702,0.0002613922189303908,108.00176850185599,COMPLETE
702,0.4554941952228546,2023-09-04 22:06:43.499685,2023-09-04 22:06:45.845113,0 days 00:00:02.345428,Sigmoid,Tanh,,,38,20,5.0,,,0.00013661969268022355,2,164,0.7440259355482769,0.00019397135971933015,107.97387932568061,COMPLETE
703,0.3683685064315796,2023-09-04 22:06:45.845464,2023-09-04 22:06:46.181765,0 days 00:00:00.336301,Tanh,ReLU,Tanh,Sigmoid,75,11,6.0,6.0,9.0,0.013805513458845613,4,260,0.3210957744177499,5.62353216607049e-05,120.5277009010315,COMPLETE
704,0.5748321413993835,2023-09-04 22:06:46.182170,2023-09-04 22:06:49.373419,0 days 00:00:03.191249,Tanh,Sigmoid,,,42,21,14.0,,,1.8114371719358534e-05,2,220,0.7998322836156805,1.1182807061316537e-05,109.32792257829146,COMPLETE
705,0.3312610387802124,2023-09-04 22:06:49.373783,2023-09-04 22:06:50.010764,0 days 00:00:00.636981,ReLU,Sigmoid,,,17,18,4.0,,,0.006730884296683035,2,276,0.5517855848027974,0.015125963258432611,138.2538525811557,COMPLETE
706,0.3175545632839203,2023-09-04 22:06:50.011128,2023-09-04 22:06:51.018704,0 days 00:00:01.007576,Tanh,,,,54,22,,,,0.004462038613913571,1,231,0.7701916162363371,0.0005801359873696966,117.90414162052488,COMPLETE
707,0.3748455345630646,2023-09-04 22:06:51.019049,2023-09-04 22:06:51.283333,0 days 00:00:00.264284,Tanh,Leaky,,,20,17,19.0,,,0.038997470542676056,2,200,0.1909086382666348,1.0013987118295787e-05,1409.396650834517,COMPLETE
708,0.3606220483779907,2023-09-04 22:06:51.283690,2023-09-04 22:06:51.761357,0 days 00:00:00.477667,Tanh,Sigmoid,Leaky,Tanh,23,24,18.0,5.0,2.0,0.016635365068536526,4,146,0.31917055007284867,1.3631289658833938e-05,111.8626229070848,COMPLETE
709,0.3940329849720001,2023-09-04 22:06:51.761794,2023-09-04 22:06:51.948493,0 days 00:00:00.186699,Tanh,ReLU,,,36,23,5.0,,,0.023424708104182387,2,62,0.298410911969054,2.0224924811941276e-05,127.76596717834472,COMPLETE
710,0.2977908253669739,2023-09-04 22:06:51.948861,2023-09-04 22:06:53.802673,0 days 00:00:01.853812,Leaky,Tanh,,,15,21,13.0,,,0.0014873847746588833,2,301,0.6242934819989294,0.0035887245233105305,102.22023182183923,COMPLETE
711,0.3971073031425476,2023-09-04 22:06:53.803054,2023-09-04 22:06:54.341396,0 days 00:00:00.538342,Tanh,,,,12,4,,,,0.030472086881032007,1,72,0.6946380739345716,7.852667090546734e-05,121.3580053229081,COMPLETE
712,0.3456994891166687,2023-09-04 22:06:54.341790,2023-09-04 22:06:54.801125,0 days 00:00:00.459335,ReLU,Sigmoid,,,40,19,7.0,,,0.009713428673288997,2,416,0.4925103380592017,0.00010601704698751583,107.15745110945268,COMPLETE
713,0.36253711581230164,2023-09-04 22:06:54.801500,2023-09-04 22:06:55.057213,0 days 00:00:00.255713,Tanh,,,,21,20,,,,0.048972126704175875,1,120,0.5994650982544227,0.0019180740586131582,107.4893068586077,COMPLETE
714,1.004615068435669,2023-09-04 22:06:55.057574,2023-09-04 22:06:55.336725,0 days 00:00:00.279151,Tanh,Sigmoid,Leaky,Leaky,44,23,16.0,4.0,24.0,0.01134711521997949,4,180,0.726057875663848,0.0412932448351162,101.72576522827148,COMPLETE
715,0.25387969613075256,2023-09-04 22:06:55.337138,2023-09-04 22:06:56.330551,0 days 00:00:00.993413,Tanh,ReLU,,,19,22,21.0,,,0.003619318805417126,2,161,0.75191287375118,4.34810156247521e-05,99.29047881232367,COMPLETE
716,0.3454010486602783,2023-09-04 22:06:56.330934,2023-09-04 22:06:57.100214,0 days 00:00:00.769280,Tanh,ReLU,,,25,22,21.0,,,0.0036111529906418137,2,174,0.5323192249000054,4.442054614737526e-05,107.00016193000637,COMPLETE
717,0.34226393699645996,2023-09-04 22:06:57.100591,2023-09-04 22:06:58.940664,0 days 00:00:01.840073,Sigmoid,ReLU,,,19,22,20.0,,,0.004336404789457789,2,167,0.7721696139408738,3.8787068514914696e-05,102.9737560215281,COMPLETE
718,0.29143446683883667,2023-09-04 22:06:58.941027,2023-09-04 22:07:00.713740,0 days 00:00:01.772713,Tanh,ReLU,,,21,22,21.0,,,0.0026660979801916393,2,174,0.7480841378107765,5.56381788344831e-05,94.46080339219836,COMPLETE
719,0.3413800001144409,2023-09-04 22:07:00.714392,2023-09-04 22:07:02.384772,0 days 00:00:01.670380,Tanh,ReLU,,,33,23,19.0,,,0.006646347921891355,2,188,0.7733340812821706,4.30416291301971e-05,96.41239905357361,COMPLETE
720,0.33469244837760925,2023-09-04 22:07:02.385482,2023-09-04 22:07:02.769803,0 days 00:00:00.384321,ReLU,ReLU,,,23,22,20.0,,,0.005973580190101469,2,457,0.1080029703796367,0.0001558496539485571,146.76768405620868,COMPLETE
721,0.3109484016895294,2023-09-04 22:07:02.770444,2023-09-04 22:07:04.758129,0 days 00:00:01.987685,Tanh,ReLU,,,29,21,19.0,,,0.0044320589484958695,2,439,0.7471372513595338,6.197879659546224e-05,90.58862862935881,COMPLETE
722,0.32249462604522705,2023-09-04 22:07:04.758562,2023-09-04 22:07:05.438049,0 days 00:00:00.679487,Tanh,ReLU,,,38,21,20.0,,,0.003617547170741978,2,163,0.4763533294242785,0.0029584476838466953,104.94408232165921,COMPLETE
723,0.4098246395587921,2023-09-04 22:07:05.438410,2023-09-04 22:07:05.622969,0 days 00:00:00.184559,Leaky,ReLU,,,69,7,21.0,,,0.0030529187850853587,2,160,0.1887989126110824,0.000380473359163009,117.33400539476044,COMPLETE
724,0.40023159980773926,2023-09-04 22:07:05.623334,2023-09-04 22:07:07.747403,0 days 00:00:02.124069,Tanh,ReLU,,,19,23,22.0,,,9.981843938457694e-05,2,151,0.3831250559996599,3.5455996843862594e-05,130.14240537731854,COMPLETE
725,0.43782103061676025,2023-09-04 22:07:07.747791,2023-09-04 22:07:14.979538,0 days 00:00:07.231747,Tanh,ReLU,,,22,22,21.0,,,1.0064772108071366e-05,2,206,0.7992933228002275,4.6994665691131726e-05,98.89094521235494,COMPLETE
726,0.32618260383605957,2023-09-04 22:07:14.980207,2023-09-04 22:07:16.354001,0 days 00:00:01.373794,Tanh,ReLU,,,35,20,18.0,,,0.005159348476933893,2,192,0.7166033411679281,7.236774109097866e-05,83.568413833092,COMPLETE
727,0.4466592073440552,2023-09-04 22:07:16.354643,2023-09-04 22:07:16.589030,0 days 00:00:00.234387,ReLU,ReLU,,,17,21,19.0,,,0.02664068175522182,2,169,0.10465436749830692,0.00012869850952740256,120.4210706438337,COMPLETE
728,0.3613288998603821,2023-09-04 22:07:16.589537,2023-09-04 22:07:17.281310,0 days 00:00:00.691773,Tanh,ReLU,,,41,22,4.0,,,0.002475271893428971,2,57,0.5772311758862575,0.0001986429600556049,108.57009740461383,COMPLETE
729,0.33394697308540344,2023-09-04 22:07:17.281691,2023-09-04 22:07:17.984418,0 days 00:00:00.702727,Tanh,Tanh,,,14,24,20.0,,,0.036428455634110096,2,179,0.774012117915197,5.098584164038692e-05,116.92420839008533,COMPLETE
730,0.3118882179260254,2023-09-04 22:07:17.984807,2023-09-04 22:07:19.158584,0 days 00:00:01.173777,Sigmoid,ReLU,,,48,21,22.0,,,0.005317295870389073,2,157,0.7354053937591006,8.855207735652669e-05,101.70732525416783,COMPLETE
731,0.4366762936115265,2023-09-04 22:07:19.159240,2023-09-04 22:07:21.571550,0 days 00:00:02.412310,Tanh,Tanh,,,10,23,6.0,,,0.0077687813650024985,2,216,0.6919597225953259,0.0442120255239388,150.60878633197984,COMPLETE
732,0.5554207563400269,2023-09-04 22:07:21.571959,2023-09-04 22:07:22.321308,0 days 00:00:00.749349,Tanh,ReLU,,,26,20,5.0,,,9.01680812584748e-05,2,69,0.36092863516981843,0.0006974349995410557,119.77831456281137,COMPLETE
733,0.3839613199234009,2023-09-04 22:07:22.321709,2023-09-04 22:07:26.238097,0 days 00:00:03.916388,Tanh,,,,20,22,,,,0.0009277806063817788,1,242,0.7480649166114048,6.216847409870046e-05,108.29426025177216,COMPLETE
734,0.3790198266506195,2023-09-04 22:07:26.238456,2023-09-04 22:07:26.897898,0 days 00:00:00.659442,ReLU,ReLU,,,23,3,15.0,,,0.031530549735438125,2,224,0.5131859944241258,0.0001616614535506369,104.84071350097656,COMPLETE
735,0.377127081155777,2023-09-04 22:07:26.898265,2023-09-04 22:07:27.388996,0 days 00:00:00.490731,Tanh,,,,16,21,,,,0.023170412427432084,1,163,0.40374082954953255,0.00023616084095385293,103.8697715335422,COMPLETE
736,0.32303372025489807,2023-09-04 22:07:27.389377,2023-09-04 22:07:27.844706,0 days 00:00:00.455329,Tanh,Leaky,,,64,16,3.0,,,0.007131030513509999,2,78,0.7972623422298021,0.00043234969046228495,99.36798646714952,COMPLETE
737,0.49623462557792664,2023-09-04 22:07:27.845115,2023-09-04 22:07:28.358328,0 days 00:00:00.513213,Tanh,Tanh,,,18,23,2.0,,,0.06649022032631965,2,150,0.7998894758753478,3.4135626291629415e-05,122.66009470621745,COMPLETE
738,0.33139482140541077,2023-09-04 22:07:28.358789,2023-09-04 22:07:30.584621,0 days 00:00:02.225832,Leaky,ReLU,,,37,20,18.0,,,0.002031243978264435,2,173,0.7131732998253129,4.2502729067522995e-05,108.34130357716181,COMPLETE
739,0.39008694887161255,2023-09-04 22:07:30.585348,2023-09-04 22:07:31.156721,0 days 00:00:00.571373,Tanh,,,,21,22,,,,0.0038038158238177322,1,202,0.16592311023240858,0.00100968270243216,104.83779958776526,COMPLETE
740,0.4434249699115753,2023-09-04 22:07:31.157250,2023-09-04 22:07:31.486025,0 days 00:00:00.328775,Tanh,ReLU,,,13,21,19.0,,,0.020123181685595376,2,398,0.2050543249034007,0.028092716710277556,257.19322713216144,COMPLETE
741,0.4827142655849457,2023-09-04 22:07:31.486534,2023-09-04 22:07:32.782598,0 days 00:00:01.296064,ReLU,Tanh,,,25,22,22.0,,,5.8071147129635434e-05,2,160,0.1965481084283252,0.00010574775163667929,222.6360704421997,COMPLETE
742,0.7553098201751709,2023-09-04 22:07:32.782967,2023-09-04 22:07:33.966643,0 days 00:00:01.183676,Tanh,Sigmoid,,,31,20,21.0,,,2.7531484752570866e-05,2,56,0.7566045544321189,0.00013531007213152325,111.0200913293021,COMPLETE
743,0.41239985823631287,2023-09-04 22:07:33.967120,2023-09-04 22:07:34.474528,0 days 00:00:00.507408,Tanh,Sigmoid,,,19,21,5.0,,,0.009003706494542178,2,227,0.14684242823284463,0.0013379343383316852,170.85445636251697,COMPLETE
744,0.39387401938438416,2023-09-04 22:07:34.475300,2023-09-04 22:07:35.197677,0 days 00:00:00.722377,Sigmoid,,,,15,24,,,,0.04347329157926389,1,50,0.27588875591528494,7.191847276225138e-05,124.6589995792934,COMPLETE
745,0.35289210081100464,2023-09-04 22:07:35.199312,2023-09-04 22:07:35.766434,0 days 00:00:00.567122,Tanh,ReLU,Sigmoid,,39,11,17.0,9.0,,0.027495561055206896,3,67,0.22171417608050398,0.000843061845320135,123.28878242091129,COMPLETE
746,0.39071816205978394,2023-09-04 22:07:35.767171,2023-09-04 22:07:47.747839,0 days 00:00:11.980668,Tanh,Sigmoid,,,24,23,7.0,,,0.0002002295676139212,2,213,0.6686333635455105,2.7062647142912682e-05,226.7968310145705,COMPLETE
747,0.3940223455429077,2023-09-04 22:07:47.748506,2023-09-04 22:07:50.743552,0 days 00:00:02.995046,Tanh,Tanh,Sigmoid,,28,21,4.0,1.0,,0.03190331694230102,3,365,0.5602829512856238,5.398624740242959e-05,125.94156738807415,COMPLETE
748,0.36257240176200867,2023-09-04 22:07:50.744281,2023-09-04 22:07:52.375396,0 days 00:00:01.631115,ReLU,Sigmoid,,,97,16,14.0,,,0.0033194018079128603,2,187,0.7260081682187914,0.0017022790113705246,96.13217264063218,COMPLETE
749,0.3369518220424652,2023-09-04 22:07:52.376220,2023-09-04 22:07:54.729404,0 days 00:00:02.353184,Tanh,ReLU,,,43,19,15.0,,,0.0061661917383402775,2,78,0.7683134562079227,8.946804384206048e-05,97.30198165348598,COMPLETE
750,0.3272213935852051,2023-09-04 22:07:54.730052,2023-09-04 22:08:03.192507,0 days 00:00:08.462455,Leaky,,,,33,22,,,,0.00026977378997876736,1,237,0.7056887145461531,3.878229574601612e-05,112.27754439985702,COMPLETE
751,0.3237644135951996,2023-09-04 22:08:03.193176,2023-09-04 22:08:05.194608,0 days 00:00:02.001432,Tanh,Sigmoid,Tanh,,22,20,19.0,10.0,,0.004629797304504263,3,252,0.38729366578340313,0.0002855606378388001,238.72915010674055,COMPLETE
752,0.46034663915634155,2023-09-04 22:08:05.195278,2023-09-04 22:08:06.237911,0 days 00:00:01.042633,Tanh,Sigmoid,,,59,21,8.0,,,0.017411036247822545,2,181,0.7455200319507821,0.08675479408301025,106.36388142903645,COMPLETE
753,0.5502231121063232,2023-09-04 22:08:06.238551,2023-09-04 22:08:23.576378,0 days 00:00:17.337827,Tanh,ReLU,,,12,23,3.0,,,2.4978204779071413e-05,2,147,0.7720941552612661,2.320413828262434e-05,97.83244593613813,COMPLETE
754,0.40807825326919556,2023-09-04 22:08:23.577061,2023-09-04 22:08:23.894590,0 days 00:00:00.317529,Tanh,,,,17,19,,,,0.03947819195905464,1,169,0.15731221093616055,0.00018114992538420424,221.08064880371094,COMPLETE
755,0.3913458585739136,2023-09-04 22:08:23.895211,2023-09-04 22:08:36.090689,0 days 00:00:12.195478,ReLU,Tanh,,,10,5,1.0,,,0.0002341576209026698,2,85,0.798502851667037,0.02520902176241915,117.31463928222657,COMPLETE
756,0.28053605556488037,2023-09-04 22:08:36.091365,2023-09-04 22:08:37.967948,0 days 00:00:01.876583,Tanh,Sigmoid,Sigmoid,,35,17,6.0,11.0,,0.02184467105299079,3,154,0.7378669037279407,4.799428532355144e-05,96.67314863204956,COMPLETE
757,0.4756130576133728,2023-09-04 22:08:37.968661,2023-09-04 22:08:42.773811,0 days 00:00:04.805150,Sigmoid,Sigmoid,,,83,21,8.0,,,0.0001568032363194959,2,219,0.6419902190892611,6.225996519061683e-05,119.2319531723789,COMPLETE
758,0.41590985655784607,2023-09-04 22:08:42.774529,2023-09-04 22:08:43.792220,0 days 00:00:01.017691,Tanh,Leaky,Leaky,,20,20,12.0,7.0,,0.005152296683031277,3,66,0.1052433756793606,0.00011611193640057333,1249.0335907936096,COMPLETE
759,0.37639740109443665,2023-09-04 22:08:43.793011,2023-09-04 22:08:44.385498,0 days 00:00:00.592487,Tanh,ReLU,,,73,22,22.0,,,0.008476347046666801,2,192,0.27553052462359445,0.0027782430718080245,106.8762472243536,COMPLETE
760,0.32307782769203186,2023-09-04 22:08:44.386191,2023-09-04 22:08:45.787637,0 days 00:00:01.401446,Tanh,,,,18,21,,,,0.010951221845995786,1,76,0.6832770218515217,0.0036701491207348,97.61846558944039,COMPLETE
761,0.306976854801178,2023-09-04 22:08:45.788330,2023-09-04 22:08:47.175980,0 days 00:00:01.387650,Tanh,Sigmoid,,,41,24,20.0,,,0.02678529604256327,2,205,0.7689056607482979,1.6127787396240823e-05,99.62185846964518,COMPLETE
762,0.31169286370277405,2023-09-04 22:08:47.176654,2023-09-04 22:08:49.122364,0 days 00:00:01.945710,ReLU,Tanh,Tanh,,22,22,14.0,8.0,,0.034706378444776594,3,87,0.5992620153820409,1.2551091877259834e-05,225.25757259792752,COMPLETE
763,0.4639991819858551,2023-09-04 22:08:49.123074,2023-09-04 22:08:57.967383,0 days 00:00:08.844309,Tanh,Sigmoid,,,16,23,18.0,,,4.435874685243112e-05,2,163,0.4462268395925264,0.009436782663675135,123.78045752589688,COMPLETE
764,0.39524203538894653,2023-09-04 22:08:57.968070,2023-09-04 22:09:00.050292,0 days 00:00:02.082222,Leaky,ReLU,Leaky,,37,20,4.0,3.0,,0.048710956690925275,3,233,0.7179847424017661,0.00548802183960795,116.15089998747173,COMPLETE
