number,value,datetime_start,datetime_complete,duration,params_activation1,params_activation2,params_activation3,params_activation4,params_batch_size,params_fl1,params_fl2,params_fl3,params_fl4,params_learning_rate,params_n_layers,params_num_epochs,params_train_size,params_weight_decay,user_attrs_mre,state
1354,0.3408214747905731,2023-09-04 21:33:27.371678,2023-09-04 21:33:30.010937,0 days 00:00:02.639259,Tanh,Tanh,,,76,19,9.0,,,0.0004991713830852941,2,451,0.7055363205398788,9.983903689042369e-05,182.76010126800034,COMPLETE
1355,0.35972651839256287,2023-09-04 21:33:30.011392,2023-09-04 21:33:30.184991,0 days 00:00:00.173599,Leaky,Tanh,,,65,20,12.0,,,0.023231826893909895,2,239,0.1407936346349374,0.0048507806320330854,411.8204137290396,COMPLETE
1356,0.6051655411720276,2023-09-04 21:33:30.185463,2023-09-04 21:33:31.074987,0 days 00:00:00.889524,Tanh,ReLU,,,74,18,7.0,,,6.07066122986572e-05,2,311,0.19309406237006196,0.0027640353668188793,135.4126331292548,COMPLETE
1357,0.4421561360359192,2023-09-04 21:33:31.075418,2023-09-04 21:33:31.582172,0 days 00:00:00.506754,Sigmoid,Sigmoid,,,82,17,2.0,,,0.016099729758749858,2,229,0.31438844113824604,0.0005059677636673032,171.10250160286017,COMPLETE
1358,0.3615752160549164,2023-09-04 21:33:31.582615,2023-09-04 21:33:31.982807,0 days 00:00:00.400192,Tanh,Tanh,,,77,18,11.0,,,0.043488250456862367,2,248,0.7709091031281768,0.0015568307630626993,108.8527616228376,COMPLETE
1359,0.38353466987609863,2023-09-04 21:33:31.983252,2023-09-04 21:33:32.885870,0 days 00:00:00.902618,Tanh,ReLU,Sigmoid,,80,16,8.0,12.0,,0.0033030530864722584,3,295,0.36053522023110635,0.00015403887501493007,206.6027000291007,COMPLETE
1360,0.4544289708137512,2023-09-04 21:33:32.886709,2023-09-04 21:33:33.249596,0 days 00:00:00.362887,Leaky,Tanh,,,89,17,9.0,,,0.028013906903042923,2,261,0.1305280427890445,0.0001189483210047987,195.7146505876021,COMPLETE
1361,0.2929401099681854,2023-09-04 21:33:33.250070,2023-09-04 21:33:34.162289,0 days 00:00:00.912219,Tanh,Leaky,,,54,20,23.0,,,0.004885751624429625,2,304,0.7992707913751678,0.0006122127284815924,462.5073301042829,COMPLETE
1362,1.031467318534851,2023-09-04 21:33:34.162752,2023-09-04 21:33:34.525001,0 days 00:00:00.362249,ReLU,Sigmoid,,,78,19,11.0,,,0.00010036523215097613,2,161,0.11414417973850724,0.011301464651153564,197.94202934881176,COMPLETE
1363,0.392762154340744,2023-09-04 21:33:34.525447,2023-09-04 21:33:34.708946,0 days 00:00:00.183499,Tanh,Tanh,,,67,18,8.0,,,0.019616605586495722,2,103,0.33016181107848835,0.00019506089096821714,159.7156122381037,COMPLETE
1364,0.3417353928089142,2023-09-04 21:33:34.709427,2023-09-04 21:33:35.344005,0 days 00:00:00.634578,Leaky,ReLU,,,84,17,9.0,,,0.00747374912398634,2,285,0.7320904004684262,4.415948836664038e-05,176.84096692956012,COMPLETE
1365,0.42257919907569885,2023-09-04 21:33:35.344483,2023-09-04 21:33:35.691432,0 days 00:00:00.346949,Tanh,,,,81,18,,,,0.011918481842696468,1,317,0.3763570994402319,1.9728273540459965e-05,186.4581322140164,COMPLETE
1366,0.5847744941711426,2023-09-04 21:33:35.691892,2023-09-04 21:33:40.209514,0 days 00:00:04.517622,Tanh,Tanh,,,73,19,7.0,,,0.00010159319447415502,2,329,0.6129171755735158,0.0019460849848197276,194.7358717295174,COMPLETE
1367,0.6536150574684143,2023-09-04 21:33:40.209966,2023-09-04 21:33:40.410220,0 days 00:00:00.200254,Tanh,ReLU,ReLU,Tanh,86,16,10.0,11.0,3.0,0.03457868058550274,4,209,0.10880229299698485,0.00023661285116731632,258.3924207500383,COMPLETE
1368,0.3448847234249115,2023-09-04 21:33:40.410691,2023-09-04 21:33:42.312024,0 days 00:00:01.901333,Leaky,Sigmoid,,,76,17,11.0,,,0.002940492847438008,2,277,0.6611173944066411,8.175964001759844e-05,142.62564891217704,COMPLETE
1369,0.20568321645259857,2023-09-04 21:33:42.312868,2023-09-04 21:33:43.005087,0 days 00:00:00.692219,Tanh,Tanh,Tanh,,79,18,24.0,3.0,,0.00968114403784785,3,410,0.7688087121031721,0.0001353458352513267,154.9231299606024,COMPLETE
1370,0.33796215057373047,2023-09-04 21:33:43.005567,2023-09-04 21:33:43.723486,0 days 00:00:00.717919,Tanh,Tanh,Tanh,,79,19,24.0,1.0,,0.011361057917644957,3,439,0.6952232244702838,0.00010113398356128897,158.82815725153142,COMPLETE
1371,0.41614776849746704,2023-09-04 21:33:43.723957,2023-09-04 21:33:43.990824,0 days 00:00:00.266867,ReLU,Leaky,Tanh,,80,19,24.0,3.0,,0.010149266769995632,3,434,0.17577844155031078,0.0001356062009922151,207.5629913330078,COMPLETE
1372,0.40664201974868774,2023-09-04 21:33:43.991270,2023-09-04 21:33:44.322013,0 days 00:00:00.330743,Tanh,Tanh,Tanh,,78,18,24.0,2.0,,0.00881523958652755,3,391,0.1880419040433323,0.00011523981249633612,182.16451527522162,COMPLETE
1373,0.47562849521636963,2023-09-04 21:33:44.322471,2023-09-04 21:33:44.915408,0 days 00:00:00.592937,Leaky,ReLU,Tanh,,81,19,24.0,4.0,,0.009960773676623362,3,368,0.4186788709359863,9.478373952049736e-05,205.52548302544488,COMPLETE
1374,0.4957858920097351,2023-09-04 21:33:44.915878,2023-09-04 21:33:45.154470,0 days 00:00:00.238592,Tanh,Sigmoid,Tanh,,79,18,24.0,3.0,,0.013435597560737611,3,431,0.20153435161676436,0.0001299817181438797,214.59321679009332,COMPLETE
1375,0.3355407416820526,2023-09-04 21:33:45.154952,2023-09-04 21:33:45.443114,0 days 00:00:00.288162,Tanh,Tanh,Tanh,,82,19,24.0,10.0,,0.013165327400829728,3,455,0.25452511272391803,7.310842515362386e-05,373.9526895376352,COMPLETE
1376,0.35518115758895874,2023-09-04 21:33:45.443593,2023-09-04 21:33:45.930043,0 days 00:00:00.486450,Leaky,ReLU,Tanh,,77,18,24.0,5.0,,0.006138415249510893,3,417,0.7228483895739197,0.00015338312822138142,178.8406000381861,COMPLETE
1377,0.6075629591941833,2023-09-04 21:33:45.930516,2023-09-04 21:33:50.796196,0 days 00:00:04.865680,Tanh,Tanh,Tanh,,83,19,24.0,7.0,,1.7515972956159973e-05,3,462,0.5658432840395055,0.00010322401861781681,160.07421191326983,COMPLETE
1378,0.45515745878219604,2023-09-04 21:33:50.796646,2023-09-04 21:33:51.458384,0 days 00:00:00.661738,Tanh,Sigmoid,Tanh,,79,18,23.0,14.0,,0.010134929480132872,3,373,0.7451030816186027,0.01576313035902813,181.13251100267684,COMPLETE
1379,0.2915085256099701,2023-09-04 21:33:51.458824,2023-09-04 21:33:52.114805,0 days 00:00:00.655981,Tanh,ReLU,Tanh,,80,18,24.0,16.0,,0.008565895063373415,3,353,0.6780016846418156,0.00011994825236957658,142.42636321020908,COMPLETE
1380,0.325008749961853,2023-09-04 21:33:52.115274,2023-09-04 21:33:52.754191,0 days 00:00:00.638917,ReLU,Tanh,Sigmoid,,77,18,23.0,9.0,,0.00742921464505801,3,149,0.7665722109492522,0.0009234807608242752,136.09576475854013,COMPLETE
1381,0.565635621547699,2023-09-04 21:33:52.754655,2023-09-04 21:33:53.064356,0 days 00:00:00.309701,Leaky,Leaky,Sigmoid,,83,20,24.0,6.0,,0.016887516644264768,3,343,0.7193632126245186,0.03528826510610612,1071.7798196543818,COMPLETE
1382,0.34762537479400635,2023-09-04 21:33:53.064832,2023-09-04 21:33:53.486205,0 days 00:00:00.421373,Tanh,Tanh,Tanh,,81,19,23.0,13.0,,0.008926727026472264,3,403,0.7481062823505975,0.0001394184541174212,165.2961950302124,COMPLETE
1383,0.4419569969177246,2023-09-04 21:33:53.486665,2023-09-04 21:33:57.865538,0 days 00:00:04.378873,Sigmoid,Sigmoid,Leaky,,78,18,23.0,2.0,,0.0003284301011484497,3,414,0.7669682608420356,0.00016355012241855323,13913.98477276051,COMPLETE
1384,0.4179224371910095,2023-09-04 21:33:57.865982,2023-09-04 21:33:58.277545,0 days 00:00:00.411563,Tanh,ReLU,Sigmoid,,76,21,24.0,15.0,,0.001446975925636103,3,392,0.18423365649056378,0.00011529795531080804,130.02542304992676,COMPLETE
1385,0.29469120502471924,2023-09-04 21:33:58.278028,2023-09-04 21:33:58.702136,0 days 00:00:00.424108,Leaky,Tanh,ReLU,,80,19,23.0,10.0,,0.012195399267460098,3,170,0.7110239800557498,0.00017362832279701562,3259.353523023201,COMPLETE
1386,0.24444574117660522,2023-09-04 21:33:58.702620,2023-09-04 21:33:59.265624,0 days 00:00:00.563004,Tanh,ReLU,Sigmoid,,84,18,24.0,8.0,,0.015863629289507082,3,377,0.7431589463852925,8.668086299276819e-05,275.9212001164754,COMPLETE
1387,0.2855009138584137,2023-09-04 21:33:59.266092,2023-09-04 21:33:59.707470,0 days 00:00:00.441378,Tanh,Tanh,Sigmoid,,90,19,24.0,8.0,,0.01582289112390628,3,400,0.6830951737922795,8.600700540721954e-05,156.44439487457277,COMPLETE
1388,0.32859429717063904,2023-09-04 21:33:59.707948,2023-09-04 21:34:00.153430,0 days 00:00:00.445482,Tanh,,,,88,19,,,,0.019511650394647275,1,371,0.628658075225621,8.757797058681007e-05,143.89107596874237,COMPLETE
1389,0.3867318332195282,2023-09-04 21:34:00.153860,2023-09-04 21:34:00.663846,0 days 00:00:00.509986,Tanh,Sigmoid,Sigmoid,,86,18,24.0,5.0,,0.016676073549082772,3,353,0.6971785530203163,6.677969779722887e-05,371.11597491325216,COMPLETE
1390,0.4988284111022949,2023-09-04 21:34:00.664328,2023-09-04 21:34:01.671246,0 days 00:00:01.006918,Tanh,ReLU,Sigmoid,,85,18,24.0,7.0,,0.0007113391576314425,3,379,0.2855509855298573,7.082064449697704e-05,252.3564995622213,COMPLETE
1391,0.318369060754776,2023-09-04 21:34:01.671687,2023-09-04 21:34:02.019414,0 days 00:00:00.347727,Tanh,Tanh,Sigmoid,,87,19,24.0,9.0,,0.02127836661486551,3,394,0.5381689768524475,8.506305817162238e-05,1808.2258823939733,COMPLETE
1392,0.49345269799232483,2023-09-04 21:34:02.019921,2023-09-04 21:34:02.434979,0 days 00:00:00.415058,Tanh,Leaky,Sigmoid,,87,18,24.0,1.0,,0.014933968502697166,3,412,0.1656111254697368,9.75710870429101e-05,187.34824249592234,COMPLETE
1393,0.5144023299217224,2023-09-04 21:34:02.435457,2023-09-04 21:34:05.350879,0 days 00:00:02.915422,Tanh,Tanh,Sigmoid,,84,19,24.0,12.0,,7.297341811287418e-05,3,380,0.4796601431114392,5.9572898699838565e-05,173.6574705625835,COMPLETE
1394,0.3296474516391754,2023-09-04 21:34:05.351771,2023-09-04 21:34:06.366218,0 days 00:00:01.014447,Tanh,Sigmoid,Sigmoid,,56,20,24.0,6.0,,0.02272958127346371,3,408,0.6470507510872845,8.006114815430297e-05,134.6853677034378,COMPLETE
1395,0.3608319163322449,2023-09-04 21:34:06.366708,2023-09-04 21:34:06.639352,0 days 00:00:00.272644,Tanh,ReLU,Sigmoid,,84,18,23.0,11.0,,0.018169982760130904,3,395,0.20902379372187074,0.00010643872449902891,160.40054043856534,COMPLETE
1396,0.6760470271110535,2023-09-04 21:34:06.639914,2023-09-04 21:34:09.380999,0 days 00:00:02.741085,Tanh,Tanh,Sigmoid,,75,18,24.0,8.0,,2.40488605719138e-05,3,396,0.46028390067095293,0.00012598513596181674,172.72255830090455,COMPLETE
1397,0.5471234321594238,2023-09-04 21:34:09.381470,2023-09-04 21:34:09.562753,0 days 00:00:00.181283,Tanh,ReLU,Sigmoid,,85,20,24.0,13.0,,0.014662640971431282,3,405,0.23829062527424433,7.554171068768493e-05,147.72690316905147,COMPLETE
1398,0.6136101484298706,2023-09-04 21:34:09.563208,2023-09-04 21:34:09.935350,0 days 00:00:00.372142,Tanh,Tanh,Sigmoid,,78,19,23.0,4.0,,0.024374688077983854,3,383,0.7267306372576581,0.07072677874906458,216.53409604673033,COMPLETE
1399,0.48635345697402954,2023-09-04 21:34:09.935835,2023-09-04 21:34:10.392145,0 days 00:00:00.456310,Tanh,Sigmoid,Sigmoid,,83,18,23.0,11.0,,0.0042608839814142485,3,424,0.7373635546517117,0.00010013127100172674,371.6569073651288,COMPLETE
1400,0.5634593963623047,2023-09-04 21:34:10.392638,2023-09-04 21:34:10.736049,0 days 00:00:00.343411,Tanh,Leaky,Tanh,,77,19,24.0,12.0,,0.02018829432554947,3,411,0.43797702632471713,0.07347310645537583,212.11153853567023,COMPLETE
1401,0.35172614455223083,2023-09-04 21:34:10.736527,2023-09-04 21:34:10.953974,0 days 00:00:00.217447,Tanh,Tanh,Leaky,,52,18,24.0,10.0,,0.026691326981705774,3,405,0.24984130283150585,0.00013666011085643827,832.199348449707,COMPLETE
1402,0.4377073645591736,2023-09-04 21:34:10.954428,2023-09-04 21:34:11.868374,0 days 00:00:00.913946,Tanh,ReLU,Sigmoid,,48,19,23.0,6.0,,0.017564135335680173,3,366,0.6650467336485089,0.024123611028914724,212.45906277360587,COMPLETE
1403,0.5253724455833435,2023-09-04 21:34:11.868882,2023-09-04 21:34:13.176845,0 days 00:00:01.307963,Tanh,Tanh,ReLU,,88,18,23.0,5.0,,0.00015135675607529596,3,389,0.20438596757855948,0.00011348236528191734,182.28465090557972,COMPLETE
1404,0.3020049035549164,2023-09-04 21:34:13.177304,2023-09-04 21:34:14.129826,0 days 00:00:00.952522,Tanh,Sigmoid,Sigmoid,,60,18,24.0,14.0,,0.012948579580007924,3,378,0.7009427286229295,0.00014774941779030967,140.3941495768229,COMPLETE
1405,0.3471304178237915,2023-09-04 21:34:14.130299,2023-09-04 21:34:14.541137,0 days 00:00:00.410838,Tanh,ReLU,Tanh,,81,19,24.0,9.0,,0.021428098674547272,3,384,0.741879534351187,9.187643344303881e-05,215.2161455154419,COMPLETE
1406,0.32877078652381897,2023-09-04 21:34:14.541618,2023-09-04 21:34:14.946646,0 days 00:00:00.405028,Tanh,Tanh,Sigmoid,,76,20,23.0,7.0,,0.026471079771265484,3,419,0.5090284657502976,5.9060693850057386e-05,181.42466196199743,COMPLETE
1407,0.47898319363594055,2023-09-04 21:34:14.947134,2023-09-04 21:34:15.146911,0 days 00:00:00.199777,Tanh,Tanh,Sigmoid,,79,18,22.0,12.0,,0.08825585911422808,3,397,0.2980295815398195,3.595855088837418e-05,206.38321358816964,COMPLETE
1408,0.5811846256256104,2023-09-04 21:34:15.147393,2023-09-04 21:34:16.975995,0 days 00:00:01.828602,Tanh,Sigmoid,Leaky,,83,19,23.0,2.0,,0.00013886820985473924,3,425,0.2714805318538112,0.00012537452432329784,304.42720178940715,COMPLETE
1409,0.33832472562789917,2023-09-04 21:34:16.976447,2023-09-04 21:34:17.339986,0 days 00:00:00.363539,Tanh,ReLU,Tanh,,86,18,24.0,11.0,,0.01578663737114123,3,361,0.36543608687619095,6.67203501606284e-05,124.28408439486634,COMPLETE
1410,0.4677940309047699,2023-09-04 21:34:17.340478,2023-09-04 21:34:17.732446,0 days 00:00:00.391968,Tanh,Leaky,Sigmoid,,78,20,24.0,3.0,,0.01946527205853072,3,332,0.3167055874987177,0.0001751254595574729,842.9145028250558,COMPLETE
1411,0.26415619254112244,2023-09-04 21:34:17.732933,2023-09-04 21:34:18.286262,0 days 00:00:00.553329,Tanh,Tanh,ReLU,,82,18,23.0,7.0,,0.029562200763050047,3,380,0.7638730900493719,0.00010659429610819557,169.71667064319956,COMPLETE
1412,0.36830219626426697,2023-09-04 21:34:18.286732,2023-09-04 21:34:20.043933,0 days 00:00:01.757201,Tanh,ReLU,Sigmoid,,75,24,24.0,8.0,,0.001987120882959156,3,347,0.7161507211415569,0.00014819877020995405,133.00888421400538,COMPLETE
1413,0.4163643419742584,2023-09-04 21:34:20.044398,2023-09-04 21:34:24.101886,0 days 00:00:04.057488,ReLU,Tanh,Tanh,,80,19,23.0,16.0,,0.00010563342659839722,3,409,0.4442976889971532,8.161683046206821e-05,217.76212491732647,COMPLETE
1414,0.37995997071266174,2023-09-04 21:34:24.102339,2023-09-04 21:34:24.736292,0 days 00:00:00.633953,Tanh,Sigmoid,Sigmoid,,85,18,22.0,13.0,,0.003656525937593693,3,340,0.2664691152699186,0.00018621775803244025,238.26127992827315,COMPLETE
1415,0.531476616859436,2023-09-04 21:34:24.736751,2023-09-04 21:34:24.929176,0 days 00:00:00.192425,Tanh,Tanh,Sigmoid,,90,19,24.0,15.0,,0.013298099461078164,3,257,0.4020371786187125,0.0001256371934232633,748.7079072840073,COMPLETE
1416,0.4697127938270569,2023-09-04 21:34:24.929679,2023-09-04 21:34:25.094185,0 days 00:00:00.164506,Tanh,ReLU,Leaky,,77,18,23.0,10.0,,0.024136639322804028,3,400,0.12055794490599037,0.0001535554036882351,149.08993911743164,COMPLETE
1417,0.4703918397426605,2023-09-04 21:34:25.094682,2023-09-04 21:34:26.863935,0 days 00:00:01.769253,Tanh,Tanh,Sigmoid,,81,20,24.0,4.0,,0.001030067125725924,3,367,0.6785964496987511,0.00010175049730935173,370.11925531362556,COMPLETE
1418,0.3121453821659088,2023-09-04 21:34:26.864801,2023-09-04 21:34:28.070970,0 days 00:00:01.206169,Tanh,Sigmoid,Tanh,,79,14,23.0,17.0,,0.017618883549848623,3,191,0.7450706558078299,4.465904012252896e-05,139.37290165788036,COMPLETE
1419,0.2673640251159668,2023-09-04 21:34:28.071484,2023-09-04 21:34:28.817346,0 days 00:00:00.745862,Tanh,Leaky,ReLU,,58,21,22.0,9.0,,0.002381738946731218,3,393,0.7707108461514027,0.0056128411035925585,296.0870361328125,COMPLETE
1420,0.3224901258945465,2023-09-04 21:34:28.817843,2023-09-04 21:34:29.300641,0 days 00:00:00.482798,ReLU,ReLU,Sigmoid,,75,18,24.0,14.0,,0.02199559680102909,3,384,0.7052495136133036,0.00020518471987669793,170.89418421036157,COMPLETE
1421,0.28613871335983276,2023-09-04 21:34:29.301129,2023-09-04 21:34:31.961232,0 days 00:00:02.660103,Tanh,Tanh,Sigmoid,,83,19,23.0,12.0,,0.0013897914506720349,3,252,0.771945591797806,0.00013473261717173102,249.27911286127,COMPLETE
1422,0.3739781081676483,2023-09-04 21:34:31.961684,2023-09-04 21:34:32.406855,0 days 00:00:00.445171,Tanh,Tanh,Tanh,,77,19,24.0,10.0,,0.002753214130644221,3,119,0.35147155962268856,0.00016968308218649885,142.59728882278222,COMPLETE
1423,0.9798728227615356,2023-09-04 21:34:32.407340,2023-09-04 21:34:32.895436,0 days 00:00:00.488096,Tanh,Sigmoid,Sigmoid,,80,1,23.0,5.0,,0.0003683920999970269,3,203,0.16214951689810667,0.06416115113329653,156.28690023270863,COMPLETE
1424,0.3070061206817627,2023-09-04 21:34:32.895944,2023-09-04 21:34:33.290644,0 days 00:00:00.394700,Tanh,ReLU,Leaky,,88,18,22.0,11.0,,0.015010797946356725,3,135,0.7299889409919121,9.285916913378422e-05,148.89400260679184,COMPLETE
1425,0.45743322372436523,2023-09-04 21:34:33.291140,2023-09-04 21:34:36.698255,0 days 00:00:03.407115,Sigmoid,Tanh,Sigmoid,,74,18,21.0,6.0,,0.001197433911662569,3,388,0.5991283466184691,0.00011776613189304508,1150.0629449824696,COMPLETE
1426,0.5010507106781006,2023-09-04 21:34:36.698708,2023-09-04 21:34:39.467904,0 days 00:00:02.769196,Tanh,ReLU,ReLU,,85,20,24.0,8.0,,3.270590266244765e-05,3,269,0.7745286294211149,0.01979733732264889,210.15809620002833,COMPLETE
1427,0.43077996373176575,2023-09-04 21:34:39.468381,2023-09-04 21:34:39.648163,0 days 00:00:00.179782,Tanh,Tanh,Tanh,,78,19,12.0,13.0,,0.028627104643187476,3,242,0.15297823777139524,7.282244216101853e-05,220.9837420063634,COMPLETE
1428,0.27320340275764465,2023-09-04 21:34:39.648698,2023-09-04 21:34:40.758817,0 days 00:00:01.110119,ReLU,Sigmoid,Sigmoid,,81,18,12.0,1.0,,0.00537993502576134,3,324,0.7987935061840055,0.00015431892854034948,158.04358358481497,COMPLETE
1429,0.2810743451118469,2023-09-04 21:34:40.759340,2023-09-04 21:34:41.373025,0 days 00:00:00.613685,Tanh,Leaky,Sigmoid,,83,17,24.0,24.0,,0.011894957367894214,3,232,0.7418944699810266,0.0002081556974868686,152.30200327359714,COMPLETE
1430,0.6592258810997009,2023-09-04 21:34:41.373493,2023-09-04 21:34:44.008746,0 days 00:00:02.635253,Tanh,Tanh,Tanh,,76,13,23.0,8.0,,1.1578899859604421e-05,3,271,0.6748232972512007,0.00011136030769932104,299.1023097865256,COMPLETE
1431,0.3290800452232361,2023-09-04 21:34:44.009226,2023-09-04 21:34:46.689699,0 days 00:00:02.680473,Tanh,ReLU,Sigmoid,,54,18,23.0,15.0,,0.0006230147545753374,3,184,0.799554544532878,0.004152164589733039,183.84695455302364,COMPLETE
1432,0.3213832974433899,2023-09-04 21:34:46.690169,2023-09-04 21:34:47.065427,0 days 00:00:00.375258,Tanh,Tanh,Leaky,,92,18,13.0,11.0,,0.018106441184796526,3,178,0.7115912002665378,5.5461456680206194e-05,150.5825309753418,COMPLETE
1433,1.0578571557998657,2023-09-04 21:34:47.065896,2023-09-04 21:34:49.620346,0 days 00:00:02.554450,Tanh,Sigmoid,Sigmoid,,79,22,24.0,9.0,,1.605953694314494e-05,3,261,0.642923085137111,0.026196858771743013,109.75151655409071,COMPLETE
1434,0.3030184805393219,2023-09-04 21:34:49.620803,2023-09-04 21:34:50.867969,0 days 00:00:01.247166,Tanh,ReLU,ReLU,Sigmoid,50,19,22.0,7.0,15.0,0.024499250637224256,4,198,0.7447831775254862,0.0001311907517735274,160.2552025053236,COMPLETE
1435,0.5379166007041931,2023-09-04 21:34:50.868453,2023-09-04 21:34:51.011925,0 days 00:00:00.143472,ReLU,Tanh,Sigmoid,,75,17,23.0,12.0,,0.03128226435294244,3,216,0.13146890741399875,0.008484929757336411,146.80056039910568,COMPLETE
1436,0.5534558892250061,2023-09-04 21:34:51.012379,2023-09-04 21:34:52.794971,0 days 00:00:01.782592,Tanh,Leaky,Tanh,,82,15,24.0,17.0,,3.8509499170838494e-05,3,416,0.23429635762972703,0.0001667240721231899,189.40871697205765,COMPLETE
1437,0.4515767991542816,2023-09-04 21:34:52.795503,2023-09-04 21:34:55.437004,0 days 00:00:02.641501,Tanh,Tanh,,,79,17,23.0,,,0.00021831426193771853,2,261,0.7672329601530817,8.061301942149434e-05,339.01028353742544,COMPLETE
1438,0.8549793362617493,2023-09-04 21:34:55.437453,2023-09-04 21:34:57.143428,0 days 00:00:01.705975,Tanh,Sigmoid,,,77,19,9.0,,,1.3907978303662377e-05,2,317,0.41295625389947865,0.010748042569921002,132.83022811360163,COMPLETE
1439,0.5446107983589172,2023-09-04 21:34:57.143880,2023-09-04 21:34:57.849959,0 days 00:00:00.706079,Tanh,ReLU,Sigmoid,,87,20,24.0,13.0,,0.0004272412195589622,3,191,0.21594277008363688,9.243347451619136e-05,158.06180712315424,COMPLETE
1440,0.41021254658699036,2023-09-04 21:34:57.850404,2023-09-04 21:35:01.509762,0 days 00:00:03.659358,Tanh,Tanh,,,56,18,22.0,,,0.00016681409928252577,2,442,0.7241470306227054,0.00023704097893838488,364.9813889310507,COMPLETE
1441,0.4244103729724884,2023-09-04 21:35:01.510222,2023-09-04 21:35:01.756425,0 days 00:00:00.246203,Tanh,ReLU,,,84,17,12.0,,,0.014699401044582948,2,160,0.2501754447627689,0.00017969819129884555,455.33417121731503,COMPLETE
1442,0.38705340027809143,2023-09-04 21:35:01.756868,2023-09-04 21:35:01.983108,0 days 00:00:00.226240,ReLU,Tanh,,,81,18,20.0,,,0.020274863867465975,2,100,0.17949400112295674,1.764649119955128e-05,308.85529011693495,COMPLETE
1443,0.538902223110199,2023-09-04 21:35:01.983557,2023-09-04 21:35:04.437147,0 days 00:00:02.453590,Tanh,Sigmoid,,,61,19,9.0,,,6.749441991175259e-05,2,252,0.6936206802087007,0.00014296599458533566,177.6236361851768,COMPLETE
1444,0.4249301552772522,2023-09-04 21:35:04.437625,2023-09-04 21:35:05.314239,0 days 00:00:00.876614,Tanh,Tanh,Sigmoid,,78,17,23.0,3.0,,0.007036395161453061,3,338,0.7497008327186855,0.00010368729302664239,160.26976569039482,COMPLETE
1445,0.3522645831108093,2023-09-04 21:35:05.314703,2023-09-04 21:35:05.616167,0 days 00:00:00.301464,Sigmoid,ReLU,,,74,18,13.0,,,0.03507634753963464,2,431,0.33399354375617574,3.2648852664136945e-05,134.3282437133789,COMPLETE
1446,0.28692343831062317,2023-09-04 21:35:05.616635,2023-09-04 21:35:06.171345,0 days 00:00:00.554710,Tanh,Sigmoid,,,80,18,24.0,,,0.024487968142453582,2,270,0.7712610967388719,2.435099580862976e-05,280.74441851102387,COMPLETE
1447,0.5951533317565918,2023-09-04 21:35:06.171831,2023-09-04 21:35:08.846740,0 days 00:00:02.674909,Tanh,Tanh,,,76,19,11.0,,,2.7816887947991298e-05,2,276,0.7991023074965314,0.00013128634921859164,296.60920455490333,COMPLETE
