number,value,datetime_start,datetime_complete,duration,params_activation1,params_activation2,params_activation3,params_activation4,params_batch_size,params_fl1,params_fl2,params_fl3,params_fl4,params_learning_rate,params_n_layers,params_num_epochs,params_train_size,params_weight_decay,user_attrs_mre,state
1905,0.5661718249320984,2023-09-04 22:42:58.492710,2023-09-04 22:42:58.985008,0 days 00:00:00.492298,Tanh,ReLU,Sigmoid,Leaky,38,21,1.0,8.0,16.0,0.008481342583933365,4,149,0.1449886225161052,0.00021851722860513227,301.68329486846926,COMPLETE
1906,0.4398931562900543,2023-09-04 22:42:58.985539,2023-09-04 22:42:59.325358,0 days 00:00:00.339819,ReLU,ReLU,Tanh,Sigmoid,41,9,22.0,6.0,12.0,0.02403304087906321,4,187,0.11839806102071582,0.0001326119737522425,228.67919787238625,COMPLETE
1907,0.37960878014564514,2023-09-04 22:42:59.325883,2023-09-04 22:43:00.134488,0 days 00:00:00.808605,Tanh,Leaky,Leaky,ReLU,35,20,8.0,11.0,14.0,0.09495959342314234,4,200,0.657347178128186,0.0001782289429261053,1817.3569708930122,COMPLETE
1908,0.35525548458099365,2023-09-04 22:43:00.134999,2023-09-04 22:43:01.020675,0 days 00:00:00.885676,Tanh,ReLU,Sigmoid,Sigmoid,65,4,23.0,8.0,10.0,0.002430221633582877,4,177,0.44247498357061654,4.785027978753992e-05,116.88997513620477,COMPLETE
1909,0.34801870584487915,2023-09-04 22:43:01.021241,2023-09-04 22:43:01.540939,0 days 00:00:00.519698,Tanh,ReLU,Tanh,Tanh,93,21,22.0,9.0,13.0,0.012295264235879299,4,215,0.7498351688328938,2.5957272181652548e-05,109.41578059726291,COMPLETE
1910,1.1850775480270386,2023-09-04 22:43:01.541470,2023-09-04 22:43:03.022771,0 days 00:00:01.481301,Tanh,ReLU,Sigmoid,ReLU,74,22,10.0,5.0,3.0,2.626391698281769e-05,4,210,0.3611244259170434,5.930560595866846e-05,377.44972054617745,COMPLETE
1911,0.37438106536865234,2023-09-04 22:43:03.023299,2023-09-04 22:43:03.646710,0 days 00:00:00.623411,ReLU,Sigmoid,Leaky,Sigmoid,53,20,21.0,6.0,18.0,0.029879022081168348,4,192,0.2752915021238398,0.0009659402940586907,137.97903060913086,COMPLETE
1912,0.3532770872116089,2023-09-04 22:43:03.647261,2023-09-04 22:43:06.634355,0 days 00:00:02.987094,Tanh,Sigmoid,Sigmoid,ReLU,37,8,24.0,7.0,6.0,0.0018977987451037066,4,153,0.680823893478535,3.865610180904965e-05,113.09139825160207,COMPLETE
1913,0.9049117565155029,2023-09-04 22:43:06.634914,2023-09-04 22:43:07.046655,0 days 00:00:00.411741,Sigmoid,ReLU,ReLU,Sigmoid,32,22,24.0,10.0,4.0,0.06109750933105248,4,205,0.7727196889293813,0.0018255743789783868,104.41361999511719,COMPLETE
1914,0.3108639419078827,2023-09-04 22:43:07.047194,2023-09-04 22:43:08.039037,0 days 00:00:00.991843,Tanh,Sigmoid,Leaky,Leaky,39,21,23.0,8.0,8.0,0.009879209947382171,4,166,0.7999528139186797,0.0036132876592067974,135.3371980248428,COMPLETE
1915,0.33439046144485474,2023-09-04 22:43:08.039608,2023-09-04 22:43:09.741667,0 days 00:00:01.702059,Tanh,ReLU,Tanh,Tanh,34,6,12.0,12.0,19.0,0.004153929528609239,4,179,0.724306289374531,0.0003902943688698191,83.73933583577474,COMPLETE
1916,0.4781954288482666,2023-09-04 22:43:09.742215,2023-09-04 22:43:10.106633,0 days 00:00:00.364418,ReLU,Leaky,Sigmoid,Sigmoid,41,19,23.0,9.0,7.0,0.007496339111940237,4,192,0.11404278959080834,8.998929872215681e-05,144.2936599368141,COMPLETE
1917,1.0214887857437134,2023-09-04 22:43:10.107164,2023-09-04 22:43:10.399456,0 days 00:00:00.292292,Tanh,Sigmoid,Leaky,ReLU,37,20,24.0,7.0,15.0,0.03474116211321197,4,153,0.24600568548412363,0.03349489704198002,100.31470222473145,COMPLETE
1918,0.969805896282196,2023-09-04 22:43:10.399989,2023-09-04 22:43:12.884916,0 days 00:00:02.484927,Tanh,ReLU,Sigmoid,Sigmoid,30,21,2.0,5.0,2.0,2.9175970359868447e-05,4,215,0.33284084785919077,0.00016132699566233778,259.9679229736328,COMPLETE
1919,0.9718114137649536,2023-09-04 22:43:12.885445,2023-09-04 22:43:13.182040,0 days 00:00:00.296595,Tanh,Sigmoid,ReLU,Tanh,40,22,16.0,11.0,9.0,0.01577963523612667,4,199,0.5288861625038342,0.028377461141908342,100.54777734929866,COMPLETE
1920,0.8835704922676086,2023-09-04 22:43:13.182590,2023-09-04 22:43:13.533214,0 days 00:00:00.350624,ReLU,Sigmoid,Tanh,ReLU,56,21,8.0,10.0,1.0,0.019837998247391568,4,167,0.7502979120334141,0.00023425964875684274,105.1607415335519,COMPLETE
1921,0.922957181930542,2023-09-04 22:43:13.533748,2023-09-04 22:43:13.883074,0 days 00:00:00.349326,Tanh,ReLU,Sigmoid,Sigmoid,36,12,11.0,7.0,13.0,0.0049881517258531455,4,217,0.16751463106858636,0.07732171964600919,108.19897206624348,COMPLETE
1922,0.3923715353012085,2023-09-04 22:43:13.883641,2023-09-04 22:43:14.255270,0 days 00:00:00.371629,Tanh,Sigmoid,Leaky,Leaky,54,20,9.0,6.0,3.0,0.024523318402181304,4,183,0.29465426604055683,0.0005804848063384836,122.44426324632433,COMPLETE
1923,0.41447576880455017,2023-09-04 22:43:14.255798,2023-09-04 22:43:14.846662,0 days 00:00:00.590864,Tanh,ReLU,Sigmoid,ReLU,33,9,7.0,8.0,5.0,0.002839221798604365,4,145,0.12394417175779206,3.229802030563851e-05,128.18217561829766,COMPLETE
1924,0.3130737245082855,2023-09-04 22:43:14.847179,2023-09-04 22:43:18.090529,0 days 00:00:03.243350,ReLU,Sigmoid,Tanh,Sigmoid,38,10,3.0,14.0,11.0,0.00017995388501043863,4,174,0.6955905106619346,0.0001288356624680007,109.2984260032917,COMPLETE
1925,0.46261030435562134,2023-09-04 22:43:18.091070,2023-09-04 22:43:20.298539,0 days 00:00:02.207469,Sigmoid,Sigmoid,Leaky,Tanh,41,21,24.0,9.0,17.0,6.840890096964718e-05,4,158,0.5038214784570123,6.428797066604462e-05,113.25716110422641,COMPLETE
1926,0.3364143371582031,2023-09-04 22:43:20.299064,2023-09-04 22:43:23.245813,0 days 00:00:02.946749,Tanh,ReLU,ReLU,Sigmoid,60,22,23.0,5.0,4.0,0.0004187337534000452,4,203,0.6111169493466482,2.6377873341870412e-05,110.40810476970204,COMPLETE
1927,0.3864986300468445,2023-09-04 22:43:23.246341,2023-09-04 22:43:23.973338,0 days 00:00:00.726997,Tanh,Leaky,Sigmoid,ReLU,35,20,22.0,7.0,14.0,0.04319611151131119,4,205,0.7692008796911398,1.003251720455471e-05,88.57955593532986,COMPLETE
1928,1.0093119144439697,2023-09-04 22:43:23.973889,2023-09-04 22:43:24.176336,0 days 00:00:00.202447,Tanh,Sigmoid,Sigmoid,Tanh,51,21,21.0,11.0,12.0,0.005864480404202863,4,162,0.16810090672079706,0.006753412054882939,102.60570878248949,COMPLETE
1929,0.3342472314834595,2023-09-04 22:43:24.176867,2023-09-04 22:43:26.576117,0 days 00:00:02.399250,ReLU,ReLU,Leaky,Sigmoid,40,22,16.0,10.0,9.0,0.011872679166578437,4,186,0.7233949054577127,4.6248820232428604e-05,102.15938293457032,COMPLETE
1930,0.41361626982688904,2023-09-04 22:43:26.576657,2023-09-04 22:43:27.039140,0 days 00:00:00.462483,Tanh,Sigmoid,Tanh,ReLU,38,19,24.0,8.0,20.0,0.008336059273801412,4,91,0.15464022717896708,0.0002655060318494295,1144.9622820008476,COMPLETE
1931,0.37322327494621277,2023-09-04 22:43:27.039685,2023-09-04 22:43:27.318126,0 days 00:00:00.278441,Tanh,ReLU,,,32,21,6.0,,,0.014287013416641882,2,217,0.17884905755687797,0.015164208597054371,139.42116422910948,COMPLETE
1932,0.35925593972206116,2023-09-04 22:43:27.318642,2023-09-04 22:43:34.457812,0 days 00:00:07.139170,Tanh,Sigmoid,Sigmoid,Leaky,17,20,11.0,6.0,10.0,0.0008921515590910481,4,151,0.4889864157656284,3.85694883813433e-05,127.5800029209682,COMPLETE
1933,0.365863561630249,2023-09-04 22:43:34.458351,2023-09-04 22:43:34.832521,0 days 00:00:00.374170,ReLU,Sigmoid,,,36,21,23.0,,,0.0014807596065054534,2,195,0.1900206101691067,0.00019082741879278286,118.02778337822586,COMPLETE
1934,0.6539798378944397,2023-09-04 22:43:34.833059,2023-09-04 22:43:38.545872,0 days 00:00:03.712813,Tanh,ReLU,,,28,18,3.0,,,1.2204693944557715e-05,2,172,0.7993831653338429,0.00010628956161958566,127.16051860188328,COMPLETE
1935,0.3325870931148529,2023-09-04 22:43:38.546367,2023-09-04 22:43:39.130374,0 days 00:00:00.584007,Tanh,Sigmoid,ReLU,Sigmoid,34,22,6.0,9.0,16.0,0.018784122838086514,4,210,0.6580493323118255,0.0022128182683311356,113.04127571799539,COMPLETE
1936,0.44456562399864197,2023-09-04 22:43:39.130919,2023-09-04 22:43:40.287845,0 days 00:00:01.156926,Sigmoid,ReLU,,,53,21,22.0,,,0.0005695551747866636,2,84,0.7459925244149278,0.004050434628855204,100.79787908281598,COMPLETE
1937,0.3148215413093567,2023-09-04 22:43:40.288337,2023-09-04 22:43:40.796706,0 days 00:00:00.508369,Tanh,Leaky,,,99,11,7.0,,,0.010001034938028557,2,221,0.6933604290245602,2.2868401340425014e-05,95.83827062753531,COMPLETE
1938,0.29531824588775635,2023-09-04 22:43:40.797250,2023-09-04 22:43:42.290885,0 days 00:00:01.493635,ReLU,Sigmoid,Leaky,ReLU,16,20,23.0,8.0,15.0,0.029785636252089756,4,145,0.7706284467491443,0.00033893174073138725,92.61230124196699,COMPLETE
1939,0.31460362672805786,2023-09-04 22:43:42.291462,2023-09-04 22:43:42.681757,0 days 00:00:00.390295,Tanh,ReLU,,,38,22,24.0,,,0.006556464208348533,2,181,0.42097588911629213,0.0007323715619134015,113.52217372771233,COMPLETE
1940,0.2729158401489258,2023-09-04 22:43:42.682279,2023-09-04 22:43:43.413028,0 days 00:00:00.730749,Tanh,Sigmoid,Sigmoid,Tanh,41,21,15.0,4.0,8.0,0.03716927980186794,4,93,0.7242222059361212,8.309968056725273e-05,240.3638095855713,COMPLETE
1941,0.36495959758758545,2023-09-04 22:43:43.413578,2023-09-04 22:43:43.989764,0 days 00:00:00.576186,Tanh,Sigmoid,Tanh,,35,10,12.0,7.0,,0.022623549606177372,3,166,0.31006881191557145,0.0001409846865630044,120.33874650435014,COMPLETE
1942,0.3553600311279297,2023-09-04 22:43:43.990300,2023-09-04 22:43:44.422375,0 days 00:00:00.432075,ReLU,ReLU,,,58,9,8.0,,,0.05005459378479557,2,206,0.5597386099855554,2.9931746916462428e-05,273.43269805908204,COMPLETE
1943,0.369929701089859,2023-09-04 22:43:44.422920,2023-09-04 22:43:44.870455,0 days 00:00:00.447535,Tanh,Sigmoid,,,33,22,23.0,,,0.0034911300863655487,2,194,0.20666591683288482,5.1332540077819715e-05,157.64473169500178,COMPLETE
1944,0.34119507670402527,2023-09-04 22:43:44.871010,2023-09-04 22:43:45.497754,0 days 00:00:00.626744,Tanh,ReLU,Sigmoid,,52,20,24.0,13.0,,0.01681887714046219,3,156,0.7699354328709541,0.009212191624426802,96.43520691815544,COMPLETE
1945,0.27366873621940613,2023-09-04 22:43:45.498294,2023-09-04 22:43:46.876429,0 days 00:00:01.378135,Tanh,Sigmoid,Leaky,Sigmoid,39,21,22.0,5.0,5.0,0.012722209345493986,4,214,0.7995535335923372,0.00017159552843748274,96.31207588391426,COMPLETE
1946,0.27189940214157104,2023-09-04 22:43:46.876970,2023-09-04 22:43:47.851680,0 days 00:00:00.974710,ReLU,ReLU,,,37,19,15.0,,,0.0080024536146032,2,220,0.7434110037404993,6.971229042490929e-05,86.5449285038182,COMPLETE
1947,0.3115348517894745,2023-09-04 22:43:47.852201,2023-09-04 22:43:49.239620,0 days 00:00:01.387419,Tanh,Sigmoid,,,31,22,6.0,,,0.0048927394306118675,2,85,0.7114232249576052,0.0004537366082013766,119.6066636806581,COMPLETE
1948,0.31521153450012207,2023-09-04 22:43:49.240155,2023-09-04 22:43:50.074641,0 days 00:00:00.834486,Tanh,Leaky,Sigmoid,ReLU,55,21,7.0,10.0,13.0,0.010077133852269566,4,174,0.7466023438244327,4.345395539196765e-05,113.47165716262091,COMPLETE
1949,0.32780760526657104,2023-09-04 22:43:50.075202,2023-09-04 22:43:51.515991,0 days 00:00:01.440789,Sigmoid,ReLU,ReLU,,72,17,16.0,6.0,,0.006545587456421523,3,200,0.6804445682162041,0.00021486891842487947,118.41590433909481,COMPLETE
1950,0.3394077718257904,2023-09-04 22:43:51.516537,2023-09-04 22:43:52.056218,0 days 00:00:00.539681,Tanh,Sigmoid,,,79,21,3.0,,,0.027291837619636314,2,160,0.7706555788872818,3.5529972591007756e-05,115.68165605333117,COMPLETE
1951,0.4844013452529907,2023-09-04 22:43:52.056764,2023-09-04 22:43:54.265427,0 days 00:00:02.208663,ReLU,Sigmoid,,,29,20,2.0,,,9.650859381233025e-05,2,190,0.46431192225013107,0.000306308002459929,117.20644663760537,COMPLETE
1952,0.2943873703479767,2023-09-04 22:43:54.265999,2023-09-04 22:43:56.551165,0 days 00:00:02.285166,Tanh,ReLU,Tanh,Sigmoid,16,21,9.0,9.0,6.0,0.0015124239823711165,4,90,0.6457118456418978,0.00011272813464037163,710.8308940949987,COMPLETE
1953,0.36735743284225464,2023-09-04 22:43:56.551696,2023-09-04 22:43:57.018643,0 days 00:00:00.466947,Tanh,Sigmoid,,,40,20,21.0,,,0.01460717705436438,2,206,0.25879400647110073,0.0001368846157169757,320.49179194523737,COMPLETE
1954,0.34284302592277527,2023-09-04 22:43:57.019180,2023-09-04 22:43:57.267665,0 days 00:00:00.248485,Tanh,ReLU,Leaky,,82,22,24.0,12.0,,0.06790755051493651,3,98,0.26235283880837407,0.0014533447639264883,170.43475815345502,COMPLETE
1955,0.32509365677833557,2023-09-04 22:43:57.268195,2023-09-04 22:43:58.250102,0 days 00:00:00.981907,ReLU,Sigmoid,,,35,22,23.0,,,0.004029479590740463,2,296,0.7160446398140181,0.001100616166691031,95.23871192932128,COMPLETE
1956,0.9078564047813416,2023-09-04 22:43:58.250649,2023-09-04 22:43:59.916232,0 days 00:00:01.665583,Tanh,ReLU,Sigmoid,Tanh,37,11,5.0,7.0,12.0,1.0866514255173358e-05,4,144,0.3795248037200464,2.6439224733407602e-05,98.9897230996026,COMPLETE
1957,0.5174230933189392,2023-09-04 22:43:59.916772,2023-09-04 22:44:00.588386,0 days 00:00:00.671614,Tanh,Sigmoid,,,42,21,22.0,,,0.021738876989382913,2,217,0.771843770057625,0.09348127616551023,104.13221740722656,COMPLETE
1958,0.39451131224632263,2023-09-04 22:44:00.588935,2023-09-04 22:44:01.901269,0 days 00:00:01.312334,Tanh,Leaky,Sigmoid,,33,10,6.0,5.0,,0.011621587950886936,3,169,0.7446642227260348,5.815584393376909e-05,107.771546517649,COMPLETE
1959,0.3579736053943634,2023-09-04 22:44:01.901818,2023-09-04 22:44:02.816948,0 days 00:00:00.915130,ReLU,Sigmoid,,,17,20,3.0,,,0.03595405360017912,2,185,0.7056552366505131,0.005219501692908602,121.52314022609166,COMPLETE
1960,0.8219574093818665,2023-09-04 22:44:02.817479,2023-09-04 22:44:03.891882,0 days 00:00:01.074403,Tanh,ReLU,Leaky,Sigmoid,39,12,24.0,8.0,7.0,4.94804767140529e-05,4,80,0.4460273719093895,2.2894713758113483e-05,138.93545875549316,COMPLETE
1961,0.4239034950733185,2023-09-04 22:44:03.892417,2023-09-04 22:44:10.878130,0 days 00:00:06.985713,Tanh,Sigmoid,,,15,19,5.0,,,4.155270709411048e-05,2,210,0.7999928118496138,0.0008563696333137976,121.96199057442801,COMPLETE
1962,0.9790743589401245,2023-09-04 22:44:10.878646,2023-09-04 22:44:11.553370,0 days 00:00:00.674724,Sigmoid,ReLU,Tanh,,63,22,13.0,9.0,,1.932554935893736e-05,3,223,0.1287363826840452,0.0027980077810504374,159.48459508921533,COMPLETE
1963,0.3209603726863861,2023-09-04 22:44:11.553912,2023-09-04 22:44:12.735155,0 days 00:00:01.181243,Tanh,Sigmoid,Sigmoid,ReLU,51,21,15.0,11.0,14.0,0.008987547629820847,4,179,0.7443683357463554,1.2147549593556914e-05,86.66262646575473,COMPLETE
1964,0.2874052822589874,2023-09-04 22:44:12.735704,2023-09-04 22:44:13.349960,0 days 00:00:00.614256,Tanh,ReLU,,,36,20,23.0,,,0.005848730317451341,2,146,0.5882946549406121,9.570640945931636e-05,121.51514602288967,COMPLETE
1965,0.3476743698120117,2023-09-04 22:44:13.350567,2023-09-04 22:44:13.924555,0 days 00:00:00.573988,ReLU,Sigmoid,,,41,8,7.0,,,0.07342003697916036,2,155,0.4712718584614654,0.0001571221896652963,110.37605684453791,COMPLETE
1966,0.46594688296318054,2023-09-04 22:44:13.925136,2023-09-04 22:44:14.348918,0 days 00:00:00.423782,Tanh,Sigmoid,ReLU,,87,21,10.0,6.0,,0.002840521701079567,3,99,0.23374577648515457,0.05381353552713969,112.1280626817183,COMPLETE
1967,0.45463302731513977,2023-09-04 22:44:14.349461,2023-09-04 22:44:14.656264,0 days 00:00:00.306803,Tanh,ReLU,Leaky,Leaky,38,22,6.0,10.0,17.0,0.016847968130799505,4,196,0.10032440679876405,0.020775878662955466,108.78604141546755,COMPLETE
1968,0.33981987833976746,2023-09-04 22:44:14.656838,2023-09-04 22:44:16.411967,0 days 00:00:01.755129,Tanh,Leaky,,,18,9,8.0,,,0.0007967863922315748,2,84,0.5650871473592315,0.0018531968612448648,99.62156359354655,COMPLETE
1969,0.4075900912284851,2023-09-04 22:44:16.412472,2023-09-04 22:44:16.677021,0 days 00:00:00.264549,ReLU,Sigmoid,,,34,21,24.0,,,0.055962649691204965,2,213,0.17156620584769164,0.014428637273500983,1011.0349051339285,COMPLETE
1970,0.3488113284111023,2023-09-04 22:44:16.677583,2023-09-04 22:44:17.899405,0 days 00:00:01.221822,Tanh,ReLU,Sigmoid,Sigmoid,53,20,12.0,4.0,11.0,0.007163868126660233,4,162,0.530775401848031,0.007422314882248379,108.40103511617642,COMPLETE
1971,0.429813414812088,2023-09-04 22:44:17.899968,2023-09-04 22:44:18.968451,0 days 00:00:01.068483,Tanh,Sigmoid,,,75,22,23.0,,,0.0002888635256618825,2,171,0.4043289042430146,4.553403997716331e-05,123.41478644476996,COMPLETE
1972,0.4227656424045563,2023-09-04 22:44:18.968979,2023-09-04 22:44:21.756048,0 days 00:00:02.787069,Tanh,ReLU,Tanh,,31,21,10.0,7.0,,0.0001770536111375206,3,221,0.4241681093600633,0.03675112045498073,118.20828809781312,COMPLETE
1973,0.30887460708618164,2023-09-04 22:44:21.756557,2023-09-04 22:44:22.782190,0 days 00:00:01.025633,ReLU,Sigmoid,,,57,19,5.0,,,0.0011854273375533392,2,92,0.6715758139654989,3.5112223337962374e-05,114.87831787441088,COMPLETE
1974,0.3787834942340851,2023-09-04 22:44:22.782734,2023-09-04 22:44:23.391908,0 days 00:00:00.609174,Sigmoid,Sigmoid,Sigmoid,Tanh,36,18,2.0,8.0,4.0,0.028964790988314323,4,203,0.21500423755979975,0.00025521461970012306,170.28978488869862,COMPLETE
1975,0.4527178704738617,2023-09-04 22:44:23.392437,2023-09-04 22:44:23.705651,0 days 00:00:00.313214,Tanh,ReLU,,,96,20,22.0,,,0.019335999848522738,2,185,0.6311053438676099,0.08136773162581222,125.09673987494574,COMPLETE
1976,0.3461105227470398,2023-09-04 22:44:23.706166,2023-09-04 22:44:24.274639,0 days 00:00:00.568473,Tanh,Sigmoid,Leaky,,42,22,6.0,12.0,,0.04107366508356506,3,152,0.7734482533705037,7.293192238012058e-05,85.84142772967999,COMPLETE
1977,0.31470203399658203,2023-09-04 22:44:24.275157,2023-09-04 22:44:24.677270,0 days 00:00:00.402113,Tanh,ReLU,,,91,21,24.0,,,0.011426176283268079,2,192,0.7311845481357789,0.00019177851204837693,89.86056213378906,COMPLETE
1978,0.36862924695014954,2023-09-04 22:44:24.677826,2023-09-04 22:44:25.041340,0 days 00:00:00.363514,ReLU,Sigmoid,Sigmoid,ReLU,39,23,9.0,6.0,15.0,0.013845853272418373,4,163,0.22644469723943636,2.7544516744207075e-05,133.6461778120561,COMPLETE
1979,0.40680861473083496,2023-09-04 22:44:25.041881,2023-09-04 22:44:26.264513,0 days 00:00:01.222632,Tanh,Leaky,ReLU,,51,11,3.0,11.0,,0.0021679624551804275,3,79,0.7693112243122189,0.03457906600014838,116.88603393940986,COMPLETE
1980,0.2985311448574066,2023-09-04 22:44:26.265020,2023-09-04 22:44:27.336326,0 days 00:00:01.071306,Tanh,ReLU,,,15,21,23.0,,,0.02414834555142099,2,101,0.6987531983546091,0.0006181589688491714,109.74481794569228,COMPLETE
1981,0.33846938610076904,2023-09-04 22:44:27.336849,2023-09-04 22:44:28.208270,0 days 00:00:00.871421,Tanh,Sigmoid,Tanh,Sigmoid,18,20,7.0,9.0,16.0,0.008303660606164425,4,142,0.3935315551776803,5.542706060719333e-05,173.26009129115513,COMPLETE
1982,0.41680675745010376,2023-09-04 22:44:28.208945,2023-09-04 22:44:28.624422,0 days 00:00:00.415477,ReLU,Sigmoid,,,37,22,4.0,,,0.005046916275136511,2,223,0.1100335766791662,1.94827779994702e-05,124.44189516703288,COMPLETE
1983,0.34513455629348755,2023-09-04 22:44:28.625031,2023-09-04 22:44:31.209902,0 days 00:00:02.584871,Tanh,ReLU,,,41,20,16.0,,,0.00035896127973430883,2,177,0.7290864425848985,3.31306600445989e-05,104.32458612474345,COMPLETE
1984,0.3408532440662384,2023-09-04 22:44:31.210476,2023-09-04 22:44:33.634277,0 days 00:00:02.423801,Tanh,Sigmoid,Leaky,,35,10,14.0,7.0,,0.003701943084844828,3,206,0.7721086120350324,0.003213737998039491,117.52563755201257,COMPLETE
1985,0.955944836139679,2023-09-04 22:44:33.634862,2023-09-04 22:44:34.344085,0 days 00:00:00.709223,Tanh,ReLU,Sigmoid,ReLU,32,12,22.0,10.0,1.0,0.03420450948350545,4,212,0.7984489888288356,0.0001348256028040429,100.95578257242839,COMPLETE
1986,0.41431838274002075,2023-09-04 22:44:34.344743,2023-09-04 22:44:34.692693,0 days 00:00:00.347950,Sigmoid,Sigmoid,,,68,21,24.0,,,0.016285139965313247,2,91,0.1495662863898349,4.1562406184699414e-05,181.6360442582951,COMPLETE
1987,0.33839520812034607,2023-09-04 22:44:34.693211,2023-09-04 22:44:35.786587,0 days 00:00:01.093376,ReLU,ReLU,,,54,22,6.0,,,0.0099571062751671,2,198,0.3756004354535402,0.0013318516679164613,120.17220388139997,COMPLETE
1988,0.34789422154426575,2023-09-04 22:44:35.787569,2023-09-04 22:44:37.488279,0 days 00:00:01.700710,Tanh,Sigmoid,Sigmoid,Sigmoid,39,21,4.0,14.0,7.0,0.04568958039284799,4,83,0.7473908379435937,8.381274194687071e-05,114.4036906560262,COMPLETE
1989,0.3475804328918457,2023-09-04 22:44:37.488831,2023-09-04 22:44:37.784560,0 days 00:00:00.295729,Tanh,Leaky,Leaky,,34,19,5.0,5.0,,0.006750540731852429,3,227,0.1371513693783234,0.00022801203072954932,628.3373561952172,COMPLETE
1990,0.33049866557121277,2023-09-04 22:44:37.785138,2023-09-04 22:44:38.781840,0 days 00:00:00.996702,Tanh,Sigmoid,,,55,20,23.0,,,0.004260021541158931,2,168,0.692386990309497,0.00010272036928500633,370.08836255754744,COMPLETE
1991,0.38523557782173157,2023-09-04 22:44:38.782389,2023-09-04 22:44:39.033891,0 days 00:00:00.251502,ReLU,ReLU,,,37,21,21.0,,,0.022597797487461137,2,157,0.195449985168836,0.00016421965136490034,126.6174545288086,COMPLETE
1992,0.4738633632659912,2023-09-04 22:44:39.034420,2023-09-04 22:44:44.948408,0 days 00:00:05.913988,Tanh,Sigmoid,Tanh,,17,23,7.0,8.0,,2.2603292022049015e-05,3,186,0.718825615955999,0.004059837128567789,106.71067531134493,COMPLETE
1993,0.4060562252998352,2023-09-04 22:44:44.948951,2023-09-04 22:44:45.226178,0 days 00:00:00.277227,Tanh,ReLU,ReLU,Tanh,50,22,13.0,9.0,3.0,0.013522246917560625,4,213,0.13844297075978584,6.500137449281219e-05,139.73497969104397,COMPLETE
1994,0.358745276927948,2023-09-04 22:44:45.226748,2023-09-04 22:44:45.572083,0 days 00:00:00.345335,Tanh,Sigmoid,,,42,21,15.0,,,0.030961627959501987,2,95,0.24883844341254496,0.002497633586204435,109.56106262207031,COMPLETE
1995,0.5760685205459595,2023-09-04 22:44:45.572629,2023-09-04 22:44:50.745401,0 days 00:00:05.172772,ReLU,ReLU,,,19,20,2.0,,,2.8466167845255992e-05,2,201,0.7731410805345837,0.0003110277076485713,101.46922746345179,COMPLETE
1996,0.945197343826294,2023-09-04 22:44:50.745937,2023-09-04 22:44:51.583971,0 days 00:00:00.838034,Tanh,Sigmoid,Sigmoid,Leaky,35,21,14.0,4.0,13.0,1.418080499939647e-05,4,176,0.1184532152055619,2.1546608966634084e-05,113.37803134051236,COMPLETE
1997,0.3933294415473938,2023-09-04 22:44:51.584521,2023-09-04 22:44:51.987508,0 days 00:00:00.402987,Tanh,Sigmoid,,,84,22,15.0,,,0.0019927309437988796,2,77,0.2733205950366625,3.071944567167317e-05,107.47335399280895,COMPLETE
