number,value,datetime_start,datetime_complete,duration,params_activation1,params_activation2,params_activation3,params_activation4,params_batch_size,params_fl1,params_fl2,params_fl3,params_fl4,params_learning_rate,params_n_layers,params_num_epochs,params_train_size,params_weight_decay,user_attrs_mre,state
1724,0.34027108550071716,2023-09-04 22:39:11.903959,2023-09-04 22:39:12.534617,0 days 00:00:00.630658,Tanh,ReLU,Tanh,Sigmoid,44,24,23.0,11.0,12.0,0.014944652912116645,4,132,0.43096496252382227,0.003994576610174861,153.620864543509,COMPLETE
1725,0.4126051366329193,2023-09-04 22:39:12.535158,2023-09-04 22:39:12.762674,0 days 00:00:00.227516,Tanh,,,,43,23,,,,0.028028481222298392,1,146,0.7491829345518937,0.07389812422673023,97.25807131253757,COMPLETE
1726,0.3365424871444702,2023-09-04 22:39:12.763178,2023-09-04 22:39:14.852591,0 days 00:00:02.089413,Tanh,ReLU,,,41,23,23.0,,,0.0003459318232957798,2,152,0.7233931563338247,0.00013444686375963874,107.28791347302888,COMPLETE
1727,0.386211097240448,2023-09-04 22:39:14.853078,2023-09-04 22:39:15.050469,0 days 00:00:00.197391,Tanh,ReLU,,,45,9,23.0,,,0.023740819476531873,2,139,0.17695863657656233,4.413150567772347e-05,112.6361171581127,COMPLETE
1728,0.3075730800628662,2023-09-04 22:39:15.050963,2023-09-04 22:39:15.969411,0 days 00:00:00.918448,Tanh,ReLU,Leaky,,40,24,24.0,9.0,,0.012394730529532964,3,134,0.6498575910888681,0.0008930934267070077,88.5783706665039,COMPLETE
1729,0.3350414037704468,2023-09-04 22:39:15.969950,2023-09-04 22:39:16.387182,0 days 00:00:00.417232,Tanh,ReLU,,,46,24,24.0,,,0.020145366159712814,2,129,0.5724609478743168,1.4948010949363982e-05,104.57030585504347,COMPLETE
1730,0.4373932480812073,2023-09-04 22:39:16.387706,2023-09-04 22:39:17.284478,0 days 00:00:00.896772,Tanh,,,,42,22,,,,0.0001830495405269425,1,153,0.3507634909872416,0.009470511459045327,114.35289928959865,COMPLETE
1731,0.39541342854499817,2023-09-04 22:39:17.284942,2023-09-04 22:39:17.712347,0 days 00:00:00.427405,Tanh,ReLU,,,47,23,23.0,,,0.031691449397095305,2,145,0.7487392867091982,0.01687372072283666,133.19790502694937,COMPLETE
1732,0.36932751536369324,2023-09-04 22:39:17.712859,2023-09-04 22:39:18.012252,0 days 00:00:00.299393,Tanh,ReLU,Sigmoid,,44,23,24.0,8.0,,0.01373532537195792,3,122,0.3795464442492845,0.0002762684972157827,108.8148456920277,COMPLETE
1733,0.3179721534252167,2023-09-04 22:39:18.012767,2023-09-04 22:39:18.416039,0 days 00:00:00.403272,Tanh,ReLU,,,40,23,24.0,,,0.017736644209792093,2,137,0.4158896896133398,2.1100843083021298e-05,104.31192257529811,COMPLETE
1734,0.3079969584941864,2023-09-04 22:39:18.416545,2023-09-04 22:39:18.823156,0 days 00:00:00.406611,Tanh,ReLU,,,42,23,24.0,,,0.02660650014252195,2,150,0.4605922903431419,2.8735725647578787e-05,98.95985158284505,COMPLETE
1735,0.2735031843185425,2023-09-04 22:39:18.823670,2023-09-04 22:39:20.206193,0 days 00:00:01.382523,Tanh,ReLU,Leaky,Leaky,38,23,24.0,10.0,1.0,0.010645736495123213,4,160,0.7994355714771441,6.164902590045651e-05,93.64814618428548,COMPLETE
1736,0.41621148586273193,2023-09-04 22:39:20.206698,2023-09-04 22:39:20.424078,0 days 00:00:00.217380,Tanh,,,,46,22,,,,0.038379356427129876,1,128,0.15996023599796952,0.0021077355458304038,126.24913730261461,COMPLETE
1737,0.33850863575935364,2023-09-04 22:39:20.424575,2023-09-04 22:39:20.650999,0 days 00:00:00.226424,Tanh,ReLU,,,43,22,21.0,,,0.014853548083274546,2,142,0.18527824613145735,0.00020824767447777902,240.96277570724487,COMPLETE
1738,0.29403796792030334,2023-09-04 22:39:20.651630,2023-09-04 22:39:21.071985,0 days 00:00:00.420355,Tanh,ReLU,Tanh,,41,23,23.0,8.0,,0.02250013006310318,3,121,0.5060554017600257,0.0004688298292234097,91.80005912780761,COMPLETE
1739,0.34576597809791565,2023-09-04 22:39:21.072508,2023-09-04 22:39:21.439506,0 days 00:00:00.366998,Tanh,ReLU,,,49,12,22.0,,,0.00956499471596097,2,156,0.22990602997365617,5.189479757183936e-05,104.57532382011414,COMPLETE
1740,0.3923550546169281,2023-09-04 22:39:21.440011,2023-09-04 22:39:21.635755,0 days 00:00:00.195744,Tanh,ReLU,,,47,22,24.0,,,0.012010277101395976,2,139,0.10608736484912407,1.7447369011468145e-05,419.9114026325505,COMPLETE
1741,0.3322131931781769,2023-09-04 22:39:21.636369,2023-09-04 22:39:22.189748,0 days 00:00:00.553379,Tanh,ReLU,Leaky,,44,24,13.0,9.0,,0.03409972328198269,3,111,0.7030666715364098,3.7852351591487345e-05,245.54115422566733,COMPLETE
1742,0.31395429372787476,2023-09-04 22:39:22.190299,2023-09-04 22:39:22.834703,0 days 00:00:00.644404,Tanh,,,,39,22,,,,0.05345835801277734,1,161,0.7504611567673433,0.00016478181344374893,97.40245009913589,COMPLETE
1743,0.29255712032318115,2023-09-04 22:39:22.835585,2023-09-04 22:39:24.377119,0 days 00:00:01.541534,Tanh,ReLU,,,80,22,23.0,,,0.0004987663187452792,2,145,0.7710085496990903,9.139205832389254e-05,104.44138215163659,COMPLETE
1744,0.46799495816230774,2023-09-04 22:39:24.377611,2023-09-04 22:39:24.646254,0 days 00:00:00.268643,Tanh,ReLU,Leaky,,45,11,22.0,11.0,,0.016013784148792228,3,128,0.14140296399926952,0.04034121844296096,139.5710326485012,COMPLETE
1745,0.37775918841362,2023-09-04 22:39:24.646886,2023-09-04 22:39:24.827480,0 days 00:00:00.180594,Tanh,ReLU,,,47,22,24.0,,,0.020463283251822065,2,167,0.1685810485629789,0.00013180506344255953,362.59085707231003,COMPLETE
1746,0.5002663135528564,2023-09-04 22:39:24.828025,2023-09-04 22:39:25.230108,0 days 00:00:00.402083,Sigmoid,ReLU,,,40,23,22.0,,,0.0005951068441661197,2,113,0.12057755086851654,0.023064270288455167,202.188639412939,COMPLETE
1747,0.7457787990570068,2023-09-04 22:39:25.230608,2023-09-04 22:39:26.098331,0 days 00:00:00.867723,Tanh,ReLU,,,67,22,23.0,,,1.5902097642053163e-05,2,154,0.35885769491716496,0.010637647122434014,94.40161335932744,COMPLETE
1748,0.3818320035934448,2023-09-04 22:39:26.098832,2023-09-04 22:39:26.505737,0 days 00:00:00.406905,ReLU,,,,42,21,,,,0.0011094623735988527,1,120,0.23843488264913507,0.0026878036957320916,111.03671185723667,COMPLETE
1749,0.9236066937446594,2023-09-04 22:39:26.506233,2023-09-04 22:39:27.006432,0 days 00:00:00.500199,Tanh,ReLU,Tanh,Sigmoid,48,22,8.0,8.0,2.0,0.027017240258442272,4,149,0.7996136729517594,0.021079268199641035,99.87811164855957,COMPLETE
1750,0.31487637758255005,2023-09-04 22:39:27.006958,2023-09-04 22:39:27.499658,0 days 00:00:00.492700,Tanh,ReLU,,,57,24,24.0,,,0.013856499134830771,2,134,0.7215671266594877,2.4540716406303007e-05,98.37630606986382,COMPLETE
1751,0.4997192323207855,2023-09-04 22:39:27.500143,2023-09-04 22:39:28.006281,0 days 00:00:00.506138,Tanh,Tanh,Sigmoid,,38,23,23.0,9.0,,0.006937969234320505,3,143,0.5413223794428734,0.046372371146230884,152.8148213048135,COMPLETE
1752,0.4189261496067047,2023-09-04 22:39:28.006781,2023-09-04 22:39:28.353914,0 days 00:00:00.347133,ReLU,Tanh,,,45,21,23.0,,,0.00042865152126237956,2,50,0.2541920306461479,7.382922646213926e-05,110.24214050292969,COMPLETE
1753,0.32886239886283875,2023-09-04 22:39:28.354397,2023-09-04 22:39:28.831650,0 days 00:00:00.477253,Tanh,ReLU,Leaky,,35,20,15.0,12.0,,0.007998416700993017,3,117,0.6811503001233413,0.00011153298784236573,92.23377373105004,COMPLETE
1754,0.37158524990081787,2023-09-04 22:39:28.832160,2023-09-04 22:39:29.160245,0 days 00:00:00.328085,Tanh,,,,50,21,,,,0.018627932772001202,1,105,0.3909947651419931,1.3407196433302403e-05,115.97748124864367,COMPLETE
1755,0.3727670907974243,2023-09-04 22:39:29.160750,2023-09-04 22:39:29.544273,0 days 00:00:00.383523,Tanh,Tanh,,,37,10,23.0,,,0.04200008687758288,2,163,0.33734115676782184,3.33335310436415e-05,123.8877779642741,COMPLETE
1756,0.3595849275588989,2023-09-04 22:39:29.544777,2023-09-04 22:39:29.703360,0 days 00:00:00.158583,Tanh,Leaky,,,71,12,24.0,,,0.03228160651150434,2,92,0.20178473655868492,0.0011473595376097884,183.4507303237915,COMPLETE
1757,0.35285019874572754,2023-09-04 22:39:29.703867,2023-09-04 22:39:30.151425,0 days 00:00:00.447558,ReLU,ReLU,Tanh,,12,22,24.0,7.0,,0.010327484974231242,3,126,0.24710061903378197,0.00036969904034787584,103.5224129813058,COMPLETE
1758,0.8905607461929321,2023-09-04 22:39:30.151956,2023-09-04 22:39:30.412391,0 days 00:00:00.260435,Sigmoid,Tanh,,,43,21,23.0,,,0.0001219033948384986,2,67,0.100433399193702,0.0015594125870714828,130.0743008513949,COMPLETE
1759,0.4257572889328003,2023-09-04 22:39:30.412879,2023-09-04 22:39:33.276596,0 days 00:00:02.863717,Tanh,ReLU,,,14,23,24.0,,,3.684433002203657e-05,2,86,0.7470558060980228,5.1172925603460384e-05,106.81486307188521,COMPLETE
1760,0.3301827311515808,2023-09-04 22:39:33.277094,2023-09-04 22:39:33.889560,0 days 00:00:00.612466,Tanh,Tanh,Leaky,,41,20,11.0,8.0,,0.026503154363042663,3,138,0.6395874480152309,0.0002647054627745076,91.18837674458821,COMPLETE
1761,0.23473532497882843,2023-09-04 22:39:33.890052,2023-09-04 22:39:35.280974,0 days 00:00:01.390922,Tanh,ReLU,Sigmoid,ReLU,32,21,24.0,11.0,6.0,0.012509449606592457,4,171,0.7726239565528952,0.00016372862066293796,93.88673824734158,COMPLETE
1762,0.5251489281654358,2023-09-04 22:39:35.281495,2023-09-04 22:39:35.980730,0 days 00:00:00.699235,Tanh,ReLU,Sigmoid,ReLU,39,21,24.0,12.0,6.0,0.012311591772198833,4,172,0.7733359734778733,0.00024012632437419651,139.08179228646415,COMPLETE
1763,0.3577575087547302,2023-09-04 22:39:35.981232,2023-09-04 22:39:37.000944,0 days 00:00:01.019712,Tanh,ReLU,Sigmoid,ReLU,32,21,24.0,10.0,3.0,0.013805519685672393,4,183,0.7736201973458893,0.00020388305382519257,99.5317402889854,COMPLETE
1764,0.4126127362251282,2023-09-04 22:39:37.001470,2023-09-04 22:39:37.673082,0 days 00:00:00.671612,Tanh,ReLU,Sigmoid,ReLU,31,20,24.0,10.0,7.0,0.0093908378366072,4,185,0.7475238739668695,0.01297872030114708,125.53065324866253,COMPLETE
1765,0.3278493881225586,2023-09-04 22:39:37.673605,2023-09-04 22:39:39.879375,0 days 00:00:02.205770,Tanh,ReLU,Sigmoid,ReLU,32,21,24.0,11.0,2.0,0.011515289721146467,4,158,0.7731394665092722,0.0003334404460698873,97.00550532341003,COMPLETE
1766,0.9161593317985535,2023-09-04 22:39:39.880393,2023-09-04 22:39:43.626262,0 days 00:00:03.745869,Tanh,ReLU,Sigmoid,ReLU,33,21,9.0,11.0,8.0,3.819639398970474e-05,4,170,0.22019600968191175,0.00015730919296119317,101.29839010799633,COMPLETE
1767,0.2741778790950775,2023-09-04 22:39:43.627241,2023-09-04 22:39:46.795510,0 days 00:00:03.168269,Tanh,ReLU,Sigmoid,ReLU,37,20,24.0,9.0,5.0,0.015557159981335856,4,175,0.734477412707992,0.0001696013164029172,94.51798852284749,COMPLETE
1768,0.29526054859161377,2023-09-04 22:39:46.796498,2023-09-04 22:39:49.934786,0 days 00:00:03.138288,Tanh,ReLU,Sigmoid,ReLU,32,20,24.0,10.0,3.0,0.013306378172634038,4,167,0.7713839840767915,0.00019474298118810432,91.78711622189253,COMPLETE
1769,1.0339090824127197,2023-09-04 22:39:49.935755,2023-09-04 22:39:52.022600,0 days 00:00:02.086845,Tanh,ReLU,Sigmoid,ReLU,34,21,23.0,12.0,4.0,0.010892693149608675,4,173,0.7983973210899596,0.0050193457141372065,100.46393585205078,COMPLETE
1770,0.3931158185005188,2023-09-04 22:39:52.023553,2023-09-04 22:39:58.997605,0 days 00:00:06.974052,Tanh,ReLU,Sigmoid,ReLU,35,20,23.0,8.0,9.0,0.00014396254711554411,4,169,0.48253963408708644,0.0002512677322613196,113.2191439747105,COMPLETE
1771,0.6429917812347412,2023-09-04 22:39:58.998113,2023-09-04 22:40:00.739199,0 days 00:00:01.741086,Tanh,ReLU,Sigmoid,ReLU,30,21,23.0,13.0,7.0,3.0821421939898265e-05,4,179,0.2706345156303174,1.8887000347999445e-05,108.81257591034446,COMPLETE
1772,0.2821136713027954,2023-09-04 22:40:00.739705,2023-09-04 22:40:02.355836,0 days 00:00:01.616131,Tanh,ReLU,Sigmoid,ReLU,10,21,24.0,10.0,6.0,0.009495941318263581,4,160,0.7992680584332725,0.00021672096634896545,91.2343205538663,COMPLETE
1773,1.0608696937561035,2023-09-04 22:40:02.356360,2023-09-04 22:40:03.011200,0 days 00:00:00.654840,Tanh,ReLU,Sigmoid,ReLU,34,21,24.0,9.0,1.0,0.01680139140290338,4,164,0.7475536948449608,0.0007697737078876039,99.73185663637908,COMPLETE
1774,0.29739105701446533,2023-09-04 22:40:03.011785,2023-09-04 22:40:03.510434,0 days 00:00:00.498649,Tanh,,,,30,20,,,,0.008025712429145179,1,176,0.7275589512313461,4.0029202307688965e-05,121.4501684865644,COMPLETE
1775,0.28184983134269714,2023-09-04 22:40:03.510978,2023-09-04 22:40:04.629135,0 days 00:00:01.118157,Tanh,ReLU,Sigmoid,ReLU,46,21,24.0,7.0,5.0,0.013362821440581995,4,149,0.7718119741116017,0.003055359424811111,107.9501064403637,COMPLETE
1776,0.2932334840297699,2023-09-04 22:40:04.629676,2023-09-04 22:40:05.600130,0 days 00:00:00.970454,Tanh,ReLU,Sigmoid,ReLU,33,21,24.0,8.0,11.0,0.011848075756530897,4,158,0.7990077636509736,0.0005582826586845889,94.27106200324164,COMPLETE
1777,0.9563161730766296,2023-09-04 22:40:05.600656,2023-09-04 22:40:06.053459,0 days 00:00:00.452803,Tanh,ReLU,Sigmoid,ReLU,39,20,23.0,11.0,4.0,0.015312707125277469,4,178,0.7184564075802282,2.8866660006424738e-05,100.32248957016888,COMPLETE
1778,0.5035438537597656,2023-09-04 22:40:06.054003,2023-09-04 22:40:06.470263,0 days 00:00:00.416260,Tanh,ReLU,Sigmoid,ReLU,35,21,24.0,7.0,3.0,0.09848403458056358,4,158,0.4415164238733436,0.00017758969734512115,177.79675986550072,COMPLETE
1779,1.1081514358520508,2023-09-04 22:40:06.470799,2023-09-04 22:40:06.663558,0 days 00:00:00.192759,Tanh,ReLU,Sigmoid,Sigmoid,33,20,24.0,9.0,10.0,0.009383019384348433,4,187,0.12716974749061344,0.006479008298546744,123.85237058003743,COMPLETE
1780,0.2640482485294342,2023-09-04 22:40:06.664084,2023-09-04 22:40:07.315624,0 days 00:00:00.651540,Tanh,ReLU,Sigmoid,ReLU,37,21,24.0,8.0,6.0,0.006849298394273505,4,162,0.7465996029476237,0.00029574201718894546,91.36215914212741,COMPLETE
1781,0.34226441383361816,2023-09-04 22:40:07.316148,2023-09-04 22:40:08.230191,0 days 00:00:00.914043,Tanh,ReLU,Sigmoid,ReLU,37,21,24.0,8.0,6.0,0.006583176165379151,4,158,0.7574239475645691,0.0003212723360096621,92.40218091692243,COMPLETE
1782,0.35478276014328003,2023-09-04 22:40:08.230735,2023-09-04 22:40:09.196502,0 days 00:00:00.965767,Tanh,ReLU,Sigmoid,ReLU,36,20,24.0,9.0,7.0,0.007733949406950976,4,162,0.7490666863402516,0.0003208521554577866,105.39971278263972,COMPLETE
1783,0.8424892425537109,2023-09-04 22:40:09.197003,2023-09-04 22:40:10.384245,0 days 00:00:01.187242,Tanh,ReLU,Sigmoid,ReLU,36,19,24.0,7.0,5.0,7.635779397867625e-05,4,166,0.21335311789976227,0.0002788020612605424,98.73106007403638,COMPLETE
1784,0.3732471466064453,2023-09-04 22:40:10.384754,2023-09-04 22:40:10.671821,0 days 00:00:00.287067,Tanh,ReLU,Sigmoid,ReLU,36,21,23.0,8.0,8.0,0.006915730844711899,4,177,0.14057042679273005,0.000210616053862715,198.9761848449707,COMPLETE
1785,0.36207833886146545,2023-09-04 22:40:10.672355,2023-09-04 22:40:11.011201,0 days 00:00:00.338846,Tanh,ReLU,Sigmoid,ReLU,35,22,24.0,7.0,6.0,0.007252299560305133,4,171,0.24599691870442678,0.00025002245248430244,192.4068549827293,COMPLETE
1786,0.36340564489364624,2023-09-04 22:40:11.011750,2023-09-04 22:40:12.348296,0 days 00:00:01.336546,Tanh,ReLU,Sigmoid,ReLU,35,20,24.0,10.0,4.0,0.0052964046207753974,4,153,0.7992591848653996,0.0002892805537270219,102.83370816266095,COMPLETE
1787,0.29926055669784546,2023-09-04 22:40:12.348799,2023-09-04 22:40:14.943809,0 days 00:00:02.595010,Tanh,ReLU,Sigmoid,ReLU,34,21,23.0,6.0,2.0,0.005922947596365014,4,175,0.7692939339427076,0.0002975266081868527,108.00698873159048,COMPLETE
1788,0.3133566379547119,2023-09-04 22:40:14.944323,2023-09-04 22:40:16.142854,0 days 00:00:01.198531,Tanh,ReLU,Sigmoid,ReLU,33,22,24.0,9.0,8.0,0.0079093264055307,4,163,0.7424964416443598,0.00042710771022657235,97.89598644023039,COMPLETE
1789,0.30666977167129517,2023-09-04 22:40:16.143394,2023-09-04 22:40:17.413232,0 days 00:00:01.269838,Tanh,ReLU,Sigmoid,ReLU,32,21,24.0,8.0,12.0,0.008995749350949581,4,152,0.7642506417810738,0.00022073219403766472,103.64275100708008,COMPLETE
1790,0.28461986780166626,2023-09-04 22:40:17.413758,2023-09-04 22:40:18.639912,0 days 00:00:01.226154,Tanh,ReLU,Sigmoid,ReLU,34,7,23.0,6.0,9.0,0.010388796172667924,4,169,0.7263482272099135,0.0003643598765695241,97.6147021484375,COMPLETE
1791,1.0182937383651733,2023-09-04 22:40:18.640492,2023-09-04 22:40:18.856736,0 days 00:00:00.216244,Tanh,ReLU,Sigmoid,ReLU,37,20,23.0,7.0,1.0,0.006816129529220176,4,149,0.13212425836868488,0.0002743021824756431,188.24613274468317,COMPLETE
1792,0.338012158870697,2023-09-04 22:40:18.857277,2023-09-04 22:40:19.440345,0 days 00:00:00.583068,ReLU,ReLU,Sigmoid,ReLU,36,22,24.0,9.0,7.0,0.006119308378575642,4,167,0.30459960944102443,2.3217973856695157e-05,137.59747651565905,COMPLETE
1793,0.2788855731487274,2023-09-04 22:40:19.440896,2023-09-04 22:40:20.697956,0 days 00:00:01.257060,Tanh,ReLU,Sigmoid,ReLU,37,21,24.0,8.0,5.0,0.008787128937842378,4,180,0.776016285892959,0.0006395968293652191,95.61988985979998,COMPLETE
1794,0.9574309587478638,2023-09-04 22:40:20.698480,2023-09-04 22:40:21.110603,0 days 00:00:00.412123,Tanh,ReLU,Sigmoid,ReLU,34,20,23.0,7.0,2.0,0.010316108952389344,4,155,0.401043862678836,0.00047140308886831013,102.39219101615573,COMPLETE
1795,0.3192142844200134,2023-09-04 22:40:21.111144,2023-09-04 22:40:21.982419,0 days 00:00:00.871275,Tanh,ReLU,Sigmoid,Leaky,37,21,24.0,10.0,3.0,0.005843980370176723,4,168,0.7994838484134632,0.00022832028897491977,80.34651206521427,COMPLETE
1796,0.33441320061683655,2023-09-04 22:40:21.982946,2023-09-04 22:40:23.728455,0 days 00:00:01.745509,Tanh,ReLU,Sigmoid,ReLU,36,19,23.0,6.0,10.0,0.008158134664244426,4,148,0.7228270052198886,1.650181496399069e-05,115.28467416763306,COMPLETE
1797,0.4607091248035431,2023-09-04 22:40:23.729431,2023-09-04 22:40:28.192032,0 days 00:00:04.462601,ReLU,ReLU,Sigmoid,Sigmoid,31,11,24.0,9.0,9.0,8.659967355742906e-05,4,167,0.7584539811713744,1.3506913002317062e-05,133.1959571153104,COMPLETE
1798,0.40655192732810974,2023-09-04 22:40:28.192543,2023-09-04 22:40:28.662875,0 days 00:00:00.470332,Tanh,ReLU,Sigmoid,ReLU,39,22,24.0,11.0,4.0,0.011804745636162897,4,187,0.360204661476285,0.019887442232427072,146.80592144236846,COMPLETE
1799,0.5232310891151428,2023-09-04 22:40:28.663428,2023-09-04 22:40:29.006570,0 days 00:00:00.343142,Sigmoid,ReLU,Sigmoid,Sigmoid,34,21,23.0,6.0,13.0,0.0015500127465912115,4,145,0.18649514052898838,3.32122357769681e-05,218.3191613091363,COMPLETE
1800,0.4768989086151123,2023-09-04 22:40:29.007143,2023-09-04 22:40:29.390739,0 days 00:00:00.383596,Tanh,ReLU,Sigmoid,Leaky,37,13,24.0,7.0,7.0,0.007010943345367219,4,158,0.1169079309594593,0.01516456348019294,136.90361388300505,COMPLETE
1801,0.3504333198070526,2023-09-04 22:40:29.391262,2023-09-04 22:40:30.567329,0 days 00:00:01.176067,Tanh,ReLU,Sigmoid,ReLU,35,20,23.0,8.0,1.0,0.00945719724705927,4,162,0.41383006890916113,2.066323016005935e-05,308.26874285065725,COMPLETE
1802,0.4031670093536377,2023-09-04 22:40:30.567887,2023-09-04 22:40:31.053959,0 days 00:00:00.486072,Tanh,ReLU,Sigmoid,Sigmoid,38,22,24.0,7.0,5.0,0.00597326661872951,4,155,0.14631277985433125,0.00036812623642647224,130.63608091305463,COMPLETE
1803,0.3904397487640381,2023-09-04 22:40:31.054527,2023-09-04 22:40:31.420147,0 days 00:00:00.365620,ReLU,ReLU,Sigmoid,ReLU,32,21,23.0,9.0,6.0,0.011086087826051251,4,183,0.1139780165897644,0.0012266630311150522,269.9836473464966,COMPLETE
1804,0.31444093585014343,2023-09-04 22:40:31.420680,2023-09-04 22:40:33.410076,0 days 00:00:01.989396,Tanh,ReLU,Sigmoid,Tanh,35,22,24.0,12.0,11.0,0.0013892374405391503,4,139,0.7466655048413668,0.0002458075946222041,138.40508695082232,COMPLETE
1805,0.8500869274139404,2023-09-04 22:40:33.410609,2023-09-04 22:40:36.708224,0 days 00:00:03.297615,Tanh,ReLU,Sigmoid,ReLU,38,9,23.0,8.0,3.0,1.3421479461397779e-05,4,173,0.7127056378956931,0.00018931524673671568,115.88382685666828,COMPLETE
1806,0.42404359579086304,2023-09-04 22:40:36.708729,2023-09-04 22:40:37.072068,0 days 00:00:00.363339,Tanh,ReLU,Sigmoid,Leaky,38,20,24.0,6.0,9.0,0.07494310484096021,4,151,0.3205062982958268,0.004145378302228533,152.281591796875,COMPLETE
1807,0.25360342860221863,2023-09-04 22:40:37.072601,2023-09-04 22:40:38.183813,0 days 00:00:01.111212,ReLU,ReLU,Sigmoid,Sigmoid,36,10,23.0,10.0,14.0,0.012951929663307554,4,190,0.7720624510569098,3.961136404244694e-05,86.78516534034242,COMPLETE
1808,0.2831585705280304,2023-09-04 22:40:38.184362,2023-09-04 22:40:40.256440,0 days 00:00:02.072078,ReLU,ReLU,Sigmoid,Sigmoid,33,10,23.0,10.0,15.0,0.004502455552074262,4,186,0.7051838745194889,4.442519991932704e-05,102.07112171885731,COMPLETE
1809,0.32570549845695496,2023-09-04 22:40:40.256969,2023-09-04 22:40:41.126840,0 days 00:00:00.869871,ReLU,ReLU,Sigmoid,Sigmoid,35,10,22.0,10.0,14.0,0.012345219262369771,4,189,0.7371605633495567,4.364891828603303e-05,89.65520773993597,COMPLETE
1810,0.43001607060432434,2023-09-04 22:40:41.127370,2023-09-04 22:40:41.427196,0 days 00:00:00.299826,ReLU,ReLU,Sigmoid,Sigmoid,40,9,23.0,11.0,16.0,0.013373463924839811,4,193,0.15977254720477616,3.5357930336200676e-05,220.59349017673068,COMPLETE
1811,0.3010208308696747,2023-09-04 22:40:41.427717,2023-09-04 22:40:43.268469,0 days 00:00:01.840752,ReLU,ReLU,Sigmoid,Sigmoid,33,10,23.0,11.0,13.0,0.0047542110668533,4,178,0.7657371236268454,5.220464767367105e-05,95.07961802328786,COMPLETE
1812,0.35532253980636597,2023-09-04 22:40:43.268998,2023-09-04 22:40:44.190409,0 days 00:00:00.921411,ReLU,ReLU,Sigmoid,Sigmoid,36,9,23.0,12.0,15.0,0.016187513549273943,4,180,0.5052268090618733,3.987555014376044e-05,126.84401798248291,COMPLETE
1813,0.2573108375072479,2023-09-04 22:40:44.190956,2023-09-04 22:40:46.021825,0 days 00:00:01.830869,ReLU,ReLU,Sigmoid,Sigmoid,34,9,22.0,10.0,14.0,0.007852007791311188,4,197,0.7208988732439843,3.1044565711903486e-05,91.59057240671926,COMPLETE
1814,0.5044392347335815,2023-09-04 22:40:46.022392,2023-09-04 22:40:46.373708,0 days 00:00:00.351316,ReLU,ReLU,Sigmoid,Sigmoid,32,8,23.0,10.0,14.0,0.007845377878904299,4,191,0.13457936544779592,4.0841429618762085e-05,320.6689314100477,COMPLETE
1815,0.3679167628288269,2023-09-04 22:40:46.374257,2023-09-04 22:40:47.210977,0 days 00:00:00.836720,ReLU,ReLU,Sigmoid,Sigmoid,33,10,22.0,11.0,15.0,0.006307699487542297,4,191,0.2895285772979714,3.356462041158733e-05,875.7149028289012,COMPLETE
