number,value,datetime_start,datetime_complete,duration,params_activation1,params_activation2,params_activation3,params_activation4,params_batch_size,params_fl1,params_fl2,params_fl3,params_fl4,params_learning_rate,params_n_layers,params_num_epochs,params_train_size,params_weight_decay,user_attrs_mre,state
1482,0.28846555948257446,2023-09-04 22:03:04.932647,2023-09-04 22:03:06.463951,0 days 00:00:01.531304,Sigmoid,Leaky,Leaky,,33,17,19.0,23.0,,0.014524187534230975,3,222,0.7713383127862745,1.2215981073534929e-05,209.1380307711088,COMPLETE
1483,1.1356496810913086,2023-09-04 22:03:06.464474,2023-09-04 22:03:07.241966,0 days 00:00:00.777492,ReLU,Leaky,Leaky,ReLU,43,20,21.0,1.0,10.0,0.002402843200278107,4,182,0.6849755380687021,0.0017357388540939897,100.02803219065947,COMPLETE
1484,0.4608599841594696,2023-09-04 22:03:07.242467,2023-09-04 22:03:09.847156,0 days 00:00:02.604689,ReLU,Leaky,Sigmoid,,31,20,23.0,22.0,,0.0001746574912759717,3,101,0.7999324632335577,0.013305375858821444,282.4827358132542,COMPLETE
1485,0.33648326992988586,2023-09-04 22:03:09.847931,2023-09-04 22:03:12.200525,0 days 00:00:02.352594,ReLU,Tanh,Tanh,,25,21,17.0,21.0,,0.003068762802720376,3,206,0.741574214875527,0.0167786337847773,431.2866912115188,COMPLETE
1486,0.3303785026073456,2023-09-04 22:03:12.201450,2023-09-04 22:03:13.405842,0 days 00:00:01.204392,ReLU,Sigmoid,Leaky,,41,19,11.0,8.0,,0.011075843157132767,3,60,0.5172090304871233,2.180033479028689e-05,168.17944056193033,COMPLETE
1487,0.6378763318061829,2023-09-04 22:03:13.406358,2023-09-04 22:03:17.364759,0 days 00:00:03.958401,ReLU,Leaky,ReLU,,37,18,7.0,24.0,,1.686954938293259e-05,3,197,0.7211975599477676,0.0002432886761243523,158.62471333615065,COMPLETE
1488,0.6194100975990295,2023-09-04 22:03:17.365331,2023-09-04 22:03:17.784176,0 days 00:00:00.418845,Sigmoid,Leaky,Leaky,,39,20,20.0,9.0,,0.05447275866627308,3,215,0.35207574268515995,0.021664572352141385,292.5725638071696,COMPLETE
1489,0.35690784454345703,2023-09-04 22:03:17.784762,2023-09-04 22:03:19.913784,0 days 00:00:02.129022,ReLU,Tanh,Leaky,,59,24,22.0,7.0,,0.003661563496650141,3,171,0.7713227616090111,0.00019768432748759168,115.73310783727845,COMPLETE
1490,0.4225732088088989,2023-09-04 22:03:19.914591,2023-09-04 22:03:20.235175,0 days 00:00:00.320584,ReLU,,,,34,19,,,,0.09912277116189866,1,231,0.2611780703725826,0.0009220314575789064,282.51237121582034,COMPLETE
1491,0.505262017250061,2023-09-04 22:03:20.235771,2023-09-04 22:03:21.239087,0 days 00:00:01.003316,ReLU,Leaky,Tanh,Leaky,27,23,5.0,22.0,2.0,0.0019182943204520961,4,186,0.12079678353117969,4.5160136389028206e-05,478.0350104195731,COMPLETE
1492,0.31885966658592224,2023-09-04 22:03:21.239921,2023-09-04 22:03:24.100057,0 days 00:00:02.860136,ReLU,Leaky,Leaky,,44,21,10.0,6.0,,0.005127844114061071,3,154,0.7488977497871755,3.340916143651108e-05,160.62637370906464,COMPLETE
1493,0.5871878266334534,2023-09-04 22:03:24.100894,2023-09-04 22:03:25.746133,0 days 00:00:01.645239,ReLU,Tanh,Sigmoid,,32,18,8.0,24.0,,0.0001112126670793784,3,207,0.10448904472138755,0.00010054031645134085,121.9709132834909,COMPLETE
1494,0.3311390280723572,2023-09-04 22:03:25.747748,2023-09-04 22:03:28.372126,0 days 00:00:02.624378,Leaky,Leaky,Leaky,Tanh,29,20,23.0,12.0,12.0,0.01620619645276178,4,80,0.6894599974096597,0.0020825043526875478,182.9059245897376,COMPLETE
1495,0.3663674294948578,2023-09-04 22:03:28.372778,2023-09-04 22:03:28.964329,0 days 00:00:00.591551,ReLU,Leaky,ReLU,,36,19,9.0,20.0,,0.00754205689774793,3,197,0.29245264159524365,3.881719298195752e-05,428.0903904691656,COMPLETE
1496,0.5151306390762329,2023-09-04 22:03:28.966319,2023-09-04 22:03:45.966522,0 days 00:00:17.000203,Sigmoid,Tanh,Leaky,,34,22,22.0,23.0,,0.00015119818917651458,3,420,0.7708713073332211,0.006035965996730275,236.3314358879538,COMPLETE
1497,0.3948307931423187,2023-09-04 22:03:45.968524,2023-09-04 22:03:48.972292,0 days 00:00:03.003768,ReLU,Leaky,Leaky,,40,20,23.0,9.0,,0.00040903829924620244,3,220,0.3284438876672323,0.0004510526731777142,128.9006026585897,COMPLETE
1498,0.34484368562698364,2023-09-04 22:03:48.973153,2023-09-04 22:03:50.674043,0 days 00:00:01.700890,ReLU,Leaky,Leaky,,38,19,18.0,16.0,,0.012716862253511494,3,184,0.7098494215825943,2.820551359395601e-05,144.0497667649213,COMPLETE
1499,0.3266909420490265,2023-09-04 22:03:50.674933,2023-09-04 22:03:52.820885,0 days 00:00:02.145952,ReLU,Sigmoid,Tanh,Leaky,57,18,21.0,8.0,22.0,0.006023959685602569,4,175,0.7990182517024077,0.001140320445979305,168.21356040553042,COMPLETE
1500,0.5426049828529358,2023-09-04 22:03:52.823989,2023-09-04 22:03:54.717488,0 days 00:00:01.893499,ReLU,Tanh,,,81,21,24.0,,,0.001408417091566705,2,162,0.7393842059310156,0.07714829720126369,234.37261654915065,COMPLETE
1501,1.0190088748931885,2023-09-04 22:03:54.718419,2023-09-04 22:03:55.182854,0 days 00:00:00.464435,ReLU,Leaky,Sigmoid,,31,19,19.0,8.0,,0.0045234149920541445,3,194,0.41189286941145714,0.08997356370729316,100.10230255126953,COMPLETE
1502,0.726056694984436,2023-09-04 22:03:55.183953,2023-09-04 22:04:05.144652,0 days 00:00:09.960699,Sigmoid,Leaky,Leaky,,36,20,20.0,15.0,,1.2556573155367923e-05,3,213,0.744333560420954,0.0001620730557155075,119.47198282161229,COMPLETE
1503,0.3661985695362091,2023-09-04 22:04:05.146240,2023-09-04 22:04:06.500912,0 days 00:00:01.354672,ReLU,Tanh,ReLU,,42,21,22.0,22.0,,0.0009120897011509753,3,231,0.18909651404591218,5.648754471752861e-05,135.18149399175877,COMPLETE
1504,0.32662662863731384,2023-09-04 22:04:06.502220,2023-09-04 22:04:07.653428,0 days 00:00:01.151208,ReLU,Leaky,Leaky,,48,17,20.0,18.0,,0.010533313631171977,3,206,0.43333495642846404,0.00030064201075327094,349.5176898731905,COMPLETE
1505,0.530443012714386,2023-09-04 22:04:07.654369,2023-09-04 22:04:15.848365,0 days 00:00:08.193996,ReLU,Leaky,Leaky,ReLU,33,3,6.0,9.0,3.0,0.00023880523481870558,4,223,0.3803641665375256,0.004842533860152584,484.9539391214003,COMPLETE
1506,0.4915871322154999,2023-09-04 22:04:15.849535,2023-09-04 22:04:16.235099,0 days 00:00:00.385564,ReLU,Tanh,Tanh,,30,20,22.0,21.0,,0.0031802973913287124,3,189,0.1001818915221796,0.00013159179092242626,141.83804302215577,COMPLETE
1507,0.4106709957122803,2023-09-04 22:04:16.236231,2023-09-04 22:04:16.587724,0 days 00:00:00.351493,ReLU,Leaky,Leaky,,35,15,21.0,23.0,,0.00917637607272866,3,177,0.1539766529875178,0.00024256869422181122,528.4721540178572,COMPLETE
1508,0.49406057596206665,2023-09-04 22:04:16.588319,2023-09-04 22:04:17.181791,0 days 00:00:00.593472,ReLU,Leaky,Sigmoid,,28,18,23.0,7.0,,0.0017341937258572554,3,195,0.2232898878942234,1.18981401392496e-05,474.5212484220179,COMPLETE
1509,0.43759873509407043,2023-09-04 22:04:17.182338,2023-09-04 22:04:18.557309,0 days 00:00:01.374971,Sigmoid,Tanh,Leaky,,38,16,21.0,24.0,,0.00220465957989391,3,131,0.23356512679825822,1.5684015407249723e-05,295.6585533782726,COMPLETE
1510,0.4368021488189697,2023-09-04 22:04:18.559266,2023-09-04 22:04:21.072820,0 days 00:00:02.513554,ReLU,Leaky,ReLU,Leaky,45,19,24.0,10.0,20.0,0.000658351852762127,4,168,0.20260795539948442,2.2105207691253687e-05,553.068600891502,COMPLETE
1511,0.5821157097816467,2023-09-04 22:04:21.074328,2023-09-04 22:04:31.717488,0 days 00:00:10.643160,ReLU,Sigmoid,Leaky,,33,19,22.0,17.0,,5.918600335518441e-05,3,201,0.6455540398815658,0.0015416162486591332,214.89000079406435,COMPLETE
1512,0.29686444997787476,2023-09-04 22:04:31.718474,2023-09-04 22:04:33.555236,0 days 00:00:01.836762,ReLU,Leaky,Leaky,,41,20,19.0,23.0,,0.0038582153220262597,3,211,0.7990029774725861,0.0006651163846789673,137.55347197396415,COMPLETE
1513,0.461437463760376,2023-09-04 22:04:33.556294,2023-09-04 22:04:36.267554,0 days 00:00:02.711260,ReLU,Tanh,Tanh,,31,22,23.0,22.0,,0.00013594789945809812,3,68,0.7061030582725042,7.666233617263884e-05,434.68727897195254,COMPLETE
1514,0.591656506061554,2023-09-04 22:04:36.268146,2023-09-04 22:04:36.946184,0 days 00:00:00.678038,Leaky,Leaky,Leaky,Sigmoid,36,1,18.0,19.0,8.0,0.002656705565174661,4,236,0.16882538201019692,0.00019194487458053128,9666.6625630188,COMPLETE
1515,0.38489916920661926,2023-09-04 22:04:36.946837,2023-09-04 22:04:37.865949,0 days 00:00:00.919112,ReLU,Leaky,Sigmoid,,52,23,22.0,9.0,,0.016642811405585076,3,184,0.6713652134815604,0.0026030269570059134,220.49975255330403,COMPLETE
1516,0.41851845383644104,2023-09-04 22:04:37.866529,2023-09-04 22:04:39.469702,0 days 00:00:01.603173,Sigmoid,Tanh,Leaky,,39,21,20.0,8.0,,0.0011681740378481893,3,222,0.3350320578045594,4.15520265398601e-05,202.42888293796116,COMPLETE
1517,0.3835102915763855,2023-09-04 22:04:39.470282,2023-09-04 22:04:41.141765,0 days 00:00:01.671483,ReLU,Leaky,ReLU,,24,19,21.0,8.0,,0.013334658227277469,3,203,0.7736689020632346,0.01793706162561705,367.9153578016493,COMPLETE
1518,0.3729178011417389,2023-09-04 22:04:41.142291,2023-09-04 22:04:41.803799,0 days 00:00:00.661508,ReLU,Leaky,Leaky,,34,17,12.0,7.0,,0.007831874932485142,3,155,0.5042685083955084,0.00011227758983928737,190.56032320348228,COMPLETE
1519,0.46370816230773926,2023-09-04 22:04:41.804401,2023-09-04 22:04:43.431512,0 days 00:00:01.627111,ReLU,Tanh,Leaky,Leaky,29,18,21.0,21.0,5.0,0.00047141243509527534,4,195,0.2542059456803579,0.0036191113981480167,297.011574234501,COMPLETE
1520,0.3872663676738739,2023-09-04 22:04:43.432189,2023-09-04 22:04:43.859820,0 days 00:00:00.427631,ReLU,Leaky,Tanh,,26,20,15.0,23.0,,0.005883165338655115,3,174,0.272528342323189,0.0005316920936870226,200.88049593838778,COMPLETE
1521,0.2900577783584595,2023-09-04 22:04:43.860317,2023-09-04 22:04:45.830762,0 days 00:00:01.970445,ReLU,Leaky,Leaky,,19,21,20.0,20.0,,0.002951939670723662,3,214,0.7312231916537034,0.001288975260128494,196.71472667825634,COMPLETE
1522,0.47087085247039795,2023-09-04 22:04:45.831429,2023-09-04 22:04:46.935511,0 days 00:00:01.104082,ReLU,Leaky,Sigmoid,,43,22,10.0,9.0,,0.0021548227938763607,3,58,0.7709373803118171,5.0066044760516804e-05,222.45447540283203,COMPLETE
1523,0.36630871891975403,2023-09-04 22:04:46.936172,2023-09-04 22:04:48.469248,0 days 00:00:01.533076,Sigmoid,Tanh,Leaky,ReLU,37,19,23.0,24.0,17.0,0.07051953764668334,4,184,0.7484976875392355,0.0003586189605428983,307.19799041748047,COMPLETE
1524,0.3494769334793091,2023-09-04 22:04:48.469796,2023-09-04 22:04:49.236933,0 days 00:00:00.767137,ReLU,Sigmoid,ReLU,,31,20,22.0,8.0,,0.01114069499706997,3,227,0.36687387879208766,3.3620325281319444e-05,566.412354007844,COMPLETE
1525,0.3570367693901062,2023-09-04 22:04:49.237430,2023-09-04 22:04:50.230754,0 days 00:00:00.993324,ReLU,Leaky,Leaky,,33,18,17.0,22.0,,0.001451100233820367,3,203,0.4571798907969671,0.0001543856376151632,199.2715781075614,COMPLETE
1526,0.47655123472213745,2023-09-04 22:04:50.231273,2023-09-04 22:04:50.664130,0 days 00:00:00.432857,ReLU,Leaky,Leaky,,40,20,11.0,9.0,,0.05053145467174612,3,189,0.6907944856025007,0.03246431836691147,249.0378433227539,COMPLETE
1527,0.29782548546791077,2023-09-04 22:04:50.664657,2023-09-04 22:04:51.474114,0 days 00:00:00.809457,ReLU,Tanh,Tanh,,46,21,23.0,14.0,,0.004376345926589055,3,164,0.5772962317416722,0.00021935531436110688,840.0042991638184,COMPLETE
1528,0.46158498525619507,2023-09-04 22:04:51.474649,2023-09-04 22:04:52.264493,0 days 00:00:00.789844,ReLU,Leaky,Leaky,Leaky,35,19,19.0,10.0,11.0,0.0005298380991041749,4,237,0.14167611519904513,2.6440747202087104e-05,173.18666713357828,COMPLETE
1529,0.4269087612628937,2023-09-04 22:04:52.265111,2023-09-04 22:04:54.168513,0 days 00:00:01.903402,Sigmoid,Leaky,Sigmoid,,37,20,22.0,7.0,,0.0008552647440208545,3,358,0.18079825522317836,9.146880715517943e-05,274.680142450599,COMPLETE
1530,0.3208327293395996,2023-09-04 22:04:54.169051,2023-09-04 22:04:55.423426,0 days 00:00:01.254375,ReLU,Tanh,Leaky,,32,18,21.0,17.0,,0.003592568100856152,3,50,0.798963292760082,5.894512214341663e-05,139.971474609375,COMPLETE
1531,0.30942681431770325,2023-09-04 22:04:55.423980,2023-09-04 22:04:56.062170,0 days 00:00:00.638190,ReLU,Leaky,,,28,21,24.0,,,0.015028579044361601,2,212,0.7226975268138099,1.3576593279697292e-05,194.9499239240374,COMPLETE
1532,0.5854929089546204,2023-09-04 22:04:56.062655,2023-09-04 22:04:56.387745,0 days 00:00:00.325090,ReLU,Leaky,Leaky,,42,19,22.0,24.0,,0.008998434941751716,3,141,0.6180014471744831,0.0661858566843548,193.98755972726005,COMPLETE
1533,0.8295431137084961,2023-09-04 22:04:56.388293,2023-09-04 22:04:59.344003,0 days 00:00:02.955710,ReLU,Tanh,ReLU,,39,20,20.0,23.0,,1.3412118822417717e-05,3,176,0.5309928085750353,0.091735060010414,141.17241391268644,COMPLETE
1534,0.3265257179737091,2023-09-04 22:04:59.344906,2023-09-04 22:05:02.639516,0 days 00:00:03.294610,ReLU,Leaky,Leaky,Tanh,30,19,16.0,16.0,7.0,0.002563712741263658,4,486,0.7700245901132894,0.0018450103067048544,211.26397369384765,COMPLETE
1535,0.4564407467842102,2023-09-04 22:05:02.640393,2023-09-04 22:05:03.802000,0 days 00:00:01.161607,ReLU,Leaky,Tanh,,35,22,23.0,8.0,,0.040558986246233865,3,193,0.7466995849651061,1.7566150135609332e-05,345.0210075378418,COMPLETE
1536,0.6572123169898987,2023-09-04 22:05:03.802923,2023-09-04 22:05:12.400766,0 days 00:00:08.597843,Sigmoid,Sigmoid,Leaky,,44,18,21.0,22.0,,2.845882055529781e-05,3,221,0.7043210157372329,0.0001757443068650761,131.74982552506805,COMPLETE
1537,0.360094279050827,2023-09-04 22:05:12.401296,2023-09-04 22:05:13.176898,0 days 00:00:00.775602,ReLU,Tanh,Sigmoid,,32,20,24.0,21.0,,0.006614210251250805,3,198,0.30881779958650585,0.00013067485497722113,127.94430341218647,COMPLETE
1538,0.5146055221557617,2023-09-04 22:05:13.177575,2023-09-04 22:05:17.242629,0 days 00:00:04.065054,Leaky,Leaky,Leaky,,56,17,9.0,23.0,,2.5699349873864122e-05,3,411,0.4593069213403095,0.000702457759285206,156.47909534760635,COMPLETE
1539,0.3058110177516937,2023-09-04 22:05:17.243168,2023-09-04 22:05:20.570871,0 days 00:00:03.327703,ReLU,Leaky,Leaky,Leaky,61,23,19.0,8.0,9.0,0.0003134936036448838,4,205,0.6612342691401379,6.898008130851612e-05,211.49947864493143,COMPLETE
1540,0.4272595942020416,2023-09-04 22:05:20.571818,2023-09-04 22:05:21.921787,0 days 00:00:01.349969,ReLU,Tanh,ReLU,,37,21,21.0,10.0,,0.0010373946292856144,3,186,0.10608461255519697,0.03840402374074582,152.88793222265306,COMPLETE
1541,0.343147337436676,2023-09-04 22:05:21.922564,2023-09-04 22:05:22.968476,0 days 00:00:01.045912,ReLU,Leaky,Leaky,,41,18,22.0,19.0,,0.013038296102641901,3,215,0.7698668861643277,1.9726780936309746e-05,170.30748421805245,COMPLETE
1542,0.3176439106464386,2023-09-04 22:05:22.969322,2023-09-04 22:05:25.057119,0 days 00:00:02.087797,ReLU,Leaky,Tanh,,34,20,20.0,9.0,,0.005008214539055497,3,178,0.7299216950315552,0.00026808063572843465,160.43882607124948,COMPLETE
1543,0.7998058199882507,2023-09-04 22:05:25.059484,2023-09-04 22:05:30.128822,0 days 00:00:05.069338,Sigmoid,Tanh,Leaky,,30,19,23.0,7.0,,4.2128208544246264e-05,3,78,0.7990563651396175,0.0009327630051323448,130.9408669104943,COMPLETE
1544,0.5227833390235901,2023-09-04 22:05:30.129344,2023-09-04 22:05:30.461620,0 days 00:00:00.332276,ReLU,Leaky,Sigmoid,Leaky,49,21,22.0,24.0,15.0,0.001710402579764079,4,228,0.27839123259234294,0.00010827925517851667,386.4111633300781,COMPLETE
1545,0.33208853006362915,2023-09-04 22:05:30.462123,2023-09-04 22:05:31.271070,0 days 00:00:00.808947,ReLU,Leaky,Leaky,,39,19,21.0,9.0,,0.0033709596182153762,3,168,0.7495466183825966,0.00019611969258257253,158.7566951751709,COMPLETE
1546,0.3338642120361328,2023-09-04 22:05:31.271660,2023-09-04 22:05:32.407303,0 days 00:00:01.135643,ReLU,Tanh,Leaky,,28,20,19.0,22.0,,0.00973899277237958,3,157,0.6999037903775757,4.555648926015216e-05,119.87269468085711,COMPLETE
1547,0.3156314194202423,2023-09-04 22:05:32.408111,2023-09-04 22:05:32.987532,0 days 00:00:00.579421,ReLU,Leaky,ReLU,,33,22,23.0,20.0,,0.007560552445984284,3,208,0.7692840155557755,2.562550151723564e-05,332.4929899735884,COMPLETE
1548,0.43627655506134033,2023-09-04 22:05:32.988063,2023-09-04 22:05:34.454973,0 days 00:00:01.466910,ReLU,Sigmoid,Leaky,,36,19,20.0,18.0,,0.0007462982315884326,3,196,0.2624169033226322,1.157422391413921e-05,286.71616978548013,COMPLETE
1549,0.4920644462108612,2023-09-04 22:05:34.455518,2023-09-04 22:05:35.048371,0 days 00:00:00.592853,ReLU,Leaky,Tanh,ReLU,47,18,11.0,22.0,4.0,0.017848417171893862,4,239,0.7987968310263079,3.720547708008911e-05,221.43775494893393,COMPLETE
1550,0.43112823367118835,2023-09-04 22:05:35.048957,2023-09-04 22:05:37.224228,0 days 00:00:02.175271,Sigmoid,Tanh,Leaky,,54,17,18.0,9.0,,0.002041461566920363,3,180,0.6321936081782948,3.205811374795899e-05,137.74082431047322,COMPLETE
1551,0.31588950753211975,2023-09-04 22:05:37.224751,2023-09-04 22:05:38.560279,0 days 00:00:01.335528,ReLU,Leaky,Leaky,,31,20,22.0,21.0,,0.002850980541309448,3,219,0.7278356973595463,0.00015817927711872385,125.44388122558594,COMPLETE
1552,0.5946864485740662,2023-09-04 22:05:38.560833,2023-09-04 22:05:38.905826,0 days 00:00:00.344993,ReLU,Leaky,Sigmoid,,26,23,10.0,8.0,,0.011829511353675881,3,189,0.20035230472020052,0.0002340886780309728,390.9944152832031,COMPLETE
1553,0.509026050567627,2023-09-04 22:05:38.906361,2023-09-04 22:05:41.961633,0 days 00:00:03.055272,ReLU,Tanh,Leaky,Leaky,38,21,23.0,8.0,21.0,8.147435026780863e-05,4,202,0.33831190424577057,0.0025836276490531296,418.41986869585395,COMPLETE
1554,0.33292582631111145,2023-09-04 22:05:41.962600,2023-09-04 22:05:43.970896,0 days 00:00:02.008296,ReLU,Leaky,ReLU,,34,18,22.0,23.0,,0.004032554659530031,3,149,0.3807305639120265,0.00031516295993184383,127.8273354892073,COMPLETE
1555,0.3578396737575531,2023-09-04 22:05:43.972216,2023-09-04 22:05:47.018688,0 days 00:00:03.046472,ReLU,Leaky,Leaky,,41,16,24.0,6.0,,0.0012754828006258435,3,213,0.44144747224244646,0.0011807226457983477,195.38998353011965,COMPLETE
1556,0.329289972782135,2023-09-04 22:05:47.019224,2023-09-04 22:05:48.583090,0 days 00:00:01.563866,Sigmoid,Leaky,Tanh,,44,19,21.0,24.0,,0.0024551007557439175,3,166,0.6692980302979709,0.00041454412135401677,184.18205307006835,COMPLETE
1557,0.6652367115020752,2023-09-04 22:05:48.583726,2023-09-04 22:05:50.410326,0 days 00:00:01.826600,ReLU,Tanh,Leaky,,36,20,20.0,13.0,,3.0267148844134673e-05,3,90,0.7496836839960921,0.025782965230306168,121.49977035522461,COMPLETE
1558,0.3475998640060425,2023-09-04 22:05:50.410919,2023-09-04 22:05:52.118484,0 days 00:00:01.707565,ReLU,Leaky,Leaky,Sigmoid,32,20,21.0,7.0,7.0,0.00534467876697963,4,230,0.7111362932381322,7.811975361243583e-05,243.79151314748844,COMPLETE
1559,0.35534629225730896,2023-09-04 22:05:52.119010,2023-09-04 22:05:53.439977,0 days 00:00:01.320967,ReLU,Leaky,Sigmoid,,40,19,22.0,23.0,,0.015057606398081107,3,191,0.5597736416843433,0.008458429265870813,211.36381022135416,COMPLETE
1560,0.46679678559303284,2023-09-04 22:05:53.440595,2023-09-04 22:05:55.491856,0 days 00:00:02.051261,ReLU,Tanh,,,29,21,18.0,,,0.00011545899821190226,2,206,0.36097232793801204,1.540939165909417e-05,247.022798186367,COMPLETE
1561,0.29581236839294434,2023-09-04 22:05:55.492445,2023-09-04 22:05:57.830934,0 days 00:00:02.338489,ReLU,Sigmoid,Leaky,,34,22,23.0,22.0,,0.003254694974109241,3,185,0.7999059461392511,0.0001425901780094671,174.40164830134466,COMPLETE
1562,0.32483339309692383,2023-09-04 22:05:57.831600,2023-09-04 22:06:01.983379,0 days 00:00:04.151779,Leaky,Leaky,ReLU,,38,18,20.0,10.0,,0.000628306027614565,3,199,0.7671230647162511,0.004192883713639271,358.88967626799575,COMPLETE
1563,0.3956332206726074,2023-09-04 22:06:01.984468,2023-09-04 22:06:02.878027,0 days 00:00:00.893559,ReLU,Leaky,Leaky,,43,19,19.0,21.0,,0.010577487914879724,3,173,0.29306707161666995,5.657027175790149e-05,158.8391996530386,COMPLETE
1564,0.909823477268219,2023-09-04 22:06:02.879001,2023-09-04 22:06:03.345951,0 days 00:00:00.466950,Sigmoid,Tanh,Tanh,Leaky,31,21,22.0,8.0,14.0,0.008356035850554739,4,221,0.11334234491173928,0.04483469664483896,101.98798252986028,COMPLETE
1565,0.30402809381484985,2023-09-04 22:06:03.347260,2023-09-04 22:06:05.839954,0 days 00:00:02.492694,ReLU,Leaky,Leaky,,35,20,21.0,9.0,,0.006488873426975736,3,241,0.6846321072980319,0.002032862061660354,331.1647922515869,COMPLETE
1566,0.3799758553504944,2023-09-04 22:06:05.840907,2023-09-04 22:06:06.956767,0 days 00:00:01.115860,ReLU,Leaky,Leaky,,27,19,24.0,23.0,,0.004442986416610612,3,179,0.22933197660187035,9.960223245220633e-05,146.69751974252554,COMPLETE
1567,0.35531505942344666,2023-09-04 22:06:06.957733,2023-09-04 22:06:13.799374,0 days 00:00:06.841641,Tanh,Tanh,Sigmoid,,32,20,9.0,12.0,,0.0016577182372294935,3,213,0.4181556199207235,0.0015046215027153247,167.41779053516876,COMPLETE
1568,0.29434797167778015,2023-09-04 22:06:13.800352,2023-09-04 22:06:23.725258,0 days 00:00:09.924906,ReLU,Leaky,Leaky,,30,18,23.0,24.0,,0.00027105525510750416,3,160,0.7282938811851581,2.2030596377886078e-05,275.58907475471494,COMPLETE
1569,0.35093826055526733,2023-09-04 22:06:23.726217,2023-09-04 22:06:27.481344,0 days 00:00:03.755127,ReLU,Leaky,ReLU,Tanh,37,24,10.0,9.0,6.0,0.01280242628811285,4,66,0.7681169759813891,0.003175265129683766,188.55977644486862,COMPLETE
1570,0.39741063117980957,2023-09-04 22:06:27.482446,2023-09-04 22:06:30.142014,0 days 00:00:02.659568,ReLU,,,,50,20,,,,0.0009852324207954945,1,194,0.737386313562305,0.00018539292593468013,259.75316190719604,COMPLETE
1571,0.35143840312957764,2023-09-04 22:06:30.142483,2023-09-04 22:06:31.379249,0 days 00:00:01.236766,Sigmoid,Tanh,Leaky,,41,19,22.0,17.0,,0.002135846870021703,3,230,0.7999321927194646,0.00011584678996133745,190.40296739147556,COMPLETE
1572,0.33513808250427246,2023-09-04 22:06:31.380218,2023-09-04 22:06:32.053677,0 days 00:00:00.673459,ReLU,Leaky,Leaky,,46,17,21.0,21.0,,0.016528873288607356,3,200,0.6032148255835379,1.0037528049794851e-05,671.9982087877062,COMPLETE
1573,0.37553468346595764,2023-09-04 22:06:32.054164,2023-09-04 22:06:32.795473,0 days 00:00:00.741309,ReLU,Leaky,Tanh,,33,21,20.0,7.0,,0.0036536204894684933,3,185,0.31815955545718994,4.035337169038296e-05,119.30932833697345,COMPLETE
1574,0.3798185884952545,2023-09-04 22:06:32.796032,2023-09-04 22:06:33.991479,0 days 00:00:01.195447,ReLU,Sigmoid,Leaky,ReLU,39,18,19.0,8.0,3.0,0.03507688170811223,4,219,0.711281425309066,0.0009943829464305715,155.1782934726813,COMPLETE
