number,value,datetime_start,datetime_complete,duration,params_activation1,params_activation2,params_activation3,params_activation4,params_batch_size,params_fl1,params_fl2,params_fl3,params_fl4,params_learning_rate,params_n_layers,params_num_epochs,params_train_size,params_weight_decay,user_attrs_mre,state
186,0.3114044666290283,2023-09-04 21:19:26.413217,2023-09-04 21:19:27.007674,0 days 00:00:00.594457,Leaky,,,,52,20,,,,0.008271504166826536,1,288,0.6378567722355741,7.05850283331979e-05,338.6662948817423,COMPLETE
187,0.31945446133613586,2023-09-04 21:19:27.007979,2023-09-04 21:19:27.480088,0 days 00:00:00.472109,ReLU,ReLU,ReLU,,47,20,24.0,8.0,,0.004468830644910961,3,251,0.7378712795878143,0.00020375818163942777,172.40620668472783,COMPLETE
188,0.26234957575798035,2023-09-04 21:19:27.480395,2023-09-04 21:19:28.861608,0 days 00:00:01.381213,Sigmoid,ReLU,Leaky,,32,18,23.0,24.0,,0.005849634515395861,3,307,0.7982077324694199,4.813755750882942e-05,216.42957793689166,COMPLETE
189,0.28914305567741394,2023-09-04 21:19:28.861916,2023-09-04 21:19:33.433330,0 days 00:00:04.571414,Sigmoid,Leaky,Leaky,,32,13,23.0,24.0,,0.0010548459020681092,3,312,0.7706459641570468,4.882804764820266e-05,273.5972940879956,COMPLETE
190,0.3393985331058502,2023-09-04 21:19:33.433718,2023-09-04 21:19:34.550329,0 days 00:00:01.116611,Sigmoid,ReLU,Leaky,,26,18,24.0,23.0,,0.0035778225801731825,3,302,0.7928149355943458,6.221862965800688e-05,467.45300144102515,COMPLETE
191,0.29377034306526184,2023-09-04 21:19:34.550690,2023-09-04 21:19:35.642464,0 days 00:00:01.091774,Sigmoid,ReLU,Leaky,,34,17,22.0,24.0,,0.0057114963867681175,3,292,0.7994402388249369,3.4938696689880486e-05,261.43653198242185,COMPLETE
192,0.27048882842063904,2023-09-04 21:19:35.642859,2023-09-04 21:19:36.953446,0 days 00:00:01.310587,Sigmoid,ReLU,Leaky,,37,19,23.0,10.0,,0.006596706400032245,3,266,0.7458132723917535,4.273507518892998e-05,635.9170019361708,COMPLETE
193,0.33103200793266296,2023-09-04 21:19:36.953748,2023-09-04 21:19:38.723686,0 days 00:00:01.769938,Sigmoid,ReLU,Leaky,,37,19,23.0,10.0,,0.0066578977295618045,3,308,0.7424826025733502,5.3282749288543255e-05,168.55972815072664,COMPLETE
194,0.3266068994998932,2023-09-04 21:19:38.723989,2023-09-04 21:19:40.411964,0 days 00:00:01.687975,Sigmoid,ReLU,Leaky,,32,19,23.0,9.0,,0.005235332046924745,3,264,0.7190178076918557,4.429217578682253e-05,277.0756570725214,COMPLETE
195,0.3820251226425171,2023-09-04 21:19:40.412273,2023-09-04 21:19:42.715175,0 days 00:00:02.302902,Sigmoid,ReLU,Leaky,,35,20,24.0,10.0,,0.0020539162743138323,3,225,0.7625300792519731,7.652339581390634e-05,300.65537917446085,COMPLETE
196,0.3101620376110077,2023-09-04 21:19:42.715474,2023-09-04 21:19:44.323517,0 days 00:00:01.608043,Sigmoid,ReLU,Leaky,,61,18,24.0,9.0,,0.006637564151634382,3,281,0.7455330968187014,0.00016742651991883447,218.2489741491893,COMPLETE
197,0.28760993480682373,2023-09-04 21:19:44.323840,2023-09-04 21:19:45.429620,0 days 00:00:01.105780,Sigmoid,Leaky,Leaky,,57,21,23.0,11.0,,0.004177764000020605,3,245,0.7098373651338609,9.384098691266342e-05,415.8048016018338,COMPLETE
198,0.33285772800445557,2023-09-04 21:19:45.429941,2023-09-04 21:19:47.066717,0 days 00:00:01.636776,Sigmoid,ReLU,Leaky,,39,22,21.0,10.0,,0.0028452435194952874,3,209,0.7698852091307378,0.00024821123577689906,306.22665488201636,COMPLETE
199,0.2721908688545227,2023-09-04 21:19:47.067030,2023-09-04 21:19:48.398161,0 days 00:00:01.331131,Leaky,Sigmoid,Sigmoid,,30,20,19.0,12.0,,0.009271310297702366,3,274,0.7998680350748287,6.192053605136644e-05,1174.8297943115235,COMPLETE
200,0.3021012246608734,2023-09-04 21:19:48.398479,2023-09-04 21:19:54.028710,0 days 00:00:05.630231,Leaky,Sigmoid,Sigmoid,,28,20,20.0,12.0,,0.000552277420516276,3,271,0.6785629052784894,6.57019664028868e-05,249.6586669696653,COMPLETE
201,0.369553804397583,2023-09-04 21:19:54.029028,2023-09-04 21:19:56.353047,0 days 00:00:02.324019,Leaky,ReLU,Sigmoid,,30,19,19.0,11.0,,0.001600643697194606,3,257,0.7751964816712057,4.23384036694618e-05,169.86934082596392,COMPLETE
202,0.3636173605918884,2023-09-04 21:19:56.353441,2023-09-04 21:19:58.814606,0 days 00:00:02.461165,Leaky,Sigmoid,Sigmoid,,32,20,20.0,14.0,,0.008956609233222168,3,279,0.7988739121469188,6.187320943734351e-05,223.25293083190917,COMPLETE
203,0.3364208936691284,2023-09-04 21:19:58.815113,2023-09-04 21:20:00.737906,0 days 00:00:01.922793,Leaky,Leaky,Sigmoid,,34,19,19.0,12.0,,0.007312985533204129,3,300,0.7414310005499732,7.911063090992991e-05,156.959974193573,COMPLETE
204,0.35675010085105896,2023-09-04 21:20:00.738221,2023-09-04 21:20:01.682352,0 days 00:00:00.944131,Leaky,Sigmoid,Tanh,,37,21,24.0,13.0,,0.010911676397391233,3,287,0.7233897041335569,5.23409831474666e-05,137.3378852561668,COMPLETE
205,0.24447238445281982,2023-09-04 21:20:01.682659,2023-09-04 21:20:03.768329,0 days 00:00:02.085670,Sigmoid,Sigmoid,Sigmoid,,31,18,18.0,9.0,,0.008834316701701988,3,235,0.7992911082479623,3.1473059297997185e-05,660.1451045445034,COMPLETE
206,0.32907426357269287,2023-09-04 21:20:03.768644,2023-09-04 21:20:06.839891,0 days 00:00:03.071247,Sigmoid,Sigmoid,Sigmoid,,30,16,19.0,9.0,,0.0060205107139817615,3,237,0.7996311717795774,2.048070771008577e-05,198.61567369639445,COMPLETE
207,0.31309279799461365,2023-09-04 21:20:06.840201,2023-09-04 21:20:08.624448,0 days 00:00:01.784247,Leaky,Sigmoid,Sigmoid,,27,19,18.0,8.0,,0.009408151246517046,3,227,0.7445543355234682,0.00010582086626145207,130.96753372380763,COMPLETE
208,0.2761000394821167,2023-09-04 21:20:08.624752,2023-09-04 21:20:09.910577,0 days 00:00:01.285825,Sigmoid,Sigmoid,Sigmoid,,31,20,17.0,24.0,,0.01283708693793148,3,215,0.766337195793836,3.0530760189037025e-05,2260.2335747612847,COMPLETE
209,0.2639332711696625,2023-09-04 21:20:09.910891,2023-09-04 21:20:11.352532,0 days 00:00:01.441641,Sigmoid,Sigmoid,Sigmoid,,29,21,20.0,9.0,,0.012433958590602328,3,214,0.694147241911806,3.101284720192463e-05,200.78428691707245,COMPLETE
210,0.30232104659080505,2023-09-04 21:20:11.352841,2023-09-04 21:20:12.861359,0 days 00:00:01.508518,Sigmoid,Sigmoid,Sigmoid,,33,22,20.0,9.0,,0.015523700933140436,3,218,0.7015354434254741,2.5614223245549175e-05,316.57128633771623,COMPLETE
211,0.3548446595668793,2023-09-04 21:20:12.861663,2023-09-04 21:20:15.293250,0 days 00:00:02.431587,Sigmoid,Sigmoid,Sigmoid,,29,20,20.0,8.0,,0.012555358665905465,3,209,0.7549475454780321,3.274382857499558e-05,206.00621265835233,COMPLETE
212,0.39328017830848694,2023-09-04 21:20:15.293772,2023-09-04 21:20:17.417511,0 days 00:00:02.123739,Sigmoid,Sigmoid,Sigmoid,,30,21,17.0,9.0,,0.01141173682437685,3,231,0.5211944222215577,3.131666290043731e-05,228.13025670694122,COMPLETE
213,0.2928888201713562,2023-09-04 21:20:17.417817,2023-09-04 21:20:19.393856,0 days 00:00:01.976039,Sigmoid,Sigmoid,Sigmoid,,31,21,17.0,7.0,,0.007764168431442587,3,220,0.4965536730134212,1.867368398824098e-05,1272.9237535719903,COMPLETE
214,0.4740218222141266,2023-09-04 21:20:19.394166,2023-09-04 21:20:20.541137,0 days 00:00:01.146971,Sigmoid,Sigmoid,Sigmoid,,28,20,19.0,10.0,,0.009865454308961677,3,245,0.4342041801775636,2.589906798161827e-05,255.17179887750174,COMPLETE
215,0.3066641390323639,2023-09-04 21:20:20.541452,2023-09-04 21:20:22.360881,0 days 00:00:01.819429,Sigmoid,Sigmoid,Sigmoid,,32,21,21.0,10.0,,0.01316059385677434,3,198,0.7288118477578638,3.448713948983563e-05,280.81259473164874,COMPLETE
216,0.3264297544956207,2023-09-04 21:20:22.361184,2023-09-04 21:20:24.613063,0 days 00:00:02.251879,Sigmoid,Sigmoid,Sigmoid,,34,20,20.0,9.0,,0.005242936920547982,3,215,0.66016969535375,3.832556057953647e-05,389.70458672516537,COMPLETE
217,0.3103073835372925,2023-09-04 21:20:24.613384,2023-09-04 21:20:25.848154,0 days 00:00:01.234770,Sigmoid,Sigmoid,Sigmoid,,31,22,21.0,9.0,,0.007301570422105431,3,238,0.6935292973700001,2.4050036742346387e-05,195.92132556799686,COMPLETE
218,0.2656722068786621,2023-09-04 21:20:25.848557,2023-09-04 21:20:27.894492,0 days 00:00:02.045935,Sigmoid,Sigmoid,Sigmoid,,36,20,22.0,8.0,,0.01550406306928008,3,228,0.765816486777522,2.9020369803220408e-05,363.08486506369263,COMPLETE
219,0.26280778646469116,2023-09-04 21:20:27.894792,2023-09-04 21:20:29.042531,0 days 00:00:01.147739,Sigmoid,Sigmoid,Sigmoid,,37,21,22.0,8.0,,0.016100886459775123,3,229,0.7184768069627111,4.6359309796034455e-05,160.60087069343118,COMPLETE
220,0.5236209630966187,2023-09-04 21:20:29.042841,2023-09-04 21:20:29.402548,0 days 00:00:00.359707,Sigmoid,Sigmoid,Sigmoid,,36,21,22.0,8.0,,0.017777959144838873,3,253,0.3626164382608947,4.7661327232736496e-05,440.5823127345035,COMPLETE
221,0.3000243306159973,2023-09-04 21:20:29.402851,2023-09-04 21:20:30.358272,0 days 00:00:00.955421,Sigmoid,Sigmoid,Sigmoid,,36,22,22.0,7.0,,0.014765910913484795,3,227,0.7264912206905688,5.75471552944313e-05,229.98918096368962,COMPLETE
222,0.4920688271522522,2023-09-04 21:20:30.358586,2023-09-04 21:20:30.697368,0 days 00:00:00.338782,Sigmoid,Sigmoid,Sigmoid,,39,21,21.0,8.0,,0.0181656101468583,3,234,0.4546316454994688,2.1896111268960203e-05,1436.0275329589845,COMPLETE
223,0.3313388526439667,2023-09-04 21:20:30.697674,2023-09-04 21:20:31.912282,0 days 00:00:01.214608,Sigmoid,Sigmoid,Sigmoid,,34,20,22.0,8.0,,0.010380781315952508,3,240,0.7705178544967125,1.5884090859716614e-05,184.45286499507844,COMPLETE
224,0.6401862502098083,2023-09-04 21:20:31.912599,2023-09-04 21:20:35.761429,0 days 00:00:03.848830,Sigmoid,Sigmoid,Sigmoid,,37,19,23.0,7.0,,4.690111645337394e-05,3,224,0.7498330939776863,3.766613643876304e-05,248.95495976720537,COMPLETE
225,0.4169764518737793,2023-09-04 21:20:35.761735,2023-09-04 21:20:39.914011,0 days 00:00:04.152276,ReLU,Sigmoid,Tanh,,36,21,21.0,6.0,,0.00012053262544379195,3,247,0.7046321156403066,7.259481239017881e-05,2025.2550810532048,COMPLETE
226,0.3459717035293579,2023-09-04 21:20:39.914313,2023-09-04 21:20:41.453296,0 days 00:00:01.538983,Sigmoid,Sigmoid,,,39,17,23.0,,,0.008892484126072929,2,260,0.5995992246182937,2.831014938738118e-05,174.51735569449033,COMPLETE
227,0.3904986083507538,2023-09-04 21:20:41.453589,2023-09-04 21:20:42.000181,0 days 00:00:00.546592,ReLU,ReLU,Sigmoid,,34,18,20.0,8.0,,0.015875442777755207,3,231,0.7990446721468553,4.6830036216636654e-05,143.5829373873197,COMPLETE
228,0.33110904693603516,2023-09-04 21:20:42.000493,2023-09-04 21:20:43.602680,0 days 00:00:01.602187,Sigmoid,Tanh,ReLU,,26,20,22.0,9.0,,0.004629378992749374,3,75,0.6771433849989196,6.094074277411273e-05,202.92024881998697,COMPLETE
229,0.3258339464664459,2023-09-04 21:20:43.602987,2023-09-04 21:20:46.005594,0 days 00:00:02.402607,Sigmoid,ReLU,Sigmoid,,35,20,23.0,9.0,,0.005998671148512717,3,192,0.799815354226187,4.0681904679722736e-05,157.68802845372562,COMPLETE
230,0.33748361468315125,2023-09-04 21:20:46.005887,2023-09-04 21:20:46.407911,0 days 00:00:00.402024,ReLU,ReLU,ReLU,,89,19,24.0,10.0,,0.011618780087524727,3,203,0.7369664200388079,8.737784691621197e-05,175.76804389953614,COMPLETE
231,0.33639445900917053,2023-09-04 21:20:46.408231,2023-09-04 21:20:48.489488,0 days 00:00:02.081257,Sigmoid,Sigmoid,Sigmoid,,33,20,21.0,24.0,,0.011980086862576143,3,212,0.7674065396420556,2.9226750758580078e-05,180.0180872599284,COMPLETE
232,0.3542765974998474,2023-09-04 21:20:48.490000,2023-09-04 21:20:50.749011,0 days 00:00:02.259011,Sigmoid,Sigmoid,Sigmoid,,32,20,19.0,10.0,,0.014056612062323781,3,219,0.7654792740666088,2.8957290911912114e-05,237.65436698294974,COMPLETE
233,0.374820351600647,2023-09-04 21:20:50.749341,2023-09-04 21:20:51.443911,0 days 00:00:00.694570,Sigmoid,Sigmoid,Sigmoid,,38,21,23.0,24.0,,0.008037489149761302,3,222,0.7659415343147717,3.2780205963728035e-05,195.59754709097055,COMPLETE
234,0.35339680314064026,2023-09-04 21:20:51.444216,2023-09-04 21:20:56.138760,0 days 00:00:04.694544,Sigmoid,Sigmoid,Sigmoid,,29,22,18.0,8.0,,0.0024263652992363547,3,236,0.7194929893545841,1.9625435168235552e-05,183.8121371834965,COMPLETE
235,0.48515576124191284,2023-09-04 21:20:56.139066,2023-09-04 21:20:57.384001,0 days 00:00:01.244935,Sigmoid,Sigmoid,Sigmoid,,31,19,24.0,9.0,,0.010151006880791924,3,210,0.7416749111152524,2.3961289438081422e-05,202.66263063492315,COMPLETE
236,0.3745786249637604,2023-09-04 21:20:57.384323,2023-09-04 21:20:59.562535,0 days 00:00:02.178212,Sigmoid,ReLU,Tanh,,35,20,22.0,11.0,,0.0008675498044793678,3,266,0.2948906295836582,0.0004932233330237112,1023.5060814018536,COMPLETE
237,0.2699074447154999,2023-09-04 21:20:59.562837,2023-09-04 21:21:00.291854,0 days 00:00:00.729017,ReLU,Sigmoid,Sigmoid,,33,18,21.0,23.0,,0.01955085855234705,3,248,0.7687426468265205,5.019987745659649e-05,223.68637212117514,COMPLETE
238,0.25546449422836304,2023-09-04 21:21:00.292181,2023-09-04 21:21:00.744686,0 days 00:00:00.452505,ReLU,Leaky,ReLU,,40,18,21.0,23.0,,0.02065615710727365,3,245,0.7065982049483884,5.098071702561859e-05,196.16788058810764,COMPLETE
239,0.33710479736328125,2023-09-04 21:21:00.744991,2023-09-04 21:21:01.078779,0 days 00:00:00.333788,ReLU,Leaky,ReLU,,41,18,21.0,23.0,,0.025175688151323837,3,253,0.6621351529120386,5.4571396547053735e-05,264.7700384230841,COMPLETE
240,0.29026588797569275,2023-09-04 21:21:01.079104,2023-09-04 21:21:01.712216,0 days 00:00:00.633112,ReLU,Leaky,ReLU,,37,17,21.0,22.0,,0.02049425660708712,3,245,0.7181479916368535,4.874968125763968e-05,152.8875183529324,COMPLETE
241,0.30166953802108765,2023-09-04 21:21:01.712537,2023-09-04 21:21:02.220907,0 days 00:00:00.508370,ReLU,Leaky,ReLU,,39,18,20.0,23.0,,0.019216888772461364,3,249,0.6938589667100723,7.08223120119932e-05,128.11195988808907,COMPLETE
242,0.33429771661758423,2023-09-04 21:21:02.221225,2023-09-04 21:21:02.835367,0 days 00:00:00.614142,ReLU,Leaky,ReLU,,34,18,21.0,22.0,,0.016478087279903443,3,238,0.7680601874099531,6.0991786319794324e-05,169.20293785544004,COMPLETE
243,0.2776035964488983,2023-09-04 21:21:02.835911,2023-09-04 21:21:04.516602,0 days 00:00:01.680691,ReLU,Leaky,ReLU,,36,18,22.0,23.0,,0.006582113228810938,3,258,0.7400100429371331,4.05875435241605e-05,120.46115504673548,COMPLETE
244,0.4732130467891693,2023-09-04 21:21:04.517120,2023-09-04 21:21:05.084411,0 days 00:00:00.567291,ReLU,ReLU,Sigmoid,,40,19,20.0,8.0,,0.023297838832481724,3,228,0.25075834165480865,8.044440149317443e-05,160.36109161376953,COMPLETE
245,0.2877945005893707,2023-09-04 21:21:05.084933,2023-09-04 21:21:08.446350,0 days 00:00:03.361417,ReLU,Leaky,Tanh,,33,19,22.0,9.0,,0.0037734935432360023,3,242,0.7994624596876372,4.53471222733588e-05,147.4450657788445,COMPLETE
246,0.4338332712650299,2023-09-04 21:21:08.446655,2023-09-04 21:21:12.472582,0 days 00:00:04.025927,ReLU,ReLU,Sigmoid,,37,18,20.0,12.0,,0.00030594085306803726,3,267,0.4701205920234057,5.444052015467931e-05,202.79805884200536,COMPLETE
247,0.36023426055908203,2023-09-04 21:21:12.472893,2023-09-04 21:21:13.743215,0 days 00:00:01.270322,ReLU,ReLU,Leaky,,43,12,21.0,10.0,,0.008801009401420635,3,256,0.7040751704536807,3.936491732846864e-05,144.92741054958768,COMPLETE
248,0.38761159777641296,2023-09-04 21:21:13.743536,2023-09-04 21:21:14.677144,0 days 00:00:00.933608,ReLU,Sigmoid,ReLU,,29,18,24.0,13.0,,0.015337496630144628,3,231,0.7726620546835483,0.006667824820389115,213.12401871454148,COMPLETE
249,0.2796880304813385,2023-09-04 21:21:14.677448,2023-09-04 21:21:15.572137,0 days 00:00:00.894689,ReLU,Tanh,Sigmoid,,33,17,23.0,23.0,,0.007308624760551285,3,250,0.7996798893772653,6.525863648736794e-05,224.2406250709711,COMPLETE
250,0.2953041195869446,2023-09-04 21:21:15.572444,2023-09-04 21:21:16.620154,0 days 00:00:01.047710,ReLU,Leaky,Leaky,,38,19,22.0,15.0,,0.0011965652525514957,3,275,0.7400320951412852,8.479559802692228e-05,164.9294713755123,COMPLETE
251,0.42968815565109253,2023-09-04 21:21:16.620462,2023-09-04 21:21:17.561448,0 days 00:00:00.940986,Leaky,ReLU,Sigmoid,,35,21,21.0,7.0,,0.005398427523828492,3,313,0.5310186690883997,4.82809243386693e-05,208.304609635297,COMPLETE
252,0.3198246359825134,2023-09-04 21:21:17.561764,2023-09-04 21:21:18.030407,0 days 00:00:00.468643,ReLU,Leaky,ReLU,,32,17,24.0,8.0,,0.010332893321564207,3,237,0.6399186182363035,1.3585625408215771e-05,1139.4815744253306,COMPLETE
253,0.25756174325942993,2023-09-04 21:21:18.030728,2023-09-04 21:21:18.964602,0 days 00:00:00.933874,Tanh,ReLU,Leaky,,40,21,21.0,10.0,,0.017390967292037967,3,226,0.6838892504512888,3.431019257127824e-05,140.25725288391112,COMPLETE
254,0.3832358717918396,2023-09-04 21:21:18.964914,2023-09-04 21:21:19.323064,0 days 00:00:00.358150,Tanh,Sigmoid,Leaky,,40,21,20.0,10.0,,0.019557133892701764,3,227,0.6735619580427394,3.3121223044246e-05,176.7378581653942,COMPLETE
255,0.35860303044319153,2023-09-04 21:21:19.323378,2023-09-04 21:21:19.792468,0 days 00:00:00.469090,Tanh,ReLU,Leaky,,41,22,21.0,22.0,,0.02935799654387332,3,146,0.6225680705018405,3.799918286116189e-05,122.8373007774353,COMPLETE
256,0.30674341320991516,2023-09-04 21:21:19.792792,2023-09-04 21:21:20.250103,0 days 00:00:00.457311,Tanh,ReLU,Leaky,,38,21,21.0,9.0,,0.013886683501923807,3,328,0.6874388769222965,6.851294391949863e-05,1002.3907561125578,COMPLETE
257,0.2924991548061371,2023-09-04 21:21:20.250420,2023-09-04 21:21:21.051259,0 days 00:00:00.800839,Tanh,Leaky,Leaky,,35,23,20.0,11.0,,0.017286726102167235,3,263,0.6486374840176549,0.0010073734883784616,135.4732427597046,COMPLETE
258,0.26161158084869385,2023-09-04 21:21:21.051797,2023-09-04 21:21:21.989134,0 days 00:00:00.937337,Tanh,Sigmoid,Leaky,,43,20,22.0,10.0,,0.021672399984276905,3,244,0.7151208465794936,5.5491724358041845e-05,252.20452917189826,COMPLETE
259,0.3330991566181183,2023-09-04 21:21:21.989463,2023-09-04 21:21:22.622606,0 days 00:00:00.633143,Tanh,Sigmoid,Leaky,,42,20,22.0,10.0,,0.02249816213950051,3,246,0.579779856000836,5.2160268720491e-05,145.61276133855185,COMPLETE
260,0.3061087727546692,2023-09-04 21:21:22.622938,2023-09-04 21:21:23.314640,0 days 00:00:00.691702,Tanh,Sigmoid,Leaky,,45,20,22.0,10.0,,0.02664197523127806,3,241,0.7112281001811454,4.285040963672669e-05,145.7776628577191,COMPLETE
261,0.47551247477531433,2023-09-04 21:21:23.314946,2023-09-04 21:21:23.736984,0 days 00:00:00.422038,Sigmoid,Sigmoid,Leaky,,44,19,23.0,11.0,,0.018835189144998033,3,112,0.21265316656056898,5.618124641666368e-05,174.22489598285722,COMPLETE
262,0.3450343906879425,2023-09-04 21:21:23.737302,2023-09-04 21:21:24.441393,0 days 00:00:00.704091,Tanh,Sigmoid,Leaky,,40,21,22.0,9.0,,0.035460981798673186,3,253,0.5570954764346647,3.4952931816721135e-05,232.66288616039134,COMPLETE
263,0.7318442463874817,2023-09-04 21:21:24.441726,2023-09-04 21:21:28.077506,0 days 00:00:03.635780,Tanh,Sigmoid,Sigmoid,,37,20,21.0,10.0,,2.284949413910794e-05,3,232,0.673349249069868,4.659438931884991e-05,145.72527970938847,COMPLETE
264,0.319497674703598,2023-09-04 21:21:28.077817,2023-09-04 21:21:28.642982,0 days 00:00:00.565165,Tanh,Leaky,Leaky,,29,19,23.0,11.0,,0.0062902567115854895,3,222,0.7279436896072793,6.740440802428341e-05,134.6260425861065,COMPLETE
265,0.3296416699886322,2023-09-04 21:21:28.643338,2023-09-04 21:21:29.638602,0 days 00:00:00.995264,Sigmoid,Sigmoid,Tanh,,27,20,22.0,9.0,,0.021295377024610335,3,271,0.6898789583594023,2.575716969801133e-05,261.8475036621094,COMPLETE
266,0.3386872410774231,2023-09-04 21:21:29.638970,2023-09-04 21:21:30.620938,0 days 00:00:00.981968,Sigmoid,Tanh,Sigmoid,,43,19,23.0,8.0,,0.008324623568896362,3,243,0.6194066358194914,3.651344335293094e-05,185.54259181667018,COMPLETE
267,0.37287774682044983,2023-09-04 21:21:30.621261,2023-09-04 21:21:31.073291,0 days 00:00:00.452030,Tanh,Sigmoid,Leaky,,31,21,15.0,10.0,,0.08628686088135165,3,260,0.3776035743781267,0.00032700409606725185,159.63176803588868,COMPLETE
268,0.29578667879104614,2023-09-04 21:21:31.073596,2023-09-04 21:21:32.381365,0 days 00:00:01.307769,Sigmoid,Leaky,Sigmoid,,39,19,21.0,12.0,,0.011463470179051477,3,234,0.7489409692084327,5.946902648794927e-05,271.2096044100248,COMPLETE
269,0.32197055220603943,2023-09-04 21:21:32.381684,2023-09-04 21:21:35.606214,0 days 00:00:03.224530,Sigmoid,Sigmoid,Leaky,,36,18,22.0,9.0,,0.004702312542168345,3,254,0.7128605938862205,2.902284752824709e-05,187.9225809066022,COMPLETE
270,0.35740700364112854,2023-09-04 21:21:35.606525,2023-09-04 21:21:37.045077,0 days 00:00:01.438552,Sigmoid,Leaky,Sigmoid,,33,20,24.0,10.0,,0.01615491445011701,3,164,0.654219553338949,9.085989353038689e-05,177.99611137026832,COMPLETE
271,0.2878967225551605,2023-09-04 21:21:37.045405,2023-09-04 21:21:39.104754,0 days 00:00:02.059349,Sigmoid,ReLU,Leaky,,41,21,22.0,24.0,,0.006941472929239893,3,225,0.7468417775274282,4.657449140161526e-05,481.72017513808385,COMPLETE
272,0.3205719590187073,2023-09-04 21:21:39.105080,2023-09-04 21:21:40.038917,0 days 00:00:00.933837,Sigmoid,Leaky,Tanh,,35,18,21.0,9.0,,0.009536906893888496,3,295,0.4883208453588936,7.46239238453906e-05,314.52355745103625,COMPLETE
273,0.29840558767318726,2023-09-04 21:21:40.039261,2023-09-04 21:21:40.638122,0 days 00:00:00.598861,ReLU,Sigmoid,Sigmoid,,37,20,24.0,7.0,,0.012627469322260386,3,282,0.7084252800743804,4.1228240983574545e-05,151.19800082120028,COMPLETE
274,0.33877694606781006,2023-09-04 21:21:40.638457,2023-09-04 21:21:42.171587,0 days 00:00:01.533130,Sigmoid,ReLU,Leaky,,30,18,23.0,8.0,,0.005901637509831798,3,246,0.5922551386974662,5.988595014099286e-05,420.89647144990806,COMPLETE
275,0.3178534507751465,2023-09-04 21:21:42.171922,2023-09-04 21:21:42.913615,0 days 00:00:00.741693,Tanh,ReLU,Sigmoid,,32,17,23.0,11.0,,0.008291184481049185,3,267,0.7700905453158589,0.00042246543034614957,163.42633999095244,COMPLETE
276,0.3359661102294922,2023-09-04 21:21:42.914230,2023-09-04 21:21:44.014134,0 days 00:00:01.099904,Sigmoid,Leaky,Sigmoid,,39,22,21.0,10.0,,0.015254007331468799,3,237,0.6713042323779047,2.3764917851404965e-05,146.88745590209962,COMPLETE
277,0.31714120507240295,2023-09-04 21:21:44.014666,2023-09-04 21:21:44.482950,0 days 00:00:00.468284,ReLU,Sigmoid,Leaky,,34,19,20.0,14.0,,0.023681386397967113,3,217,0.7312989682748287,3.34382367543093e-05,174.78346942719958,COMPLETE
