number,value,datetime_start,datetime_complete,duration,params_activation1,params_activation2,params_activation3,params_activation4,params_batch_size,params_fl1,params_fl2,params_fl3,params_fl4,params_learning_rate,params_n_layers,params_num_epochs,params_train_size,params_weight_decay,user_attrs_mre,state
933,0.3648708760738373,2023-09-04 22:20:46.549150,2023-09-04 22:20:49.609530,0 days 00:00:03.060380,ReLU,ReLU,Tanh,ReLU,28,22,9.0,4.0,13.0,0.006139925346349623,4,240,0.708628752864375,0.0016361143534456774,109.61583377153445,COMPLETE
934,0.33153313398361206,2023-09-04 22:20:49.610309,2023-09-04 22:20:54.112639,0 days 00:00:04.502330,Tanh,ReLU,Leaky,Leaky,19,23,10.0,7.0,6.0,0.009260139712694819,4,160,0.6556513007688239,2.011072807000565e-05,111.64369693332249,COMPLETE
935,0.4349268674850464,2023-09-04 22:20:54.113458,2023-09-04 22:20:54.538954,0 days 00:00:00.425496,Tanh,Tanh,Tanh,Tanh,34,21,6.0,20.0,7.0,0.007410704615180487,4,200,0.1065967936511483,2.5257227686724122e-05,465.9346733093262,COMPLETE
936,0.3755524754524231,2023-09-04 22:20:54.539742,2023-09-04 22:20:56.559782,0 days 00:00:02.020040,ReLU,ReLU,Sigmoid,ReLU,31,20,8.0,5.0,9.0,0.013108663425520112,4,255,0.3095350975401353,1.0169484659995256e-05,283.32606420209333,COMPLETE
937,0.37325960397720337,2023-09-04 22:20:56.560597,2023-09-04 22:20:57.557356,0 days 00:00:00.996759,Tanh,Sigmoid,ReLU,Sigmoid,26,22,11.0,17.0,11.0,0.005283130681619169,4,229,0.1742873774793674,8.512932904948713e-05,125.72243900299073,COMPLETE
938,0.29159608483314514,2023-09-04 22:20:57.558164,2023-09-04 22:21:01.541927,0 days 00:00:03.983763,ReLU,ReLU,Tanh,Leaky,24,20,12.0,15.0,8.0,0.010199481918964266,4,245,0.7997449109408242,1.3918972133223373e-05,90.37189712524415,COMPLETE
939,0.399081289768219,2023-09-04 22:21:01.542727,2023-09-04 22:21:18.093772,0 days 00:00:16.551045,Tanh,Tanh,ReLU,Tanh,29,23,8.0,6.0,7.0,7.08579871259196e-05,4,263,0.6215574355553758,0.0006846849269235094,109.90311135991898,COMPLETE
940,0.3127850294113159,2023-09-04 22:21:18.094567,2023-09-04 22:21:20.209335,0 days 00:00:02.114768,Tanh,ReLU,,,56,19,9.0,,,0.006403607272111862,2,145,0.7431426382036647,2.8077073625964482e-05,122.50635298471602,COMPLETE
941,0.25495725870132446,2023-09-04 22:21:20.210084,2023-09-04 22:21:26.951604,0 days 00:00:06.741520,ReLU,ReLU,Tanh,ReLU,22,21,10.0,16.0,24.0,0.003732328487851215,4,250,0.7702603166928504,1.8585569913701578e-05,97.23096740245819,COMPLETE
942,1.059302806854248,2023-09-04 22:21:26.952389,2023-09-04 22:21:27.345955,0 days 00:00:00.393566,ReLU,ReLU,Tanh,ReLU,19,21,10.0,16.0,24.0,0.003742964506525823,4,236,0.12037275089598194,0.08780863747503281,100.75026766459148,COMPLETE
943,0.28625160455703735,2023-09-04 22:21:27.346738,2023-09-04 22:21:35.318713,0 days 00:00:07.971975,Tanh,ReLU,ReLU,ReLU,21,20,24.0,16.0,23.0,0.003075468722954148,4,223,0.7702183441481611,2.176467671426384e-05,88.18489849033641,COMPLETE
944,0.33816108107566833,2023-09-04 22:21:35.319480,2023-09-04 22:21:38.600875,0 days 00:00:03.281395,ReLU,ReLU,Sigmoid,ReLU,21,21,10.0,16.0,24.0,0.003871597813906401,4,246,0.799707735966475,0.0002941153155248957,91.10977015002021,COMPLETE
945,0.35474029183387756,2023-09-04 22:21:38.601671,2023-09-04 22:21:43.457362,0 days 00:00:04.855691,Tanh,ReLU,Tanh,ReLU,18,20,11.0,15.0,22.0,0.0010559785397492032,4,237,0.7519653013290702,0.0009330429260798229,107.70358695983887,COMPLETE
946,0.3720751702785492,2023-09-04 22:21:43.458146,2023-09-04 22:21:44.590060,0 days 00:00:01.131914,Tanh,ReLU,ReLU,ReLU,22,21,11.0,16.0,24.0,0.00418463985132396,4,250,0.24822424495395476,0.00037452175676125484,121.07725919526199,COMPLETE
947,0.3152301013469696,2023-09-04 22:21:44.590897,2023-09-04 22:21:47.358412,0 days 00:00:02.767515,ReLU,ReLU,Tanh,ReLU,24,20,10.0,17.0,23.0,0.004734307572448455,4,230,0.7625936608934375,1.8584905070373665e-05,98.53407641819545,COMPLETE
948,0.3595791459083557,2023-09-04 22:21:47.359207,2023-09-04 22:21:48.794334,0 days 00:00:01.435127,Tanh,ReLU,Leaky,ReLU,52,19,10.0,15.0,21.0,0.00319998056419842,4,238,0.3203907038602133,0.002123844147253948,113.29726771985071,COMPLETE
949,0.4151759743690491,2023-09-04 22:21:48.795144,2023-09-04 22:21:49.497765,0 days 00:00:00.702621,ReLU,ReLU,Tanh,ReLU,23,21,11.0,16.0,23.0,0.005398643412165844,4,254,0.1179112438152764,2.635771373685025e-05,122.97766184806824,COMPLETE
950,0.45328301191329956,2023-09-04 22:21:49.498582,2023-09-04 22:21:50.694715,0 days 00:00:01.196133,Sigmoid,ReLU,ReLU,ReLU,20,20,12.0,17.0,24.0,0.003533767153929794,4,217,0.1946324386617824,0.02688718139621285,325.75677577427456,COMPLETE
951,0.3064531087875366,2023-09-04 22:21:50.695585,2023-09-04 22:21:54.704235,0 days 00:00:04.008650,Tanh,ReLU,Sigmoid,ReLU,23,19,10.0,16.0,20.0,0.002895710959883323,4,172,0.7287568139170377,0.0010380472642160456,104.85202044532413,COMPLETE
952,0.3280942738056183,2023-09-04 22:21:54.705015,2023-09-04 22:21:56.019392,0 days 00:00:01.314377,Tanh,ReLU,Tanh,ReLU,26,20,11.0,15.0,18.0,0.004180853637335128,4,243,0.24631266619028414,6.227657657332767e-05,158.25496711730958,COMPLETE
953,0.2931327819824219,2023-09-04 22:21:56.020225,2023-09-04 22:22:01.289677,0 days 00:00:05.269452,ReLU,ReLU,ReLU,Leaky,21,21,10.0,16.0,10.0,0.008561578659547268,4,248,0.7707863319160749,0.0005270757671592521,92.35212415329953,COMPLETE
954,0.3371144235134125,2023-09-04 22:22:01.290474,2023-09-04 22:22:04.714152,0 days 00:00:03.423678,Tanh,ReLU,Tanh,Tanh,24,20,12.0,18.0,22.0,0.00681964868246145,4,258,0.7999631498545631,0.034934902899740536,117.03231635460487,COMPLETE
955,0.37245821952819824,2023-09-04 22:22:04.714637,2023-09-04 22:22:05.059120,0 days 00:00:00.344483,ReLU,ReLU,ReLU,Leaky,19,21,11.0,17.0,24.0,0.0008276193004016967,4,305,0.15745809890984214,2.9971456811678618e-05,251.27312145811138,COMPLETE
956,0.29503682255744934,2023-09-04 22:22:05.059544,2023-09-04 22:22:06.361407,0 days 00:00:01.301863,Tanh,ReLU,Tanh,ReLU,28,22,11.0,16.0,22.0,0.0024268038521127267,4,227,0.7092583436343436,2.2404551708725743e-05,114.17049525334285,COMPLETE
957,0.3741680979728699,2023-09-04 22:22:06.361829,2023-09-04 22:22:08.403978,0 days 00:00:02.042149,Tanh,ReLU,Sigmoid,Tanh,25,21,19.0,15.0,23.0,0.00031847966252756404,4,182,0.27822296302760036,1.680502358710347e-05,118.46627262660435,COMPLETE
958,0.3687560260295868,2023-09-04 22:22:08.404402,2023-09-04 22:22:08.796779,0 days 00:00:00.392377,ReLU,ReLU,ReLU,Leaky,22,12,13.0,8.0,8.0,0.002478235002227912,4,234,0.30059299501948933,0.0012464391491123447,123.65199554443359,COMPLETE
959,0.29476112127304077,2023-09-04 22:22:08.797207,2023-09-04 22:22:09.875962,0 days 00:00:01.078755,Tanh,ReLU,Tanh,ReLU,27,19,19.0,17.0,21.0,0.013383894935501236,4,243,0.7458955065725749,1.9840850459310858e-05,90.17993887876852,COMPLETE
960,0.3001263737678528,2023-09-04 22:22:09.876389,2023-09-04 22:22:10.900914,0 days 00:00:01.024525,ReLU,ReLU,Tanh,Tanh,25,22,18.0,6.0,9.0,0.0048555370308722015,4,257,0.6830720653149892,0.00010733615229461136,91.08166965685393,COMPLETE
961,0.4149109423160553,2023-09-04 22:22:10.901338,2023-09-04 22:22:11.470392,0 days 00:00:00.569054,Tanh,ReLU,Leaky,Sigmoid,30,23,20.0,7.0,6.0,0.0019767068236390176,4,210,0.1276475329121782,0.010395274901987136,337.75846310570125,COMPLETE
962,0.35936304926872253,2023-09-04 22:22:11.470803,2023-09-04 22:22:13.172725,0 days 00:00:01.701922,Tanh,ReLU,ReLU,Leaky,16,20,12.0,19.0,10.0,0.006114630981093191,4,270,0.34613139518754876,0.0004310838630064129,99.94013754526775,COMPLETE
963,0.3367510735988617,2023-09-04 22:22:13.173483,2023-09-04 22:22:15.149270,0 days 00:00:01.975787,ReLU,ReLU,Tanh,ReLU,32,19,10.0,15.0,19.0,0.011188562756993856,4,249,0.5120023514977309,0.0026262381619487833,142.89051344129774,COMPLETE
964,0.35810306668281555,2023-09-04 22:22:15.149705,2023-09-04 22:22:23.281787,0 days 00:00:08.132082,Tanh,ReLU,ReLU,Tanh,23,23,10.0,16.0,14.0,8.90319045614023e-05,4,234,0.6001862991185635,0.005891056167415536,93.63345248882587,COMPLETE
965,0.3608137369155884,2023-09-04 22:22:23.282236,2023-09-04 22:22:23.489842,0 days 00:00:00.207606,ReLU,Leaky,Tanh,Leaky,47,21,13.0,16.0,9.0,0.007762997768374064,4,262,0.2053943780391972,1.1966702910966756e-05,122.59356108165923,COMPLETE
966,0.342655748128891,2023-09-04 22:22:23.490315,2023-09-04 22:22:26.914094,0 days 00:00:03.423779,Tanh,ReLU,Sigmoid,ReLU,21,20,11.0,17.0,8.0,0.0014630044342036417,4,221,0.7717757009149679,0.0001812092950733209,86.38593608311244,COMPLETE
967,0.2510316073894501,2023-09-04 22:22:26.914930,2023-09-04 22:22:29.919853,0 days 00:00:03.004923,Tanh,ReLU,ReLU,Leaky,27,22,15.0,7.0,12.0,0.005775974076124,4,242,0.728135332405792,0.0006352671845399953,89.41934463500976,COMPLETE
968,0.34809646010398865,2023-09-04 22:22:29.920327,2023-09-04 22:22:30.449597,0 days 00:00:00.529270,ReLU,ReLU,Tanh,Leaky,29,22,15.0,8.0,13.0,0.00525132006793826,4,238,0.2867114491779534,3.331143661120274e-05,102.94587226535963,COMPLETE
969,0.3054662048816681,2023-09-04 22:22:30.450054,2023-09-04 22:22:31.266775,0 days 00:00:00.816721,Tanh,ReLU,ReLU,Leaky,25,22,15.0,8.0,12.0,0.004265230034155712,4,245,0.4238166968383896,5.496166942021629e-05,101.09645632480053,COMPLETE
970,0.33064180612564087,2023-09-04 22:22:31.267242,2023-09-04 22:22:32.001991,0 days 00:00:00.734749,ReLU,ReLU,Tanh,Leaky,35,22,15.0,8.0,13.0,0.00617887982240239,4,230,0.7124328962047694,2.584089784551613e-05,108.0575776533647,COMPLETE
971,0.32844337821006775,2023-09-04 22:22:32.002424,2023-09-04 22:22:33.672042,0 days 00:00:01.669618,Tanh,ReLU,Tanh,Leaky,19,21,15.0,7.0,11.0,0.0053256373936143115,4,254,0.7289265238570495,0.00027609433259797927,114.22364439787688,COMPLETE
972,0.38582760095596313,2023-09-04 22:22:33.672491,2023-09-04 22:22:34.209166,0 days 00:00:00.536675,Tanh,ReLU,,,27,22,14.0,,,0.004042546165182376,2,239,0.659515416863862,0.000778046675766782,105.67588674611059,COMPLETE
973,0.33763188123703003,2023-09-04 22:22:34.209573,2023-09-04 22:22:37.399633,0 days 00:00:03.190060,Sigmoid,Sigmoid,ReLU,Leaky,32,21,15.0,7.0,12.0,0.0033276576288770194,4,251,0.6874578094941899,0.00019933563513653256,103.78782618440539,COMPLETE
974,0.4559424817562103,2023-09-04 22:22:37.400066,2023-09-04 22:22:37.608084,0 days 00:00:00.208018,ReLU,ReLU,Sigmoid,Leaky,23,22,15.0,8.0,15.0,0.0071363014077700905,4,244,0.10170478853471715,1.4909217616086681e-05,172.0170327645761,COMPLETE
975,0.30353352427482605,2023-09-04 22:22:37.608511,2023-09-04 22:22:39.118364,0 days 00:00:01.509853,Tanh,ReLU,Tanh,Leaky,29,21,14.0,16.0,11.0,0.005579720076721373,4,228,0.7730182290748355,0.0028520501200691465,127.17137869810446,COMPLETE
976,0.3595952093601227,2023-09-04 22:22:39.119140,2023-09-04 22:22:43.147390,0 days 00:00:04.028250,ReLU,,,,26,22,,,,6.0345961226842695e-05,1,260,0.7346381125792305,1.002825326094991e-05,99.21785372220553,COMPLETE
977,0.36126598715782166,2023-09-04 22:22:43.147807,2023-09-04 22:22:44.905206,0 days 00:00:01.757399,Tanh,ReLU,Leaky,Leaky,21,21,15.0,15.0,11.0,0.0005331352525217056,4,238,0.7988697655112924,0.007849450429049545,153.76403481619698,COMPLETE
978,0.295559823513031,2023-09-04 22:22:44.905617,2023-09-04 22:22:47.567384,0 days 00:00:02.661767,Tanh,ReLU,ReLU,Leaky,34,22,16.0,18.0,10.0,0.00476577684015221,4,248,0.7619150375449469,0.0001347448094175937,89.88791765485492,COMPLETE
979,0.3298681080341339,2023-09-04 22:22:47.568196,2023-09-04 22:22:48.747880,0 days 00:00:01.179684,ReLU,ReLU,Tanh,Leaky,30,21,14.0,17.0,12.0,0.006226954035274012,4,268,0.3656644517736646,7.629795864214436e-05,195.25860813685827,COMPLETE
980,0.3896133601665497,2023-09-04 22:22:48.748650,2023-09-04 22:22:53.190068,0 days 00:00:04.441418,Tanh,ReLU,ReLU,Leaky,27,20,16.0,7.0,10.0,3.952102050099751e-05,4,254,0.4019747425654028,2.1426222067696223e-05,139.40288156224048,COMPLETE
981,0.3247157633304596,2023-09-04 22:22:53.190498,2023-09-04 22:22:54.263532,0 days 00:00:01.073034,ReLU,ReLU,Tanh,,24,22,13.0,19.0,,0.007738922321380379,3,224,0.7091509664794681,0.004118591595358829,121.46657104492188,COMPLETE
982,0.9901413321495056,2023-09-04 22:22:54.263990,2023-09-04 22:22:57.327002,0 days 00:00:03.063012,Tanh,ReLU,Sigmoid,ReLU,25,22,14.0,8.0,12.0,1.2869703523892198e-05,4,241,0.14286165689712194,3.052584173496179e-05,98.25780512386338,COMPLETE
983,0.4073218107223511,2023-09-04 22:22:57.327458,2023-09-04 22:23:05.316690,0 days 00:00:07.989232,Tanh,ReLU,ReLU,,28,21,12.0,20.0,,1.7775751545581978e-05,3,265,0.5746164429555871,0.0017228835235386594,108.41196913809146,COMPLETE
984,0.2977844476699829,2023-09-04 22:23:05.317457,2023-09-04 22:23:10.314986,0 days 00:00:04.997529,ReLU,Leaky,Tanh,Leaky,18,21,15.0,7.0,16.0,0.0024023139497123236,4,231,0.7407088929628741,3.985881309815703e-05,109.71297391255696,COMPLETE
985,0.35863006114959717,2023-09-04 22:23:10.315472,2023-09-04 22:23:10.715296,0 days 00:00:00.399824,Tanh,ReLU,Tanh,,31,19,13.0,17.0,,0.0034383861093499166,3,251,0.3308955832455572,0.0013579409888270538,216.45118321010045,COMPLETE
986,0.4078388810157776,2023-09-04 22:23:10.715727,2023-09-04 22:23:11.384541,0 days 00:00:00.668814,ReLU,ReLU,ReLU,Sigmoid,23,20,11.0,15.0,10.0,0.004775503142328147,4,257,0.2987542252175955,0.018663119425954354,122.49162371953328,COMPLETE
987,0.32569757103919983,2023-09-04 22:23:11.384977,2023-09-04 22:23:13.544628,0 days 00:00:02.159651,Tanh,ReLU,Tanh,,28,22,9.0,16.0,,0.006587451905319939,3,275,0.4728552854339242,1.711397391649885e-05,115.35787525883427,COMPLETE
988,0.30398479104042053,2023-09-04 22:23:13.545057,2023-09-04 22:23:14.346506,0 days 00:00:00.801449,Tanh,ReLU,ReLU,,33,20,7.0,7.0,,0.008648910123561478,3,123,0.46245046046144406,0.0005865558047915681,118.35968930604028,COMPLETE
989,0.35938504338264465,2023-09-04 22:23:14.346938,2023-09-04 22:23:15.086619,0 days 00:00:00.739681,ReLU,ReLU,Sigmoid,ReLU,20,19,12.0,18.0,24.0,0.0038718131173878017,4,244,0.2317860862032632,0.01537910370479044,116.60550573316671,COMPLETE
990,0.3404347002506256,2023-09-04 22:23:15.087048,2023-09-04 22:23:17.712191,0 days 00:00:02.625143,Tanh,ReLU,Tanh,,26,22,10.0,10.0,,0.0002796329113487947,3,237,0.7710742816755082,2.4753276493902574e-05,110.47448275504856,COMPLETE
991,1.0267237424850464,2023-09-04 22:23:17.712631,2023-09-04 22:23:20.377448,0 days 00:00:02.664817,ReLU,Sigmoid,Leaky,Leaky,22,23,14.0,9.0,13.0,1.6159859819138284e-05,4,260,0.5178698763224138,0.05243110556356299,102.95860906007911,COMPLETE
992,0.28973469138145447,2023-09-04 22:23:20.377886,2023-09-04 22:23:20.920060,0 days 00:00:00.542174,Tanh,ReLU,ReLU,,30,21,16.0,16.0,,0.0017489539782700105,3,249,0.6197804940983259,1.419479192903834e-05,96.58218710763114,COMPLETE
993,0.5531433820724487,2023-09-04 22:23:20.920476,2023-09-04 22:23:23.839700,0 days 00:00:02.919224,Sigmoid,ReLU,Tanh,,24,22,9.0,19.0,,2.746020044384124e-05,3,219,0.3791491399814085,0.006806191715764874,106.76436458221853,COMPLETE
994,0.39545443654060364,2023-09-04 22:23:23.840151,2023-09-04 22:23:25.091967,0 days 00:00:01.251816,Tanh,ReLU,Tanh,ReLU,15,20,5.0,8.0,23.0,0.005643192570183869,4,233,0.6870878628695893,0.027044409727091944,108.55277913411459,COMPLETE
995,0.34995773434638977,2023-09-04 22:23:25.092404,2023-09-04 22:23:30.208306,0 days 00:00:05.115902,ReLU,ReLU,ReLU,Leaky,44,23,11.0,11.0,9.0,0.0004411155302344377,4,269,0.7240001509445034,6.525506468564199e-05,99.73326810201009,COMPLETE
996,0.4027298092842102,2023-09-04 22:23:30.208740,2023-09-04 22:23:30.540990,0 days 00:00:00.332250,Tanh,ReLU,Tanh,,26,21,15.0,17.0,,0.007476401088078105,3,244,0.40820324067622077,0.028505644410113412,100.96429162276418,COMPLETE
997,1.0662438869476318,2023-09-04 22:23:30.541538,2023-09-04 22:23:31.034292,0 days 00:00:00.492754,ReLU,ReLU,Sigmoid,,32,20,13.0,21.0,,0.08687982862490642,3,283,0.7989261794604181,0.06780392373647696,113.71245702107747,COMPLETE
998,0.4061298966407776,2023-09-04 22:23:31.034889,2023-09-04 22:23:40.822843,0 days 00:00:09.787954,Tanh,ReLU,ReLU,Leaky,29,23,14.0,18.0,11.0,2.472088912596209e-05,4,256,0.5474678610081045,5.043110284173305e-05,109.49502268433571,COMPLETE
999,0.3006986975669861,2023-09-04 22:23:40.823638,2023-09-04 22:23:42.325727,0 days 00:00:01.502089,Tanh,ReLU,Tanh,,25,21,10.0,7.0,,0.009339478025293693,3,112,0.7689478943767981,2.8215674899559172e-05,227.73136478000217,COMPLETE
1000,0.3595409691333771,2023-09-04 22:23:42.326514,2023-09-04 22:23:46.206930,0 days 00:00:03.880416,ReLU,ReLU,ReLU,ReLU,21,20,21.0,15.0,14.0,0.014581144405727659,4,236,0.6547738404340271,0.00023520426650373193,91.9087608956002,COMPLETE
1001,0.38056641817092896,2023-09-04 22:23:46.207878,2023-09-04 22:23:48.316653,0 days 00:00:02.108775,Tanh,ReLU,Tanh,,35,12,15.0,16.0,,0.004473682500761515,3,262,0.4004057877468354,0.0004730283844736294,102.85826815980853,COMPLETE
1002,0.3978312611579895,2023-09-04 22:23:48.317483,2023-09-04 22:23:50.261692,0 days 00:00:01.944209,ReLU,ReLU,Sigmoid,Leaky,28,22,11.0,8.0,9.0,0.0011898462813022621,4,226,0.2701043472462115,1.9256479047521574e-05,134.3976551178963,COMPLETE
1003,0.3149915933609009,2023-09-04 22:23:50.262487,2023-09-04 22:23:57.380857,0 days 00:00:07.118370,Tanh,ReLU,ReLU,,22,19,12.0,6.0,,0.0006861361456064715,3,248,0.5873435815923356,1.269838446951897e-05,338.3614985854537,COMPLETE
1004,0.3353348672389984,2023-09-04 22:23:57.381647,2023-09-04 22:24:00.765552,0 days 00:00:03.383905,Tanh,Leaky,Tanh,ReLU,30,21,13.0,9.0,20.0,0.0058124074833525805,4,274,0.7366114829126296,0.0008789679067337479,368.8222670121626,COMPLETE
1005,0.38927504420280457,2023-09-04 22:24:00.766362,2023-09-04 22:24:03.031815,0 days 00:00:02.265453,ReLU,ReLU,,,27,6,16.0,,,0.0029398716660479596,2,254,0.7701219182712101,0.045911296842256796,193.32019331648544,COMPLETE
1006,0.44305020570755005,2023-09-04 22:24:03.032572,2023-09-04 22:24:06.173440,0 days 00:00:03.140868,Tanh,Tanh,Tanh,,18,22,10.0,17.0,,0.000166475810816814,3,242,0.18435805524420382,0.07497237491511866,133.7261281374122,COMPLETE
1007,0.41752326488494873,2023-09-04 22:24:06.174248,2023-09-04 22:24:06.814828,0 days 00:00:00.640580,ReLU,ReLU,Leaky,,24,23,9.0,16.0,,0.007908103066912175,3,265,0.13596595016775506,9.586376489861098e-05,454.27050590515137,COMPLETE
1008,0.31426844000816345,2023-09-04 22:24:06.815620,2023-09-04 22:24:11.835514,0 days 00:00:05.019894,Tanh,ReLU,ReLU,Leaky,37,21,14.0,20.0,10.0,0.00702872565897001,4,130,0.6998668104612026,3.679105605261698e-05,115.40220779027695,COMPLETE
1009,0.4429904520511627,2023-09-04 22:24:11.836317,2023-09-04 22:24:19.413276,0 days 00:00:07.576959,Tanh,ReLU,Tanh,,31,22,11.0,15.0,,4.5686608683010214e-05,3,248,0.3565904558556776,2.3311445010107497e-05,115.05128460545694,COMPLETE
1010,0.3356614112854004,2023-09-04 22:24:19.414100,2023-09-04 22:24:40.987300,0 days 00:00:21.573200,ReLU,Tanh,ReLU,ReLU,23,20,12.0,14.0,9.0,3.738647093197425e-05,4,235,0.7359929051124119,1.721707477591441e-05,118.15639401699634,COMPLETE
1011,0.31538131833076477,2023-09-04 22:24:40.988124,2023-09-04 22:24:43.345068,0 days 00:00:02.356944,Tanh,ReLU,Sigmoid,,76,23,16.0,8.0,,0.002219362700747118,3,221,0.7730463057676956,3.2705234105221454e-05,112.62076512505027,COMPLETE
1012,0.3942619562149048,2023-09-04 22:24:43.345862,2023-09-04 22:24:44.178243,0 days 00:00:00.832381,ReLU,ReLU,Tanh,,27,19,13.0,7.0,,0.027027617879190172,3,258,0.1492538827198153,0.005833261507385322,241.8619658641326,COMPLETE
1013,0.30725330114364624,2023-09-04 22:24:44.179147,2023-09-04 22:24:48.195599,0 days 00:00:04.016452,Tanh,Sigmoid,ReLU,Leaky,20,11,15.0,16.0,18.0,0.00936673980143559,4,295,0.6784956921357586,0.0006534091545453906,110.82822137129934,COMPLETE
1014,0.32350966334342957,2023-09-04 22:24:48.196395,2023-09-04 22:25:02.108672,0 days 00:00:13.912277,Leaky,ReLU,Tanh,ReLU,53,20,14.0,6.0,11.0,0.00013543953216828768,4,281,0.7994047570656196,2.046101357052854e-05,104.99134145173313,COMPLETE
1015,0.38170138001441956,2023-09-04 22:25:02.109496,2023-09-04 22:25:04.714199,0 days 00:00:02.604703,Tanh,Tanh,Tanh,,33,21,8.0,10.0,,0.004841201807976095,3,229,0.7082848361792274,0.02390862878224908,125.9810787624783,COMPLETE
1016,0.38987475633621216,2023-09-04 22:25:04.714971,2023-09-04 22:25:15.858379,0 days 00:00:11.143408,Sigmoid,ReLU,ReLU,Sigmoid,25,22,10.0,17.0,2.0,0.0008693971537910361,4,241,0.3186318603112275,4.2335175667858204e-05,118.15432485999902,COMPLETE
1017,0.2879745066165924,2023-09-04 22:25:15.859189,2023-09-04 22:25:18.384220,0 days 00:00:02.525031,ReLU,ReLU,Leaky,,29,22,15.0,15.0,,0.003627434679052218,3,270,0.7481147905569168,0.00033011908601488253,91.91796260409885,COMPLETE
1018,0.4260728061199188,2023-09-04 22:25:18.385091,2023-09-04 22:25:36.440283,0 days 00:00:18.055192,Tanh,Tanh,Tanh,,26,21,17.0,19.0,,5.246351666081737e-05,3,253,0.7500204209826368,0.00016199049659276342,126.85335634254184,COMPLETE
1019,0.3342708349227905,2023-09-04 22:25:36.441086,2023-09-04 22:25:38.080563,0 days 00:00:01.639477,ReLU,ReLU,Sigmoid,Leaky,35,23,9.0,9.0,8.0,0.0162952941774726,4,248,0.47939339131607356,1.188728882443215e-05,125.1744378226144,COMPLETE
1020,0.4190292954444885,2023-09-04 22:25:38.081399,2023-09-04 22:25:38.464130,0 days 00:00:00.382731,Tanh,ReLU,ReLU,,96,20,20.0,7.0,,0.006107120591921031,3,264,0.17754062727120046,1.5090630181398724e-05,139.89602011221427,COMPLETE
1021,0.29482513666152954,2023-09-04 22:25:38.464975,2023-09-04 22:25:42.234078,0 days 00:00:03.769103,Tanh,ReLU,Tanh,ReLU,31,22,12.0,6.0,12.0,0.012593042526470019,4,238,0.6494293244893017,0.00012140001796710087,96.54222159550108,COMPLETE
1022,0.32370704412460327,2023-09-04 22:25:42.234887,2023-09-04 22:25:43.064309,0 days 00:00:00.829422,ReLU,Tanh,ReLU,,23,20,11.0,5.0,,0.009704710988279484,3,258,0.16375378149142883,2.5204829032507992e-05,137.0144117200697,COMPLETE
1023,0.3344535231590271,2023-09-04 22:25:43.065097,2023-09-04 22:25:45.491813,0 days 00:00:02.426716,Leaky,ReLU,Tanh,Leaky,28,19,14.0,18.0,10.0,0.004143331181555927,4,319,0.7179387733980505,0.03725660230751972,110.20957209269206,COMPLETE
1024,0.2889140844345093,2023-09-04 22:25:45.492658,2023-09-04 22:25:47.432687,0 days 00:00:01.940029,Tanh,ReLU,,,20,21,16.0,,,0.0068597385606201265,2,230,0.7710858593240283,0.000789816686665082,97.58236885070801,COMPLETE
