number,value,datetime_start,datetime_complete,duration,params_activation1,params_activation2,params_activation3,params_activation4,params_batch_size,params_fl1,params_fl2,params_fl3,params_fl4,params_learning_rate,params_n_layers,params_num_epochs,params_train_size,params_weight_decay,user_attrs_mre,state
1246,0.3308171331882477,2023-09-04 22:26:11.913760,2023-09-04 22:26:13.884019,0 days 00:00:01.970259,Tanh,,,,14,20,,,,0.04720171496848559,1,130,0.7474493428527509,5.178138527790326e-05,112.63291041056316,COMPLETE
1247,0.3519900143146515,2023-09-04 22:26:13.884822,2023-09-04 22:26:15.314148,0 days 00:00:01.429326,Tanh,Sigmoid,,,53,22,19.0,,,0.010061881898359451,2,72,0.6328184062241172,0.0024105740228185036,136.3659518848766,COMPLETE
1248,0.5511623620986938,2023-09-04 22:26:15.314954,2023-09-04 22:26:16.450530,0 days 00:00:01.135576,Tanh,Tanh,Leaky,Leaky,46,14,22.0,7.0,3.0,0.01380485243509469,4,59,0.7444830435501787,0.0037674119814915183,120.77817704942491,COMPLETE
1249,0.33292731642723083,2023-09-04 22:26:16.451366,2023-09-04 22:26:18.111342,0 days 00:00:01.659976,ReLU,Sigmoid,,,40,23,10.0,,,0.0645438291747517,2,227,0.6674507493791736,1.7856036049832695e-05,115.89400596618653,COMPLETE
1250,0.5037938952445984,2023-09-04 22:26:18.112174,2023-09-04 22:26:19.007204,0 days 00:00:00.895030,Tanh,Leaky,,,50,19,23.0,,,0.00014638697828321735,2,91,0.1595765730985543,0.02608116700453013,152.00281524658203,COMPLETE
1251,0.2984054982662201,2023-09-04 22:26:19.008034,2023-09-04 22:26:23.003154,0 days 00:00:03.995120,Tanh,ReLU,ReLU,,20,21,18.0,4.0,,0.0013752950430348243,3,236,0.7113894614149101,3.001143521231247e-05,101.27462480333116,COMPLETE
1252,0.3007432520389557,2023-09-04 22:26:23.003966,2023-09-04 22:26:26.454467,0 days 00:00:03.450501,Leaky,Sigmoid,,,10,20,6.0,,,0.03357297902594044,2,84,0.7716559362065504,3.79393357687414e-05,106.22815386454265,COMPLETE
1253,0.41462814807891846,2023-09-04 22:26:26.455260,2023-09-04 22:26:28.845179,0 days 00:00:02.389919,Tanh,Tanh,,,44,18,13.0,,,0.005716833998833184,2,218,0.5742477872322516,0.02705040713653511,103.30780942816483,COMPLETE
1254,0.3453044593334198,2023-09-04 22:26:28.845954,2023-09-04 22:26:29.961548,0 days 00:00:01.115594,Tanh,,,,35,20,,,,0.017190630940118745,1,65,0.7305862181383124,0.0001354174641528589,123.03186334882464,COMPLETE
1255,0.6950759291648865,2023-09-04 22:26:29.962339,2023-09-04 22:26:34.818270,0 days 00:00:04.855931,ReLU,Sigmoid,Sigmoid,,37,24,16.0,6.0,,7.931150064089308e-05,3,164,0.3983083864465397,0.00010067166478546588,113.80434036254883,COMPLETE
1256,0.31834766268730164,2023-09-04 22:26:34.819102,2023-09-04 22:26:55.911781,0 days 00:00:21.092679,Tanh,Tanh,,,13,23,20.0,,,0.0005943928028959852,2,203,0.7732529959202171,0.001922638885582659,103.27972499076567,COMPLETE
1257,0.3664708435535431,2023-09-04 22:26:55.912562,2023-09-04 22:26:56.947242,0 days 00:00:01.034680,Tanh,ReLU,Leaky,Tanh,17,22,5.0,8.0,11.0,0.02295143815540227,4,99,0.18187840422478915,0.0001899329026343259,201.72772386338977,COMPLETE
1258,0.38292592763900757,2023-09-04 22:26:56.948106,2023-09-04 22:26:58.863555,0 days 00:00:01.915449,Sigmoid,Sigmoid,,,48,21,15.0,,,0.011925750752784408,2,142,0.6899674027295866,0.0007304531432469546,484.76593305479804,COMPLETE
1259,0.34982582926750183,2023-09-04 22:26:58.864364,2023-09-04 22:26:59.895466,0 days 00:00:01.031102,Tanh,,,,23,13,,,,0.041362244227373626,1,75,0.6153853260513736,0.001057646413563828,110.54851046475497,COMPLETE
1260,0.31730058789253235,2023-09-04 22:26:59.896293,2023-09-04 22:27:02.924871,0 days 00:00:03.028578,Tanh,Sigmoid,,,42,20,21.0,,,0.004304512686504514,2,109,0.4893990945170746,2.4955852210394993e-05,106.91258988686658,COMPLETE
1261,0.3277728259563446,2023-09-04 22:27:02.925659,2023-09-04 22:27:07.007589,0 days 00:00:04.081930,ReLU,Tanh,ReLU,,33,21,4.0,5.0,,0.007422908132916943,3,233,0.7370605800481704,6.0018929057751663e-05,116.05063422066824,COMPLETE
1262,0.31289201974868774,2023-09-04 22:27:07.008401,2023-09-04 22:27:08.515924,0 days 00:00:01.507523,Tanh,Sigmoid,,,38,11,11.0,,,0.027454838243550342,2,191,0.7992335149390639,0.00016306638792245594,91.25971552530925,COMPLETE
1263,0.3715769648551941,2023-09-04 22:27:08.516727,2023-09-04 22:27:09.608859,0 days 00:00:01.092132,Tanh,ReLU,Tanh,Sigmoid,45,19,13.0,6.0,12.0,0.008868709524766658,4,308,0.26979579291946526,0.00023758479837464135,147.00378920815209,COMPLETE
1264,0.3142908811569214,2023-09-04 22:27:09.609696,2023-09-04 22:27:11.960511,0 days 00:00:02.350815,Tanh,Tanh,,,12,15,4.0,,,0.03398844816769007,2,225,0.5367732157327383,0.002825493438721545,115.17715341073496,COMPLETE
1265,0.3357596695423126,2023-09-04 22:27:11.961296,2023-09-04 22:27:13.099311,0 days 00:00:01.138015,Leaky,Leaky,,,50,16,5.0,,,0.01919090248845024,2,94,0.7588052304739985,0.0012634862767485124,105.24419702802386,COMPLETE
1266,0.39117175340652466,2023-09-04 22:27:13.100117,2023-09-04 22:27:14.136088,0 days 00:00:01.035971,Tanh,Sigmoid,Leaky,,15,22,14.0,7.0,,0.012942971438825186,3,210,0.16425025837236912,0.0003292825830195424,121.06772104899089,COMPLETE
1267,0.3162280321121216,2023-09-04 22:27:14.136934,2023-09-04 22:27:15.466498,0 days 00:00:01.329564,ReLU,,,,19,21,,,,0.016009506568018705,1,244,0.4273438771437864,1.613394384311798e-05,115.2579574584961,COMPLETE
1268,0.33934035897254944,2023-09-04 22:27:15.467396,2023-09-04 22:27:17.255999,0 days 00:00:01.788603,Tanh,Sigmoid,,,54,20,8.0,,,0.010396178476209699,2,82,0.5152845219872997,4.462023147251595e-05,102.1803002887302,COMPLETE
1269,0.30122682452201843,2023-09-04 22:27:17.256815,2023-09-04 22:27:18.138436,0 days 00:00:00.881621,Tanh,ReLU,,,47,22,7.0,,,0.08171279987902844,2,63,0.7093944658179681,7.667517897905907e-05,95.37432316371373,COMPLETE
1270,0.34432756900787354,2023-09-04 22:27:18.139251,2023-09-04 22:27:25.414316,0 days 00:00:07.275065,Tanh,Tanh,ReLU,ReLU,52,21,6.0,3.0,5.0,0.0021140845642745277,4,174,0.6496868941813257,0.00012230719182688114,106.15131426405632,COMPLETE
1271,1.051524043083191,2023-09-04 22:27:25.415146,2023-09-04 22:27:26.916319,0 days 00:00:01.501173,Sigmoid,Sigmoid,Sigmoid,,41,20,12.0,9.0,,0.0029827846956893816,3,152,0.7654457961019743,0.015985615936301656,99.79349885163484,COMPLETE
1272,0.35786333680152893,2023-09-04 22:27:26.917142,2023-09-04 22:27:27.876782,0 days 00:00:00.959640,Tanh,,,,64,23,,,,0.023317841162626606,1,221,0.5926121397906906,3.666705379738988e-05,128.5793983991756,COMPLETE
1273,0.41646987199783325,2023-09-04 22:27:27.877553,2023-09-04 22:27:28.321998,0 days 00:00:00.444445,ReLU,Tanh,,,21,10,15.0,,,0.005624224256878205,2,254,0.11260496592271024,0.00010202905183993601,319.5141882324219,COMPLETE
1274,0.34549710154533386,2023-09-04 22:27:28.322771,2023-09-04 22:27:29.817648,0 days 00:00:01.494877,Tanh,Sigmoid,,,17,8,5.0,,,0.038961398524863376,2,74,0.33301867904436716,2.0703264304862682e-05,95.77802552117242,COMPLETE
1275,0.46497368812561035,2023-09-04 22:27:29.818445,2023-09-04 22:27:30.916218,0 days 00:00:01.097773,Tanh,ReLU,Leaky,,43,21,17.0,4.0,,0.007965116807228511,3,57,0.24827790084478538,0.044580132387017406,164.27911042330558,COMPLETE
1276,0.40594956278800964,2023-09-04 22:27:30.917033,2023-09-04 22:27:32.044192,0 days 00:00:01.127159,Tanh,Sigmoid,,,10,20,14.0,,,0.05622401049198512,2,92,0.22425044826511212,0.00015133938835941872,112.48790995279948,COMPLETE
1277,0.32912975549697876,2023-09-04 22:27:32.044989,2023-09-04 22:27:33.241573,0 days 00:00:01.196584,Tanh,Tanh,,,25,19,20.0,,,0.028515652767180356,2,238,0.6799918702623828,0.0002706973038323063,366.44826387104234,COMPLETE
1278,0.5874814987182617,2023-09-04 22:27:33.242365,2023-09-04 22:27:36.453810,0 days 00:00:03.211445,ReLU,Leaky,ReLU,,79,15,3.0,2.0,,0.0003898286313506112,3,122,0.7275911484207497,5.251205619102606e-05,124.81916690263591,COMPLETE
1279,0.41400885581970215,2023-09-04 22:27:36.454235,2023-09-04 22:27:36.596812,0 days 00:00:00.142577,Leaky,,,,39,21,,,,0.020999565679911493,1,69,0.17433296734161743,3.065171808607083e-05,115.92448748075046,COMPLETE
1280,0.38296598196029663,2023-09-04 22:27:36.597218,2023-09-04 22:27:38.126464,0 days 00:00:01.529246,Tanh,Sigmoid,Tanh,Tanh,46,22,6.0,5.0,10.0,0.00029829525988818873,4,82,0.7985346754613958,0.00017035511518421914,112.69719007538586,COMPLETE
1281,0.3250528573989868,2023-09-04 22:27:38.126902,2023-09-04 22:27:39.824818,0 days 00:00:01.697916,Tanh,ReLU,,,49,24,13.0,,,0.006329445298006838,2,182,0.7413987102333397,0.003136678698470844,99.28156736299589,COMPLETE
1282,0.3167251944541931,2023-09-04 22:27:39.825226,2023-09-04 22:27:40.249496,0 days 00:00:00.424270,Tanh,Tanh,,,58,20,2.0,,,0.013528516999051237,2,201,0.7042918434549256,2.6909437824403467e-05,108.4922343662807,COMPLETE
1283,0.36441999673843384,2023-09-04 22:27:40.249907,2023-09-04 22:27:40.898619,0 days 00:00:00.648712,Tanh,Sigmoid,,,44,22,19.0,,,0.0035248137635208723,2,102,0.3040799104776471,0.00013133896654129952,124.54309074551452,COMPLETE
1284,0.36070290207862854,2023-09-04 22:27:40.899037,2023-09-04 22:27:44.704741,0 days 00:00:03.805704,ReLU,,,,12,21,,,,0.0003172176793097412,1,164,0.7692424552905676,0.0005575707921188385,100.71206825971603,COMPLETE
1285,0.36768195033073425,2023-09-04 22:27:44.705170,2023-09-04 22:27:45.333020,0 days 00:00:00.627850,Tanh,Sigmoid,Leaky,,55,14,14.0,14.0,,0.010054417319419567,3,138,0.7999665233770431,6.642741980761218e-05,102.92602825164795,COMPLETE
1286,0.3337971568107605,2023-09-04 22:27:45.333458,2023-09-04 22:27:45.780218,0 days 00:00:00.446760,Tanh,Tanh,,,19,20,16.0,,,0.04717371100160644,2,227,0.4092594542788725,0.0006400068864726468,117.716268186216,COMPLETE
1287,0.47461408376693726,2023-09-04 22:27:45.780655,2023-09-04 22:27:46.055965,0 days 00:00:00.275310,Sigmoid,ReLU,,,14,23,15.0,,,0.0049340938566098235,2,217,0.13112720359072882,0.00043387235927349097,139.31736755371094,COMPLETE
1288,0.36884501576423645,2023-09-04 22:27:46.056379,2023-09-04 22:27:46.589230,0 days 00:00:00.532851,Tanh,Sigmoid,ReLU,Sigmoid,28,11,22.0,8.0,8.0,0.030589461729777986,4,110,0.4699164948526138,0.004219208572444538,136.9952254118743,COMPLETE
1289,0.3488154411315918,2023-09-04 22:27:46.589659,2023-09-04 22:27:46.850019,0 days 00:00:00.260360,ReLU,Tanh,,,77,19,6.0,,,0.01718558133860304,2,86,0.28666017816178796,0.00785631833437002,145.17608252992022,COMPLETE
1290,0.393147349357605,2023-09-04 22:27:46.850432,2023-09-04 22:27:47.161397,0 days 00:00:00.310965,Tanh,,,,22,21,,,,0.025842399478831015,1,56,0.19595717370981097,0.006130785473041031,790.398578120213,COMPLETE
1291,0.35221776366233826,2023-09-04 22:27:47.161805,2023-09-04 22:27:47.508666,0 days 00:00:00.346861,Tanh,Sigmoid,Sigmoid,,40,22,7.0,6.0,,0.037699547209674736,3,209,0.3668596676720896,4.093836659754825e-05,207.1862497329712,COMPLETE
1292,0.6935436725616455,2023-09-04 22:27:47.509090,2023-09-04 22:27:47.837536,0 days 00:00:00.328446,Leaky,ReLU,,,50,21,14.0,,,9.194131413863814e-05,2,67,0.21116897380201638,8.794654196503473e-05,100.85122293500758,COMPLETE
1293,0.2855333685874939,2023-09-04 22:27:47.837951,2023-09-04 22:27:48.624349,0 days 00:00:00.786398,Tanh,Leaky,Leaky,Tanh,34,20,24.0,10.0,13.0,0.01169323635758228,4,233,0.7436276728462514,0.000206774113125917,93.47928896817294,COMPLETE
1294,0.33021479845046997,2023-09-04 22:27:48.624774,2023-09-04 22:27:49.196187,0 days 00:00:00.571413,Tanh,Sigmoid,,,47,22,8.0,,,0.008150560756530765,2,156,0.6622186718268749,1.7481314887662007e-05,102.2703738005265,COMPLETE
1295,0.6598097681999207,2023-09-04 22:27:49.196627,2023-09-04 22:27:51.970799,0 days 00:00:02.774172,ReLU,,,,37,21,,,,1.3552490649793215e-05,1,252,0.6986119113213908,0.0021034055758960757,106.09315384758844,COMPLETE
1296,0.31176507472991943,2023-09-04 22:27:51.971209,2023-09-04 22:27:53.985713,0 days 00:00:02.014504,Tanh,Tanh,ReLU,,17,20,5.0,5.0,,0.0014900368836079484,3,75,0.7701499708514511,2.2220659596934035e-05,139.62242481626313,COMPLETE
1297,0.3779957592487335,2023-09-04 22:27:53.986164,2023-09-04 22:27:54.275092,0 days 00:00:00.288928,Tanh,Sigmoid,,,52,14,21.0,,,0.015644142455239134,2,95,0.2353581027339765,0.0008594998762262009,115.53053672096947,COMPLETE
1298,0.3287849724292755,2023-09-04 22:27:54.275509,2023-09-04 22:27:55.249370,0 days 00:00:00.973861,Sigmoid,ReLU,,,42,23,12.0,,,0.00421323067104367,2,242,0.7225507110459084,5.006409980628848e-05,119.45253366323618,COMPLETE
1299,0.28624045848846436,2023-09-04 22:27:55.249785,2023-09-04 22:27:55.796048,0 days 00:00:00.546263,Tanh,Sigmoid,,,83,16,9.0,,,0.006465781006614141,2,195,0.7487105441114198,3.444021172986874e-05,91.36423315320697,COMPLETE
1300,0.5374853610992432,2023-09-04 22:27:55.796504,2023-09-04 22:27:57.735271,0 days 00:00:01.938767,Tanh,Tanh,Tanh,,24,21,15.0,6.0,,2.448552797285433e-05,3,221,0.2503496042090999,0.010372684484126102,107.00673223296981,COMPLETE
1301,0.34764236211776733,2023-09-04 22:27:57.735705,2023-09-04 22:27:58.395738,0 days 00:00:00.660033,ReLU,,,,15,24,,,,0.021060807134847807,1,170,0.7704950945166288,0.00010981631551278382,146.8941619873047,COMPLETE
1302,0.4683852195739746,2023-09-04 22:27:58.396142,2023-09-04 22:27:58.641329,0 days 00:00:00.245187,Tanh,Sigmoid,,,73,15,13.0,,,0.0009243604617099934,2,79,0.13534221565965845,7.263473003633143e-05,111.32140601435795,COMPLETE
1303,0.4897117018699646,2023-09-04 22:27:58.641759,2023-09-04 22:27:58.824417,0 days 00:00:00.182658,Tanh,Tanh,,,45,13,3.0,,,0.0017786007164830434,2,50,0.1020180278001053,0.00158390426900777,126.87641952514649,COMPLETE
1304,0.46743786334991455,2023-09-04 22:27:58.824841,2023-09-04 22:27:59.413816,0 days 00:00:00.588975,Tanh,Sigmoid,Leaky,,20,21,4.0,7.0,,0.009227925247765058,3,116,0.4465063522755177,0.08339017864494758,151.14845907277075,COMPLETE
1305,0.33923012018203735,2023-09-04 22:27:59.414250,2023-09-04 22:28:02.647139,0 days 00:00:03.232889,Leaky,ReLU,ReLU,Leaky,11,22,5.0,4.0,16.0,0.03336140430484819,4,64,0.6868398775825034,5.989596074152193e-05,103.84734522501627,COMPLETE
1306,0.4613780975341797,2023-09-04 22:28:02.647608,2023-09-04 22:28:03.649335,0 days 00:00:01.001727,Tanh,Sigmoid,,,48,20,6.0,,,0.0025380960412159813,2,103,0.6225255194691109,0.022918490716943088,106.0256464585014,COMPLETE
1307,0.3476240336894989,2023-09-04 22:28:03.649778,2023-09-04 22:28:04.162350,0 days 00:00:00.512572,ReLU,Leaky,,,40,19,7.0,,,0.02507252179210044,2,150,0.7238923747058936,0.0003436456396212151,90.92557918664181,COMPLETE
1308,0.360147088766098,2023-09-04 22:28:04.162767,2023-09-04 22:28:04.802049,0 days 00:00:00.639282,Tanh,,,,56,18,,,,0.012963167285711003,1,88,0.5421010396931761,0.009376633700277907,140.50252784382212,COMPLETE
1309,0.34221333265304565,2023-09-04 22:28:04.802469,2023-09-04 22:28:06.988484,0 days 00:00:02.186015,Tanh,Tanh,,,35,22,18.0,,,0.0005270383316537414,2,212,0.49021526862205106,0.00018477357701407682,423.76203213097915,COMPLETE
1310,0.3309897780418396,2023-09-04 22:28:06.988910,2023-09-04 22:28:07.569517,0 days 00:00:00.580607,Tanh,Sigmoid,Sigmoid,,13,21,16.0,9.0,,0.0434606612004801,3,228,0.2903368159017168,2.693337977735361e-05,116.4160888671875,COMPLETE
1311,0.292277067899704,2023-09-04 22:28:07.569977,2023-09-04 22:28:08.152944,0 days 00:00:00.582967,Tanh,ReLU,Leaky,Tanh,60,6,13.0,15.0,7.0,0.010781719860781224,4,74,0.7521002728366732,0.00013413635170565847,96.70693729945592,COMPLETE
1312,0.3945828676223755,2023-09-04 22:28:08.153375,2023-09-04 22:28:10.122204,0 days 00:00:01.968829,Sigmoid,Tanh,,,38,17,17.0,,,0.0007465498213550265,2,131,0.7720852150335216,0.00127608193973459,119.25373188047918,COMPLETE
1313,0.3125646114349365,2023-09-04 22:28:10.122615,2023-09-04 22:28:11.328368,0 days 00:00:01.205753,ReLU,Sigmoid,,,18,12,3.0,,,0.018374477653460685,2,241,0.6676437646487194,1.533970151405702e-05,100.44112411499023,COMPLETE
1314,0.287463903427124,2023-09-04 22:28:11.328769,2023-09-04 22:28:11.837632,0 days 00:00:00.508863,Tanh,,,,43,20,,,,0.014793818316685494,1,50,0.7986618715414506,4.08116673236976e-05,96.12257041931153,COMPLETE
1315,0.29324209690093994,2023-09-04 22:28:11.838062,2023-09-04 22:28:13.086306,0 days 00:00:01.248244,Tanh,Sigmoid,Tanh,,32,16,10.0,1.0,,0.007490703266995479,3,180,0.7141908721140212,0.000240176353194144,102.01040719839243,COMPLETE
1316,0.3388121426105499,2023-09-04 22:28:13.086736,2023-09-04 22:28:13.567567,0 days 00:00:00.480831,Tanh,Tanh,,,52,21,4.0,,,0.02861934660615765,2,190,0.43955600003942585,0.005186155303206336,121.43718525514764,COMPLETE
1317,0.3286302983760834,2023-09-04 22:28:13.567990,2023-09-04 22:28:14.839858,0 days 00:00:01.271868,Tanh,ReLU,,,22,22,14.0,,,0.002031464787103731,2,62,0.7417686532287495,2.0136124627453118e-05,81.32690734863282,COMPLETE
1318,0.32958850264549255,2023-09-04 22:28:14.840306,2023-09-04 22:28:15.889590,0 days 00:00:01.049284,ReLU,Sigmoid,,,45,23,19.0,,,0.00534793472233513,2,96,0.69894225008549,9.532914575963679e-05,230.57153011503675,COMPLETE
1319,0.31894275546073914,2023-09-04 22:28:15.890007,2023-09-04 22:28:20.022994,0 days 00:00:04.132987,Leaky,Leaky,ReLU,ReLU,10,20,8.0,11.0,17.0,0.00020145027552502385,4,83,0.5810635673128353,0.0001563597877911147,122.18808277543769,COMPLETE
1320,0.40924903750419617,2023-09-04 22:28:20.023434,2023-09-04 22:28:20.311726,0 days 00:00:00.288292,Tanh,Tanh,,,51,21,15.0,,,0.003915808715475716,2,204,0.20864996859545362,0.0002876656695465798,112.33160858154297,COMPLETE
1321,0.2563057243824005,2023-09-04 22:28:20.312140,2023-09-04 22:28:20.968371,0 days 00:00:00.656231,Tanh,Sigmoid,Leaky,,54,22,6.0,3.0,,0.05564065170383318,3,223,0.7996115536266666,3.190776196661413e-05,86.52375998148104,COMPLETE
1322,0.33155184984207153,2023-09-04 22:28:20.968808,2023-09-04 22:28:21.409273,0 days 00:00:00.440465,Tanh,Sigmoid,Leaky,,50,22,6.0,13.0,,0.07013809446361725,3,221,0.7972409804717682,2.744890484602904e-05,88.56670792897542,COMPLETE
1323,0.4007366895675659,2023-09-04 22:28:21.409709,2023-09-04 22:28:21.642288,0 days 00:00:00.232579,Tanh,Sigmoid,Leaky,,53,22,5.0,3.0,,0.059302962409156945,3,230,0.26510074727575145,3.0237947189631913e-05,335.31317247663225,COMPLETE
1324,0.4187934696674347,2023-09-04 22:28:21.642739,2023-09-04 22:28:21.866706,0 days 00:00:00.223967,ReLU,Sigmoid,Leaky,,55,22,7.0,7.0,,0.04410789752173278,3,215,0.14211611883721093,2.147783995424858e-05,114.89244333902995,COMPLETE
1325,0.31998780369758606,2023-09-04 22:28:21.867138,2023-09-04 22:28:22.538486,0 days 00:00:00.671348,Tanh,Sigmoid,Leaky,,54,22,12.0,5.0,,0.07708640593351185,3,226,0.7781993323830937,2.4217360449772208e-05,98.3933717636835,COMPLETE
1326,0.3589369058609009,2023-09-04 22:28:22.539331,2023-09-04 22:28:24.353863,0 days 00:00:01.814532,Sigmoid,Sigmoid,Leaky,,56,22,23.0,4.0,,0.059633547110789706,3,235,0.768810698184517,3.333604448327785e-05,102.24003046209162,COMPLETE
1327,0.31950029730796814,2023-09-04 22:28:24.354669,2023-09-04 22:28:26.262472,0 days 00:00:01.907803,Tanh,Sigmoid,Leaky,,54,21,11.0,2.0,,0.044393105928896115,3,213,0.7972863568462353,3.3536607578879385e-05,88.32227788997602,COMPLETE
1328,0.404924601316452,2023-09-04 22:28:26.262899,2023-09-04 22:28:26.454803,0 days 00:00:00.191904,Tanh,Sigmoid,Leaky,,52,21,6.0,16.0,,0.048826078182639135,3,218,0.1739269092402085,2.4597586991380373e-05,120.80046985767505,COMPLETE
1329,0.305085688829422,2023-09-04 22:28:26.455230,2023-09-04 22:28:27.079225,0 days 00:00:00.623995,Tanh,Sigmoid,Leaky,,56,22,14.0,23.0,,0.05480222139649504,3,227,0.7466288221625799,1.808224241556049e-05,92.41144852411179,COMPLETE
1330,0.323308527469635,2023-09-04 22:28:27.079651,2023-09-04 22:28:27.554494,0 days 00:00:00.474843,ReLU,Sigmoid,Leaky,,48,22,16.0,8.0,,0.05425246539146577,3,248,0.5183829152811243,0.00019870800507839885,99.51763192201273,COMPLETE
1331,0.4179483950138092,2023-09-04 22:28:27.554938,2023-09-04 22:28:27.716658,0 days 00:00:00.161720,Tanh,Sigmoid,Leaky,,53,21,13.0,10.0,,0.06776720191816939,3,236,0.1165731943078346,0.00012386049139881695,200.14411530671296,COMPLETE
1332,1.044664740562439,2023-09-04 22:28:27.717101,2023-09-04 22:28:27.903127,0 days 00:00:00.186026,Tanh,Sigmoid,Leaky,,54,21,21.0,6.0,,0.03616962520617595,3,221,0.26876331277650073,0.06266947814220024,102.03922737969293,COMPLETE
1333,0.38215869665145874,2023-09-04 22:28:27.903553,2023-09-04 22:28:28.072702,0 days 00:00:00.169149,Leaky,Sigmoid,Leaky,,50,22,15.0,5.0,,0.03762209642338425,3,214,0.18677742710672632,0.00040448936633256336,264.4580391331723,COMPLETE
1334,0.3724602162837982,2023-09-04 22:28:28.073129,2023-09-04 22:28:28.317126,0 days 00:00:00.243997,Tanh,Sigmoid,Leaky,,51,9,6.0,17.0,,0.0808391256316189,3,203,0.38421273631244324,0.004098836280691656,230.80369495210192,COMPLETE
1335,0.44604620337486267,2023-09-04 22:28:28.317548,2023-09-04 22:28:28.843990,0 days 00:00:00.526442,Tanh,Sigmoid,Leaky,,41,20,5.0,3.0,,0.024027691448762406,3,233,0.7699341460181974,0.028273058419146006,120.80944598162615,COMPLETE
1336,0.36450934410095215,2023-09-04 22:28:28.844422,2023-09-04 22:28:29.427375,0 days 00:00:00.582953,ReLU,Sigmoid,Leaky,,14,21,20.0,7.0,,0.04943729139291471,3,242,0.3561260694944811,0.0006724761767138252,116.41251901479868,COMPLETE
1337,0.33346760272979736,2023-09-04 22:28:29.427805,2023-09-04 22:28:34.592532,0 days 00:00:05.164727,Tanh,Sigmoid,Leaky,,16,21,7.0,4.0,,0.0007479676131521614,3,209,0.6413632186739247,0.0033887656865456274,113.58592044348005,COMPLETE
1338,0.4322858452796936,2023-09-04 22:28:34.592959,2023-09-04 22:28:35.129224,0 days 00:00:00.536265,Tanh,Sigmoid,Leaky,,20,19,14.0,8.0,,0.0013495296476887884,3,221,0.129895971102552,1.5366054895236775e-05,263.1115571022034,COMPLETE
1339,0.3660007119178772,2023-09-04 22:28:35.129651,2023-09-04 22:28:35.892609,0 days 00:00:00.762958,Sigmoid,Sigmoid,Leaky,,26,22,9.0,12.0,,0.09594816420028056,3,225,0.7254238649663279,2.878228407146885e-05,91.53773498535156,COMPLETE
1340,0.33714839816093445,2023-09-04 22:28:35.893046,2023-09-04 22:28:36.464693,0 days 00:00:00.571647,Tanh,Sigmoid,Leaky,,47,21,4.0,5.0,,0.0318163894160201,3,255,0.7555473110099667,0.001844990706369699,100.8818406497731,COMPLETE
