number,value,datetime_start,datetime_complete,duration,params_activation1,params_activation2,params_activation3,params_activation4,params_batch_size,params_fl1,params_fl2,params_fl3,params_fl4,params_learning_rate,params_n_layers,params_num_epochs,params_train_size,params_weight_decay,user_attrs_mre,state
1161,0.3465266525745392,2023-09-04 22:26:59.393376,2023-09-04 22:26:59.812123,0 days 00:00:00.418747,ReLU,Leaky,Sigmoid,Leaky,83,18,19.0,14.0,5.0,0.005314819821911802,4,242,0.6565248267634791,0.00042541916991832785,183.0233302116394,COMPLETE
1162,0.3960369825363159,2023-09-04 22:26:59.812578,2023-09-04 22:27:00.201970,0 days 00:00:00.389392,Leaky,Leaky,ReLU,Leaky,80,19,18.0,13.0,6.0,0.0068658027983080246,4,256,0.2944284998907462,5.3772951823306146e-05,249.25763252133228,COMPLETE
1163,0.6590931415557861,2023-09-04 22:27:00.202430,2023-09-04 22:27:03.167836,0 days 00:00:02.965406,Tanh,Leaky,Sigmoid,Leaky,30,18,20.0,15.0,5.0,3.942068779312596e-05,4,240,0.3656884765260803,0.0002915469698363492,1545.9206143697104,COMPLETE
1164,0.6142821311950684,2023-09-04 22:27:03.168284,2023-09-04 22:27:03.447691,0 days 00:00:00.279407,Sigmoid,Leaky,Sigmoid,Leaky,82,3,20.0,12.0,6.0,0.011756808745609885,4,249,0.7388236427147727,6.469503987378162e-05,147.74029874801636,COMPLETE
1165,0.9422785043716431,2023-09-04 22:27:03.448153,2023-09-04 22:27:08.757530,0 days 00:00:05.309377,Tanh,Leaky,Sigmoid,Leaky,37,19,19.0,15.0,4.0,1.2757052082482363e-05,4,278,0.7084863265380337,0.07021145801206051,126.06916674607092,COMPLETE
1166,0.2335810512304306,2023-09-04 22:27:08.757961,2023-09-04 22:27:09.492801,0 days 00:00:00.734840,Leaky,Leaky,Sigmoid,Leaky,84,18,20.0,22.0,5.0,0.009200750245336693,4,266,0.6895979100092244,7.933300192025438e-05,598.7085120677948,COMPLETE
1167,1.115398645401001,2023-09-04 22:27:09.493237,2023-09-04 22:27:10.160766,0 days 00:00:00.667529,Tanh,Leaky,ReLU,Leaky,90,17,20.0,24.0,6.0,2.0643345628001173e-05,4,231,0.13112605640870928,0.00011394170120991497,278.4290835558078,COMPLETE
1168,0.45201173424720764,2023-09-04 22:27:10.161195,2023-09-04 22:27:11.845846,0 days 00:00:01.684651,Tanh,Leaky,Sigmoid,Leaky,68,19,19.0,23.0,22.0,0.00034920204670618786,4,257,0.4846581070336921,0.00022289223781686492,502.86959753189495,COMPLETE
1169,0.31374260783195496,2023-09-04 22:27:11.846313,2023-09-04 22:27:12.580717,0 days 00:00:00.734404,ReLU,Leaky,Leaky,Leaky,40,18,21.0,15.0,5.0,0.01281273713912374,4,240,0.7472517825497393,3.261578752625994e-05,130.00466132164001,COMPLETE
1170,0.3641262650489807,2023-09-04 22:27:12.581672,2023-09-04 22:27:13.109921,0 days 00:00:00.528249,Sigmoid,Leaky,Sigmoid,Leaky,86,18,20.0,24.0,3.0,0.008535268919815181,4,247,0.7713952925923863,0.00014707163536420895,202.39446149553572,COMPLETE
1171,0.3510463535785675,2023-09-04 22:27:13.110365,2023-09-04 22:27:13.715507,0 days 00:00:00.605142,Leaky,Leaky,Sigmoid,Sigmoid,79,19,19.0,23.0,6.0,0.01077180416924356,4,88,0.7251498602930564,0.00018543771501270664,234.41239521115324,COMPLETE
1172,0.3625524640083313,2023-09-04 22:27:13.716006,2023-09-04 22:27:14.370536,0 days 00:00:00.654530,Tanh,Leaky,ReLU,Tanh,28,17,21.0,14.0,4.0,0.013347848384699827,4,226,0.6773735743851562,1.7553110440767947e-05,123.82295361687156,COMPLETE
1173,0.5279114842414856,2023-09-04 22:27:14.370994,2023-09-04 22:27:14.719918,0 days 00:00:00.348924,Tanh,Leaky,Sigmoid,Leaky,33,20,20.0,15.0,7.0,0.014636530256005417,4,263,0.10158662598396469,0.00023884994567664923,226.57118606567383,COMPLETE
1174,0.29629477858543396,2023-09-04 22:27:14.720363,2023-09-04 22:27:15.730660,0 days 00:00:01.010297,Leaky,Leaky,Sigmoid,Sigmoid,36,19,19.0,14.0,19.0,0.006318535858023269,4,469,0.7994815078941415,9.230000510243457e-05,117.69460105895996,COMPLETE
1175,0.22116613388061523,2023-09-04 22:27:15.731125,2023-09-04 22:27:16.285036,0 days 00:00:00.553911,ReLU,Leaky,Sigmoid,Leaky,87,22,18.0,23.0,5.0,0.011547271322105883,4,284,0.7487235153694046,4.421657297874268e-05,156.58660790859125,COMPLETE
1176,1.0635367631912231,2023-09-04 22:27:16.285480,2023-09-04 22:27:17.050613,0 days 00:00:00.765133,ReLU,Leaky,Sigmoid,Leaky,86,22,17.0,23.0,5.0,1.839607880299132e-05,4,272,0.12979645992300057,5.299357351512529e-05,189.86602160509895,COMPLETE
1177,1.4518392086029053,2023-09-04 22:27:17.051062,2023-09-04 22:27:18.192823,0 days 00:00:01.141761,ReLU,Leaky,ReLU,Leaky,90,23,17.0,22.0,5.0,3.6023219469800695e-05,4,284,0.22038074039844494,3.814716664413692e-05,103.75286875980001,COMPLETE
1178,0.5644990801811218,2023-09-04 22:27:18.193309,2023-09-04 22:27:18.504329,0 days 00:00:00.311020,ReLU,Leaky,Sigmoid,Leaky,89,22,18.0,23.0,4.0,0.008602825898994526,4,304,0.704066279681659,4.287959281741492e-05,152.0628055996365,COMPLETE
1179,1.0383962392807007,2023-09-04 22:27:18.504764,2023-09-04 22:27:18.705392,0 days 00:00:00.200628,ReLU,Leaky,Sigmoid,Leaky,88,23,18.0,23.0,5.0,0.01102141161437404,4,293,0.24964498535299942,0.0398841748333779,101.45609029134114,COMPLETE
1180,0.4671752452850342,2023-09-04 22:27:18.705895,2023-09-04 22:27:19.001527,0 days 00:00:00.295632,ReLU,Leaky,Sigmoid,Leaky,92,22,18.0,22.0,5.0,0.010210182261603147,4,283,0.14953027043702086,6.025170504087914e-05,94.75652245914235,COMPLETE
1181,0.3328936994075775,2023-09-04 22:27:19.002052,2023-09-04 22:27:20.186585,0 days 00:00:01.184533,ReLU,Leaky,Sigmoid,Leaky,88,22,16.0,23.0,4.0,0.0073103607650936405,4,289,0.649507251245664,4.610364241065713e-05,103.80041788138595,COMPLETE
1182,0.8844225406646729,2023-09-04 22:27:20.187047,2023-09-04 22:27:21.473085,0 days 00:00:01.286038,ReLU,Leaky,ReLU,Leaky,90,23,18.0,22.0,4.0,2.760825950576946e-05,4,283,0.25811542142508626,0.00786241394624748,118.84562793637333,COMPLETE
1183,0.3610028922557831,2023-09-04 22:27:21.473547,2023-09-04 22:27:22.332965,0 days 00:00:00.859418,ReLU,Leaky,Sigmoid,Leaky,88,22,19.0,24.0,23.0,0.012871796632796416,4,276,0.7297179386286945,6.89332069309729e-05,86.77109785640941,COMPLETE
1184,0.5823701620101929,2023-09-04 22:27:22.333411,2023-09-04 22:27:25.184558,0 days 00:00:02.851147,ReLU,Leaky,Sigmoid,Leaky,87,22,17.0,23.0,6.0,5.173089601171918e-05,4,276,0.6845675211312962,5.5909435537648904e-05,195.88869796974072,COMPLETE
1185,0.39927417039871216,2023-09-04 22:27:25.185010,2023-09-04 22:27:25.997290,0 days 00:00:00.812280,ReLU,Leaky,Sigmoid,Leaky,87,22,19.0,24.0,5.0,0.004686091486115033,4,285,0.7438801981954815,0.0022749935912094424,126.26560803313754,COMPLETE
1186,0.29844430088996887,2023-09-04 22:27:25.997782,2023-09-04 22:27:26.469194,0 days 00:00:00.471412,ReLU,Leaky,ReLU,Leaky,90,21,18.0,23.0,5.0,0.008727141894339633,4,272,0.7188515487037892,2.2757252980884955e-05,153.53945880466037,COMPLETE
1187,0.7272245287895203,2023-09-04 22:27:26.469638,2023-09-04 22:27:28.520739,0 days 00:00:02.051101,ReLU,Leaky,Sigmoid,Leaky,87,22,18.0,22.0,6.0,0.0005114428897062887,4,289,0.3201580690145835,7.972659671389539e-05,312.6193374053005,COMPLETE
1188,0.95169997215271,2023-09-04 22:27:28.521179,2023-09-04 22:27:31.853663,0 days 00:00:03.332484,ReLU,Leaky,Sigmoid,Leaky,86,21,18.0,23.0,4.0,1.4454147551318825e-05,4,299,0.7452258776886193,0.0037258126821241985,191.1212458530796,COMPLETE
1189,0.6736363768577576,2023-09-04 22:27:31.854097,2023-09-04 22:27:32.472717,0 days 00:00:00.618620,ReLU,Leaky,Sigmoid,Leaky,89,23,19.0,21.0,6.0,0.0002545370126376643,4,265,0.11236956423606943,1.1879853187686104e-05,154.58767510180203,COMPLETE
1190,0.38039445877075195,2023-09-04 22:27:32.473151,2023-09-04 22:27:32.723843,0 days 00:00:00.250692,ReLU,Leaky,Sigmoid,Leaky,85,22,17.0,24.0,5.0,0.011076098592275199,4,257,0.26709445402021553,3.339945861271053e-05,107.23187321254186,COMPLETE
1191,0.3669956922531128,2023-09-04 22:27:32.724291,2023-09-04 22:27:33.276902,0 days 00:00:00.552611,ReLU,Leaky,ReLU,Leaky,85,21,19.0,23.0,5.0,0.0016405099094023603,4,219,0.2825006391226229,6.491078522949621e-05,152.12187233356514,COMPLETE
1192,0.5646470785140991,2023-09-04 22:27:33.277375,2023-09-04 22:27:33.468416,0 days 00:00:00.191041,ReLU,Leaky,Sigmoid,Leaky,87,21,18.0,11.0,6.0,0.016165683606765117,4,232,0.10021808019827999,4.5800615641933945e-05,1357.8550127202814,COMPLETE
1193,0.4007941484451294,2023-09-04 22:27:33.468885,2023-09-04 22:27:34.929573,0 days 00:00:01.460688,ReLU,Leaky,Leaky,Leaky,43,23,20.0,24.0,5.0,0.0006862391851885608,4,251,0.6929825805755224,2.7132819838469665e-05,127.51528549194336,COMPLETE
1194,0.24074216187000275,2023-09-04 22:27:34.930018,2023-09-04 22:27:35.821352,0 days 00:00:00.891334,ReLU,Leaky,Sigmoid,Leaky,92,22,19.0,22.0,17.0,0.013527733904495298,4,296,0.7692846923136619,9.507126995080779e-05,3385.3451538085938,COMPLETE
1195,0.9398855566978455,2023-09-04 22:27:35.821817,2023-09-04 22:27:36.404277,0 days 00:00:00.582460,ReLU,Leaky,Sigmoid,ReLU,89,16,20.0,24.0,4.0,0.0005820301202044086,4,242,0.42949827218599523,0.06627943115777378,99.20296760454569,COMPLETE
1196,0.7122783064842224,2023-09-04 22:27:36.404712,2023-09-04 22:27:38.642689,0 days 00:00:02.237977,Sigmoid,Leaky,ReLU,Leaky,32,14,18.0,23.0,7.0,3.8172952518031816e-05,4,269,0.2412411112421618,0.00011860375386619889,142.99184170974675,COMPLETE
1197,0.31030476093292236,2023-09-04 22:27:38.643161,2023-09-04 22:27:39.105002,0 days 00:00:00.461841,Tanh,Leaky,Sigmoid,Leaky,85,21,19.0,23.0,6.0,0.011368666542875142,4,204,0.7176813514480748,7.568400336218587e-05,113.28620610092625,COMPLETE
1198,0.2715969979763031,2023-09-04 22:27:39.105459,2023-09-04 22:27:39.663153,0 days 00:00:00.557694,Tanh,Leaky,Sigmoid,Leaky,84,21,20.0,24.0,2.0,0.017355048885547297,4,234,0.4940463318538755,5.607184741337376e-05,120.01206823495718,COMPLETE
1199,0.2622143626213074,2023-09-04 22:27:39.664013,2023-09-04 22:27:40.295558,0 days 00:00:00.631545,ReLU,Leaky,Sigmoid,Leaky,87,22,20.0,22.0,19.0,0.05285600928408123,4,282,0.15140409733645518,0.0016287209392961664,91.92905881327968,COMPLETE
1200,0.6340252161026001,2023-09-04 22:27:40.296393,2023-09-04 22:27:41.776109,0 days 00:00:01.479716,Tanh,Leaky,ReLU,Leaky,91,22,19.0,23.0,5.0,0.0001708929570304923,4,215,0.17766079393164755,0.00015327780414019543,139.52931731468024,COMPLETE
1201,0.273971825838089,2023-09-04 22:27:41.776546,2023-09-04 22:27:42.588904,0 days 00:00:00.812358,Sigmoid,Leaky,Sigmoid,Tanh,34,21,17.0,24.0,18.0,0.03142621709215916,4,257,0.6694784842987928,0.00010595239696954388,151.75692897372775,COMPLETE
1202,0.3004976809024811,2023-09-04 22:27:42.589366,2023-09-04 22:27:43.436653,0 days 00:00:00.847287,Tanh,Leaky,Sigmoid,Leaky,84,17,18.0,22.0,6.0,0.009437965317435359,4,246,0.7579747467858902,4.1585869800321824e-05,219.45744820797083,COMPLETE
1203,0.37494122982025146,2023-09-04 22:27:43.437090,2023-09-04 22:27:44.133766,0 days 00:00:00.696676,Tanh,Leaky,Sigmoid,Leaky,86,21,20.0,24.0,20.0,0.006007437150727225,4,422,0.2318860621215331,0.0009663203576281676,321.18827203603894,COMPLETE
1204,0.37546220421791077,2023-09-04 22:27:44.134586,2023-09-04 22:27:45.490022,0 days 00:00:01.355436,ReLU,Leaky,Sigmoid,ReLU,36,17,20.0,23.0,3.0,0.014656396382166816,4,226,0.6457806137144454,0.00013118780157090172,157.7535969870431,COMPLETE
1205,1.007972002029419,2023-09-04 22:27:45.490461,2023-09-04 22:27:45.712543,0 days 00:00:00.222082,Sigmoid,Leaky,ReLU,Leaky,88,23,19.0,23.0,16.0,0.06736553233056661,4,267,0.7143715948893359,0.054316186698001714,99.80775659734553,COMPLETE
1206,0.6163843274116516,2023-09-04 22:27:45.712985,2023-09-04 22:27:46.781160,0 days 00:00:01.068175,Tanh,Leaky,Sigmoid,Leaky,83,15,20.0,22.0,1.0,0.001349418435589022,4,239,0.3346573567222503,1.9623678884225232e-05,134.99220606350005,COMPLETE
1207,1.058722972869873,2023-09-04 22:27:46.781604,2023-09-04 22:27:47.281809,0 days 00:00:00.500205,Tanh,Leaky,Sigmoid,Leaky,29,16,20.0,12.0,17.0,0.00402734112788148,4,292,0.7708084361670987,0.040903731081589824,99.61845092773437,COMPLETE
1208,0.3580660820007324,2023-09-04 22:27:47.282245,2023-09-04 22:27:47.743792,0 days 00:00:00.461547,ReLU,Leaky,Sigmoid,Leaky,86,21,19.0,21.0,5.0,0.012367540739967417,4,278,0.5999348864113556,1.0011460739281606e-05,90.91877403259278,COMPLETE
1209,0.33808624744415283,2023-09-04 22:27:47.744243,2023-09-04 22:27:48.741382,0 days 00:00:00.997139,Tanh,Leaky,ReLU,Leaky,40,20,21.0,24.0,4.0,0.01690411620347433,4,252,0.7390161443297857,1.529398759786298e-05,101.92576306931515,COMPLETE
1210,0.5360642671585083,2023-09-04 22:27:48.741824,2023-09-04 22:27:48.936495,0 days 00:00:00.194671,Sigmoid,Leaky,Sigmoid,Tanh,83,22,20.0,23.0,19.0,0.007534574390664609,4,231,0.15910589927539315,8.161641463698355e-05,123.49763895670573,COMPLETE
1211,0.45437076687812805,2023-09-04 22:27:48.936931,2023-09-04 22:27:49.282206,0 days 00:00:00.345275,Tanh,Leaky,Sigmoid,Leaky,59,21,19.0,23.0,18.0,0.0215537073274627,4,212,0.3539986241702166,6.585976639425872e-05,166.5820215398615,COMPLETE
1212,0.8241397738456726,2023-09-04 22:27:49.282669,2023-09-04 22:27:49.962145,0 days 00:00:00.679476,Tanh,Leaky,Sigmoid,Leaky,93,18,20.0,24.0,6.0,7.321779076117209e-05,4,188,0.19375809165591823,4.802483500225231e-05,125.20046550669569,COMPLETE
1213,1.1164520978927612,2023-09-04 22:27:49.962598,2023-09-04 22:27:50.101742,0 days 00:00:00.139144,ReLU,Leaky,Sigmoid,Leaky,85,11,18.0,22.0,7.0,0.028177014016311813,4,258,0.15718692554790523,0.06228853355734804,100.50039990743001,COMPLETE
1214,0.6912489533424377,2023-09-04 22:27:50.102161,2023-09-04 22:27:50.349096,0 days 00:00:00.246935,Sigmoid,Leaky,ReLU,ReLU,31,20,21.0,16.0,5.0,0.005289389450848896,4,219,0.11108957198078698,0.0012750455455515204,197.31354141235352,COMPLETE
1215,0.608428418636322,2023-09-04 22:27:50.349527,2023-09-04 22:27:50.911388,0 days 00:00:00.561861,Tanh,,,,89,22,,,,0.00972434021086814,1,241,0.6960182411674455,0.016583404349170796,174.91015625,COMPLETE
1216,0.4284757971763611,2023-09-04 22:27:50.911804,2023-09-04 22:27:51.120901,0 days 00:00:00.209097,Tanh,Leaky,Sigmoid,Leaky,84,20,19.0,23.0,18.0,0.012763970677935521,4,305,0.16724128777137526,1.284085868864486e-05,217.9083249773298,COMPLETE
1217,0.5354809761047363,2023-09-04 22:27:51.121344,2023-09-04 22:27:51.336152,0 days 00:00:00.214808,ReLU,Leaky,Leaky,Leaky,82,17,20.0,24.0,4.0,0.03655556621311049,4,264,0.14443357521368327,0.01847881031154172,110.90965983072917,COMPLETE
1218,0.9786179661750793,2023-09-04 22:27:51.336585,2023-09-04 22:27:54.636718,0 days 00:00:03.300133,Tanh,Leaky,Sigmoid,Leaky,87,18,20.0,16.0,6.0,1.4907306872665596e-05,4,248,0.5113952020425018,9.843486256248483e-05,119.35073966364706,COMPLETE
1219,0.8782964944839478,2023-09-04 22:27:54.637598,2023-09-04 22:27:57.851135,0 days 00:00:03.213537,Sigmoid,Leaky,Sigmoid,Leaky,84,23,21.0,22.0,20.0,2.6473604565798084e-05,4,195,0.621723414813915,0.00017084001975725202,104.91927388509114,COMPLETE
1220,0.4259205758571625,2023-09-04 22:27:57.851572,2023-09-04 22:28:02.707425,0 days 00:00:04.855853,Tanh,Leaky,ReLU,Tanh,38,21,21.0,16.0,17.0,0.00012727862709698625,4,272,0.5600474478466618,0.00012294159504345494,129.65007995094,COMPLETE
1221,0.32072266936302185,2023-09-04 22:28:02.707877,2023-09-04 22:28:03.265211,0 days 00:00:00.557334,Tanh,Leaky,Sigmoid,Leaky,86,20,19.0,23.0,14.0,0.016573051017923876,4,234,0.7999712243883204,3.7860942128388406e-05,103.51663344945663,COMPLETE
1222,1.0018119812011719,2023-09-04 22:28:03.265643,2023-09-04 22:28:03.540201,0 days 00:00:00.274558,ReLU,Leaky,Sigmoid,Leaky,35,15,20.0,13.0,7.0,0.019165173113092616,4,224,0.3905575159630036,0.002488064656013234,102.88104146321615,COMPLETE
1223,0.8202439546585083,2023-09-04 22:28:03.540642,2023-09-04 22:28:04.948458,0 days 00:00:01.407816,Sigmoid,Leaky,Sigmoid,Leaky,89,18,19.0,11.0,3.0,0.0003099056817181795,4,208,0.753369502512867,0.08336860304883977,113.25427003890749,COMPLETE
1224,0.48803645372390747,2023-09-04 22:28:04.948895,2023-09-04 22:28:06.302076,0 days 00:00:01.353181,Tanh,Leaky,ReLU,ReLU,82,11,18.0,24.0,19.0,0.0009576166054592622,4,293,0.3922286946340395,0.03589802736437531,180.49428057314745,COMPLETE
1225,0.5407353639602661,2023-09-04 22:28:06.302510,2023-09-04 22:28:06.827077,0 days 00:00:00.524567,Tanh,Leaky,Sigmoid,Leaky,84,22,21.0,24.0,5.0,0.0857809147588688,4,239,0.7205859538420684,6.09668024368518e-05,202.75304999718298,COMPLETE
1226,0.3944668769836426,2023-09-04 22:28:06.827505,2023-09-04 22:28:07.752716,0 days 00:00:00.925211,Tanh,Leaky,Sigmoid,Leaky,25,21,20.0,23.0,18.0,0.024712193423085508,4,254,0.6714455396896876,0.0018138821379475418,145.87154504024622,COMPLETE
1227,0.3127317726612091,2023-09-04 22:28:07.753148,2023-09-04 22:28:08.457659,0 days 00:00:00.704511,ReLU,Leaky,Sigmoid,Leaky,33,20,20.0,16.0,2.0,0.014451677269892363,4,284,0.5316096202415224,0.0001404239126330389,393.1240635922081,COMPLETE
1228,0.3878893256187439,2023-09-04 22:28:08.458109,2023-09-04 22:28:09.254593,0 days 00:00:00.796484,Sigmoid,Leaky,Sigmoid,Leaky,87,18,21.0,16.0,6.0,0.04501117187995339,4,228,0.7609183242926978,0.0008627678114558544,150.6523119211197,COMPLETE
1229,0.2935965955257416,2023-09-04 22:28:09.255037,2023-09-04 22:28:09.798254,0 days 00:00:00.543217,Tanh,Leaky,ReLU,Tanh,91,17,19.0,15.0,5.0,0.011060398149448045,4,248,0.7684529754271272,1.637866336109608e-05,109.6442136492048,COMPLETE
1230,0.802865207195282,2023-09-04 22:28:09.798702,2023-09-04 22:28:09.950164,0 days 00:00:00.151462,Tanh,Leaky,Sigmoid,Leaky,81,21,9.0,23.0,4.0,0.008426135756291071,4,263,0.18552607855032338,0.006851302462477856,99.97594887869698,COMPLETE
1231,0.5285414457321167,2023-09-04 22:28:09.950742,2023-09-04 22:28:12.313396,0 days 00:00:02.362654,ReLU,Leaky,Sigmoid,Leaky,85,12,20.0,22.0,16.0,8.88147098762004e-05,4,218,0.7348252644700238,2.9274860494378563e-05,132.4656465512897,COMPLETE
1232,0.3797664940357208,2023-09-04 22:28:12.313840,2023-09-04 22:28:13.311720,0 days 00:00:00.997880,Sigmoid,Leaky,Sigmoid,Leaky,27,22,18.0,21.0,17.0,0.02101243129138412,4,238,0.6903881980188559,8.163500839308325e-05,136.45662247507195,COMPLETE
1233,0.6193459033966064,2023-09-04 22:28:13.312246,2023-09-04 22:28:13.829252,0 days 00:00:00.517006,Tanh,Leaky,ReLU,ReLU,39,20,21.0,24.0,6.0,0.013489303138421647,4,247,0.2705338190921771,0.0001708202489094949,323.8396944912997,COMPLETE
1234,0.5505514144897461,2023-09-04 22:28:13.829777,2023-09-04 22:28:14.050011,0 days 00:00:00.220234,Tanh,Leaky,Sigmoid,Leaky,83,19,19.0,15.0,19.0,0.01648035465611032,4,231,0.14055122335187675,2.5430233470742843e-05,401.5656134422789,COMPLETE
1235,0.6021514534950256,2023-09-04 22:28:14.050526,2023-09-04 22:28:17.166059,0 days 00:00:03.115533,Tanh,Leaky,Sigmoid,Sigmoid,88,18,20.0,17.0,7.0,0.00020492898107245255,4,276,0.7746909613633693,4.965937226773527e-05,183.70163834613302,COMPLETE
1236,0.47075650095939636,2023-09-04 22:28:17.166521,2023-09-04 22:28:17.463827,0 days 00:00:00.297306,ReLU,Leaky,Sigmoid,Leaky,86,14,21.0,23.0,20.0,0.010531072584420424,4,259,0.2997010614809732,0.00010432017620629428,175.76959061041111,COMPLETE
1237,0.6436598896980286,2023-09-04 22:28:17.464344,2023-09-04 22:28:18.585563,0 days 00:00:01.121219,Sigmoid,Leaky,Sigmoid,Sigmoid,82,16,19.0,12.0,5.0,0.0015327940427700836,4,299,0.7141698348459183,6.957100749645626e-05,198.22526275634766,COMPLETE
1238,0.2553670406341553,2023-09-04 22:28:18.586098,2023-09-04 22:28:21.062504,0 days 00:00:02.476406,Tanh,Leaky,ReLU,Leaky,36,21,20.0,16.0,17.0,0.0006084890370148038,4,221,0.747412196374966,0.00019720519552230442,307.8375331712806,COMPLETE
1239,0.7786681652069092,2023-09-04 22:28:21.062984,2023-09-04 22:28:22.462131,0 days 00:00:01.399147,Tanh,Leaky,Sigmoid,Leaky,71,18,20.0,24.0,19.0,5.8556172335912013e-05,4,200,0.37700110800820413,0.00014319752186718878,182.35535865783692,COMPLETE
1240,0.5361629724502563,2023-09-04 22:28:22.462574,2023-09-04 22:28:22.641327,0 days 00:00:00.178753,ReLU,Leaky,Leaky,Sigmoid,61,11,20.0,15.0,5.0,0.028332800251496582,4,239,0.1082290164830263,5.581951029230151e-05,145.43860931396483,COMPLETE
1241,0.3787790536880493,2023-09-04 22:28:22.641804,2023-09-04 22:28:23.475608,0 days 00:00:00.833804,Sigmoid,Leaky,Sigmoid,Leaky,42,21,21.0,22.0,6.0,0.0071785405519152025,4,268,0.7751043658637432,1.4174641401799254e-05,298.09925764034955,COMPLETE
1242,0.4329964518547058,2023-09-04 22:28:23.476051,2023-09-04 22:28:23.735510,0 days 00:00:00.259459,Tanh,Leaky,Sigmoid,Tanh,85,20,21.0,13.0,18.0,0.012267838511426061,4,253,0.2009956291718811,0.0005327532585963204,175.37455891453942,COMPLETE
1243,0.5194739699363708,2023-09-04 22:28:23.735962,2023-09-04 22:28:24.166768,0 days 00:00:00.430806,Tanh,Leaky,ReLU,Leaky,83,19,19.0,16.0,15.0,0.017289667854437387,4,207,0.41101410503478086,0.02786058580716231,174.0056473658635,COMPLETE
1244,0.21208761632442474,2023-09-04 22:28:24.167209,2023-09-04 22:28:25.043014,0 days 00:00:00.875805,Tanh,Leaky,Sigmoid,Sigmoid,30,17,20.0,23.0,8.0,0.02154500448795758,4,232,0.7987487814226077,8.89959446848761e-05,127.95342472621373,COMPLETE
1245,1.0444308519363403,2023-09-04 22:28:25.043457,2023-09-04 22:28:29.135955,0 days 00:00:04.092498,ReLU,Leaky,Sigmoid,Sigmoid,29,17,17.0,23.0,8.0,1.0196953110393794e-05,4,182,0.4706750058921274,8.896628181592096e-05,224.41097334977036,COMPLETE
1246,0.2759763300418854,2023-09-04 22:28:29.136414,2023-09-04 22:28:30.008634,0 days 00:00:00.872220,Sigmoid,Leaky,Sigmoid,Sigmoid,29,17,19.0,23.0,21.0,0.030676310887392706,4,225,0.7969434856565435,0.00011332446315627268,128.31363627115886,COMPLETE
1247,0.49849069118499756,2023-09-04 22:28:30.009097,2023-09-04 22:28:30.603234,0 days 00:00:00.594137,Tanh,Leaky,Sigmoid,Sigmoid,32,17,20.0,23.0,8.0,0.024584323818421492,4,232,0.17096957226161286,8.652548921664857e-05,542.4877052307129,COMPLETE
1248,0.33699774742126465,2023-09-04 22:28:30.603678,2023-09-04 22:28:31.378855,0 days 00:00:00.775177,Tanh,Leaky,ReLU,Sigmoid,28,16,18.0,22.0,20.0,0.021768247169160163,4,193,0.7754810489909962,6.616779153219037e-05,127.95841461181641,COMPLETE
1249,0.343604177236557,2023-09-04 22:28:31.379317,2023-09-04 22:28:32.024835,0 days 00:00:00.645518,Tanh,Leaky,Sigmoid,Sigmoid,27,17,21.0,22.0,8.0,0.03596764629636755,4,244,0.7733504948154689,0.000101557377387588,192.31042518615723,COMPLETE
