number,value,datetime_start,datetime_complete,duration,params_activation1,params_activation2,params_activation3,params_activation4,params_batch_size,params_fl1,params_fl2,params_fl3,params_fl4,params_learning_rate,params_n_layers,params_num_epochs,params_train_size,params_weight_decay,user_attrs_mre,state
291,0.32336169481277466,2023-09-04 21:16:17.814275,2023-09-04 21:16:18.202472,0 days 00:00:00.388197,Tanh,Tanh,,,59,16,8.0,,,0.012909177439610151,2,226,0.725041911105227,0.0001416237824831551,176.49144723680286,COMPLETE
292,0.33275356888771057,2023-09-04 21:16:18.202761,2023-09-04 21:16:18.672147,0 days 00:00:00.469386,Leaky,Tanh,,,60,15,7.0,,,0.00960198141048118,2,215,0.6791948973173326,0.0001640559694639178,232.58913859915225,COMPLETE
293,0.3816155791282654,2023-09-04 21:16:18.672442,2023-09-04 21:16:19.053981,0 days 00:00:00.381539,Tanh,Tanh,,,56,18,8.0,,,0.00802893229730704,2,235,0.31169488635822107,9.553512622270099e-05,198.24860276116266,COMPLETE
294,0.32566505670547485,2023-09-04 21:16:19.054274,2023-09-04 21:16:19.535189,0 days 00:00:00.480915,Sigmoid,Tanh,,,54,18,11.0,,,0.08079499358277939,2,82,0.6189975109970747,0.0001316778191414037,165.38967537393376,COMPLETE
295,0.305905282497406,2023-09-04 21:16:19.535476,2023-09-04 21:16:20.101698,0 days 00:00:00.566222,Tanh,Tanh,,,59,17,7.0,,,0.006951284050251486,2,322,0.49705195686754283,0.0002286136244778597,154.2823639933268,COMPLETE
296,0.3192905783653259,2023-09-04 21:16:20.101981,2023-09-04 21:16:20.505736,0 days 00:00:00.403755,Leaky,Sigmoid,,,61,19,8.0,,,0.0296255924770449,2,229,0.6971479233461104,5.416213461212952e-05,479.0508071899414,COMPLETE
297,0.3349355161190033,2023-09-04 21:16:20.506036,2023-09-04 21:16:21.047358,0 days 00:00:00.541322,Tanh,Tanh,,,58,17,9.0,,,0.02360767442442403,2,475,0.7358540788885682,0.00027761640050576934,1742.9475036621093,COMPLETE
298,0.32129794359207153,2023-09-04 21:16:21.047653,2023-09-04 21:16:26.998338,0 days 00:00:05.950685,Tanh,ReLU,,,66,16,8.0,,,0.0003290275282646553,2,437,0.7664612556942553,0.0001140111202120743,164.08274190123652,COMPLETE
299,0.33190619945526123,2023-09-04 21:16:26.998627,2023-09-04 21:16:27.480249,0 days 00:00:00.481622,Leaky,Tanh,,,68,18,10.0,,,0.03801694784221804,2,281,0.6553992508999423,7.749803313935722e-05,1069.0622242115162,COMPLETE
300,0.28862738609313965,2023-09-04 21:16:27.480539,2023-09-04 21:16:28.154029,0 days 00:00:00.673490,Tanh,Sigmoid,,,72,18,6.0,,,0.010666547354377087,2,494,0.5409816520945885,0.00017287149521224893,148.40719669423206,COMPLETE
301,0.3466123044490814,2023-09-04 21:16:28.154314,2023-09-04 21:16:28.608412,0 days 00:00:00.454098,Sigmoid,Tanh,,,63,14,7.0,,,0.05392940200594406,2,270,0.7361075326920329,9.343195471622236e-05,177.1075535264126,COMPLETE
302,0.36556848883628845,2023-09-04 21:16:28.608706,2023-09-04 21:16:30.072521,0 days 00:00:01.463815,Tanh,Tanh,,,76,22,8.0,,,0.001372556586623578,2,449,0.6920952664998109,0.00013348189812253236,139.55830878995906,COMPLETE
303,0.4861564636230469,2023-09-04 21:16:30.072823,2023-09-04 21:16:30.172119,0 days 00:00:00.099296,Leaky,Sigmoid,,,70,20,11.0,,,0.01577165473401351,2,116,0.11138880882248355,0.0033468696625187063,169.45755122258112,COMPLETE
304,0.3471595048904419,2023-09-04 21:16:30.172408,2023-09-04 21:16:30.427392,0 days 00:00:00.254984,Tanh,Tanh,,,47,17,9.0,,,0.023787752364405345,2,292,0.35728151536630415,6.678870929159407e-05,168.6516282365129,COMPLETE
305,0.42406490445137024,2023-09-04 21:16:30.427708,2023-09-04 21:16:30.607347,0 days 00:00:00.179639,Tanh,Tanh,,,56,19,10.0,,,0.005878033048598157,2,158,0.16830288612494743,0.00018734586717140877,153.34740807875147,COMPLETE
306,0.33158618211746216,2023-09-04 21:16:30.607652,2023-09-04 21:16:32.971393,0 days 00:00:02.363741,Leaky,Tanh,,,74,18,8.0,,,0.00022124069071203763,2,255,0.7667999396129724,3.1470038015780304e-05,160.82625555898628,COMPLETE
307,0.33769023418426514,2023-09-04 21:16:32.971703,2023-09-04 21:16:33.491078,0 days 00:00:00.519375,Tanh,Sigmoid,,,31,16,9.0,,,0.02124557186978241,2,481,0.4729608135103944,0.0001074315871486389,148.61486949091372,COMPLETE
308,0.319529265165329,2023-09-04 21:16:33.491374,2023-09-04 21:16:33.788420,0 days 00:00:00.297046,Sigmoid,Tanh,,,77,17,9.0,,,0.06389853910573443,2,97,0.5036994594317467,0.00015258392852681221,342.99363602039426,COMPLETE
309,0.38219693303108215,2023-09-04 21:16:33.788723,2023-09-04 21:16:34.527033,0 days 00:00:00.738310,Tanh,ReLU,,,16,19,8.0,,,0.031794622899108935,2,242,0.7142781226701855,8.360722385082046e-05,143.84030708899866,COMPLETE
310,0.34348124265670776,2023-09-04 21:16:34.527340,2023-09-04 21:16:34.721505,0 days 00:00:00.194165,Leaky,Tanh,,,68,18,7.0,,,0.04385841160666657,2,363,0.36570994356249026,0.00012110049602421046,244.91262216279,COMPLETE
311,0.25230872631073,2023-09-04 21:16:34.721794,2023-09-04 21:16:35.361354,0 days 00:00:00.639560,Tanh,Sigmoid,,,72,18,11.0,,,0.027543684898795637,2,302,0.7995833865243068,0.0002289681614762277,115.30720741518083,COMPLETE
312,0.3226552903652191,2023-09-04 21:16:35.361653,2023-09-04 21:16:35.662875,0 days 00:00:00.301222,Tanh,Sigmoid,ReLU,,72,18,11.0,17.0,,0.01616902321088463,3,351,0.3944595106960846,0.0002432627692934037,136.76477863477623,COMPLETE
313,0.7180674076080322,2023-09-04 21:16:35.663187,2023-09-04 21:16:38.082090,0 days 00:00:02.418903,Tanh,Sigmoid,,,74,18,10.0,,,1.6236202083229177e-05,2,297,0.6732545407064329,0.0003685822093295869,132.88527430267848,COMPLETE
314,0.38618502020835876,2023-09-04 21:16:38.082394,2023-09-04 21:16:38.414778,0 days 00:00:00.332384,Tanh,Sigmoid,,,42,19,11.0,,,0.02597953358212976,2,211,0.7428868330045552,0.00020415986839986955,252.97875512164572,COMPLETE
315,0.3211216926574707,2023-09-04 21:16:38.415075,2023-09-04 21:16:38.881895,0 days 00:00:00.466820,Tanh,Sigmoid,,,70,18,11.0,,,0.02058113968421391,2,449,0.7986224761999059,0.00016546368622432937,176.93100287697533,COMPLETE
316,0.33390772342681885,2023-09-04 21:16:38.882194,2023-09-04 21:16:39.771054,0 days 00:00:00.888860,Tanh,Sigmoid,,,65,19,10.0,,,0.011201818531854072,2,311,0.4519178844279567,0.00025953621873677765,666.1500659887341,COMPLETE
317,0.2840437889099121,2023-09-04 21:16:39.771366,2023-09-04 21:16:40.155909,0 days 00:00:00.384543,Tanh,Sigmoid,,,72,17,12.0,,,0.07231513503968812,2,466,0.71958751884963,0.0002901995891319426,135.1370698928833,COMPLETE
318,0.4077345132827759,2023-09-04 21:16:40.156210,2023-09-04 21:16:40.835773,0 days 00:00:00.679563,Tanh,Sigmoid,,,75,20,10.0,,,0.008879993106786867,2,223,0.7673717080332164,0.0026159866023416885,155.1154653276716,COMPLETE
319,0.2834268808364868,2023-09-04 21:16:40.836069,2023-09-04 21:16:41.388479,0 days 00:00:00.552410,ReLU,Sigmoid,,,77,18,9.0,,,0.02740622388435587,2,109,0.6439858129956193,0.0001914428035475443,361.0392093943126,COMPLETE
320,0.3163277804851532,2023-09-04 21:16:41.388768,2023-09-04 21:16:43.005820,0 days 00:00:01.617052,Tanh,Tanh,,,71,17,11.0,,,0.0017361844787429565,2,195,0.690193806032949,6.16226902731461e-05,156.68196389453658,COMPLETE
321,0.5050754547119141,2023-09-04 21:16:43.006126,2023-09-04 21:16:43.280829,0 days 00:00:00.274703,Sigmoid,ReLU,,,62,18,9.0,,,0.0181365234631258,2,304,0.259824329265841,4.4094436359918774e-05,186.30987327329575,COMPLETE
322,0.27068254351615906,2023-09-04 21:16:43.281130,2023-09-04 21:16:43.897702,0 days 00:00:00.616572,Tanh,Sigmoid,,,83,19,10.0,,,0.013397183596453354,2,286,0.7411320491851047,0.0001619856184704597,145.02398526841316,COMPLETE
323,0.33209577202796936,2023-09-04 21:16:43.897995,2023-09-04 21:16:44.561112,0 days 00:00:00.663117,Tanh,Sigmoid,,,82,19,5.0,,,0.01272264228697238,2,293,0.43109042866872016,1.9051122558056976e-05,169.29589949196915,COMPLETE
324,0.338138222694397,2023-09-04 21:16:44.561418,2023-09-04 21:16:45.254451,0 days 00:00:00.693033,Tanh,Sigmoid,,,86,20,10.0,,,0.014154872894683352,2,291,0.7165309320789465,0.00015908582365310741,192.38571576374332,COMPLETE
325,0.37076887488365173,2023-09-04 21:16:45.254752,2023-09-04 21:16:45.554836,0 days 00:00:00.300084,Tanh,Sigmoid,,,83,19,12.0,,,0.01686451203111272,2,282,0.32455334880685893,0.0004397412337039974,176.8778076171875,COMPLETE
326,0.34627050161361694,2023-09-04 21:16:45.555135,2023-09-04 21:16:45.853224,0 days 00:00:00.298089,Tanh,Sigmoid,,,80,19,10.0,,,0.0882481054319186,2,257,0.5668452264892457,0.00022281474819281282,163.2051501151843,COMPLETE
327,0.34378349781036377,2023-09-04 21:16:45.853538,2023-09-04 21:16:46.218955,0 days 00:00:00.365417,Tanh,Sigmoid,,,89,19,11.0,,,0.05878765368498345,2,265,0.7431090254136828,0.00010170615417491655,184.63205402653392,COMPLETE
328,0.562911868095398,2023-09-04 21:16:46.219247,2023-09-04 21:16:46.364895,0 days 00:00:00.145648,Tanh,Sigmoid,,,83,18,6.0,,,0.012348195445647787,2,281,0.210694730789175,0.00015445690923636076,162.2094652085077,COMPLETE
329,0.34546372294425964,2023-09-04 21:16:46.365188,2023-09-04 21:16:47.145900,0 days 00:00:00.780712,Tanh,Sigmoid,,,85,18,8.0,,,0.005011220330103425,2,271,0.6611848201424066,8.167825839907144e-05,216.21458286709256,COMPLETE
330,0.2852552831172943,2023-09-04 21:16:47.146407,2023-09-04 21:16:48.276273,0 days 00:00:01.129866,Tanh,Leaky,,,78,22,10.0,,,0.020170086013171575,2,246,0.6078848034339335,0.00018757985306736867,122.04332157350936,COMPLETE
331,0.34262847900390625,2023-09-04 21:16:48.276780,2023-09-04 21:16:50.725560,0 days 00:00:02.448780,Tanh,Sigmoid,,,68,19,7.0,,,0.0010046352728505371,2,274,0.5099868059490867,0.00013738348946665371,529.6413284079002,COMPLETE
332,0.3359518349170685,2023-09-04 21:16:50.725854,2023-09-04 21:16:51.244383,0 days 00:00:00.518529,Tanh,Sigmoid,,,70,8,11.0,,,0.03853935696614663,2,81,0.693177004909873,0.0003071566791511676,130.75461398037996,COMPLETE
333,0.4553421437740326,2023-09-04 21:16:51.244673,2023-09-04 21:16:51.491774,0 days 00:00:00.247101,Tanh,Leaky,,,87,20,9.0,,,0.04737937097452075,2,227,0.7513007910279932,0.03705061196698976,304.0090026855469,COMPLETE
334,0.3314085602760315,2023-09-04 21:16:51.492206,2023-09-04 21:16:52.485427,0 days 00:00:00.993221,Tanh,Tanh,,,73,4,8.0,,,0.008669130361722593,2,304,0.7158428226160406,1.5149147765988915e-05,139.67952448205102,COMPLETE
335,0.3390721380710602,2023-09-04 21:16:52.485919,2023-09-04 21:16:53.695242,0 days 00:00:01.209323,Tanh,Sigmoid,,,80,19,9.0,,,0.08531659308217539,2,139,0.7690157628956148,0.00011957187299463818,260.86739050823707,COMPLETE
336,0.35180380940437317,2023-09-04 21:16:53.695754,2023-09-04 21:16:54.700977,0 days 00:00:01.005223,Tanh,ReLU,,,75,21,10.0,,,0.006722051521917393,2,123,0.7427548046361498,0.0006162819880231318,135.31705124313766,COMPLETE
337,0.3243897259235382,2023-09-04 21:16:54.701487,2023-09-04 21:16:55.717688,0 days 00:00:01.016201,Tanh,Tanh,,,84,18,11.0,,,0.02295229764051644,2,332,0.6297871254495143,0.0002066433081262897,190.39625646712932,COMPLETE
338,0.29384317994117737,2023-09-04 21:16:55.718200,2023-09-04 21:16:56.333758,0 days 00:00:00.615558,Tanh,Tanh,,,67,13,9.0,,,0.015870971881413676,2,178,0.4189844863969006,7.360136809279148e-05,383.4470734098064,COMPLETE
339,0.32091519236564636,2023-09-04 21:16:56.334112,2023-09-04 21:16:56.653599,0 days 00:00:00.319487,Tanh,Sigmoid,,,78,17,8.0,,,0.0327679163778193,2,235,0.6822519406103985,9.739883876447798e-05,439.3156347835765,COMPLETE
340,0.42088210582733154,2023-09-04 21:16:56.653998,2023-09-04 21:16:56.974979,0 days 00:00:00.320981,Leaky,Tanh,,,82,18,12.0,,,0.062311400252139174,2,285,0.3310429989598254,0.005072799933750219,217.38951416015624,COMPLETE
341,0.34678182005882263,2023-09-04 21:16:56.975367,2023-09-04 21:16:57.652292,0 days 00:00:00.676925,Tanh,Leaky,,,70,19,8.0,,,0.004332875008290273,2,58,0.7734788026186745,5.060302017695953e-05,143.86640627630825,COMPLETE
342,0.3410276770591736,2023-09-04 21:16:57.652826,2023-09-04 21:16:58.825747,0 days 00:00:01.172921,ReLU,Tanh,,,73,23,7.0,,,0.021496723808710934,2,265,0.7044725771827629,0.00022844176727149286,147.44922107198963,COMPLETE
343,0.4527265131473541,2023-09-04 21:16:58.826246,2023-09-04 21:16:59.529240,0 days 00:00:00.702994,Tanh,Sigmoid,,,75,17,21.0,,,0.010945529386465832,2,500,0.34952271660331274,0.00017163168102069754,192.18358813591723,COMPLETE
344,0.24971207976341248,2023-09-04 21:16:59.529532,2023-09-04 21:16:59.994998,0 days 00:00:00.465466,Tanh,Tanh,,,77,18,13.0,,,0.013953942696074398,2,94,0.7371800680058812,0.00014689355174320366,279.22746643066404,COMPLETE
345,0.3678348958492279,2023-09-04 21:16:59.995297,2023-09-04 21:17:00.230702,0 days 00:00:00.235405,Tanh,Tanh,,,65,18,13.0,,,0.012436020151458156,2,89,0.30725697675682856,0.0008092988391170113,128.20496335236922,COMPLETE
346,0.3915126323699951,2023-09-04 21:17:00.231005,2023-09-04 21:17:00.614677,0 days 00:00:00.383672,Leaky,,,,81,18,,,,0.01390915190374303,1,102,0.672618198328625,3.8419695075525266e-05,682.7174648708767,COMPLETE
347,0.3539917469024658,2023-09-04 21:17:00.615008,2023-09-04 21:17:01.115647,0 days 00:00:00.500639,Tanh,Tanh,,,40,18,13.0,,,0.009587640569019711,2,86,0.2963480470318963,0.00011284297947435659,295.8292558670044,COMPLETE
348,0.29259949922561646,2023-09-04 21:17:01.115961,2023-09-04 21:17:01.579899,0 days 00:00:00.463938,Tanh,Tanh,,,79,19,14.0,,,0.01897540198672659,2,488,0.7313580328571986,0.0001352215549477547,138.66358673095704,COMPLETE
349,0.29549548029899597,2023-09-04 21:17:01.580217,2023-09-04 21:17:01.995267,0 days 00:00:00.415050,Leaky,Tanh,,,77,17,13.0,,,0.015070336641052137,2,101,0.7756668061135549,8.677758456736665e-05,333.7887460617792,COMPLETE
350,0.2672325074672699,2023-09-04 21:17:01.995585,2023-09-04 21:17:02.460895,0 days 00:00:00.465310,Tanh,Tanh,,,69,20,12.0,,,0.028065475024131557,2,77,0.7980202100116538,6.965054109641107e-05,278.7963104248047,COMPLETE
351,0.3378979563713074,2023-09-04 21:17:02.461206,2023-09-04 21:17:03.059877,0 days 00:00:00.598671,Tanh,Tanh,ReLU,ReLU,69,20,12.0,15.0,7.0,0.02971184364009009,4,95,0.7953787945598386,6.936510241706559e-05,145.4665007818313,COMPLETE
352,0.36783671379089355,2023-09-04 21:17:03.060209,2023-09-04 21:17:03.363682,0 days 00:00:00.303473,Leaky,Tanh,,,68,20,12.0,,,0.035974780850347214,2,90,0.478427370150241,5.648435359866921e-05,223.52712515897528,COMPLETE
353,0.3691200315952301,2023-09-04 21:17:03.363991,2023-09-04 21:17:03.568291,0 days 00:00:00.204300,Tanh,Tanh,,,64,20,14.0,,,0.02719210960230027,2,68,0.250049592920986,0.00037019745780766407,163.6411015936669,COMPLETE
354,0.32206854224205017,2023-09-04 21:17:03.568659,2023-09-04 21:17:04.627175,0 days 00:00:01.058516,Tanh,Tanh,,,71,20,13.0,,,0.0007369495726720533,2,108,0.7667650571453514,0.00014805165307804334,13685.355260778357,COMPLETE
355,0.3504403829574585,2023-09-04 21:17:04.627469,2023-09-04 21:17:04.881502,0 days 00:00:00.254033,Tanh,Tanh,,,66,19,12.0,,,0.04244208523630092,2,375,0.38671690675785786,0.0002774514091507854,156.8115935552688,COMPLETE
356,0.2754334509372711,2023-09-04 21:17:04.881788,2023-09-04 21:17:05.131955,0 days 00:00:00.250167,Leaky,Tanh,,,72,19,11.0,,,0.02446913347222727,2,319,0.7966242323093616,0.00018469139796636373,154.51349570534447,COMPLETE
357,0.28952208161354065,2023-09-04 21:17:05.132247,2023-09-04 21:17:05.489301,0 days 00:00:00.357054,Leaky,Tanh,,,72,19,11.0,,,0.022885644580664586,2,315,0.7945460630094267,0.00023554632499939697,315.8524784897313,COMPLETE
358,0.31174740195274353,2023-09-04 21:17:05.489612,2023-09-04 21:17:05.771038,0 days 00:00:00.281426,Leaky,Tanh,,,70,21,11.0,,,0.029274424559630495,2,76,0.7136699875229068,0.00019109097713650814,184.57107713487414,COMPLETE
359,0.33988040685653687,2023-09-04 21:17:05.771339,2023-09-04 21:17:06.073504,0 days 00:00:00.302165,Leaky,Tanh,,,73,20,12.0,,,0.017236999807145797,2,78,0.40534984191833195,0.00017875896225094036,2925.344815123315,COMPLETE
360,0.2636840343475342,2023-09-04 21:17:06.073809,2023-09-04 21:17:06.360117,0 days 00:00:00.286308,Leaky,ReLU,,,67,19,11.0,,,0.03772243815608614,2,70,0.7660519606495497,0.0001492292342840743,225.69921053372897,COMPLETE
361,0.345097154378891,2023-09-04 21:17:06.360421,2023-09-04 21:17:06.781193,0 days 00:00:00.420772,Leaky,ReLU,,,68,19,11.0,,,0.0385226073763279,2,76,0.7991452536084357,0.00014868791390048884,136.1109010796798,COMPLETE
362,0.3301132023334503,2023-09-04 21:17:06.781508,2023-09-04 21:17:07.096702,0 days 00:00:00.315194,Leaky,ReLU,,,72,11,11.0,,,0.052995045643855605,2,62,0.7996828844947649,0.0005296372622903973,251.50906529919854,COMPLETE
363,0.3560008704662323,2023-09-04 21:17:07.097009,2023-09-04 21:17:07.471972,0 days 00:00:00.374963,Leaky,ReLU,,,70,19,12.0,,,0.04577649276411848,2,68,0.756141240809917,0.00021337424990110958,142.17484876844617,COMPLETE
364,0.35299667716026306,2023-09-04 21:17:07.472287,2023-09-04 21:17:07.791617,0 days 00:00:00.319330,Leaky,ReLU,,,74,19,11.0,,,0.02463888888558241,2,81,0.3396293840536654,0.0001657498107668659,151.50744393292595,COMPLETE
365,0.3476319909095764,2023-09-04 21:17:07.791929,2023-09-04 21:17:08.082803,0 days 00:00:00.290874,Leaky,ReLU,,,67,18,10.0,,,0.035231937875160005,2,67,0.5941334587308494,0.00012755523613205836,193.06429128935844,COMPLETE
366,0.9071626663208008,2023-09-04 21:17:08.083141,2023-09-04 21:17:09.043612,0 days 00:00:00.960471,Leaky,ReLU,,,69,17,11.0,,,1.1493415672460111e-05,2,96,0.7641780298621086,0.00024045813449548534,153.11461726824442,COMPLETE
367,0.30541539192199707,2023-09-04 21:17:09.043927,2023-09-04 21:17:09.458733,0 days 00:00:00.414806,Tanh,Tanh,,,71,19,12.0,,,0.01851965453123861,2,86,0.7365264900233718,0.00014617412658776412,140.4326976594471,COMPLETE
368,0.352705717086792,2023-09-04 21:17:09.459036,2023-09-04 21:17:09.719036,0 days 00:00:00.260000,Leaky,Tanh,,,75,18,10.0,,,0.03255034520602596,2,303,0.36574836958476054,0.00011705102539114002,208.95654078892298,COMPLETE
369,0.3000389337539673,2023-09-04 21:17:09.719357,2023-09-04 21:17:10.226074,0 days 00:00:00.506717,Tanh,Tanh,,,73,17,10.0,,,0.02532214574148725,2,322,0.5136414911770625,0.00018871286635017325,373.4346911456134,COMPLETE
370,0.4125916063785553,2023-09-04 21:17:10.226380,2023-09-04 21:17:10.886410,0 days 00:00:00.660030,ReLU,Tanh,,,71,19,23.0,,,0.0022737822316760852,2,73,0.7726555200734931,0.01574771673201984,196.77207415031666,COMPLETE
371,0.5427500009536743,2023-09-04 21:17:10.886725,2023-09-04 21:17:11.266474,0 days 00:00:00.379749,Tanh,ReLU,,,68,15,13.0,,,0.0005494605133616478,2,88,0.2845487858593377,0.00016224561792604084,226.78006969798696,COMPLETE
372,0.2881631851196289,2023-09-04 21:17:11.266772,2023-09-04 21:17:11.719395,0 days 00:00:00.452623,Leaky,Tanh,,,76,16,11.0,,,0.014030865505366022,2,53,0.7316671650467308,0.0001069934089268239,229.27263438944914,COMPLETE
373,0.590083658695221,2023-09-04 21:17:11.719696,2023-09-04 21:17:11.800045,0 days 00:00:00.080349,Tanh,Tanh,,,66,18,12.0,,,0.04918325098251563,2,114,0.10316678031798461,0.00013024683031265182,140.744322850154,COMPLETE
374,0.5281630754470825,2023-09-04 21:17:11.800345,2023-09-04 21:17:11.934159,0 days 00:00:00.133814,Sigmoid,Tanh,,,73,1,11.0,,,0.021445854285530065,2,444,0.4421739089266503,0.00026231454193825895,281.07188924153644,COMPLETE
375,0.2600449323654175,2023-09-04 21:17:11.934452,2023-09-04 21:17:12.524758,0 days 00:00:00.590306,Tanh,Tanh,,,70,17,10.0,,,0.038540968387119456,2,295,0.7985615001319308,0.0002074213284103465,146.9186175162332,COMPLETE
376,0.28993117809295654,2023-09-04 21:17:12.525059,2023-09-04 21:17:13.139423,0 days 00:00:00.614364,Tanh,Tanh,,,70,17,10.0,,,0.045220909984925464,2,293,0.7049252047425735,0.0003258724137812975,142.5676305135091,COMPLETE
377,0.3153863251209259,2023-09-04 21:17:13.139952,2023-09-04 21:17:14.304149,0 days 00:00:01.164197,Tanh,Tanh,,,69,16,10.0,,,0.03735937163265174,2,244,0.7521987767036571,0.0019086189328277078,191.19360463212175,COMPLETE
378,0.3387206494808197,2023-09-04 21:17:14.304656,2023-09-04 21:17:15.985875,0 days 00:00:01.681219,Tanh,ReLU,,,67,17,10.0,,,0.056555317582542036,2,108,0.7196033588544788,0.0002321638191474006,165.00118893482647,COMPLETE
379,0.31474366784095764,2023-09-04 21:17:15.986400,2023-09-04 21:17:16.950738,0 days 00:00:00.964338,Tanh,Tanh,,,76,16,9.0,,,0.030255752109658064,2,60,0.7996088112277535,0.0001422720985536909,132.97125670489143,COMPLETE
380,0.46369582414627075,2023-09-04 21:17:16.951253,2023-09-04 21:17:18.061560,0 days 00:00:01.110307,Tanh,Tanh,,,71,17,10.0,,,0.0004163030376774004,2,74,0.7612684379774569,0.00011053522881817906,283.08923257363807,COMPLETE
381,0.33497354388237,2023-09-04 21:17:18.061861,2023-09-04 21:17:18.878601,0 days 00:00:00.816740,Tanh,Tanh,,,74,17,9.0,,,0.0037808189688677296,2,98,0.6632909235439541,0.00019503205659952963,158.96610594768913,COMPLETE
382,0.36890992522239685,2023-09-04 21:17:18.878916,2023-09-04 21:17:20.001423,0 days 00:00:01.122507,Tanh,Tanh,,,69,18,10.0,,,0.002798883234780204,2,300,0.5576249638976153,0.00029724551461086934,155.14217222126481,COMPLETE
383,0.5051328539848328,2023-09-04 21:17:20.001720,2023-09-04 21:17:20.098527,0 days 00:00:00.096807,Tanh,Tanh,,,66,18,9.0,,,0.07235923730195237,2,471,0.12820541447117986,9.348572344833736e-05,169.7823118012527,COMPLETE
384,0.3581240773200989,2023-09-04 21:17:20.098828,2023-09-04 21:17:20.550263,0 days 00:00:00.451435,Tanh,Tanh,,,77,17,12.0,,,0.04002962216174545,2,253,0.6326685024263665,0.0059366184533495864,764.238149370466,COMPLETE
385,0.3385937511920929,2023-09-04 21:17:20.550558,2023-09-04 21:17:20.875459,0 days 00:00:00.324901,Tanh,ReLU,ReLU,,80,16,9.0,21.0,,0.011485424811924796,3,436,0.4662844195060866,0.0001540880998581895,132.16922539605034,COMPLETE
386,0.3240049183368683,2023-09-04 21:17:20.875812,2023-09-04 21:17:21.266494,0 days 00:00:00.390682,Tanh,Tanh,,,72,18,9.0,,,0.015891175640649798,2,286,0.691649661052022,0.00012875586491688885,131.29958434331985,COMPLETE
387,0.4563179016113281,2023-09-04 21:17:21.266795,2023-09-04 21:17:24.089523,0 days 00:00:02.822728,Tanh,Tanh,,,75,18,10.0,,,9.158650034491842e-05,2,237,0.7378681672415615,0.0002220731571213189,195.83570140725953,COMPLETE
