number,value,datetime_start,datetime_complete,duration,params_activation1,params_activation2,params_activation3,params_activation4,params_batch_size,params_fl1,params_fl2,params_fl3,params_fl4,params_learning_rate,params_n_layers,params_num_epochs,params_train_size,params_weight_decay,user_attrs_mre,state
804,0.49796977639198303,2023-09-04 22:20:34.413357,2023-09-04 22:20:34.896376,0 days 00:00:00.483019,Leaky,ReLU,Sigmoid,Leaky,25,20,19.0,23.0,11.0,0.013155940590366334,4,158,0.20059545769117287,0.00019538248003169223,284.304311578924,COMPLETE
805,0.2955942451953888,2023-09-04 22:20:34.896834,2023-09-04 22:20:35.600259,0 days 00:00:00.703425,Tanh,Leaky,Sigmoid,Sigmoid,81,12,20.0,18.0,10.0,0.004744507653172168,4,302,0.7121341640724232,1.213118762280159e-05,260.25099421482463,COMPLETE
806,1.0875779390335083,2023-09-04 22:20:35.600837,2023-09-04 22:20:36.182079,0 days 00:00:00.581242,Sigmoid,Tanh,Sigmoid,Tanh,30,21,21.0,7.0,17.0,0.020921116590285598,4,255,0.7338862759966832,0.06802444971192585,101.70904219777961,COMPLETE
807,0.5353435277938843,2023-09-04 22:20:36.182514,2023-09-04 22:20:40.394648,0 days 00:00:04.212134,Leaky,Leaky,Sigmoid,Leaky,51,9,22.0,15.0,6.0,0.0001348097807890466,4,270,0.34143127235016163,0.00045941192660860176,176.5588737487793,COMPLETE
808,1.0167632102966309,2023-09-04 22:20:40.395057,2023-09-04 22:20:40.618456,0 days 00:00:00.223399,Tanh,Leaky,Sigmoid,Sigmoid,86,18,21.0,3.0,9.0,0.09567441676629382,4,120,0.7712937755123788,0.0812531817128783,235.12459246317545,COMPLETE
809,0.3046664297580719,2023-09-04 22:20:40.618947,2023-09-04 22:20:41.469950,0 days 00:00:00.851003,Leaky,Leaky,Sigmoid,ReLU,78,17,20.0,16.0,5.0,0.009105529433701257,4,332,0.6522752775763236,1.3647181713067836e-05,104.8246067271513,COMPLETE
810,0.5922936797142029,2023-09-04 22:20:41.470367,2023-09-04 22:20:41.716175,0 days 00:00:00.245808,Tanh,Leaky,Tanh,Sigmoid,84,22,19.0,15.0,3.0,0.01607348605123933,4,312,0.6933293625873227,0.00031648305733258264,176.01535892486572,COMPLETE
811,0.38238298892974854,2023-09-04 22:20:41.716576,2023-09-04 22:20:42.750536,0 days 00:00:01.033960,Sigmoid,Leaky,Sigmoid,Leaky,80,12,20.0,16.0,7.0,0.005485597794988019,4,199,0.7394610921206672,3.603427556790239e-05,224.05736024039132,COMPLETE
812,0.4038855731487274,2023-09-04 22:20:42.751010,2023-09-04 22:20:42.996663,0 days 00:00:00.245653,Leaky,Leaky,Sigmoid,,35,19,21.0,22.0,,0.029534022459156678,3,293,0.22912648637977645,9.703700204734664e-05,144.44016565595354,COMPLETE
813,0.5749402642250061,2023-09-04 22:20:42.997080,2023-09-04 22:20:43.360134,0 days 00:00:00.363054,Tanh,Leaky,Sigmoid,Sigmoid,76,5,13.0,15.0,2.0,0.0034237029637827245,4,235,0.7995322854360477,0.0007842345510146176,150.3625139982804,COMPLETE
814,0.3490332365036011,2023-09-04 22:20:43.360564,2023-09-04 22:20:43.669688,0 days 00:00:00.309124,Leaky,Leaky,Leaky,Leaky,85,11,18.0,6.0,13.0,0.012066414122171838,4,246,0.24290738615744759,0.0021675657744793806,128.76456799423485,COMPLETE
815,0.37913385033607483,2023-09-04 22:20:43.670111,2023-09-04 22:20:44.020067,0 days 00:00:00.349956,Tanh,Leaky,Sigmoid,Sigmoid,88,20,19.0,24.0,10.0,0.014767192473769487,4,220,0.42376667619920755,0.0001554936282235895,154.78030395507812,COMPLETE
816,0.7440119981765747,2023-09-04 22:20:44.020486,2023-09-04 22:20:46.179715,0 days 00:00:02.159229,Sigmoid,ReLU,Sigmoid,Leaky,83,10,20.0,16.0,11.0,9.46443439965208e-05,4,264,0.5068375830624373,7.205886099914358e-05,155.12460312698826,COMPLETE
817,1.0524377822875977,2023-09-04 22:20:46.180124,2023-09-04 22:20:46.417642,0 days 00:00:00.237518,Leaky,Leaky,Sigmoid,Sigmoid,82,8,15.0,17.0,4.0,0.01779514828501901,4,256,0.7106526098615589,0.026707499424015218,110.19437459309896,COMPLETE
818,0.3865165710449219,2023-09-04 22:20:46.418061,2023-09-04 22:20:47.329660,0 days 00:00:00.911599,Tanh,Tanh,Sigmoid,Sigmoid,39,21,21.0,14.0,15.0,0.022852835463710475,4,341,0.7519734074929709,1.6068105892751788e-05,280.84663178199946,COMPLETE
819,1.0223989486694336,2023-09-04 22:20:47.330087,2023-09-04 22:20:47.527313,0 days 00:00:00.197226,Leaky,Leaky,Sigmoid,Leaky,99,19,22.0,12.0,16.0,0.011076730195954326,4,229,0.4387294275846691,0.05189585085487686,99.36192815444049,COMPLETE
820,0.2879127860069275,2023-09-04 22:20:47.527752,2023-09-04 22:20:48.017381,0 days 00:00:00.489629,Tanh,Leaky,Tanh,Tanh,85,21,19.0,15.0,12.0,0.013146084668491223,4,278,0.5731983848379905,0.000547637014115568,139.12047036488852,COMPLETE
821,0.9776861667633057,2023-09-04 22:20:48.017798,2023-09-04 22:20:48.606798,0 days 00:00:00.589000,Leaky,Leaky,Sigmoid,Sigmoid,32,18,20.0,16.0,14.0,0.01934168517513234,4,145,0.6314553105249658,0.010809656340553867,112.38393878936768,COMPLETE
822,0.516089141368866,2023-09-04 22:20:48.607222,2023-09-04 22:20:48.989497,0 days 00:00:00.382275,Sigmoid,Leaky,,,79,13,20.0,,,0.007630199207357916,2,175,0.14322122204191834,2.2003828346098927e-05,150.43440390450613,COMPLETE
823,0.6100892424583435,2023-09-04 22:20:48.989896,2023-09-04 22:20:49.354555,0 days 00:00:00.364659,Tanh,Leaky,Sigmoid,Leaky,89,20,21.0,23.0,1.0,0.009613729044571246,4,239,0.6721310328043764,5.6420777096075204e-05,191.48201146619073,COMPLETE
824,0.34670117497444153,2023-09-04 22:20:49.354985,2023-09-04 22:20:50.095768,0 days 00:00:00.740783,Leaky,Leaky,Sigmoid,ReLU,42,9,22.0,17.0,8.0,0.0418136851976932,4,320,0.7688245438593108,1.0151762614308417e-05,107.92750941685267,COMPLETE
825,1.0141346454620361,2023-09-04 22:20:50.096173,2023-09-04 22:20:50.492458,0 days 00:00:00.396285,Tanh,Sigmoid,Sigmoid,Sigmoid,81,19,20.0,18.0,18.0,0.01562937956753269,4,210,0.7259437115340024,0.0197307801680826,109.43664235082166,COMPLETE
826,0.34377411007881165,2023-09-04 22:20:50.492863,2023-09-04 22:20:50.870813,0 days 00:00:00.377950,Leaky,Leaky,Sigmoid,Leaky,87,18,21.0,24.0,17.0,0.02619077886182309,4,253,0.3115926323678075,0.0038715637347337063,92.4695565008348,COMPLETE
827,0.39741837978363037,2023-09-04 22:20:50.871217,2023-09-04 22:20:51.383202,0 days 00:00:00.511985,Tanh,Leaky,Sigmoid,,83,20,19.0,13.0,,0.013834294377778729,3,268,0.7013277659970626,0.009809058137406642,215.17004264669217,COMPLETE
828,1.1000003814697266,2023-09-04 22:20:51.383607,2023-09-04 22:20:54.953573,0 days 00:00:03.569966,Sigmoid,Leaky,Sigmoid,Sigmoid,27,17,19.0,14.0,5.0,2.7237965915203348e-05,4,332,0.36574573265335153,0.0048745156894381605,130.21130268990328,COMPLETE
829,0.559112012386322,2023-09-04 22:20:54.953986,2023-09-04 22:20:55.170189,0 days 00:00:00.216203,Leaky,ReLU,Sigmoid,Leaky,85,22,20.0,15.0,19.0,0.019807454468318192,4,294,0.13195765201518878,0.00018959453794094986,920.1610401081589,COMPLETE
830,0.3882952928543091,2023-09-04 22:20:55.170602,2023-09-04 22:20:56.765596,0 days 00:00:01.594994,Tanh,Leaky,Sigmoid,Sigmoid,36,10,18.0,15.0,7.0,0.010803858945711965,4,280,0.7984084195378162,0.00012838800453857246,122.99975995049961,COMPLETE
831,0.37825289368629456,2023-09-04 22:20:56.766018,2023-09-04 22:20:57.049317,0 days 00:00:00.283299,Leaky,Tanh,Sigmoid,Sigmoid,92,11,22.0,16.0,6.0,0.016796198978187907,4,247,0.6018888274829962,0.0002386801417881656,168.17910269032353,COMPLETE
832,0.5399949550628662,2023-09-04 22:20:57.049739,2023-09-04 22:21:02.751227,0 days 00:00:05.701488,Tanh,Leaky,Tanh,Leaky,81,21,12.0,15.0,12.0,4.4209368309984504e-05,4,346,0.74428018872446,0.0011273382508613795,155.32474786835598,COMPLETE
833,0.5134285688400269,2023-09-04 22:21:02.751621,2023-09-04 22:21:02.910930,0 days 00:00:00.159309,Sigmoid,Leaky,Sigmoid,Sigmoid,83,20,24.0,21.0,11.0,0.06469961456495713,4,218,0.21376870729495925,1.2492042394272891e-05,116.50489225841704,COMPLETE
834,0.8174775838851929,2023-09-04 22:21:02.911344,2023-09-04 22:21:03.934718,0 days 00:00:01.023374,Leaky,Leaky,Sigmoid,Tanh,87,21,21.0,24.0,9.0,3.283906876785269e-05,4,228,0.27101246015015723,7.278199303913274e-05,109.21364212036133,COMPLETE
835,0.602302610874176,2023-09-04 22:21:03.935118,2023-09-04 22:21:08.606557,0 days 00:00:04.671439,Tanh,Sigmoid,Sigmoid,Leaky,46,20,20.0,16.0,6.0,0.000201993077459987,4,307,0.6584934731572157,0.0006081669735767588,197.60450416589794,COMPLETE
836,0.3783526122570038,2023-09-04 22:21:08.606951,2023-09-04 22:21:10.411291,0 days 00:00:01.804340,Leaky,Leaky,Sigmoid,Sigmoid,78,22,21.0,23.0,4.0,0.0010050113744165547,4,194,0.7724207612636763,0.00010734279307494688,188.95295627100938,COMPLETE
837,0.2768779993057251,2023-09-04 22:21:10.411692,2023-09-04 22:21:10.916437,0 days 00:00:00.504745,Tanh,Leaky,Sigmoid,ReLU,80,19,23.0,14.0,10.0,0.023750092253152347,4,182,0.4611387132367369,0.00041817287581747623,92.02230387720569,COMPLETE
838,0.9566925764083862,2023-09-04 22:21:10.916844,2023-09-04 22:21:13.333053,0 days 00:00:02.416209,Sigmoid,Leaky,Leaky,Leaky,85,18,20.0,17.0,16.0,4.4084721707000545e-05,4,113,0.6967617451920951,0.013379357811302171,124.3627278825878,COMPLETE
839,0.3446752727031708,2023-09-04 22:21:13.333776,2023-09-04 22:21:13.874748,0 days 00:00:00.540972,Leaky,Leaky,Sigmoid,Sigmoid,37,15,19.0,16.0,5.0,0.031649205843647124,4,260,0.7286772003240093,0.00014655184885027794,717.5611106872559,COMPLETE
840,0.37997859716415405,2023-09-04 22:21:13.875170,2023-09-04 22:21:14.517996,0 days 00:00:00.642826,Tanh,Leaky,Sigmoid,,34,11,21.0,15.0,,0.013028100592951588,3,360,0.7699251684791569,0.00029471133291199356,515.233144124349,COMPLETE
841,0.843612015247345,2023-09-04 22:21:14.518401,2023-09-04 22:21:15.200056,0 days 00:00:00.681655,Leaky,Leaky,Sigmoid,Sigmoid,89,9,20.0,16.0,11.0,1.671715235953138e-05,4,158,0.2953198778723924,8.835977289408311e-05,84.65338798697668,COMPLETE
842,0.4359012246131897,2023-09-04 22:21:15.200489,2023-09-04 22:21:16.101092,0 days 00:00:00.900603,Tanh,ReLU,Sigmoid,Leaky,83,21,22.0,24.0,13.0,0.0003633495760140873,4,326,0.1390634917253338,5.071796951820213e-05,135.8331695275804,COMPLETE
843,0.3886291980743408,2023-09-04 22:21:16.101488,2023-09-04 22:21:17.185306,0 days 00:00:01.083818,Sigmoid,Leaky,Sigmoid,Sigmoid,29,14,19.0,22.0,6.0,0.008340253622357687,4,237,0.39395969622250876,1.7356599022231514e-05,198.2121588967063,COMPLETE
844,0.25876307487487793,2023-09-04 22:21:17.185727,2023-09-04 22:21:18.239725,0 days 00:00:01.053998,Leaky,Tanh,Sigmoid,Leaky,43,12,21.0,15.0,10.0,0.016794617332784725,4,84,0.7456117051313135,2.989243490571512e-05,97.03252227783203,COMPLETE
845,0.7103472352027893,2023-09-04 22:21:18.240139,2023-09-04 22:21:18.389803,0 days 00:00:00.149664,Tanh,Sigmoid,Tanh,Sigmoid,86,19,22.0,14.0,7.0,0.020969425448120665,4,245,0.1634917235670943,6.424659133174581e-05,532.5659378715184,COMPLETE
846,0.3294547498226166,2023-09-04 22:21:18.390209,2023-09-04 22:21:20.188827,0 days 00:00:01.798618,Leaky,Leaky,Sigmoid,Leaky,84,20,20.0,16.0,17.0,0.0017137633782870413,4,204,0.7999417492131069,0.00016973097286374634,89.9371654843324,COMPLETE
847,0.32674887776374817,2023-09-04 22:21:20.189241,2023-09-04 22:21:20.947789,0 days 00:00:00.758548,Tanh,Leaky,Sigmoid,Sigmoid,75,21,20.0,23.0,3.0,0.009601605797078142,4,168,0.5342786413024464,0.0002556128967701315,130.31008549225635,COMPLETE
848,0.42226624488830566,2023-09-04 22:21:20.948186,2023-09-04 22:21:21.565000,0 days 00:00:00.616814,Sigmoid,Leaky,Sigmoid,Tanh,94,17,21.0,15.0,12.0,0.004340834451964396,4,480,0.32055172882856414,0.00034940038482037596,152.36921451328038,COMPLETE
849,0.3689616322517395,2023-09-04 22:21:21.565411,2023-09-04 22:21:22.895665,0 days 00:00:01.330254,Leaky,Leaky,Sigmoid,Leaky,82,10,23.0,12.0,7.0,0.0013303439815383353,4,286,0.6788063373274665,2.4064339271442966e-05,123.41761195275092,COMPLETE
850,0.5932289361953735,2023-09-04 22:21:22.896095,2023-09-04 22:21:28.337966,0 days 00:00:05.441871,Tanh,Leaky,Sigmoid,Sigmoid,49,22,6.0,13.0,18.0,4.1863019978400684e-05,4,271,0.7192194749638927,0.00021597323904549726,140.25099159606708,COMPLETE
851,0.37189340591430664,2023-09-04 22:21:28.338385,2023-09-04 22:21:28.677597,0 days 00:00:00.339212,Leaky,,,,79,19,,,,0.014472061887123976,1,300,0.39946213487584326,3.8192314855570337e-05,145.68272936021958,COMPLETE
852,0.8589094877243042,2023-09-04 22:21:28.677995,2023-09-04 22:21:29.004797,0 days 00:00:00.326802,Tanh,Leaky,Sigmoid,ReLU,81,20,17.0,17.0,14.0,1.707038504222477e-05,4,128,0.10101853502695744,0.0007492311573958267,106.87276130914688,COMPLETE
853,0.9332321882247925,2023-09-04 22:21:29.005189,2023-09-04 22:21:29.450058,0 days 00:00:00.444869,Sigmoid,Sigmoid,Sigmoid,Sigmoid,32,7,19.0,15.0,5.0,0.006156563482014764,4,252,0.6495879130597947,0.06535309879217181,107.5647261770148,COMPLETE
854,0.35926494002342224,2023-09-04 22:21:29.450466,2023-09-04 22:21:29.823294,0 days 00:00:00.372828,Leaky,Leaky,Sigmoid,Leaky,87,18,20.0,24.0,8.0,0.011615873749724144,4,315,0.5208479027918631,7.686274390084538e-05,128.84508163864547,COMPLETE
855,0.34111732244491577,2023-09-04 22:21:29.823721,2023-09-04 22:21:31.603956,0 days 00:00:01.780235,Tanh,Leaky,Sigmoid,,77,8,9.0,16.0,,0.0006251733530674185,3,339,0.7510285688384268,1.342224068322121e-05,135.66931987514158,COMPLETE
856,0.9356364607810974,2023-09-04 22:21:31.604372,2023-09-04 22:21:31.842229,0 days 00:00:00.237857,Leaky,Leaky,Sigmoid,Sigmoid,90,21,18.0,18.0,11.0,0.01814600012339038,4,137,0.7055627806096494,0.02845183746764817,107.07908833821615,COMPLETE
857,0.8337562084197998,2023-09-04 22:21:31.842641,2023-09-04 22:21:32.105606,0 days 00:00:00.262965,Tanh,ReLU,Sigmoid,Leaky,84,16,21.0,14.0,6.0,0.026636664620394043,4,232,0.19555344112929135,0.00013422304843165516,221.57561172977572,COMPLETE
858,0.24811682105064392,2023-09-04 22:21:32.106028,2023-09-04 22:21:34.362691,0 days 00:00:02.256663,Leaky,Leaky,Tanh,Sigmoid,13,6,19.0,10.0,4.0,0.013963327759445435,4,213,0.7678051213213051,0.0013963134538963783,183.36504062386447,COMPLETE
859,0.3861839175224304,2023-09-04 22:21:34.363102,2023-09-04 22:21:34.771789,0 days 00:00:00.408687,Sigmoid,Tanh,Sigmoid,Leaky,40,12,20.0,16.0,17.0,0.03487343333848572,4,265,0.4760417092074079,0.00011714426219049268,128.05953329580802,COMPLETE
860,0.37632182240486145,2023-09-04 22:21:34.772194,2023-09-04 22:21:35.108497,0 days 00:00:00.336303,Tanh,Leaky,Sigmoid,Sigmoid,82,9,21.0,23.0,13.0,0.011267078543234986,4,278,0.24943455807786516,0.00018586918960636093,208.18843915385585,COMPLETE
861,0.35687321424484253,2023-09-04 22:21:35.108901,2023-09-04 22:21:35.743359,0 days 00:00:00.634458,Leaky,Leaky,Leaky,Tanh,86,10,22.0,4.0,12.0,0.021212932156869948,4,225,0.7356875091098926,0.0009346621142045884,113.3598045493072,COMPLETE
862,0.36123499274253845,2023-09-04 22:21:35.743787,2023-09-04 22:21:36.020913,0 days 00:00:00.277126,Tanh,Leaky,Sigmoid,Sigmoid,38,21,20.0,15.0,8.0,0.007134652710919163,4,181,0.10679840773430738,5.989701424327655e-05,131.71672017233712,COMPLETE
863,0.5847545266151428,2023-09-04 22:21:36.021350,2023-09-04 22:21:36.227045,0 days 00:00:00.205695,Leaky,Sigmoid,Sigmoid,Leaky,80,18,19.0,17.0,9.0,0.016460313996890807,4,239,0.11473818397513875,1.5501704525420506e-05,171.97474934504584,COMPLETE
864,0.23203688859939575,2023-09-04 22:21:36.227471,2023-09-04 22:21:37.928416,0 days 00:00:01.700945,Tanh,Leaky,Sigmoid,Sigmoid,19,13,22.0,9.0,10.0,0.0033133897038945537,4,327,0.6289942745818157,0.00047378971019395395,137.0921863902699,COMPLETE
865,0.2781689763069153,2023-09-04 22:21:37.928848,2023-09-04 22:21:39.181802,0 days 00:00:01.252954,Tanh,Leaky,Sigmoid,Sigmoid,23,13,22.0,15.0,10.0,0.0049853594929025625,4,318,0.6448302371612399,0.0004303316346596579,117.75338148034137,COMPLETE
866,0.42981576919555664,2023-09-04 22:21:39.182217,2023-09-04 22:21:40.269172,0 days 00:00:01.086955,Tanh,Leaky,Sigmoid,Sigmoid,19,13,23.0,14.0,5.0,0.0058302159424325475,4,309,0.6247362398179008,0.00029816437006753696,227.69164141486672,COMPLETE
867,0.34016668796539307,2023-09-04 22:21:40.269593,2023-09-04 22:21:40.598148,0 days 00:00:00.328555,Tanh,Leaky,Sigmoid,Sigmoid,53,12,23.0,9.0,2.0,0.014145447553898991,4,329,0.18976920967369185,0.00010147975910576435,182.8805672597077,COMPLETE
868,0.3609938323497772,2023-09-04 22:21:40.598554,2023-09-04 22:21:41.446841,0 days 00:00:00.848287,Tanh,Leaky,,,20,12,22.0,,,0.01836979087270932,2,323,0.5974694010416151,0.0022191428689844243,107.09758867536273,COMPLETE
869,0.8505202531814575,2023-09-04 22:21:41.447258,2023-09-04 22:21:42.352886,0 days 00:00:00.905628,Tanh,Leaky,Sigmoid,Sigmoid,16,13,23.0,8.0,16.0,0.0034330937013589725,4,402,0.670062244920865,0.05674231808844355,105.22737157912482,COMPLETE
870,0.7518958449363708,2023-09-04 22:21:42.353321,2023-09-04 22:21:50.712283,0 days 00:00:08.358962,Tanh,Leaky,Sigmoid,Sigmoid,24,13,23.0,16.0,6.0,1.313448466437722e-05,4,308,0.6866013755459913,1.905574895578083e-05,104.1968668157404,COMPLETE
871,0.4292276203632355,2023-09-04 22:21:50.712779,2023-09-04 22:21:51.383309,0 days 00:00:00.670530,Tanh,Leaky,Sigmoid,Sigmoid,23,12,22.0,6.0,11.0,0.022834294237480634,4,261,0.6244593663544382,4.765154681939186e-05,136.04243203868037,COMPLETE
872,0.5726466178894043,2023-09-04 22:21:51.383767,2023-09-04 22:21:55.234357,0 days 00:00:03.850590,Tanh,Leaky,Sigmoid,Sigmoid,41,13,22.0,7.0,1.0,0.0007545176903199793,4,289,0.7719079602263158,0.0005085306201564176,199.29622379302978,COMPLETE
873,0.4453426003456116,2023-09-04 22:21:55.234817,2023-09-04 22:21:56.072727,0 days 00:00:00.837910,Tanh,Leaky,Tanh,,15,13,22.0,9.0,,0.0018453286079559655,3,254,0.26821031418817987,0.0002180930122767403,205.63754817417689,COMPLETE
874,0.29475027322769165,2023-09-04 22:21:56.073153,2023-09-04 22:21:56.794797,0 days 00:00:00.721644,Tanh,Leaky,Sigmoid,Sigmoid,47,14,22.0,15.0,17.0,0.012399715174796353,4,154,0.710094955067822,3.1001097290015925e-05,139.04178981781007,COMPLETE
875,0.5908140540122986,2023-09-04 22:21:56.795274,2023-09-04 22:21:58.414356,0 days 00:00:01.619082,Tanh,Leaky,Sigmoid,Sigmoid,21,11,21.0,16.0,4.0,0.0012996849820791846,4,297,0.12237119544897074,8.266474301551591e-05,189.21077745545585,COMPLETE
876,0.45766812562942505,2023-09-04 22:21:58.414764,2023-09-04 22:21:58.808203,0 days 00:00:00.393439,Tanh,Leaky,Sigmoid,Sigmoid,45,14,22.0,22.0,9.0,0.01591423351319343,4,244,0.37038302372505116,1.0098451281049223e-05,164.03329315185547,COMPLETE
877,0.659967839717865,2023-09-04 22:21:58.808655,2023-09-04 22:21:59.011032,0 days 00:00:00.202377,Tanh,Leaky,Sigmoid,Sigmoid,17,13,11.0,24.0,12.0,0.02009604607104723,4,191,0.1198931480555865,0.00035969928983490277,255.22559547424316,COMPLETE
878,1.2775362730026245,2023-09-04 22:21:59.011517,2023-09-04 22:22:00.740278,0 days 00:00:01.728761,Tanh,Leaky,Sigmoid,Sigmoid,17,13,21.0,2.0,5.0,0.0028729638293636434,4,174,0.6692833332192247,0.09913686350744008,98.01693163420025,COMPLETE
879,0.3185942471027374,2023-09-04 22:22:00.741019,2023-09-04 22:22:04.834837,0 days 00:00:04.093818,Tanh,Leaky,Sigmoid,Sigmoid,78,22,22.0,17.0,11.0,0.0022121323448299583,4,224,0.7980095366838984,1.1650588808514397e-05,119.56572785810991,COMPLETE
880,0.3506142497062683,2023-09-04 22:22:04.835288,2023-09-04 22:22:06.741542,0 days 00:00:01.906254,Sigmoid,Leaky,Sigmoid,Sigmoid,21,14,24.0,14.0,7.0,0.0036175275402219897,4,102,0.7389590827217906,4.115479818727733e-05,190.39657619081694,COMPLETE
881,1.0281856060028076,2023-09-04 22:22:06.741943,2023-09-04 22:22:07.799174,0 days 00:00:01.057231,Tanh,Leaky,Sigmoid,ReLU,80,12,21.0,15.0,2.0,0.00982391690184681,4,273,0.6371256652044647,0.00017413981066367537,101.2723641531808,COMPLETE
882,0.4494984447956085,2023-09-04 22:22:07.799964,2023-09-04 22:22:10.813233,0 days 00:00:03.013269,ReLU,Leaky,Sigmoid,Sigmoid,12,15,23.0,16.0,10.0,0.028293610167026133,4,313,0.6960564598086636,6.460888090028306e-05,139.10002432929144,COMPLETE
883,0.6525546312332153,2023-09-04 22:22:10.813676,2023-09-04 22:22:12.716333,0 days 00:00:01.902657,Tanh,Leaky,Sigmoid,,81,11,18.0,16.0,,0.00016166423913998576,3,234,0.5697055446210312,0.00014916534695265236,167.44748436691415,COMPLETE
884,1.1041193008422852,2023-09-04 22:22:12.716795,2023-09-04 22:22:13.017535,0 days 00:00:00.300740,Sigmoid,Leaky,Sigmoid,Sigmoid,18,17,21.0,10.0,3.0,0.000987416668893891,4,205,0.2150269204340124,0.020523770418712575,136.67641087582237,COMPLETE
885,0.2948395609855652,2023-09-04 22:22:13.017972,2023-09-04 22:22:14.548488,0 days 00:00:01.530516,Tanh,ReLU,Tanh,Sigmoid,83,9,22.0,15.0,6.0,0.003315989837811995,4,248,0.7686373934272417,0.0002537678582189598,118.94059456719293,COMPLETE
886,0.37975266575813293,2023-09-04 22:22:14.548884,2023-09-04 22:22:16.318069,0 days 00:00:01.769185,Tanh,Leaky,Leaky,Sigmoid,14,14,21.0,24.0,5.0,0.013876913869957624,4,330,0.7993780790163552,9.805135352951011e-05,195.21241138599538,COMPLETE
887,0.6229326128959656,2023-09-04 22:22:16.318504,2023-09-04 22:22:16.833805,0 days 00:00:00.515301,Sigmoid,Tanh,Sigmoid,Sigmoid,97,18,21.0,23.0,16.0,0.0029192204104867498,4,122,0.3559459125796785,0.00020212173961940992,184.64096823404,COMPLETE
888,0.6521970629692078,2023-09-04 22:22:16.834279,2023-09-04 22:22:17.107405,0 days 00:00:00.273126,Tanh,Leaky,Sigmoid,Tanh,37,10,22.0,15.0,15.0,0.0021782658744631416,4,259,0.12822600290496852,0.00302728646776244,163.79148400348166,COMPLETE
889,0.2820693552494049,2023-09-04 22:22:17.107858,2023-09-04 22:22:18.004607,0 days 00:00:00.896749,Tanh,Leaky,Sigmoid,Sigmoid,27,13,20.0,16.0,18.0,0.01719051162172466,4,146,0.40469324787327454,0.0006263728660145217,149.52329676491874,COMPLETE
890,0.2315683811903,2023-09-04 22:22:18.005021,2023-09-04 22:22:19.576124,0 days 00:00:01.571103,ReLU,Leaky,Sigmoid,ReLU,50,11,21.0,23.0,11.0,0.002544253798099991,4,166,0.7210056869513924,1.4595296587197107e-05,105.7311577796936,COMPLETE
891,0.48953977227211,2023-09-04 22:22:19.576543,2023-09-04 22:22:22.293119,0 days 00:00:02.716576,ReLU,Leaky,Sigmoid,ReLU,44,11,21.0,23.0,11.0,0.0011493556311112025,4,166,0.6778895661114078,0.002412321630644294,278.01529554451037,COMPLETE
892,0.4135507643222809,2023-09-04 22:22:22.293544,2023-09-04 22:22:23.188869,0 days 00:00:00.895325,ReLU,Leaky,Sigmoid,ReLU,50,11,20.0,24.0,11.0,0.002530745306282667,4,165,0.49012353166313216,0.00012322854712283181,119.10190035845783,COMPLETE
