number,value,datetime_start,datetime_complete,duration,params_activation1,params_activation2,params_activation3,params_activation4,params_batch_size,params_fl1,params_fl2,params_fl3,params_fl4,params_learning_rate,params_n_layers,params_num_epochs,params_train_size,params_weight_decay,user_attrs_mre,state
571,0.44327691197395325,2023-09-04 21:22:07.472239,2023-09-04 21:22:10.077560,0 days 00:00:02.605321,Leaky,ReLU,Tanh,Leaky,43,19,18.0,15.0,14.0,0.0011294067117709119,4,373,0.24502660685926675,0.00108140090723849,139.03766154514923,COMPLETE
572,0.3528328537940979,2023-09-04 21:22:10.078210,2023-09-04 21:22:12.777706,0 days 00:00:02.699496,Leaky,Sigmoid,,,38,23,19.0,,,0.012193396062176192,2,199,0.6794151630198607,0.00019709991598956225,811.1198088233151,COMPLETE
573,0.4302106201648712,2023-09-04 21:22:12.778311,2023-09-04 21:22:13.439754,0 days 00:00:00.661443,Leaky,Tanh,,,33,22,20.0,,,0.05528567790759878,2,160,0.17196043679360387,5.692953407687303e-05,160.33916700647234,COMPLETE
574,0.433330774307251,2023-09-04 21:22:13.440364,2023-09-04 21:22:15.639817,0 days 00:00:02.199453,Leaky,ReLU,,,98,21,20.0,,,0.0006446423753304733,2,142,0.4841191710926602,1.7417237461981776e-05,184.2003415067431,COMPLETE
575,0.39328885078430176,2023-09-04 21:22:15.640459,2023-09-04 21:22:16.521015,0 days 00:00:00.880556,Leaky,,,,81,24,,,,0.01678149374562321,1,192,0.7433106970926046,0.0003151397120320197,170.14503205128204,COMPLETE
576,0.39866378903388977,2023-09-04 21:22:16.521598,2023-09-04 21:22:17.816909,0 days 00:00:01.295311,Tanh,Tanh,,,89,23,12.0,,,0.007534118628294781,2,169,0.7981711266639738,0.0001539886158983021,2966.1474323678526,COMPLETE
577,0.30149635672569275,2023-09-04 21:22:17.817506,2023-09-04 21:22:19.350927,0 days 00:00:01.533421,Leaky,Sigmoid,,,74,24,17.0,,,0.023056135715225596,2,458,0.7165276267634414,1.1905475215359013e-05,165.57116837935015,COMPLETE
578,0.5023117661476135,2023-09-04 21:22:19.351539,2023-09-04 21:22:23.555808,0 days 00:00:04.204269,Leaky,Sigmoid,,,75,24,16.0,,,0.0004870454420070382,2,482,0.21875808921308218,1.1820077379297731e-05,254.57334861913657,COMPLETE
579,0.4269554018974304,2023-09-04 21:22:23.556420,2023-09-04 21:22:24.403855,0 days 00:00:00.847435,Leaky,Sigmoid,,,73,24,5.0,,,0.021776504082345334,2,461,0.21092939911617026,1.0151121985662031e-05,141.98876233047315,COMPLETE
580,0.48923933506011963,2023-09-04 21:22:24.404462,2023-09-04 21:22:29.739362,0 days 00:00:05.334900,Leaky,Sigmoid,,,75,24,17.0,,,0.000257613250882586,2,476,0.2896509821251673,1.4003226616574255e-05,295.62153984518613,COMPLETE
581,0.3591087758541107,2023-09-04 21:22:29.739978,2023-09-04 21:22:31.432396,0 days 00:00:01.692418,Tanh,Sigmoid,ReLU,Sigmoid,71,24,17.0,15.0,18.0,0.0246403954550395,4,444,0.7206516473525426,0.0010765464635669637,290.8867677200672,COMPLETE
582,0.40474480390548706,2023-09-04 21:22:31.433029,2023-09-04 21:22:43.619950,0 days 00:00:12.186921,Leaky,Sigmoid,,,77,23,16.0,,,0.0003124169850667947,2,454,0.7716673736499874,0.00011942127301398565,159.8235537995326,COMPLETE
583,0.35763823986053467,2023-09-04 21:22:43.620556,2023-09-04 21:22:44.626366,0 days 00:00:01.005810,Leaky,Sigmoid,,,78,24,13.0,,,0.02549564499253783,2,432,0.42453489546324774,8.028669778267625e-05,139.24713197301645,COMPLETE
584,0.5607137680053711,2023-09-04 21:22:44.626980,2023-09-04 21:22:44.939940,0 days 00:00:00.312960,Sigmoid,Sigmoid,,,73,15,17.0,,,0.0350360313420824,2,457,0.1375552588276618,0.0026283825417532827,195.7481966291155,COMPLETE
585,0.6883570551872253,2023-09-04 21:22:44.940541,2023-09-04 21:22:48.137130,0 days 00:00:03.196589,ReLU,Sigmoid,,,75,23,17.0,,,0.0001255306854681751,2,421,0.17729849181072407,1.3850347090941195e-05,641.2418685876842,COMPLETE
586,0.46290266513824463,2023-09-04 21:22:48.137738,2023-09-04 21:23:04.204540,0 days 00:00:16.066802,Leaky,Sigmoid,Sigmoid,ReLU,74,24,15.0,21.0,4.0,0.000408001142500297,4,449,0.7412202175314944,1.1834981876565234e-05,150.85325580078668,COMPLETE
587,0.33500149846076965,2023-09-04 21:23:04.205180,2023-09-04 21:23:05.355837,0 days 00:00:01.150657,Leaky,Sigmoid,Tanh,,79,23,18.0,12.0,,0.01956345958398661,3,153,0.6510866813438523,0.0007353607840672524,162.3417673110962,COMPLETE
588,0.38823336362838745,2023-09-04 21:23:05.356473,2023-09-04 21:23:06.364248,0 days 00:00:01.007775,Leaky,Sigmoid,,,41,24,14.0,,,0.030317186813176553,2,463,0.3398059586571883,9.724659890934064e-05,243.53898263484874,COMPLETE
589,0.4054535925388336,2023-09-04 21:23:06.364854,2023-09-04 21:23:06.970824,0 days 00:00:00.605970,Tanh,ReLU,,,72,23,18.0,,,0.014192820404869537,2,387,0.378600939932324,1.5216207157967448e-05,191.4663835797991,COMPLETE
590,0.317687451839447,2023-09-04 21:23:06.971436,2023-09-04 21:23:11.078022,0 days 00:00:04.106586,Leaky,Sigmoid,,,37,24,16.0,,,0.003705142247079547,2,440,0.7119116841186035,1.9603105562253483e-05,226.60927967189514,COMPLETE
591,0.3727545440196991,2023-09-04 21:23:11.078627,2023-09-04 21:23:11.791924,0 days 00:00:00.713297,Leaky,Leaky,,,50,23,21.0,,,0.01630169102512581,2,129,0.28120693375480865,0.00016694963983538178,157.97297789833763,COMPLETE
592,0.34213361144065857,2023-09-04 21:23:11.792519,2023-09-04 21:23:13.479447,0 days 00:00:01.686928,Leaky,ReLU,,,44,24,18.0,,,0.005308464494546063,2,264,0.4459193970756593,0.00023441054827728206,143.06612908662254,COMPLETE
593,0.4288580119609833,2023-09-04 21:23:13.480053,2023-09-04 21:23:23.847230,0 days 00:00:10.367177,Leaky,Sigmoid,ReLU,Sigmoid,46,23,16.0,13.0,17.0,0.00034929112870478,4,178,0.773263721951891,1.720908655186473e-05,386.83062551262674,COMPLETE
594,0.4643014669418335,2023-09-04 21:23:23.847884,2023-09-04 21:23:26.779989,0 days 00:00:02.932105,Tanh,Sigmoid,,,69,24,17.0,,,0.002143939469631506,2,402,0.2700193089686454,0.0013452328478281226,255.067080676784,COMPLETE
595,0.3598082363605499,2023-09-04 21:23:26.780614,2023-09-04 21:23:28.046571,0 days 00:00:01.265957,Leaky,ReLU,,,52,22,22.0,,,0.020643360659455684,2,341,0.7987643534925083,2.9697474636582543e-05,114.82558274269104,COMPLETE
596,0.6961919069290161,2023-09-04 21:23:28.047193,2023-09-04 21:23:29.376688,0 days 00:00:01.329495,Leaky,Sigmoid,,,76,23,18.0,,,0.0002037651083818289,2,163,0.19222938680502055,0.00013755926288863237,268.9138714843001,COMPLETE
597,0.3418586552143097,2023-09-04 21:23:29.377316,2023-09-04 21:23:31.322638,0 days 00:00:01.945322,Leaky,ReLU,,,57,24,21.0,,,0.015117753692738434,2,466,0.7372790078019598,0.00010917483271110296,107.80230462962183,COMPLETE
598,0.6692533493041992,2023-09-04 21:23:31.323248,2023-09-04 21:23:36.603022,0 days 00:00:05.279774,Leaky,Sigmoid,,,39,23,17.0,,,4.043613517529058e-05,2,137,0.6776330608942596,1.1900840522864056e-05,120.60786967033887,COMPLETE
599,0.401755154132843,2023-09-04 21:23:36.603639,2023-09-04 21:23:37.606925,0 days 00:00:01.003286,Tanh,Sigmoid,Leaky,Tanh,35,24,20.0,14.0,13.0,0.023785696329923393,4,181,0.17950391393530016,7.172995846914215e-05,142.72768387140013,COMPLETE
600,0.6947982907295227,2023-09-04 21:23:37.607571,2023-09-04 21:23:38.746876,0 days 00:00:01.139305,Leaky,ReLU,,,42,22,18.0,,,0.0005980195637576731,2,121,0.15172304933368844,2.2654288236607617e-05,162.84971568210065,COMPLETE
601,0.3218633234500885,2023-09-04 21:23:38.747482,2023-09-04 21:23:40.124914,0 days 00:00:01.377432,Leaky,Sigmoid,,,44,23,7.0,,,0.01240766274251056,2,144,0.7544442671095686,1.0212952732531646e-05,272.61674407034207,COMPLETE
602,0.34578636288642883,2023-09-04 21:23:40.125522,2023-09-04 21:23:42.711711,0 days 00:00:02.586189,Leaky,ReLU,,,48,24,15.0,,,0.006204305878171443,2,155,0.5988276214046494,0.0016581308349099958,160.79195089901194,COMPLETE
603,0.5432533621788025,2023-09-04 21:23:42.712322,2023-09-04 21:23:43.858436,0 days 00:00:01.146114,Leaky,Sigmoid,Tanh,Sigmoid,97,23,21.0,11.0,7.0,0.08918751823194668,4,326,0.7056818538051479,1.4737175792079203e-05,180.57261308942523,COMPLETE
604,0.3917281925678253,2023-09-04 21:23:43.859088,2023-09-04 21:23:46.146597,0 days 00:00:02.287509,Sigmoid,Tanh,,,32,12,14.0,,,0.0372767243703305,2,304,0.5620222784300827,0.0009509736163672127,186.55912056615796,COMPLETE
605,0.42957237362861633,2023-09-04 21:23:46.147217,2023-09-04 21:23:57.331609,0 days 00:00:11.184392,Tanh,ReLU,,,37,22,19.0,,,0.00020941874386688493,2,361,0.5111802708008251,3.152289584701753e-05,172.644094620385,COMPLETE
606,0.39608609676361084,2023-09-04 21:23:57.332235,2023-09-04 21:23:58.151199,0 days 00:00:00.818964,Leaky,Leaky,,,70,16,18.0,,,0.01709149949827086,2,150,0.41103011187357247,0.00018447219193732287,191.58612742322558,COMPLETE
607,0.8896451592445374,2023-09-04 21:23:58.151818,2023-09-04 21:24:10.568626,0 days 00:00:12.416808,Leaky,Sigmoid,,,40,17,17.0,,,1.0216263929390003e-05,2,281,0.7995398504126392,2.5134483524685264e-05,220.06268647217667,COMPLETE
608,0.3577408194541931,2023-09-04 21:24:10.569232,2023-09-04 21:24:12.203216,0 days 00:00:01.633984,Leaky,Tanh,,,77,23,22.0,,,0.004670349164861105,2,166,0.5345154415217489,4.27080613568559e-05,189.20150988615012,COMPLETE
609,0.3208376467227936,2023-09-04 21:24:12.203834,2023-09-04 21:24:13.222787,0 days 00:00:01.018953,ReLU,Sigmoid,,,100,24,20.0,,,0.027990411234821932,2,396,0.7342183591350108,0.0002731610522278188,323.0478820800781,COMPLETE
610,0.3547525703907013,2023-09-04 21:24:13.223415,2023-09-04 21:24:14.342988,0 days 00:00:01.119573,Leaky,ReLU,ReLU,Sigmoid,83,24,20.0,16.0,11.0,0.010803883362275063,4,193,0.4684673010028536,1.2796860577568036e-05,248.69312916631284,COMPLETE
611,0.3334807753562927,2023-09-04 21:24:14.343635,2023-09-04 21:24:15.191887,0 days 00:00:00.848252,Leaky,Tanh,,,72,22,16.0,,,0.013556468696455836,2,143,0.360007307024457,1.716367563167188e-05,130.17032269069128,COMPLETE
612,0.3160777688026428,2023-09-04 21:24:15.192500,2023-09-04 21:24:17.290589,0 days 00:00:02.098089,Tanh,Sigmoid,,,86,23,21.0,,,0.008464998600647105,2,425,0.6589233966235305,0.0001419229121914782,178.8861494478972,COMPLETE
613,0.33947470784187317,2023-09-04 21:24:17.291225,2023-09-04 21:24:19.452386,0 days 00:00:02.161161,Leaky,Tanh,Tanh,,74,23,19.0,22.0,,0.003976267042587502,3,132,0.768466257462205,0.00022319006930097935,573.750000484406,COMPLETE
614,0.3553946912288666,2023-09-04 21:24:19.453012,2023-09-04 21:24:23.420425,0 days 00:00:03.967413,Leaky,ReLU,,,43,24,18.0,,,0.0014712040796771892,2,472,0.40051121842681675,3.698083185002701e-05,137.24084883795845,COMPLETE
615,0.3244389593601227,2023-09-04 21:24:23.421045,2023-09-04 21:24:24.992727,0 days 00:00:01.571682,Leaky,Sigmoid,,,98,22,17.0,,,0.02091037932501158,2,174,0.6211203640414744,2.0180438210407044e-05,123.97699913611778,COMPLETE
616,0.6190690994262695,2023-09-04 21:24:24.993354,2023-09-04 21:24:34.064065,0 days 00:00:09.070711,Leaky,Tanh,,,81,23,19.0,,,1.3290531549776845e-05,2,380,0.6952006879599962,1.00712288844666e-05,122.58121167233115,COMPLETE
617,0.3236859142780304,2023-09-04 21:24:34.064685,2023-09-04 21:24:36.877357,0 days 00:00:02.812672,Tanh,Tanh,,,40,24,20.0,,,0.0070597613277668825,2,212,0.7431091422894128,1.333618274510949e-05,144.58408829660127,COMPLETE
618,0.35767191648483276,2023-09-04 21:24:36.877970,2023-09-04 21:24:38.211942,0 days 00:00:01.333972,Leaky,ReLU,,,96,23,21.0,,,0.01782470720509223,2,156,0.7711827360747523,8.763457811531819e-05,133.7609999730037,COMPLETE
619,0.31503209471702576,2023-09-04 21:24:38.212566,2023-09-04 21:24:40.496597,0 days 00:00:02.284031,Leaky,Sigmoid,Sigmoid,Leaky,79,24,15.0,19.0,16.0,0.010491497295437425,4,312,0.7130251891748863,4.897514775983526e-05,213.90010278875178,COMPLETE
620,0.35395538806915283,2023-09-04 21:24:40.497243,2023-09-04 21:24:48.391340,0 days 00:00:07.894097,Leaky,Tanh,,,46,22,13.0,,,0.0009682435006660782,2,410,0.7999360928200926,1.6268245277697615e-05,130.933941388371,COMPLETE
621,0.35454821586608887,2023-09-04 21:24:48.391993,2023-09-04 21:24:51.272909,0 days 00:00:02.880916,Leaky,Sigmoid,,,42,24,18.0,,,0.013414746419604794,2,118,0.6754305723733584,0.0007133468351310528,129.20705893100836,COMPLETE
622,0.3189162015914917,2023-09-04 21:24:51.273525,2023-09-04 21:24:53.636332,0 days 00:00:02.362807,Tanh,ReLU,,,38,23,20.0,,,0.008902594598562968,2,164,0.7383849749847061,0.00011234846074157097,131.7734235367685,COMPLETE
623,0.35479268431663513,2023-09-04 21:24:53.636969,2023-09-04 21:24:56.796841,0 days 00:00:03.159872,Leaky,Tanh,ReLU,Sigmoid,35,22,19.0,17.0,19.0,0.005133577671874016,4,297,0.6459643685623228,0.0001790227229355819,224.07333931556116,COMPLETE
624,0.3671373426914215,2023-09-04 21:24:56.797494,2023-09-04 21:25:02.046350,0 days 00:00:05.248856,Leaky,Sigmoid,,,44,24,17.0,,,0.0007722055405418026,2,140,0.7114917715153719,5.705883376793341e-05,146.497938646589,COMPLETE
625,0.410028874874115,2023-09-04 21:25:02.046973,2023-09-04 21:25:03.683924,0 days 00:00:01.636951,Leaky,Tanh,,,76,22,18.0,,,0.002616889665226366,2,446,0.2680700835889225,1.1895180567162892e-05,283.15549184761795,COMPLETE
626,0.45893895626068115,2023-09-04 21:25:03.684569,2023-09-04 21:25:04.539709,0 days 00:00:00.855140,Leaky,ReLU,,,55,11,19.0,,,0.08548326624607751,2,492,0.5841101034143058,0.0008132300196862311,198.50326538085938,COMPLETE
627,0.8012523055076599,2023-09-04 21:25:04.540337,2023-09-04 21:25:11.369192,0 days 00:00:06.828855,Tanh,Sigmoid,,,48,13,16.0,,,1.906309626568153e-05,2,184,0.7701482846971934,2.066292463239124e-05,112.86842242531155,COMPLETE
628,0.4345891773700714,2023-09-04 21:25:11.369809,2023-09-04 21:25:11.961538,0 days 00:00:00.591729,Leaky,Tanh,Tanh,ReLU,95,23,22.0,24.0,9.0,0.05076529175394755,4,157,0.4420912214730368,0.0011869964958229654,894.2418111165365,COMPLETE
629,0.33942869305610657,2023-09-04 21:25:11.962193,2023-09-04 21:25:15.168243,0 days 00:00:03.206050,Sigmoid,Sigmoid,,,41,23,11.0,,,0.01575439223854123,2,272,0.6865011563177595,3.1300270508208825e-05,188.01830282556006,COMPLETE
630,0.4335200786590576,2023-09-04 21:25:15.168881,2023-09-04 21:25:15.542998,0 days 00:00:00.374117,Leaky,Leaky,,,98,21,10.0,,,0.07340177266951327,2,150,0.34998477617175944,1.4841594242745598e-05,139.76156799316405,COMPLETE
631,0.407107412815094,2023-09-04 21:25:15.543615,2023-09-04 21:25:17.612296,0 days 00:00:02.068681,Leaky,,,,71,24,,,,0.011028237438512879,1,127,0.7495817243642608,0.00020850739705503328,171.0786885465129,COMPLETE
632,0.4808310866355896,2023-09-04 21:25:17.612893,2023-09-04 21:25:18.222545,0 days 00:00:00.609652,Leaky,ReLU,Tanh,,30,23,18.0,12.0,,0.04123807971691151,3,173,0.25483648419217536,0.00014437801307606393,177.82014049183238,COMPLETE
633,0.4067254066467285,2023-09-04 21:25:18.223187,2023-09-04 21:25:19.505665,0 days 00:00:01.282478,ReLU,Tanh,,,45,24,20.0,,,0.006560234530762846,2,200,0.3060219075788366,2.448066989594986e-05,151.36087922792177,COMPLETE
634,0.6021003723144531,2023-09-04 21:25:19.506292,2023-09-04 21:25:22.804508,0 days 00:00:03.298216,Leaky,Sigmoid,,,36,22,21.0,,,7.919215481649806e-05,2,134,0.3857145015243043,1.7538550762448046e-05,123.56933064247245,COMPLETE
635,0.37574782967567444,2023-09-04 21:25:22.805151,2023-09-04 21:25:24.435793,0 days 00:00:01.630642,Tanh,Tanh,,,39,23,17.0,,,0.018595962014473597,2,231,0.49942776113492293,1.1658567750153407e-05,191.73678927951389,COMPLETE
636,0.29513266682624817,2023-09-04 21:25:24.436409,2023-09-04 21:25:28.554726,0 days 00:00:04.118317,Leaky,ReLU,,,26,24,19.0,,,0.008184904114520974,2,288,0.7206511116380794,0.00027673646832884855,237.0365001621531,COMPLETE
637,0.3345845639705658,2023-09-04 21:25:28.555346,2023-09-04 21:25:30.832271,0 days 00:00:02.276925,Leaky,ReLU,,,42,24,19.0,,,0.008145498055082656,2,289,0.717396871639977,0.00033857908599133806,117.71407903943744,COMPLETE
638,0.3267122507095337,2023-09-04 21:25:30.832888,2023-09-04 21:25:56.223284,0 days 00:00:25.390396,Leaky,ReLU,,,25,24,20.0,,,0.0002660313860166343,2,385,0.7708498610971656,0.0002618694712086756,143.88958439021917,COMPLETE
639,0.5337016582489014,2023-09-04 21:25:56.223923,2023-09-04 21:25:56.750661,0 days 00:00:00.526738,Leaky,ReLU,,,21,24,19.0,,,0.005841931020296354,2,149,0.11948328833302171,0.0005389371467581078,196.3617191859654,COMPLETE
640,0.31594255566596985,2023-09-04 21:25:56.751280,2023-09-04 21:26:00.540896,0 days 00:00:03.789616,Leaky,ReLU,,,21,24,20.0,,,0.0068618700797419665,2,166,0.7315500484082031,0.0004542203524117631,233.14123422128182,COMPLETE
641,0.8837139010429382,2023-09-04 21:26:00.541520,2023-09-04 21:26:03.459318,0 days 00:00:02.917798,Leaky,ReLU,,,51,24,19.0,,,2.9412075629777688e-05,2,281,0.2083745972407626,1.003130255200862e-05,370.57788846161867,COMPLETE
642,0.36726897954940796,2023-09-04 21:26:03.459953,2023-09-04 21:26:05.000948,0 days 00:00:01.540995,Leaky,ReLU,,,74,24,19.0,,,0.00862270594716454,2,393,0.6991776901846773,0.00034340999676648226,177.02501450923452,COMPLETE
643,0.34246957302093506,2023-09-04 21:26:05.001575,2023-09-04 21:26:07.962336,0 days 00:00:02.960761,Leaky,ReLU,,,100,24,20.0,,,0.0020115487416655846,2,189,0.798535485362155,0.004405014950208526,135.83714390602432,COMPLETE
644,0.44561415910720825,2023-09-04 21:26:07.962966,2023-09-04 21:26:08.786756,0 days 00:00:00.823790,Leaky,ReLU,,,44,23,22.0,,,0.004467428095460615,2,141,0.2417233718131037,0.0003032734436025504,179.2110949925014,COMPLETE
645,0.50603187084198,2023-09-04 21:26:08.787391,2023-09-04 21:26:25.326232,0 days 00:00:16.538841,Leaky,ReLU,,,40,24,3.0,,,0.0001565857117477821,2,402,0.7530213750935839,6.112105015495125e-05,143.04194956157932,COMPLETE
646,0.34545478224754333,2023-09-04 21:26:25.326864,2023-09-04 21:26:28.065509,0 days 00:00:02.738645,Leaky,ReLU,,,47,23,20.0,,,0.0017354314606479624,2,174,0.6624679606777493,7.498019606608453e-05,142.50332321355373,COMPLETE
647,0.4870043098926544,2023-09-04 21:26:28.066162,2023-09-04 21:26:38.437942,0 days 00:00:10.371780,Leaky,ReLU,,,22,21,21.0,,,0.0004972176692289308,2,160,0.7164491462811,0.02046705150808477,668.3578750610352,COMPLETE
648,0.32039913535118103,2023-09-04 21:26:38.438564,2023-09-04 21:26:41.258183,0 days 00:00:02.819619,Leaky,Sigmoid,,,17,24,19.0,,,0.02935342750380713,2,368,0.7515331581360067,0.0003919105176230003,155.90368342399597,COMPLETE
649,0.4100431799888611,2023-09-04 21:26:41.258825,2023-09-04 21:26:42.826495,0 days 00:00:01.567670,Leaky,ReLU,,,28,23,14.0,,,0.005900046270642348,2,416,0.18116054051349018,0.007782882607650975,184.90503169041054,COMPLETE
650,0.4064784348011017,2023-09-04 21:26:42.827110,2023-09-04 21:26:43.451986,0 days 00:00:00.624876,Leaky,Sigmoid,,,78,22,20.0,,,0.023050779473024554,2,452,0.21309484093304046,0.00011172259718182587,147.5625624223189,COMPLETE
651,0.5835897922515869,2023-09-04 21:26:43.452613,2023-09-04 21:26:44.656919,0 days 00:00:01.204306,Leaky,ReLU,,,43,24,19.0,,,0.0003471324736484403,2,148,0.12046615952947505,8.740381816291572e-05,244.83722449637747,COMPLETE
652,0.5114275217056274,2023-09-04 21:26:44.657595,2023-09-04 21:26:56.428155,0 days 00:00:11.770560,Leaky,Sigmoid,,,14,23,15.0,,,0.00024376568335494433,2,113,0.7740862295241796,2.6901868647496376e-05,170.19310146095478,COMPLETE
653,0.8004388809204102,2023-09-04 21:26:56.428806,2023-09-04 21:27:00.605257,0 days 00:00:04.176451,Leaky,Sigmoid,,,49,22,21.0,,,3.821322151305393e-05,2,124,0.6873419336807395,4.1007877638067115e-05,133.87984435789048,COMPLETE
654,0.544917643070221,2023-09-04 21:27:00.605891,2023-09-04 21:27:16.395366,0 days 00:00:15.789475,Leaky,ReLU,,,16,23,19.0,,,2.4134090618499107e-05,2,181,0.7291709967996721,0.0009828368062523133,133.44227882511709,COMPLETE
655,0.26421666145324707,2023-09-04 21:27:16.396007,2023-09-04 21:27:20.365066,0 days 00:00:03.969059,Leaky,Sigmoid,,,38,21,16.0,,,0.007850101583551466,2,436,0.7739656868898668,0.0006282563478552469,132.54242302905553,COMPLETE
656,0.40181174874305725,2023-09-04 21:27:20.365692,2023-09-04 21:27:21.779787,0 days 00:00:01.414095,Leaky,Sigmoid,,,26,21,16.0,,,0.007286586993283813,2,406,0.2249243950184644,0.0004279558770410161,301.6106713699968,COMPLETE
657,0.3099076747894287,2023-09-04 21:27:21.780411,2023-09-04 21:27:26.462969,0 days 00:00:04.682558,Leaky,Sigmoid,,,26,21,16.0,,,0.009323417262143741,2,263,0.676037882600318,0.000560051536312244,158.91986504916488,COMPLETE
658,0.3112437129020691,2023-09-04 21:27:26.463608,2023-09-04 21:27:29.969203,0 days 00:00:03.505595,Leaky,Sigmoid,,,25,20,15.0,,,0.007274096904420487,2,423,0.7158197938578109,0.0004900916841896365,182.7325801526086,COMPLETE
659,0.4384111166000366,2023-09-04 21:27:29.969834,2023-09-04 21:27:31.518157,0 days 00:00:01.548323,Leaky,Sigmoid,,,24,21,16.0,,,0.005464779125635832,2,472,0.19488922034377992,0.0009043765095935034,212.7930672224178,COMPLETE
660,0.4015089273452759,2023-09-04 21:27:31.518776,2023-09-04 21:27:32.731501,0 days 00:00:01.212725,Leaky,Sigmoid,,,38,20,15.0,,,0.010424187289109129,2,437,0.17170035539483375,0.0021969104657521416,281.948188282619,COMPLETE
661,0.31883785128593445,2023-09-04 21:27:32.732136,2023-09-04 21:27:41.639516,0 days 00:00:08.907380,Leaky,Sigmoid,,,68,21,16.0,,,0.0013452076888073017,2,435,0.6398616106409514,0.0007391102393686076,140.51957274800506,COMPLETE
662,0.6328116059303284,2023-09-04 21:27:41.640194,2023-09-04 21:27:44.573152,0 days 00:00:02.932958,Leaky,Sigmoid,,,38,21,18.0,,,0.00013920864308836217,2,436,0.10420299025371484,0.0006874737526132499,256.472255846776,COMPLETE
663,0.3698069453239441,2023-09-04 21:27:44.573777,2023-09-04 21:27:56.018099,0 days 00:00:11.444322,Leaky,Sigmoid,,,36,8,17.0,,,0.0030936489358835612,2,446,0.7495984431420145,0.0013667834730065253,167.40683911541316,COMPLETE
664,0.39170634746551514,2023-09-04 21:27:56.018732,2023-09-04 21:27:58.114287,0 days 00:00:02.095555,Sigmoid,Sigmoid,,,33,22,16.0,,,0.007908742028380034,2,464,0.2913511790159066,0.0006018455694508497,181.02409146238102,COMPLETE
665,0.36190274357795715,2023-09-04 21:27:58.114627,2023-09-04 21:27:59.134725,0 days 00:00:01.020098,Leaky,Sigmoid,,,39,21,17.0,,,0.009046573139028957,2,430,0.6989994919220924,0.0005955729594476585,150.76134326006914,COMPLETE
666,0.31822165846824646,2023-09-04 21:27:59.135060,2023-09-04 21:27:59.868406,0 days 00:00:00.733346,Leaky,Sigmoid,,,37,22,15.0,,,0.01182512645078833,2,455,0.7731182556449997,1.4404122048124782e-05,111.17567511664497,COMPLETE
