number,value,datetime_start,datetime_complete,duration,params_activation1,params_activation2,params_activation3,params_activation4,params_batch_size,params_fl1,params_fl2,params_fl3,params_fl4,params_learning_rate,params_n_layers,params_num_epochs,params_train_size,params_weight_decay,user_attrs_mre,state
1335,0.4497408866882324,2023-09-04 21:43:30.952576,2023-09-04 21:43:31.095692,0 days 00:00:00.143116,Leaky,Sigmoid,,,88,23,19.0,,,0.07244065742576133,2,117,0.11530712265715123,2.2487746796117825e-05,169.48585597446987,COMPLETE
1336,0.3967953026294708,2023-09-04 21:43:31.096238,2023-09-04 21:43:31.336773,0 days 00:00:00.240535,Leaky,Sigmoid,,,61,21,20.0,,,0.007959173311601843,2,185,0.12444997860139163,1.2309298730236295e-05,746.6818583313848,COMPLETE
1337,0.5794824361801147,2023-09-04 21:43:31.337219,2023-09-04 21:43:32.030819,0 days 00:00:00.693600,Sigmoid,Tanh,,,51,14,18.0,,,0.014750463634062391,2,149,0.7170962858986366,0.007751923998567606,169.9933598836263,COMPLETE
1338,0.32764068245887756,2023-09-04 21:43:32.031250,2023-09-04 21:43:32.583673,0 days 00:00:00.552423,Leaky,ReLU,,,86,22,21.0,,,0.021942537990937993,2,163,0.6640381006133049,0.0009146521766666199,130.02489008668994,COMPLETE
1339,0.49522948265075684,2023-09-04 21:43:32.584113,2023-09-04 21:43:33.464852,0 days 00:00:00.880739,Leaky,Sigmoid,,,95,18,17.0,,,0.0004982985197046579,2,101,0.7274232361851797,1.545733446212171e-05,131.28839186866685,COMPLETE
1340,0.3867928087711334,2023-09-04 21:43:33.465318,2023-09-04 21:43:33.861824,0 days 00:00:00.396506,Tanh,Tanh,,,90,24,22.0,,,0.009747874824939667,2,299,0.48422242911049496,0.00011727882054708187,187.6993710604581,COMPLETE
1341,0.4291806221008301,2023-09-04 21:43:33.862253,2023-09-04 21:43:34.545262,0 days 00:00:00.683009,Leaky,Sigmoid,,,34,23,15.0,,,0.01204151550003251,2,287,0.39837741660916903,0.005593083605811806,600.0132742489086,COMPLETE
1342,0.3979993462562561,2023-09-04 21:43:34.545712,2023-09-04 21:43:35.480018,0 days 00:00:00.934306,Leaky,ReLU,,,39,20,4.0,,,0.0073086946881049985,2,151,0.7669904751498412,2.8997415063434615e-05,2962.840360997087,COMPLETE
1343,0.6256875991821289,2023-09-04 21:43:35.480511,2023-09-04 21:43:35.990419,0 days 00:00:00.509908,Leaky,Tanh,,,45,24,19.0,,,0.00012315772441431907,2,173,0.12241461064378736,1.7827313469904894e-05,136.9847208805856,COMPLETE
1344,0.7165562510490417,2023-09-04 21:43:35.990861,2023-09-04 21:43:36.488597,0 days 00:00:00.497736,Leaky,Sigmoid,,,99,23,16.0,,,0.00014759054653915355,2,139,0.26082763468242814,8.511391410565327e-05,141.01215022244898,COMPLETE
1345,0.6570369601249695,2023-09-04 21:43:36.489042,2023-09-04 21:43:36.766850,0 days 00:00:00.277808,Leaky,Tanh,,,93,15,23.0,,,0.0016998261116544493,2,87,0.6436903892603812,0.07422034384111813,194.04793842022235,COMPLETE
1346,0.722798764705658,2023-09-04 21:43:36.767288,2023-09-04 21:43:43.096471,0 days 00:00:06.329183,Tanh,Sigmoid,,,36,21,1.0,,,0.000938205444538169,2,365,0.6902344815082446,1.1848220920586904e-05,238.2387582284433,COMPLETE
1347,0.3375647962093353,2023-09-04 21:43:43.096953,2023-09-04 21:43:43.966245,0 days 00:00:00.869292,ReLU,ReLU,,,24,22,20.0,,,0.01641981271616761,2,127,0.7466986587293865,3.5307958242390844e-05,194.85159824916295,COMPLETE
1348,0.35014158487319946,2023-09-04 21:43:43.966751,2023-09-04 21:43:44.884127,0 days 00:00:00.917376,Leaky,Tanh,,,96,23,17.0,,,0.004669984738123449,2,161,0.7724480736139919,5.5157070900756295e-05,134.87053680419922,COMPLETE
1349,0.6957207322120667,2023-09-04 21:43:44.884590,2023-09-04 21:43:45.350185,0 days 00:00:00.465595,Leaky,Sigmoid,,,42,20,21.0,,,0.0001858879400022025,2,57,0.36252185861436015,1.0040181369806156e-05,147.64984345017817,COMPLETE
1350,0.4319489300251007,2023-09-04 21:43:45.350637,2023-09-04 21:43:45.533125,0 days 00:00:00.182488,Leaky,Tanh,,,83,24,18.0,,,0.037361695754976144,2,340,0.23373094854164164,0.0002654944562075946,307.28014577229817,COMPLETE
1351,0.3984427750110626,2023-09-04 21:43:45.533597,2023-09-04 21:43:45.942827,0 days 00:00:00.409230,Leaky,,,,98,22,,,,0.009063927074031768,1,280,0.7236232397124508,0.00017392281856374984,471.7536826500526,COMPLETE
1352,0.35496991872787476,2023-09-04 21:43:45.943296,2023-09-04 21:43:46.698074,0 days 00:00:00.754778,Leaky,Sigmoid,,,40,24,19.0,,,0.006380550063027557,2,144,0.6991185901785464,1.346955179165542e-05,140.08733996223,COMPLETE
1353,0.3310089707374573,2023-09-04 21:43:46.698536,2023-09-04 21:43:47.483057,0 days 00:00:00.784521,Tanh,ReLU,,,28,23,22.0,,,0.012510803208233454,2,154,0.799395227289287,2.1696689871222113e-05,220.15401713053384,COMPLETE
1354,0.2854860723018646,2023-09-04 21:43:47.483532,2023-09-04 21:43:50.082349,0 days 00:00:02.598817,Leaky,Leaky,,,58,23,20.0,,,0.0019914594019262094,2,254,0.7445868950051926,0.0003685443314688267,156.4809549967448,COMPLETE
1355,0.3464120030403137,2023-09-04 21:43:50.082795,2023-09-04 21:43:50.960387,0 days 00:00:00.877592,Leaky,Tanh,,,55,22,20.0,,,0.002611723453884728,2,257,0.6687579682852008,0.0003538168351316674,250.98650211482854,COMPLETE
1356,0.6032992005348206,2023-09-04 21:43:50.960830,2023-09-04 21:43:53.626058,0 days 00:00:02.665228,Leaky,ReLU,,,57,21,20.0,,,1.556584177426297e-05,2,250,0.7027057064157827,0.00031643089795225924,177.1383629760742,COMPLETE
1357,0.36075565218925476,2023-09-04 21:43:53.626505,2023-09-04 21:43:54.553211,0 days 00:00:00.926706,Leaky,Leaky,,,58,24,20.0,,,0.001650395788844241,2,229,0.6509917716608047,0.00040991095968005817,137.47298665480182,COMPLETE
1358,0.40907806158065796,2023-09-04 21:43:54.553646,2023-09-04 21:43:54.920916,0 days 00:00:00.367270,Leaky,Leaky,,,56,23,20.0,,,0.00419461592289269,2,274,0.2228541149723441,0.0004785734447286307,159.59883187033913,COMPLETE
1359,0.3758212625980377,2023-09-04 21:43:54.921367,2023-09-04 21:43:55.497456,0 days 00:00:00.576089,Leaky,Leaky,,,59,24,20.0,,,0.004700115839621881,2,246,0.3460020981892754,0.000458415951997016,169.8185214996338,COMPLETE
1360,0.31617844104766846,2023-09-04 21:43:55.497909,2023-09-04 21:43:56.683332,0 days 00:00:01.185423,ReLU,Leaky,,,61,22,21.0,,,0.0035240607694723386,2,263,0.7346524129614223,0.00027682461005153013,128.94513607933408,COMPLETE
1361,0.5823255777359009,2023-09-04 21:43:56.683814,2023-09-04 21:43:56.926450,0 days 00:00:00.242636,Tanh,Tanh,,,57,23,19.0,,,0.0021830196282909622,2,269,0.6864496957209815,0.04227128974215526,169.2617688860212,COMPLETE
1362,0.6498823165893555,2023-09-04 21:43:56.926992,2023-09-04 21:43:57.137322,0 days 00:00:00.210330,Leaky,Leaky,,,53,23,20.0,,,0.00396538440273672,2,236,0.1178234870379891,0.0003555728865648576,235.10066959775727,COMPLETE
1363,0.380812406539917,2023-09-04 21:43:57.137759,2023-09-04 21:43:58.376814,0 days 00:00:01.239055,Sigmoid,Leaky,,,64,22,21.0,,,0.014584507987916637,2,256,0.6094673574435631,0.0002030033072574062,240.59416926184366,COMPLETE
1364,0.4174083173274994,2023-09-04 21:43:58.377609,2023-09-04 21:43:59.750677,0 days 00:00:01.373068,Leaky,Leaky,,,56,21,20.0,,,0.0019214073196601995,2,282,0.7114331780113811,0.022444974993619537,154.14901479085287,COMPLETE
1365,0.2998659312725067,2023-09-04 21:43:59.751101,2023-09-04 21:44:01.310211,0 days 00:00:01.559110,Leaky,Leaky,,,59,24,20.0,,,0.0024041601556436146,2,264,0.7433814397296606,0.0006489093941322576,125.85696805756668,COMPLETE
1366,0.3645356297492981,2023-09-04 21:44:01.311018,2023-09-04 21:44:01.823272,0 days 00:00:00.512254,Leaky,Leaky,,,60,22,19.0,,,0.005491992552362572,2,279,0.30757029408219927,0.00022879431147346493,152.0173403596225,COMPLETE
1367,0.4208771288394928,2023-09-04 21:44:01.823727,2023-09-04 21:44:02.085233,0 days 00:00:00.261506,Leaky,Leaky,,,58,23,20.0,,,0.018398027444313216,2,215,0.2702866040663162,0.0037734725021282196,212.8826785203887,COMPLETE
1368,0.6084187030792236,2023-09-04 21:44:02.085666,2023-09-04 21:44:02.374554,0 days 00:00:00.288888,Tanh,Leaky,,,62,24,19.0,,,0.001970952958354911,2,253,0.38941141843095,0.05824951883159087,144.52720578511557,COMPLETE
1369,0.3353247344493866,2023-09-04 21:44:02.374983,2023-09-04 21:44:04.764781,0 days 00:00:02.389798,Leaky,Leaky,,,61,24,21.0,,,0.0007280928404973,2,294,0.7223470314846527,0.00027273574751199265,163.26575613534578,COMPLETE
1370,0.3960703909397125,2023-09-04 21:44:04.765240,2023-09-04 21:44:07.651036,0 days 00:00:02.885796,Leaky,Leaky,,,58,21,19.0,,,0.0005984735958943701,2,284,0.46561278148463336,0.0003283127086799691,154.5692319467034,COMPLETE
1371,0.40505263209342957,2023-09-04 21:44:07.651627,2023-09-04 21:44:08.517512,0 days 00:00:00.865885,Leaky,Leaky,,,55,16,20.0,,,0.0034782324976809684,2,268,0.34018847008260966,4.247016616264447e-05,612.4475172434421,COMPLETE
1372,0.5917348861694336,2023-09-04 21:44:08.517993,2023-09-04 21:44:09.440387,0 days 00:00:00.922394,Leaky,Leaky,,,38,23,19.0,,,8.025131136909902e-05,2,243,0.1597123933801446,2.517139910959454e-05,164.2774329165863,COMPLETE
1373,0.6462308764457703,2023-09-04 21:44:09.440827,2023-09-04 21:44:11.004033,0 days 00:00:01.563206,ReLU,Leaky,,,58,22,21.0,,,6.135887544324699e-05,2,297,0.32353726115694503,0.0007617349007990509,217.78539232453113,COMPLETE
1374,0.3890513479709625,2023-09-04 21:44:11.004459,2023-09-04 21:44:12.085533,0 days 00:00:01.081074,Leaky,Leaky,,,53,23,20.0,,,0.002771504642869141,2,273,0.6818236211346153,5.278863232573003e-05,145.15414998988913,COMPLETE
1375,0.35452428460121155,2023-09-04 21:44:12.085995,2023-09-04 21:44:14.146561,0 days 00:00:02.060566,Tanh,Leaky,,,43,22,18.0,,,0.003530164805814268,2,293,0.634482252036353,0.0005710274820306346,128.29966434112376,COMPLETE
1376,0.4771827161312103,2023-09-04 21:44:14.147012,2023-09-04 21:44:14.990305,0 days 00:00:00.843293,Leaky,Leaky,,,32,20,21.0,,,0.0009521974997960005,2,288,0.1829196780647951,6.366851137440837e-05,150.83257485635625,COMPLETE
1377,0.49369460344314575,2023-09-04 21:44:14.990755,2023-09-04 21:44:15.160746,0 days 00:00:00.169991,Leaky,Leaky,,,60,24,19.0,,,0.010957726950673204,2,264,0.15171212749451043,2.9441819064122138e-05,156.32610370266823,COMPLETE
1378,0.5314487218856812,2023-09-04 21:44:15.161201,2023-09-04 21:44:15.833968,0 days 00:00:00.672767,Leaky,Leaky,,,59,19,17.0,,,0.0002559313028926325,2,281,0.13704297680133,0.0003753521856860015,144.02006124877929,COMPLETE
1379,0.46951523423194885,2023-09-04 21:44:15.834393,2023-09-04 21:44:16.336908,0 days 00:00:00.502515,Leaky,Tanh,,,56,23,18.0,,,0.0021527015221693836,2,211,0.19975140988330053,0.005636954015955504,177.02375230055588,COMPLETE
1380,0.3704945147037506,2023-09-04 21:44:16.337345,2023-09-04 21:44:16.901465,0 days 00:00:00.564120,Leaky,Leaky,,,48,21,20.0,,,0.021442384359598658,2,199,0.7510138159910943,0.0005094589625664714,122.01060955341046,COMPLETE
1381,0.39236781001091003,2023-09-04 21:44:16.901900,2023-09-04 21:44:17.309054,0 days 00:00:00.407154,Tanh,Leaky,,,54,22,19.0,,,0.013690238500165507,2,187,0.7180946977883952,0.004483599364924589,190.8856221516927,COMPLETE
1382,0.326431542634964,2023-09-04 21:44:17.309483,2023-09-04 21:44:18.571443,0 days 00:00:01.261960,Leaky,ReLU,,,37,24,14.0,,,0.0030262322085780114,2,300,0.5515613143810705,9.767200945734716e-05,125.71292856004503,COMPLETE
1383,0.3279493749141693,2023-09-04 21:44:18.571897,2023-09-04 21:44:19.009128,0 days 00:00:00.437231,Leaky,Tanh,,,63,23,20.0,,,0.016267368591356853,2,275,0.5176349684514217,0.00025243638491722123,163.3461418930365,COMPLETE
1384,0.5139464735984802,2023-09-04 21:44:19.009569,2023-09-04 21:44:20.515685,0 days 00:00:01.506116,Leaky,Tanh,,,85,23,21.0,,,0.0002797671809157004,2,176,0.655146292298259,0.0029291107024291435,144.7796670740301,COMPLETE
1385,0.3823046386241913,2023-09-04 21:44:20.516132,2023-09-04 21:44:24.303692,0 days 00:00:03.787560,Sigmoid,ReLU,,,45,20,13.0,,,0.0016496780956374378,2,274,0.7657356796337642,3.711269553836946e-05,138.2714899150168,COMPLETE
1386,0.4006020426750183,2023-09-04 21:44:24.304162,2023-09-04 21:44:25.394887,0 days 00:00:01.090725,Leaky,Tanh,,,41,24,15.0,,,0.002479825278308828,2,171,0.42452736288985676,0.00014543461142878993,140.4570636153221,COMPLETE
1387,0.5175177454948425,2023-09-04 21:44:25.395314,2023-09-04 21:44:31.085747,0 days 00:00:05.690433,ReLU,ReLU,Leaky,Sigmoid,35,22,7.0,11.0,14.0,0.0005809611561625046,4,293,0.6897806804424456,0.00795371431006279,218.1863515287536,COMPLETE
1388,0.35191819071769714,2023-09-04 21:44:31.086220,2023-09-04 21:44:33.279958,0 days 00:00:02.193738,Leaky,Tanh,,,89,23,19.0,,,0.001179038143761337,2,256,0.7436445937060082,0.00042008772629257126,117.31980082392693,COMPLETE
1389,0.4510834813117981,2023-09-04 21:44:33.280380,2023-09-04 21:44:34.263782,0 days 00:00:00.983402,Leaky,Leaky,,,39,21,16.0,,,0.011421697234649518,2,180,0.7138814667417217,0.017072229869933273,147.24931512362716,COMPLETE
1390,0.4648747444152832,2023-09-04 21:44:34.264219,2023-09-04 21:44:35.364312,0 days 00:00:01.100093,Tanh,Tanh,,,44,22,18.0,,,0.0006526855812332297,2,287,0.17005134312913925,2.0122219308489624e-05,407.3952190651711,COMPLETE
1391,0.3501181900501251,2023-09-04 21:44:35.364761,2023-09-04 21:44:37.187373,0 days 00:00:01.822612,Leaky,ReLU,,,38,24,17.0,,,0.0011882782411169644,2,224,0.7656156518012772,0.0003228213326419548,132.89362820712003,COMPLETE
1392,0.4896739721298218,2023-09-04 21:44:37.187837,2023-09-04 21:44:37.904010,0 days 00:00:00.716173,Leaky,Tanh,,,50,23,20.0,,,0.00033959759874640073,2,130,0.28242787648535195,0.00017857119135142153,145.69914568387546,COMPLETE
1393,0.3648263216018677,2023-09-04 21:44:37.904465,2023-09-04 21:44:38.382669,0 days 00:00:00.478204,Leaky,Tanh,,,42,24,19.0,,,0.009594341269726293,2,162,0.49915287358279037,0.00012037915847839927,138.11892838911578,COMPLETE
1394,0.45550161600112915,2023-09-04 21:44:38.383106,2023-09-04 21:44:38.773745,0 days 00:00:00.390639,Leaky,ReLU,,,60,22,21.0,,,0.0009966461454339029,2,195,0.12097769342444568,2.3097417725115927e-05,141.12971012012378,COMPLETE
1395,0.4538852274417877,2023-09-04 21:44:38.774173,2023-09-04 21:44:39.001336,0 days 00:00:00.227163,Leaky,Tanh,,,57,21,20.0,,,0.026968986062633676,2,120,0.1797111787216175,3.0099298957342034e-05,3105.6444839166134,COMPLETE
1396,0.5370243191719055,2023-09-04 21:44:39.001782,2023-09-04 21:44:39.306786,0 days 00:00:00.305004,Leaky,ReLU,,,87,23,21.0,,,0.018514092044001642,2,267,0.6796818590020716,0.030665865519657075,134.221249547498,COMPLETE
1397,0.4544104337692261,2023-09-04 21:44:39.307223,2023-09-04 21:44:39.625054,0 days 00:00:00.317831,Tanh,Tanh,Tanh,Tanh,66,23,18.0,10.0,8.0,0.014331790103225524,4,305,0.20908828900552445,0.0006817718261502288,164.22535366482205,COMPLETE
1398,0.346245676279068,2023-09-04 21:44:39.625515,2023-09-04 21:44:40.405165,0 days 00:00:00.779650,Leaky,Leaky,,,40,22,19.0,,,0.004919521038977535,2,141,0.7469054451862213,0.00021543515285879866,122.65942622166054,COMPLETE
1399,0.5315233469009399,2023-09-04 21:44:40.405614,2023-09-04 21:44:41.245432,0 days 00:00:00.839818,Leaky,Tanh,,,47,24,15.0,,,0.0016057763715570706,2,154,0.5999428000213608,0.036565656087647856,671.4001482678698,COMPLETE
1400,0.5319352149963379,2023-09-04 21:44:41.245991,2023-09-04 21:44:42.137278,0 days 00:00:00.891287,ReLU,ReLU,,,52,24,16.0,,,0.0001000525290595908,2,169,0.3005965011143923,1.6994611235131154e-05,122.58551386545396,COMPLETE
1401,0.4543052613735199,2023-09-04 21:44:42.137717,2023-09-04 21:44:43.499768,0 days 00:00:01.362051,Leaky,Tanh,,,34,23,20.0,,,0.0004687832119248138,2,235,0.24679135945907407,0.00029537397941371564,218.98800795534825,COMPLETE
1402,0.37956616282463074,2023-09-04 21:44:43.500219,2023-09-04 21:44:44.335874,0 days 00:00:00.835655,Leaky,,,,37,23,,,,0.006573358746575372,1,147,0.5881047363295029,0.0011081521770895974,193.36763285319012,COMPLETE
1403,0.3771054446697235,2023-09-04 21:44:44.336338,2023-09-04 21:44:44.701828,0 days 00:00:00.365490,Tanh,ReLU,,,84,22,17.0,,,0.011904862904537548,2,112,0.44496972656222195,4.439415625710535e-05,18091.990516075723,COMPLETE
1404,0.38442814350128174,2023-09-04 21:44:44.702262,2023-09-04 21:44:46.486445,0 days 00:00:01.784183,Leaky,Tanh,,,43,21,18.0,,,0.001131732082542607,2,136,0.7115530725259346,8.767360693702172e-05,142.7362443699556,COMPLETE
1405,0.34250667691230774,2023-09-04 21:44:46.486896,2023-09-04 21:44:46.910714,0 days 00:00:00.423818,Leaky,Tanh,,,41,24,19.0,,,0.021996687379828288,2,188,0.6593776441969559,0.0008325935720608222,152.72236279078894,COMPLETE
1406,0.34579211473464966,2023-09-04 21:44:46.911157,2023-09-04 21:44:52.767193,0 days 00:00:05.856036,Leaky,ReLU,Tanh,Sigmoid,36,23,21.0,17.0,17.0,0.00030545196277844083,4,278,0.7499138440750797,0.0005734381931913842,160.14447647204503,COMPLETE
1407,0.36986514925956726,2023-09-04 21:44:52.767645,2023-09-04 21:44:53.242835,0 days 00:00:00.475190,Leaky,Leaky,,,45,22,20.0,,,0.008871045516567515,2,314,0.3307582868794718,0.00023008167572360257,160.39811325073242,COMPLETE
1408,0.812972903251648,2023-09-04 21:44:53.243288,2023-09-04 21:44:54.479168,0 days 00:00:01.235880,Leaky,Tanh,,,82,23,18.0,,,1.445632267374899e-05,2,159,0.6272722084630136,7.547006998427171e-05,133.53218980705213,COMPLETE
1409,0.5572753548622131,2023-09-04 21:44:54.479597,2023-09-04 21:44:54.952216,0 days 00:00:00.472619,Tanh,Tanh,,,62,22,19.0,,,0.0012475653420438986,2,291,0.14621202726604132,0.013130858405963761,151.99250203912908,COMPLETE
1410,0.6086660623550415,2023-09-04 21:44:54.952656,2023-09-04 21:44:55.492483,0 days 00:00:00.539827,Sigmoid,ReLU,,,88,3,16.0,,,0.016374665128176726,2,124,0.7734939108873488,0.011347502144269201,171.12937265072227,COMPLETE
1411,0.40910735726356506,2023-09-04 21:44:55.492938,2023-09-04 21:44:56.748368,0 days 00:00:01.255430,Leaky,Tanh,,,40,20,20.0,,,0.001310748392713517,2,149,0.4079532293776247,0.00015819414228249217,137.70415061592254,COMPLETE
1412,0.2802974581718445,2023-09-04 21:44:56.748808,2023-09-04 21:44:57.626119,0 days 00:00:00.877311,Leaky,ReLU,,,29,21,21.0,,,0.013303434558692715,2,262,0.7265111542284238,3.4602077568988815e-05,133.10214929995328,COMPLETE
1413,0.3414074778556824,2023-09-04 21:44:57.626548,2023-09-04 21:44:58.394449,0 days 00:00:00.767901,Leaky,ReLU,,,25,20,21.0,,,0.018796273661900197,2,267,0.7247877180300596,2.7210053367502077e-05,159.23985050746373,COMPLETE
1414,0.6012962460517883,2023-09-04 21:44:58.394878,2023-09-04 21:45:03.572933,0 days 00:00:05.178055,ReLU,ReLU,,,26,21,21.0,,,1.2403268234098342e-05,2,257,0.7755429218237432,3.2894153430181016e-05,134.81368172493427,COMPLETE
1415,0.3725634515285492,2023-09-04 21:45:03.573372,2023-09-04 21:45:04.541929,0 days 00:00:00.968557,Leaky,ReLU,,,27,20,21.0,,,0.003402784262986945,2,257,0.5629211332680624,3.321042280258315e-05,129.98650606216924,COMPLETE
1416,0.49582910537719727,2023-09-04 21:45:04.542389,2023-09-04 21:45:04.863470,0 days 00:00:00.321081,Leaky,ReLU,,,28,21,21.0,,,0.014887068278500061,2,245,0.167323359655979,0.03418182998380154,127.97613237488945,COMPLETE
1417,0.44070181250572205,2023-09-04 21:45:04.863915,2023-09-04 21:45:05.641675,0 days 00:00:00.777760,Leaky,ReLU,Sigmoid,Sigmoid,25,21,21.0,9.0,15.0,0.0031243812936244046,4,250,0.13864504726963692,3.669731554343444e-05,224.26334891941235,COMPLETE
1418,0.4114990830421448,2023-09-04 21:45:05.642182,2023-09-04 21:45:05.952472,0 days 00:00:00.310290,Tanh,ReLU,,,26,21,22.0,,,0.02400111002644359,2,264,0.219969391156304,2.2919208775167275e-05,298.4965476989746,COMPLETE
1419,0.5018854141235352,2023-09-04 21:45:05.952919,2023-09-04 21:45:06.125869,0 days 00:00:00.172950,Leaky,ReLU,,,26,20,21.0,,,0.012482574841886241,2,258,0.10805246720542806,2.9385024043030713e-05,200.5307489013672,COMPLETE
1420,0.3459303677082062,2023-09-04 21:45:06.126320,2023-09-04 21:45:07.737890,0 days 00:00:01.611570,Leaky,ReLU,,,29,19,22.0,,,0.004014539670961998,2,260,0.6947582050569785,0.0022262127026094125,127.83967714309692,COMPLETE
1421,0.36858779191970825,2023-09-04 21:45:07.738324,2023-09-04 21:45:10.004040,0 days 00:00:02.265716,Leaky,ReLU,,,23,21,21.0,,,0.0013608787401285238,2,271,0.7419412331284128,4.122597893689554e-05,263.54425606360803,COMPLETE
1422,0.40699803829193115,2023-09-04 21:45:10.004503,2023-09-04 21:45:10.466661,0 days 00:00:00.462158,Leaky,ReLU,,,32,20,21.0,,,0.01759532026257519,2,276,0.20031646384299065,2.749911417705143e-05,168.75250534784226,COMPLETE
1423,0.45660972595214844,2023-09-04 21:45:10.467484,2023-09-04 21:45:17.035458,0 days 00:00:06.567974,Leaky,ReLU,,,30,21,22.0,,,4.043199979951289e-05,2,266,0.7734308807359103,1.9844940968990025e-05,146.23846576088354,COMPLETE
1424,0.4400384724140167,2023-09-04 21:45:17.035903,2023-09-04 21:45:17.348141,0 days 00:00:00.312238,Leaky,ReLU,,,30,21,22.0,,,0.028685596359291594,2,250,0.2820705820928002,2.5156388432760584e-05,177.9789072672526,COMPLETE
1425,0.6171833872795105,2023-09-04 21:45:17.348575,2023-09-04 21:45:20.451571,0 days 00:00:03.102996,Tanh,ReLU,,,22,21,21.0,,,1.0590900364982693e-05,2,271,0.37256578364397136,0.0014206934583503132,109.7230479673266,COMPLETE
1426,0.6304183602333069,2023-09-04 21:45:20.452002,2023-09-04 21:45:25.072491,0 days 00:00:04.620489,Leaky,ReLU,Tanh,Leaky,30,20,22.0,12.0,11.0,1.60847580153588e-05,4,284,0.4841617742111608,4.8606122327326195e-05,215.8093393889951,COMPLETE
1427,0.5416872501373291,2023-09-04 21:45:25.072948,2023-09-04 21:45:29.964326,0 days 00:00:04.891378,ReLU,ReLU,,,28,21,21.0,,,5.2051383176901694e-05,2,277,0.7282932689696066,0.0004254393972542531,206.89909814497193,COMPLETE
1428,0.39585697650909424,2023-09-04 21:45:29.964763,2023-09-04 21:45:31.115883,0 days 00:00:01.151120,Leaky,ReLU,,,31,20,15.0,,,0.0014813631688685661,2,245,0.7983914073092452,1.9464425895462606e-05,147.61939137776693,COMPLETE
1429,0.6350736618041992,2023-09-04 21:45:31.116347,2023-09-04 21:45:31.789104,0 days 00:00:00.672757,Leaky,ReLU,,,29,21,20.0,,,0.0008854331417414226,2,271,0.23044902729828073,0.07489543614898266,160.26629493713378,COMPLETE
1430,0.3595702648162842,2023-09-04 21:45:31.789568,2023-09-04 21:45:33.089204,0 days 00:00:01.299636,Leaky,ReLU,,,32,21,14.0,,,0.00552542613810479,2,286,0.6829780428356416,3.910703973010856e-05,838.3689846462673,COMPLETE
