number,value,datetime_start,datetime_complete,duration,params_activation1,params_activation2,params_activation3,params_activation4,params_batch_size,params_fl1,params_fl2,params_fl3,params_fl4,params_learning_rate,params_n_layers,params_num_epochs,params_train_size,params_weight_decay,user_attrs_mre,state
1072,0.26602280139923096,2023-09-04 22:25:38.393574,2023-09-04 22:25:39.361385,0 days 00:00:00.967811,Tanh,Leaky,Sigmoid,Leaky,87,18,21.0,24.0,7.0,0.008343285872331466,4,242,0.7679522714531046,0.0002601216333177942,103.5292080965909,COMPLETE
1073,0.43447789549827576,2023-09-04 22:25:39.361869,2023-09-04 22:25:39.787880,0 days 00:00:00.426011,Tanh,Leaky,Leaky,Leaky,77,17,20.0,14.0,5.0,0.012150505689077622,4,281,0.36841973774761927,0.00012037039105885776,116.43359504555757,COMPLETE
1074,0.5236353874206543,2023-09-04 22:25:39.788386,2023-09-04 22:25:40.106892,0 days 00:00:00.318506,Sigmoid,Leaky,Sigmoid,Leaky,37,19,20.0,20.0,17.0,0.027747968609419915,4,212,0.12529136735832927,1.0012149321687864e-05,267.51019041878834,COMPLETE
1075,1.0823160409927368,2023-09-04 22:25:40.107336,2023-09-04 22:25:40.636163,0 days 00:00:00.528827,ReLU,Leaky,Sigmoid,Leaky,83,21,22.0,16.0,8.0,0.015922818522289436,4,289,0.7299547990749663,0.0014661212479770154,99.86614502800836,COMPLETE
1076,0.24540723860263824,2023-09-04 22:25:40.636661,2023-09-04 22:25:43.398215,0 days 00:00:02.761554,Tanh,Leaky,Sigmoid,Leaky,81,18,5.0,15.0,21.0,0.0007676987702175302,4,226,0.7999950941084957,2.8968722560825515e-05,124.711934958939,COMPLETE
1077,0.48161229491233826,2023-09-04 22:25:43.398647,2023-09-04 22:25:43.667334,0 days 00:00:00.268687,Tanh,Leaky,ReLU,Tanh,31,20,10.0,23.0,18.0,0.020227413186231353,4,252,0.13607690585891835,0.0003068261941190401,169.24708324008517,COMPLETE
1078,0.3057630956172943,2023-09-04 22:25:43.667870,2023-09-04 22:25:44.346385,0 days 00:00:00.678515,Sigmoid,Leaky,Sigmoid,Leaky,84,15,19.0,22.0,19.0,0.03405235670301352,4,295,0.6934347363257798,0.00014969344977006153,152.42055577245253,COMPLETE
1079,0.9199641346931458,2023-09-04 22:25:44.346839,2023-09-04 22:25:44.536622,0 days 00:00:00.189783,Tanh,Leaky,Sigmoid,Leaky,89,16,21.0,17.0,20.0,0.013235100953048319,4,272,0.273335794308216,0.051669515999225105,104.33143761044457,COMPLETE
1080,0.35999932885169983,2023-09-04 22:25:44.537061,2023-09-04 22:25:44.813684,0 days 00:00:00.276623,ReLU,Leaky,Sigmoid,Leaky,86,19,19.0,15.0,5.0,0.017824779986748265,4,220,0.33862930315769346,5.520875808903058e-05,122.23327277688419,COMPLETE
1081,0.30604472756385803,2023-09-04 22:25:44.814112,2023-09-04 22:25:45.497646,0 days 00:00:00.683534,Tanh,ReLU,ReLU,Leaky,83,21,15.0,16.0,7.0,0.009727787702213478,4,236,0.5835775458254864,0.007011669817889844,124.49539034483863,COMPLETE
1082,0.44804897904396057,2023-09-04 22:25:45.498121,2023-09-04 22:25:46.381929,0 days 00:00:00.883808,Tanh,Leaky,Sigmoid,Leaky,28,22,21.0,24.0,6.0,0.07334373585756042,4,259,0.7486171349617463,9.018080548292776e-05,292.0234625680106,COMPLETE
1083,1.3596079349517822,2023-09-04 22:25:46.382389,2023-09-04 22:25:47.043976,0 days 00:00:00.661587,Sigmoid,Leaky,Sigmoid,Leaky,79,18,20.0,12.0,16.0,0.00010251099067942385,4,244,0.11730909465817245,0.00022315535834172877,110.83619618024983,COMPLETE
1084,0.9193946719169617,2023-09-04 22:25:47.044440,2023-09-04 22:25:47.311616,0 days 00:00:00.267176,Leaky,Leaky,Sigmoid,Tanh,92,20,20.0,23.0,2.0,0.02458058511274046,4,230,0.7722599584565984,0.014875412979914808,133.9076721191406,COMPLETE
1085,0.34187209606170654,2023-09-04 22:25:47.312108,2023-09-04 22:25:47.740720,0 days 00:00:00.428612,Tanh,Leaky,ReLU,Leaky,85,19,18.0,14.0,4.0,0.011185550243413223,4,79,0.45960146183958556,4.24431597886713e-05,124.43047446392953,COMPLETE
1086,0.4287513196468353,2023-09-04 22:25:47.741188,2023-09-04 22:25:48.032740,0 days 00:00:00.291552,ReLU,Leaky,Sigmoid,Leaky,81,21,21.0,16.0,17.0,0.005414986905967386,4,261,0.17677332955209277,0.00014927802238194575,134.981080433679,COMPLETE
1087,0.31409889459609985,2023-09-04 22:25:48.033224,2023-09-04 22:25:50.610482,0 days 00:00:02.577258,Tanh,Leaky,Sigmoid,Leaky,87,20,24.0,15.0,18.0,0.0006160827287963964,4,249,0.7203887946757813,0.0010802237262035688,170.74326604859442,COMPLETE
1088,0.22939766943454742,2023-09-04 22:25:50.611039,2023-09-04 22:25:51.675391,0 days 00:00:01.064352,Leaky,Leaky,Sigmoid,Leaky,39,17,20.0,23.0,8.0,0.014998021621845147,4,207,0.7481014753016484,2.0747225230660253e-05,250.38219665527345,COMPLETE
1089,0.3105151653289795,2023-09-04 22:25:51.675842,2023-09-04 22:25:52.408065,0 days 00:00:00.732223,Sigmoid,Leaky,Sigmoid,Leaky,34,19,23.0,17.0,19.0,0.046503220211727904,4,216,0.4016068400651363,6.80581531657353e-05,139.84128415143047,COMPLETE
1090,0.3785119354724884,2023-09-04 22:25:52.408520,2023-09-04 22:25:52.706031,0 days 00:00:00.297511,Tanh,Leaky,ReLU,Leaky,82,23,21.0,22.0,5.0,0.020382890036271518,4,272,0.18958003485357316,0.00018338830987709755,91.60984699146168,COMPLETE
1091,0.3039931356906891,2023-09-04 22:25:52.706453,2023-09-04 22:25:53.107930,0 days 00:00:00.401477,Leaky,Leaky,Sigmoid,Leaky,85,22,22.0,21.0,6.0,0.00828900008102802,4,238,0.6845078654281554,0.00011587828514528239,107.6323237101237,COMPLETE
1092,1.1114964485168457,2023-09-04 22:25:53.108383,2023-09-04 22:25:53.302961,0 days 00:00:00.194578,Tanh,ReLU,Sigmoid,Tanh,32,18,19.0,24.0,3.0,0.013555436267789305,4,298,0.10563578967018061,0.019487794650188062,108.7543255349864,COMPLETE
1093,0.26906323432922363,2023-09-04 22:25:53.303399,2023-09-04 22:25:53.748987,0 days 00:00:00.445588,ReLU,Leaky,Sigmoid,Leaky,83,20,20.0,16.0,7.0,0.01690132508558195,4,224,0.799830443220985,9.035533146120093e-05,125.54455697947535,COMPLETE
1094,0.3378449082374573,2023-09-04 22:25:53.749486,2023-09-04 22:25:54.408811,0 days 00:00:00.659325,Tanh,Leaky,,,89,21,22.0,,,0.006459847430854501,2,252,0.7143252812412623,0.0003641168858908547,145.9624470011393,COMPLETE
1095,1.122240662574768,2023-09-04 22:25:54.409254,2023-09-04 22:25:54.576707,0 days 00:00:00.167453,Sigmoid,Leaky,ReLU,Leaky,80,18,19.0,15.0,18.0,0.01031440472607197,4,197,0.12157381147799354,0.09738549634880359,98.23209522388599,COMPLETE
1096,0.6193875074386597,2023-09-04 22:25:54.577151,2023-09-04 22:25:54.838383,0 days 00:00:00.261232,Leaky,Leaky,Sigmoid,Leaky,78,19,21.0,24.0,20.0,0.04890857433565283,4,234,0.28348736224526455,0.009985375976681539,177.4678622159091,COMPLETE
1097,0.3209414780139923,2023-09-04 22:25:54.838832,2023-09-04 22:25:55.105121,0 days 00:00:00.266289,Tanh,Leaky,Leaky,Leaky,85,21,20.0,23.0,19.0,0.02875922933852031,4,281,0.2993860958077952,0.000240269509305337,79.34971553257533,COMPLETE
1098,0.8296031951904297,2023-09-04 22:25:55.105587,2023-09-04 22:25:57.796190,0 days 00:00:02.690603,Tanh,Leaky,Sigmoid,Leaky,87,20,21.0,13.0,1.0,2.6699900446006203e-05,4,242,0.7372507430708073,0.00029656760367953043,158.17840405929186,COMPLETE
1099,0.4274516701698303,2023-09-04 22:25:57.796629,2023-09-04 22:26:00.836756,0 days 00:00:03.040127,Leaky,Leaky,Sigmoid,Leaky,83,17,18.0,15.0,4.0,0.000437301088370782,4,263,0.7645440831422203,1.2004703528491251e-05,118.63015509195654,COMPLETE
1100,0.326975017786026,2023-09-04 22:26:00.837215,2023-09-04 22:26:02.241536,0 days 00:00:01.404321,Sigmoid,Leaky,Sigmoid,Leaky,37,18,19.0,14.0,7.0,0.023395703405833863,4,216,0.7997477293091584,0.000176254354816182,129.7283172607422,COMPLETE
1101,0.3639269173145294,2023-09-04 22:26:02.241979,2023-09-04 22:26:04.727137,0 days 00:00:02.485158,ReLU,Leaky,ReLU,Tanh,82,19,20.0,16.0,6.0,0.00018525321268951815,4,230,0.693802516074574,5.1270482063362456e-05,185.9884022588315,COMPLETE
1102,0.36877045035362244,2023-09-04 22:26:04.727566,2023-09-04 22:26:05.448111,0 days 00:00:00.720545,Tanh,Leaky,Sigmoid,Leaky,29,22,22.0,22.0,17.0,0.011922449545113031,4,255,0.5173577426404794,0.0011927921213484994,172.30485916137695,COMPLETE
1103,0.41441482305526733,2023-09-04 22:26:05.448555,2023-09-04 22:26:05.711166,0 days 00:00:00.262611,Tanh,Leaky,Sigmoid,Leaky,91,20,14.0,23.0,5.0,0.017362651009085652,4,245,0.21617467982546526,7.415196826546413e-05,131.23286562187727,COMPLETE
1104,0.26180633902549744,2023-09-04 22:26:05.711608,2023-09-04 22:26:06.105717,0 days 00:00:00.394109,Leaky,ReLU,Sigmoid,Leaky,85,21,20.0,18.0,6.0,0.014325187043730555,4,288,0.5262390849465967,0.00013981054030517593,98.78816779884133,COMPLETE
1105,0.45259636640548706,2023-09-04 22:26:06.106144,2023-09-04 22:26:06.353000,0 days 00:00:00.246856,Tanh,Leaky,ReLU,Leaky,80,19,21.0,16.0,18.0,0.019153007705715527,4,207,0.3351355362934774,0.011522539458285342,277.3014890230619,COMPLETE
1106,0.3210902810096741,2023-09-04 22:26:06.353424,2023-09-04 22:26:07.720281,0 days 00:00:01.366857,Sigmoid,Leaky,Sigmoid,Leaky,35,21,19.0,15.0,16.0,0.034595111348590196,4,269,0.7500142795928253,1.841463231930829e-05,117.15774936363346,COMPLETE
1107,0.5608157515525818,2023-09-04 22:26:07.720724,2023-09-04 22:26:08.760694,0 days 00:00:01.039970,Tanh,Leaky,Sigmoid,Tanh,87,22,20.0,17.0,20.0,0.0003835013988807509,4,225,0.24976187812465284,0.00019947192498739178,448.5351194593641,COMPLETE
1108,0.4790964722633362,2023-09-04 22:26:08.761150,2023-09-04 22:26:09.320540,0 days 00:00:00.559390,ReLU,Leaky,Sigmoid,Leaky,83,18,22.0,24.0,17.0,0.009397728636646443,4,237,0.7739889387094496,3.9991235991658375e-05,143.54378666021884,COMPLETE
1109,0.4720906913280487,2023-09-04 22:26:09.321026,2023-09-04 22:26:10.885789,0 days 00:00:01.564763,Leaky,Leaky,ReLU,Leaky,81,19,21.0,14.0,5.0,0.00032870848631365464,4,251,0.7206646069115598,2.8591201470646425e-05,130.46468207949684,COMPLETE
1110,0.6345034241676331,2023-09-04 22:26:10.886248,2023-09-04 22:26:11.168257,0 days 00:00:00.282009,Tanh,Leaky,Sigmoid,Leaky,84,17,19.0,16.0,19.0,0.012104585123124022,4,299,0.1832235909563984,0.00010562335176483295,261.5628026788885,COMPLETE
1111,0.4981187880039215,2023-09-04 22:26:11.168705,2023-09-04 22:26:11.743402,0 days 00:00:00.574697,Sigmoid,,,,89,20,,,,0.021794087773493086,1,221,0.6727612781651501,0.004916097042916624,273.07003106011285,COMPLETE
1112,0.5418661236763,2023-09-04 22:26:11.743816,2023-09-04 22:26:12.049256,0 days 00:00:00.305440,Leaky,Leaky,Sigmoid,Leaky,32,21,20.0,21.0,8.0,0.015616837796722773,4,261,0.3152407786210959,6.253463132534281e-05,1244.118425157335,COMPLETE
1113,0.3060694932937622,2023-09-04 22:26:12.049830,2023-09-04 22:26:12.453410,0 days 00:00:00.403580,Tanh,Leaky,Sigmoid,Leaky,77,16,21.0,23.0,21.0,0.013668010880576325,4,243,0.7696868821070945,0.00027429317327932985,195.99865356445312,COMPLETE
1114,0.42148175835609436,2023-09-04 22:26:12.453850,2023-09-04 22:26:12.813544,0 days 00:00:00.359694,Tanh,Leaky,Sigmoid,Leaky,86,18,20.0,15.0,4.0,0.010651400556785142,4,197,0.2742789941242238,0.00021650744113458606,150.2263641357422,COMPLETE
1115,0.5277413725852966,2023-09-04 22:26:12.814000,2023-09-04 22:26:13.207305,0 days 00:00:00.393305,ReLU,Leaky,ReLU,Leaky,38,20,22.0,24.0,7.0,0.057106649429459845,4,234,0.7117317202502048,0.00013035507685703904,150.93871053059897,COMPLETE
1116,0.3946024477481842,2023-09-04 22:26:13.207752,2023-09-04 22:26:13.660043,0 days 00:00:00.452291,Leaky,Leaky,Sigmoid,Tanh,84,19,21.0,22.0,3.0,0.025465472432806755,4,280,0.7427606495713628,7.960030838621818e-05,133.06323420206706,COMPLETE
1117,0.4767896831035614,2023-09-04 22:26:13.660526,2023-09-04 22:26:14.085106,0 days 00:00:00.424580,Tanh,Leaky,Sigmoid,Sigmoid,25,23,19.0,17.0,2.0,0.007672176604534657,4,249,0.20154290362876587,1.17950050039573e-05,222.55571844638922,COMPLETE
1118,0.6520837545394897,2023-09-04 22:26:14.085559,2023-09-04 22:26:15.763923,0 days 00:00:01.678364,Sigmoid,ReLU,Sigmoid,Leaky,82,22,20.0,11.0,6.0,0.000500426491291952,4,216,0.4425710281024976,0.00016673830776400096,152.69313268308287,COMPLETE
1119,1.4354912042617798,2023-09-04 22:26:15.764355,2023-09-04 22:26:16.051800,0 days 00:00:00.287445,Tanh,Leaky,ReLU,Sigmoid,79,17,23.0,15.0,18.0,0.01733757254144974,4,235,0.7995491221425712,0.025717443227404328,104.23484344482422,COMPLETE
1120,0.5721813440322876,2023-09-04 22:26:16.052243,2023-09-04 22:26:17.770855,0 days 00:00:01.718612,Leaky,Leaky,,,88,20,19.0,,,8.89855097609575e-05,2,272,0.5614330393411884,3.247482185571662e-05,146.27524709701538,COMPLETE
1121,0.36354222893714905,2023-09-04 22:26:17.771276,2023-09-04 22:26:18.142493,0 days 00:00:00.371217,Tanh,Leaky,Sigmoid,Leaky,86,18,21.0,23.0,19.0,0.020583479362971696,4,225,0.43552439773213697,9.997113111515824e-05,148.36037034254807,COMPLETE
1122,0.43666011095046997,2023-09-04 22:26:18.142928,2023-09-04 22:26:18.377634,0 days 00:00:00.234706,ReLU,Leaky,Leaky,Leaky,81,21,20.0,16.0,6.0,0.014050727124066157,4,260,0.16255086846598021,0.024164681492887686,142.82382015652126,COMPLETE
1123,1.116559386253357,2023-09-04 22:26:18.378062,2023-09-04 22:26:18.572858,0 days 00:00:00.194796,Sigmoid,Leaky,Sigmoid,Sigmoid,85,19,18.0,12.0,5.0,0.008915943427742415,4,207,0.5814686546640423,0.004751655657205461,101.13445698131214,COMPLETE
1124,0.4113772213459015,2023-09-04 22:26:18.573284,2023-09-04 22:26:18.879490,0 days 00:00:00.306206,Tanh,Leaky,Sigmoid,Leaky,84,19,21.0,24.0,17.0,0.011581977990706408,4,245,0.2284062147506712,4.848329750690047e-05,148.73815293745562,COMPLETE
1125,0.4669415056705475,2023-09-04 22:26:18.879932,2023-09-04 22:26:19.122067,0 days 00:00:00.242135,Leaky,Leaky,Sigmoid,Sigmoid,90,18,20.0,14.0,7.0,0.029225925802370416,4,300,0.22043043529542633,0.0003543053028311497,160.67947955009265,COMPLETE
1126,0.31380993127822876,2023-09-04 22:26:19.122518,2023-09-04 22:26:19.653824,0 days 00:00:00.531306,Tanh,Leaky,ReLU,Leaky,82,20,19.0,13.0,5.0,0.01756073466820801,4,233,0.7432852492593087,0.00019148295817865944,104.43001360770984,COMPLETE
1127,0.5037629008293152,2023-09-04 22:26:19.654292,2023-09-04 22:26:20.655922,0 days 00:00:01.001630,Tanh,Leaky,Sigmoid,Sigmoid,30,21,22.0,15.0,18.0,0.0013020474567794786,4,254,0.19564755318401592,0.0001331132638843716,165.53612693029507,COMPLETE
1128,0.39120057225227356,2023-09-04 22:26:20.656381,2023-09-04 22:26:20.945111,0 days 00:00:00.288730,Leaky,Leaky,Sigmoid,Leaky,93,18,20.0,23.0,19.0,0.01508016330335824,4,54,0.6999729045805275,0.0032836046433421294,158.274025364926,COMPLETE
1129,0.6923933625221252,2023-09-04 22:26:20.945568,2023-09-04 22:26:26.148113,0 days 00:00:05.202545,Sigmoid,Leaky,Sigmoid,Leaky,35,22,21.0,16.0,20.0,5.9277978679803995e-05,4,241,0.7643041519022249,0.0002564306510590491,150.30301985997878,COMPLETE
1130,0.4756925106048584,2023-09-04 22:26:26.148538,2023-09-04 22:26:26.301490,0 days 00:00:00.152952,ReLU,ReLU,ReLU,Tanh,87,19,20.0,20.0,8.0,0.022626375237133706,4,224,0.13398621907828812,1.7205331073627926e-05,105.17438056252219,COMPLETE
1131,0.8946804404258728,2023-09-04 22:26:26.301927,2023-09-04 22:26:27.299785,0 days 00:00:00.997858,Tanh,Leaky,Sigmoid,Sigmoid,79,17,22.0,24.0,6.0,4.815828658400703e-05,4,383,0.11516760919830958,5.76136412458165e-05,211.05983090711948,COMPLETE
1132,0.45105084776878357,2023-09-04 22:26:27.300239,2023-09-04 22:26:30.176590,0 days 00:00:02.876351,Tanh,Leaky,Sigmoid,Leaky,83,15,23.0,15.0,4.0,0.00010444647070932343,4,268,0.7197631325414882,2.461033417122421e-05,349.34064264439826,COMPLETE
1133,0.36644747853279114,2023-09-04 22:26:30.177055,2023-09-04 22:26:33.882578,0 days 00:00:03.705523,Leaky,Leaky,Sigmoid,Sigmoid,39,21,20.0,16.0,1.0,0.0007885770888985874,4,304,0.6789017750003649,0.00015729497897783474,128.8475781566692,COMPLETE
1134,0.33151471614837646,2023-09-04 22:26:33.883058,2023-09-04 22:26:35.164287,0 days 00:00:01.281229,Sigmoid,Leaky,Sigmoid,Leaky,33,20,21.0,22.0,16.0,0.01232301376973667,4,287,0.7633021157367069,1.4848383441161363e-05,414.7555745442708,COMPLETE
1135,0.5205393433570862,2023-09-04 22:26:35.164748,2023-09-04 22:26:35.412698,0 days 00:00:00.247950,Tanh,Leaky,ReLU,Leaky,81,10,19.0,17.0,7.0,0.07481680257926493,4,213,0.35816011879963056,9.014079435705519e-05,346.42908630371096,COMPLETE
1136,0.3470185101032257,2023-09-04 22:26:35.413154,2023-09-04 22:26:35.767860,0 days 00:00:00.354706,ReLU,Leaky,Sigmoid,Sigmoid,85,19,18.0,14.0,3.0,0.018783288702664137,4,195,0.2096505332421378,6.856494257742077e-05,116.83869117414447,COMPLETE
1137,0.3523673117160797,2023-09-04 22:26:35.768295,2023-09-04 22:26:36.647726,0 days 00:00:00.879431,Leaky,Leaky,Sigmoid,Leaky,27,21,19.0,23.0,2.0,0.038196835381657315,4,254,0.7287854837304087,1.1992559728834967e-05,148.17531040736608,COMPLETE
1138,0.35412782430648804,2023-09-04 22:26:36.648218,2023-09-04 22:26:37.214552,0 days 00:00:00.566334,Tanh,Leaky,Sigmoid,Sigmoid,41,16,21.0,15.0,17.0,0.005869416552773986,4,233,0.4121526037365534,0.00023934643728286046,148.04750654432507,COMPLETE
1139,0.353188693523407,2023-09-04 22:26:37.215065,2023-09-04 22:26:37.714645,0 days 00:00:00.499580,Tanh,Leaky,ReLU,Leaky,88,22,20.0,16.0,15.0,0.01006597360326889,4,275,0.47126830928104607,0.00011312347878869644,109.46119984409265,COMPLETE
1140,1.1660575866699219,2023-09-04 22:26:37.715095,2023-09-04 22:26:37.951815,0 days 00:00:00.236720,Sigmoid,Leaky,Sigmoid,Sigmoid,84,18,22.0,24.0,18.0,0.007072218252873415,4,241,0.771632942024213,0.0055450037288180985,103.40744082132976,COMPLETE
1141,0.3546333312988281,2023-09-04 22:26:37.952260,2023-09-04 22:26:38.435061,0 days 00:00:00.482801,Leaky,Leaky,Sigmoid,Tanh,80,20,21.0,18.0,8.0,0.014691350789773924,4,226,0.4177780598533146,0.00020472627451769814,119.35760631895901,COMPLETE
1142,0.3149741590023041,2023-09-04 22:26:38.435499,2023-09-04 22:26:40.211286,0 days 00:00:01.775787,Tanh,ReLU,Sigmoid,Leaky,86,19,20.0,19.0,5.0,0.0009403526337338422,4,248,0.6606455664379428,0.00030531559322130705,136.5551398756814,COMPLETE
1143,0.41338953375816345,2023-09-04 22:26:40.211722,2023-09-04 22:26:40.408534,0 days 00:00:00.196812,ReLU,Leaky,ReLU,Leaky,82,10,20.0,23.0,6.0,0.02419254153180701,4,262,0.1554409572643641,4.667937809084159e-05,115.98709201812744,COMPLETE
1144,0.4530210494995117,2023-09-04 22:26:40.408971,2023-09-04 22:26:40.627194,0 days 00:00:00.218223,Tanh,Leaky,Sigmoid,Sigmoid,77,18,19.0,16.0,19.0,0.015700112070956812,4,371,0.13990240518120223,0.0012725287335461654,167.80709838867188,COMPLETE
1145,0.5689691305160522,2023-09-04 22:26:40.627628,2023-09-04 22:26:41.940590,0 days 00:00:01.312962,Leaky,Leaky,Leaky,Leaky,83,21,21.0,22.0,17.0,7.175148793138148e-05,4,213,0.37894606377048023,0.011659394988048079,130.3227766511586,COMPLETE
1146,1.0119221210479736,2023-09-04 22:26:41.941017,2023-09-04 22:26:42.407886,0 days 00:00:00.466869,Sigmoid,Leaky,Sigmoid,ReLU,37,20,23.0,15.0,7.0,0.012246182378532568,4,293,0.7430277120150525,0.009108421858466699,101.26805920071072,COMPLETE
1147,0.670845091342926,2023-09-04 22:26:42.408341,2023-09-04 22:26:42.973736,0 days 00:00:00.565395,Tanh,Leaky,Sigmoid,Sigmoid,31,19,20.0,14.0,16.0,0.08263946116738503,4,222,0.7039934230922597,0.0001765581882939428,204.96976361955916,COMPLETE
1148,0.39146724343299866,2023-09-04 22:26:42.974173,2023-09-04 22:26:43.760288,0 days 00:00:00.786115,Tanh,Leaky,Sigmoid,Leaky,91,17,19.0,17.0,20.0,0.004462803937054634,4,239,0.4972894737442987,7.417482329476067e-05,118.07302529471261,COMPLETE
1149,0.4495829641819,2023-09-04 22:26:43.760738,2023-09-04 22:26:46.163139,0 days 00:00:02.402401,Leaky,Leaky,ReLU,Sigmoid,88,21,22.0,24.0,18.0,0.00014705663261239276,4,493,0.7727877099384693,0.0001246623434419485,116.88698448826425,COMPLETE
1150,0.27159807085990906,2023-09-04 22:26:46.163996,2023-09-04 22:26:47.561311,0 days 00:00:01.397315,Tanh,Leaky,Sigmoid,Leaky,85,23,21.0,16.0,21.0,0.019817948343252737,4,201,0.7993947265050614,9.353344231621091e-05,141.39391451103742,COMPLETE
1151,0.2168327271938324,2023-09-04 22:26:47.561758,2023-09-04 22:26:48.389837,0 days 00:00:00.828079,ReLU,Leaky,Sigmoid,Leaky,81,18,20.0,15.0,5.0,0.009576682015822253,4,252,0.7362326748831307,0.00042268265420677747,142.59358989831173,COMPLETE
1152,0.3437952995300293,2023-09-04 22:26:48.390288,2023-09-04 22:26:49.284465,0 days 00:00:00.894177,Sigmoid,Leaky,Sigmoid,Leaky,78,18,20.0,15.0,5.0,0.008031111816505955,4,256,0.5943541382038006,0.00016929461205433195,149.78814723573882,COMPLETE
1153,0.3567758798599243,2023-09-04 22:26:49.284899,2023-09-04 22:26:49.852220,0 days 00:00:00.567321,Tanh,Leaky,Sigmoid,Leaky,75,17,20.0,14.0,5.0,0.010000280022956764,4,266,0.555774906123891,0.002059638039374587,170.3733143525965,COMPLETE
1154,0.3966023623943329,2023-09-04 22:26:49.852674,2023-09-04 22:26:52.018194,0 days 00:00:02.165520,Leaky,Leaky,ReLU,Leaky,79,18,19.0,14.0,4.0,0.00013060059238591062,4,253,0.5334173936081851,0.0003868022943257041,169.76809638102534,COMPLETE
1155,0.29527702927589417,2023-09-04 22:26:52.018655,2023-09-04 22:26:52.892167,0 days 00:00:00.873512,ReLU,Leaky,Sigmoid,Leaky,81,18,20.0,15.0,5.0,0.009000970642746759,4,248,0.678550403126912,1.021556536453307e-05,125.82495137807486,COMPLETE
1156,0.670599639415741,2023-09-04 22:26:52.892640,2023-09-04 22:26:54.063446,0 days 00:00:01.170806,Tanh,Leaky,Sigmoid,Leaky,80,18,20.0,15.0,5.0,0.00023174135923208835,4,264,0.24606070725917714,3.80605922943161e-05,207.08772084207246,COMPLETE
1157,0.2885032594203949,2023-09-04 22:26:54.063920,2023-09-04 22:26:55.656777,0 days 00:00:01.592857,Tanh,Leaky,Sigmoid,Leaky,76,17,19.0,13.0,5.0,0.00750403304406828,4,259,0.7056410966728537,0.00021670487961973037,113.81156578616819,COMPLETE
1158,0.7268673777580261,2023-09-04 22:26:55.657240,2023-09-04 22:26:55.882285,0 days 00:00:00.225045,Leaky,Leaky,ReLU,Leaky,34,18,20.0,14.0,4.0,0.010141505607882595,4,274,0.10054615015202939,2.1233680649277722e-05,457.56311383928573,COMPLETE
1159,0.35272252559661865,2023-09-04 22:26:55.882738,2023-09-04 22:26:58.097012,0 days 00:00:02.214274,Sigmoid,Leaky,Sigmoid,Leaky,78,17,20.0,15.0,6.0,0.0010755464741471197,4,248,0.728184559758657,1.391074030767689e-05,140.1676304867393,COMPLETE
1160,0.6437559723854065,2023-09-04 22:26:58.097453,2023-09-04 22:26:59.392935,0 days 00:00:01.295482,Tanh,Leaky,Sigmoid,Leaky,81,19,19.0,23.0,4.0,8.437489348340574e-05,4,232,0.3148481552297587,0.00014639571145679494,106.84399321983601,COMPLETE
