number,value,datetime_start,datetime_complete,duration,params_activation1,params_activation2,params_activation3,params_activation4,params_batch_size,params_fl1,params_fl2,params_fl3,params_fl4,params_learning_rate,params_n_layers,params_num_epochs,params_train_size,params_weight_decay,user_attrs_mre,state
1605,0.6633954048156738,2023-09-04 22:41:15.096070,2023-09-04 22:41:15.533820,0 days 00:00:00.437750,Leaky,Leaky,Sigmoid,Leaky,91,11,17.0,16.0,3.0,0.011696235814781589,4,259,0.1281735783717879,1.913305922056415e-05,159.01689256940568,COMPLETE
1606,0.3314443826675415,2023-09-04 22:41:15.534813,2023-09-04 22:41:17.235398,0 days 00:00:01.700585,Tanh,ReLU,Sigmoid,Leaky,90,9,17.0,17.0,3.0,0.01631067124070732,4,260,0.7989261178782987,0.0001082005652839006,199.10181717645554,COMPLETE
1607,1.078798532485962,2023-09-04 22:41:17.236439,2023-09-04 22:41:18.234749,0 days 00:00:00.998310,Sigmoid,ReLU,ReLU,Leaky,22,10,17.0,16.0,4.0,0.026072806824168796,4,254,0.3173155426442124,0.0009579437903944321,100.10183222153607,COMPLETE
1608,0.47171980142593384,2023-09-04 22:41:18.235764,2023-09-04 22:41:18.994622,0 days 00:00:00.758858,Tanh,ReLU,Sigmoid,Leaky,89,9,17.0,15.0,4.0,0.019076803006527705,4,288,0.2619679853612817,1.581907633557983e-05,131.11194532345502,COMPLETE
1609,1.079402208328247,2023-09-04 22:41:18.995673,2023-09-04 22:41:19.799205,0 days 00:00:00.803532,ReLU,ReLU,Sigmoid,Leaky,33,10,18.0,16.0,4.0,0.014335373711564039,4,264,0.424938177102981,0.08809453025035678,110.33898221529446,COMPLETE
1610,0.22402259707450867,2023-09-04 22:41:19.800210,2023-09-04 22:41:21.422512,0 days 00:00:01.622302,Tanh,ReLU,Sigmoid,Leaky,88,11,18.0,15.0,4.0,0.02114842671767843,4,269,0.7713701768081471,0.00015025269723860474,2071.3955490112303,COMPLETE
1611,0.661188006401062,2023-09-04 22:41:21.423541,2023-09-04 22:41:36.970082,0 days 00:00:15.546541,Leaky,ReLU,Sigmoid,ReLU,37,10,16.0,17.0,2.0,5.625412193141414e-05,4,253,0.7351381646031862,1.1580558543473866e-05,150.5409689138058,COMPLETE
1612,0.4546436667442322,2023-09-04 22:41:36.971078,2023-09-04 22:41:39.031575,0 days 00:00:02.060497,Sigmoid,ReLU,Leaky,Leaky,93,9,17.0,16.0,4.0,0.011763111184805445,4,320,0.7500594694880054,0.0002482502830311796,152.67571517168466,COMPLETE
1613,0.6548961997032166,2023-09-04 22:41:39.032783,2023-09-04 22:41:51.484438,0 days 00:00:12.451655,Tanh,Leaky,ReLU,Leaky,26,10,17.0,16.0,3.0,1.8366251116312775e-05,4,298,0.3697213769465072,3.380348105447662e-05,136.73040512904225,COMPLETE
1614,0.9179712533950806,2023-09-04 22:41:51.485437,2023-09-04 22:41:52.387694,0 days 00:00:00.902257,Tanh,ReLU,Sigmoid,Leaky,28,11,22.0,16.0,4.0,0.01629302983943152,4,310,0.2379595925242735,0.03557531111521019,101.62062875848068,COMPLETE
1615,0.4208635985851288,2023-09-04 22:41:52.388708,2023-09-04 22:41:54.240068,0 days 00:00:01.851360,ReLU,ReLU,Sigmoid,Leaky,53,10,19.0,15.0,3.0,0.012927869259095896,4,282,0.4409495089430856,0.00012672688140315477,192.0169219970703,COMPLETE
1616,0.4300321638584137,2023-09-04 22:41:54.241058,2023-09-04 22:41:56.701357,0 days 00:00:02.460299,Sigmoid,ReLU,Tanh,Leaky,31,11,18.0,17.0,17.0,0.02981685866038834,4,255,0.49247392180224303,0.0018205689910732285,167.64238689256752,COMPLETE
1617,0.39156362414360046,2023-09-04 22:41:56.702345,2023-09-04 22:42:00.931276,0 days 00:00:04.228931,Tanh,ReLU,Sigmoid,Leaky,88,10,16.0,15.0,20.0,0.00044707690798015284,4,267,0.7706399396588113,0.0001639040493215941,136.40230887276786,COMPLETE
1618,0.8097851276397705,2023-09-04 22:42:00.932285,2023-09-04 22:42:09.196076,0 days 00:00:08.263791,Leaky,Leaky,ReLU,Leaky,87,9,23.0,15.0,4.0,1.7578638245843455e-05,4,247,0.7293000994603452,0.006643928146499234,104.7828610686638,COMPLETE
1619,0.35648730397224426,2023-09-04 22:42:09.197092,2023-09-04 22:42:10.820614,0 days 00:00:01.623522,Tanh,ReLU,Sigmoid,ReLU,90,11,16.0,18.0,19.0,0.010685521020292625,4,286,0.7594697376281333,0.000598905684754845,338.7274645850772,COMPLETE
1620,0.48154416680336,2023-09-04 22:42:10.821597,2023-09-04 22:42:17.327948,0 days 00:00:06.506351,ReLU,Leaky,Sigmoid,Leaky,34,9,21.0,16.0,16.0,9.388290954868284e-05,4,432,0.15586326458078495,0.00010102611848720965,118.17360853265833,COMPLETE
1621,0.35619211196899414,2023-09-04 22:42:17.328937,2023-09-04 22:42:19.115364,0 days 00:00:01.786427,Sigmoid,Leaky,Sigmoid,Leaky,30,10,18.0,13.0,5.0,0.019786282135558397,4,302,0.5466992908736173,0.00019552806519484737,135.32559503827775,COMPLETE
1622,0.5570126175880432,2023-09-04 22:42:19.116388,2023-09-04 22:42:19.629228,0 days 00:00:00.512840,Tanh,Leaky,ReLU,Leaky,36,11,19.0,15.0,9.0,0.044046561064572345,4,253,0.10454364156083504,0.0003662705742041896,430.5217756791548,COMPLETE
1623,0.3002314269542694,2023-09-04 22:42:19.630257,2023-09-04 22:42:23.830629,0 days 00:00:04.200372,Leaky,Leaky,Sigmoid,Leaky,32,10,21.0,14.0,14.0,0.0019026980023792086,4,195,0.7975920228176455,0.00023760189140767195,143.7002128745025,COMPLETE
1624,0.24015912413597107,2023-09-04 22:42:23.831633,2023-09-04 22:42:25.857104,0 days 00:00:02.025471,Tanh,Leaky,Sigmoid,Leaky,87,11,22.0,16.0,18.0,0.014935121603492477,4,275,0.7994370708035544,0.0004427434013324894,247.04687089186447,COMPLETE
1625,0.9842367172241211,2023-09-04 22:42:25.858120,2023-09-04 22:42:26.731980,0 days 00:00:00.873860,Tanh,Leaky,Sigmoid,Leaky,38,23,19.0,17.0,15.0,0.02608257545733399,4,245,0.5092214011259584,0.015376397833390199,107.63405663626534,COMPLETE
1626,0.29541751742362976,2023-09-04 22:42:26.732966,2023-09-04 22:42:29.387174,0 days 00:00:02.654208,Sigmoid,Leaky,Sigmoid,Leaky,91,10,20.0,15.0,17.0,0.01765596259835353,4,205,0.7266911816872863,0.00013418321727013888,145.1659492286476,COMPLETE
1627,0.3283388018608093,2023-09-04 22:42:29.388175,2023-09-04 22:42:30.633070,0 days 00:00:01.244895,ReLU,Tanh,ReLU,Leaky,58,20,21.0,16.0,5.0,0.01209860808673789,4,295,0.46962047919548916,3.744680539857395e-05,117.07097734723773,COMPLETE
1628,0.3986078202724457,2023-09-04 22:42:30.634126,2023-09-04 22:42:32.249573,0 days 00:00:01.615447,Tanh,,,,89,21,,,,0.022108129449513632,1,261,0.701035086752512,0.0007211551895813999,154.93199375697546,COMPLETE
1629,0.279485821723938,2023-09-04 22:42:32.250523,2023-09-04 22:42:33.632557,0 days 00:00:01.382034,Leaky,Leaky,Sigmoid,Leaky,94,9,14.0,15.0,2.0,0.034095264640255016,4,232,0.7676507308359813,1.2115043145922531e-05,249.71131981743707,COMPLETE
1630,0.5618497729301453,2023-09-04 22:42:33.633619,2023-09-04 22:42:35.378491,0 days 00:00:01.744872,Tanh,Leaky,Sigmoid,ReLU,27,22,17.0,14.0,19.0,0.06320579767405747,4,447,0.6462087048162776,9.495349777599573e-05,189.73039474487305,COMPLETE
1631,0.4934961497783661,2023-09-04 22:42:35.379631,2023-09-04 22:42:39.544922,0 days 00:00:04.165291,Sigmoid,Sigmoid,Sigmoid,Leaky,29,21,21.0,16.0,18.0,0.009877387101373944,4,267,0.7402432433596806,0.00015471565540739647,177.5196160536546,COMPLETE
1632,0.49565815925598145,2023-09-04 22:42:39.545944,2023-09-04 22:42:40.554037,0 days 00:00:01.008093,ReLU,Leaky,ReLU,Leaky,40,20,20.0,12.0,21.0,0.013773247330191534,4,247,0.17004846198021661,0.001097257475358254,182.66400566101075,COMPLETE
1633,0.46559450030326843,2023-09-04 22:42:40.555035,2023-09-04 22:42:41.363044,0 days 00:00:00.808009,Tanh,Leaky,,,87,22,22.0,,,0.017187629746512213,2,215,0.2691339352599805,0.02328656732876668,228.2990271935096,COMPLETE
1634,0.26332855224609375,2023-09-04 22:42:41.364105,2023-09-04 22:42:46.704722,0 days 00:00:05.340617,Leaky,ReLU,Sigmoid,Leaky,35,20,15.0,17.0,5.0,0.0023983082202474774,4,315,0.6928748619303909,0.0003023178184823322,96.76529739016578,COMPLETE
1635,0.28263339400291443,2023-09-04 22:42:46.705722,2023-09-04 22:42:49.426692,0 days 00:00:02.720970,Tanh,Leaky,Sigmoid,Leaky,32,10,20.0,16.0,16.0,0.011238003200435744,4,257,0.4199350961262787,0.0001936132010750249,104.39472358457503,COMPLETE
1636,0.6903070211410522,2023-09-04 22:42:49.427706,2023-09-04 22:42:51.282931,0 days 00:00:01.855225,Sigmoid,Leaky,Sigmoid,Leaky,86,21,19.0,15.0,17.0,0.00021746952242475518,4,285,0.10091089330829514,1.6963988777477928e-05,118.41080686334978,COMPLETE
1637,0.3806699216365814,2023-09-04 22:42:51.283934,2023-09-04 22:42:59.220905,0 days 00:00:07.936971,Tanh,Leaky,Leaky,Leaky,90,12,22.0,18.0,18.0,6.323941975537793e-05,4,240,0.7668313889744144,0.00010988929202784676,125.928071753184,COMPLETE
1638,0.39075708389282227,2023-09-04 22:42:59.221928,2023-09-04 22:43:01.393035,0 days 00:00:02.171107,ReLU,Leaky,Sigmoid,ReLU,62,20,21.0,14.0,1.0,0.014261095028679619,4,227,0.7311922346525074,0.0022724537407905134,105.64021942832254,COMPLETE
1639,0.31815943121910095,2023-09-04 22:43:01.394043,2023-09-04 22:43:01.979834,0 days 00:00:00.585791,Tanh,Leaky,ReLU,,66,11,20.0,17.0,,0.022075006478430418,3,275,0.180525954161808,2.0923615913681757e-05,101.34957022415965,COMPLETE
1640,0.27479591965675354,2023-09-04 22:43:01.980834,2023-09-04 22:43:04.697284,0 days 00:00:02.716450,Leaky,Leaky,Sigmoid,Leaky,42,20,18.0,15.0,2.0,0.01790581325826316,4,252,0.7721159121453763,0.009739490039814952,134.25850251663562,COMPLETE
1641,0.40382787585258484,2023-09-04 22:43:04.698313,2023-09-04 22:43:05.682401,0 days 00:00:00.984088,Sigmoid,Leaky,Sigmoid,Leaky,86,21,19.0,16.0,20.0,0.0256305535131027,4,295,0.3314059445470625,1.4496102264115458e-05,146.5943716297979,COMPLETE
1642,0.432307630777359,2023-09-04 22:43:05.683419,2023-09-04 22:43:06.506818,0 days 00:00:00.823399,Tanh,Leaky,Sigmoid,Leaky,92,10,21.0,14.0,19.0,0.009056999576028308,4,190,0.3136271310851156,8.88471036425756e-05,177.52166258983124,COMPLETE
1643,0.5574191212654114,2023-09-04 22:43:06.507820,2023-09-04 22:43:14.942640,0 days 00:00:08.434820,ReLU,Leaky,ReLU,Leaky,88,19,19.0,16.0,4.0,0.000107209932309582,4,238,0.7996800615756887,0.019291749986330403,146.49376386754653,COMPLETE
1644,0.36278989911079407,2023-09-04 22:43:14.943637,2023-09-04 22:43:17.109819,0 days 00:00:02.166182,Tanh,Leaky,Tanh,Leaky,47,9,20.0,15.0,5.0,0.012581703127463638,4,267,0.727589595451079,0.00022332343748170368,128.43083551194934,COMPLETE
1645,0.40716496109962463,2023-09-04 22:43:17.110817,2023-09-04 22:43:21.973013,0 days 00:00:04.862196,Sigmoid,Leaky,Sigmoid,Leaky,30,19,18.0,15.0,17.0,0.0012911485613129165,4,222,0.205103073151215,4.808243330423891e-05,216.03426041474214,COMPLETE
1646,0.9233466386795044,2023-09-04 22:43:21.974030,2023-09-04 22:43:37.069476,0 days 00:00:15.095446,Leaky,ReLU,Sigmoid,Leaky,34,21,20.0,13.0,3.0,1.1686847261774348e-05,4,247,0.6789175517512122,0.0002647821716096415,122.31344783643962,COMPLETE
1647,0.40261080861091614,2023-09-04 22:43:37.070479,2023-09-04 22:43:38.162440,0 days 00:00:01.091961,Tanh,Leaky,Sigmoid,ReLU,25,19,23.0,12.0,15.0,0.015780718327468503,4,208,0.1907532056404485,0.00011836871915332432,336.5947444370815,COMPLETE
1648,0.6527573466300964,2023-09-04 22:43:38.163449,2023-09-04 22:43:39.093328,0 days 00:00:00.929879,Tanh,Leaky,ReLU,Leaky,86,22,21.0,15.0,8.0,0.010753448381336662,4,232,0.630344032141555,0.061314643708438955,163.32800261179605,COMPLETE
1649,0.48603641986846924,2023-09-04 22:43:39.094315,2023-09-04 22:43:40.536083,0 days 00:00:01.441768,ReLU,Leaky,Sigmoid,Leaky,28,20,22.0,16.0,4.0,0.052418882083810105,4,304,0.7443390089345897,1.0137029580663397e-05,309.58237021309986,COMPLETE
1650,0.5289087295532227,2023-09-04 22:43:40.537089,2023-09-04 22:43:42.226207,0 days 00:00:01.689118,Sigmoid,Leaky,Sigmoid,Leaky,89,9,17.0,21.0,19.0,0.0009182095061789436,4,256,0.16451695337279137,0.0001532991333219129,110.0698272289873,COMPLETE
1651,0.36171388626098633,2023-09-04 22:43:42.227223,2023-09-04 22:43:43.178785,0 days 00:00:00.951562,Tanh,Leaky,Sigmoid,Leaky,85,20,20.0,11.0,5.0,0.018723212941465346,4,278,0.28002149174319707,2.7138939819063718e-05,112.11897153270488,COMPLETE
1652,0.3115512728691101,2023-09-04 22:43:43.179805,2023-09-04 22:43:44.794020,0 days 00:00:01.614215,Leaky,Leaky,Sigmoid,Leaky,87,11,19.0,17.0,20.0,0.014334084786991292,4,288,0.4505783709463244,0.00017853046219324625,538.5298445730498,COMPLETE
1653,0.25243687629699707,2023-09-04 22:43:44.795098,2023-09-04 22:43:52.022651,0 days 00:00:07.227553,Tanh,Tanh,ReLU,Leaky,31,19,20.0,14.0,17.0,0.0006565986670868532,4,415,0.5839460521916338,0.0001299170837010783,100.58856079101562,COMPLETE
1654,0.3139066994190216,2023-09-04 22:43:52.023695,2023-09-04 22:43:54.208075,0 days 00:00:02.184380,Sigmoid,Leaky,Sigmoid,Leaky,84,21,21.0,22.0,16.0,0.02196268478615666,4,242,0.5649820866771639,5.620614040323008e-05,159.41222147623697,COMPLETE
1655,0.29658064246177673,2023-09-04 22:43:54.209108,2023-09-04 22:43:56.022820,0 days 00:00:01.813712,ReLU,Leaky,Sigmoid,ReLU,76,16,21.0,20.0,4.0,0.03618706746447004,4,322,0.7998469060944654,0.0003300974116244716,83.34535142852039,COMPLETE
1656,1.0688049793243408,2023-09-04 22:43:56.023822,2023-09-04 22:43:56.829260,0 days 00:00:00.805438,Tanh,Sigmoid,Sigmoid,Leaky,38,23,20.0,16.0,18.0,0.010344403814253991,4,217,0.20755541769965086,0.052395195191944716,101.27122809670188,COMPLETE
1657,0.3928154408931732,2023-09-04 22:43:56.830277,2023-09-04 22:43:58.026264,0 days 00:00:01.195987,Leaky,Leaky,ReLU,Leaky,97,10,19.0,15.0,5.0,0.02991948573168286,4,158,0.7063069424801377,0.00020993605434458434,108.27703325676195,COMPLETE
1658,0.38886529207229614,2023-09-04 22:43:58.027272,2023-09-04 22:44:16.057360,0 days 00:00:18.030088,Tanh,Leaky,Sigmoid,Sigmoid,33,14,21.0,16.0,1.0,0.0004006807714192157,4,261,0.7531806842472886,0.0005797143124709746,130.55029358260933,COMPLETE
1659,0.861350953578949,2023-09-04 22:44:16.058358,2023-09-04 22:44:16.471158,0 days 00:00:00.412800,Sigmoid,Leaky,Sigmoid,Leaky,91,19,18.0,17.0,13.0,0.01571358596314935,4,232,0.11083872705244158,9.95338582871311e-05,474.058292388916,COMPLETE
1660,0.657557487487793,2023-09-04 22:44:16.472289,2023-09-04 22:44:23.538984,0 days 00:00:07.066695,Tanh,Leaky,Sigmoid,Leaky,85,22,19.0,15.0,18.0,3.791532880921103e-05,4,251,0.6092449751740866,4.157828596709797e-05,116.30110876683695,COMPLETE
1661,0.3801755905151367,2023-09-04 22:44:23.540017,2023-09-04 22:44:24.434025,0 days 00:00:00.894008,ReLU,ReLU,Sigmoid,Sigmoid,88,20,22.0,22.0,9.0,0.013217740245996494,4,270,0.24719389634017516,0.0001691337442368912,461.1169024658203,COMPLETE
1662,0.31761690974235535,2023-09-04 22:44:24.435052,2023-09-04 22:44:25.804535,0 days 00:00:01.369483,Tanh,Leaky,ReLU,Leaky,50,15,9.0,23.0,2.0,0.019956578024232254,4,308,0.4983673195387753,8.442454964569413e-05,105.84713271568562,COMPLETE
1663,0.26256856322288513,2023-09-04 22:44:25.805540,2023-09-04 22:44:29.973740,0 days 00:00:04.168200,Leaky,Leaky,Leaky,Sigmoid,81,21,20.0,21.0,20.0,0.0022067162110297914,4,223,0.7726089524074262,6.420818585330999e-05,103.8105126789638,COMPLETE
1664,0.2986014783382416,2023-09-04 22:44:29.974771,2023-09-04 22:44:32.196274,0 days 00:00:02.221503,Tanh,Leaky,Sigmoid,Leaky,94,12,23.0,23.0,19.0,0.008820011061777256,4,242,0.7130027032089061,1.2879247494931916e-05,130.7436496850216,COMPLETE
1665,0.3784325420856476,2023-09-04 22:44:32.197325,2023-09-04 22:44:34.487811,0 days 00:00:02.290486,ReLU,Leaky,Sigmoid,Leaky,36,19,12.0,16.0,3.0,0.0015831875024658608,4,295,0.6730688337848784,0.0015744361851366406,198.16247057233537,COMPLETE
1666,0.6722841858863831,2023-09-04 22:44:34.488860,2023-09-04 22:44:35.251562,0 days 00:00:00.762702,Sigmoid,Leaky,Sigmoid,Sigmoid,29,19,16.0,13.0,16.0,0.012072700284598337,4,200,0.11390871006980859,0.00025531161667149483,184.95191110147013,COMPLETE
1667,0.5069851875305176,2023-09-04 22:44:35.252566,2023-09-04 22:44:43.264481,0 days 00:00:08.011915,Tanh,Leaky,Tanh,Leaky,84,21,21.0,15.0,5.0,0.00013314918876030044,4,234,0.7452923092406898,0.0051524092776701145,156.89333829309186,COMPLETE
1668,0.39540520310401917,2023-09-04 22:44:43.265477,2023-09-04 22:44:44.831486,0 days 00:00:01.566009,Leaky,Leaky,ReLU,ReLU,44,11,20.0,14.0,8.0,0.025292762989908558,4,257,0.7681809614578475,0.004270515658433788,144.93340446835472,COMPLETE
1669,0.32579734921455383,2023-09-04 22:44:44.832594,2023-09-04 22:44:49.042807,0 days 00:00:04.210213,Tanh,Leaky,Sigmoid,Sigmoid,32,20,2.0,23.0,18.0,0.01664204000294291,4,280,0.7036722851315677,1.0008190449149069e-05,148.30052553812664,COMPLETE
1670,0.3221753239631653,2023-09-04 22:44:49.043858,2023-09-04 22:44:50.556914,0 days 00:00:01.513056,Sigmoid,Leaky,Sigmoid,Leaky,82,10,19.0,22.0,5.0,0.009937250088388467,4,213,0.7991345716557011,2.510305023318223e-05,132.8246576645795,COMPLETE
1671,0.29754793643951416,2023-09-04 22:44:50.557922,2023-09-04 22:44:52.742543,0 days 00:00:02.184621,Tanh,Leaky,Sigmoid,Tanh,89,22,20.0,18.0,17.0,0.0070619823900142185,4,244,0.7290256712947523,0.0004100077553350112,102.77558073450308,COMPLETE
1672,0.2579459846019745,2023-09-04 22:44:52.743590,2023-09-04 22:44:54.319103,0 days 00:00:01.575513,ReLU,Leaky,ReLU,Leaky,85,17,19.0,16.0,4.0,0.019806459691137812,4,226,0.7494899466254716,0.00014589669984765497,101.08604626777844,COMPLETE
1673,1.1262531280517578,2023-09-04 22:44:54.320113,2023-09-04 22:44:58.702855,0 days 00:00:04.382742,Tanh,ReLU,Sigmoid,Sigmoid,79,20,13.0,17.0,17.0,1.0389276253792094e-05,4,263,0.30420413891205894,0.00011387125406840085,132.6151587482641,COMPLETE
1674,0.46559739112854004,2023-09-04 22:44:58.703984,2023-09-04 22:45:02.568047,0 days 00:00:03.864063,Sigmoid,Leaky,,,34,19,15.0,,,0.002944209263780065,2,250,0.3447465155332528,0.00020650772116285034,489.3147219681158,COMPLETE
1675,0.848362386226654,2023-09-04 22:45:02.569025,2023-09-04 22:45:03.267305,0 days 00:00:00.698280,Leaky,Leaky,Sigmoid,Leaky,27,19,21.0,23.0,19.0,0.0012600756276370721,4,235,0.10461373098192858,8.409408419056488e-05,386.5354354381561,COMPLETE
1676,0.6856107711791992,2023-09-04 22:45:03.268325,2023-09-04 22:45:06.123427,0 days 00:00:02.855102,Tanh,Leaky,Sigmoid,Sigmoid,87,18,20.0,15.0,4.0,0.0006238495463455242,4,268,0.2251476088438141,1.8069302797582705e-05,146.08275970210875,COMPLETE
1677,0.3397791087627411,2023-09-04 22:45:06.124459,2023-09-04 22:45:07.436115,0 days 00:00:01.311656,ReLU,Tanh,Sigmoid,Leaky,83,16,22.0,23.0,16.0,0.03990555874057575,4,284,0.6473490171030984,3.119717031308558e-05,116.6230934990777,COMPLETE
1678,0.2317335307598114,2023-09-04 22:45:07.437125,2023-09-04 22:45:09.573993,0 days 00:00:02.136868,Tanh,Leaky,ReLU,Leaky,90,18,7.0,22.0,21.0,0.01310073160540389,4,311,0.7994440820301473,0.00017372954453506294,96.43713087602096,COMPLETE
1679,0.5896862745285034,2023-09-04 22:45:09.574995,2023-09-04 22:45:10.985191,0 days 00:00:01.410196,Sigmoid,Leaky,Sigmoid,Sigmoid,86,13,20.0,14.0,5.0,0.01551687779948546,4,188,0.6848530926315622,5.639913835597325e-05,168.9200957327178,COMPLETE
1680,0.35701268911361694,2023-09-04 22:45:10.986198,2023-09-04 22:45:29.772417,0 days 00:00:18.786219,Leaky,Leaky,Sigmoid,Leaky,31,21,18.0,16.0,2.0,0.0003086566676572741,4,224,0.7230627371586675,0.010922101135434943,119.28519533330744,COMPLETE
1681,0.7610158324241638,2023-09-04 22:45:29.773421,2023-09-04 22:45:30.260163,0 days 00:00:00.486742,Tanh,Sigmoid,Sigmoid,Leaky,84,17,6.0,12.0,3.0,0.022813234119143728,4,300,0.12086269677629927,0.0008647915968798492,183.88190378461564,COMPLETE
1682,0.8538815379142761,2023-09-04 22:45:30.261167,2023-09-04 22:45:31.970376,0 days 00:00:01.709209,Tanh,Leaky,ReLU,Sigmoid,25,20,21.0,22.0,14.0,0.000884370028423261,4,253,0.13265802698612716,0.0002760900952977892,200.14711142147289,COMPLETE
1683,0.425432413816452,2023-09-04 22:45:31.971379,2023-09-04 22:45:33.707525,0 days 00:00:01.736146,ReLU,Leaky,Sigmoid,ReLU,81,24,19.0,23.0,20.0,0.000728345761210134,4,240,0.2791169628494354,0.00013685740844359274,156.50883980517116,COMPLETE
1684,0.6747650504112244,2023-09-04 22:45:33.708522,2023-09-04 22:45:36.486993,0 days 00:00:02.778471,Sigmoid,Leaky,Sigmoid,Leaky,93,18,20.0,15.0,18.0,0.0010718272231785171,4,273,0.7700865368791665,0.00047063811411318196,181.67178869866706,COMPLETE
1685,0.4648069739341736,2023-09-04 22:45:36.488008,2023-09-04 22:45:38.541936,0 days 00:00:02.053928,Tanh,Leaky,Sigmoid,Sigmoid,86,9,22.0,23.0,19.0,0.0018334028853098957,4,290,0.2525556352346767,7.335318771343811e-05,159.26846370412343,COMPLETE
1686,0.2722720503807068,2023-09-04 22:45:38.542951,2023-09-04 22:45:42.484191,0 days 00:00:03.941240,Tanh,Leaky,Leaky,Leaky,29,10,21.0,15.0,8.0,0.008218423895875326,4,212,0.7479402840628978,1.5194939614417079e-05,182.5650202433268,COMPLETE
1687,0.3150397837162018,2023-09-04 22:45:42.485215,2023-09-04 22:45:44.254590,0 days 00:00:01.769375,Leaky,ReLU,Sigmoid,Leaky,37,19,18.0,24.0,5.0,0.017890051346663438,4,230,0.5352023719387234,4.527336479336355e-05,94.72423276034269,COMPLETE
1688,0.47287940979003906,2023-09-04 22:45:44.255607,2023-09-04 22:45:45.802359,0 days 00:00:01.546752,Sigmoid,Leaky,ReLU,Sigmoid,89,6,19.0,16.0,17.0,0.011883911160335771,4,247,0.377474201362444,0.00010973126309230349,207.4682708946434,COMPLETE
1689,0.38634833693504333,2023-09-04 22:45:45.803355,2023-09-04 22:45:57.971281,0 days 00:00:12.167926,ReLU,Leaky,Sigmoid,Leaky,35,8,24.0,17.0,4.0,0.00034501273002112695,4,260,0.699514954170552,0.000793130503384717,142.86974373249092,COMPLETE
1690,0.3687562048435211,2023-09-04 22:45:57.972315,2023-09-04 22:45:59.105008,0 days 00:00:01.132693,Tanh,Leaky,Sigmoid,Sigmoid,70,11,20.0,11.0,19.0,0.02710420396899297,4,238,0.29174015803002146,0.001237414407280521,170.93286219183005,COMPLETE
1691,0.4285919964313507,2023-09-04 22:45:59.106021,2023-09-04 22:46:04.241441,0 days 00:00:05.135420,Leaky,Leaky,Sigmoid,Leaky,82,20,21.0,22.0,18.0,0.0005274047209997972,4,203,0.7668454735719927,0.01351807854247224,194.59581801470588,COMPLETE
1692,0.4786113202571869,2023-09-04 22:46:04.242494,2023-09-04 22:46:08.316003,0 days 00:00:04.073509,Tanh,Leaky,Tanh,Leaky,40,22,3.0,23.0,16.0,0.00021628189566388377,4,318,0.1729435924921122,0.0003349870354496521,152.52755675682656,COMPLETE
1693,0.288268506526947,2023-09-04 22:46:08.317008,2023-09-04 22:46:11.024511,0 days 00:00:02.707503,Sigmoid,Leaky,ReLU,Sigmoid,73,19,20.0,13.0,5.0,0.010114406519643883,4,220,0.4584521557152779,0.00023425217231040637,125.0551920199613,COMPLETE
