number,value,datetime_start,datetime_complete,duration,params_activation1,params_activation2,params_activation3,params_activation4,params_batch_size,params_fl1,params_fl2,params_fl3,params_fl4,params_learning_rate,params_n_layers,params_num_epochs,params_train_size,params_weight_decay,user_attrs_mre,state
1855,0.4310590326786041,2023-09-04 23:01:09.606948,2023-09-04 23:01:09.913352,0 days 00:00:00.306404,Tanh,ReLU,Tanh,ReLU,21,20,17.0,14.0,13.0,0.006671307903868389,4,269,0.109064984206364,0.00015963929142076775,236.34598236083986,COMPLETE
1856,0.406516432762146,2023-09-04 23:01:09.913872,2023-09-04 23:01:10.279347,0 days 00:00:00.365475,Tanh,Tanh,ReLU,,24,18,18.0,17.0,,0.007834326731491793,3,246,0.27048791241411263,0.001030014266656728,589.4448429987981,COMPLETE
1857,0.39172759652137756,2023-09-04 23:01:10.279866,2023-09-04 23:01:10.989612,0 days 00:00:00.709746,Tanh,ReLU,Leaky,Leaky,34,19,17.0,16.0,12.0,0.0008676378441477407,4,261,0.22378013166721172,0.0002902334954979982,106.56439613434206,COMPLETE
1858,0.3531073033809662,2023-09-04 23:01:10.990124,2023-09-04 23:01:11.506494,0 days 00:00:00.516370,Tanh,ReLU,Tanh,,20,20,18.0,15.0,,0.014638710844180666,3,241,0.37674428319032566,0.0002556977938435304,101.97176291725852,COMPLETE
1859,0.37029898166656494,2023-09-04 23:01:11.506999,2023-09-04 23:01:15.542747,0 days 00:00:04.035748,Tanh,ReLU,ReLU,Leaky,23,19,18.0,16.0,9.0,0.0002999074162064353,4,255,0.5247620575811286,0.02399058924675869,112.60153657691913,COMPLETE
1860,0.5164729356765747,2023-09-04 23:01:15.543271,2023-09-04 23:01:15.877436,0 days 00:00:00.334165,Tanh,ReLU,Sigmoid,,25,20,20.0,17.0,,0.044198972542899055,3,277,0.32872766321524316,0.0625093484598139,118.256593492296,COMPLETE
1861,0.2894479036331177,2023-09-04 23:01:15.877972,2023-09-04 23:01:20.502246,0 days 00:00:04.624274,Tanh,ReLU,Tanh,,12,20,19.0,16.0,,0.000657617242118294,3,242,0.7000255571034323,0.00019442668093984247,96.44266455514091,COMPLETE
1862,0.3611213266849518,2023-09-04 23:01:20.502756,2023-09-04 23:01:24.805947,0 days 00:00:04.303191,Tanh,Tanh,ReLU,ReLU,36,18,17.0,14.0,23.0,0.00012875399505325505,4,234,0.6595637988081735,0.0007445965470832897,111.7017564692049,COMPLETE
1863,0.35263100266456604,2023-09-04 23:01:24.806492,2023-09-04 23:01:25.144967,0 days 00:00:00.338475,Tanh,ReLU,Leaky,,22,21,19.0,15.0,,0.03349038091759292,3,251,0.2631389724456697,0.0004120495463874929,113.74138017134233,COMPLETE
1864,0.32255059480667114,2023-09-04 23:01:25.145476,2023-09-04 23:01:26.405367,0 days 00:00:01.259891,Tanh,Leaky,,,17,21,18.0,,,0.005482897005950811,2,267,0.7549385594321353,0.0001460555456447396,80.15036085175305,COMPLETE
1865,0.35097524523735046,2023-09-04 23:01:26.405871,2023-09-04 23:01:26.959204,0 days 00:00:00.553333,Tanh,ReLU,Tanh,Leaky,14,19,17.0,17.0,11.0,0.0021781474697405373,4,257,0.16044618590005677,0.00017436787917186872,168.77353630065917,COMPLETE
1866,0.3030703365802765,2023-09-04 23:01:26.959714,2023-09-04 23:01:27.599745,0 days 00:00:00.640031,Tanh,,,,39,20,,,,0.022992328642094093,1,244,0.7658221215412513,0.0005379142681157311,93.81418640136718,COMPLETE
1867,0.33891013264656067,2023-09-04 23:01:27.600276,2023-09-04 23:01:27.857790,0 days 00:00:00.257514,Tanh,ReLU,ReLU,,25,21,17.0,18.0,,0.010968021793559565,3,234,0.18914870885717996,0.0001352573669888439,110.06104639956826,COMPLETE
1868,0.319101482629776,2023-09-04 23:01:27.858298,2023-09-04 23:01:30.746995,0 days 00:00:02.888697,ReLU,ReLU,ReLU,,33,20,22.0,12.0,,0.0005178792401223512,3,249,0.7245896701444176,0.0013650972790707836,108.86709781769784,COMPLETE
1869,0.31740933656692505,2023-09-04 23:01:30.747514,2023-09-04 23:01:31.311639,0 days 00:00:00.564125,Tanh,ReLU,Tanh,ReLU,23,20,19.0,17.0,10.0,0.02946142800001051,4,282,0.5049264571127867,0.0002342203658965914,186.3135782877604,COMPLETE
1870,0.30123233795166016,2023-09-04 23:01:31.312148,2023-09-04 23:01:32.645480,0 days 00:00:01.333332,ReLU,Tanh,Sigmoid,,19,19,20.0,2.0,,0.008401757559264573,3,131,0.613153797041011,0.0019874324782443425,129.99814475850857,COMPLETE
1871,0.2883993983268738,2023-09-04 23:01:32.646018,2023-09-04 23:01:33.742220,0 days 00:00:01.096202,Tanh,ReLU,ReLU,Leaky,26,21,18.0,16.0,24.0,0.006021453315894064,4,261,0.7693910131325095,7.401366779585283e-05,101.43559112548829,COMPLETE
1872,0.34503623843193054,2023-09-04 23:01:33.742736,2023-09-04 23:01:34.339533,0 days 00:00:00.596797,ReLU,ReLU,Leaky,,35,19,17.0,13.0,,0.019227657111082607,3,71,0.6865156837696036,0.0003439993979378324,104.15926361083984,COMPLETE
1873,0.34902527928352356,2023-09-04 23:01:34.340054,2023-09-04 23:01:34.939515,0 days 00:00:00.599461,Tanh,ReLU,Tanh,ReLU,21,18,18.0,7.0,3.0,0.012309159043391495,4,242,0.4721631806300985,0.005663424197159346,102.246325948964,COMPLETE
1874,0.7534254789352417,2023-09-04 23:01:34.940033,2023-09-04 23:01:37.531860,0 days 00:00:02.591827,ReLU,Sigmoid,ReLU,,38,20,12.0,6.0,,3.425771135501972e-05,3,272,0.3147343218686746,0.0028199608735778197,97.35149361105526,COMPLETE
1875,0.3282488286495209,2023-09-04 23:01:37.532355,2023-09-04 23:01:38.574457,0 days 00:00:01.042102,Tanh,ReLU,Tanh,Leaky,19,19,8.0,16.0,8.0,0.004876086091872799,4,231,0.4795106254336781,6.0550451428499035e-05,115.4008469452729,COMPLETE
1876,0.4378994107246399,2023-09-04 23:01:38.574975,2023-09-04 23:01:38.829248,0 days 00:00:00.254273,Sigmoid,ReLU,Sigmoid,,34,21,19.0,11.0,,0.007566930957608783,3,251,0.17960222532082815,0.020056459879290358,114.6186949412028,COMPLETE
1877,0.49566730856895447,2023-09-04 23:01:38.829764,2023-09-04 23:01:40.142065,0 days 00:00:01.312301,ReLU,Tanh,ReLU,ReLU,24,1,6.0,5.0,12.0,0.0013396887352452355,4,263,0.7404399045990444,1.1551045851388894e-05,126.6027138288631,COMPLETE
1878,0.34099262952804565,2023-09-04 23:01:40.142643,2023-09-04 23:01:40.838651,0 days 00:00:00.696008,Tanh,ReLU,Tanh,,26,20,12.0,15.0,,0.009906853178924745,3,105,0.39286724670108014,8.399942523494821e-05,100.93116500529837,COMPLETE
1879,0.37475016713142395,2023-09-04 23:01:40.839165,2023-09-04 23:01:41.147937,0 days 00:00:00.308772,ReLU,Leaky,Leaky,,21,8,4.0,18.0,,0.013507948555461707,3,240,0.10607924849730442,0.0001065427044068489,120.31125710227273,COMPLETE
1880,0.39428290724754333,2023-09-04 23:01:41.148437,2023-09-04 23:01:42.667597,0 days 00:00:01.519160,Tanh,ReLU,ReLU,Leaky,16,21,20.0,17.0,9.0,0.006529505271761081,4,253,0.7990676172265317,0.030706527627211298,115.64730682373047,COMPLETE
1881,0.3546222746372223,2023-09-04 23:01:42.668231,2023-09-04 23:01:43.275707,0 days 00:00:00.607476,ReLU,ReLU,Tanh,,23,18,7.0,15.0,,0.016303715262656133,3,233,0.7655600907577242,0.0006911735409158067,108.14042703728927,COMPLETE
1882,0.30806970596313477,2023-09-04 23:01:43.276210,2023-09-04 23:01:44.552355,0 days 00:00:01.276145,Tanh,ReLU,ReLU,ReLU,32,20,18.0,8.0,19.0,0.0020382993486184994,4,245,0.7121402232887266,1.373529202730331e-05,93.04528766208225,COMPLETE
1883,0.4440273344516754,2023-09-04 23:01:44.552883,2023-09-04 23:01:44.996350,0 days 00:00:00.443467,ReLU,ReLU,Sigmoid,,26,19,17.0,16.0,,0.09646936261242685,3,270,0.7404740632696524,0.00015339754997222019,137.29853766305106,COMPLETE
1884,0.35235512256622314,2023-09-04 23:01:44.996866,2023-09-04 23:01:45.725027,0 days 00:00:00.728161,Tanh,Tanh,Tanh,Leaky,36,21,13.0,6.0,7.0,0.005011574488320956,4,257,0.29133913184552096,0.0002175352847028827,104.41553952958849,COMPLETE
1885,0.39742550253868103,2023-09-04 23:01:45.725553,2023-09-04 23:01:48.027420,0 days 00:00:02.301867,ReLU,ReLU,Leaky,,18,20,18.0,17.0,,0.00012881454408335104,3,236,0.26131991669599886,1.6876405218911573e-05,113.298771192081,COMPLETE
1886,0.4778466820716858,2023-09-04 23:01:48.027947,2023-09-04 23:01:51.869771,0 days 00:00:03.841824,Tanh,,,,22,21,,,,2.601273794094027e-05,1,249,0.7992541926350175,0.0342801515291248,130.76624570837345,COMPLETE
1887,0.3326362371444702,2023-09-04 23:01:51.870267,2023-09-04 23:01:52.624168,0 days 00:00:00.753901,ReLU,ReLU,,,34,19,19.0,,,0.008833893561623094,2,262,0.7539993995534782,0.0005954556197036059,85.31416447957356,COMPLETE
1888,0.32358697056770325,2023-09-04 23:01:52.624653,2023-09-04 23:01:54.732599,0 days 00:00:02.107946,Tanh,ReLU,ReLU,Leaky,24,20,12.0,14.0,10.0,0.0042168097027214775,4,280,0.7089383407561123,0.0009324756560280745,110.55495545922255,COMPLETE
1889,0.36152854561805725,2023-09-04 23:01:54.733593,2023-09-04 23:01:55.142930,0 days 00:00:00.409337,ReLU,ReLU,Tanh,,72,19,17.0,7.0,,0.02478095068475542,3,240,0.3996914698609729,0.0002858183479103639,277.7033929592226,COMPLETE
1890,0.4144091010093689,2023-09-04 23:01:55.143443,2023-09-04 23:01:55.589942,0 days 00:00:00.446499,Sigmoid,ReLU,ReLU,,37,21,13.0,18.0,,0.03935013858828805,3,227,0.6511676845439716,0.010594278091776203,119.14125315348308,COMPLETE
1891,0.7200323939323425,2023-09-04 23:01:55.590450,2023-09-04 23:01:59.340304,0 days 00:00:03.749854,Tanh,Tanh,Sigmoid,ReLU,57,20,9.0,15.0,6.0,1.7077300008744416e-05,4,250,0.770680750066154,0.007918197774271442,103.06265466308594,COMPLETE
1892,0.3129768669605255,2023-09-04 23:01:59.340811,2023-09-04 23:02:04.434582,0 days 00:00:05.093771,ReLU,Leaky,Tanh,,31,20,18.0,16.0,,0.00011022638359616037,3,257,0.73158678435457,0.00016811214832912553,100.48800359347452,COMPLETE
1893,0.3242699205875397,2023-09-04 23:02:04.435094,2023-09-04 23:02:05.322973,0 days 00:00:00.887879,Tanh,ReLU,ReLU,Leaky,28,21,19.0,17.0,4.0,0.010679652970526846,4,231,0.6809980039413414,1.0016921956603416e-05,101.14526297829367,COMPLETE
1894,0.5275185704231262,2023-09-04 23:02:05.323483,2023-09-04 23:02:06.877107,0 days 00:00:01.553624,ReLU,ReLU,Leaky,,20,2,12.0,9.0,,0.0006829796208415235,3,243,0.2438631354904726,5.131252891217533e-05,126.62215019674862,COMPLETE
1895,0.3343944847583771,2023-09-04 23:02:06.877623,2023-09-04 23:02:10.253302,0 days 00:00:03.375679,Tanh,ReLU,Tanh,ReLU,26,19,21.0,5.0,14.0,0.0002672346532452008,4,269,0.7726886033207415,0.00011906968013335074,117.68948496668791,COMPLETE
1896,0.4062917232513428,2023-09-04 23:02:10.253814,2023-09-04 23:02:10.782837,0 days 00:00:00.529023,ReLU,ReLU,ReLU,,24,21,13.0,6.0,,0.007093115855474165,3,258,0.7472279674282116,0.04250569023780053,100.33942233814912,COMPLETE
1897,0.40051957964897156,2023-09-04 23:02:10.783372,2023-09-04 23:02:10.979990,0 days 00:00:00.196618,Tanh,ReLU,,,33,20,8.0,,,0.005555027790870243,2,240,0.10344954607781624,2.2186824773927856e-05,170.1645261492048,COMPLETE
1898,0.35569870471954346,2023-09-04 23:02:10.980486,2023-09-04 23:02:12.511433,0 days 00:00:01.530947,ReLU,Tanh,Sigmoid,,14,18,17.0,16.0,,0.0009055481551758798,3,249,0.7992104096396916,0.018255484749518693,143.86164624763256,COMPLETE
1899,0.38005971908569336,2023-09-04 23:02:12.511946,2023-09-04 23:02:13.284560,0 days 00:00:00.772614,Sigmoid,Sigmoid,Tanh,Leaky,30,19,7.0,7.0,11.0,0.01567794717289098,4,228,0.2558002987040111,1.4047775001434103e-05,138.22550673233835,COMPLETE
1900,0.33760103583335876,2023-09-04 23:02:13.285069,2023-09-04 23:02:13.857597,0 days 00:00:00.572528,Tanh,ReLU,ReLU,,22,20,19.0,17.0,,0.008169282701326415,3,261,0.36069872798771874,0.00047194329511213477,103.87812870570592,COMPLETE
1901,0.28921249508857727,2023-09-04 23:02:13.858096,2023-09-04 23:02:14.937696,0 days 00:00:01.079600,ReLU,ReLU,Leaky,ReLU,27,21,13.0,15.0,7.0,0.01945534268071714,4,238,0.7081770209111171,6.333862761064229e-05,96.5251232049404,COMPLETE
1902,0.3565279245376587,2023-09-04 23:02:14.938219,2023-09-04 23:02:15.356188,0 days 00:00:00.417969,Tanh,ReLU,ReLU,,35,24,18.0,16.0,,0.01292132099434882,3,249,0.4160928176581681,0.0042237215547671686,117.62078910038389,COMPLETE
1903,0.325612872838974,2023-09-04 23:02:15.356695,2023-09-04 23:02:16.159311,0 days 00:00:00.802616,ReLU,ReLU,Tanh,,39,9,20.0,8.0,,0.00239983247894413,3,269,0.34915457470212186,0.001465211563494771,110.825194921249,COMPLETE
1904,0.33526769280433655,2023-09-04 23:02:16.159830,2023-09-04 23:02:17.909924,0 days 00:00:01.750094,Tanh,ReLU,ReLU,Leaky,19,20,17.0,17.0,21.0,0.006249179472811178,4,231,0.7707668118596912,0.01187356345982673,108.63271686642669,COMPLETE
1905,0.313019335269928,2023-09-04 23:02:17.910446,2023-09-04 23:02:22.822530,0 days 00:00:04.912084,ReLU,Leaky,Tanh,ReLU,21,19,12.0,14.0,8.0,0.0004220258496748642,4,281,0.7322953952011021,1.792003837793883e-05,98.47165208561405,COMPLETE
1906,0.37178802490234375,2023-09-04 23:02:22.823050,2023-09-04 23:02:27.476536,0 days 00:00:04.653486,Tanh,Tanh,Sigmoid,,29,21,24.0,4.0,,0.000367755452841089,3,253,0.7998555519917012,0.00033932273608825396,105.14659401086661,COMPLETE
1907,0.3100343942642212,2023-09-04 23:02:27.477036,2023-09-04 23:02:29.196611,0 days 00:00:01.719575,ReLU,ReLU,ReLU,Leaky,24,20,18.0,18.0,9.0,0.0019100360622433727,4,244,0.5740334234775082,2.2676236755386578e-05,111.14572634762281,COMPLETE
1908,0.5464677214622498,2023-09-04 23:02:29.197128,2023-09-04 23:02:32.634946,0 days 00:00:03.437818,Tanh,ReLU,Leaky,,17,19,13.0,16.0,,2.188694512042819e-05,3,260,0.28166459719654574,0.003155274241806316,141.54108035747822,COMPLETE
1909,0.41878417134284973,2023-09-04 23:02:32.635475,2023-09-04 23:02:33.558289,0 days 00:00:00.922814,ReLU,ReLU,Tanh,,32,18,8.0,6.0,,0.0002193781633452297,3,225,0.13189198569277294,0.0001807280642836611,116.13262559678819,COMPLETE
1910,0.32089799642562866,2023-09-04 23:02:33.558790,2023-09-04 23:02:34.700835,0 days 00:00:01.142045,Tanh,ReLU,ReLU,Sigmoid,26,21,22.0,7.0,15.0,0.0033468026498679995,4,242,0.7522617701417049,9.575157309117037e-05,81.90036331979852,COMPLETE
1911,0.40370944142341614,2023-09-04 23:02:34.701356,2023-09-04 23:02:35.585141,0 days 00:00:00.883785,ReLU,ReLU,Tanh,,23,20,19.0,5.0,,0.030198886818461935,3,272,0.6751812514120142,0.014742885077711107,109.78547264547909,COMPLETE
1912,0.3270486891269684,2023-09-04 23:02:35.585644,2023-09-04 23:02:37.118501,0 days 00:00:01.532857,Sigmoid,Tanh,Sigmoid,ReLU,35,21,17.0,17.0,10.0,0.009152712158496867,4,235,0.7996310794801712,0.0002273800607274,98.94951021671295,COMPLETE
1913,0.3953166604042053,2023-09-04 23:02:37.119011,2023-09-04 23:02:39.117977,0 days 00:00:01.998966,Tanh,ReLU,,,20,19,23.0,,,7.713321014323468e-05,2,82,0.7218867475003254,0.00013077776209188382,128.56163778537658,COMPLETE
1914,0.34204453229904175,2023-09-04 23:02:39.118482,2023-09-04 23:02:39.697290,0 days 00:00:00.578808,ReLU,ReLU,ReLU,,28,19,12.0,15.0,,0.011596044684527714,3,253,0.7709967830787138,1.5659288978667534e-05,125.25934273856026,COMPLETE
1915,0.3925928771495819,2023-09-04 23:02:39.697799,2023-09-04 23:02:40.247285,0 days 00:00:00.549486,Tanh,ReLU,Tanh,,25,20,13.0,3.0,,0.004218199033761463,3,246,0.21803111256903707,0.042509173515691334,269.37519658406575,COMPLETE
1916,0.35261091589927673,2023-09-04 23:02:40.247789,2023-09-04 23:02:41.337903,0 days 00:00:01.090114,ReLU,ReLU,Leaky,Leaky,31,24,3.0,16.0,13.0,0.0016196119528425648,4,264,0.5289921732621795,2.592535692136214e-05,107.82624338440976,COMPLETE
1917,0.5783596634864807,2023-09-04 23:02:41.338431,2023-09-04 23:02:44.202277,0 days 00:00:02.863846,Tanh,Leaky,ReLU,,37,21,14.0,17.0,,1.2909158087404314e-05,3,223,0.54098703283233,4.504467720287588e-05,97.62962765543985,COMPLETE
1918,0.358598530292511,2023-09-04 23:02:44.202790,2023-09-04 23:02:44.661538,0 days 00:00:00.458748,ReLU,ReLU,Tanh,Leaky,33,20,20.0,16.0,11.0,0.005151732822446753,4,238,0.4357864589731506,2.0211250509745994e-05,2129.6892603824012,COMPLETE
1919,0.37846797704696655,2023-09-04 23:02:44.662286,2023-09-04 23:02:45.046345,0 days 00:00:00.384059,Tanh,Tanh,ReLU,,21,21,17.0,15.0,,0.06527901429382482,3,255,0.3719283904329664,1.2583094891027276e-05,220.08299085828992,COMPLETE
1920,0.37110182642936707,2023-09-04 23:02:45.046856,2023-09-04 23:02:45.420457,0 days 00:00:00.373601,ReLU,,,,25,23,,,,0.0073554490159830396,1,248,0.6969318033393952,8.017237563081671e-05,105.57702560424805,COMPLETE
1921,0.3669007122516632,2023-09-04 23:02:45.420950,2023-09-04 23:02:46.325707,0 days 00:00:00.904757,Tanh,ReLU,Sigmoid,ReLU,27,20,16.0,6.0,12.0,0.0029590238956887145,4,233,0.6337963524305869,0.0006595422492143368,129.3836218697684,COMPLETE
1922,0.36660850048065186,2023-09-04 23:02:46.326214,2023-09-04 23:02:46.549574,0 days 00:00:00.223360,ReLU,Sigmoid,Tanh,,39,18,18.0,13.0,,0.00982369014898985,3,262,0.11421254115411242,0.0017519584217369827,151.39542770385742,COMPLETE
1923,0.3276318609714508,2023-09-04 23:02:46.550068,2023-09-04 23:02:47.342248,0 days 00:00:00.792180,Sigmoid,ReLU,ReLU,,30,23,12.0,17.0,,0.022244197449023215,3,275,0.7498460433585928,0.0010230874399212383,100.1836991743608,COMPLETE
1924,0.29794207215309143,2023-09-04 23:02:47.342753,2023-09-04 23:02:48.851835,0 days 00:00:01.509082,Tanh,ReLU,Leaky,Leaky,18,19,19.0,18.0,9.0,0.015218257390409563,4,243,0.7716495387913116,2.813159509097454e-05,93.06318075997488,COMPLETE
1925,0.3492042124271393,2023-09-04 23:02:48.852353,2023-09-04 23:02:49.347281,0 days 00:00:00.494928,ReLU,ReLU,Tanh,,23,21,16.0,16.0,,0.04602008157050209,3,253,0.6060881305385232,0.00040347944475827637,116.6764539082845,COMPLETE
1926,0.3227301239967346,2023-09-04 23:02:49.347796,2023-09-04 23:02:51.333979,0 days 00:00:01.986183,Tanh,ReLU,ReLU,ReLU,10,20,13.0,8.0,5.0,0.006248835366807368,4,230,0.4531668827116797,0.0011761555151856501,104.26665084838868,COMPLETE
1927,0.30966296792030334,2023-09-04 23:02:51.334492,2023-09-04 23:02:52.571726,0 days 00:00:01.237234,ReLU,Tanh,Sigmoid,,34,21,21.0,5.0,,0.004415375490382592,3,283,0.7238453324328924,3.5330379845475835e-05,109.12448374430339,COMPLETE
1928,0.36392930150032043,2023-09-04 23:02:52.572250,2023-09-04 23:02:53.769086,0 days 00:00:01.196836,Tanh,ReLU,Tanh,Sigmoid,37,19,14.0,14.0,23.0,0.003602802212959151,4,219,0.7490199549146134,1.8001680449102076e-05,81.20358780195129,COMPLETE
1929,0.3100825846195221,2023-09-04 23:02:53.769597,2023-09-04 23:02:54.511054,0 days 00:00:00.741457,ReLU,ReLU,ReLU,,22,23,18.0,7.0,,0.007418965703657601,3,267,0.662438887627956,0.016703056027763268,103.87442186143663,COMPLETE
1930,0.39155519008636475,2023-09-04 23:02:54.511558,2023-09-04 23:02:54.884400,0 days 00:00:00.372842,Tanh,ReLU,Leaky,Leaky,16,20,7.0,17.0,22.0,0.012042738453523825,4,241,0.1306918458532725,0.00020625429601538636,127.30204277038574,COMPLETE
1931,0.3924993872642517,2023-09-04 23:02:54.884912,2023-09-04 23:02:55.873528,0 days 00:00:00.988616,ReLU,ReLU,ReLU,,27,19,19.0,15.0,,0.0009557789645442996,3,258,0.3191819838974392,0.00015208430680137424,299.54596626365577,COMPLETE
1932,0.3931213915348053,2023-09-04 23:02:55.874024,2023-09-04 23:02:56.883426,0 days 00:00:01.009402,Tanh,Leaky,Tanh,,32,24,14.0,16.0,,0.00016348738743551501,3,249,0.1666535301626458,0.00012249968308983573,118.25699615478516,COMPLETE
1933,0.36447781324386597,2023-09-04 23:02:56.883951,2023-09-04 23:02:57.394226,0 days 00:00:00.510275,ReLU,ReLU,Sigmoid,ReLU,29,21,13.0,6.0,8.0,0.017934559774913397,4,141,0.23924989053266854,0.004713845053817,116.66984972746477,COMPLETE
1934,0.5053610801696777,2023-09-04 23:02:57.394747,2023-09-04 23:02:57.593658,0 days 00:00:00.198911,Tanh,Tanh,,,25,20,9.0,,,0.07414282030806556,2,235,0.19533960238859105,0.06245395673801728,333.9378833770752,COMPLETE
1935,0.4226473271846771,2023-09-04 23:02:57.594124,2023-09-04 23:02:59.088374,0 days 00:00:01.494250,ReLU,,,,19,18,,,,5.3226190977632534e-05,1,247,0.20446805202659984,5.46059425996919e-05,281.3056861784777,COMPLETE
1936,0.477508008480072,2023-09-04 23:02:59.088878,2023-09-04 23:03:01.310193,0 days 00:00:02.221315,Sigmoid,ReLU,ReLU,,22,23,14.0,7.0,,0.0001652015536830241,3,259,0.3104675076959874,0.05082303143973074,173.1855607622125,COMPLETE
1937,0.3818179965019226,2023-09-04 23:03:01.310702,2023-09-04 23:03:02.518897,0 days 00:00:01.208195,Tanh,ReLU,Tanh,Leaky,35,20,17.0,15.0,13.0,0.002686344062054849,4,240,0.7698527461134458,0.025061532881597015,96.50410903930664,COMPLETE
1938,0.4867609739303589,2023-09-04 23:03:02.519409,2023-09-04 23:03:02.905402,0 days 00:00:00.385993,ReLU,ReLU,Leaky,,13,21,5.0,18.0,,0.027369327705665025,3,271,0.21086074548689354,0.0007577658361196776,1998.3117850167412,COMPLETE
1939,0.3489565849304199,2023-09-04 23:03:02.905913,2023-09-04 23:03:04.167592,0 days 00:00:01.261679,Tanh,ReLU,ReLU,ReLU,28,19,12.0,12.0,10.0,0.001287878673962029,4,223,0.333596854537762,6.878512829240223e-05,109.44988069439879,COMPLETE
1940,0.2996501922607422,2023-09-04 23:03:04.168119,2023-09-04 23:03:04.973473,0 days 00:00:00.805354,ReLU,ReLU,Tanh,,40,23,9.0,17.0,,0.008872231160047806,3,229,0.7995863893558444,0.00026559709933597755,102.749880027771,COMPLETE
1941,0.499211847782135,2023-09-04 23:03:04.973979,2023-09-04 23:03:05.938336,0 days 00:00:00.964357,Tanh,Tanh,ReLU,Leaky,24,20,16.0,16.0,9.0,0.00587750976202688,4,451,0.5617138938264191,0.033779915651425726,135.01476331438337,COMPLETE
1942,0.3357515335083008,2023-09-04 23:03:05.938853,2023-09-04 23:03:06.582311,0 days 00:00:00.643458,ReLU,ReLU,Sigmoid,,30,21,17.0,14.0,,0.03614342563711574,3,253,0.7049005994877923,1.4671218188579658e-05,84.74463568793402,COMPLETE
1943,0.2719089686870575,2023-09-04 23:03:06.582832,2023-09-04 23:03:08.825710,0 days 00:00:02.242878,Tanh,ReLU,Tanh,,21,19,18.0,6.0,,0.0007356561470879225,3,235,0.7458122797482873,9.85630674305075e-05,108.72502632141114,COMPLETE
1944,0.26364457607269287,2023-09-04 23:03:08.826214,2023-09-04 23:03:10.402150,0 days 00:00:01.575936,ReLU,ReLU,ReLU,Sigmoid,33,22,13.0,17.0,12.0,0.010823931828744417,4,324,0.769952515477158,1.1832530978012446e-05,94.33788158710186,COMPLETE
1945,0.26720505952835083,2023-09-04 23:03:10.402670,2023-09-04 23:03:11.373041,0 days 00:00:00.970371,ReLU,ReLU,ReLU,Sigmoid,37,22,13.0,18.0,12.0,0.013134168526808506,4,369,0.7713536798082988,1.0339308113281312e-05,111.67477770549495,COMPLETE
1946,0.304132878780365,2023-09-04 23:03:11.373561,2023-09-04 23:03:16.604233,0 days 00:00:05.230672,Tanh,Leaky,ReLU,,35,22,13.0,18.0,,0.0002744062565974171,3,328,0.7993791097633293,1.0349012418845094e-05,97.10226002024181,COMPLETE
1947,0.3101794123649597,2023-09-04 23:03:16.604749,2023-09-04 23:03:17.267808,0 days 00:00:00.663059,ReLU,Sigmoid,ReLU,Sigmoid,34,22,13.0,18.0,13.0,0.011974405612347134,4,226,0.4719100253439973,1.2829619668404771e-05,95.2508460596988,COMPLETE
