number,value,datetime_start,datetime_complete,duration,params_activation1,params_activation2,params_activation3,params_activation4,params_batch_size,params_fl1,params_fl2,params_fl3,params_fl4,params_learning_rate,params_n_layers,params_num_epochs,params_train_size,params_weight_decay,user_attrs_mre,state
279,0.3091336190700531,2023-09-04 21:23:44.998214,2023-09-04 21:23:46.153058,0 days 00:00:01.154844,ReLU,Leaky,Leaky,,23,11,13.0,13.0,,0.014471822393170316,3,312,0.7468492177440041,0.00014353945231571552,99.20767364501953,COMPLETE
280,0.3820040225982666,2023-09-04 21:23:46.153391,2023-09-04 21:23:47.929919,0 days 00:00:01.776528,Tanh,Leaky,Tanh,,19,2,16.0,8.0,,0.011097731603881679,3,351,0.7027241380316149,0.0002754635397971914,104.77723394121442,COMPLETE
281,0.3310682475566864,2023-09-04 21:23:47.930444,2023-09-04 21:23:49.315560,0 days 00:00:01.385116,Tanh,Leaky,Leaky,,26,13,15.0,14.0,,0.004985676492651727,3,405,0.3682550803536412,0.00023692907285813284,101.41723926250751,COMPLETE
282,0.3907967209815979,2023-09-04 21:23:49.316104,2023-09-04 21:23:51.118850,0 days 00:00:01.802746,Tanh,Leaky,Leaky,,16,9,14.0,5.0,,0.008811861497863886,3,325,0.7724520621211238,0.0003675500609291668,117.09870175962095,COMPLETE
283,0.39094293117523193,2023-09-04 21:23:51.119261,2023-09-04 21:23:51.577834,0 days 00:00:00.458573,Tanh,Leaky,Leaky,,22,4,18.0,10.0,,0.037035662895138696,3,279,0.7995666922491004,0.0001597995600387056,120.67479298909505,COMPLETE
284,0.3078802824020386,2023-09-04 21:23:51.578157,2023-09-04 21:23:52.889572,0 days 00:00:01.311415,Tanh,Leaky,Leaky,,20,12,17.0,15.0,,0.003385395237335192,3,382,0.618108909793333,0.002141839555013183,114.7154074774848,COMPLETE
285,0.35825029015541077,2023-09-04 21:23:52.889967,2023-09-04 21:23:53.316506,0 days 00:00:00.426539,Tanh,Leaky,Leaky,,32,11,14.0,13.0,,0.007324394700451181,3,344,0.5586619264030617,0.00032280440630537665,101.80151141131365,COMPLETE
286,0.2593992054462433,2023-09-04 21:23:53.316814,2023-09-04 21:23:54.145390,0 days 00:00:00.828576,ReLU,Leaky,Leaky,,18,21,15.0,7.0,,0.013781743319575658,3,365,0.7358271876758308,0.0001980138068187006,95.85580737774188,COMPLETE
287,0.3416089415550232,2023-09-04 21:23:54.145711,2023-09-04 21:23:54.770082,0 days 00:00:00.624371,Leaky,Sigmoid,Leaky,,18,20,15.0,7.0,,0.015775234440956992,3,364,0.47907895675047474,0.0001937442017674066,135.4701716982085,COMPLETE
288,0.3395150899887085,2023-09-04 21:23:54.770388,2023-09-04 21:23:55.660782,0 days 00:00:00.890394,Tanh,Leaky,Leaky,,15,17,16.0,23.0,,0.013824515094271232,3,374,0.7372618560616113,0.00013242388631427003,88.26774470011394,COMPLETE
289,0.3860146999359131,2023-09-04 21:23:55.661118,2023-09-04 21:24:07.483907,0 days 00:00:11.822789,Tanh,Leaky,Leaky,,17,21,15.0,7.0,,1.3490815331229965e-05,3,359,0.7527723893142592,0.00017365835218467073,113.75970731007355,COMPLETE
290,0.4241640567779541,2023-09-04 21:24:07.484234,2023-09-04 21:24:07.712868,0 days 00:00:00.228634,ReLU,Leaky,ReLU,,21,10,13.0,8.0,,0.010515458383227866,3,349,0.20786693575150325,0.00022928422878826815,138.17712465922037,COMPLETE
291,0.3631180226802826,2023-09-04 21:24:07.713198,2023-09-04 21:24:08.748204,0 days 00:00:01.035006,Tanh,Leaky,Leaky,,18,12,15.0,12.0,,0.012562214205363992,3,391,0.7104146097563862,0.004383624414209256,97.53054428100586,COMPLETE
292,0.32333046197891235,2023-09-04 21:24:08.748532,2023-09-04 21:24:09.645426,0 days 00:00:00.896894,Tanh,Leaky,Leaky,,57,11,16.0,13.0,,0.0016887077200274177,3,368,0.7707549551167442,0.00027403992449010297,90.42283787446864,COMPLETE
293,0.34102368354797363,2023-09-04 21:24:09.645785,2023-09-04 21:24:10.758484,0 days 00:00:01.112699,Tanh,Leaky,Leaky,,41,10,14.0,14.0,,0.001331746353169545,3,332,0.7224308300373488,0.00019953730351892328,87.68670342673718,COMPLETE
294,0.3050695061683655,2023-09-04 21:24:10.758791,2023-09-04 21:24:11.595317,0 days 00:00:00.836526,Tanh,Leaky,Leaky,,14,12,15.0,12.0,,0.006611755491918454,3,358,0.6956409176401066,0.00015529124532435217,94.67687918923117,COMPLETE
295,0.3716830015182495,2023-09-04 21:24:11.595637,2023-09-04 21:24:12.248077,0 days 00:00:00.652440,Tanh,Leaky,Leaky,,20,21,14.0,15.0,,0.008862639251599096,3,343,0.4639657060613817,0.011067935085542335,108.94017657111672,COMPLETE
296,0.2558712065219879,2023-09-04 21:24:12.248413,2023-09-04 21:24:13.191788,0 days 00:00:00.943375,ReLU,Leaky,,,24,11,16.0,,,0.016659401882165466,2,376,0.7358688432428782,9.425801048019167e-05,99.3662923729938,COMPLETE
297,0.25677305459976196,2023-09-04 21:24:13.192116,2023-09-04 21:24:14.112668,0 days 00:00:00.920552,ReLU,Sigmoid,,,24,11,17.0,,,0.01710981467170082,2,369,0.7419259498598311,0.00010357551897953187,108.22778337652034,COMPLETE
298,0.26841267943382263,2023-09-04 21:24:14.112999,2023-09-04 21:24:14.912275,0 days 00:00:00.799276,ReLU,Sigmoid,,,25,9,16.0,,,0.017361345145342388,2,378,0.7976505613732019,9.01822817720304e-05,114.36707615207982,COMPLETE
299,0.31876838207244873,2023-09-04 21:24:14.912588,2023-09-04 21:24:15.711177,0 days 00:00:00.798589,ReLU,Sigmoid,,,25,9,16.0,,,0.017402212024166964,2,379,0.7761522182392749,0.00010240570394668987,90.85433578491211,COMPLETE
300,0.2804580628871918,2023-09-04 21:24:15.711493,2023-09-04 21:24:16.512317,0 days 00:00:00.800824,ReLU,Sigmoid,,,24,10,17.0,,,0.02296890040582383,2,371,0.7900528623908583,8.50975396310829e-05,104.8948794470893,COMPLETE
301,0.34018921852111816,2023-09-04 21:24:16.512648,2023-09-04 21:24:17.256579,0 days 00:00:00.743931,ReLU,Sigmoid,,,24,9,18.0,,,0.024839422685904403,2,393,0.7967493582990913,8.339399654261158e-05,81.2274935173266,COMPLETE
302,0.28308963775634766,2023-09-04 21:24:17.256911,2023-09-04 21:24:17.717333,0 days 00:00:00.460422,ReLU,Sigmoid,,,26,10,17.0,,,0.02210804044070793,2,371,0.7715211315457526,9.343697339555384e-05,83.4295838095925,COMPLETE
303,0.2902994155883789,2023-09-04 21:24:17.717644,2023-09-04 21:24:18.234954,0 days 00:00:00.517310,ReLU,Sigmoid,,,28,10,17.0,,,0.021493454213323982,2,389,0.7730847166989521,8.647531610918972e-05,83.28782624464769,COMPLETE
304,0.321026086807251,2023-09-04 21:24:18.235288,2023-09-04 21:24:19.258317,0 days 00:00:01.023029,ReLU,Sigmoid,,,26,10,17.0,,,0.025158911166512275,2,375,0.7979700515126416,7.391258866950699e-05,87.254822070782,COMPLETE
305,0.4496455192565918,2023-09-04 21:24:19.258850,2023-09-04 21:24:19.644617,0 days 00:00:00.385767,ReLU,Sigmoid,,,24,9,17.0,,,0.019963381563721908,2,382,0.1078722695515141,0.00010090024514704329,159.92898733956474,COMPLETE
306,0.3070429265499115,2023-09-04 21:24:19.645197,2023-09-04 21:24:21.953892,0 days 00:00:02.308695,ReLU,Sigmoid,,,29,10,17.0,,,0.02235089965880434,2,368,0.7662068825132037,6.598345287957832e-05,88.74715884896212,COMPLETE
307,0.30369850993156433,2023-09-04 21:24:21.954411,2023-09-04 21:24:23.731506,0 days 00:00:01.777095,ReLU,Sigmoid,,,25,8,18.0,,,0.03180115968836367,2,372,0.7468798854765936,6.044696295893743e-05,99.15017064412434,COMPLETE
308,0.3333994746208191,2023-09-04 21:24:23.732038,2023-09-04 21:24:30.363989,0 days 00:00:06.631951,ReLU,Sigmoid,,,27,6,17.0,,,0.016619938374139717,2,383,0.7960260478762998,0.00010768571648573475,132.60903676350912,COMPLETE
309,0.30189916491508484,2023-09-04 21:24:30.364514,2023-09-04 21:24:32.720019,0 days 00:00:02.355505,ReLU,Sigmoid,,,23,10,17.0,,,0.017444758731120523,2,366,0.7619224920042658,8.783362993059287e-05,112.87821076133035,COMPLETE
310,0.3133140206336975,2023-09-04 21:24:32.720344,2023-09-04 21:24:33.771186,0 days 00:00:01.050842,ReLU,Sigmoid,,,26,11,18.0,,,0.015975670185209824,2,373,0.7380854134731746,8.234596695074652e-05,104.53802850896662,COMPLETE
311,0.3718937337398529,2023-09-04 21:24:33.771518,2023-09-04 21:24:34.319043,0 days 00:00:00.547525,ReLU,Sigmoid,,,23,11,16.0,,,0.02791625341056713,2,396,0.7726292614580678,0.00010414669769935531,98.83983039855957,COMPLETE
312,0.334491103887558,2023-09-04 21:24:34.319361,2023-09-04 21:24:34.583461,0 days 00:00:00.264100,ReLU,Sigmoid,,,29,10,17.0,,,0.02043964450027773,2,379,0.411850597042382,5.897731649638992e-05,202.50864028930664,COMPLETE
313,0.31014585494995117,2023-09-04 21:24:34.583791,2023-09-04 21:24:35.091095,0 days 00:00:00.507304,ReLU,Sigmoid,,,70,9,16.0,,,0.014123610201272589,2,403,0.7277554629570647,8.952702568645986e-05,95.60605042069047,COMPLETE
314,0.3336015045642853,2023-09-04 21:24:35.091424,2023-09-04 21:24:35.783929,0 days 00:00:00.692505,ReLU,Sigmoid,,,23,11,16.0,,,0.014017840108522367,2,363,0.7949144322340507,0.00012028773447429704,101.28439280192057,COMPLETE
315,0.3631499409675598,2023-09-04 21:24:35.784357,2023-09-04 21:24:37.006984,0 days 00:00:01.222627,ReLU,Sigmoid,,,26,10,18.0,,,0.002560782453064553,2,386,0.4179181121005825,7.407395625749872e-05,105.76690980366298,COMPLETE
316,0.38293710350990295,2023-09-04 21:24:37.007409,2023-09-04 21:24:40.292846,0 days 00:00:03.285437,ReLU,ReLU,,,31,11,17.0,,,0.00028991593604233063,2,369,0.5832706916299043,9.908612814643508e-05,316.56297964643136,COMPLETE
317,0.3947995603084564,2023-09-04 21:24:40.293253,2023-09-04 21:24:41.302836,0 days 00:00:01.009583,ReLU,Sigmoid,ReLU,,45,10,16.0,10.0,,0.0007002724955983174,3,361,0.7487817390078046,0.00011646278908284836,172.54840434681284,COMPLETE
318,0.306342750787735,2023-09-04 21:24:41.303139,2023-09-04 21:24:42.170316,0 days 00:00:00.867177,ReLU,Sigmoid,,,25,11,17.0,,,0.02371868921593117,2,378,0.7136976397682445,7.383871095775284e-05,96.15827568901909,COMPLETE
319,0.3614957332611084,2023-09-04 21:24:42.170624,2023-09-04 21:24:43.137872,0 days 00:00:00.967248,ReLU,Sigmoid,,,22,11,11.0,,,0.018526403486524033,2,360,0.798437106693704,0.00012870002362972257,104.63867299149676,COMPLETE
320,0.3343712389469147,2023-09-04 21:24:43.138193,2023-09-04 21:24:44.539422,0 days 00:00:01.401229,ReLU,Leaky,,,28,10,15.0,,,0.003950242215857224,2,369,0.5220872506771418,8.713567011694591e-05,126.55075238785653,COMPLETE
321,0.412298321723938,2023-09-04 21:24:44.539961,2023-09-04 21:24:52.464823,0 days 00:00:07.924862,Sigmoid,Sigmoid,,,24,9,18.0,,,0.00048013924403661186,2,387,0.7580973914513149,9.924574619271016e-05,102.72824453506666,COMPLETE
322,0.3078712224960327,2023-09-04 21:24:52.465134,2023-09-04 21:24:54.043674,0 days 00:00:01.578540,ReLU,Leaky,,,22,11,16.0,,,0.003022802728332753,2,253,0.6725019688726787,5.2183386048528185e-05,205.63195400238038,COMPLETE
323,0.32295605540275574,2023-09-04 21:24:54.044022,2023-09-04 21:24:54.905410,0 days 00:00:00.861388,ReLU,Leaky,,,24,10,10.0,,,0.005270713285471355,2,356,0.7249447104405567,6.73114898508169e-05,103.17570779489917,COMPLETE
324,0.30201250314712524,2023-09-04 21:24:54.905737,2023-09-04 21:24:57.184767,0 days 00:00:02.279030,ReLU,Leaky,,,27,11,17.0,,,0.001186898496495055,2,374,0.7527876392735356,0.00013273524792333533,105.73195499327124,COMPLETE
325,0.31711310148239136,2023-09-04 21:24:57.185093,2023-09-04 21:24:58.206184,0 days 00:00:01.021091,ReLU,Leaky,,,30,8,16.0,,,0.00198493331310383,2,363,0.6032997879013365,0.0001104651354816052,108.18073983388405,COMPLETE
326,0.32437631487846375,2023-09-04 21:24:58.206498,2023-09-04 21:24:58.711064,0 days 00:00:00.504566,ReLU,,,,21,9,,,,0.012634109896200256,1,233,0.643426883460644,0.0013114256841671222,90.15076994895935,COMPLETE
327,0.4401722550392151,2023-09-04 21:24:58.711373,2023-09-04 21:25:03.883120,0 days 00:00:05.171747,Leaky,Leaky,,,25,10,15.0,,,1.835366655040845e-05,2,209,0.7048688988379649,0.0008566138941058464,107.35201281679875,COMPLETE
328,0.35964226722717285,2023-09-04 21:25:03.883427,2023-09-04 21:25:05.407953,0 days 00:00:01.524526,ReLU,ReLU,,,22,11,17.0,,,0.001001526278310416,2,395,0.37816962166227486,0.017473111752007536,296.30720463083753,COMPLETE
329,0.35533031821250916,2023-09-04 21:25:05.408291,2023-09-04 21:25:05.786217,0 days 00:00:00.377926,ReLU,Sigmoid,,,74,11,18.0,,,0.015081601459824049,2,262,0.4492413060613884,5.2691940752558394e-05,157.65114005667263,COMPLETE
330,0.4920952618122101,2023-09-04 21:25:05.786544,2023-09-04 21:25:08.202009,0 days 00:00:02.415465,Sigmoid,Leaky,,,28,5,15.0,,,7.587062621801598e-05,2,289,0.3389291144523426,0.00102480248244351,109.82005265179802,COMPLETE
331,0.3226136565208435,2023-09-04 21:25:08.202317,2023-09-04 21:25:08.842085,0 days 00:00:00.639768,Tanh,Leaky,,,20,12,16.0,,,0.03363725072570018,2,412,0.7696878148785262,7.76324903185103e-05,114.50279693603515,COMPLETE
332,0.3650222718715668,2023-09-04 21:25:08.842409,2023-09-04 21:25:16.221141,0 days 00:00:07.378732,ReLU,Leaky,,,12,10,19.0,,,0.0001722455652744914,2,359,0.6865300494448909,0.005314347117523029,99.9570451788946,COMPLETE
333,0.3022609353065491,2023-09-04 21:25:16.221466,2023-09-04 21:25:16.854529,0 days 00:00:00.633063,Tanh,Leaky,,,24,11,15.0,,,0.0189941223267128,2,378,0.7230240212081475,0.0016522534730682588,97.01600105531755,COMPLETE
334,0.31840550899505615,2023-09-04 21:25:16.854860,2023-09-04 21:25:17.209818,0 days 00:00:00.354958,Tanh,Leaky,,,35,24,18.0,,,0.026725110158088004,2,353,0.3910529584261677,4.0828253152639804e-05,143.62629895332532,COMPLETE
335,0.2891019582748413,2023-09-04 21:25:17.210157,2023-09-04 21:25:20.670408,0 days 00:00:03.460251,Tanh,Sigmoid,Tanh,,32,19,17.0,18.0,,0.000818187736401614,3,302,0.7710400876031804,0.0004592625537956843,100.99372179754849,COMPLETE
336,0.41911497712135315,2023-09-04 21:25:20.670749,2023-09-04 21:25:22.182414,0 days 00:00:01.511665,ReLU,,,,22,12,,,,0.000587931481246753,1,189,0.7399238234889097,0.09729391135586073,94.48688935697749,COMPLETE
337,0.3191307485103607,2023-09-04 21:25:22.182728,2023-09-04 21:25:22.679271,0 days 00:00:00.496543,Tanh,Leaky,,,20,11,16.0,,,0.012270357642945106,2,337,0.70075485005061,0.00014196104340410433,101.30382973807198,COMPLETE
338,0.36570194363594055,2023-09-04 21:25:22.679594,2023-09-04 21:25:24.214011,0 days 00:00:01.534417,Leaky,Leaky,ReLU,,27,7,14.0,16.0,,0.004553024725187344,3,374,0.796240181942151,0.0007677331445331086,94.47231220063709,COMPLETE
339,0.31673571467399597,2023-09-04 21:25:24.214343,2023-09-04 21:25:26.922935,0 days 00:00:02.708592,Tanh,Leaky,Tanh,,25,10,15.0,9.0,,0.0003825990298472239,3,272,0.7998622119379437,0.001916457286286428,97.56990602281358,COMPLETE
340,0.3648660182952881,2023-09-04 21:25:26.923267,2023-09-04 21:25:28.201410,0 days 00:00:01.278143,Tanh,Sigmoid,ReLU,,23,12,12.0,21.0,,0.015432999777452789,3,325,0.6521556009127869,0.0032878156134943533,110.13163566589355,COMPLETE
341,0.4453635811805725,2023-09-04 21:25:28.201743,2023-09-04 21:25:28.685937,0 days 00:00:00.484194,ReLU,Leaky,Leaky,,30,6,2.0,24.0,,0.042631791568482416,3,368,0.5337842607329264,0.0005674352573426009,115.030761226531,COMPLETE
342,0.3174462914466858,2023-09-04 21:25:28.686290,2023-09-04 21:25:29.948711,0 days 00:00:01.262421,Tanh,Leaky,Leaky,,19,11,11.0,11.0,,0.0062467700864671065,3,315,0.7404817396054413,9.586242074722143e-05,106.01115523937136,COMPLETE
343,0.39065685868263245,2023-09-04 21:25:29.949047,2023-09-04 21:25:30.389384,0 days 00:00:00.440337,Tanh,Leaky,Leaky,,16,10,6.0,6.0,,0.022584826602794723,3,358,0.492479818410634,0.000304468281345747,109.38880327012804,COMPLETE
344,0.34499654173851013,2023-09-04 21:25:30.389731,2023-09-04 21:25:32.061081,0 days 00:00:01.671350,Tanh,Leaky,,,26,20,16.0,,,0.0014800943004410635,2,241,0.43078015716455237,0.009670160327612254,98.99241805076599,COMPLETE
345,0.2931992709636688,2023-09-04 21:25:32.061634,2023-09-04 21:25:33.219094,0 days 00:00:01.157460,ReLU,Sigmoid,Leaky,,21,9,10.0,1.0,,0.017936531780385286,3,348,0.6794898085523005,0.00036913782555252566,100.09348887781942,COMPLETE
346,0.3190283179283142,2023-09-04 21:25:33.219412,2023-09-04 21:25:33.541938,0 days 00:00:00.322526,Tanh,Leaky,Leaky,,24,17,14.0,8.0,,0.007346294157374511,3,384,0.29661809483350926,0.00012816401684113239,113.6659014471646,COMPLETE
347,0.3064192533493042,2023-09-04 21:25:33.542261,2023-09-04 21:25:35.098065,0 days 00:00:01.555804,Tanh,Leaky,Leaky,,22,11,16.0,20.0,,0.003273640465714401,3,336,0.762827337079421,0.0024514222859989766,119.29582696211965,COMPLETE
348,0.31528958678245544,2023-09-04 21:25:35.098390,2023-09-04 21:25:36.161664,0 days 00:00:01.063274,ReLU,Leaky,ReLU,,18,12,15.0,23.0,,0.0010320182481867472,3,400,0.35344266659166274,0.00015482992937930647,143.1122306049734,COMPLETE
349,0.32780158519744873,2023-09-04 21:25:36.162003,2023-09-04 21:25:37.094479,0 days 00:00:00.932476,Tanh,Sigmoid,,,28,10,17.0,,,0.013666620445811248,2,367,0.7194520148282395,0.00010979775987229695,102.56977613916936,COMPLETE
350,0.3117983043193817,2023-09-04 21:25:37.094810,2023-09-04 21:25:38.146179,0 days 00:00:01.051369,Tanh,Leaky,Sigmoid,,14,11,13.0,19.0,,0.010596086398888451,3,351,0.5724089034627386,0.001462425116463794,123.42972362742705,COMPLETE
351,0.33471718430519104,2023-09-04 21:25:38.146517,2023-09-04 21:25:38.631603,0 days 00:00:00.485086,Sigmoid,Leaky,Leaky,,65,12,15.0,22.0,,0.008608500241349754,3,389,0.3912564378730596,8.62278450479824e-05,104.80998982174296,COMPLETE
352,0.38941094279289246,2023-09-04 21:25:38.632045,2023-09-04 21:25:39.851672,0 days 00:00:01.219627,Tanh,ReLU,Leaky,,62,10,16.0,15.0,,0.001163090237090244,3,342,0.5053241260360294,0.036800486521747756,122.55169859386626,COMPLETE
353,0.3159550428390503,2023-09-04 21:25:39.852029,2023-09-04 21:25:41.458654,0 days 00:00:01.606625,ReLU,Leaky,Leaky,Leaky,20,21,17.0,4.0,6.0,0.002349622087346337,4,379,0.7410237992939188,0.00028205181515811344,116.64774306615193,COMPLETE
354,0.2944895029067993,2023-09-04 21:25:41.459009,2023-09-04 21:25:43.838114,0 days 00:00:02.379105,Tanh,Leaky,,,26,13,14.0,,,0.0007403997735781795,2,363,0.7667739638008068,0.0011043123059969401,97.8870698897565,COMPLETE
355,0.3252755105495453,2023-09-04 21:25:43.838437,2023-09-04 21:25:44.573179,0 days 00:00:00.734742,Tanh,Sigmoid,Leaky,,23,23,18.0,6.0,,0.015833064294909174,3,331,0.7045144980074571,0.0006553263388632359,103.0810783649313,COMPLETE
356,0.3161729872226715,2023-09-04 21:25:44.573518,2023-09-04 21:25:45.166876,0 days 00:00:00.593358,ReLU,Leaky,Leaky,,33,11,12.0,11.0,,0.01178512506250345,3,351,0.6316139779384876,0.00034735166975582044,86.46117728097099,COMPLETE
357,0.3429436683654785,2023-09-04 21:25:45.167207,2023-09-04 21:25:46.061374,0 days 00:00:00.894167,Tanh,Leaky,Leaky,,21,14,15.0,10.0,,0.005384372195552374,3,372,0.7356033677642912,0.003986938929331005,125.59232568740845,COMPLETE
358,0.29465118050575256,2023-09-04 21:25:46.061714,2023-09-04 21:25:51.886994,0 days 00:00:05.825280,Tanh,Leaky,Leaky,,17,11,16.0,8.0,,0.0005468347994394636,3,497,0.7705316946418962,0.00019003634456550062,101.66669071584508,COMPLETE
359,0.3583468198776245,2023-09-04 21:25:51.887318,2023-09-04 21:25:59.701529,0 days 00:00:07.814211,ReLU,Sigmoid,,,24,10,17.0,,,0.00024303399577537888,2,358,0.7983835630152287,0.00043650428530311994,103.80421739716769,COMPLETE
360,0.3436945080757141,2023-09-04 21:25:59.701844,2023-09-04 21:26:03.128267,0 days 00:00:03.426423,Tanh,Leaky,Leaky,,30,9,13.0,6.0,,0.00031427551560174965,3,267,0.46823813050213614,0.0001164330647897685,102.92629719137699,COMPLETE
361,0.3034747242927551,2023-09-04 21:26:03.128593,2023-09-04 21:26:03.563006,0 days 00:00:00.434413,Tanh,Leaky,Leaky,,37,12,15.0,5.0,,0.02025239247711634,3,344,0.6622652997408567,6.481283304517401e-05,136.0829951946552,COMPLETE
362,0.34763240814208984,2023-09-04 21:26:03.563351,2023-09-04 21:26:04.942998,0 days 00:00:01.379647,Tanh,Leaky,Tanh,,19,11,14.0,16.0,,0.0013112273048681588,3,217,0.31493995949918985,0.00016994834109576397,106.9497456967252,COMPLETE
363,0.32767266035079956,2023-09-04 21:26:04.943345,2023-09-04 21:26:05.645713,0 days 00:00:00.702368,ReLU,Leaky,,,26,11,17.0,,,0.0038883078063651285,2,290,0.6877714299169702,0.0002676925375544734,100.16252497622841,COMPLETE
364,0.9456338286399841,2023-09-04 21:26:05.646050,2023-09-04 21:26:07.982574,0 days 00:00:02.336524,Leaky,Sigmoid,Leaky,ReLU,23,12,19.0,3.0,1.0,0.0009046083901347894,4,366,0.7258527539188688,9.173469100381004e-05,112.27973556518555,COMPLETE
365,0.279060959815979,2023-09-04 21:26:07.982936,2023-09-04 21:26:08.963747,0 days 00:00:00.980811,Tanh,Leaky,ReLU,,25,13,18.0,7.0,,0.013854945573362018,3,381,0.7560498893872798,0.0005369762499314406,89.21831297263121,COMPLETE
366,0.2752555012702942,2023-09-04 21:26:08.964078,2023-09-04 21:26:09.693017,0 days 00:00:00.728939,Tanh,Leaky,ReLU,,25,13,18.0,7.0,,0.013392995840186415,3,389,0.7657724752860778,0.0004050049767559481,109.89654922485352,COMPLETE
367,0.307717889547348,2023-09-04 21:26:09.693348,2023-09-04 21:26:10.673111,0 days 00:00:00.979763,Tanh,Leaky,ReLU,,25,13,18.0,7.0,,0.01267953268983717,3,398,0.7681493378354166,0.0004222876171685659,116.84981637252004,COMPLETE
368,0.29357588291168213,2023-09-04 21:26:10.673459,2023-09-04 21:26:11.925992,0 days 00:00:01.252533,ReLU,Leaky,ReLU,,25,14,18.0,7.0,,0.015425527017608192,3,389,0.7692204676063443,0.00038502313222355715,96.89770461101921,COMPLETE
369,0.3709685504436493,2023-09-04 21:26:11.926321,2023-09-04 21:26:12.278447,0 days 00:00:00.352126,Tanh,Sigmoid,,,27,13,19.0,,,0.017703960270123737,2,385,0.22926884143631723,0.0003191738124315744,126.44733238220215,COMPLETE
370,0.4020330011844635,2023-09-04 21:26:12.278763,2023-09-04 21:26:12.928402,0 days 00:00:00.649639,Tanh,Leaky,ReLU,,28,13,19.0,9.0,,0.01352273573705546,3,396,0.7982841147935876,0.0022499917746735282,103.23878625723032,COMPLETE
371,0.3159506320953369,2023-09-04 21:26:12.928739,2023-09-04 21:26:13.469088,0 days 00:00:00.540349,ReLU,Leaky,ReLU,,23,14,18.0,7.0,,0.010961239905735864,3,410,0.7489781021392943,0.0005010323795792704,100.38185424804688,COMPLETE
372,0.3194797933101654,2023-09-04 21:26:13.469428,2023-09-04 21:26:14.184900,0 days 00:00:00.715472,Tanh,Leaky,,,26,13,18.0,,,0.009105791474924713,2,376,0.7233604831942949,7.750768392348993e-05,101.16582633353569,COMPLETE
373,0.329860121011734,2023-09-04 21:26:14.185239,2023-09-04 21:26:15.190100,0 days 00:00:01.004861,Tanh,Leaky,ReLU,,24,13,17.0,6.0,,0.023158883645950097,3,419,0.7497482515729372,0.0005883791671724795,111.58571194379758,COMPLETE
