number,value,datetime_start,datetime_complete,duration,params_activation1,params_activation2,params_activation3,params_activation4,params_batch_size,params_fl1,params_fl2,params_fl3,params_fl4,params_learning_rate,params_n_layers,params_num_epochs,params_train_size,params_weight_decay,user_attrs_mre,state
90,0.27183017134666443,2023-09-04 22:09:53.316662,2023-09-04 22:09:54.235406,0 days 00:00:00.918744,Leaky,Tanh,Sigmoid,Leaky,45,23,20.0,18.0,7.0,0.014260832724451831,4,253,0.591463526658463,0.0005821423911973847,131.3220479329427,COMPLETE
91,0.3550412058830261,2023-09-04 22:09:54.235769,2023-09-04 22:09:54.904352,0 days 00:00:00.668583,Leaky,Tanh,Sigmoid,Leaky,53,22,20.0,18.0,7.0,0.014775517746060013,4,259,0.5865496985903565,0.0005913534882122045,297.8934621396272,COMPLETE
92,0.4007769823074341,2023-09-04 22:09:54.904690,2023-09-04 22:09:55.545945,0 days 00:00:00.641255,Leaky,Tanh,Sigmoid,Leaky,43,23,21.0,19.0,7.0,0.009527571370195474,4,190,0.6499852945712351,0.0007557330206293772,119.57360498528732,COMPLETE
93,0.3072872757911682,2023-09-04 22:09:55.546260,2023-09-04 22:09:56.089173,0 days 00:00:00.542913,Leaky,Tanh,Sigmoid,Leaky,46,23,18.0,17.0,10.0,0.012008438063781055,4,304,0.7174621323963353,0.0003881947604132692,123.21728121849799,COMPLETE
94,0.29728543758392334,2023-09-04 22:09:56.089488,2023-09-04 22:09:56.609298,0 days 00:00:00.519810,Leaky,Tanh,Sigmoid,Leaky,64,21,20.0,8.0,14.0,0.01726597116395225,4,243,0.7635168859968771,0.00043655219895297914,274.47916348775226,COMPLETE
95,0.26610851287841797,2023-09-04 22:09:56.609619,2023-09-04 22:09:57.297479,0 days 00:00:00.687860,Leaky,Leaky,Sigmoid,Leaky,35,22,19.0,21.0,8.0,0.02346014189967314,4,290,0.6139459288037478,0.0002717573567916433,117.00670561919341,COMPLETE
96,0.3148342967033386,2023-09-04 22:09:57.297872,2023-09-04 22:09:57.910023,0 days 00:00:00.612151,Leaky,Leaky,Sigmoid,Leaky,33,19,19.0,22.0,6.0,0.021857071947351654,4,327,0.5620937893522125,0.0002542225365979295,141.84064865112305,COMPLETE
97,0.26680976152420044,2023-09-04 22:09:57.910427,2023-09-04 22:09:58.749691,0 days 00:00:00.839264,Leaky,Leaky,Sigmoid,Sigmoid,29,22,18.0,21.0,8.0,0.028301255700014284,4,294,0.6877979796041764,0.0005174659448684964,143.3567771911621,COMPLETE
98,0.362526535987854,2023-09-04 22:09:58.750096,2023-09-04 22:09:59.484764,0 days 00:00:00.734668,Leaky,Leaky,Sigmoid,ReLU,29,24,18.0,20.0,8.0,0.02682691303951135,4,268,0.6886446243931194,0.0003412108564522428,128.7756350117345,COMPLETE
99,0.3973763585090637,2023-09-04 22:09:59.485167,2023-09-04 22:09:59.802866,0 days 00:00:00.317699,Sigmoid,Leaky,Sigmoid,,34,22,16.0,21.0,,0.03966831706551758,3,314,0.6128761511289537,0.0005306570851071221,163.71800443861218,COMPLETE
100,0.24042601883411407,2023-09-04 22:09:59.803245,2023-09-04 22:10:00.308257,0 days 00:00:00.505012,Leaky,Leaky,Sigmoid,Leaky,39,24,17.0,24.0,6.0,0.05120890144773886,4,220,0.7633270090253753,0.00019527586052642235,112.43106396993001,COMPLETE
101,0.3215717673301697,2023-09-04 22:10:00.308613,2023-09-04 22:10:01.465022,0 days 00:00:01.156409,Leaky,Leaky,Sigmoid,Leaky,29,24,17.0,24.0,5.0,0.055373255304830116,4,290,0.7618714971785742,0.00019288697227702207,435.21336815573954,COMPLETE
102,0.2787902057170868,2023-09-04 22:10:01.465345,2023-09-04 22:10:02.099578,0 days 00:00:00.634233,Leaky,Leaky,Sigmoid,Leaky,41,23,18.0,23.0,6.0,0.03082947248713454,4,212,0.7232547311697167,0.00014302169681678235,117.32359873453775,COMPLETE
103,0.3254207968711853,2023-09-04 22:10:02.099894,2023-09-04 22:10:02.798608,0 days 00:00:00.698714,Leaky,Leaky,Sigmoid,Leaky,38,22,16.0,22.0,8.0,0.022666135752585886,4,296,0.6894858498318542,0.00021743685971481122,114.71169303445255,COMPLETE
104,0.37497657537460327,2023-09-04 22:10:02.798927,2023-09-04 22:10:03.595320,0 days 00:00:00.796393,Leaky,Leaky,Sigmoid,Leaky,44,22,19.0,23.0,9.0,0.04142294578966366,4,276,0.732468437495501,0.0002720433749737636,137.40589611346905,COMPLETE
105,0.24520623683929443,2023-09-04 22:10:03.595623,2023-09-04 22:10:04.857635,0 days 00:00:01.262012,Leaky,Leaky,Sigmoid,Leaky,50,23,20.0,21.0,3.0,0.01615324124946284,4,229,0.7999294265642415,0.00044805798397248267,120.59839117704932,COMPLETE
106,0.3113454282283783,2023-09-04 22:10:04.857954,2023-09-04 22:10:05.442654,0 days 00:00:00.584700,Leaky,Leaky,Sigmoid,Sigmoid,51,24,20.0,21.0,2.0,0.027582310955281814,4,229,0.772541805630341,0.00046492092393719743,115.002973614317,COMPLETE
107,0.39555078744888306,2023-09-04 22:10:05.443001,2023-09-04 22:10:06.220670,0 days 00:00:00.777669,Leaky,Leaky,Tanh,Leaky,50,23,18.0,21.0,4.0,0.048903065686262036,4,247,0.7517393818220619,0.0006569414510848938,158.65647599962023,COMPLETE
108,0.274169921875,2023-09-04 22:10:06.221022,2023-09-04 22:10:06.819042,0 days 00:00:00.598020,Leaky,Leaky,Sigmoid,Leaky,45,23,15.0,20.0,3.0,0.01639743947308484,4,220,0.6702325344941996,0.00034403728185000893,112.37424917782054,COMPLETE
109,0.3194359838962555,2023-09-04 22:10:06.819389,2023-09-04 22:10:07.739211,0 days 00:00:00.919822,Leaky,Leaky,Sigmoid,Sigmoid,48,23,15.0,23.0,4.0,0.023014782511384717,4,201,0.6650631813395733,0.000323443182613457,168.6925606978567,COMPLETE
110,0.3656511604785919,2023-09-04 22:10:07.739533,2023-09-04 22:10:08.122667,0 days 00:00:00.383134,Leaky,Leaky,Sigmoid,Tanh,58,24,14.0,20.0,3.0,0.036691531139275625,4,218,0.7008031021206416,0.0005889075199100333,205.50021567711462,COMPLETE
111,0.8473224639892578,2023-09-04 22:10:08.123070,2023-09-04 22:10:08.489358,0 days 00:00:00.366288,Leaky,Leaky,Sigmoid,Leaky,37,11,17.0,21.0,3.0,0.01703883999091384,4,235,0.766990187862429,0.0003799344016882721,110.70378723144532,COMPLETE
112,0.3297867774963379,2023-09-04 22:10:08.489672,2023-09-04 22:10:09.542379,0 days 00:00:01.052707,Leaky,Leaky,Sigmoid,Leaky,45,23,16.0,18.0,6.0,0.018893940403957872,4,171,0.7251987430140729,0.0008752850609606194,131.8344295107085,COMPLETE
113,0.3645864725112915,2023-09-04 22:10:09.542768,2023-09-04 22:10:10.269209,0 days 00:00:00.726441,Leaky,Leaky,Sigmoid,Leaky,39,21,18.0,24.0,7.0,0.013498227749937702,4,186,0.799798822006815,0.0005058363358884355,98.14638018608093,COMPLETE
114,0.30382004380226135,2023-09-04 22:10:10.269608,2023-09-04 22:10:11.057557,0 days 00:00:00.787949,Leaky,Leaky,Leaky,Leaky,31,22,17.0,20.0,3.0,0.03311314236880256,4,207,0.6751136836666671,0.00029940344965414666,110.94245387486049,COMPLETE
115,0.2545071244239807,2023-09-04 22:10:11.057918,2023-09-04 22:10:12.058369,0 days 00:00:01.000451,Tanh,Tanh,Sigmoid,Leaky,40,20,20.0,21.0,9.0,0.02793337935252888,4,252,0.619963419860804,0.00023919788616286614,122.47818963002351,COMPLETE
116,0.3580799400806427,2023-09-04 22:10:12.058704,2023-09-04 22:10:12.823380,0 days 00:00:00.764676,Tanh,Tanh,Sigmoid,Sigmoid,40,21,22.0,19.0,9.0,0.028309310802026654,4,193,0.6215051156540441,0.0002553820396049107,162.1406275431315,COMPLETE
117,0.3468765914440155,2023-09-04 22:10:12.823694,2023-09-04 22:10:13.655083,0 days 00:00:00.831389,Tanh,Tanh,Sigmoid,Leaky,36,20,21.0,21.0,1.0,0.04439775186428225,4,226,0.5992685723274848,0.0004204874135442683,144.4028200190118,COMPLETE
118,0.38893362879753113,2023-09-04 22:10:13.655418,2023-09-04 22:10:14.305753,0 days 00:00:00.650335,Tanh,Tanh,Sigmoid,ReLU,48,24,20.0,20.0,8.0,0.07396171416521699,4,254,0.6501207355012836,0.00016001719351877385,187.22369857061477,COMPLETE
119,0.45027679204940796,2023-09-04 22:10:14.306108,2023-09-04 22:10:15.273482,0 days 00:00:00.967374,Tanh,Tanh,Sigmoid,Sigmoid,44,22,1.0,22.0,10.0,0.02412835651995227,4,178,0.5984941795464344,0.00022327713344427944,195.2532048080907,COMPLETE
120,0.2566409111022949,2023-09-04 22:10:15.273786,2023-09-04 22:10:15.826671,0 days 00:00:00.552885,Tanh,ReLU,Sigmoid,Leaky,55,20,20.0,23.0,7.0,0.01518433772185731,4,219,0.6945481265189993,0.000601190043623952,137.27056482103137,COMPLETE
121,0.3003900647163391,2023-09-04 22:10:15.826987,2023-09-04 22:10:16.518844,0 days 00:00:00.691857,Tanh,ReLU,Sigmoid,Leaky,56,20,20.0,23.0,7.0,0.016295199385337127,4,268,0.7032370164589702,0.0004675323775046705,137.93704754373303,COMPLETE
122,0.27860409021377563,2023-09-04 22:10:16.519172,2023-09-04 22:10:17.279096,0 days 00:00:00.759924,Tanh,ReLU,Sigmoid,Leaky,53,21,19.0,22.0,9.0,0.020509270749998386,4,240,0.665114651179538,0.0006311183639182903,164.59223248408392,COMPLETE
123,0.32806524634361267,2023-09-04 22:10:17.279425,2023-09-04 22:10:17.773657,0 days 00:00:00.494232,Tanh,ReLU,Sigmoid,Leaky,60,19,21.0,24.0,8.0,0.015387954955142197,4,221,0.6299665530693798,0.00035325971412232895,119.9822988008198,COMPLETE
124,0.4165039658546448,2023-09-04 22:10:17.774014,2023-09-04 22:10:18.179383,0 days 00:00:00.405369,Tanh,ReLU,Sigmoid,Leaky,49,20,20.0,23.0,5.0,0.0305413745961784,4,284,0.5736311112145425,0.0008339961384238283,138.57345765212486,COMPLETE
125,0.35310736298561096,2023-09-04 22:10:18.179716,2023-09-04 22:10:19.505800,0 days 00:00:01.326084,Tanh,Tanh,Tanh,Sigmoid,52,23,3.0,21.0,6.0,0.012324333569345373,4,212,0.7417959846260002,0.0011211994385589615,135.4610637067312,COMPLETE
126,0.2895676791667938,2023-09-04 22:10:19.506229,2023-09-04 22:10:20.228691,0 days 00:00:00.722462,Leaky,Leaky,Sigmoid,Leaky,46,22,21.0,22.0,7.0,0.01931880171651055,4,233,0.5082737619900474,0.0005222253596331323,210.76393569143195,COMPLETE
127,0.36359626054763794,2023-09-04 22:10:20.229020,2023-09-04 22:10:20.814710,0 days 00:00:00.585690,Leaky,Tanh,Sigmoid,Leaky,42,23,19.0,19.0,2.0,0.03776608025973031,4,251,0.7053952213957493,0.0006488279341294438,142.2588150024414,COMPLETE
128,0.35040906071662903,2023-09-04 22:10:20.815226,2023-09-04 22:10:21.234312,0 days 00:00:00.419086,Leaky,ReLU,Sigmoid,Sigmoid,55,21,17.0,13.0,8.0,0.025060366958191343,4,206,0.5492000869141576,0.00028995438722704793,257.0334468168371,COMPLETE
129,0.3855647146701813,2023-09-04 22:10:21.234653,2023-09-04 22:10:21.804187,0 days 00:00:00.569534,Leaky,Leaky,,,31,20,13.0,,,0.008044529050139781,2,335,0.6747919221702597,0.0003897581553040057,175.66256757463728,COMPLETE
130,1.0343555212020874,2023-09-04 22:10:21.804500,2023-09-04 22:10:22.426004,0 days 00:00:00.621504,Sigmoid,Tanh,Sigmoid,Leaky,21,22,20.0,20.0,16.0,0.05898933424265075,4,196,0.6355643391473002,0.0009242497378345878,106.65262967064267,COMPLETE
131,0.22791226208209991,2023-09-04 22:10:22.426324,2023-09-04 22:10:23.618368,0 days 00:00:01.192044,Leaky,Leaky,Sigmoid,Leaky,38,12,19.0,16.0,12.0,0.01402159718337002,4,264,0.7974193416866119,0.00018106454766972217,89.2705475429319,COMPLETE
132,0.19835737347602844,2023-09-04 22:10:23.618699,2023-09-04 22:10:24.784740,0 days 00:00:01.166041,Leaky,Leaky,Sigmoid,Leaky,36,14,18.0,16.0,12.0,0.014151959172526313,4,310,0.7999348277868781,0.00018411574899597583,92.67262890874123,COMPLETE
133,0.32126227021217346,2023-09-04 22:10:24.785046,2023-09-04 22:10:25.943210,0 days 00:00:01.158164,Leaky,Leaky,Sigmoid,Leaky,35,13,18.0,16.0,12.0,0.013334938244594642,4,311,0.7689299369627012,0.00019330069713275317,108.50407499425552,COMPLETE
134,0.2697990834712982,2023-09-04 22:10:25.943520,2023-09-04 22:10:26.861112,0 days 00:00:00.917592,Leaky,Leaky,Sigmoid,Leaky,39,12,19.0,16.0,15.0,0.009494227890720337,4,276,0.7353771181621377,0.0001709974964712601,106.0725809141647,COMPLETE
135,0.30803781747817993,2023-09-04 22:10:26.861421,2023-09-04 22:10:27.963695,0 days 00:00:01.102274,Leaky,Leaky,Sigmoid,Tanh,37,12,19.0,15.0,15.0,0.010037496183854105,4,294,0.7965304560430886,0.00015011601114906173,129.8855344082447,COMPLETE
136,0.3363957107067108,2023-09-04 22:10:27.964042,2023-09-04 22:10:29.046002,0 days 00:00:01.081960,Leaky,Leaky,Tanh,Leaky,27,14,19.0,11.0,14.0,0.008980840877982083,4,273,0.7457556271633927,0.00013018811688998401,123.13853681409681,COMPLETE
137,0.1871126890182495,2023-09-04 22:10:29.046313,2023-09-04 22:10:30.724377,0 days 00:00:01.678064,Leaky,Leaky,Sigmoid,Sigmoid,33,10,22.0,16.0,10.0,0.010915058937941223,4,304,0.7286195803550963,0.00018323807096468615,125.39370686667306,COMPLETE
138,0.29760584235191345,2023-09-04 22:10:30.724714,2023-09-04 22:10:31.685466,0 days 00:00:00.960752,Leaky,Leaky,Sigmoid,Sigmoid,31,10,22.0,15.0,11.0,0.011622370620644477,4,308,0.7697115188767593,0.00023174851281825955,138.24484909905328,COMPLETE
139,0.26287156343460083,2023-09-04 22:10:31.685792,2023-09-04 22:10:32.211454,0 days 00:00:00.525662,Tanh,Leaky,Leaky,Sigmoid,33,19,24.0,16.0,10.0,0.018963870418182243,4,323,0.7224904064771651,0.00018840880539419623,149.95453098842077,COMPLETE
140,0.38930296897888184,2023-09-04 22:10:32.211864,2023-09-04 22:10:33.109491,0 days 00:00:00.897627,Tanh,Leaky,Leaky,Sigmoid,33,19,24.0,16.0,10.0,0.021166960341564626,4,330,0.7227658666686221,0.00018527587709535844,139.10569577603727,COMPLETE
141,0.3272295892238617,2023-09-04 22:10:33.109851,2023-09-04 22:10:33.751154,0 days 00:00:00.641303,Tanh,Leaky,Leaky,Sigmoid,25,9,22.0,17.0,10.0,0.016517291741992745,4,321,0.7968959050609964,0.00014403598112488415,112.02152548895941,COMPLETE
142,0.29950791597366333,2023-09-04 22:10:33.751486,2023-09-04 22:10:34.392209,0 days 00:00:00.640723,Tanh,Leaky,Leaky,Sigmoid,28,21,23.0,14.0,12.0,0.02813141563273029,4,346,0.7046434471577943,0.00020799575122658427,116.39324847134677,COMPLETE
143,0.33989647030830383,2023-09-04 22:10:34.392557,2023-09-04 22:10:35.026955,0 days 00:00:00.634398,Tanh,Leaky,Leaky,Sigmoid,35,10,23.0,17.0,11.0,0.019566547163384313,4,288,0.7563652615808125,0.00010907982270434804,127.82568908691407,COMPLETE
144,0.3779686987400055,2023-09-04 22:10:35.027271,2023-09-04 22:10:35.677094,0 days 00:00:00.649823,Leaky,Leaky,Sigmoid,Sigmoid,29,20,24.0,15.0,9.0,0.012096595665675353,4,303,0.6921979825911898,0.00025971135131089377,99.65853532155354,COMPLETE
145,0.3132975101470947,2023-09-04 22:10:35.677409,2023-09-04 22:10:36.361597,0 days 00:00:00.684188,Tanh,Leaky,Sigmoid,Sigmoid,63,8,21.0,16.0,13.0,0.02478894782394905,4,318,0.7310124018275567,0.00017029008258483304,324.7806396484375,COMPLETE
146,0.3259463608264923,2023-09-04 22:10:36.361913,2023-09-04 22:10:37.078705,0 days 00:00:00.716792,Leaky,Leaky,Sigmoid,Sigmoid,67,15,18.0,9.0,12.0,0.007602948434727378,4,297,0.7682962168896028,0.00011755048992184456,119.93535880155342,COMPLETE
147,0.2285885065793991,2023-09-04 22:10:37.079190,2023-09-04 22:10:37.601002,0 days 00:00:00.521812,Leaky,Leaky,Sigmoid,Sigmoid,81,19,22.0,15.0,10.0,0.014567594550327674,4,330,0.7989261709734151,0.00027811546095887486,97.47475493581672,COMPLETE
148,0.2620289921760559,2023-09-04 22:10:37.601399,2023-09-04 22:10:38.358859,0 days 00:00:00.757460,Leaky,ReLU,Tanh,ReLU,87,19,22.0,13.0,11.0,0.01098750445827019,4,149,0.7987092450824513,0.00025971381025843214,117.7422612508138,COMPLETE
149,0.2980794608592987,2023-09-04 22:10:38.359297,2023-09-04 22:10:38.821403,0 days 00:00:00.462106,Leaky,ReLU,Tanh,ReLU,81,17,22.0,13.0,10.0,0.014373379929780886,4,142,0.799646761136152,0.00022959044666851983,101.70892542058772,COMPLETE
150,0.3491284251213074,2023-09-04 22:10:38.821711,2023-09-04 22:10:39.288352,0 days 00:00:00.466641,Leaky,ReLU,Tanh,ReLU,79,19,23.0,14.0,11.0,0.011641735017233326,4,155,0.7660462434457526,0.00013923167952704048,99.37820025852749,COMPLETE
151,0.2751471698284149,2023-09-04 22:10:39.288661,2023-09-04 22:10:39.794289,0 days 00:00:00.505628,Leaky,ReLU,Tanh,ReLU,84,18,21.0,16.0,11.0,0.01755003780748317,4,337,0.7345290177051836,0.0002844142236734799,128.4526252746582,COMPLETE
152,0.2977161109447479,2023-09-04 22:10:39.794628,2023-09-04 22:10:40.671243,0 days 00:00:00.876615,Leaky,ReLU,Tanh,ReLU,85,19,9.0,12.0,9.0,0.010261644517378488,4,130,0.7201326326289539,0.0002042278955832178,161.4841412995991,COMPLETE
153,0.2824721932411194,2023-09-04 22:10:40.671575,2023-09-04 22:10:41.311775,0 days 00:00:00.640200,Leaky,Leaky,Sigmoid,Sigmoid,87,20,22.0,15.0,10.0,0.014253945422916877,4,150,0.7652878010896592,0.00016578076413423806,532.6662639543122,COMPLETE
154,0.3422855734825134,2023-09-04 22:10:41.312083,2023-09-04 22:10:42.021501,0 days 00:00:00.709418,Leaky,ReLU,Leaky,Leaky,76,20,20.0,13.0,12.0,0.005981075861145777,4,168,0.7984860073848983,0.00025913708725523727,92.1104449865953,COMPLETE
155,0.3612527847290039,2023-09-04 22:10:42.021808,2023-09-04 22:10:42.486127,0 days 00:00:00.464319,Leaky,Leaky,Sigmoid,Leaky,38,18,24.0,24.0,10.0,0.0073154727213633666,4,119,0.3974337200905062,0.0003213454646024823,147.57295109675482,COMPLETE
156,0.3626177906990051,2023-09-04 22:10:42.486435,2023-09-04 22:10:43.075281,0 days 00:00:00.588846,Leaky,Leaky,Sigmoid,Sigmoid,34,19,21.0,14.0,11.0,0.020609228539142994,4,326,0.656504233439658,0.0004068929932068035,144.66137531825476,COMPLETE
157,0.3223089575767517,2023-09-04 22:10:43.075741,2023-09-04 22:10:43.543497,0 days 00:00:00.467756,Sigmoid,Leaky,Tanh,Leaky,82,21,20.0,11.0,9.0,0.008463697740256865,4,312,0.7108164294631906,0.00018244451525251142,225.06144199371337,COMPLETE
158,0.4272879362106323,2023-09-04 22:10:43.543831,2023-09-04 22:10:44.105975,0 days 00:00:00.562144,Tanh,ReLU,Sigmoid,Sigmoid,91,19,23.0,6.0,13.0,0.015400211465163374,4,349,0.7562906906101262,9.735795769084195e-05,132.34292634328207,COMPLETE
159,0.48293060064315796,2023-09-04 22:10:44.106303,2023-09-04 22:10:44.499343,0 days 00:00:00.393040,Leaky,,,,40,21,,,,0.012371191261510603,1,166,0.308163591718724,0.0002322279534396088,147.87474592108475,COMPLETE
160,0.41224002838134766,2023-09-04 22:10:44.499649,2023-09-04 22:10:44.853284,0 days 00:00:00.353635,Leaky,Leaky,Sigmoid,Leaky,36,14,22.0,15.0,14.0,0.018120237641869433,4,186,0.6851508493332811,0.00012539310686046133,121.5767469406128,COMPLETE
161,0.3216196894645691,2023-09-04 22:10:44.853607,2023-09-04 22:10:45.429053,0 days 00:00:00.575446,Leaky,Leaky,Sigmoid,Sigmoid,32,21,18.0,17.0,9.0,0.02306064999510725,4,369,0.7332738722244,0.0005113907673972229,198.78689448038736,COMPLETE
162,0.3181803822517395,2023-09-04 22:10:45.429382,2023-09-04 22:10:46.032039,0 days 00:00:00.602657,Leaky,Leaky,Sigmoid,Sigmoid,89,20,17.0,23.0,8.0,0.03307772188213005,4,307,0.6930390292739476,0.0003164121264866922,1927.718611092403,COMPLETE
163,0.3085908591747284,2023-09-04 22:10:46.032359,2023-09-04 22:10:47.311920,0 days 00:00:01.279561,Leaky,Leaky,Sigmoid,Sigmoid,33,10,20.0,16.0,11.0,0.04192424830520452,4,321,0.6634195102753901,0.000719027161931162,128.23943970695373,COMPLETE
164,0.39784982800483704,2023-09-04 22:10:47.312317,2023-09-04 22:10:48.006098,0 days 00:00:00.693781,Leaky,Leaky,Sigmoid,Sigmoid,30,22,19.0,21.0,10.0,0.05051057220702166,4,263,0.6215681768283048,0.0004545003944907508,156.0291702747345,COMPLETE
165,0.27462172508239746,2023-09-04 22:10:48.006418,2023-09-04 22:10:48.797646,0 days 00:00:00.791228,Leaky,Sigmoid,Sigmoid,Leaky,57,11,18.0,16.0,9.0,0.02736877754374969,4,288,0.773837356791063,0.0003566801865632817,120.7675619506836,COMPLETE
166,0.32835671305656433,2023-09-04 22:10:48.797969,2023-09-04 22:10:49.234383,0 days 00:00:00.436414,Leaky,Tanh,Sigmoid,Tanh,80,20,21.0,15.0,8.0,0.014442050671372364,4,333,0.7147681297880638,0.0002959252937108002,106.37197346157498,COMPLETE
167,0.40647727251052856,2023-09-04 22:10:49.234709,2023-09-04 22:10:49.641615,0 days 00:00:00.406906,Tanh,Leaky,Sigmoid,ReLU,87,19,19.0,13.0,12.0,0.010881993614698219,4,147,0.7992191166273435,0.00021458720093051517,122.55304646492004,COMPLETE
168,0.33847394585609436,2023-09-04 22:10:49.641929,2023-09-04 22:10:49.996922,0 days 00:00:00.354993,Leaky,Leaky,Sigmoid,Leaky,35,21,16.0,18.0,7.0,0.022132082765151277,4,137,0.45413351269202396,0.00014570864963852134,126.08694775899251,COMPLETE
169,0.3555293381214142,2023-09-04 22:10:49.997253,2023-09-04 22:10:50.434433,0 days 00:00:00.437180,Leaky,Sigmoid,Tanh,Sigmoid,38,20,20.0,10.0,11.0,0.01805900207389886,4,303,0.6443529110169246,0.000418762111953586,151.48268824038297,COMPLETE
170,0.2896230220794678,2023-09-04 22:10:50.434873,2023-09-04 22:10:50.885539,0 days 00:00:00.450666,Leaky,Tanh,Sigmoid,Leaky,59,22,17.0,14.0,10.0,0.032139577434157754,4,340,0.7449516128437741,0.0005922526805862323,192.28879126187027,COMPLETE
171,0.27153274416923523,2023-09-04 22:10:50.885976,2023-09-04 22:10:51.762623,0 days 00:00:00.876647,Leaky,Leaky,Sigmoid,Leaky,40,11,19.0,16.0,15.0,0.009230156055970823,4,283,0.7299329374483834,0.00018440689603139025,273.07278205023874,COMPLETE
172,0.270194947719574,2023-09-04 22:10:51.763049,2023-09-04 22:10:52.577052,0 days 00:00:00.814003,Leaky,Leaky,Sigmoid,Leaky,42,12,20.0,16.0,16.0,0.009849938878564604,4,274,0.6939625425008993,0.0002576809510205456,121.70983074022377,COMPLETE
173,0.3239598572254181,2023-09-04 22:10:52.577469,2023-09-04 22:10:53.055398,0 days 00:00:00.477929,Leaky,Leaky,Sigmoid,Leaky,39,12,18.0,15.0,14.0,0.012987203894187938,4,179,0.481746790121679,0.00015307336482170514,103.27638558780446,COMPLETE
174,0.3355187177658081,2023-09-04 22:10:53.055841,2023-09-04 22:10:54.196704,0 days 00:00:01.140863,Leaky,Leaky,Sigmoid,Leaky,36,13,20.0,12.0,13.0,0.016505622323789833,4,245,0.7452918380407721,0.00020822839423103505,116.66118607431088,COMPLETE
175,0.3287736177444458,2023-09-04 22:10:54.197027,2023-09-04 22:10:55.976669,0 days 00:00:01.779642,Leaky,Leaky,Sigmoid,Leaky,16,21,21.0,24.0,14.0,0.007557728734041332,4,297,0.679746368808617,0.00017601197065733828,112.76691131591797,COMPLETE
176,0.4398103654384613,2023-09-04 22:10:55.977000,2023-09-04 22:10:56.373994,0 days 00:00:00.396994,Tanh,Leaky,Leaky,Sigmoid,74,19,19.0,17.0,8.0,0.010042051784041627,4,263,0.799687397353838,0.0007651302963811602,155.7156886348018,COMPLETE
177,0.3679754137992859,2023-09-04 22:10:56.374316,2023-09-04 22:10:57.503333,0 days 00:00:01.129017,Leaky,Leaky,Sigmoid,Leaky,33,12,19.0,15.0,15.0,0.06923986656228519,4,312,0.7524421774196328,0.0003561614764645421,200.9637190500895,COMPLETE
178,0.45478665828704834,2023-09-04 22:10:57.503648,2023-09-04 22:10:57.757433,0 days 00:00:00.253785,Leaky,ReLU,Sigmoid,Sigmoid,83,13,18.0,18.0,9.0,0.011935448525342033,4,279,0.2564115139748173,0.00026226802448990773,376.45007925767163,COMPLETE
