number,value,datetime_start,datetime_complete,duration,params_activation1,params_activation2,params_activation3,params_activation4,params_batch_size,params_fl1,params_fl2,params_fl3,params_fl4,params_learning_rate,params_n_layers,params_num_epochs,params_train_size,params_weight_decay,user_attrs_mre,state
1969,0.3227952718734741,2023-09-04 22:32:01.510180,2023-09-04 22:32:03.009203,0 days 00:00:01.499023,Leaky,Leaky,Leaky,,19,11,19.0,15.0,,0.0027247091769596445,3,368,0.7705154335074904,0.00032183491134913885,102.7556757245745,COMPLETE
1970,0.3248462378978729,2023-09-04 22:32:03.009779,2023-09-04 22:32:03.922790,0 days 00:00:00.913011,ReLU,ReLU,Leaky,,24,22,18.0,11.0,,0.017697363288005894,3,350,0.5879645476002023,0.00017244968827945822,97.2347885523087,COMPLETE
1971,0.3308190405368805,2023-09-04 22:32:03.923360,2023-09-04 22:32:06.344146,0 days 00:00:02.420786,ReLU,Leaky,Leaky,,10,12,20.0,8.0,,0.009499856638477707,3,443,0.6516206294652542,0.0001114101882286877,100.67400848388672,COMPLETE
1972,0.38744068145751953,2023-09-04 22:32:06.344725,2023-09-04 22:32:07.768819,0 days 00:00:01.424094,ReLU,Leaky,Leaky,,28,13,19.0,12.0,,0.00039875076812631826,3,360,0.22147509343535624,0.04798982059628335,174.95794269458668,COMPLETE
1973,0.4231169521808624,2023-09-04 22:32:07.769429,2023-09-04 22:32:14.467442,0 days 00:00:06.698013,Tanh,Leaky,Leaky,,25,10,12.0,5.0,,3.750921707998932e-05,3,395,0.5244526360453198,6.820005946081734e-05,171.24336609659315,COMPLETE
1974,0.35542476177215576,2023-09-04 22:32:14.467978,2023-09-04 22:32:16.629921,0 days 00:00:02.161943,Leaky,ReLU,ReLU,,38,21,18.0,14.0,,0.0001119411542485161,3,407,0.2661455226531904,1.385295932145159e-05,101.79414937302873,COMPLETE
1975,0.4810088574886322,2023-09-04 22:32:16.630580,2023-09-04 22:32:17.880864,0 days 00:00:01.250284,Sigmoid,Leaky,Leaky,,22,11,19.0,15.0,,0.0001867942307671393,3,426,0.10876478287626758,0.0003725385501875041,112.56561138986171,COMPLETE
1976,0.2845330238342285,2023-09-04 22:32:17.881584,2023-09-04 22:32:18.763098,0 days 00:00:00.881514,Tanh,Leaky,Leaky,,32,12,20.0,16.0,,0.01126360191291563,3,376,0.7416857968770547,0.011245192342140197,89.02615356445312,COMPLETE
1977,0.3398110866546631,2023-09-04 22:32:18.763797,2023-09-04 22:32:21.136277,0 days 00:00:02.372480,ReLU,Leaky,Tanh,,26,11,11.0,14.0,,0.0007790920778331945,3,337,0.7185484300535302,0.00026420211271723827,110.99840746427837,COMPLETE
1978,0.38525572419166565,2023-09-04 22:32:21.136859,2023-09-04 22:32:21.412348,0 days 00:00:00.275489,Tanh,Leaky,Leaky,,28,22,18.0,6.0,,0.005418765822102381,3,416,0.14848362783697178,0.00020996459007364442,116.37862807053786,COMPLETE
1979,0.29083290696144104,2023-09-04 22:32:21.412896,2023-09-04 22:32:22.837111,0 days 00:00:01.424215,ReLU,ReLU,Leaky,,19,9,21.0,7.0,,0.007040935042099912,3,348,0.7662777391970986,8.409229483864663e-05,106.47914577665783,COMPLETE
1980,0.32621657848358154,2023-09-04 22:32:22.837700,2023-09-04 22:32:23.879800,0 days 00:00:01.042100,Tanh,Leaky,Leaky,,21,14,14.0,13.0,,0.019588045407390006,3,361,0.6799440906502388,0.0007648673855507771,105.06204917214133,COMPLETE
1981,0.3026288151741028,2023-09-04 22:32:23.880336,2023-09-04 22:32:25.069580,0 days 00:00:01.189244,Leaky,Leaky,Leaky,,30,13,19.0,8.0,,0.0035863513485079475,3,368,0.50740971808847,0.004075029107731215,120.02757395426433,COMPLETE
1982,0.3533689081668854,2023-09-04 22:32:25.070144,2023-09-04 22:32:25.384481,0 days 00:00:00.314337,Tanh,Tanh,Leaky,,23,12,10.0,15.0,,0.013156627893722675,3,384,0.1695859160885508,0.00013381994399893095,116.73900482177734,COMPLETE
1983,0.4194554388523102,2023-09-04 22:32:25.385024,2023-09-04 22:32:25.628613,0 days 00:00:00.243589,ReLU,Leaky,Sigmoid,,25,21,18.0,16.0,,0.007849201462462546,3,316,0.11988515505414209,0.00296664935168838,176.6766128540039,COMPLETE
1984,0.3832468092441559,2023-09-04 22:32:25.629146,2023-09-04 22:32:26.279092,0 days 00:00:00.649946,Tanh,ReLU,Leaky,,19,19,19.0,12.0,,0.004270537021848847,3,354,0.2833224059829878,0.008577507679065505,108.45824450981326,COMPLETE
1985,0.2669651210308075,2023-09-04 22:32:26.279639,2023-09-04 22:32:27.863403,0 days 00:00:01.583764,ReLU,Leaky,Leaky,,27,11,17.0,15.0,,0.002979019283592009,3,402,0.7491503165682044,0.000979263782459007,88.15712479622134,COMPLETE
1986,0.33486780524253845,2023-09-04 22:32:27.863963,2023-09-04 22:32:29.733756,0 days 00:00:01.869793,Tanh,Leaky,Leaky,,24,10,19.0,14.0,,0.0015419609795442636,3,338,0.7098889156094257,0.0003137606171976282,111.63426615397135,COMPLETE
1987,0.32779160141944885,2023-09-04 22:32:29.734320,2023-09-04 22:32:30.281365,0 days 00:00:00.547045,ReLU,Leaky,ReLU,,46,20,20.0,14.0,,0.015201906759369232,3,394,0.7991669401981703,0.001293093180738576,96.66544987605168,COMPLETE
1988,0.30477142333984375,2023-09-04 22:32:30.281923,2023-09-04 22:32:31.361380,0 days 00:00:01.079457,Leaky,Leaky,Leaky,,21,12,18.0,24.0,,0.009757826451734834,3,377,0.7659830988536419,0.0004329568964470696,107.82116631900563,COMPLETE
1989,0.310899019241333,2023-09-04 22:32:31.361941,2023-09-04 22:32:32.026166,0 days 00:00:00.664225,Tanh,ReLU,Leaky,,29,23,13.0,13.0,,0.024156451134974777,3,422,0.7999926266147951,0.00017937891499817792,90.89200525698455,COMPLETE
1990,0.37725597620010376,2023-09-04 22:32:32.026712,2023-09-04 22:32:33.434992,0 days 00:00:01.408280,Tanh,Leaky,Tanh,,23,11,19.0,19.0,,0.06496792939030799,3,435,0.7278170438876727,0.0005993081448364064,116.17513702392579,COMPLETE
1991,0.30948689579963684,2023-09-04 22:32:33.436037,2023-09-04 22:32:35.700409,0 days 00:00:02.264372,ReLU,Leaky,Leaky,,32,13,12.0,7.0,,0.002268523939079473,3,347,0.6884918965951475,0.00022558289170164638,279.857176951873,COMPLETE
1992,0.35424333810806274,2023-09-04 22:32:35.701487,2023-09-04 22:32:36.635591,0 days 00:00:00.934104,Tanh,Leaky,Leaky,,27,17,20.0,11.0,,0.005680959023868577,3,99,0.24206952434476656,0.00026064169799584617,115.75604677200317,COMPLETE
1993,0.49016910791397095,2023-09-04 22:32:36.636206,2023-09-04 22:32:40.530422,0 days 00:00:03.894216,ReLU,ReLU,Leaky,,25,12,14.0,15.0,,2.3623122909837484e-05,3,411,0.26488896529501954,2.083246581628741e-05,118.6016701282956,COMPLETE
1994,0.3249910771846771,2023-09-04 22:32:40.531081,2023-09-04 22:32:47.353984,0 days 00:00:06.822903,Tanh,Leaky,Leaky,,21,11,17.0,8.0,,0.0006916672515825488,3,366,0.7430025091251157,2.639193001182597e-05,102.673720352293,COMPLETE
1995,0.40491974353790283,2023-09-04 22:32:47.355011,2023-09-04 22:32:53.147725,0 days 00:00:05.792714,Leaky,Leaky,Leaky,,30,12,18.0,16.0,,3.794085308180562e-05,3,328,0.4106865733080162,0.00010790762450620683,213.8810582975062,COMPLETE
1996,0.9744359850883484,2023-09-04 22:32:53.148279,2023-09-04 22:32:53.741879,0 days 00:00:00.593600,Tanh,Leaky,Leaky,,19,10,10.0,13.0,,0.015160922340558958,3,356,0.6573724185537623,0.09967012795421766,100.46130899282602,COMPLETE
1997,0.3875647783279419,2023-09-04 22:32:53.742426,2023-09-04 22:32:54.104012,0 days 00:00:00.361586,ReLU,Leaky,Leaky,,26,24,19.0,7.0,,0.011078705688298359,3,388,0.22633866574544584,0.00014563766316485775,100.52842085702079,COMPLETE
1998,0.34693726897239685,2023-09-04 22:32:54.104560,2023-09-04 22:32:55.107976,0 days 00:00:01.003416,Sigmoid,ReLU,Leaky,,22,11,4.0,12.0,,0.019905689354302206,3,372,0.31418595915455483,6.881936814247064e-05,357.6815417652399,COMPLETE
1999,0.2769216001033783,2023-09-04 22:32:55.108563,2023-09-04 22:32:55.978539,0 days 00:00:00.869976,Tanh,Leaky,Leaky,,35,21,19.0,14.0,,0.0068598975649922355,3,401,0.7724903236174188,0.00018807175957948202,83.70110217944996,COMPLETE
