number,value,datetime_start,datetime_complete,duration,params_activation1,params_activation2,params_activation3,params_activation4,params_batch_size,params_fl1,params_fl2,params_fl3,params_fl4,params_learning_rate,params_n_layers,params_num_epochs,params_train_size,params_weight_decay,user_attrs_mre,state
464,0.3327364921569824,2023-09-04 21:28:26.542755,2023-09-04 21:28:31.607382,0 days 00:00:05.064627,Sigmoid,Sigmoid,Leaky,,33,19,21.0,6.0,,0.0032949819313079325,3,225,0.7419775394277361,2.790447815027711e-05,172.76665245402944,COMPLETE
465,0.347770094871521,2023-09-04 21:28:31.608011,2023-09-04 21:28:33.089643,0 days 00:00:01.481632,ReLU,Leaky,ReLU,,36,20,20.0,8.0,,0.03192827593474809,3,342,0.7999417255010153,1.0146878043008739e-05,120.16110197703044,COMPLETE
466,0.5008246898651123,2023-09-04 21:28:33.090243,2023-09-04 21:28:47.840047,0 days 00:00:14.749804,ReLU,ReLU,Sigmoid,,30,21,12.0,7.0,,0.0002508903944531884,3,243,0.7195915439708704,1.8385026211459382e-05,207.7891862971302,COMPLETE
467,0.29096972942352295,2023-09-04 21:28:47.840658,2023-09-04 21:28:49.505931,0 days 00:00:01.665273,Leaky,Leaky,Tanh,,46,22,24.0,21.0,,0.005840468217412251,3,233,0.7544644795181217,0.001228142204258599,121.47102966308594,COMPLETE
468,0.43836814165115356,2023-09-04 21:28:49.506530,2023-09-04 21:28:53.030703,0 days 00:00:03.524173,Sigmoid,Sigmoid,Leaky,,34,23,22.0,9.0,,0.015745114956216433,3,170,0.686740088175766,0.002584864350838199,202.51619720458984,COMPLETE
469,0.31686362624168396,2023-09-04 21:28:53.031296,2023-09-04 21:28:54.282845,0 days 00:00:01.251549,ReLU,Leaky,Leaky,,42,19,22.0,22.0,,0.009027242715815027,3,373,0.42816811874448646,3.332066038518643e-05,127.93455542587652,COMPLETE
470,0.5042780041694641,2023-09-04 21:28:54.283451,2023-09-04 21:28:54.817362,0 days 00:00:00.533911,ReLU,Leaky,Sigmoid,,37,20,19.0,13.0,,0.0211897362788341,3,255,0.3300800426587969,3.8529514896143724e-05,202.8545616997613,COMPLETE
471,0.3629186451435089,2023-09-04 21:28:54.817974,2023-09-04 21:29:06.013219,0 days 00:00:11.195245,Tanh,ReLU,Leaky,,39,21,21.0,9.0,,8.89247773160889e-05,3,210,0.77226937055995,0.00011582114229033183,243.29338782174247,COMPLETE
472,0.30506056547164917,2023-09-04 21:29:06.013821,2023-09-04 21:29:10.921884,0 days 00:00:04.908063,ReLU,Sigmoid,ReLU,,27,18,23.0,10.0,,0.007096898829970845,3,160,0.7227062847623226,5.261406842817878e-05,138.33084346226283,COMPLETE
473,0.2705138027667999,2023-09-04 21:29:10.922487,2023-09-04 21:29:13.747718,0 days 00:00:02.825231,Sigmoid,Leaky,Leaky,,33,20,23.0,8.0,,0.011173143886989095,3,228,0.746496548609782,2.3844729233227644e-05,157.24935815689412,COMPLETE
474,0.408631294965744,2023-09-04 21:29:13.748330,2023-09-04 21:29:15.024689,0 days 00:00:01.276359,ReLU,Leaky,Tanh,,31,16,22.0,11.0,,0.001456074141744676,3,180,0.11375488897301926,1.2946998481751899e-05,127.0368471382078,COMPLETE
475,0.5852875113487244,2023-09-04 21:29:15.025333,2023-09-04 21:29:23.482741,0 days 00:00:08.457408,ReLU,Tanh,Sigmoid,,41,19,21.0,9.0,,2.8138093681058527e-05,3,244,0.6275460949607675,7.453591250476748e-05,158.29310695460586,COMPLETE
476,0.6717872619628906,2023-09-04 21:29:23.483089,2023-09-04 21:29:26.687011,0 days 00:00:03.203922,Sigmoid,ReLU,Leaky,,44,22,23.0,8.0,,4.9438503335268535e-05,3,205,0.66948963285565,0.004656364121598717,164.01596333573505,COMPLETE
477,0.3285408318042755,2023-09-04 21:29:26.687369,2023-09-04 21:29:27.822697,0 days 00:00:01.135328,ReLU,Sigmoid,Leaky,,29,21,22.0,10.0,,0.026819862322289615,3,237,0.7987603370069648,4.5072142444653435e-05,173.91963005065918,COMPLETE
478,0.3140621483325958,2023-09-04 21:29:27.823077,2023-09-04 21:29:28.714326,0 days 00:00:00.891249,Tanh,Leaky,Sigmoid,,56,20,24.0,9.0,,0.013753830672000564,3,222,0.7139219299752979,0.0003681587553087495,188.42007866458616,COMPLETE
479,0.42695486545562744,2023-09-04 21:29:28.714669,2023-09-04 21:29:29.050991,0 days 00:00:00.336322,ReLU,,,,35,18,,,,0.08139359744373033,1,195,0.7740434865741251,0.002250123045962672,137.61584599812826,COMPLETE
480,0.40806883573532104,2023-09-04 21:29:29.051339,2023-09-04 21:29:31.234497,0 days 00:00:02.183158,Leaky,Leaky,,,38,20,20.0,,,0.00010739295938268166,2,260,0.2700362980217638,6.066422123188395e-05,148.7396296281081,COMPLETE
481,0.3914358615875244,2023-09-04 21:29:31.234831,2023-09-04 21:29:33.148274,0 days 00:00:01.913443,Sigmoid,Sigmoid,ReLU,,32,21,21.0,24.0,,0.0022144314326173324,3,215,0.5886457277218781,2.0625082828893958e-05,6820.287121271683,COMPLETE
482,0.367100328207016,2023-09-04 21:29:33.148603,2023-09-04 21:29:35.419741,0 days 00:00:02.271138,ReLU,ReLU,Leaky,,40,19,22.0,8.0,,0.0005052373794875113,3,230,0.7431981792096841,1.5479294125383763e-05,131.2252977343573,COMPLETE
483,0.5678536891937256,2023-09-04 21:29:35.420091,2023-09-04 21:29:35.612533,0 days 00:00:00.192442,ReLU,Leaky,Tanh,,37,17,21.0,19.0,,0.059049543329658914,3,271,0.5470777212133915,0.00040453797192196176,206.9538712935014,COMPLETE
484,0.35552772879600525,2023-09-04 21:29:35.612888,2023-09-04 21:29:36.371285,0 days 00:00:00.758397,Tanh,Leaky,Leaky,,34,5,23.0,7.0,,0.017268564092077204,3,235,0.6929348962257057,3.082876291767283e-05,347.2287717546736,COMPLETE
485,0.5594279766082764,2023-09-04 21:29:36.371659,2023-09-04 21:29:36.908439,0 days 00:00:00.536780,Sigmoid,Sigmoid,Sigmoid,,43,21,22.0,11.0,,0.005054682221899535,3,246,0.23347353303624577,9.615574042038537e-05,488.586925467265,COMPLETE
486,0.3184487819671631,2023-09-04 21:29:36.908806,2023-09-04 21:29:37.295769,0 days 00:00:00.386963,ReLU,Leaky,Leaky,,30,20,20.0,20.0,,0.008413187735584597,3,249,0.6490901460938593,3.903576402172238e-05,132.15215662906044,COMPLETE
487,0.35476019978523254,2023-09-04 21:29:37.296129,2023-09-04 21:29:37.759649,0 days 00:00:00.463520,ReLU,ReLU,Leaky,,36,22,24.0,10.0,,0.004165368532194001,3,316,0.34946003408057325,0.00325200173208488,890.0137615203857,COMPLETE
488,0.3353808522224426,2023-09-04 21:29:37.760036,2023-09-04 21:29:38.099825,0 days 00:00:00.339789,ReLU,Leaky,ReLU,,100,18,22.0,9.0,,0.009950491368828831,3,90,0.4573681289592832,2.7833712725865616e-05,134.71356187043367,COMPLETE
489,0.3615308701992035,2023-09-04 21:29:38.100178,2023-09-04 21:29:38.871473,0 days 00:00:00.771295,Sigmoid,Sigmoid,Sigmoid,,32,21,23.0,22.0,,0.04333121760433065,3,220,0.4691096614663054,4.958857517140918e-05,224.86391013009208,COMPLETE
490,0.31752464175224304,2023-09-04 21:29:38.871834,2023-09-04 21:29:39.783497,0 days 00:00:00.911663,ReLU,Leaky,Tanh,,39,19,21.0,8.0,,0.006317699985176996,3,205,0.7719515075546399,6.437198499022565e-05,130.13486907958983,COMPLETE
491,0.3378925621509552,2023-09-04 21:29:39.783865,2023-09-04 21:29:40.338669,0 days 00:00:00.554804,ReLU,Tanh,Leaky,,27,20,22.0,10.0,,0.01980770784296982,3,240,0.5154400246147762,3.486551427418871e-05,131.02649593353271,COMPLETE
492,0.3576332628726959,2023-09-04 21:29:40.339027,2023-09-04 21:29:41.465692,0 days 00:00:01.126665,Tanh,ReLU,Leaky,,41,23,16.0,7.0,,0.0029861437330708208,3,258,0.7204265929551731,8.218690529896665e-05,131.6034186542898,COMPLETE
493,0.24687257409095764,2023-09-04 21:29:41.466032,2023-09-04 21:29:43.112166,0 days 00:00:01.646134,Sigmoid,Leaky,Sigmoid,,34,21,21.0,23.0,,0.013160047952917218,3,183,0.7994855861035542,0.0002622159785818334,264.5391423225403,COMPLETE
494,0.27123650908470154,2023-09-04 21:29:43.112518,2023-09-04 21:29:44.372063,0 days 00:00:01.259545,Sigmoid,Leaky,Sigmoid,,34,21,21.0,22.0,,0.015033553965647744,3,189,0.771187139509846,0.0002404341397722625,154.34616972908142,COMPLETE
495,0.35793328285217285,2023-09-04 21:29:44.372412,2023-09-04 21:29:44.946804,0 days 00:00:00.574392,Sigmoid,Leaky,Sigmoid,,33,22,20.0,23.0,,0.024925640127988653,3,176,0.41022628217153434,0.00027637514397427985,466.78747812906903,COMPLETE
496,0.25868967175483704,2023-09-04 21:29:44.947168,2023-09-04 21:29:47.299376,0 days 00:00:02.352208,Sigmoid,Leaky,Sigmoid,,35,21,20.0,23.0,,0.007110144855178658,3,183,0.7973890479778478,0.0001902181207277606,125.36781441537957,COMPLETE
497,0.26013249158859253,2023-09-04 21:29:47.299741,2023-09-04 21:29:48.288666,0 days 00:00:00.988925,Sigmoid,Leaky,Sigmoid,,31,22,20.0,23.0,,0.007672591807232421,3,186,0.7974546147645005,0.00018706495441728004,213.47120293511284,COMPLETE
498,0.6133289933204651,2023-09-04 21:29:48.289012,2023-09-04 21:29:48.530511,0 days 00:00:00.241499,Sigmoid,Leaky,Sigmoid,,30,22,20.0,23.0,,0.007077112529138655,3,183,0.12285404475890045,0.00018000594804410414,166.6575087061468,COMPLETE
499,0.37106648087501526,2023-09-04 21:29:48.530881,2023-09-04 21:29:49.559394,0 days 00:00:01.028513,Sigmoid,Leaky,Sigmoid,,31,22,19.0,22.0,,0.00534449494301868,3,177,0.7954822560587801,0.00029530888768205393,211.32837595838183,COMPLETE
500,0.5797978639602661,2023-09-04 21:29:49.559759,2023-09-04 21:29:49.756037,0 days 00:00:00.196278,Sigmoid,Leaky,Sigmoid,ReLU,28,23,19.0,23.0,14.0,0.0062967472816545635,4,190,0.1076100777194486,0.00012255794138291175,229.60488729765922,COMPLETE
501,0.287644624710083,2023-09-04 21:29:49.756409,2023-09-04 21:29:51.610626,0 days 00:00:01.854217,Sigmoid,Leaky,Sigmoid,,25,23,20.0,24.0,,0.007933612966592632,3,155,0.7999687541367199,0.0001515550791124996,185.99995104471842,COMPLETE
502,0.3971140682697296,2023-09-04 21:29:51.610980,2023-09-04 21:29:53.556184,0 days 00:00:01.945204,Sigmoid,Leaky,Sigmoid,,29,22,20.0,24.0,,0.004997130462224834,3,187,0.381112201501063,9.683330114291532e-05,201.74901683910474,COMPLETE
503,0.5662791728973389,2023-09-04 21:29:53.556785,2023-09-04 21:29:55.644793,0 days 00:00:02.088008,Sigmoid,Leaky,Sigmoid,,32,22,19.0,23.0,,0.0004163225883450051,3,160,0.22395185527412417,0.0002011147003837257,211.1551613330841,COMPLETE
504,0.4963438808917999,2023-09-04 21:29:55.645147,2023-09-04 21:29:56.225904,0 days 00:00:00.580757,Leaky,Leaky,Sigmoid,,31,21,20.0,23.0,,0.0037714327951524087,3,172,0.2469220553945049,0.0001218678611921459,2043.2426781905324,COMPLETE
505,0.2753413915634155,2023-09-04 21:29:56.226249,2023-09-04 21:29:58.207578,0 days 00:00:01.981329,Sigmoid,Leaky,Sigmoid,,33,21,19.0,23.0,,0.006450864343488588,3,165,0.7408105201717406,0.00016863839954757206,155.46085611979166,COMPLETE
506,0.3391193449497223,2023-09-04 21:29:58.207931,2023-09-04 21:29:59.431706,0 days 00:00:01.223775,Sigmoid,Leaky,Sigmoid,,35,22,20.0,24.0,,0.007548787850125717,3,175,0.45147249617442753,0.0001795242205299035,402.23150867280503,COMPLETE
507,0.372114360332489,2023-09-04 21:29:59.432054,2023-09-04 21:30:00.036366,0 days 00:00:00.604312,Tanh,Leaky,Sigmoid,,28,22,18.0,23.0,,0.008870205065624238,3,185,0.36466840925312866,0.00028183154358440564,289.0267636168237,COMPLETE
508,0.4805913269519806,2023-09-04 21:30:00.036701,2023-09-04 21:30:01.064974,0 days 00:00:01.028273,Sigmoid,Leaky,Sigmoid,,30,21,19.0,23.0,,0.0007303653960205425,3,166,0.20555090497306622,0.00013716004194563885,453.50573716680685,COMPLETE
509,0.3619222939014435,2023-09-04 21:30:01.065325,2023-09-04 21:30:04.383660,0 days 00:00:03.318335,Tanh,Leaky,Sigmoid,,33,24,21.0,24.0,,0.00018798088333731242,3,183,0.6933525942546805,0.0002000526584231563,161.66237002513446,COMPLETE
510,0.6050412058830261,2023-09-04 21:30:04.384012,2023-09-04 21:30:04.514286,0 days 00:00:00.130274,Leaky,Leaky,Sigmoid,,31,21,20.0,21.0,,0.005578046067492632,3,193,0.11952129246994248,0.00021216531561380815,800.9139140735973,COMPLETE
511,0.3503992259502411,2023-09-04 21:30:04.514657,2023-09-04 21:30:06.163868,0 days 00:00:01.649211,Sigmoid,Leaky,Sigmoid,,35,21,20.0,22.0,,0.00473265625958703,3,180,0.41699797274937117,0.00015369334492150585,214.43249074364923,COMPLETE
512,0.3037823438644409,2023-09-04 21:30:06.164234,2023-09-04 21:30:06.766896,0 days 00:00:00.602662,Sigmoid,Leaky,ReLU,,37,22,21.0,22.0,,0.034532668715346285,3,195,0.7413236631828426,0.00010029412295193889,138.58861589431763,COMPLETE
513,0.37476712465286255,2023-09-04 21:30:06.767250,2023-09-04 21:30:08.864278,0 days 00:00:02.097028,ReLU,Leaky,Tanh,,33,22,21.0,24.0,,0.00028329451142301306,3,172,0.662161796208757,8.764942194555223e-05,173.50109182993572,COMPLETE
514,0.30999115109443665,2023-09-04 21:30:08.864640,2023-09-04 21:30:11.047097,0 days 00:00:02.182457,Tanh,Leaky,Sigmoid,,29,21,21.0,23.0,,0.0017929860370153722,3,194,0.7698752826795855,0.00032360402387426684,190.87094527683902,COMPLETE
515,0.42430660128593445,2023-09-04 21:30:11.047443,2023-09-04 21:30:12.456378,0 days 00:00:01.408935,ReLU,Leaky,Sigmoid,,27,23,20.0,22.0,,0.000608063982186081,3,149,0.2615723415813935,0.0004818232991169669,605.303920216804,COMPLETE
516,0.3191484212875366,2023-09-04 21:30:12.456721,2023-09-04 21:30:13.391565,0 days 00:00:00.934844,Sigmoid,Leaky,ReLU,,38,21,20.0,24.0,,0.010849767235061567,3,182,0.565573425650684,0.00014758057862500836,206.14511507474458,COMPLETE
517,0.33288660645484924,2023-09-04 21:30:13.391939,2023-09-04 21:30:13.906006,0 days 00:00:00.514067,ReLU,Leaky,Tanh,,95,20,21.0,5.0,,0.0032210380979765044,3,198,0.4826182678946606,0.00022486901289035896,137.01406780042146,COMPLETE
518,0.3392314314842224,2023-09-04 21:30:13.906351,2023-09-04 21:30:14.718924,0 days 00:00:00.812573,ReLU,Leaky,Sigmoid,,59,21,21.0,23.0,,0.007382699744300749,3,172,0.6245744977899201,7.70093421006729e-05,198.9596576429393,COMPLETE
519,0.8827311992645264,2023-09-04 21:30:14.719282,2023-09-04 21:30:17.425835,0 days 00:00:02.706553,Sigmoid,Leaky,Sigmoid,,32,17,17.0,21.0,,2.1138746309596008e-05,3,330,0.1944463449448449,0.00011004014542720775,220.20822300766454,COMPLETE
520,0.2799068093299866,2023-09-04 21:30:17.426442,2023-09-04 21:30:19.269510,0 days 00:00:01.843068,ReLU,Leaky,ReLU,,35,20,20.0,23.0,,0.004033686361484415,3,198,0.7160313081146502,0.00024814060830124005,97.1840033280222,COMPLETE
521,0.35556232929229736,2023-09-04 21:30:19.269852,2023-09-04 21:30:20.105817,0 days 00:00:00.835965,Leaky,Leaky,Tanh,,82,22,11.0,22.0,,0.0012076231717147203,3,186,0.7525944888790721,6.223880960243713e-05,136.51750107753423,COMPLETE
522,0.3624465763568878,2023-09-04 21:30:20.106180,2023-09-04 21:30:20.835381,0 days 00:00:00.729201,Tanh,Leaky,Sigmoid,,36,11,21.0,24.0,,0.005823244057408217,3,205,0.2806402685307713,0.0016638087714427555,140.98077030374546,COMPLETE
523,0.29937055706977844,2023-09-04 21:30:20.835725,2023-09-04 21:30:21.885893,0 days 00:00:01.050168,ReLU,Leaky,Sigmoid,,30,20,19.0,14.0,,0.009743487707391635,3,307,0.796267555252694,0.0008113446740198691,434.9603278118631,COMPLETE
524,0.5755822658538818,2023-09-04 21:30:21.886234,2023-09-04 21:30:22.899583,0 days 00:00:01.013349,Sigmoid,Leaky,ReLU,,16,15,21.0,15.0,,0.01234607568287243,3,274,0.6811377034351496,0.020162450086131493,216.54683380126954,COMPLETE
525,0.3146018385887146,2023-09-04 21:30:22.899934,2023-09-04 21:30:23.623991,0 days 00:00:00.724057,ReLU,Tanh,Tanh,,34,21,20.0,21.0,,0.019118313573609068,3,163,0.7998242807640199,5.326159240468357e-05,132.81380013858572,COMPLETE
526,0.31022000312805176,2023-09-04 21:30:23.624357,2023-09-04 21:30:24.458615,0 days 00:00:00.834258,ReLU,Leaky,Sigmoid,,38,21,6.0,23.0,,0.004727045472545508,3,182,0.7257533596048226,0.0005568890336036393,462.18652121225995,COMPLETE
527,0.4216296076774597,2023-09-04 21:30:24.458973,2023-09-04 21:30:25.346501,0 days 00:00:00.887528,Sigmoid,Leaky,Sigmoid,,25,18,21.0,23.0,,0.0025680706967804875,3,266,0.17930659561684698,7.39618867706308e-05,132.33345960534137,COMPLETE
528,0.40819504857063293,2023-09-04 21:30:25.346846,2023-09-04 21:30:25.559659,0 days 00:00:00.212813,ReLU,Leaky,ReLU,,32,23,20.0,22.0,,0.008278240100781842,3,197,0.15922998337493344,6.161387186351919e-05,360.47313012017145,COMPLETE
529,0.567722737789154,2023-09-04 21:30:25.560012,2023-09-04 21:30:30.067411,0 days 00:00:04.507399,Tanh,Leaky,Tanh,,34,20,22.0,22.0,,1.1511381008876122e-05,3,173,0.7557207511056109,0.00011189424226694852,170.18275592781904,COMPLETE
530,0.4722379148006439,2023-09-04 21:30:30.067762,2023-09-04 21:30:30.213307,0 days 00:00:00.145545,ReLU,Leaky,Sigmoid,,37,21,22.0,24.0,,0.022359580084450853,3,201,0.2724847517933688,0.0007163293445230376,158.3807607797476,COMPLETE
531,0.3597439229488373,2023-09-04 21:30:30.213735,2023-09-04 21:30:30.868048,0 days 00:00:00.654313,Sigmoid,Leaky,Sigmoid,,40,22,21.0,6.0,,0.028274296084556935,3,361,0.33993881874012566,0.000612486523021426,170.2963527880217,COMPLETE
532,0.3195509910583496,2023-09-04 21:30:30.868501,2023-09-04 21:30:31.269398,0 days 00:00:00.400897,ReLU,Leaky,ReLU,,29,20,21.0,21.0,,0.006753892289011361,3,189,0.2528014239336022,0.0027506411675337914,132.73612894910448,COMPLETE
533,0.6007027626037598,2023-09-04 21:30:31.269763,2023-09-04 21:30:31.397008,0 days 00:00:00.127245,ReLU,Leaky,Leaky,,51,1,22.0,8.0,,0.013543134497242522,3,210,0.1342749386198388,4.620598921783095e-05,362.78443615253155,COMPLETE
534,0.4354865550994873,2023-09-04 21:30:31.397368,2023-09-04 21:30:31.840364,0 days 00:00:00.442996,Sigmoid,Tanh,Tanh,,62,17,21.0,20.0,,0.08789892464738817,3,251,0.7116182852228448,0.0062408494079468115,380.1895783368279,COMPLETE
535,0.3573555648326874,2023-09-04 21:30:31.840716,2023-09-04 21:30:32.296791,0 days 00:00:00.456075,ReLU,Leaky,Sigmoid,,31,21,22.0,23.0,,0.01080459218548778,3,322,0.2950906147884517,0.00013480576935564256,168.88826443286652,COMPLETE
536,0.29188212752342224,2023-09-04 21:30:32.297167,2023-09-04 21:30:32.868902,0 days 00:00:00.571735,Leaky,Leaky,Leaky,,55,22,20.0,7.0,,0.0035227599514450494,3,135,0.6101843439416695,0.00020429826282970565,459.439416885376,COMPLETE
537,0.30974364280700684,2023-09-04 21:30:32.869258,2023-09-04 21:30:33.958988,0 days 00:00:01.089730,Tanh,Leaky,Sigmoid,,39,20,19.0,8.0,,0.016888588483823297,3,279,0.7645541333782596,0.0003155687474591008,156.81853663126628,COMPLETE
538,0.38815808296203613,2023-09-04 21:30:33.959343,2023-09-04 21:30:34.341264,0 days 00:00:00.381921,ReLU,Leaky,,,35,20,22.0,,,0.005685135157723214,2,177,0.39820735923830464,8.384347253016513e-05,168.3310746413011,COMPLETE
539,0.3365025520324707,2023-09-04 21:30:34.341622,2023-09-04 21:30:36.264129,0 days 00:00:01.922507,Sigmoid,Leaky,Leaky,,33,19,8.0,9.0,,0.0043062221757992954,3,265,0.5123639339494982,5.014143816096534e-05,303.24851919899527,COMPLETE
540,0.4788456857204437,2023-09-04 21:30:36.264487,2023-09-04 21:30:40.520256,0 days 00:00:04.255769,ReLU,Leaky,ReLU,,28,18,21.0,23.0,,6.66550022762274e-05,3,212,0.6565219627964146,6.861419444746967e-05,292.9109646059432,COMPLETE
541,0.6644666194915771,2023-09-04 21:30:40.520620,2023-09-04 21:30:43.906678,0 days 00:00:03.386058,Sigmoid,Leaky,Leaky,,36,22,20.0,22.0,,1.5317669159225615e-05,3,191,0.6944284021596009,0.0020372264325607898,169.20261287189902,COMPLETE
542,0.30094942450523376,2023-09-04 21:30:43.907042,2023-09-04 21:30:45.312312,0 days 00:00:01.405270,ReLU,Leaky,Sigmoid,,31,21,21.0,9.0,,0.008972090087853346,3,259,0.740239712247109,0.0009883209343741954,162.57531180310605,COMPLETE
543,0.4139173924922943,2023-09-04 21:30:45.312669,2023-09-04 21:30:46.250539,0 days 00:00:00.937870,Tanh,Tanh,Tanh,,38,21,22.0,24.0,,0.038960006252906826,3,202,0.7747490762634536,0.007626205987619463,247.75156106754224,COMPLETE
544,0.3599519729614258,2023-09-04 21:30:46.250906,2023-09-04 21:30:49.129475,0 days 00:00:02.878569,ReLU,Leaky,Leaky,,42,19,22.0,13.0,,0.0008512953965471734,3,289,0.7318274366638017,4.2309023904952444e-05,133.75182524181548,COMPLETE
545,0.3423556685447693,2023-09-04 21:30:49.130105,2023-09-04 21:30:50.274683,0 days 00:00:01.144578,Sigmoid,Leaky,Sigmoid,,34,20,21.0,8.0,,0.0123680719275177,3,252,0.7724528770181296,0.00015861684394953763,137.37434092739173,COMPLETE
546,0.3898666203022003,2023-09-04 21:30:50.275032,2023-09-04 21:30:50.699457,0 days 00:00:00.424425,ReLU,Leaky,Leaky,,27,9,22.0,21.0,,0.007268075930117008,3,167,0.22235786627116277,5.73386712432938e-05,181.04785127992983,COMPLETE
547,0.2738712430000305,2023-09-04 21:30:50.699835,2023-09-04 21:30:52.101312,0 days 00:00:01.401477,ReLU,Leaky,ReLU,,32,18,21.0,9.0,,0.0014562253788091039,3,302,0.7977713426633273,0.0010926362782730896,270.41854600172775,COMPLETE
548,0.3346622884273529,2023-09-04 21:30:52.101684,2023-09-04 21:30:52.644847,0 days 00:00:00.543163,Leaky,Leaky,Leaky,,40,21,20.0,8.0,,0.01799135570957711,3,244,0.5014723541922095,0.0003955871654451188,265.55877234719014,COMPLETE
549,0.8637591600418091,2023-09-04 21:30:52.645215,2023-09-04 21:30:55.453687,0 days 00:00:02.808472,Sigmoid,ReLU,Sigmoid,,36,20,21.0,9.0,,1.9057468605146532e-05,3,181,0.6400812503830506,0.0005155714124902071,130.26795799297523,COMPLETE
550,0.508103609085083,2023-09-04 21:30:55.454043,2023-09-04 21:30:55.666199,0 days 00:00:00.212156,ReLU,Leaky,Tanh,,30,21,22.0,23.0,,0.0022159229049842355,3,216,0.1283505714982075,0.0002563719365294846,200.44532032502002,COMPLETE
551,0.3456483483314514,2023-09-04 21:30:55.666553,2023-09-04 21:30:56.303576,0 days 00:00:00.637023,Tanh,Leaky,Leaky,,37,22,19.0,16.0,,0.014961524875867738,3,228,0.7038374408899928,0.0014260892885130873,198.35657946268717,COMPLETE
552,0.35260534286499023,2023-09-04 21:30:56.303935,2023-09-04 21:30:56.715323,0 days 00:00:00.411388,ReLU,Tanh,Sigmoid,,33,19,23.0,22.0,,0.02170468798876965,3,208,0.3625462080921179,4.1659356879380996e-05,706.9447021484375,COMPLETE
553,0.32462912797927856,2023-09-04 21:30:56.715685,2023-09-04 21:30:58.215382,0 days 00:00:01.499697,Sigmoid,Leaky,Leaky,,39,20,18.0,7.0,,0.002834438552267379,3,187,0.680551597684502,0.00010264869523673855,393.21308143851684,COMPLETE
554,0.29903876781463623,2023-09-04 21:30:58.215754,2023-09-04 21:31:00.403385,0 days 00:00:02.187631,ReLU,ReLU,Sigmoid,,23,22,20.0,8.0,,0.010230683462312951,3,236,0.7444964448550487,0.0003355112351780167,190.1841029240535,COMPLETE
555,0.2785991132259369,2023-09-04 21:31:00.403742,2023-09-04 21:31:01.872107,0 days 00:00:01.468365,ReLU,Leaky,Leaky,,29,23,14.0,15.0,,0.005688119344409154,3,255,0.7705196135054676,0.00018431695531042274,147.5581510676894,COMPLETE
556,0.5674421191215515,2023-09-04 21:31:01.872468,2023-09-04 21:31:04.335824,0 days 00:00:02.463356,Sigmoid,Leaky,ReLU,,35,19,21.0,24.0,,0.00016522879567585304,3,155,0.5877601967603723,0.004442601916956472,232.3204309278919,COMPLETE
