number,value,datetime_start,datetime_complete,duration,params_activation1,params_activation2,params_activation3,params_activation4,params_batch_size,params_fl1,params_fl2,params_fl3,params_fl4,params_learning_rate,params_n_layers,params_num_epochs,params_train_size,params_weight_decay,user_attrs_mre,state
1164,0.40435755252838135,2023-09-04 21:30:54.299913,2023-09-04 21:30:54.605915,0 days 00:00:00.306002,Leaky,Tanh,,,82,17,12.0,,,0.01842058491798222,2,304,0.6480771727541709,0.011374571503169539,186.1891120172316,COMPLETE
1165,0.30268383026123047,2023-09-04 21:30:54.606360,2023-09-04 21:30:54.924117,0 days 00:00:00.317757,Tanh,ReLU,,,73,19,21.0,,,0.012616880340141247,2,199,0.7164327595505261,0.00019752393330029424,290.38392469618054,COMPLETE
1166,0.4435080587863922,2023-09-04 21:30:54.924535,2023-09-04 21:30:55.179343,0 days 00:00:00.254808,Tanh,Tanh,,,84,18,22.0,,,0.006699351313325856,2,293,0.23216047099436868,0.007480407312065966,161.7682718737372,COMPLETE
1167,0.39220157265663147,2023-09-04 21:30:55.179772,2023-09-04 21:30:56.456035,0 days 00:00:01.276263,Leaky,Tanh,,,20,19,10.0,,,0.02771024752536689,2,493,0.769247037904641,0.0001289951073275485,381.24228424072265,COMPLETE
1168,0.2972029745578766,2023-09-04 21:30:56.456458,2023-09-04 21:30:56.933943,0 days 00:00:00.477485,Tanh,ReLU,,,71,18,14.0,,,0.035716397286538464,2,324,0.743462352588935,5.132993007858269e-05,137.67962369051847,COMPLETE
1169,0.29218342900276184,2023-09-04 21:30:56.934386,2023-09-04 21:30:58.250170,0 days 00:00:01.315784,Leaky,Sigmoid,,,79,17,7.0,,,0.004363362970236609,2,273,0.7998990263853066,7.614576446676429e-05,780.5406019422743,COMPLETE
1170,0.3855536878108978,2023-09-04 21:30:58.250601,2023-09-04 21:30:58.783211,0 days 00:00:00.532610,ReLU,Tanh,,,77,16,11.0,,,0.0014779179387532817,2,298,0.34062598817120493,3.747841556769687e-05,136.44738825526807,COMPLETE
1171,0.3954884707927704,2023-09-04 21:30:58.783629,2023-09-04 21:30:58.992376,0 days 00:00:00.208747,Tanh,Leaky,,,83,17,9.0,,,0.01492237070776334,2,481,0.24678748198558184,0.00015095498180454263,127.45746559320494,COMPLETE
1172,0.41153958439826965,2023-09-04 21:30:58.992797,2023-09-04 21:30:59.226121,0 days 00:00:00.233324,Tanh,Tanh,,,80,18,24.0,,,0.020614954666858275,2,500,0.21469086675129587,0.0003193466947414306,134.57446048134253,COMPLETE
1173,0.3421124815940857,2023-09-04 21:30:59.226540,2023-09-04 21:30:59.545602,0 days 00:00:00.319062,Leaky,ReLU,,,74,19,11.0,,,0.05147134127631414,2,282,0.6947076051261238,0.00010839542726682093,164.99073344263536,COMPLETE
1174,0.5276714563369751,2023-09-04 21:30:59.546024,2023-09-04 21:31:04.315566,0 days 00:00:04.769542,Tanh,Tanh,,,31,20,23.0,,,1.325152215927597e-05,2,264,0.7998446032028921,0.00018392144509436244,221.24620576338336,COMPLETE
1175,0.3376908004283905,2023-09-04 21:31:04.315989,2023-09-04 21:31:04.660488,0 days 00:00:00.344499,Tanh,Tanh,,,91,18,12.0,,,0.026694888213985676,2,286,0.7403830003177174,0.0005284138411257697,219.40044941621667,COMPLETE
1176,0.3297123312950134,2023-09-04 21:31:04.660924,2023-09-04 21:31:04.931665,0 days 00:00:00.270741,Leaky,ReLU,,,86,21,8.0,,,0.01763427807798066,2,310,0.2611444593974004,0.00350879125343135,133.18721541147383,COMPLETE
1177,0.36087602376937866,2023-09-04 21:31:04.932092,2023-09-04 21:31:05.677274,0 days 00:00:00.745182,Tanh,Sigmoid,,,70,17,10.0,,,0.010631779697153192,2,398,0.6256434095030362,0.0009221044718599978,289.2702556703149,COMPLETE
1178,0.5232378244400024,2023-09-04 21:31:05.677702,2023-09-04 21:31:06.275837,0 days 00:00:00.598135,ReLU,Tanh,,,78,19,9.0,,,0.037358208436596804,2,256,0.7742317364671879,0.02329370034803688,184.80388693973936,COMPLETE
1179,0.6554087996482849,2023-09-04 21:31:06.276268,2023-09-04 21:31:07.936284,0 days 00:00:01.660016,Tanh,ReLU,,,76,17,15.0,,,2.9633355868668486e-05,2,246,0.501694538403029,0.030592997753697622,216.0908031308554,COMPLETE
1180,0.3864043354988098,2023-09-04 21:31:07.936696,2023-09-04 21:31:09.989457,0 days 00:00:02.052761,Leaky,Leaky,,,81,18,16.0,,,0.00038692279592781996,2,299,0.5817653271544692,0.0015208663423280687,246.818791469204,COMPLETE
1181,0.34801948070526123,2023-09-04 21:31:09.989854,2023-09-04 21:31:10.448856,0 days 00:00:00.459002,Tanh,Tanh,,,79,18,7.0,,,0.023549770609760937,2,272,0.43852428846759134,8.695795951742202e-05,1265.0008132289834,COMPLETE
1182,0.3959902822971344,2023-09-04 21:31:10.449283,2023-09-04 21:31:10.774497,0 days 00:00:00.325214,Leaky,Tanh,,,64,15,13.0,,,0.030493288877182737,2,291,0.7192511948811173,0.0007046525295102009,140.33199251615085,COMPLETE
1183,0.43835926055908203,2023-09-04 21:31:10.774954,2023-09-04 21:31:11.002692,0 days 00:00:00.227738,Tanh,Sigmoid,,,83,16,8.0,,,0.013048825482842854,2,308,0.13079810047105292,6.703003101656536e-05,203.1521712711879,COMPLETE
1184,0.32298749685287476,2023-09-04 21:31:11.003127,2023-09-04 21:31:11.631646,0 days 00:00:00.628519,Tanh,ReLU,,,85,19,19.0,,,0.002581206586263541,2,279,0.674813184098661,0.00013765003507351062,5281.652331882053,COMPLETE
1185,0.3402612507343292,2023-09-04 21:31:11.632129,2023-09-04 21:31:12.067802,0 days 00:00:00.435673,Leaky,Tanh,,,88,18,11.0,,,0.003788355450977122,2,232,0.7682075632893344,0.0043012742065751865,351.7466320658839,COMPLETE
1186,0.2918875515460968,2023-09-04 21:31:12.068236,2023-09-04 21:31:12.649683,0 days 00:00:00.581447,Tanh,Tanh,,,73,17,23.0,,,0.020126358890378376,2,316,0.7440569100002734,0.00011378012955575402,521.709189675071,COMPLETE
1187,0.4069744646549225,2023-09-04 21:31:12.650206,2023-09-04 21:31:13.003067,0 days 00:00:00.352861,ReLU,ReLU,,,81,5,9.0,,,0.016135510734893877,2,123,0.7062443011859446,0.00024830576571026146,242.90889020647322,COMPLETE
1188,0.26151156425476074,2023-09-04 21:31:13.003497,2023-09-04 21:31:13.389430,0 days 00:00:00.385933,Tanh,Tanh,,,77,19,10.0,,,0.02802170406280263,2,145,0.7709442926779662,0.0001668909423577642,140.93865719963523,COMPLETE
1189,0.496006578207016,2023-09-04 21:31:13.389873,2023-09-04 21:31:13.496461,0 days 00:00:00.106588,Tanh,Leaky,,,50,17,10.0,,,0.042471364942311206,2,113,0.1110442900751074,0.0002072343758385368,400.55240740094865,COMPLETE
1190,0.2478732019662857,2023-09-04 21:31:13.496916,2023-09-04 21:31:13.968684,0 days 00:00:00.471768,Tanh,Tanh,Sigmoid,,77,18,10.0,12.0,,0.03406761965311267,3,153,0.7731650432778525,0.0001638164570579608,413.9203243771115,COMPLETE
1191,0.2408141791820526,2023-09-04 21:31:13.969106,2023-09-04 21:31:14.717869,0 days 00:00:00.748763,Tanh,Sigmoid,Sigmoid,,78,20,10.0,13.0,,0.040233137556526535,3,186,0.7994085868403407,0.00017171533097699827,141.10151509769628,COMPLETE
1192,0.26072850823402405,2023-09-04 21:31:14.718299,2023-09-04 21:31:15.407590,0 days 00:00:00.689291,Tanh,Sigmoid,Sigmoid,,79,21,10.0,12.0,,0.05014218998753552,3,182,0.777715303988746,0.00019105679333348123,220.19674156452047,COMPLETE
1193,0.397684246301651,2023-09-04 21:31:15.408012,2023-09-04 21:31:15.793755,0 days 00:00:00.385743,Tanh,Sigmoid,Sigmoid,,78,21,10.0,13.0,,0.050007490939145444,3,205,0.7990384608856974,0.00019781084023744346,163.39038029423466,COMPLETE
1194,0.3687102794647217,2023-09-04 21:31:15.794209,2023-09-04 21:31:16.334913,0 days 00:00:00.540704,Tanh,Sigmoid,Sigmoid,,78,22,10.0,12.0,,0.04728983211969682,3,185,0.7990104018842791,0.00017720833556377708,158.24168559483118,COMPLETE
1195,0.3754311501979828,2023-09-04 21:31:16.335345,2023-09-04 21:31:16.648845,0 days 00:00:00.313500,Tanh,Sigmoid,Sigmoid,,79,20,2.0,15.0,,0.039857492795511804,3,185,0.32604537516840654,0.000220965462613359,244.72503341674803,COMPLETE
1196,0.543613851070404,2023-09-04 21:31:16.649342,2023-09-04 21:31:16.918675,0 days 00:00:00.269333,Tanh,Sigmoid,Sigmoid,,45,21,10.0,11.0,,0.04067608689951367,3,193,0.167363766375331,0.006291030427599044,159.60912956075467,COMPLETE
1197,0.2999964654445648,2023-09-04 21:31:16.919120,2023-09-04 21:31:17.733855,0 days 00:00:00.814735,Tanh,Sigmoid,Sigmoid,,47,23,10.0,9.0,,0.03277356398591367,3,177,0.7991160594023705,0.0001574165666833761,214.8160064074458,COMPLETE
1198,0.29551517963409424,2023-09-04 21:31:17.734285,2023-09-04 21:31:18.255994,0 days 00:00:00.521709,Tanh,Sigmoid,Sigmoid,,77,21,10.0,15.0,,0.03590864681567665,3,183,0.7713108818442048,0.00022386178145489833,259.9289757864816,COMPLETE
1199,0.35213613510131836,2023-09-04 21:31:18.256447,2023-09-04 21:31:18.687693,0 days 00:00:00.431246,Tanh,Sigmoid,Sigmoid,,48,21,10.0,17.0,,0.04630149454269327,3,172,0.2855049350159854,0.0002536866404008993,347.1417339091398,COMPLETE
1200,0.20098531246185303,2023-09-04 21:31:18.688132,2023-09-04 21:31:19.321163,0 days 00:00:00.633031,Tanh,Sigmoid,Sigmoid,,76,20,10.0,10.0,,0.034235065659706826,3,175,0.7671169095475128,0.00017780662058604037,287.20681474793633,COMPLETE
1201,0.34346678853034973,2023-09-04 21:31:19.321613,2023-09-04 21:31:19.721957,0 days 00:00:00.400344,Tanh,Sigmoid,Sigmoid,,77,21,10.0,10.0,,0.03409033970567685,3,163,0.3130830626061572,0.0001568884883892789,484.7380382150844,COMPLETE
1202,0.31095394492149353,2023-09-04 21:31:19.722451,2023-09-04 21:31:20.291740,0 days 00:00:00.569289,Tanh,Sigmoid,Sigmoid,,75,20,10.0,14.0,,0.03614756611449874,3,187,0.7665000542828311,0.0001439636642480116,165.94833221435547,COMPLETE
1203,0.5144520401954651,2023-09-04 21:31:20.292180,2023-09-04 21:31:22.235207,0 days 00:00:01.943027,Tanh,Sigmoid,Sigmoid,,75,20,10.0,8.0,,0.0007498672651647675,3,174,0.7659053657506841,0.00017715220531723416,222.56881898024986,COMPLETE
1204,0.3092406690120697,2023-09-04 21:31:22.235630,2023-09-04 21:31:22.954725,0 days 00:00:00.719095,Tanh,Sigmoid,Sigmoid,ReLU,75,21,10.0,7.0,11.0,0.031384540652619176,4,189,0.7984169420117503,0.00030601093894129093,409.76063662159197,COMPLETE
1205,0.6623131632804871,2023-09-04 21:31:22.955156,2023-09-04 21:31:23.082125,0 days 00:00:00.126969,Tanh,Sigmoid,Sigmoid,,76,16,10.0,9.0,,0.03961192698485317,3,164,0.17491902684230373,0.00014394032935154257,175.547509765625,COMPLETE
1206,0.38331180810928345,2023-09-04 21:31:23.082578,2023-09-04 21:31:23.534572,0 days 00:00:00.451994,Tanh,Sigmoid,Sigmoid,,75,21,9.0,6.0,,0.031197613849275566,3,195,0.7466391103844888,0.0002066363746225983,224.50086495535714,COMPLETE
1207,0.48768648505210876,2023-09-04 21:31:23.535012,2023-09-04 21:31:24.021025,0 days 00:00:00.486013,Tanh,Sigmoid,Sigmoid,,73,20,9.0,16.0,,0.003078480394402305,3,171,0.7717944734524365,0.00027470879381104963,242.54218419392905,COMPLETE
1208,0.8891083598136902,2023-09-04 21:31:24.021477,2023-09-04 21:31:24.434700,0 days 00:00:00.413223,Tanh,Sigmoid,Sigmoid,,77,20,10.0,13.0,,0.00023939455803374842,3,157,0.12218400808162073,0.00016381428857736505,102.80383159856127,COMPLETE
1209,0.39740094542503357,2023-09-04 21:31:24.435129,2023-09-04 21:31:26.506146,0 days 00:00:02.071017,Tanh,Sigmoid,Sigmoid,,74,20,9.0,11.0,,0.0011368706213186715,3,192,0.7416861921965429,0.0001308700840935509,304.1166994571686,COMPLETE
1210,0.34621965885162354,2023-09-04 21:31:26.506591,2023-09-04 21:31:26.936944,0 days 00:00:00.430353,Tanh,Sigmoid,Sigmoid,,51,20,10.0,10.0,,0.02814987115568475,3,175,0.37835115136511743,0.0002185782816041127,979.1912943522135,COMPLETE
1211,0.3921264410018921,2023-09-04 21:31:26.937375,2023-09-04 21:31:27.475052,0 days 00:00:00.537677,Tanh,Sigmoid,Sigmoid,,76,21,10.0,14.0,,0.03774968109313833,3,149,0.7996135540137155,0.008232528417719582,317.9348802112398,COMPLETE
1212,0.26362207531929016,2023-09-04 21:31:27.475506,2023-09-04 21:31:28.422668,0 days 00:00:00.947162,Tanh,Sigmoid,Tanh,,43,20,10.0,18.0,,0.03041304447208418,3,193,0.7701153370460144,0.00016790315156139503,685.7389004794034,COMPLETE
1213,0.42770853638648987,2023-09-04 21:31:28.423144,2023-09-04 21:31:28.963114,0 days 00:00:00.539970,Tanh,Sigmoid,ReLU,,72,20,9.0,6.0,,0.025455146046300545,3,197,0.733464701293594,0.00036755034078538176,1066.5796741303943,COMPLETE
1214,0.6675214171409607,2023-09-04 21:31:28.963582,2023-09-04 21:31:30.135328,0 days 00:00:01.171746,Tanh,Sigmoid,Sigmoid,,79,20,11.0,4.0,,0.00014747862124088324,3,170,0.4661638284362085,0.00012611064124566754,145.23939141666187,COMPLETE
1215,0.6248511672019958,2023-09-04 21:31:30.135768,2023-09-04 21:31:30.360273,0 days 00:00:00.224505,Tanh,Sigmoid,Sigmoid,,77,20,9.0,8.0,,0.0426848292722544,3,201,0.3603424559553524,0.011204947800521229,159.821435546875,COMPLETE
1216,0.3360830843448639,2023-09-04 21:31:30.360714,2023-09-04 21:31:30.833449,0 days 00:00:00.472735,Tanh,Sigmoid,Leaky,,78,12,10.0,16.0,,0.03252076805742426,3,174,0.42604992529092217,0.00017462339084649167,138.29794450239703,COMPLETE
1217,1.0980075597763062,2023-09-04 21:31:30.833891,2023-09-04 21:31:31.596864,0 days 00:00:00.762973,Tanh,Sigmoid,ReLU,,73,20,9.0,20.0,,2.5808591157473218e-05,3,195,0.2132533050930342,0.00014268667872608735,103.16140704032702,COMPLETE
1218,0.44258707761764526,2023-09-04 21:31:31.597305,2023-09-04 21:31:32.934526,0 days 00:00:01.337221,Tanh,,,,75,21,,,,0.00019146282644181558,1,164,0.7704949605868018,0.00026774989165059815,444.09389923840035,COMPLETE
1219,0.3344348073005676,2023-09-04 21:31:32.934936,2023-09-04 21:31:33.514106,0 days 00:00:00.579170,Tanh,Sigmoid,Tanh,,78,20,11.0,9.0,,0.008403888960667516,3,185,0.34320741996275905,0.00020282754944082082,862.8037769047901,COMPLETE
1220,0.4513965845108032,2023-09-04 21:31:33.514551,2023-09-04 21:31:34.403287,0 days 00:00:00.888736,Tanh,Sigmoid,Sigmoid,,76,22,9.0,15.0,,0.0018897107397517167,3,137,0.4002595793260803,0.0054787050831695515,171.50619679471873,COMPLETE
1221,0.3155742883682251,2023-09-04 21:31:34.403715,2023-09-04 21:31:34.873167,0 days 00:00:00.469452,Tanh,Sigmoid,Leaky,,79,21,10.0,10.0,,0.026476731453379514,3,188,0.7315425767720108,0.00014768858246671428,145.65820091649107,COMPLETE
1222,0.39125242829322815,2023-09-04 21:31:34.873598,2023-09-04 21:31:35.649841,0 days 00:00:00.776243,Tanh,Sigmoid,ReLU,,71,20,11.0,11.0,,0.005834726970693517,3,155,0.7979356395205771,0.006569012905046861,169.53123054504394,COMPLETE
1223,0.4291481077671051,2023-09-04 21:31:35.650459,2023-09-04 21:31:36.177791,0 days 00:00:00.527332,Tanh,Sigmoid,Tanh,,80,16,9.0,13.0,,0.03521132252588237,3,205,0.4236931059091083,0.013279179968368771,247.5054813639323,COMPLETE
1224,0.45160162448883057,2023-09-04 21:31:36.178223,2023-09-04 21:31:36.365945,0 days 00:00:00.187722,Tanh,Sigmoid,Sigmoid,,73,16,5.0,12.0,,0.027175408667166463,3,182,0.13751683214314797,0.00023275032882736133,154.55310523800733,COMPLETE
1225,0.37782979011535645,2023-09-04 21:31:36.366392,2023-09-04 21:31:36.807641,0 days 00:00:00.441249,Tanh,Sigmoid,Sigmoid,,74,20,4.0,18.0,,0.04199131818976664,3,175,0.3241858602028607,0.00011995508413167412,234.03992712987613,COMPLETE
1226,0.34802135825157166,2023-09-04 21:31:36.808073,2023-09-04 21:31:38.199186,0 days 00:00:01.391113,Tanh,Sigmoid,Leaky,,80,14,10.0,7.0,,0.004906462314973734,3,200,0.7486243649428611,0.00019186337764686,150.57774713134765,COMPLETE
1227,0.5030710101127625,2023-09-04 21:31:38.199637,2023-09-04 21:31:40.010522,0 days 00:00:01.810885,Tanh,Sigmoid,Sigmoid,,69,17,10.0,4.0,,0.0004682010271900168,3,213,0.7691148219042577,0.00015022803713930858,197.5928925544985,COMPLETE
1228,0.6048952341079712,2023-09-04 21:31:40.010963,2023-09-04 21:31:40.791901,0 days 00:00:00.780938,Tanh,Sigmoid,ReLU,,76,11,9.0,2.0,,0.0010370438199851033,3,179,0.26392636549199083,0.00983166272709193,122.36716312003536,COMPLETE
1229,0.29634061455726624,2023-09-04 21:31:40.792334,2023-09-04 21:31:41.398999,0 days 00:00:00.606665,Tanh,Sigmoid,Tanh,,77,17,24.0,15.0,,0.02384327654959784,3,165,0.7207737768771095,0.00012426201596546643,162.80050996633676,COMPLETE
1230,0.3354261815547943,2023-09-04 21:31:41.399469,2023-09-04 21:31:41.998322,0 days 00:00:00.598853,Tanh,Sigmoid,Sigmoid,,80,17,11.0,14.0,,0.03202909604718701,3,199,0.7694903520993075,0.00046185250325100506,226.8424883075789,COMPLETE
1231,0.9510436058044434,2023-09-04 21:31:41.998806,2023-09-04 21:31:43.590577,0 days 00:00:01.591771,Tanh,Sigmoid,Sigmoid,,78,22,10.0,23.0,,2.9398727208042572e-05,3,206,0.532338206047265,0.00028508539630659564,108.56269803093475,COMPLETE
1232,0.3669454753398895,2023-09-04 21:31:43.591042,2023-09-04 21:31:45.296734,0 days 00:00:01.705692,Tanh,ReLU,Leaky,,81,7,9.0,17.0,,0.0015067929237792994,3,189,0.7985416007570628,0.00017498146745170272,153.32740389916205,COMPLETE
1233,0.3567476272583008,2023-09-04 21:31:45.297176,2023-09-04 21:31:46.591831,0 days 00:00:01.294655,Tanh,Sigmoid,Sigmoid,,71,19,11.0,12.0,,0.003167643642206919,3,154,0.5507679241286015,0.00041296309251788585,608.1817437704508,COMPLETE
1234,0.4683661162853241,2023-09-04 21:31:46.592258,2023-09-04 21:31:46.834262,0 days 00:00:00.242004,Tanh,ReLU,ReLU,,75,15,9.0,10.0,,0.006537618038175487,3,210,0.14652879032880928,0.00023415031468192112,177.7162123649351,COMPLETE
1235,0.45573288202285767,2023-09-04 21:31:46.834711,2023-09-04 21:31:46.962835,0 days 00:00:00.128124,ReLU,Sigmoid,Tanh,,79,20,23.0,9.0,,0.023771645323852883,3,146,0.10613201581171657,1.558287536651713e-05,164.1659273893937,COMPLETE
1236,0.4907045364379883,2023-09-04 21:31:46.963296,2023-09-04 21:31:49.108174,0 days 00:00:02.144878,Tanh,ReLU,Sigmoid,,74,19,6.0,5.0,,0.0008035922420689367,3,181,0.7465592250978491,0.00010837448566037437,207.8436724197033,COMPLETE
1237,0.31164565682411194,2023-09-04 21:31:49.108624,2023-09-04 21:31:49.643565,0 days 00:00:00.534941,Tanh,Leaky,Sigmoid,,77,16,22.0,20.0,,0.036595210870155645,3,163,0.7153744272380755,0.0006976832168221115,156.68641933865018,COMPLETE
1238,1.1408199071884155,2023-09-04 21:31:49.644145,2023-09-04 21:31:50.362538,0 days 00:00:00.718393,Tanh,ReLU,Sigmoid,,81,16,10.0,13.0,,1.8371693867217004e-05,3,141,0.30411198006317197,0.00014301602422611128,103.06088998131719,COMPLETE
1239,0.387058287858963,2023-09-04 21:31:50.362997,2023-09-04 21:31:50.828460,0 days 00:00:00.465463,Tanh,Sigmoid,Leaky,,72,17,11.0,7.0,,0.0074781874883851854,3,197,0.20363667071122796,0.00017141448912211908,140.99811458587646,COMPLETE
1240,0.4538407325744629,2023-09-04 21:31:50.828918,2023-09-04 21:31:51.494882,0 days 00:00:00.665964,Tanh,ReLU,Sigmoid,ReLU,49,17,10.0,11.0,17.0,0.010073474480693064,4,181,0.4925292710595198,0.013090648475738926,165.24576640578937,COMPLETE
1241,0.26258355379104614,2023-09-04 21:31:51.495342,2023-09-04 21:31:52.385448,0 days 00:00:00.890106,ReLU,Leaky,Tanh,,46,20,24.0,8.0,,0.0022018417313764303,3,193,0.7998968979721465,0.018133433034036514,248.73841977586935,COMPLETE
1242,0.3817094564437866,2023-09-04 21:31:52.385958,2023-09-04 21:31:52.725580,0 days 00:00:00.339622,Tanh,Sigmoid,ReLU,,76,19,9.0,19.0,,0.04454739481819106,3,155,0.7450561788299614,0.0003258332458706406,204.98820877075195,COMPLETE
1243,0.4313410520553589,2023-09-04 21:31:52.726123,2023-09-04 21:31:53.027203,0 days 00:00:00.301080,Tanh,ReLU,Sigmoid,,79,17,11.0,14.0,,0.02918602829471936,3,132,0.11904755776391297,0.00020247181467260845,281.34301085970293,COMPLETE
1244,0.377280592918396,2023-09-04 21:31:53.027783,2023-09-04 21:31:53.455303,0 days 00:00:00.427520,Tanh,ReLU,Sigmoid,,52,19,9.0,17.0,,0.02130939759596855,3,213,0.2380535715203762,0.00011785463495982857,167.22654064281568,COMPLETE
1245,0.9393578171730042,2023-09-04 21:31:53.455886,2023-09-04 21:31:55.004003,0 days 00:00:01.548117,Tanh,Sigmoid,Sigmoid,,69,18,10.0,6.0,,4.893452237210621e-05,3,186,0.5275157587453749,0.00013891303968730496,119.02893004878875,COMPLETE
1246,0.27475330233573914,2023-09-04 21:31:55.004453,2023-09-04 21:31:55.670102,0 days 00:00:00.665649,Tanh,ReLU,Leaky,,82,17,23.0,16.0,,0.003956251494671801,3,175,0.7996087081437733,0.000596076622140419,154.95072371871382,COMPLETE
1247,0.6598907709121704,2023-09-04 21:31:55.670530,2023-09-04 21:31:55.869136,0 days 00:00:00.198606,Tanh,Leaky,Sigmoid,Leaky,74,16,11.0,2.0,4.0,0.009040518807948612,4,165,0.2217298743065483,0.00024633288823483766,284.5307887150691,COMPLETE
1248,0.4371795654296875,2023-09-04 21:31:55.869608,2023-09-04 21:31:56.083373,0 days 00:00:00.213765,ReLU,Sigmoid,ReLU,,78,21,10.0,12.0,,0.02647465645380251,3,204,0.22784656441629664,0.0001738136309056766,491.02659781319755,COMPLETE
1249,0.5366073846817017,2023-09-04 21:31:56.083832,2023-09-04 21:31:56.529195,0 days 00:00:00.445363,Tanh,ReLU,Tanh,,81,18,24.0,1.0,,0.005263587080748268,3,124,0.7644138349983374,0.03575297798991432,178.61964133126395,COMPLETE
1250,0.560693085193634,2023-09-04 21:31:56.529686,2023-09-04 21:31:56.694867,0 days 00:00:00.165181,Tanh,Sigmoid,Sigmoid,,76,19,9.0,3.0,,0.034683056069807164,3,214,0.18594610057925237,0.01566325321481754,182.0123994246773,COMPLETE
1251,0.481010377407074,2023-09-04 21:31:56.695310,2023-09-04 21:31:57.453466,0 days 00:00:00.758156,Tanh,ReLU,Sigmoid,,70,17,23.0,21.0,,0.05356072848023769,3,179,0.7194180462984134,0.02109771980005391,179.40365477531188,COMPLETE
1252,0.3327735960483551,2023-09-04 21:31:57.453907,2023-09-04 21:31:57.945913,0 days 00:00:00.492006,Tanh,Leaky,Leaky,,80,18,10.0,11.0,,0.012092800329824599,3,172,0.7451953164363184,0.00085365400646789,112.5198860168457,COMPLETE
1253,0.39393308758735657,2023-09-04 21:31:57.946366,2023-09-04 21:31:58.290179,0 days 00:00:00.343813,Tanh,ReLU,Sigmoid,,83,16,22.0,10.0,,0.019456353967845546,3,183,0.3171601417391449,0.007722514143374139,389.39232011274856,COMPLETE
1254,0.413940966129303,2023-09-04 21:31:58.290622,2023-09-04 21:31:58.830782,0 days 00:00:00.540160,Tanh,Sigmoid,ReLU,,73,20,9.0,13.0,,0.023580736982128772,3,192,0.3694117095992132,0.00010042318423604967,215.74085274720804,COMPLETE
1255,0.40223416686058044,2023-09-04 21:31:58.831237,2023-09-04 21:31:59.027346,0 days 00:00:00.196109,ReLU,ReLU,Tanh,,77,15,3.0,23.0,,0.029982282668266504,3,221,0.15300911891829347,0.005085282592224755,479.4826548506574,COMPLETE
1256,1.074355125427246,2023-09-04 21:31:59.027810,2023-09-04 21:31:59.733586,0 days 00:00:00.705776,Tanh,Sigmoid,,,79,17,11.0,,,3.1866674518351685e-05,2,200,0.1813717493366467,0.00012473827654129558,107.7590852355957,COMPLETE
1257,0.34283924102783203,2023-09-04 21:31:59.734378,2023-09-04 21:32:00.881067,0 days 00:00:01.146689,Tanh,ReLU,Sigmoid,,87,18,10.0,9.0,,0.03888687341108181,3,202,0.4521638871918993,0.00014982652030044545,169.75565779836555,COMPLETE
