number,value,datetime_start,datetime_complete,duration,params_activation1,params_activation2,params_activation3,params_activation4,params_batch_size,params_fl1,params_fl2,params_fl3,params_fl4,params_learning_rate,params_n_layers,params_num_epochs,params_train_size,params_weight_decay,user_attrs_mre,state
1391,0.3323975205421448,2023-09-04 22:46:54.963318,2023-09-04 22:47:09.406330,0 days 00:00:14.443012,Tanh,ReLU,Sigmoid,,28,22,18.0,6.0,,0.00018742175012089845,3,213,0.7702628423156731,0.011992654268213715,138.73437922661293,COMPLETE
1392,0.37755489349365234,2023-09-04 22:47:09.407226,2023-09-04 22:47:11.011533,0 days 00:00:01.604307,ReLU,ReLU,,,35,19,13.0,,,0.00439622857727153,2,255,0.46676630180587114,0.0555258430248461,122.73048065185547,COMPLETE
1393,0.8716765642166138,2023-09-04 22:47:11.012398,2023-09-04 22:47:16.321307,0 days 00:00:05.308909,Tanh,ReLU,ReLU,,23,20,16.0,6.0,,1.4803940839337306e-05,3,156,0.30830129404029843,0.005209048128713075,176.6207494491186,COMPLETE
1394,0.3062824308872223,2023-09-04 22:47:16.322193,2023-09-04 22:47:18.540641,0 days 00:00:02.218448,ReLU,Tanh,ReLU,,33,20,11.0,8.0,,0.014833654072166729,3,265,0.7995938242742653,7.317900644793229e-05,94.40461314808239,COMPLETE
1395,0.33386707305908203,2023-09-04 22:47:18.541553,2023-09-04 22:47:21.605840,0 days 00:00:03.064287,Leaky,ReLU,Sigmoid,,26,21,17.0,7.0,,0.008241508996827044,3,241,0.5903012154302858,2.4174988034416136e-05,113.44672744750977,COMPLETE
1396,0.3106502294540405,2023-09-04 22:47:21.606736,2023-09-04 22:47:23.712017,0 days 00:00:02.105281,Tanh,ReLU,ReLU,,29,24,12.0,18.0,,0.02491724872577025,3,252,0.5005987185710301,1.2622168437110827e-05,222.91585471413353,COMPLETE
1397,0.40840473771095276,2023-09-04 22:47:23.712971,2023-09-04 22:47:24.068852,0 days 00:00:00.355881,ReLU,ReLU,,,77,22,11.0,,,0.006508185558887384,2,232,0.119289316194932,0.000206563811820072,135.78000371596391,COMPLETE
1398,0.38161328434944153,2023-09-04 22:47:24.069738,2023-09-04 22:47:24.679541,0 days 00:00:00.609803,ReLU,Tanh,ReLU,,24,23,22.0,5.0,,0.010756358865519714,3,198,0.16806364486561187,0.003841233268936604,120.7457705411044,COMPLETE
1399,0.28631624579429626,2023-09-04 22:47:24.680495,2023-09-04 22:47:29.085148,0 days 00:00:04.404653,Tanh,ReLU,ReLU,,36,19,13.0,6.0,,0.01695604053190994,3,245,0.7999594644679913,2.8107298549597933e-05,99.78187765202053,COMPLETE
1400,0.4719042479991913,2023-09-04 22:47:29.086230,2023-09-04 22:47:51.464071,0 days 00:00:22.377841,ReLU,Leaky,Sigmoid,,21,21,19.0,7.0,,3.1738387628646764e-05,3,262,0.738873055939646,1.7697968733302577e-05,119.68881604143681,COMPLETE
1401,0.5234582424163818,2023-09-04 22:47:51.464955,2023-09-04 22:48:04.506280,0 days 00:00:13.041325,Tanh,ReLU,ReLU,,31,23,18.0,4.0,,1.1075472727603964e-05,3,226,0.7085885013791909,3.560682523400244e-05,107.91515110657278,COMPLETE
1402,0.37891900539398193,2023-09-04 22:48:04.507232,2023-09-04 22:48:05.821154,0 days 00:00:01.313922,Leaky,ReLU,ReLU,,27,20,5.0,18.0,,0.0030190676578526255,3,236,0.28589985286592967,0.0018708933813420695,111.6073878218488,COMPLETE
1403,0.35259878635406494,2023-09-04 22:48:05.822072,2023-09-04 22:48:07.856026,0 days 00:00:02.033954,Sigmoid,,,,25,22,,,,0.005573572178316126,1,252,0.23882461499749644,2.1244844004710846e-05,665.3145301455543,COMPLETE
1404,0.3435690104961395,2023-09-04 22:48:07.856890,2023-09-04 22:48:08.521594,0 days 00:00:00.664704,ReLU,ReLU,Sigmoid,,30,22,8.0,17.0,,0.04003244839411376,3,175,0.2445006117024913,1.5864843680856584e-05,117.84677158702503,COMPLETE
1405,0.40444856882095337,2023-09-04 22:48:08.522508,2023-09-04 22:48:09.455813,0 days 00:00:00.933305,Tanh,Tanh,ReLU,,23,21,16.0,5.0,,0.01200837295462247,3,242,0.18870306346414853,0.014761047250412279,251.64964207240513,COMPLETE
1406,0.2972967028617859,2023-09-04 22:48:09.456717,2023-09-04 22:48:12.862302,0 days 00:00:03.405585,ReLU,ReLU,ReLU,,34,20,20.0,3.0,,0.007255122408538254,3,264,0.7660241784297862,6.477005859617062e-05,104.44096665815873,COMPLETE
1407,0.4200184941291809,2023-09-04 22:48:12.863288,2023-09-04 22:48:14.536896,0 days 00:00:01.673608,Tanh,ReLU,Tanh,,28,18,24.0,21.0,,0.0047027637106274185,3,147,0.6716794318687019,0.042910214977631866,105.88599706579137,COMPLETE
1408,0.34268099069595337,2023-09-04 22:48:14.537367,2023-09-04 22:48:15.276748,0 days 00:00:00.739381,ReLU,Sigmoid,Sigmoid,,37,23,7.0,17.0,,0.0036238997981620324,3,220,0.47549749456092844,0.0003976079891642491,110.39830017089844,COMPLETE
1409,0.3283936083316803,2023-09-04 22:48:15.277319,2023-09-04 22:48:15.974094,0 days 00:00:00.696775,Leaky,,,,32,21,,,,0.009184872443646958,1,256,0.7424036518250937,0.0005489969468283826,102.43934585571289,COMPLETE
1410,0.43062999844551086,2023-09-04 22:48:15.974590,2023-09-04 22:48:16.478301,0 days 00:00:00.503711,Tanh,ReLU,,,21,22,17.0,,,0.013226170376348592,2,247,0.7683146963990282,0.032014198201306916,138.0490311516656,COMPLETE
1411,0.3174033463001251,2023-09-04 22:48:16.478939,2023-09-04 22:48:17.757697,0 days 00:00:01.278758,ReLU,ReLU,ReLU,,25,23,13.0,7.0,,0.005631860890279272,3,193,0.6978024270211077,0.0014184440293223903,110.86790945015701,COMPLETE
1412,0.49695196747779846,2023-09-04 22:48:17.758218,2023-09-04 22:48:19.599519,0 days 00:00:01.841301,Tanh,Tanh,Tanh,,39,21,12.0,6.0,,2.1418323982826373e-05,3,232,0.33841983711163864,8.547310327242311e-05,225.13931359915898,COMPLETE
1413,0.3568060100078583,2023-09-04 22:48:19.599995,2023-09-04 22:48:20.161251,0 days 00:00:00.561256,ReLU,ReLU,ReLU,,73,24,18.0,17.0,,0.0023167765754022033,3,162,0.728153552296122,0.038984520977049804,110.45547892252604,COMPLETE
1414,0.34367862343788147,2023-09-04 22:48:20.161759,2023-09-04 22:48:20.510043,0 days 00:00:00.348284,Tanh,ReLU,Tanh,,29,20,11.0,7.0,,0.028088541855653217,3,238,0.3647415098554729,0.00015301605274871608,96.80451865818189,COMPLETE
1415,0.3411307632923126,2023-09-04 22:48:20.510508,2023-09-04 22:48:21.803594,0 days 00:00:01.293086,Leaky,Leaky,ReLU,,22,19,16.0,18.0,,0.00417726303941806,3,253,0.7700530119371001,2.7785488654738444e-05,101.0932187167081,COMPLETE
1416,0.3587089478969574,2023-09-04 22:48:21.804080,2023-09-04 22:48:22.298913,0 days 00:00:00.494833,ReLU,ReLU,,,27,22,19.0,,,0.017097686864419225,2,265,0.4015852326708569,1.4307222195757238e-05,104.1833532333374,COMPLETE
1417,0.31621024012565613,2023-09-04 22:48:22.299402,2023-09-04 22:48:23.180271,0 days 00:00:00.880869,Sigmoid,ReLU,Sigmoid,,33,23,16.0,8.0,,0.008240260682924024,3,246,0.5511272733104544,0.00025770795388202754,478.2324959359518,COMPLETE
1418,0.37191322445869446,2023-09-04 22:48:23.180758,2023-09-04 22:48:28.932902,0 days 00:00:05.752144,Tanh,Tanh,Tanh,Leaky,24,19,23.0,6.0,4.0,6.210081412046769e-05,4,229,0.6457226179000994,4.047368661769787e-05,109.3155534569353,COMPLETE
1419,0.37026041746139526,2023-09-04 22:48:28.933428,2023-09-04 22:48:29.597007,0 days 00:00:00.663579,ReLU,ReLU,ReLU,,30,21,13.0,17.0,,0.006695917312943303,3,212,0.799621587563834,0.0007809669574483263,110.41214165320763,COMPLETE
1420,0.3319920599460602,2023-09-04 22:48:29.597628,2023-09-04 22:48:30.243151,0 days 00:00:00.645523,Tanh,ReLU,Tanh,Leaky,28,22,8.0,5.0,6.0,0.01062014889487971,4,256,0.431656186504615,2.1336148280477087e-05,169.92658143884995,COMPLETE
1421,0.2769513428211212,2023-09-04 22:48:30.243780,2023-09-04 22:48:32.204913,0 days 00:00:01.961133,ReLU,ReLU,ReLU,,26,24,6.0,14.0,,0.0028234885996012878,3,242,0.7440639281987405,4.9987483649740626e-05,84.18687086105346,COMPLETE
1422,0.39044633507728577,2023-09-04 22:48:32.205496,2023-09-04 22:48:32.415367,0 days 00:00:00.209871,Leaky,ReLU,Sigmoid,ReLU,35,20,17.0,6.0,23.0,0.021512853295104887,4,180,0.14337738599423266,1.1577244383407399e-05,113.87708168029785,COMPLETE
1423,0.5728753209114075,2023-09-04 22:48:32.415855,2023-09-04 22:48:34.292289,0 days 00:00:01.876434,Tanh,Tanh,Tanh,,22,21,12.0,4.0,,2.246984004232279e-05,3,225,0.19446567850317176,0.0034182931810375857,120.34989630805121,COMPLETE
1424,0.3953240215778351,2023-09-04 22:48:34.292752,2023-09-04 22:48:34.789650,0 days 00:00:00.496898,ReLU,ReLU,ReLU,Leaky,32,20,11.0,15.0,5.0,0.005004565673208374,4,266,0.2971415344507867,0.02186334371336375,118.1615364074707,COMPLETE
1425,0.40704992413520813,2023-09-04 22:48:34.790212,2023-09-04 22:48:35.000888,0 days 00:00:00.210676,Tanh,ReLU,ReLU,ReLU,63,22,16.0,12.0,18.0,0.04626492514641684,4,237,0.20770791671082395,2.4040772211539125e-05,115.78203513405539,COMPLETE
1426,0.27054059505462646,2023-09-04 22:48:35.001437,2023-09-04 22:48:36.172621,0 days 00:00:01.171184,ReLU,ReLU,Tanh,,24,19,18.0,7.0,,0.012539199253389118,3,249,0.7721505267252812,1.797675827065993e-05,80.70140607966933,COMPLETE
1427,0.3030238747596741,2023-09-04 22:48:36.173172,2023-09-04 22:48:37.135529,0 days 00:00:00.962357,ReLU,Leaky,ReLU,,26,23,17.0,8.0,,0.010011991509703,3,169,0.706630842861763,3.1460242852013185e-05,98.20387170253656,COMPLETE
1428,0.517529308795929,2023-09-04 22:48:37.136055,2023-09-04 22:48:37.917980,0 days 00:00:00.781925,Tanh,ReLU,Tanh,Leaky,21,18,13.0,18.0,6.0,0.08661840085573111,4,258,0.7346296728115673,0.0003417470614544461,135.09227316720145,COMPLETE
1429,0.3406693935394287,2023-09-04 22:48:37.918465,2023-09-04 22:48:41.315311,0 days 00:00:03.396846,Leaky,Tanh,Sigmoid,ReLU,37,21,15.0,5.0,22.0,0.0002750541575010092,4,247,0.7999438283638146,0.00016079317885991988,102.07314559936523,COMPLETE
1430,0.42599040269851685,2023-09-04 22:48:41.315998,2023-09-04 22:48:42.990465,0 days 00:00:01.674467,Sigmoid,ReLU,ReLU,,41,22,12.0,13.0,,0.0036153411493001037,3,220,0.7690070020151468,0.008186389203552526,103.6838582645763,COMPLETE
1431,0.35524097084999084,2023-09-04 22:48:42.991006,2023-09-04 22:48:43.729033,0 days 00:00:00.738027,ReLU,Sigmoid,Tanh,Leaky,30,23,11.0,17.0,7.0,0.008062805067922141,4,206,0.5730321807837718,0.00021851868903009753,108.63138834635417,COMPLETE
1432,0.33927828073501587,2023-09-04 22:48:43.729522,2023-09-04 22:48:44.454952,0 days 00:00:00.725430,Tanh,,,,28,20,,,,0.00618642470271117,1,235,0.6053047865613013,0.00010618444368933912,115.11232921055385,COMPLETE
1433,0.3695501387119293,2023-09-04 22:48:44.455444,2023-09-04 22:48:48.368733,0 days 00:00:03.913289,ReLU,ReLU,,,32,17,16.0,,,5.5902073840115284e-05,2,264,0.6791368710633875,0.0023213327758951595,120.2204809477835,COMPLETE
1434,0.32991573214530945,2023-09-04 22:48:48.369210,2023-09-04 22:48:48.933513,0 days 00:00:00.564303,Tanh,ReLU,ReLU,,24,21,18.0,15.0,,0.014794869015297156,3,255,0.5057757658073934,1.3554483126605517e-05,100.43181214509187,COMPLETE
1435,0.3132774233818054,2023-09-04 22:48:48.934016,2023-09-04 22:48:49.611154,0 days 00:00:00.677138,ReLU,ReLU,Tanh,ReLU,34,22,19.0,17.0,24.0,0.03417519891975563,4,244,0.7397715483374582,3.8922061145543365e-05,109.83628143310547,COMPLETE
1436,0.3462786078453064,2023-09-04 22:48:49.611673,2023-09-04 22:48:50.721773,0 days 00:00:01.110100,Tanh,Tanh,Sigmoid,,21,24,21.0,6.0,,0.004455885008124091,3,231,0.7997442167042723,0.0004921431730834314,109.13978530421402,COMPLETE
1437,0.3434586226940155,2023-09-04 22:48:50.722336,2023-09-04 22:48:57.733612,0 days 00:00:07.011276,Leaky,ReLU,ReLU,Leaky,26,23,15.0,7.0,7.0,0.00010175125446227557,4,266,0.7116475802712243,0.0009474791475995492,107.41717862007313,COMPLETE
1438,0.36285993456840515,2023-09-04 22:48:57.734089,2023-09-04 22:48:58.708979,0 days 00:00:00.974890,ReLU,ReLU,Tanh,,30,19,13.0,17.0,,0.0017699519482276863,3,252,0.7522404563898847,2.476448945452899e-05,102.57942799159459,COMPLETE
1439,0.3208482265472412,2023-09-04 22:48:58.709531,2023-09-04 22:49:00.477816,0 days 00:00:01.768285,Tanh,ReLU,ReLU,ReLU,23,20,17.0,21.0,16.0,0.019395687050269714,4,240,0.7745696434253851,0.00012768158531336214,101.63738663991292,COMPLETE
1440,0.6286193132400513,2023-09-04 22:49:00.478284,2023-09-04 22:49:04.277879,0 days 00:00:03.799595,ReLU,Tanh,Tanh,,10,21,15.0,18.0,,1.2300010624867057e-05,3,155,0.2475040438398601,6.101473128348683e-05,126.87723905501826,COMPLETE
1441,0.37846580147743225,2023-09-04 22:49:04.278357,2023-09-04 22:49:07.738547,0 days 00:00:03.460190,Tanh,ReLU,ReLU,Leaky,28,22,11.0,16.0,8.0,0.0001254311704501749,4,140,0.5560540349587634,1.9000107043082234e-05,112.81630663190569,COMPLETE
1442,0.36614567041397095,2023-09-04 22:49:07.739023,2023-09-04 22:49:08.111117,0 days 00:00:00.372094,ReLU,Leaky,Sigmoid,,38,22,16.0,5.0,,0.007010567762108931,3,184,0.25913960020872673,2.9082848973574076e-05,516.1687719171697,COMPLETE
1443,0.9877501130104065,2023-09-04 22:49:08.111599,2023-09-04 22:49:08.340374,0 days 00:00:00.228775,Leaky,ReLU,Tanh,ReLU,35,23,12.0,17.0,14.0,0.009391470990831804,4,227,0.3275533227893909,0.07445554215842726,100.19238905473189,COMPLETE
1444,0.3946792185306549,2023-09-04 22:49:08.340871,2023-09-04 22:49:08.755038,0 days 00:00:00.414167,Sigmoid,ReLU,ReLU,,25,20,13.0,15.0,,0.05390357304804156,3,258,0.37027596995226375,0.00019182885906568738,107.90024302555965,COMPLETE
1445,0.32574912905693054,2023-09-04 22:49:08.755517,2023-09-04 22:49:09.896222,0 days 00:00:01.140705,Tanh,ReLU,Tanh,Leaky,31,19,18.0,6.0,21.0,0.0031275319313159647,4,247,0.6953708875141651,0.014468281070251542,98.2638403444874,COMPLETE
1446,0.3320266604423523,2023-09-04 22:49:09.896690,2023-09-04 22:49:21.092792,0 days 00:00:11.196102,ReLU,Tanh,ReLU,,20,20,15.0,7.0,,9.069696709528034e-05,3,240,0.7288775128501837,8.431550259973994e-05,104.94755175908406,COMPLETE
1447,0.44952258467674255,2023-09-04 22:49:21.093262,2023-09-04 22:49:21.490205,0 days 00:00:00.396943,Tanh,ReLU,Sigmoid,Leaky,27,7,19.0,8.0,3.0,0.005328861578605579,4,219,0.12944753074540122,1.575205049633407e-05,169.5217546735491,COMPLETE
1448,0.4310017228126526,2023-09-04 22:49:21.490685,2023-09-04 22:49:21.747359,0 days 00:00:00.256674,ReLU,ReLU,Tanh,ReLU,22,23,14.0,6.0,15.0,0.01218463652551205,4,267,0.18309124003870705,1.1627403367049498e-05,131.4061211978688,COMPLETE
1449,0.27820003032684326,2023-09-04 22:49:21.747836,2023-09-04 22:49:22.248177,0 days 00:00:00.500341,Tanh,,,,33,21,,,,0.024199874107947206,1,250,0.7710388956865846,0.0006069268042880507,114.45942351397346,COMPLETE
1450,0.31315895915031433,2023-09-04 22:49:22.248625,2023-09-04 22:49:23.085418,0 days 00:00:00.836793,ReLU,ReLU,,,75,22,8.0,,,0.004112029437881855,2,234,0.6250030950043634,3.6721195289096055e-05,226.60712550236627,COMPLETE
1451,0.3434346914291382,2023-09-04 22:49:23.085875,2023-09-04 22:49:23.793414,0 days 00:00:00.707539,Leaky,ReLU,ReLU,,29,24,17.0,24.0,,0.016085996839127047,3,76,0.6611401014727329,4.541044058785801e-05,104.08180927094959,COMPLETE
1452,0.29613032937049866,2023-09-04 22:49:23.794358,2023-09-04 22:49:24.998657,0 days 00:00:01.204299,Tanh,Tanh,ReLU,Leaky,24,21,16.0,15.0,22.0,0.008476082214937381,4,261,0.3508450938492774,0.0012824696616075093,109.12715327486079,COMPLETE
1453,0.3033587634563446,2023-09-04 22:49:24.999596,2023-09-04 22:49:26.637778,0 days 00:00:01.638182,ReLU,ReLU,Tanh,,36,22,11.0,16.0,,0.006066536493832829,3,103,0.5115616017256055,0.0003105466194151474,98.88629934522841,COMPLETE
1454,0.294132798910141,2023-09-04 22:49:26.638275,2023-09-04 22:49:27.463557,0 days 00:00:00.825282,Tanh,ReLU,Sigmoid,ReLU,42,19,20.0,18.0,7.0,0.0026359970100275796,4,240,0.7467782820671027,2.34540161207447e-05,94.80637035369872,COMPLETE
1455,0.4000910222530365,2023-09-04 22:49:27.464040,2023-09-04 22:49:27.768517,0 days 00:00:00.304477,ReLU,Leaky,ReLU,,26,20,12.0,14.0,,0.0022809116408532668,3,168,0.20237907612428072,1.8864038980753596e-05,228.0788522535755,COMPLETE
1456,0.30298253893852234,2023-09-04 22:49:27.769062,2023-09-04 22:49:28.854081,0 days 00:00:01.085019,Tanh,ReLU,Tanh,Leaky,31,23,13.0,16.0,6.0,0.010901898872898465,4,254,0.7705174945101635,0.0006942701885666407,96.8072881931212,COMPLETE
1457,0.3648143410682678,2023-09-04 22:49:28.854560,2023-09-04 22:49:30.414515,0 days 00:00:01.559955,Sigmoid,Sigmoid,ReLU,,23,21,23.0,17.0,,0.007632617649617538,3,225,0.7172127776165147,3.141359616509566e-05,250.64590329029522,COMPLETE
1458,0.5419712066650391,2023-09-04 22:49:30.415005,2023-09-04 22:49:30.759348,0 days 00:00:00.344343,ReLU,ReLU,Tanh,Tanh,39,22,14.0,22.0,4.0,0.07707135219516792,4,248,0.7997350222302396,0.00013855414411318397,117.21118302778764,COMPLETE
1459,0.2743671238422394,2023-09-04 22:49:30.759821,2023-09-04 22:49:31.775998,0 days 00:00:01.016177,Leaky,Tanh,ReLU,,20,20,17.0,8.0,,0.029816197066089616,3,269,0.7433547372431297,5.559589296211629e-05,100.55412292480469,COMPLETE
1460,0.3471396565437317,2023-09-04 22:49:31.776472,2023-09-04 22:49:32.775877,0 days 00:00:00.999405,ReLU,ReLU,Sigmoid,ReLU,28,21,5.0,4.0,8.0,0.005165396584492151,4,213,0.5297863719775907,1.3617604017175342e-05,103.16679000854492,COMPLETE
1461,0.37228941917419434,2023-09-04 22:49:32.776377,2023-09-04 22:49:33.068979,0 days 00:00:00.292602,Tanh,ReLU,Tanh,,59,24,18.0,7.0,,0.012935895424692763,3,235,0.31621072815172085,0.0008661713357298559,334.0518767412971,COMPLETE
1462,0.34537866711616516,2023-09-04 22:49:33.069459,2023-09-04 22:49:33.721420,0 days 00:00:00.651961,ReLU,ReLU,ReLU,Leaky,34,18,15.0,5.0,23.0,0.00959735237658118,4,259,0.45702205965255194,0.00613671992404363,140.51618082930403,COMPLETE
1463,0.40276816487312317,2023-09-04 22:49:33.721890,2023-09-04 22:49:34.010858,0 days 00:00:00.288968,Tanh,ReLU,Tanh,,32,23,16.0,6.0,,0.003592701649407225,3,244,0.1703830348429038,2.547484576583343e-05,1241.2017715041702,COMPLETE
1464,0.31805211305618286,2023-09-04 22:49:34.011346,2023-09-04 22:49:34.491106,0 days 00:00:00.479760,ReLU,Tanh,ReLU,ReLU,25,19,7.0,16.0,7.0,0.006549900274704398,4,196,0.234274175329994,0.0017182333393248777,220.42363166809082,COMPLETE
1465,0.30522602796554565,2023-09-04 22:49:34.491587,2023-09-04 22:49:35.132788,0 days 00:00:00.641201,Leaky,ReLU,Tanh,,29,22,15.0,17.0,,0.01785062817831204,3,230,0.6865501187484166,0.00010217525429917592,92.86112213134766,COMPLETE
1466,0.41590479016304016,2023-09-04 22:49:35.133256,2023-09-04 22:49:35.486837,0 days 00:00:00.353581,Tanh,ReLU,Sigmoid,Tanh,49,20,12.0,18.0,6.0,0.03829495719997014,4,254,0.46994231215947596,0.01608103584785232,126.30009460449219,COMPLETE
1467,0.3302658796310425,2023-09-04 22:49:35.487343,2023-09-04 22:49:36.707093,0 days 00:00:01.219750,ReLU,ReLU,ReLU,Leaky,21,23,13.0,1.0,17.0,0.004393942715217595,4,243,0.7729233240963145,0.00024966279736567327,110.39424963558422,COMPLETE
1468,0.29624930024147034,2023-09-04 22:49:36.707624,2023-09-04 22:49:37.428003,0 days 00:00:00.720379,Tanh,Leaky,Tanh,,27,21,14.0,7.0,,0.014650091400286842,3,266,0.7301859913588965,0.0010214604788427192,92.59977064461543,COMPLETE
1469,0.3083550035953522,2023-09-04 22:49:37.428516,2023-09-04 22:49:38.549781,0 days 00:00:01.121265,ReLU,ReLU,ReLU,ReLU,23,22,22.0,15.0,24.0,0.007518646750999862,4,205,0.7716585745213753,0.0021976149731015786,100.41580003307712,COMPLETE
1470,0.3021823465824127,2023-09-04 22:49:38.550275,2023-09-04 22:49:40.423130,0 days 00:00:01.872855,Tanh,Tanh,Tanh,,36,20,19.0,16.0,,0.002069899529949383,3,160,0.7082215742508929,1.661954348022723e-05,104.95610347362833,COMPLETE
1471,0.4621160924434662,2023-09-04 22:49:40.423629,2023-09-04 22:49:43.463583,0 days 00:00:03.039954,Sigmoid,ReLU,,,26,22,14.0,,,3.207831442542442e-05,2,249,0.45298540498925166,0.0029521116474587185,106.97557153663482,COMPLETE
1472,0.453910231590271,2023-09-04 22:49:43.464059,2023-09-04 22:49:44.643681,0 days 00:00:01.179622,ReLU,ReLU,ReLU,Leaky,30,21,18.0,6.0,5.0,0.00018635181067714273,4,236,0.1256700094882371,0.0004123997103964284,125.2333172620353,COMPLETE
1473,0.39162880182266235,2023-09-04 22:49:44.644244,2023-09-04 22:49:45.202484,0 days 00:00:00.558240,Leaky,ReLU,Sigmoid,,34,23,8.0,17.0,,0.020910678693081615,3,432,0.7510687675447542,0.00947981441749795,131.27773507436117,COMPLETE
1474,0.33132779598236084,2023-09-04 22:49:45.202968,2023-09-04 22:49:46.382064,0 days 00:00:01.179096,Tanh,,,,45,19,,,,0.0031028511580328297,1,222,0.6623955384044902,7.09032400938784e-05,123.61782523124448,COMPLETE
1475,0.3313117027282715,2023-09-04 22:49:46.382518,2023-09-04 22:49:46.978185,0 days 00:00:00.595667,ReLU,ReLU,Tanh,Tanh,32,20,6.0,5.0,21.0,0.0054939641399462625,4,258,0.7742363077680733,2.031096316081155e-05,98.69922964913505,COMPLETE
1476,0.31607362627983093,2023-09-04 22:49:46.978652,2023-09-04 22:49:47.680363,0 days 00:00:00.701711,Tanh,Tanh,ReLU,,23,18,16.0,15.0,,0.05945236592030358,3,149,0.7182724266737301,3.0718287582252255e-05,107.31267791748047,COMPLETE
1477,0.2766360342502594,2023-09-04 22:49:47.680855,2023-09-04 22:49:49.407371,0 days 00:00:01.726516,ReLU,ReLU,Tanh,Leaky,20,21,11.0,16.0,8.0,0.010588071698473494,4,269,0.7978496845353404,1.0115925857605134e-05,105.14935369076936,COMPLETE
1478,0.6110377311706543,2023-09-04 22:49:49.407878,2023-09-04 22:49:51.146449,0 days 00:00:01.738571,Tanh,ReLU,ReLU,,29,24,17.0,14.0,,1.8214151886067687e-05,3,240,0.21738351107097803,0.00016829761580720078,102.87264394760132,COMPLETE
1479,0.41574686765670776,2023-09-04 22:49:51.146999,2023-09-04 22:50:03.921144,0 days 00:00:12.774145,Leaky,Sigmoid,Sigmoid,ReLU,25,22,15.0,21.0,20.0,1.573561797153029e-05,4,459,0.7513077042137739,3.995150743569985e-05,123.59986925644553,COMPLETE
1480,0.31121399998664856,2023-09-04 22:50:03.921642,2023-09-04 22:50:04.637108,0 days 00:00:00.715466,ReLU,ReLU,ReLU,,27,23,13.0,6.0,,0.0070205026434915045,3,230,0.5660960716725925,2.3495095039636928e-05,113.03778076171875,COMPLETE
1481,0.35108622908592224,2023-09-04 22:50:04.637634,2023-09-04 22:50:06.206647,0 days 00:00:01.569013,Tanh,Tanh,Tanh,Leaky,22,22,7.0,16.0,14.0,0.00870961169621993,4,247,0.7998746927611081,4.845327662958459e-05,140.8144044664171,COMPLETE
1482,0.3749484121799469,2023-09-04 22:50:06.207135,2023-09-04 22:50:06.880366,0 days 00:00:00.673231,ReLU,ReLU,ReLU,,31,20,16.0,17.0,,0.004121598440317437,3,256,0.6111597700061024,0.02105965762271693,114.39234860738118,COMPLETE
1483,0.3955771327018738,2023-09-04 22:50:06.880851,2023-09-04 22:50:07.943127,0 days 00:00:01.062276,Sigmoid,Leaky,Tanh,ReLU,37,21,12.0,8.0,19.0,0.013480114449117661,4,174,0.15324602891912054,1.3765906546319869e-05,217.72648896111383,COMPLETE
