number,value,datetime_start,datetime_complete,duration,params_activation1,params_activation2,params_activation3,params_activation4,params_batch_size,params_fl1,params_fl2,params_fl3,params_fl4,params_learning_rate,params_n_layers,params_num_epochs,params_train_size,params_weight_decay,user_attrs_mre,state
657,0.4060601592063904,2023-09-04 21:36:14.141843,2023-09-04 21:36:16.543424,0 days 00:00:02.401581,Tanh,Leaky,Leaky,,14,12,17.0,4.0,,0.06536782301772405,3,261,0.7360989076076646,0.0024921958925883812,103.13200498882092,COMPLETE
658,0.3127470314502716,2023-09-04 21:36:16.544132,2023-09-04 21:36:18.879704,0 days 00:00:02.335572,Tanh,Sigmoid,Leaky,,22,24,16.0,15.0,,0.018317064184203494,3,338,0.6694612099022275,3.3920066562939324e-05,98.74841028849283,COMPLETE
659,0.3074563145637512,2023-09-04 21:36:18.880364,2023-09-04 21:36:20.489430,0 days 00:00:01.609066,Tanh,Leaky,,,64,9,15.0,,,0.03068131447367261,2,357,0.7662637685255409,7.590606978967927e-05,97.92635635375977,COMPLETE
660,0.35626232624053955,2023-09-04 21:36:20.490071,2023-09-04 21:36:21.336162,0 days 00:00:00.846091,ReLU,Tanh,Leaky,,32,23,14.0,8.0,,0.002882059204998944,3,306,0.24610346210391792,0.0002602280185450948,3496.7618119981553,COMPLETE
661,0.41680750250816345,2023-09-04 21:36:21.336922,2023-09-04 21:36:47.831510,0 days 00:00:26.494588,Tanh,Leaky,Leaky,,18,11,16.0,13.0,,3.3162407396594296e-05,3,326,0.6268797183984609,0.00774356744664713,237.44964917890866,COMPLETE
662,0.35901764035224915,2023-09-04 21:36:47.832178,2023-09-04 21:36:49.340444,0 days 00:00:01.508266,Leaky,Sigmoid,,,58,22,17.0,,,0.010466955860886222,2,280,0.7130006956229324,0.003573138366084123,109.36139175739694,COMPLETE
663,0.39055734872817993,2023-09-04 21:36:49.341070,2023-09-04 21:37:09.860212,0 days 00:00:20.519142,Tanh,,,,20,10,,,,1.9189596187057024e-05,1,350,0.798753750457024,0.005867086392297155,104.50382758004325,COMPLETE
664,0.32287052273750305,2023-09-04 21:37:09.860896,2023-09-04 21:37:14.174718,0 days 00:00:04.313822,Tanh,Leaky,Leaky,,15,12,17.0,24.0,,0.013074939322790129,3,342,0.743383452524878,0.00018656625575467868,120.59909201957085,COMPLETE
665,0.3584255278110504,2023-09-04 21:37:14.175382,2023-09-04 21:37:18.711243,0 days 00:00:04.535861,Tanh,Leaky,Leaky,,29,11,15.0,7.0,,0.0017094435386334368,3,359,0.6946224250453639,4.8362032041007856e-05,103.80533146213841,COMPLETE
666,1.0734392404556274,2023-09-04 21:37:18.711898,2023-09-04 21:37:19.927177,0 days 00:00:01.215279,ReLU,Leaky,Sigmoid,,22,11,16.0,9.0,,0.0007725366663132142,3,444,0.7711509046154016,0.04271890759128458,101.07569415752704,COMPLETE
667,0.8921570181846619,2023-09-04 21:37:19.927844,2023-09-04 21:37:25.628402,0 days 00:00:05.700558,Tanh,Sigmoid,,,16,12,20.0,,,2.0205992836498155e-05,2,335,0.13375942749690292,0.0017980571140343072,107.05362931436566,COMPLETE
668,0.505745530128479,2023-09-04 21:37:25.629056,2023-09-04 21:37:30.608321,0 days 00:00:04.979265,Tanh,Leaky,Leaky,,50,5,14.0,14.0,,5.1807352153203856e-05,3,351,0.23307144711025962,2.342670212800341e-05,117.2712314746998,COMPLETE
669,0.34594839811325073,2023-09-04 21:37:30.608975,2023-09-04 21:37:34.005963,0 days 00:00:03.396988,Tanh,Leaky,,,34,10,17.0,,,0.0012726232808746032,2,362,0.6063212229547853,0.0003764595863866247,108.27774810791016,COMPLETE
670,0.384819895029068,2023-09-04 21:37:34.006612,2023-09-04 21:37:36.745818,0 days 00:00:02.739206,ReLU,Leaky,Leaky,,12,11,15.0,10.0,,0.017194530621798272,3,269,0.6661006847223105,0.00015430107943949193,105.50436292375836,COMPLETE
671,0.25747039914131165,2023-09-04 21:37:36.746470,2023-09-04 21:37:46.039099,0 days 00:00:09.292629,Tanh,Sigmoid,Leaky,,20,12,18.0,22.0,,0.004567659610973052,3,420,0.7994596019790038,2.7102245896349526e-05,96.83931590601341,COMPLETE
672,0.3610323369503021,2023-09-04 21:37:46.039773,2023-09-04 21:37:47.331236,0 days 00:00:01.291463,Tanh,Sigmoid,Leaky,,75,12,18.0,22.0,,0.0038872465165746967,3,428,0.1943610990754473,2.029477159160242e-05,344.14923604329425,COMPLETE
673,0.2988415062427521,2023-09-04 21:37:47.331905,2023-09-04 21:37:53.232012,0 days 00:00:05.900107,Tanh,Sigmoid,Leaky,,21,12,18.0,23.0,,0.007107425794591821,3,422,0.7705617104938965,2.7393992052386833e-05,114.91691901467063,COMPLETE
674,0.30230823159217834,2023-09-04 21:37:53.232685,2023-09-04 21:37:59.559437,0 days 00:00:06.326752,Tanh,Sigmoid,Leaky,,23,12,19.0,22.0,,0.005189927487312326,3,433,0.7393102594607567,3.629642791368254e-05,91.20638084411621,COMPLETE
675,0.3365677297115326,2023-09-04 21:37:59.560112,2023-09-04 21:38:03.158435,0 days 00:00:03.598323,Tanh,Sigmoid,Leaky,,19,12,19.0,24.0,,0.006831985451180433,3,418,0.799940122931015,0.00127468170224747,116.22306976318359,COMPLETE
676,0.36876562237739563,2023-09-04 21:38:03.159109,2023-09-04 21:38:04.295093,0 days 00:00:01.135984,Sigmoid,Sigmoid,Leaky,,21,11,18.0,23.0,,0.00890074065212096,3,409,0.11933220690760339,3.226665626606866e-05,350.9463813892309,COMPLETE
677,1.0004422664642334,2023-09-04 21:38:04.295757,2023-09-04 21:38:04.849578,0 days 00:00:00.553821,ReLU,Sigmoid,Leaky,,23,12,18.0,21.0,,0.01025621455778514,3,437,0.33298087795594894,0.06855984519582364,100.29513422648112,COMPLETE
678,0.2991037964820862,2023-09-04 21:38:04.850233,2023-09-04 21:38:06.526440,0 days 00:00:01.676207,Tanh,Sigmoid,Leaky,,89,11,18.0,23.0,,0.005977731843462722,3,422,0.7699363601167573,0.00092084651532021,119.93148193359374,COMPLETE
679,0.3511578142642975,2023-09-04 21:38:06.527087,2023-09-04 21:38:10.111614,0 days 00:00:03.584527,Tanh,Sigmoid,Tanh,,20,11,19.0,23.0,,0.0026668362557764483,3,405,0.7307776413299266,2.8385910194262618e-05,109.10803985595703,COMPLETE
680,0.3158321678638458,2023-09-04 21:38:10.112293,2023-09-04 21:38:14.913188,0 days 00:00:04.800895,Tanh,Sigmoid,Leaky,,24,12,15.0,24.0,,0.0032397457761898494,3,443,0.7991324882195551,2.2651740872072e-05,87.70649771854795,COMPLETE
681,0.3325400948524475,2023-09-04 21:38:14.913875,2023-09-04 21:38:16.551236,0 days 00:00:01.637361,ReLU,Sigmoid,Leaky,,27,10,13.0,24.0,,0.012187036282821282,3,413,0.7512952999479041,0.005083468489817993,108.74831494418058,COMPLETE
682,0.4113142788410187,2023-09-04 21:38:16.551905,2023-09-04 21:38:18.350740,0 days 00:00:01.798835,Tanh,Sigmoid,Leaky,,19,10,20.0,22.0,,0.004386147575646166,3,427,0.2931469074895942,1.7311645357891744e-05,127.95625813802083,COMPLETE
683,0.3658241033554077,2023-09-04 21:38:18.351406,2023-09-04 21:38:50.568885,0 days 00:00:32.217479,Tanh,Sigmoid,Sigmoid,,22,18,14.0,24.0,,0.00012862955452792594,3,413,0.7174823097679077,6.148138085420209e-05,121.35643238132283,COMPLETE
684,0.35682061314582825,2023-09-04 21:38:50.569541,2023-09-04 21:38:54.324542,0 days 00:00:03.755001,Tanh,Sigmoid,Leaky,,24,11,6.0,22.0,,0.01448929306311329,3,397,0.7691564349216891,0.0021018413876700806,108.53949055773147,COMPLETE
685,0.3159075081348419,2023-09-04 21:38:54.325198,2023-09-04 21:38:57.969669,0 days 00:00:03.644471,ReLU,ReLU,Leaky,,31,12,16.0,23.0,,0.009308301136750597,3,364,0.7996538373614931,0.0001883737819049295,107.07211614538122,COMPLETE
686,0.39967408776283264,2023-09-04 21:38:57.970332,2023-09-04 21:39:01.984590,0 days 00:00:04.014258,Tanh,Sigmoid,Leaky,,28,12,18.0,21.0,,0.003509530105058785,3,352,0.7448721823371384,2.5741221405800025e-05,113.1465552378509,COMPLETE
687,0.37273046374320984,2023-09-04 21:39:01.985256,2023-09-04 21:39:06.396448,0 days 00:00:04.411192,Tanh,Sigmoid,Leaky,,26,11,15.0,23.0,,0.0021463810061576084,3,404,0.7018080417242119,8.223002580603437e-05,114.59619833139273,COMPLETE
688,0.3453125059604645,2023-09-04 21:39:06.397128,2023-09-04 21:39:08.312040,0 days 00:00:01.914912,Leaky,Tanh,Leaky,,65,24,16.0,24.0,,0.007856573283203088,3,346,0.7455034486403991,0.0001375698247974781,103.31081404775944,COMPLETE
689,0.3167809545993805,2023-09-04 21:39:08.312800,2023-09-04 21:39:12.471721,0 days 00:00:04.158921,Tanh,Sigmoid,Leaky,,21,7,17.0,2.0,,0.01158448129845253,3,371,0.799827491112559,0.00022010734918061502,123.25804595947265,COMPLETE
690,0.4711688160896301,2023-09-04 21:39:12.472391,2023-09-04 21:39:13.364772,0 days 00:00:00.892381,Tanh,Leaky,Leaky,,19,13,19.0,13.0,,0.02146478588738571,3,422,0.3484913260185397,0.05171985478222276,182.4291498093378,COMPLETE
691,0.4129277169704437,2023-09-04 21:39:13.365411,2023-09-04 21:39:14.655229,0 days 00:00:01.289818,ReLU,Sigmoid,Tanh,,24,11,4.0,16.0,,0.016486496023866752,3,329,0.29246154979449174,0.03234132612468042,125.41718215942383,COMPLETE
692,0.301356703042984,2023-09-04 21:39:14.655906,2023-09-04 21:39:16.530604,0 days 00:00:01.874698,Tanh,Leaky,Leaky,,93,9,18.0,14.0,,0.004513284726659943,3,358,0.7210900222386636,0.002943313281706443,105.20444757166044,COMPLETE
693,0.37686339020729065,2023-09-04 21:39:16.531272,2023-09-04 21:39:16.848092,0 days 00:00:00.316820,Tanh,Leaky,Leaky,,29,10,14.0,15.0,,0.013715884113868666,3,389,0.14693346765288226,3.5955832132126663e-05,348.0163170309628,COMPLETE
694,0.4491879343986511,2023-09-04 21:39:16.848476,2023-09-04 21:39:20.598671,0 days 00:00:03.750195,Tanh,Leaky,Leaky,,18,12,15.0,23.0,,2.869211139496387e-05,3,366,0.2271581410147202,4.092862161414592e-05,111.7896461278363,COMPLETE
695,0.34970685839653015,2023-09-04 21:39:20.599045,2023-09-04 21:39:21.613696,0 days 00:00:01.014651,ReLU,Sigmoid,Leaky,,25,8,17.0,22.0,,0.00645982332954304,3,340,0.372927223656505,0.001112998092228525,121.79064308724752,COMPLETE
696,0.3614768087863922,2023-09-04 21:39:21.614059,2023-09-04 21:39:21.888217,0 days 00:00:00.274158,Tanh,Leaky,Leaky,,27,11,16.0,24.0,,0.010430875701705913,3,437,0.1858390966290539,0.00016844448743012728,277.6094750298394,COMPLETE
697,0.8198821544647217,2023-09-04 21:39:21.888632,2023-09-04 21:39:24.835445,0 days 00:00:02.946813,Tanh,Leaky,Sigmoid,,22,12,18.0,20.0,,1.0279205883301153e-05,3,412,0.18472795955061463,0.00010137859202080764,111.78225317279112,COMPLETE
698,0.3119145333766937,2023-09-04 21:39:24.835807,2023-09-04 21:39:25.162482,0 days 00:00:00.326675,Tanh,Leaky,Leaky,,33,23,15.0,19.0,,0.023952098167290017,3,376,0.2775134497616708,0.0002764389898370228,97.02532810635037,COMPLETE
699,0.36782389879226685,2023-09-04 21:39:25.162853,2023-09-04 21:39:30.228736,0 days 00:00:05.065883,Sigmoid,Sigmoid,Leaky,,17,6,17.0,12.0,,0.0015019943018194331,3,396,0.6829786042736818,5.446298724825473e-05,103.56770266364603,COMPLETE
700,0.4465639591217041,2023-09-04 21:39:30.229195,2023-09-04 21:39:30.754788,0 days 00:00:00.525593,Tanh,Leaky,ReLU,,30,13,19.0,15.0,,0.043563017446174905,3,356,0.7674665523222772,0.02550996128579284,134.99572857943448,COMPLETE
701,0.36188754439353943,2023-09-04 21:39:30.755166,2023-09-04 21:39:31.119119,0 days 00:00:00.363953,ReLU,Leaky,,,20,10,16.0,,,0.012962600124348973,2,427,0.3868985440019533,0.003479276685655865,135.12035949707033,COMPLETE
702,0.31806930899620056,2023-09-04 21:39:31.119492,2023-09-04 21:39:31.887078,0 days 00:00:00.767586,Tanh,Sigmoid,Leaky,,61,11,14.0,23.0,,0.008668547329096407,3,345,0.7423400075671085,0.00012908426476354988,100.19916636149088,COMPLETE
703,0.40470483899116516,2023-09-04 21:39:31.887506,2023-09-04 21:39:33.656717,0 days 00:00:01.769211,Tanh,Leaky,Leaky,,23,10,16.0,13.0,,0.00017637336287374458,3,318,0.16317707216721078,6.824594524030737e-05,109.3067970802044,COMPLETE
704,0.3954189419746399,2023-09-04 21:39:33.657113,2023-09-04 21:39:34.024358,0 days 00:00:00.367245,Tanh,ReLU,,,26,12,15.0,,,0.0048040933447772395,2,367,0.1917286867680448,0.004213768612041186,119.59811129812466,COMPLETE
705,0.31984061002731323,2023-09-04 21:39:34.024751,2023-09-04 21:39:35.593421,0 days 00:00:01.568670,ReLU,Leaky,Leaky,,28,9,18.0,24.0,,0.015947826631043143,3,418,0.7680302416922514,1.2152015232745768e-05,80.48737290976705,COMPLETE
706,0.35768401622772217,2023-09-04 21:39:35.593800,2023-09-04 21:39:49.847333,0 days 00:00:14.253533,Tanh,Leaky,ReLU,,21,11,17.0,22.0,,2.287660672821194e-05,3,404,0.7024480433348834,9.074962395080839e-05,102.89664143855029,COMPLETE
707,0.29080522060394287,2023-09-04 21:39:49.847795,2023-09-04 21:39:51.142927,0 days 00:00:01.295132,Tanh,Sigmoid,Leaky,,18,24,15.0,3.0,,0.01953620942366686,3,383,0.7998413006806858,2.638457244205983e-05,88.8427857293023,COMPLETE
708,0.3332177400588989,2023-09-04 21:39:51.143307,2023-09-04 21:39:52.665852,0 days 00:00:01.522545,Tanh,Leaky,,,24,12,18.0,,,0.001102593331453267,2,352,0.7234427155376054,1.9712762268908175e-05,96.71372824655452,COMPLETE
709,0.3441546559333801,2023-09-04 21:39:52.666541,2023-09-04 21:39:53.473326,0 days 00:00:00.806785,ReLU,Leaky,Tanh,,56,11,13.0,14.0,,0.027255940480325685,3,333,0.3257906476008008,0.0007788163743475288,109.88270604333212,COMPLETE
710,1.057708501815796,2023-09-04 21:39:53.473700,2023-09-04 21:39:53.646501,0 days 00:00:00.172801,Tanh,Sigmoid,Leaky,,32,11,16.0,4.0,,0.009990369453484003,3,392,0.3703700932797772,0.0023663625600246784,101.65084145285867,COMPLETE
711,0.3385979235172272,2023-09-04 21:39:53.646909,2023-09-04 21:39:54.380150,0 days 00:00:00.733241,Tanh,Tanh,Leaky,,36,12,17.0,23.0,,0.005629024435252613,3,457,0.7655594836080499,0.0015234908493021741,108.52970659410632,COMPLETE
712,0.42608287930488586,2023-09-04 21:39:54.380534,2023-09-04 21:39:55.743350,0 days 00:00:01.362816,Tanh,Leaky,,,26,13,19.0,,,0.00010428966922948359,2,373,0.1445318520535288,4.409829754117392e-05,110.79746649790619,COMPLETE
713,0.3864412009716034,2023-09-04 21:39:55.743754,2023-09-04 21:40:00.473921,0 days 00:00:04.730167,Tanh,Leaky,ReLU,,30,10,20.0,8.0,,8.84938232089854e-05,3,362,0.413517440043325,0.00023109718727753337,112.78899318210328,COMPLETE
714,0.4150795042514801,2023-09-04 21:40:00.474306,2023-09-04 21:40:00.639796,0 days 00:00:00.165490,Leaky,Sigmoid,Leaky,,22,23,8.0,10.0,,0.0579270224042856,3,338,0.12947541821993166,0.006073361358411559,119.22837793259393,COMPLETE
715,0.38099798560142517,2023-09-04 21:40:00.640257,2023-09-04 21:40:00.928480,0 days 00:00:00.288223,ReLU,Leaky,,,71,12,14.0,,,0.007348421027061473,2,431,0.663905763231172,0.08793978536416497,95.4085886819022,COMPLETE
716,0.31168195605278015,2023-09-04 21:40:00.928833,2023-09-04 21:40:01.643768,0 days 00:00:00.714935,Tanh,Leaky,Leaky,,46,11,16.0,9.0,,0.011631613181529834,3,354,0.7196879177922682,0.000191292604041763,230.10830091393512,COMPLETE
717,0.4676670730113983,2023-09-04 21:40:01.644194,2023-09-04 21:40:01.979477,0 days 00:00:00.335283,Tanh,Leaky,ReLU,,17,4,17.0,5.0,,0.014625479227275258,3,447,0.1755087389672243,0.03606440114253196,116.92018381754558,COMPLETE
718,0.34043070673942566,2023-09-04 21:40:01.979845,2023-09-04 21:40:03.221332,0 days 00:00:01.241487,Tanh,Sigmoid,Leaky,,20,6,15.0,6.0,,0.0018548188064039881,3,403,0.5070126549964873,0.00015928582579587252,103.39792594909667,COMPLETE
719,0.3586844503879547,2023-09-04 21:40:03.221709,2023-09-04 21:40:03.687401,0 days 00:00:00.465692,ReLU,Leaky,,,24,10,16.0,,,0.0037988825176807806,2,381,0.2798569330080092,0.01888963603609216,116.99783985431378,COMPLETE
720,0.39401647448539734,2023-09-04 21:40:03.687788,2023-09-04 21:40:04.005855,0 days 00:00:00.318067,Tanh,Leaky,Leaky,,28,11,18.0,21.0,,0.0023887227845650633,3,415,0.122173625881664,3.3477974963227195e-05,129.43551436204177,COMPLETE
721,0.31950655579566956,2023-09-04 21:40:04.006250,2023-09-04 21:40:04.329145,0 days 00:00:00.322895,Tanh,Sigmoid,Sigmoid,,19,23,21.0,16.0,,0.033563922947828756,3,391,0.16681767500153583,0.0001146737749437921,117.01923588344029,COMPLETE
722,0.34404611587524414,2023-09-04 21:40:04.329550,2023-09-04 21:40:04.486798,0 days 00:00:00.157248,Tanh,Leaky,,,59,7,13.0,,,0.01889611771367228,2,346,0.14174624242965897,0.009388221922407262,142.78651250794877,COMPLETE
723,0.35446828603744507,2023-09-04 21:40:04.487170,2023-09-04 21:40:05.540226,0 days 00:00:01.053056,Tanh,Leaky,Leaky,,25,8,15.0,12.0,,0.0013513284598873155,3,325,0.42682334977170494,0.023700761679275487,116.83607885572646,COMPLETE
724,0.3369022011756897,2023-09-04 21:40:05.540617,2023-09-04 21:40:08.565273,0 days 00:00:03.024656,ReLU,Sigmoid,,,22,13,16.0,,,0.0009617268525670087,2,366,0.7523041478556084,8.262611769766339e-05,102.41002647622118,COMPLETE
725,0.42484694719314575,2023-09-04 21:40:08.565636,2023-09-04 21:40:08.881202,0 days 00:00:00.315566,Tanh,Leaky,ReLU,,16,12,19.0,24.0,,0.011807766271065875,3,398,0.1305488680954104,0.007571590652359024,123.42772831060948,COMPLETE
726,0.2859123647212982,2023-09-04 21:40:08.881572,2023-09-04 21:40:11.611491,0 days 00:00:02.729919,Sigmoid,Leaky,Leaky,,29,9,17.0,14.0,,0.008061752715086391,3,371,0.7719055508547327,0.00026366379277436886,87.75727513831431,COMPLETE
727,0.36320337653160095,2023-09-04 21:40:11.611990,2023-09-04 21:40:21.865606,0 days 00:00:10.253616,Tanh,Leaky,Leaky,,23,11,15.0,13.0,,6.12238710130212e-05,3,357,0.692452890676697,0.002599810485941113,111.58211151892398,COMPLETE
728,0.3494936227798462,2023-09-04 21:40:21.865971,2023-09-04 21:40:22.692205,0 days 00:00:00.826234,Tanh,ReLU,,,27,24,18.0,,,0.015539741866928582,2,344,0.7333067456962266,0.001956613791039698,382.10668218703495,COMPLETE
729,0.4086410105228424,2023-09-04 21:40:22.692564,2023-09-04 21:40:23.046019,0 days 00:00:00.353455,ReLU,Sigmoid,Leaky,,31,12,14.0,18.0,,0.009910013315599901,3,380,0.250080313076144,0.00013573959070098174,110.70182691301618,COMPLETE
730,0.3714807331562042,2023-09-04 21:40:23.046376,2023-09-04 21:40:24.156607,0 days 00:00:01.110231,Tanh,Leaky,ReLU,,63,11,17.0,22.0,,0.0028693118003517773,3,409,0.6803513112045668,0.010530692826781228,96.954726909769,COMPLETE
731,0.36892497539520264,2023-09-04 21:40:24.157259,2023-09-04 21:40:27.089234,0 days 00:00:02.931975,Tanh,Leaky,Leaky,,20,10,18.0,23.0,,0.013406149893367789,3,419,0.7688079130934786,0.00033639447468572763,93.73771874109904,COMPLETE
732,0.3326198160648346,2023-09-04 21:40:27.089628,2023-09-04 21:40:30.237928,0 days 00:00:03.148300,Tanh,Sigmoid,Leaky,,25,13,16.0,20.0,,0.0011231824304692745,3,438,0.7992575207262023,0.0009193894315108929,121.86738849077068,COMPLETE
733,0.32726532220840454,2023-09-04 21:40:30.238315,2023-09-04 21:40:31.257158,0 days 00:00:01.018843,ReLU,Leaky,,,18,12,14.0,,,0.03980186041857415,2,332,0.7213659646903694,1.551501431002341e-05,98.37603466327374,COMPLETE
734,0.41948094964027405,2023-09-04 21:40:31.257513,2023-09-04 21:40:39.592615,0 days 00:00:08.335102,Tanh,Leaky,Tanh,,22,11,17.0,13.0,,3.447407311377404e-05,3,365,0.6479941435424612,0.0006115144049698187,105.21045837402343,COMPLETE
735,0.4550354480743408,2023-09-04 21:40:39.592979,2023-09-04 21:40:44.763150,0 days 00:00:05.170171,Leaky,Tanh,Leaky,,52,11,19.0,15.0,,1.6110537674174403e-05,3,387,0.7460874250275936,5.3731199007688656e-05,142.77839171732427,COMPLETE
736,0.35436761379241943,2023-09-04 21:40:44.763545,2023-09-04 21:40:45.646139,0 days 00:00:00.882594,Tanh,Sigmoid,ReLU,,26,10,15.0,7.0,,0.006226832147262256,3,353,0.3469171338725488,2.4407671546903757e-05,104.31745290120443,COMPLETE
737,0.32072746753692627,2023-09-04 21:40:45.646582,2023-09-04 21:40:46.091334,0 days 00:00:00.444752,Tanh,Leaky,,,68,12,18.0,,,0.01724038560391582,2,376,0.7046464788205172,0.00021254970152414945,119.89758942343973,COMPLETE
738,0.3718028962612152,2023-09-04 21:40:46.091717,2023-09-04 21:40:46.741534,0 days 00:00:00.649817,Tanh,Leaky,Leaky,,21,22,17.0,17.0,,0.02207357014000907,3,429,0.7681405102018559,7.147448393021685e-05,90.93225206647601,COMPLETE
739,0.42380717396736145,2023-09-04 21:40:46.741922,2023-09-04 21:40:47.244868,0 days 00:00:00.502946,ReLU,Leaky,,,16,12,16.0,,,0.0750469036672739,2,345,0.7465773497989018,0.0011601522158161848,108.37399244308472,COMPLETE
740,0.3662325143814087,2023-09-04 21:40:47.245260,2023-09-04 21:40:48.050624,0 days 00:00:00.805364,Tanh,Sigmoid,Leaky,,28,11,16.0,24.0,,0.010916310218468117,3,252,0.685982069182381,0.0016587064230907773,107.52625595895867,COMPLETE
741,0.34015434980392456,2023-09-04 21:40:48.051021,2023-09-04 21:40:49.310873,0 days 00:00:01.259852,Tanh,Leaky,Leaky,,34,13,14.0,5.0,,0.0021684893722361477,3,362,0.7985419754238219,0.00010894790791091476,98.78310874200636,COMPLETE
742,0.33640018105506897,2023-09-04 21:40:49.311267,2023-09-04 21:40:49.553385,0 days 00:00:00.242118,Tanh,Leaky,ReLU,,24,10,15.0,23.0,,0.026475370272486625,3,400,0.2096849420489056,0.0001680985742857819,115.42888061523438,COMPLETE
743,0.37776094675064087,2023-09-04 21:40:49.553767,2023-09-04 21:40:50.105685,0 days 00:00:00.551918,ReLU,Sigmoid,,,20,12,20.0,,,0.0016215274232993244,2,314,0.1748752932845053,3.239794082848122e-05,137.01669320292856,COMPLETE
744,0.3352911174297333,2023-09-04 21:40:50.106059,2023-09-04 21:40:50.847470,0 days 00:00:00.741411,Tanh,Leaky,Leaky,,30,11,17.0,8.0,,0.0008538828402897765,3,336,0.24440187984011316,0.000286958549802107,140.16299999003508,COMPLETE
745,0.37169739603996277,2023-09-04 21:40:50.847857,2023-09-04 21:40:51.723793,0 days 00:00:00.875936,Tanh,Leaky,Leaky,,17,5,18.0,14.0,,0.008802815629587278,3,373,0.7219022616320756,0.008586788239980684,111.77877367459811,COMPLETE
746,0.38831719756126404,2023-09-04 21:40:51.724206,2023-09-04 21:40:52.054356,0 days 00:00:00.330150,Tanh,Sigmoid,Leaky,,32,11,15.0,7.0,,0.013474288224085123,3,387,0.22230689119440028,4.1501407107726966e-05,212.38596769820813,COMPLETE
747,0.3450108766555786,2023-09-04 21:40:52.054753,2023-09-04 21:40:52.474083,0 days 00:00:00.419330,Tanh,Leaky,,,26,23,13.0,,,0.004951436444408004,2,411,0.21645697996691615,0.0031474030836776026,196.5707883199056,COMPLETE
748,0.3523810803890228,2023-09-04 21:40:52.474472,2023-09-04 21:40:52.884237,0 days 00:00:00.409765,ReLU,Leaky,Sigmoid,,23,9,16.0,9.0,,0.017051761055691752,3,354,0.30831896377036344,0.00044657344769022676,131.1713423728943,COMPLETE
749,0.366360068321228,2023-09-04 21:40:52.884617,2023-09-04 21:40:56.134572,0 days 00:00:03.249955,Sigmoid,Leaky,ReLU,,14,7,17.0,6.0,,0.003454175912019672,3,241,0.6357718015396836,0.00014754664324431458,110.74822428385417,COMPLETE
750,0.3520604968070984,2023-09-04 21:40:56.134952,2023-09-04 21:41:00.624561,0 days 00:00:04.489609,Tanh,Sigmoid,Leaky,,19,12,18.0,11.0,,0.001366384962330495,3,425,0.7724400468265017,9.24001691032391e-05,104.28778250321098,COMPLETE
