number,value,datetime_start,datetime_complete,duration,params_activation1,params_activation2,params_activation3,params_activation4,params_batch_size,params_fl1,params_fl2,params_fl3,params_fl4,params_learning_rate,params_n_layers,params_num_epochs,params_train_size,params_weight_decay,user_attrs_mre,state
1207,0.5394667983055115,2023-09-04 21:52:10.286710,2023-09-04 21:52:13.673315,0 days 00:00:03.386605,ReLU,Tanh,ReLU,,28,18,22.0,9.0,,3.716988990577196e-05,3,189,0.5441250321560046,0.004140581429412849,182.28515891423302,COMPLETE
1208,0.2989479899406433,2023-09-04 21:52:13.673783,2023-09-04 21:52:14.273265,0 days 00:00:00.599482,ReLU,Leaky,Leaky,,58,19,21.0,8.0,,0.004441199482925222,3,216,0.7514409294654919,0.00012318323160294054,313.5935546130669,COMPLETE
1209,0.5224357843399048,2023-09-04 21:52:14.273776,2023-09-04 21:52:14.620937,0 days 00:00:00.347161,ReLU,Leaky,Sigmoid,,33,20,21.0,7.0,,0.0014727832405616477,3,368,0.19933397877102238,1.000922583215318e-05,207.13078969319662,COMPLETE
1210,0.36710336804389954,2023-09-04 21:52:14.621394,2023-09-04 21:52:18.199558,0 days 00:00:03.578164,ReLU,Tanh,Tanh,,30,20,22.0,9.0,,0.00019495933163510358,3,199,0.6450031637584626,1.5243298834916686e-05,162.34679708049524,COMPLETE
1211,0.3730543553829193,2023-09-04 21:52:18.200019,2023-09-04 21:52:18.450163,0 days 00:00:00.250144,ReLU,Leaky,Leaky,,26,18,23.0,24.0,,0.008006011800445051,3,182,0.14963539476242171,1.967675648823777e-05,253.65487227901335,COMPLETE
1212,0.45392632484436035,2023-09-04 21:52:18.450602,2023-09-04 21:52:18.674678,0 days 00:00:00.224076,ReLU,Leaky,Leaky,,33,19,10.0,6.0,,0.04548706333549351,3,223,0.20427010758090733,0.00016768226877754498,338.3630536950153,COMPLETE
1213,0.38243135809898376,2023-09-04 21:52:18.675135,2023-09-04 21:52:19.942888,0 days 00:00:01.267753,ReLU,Tanh,Leaky,,34,17,22.0,8.0,,0.0006480762174987548,3,208,0.7045400148718592,0.006245609072811641,309.11661996414415,COMPLETE
1214,0.38106387853622437,2023-09-04 21:52:19.943337,2023-09-04 21:52:21.333568,0 days 00:00:01.390231,ReLU,Leaky,Tanh,,31,20,23.0,9.0,,0.001086792168497958,3,191,0.7689907907114093,0.004606420369570139,139.7515676021576,COMPLETE
1215,0.41711220145225525,2023-09-04 21:52:21.334014,2023-09-04 21:52:21.724989,0 days 00:00:00.390975,ReLU,Leaky,Leaky,,60,19,21.0,9.0,,0.006511198677177992,3,168,0.413249405036579,0.010530829758426936,244.8234089938077,COMPLETE
1216,0.46932196617126465,2023-09-04 21:52:21.725485,2023-09-04 21:52:21.997016,0 days 00:00:00.271531,ReLU,Sigmoid,Sigmoid,,30,16,21.0,8.0,,0.004768052074449548,3,198,0.10051194864515074,1.2588368836814208e-05,206.3677300193093,COMPLETE
1217,0.39507895708084106,2023-09-04 21:52:21.997493,2023-09-04 21:52:22.768166,0 days 00:00:00.770673,ReLU,Tanh,ReLU,,33,20,22.0,24.0,,0.0004965002854024526,3,182,0.13325485732965495,0.0001396860488978171,136.0462472517412,COMPLETE
1218,0.20967082679271698,2023-09-04 21:52:22.768618,2023-09-04 21:52:24.122306,0 days 00:00:01.353688,ReLU,Leaky,Leaky,Leaky,29,19,18.0,7.0,6.0,0.0029231704525418804,4,212,0.7431446605404771,0.0001855956144032176,201.28675151321124,COMPLETE
1219,0.283298522233963,2023-09-04 21:52:24.122757,2023-09-04 21:52:25.281681,0 days 00:00:01.158924,ReLU,Leaky,Leaky,Leaky,51,19,19.0,6.0,6.0,0.002762341321913355,4,221,0.6792751673588883,0.00023671802251506823,125.38062226927126,COMPLETE
1220,0.28332632780075073,2023-09-04 21:52:25.282125,2023-09-04 21:52:26.577596,0 days 00:00:01.295471,ReLU,Leaky,Leaky,Leaky,23,20,19.0,6.0,7.0,0.0021333565792328105,4,210,0.6970578087084661,0.0001861127672020643,147.60031509399414,COMPLETE
1221,0.40301573276519775,2023-09-04 21:52:26.578055,2023-09-04 21:52:27.762913,0 days 00:00:01.184858,ReLU,Tanh,Leaky,Leaky,25,19,17.0,7.0,3.0,0.0029908787585199697,4,204,0.45952247685381903,0.00018034868321641952,314.64266531808033,COMPLETE
1222,0.3796203136444092,2023-09-04 21:52:27.763394,2023-09-04 21:52:28.316519,0 days 00:00:00.553125,ReLU,Leaky,Leaky,Leaky,27,20,17.0,7.0,1.0,0.0746210904919547,4,155,0.6206780730075508,0.00020271083900656907,167.24810718354723,COMPLETE
1223,0.3543455898761749,2023-09-04 21:52:28.316977,2023-09-04 21:52:29.317954,0 days 00:00:01.000977,ReLU,Leaky,Leaky,Leaky,28,20,17.0,6.0,9.0,0.0022543127935308505,4,177,0.40780268245652107,0.0001457197526429095,452.4309288611779,COMPLETE
1224,0.26351216435432434,2023-09-04 21:52:29.318404,2023-09-04 21:52:30.763398,0 days 00:00:01.444994,ReLU,Tanh,Leaky,Leaky,29,19,18.0,7.0,13.0,0.0017920123665772076,4,193,0.7279288187993549,0.00022190475965057612,285.4137650874623,COMPLETE
1225,0.4364241361618042,2023-09-04 21:52:30.763845,2023-09-04 21:52:31.615749,0 days 00:00:00.851904,ReLU,Leaky,Leaky,Leaky,26,20,18.0,7.0,8.0,0.0033838081440623505,4,67,0.3386807639032293,0.00028241576858716304,150.91706823130124,COMPLETE
1226,0.4623936414718628,2023-09-04 21:52:31.616214,2023-09-04 21:52:32.387489,0 days 00:00:00.771275,ReLU,Leaky,Leaky,Leaky,28,14,18.0,7.0,4.0,0.09468110485759729,4,125,0.653697700876388,0.0001297462170321601,161.77787140877015,COMPLETE
1227,0.29264670610427856,2023-09-04 21:52:32.387993,2023-09-04 21:52:37.460272,0 days 00:00:05.072279,ReLU,Tanh,Leaky,Tanh,30,19,17.0,7.0,10.0,0.000330106922261843,4,220,0.7285886506983044,0.00015825019221167122,173.30614433288574,COMPLETE
1228,0.4809795916080475,2023-09-04 21:52:37.460704,2023-09-04 21:52:38.773243,0 days 00:00:01.312539,ReLU,Leaky,Leaky,ReLU,24,20,18.0,6.0,5.0,0.002788235508561217,4,213,0.4974562445493709,0.00038981127678445283,128.08945184004935,COMPLETE
1229,0.32249799370765686,2023-09-04 21:52:38.773720,2023-09-04 21:52:40.487706,0 days 00:00:01.713986,ReLU,Sigmoid,Leaky,Leaky,27,19,13.0,13.0,2.0,0.002266356736006224,4,201,0.6865306760051604,0.0002120760124621169,188.96698615130256,COMPLETE
1230,0.37772679328918457,2023-09-04 21:52:40.488193,2023-09-04 21:52:41.623969,0 days 00:00:01.135776,ReLU,Leaky,Leaky,Sigmoid,29,20,18.0,7.0,14.0,0.001517541427051446,4,185,0.3013336557541646,0.00027065876189319454,175.1936602124981,COMPLETE
1231,0.6366101503372192,2023-09-04 21:52:41.624430,2023-09-04 21:52:41.889916,0 days 00:00:00.265486,ReLU,Tanh,Leaky,ReLU,27,19,18.0,6.0,11.0,0.09682627260342164,4,224,0.3173063064732983,0.0001896987306102511,202.22056906563895,COMPLETE
1232,0.2990475594997406,2023-09-04 21:52:41.890380,2023-09-04 21:52:43.068172,0 days 00:00:01.177792,ReLU,Leaky,Leaky,Leaky,25,19,18.0,7.0,6.0,0.003590173473469052,4,170,0.7481715745166876,0.005687369323186508,343.3685067983774,COMPLETE
1233,0.32243019342422485,2023-09-04 21:52:43.068628,2023-09-04 21:52:45.042619,0 days 00:00:01.973991,ReLU,Leaky,Leaky,Tanh,54,20,18.0,16.0,16.0,0.0008923643902923894,4,479,0.7101981481081918,0.001782249193422091,131.5868623521593,COMPLETE
1234,0.41370889544487,2023-09-04 21:52:45.043473,2023-09-04 21:52:46.246570,0 days 00:00:01.203097,ReLU,Tanh,Leaky,ReLU,29,19,18.0,14.0,7.0,0.0025650025095332965,4,190,0.15966014128966033,0.0001428458068583282,127.35331044514975,COMPLETE
1235,0.2858782112598419,2023-09-04 21:52:46.247037,2023-09-04 21:52:47.723743,0 days 00:00:01.476706,ReLU,Leaky,Leaky,Leaky,30,20,19.0,8.0,8.0,0.0030884522278553524,4,204,0.7392486700644384,0.0001131742574912143,125.06667433113887,COMPLETE
1236,0.5126992464065552,2023-09-04 21:52:47.724214,2023-09-04 21:52:48.132113,0 days 00:00:00.407899,ReLU,Leaky,Leaky,Sigmoid,31,20,17.0,7.0,19.0,0.009609626375370443,4,214,0.15375261072999932,0.00029645727953412867,351.39009817023026,COMPLETE
1237,0.35712942481040955,2023-09-04 21:52:48.132570,2023-09-04 21:52:48.607124,0 days 00:00:00.474554,ReLU,Tanh,Leaky,Leaky,49,19,19.0,8.0,17.0,0.010691359836608759,4,181,0.2581234820690328,0.0007203360812145709,299.4866075359407,COMPLETE
1238,0.6707201600074768,2023-09-04 21:52:48.607581,2023-09-04 21:52:49.253619,0 days 00:00:00.646038,ReLU,Leaky,Leaky,ReLU,28,20,16.0,24.0,3.0,0.0018970433747961214,4,90,0.17380235556096335,1.0049941305858985e-05,130.61983753386,COMPLETE
1239,0.6954050660133362,2023-09-04 21:52:49.254078,2023-09-04 21:52:50.264066,0 days 00:00:01.009988,ReLU,Leaky,Leaky,Tanh,47,19,9.0,17.0,4.0,3.810015951724618e-05,4,195,0.18488936024264196,0.0004319884557605936,105.41741051307092,COMPLETE
1240,0.3884078860282898,2023-09-04 21:52:50.264522,2023-09-04 21:52:53.958746,0 days 00:00:03.694224,ReLU,Tanh,,,31,20,18.0,,,0.0004385405471110969,2,381,0.7680086121470062,0.0022409766526105116,143.48842094313932,COMPLETE
1241,0.2830080986022949,2023-09-04 21:52:53.959182,2023-09-04 21:52:56.271279,0 days 00:00:02.312097,ReLU,Sigmoid,Leaky,Leaky,56,19,14.0,7.0,13.0,0.0012903172636095806,4,209,0.6571097529804435,0.00010148860915557567,176.63173910958426,COMPLETE
1242,0.3034718930721283,2023-09-04 21:52:56.271750,2023-09-04 21:52:56.920602,0 days 00:00:00.648852,ReLU,Leaky,Leaky,ReLU,45,18,19.0,19.0,21.0,0.0037318482892180847,4,228,0.611840624631371,0.00019734870445179813,167.10609103471805,COMPLETE
1243,0.41637948155403137,2023-09-04 21:52:56.921053,2023-09-04 21:52:58.764740,0 days 00:00:01.843687,ReLU,Leaky,Sigmoid,Sigmoid,32,19,12.0,5.0,5.0,0.0025111940028123003,4,191,0.6921969084495618,0.0002476908802540386,473.1201671082296,COMPLETE
1244,0.48818832635879517,2023-09-04 21:52:58.765193,2023-09-04 21:52:59.344562,0 days 00:00:00.579369,ReLU,Tanh,Leaky,Leaky,29,20,20.0,6.0,12.0,0.0010060450850494338,4,201,0.13751992761945644,0.01122855074317594,142.8200205320953,COMPLETE
1245,0.42090368270874023,2023-09-04 21:52:59.345039,2023-09-04 21:53:01.206741,0 days 00:00:01.861702,ReLU,Leaky,Leaky,ReLU,43,20,17.0,24.0,9.0,0.0002569654910509786,4,219,0.4462020067710883,0.0003520130936983802,219.0281247138977,COMPLETE
1246,0.5265524983406067,2023-09-04 21:53:01.207218,2023-09-04 21:53:02.439136,0 days 00:00:01.231918,ReLU,Leaky,ReLU,,33,19,15.0,15.0,,0.00012877627070217738,3,172,0.24741774278260878,0.0001669812897136923,180.55676642129586,COMPLETE
1247,0.4395960867404938,2023-09-04 21:53:02.439572,2023-09-04 21:53:03.618429,0 days 00:00:01.178857,ReLU,Tanh,Leaky,Tanh,31,18,11.0,18.0,2.0,0.009424064680561197,4,184,0.7989274972865618,0.00011828604950678463,184.26298973777077,COMPLETE
1248,0.4485539495944977,2023-09-04 21:53:03.618889,2023-09-04 21:53:03.931444,0 days 00:00:00.312555,ReLU,Leaky,Leaky,,26,20,10.0,23.0,,0.0031418429869738006,3,227,0.12941062326599595,0.0005862465551981867,169.68467163085938,COMPLETE
1249,0.5360515117645264,2023-09-04 21:53:03.931896,2023-09-04 21:53:04.815008,0 days 00:00:00.883112,ReLU,,,,28,19,,,,9.090647675724577e-05,1,149,0.2805834849289388,0.0027337952538836704,138.21643557964555,COMPLETE
1250,0.3986840844154358,2023-09-04 21:53:04.815434,2023-09-04 21:53:05.667404,0 days 00:00:00.851970,ReLU,Leaky,Sigmoid,,46,19,19.0,24.0,,0.0007307965405003679,3,162,0.7248787184813119,1.576471083968546e-05,185.13852763625812,COMPLETE
1251,0.6180631518363953,2023-09-04 21:53:05.667862,2023-09-04 21:53:07.534822,0 days 00:00:01.866960,ReLU,Tanh,Leaky,,43,20,7.0,8.0,,0.0005439926661894255,3,199,0.7524395295246791,0.08714248397601562,239.64093714175016,COMPLETE
1252,0.2797238230705261,2023-09-04 21:53:07.535275,2023-09-04 21:53:09.135324,0 days 00:00:01.600049,ReLU,Leaky,Leaky,,32,24,20.0,23.0,,0.0015371862790531975,3,209,0.7726814661187855,1.2627996874041012e-05,137.78711198505601,COMPLETE
1253,0.416298508644104,2023-09-04 21:53:09.135786,2023-09-04 21:53:09.649910,0 days 00:00:00.514124,ReLU,Sigmoid,Leaky,Leaky,10,18,24.0,8.0,10.0,0.01148897128310482,4,217,0.12012797135009437,9.124260932048035e-05,535.6562371504934,COMPLETE
1254,0.420242041349411,2023-09-04 21:53:09.650479,2023-09-04 21:53:12.092296,0 days 00:00:02.441817,ReLU,Leaky,ReLU,,52,12,19.0,5.0,,0.0002885618605695765,3,189,0.7085820172147959,0.0001433880722985771,788.4556090339781,COMPLETE
1255,0.6406149864196777,2023-09-04 21:53:12.092722,2023-09-04 21:53:18.125046,0 days 00:00:06.032324,ReLU,Tanh,Leaky,,34,4,20.0,7.0,,4.389771281911719e-05,3,427,0.5414459325582177,0.0002269495509058567,216.00973503595213,COMPLETE
1256,0.4061446785926819,2023-09-04 21:53:18.125471,2023-09-04 21:53:20.000126,0 days 00:00:01.874655,ReLU,Leaky,Sigmoid,,41,21,18.0,23.0,,0.003788141729064342,3,81,0.6740990214099585,0.0030983424202347476,142.0013748407364,COMPLETE
1257,0.35604411363601685,2023-09-04 21:53:20.000632,2023-09-04 21:53:21.868248,0 days 00:00:01.867616,ReLU,Leaky,Leaky,,31,19,10.0,8.0,,0.008256019722376164,3,233,0.4317815948831354,0.0008427216648878571,141.00101906912667,COMPLETE
1258,0.280232310295105,2023-09-04 21:53:21.869073,2023-09-04 21:53:23.562683,0 days 00:00:01.693610,ReLU,Tanh,Leaky,,35,18,16.0,24.0,,0.002631685828732599,3,272,0.5109402950012413,6.58489472321895e-05,124.12169634709593,COMPLETE
1259,0.3476025462150574,2023-09-04 21:53:23.563134,2023-09-04 21:53:24.393895,0 days 00:00:00.830761,ReLU,Leaky,Leaky,,29,20,21.0,8.0,,0.007120463130688846,3,68,0.7996398837285823,0.00733896488805923,1763.2994458747633,COMPLETE
1260,0.307205468416214,2023-09-04 21:53:24.394319,2023-09-04 21:53:25.242209,0 days 00:00:00.847890,ReLU,Leaky,Leaky,,42,20,20.0,20.0,,0.002036705732838116,3,200,0.364572005447269,0.00017327603609495088,125.10681287447612,COMPLETE
1261,0.30867308378219604,2023-09-04 21:53:25.242656,2023-09-04 21:53:26.217282,0 days 00:00:00.974626,ReLU,Tanh,Leaky,ReLU,34,18,19.0,23.0,15.0,0.003042038122085763,4,135,0.7465037787996489,0.00013083821118843185,283.6583713531494,COMPLETE
1262,0.4116751253604889,2023-09-04 21:53:26.217751,2023-09-04 21:53:26.737347,0 days 00:00:00.519596,ReLU,Leaky,Sigmoid,,45,19,21.0,24.0,,0.012588178429359718,3,176,0.7170623840812234,0.0003144623284993884,162.62747534390152,COMPLETE
1263,0.36400195956230164,2023-09-04 21:53:26.737808,2023-09-04 21:53:28.214802,0 days 00:00:01.476994,ReLU,Leaky,ReLU,,32,20,21.0,6.0,,0.0008246910717702914,3,211,0.48309291541053884,0.00110472497183842,143.60414699207652,COMPLETE
1264,0.3567199409008026,2023-09-04 21:53:28.215280,2023-09-04 21:53:28.664288,0 days 00:00:00.449008,ReLU,Tanh,Leaky,,41,23,20.0,8.0,,0.009449541364261137,3,194,0.37736845463560903,0.00019521361892791043,380.1259430675972,COMPLETE
1265,0.4497518837451935,2023-09-04 21:53:28.664744,2023-09-04 21:53:29.268233,0 days 00:00:00.603489,ReLU,Sigmoid,Leaky,,30,21,24.0,7.0,,0.06720073820363112,3,223,0.7653928306275745,0.005563924690787376,268.45556322733563,COMPLETE
1266,0.3182046711444855,2023-09-04 21:53:29.268676,2023-09-04 21:53:30.280713,0 days 00:00:01.012037,ReLU,Leaky,Leaky,,93,19,21.0,23.0,,0.0011787054721461576,3,182,0.5620877227080116,0.001256393944688588,134.95825517177582,COMPLETE
1267,0.2799336314201355,2023-09-04 21:53:30.281165,2023-09-04 21:53:31.322277,0 days 00:00:01.041112,ReLU,Leaky,Leaky,,49,20,20.0,17.0,,0.029462828465454578,3,207,0.74197244216328,1.4620064703827225e-05,180.4559178006822,COMPLETE
1268,1.0056053400039673,2023-09-04 21:53:31.322725,2023-09-04 21:53:32.057735,0 days 00:00:00.735010,ReLU,Tanh,Sigmoid,,39,19,6.0,7.0,,5.259169498300867e-05,3,217,0.11400921813792741,0.0035264650839952933,622.4197105020971,COMPLETE
1269,0.5550676584243774,2023-09-04 21:53:32.058162,2023-09-04 21:53:35.962396,0 days 00:00:03.904234,ReLU,Leaky,Leaky,Leaky,26,18,19.0,20.0,1.0,1.9919742400241384e-05,4,462,0.2216595542073727,5.565188811911543e-05,155.47894979039313,COMPLETE
1270,0.3089559078216553,2023-09-04 21:53:35.962838,2023-09-04 21:53:38.891696,0 days 00:00:02.928858,ReLU,Leaky,ReLU,,35,18,17.0,24.0,,0.00036567986365832215,3,197,0.7701517068436793,0.00010736019783799376,202.85283142289305,COMPLETE
1271,0.38806426525115967,2023-09-04 21:53:38.892151,2023-09-04 21:53:39.661333,0 days 00:00:00.769182,ReLU,Tanh,Leaky,,44,21,11.0,21.0,,0.0016986753143396198,3,189,0.23607538096850547,1.983762621840576e-05,176.4499271937779,COMPLETE
1272,0.46102869510650635,2023-09-04 21:53:39.661832,2023-09-04 21:53:40.653234,0 days 00:00:00.991402,ReLU,Leaky,Leaky,,37,17,20.0,12.0,,0.0006751090349369031,3,227,0.19760211781388543,0.00024647383653757373,143.42060956882156,COMPLETE
1273,0.5504456162452698,2023-09-04 21:53:40.653748,2023-09-04 21:53:43.294375,0 days 00:00:02.640627,ReLU,Leaky,Leaky,,41,19,9.0,8.0,,6.294123968506362e-05,3,204,0.5878667069058257,0.0001608549990596726,202.3987745771221,COMPLETE
1274,0.33682385087013245,2023-09-04 21:53:43.294825,2023-09-04 21:53:43.826548,0 days 00:00:00.531723,ReLU,Tanh,,,32,20,23.0,,,0.057059089732419764,2,161,0.5360401479216447,1.229070215574617e-05,372.50620149311266,COMPLETE
1275,1.1933517456054688,2023-09-04 21:53:43.827018,2023-09-04 21:53:44.219824,0 days 00:00:00.392806,ReLU,Leaky,Sigmoid,,29,21,21.0,23.0,,4.3792419422886115e-05,3,50,0.18881894469774121,1.6464395676503332e-05,113.45354721069336,COMPLETE
1276,0.3157161772251129,2023-09-04 21:53:44.220262,2023-09-04 21:53:44.721898,0 days 00:00:00.501636,ReLU,Leaky,Leaky,,47,20,23.0,9.0,,0.004113704378641385,3,237,0.6948300553791211,7.940942907880441e-05,170.22039082845052,COMPLETE
1277,0.3082086145877838,2023-09-04 21:53:44.722362,2023-09-04 21:53:45.349654,0 days 00:00:00.627292,ReLU,Tanh,Leaky,,58,18,18.0,18.0,,0.011036427970351429,3,173,0.733070350878835,0.0014864979701271013,124.00974568453702,COMPLETE
1278,0.37679246068000793,2023-09-04 21:53:45.350124,2023-09-04 21:53:46.952440,0 days 00:00:01.602316,ReLU,Sigmoid,Leaky,,34,19,8.0,8.0,,0.0021512405234451262,3,214,0.644312411947258,0.0018383482549628877,215.76525533575762,COMPLETE
1279,0.5058396458625793,2023-09-04 21:53:46.952875,2023-09-04 21:53:47.198214,0 days 00:00:00.245339,ReLU,Leaky,ReLU,Sigmoid,39,20,10.0,23.0,23.0,0.007939250210384125,4,189,0.1442358821900937,0.00020220886068617888,195.03982740832913,COMPLETE
1280,0.3110455870628357,2023-09-04 21:53:47.198681,2023-09-04 21:53:47.903785,0 days 00:00:00.705104,ReLU,Tanh,Leaky,,36,19,22.0,24.0,,0.013575911025182819,3,281,0.46621034463665695,6.515615804911748e-05,147.895162762336,COMPLETE
1281,0.4957691431045532,2023-09-04 21:53:47.904259,2023-09-04 21:53:50.004350,0 days 00:00:02.100091,ReLU,Leaky,Leaky,,63,20,24.0,10.0,,0.00011771777934560851,3,115,0.7723322806321303,0.0025647349679661325,194.9772278495457,COMPLETE
1282,0.5039055943489075,2023-09-04 21:53:50.004789,2023-09-04 21:53:51.123089,0 days 00:00:01.118300,ReLU,Leaky,Sigmoid,,27,21,19.0,8.0,,0.025366530306187077,3,178,0.3921717147052439,0.00035624924696333807,468.5045392071759,COMPLETE
1283,0.33564308285713196,2023-09-04 21:53:51.123950,2023-09-04 21:53:52.233637,0 days 00:00:01.109687,ReLU,Tanh,Leaky,,42,17,21.0,22.0,,0.03440722285070869,3,203,0.7992506370345939,0.004264382382609713,221.53717041015625,COMPLETE
1284,0.43494194746017456,2023-09-04 21:53:52.234171,2023-09-04 21:53:53.017993,0 days 00:00:00.783822,ReLU,Leaky,Leaky,,55,18,23.0,9.0,,0.0055886537741964455,3,262,0.6718054420874536,0.07187631101939494,148.43300508197984,COMPLETE
1285,0.36670392751693726,2023-09-04 21:53:53.018537,2023-09-04 21:53:53.849867,0 days 00:00:00.831330,ReLU,Leaky,Leaky,Leaky,33,19,20.0,23.0,7.0,0.0031199518143282803,4,223,0.720825433492951,0.00045364328776700976,141.10330778179747,COMPLETE
1286,0.3372516632080078,2023-09-04 21:53:53.850432,2023-09-04 21:53:57.787089,0 days 00:00:03.936657,ReLU,Tanh,ReLU,,30,20,21.0,7.0,,0.0009015357607125758,3,196,0.7482060952098478,0.0005457842645510146,1123.971019897461,COMPLETE
1287,0.39485782384872437,2023-09-04 21:53:57.787665,2023-09-04 21:53:58.286897,0 days 00:00:00.499232,ReLU,Leaky,Leaky,,38,19,22.0,8.0,,0.006661692689118705,3,232,0.2536738448458884,0.0009309485273115329,243.54654693603516,COMPLETE
1288,0.3126381039619446,2023-09-04 21:53:58.287381,2023-09-04 21:53:59.289413,0 days 00:00:01.002032,ReLU,Leaky,Sigmoid,,43,21,20.0,21.0,,0.003995833217491188,3,182,0.6039633244598233,0.00013080838959466927,238.51429306251416,COMPLETE
1289,0.3608124256134033,2023-09-04 21:53:59.289979,2023-09-04 21:54:00.907067,0 days 00:00:01.617088,ReLU,Sigmoid,Leaky,,35,15,18.0,22.0,,0.0025068129847865034,3,210,0.7996538340320567,0.00015689362115149075,212.24282674153645,COMPLETE
1290,0.45782509446144104,2023-09-04 21:54:00.907589,2023-09-04 21:54:01.439015,0 days 00:00:00.531426,ReLU,Tanh,Leaky,,40,20,22.0,24.0,,0.010373133073719443,3,218,0.3284261700549856,0.023578551330000735,138.44433007921492,COMPLETE
1291,0.28027254343032837,2023-09-04 21:54:01.439481,2023-09-04 21:54:02.463133,0 days 00:00:01.023652,ReLU,Leaky,Leaky,,72,19,21.0,23.0,,0.0012777325660767406,3,197,0.7040453306324627,4.919343315946127e-05,152.45862073576853,COMPLETE
1292,0.47792017459869385,2023-09-04 21:54:02.463584,2023-09-04 21:54:03.895338,0 days 00:00:01.431754,ReLU,Leaky,Leaky,,31,18,19.0,9.0,,0.00020833010525505435,3,167,0.2810354061975575,0.01376680117113733,466.2916472657712,COMPLETE
1293,0.4957841634750366,2023-09-04 21:54:03.895809,2023-09-04 21:54:04.412297,0 days 00:00:00.516488,ReLU,Tanh,Sigmoid,Tanh,36,17,20.0,7.0,22.0,0.0660692120877125,4,271,0.7524285759060199,1.0032107830099086e-05,729.7019653320312,COMPLETE
1294,0.35686248540878296,2023-09-04 21:54:04.412781,2023-09-04 21:54:07.658972,0 days 00:00:03.246191,ReLU,Leaky,,,33,20,24.0,,,0.0006010528685583647,2,237,0.76627204504524,9.38290257649346e-05,137.7329189159252,COMPLETE
1295,0.4877915382385254,2023-09-04 21:54:07.659864,2023-09-04 21:54:08.314244,0 days 00:00:00.654380,ReLU,Leaky,Leaky,,45,18,21.0,19.0,,0.00011653457850275344,3,206,0.11017453688436399,0.0002728850064243027,241.925831343488,COMPLETE
1296,0.4251076877117157,2023-09-04 21:54:08.314778,2023-09-04 21:54:08.783021,0 days 00:00:00.468243,ReLU,Tanh,ReLU,,38,19,22.0,10.0,,0.049035309143458904,3,185,0.7151578487809439,2.1348480225528413e-05,173.46182042902166,COMPLETE
1297,0.44010090827941895,2023-09-04 21:54:08.783489,2023-09-04 21:54:13.968739,0 days 00:00:05.185250,ReLU,Leaky,Leaky,,28,21,11.0,9.0,,6.96813041409534e-05,3,255,0.6718771859217156,0.007063901743782891,204.15418330173867,COMPLETE
1298,0.4022934138774872,2023-09-04 21:54:13.969198,2023-09-04 21:54:14.401114,0 days 00:00:00.431916,ReLU,Leaky,Leaky,,41,20,23.0,8.0,,0.001924910233154214,3,194,0.17081518132556042,1.4133742570076944e-05,322.5470672998673,COMPLETE
