number,value,datetime_start,datetime_complete,duration,params_activation1,params_activation2,params_activation3,params_activation4,params_batch_size,params_fl1,params_fl2,params_fl3,params_fl4,params_learning_rate,params_n_layers,params_num_epochs,params_train_size,params_weight_decay,user_attrs_mre,state
873,0.43248966336250305,2023-09-04 21:26:19.655882,2023-09-04 21:26:19.921894,0 days 00:00:00.266012,Tanh,ReLU,,,76,18,7.0,,,0.006934339503388406,2,287,0.2499043995862272,0.0002183230100966932,345.63696939437114,COMPLETE
874,0.28302299976348877,2023-09-04 21:26:19.922284,2023-09-04 21:26:20.308966,0 days 00:00:00.386682,Leaky,Tanh,,,61,24,8.0,,,0.04289956106404554,2,185,0.7710444399121342,8.913344805318924e-05,604.7335707141507,COMPLETE
875,0.36835601925849915,2023-09-04 21:26:20.309356,2023-09-04 21:26:20.963098,0 days 00:00:00.653742,Tanh,ReLU,,,87,19,23.0,,,0.0033437965239067093,2,500,0.6986550270385254,6.165509666971689e-05,161.33390185707495,COMPLETE
876,0.3335513770580292,2023-09-04 21:26:20.963492,2023-09-04 21:26:21.339650,0 days 00:00:00.376158,Tanh,Tanh,,,79,17,11.0,,,0.03017845435507003,2,300,0.730640361629199,0.00014689794193735328,485.86941610800255,COMPLETE
877,0.3147124648094177,2023-09-04 21:26:21.340060,2023-09-04 21:26:22.280198,0 days 00:00:00.940138,Leaky,Leaky,,,82,18,22.0,,,0.004606301521822046,2,165,0.7990285149170654,0.0007837772926661788,111.51445518572307,COMPLETE
878,0.3274553716182709,2023-09-04 21:26:22.280584,2023-09-04 21:26:22.964305,0 days 00:00:00.683721,Tanh,Tanh,ReLU,ReLU,77,15,24.0,16.0,24.0,0.0009036027320151344,4,271,0.37701537359304016,0.0012491228059004604,144.14988052368165,COMPLETE
879,0.3858473002910614,2023-09-04 21:26:22.964714,2023-09-04 21:26:23.125108,0 days 00:00:00.160394,ReLU,ReLU,,,84,19,8.0,,,0.011264873297092115,2,310,0.2015731903298354,0.0003564533060668257,136.76812101665297,COMPLETE
880,0.3243938982486725,2023-09-04 21:26:23.125494,2023-09-04 21:26:23.779037,0 days 00:00:00.653543,Leaky,Tanh,,,55,18,19.0,,,0.021623571352351007,2,335,0.7647985205629055,0.00010350219313505093,508.84079728036556,COMPLETE
881,0.46679529547691345,2023-09-04 21:26:23.779420,2023-09-04 21:26:24.139474,0 days 00:00:00.360054,Tanh,Leaky,,,78,16,23.0,,,0.016215214876893577,2,227,0.7148989949271112,0.01966771941181787,166.93170759412976,COMPLETE
882,0.34808850288391113,2023-09-04 21:26:24.139872,2023-09-04 21:26:24.561269,0 days 00:00:00.421397,Tanh,ReLU,,,80,17,15.0,,,0.027105332570313476,2,322,0.5583647490456205,0.00011777364142273886,243.49959027325664,COMPLETE
883,0.3173748254776001,2023-09-04 21:26:24.561655,2023-09-04 21:26:25.170328,0 days 00:00:00.608673,Leaky,Tanh,,,82,19,6.0,,,0.0366369685758179,2,282,0.7559253987253396,0.00045184506295718827,165.19310857379247,COMPLETE
884,0.3942505717277527,2023-09-04 21:26:25.170694,2023-09-04 21:26:25.492616,0 days 00:00:00.321922,Sigmoid,Tanh,,,76,18,17.0,,,0.013215950037884646,2,194,0.2814121795873793,0.0002416483689535387,197.62092928205217,COMPLETE
885,0.4587453007698059,2023-09-04 21:26:25.493003,2023-09-04 21:26:25.600638,0 days 00:00:00.107635,Tanh,ReLU,,,88,17,11.0,,,0.020367724941584484,2,295,0.1077705969995842,0.002762883729084748,138.94770074659777,COMPLETE
886,0.3491477966308594,2023-09-04 21:26:25.601000,2023-09-04 21:26:25.915980,0 days 00:00:00.314980,Leaky,Tanh,,,86,18,12.0,,,0.03262137662091321,2,304,0.5214349538153769,0.00018078220257016671,170.36007690429688,COMPLETE
887,0.3451457619667053,2023-09-04 21:26:25.916365,2023-09-04 21:26:28.563562,0 days 00:00:02.647197,Tanh,Leaky,,,63,19,7.0,,,0.0010442040028973893,2,219,0.6774628029937765,0.00014847847408162374,142.62475303754414,COMPLETE
888,0.36689940094947815,2023-09-04 21:26:28.564253,2023-09-04 21:26:29.443471,0 days 00:00:00.879218,ReLU,ReLU,,,80,18,11.0,,,0.002056440711465799,2,152,0.4971015967050413,5.10896010437982e-05,375.7048502043476,COMPLETE
889,0.2832251787185669,2023-09-04 21:26:29.443861,2023-09-04 21:26:29.791744,0 days 00:00:00.347883,Tanh,Tanh,,,44,16,23.0,,,0.04727081694834218,2,270,0.7325692621259894,7.718865689402939e-05,178.28943335491678,COMPLETE
890,0.43715840578079224,2023-09-04 21:26:29.792110,2023-09-04 21:26:30.383719,0 days 00:00:00.591609,Leaky,Tanh,,,78,20,8.0,,,0.0005040843228507238,2,407,0.21867106476387405,0.002330602392196971,133.92313116723363,COMPLETE
891,0.42523783445358276,2023-09-04 21:26:30.384091,2023-09-04 21:26:33.334896,0 days 00:00:02.950805,Tanh,ReLU,,,75,17,14.0,,,0.00017168504661190588,2,310,0.7735819051806008,0.00012376642607971357,305.32958689043596,COMPLETE
892,0.33900704979896545,2023-09-04 21:26:33.335267,2023-09-04 21:26:33.663146,0 days 00:00:00.327879,Leaky,Leaky,,,83,19,22.0,,,0.025156406795956005,2,292,0.709911374384558,0.009336982177305468,273.72083906693894,COMPLETE
893,0.6089965105056763,2023-09-04 21:26:33.663653,2023-09-04 21:26:34.246849,0 days 00:00:00.583196,Tanh,Tanh,,,77,18,24.0,,,0.010300801720733365,2,488,0.7984203901765001,0.0955376022128209,229.08299005681818,COMPLETE
894,0.28081369400024414,2023-09-04 21:26:34.247229,2023-09-04 21:26:34.808457,0 days 00:00:00.561228,Leaky,ReLU,,,81,17,13.0,,,0.015518311832829248,2,261,0.6546504330343634,0.00019913141430873536,218.27102661132812,COMPLETE
895,0.4752172529697418,2023-09-04 21:26:34.808844,2023-09-04 21:26:35.283610,0 days 00:00:00.474766,Tanh,Tanh,,,85,18,11.0,,,0.0006092185634257838,2,283,0.10581072654706697,9.50505025127054e-05,201.89907796475575,COMPLETE
896,0.3751310110092163,2023-09-04 21:26:35.283982,2023-09-04 21:26:35.448634,0 days 00:00:00.164652,Tanh,Leaky,,,79,17,12.0,,,0.019358178477270605,2,320,0.25443435123660946,0.00015051885809160936,200.7178816361861,COMPLETE
897,0.41972965002059937,2023-09-04 21:26:35.449015,2023-09-04 21:26:38.416345,0 days 00:00:02.967330,Sigmoid,Tanh,,,75,19,18.0,,,0.0006920455038731191,2,299,0.7574396840318167,0.006308421990036719,258.8322804938989,COMPLETE
898,0.48339083790779114,2023-09-04 21:26:38.416732,2023-09-04 21:26:38.600919,0 days 00:00:00.184187,Leaky,ReLU,,,83,18,8.0,,,0.007484027013158862,2,204,0.1878339006524912,0.00012651274194481934,336.94965890737683,COMPLETE
899,0.5631870031356812,2023-09-04 21:26:38.601307,2023-09-04 21:26:39.847789,0 days 00:00:01.246482,ReLU,Tanh,,,61,18,6.0,,,0.00010118229616464688,2,304,0.26098420478823786,0.026658917571022924,148.44272972408095,COMPLETE
900,0.35020822286605835,2023-09-04 21:26:39.848179,2023-09-04 21:26:40.187189,0 days 00:00:00.339010,Tanh,ReLU,,,80,19,23.0,,,0.023460278770586155,2,278,0.5967237113354374,0.0010642124640908247,294.7508376272101,COMPLETE
901,0.4332870841026306,2023-09-04 21:26:40.187632,2023-09-04 21:26:40.318661,0 days 00:00:00.131029,Leaky,Tanh,,,52,17,16.0,,,0.03788239323080868,2,293,0.13123895665901544,0.0015852662059951867,338.4206685033338,COMPLETE
902,0.3235260248184204,2023-09-04 21:26:40.319124,2023-09-04 21:26:42.981552,0 days 00:00:02.662428,Tanh,Leaky,,,81,16,22.0,,,0.0003022896490733548,2,471,0.6205283395751084,4.2148467287464566e-05,454.2946819073587,COMPLETE
903,0.3586360514163971,2023-09-04 21:26:42.982016,2023-09-04 21:26:43.653853,0 days 00:00:00.671837,Tanh,Tanh,,,26,20,11.0,,,0.0054828544925281456,2,376,0.4708114941057252,0.00017245313495576565,168.65179519653321,COMPLETE
904,0.47522684931755066,2023-09-04 21:26:43.654361,2023-09-04 21:26:46.485218,0 days 00:00:02.830857,Leaky,ReLU,,,77,18,12.0,,,0.00012133230971018347,2,314,0.7371149666120035,6.066177231488274e-05,333.5975398895847,COMPLETE
905,0.41467514634132385,2023-09-04 21:26:46.485584,2023-09-04 21:26:46.690394,0 days 00:00:00.204810,Tanh,Tanh,,,75,19,7.0,,,0.02949416925641288,2,398,0.3619795016884328,7.827905096071793e-05,5697.327954101563,COMPLETE
906,0.30726000666618347,2023-09-04 21:26:46.690788,2023-09-04 21:26:47.068471,0 days 00:00:00.377683,Leaky,Leaky,,,78,17,24.0,,,0.013818569345068109,2,493,0.7997415349438906,0.00010758010935986482,254.42533180930397,COMPLETE
907,0.3738376498222351,2023-09-04 21:26:47.068853,2023-09-04 21:26:47.343523,0 days 00:00:00.274670,ReLU,ReLU,,,84,14,21.0,,,0.05163327878025901,2,237,0.5465436055186326,0.00022689118964740434,154.9686263113311,COMPLETE
908,0.49923020601272583,2023-09-04 21:26:47.343906,2023-09-04 21:26:47.560955,0 days 00:00:00.217049,Tanh,Tanh,,,15,17,23.0,,,0.017667019201176387,2,479,0.11097013469057565,0.0003032888447003396,155.433571879069,COMPLETE
909,0.32776758074760437,2023-09-04 21:26:47.561326,2023-09-04 21:26:47.889068,0 days 00:00:00.327742,Leaky,Tanh,,,90,18,13.0,,,0.02421831516327113,2,289,0.6920483370034015,0.0001394201831433168,152.00930698939732,COMPLETE
910,0.48594018816947937,2023-09-04 21:26:47.889440,2023-09-04 21:26:50.637033,0 days 00:00:02.747593,Tanh,ReLU,,,81,19,8.0,,,0.00020574168143815854,2,307,0.7638994545656806,8.943874229429708e-05,308.0789090631839,COMPLETE
911,0.39890599250793457,2023-09-04 21:26:50.637421,2023-09-04 21:26:50.937584,0 days 00:00:00.300163,Tanh,Sigmoid,,,49,18,12.0,,,0.008584137470485685,2,275,0.19268434482861133,0.001402041852778177,143.26301862191463,COMPLETE
912,0.3516159653663635,2023-09-04 21:26:50.937949,2023-09-04 21:26:52.565747,0 days 00:00:01.627798,Sigmoid,Leaky,,,82,20,11.0,,,0.0014333580073528423,2,300,0.4467729263454523,0.00016753472964535412,134.73705520629883,COMPLETE
913,0.5611769556999207,2023-09-04 21:26:52.566111,2023-09-04 21:27:03.062561,0 days 00:00:10.496450,Leaky,Tanh,,,10,16,7.0,,,1.1761790816687618e-05,2,249,0.7214298652622073,0.05567841108551491,182.66858642455566,COMPLETE
914,0.9484396576881409,2023-09-04 21:27:03.062926,2023-09-04 21:27:03.876668,0 days 00:00:00.813742,Tanh,ReLU,,,79,19,9.0,,,2.183996087983001e-05,2,327,0.17810325688232034,0.00012230308584336989,108.07563634749947,COMPLETE
915,0.25416994094848633,2023-09-04 21:27:03.877042,2023-09-04 21:27:04.335390,0 days 00:00:00.458348,Leaky,Tanh,,,87,17,10.0,,,0.03255839685944498,2,264,0.7702675201948999,0.00010682329033322798,244.09657171498174,COMPLETE
916,0.3243465721607208,2023-09-04 21:27:04.335782,2023-09-04 21:27:04.742004,0 days 00:00:00.406222,Tanh,,,,89,16,,,,0.029159834231361686,1,266,0.7046403873311531,0.00010060479171552207,201.475094265408,COMPLETE
917,0.3279328942298889,2023-09-04 21:27:04.742454,2023-09-04 21:27:05.739349,0 days 00:00:00.996895,ReLU,Tanh,,,91,16,11.0,,,0.0026764329989888425,2,257,0.7441445280213981,0.0001090510652167015,174.31836315709302,COMPLETE
918,0.44379469752311707,2023-09-04 21:27:05.739746,2023-09-04 21:27:06.107294,0 days 00:00:00.367548,Leaky,Tanh,,,86,17,23.0,,,0.004552495121020456,2,262,0.6846016150655628,0.00465686308904509,147.55628556471603,COMPLETE
919,0.28935104608535767,2023-09-04 21:27:06.107703,2023-09-04 21:27:06.536189,0 days 00:00:00.428486,Tanh,Tanh,,,90,17,8.0,,,0.021315708711260744,2,254,0.6479319471114532,0.00013213714302624503,187.96453123826248,COMPLETE
920,0.30596500635147095,2023-09-04 21:27:06.536561,2023-09-04 21:27:06.946393,0 days 00:00:00.409832,Tanh,Tanh,,,88,15,22.0,,,0.01272020597870729,2,268,0.7420382119996735,0.0001518695878140843,859.6423746744791,COMPLETE
921,0.42268648743629456,2023-09-04 21:27:06.946797,2023-09-04 21:27:07.314692,0 days 00:00:00.367895,Leaky,Tanh,,,95,17,9.0,,,0.016911031938112102,2,269,0.7670952060224798,0.025860375297217648,467.51556396484375,COMPLETE
922,0.3752579987049103,2023-09-04 21:27:07.315091,2023-09-04 21:27:08.232469,0 days 00:00:00.917378,Tanh,Tanh,,,92,16,14.0,,,0.0029620384947411766,2,259,0.7184258621936138,8.749395757641218e-05,181.9481873638862,COMPLETE
923,0.335675984621048,2023-09-04 21:27:08.232855,2023-09-04 21:27:08.930809,0 days 00:00:00.697954,Leaky,Tanh,Tanh,,85,17,12.0,11.0,,0.026995069338694676,3,246,0.7718042986787587,0.00020065392639755225,396.56682801246643,COMPLETE
924,0.4152524769306183,2023-09-04 21:27:08.931199,2023-09-04 21:27:09.848085,0 days 00:00:00.916886,Sigmoid,Tanh,,,88,16,10.0,,,0.001978874183189212,2,243,0.23723679594283897,0.00011061535864472043,139.17745287231946,COMPLETE
925,0.36614835262298584,2023-09-04 21:27:09.848760,2023-09-04 21:27:10.725586,0 days 00:00:00.876826,Tanh,Tanh,,,86,17,24.0,,,0.041943061014744605,2,274,0.6751875993303754,0.005240233568905354,13003.089725889009,COMPLETE
926,0.485323041677475,2023-09-04 21:27:10.725978,2023-09-04 21:27:11.229672,0 days 00:00:00.503694,ReLU,Tanh,,,83,17,11.0,,,0.0008017356775250119,2,266,0.19434442129690319,0.00013166214829610034,166.48828102427828,COMPLETE
927,0.41309911012649536,2023-09-04 21:27:11.230048,2023-09-04 21:27:11.442215,0 days 00:00:00.212167,Leaky,Tanh,,,86,16,11.0,,,0.020801965512116452,2,232,0.31479205971782026,0.0035988828843682586,533.4070360137196,COMPLETE
928,0.6487661004066467,2023-09-04 21:27:11.442608,2023-09-04 21:27:13.562645,0 days 00:00:02.120037,Tanh,Tanh,,,87,15,8.0,,,1.8492214136666707e-05,2,258,0.7402245301093976,0.001940349237228627,158.0640491515167,COMPLETE
929,0.33891481161117554,2023-09-04 21:27:13.563032,2023-09-04 21:27:13.838810,0 days 00:00:00.275778,Tanh,Tanh,,,88,17,23.0,,,0.03297677213241291,2,282,0.3919934900474622,0.0001678148856230889,293.93377653081365,COMPLETE
930,0.3314935863018036,2023-09-04 21:27:13.839232,2023-09-04 21:27:14.331621,0 days 00:00:00.492389,Leaky,Tanh,,,84,10,12.0,,,0.015524469411336079,2,281,0.4251229714322744,0.0002687931065766008,255.0848159790039,COMPLETE
931,0.3486599028110504,2023-09-04 21:27:14.332029,2023-09-04 21:27:15.162457,0 days 00:00:00.830428,Tanh,Tanh,,,85,18,10.0,,,0.0035397387426585516,2,175,0.7052267675863014,0.00044898592786291313,265.4184140864107,COMPLETE
932,0.5635585784912109,2023-09-04 21:27:15.162841,2023-09-04 21:27:16.324555,0 days 00:00:01.161714,Leaky,Tanh,,,83,17,9.0,,,0.00018214227559173478,2,494,0.17353110169497388,7.394010542212672e-05,160.68641630165007,COMPLETE
933,0.4959796369075775,2023-09-04 21:27:16.324935,2023-09-04 21:27:16.668128,0 days 00:00:00.343193,Tanh,ReLU,,,81,20,24.0,,,0.011757780337030923,2,251,0.5210805433172919,0.0456461920665293,194.4281864995542,COMPLETE
934,0.6103243827819824,2023-09-04 21:27:16.668512,2023-09-04 21:27:16.886586,0 days 00:00:00.218074,Leaky,Sigmoid,,,76,1,11.0,,,0.026429190446905098,2,274,0.4754304416378203,0.00010487297146206236,230.69939940316337,COMPLETE
935,0.6826655864715576,2023-09-04 21:27:16.886971,2023-09-04 21:27:17.946754,0 days 00:00:01.059783,Tanh,Tanh,,,88,18,10.0,,,5.1832919396469785e-05,2,286,0.2960146588979069,0.00020304836594126855,468.73873842679535,COMPLETE
936,0.3626677691936493,2023-09-04 21:27:17.947149,2023-09-04 21:27:18.693234,0 days 00:00:00.746085,ReLU,Tanh,,,79,8,5.0,,,0.019134888673414924,2,224,0.7687371265061592,8.73742932423387e-05,191.7594855870956,COMPLETE
937,0.5002605319023132,2023-09-04 21:27:18.693626,2023-09-04 21:27:20.937960,0 days 00:00:02.244334,Sigmoid,ReLU,,,86,18,13.0,,,0.0004410081537846895,2,355,0.5398136856410582,1.153631022532401e-05,271.7333107961735,COMPLETE
938,0.39169490337371826,2023-09-04 21:27:20.938350,2023-09-04 21:27:21.135835,0 days 00:00:00.197485,Tanh,Tanh,,,77,16,17.0,,,0.023128535816621287,2,500,0.3533109516964805,0.00014654158187303923,154.95259537235384,COMPLETE
939,0.2596311867237091,2023-09-04 21:27:21.136218,2023-09-04 21:27:21.625073,0 days 00:00:00.488855,Leaky,ReLU,,,82,17,7.0,,,0.010017607829433384,2,480,0.7994904105559426,0.0009061034605752313,114.99785110798288,COMPLETE
940,0.2912670075893402,2023-09-04 21:27:21.625449,2023-09-04 21:27:22.318160,0 days 00:00:00.692711,Leaky,ReLU,,,84,17,6.0,,,0.011178397094704699,2,492,0.7347454611526232,0.0013572341109660748,213.80993029945776,COMPLETE
941,0.3434602618217468,2023-09-04 21:27:22.318541,2023-09-04 21:27:22.823240,0 days 00:00:00.504699,Leaky,ReLU,,,82,16,6.0,,,0.013957746116208966,2,492,0.7733395092940825,0.0003783015335191534,122.56351455987668,COMPLETE
942,0.5118677616119385,2023-09-04 21:27:22.823626,2023-09-04 21:27:26.565559,0 days 00:00:03.741933,Leaky,ReLU,,,82,17,7.0,,,4.611887407725241e-05,2,468,0.7045372284172959,0.003137026391522133,159.87589353577704,COMPLETE
943,0.3147861063480377,2023-09-04 21:27:26.565955,2023-09-04 21:27:27.062703,0 days 00:00:00.496748,Leaky,ReLU,,,84,17,6.0,,,0.010397474382547406,2,473,0.60698817727481,0.0010918964688052715,234.23328566551208,COMPLETE
944,0.6674217581748962,2023-09-04 21:27:27.063102,2023-09-04 21:27:31.419799,0 days 00:00:04.356697,Leaky,ReLU,,,80,17,7.0,,,3.022379466572934e-05,2,480,0.7992148849975466,0.0006601007356136849,118.0813631216685,COMPLETE
945,0.42488354444503784,2023-09-04 21:27:31.420207,2023-09-04 21:27:31.691952,0 days 00:00:00.271745,Leaky,ReLU,,,83,15,7.0,,,0.016545548945785825,2,215,0.2182686336269987,0.002107112401612737,137.05268184955304,COMPLETE
946,0.41815894842147827,2023-09-04 21:27:31.692347,2023-09-04 21:27:31.853216,0 days 00:00:00.160869,Leaky,ReLU,,,81,16,8.0,,,0.01890240149374664,2,457,0.13154267971785247,0.002615171815951894,411.1184811062283,COMPLETE
947,0.37562036514282227,2023-09-04 21:27:31.853616,2023-09-04 21:27:32.075802,0 days 00:00:00.222186,Leaky,ReLU,,,85,17,8.0,,,0.03238610451349952,2,476,0.20888809159643856,0.012843067201414364,186.1388064066569,COMPLETE
948,0.4395158588886261,2023-09-04 21:27:32.076196,2023-09-04 21:27:32.202084,0 days 00:00:00.125888,Leaky,ReLU,,,80,16,7.0,,,0.014273096054177412,2,480,0.12422379269351229,0.0005577513403813083,195.74667021807502,COMPLETE
949,0.34226858615875244,2023-09-04 21:27:32.202506,2023-09-04 21:27:32.673298,0 days 00:00:00.470792,Leaky,ReLU,,,87,17,7.0,,,0.009345752408434313,2,484,0.36589241556862634,0.0016257854758787624,310.815449764854,COMPLETE
950,0.3431190848350525,2023-09-04 21:27:32.673697,2023-09-04 21:27:32.913818,0 days 00:00:00.240121,Leaky,ReLU,,,84,17,8.0,,,0.04018129655943157,2,466,0.745334988034459,0.0009946556723801686,166.1868911016555,COMPLETE
951,0.30488452315330505,2023-09-04 21:27:32.914220,2023-09-04 21:27:33.316229,0 days 00:00:00.402009,Leaky,ReLU,,,82,17,7.0,,,0.02333879985048012,2,486,0.4979038130948623,0.0004025292019835576,183.0992386916588,COMPLETE
952,0.4318634271621704,2023-09-04 21:27:33.316638,2023-09-04 21:27:33.551127,0 days 00:00:00.234489,Leaky,ReLU,,,79,9,7.0,,,0.01354818690985335,2,473,0.1846062539870585,0.0006390451519608999,143.73317983876103,COMPLETE
953,0.326602578163147,2023-09-04 21:27:33.551497,2023-09-04 21:27:34.003405,0 days 00:00:00.451908,Leaky,ReLU,,,47,18,20.0,,,0.029221731409473675,2,488,0.6689481521282662,0.0007377812616343419,116.58547486199274,COMPLETE
954,0.3759312331676483,2023-09-04 21:27:34.003816,2023-09-04 21:27:34.393458,0 days 00:00:00.389642,Leaky,ReLU,,,81,16,8.0,,,0.019020450874206736,2,472,0.5877063085517228,0.007823735025519491,182.7749465630979,COMPLETE
955,0.5167376399040222,2023-09-04 21:27:34.393835,2023-09-04 21:27:38.712225,0 days 00:00:04.318390,Leaky,Sigmoid,,,79,17,6.0,,,0.00022593355976958506,2,482,0.7680609821427796,0.0002475206707762229,164.90086698729962,COMPLETE
956,0.3943289816379547,2023-09-04 21:27:38.712623,2023-09-04 21:27:39.037858,0 days 00:00:00.325235,Leaky,Tanh,,,89,16,9.0,,,0.01572334341982491,2,485,0.4091781678507984,0.0010051024751606512,145.3585193562058,COMPLETE
957,0.3774415850639343,2023-09-04 21:27:39.038237,2023-09-04 21:27:39.278638,0 days 00:00:00.240401,Leaky,ReLU,,,83,18,7.0,,,0.051102189658021054,2,384,0.6380682782256518,0.00027809277689232333,158.93486245473227,COMPLETE
958,0.34968093037605286,2023-09-04 21:27:39.279035,2023-09-04 21:27:39.815392,0 days 00:00:00.536357,ReLU,Tanh,,,78,17,15.0,,,0.011479429964567023,2,414,0.7224187455049951,0.003163218176122566,192.5215409712358,COMPLETE
959,0.45300862193107605,2023-09-04 21:27:39.815774,2023-09-04 21:27:39.921251,0 days 00:00:00.105477,Leaky,Tanh,,,86,18,22.0,,,0.03536338967446909,2,192,0.11182820484337136,0.06615886415061625,176.4686514047476,COMPLETE
960,0.442142128944397,2023-09-04 21:27:39.921629,2023-09-04 21:27:44.180124,0 days 00:00:04.258495,Leaky,ReLU,,,92,13,9.0,,,0.00011418363569627476,2,494,0.7457366728926359,0.0008460129609953527,178.13930465142255,COMPLETE
961,0.4393756091594696,2023-09-04 21:27:44.180508,2023-09-04 21:27:44.642919,0 days 00:00:00.462411,Sigmoid,Sigmoid,,,82,18,8.0,,,0.024038526208463383,2,465,0.6936012080120643,0.004528761213967256,268.1994658825444,COMPLETE
962,0.550412654876709,2023-09-04 21:27:44.643347,2023-09-04 21:27:45.923364,0 days 00:00:01.280017,Leaky,Tanh,,,80,17,23.0,,,9.572089538888806e-05,2,138,0.7683948089279604,0.001300271731789896,242.50601085718128,COMPLETE
963,0.41273990273475647,2023-09-04 21:27:45.923731,2023-09-04 21:27:46.187104,0 days 00:00:00.263373,Leaky,ReLU,,,78,18,8.0,,,0.02087337357651091,2,313,0.27670475576909687,0.002197261949712415,235.76878093851025,COMPLETE
964,0.3358260989189148,2023-09-04 21:27:46.187482,2023-09-04 21:27:46.564268,0 days 00:00:00.376786,ReLU,Tanh,,,84,17,9.0,,,0.02842206998475878,2,500,0.7255825576900967,0.0008327564212757976,173.90253233298276,COMPLETE
965,0.35220420360565186,2023-09-04 21:27:46.564638,2023-09-04 21:27:46.833585,0 days 00:00:00.268947,Leaky,Tanh,,,81,16,24.0,,,0.042515616233611817,2,301,0.7760013182104941,0.0024756129198317545,904.1327833092731,COMPLETE
966,0.3812439441680908,2023-09-04 21:27:46.833959,2023-09-04 21:27:49.058885,0 days 00:00:02.224926,Leaky,ReLU,,,41,17,10.0,,,0.00037354632857818635,2,293,0.4089272002175638,0.00018360804497773593,476.2146204404863,COMPLETE
967,0.3397451639175415,2023-09-04 21:27:49.059255,2023-09-04 21:27:49.341435,0 days 00:00:00.282180,Leaky,Sigmoid,,,77,18,7.0,,,0.017990379197015124,2,204,0.3301442869590412,0.00034442618626513824,198.95305475198998,COMPLETE
968,0.3261735141277313,2023-09-04 21:27:49.341815,2023-09-04 21:27:49.785327,0 days 00:00:00.443512,ReLU,Tanh,,,85,18,23.0,,,0.013245355520616812,2,288,0.7437078989623734,0.0005289479552157205,131.83363054063585,COMPLETE
969,0.8074926137924194,2023-09-04 21:27:49.785698,2023-09-04 21:27:52.484897,0 days 00:00:02.699199,Sigmoid,ReLU,,,87,16,21.0,,,1.5940187353697392e-05,2,338,0.6870731517333887,0.00032109343079122875,112.79947337314222,COMPLETE
