number,value,datetime_start,datetime_complete,duration,params_activation1,params_activation2,params_activation3,params_activation4,params_batch_size,params_fl1,params_fl2,params_fl3,params_fl4,params_learning_rate,params_n_layers,params_num_epochs,params_train_size,params_weight_decay,user_attrs_mre,state
1504,0.3616819381713867,2023-09-04 22:17:14.410482,2023-09-04 22:17:14.781371,0 days 00:00:00.370889,Leaky,Leaky,Leaky,,12,12,19.0,14.0,,0.01171013348913228,3,343,0.15594902720738077,0.002312782041166846,112.5025166102818,COMPLETE
1505,0.28321927785873413,2023-09-04 22:17:14.781872,2023-09-04 22:17:16.877391,0 days 00:00:02.095519,Leaky,ReLU,Leaky,,17,9,18.0,18.0,,0.020346683081882817,3,352,0.7991988706091429,0.0038251802735481968,110.37381915656887,COMPLETE
1506,0.3439629077911377,2023-09-04 22:17:16.878014,2023-09-04 22:17:32.123598,0 days 00:00:15.245584,Leaky,Leaky,Leaky,,15,13,19.0,15.0,,2.6208873376977924e-05,3,377,0.749188876687862,0.0012454094137221785,109.71275347803252,COMPLETE
1507,0.3101148009300232,2023-09-04 22:17:32.124062,2023-09-04 22:17:35.261433,0 days 00:00:03.137371,Leaky,Leaky,Leaky,,10,12,20.0,13.0,,0.00773614328351037,3,388,0.7745877711062927,0.005602572896601534,93.07827589246962,COMPLETE
1508,0.32816189527511597,2023-09-04 22:17:35.261889,2023-09-04 22:17:36.556326,0 days 00:00:01.294437,Leaky,Leaky,Leaky,,18,8,18.0,14.0,,0.013437619502163151,3,364,0.7149894578015666,0.008059940016983807,105.33935031890869,COMPLETE
1509,0.3872566819190979,2023-09-04 22:17:36.556833,2023-09-04 22:17:37.030095,0 days 00:00:00.473262,Leaky,ReLU,Leaky,,15,11,21.0,16.0,,0.010071209339299956,3,388,0.3842803249971442,0.028931253870616614,126.03848627993935,COMPLETE
1510,0.39823266863822937,2023-09-04 22:17:37.030573,2023-09-04 22:17:37.771932,0 days 00:00:00.741359,Leaky,Leaky,Leaky,,12,12,19.0,18.0,,0.016921751567365875,3,374,0.20769877771471484,0.00022120105270848346,109.9489323425293,COMPLETE
1511,0.3640716075897217,2023-09-04 22:17:37.772447,2023-09-04 22:17:38.096646,0 days 00:00:00.324199,Leaky,Leaky,Leaky,,18,20,20.0,17.0,,0.01181312691537577,3,356,0.19284519550299867,0.00011005517878711467,130.5287579345703,COMPLETE
1512,0.43204402923583984,2023-09-04 22:17:38.097137,2023-09-04 22:17:39.450005,0 days 00:00:01.352868,Leaky,Leaky,Leaky,,14,14,18.0,15.0,,0.005923805376312652,3,347,0.7709093406646832,0.0715645409434,106.952135403951,COMPLETE
1513,0.3010827302932739,2023-09-04 22:17:39.450478,2023-09-04 22:17:42.831913,0 days 00:00:03.381435,Leaky,ReLU,Leaky,,16,13,18.0,20.0,,0.008837119814617623,3,364,0.7443552125318719,0.0010757119773276934,104.10827956661102,COMPLETE
1514,0.30530640482902527,2023-09-04 22:17:42.832781,2023-09-04 22:17:44.050365,0 days 00:00:01.217584,Leaky,Leaky,Leaky,,18,17,19.0,14.0,,0.014291402164903376,3,338,0.7139143001598778,5.181591106004763e-05,97.5393567766462,COMPLETE
1515,0.36716994643211365,2023-09-04 22:17:44.050856,2023-09-04 22:17:45.190509,0 days 00:00:01.139653,Leaky,Leaky,Leaky,,10,11,19.0,13.0,,0.020520608085240078,3,381,0.7692384110037523,0.0002508977307679216,101.30381817287869,COMPLETE
1516,0.36289578676223755,2023-09-04 22:17:45.191004,2023-09-04 22:17:45.859940,0 days 00:00:00.668936,Leaky,Leaky,Leaky,,19,11,18.0,19.0,,0.010402793710296008,3,371,0.3009159233521917,7.413537747133919e-05,171.51737876560378,COMPLETE
1517,0.3475838005542755,2023-09-04 22:17:45.860421,2023-09-04 22:17:47.018033,0 days 00:00:01.157612,Leaky,Leaky,Leaky,,16,12,19.0,16.0,,0.007332643795840185,3,325,0.7989610175690138,0.00017084369512305518,96.76796354096511,COMPLETE
1518,0.3535040318965912,2023-09-04 22:17:47.018528,2023-09-04 22:17:47.538613,0 days 00:00:00.520085,Leaky,ReLU,Leaky,,14,24,20.0,14.0,,0.016685730680741525,3,92,0.2850976174839037,0.0001289772739352163,165.53294190906342,COMPLETE
1519,0.2984497547149658,2023-09-04 22:17:47.539152,2023-09-04 22:17:49.261769,0 days 00:00:01.722617,Leaky,Leaky,Leaky,,19,10,18.0,15.0,,0.012675783888556206,3,355,0.5076746183949601,0.0003556500135685347,110.51984672546386,COMPLETE
1520,0.3160446882247925,2023-09-04 22:17:49.262260,2023-09-04 22:17:50.381045,0 days 00:00:01.118785,Leaky,Leaky,Leaky,,16,11,19.0,20.0,,0.022892765821624333,3,379,0.7406659709310401,5.888969659027074e-05,116.37382227579752,COMPLETE
1521,0.3448823094367981,2023-09-04 22:17:50.381533,2023-09-04 22:17:51.109887,0 days 00:00:00.728354,Leaky,Tanh,Leaky,,13,22,20.0,14.0,,0.008991192854588164,3,391,0.34911785575629567,0.020160928023203403,109.58992816555885,COMPLETE
1522,0.37588489055633545,2023-09-04 22:17:51.110378,2023-09-04 22:17:52.307192,0 days 00:00:01.196814,Leaky,Leaky,Leaky,,20,2,18.0,13.0,,0.014557283643598163,3,361,0.799267570344647,0.00020939127845195986,85.01465214909734,COMPLETE
1523,0.3848266899585724,2023-09-04 22:17:52.307678,2023-09-04 22:17:59.094021,0 days 00:00:06.786343,Tanh,ReLU,Leaky,,17,12,21.0,13.0,,4.660699289297932e-05,3,350,0.3570017836767002,0.0015050148438875504,113.51919825962612,COMPLETE
1524,0.36094677448272705,2023-09-04 22:17:59.094506,2023-09-04 22:17:59.644892,0 days 00:00:00.550386,Tanh,Leaky,Leaky,,19,13,19.0,16.0,,0.05100691347596966,3,340,0.690865212766624,0.00026599486678083523,101.22251272201538,COMPLETE
1525,0.3654172718524933,2023-09-04 22:17:59.645435,2023-09-04 22:18:00.686204,0 days 00:00:01.040769,Leaky,Leaky,Leaky,,12,12,18.0,14.0,,0.06414475289857914,3,370,0.7244042954365343,2.353859135954139e-05,133.93084716796875,COMPLETE
1526,0.3342278003692627,2023-09-04 22:18:00.686695,2023-09-04 22:18:01.708736,0 days 00:00:01.022041,Tanh,Leaky,Leaky,,15,11,20.0,15.0,,0.006958289963835602,3,387,0.749844746964986,0.013578006965820313,115.10568725585938,COMPLETE
1527,0.29076912999153137,2023-09-04 22:18:01.709231,2023-09-04 22:18:03.694257,0 days 00:00:01.985026,Tanh,ReLU,Leaky,,17,10,18.0,8.0,,0.011135851108840073,3,331,0.7742987982839322,0.0008412014732834,103.57100202772352,COMPLETE
1528,0.7222015261650085,2023-09-04 22:18:03.694730,2023-09-04 22:18:07.097887,0 days 00:00:03.403157,Tanh,Leaky,Leaky,,20,21,19.0,13.0,,1.0209585609708688e-05,3,377,0.21400729451283834,0.0001468723813282479,112.64881140104339,COMPLETE
1529,0.3170153498649597,2023-09-04 22:18:07.098381,2023-09-04 22:18:08.495853,0 days 00:00:01.397472,Tanh,Leaky,ReLU,,18,9,20.0,17.0,,0.018396054845359965,3,361,0.5708518762250941,2.009389659128318e-05,1604.0790670142983,COMPLETE
1530,0.447978138923645,2023-09-04 22:18:08.496335,2023-09-04 22:18:08.744431,0 days 00:00:00.248096,Tanh,Leaky,Leaky,,21,11,21.0,14.0,,0.07831363219964833,3,393,0.1411285401288039,0.009812039584895994,115.2721325267445,COMPLETE
1531,0.2952916622161865,2023-09-04 22:18:08.744928,2023-09-04 22:18:10.240352,0 days 00:00:01.495424,Tanh,ReLU,Leaky,,14,12,18.0,15.0,,0.008551180298882926,3,345,0.5324708567326406,3.478780467301724e-05,103.04765506666534,COMPLETE
1532,0.26964789628982544,2023-09-04 22:18:10.240850,2023-09-04 22:18:11.274789,0 days 00:00:01.033939,Tanh,Leaky,Tanh,,16,13,19.0,8.0,,0.012647389770624573,3,369,0.7995923848838059,1.6136263683165484e-05,87.13507934570312,COMPLETE
1533,0.38659748435020447,2023-09-04 22:18:11.275282,2023-09-04 22:18:11.717969,0 days 00:00:00.442687,Leaky,Leaky,Leaky,,20,10,11.0,19.0,,0.043010753285721674,3,357,0.4369304110403538,4.883910568729067e-05,113.24695145456414,COMPLETE
1534,0.3178844153881073,2023-09-04 22:18:11.718482,2023-09-04 22:18:13.364789,0 days 00:00:01.646307,Tanh,Leaky,Leaky,,18,23,12.0,16.0,,0.005783134294821265,3,383,0.7055678718152004,9.062171969746853e-05,95.02482021556182,COMPLETE
1535,0.351608544588089,2023-09-04 22:18:13.365277,2023-09-04 22:18:14.013643,0 days 00:00:00.648366,Tanh,ReLU,Leaky,,10,12,19.0,13.0,,0.010049802451365367,3,350,0.13416297916159442,0.0032659822559877863,111.69194360212846,COMPLETE
1536,0.5531339049339294,2023-09-04 22:18:14.014138,2023-09-04 22:18:15.867917,0 days 00:00:01.853779,Tanh,Leaky,Leaky,,21,11,18.0,14.0,,4.96046911679545e-05,3,394,0.1006371380602828,0.004638579521629923,109.75365970824576,COMPLETE
1537,0.36485832929611206,2023-09-04 22:18:15.868390,2023-09-04 22:18:19.433956,0 days 00:00:03.565566,Tanh,Leaky,Leaky,,12,12,20.0,23.0,,6.274433654863097e-05,3,147,0.38795313477674614,0.0018701293213684456,108.02646237327939,COMPLETE
1538,0.38038626313209534,2023-09-04 22:18:19.434445,2023-09-04 22:18:20.277076,0 days 00:00:00.842631,Sigmoid,Leaky,Leaky,,19,16,18.0,12.0,,0.016399690161609918,3,373,0.25205323118921197,0.0003081827369596963,383.3589898767606,COMPLETE
1539,0.3447171449661255,2023-09-04 22:18:20.277555,2023-09-04 22:18:21.312694,0 days 00:00:01.035139,Tanh,ReLU,Leaky,,17,11,20.0,7.0,,0.021142651512509675,3,341,0.7442265676248477,0.0001164331100034158,104.82625007629395,COMPLETE
1540,0.40461283922195435,2023-09-04 22:18:21.313181,2023-09-04 22:18:34.874551,0 days 00:00:13.561370,Tanh,Tanh,ReLU,,15,10,19.0,21.0,,1.655265890518568e-05,3,363,0.6884978797036564,6.653261479470757e-05,120.62815354612576,COMPLETE
1541,0.26837968826293945,2023-09-04 22:18:34.875425,2023-09-04 22:18:36.811688,0 days 00:00:01.936263,Leaky,Leaky,Leaky,,21,13,12.0,15.0,,0.006693396172102186,3,385,0.7688493253039123,0.0001849536210682066,111.54557110014416,COMPLETE
1542,0.2781229615211487,2023-09-04 22:18:36.812178,2023-09-04 22:18:37.784339,0 days 00:00:00.972161,Leaky,Leaky,Leaky,,20,13,11.0,15.0,,0.006478167949881041,3,391,0.7240665021175969,0.00021743316257571022,95.2352786064148,COMPLETE
1543,0.29091963171958923,2023-09-04 22:18:37.784838,2023-09-04 22:18:39.531643,0 days 00:00:01.746805,Leaky,Leaky,Leaky,,19,14,11.0,15.0,,0.005425097716550523,3,397,0.7001619995214673,0.00018242248814553212,1049.6103769938152,COMPLETE
1544,0.3203551471233368,2023-09-04 22:18:39.532167,2023-09-04 22:18:40.486569,0 days 00:00:00.954402,Leaky,Leaky,Leaky,,18,14,11.0,16.0,,0.006852674070074985,3,322,0.670166924374141,0.00018247710723427586,128.8299294748614,COMPLETE
1545,0.35180407762527466,2023-09-04 22:18:40.487075,2023-09-04 22:18:41.553045,0 days 00:00:01.065970,Leaky,Leaky,Leaky,,21,13,12.0,15.0,,0.005101901764262865,3,393,0.7492475207550529,0.00023176147312182005,99.6732450543028,COMPLETE
1546,0.36399707198143005,2023-09-04 22:18:41.553516,2023-09-04 22:18:42.154346,0 days 00:00:00.600830,Leaky,Leaky,Leaky,,20,13,13.0,15.0,,0.007940003922866735,3,378,0.3124086078448501,0.00016186619699253704,181.25803244986184,COMPLETE
1547,0.3130190074443817,2023-09-04 22:18:42.154823,2023-09-04 22:18:44.842513,0 days 00:00:02.687690,Leaky,Leaky,Leaky,,21,14,12.0,16.0,,0.007390821396606198,3,385,0.6163276491972604,0.00020331497860356777,109.31324947581572,COMPLETE
1548,0.30403804779052734,2023-09-04 22:18:44.842990,2023-09-04 22:18:46.317947,0 days 00:00:01.474957,Leaky,Leaky,Leaky,,17,14,12.0,15.0,,0.0063498247220276785,3,385,0.7307288930703482,0.00025748940161706915,107.56601644116779,COMPLETE
1549,0.2666299045085907,2023-09-04 22:18:46.318428,2023-09-04 22:18:47.657042,0 days 00:00:01.338614,Leaky,Leaky,Leaky,,18,13,11.0,15.0,,0.009180319437756466,3,341,0.769172699449587,0.00015243984838415328,89.46351212721605,COMPLETE
1550,0.2596377730369568,2023-09-04 22:18:47.657533,2023-09-04 22:18:49.346193,0 days 00:00:01.688660,Leaky,Leaky,Leaky,,14,13,10.0,14.0,,0.009250606557752257,3,334,0.7116211960452522,0.00017268803203558306,98.81057597315589,COMPLETE
1551,0.32609015703201294,2023-09-04 22:18:49.346681,2023-09-04 22:18:51.324138,0 days 00:00:01.977457,Leaky,Leaky,Leaky,,10,14,10.0,14.0,,0.00943397706580904,3,320,0.6532265394101232,0.0001394786575611777,182.19133440653482,COMPLETE
1552,0.38949212431907654,2023-09-04 22:18:51.324601,2023-09-04 22:18:51.873611,0 days 00:00:00.549010,Leaky,Leaky,Leaky,,12,13,9.0,14.0,,0.008801775230811288,3,316,0.2311141314405398,0.00014167565372294209,668.7799453735352,COMPLETE
1553,0.3222431540489197,2023-09-04 22:18:51.874104,2023-09-04 22:18:53.231639,0 days 00:00:01.357535,Leaky,Leaky,Leaky,,13,14,10.0,17.0,,0.007865200673944112,3,331,0.676908240654467,0.0001591609906991128,113.35698914527893,COMPLETE
1554,0.5281025767326355,2023-09-04 22:18:53.232282,2023-09-04 22:18:59.885688,0 days 00:00:06.653406,Leaky,Leaky,Leaky,,13,13,9.0,16.0,,4.060741275613153e-05,3,333,0.19516489697699704,0.00014817680295138588,188.99692979875627,COMPLETE
1555,0.363981157541275,2023-09-04 22:18:59.886493,2023-09-04 22:19:00.287328,0 days 00:00:00.400835,Leaky,Leaky,Leaky,,14,13,10.0,15.0,,0.00978492547133869,3,327,0.17602365902450848,0.0009090286099848868,167.74357223510742,COMPLETE
1556,0.3332517147064209,2023-09-04 22:19:00.287861,2023-09-04 22:19:02.419827,0 days 00:00:02.131966,Leaky,Leaky,Leaky,,14,14,11.0,17.0,,0.010526711491896346,3,319,0.7050618106854983,0.0028613506667344167,103.9875259399414,COMPLETE
1557,0.348168283700943,2023-09-04 22:19:02.420301,2023-09-04 22:19:03.429339,0 days 00:00:01.009038,Leaky,Leaky,Leaky,,12,14,11.0,14.0,,0.007984562246347074,3,329,0.6006791238861485,0.00012363740046676523,94.7576400756836,COMPLETE
1558,0.3058529794216156,2023-09-04 22:19:03.429894,2023-09-04 22:19:04.729999,0 days 00:00:01.300105,Leaky,Leaky,Leaky,,15,14,11.0,16.0,,0.010853161935804843,3,311,0.6418230556946433,1.4339464864407747e-05,97.12417702925832,COMPLETE
1559,0.39227747917175293,2023-09-04 22:19:04.730479,2023-09-04 22:19:05.088079,0 days 00:00:00.357600,Leaky,Leaky,Leaky,,12,13,10.0,15.0,,0.00958833354711591,3,334,0.11532843210883768,2.7643964830196077e-05,116.81174626069911,COMPLETE
1560,0.3208072781562805,2023-09-04 22:19:05.088539,2023-09-04 22:19:06.393415,0 days 00:00:01.304876,Leaky,Leaky,Leaky,,14,15,10.0,14.0,,0.008208476206684582,3,328,0.5121893681779378,0.0010760819231207068,173.9689690483941,COMPLETE
1561,0.3635338842868805,2023-09-04 22:19:06.393901,2023-09-04 22:19:07.688906,0 days 00:00:01.295005,Leaky,Leaky,Leaky,,10,13,10.0,13.0,,0.0058598745401142426,3,336,0.3652993738710905,0.0001692654448704819,156.38292793605638,COMPLETE
1562,0.4093032777309418,2023-09-04 22:19:07.689405,2023-09-04 22:19:07.965260,0 days 00:00:00.275855,Leaky,Leaky,Leaky,,16,14,10.0,16.0,,0.011630026410237585,3,324,0.11129360553786923,0.00036342157406288745,279.54346084594727,COMPLETE
1563,0.30971813201904297,2023-09-04 22:19:07.965731,2023-09-04 22:19:09.036627,0 days 00:00:01.070896,Leaky,Leaky,Leaky,,15,13,10.0,15.0,,0.03709013579707981,3,309,0.7226867022189601,3.478602966085358e-05,109.63894762311664,COMPLETE
1564,0.35350501537323,2023-09-04 22:19:09.037125,2023-09-04 22:19:11.208812,0 days 00:00:02.171687,Leaky,Leaky,Leaky,,12,13,10.0,14.0,,0.008276957306082912,3,340,0.4717056512344745,0.0003042318187790665,101.70635559082031,COMPLETE
1565,0.3784239590167999,2023-09-04 22:19:11.209347,2023-09-04 22:19:12.256750,0 days 00:00:01.047403,Leaky,Leaky,Leaky,,14,13,10.0,14.0,,0.012451331806886458,3,337,0.2517695940116152,0.0023323307979019963,122.10207950367646,COMPLETE
1566,0.4750973880290985,2023-09-04 22:19:12.257635,2023-09-04 22:19:18.556404,0 days 00:00:06.298769,Leaky,Leaky,Sigmoid,,16,13,9.0,8.0,,3.671569085381216e-05,3,320,0.3405423729112205,0.00011704544257351351,145.40831718444824,COMPLETE
1567,0.29734906554222107,2023-09-04 22:19:18.556882,2023-09-04 22:19:19.956413,0 days 00:00:01.399531,Leaky,Leaky,Tanh,,15,14,9.0,13.0,,0.0070982209057945875,3,341,0.6781210690725685,4.117702316050955e-05,109.21108088773839,COMPLETE
1568,0.34932559728622437,2023-09-04 22:19:19.956885,2023-09-04 22:19:20.625236,0 days 00:00:00.668351,Leaky,Leaky,Leaky,,12,13,9.0,9.0,,0.0052783934105261575,3,334,0.2717930105100766,0.00014592996457003064,111.27838314280791,COMPLETE
1569,0.38407352566719055,2023-09-04 22:19:20.625714,2023-09-04 22:19:21.018401,0 days 00:00:00.392687,Leaky,Leaky,Leaky,,16,13,11.0,15.0,,0.01010042049544214,3,326,0.16388548125568086,0.06543655394686682,193.186086164202,COMPLETE
1570,0.39803391695022583,2023-09-04 22:19:21.018870,2023-09-04 22:19:21.956913,0 days 00:00:00.938043,Leaky,Leaky,Leaky,,14,13,11.0,23.0,,0.057569429183253217,3,344,0.7681709630238323,0.0004646082965493169,155.363523937407,COMPLETE
1571,0.30638784170150757,2023-09-04 22:19:21.957409,2023-09-04 22:19:23.220818,0 days 00:00:01.263409,Leaky,ReLU,Leaky,,13,13,8.0,8.0,,0.01386750074104133,3,331,0.5491596918330695,0.00020889974967532238,97.12830071700246,COMPLETE
1572,0.4218536615371704,2023-09-04 22:19:23.221293,2023-09-04 22:19:23.852501,0 days 00:00:00.631208,Sigmoid,Leaky,Leaky,,16,13,10.0,14.0,,0.004617085304370833,3,316,0.15037012388592552,4.9928541664087966e-05,142.720424813284,COMPLETE
1573,0.40718457102775574,2023-09-04 22:19:23.853007,2023-09-04 22:19:35.560910,0 days 00:00:11.707903,Tanh,Leaky,Leaky,,15,14,11.0,13.0,,3.4432726349725936e-05,3,347,0.43882160700497846,0.0002470908661952103,126.95409487853476,COMPLETE
1574,0.5188037157058716,2023-09-04 22:19:35.561395,2023-09-04 22:19:36.608204,0 days 00:00:01.046809,Leaky,Leaky,Leaky,,10,14,11.0,16.0,,0.09403377039295129,3,339,0.7012891774706468,0.09088004170660899,127.38940474566292,COMPLETE
1575,0.3527950644493103,2023-09-04 22:19:36.608730,2023-09-04 22:19:38.215207,0 days 00:00:01.606477,Leaky,ReLU,ReLU,,13,22,9.0,7.0,,0.011248515119740203,3,344,0.7505292881317411,0.007189679140560303,103.77080688476562,COMPLETE
1576,0.3692580461502075,2023-09-04 22:19:38.215708,2023-09-04 22:19:39.089883,0 days 00:00:00.874175,Leaky,Leaky,Leaky,,17,12,11.0,22.0,,0.04235927073430128,3,325,0.47668174890304277,0.003655032421152935,124.25238757663303,COMPLETE
1577,0.3117120563983917,2023-09-04 22:19:39.090385,2023-09-04 22:19:40.303159,0 days 00:00:01.212774,Leaky,Leaky,Leaky,,16,15,10.0,15.0,,0.008575271271306556,3,344,0.7704753579249879,0.001442192453600622,94.96625125023627,COMPLETE
1578,0.4880817234516144,2023-09-04 22:19:40.303661,2023-09-04 22:19:42.507070,0 days 00:00:02.203409,Leaky,Leaky,Tanh,,17,20,10.0,23.0,,3.014269622705621e-05,3,335,0.12778417539514114,2.0692459503054243e-05,113.2465316772461,COMPLETE
1579,0.30501919984817505,2023-09-04 22:19:42.507544,2023-09-04 22:19:45.764912,0 days 00:00:03.257368,Leaky,ReLU,Leaky,,13,12,11.0,9.0,,0.006520616101600729,3,345,0.7993817596968069,0.0001730769374230131,97.49889526367187,COMPLETE
1580,0.3132793605327606,2023-09-04 22:19:45.765389,2023-09-04 22:19:46.308143,0 days 00:00:00.542754,Leaky,Leaky,Leaky,,17,13,9.0,12.0,,0.012994341762693555,3,303,0.2436155017210027,0.0017730422378178774,251.04915257504112,COMPLETE
1581,0.383436918258667,2023-09-04 22:19:46.308631,2023-09-04 22:19:49.952205,0 days 00:00:03.643574,Leaky,Leaky,Leaky,,10,23,12.0,8.0,,0.00010692500961374276,3,327,0.18666443666739832,2.930450019752993e-05,362.85311868217553,COMPLETE
1582,0.3579396903514862,2023-09-04 22:19:49.952754,2023-09-04 22:19:51.359599,0 days 00:00:01.406845,Leaky,Leaky,Leaky,,15,12,10.0,15.0,,0.009231371015950536,3,353,0.7327417582441569,0.00040971449456290093,102.11081963616448,COMPLETE
1583,0.35280880331993103,2023-09-04 22:19:51.360066,2023-09-04 22:19:51.915703,0 days 00:00:00.555637,Leaky,ReLU,Leaky,,18,13,11.0,18.0,,0.029182104342573942,3,350,0.40002047971608545,3.828272457898928e-05,111.49795766977164,COMPLETE
1584,0.38753587007522583,2023-09-04 22:19:51.916191,2023-09-04 22:19:53.345404,0 days 00:00:01.429213,Leaky,Leaky,Leaky,,12,12,11.0,14.0,,0.01130997011420372,3,333,0.7112243927021982,0.04735817059867159,115.46963211585735,COMPLETE
1585,0.3285541534423828,2023-09-04 22:19:53.345866,2023-09-04 22:19:54.560462,0 days 00:00:01.214596,Leaky,Tanh,Leaky,,17,21,10.0,7.0,,0.024442084567334783,3,354,0.6719947127863044,0.00011063028302836929,95.7635612487793,COMPLETE
1586,0.2670714855194092,2023-09-04 22:19:54.560944,2023-09-04 22:19:56.359112,0 days 00:00:01.798168,Leaky,Leaky,ReLU,Sigmoid,16,12,12.0,13.0,13.0,0.00740665358610174,4,316,0.5963648146472019,0.00079426446075777,93.82554910697189,COMPLETE
1587,0.4053238332271576,2023-09-04 22:19:56.359589,2023-09-04 22:19:56.623878,0 days 00:00:00.264289,Leaky,Leaky,Leaky,,14,13,11.0,17.0,,0.015506467031328148,3,343,0.14662896307057355,0.0002962674347351246,128.7216013858193,COMPLETE
1588,0.3646131753921509,2023-09-04 22:19:56.624360,2023-09-04 22:19:57.143306,0 days 00:00:00.518946,Leaky,ReLU,Leaky,,18,12,11.0,13.0,,0.03354139777580791,3,337,0.2837624210072965,0.0061495214740643405,116.26471132220644,COMPLETE
1589,0.44124531745910645,2023-09-04 22:19:57.143784,2023-09-04 22:19:57.584023,0 days 00:00:00.440239,Leaky,Leaky,Sigmoid,,14,22,12.0,14.0,,0.009066511719638822,3,324,0.41610601335689973,0.03214684218749177,103.92552388509115,COMPLETE
1590,0.3289541006088257,2023-09-04 22:19:57.584524,2023-09-04 22:19:58.437515,0 days 00:00:00.852991,Leaky,Leaky,Tanh,,18,24,12.0,9.0,,0.005835457976081354,3,352,0.7495452467025853,0.0010135737470158468,103.53795878092448,COMPLETE
1591,0.3449471890926361,2023-09-04 22:19:58.438009,2023-09-04 22:19:59.608815,0 days 00:00:01.170806,Leaky,,,,12,13,,,,0.013892429614218988,1,356,0.7711510331941783,0.0001996912856703194,90.29779956215306,COMPLETE
1592,0.35650476813316345,2023-09-04 22:19:59.609261,2023-09-04 22:20:05.228645,0 days 00:00:05.619384,Leaky,Leaky,Leaky,,15,12,10.0,8.0,,6.829148817589316e-05,3,345,0.3243534088279578,0.00013852083460764902,112.3524012911147,COMPLETE
1593,0.3581753671169281,2023-09-04 22:20:05.229125,2023-09-04 22:20:07.781707,0 days 00:00:02.552582,Leaky,Leaky,Leaky,,18,14,9.0,7.0,,0.0008662497822979751,3,358,0.6398460716182586,0.008390885948579865,109.03898544311524,COMPLETE
1594,0.31866714358329773,2023-09-04 22:20:07.782193,2023-09-04 22:20:08.984919,0 days 00:00:01.202726,Leaky,ReLU,Leaky,,16,21,11.0,16.0,,0.010422644903967616,3,338,0.7224302634826655,2.616799833332694e-05,111.77300853113974,COMPLETE
1595,0.41591840982437134,2023-09-04 22:20:08.985432,2023-09-04 22:20:09.173746,0 days 00:00:00.188314,Leaky,Leaky,Leaky,,45,23,19.0,24.0,,0.06891014356201282,3,348,0.10440039918867877,0.0021460374114503043,130.77942449396306,COMPLETE
1596,0.36903849244117737,2023-09-04 22:20:09.174225,2023-09-04 22:20:09.477986,0 days 00:00:00.303761,Leaky,Leaky,Leaky,,10,12,20.0,9.0,,0.007956770997897343,3,362,0.11897133518578931,0.004001993807810955,113.03502509707496,COMPLETE
