number,value,datetime_start,datetime_complete,duration,params_activation1,params_activation2,params_activation3,params_activation4,params_batch_size,params_fl1,params_fl2,params_fl3,params_fl4,params_learning_rate,params_n_layers,params_num_epochs,params_train_size,params_weight_decay,user_attrs_mre,state
1816,0.39254724979400635,2023-09-04 22:40:47.211527,2023-09-04 22:40:48.051549,0 days 00:00:00.840022,ReLU,ReLU,Sigmoid,Sigmoid,31,11,22.0,10.0,14.0,0.005290955251926118,4,194,0.6985925871711947,4.671732198582706e-05,122.93088436126709,COMPLETE
1817,0.8807064294815063,2023-09-04 22:40:48.052101,2023-09-04 22:40:50.389011,0 days 00:00:02.336910,ReLU,ReLU,Sigmoid,Sigmoid,31,8,22.0,11.0,13.0,2.9365994495399975e-05,4,194,0.33385441703438307,5.635873512081947e-05,99.50228303732331,COMPLETE
1818,0.33623355627059937,2023-09-04 22:40:50.389540,2023-09-04 22:40:51.281776,0 days 00:00:00.892236,ReLU,ReLU,Sigmoid,Sigmoid,37,9,22.0,12.0,16.0,0.006996836770098676,4,196,0.7029600836041403,3.6257140504556146e-05,148.78504861367716,COMPLETE
1819,0.3154968023300171,2023-09-04 22:40:51.282367,2023-09-04 22:40:52.416434,0 days 00:00:01.134067,ReLU,ReLU,Sigmoid,Sigmoid,35,11,22.0,10.0,12.0,0.00789399987771052,4,180,0.7217998178586673,4.749831629262913e-05,92.72643498011998,COMPLETE
1820,0.4952932596206665,2023-09-04 22:40:52.416962,2023-09-04 22:40:52.688603,0 days 00:00:00.271641,ReLU,ReLU,Sigmoid,Sigmoid,30,10,22.0,9.0,15.0,0.005706149992811224,4,186,0.10960715901395258,2.9993755543712063e-05,126.28739823966191,COMPLETE
1821,0.32126280665397644,2023-09-04 22:40:52.689189,2023-09-04 22:40:53.517404,0 days 00:00:00.828215,ReLU,ReLU,Sigmoid,Sigmoid,34,9,22.0,11.0,13.0,0.006925537288489963,4,185,0.7301012119382968,3.576099644766755e-05,93.67184931437174,COMPLETE
1822,0.33871015906333923,2023-09-04 22:40:53.517924,2023-09-04 22:40:54.078827,0 days 00:00:00.560903,ReLU,ReLU,Sigmoid,Sigmoid,34,10,23.0,9.0,12.0,0.008378092604242755,4,180,0.47802207670571656,6.242188959497306e-05,112.23574295043946,COMPLETE
1823,0.3315057158470154,2023-09-04 22:40:54.079384,2023-09-04 22:40:54.731122,0 days 00:00:00.651738,ReLU,ReLU,Sigmoid,Sigmoid,34,10,23.0,9.0,11.0,0.005035427888719326,4,190,0.2314485130945081,4.3506928829164637e-05,263.6157899621415,COMPLETE
1824,0.3177550435066223,2023-09-04 22:40:54.731651,2023-09-04 22:40:55.539718,0 days 00:00:00.808067,ReLU,ReLU,Sigmoid,Sigmoid,36,8,23.0,11.0,14.0,0.008934769787745704,4,197,0.5446811756284616,5.1776886194718445e-05,100.66182826115535,COMPLETE
1825,0.2938784062862396,2023-09-04 22:40:55.540260,2023-09-04 22:40:57.590170,0 days 00:00:02.049910,ReLU,ReLU,Sigmoid,Sigmoid,32,10,22.0,10.0,12.0,0.001903330522350112,4,194,0.6954176323582357,2.9618994454869743e-05,121.8548812866211,COMPLETE
1826,0.4009338915348053,2023-09-04 22:40:57.590707,2023-09-04 22:40:57.940375,0 days 00:00:00.349668,ReLU,ReLU,Sigmoid,Sigmoid,35,9,23.0,8.0,17.0,0.004655898268954193,4,199,0.20767561585969438,4.097978381040275e-05,119.92064463297525,COMPLETE
1827,0.2864990532398224,2023-09-04 22:40:57.940913,2023-09-04 22:40:59.647779,0 days 00:00:01.706866,ReLU,ReLU,Sigmoid,Sigmoid,31,11,22.0,9.0,18.0,0.00624569215149352,4,174,0.7398894283471777,6.029955183774715e-05,115.9686021947149,COMPLETE
1828,0.9814223051071167,2023-09-04 22:40:59.648328,2023-09-04 22:41:00.086186,0 days 00:00:00.437858,ReLU,ReLU,Sigmoid,Sigmoid,36,9,23.0,12.0,11.0,0.00911984756350194,4,180,0.7102950264486448,0.049800688499707424,102.40284729003906,COMPLETE
1829,0.8528600931167603,2023-09-04 22:41:00.086732,2023-09-04 22:41:02.193154,0 days 00:00:02.106422,ReLU,ReLU,Sigmoid,Sigmoid,33,10,23.0,10.0,15.0,4.0266059283890565e-05,4,200,0.29049410919159446,3.292157986374192e-05,105.7354250717163,COMPLETE
1830,0.3824996054172516,2023-09-04 22:41:02.193695,2023-09-04 22:41:02.759883,0 days 00:00:00.566188,ReLU,ReLU,Sigmoid,Sigmoid,29,9,23.0,13.0,16.0,0.00558251084048287,4,196,0.2665758302163702,4.083005215410435e-05,109.10523091191831,COMPLETE
1831,0.9524590373039246,2023-09-04 22:41:02.760403,2023-09-04 22:41:04.098683,0 days 00:00:01.338280,ReLU,ReLU,Sigmoid,Sigmoid,37,9,24.0,8.0,17.0,1.6549283181371853e-05,4,171,0.24509731191484826,5.1347559208477554e-05,103.10083984910396,COMPLETE
1832,1.0055124759674072,2023-09-04 22:41:04.099200,2023-09-04 22:41:04.476449,0 days 00:00:00.377249,ReLU,ReLU,Sigmoid,Sigmoid,33,8,22.0,9.0,14.0,0.004107868907650699,4,177,0.42245450897516096,0.062114297558951405,107.5830282914011,COMPLETE
1833,0.9747925400733948,2023-09-04 22:41:04.476970,2023-09-04 22:41:04.901938,0 days 00:00:00.424968,ReLU,ReLU,Sigmoid,Sigmoid,35,8,22.0,8.0,13.0,0.0672069132808318,4,201,0.46507793320883095,0.012036494082881809,110.46673257010323,COMPLETE
1834,0.37957316637039185,2023-09-04 22:41:04.902472,2023-09-04 22:41:05.587156,0 days 00:00:00.684684,ReLU,ReLU,Sigmoid,Sigmoid,37,9,23.0,12.0,16.0,0.00771161476673209,4,181,0.3095056769189733,0.0003109513608290674,154.2829333446065,COMPLETE
1835,0.3958091735839844,2023-09-04 22:41:05.587711,2023-09-04 22:41:07.100706,0 days 00:00:01.512995,ReLU,ReLU,Sigmoid,Sigmoid,33,9,23.0,10.0,12.0,0.050706905594957066,4,187,0.7456453603866806,0.003573870948281052,112.02170927628227,COMPLETE
1836,0.3302644193172455,2023-09-04 22:41:07.101677,2023-09-04 22:41:09.558490,0 days 00:00:02.456813,ReLU,ReLU,Sigmoid,Sigmoid,36,10,23.0,11.0,10.0,0.06385954807848118,4,187,0.6758002154899954,0.00043081951149125184,107.45511901072966,COMPLETE
1837,0.7385862469673157,2023-09-04 22:41:09.559047,2023-09-04 22:41:10.743724,0 days 00:00:01.184677,ReLU,ReLU,Sigmoid,Sigmoid,38,10,24.0,7.0,11.0,7.805128890144444e-05,4,199,0.18081209502730583,0.00018163521294019535,97.70953154444095,COMPLETE
1838,0.4825024902820587,2023-09-04 22:41:10.744289,2023-09-04 22:41:11.418102,0 days 00:00:00.673813,Sigmoid,ReLU,Sigmoid,Tanh,34,2,22.0,8.0,15.0,0.007121070332203871,4,173,0.7267640789655747,3.65966449393867e-05,113.56437469482422,COMPLETE
1839,0.36791297793388367,2023-09-04 22:41:11.418682,2023-09-04 22:41:11.938818,0 days 00:00:00.520136,ReLU,ReLU,Sigmoid,Sigmoid,36,9,24.0,10.0,4.0,0.009675727085929054,4,188,0.3743855670113162,2.921509808607888e-05,170.19846845354354,COMPLETE
1840,0.3285667598247528,2023-09-04 22:41:11.939412,2023-09-04 22:41:15.162972,0 days 00:00:03.223560,ReLU,ReLU,Sigmoid,ReLU,30,9,24.0,9.0,13.0,0.0008207836269940145,4,203,0.44407909133440493,0.0014536216042914942,115.12792973109654,COMPLETE
1841,0.39470353722572327,2023-09-04 22:41:15.163540,2023-09-04 22:41:15.780882,0 days 00:00:00.617342,Sigmoid,ReLU,Sigmoid,Tanh,38,8,24.0,9.0,14.0,0.006375217407684618,4,168,0.5320134674411809,6.403107546924245e-05,125.60617967085405,COMPLETE
1842,0.3024000823497772,2023-09-04 22:41:15.781463,2023-09-04 22:41:17.203578,0 days 00:00:01.422115,ReLU,ReLU,Sigmoid,Sigmoid,32,10,23.0,7.0,12.0,0.004918641846543675,4,200,0.7710509602804386,0.0023973695440035548,108.13702686016376,COMPLETE
1843,0.7733948230743408,2023-09-04 22:41:17.204120,2023-09-04 22:41:18.521934,0 days 00:00:01.317814,ReLU,ReLU,Sigmoid,ReLU,38,8,23.0,8.0,2.0,9.511495518236373e-05,4,193,0.2224407160834866,0.006067002571408735,116.47546746446679,COMPLETE
1844,0.3224988281726837,2023-09-04 22:41:18.522534,2023-09-04 22:41:22.037111,0 days 00:00:03.514577,ReLU,ReLU,Sigmoid,Leaky,35,9,22.0,11.0,8.0,0.0010825511892999429,4,183,0.5736447211854537,0.0008797024779137434,110.55271878268549,COMPLETE
1845,0.47338300943374634,2023-09-04 22:41:22.037635,2023-09-04 22:41:26.381050,0 days 00:00:04.343415,Sigmoid,ReLU,Sigmoid,Sigmoid,34,10,24.0,9.0,10.0,0.00015395922232730637,4,169,0.7995943224195899,0.0005060167828038689,98.62134570059692,COMPLETE
1846,1.0361621379852295,2023-09-04 22:41:26.381567,2023-09-04 22:41:27.743628,0 days 00:00:01.362061,ReLU,ReLU,Sigmoid,ReLU,37,10,23.0,12.0,5.0,1.340550420507192e-05,4,202,0.21268336078704475,0.00022754142934395795,98.104418499635,COMPLETE
1847,0.37036240100860596,2023-09-04 22:41:27.744158,2023-09-04 22:41:28.209191,0 days 00:00:00.465033,ReLU,ReLU,Sigmoid,Tanh,32,9,22.0,7.0,18.0,0.010518651553817166,4,207,0.34262248085034935,0.008487617156726683,122.22063929239908,COMPLETE
1848,0.37986212968826294,2023-09-04 22:41:28.209709,2023-09-04 22:41:29.049489,0 days 00:00:00.839780,ReLU,ReLU,Sigmoid,Sigmoid,39,11,24.0,11.0,13.0,0.001995175962644431,4,186,0.25487548120207937,4.800668314714384e-05,132.84926613994028,COMPLETE
1849,0.285818874835968,2023-09-04 22:41:29.050015,2023-09-04 22:41:30.274118,0 days 00:00:01.224103,Tanh,ReLU,Sigmoid,ReLU,36,8,23.0,10.0,4.0,0.004116921235902694,4,174,0.7496207209942491,2.947988042047127e-05,122.58764853844276,COMPLETE
1850,0.42517203092575073,2023-09-04 22:41:30.274670,2023-09-04 22:41:34.513717,0 days 00:00:04.239047,Sigmoid,ReLU,Sigmoid,Tanh,30,12,24.0,13.0,6.0,0.00046733015167474423,4,171,0.7068557197895955,0.0006775869281134487,134.3125245836046,COMPLETE
1851,0.277040958404541,2023-09-04 22:41:34.514243,2023-09-04 22:41:38.294634,0 days 00:00:03.780391,Tanh,ReLU,Sigmoid,Sigmoid,35,10,23.0,7.0,16.0,0.0005814573409270006,4,163,0.7684588825698154,0.00016461101958880207,115.25847826998658,COMPLETE
1852,0.30500558018684387,2023-09-04 22:41:38.295135,2023-09-04 22:41:39.001476,0 days 00:00:00.706341,Tanh,ReLU,Tanh,Leaky,38,11,22.0,8.0,11.0,0.01946319594830361,4,196,0.6778665234127635,0.00019770548003608362,94.46027636528015,COMPLETE
1853,0.36166098713874817,2023-09-04 22:41:39.001981,2023-09-04 22:41:39.756245,0 days 00:00:00.754264,ReLU,ReLU,Sigmoid,ReLU,35,9,24.0,8.0,3.0,0.057169517179664904,4,207,0.5096874581652255,0.00026217796712052157,140.81970254998458,COMPLETE
1854,0.9875468611717224,2023-09-04 22:41:39.756824,2023-09-04 22:41:41.415352,0 days 00:00:01.658528,Tanh,ReLU,Sigmoid,Sigmoid,33,10,22.0,10.0,7.0,0.0816529558086423,4,184,0.7325772734460326,0.018494401961898,106.31698172433036,COMPLETE
1855,0.32117992639541626,2023-09-04 22:41:41.416372,2023-09-04 22:41:44.679908,0 days 00:00:03.263536,Tanh,ReLU,Tanh,Tanh,38,11,23.0,6.0,14.0,0.0005022099269045487,4,203,0.7997155589611503,3.8535012995988694e-05,97.33577545418227,COMPLETE
1856,0.3855942189693451,2023-09-04 22:41:44.680451,2023-09-04 22:41:45.474283,0 days 00:00:00.793832,Tanh,ReLU,Sigmoid,ReLU,36,19,24.0,9.0,17.0,0.000641373559333296,4,166,0.13176720121405308,5.589908041132576e-05,340.5160622654191,COMPLETE
1857,0.315686970949173,2023-09-04 22:41:45.474791,2023-09-04 22:41:46.974529,0 days 00:00:01.499738,ReLU,ReLU,Sigmoid,Sigmoid,39,9,23.0,6.0,15.0,0.007914156859627158,4,192,0.74945360419188,7.08297989899407e-05,98.17681685227615,COMPLETE
1858,0.6166782379150391,2023-09-04 22:41:46.975036,2023-09-04 22:41:48.020008,0 days 00:00:01.044972,Tanh,ReLU,Tanh,ReLU,31,9,24.0,8.0,10.0,4.186379935905407e-05,4,177,0.15640074188187877,0.00035799896528643796,103.05851508533887,COMPLETE
1859,0.34325462579727173,2023-09-04 22:41:48.020512,2023-09-04 22:41:48.937110,0 days 00:00:00.916598,Tanh,ReLU,Sigmoid,Sigmoid,34,10,23.0,7.0,9.0,0.015127402589130114,4,206,0.6987766662664634,0.0016850952162172303,100.60009061373196,COMPLETE
1860,0.3461206257343292,2023-09-04 22:41:48.937637,2023-09-04 22:41:49.395694,0 days 00:00:00.458057,Tanh,ReLU,Sigmoid,Tanh,37,10,22.0,10.0,13.0,0.010554667791646134,4,165,0.37966844504785435,0.00015426123364767775,177.9628433227539,COMPLETE
1861,0.33490243554115295,2023-09-04 22:41:49.396214,2023-09-04 22:41:50.296930,0 days 00:00:00.900716,Tanh,ReLU,Tanh,Leaky,38,8,24.0,9.0,8.0,0.0063273175048557334,4,190,0.770015527223122,2.6798560698866253e-05,91.69801772268195,COMPLETE
1862,0.35249003767967224,2023-09-04 22:41:50.297488,2023-09-04 22:41:51.041399,0 days 00:00:00.743911,ReLU,ReLU,Sigmoid,Sigmoid,35,7,23.0,11.0,12.0,0.017449196781439504,4,194,0.3284413521442306,0.0019772205377259046,112.90405654907227,COMPLETE
1863,0.3824979066848755,2023-09-04 22:41:51.041931,2023-09-04 22:41:53.690393,0 days 00:00:02.648462,Sigmoid,ReLU,Sigmoid,ReLU,29,9,24.0,8.0,5.0,0.008975524582297485,4,183,0.7233820621087189,0.00454875823462068,428.62426552076016,COMPLETE
1864,0.3084992468357086,2023-09-04 22:41:53.690931,2023-09-04 22:41:59.739293,0 days 00:00:06.048362,Tanh,ReLU,Tanh,Sigmoid,39,11,23.0,7.0,6.0,0.00022606473331087987,4,207,0.7698125156478671,3.384940006132857e-05,98.70679381734507,COMPLETE
1865,0.6865736246109009,2023-09-04 22:41:59.739838,2023-09-04 22:42:03.825941,0 days 00:00:04.086103,Tanh,ReLU,Sigmoid,Tanh,32,10,22.0,9.0,2.0,2.0854451158622685e-05,4,177,0.7416168252202551,4.277613783603462e-05,105.24650073724952,COMPLETE
1866,0.4480138123035431,2023-09-04 22:42:03.826450,2023-09-04 22:42:04.263209,0 days 00:00:00.436759,Tanh,ReLU,Tanh,ReLU,36,9,24.0,6.0,14.0,0.0009897070047953384,4,161,0.1036028500742397,0.0005507288190308801,187.70500955127534,COMPLETE
1867,0.9376431703567505,2023-09-04 22:42:04.263765,2023-09-04 22:42:04.762576,0 days 00:00:00.498811,ReLU,ReLU,Sigmoid,Sigmoid,40,10,22.0,12.0,1.0,0.013486890750479775,4,198,0.4853112752601715,0.023244171052818636,99.95897570523348,COMPLETE
1868,0.4158880114555359,2023-09-04 22:42:04.763107,2023-09-04 22:42:05.884161,0 days 00:00:01.121054,Tanh,ReLU,Sigmoid,ReLU,34,11,24.0,7.0,15.0,0.0003390649030069138,4,209,0.1506270504614009,0.0003073082050400791,117.70877581340511,COMPLETE
1869,0.4495150148868561,2023-09-04 22:42:05.884698,2023-09-04 22:42:06.300977,0 days 00:00:00.416279,Tanh,ReLU,Tanh,Sigmoid,37,9,23.0,10.0,3.0,0.005564797674884583,4,171,0.14699387279782747,0.00018505443043461526,149.4108018718782,COMPLETE
1870,0.3090451657772064,2023-09-04 22:42:06.301527,2023-09-04 22:42:07.339235,0 days 00:00:01.037708,Tanh,ReLU,Sigmoid,Leaky,34,11,23.0,13.0,16.0,0.003565197535620358,4,159,0.6998257611011909,0.001096110686196845,106.1184380271218,COMPLETE
1871,0.3946947753429413,2023-09-04 22:42:07.339777,2023-09-04 22:42:10.565760,0 days 00:00:03.225983,ReLU,ReLU,Sigmoid,Tanh,39,8,24.0,9.0,7.0,0.0002798868507423968,4,210,0.767509072148973,0.02522181103689264,118.13024207437114,COMPLETE
1872,0.43874192237854004,2023-09-04 22:42:10.566276,2023-09-04 22:42:14.089768,0 days 00:00:03.523492,Tanh,Leaky,Tanh,Sigmoid,36,9,23.0,8.0,11.0,6.350420781091861e-05,4,183,0.6775526398573936,0.00014758006628200703,123.90425501755678,COMPLETE
1873,0.324244886636734,2023-09-04 22:42:14.090303,2023-09-04 22:42:17.570838,0 days 00:00:03.480535,Tanh,ReLU,Sigmoid,ReLU,40,10,22.0,6.0,18.0,0.0007150518987741193,4,199,0.7192939812200582,0.0008449714084739259,88.77474262675301,COMPLETE
1874,0.49856266379356384,2023-09-04 22:42:17.571390,2023-09-04 22:42:18.179887,0 days 00:00:00.608497,Tanh,ReLU,Sigmoid,Sigmoid,32,10,24.0,11.0,17.0,0.04414003467359342,4,170,0.3887065073089655,1.0117850799329778e-05,128.38588774831672,COMPLETE
1875,0.924383819103241,2023-09-04 22:42:18.180450,2023-09-04 22:42:19.123552,0 days 00:00:00.943102,Sigmoid,ReLU,Tanh,Tanh,38,7,23.0,7.0,5.0,2.3215999983513858e-05,4,208,0.1266583852966849,0.00024132633740182928,103.97987204331618,COMPLETE
1876,0.4323398172855377,2023-09-04 22:42:19.124072,2023-09-04 22:42:19.664400,0 days 00:00:00.540328,ReLU,ReLU,Sigmoid,ReLU,29,9,24.0,5.0,4.0,0.0074046028084685305,4,176,0.29963410608063523,5.0971838016481834e-05,116.8485858623798,COMPLETE
1877,0.6865341067314148,2023-09-04 22:42:19.664988,2023-09-04 22:42:20.904660,0 days 00:00:01.239672,Tanh,Leaky,Sigmoid,Sigmoid,40,19,23.0,10.0,12.0,5.26388561626284e-05,4,190,0.20191456856109805,0.0004147765955160649,103.64929263466283,COMPLETE
1878,0.33341750502586365,2023-09-04 22:42:20.905187,2023-09-04 22:42:24.695792,0 days 00:00:03.790605,Tanh,ReLU,Tanh,Leaky,34,11,24.0,9.0,8.0,0.0012464858623557845,4,163,0.7991225299985028,0.002178262795146166,112.96713305742313,COMPLETE
1879,0.46188342571258545,2023-09-04 22:42:24.696475,2023-09-04 22:42:25.114279,0 days 00:00:00.417804,Tanh,ReLU,Sigmoid,ReLU,78,22,22.0,8.0,2.0,0.0016446974068425224,4,209,0.18046408920023196,3.099337153530476e-05,152.65757137149959,COMPLETE
1880,0.3028852939605713,2023-09-04 22:42:25.114820,2023-09-04 22:42:27.660225,0 days 00:00:02.545405,ReLU,ReLU,Sigmoid,Tanh,36,20,23.0,6.0,9.0,0.0002764834929295763,4,162,0.7495028754508973,0.003231098162974022,125.5486626876028,COMPLETE
1881,0.3393895924091339,2023-09-04 22:42:27.660816,2023-09-04 22:42:28.084123,0 days 00:00:00.423307,Tanh,ReLU,Tanh,Sigmoid,55,8,21.0,7.0,6.0,0.010867534155749512,4,196,0.2673608357602047,6.0647225649510007e-05,105.95171253101246,COMPLETE
1882,0.5530750155448914,2023-09-04 22:42:28.084658,2023-09-04 22:42:32.517460,0 days 00:00:04.432802,Tanh,Leaky,ReLU,Sigmoid,37,21,22.0,12.0,19.0,1.9342083023169644e-05,4,185,0.5522117786896844,0.002769264497140144,100.8634393228067,COMPLETE
1883,0.3937448263168335,2023-09-04 22:42:32.518013,2023-09-04 22:42:34.365366,0 days 00:00:01.847353,Tanh,ReLU,Sigmoid,ReLU,39,22,24.0,6.0,14.0,0.00035448630015959823,4,201,0.31552980000691266,7.239244996257427e-05,116.1248173120603,COMPLETE
1884,0.39273369312286377,2023-09-04 22:42:34.365905,2023-09-04 22:42:34.631238,0 days 00:00:00.265333,ReLU,ReLU,Sigmoid,Tanh,33,10,23.0,11.0,13.0,0.022258055600058932,4,171,0.1011948571705209,0.005810707729122761,259.42981405819165,COMPLETE
1885,0.3628023862838745,2023-09-04 22:42:34.631836,2023-09-04 22:42:35.545787,0 days 00:00:00.913951,Tanh,ReLU,Tanh,Sigmoid,31,21,24.0,8.0,15.0,0.0012672910537590467,4,157,0.19584128713984741,4.0432195611958504e-05,120.86877279766536,COMPLETE
1886,0.36919552087783813,2023-09-04 22:42:35.546325,2023-09-04 22:42:36.901020,0 days 00:00:01.354695,Tanh,ReLU,Sigmoid,ReLU,36,19,24.0,5.0,10.0,0.0024417624616447074,4,181,0.7694626143017489,0.000201007775517512,103.15803198978819,COMPLETE
1887,0.48118147253990173,2023-09-04 22:42:36.901558,2023-09-04 22:42:37.499213,0 days 00:00:00.597655,Tanh,Leaky,ReLU,Leaky,39,11,10.0,10.0,11.0,0.004532811473855639,4,210,0.39780297935715425,0.040387151213566196,121.2262602912055,COMPLETE
1888,1.021649718284607,2023-09-04 22:42:37.499748,2023-09-04 22:42:38.059343,0 days 00:00:00.559595,Sigmoid,ReLU,Sigmoid,Sigmoid,34,20,23.0,9.0,9.0,0.017280600558134337,4,194,0.7246164950427344,0.007698044044079148,103.48079681396484,COMPLETE
1889,0.4841459393501282,2023-09-04 22:42:38.059873,2023-09-04 22:42:39.483635,0 days 00:00:01.423762,ReLU,ReLU,Tanh,ReLU,40,21,11.0,8.0,4.0,0.00022087458797018228,4,210,0.23327481113988852,2.5899487359758975e-05,117.17312887282598,COMPLETE
1890,0.36654940247535706,2023-09-04 22:42:39.484156,2023-09-04 22:42:39.793901,0 days 00:00:00.309745,Tanh,ReLU,Sigmoid,Tanh,83,22,23.0,7.0,14.0,0.009053342222231557,4,159,0.2153679182823298,0.0006950719202880753,108.48226894031872,COMPLETE
1891,0.475979208946228,2023-09-04 22:42:39.794429,2023-09-04 22:42:41.346265,0 days 00:00:01.551836,Tanh,ReLU,Sigmoid,Sigmoid,38,20,2.0,6.0,12.0,0.0010147807164725573,4,175,0.7443240763359388,0.0001479122153925167,125.35146948409407,COMPLETE
1892,0.3605722188949585,2023-09-04 22:42:41.346785,2023-09-04 22:42:41.754510,0 days 00:00:00.407725,Tanh,Leaky,ReLU,ReLU,58,22,24.0,5.0,7.0,0.013460660820082303,4,203,0.2830291530741496,4.888566109621175e-05,220.6251698155557,COMPLETE
1893,0.32587918639183044,2023-09-04 22:42:41.755023,2023-09-04 22:42:42.340081,0 days 00:00:00.585058,ReLU,ReLU,Tanh,Sigmoid,37,21,23.0,11.0,10.0,0.038195259561268305,4,152,0.6688076687511325,0.001416096428277563,110.70643043518066,COMPLETE
1894,0.34832221269607544,2023-09-04 22:42:42.340615,2023-09-04 22:42:42.932674,0 days 00:00:00.592059,Tanh,ReLU,Sigmoid,Tanh,54,10,24.0,10.0,17.0,0.05017032136135178,4,215,0.7713503353180297,3.6560790499347596e-05,102.94012503788389,COMPLETE
1895,1.0079162120819092,2023-09-04 22:42:42.933194,2023-09-04 22:42:43.242466,0 days 00:00:00.309272,Tanh,ReLU,Sigmoid,Sigmoid,31,20,22.0,9.0,3.0,0.005394063956342174,4,168,0.1880533953666335,0.07107420345438012,273.0405163574219,COMPLETE
1896,0.40433457493782043,2023-09-04 22:42:43.242991,2023-09-04 22:42:46.383628,0 days 00:00:03.140637,Tanh,ReLU,Tanh,ReLU,56,11,21.0,7.0,13.0,0.00015274380329686078,4,193,0.7995001998901947,0.056523362734438816,105.76142179657141,COMPLETE
1897,0.3088594675064087,2023-09-04 22:42:46.384151,2023-09-04 22:42:47.316931,0 days 00:00:00.932780,ReLU,Leaky,ReLU,Leaky,36,21,9.0,9.0,2.0,0.011125007017777954,4,178,0.7044243546083407,3.1529641061877033e-05,110.87751850328948,COMPLETE
1898,0.2816084027290344,2023-09-04 22:42:47.317448,2023-09-04 22:42:48.991271,0 days 00:00:01.673823,Tanh,ReLU,Sigmoid,Sigmoid,40,18,24.0,13.0,6.0,0.006699625258962839,4,212,0.7434433437052932,0.0002866305722329198,129.72233406702676,COMPLETE
1899,0.3073382079601288,2023-09-04 22:42:48.991830,2023-09-04 22:42:50.965055,0 days 00:00:01.973225,Tanh,ReLU,Leaky,Tanh,35,22,23.0,8.0,16.0,0.0007714707335046096,4,202,0.7703213692287254,0.0051846332593715565,259.7796566515084,COMPLETE
1900,1.035841941833496,2023-09-04 22:42:50.965604,2023-09-04 22:42:51.284261,0 days 00:00:00.318657,Sigmoid,ReLU,Sigmoid,ReLU,62,20,22.0,5.0,1.0,0.0034672734827087075,4,186,0.7994576084255628,0.011293252490711636,100.25569360906428,COMPLETE
1901,0.298848956823349,2023-09-04 22:42:51.284781,2023-09-04 22:42:52.063451,0 days 00:00:00.778670,Tanh,ReLU,Tanh,Sigmoid,86,19,10.0,6.0,8.0,0.018942353533934638,4,163,0.5884159817988425,7.785411995483479e-05,96.12608776670514,COMPLETE
1902,1.0578941106796265,2023-09-04 22:42:52.064002,2023-09-04 22:42:53.557456,0 days 00:00:01.493454,ReLU,Leaky,Sigmoid,ReLU,69,12,9.0,12.0,5.0,5.112134570644074e-05,4,216,0.3556775962499678,0.009560902649689068,99.4622493673254,COMPLETE
1903,0.38748636841773987,2023-09-04 22:42:53.557979,2023-09-04 22:42:54.268172,0 days 00:00:00.710193,Tanh,ReLU,Leaky,Sigmoid,33,21,23.0,7.0,15.0,0.014700078126822117,4,170,0.7052814459930384,0.017001377062461957,109.21604552092376,COMPLETE
1904,0.3378980755805969,2023-09-04 22:42:54.268696,2023-09-04 22:42:58.492183,0 days 00:00:04.223487,Tanh,ReLU,ReLU,Tanh,28,22,24.0,10.0,11.0,0.00020716134095696655,4,158,0.727699058726745,0.0012040926443089757,108.56423612184162,COMPLETE
