number,value,datetime_start,datetime_complete,duration,params_activation1,params_activation2,params_activation3,params_activation4,params_batch_size,params_fl1,params_fl2,params_fl3,params_fl4,params_learning_rate,params_n_layers,params_num_epochs,params_train_size,params_weight_decay,user_attrs_mre,state
625,0.31705009937286377,2023-09-04 22:17:34.058319,2023-09-04 22:17:35.543487,0 days 00:00:01.485168,ReLU,Leaky,Sigmoid,ReLU,83,9,20.0,15.0,10.0,0.015522434498055824,4,340,0.7998729444402072,0.0008805485474389438,114.41997493914704,COMPLETE
626,1.8386114835739136,2023-09-04 22:17:35.543866,2023-09-04 22:17:35.644739,0 days 00:00:00.100873,Sigmoid,Tanh,Sigmoid,Leaky,100,17,22.0,15.0,11.0,0.001999629250909683,4,303,0.17464438439781413,5.059637336453699e-05,101.33427567915483,COMPLETE
627,0.35049182176589966,2023-09-04 22:17:35.645167,2023-09-04 22:17:35.972949,0 days 00:00:00.327782,Tanh,Leaky,Sigmoid,Sigmoid,88,20,12.0,7.0,16.0,0.019049140764806082,4,280,0.7634082124782455,5.8005336780397126e-05,116.06039047241211,COMPLETE
628,1.3384088277816772,2023-09-04 22:17:35.973353,2023-09-04 22:17:36.991328,0 days 00:00:01.017975,Tanh,Leaky,ReLU,Sigmoid,86,22,20.0,14.0,1.0,0.00013067893333160112,4,316,0.11706523976789963,3.933197776824479e-05,394.73762869533107,COMPLETE
629,0.4283011853694916,2023-09-04 22:17:36.991993,2023-09-04 22:17:37.745305,0 days 00:00:00.753312,Sigmoid,Sigmoid,Tanh,Leaky,81,21,21.0,24.0,4.0,0.02570675261223215,4,250,0.36576196018437207,0.00013277946700287335,211.85576790257505,COMPLETE
630,0.25857117772102356,2023-09-04 22:17:37.745984,2023-09-04 22:17:38.780600,0 days 00:00:01.034616,Tanh,Leaky,Sigmoid,Sigmoid,84,13,19.0,16.0,8.0,0.013475661108376766,4,242,0.7243500974973175,1.0073058585564355e-05,109.9636362393697,COMPLETE
631,0.5580590963363647,2023-09-04 22:17:38.781060,2023-09-04 22:17:40.666791,0 days 00:00:01.885731,Tanh,Leaky,Leaky,Leaky,30,19,21.0,17.0,17.0,2.3072805677620433e-05,4,329,0.15856631633131496,0.0002786702196192768,109.99086485517786,COMPLETE
632,0.2701764702796936,2023-09-04 22:17:40.667223,2023-09-04 22:17:41.520158,0 days 00:00:00.852935,ReLU,Leaky,Sigmoid,Sigmoid,82,11,20.0,23.0,5.0,0.009866584031399759,4,266,0.6656870285818305,0.00021767580825808526,162.24950592427314,COMPLETE
633,1.1193972826004028,2023-09-04 22:17:41.520550,2023-09-04 22:17:41.636106,0 days 00:00:00.115556,Sigmoid,Leaky,Sigmoid,Leaky,87,18,19.0,15.0,8.0,0.021980995213620107,4,172,0.14925875738831343,0.028566538007811084,103.73907189620168,COMPLETE
634,0.388716459274292,2023-09-04 22:17:41.636471,2023-09-04 22:17:41.869701,0 days 00:00:00.233230,Tanh,Leaky,,,79,21,20.0,,,0.016911106129367283,2,196,0.5092890331406501,3.5026107572112906e-05,211.649628211712,COMPLETE
635,0.3148251473903656,2023-09-04 22:17:41.870076,2023-09-04 22:17:43.370908,0 days 00:00:01.500832,Tanh,Sigmoid,Sigmoid,Sigmoid,36,16,21.0,22.0,11.0,0.012078743333590807,4,162,0.7630091065936384,0.00010190500026091005,115.29810145281363,COMPLETE
636,0.34381091594696045,2023-09-04 22:17:43.371285,2023-09-04 22:17:43.909610,0 days 00:00:00.538325,Tanh,Leaky,Sigmoid,Leaky,84,9,22.0,16.0,10.0,0.015042482585305637,4,152,0.6005787736627792,7.540880226392725e-05,128.5029325665168,COMPLETE
637,0.30131515860557556,2023-09-04 22:17:43.910004,2023-09-04 22:17:45.057229,0 days 00:00:01.147225,Sigmoid,Leaky,Sigmoid,Sigmoid,86,12,19.0,24.0,19.0,0.007806310865026432,4,371,0.6426245928972389,1.7653927067693712e-05,155.2136636485224,COMPLETE
638,1.1679182052612305,2023-09-04 22:17:45.057604,2023-09-04 22:17:45.236951,0 days 00:00:00.179347,ReLU,ReLU,Sigmoid,Tanh,91,20,20.0,15.0,12.0,0.003583736699264126,4,291,0.7187957104542642,0.045068438652696705,102.65253933993253,COMPLETE
639,0.43607404828071594,2023-09-04 22:17:45.237322,2023-09-04 22:17:46.330964,0 days 00:00:01.093642,Tanh,Tanh,ReLU,Sigmoid,82,21,21.0,16.0,13.0,0.00038843138160004297,4,257,0.6977232695325019,0.000181237132643502,156.30539960277324,COMPLETE
640,0.42319315671920776,2023-09-04 22:17:46.331349,2023-09-04 22:17:46.910173,0 days 00:00:00.578824,Tanh,Leaky,Sigmoid,ReLU,80,22,20.0,17.0,5.0,0.004294485252485656,4,236,0.450349761805762,6.552921746663272e-05,148.8872128338881,COMPLETE
641,1.033057451248169,2023-09-04 22:17:46.910564,2023-09-04 22:17:51.964574,0 days 00:00:05.054010,Sigmoid,Leaky,Sigmoid,Leaky,28,19,22.0,15.0,11.0,1.3194721932230984e-05,4,310,0.7692002498990821,0.07268930200624564,97.42820786456673,COMPLETE
642,0.937999963760376,2023-09-04 22:17:51.964960,2023-09-04 22:17:52.339461,0 days 00:00:00.374501,Tanh,Leaky,Sigmoid,Sigmoid,97,20,21.0,14.0,15.0,0.019726667571721798,4,277,0.7406070677988842,0.01077727140242669,111.52255224412487,COMPLETE
643,0.4298536777496338,2023-09-04 22:17:52.339852,2023-09-04 22:17:53.130946,0 days 00:00:00.791094,ReLU,Sigmoid,Tanh,Leaky,33,18,19.0,1.0,9.0,0.010447461303996566,4,351,0.6838755030968803,0.00015354911562379643,122.31473774380154,COMPLETE
644,0.248103529214859,2023-09-04 22:17:53.131337,2023-09-04 22:17:53.610730,0 days 00:00:00.479393,Tanh,Leaky,Sigmoid,Sigmoid,84,11,20.0,24.0,17.0,0.027558375875001567,4,182,0.7710725137847194,1.2317579902606987e-05,115.49666863518792,COMPLETE
645,0.6587173938751221,2023-09-04 22:17:53.611113,2023-09-04 22:17:54.645921,0 days 00:00:01.034808,Sigmoid,Leaky,Sigmoid,Leaky,88,10,20.0,16.0,4.0,0.00017222261564043303,4,334,0.1724041138079397,2.8521341352231292e-05,111.57146337360679,COMPLETE
646,0.30698248744010925,2023-09-04 22:17:54.646311,2023-09-04 22:17:55.206338,0 days 00:00:00.560027,Leaky,Leaky,Sigmoid,Sigmoid,86,19,21.0,15.0,10.0,0.005237722736387148,4,265,0.7241573323433407,0.004154177286131977,1050.7368523970895,COMPLETE
647,0.5641403794288635,2023-09-04 22:17:55.206717,2023-09-04 22:17:57.398678,0 days 00:00:02.191961,Tanh,Leaky,Sigmoid,,83,21,22.0,23.0,,3.346189308558395e-05,3,243,0.6611517385273854,5.200952892555575e-05,157.18184316501697,COMPLETE
648,0.9249608516693115,2023-09-04 22:17:57.399053,2023-09-04 22:17:58.762802,0 days 00:00:01.363749,Leaky,Leaky,ReLU,Leaky,36,18,4.0,14.0,5.0,0.0002780927624469403,4,250,0.1813072417940104,0.008590363057616068,143.9132384338379,COMPLETE
649,0.4401676654815674,2023-09-04 22:17:58.763174,2023-09-04 22:17:59.122684,0 days 00:00:00.359510,Tanh,Sigmoid,Sigmoid,Sigmoid,81,20,19.0,24.0,20.0,0.014089802602651798,4,189,0.191041421623208,0.00012055826323664045,737.9495678856259,COMPLETE
650,0.43381038308143616,2023-09-04 22:17:59.123063,2023-09-04 22:17:59.351782,0 days 00:00:00.228719,Sigmoid,Leaky,Sigmoid,Sigmoid,85,9,21.0,15.0,2.0,0.017702089258878593,4,324,0.7996604055677308,8.7124926375738e-05,142.8500578744071,COMPLETE
651,0.2548271715641022,2023-09-04 22:17:59.352169,2023-09-04 22:18:00.570481,0 days 00:00:01.218312,Leaky,ReLU,Sigmoid,Leaky,89,10,23.0,17.0,3.0,0.006295950813240745,4,343,0.7060351743631756,0.00022118459143071332,110.1023956298828,COMPLETE
652,0.25219085812568665,2023-09-04 22:18:00.570881,2023-09-04 22:18:01.486340,0 days 00:00:00.915459,Tanh,Leaky,Sigmoid,Sigmoid,83,8,20.0,18.0,13.0,0.022721974315300764,4,271,0.7452460479651172,0.0015869594971671841,350.649038240507,COMPLETE
653,0.41972970962524414,2023-09-04 22:18:01.486735,2023-09-04 22:18:02.007904,0 days 00:00:00.521169,ReLU,Tanh,Sigmoid,ReLU,34,22,20.0,16.0,14.0,0.012889357076777653,4,286,0.20507917110255197,0.00029899898165507827,373.9170516746632,COMPLETE
654,0.30796703696250916,2023-09-04 22:18:02.008283,2023-09-04 22:18:02.550917,0 days 00:00:00.542634,Leaky,Leaky,Leaky,Leaky,31,19,21.0,23.0,16.0,0.009601311920767285,4,361,0.6255724455469773,0.0003468224502596232,106.10388549804688,COMPLETE
655,0.4696333408355713,2023-09-04 22:18:02.551284,2023-09-04 22:18:02.724523,0 days 00:00:00.173239,Tanh,Leaky,Sigmoid,Sigmoid,38,17,19.0,15.0,17.0,0.01616283824686326,4,236,0.11032401272149069,0.0010496945732267422,381.10839080810547,COMPLETE
656,0.4070827066898346,2023-09-04 22:18:02.724897,2023-09-04 22:18:03.491762,0 days 00:00:00.766865,Sigmoid,Leaky,Tanh,Leaky,87,21,22.0,14.0,11.0,0.01945356539891065,4,302,0.7549757137992135,0.005664128260828567,142.6712629144842,COMPLETE
657,0.46808820962905884,2023-09-04 22:18:03.492141,2023-09-04 22:18:03.743201,0 days 00:00:00.251060,Leaky,Sigmoid,Sigmoid,Sigmoid,80,12,20.0,16.0,12.0,0.030189557153208254,4,168,0.2935835703840247,4.617942737681869e-05,558.4117595672608,COMPLETE
658,1.0523780584335327,2023-09-04 22:18:03.743573,2023-09-04 22:18:04.433399,0 days 00:00:00.689826,Tanh,Leaky,ReLU,Leaky,91,20,19.0,8.0,5.0,4.1672813572205004e-05,4,178,0.22171991378973802,5.925741583815208e-05,148.00456220648263,COMPLETE
659,1.203037977218628,2023-09-04 22:18:04.433771,2023-09-04 22:18:05.155530,0 days 00:00:00.721759,Tanh,Leaky,Sigmoid,Sigmoid,85,18,21.0,24.0,10.0,5.545677844849638e-05,4,256,0.15198772462227797,2.3513405528546917e-05,121.33576941490173,COMPLETE
660,0.8190852403640747,2023-09-04 22:18:05.155916,2023-09-04 22:18:05.399404,0 days 00:00:00.243488,Leaky,Leaky,Sigmoid,Sigmoid,82,10,22.0,23.0,18.0,0.01149947433810888,4,200,0.6922710002473041,0.09916445208111559,113.11693438361672,COMPLETE
661,0.9971261024475098,2023-09-04 22:18:05.399776,2023-09-04 22:18:05.565946,0 days 00:00:00.166170,Sigmoid,Leaky,Sigmoid,Leaky,84,20,20.0,16.0,4.0,0.014624966920885909,4,242,0.5469256996087635,0.02438238104503433,101.27610079447429,COMPLETE
662,0.44302618503570557,2023-09-04 22:18:05.566326,2023-09-04 22:18:05.749817,0 days 00:00:00.183491,ReLU,Leaky,Sigmoid,Sigmoid,79,9,21.0,22.0,9.0,0.02511292492176644,4,260,0.16633532692782071,0.00020128293366541742,166.7532923771785,COMPLETE
663,0.9802871346473694,2023-09-04 22:18:05.750181,2023-09-04 22:18:05.900296,0 days 00:00:00.150115,Tanh,Sigmoid,Sigmoid,Tanh,87,19,20.0,15.0,11.0,0.01814539375647798,4,315,0.3795549007228549,0.012163143438918026,105.14482661655971,COMPLETE
664,0.4228004217147827,2023-09-04 22:18:05.900679,2023-09-04 22:18:06.042411,0 days 00:00:00.141732,Leaky,Leaky,Sigmoid,,82,11,23.0,14.0,,0.011636840962050938,3,233,0.186899609410839,0.00010889394714122297,116.6512321472168,COMPLETE
665,0.26557496190071106,2023-09-04 22:18:06.042795,2023-09-04 22:18:07.012692,0 days 00:00:00.969897,Tanh,ReLU,Sigmoid,Leaky,89,21,19.0,17.0,14.0,0.008796298440291003,4,280,0.7246714264540057,0.0001560160322857192,107.41199059919877,COMPLETE
666,0.2591456472873688,2023-09-04 22:18:07.013070,2023-09-04 22:18:07.860385,0 days 00:00:00.847315,Leaky,Tanh,ReLU,Sigmoid,48,13,20.0,4.0,8.0,0.022419465352303113,4,138,0.7665535182462757,7.62999548659139e-05,155.06647443771362,COMPLETE
667,0.9181709885597229,2023-09-04 22:18:07.861058,2023-09-04 22:18:08.130234,0 days 00:00:00.269176,Sigmoid,Leaky,Sigmoid,ReLU,93,17,21.0,24.0,5.0,0.01481428733084774,4,254,0.1980296122649927,0.018795321831745246,102.90612125396729,COMPLETE
668,0.887385904788971,2023-09-04 22:18:08.130946,2023-09-04 22:18:12.917570,0 days 00:00:04.786624,Tanh,Leaky,Sigmoid,Leaky,85,22,20.0,15.0,12.0,1.2362581818543586e-05,4,294,0.7987831005658103,0.0002754424570600669,153.71537490118118,COMPLETE
669,0.5203568935394287,2023-09-04 22:18:12.917945,2023-09-04 22:18:14.153675,0 days 00:00:01.235730,Leaky,Leaky,Sigmoid,Sigmoid,33,19,22.0,16.0,16.0,0.000625055711929105,4,339,0.17963127302950985,0.0008103913686040058,610.8941014348244,COMPLETE
670,0.35012081265449524,2023-09-04 22:18:14.154186,2023-09-04 22:18:14.845194,0 days 00:00:00.691008,Tanh,Leaky,Tanh,Sigmoid,22,18,21.0,15.0,10.0,0.01710823968133075,4,418,0.4103049729634304,3.4378851910031385e-05,149.58708745783025,COMPLETE
671,0.380341500043869,2023-09-04 22:18:14.845589,2023-09-04 22:18:18.774963,0 days 00:00:03.929374,Leaky,Sigmoid,Sigmoid,Leaky,37,20,20.0,18.0,5.0,0.002297674071733319,4,326,0.684932912728977,0.00042830033309088864,110.0468459851814,COMPLETE
672,0.44285595417022705,2023-09-04 22:18:18.775637,2023-09-04 22:18:19.803219,0 days 00:00:01.027582,ReLU,Leaky,Sigmoid,Sigmoid,83,21,19.0,10.0,1.0,0.007664591271858333,4,159,0.4747027711028008,1.684199349798401e-05,130.18030318168744,COMPLETE
673,0.3448200225830078,2023-09-04 22:18:19.803648,2023-09-04 22:18:20.125412,0 days 00:00:00.321764,Tanh,Leaky,Sigmoid,Leaky,81,11,21.0,16.0,17.0,0.013600600567797732,4,271,0.2672315203162491,6.544595402432957e-05,135.66047355106897,COMPLETE
674,0.6568512320518494,2023-09-04 22:18:20.125803,2023-09-04 22:18:20.494944,0 days 00:00:00.369141,Sigmoid,Leaky,Sigmoid,Sigmoid,46,10,20.0,19.0,4.0,0.020912010051046374,4,231,0.33849292679738263,0.002032664070752651,238.79457053160056,COMPLETE
675,1.145461916923523,2023-09-04 22:18:20.495359,2023-09-04 22:18:20.635274,0 days 00:00:00.139915,Leaky,Leaky,Sigmoid,Leaky,86,20,19.0,2.0,15.0,1.9883690991530304e-05,4,250,0.4326776606110695,0.06793033306364335,117.20857932350852,COMPLETE
676,0.6371314525604248,2023-09-04 22:18:20.635695,2023-09-04 22:18:21.726388,0 days 00:00:01.090693,Tanh,Leaky,Sigmoid,Sigmoid,79,21,21.0,23.0,3.0,0.0008469741211079126,4,190,0.5877450765371174,3.963724264944475e-05,175.0882899197665,COMPLETE
677,0.3801809847354889,2023-09-04 22:18:21.726783,2023-09-04 22:18:22.447745,0 days 00:00:00.720962,Leaky,Sigmoid,ReLU,Leaky,40,8,22.0,14.0,11.0,0.010854798494949929,4,268,0.6481189586870982,0.00014277910924217344,125.3639181137085,COMPLETE
678,0.8508033752441406,2023-09-04 22:18:22.448158,2023-09-04 22:18:22.784100,0 days 00:00:00.335942,Tanh,ReLU,,,88,18,18.0,,,0.03240685941663186,2,108,0.7331626795437356,0.05500038623686259,219.6406254359654,COMPLETE
679,0.2963429391384125,2023-09-04 22:18:22.784469,2023-09-04 22:18:23.979835,0 days 00:00:01.195366,Sigmoid,Leaky,Leaky,Sigmoid,84,14,20.0,24.0,12.0,0.001471247376576022,4,177,0.766964532219444,1.1583020691062732e-05,179.2380388130262,COMPLETE
680,0.34196212887763977,2023-09-04 22:18:23.980248,2023-09-04 22:18:24.497173,0 days 00:00:00.516925,Leaky,Tanh,Sigmoid,Sigmoid,90,19,21.0,17.0,2.0,0.016574125385148852,4,300,0.7097191773724736,2.2105605592396213e-05,115.30557180005451,COMPLETE
681,0.4033494293689728,2023-09-04 22:18:24.497568,2023-09-04 22:18:25.664837,0 days 00:00:01.167269,ReLU,Leaky,Sigmoid,Leaky,31,9,19.0,15.0,10.0,0.0009924203457553878,4,285,0.7420897651089978,1.428023165693573e-05,545.677798332052,COMPLETE
682,0.27057069540023804,2023-09-04 22:18:25.665260,2023-09-04 22:18:26.671020,0 days 00:00:01.005760,Tanh,Leaky,Sigmoid,ReLU,35,21,20.0,16.0,7.0,0.012749493971470606,4,243,0.6642099175366717,0.0001829595600384529,266.9988534109933,COMPLETE
683,0.8610777854919434,2023-09-04 22:18:26.671445,2023-09-04 22:18:26.911352,0 days 00:00:00.239907,Leaky,Leaky,Sigmoid,Sigmoid,98,22,22.0,24.0,9.0,0.026061592083048445,4,259,0.5664420534471978,0.022277940744684043,100.48511505126953,COMPLETE
684,0.4683398902416229,2023-09-04 22:18:26.911753,2023-09-04 22:18:27.421154,0 days 00:00:00.509401,Tanh,Leaky,Tanh,Leaky,85,20,21.0,22.0,5.0,0.0013888637642471317,4,457,0.7781636224834562,8.972777144532475e-05,126.14999683086688,COMPLETE
685,0.645995020866394,2023-09-04 22:18:27.421545,2023-09-04 22:18:27.826838,0 days 00:00:00.405293,Sigmoid,Leaky,Sigmoid,Sigmoid,83,19,23.0,23.0,11.0,0.020598464654098297,4,310,0.6049455523216002,0.00025750578602640715,199.79090740806177,COMPLETE
686,0.47866061329841614,2023-09-04 22:18:27.827226,2023-09-04 22:18:33.301352,0 days 00:00:05.474126,Leaky,Sigmoid,Sigmoid,Leaky,81,17,19.0,6.0,18.0,7.807625468798312e-05,4,344,0.7994507978122111,4.988117926933559e-05,160.7307043519131,COMPLETE
687,0.8055372834205627,2023-09-04 22:18:33.301739,2023-09-04 22:18:34.092110,0 days 00:00:00.790371,Tanh,Leaky,ReLU,Sigmoid,87,21,20.0,20.0,13.0,9.447168197949349e-05,4,152,0.2839640847407417,0.0001034997910363383,108.09280992809094,COMPLETE
688,0.2854267954826355,2023-09-04 22:18:34.092490,2023-09-04 22:18:34.410606,0 days 00:00:00.318116,Leaky,Leaky,Sigmoid,,95,18,20.0,16.0,,0.014261509567477293,3,235,0.7078368062132462,0.00038558715635307356,79.02609418233236,COMPLETE
689,1.1506407260894775,2023-09-04 22:18:34.411031,2023-09-04 22:18:34.643466,0 days 00:00:00.232435,Tanh,Leaky,Sigmoid,Leaky,78,10,21.0,15.0,10.0,0.010838087340480623,4,244,0.7435328759824638,0.038018337799547525,99.58278710501534,COMPLETE
690,0.8160999417304993,2023-09-04 22:18:34.643899,2023-09-04 22:18:34.912882,0 days 00:00:00.268983,ReLU,Leaky,Sigmoid,Tanh,85,20,22.0,15.0,17.0,0.017222282491392373,4,200,0.6836952066026748,0.0457841307830188,332.42882296913547,COMPLETE
691,1.1052734851837158,2023-09-04 22:18:34.913317,2023-09-04 22:18:35.277995,0 days 00:00:00.364678,Sigmoid,Sigmoid,Sigmoid,Sigmoid,81,12,21.0,16.0,4.0,0.005420595153481221,4,172,0.7205760815737463,0.0028662770062497732,101.24812966805918,COMPLETE
692,0.2967090606689453,2023-09-04 22:18:35.278405,2023-09-04 22:18:35.958601,0 days 00:00:00.680196,Tanh,ReLU,Sigmoid,Sigmoid,83,7,20.0,17.0,7.0,0.023383532424237605,4,322,0.7665037823081229,6.459605740592472e-05,115.37564720297759,COMPLETE
693,0.516816258430481,2023-09-04 22:18:35.958998,2023-09-04 22:18:36.341555,0 days 00:00:00.382557,Leaky,Tanh,Sigmoid,Leaky,36,9,20.0,14.0,12.0,0.00933157068627484,4,275,0.13496284486794535,0.015212121090317379,245.32227910708076,COMPLETE
694,0.6323333382606506,2023-09-04 22:18:36.341952,2023-09-04 22:18:36.636290,0 days 00:00:00.294338,Tanh,,,,88,11,,,,0.012400149286081096,1,355,0.364326530359009,0.00012886407794581508,196.4215691794812,COMPLETE
695,0.30151328444480896,2023-09-04 22:18:36.636687,2023-09-04 22:18:37.379733,0 days 00:00:00.743046,Leaky,Leaky,Sigmoid,Sigmoid,39,21,19.0,24.0,8.0,0.007038420077314311,4,228,0.6509774087338197,0.00023657536325979566,98.95988693237305,COMPLETE
696,0.6617428660392761,2023-09-04 22:18:37.380143,2023-09-04 22:18:38.452212,0 days 00:00:01.072069,Sigmoid,Leaky,ReLU,Leaky,86,19,21.0,16.0,5.0,0.0002744333689043391,4,332,0.19670531063933652,0.00016579611480570014,113.38611370684153,COMPLETE
697,0.2873675227165222,2023-09-04 22:18:38.452590,2023-09-04 22:18:38.782791,0 days 00:00:00.330201,Tanh,Leaky,Sigmoid,ReLU,33,22,18.0,15.0,16.0,0.016154089383599662,4,262,0.25661114596773454,3.100595430553647e-05,77.878649856105,COMPLETE
698,0.634684681892395,2023-09-04 22:18:38.783170,2023-09-04 22:18:40.767747,0 days 00:00:01.984577,Leaky,Leaky,Sigmoid,Sigmoid,82,20,22.0,14.0,6.0,6.23027223873091e-05,4,252,0.4946614172471191,8.211076246147678e-05,110.57372504945785,COMPLETE
699,0.30675822496414185,2023-09-04 22:18:40.768136,2023-09-04 22:18:41.585902,0 days 00:00:00.817766,ReLU,Leaky,Tanh,Leaky,52,21,19.0,15.0,9.0,0.020269658869627144,4,184,0.7291931087744408,0.0006775290999560401,95.95210481301332,COMPLETE
700,0.7772915363311768,2023-09-04 22:18:41.586571,2023-09-04 22:18:43.201167,0 days 00:00:01.614596,Tanh,Sigmoid,Sigmoid,Sigmoid,92,19,20.0,23.0,11.0,0.0005806436528496302,4,165,0.6887613358089731,4.351623166024237e-05,190.45931917078354,COMPLETE
701,0.34638145565986633,2023-09-04 22:18:43.201542,2023-09-04 22:18:43.579064,0 days 00:00:00.377522,Leaky,Leaky,Sigmoid,Leaky,80,18,21.0,16.0,4.0,0.014554621920153003,4,291,0.38519813721406676,0.0002140612202669638,118.22507402008655,COMPLETE
702,0.4208220839500427,2023-09-04 22:18:43.579447,2023-09-04 22:18:44.113274,0 days 00:00:00.533827,Sigmoid,Leaky,Sigmoid,Sigmoid,85,17,21.0,14.0,18.0,0.004224818831501801,4,244,0.327079549674005,5.2393282144941306e-05,143.17388564549137,COMPLETE
703,0.3233678936958313,2023-09-04 22:18:44.113663,2023-09-04 22:18:44.663485,0 days 00:00:00.549822,Tanh,Leaky,Sigmoid,Sigmoid,84,20,19.0,24.0,15.0,0.018186629558118613,4,308,0.7995557725556726,0.004278495349161635,2152.0331316692073,COMPLETE
704,0.4877476990222931,2023-09-04 22:18:44.663887,2023-09-04 22:18:44.885846,0 days 00:00:00.221959,Leaky,Leaky,Leaky,Leaky,44,10,20.0,17.0,10.0,0.02956814415465799,4,189,0.1022855319157451,0.019554118176172555,196.76226133458755,COMPLETE
705,0.8877959251403809,2023-09-04 22:18:44.886240,2023-09-04 22:18:48.556323,0 days 00:00:03.670083,Tanh,ReLU,Sigmoid,Sigmoid,87,20,22.0,15.0,5.0,1.3871998372132314e-05,4,335,0.7490802788125713,0.0005304755169304536,103.7599753308652,COMPLETE
706,0.30441465973854065,2023-09-04 22:18:48.556702,2023-09-04 22:18:51.122615,0 days 00:00:02.565913,Leaky,Leaky,ReLU,Leaky,89,11,20.0,23.0,17.0,0.0004065465621535519,4,267,0.638712622092906,0.00030334875302729666,133.1109007646082,COMPLETE
707,0.6883382797241211,2023-09-04 22:18:51.122994,2023-09-04 22:18:58.068581,0 days 00:00:06.945587,Sigmoid,Sigmoid,Sigmoid,Sigmoid,30,8,23.0,22.0,12.0,0.0002129925958461094,4,283,0.7678844135145957,1.814152588009247e-05,162.7240976124686,COMPLETE
708,1.2064733505249023,2023-09-04 22:18:58.068981,2023-09-04 22:18:58.315883,0 days 00:00:00.246902,Tanh,Tanh,Sigmoid,Leaky,61,19,21.0,15.0,3.0,0.002803296723996891,4,226,0.5430342197508239,0.03217752316948379,98.2393933464499,COMPLETE
709,0.6863663792610168,2023-09-04 22:18:58.316269,2023-09-04 22:18:58.489662,0 days 00:00:00.173393,ReLU,Leaky,Sigmoid,ReLU,83,22,20.0,16.0,6.0,0.010863254440250148,4,237,0.13128001045260115,0.0009183558863324998,532.3310443333218,COMPLETE
710,0.3554306626319885,2023-09-04 22:18:58.490106,2023-09-04 22:18:59.098298,0 days 00:00:00.608192,Leaky,Leaky,Sigmoid,Sigmoid,37,12,19.0,24.0,8.0,0.01317388361081978,4,373,0.7044582080106874,0.0021694815839886435,130.96184948512487,COMPLETE
711,0.325236439704895,2023-09-04 22:18:59.098691,2023-09-04 22:19:02.066411,0 days 00:00:02.967720,Tanh,Leaky,Sigmoid,Sigmoid,34,10,21.0,16.0,11.0,0.0021060826052602555,4,317,0.5065858234043443,2.530324138245101e-05,188.5575948899792,COMPLETE
712,0.39504680037498474,2023-09-04 22:19:02.066938,2023-09-04 22:19:02.431466,0 days 00:00:00.364528,Leaky,Leaky,Tanh,Leaky,78,15,20.0,17.0,2.0,0.008675708780307538,4,251,0.31559485796000547,7.146507453027164e-05,627.2766709237728,COMPLETE
713,0.34865719079971313,2023-09-04 22:19:02.431895,2023-09-04 22:19:02.710248,0 days 00:00:00.278353,Tanh,Leaky,Sigmoid,,80,21,18.0,15.0,,0.023652144052005615,3,300,0.2127289848401724,0.00012004182728296612,102.59014396061973,COMPLETE
