number,value,datetime_start,datetime_complete,duration,params_activation1,params_activation2,params_activation3,params_activation4,params_batch_size,params_fl1,params_fl2,params_fl3,params_fl4,params_learning_rate,params_n_layers,params_num_epochs,params_train_size,params_weight_decay,user_attrs_mre,state
1484,0.36664828658103943,2023-09-04 22:50:07.944065,2023-09-04 22:50:12.241887,0 days 00:00:04.297822,Tanh,ReLU,Sigmoid,,33,19,14.0,18.0,,6.999591264442455e-05,3,188,0.6869244773726173,0.00046581327391854765,99.91306966416379,COMPLETE
1485,0.3580268323421478,2023-09-04 22:50:12.242372,2023-09-04 22:50:12.766189,0 days 00:00:00.523817,ReLU,ReLU,ReLU,Tanh,24,23,24.0,7.0,8.0,0.0027753118078466883,4,238,0.21770521248420868,0.0001946137902183691,117.88497924804688,COMPLETE
1486,0.28904175758361816,2023-09-04 22:50:12.766679,2023-09-04 22:50:18.587109,0 days 00:00:05.820430,Leaky,ReLU,,,28,22,11.0,,,0.00019508690569996538,2,262,0.7998566916681003,8.479182027742977e-05,122.43908564249675,COMPLETE
1487,0.3944458067417145,2023-09-04 22:50:18.587588,2023-09-04 22:50:18.874243,0 days 00:00:00.286655,Tanh,Tanh,Tanh,Leaky,40,21,20.0,5.0,9.0,0.027085388190847826,4,133,0.1749502180212826,1.7360349319547368e-05,137.12398413455847,COMPLETE
1488,0.4547538161277771,2023-09-04 22:50:18.874733,2023-09-04 22:50:20.230038,0 days 00:00:01.355305,ReLU,ReLU,ReLU,,21,23,17.0,16.0,,4.98220055592676e-05,3,217,0.1402098730243449,3.648584289080793e-05,109.79313069005167,COMPLETE
1489,0.4840226173400879,2023-09-04 22:50:20.230519,2023-09-04 22:50:21.598032,0 days 00:00:01.367513,ReLU,ReLU,Tanh,ReLU,30,24,15.0,17.0,2.0,0.004807098343468695,4,251,0.7390612796538393,0.0001145958460044137,132.7247221513228,COMPLETE
1490,0.2964177131652832,2023-09-04 22:50:21.598526,2023-09-04 22:50:22.285382,0 days 00:00:00.686856,Tanh,ReLU,ReLU,,26,20,18.0,6.0,,0.006005163140350869,3,244,0.6370839534199293,0.0007111587448428945,200.51931966145833,COMPLETE
1491,0.3387809097766876,2023-09-04 22:50:22.285853,2023-09-04 22:50:24.059988,0 days 00:00:01.774135,ReLU,ReLU,Sigmoid,Leaky,24,3,19.0,15.0,7.0,0.011721407742439205,4,227,0.7527066939635184,2.6797364671388035e-05,114.92787299721928,COMPLETE
1492,0.43609264492988586,2023-09-04 22:50:24.060482,2023-09-04 22:50:24.353342,0 days 00:00:00.292860,Tanh,Tanh,Tanh,,53,22,14.0,17.0,,0.0034541205038933574,3,269,0.16447218437670744,0.0014598400358641168,111.59062663295813,COMPLETE
1493,0.3416101336479187,2023-09-04 22:50:24.353817,2023-09-04 22:50:25.033808,0 days 00:00:00.679991,Leaky,ReLU,ReLU,Tanh,34,20,12.0,7.0,8.0,0.0015391957010627059,4,257,0.4431450823964986,0.0073441618996707096,108.44338139620695,COMPLETE
1494,0.4013129472732544,2023-09-04 22:50:25.034294,2023-09-04 22:50:27.010812,0 days 00:00:01.976518,ReLU,ReLU,Tanh,,43,21,16.0,5.0,,3.6331689673585245e-05,3,237,0.3843084110642403,2.1710369682855245e-05,142.21139194794344,COMPLETE
1495,1.015423059463501,2023-09-04 22:50:27.011287,2023-09-04 22:50:27.425749,0 days 00:00:00.414462,Tanh,Leaky,ReLU,ReLU,28,19,13.0,13.0,9.0,0.009668724887368318,4,248,0.7052491154872549,0.07794679104791553,99.66340446472168,COMPLETE
1496,0.30065569281578064,2023-09-04 22:50:27.426229,2023-09-04 22:50:28.008974,0 days 00:00:00.582745,ReLU,ReLU,Tanh,,38,22,10.0,18.0,,0.016804864912400158,3,259,0.7995996708246895,1.5601938767829327e-05,111.81365006058304,COMPLETE
1497,0.4224978983402252,2023-09-04 22:50:28.009443,2023-09-04 22:50:29.148786,0 days 00:00:01.139343,Sigmoid,ReLU,Sigmoid,Leaky,22,23,21.0,14.0,24.0,0.00788507793574171,4,229,0.770399112053867,0.004812293258236588,147.55463522451896,COMPLETE
1498,0.3043884038925171,2023-09-04 22:50:29.149685,2023-09-04 22:50:29.841877,0 days 00:00:00.692192,Tanh,Tanh,ReLU,,32,21,15.0,16.0,,0.02251991322997385,3,250,0.7296646912794991,0.0011774010588644784,126.66137295677548,COMPLETE
1499,0.39487361907958984,2023-09-04 22:50:29.842376,2023-09-04 22:50:30.189467,0 days 00:00:00.347091,ReLU,,,,20,20,,,,0.04438350444197425,1,270,0.2653235036240223,0.00026821020922597407,127.70698351737781,COMPLETE
1500,0.33830806612968445,2023-09-04 22:50:30.189973,2023-09-04 22:50:30.471643,0 days 00:00:00.281670,Tanh,ReLU,Tanh,,47,24,8.0,15.0,,0.005347075881727363,3,240,0.24042759152223828,0.0001425123139015785,132.0761947631836,COMPLETE
1501,0.35403117537498474,2023-09-04 22:50:30.472111,2023-09-04 22:50:31.280572,0 days 00:00:00.808461,Leaky,ReLU,ReLU,ReLU,26,22,11.0,4.0,6.0,0.006595429144835574,4,168,0.3839933767953362,1.1673525709047595e-05,25983.87043606505,COMPLETE
1502,0.3454708755016327,2023-09-04 22:50:31.281168,2023-09-04 22:50:31.568490,0 days 00:00:00.287322,ReLU,ReLU,Tanh,Leaky,30,19,17.0,7.0,13.0,0.033584178858994534,4,214,0.14891773422467158,0.0003790772522715254,274.09469538149625,COMPLETE
1503,0.3719176650047302,2023-09-04 22:50:31.568974,2023-09-04 22:50:31.838458,0 days 00:00:00.269484,Tanh,ReLU,ReLU,,36,23,12.0,6.0,,0.010551932569368105,3,183,0.1877502501043198,5.742289871796422e-05,1411.4411869049072,COMPLETE
1504,0.28530097007751465,2023-09-04 22:50:31.838925,2023-09-04 22:50:33.654048,0 days 00:00:01.815123,ReLU,Sigmoid,Sigmoid,Tanh,24,21,16.0,17.0,15.0,0.003704919855785833,4,261,0.7696308489647475,3.270441755069834e-05,96.59130380921445,COMPLETE
1505,0.3362845778465271,2023-09-04 22:50:33.654557,2023-09-04 22:50:34.186002,0 days 00:00:00.531445,Tanh,Tanh,ReLU,,27,20,14.0,8.0,,0.008639425617100497,3,232,0.4158963257751969,1.958376875405537e-05,96.04721877154182,COMPLETE
1506,0.3845708668231964,2023-09-04 22:50:34.186487,2023-09-04 22:50:35.430352,0 days 00:00:01.243865,ReLU,ReLU,Tanh,Leaky,22,22,18.0,16.0,23.0,0.013894334312428237,4,246,0.6822465356788896,0.019618444587553165,135.9097003421268,COMPLETE
1507,0.2840236723423004,2023-09-04 22:50:35.430831,2023-09-04 22:50:36.095920,0 days 00:00:00.665089,Leaky,ReLU,ReLU,,35,18,15.0,16.0,,0.018011318953344065,3,271,0.7231185027823307,6.727575170793685e-05,91.37455009691644,COMPLETE
1508,0.3236440420150757,2023-09-04 22:50:36.096403,2023-09-04 22:50:36.817326,0 days 00:00:00.720923,Tanh,ReLU,,,31,14,13.0,,,0.06653839993888475,2,223,0.7525466339792062,0.0005955297125774541,113.36182970878406,COMPLETE
1509,0.38793519139289856,2023-09-04 22:50:36.817788,2023-09-04 22:50:40.228505,0 days 00:00:03.410717,ReLU,Leaky,Tanh,ReLU,29,22,19.0,15.0,7.0,6.482511107074444e-05,4,159,0.5862902832609851,2.6146450158109095e-05,109.48636655987434,COMPLETE
1510,0.35326695442199707,2023-09-04 22:50:40.229002,2023-09-04 22:50:42.794767,0 days 00:00:02.565765,Sigmoid,ReLU,Sigmoid,,20,23,14.0,7.0,,0.004775156901794977,3,254,0.3257673909235887,0.0008108172670102615,113.60391432515691,COMPLETE
1511,0.3175060451030731,2023-09-04 22:50:42.795257,2023-09-04 22:50:46.932851,0 days 00:00:04.137594,Tanh,Tanh,ReLU,Leaky,24,21,17.0,6.0,9.0,0.00089790420285367,4,240,0.761776822129248,4.541295054394193e-05,142.15063142428434,COMPLETE
1512,0.36079710721969604,2023-09-04 22:50:46.933343,2023-09-04 22:50:48.458807,0 days 00:00:01.525464,ReLU,ReLU,Tanh,ReLU,33,20,18.0,22.0,8.0,0.00015160950891013935,4,235,0.19400513017679927,1.378584059639674e-05,127.71329783987491,COMPLETE
1513,0.46068301796913147,2023-09-04 22:50:48.459297,2023-09-04 22:50:48.651427,0 days 00:00:00.192130,Tanh,ReLU,ReLU,,26,24,15.0,17.0,,0.006101519730091035,3,205,0.1115011007484757,0.0017148649971686692,125.6070110321045,COMPLETE
1514,0.33557459712028503,2023-09-04 22:50:48.652025,2023-09-04 22:50:49.727383,0 days 00:00:01.075358,ReLU,ReLU,Tanh,Tanh,28,21,11.0,16.0,17.0,0.0023149087597829463,4,251,0.722201905115056,0.00021637600526853894,92.20090675354004,COMPLETE
1515,0.27750363945961,2023-09-04 22:50:49.727937,2023-09-04 22:50:50.697076,0 days 00:00:00.969139,Leaky,ReLU,ReLU,,25,19,16.0,18.0,,0.012545065548211515,3,404,0.799653078648864,3.097376708421583e-05,104.59090270996094,COMPLETE
1516,0.4645227789878845,2023-09-04 22:50:50.697571,2023-09-04 22:50:52.711123,0 days 00:00:02.013552,Tanh,Tanh,Sigmoid,Leaky,22,22,10.0,17.0,12.0,0.00010713017951133822,4,265,0.1587648874116919,0.00029624267218201106,139.4824407901404,COMPLETE
1517,0.2997399866580963,2023-09-04 22:50:52.711627,2023-09-04 22:50:53.476643,0 days 00:00:00.765016,ReLU,ReLU,Tanh,,19,23,13.0,6.0,,0.024793246902101333,3,248,0.7683802665903499,9.13679380858879e-05,130.57232388583097,COMPLETE
1518,0.3872372806072235,2023-09-04 22:50:53.477150,2023-09-04 22:50:53.861723,0 days 00:00:00.384573,ReLU,ReLU,ReLU,ReLU,30,20,15.0,8.0,13.0,0.007480130228758147,4,177,0.3972228004407503,2.0650179797969804e-05,182.40694754464286,COMPLETE
1519,0.4372926652431488,2023-09-04 22:50:53.862238,2023-09-04 22:50:58.182155,0 days 00:00:04.319917,Tanh,ReLU,Tanh,,32,21,3.0,16.0,,2.32406994334898e-05,3,260,0.6467130228224925,0.00015905715458224977,135.39851740323581,COMPLETE
1520,0.32739531993865967,2023-09-04 22:50:58.182647,2023-09-04 22:50:58.719537,0 days 00:00:00.536890,ReLU,ReLU,,,27,22,17.0,,,0.004090007093041099,2,229,0.49358073751111253,1.6554034621086564e-05,125.87360320220122,COMPLETE
1521,0.30218252539634705,2023-09-04 22:50:58.720030,2023-09-04 22:50:59.879648,0 days 00:00:01.159618,Tanh,Tanh,ReLU,Leaky,23,19,16.0,15.0,7.0,0.009313855840662726,4,149,0.4238483832520528,0.0004938640919700857,249.12546877001154,COMPLETE
1522,0.34490150213241577,2023-09-04 22:50:59.880137,2023-09-04 22:51:00.285517,0 days 00:00:00.405380,Leaky,,,,38,23,,,,0.0028656754906023455,1,241,0.2921675138365774,3.556221364141753e-05,117.0157044728597,COMPLETE
1523,0.3296096622943878,2023-09-04 22:51:00.285988,2023-09-04 22:51:01.474263,0 days 00:00:01.188275,Sigmoid,ReLU,Sigmoid,,29,21,12.0,20.0,,0.015320313762008682,3,271,0.7045418297884726,0.0032197358028563075,112.31628104618618,COMPLETE
1524,0.30923569202423096,2023-09-04 22:51:01.474733,2023-09-04 22:51:02.533985,0 days 00:00:01.059252,ReLU,Leaky,Tanh,Tanh,35,20,11.0,7.0,9.0,0.011399097233927147,4,220,0.7468184817872124,2.5712901102594357e-05,99.98893406080163,COMPLETE
1525,0.3169357180595398,2023-09-04 22:51:02.534469,2023-09-04 22:51:04.364541,0 days 00:00:01.830072,Tanh,ReLU,ReLU,,25,22,14.0,12.0,,0.0018180938922434256,3,254,0.7991655287100524,1.200747924823098e-05,115.66309698304134,COMPLETE
1526,0.40606334805488586,2023-09-04 22:51:04.365017,2023-09-04 22:51:04.634021,0 days 00:00:00.269004,ReLU,ReLU,Tanh,ReLU,41,24,8.0,18.0,8.0,0.0052603537985272085,4,236,0.11831031872274106,0.04263096075645614,192.38179299997728,COMPLETE
1527,0.3565220236778259,2023-09-04 22:51:04.634554,2023-09-04 22:51:05.509389,0 days 00:00:00.874835,Tanh,Tanh,ReLU,,21,20,18.0,5.0,,0.006772981319484568,3,196,0.3364435159530414,0.00011119485623333348,104.90941644483998,COMPLETE
1528,0.5375316143035889,2023-09-04 22:51:05.509858,2023-09-04 22:51:05.721780,0 days 00:00:00.211922,ReLU,ReLU,Sigmoid,Leaky,34,23,23.0,6.0,5.0,0.07579503483150232,4,244,0.1342310566080092,1.8227130811881608e-05,148.61494827270508,COMPLETE
1529,0.3479554057121277,2023-09-04 22:51:05.722266,2023-09-04 22:51:06.247699,0 days 00:00:00.525433,Leaky,Sigmoid,Tanh,ReLU,31,19,13.0,17.0,14.0,0.01968917358041867,4,262,0.281803293902041,7.49310928652159e-05,109.90096486409506,COMPLETE
1530,0.35602834820747375,2023-09-04 22:51:06.248175,2023-09-04 22:51:08.482439,0 days 00:00:02.234264,Tanh,ReLU,ReLU,,27,22,15.0,5.0,,0.00023579715211281954,3,252,0.27803133579713407,0.0026426190324258993,332.0666689797053,COMPLETE
1531,0.7044780850410461,2023-09-04 22:51:08.482920,2023-09-04 22:51:10.328183,0 days 00:00:01.845263,ReLU,ReLU,ReLU,,68,21,12.0,14.0,,1.3754198587009166e-05,3,229,0.5285179923733361,4.703225026740996e-05,95.63434777405585,COMPLETE
1532,0.31055986881256104,2023-09-04 22:51:10.328666,2023-09-04 22:51:12.394685,0 days 00:00:02.066019,Tanh,ReLU,Tanh,Leaky,19,22,20.0,4.0,22.0,0.0032577844602225087,4,272,0.673415232792804,2.2766912624175587e-05,92.53776082684917,COMPLETE
1533,0.4136996269226074,2023-09-04 22:51:12.395182,2023-09-04 22:51:13.072886,0 days 00:00:00.677704,ReLU,Tanh,ReLU,,23,23,16.0,17.0,,0.028608706003251168,3,243,0.7697442497826404,0.08919755336772152,102.93373940207742,COMPLETE
1534,0.35061249136924744,2023-09-04 22:51:13.073376,2023-09-04 22:51:13.840409,0 days 00:00:00.767033,Tanh,ReLU,Tanh,Tanh,29,21,14.0,16.0,9.0,0.00830202459150487,4,257,0.36726302293081176,0.0010041441362887806,131.55570594300616,COMPLETE
1535,0.37592071294784546,2023-09-04 22:51:13.840882,2023-09-04 22:51:14.506007,0 days 00:00:00.665125,ReLU,ReLU,Sigmoid,Leaky,25,24,19.0,2.0,7.0,0.004851599139414941,4,235,0.20431676617591757,0.0001325997436920051,239.8276380266462,COMPLETE
1536,0.3733586370944977,2023-09-04 22:51:14.506497,2023-09-04 22:51:16.888204,0 days 00:00:02.381707,Leaky,ReLU,ReLU,,33,20,17.0,24.0,,3.8867907105383394e-05,3,124,0.7334848555594823,1.4672236631541553e-05,111.37110790129631,COMPLETE
1537,0.5091238021850586,2023-09-04 22:51:16.888693,2023-09-04 22:51:17.147089,0 days 00:00:00.258396,Sigmoid,ReLU,Tanh,ReLU,36,22,10.0,7.0,4.0,0.010696016847374208,4,224,0.10813907491385175,0.0001951850619443584,165.67351512419873,COMPLETE
1538,0.34341976046562195,2023-09-04 22:51:17.147591,2023-09-04 22:51:17.720365,0 days 00:00:00.572774,Tanh,Leaky,ReLU,,22,19,11.0,15.0,,0.00394468344408505,3,247,0.6937804594003033,0.027441343082593217,115.29196608693977,COMPLETE
1539,0.471341609954834,2023-09-04 22:51:17.720847,2023-09-04 22:51:24.791030,0 days 00:00:07.070183,ReLU,Tanh,Tanh,Leaky,20,18,15.0,18.0,6.0,1.7908531206217758e-05,4,214,0.7421864234312054,2.8797298102796607e-05,108.16355646436459,COMPLETE
1540,0.29226192831993103,2023-09-04 22:51:24.791593,2023-09-04 22:51:25.400964,0 days 00:00:00.609371,Tanh,,,,28,23,,,,0.038732747316402145,1,260,0.7686691369940929,3.912238696128338e-05,92.53862226331556,COMPLETE
1541,0.2915714979171753,2023-09-04 22:51:25.401453,2023-09-04 22:51:26.629948,0 days 00:00:01.228495,ReLU,ReLU,Sigmoid,,26,21,18.0,6.0,,0.006071539131890083,3,164,0.7194045561264267,0.0006651701649551689,103.46071434020996,COMPLETE
1542,0.3375179171562195,2023-09-04 22:51:26.630464,2023-09-04 22:51:27.174083,0 days 00:00:00.543619,Tanh,ReLU,,,31,20,14.0,,,0.008542249659669477,2,238,0.4787153686907645,0.00550777853869365,107.55747931344169,COMPLETE
1543,0.4189472794532776,2023-09-04 22:51:27.174588,2023-09-04 22:51:29.285901,0 days 00:00:02.111313,Leaky,ReLU,ReLU,Tanh,39,22,13.0,19.0,8.0,7.302238675179622e-05,4,251,0.2963440921974709,0.0013419679073164194,2364.69278762635,COMPLETE
1544,0.3455376625061035,2023-09-04 22:51:29.286403,2023-09-04 22:51:30.033225,0 days 00:00:00.746822,ReLU,ReLU,Tanh,,24,23,15.0,8.0,,0.050671637620147564,3,274,0.7679887769999759,0.004308600498082517,105.16517771845278,COMPLETE
1545,0.29697760939598083,2023-09-04 22:51:30.033731,2023-09-04 22:51:36.549357,0 days 00:00:06.515626,Tanh,Tanh,ReLU,ReLU,33,21,7.0,16.0,23.0,0.00035703441262408887,4,263,0.7736255800717599,0.00034173550467439843,87.9034406377914,COMPLETE
1546,0.3403065800666809,2023-09-04 22:51:36.549858,2023-09-04 22:51:39.010877,0 days 00:00:02.461019,ReLU,ReLU,Tanh,,30,22,12.0,16.0,,0.0012601154080335282,3,244,0.6602800033446411,0.03466772381963944,92.01167979993318,COMPLETE
1547,0.30254626274108887,2023-09-04 22:51:39.011818,2023-09-04 22:51:39.846521,0 days 00:00:00.834703,ReLU,ReLU,ReLU,Leaky,51,20,16.0,17.0,3.0,0.012745167824773177,4,232,0.7320144513051104,1.9686838374035912e-05,94.91183191935221,COMPLETE
1548,0.4205356240272522,2023-09-04 22:51:39.847015,2023-09-04 22:51:43.016866,0 days 00:00:03.169851,Tanh,ReLU,Sigmoid,,27,23,2.0,17.0,,0.0007836895194706623,3,175,0.6042690038193035,0.014267269705397058,125.57214944022043,COMPLETE
1549,0.33480361104011536,2023-09-04 22:51:43.017348,2023-09-04 22:51:48.598551,0 days 00:00:05.581203,Leaky,Leaky,Tanh,ReLU,21,24,19.0,15.0,1.0,0.0002889463028995749,4,189,0.6992847889060422,5.8038797343552866e-05,102.5278686605474,COMPLETE
1550,1.0854319334030151,2023-09-04 22:51:48.599050,2023-09-04 22:51:51.208226,0 days 00:00:02.609176,Sigmoid,ReLU,ReLU,Leaky,19,19,14.0,6.0,10.0,1.0384357956936391e-05,4,139,0.5559659765727971,0.048680550814962274,100.86060675796197,COMPLETE
1551,0.37469616532325745,2023-09-04 22:51:51.208740,2023-09-04 22:51:52.436459,0 days 00:00:01.227719,ReLU,Tanh,Tanh,,79,21,18.0,21.0,,0.00012032250348595802,3,249,0.30283876461447296,0.0020756283451997862,103.68756912415286,COMPLETE
1552,0.371420681476593,2023-09-04 22:51:52.436932,2023-09-04 22:51:53.212428,0 days 00:00:00.775496,Tanh,ReLU,ReLU,,57,22,22.0,7.0,,0.0026636981059665822,3,259,0.2514429914195605,0.00023753349417407048,250.44098772321428,COMPLETE
1553,0.33059632778167725,2023-09-04 22:51:53.212975,2023-09-04 22:51:54.037645,0 days 00:00:00.824670,ReLU,ReLU,Sigmoid,Tanh,37,20,17.0,15.0,11.0,0.00214800333978029,4,222,0.7493048315052102,0.0005428928481833043,103.1194344797442,COMPLETE
1554,0.3962177336215973,2023-09-04 22:51:54.038159,2023-09-04 22:51:55.226167,0 days 00:00:01.188008,Tanh,ReLU,Tanh,ReLU,25,21,13.0,16.0,12.0,0.0001676709064364287,4,153,0.1763261912842058,1.18696559375931e-05,114.41511381062028,COMPLETE
1555,0.4694178104400635,2023-09-04 22:51:55.226670,2023-09-04 22:52:08.164248,0 days 00:00:12.937578,ReLU,Sigmoid,ReLU,,10,22,21.0,7.0,,4.554075541316537e-05,3,237,0.773455325951535,0.052831214606112134,116.46301282407865,COMPLETE
1556,0.33769330382347107,2023-09-04 22:52:08.164737,2023-09-04 22:52:09.060564,0 days 00:00:00.895827,Tanh,ReLU,ReLU,Leaky,28,23,15.0,5.0,9.0,0.015530606128675266,4,272,0.7211265120217755,1.5711074196706883e-05,106.9933021068573,COMPLETE
1557,0.342702180147171,2023-09-04 22:52:09.061078,2023-09-04 22:52:09.388068,0 days 00:00:00.326990,Leaky,Tanh,Tanh,,71,18,16.0,17.0,,0.007116280668931771,3,253,0.34226697446112064,3.332282191395888e-05,292.31937985303927,COMPLETE
1558,0.4382587671279907,2023-09-04 22:52:09.388558,2023-09-04 22:52:10.306556,0 days 00:00:00.917998,ReLU,ReLU,Sigmoid,ReLU,23,20,11.0,18.0,10.0,0.0005790133769418922,4,207,0.17808414967482297,2.267733146939696e-05,120.99018224080403,COMPLETE
1559,0.25063297152519226,2023-09-04 22:52:10.307061,2023-09-04 22:52:11.583688,0 days 00:00:01.276627,Tanh,ReLU,ReLU,,32,19,10.0,14.0,,0.010092389525226689,3,243,0.7747277626520102,2.6777045157274954e-05,103.65492986043294,COMPLETE
1560,0.2741395831108093,2023-09-04 22:52:11.584182,2023-09-04 22:52:12.705520,0 days 00:00:01.121338,Tanh,ReLU,Tanh,,36,18,10.0,14.0,,0.009356850968223876,3,230,0.7051429904431781,2.8062773468123422e-05,108.44712611607143,COMPLETE
1561,0.31927549839019775,2023-09-04 22:52:12.706493,2023-09-04 22:52:13.761611,0 days 00:00:01.055118,ReLU,ReLU,ReLU,,34,19,10.0,14.0,,0.00774568209710232,3,117,0.7480886300993054,2.6708186286161395e-05,103.38248901367187,COMPLETE
1562,0.3453006148338318,2023-09-04 22:52:13.762120,2023-09-04 22:52:14.493673,0 days 00:00:00.731553,Tanh,ReLU,Tanh,,34,18,11.0,14.0,,0.006001360347789347,3,241,0.4441120934899067,3.49926664304012e-05,101.17193725585938,COMPLETE
1563,0.3345290720462799,2023-09-04 22:52:14.494176,2023-09-04 22:52:15.271840,0 days 00:00:00.777664,ReLU,ReLU,ReLU,,33,19,10.0,14.0,,0.010165393443327243,3,219,0.6813026172831302,2.4825261905443968e-05,116.44524211883545,COMPLETE
1564,0.38218483328819275,2023-09-04 22:52:15.272335,2023-09-04 22:52:16.393114,0 days 00:00:01.120779,Sigmoid,ReLU,Tanh,,37,19,9.0,14.0,,0.004674928089799125,3,243,0.3772391879114985,2.115306926330121e-05,111.72746716748487,COMPLETE
1565,0.37371018528938293,2023-09-04 22:52:16.393616,2023-09-04 22:52:20.808149,0 days 00:00:04.414533,Leaky,ReLU,Sigmoid,,35,18,10.0,15.0,,0.00022670700600236737,3,230,0.7987293210552325,2.9896581016809293e-05,147.20026961616847,COMPLETE
1566,0.28950339555740356,2023-09-04 22:52:20.808624,2023-09-04 22:52:21.638783,0 days 00:00:00.830159,ReLU,ReLU,ReLU,,39,19,9.0,15.0,,0.006825563132743093,3,246,0.7997222175623564,4.6180903746826996e-05,91.95982033865792,COMPLETE
1567,0.3307003378868103,2023-09-04 22:52:21.639292,2023-09-04 22:52:22.479933,0 days 00:00:00.840641,Tanh,ReLU,Tanh,,32,19,10.0,14.0,,0.008537622647903607,3,238,0.5221925939665866,1.774019519640858e-05,200.79674671314382,COMPLETE
1568,0.6245535016059875,2023-09-04 22:52:22.480416,2023-09-04 22:52:24.013631,0 days 00:00:01.533215,ReLU,ReLU,ReLU,,20,4,9.0,15.0,,4.9837850138171385e-05,3,253,0.14180238877669313,3.822418705160802e-05,118.83617383029622,COMPLETE
1569,0.443475604057312,2023-09-04 22:52:24.014116,2023-09-04 22:52:24.255542,0 days 00:00:00.241426,Tanh,ReLU,ReLU,,32,19,10.0,13.0,,0.005569490566274219,3,224,0.13008464665402347,2.3301110803940038e-05,2370.692014857701,COMPLETE
1570,0.31327250599861145,2023-09-04 22:52:24.256044,2023-09-04 22:52:25.061746,0 days 00:00:00.805702,ReLU,ReLU,Tanh,,35,19,10.0,13.0,,0.0017673156259440273,3,233,0.6213776178718117,3.11418409520581e-05,87.76359428243434,COMPLETE
1571,0.357500821352005,2023-09-04 22:52:25.062237,2023-09-04 22:52:25.464955,0 days 00:00:00.402718,Tanh,ReLU,Sigmoid,,22,18,9.0,13.0,,0.0038784735927238187,3,254,0.26317958953528625,1.9654181899057393e-05,280.1040873209635,COMPLETE
1572,0.3468388020992279,2023-09-04 22:52:25.465443,2023-09-04 22:52:26.135850,0 days 00:00:00.670407,Leaky,ReLU,ReLU,,18,19,11.0,14.0,,0.0032426254505103598,3,244,0.7432781534324693,1.4513155023946113e-05,119.81927967071533,COMPLETE
1573,0.3522438108921051,2023-09-04 22:52:26.136351,2023-09-04 22:52:26.640836,0 days 00:00:00.504485,ReLU,ReLU,Tanh,,32,16,10.0,15.0,,0.0013573179810873603,3,261,0.22269355744572147,2.7489343058809947e-05,108.67323424324157,COMPLETE
1574,0.3699764311313629,2023-09-04 22:52:26.641366,2023-09-04 22:52:26.825923,0 days 00:00:00.184557,Tanh,ReLU,Leaky,,37,19,11.0,15.0,,0.0333113128032844,3,215,0.11483236563076818,0.00018149985955789202,166.94673883347284,COMPLETE
1575,0.3686828911304474,2023-09-04 22:52:26.826423,2023-09-04 22:52:27.130047,0 days 00:00:00.303624,ReLU,ReLU,ReLU,,43,20,11.0,15.0,,0.007271349096851778,3,238,0.35747514844600176,9.606501264433375e-05,118.61916669209798,COMPLETE
