number,value,datetime_start,datetime_complete,duration,params_activation1,params_activation2,params_activation3,params_activation4,params_batch_size,params_fl1,params_fl2,params_fl3,params_fl4,params_learning_rate,params_n_layers,params_num_epochs,params_train_size,params_weight_decay,user_attrs_mre,state
893,0.5255249738693237,2023-09-04 22:22:23.189302,2023-09-04 22:22:23.397878,0 days 00:00:00.208576,ReLU,Leaky,Sigmoid,ReLU,56,10,21.0,23.0,11.0,0.001778709357178519,4,170,0.1771484489269237,0.0012431323369770427,110.34972941080729,COMPLETE
894,0.4382065534591675,2023-09-04 22:22:23.398297,2023-09-04 22:22:23.805906,0 days 00:00:00.407609,ReLU,Leaky,Sigmoid,ReLU,57,10,20.0,23.0,12.0,0.0048869931405849205,4,178,0.22644830731716756,2.341495479441707e-05,3714.971512303208,COMPLETE
895,0.4198852479457855,2023-09-04 22:22:23.806325,2023-09-04 22:22:24.488624,0 days 00:00:00.682299,ReLU,Leaky,Sigmoid,ReLU,49,11,20.0,22.0,10.0,0.0012968201737963343,4,179,0.14767759362320318,0.003947904611036399,151.623545281681,COMPLETE
896,0.6379780173301697,2023-09-04 22:22:24.489050,2023-09-04 22:22:24.731631,0 days 00:00:00.242581,ReLU,Leaky,Sigmoid,ReLU,48,10,21.0,22.0,11.0,0.0020906153399301713,4,163,0.10569852725947497,5.5799215391314416e-05,167.7744795365767,COMPLETE
897,0.40377500653266907,2023-09-04 22:22:24.732076,2023-09-04 22:22:25.573521,0 days 00:00:00.841445,Tanh,ReLU,Sigmoid,ReLU,58,11,20.0,23.0,10.0,0.003862091170442375,4,180,0.65347573705229,0.0026482021853721,132.54377568562825,COMPLETE
898,0.2750171422958374,2023-09-04 22:22:25.573933,2023-09-04 22:22:26.317605,0 days 00:00:00.743672,ReLU,Leaky,Tanh,ReLU,55,11,19.0,23.0,12.0,0.0040637525663225075,4,153,0.7172622721405995,8.067472184805538e-05,131.81253366884977,COMPLETE
899,0.5649862289428711,2023-09-04 22:22:26.318011,2023-09-04 22:22:26.911278,0 days 00:00:00.593267,ReLU,Tanh,Sigmoid,ReLU,11,10,21.0,24.0,11.0,0.0014219500795649416,4,172,0.18561266035152518,3.483816142089539e-05,115.6550362326882,COMPLETE
900,0.36823561787605286,2023-09-04 22:22:26.911860,2023-09-04 22:22:27.637161,0 days 00:00:00.725301,ReLU,Leaky,ReLU,ReLU,54,11,18.0,22.0,12.0,0.0026424013574767985,4,182,0.6086324026213498,0.0003241194765828387,113.48631107105928,COMPLETE
901,0.45936688780784607,2023-09-04 22:22:27.637591,2023-09-04 22:22:28.500784,0 days 00:00:00.863193,ReLU,Leaky,Sigmoid,ReLU,46,9,20.0,23.0,10.0,0.000717054527370901,4,192,0.157847452630401,0.00026009281772568064,113.66062045097351,COMPLETE
902,0.3317352533340454,2023-09-04 22:22:28.501192,2023-09-04 22:22:29.508652,0 days 00:00:01.007460,ReLU,Leaky,Sigmoid,ReLU,44,8,21.0,24.0,11.0,0.004278376620205191,4,160,0.6921639920836259,1.2096690137413643e-05,103.17811298370361,COMPLETE
903,0.5907706618309021,2023-09-04 22:22:29.509056,2023-09-04 22:22:29.875270,0 days 00:00:00.366214,ReLU,Leaky,Sigmoid,ReLU,53,22,19.0,22.0,9.0,0.004731772377775346,4,188,0.2651054663059921,0.00015272951261964437,471.39331102371216,COMPLETE
904,0.25350016355514526,2023-09-04 22:22:29.875676,2023-09-04 22:22:31.975545,0 days 00:00:02.099869,ReLU,Leaky,Sigmoid,ReLU,42,11,17.0,24.0,10.0,0.002392270239927385,4,186,0.7242783896992543,0.0017146207880717036,101.9433085603534,COMPLETE
905,0.41312289237976074,2023-09-04 22:22:31.975950,2023-09-04 22:22:32.470036,0 days 00:00:00.494086,ReLU,Leaky,Sigmoid,Sigmoid,60,18,19.0,23.0,12.0,0.0221168186955077,4,135,0.4509878069784399,6.930497510991168e-05,115.90630904487942,COMPLETE
906,0.4550342261791229,2023-09-04 22:22:32.470461,2023-09-04 22:22:34.399470,0 days 00:00:01.929009,ReLU,Leaky,Sigmoid,Sigmoid,41,12,21.0,17.0,13.0,0.0011813705806697503,4,150,0.6944460186668743,0.00043907773626739396,134.64908350431003,COMPLETE
907,1.0534696578979492,2023-09-04 22:22:34.399876,2023-09-04 22:22:34.728892,0 days 00:00:00.329016,Sigmoid,Leaky,Sigmoid,ReLU,50,19,20.0,23.0,7.0,0.0031656449757891812,4,171,0.6549076122759041,0.013570456108298929,103.20884480195888,COMPLETE
908,0.9552480578422546,2023-09-04 22:22:34.729319,2023-09-04 22:22:36.652108,0 days 00:00:01.922789,Tanh,Leaky,Sigmoid,Sigmoid,10,22,20.0,24.0,17.0,0.026794236304142044,4,200,0.7403724699439768,0.00855972585493007,120.13005956013997,COMPLETE
909,0.3353351950645447,2023-09-04 22:22:36.652576,2023-09-04 22:22:38.261733,0 days 00:00:01.609157,ReLU,Leaky,Leaky,Sigmoid,47,3,21.0,22.0,11.0,0.002284235537368377,4,114,0.587627341817513,0.0006738968896408674,132.32581938358774,COMPLETE
910,0.5373343825340271,2023-09-04 22:22:38.262172,2023-09-04 22:22:38.672802,0 days 00:00:00.410630,Tanh,ReLU,Sigmoid,Sigmoid,51,9,19.0,24.0,6.0,0.0015087848333709243,4,322,0.20777296006815005,0.00022389156281876372,123.61865885117474,COMPLETE
911,0.30505064129829407,2023-09-04 22:22:38.673235,2023-09-04 22:22:40.116716,0 days 00:00:01.443481,Sigmoid,Leaky,Sigmoid,Tanh,38,10,16.0,8.0,10.0,0.019715760862378206,4,140,0.7160410053474053,1.9726976400559977e-05,206.6787843051022,COMPLETE
912,0.5729832649230957,2023-09-04 22:22:40.117199,2023-09-04 22:22:41.407415,0 days 00:00:01.290216,Tanh,Tanh,Sigmoid,Sigmoid,40,16,20.0,1.0,5.0,0.0027880614417566825,4,216,0.7503204642059726,4.956216344944232e-05,334.5488176345825,COMPLETE
913,0.46332845091819763,2023-09-04 22:22:41.407866,2023-09-04 22:22:41.944584,0 days 00:00:00.536718,Tanh,Leaky,Tanh,Sigmoid,49,21,21.0,17.0,11.0,0.0008797115718792711,4,166,0.15462682587119916,2.668059085998094e-05,161.94861711774553,COMPLETE
914,1.1031862497329712,2023-09-04 22:22:41.945044,2023-09-04 22:22:42.194415,0 days 00:00:00.249371,Sigmoid,Leaky,ReLU,ReLU,52,17,20.0,23.0,12.0,0.00016103912730411227,4,337,0.339779102066013,0.08220818291130784,100.1374024890718,COMPLETE
915,1.0495548248291016,2023-09-04 22:22:42.194844,2023-09-04 22:22:45.393623,0 days 00:00:03.198779,Tanh,Leaky,Sigmoid,Sigmoid,84,21,18.0,23.0,6.0,1.4843165093273838e-05,4,303,0.6897977581320245,0.016350939109182963,149.22575194607472,COMPLETE
916,0.5818198919296265,2023-09-04 22:22:45.394028,2023-09-04 22:22:46.020131,0 days 00:00:00.626103,ReLU,Leaky,Sigmoid,Sigmoid,82,22,20.0,17.0,5.0,0.00040307861864995507,4,157,0.505304365952407,9.434246572626098e-05,129.37713315593663,COMPLETE
917,1.027679681777954,2023-09-04 22:22:46.020587,2023-09-04 22:22:46.189624,0 days 00:00:00.169037,Tanh,Leaky,Sigmoid,Sigmoid,84,19,19.0,3.0,7.0,0.0015733785575228808,4,439,0.28595212941273274,0.03239739110938258,102.60438919067383,COMPLETE
918,0.4754857122898102,2023-09-04 22:22:46.190070,2023-09-04 22:22:46.958869,0 days 00:00:00.768799,Tanh,Leaky,Sigmoid,Sigmoid,36,11,21.0,16.0,2.0,0.0010550454233269606,4,191,0.11458388328915088,0.0008240284570065674,92.1907131334874,COMPLETE
919,0.6011884808540344,2023-09-04 22:22:46.959279,2023-09-04 22:22:47.366113,0 days 00:00:00.406834,Sigmoid,Leaky,Sigmoid,Sigmoid,52,10,20.0,19.0,12.0,0.034556171371354125,4,232,0.745388721679233,0.00017768507734507925,153.49418961374383,COMPLETE
920,0.5088414549827576,2023-09-04 22:22:47.366514,2023-09-04 22:22:48.375819,0 days 00:00:01.009305,Tanh,Leaky,Sigmoid,Tanh,25,9,21.0,24.0,9.0,0.024590868641470514,4,348,0.6308204019862804,0.015856501040090416,187.8911674901059,COMPLETE
921,1.1696184873580933,2023-09-04 22:22:48.376244,2023-09-04 22:22:51.335133,0 days 00:00:02.958889,Tanh,Leaky,Sigmoid,Sigmoid,43,18,14.0,18.0,6.0,2.1160593420525664e-05,4,179,0.6683217443114869,0.0003727463651409723,101.12821355212334,COMPLETE
922,0.9982574582099915,2023-09-04 22:22:51.335543,2023-09-04 22:22:51.592290,0 days 00:00:00.256747,Sigmoid,ReLU,Sigmoid,ReLU,46,21,19.0,21.0,4.0,0.043175239554851016,4,197,0.5582366580355509,0.006273921801971478,101.29622884897086,COMPLETE
923,0.40917080640792847,2023-09-04 22:22:51.592712,2023-09-04 22:22:52.081934,0 days 00:00:00.489222,ReLU,Leaky,Sigmoid,Sigmoid,39,12,20.0,16.0,10.0,0.00293052620079143,4,322,0.4453740389155246,0.00013771738252114083,225.9030544757843,COMPLETE
924,0.3035251796245575,2023-09-04 22:22:52.082387,2023-09-04 22:22:52.874820,0 days 00:00:00.792433,Tanh,Tanh,Tanh,Leaky,85,19,21.0,4.0,8.0,0.0018307049606412905,4,225,0.7297676255434369,1.6220531959351295e-05,134.39442686050657,COMPLETE
925,1.4322175979614258,2023-09-04 22:22:52.875284,2023-09-04 22:22:53.575617,0 days 00:00:00.700333,Tanh,Leaky,Sigmoid,Sigmoid,82,18,20.0,16.0,11.0,2.93159532579217e-05,4,241,0.13697033078735096,4.4631881425619714e-05,625.9829000259336,COMPLETE
926,0.30208027362823486,2023-09-04 22:22:53.576042,2023-09-04 22:22:54.061329,0 days 00:00:00.485287,Sigmoid,Leaky,Sigmoid,Sigmoid,83,20,22.0,24.0,17.0,0.005419566508038588,4,210,0.7170888277087941,0.00010932171405651618,196.4563691880968,COMPLETE
927,0.4011334180831909,2023-09-04 22:22:54.061764,2023-09-04 22:22:54.301603,0 days 00:00:00.239839,Tanh,Leaky,ReLU,Leaky,86,22,19.0,16.0,5.0,0.015298742910007834,4,316,0.24006465247129904,0.0002844813002888602,137.30734486050076,COMPLETE
928,1.199654459953308,2023-09-04 22:22:54.302045,2023-09-04 22:22:54.716933,0 days 00:00:00.414888,Tanh,Leaky,Sigmoid,Sigmoid,98,21,22.0,9.0,14.0,2.481948539182745e-05,4,125,0.14282429097512425,0.0005129257500958154,200.29327172851563,COMPLETE
929,0.2496635615825653,2023-09-04 22:22:54.717343,2023-09-04 22:22:55.148119,0 days 00:00:00.430776,Tanh,Leaky,Sigmoid,ReLU,85,17,21.0,22.0,13.0,0.018292373870150706,4,336,0.45295707289020626,1.2209659030408256e-05,118.23892623901367,COMPLETE
930,0.3825468122959137,2023-09-04 22:22:55.148523,2023-09-04 22:22:55.795297,0 days 00:00:00.646774,ReLU,Leaky,Sigmoid,Leaky,35,21,18.0,23.0,7.0,0.012008084399614991,4,174,0.7689496043961522,0.006406379606578869,175.0545372596154,COMPLETE
931,0.6504399180412292,2023-09-04 22:22:55.795712,2023-09-04 22:22:57.483202,0 days 00:00:01.687490,Sigmoid,Leaky,Sigmoid,Sigmoid,82,19,20.0,17.0,18.0,0.0005570502171082736,4,146,0.6797630957751156,6.513191432156281e-05,164.83452276987572,COMPLETE
932,0.661212682723999,2023-09-04 22:22:57.483681,2023-09-04 22:22:58.082708,0 days 00:00:00.599027,Tanh,,,,84,20,,,,9.83452836781712e-05,1,219,0.21805130792541702,0.00019917671712628223,147.54694356003853,COMPLETE
933,0.4281758964061737,2023-09-04 22:22:58.083210,2023-09-04 22:22:58.378038,0 days 00:00:00.294828,Tanh,Leaky,Sigmoid,Tanh,95,10,21.0,7.0,4.0,0.015006275688182023,4,247,0.32628490062468324,8.006206847294888e-05,1414.0291610717773,COMPLETE
934,0.4107363224029541,2023-09-04 22:22:58.378636,2023-09-04 22:22:59.267945,0 days 00:00:00.889309,Sigmoid,Leaky,Sigmoid,Sigmoid,100,18,20.0,15.0,16.0,0.005685050070366232,4,233,0.7684669400556893,5.23847742123376e-05,232.50035546955309,COMPLETE
935,0.3148394227027893,2023-09-04 22:22:59.268523,2023-09-04 22:23:00.336540,0 days 00:00:01.068017,Tanh,ReLU,Leaky,Leaky,55,11,19.0,14.0,1.0,0.021026088656443658,4,327,0.7091099019328593,0.0018691223679666864,333.0846140847277,COMPLETE
936,0.3290409445762634,2023-09-04 22:23:00.337095,2023-09-04 22:23:00.981268,0 days 00:00:00.644173,ReLU,Leaky,Sigmoid,Sigmoid,84,8,21.0,10.0,10.0,0.006429552225465278,4,201,0.43582362951503567,0.0009697881808581812,101.51977576279059,COMPLETE
937,0.29466021060943604,2023-09-04 22:23:00.981688,2023-09-04 22:23:02.902073,0 days 00:00:01.920385,Tanh,Tanh,Sigmoid,Leaky,48,20,21.0,16.0,11.0,0.003421299557966014,4,305,0.747785744633723,1.0036482858766717e-05,153.74623579545454,COMPLETE
938,1.2376435995101929,2023-09-04 22:23:02.902508,2023-09-04 22:23:03.758480,0 days 00:00:00.855972,Sigmoid,Leaky,Sigmoid,Sigmoid,19,19,20.0,5.0,5.0,0.0008880009476370413,4,241,0.37841752847451104,0.026597360472233218,105.9623149690174,COMPLETE
939,0.3875519335269928,2023-09-04 22:23:03.758890,2023-09-04 22:23:04.075823,0 days 00:00:00.316933,Tanh,Leaky,Tanh,ReLU,82,22,19.0,24.0,17.0,0.012653019359863512,4,161,0.28424919939390797,0.00012057169034890609,366.5361087880236,COMPLETE
940,0.7259770035743713,2023-09-04 22:23:04.076270,2023-09-04 22:23:05.138452,0 days 00:00:01.062182,Tanh,Leaky,Sigmoid,Sigmoid,80,21,22.0,17.0,6.0,0.0002557673084342882,4,188,0.30514648397372235,1.4803902911506476e-05,1672.427239275993,COMPLETE
941,0.7715626358985901,2023-09-04 22:23:05.138858,2023-09-04 22:23:06.459739,0 days 00:00:01.320881,Tanh,Leaky,Sigmoid,Leaky,87,10,20.0,16.0,12.0,3.235207331048013e-05,4,354,0.20536879956316503,3.931004708276212e-05,107.12769515905003,COMPLETE
942,0.31967800855636597,2023-09-04 22:23:06.460153,2023-09-04 22:23:07.349457,0 days 00:00:00.889304,Sigmoid,Leaky,ReLU,Sigmoid,34,20,20.0,15.0,9.0,0.02987524980306252,4,341,0.6489162834597959,0.00016021778912083081,139.44187854585192,COMPLETE
943,0.4384813606739044,2023-09-04 22:23:07.349881,2023-09-04 22:23:07.833196,0 days 00:00:00.483315,ReLU,Leaky,Sigmoid,Leaky,85,12,21.0,23.0,8.0,0.016556713761527616,4,174,0.7056898891641951,0.0002348201847618076,127.31895611737225,COMPLETE
944,0.24115754663944244,2023-09-04 22:23:07.833629,2023-09-04 22:23:09.113322,0 days 00:00:01.279693,Tanh,Leaky,Sigmoid,Sigmoid,81,11,22.0,15.0,7.0,0.010530931417520914,4,255,0.7670916884892532,9.292227323175637e-05,104.68140655813865,COMPLETE
945,0.608703076839447,2023-09-04 22:23:09.113746,2023-09-04 22:23:09.307543,0 days 00:00:00.193797,Tanh,Leaky,Sigmoid,Tanh,83,9,19.0,14.0,11.0,0.08083891923145163,4,107,0.2470540229998243,0.009718919374844499,208.64735107421876,COMPLETE
946,1.1185027360916138,2023-09-04 22:23:09.307972,2023-09-04 22:23:09.444001,0 days 00:00:00.136029,Sigmoid,Leaky,Sigmoid,Sigmoid,51,18,20.0,20.0,2.0,0.007572566627165781,4,310,0.12938416570854094,0.007794835429707097,107.89582443237305,COMPLETE
947,0.25349509716033936,2023-09-04 22:23:09.444565,2023-09-04 22:23:10.536517,0 days 00:00:01.091952,Tanh,Leaky,Sigmoid,Leaky,38,21,21.0,24.0,7.0,0.02340264609674834,4,224,0.7399849548965248,3.3268157071561386e-05,125.89447082519531,COMPLETE
948,0.39407292008399963,2023-09-04 22:23:10.536950,2023-09-04 22:23:11.898400,0 days 00:00:01.361450,Tanh,ReLU,Sigmoid,ReLU,88,19,18.0,16.0,6.0,0.0004068368716590149,4,240,0.3474774431957406,2.2333270016342247e-05,135.37209590276083,COMPLETE
949,1.0885549783706665,2023-09-04 22:23:11.898816,2023-09-04 22:23:12.462569,0 days 00:00:00.563753,ReLU,Leaky,Sigmoid,Sigmoid,86,20,20.0,15.0,3.0,3.6223364093188984e-05,4,135,0.1662861549596893,5.8590518976258276e-05,256.74434294524013,COMPLETE
950,0.28887835144996643,2023-09-04 22:23:12.463013,2023-09-04 22:23:13.460263,0 days 00:00:00.997250,Sigmoid,Tanh,Sigmoid,Leaky,82,22,21.0,17.0,12.0,0.018003189312174997,4,296,0.6163635998311205,0.00033232148580100804,241.8562428900536,COMPLETE
951,0.6375033259391785,2023-09-04 22:23:13.460688,2023-09-04 22:23:18.377247,0 days 00:00:04.916559,Tanh,Leaky,Sigmoid,Sigmoid,26,17,19.0,16.0,10.0,6.034391988934042e-05,4,252,0.5188145938176791,0.0025018424896711875,164.8157961103651,COMPLETE
952,1.1129871606826782,2023-09-04 22:23:18.377678,2023-09-04 22:23:19.055150,0 days 00:00:00.677472,Tanh,Leaky,Tanh,Sigmoid,44,18,17.0,22.0,17.0,0.0038976971567291317,4,333,0.6808873896796526,0.04107823989924172,101.1347479984678,COMPLETE
953,0.21839256584644318,2023-09-04 22:23:19.055604,2023-09-04 22:23:19.680001,0 days 00:00:00.624397,Tanh,Leaky,Sigmoid,Leaky,84,21,19.0,23.0,19.0,0.013422082986542292,4,231,0.7742980358200333,0.00018896741613016026,141.6710456501354,COMPLETE
954,0.33792030811309814,2023-09-04 22:23:19.680439,2023-09-04 22:23:20.619250,0 days 00:00:00.938811,Tanh,Leaky,Sigmoid,Leaky,86,9,19.0,23.0,20.0,0.011229211392910185,4,227,0.7994695202394474,0.0001809332869442049,159.20423613654242,COMPLETE
955,0.20591633021831512,2023-09-04 22:23:20.619704,2023-09-04 22:23:21.240177,0 days 00:00:00.620473,Tanh,Leaky,ReLU,Leaky,83,19,20.0,23.0,18.0,0.013567188131883451,4,233,0.7723699002687247,0.0002199401184766412,105.95681762695312,COMPLETE
956,0.3354976773262024,2023-09-04 22:23:21.240615,2023-09-04 22:23:21.554460,0 days 00:00:00.313845,Tanh,Leaky,ReLU,Leaky,84,19,19.0,22.0,19.0,0.013888012298039163,4,233,0.7735011272573528,0.00024088345063588,168.96951655337685,COMPLETE
957,0.7377472519874573,2023-09-04 22:23:21.554899,2023-09-04 22:23:24.190572,0 days 00:00:02.635673,Tanh,Leaky,ReLU,Leaky,85,19,20.0,22.0,21.0,1.5424267546679737e-05,4,220,0.7744529373633691,0.00019462294014985413,127.01909030567516,COMPLETE
958,0.28266799449920654,2023-09-04 22:23:24.190997,2023-09-04 22:23:25.898614,0 days 00:00:01.707617,Tanh,Leaky,ReLU,Leaky,88,19,20.0,22.0,20.0,0.0006809564473178333,4,232,0.7485789171996539,0.0002739391338529567,153.64801740975216,COMPLETE
959,0.3525312542915344,2023-09-04 22:23:25.899056,2023-09-04 22:23:26.388144,0 days 00:00:00.489088,Tanh,Leaky,ReLU,Leaky,83,19,19.0,23.0,19.0,0.015635679141614994,4,211,0.7734048626250508,0.00022053541414734142,150.62627017859256,COMPLETE
960,0.40446943044662476,2023-09-04 22:23:26.388586,2023-09-04 22:23:26.588297,0 days 00:00:00.199711,Tanh,Leaky,ReLU,Leaky,80,18,23.0,23.0,18.0,0.0201460824255512,4,221,0.2621180173402333,0.00015925190285438892,95.67858054421164,COMPLETE
961,0.19213254749774933,2023-09-04 22:23:26.588750,2023-09-04 22:23:27.672857,0 days 00:00:01.084107,Tanh,Leaky,ReLU,Leaky,86,19,22.0,22.0,20.0,0.002428225432461666,4,236,0.7485434912399309,0.00019741734845165945,83.64816207028507,COMPLETE
962,0.33933642506599426,2023-09-04 22:23:27.673281,2023-09-04 22:23:28.748077,0 days 00:00:01.074796,Tanh,Leaky,ReLU,Leaky,89,18,23.0,22.0,18.0,0.0005090013621720008,4,238,0.7694844898303635,0.00018048894484633737,2115.833876363347,COMPLETE
963,0.24621720612049103,2023-09-04 22:23:28.748525,2023-09-04 22:23:29.701820,0 days 00:00:00.953295,Tanh,Leaky,ReLU,Leaky,90,19,22.0,22.0,21.0,0.0019388532924620647,4,231,0.7994657375830146,0.00029012018600323765,195.84783875314812,COMPLETE
964,0.42894092202186584,2023-09-04 22:23:29.702245,2023-09-04 22:23:29.941317,0 days 00:00:00.239072,Tanh,Leaky,ReLU,Leaky,87,19,22.0,21.0,19.0,0.003447250837791322,4,225,0.19163686066525776,0.00021930400967166177,123.93711471557617,COMPLETE
965,0.24118490517139435,2023-09-04 22:23:29.941740,2023-09-04 22:23:30.912812,0 days 00:00:00.971072,Tanh,Leaky,ReLU,Leaky,88,18,22.0,21.0,20.0,0.0028859616571540727,4,238,0.7505078732847404,0.00013923500992855616,92.35164849552108,COMPLETE
966,0.2648453116416931,2023-09-04 22:23:30.913252,2023-09-04 22:23:32.056113,0 days 00:00:01.142861,Tanh,Leaky,ReLU,Leaky,86,18,23.0,22.0,19.0,0.0030537078369127528,4,246,0.7363343304448241,0.00018176268661837977,92.30735200580797,COMPLETE
967,0.31336429715156555,2023-09-04 22:23:32.056575,2023-09-04 22:23:32.507871,0 days 00:00:00.451296,Tanh,Leaky,ReLU,Leaky,86,19,22.0,22.0,20.0,0.0024907800060881002,4,228,0.772152700086313,0.0002618831599073308,161.9572970482611,COMPLETE
968,0.2474140077829361,2023-09-04 22:23:32.508302,2023-09-04 22:23:33.419430,0 days 00:00:00.911128,Tanh,Leaky,ReLU,Leaky,84,19,22.0,21.0,18.0,0.0025138626325787532,4,216,0.736401781095086,0.00015164032431240842,236.30923211084652,COMPLETE
969,0.2872149348258972,2023-09-04 22:23:33.419891,2023-09-04 22:23:34.222386,0 days 00:00:00.802495,Tanh,Leaky,ReLU,Leaky,91,19,23.0,23.0,19.0,0.0017922867998721485,4,240,0.7532478516316932,0.00021352251532576967,93.44268341064453,COMPLETE
970,0.263643741607666,2023-09-04 22:23:34.222862,2023-09-04 22:23:35.100751,0 days 00:00:00.877889,Tanh,Leaky,ReLU,Leaky,36,17,22.0,21.0,21.0,0.007076734625521367,4,229,0.7980468005677278,0.00023014556620531393,93.26790793282645,COMPLETE
971,0.26057758927345276,2023-09-04 22:23:35.101271,2023-09-04 22:23:36.178164,0 days 00:00:01.076893,Tanh,Leaky,ReLU,Leaky,88,18,23.0,23.0,19.0,0.001520304420621802,4,242,0.7275279983136023,0.0001837460387692939,98.26228713989258,COMPLETE
972,0.40046584606170654,2023-09-04 22:23:36.178747,2023-09-04 22:23:36.620221,0 days 00:00:00.441474,Tanh,Leaky,ReLU,Leaky,82,18,4.0,22.0,20.0,0.008870320468615295,4,221,0.7698944584246054,0.0001316268072432581,104.45272511449353,COMPLETE
973,0.24211370944976807,2023-09-04 22:23:36.620675,2023-09-04 22:23:37.452138,0 days 00:00:00.831463,Tanh,Leaky,ReLU,Leaky,85,20,8.0,23.0,20.0,0.012750499114431036,4,233,0.7234408505337325,0.0002891775521561685,104.42085493856402,COMPLETE
974,0.30564603209495544,2023-09-04 22:23:37.452647,2023-09-04 22:23:38.480656,0 days 00:00:01.028009,Tanh,Leaky,ReLU,Leaky,84,19,21.0,23.0,19.0,0.0018770406472932305,4,213,0.7717724262320568,0.0002472565883817277,100.19009618759155,COMPLETE
975,0.3448604643344879,2023-09-04 22:23:38.481094,2023-09-04 22:23:39.047073,0 days 00:00:00.565979,Tanh,Leaky,ReLU,Leaky,81,19,22.0,22.0,20.0,0.0022368565668480396,4,248,0.48578029280022833,0.00014575827320518312,173.6915251413981,COMPLETE
976,0.30932337045669556,2023-09-04 22:23:39.047538,2023-09-04 22:23:40.803521,0 days 00:00:01.755983,Tanh,Leaky,ReLU,Leaky,39,18,22.0,23.0,19.0,0.0025723662431063857,4,239,0.7498200407851769,0.00019740053379572507,122.28252179109597,COMPLETE
977,0.4572979211807251,2023-09-04 22:23:40.803971,2023-09-04 22:23:42.806376,0 days 00:00:02.002405,Tanh,Leaky,ReLU,Leaky,86,12,21.0,22.0,22.0,0.0001110377732571553,4,234,0.5458500815802385,0.0001758692643877903,105.69699425982614,COMPLETE
978,0.26596373319625854,2023-09-04 22:23:42.806800,2023-09-04 22:23:43.377961,0 days 00:00:00.571161,Tanh,Leaky,ReLU,Leaky,62,20,22.0,22.0,21.0,0.010667947527139458,4,248,0.7191222095381005,0.00032323800574551767,115.10972870720758,COMPLETE
979,0.3231218755245209,2023-09-04 22:23:43.378396,2023-09-04 22:23:44.620105,0 days 00:00:01.241709,Tanh,Leaky,ReLU,Leaky,83,19,21.0,23.0,19.0,0.0019791485282372504,4,220,0.7733927420865002,0.00011541634603046712,98.85974264835966,COMPLETE
980,0.2677387297153473,2023-09-04 22:23:44.620887,2023-09-04 22:23:45.719957,0 days 00:00:01.099070,Tanh,Leaky,ReLU,Leaky,89,17,23.0,23.0,20.0,0.003042413433765241,4,228,0.7995468334460815,0.00021094494588542052,118.19644388338415,COMPLETE
981,0.24866648018360138,2023-09-04 22:23:45.720379,2023-09-04 22:23:48.729613,0 days 00:00:03.009234,Tanh,Leaky,Leaky,Leaky,28,11,21.0,21.0,18.0,0.0010521998708647748,4,248,0.7991329350130086,0.00026322508721545287,870.8302380961757,COMPLETE
