number,value,datetime_start,datetime_complete,duration,params_activation1,params_activation2,params_activation3,params_activation4,params_batch_size,params_fl1,params_fl2,params_fl3,params_fl4,params_learning_rate,params_n_layers,params_num_epochs,params_train_size,params_weight_decay,user_attrs_mre,state
970,0.3881346583366394,2023-09-04 21:27:52.485268,2023-09-04 21:27:52.934019,0 days 00:00:00.448751,Leaky,Tanh,,,80,18,22.0,,,0.031992343645021286,2,321,0.39957608132656247,0.0016436036629089337,174.26322333757267,COMPLETE
971,0.29620659351348877,2023-09-04 21:27:52.934725,2023-09-04 21:27:53.661505,0 days 00:00:00.726780,Leaky,Tanh,,,82,17,8.0,,,0.02523795291511084,2,306,0.797399352782436,0.00023930002189124968,165.9067234848485,COMPLETE
972,0.30855584144592285,2023-09-04 21:27:53.662058,2023-09-04 21:27:54.169891,0 days 00:00:00.507833,Leaky,ReLU,,,78,18,18.0,,,0.015838125642356763,2,294,0.7232509755469713,0.0004601097883298296,129.26154547471268,COMPLETE
973,0.4894701838493347,2023-09-04 21:27:54.170267,2023-09-04 21:27:56.936440,0 days 00:00:02.766173,ReLU,Tanh,,,83,15,6.0,,,0.00015646463652817325,2,311,0.7991892587540141,0.00020339485900994027,170.29410604495328,COMPLETE
974,0.405356228351593,2023-09-04 21:27:56.936828,2023-09-04 21:27:59.817354,0 days 00:00:02.880526,Leaky,Sigmoid,,,76,17,9.0,,,0.0002465339453139695,2,366,0.6578416361640242,0.00016787450940989446,186.32957279226167,COMPLETE
975,0.4264414310455322,2023-09-04 21:27:59.817729,2023-09-04 21:28:00.189260,0 days 00:00:00.371531,Tanh,,,,57,18,,,,0.008055739467041254,1,483,0.7577278943922294,0.05736768283358102,203.356329176161,COMPLETE
976,0.39670678973197937,2023-09-04 21:28:00.189653,2023-09-04 21:28:00.341546,0 days 00:00:00.151893,Leaky,ReLU,,,79,16,10.0,,,0.020734125542250483,2,283,0.13726930056420197,0.005345145850565128,132.97282708209494,COMPLETE
977,0.4560868740081787,2023-09-04 21:28:00.341931,2023-09-04 21:28:00.529356,0 days 00:00:00.187425,Sigmoid,Tanh,,,90,17,24.0,,,0.05876474818850459,2,324,0.15379364987416805,0.0038280351553450576,229.9801920906442,COMPLETE
978,0.43814340233802795,2023-09-04 21:28:00.529743,2023-09-04 21:28:00.661176,0 days 00:00:00.131433,Tanh,ReLU,,,85,18,23.0,,,0.03885637985162911,2,297,0.1568690760972214,0.00058665577657104,309.98707580566406,COMPLETE
979,0.4173975884914398,2023-09-04 21:28:00.661650,2023-09-04 21:28:01.018652,0 days 00:00:00.357002,Leaky,Tanh,,,19,17,19.0,,,0.010428046839628257,2,288,0.22912119603610917,0.0007849482857000178,176.58142810397678,COMPLETE
980,0.34056663513183594,2023-09-04 21:28:01.019092,2023-09-04 21:28:04.911179,0 days 00:00:03.892087,Tanh,Tanh,,,81,19,8.0,,,0.0005949894004336654,2,473,0.7057807502958993,0.00012917165360703956,138.5069519268786,COMPLETE
981,0.4245221018791199,2023-09-04 21:28:04.911586,2023-09-04 21:28:05.109729,0 days 00:00:00.198143,Leaky,Sigmoid,,,75,17,10.0,,,0.04754936442128732,2,198,0.13684827227120464,0.00015631204692031776,258.4917883389238,COMPLETE
982,0.2649642527103424,2023-09-04 21:28:05.110120,2023-09-04 21:28:05.795928,0 days 00:00:00.685808,Tanh,ReLU,Leaky,Leaky,78,18,9.0,24.0,9.0,0.026127691047241337,4,500,0.7694857658677405,0.00011951609591850418,172.2750308227539,COMPLETE
983,0.5495495796203613,2023-09-04 21:28:05.796332,2023-09-04 21:28:06.095187,0 days 00:00:00.298855,ReLU,Tanh,,,83,16,7.0,,,0.031711742170031136,2,216,0.37891614095771536,0.07807855829119269,238.34644063313803,COMPLETE
984,0.35592126846313477,2023-09-04 21:28:06.095604,2023-09-04 21:28:06.835095,0 days 00:00:00.739491,Leaky,ReLU,,,12,19,23.0,,,0.018283603069845968,2,183,0.29610774233974163,0.00022824106221818054,141.72946184734965,COMPLETE
985,0.7439782023429871,2023-09-04 21:28:06.835510,2023-09-04 21:28:08.199339,0 days 00:00:01.363829,Tanh,Tanh,,,87,18,9.0,,,1.3231491767487957e-05,2,313,0.34561210521284425,0.009349710836568891,115.20185396237115,COMPLETE
986,0.5472636818885803,2023-09-04 21:28:08.199726,2023-09-04 21:28:11.019384,0 days 00:00:02.819658,Leaky,Tanh,,,50,17,22.0,,,3.5366818783037756e-05,2,298,0.5745869490071741,0.0014630945625958658,242.64651873287738,COMPLETE
987,0.2548164427280426,2023-09-04 21:28:11.019799,2023-09-04 21:28:11.677143,0 days 00:00:00.657344,Tanh,ReLU,,,59,17,11.0,,,0.013376501809963299,2,276,0.7392033558553874,0.0001805066778574145,478.9908106023615,COMPLETE
988,0.5134438872337341,2023-09-04 21:28:11.677535,2023-09-04 21:28:12.394232,0 days 00:00:00.716697,Tanh,Sigmoid,,,80,16,7.0,,,0.012923759753292286,2,272,0.6266083364405424,0.019706831349600634,319.2799274533294,COMPLETE
989,0.5236473679542542,2023-09-04 21:28:12.394613,2023-09-04 21:28:15.896289,0 days 00:00:03.501676,Tanh,ReLU,Sigmoid,,58,17,24.0,19.0,,8.746000009965168e-05,3,280,0.6713995545016916,0.0061615864979873885,573.6582761764527,COMPLETE
990,0.3226141035556793,2023-09-04 21:28:15.896683,2023-09-04 21:28:16.414694,0 days 00:00:00.518011,Tanh,Tanh,,,58,16,10.0,,,0.010989651091829703,2,270,0.7154568461341232,0.00027591872518294434,196.65276038128397,COMPLETE
991,0.26209136843681335,2023-09-04 21:28:16.415088,2023-09-04 21:28:17.134341,0 days 00:00:00.719253,Tanh,Tanh,,,56,17,8.0,,,0.014350284580666183,2,277,0.7391634146112773,0.00118120880973165,172.73926798502603,COMPLETE
992,0.369870662689209,2023-09-04 21:28:17.134736,2023-09-04 21:28:17.452679,0 days 00:00:00.317943,Tanh,Tanh,,,61,17,8.0,,,0.009285095349188928,2,273,0.24524155492525349,0.0011090029988659864,145.52803410424127,COMPLETE
993,0.37757933139801025,2023-09-04 21:28:17.453078,2023-09-04 21:28:17.869975,0 days 00:00:00.416897,Tanh,Tanh,,,54,17,8.0,,,0.011835713252853765,2,278,0.2589150503982797,0.0014002564635722577,157.9420928955078,COMPLETE
994,0.3613271117210388,2023-09-04 21:28:17.870468,2023-09-04 21:28:18.310739,0 days 00:00:00.440271,Tanh,Tanh,,,57,16,8.0,,,0.016332624975792888,2,267,0.31085673254555024,0.0019457813826165384,143.24626617431642,COMPLETE
995,0.3484483063220978,2023-09-04 21:28:18.311134,2023-09-04 21:28:18.810355,0 days 00:00:00.499221,Tanh,Tanh,,,58,16,8.0,,,0.013250470968384014,2,279,0.6894867353045407,0.0016488526911907333,257.35817475752395,COMPLETE
996,0.35332047939300537,2023-09-04 21:28:18.810748,2023-09-04 21:28:19.373171,0 days 00:00:00.562423,Tanh,Tanh,,,59,17,7.0,,,0.008867457532302551,2,279,0.5363641339703537,0.0009688350582633202,170.69674424391528,COMPLETE
997,0.499955952167511,2023-09-04 21:28:19.373593,2023-09-04 21:28:19.755659,0 days 00:00:00.382066,Tanh,Tanh,,,59,15,7.0,,,0.016871017757914598,2,262,0.20080818881447335,0.0019802112028682243,126.41739724606884,COMPLETE
998,0.5123064517974854,2023-09-04 21:28:19.756075,2023-09-04 21:28:19.932529,0 days 00:00:00.176454,Tanh,Tanh,,,54,17,8.0,,,0.021278185681727027,2,285,0.1634391611960281,0.00047187849040188437,210.90711075220352,COMPLETE
999,0.5250085592269897,2023-09-04 21:28:19.932950,2023-09-04 21:28:20.094941,0 days 00:00:00.161991,Tanh,Tanh,,,56,17,9.0,,,0.0065338222707171005,2,274,0.11624068660495174,0.0006394372360324568,296.05755750868053,COMPLETE
1000,0.3304924964904785,2023-09-04 21:28:20.095344,2023-09-04 21:28:21.140670,0 days 00:00:01.045326,Tanh,Tanh,,,56,16,5.0,,,0.01439016082007608,2,264,0.7432128744335095,0.0009490731970551535,215.294888866191,COMPLETE
1001,0.5050991773605347,2023-09-04 21:28:21.141177,2023-09-04 21:28:21.481761,0 days 00:00:00.340584,Tanh,Tanh,,,54,2,8.0,,,0.012200323081030064,2,280,0.4426601978100492,0.0013447318381120958,199.20479293096633,COMPLETE
1002,0.2828819751739502,2023-09-04 21:28:21.482253,2023-09-04 21:28:21.903861,0 days 00:00:00.421608,Tanh,Tanh,,,55,18,9.0,,,0.021848155214173437,2,162,0.7174841853460817,0.001211345394493456,240.5774414960076,COMPLETE
1003,0.25680410861968994,2023-09-04 21:28:21.904239,2023-09-04 21:28:22.421185,0 days 00:00:00.516946,Tanh,Tanh,,,56,17,8.0,,,0.01766117359301168,2,272,0.7752129675172454,0.0003301455682117622,494.4677444458008,COMPLETE
1004,0.3488040864467621,2023-09-04 21:28:22.421587,2023-09-04 21:28:23.332592,0 days 00:00:00.911005,Tanh,Tanh,,,53,6,8.0,,,0.01721492837270943,2,260,0.7744957743200677,0.00032637953280803306,177.82965231841465,COMPLETE
1005,0.33924174308776855,2023-09-04 21:28:23.332992,2023-09-04 21:28:23.857985,0 days 00:00:00.524993,Tanh,Tanh,,,55,17,7.0,,,0.014504548381897844,2,272,0.797893098716252,0.0003985872042390535,139.28160839080812,COMPLETE
1006,0.4639071226119995,2023-09-04 21:28:23.858374,2023-09-04 21:28:26.532405,0 days 00:00:02.674031,Tanh,Tanh,,,61,18,8.0,,,0.0001444815437122488,2,253,0.7713046912768773,0.0007751909551990315,207.48888900817147,COMPLETE
1007,0.3253946900367737,2023-09-04 21:28:26.532784,2023-09-04 21:28:27.064629,0 days 00:00:00.531845,Tanh,Tanh,,,55,17,7.0,,,0.018075215071934905,2,273,0.7542113808347916,0.00029760537886139196,129.23699122837613,COMPLETE
1008,0.4317680299282074,2023-09-04 21:28:27.065332,2023-09-04 21:28:27.501375,0 days 00:00:00.436043,Tanh,Tanh,,,58,18,8.0,,,0.015078152443716289,2,265,0.17304634614286593,0.0002465302131659918,216.84954677483975,COMPLETE
1009,0.47667196393013,2023-09-04 21:28:27.502084,2023-09-04 21:28:27.965889,0 days 00:00:00.463805,Tanh,Tanh,,,52,17,8.0,,,0.01041411552647533,2,282,0.10374818182718214,0.016949554710185607,189.66188949835106,COMPLETE
1010,0.407319575548172,2023-09-04 21:28:27.966604,2023-09-04 21:28:28.665440,0 days 00:00:00.698836,Tanh,Sigmoid,,,55,18,8.0,,,0.020078126544559434,2,251,0.14168587302507388,0.0009515719745088289,176.45915789936865,COMPLETE
1011,0.36263903975486755,2023-09-04 21:28:28.666151,2023-09-04 21:28:29.604055,0 days 00:00:00.937904,Tanh,Tanh,,,57,16,7.0,,,0.013173872872765042,2,268,0.34118643834062573,0.00021681581953555436,171.82646220814098,COMPLETE
1012,0.3160071074962616,2023-09-04 21:28:29.604776,2023-09-04 21:28:30.364654,0 days 00:00:00.759878,Tanh,Tanh,,,57,4,6.0,,,0.008172835176767996,2,258,0.7715262009076895,0.00036518010074509054,292.920108795166,COMPLETE
1013,0.3097414970397949,2023-09-04 21:28:30.365041,2023-09-04 21:28:30.883453,0 days 00:00:00.518412,Tanh,Tanh,,,56,17,9.0,,,0.01808062025058925,2,288,0.7374227654204994,0.0011918649394210153,194.52056423453396,COMPLETE
1014,0.3293536603450775,2023-09-04 21:28:30.883848,2023-09-04 21:28:31.695233,0 days 00:00:00.811385,Tanh,Sigmoid,,,53,18,8.0,,,0.02337894062290759,2,287,0.7739956985677502,0.0024135393514422543,169.09684553879958,COMPLETE
1015,0.5362959504127502,2023-09-04 21:28:31.695661,2023-09-04 21:28:34.376033,0 days 00:00:02.680372,Tanh,Tanh,,,59,18,9.0,,,6.204627986095592e-05,2,237,0.7999864302944288,0.0002708656162220568,186.8767159055557,COMPLETE
1016,0.3887971043586731,2023-09-04 21:28:34.376423,2023-09-04 21:28:34.676144,0 days 00:00:00.299721,Tanh,Tanh,,,60,14,7.0,,,0.0106395086241214,2,271,0.27085510180783096,1.522039047251678e-05,337.44644088745116,COMPLETE
1017,0.311524897813797,2023-09-04 21:28:34.676556,2023-09-04 21:28:35.448400,0 days 00:00:00.771844,Tanh,Tanh,,,57,17,9.0,,,0.015922577415678384,2,278,0.7324804153478758,0.00044016026548243225,160.62571033678557,COMPLETE
1018,0.31287261843681335,2023-09-04 21:28:35.449092,2023-09-04 21:28:37.083906,0 days 00:00:01.634814,Tanh,Tanh,,,55,18,8.0,,,0.021189909081258618,2,243,0.7490159513880086,0.0016539999816904424,145.53121777238516,COMPLETE
1019,0.4818595051765442,2023-09-04 21:28:37.084322,2023-09-04 21:28:39.072842,0 days 00:00:01.988520,Tanh,Sigmoid,,,56,16,7.0,,,0.00019477463795222088,2,290,0.4629937043612271,0.0006162736952860638,138.79527466872642,COMPLETE
1020,0.6543322801589966,2023-09-04 21:28:39.073256,2023-09-04 21:28:42.137978,0 days 00:00:03.064722,Tanh,Tanh,,,51,15,8.0,,,1.5978970267207773e-05,2,263,0.7697577121470379,0.001187148124348925,361.12907136982386,COMPLETE
1021,0.3694932162761688,2023-09-04 21:28:42.138397,2023-09-04 21:28:42.643817,0 days 00:00:00.505420,Tanh,Tanh,,,51,17,16.0,,,0.024893279298938555,2,279,0.7978530610742276,0.0007522959024175896,146.949459499783,COMPLETE
1022,0.3679032027721405,2023-09-04 21:28:42.644278,2023-09-04 21:28:47.376715,0 days 00:00:04.732437,Tanh,Tanh,,,53,18,9.0,,,0.000270915107337502,2,289,0.7998240991593152,0.0001963781438791847,194.45940639403452,COMPLETE
1023,0.3607115149497986,2023-09-04 21:28:47.377096,2023-09-04 21:28:47.988268,0 days 00:00:00.611172,Tanh,Sigmoid,,,59,17,8.0,,,0.012772290304193086,2,250,0.7107608858596125,0.0003152890467384372,173.5866029219194,COMPLETE
1024,0.4214974045753479,2023-09-04 21:28:47.988675,2023-09-04 21:28:48.271538,0 days 00:00:00.282863,Tanh,Tanh,,,52,17,7.0,,,0.01847577928985968,2,279,0.28708207243389877,0.0031317445927366325,138.89297803243002,COMPLETE
1025,0.564369261264801,2023-09-04 21:28:48.271934,2023-09-04 21:28:50.184968,0 days 00:00:01.913034,Tanh,Tanh,,,76,18,9.0,,,5.6760434038620426e-05,2,270,0.5761823323144338,0.00018460479847076807,193.70871033845125,COMPLETE
1026,0.3246893882751465,2023-09-04 21:28:50.185358,2023-09-04 21:28:50.835344,0 days 00:00:00.649986,Tanh,Tanh,,,55,18,9.0,,,0.015130830933237215,2,257,0.7420708033116088,0.0018700350355823727,170.01366771351206,COMPLETE
1027,0.3361760079860687,2023-09-04 21:28:50.835756,2023-09-04 21:28:51.285853,0 days 00:00:00.450097,Tanh,Sigmoid,,,75,16,8.0,,,0.0200330501866422,2,290,0.3664723865190918,0.00022301270294677566,214.04220744541712,COMPLETE
1028,0.3283670246601105,2023-09-04 21:28:51.286257,2023-09-04 21:28:52.414547,0 days 00:00:01.128290,Tanh,Tanh,,,29,12,6.0,,,0.007721216545985555,2,267,0.6995178679658246,0.00011043493861724108,210.86390640486533,COMPLETE
1029,0.2705780267715454,2023-09-04 21:28:52.414973,2023-09-04 21:28:53.274854,0 days 00:00:00.859881,Tanh,Tanh,,,35,17,7.0,,,0.011885370709726352,2,292,0.7506394044515652,0.0001378319223734198,215.53848554503242,COMPLETE
1030,0.3249136507511139,2023-09-04 21:28:53.275263,2023-09-04 21:28:53.660212,0 days 00:00:00.384949,Tanh,Tanh,,,89,18,8.0,,,0.025457914860961158,2,227,0.7239172870675576,0.002700508304880133,159.61324254477896,COMPLETE
1031,0.409696489572525,2023-09-04 21:28:53.660744,2023-09-04 21:28:53.977878,0 days 00:00:00.317134,Tanh,Sigmoid,,,86,17,9.0,,,0.005636692277845319,2,280,0.19599618631071447,0.00024113891873494493,134.74437473842076,COMPLETE
1032,0.5270020365715027,2023-09-04 21:28:53.978275,2023-09-04 21:28:54.294137,0 days 00:00:00.315862,Tanh,Tanh,,,54,16,7.0,,,0.00991707760419512,2,275,0.12668865612419744,0.01099105299427146,160.02070392706455,COMPLETE
1033,0.31762105226516724,2023-09-04 21:28:54.294565,2023-09-04 21:28:54.957606,0 days 00:00:00.663041,Tanh,Tanh,,,77,15,8.0,,,0.015839902731426322,2,285,0.7689239896647018,0.001808694573560405,206.81196958627274,COMPLETE
1034,0.5192679762840271,2023-09-04 21:28:54.958036,2023-09-04 21:28:57.493262,0 days 00:00:02.535226,Tanh,,,,50,18,,,,7.999340219331619e-05,1,296,0.6648937695564133,0.0014879576457686372,230.94262071557947,COMPLETE
1035,0.752968966960907,2023-09-04 21:28:57.493648,2023-09-04 21:29:00.083712,0 days 00:00:02.590064,Tanh,Tanh,,,74,18,9.0,,,1.0974773928916188e-05,2,266,0.7992400698173262,0.00018200113861800512,142.72597242656508,COMPLETE
1036,0.2832707166671753,2023-09-04 21:29:00.084103,2023-09-04 21:29:00.432429,0 days 00:00:00.348326,Tanh,Tanh,,,39,17,8.0,,,0.022783458709828515,2,286,0.45393395295656247,9.888609796596714e-05,138.06056606408322,COMPLETE
1037,0.6033454537391663,2023-09-04 21:29:00.432842,2023-09-04 21:29:02.709546,0 days 00:00:02.276704,Tanh,Sigmoid,,,60,19,9.0,,,5.924016846823934e-05,2,258,0.6201552078050571,0.00012398545271658477,577.9008071071418,COMPLETE
1038,0.39538803696632385,2023-09-04 21:29:02.709932,2023-09-04 21:29:04.844827,0 days 00:00:02.134895,Tanh,Tanh,,,78,17,7.0,,,0.001001878323621598,2,244,0.7315949866627693,0.0011007466195410705,146.19253493137046,COMPLETE
1039,0.3625257909297943,2023-09-04 21:29:04.845222,2023-09-04 21:29:05.217173,0 days 00:00:00.371951,Tanh,Tanh,,,22,16,8.0,,,0.027171572968788048,2,296,0.22039794533761048,0.0003499976317802454,153.21146824048913,COMPLETE
1040,0.30545079708099365,2023-09-04 21:29:05.217586,2023-09-04 21:29:07.310081,0 days 00:00:02.092495,Tanh,Tanh,,,83,18,10.0,,,0.0012249933081366082,2,274,0.6961057557060659,1.2522084827901495e-05,141.82103765010834,COMPLETE
1041,0.38606753945350647,2023-09-04 21:29:07.310500,2023-09-04 21:29:07.752069,0 days 00:00:00.441569,ReLU,Sigmoid,,,86,19,9.0,,,0.09906786936215113,2,297,0.7627805966281456,0.0008062684370572123,209.1419695073908,COMPLETE
1042,0.42738276720046997,2023-09-04 21:29:07.752478,2023-09-04 21:29:08.222017,0 days 00:00:00.469539,Tanh,Tanh,,,79,17,17.0,,,0.019302638013844565,2,394,0.7526742683943402,0.02247412678935557,214.55802121369734,COMPLETE
1043,0.40837037563323975,2023-09-04 21:29:08.222429,2023-09-04 21:29:08.701078,0 days 00:00:00.478649,Tanh,Tanh,,,76,18,10.0,,,0.012988479263160855,2,147,0.7141730529461755,0.01405458296966816,170.27412258848852,COMPLETE
1044,0.424160361289978,2023-09-04 21:29:08.701462,2023-09-04 21:29:09.100492,0 days 00:00:00.399030,Tanh,ReLU,,,85,17,8.0,,,0.017020354707852868,2,346,0.39758684044773396,0.028998561087316625,240.47581765311105,COMPLETE
1045,0.3748052716255188,2023-09-04 21:29:09.100879,2023-09-04 21:29:09.551139,0 days 00:00:00.450260,Tanh,Tanh,,,81,18,15.0,,,0.0017329453058370467,2,205,0.1436883178373497,7.368080725677149e-05,337.086032625524,COMPLETE
1046,0.3132171928882599,2023-09-04 21:29:09.551518,2023-09-04 21:29:10.143502,0 days 00:00:00.591984,ReLU,ReLU,,,88,16,6.0,,,0.006889154759769205,2,287,0.7732234609635721,0.00016114529692847922,155.0165048024011,COMPLETE
1047,0.40015292167663574,2023-09-04 21:29:10.143908,2023-09-04 21:29:12.309515,0 days 00:00:02.165607,Tanh,Tanh,,,93,17,9.0,,,0.00016431735572489394,2,254,0.799106554450636,0.0005692171997677949,683.1323934239665,COMPLETE
1048,0.3884020447731018,2023-09-04 21:29:12.309901,2023-09-04 21:29:12.574152,0 days 00:00:00.264251,Tanh,Sigmoid,,,56,19,7.0,,,0.02259157476159143,2,280,0.16253756579906625,0.0004897168053867851,139.31708886888293,COMPLETE
1049,0.320413202047348,2023-09-04 21:29:12.574555,2023-09-04 21:29:12.894071,0 days 00:00:00.319516,Tanh,Tanh,,,84,18,10.0,,,0.027719956815320804,2,265,0.4857577641345309,0.00020197405769182037,191.64356146918402,COMPLETE
1050,0.3669915497303009,2023-09-04 21:29:12.894476,2023-09-04 21:29:13.454765,0 days 00:00:00.560289,Tanh,ReLU,,,74,17,8.0,,,0.009418432434014265,2,298,0.6509593776039801,0.00013909540544904746,165.68558059200163,COMPLETE
1051,0.539892315864563,2023-09-04 21:29:13.455187,2023-09-04 21:29:15.966561,0 days 00:00:02.511374,Tanh,Tanh,,,77,18,14.0,,,0.00012510240538403145,2,426,0.46681405941734866,0.00010563783543677128,252.0196633674729,COMPLETE
1052,0.38307660818099976,2023-09-04 21:29:15.966965,2023-09-04 21:29:16.556261,0 days 00:00:00.589296,ReLU,Tanh,,,25,19,9.0,,,0.01483694192998612,2,231,0.6876558672938353,0.002259547943194993,238.4064089018723,COMPLETE
1053,0.551461398601532,2023-09-04 21:29:16.556665,2023-09-04 21:29:18.240703,0 days 00:00:01.684038,Tanh,ReLU,,,53,16,20.0,,,0.0004916308252279919,2,271,0.7434305860308742,0.08346180811453668,189.16138411541374,COMPLETE
1054,0.3735429048538208,2023-09-04 21:29:18.241131,2023-09-04 21:29:18.489507,0 days 00:00:00.248376,Tanh,Sigmoid,,,80,18,9.0,,,0.06967926510206666,2,220,0.33066847362519375,0.0008779865405246439,265.81701015896266,COMPLETE
1055,0.49063146114349365,2023-09-04 21:29:18.489907,2023-09-04 21:29:19.181977,0 days 00:00:00.692070,Tanh,Tanh,,,91,19,8.0,,,0.0003587195142283681,2,174,0.3215693239778002,0.00028324176301163656,199.0085842965663,COMPLETE
1056,0.36772963404655457,2023-09-04 21:29:19.182366,2023-09-04 21:29:19.569738,0 days 00:00:00.387372,Tanh,Tanh,,,82,17,8.0,,,0.019570726030174974,2,305,0.43357129530058836,0.00018694143485800902,162.74809240916417,COMPLETE
1057,0.28579461574554443,2023-09-04 21:29:19.570142,2023-09-04 21:29:20.219009,0 days 00:00:00.648867,Tanh,ReLU,,,79,18,19.0,,,0.011433519785235702,2,278,0.771577193039437,0.0001201423339941221,172.78322529792786,COMPLETE
1058,0.4369233548641205,2023-09-04 21:29:20.219416,2023-09-04 21:29:20.393435,0 days 00:00:00.174019,ReLU,Tanh,,,57,16,7.0,,,0.030034000806964715,2,295,0.25819179133843567,0.0001524176568733905,175.84052474410444,COMPLETE
1059,0.47134262323379517,2023-09-04 21:29:20.393859,2023-09-04 21:29:21.271486,0 days 00:00:00.877627,Tanh,ReLU,ReLU,,75,17,10.0,5.0,,0.0005663010436180936,3,287,0.17917026290437674,8.459688892356155e-05,250.79610671721642,COMPLETE
1060,0.8308025598526001,2023-09-04 21:29:21.271932,2023-09-04 21:29:23.239624,0 days 00:00:01.967692,Tanh,Sigmoid,,,84,18,10.0,,,1.9362184511825434e-05,2,238,0.7257796182331596,0.003976982901526618,232.8955714762712,COMPLETE
1061,0.25022345781326294,2023-09-04 21:29:23.240024,2023-09-04 21:29:23.781928,0 days 00:00:00.541904,Tanh,Tanh,,,77,19,9.0,,,0.023100639459310943,2,264,0.7997215717314421,6.534519449149458e-05,233.26365123075598,COMPLETE
1062,0.2740403413772583,2023-09-04 21:29:23.782356,2023-09-04 21:29:24.110766,0 days 00:00:00.328410,Tanh,Tanh,,,76,20,9.0,,,0.024566036981146143,2,251,0.7796187824028145,6.629168279888122e-05,163.91751670837402,COMPLETE
1063,0.35500866174697876,2023-09-04 21:29:24.111191,2023-09-04 21:29:24.526749,0 days 00:00:00.415558,Tanh,ReLU,,,77,19,10.0,,,0.03166500637107283,2,245,0.7992094995616255,5.7306079225210434e-05,379.4658467060811,COMPLETE
1064,0.3244978189468384,2023-09-04 21:29:24.527167,2023-09-04 21:29:24.818427,0 days 00:00:00.291260,ReLU,Tanh,,,74,19,9.0,,,0.022594742747725338,2,256,0.49468269305500046,6.443537796267521e-05,298.69147406684027,COMPLETE
1065,0.3787771165370941,2023-09-04 21:29:24.818851,2023-09-04 21:29:25.056737,0 days 00:00:00.237886,Tanh,Tanh,,,78,19,10.0,,,0.026939967382749522,2,266,0.23787685530027405,7.466400411091886e-05,123.02566237016158,COMPLETE
1066,0.3311271071434021,2023-09-04 21:29:25.057156,2023-09-04 21:29:26.836801,0 days 00:00:01.779645,Tanh,ReLU,,,77,20,9.0,,,0.0009126869005131493,2,262,0.777079383180002,9.331888320811369e-05,195.65256130820828,COMPLETE
