number,value,datetime_start,datetime_complete,duration,params_activation1,params_activation2,params_activation3,params_activation4,params_batch_size,params_fl1,params_fl2,params_fl3,params_fl4,params_learning_rate,params_n_layers,params_num_epochs,params_train_size,params_weight_decay,user_attrs_mre,state
1832,0.3562180697917938,2023-09-04 21:41:26.638920,2023-09-04 21:41:27.480579,0 days 00:00:00.841659,Leaky,Tanh,,,63,18,10.0,,,0.007097027956836083,2,275,0.2869296228512864,3.1170145725917513e-05,673.2702115145596,COMPLETE
1833,0.37794578075408936,2023-09-04 21:41:27.481561,2023-09-04 21:41:29.019278,0 days 00:00:01.537717,Tanh,Sigmoid,,,82,17,24.0,,,0.003446342552863257,2,283,0.7704073935695829,0.0002844767126393879,225.24164277763776,COMPLETE
1834,0.5274737477302551,2023-09-04 21:41:29.019816,2023-09-04 21:41:29.278167,0 days 00:00:00.258351,Tanh,ReLU,Sigmoid,,70,19,9.0,17.0,,0.01847726727367235,3,313,0.10676020583076241,0.00014847567112730782,162.71999564537634,COMPLETE
1835,1.0313621759414673,2023-09-04 21:41:29.278711,2023-09-04 21:41:29.566743,0 days 00:00:00.288032,Tanh,Tanh,,,73,12,23.0,,,2.4717520054154628e-05,2,78,0.15630322199142713,0.00010978754716384654,136.52830671652768,COMPLETE
1836,0.3624955713748932,2023-09-04 21:41:29.567271,2023-09-04 21:41:30.048469,0 days 00:00:00.481198,Leaky,Tanh,,,77,13,15.0,,,0.013057076421370788,2,326,0.5064531878612676,0.00017577666563224216,212.8104203322838,COMPLETE
1837,0.3817874789237976,2023-09-04 21:41:30.049075,2023-09-04 21:41:30.338181,0 days 00:00:00.289106,ReLU,ReLU,,,84,17,11.0,,,0.022289938001005774,2,266,0.3358490420948557,0.010191177917293093,158.10606349598277,COMPLETE
1838,0.26203545928001404,2023-09-04 21:41:30.338714,2023-09-04 21:41:31.623775,0 days 00:00:01.285061,Tanh,Sigmoid,,,80,21,17.0,,,0.0013572276763206591,2,391,0.7998519282409815,2.2584003668595507e-05,127.31298906221164,COMPLETE
1839,0.27509263157844543,2023-09-04 21:41:31.624310,2023-09-04 21:41:31.996994,0 days 00:00:00.372684,Tanh,Tanh,Leaky,,82,18,12.0,10.0,,0.044065845385741445,3,297,0.725860316432504,7.826815158392596e-05,151.37053131103517,COMPLETE
1840,0.3704907298088074,2023-09-04 21:41:31.997502,2023-09-04 21:41:32.517138,0 days 00:00:00.519636,Tanh,ReLU,,,87,19,24.0,,,0.0757939480290422,2,424,0.6830910561182773,1.5880189633457934e-05,155.27965266887958,COMPLETE
1841,0.3156602084636688,2023-09-04 21:41:32.517649,2023-09-04 21:41:33.016034,0 days 00:00:00.498385,Leaky,Tanh,,,75,10,10.0,,,0.015528783766540719,2,306,0.6252439422802344,0.01823664133202,1434.020559273514,COMPLETE
1842,0.3134407103061676,2023-09-04 21:41:33.016626,2023-09-04 21:41:34.381028,0 days 00:00:01.364402,Tanh,Sigmoid,,,72,17,9.0,,,0.0041797762501155486,2,320,0.49558881200758137,0.0003825733555073515,173.48501326398153,COMPLETE
1843,0.3653731048107147,2023-09-04 21:41:34.381579,2023-09-04 21:41:34.857938,0 days 00:00:00.476359,Sigmoid,ReLU,Sigmoid,,85,20,23.0,12.0,,0.03550160091499898,3,405,0.36008819944931963,4.0841424425942265e-05,3974.270371048539,COMPLETE
1844,0.5518247485160828,2023-09-04 21:41:34.858469,2023-09-04 21:41:35.832366,0 days 00:00:00.973897,Tanh,Tanh,,,79,16,13.0,,,5.714574893661753e-05,2,123,0.5944683928893197,0.0008266252102679692,258.3195514213748,COMPLETE
1845,0.6181372404098511,2023-09-04 21:41:35.832883,2023-09-04 21:41:37.534871,0 days 00:00:01.701988,Tanh,Tanh,,,77,18,11.0,,,7.039341243657524e-05,2,289,0.4571246359264088,0.0138673741976613,210.88532328358158,COMPLETE
1846,0.25822699069976807,2023-09-04 21:41:37.535381,2023-09-04 21:41:37.977841,0 days 00:00:00.442460,Leaky,Sigmoid,,,98,19,22.0,,,0.027844211583259795,2,274,0.7498967910460528,0.00021842533041958545,140.30001467750185,COMPLETE
1847,0.40788063406944275,2023-09-04 21:41:37.978379,2023-09-04 21:41:41.221198,0 days 00:00:03.242819,ReLU,ReLU,,,65,14,10.0,,,0.0001997140741689114,2,344,0.7121302853598435,0.00013755172255936512,160.73317461235578,COMPLETE
1848,0.5642743110656738,2023-09-04 21:41:41.221745,2023-09-04 21:41:41.384023,0 days 00:00:00.162278,Tanh,Tanh,,,81,15,24.0,,,0.018351152018414457,2,367,0.10152110448887446,0.00010126175426324574,191.6021218135439,COMPLETE
1849,0.4541972279548645,2023-09-04 21:41:41.384557,2023-09-04 21:41:45.362114,0 days 00:00:03.977557,Tanh,ReLU,ReLU,,83,18,8.0,7.0,,9.707295544336579e-05,3,382,0.7719101568555986,0.00018844068943231598,250.32188351616185,COMPLETE
1850,0.4505992531776428,2023-09-04 21:41:45.362635,2023-09-04 21:41:49.431753,0 days 00:00:04.069118,Tanh,Tanh,,,74,17,12.0,,,8.230699925917036e-05,2,438,0.7478275893603791,0.00011807973472585964,282.2130287901996,COMPLETE
1851,0.4387761056423187,2023-09-04 21:41:49.432281,2023-09-04 21:41:49.785071,0 days 00:00:00.352790,Leaky,Sigmoid,,,78,20,11.0,,,0.01103968088454055,2,302,0.24989211578937784,0.004954395368187399,160.2843410937817,COMPLETE
1852,0.3453202247619629,2023-09-04 21:41:49.785608,2023-09-04 21:41:50.190300,0 days 00:00:00.404692,Tanh,ReLU,,,76,18,24.0,,,0.052121211364377654,2,457,0.7744384293061782,5.7640346319973543e-05,277.13158884356096,COMPLETE
1853,0.3200010657310486,2023-09-04 21:41:50.190836,2023-09-04 21:41:52.153210,0 days 00:00:01.962374,Tanh,Tanh,,,89,17,10.0,,,0.0019183659697690437,2,264,0.6507778814373986,0.0003125103105526413,191.36364191228694,COMPLETE
1854,0.2930734157562256,2023-09-04 21:41:52.153758,2023-09-04 21:41:52.813165,0 days 00:00:00.659407,Tanh,Tanh,Sigmoid,,68,19,23.0,14.0,,0.023637648272788993,3,98,0.7077910848737347,0.00015378249122311778,552.3056930541992,COMPLETE
1855,0.3534531593322754,2023-09-04 21:41:52.813708,2023-09-04 21:41:53.799763,0 days 00:00:00.986055,ReLU,Sigmoid,,,80,16,9.0,,,0.0054380959355387875,2,309,0.38289077471688515,1.292471943748177e-05,247.8632028345118,COMPLETE
1856,0.574256956577301,2023-09-04 21:41:53.800303,2023-09-04 21:41:54.174315,0 days 00:00:00.374012,Leaky,ReLU,,,86,22,10.0,,,0.03685797789870324,2,286,0.5507735365866505,0.07701352947659319,184.35201212565104,COMPLETE
1857,0.2721693515777588,2023-09-04 21:41:54.174837,2023-09-04 21:41:54.675748,0 days 00:00:00.500911,Tanh,Tanh,,,84,18,11.0,,,0.01428465559914512,2,50,0.7341829938311104,0.001891622615091247,138.34007943194845,COMPLETE
1858,0.3482706546783447,2023-09-04 21:41:54.676306,2023-09-04 21:41:57.969047,0 days 00:00:03.292741,Tanh,ReLU,Tanh,,61,13,23.0,3.0,,0.0004525102306225905,3,295,0.7692829793882324,0.006567788525326809,189.03982870495273,COMPLETE
1859,0.3801853358745575,2023-09-04 21:41:57.969572,2023-09-04 21:41:59.357364,0 days 00:00:01.387792,Tanh,Sigmoid,,,78,17,24.0,,,0.0028204986358391845,2,325,0.6974421371945451,0.0014499708615847838,436.2680656186996,COMPLETE
1860,0.433939129114151,2023-09-04 21:41:59.357916,2023-09-04 21:41:59.565064,0 days 00:00:00.207148,Leaky,Tanh,,,47,19,20.0,,,0.006967008744970454,2,89,0.14007266982338895,9.15638860736026e-05,121.15191650390625,COMPLETE
1861,0.8038257956504822,2023-09-04 21:41:59.565562,2023-09-04 21:42:00.371739,0 days 00:00:00.806177,Tanh,ReLU,,,39,18,9.0,,,3.5294769345303364e-05,2,275,0.11199405247543473,0.0034773374397483094,108.29560438676315,COMPLETE
1862,0.5011482238769531,2023-09-04 21:42:00.372259,2023-09-04 21:42:00.560436,0 days 00:00:00.188177,Tanh,Tanh,,,82,17,10.0,,,0.08998378968648088,2,315,0.12947307617354856,7.262546333924187e-05,289.3250540597098,COMPLETE
1863,0.403059184551239,2023-09-04 21:42:00.561017,2023-09-04 21:42:01.066217,0 days 00:00:00.505200,Tanh,Sigmoid,Sigmoid,,75,19,22.0,10.0,,0.019543675166527295,3,358,0.7338728605002243,0.0027415125284081473,199.52673612322127,COMPLETE
1864,0.7662558555603027,2023-09-04 21:42:01.066800,2023-09-04 21:42:01.708419,0 days 00:00:00.641619,ReLU,Tanh,,,70,16,11.0,,,4.9463033701324674e-05,2,161,0.2292777792956442,0.00013304534672139187,115.53374400642348,COMPLETE
1865,0.31007227301597595,2023-09-04 21:42:01.708920,2023-09-04 21:42:02.198619,0 days 00:00:00.489699,Tanh,,,,80,8,,,,0.03023946311229076,1,256,0.6782761456557252,0.0006750489501329718,132.31984035304336,COMPLETE
1866,0.2736944258213043,2023-09-04 21:42:02.199129,2023-09-04 21:42:02.776863,0 days 00:00:00.577734,Leaky,ReLU,,,77,18,12.0,,,0.00918593341597153,2,281,0.7991117175136764,0.0002242083262568496,147.34882339166134,COMPLETE
1867,0.6695801019668579,2023-09-04 21:42:02.777375,2023-09-04 21:42:04.923577,0 days 00:00:02.146202,Sigmoid,Tanh,,,73,18,23.0,,,0.00011441282609675878,2,413,0.7713714288659791,0.00016641685075978,238.5172951374579,COMPLETE
1868,0.317927747964859,2023-09-04 21:42:04.924135,2023-09-04 21:42:06.506241,0 days 00:00:01.582106,Tanh,ReLU,,,88,19,9.0,,,0.0010674890037544857,2,300,0.7466062255032219,1.9185090691496193e-05,511.8906616551916,COMPLETE
1869,0.48536884784698486,2023-09-04 21:42:06.506798,2023-09-04 21:42:07.393563,0 days 00:00:00.886765,Tanh,Sigmoid,Sigmoid,,82,20,19.0,4.0,,0.012318189801519603,3,286,0.7996090199099785,0.00011679585065033248,198.91071637471518,COMPLETE
1870,0.3545624315738678,2023-09-04 21:42:07.394548,2023-09-04 21:42:07.967386,0 days 00:00:00.572838,Tanh,Tanh,,,94,17,21.0,,,0.025435156326347488,2,336,0.3160173370393785,8.650325365433236e-05,858.9950325705788,COMPLETE
1871,0.4029155969619751,2023-09-04 21:42:07.967951,2023-09-04 21:42:09.013696,0 days 00:00:01.045745,Leaky,ReLU,,,91,19,24.0,,,0.000334091833716416,2,377,0.24729924273541323,0.008536813799244399,182.26396249193664,COMPLETE
1872,0.32106301188468933,2023-09-04 21:42:09.014214,2023-09-04 21:42:10.825764,0 days 00:00:01.811550,Tanh,Tanh,,,79,24,8.0,,,0.0005833687760495398,2,309,0.45050125781453065,2.6545241272646858e-05,121.22305959559567,COMPLETE
1873,0.31595057249069214,2023-09-04 21:42:10.826279,2023-09-04 21:42:11.184232,0 days 00:00:00.357953,Tanh,Sigmoid,,,84,16,10.0,,,0.04267200510584949,2,146,0.4053555284960534,0.00019062079949553964,145.60165481567384,COMPLETE
1874,0.2844740152359009,2023-09-04 21:42:11.184761,2023-09-04 21:42:12.092152,0 days 00:00:00.907391,ReLU,Tanh,Leaky,,76,13,13.0,11.0,,0.01697879338602732,3,267,0.7204208184636542,0.0005099682682946663,99.95535239195212,COMPLETE
1875,0.3100808262825012,2023-09-04 21:42:12.092665,2023-09-04 21:42:12.755726,0 days 00:00:00.663061,Tanh,ReLU,,,66,14,11.0,,,0.022813595138212375,2,322,0.7488777179276825,0.0021462375326128397,141.05064954255758,COMPLETE
1876,0.33798283338546753,2023-09-04 21:42:12.756242,2023-09-04 21:42:13.228504,0 days 00:00:00.472262,Leaky,Tanh,,,86,18,12.0,,,0.06370308980160434,2,136,0.6734735120823994,0.00026367414735486516,132.6807106865777,COMPLETE
1877,0.4203009605407715,2023-09-04 21:42:13.229002,2023-09-04 21:42:13.602677,0 days 00:00:00.373675,Tanh,ReLU,,,81,15,24.0,,,0.004365577866893168,2,292,0.2126037360461902,3.4432446037950625e-05,164.1429502169291,COMPLETE
1878,0.5222489833831787,2023-09-04 21:42:13.603182,2023-09-04 21:42:16.009369,0 days 00:00:02.406187,Tanh,Sigmoid,,,80,21,10.0,,,0.00017374804378271277,2,258,0.7715921046904827,0.0001369245444146069,220.7751289781674,COMPLETE
1879,0.3342605233192444,2023-09-04 21:42:16.009862,2023-09-04 21:42:16.605033,0 days 00:00:00.595171,Tanh,Tanh,Tanh,,71,23,9.0,5.0,,0.0335256904800801,3,392,0.7999688845776274,0.0001042173982801728,233.07595405578613,COMPLETE
1880,0.4357954263687134,2023-09-04 21:42:16.605535,2023-09-04 21:42:18.804361,0 days 00:00:02.198826,Leaky,ReLU,Sigmoid,Tanh,78,17,23.0,13.0,23.0,0.0014144140902951246,4,111,0.7044929352799184,5.067861619021005e-05,192.67056630452473,COMPLETE
1881,0.2873295545578003,2023-09-04 21:42:18.804889,2023-09-04 21:42:19.187800,0 days 00:00:00.382911,Tanh,Tanh,,,63,18,16.0,,,0.015202384294657841,2,278,0.4883609941804909,0.0009100873470115694,671.4784898024338,COMPLETE
1882,0.34589412808418274,2023-09-04 21:42:19.188507,2023-09-04 21:42:19.781970,0 days 00:00:00.593463,Tanh,Sigmoid,,,83,12,9.0,,,0.01999284369689492,2,297,0.5254489436953205,0.00015214395394318254,185.4289789444361,COMPLETE
1883,0.34137701988220215,2023-09-04 21:42:19.782563,2023-09-04 21:42:20.383431,0 days 00:00:00.600868,ReLU,Tanh,,,68,18,15.0,,,0.010902021732907165,2,307,0.5798832023169656,0.00019448333343808198,137.8608863265426,COMPLETE
1884,0.3081568479537964,2023-09-04 21:42:20.384405,2023-09-04 21:42:21.748691,0 days 00:00:01.364286,Tanh,ReLU,,,74,20,8.0,,,0.028846020899645948,2,315,0.7334699726301976,1.1823257267205235e-05,137.84920816836149,COMPLETE
1885,0.301256000995636,2023-09-04 21:42:21.749659,2023-09-04 21:42:23.459094,0 days 00:00:01.709435,Leaky,Tanh,ReLU,,87,17,14.0,20.0,,0.008395892745765566,3,289,0.6240161314311068,1.009140430235042e-05,242.64400282639724,COMPLETE
1886,0.46868255734443665,2023-09-04 21:42:23.460094,2023-09-04 21:42:23.809902,0 days 00:00:00.349808,Tanh,ReLU,,,76,19,10.0,,,0.047644735071897315,2,249,0.7631846678759323,0.03755371494260434,217.7673797607422,COMPLETE
1887,0.4418008625507355,2023-09-04 21:42:23.810418,2023-09-04 21:42:24.304624,0 days 00:00:00.494206,Tanh,Sigmoid,,,79,17,11.0,,,0.0016943969698076568,2,277,0.10499375274389869,7.105606770117722e-05,442.5655852923375,COMPLETE
1888,0.43005338311195374,2023-09-04 21:42:24.305137,2023-09-04 21:42:27.383115,0 days 00:00:03.077978,Tanh,Tanh,,,85,20,24.0,,,0.0001679964954219861,2,327,0.6536678306158249,0.00559094986248234,170.81944666871237,COMPLETE
1889,0.4772548973560333,2023-09-04 21:42:27.383641,2023-09-04 21:42:27.993105,0 days 00:00:00.609464,Leaky,ReLU,Sigmoid,,96,19,23.0,1.0,,0.013385485090837682,3,300,0.7242624282890704,0.00011813355592306076,302.6201723788647,COMPLETE
1890,0.35048526525497437,2023-09-04 21:42:27.993630,2023-09-04 21:42:28.358976,0 days 00:00:00.365346,Tanh,Tanh,,,81,18,10.0,,,0.03673544283220543,2,361,0.27389991384442625,9.686022801643924e-05,233.84502233217842,COMPLETE
1891,0.5901554226875305,2023-09-04 21:42:28.359519,2023-09-04 21:42:28.580784,0 days 00:00:00.221265,Sigmoid,Sigmoid,,,78,16,11.0,,,0.0058329729450822005,2,266,0.22532230011672694,0.0038609667833921935,191.99589255196707,COMPLETE
1892,0.39756476879119873,2023-09-04 21:42:28.581285,2023-09-04 21:42:28.801458,0 days 00:00:00.220173,Tanh,ReLU,,,90,17,24.0,,,0.025590205066380364,2,313,0.2675010492606323,0.0005958257975722379,150.07267219789566,COMPLETE
1893,0.4071424901485443,2023-09-04 21:42:28.801972,2023-09-04 21:42:30.873217,0 days 00:00:02.071245,ReLU,Tanh,,,83,18,9.0,,,0.0007360295324563076,2,284,0.7729374895315667,0.001173679518496018,142.10256120469836,COMPLETE
1894,0.29027146100997925,2023-09-04 21:42:30.873728,2023-09-04 21:42:31.431944,0 days 00:00:00.558216,Tanh,Tanh,,,73,17,22.0,,,0.021759059805373068,2,272,0.6985595783337936,0.0003857890728614433,812.9893153263972,COMPLETE
1895,0.2421962022781372,2023-09-04 21:42:31.432468,2023-09-04 21:42:32.043506,0 days 00:00:00.611038,Leaky,ReLU,Tanh,,76,19,23.0,8.0,,0.017703553323241437,3,346,0.7537110876624874,0.00015396578001943768,199.35364134415337,COMPLETE
1896,0.4055475890636444,2023-09-04 21:42:32.044060,2023-09-04 21:42:32.456152,0 days 00:00:00.412092,Leaky,Sigmoid,Tanh,,71,18,12.0,8.0,,0.015437444651654428,3,348,0.17253176645903323,0.00017482701906077492,144.4949405125209,COMPLETE
1897,0.2467937022447586,2023-09-04 21:42:32.456682,2023-09-04 21:42:33.276284,0 days 00:00:00.819602,Leaky,ReLU,Tanh,,75,9,10.0,9.0,,0.012100650978821754,3,369,0.73028530465633,0.0002296134303773978,1083.5625596887926,COMPLETE
1898,0.29867151379585266,2023-09-04 21:42:33.276832,2023-09-04 21:42:33.909567,0 days 00:00:00.632735,Leaky,ReLU,Tanh,,72,16,10.0,8.0,,0.01106097613828272,3,367,0.6828235271337132,0.0002533358270891987,161.2016349205604,COMPLETE
1899,0.3148135542869568,2023-09-04 21:42:33.910083,2023-09-04 21:42:34.434370,0 days 00:00:00.524287,Leaky,ReLU,Tanh,,72,18,10.0,9.0,,0.010244551219859517,3,357,0.6421590957548736,0.0002767672577180586,172.0160983773165,COMPLETE
1900,0.25834691524505615,2023-09-04 21:42:34.434916,2023-09-04 21:42:35.131982,0 days 00:00:00.697066,Leaky,ReLU,Tanh,,74,19,10.0,9.0,,0.011716392660138365,3,389,0.6999949197035089,0.00023202778161515538,124.7683342243063,COMPLETE
1901,0.2902800738811493,2023-09-04 21:42:35.132500,2023-09-04 21:42:35.785886,0 days 00:00:00.653386,Leaky,ReLU,Tanh,,74,9,10.0,10.0,,0.013753993303755574,3,371,0.6697235071250599,0.0003349546259832391,709.2140191396078,COMPLETE
1902,0.4726687967777252,2023-09-04 21:42:35.786422,2023-09-04 21:42:36.009955,0 days 00:00:00.223533,Leaky,ReLU,Tanh,,74,4,10.0,7.0,,0.00988145899514651,3,394,0.15099115850140954,0.00022309368517939464,3231.4300310289536,COMPLETE
1903,0.32690486311912537,2023-09-04 21:42:36.010476,2023-09-04 21:42:36.753345,0 days 00:00:00.742869,Leaky,ReLU,Tanh,,75,10,11.0,12.0,,0.012505057981786855,3,379,0.7156740415682504,0.00020802863172099983,383.71251811678445,COMPLETE
1904,0.3529098331928253,2023-09-04 21:42:36.753880,2023-09-04 21:42:37.240190,0 days 00:00:00.486310,Leaky,ReLU,Tanh,,72,6,10.0,11.0,,0.01564452628482987,3,368,0.7296940923342979,0.0003370374017763964,358.1082305908203,COMPLETE
1905,0.3642371594905853,2023-09-04 21:42:37.240710,2023-09-04 21:42:38.085944,0 days 00:00:00.845234,Leaky,ReLU,Tanh,,73,8,9.0,9.0,,0.00824099277494613,3,363,0.6744277281525058,0.0002495050876321142,477.57769307454424,COMPLETE
1906,0.4152567982673645,2023-09-04 21:42:38.086458,2023-09-04 21:42:38.328980,0 days 00:00:00.242522,Leaky,ReLU,Tanh,,75,9,11.0,8.0,,0.009994178534367931,3,375,0.12653852305793842,0.00019623525201213887,130.84457617539627,COMPLETE
1907,0.3256000280380249,2023-09-04 21:42:38.329512,2023-09-04 21:42:39.232204,0 days 00:00:00.902692,Leaky,ReLU,Tanh,,75,9,10.0,6.0,,0.012694422063226424,3,373,0.7387690931501188,0.00029294094631159446,118.22225089695142,COMPLETE
1908,0.32509350776672363,2023-09-04 21:42:39.232742,2023-09-04 21:42:40.089453,0 days 00:00:00.856711,Leaky,ReLU,Tanh,,72,7,9.0,11.0,,0.00688299017565774,3,363,0.7023923914248335,0.00016724676257327345,206.77087485953552,COMPLETE
1909,0.4537094831466675,2023-09-04 21:42:40.089976,2023-09-04 21:42:40.374176,0 days 00:00:00.284200,Leaky,ReLU,Tanh,,75,11,11.0,9.0,,0.016876425521539614,3,361,0.11596812577673704,0.00019181102340207635,196.49848335667662,COMPLETE
1910,0.4909024238586426,2023-09-04 21:42:40.374716,2023-09-04 21:42:40.619970,0 days 00:00:00.245254,Leaky,ReLU,Tanh,,73,3,9.0,10.0,,0.01341779758141913,3,368,0.19163185432449012,0.00015624248477550098,303.0061974776419,COMPLETE
1911,0.3490248918533325,2023-09-04 21:42:40.620506,2023-09-04 21:42:41.085882,0 days 00:00:00.465376,Leaky,ReLU,Tanh,,76,11,10.0,8.0,,0.00830602322541242,3,382,0.43676967481818024,0.0002576476250359114,193.67352012351708,COMPLETE
1912,0.4281063675880432,2023-09-04 21:42:41.086416,2023-09-04 21:42:41.536178,0 days 00:00:00.449762,Leaky,ReLU,Tanh,,70,9,11.0,12.0,,0.016602988737759842,3,391,0.2384696382947796,0.00021152954974060738,363.224844455719,COMPLETE
1913,0.601935863494873,2023-09-04 21:42:41.536713,2023-09-04 21:42:41.876756,0 days 00:00:00.340043,Leaky,ReLU,Tanh,,74,1,10.0,7.0,,0.010691757179967551,3,378,0.30068581012553197,0.00014301378091835824,479.52009137471515,COMPLETE
1914,0.4416777789592743,2023-09-04 21:42:41.877276,2023-09-04 21:42:45.975663,0 days 00:00:04.098387,Leaky,ReLU,Tanh,,77,17,10.0,10.0,,0.000139621992936991,3,352,0.7449981318484787,0.04185451710510956,553.4912179600109,COMPLETE
1915,0.5006720423698425,2023-09-04 21:42:45.976178,2023-09-04 21:42:46.319365,0 days 00:00:00.343187,Leaky,ReLU,Tanh,,76,6,11.0,7.0,,0.0031104426774979316,3,359,0.14454881904370948,4.4797916819460436e-05,209.8638459128895,COMPLETE
1916,0.373029887676239,2023-09-04 21:42:46.319888,2023-09-04 21:42:46.800757,0 days 00:00:00.480869,Leaky,ReLU,Tanh,,72,16,9.0,6.0,,0.013559978411283678,3,375,0.3725533277566377,0.0003039941937377901,195.54486846923828,COMPLETE
1917,0.25163447856903076,2023-09-04 21:42:46.801272,2023-09-04 21:42:47.285903,0 days 00:00:00.484631,Leaky,ReLU,Tanh,,77,6,10.0,11.0,,0.017975680993021385,3,382,0.6533125741970381,0.00017333996563018264,125.75604419708252,COMPLETE
1918,0.338493287563324,2023-09-04 21:42:47.286427,2023-09-04 21:42:47.814785,0 days 00:00:00.528358,Leaky,ReLU,Tanh,,75,10,9.0,11.0,,0.01930413628626691,3,384,0.6279452027775462,0.00011998499309515336,215.9638746106947,COMPLETE
1919,0.3360308110713959,2023-09-04 21:42:47.815316,2023-09-04 21:42:48.718193,0 days 00:00:00.902877,Leaky,ReLU,Tanh,,77,9,9.0,12.0,,0.018383684414557996,3,375,0.6239300047209536,0.00015726206181820965,178.41966959635417,COMPLETE
1920,0.4892410337924957,2023-09-04 21:42:48.719187,2023-09-04 21:42:53.801199,0 days 00:00:05.082012,Leaky,ReLU,Tanh,,77,6,10.0,11.0,,4.577923344439719e-05,3,379,0.668643520962399,6.263047309150991e-05,321.4835017664766,COMPLETE
1921,0.2965344488620758,2023-09-04 21:42:53.801699,2023-09-04 21:42:54.256538,0 days 00:00:00.454839,Leaky,ReLU,Tanh,,76,20,9.0,13.0,,0.019375931790299478,3,369,0.6520688197970528,0.00022418591145893416,225.0266227722168,COMPLETE
1922,0.39937013387680054,2023-09-04 21:42:54.257051,2023-09-04 21:42:54.567145,0 days 00:00:00.310094,Leaky,ReLU,Tanh,,75,7,10.0,10.0,,0.016542566191480677,3,384,0.5856840546174318,0.00013777275749406715,252.4189543290572,COMPLETE
1923,0.42589071393013,2023-09-04 21:42:54.567667,2023-09-04 21:42:55.028307,0 days 00:00:00.460640,Leaky,ReLU,Tanh,,75,5,9.0,9.0,,0.02247016753244775,3,387,0.6871271979485525,0.0001704358561714842,218.69125758579798,COMPLETE
1924,0.52550208568573,2023-09-04 21:42:55.028832,2023-09-04 21:42:55.304422,0 days 00:00:00.275590,Leaky,ReLU,Tanh,,76,8,10.0,12.0,,0.019362655843934987,3,383,0.209300545596009,7.957911159438668e-05,222.9511725685813,COMPLETE
1925,0.4748663604259491,2023-09-04 21:42:55.304935,2023-09-04 21:42:55.593256,0 days 00:00:00.288321,Leaky,ReLU,Tanh,,73,20,10.0,10.0,,0.015732847694797564,3,384,0.20263228821830429,0.011059888159657848,268.51790220841116,COMPLETE
1926,0.5361005663871765,2023-09-04 21:42:55.593816,2023-09-04 21:42:59.567336,0 days 00:00:03.973520,Leaky,ReLU,Tanh,,77,7,9.0,13.0,,9.292566868027057e-05,3,371,0.5574735751821644,0.06548968797226513,129.20305168789352,COMPLETE
