number,value,datetime_start,datetime_complete,duration,params_activation1,params_activation2,params_activation3,params_activation4,params_batch_size,params_fl1,params_fl2,params_fl3,params_fl4,params_learning_rate,params_n_layers,params_num_epochs,params_train_size,params_weight_decay,user_attrs_mre,state
286,0.37202882766723633,2023-09-04 21:57:00.686058,2023-09-04 21:57:02.107302,0 days 00:00:01.421244,ReLU,ReLU,ReLU,,42,19,17.0,7.0,,0.0325245669225358,3,208,0.6918295022238931,0.00014712339351546032,106.05233931541443,COMPLETE
287,0.36175182461738586,2023-09-04 21:57:02.107834,2023-09-04 21:57:02.853833,0 days 00:00:00.745999,ReLU,Tanh,ReLU,,46,19,19.0,5.0,,0.043541332824547085,3,195,0.7487397052667848,0.00010398937112315172,96.27430681501116,COMPLETE
288,0.32676130533218384,2023-09-04 21:57:02.854156,2023-09-04 21:57:03.522791,0 days 00:00:00.668635,ReLU,ReLU,ReLU,,36,20,18.0,6.0,,0.03028034296158017,3,226,0.6538732499130242,8.783718668180035e-05,106.99845086074457,COMPLETE
289,0.39294666051864624,2023-09-04 21:57:03.523096,2023-09-04 21:57:03.803663,0 days 00:00:00.280567,ReLU,,,,38,19,,,,0.06334714084311559,1,242,0.7040233587041118,0.00016376891444287102,104.9826945429263,COMPLETE
290,0.3178163766860962,2023-09-04 21:57:03.803958,2023-09-04 21:57:04.144580,0 days 00:00:00.340622,ReLU,Tanh,ReLU,,39,21,18.0,4.0,,0.056601405129261186,3,299,0.4002767575253711,0.000488743593557946,103.36843270966502,COMPLETE
291,0.347626268863678,2023-09-04 21:57:04.144886,2023-09-04 21:57:04.704229,0 days 00:00:00.559343,ReLU,Tanh,ReLU,Sigmoid,43,20,15.0,2.0,17.0,0.02521386100994771,4,178,0.7700514022868492,0.0002022624748701756,104.11334754680765,COMPLETE
292,0.3319334387779236,2023-09-04 21:57:04.704543,2023-09-04 21:57:05.517210,0 days 00:00:00.812667,ReLU,,,,56,21,,,,0.022745627446170022,1,225,0.7251923704180321,0.00011036092702052647,97.76467751167915,COMPLETE
293,0.30668437480926514,2023-09-04 21:57:05.517718,2023-09-04 21:57:06.854511,0 days 00:00:01.336793,ReLU,ReLU,ReLU,Tanh,58,18,17.0,3.0,10.0,0.032287320189233845,4,275,0.7715607492389436,3.1546944504015884e-05,109.23524033395867,COMPLETE
294,0.4288829267024994,2023-09-04 21:57:06.854835,2023-09-04 21:57:07.610736,0 days 00:00:00.755901,ReLU,Tanh,ReLU,,47,19,19.0,4.0,,0.001443102763459034,3,75,0.4910652289197658,5.577248626630857e-05,100.01228139241536,COMPLETE
295,0.2960653305053711,2023-09-04 21:57:07.611054,2023-09-04 21:57:08.005621,0 days 00:00:00.394567,Sigmoid,,,,40,17,,,,0.03954391532911573,1,242,0.6616305103511044,7.432772929810628e-05,117.06299992611534,COMPLETE
296,0.3461376428604126,2023-09-04 21:57:08.005936,2023-09-04 21:57:08.368663,0 days 00:00:00.362727,Tanh,Tanh,ReLU,ReLU,71,21,18.0,10.0,7.0,0.05227003878728641,4,169,0.6145930559930238,1.6567619163073594e-05,89.3396155834198,COMPLETE
297,0.3127932548522949,2023-09-04 21:57:08.368981,2023-09-04 21:57:08.706611,0 days 00:00:00.337630,ReLU,ReLU,,,36,20,13.0,,,0.026927186544420396,2,189,0.7373488594699252,2.3782488977483755e-05,119.57727414085751,COMPLETE
298,0.3624643087387085,2023-09-04 21:57:08.706927,2023-09-04 21:57:09.210381,0 days 00:00:00.503454,Tanh,Tanh,,,33,22,20.0,,,0.022526818660223366,2,163,0.7997723807168712,0.00013318714211296847,124.14220673697335,COMPLETE
299,0.3186618685722351,2023-09-04 21:57:09.210695,2023-09-04 21:57:09.796137,0 days 00:00:00.585442,Tanh,Leaky,ReLU,Tanh,38,16,17.0,6.0,22.0,0.012122968638456072,4,90,0.7142939818183438,3.8410303155698996e-05,87.96518260035022,COMPLETE
300,0.33723607659339905,2023-09-04 21:57:09.796466,2023-09-04 21:57:10.178903,0 days 00:00:00.382437,Tanh,,,,31,15,,,,0.019666126296561393,1,234,0.6855042775532838,2.8670537770408508e-05,101.76741790771484,COMPLETE
301,0.34217917919158936,2023-09-04 21:57:10.179197,2023-09-04 21:57:10.962666,0 days 00:00:00.783469,Tanh,Tanh,,,29,17,6.0,,,0.014903191540861054,2,51,0.7473994824459061,0.0032622415434866957,99.00797253985738,COMPLETE
302,0.3435554504394531,2023-09-04 21:57:10.962974,2023-09-04 21:57:11.431590,0 days 00:00:00.468616,ReLU,Sigmoid,,,41,20,19.0,,,0.009344506911226751,2,262,0.7105721137005044,6.0937198824114077e-05,104.30698282578412,COMPLETE
303,0.4105089604854584,2023-09-04 21:57:11.431925,2023-09-04 21:57:13.032583,0 days 00:00:01.600658,Sigmoid,Sigmoid,ReLU,,34,22,14.0,8.0,,0.0009521533659439872,3,81,0.7663985147897798,8.512603883662197e-05,126.53529593385296,COMPLETE
304,0.2658167779445648,2023-09-04 21:57:13.032903,2023-09-04 21:57:13.684469,0 days 00:00:00.651566,Tanh,Sigmoid,,,37,21,15.0,,,0.02756496526493916,2,220,0.7708320909135822,0.00017300782711692167,79.90181397228706,COMPLETE
305,0.31075936555862427,2023-09-04 21:57:13.684773,2023-09-04 21:57:14.026387,0 days 00:00:00.341614,Tanh,Sigmoid,,,39,21,15.0,,,0.04188031072724244,2,253,0.7744943592163274,0.00013559892071365152,88.25290752592541,COMPLETE
306,0.2673049569129944,2023-09-04 21:57:14.026689,2023-09-04 21:57:15.324934,0 days 00:00:01.298245,Tanh,,,,34,21,,,,0.006350360071445271,1,233,0.7486656668210708,0.0001588304402014548,105.38237755043993,COMPLETE
307,0.2950736880302429,2023-09-04 21:57:15.325236,2023-09-04 21:57:16.158355,0 days 00:00:00.833119,Tanh,,,,35,21,,,,0.0060117066908528,1,216,0.743311020194228,0.00019755240781680488,93.99969586459073,COMPLETE
308,0.42538556456565857,2023-09-04 21:57:16.158653,2023-09-04 21:57:16.319966,0 days 00:00:00.161313,Tanh,,,,37,21,,,,0.007110253749398765,1,218,0.16433551653049924,0.00018872796205316296,113.08568475601521,COMPLETE
309,0.37064704298973083,2023-09-04 21:57:16.320255,2023-09-04 21:57:16.636775,0 days 00:00:00.316520,Tanh,,,,37,20,,,,0.008129407575304542,1,224,0.4362749803531156,0.0002928926435326534,114.5889207793445,COMPLETE
310,0.29893922805786133,2023-09-04 21:57:16.637115,2023-09-04 21:57:17.340017,0 days 00:00:00.702902,Tanh,,,,34,20,,,,0.006166738617692527,1,207,0.7307012867691008,0.0001718105895753384,106.82430087002841,COMPLETE
311,0.3150307834148407,2023-09-04 21:57:17.340315,2023-09-04 21:57:17.778746,0 days 00:00:00.438431,Tanh,,,,40,21,,,,0.010965547731059577,1,210,0.5351162539907047,0.00011333044389201296,420.7243206787109,COMPLETE
312,0.3792804479598999,2023-09-04 21:57:17.779031,2023-09-04 21:57:18.056484,0 days 00:00:00.277453,Tanh,,,,37,22,,,,0.003480383588521055,1,246,0.2267867928828474,0.00015053023670616493,123.9433468580246,COMPLETE
313,0.31208547949790955,2023-09-04 21:57:18.056776,2023-09-04 21:57:18.723240,0 days 00:00:00.666464,Tanh,ReLU,Tanh,Sigmoid,92,19,16.0,1.0,19.0,0.005180378258582102,4,237,0.6326717183852298,1.4503804998364137e-05,99.75467159323496,COMPLETE
314,0.3294866979122162,2023-09-04 21:57:18.723558,2023-09-04 21:57:19.996353,0 days 00:00:01.272795,ReLU,,,,36,21,,,,0.0020804126901769913,1,227,0.6734914396160531,1.9515147819738504e-05,111.84169440433897,COMPLETE
315,0.35144320130348206,2023-09-04 21:57:19.996645,2023-09-04 21:57:20.132195,0 days 00:00:00.135550,Tanh,,,,52,22,,,,0.009268182185098648,1,200,0.10956420305683488,0.00022473896948149662,131.95561525898594,COMPLETE
316,0.3185006380081177,2023-09-04 21:57:20.132482,2023-09-04 21:57:20.663334,0 days 00:00:00.530852,Tanh,Tanh,ReLU,,45,19,2.0,2.0,,0.03224786016970478,3,233,0.5853426770694039,0.00017207427472058185,182.48197065080916,COMPLETE
317,0.5573081970214844,2023-09-04 21:57:20.663758,2023-09-04 21:57:21.818631,0 days 00:00:01.154873,Tanh,Tanh,Sigmoid,Leaky,61,20,18.0,7.0,3.0,0.0002754416850028488,4,263,0.7572168586353099,0.00021801141201871518,115.51360079608386,COMPLETE
318,0.35184648633003235,2023-09-04 21:57:21.819089,2023-09-04 21:57:22.065979,0 days 00:00:00.246890,Tanh,,,,65,18,,,,0.012997443028777842,1,103,0.3548771128660497,0.00045965746735470467,165.61863597523083,COMPLETE
319,0.34177860617637634,2023-09-04 21:57:22.066266,2023-09-04 21:57:23.563711,0 days 00:00:01.497445,ReLU,Sigmoid,ReLU,Tanh,33,5,13.0,2.0,12.0,0.006942957134544768,4,219,0.7739899895768578,0.00011147444238849487,116.62536203861237,COMPLETE
320,0.321345716714859,2023-09-04 21:57:23.564035,2023-09-04 21:57:24.097559,0 days 00:00:00.533524,Tanh,Leaky,ReLU,,42,21,11.0,5.0,,0.010282596913238542,3,149,0.509332169822365,0.00035247960495526215,99.88195139567057,COMPLETE
321,0.3207260072231293,2023-09-04 21:57:24.097873,2023-09-04 21:57:24.719293,0 days 00:00:00.621420,Tanh,,,,35,22,,,,0.01647058115020168,1,158,0.6979611692915414,0.0007842565588226716,120.53678747323843,COMPLETE
322,0.2691914141178131,2023-09-04 21:57:24.719601,2023-09-04 21:57:25.808095,0 days 00:00:01.088494,Tanh,Sigmoid,,,12,20,6.0,,,0.027821553998567273,2,172,0.7989479627902306,0.000267377851793617,120.27710780390987,COMPLETE
323,0.3232889175415039,2023-09-04 21:57:25.808423,2023-09-04 21:57:26.077826,0 days 00:00:00.269403,Tanh,Sigmoid,,,49,20,5.0,,,0.02777327807692885,2,175,0.4620315858425579,0.00028227208845649503,117.16615738407258,COMPLETE
324,0.3499361276626587,2023-09-04 21:57:26.078143,2023-09-04 21:57:28.160591,0 days 00:00:02.082448,ReLU,Sigmoid,,,12,21,6.0,,,0.03604766229366548,2,283,0.7951105348249742,0.00016673448402821929,99.60185579153207,COMPLETE
325,0.3406679034233093,2023-09-04 21:57:28.160907,2023-09-04 21:57:28.894192,0 days 00:00:00.733285,Tanh,Sigmoid,,,11,20,6.0,,,0.0449545110694329,2,162,0.4688565688351534,0.0002715746886150924,104.35503278459821,COMPLETE
326,0.4704848527908325,2023-09-04 21:57:28.894504,2023-09-04 21:57:29.478010,0 days 00:00:00.583506,Tanh,Sigmoid,,,10,24,5.0,,,0.09722502252057763,2,171,0.7977258966915509,0.0001254227526823627,122.67359733581543,COMPLETE
327,0.2931979298591614,2023-09-04 21:57:29.478340,2023-09-04 21:57:30.552500,0 days 00:00:01.074160,Tanh,Sigmoid,,,13,23,24.0,,,0.025861300178725493,2,113,0.7445211053094867,0.00018829093973861258,104.77253036499023,COMPLETE
328,0.3759857416152954,2023-09-04 21:57:30.552807,2023-09-04 21:57:30.703796,0 days 00:00:00.150989,ReLU,Sigmoid,,,49,21,6.0,,,0.01958038732544537,2,183,0.28339956077498346,0.00014693274468820298,112.38627847035725,COMPLETE
329,0.30146390199661255,2023-09-04 21:57:30.704108,2023-09-04 21:57:31.464448,0 days 00:00:00.760340,Tanh,Sigmoid,,,38,20,21.0,,,0.030394039164524208,2,153,0.7997720820062205,1.1243225383273418e-05,91.24843804041545,COMPLETE
330,0.32888010144233704,2023-09-04 21:57:31.464753,2023-09-04 21:57:32.210068,0 days 00:00:00.745315,Tanh,Sigmoid,,,39,21,24.0,,,0.014019067200583804,2,248,0.7290335911544645,0.00010093289842010126,97.84793619009164,COMPLETE
331,0.3464607894420624,2023-09-04 21:57:32.210379,2023-09-04 21:57:33.292274,0 days 00:00:01.081895,Tanh,Sigmoid,Leaky,ReLU,54,11,4.0,15.0,18.0,0.0655110222960066,4,189,0.7638475660778742,1.7612241349963266e-05,152.4067099966654,COMPLETE
332,0.35589027404785156,2023-09-04 21:57:33.292825,2023-09-04 21:57:34.232066,0 days 00:00:00.939241,ReLU,ReLU,,,12,22,7.0,,,0.05158542654617892,2,102,0.7658997765794892,0.0002372020939980595,104.23122074293053,COMPLETE
333,0.29275625944137573,2023-09-04 21:57:34.232394,2023-09-04 21:57:35.571911,0 days 00:00:01.339517,Tanh,Sigmoid,ReLU,Sigmoid,13,20,5.0,24.0,23.0,0.022640067145035848,4,122,0.7191687262666672,1.2791763410441486e-05,95.6229736328125,COMPLETE
334,0.35171347856521606,2023-09-04 21:57:35.572282,2023-09-04 21:57:36.694109,0 days 00:00:01.121827,Tanh,Tanh,,,43,19,2.0,,,0.0008090110087974031,2,172,0.7499488667128809,6.963827555977881e-05,124.26812973941665,COMPLETE
335,0.3327605724334717,2023-09-04 21:57:36.694527,2023-09-04 21:57:37.556399,0 days 00:00:00.861872,Tanh,Sigmoid,,,15,14,10.0,,,0.011687772427175008,2,95,0.7748867891521645,1.517206310692392e-05,88.02704708392804,COMPLETE
336,0.9842181205749512,2023-09-04 21:57:37.556728,2023-09-04 21:57:40.011173,0 days 00:00:02.454445,ReLU,Sigmoid,Tanh,Tanh,40,21,15.0,1.0,9.0,1.0272858809430088e-05,4,141,0.662345590634566,0.00013100031170081906,119.33526957626884,COMPLETE
337,0.28159812092781067,2023-09-04 21:57:40.011505,2023-09-04 21:57:43.264354,0 days 00:00:03.252849,Tanh,Sigmoid,Leaky,,10,22,14.0,4.0,,0.03601970009808394,3,237,0.7068024383591305,8.44425196695029e-05,127.46769269307454,COMPLETE
338,0.3222918212413788,2023-09-04 21:57:43.264687,2023-09-04 21:57:44.899625,0 days 00:00:01.634938,Tanh,Sigmoid,Leaky,,10,23,14.0,4.0,,0.03467073071228043,3,244,0.7234875157665608,0.00059585677198031,116.01815697454637,COMPLETE
339,0.3560323417186737,2023-09-04 21:57:44.899973,2023-09-04 21:57:45.485386,0 days 00:00:00.585413,Tanh,Tanh,Leaky,,22,22,13.0,3.0,,0.04205698241364318,3,241,0.38182203544350474,9.823629330597881e-05,106.41338443756104,COMPLETE
340,0.32232147455215454,2023-09-04 21:57:45.485706,2023-09-04 21:57:46.699064,0 days 00:00:01.213358,Tanh,Sigmoid,Leaky,,17,22,14.0,5.0,,0.028616376287000853,3,232,0.7406222396929525,7.686319585749134e-05,89.57461081610785,COMPLETE
341,0.3323226869106293,2023-09-04 21:57:46.699397,2023-09-04 21:57:47.391411,0 days 00:00:00.692014,ReLU,Sigmoid,Leaky,,14,20,14.0,4.0,,0.036112890426311516,3,204,0.6980699364192253,8.566283246426619e-05,158.55840979682074,COMPLETE
342,0.2551743984222412,2023-09-04 21:57:47.391741,2023-09-04 21:57:47.765062,0 days 00:00:00.373321,Tanh,Sigmoid,Leaky,,82,21,15.0,6.0,,0.026671603734024517,3,216,0.7727740489089326,5.4704395142142514e-05,103.31311890573213,COMPLETE
343,0.2988232672214508,2023-09-04 21:57:47.765380,2023-09-04 21:57:49.307607,0 days 00:00:01.542227,Tanh,Sigmoid,Leaky,,10,21,16.0,6.0,,0.024589214419998603,3,217,0.7115468872512581,4.965810997716604e-05,88.29324061075846,COMPLETE
344,0.3175368905067444,2023-09-04 21:57:49.307947,2023-09-04 21:57:49.530695,0 days 00:00:00.222748,Tanh,ReLU,Leaky,,82,22,15.0,9.0,,0.019911701272417492,3,223,0.296994944598303,5.524091257704675e-05,413.0655754937066,COMPLETE
345,0.31166836619377136,2023-09-04 21:57:49.531010,2023-09-04 21:57:50.722869,0 days 00:00:01.191859,Tanh,Sigmoid,Leaky,,19,21,14.0,5.0,,0.017553524180618188,3,233,0.5533472718609169,6.829104282867476e-05,101.2044511941763,COMPLETE
346,0.3362860083580017,2023-09-04 21:57:50.723231,2023-09-04 21:57:53.946357,0 days 00:00:03.223126,ReLU,Tanh,Leaky,,12,21,15.0,3.0,,0.0012336721950252736,3,196,0.7493116244782548,4.289907470127869e-05,118.23264162305375,COMPLETE
347,0.33171021938323975,2023-09-04 21:57:53.946677,2023-09-04 21:57:54.396937,0 days 00:00:00.450260,Tanh,Sigmoid,Leaky,,86,22,13.0,4.0,,0.02718120231953906,3,213,0.6896368952420736,5.633964393531839e-05,103.60299146936295,COMPLETE
348,0.32649296522140503,2023-09-04 21:57:54.397259,2023-09-04 21:57:55.181860,0 days 00:00:00.784601,Tanh,Sigmoid,Leaky,,79,20,16.0,13.0,,0.002577685619959512,3,228,0.7688707040063046,2.2474366961140164e-05,108.83035235934787,COMPLETE
349,0.35291728377342224,2023-09-04 21:57:55.182176,2023-09-04 21:57:56.454664,0 days 00:00:01.272488,Tanh,Leaky,Leaky,,75,23,14.0,8.0,,0.0005751598258776719,3,254,0.43341850965907375,6.614671382048066e-05,100.35738622004064,COMPLETE
350,0.3257318437099457,2023-09-04 21:57:56.454995,2023-09-04 21:57:56.821338,0 days 00:00:00.366343,ReLU,Sigmoid,Leaky,,85,21,17.0,3.0,,0.025068345148692318,3,210,0.7256757028302642,4.8910591638519254e-05,124.09174303327288,COMPLETE
351,0.37195128202438354,2023-09-04 21:57:56.821663,2023-09-04 21:57:57.035694,0 days 00:00:00.214031,Tanh,Sigmoid,Sigmoid,,81,22,12.0,2.0,,0.020928341548861695,3,155,0.3102147746834878,3.385091566855611e-05,102.62147913223657,COMPLETE
352,0.32580888271331787,2023-09-04 21:57:57.036025,2023-09-04 21:57:57.518012,0 days 00:00:00.481987,Tanh,Tanh,Leaky,,37,20,15.0,7.0,,0.008498422008402083,3,238,0.37390984919665976,3.958765322872384e-05,115.82492439419616,COMPLETE
353,0.33555924892425537,2023-09-04 21:57:57.518335,2023-09-04 21:57:58.892359,0 days 00:00:01.374024,Tanh,Sigmoid,ReLU,Tanh,18,21,10.0,4.0,21.0,0.016362204384354567,4,222,0.7672020633235137,0.00036133253002448135,99.18401423863003,COMPLETE
354,0.3729921877384186,2023-09-04 21:57:58.892677,2023-09-04 21:57:59.248315,0 days 00:00:00.355638,ReLU,Sigmoid,Leaky,,22,19,3.0,6.0,,0.030605214955550755,3,165,0.5248816505381434,5.795707968087716e-05,162.89687975715188,COMPLETE
355,0.3688652515411377,2023-09-04 21:57:59.248630,2023-09-04 21:58:04.495544,0 days 00:00:05.246914,Tanh,ReLU,Leaky,,15,21,22.0,5.0,,6.937869770536848e-05,3,115,0.7986616543446505,8.158242881462975e-05,106.0255311385445,COMPLETE
356,0.3188345432281494,2023-09-04 21:58:04.495878,2023-09-04 21:58:05.083665,0 days 00:00:00.587787,Tanh,Sigmoid,ReLU,ReLU,34,22,18.0,3.0,6.0,0.010326694328489332,4,144,0.4508438476622278,2.0610962299911398e-05,97.46084780809356,COMPLETE
357,0.327118456363678,2023-09-04 21:58:05.084007,2023-09-04 21:58:05.606934,0 days 00:00:00.522927,Tanh,Sigmoid,Leaky,Sigmoid,89,20,9.0,10.0,14.0,0.014843532918246131,4,108,0.7352601208385813,4.522487031751782e-05,93.78090570328084,COMPLETE
358,0.3474917411804199,2023-09-04 21:58:05.607290,2023-09-04 21:58:05.988808,0 days 00:00:00.381518,ReLU,Tanh,ReLU,,98,21,15.0,22.0,,0.021221558481191328,3,269,0.6776474788666267,0.0016683355027383782,126.36495543689263,COMPLETE
359,0.3391827344894409,2023-09-04 21:58:05.989216,2023-09-04 21:58:06.337344,0 days 00:00:00.348128,Tanh,Sigmoid,Leaky,Leaky,77,23,16.0,24.0,16.0,0.05215678646021613,4,187,0.7174541363896426,2.7215873083292552e-05,88.7061583907516,COMPLETE
360,0.31503814458847046,2023-09-04 21:58:06.337772,2023-09-04 21:58:07.019444,0 days 00:00:00.681672,Tanh,Sigmoid,Tanh,,17,20,12.0,21.0,,0.012313214717854414,3,312,0.39773286183013323,0.00010753947959046157,183.41498565673828,COMPLETE
361,0.4244503974914551,2023-09-04 21:58:07.019783,2023-09-04 21:58:07.823586,0 days 00:00:00.803803,Tanh,,,,73,24,,,,0.0001195097353861581,1,100,0.7707092690623807,1.7204207139831075e-05,111.00038208007813,COMPLETE
362,0.3502298593521118,2023-09-04 21:58:07.823914,2023-09-04 21:58:08.290642,0 days 00:00:00.466728,Tanh,,,,36,14,,,,0.01773804498668124,1,202,0.7533826113368395,0.00020908583833201806,103.33233601338155,COMPLETE
363,0.5243504643440247,2023-09-04 21:58:08.290957,2023-09-04 21:58:10.857107,0 days 00:00:02.566150,ReLU,Sigmoid,ReLU,Tanh,10,1,11.0,23.0,5.0,0.024871556218691266,4,475,0.6945818198674629,0.0004403112795934738,127.5401869274321,COMPLETE
364,0.4791354835033417,2023-09-04 21:58:10.857442,2023-09-04 21:58:11.453250,0 days 00:00:00.595808,Tanh,Sigmoid,Leaky,,20,21,13.0,1.0,,0.03225582048511807,3,233,0.6566988204317357,7.456853112913055e-05,143.0040054321289,COMPLETE
365,0.37616997957229614,2023-09-04 21:58:11.453597,2023-09-04 21:58:12.264414,0 days 00:00:00.810817,Tanh,Tanh,Sigmoid,Tanh,41,11,3.0,6.0,22.0,0.007634858832938336,4,128,0.7991733990209475,0.0005793534378842647,105.49269405164216,COMPLETE
366,0.34197595715522766,2023-09-04 21:58:12.264757,2023-09-04 21:58:17.490534,0 days 00:00:05.225777,Tanh,,,,12,22,,,,0.0017385807399860982,1,165,0.3182203010319404,5.988427654062202e-05,244.67812704738182,COMPLETE
367,0.5183447599411011,2023-09-04 21:58:17.491056,2023-09-04 21:58:18.370491,0 days 00:00:00.879435,ReLU,Sigmoid,ReLU,ReLU,39,20,21.0,2.0,8.0,0.040209626295610784,4,216,0.41137068270654864,9.587710271745497e-05,130.53143721360428,COMPLETE
368,0.3637668490409851,2023-09-04 21:58:18.370844,2023-09-04 21:58:21.917716,0 days 00:00:03.546872,Tanh,Sigmoid,,,14,19,20.0,,,0.0003581568262097106,2,109,0.7357116977596644,0.00030525335413082613,113.14645707716636,COMPLETE
369,0.324912965297699,2023-09-04 21:58:21.918025,2023-09-04 21:58:22.591597,0 days 00:00:00.673572,Tanh,,,,32,10,,,,0.013855942877671919,1,96,0.6334410124116062,0.0001584075253008889,127.45833226254112,COMPLETE
370,0.2751067578792572,2023-09-04 21:58:22.591990,2023-09-04 21:58:23.814049,0 days 00:00:01.222059,Tanh,ReLU,Leaky,,23,21,4.0,5.0,,0.0028038779597249386,3,178,0.7048416745666144,1.0023377555137188e-05,95.24318726208745,COMPLETE
371,0.28296908736228943,2023-09-04 21:58:23.814398,2023-09-04 21:58:25.009011,0 days 00:00:01.194613,Tanh,ReLU,,,25,21,4.0,,,0.005640013309648787,2,169,0.6875258497640194,1.1206098623325546e-05,107.23601810515873,COMPLETE
372,0.3481082320213318,2023-09-04 21:58:25.009322,2023-09-04 21:58:25.257208,0 days 00:00:00.247886,ReLU,ReLU,,,25,21,5.0,,,0.004568397436036171,2,174,0.23864552472714676,1.0535194421962443e-05,5710.699516296387,COMPLETE
373,0.3884700536727905,2023-09-04 21:58:25.257543,2023-09-04 21:58:25.545288,0 days 00:00:00.287745,Tanh,ReLU,,,24,21,5.0,,,0.008466272143417867,2,175,0.20017778307102627,1.4681573757734837e-05,120.18276435450504,COMPLETE
374,0.3485890328884125,2023-09-04 21:58:25.545614,2023-09-04 21:58:26.096462,0 days 00:00:00.550848,Tanh,ReLU,,,25,22,4.0,,,0.005716903846969272,2,180,0.3660798357504592,1.3529462021345592e-05,112.92068825516046,COMPLETE
375,0.31871864199638367,2023-09-04 21:58:26.096789,2023-09-04 21:58:27.577465,0 days 00:00:01.480676,Tanh,ReLU,,,83,21,4.0,,,0.0028296515972494603,2,158,0.6894157825421646,1.0238994082146533e-05,97.81563560167949,COMPLETE
376,0.3595413565635681,2023-09-04 21:58:27.577993,2023-09-04 21:58:29.344458,0 days 00:00:01.766465,Sigmoid,ReLU,,,27,20,4.0,,,0.006239138057166217,2,183,0.6042668218470088,1.1924077781130056e-05,97.96934077614232,COMPLETE
377,0.373492032289505,2023-09-04 21:58:29.344792,2023-09-04 21:58:29.767199,0 days 00:00:00.422407,Tanh,ReLU,,,22,22,4.0,,,0.004027835285729374,2,189,0.33648132287215954,1.231547926828996e-05,102.1804851732756,COMPLETE
378,0.3110258877277374,2023-09-04 21:58:29.767531,2023-09-04 21:58:30.581612,0 days 00:00:00.814081,ReLU,ReLU,,,19,21,16.0,,,0.004696357710538248,2,165,0.6635538315775393,1.574762058881833e-05,89.80192799038358,COMPLETE
379,0.2740032970905304,2023-09-04 21:58:30.581968,2023-09-04 21:58:31.478330,0 days 00:00:00.896362,Tanh,ReLU,,,21,20,14.0,,,0.0060078612095884835,2,153,0.7711008554059394,1.041187013811032e-05,101.89724112845757,COMPLETE
380,0.334509015083313,2023-09-04 21:58:31.478662,2023-09-04 21:58:32.011736,0 days 00:00:00.533074,Tanh,ReLU,,,23,22,14.0,,,0.007004771712390979,2,162,0.5090784555158306,1.0163708021047255e-05,96.16363996617935,COMPLETE
