number,value,datetime_start,datetime_complete,duration,params_activation1,params_activation2,params_activation3,params_activation4,params_batch_size,params_fl1,params_fl2,params_fl3,params_fl4,params_learning_rate,params_n_layers,params_num_epochs,params_train_size,params_weight_decay,user_attrs_mre,state
1437,0.2934216260910034,2023-09-04 22:30:23.593906,2023-09-04 22:30:24.134104,0 days 00:00:00.540198,ReLU,Tanh,,,47,15,7.0,,,0.009885534584981225,2,122,0.740228302073117,4.0222680544689154e-05,91.07612730327405,COMPLETE
1438,0.359939306974411,2023-09-04 22:30:24.134531,2023-09-04 22:30:24.527249,0 days 00:00:00.392718,ReLU,Sigmoid,,,39,14,5.0,,,0.01887263445998252,2,100,0.35625143133173004,1.6043620280858857e-05,104.42556397811227,COMPLETE
1439,0.3199341297149658,2023-09-04 22:30:24.527683,2023-09-04 22:30:24.984775,0 days 00:00:00.457092,ReLU,ReLU,Sigmoid,,42,15,5.0,9.0,,0.00861685288577849,3,124,0.7714723993802182,4.7967053211616425e-05,111.69921476944633,COMPLETE
1440,0.31226107478141785,2023-09-04 22:30:24.985217,2023-09-04 22:30:25.667914,0 days 00:00:00.682697,ReLU,Sigmoid,,,44,13,6.0,,,0.016744356661489664,2,93,0.7229744048603103,3.069074056112364e-05,106.72151168823243,COMPLETE
1441,0.4116728901863098,2023-09-04 22:30:25.668375,2023-09-04 22:30:26.393716,0 days 00:00:00.725341,ReLU,,,,43,15,,,,0.004168348134370842,1,105,0.6452209952487226,2.2422697510411757e-05,125.2710732014974,COMPLETE
1442,0.3385293483734131,2023-09-04 22:30:26.394135,2023-09-04 22:30:26.920753,0 days 00:00:00.526618,ReLU,Tanh,,,41,14,6.0,,,0.001025976565897662,2,96,0.2915425206015619,7.023133145147708e-05,136.26888275146484,COMPLETE
1443,0.4676821827888489,2023-09-04 22:30:26.921195,2023-09-04 22:30:28.086609,0 days 00:00:01.165414,ReLU,Sigmoid,Leaky,,46,1,6.0,14.0,,0.0017302628776596654,3,146,0.477931684062319,0.0015481543410892271,111.09445582495795,COMPLETE
1444,0.32138848304748535,2023-09-04 22:30:28.087453,2023-09-04 22:30:30.197423,0 days 00:00:02.109970,ReLU,Leaky,,,40,13,5.0,,,0.006138360933567098,2,115,0.7991587649857269,0.00010910378509627756,97.66992618726647,COMPLETE
1445,0.34919291734695435,2023-09-04 22:30:30.198251,2023-09-04 22:30:32.370254,0 days 00:00:02.172003,ReLU,ReLU,,,17,16,7.0,,,0.011609496296678653,2,132,0.7471719814057605,8.72299798308591e-05,76.26983473036024,COMPLETE
1446,0.3409363329410553,2023-09-04 22:30:32.370687,2023-09-04 22:30:32.894124,0 days 00:00:00.523437,ReLU,,,,19,15,,,,0.004992463276152184,1,94,0.5407059109511426,0.0006931219817718585,103.2089593410492,COMPLETE
1447,0.38935786485671997,2023-09-04 22:30:32.894541,2023-09-04 22:30:33.869325,0 days 00:00:00.974784,ReLU,Sigmoid,Tanh,,15,14,7.0,7.0,,0.014197341846245997,3,103,0.7063151973051806,0.029682971046311395,102.36662101745605,COMPLETE
1448,0.29729747772216797,2023-09-04 22:30:33.869783,2023-09-04 22:30:35.353010,0 days 00:00:01.483227,Leaky,Tanh,,,44,16,4.0,,,0.0011529684959826084,2,111,0.799788556921871,3.774885782178632e-05,239.33209955467368,COMPLETE
1449,0.4100716710090637,2023-09-04 22:30:35.353447,2023-09-04 22:30:35.864928,0 days 00:00:00.511481,ReLU,Sigmoid,,,25,12,6.0,,,0.00048186377351874956,2,123,0.11664980994112543,1.356939119438768e-05,116.19093155279393,COMPLETE
1450,0.38219988346099854,2023-09-04 22:30:35.865358,2023-09-04 22:30:40.031087,0 days 00:00:04.165729,Sigmoid,Tanh,Leaky,,11,14,8.0,13.0,,0.0002365080539395256,3,84,0.754396650572195,5.3692787971305494e-05,96.01324671790714,COMPLETE
1451,0.3629465103149414,2023-09-04 22:30:40.031533,2023-09-04 22:30:40.318207,0 days 00:00:00.286674,ReLU,Sigmoid,,,47,13,5.0,,,0.007732313166690607,2,103,0.3329537823982283,2.904697134181412e-05,240.31487121582032,COMPLETE
1452,0.3526628017425537,2023-09-04 22:30:40.318645,2023-09-04 22:30:40.991203,0 days 00:00:00.672558,ReLU,,,,21,15,,,,0.018994953290831916,1,139,0.6813640556844547,0.0024183803036182125,103.4239925585295,COMPLETE
1453,0.33893707394599915,2023-09-04 22:30:40.991633,2023-09-04 22:30:41.591422,0 days 00:00:00.599789,Leaky,ReLU,,,36,15,7.0,,,0.002287489085269062,2,92,0.5618987227750359,2.0214513848391554e-05,502.21316268596246,COMPLETE
1454,0.3672657608985901,2023-09-04 22:30:41.591866,2023-09-04 22:30:42.088714,0 days 00:00:00.496848,ReLU,Sigmoid,Sigmoid,,41,23,4.0,8.0,,0.009428028186788714,3,90,0.16477285673662365,0.01225983734149867,241.25156180803165,COMPLETE
1455,0.44705837965011597,2023-09-04 22:30:42.089164,2023-09-04 22:30:45.086094,0 days 00:00:02.996930,Sigmoid,Tanh,,,13,22,3.0,,,0.00031785874821393636,2,84,0.770331749743556,2.5565074903078453e-05,123.02439162844703,COMPLETE
1456,0.3301520049571991,2023-09-04 22:30:45.086552,2023-09-04 22:30:45.441817,0 days 00:00:00.355265,ReLU,Sigmoid,,,85,14,6.0,,,0.014922803816072165,2,152,0.44318794865164346,0.008336725867626467,100.97339410048265,COMPLETE
1457,0.4116860032081604,2023-09-04 22:30:45.442262,2023-09-04 22:30:45.602330,0 days 00:00:00.160068,Leaky,,,,46,23,,,,0.07822075248189972,1,113,0.26931801116774456,0.00012274810160416345,200.12294214422053,COMPLETE
1458,0.35089966654777527,2023-09-04 22:30:45.602756,2023-09-04 22:30:46.397985,0 days 00:00:00.795229,ReLU,ReLU,Leaky,,29,22,22.0,5.0,,0.000834028378175343,3,81,0.30095742038441387,6.671858508134224e-05,130.20936336517335,COMPLETE
1459,0.34638646245002747,2023-09-04 22:30:46.398436,2023-09-04 22:30:47.108920,0 days 00:00:00.710484,ReLU,Leaky,,,43,10,5.0,,,0.011502007171090522,2,315,0.3956526961806407,1.8068711848337932e-05,105.2354298081509,COMPLETE
1460,0.3906499743461609,2023-09-04 22:30:47.109383,2023-09-04 22:30:48.622092,0 days 00:00:01.512709,Sigmoid,Sigmoid,,,19,22,6.0,,,0.0030781459645047885,2,99,0.41954865764329574,3.594090993590383e-05,125.44613300670277,COMPLETE
1461,0.34032005071640015,2023-09-04 22:30:48.622563,2023-09-04 22:30:50.133139,0 days 00:00:01.510576,Tanh,Tanh,Tanh,,23,13,9.0,23.0,,0.023381156977456484,3,145,0.72296139090068,4.294529857218013e-05,108.54280169256802,COMPLETE
1462,0.3468798100948334,2023-09-04 22:30:50.134089,2023-09-04 22:30:51.210305,0 days 00:00:01.076216,Tanh,Sigmoid,,,38,21,5.0,,,0.00723359150979064,2,123,0.25498917663820175,0.0012309893574664812,121.01940948486327,COMPLETE
1463,0.35691070556640625,2023-09-04 22:30:51.210757,2023-09-04 22:30:51.716976,0 days 00:00:00.506219,Tanh,,,,16,15,,,,0.017844745369311597,1,71,0.747034368520491,9.778654566392503e-05,111.22851602654708,COMPLETE
1464,0.3774547874927521,2023-09-04 22:30:51.717409,2023-09-04 22:30:52.110852,0 days 00:00:00.393443,ReLU,ReLU,,,48,21,24.0,,,0.013853116877533652,2,96,0.6668117599018898,0.006193925739381913,103.49145931667752,COMPLETE
1465,0.7318550944328308,2023-09-04 22:30:52.111286,2023-09-04 22:30:54.559696,0 days 00:00:02.448410,Tanh,Sigmoid,Leaky,,40,16,4.0,15.0,,2.8207328600479136e-05,3,132,0.772735337071706,0.0037541384749623804,94.07974277843128,COMPLETE
1466,0.3218805193901062,2023-09-04 22:30:54.560178,2023-09-04 22:30:57.818818,0 days 00:00:03.258640,Tanh,Tanh,,,12,22,7.0,,,0.006103415621723043,2,87,0.627816832220369,4.800062276847098e-05,100.90167617797852,COMPLETE
1467,0.40090903639793396,2023-09-04 22:30:57.819278,2023-09-04 22:31:02.593114,0 days 00:00:04.773836,Leaky,Sigmoid,,,10,12,6.0,,,0.00011054016868397015,2,110,0.7141941059044593,0.0009541308560609543,129.3774442499334,COMPLETE
1468,0.322161465883255,2023-09-04 22:31:02.593548,2023-09-04 22:31:03.114036,0 days 00:00:00.520488,Tanh,,,,45,14,,,,0.009079159331544372,1,67,0.46841802409955563,0.0001394780623440022,100.73187608861211,COMPLETE
1469,0.8809524178504944,2023-09-04 22:31:03.114468,2023-09-04 22:31:03.981851,0 days 00:00:00.867383,Tanh,Sigmoid,,,43,21,17.0,,,2.0572147661476717e-05,2,81,0.5272604276393587,0.0028012848607446637,104.39155267786097,COMPLETE
1470,0.3671117424964905,2023-09-04 22:31:03.982309,2023-09-04 22:31:05.079038,0 days 00:00:01.096729,ReLU,ReLU,Sigmoid,,21,21,16.0,2.0,,0.004469037642099747,3,153,0.42280480592560904,2.2876247264944128e-05,109.3590828680223,COMPLETE
1471,0.4639851450920105,2023-09-04 22:31:05.079505,2023-09-04 22:31:05.283660,0 days 00:00:00.204155,Tanh,Tanh,,,34,22,8.0,,,0.010392786837103223,2,96,0.14090151254977512,0.0018521158458356577,146.0903980030733,COMPLETE
1472,0.37358176708221436,2023-09-04 22:31:05.284103,2023-09-04 22:31:05.830610,0 days 00:00:00.546507,Tanh,,,,48,23,,,,0.0038135281230154156,1,105,0.3866670924828931,1.3217868107044368e-05,117.81901238181375,COMPLETE
1473,0.524552047252655,2023-09-04 22:31:05.831056,2023-09-04 22:31:06.788718,0 days 00:00:00.957662,Sigmoid,Sigmoid,,,17,21,6.0,,,0.001148926931579698,2,74,0.30771166057320054,0.05143913439690825,116.25241728086729,COMPLETE
1474,0.29263216257095337,2023-09-04 22:31:06.789163,2023-09-04 22:31:08.072997,0 days 00:00:01.283834,Tanh,Leaky,Leaky,,14,15,7.0,4.0,,0.022906480205107396,3,57,0.7999220323273014,3.0244229972576546e-05,104.77574293954032,COMPLETE
1475,0.4207059144973755,2023-09-04 22:31:08.073464,2023-09-04 22:31:08.477953,0 days 00:00:00.404489,ReLU,Sigmoid,,,41,11,5.0,,,0.002243206909492273,2,80,0.20557490934658532,1.6219711104063178e-05,233.31791191101075,COMPLETE
1476,0.36181026697158813,2023-09-04 22:31:08.478399,2023-09-04 22:31:09.412593,0 days 00:00:00.934194,Tanh,ReLU,Tanh,,37,22,20.0,7.0,,0.0003727979361493392,3,89,0.3147830804800219,0.0004784341327080181,124.21222455314036,COMPLETE
1477,0.422238290309906,2023-09-04 22:31:09.413039,2023-09-04 22:31:09.676220,0 days 00:00:00.263181,Tanh,Tanh,,,46,21,18.0,,,0.020695828500607086,2,118,0.1542501302618651,5.579363955861798e-05,113.59384278328189,COMPLETE
1478,0.498904824256897,2023-09-04 22:31:09.676676,2023-09-04 22:31:10.047274,0 days 00:00:00.370598,Tanh,Sigmoid,,,44,23,15.0,,,0.0010429561131243216,2,67,0.21900930819536452,0.004312114624822186,121.87046085186859,COMPLETE
1479,0.35820576548576355,2023-09-04 22:31:10.047737,2023-09-04 22:31:10.840524,0 days 00:00:00.792787,ReLU,Sigmoid,,,24,21,5.0,,,0.011107952937805022,2,291,0.743638475916086,8.161219091506282e-05,91.2340285357307,COMPLETE
1480,0.996297299861908,2023-09-04 22:31:10.840959,2023-09-04 22:31:11.983267,0 days 00:00:01.142308,Tanh,Tanh,Leaky,,39,22,3.0,5.0,,2.5897077807548822e-05,3,90,0.5047809638726817,3.707246777755529e-05,197.1197792900933,COMPLETE
1481,0.38511279225349426,2023-09-04 22:31:11.983723,2023-09-04 22:31:13.583513,0 days 00:00:01.599790,Leaky,,,,19,16,,,,9.72682867222004e-05,1,137,0.4346488629233303,0.00011400545120243611,140.22448752744356,COMPLETE
1482,0.3219711482524872,2023-09-04 22:31:13.583953,2023-09-04 22:31:15.373870,0 days 00:00:01.789917,Tanh,ReLU,,,10,21,6.0,,,0.013280848838019282,2,156,0.6922786924839607,2.5048753240310533e-05,95.69841911679222,COMPLETE
1483,0.29263871908187866,2023-09-04 22:31:15.374305,2023-09-04 22:31:16.288569,0 days 00:00:00.914264,Tanh,Sigmoid,,,26,21,19.0,,,0.007728250430637104,2,66,0.7995858943146613,0.00016386713067332404,87.05995273590088,COMPLETE
1484,0.9873108863830566,2023-09-04 22:31:16.289003,2023-09-04 22:31:18.300694,0 days 00:00:02.011691,ReLU,Sigmoid,Leaky,,15,22,21.0,1.0,,3.9565558423277784e-05,3,103,0.14684308379310293,0.0006503578767644323,231.82777671443606,COMPLETE
1485,0.33926311135292053,2023-09-04 22:31:18.301542,2023-09-04 22:31:21.983910,0 days 00:00:03.682368,Tanh,,,,42,14,,,,0.0006481436481258652,1,267,0.7477987398288861,6.606559545556989e-05,138.53995285319925,COMPLETE
1486,0.29005295038223267,2023-09-04 22:31:21.984337,2023-09-04 22:31:23.059612,0 days 00:00:01.075275,Tanh,Leaky,,,47,23,8.0,,,0.0013524799431894987,2,78,0.7719885042077781,3.266547292775653e-05,103.46221747765175,COMPLETE
1487,0.3068198263645172,2023-09-04 22:31:23.060080,2023-09-04 22:31:24.050948,0 days 00:00:00.990868,Tanh,Tanh,,,35,21,4.0,,,0.015887461824762993,2,97,0.709805161703972,1.7834646213434653e-05,87.47712554931641,COMPLETE
1488,0.997494637966156,2023-09-04 22:31:24.051415,2023-09-04 22:31:25.875850,0 days 00:00:01.824435,ReLU,Sigmoid,Sigmoid,,12,22,16.0,3.0,,0.005328571236094023,3,129,0.653235147153819,0.08586097444053957,100.96359647553543,COMPLETE
1489,0.4323984384536743,2023-09-04 22:31:25.876307,2023-09-04 22:31:30.241248,0 days 00:00:04.364941,Sigmoid,ReLU,,,21,22,22.0,,,0.0001511333644801623,2,110,0.738421653830588,0.005030765708663477,103.47444319291549,COMPLETE
1490,0.3957114517688751,2023-09-04 22:31:30.241722,2023-09-04 22:31:30.701702,0 days 00:00:00.459980,Tanh,,,,32,18,,,,0.0271064254911966,1,161,0.6806736787664642,0.0789128779007023,116.13277435302734,COMPLETE
1491,0.5370035171508789,2023-09-04 22:31:30.702172,2023-09-04 22:31:32.930389,0 days 00:00:02.228217,Tanh,Sigmoid,,,18,21,6.0,,,0.00020670186365806523,2,57,0.7707578546432634,4.637176532079671e-05,117.11543996710526,COMPLETE
1492,0.4277268648147583,2023-09-04 22:31:32.930857,2023-09-04 22:31:33.369546,0 days 00:00:00.438689,Tanh,Tanh,Leaky,,95,20,9.0,11.0,,0.0016351635306540882,3,77,0.34257738426635626,0.0014463496151758328,109.95319752878957,COMPLETE
1493,0.43229976296424866,2023-09-04 22:31:33.370017,2023-09-04 22:31:33.544405,0 days 00:00:00.174388,ReLU,Sigmoid,,,45,14,5.0,,,0.0189319785257984,2,146,0.10782147382727297,0.015064304643850715,136.78618621826172,COMPLETE
1494,0.4180293083190918,2023-09-04 22:31:33.544881,2023-09-04 22:31:33.725344,0 days 00:00:00.180463,Leaky,,,,38,15,,,,0.061250661755487344,1,485,0.2824551931610027,0.0008165929445433087,106.64658864339192,COMPLETE
1495,0.32193493843078613,2023-09-04 22:31:33.725785,2023-09-04 22:31:34.461451,0 days 00:00:00.735666,Tanh,ReLU,,,42,17,7.0,,,0.008974596558093628,2,91,0.7193719420248417,0.00010728628103524686,104.52733306884765,COMPLETE
1496,0.42377322912216187,2023-09-04 22:31:34.461902,2023-09-04 22:31:35.127449,0 days 00:00:00.665547,Tanh,Sigmoid,,,48,21,15.0,,,0.012236715735264742,2,206,0.7703828675166591,0.012379458404823625,103.54153263822515,COMPLETE
1497,0.3695254623889923,2023-09-04 22:31:35.127908,2023-09-04 22:31:37.279223,0 days 00:00:02.151315,Tanh,Tanh,Tanh,,13,13,7.0,6.0,,0.00032405052209274544,3,50,0.7428652996596361,0.0001460285893041292,123.53633682250977,COMPLETE
1498,0.30436304211616516,2023-09-04 22:31:37.279669,2023-09-04 22:31:38.057146,0 days 00:00:00.777477,ReLU,Sigmoid,,,16,21,4.0,,,0.024184149547871948,2,64,0.7095004271085912,2.8596253614312502e-05,98.4529312133789,COMPLETE
1499,0.5770639777183533,2023-09-04 22:31:38.057599,2023-09-04 22:31:38.654795,0 days 00:00:00.597196,Tanh,ReLU,Leaky,,23,23,23.0,4.0,,6.342278665198181e-05,3,75,0.1671773097623612,7.77670121062026e-05,161.18437703450522,COMPLETE
1500,0.3935241103172302,2023-09-04 22:31:38.655357,2023-09-04 22:31:39.434673,0 days 00:00:00.779316,Sigmoid,Sigmoid,,,40,9,6.0,,,0.014673108294663145,2,85,0.7730398912267457,2.159747743866821e-05,117.77817144626525,COMPLETE
1501,0.3671026825904846,2023-09-04 22:31:39.435142,2023-09-04 22:31:40.394756,0 days 00:00:00.959614,Tanh,,,,20,12,,,,0.006458969569919718,1,195,0.7417726727984025,0.003268677750607411,104.08653740260912,COMPLETE
1502,0.28866735100746155,2023-09-04 22:31:40.395213,2023-09-04 22:31:41.393596,0 days 00:00:00.998383,Tanh,Leaky,,,44,22,20.0,,,0.002873450910221152,2,104,0.5915338296245768,0.0010062953396786597,105.66572233688,COMPLETE
1503,0.38814985752105713,2023-09-04 22:31:41.394047,2023-09-04 22:31:43.248982,0 days 00:00:01.854935,ReLU,Tanh,,,47,20,3.0,,,0.00040119514747999336,2,213,0.3172478453365162,1.1938962078420893e-05,106.38629097274587,COMPLETE
1504,0.4628005027770996,2023-09-04 22:31:43.249468,2023-09-04 22:31:44.202718,0 days 00:00:00.953250,Tanh,Sigmoid,Sigmoid,,10,21,2.0,8.0,,0.09871988130340732,3,117,0.7985846721722524,4.1950543388568194e-05,125.19304911295573,COMPLETE
1505,0.32364341616630554,2023-09-04 22:31:44.203187,2023-09-04 22:31:44.637854,0 days 00:00:00.434667,Tanh,Sigmoid,,,37,20,15.0,,,0.03028913653666788,2,71,0.38527469107599777,5.7404999462632286e-05,96.81218880101254,COMPLETE
1506,0.48331090807914734,2023-09-04 22:31:44.638447,2023-09-04 22:31:44.799882,0 days 00:00:00.161435,Tanh,,,,49,21,,,,0.009868809190600932,1,98,0.10352915209501537,0.0005537371513231403,180.07356227527964,COMPLETE
1507,0.32404401898384094,2023-09-04 22:31:44.800359,2023-09-04 22:31:45.612171,0 days 00:00:00.811812,Leaky,ReLU,Leaky,,22,22,5.0,6.0,,0.01692694633517291,3,62,0.6281174289254253,9.161077300366821e-05,167.55935465494792,COMPLETE
1508,0.3327903151512146,2023-09-04 22:31:45.612648,2023-09-04 22:31:45.941286,0 days 00:00:00.328638,Tanh,Tanh,,,45,20,6.0,,,0.02036788930962347,2,87,0.40745781922086505,0.00011626693924808718,120.24287629127502,COMPLETE
1509,0.3543209433555603,2023-09-04 22:31:45.941820,2023-09-04 22:31:47.184856,0 days 00:00:01.243036,ReLU,Sigmoid,,,14,15,17.0,,,0.0018425798423544447,2,259,0.6832105644141981,3.367671982994396e-05,95.6901907018713,COMPLETE
1510,0.43127191066741943,2023-09-04 22:31:47.185369,2023-09-04 22:31:48.563359,0 days 00:00:01.377990,Tanh,Sigmoid,ReLU,,42,21,16.0,9.0,,0.00026233952791485067,3,205,0.2453722241211396,0.00041440725760372214,129.65542844446693,COMPLETE
1511,0.4783337116241455,2023-09-04 22:31:48.563844,2023-09-04 22:31:49.231804,0 days 00:00:00.667960,Tanh,Tanh,,,18,22,4.0,,,8.562845025346082e-05,2,79,0.185675647299742,1.4532301144044294e-05,127.33331569237045,COMPLETE
1512,0.36543527245521545,2023-09-04 22:31:49.232302,2023-09-04 22:31:50.447882,0 days 00:00:01.215580,Tanh,,,,41,16,,,,0.0038409003516789524,1,127,0.7171548008498685,0.002321820086984411,106.38509455415391,COMPLETE
1513,0.39871513843536377,2023-09-04 22:31:50.448423,2023-09-04 22:31:50.712122,0 days 00:00:00.263699,ReLU,ReLU,,,39,20,18.0,,,0.05135083125184041,2,137,0.24198797693882565,0.00013416416777434583,104.97078680223034,COMPLETE
1514,0.5241954326629639,2023-09-04 22:31:50.712640,2023-09-04 22:31:51.017526,0 days 00:00:00.304886,Sigmoid,Sigmoid,,,35,21,8.0,,,0.02674518649406847,2,161,0.22420010609688726,0.019364491566538456,107.64364115397136,COMPLETE
1515,0.29406872391700745,2023-09-04 22:31:51.018021,2023-09-04 22:31:54.492114,0 days 00:00:03.474093,Tanh,Leaky,Tanh,,12,23,5.0,16.0,,0.004751882566076163,3,70,0.7717135313416406,0.0011889507641248342,99.05325222015381,COMPLETE
1516,0.29181233048439026,2023-09-04 22:31:54.492645,2023-09-04 22:31:55.476858,0 days 00:00:00.984213,Tanh,Sigmoid,,,28,15,7.0,,,0.00782954112525624,2,221,0.7991735982266096,2.6574385609257012e-05,92.39626329998637,COMPLETE
1517,0.2884681820869446,2023-09-04 22:31:55.477349,2023-09-04 22:31:57.164587,0 days 00:00:01.687238,Tanh,Tanh,,,17,11,10.0,,,0.012211916265586042,2,58,0.7465005061779163,0.00034450576789821804,93.09719625012627,COMPLETE
1518,0.3671216666698456,2023-09-04 22:31:57.165046,2023-09-04 22:31:57.601189,0 days 00:00:00.436143,ReLU,ReLU,Leaky,,47,22,15.0,10.0,,0.04076190198860617,3,150,0.6615294231639757,0.00017478054279215034,108.678291015625,COMPLETE
1519,0.4696929156780243,2023-09-04 22:31:57.601725,2023-09-04 22:31:57.860919,0 days 00:00:00.259194,Tanh,,,,20,14,,,,0.08068216753324223,1,97,0.3620692368100425,0.03352716264004179,726.1104583740234,COMPLETE
1520,0.67860347032547,2023-09-04 22:31:57.861566,2023-09-04 22:31:58.312226,0 days 00:00:00.450660,Leaky,Sigmoid,,,88,20,19.0,,,0.00012514979046386764,2,190,0.1312529745570072,4.921920970020386e-05,101.15080156828228,COMPLETE
1521,1.4774775505065918,2023-09-04 22:31:58.312681,2023-09-04 22:31:58.703570,0 days 00:00:00.390889,Tanh,Sigmoid,,,78,5,6.0,,,1.949186908439881e-05,2,110,0.212100969240856,2.1146887776519057e-05,392.9857865767045,COMPLETE
1522,0.3185025751590729,2023-09-04 22:31:58.704039,2023-09-04 22:31:59.640696,0 days 00:00:00.936657,Tanh,Tanh,ReLU,,44,21,21.0,2.0,,0.013484656092477607,3,87,0.7009765946354616,6.55473317950961e-05,116.44216142620957,COMPLETE
1523,0.30748268961906433,2023-09-04 22:31:59.641244,2023-09-04 22:31:59.984484,0 days 00:00:00.343240,ReLU,,,,80,22,,,,0.010677450483957188,1,213,0.7498886787691815,1.7240328397465702e-05,112.56471099853516,COMPLETE
1524,0.3625463843345642,2023-09-04 22:31:59.984981,2023-09-04 22:32:00.872224,0 days 00:00:00.887243,Tanh,Sigmoid,,,46,13,22.0,,,0.0062738580019896075,2,79,0.7317460777766862,3.7070198633835816e-05,107.33900925208782,COMPLETE
1525,0.3426275849342346,2023-09-04 22:32:00.872724,2023-09-04 22:32:01.309287,0 days 00:00:00.436563,Tanh,ReLU,,,49,17,24.0,,,0.033110636630013957,2,50,0.5855693935808993,0.002071215616047876,115.97533798217773,COMPLETE
1526,0.29110661149024963,2023-09-04 22:32:01.309800,2023-09-04 22:32:02.927938,0 days 00:00:01.618138,Tanh,Sigmoid,,,11,20,6.0,,,0.01645330011070924,2,141,0.7707595677242114,9.48442623922461e-05,87.1306718190511,COMPLETE
1527,0.34284281730651855,2023-09-04 22:32:02.928418,2023-09-04 22:32:03.383186,0 days 00:00:00.454768,ReLU,Tanh,Leaky,,43,21,8.0,3.0,,0.022377681784235395,3,93,0.6891811575099851,0.0002845322877571325,146.58239841461182,COMPLETE
1528,0.36133983731269836,2023-09-04 22:32:03.383665,2023-09-04 22:32:04.221242,0 days 00:00:00.837577,Sigmoid,,,,37,21,,,,0.00884663734887268,1,247,0.3738324953572813,2.4520419579421563e-05,110.07805439782521,COMPLETE
1529,0.3397088944911957,2023-09-04 22:32:04.221697,2023-09-04 22:32:05.159984,0 days 00:00:00.938287,Tanh,Leaky,,,24,19,14.0,,,0.0019839512095644225,2,67,0.519489174099261,0.00015666283541774088,109.23300318132367,COMPLETE
1530,0.32725515961647034,2023-09-04 22:32:05.160457,2023-09-04 22:32:07.116509,0 days 00:00:01.956052,Tanh,Sigmoid,Sigmoid,,31,23,5.0,7.0,,0.027648969095682065,3,221,0.7205339247456763,7.55806717793342e-05,106.19466046589177,COMPLETE
1531,0.3121129870414734,2023-09-04 22:32:07.117392,2023-09-04 22:32:10.466125,0 days 00:00:03.348733,Tanh,ReLU,,,16,21,16.0,,,0.019269688535517034,2,201,0.6190261133636846,0.006753705981244889,603.0396205357143,COMPLETE
1532,0.3750900626182556,2023-09-04 22:32:10.467002,2023-09-04 22:32:13.206190,0 days 00:00:02.739188,ReLU,Sigmoid,,,40,22,7.0,,,0.002660524601831891,2,107,0.7996487343043153,5.749751446034945e-05,101.04591894931481,COMPLETE
1533,0.43123242259025574,2023-09-04 22:32:13.206690,2023-09-04 22:32:14.947243,0 days 00:00:01.740553,Tanh,Tanh,,,13,20,23.0,,,5.350648427124519e-05,2,118,0.281549846344689,0.010328422889915421,1167.6416562613795,COMPLETE
