number,value,datetime_start,datetime_complete,duration,params_activation1,params_activation2,params_activation3,params_activation4,params_batch_size,params_fl1,params_fl2,params_fl3,params_fl4,params_learning_rate,params_n_layers,params_num_epochs,params_train_size,params_weight_decay,user_attrs_mre,state
1690,0.3242802917957306,2023-09-04 22:23:30.465652,2023-09-04 22:23:31.944620,0 days 00:00:01.478968,Tanh,ReLU,Leaky,,20,13,17.0,21.0,,0.0009350276378104293,3,341,0.6443854589655879,0.00011782778825006646,121.08586940058956,COMPLETE
1691,0.37578919529914856,2023-09-04 22:23:31.945171,2023-09-04 22:23:32.411027,0 days 00:00:00.465856,Tanh,Leaky,Leaky,,26,11,19.0,12.0,,0.011851778591302816,3,358,0.322900076668034,0.0065648067574443246,120.60501098632812,COMPLETE
1692,0.3166459798812866,2023-09-04 22:23:32.411576,2023-09-04 22:23:33.892464,0 days 00:00:01.480888,Tanh,Leaky,ReLU,,15,12,20.0,9.0,,0.007497204627679284,3,390,0.7456013994957271,2.471949276400385e-05,96.1139619157121,COMPLETE
1693,0.4317845106124878,2023-09-04 22:23:33.892986,2023-09-04 22:23:42.045958,0 days 00:00:08.152972,Tanh,Leaky,Leaky,,23,10,21.0,15.0,,1.9105075072825453e-05,3,412,0.5625856220105806,0.0002883498376970801,219.7222930945239,COMPLETE
1694,0.33131465315818787,2023-09-04 22:23:42.046463,2023-09-04 22:23:54.572292,0 days 00:00:12.525829,Tanh,ReLU,Sigmoid,,18,11,17.0,23.0,,4.7354063656705444e-05,3,367,0.7719388719157947,0.00042133857252978443,106.68403816742858,COMPLETE
1695,0.4533097445964813,2023-09-04 22:23:54.572769,2023-09-04 22:23:55.002846,0 days 00:00:00.430077,Sigmoid,Leaky,Leaky,,21,1,18.0,13.0,,0.014406505017664054,3,334,0.7099377969030188,3.395856337526253e-05,133.88890838623047,COMPLETE
1696,0.4144864082336426,2023-09-04 22:23:55.003346,2023-09-04 22:23:55.364117,0 days 00:00:00.360771,Tanh,Sigmoid,Tanh,,26,12,18.0,8.0,,0.009280409482987861,3,383,0.11625275207769466,0.0027507644240298396,219.347746677086,COMPLETE
1697,0.2890569567680359,2023-09-04 22:23:55.364609,2023-09-04 22:23:59.457179,0 days 00:00:04.092570,Tanh,Leaky,Leaky,,17,13,19.0,17.0,,0.03451855358830845,3,399,0.7996370577461834,0.0005502728582344465,104.87182226846384,COMPLETE
1698,0.32346540689468384,2023-09-04 22:23:59.458087,2023-09-04 22:24:07.642922,0 days 00:00:08.184835,Tanh,Leaky,Leaky,ReLU,24,11,17.0,11.0,2.0,0.0013934721916042067,4,345,0.3998498050793122,0.009525182200463337,117.24914418734036,COMPLETE
1699,0.4373854100704193,2023-09-04 22:24:07.643516,2023-09-04 22:24:26.399782,0 days 00:00:18.756266,Tanh,Sigmoid,Leaky,,15,10,20.0,15.0,,8.635037529728667e-05,3,358,0.7996557333747338,5.7274879311617016e-05,108.85875808460086,COMPLETE
1700,0.36324286460876465,2023-09-04 22:24:26.400296,2023-09-04 22:24:27.554424,0 days 00:00:01.154128,Tanh,ReLU,Leaky,,13,23,19.0,24.0,,0.044948409932827636,3,325,0.7470204840294021,0.001182506380135211,119.20788706903872,COMPLETE
1701,0.4541718065738678,2023-09-04 22:24:27.554939,2023-09-04 22:24:38.200765,0 days 00:00:10.645826,Tanh,Leaky,Leaky,,20,11,13.0,8.0,,1.0584705476052294e-05,3,408,0.604150324880317,0.00021923176652082445,132.03634652904435,COMPLETE
1702,0.32090920209884644,2023-09-04 22:24:38.201276,2023-09-04 22:24:38.891445,0 days 00:00:00.690169,Tanh,Leaky,Leaky,,23,15,18.0,14.0,,0.06378484740334875,3,351,0.6750764375360498,0.0008859249792929789,120.06747071639352,COMPLETE
1703,0.3007723093032837,2023-09-04 22:24:38.891940,2023-09-04 22:24:40.059317,0 days 00:00:01.167377,Tanh,Leaky,Leaky,,12,21,17.0,23.0,,0.018073539632306984,3,373,0.7190554178860465,4.4624891669448454e-05,94.23391151428223,COMPLETE
1704,0.34772613644599915,2023-09-04 22:24:40.059849,2023-09-04 22:24:40.640752,0 days 00:00:00.580903,Tanh,Tanh,ReLU,,26,17,21.0,22.0,,0.005133504404793609,3,391,0.27854502636184764,7.859211056616577e-05,124.78650983174641,COMPLETE
1705,0.3633449673652649,2023-09-04 22:24:40.641254,2023-09-04 22:24:43.240180,0 days 00:00:02.598926,Tanh,Sigmoid,Leaky,,17,12,19.0,9.0,,0.0011543072153601555,3,419,0.7449815777041123,0.0001765713100636672,122.08710168113171,COMPLETE
1706,0.3426816761493683,2023-09-04 22:24:43.240685,2023-09-04 22:24:43.758887,0 days 00:00:00.518202,Tanh,Leaky,Leaky,,19,22,18.0,7.0,,0.01299397951269185,3,365,0.19746593967526663,1.7499525312808267e-05,116.5018889385721,COMPLETE
1707,0.33713623881340027,2023-09-04 22:24:43.759398,2023-09-04 22:24:44.695095,0 days 00:00:00.935697,Tanh,ReLU,Tanh,,51,13,20.0,10.0,,0.006674052751780966,3,380,0.77292439933283,0.00013222907197060746,100.60083599748283,COMPLETE
1708,0.3538530170917511,2023-09-04 22:24:44.695600,2023-09-04 22:24:45.054304,0 days 00:00:00.358704,Tanh,Leaky,Leaky,,21,12,17.0,14.0,,0.008717887263538733,3,336,0.2025827083196812,0.00010336403342132198,105.99707972208658,COMPLETE
1709,0.35826048254966736,2023-09-04 22:24:45.054779,2023-09-04 22:24:46.227404,0 days 00:00:01.172625,ReLU,Leaky,Leaky,,24,10,18.0,6.0,,0.0017870999667766612,3,347,0.3317271210505047,0.0002485269209416993,149.98605633807438,COMPLETE
1710,0.9763096570968628,2023-09-04 22:24:46.227917,2023-09-04 22:24:47.563495,0 days 00:00:01.335578,Tanh,Sigmoid,Leaky,,16,11,17.0,16.0,,0.002319762888203354,3,397,0.7005445163710056,0.08304631828316851,100.43270918902229,COMPLETE
1711,0.3278147280216217,2023-09-04 22:24:47.564045,2023-09-04 22:24:49.148673,0 days 00:00:01.584628,Tanh,Leaky,Leaky,,10,12,13.0,13.0,,0.010479512144597889,3,358,0.6407155742250378,1.3431065339717338e-05,102.20284118652344,COMPLETE
1712,0.4622911810874939,2023-09-04 22:24:49.149198,2023-09-04 22:24:49.425622,0 days 00:00:00.276424,Sigmoid,ReLU,Leaky,,22,11,19.0,15.0,,0.02328979793442468,3,319,0.13335265195905927,0.008191917023052645,125.96806023337625,COMPLETE
1713,0.32711610198020935,2023-09-04 22:24:49.426251,2023-09-04 22:24:49.888109,0 days 00:00:00.461858,Tanh,,,,78,18,,,,0.015204141654908467,1,371,0.4455906051794412,0.0006169193848080397,116.05042385047591,COMPLETE
1714,0.3668138086795807,2023-09-04 22:24:49.888737,2023-09-04 22:24:50.205042,0 days 00:00:00.316305,ReLU,Leaky,Leaky,,25,13,18.0,24.0,,0.007766096442112954,3,388,0.14481071875295706,0.00014698381878237125,202.05282014789003,COMPLETE
1715,0.30680033564567566,2023-09-04 22:24:50.205680,2023-09-04 22:24:53.382963,0 days 00:00:03.177283,Tanh,Leaky,Sigmoid,,18,13,19.0,12.0,,0.0008578074906583386,3,406,0.5791718508080431,6.242558265410144e-05,117.62500756685851,COMPLETE
1716,0.432722270488739,2023-09-04 22:24:53.383455,2023-09-04 22:24:53.756124,0 days 00:00:00.372669,Tanh,Sigmoid,Leaky,,27,12,20.0,13.0,,0.004266846394595305,3,301,0.13879836922522795,0.012021569920730207,154.4338607788086,COMPLETE
1717,0.31826895475387573,2023-09-04 22:24:53.756666,2023-09-04 22:24:54.877964,0 days 00:00:01.121298,Tanh,Leaky,ReLU,,15,11,17.0,17.0,,0.011453114713196726,3,350,0.5209515302071717,2.914838565610359e-05,106.07383105629368,COMPLETE
1718,0.3269135653972626,2023-09-04 22:24:54.878455,2023-09-04 22:25:01.348893,0 days 00:00:06.470438,ReLU,ReLU,Leaky,,13,11,12.0,8.0,,0.0006536478447732621,3,417,0.7991627216536832,0.0003335766363120409,85.40717753163584,COMPLETE
1719,0.32270511984825134,2023-09-04 22:25:01.349406,2023-09-04 22:25:01.979298,0 days 00:00:00.629892,Tanh,Leaky,Leaky,,38,10,18.0,6.0,,0.0033093949652036685,3,382,0.7263815876504118,0.003245155199846253,108.11395780501827,COMPLETE
1720,0.37734749913215637,2023-09-04 22:25:01.979799,2023-09-04 22:25:02.269714,0 days 00:00:00.289915,Tanh,Sigmoid,Tanh,,20,12,19.0,18.0,,0.031189152475012527,3,340,0.1755875628310965,5.087902840663792e-05,446.3559681285511,COMPLETE
1721,0.43668973445892334,2023-09-04 22:25:02.270229,2023-09-04 22:25:06.813196,0 days 00:00:04.542967,Tanh,Leaky,Leaky,,23,12,18.0,9.0,,3.79680854701105e-05,3,362,0.30127973055929397,8.593775868540846e-05,129.27549242051268,COMPLETE
1722,0.2925232946872711,2023-09-04 22:25:06.813686,2023-09-04 22:25:08.651850,0 days 00:00:01.838164,ReLU,Leaky,Leaky,,26,19,17.0,16.0,,0.017577256716122525,3,328,0.753201438202229,3.6649196866013774e-05,97.72710768381755,COMPLETE
1723,0.4145955741405487,2023-09-04 22:25:08.652600,2023-09-04 22:25:08.969988,0 days 00:00:00.317388,Tanh,Leaky,Leaky,,19,10,14.0,11.0,,0.009804265601625384,3,376,0.1070197641581993,0.0019401628702034137,1958.4326190370502,COMPLETE
1724,0.31095415353775024,2023-09-04 22:25:08.970518,2023-09-04 22:25:10.860032,0 days 00:00:01.889514,Tanh,ReLU,Leaky,,16,24,12.0,7.0,,0.013055478827590871,3,398,0.6677562772069117,0.00018405131658546383,308.8460553757688,COMPLETE
1725,0.45790091156959534,2023-09-04 22:25:10.860514,2023-09-04 22:25:26.998093,0 days 00:00:16.137579,Tanh,Sigmoid,Leaky,,21,11,8.0,15.0,,1.2847554947290948e-05,3,357,0.7708592774726378,0.00021846790763538029,100.46013615712398,COMPLETE
1726,0.31709372997283936,2023-09-04 22:25:26.998585,2023-09-04 22:25:28.959282,0 days 00:00:01.960697,ReLU,Leaky,Leaky,,14,13,20.0,8.0,,0.006082306214376077,3,367,0.7099682583338524,0.0024846532046231143,91.61627308527629,COMPLETE
1727,0.3384319245815277,2023-09-04 22:25:28.959907,2023-09-04 22:25:29.772162,0 days 00:00:00.812255,Tanh,Tanh,Leaky,,24,22,6.0,14.0,,0.01987954730197135,3,408,0.743211549043442,1.1318013912496112e-05,95.30617229755109,COMPLETE
1728,0.40013742446899414,2023-09-04 22:25:29.772807,2023-09-04 22:25:30.249248,0 days 00:00:00.476441,Tanh,Leaky,Leaky,,18,16,9.0,23.0,,0.025809579373023635,3,343,0.46728767729400317,0.00567158981128338,120.2316026687622,COMPLETE
1729,0.293870210647583,2023-09-04 22:25:30.249762,2023-09-04 22:25:31.212671,0 days 00:00:00.962909,Tanh,Leaky,Leaky,,22,12,19.0,12.0,,0.008666150176528088,3,421,0.7997663489258875,2.193179268680289e-05,107.53941062644675,COMPLETE
1730,0.36409229040145874,2023-09-04 22:25:31.213255,2023-09-04 22:25:31.992159,0 days 00:00:00.778904,ReLU,ReLU,ReLU,,27,11,21.0,10.0,,0.015534990725504133,3,389,0.6166163986091011,0.0002829214749887191,110.98044134069372,COMPLETE
1731,0.37038949131965637,2023-09-04 22:25:31.992692,2023-09-04 22:25:32.647427,0 days 00:00:00.654735,Tanh,Sigmoid,Leaky,,12,21,17.0,7.0,,0.053886126736044405,3,353,0.25240874795418733,0.0004960547455537254,109.3182586034139,COMPLETE
1732,0.3193332850933075,2023-09-04 22:25:32.648127,2023-09-04 22:25:34.751475,0 days 00:00:02.103348,Tanh,Leaky,Leaky,,17,23,17.0,14.0,,0.011778210148005307,3,376,0.6858989878976248,0.0001589360028021432,99.17452223404594,COMPLETE
1733,0.3379557430744171,2023-09-04 22:25:34.752359,2023-09-04 22:25:36.037362,0 days 00:00:01.285003,Sigmoid,Leaky,Tanh,,25,12,19.0,9.0,,0.006901363305969823,3,310,0.7523132674244581,0.00011523667546637788,100.49330014598613,COMPLETE
1734,0.3059096336364746,2023-09-04 22:25:36.037977,2023-09-04 22:25:37.722888,0 days 00:00:01.684911,Tanh,Leaky,Leaky,,19,20,13.0,24.0,,0.0016476979541327785,3,333,0.721140255123761,4.352250679775314e-05,97.15650134616428,COMPLETE
1735,0.3833322525024414,2023-09-04 22:25:37.723385,2023-09-04 22:25:38.218148,0 days 00:00:00.494763,ReLU,Sigmoid,Leaky,,15,11,18.0,13.0,,0.00989386735156895,3,175,0.21338570598485887,0.0009908045226034365,137.04655478982363,COMPLETE
1736,0.314223051071167,2023-09-04 22:25:38.218660,2023-09-04 22:25:39.030322,0 days 00:00:00.811662,Tanh,ReLU,Leaky,,21,10,23.0,16.0,,0.02163400948535451,3,367,0.7720602714846183,0.0007974869258463985,108.18689918518066,COMPLETE
1737,0.3400130867958069,2023-09-04 22:25:39.030836,2023-09-04 22:25:40.327643,0 days 00:00:01.296807,Tanh,Leaky,Sigmoid,,42,13,14.0,17.0,,0.004590506014955354,3,400,0.3472557447410643,0.0047258778172847545,108.20837996277628,COMPLETE
1738,0.35586535930633545,2023-09-04 22:25:40.328250,2023-09-04 22:25:41.073900,0 days 00:00:00.745650,Tanh,Leaky,Leaky,,23,12,20.0,21.0,,0.013694393779775235,3,384,0.502568846753893,0.001329087170767368,91.00001575100806,COMPLETE
1739,0.3826497793197632,2023-09-04 22:25:41.074406,2023-09-04 22:25:42.139980,0 days 00:00:01.065574,ReLU,Sigmoid,Leaky,,27,11,20.0,23.0,,0.0010870674314182815,3,347,0.6946014312085994,6.991734576599747e-05,124.05386257171631,COMPLETE
1740,0.38773292303085327,2023-09-04 22:25:42.140480,2023-09-04 22:25:42.468997,0 days 00:00:00.328517,Tanh,Leaky,Leaky,,17,12,12.0,11.0,,0.007888474345084712,3,359,0.12524866700973533,0.003880133705114805,155.06089378805723,COMPLETE
1741,0.3305639922618866,2023-09-04 22:25:42.469559,2023-09-04 22:25:44.725768,0 days 00:00:02.256209,Tanh,ReLU,ReLU,,20,13,19.0,22.0,,0.005282655740931023,3,412,0.7726992270466185,0.0004601233589849545,99.11507695157763,COMPLETE
1742,0.37288805842399597,2023-09-04 22:25:44.726281,2023-09-04 22:25:45.487397,0 days 00:00:00.761116,ReLU,Leaky,Leaky,,24,11,17.0,8.0,,0.0026273881264276596,3,373,0.37479418699186356,0.0002038345665631956,124.65267619680851,COMPLETE
1743,0.3953835368156433,2023-09-04 22:25:45.487921,2023-09-04 22:25:46.034099,0 days 00:00:00.546178,Tanh,Leaky,Leaky,Sigmoid,10,10,18.0,15.0,16.0,0.04011030224108602,4,392,0.15805850887830308,8.820679522133706e-05,475.54580747164215,COMPLETE
1744,0.3989819884300232,2023-09-04 22:25:46.034666,2023-09-04 22:25:47.221676,0 days 00:00:01.187010,Tanh,Sigmoid,Tanh,,28,3,18.0,13.0,,0.0005660297525576163,3,325,0.40948743179250846,3.1280593523286676e-05,119.27884570463205,COMPLETE
1745,0.4288836121559143,2023-09-04 22:25:47.222199,2023-09-04 22:25:48.320392,0 days 00:00:01.098193,Tanh,Leaky,Leaky,,14,12,22.0,7.0,,0.011090463235862033,3,339,0.424833860719273,0.05321021413058032,120.78130855116733,COMPLETE
1746,0.23245184123516083,2023-09-04 22:25:48.320891,2023-09-04 22:25:50.598266,0 days 00:00:02.277375,ReLU,Leaky,Leaky,,25,22,19.0,15.0,,0.0020874355895731046,3,423,0.7298992565247543,0.0002702318675833568,113.20068599866784,COMPLETE
1747,0.36054927110671997,2023-09-04 22:25:50.598787,2023-09-04 22:26:09.002708,0 days 00:00:18.403921,ReLU,ReLU,Leaky,,26,22,19.0,15.0,,1.5817939951456605e-05,3,423,0.7447441255394829,0.00029773439831178055,115.53899399777676,COMPLETE
1748,0.28761032223701477,2023-09-04 22:26:09.003479,2023-09-04 22:26:11.257616,0 days 00:00:02.254137,ReLU,Leaky,Leaky,,27,23,20.0,16.0,,0.001624816747182416,3,424,0.7706308658338231,0.00026311953773211857,157.4942819174234,COMPLETE
1749,0.2813410758972168,2023-09-04 22:26:11.258412,2023-09-04 22:26:12.614368,0 days 00:00:01.355956,ReLU,Leaky,Leaky,,25,22,19.0,15.0,,0.0027862064966372186,3,427,0.7274327049782028,0.0003542247400481159,99.64166212081909,COMPLETE
1750,0.3160901367664337,2023-09-04 22:26:12.615121,2023-09-04 22:26:14.785354,0 days 00:00:02.170233,ReLU,Sigmoid,Leaky,,25,22,19.0,15.0,,0.0012947210427568443,3,421,0.7490979827524472,0.00031409184767124934,211.7355087489298,COMPLETE
1751,0.29781457781791687,2023-09-04 22:26:14.786031,2023-09-04 22:26:16.040461,0 days 00:00:01.254430,ReLU,Leaky,Leaky,,27,22,19.0,16.0,,0.0022062103504852963,3,426,0.7716155138648239,0.0002548516413651422,94.19308504850969,COMPLETE
1752,0.3074468970298767,2023-09-04 22:26:16.040974,2023-09-04 22:26:17.649640,0 days 00:00:01.608666,ReLU,Tanh,ReLU,,25,22,20.0,14.0,,0.001986873015036211,3,415,0.7989452462897564,0.00023291568024105743,82.06488746509217,COMPLETE
1753,0.4019283652305603,2023-09-04 22:26:17.650169,2023-09-04 22:26:17.872462,0 days 00:00:00.222293,ReLU,Leaky,Leaky,,24,22,19.0,15.0,,0.024899297972861743,3,420,0.11265878065662169,0.0004056686919452346,204.0815654553865,COMPLETE
1754,0.30820003151893616,2023-09-04 22:26:17.873017,2023-09-04 22:26:19.738690,0 days 00:00:01.865673,ReLU,ReLU,Leaky,,28,21,19.0,15.0,,0.0013822445612552562,3,415,0.7128763521586017,0.00020198533208042152,134.7489046507244,COMPLETE
1755,0.34698835015296936,2023-09-04 22:26:19.739196,2023-09-04 22:26:20.805528,0 days 00:00:01.066332,ReLU,Sigmoid,Tanh,,26,23,20.0,16.0,,0.0014531398478859615,3,429,0.728957237481147,0.0003182054977451853,106.81960220336914,COMPLETE
1756,0.39040181040763855,2023-09-04 22:26:20.806049,2023-09-04 22:26:21.681409,0 days 00:00:00.875360,ReLU,Leaky,Leaky,,23,23,19.0,14.0,,0.0032850539306577,3,408,0.38906276710395615,0.0640630699161789,104.6610599274331,COMPLETE
1757,0.4620555639266968,2023-09-04 22:26:21.682155,2023-09-04 22:26:21.946826,0 days 00:00:00.264671,ReLU,Leaky,Leaky,,29,22,20.0,5.0,,0.0022204595466155017,3,414,0.10958008360017228,0.0002639507420254895,207.61233988115865,COMPLETE
1758,0.34555795788764954,2023-09-04 22:26:21.947509,2023-09-04 22:26:22.657248,0 days 00:00:00.709739,ReLU,Leaky,Sigmoid,,24,22,19.0,16.0,,0.003672442910955113,3,427,0.5526963323600348,0.00018268581418180856,107.94132946383569,COMPLETE
1759,0.3080240488052368,2023-09-04 22:26:22.657975,2023-09-04 22:26:23.583811,0 days 00:00:00.925836,ReLU,ReLU,Leaky,,26,21,20.0,15.0,,0.0016142953259046212,3,412,0.7708472182434504,0.00022534001145259387,91.04358719334458,COMPLETE
1760,0.3433549702167511,2023-09-04 22:26:23.584319,2023-09-04 22:26:33.007675,0 days 00:00:09.423356,ReLU,Sigmoid,Leaky,,28,21,19.0,14.0,,6.906385278375213e-05,3,402,0.7494488003934454,0.0004041683692821912,106.90692193709796,COMPLETE
1761,0.29570019245147705,2023-09-04 22:26:33.008337,2023-09-04 22:26:35.012067,0 days 00:00:02.003730,ReLU,Leaky,Leaky,,24,23,20.0,14.0,,0.0025038533116627797,3,417,0.7998245943379462,0.00034520335241839995,89.28794602424868,COMPLETE
1762,0.32816624641418457,2023-09-04 22:26:35.012782,2023-09-04 22:26:37.154200,0 days 00:00:02.141418,ReLU,,,,23,22,,,,0.0019053462634722133,1,404,0.7256311085921507,0.00028136668820412966,105.03925795474295,COMPLETE
1763,0.30151814222335815,2023-09-04 22:26:37.154713,2023-09-04 22:26:38.598483,0 days 00:00:01.443770,ReLU,Leaky,Leaky,,26,21,19.0,15.0,,0.0009813222835244368,3,424,0.4979789661285705,0.00016572697911926447,154.1213153987736,COMPLETE
1764,0.2565087676048279,2023-09-04 22:26:38.599018,2023-09-04 22:26:41.029969,0 days 00:00:02.430951,ReLU,Leaky,Leaky,,28,21,19.0,15.0,,0.0031047635635497515,3,404,0.7720744346185259,0.0002348254182019186,86.34400817871094,COMPLETE
1765,0.3926219046115875,2023-09-04 22:26:41.030534,2023-09-04 22:26:41.585459,0 days 00:00:00.554925,ReLU,Sigmoid,ReLU,,29,21,20.0,15.0,,0.0029390302690353184,3,407,0.18744332496121144,0.0002257433728982116,107.75887160831027,COMPLETE
1766,0.3166780173778534,2023-09-04 22:26:41.585997,2023-09-04 22:26:43.742040,0 days 00:00:02.156043,ReLU,Leaky,Leaky,,28,21,19.0,15.0,,0.0028164109755884014,3,409,0.7706429639748682,0.00026655774893384046,84.53915749826739,COMPLETE
1767,0.3579394221305847,2023-09-04 22:26:43.742568,2023-09-04 22:26:44.275500,0 days 00:00:00.532932,ReLU,ReLU,Leaky,,29,21,21.0,14.0,,0.003699836418707314,3,420,0.2738944672033019,0.02101557883057707,260.9107989142923,COMPLETE
1768,0.32273155450820923,2023-09-04 22:26:44.275994,2023-09-04 22:26:45.058273,0 days 00:00:00.782279,ReLU,Leaky,Tanh,,30,20,20.0,14.0,,0.0025100051128503016,3,406,0.7730678457899821,0.00020936451521700946,120.14996756276777,COMPLETE
1769,0.31405380368232727,2023-09-04 22:26:45.058756,2023-09-04 22:26:46.605593,0 days 00:00:01.546837,ReLU,Leaky,Leaky,,28,21,13.0,15.0,,0.003333672649558583,3,415,0.7738001507346218,0.0002479992734093804,104.75663357093686,COMPLETE
1770,0.3171062767505646,2023-09-04 22:26:46.606142,2023-09-04 22:26:47.957639,0 days 00:00:01.351497,ReLU,Sigmoid,Leaky,,27,20,19.0,15.0,,0.003077720572971862,3,431,0.7457912782283816,0.0003319554114007391,94.9494834206321,COMPLETE
1771,0.3679322302341461,2023-09-04 22:26:47.958144,2023-09-04 22:26:48.696672,0 days 00:00:00.738528,ReLU,Leaky,Leaky,,30,20,3.0,15.0,,0.0023160434582521153,3,401,0.36677505274836303,0.00018373858397827627,103.76943044193456,COMPLETE
1772,0.31224068999290466,2023-09-04 22:26:48.697172,2023-09-04 22:26:49.264732,0 days 00:00:00.567560,ReLU,ReLU,Leaky,,26,22,19.0,14.0,,0.003439493978022464,3,416,0.7761665080118951,0.04312330047267815,129.97294897782174,COMPLETE
1773,0.33886075019836426,2023-09-04 22:26:49.265221,2023-09-04 22:26:50.685907,0 days 00:00:01.420686,ReLU,Leaky,Leaky,,27,21,14.0,15.0,,0.002599259240453696,3,408,0.7990787694659613,0.00014453620327352818,118.54625900268555,COMPLETE
1774,0.3353613018989563,2023-09-04 22:26:50.686922,2023-09-04 22:26:52.187251,0 days 00:00:01.500329,ReLU,Sigmoid,Leaky,,28,22,19.0,14.0,,0.0019623363742281787,3,400,0.5268501221829316,0.000302284367385445,1156.938042891653,COMPLETE
1775,0.3207007348537445,2023-09-04 22:26:52.187788,2023-09-04 22:26:53.000939,0 days 00:00:00.813151,ReLU,Leaky,Leaky,,30,21,20.0,15.0,,0.004239525762894504,3,426,0.7463332680517628,0.00021147960315356497,122.77172876993815,COMPLETE
1776,0.27563589811325073,2023-09-04 22:26:53.001461,2023-09-04 22:26:54.731416,0 days 00:00:01.729955,ReLU,Leaky,ReLU,,26,21,12.0,14.0,,0.0038550889461545085,3,419,0.798996542406267,0.000246478491582811,83.57351578932543,COMPLETE
1777,0.35431042313575745,2023-09-04 22:26:54.731947,2023-09-04 22:26:55.143198,0 days 00:00:00.411251,ReLU,ReLU,Leaky,,28,20,18.0,14.0,,0.002178998347920775,3,406,0.24714360560895346,0.00015980109841484683,96.39690894049568,COMPLETE
1778,0.3881751596927643,2023-09-04 22:26:55.143716,2023-09-04 22:27:05.194490,0 days 00:00:10.050774,ReLU,Leaky,Leaky,,25,21,18.0,15.0,,1.862575609769079e-05,3,399,0.7989760183362516,0.0001885541615964546,109.54751303918977,COMPLETE
1779,0.32611083984375,2023-09-04 22:27:05.195007,2023-09-04 22:27:06.547166,0 days 00:00:01.352159,ReLU,Tanh,Leaky,Leaky,25,21,21.0,13.0,17.0,0.0027329216588894804,4,413,0.7395427998492237,0.0002947838320355921,92.92682682384144,COMPLETE
1780,0.3956257700920105,2023-09-04 22:27:06.547689,2023-09-04 22:27:06.819814,0 days 00:00:00.272125,ReLU,Sigmoid,Tanh,,27,22,14.0,16.0,,0.03372770177759827,3,432,0.24144724951485227,0.0003893166351043589,121.61298836602106,COMPLETE
1781,0.25050950050354004,2023-09-04 22:27:06.820333,2023-09-04 22:27:07.805782,0 days 00:00:00.985449,ReLU,Leaky,Leaky,,31,21,19.0,15.0,,0.003385544103541482,3,398,0.7554052467740783,0.00022388007121132834,102.92348206348909,COMPLETE
1782,0.38876116275787354,2023-09-04 22:27:07.806326,2023-09-04 22:27:08.168620,0 days 00:00:00.362294,ReLU,Leaky,Leaky,,35,20,19.0,15.0,,0.003183404216750498,3,423,0.17648204151539035,0.0002578840180858866,159.51399305755018,COMPLETE
