number,value,datetime_start,datetime_complete,duration,params_activation1,params_activation2,params_activation3,params_activation4,params_batch_size,params_fl1,params_fl2,params_fl3,params_fl4,params_learning_rate,params_n_layers,params_num_epochs,params_train_size,params_weight_decay,user_attrs_mre,state
1411,0.468311071395874,2023-09-04 22:14:08.486893,2023-09-04 22:14:08.801040,0 days 00:00:00.314147,Tanh,Sigmoid,,,26,16,20.0,,,0.003326466108293205,2,421,0.16723089139084865,0.031625312684141156,109.86462020874023,COMPLETE
1412,0.3392106890678406,2023-09-04 22:14:08.801509,2023-09-04 22:14:09.694663,0 days 00:00:00.893154,ReLU,ReLU,Leaky,,23,22,11.0,10.0,,0.022398475315848595,3,393,0.663938244553896,4.584919636731184e-05,113.55742772420247,COMPLETE
1413,0.3265502154827118,2023-09-04 22:14:09.695180,2023-09-04 22:14:10.723268,0 days 00:00:01.028088,Tanh,Sigmoid,Leaky,,29,12,15.0,6.0,,0.004420215286008523,3,445,0.6974813459820289,6.780012036888547e-05,139.6572688334697,COMPLETE
1414,0.3024166524410248,2023-09-04 22:14:10.723780,2023-09-04 22:14:12.313023,0 days 00:00:01.589243,Tanh,Sigmoid,,,17,11,16.0,,,0.01536728274157982,2,382,0.7407226615464254,2.7068704142349906e-05,94.23025288301356,COMPLETE
1415,0.2947053909301758,2023-09-04 22:14:12.313500,2023-09-04 22:14:13.838799,0 days 00:00:01.525299,Tanh,Leaky,Leaky,,22,10,14.0,9.0,,0.0061408617467518896,3,334,0.48817807661236357,0.0002151335076249136,100.981153827824,COMPLETE
1416,0.29948800802230835,2023-09-04 22:14:13.839265,2023-09-04 22:14:14.609108,0 days 00:00:00.769843,ReLU,ReLU,ReLU,,27,23,15.0,14.0,,0.0027110301744823766,3,351,0.7722367723530354,2.0277478269186637e-05,112.65129371925637,COMPLETE
1417,0.3458501398563385,2023-09-04 22:14:14.609590,2023-09-04 22:14:15.227646,0 days 00:00:00.618056,Leaky,Leaky,,,24,13,16.0,,,0.011335560237454679,2,368,0.38401750735259954,0.0011055601700160728,111.41703962243122,COMPLETE
1418,0.33289361000061035,2023-09-04 22:14:15.228208,2023-09-04 22:14:15.909515,0 days 00:00:00.681307,Tanh,Sigmoid,Leaky,,20,15,12.0,11.0,,0.008694648497030775,3,426,0.35459325767602284,0.00012247184278704846,230.0281970684345,COMPLETE
1419,0.38664710521698,2023-09-04 22:14:15.910114,2023-09-04 22:14:16.406050,0 days 00:00:00.495936,Tanh,Leaky,Tanh,,11,11,16.0,7.0,,0.04340715083671366,3,400,0.20750268001296693,4.115601838260496e-05,120.22912823712385,COMPLETE
1420,0.3714163601398468,2023-09-04 22:14:16.406531,2023-09-04 22:14:22.116280,0 days 00:00:05.709749,ReLU,,,,30,12,,,,0.00022527728412437002,1,409,0.6275517774989579,0.01700133234625357,100.80932365537313,COMPLETE
1421,0.4093514084815979,2023-09-04 22:14:22.116752,2023-09-04 22:14:23.827650,0 days 00:00:01.710898,Tanh,Leaky,,,25,14,13.0,,,0.00018568507411600621,2,467,0.17559804154927838,9.097168944001636e-05,102.69475751174123,COMPLETE
1422,0.460909903049469,2023-09-04 22:14:23.828620,2023-09-04 22:14:30.955601,0 days 00:00:07.126981,Tanh,Sigmoid,Leaky,,14,10,15.0,13.0,,4.645348258713475e-05,3,377,0.29437663905091327,0.00034188624610589246,200.3762413652253,COMPLETE
1423,0.28407835960388184,2023-09-04 22:14:30.956162,2023-09-04 22:14:32.494831,0 days 00:00:01.538669,ReLU,Leaky,Leaky,,16,12,16.0,8.0,,0.00736240197671839,3,344,0.7082770014781169,0.0005100241984155069,476.8589456731623,COMPLETE
1424,0.37389978766441345,2023-09-04 22:14:32.495355,2023-09-04 22:14:36.417594,0 days 00:00:03.922239,Tanh,ReLU,Leaky,,32,20,19.0,13.0,,5.764453082147308e-05,3,358,0.39607755690017676,0.015833036429912975,118.5326679592026,COMPLETE
1425,0.3569642901420593,2023-09-04 22:14:36.418057,2023-09-04 22:14:37.308425,0 days 00:00:00.890368,Tanh,Leaky,,,19,18,14.0,,,0.013259447892321159,2,434,0.7534740168821691,0.0008333587661223866,84.97790861129761,COMPLETE
1426,0.3675360381603241,2023-09-04 22:14:37.308877,2023-09-04 22:14:38.836339,0 days 00:00:01.527462,Tanh,Sigmoid,Leaky,,27,11,20.0,10.0,,0.002080245675898827,3,390,0.7763709490110317,0.0045256924533503785,135.39793236024917,COMPLETE
1427,0.3168267607688904,2023-09-04 22:14:38.836806,2023-09-04 22:14:43.224397,0 days 00:00:04.387591,ReLU,Leaky,Leaky,ReLU,23,11,9.0,9.0,2.0,0.0005570970242889531,4,399,0.6511995655184353,0.00025176498191762064,133.37215305115126,COMPLETE
1428,0.4216649830341339,2023-09-04 22:14:43.224986,2023-09-04 22:14:48.275609,0 days 00:00:05.050623,Tanh,Leaky,,,29,12,15.0,,,1.547005625365739e-05,2,369,0.5854740837865161,0.01835884658010404,108.59909539364864,COMPLETE
1429,0.34833788871765137,2023-09-04 22:14:48.276091,2023-09-04 22:14:50.181921,0 days 00:00:01.905830,Tanh,Tanh,Sigmoid,,21,13,13.0,6.0,,0.0051091139723771165,3,416,0.7272589802423767,0.0036215183686070457,108.22453487620635,COMPLETE
1430,0.3968328833580017,2023-09-04 22:14:50.182395,2023-09-04 22:14:50.571967,0 days 00:00:00.389572,Sigmoid,Sigmoid,Leaky,,25,10,11.0,12.0,,0.021938517508154332,3,341,0.13720261192993916,0.0001571724967040879,161.3474442799886,COMPLETE
1431,0.3565855622291565,2023-09-04 22:14:50.572537,2023-09-04 22:14:51.573606,0 days 00:00:01.001069,ReLU,Leaky,ReLU,,19,9,10.0,7.0,,0.01017801178048426,3,353,0.6903582062811716,5.8012127548285654e-05,100.11019411954013,COMPLETE
1432,0.35757318139076233,2023-09-04 22:14:51.574158,2023-09-04 22:15:00.592950,0 days 00:00:09.018792,Tanh,ReLU,,,27,12,21.0,,,0.00010445981351843573,2,381,0.7465708229822402,0.020208291328377585,109.63316923927448,COMPLETE
1433,0.28772416710853577,2023-09-04 22:15:00.593389,2023-09-04 22:15:09.200339,0 days 00:00:08.606950,Tanh,Leaky,Leaky,,23,11,12.0,8.0,,0.0003934419230760205,3,320,0.7982500103662067,3.208470796566193e-05,90.25683135986328,COMPLETE
1434,0.35479333996772766,2023-09-04 22:15:09.200867,2023-09-04 22:15:24.142803,0 days 00:00:14.941936,ReLU,Sigmoid,Tanh,,18,12,22.0,11.0,,0.00012670053715052284,3,409,0.799630676689095,0.03388455594631026,104.40546280553365,COMPLETE
1435,0.283285528421402,2023-09-04 22:15:24.143272,2023-09-04 22:15:25.571548,0 days 00:00:01.428276,Tanh,Leaky,,,31,21,16.0,,,0.016659804604209585,2,425,0.7177782852856733,1.6737768366085407e-05,115.36677265167236,COMPLETE
1436,0.41690197587013245,2023-09-04 22:15:25.572051,2023-09-04 22:15:25.906064,0 days 00:00:00.334013,Tanh,Leaky,Leaky,,22,22,14.0,9.0,,0.02935124839105998,3,386,0.1472418256738926,0.009041017972367707,126.44330792549329,COMPLETE
1437,0.44809406995773315,2023-09-04 22:15:25.906619,2023-09-04 22:15:41.261371,0 days 00:00:15.354752,Tanh,Sigmoid,Leaky,,16,10,15.0,14.0,,1.111788473497281e-05,3,440,0.7633744031209431,1.1339063704897027e-05,106.4789006319913,COMPLETE
1438,0.3549887537956238,2023-09-04 22:15:41.261837,2023-09-04 22:15:41.499172,0 days 00:00:00.237335,ReLU,Leaky,,,26,11,16.0,,,0.013629889715289197,2,331,0.18770176980468894,7.93242560237682e-05,152.02073985132677,COMPLETE
1439,0.433277428150177,2023-09-04 22:15:41.499620,2023-09-04 22:15:42.120016,0 days 00:00:00.620396,Tanh,ReLU,Leaky,,24,13,8.0,12.0,,0.00032431701877103894,3,364,0.15683657034889006,0.00011446388026429729,120.51683309803839,COMPLETE
1440,0.389019638299942,2023-09-04 22:15:42.120497,2023-09-04 22:15:42.596162,0 days 00:00:00.475665,Leaky,Leaky,Leaky,,28,11,15.0,8.0,,0.08722388723627394,3,396,0.6865807949156065,4.990139553486873e-05,138.8059973465769,COMPLETE
1441,0.2999190390110016,2023-09-04 22:15:42.596637,2023-09-04 22:15:43.324808,0 days 00:00:00.728171,Tanh,Sigmoid,,,32,12,19.0,,,0.008296120710730038,2,376,0.7482787692163053,0.00018588963859703564,125.35361385345459,COMPLETE
1442,0.3230606019496918,2023-09-04 22:15:43.325252,2023-09-04 22:15:43.824180,0 days 00:00:00.498928,ReLU,Leaky,Leaky,,20,24,17.0,13.0,,0.011098249776508523,3,357,0.33659216388796576,2.440635685121583e-05,173.89867655436197,COMPLETE
1443,0.37483853101730347,2023-09-04 22:15:43.824649,2023-09-04 22:15:44.917800,0 days 00:00:01.093151,Tanh,Leaky,Leaky,,14,11,20.0,7.0,,0.05267477785261058,3,349,0.30789030746699964,0.0005967318985224369,128.99430611020043,COMPLETE
1444,0.3393131494522095,2023-09-04 22:15:44.918654,2023-09-04 22:15:46.220902,0 days 00:00:01.302248,Tanh,Sigmoid,,,21,10,14.0,,,0.006288562200018133,2,339,0.48534351703609613,0.0002954644030266112,106.90941757452292,COMPLETE
1445,0.34749528765678406,2023-09-04 22:15:46.221375,2023-09-04 22:15:48.033407,0 days 00:00:01.812032,ReLU,Leaky,ReLU,,29,12,15.0,10.0,,0.000606981974858532,3,453,0.6635177662060731,0.00774135521076764,119.03321066962349,COMPLETE
1446,0.32212284207344055,2023-09-04 22:15:48.033914,2023-09-04 22:15:48.756847,0 days 00:00:00.722933,Tanh,ReLU,Leaky,,25,13,16.0,15.0,,0.025409368747908317,3,405,0.7715293997053414,0.00143803308565302,126.89626556396485,COMPLETE
1447,0.4202786087989807,2023-09-04 22:15:48.757311,2023-09-04 22:15:49.836352,0 days 00:00:01.079041,Tanh,Leaky,,,18,11,17.0,,,0.0023660457527809263,2,414,0.524039451973103,0.057528387809469894,113.408552273837,COMPLETE
1448,0.3698631823062897,2023-09-04 22:15:49.836810,2023-09-04 22:15:50.190002,0 days 00:00:00.353192,Tanh,Sigmoid,Leaky,,23,11,10.0,20.0,,0.03536788900287843,3,391,0.2764121617579107,3.8790679065464504e-05,126.42535308837891,COMPLETE
1449,0.3259601294994354,2023-09-04 22:15:50.190480,2023-09-04 22:15:51.020644,0 days 00:00:00.830164,ReLU,Leaky,Leaky,,27,12,21.0,6.0,,0.06877150905563778,3,373,0.7232628937958616,6.820115895259641e-05,98.35544945211971,COMPLETE
1450,0.3479619026184082,2023-09-04 22:15:51.021113,2023-09-04 22:15:51.228118,0 days 00:00:00.207005,Tanh,Leaky,,,17,14,16.0,,,0.019167183739128672,2,432,0.1361904075595508,0.0002257444239270409,133.3218950544085,COMPLETE
1451,0.44475236535072327,2023-09-04 22:15:51.228572,2023-09-04 22:15:51.796405,0 days 00:00:00.567833,Tanh,Sigmoid,Tanh,,30,23,13.0,19.0,,0.0004577461865519089,3,364,0.10474398868235744,0.057781860844329895,107.22923355651416,COMPLETE
1452,0.4553387761116028,2023-09-04 22:15:51.796877,2023-09-04 22:15:52.592456,0 days 00:00:00.795579,ReLU,ReLU,Leaky,,98,10,15.0,14.0,,0.00014764450811314954,3,421,0.11185624859261865,0.00041852241777472134,118.38312985381718,COMPLETE
1453,0.34543171525001526,2023-09-04 22:15:52.592906,2023-09-04 22:15:52.912997,0 days 00:00:00.320091,Tanh,Leaky,,,25,12,14.0,,,0.015701192325739886,2,385,0.16984556433931433,9.633904071621917e-05,108.53878297197058,COMPLETE
1454,0.3478517532348633,2023-09-04 22:15:52.913460,2023-09-04 22:15:57.181852,0 days 00:00:04.268392,Tanh,Tanh,Sigmoid,,21,21,16.0,8.0,,0.001719245848229128,3,400,0.5576310106693951,0.0001487638293314687,147.2199358014918,COMPLETE
1455,0.36996251344680786,2023-09-04 22:15:57.182315,2023-09-04 22:15:58.406862,0 days 00:00:01.224547,Sigmoid,Leaky,Leaky,,28,20,17.0,12.0,,0.00922662424627963,3,347,0.7996355739978526,3.260375472106157e-05,154.69842778419962,COMPLETE
1456,0.3105340898036957,2023-09-04 22:15:58.407335,2023-09-04 22:15:59.850401,0 days 00:00:01.443066,ReLU,Sigmoid,Leaky,,34,10,16.0,13.0,,0.003957415666730036,3,357,0.6264969252467051,0.00019210135122253475,125.33798664372142,COMPLETE
1457,0.38954493403434753,2023-09-04 22:15:59.850856,2023-09-04 22:16:07.913028,0 days 00:00:08.062172,Tanh,Leaky,,,19,9,15.0,,,2.0812350854914996e-05,2,335,0.7397707788060913,0.00027248871513126105,112.57924324149516,COMPLETE
1458,0.2650623023509979,2023-09-04 22:16:07.913550,2023-09-04 22:16:08.704998,0 days 00:00:00.791448,Tanh,Leaky,Leaky,,15,12,19.0,17.0,,0.011417626435612302,3,377,0.7020920799546773,5.019888331853082e-05,104.87749710083008,COMPLETE
1459,0.31963199377059937,2023-09-04 22:16:08.705469,2023-09-04 22:16:10.783257,0 days 00:00:02.077788,Tanh,Leaky,Leaky,,13,13,19.0,17.0,,0.011938664492067055,3,375,0.7702447311459597,3.880469553431824e-05,95.14995769744223,COMPLETE
1460,0.379354864358902,2023-09-04 22:16:10.783735,2023-09-04 22:16:11.282358,0 days 00:00:00.498623,ReLU,ReLU,Leaky,,14,13,19.0,17.0,,0.010246938557002632,3,383,0.42836299682136914,0.014427375237475825,111.97234030330883,COMPLETE
1461,0.3030564785003662,2023-09-04 22:16:11.282845,2023-09-04 22:16:13.364034,0 days 00:00:02.081189,Tanh,Sigmoid,Leaky,,11,13,19.0,16.0,,0.01284513356478772,3,379,0.7001223904098004,4.8185285385722575e-05,97.47059915232104,COMPLETE
1462,0.41271862387657166,2023-09-04 22:16:13.364544,2023-09-04 22:16:13.716088,0 days 00:00:00.351544,Tanh,Leaky,Leaky,,14,13,19.0,18.0,,0.015115146462072156,3,378,0.13823418283646194,4.4831603088093664e-05,280.9441493864982,COMPLETE
1463,0.38321322202682495,2023-09-04 22:16:13.716575,2023-09-04 22:16:20.074352,0 days 00:00:06.357777,Tanh,Leaky,Leaky,,12,12,20.0,14.0,,8.49473903830221e-05,3,369,0.49807590360572995,2.881569037858786e-05,128.24349526583293,COMPLETE
1464,0.3725545108318329,2023-09-04 22:16:20.074900,2023-09-04 22:16:23.868048,0 days 00:00:03.793148,ReLU,Sigmoid,Leaky,,18,12,19.0,16.0,,0.00018961931802360756,3,390,0.7403728910366866,4.136102700786318e-05,113.74228460746899,COMPLETE
1465,0.24185894429683685,2023-09-04 22:16:23.868548,2023-09-04 22:16:25.394351,0 days 00:00:01.525803,Leaky,Leaky,Leaky,,15,12,19.0,17.0,,0.011170964552313811,3,370,0.7714495436516839,5.367182337088262e-05,92.74550035264757,COMPLETE
1466,0.34210720658302307,2023-09-04 22:16:25.394832,2023-09-04 22:16:27.393928,0 days 00:00:01.999096,Leaky,Leaky,Leaky,,13,13,20.0,17.0,,0.010806135789864536,3,369,0.7718441279082786,0.0007204841909895082,98.43879318237305,COMPLETE
1467,0.3183995485305786,2023-09-04 22:16:27.394465,2023-09-04 22:16:28.833713,0 days 00:00:01.439248,Leaky,ReLU,Leaky,,11,12,19.0,19.0,,0.009576730401841607,3,372,0.7990349586302428,5.515337586652683e-05,91.82350623089334,COMPLETE
1468,0.3069884777069092,2023-09-04 22:16:28.834252,2023-09-04 22:16:30.991036,0 days 00:00:02.156784,Leaky,Sigmoid,Leaky,,11,13,19.0,18.0,,0.012120697560400092,3,364,0.7681484184539596,0.00039869231264915475,91.29000742295209,COMPLETE
1469,0.33320286870002747,2023-09-04 22:16:30.991559,2023-09-04 22:16:32.315414,0 days 00:00:01.323855,ReLU,Leaky,Leaky,,14,12,19.0,16.0,,0.008357927438702874,3,379,0.7486713422516545,1.2738297507564256e-05,98.35096468244281,COMPLETE
1470,0.3288908004760742,2023-09-04 22:16:32.315940,2023-09-04 22:16:34.309112,0 days 00:00:01.993172,Leaky,Leaky,Leaky,,13,12,19.0,19.0,,0.013722181173910284,3,365,0.7998459104440979,0.0003347083599714296,96.34044740258193,COMPLETE
1471,0.29515910148620605,2023-09-04 22:16:34.309608,2023-09-04 22:16:35.546187,0 days 00:00:01.236579,Leaky,Sigmoid,Leaky,,16,22,19.0,15.0,,0.01001784813975244,3,373,0.7522668318660709,0.0009758972942358052,101.28147838961694,COMPLETE
1472,0.3121628761291504,2023-09-04 22:16:35.546817,2023-09-04 22:16:36.410708,0 days 00:00:00.863891,Leaky,Leaky,Leaky,,15,12,20.0,17.0,,0.011717655042286147,3,386,0.7999652038559805,0.0005520202636390086,116.18409983317058,COMPLETE
1473,0.325237900018692,2023-09-04 22:16:36.411345,2023-09-04 22:16:37.480401,0 days 00:00:01.069056,ReLU,Leaky,Leaky,,15,12,20.0,18.0,,0.014177578326155042,3,361,0.7214791688014944,5.9878415467297364e-05,105.35943420410156,COMPLETE
1474,0.2503697872161865,2023-09-04 22:16:37.481039,2023-09-04 22:16:39.487343,0 days 00:00:02.006304,Leaky,ReLU,Leaky,,10,13,19.0,15.0,,0.007777389119745631,3,372,0.7653159742249921,0.000226774595633677,102.41969484271425,COMPLETE
1475,0.3529607057571411,2023-09-04 22:16:39.487821,2023-09-04 22:16:40.441816,0 days 00:00:00.953995,Leaky,ReLU,Leaky,,11,14,19.0,15.0,,0.008170744972810602,3,377,0.7706248736194025,0.00020175103642882915,108.45369815826416,COMPLETE
1476,0.35484254360198975,2023-09-04 22:16:40.442288,2023-09-04 22:16:41.753934,0 days 00:00:01.311646,Leaky,ReLU,Leaky,,13,14,19.0,15.0,,0.007044677745504195,3,367,0.7661923295171685,0.00024454372105491907,99.17882448084214,COMPLETE
1477,0.3754391074180603,2023-09-04 22:16:41.754407,2023-09-04 22:16:43.063791,0 days 00:00:01.309384,Leaky,ReLU,Leaky,,12,13,19.0,16.0,,0.008788573212437974,3,370,0.7738240502165671,0.00022443763490393438,90.19065299400917,COMPLETE
1478,0.34915727376937866,2023-09-04 22:16:43.064260,2023-09-04 22:16:44.850571,0 days 00:00:01.786311,Leaky,ReLU,Leaky,,10,13,19.0,17.0,,0.0074815741683632395,3,358,0.40579596550869756,0.0016117703241795153,108.90109825134277,COMPLETE
1479,0.31545841693878174,2023-09-04 22:16:44.851050,2023-09-04 22:16:46.247118,0 days 00:00:01.396068,Leaky,ReLU,Leaky,,11,13,20.0,16.0,,0.010549519812792924,3,364,0.7382206769033841,0.0002674617774862911,91.59577941894531,COMPLETE
1480,0.37248551845550537,2023-09-04 22:16:46.247635,2023-09-04 22:16:46.861615,0 days 00:00:00.613980,Leaky,ReLU,Leaky,,12,14,19.0,14.0,,0.009486636203975529,3,371,0.2940241614465378,0.0001950636783694267,146.27925138120298,COMPLETE
1481,0.30405157804489136,2023-09-04 22:16:46.862088,2023-09-04 22:16:48.828135,0 days 00:00:01.966047,Leaky,ReLU,Leaky,,13,14,19.0,16.0,,0.011596204479248607,3,355,0.7716999556940202,0.001755116218538152,94.44982463557545,COMPLETE
1482,0.33573657274246216,2023-09-04 22:16:48.828641,2023-09-04 22:16:50.466145,0 days 00:00:01.637504,Leaky,Leaky,Leaky,,12,14,20.0,15.0,,0.008037087389243773,3,376,0.7278376987365784,0.0014037075918257207,93.04439152308873,COMPLETE
1483,0.3725890815258026,2023-09-04 22:16:50.466608,2023-09-04 22:16:51.065058,0 days 00:00:00.598450,Sigmoid,ReLU,Leaky,,17,15,20.0,15.0,,0.006852099513729506,3,365,0.23986840469247067,0.00024649767668918557,113.13972455804998,COMPLETE
1484,0.3452501595020294,2023-09-04 22:16:51.065587,2023-09-04 22:16:53.009336,0 days 00:00:01.943749,Sigmoid,ReLU,Leaky,,11,13,19.0,16.0,,0.013350644691132065,3,358,0.5745664936821395,0.001172274192210303,110.77553939819336,COMPLETE
1485,0.34142398834228516,2023-09-04 22:16:53.009829,2023-09-04 22:16:54.585601,0 days 00:00:01.575772,Leaky,ReLU,Leaky,,11,14,19.0,17.0,,0.009836071368729597,3,379,0.799522821153379,0.00016985289588197918,98.99819239863643,COMPLETE
1486,0.3523099422454834,2023-09-04 22:16:54.586112,2023-09-04 22:16:55.384789,0 days 00:00:00.798677,Leaky,ReLU,Leaky,,15,13,19.0,18.0,,0.01692754739731864,3,372,0.31720944805224993,0.0003105004977391006,106.62792401994977,COMPLETE
1487,0.3500305712223053,2023-09-04 22:16:55.385294,2023-09-04 22:16:55.983316,0 days 00:00:00.598022,Leaky,ReLU,Leaky,,10,13,20.0,14.0,,0.011761576968816781,3,363,0.3318390369983938,0.00022228187930304927,127.496830368042,COMPLETE
1488,0.27179086208343506,2023-09-04 22:16:55.983811,2023-09-04 22:16:58.955139,0 days 00:00:02.971328,Leaky,ReLU,Leaky,,14,13,19.0,15.0,,0.009054768359166458,3,354,0.769476836154944,0.00016124051733110232,89.95130101372214,COMPLETE
1489,0.3753659725189209,2023-09-04 22:16:58.955660,2023-09-04 22:16:59.396788,0 days 00:00:00.441128,Leaky,ReLU,Leaky,,13,23,19.0,16.0,,0.01537648634115096,3,382,0.12475151168255819,0.00027546575848903294,153.766485426161,COMPLETE
1490,0.31026023626327515,2023-09-04 22:16:59.397450,2023-09-04 22:17:02.438449,0 days 00:00:03.040999,Leaky,ReLU,Leaky,,10,24,20.0,15.0,,0.007060841075030689,3,372,0.747186509126132,0.0001606527503440072,100.87097254339254,COMPLETE
1491,0.33565860986709595,2023-09-04 22:17:02.438966,2023-09-04 22:17:03.566639,0 days 00:00:01.127673,Leaky,ReLU,Leaky,,16,22,18.0,17.0,,0.0126039357428416,3,353,0.7199492872024534,0.0019141210742803288,109.88452606201172,COMPLETE
1492,0.34724244475364685,2023-09-04 22:17:03.567104,2023-09-04 22:17:04.475515,0 days 00:00:00.908411,Leaky,ReLU,Leaky,,10,13,19.0,14.0,,0.0180430541589454,3,366,0.4231852177868801,0.00021197359262392003,119.79463225144606,COMPLETE
1493,0.35072094202041626,2023-09-04 22:17:04.476023,2023-09-04 22:17:05.070239,0 days 00:00:00.594216,Leaky,ReLU,Leaky,,15,18,20.0,15.0,,0.010720878665427013,3,382,0.26062606342287226,0.00129023648781372,99.06509749953811,COMPLETE
1494,0.34179043769836426,2023-09-04 22:17:05.070723,2023-09-04 22:17:06.781766,0 days 00:00:01.711043,Leaky,ReLU,Leaky,,10,21,19.0,14.0,,0.009105965473772319,3,359,0.5419642982743642,0.00018419290424155507,100.40512294769287,COMPLETE
1495,0.3153645396232605,2023-09-04 22:17:06.782275,2023-09-04 22:17:07.687198,0 days 00:00:00.904923,Leaky,ReLU,Leaky,,15,13,20.0,15.0,,0.007673607930166821,3,348,0.37209537862297576,0.00028944179094459165,105.51960187080579,COMPLETE
1496,0.3651063144207001,2023-09-04 22:17:07.687751,2023-09-04 22:17:08.246571,0 days 00:00:00.558820,Leaky,ReLU,Leaky,,15,14,18.0,17.0,,0.015279514490507106,3,375,0.2003893545903692,0.00013438334271744372,335.793183297822,COMPLETE
1497,0.3462568521499634,2023-09-04 22:17:08.247064,2023-09-04 22:17:10.172404,0 days 00:00:01.925340,Leaky,ReLU,Leaky,,13,9,18.0,15.0,,0.013322511673574578,3,385,0.7725757922205959,0.0002438304739463029,172.45237132481165,COMPLETE
1498,0.3828280568122864,2023-09-04 22:17:10.172883,2023-09-04 22:17:10.545355,0 days 00:00:00.372472,Leaky,ReLU,Leaky,,16,19,19.0,14.0,,0.006345887834640157,3,363,0.215242462053624,0.012431905403781935,125.98951394217355,COMPLETE
1499,0.278941810131073,2023-09-04 22:17:10.545838,2023-09-04 22:17:12.205574,0 days 00:00:01.659736,Leaky,ReLU,Leaky,,16,23,20.0,16.0,,0.010418436331950881,3,347,0.7426744838575735,0.00019636599594462004,152.26677238650439,COMPLETE
1500,0.3711863160133362,2023-09-04 22:17:12.206051,2023-09-04 22:17:12.863933,0 days 00:00:00.657882,Leaky,ReLU,Leaky,,13,22,18.0,19.0,,0.018636377364841562,3,371,0.41480391050917137,0.0003092074543959285,103.5960904901678,COMPLETE
1501,0.36682072281837463,2023-09-04 22:17:12.864462,2023-09-04 22:17:13.221799,0 days 00:00:00.357337,Leaky,Leaky,Leaky,,17,12,19.0,16.0,,0.008482679322157157,3,358,0.1285965217299219,0.00013421073561665776,111.09257420131138,COMPLETE
1502,0.332112193107605,2023-09-04 22:17:13.222271,2023-09-04 22:17:13.761890,0 days 00:00:00.539619,Leaky,Tanh,Leaky,,14,15,18.0,18.0,,0.0056097592313846985,3,382,0.22810117159981938,0.0003525203344227906,117.6325922319966,COMPLETE
1503,0.42768123745918274,2023-09-04 22:17:13.762364,2023-09-04 22:17:14.409987,0 days 00:00:00.647623,Leaky,Leaky,Leaky,,17,21,20.0,15.0,,0.015556679497991069,3,368,0.7093466371475601,0.00016902593863093996,107.32612085342407,COMPLETE
