number,value,datetime_start,datetime_complete,duration,params_activation1,params_activation2,params_activation3,params_activation4,params_batch_size,params_fl1,params_fl2,params_fl3,params_fl4,params_learning_rate,params_n_layers,params_num_epochs,params_train_size,params_weight_decay,user_attrs_mre,state
485,0.4358130693435669,2023-09-04 21:18:23.716329,2023-09-04 21:18:24.034905,0 days 00:00:00.318576,Sigmoid,ReLU,,,77,16,10.0,,,0.09684971291234612,2,228,0.4629509677304688,0.0001879237349836785,244.67172303491708,COMPLETE
486,0.4504571557044983,2023-09-04 21:18:24.035224,2023-09-04 21:18:24.854542,0 days 00:00:00.819318,Tanh,Leaky,,,68,19,7.0,,,0.00041923192159067356,2,83,0.7410278116493243,9.844953346259683e-05,425.9113001076572,COMPLETE
487,0.40920278429985046,2023-09-04 21:18:24.854861,2023-09-04 21:18:25.696215,0 days 00:00:00.841354,Leaky,Tanh,,,19,17,11.0,,,0.024929497738089793,2,243,0.5500131419401403,0.009136951848630354,437.512890625,COMPLETE
488,0.31108996272087097,2023-09-04 21:18:25.696536,2023-09-04 21:18:26.392664,0 days 00:00:00.696128,ReLU,Tanh,,,62,14,10.0,,,0.003952603896390462,2,476,0.7738418542748777,0.0015440062479164579,120.11029706682477,COMPLETE
489,0.4420813322067261,2023-09-04 21:18:26.392978,2023-09-04 21:18:26.927530,0 days 00:00:00.534552,Tanh,Sigmoid,,,50,18,8.0,,,0.006987738757547226,2,268,0.7150799810250668,0.004831418354614593,169.86445582996714,COMPLETE
490,0.33023619651794434,2023-09-04 21:18:26.927875,2023-09-04 21:18:28.235817,0 days 00:00:01.307942,Tanh,Tanh,,,66,15,9.0,,,0.0012508644170808744,2,298,0.7423924845319174,3.0019032663186173e-05,183.6466799857921,COMPLETE
491,0.40767934918403625,2023-09-04 21:18:28.236134,2023-09-04 21:18:28.541749,0 days 00:00:00.305615,Leaky,Tanh,,,70,13,9.0,,,0.006106100353546859,2,109,0.6573419299178693,1.7407284743235973e-05,193.16395902633667,COMPLETE
492,0.5114501714706421,2023-09-04 21:18:28.542101,2023-09-04 21:18:28.658723,0 days 00:00:00.116622,Tanh,Sigmoid,,,81,19,8.0,,,0.04996931868313994,2,286,0.12895830241910858,0.00013770647484633727,189.79668370688833,COMPLETE
493,0.408031165599823,2023-09-04 21:18:28.659180,2023-09-04 21:18:28.816392,0 days 00:00:00.157212,Tanh,Tanh,,,74,18,12.0,,,0.014180086308236277,2,439,0.1906399522731514,0.00011953549568052539,1149.531598578559,COMPLETE
494,0.4754689633846283,2023-09-04 21:18:28.816735,2023-09-04 21:18:33.444676,0 days 00:00:04.627941,Sigmoid,ReLU,,,72,17,10.0,,,0.00047668183723825064,2,260,0.7977170593820517,0.00023968836391379894,169.66866490290715,COMPLETE
495,0.37653881311416626,2023-09-04 21:18:33.444993,2023-09-04 21:18:34.217741,0 days 00:00:00.772748,Tanh,Leaky,,,32,20,11.0,,,0.03155578777469065,2,464,0.34566910023083885,0.0003344677418476274,190.98140449523925,COMPLETE
496,0.5701547861099243,2023-09-04 21:18:34.218317,2023-09-04 21:18:36.305020,0 days 00:00:02.086703,Leaky,Tanh,,,76,18,11.0,,,5.6171326816062814e-05,2,407,0.11807258941820191,0.009920970919224344,129.08785114710102,COMPLETE
497,0.34847477078437805,2023-09-04 21:18:36.305585,2023-09-04 21:18:37.160756,0 days 00:00:00.855171,Tanh,Sigmoid,,,69,21,4.0,,,0.044894186439310875,2,74,0.4758393137339286,3.904159489381542e-05,160.60369977084073,COMPLETE
498,0.33023595809936523,2023-09-04 21:18:37.161320,2023-09-04 21:18:38.511353,0 days 00:00:01.350033,Tanh,Tanh,,,84,16,9.0,,,0.010271817810613652,2,238,0.5961914497145784,8.583972191851893e-05,135.353125,COMPLETE
499,0.35041239857673645,2023-09-04 21:18:38.511933,2023-09-04 21:18:41.275872,0 days 00:00:02.763939,Leaky,Tanh,,,58,19,8.0,,,0.018545510663614907,2,452,0.6854576568331708,0.0057328138055267675,152.76335079795436,COMPLETE
500,0.3550078570842743,2023-09-04 21:18:41.276446,2023-09-04 21:18:42.370192,0 days 00:00:01.093746,Tanh,Tanh,,,90,17,10.0,,,0.027404526594875526,2,277,0.7734734739288847,0.00019394440758884198,190.60021100725447,COMPLETE
501,0.3638295531272888,2023-09-04 21:18:42.370758,2023-09-04 21:18:43.019832,0 days 00:00:00.649074,Tanh,Sigmoid,,,79,18,7.0,,,0.03457616595404155,2,93,0.2812086977579402,1.2082336210500076e-05,170.7072843585098,COMPLETE
502,0.28961339592933655,2023-09-04 21:18:43.020411,2023-09-04 21:18:44.196136,0 days 00:00:01.175725,Tanh,Tanh,,,75,18,9.0,,,0.08046084579456793,2,251,0.7136851451202358,0.0001597866014647748,191.57831053300336,COMPLETE
503,0.5828746557235718,2023-09-04 21:18:44.196709,2023-09-04 21:18:50.539163,0 days 00:00:06.342454,Sigmoid,ReLU,,,71,19,13.0,,,0.00031202031627111627,2,189,0.7999802517787554,0.007589609434442878,454.4213159954737,COMPLETE
504,0.35570695996284485,2023-09-04 21:18:50.539735,2023-09-04 21:18:51.128652,0 days 00:00:00.588917,Leaky,Leaky,,,66,17,12.0,,,0.022325241999755482,2,86,0.22284419028817182,0.00010574405821510854,170.29562488902698,COMPLETE
505,0.26135730743408203,2023-09-04 21:18:51.129216,2023-09-04 21:18:52.236916,0 days 00:00:01.107700,Tanh,Tanh,,,82,18,8.0,,,0.05907385749685519,2,487,0.7457164042958283,0.0017736005854184919,176.62842777797155,COMPLETE
506,0.4283277094364166,2023-09-04 21:18:52.237498,2023-09-04 21:18:53.026875,0 days 00:00:00.789377,Tanh,Sigmoid,,,82,16,8.0,,,0.0615408677700956,2,493,0.7481974336060211,0.0025761929696579535,151.12595656822467,COMPLETE
507,0.3664677143096924,2023-09-04 21:18:53.027457,2023-09-04 21:18:54.184403,0 days 00:00:01.156946,Tanh,Tanh,,,83,19,8.0,,,0.05924699929357128,2,475,0.7503678336945947,0.003108561490869839,193.27235308560458,COMPLETE
508,0.3823104500770569,2023-09-04 21:18:54.184974,2023-09-04 21:18:54.964513,0 days 00:00:00.779539,Leaky,Tanh,,,81,18,7.0,,,0.043441395123424126,2,487,0.36940339131877065,0.001317586989416723,462.6991476331438,COMPLETE
509,0.5077255368232727,2023-09-04 21:18:54.965083,2023-09-04 21:18:55.273642,0 days 00:00:00.308559,Tanh,Tanh,,,87,20,6.0,,,0.07227301032063037,2,499,0.4415814718692621,5.397070131095357e-05,253.08011881510416,COMPLETE
510,0.3899422287940979,2023-09-04 21:18:55.274213,2023-09-04 21:19:05.290754,0 days 00:00:10.016541,Tanh,Sigmoid,Leaky,,86,17,8.0,12.0,,0.00019999758533852444,3,491,0.5368036238269808,0.0015832648341819252,228.7969917872287,COMPLETE
511,0.33126503229141235,2023-09-04 21:19:05.291352,2023-09-04 21:19:05.987793,0 days 00:00:00.696441,Leaky,Tanh,,,83,18,7.0,,,0.05336165260060026,2,484,0.769365262417588,0.0021423621572972977,200.40639623006186,COMPLETE
512,0.41475340723991394,2023-09-04 21:19:05.988365,2023-09-04 21:19:08.267323,0 days 00:00:02.278958,Tanh,ReLU,,,79,17,11.0,,,0.0021767752208335643,2,473,0.7244188183941968,0.00012031805808991089,167.90806361607142,COMPLETE
513,0.40068304538726807,2023-09-04 21:19:08.267899,2023-09-04 21:19:09.283385,0 days 00:00:01.015486,Sigmoid,Tanh,,,80,19,8.0,,,0.0338297987111461,2,489,0.7994522536900712,0.0018815164051879285,289.3457763671875,COMPLETE
514,0.3614867925643921,2023-09-04 21:19:09.283991,2023-09-04 21:19:11.529118,0 days 00:00:02.245127,ReLU,Sigmoid,,,52,18,11.0,,,0.008850831317002861,2,486,0.4161195824407227,0.0010630967890394687,193.7164482184216,COMPLETE
515,0.3283231258392334,2023-09-04 21:19:11.529690,2023-09-04 21:19:12.701310,0 days 00:00:01.171620,Tanh,Leaky,,,78,17,12.0,,,0.0404263342297,2,480,0.7454637097210528,7.674349472342627e-05,139.07844827341478,COMPLETE
516,0.6525399684906006,2023-09-04 21:19:12.701879,2023-09-04 21:19:24.210513,0 days 00:00:11.508634,Tanh,Tanh,,,85,19,5.0,,,1.4588217398317091e-05,2,466,0.7679296699221305,9.288729508675072e-05,197.6153279415016,COMPLETE
517,0.37486687302589417,2023-09-04 21:19:24.211101,2023-09-04 21:19:24.832617,0 days 00:00:00.621516,Leaky,Tanh,,,81,20,15.0,,,0.06828083085856805,2,494,0.6963427371142539,0.0018224908821463516,179.08295938243037,COMPLETE
518,0.3543630540370941,2023-09-04 21:19:24.833182,2023-09-04 21:19:26.099307,0 days 00:00:01.266125,Tanh,Sigmoid,,,67,12,10.0,,,0.012554615855649064,2,102,0.5083600769086577,6.996554007413912e-05,309.9699984691182,COMPLETE
519,0.43259626626968384,2023-09-04 21:19:26.099906,2023-09-04 21:19:34.236406,0 days 00:00:08.136500,Tanh,Tanh,,,64,15,8.0,,,0.00023902568091601254,2,289,0.7284071856021017,0.003246821505519149,205.21241570179026,COMPLETE
520,0.3773907423019409,2023-09-04 21:19:34.236981,2023-09-04 21:19:34.822935,0 days 00:00:00.585954,Leaky,Tanh,,,83,16,14.0,,,0.015284109485410834,2,304,0.2701122305878748,0.001733063468088456,173.13874846813727,COMPLETE
521,0.3834148645401001,2023-09-04 21:19:34.823521,2023-09-04 21:19:35.490154,0 days 00:00:00.666633,Tanh,Sigmoid,,,69,18,9.0,,,0.028239426520262692,2,499,0.29019246178021746,0.00013301813317822877,179.7867218017578,COMPLETE
522,0.41851842403411865,2023-09-04 21:19:35.490741,2023-09-04 21:19:36.449454,0 days 00:00:00.958713,Tanh,ReLU,,,77,17,10.0,,,0.001601351802219486,2,117,0.19912723295176227,0.0022646471038434996,1121.3597905085637,COMPLETE
523,0.5075128674507141,2023-09-04 21:19:36.450042,2023-09-04 21:19:36.795096,0 days 00:00:00.345054,Sigmoid,Tanh,,,60,18,7.0,,,0.0798683855989676,2,76,0.14237240089352826,0.002682807419911009,915.150919060958,COMPLETE
524,0.3360857367515564,2023-09-04 21:19:36.795666,2023-09-04 21:19:38.019523,0 days 00:00:01.223857,Tanh,Leaky,,,56,19,13.0,,,0.0076839389470438136,2,64,0.43504588967238955,0.00425010767458563,324.6717806956807,COMPLETE
525,0.46355554461479187,2023-09-04 21:19:38.020104,2023-09-04 21:19:39.277286,0 days 00:00:01.257182,Leaky,Tanh,,,47,18,1.0,,,0.053121271897640494,2,477,0.7673855659148495,0.0034139270563619756,2246.8968048095703,COMPLETE
526,0.3097975552082062,2023-09-04 21:19:39.277869,2023-09-04 21:19:44.259181,0 days 00:00:04.981312,Tanh,Tanh,,,13,17,9.0,,,0.005006221398195555,2,466,0.6721669437846437,0.0001586962167103907,1384.6892312856821,COMPLETE
527,0.4075773060321808,2023-09-04 21:19:44.259766,2023-09-04 21:19:45.989043,0 days 00:00:01.729277,Tanh,Sigmoid,,,80,19,11.0,,,0.004183649778184833,2,280,0.23189609373391543,1.4167788971933343e-05,1813.1908572548314,COMPLETE
528,0.39003807306289673,2023-09-04 21:19:45.989621,2023-09-04 21:19:46.346429,0 days 00:00:00.356808,Leaky,Tanh,,,67,11,8.0,,,0.038141356411976766,2,270,0.25983394504957325,0.00010853468999833679,181.64057276799127,COMPLETE
529,0.3277057409286499,2023-09-04 21:19:46.347009,2023-09-04 21:19:47.403205,0 days 00:00:01.056196,Tanh,Tanh,,,84,16,9.0,,,0.018136005122750053,2,158,0.358460365232547,0.0009365269370490926,285.5323743216599,COMPLETE
530,0.2678883671760559,2023-09-04 21:19:47.403795,2023-09-04 21:19:48.599061,0 days 00:00:01.195266,Tanh,Sigmoid,,,71,18,10.0,,,0.025908591619455464,2,85,0.7171502903206217,2.4647028868846027e-05,212.60003200797146,COMPLETE
531,0.540649950504303,2023-09-04 21:19:48.599643,2023-09-04 21:19:49.012969,0 days 00:00:00.413326,Tanh,Sigmoid,,,74,18,10.0,,,0.010397374745148314,2,70,0.18674378521126217,0.00047289170392120585,249.69201816212046,COMPLETE
532,0.29473876953125,2023-09-04 21:19:49.013544,2023-09-04 21:19:50.265764,0 days 00:00:01.252220,Tanh,Sigmoid,,,71,19,12.0,,,0.023494067543315855,2,87,0.6345751804751529,2.469907905914348e-05,148.84758804321288,COMPLETE
533,0.5550356507301331,2023-09-04 21:19:50.266352,2023-09-04 21:19:52.777237,0 days 00:00:02.510885,Tanh,Sigmoid,,,73,18,11.0,,,0.0006300675500872105,2,95,0.7061687042661259,1.4260583067389713e-05,210.00169035259046,COMPLETE
534,0.5343248844146729,2023-09-04 21:19:52.777819,2023-09-04 21:19:53.748162,0 days 00:00:00.970343,Tanh,Sigmoid,,,76,18,11.0,,,0.001035601077956619,2,80,0.30467816210242854,2.3120547472803995e-05,379.06973180770876,COMPLETE
535,0.6399219036102295,2023-09-04 21:19:53.748746,2023-09-04 21:19:55.115047,0 days 00:00:01.366301,Tanh,Sigmoid,,,78,19,10.0,,,0.00033873711096077955,2,56,0.6674431101788002,4.5379531643067854e-05,192.84468269348145,COMPLETE
536,0.282352089881897,2023-09-04 21:19:55.115630,2023-09-04 21:19:56.348077,0 days 00:00:01.232447,Tanh,Sigmoid,,,70,18,10.0,,,0.04785792321926047,2,85,0.7271338224853575,3.0327221382434543e-05,235.58937427609465,COMPLETE
537,0.5350649952888489,2023-09-04 21:19:56.348658,2023-09-04 21:19:58.977441,0 days 00:00:02.628783,Tanh,Sigmoid,,,75,17,6.0,,,0.00014757939950154228,2,107,0.6872129451874218,2.914542843960565e-05,167.52207896865417,COMPLETE
538,0.4047861695289612,2023-09-04 21:19:58.978015,2023-09-04 21:20:00.720923,0 days 00:00:01.742908,Tanh,,,,72,19,,,,0.0028262006288340153,1,98,0.5634767424579818,4.9493309919491765e-05,143.14524086154236,COMPLETE
539,1.0534374713897705,2023-09-04 21:20:00.721488,2023-09-04 21:20:02.547571,0 days 00:00:01.826083,Tanh,Sigmoid,,,81,18,12.0,,,1.0396705122149344e-05,2,72,0.7115986569518267,2.594374936944529e-05,198.72341431511774,COMPLETE
540,0.43478691577911377,2023-09-04 21:20:02.548152,2023-09-04 21:20:03.276762,0 days 00:00:00.728610,Tanh,Sigmoid,,,40,18,11.0,,,0.0161819811997818,2,90,0.25018559327749346,3.588125056025641e-05,166.1576944986979,COMPLETE
541,0.33259230852127075,2023-09-04 21:20:03.277336,2023-09-04 21:20:04.359083,0 days 00:00:01.081747,Sigmoid,ReLU,,,73,20,11.0,,,0.030409316174204733,2,84,0.3131855032086433,1.8405308852209183e-05,200.5791069212414,COMPLETE
542,0.5550575256347656,2023-09-04 21:20:04.359679,2023-09-04 21:20:05.104700,0 days 00:00:00.745021,Tanh,Sigmoid,,,78,17,10.0,,,0.0005500418589378707,2,126,0.13824878518728462,5.595976558063885e-05,135.0880889892578,COMPLETE
543,0.6505629420280457,2023-09-04 21:20:05.105281,2023-09-04 21:20:10.633181,0 days 00:00:05.527900,Tanh,Leaky,,,70,18,7.0,,,2.5046582501530863e-05,2,295,0.49300730624838196,1.0005209652564511e-05,149.21478408554853,COMPLETE
544,0.38203728199005127,2023-09-04 21:20:10.633802,2023-09-04 21:20:11.967180,0 days 00:00:01.333378,Tanh,Sigmoid,,,82,19,10.0,,,0.012539053427435465,2,63,0.611242426688244,0.0007179433690929935,141.9799129486084,COMPLETE
545,0.3238712251186371,2023-09-04 21:20:11.967770,2023-09-04 21:20:13.113819,0 days 00:00:01.146049,ReLU,Sigmoid,,,54,19,9.0,,,0.02554667386955563,2,102,0.7421266232188128,2.251460725362834e-05,164.3760759758227,COMPLETE
546,0.27656668424606323,2023-09-04 21:20:13.114403,2023-09-04 21:20:14.470203,0 days 00:00:01.355800,Tanh,ReLU,,,88,17,10.0,,,0.08916207567829139,2,500,0.7622412538081376,2.0528816738742885e-05,342.74506191037733,COMPLETE
547,0.36185020208358765,2023-09-04 21:20:14.470787,2023-09-04 21:20:16.562843,0 days 00:00:02.092056,Tanh,Leaky,,,76,3,12.0,,,0.02107734101933572,2,281,0.6463380273573579,4.6551395552472275e-05,209.77959798177082,COMPLETE
548,0.29846054315567017,2023-09-04 21:20:16.563435,2023-09-04 21:20:17.790424,0 days 00:00:01.226989,Tanh,Sigmoid,,,58,18,8.0,,,0.03585607087372406,2,221,0.6873985967585577,0.00028227839655212085,219.0693702697754,COMPLETE
549,0.31037160754203796,2023-09-04 21:20:17.791014,2023-09-04 21:20:19.396678,0 days 00:00:01.605664,Sigmoid,Sigmoid,,,72,20,9.0,,,0.06109395874509024,2,76,0.732859533284741,0.0001809799259252756,174.35552121881852,COMPLETE
550,0.5424997210502625,2023-09-04 21:20:19.397258,2023-09-04 21:20:24.381780,0 days 00:00:04.984522,Tanh,Tanh,,,85,18,11.0,,,8.444613765573657e-05,2,356,0.4157232127897637,1.113594980651489e-05,199.28163241268544,COMPLETE
551,0.2997615337371826,2023-09-04 21:20:24.382388,2023-09-04 21:20:25.483618,0 days 00:00:01.101230,Tanh,ReLU,,,80,17,9.0,,,0.045364139112681195,2,201,0.7997867573790298,0.0006748982773440858,306.1124645032381,COMPLETE
552,0.3086765706539154,2023-09-04 21:20:25.484207,2023-09-04 21:20:26.350179,0 days 00:00:00.865972,Tanh,Tanh,,,69,19,13.0,,,0.018525386341583086,2,111,0.3551475812324086,3.3825550221698534e-05,120.30567564283099,COMPLETE
553,0.38076725602149963,2023-09-04 21:20:26.350757,2023-09-04 21:20:27.064946,0 days 00:00:00.714189,Tanh,Sigmoid,,,74,9,8.0,,,0.01481221084047145,2,272,0.16149646907357057,0.00014001048794308417,169.29301893944833,COMPLETE
554,0.3808424174785614,2023-09-04 21:20:27.065530,2023-09-04 21:20:31.571088,0 days 00:00:04.505558,Tanh,Tanh,,,71,18,7.0,,,0.0009403957690132913,2,322,0.7130634898536592,0.0002290307020281526,121.62930210157373,COMPLETE
555,0.4394022226333618,2023-09-04 21:20:31.571669,2023-09-04 21:20:34.287249,0 days 00:00:02.715580,Tanh,Leaky,,,62,21,10.0,,,0.00037112601231299144,2,288,0.20951542349478483,1.4333074728658743e-05,488.10340028338965,COMPLETE
556,0.4096708297729492,2023-09-04 21:20:34.287842,2023-09-04 21:20:35.777279,0 days 00:00:01.489437,Sigmoid,Tanh,Tanh,Leaky,77,17,12.0,18.0,1.0,0.028488118009817924,4,94,0.7699712682869183,6.337713192262484e-05,258.45359684870795,COMPLETE
557,0.3415489196777344,2023-09-04 21:20:35.777896,2023-09-04 21:20:45.495019,0 days 00:00:09.717123,Tanh,Sigmoid,,,74,19,10.0,,,0.0008566963744361845,2,484,0.6660433467710177,3.087690009658539e-05,188.6738385338072,COMPLETE
558,0.3366429805755615,2023-09-04 21:20:45.495617,2023-09-04 21:20:46.493494,0 days 00:00:00.997877,Tanh,Tanh,,,83,18,11.0,,,0.03426292553643351,2,309,0.7423385257628413,0.0014657952107279574,194.5063394082559,COMPLETE
559,0.4509827494621277,2023-09-04 21:20:46.494073,2023-09-04 21:20:48.248018,0 days 00:00:01.753945,Tanh,Tanh,,,68,17,9.0,,,0.0020297454435689553,2,344,0.32520465329311715,3.928104684546779e-05,197.9076567205764,COMPLETE
560,0.3750876188278198,2023-09-04 21:20:48.248609,2023-09-04 21:20:48.978488,0 days 00:00:00.729879,Tanh,ReLU,,,71,18,8.0,,,0.07160385974315878,2,300,0.7020148629356452,0.00014133369311218787,191.09884704589842,COMPLETE
561,0.3702343702316284,2023-09-04 21:20:48.979070,2023-09-04 21:20:50.540886,0 days 00:00:01.561816,Tanh,Sigmoid,,,65,19,10.0,,,0.009391970631514864,2,81,0.7692206679154514,1.2884577237366325e-05,191.76807067871093,COMPLETE
562,0.5828033685684204,2023-09-04 21:20:50.541478,2023-09-04 21:20:57.287426,0 days 00:00:06.745948,Tanh,Tanh,,,79,17,11.0,,,3.3514182400028734e-05,2,265,0.7340269202240066,1.6521192876505444e-05,252.50696200964586,COMPLETE
563,0.38919225335121155,2023-09-04 21:20:57.288023,2023-09-04 21:20:58.997655,0 days 00:00:01.709632,Sigmoid,Leaky,,,76,18,8.0,,,0.005505680825474068,2,119,0.6438956144504815,0.0005931557383061028,164.92841593424478,COMPLETE
564,0.30089595913887024,2023-09-04 21:20:58.998250,2023-09-04 21:21:00.574979,0 days 00:00:01.576729,Tanh,Tanh,,,69,19,9.0,,,0.023440188545392336,2,64,0.7671489819440336,0.001127306244065483,209.1439942580003,COMPLETE
565,0.28057360649108887,2023-09-04 21:21:00.575571,2023-09-04 21:21:01.535433,0 days 00:00:00.959862,ReLU,Sigmoid,,,86,20,12.0,,,0.0545184416951303,2,94,0.6825090954153445,0.0001807954429334586,408.94039721366687,COMPLETE
566,0.2857445776462555,2023-09-04 21:21:01.536021,2023-09-04 21:21:04.311805,0 days 00:00:02.775784,Tanh,Tanh,,,73,18,7.0,,,0.0027103458470912633,2,280,0.7127419615369817,3.9063430070934996e-05,132.28751765659877,COMPLETE
567,0.29332852363586426,2023-09-04 21:21:04.312392,2023-09-04 21:21:05.384850,0 days 00:00:01.072458,Tanh,Tanh,Leaky,,80,18,11.0,24.0,,0.04097269837675405,3,73,0.7979039514229495,0.00037581827528432955,882.4579694194179,COMPLETE
568,0.48565205931663513,2023-09-04 21:21:05.385460,2023-09-04 21:21:05.705014,0 days 00:00:00.319554,Tanh,Tanh,,,82,17,14.0,,,0.019937295061119575,2,209,0.11169638780768719,2.036028907258279e-05,163.13589477539062,COMPLETE
569,0.2954840064048767,2023-09-04 21:21:05.705608,2023-09-04 21:21:07.529240,0 days 00:00:01.823632,Tanh,Sigmoid,,,49,19,10.0,,,0.09696423221752852,2,419,0.7465755252307257,8.626021869204718e-05,196.9273750149474,COMPLETE
570,0.3305247128009796,2023-09-04 21:21:07.529840,2023-09-04 21:21:09.654858,0 days 00:00:02.125018,Sigmoid,ReLU,,,75,18,13.0,,,0.012003435519052228,2,491,0.7724978200486158,0.00011746902303932085,130.2419140625,COMPLETE
571,0.3227640688419342,2023-09-04 21:21:09.655488,2023-09-04 21:21:11.542949,0 days 00:00:01.887461,Tanh,Tanh,,,78,8,9.0,,,0.003834030278499443,2,292,0.694253330252853,0.0001604213179125586,395.40241643002156,COMPLETE
572,0.30860528349876404,2023-09-04 21:21:11.543549,2023-09-04 21:21:12.662131,0 days 00:00:01.118582,Tanh,Leaky,,,72,17,8.0,,,0.027409692493117265,2,261,0.5741978077454539,0.00020925393578024264,120.57059759023238,COMPLETE
573,0.3498421907424927,2023-09-04 21:21:12.662759,2023-09-04 21:21:14.028282,0 days 00:00:01.365523,Tanh,Sigmoid,,,70,18,10.0,,,0.016137004602763416,2,376,0.6236458276570458,9.863491223784134e-05,222.84478288130327,COMPLETE
574,0.5493765473365784,2023-09-04 21:21:14.028881,2023-09-04 21:21:14.928392,0 days 00:00:00.899511,Tanh,Tanh,,,63,20,11.0,,,0.0002458398839999678,2,51,0.3870887808953411,6.922360103592381e-05,140.15090508554496,COMPLETE
575,0.3073383867740631,2023-09-04 21:21:14.928983,2023-09-04 21:21:15.470853,0 days 00:00:00.541870,Leaky,Tanh,,,68,19,9.0,,,0.03477368608825377,2,399,0.45711133956990596,2.660086134037367e-05,124.5487794142503,COMPLETE
576,0.4098653495311737,2023-09-04 21:21:15.471452,2023-09-04 21:21:16.343117,0 days 00:00:00.871665,Tanh,Sigmoid,,,66,18,7.0,,,0.00814312417628612,2,85,0.2179156494351347,0.00025998275428229235,289.4309511970071,COMPLETE
577,0.32007381319999695,2023-09-04 21:21:16.343706,2023-09-04 21:21:18.179169,0 days 00:00:01.835463,Tanh,Tanh,,,92,17,8.0,,,0.006164348955059973,2,274,0.5246949824224906,1.681476948246877e-05,123.24298426790058,COMPLETE
578,0.728692889213562,2023-09-04 21:21:18.179778,2023-09-04 21:21:19.152784,0 days 00:00:00.973006,Sigmoid,Tanh,,,75,17,9.0,,,0.00019985251269794688,2,102,0.23866496434453288,0.0001320770147073146,260.91781900443283,COMPLETE
579,0.3662288784980774,2023-09-04 21:21:19.153384,2023-09-04 21:21:21.007520,0 days 00:00:01.854136,Tanh,Sigmoid,,,57,19,11.0,,,0.022742603083201397,2,270,0.7250982660094555,0.0001682930993835241,365.6107714422818,COMPLETE
580,0.33319664001464844,2023-09-04 21:21:21.008130,2023-09-04 21:21:22.158584,0 days 00:00:01.150454,Leaky,ReLU,,,60,16,12.0,,,0.04310664077100505,2,484,0.6608346310812587,8.124593865190341e-05,155.99869136810304,COMPLETE
581,0.4813198447227478,2023-09-04 21:21:22.159191,2023-09-04 21:21:22.431492,0 days 00:00:00.272301,Tanh,Tanh,,,100,18,10.0,,,0.030441704487765904,2,285,0.20850145883410784,0.00044671136939547886,247.77600977971002,COMPLETE
