number,value,datetime_start,datetime_complete,duration,params_activation1,params_activation2,params_activation3,params_activation4,params_batch_size,params_fl1,params_fl2,params_fl3,params_fl4,params_learning_rate,params_n_layers,params_num_epochs,params_train_size,params_weight_decay,user_attrs_mre,state
1872,0.4283510148525238,2023-09-04 22:51:41.568116,2023-09-04 22:51:41.879464,0 days 00:00:00.311348,ReLU,Leaky,Sigmoid,Leaky,84,21,21.0,24.0,14.0,0.012209370402920305,4,255,0.1626082144557494,0.00012543906458908988,132.70591272092332,COMPLETE
1873,0.3425927460193634,2023-09-04 22:51:41.880007,2023-09-04 22:51:43.825266,0 days 00:00:01.945259,Tanh,Leaky,Sigmoid,Sigmoid,78,9,19.0,22.0,2.0,0.008333553974770232,4,319,0.7455017624281103,0.00046332926777682156,130.5159387588501,COMPLETE
1874,1.0156686305999756,2023-09-04 22:51:43.825801,2023-09-04 22:51:44.075245,0 days 00:00:00.249444,Leaky,Sigmoid,Sigmoid,Tanh,33,18,20.0,7.0,9.0,0.015245322430941267,4,227,0.2321474787205378,0.009323975520534353,103.73903528849284,COMPLETE
1875,0.3453224301338196,2023-09-04 22:51:44.075799,2023-09-04 22:51:45.876415,0 days 00:00:01.800616,Tanh,Leaky,ReLU,Leaky,82,19,19.0,23.0,19.0,0.0006287457602911357,4,281,0.7186005534736057,0.0009560303846429907,111.21843567939653,COMPLETE
1876,1.0233533382415771,2023-09-04 22:51:45.876948,2023-09-04 22:51:46.124589,0 days 00:00:00.247641,Sigmoid,ReLU,Sigmoid,Sigmoid,87,13,20.0,16.0,4.0,0.02016260121894264,4,310,0.2701366353674352,0.004411568364655408,104.41774568103608,COMPLETE
1877,0.3729192018508911,2023-09-04 22:51:46.125112,2023-09-04 22:51:46.719852,0 days 00:00:00.594740,Tanh,Leaky,Sigmoid,Leaky,89,20,19.0,21.0,18.0,0.03410714639329301,4,211,0.6419680714793996,0.006315150308506846,147.74972777671002,COMPLETE
1878,0.27201956510543823,2023-09-04 22:51:46.720374,2023-09-04 22:51:47.631846,0 days 00:00:00.911472,ReLU,Leaky,Sigmoid,Leaky,85,17,16.0,12.0,9.0,0.003557254599123038,4,262,0.7750619236971579,0.00019935894013616774,84.88673313328478,COMPLETE
1879,0.3852434754371643,2023-09-04 22:51:47.632398,2023-09-04 22:51:51.044887,0 days 00:00:03.412489,Tanh,Leaky,Sigmoid,Sigmoid,92,18,21.0,17.0,8.0,0.0004513280533285517,4,245,0.6911530468281563,0.0001031184035710699,204.07821794835533,COMPLETE
1880,0.437656968832016,2023-09-04 22:51:51.046007,2023-09-04 22:51:51.657488,0 days 00:00:00.611481,Leaky,Leaky,ReLU,ReLU,80,20,20.0,14.0,16.0,0.0013063092945621451,4,233,0.4240324915356872,0.002305015083837137,140.0094861676616,COMPLETE
1881,0.3927399814128876,2023-09-04 22:51:51.658040,2023-09-04 22:51:52.077700,0 days 00:00:00.419660,Sigmoid,Leaky,Sigmoid,Leaky,83,22,18.0,23.0,17.0,0.08162777509684163,4,327,0.3998190182785427,6.930331721204263e-05,151.5641624255058,COMPLETE
1882,0.2956191897392273,2023-09-04 22:51:52.078237,2023-09-04 22:51:52.956731,0 days 00:00:00.878494,Tanh,Leaky,Sigmoid,Leaky,41,11,21.0,15.0,7.0,0.014026073614046394,4,293,0.47087030248975364,1.0061634419078399e-05,130.7372853597005,COMPLETE
1883,0.5199494361877441,2023-09-04 22:51:52.957277,2023-09-04 22:51:53.286606,0 days 00:00:00.329329,ReLU,Leaky,Leaky,Sigmoid,86,16,22.0,24.0,21.0,0.009738343434302209,4,219,0.11803103982444432,1.3299852362527213e-05,161.6442424229213,COMPLETE
1884,1.0874342918395996,2023-09-04 22:51:53.287212,2023-09-04 22:51:54.133560,0 days 00:00:00.846348,Tanh,Leaky,Sigmoid,Leaky,29,19,20.0,22.0,5.0,0.026713766706983822,4,168,0.5594199453454676,0.04203968257776951,100.67077382405598,COMPLETE
1885,0.8063275814056396,2023-09-04 22:51:54.134125,2023-09-04 22:51:58.493737,0 days 00:00:04.359612,Sigmoid,Leaky,ReLU,Sigmoid,25,18,19.0,23.0,3.0,0.0008620186738357643,4,272,0.27946709720611196,0.000149609816180117,814.1172532038902,COMPLETE
1886,0.42857328057289124,2023-09-04 22:51:58.494791,2023-09-04 22:52:00.614057,0 days 00:00:02.119266,Leaky,Leaky,Sigmoid,Leaky,32,21,21.0,24.0,6.0,0.017674136053737695,4,183,0.7483927942718428,8.27989940432175e-05,138.85121712317834,COMPLETE
1887,0.40401631593704224,2023-09-04 22:52:00.615119,2023-09-04 22:52:08.566506,0 days 00:00:07.951387,Tanh,Leaky,Sigmoid,Leaky,82,18,20.0,16.0,4.0,0.0003176779949658484,4,256,0.7173451691482433,4.969107677467312e-05,152.75742637504965,COMPLETE
1888,0.41699495911598206,2023-09-04 22:52:08.567568,2023-09-04 22:52:10.967668,0 days 00:00:02.400100,Tanh,,,,88,17,,,,0.004521938374271553,1,241,0.7783956393103527,0.00022558479188617954,150.06747648031404,COMPLETE
1889,0.2754502296447754,2023-09-04 22:52:10.968697,2023-09-04 22:52:13.532303,0 days 00:00:02.563606,ReLU,Leaky,Sigmoid,Sigmoid,55,20,20.0,18.0,20.0,0.011551509956834833,4,306,0.7988210481822335,0.00083932241479134,166.1176366603121,COMPLETE
1890,0.4069674015045166,2023-09-04 22:52:13.533373,2023-09-04 22:52:14.584842,0 days 00:00:01.051469,Sigmoid,ReLU,Tanh,Leaky,35,19,17.0,14.0,13.0,0.022285655032151817,4,249,0.4146886850889002,0.00011491482792800082,129.7629852294922,COMPLETE
1891,0.43488091230392456,2023-09-04 22:52:14.585905,2023-09-04 22:52:16.075995,0 days 00:00:01.490090,Tanh,Leaky,ReLU,Sigmoid,74,17,21.0,23.0,6.0,0.0022266111849857727,4,228,0.3298729627711927,2.9055747715401458e-05,199.53074269899182,COMPLETE
1892,0.483617901802063,2023-09-04 22:52:16.077070,2023-09-04 22:52:22.476311,0 days 00:00:06.399241,Leaky,Leaky,Sigmoid,Leaky,85,21,18.0,24.0,17.0,7.081337483830829e-05,4,263,0.5114957491944705,0.00026021187607084287,132.0339826866701,COMPLETE
1893,0.46621009707450867,2023-09-04 22:52:22.477394,2023-09-04 22:52:23.642009,0 days 00:00:01.164615,Tanh,Leaky,Sigmoid,Leaky,79,19,22.0,15.0,1.0,0.0057922513660723434,4,237,0.1418444945222929,0.00018330408840901027,100.6559207030017,COMPLETE
1894,1.0677558183670044,2023-09-04 22:52:23.643140,2023-09-04 22:52:26.003190,0 days 00:00:02.360050,Sigmoid,Leaky,Sigmoid,ReLU,90,10,19.0,22.0,18.0,2.4010780965592013e-05,4,281,0.5255139306794001,0.08866745425281256,125.04493530936863,COMPLETE
1895,0.43332383036613464,2023-09-04 22:52:26.004273,2023-09-04 22:52:27.196387,0 days 00:00:01.192114,ReLU,Leaky,Sigmoid,Sigmoid,83,18,20.0,23.0,5.0,0.01536371036419104,4,221,0.2555542465952316,0.004030934178029087,177.02048905690512,COMPLETE
1896,0.29252102971076965,2023-09-04 22:52:27.197546,2023-09-04 22:52:27.896288,0 days 00:00:00.698742,Tanh,Leaky,ReLU,Leaky,77,20,19.0,16.0,19.0,0.04682737571671516,4,248,0.6123896746467326,6.409202884028645e-05,124.08550671833318,COMPLETE
1897,0.3242506682872772,2023-09-04 22:52:27.896818,2023-09-04 22:52:31.304345,0 days 00:00:03.407527,Leaky,Tanh,Sigmoid,Leaky,27,8,21.0,23.0,3.0,0.0009069040160819937,4,268,0.7463407167653099,2.2395575151435404e-05,126.63523071887447,COMPLETE
1898,1.0502461194992065,2023-09-04 22:52:31.304890,2023-09-04 22:52:32.564842,0 days 00:00:01.259952,Tanh,Leaky,Sigmoid,Sigmoid,34,19,23.0,17.0,7.0,0.0005137758468782734,4,199,0.6654262928774937,0.010795558656266737,111.57316790129009,COMPLETE
1899,0.5099346041679382,2023-09-04 22:52:32.565866,2023-09-04 22:52:34.653890,0 days 00:00:02.088024,Sigmoid,Leaky,Sigmoid,Leaky,31,22,20.0,15.0,19.0,0.0562629525827834,4,294,0.7086049158189539,1.683902012623194e-05,319.96686412669993,COMPLETE
1900,0.2950614094734192,2023-09-04 22:52:34.655153,2023-09-04 22:52:35.760841,0 days 00:00:01.105688,Tanh,Sigmoid,ReLU,,87,18,21.0,24.0,,0.011977643341689085,3,235,0.49313876264677997,0.0001494894835177866,107.34125518798828,COMPLETE
1901,0.5057907700538635,2023-09-04 22:52:35.761387,2023-09-04 22:52:38.934608,0 days 00:00:03.173221,ReLU,Leaky,Sigmoid,Sigmoid,81,19,19.0,22.0,15.0,0.00013359794306195202,4,255,0.7990766815115146,0.001778283720229677,149.53627890792546,COMPLETE
1902,0.4397920072078705,2023-09-04 22:52:38.935146,2023-09-04 22:52:39.448041,0 days 00:00:00.512895,Tanh,Leaky,Sigmoid,Tanh,37,9,20.0,9.0,20.0,0.007207402078484067,4,243,0.12922986220098542,0.0003594207981408722,318.1828565289897,COMPLETE
1903,0.5452435612678528,2023-09-04 22:52:39.449038,2023-09-04 22:52:40.289631,0 days 00:00:00.840593,Leaky,Leaky,Sigmoid,Leaky,85,12,18.0,20.0,16.0,0.0007921032934737301,4,216,0.2411714738607098,0.000492189783389184,392.4477153930664,COMPLETE
1904,0.3808884918689728,2023-09-04 22:52:40.290192,2023-09-04 22:52:40.530345,0 days 00:00:00.240153,Tanh,ReLU,ReLU,Leaky,98,17,22.0,16.0,6.0,0.018906357626477906,4,276,0.21046814116540208,9.910431274433723e-05,145.00163700269616,COMPLETE
1905,0.6520883440971375,2023-09-04 22:52:40.530907,2023-09-04 22:52:41.361413,0 days 00:00:00.830506,Sigmoid,Leaky,Sigmoid,Sigmoid,83,14,21.0,24.0,4.0,0.008822445383563846,4,229,0.7506345464484441,0.00012726695309906905,179.70905774434408,COMPLETE
1906,0.3043806552886963,2023-09-04 22:52:41.361948,2023-09-04 22:52:41.973399,0 days 00:00:00.611451,Tanh,Leaky,Sigmoid,Leaky,92,10,20.0,21.0,18.0,0.01470922679005486,4,301,0.7276596253901367,4.152796517055343e-05,327.73943488542426,COMPLETE
1907,0.2964065670967102,2023-09-04 22:52:41.973941,2023-09-04 22:52:42.455803,0 days 00:00:00.481862,ReLU,Leaky,Sigmoid,Sigmoid,88,20,19.0,14.0,8.0,0.026312275951295816,4,258,0.3055555337803796,3.510104367396994e-05,245.70637188535747,COMPLETE
1908,0.32626259326934814,2023-09-04 22:52:42.456356,2023-09-04 22:52:43.599595,0 days 00:00:01.143239,Leaky,Leaky,Sigmoid,Leaky,86,18,20.0,23.0,6.0,0.0024958305527708604,4,287,0.6315487560202642,8.062461831119919e-05,110.4438505367357,COMPLETE
1909,0.25124743580818176,2023-09-04 22:52:43.600152,2023-09-04 22:52:46.070180,0 days 00:00:02.470028,Tanh,Leaky,ReLU,Leaky,30,21,21.0,23.0,5.0,0.0033716995650255777,4,243,0.7722020434675682,0.0002951818722139005,89.84456066056794,COMPLETE
1910,0.3442976474761963,2023-09-04 22:52:46.070752,2023-09-04 22:52:46.915409,0 days 00:00:00.844657,Sigmoid,Leaky,Leaky,ReLU,80,19,20.0,10.0,17.0,0.0020190930245768055,4,209,0.38983976031438583,1.2230491580307093e-05,127.57217958995274,COMPLETE
1911,0.4389338493347168,2023-09-04 22:52:46.915962,2023-09-04 22:52:51.042532,0 days 00:00:04.126570,Tanh,Leaky,Sigmoid,Sigmoid,84,18,21.0,15.0,5.0,0.0003607537737771741,4,314,0.6825343735809376,0.0002062584679094261,153.5173365599031,COMPLETE
1912,1.1869150400161743,2023-09-04 22:52:51.043104,2023-09-04 22:52:51.356490,0 days 00:00:00.313386,ReLU,Leaky,Sigmoid,Leaky,71,23,22.0,22.0,2.0,0.010798094846245424,4,229,0.7991294996327347,0.0001660160668862683,104.32286487926136,COMPLETE
1913,0.2724398374557495,2023-09-04 22:52:51.357035,2023-09-04 22:52:52.228931,0 days 00:00:00.871896,Tanh,Leaky,Sigmoid,Sigmoid,90,11,19.0,13.0,6.0,0.02025542335658619,4,175,0.7494009057543479,6.46472371691384e-05,126.39567100395591,COMPLETE
1914,0.35672104358673096,2023-09-04 22:52:52.229476,2023-09-04 22:52:53.649267,0 days 00:00:01.419791,Sigmoid,Leaky,ReLU,Leaky,81,21,19.0,24.0,18.0,0.013357463599763194,4,248,0.711942293645696,0.00012058243214820075,208.6958753797743,COMPLETE
1915,0.3224702477455139,2023-09-04 22:52:53.649835,2023-09-04 22:52:55.697489,0 days 00:00:02.047654,Leaky,Leaky,Tanh,Leaky,33,16,24.0,17.0,19.0,0.016456030693545308,4,269,0.7684812412352242,0.00022835771254797903,93.58487346560456,COMPLETE
1916,0.40617403388023376,2023-09-04 22:52:55.698028,2023-09-04 22:52:58.358193,0 days 00:00:02.660165,Tanh,ReLU,Sigmoid,Sigmoid,87,20,20.0,23.0,22.0,0.0002521675145556562,4,237,0.7289356549347086,8.856229215419423e-05,841.7837561434332,COMPLETE
1917,0.3816865384578705,2023-09-04 22:52:58.358719,2023-09-04 22:52:58.952243,0 days 00:00:00.593524,ReLU,Leaky,Sigmoid,Leaky,94,19,20.0,16.0,7.0,0.00964213916425975,4,221,0.6626193165453348,5.676611548680524e-05,129.6408487955729,COMPLETE
1918,0.38237127661705017,2023-09-04 22:52:58.952772,2023-09-04 22:53:02.883141,0 days 00:00:03.930369,Tanh,Leaky,Sigmoid,Leaky,29,18,17.0,24.0,4.0,0.0002484266658790496,4,258,0.6933051828996089,0.00014035342195395636,245.6438915510119,COMPLETE
1919,0.8777011632919312,2023-09-04 22:53:02.883672,2023-09-04 22:53:03.299540,0 days 00:00:00.415868,Sigmoid,Leaky,Sigmoid,Sigmoid,84,15,22.0,15.0,17.0,0.0001698413802746812,4,303,0.7702256472436333,0.003835662158577516,134.6257393878439,COMPLETE
1920,0.39926469326019287,2023-09-04 22:53:03.300070,2023-09-04 22:53:03.603167,0 days 00:00:00.303097,Leaky,Leaky,ReLU,Leaky,89,19,21.0,13.0,5.0,0.02354172389240087,4,249,0.3181723051550737,0.00018205265851080037,106.61670201619467,COMPLETE
1921,0.5044243335723877,2023-09-04 22:53:03.603700,2023-09-04 22:53:04.745487,0 days 00:00:01.141787,Tanh,Leaky,Sigmoid,Sigmoid,26,17,18.0,22.0,5.0,0.0001452610446989217,4,283,0.1736780619678161,4.616171162732032e-05,103.34686655540989,COMPLETE
1922,0.7911908626556396,2023-09-04 22:53:04.746024,2023-09-04 22:53:05.096951,0 days 00:00:00.350927,Tanh,Sigmoid,Sigmoid,Leaky,49,20,19.0,23.0,16.0,0.0043767211191704835,4,266,0.7416353752036586,0.008043683926976169,99.08150482177734,COMPLETE
1923,0.28976091742515564,2023-09-04 22:53:05.097470,2023-09-04 22:53:06.016760,0 days 00:00:00.919290,ReLU,Tanh,,,86,18,21.0,,,0.0028491033345767994,2,409,0.7666184140839063,1.4723461866325057e-05,93.5006419337073,COMPLETE
1924,1.0157933235168457,2023-09-04 22:53:06.017270,2023-09-04 22:53:06.223749,0 days 00:00:00.206479,Sigmoid,Leaky,Sigmoid,ReLU,82,21,20.0,16.0,7.0,0.00786439910183395,4,234,0.13817169014428915,0.07098232449822213,109.14215326309204,COMPLETE
1925,0.41387641429901123,2023-09-04 22:53:06.224286,2023-09-04 22:53:06.933864,0 days 00:00:00.709578,Tanh,Leaky,Sigmoid,Tanh,31,22,23.0,24.0,3.0,0.031026148591835796,4,193,0.3432065151271914,0.005092240885533884,129.13935805340202,COMPLETE
1926,0.38957738876342773,2023-09-04 22:53:06.934390,2023-09-04 22:53:07.488047,0 days 00:00:00.553657,Leaky,Leaky,ReLU,Leaky,36,17,20.0,23.0,9.0,0.017878564475117268,4,292,0.7172419043078775,7.40013014515211e-05,151.05037956237794,COMPLETE
1927,0.39071714878082275,2023-09-04 22:53:07.488583,2023-09-04 22:53:07.996900,0 days 00:00:00.508317,Tanh,Leaky,Sigmoid,Sigmoid,42,19,21.0,15.0,14.0,0.012901305622759306,4,275,0.22076417229273018,0.000593090375937679,2408.365975215517,COMPLETE
1928,0.5827280282974243,2023-09-04 22:53:07.997428,2023-09-04 22:53:08.898201,0 days 00:00:00.900773,Sigmoid,Leaky,Sigmoid,Leaky,34,20,4.0,21.0,18.0,0.005760806083735254,4,225,0.1965243887323088,0.00010102293528483658,526.6902766096482,COMPLETE
1929,0.5225712060928345,2023-09-04 22:53:08.898730,2023-09-04 22:53:10.706691,0 days 00:00:01.807961,Tanh,Leaky,ReLU,Sigmoid,39,9,14.0,24.0,2.0,0.00042747898573578566,4,213,0.27844962460010475,0.0002541924654673901,87.59579353153426,COMPLETE
1930,0.37557274103164673,2023-09-04 22:53:10.707220,2023-09-04 22:53:12.337321,0 days 00:00:01.630101,ReLU,Leaky,Sigmoid,Leaky,91,10,20.0,22.0,20.0,0.0010109553593373381,4,156,0.685880545666207,0.012909487150596147,145.87007400616497,COMPLETE
1931,0.9689577221870422,2023-09-04 22:53:12.337846,2023-09-04 22:53:13.489787,0 days 00:00:01.151941,Leaky,ReLU,Sigmoid,Leaky,84,18,22.0,11.0,4.0,6.321551085764834e-05,4,255,0.7437975726917124,0.02212186017020582,102.274921503934,COMPLETE
1932,0.4035196900367737,2023-09-04 22:53:13.490341,2023-09-04 22:53:14.163825,0 days 00:00:00.673484,Tanh,Leaky,Sigmoid,Sigmoid,28,11,19.0,12.0,19.0,0.010620341535529591,4,324,0.7727345621538941,0.00015587345442541673,128.42697786030016,COMPLETE
1933,0.6794511675834656,2023-09-04 22:53:14.164350,2023-09-04 22:53:15.251580,0 days 00:00:01.087230,Sigmoid,Leaky,Sigmoid,Leaky,88,19,18.0,14.0,21.0,0.0002225645355123285,4,243,0.720343303756228,0.0012557035119658878,132.8481703538161,COMPLETE
1934,0.6499327421188354,2023-09-04 22:53:15.252670,2023-09-04 22:53:19.290926,0 days 00:00:04.038256,Tanh,Leaky,Leaky,Leaky,79,18,21.0,23.0,17.0,3.159911726363556e-05,4,204,0.7997246213523976,0.0003713924344788902,115.86718185275208,COMPLETE
1935,0.48726731538772583,2023-09-04 22:53:19.291454,2023-09-04 22:53:19.553402,0 days 00:00:00.261948,ReLU,,,,81,22,,,,0.016010560636686575,1,237,0.3117197945918684,0.00030730595921384026,181.23496921245868,COMPLETE
1936,0.3383026421070099,2023-09-04 22:53:19.553921,2023-09-04 22:53:20.175905,0 days 00:00:00.621984,Tanh,Leaky,ReLU,Sigmoid,83,19,19.0,16.0,8.0,0.022125427454681545,4,262,0.6281051005695945,0.00020320164523658424,125.77124818166097,COMPLETE
1937,0.5972069501876831,2023-09-04 22:53:20.176438,2023-09-04 22:53:20.629961,0 days 00:00:00.453523,Leaky,Leaky,Sigmoid,ReLU,86,20,20.0,24.0,4.0,0.0007389222796884586,4,454,0.12102358595631714,0.00011824383530848339,172.34858315889952,COMPLETE
1938,0.893972635269165,2023-09-04 22:53:20.630503,2023-09-04 22:53:23.220022,0 days 00:00:02.589519,Sigmoid,Leaky,Sigmoid,Leaky,32,21,20.0,15.0,10.0,1.317791654176473e-05,4,252,0.29864656803163303,0.0005110663104793845,93.46149293203203,COMPLETE
1939,0.4680655896663666,2023-09-04 22:53:23.220571,2023-09-04 22:53:26.914174,0 days 00:00:03.693603,Tanh,Leaky,Sigmoid,Sigmoid,88,17,22.0,17.0,6.0,0.0002849319364426563,4,227,0.5788703588324625,1.9987960994360216e-05,170.31194409609893,COMPLETE
1940,0.38354408740997314,2023-09-04 22:53:26.915257,2023-09-04 22:53:27.832546,0 days 00:00:00.917289,Tanh,Leaky,ReLU,Leaky,85,16,15.0,23.0,6.0,0.0018282711521291157,4,287,0.35058867865781446,0.009058885106588567,242.08092411359152,COMPLETE
1941,0.22736111283302307,2023-09-04 22:53:27.833125,2023-09-04 22:53:28.645263,0 days 00:00:00.812138,ReLU,Leaky,Sigmoid,Leaky,91,18,21.0,22.0,15.0,0.013167810632887512,4,301,0.7485982055313414,1.2198725516709922e-05,108.68442449262065,COMPLETE
1942,0.971416711807251,2023-09-04 22:53:28.645853,2023-09-04 22:53:32.103371,0 days 00:00:03.457518,Leaky,Leaky,Tanh,Sigmoid,83,13,19.0,16.0,5.0,2.827031538772948e-05,4,314,0.6968182558405176,9.362444397997396e-05,225.49226073246854,COMPLETE
1943,0.4459165036678314,2023-09-04 22:53:32.103920,2023-09-04 22:53:32.693376,0 days 00:00:00.589456,Tanh,Leaky,Sigmoid,Leaky,46,19,8.0,24.0,18.0,0.035380838954330265,4,274,0.45649809304499567,5.977117857330341e-05,198.9338143088601,COMPLETE
1944,0.9116032123565674,2023-09-04 22:53:32.693926,2023-09-04 22:53:36.546128,0 days 00:00:03.852202,Sigmoid,ReLU,Sigmoid,Sigmoid,80,20,18.0,23.0,1.0,0.00012210264907895854,4,242,0.6636168834926411,0.0016224488569719184,160.27925220205765,COMPLETE
1945,0.5267276167869568,2023-09-04 22:53:36.546669,2023-09-04 22:53:36.877940,0 days 00:00:00.331271,Tanh,Leaky,Sigmoid,Leaky,77,17,21.0,15.0,7.0,0.0065472753003278745,4,187,0.12718818991712136,0.003518754398345085,537.7409354701186,COMPLETE
1946,0.38175639510154724,2023-09-04 22:53:36.878474,2023-09-04 22:53:37.175668,0 days 00:00:00.297194,ReLU,Tanh,ReLU,,61,10,20.0,22.0,,0.018876610421175992,3,215,0.2002719609710013,7.676225554369525e-05,222.93034437226086,COMPLETE
1947,0.4279930889606476,2023-09-04 22:53:37.176262,2023-09-04 22:53:37.718275,0 days 00:00:00.542013,Tanh,Leaky,Sigmoid,Leaky,37,9,20.0,17.0,19.0,0.003985165619592855,4,392,0.2651858349976913,2.651200331058448e-05,141.98704330444335,COMPLETE
1948,0.27087903022766113,2023-09-04 22:53:37.718838,2023-09-04 22:53:39.679980,0 days 00:00:01.961142,Sigmoid,Sigmoid,Sigmoid,Sigmoid,30,21,23.0,24.0,16.0,0.009300261707574729,4,236,0.7999208772838595,3.381679527845262e-05,200.99262157838737,COMPLETE
1949,1.1486272811889648,2023-09-04 22:53:39.680517,2023-09-04 22:53:39.987030,0 days 00:00:00.306513,Leaky,Leaky,Sigmoid,Leaky,86,18,19.0,16.0,6.0,0.014952389979595875,4,250,0.7701011644839797,0.014886599955306857,101.18665250142415,COMPLETE
1950,0.5036236643791199,2023-09-04 22:53:39.987616,2023-09-04 22:53:40.568051,0 days 00:00:00.580435,Tanh,Leaky,ReLU,Tanh,89,19,22.0,21.0,17.0,0.0016714150303818761,4,223,0.7286664033515221,0.0001580443260451926,173.8247559376252,COMPLETE
1951,0.2751857340335846,2023-09-04 22:53:40.568594,2023-09-04 22:53:41.230449,0 days 00:00:00.661855,Tanh,Leaky,Sigmoid,ReLU,33,20,21.0,23.0,20.0,0.011898632244846111,4,258,0.36126891271255474,0.00013233579715026355,126.70602000843395,COMPLETE
1952,0.29652705788612366,2023-09-04 22:53:41.230995,2023-09-04 22:53:41.895287,0 days 00:00:00.664292,ReLU,Leaky,Sigmoid,Sigmoid,84,19,13.0,24.0,5.0,0.024570955849857738,4,270,0.7506038656230392,0.0027850174003573027,203.50602340698242,COMPLETE
1953,0.44624677300453186,2023-09-04 22:53:41.896311,2023-09-04 22:53:43.899666,0 days 00:00:02.003355,Sigmoid,Leaky,Sigmoid,Leaky,24,11,20.0,14.0,18.0,0.001366338866994677,4,282,0.3686951569253238,4.921187739630203e-05,164.35098404482187,COMPLETE
1954,0.4196852445602417,2023-09-04 22:53:43.900723,2023-09-04 22:53:44.909155,0 days 00:00:01.008432,Tanh,Leaky,ReLU,Leaky,82,18,20.0,23.0,3.0,0.016940684768697582,4,231,0.38486024421177667,0.01997395131108195,704.0301109313965,COMPLETE
1955,0.41931530833244324,2023-09-04 22:53:44.910197,2023-09-04 22:53:45.685834,0 days 00:00:00.775637,Leaky,Leaky,Sigmoid,Sigmoid,86,14,18.0,15.0,10.0,0.028873067330323625,4,164,0.5963484491875539,0.00023616673847404776,196.72758909713392,COMPLETE
1956,0.2632869482040405,2023-09-04 22:53:45.686381,2023-09-04 22:53:46.498657,0 days 00:00:00.812276,Tanh,Leaky,Sigmoid,Leaky,35,12,19.0,22.0,13.0,0.020511640919837672,4,244,0.7075411983177365,0.00017822563372343208,258.51568141128075,COMPLETE
1957,0.39844515919685364,2023-09-04 22:53:46.499192,2023-09-04 22:53:47.901522,0 days 00:00:01.402330,Sigmoid,Leaky,Sigmoid,Leaky,27,22,17.0,16.0,16.0,0.005156138818178277,4,262,0.7715657143338782,1.573363942251975e-05,160.96831824562767,COMPLETE
1958,0.629328191280365,2023-09-04 22:53:47.902077,2023-09-04 22:53:48.143251,0 days 00:00:00.241174,ReLU,ReLU,Sigmoid,Sigmoid,53,17,21.0,23.0,7.0,0.008021242384843304,4,296,0.187868742540272,0.00011252307854883434,152.57335705227322,COMPLETE
1959,0.30177491903305054,2023-09-04 22:53:48.143792,2023-09-04 22:53:49.007828,0 days 00:00:00.864036,Tanh,Leaky,Leaky,Leaky,88,20,22.0,24.0,17.0,0.012516252584757375,4,236,0.7995104338907588,0.010764698657669871,110.44188788629347,COMPLETE
1960,0.7866698503494263,2023-09-04 22:53:49.008373,2023-09-04 22:53:49.448180,0 days 00:00:00.439807,Leaky,Leaky,ReLU,Sigmoid,94,21,20.0,22.0,4.0,0.05187088483830735,4,217,0.7357469238087635,6.930598267487696e-05,219.63329080434946,COMPLETE
