number,value,datetime_start,datetime_complete,duration,params_activation1,params_activation2,params_activation3,params_activation4,params_batch_size,params_fl1,params_fl2,params_fl3,params_fl4,params_learning_rate,params_n_layers,params_num_epochs,params_train_size,params_weight_decay,user_attrs_mre,state
1341,0.41514384746551514,2023-09-04 22:28:36.465171,2023-09-04 22:28:40.216090,0 days 00:00:03.750919,Tanh,Sigmoid,Sigmoid,,36,20,23.0,6.0,,0.00012795769098751007,3,231,0.6800645448878972,0.00051888608074887,121.79658742797324,COMPLETE
1342,0.3735801577568054,2023-09-04 22:28:40.216515,2023-09-04 22:28:40.577618,0 days 00:00:00.361103,ReLU,Sigmoid,Leaky,,49,22,5.0,4.0,,0.01842699326174596,3,238,0.7226297066586939,0.016093972758248632,102.43542976379395,COMPLETE
1343,0.3347058892250061,2023-09-04 22:28:40.578050,2023-09-04 22:28:41.439081,0 days 00:00:00.861031,Tanh,Sigmoid,Tanh,,53,21,12.0,9.0,,0.013184032634571576,3,207,0.7989477156037365,0.0001721268256880853,93.59576565878731,COMPLETE
1344,0.3413999676704407,2023-09-04 22:28:41.439544,2023-09-04 22:28:42.100226,0 days 00:00:00.660682,Tanh,ReLU,Leaky,,39,20,6.0,11.0,,0.011486521664213744,3,218,0.32387741554789257,0.0009980534973801731,116.99174200521934,COMPLETE
1345,0.4898811876773834,2023-09-04 22:28:42.100659,2023-09-04 22:28:43.242778,0 days 00:00:01.142119,Tanh,Sigmoid,Sigmoid,,12,15,13.0,7.0,,0.0627990051560712,3,107,0.7502840464924951,0.0066192863389126794,144.17489728060636,COMPLETE
1346,1.019445538520813,2023-09-04 22:28:43.243222,2023-09-04 22:28:43.557850,0 days 00:00:00.314628,Leaky,Sigmoid,Leaky,,44,22,22.0,2.0,,0.015448497251165145,3,246,0.7706624175183973,0.04700373740873864,100.36539350237165,COMPLETE
1347,0.3636312186717987,2023-09-04 22:28:43.558283,2023-09-04 22:28:44.337156,0 days 00:00:00.778873,Tanh,ReLU,Tanh,,87,20,14.0,8.0,,0.00016809561828292884,3,70,0.799070925200139,0.00010081559120081004,110.13135365077427,COMPLETE
1348,0.36688488721847534,2023-09-04 22:28:44.337595,2023-09-04 22:28:44.601052,0 days 00:00:00.263457,ReLU,,,,100,19,,,,0.021349116974044815,1,227,0.5580058765604737,0.00023208598244576966,96.11038168882712,COMPLETE
1349,0.4118686318397522,2023-09-04 22:28:44.601464,2023-09-04 22:28:44.920047,0 days 00:00:00.318583,Tanh,Sigmoid,,,46,21,15.0,,,0.002495846040681554,2,89,0.1523777124223912,3.8973194831887136e-05,339.9911790678773,COMPLETE
1350,0.4522142708301544,2023-09-04 22:28:44.920467,2023-09-04 22:28:45.157777,0 days 00:00:00.237310,Tanh,Sigmoid,Leaky,,57,22,8.0,6.0,,0.028093223922331507,3,212,0.3388390785858778,0.03190871728608659,347.51455243428546,COMPLETE
1351,0.31727105379104614,2023-09-04 22:28:45.158211,2023-09-04 22:28:46.337873,0 days 00:00:01.179662,Tanh,ReLU,,,18,21,17.0,,,0.002810238292584802,2,79,0.6165329140313229,0.00014963868138037287,104.70413574805626,COMPLETE
1352,0.328336626291275,2023-09-04 22:28:46.338304,2023-09-04 22:28:46.866155,0 days 00:00:00.527851,Sigmoid,,,,51,20,,,,0.0374923685836949,1,233,0.7140284673303713,8.712118553870729e-05,94.30286348783054,COMPLETE
1353,0.3678438067436218,2023-09-04 22:28:46.866607,2023-09-04 22:28:47.356362,0 days 00:00:00.489755,Tanh,Leaky,,,23,19,2.0,,,0.00965812295228999,2,66,0.31936623177755485,2.0967180737168674e-05,197.93167252974078,COMPLETE
1354,0.4023897051811218,2023-09-04 22:28:47.356784,2023-09-04 22:28:47.750357,0 days 00:00:00.393573,ReLU,Sigmoid,,,10,21,4.0,,,0.01992443089076595,2,220,0.19800571162232516,0.00011494846245656727,318.9541485126202,COMPLETE
1355,1.01576566696167,2023-09-04 22:28:47.750785,2023-09-04 22:28:48.131038,0 days 00:00:00.380253,Tanh,Sigmoid,Sigmoid,,43,20,7.0,4.0,,1.1419370020696936e-05,3,95,0.12357843196000132,2.7489571250985114e-05,202.50393098530017,COMPLETE
1356,0.4344259202480316,2023-09-04 22:28:48.131475,2023-09-04 22:28:48.455585,0 days 00:00:00.324110,Tanh,Sigmoid,,,38,14,18.0,,,0.04142617299324309,2,253,0.22626306793158607,0.011291452249089002,131.47515953911676,COMPLETE
1357,0.3648664653301239,2023-09-04 22:28:48.456016,2023-09-04 22:28:51.282099,0 days 00:00:02.826083,Tanh,ReLU,,,20,21,10.0,,,0.0006207732999919611,2,201,0.6685314389144112,0.008904354540482898,105.20241799031882,COMPLETE
1358,0.3192448616027832,2023-09-04 22:28:51.282521,2023-09-04 22:28:51.978635,0 days 00:00:00.696114,Tanh,Sigmoid,Leaky,,55,7,5.0,5.0,,0.011942342227839922,3,57,0.7421301907608482,0.00027411550913401724,120.36086242052974,COMPLETE
1359,0.4403289258480072,2023-09-04 22:28:51.979070,2023-09-04 22:28:55.672155,0 days 00:00:03.693085,ReLU,,,,16,15,,,,2.374528146452123e-05,1,241,0.49772985989423146,4.6200600765555235e-05,97.17346903694121,COMPLETE
1360,0.34519997239112854,2023-09-04 22:28:55.672994,2023-09-04 22:28:56.411265,0 days 00:00:00.738271,Leaky,Sigmoid,,,41,22,16.0,,,0.031640624280292365,2,71,0.6976887849779775,0.00014090690385742851,103.41538283404182,COMPLETE
1361,0.4488826096057892,2023-09-04 22:28:56.411825,2023-09-04 22:28:56.581146,0 days 00:00:00.169321,Tanh,ReLU,Tanh,,49,21,6.0,3.0,,0.015395207900540392,3,88,0.10858010756863107,0.0013675464919672886,126.83630198817099,COMPLETE
1362,0.3569883406162262,2023-09-04 22:28:56.581580,2023-09-04 22:28:56.850487,0 days 00:00:00.268907,Tanh,Sigmoid,,,12,20,13.0,,,0.05399289961781367,2,117,0.16189738766251624,7.422805793418006e-05,114.24507722400483,COMPLETE
1363,0.2808298170566559,2023-09-04 22:28:56.850919,2023-09-04 22:28:57.374568,0 days 00:00:00.523649,Tanh,Leaky,,,47,13,15.0,,,0.024627895250474728,2,226,0.7996502823360805,3.603536997703183e-05,85.35083501479205,COMPLETE
1364,0.8505697250366211,2023-09-04 22:28:57.375022,2023-09-04 22:28:57.785312,0 days 00:00:00.410290,ReLU,,,,36,21,,,,1.4438438503080902e-05,1,79,0.2596668279976579,1.7683436445170047e-05,449.3090264042722,COMPLETE
1365,1.0480668544769287,2023-09-04 22:28:57.785738,2023-09-04 22:28:58.495710,0 days 00:00:00.709972,Tanh,Sigmoid,,,52,12,20.0,,,1.63701474278916e-05,2,101,0.3994288953452307,0.00019503159600316183,152.41080255791692,COMPLETE
1366,0.29706117510795593,2023-09-04 22:28:58.496140,2023-09-04 22:29:04.192291,0 days 00:00:05.696151,Sigmoid,ReLU,Leaky,,18,22,14.0,7.0,,0.001642931027315937,3,214,0.5982515031049969,0.0003558412584463388,106.00297646210572,COMPLETE
1367,0.3230365216732025,2023-09-04 22:29:04.192724,2023-09-04 22:29:05.003694,0 days 00:00:00.810970,Tanh,Sigmoid,,,30,20,24.0,,,0.009987879442783225,2,62,0.649246990309863,1.4008016297150392e-05,118.17922243158868,COMPLETE
1368,0.3443675637245178,2023-09-04 22:29:05.004168,2023-09-04 22:29:06.320345,0 days 00:00:01.316177,Tanh,,,,21,21,,,,0.013589288899650553,1,236,0.7650833699896633,2.3934387705588095e-05,106.18918811573701,COMPLETE
1369,0.33745282888412476,2023-09-04 22:29:06.320801,2023-09-04 22:29:08.588497,0 days 00:00:02.267696,Tanh,Sigmoid,,,45,22,3.0,,,0.0019154444232090833,2,200,0.73023064599315,0.0004908886386217449,107.53909378477981,COMPLETE
1370,0.39815399050712585,2023-09-04 22:29:08.588959,2023-09-04 22:29:09.264112,0 days 00:00:00.675153,ReLU,ReLU,Leaky,,14,19,22.0,2.0,,0.00041871388832250857,3,83,0.12715344441440424,5.8381816511200173e-05,269.7677512111434,COMPLETE
1371,0.3835236728191376,2023-09-04 22:29:09.264564,2023-09-04 22:29:09.525110,0 days 00:00:00.260546,Tanh,Sigmoid,,,92,14,6.0,,,0.017990878337375744,2,225,0.2360497867301311,0.0020331733454714788,151.96298623085022,COMPLETE
1372,0.33141618967056274,2023-09-04 22:29:09.525566,2023-09-04 22:29:10.062680,0 days 00:00:00.537114,Tanh,Sigmoid,,,34,21,19.0,,,0.03472371603074073,2,109,0.4601206425593481,0.00012870424644174325,269.3097162661345,COMPLETE
1373,1.1375447511672974,2023-09-04 22:29:10.063121,2023-09-04 22:29:11.187396,0 days 00:00:01.124275,Leaky,Sigmoid,Sigmoid,,41,20,5.0,1.0,,1.7951935493844853e-05,3,50,0.769718593751813,3.300932547105344e-05,119.96018707275391,COMPLETE
1374,0.31706950068473816,2023-09-04 22:29:11.187860,2023-09-04 22:29:11.793808,0 days 00:00:00.605948,Tanh,Leaky,,,24,22,7.0,,,0.02687902961794211,2,208,0.6956736428933754,0.0007850504134107328,103.22790075231481,COMPLETE
1375,0.42530953884124756,2023-09-04 22:29:11.794265,2023-09-04 22:29:12.076404,0 days 00:00:00.282139,Tanh,,,,43,20,,,,0.021536474031266503,1,126,0.4248052973304141,0.05815622301951617,112.79269745770623,COMPLETE
1376,0.39013975858688354,2023-09-04 22:29:12.076826,2023-09-04 22:29:12.389468,0 days 00:00:00.312642,ReLU,ReLU,,,48,16,14.0,,,0.0484056431185059,2,74,0.2933076290130036,9.325610908764907e-05,101.98279910617404,COMPLETE
1377,0.4241299033164978,2023-09-04 22:29:12.389921,2023-09-04 22:29:15.686545,0 days 00:00:03.296624,Tanh,Sigmoid,Tanh,,53,21,13.0,22.0,,2.509794127586783e-05,3,244,0.741413841011057,0.0002084523915673704,117.57852147837154,COMPLETE
1378,0.34756335616111755,2023-09-04 22:29:15.687000,2023-09-04 22:29:16.042396,0 days 00:00:00.355396,Tanh,Sigmoid,,,38,21,12.0,,,0.008651713174935545,2,259,0.21965329697685965,0.00016318693238487507,109.6981272204169,COMPLETE
1379,0.4034512937068939,2023-09-04 22:29:16.042838,2023-09-04 22:29:18.151771,0 days 00:00:02.108933,Sigmoid,ReLU,,,10,22,21.0,,,0.011170321476494334,2,92,0.7992242123509439,0.0026123847166389944,114.31292743682862,COMPLETE
1380,0.34598127007484436,2023-09-04 22:29:18.152216,2023-09-04 22:29:21.476757,0 days 00:00:03.324541,Tanh,Sigmoid,,,50,20,15.0,,,0.0009439200245317606,2,231,0.711144104242961,4.2718883418887807e-05,104.05768563913745,COMPLETE
1381,0.5267655849456787,2023-09-04 22:29:21.477589,2023-09-04 22:29:22.636916,0 days 00:00:01.159327,Tanh,,,,81,15,,,,7.278353825750707e-05,1,58,0.7655892045886207,0.0011571699538083047,101.17868686544485,COMPLETE
1382,0.44519996643066406,2023-09-04 22:29:22.637354,2023-09-04 22:29:22.988871,0 days 00:00:00.351517,ReLU,Sigmoid,Leaky,,16,19,4.0,6.0,,0.0713363782510779,3,217,0.17980342478278802,8.120169215802397e-05,161.82153741244613,COMPLETE
1383,0.3259398341178894,2023-09-04 22:29:22.989305,2023-09-04 22:29:23.622298,0 days 00:00:00.632993,Tanh,Leaky,,,19,21,5.0,,,0.04111775625273742,2,67,0.7360405123888776,2.091035932698136e-05,122.2770651112432,COMPLETE
1384,0.4107363820075989,2023-09-04 22:29:23.622725,2023-09-04 22:29:23.959417,0 days 00:00:00.336692,Tanh,ReLU,Leaky,,13,22,6.0,9.0,,0.03103545462230638,3,98,0.277325920305042,0.004662403226580389,1733.1972127278646,COMPLETE
1385,0.3904514014720917,2023-09-04 22:29:23.959863,2023-09-04 22:29:24.712881,0 days 00:00:00.753018,Tanh,,,,46,10,,,,0.0033514255755803047,1,79,0.6687829463127355,0.00011050150074395939,108.15466636947438,COMPLETE
1386,0.5315687656402588,2023-09-04 22:29:24.713300,2023-09-04 22:29:29.589563,0 days 00:00:04.876263,Tanh,Sigmoid,,,22,18,7.0,,,3.432190038530915e-05,2,220,0.7671034120625603,0.005567409467289221,109.66154525063254,COMPLETE
1387,0.40625065565109253,2023-09-04 22:29:29.589998,2023-09-04 22:29:29.862400,0 days 00:00:00.272402,Leaky,Sigmoid,,,40,4,16.0,,,0.014976542987699522,2,88,0.10545579168130162,0.00030895393049912577,294.71754356833065,COMPLETE
1388,0.4366287589073181,2023-09-04 22:29:29.862836,2023-09-04 22:29:29.999276,0 days 00:00:00.136440,ReLU,Sigmoid,,,54,20,11.0,,,0.09904531400530467,2,234,0.10876039410442878,0.04226213717571202,101.04647155761718,COMPLETE
1389,1.0349920988082886,2023-09-04 22:29:29.999694,2023-09-04 22:29:30.387331,0 days 00:00:00.387637,Tanh,ReLU,Sigmoid,,51,23,13.0,5.0,,1.9655544618053967e-05,3,105,0.13592450855281776,0.013316373636636408,99.95435652959914,COMPLETE
1390,0.3471638262271881,2023-09-04 22:29:30.387772,2023-09-04 22:29:30.716802,0 days 00:00:00.329030,Tanh,,,,42,21,,,,0.025653170192016427,1,73,0.7201169496761135,0.007511838275960186,101.05201385498047,COMPLETE
1391,0.3593685030937195,2023-09-04 22:29:30.717216,2023-09-04 22:29:31.206349,0 days 00:00:00.489133,Tanh,Sigmoid,,,44,22,14.0,,,0.019032017271493732,2,208,0.7998687458777225,2.8150677126149157e-05,107.98010126749675,COMPLETE
1392,0.33704933524131775,2023-09-04 22:29:31.206840,2023-09-04 22:29:32.474720,0 days 00:00:01.267880,Sigmoid,Sigmoid,,,12,16,6.0,,,0.03727344580053845,2,248,0.6833289671530717,0.0002443268757892083,110.10444429185655,COMPLETE
1393,0.3291790187358856,2023-09-04 22:29:32.475144,2023-09-04 22:29:33.033328,0 days 00:00:00.558184,Tanh,ReLU,Leaky,,36,21,4.0,3.0,,0.01256485256009689,3,62,0.6353357274231213,5.209964758447774e-05,104.7344712288149,COMPLETE
1394,0.3504183292388916,2023-09-04 22:29:33.033765,2023-09-04 22:29:34.127778,0 days 00:00:01.094013,ReLU,Sigmoid,,,17,20,15.0,,,0.009523021659772963,2,227,0.7531585322450255,0.002965630056627083,120.00381600516182,COMPLETE
1395,0.3177732825279236,2023-09-04 22:29:34.128219,2023-09-04 22:29:34.575400,0 days 00:00:00.447181,Tanh,Sigmoid,,,27,21,18.0,,,0.022036926799860725,2,84,0.5099227391873623,3.8725853928213804e-05,107.85751370021275,COMPLETE
1396,0.49924975633621216,2023-09-04 22:29:34.575847,2023-09-04 22:29:35.307555,0 days 00:00:00.731708,Tanh,Leaky,Tanh,,49,14,1.0,7.0,,0.0013137120887684972,3,201,0.5403439859517257,0.05372697994051426,111.24367934006911,COMPLETE
1397,0.3416452705860138,2023-09-04 22:29:35.308004,2023-09-04 22:29:37.401505,0 days 00:00:02.093501,Tanh,ReLU,,,21,21,3.0,,,0.007846415166911244,2,116,0.5727659883886224,1.539223100212899e-05,91.62052899737691,COMPLETE
1398,0.35836607217788696,2023-09-04 22:29:37.402441,2023-09-04 22:29:38.541928,0 days 00:00:01.139487,Tanh,,,,15,23,,,,0.03014633770681958,1,240,0.7286575688976605,0.0016573562280500314,118.19971160888672,COMPLETE
1399,0.3396463692188263,2023-09-04 22:29:38.542705,2023-09-04 22:29:39.721326,0 days 00:00:01.178621,ReLU,Sigmoid,,,47,19,9.0,,,0.01605622044831557,2,94,0.7696413624474511,0.0023228706875559313,100.52899808661883,COMPLETE
1400,0.3423810601234436,2023-09-04 22:29:39.721771,2023-09-04 22:29:40.488184,0 days 00:00:00.766413,Tanh,Sigmoid,,,39,22,14.0,,,0.010931443571109856,2,221,0.7003027650417379,0.0001668947496175189,102.24925246605507,COMPLETE
1401,0.31949836015701294,2023-09-04 22:29:40.488626,2023-09-04 22:29:41.089064,0 days 00:00:00.600438,Leaky,Sigmoid,Leaky,,56,13,5.0,8.0,,0.05096628034595669,3,57,0.7485760892559508,6.601571678540833e-05,104.32309951782227,COMPLETE
1402,0.34313541650772095,2023-09-04 22:29:41.089516,2023-09-04 22:29:42.213962,0 days 00:00:01.124446,Tanh,ReLU,Sigmoid,,44,20,16.0,10.0,,0.0023977128301135783,3,72,0.7718560455132655,0.00012787677223868917,100.38010545210405,COMPLETE
1403,0.32857823371887207,2023-09-04 22:29:42.214397,2023-09-04 22:29:47.166391,0 days 00:00:04.951994,Tanh,Sigmoid,,,20,21,8.0,,,0.0005326228261890598,2,214,0.7997206123039627,1.854221385181321e-05,97.08015150059768,COMPLETE
1404,0.5013842582702637,2023-09-04 22:29:47.166831,2023-09-04 22:29:49.135733,0 days 00:00:01.968902,ReLU,,,,32,11,,,,8.355969905817728e-05,1,134,0.7160276720217812,3.06403568600371e-05,112.06640197981649,COMPLETE
1405,0.37643665075302124,2023-09-04 22:29:49.136146,2023-09-04 22:29:50.142535,0 days 00:00:01.006389,Tanh,Leaky,,,46,20,20.0,,,0.00016614810176660596,2,84,0.6572286071815028,2.3819422016097585e-05,114.08426248459588,COMPLETE
1406,0.5880233645439148,2023-09-04 22:29:50.142983,2023-09-04 22:29:57.203129,0 days 00:00:07.060146,Sigmoid,Sigmoid,,,10,22,7.0,,,3.213114909038353e-05,2,228,0.37326858626069326,4.6638222202633487e-05,108.23155710989968,COMPLETE
1407,0.3198305368423462,2023-09-04 22:29:57.203560,2023-09-04 22:29:58.013006,0 days 00:00:00.809446,Tanh,,,,52,21,,,,0.0033328276589069286,1,98,0.610461121473193,0.0001022926588968956,125.85691405315788,COMPLETE
1408,0.42983806133270264,2023-09-04 22:29:58.013435,2023-09-04 22:29:58.244105,0 days 00:00:00.230670,Tanh,ReLU,Leaky,,18,15,13.0,5.0,,0.013771264635593692,3,196,0.12054454764616077,0.0009001396363394014,155.6082681020101,COMPLETE
1409,0.3634517788887024,2023-09-04 22:29:58.244550,2023-09-04 22:29:58.463475,0 days 00:00:00.218925,Tanh,Sigmoid,,,42,22,2.0,,,0.02547846792691423,2,75,0.14994948165703986,0.00014394348586084754,450.94224955240884,COMPLETE
1410,0.3326810896396637,2023-09-04 22:29:58.463916,2023-09-04 22:30:02.983906,0 days 00:00:04.519990,ReLU,Sigmoid,,,23,20,23.0,,,0.0002857101619112194,2,252,0.7469731170277119,0.00018626915722630652,103.05023129485375,COMPLETE
1411,0.3524581491947174,2023-09-04 22:30:02.984356,2023-09-04 22:30:03.358147,0 days 00:00:00.373791,Tanh,ReLU,,,90,17,17.0,,,0.006702463763533823,2,240,0.343505996687466,8.01609821320793e-05,122.4367299609714,COMPLETE
1412,0.4918978214263916,2023-09-04 22:30:03.358582,2023-09-04 22:30:04.346861,0 days 00:00:00.988279,Tanh,Sigmoid,Tanh,,14,23,12.0,24.0,,0.04157051083980886,3,67,0.6890761693007953,0.0231147897461052,142.70774205525717,COMPLETE
1413,0.3383422791957855,2023-09-04 22:30:04.347306,2023-09-04 22:30:05.135716,0 days 00:00:00.788410,Leaky,,,,49,21,,,,0.0007420856832225788,1,211,0.3107180664427172,0.00022435262724439676,103.43581951623675,COMPLETE
1414,0.5593692660331726,2023-09-04 22:30:05.136155,2023-09-04 22:30:05.273231,0 days 00:00:00.137076,Tanh,Sigmoid,,,38,19,15.0,,,0.06599485422260973,2,50,0.1451033555311722,0.09499324803690913,9117.034511021206,COMPLETE
1415,0.35004037618637085,2023-09-04 22:30:05.273665,2023-09-04 22:30:05.872637,0 days 00:00:00.598972,Tanh,Sigmoid,,,12,20,10.0,,,0.017203601414468916,2,144,0.24836606952971335,3.4400041343486166e-05,191.20749608481802,COMPLETE
1416,0.3242156207561493,2023-09-04 22:30:05.873075,2023-09-04 22:30:06.170244,0 days 00:00:00.297169,ReLU,,,,58,21,,,,0.03027426896199235,1,233,0.7260469382339041,1.3878708023164916e-05,99.69409825251653,COMPLETE
1417,0.8708502650260925,2023-09-04 22:30:06.170724,2023-09-04 22:30:07.406707,0 days 00:00:01.235983,Tanh,ReLU,Leaky,,76,12,4.0,4.0,,1.2671046434510592e-05,3,107,0.7704112621610164,0.017292971833536157,99.13153995977383,COMPLETE
1418,0.3374107778072357,2023-09-04 22:30:07.407140,2023-09-04 22:30:08.106973,0 days 00:00:00.699833,Tanh,Leaky,,,34,22,19.0,,,0.002811493445433232,2,87,0.7439272688411219,0.0035506963779458277,133.37539560654585,COMPLETE
1419,0.35610222816467285,2023-09-04 22:30:08.107430,2023-09-04 22:30:09.410007,0 days 00:00:01.302577,Tanh,Sigmoid,,,54,20,21.0,,,0.008384211743894017,2,223,0.697375393865,0.006776304748799029,104.64838112006753,COMPLETE
1420,0.3308491110801697,2023-09-04 22:30:09.410835,2023-09-04 22:30:11.066168,0 days 00:00:01.655333,Sigmoid,Sigmoid,Sigmoid,,40,21,5.0,12.0,,0.02169974228327044,3,60,0.3682770104257526,0.0004270560402487333,114.41397616068522,COMPLETE
1421,0.42562809586524963,2023-09-04 22:30:11.067000,2023-09-04 22:30:11.618963,0 days 00:00:00.551963,Tanh,ReLU,,,37,22,8.0,,,0.03570008801977048,2,77,0.18771667507535914,5.9046451702381076e-05,174.1181697845459,COMPLETE
1422,0.2698707580566406,2023-09-04 22:30:11.619809,2023-09-04 22:30:13.184500,0 days 00:00:01.564691,ReLU,Tanh,,,45,14,6.0,,,0.012192394373620772,2,119,0.7729200620987577,2.450311324523801e-05,80.0252890586853,COMPLETE
1423,0.516976535320282,2023-09-04 22:30:13.184929,2023-09-04 22:30:15.603006,0 days 00:00:02.418077,ReLU,Sigmoid,,,44,14,6.0,,,5.048540051353293e-05,2,124,0.7997597075865722,2.5012546185983672e-05,101.95273202465427,COMPLETE
1424,0.3960982859134674,2023-09-04 22:30:15.603436,2023-09-04 22:30:15.847965,0 days 00:00:00.244529,ReLU,,,,45,13,,,,0.010943544261821743,1,132,0.2574136460360912,2.0891083690072047e-05,112.75696746162747,COMPLETE
1425,0.4136642813682556,2023-09-04 22:30:15.848413,2023-09-04 22:30:16.869366,0 days 00:00:01.020953,ReLU,Sigmoid,Leaky,,43,13,6.0,6.0,,0.0002302956903461135,3,110,0.40627100629196367,2.8030053897273327e-05,134.76751147183504,COMPLETE
1426,0.370159387588501,2023-09-04 22:30:16.869802,2023-09-04 22:30:17.092815,0 days 00:00:00.223013,ReLU,Tanh,Tanh,,45,14,7.0,6.0,,0.011157220859345706,3,120,0.2019483697763554,2.2413565401832297e-05,178.00936468716324,COMPLETE
1427,0.33561474084854126,2023-09-04 22:30:17.093238,2023-09-04 22:30:17.897951,0 days 00:00:00.804713,ReLU,ReLU,,,43,14,6.0,,,0.01593784447036524,2,115,0.799331551361379,1.8661403209694335e-05,89.19279395209418,COMPLETE
1428,0.3372381925582886,2023-09-04 22:30:17.898374,2023-09-04 22:30:18.471471,0 days 00:00:00.573097,ReLU,Sigmoid,,,45,13,5.0,,,0.013099857248367538,2,103,0.768805715384201,3.267821809383101e-05,95.40593973795573,COMPLETE
1429,0.3736662268638611,2023-09-04 22:30:18.471914,2023-09-04 22:30:18.953111,0 days 00:00:00.481197,ReLU,,,,98,15,,,,0.010021330149713778,1,109,0.7727986361789807,2.552950693163654e-05,99.2514770261703,COMPLETE
1430,0.4447748064994812,2023-09-04 22:30:18.953518,2023-09-04 22:30:19.218863,0 days 00:00:00.265345,ReLU,Leaky,,,42,22,7.0,,,0.013491235931319652,2,127,0.16050209348438044,1.6762792048448963e-05,3952.722110523897,COMPLETE
1431,0.31880712509155273,2023-09-04 22:30:19.219321,2023-09-04 22:30:19.843063,0 days 00:00:00.623742,ReLU,Sigmoid,Leaky,,41,14,6.0,17.0,,0.008929616888062424,3,138,0.7729580880835188,3.975649946729329e-05,113.86913561820984,COMPLETE
1432,0.3182215988636017,2023-09-04 22:30:19.843516,2023-09-04 22:30:20.477513,0 days 00:00:00.633997,ReLU,Tanh,,,45,14,6.0,,,0.012332380765082496,2,114,0.47936667814179085,2.5565222668517068e-05,97.24155255218051,COMPLETE
1433,0.7969486117362976,2023-09-04 22:30:20.477953,2023-09-04 22:30:21.316703,0 days 00:00:00.838750,ReLU,Sigmoid,,,45,14,7.0,,,6.138776403606494e-05,2,117,0.11219798276125986,3.097726811844736e-05,219.38151054708368,COMPLETE
1434,0.3244214653968811,2023-09-04 22:30:21.317528,2023-09-04 22:30:22.468842,0 days 00:00:01.151314,ReLU,ReLU,,,47,14,5.0,,,0.015557838809788107,2,103,0.5950868541288145,0.0005891237123610808,101.86722390311105,COMPLETE
1435,0.3650100827217102,2023-09-04 22:30:22.469660,2023-09-04 22:30:23.077509,0 days 00:00:00.607849,ReLU,Sigmoid,Leaky,,46,15,6.0,3.0,,0.007133109442035295,3,143,0.17203237361688647,2.0017965555705924e-05,200.03931035222234,COMPLETE
1436,0.4004504382610321,2023-09-04 22:30:23.078363,2023-09-04 22:30:23.593483,0 days 00:00:00.515120,ReLU,,,,43,13,,,,0.012334656738205477,1,133,0.4494864453291813,0.019502037750701424,108.96455637613933,COMPLETE
