number,value,datetime_start,datetime_complete,duration,params_activation1,params_activation2,params_activation3,params_activation4,params_batch_size,params_fl1,params_fl2,params_fl3,params_fl4,params_learning_rate,params_n_layers,params_num_epochs,params_train_size,params_weight_decay,user_attrs_mre,state
478,0.37470543384552,2023-09-04 22:00:43.208072,2023-09-04 22:00:43.741746,0 days 00:00:00.533674,Tanh,Leaky,,,48,22,9.0,,,0.03958651352826191,2,257,0.2729510609940636,7.539765038319622e-05,97.04110590616862,COMPLETE
479,0.9334859848022461,2023-09-04 22:00:43.742498,2023-09-04 22:00:44.966904,0 days 00:00:01.224406,Sigmoid,ReLU,Sigmoid,,38,15,15.0,9.0,,0.01391021687469057,3,81,0.7581394673621124,0.056571680192092,101.00114962929173,COMPLETE
480,0.33068788051605225,2023-09-04 22:00:44.967640,2023-09-04 22:00:46.558537,0 days 00:00:01.590897,Tanh,Sigmoid,,,19,14,14.0,,,0.028342637617575602,2,238,0.5186599578909848,9.570648095715325e-05,100.61269296918597,COMPLETE
481,0.4092736542224884,2023-09-04 22:00:46.559121,2023-09-04 22:00:47.991688,0 days 00:00:01.432567,Tanh,Sigmoid,,,16,7,23.0,,,0.00977148675207544,2,59,0.18421220949385214,1.815539354832461e-05,112.28582892983647,COMPLETE
482,0.3273472189903259,2023-09-04 22:00:47.992292,2023-09-04 22:00:49.173719,0 days 00:00:01.181427,Tanh,,,,43,16,,,,0.021168674973309626,1,133,0.7185647375931858,0.00026765614099515464,116.46358758050042,COMPLETE
483,0.28531357645988464,2023-09-04 22:00:49.174322,2023-09-04 22:00:55.669971,0 days 00:00:06.495649,Tanh,Tanh,Leaky,,10,21,13.0,12.0,,0.011951469929305935,3,158,0.7705408665043876,6.309723474293617e-05,88.4758841196696,COMPLETE
484,0.34278205037117004,2023-09-04 22:00:55.671135,2023-09-04 22:00:56.520179,0 days 00:00:00.849044,Tanh,Sigmoid,,,33,23,7.0,,,0.03266626662716442,2,51,0.3856631449670028,4.169046586099511e-05,107.92922154179325,COMPLETE
485,0.32409602403640747,2023-09-04 22:00:56.521062,2023-09-04 22:00:57.354474,0 days 00:00:00.833412,Tanh,ReLU,,,19,20,16.0,,,0.015906788952881775,2,88,0.6592288496460945,0.0004177527919894522,130.9686176593487,COMPLETE
486,0.3506609797477722,2023-09-04 22:00:57.354794,2023-09-04 22:01:05.001698,0 days 00:00:07.646904,Tanh,Sigmoid,,,14,21,17.0,,,0.0009535887860119847,2,106,0.7984676869487627,0.007436817237518138,99.94533805127413,COMPLETE
487,0.4899168014526367,2023-09-04 22:01:05.002042,2023-09-04 22:01:06.723688,0 days 00:00:01.721646,Leaky,Sigmoid,Leaky,,16,22,22.0,1.0,,0.0012032391266981139,3,223,0.2672681135963356,0.00014253020584301283,245.44990902855284,COMPLETE
488,0.3575536906719208,2023-09-04 22:01:06.724042,2023-09-04 22:01:06.997522,0 days 00:00:00.273480,Tanh,,,,36,21,,,,0.025529184077567848,1,71,0.7464219105963984,2.4029035056106486e-05,103.35495236045436,COMPLETE
489,0.3546763062477112,2023-09-04 22:01:06.997858,2023-09-04 22:01:08.477545,0 days 00:00:01.479687,Tanh,ReLU,,,21,23,6.0,,,0.0494380652882151,2,98,0.7062834780256014,0.0001645186229947393,100.75806345258441,COMPLETE
490,0.3404791057109833,2023-09-04 22:01:08.478142,2023-09-04 22:01:09.534386,0 days 00:00:01.056244,Tanh,Tanh,Leaky,Tanh,40,20,11.0,5.0,13.0,0.0034346145067334515,4,144,0.7505883266969159,0.0016922774655625645,108.47204571235471,COMPLETE
491,0.34170499444007874,2023-09-04 22:01:09.534735,2023-09-04 22:01:10.092436,0 days 00:00:00.557701,Sigmoid,Sigmoid,,,97,13,10.0,,,0.008005090406098397,2,80,0.7208662983251672,5.4851853034065064e-05,114.91427270690006,COMPLETE
492,0.3080468773841858,2023-09-04 22:01:10.092794,2023-09-04 22:01:11.410933,0 days 00:00:01.318139,Tanh,Sigmoid,,,12,24,21.0,,,0.017436047662115928,2,121,0.6918579246411194,1.8273448296635785e-05,87.10359824044365,COMPLETE
493,0.30596408247947693,2023-09-04 22:01:11.411313,2023-09-04 22:01:12.552604,0 days 00:00:01.141291,Tanh,Sigmoid,Leaky,,19,15,14.0,4.0,,0.011500799660112368,3,389,0.7997043910118876,0.00021208406721647525,107.67829704284668,COMPLETE
494,0.2896116375923157,2023-09-04 22:01:12.552952,2023-09-04 22:01:13.668322,0 days 00:00:01.115370,Tanh,,,,17,21,,,,0.022565771743261447,1,150,0.7671806080673336,8.193235566027354e-05,101.4943667472677,COMPLETE
495,0.3677634596824646,2023-09-04 22:01:13.668719,2023-09-04 22:01:18.927514,0 days 00:00:05.258795,Tanh,ReLU,,,13,4,15.0,,,0.00016451674438119722,2,164,0.6718034930897019,0.00011385275944641318,93.9442422448135,COMPLETE
496,0.4807562232017517,2023-09-04 22:01:18.927843,2023-09-04 22:01:19.747716,0 days 00:00:00.819873,Tanh,Sigmoid,,,35,22,9.0,,,0.0017438654837947042,2,245,0.7290083255654951,0.03731216244945193,105.80731033325195,COMPLETE
497,0.5276660323143005,2023-09-04 22:01:19.748098,2023-09-04 22:01:20.198636,0 days 00:00:00.450538,Tanh,Sigmoid,Tanh,Leaky,38,14,13.0,3.0,17.0,0.0005095525323783702,4,87,0.15503925700418197,0.017075066583028285,107.83515518013088,COMPLETE
498,0.31601428985595703,2023-09-04 22:01:20.199083,2023-09-04 22:01:21.570783,0 days 00:00:01.371700,Tanh,ReLU,Leaky,,10,21,12.0,8.0,,0.03781347476605546,3,68,0.6428267325359608,3.215668289550292e-05,104.54177997730396,COMPLETE
499,0.29701629281044006,2023-09-04 22:01:21.571150,2023-09-04 22:01:22.701699,0 days 00:00:01.130549,Tanh,Tanh,,,21,20,20.0,,,0.009115626243402793,2,139,0.7732585341905073,1.4602362561476979e-05,85.63055489280008,COMPLETE
500,0.3076823055744171,2023-09-04 22:01:22.702091,2023-09-04 22:01:24.308151,0 days 00:00:01.606060,Tanh,Sigmoid,,,43,19,24.0,,,0.0026027592062304768,2,270,0.7432238577376242,0.00031177813372387336,107.6060319983441,COMPLETE
501,0.3832108676433563,2023-09-04 22:01:24.308501,2023-09-04 22:01:24.536530,0 days 00:00:00.228029,Tanh,,,,23,22,,,,0.013877521434856434,1,233,0.31030066260432865,6.527987983051581e-05,1614.573045813519,COMPLETE
502,0.36593198776245117,2023-09-04 22:01:24.536904,2023-09-04 22:01:25.150090,0 days 00:00:00.613186,Tanh,Sigmoid,,,17,9,5.0,,,0.02929092528999156,2,100,0.5355525592974392,4.706991197807434e-05,109.16608674185616,COMPLETE
503,0.3345004916191101,2023-09-04 22:01:25.150433,2023-09-04 22:01:26.204115,0 days 00:00:01.053682,Sigmoid,Leaky,Leaky,,14,16,23.0,6.0,,0.019246257629139115,3,112,0.5591791355424667,2.5603552424811643e-05,109.73299363080193,COMPLETE
504,0.3559015393257141,2023-09-04 22:01:26.204524,2023-09-04 22:01:26.713783,0 days 00:00:00.509259,Tanh,ReLU,,,32,15,16.0,,,0.007327854760258783,2,157,0.6974201692666183,1.983943931464837e-05,101.80449905395508,COMPLETE
505,0.36308982968330383,2023-09-04 22:01:26.714131,2023-09-04 22:01:29.206284,0 days 00:00:02.492153,Tanh,,,,41,20,,,,0.0005334539187427243,1,210,0.7748469849702438,4.117887706519315e-05,111.58288309006464,COMPLETE
506,1.0603502988815308,2023-09-04 22:01:29.206615,2023-09-04 22:01:30.006979,0 days 00:00:00.800364,Tanh,Sigmoid,,,64,14,8.0,,,1.3867158642341617e-05,2,76,0.7217629705846799,0.0011293216412785723,146.1534339503238,COMPLETE
507,0.36714860796928406,2023-09-04 22:01:30.007309,2023-09-04 22:01:31.321384,0 days 00:00:01.314075,Tanh,Sigmoid,Sigmoid,Tanh,18,21,6.0,5.0,14.0,0.0882661151392503,4,89,0.753984208945064,9.666251486079487e-05,125.79750490188599,COMPLETE
508,0.27991679310798645,2023-09-04 22:01:31.321755,2023-09-04 22:01:32.730205,0 days 00:00:01.408450,Tanh,Sigmoid,Leaky,,20,23,19.0,18.0,,0.026161165562441246,3,374,0.602045399666571,0.00012792760496586507,108.01737601540306,COMPLETE
509,0.2709347903728485,2023-09-04 22:01:32.730564,2023-09-04 22:01:33.633385,0 days 00:00:00.902821,Leaky,Tanh,Leaky,,23,23,19.0,18.0,,0.03217875921216995,3,224,0.6121390186735464,0.00011978388007090302,132.3658230121319,COMPLETE
510,0.32988396286964417,2023-09-04 22:01:33.633798,2023-09-04 22:01:34.144108,0 days 00:00:00.510310,Leaky,Tanh,Leaky,,23,24,19.0,18.0,,0.029564364137209764,3,466,0.6104914335190739,0.00012194465791373716,104.84026917957124,COMPLETE
511,0.3294267952442169,2023-09-04 22:01:34.144582,2023-09-04 22:01:34.593911,0 days 00:00:00.449329,Leaky,Tanh,Leaky,,24,23,19.0,20.0,,0.014893762835162444,3,411,0.6228336609480525,0.0001698623086601831,106.48782730102539,COMPLETE
512,0.34797433018684387,2023-09-04 22:01:34.594396,2023-09-04 22:01:35.210968,0 days 00:00:00.616572,Sigmoid,Tanh,Leaky,,22,24,18.0,17.0,,0.010827800652645958,3,324,0.37112019081129516,0.00014578645724347417,129.25140419006348,COMPLETE
513,0.3351163864135742,2023-09-04 22:01:35.211422,2023-09-04 22:01:36.031720,0 days 00:00:00.820298,Leaky,Tanh,Leaky,,21,23,19.0,17.0,,0.025193647322042767,3,374,0.593803352202396,0.0001874631635163877,117.63088781183416,COMPLETE
514,0.35573717951774597,2023-09-04 22:01:36.032169,2023-09-04 22:01:36.524351,0 days 00:00:00.492182,Leaky,Tanh,Leaky,,27,23,18.0,14.0,,0.019512236964951944,3,443,0.5220398455069544,0.00013622792531612957,128.31452296330377,COMPLETE
515,0.3174359202384949,2023-09-04 22:01:36.524753,2023-09-04 22:01:37.641210,0 days 00:00:01.116457,Leaky,Tanh,Leaky,,23,24,20.0,19.0,,0.003901192010051857,3,224,0.607033626200368,0.00011742032185724112,110.66675318842348,COMPLETE
516,0.38642358779907227,2023-09-04 22:01:37.641560,2023-09-04 22:01:42.356066,0 days 00:00:04.714506,Leaky,Tanh,Leaky,,20,23,19.0,15.0,,2.9097814592967488e-05,3,352,0.31744655113389164,0.00016791647898469365,116.8081364848397,COMPLETE
517,0.34030354022979736,2023-09-04 22:01:42.356433,2023-09-04 22:01:42.784477,0 days 00:00:00.428044,Leaky,Tanh,ReLU,,30,23,17.0,18.0,,0.008858220955875264,3,216,0.4014625992345455,0.00012617024717541977,117.21142135127899,COMPLETE
518,0.36701637506484985,2023-09-04 22:01:42.784826,2023-09-04 22:01:43.524253,0 days 00:00:00.739427,Leaky,Tanh,Leaky,,25,24,19.0,19.0,,0.0065873627055768255,3,340,0.7976068851954622,0.0006409146252804067,106.552429492657,COMPLETE
519,0.35207733511924744,2023-09-04 22:01:43.524630,2023-09-04 22:01:44.866203,0 days 00:00:01.341573,Leaky,ReLU,Leaky,,20,23,19.0,13.0,,0.001994424510186546,3,194,0.6527998242523465,3.5985856548862134e-05,113.19115339006696,COMPLETE
520,0.40859752893447876,2023-09-04 22:01:44.866556,2023-09-04 22:01:45.397652,0 days 00:00:00.531096,Tanh,ReLU,ReLU,Tanh,21,23,7.0,20.0,18.0,0.03276594236036282,4,293,0.7647888136113039,0.000242340126461661,187.8125822884696,COMPLETE
521,0.31083011627197266,2023-09-04 22:01:45.398022,2023-09-04 22:01:46.078106,0 days 00:00:00.680084,Leaky,,,,67,22,,,,0.01199108103200071,1,495,0.7421714972833933,9.527282484260092e-05,113.32463132418118,COMPLETE
522,0.3614577353000641,2023-09-04 22:01:46.078441,2023-09-04 22:01:49.208754,0 days 00:00:03.130313,Tanh,Tanh,Leaky,,23,24,18.0,17.0,,0.00013599203337823107,3,202,0.426416866589896,0.0001968700998234474,107.77414276576278,COMPLETE
523,0.4445604979991913,2023-09-04 22:01:49.209126,2023-09-04 22:01:51.093840,0 days 00:00:01.884714,Tanh,,,,34,22,,,,4.148029232471665e-05,1,409,0.24093371396615867,5.28660299547177e-05,116.63749284441138,COMPLETE
524,0.31138327717781067,2023-09-04 22:01:51.094169,2023-09-04 22:01:51.485627,0 days 00:00:00.391458,Tanh,ReLU,Leaky,,37,20,18.0,15.0,,0.014950496585958001,3,164,0.5022771816764221,0.00010715966779597995,129.98233795166016,COMPLETE
525,0.3560391664505005,2023-09-04 22:01:51.486013,2023-09-04 22:01:51.946478,0 days 00:00:00.460465,Tanh,ReLU,Tanh,,19,21,20.0,18.0,,0.02350200009734921,3,175,0.5645719097090931,0.00014968135698604194,94.04256798239315,COMPLETE
526,0.38620898127555847,2023-09-04 22:01:51.946867,2023-09-04 22:01:52.514313,0 days 00:00:00.567446,Tanh,Tanh,ReLU,Tanh,25,23,10.0,16.0,2.0,0.043100366184505655,4,134,0.5476011879432441,0.0007314966378305994,116.54082743326823,COMPLETE
527,0.34350311756134033,2023-09-04 22:01:52.514708,2023-09-04 22:01:52.932367,0 days 00:00:00.417659,Tanh,,,,22,22,,,,0.01660125089736919,1,147,0.5803405994702551,3.087751544991901e-05,102.19002645987051,COMPLETE
528,0.3273395597934723,2023-09-04 22:01:52.932697,2023-09-04 22:01:54.231205,0 days 00:00:01.298508,Sigmoid,Sigmoid,Leaky,,39,21,5.0,21.0,,0.005377682782242555,3,155,0.6751300599616796,7.533645224415891e-05,95.86998386383057,COMPLETE
529,0.3242490887641907,2023-09-04 22:01:54.231599,2023-09-04 22:01:54.696787,0 days 00:00:00.465188,Tanh,Leaky,,,18,20,19.0,,,0.010369728508437252,2,62,0.46670736637332627,2.1730658820974657e-05,2347.753016153971,COMPLETE
530,0.35238462686538696,2023-09-04 22:01:54.697134,2023-09-04 22:01:56.504091,0 days 00:00:01.806957,Tanh,ReLU,Leaky,,59,19,17.0,10.0,,9.185338398016374e-05,3,125,0.7989678925030439,4.3204088803032746e-05,95.44684649658203,COMPLETE
531,0.3417375087738037,2023-09-04 22:01:56.504582,2023-09-04 22:01:59.175013,0 days 00:00:02.670431,Tanh,Sigmoid,Sigmoid,Leaky,75,21,9.0,21.0,11.0,0.0002346855157938156,4,207,0.7635721931785766,0.00013504045539531093,173.05705898856195,COMPLETE
532,0.2977501451969147,2023-09-04 22:01:59.175375,2023-09-04 22:01:59.567917,0 days 00:00:00.392542,Leaky,,,,55,22,,,,0.020554057282054325,1,224,0.7262576984851229,6.244323497777935e-05,111.51714442326472,COMPLETE
533,0.29588213562965393,2023-09-04 22:01:59.568377,2023-09-04 22:02:00.099769,0 days 00:00:00.531392,Tanh,Sigmoid,,,45,23,11.0,,,0.026373872810060376,2,376,0.7998965236105673,0.0002747271916874169,85.14773319789342,COMPLETE
534,0.293965220451355,2023-09-04 22:02:00.100131,2023-09-04 22:02:01.082049,0 days 00:00:00.981918,Tanh,Tanh,,,20,20,6.0,,,0.0046582881569117085,2,171,0.7435973033518193,0.00037233079249602186,97.95845403426733,COMPLETE
535,0.31481412053108215,2023-09-04 22:02:01.082411,2023-09-04 22:02:01.803311,0 days 00:00:00.720900,ReLU,Sigmoid,,,27,24,20.0,,,0.007680127826922548,2,216,0.48624155235038385,3.7338957206179324e-05,101.57364023648776,COMPLETE
536,0.346701055765152,2023-09-04 22:02:01.803656,2023-09-04 22:02:03.497911,0 days 00:00:01.694255,Tanh,ReLU,ReLU,,36,21,8.0,7.0,,0.00037277801361087365,3,104,0.6393994177958152,0.0001643626394394422,99.11214131575365,COMPLETE
537,0.3556622266769409,2023-09-04 22:02:03.498253,2023-09-04 22:02:04.055357,0 days 00:00:00.557104,Tanh,,,,16,12,,,,0.01273992937527637,1,154,0.5763152630195205,0.0021245455781046655,150.6704038422683,COMPLETE
538,0.35859414935112,2023-09-04 22:02:04.055676,2023-09-04 22:02:08.098477,0 days 00:00:04.042801,Tanh,Sigmoid,Leaky,Tanh,22,10,5.0,2.0,16.0,0.00042315829568987035,4,446,0.2875630439965443,0.0002128436199547844,532.2965552457579,COMPLETE
539,0.4580925405025482,2023-09-04 22:02:08.098850,2023-09-04 22:02:08.793595,0 days 00:00:00.694745,Tanh,Sigmoid,,,41,20,15.0,,,0.00029449402533967205,2,50,0.6879162122372745,5.271695450624162e-05,95.73241912841797,COMPLETE
540,0.3331458866596222,2023-09-04 22:02:08.793943,2023-09-04 22:02:09.501055,0 days 00:00:00.707112,Tanh,ReLU,,,19,16,16.0,,,0.03552220770141713,2,143,0.7733464968155842,0.0009080101771423185,95.59403198242188,COMPLETE
541,0.42090004682540894,2023-09-04 22:02:09.501512,2023-09-04 22:02:11.305303,0 days 00:00:01.803791,Sigmoid,Sigmoid,Leaky,,24,22,2.0,20.0,,0.0007824886671306829,3,114,0.4393042738953784,1.634495800838433e-05,122.98212011236893,COMPLETE
542,0.31522318720817566,2023-09-04 22:02:11.305659,2023-09-04 22:02:12.677910,0 days 00:00:01.372251,Tanh,Tanh,,,17,21,4.0,,,0.0029284701083163735,2,163,0.7220802049778925,0.00010462459549360761,85.6992540359497,COMPLETE
543,0.29197201132774353,2023-09-04 22:02:12.678463,2023-09-04 22:02:13.892135,0 days 00:00:01.213672,Tanh,,,,38,22,,,,0.002396397564380009,1,95,0.7711367462388283,0.001376015503065719,93.4231914763755,COMPLETE
544,0.32692939043045044,2023-09-04 22:02:13.892471,2023-09-04 22:02:14.348478,0 days 00:00:00.456007,ReLU,Sigmoid,,,32,19,9.0,,,0.06648361359174712,2,138,0.7080369285613871,8.878153793400615e-05,94.67994506835937,COMPLETE
545,0.3279920518398285,2023-09-04 22:02:14.348823,2023-09-04 22:02:15.537494,0 days 00:00:01.188671,Tanh,ReLU,Leaky,Tanh,21,15,7.0,5.0,24.0,0.0490836974779082,4,186,0.7488877834966143,2.4984733108402794e-05,107.12075019605231,COMPLETE
546,0.3195221722126007,2023-09-04 22:02:15.537882,2023-09-04 22:02:19.850497,0 days 00:00:04.312615,Tanh,Sigmoid,ReLU,,34,23,10.0,3.0,,0.00889790779390569,3,129,0.6758123269227735,0.0005365621658599297,110.28808848063152,COMPLETE
547,0.30497950315475464,2023-09-04 22:02:19.851122,2023-09-04 22:02:22.777833,0 days 00:00:02.926711,Tanh,Sigmoid,,,16,21,3.0,,,0.01807536075045042,2,230,0.7714823744882783,7.200451958212769e-05,110.40330480760143,COMPLETE
548,0.3979923129081726,2023-09-04 22:02:22.778429,2023-09-04 22:02:23.333643,0 days 00:00:00.555214,Leaky,,,,18,20,,,,0.027227721829466315,1,65,0.26247343893470676,1.3602866717018042e-05,699.9216807972301,COMPLETE
549,0.4044032394886017,2023-09-04 22:02:23.334231,2023-09-04 22:02:26.594651,0 days 00:00:03.260420,Tanh,Sigmoid,Leaky,,28,24,4.0,19.0,,0.0006634859963701695,3,76,0.45541274163335427,0.023316612363489295,112.8571827537135,COMPLETE
550,0.43637996912002563,2023-09-04 22:02:26.595362,2023-09-04 22:02:27.222824,0 days 00:00:00.627462,Tanh,Tanh,,,23,21,5.0,,,0.006386846446302317,2,281,0.2446939088738185,2.755484437372567e-05,111.14530247279576,COMPLETE
551,0.297956258058548,2023-09-04 22:02:27.223189,2023-09-04 22:02:29.783856,0 days 00:00:02.560667,Tanh,ReLU,,,20,6,18.0,,,0.001139526547045041,2,107,0.7347472478013688,2.084841293153256e-05,107.18256863032546,COMPLETE
552,0.34377261996269226,2023-09-04 22:02:29.784220,2023-09-04 22:02:30.889060,0 days 00:00:01.104840,ReLU,Sigmoid,Tanh,,26,22,12.0,11.0,,0.00036264905097281667,3,150,0.21264351922921437,4.7167695173144355e-05,126.9891687520345,COMPLETE
553,0.8086500763893127,2023-09-04 22:02:30.889420,2023-09-04 22:02:31.985428,0 days 00:00:01.096008,Tanh,Sigmoid,,,43,18,6.0,,,2.1215721950618942e-05,2,172,0.33329601368251655,0.007937624466532494,116.92208986504133,COMPLETE
554,0.31612908840179443,2023-09-04 22:02:31.985788,2023-09-04 22:02:33.101339,0 days 00:00:01.115551,Tanh,Leaky,Leaky,Tanh,15,20,15.0,16.0,15.0,0.021755932893853094,4,199,0.6149857541814722,0.00013088575426784257,114.93855048870218,COMPLETE
555,0.3444732427597046,2023-09-04 22:02:33.101752,2023-09-04 22:02:33.813165,0 days 00:00:00.711413,Sigmoid,ReLU,,,100,13,13.0,,,0.013026154799050999,2,121,0.7059775331146635,6.698073406430493e-05,107.51664176683748,COMPLETE
556,0.3307047188282013,2023-09-04 22:02:33.813523,2023-09-04 22:02:34.172903,0 days 00:00:00.359380,Tanh,,,,30,11,,,,0.03050472103004577,1,160,0.7987765955971337,3.554466010791788e-05,109.21708471124822,COMPLETE
557,0.32805871963500977,2023-09-04 22:02:34.173233,2023-09-04 22:02:34.555224,0 days 00:00:00.381991,Tanh,Sigmoid,,,40,16,9.0,,,0.010977717627104831,2,59,0.28230193590524505,0.0001960255002186204,113.5929636551162,COMPLETE
558,0.3114861845970154,2023-09-04 22:02:34.555563,2023-09-04 22:02:35.151780,0 days 00:00:00.596217,Tanh,Tanh,ReLU,,37,21,8.0,22.0,,0.03845328291008789,3,399,0.746789546941396,1.634446362484667e-05,102.83232584307271,COMPLETE
559,0.34492620825767517,2023-09-04 22:02:35.152153,2023-09-04 22:02:37.440886,0 days 00:00:02.288733,Tanh,Sigmoid,,,21,19,1.0,,,0.0014113624508161795,2,93,0.799444135157397,0.0003411868123707124,121.83344367242628,COMPLETE
560,0.3454504609107971,2023-09-04 22:02:37.441234,2023-09-04 22:02:38.161478,0 days 00:00:00.720244,Tanh,ReLU,Leaky,Tanh,18,15,19.0,2.0,12.0,0.004183737874235273,4,215,0.385341595625375,5.76378558004245e-05,147.22848420984604,COMPLETE
561,0.3289893865585327,2023-09-04 22:02:38.161837,2023-09-04 22:02:38.537853,0 days 00:00:00.376016,Leaky,,,,62,22,,,,0.014482901006312792,1,83,0.6556426571720451,0.0004963991329418795,95.72094472249348,COMPLETE
562,0.29987120628356934,2023-09-04 22:02:38.538170,2023-09-04 22:02:40.824360,0 days 00:00:02.286190,Tanh,Sigmoid,,,23,23,14.0,,,0.0017223684332194889,2,101,0.7659670288005866,7.999701667371231e-05,102.75614407983157,COMPLETE
563,0.35419562458992004,2023-09-04 22:02:40.824709,2023-09-04 22:02:41.194853,0 days 00:00:00.370144,ReLU,Sigmoid,Sigmoid,,35,20,17.0,14.0,,0.017895382094800724,3,73,0.3032313107917362,0.00011072347819912962,106.91930352187738,COMPLETE
564,0.3193223178386688,2023-09-04 22:02:41.195188,2023-09-04 22:02:41.696116,0 days 00:00:00.500928,Tanh,Tanh,,,70,24,11.0,,,0.00914693402655635,2,315,0.4811161847325571,1.1928211910186913e-05,98.85809796477017,COMPLETE
565,0.31125715374946594,2023-09-04 22:02:41.696462,2023-09-04 22:02:42.311388,0 days 00:00:00.614926,Tanh,Sigmoid,,,14,21,24.0,,,0.02307169379884135,2,147,0.718861898801559,0.00016153601500280796,93.9407713148329,COMPLETE
566,0.4002460241317749,2023-09-04 22:02:42.311715,2023-09-04 22:02:43.443269,0 days 00:00:01.131554,Tanh,,,,20,23,,,,0.0048709171504739465,1,244,0.6911845281169228,0.00024894385418559276,124.93461916523594,COMPLETE
567,0.30881553888320923,2023-09-04 22:02:43.443664,2023-09-04 22:02:44.114115,0 days 00:00:00.670451,Tanh,ReLU,Leaky,,39,22,20.0,1.0,,0.007843484154178435,3,230,0.7394280326020144,4.2248497013525394e-05,103.90793100992839,COMPLETE
568,0.3210000991821289,2023-09-04 22:02:44.114481,2023-09-04 22:02:46.506180,0 days 00:00:02.391699,Sigmoid,Sigmoid,,,16,12,18.0,,,0.0034608072983892727,2,179,0.7582407290370557,1.005384536907621e-05,94.88314380645753,COMPLETE
569,0.31233900785446167,2023-09-04 22:02:46.506551,2023-09-04 22:02:46.924452,0 days 00:00:00.417901,Tanh,Sigmoid,,,51,15,6.0,,,0.03141083211693784,2,116,0.5885160087126828,2.0366095081240523e-05,121.84387461344402,COMPLETE
570,0.3621639013290405,2023-09-04 22:02:46.924803,2023-09-04 22:02:47.173795,0 days 00:00:00.248992,Tanh,ReLU,Leaky,Leaky,25,21,15.0,6.0,20.0,0.006806414312874816,4,163,0.12794517546795767,1.447204902336039e-05,150.9822568026456,COMPLETE
571,0.2811197340488434,2023-09-04 22:02:47.174200,2023-09-04 22:02:48.519517,0 days 00:00:01.345317,ReLU,Sigmoid,ReLU,,18,14,10.0,19.0,,0.01431805644550055,3,92,0.7075719795778597,2.828312499652764e-05,262.5861620221819,COMPLETE
572,0.3519381284713745,2023-09-04 22:02:48.519889,2023-09-04 22:02:49.064379,0 days 00:00:00.544490,ReLU,Tanh,ReLU,,13,13,10.0,19.0,,0.016186304045115736,3,89,0.25537991821557987,3.0356604045707966e-05,104.41603065259528,COMPLETE
