number,value,datetime_start,datetime_complete,duration,params_activation1,params_activation2,params_activation3,params_activation4,params_batch_size,params_fl1,params_fl2,params_fl3,params_fl4,params_learning_rate,params_n_layers,params_num_epochs,params_train_size,params_weight_decay,user_attrs_mre,state
982,0.2945067286491394,2023-09-04 22:23:48.730135,2023-09-04 22:23:49.416183,0 days 00:00:00.686048,Tanh,Leaky,ReLU,Leaky,87,20,22.0,23.0,19.0,0.003933520885035523,4,238,0.40934124455732707,0.00014735281538784436,107.53056901224544,COMPLETE
983,0.4250204265117645,2023-09-04 22:23:49.416607,2023-09-04 22:23:51.241483,0 days 00:00:01.824876,Tanh,Leaky,ReLU,Leaky,33,18,21.0,23.0,21.0,0.00011779885171534632,4,212,0.2579335777008235,0.00021997319634541797,118.72292846103885,COMPLETE
984,0.7291690707206726,2023-09-04 22:23:51.241909,2023-09-04 22:23:51.866419,0 days 00:00:00.624510,Tanh,Leaky,ReLU,Leaky,81,12,21.0,22.0,20.0,0.00019383751835975698,4,253,0.10534071662453424,0.00017060567730940593,407.47632016871756,COMPLETE
985,0.2716836929321289,2023-09-04 22:23:51.867052,2023-09-04 22:23:52.710157,0 days 00:00:00.843105,Tanh,Leaky,ReLU,Leaky,84,19,24.0,23.0,18.0,0.0015778955046133537,4,235,0.7368143725086106,0.00012269064658788578,138.3258662223816,COMPLETE
986,0.24154557287693024,2023-09-04 22:23:52.710581,2023-09-04 22:23:53.241728,0 days 00:00:00.531147,Tanh,Leaky,ReLU,Leaky,79,19,22.0,22.0,19.0,0.0045073534706911176,4,227,0.7489885954287334,0.0003743541171118534,118.94782504519901,COMPLETE
987,0.47090834379196167,2023-09-04 22:23:53.242163,2023-09-04 22:23:53.939635,0 days 00:00:00.697472,Sigmoid,Leaky,ReLU,Leaky,41,20,19.0,23.0,18.0,0.03798466033876464,4,243,0.7170178363858614,0.0013935962917229216,184.9907684326172,COMPLETE
988,0.41303277015686035,2023-09-04 22:23:53.940098,2023-09-04 22:23:54.444729,0 days 00:00:00.504631,Tanh,,,,31,17,,,,0.014274198343307492,1,217,0.468388236145382,0.00029732359546023304,144.59706160601448,COMPLETE
989,0.18791264295578003,2023-09-04 22:23:54.445149,2023-09-04 22:23:55.140812,0 days 00:00:00.695663,ReLU,Leaky,ReLU,Leaky,85,16,20.0,23.0,19.0,0.009827459347866408,4,209,0.7562475516283224,0.00010479946514787003,83.56206814747937,COMPLETE
990,0.2728285491466522,2023-09-04 22:23:55.141240,2023-09-04 22:23:56.283948,0 days 00:00:01.142708,ReLU,Leaky,ReLU,Leaky,31,16,20.0,23.0,19.0,0.008910739296772097,4,203,0.7722312199177405,0.00011274648174820396,262.18992505754744,COMPLETE
991,0.4879308342933655,2023-09-04 22:23:56.284465,2023-09-04 22:23:56.486628,0 days 00:00:00.202163,ReLU,Leaky,ReLU,Leaky,33,17,20.0,23.0,18.0,0.009783776677777483,4,209,0.11934046202914993,8.914603524830082e-05,143.23072899712457,COMPLETE
992,0.3831058740615845,2023-09-04 22:23:56.487070,2023-09-04 22:23:57.018455,0 days 00:00:00.531385,ReLU,Leaky,ReLU,Leaky,87,17,7.0,22.0,20.0,0.011514870536403423,4,222,0.7995610772517348,0.00013164463452150954,172.31220626831055,COMPLETE
993,0.3712938129901886,2023-09-04 22:23:57.018878,2023-09-04 22:23:57.197350,0 days 00:00:00.178472,ReLU,Leaky,ReLU,Leaky,85,16,20.0,21.0,20.0,0.013094506810500625,4,205,0.14420203658632166,0.00010416614189372316,99.60928691517223,COMPLETE
994,0.3892248272895813,2023-09-04 22:23:57.197764,2023-09-04 22:23:58.801984,0 days 00:00:01.604220,ReLU,Leaky,ReLU,Leaky,88,16,10.0,23.0,19.0,0.0004746117391530838,4,210,0.7537656773179844,0.00016051981676857614,110.55234809543775,COMPLETE
995,0.37515565752983093,2023-09-04 22:23:58.802398,2023-09-04 22:23:59.092979,0 days 00:00:00.290581,ReLU,ReLU,ReLU,Leaky,85,18,20.0,22.0,19.0,0.009936479083762492,4,215,0.3224791827168848,8.95343670275551e-05,95.63303602063978,COMPLETE
996,0.3298932611942291,2023-09-04 22:23:59.093447,2023-09-04 22:24:00.081970,0 days 00:00:00.988523,ReLU,Leaky,ReLU,Leaky,34,17,19.0,23.0,18.0,0.016264711736784777,4,222,0.7440300910698604,0.0001565096029341642,110.57589206180057,COMPLETE
997,0.31244775652885437,2023-09-04 22:24:00.082414,2023-09-04 22:24:00.535990,0 days 00:00:00.453576,ReLU,Leaky,ReLU,Leaky,83,16,20.0,12.0,21.0,0.013567351218525835,4,229,0.7116445316728119,0.00011998569071463476,210.90106987230706,COMPLETE
998,0.3482215106487274,2023-09-04 22:24:00.536472,2023-09-04 22:24:01.466572,0 days 00:00:00.930100,ReLU,Leaky,ReLU,Leaky,91,16,19.0,24.0,19.0,0.0012028567901963667,4,216,0.35449563432394054,0.0001030076220404267,91.8271751157699,COMPLETE
999,0.4481993615627289,2023-09-04 22:24:01.467033,2023-09-04 22:24:01.869360,0 days 00:00:00.402327,ReLU,Leaky,ReLU,Leaky,86,18,20.0,23.0,20.0,0.0008760031973443741,4,200,0.18564976058045587,7.735598788602726e-05,117.99998147147042,COMPLETE
1000,0.315143346786499,2023-09-04 22:24:01.869804,2023-09-04 22:24:02.285969,0 days 00:00:00.416165,ReLU,Leaky,ReLU,Leaky,83,18,19.0,22.0,22.0,0.007427605482810783,4,235,0.7699024987442287,0.00013948027312411925,119.74642690022786,COMPLETE
1001,0.4686044752597809,2023-09-04 22:24:02.286381,2023-09-04 22:24:03.455280,0 days 00:00:01.168899,ReLU,Leaky,ReLU,Leaky,82,15,20.0,23.0,19.0,0.00015213099397109905,4,225,0.29239416191523687,0.00019283495254912377,380.1640178087023,COMPLETE
1002,0.42516854405403137,2023-09-04 22:24:03.455707,2023-09-04 22:24:03.962239,0 days 00:00:00.506532,Sigmoid,Leaky,ReLU,Leaky,85,19,20.0,24.0,18.0,0.011279249605210647,4,213,0.1146591895001993,0.00010562460064138056,158.27784844893444,COMPLETE
1003,0.3540725111961365,2023-09-04 22:24:03.963000,2023-09-04 22:24:04.359615,0 days 00:00:00.396615,ReLU,Leaky,ReLU,Leaky,89,15,21.0,23.0,20.0,0.00820426067430448,4,230,0.2827001784472376,1.8541571973365803e-05,121.5031660848589,COMPLETE
1004,0.2979367673397064,2023-09-04 22:24:04.360070,2023-09-04 22:24:04.989328,0 days 00:00:00.629258,ReLU,Leaky,ReLU,Leaky,87,20,20.0,22.0,18.0,0.006216186211994756,4,245,0.7247000315571791,0.00016353733114422657,157.76625107745735,COMPLETE
1005,0.39334267377853394,2023-09-04 22:24:04.989770,2023-09-04 22:24:05.442179,0 days 00:00:00.452409,ReLU,Leaky,ReLU,Leaky,81,19,19.0,24.0,18.0,0.017798299407687145,4,221,0.7708439970603724,0.04438392592430292,161.4189338684082,COMPLETE
1006,0.3406383693218231,2023-09-04 22:24:05.442632,2023-09-04 22:24:05.714169,0 days 00:00:00.271537,ReLU,ReLU,ReLU,Leaky,35,18,21.0,12.0,19.0,0.015432126247069885,4,256,0.1970958917120248,1.3617648973451106e-05,126.90354347229004,COMPLETE
1007,0.6691011190414429,2023-09-04 22:24:05.714684,2023-09-04 22:24:06.636705,0 days 00:00:00.922021,ReLU,Leaky,,,84,17,19.0,,,0.00011237657285709849,2,237,0.3016701243530088,0.0002058585470315972,122.85640916140271,COMPLETE
1008,0.8288700580596924,2023-09-04 22:24:06.637164,2023-09-04 22:24:11.658406,0 days 00:00:05.021242,Sigmoid,Leaky,ReLU,Leaky,31,15,20.0,23.0,18.0,1.1389055424411655e-05,4,205,0.7539331119355424,0.00013455605384846324,103.78438047083412,COMPLETE
1009,0.20411023497581482,2023-09-04 22:24:11.658869,2023-09-04 22:24:12.894428,0 days 00:00:01.235559,ReLU,Leaky,ReLU,Leaky,29,18,20.0,24.0,19.0,0.02427414083302871,4,246,0.7996270261353573,7.00549041609867e-05,99.13451595306397,COMPLETE
1010,0.431481271982193,2023-09-04 22:24:12.894898,2023-09-04 22:24:13.607769,0 days 00:00:00.712871,Sigmoid,Leaky,ReLU,Leaky,29,18,19.0,24.0,20.0,0.029475654561335846,4,247,0.7996042327052156,7.037682524743986e-05,145.4908629707668,COMPLETE
1011,0.29694637656211853,2023-09-04 22:24:13.608268,2023-09-04 22:24:21.356062,0 days 00:00:07.747794,ReLU,Leaky,ReLU,Leaky,30,18,20.0,24.0,19.0,5.228342989458657e-05,4,258,0.7737740013926492,8.340497385920429e-05,97.79329205298609,COMPLETE
1012,0.3175334930419922,2023-09-04 22:24:21.356482,2023-09-04 22:24:23.392962,0 days 00:00:02.036480,Sigmoid,Leaky,ReLU,Leaky,29,17,19.0,24.0,19.0,0.025072481220692777,4,61,0.797869900101842,7.091713149341015e-05,872.6356300685717,COMPLETE
1013,0.4685790538787842,2023-09-04 22:24:23.393419,2023-09-04 22:24:24.152008,0 days 00:00:00.758589,Sigmoid,Leaky,ReLU,Leaky,26,18,19.0,24.0,20.0,0.029772413465777636,4,252,0.426333587535716,8.841443274689828e-05,197.71820224859775,COMPLETE
1014,0.28471839427948,2023-09-04 22:24:24.152468,2023-09-04 22:24:24.860737,0 days 00:00:00.708269,ReLU,Leaky,ReLU,Leaky,29,17,20.0,24.0,19.0,0.02298046046640003,4,240,0.7998948627958311,0.00010448824044331891,136.2662858508882,COMPLETE
1015,0.3888343870639801,2023-09-04 22:24:24.861257,2023-09-04 22:24:28.905355,0 days 00:00:04.044098,Sigmoid,Leaky,ReLU,Leaky,32,18,20.0,24.0,19.0,0.0002939223244599079,4,263,0.7484521958038085,0.00012021098168989228,201.49384088453903,COMPLETE
1016,0.4919266104698181,2023-09-04 22:24:28.905804,2023-09-04 22:24:35.568995,0 days 00:00:06.663191,ReLU,Leaky,ReLU,Leaky,28,18,20.0,24.0,20.0,6.95462601019337e-05,4,245,0.7690712514310565,6.117877256373591e-05,119.73767289142219,COMPLETE
1017,0.35577866435050964,2023-09-04 22:24:35.569423,2023-09-04 22:24:36.649112,0 days 00:00:01.079689,Sigmoid,Leaky,ReLU,Leaky,34,17,19.0,13.0,19.0,0.020933310287539184,4,233,0.74705121435349,7.741844110928581e-05,109.31550207803416,COMPLETE
1018,0.3214588165283203,2023-09-04 22:24:36.649580,2023-09-04 22:24:37.411808,0 days 00:00:00.762228,Tanh,Leaky,ReLU,Leaky,29,19,20.0,24.0,19.0,0.017867348270842055,4,253,0.3105709676824192,0.00023171769879506263,121.83111090409129,COMPLETE
1019,0.4494231343269348,2023-09-04 22:24:37.412253,2023-09-04 22:24:37.616305,0 days 00:00:00.204052,Tanh,ReLU,ReLU,Leaky,33,18,20.0,11.0,18.0,0.02576405502410928,4,237,0.1358878387637629,9.837277307679195e-05,95.14675998687744,COMPLETE
1020,0.35509929060935974,2023-09-04 22:24:37.616742,2023-09-04 22:24:39.966690,0 days 00:00:02.349948,ReLU,Leaky,ReLU,Leaky,31,19,19.0,24.0,20.0,0.044284003628968435,4,228,0.7742622696728441,0.0017980626024706077,137.39406226663027,COMPLETE
1021,0.37412911653518677,2023-09-04 22:24:39.967144,2023-09-04 22:24:40.343073,0 days 00:00:00.375929,Tanh,Leaky,ReLU,Leaky,32,19,20.0,23.0,18.0,0.0385766403212727,4,244,0.4160466266467613,6.346364516418992e-05,103.19521026611328,COMPLETE
1022,0.4804548919200897,2023-09-04 22:24:40.343764,2023-09-04 22:24:40.719200,0 days 00:00:00.375436,Sigmoid,Leaky,ReLU,Leaky,80,18,18.0,24.0,21.0,0.09868041529136441,4,262,0.7078113077912848,0.00017300525241407274,145.6275774637858,COMPLETE
1023,0.48219427466392517,2023-09-04 22:24:40.719677,2023-09-04 22:24:40.938077,0 days 00:00:00.218400,Tanh,Leaky,ReLU,Leaky,27,17,19.0,23.0,18.0,0.01988055284580445,4,224,0.10816039413147233,0.0002472693237837324,178.80719111515924,COMPLETE
1024,0.3375861942768097,2023-09-04 22:24:40.938495,2023-09-04 22:24:41.475215,0 days 00:00:00.536720,Tanh,Leaky,ReLU,Leaky,86,19,19.0,14.0,19.0,0.05759841175851413,4,249,0.7414223687828787,7.387370909280628e-05,123.05474760474229,COMPLETE
1025,0.32404738664627075,2023-09-04 22:24:41.475682,2023-09-04 22:24:42.354020,0 days 00:00:00.878338,Tanh,Leaky,ReLU,Leaky,30,18,20.0,15.0,17.0,0.012436361673318122,4,235,0.5366422037806668,0.0001415077454057016,112.95586200093113,COMPLETE
1026,1.125099778175354,2023-09-04 22:24:42.354456,2023-09-04 22:24:43.278420,0 days 00:00:00.923964,ReLU,Leaky,Leaky,Leaky,83,21,20.0,21.0,19.0,1.0288826181114948e-05,4,263,0.1687945593223926,2.788840793481934e-05,107.31360362237851,COMPLETE
1027,0.46701914072036743,2023-09-04 22:24:43.278896,2023-09-04 22:24:43.487388,0 days 00:00:00.208492,Sigmoid,Leaky,ReLU,Leaky,89,19,21.0,24.0,20.0,0.03207959930699748,4,218,0.19991619759720303,5.285765346790314e-05,345.1160538617302,COMPLETE
1028,0.32471898198127747,2023-09-04 22:24:43.487860,2023-09-04 22:24:47.456217,0 days 00:00:03.968357,Tanh,Leaky,ReLU,Leaky,82,16,20.0,15.0,18.0,0.0002627082217032522,4,243,0.767412597901585,0.00018081180578111215,116.3039205624507,COMPLETE
1029,0.46069496870040894,2023-09-04 22:24:47.456644,2023-09-04 22:24:47.681372,0 days 00:00:00.224728,Tanh,Leaky,ReLU,Leaky,85,20,21.0,23.0,17.0,0.015972727119499784,4,228,0.22700173743843582,8.861113065695879e-05,359.15553332913305,COMPLETE
1030,0.3356046676635742,2023-09-04 22:24:47.681866,2023-09-04 22:24:48.629421,0 days 00:00:00.947555,Sigmoid,Leaky,ReLU,Leaky,36,21,20.0,23.0,19.0,0.024130160239480575,4,255,0.7286920879480787,0.00020536939301122285,121.15951283772786,COMPLETE
1031,0.35512736439704895,2023-09-04 22:24:48.629970,2023-09-04 22:24:49.188484,0 days 00:00:00.558514,Tanh,ReLU,ReLU,Leaky,80,22,19.0,22.0,24.0,0.013816494460350654,4,241,0.38065923262172996,0.00011583415070974636,116.55774758078836,COMPLETE
1032,0.9412643313407898,2023-09-04 22:24:49.189302,2023-09-04 22:24:54.077429,0 days 00:00:04.888127,ReLU,Leaky,Leaky,Tanh,87,18,21.0,13.0,17.0,1.8911031278144407e-05,4,211,0.4912547200088817,0.000145222501380492,118.05746901091806,COMPLETE
1033,0.3651087284088135,2023-09-04 22:24:54.078253,2023-09-04 22:24:55.157368,0 days 00:00:01.079115,Tanh,Leaky,ReLU,Leaky,83,19,19.0,20.0,18.0,0.018375219810425752,4,233,0.34338986849495895,0.0031937125210739336,123.86105935615406,COMPLETE
1034,0.5837805867195129,2023-09-04 22:24:55.158181,2023-09-04 22:24:56.092475,0 days 00:00:00.934294,Tanh,Leaky,ReLU,Leaky,85,20,1.0,14.0,20.0,0.010537554904588981,4,221,0.5116687659431304,5.9567706163070544e-05,199.69129514694214,COMPLETE
1035,0.40155044198036194,2023-09-04 22:24:56.093290,2023-09-04 22:24:59.460343,0 days 00:00:03.367053,Sigmoid,Leaky,Sigmoid,Leaky,81,20,20.0,24.0,19.0,0.0006561891210367586,4,252,0.7999505703657388,0.0002505992664939691,128.82285553688226,COMPLETE
1036,0.6216994524002075,2023-09-04 22:24:59.460788,2023-09-04 22:24:59.595388,0 days 00:00:00.134600,Tanh,Leaky,Sigmoid,Leaky,90,18,20.0,15.0,5.0,0.01509512853776076,4,266,0.17146853633780645,0.03199852348849338,97.27265866597493,COMPLETE
1037,0.46340012550354004,2023-09-04 22:24:59.595838,2023-09-04 22:24:59.948611,0 days 00:00:00.352773,ReLU,Leaky,Sigmoid,Leaky,31,17,21.0,12.0,18.0,0.011959626586853709,4,233,0.2606674239228185,4.3410293169541086e-05,157.18951585557727,COMPLETE
1038,0.5194862484931946,2023-09-04 22:24:59.949050,2023-09-04 22:25:00.139933,0 days 00:00:00.190883,Tanh,Leaky,ReLU,Leaky,87,15,12.0,16.0,3.0,0.020328864238615678,4,246,0.1637994899549942,9.716507234535385e-05,151.4732744693756,COMPLETE
1039,0.6764490008354187,2023-09-04 22:25:00.140365,2023-09-04 22:25:00.394780,0 days 00:00:00.254415,Sigmoid,Leaky,Sigmoid,Tanh,79,19,20.0,23.0,21.0,0.02652035673687093,4,285,0.1472221889105679,7.750663242082776e-05,258.30311247018665,COMPLETE
1040,0.38568568229675293,2023-09-04 22:25:00.395233,2023-09-04 22:25:00.961934,0 days 00:00:00.566701,Tanh,Leaky,Sigmoid,Leaky,84,21,19.0,15.0,6.0,0.017521558850285453,4,259,0.7050399264381406,0.004044529583744314,145.55269657481801,COMPLETE
1041,0.9040113687515259,2023-09-04 22:25:00.962381,2023-09-04 22:25:01.185077,0 days 00:00:00.222696,Tanh,Leaky,Sigmoid,Leaky,82,22,21.0,16.0,7.0,7.563239878979335e-05,4,225,0.7499233043342415,0.00016667287554379768,96.17971316250888,COMPLETE
1042,0.3631793260574341,2023-09-04 22:25:01.185508,2023-09-04 22:25:01.375252,0 days 00:00:00.189744,ReLU,Leaky,ReLU,Leaky,85,20,18.0,15.0,20.0,0.03411296756766641,4,211,0.17948898423329263,0.0001977610545564349,88.77204462687175,COMPLETE
1043,0.2851056754589081,2023-09-04 22:25:01.375699,2023-09-04 22:25:02.310943,0 days 00:00:00.935244,Tanh,ReLU,Sigmoid,Leaky,88,18,20.0,22.0,17.0,0.06544020911539049,4,238,0.7738586526719573,0.00027479749696211834,307.6222098379424,COMPLETE
1044,0.5923551321029663,2023-09-04 22:25:02.311377,2023-09-04 22:25:05.254081,0 days 00:00:02.942704,Sigmoid,Leaky,Sigmoid,Leaky,92,19,21.0,24.0,5.0,0.00019757006685235427,4,276,0.7289994973368942,3.331651056046145e-05,191.11532836029494,COMPLETE
1045,0.3061944544315338,2023-09-04 22:25:05.254504,2023-09-04 22:25:06.396703,0 days 00:00:01.142199,Tanh,Leaky,Sigmoid,Leaky,27,21,19.0,14.0,4.0,0.00947191552536726,4,248,0.7999517867928639,0.00012824914992288697,84.08007132040488,COMPLETE
1046,0.4140578806400299,2023-09-04 22:25:06.397210,2023-09-04 22:25:11.497310,0 days 00:00:05.100100,Tanh,Leaky,Sigmoid,Leaky,33,20,19.0,24.0,8.0,0.00013660078795704148,4,217,0.7063400111354846,6.694129914793239e-05,122.8396724929458,COMPLETE
1047,0.3663294315338135,2023-09-04 22:25:11.497825,2023-09-04 22:25:11.767259,0 days 00:00:00.269434,ReLU,Leaky,ReLU,Tanh,83,21,21.0,15.0,19.0,0.014063850889398734,4,258,0.4256875456771718,0.00022439226815286988,114.81503295898438,COMPLETE
1048,0.7971124053001404,2023-09-04 22:25:11.767738,2023-09-04 22:25:14.608412,0 days 00:00:02.840674,Sigmoid,Leaky,Sigmoid,Leaky,81,4,20.0,23.0,6.0,0.00021780656416386452,4,229,0.7534321152624671,0.00015757077920540143,147.37967578604753,COMPLETE
1049,0.3409818410873413,2023-09-04 22:25:14.608865,2023-09-04 22:25:15.156089,0 days 00:00:00.547224,Tanh,Leaky,Leaky,Leaky,65,17,20.0,13.0,18.0,0.02252554558764199,4,268,0.5537454195157006,0.00010492632214584985,114.25545022653979,COMPLETE
1050,0.28969135880470276,2023-09-04 22:25:15.156524,2023-09-04 22:25:21.765147,0 days 00:00:06.608623,Tanh,Leaky,Sigmoid,Leaky,37,19,13.0,16.0,7.0,0.00014924376646980458,4,242,0.7676980816837825,8.493903807130324e-05,1055.9897078123386,COMPLETE
1051,0.9289304614067078,2023-09-04 22:25:21.765964,2023-09-04 22:25:25.026143,0 days 00:00:03.260179,Tanh,Leaky,Sigmoid,Leaky,86,18,21.0,22.0,17.0,5.952740094574933e-05,4,253,0.45407625155425785,0.017535324378173314,99.77110356869905,COMPLETE
1052,0.28219279646873474,2023-09-04 22:25:25.026563,2023-09-04 22:25:26.557808,0 days 00:00:01.531245,Sigmoid,Leaky,Sigmoid,Leaky,79,19,20.0,21.0,18.0,0.01672179898251044,4,225,0.7336820479618164,4.740509149426162e-05,105.72250047818882,COMPLETE
1053,0.31864428520202637,2023-09-04 22:25:26.558259,2023-09-04 22:25:27.497604,0 days 00:00:00.939345,ReLU,Leaky,ReLU,Leaky,35,22,18.0,18.0,19.0,0.012873560204154201,4,206,0.6942870421286669,0.003260694217837604,161.01052547636488,COMPLETE
1054,0.4177866578102112,2023-09-04 22:25:27.498032,2023-09-04 22:25:27.661166,0 days 00:00:00.163134,Tanh,Leaky,,,84,20,19.0,,,0.011328858087705907,2,68,0.11024904870229196,0.0003288782477668871,178.71226768493653,COMPLETE
1055,0.6800859570503235,2023-09-04 22:25:27.661613,2023-09-04 22:25:28.593645,0 days 00:00:00.932032,Tanh,ReLU,Sigmoid,Tanh,88,16,21.0,17.0,1.0,0.0003252747461211896,4,237,0.23730551396538982,0.00019661773822463933,191.79088074245533,COMPLETE
1056,0.364915132522583,2023-09-04 22:25:28.594061,2023-09-04 22:25:28.920074,0 days 00:00:00.326013,Tanh,Leaky,Sigmoid,Leaky,82,21,20.0,11.0,8.0,0.020113294176358053,4,290,0.39455179856511496,0.00025192211040648606,144.4134152730306,COMPLETE
1057,1.0274500846862793,2023-09-04 22:25:28.920506,2023-09-04 22:25:29.425368,0 days 00:00:00.504862,Sigmoid,Leaky,Sigmoid,Leaky,30,22,20.0,24.0,6.0,0.00043924862369875485,4,218,0.7980129422154754,0.07340939714687732,100.94906759262085,COMPLETE
1058,0.26384517550468445,2023-09-04 22:25:29.425797,2023-09-04 22:25:29.949410,0 days 00:00:00.523613,Tanh,Leaky,ReLU,Leaky,84,19,19.0,16.0,2.0,0.01518182413548093,4,244,0.7455555105133205,3.7819688034196624e-05,87.43340321591026,COMPLETE
1059,0.31096357107162476,2023-09-04 22:25:29.949852,2023-09-04 22:25:30.949993,0 days 00:00:01.000141,ReLU,Leaky,Sigmoid,Leaky,86,18,21.0,15.0,7.0,0.009636324584374693,4,265,0.7715681991953387,0.004434509563364338,544.1602382659912,COMPLETE
1060,0.3136105239391327,2023-09-04 22:25:30.950433,2023-09-04 22:25:31.485477,0 days 00:00:00.535044,Tanh,Leaky,Sigmoid,Leaky,90,20,20.0,19.0,5.0,0.02830088713014857,4,278,0.7017761527720416,0.00012913792881245474,159.01143941012296,COMPLETE
1061,0.3173724114894867,2023-09-04 22:25:31.485972,2023-09-04 22:25:32.682058,0 days 00:00:01.196086,Sigmoid,Leaky,Sigmoid,Leaky,81,23,20.0,23.0,6.0,0.022143865153542358,4,229,0.7262551695622965,5.71738178618097e-05,121.10030413175885,COMPLETE
1062,0.43109309673309326,2023-09-04 22:25:32.682522,2023-09-04 22:25:32.905685,0 days 00:00:00.223163,Tanh,Leaky,ReLU,Tanh,83,18,21.0,17.0,4.0,0.018672255819883285,4,234,0.23752273371025476,0.0025774550248896947,153.46124674479168,COMPLETE
1063,0.2905852198600769,2023-09-04 22:25:32.906127,2023-09-04 22:25:33.443598,0 days 00:00:00.537471,Tanh,Leaky,Sigmoid,Leaky,86,17,18.0,14.0,17.0,0.012789260649455073,4,252,0.467781358332846,0.00016415029858902442,96.83242241810945,COMPLETE
1064,0.3812290132045746,2023-09-04 22:25:33.444052,2023-09-04 22:25:34.112521,0 days 00:00:00.668469,ReLU,Leaky,Sigmoid,Leaky,79,20,19.0,16.0,5.0,0.015691231607138277,4,256,0.799940190911251,0.0017133335015726146,184.47934872171155,COMPLETE
1065,0.43897175788879395,2023-09-04 22:25:34.112951,2023-09-04 22:25:34.444628,0 days 00:00:00.331677,Tanh,Leaky,Sigmoid,Leaky,84,21,21.0,23.0,4.0,0.007694362032567752,4,205,0.3027343631802705,6.760564250675344e-05,195.25888986790434,COMPLETE
1066,0.45363062620162964,2023-09-04 22:25:34.445060,2023-09-04 22:25:35.002451,0 days 00:00:00.557391,Sigmoid,Leaky,Sigmoid,Leaky,33,19,20.0,15.0,19.0,0.010898545156176009,4,219,0.38806690223784324,2.4564939163738244e-05,198.07089233398438,COMPLETE
1067,0.4479477107524872,2023-09-04 22:25:35.002891,2023-09-04 22:25:35.262930,0 days 00:00:00.260039,Tanh,Leaky,ReLU,Leaky,88,21,19.0,24.0,3.0,0.042133233719301284,4,246,0.3588679223087721,0.00010617390251145854,145.89789861043295,COMPLETE
1068,0.815809965133667,2023-09-04 22:25:35.263359,2023-09-04 22:25:35.538869,0 days 00:00:00.275510,Tanh,ReLU,Sigmoid,Leaky,82,22,20.0,15.0,16.0,0.023906260540067663,4,237,0.7538326900660314,0.08827238129499168,98.55475667317708,COMPLETE
1069,0.34520938992500305,2023-09-04 22:25:35.539299,2023-09-04 22:25:36.389185,0 days 00:00:00.849886,ReLU,Leaky,Sigmoid,Leaky,35,18,21.0,16.0,20.0,0.014351636638390699,4,266,0.6956696263007847,8.034625181939211e-05,109.15691897743626,COMPLETE
1070,1.0333539247512817,2023-09-04 22:25:36.389628,2023-09-04 22:25:37.720191,0 days 00:00:01.330563,Tanh,Leaky,Sigmoid,Tanh,85,19,20.0,23.0,18.0,3.401398050447461e-05,4,198,0.7716478915961462,0.03618728566813687,106.80765820424492,COMPLETE
1071,0.40796801447868347,2023-09-04 22:25:37.720621,2023-09-04 22:25:38.393133,0 days 00:00:00.672512,Sigmoid,Leaky,ReLU,Leaky,80,20,19.0,22.0,6.0,0.018173792365918335,4,228,0.7272964225115873,0.00019917736939820084,170.19342569204477,COMPLETE
