number,value,datetime_start,datetime_complete,duration,params_activation1,params_activation2,params_activation3,params_activation4,params_batch_size,params_fl1,params_fl2,params_fl3,params_fl4,params_learning_rate,params_n_layers,params_num_epochs,params_train_size,params_weight_decay,user_attrs_mre,state
667,0.3974217474460602,2023-09-04 21:27:59.868752,2023-09-04 21:28:00.438076,0 days 00:00:00.569324,ReLU,Sigmoid,ReLU,,40,22,20.0,5.0,,0.006318384453111518,3,416,0.32748874697733454,9.698634812749544e-05,127.25319196175838,COMPLETE
668,0.3214244246482849,2023-09-04 21:28:00.438442,2023-09-04 21:28:01.584264,0 days 00:00:01.145822,Leaky,ReLU,,,35,21,22.0,,,0.0034787163907301234,2,445,0.7353101351921003,3.558395427186199e-05,712.6444835924123,COMPLETE
669,0.45303836464881897,2023-09-04 21:28:01.584631,2023-09-04 21:28:01.959648,0 days 00:00:00.375017,Leaky,Sigmoid,,,37,22,21.0,,,0.004782375327102559,2,286,0.13988013123878043,0.0008535817628069847,166.65659556669348,COMPLETE
670,0.4276577830314636,2023-09-04 21:28:01.960000,2023-09-04 21:28:02.380729,0 days 00:00:00.420729,Leaky,ReLU,,,23,20,18.0,,,0.00978209884441013,2,194,0.1942569037259419,1.2067968178015825e-05,182.57800074986048,COMPLETE
671,0.33488261699676514,2023-09-04 21:28:02.381080,2023-09-04 21:28:03.545613,0 days 00:00:01.164533,Leaky,Sigmoid,,,28,22,17.0,,,0.007533328709364106,2,306,0.6718048304158978,7.306203059039213e-05,129.54221052281997,COMPLETE
672,0.7549378871917725,2023-09-04 21:28:03.545959,2023-09-04 21:28:05.822686,0 days 00:00:02.276727,Leaky,ReLU,,,41,21,19.0,,,1.598749740480564e-05,2,391,0.29878556545209073,2.1498567840424194e-05,108.49950725038339,COMPLETE
673,0.30619361996650696,2023-09-04 21:28:05.823030,2023-09-04 21:28:06.471208,0 days 00:00:00.648178,Leaky,Leaky,,,75,23,16.0,,,0.012479728284538347,2,408,0.7683578028700564,1.7861440874478628e-05,154.5262622833252,COMPLETE
674,0.382257878780365,2023-09-04 21:28:06.471645,2023-09-04 21:28:06.953465,0 days 00:00:00.481820,Leaky,Sigmoid,,,73,23,20.0,,,0.014338864803539618,2,425,0.7164598725916189,0.001659736568899618,213.39011351267496,COMPLETE
675,0.42097464203834534,2023-09-04 21:28:06.953919,2023-09-04 21:28:07.827184,0 days 00:00:00.873265,Leaky,Sigmoid,,,31,22,18.0,,,0.008569011417071087,2,205,0.617802651402729,0.0035469474431199704,151.43566144522973,COMPLETE
676,0.533709704875946,2023-09-04 21:28:07.827648,2023-09-04 21:28:07.987395,0 days 00:00:00.159747,Leaky,ReLU,,,96,22,19.0,,,0.005854004142269551,2,296,0.12625277869761783,1.3773374593999015e-05,290.21932010374206,COMPLETE
677,0.5914573669433594,2023-09-04 21:28:07.987873,2023-09-04 21:28:08.269983,0 days 00:00:00.282110,Leaky,Sigmoid,,,80,4,20.0,,,0.01089086405678175,2,379,0.1868817944412792,0.0010693862702695412,313.44458144970156,COMPLETE
678,0.44978588819503784,2023-09-04 21:28:08.270409,2023-09-04 21:28:10.511198,0 days 00:00:02.240789,Leaky,ReLU,,,39,20,21.0,,,0.0002002294846119083,2,125,0.7470275549097407,0.0006545704674202004,228.40211779785156,COMPLETE
679,0.3873589336872101,2023-09-04 21:28:10.511537,2023-09-04 21:28:11.298606,0 days 00:00:00.787069,Leaky,Sigmoid,,,98,23,18.0,,,0.004014201326525826,2,217,0.3719762724795376,5.046952281268141e-05,247.04840645093597,COMPLETE
680,0.4625709354877472,2023-09-04 21:28:11.298950,2023-09-04 21:28:11.455964,0 days 00:00:00.157014,Leaky,ReLU,,,70,23,17.0,,,0.01356164606346587,2,353,0.1423772430544927,0.00012632686142150616,206.39850881148357,COMPLETE
681,0.42594340443611145,2023-09-04 21:28:11.456308,2023-09-04 21:28:11.968660,0 days 00:00:00.512352,Leaky,Sigmoid,,,76,22,16.0,,,0.007691955012225756,2,339,0.2767037016980922,2.5532067572753747e-05,307.7164110781541,COMPLETE
682,0.7740496397018433,2023-09-04 21:28:11.969004,2023-09-04 21:28:14.054630,0 days 00:00:02.085626,Leaky,Sigmoid,,,41,21,19.0,,,2.387356577503939e-05,2,135,0.7999812802977594,3.0227208962738782e-05,116.55395982530382,COMPLETE
683,0.6504291296005249,2023-09-04 21:28:14.054981,2023-09-04 21:28:14.595068,0 days 00:00:00.540087,Sigmoid,ReLU,,,37,24,15.0,,,0.005048269146223774,2,373,0.6948246318745626,0.038782622903148774,195.67881478203668,COMPLETE
684,0.4184032380580902,2023-09-04 21:28:14.595429,2023-09-04 21:28:15.492061,0 days 00:00:00.896632,Leaky,Sigmoid,,,33,9,20.0,,,0.010020781445622122,2,316,0.6621673941080807,0.002378402777383112,153.71077295939128,COMPLETE
685,0.3589993119239807,2023-09-04 21:28:15.492519,2023-09-04 21:28:16.455015,0 days 00:00:00.962496,Leaky,ReLU,,,39,23,18.0,,,0.00632725152475701,2,397,0.741747718116895,0.001917774824464983,352.50443667457216,COMPLETE
686,0.5573641657829285,2023-09-04 21:28:16.455349,2023-09-04 21:28:20.630988,0 days 00:00:04.175639,Leaky,Sigmoid,,,41,7,17.0,,,0.00011256495052815322,2,275,0.7758026770085463,1.004341037310442e-05,218.86568875399502,COMPLETE
687,0.5979904532432556,2023-09-04 21:28:20.631385,2023-09-04 21:28:20.968742,0 days 00:00:00.337357,Leaky,,,,96,14,,,,0.01199099015528411,1,112,0.7177996680014679,0.07878574690279612,153.8977113806683,COMPLETE
688,0.4822198450565338,2023-09-04 21:28:20.969089,2023-09-04 21:28:21.170076,0 days 00:00:00.200987,ReLU,Leaky,,,35,24,22.0,,,0.002458214789530497,2,254,0.10012880346152583,2.1227811562738204e-05,242.08264821370443,COMPLETE
689,0.3657477796077728,2023-09-04 21:28:21.170454,2023-09-04 21:28:21.558967,0 days 00:00:00.388513,Leaky,ReLU,Leaky,,100,10,19.0,20.0,,0.016259178539682135,3,188,0.6945477353032389,1.631464607967977e-05,859.3453956604004,COMPLETE
690,0.4669840335845947,2023-09-04 21:28:21.559335,2023-09-04 21:28:21.802329,0 days 00:00:00.242994,Leaky,Sigmoid,,,77,22,24.0,,,0.008894583481621646,2,481,0.14729551045598116,9.194485610928156e-05,127.78953131313982,COMPLETE
691,0.37002238631248474,2023-09-04 21:28:21.802687,2023-09-04 21:28:23.271120,0 days 00:00:01.468433,Leaky,Sigmoid,,,72,19,20.0,,,0.0011172354170464107,2,139,0.7986941328996373,0.0005199865821200677,135.08158940376995,COMPLETE
692,0.3848183751106262,2023-09-04 21:28:23.271461,2023-09-04 21:28:23.632440,0 days 00:00:00.360979,Leaky,ReLU,,,42,23,21.0,,,0.0069865899795439924,2,444,0.25527949130506666,0.002782839178713095,139.58460555538053,COMPLETE
693,0.5045426487922668,2023-09-04 21:28:23.632842,2023-09-04 21:28:23.789989,0 days 00:00:00.157147,Leaky,Sigmoid,,,79,21,18.0,,,0.01438345596533806,2,462,0.10524821959278881,1.2261769369638385e-05,235.82452235502356,COMPLETE
694,0.49703291058540344,2023-09-04 21:28:23.790338,2023-09-04 21:28:24.256421,0 days 00:00:00.466083,Leaky,ReLU,,,94,24,17.0,,,0.0005341238710024557,2,129,0.26321476058499366,6.251421678943823e-05,163.254083500352,COMPLETE
695,0.4579981565475464,2023-09-04 21:28:24.256772,2023-09-04 21:28:24.509136,0 days 00:00:00.252364,Leaky,Sigmoid,,,82,23,20.0,,,0.011290894776836695,2,430,0.33960211076978325,0.00011933555996370748,176.33166354635486,COMPLETE
696,0.341127872467041,2023-09-04 21:28:24.509472,2023-09-04 21:28:24.990014,0 days 00:00:00.480542,Leaky,ReLU,,,98,24,16.0,,,0.00536098504841074,2,414,0.7535417960236802,0.00015811830640663689,121.15422182950107,COMPLETE
697,0.3334341049194336,2023-09-04 21:28:24.990361,2023-09-04 21:28:25.826533,0 days 00:00:00.836172,Leaky,Sigmoid,,,38,23,19.0,,,0.009504819586633484,2,297,0.6423391337206239,0.0004242528131281888,150.5895495414734,COMPLETE
698,0.5152879953384399,2023-09-04 21:28:25.826890,2023-09-04 21:28:26.750289,0 days 00:00:00.923399,Leaky,Sigmoid,,,34,22,18.0,,,0.0006661040073687548,2,177,0.15213522081323758,1.4942759261284436e-05,253.9402701167737,COMPLETE
699,0.47583886981010437,2023-09-04 21:28:26.750919,2023-09-04 21:28:29.574051,0 days 00:00:02.823132,Leaky,ReLU,,,40,18,19.0,,,8.53297955312492e-05,2,202,0.7224005988628112,3.992554551974385e-05,389.65759851436803,COMPLETE
700,0.38191813230514526,2023-09-04 21:28:29.574406,2023-09-04 21:28:30.680073,0 days 00:00:01.105667,Leaky,Sigmoid,,,67,20,14.0,,,0.004019457812624909,2,455,0.7610836275703454,0.0008321009819434915,391.4055610939308,COMPLETE
701,0.5208904147148132,2023-09-04 21:28:30.680422,2023-09-04 21:28:32.143928,0 days 00:00:01.463506,Leaky,ReLU,,,57,24,20.0,,,0.00013536106562649804,2,145,0.6729730845791623,0.0012159674927891048,145.15732479753166,COMPLETE
702,0.9253430366516113,2023-09-04 21:28:32.144295,2023-09-04 21:28:34.432229,0 days 00:00:02.287934,Leaky,Sigmoid,,,43,21,21.0,,,1.775460233526147e-05,2,286,0.3075310315074827,1.852952398158309e-05,117.41058875130607,COMPLETE
703,0.40650510787963867,2023-09-04 21:28:34.432870,2023-09-04 21:28:35.019837,0 days 00:00:00.586967,Leaky,Tanh,ReLU,,30,22,21.0,23.0,,0.017781468644457985,3,386,0.16735969527040717,1.0014490743373699e-05,168.35273260819284,COMPLETE
704,0.9682657122612,2023-09-04 21:28:35.020205,2023-09-04 21:28:35.784546,0 days 00:00:00.764341,Sigmoid,ReLU,,,70,23,15.0,,,1.153566298864685e-05,2,116,0.477208062200275,1.3264111222018871e-05,140.28446500054721,COMPLETE
705,0.3175283372402191,2023-09-04 21:28:35.784893,2023-09-04 21:28:36.967345,0 days 00:00:01.182452,Leaky,Sigmoid,,,36,24,23.0,,,0.012733864207921927,2,194,0.7715592918720846,0.00038422118575160785,765.6608975384686,COMPLETE
706,0.36000168323516846,2023-09-04 21:28:36.967697,2023-09-04 21:28:37.691897,0 days 00:00:00.724200,Leaky,Tanh,,,74,23,17.0,,,0.007337517442207463,2,136,0.6940965634618342,0.00604596563084501,213.90603599065466,COMPLETE
707,0.4644838571548462,2023-09-04 21:28:37.692247,2023-09-04 21:28:44.181369,0 days 00:00:06.489122,Leaky,Leaky,,,19,24,19.0,,,0.00038937305757933625,2,270,0.7325065488357206,0.014080685857443546,155.5425385651765,COMPLETE
708,0.43104878067970276,2023-09-04 21:28:44.181734,2023-09-04 21:28:44.340634,0 days 00:00:00.158900,ReLU,Sigmoid,,,97,22,20.0,,,0.03543437220898055,2,166,0.20691534299693676,2.9130406912157107e-05,792.7078374818313,COMPLETE
709,0.3780691921710968,2023-09-04 21:28:44.340992,2023-09-04 21:28:44.763314,0 days 00:00:00.422322,Leaky,ReLU,,,53,23,18.0,,,0.015440015437739815,2,327,0.6349617868206383,7.443312493177983e-05,159.40184181614927,COMPLETE
710,0.3141954243183136,2023-09-04 21:28:44.763658,2023-09-04 21:28:45.812177,0 days 00:00:01.048519,Leaky,Sigmoid,,,76,21,19.0,,,0.008362911123800833,2,156,0.7401240053115881,4.695830617687621e-05,113.79146773474557,COMPLETE
711,0.37311258912086487,2023-09-04 21:28:45.812524,2023-09-04 21:28:46.162243,0 days 00:00:00.349719,Leaky,Tanh,,,100,24,18.0,,,0.01115333554933757,2,174,0.42772327677020217,1.2086422449612182e-05,161.6361108204675,COMPLETE
712,0.4294500946998596,2023-09-04 21:28:46.162590,2023-09-04 21:28:47.328737,0 days 00:00:01.166147,Tanh,ReLU,,,42,12,21.0,,,0.0008539184564471337,2,224,0.31211831234389253,9.852990281421284e-05,149.94420920924136,COMPLETE
713,0.6217147707939148,2023-09-04 21:28:47.329093,2023-09-04 21:28:47.542169,0 days 00:00:00.213076,Leaky,Sigmoid,,,38,23,17.0,,,0.00658390924865642,2,401,0.12488143755391688,3.403189218873484e-05,171.99867384774345,COMPLETE
714,0.5497940182685852,2023-09-04 21:28:47.542542,2023-09-04 21:28:48.042732,0 days 00:00:00.500190,Leaky,Tanh,,,95,23,20.0,,,0.0001642657354126544,2,185,0.19854256626655595,2.2794266467521607e-05,119.76294951567779,COMPLETE
715,0.5281407237052917,2023-09-04 21:28:48.043104,2023-09-04 21:28:48.283171,0 days 00:00:00.240067,Leaky,ReLU,,,40,13,22.0,,,0.06693698340680476,2,147,0.23468175521540988,0.007947508596194336,206.76217130335365,COMPLETE
716,0.41321635246276855,2023-09-04 21:28:48.283521,2023-09-04 21:28:55.968175,0 days 00:00:07.684654,Leaky,Sigmoid,,,43,22,19.0,,,0.00017867920669163302,2,499,0.771268444091406,0.000619458127556083,155.32065962906722,COMPLETE
717,0.35360196232795715,2023-09-04 21:28:55.968539,2023-09-04 21:28:56.963766,0 days 00:00:00.995227,Leaky,Tanh,,,45,21,18.0,,,0.0031198010005794477,2,363,0.6077502556990366,0.0002902671170785077,150.93823879367702,COMPLETE
718,0.3588196039199829,2023-09-04 21:28:56.964120,2023-09-04 21:28:57.596151,0 days 00:00:00.632031,Tanh,Sigmoid,,,78,24,16.0,,,0.021844808147758785,2,124,0.7067659174348525,0.001591900210092708,585.45787222726,COMPLETE
719,0.39577677845954895,2023-09-04 21:28:57.596507,2023-09-04 21:28:57.798426,0 days 00:00:00.201919,Leaky,ReLU,,,59,24,20.0,,,0.009873274141754316,2,421,0.2337798457837017,1.655617355912874e-05,156.35468385277724,COMPLETE
720,0.40086936950683594,2023-09-04 21:28:57.798804,2023-09-04 21:28:58.142082,0 days 00:00:00.343278,Leaky,Tanh,Sigmoid,,73,22,19.0,22.0,,0.004838814629183109,3,239,0.22146799167476786,0.00014155568127159973,257.0733867645264,COMPLETE
721,0.32363641262054443,2023-09-04 21:28:58.142453,2023-09-04 21:28:59.059353,0 days 00:00:00.916900,Leaky,Sigmoid,,,36,23,17.0,,,0.013069795516036386,2,133,0.5605031247620437,0.00019803099041096477,144.1952189656047,COMPLETE
722,0.4369896352291107,2023-09-04 21:28:59.059721,2023-09-04 21:28:59.189321,0 days 00:00:00.129600,Leaky,ReLU,,,98,24,14.0,,,0.02487474860087112,2,292,0.16082168769048386,1.9232250828181506e-05,411.5908717105263,COMPLETE
723,0.37281355261802673,2023-09-04 21:28:59.189695,2023-09-04 21:29:00.353090,0 days 00:00:01.163395,Leaky,Tanh,,,12,23,24.0,,,0.01780168628318996,2,208,0.7993503210966745,2.589705167912832e-05,148.09166308811731,COMPLETE
724,0.44954240322113037,2023-09-04 21:29:00.353460,2023-09-04 21:29:00.691892,0 days 00:00:00.338432,Tanh,Sigmoid,,,93,22,16.0,,,0.008090175059482606,2,441,0.20222036761672882,0.0007620366685641593,137.17073341895795,COMPLETE
725,0.48463213443756104,2023-09-04 21:29:00.692262,2023-09-04 21:29:07.674048,0 days 00:00:06.981786,Leaky,Sigmoid,,,40,23,18.0,,,6.639343120775115e-05,2,470,0.6581887518954952,1.3642571595577427e-05,171.76448739234436,COMPLETE
726,0.31160351634025574,2023-09-04 21:29:07.674417,2023-09-04 21:29:08.709372,0 days 00:00:01.034955,Leaky,Tanh,,,37,20,20.0,,,0.006017750519388898,2,168,0.729295456161323,0.0005060175536010731,300.32152382986885,COMPLETE
727,0.3763570487499237,2023-09-04 21:29:08.709766,2023-09-04 21:29:09.260483,0 days 00:00:00.550717,Leaky,ReLU,,,18,24,21.0,,,0.014235159289468589,2,153,0.24423124664834164,0.00017550266530050283,190.01306397574288,COMPLETE
728,0.3733878433704376,2023-09-04 21:29:09.260859,2023-09-04 21:29:10.066850,0 days 00:00:00.805991,Sigmoid,,,,69,21,,,,0.011172624508454127,1,279,0.7997873481683934,5.560503571340954e-05,260.7982690832117,COMPLETE
729,0.4245847165584564,2023-09-04 21:29:10.067210,2023-09-04 21:29:10.229815,0 days 00:00:00.162605,Leaky,Sigmoid,,,84,22,19.0,,,0.04535431486971524,2,302,0.1823048545347261,1.2298763834959521e-05,322.9315062813137,COMPLETE
730,0.522443413734436,2023-09-04 21:29:10.230182,2023-09-04 21:29:10.514171,0 days 00:00:00.283989,Leaky,Tanh,,,32,11,22.0,,,0.0089864822052635,2,393,0.14636430618186438,0.0003668051921412741,402.7989092015508,COMPLETE
731,0.31852084398269653,2023-09-04 21:29:10.514534,2023-09-04 21:29:11.486680,0 days 00:00:00.972146,Leaky,ReLU,,,75,24,17.0,,,0.004373463796619243,2,184,0.685686787630832,0.000115168133567053,149.4694775390625,COMPLETE
732,0.45564642548561096,2023-09-04 21:29:11.487041,2023-09-04 21:29:13.208396,0 days 00:00:01.721355,Tanh,Leaky,,,55,23,20.0,,,0.00023974557998291828,2,147,0.7534185176749335,1.5266675443084973e-05,185.6690763097231,COMPLETE
733,0.49665457010269165,2023-09-04 21:29:13.208748,2023-09-04 21:29:13.822033,0 days 00:00:00.613285,Leaky,Sigmoid,,,42,23,15.0,,,0.016119871792193697,2,409,0.707551759503404,0.00585336950840896,264.07683439032974,COMPLETE
734,0.4944663345813751,2023-09-04 21:29:13.822399,2023-09-04 21:29:14.917476,0 days 00:00:01.095077,ReLU,Tanh,,,80,24,19.0,,,0.0015693641124966819,2,379,0.7630293977748553,0.022151228797192193,135.15249299166496,COMPLETE
735,0.36936965584754944,2023-09-04 21:29:14.917921,2023-09-04 21:29:15.317110,0 days 00:00:00.399189,Leaky,ReLU,ReLU,Tanh,62,21,18.0,21.0,6.0,0.03069925715037269,4,314,0.49693482118918236,0.00024625933569052234,373.8864490284639,COMPLETE
736,0.3840371072292328,2023-09-04 21:29:15.317562,2023-09-04 21:29:18.107931,0 days 00:00:02.790369,Leaky,Sigmoid,,,34,17,23.0,,,0.0019164754284135821,2,162,0.7270282995396087,1.0081053459423605e-05,124.95120688847133,COMPLETE
737,0.3644123375415802,2023-09-04 21:29:18.108596,2023-09-04 21:29:19.619790,0 days 00:00:01.511194,Leaky,Tanh,,,71,22,20.0,,,0.005701047235787726,2,139,0.6739773364947336,2.2618973837139193e-05,159.95654923575265,COMPLETE
738,0.5245480537414551,2023-09-04 21:29:19.620469,2023-09-04 21:29:20.161454,0 days 00:00:00.540985,Leaky,Sigmoid,,,96,24,18.0,,,0.019202797134640334,2,194,0.27460052579485017,0.009677672607988295,133.1223423170007,COMPLETE
739,0.32996150851249695,2023-09-04 21:29:20.162115,2023-09-04 21:29:21.711395,0 days 00:00:01.549280,Tanh,ReLU,,,44,23,16.0,,,0.012736175592360255,2,454,0.46200478568664544,8.59712970099283e-05,116.01865094502767,COMPLETE
740,0.346334308385849,2023-09-04 21:29:21.712070,2023-09-04 21:29:23.114998,0 days 00:00:01.402928,Leaky,Tanh,,,77,23,21.0,,,0.010312304569827358,2,171,0.5453414775264386,0.0010192028459866651,248.29940402869022,COMPLETE
741,0.4740029275417328,2023-09-04 21:29:23.115659,2023-09-04 21:29:24.279404,0 days 00:00:01.163745,Leaky,Sigmoid,,,39,22,19.0,,,0.007105979416022809,2,125,0.16445010080176287,3.291148910409603e-05,195.68415605903851,COMPLETE
742,0.35175174474716187,2023-09-04 21:29:24.280069,2023-09-04 21:29:26.462489,0 days 00:00:02.182420,Leaky,ReLU,,,98,24,17.0,,,0.008145345642814014,2,157,0.7998917171917683,0.00013862643169387114,900.4270502134812,COMPLETE
743,0.4088982939720154,2023-09-04 21:29:26.463153,2023-09-04 21:29:28.739596,0 days 00:00:02.276443,Leaky,Sigmoid,Leaky,Leaky,41,23,21.0,5.0,8.0,0.0022045451822257436,4,110,0.4046549183721788,1.9093624446793598e-05,133.95718686720903,COMPLETE
744,0.6030081510543823,2023-09-04 21:29:28.740319,2023-09-04 21:29:31.513336,0 days 00:00:02.773017,Leaky,Tanh,,,28,21,15.0,,,0.0004287850806957866,2,429,0.754473597024405,0.09652460295269728,121.22974999745686,COMPLETE
745,0.3905394971370697,2023-09-04 21:29:31.513993,2023-09-04 21:29:32.581111,0 days 00:00:01.067118,Leaky,ReLU,ReLU,,94,22,18.0,24.0,,0.003537274079379195,3,180,0.3178791634392645,1.1745300383084167e-05,129.5684359701056,COMPLETE
746,0.9243433475494385,2023-09-04 21:29:32.581791,2023-09-04 21:29:36.495535,0 days 00:00:03.913744,Tanh,Sigmoid,,,67,24,19.0,,,1.084205343488764e-05,2,141,0.705092112886949,4.0046132857479205e-05,127.84748521087863,COMPLETE
747,0.6352904438972473,2023-09-04 21:29:36.496200,2023-09-04 21:29:44.660211,0 days 00:00:08.164011,Leaky,Tanh,,,45,20,22.0,,,1.532390323647245e-05,2,386,0.3990222356431232,0.00031572423841862173,1029.1092627332619,COMPLETE
748,0.44912049174308777,2023-09-04 21:29:44.660921,2023-09-04 21:29:46.993368,0 days 00:00:02.332447,Leaky,Sigmoid,,,99,23,20.0,,,0.0010823411341068236,2,400,0.155948407309789,6.605827840196752e-05,151.8689397624518,COMPLETE
749,0.4441111981868744,2023-09-04 21:29:46.994036,2023-09-04 21:29:50.870760,0 days 00:00:03.876724,Leaky,ReLU,,,38,24,17.0,,,0.000529512125385806,2,285,0.21786578580558305,0.00010450939901945315,141.83982468989856,COMPLETE
750,0.34215477108955383,2023-09-04 21:29:50.871425,2023-09-04 21:29:51.750255,0 days 00:00:00.878830,Leaky,Tanh,,,64,21,19.0,,,0.014771131864785706,2,131,0.375230365575545,1.4974648594046027e-05,152.68386108398437,COMPLETE
751,0.4095422923564911,2023-09-04 21:29:51.750940,2023-09-04 21:29:53.713293,0 days 00:00:01.962353,Sigmoid,Sigmoid,ReLU,ReLU,73,23,16.0,18.0,5.0,0.011305408805451318,4,151,0.29308271421412496,0.00016915942065386143,187.05084551059133,COMPLETE
752,0.34985896944999695,2023-09-04 21:29:53.713995,2023-09-04 21:29:54.885063,0 days 00:00:01.171068,Leaky,ReLU,,,42,22,20.0,,,0.026736484292109723,2,121,0.35067558185636466,0.0004748946952818527,264.1357551857277,COMPLETE
753,0.3474232852458954,2023-09-04 21:29:54.885748,2023-09-04 21:29:57.180355,0 days 00:00:02.294607,Tanh,Tanh,,,39,24,18.0,,,0.006657907833133556,2,345,0.6460917295382368,2.8223750844350105e-05,133.23613764876026,COMPLETE
754,0.3536255657672882,2023-09-04 21:29:57.181025,2023-09-04 21:29:58.873847,0 days 00:00:01.692822,Leaky,Sigmoid,,,82,16,19.0,,,0.009433824988780516,2,159,0.7716352024654037,0.0006218861188870941,144.30027783503297,COMPLETE
755,0.37194710969924927,2023-09-04 21:29:58.874495,2023-09-04 21:30:00.325033,0 days 00:00:01.450538,Leaky,Leaky,,,35,19,21.0,,,0.02104062803243399,2,300,0.43518166187054114,0.0021355850887884204,2059.3678850446427,COMPLETE
756,0.49582841992378235,2023-09-04 21:30:00.325713,2023-09-04 21:30:07.439216,0 days 00:00:07.113503,Leaky,ReLU,,,95,22,15.0,,,0.00011089290539231865,2,374,0.605235304354505,1.002766725210754e-05,212.0106004521171,COMPLETE
757,0.5012333989143372,2023-09-04 21:30:07.439885,2023-09-04 21:30:10.352725,0 days 00:00:02.912840,ReLU,Sigmoid,,,100,2,17.0,,,0.00510299144287994,2,264,0.733064631924521,0.00021478104310800232,168.77188366606035,COMPLETE
758,0.3613100051879883,2023-09-04 21:30:10.353386,2023-09-04 21:30:15.608055,0 days 00:00:05.254669,Leaky,Tanh,,,37,23,18.0,,,0.0028567294733340244,2,439,0.6883089749384674,1.800330001400371e-05,142.52790634275422,COMPLETE
759,0.895855188369751,2023-09-04 21:30:15.608715,2023-09-04 21:30:16.478922,0 days 00:00:00.870207,Leaky,Sigmoid,Sigmoid,Tanh,79,9,20.0,18.0,24.0,9.948507331978995e-05,4,146,0.1114459969190698,4.683830245476423e-05,119.51977405733275,COMPLETE
760,0.38203224539756775,2023-09-04 21:30:16.479639,2023-09-04 21:30:18.617741,0 days 00:00:02.138102,Leaky,Tanh,,,76,6,19.0,,,0.012672091565643287,2,170,0.7725555362804143,0.0012816969834909414,140.22022020494614,COMPLETE
761,0.4174071252346039,2023-09-04 21:30:18.618410,2023-09-04 21:30:19.365981,0 days 00:00:00.747571,Tanh,ReLU,,,46,14,18.0,,,0.017231192795945892,2,417,0.24957577489183697,1.3668083281697335e-05,125.24041623485331,COMPLETE
762,0.44770264625549316,2023-09-04 21:30:19.366637,2023-09-04 21:30:20.160941,0 days 00:00:00.794304,Leaky,Sigmoid,,,41,24,23.0,,,0.008309033576325134,2,188,0.17704411815648405,0.0007975286976984532,304.39644861221313,COMPLETE
