number,value,datetime_start,datetime_complete,duration,params_activation1,params_activation2,params_activation3,params_activation4,params_batch_size,params_fl1,params_fl2,params_fl3,params_fl4,params_learning_rate,params_n_layers,params_num_epochs,params_train_size,params_weight_decay,user_attrs_mre,state
1427,0.42121872305870056,2023-09-04 22:32:49.136972,2023-09-04 22:32:49.596212,0 days 00:00:00.459240,Tanh,Leaky,Sigmoid,ReLU,89,20,22.0,22.0,9.0,0.0036152263827384495,4,293,0.24204265427404717,0.004179545881606178,143.3154719560996,COMPLETE
1428,0.8413150310516357,2023-09-04 22:32:49.596721,2023-09-04 22:32:49.867272,0 days 00:00:00.270551,Leaky,Leaky,Sigmoid,Leaky,92,19,23.0,23.0,2.0,0.006403229307437353,4,248,0.16944535039349734,2.4535145371718933e-05,410.0451457683857,COMPLETE
1429,0.312481552362442,2023-09-04 22:32:49.867786,2023-09-04 22:32:51.618824,0 days 00:00:01.751038,Sigmoid,Leaky,Sigmoid,Sigmoid,86,16,21.0,23.0,20.0,0.0045763510716063435,4,272,0.7470030757153926,1.0526462930478956e-05,139.45006312880406,COMPLETE
1430,0.47626152634620667,2023-09-04 22:32:51.619338,2023-09-04 22:32:52.630316,0 days 00:00:01.010978,Tanh,Leaky,ReLU,Leaky,76,5,21.0,21.0,6.0,0.0025568232720232166,4,252,0.7705541885234317,0.011063409754814657,184.13961929745145,COMPLETE
1431,1.0207133293151855,2023-09-04 22:32:52.630840,2023-09-04 22:32:53.578868,0 days 00:00:00.948028,Tanh,Leaky,Sigmoid,Sigmoid,25,10,21.0,23.0,18.0,0.007727044488225819,4,256,0.7230475559449807,0.07448108597929272,111.39863745371501,COMPLETE
1432,0.25243279337882996,2023-09-04 22:32:53.579386,2023-09-04 22:32:54.670418,0 days 00:00:01.091032,ReLU,Leaky,Sigmoid,Leaky,80,20,23.0,22.0,7.0,0.0025630580149983736,4,222,0.7996215012528309,1.014123365645983e-05,99.90674967580027,COMPLETE
1433,0.3868767023086548,2023-09-04 22:32:54.670955,2023-09-04 22:33:01.521079,0 days 00:00:06.850124,Tanh,Leaky,Sigmoid,Leaky,33,19,22.0,23.0,17.0,8.616082471227716e-05,4,284,0.7995382384491296,1.3340694138556489e-05,169.09200302983675,COMPLETE
1434,0.40241947770118713,2023-09-04 22:33:01.521586,2023-09-04 22:33:02.160174,0 days 00:00:00.638588,Leaky,Leaky,ReLU,Sigmoid,29,18,21.0,20.0,3.0,0.0017491960137893494,4,263,0.2859341791000855,0.0020728347381103436,128.51689866872934,COMPLETE
1435,0.3467056155204773,2023-09-04 22:33:02.160676,2023-09-04 22:33:03.170247,0 days 00:00:01.009571,Sigmoid,Leaky,Sigmoid,Leaky,95,19,21.0,22.0,18.0,0.00761394998982869,4,237,0.6856851524625321,0.000968202415891533,146.23629827666701,COMPLETE
1436,0.37563836574554443,2023-09-04 22:33:03.170727,2023-09-04 22:33:03.574247,0 days 00:00:00.403520,Tanh,Leaky,Sigmoid,Sigmoid,88,18,18.0,12.0,6.0,0.07608343327373678,4,310,0.35871258815282364,0.0006633283728620507,300.55588187423405,COMPLETE
1437,0.3884817361831665,2023-09-04 22:33:03.574751,2023-09-04 22:33:04.537644,0 days 00:00:00.962893,ReLU,Tanh,Leaky,Leaky,46,17,21.0,23.0,16.0,0.0013260758439111516,4,246,0.2972055019564032,0.011543905372021913,108.66573435015383,COMPLETE
1438,1.0086421966552734,2023-09-04 22:33:04.538153,2023-09-04 22:33:05.362871,0 days 00:00:00.824718,Tanh,Leaky,Sigmoid,Sigmoid,83,10,22.0,22.0,19.0,5.103180546991377e-05,4,229,0.1600828198980342,0.00017738825805724525,133.23543811781437,COMPLETE
1439,0.9293771982192993,2023-09-04 22:33:05.363372,2023-09-04 22:33:05.738282,0 days 00:00:00.374910,Sigmoid,Sigmoid,ReLU,Leaky,31,19,17.0,23.0,7.0,0.0022437204766110187,4,272,0.38571582426057227,0.04485300555274468,107.83373260498047,COMPLETE
1440,0.27347931265830994,2023-09-04 22:33:05.738798,2023-09-04 22:33:07.028292,0 days 00:00:01.289494,Leaky,Leaky,Sigmoid,Leaky,86,20,21.0,23.0,6.0,0.0035080791393637847,4,300,0.4819275730351298,0.0005111345741119528,104.22813415527344,COMPLETE
1441,0.31762027740478516,2023-09-04 22:33:07.028792,2023-09-04 22:33:08.096666,0 days 00:00:01.067874,Tanh,Leaky,Sigmoid,ReLU,85,18,19.0,10.0,2.0,0.0063990213482938395,4,242,0.7486580211764202,0.00019941316090385023,126.43700363522484,COMPLETE
1442,0.3214339017868042,2023-09-04 22:33:08.097143,2023-09-04 22:33:09.914786,0 days 00:00:01.817643,Tanh,Leaky,Sigmoid,Sigmoid,35,19,20.0,22.0,16.0,0.0008643275989213753,4,259,0.6480949691114143,7.31384509196429e-05,119.85649880303276,COMPLETE
1443,0.675131618976593,2023-09-04 22:33:09.915335,2023-09-04 22:33:16.525953,0 days 00:00:06.610618,ReLU,Leaky,Tanh,Leaky,27,17,21.0,23.0,17.0,2.119308064198897e-05,4,230,0.7168319022321856,0.00935903284685494,127.81216427346935,COMPLETE
1444,0.5480136275291443,2023-09-04 22:33:16.526464,2023-09-04 22:33:17.080206,0 days 00:00:00.553742,Sigmoid,Leaky,Sigmoid,Sigmoid,82,20,22.0,23.0,20.0,0.09092169191198748,4,220,0.7734364363048777,0.0002727378163178554,170.06619153703963,COMPLETE
1445,0.3789290487766266,2023-09-04 22:33:17.080697,2023-09-04 22:33:17.440291,0 days 00:00:00.359594,Tanh,Leaky,ReLU,Leaky,54,18,19.0,21.0,5.0,0.03481037662194194,4,249,0.6232629912452954,1.5864873001184996e-05,165.8023178998162,COMPLETE
1446,0.4368402063846588,2023-09-04 22:33:17.440818,2023-09-04 22:33:17.687297,0 days 00:00:00.246479,Leaky,Leaky,Sigmoid,Sigmoid,81,19,21.0,22.0,19.0,0.06794919343068942,4,291,0.1790729353648008,0.00039199024711099393,218.17164527045355,COMPLETE
1447,0.4673125445842743,2023-09-04 22:33:17.687815,2023-09-04 22:33:18.027706,0 days 00:00:00.339891,Tanh,Leaky,Sigmoid,Leaky,84,18,20.0,23.0,9.0,0.004587231730560075,4,235,0.32883489690752415,0.0012473308776691963,146.60303999248305,COMPLETE
1448,0.36780187487602234,2023-09-04 22:33:18.028213,2023-09-04 22:33:18.933870,0 days 00:00:00.905657,Sigmoid,Leaky,Sigmoid,Leaky,90,15,23.0,23.0,18.0,0.0038008881242531578,4,280,0.2282410704085647,0.00022642310769366446,104.66774113293,COMPLETE
1449,0.40933266282081604,2023-09-04 22:33:18.934360,2023-09-04 22:33:19.257758,0 days 00:00:00.323398,ReLU,Leaky,ReLU,Sigmoid,88,20,12.0,22.0,15.0,0.009341636462483874,4,264,0.4065713972824167,0.00016451162255754463,215.49793341852003,COMPLETE
1450,0.37573322653770447,2023-09-04 22:33:19.258251,2023-09-04 22:33:20.133728,0 days 00:00:00.875477,Tanh,Leaky,Sigmoid,Leaky,72,17,18.0,24.0,6.0,0.008356447538007102,4,244,0.743644338631659,0.005258360696391786,128.41914160776946,COMPLETE
1451,1.0104811191558838,2023-09-04 22:33:20.134244,2023-09-04 22:33:22.900690,0 days 00:00:02.766446,Leaky,Leaky,Sigmoid,Sigmoid,86,19,22.0,23.0,7.0,2.5433749826050024e-05,4,251,0.707794835721691,0.007534764264386579,140.3530081334817,COMPLETE
1452,0.4376234710216522,2023-09-04 22:33:22.901210,2023-09-04 22:33:24.110991,0 days 00:00:01.209781,Tanh,Leaky,Sigmoid,Leaky,34,18,20.0,13.0,5.0,0.0028340376156831826,4,211,0.2759024147676272,0.015588260407998808,140.3267195786887,COMPLETE
1453,1.263821005821228,2023-09-04 22:33:24.111529,2023-09-04 22:33:24.323867,0 days 00:00:00.212338,Sigmoid,Leaky,Sigmoid,ReLU,84,14,19.0,22.0,1.0,0.011215411559241625,4,223,0.3772935274295852,0.0010811397040214736,111.0723149226262,COMPLETE
1454,0.40590766072273254,2023-09-04 22:33:24.324359,2023-09-04 22:33:25.194679,0 days 00:00:00.870320,Tanh,Leaky,ReLU,Sigmoid,31,20,19.0,23.0,8.0,0.027867044905480386,4,310,0.7754140957697988,0.00014416106241171432,130.92843180689317,COMPLETE
1455,0.3064414858818054,2023-09-04 22:33:25.195171,2023-09-04 22:33:27.107410,0 days 00:00:01.912239,ReLU,Leaky,Sigmoid,Leaky,78,18,21.0,24.0,21.0,0.006066308904760462,4,236,0.5149365574399101,6.354123654974842e-05,1982.2841159820557,COMPLETE
1456,0.36931318044662476,2023-09-04 22:33:27.108364,2023-09-04 22:33:27.753592,0 days 00:00:00.645228,Tanh,Leaky,,,80,19,20.0,,,0.04659688391758441,2,269,0.7994651878073256,0.0013774461656628125,140.14038803998162,COMPLETE
1457,0.8253933787345886,2023-09-04 22:33:27.754524,2023-09-04 22:33:44.354113,0 days 00:00:16.599589,Leaky,Leaky,Sigmoid,Leaky,32,17,21.0,11.0,6.0,1.0866845685503397e-05,4,257,0.6771554824019321,3.0868959492597364e-05,127.75385311141552,COMPLETE
1458,0.42685583233833313,2023-09-04 22:33:44.355067,2023-09-04 22:33:49.682051,0 days 00:00:05.326984,Sigmoid,Leaky,Sigmoid,Sigmoid,82,19,20.0,23.0,19.0,0.0015001316593476403,4,296,0.7425009142495487,2.3268447639919718e-05,133.39624603073318,COMPLETE
1459,0.29669538140296936,2023-09-04 22:33:49.682999,2023-09-04 22:33:52.284654,0 days 00:00:02.601655,Tanh,Leaky,ReLU,Leaky,29,18,21.0,22.0,18.0,0.021806573452083602,4,229,0.724894942063894,0.0002906242722493085,131.0976281935169,COMPLETE
1460,0.344588041305542,2023-09-04 22:33:52.285637,2023-09-04 22:34:01.642302,0 days 00:00:09.356665,ReLU,Leaky,Sigmoid,Sigmoid,38,16,19.0,19.0,17.0,0.00039316999843486594,4,317,0.7695213405598041,4.28271667182029e-05,306.0355418952736,COMPLETE
1461,0.29936477541923523,2023-09-04 22:34:01.643306,2023-09-04 22:34:02.923442,0 days 00:00:01.280136,Tanh,Tanh,Sigmoid,Leaky,87,20,20.0,24.0,14.0,0.010104590039131705,4,287,0.6951775905740992,7.817040268425204e-05,158.9552432789522,COMPLETE
1462,0.9598578214645386,2023-09-04 22:34:02.924381,2023-09-04 22:34:03.682751,0 days 00:00:00.758370,Leaky,Sigmoid,Sigmoid,Leaky,92,19,15.0,12.0,5.0,0.0007969982595093337,4,240,0.252016269112203,0.004788097670570782,115.77125438054402,COMPLETE
1463,0.679482638835907,2023-09-04 22:34:03.683715,2023-09-04 22:34:17.642751,0 days 00:00:13.959036,Sigmoid,Leaky,ReLU,Sigmoid,50,18,23.0,21.0,3.0,7.22179051406945e-05,4,279,0.7483746636172127,0.00012907241013021594,180.68101791327146,COMPLETE
1464,0.7838324904441833,2023-09-04 22:34:17.643788,2023-09-04 22:34:18.778021,0 days 00:00:01.134233,Tanh,Leaky,Leaky,Leaky,85,10,20.0,23.0,7.0,0.0010680098788349091,4,249,0.15953481592164778,0.00020722907332628273,326.21107316725323,COMPLETE
1465,0.8915218114852905,2023-09-04 22:34:18.779051,2023-09-04 22:34:19.205773,0 days 00:00:00.426722,Tanh,Leaky,Sigmoid,Sigmoid,83,20,22.0,24.0,6.0,0.004969779784414995,4,259,0.19206351475410724,0.028991591281855807,117.08258361816407,COMPLETE
1466,0.9405834674835205,2023-09-04 22:34:19.206784,2023-09-04 22:34:20.561932,0 days 00:00:01.355148,ReLU,Leaky,Sigmoid,ReLU,43,19,18.0,22.0,20.0,0.012373930972677446,4,219,0.5971443548573577,0.05801052162909331,103.8805118560791,COMPLETE
1467,0.384147971868515,2023-09-04 22:34:20.562905,2023-09-04 22:34:33.166604,0 days 00:00:12.603699,Sigmoid,Leaky,Sigmoid,Leaky,36,17,21.0,18.0,8.0,0.0005200518443057916,4,237,0.7989757430182483,9.141343334592146e-05,158.4130736226621,COMPLETE
1468,0.45985496044158936,2023-09-04 22:34:33.167577,2023-09-04 22:34:34.803645,0 days 00:00:01.636068,Tanh,Leaky,Sigmoid,Sigmoid,89,18,19.0,23.0,5.0,0.0006644260472301246,4,230,0.5824622412913097,5.399527843617416e-05,106.34032779269748,COMPLETE
1469,0.26578444242477417,2023-09-04 22:34:34.804608,2023-09-04 22:34:37.968010,0 days 00:00:03.163402,Leaky,Leaky,Tanh,Leaky,26,19,20.0,24.0,17.0,0.007446105072334969,4,274,0.6546944823336911,0.00015879794227542025,113.9010398864746,COMPLETE
1470,0.5467754006385803,2023-09-04 22:34:37.968951,2023-09-04 22:34:38.434832,0 days 00:00:00.465881,Tanh,Leaky,ReLU,Leaky,87,16,21.0,23.0,2.0,0.032819596172179784,4,301,0.14560181884644252,1.3482184549140944e-05,296.69643892560686,COMPLETE
1471,0.6276372671127319,2023-09-04 22:34:38.435807,2023-09-04 22:34:43.837783,0 days 00:00:05.401976,ReLU,Leaky,Sigmoid,Sigmoid,33,20,20.0,23.0,6.0,0.0001659158219874771,4,245,0.22356299965940432,0.00019202726779680442,159.79551541075415,COMPLETE
1472,0.9622102975845337,2023-09-04 22:34:43.838743,2023-09-04 22:34:44.583625,0 days 00:00:00.744882,Tanh,Leaky,Sigmoid,Leaky,81,18,19.0,22.0,18.0,0.05434552175070518,4,209,0.5404801117987525,0.05160086172860221,102.54626745926707,COMPLETE
1473,0.25341081619262695,2023-09-04 22:34:44.584589,2023-09-04 22:34:47.310313,0 days 00:00:02.725724,Leaky,Leaky,Sigmoid,Sigmoid,83,17,22.0,20.0,4.0,0.014112933713459501,4,257,0.7182582957662014,0.00011139108032342555,121.6558135595077,COMPLETE
1474,0.3604971468448639,2023-09-04 22:34:47.311302,2023-09-04 22:34:48.306168,0 days 00:00:00.994866,Sigmoid,Leaky,ReLU,Leaky,85,10,21.0,24.0,16.0,0.02006842333059973,4,267,0.20999030901283822,0.00023835834149244978,222.80908912524842,COMPLETE
1475,0.38818037509918213,2023-09-04 22:34:48.307146,2023-09-04 22:34:49.708699,0 days 00:00:01.401553,Tanh,Leaky,Sigmoid,Sigmoid,79,19,16.0,23.0,19.0,0.009225163404180415,4,221,0.3236759418671386,0.0006027301055896318,135.99914478611302,COMPLETE
1476,0.4929083585739136,2023-09-04 22:34:49.709666,2023-09-04 22:34:50.746287,0 days 00:00:01.036621,Tanh,Leaky,Sigmoid,Leaky,29,19,20.0,24.0,7.0,0.024439514692391206,4,242,0.20416256901462573,0.0034404852592366726,357.51421944754463,COMPLETE
1477,0.43638432025909424,2023-09-04 22:34:50.747243,2023-09-04 22:34:52.220408,0 days 00:00:01.473165,Sigmoid,Leaky,Sigmoid,Leaky,90,18,21.0,22.0,5.0,0.01701359640896265,4,251,0.7997846886932752,0.0007862144528165816,179.22697321573892,COMPLETE
1478,0.5234178304672241,2023-09-04 22:34:52.221352,2023-09-04 22:34:53.360035,0 days 00:00:01.138683,ReLU,Leaky,,,87,18,20.0,,,0.0002674886843551627,2,229,0.1185824827240804,0.00038041709788064405,158.48870922904868,COMPLETE
1479,0.6816237568855286,2023-09-04 22:34:53.360964,2023-09-04 22:35:03.195954,0 days 00:00:09.834990,Tanh,Leaky,Sigmoid,Sigmoid,84,20,19.0,24.0,17.0,2.9917234020945277e-05,4,288,0.7532432915886715,1.957908573880909e-05,125.76787421438429,COMPLETE
1480,0.5093576312065125,2023-09-04 22:35:03.196895,2023-09-04 22:35:03.502098,0 days 00:00:00.305203,Leaky,,,,76,17,,,,0.09063016877325648,1,305,0.12204117642502754,0.0026239857466821797,198.51896626240497,COMPLETE
1481,0.3212597370147705,2023-09-04 22:35:03.502997,2023-09-04 22:35:14.234291,0 days 00:00:10.731294,Tanh,Leaky,ReLU,ReLU,41,18,18.0,23.0,20.0,0.0001477077107444235,4,236,0.5616457375068424,5.626324144392374e-05,105.35452490337825,COMPLETE
1482,0.6594484448432922,2023-09-04 22:35:14.235238,2023-09-04 22:35:22.739416,0 days 00:00:08.504178,Sigmoid,Leaky,Sigmoid,Leaky,81,20,19.0,22.0,6.0,4.903626585975671e-05,4,265,0.6971279663081251,1.0056409522786069e-05,133.80367944105618,COMPLETE
1483,0.4103856682777405,2023-09-04 22:35:22.740403,2023-09-04 22:35:24.177435,0 days 00:00:01.437032,ReLU,Leaky,Sigmoid,Sigmoid,32,19,22.0,12.0,18.0,0.003954149879422039,4,279,0.3151645052901744,0.0016412395287245308,117.97805081881009,COMPLETE
1484,0.3268958032131195,2023-09-04 22:35:24.178377,2023-09-04 22:35:27.084927,0 days 00:00:02.906550,Tanh,Tanh,Sigmoid,Leaky,86,17,20.0,13.0,4.0,0.013489701195222836,4,212,0.7659911039945054,7.364210849647049e-05,175.86032696774132,COMPLETE
1485,0.29898595809936523,2023-09-04 22:35:27.085891,2023-09-04 22:35:29.305408,0 days 00:00:02.219517,Leaky,Leaky,ReLU,Sigmoid,88,4,20.0,23.0,19.0,0.011616470639989695,4,248,0.7309935501706526,0.00013893083568354583,98.92950267176474,COMPLETE
1486,0.3518189489841461,2023-09-04 22:35:29.306372,2023-09-04 22:35:32.804463,0 days 00:00:03.498091,Tanh,Sigmoid,Sigmoid,Leaky,83,19,21.0,19.0,5.0,0.0027523805622534595,4,226,0.76850253265403,9.29840178049022e-05,207.02032430121238,COMPLETE
1487,0.293730229139328,2023-09-04 22:35:32.805444,2023-09-04 22:35:38.657544,0 days 00:00:05.852100,Sigmoid,Leaky,Sigmoid,Leaky,35,18,20.0,21.0,16.0,0.005973999472012932,4,316,0.727992280395769,1.652990625605523e-05,2248.072730932343,COMPLETE
1488,0.3329256772994995,2023-09-04 22:35:38.658538,2023-09-04 22:35:47.586366,0 days 00:00:08.927828,Tanh,Leaky,Leaky,Sigmoid,27,20,19.0,24.0,7.0,0.0007447666423629181,4,257,0.4436504115435701,0.0018268026434616687,133.86463945176865,COMPLETE
1489,0.4672577977180481,2023-09-04 22:35:47.587313,2023-09-04 22:35:48.510326,0 days 00:00:00.923013,ReLU,Leaky,Sigmoid,Leaky,93,19,22.0,23.0,3.0,0.020514573918027443,4,295,0.4033602763651274,0.00011652986792041743,164.20492453324167,COMPLETE
1490,0.3419829308986664,2023-09-04 22:35:48.511276,2023-09-04 22:35:49.612855,0 days 00:00:01.101579,Tanh,Leaky,ReLU,Sigmoid,30,14,21.0,11.0,1.0,0.010328664233989268,4,238,0.17128492695849434,3.7109280828187974e-05,99.83767472936752,COMPLETE
1491,0.45622560381889343,2023-09-04 22:35:49.613803,2023-09-04 22:35:51.138649,0 days 00:00:01.524846,Leaky,Leaky,Sigmoid,Leaky,85,18,18.0,22.0,15.0,0.0016473415234597936,4,217,0.38630124928862764,0.0003329321950275198,267.9663484934214,COMPLETE
1492,1.1413347721099854,2023-09-04 22:35:51.139602,2023-09-04 22:35:51.598955,0 days 00:00:00.459353,Sigmoid,Leaky,Sigmoid,Sigmoid,78,19,21.0,24.0,8.0,0.015987267598032255,4,272,0.14967685858018892,0.00018829933297158678,2154.708226742952,COMPLETE
1493,0.536651611328125,2023-09-04 22:35:51.599940,2023-09-04 22:35:52.126797,0 days 00:00:00.526857,Tanh,Leaky,Sigmoid,Leaky,81,17,17.0,23.0,6.0,0.00854939327339691,4,246,0.1345834589968497,0.00044539079700569136,163.66831228468152,COMPLETE
1494,0.2998606264591217,2023-09-04 22:35:52.127766,2023-09-04 22:35:53.288605,0 days 00:00:01.160839,Tanh,Leaky,Tanh,ReLU,89,21,19.0,23.0,18.0,0.003518360936969276,4,233,0.6699820108503738,7.180586897365578e-05,103.08530844411543,COMPLETE
1495,0.5565647482872009,2023-09-04 22:35:53.289549,2023-09-04 22:35:53.716714,0 days 00:00:00.427165,ReLU,Leaky,Sigmoid,Leaky,83,16,20.0,22.0,5.0,0.09888849202962702,4,261,0.10931840558135714,4.5823738012219484e-05,153.92013795035226,COMPLETE
1496,0.9048805236816406,2023-09-04 22:35:53.717687,2023-09-04 22:35:56.257983,0 days 00:00:02.540296,Sigmoid,Leaky,ReLU,Sigmoid,60,18,20.0,24.0,17.0,0.00018569175023819802,4,289,0.7030563269903626,0.06935822976470654,121.25582306473343,COMPLETE
1497,0.9723776578903198,2023-09-04 22:35:56.258973,2023-09-04 22:35:57.825124,0 days 00:00:01.566151,Leaky,Leaky,Sigmoid,Leaky,37,20,22.0,17.0,19.0,0.027746762422569664,4,226,0.7510758977099746,0.0095871716001148,122.53047307332356,COMPLETE
1498,1.1356394290924072,2023-09-04 22:35:57.826081,2023-09-04 22:35:58.378998,0 days 00:00:00.552917,Tanh,Leaky,Sigmoid,Sigmoid,85,18,21.0,23.0,2.0,0.01329336735045752,4,252,0.49614546201991905,0.020326522540103874,100.26942795973558,COMPLETE
1499,0.3274443447589874,2023-09-04 22:35:58.379968,2023-09-04 22:36:03.332511,0 days 00:00:04.952543,Tanh,Leaky,Sigmoid,Leaky,33,19,20.0,23.0,6.0,0.002328085045455276,4,240,0.799872802659519,0.00025112866223778505,99.7219481248122,COMPLETE
1500,0.31154242157936096,2023-09-04 22:36:03.333471,2023-09-04 22:36:09.667801,0 days 00:00:06.334330,ReLU,Leaky,ReLU,Sigmoid,87,10,19.0,21.0,7.0,0.0011698539178556422,4,274,0.7710439051426222,6.252288234004331e-05,147.33143297831217,COMPLETE
1501,0.37682655453681946,2023-09-04 22:36:09.668913,2023-09-04 22:36:12.306871,0 days 00:00:02.637958,Sigmoid,Leaky,Sigmoid,Leaky,82,20,19.0,24.0,5.0,0.0020879072469792677,4,244,0.4315873438218115,0.00014545822482991359,462.80420357840404,COMPLETE
1502,0.3110743463039398,2023-09-04 22:36:12.307839,2023-09-04 22:36:15.911914,0 days 00:00:03.604075,Tanh,Leaky,Sigmoid,Leaky,28,17,23.0,22.0,9.0,0.004873150630360911,4,219,0.6267921673636855,0.000301090812395068,146.45522398107192,COMPLETE
1503,0.254119336605072,2023-09-04 22:36:15.912872,2023-09-04 22:36:18.578295,0 days 00:00:02.665423,Leaky,Leaky,Sigmoid,Sigmoid,69,15,20.0,24.0,16.0,0.017860345386937256,4,308,0.7253336270841984,1.3360014996867718e-05,93.33111584003154,COMPLETE
1504,0.31702500581741333,2023-09-04 22:36:18.579252,2023-09-04 22:36:21.211995,0 days 00:00:02.632743,Tanh,Leaky,Sigmoid,Leaky,24,18,17.0,22.0,20.0,0.023112753943533824,4,256,0.5768252199340804,0.00017605447406105436,142.69930110258215,COMPLETE
1505,0.8462698459625244,2023-09-04 22:36:21.212954,2023-09-04 22:36:21.797673,0 days 00:00:00.584719,Sigmoid,Leaky,ReLU,Sigmoid,91,19,21.0,23.0,6.0,0.014469883573392307,4,233,0.6810714634571279,0.008304061282043352,103.51702880859375,COMPLETE
1506,0.8924071192741394,2023-09-04 22:36:21.798635,2023-09-04 22:36:28.751782,0 days 00:00:06.953147,Tanh,Leaky,Sigmoid,Leaky,31,21,21.0,14.0,4.0,2.4264198734165185e-05,4,285,0.23835894406064706,9.473139485340153e-05,89.05854224489447,COMPLETE
1507,0.3627825379371643,2023-09-04 22:36:28.752782,2023-09-04 22:36:30.124710,0 days 00:00:01.371928,ReLU,Tanh,Sigmoid,Leaky,80,20,24.0,13.0,18.0,0.011486296697602883,4,266,0.7483447748640566,0.0001237088977777238,302.9337306022644,COMPLETE
1508,0.28983813524246216,2023-09-04 22:36:30.125680,2023-09-04 22:36:48.717882,0 days 00:00:18.592202,Leaky,Leaky,Sigmoid,Sigmoid,39,19,20.0,24.0,17.0,0.00026952006577002905,4,299,0.7723614241380486,0.00022608143774305789,116.3293315670562,COMPLETE
1509,0.48478835821151733,2023-09-04 22:36:48.718839,2023-09-04 22:36:49.228700,0 days 00:00:00.509861,Tanh,Sigmoid,ReLU,ReLU,86,18,13.0,23.0,14.0,0.0382351421836265,4,207,0.17833870016410763,7.470356902995383e-05,120.75853955304181,COMPLETE
1510,0.9869446754455566,2023-09-04 22:36:49.229662,2023-09-04 22:36:51.544577,0 days 00:00:02.314915,Tanh,Leaky,Sigmoid,Leaky,44,11,18.0,18.0,19.0,1.2109291777905313e-05,4,225,0.11311827007517346,0.00015936087585354086,252.0592502170139,COMPLETE
1511,0.6155617833137512,2023-09-04 22:36:51.545555,2023-09-04 22:36:53.619147,0 days 00:00:02.073592,Sigmoid,Leaky,Sigmoid,Sigmoid,84,18,22.0,15.0,7.0,0.0004298837602173872,4,248,0.1532883870403726,3.499702863386165e-05,139.25923688950078,COMPLETE
1512,0.29806089401245117,2023-09-04 22:36:53.620107,2023-09-04 22:36:55.704365,0 days 00:00:02.084258,ReLU,Leaky,Leaky,Leaky,83,17,20.0,23.0,5.0,0.0070808024741558975,4,234,0.7021980026197071,0.004426558095752982,103.0634098710685,COMPLETE
1513,0.33188578486442566,2023-09-04 22:36:55.705337,2023-09-04 22:36:57.414890,0 days 00:00:01.709553,Tanh,Leaky,Sigmoid,Sigmoid,34,21,19.0,24.0,6.0,0.019906071773776145,4,281,0.3022104989283818,5.972950882031048e-05,134.45411276310048,COMPLETE
1514,0.8407224416732788,2023-09-04 22:36:57.415867,2023-09-04 22:37:04.178791,0 days 00:00:06.762924,Leaky,Leaky,ReLU,Leaky,88,9,21.0,12.0,21.0,1.4599419745601295e-05,4,242,0.646838808367421,1.1978314493582192e-05,94.92214259628422,COMPLETE
1515,0.34890270233154297,2023-09-04 22:37:04.179762,2023-09-04 22:37:05.169205,0 days 00:00:00.989443,Tanh,Leaky,Sigmoid,Leaky,79,19,20.0,17.0,18.0,0.010308727899527807,4,261,0.23200103287418397,8.724185671103381e-05,131.21738809054014,COMPLETE
