number,value,datetime_start,datetime_complete,duration,params_activation1,params_activation2,params_activation3,params_activation4,params_batch_size,params_fl1,params_fl2,params_fl3,params_fl4,params_learning_rate,params_n_layers,params_num_epochs,params_train_size,params_weight_decay,user_attrs_mre,state
776,0.40280574560165405,2023-09-04 21:24:57.733788,2023-09-04 21:24:57.993839,0 days 00:00:00.260051,Tanh,ReLU,,,76,19,23.0,,,0.008232464906227943,2,327,0.20319015907068144,0.0007059293044393793,126.46071411132813,COMPLETE
777,0.5445880889892578,2023-09-04 21:24:57.994202,2023-09-04 21:25:00.753172,0 days 00:00:02.758970,ReLU,ReLU,,,77,20,14.0,,,5.5953191762695496e-05,2,302,0.7490684331996613,0.00011261865865132905,220.065084444766,COMPLETE
778,0.2761560082435608,2023-09-04 21:25:00.753539,2023-09-04 21:25:03.683565,0 days 00:00:02.930026,ReLU,ReLU,,,79,19,23.0,,,0.0002428443158141722,2,310,0.7721572316371773,7.71195989806517e-05,196.52603306924144,COMPLETE
779,0.3996117413043976,2023-09-04 21:25:03.683979,2023-09-04 21:25:03.883935,0 days 00:00:00.199956,ReLU,ReLU,,,77,21,17.0,,,0.011042115843041106,2,336,0.17617934817302217,9.698906085008342e-05,168.5581748716293,COMPLETE
780,0.35218319296836853,2023-09-04 21:25:03.884317,2023-09-04 21:25:04.166829,0 days 00:00:00.282512,ReLU,ReLU,,,91,20,24.0,,,0.023441654682030577,2,323,0.44237390857444897,0.00015811456654269568,177.63167439336362,COMPLETE
781,0.47910264134407043,2023-09-04 21:25:04.167210,2023-09-04 21:25:05.258383,0 days 00:00:01.091173,ReLU,ReLU,,,81,19,24.0,,,0.0010770468708913607,2,295,0.7194314366736382,0.07525949721588046,282.45326524439866,COMPLETE
782,0.24993740022182465,2023-09-04 21:25:05.258760,2023-09-04 21:25:05.714716,0 days 00:00:00.455956,ReLU,ReLU,,,83,19,23.0,,,0.030615395141157357,2,311,0.7998130670670021,0.002725492367990705,337.3312184651693,COMPLETE
783,0.35981059074401855,2023-09-04 21:25:05.715070,2023-09-04 21:25:05.975221,0 days 00:00:00.260151,ReLU,ReLU,,,84,19,22.0,,,0.03469488552992867,2,312,0.7481676494850131,0.0036101755956159435,181.1048672993978,COMPLETE
784,0.4400899112224579,2023-09-04 21:25:05.975606,2023-09-04 21:25:07.292165,0 days 00:00:01.316559,ReLU,ReLU,,,84,18,23.0,,,0.0001499815136238261,2,326,0.3211132781390323,0.002593256900478529,150.19142824886768,COMPLETE
785,0.35767096281051636,2023-09-04 21:25:07.292546,2023-09-04 21:25:08.299203,0 days 00:00:01.006657,ReLU,ReLU,,,86,19,22.0,,,0.0007848675876072229,2,308,0.7701729280522654,0.0030351183515599494,538.7570622074711,COMPLETE
786,0.623555064201355,2023-09-04 21:25:08.299594,2023-09-04 21:25:12.307524,0 days 00:00:04.007930,ReLU,ReLU,,,86,19,23.0,,,1.024656279469483e-05,2,344,0.726311714904796,0.0024461926802626694,168.29723282747491,COMPLETE
787,0.4130633771419525,2023-09-04 21:25:12.307897,2023-09-04 21:25:12.491824,0 days 00:00:00.183927,ReLU,ReLU,,,85,18,23.0,,,0.04379516944068828,2,316,0.2399896146407168,0.0016844965158369159,161.17353548322404,COMPLETE
788,0.7976356744766235,2023-09-04 21:25:12.492185,2023-09-04 21:25:13.652135,0 days 00:00:01.159950,ReLU,ReLU,,,82,19,22.0,,,2.784426408894131e-05,2,305,0.12769839087228227,0.002438221491976359,108.79407328621286,COMPLETE
789,0.3123784065246582,2023-09-04 21:25:13.652814,2023-09-04 21:25:14.180803,0 days 00:00:00.527989,ReLU,ReLU,,,83,18,23.0,,,0.029535197071957217,2,294,0.41294940427422566,0.0021285511542258745,155.77076475081904,COMPLETE
790,0.36720407009124756,2023-09-04 21:25:14.181433,2023-09-04 21:25:17.054183,0 days 00:00:02.872750,ReLU,ReLU,,,83,3,24.0,,,0.013635179615283901,2,303,0.7666567794055976,0.0021780020736161237,181.90443508230524,COMPLETE
791,0.6537966728210449,2023-09-04 21:25:17.054559,2023-09-04 21:25:19.829572,0 days 00:00:02.775013,Leaky,ReLU,,,79,18,23.0,,,2.2509763831240924e-05,2,318,0.710605213075148,0.0008612404620096649,311.69613114842826,COMPLETE
792,0.37636685371398926,2023-09-04 21:25:19.829948,2023-09-04 21:25:20.127034,0 days 00:00:00.297086,Leaky,ReLU,,,88,19,23.0,,,0.03863781682345059,2,329,0.7739806970408647,0.004721112767003805,178.41574435763889,COMPLETE
793,0.31580471992492676,2023-09-04 21:25:20.127418,2023-09-04 21:25:20.541653,0 days 00:00:00.414235,ReLU,ReLU,,,82,19,22.0,,,0.01680999689308316,2,313,0.799717697020937,0.0037592669607921163,136.16670447901674,COMPLETE
794,0.4006706774234772,2023-09-04 21:25:20.542028,2023-09-04 21:25:20.737249,0 days 00:00:00.195221,ReLU,ReLU,,,81,18,23.0,,,0.0049752703492704385,2,293,0.18223653170465354,0.003949052113346034,331.5586073739188,COMPLETE
795,0.38765406608581543,2023-09-04 21:25:20.737614,2023-09-04 21:25:22.417216,0 days 00:00:01.679602,ReLU,ReLU,,,81,17,24.0,,,0.0004653052576042665,2,287,0.46401219898264834,0.002806434652802364,238.58486008062596,COMPLETE
796,0.6464952230453491,2023-09-04 21:25:22.417572,2023-09-04 21:25:23.154086,0 days 00:00:00.736514,ReLU,ReLU,,,87,18,23.0,,,7.504905515991012e-05,2,189,0.28656609796893473,0.005225012773678094,242.3415880152788,COMPLETE
797,0.6869349479675293,2023-09-04 21:25:23.154435,2023-09-04 21:25:23.932468,0 days 00:00:00.778033,ReLU,ReLU,,,80,17,22.0,,,3.8604045545533326e-05,2,321,0.16372345553391496,0.00013495533754801463,101.4014379435982,COMPLETE
798,0.35738274455070496,2023-09-04 21:25:23.932830,2023-09-04 21:25:24.535467,0 days 00:00:00.602637,ReLU,ReLU,Tanh,Tanh,85,18,23.0,22.0,18.0,0.001592474294725858,4,297,0.3550801365103217,0.0001650902879532124,205.68072803203876,COMPLETE
799,0.3994212746620178,2023-09-04 21:25:24.535850,2023-09-04 21:25:24.847278,0 days 00:00:00.311428,ReLU,Leaky,,,79,19,22.0,,,0.05791512997357524,2,338,0.7998507022465103,0.00010821456602063416,181.78096595177283,COMPLETE
800,0.37229007482528687,2023-09-04 21:25:24.847743,2023-09-04 21:25:25.248636,0 days 00:00:00.400893,ReLU,ReLU,,,83,18,24.0,,,0.0218737624192953,2,307,0.495577762125109,0.0005233645790548926,123.751168590481,COMPLETE
801,0.3597949743270874,2023-09-04 21:25:25.249089,2023-09-04 21:25:25.824676,0 days 00:00:00.575587,ReLU,Leaky,Sigmoid,,77,17,24.0,19.0,,0.026490975426340067,3,285,0.6937207948157671,0.0011729953653044428,1332.3893573467549,COMPLETE
802,0.24725542962551117,2023-09-04 21:25:25.825055,2023-09-04 21:25:26.674653,0 days 00:00:00.849598,Leaky,ReLU,,,80,17,23.0,,,0.0042372001813457735,2,304,0.7417032446026305,0.000129442555674102,128.72461492365056,COMPLETE
803,0.32649099826812744,2023-09-04 21:25:26.675105,2023-09-04 21:25:27.198691,0 days 00:00:00.523586,Leaky,ReLU,,,79,16,23.0,,,0.011721523156110617,2,301,0.7456613793348404,0.009971707059401634,161.98126390245227,COMPLETE
804,0.26316145062446594,2023-09-04 21:25:27.199074,2023-09-04 21:25:27.631536,0 days 00:00:00.432462,Leaky,ReLU,,,81,17,23.0,,,0.014667819184685385,2,307,0.7386848005510185,0.00015607074371017888,333.67491722106934,COMPLETE
805,0.3346938490867615,2023-09-04 21:25:27.631969,2023-09-04 21:25:28.124742,0 days 00:00:00.492773,Leaky,ReLU,,,82,16,22.0,,,0.0024494381069286677,2,303,0.5932598189332512,0.00014254558017025626,344.00948127867684,COMPLETE
806,0.43234169483184814,2023-09-04 21:25:28.125134,2023-09-04 21:25:28.367483,0 days 00:00:00.242349,Leaky,ReLU,,,81,16,23.0,,,0.006357041664430605,2,294,0.10273818801628828,0.00012684501479414426,144.12242369956158,COMPLETE
807,0.31066828966140747,2023-09-04 21:25:28.368138,2023-09-04 21:25:28.806474,0 days 00:00:00.438336,Leaky,ReLU,,,83,17,23.0,,,0.0096203173971387,2,309,0.27852887661848424,0.00016338487073022916,124.47483337402343,COMPLETE
808,0.33055001497268677,2023-09-04 21:25:28.806932,2023-09-04 21:25:29.158722,0 days 00:00:00.351790,Leaky,ReLU,,,80,17,22.0,,,0.014591302512478784,2,286,0.3788541373253746,0.008005460827901724,172.12531843341765,COMPLETE
809,0.2503213584423065,2023-09-04 21:25:29.159112,2023-09-04 21:25:29.650700,0 days 00:00:00.491588,Leaky,ReLU,,,85,16,24.0,,,0.012599855050031084,2,297,0.7418244914647387,0.0001325785505706444,157.52730692349948,COMPLETE
810,0.32536861300468445,2023-09-04 21:25:29.651109,2023-09-04 21:25:30.137228,0 days 00:00:00.486119,Leaky,ReLU,,,86,16,24.0,,,0.0028879600713962736,2,296,0.7376771358148875,0.00010840551830462901,182.48454793294272,COMPLETE
811,0.36303213238716125,2023-09-04 21:25:30.137604,2023-09-04 21:25:30.368705,0 days 00:00:00.231101,Leaky,ReLU,,,84,16,24.0,,,0.009927795866848523,2,309,0.2642256145645843,0.00012732658048293899,1028.5812863950375,COMPLETE
812,0.2966548502445221,2023-09-04 21:25:30.369071,2023-09-04 21:25:31.020014,0 days 00:00:00.650943,Leaky,ReLU,,,88,16,24.0,,,0.007840255926663814,2,293,0.7403129198343363,0.00015721851986906602,175.14694096491888,COMPLETE
813,0.377789169549942,2023-09-04 21:25:31.020407,2023-09-04 21:25:31.799011,0 days 00:00:00.778604,Leaky,ReLU,,,83,15,24.0,,,0.013184918563879383,2,304,0.7998952654130332,0.023255519708930212,146.02566068600385,COMPLETE
814,0.2930814325809479,2023-09-04 21:25:31.799371,2023-09-04 21:25:32.312089,0 days 00:00:00.512718,Leaky,ReLU,,,82,16,24.0,,,0.010041491045491607,2,283,0.7451736352111638,0.0006489648751204025,144.02735541001806,COMPLETE
815,0.3500969409942627,2023-09-04 21:25:32.312446,2023-09-04 21:25:32.892348,0 days 00:00:00.579902,Leaky,ReLU,,,85,15,21.0,,,0.0031533771217048547,2,313,0.7143285392302648,0.006656898403293249,188.08958883134144,COMPLETE
816,0.2842811048030853,2023-09-04 21:25:32.892726,2023-09-04 21:25:33.575933,0 days 00:00:00.683207,Leaky,ReLU,,,87,17,24.0,,,0.004058141213837432,2,296,0.770102691397453,0.0010060775713939287,128.09145645356514,COMPLETE
817,0.5646159052848816,2023-09-04 21:25:33.576297,2023-09-04 21:25:33.790914,0 days 00:00:00.214617,Leaky,ReLU,,,84,17,23.0,,,0.00236989847068117,2,287,0.14528734601059187,0.00011384392006547606,138.89650621414185,COMPLETE
818,0.5290628671646118,2023-09-04 21:25:33.791278,2023-09-04 21:25:33.953920,0 days 00:00:00.162642,Leaky,ReLU,,,89,17,21.0,,,0.013953756001258375,2,301,0.1568682535570863,0.0782224913090998,178.16883178710938,COMPLETE
819,0.2784408628940582,2023-09-04 21:25:33.954291,2023-09-04 21:25:34.401828,0 days 00:00:00.447537,Leaky,ReLU,,,85,17,23.0,,,0.011489554848900432,2,313,0.7697042678114814,0.00013243591997738868,314.5918409174139,COMPLETE
820,0.42351263761520386,2023-09-04 21:25:34.402206,2023-09-04 21:25:34.796804,0 days 00:00:00.394598,Leaky,ReLU,,,82,16,24.0,,,0.007551241696718475,2,278,0.7259506944887031,0.04162907689344017,207.40081552358774,COMPLETE
821,0.3466801643371582,2023-09-04 21:25:34.797180,2023-09-04 21:25:35.028169,0 days 00:00:00.230989,Leaky,ReLU,,,81,17,23.0,,,0.016669143890753725,2,303,0.31034249306061235,0.00018632768761161656,1825.42675054641,COMPLETE
822,0.33125370740890503,2023-09-04 21:25:35.028553,2023-09-04 21:25:35.273638,0 days 00:00:00.245085,Leaky,ReLU,,,80,17,24.0,,,0.012538658270972865,2,289,0.21490275121706076,0.003348889300733131,195.25699083732837,COMPLETE
823,0.2867811620235443,2023-09-04 21:25:35.274084,2023-09-04 21:25:36.037177,0 days 00:00:00.763093,Leaky,ReLU,,,84,16,23.0,,,0.0050045185919341964,2,295,0.6943555279486898,0.00014453332181687916,189.80131894891912,COMPLETE
824,0.6580526232719421,2023-09-04 21:25:36.037548,2023-09-04 21:25:41.892340,0 days 00:00:05.854792,ReLU,ReLU,,,87,17,22.0,,,1.4732277057908817e-05,2,321,0.7542710352290076,9.954675976903638e-05,197.45318175699109,COMPLETE
825,0.48631206154823303,2023-09-04 21:25:41.892704,2023-09-04 21:25:44.662863,0 days 00:00:02.770159,Leaky,ReLU,,,18,17,18.0,,,6.675943262504386e-05,2,304,0.2547073004878931,0.00011934754963396903,352.31128652472245,COMPLETE
826,0.3852233290672302,2023-09-04 21:25:44.663230,2023-09-04 21:25:44.836010,0 days 00:00:00.172780,Leaky,ReLU,,,83,16,24.0,,,0.015649559326547748,2,280,0.1771664311733447,0.0060569535197129215,187.7928744506836,COMPLETE
827,0.49835941195487976,2023-09-04 21:25:44.836368,2023-09-04 21:25:45.768512,0 days 00:00:00.932144,Leaky,ReLU,,,80,17,23.0,,,0.0014915090731335507,2,313,0.7745563582764453,0.014805270781879492,170.95009265368498,COMPLETE
828,0.32343560457229614,2023-09-04 21:25:45.769172,2023-09-04 21:25:46.204211,0 days 00:00:00.435039,ReLU,ReLU,,,79,15,22.0,,,0.005976340615405501,2,291,0.5103621971447979,0.0013406612735784734,124.22244993845622,COMPLETE
829,0.33950507640838623,2023-09-04 21:25:46.204610,2023-09-04 21:25:47.158768,0 days 00:00:00.954158,Leaky,ReLU,,,81,17,23.0,,,0.0012681594755369733,2,301,0.728353798748736,0.0001830948526000396,1085.9310467059795,COMPLETE
830,0.35743385553359985,2023-09-04 21:25:47.159190,2023-09-04 21:25:47.696382,0 days 00:00:00.537192,Leaky,Leaky,,,85,17,24.0,,,0.009271666190085891,2,313,0.7990479879758379,0.008445859020537768,142.48887821413436,COMPLETE
831,0.3577611744403839,2023-09-04 21:25:47.696831,2023-09-04 21:25:47.941706,0 days 00:00:00.244875,Leaky,ReLU,,,82,18,20.0,,,0.018146788026325137,2,282,0.33246918403035014,0.0019592651661342114,187.15338304307727,COMPLETE
832,0.49595704674720764,2023-09-04 21:25:47.942145,2023-09-04 21:25:48.508104,0 days 00:00:00.565959,ReLU,Leaky,,,78,18,23.0,,,0.003908993559157594,2,328,0.7502362278959741,0.08154765281714547,174.98246296665124,COMPLETE
833,0.3861292898654938,2023-09-04 21:25:48.508646,2023-09-04 21:25:49.663398,0 days 00:00:01.154752,Leaky,ReLU,,,80,16,21.0,,,0.0009611994001185977,2,297,0.4329071138228781,0.00014598862456899477,917.9827295450064,COMPLETE
834,0.3118573725223541,2023-09-04 21:25:49.663797,2023-09-04 21:25:50.469943,0 days 00:00:00.806146,Leaky,ReLU,,,86,18,22.0,,,0.0019979113155697615,2,308,0.552067150038498,9.149853921605246e-05,130.27755918341168,COMPLETE
835,0.30152857303619385,2023-09-04 21:25:50.470319,2023-09-04 21:25:51.324592,0 days 00:00:00.854273,Leaky,Leaky,,,84,17,24.0,,,0.012860256267853845,2,275,0.6914126335217836,0.00011194798202074438,241.14407316843668,COMPLETE
836,0.42955657839775085,2023-09-04 21:25:51.325250,2023-09-04 21:25:51.719694,0 days 00:00:00.394444,ReLU,ReLU,,,81,18,23.0,,,0.007129401762406053,2,294,0.23954167031466714,0.00017098556609436124,158.92214711507162,COMPLETE
837,0.34670567512512207,2023-09-04 21:25:51.720370,2023-09-04 21:25:52.917396,0 days 00:00:01.197026,Leaky,Leaky,,,78,16,23.0,,,0.016336614947548997,2,287,0.7161260563494435,0.002875902432535099,124.4447135925293,COMPLETE
838,0.3106987476348877,2023-09-04 21:25:52.917789,2023-09-04 21:25:53.264886,0 days 00:00:00.347097,Leaky,ReLU,,,83,17,7.0,,,0.01916767103153791,2,177,0.7751229861887439,0.00021090413234937968,231.73853787508878,COMPLETE
839,0.3313923180103302,2023-09-04 21:25:53.265242,2023-09-04 21:25:53.813153,0 days 00:00:00.547911,Leaky,ReLU,,,79,18,24.0,,,0.010409265225692976,2,320,0.7450742049773841,0.0001256052030157798,264.73765781947543,COMPLETE
840,0.3124130070209503,2023-09-04 21:25:53.813506,2023-09-04 21:25:54.634412,0 days 00:00:00.820906,ReLU,Leaky,,,81,17,22.0,,,0.003095606036316776,2,391,0.6534330326803615,0.0001509884745047875,155.8693583271291,COMPLETE
841,0.3762895166873932,2023-09-04 21:25:54.634795,2023-09-04 21:25:55.056151,0 days 00:00:00.421356,Leaky,ReLU,,,53,18,15.0,,,0.014398680910692574,2,305,0.38727488287300854,8.817846033924822e-05,200.32540924695073,COMPLETE
842,0.41679510474205017,2023-09-04 21:25:55.056532,2023-09-04 21:25:55.503718,0 days 00:00:00.447186,Sigmoid,Leaky,,,98,18,23.0,,,0.004746378803832752,2,200,0.7995802779370605,0.0017471664234787584,175.15556838664602,COMPLETE
843,0.3227252960205078,2023-09-04 21:25:55.504107,2023-09-04 21:25:56.197614,0 days 00:00:00.693507,Leaky,ReLU,,,85,17,24.0,,,0.0017956420402784384,2,291,0.708278935042084,0.0015487232311925845,577.7802093119561,COMPLETE
844,0.5517875552177429,2023-09-04 21:25:56.197997,2023-09-04 21:25:56.350552,0 days 00:00:00.152555,Leaky,ReLU,,,90,18,22.0,,,0.005666784261202526,2,276,0.11540083879395209,0.00010596228070986171,565.7398258332283,COMPLETE
845,0.288534939289093,2023-09-04 21:25:56.350930,2023-09-04 21:25:56.823345,0 days 00:00:00.472415,ReLU,Leaky,,,78,16,21.0,,,0.0197416100142881,2,303,0.7665432476375453,0.00019512184223590017,100.66126748789911,COMPLETE
846,0.3374280035495758,2023-09-04 21:25:56.823719,2023-09-04 21:25:57.177155,0 days 00:00:00.353436,Leaky,ReLU,,,82,14,17.0,,,0.011762723089636646,2,309,0.7404271235641169,0.00013563838967714753,3187.2248116629466,COMPLETE
847,0.455452561378479,2023-09-04 21:25:57.177529,2023-09-04 21:25:57.489623,0 days 00:00:00.312094,Leaky,Leaky,,,80,5,7.0,,,0.015546425444954312,2,318,0.44468667691776337,0.00016645014341489867,181.93396868024553,COMPLETE
848,0.42399683594703674,2023-09-04 21:25:57.489986,2023-09-04 21:25:58.439083,0 days 00:00:00.949097,Sigmoid,ReLU,,,87,17,20.0,,,0.0040449529589233766,2,215,0.6792923074339464,0.004293017394015367,271.6225748062134,COMPLETE
849,0.4328029453754425,2023-09-04 21:25:58.439466,2023-09-04 21:25:58.700883,0 days 00:00:00.261417,Leaky,ReLU,,,77,18,23.0,,,0.00889436211947765,2,284,0.2060135396426391,0.031494437943790296,133.16801121360376,COMPLETE
850,0.36128777265548706,2023-09-04 21:25:58.701261,2023-09-04 21:25:59.497819,0 days 00:00:00.796558,ReLU,Leaky,,,83,18,19.0,,,0.0023753076838019136,2,294,0.799566733497891,0.00010743568219647202,140.67003328254424,COMPLETE
851,0.323520302772522,2023-09-04 21:25:59.498201,2023-09-04 21:25:59.943311,0 days 00:00:00.445110,Leaky,ReLU,,,30,17,24.0,,,0.021025810450407918,2,299,0.3010620569729776,0.00022124249378408214,118.07595655653212,COMPLETE
852,0.3574359118938446,2023-09-04 21:25:59.943705,2023-09-04 21:26:00.821585,0 days 00:00:00.877880,Leaky,ReLU,,,79,16,6.0,,,0.002662059166210449,2,270,0.770092535676535,0.01101444920207167,3164.5482124077093,COMPLETE
853,0.3653140962123871,2023-09-04 21:26:00.821975,2023-09-04 21:26:02.096746,0 days 00:00:01.274771,Leaky,Leaky,,,89,19,23.0,,,0.0003967950080416638,2,365,0.7207996442809186,8.357098505376213e-05,176.87516740932585,COMPLETE
854,0.3705235421657562,2023-09-04 21:26:02.097132,2023-09-04 21:26:02.631848,0 days 00:00:00.534716,Leaky,ReLU,,,81,18,18.0,,,0.016776281498418904,2,328,0.7480425730233138,0.0009488907315404465,165.1418813532049,COMPLETE
855,0.6859028339385986,2023-09-04 21:26:02.632239,2023-09-04 21:26:04.012764,0 days 00:00:01.380525,ReLU,Leaky,,,77,17,7.0,,,3.783786782227496e-05,2,312,0.34875881857519964,4.538752857797312e-05,187.78466151310846,COMPLETE
856,0.6191971302032471,2023-09-04 21:26:04.013129,2023-09-04 21:26:04.433503,0 days 00:00:00.420374,Sigmoid,ReLU,,,86,15,22.0,,,0.00032569701613782156,2,278,0.12314017083481989,0.00013069900601113854,190.42978457746835,COMPLETE
857,0.8860501050949097,2023-09-04 21:26:04.433870,2023-09-04 21:26:05.472010,0 days 00:00:01.038140,Leaky,ReLU,,,79,19,23.0,,,1.8276218190222704e-05,2,287,0.2700775236019205,0.00017155878147812154,116.12950267193625,COMPLETE
858,0.39595678448677063,2023-09-04 21:26:05.472389,2023-09-04 21:26:09.850730,0 days 00:00:04.378341,Leaky,Leaky,Leaky,,83,18,24.0,2.0,,9.579276842070975e-05,3,479,0.7023036409441313,0.002014803930711422,166.95222297939227,COMPLETE
859,0.4080508351325989,2023-09-04 21:26:09.851101,2023-09-04 21:26:10.014315,0 days 00:00:00.163214,Leaky,ReLU,,,82,18,14.0,,,0.012368961980531876,2,499,0.14939322754874484,0.00010064040405083791,445.6877616188743,COMPLETE
860,0.41703009605407715,2023-09-04 21:26:10.014699,2023-09-04 21:26:11.203418,0 days 00:00:01.188719,ReLU,Leaky,,,84,17,8.0,,,0.0015348707315088537,2,302,0.7676188683764806,0.04718239099929131,400.0509174143085,COMPLETE
861,0.6605828404426575,2023-09-04 21:26:11.203813,2023-09-04 21:26:14.209833,0 days 00:00:03.006020,Leaky,Tanh,,,77,12,16.0,,,1.972934742327605e-05,2,318,0.7993800668263674,0.01674731179068664,144.66577659462982,COMPLETE
862,0.5763545632362366,2023-09-04 21:26:14.210212,2023-09-04 21:26:14.330391,0 days 00:00:00.120179,Leaky,,,,80,19,,,,0.006222913477334239,1,209,0.10024897037643629,0.0006561109076459717,144.38585459391277,COMPLETE
863,0.6548318862915039,2023-09-04 21:26:14.330754,2023-09-04 21:26:15.943410,0 days 00:00:01.612656,Sigmoid,ReLU,,,78,17,23.0,,,0.0001424755477061563,2,288,0.4188261212043544,0.06233206792451234,164.3983547422621,COMPLETE
864,0.30022934079170227,2023-09-04 21:26:15.943795,2023-09-04 21:26:16.329800,0 days 00:00:00.386005,Leaky,Tanh,,,81,18,7.0,,,0.022353013581265423,2,350,0.6360779348168693,7.114501675365335e-05,132.92664441195402,COMPLETE
865,0.3795735538005829,2023-09-04 21:26:16.330187,2023-09-04 21:26:16.881809,0 days 00:00:00.551622,ReLU,Tanh,,,23,16,22.0,,,0.018597966598572838,2,266,0.5800111577516023,0.01145587595781547,186.2400680541992,COMPLETE
866,0.31573209166526794,2023-09-04 21:26:16.882196,2023-09-04 21:26:17.319584,0 days 00:00:00.437388,Leaky,ReLU,,,76,18,20.0,,,0.008802223098542295,2,299,0.7315842778503361,0.0005239714007120297,236.17184032093394,COMPLETE
867,0.2982505261898041,2023-09-04 21:26:17.319980,2023-09-04 21:26:17.647013,0 days 00:00:00.327033,Leaky,Leaky,,,85,19,21.0,,,0.014484827936623281,2,308,0.6694879185744997,0.00015329550624542992,117.34869450160436,COMPLETE
868,0.32134342193603516,2023-09-04 21:26:17.647426,2023-09-04 21:26:18.762747,0 days 00:00:01.115321,Leaky,Tanh,,,79,17,8.0,,,0.0036975001127539046,2,294,0.7482666154075787,0.00012574254973590798,170.06053149010523,COMPLETE
869,0.5186343789100647,2023-09-04 21:26:18.763129,2023-09-04 21:26:18.924646,0 days 00:00:00.161517,ReLU,ReLU,,,82,18,24.0,,,0.03381774614007616,2,278,0.16462757573323644,0.0002881811609823547,123.5400904337565,COMPLETE
870,0.5806900262832642,2023-09-04 21:26:18.925017,2023-09-04 21:26:19.154130,0 days 00:00:00.229113,Sigmoid,Tanh,,,35,19,23.0,,,0.023859694150151274,2,487,0.3286152791945164,0.012718803038298143,223.73139190673828,COMPLETE
871,0.39182862639427185,2023-09-04 21:26:19.154503,2023-09-04 21:26:19.355558,0 days 00:00:00.201055,Tanh,Leaky,,,84,16,8.0,,,0.01797800959592056,2,315,0.22817337276396166,0.00018796779158822093,269.44757349350874,COMPLETE
872,0.4822588860988617,2023-09-04 21:26:19.355945,2023-09-04 21:26:19.655381,0 days 00:00:00.299436,Leaky,Tanh,,,80,17,24.0,,,0.001276056306894172,2,329,0.22992367716313594,0.003593338055698912,176.68230888171072,COMPLETE
