number,value,datetime_start,datetime_complete,duration,params_activation1,params_activation2,params_activation3,params_activation4,params_batch_size,params_fl1,params_fl2,params_fl3,params_fl4,params_learning_rate,params_n_layers,params_num_epochs,params_train_size,params_weight_decay,user_attrs_mre,state
941,0.2905893325805664,2023-09-04 21:48:30.453186,2023-09-04 21:48:31.083081,0 days 00:00:00.629895,Tanh,Leaky,,,21,11,15.0,,,0.01761692447034316,2,358,0.6798623224417378,0.00012607836593005517,236.30706133161272,COMPLETE
942,1.0185467004776,2023-09-04 21:48:31.083453,2023-09-04 21:48:31.365040,0 days 00:00:00.281587,ReLU,Sigmoid,Leaky,,23,12,17.0,14.0,,0.0028027105743965823,3,315,0.5591222432843262,0.09601516679461415,99.62895133278586,COMPLETE
943,0.3658668100833893,2023-09-04 21:48:31.365415,2023-09-04 21:48:31.985252,0 days 00:00:00.619837,Tanh,Leaky,Leaky,,30,11,16.0,20.0,,0.00902450224837008,3,411,0.48076746741308335,0.0007156711011416236,96.70694514683315,COMPLETE
944,0.3248157799243927,2023-09-04 21:48:31.985641,2023-09-04 21:48:32.327706,0 days 00:00:00.342065,Tanh,Leaky,,,26,10,14.0,,,0.011617300757823676,2,394,0.40308074315199005,0.0002004610297629353,152.36061661331743,COMPLETE
945,0.4519445598125458,2023-09-04 21:48:32.328079,2023-09-04 21:48:36.044108,0 days 00:00:03.716029,Sigmoid,Sigmoid,Leaky,,17,11,18.0,10.0,,0.000514885111048974,3,347,0.7678537999877577,0.012727580450090108,118.5312523098167,COMPLETE
946,0.2857300341129303,2023-09-04 21:48:36.044490,2023-09-04 21:48:37.019660,0 days 00:00:00.975170,Tanh,Leaky,Leaky,,28,22,15.0,11.0,,0.013975640789597924,3,375,0.7447537962513153,2.4516569882036574e-05,94.83194661694904,COMPLETE
947,0.2830185294151306,2023-09-04 21:48:37.020067,2023-09-04 21:48:38.375858,0 days 00:00:01.355791,ReLU,Leaky,,,31,12,17.0,,,0.002141969715884269,2,441,0.6978393275621019,0.0035787274923971004,102.26121485510538,COMPLETE
948,0.4886333644390106,2023-09-04 21:48:38.376231,2023-09-04 21:48:40.018994,0 days 00:00:01.642763,Tanh,Sigmoid,Leaky,,19,8,16.0,15.0,,0.000462251292398551,3,333,0.42315101975354047,0.05088060726016144,104.64007662655263,COMPLETE
949,0.38053709268569946,2023-09-04 21:48:40.019392,2023-09-04 21:48:40.312700,0 days 00:00:00.293308,Tanh,Leaky,,,24,10,15.0,,,0.0071974409152958906,2,120,0.11358719971447238,0.004672343773555566,113.05545114370493,COMPLETE
950,0.35472095012664795,2023-09-04 21:48:40.313119,2023-09-04 21:48:41.503617,0 days 00:00:01.190498,ReLU,ReLU,Leaky,,91,12,19.0,16.0,,0.0002669930155323061,3,365,0.6556991113839483,5.461685583895323e-05,106.46103408488821,COMPLETE
951,0.38086286187171936,2023-09-04 21:48:41.504009,2023-09-04 21:48:43.714264,0 days 00:00:02.210255,Tanh,Leaky,,,15,9,13.0,,,0.0036360809922317675,2,228,0.5911492319886777,0.02571712172778678,117.80658271985176,COMPLETE
952,0.30210354924201965,2023-09-04 21:48:43.714667,2023-09-04 21:48:44.846352,0 days 00:00:01.131685,Tanh,Sigmoid,Leaky,,22,13,20.0,24.0,,0.027236069583086733,3,208,0.7215227367507676,0.0002859487048065274,101.52709104956651,COMPLETE
953,0.30422356724739075,2023-09-04 21:48:44.846744,2023-09-04 21:48:45.520209,0 days 00:00:00.673465,Tanh,Leaky,Tanh,,38,11,17.0,4.0,,0.02148906121797093,3,385,0.7695068733946674,3.7421361131581134e-05,111.34293993781594,COMPLETE
954,0.34726718068122864,2023-09-04 21:48:45.520625,2023-09-04 21:48:45.905700,0 days 00:00:00.385075,Leaky,Leaky,Leaky,,26,12,18.0,24.0,,0.016676442584161365,3,419,0.382497185042726,0.00016729427551301557,132.73927248441257,COMPLETE
955,0.3026871979236603,2023-09-04 21:48:45.906106,2023-09-04 21:48:47.589631,0 days 00:00:01.683525,ReLU,Sigmoid,,,13,14,16.0,,,0.03911282324686942,2,341,0.7725319030180284,1.26632827589411e-05,93.27899286021356,COMPLETE
956,0.3906300961971283,2023-09-04 21:48:47.590037,2023-09-04 21:48:47.888092,0 days 00:00:00.298055,Tanh,Leaky,Sigmoid,,28,11,18.0,14.0,,0.00593180849946236,3,354,0.19259674411021974,0.0014002600799287235,113.70893902248807,COMPLETE
957,0.34888118505477905,2023-09-04 21:48:47.888493,2023-09-04 21:48:48.796062,0 days 00:00:00.907569,Tanh,Tanh,,,21,10,17.0,,,0.009902211755528129,2,454,0.37596087379463256,6.98217252252021e-05,96.12972985544512,COMPLETE
958,0.3599169850349426,2023-09-04 21:48:48.796744,2023-09-04 21:48:50.303611,0 days 00:00:01.506867,Tanh,Leaky,Leaky,,34,11,15.0,19.0,,0.001759340431858788,3,404,0.2651745076902577,0.00013887171201928941,140.91992305701888,COMPLETE
959,0.39066824316978455,2023-09-04 21:48:50.304320,2023-09-04 21:48:50.935228,0 days 00:00:00.630908,ReLU,Sigmoid,Leaky,,18,13,16.0,5.0,,0.012614706575326184,3,429,0.2848642143352084,9.98980664166682e-05,185.3992099761963,COMPLETE
960,0.3586352467536926,2023-09-04 21:48:50.935642,2023-09-04 21:48:55.344089,0 days 00:00:04.408447,Tanh,Leaky,Leaky,,24,12,14.0,9.0,,0.0006971383992926605,3,380,0.7398871211658598,0.0020579984285558467,105.41377694266183,COMPLETE
961,0.3799324333667755,2023-09-04 21:48:55.344500,2023-09-04 21:48:57.335795,0 days 00:00:01.991295,Tanh,Leaky,,,26,21,17.0,,,0.00018201711616777004,2,362,0.21861389164818124,0.00022432842015422135,116.01148620990548,COMPLETE
962,0.34717342257499695,2023-09-04 21:48:57.336178,2023-09-04 21:49:04.407860,0 days 00:00:07.071682,Tanh,Sigmoid,Leaky,,32,11,15.0,11.0,,0.0003680018654337281,3,412,0.6275405101885011,3.198935688011769e-05,105.64819790845249,COMPLETE
963,0.6230140328407288,2023-09-04 21:49:04.408258,2023-09-04 21:49:05.426030,0 days 00:00:01.017772,ReLU,,,,29,12,,,,8.646257278802397e-05,1,298,0.17269379676157975,5.104769458826288e-05,105.32689321121113,COMPLETE
964,0.37171515822410583,2023-09-04 21:49:05.426394,2023-09-04 21:49:05.809165,0 days 00:00:00.382771,Tanh,Leaky,,,23,11,16.0,,,0.008212840049893453,2,393,0.29446794697174833,0.00037789594549830313,119.87956659417404,COMPLETE
965,0.2984144389629364,2023-09-04 21:49:05.809550,2023-09-04 21:49:08.560243,0 days 00:00:02.750693,Tanh,Leaky,Leaky,,16,10,19.0,13.0,,0.0012219283135474041,3,355,0.6988145069748048,1.966423349401748e-05,116.90402357918876,COMPLETE
966,0.3261052072048187,2023-09-04 21:49:08.560640,2023-09-04 21:49:09.083725,0 days 00:00:00.523085,Tanh,Sigmoid,Leaky,,19,12,18.0,24.0,,0.0195410307428256,3,372,0.3486479487143308,0.0006574864410057363,131.3474097251892,COMPLETE
967,0.44992226362228394,2023-09-04 21:49:09.084118,2023-09-04 21:49:14.342581,0 days 00:00:05.258463,ReLU,Leaky,,,21,11,16.0,,,2.0327904488840163e-05,2,343,0.5055666660977591,0.00019752276149145854,224.03697458161557,COMPLETE
968,0.3446711599826813,2023-09-04 21:49:14.342976,2023-09-04 21:49:18.971448,0 days 00:00:04.628472,Sigmoid,Leaky,Tanh,,27,20,17.0,22.0,,0.0009097006132313748,3,327,0.7982448374097071,9.17483227218541e-05,94.03154224929415,COMPLETE
969,1.0953232049942017,2023-09-04 21:49:18.971845,2023-09-04 21:49:20.842794,0 days 00:00:01.870949,Tanh,Sigmoid,Leaky,,25,9,15.0,20.0,,1.3118681716167456e-05,3,364,0.1496420598079207,0.00014389595782814913,111.93604144421252,COMPLETE
970,0.28939691185951233,2023-09-04 21:49:20.843194,2023-09-04 21:49:21.594226,0 days 00:00:00.751032,Tanh,Leaky,Leaky,,31,13,14.0,3.0,,0.01114819331297074,3,382,0.7446320147040673,1.4687076097588365e-05,113.77488555908204,COMPLETE
971,0.3823952376842499,2023-09-04 21:49:21.594619,2023-09-04 21:49:22.126838,0 days 00:00:00.532219,ReLU,Leaky,,,36,10,16.0,,,0.01454573004935803,2,423,0.6687134443417241,0.0001112133996846933,90.47451210021973,COMPLETE
972,0.33444586396217346,2023-09-04 21:49:22.127213,2023-09-04 21:49:23.762285,0 days 00:00:01.635072,Tanh,Sigmoid,,,23,12,17.0,,,0.0029827464684414363,2,351,0.7184784256935295,4.5634583889018506e-05,104.76391067504883,COMPLETE
973,0.4217836558818817,2023-09-04 21:49:23.762677,2023-09-04 21:49:27.479035,0 days 00:00:03.716358,Tanh,Leaky,Leaky,,20,22,14.0,23.0,,2.393328012876718e-05,3,394,0.2371215307703072,0.0011092563664644867,118.44193871977366,COMPLETE
974,0.36299067735671997,2023-09-04 21:49:27.479435,2023-09-04 21:49:27.729935,0 days 00:00:00.250500,Tanh,Leaky,Leaky,,29,11,22.0,12.0,,0.004908218253251924,3,406,0.2564535060716942,2.7324992283787464e-05,187.9111036217731,COMPLETE
975,0.9959039092063904,2023-09-04 21:49:27.730331,2023-09-04 21:49:30.580746,0 days 00:00:02.850415,ReLU,Sigmoid,Leaky,,16,12,15.0,14.0,,1.00501192664897e-05,3,335,0.17528387197780723,0.0002612847159462325,111.55968791904733,COMPLETE
976,0.3289184868335724,2023-09-04 21:49:30.581144,2023-09-04 21:49:31.209193,0 days 00:00:00.628049,Tanh,ReLU,,,25,10,18.0,,,0.023687297443594862,2,372,0.7715654168564088,0.00016794650929740002,94.26943860735211,COMPLETE
977,0.4184129238128662,2023-09-04 21:49:31.209581,2023-09-04 21:49:31.543292,0 days 00:00:00.333711,Tanh,Leaky,Leaky,,27,13,17.0,22.0,,0.07135319299464472,3,439,0.21014508796630002,6.673036865161093e-05,116.16427555084229,COMPLETE
978,0.45896339416503906,2023-09-04 21:49:31.543698,2023-09-04 21:49:31.910994,0 days 00:00:00.367296,Leaky,Leaky,Sigmoid,,11,11,16.0,13.0,,0.016381543029220985,3,363,0.11982604803575417,0.0075299915374888666,112.84634039137099,COMPLETE
979,0.3468511700630188,2023-09-04 21:49:31.911396,2023-09-04 21:49:32.413119,0 days 00:00:00.501723,Tanh,Sigmoid,,,22,11,1.0,,,0.012367356938663226,2,346,0.30073391884553746,3.890149284279356e-05,824.4999969482421,COMPLETE
980,0.4158843755722046,2023-09-04 21:49:32.413524,2023-09-04 21:49:33.032937,0 days 00:00:00.619413,ReLU,Leaky,Leaky,,18,12,19.0,2.0,,0.009721220824209485,3,416,0.27233269698650475,0.0008039405032458918,117.17106612523396,COMPLETE
981,0.3291400074958801,2023-09-04 21:49:33.033327,2023-09-04 21:49:34.365693,0 days 00:00:01.332366,Tanh,Leaky,,,30,11,15.0,,,0.0019958015317044406,2,471,0.7481343008870902,0.0029608775349710265,110.6457448191457,COMPLETE
982,0.39456814527511597,2023-09-04 21:49:34.366086,2023-09-04 21:49:40.992338,0 days 00:00:06.626252,Tanh,Sigmoid,Tanh,,20,9,16.0,24.0,,6.628807594061908e-05,3,248,0.7092549371258718,0.00012251820029251327,115.48926362683696,COMPLETE
983,0.2613384425640106,2023-09-04 21:49:40.992739,2023-09-04 21:49:42.130287,0 days 00:00:01.137548,Tanh,Leaky,Leaky,,24,12,12.0,15.0,,0.006681362616505755,3,384,0.7736511455152179,0.0003291510046603055,90.92435969862827,COMPLETE
984,0.3324545621871948,2023-09-04 21:49:42.130671,2023-09-04 21:49:43.031613,0 days 00:00:00.900942,ReLU,Leaky,Leaky,,24,10,13.0,15.0,,0.0061956229697712325,3,395,0.6834150157527223,0.000351629458419849,101.89425839875874,COMPLETE
985,0.30771589279174805,2023-09-04 21:49:43.032011,2023-09-04 21:49:44.656660,0 days 00:00:01.624649,Tanh,Leaky,,,22,13,12.0,,,0.005372321856018227,2,401,0.7999333166256505,0.00030388131265637707,90.43551099300385,COMPLETE
986,0.33743634819984436,2023-09-04 21:49:44.657405,2023-09-04 21:49:45.495027,0 days 00:00:00.837622,Tanh,Leaky,Leaky,,24,12,12.0,14.0,,0.05034628369897894,3,389,0.7305001519228709,0.0002678599119820897,97.26995168413434,COMPLETE
987,0.31859415769577026,2023-09-04 21:49:45.495498,2023-09-04 21:49:47.042293,0 days 00:00:01.546795,Tanh,Leaky,,,23,11,11.0,,,0.007329246661084926,2,387,0.5803820377943816,0.0004162708145653417,89.4515393938337,COMPLETE
988,0.358832448720932,2023-09-04 21:49:47.043007,2023-09-04 21:49:50.485024,0 days 00:00:03.442017,ReLU,Leaky,Leaky,,21,10,12.0,16.0,,0.0005998424947186949,3,270,0.6120520461558666,0.000230351824173586,102.19123544044865,COMPLETE
989,0.30809348821640015,2023-09-04 21:49:50.485419,2023-09-04 21:49:51.229592,0 days 00:00:00.744173,Tanh,Leaky,Leaky,,25,11,12.0,15.0,,0.007758088704355815,3,411,0.7698836560685051,0.0003327236128896264,275.7834924970354,COMPLETE
990,0.3553136885166168,2023-09-04 21:49:51.229982,2023-09-04 21:49:52.524848,0 days 00:00:01.294866,Tanh,Leaky,,,21,8,12.0,,,0.003965154346174802,2,398,0.661672996526878,0.0005290552357371556,101.04137590196397,COMPLETE
991,0.3966199457645416,2023-09-04 21:49:52.525234,2023-09-04 21:49:53.003296,0 days 00:00:00.478062,Tanh,Leaky,Leaky,,18,12,13.0,14.0,,0.0004458914696399481,3,382,0.10494693180430076,0.00024080483366463568,246.41507711971508,COMPLETE
992,0.4215037524700165,2023-09-04 21:49:53.003685,2023-09-04 21:49:56.854098,0 days 00:00:03.850413,ReLU,Leaky,Leaky,,23,12,12.0,13.0,,0.00015131747313548496,3,432,0.24824659279245206,0.006138558771605839,134.63182565740948,COMPLETE
993,0.7413213849067688,2023-09-04 21:49:56.854485,2023-09-04 21:50:01.831036,0 days 00:00:04.976551,Sigmoid,Leaky,,,20,14,13.0,,,3.5461506331297736e-05,2,405,0.1619944549384612,0.0003861649866723973,126.5204146962107,COMPLETE
994,0.3686908483505249,2023-09-04 21:50:01.831434,2023-09-04 21:50:03.361181,0 days 00:00:01.529747,Tanh,Leaky,Tanh,,14,11,11.0,14.0,,0.001082293583199205,3,387,0.43332776004163737,0.00019363394217354458,92.09424328804016,COMPLETE
995,0.3163641393184662,2023-09-04 21:50:03.361578,2023-09-04 21:50:04.165932,0 days 00:00:00.804354,Tanh,Leaky,,,26,22,13.0,,,0.006453438609573044,2,285,0.7188672678969259,0.000312097206001322,98.40258049242425,COMPLETE
996,0.29186439514160156,2023-09-04 21:50:04.166305,2023-09-04 21:50:07.002556,0 days 00:00:02.836251,Tanh,Leaky,Leaky,,24,21,11.0,13.0,,0.0008204004045476902,3,379,0.7521097450884341,8.57305648144637e-05,94.98920355110525,COMPLETE
997,0.330966979265213,2023-09-04 21:50:07.002966,2023-09-04 21:50:11.677697,0 days 00:00:04.674731,ReLU,Leaky,Leaky,,22,11,12.0,15.0,,0.0002942094559506188,3,426,0.639709602345282,0.009530805619257041,125.51688564740695,COMPLETE
998,0.35220491886138916,2023-09-04 21:50:11.678100,2023-09-04 21:50:12.397402,0 days 00:00:00.719302,Tanh,Leaky,,,19,10,13.0,,,0.008479880116594826,2,322,0.49559164950343804,0.0025919184023573036,211.5540399318788,COMPLETE
999,0.3211459517478943,2023-09-04 21:50:12.397780,2023-09-04 21:50:13.408021,0 days 00:00:01.010241,Tanh,Leaky,Leaky,,25,13,12.0,12.0,,0.004571494910120151,3,447,0.7982575198920906,0.0005023249429093123,106.11485210217927,COMPLETE
1000,0.3358859419822693,2023-09-04 21:50:13.408401,2023-09-04 21:50:14.242134,0 days 00:00:00.833733,ReLU,Tanh,Leaky,,17,9,14.0,14.0,,0.03336326797464078,3,420,0.696353236307139,0.00027012026296511425,109.29885528564454,COMPLETE
1001,0.39893320202827454,2023-09-04 21:50:14.242524,2023-09-04 21:50:23.312813,0 days 00:00:09.070289,Tanh,Leaky,,,23,12,12.0,,,1.7879686101059714e-05,2,399,0.7477515545136594,0.0043412214896686304,99.01365699863673,COMPLETE
1002,0.421915203332901,2023-09-04 21:50:23.313198,2023-09-04 21:50:23.695705,0 days 00:00:00.382507,Tanh,Leaky,Leaky,,54,19,17.0,13.0,,0.0016557520316337804,3,158,0.14060717195771988,0.033379761016882455,118.58952041908547,COMPLETE
1003,0.33560484647750854,2023-09-04 21:50:23.696180,2023-09-04 21:50:26.346045,0 days 00:00:02.649865,Leaky,Leaky,,,21,12,11.0,,,0.0012447228439981858,2,261,0.7994678079260992,0.00020053063963742284,103.927543286924,COMPLETE
1004,0.3917717933654785,2023-09-04 21:50:26.346420,2023-09-04 21:50:30.794680,0 days 00:00:04.448260,Tanh,Leaky,Leaky,,15,11,15.0,15.0,,0.00013044278763687294,3,343,0.22689558584709857,0.0015908511358652217,368.3814574928395,COMPLETE
1005,0.3602621555328369,2023-09-04 21:50:30.795090,2023-09-04 21:50:36.516596,0 days 00:00:05.721506,ReLU,Leaky,Sigmoid,,26,10,16.0,16.0,,0.0002283201749768265,3,378,0.7246494641504231,0.017019562592649713,104.79890461128299,COMPLETE
1006,0.28110310435295105,2023-09-04 21:50:36.516991,2023-09-04 21:50:37.544627,0 days 00:00:01.027636,Tanh,Leaky,,,19,12,15.0,,,0.005395583800352969,2,392,0.766947122879788,0.0037698144235695638,90.43097901955629,COMPLETE
1007,0.315541535615921,2023-09-04 21:50:37.545015,2023-09-04 21:50:39.078018,0 days 00:00:01.533003,Tanh,Leaky,Leaky,,57,13,17.0,14.0,,0.0007196759763051128,3,308,0.6793267247804513,6.26891399131604e-05,112.25009675459428,COMPLETE
1008,0.3065633177757263,2023-09-04 21:50:39.078414,2023-09-04 21:50:39.986302,0 days 00:00:00.907888,Tanh,Leaky,Tanh,,27,11,16.0,12.0,,0.02915840675908397,3,410,0.7130142319586996,1.857396135023714e-05,140.51207485198975,COMPLETE
1009,0.35011518001556396,2023-09-04 21:50:39.986709,2023-09-04 21:50:40.357027,0 days 00:00:00.370318,ReLU,Leaky,,,24,11,18.0,,,0.009263441465218122,2,351,0.3737948421245897,0.0023274515529709086,116.76425399780274,COMPLETE
1010,0.3013285994529724,2023-09-04 21:50:40.357417,2023-09-04 21:50:41.127994,0 days 00:00:00.770577,Tanh,Leaky,Leaky,,22,12,13.0,15.0,,0.006924722833293771,3,358,0.7696929703564519,8.080958277438762e-05,90.73180712186374,COMPLETE
1011,0.38491290807724,2023-09-04 21:50:41.128396,2023-09-04 21:50:43.085144,0 days 00:00:01.956748,Tanh,Leaky,Leaky,,17,23,15.0,9.0,,0.00010135523071615501,3,434,0.11980934130367739,0.00016784644957807567,120.75671268516862,COMPLETE
1012,0.32044902443885803,2023-09-04 21:50:43.085543,2023-09-04 21:50:44.843786,0 days 00:00:01.758243,Tanh,ReLU,,,25,10,17.0,,,0.0005720367563693119,2,331,0.5294365883860283,0.0019023998068074086,99.52941944973527,COMPLETE
1013,0.4695444107055664,2023-09-04 21:50:44.844215,2023-09-04 21:50:45.025934,0 days 00:00:00.181719,ReLU,Leaky,Leaky,,21,11,7.0,13.0,,0.010677320438430246,3,400,0.116010461787566,0.0005583496247670744,121.51288812810725,COMPLETE
1014,0.342173308134079,2023-09-04 21:50:45.026342,2023-09-04 21:50:48.229382,0 days 00:00:03.203040,Tanh,Leaky,Leaky,,19,13,16.0,17.0,,7.155893386471509e-05,3,386,0.19815669400779104,0.0002168954247378722,113.15733932336995,COMPLETE
1015,0.30134156346321106,2023-09-04 21:50:48.229781,2023-09-04 21:50:48.600086,0 days 00:00:00.370305,Tanh,Leaky,,,27,24,14.0,,,0.03901310905224673,2,462,0.5570842546070739,0.00013650891398653056,97.36872621016069,COMPLETE
1016,0.40096941590309143,2023-09-04 21:50:48.600471,2023-09-04 21:50:48.780767,0 days 00:00:00.180296,Sigmoid,Leaky,Leaky,,23,12,10.0,13.0,,0.06203513051433934,3,336,0.12856015662520034,2.2676608823450026e-05,149.13944053649902,COMPLETE
1017,0.3757711350917816,2023-09-04 21:50:48.781169,2023-09-04 21:50:51.032814,0 days 00:00:02.251645,Tanh,Leaky,,,13,10,11.0,,,0.00033026145839261053,2,416,0.15543679734169843,0.00043377189908186273,126.19941576444185,COMPLETE
1018,0.4163913130760193,2023-09-04 21:50:51.033202,2023-09-04 21:50:51.529978,0 days 00:00:00.496776,ReLU,Tanh,Leaky,,25,8,17.0,15.0,,0.0009259152658880641,3,371,0.13408771581201948,0.0001002604511493942,205.32239356407752,COMPLETE
1019,0.3046984374523163,2023-09-04 21:50:51.530384,2023-09-04 21:50:53.445296,0 days 00:00:01.914912,Tanh,Leaky,Tanh,,17,11,18.0,14.0,,0.0014993736788992888,3,377,0.7432759660538477,0.00033030501357141534,95.82771676046806,COMPLETE
1020,0.30268561840057373,2023-09-04 21:50:53.445696,2023-09-04 21:50:54.450320,0 days 00:00:01.004624,Tanh,Leaky,,,20,22,16.0,,,0.0036192292859184463,2,314,0.6911493041494501,1.55429831070894e-05,101.19500785650209,COMPLETE
1021,0.45419207215309143,2023-09-04 21:50:54.450713,2023-09-04 21:50:54.715806,0 days 00:00:00.265093,ReLU,Leaky,Leaky,,28,12,15.0,5.0,,0.007795812310516015,3,354,0.3503181923140832,0.09570284742095843,130.37327745225696,COMPLETE
1022,0.32604190707206726,2023-09-04 21:50:54.716208,2023-09-04 21:50:55.225197,0 days 00:00:00.508989,Tanh,Leaky,Leaky,,23,11,14.0,8.0,,0.04730550376931543,3,276,0.6501526031649867,0.00025551609741088644,106.03784484863282,COMPLETE
1023,0.33717185258865356,2023-09-04 21:50:55.225595,2023-09-04 21:51:01.268567,0 days 00:00:06.042972,Tanh,Leaky,,,26,18,16.0,,,0.00019895080225056544,2,392,0.6038252565728991,0.0032808848618344475,114.90579708255068,COMPLETE
1024,0.3842822313308716,2023-09-04 21:51:01.268952,2023-09-04 21:51:05.129102,0 days 00:00:03.860150,Tanh,Leaky,Leaky,,15,9,17.0,6.0,,0.00042920641189701195,3,443,0.45644258669252685,0.008081648406189492,115.85367849013385,COMPLETE
1025,0.3338002860546112,2023-09-04 21:51:05.129610,2023-09-04 21:51:05.759949,0 days 00:00:00.630339,ReLU,Leaky,,,20,12,17.0,,,0.02653715909042917,2,82,0.7684919554632031,0.0001836019081144342,101.66561196067117,COMPLETE
1026,0.352266788482666,2023-09-04 21:51:05.760347,2023-09-04 21:51:06.158074,0 days 00:00:00.397727,Tanh,Leaky,Leaky,,22,11,12.0,11.0,,0.005751674946062108,3,364,0.18571408237190762,0.00010929533703885603,112.14679371226917,COMPLETE
1027,0.31109821796417236,2023-09-04 21:51:06.158474,2023-09-04 21:51:08.047942,0 days 00:00:01.889468,Leaky,Leaky,Sigmoid,,24,10,18.0,13.0,,0.0010553689921324267,3,239,0.7277649225454534,6.924895608026331e-05,99.72247108253273,COMPLETE
1028,0.3426019847393036,2023-09-04 21:51:08.048344,2023-09-04 21:51:09.093004,0 days 00:00:01.044660,Tanh,Leaky,,,28,13,15.0,,,0.010160241964189692,2,424,0.7712845274992536,5.24717569644703e-05,84.02261296025029,COMPLETE
1029,0.3954797089099884,2023-09-04 21:51:09.093418,2023-09-04 21:51:09.254933,0 days 00:00:00.161515,Tanh,ReLU,Leaky,,26,12,16.0,14.0,,0.01317959764407293,3,346,0.12828580721471428,0.0006506349676981221,166.47223663330078,COMPLETE
1030,0.34267961978912354,2023-09-04 21:51:09.255359,2023-09-04 21:51:10.130854,0 days 00:00:00.875495,ReLU,Leaky,Leaky,,19,21,15.0,12.0,,0.020453886537015045,3,410,0.799149571909797,0.00014628057601070876,98.8195858001709,COMPLETE
1031,0.32149189710617065,2023-09-04 21:51:10.131277,2023-09-04 21:51:10.815865,0 days 00:00:00.684588,Tanh,Leaky,Leaky,,17,11,17.0,16.0,,0.004470651142486631,3,497,0.34345226980255994,0.00022004184377391733,117.75739775763617,COMPLETE
1032,0.30828195810317993,2023-09-04 21:51:10.816289,2023-09-04 21:51:12.445318,0 days 00:00:01.629029,Tanh,Leaky,,,21,20,14.0,,,0.0014717222716803435,2,130,0.7082909704154052,0.00029451229643197204,89.3599058787028,COMPLETE
1033,0.448635458946228,2023-09-04 21:51:12.445718,2023-09-04 21:51:12.661861,0 days 00:00:00.216143,Tanh,Leaky,Tanh,,33,10,16.0,8.0,,0.008833799970196803,3,335,0.13428352711809657,0.0009109936730977108,193.70568487379285,COMPLETE
1034,0.32264649868011475,2023-09-04 21:51:12.662319,2023-09-04 21:51:14.542176,0 days 00:00:01.879857,ReLU,Tanh,,,24,12,18.0,,,0.00268483772971418,2,400,0.7450116222849796,0.00038495295742202484,98.4857031215321,COMPLETE
