number,value,datetime_start,datetime_complete,duration,params_activation1,params_activation2,params_activation3,params_activation4,params_batch_size,params_fl1,params_fl2,params_fl3,params_fl4,params_learning_rate,params_n_layers,params_num_epochs,params_train_size,params_weight_decay,user_attrs_mre,state
374,0.37113428115844727,2023-09-04 21:26:15.190431,2023-09-04 21:26:16.816869,0 days 00:00:01.626438,Tanh,Sigmoid,ReLU,,10,15,18.0,8.0,,0.016394016415586254,3,385,0.7987150252409763,0.0003510737400700788,93.51854160853794,COMPLETE
375,0.34131425619125366,2023-09-04 21:26:16.817217,2023-09-04 21:26:17.756257,0 days 00:00:00.939040,ReLU,ReLU,ReLU,,22,14,18.0,5.0,,0.012711597908643346,3,378,0.7137422892467964,0.0001339580729319019,95.59873920016818,COMPLETE
376,0.3847551941871643,2023-09-04 21:26:17.756618,2023-09-04 21:26:18.307099,0 days 00:00:00.550481,Tanh,Leaky,ReLU,Sigmoid,16,12,17.0,7.0,3.0,0.009702634334314644,4,390,0.19959161616760657,0.0032920160168612047,585.0402555243913,COMPLETE
377,0.34877312183380127,2023-09-04 21:26:18.307448,2023-09-04 21:26:18.616086,0 days 00:00:00.308638,Tanh,Leaky,ReLU,,25,13,18.0,8.0,,0.019426164565471575,3,325,0.27040925632421453,0.00044626883340222813,110.93889439900717,COMPLETE
378,0.36954960227012634,2023-09-04 21:26:18.616433,2023-09-04 21:26:20.203921,0 days 00:00:01.587488,Sigmoid,Leaky,ReLU,,28,3,19.0,7.0,,0.014246184725107944,3,402,0.7693147462392127,0.0005107814106596588,97.74718764732624,COMPLETE
379,0.32410627603530884,2023-09-04 21:26:20.204272,2023-09-04 21:26:20.999394,0 days 00:00:00.795122,ReLU,Sigmoid,,,21,12,17.0,,,0.011238644856128462,2,357,0.6072608201795298,0.00025749211434982524,411.0425281059451,COMPLETE
380,0.38166216015815735,2023-09-04 21:26:20.999734,2023-09-04 21:26:21.945252,0 days 00:00:00.945518,Tanh,Leaky,ReLU,,19,12,11.0,6.0,,0.027459635860260154,3,338,0.5436011627944207,0.006582221507386693,109.58170020871046,COMPLETE
381,0.2928819954395294,2023-09-04 21:26:21.945572,2023-09-04 21:26:22.597602,0 days 00:00:00.652030,Tanh,Leaky,ReLU,,24,13,16.0,8.0,,0.007857362570073674,3,306,0.7393574425373436,0.00031247949922381523,100.10705657958984,COMPLETE
382,0.29616186022758484,2023-09-04 21:26:22.597960,2023-09-04 21:26:24.656654,0 days 00:00:02.058694,ReLU,Leaky,ReLU,,13,20,17.0,9.0,,0.0165431931573268,3,372,0.7683839655885395,0.00010538471142176662,97.70715704196837,COMPLETE
383,0.34991729259490967,2023-09-04 21:26:24.657032,2023-09-04 21:26:25.253465,0 days 00:00:00.596433,Tanh,Sigmoid,,,27,8,16.0,,,0.012909720502665522,2,381,0.4082013624407394,0.0003872605986428525,103.48929484974255,COMPLETE
384,0.3379565477371216,2023-09-04 21:26:25.253780,2023-09-04 21:26:25.419057,0 days 00:00:00.165277,Tanh,Leaky,ReLU,,22,22,18.0,7.0,,0.022542779928560623,3,351,0.1892654451206233,0.0019952782794913073,381.374563778148,COMPLETE
385,0.3779604136943817,2023-09-04 21:26:25.419374,2023-09-04 21:26:25.843509,0 days 00:00:00.424135,Tanh,Tanh,Sigmoid,,20,14,17.0,6.0,,0.03986445280211789,3,282,0.4503893351996351,0.002664508832392613,132.1210542158647,COMPLETE
386,0.300335168838501,2023-09-04 21:26:25.843956,2023-09-04 21:26:26.472112,0 days 00:00:00.628156,ReLU,Leaky,ReLU,,60,21,19.0,24.0,,0.009565345293640717,3,365,0.7067825766994709,0.00014309373332704165,96.96172841389973,COMPLETE
387,0.33277004957199097,2023-09-04 21:26:26.472433,2023-09-04 21:26:27.221293,0 days 00:00:00.748860,Tanh,Leaky,Leaky,Leaky,15,12,16.0,5.0,7.0,0.05250586609656044,4,340,0.5572649692592413,0.0002408827746604858,105.31263282082297,COMPLETE
388,0.33105212450027466,2023-09-04 21:26:27.221646,2023-09-04 21:26:28.064400,0 days 00:00:00.842754,Leaky,Leaky,Leaky,,23,15,18.0,8.0,,0.018795336035378366,3,330,0.7385358596423354,0.0014017725409098025,89.68365154844342,COMPLETE
389,0.23592835664749146,2023-09-04 21:26:28.064721,2023-09-04 21:26:29.487845,0 days 00:00:01.423124,Tanh,Sigmoid,,,17,24,17.0,,,0.014635911369046508,2,356,0.7994517095216283,0.0007287627146527001,89.68359088897705,COMPLETE
390,0.3645622730255127,2023-09-04 21:26:29.488145,2023-09-04 21:26:29.992722,0 days 00:00:00.504577,Tanh,Sigmoid,,,17,24,17.0,,,0.01158486827398047,2,374,0.25939116067906703,0.000846813053541846,125.20438725897607,COMPLETE
391,0.3862435221672058,2023-09-04 21:26:29.993051,2023-09-04 21:26:38.920025,0 days 00:00:08.926974,ReLU,Sigmoid,,,15,23,17.0,,,0.00010430449292436826,2,394,0.7787690684677373,0.0007212006706571915,137.33552359121816,COMPLETE
392,0.32000166177749634,2023-09-04 21:26:38.920380,2023-09-04 21:26:40.120127,0 days 00:00:01.199747,Tanh,Sigmoid,,,19,24,18.0,,,0.02855035214377932,2,361,0.7752158590049342,0.0005868409135082858,95.0218965281611,COMPLETE
393,0.38060683012008667,2023-09-04 21:26:40.120438,2023-09-04 21:26:41.295818,0 days 00:00:01.175380,Tanh,Sigmoid,,,18,23,17.0,,,0.006916220928690657,2,383,0.3323786890427491,0.005608814543098074,111.37701578609278,COMPLETE
394,0.3069610297679901,2023-09-04 21:26:41.296353,2023-09-04 21:26:51.338066,0 days 00:00:10.041713,ReLU,Sigmoid,,,30,24,16.0,,,2.627165017713737e-05,2,370,0.7949015825381299,9.514088301044584e-05,136.29535998782595,COMPLETE
395,0.3110499978065491,2023-09-04 21:26:51.338383,2023-09-04 21:26:58.473205,0 days 00:00:07.134822,Tanh,Sigmoid,,,17,23,16.0,,,0.000632125355671485,2,276,0.7981455073722579,4.240674459202093e-05,130.00602854451824,COMPLETE
396,0.3067460060119629,2023-09-04 21:26:58.473515,2023-09-04 21:26:59.129986,0 days 00:00:00.656471,Tanh,Sigmoid,,,26,24,18.0,,,0.014723635694675918,2,316,0.7577985928976451,6.237856064205751e-05,113.39313340187073,COMPLETE
397,0.3114447593688965,2023-09-04 21:26:59.130315,2023-09-04 21:27:00.425601,0 days 00:00:01.295286,ReLU,Sigmoid,,,12,23,17.0,,,0.020767849979528408,2,354,0.6727374869198849,7.557332220918117e-05,110.77058832268966,COMPLETE
398,0.37740784883499146,2023-09-04 21:27:00.425936,2023-09-04 21:27:01.246541,0 days 00:00:00.820605,Tanh,Sigmoid,,,14,24,19.0,,,0.008786378052801696,2,362,0.379989347394423,0.0006344149276637903,125.58945676113697,COMPLETE
399,0.4305836260318756,2023-09-04 21:27:01.246879,2023-09-04 21:27:02.815851,0 days 00:00:01.568972,Tanh,Leaky,,,29,22,17.0,,,0.0004632782973558236,2,262,0.29638515183040787,0.02766065894785755,473.9576384196349,COMPLETE
400,0.31045153737068176,2023-09-04 21:27:02.816205,2023-09-04 21:27:03.366086,0 days 00:00:00.549881,Tanh,ReLU,,,45,19,16.0,,,0.010613807070605302,2,346,0.7148839110578652,0.00011079398021262967,87.39206589099973,COMPLETE
401,0.35505813360214233,2023-09-04 21:27:03.366402,2023-09-04 21:27:04.639490,0 days 00:00:01.273088,ReLU,Sigmoid,ReLU,ReLU,25,9,15.0,6.0,5.0,0.0027175666895895316,4,378,0.43406942656044,0.0016537744067940988,99.93496535660384,COMPLETE
402,0.28922393918037415,2023-09-04 21:27:04.639934,2023-09-04 21:27:05.737972,0 days 00:00:01.098038,Tanh,Leaky,ReLU,,20,10,16.0,7.0,,0.01706934440265427,3,297,0.7998606553139199,0.0005036705837782566,95.50350144330193,COMPLETE
403,0.3236673176288605,2023-09-04 21:27:05.738295,2023-09-04 21:27:06.248297,0 days 00:00:00.510002,Sigmoid,Leaky,,,40,11,18.0,,,0.014416665321763751,2,369,0.7466530925874388,0.0009237792447884673,120.43603907993861,COMPLETE
404,0.33790692687034607,2023-09-04 21:27:06.248630,2023-09-04 21:27:16.960139,0 days 00:00:10.711509,Tanh,Leaky,Tanh,,21,10,11.0,8.0,,0.00018870604620948675,3,355,0.7110827187701226,0.000160195651949281,100.51567307496683,COMPLETE
405,0.32244667410850525,2023-09-04 21:27:16.960464,2023-09-04 21:27:20.945866,0 days 00:00:03.985402,ReLU,Sigmoid,Sigmoid,,16,11,17.0,9.0,,0.0008743375108002617,3,400,0.7531790844258947,8.965754014485934e-05,130.86872241371557,COMPLETE
406,0.34608033299446106,2023-09-04 21:27:20.946195,2023-09-04 21:27:22.594360,0 days 00:00:01.648165,Tanh,,,,24,11,,,,0.001807008531763457,1,386,0.6881878888162934,0.003922935921214291,100.17825671109286,COMPLETE
407,0.32703715562820435,2023-09-04 21:27:22.594666,2023-09-04 21:27:22.926520,0 days 00:00:00.331854,Tanh,Leaky,Leaky,,27,7,9.0,5.0,,0.024349648895183817,3,342,0.35603429610566156,0.00020431615141023164,362.32532981589986,COMPLETE
408,0.30126887559890747,2023-09-04 21:27:22.926849,2023-09-04 21:27:23.715725,0 days 00:00:00.788876,ReLU,Leaky,Leaky,,28,11,15.0,15.0,,0.0021181413712248343,3,355,0.7665603045624233,0.00012531446084471578,100.7346420288086,COMPLETE
409,0.3264879584312439,2023-09-04 21:27:23.716077,2023-09-04 21:27:31.665276,0 days 00:00:07.949199,Tanh,Tanh,,,23,10,16.0,,,0.00014528215339948953,2,374,0.738356864307199,0.00018055802677859308,93.68105587474803,COMPLETE
410,0.3011031746864319,2023-09-04 21:27:31.665592,2023-09-04 21:27:32.082076,0 days 00:00:00.416484,Tanh,Leaky,Leaky,,48,8,18.0,3.0,,0.012139651174871624,3,333,0.6568446959069564,0.001263943538038923,106.02333628336588,COMPLETE
411,0.36780083179473877,2023-09-04 21:27:32.082409,2023-09-04 21:27:35.253947,0 days 00:00:03.171538,Tanh,Sigmoid,ReLU,,58,22,12.0,7.0,,0.00035009231507914375,3,254,0.7234780797714979,0.0007541537037080609,133.80311218021424,COMPLETE
412,0.38193124532699585,2023-09-04 21:27:35.254279,2023-09-04 21:27:35.709020,0 days 00:00:00.454741,ReLU,Leaky,Leaky,,18,21,17.0,10.0,,0.007975903576846374,3,365,0.23520102633431075,0.0031456416738119895,2633.710073852539,COMPLETE
413,0.4374118745326996,2023-09-04 21:27:35.709355,2023-09-04 21:27:36.053974,0 days 00:00:00.344619,Leaky,Leaky,Leaky,Sigmoid,21,12,20.0,14.0,8.0,0.07391071832075422,4,388,0.6295546969573361,0.00014792320816813095,140.89946469393644,COMPLETE
414,0.4084925651550293,2023-09-04 21:27:36.054325,2023-09-04 21:27:37.154626,0 days 00:00:01.100301,Tanh,Leaky,,,52,10,19.0,,,0.0002577753632378391,2,350,0.17881038691951606,0.010070525371097039,120.94647432599749,COMPLETE
415,0.3788728415966034,2023-09-04 21:27:37.154943,2023-09-04 21:27:40.305978,0 days 00:00:03.151035,Tanh,Sigmoid,Leaky,,26,18,16.0,4.0,,0.001131747001579528,3,379,0.5118173805679413,0.004831415344583587,114.9094347785501,COMPLETE
416,0.3165796995162964,2023-09-04 21:27:40.306293,2023-09-04 21:27:41.167870,0 days 00:00:00.861577,ReLU,Leaky,Tanh,,19,11,15.0,6.0,,0.018315495632836742,3,364,0.4832705129073484,0.00011988005648757056,101.83130155290876,COMPLETE
417,0.4218684434890747,2023-09-04 21:27:41.168196,2023-09-04 21:27:41.811615,0 days 00:00:00.643419,Tanh,Leaky,,,24,12,10.0,,,0.014201590337870247,2,343,0.7994108443502278,0.0127200388967437,119.96001134599958,COMPLETE
418,0.42587074637413025,2023-09-04 21:27:41.811941,2023-09-04 21:27:42.738984,0 days 00:00:00.927043,Tanh,Leaky,Leaky,,22,4,17.0,8.0,,0.010063630634210927,3,406,0.6944292686866602,0.056646404750884595,123.7826968299018,COMPLETE
419,0.3133014440536499,2023-09-04 21:27:42.739307,2023-09-04 21:27:45.064560,0 days 00:00:02.325253,ReLU,Sigmoid,Leaky,,14,5,18.0,7.0,,0.006245749629670981,3,321,0.7598058837802588,7.854647075833645e-05,110.97766847963686,COMPLETE
420,0.33329442143440247,2023-09-04 21:27:45.064922,2023-09-04 21:27:47.209028,0 days 00:00:02.144106,Tanh,Leaky,Leaky,,17,13,15.0,9.0,,0.0007126788174579586,3,393,0.7318218705325022,0.0025183131517709186,97.80416257453687,COMPLETE
421,0.3637579083442688,2023-09-04 21:27:47.209357,2023-09-04 21:27:52.011804,0 days 00:00:04.802447,Tanh,Leaky,ReLU,,25,11,16.0,17.0,,0.0015842354604562972,3,110,0.5781267611405709,0.0004603325399043902,128.70061030012837,COMPLETE
422,0.3509666323661804,2023-09-04 21:27:52.012373,2023-09-04 21:27:52.358247,0 days 00:00:00.345874,Tanh,Leaky,,,29,23,17.0,,,0.0320532959780661,2,359,0.319279930267095,0.0019476665270003021,113.2847282409668,COMPLETE
423,0.39216840267181396,2023-09-04 21:27:52.358559,2023-09-04 21:27:52.700921,0 days 00:00:00.342362,ReLU,Sigmoid,Leaky,,43,9,18.0,14.0,,0.012377693907112455,3,286,0.22509894360966792,0.00022442106117706782,121.25978010791843,COMPLETE
424,0.29363423585891724,2023-09-04 21:27:52.701251,2023-09-04 21:27:53.398409,0 days 00:00:00.697158,Tanh,Leaky,Leaky,,63,10,15.0,15.0,,0.02081767861574897,3,372,0.7685784025878444,0.006971340785246424,103.95562253679547,COMPLETE
425,0.45772311091423035,2023-09-04 21:27:53.398733,2023-09-04 21:27:53.579072,0 days 00:00:00.180339,Tanh,ReLU,Leaky,Leaky,20,11,16.0,6.0,14.0,0.01731192380010691,4,334,0.13826676640413682,0.0002737691047410869,127.7459612394634,COMPLETE
426,0.37135830521583557,2023-09-04 21:27:53.579403,2023-09-04 21:27:54.924428,0 days 00:00:01.345025,ReLU,Leaky,,,23,6,12.0,,,0.0009818102871042725,2,269,0.2390004010382329,5.8521237524033805e-05,123.0708103577296,COMPLETE
427,0.3397254943847656,2023-09-04 21:27:54.924749,2023-09-04 21:27:55.597601,0 days 00:00:00.672852,Tanh,Leaky,Leaky,,26,12,17.0,23.0,,0.0033601747382067788,3,351,0.29021843548326953,0.0005498133282980035,343.51581797880283,COMPLETE
428,0.31281778216362,2023-09-04 21:27:55.597926,2023-09-04 21:27:56.278384,0 days 00:00:00.680458,Sigmoid,Sigmoid,,,31,11,15.0,,,0.026796937270549465,2,380,0.6820120659972982,9.822834128747977e-05,114.69463244351473,COMPLETE
429,0.33997800946235657,2023-09-04 21:27:56.278733,2023-09-04 21:27:58.447961,0 days 00:00:02.169228,Tanh,Leaky,ReLU,,22,9,16.0,7.0,,0.00055024419653303,3,367,0.30460469743277,0.0003994332543230787,122.34150254533098,COMPLETE
430,0.32163652777671814,2023-09-04 21:27:58.448303,2023-09-04 21:27:59.303116,0 days 00:00:00.854813,ReLU,Leaky,Leaky,,16,10,19.0,8.0,,0.010211791997999778,3,358,0.420941434705905,0.00018664002355102112,125.11287298435118,COMPLETE
431,0.331364244222641,2023-09-04 21:27:59.303454,2023-09-04 21:28:00.614809,0 days 00:00:01.311355,Tanh,Leaky,Sigmoid,,27,14,3.0,14.0,,0.01475370602285989,3,343,0.5919977022200146,0.000997375765424186,107.06185118357341,COMPLETE
432,0.38995975255966187,2023-09-04 21:28:00.615140,2023-09-04 21:28:08.025135,0 days 00:00:07.409995,Tanh,Sigmoid,,,24,24,18.0,,,8.68806389671327e-05,2,384,0.7092949915393002,6.839529049850745e-05,106.30558719237645,COMPLETE
433,0.3175038993358612,2023-09-04 21:28:08.025452,2023-09-04 21:28:10.498697,0 days 00:00:02.473245,Tanh,Leaky,Leaky,,60,11,11.0,4.0,,0.0003839266562571072,3,277,0.7679194515412816,0.0001500313051111403,107.45984586079915,COMPLETE
434,0.424777090549469,2023-09-04 21:28:10.499038,2023-09-04 21:28:22.220676,0 days 00:00:11.721638,ReLU,Leaky,Leaky,,19,13,17.0,9.0,,1.2776486075363371e-05,3,372,0.7994349577106351,0.0003120179709023823,99.50640957329863,COMPLETE
435,0.31036534905433655,2023-09-04 21:28:22.221006,2023-09-04 21:28:22.988756,0 days 00:00:00.767750,Tanh,Tanh,Leaky,,21,12,15.0,15.0,,0.004530702946729283,3,329,0.7411835191945038,0.0002521955434654653,97.77104921694155,COMPLETE
436,0.40846720337867737,2023-09-04 21:28:22.989090,2023-09-04 21:28:25.124546,0 days 00:00:02.135456,Tanh,Leaky,Leaky,ReLU,25,12,16.0,16.0,11.0,0.0012395249313600029,4,393,0.7204547265331194,0.046391864124726394,113.29634386698405,COMPLETE
437,0.3733711540699005,2023-09-04 21:28:25.125129,2023-09-04 21:28:25.948705,0 days 00:00:00.823576,Leaky,Sigmoid,,,12,10,18.0,,,0.007757565600811215,2,350,0.7646909617544532,0.007484632506107053,89.0050791422526,COMPLETE
438,0.34607577323913574,2023-09-04 21:28:25.949041,2023-09-04 21:28:26.318420,0 days 00:00:00.369379,ReLU,Leaky,ReLU,,18,20,16.0,5.0,,0.011890156765435785,3,310,0.2799683344212757,0.0006494066361846316,146.93048463044343,COMPLETE
439,0.46942898631095886,2023-09-04 21:28:26.318762,2023-09-04 21:28:29.173268,0 days 00:00:02.854506,Tanh,Leaky,Leaky,,28,7,17.0,13.0,,5.2111663940913556e-05,3,361,0.26355191397327127,0.00010331198227954976,109.23309351532743,COMPLETE
440,0.42214131355285645,2023-09-04 21:28:29.173603,2023-09-04 21:28:30.761163,0 days 00:00:01.587560,Tanh,Sigmoid,Leaky,,22,11,14.0,10.0,,0.0008022416749839164,3,339,0.6562213093653982,0.016886951561528408,117.75426640230067,COMPLETE
441,0.37660452723503113,2023-09-04 21:28:30.761496,2023-09-04 21:28:31.265933,0 days 00:00:00.504437,ReLU,Leaky,,,23,22,15.0,,,0.023866556202241002,2,378,0.6961874156961728,0.0029055298075034487,106.34757773081462,COMPLETE
442,0.32850825786590576,2023-09-04 21:28:31.266264,2023-09-04 21:28:31.642411,0 days 00:00:00.376147,Tanh,Leaky,Leaky,,54,11,17.0,2.0,,0.016321448261335296,3,357,0.33893211259114353,5.120779473629631e-05,106.26789134632457,COMPLETE
443,0.2925906479358673,2023-09-04 21:28:31.642784,2023-09-04 21:28:32.415911,0 days 00:00:00.773127,Tanh,Leaky,Tanh,Sigmoid,20,23,18.0,7.0,8.0,0.009401086436068207,4,370,0.7383151441096771,8.234491442145624e-05,99.57682037353516,COMPLETE
444,0.3253507912158966,2023-09-04 21:28:32.416268,2023-09-04 21:28:33.443282,0 days 00:00:01.027014,Tanh,Sigmoid,Leaky,,15,10,15.0,6.0,,0.013381169803773667,3,345,0.4063390281713114,0.00012704659050703936,109.42136703491211,COMPLETE
445,0.3658824563026428,2023-09-04 21:28:33.443647,2023-09-04 21:28:33.879919,0 days 00:00:00.436272,ReLU,Leaky,,,26,12,12.0,,,0.019853369156251202,2,386,0.2856045724626861,0.0016855322172871453,129.02883642691154,COMPLETE
446,0.3539820611476898,2023-09-04 21:28:33.880266,2023-09-04 21:28:35.093615,0 days 00:00:01.213349,Tanh,Leaky,ReLU,,18,13,16.0,11.0,,0.006051688486789474,3,77,0.7996730255411737,0.009034494043555358,97.54162292480468,COMPLETE
447,0.3289688527584076,2023-09-04 21:28:35.093966,2023-09-04 21:28:35.693139,0 days 00:00:00.599173,Tanh,Leaky,Leaky,,29,11,18.0,8.0,,0.0028561623878246125,3,321,0.3644225701530388,0.0002099399235994114,113.35719443267246,COMPLETE
448,0.3448263704776764,2023-09-04 21:28:35.693504,2023-09-04 21:28:36.886869,0 days 00:00:01.193365,ReLU,Sigmoid,Leaky,,21,24,17.0,14.0,,0.001766326032466335,3,365,0.7684930885141776,1.4695806370949503e-05,95.26398951832842,COMPLETE
449,0.30883872509002686,2023-09-04 21:28:36.887204,2023-09-04 21:28:41.830087,0 days 00:00:04.942883,Tanh,Leaky,,,25,10,19.0,,,0.0009956135419102365,2,261,0.6205356099820942,0.00036282265847905525,106.97176841840353,COMPLETE
450,0.32758828997612,2023-09-04 21:28:41.830413,2023-09-04 21:28:42.747887,0 days 00:00:00.917474,Sigmoid,Leaky,Leaky,,23,21,14.0,6.0,,0.010713188438499173,3,349,0.4596463489712767,0.0001693098320926692,185.49549893465908,COMPLETE
451,0.3811100721359253,2023-09-04 21:28:42.748235,2023-09-04 21:28:44.010792,0 days 00:00:01.262557,Tanh,Leaky,Leaky,,16,9,16.0,13.0,,0.0013243983562744252,3,297,0.7356048385759788,0.002280500344988654,98.14237361484103,COMPLETE
452,0.3232317268848419,2023-09-04 21:28:44.011131,2023-09-04 21:28:45.270231,0 days 00:00:01.259100,ReLU,ReLU,,,13,12,15.0,,,0.008298257335150874,2,398,0.6730464660080708,0.0004806268218735966,108.50885581970215,COMPLETE
453,0.36417096853256226,2023-09-04 21:28:45.270580,2023-09-04 21:28:47.923855,0 days 00:00:02.653275,Tanh,Sigmoid,ReLU,,27,8,17.0,15.0,,0.0023538862986655852,3,332,0.7086002971911701,0.00029724462608180126,103.95408542950948,COMPLETE
454,0.3142993450164795,2023-09-04 21:28:47.924422,2023-09-04 21:28:48.851767,0 days 00:00:00.927345,Tanh,Leaky,Leaky,,20,6,23.0,7.0,,0.016295524748981886,3,377,0.39591273813088024,0.00024479629408492333,102.48657117571149,COMPLETE
455,0.3342306613922119,2023-09-04 21:28:48.852114,2023-09-04 21:28:52.485954,0 days 00:00:03.633840,Tanh,Leaky,Leaky,Leaky,23,16,16.0,11.0,3.0,0.0007079461902280715,4,356,0.7640921208399827,0.00013396957791405995,100.16956545126558,COMPLETE
456,0.4005568027496338,2023-09-04 21:28:52.486305,2023-09-04 21:28:54.453467,0 days 00:00:01.967162,ReLU,Sigmoid,Leaky,,24,11,12.0,22.0,,0.0004516875907760947,3,338,0.25296337181659784,0.0036492140674545615,130.21380265693833,COMPLETE
457,0.2715911567211151,2023-09-04 21:28:54.453802,2023-09-04 21:28:55.036827,0 days 00:00:00.583025,Tanh,Leaky,,,31,10,17.0,,,0.012780246442029873,2,429,0.7371833846085132,0.00010774028529327298,109.1607415335519,COMPLETE
458,0.3276109993457794,2023-09-04 21:28:55.037388,2023-09-04 21:28:57.913062,0 days 00:00:02.875674,Tanh,Leaky,Sigmoid,,31,12,11.0,24.0,,0.011916895972344521,3,448,0.6890855818755013,0.0011124031824044198,88.62618926475788,COMPLETE
459,0.279554545879364,2023-09-04 21:28:57.913514,2023-09-04 21:28:58.362164,0 days 00:00:00.448650,Tanh,Leaky,Leaky,,34,10,15.0,14.0,,0.013426263495780423,3,437,0.5296074651678935,0.00011406914918356564,835.2530110677084,COMPLETE
460,0.3463698625564575,2023-09-04 21:28:58.362502,2023-09-04 21:28:58.989971,0 days 00:00:00.627469,Tanh,Leaky,,,34,13,18.0,,,0.01415210497898565,2,449,0.5875064329642888,0.00011821457288915935,91.4117285545836,COMPLETE
461,0.2860754430294037,2023-09-04 21:28:58.990423,2023-09-04 21:28:59.457187,0 days 00:00:00.466764,Tanh,Leaky,ReLU,,33,23,14.0,14.0,,0.013350667647195811,3,433,0.6329224869903726,0.00015238250133890033,109.47695190429687,COMPLETE
462,0.3458999991416931,2023-09-04 21:28:59.457522,2023-09-04 21:28:59.886611,0 days 00:00:00.429089,Tanh,Leaky,Leaky,,32,22,15.0,5.0,,0.01715341626175864,3,431,0.32539559846842525,0.00010600873806672118,183.75431315104166,COMPLETE
463,0.33170098066329956,2023-09-04 21:28:59.886935,2023-09-04 21:29:00.709963,0 days 00:00:00.823028,Tanh,Leaky,Leaky,,32,11,17.0,23.0,,0.004029022731623025,3,422,0.515558677250109,8.801209292130533e-05,655.5730285644531,COMPLETE
464,0.3336167633533478,2023-09-04 21:29:00.710303,2023-09-04 21:29:01.272904,0 days 00:00:00.562601,Tanh,Leaky,,,35,10,16.0,,,0.01185596548467688,2,471,0.6529192765466995,0.00011681179117286181,82.67199635505676,COMPLETE
465,0.339224249124527,2023-09-04 21:29:01.273467,2023-09-04 21:29:01.994918,0 days 00:00:00.721451,Tanh,Leaky,Leaky,,33,11,19.0,8.0,,0.01575720595963917,3,406,0.5569499222320918,0.0007313576867712996,115.96236192857897,COMPLETE
466,0.3181396424770355,2023-09-04 21:29:01.995254,2023-09-04 21:29:02.691161,0 days 00:00:00.695907,Tanh,Leaky,Leaky,,30,12,18.0,6.0,,0.010052868917736798,3,455,0.5447786939229935,0.0001870360399341703,98.2629411870783,COMPLETE
467,0.33130618929862976,2023-09-04 21:29:02.691511,2023-09-04 21:29:04.074927,0 days 00:00:01.383416,Tanh,Tanh,ReLU,,29,9,15.0,9.0,,0.001447694486000958,3,460,0.7137357933848858,0.0001460840716755953,105.00587048250087,COMPLETE
