number,value,datetime_start,datetime_complete,duration,params_activation1,params_activation2,params_activation3,params_activation4,params_batch_size,params_fl1,params_fl2,params_fl3,params_fl4,params_learning_rate,params_n_layers,params_num_epochs,params_train_size,params_weight_decay,user_attrs_mre,state
1240,0.4841124713420868,2023-09-04 21:41:50.943162,2023-09-04 21:41:51.334245,0 days 00:00:00.391083,Sigmoid,Sigmoid,,,78,24,20.0,,,0.0072284569294284295,2,176,0.1307696173040552,0.0001443654085063167,198.69471221562674,COMPLETE
1241,0.2863807678222656,2023-09-04 21:41:51.334656,2023-09-04 21:41:51.712348,0 days 00:00:00.377692,Leaky,Tanh,,,98,23,15.0,,,0.018905702759037885,2,124,0.6688832807890327,1.346451629617576e-05,134.23176883515856,COMPLETE
1242,0.31887155771255493,2023-09-04 21:41:51.712866,2023-09-04 21:41:52.451692,0 days 00:00:00.738826,Leaky,Tanh,,,97,23,15.0,,,0.01686761637124104,2,127,0.6746939598317941,1.2306686847629753e-05,136.18538741227036,COMPLETE
1243,0.3619332015514374,2023-09-04 21:41:52.452214,2023-09-04 21:41:52.819029,0 days 00:00:00.366815,Leaky,Tanh,,,99,23,15.0,,,0.0239157480924646,2,110,0.642811459735206,1.169884403161569e-05,132.06621942287538,COMPLETE
1244,0.5930255055427551,2023-09-04 21:41:52.819557,2023-09-04 21:41:53.508208,0 days 00:00:00.688651,Leaky,Tanh,,,98,23,16.0,,,0.020170057212728607,2,119,0.6641462883451362,0.039477909526540254,166.30068725585937,COMPLETE
1245,0.7422695159912109,2023-09-04 21:41:53.509002,2023-09-04 21:41:54.305486,0 days 00:00:00.796484,Leaky,Tanh,ReLU,Tanh,100,23,14.0,11.0,1.0,0.027388494750165956,4,125,0.27085216836258363,1.388713599337907e-05,137.65025424957275,COMPLETE
1246,0.3399999737739563,2023-09-04 21:41:54.306325,2023-09-04 21:41:54.954560,0 days 00:00:00.648235,Tanh,Tanh,,,95,24,15.0,,,0.024812141528160636,2,122,0.6192793185695358,9.778554360563499e-05,169.16645304361978,COMPLETE
1247,0.40187889337539673,2023-09-04 21:41:54.955045,2023-09-04 21:41:55.283255,0 days 00:00:00.328210,Leaky,Tanh,,,96,23,15.0,,,0.017669393092447437,2,114,0.26553697684238664,1.0112765265153214e-05,179.08967882966343,COMPLETE
1248,0.5545665621757507,2023-09-04 21:41:55.283701,2023-09-04 21:41:55.538680,0 days 00:00:00.254979,Leaky,Tanh,,,98,23,14.0,,,0.01965263947087607,2,137,0.685807205968563,0.018573006926839008,159.97910794344816,COMPLETE
1249,0.3047710359096527,2023-09-04 21:41:55.539098,2023-09-04 21:41:56.537029,0 days 00:00:00.997931,Leaky,Tanh,,,96,24,15.0,,,0.003623300713077314,2,129,0.6539506816329157,0.000274246396704737,109.01301178451656,COMPLETE
1250,0.402442991733551,2023-09-04 21:41:56.537457,2023-09-04 21:41:56.733840,0 days 00:00:00.196383,Leaky,Tanh,,,100,23,16.0,,,0.08405649869738634,2,92,0.22843086019576656,4.943832506433125e-05,148.46146374213987,COMPLETE
1251,0.8338353633880615,2023-09-04 21:41:56.734268,2023-09-04 21:41:57.595417,0 days 00:00:00.861149,ReLU,Tanh,Leaky,,97,24,16.0,13.0,,0.005243915945899205,3,122,0.7021651476496581,0.04631486950479335,128.34676478459284,COMPLETE
1252,0.3945644795894623,2023-09-04 21:41:57.596226,2023-09-04 21:41:58.657204,0 days 00:00:01.060978,Leaky,Tanh,,,98,23,16.0,,,0.03007616648799986,2,135,0.6281537527153831,0.008902827298340655,260.5971941266741,COMPLETE
1253,0.3212990462779999,2023-09-04 21:41:58.658090,2023-09-04 21:41:59.575294,0 days 00:00:00.917204,Leaky,Tanh,,,94,24,14.0,,,0.022703669856816888,2,104,0.6744050413728444,5.9079195676701894e-05,114.35279681231525,COMPLETE
1254,0.7695815563201904,2023-09-04 21:41:59.576098,2023-09-04 21:42:00.165491,0 days 00:00:00.589393,Tanh,Tanh,,,98,23,15.0,,,7.813665826240362e-05,2,112,0.3049960979747351,0.00017251722866832032,124.47492967333112,COMPLETE
1255,0.5053424835205078,2023-09-04 21:42:00.165911,2023-09-04 21:42:01.778729,0 days 00:00:01.612818,Leaky,Tanh,Tanh,Sigmoid,100,23,15.0,24.0,9.0,0.0004124611396978488,4,141,0.7193614266399038,0.0003476395584023975,181.84603519304423,COMPLETE
1256,0.6469841599464417,2023-09-04 21:42:01.779170,2023-09-04 21:42:02.582664,0 days 00:00:00.803494,Leaky,Tanh,,,93,24,14.0,,,5.5862941315535455e-05,2,133,0.48396883904373195,3.697216139751129e-05,193.39193983723345,COMPLETE
1257,0.8275272250175476,2023-09-04 21:42:02.583085,2023-09-04 21:42:03.531527,0 days 00:00:00.948442,Leaky,Tanh,,,95,24,16.0,,,2.04773854465086e-05,2,118,0.697467340465823,6.980938875064335e-05,125.2035241207834,COMPLETE
1258,0.3236650228500366,2023-09-04 21:42:03.531963,2023-09-04 21:42:03.869600,0 days 00:00:00.337637,Leaky,Tanh,,,100,23,15.0,,,0.03496481529126663,2,128,0.7345011049444092,2.7572370781653054e-05,161.32327764174516,COMPLETE
1259,0.5425248146057129,2023-09-04 21:42:03.870041,2023-09-04 21:42:04.095052,0 days 00:00:00.225011,Leaky,Tanh,,,97,23,16.0,,,0.016489466533005346,2,143,0.29992672097706663,0.026569926652752693,157.39625847048876,COMPLETE
1260,0.7354629635810852,2023-09-04 21:42:04.095467,2023-09-04 21:42:04.250583,0 days 00:00:00.155116,Tanh,Tanh,,,98,24,15.0,,,0.01348951341148957,2,99,0.42383575207724383,0.09888406195502841,212.4774149576823,COMPLETE
1261,0.5700936913490295,2023-09-04 21:42:04.251021,2023-09-04 21:42:04.891676,0 days 00:00:00.640655,Leaky,Tanh,ReLU,,18,22,16.0,17.0,,0.04902605445023878,3,149,0.5052730995962252,0.01345946518707937,191.83772705078124,COMPLETE
1262,0.35104355216026306,2023-09-04 21:42:04.892144,2023-09-04 21:42:05.872224,0 days 00:00:00.980080,Leaky,Tanh,,,95,24,15.0,,,0.004141535796328373,2,124,0.6753712316528667,1.3914872754790371e-05,129.72690686871928,COMPLETE
1263,1.145595908164978,2023-09-04 21:42:05.872646,2023-09-04 21:42:05.983546,0 days 00:00:00.110900,Leaky,Sigmoid,,,96,22,14.0,,,0.01922613470662513,2,129,0.19031188265117893,0.09999562501965799,140.4779052734375,COMPLETE
1264,0.3879096508026123,2023-09-04 21:42:05.983999,2023-09-04 21:42:07.049951,0 days 00:00:01.065952,Sigmoid,Tanh,,,91,23,16.0,,,0.0059125823864507555,2,146,0.6076918834297937,0.0010237420706418405,239.97072977562473,COMPLETE
1265,0.3587540090084076,2023-09-04 21:42:07.050364,2023-09-04 21:42:09.852481,0 days 00:00:02.802117,ReLU,Sigmoid,Sigmoid,Leaky,22,23,16.0,18.0,13.0,0.0072221617657807395,4,136,0.7103287461778147,0.0004428607337183625,191.964354798034,COMPLETE
1266,0.48899045586586,2023-09-04 21:42:09.852943,2023-09-04 21:42:10.289059,0 days 00:00:00.436116,Leaky,Tanh,,,94,24,17.0,,,0.024496645803070028,2,164,0.7452602650587837,0.014547217655437273,152.49347149242055,COMPLETE
1267,0.9867183566093445,2023-09-04 21:42:10.289531,2023-09-04 21:42:10.425216,0 days 00:00:00.135685,Leaky,Sigmoid,,,99,22,13.0,,,0.011928793309252892,2,307,0.3816431545874427,0.09070624074527141,101.38253021240234,COMPLETE
1268,0.6444395184516907,2023-09-04 21:42:10.425652,2023-09-04 21:42:10.555152,0 days 00:00:00.129500,Tanh,Tanh,,,96,23,16.0,,,0.01516156079595076,2,113,0.16765644961077836,0.08355497575531504,150.97421403364703,COMPLETE
1269,0.3858000934123993,2023-09-04 21:42:10.555613,2023-09-04 21:42:12.622706,0 days 00:00:02.067093,Leaky,Sigmoid,,,45,24,17.0,,,0.0012222440973851116,2,441,0.38636361610259057,0.0008060765983186681,128.68513581559463,COMPLETE
1270,0.4950701594352722,2023-09-04 21:42:12.623143,2023-09-04 21:42:12.939428,0 days 00:00:00.316285,Leaky,Tanh,,,49,23,15.0,,,0.09888385043903743,2,155,0.6456979063822039,0.0001297207956498155,179.7875123457475,COMPLETE
1271,0.2972312569618225,2023-09-04 21:42:12.939878,2023-09-04 21:42:14.129569,0 days 00:00:01.189691,Leaky,Sigmoid,,,36,22,17.0,,,0.009392370668084462,2,275,0.7478066659383169,1.689752542389181e-05,124.58279617972995,COMPLETE
1272,0.402797132730484,2023-09-04 21:42:14.130020,2023-09-04 21:42:18.284172,0 days 00:00:04.154152,Leaky,Leaky,,,37,22,14.0,,,0.0003305584666313605,2,261,0.7639452700624317,2.5434042495633783e-05,225.73509543700237,COMPLETE
1273,0.3964560329914093,2023-09-04 21:42:18.284617,2023-09-04 21:42:18.677789,0 days 00:00:00.393172,Leaky,Tanh,Tanh,Sigmoid,34,22,16.0,16.0,16.0,0.008820092747629241,4,271,0.35788767544731137,1.9867076508357404e-05,212.6148110848886,COMPLETE
1274,0.38711708784103394,2023-09-04 21:42:18.678332,2023-09-04 21:42:19.611552,0 days 00:00:00.933220,Leaky,,,,37,22,,,,0.00794638943650295,1,265,0.7451148354098102,1.9034454521836924e-05,163.87566566467285,COMPLETE
1275,0.32959792017936707,2023-09-04 21:42:19.612024,2023-09-04 21:42:20.851022,0 days 00:00:01.238998,Tanh,Sigmoid,,,34,22,15.0,,,0.009627703370365314,2,289,0.7700608168956146,2.2819240249476898e-05,147.69277911716037,COMPLETE
1276,0.3538859784603119,2023-09-04 21:42:20.851456,2023-09-04 21:42:21.403317,0 days 00:00:00.551861,Leaky,Tanh,,,38,22,17.0,,,0.011093641754965924,2,270,0.5250291753483836,3.130952662171221e-05,3765.1306417713995,COMPLETE
1277,0.3409276008605957,2023-09-04 21:42:21.403762,2023-09-04 21:42:22.179795,0 days 00:00:00.776033,Leaky,Sigmoid,,,35,22,24.0,,,0.0069529123210910915,2,281,0.544773658909001,1.6269874467809375e-05,127.51733386132025,COMPLETE
1278,0.35846614837646484,2023-09-04 21:42:22.180231,2023-09-04 21:42:22.890826,0 days 00:00:00.710595,Leaky,Tanh,,,35,22,23.0,,,0.009451102955495316,2,277,0.7256992321643656,0.002669777219094392,242.61507888067337,COMPLETE
1279,0.5232194662094116,2023-09-04 21:42:22.891254,2023-09-04 21:42:28.357320,0 days 00:00:05.466066,ReLU,Sigmoid,,,35,22,22.0,,,0.00010687627467435325,2,291,0.7687734972846996,0.00024379847563357158,192.1656159076494,COMPLETE
1280,0.3297237455844879,2023-09-04 21:42:28.357743,2023-09-04 21:42:29.937633,0 days 00:00:01.579890,Leaky,Tanh,ReLU,ReLU,36,22,23.0,15.0,20.0,0.005470783057399399,4,250,0.7047060589655953,0.0001935484233750847,309.53259040939975,COMPLETE
1281,0.36708784103393555,2023-09-04 21:42:29.938094,2023-09-04 21:42:30.677314,0 days 00:00:00.739220,Leaky,Sigmoid,,,39,22,17.0,,,0.007977028199061686,2,272,0.40576463840433347,4.494303464439992e-05,321.37768215603296,COMPLETE
1282,0.41018813848495483,2023-09-04 21:42:30.677755,2023-09-04 21:42:31.185290,0 days 00:00:00.507535,Tanh,Tanh,,,37,22,16.0,,,0.011722443868333902,2,261,0.31363766656666286,8.053351845403561e-05,166.8856987953186,COMPLETE
1283,0.5727791786193848,2023-09-04 21:42:31.185718,2023-09-04 21:42:31.393559,0 days 00:00:00.207841,Leaky,Sigmoid,,,33,23,22.0,,,0.006190012041677991,2,281,0.10541068078958411,0.02455095239766765,159.700942668509,COMPLETE
1284,0.32134750485420227,2023-09-04 21:42:31.393993,2023-09-04 21:42:32.431073,0 days 00:00:01.037080,Leaky,Tanh,,,32,22,18.0,,,0.011185340907156838,2,272,0.7446737379467103,0.0005801458606647482,124.95145777652138,COMPLETE
1285,0.4118853509426117,2023-09-04 21:42:32.431534,2023-09-04 21:42:33.715867,0 days 00:00:01.284333,Leaky,Sigmoid,,,36,23,16.0,,,0.00884303272364906,2,276,0.2541558248168203,0.0007014858400366435,246.59646429017533,COMPLETE
1286,0.42760762572288513,2023-09-04 21:42:33.716652,2023-09-04 21:42:34.919591,0 days 00:00:01.202939,Leaky,Tanh,,,39,22,15.0,,,0.004767974633937416,2,268,0.15517164711245987,0.0013361011502561267,150.11897876344878,COMPLETE
1287,0.28016364574432373,2023-09-04 21:42:34.920384,2023-09-04 21:42:36.878451,0 days 00:00:01.958067,Leaky,Sigmoid,,,38,18,23.0,,,0.01412213530821122,2,284,0.7724237074889554,2.3015372362348457e-05,117.79307633739407,COMPLETE
1288,0.35882312059402466,2023-09-04 21:42:36.878905,2023-09-04 21:42:37.437402,0 days 00:00:00.558497,Leaky,Sigmoid,,,31,20,22.0,,,0.014606356309315399,2,235,0.47352480851251044,2.2648752646465345e-05,189.97476161609995,COMPLETE
1289,0.39970606565475464,2023-09-04 21:42:37.437847,2023-09-04 21:42:37.773706,0 days 00:00:00.335859,Tanh,Sigmoid,,,33,18,23.0,,,0.014352953939357585,2,258,0.21068519287840043,1.7494592705873194e-05,203.2413566157503,COMPLETE
1290,1.0893398523330688,2023-09-04 21:42:37.774149,2023-09-04 21:42:38.731384,0 days 00:00:00.957235,Sigmoid,Sigmoid,,,35,21,23.0,,,0.00016961127284158368,2,346,0.11046375748357616,0.010302857846166592,104.34534130206687,COMPLETE
1291,0.3174302875995636,2023-09-04 21:42:38.731820,2023-09-04 21:42:39.388974,0 days 00:00:00.657154,Leaky,Sigmoid,,,37,18,22.0,,,0.01725825465831548,2,206,0.6881986936870134,0.00015648139649448832,136.45020897443905,COMPLETE
1292,0.5660988092422485,2023-09-04 21:42:39.389410,2023-09-04 21:42:42.057246,0 days 00:00:02.667836,Leaky,Sigmoid,,,29,19,22.0,,,0.0001891815529940873,2,185,0.5965249485688673,0.0238391945219475,135.37247883564717,COMPLETE
1293,0.3067542314529419,2023-09-04 21:42:42.057698,2023-09-04 21:42:43.815552,0 days 00:00:01.757854,ReLU,Sigmoid,,,40,19,23.0,,,0.0029250039286015787,2,356,0.720928040849328,0.00010509026635427276,132.90339091786166,COMPLETE
1294,0.3349330723285675,2023-09-04 21:42:43.815972,2023-09-04 21:42:44.646513,0 days 00:00:00.830541,Leaky,Sigmoid,,,39,16,22.0,,,0.012910810329550214,2,172,0.6647025533397594,1.5896764081488413e-05,149.33589353399762,COMPLETE
1295,0.45590338110923767,2023-09-04 21:42:44.646976,2023-09-04 21:42:44.866274,0 days 00:00:00.219298,Leaky,Sigmoid,,,37,18,17.0,,,0.0678604028195176,2,284,0.20366018746194614,0.0019680636445575804,153.2233165617912,COMPLETE
1296,0.3497394025325775,2023-09-04 21:42:44.866688,2023-09-04 21:42:45.378478,0 days 00:00:00.511790,Leaky,Sigmoid,,,85,17,22.0,,,0.012937691640653493,2,107,0.5637329187949592,1.9416813984425783e-05,147.30362537090596,COMPLETE
1297,0.31462445855140686,2023-09-04 21:42:45.378915,2023-09-04 21:42:46.462245,0 days 00:00:01.083330,Tanh,Sigmoid,,,36,19,23.0,,,0.01725044832426146,2,217,0.7467136027609143,0.00013202038910770558,537.7868915264423,COMPLETE
1298,0.33799082040786743,2023-09-04 21:42:46.462698,2023-09-04 21:42:46.870562,0 days 00:00:00.407864,Leaky,Sigmoid,,,92,21,18.0,,,0.010813681718746027,2,62,0.4628157701446824,0.00040664994396548995,544.8785326557775,COMPLETE
1299,0.43255096673965454,2023-09-04 21:42:46.870979,2023-09-04 21:42:50.273746,0 days 00:00:03.402767,Leaky,Sigmoid,,,38,21,18.0,,,0.0002689405682962861,2,240,0.6992659610060228,0.0002946690951758445,313.5551460901896,COMPLETE
1300,1.0365931987762451,2023-09-04 21:42:50.274154,2023-09-04 21:42:50.797687,0 days 00:00:00.523533,Leaky,Sigmoid,,,98,21,17.0,,,1.1457184152071004e-05,2,148,0.2536097285486913,0.048078170540690864,127.86575750402503,COMPLETE
1301,0.3604736924171448,2023-09-04 21:42:50.798196,2023-09-04 21:42:51.585573,0 days 00:00:00.787377,Leaky,Sigmoid,,,41,18,23.0,,,0.05658214831614287,2,162,0.7319181282789509,8.698140521012979e-05,559.7133120023287,COMPLETE
1302,0.32326388359069824,2023-09-04 21:42:51.586366,2023-09-04 21:42:52.824125,0 days 00:00:01.237759,Leaky,Sigmoid,,,36,17,19.0,,,0.014814832158824282,2,139,0.7719027891498451,1.4637387709487037e-05,128.02967413540543,COMPLETE
1303,0.4227186441421509,2023-09-04 21:42:52.824582,2023-09-04 21:42:53.198382,0 days 00:00:00.373800,Tanh,Sigmoid,,,89,20,22.0,,,0.013088284468944151,2,80,0.21853450702360241,0.0011355376208508118,196.52188949584962,COMPLETE
1304,0.38436824083328247,2023-09-04 21:42:53.198803,2023-09-04 21:42:54.938065,0 days 00:00:01.739262,Leaky,Sigmoid,,,33,21,13.0,,,0.0014818307824428492,2,118,0.6662476286719169,0.00020777891485961243,127.24810202647063,COMPLETE
1305,0.4069378674030304,2023-09-04 21:42:54.938498,2023-09-04 21:42:55.199649,0 days 00:00:00.261151,Leaky,Sigmoid,,,96,22,17.0,,,0.017601522046080915,2,287,0.23886034740729423,0.00032635920198364777,145.69125587709487,COMPLETE
1306,0.3223911225795746,2023-09-04 21:42:55.200085,2023-09-04 21:42:56.580947,0 days 00:00:01.380862,ReLU,Sigmoid,,,39,21,15.0,,,0.009999058952026858,2,184,0.6322223761352405,2.2708030307432426e-05,134.35920018416184,COMPLETE
1307,0.7146483659744263,2023-09-04 21:42:56.581743,2023-09-04 21:42:58.798776,0 days 00:00:02.217033,Leaky,Sigmoid,,,42,19,19.0,,,3.178929156510472e-05,2,130,0.7705622046002625,0.0005092791589166699,213.4823716383714,COMPLETE
1308,0.5084772109985352,2023-09-04 21:42:58.799198,2023-09-04 21:42:59.114117,0 days 00:00:00.314919,Leaky,Sigmoid,,,100,22,14.0,,,0.012604899179149196,2,153,0.17302268890967,0.0015833067738802253,633.5676789154877,COMPLETE
1309,0.3490111827850342,2023-09-04 21:42:59.114529,2023-09-04 21:42:59.574702,0 days 00:00:00.460173,Leaky,Sigmoid,,,94,20,18.0,,,0.019610776849718688,2,165,0.7160245037064802,0.0008835726593566632,4593.2235561939,COMPLETE
1310,0.4290611743927002,2023-09-04 21:42:59.575147,2023-09-04 21:42:59.898266,0 days 00:00:00.323119,Leaky,Sigmoid,,,98,22,16.0,,,0.011139536109021431,2,172,0.1551376632658653,1.3710367286420498e-05,160.65264351347574,COMPLETE
1311,0.3153891861438751,2023-09-04 21:42:59.898708,2023-09-04 21:43:01.062520,0 days 00:00:01.163812,Tanh,Sigmoid,,,26,13,23.0,,,0.015326556053443284,2,247,0.7443177283630102,0.00015328039324180974,217.7225887157299,COMPLETE
1312,0.354947030544281,2023-09-04 21:43:01.062968,2023-09-04 21:43:03.142869,0 days 00:00:02.079901,Leaky,Leaky,,,84,22,22.0,,,0.0008205376223462558,2,335,0.6784868365033528,1.751736799849563e-05,164.15446888581488,COMPLETE
1313,0.5379220247268677,2023-09-04 21:43:03.143289,2023-09-04 21:43:04.373311,0 days 00:00:01.230022,Leaky,Sigmoid,,,92,21,21.0,,,0.00037818594900644874,2,138,0.7719367649962446,0.002243428134451361,160.38969941070116,COMPLETE
1314,0.3737424314022064,2023-09-04 21:43:04.373728,2023-09-04 21:43:04.811345,0 days 00:00:00.437617,Leaky,Sigmoid,,,87,20,19.0,,,0.009465270042419946,2,93,0.3536744122061186,2.6051655086647466e-05,128.31860053402255,COMPLETE
1315,0.3636697828769684,2023-09-04 21:43:04.811775,2023-09-04 21:43:07.670076,0 days 00:00:02.858301,Sigmoid,Sigmoid,,,43,22,15.0,,,0.0040404383884396315,2,190,0.7062848789295721,6.373401672362313e-05,126.21195927719397,COMPLETE
1316,0.8461586833000183,2023-09-04 21:43:07.670529,2023-09-04 21:43:10.198074,0 days 00:00:02.527545,Leaky,Sigmoid,,,38,1,18.0,,,0.0010951632966242205,2,178,0.7399241951211308,0.00012101962171994923,299.8108673952938,COMPLETE
1317,0.37431958317756653,2023-09-04 21:43:10.198493,2023-09-04 21:43:15.777404,0 days 00:00:05.578911,Leaky,Sigmoid,,,34,23,19.0,,,0.0004559227794823441,2,282,0.7990199758089701,0.0002537827884517686,226.68457134057445,COMPLETE
1318,0.7117122411727905,2023-09-04 21:43:15.777837,2023-09-04 21:43:17.024253,0 days 00:00:01.246416,Tanh,Sigmoid,,,41,23,17.0,,,4.01354153297234e-05,2,146,0.42791578404810726,0.00010048621762562928,223.2029732482074,COMPLETE
1319,0.3776532709598541,2023-09-04 21:43:17.024682,2023-09-04 21:43:17.344057,0 days 00:00:00.319375,Leaky,Sigmoid,,,46,23,16.0,,,0.043579002483627935,2,158,0.24761168086593888,0.000696635570285865,284.15261495338297,COMPLETE
1320,0.3850843608379364,2023-09-04 21:43:17.344487,2023-09-04 21:43:17.662998,0 days 00:00:00.318511,ReLU,Sigmoid,,,97,21,21.0,,,0.013949656700598969,2,207,0.32552882596027527,1.1379888057859895e-05,126.46839323497954,COMPLETE
1321,0.3584437072277069,2023-09-04 21:43:17.663454,2023-09-04 21:43:18.324289,0 days 00:00:00.660835,Leaky,Sigmoid,,,94,19,19.0,,,0.007782100175786814,2,123,0.4532308499707479,1.9971117812711087e-05,226.25747036111767,COMPLETE
1322,0.3746686577796936,2023-09-04 21:43:18.324707,2023-09-04 21:43:18.668914,0 days 00:00:00.344207,Leaky,Leaky,,,40,22,22.0,,,0.020106533484323785,2,292,0.2572080876407876,1.001034992394097e-05,271.5726960380122,COMPLETE
1323,0.33485835790634155,2023-09-04 21:43:18.669339,2023-09-04 21:43:19.326406,0 days 00:00:00.657067,Leaky,Sigmoid,,,96,23,18.0,,,0.011344155626059362,2,134,0.5820744818409251,0.00017236421533375833,206.7664936065674,COMPLETE
1324,0.46010157465934753,2023-09-04 21:43:19.326826,2023-09-04 21:43:19.996782,0 days 00:00:00.669956,Leaky,Sigmoid,,,36,21,6.0,,,0.0032023048064173947,2,357,0.13226693994074992,1.413320020438065e-05,174.9991525816686,COMPLETE
1325,0.366505891084671,2023-09-04 21:43:19.997206,2023-09-04 21:43:20.662618,0 days 00:00:00.665412,Tanh,Sigmoid,,,44,22,23.0,,,0.015887559431890942,2,153,0.621250836430528,0.0004560320743240937,657.5693048547815,COMPLETE
1326,0.36115673184394836,2023-09-04 21:43:20.663057,2023-09-04 21:43:21.764470,0 days 00:00:01.101413,Leaky,Sigmoid,,,13,23,17.0,,,0.006396296391562788,2,263,0.29345258090092763,0.0002297702961042346,124.07747315707272,COMPLETE
1327,0.34704887866973877,2023-09-04 21:43:21.764895,2023-09-04 21:43:22.377026,0 days 00:00:00.612131,Leaky,Sigmoid,,,100,21,21.0,,,0.01029735662280194,2,107,0.6927404295096247,1.6542181117539056e-05,131.9819286134508,COMPLETE
1328,0.6713265180587769,2023-09-04 21:43:22.377462,2023-09-04 21:43:23.767986,0 days 00:00:01.390524,Leaky,Sigmoid,,,91,23,16.0,,,6.681803763780247e-05,2,164,0.7449097475327727,0.00019636242158472178,124.8764960126179,COMPLETE
1329,0.3225579261779785,2023-09-04 21:43:23.768407,2023-09-04 21:43:25.706350,0 days 00:00:01.937943,Leaky,Sigmoid,,,38,17,23.0,,,0.002620680611606367,2,276,0.7677262850465681,7.63474494863804e-05,247.06038718999818,COMPLETE
1330,0.3857533931732178,2023-09-04 21:43:25.706799,2023-09-04 21:43:25.991074,0 days 00:00:00.284275,Leaky,Sigmoid,,,41,22,20.0,,,0.01275881630129929,2,196,0.18528058056458088,0.00038307107019392724,132.35477292096172,COMPLETE
1331,0.3343837261199951,2023-09-04 21:43:25.991507,2023-09-04 21:43:28.516744,0 days 00:00:02.525237,Tanh,Sigmoid,,,31,23,19.0,,,0.0020118153880397515,2,142,0.7994909498561517,0.0005831077152124363,202.50607745316776,COMPLETE
1332,0.9794110059738159,2023-09-04 21:43:28.517305,2023-09-04 21:43:29.332414,0 days 00:00:00.815109,Leaky,Leaky,,,98,22,14.0,,,2.523146840962734e-05,2,226,0.2801775519590982,0.005449324002299721,160.78166320260647,COMPLETE
1333,0.41916871070861816,2023-09-04 21:43:29.332849,2023-09-04 21:43:30.191261,0 days 00:00:00.858412,ReLU,Sigmoid,,,43,22,18.0,,,0.0053905192301368175,2,175,0.17659639079752656,0.00014243668515925959,183.89640587700737,COMPLETE
1334,0.34909340739250183,2023-09-04 21:43:30.192073,2023-09-04 21:43:30.952042,0 days 00:00:00.759969,Leaky,Sigmoid,,,47,23,22.0,,,0.018114064639408886,2,131,0.5273510624755781,0.0003036855327581483,210.79518946205698,COMPLETE
