number,value,datetime_start,datetime_complete,duration,params_activation1,params_activation2,params_activation3,params_activation4,params_batch_size,params_fl1,params_fl2,params_fl3,params_fl4,params_learning_rate,params_n_layers,params_num_epochs,params_train_size,params_weight_decay,user_attrs_mre,state
929,0.3164560794830322,2023-09-04 21:46:47.774479,2023-09-04 21:46:48.369306,0 days 00:00:00.594827,ReLU,Leaky,Leaky,,41,19,8.0,24.0,,0.020225464007738312,3,76,0.44590427245287023,0.00010766608298240133,163.74118832674893,COMPLETE
930,0.4294376075267792,2023-09-04 21:46:48.369695,2023-09-04 21:46:49.277351,0 days 00:00:00.907656,Leaky,Leaky,Tanh,,38,19,21.0,22.0,,0.00019764327690078567,3,201,0.16499092686169162,0.00015226273387087101,143.63406599813433,COMPLETE
931,0.4057322144508362,2023-09-04 21:46:49.277739,2023-09-04 21:46:55.505814,0 days 00:00:06.228075,ReLU,Leaky,Leaky,,35,18,20.0,23.0,,2.70575940561572e-05,3,338,0.7713747355938657,1.0157139930533004e-05,175.04423516177567,COMPLETE
932,0.5649058222770691,2023-09-04 21:46:55.506206,2023-09-04 21:46:56.650224,0 days 00:00:01.144018,ReLU,Tanh,Leaky,,40,20,9.0,22.0,,0.005188894078244265,3,183,0.6918267845233411,0.0504897578172963,203.35432410962653,COMPLETE
933,0.40363645553588867,2023-09-04 21:46:56.650717,2023-09-04 21:46:57.209910,0 days 00:00:00.559193,ReLU,ReLU,Leaky,,36,18,8.0,24.0,,0.00167315716139076,3,151,0.3259205697620952,7.868017681283203e-05,328.6185025861186,COMPLETE
934,0.3663257360458374,2023-09-04 21:46:57.210307,2023-09-04 21:46:57.512299,0 days 00:00:00.301992,ReLU,Leaky,Tanh,,43,19,9.0,10.0,,0.012366600333964995,3,214,0.7419284087201492,1.5028337710840359e-05,334.9510477701823,COMPLETE
935,0.5207298994064331,2023-09-04 21:46:57.512693,2023-09-04 21:46:58.296848,0 days 00:00:00.784155,ReLU,Leaky,Leaky,,38,20,9.0,23.0,,0.0003284118923875263,3,196,0.19175490060722397,0.0026115296881571784,320.21289422102035,COMPLETE
936,0.31799396872520447,2023-09-04 21:46:58.297253,2023-09-04 21:46:59.030204,0 days 00:00:00.732951,ReLU,Tanh,ReLU,,47,19,11.0,23.0,,0.007313056172089361,3,170,0.6566392187842033,0.0006105396894105209,235.8771456204928,COMPLETE
937,0.3441554307937622,2023-09-04 21:46:59.030603,2023-09-04 21:46:59.765021,0 days 00:00:00.734418,ReLU,Leaky,Leaky,,35,20,5.0,11.0,,0.00938672757485252,3,206,0.7991815652244171,0.002146338380290462,551.726220703125,COMPLETE
938,0.4304141402244568,2023-09-04 21:46:59.765422,2023-09-04 21:47:00.176533,0 days 00:00:00.411111,ReLU,Sigmoid,Leaky,,56,18,23.0,22.0,,0.002075986199247464,3,303,0.11741881189163525,0.008293927828578483,156.87139597073408,COMPLETE
939,0.383444607257843,2023-09-04 21:47:00.176920,2023-09-04 21:47:00.710862,0 days 00:00:00.533942,Leaky,Leaky,Tanh,,40,19,21.0,10.0,,0.017218221988718356,3,183,0.3970738833193184,0.0002424331637529447,290.58210138174206,COMPLETE
940,0.300423800945282,2023-09-04 21:47:00.711261,2023-09-04 21:47:02.559696,0 days 00:00:01.848435,ReLU,ReLU,Leaky,,52,9,24.0,23.0,,0.002954850060090322,3,192,0.7549751230740624,5.129517684491861e-05,179.14715799967448,COMPLETE
941,0.3793434202671051,2023-09-04 21:47:02.560448,2023-09-04 21:47:07.931825,0 days 00:00:05.371377,ReLU,Tanh,Leaky,,37,17,22.0,24.0,,0.0007179855887361501,3,218,0.7118572438352054,0.006325062915056979,147.00064744289566,COMPLETE
942,0.3227304518222809,2023-09-04 21:47:07.932232,2023-09-04 21:47:08.247053,0 days 00:00:00.314821,ReLU,Leaky,Leaky,,92,20,20.0,22.0,,0.02258975573830032,3,166,0.45387266138710186,0.00013345771112469807,141.91376386369978,COMPLETE
943,0.45316752791404724,2023-09-04 21:47:08.247459,2023-09-04 21:47:10.487936,0 days 00:00:02.240477,ReLU,Leaky,ReLU,,42,20,22.0,9.0,,0.00023870417893726709,3,137,0.770339399343741,0.00030995565244011327,129.16242290413294,COMPLETE
944,0.37199094891548157,2023-09-04 21:47:10.488336,2023-09-04 21:47:11.073252,0 days 00:00:00.584916,ReLU,Leaky,Tanh,,45,19,10.0,12.0,,0.013458898521594674,3,156,0.5065018731015564,0.004969203448055317,346.94293701171875,COMPLETE
945,0.3783186078071594,2023-09-04 21:47:11.073649,2023-09-04 21:47:12.166811,0 days 00:00:01.093162,ReLU,Tanh,Leaky,,35,18,21.0,23.0,,0.0062601416386527465,3,205,0.4653837458108528,0.013826315831500563,246.70098482624869,COMPLETE
946,0.6389325857162476,2023-09-04 21:47:12.167214,2023-09-04 21:47:12.838935,0 days 00:00:00.671721,ReLU,Leaky,Leaky,,39,20,11.0,24.0,,0.00012352646702174072,3,180,0.12762063136150167,0.0010320712832805065,683.294431008233,COMPLETE
947,0.6944013237953186,2023-09-04 21:47:12.839332,2023-09-04 21:47:14.294901,0 days 00:00:01.455569,ReLU,ReLU,Leaky,,60,19,21.0,22.0,,3.4258987919377994e-05,3,191,0.4146327833244488,0.00016940620920981948,216.61693696825915,COMPLETE
948,0.5712330937385559,2023-09-04 21:47:14.295302,2023-09-04 21:47:18.180325,0 days 00:00:03.885023,ReLU,Leaky,Tanh,,34,4,23.0,23.0,,3.855376113402233e-05,3,213,0.7251909767006214,0.003074930109017135,197.5084845314563,COMPLETE
949,0.313425749540329,2023-09-04 21:47:18.180727,2023-09-04 21:47:18.671378,0 days 00:00:00.490651,ReLU,Tanh,Leaky,,38,19,22.0,10.0,,0.008052852096742114,3,200,0.7990456813225127,6.350542580296141e-05,244.40882210109544,COMPLETE
950,0.3220146596431732,2023-09-04 21:47:18.671793,2023-09-04 21:47:20.246929,0 days 00:00:01.575136,Leaky,Leaky,Leaky,,36,18,23.0,9.0,,0.0024674783996235963,3,177,0.6793739593991969,0.00020389265003640578,8161.281783492477,COMPLETE
951,0.48706212639808655,2023-09-04 21:47:20.247670,2023-09-04 21:47:23.602581,0 days 00:00:03.354911,ReLU,Sigmoid,ReLU,,40,22,21.0,6.0,,0.00045509441736876446,3,328,0.5355074830554086,0.00048327577164319115,236.83565372228622,COMPLETE
952,0.5990937948226929,2023-09-04 21:47:23.603009,2023-09-04 21:47:24.171256,0 days 00:00:00.568247,ReLU,Leaky,Leaky,,87,20,20.0,22.0,,0.00016460347033205993,3,223,0.1557607117506433,9.61483695824606e-05,521.0640784977797,COMPLETE
953,0.31276416778564453,2023-09-04 21:47:24.171672,2023-09-04 21:47:25.326879,0 days 00:00:01.155207,ReLU,Tanh,Tanh,,34,20,24.0,24.0,,0.004185485418495787,3,187,0.42869434641892445,1.3028720934826798e-05,146.99144529092192,COMPLETE
954,0.799984872341156,2023-09-04 21:47:25.327306,2023-09-04 21:47:29.957431,0 days 00:00:04.630125,ReLU,Leaky,Leaky,,42,21,20.0,22.0,,1.7504890391872175e-05,3,294,0.7478097819363094,0.06385646996250621,126.93967237926665,COMPLETE
955,0.32936492562294006,2023-09-04 21:47:29.957833,2023-09-04 21:47:30.695451,0 days 00:00:00.737618,ReLU,ReLU,Leaky,,36,19,12.0,23.0,,0.03086620350802562,3,211,0.7710369353764532,0.003890244887802114,950.1532757733319,COMPLETE
956,0.5266045331954956,2023-09-04 21:47:30.695856,2023-09-04 21:47:31.070883,0 days 00:00:00.375027,ReLU,Leaky,,,38,21,22.0,,,0.01084239489365525,2,198,0.7026065861458125,0.07637952573882995,326.514624554178,COMPLETE
957,0.36882707476615906,2023-09-04 21:47:31.071266,2023-09-04 21:47:33.116531,0 days 00:00:02.045265,ReLU,Tanh,Leaky,,33,15,23.0,11.0,,0.0010502299340083242,3,220,0.7289512657544446,0.0013850499921263485,142.45081242975198,COMPLETE
958,0.3683171272277832,2023-09-04 21:47:33.116926,2023-09-04 21:47:33.479639,0 days 00:00:00.362713,Leaky,Leaky,Leaky,,44,20,21.0,9.0,,0.005238816556940564,3,315,0.25399358583780546,8.065726996003878e-05,130.97087874502506,COMPLETE
959,0.6383216381072998,2023-09-04 21:47:33.480048,2023-09-04 21:47:35.118251,0 days 00:00:01.638203,ReLU,Leaky,Tanh,,37,17,22.0,23.0,,4.173562766543319e-05,3,230,0.19790042937395824,5.118099318635311e-05,244.813760309634,COMPLETE
960,0.3301977515220642,2023-09-04 21:47:35.118985,2023-09-04 21:47:35.784321,0 days 00:00:00.665336,ReLU,Leaky,ReLU,,41,12,20.0,24.0,,0.04347555040552638,3,203,0.7989549982782645,0.00025170155661862365,699.229746500651,COMPLETE
961,0.4182489812374115,2023-09-04 21:47:35.784730,2023-09-04 21:47:36.030526,0 days 00:00:00.245796,ReLU,Tanh,Leaky,,75,18,22.0,10.0,,0.0153929403635187,3,186,0.17522153958519213,0.0007289085773869051,146.59011554718018,COMPLETE
962,0.35899072885513306,2023-09-04 21:47:36.030932,2023-09-04 21:47:36.512448,0 days 00:00:00.481516,ReLU,Leaky,Leaky,,34,18,21.0,5.0,,0.01819587099682701,3,331,0.33435630764960605,0.0003739592241453425,167.3497190475464,COMPLETE
963,0.37486857175827026,2023-09-04 21:47:36.512851,2023-09-04 21:47:37.033975,0 days 00:00:00.521124,ReLU,ReLU,Leaky,,39,19,21.0,22.0,,0.00847329261236575,3,165,0.3089999748128309,0.03411650760362174,137.0697917000192,COMPLETE
964,0.32814109325408936,2023-09-04 21:47:37.034377,2023-09-04 21:47:37.854000,0 days 00:00:00.819623,ReLU,Leaky,Tanh,,36,20,23.0,9.0,,0.0014077670826616805,3,467,0.27915743544979404,0.00015892300325066788,116.93510394626193,COMPLETE
965,1.043798804283142,2023-09-04 21:47:37.854398,2023-09-04 21:47:37.981963,0 days 00:00:00.127565,ReLU,Sigmoid,Leaky,,34,21,14.0,23.0,,0.003394290196565192,3,225,0.1251604502065653,0.05819308742180525,107.91680450439453,COMPLETE
966,0.3734104037284851,2023-09-04 21:47:37.982360,2023-09-04 21:47:38.267801,0 days 00:00:00.285441,ReLU,Tanh,Leaky,,70,20,20.0,23.0,,0.010465175290143671,3,177,0.2689480624160719,0.00012089975709984633,160.1265892982483,COMPLETE
967,0.44451504945755005,2023-09-04 21:47:38.268203,2023-09-04 21:47:38.455447,0 days 00:00:00.187244,ReLU,Leaky,ReLU,,37,22,21.0,22.0,,0.02519640609978538,3,211,0.1398014447488888,1.5886482137542465e-05,142.0124277750651,COMPLETE
968,0.43490663170814514,2023-09-04 21:47:38.455845,2023-09-04 21:47:38.668758,0 days 00:00:00.212913,Leaky,Leaky,Leaky,,41,19,22.0,8.0,,0.012886203145747352,3,308,0.19079395600250992,5.815299374501513e-05,348.40966796875,COMPLETE
969,0.31853145360946655,2023-09-04 21:47:38.669171,2023-09-04 21:47:40.085723,0 days 00:00:01.416552,ReLU,ReLU,Tanh,,39,21,20.0,24.0,,0.0005863332968821724,3,193,0.7509497429081481,1.907993439314071e-05,136.15687951809022,COMPLETE
970,0.5768330693244934,2023-09-04 21:47:40.086112,2023-09-04 21:47:44.007607,0 days 00:00:03.921495,ReLU,Tanh,Leaky,,33,19,2.0,22.0,,8.916439459005983e-05,3,203,0.7701888050397113,7.048284727748336e-05,194.1526585846699,COMPLETE
971,0.4444711208343506,2023-09-04 21:47:44.008018,2023-09-04 21:47:44.175851,0 days 00:00:00.167833,ReLU,Leaky,Leaky,,35,20,22.0,9.0,,0.039035303231665916,3,220,0.23389139376695015,0.00010286788353353319,182.46765543619793,COMPLETE
972,0.3207907974720001,2023-09-04 21:47:44.176239,2023-09-04 21:47:46.845894,0 days 00:00:02.669655,ReLU,Leaky,Leaky,,43,18,23.0,10.0,,0.0003894170742666098,3,231,0.6776970585685959,0.00018460314323399547,824.1652653470952,COMPLETE
973,0.3264465034008026,2023-09-04 21:47:46.846290,2023-09-04 21:47:47.681591,0 days 00:00:00.835301,ReLU,Tanh,Tanh,,18,21,24.0,8.0,,0.007151503537348703,3,194,0.36086266363505,4.095209821332975e-05,223.37521253313338,COMPLETE
974,0.38579705357551575,2023-09-04 21:47:47.682342,2023-09-04 21:47:50.765322,0 days 00:00:03.082980,Sigmoid,Leaky,Leaky,,46,17,21.0,23.0,,0.0009631589408064146,3,170,0.6148720663294565,4.5817865929069076e-05,154.4742464489407,COMPLETE
975,0.9996072053909302,2023-09-04 21:47:50.765716,2023-09-04 21:47:51.468871,0 days 00:00:00.703155,ReLU,Leaky,Leaky,,37,20,20.0,24.0,,1.0120633396816843e-05,3,211,0.11428550773311189,0.00013928445136902613,113.26096228287683,COMPLETE
976,0.30715131759643555,2023-09-04 21:47:51.469264,2023-09-04 21:47:52.039199,0 days 00:00:00.569935,ReLU,ReLU,ReLU,,40,19,22.0,22.0,,0.004528620500497114,3,128,0.7996106527401676,0.0008363311055499859,129.2193406422933,COMPLETE
977,0.4359130561351776,2023-09-04 21:47:52.039937,2023-09-04 21:47:54.525838,0 days 00:00:02.485901,ReLU,Leaky,Leaky,,33,19,20.0,8.0,,0.0018477123072993032,3,183,0.28577415299948566,0.0011681798703643816,157.2016490720353,COMPLETE
978,0.3192976117134094,2023-09-04 21:47:54.526580,2023-09-04 21:47:56.176542,0 days 00:00:01.649962,Sigmoid,Tanh,Tanh,,35,22,9.0,11.0,,0.014092758118987704,3,237,0.5728457108899384,0.0003186413748314497,498.23327713978443,COMPLETE
979,0.3330436944961548,2023-09-04 21:47:56.176948,2023-09-04 21:47:56.741063,0 days 00:00:00.564115,Leaky,Leaky,Leaky,,38,20,7.0,9.0,,0.009407924617613425,3,203,0.7224371400330193,0.00024642899830747985,215.2718712591356,COMPLETE
980,0.4745790660381317,2023-09-04 21:47:56.741458,2023-09-04 21:47:59.834743,0 days 00:00:03.093285,ReLU,Sigmoid,Leaky,,36,18,21.0,21.0,,0.0002903335391220601,3,157,0.6554577790385523,2.5197854369837277e-05,278.10452581514977,COMPLETE
981,0.3124798536300659,2023-09-04 21:47:59.835137,2023-09-04 21:48:00.778327,0 days 00:00:00.943190,ReLU,Leaky,Sigmoid,,54,21,21.0,23.0,,0.055689876807085224,3,340,0.7504351002385221,0.0005452974434252507,296.61704369747275,COMPLETE
982,0.4307507872581482,2023-09-04 21:48:00.778726,2023-09-04 21:48:00.963199,0 days 00:00:00.184473,ReLU,Tanh,Leaky,,42,20,23.0,22.0,,0.021562556464731156,3,218,0.1571825476901839,8.059063672714518e-05,317.58380017961775,COMPLETE
983,0.5885752439498901,2023-09-04 21:48:00.963592,2023-09-04 21:48:01.173157,0 days 00:00:00.209565,Sigmoid,ReLU,ReLU,,51,22,22.0,23.0,,0.005997224189377045,3,322,0.17801773592812334,0.0014586497407264114,145.59969927813555,COMPLETE
984,0.37666556239128113,2023-09-04 21:48:01.173544,2023-09-04 21:48:01.518113,0 days 00:00:00.344569,ReLU,Leaky,Tanh,,32,18,10.0,9.0,,0.01769738054863767,3,192,0.2938489756562715,0.00019024336265910792,132.25853118896484,COMPLETE
985,0.3372722864151001,2023-09-04 21:48:01.518523,2023-09-04 21:48:06.806020,0 days 00:00:05.287497,ReLU,Leaky,Leaky,,40,19,19.0,24.0,,0.000132734138598366,3,285,0.7077449625747465,0.00012980368098469057,148.86235648707338,COMPLETE
986,0.35458362102508545,2023-09-04 21:48:06.806411,2023-09-04 21:48:09.748099,0 days 00:00:02.941688,ReLU,Tanh,Leaky,Sigmoid,38,21,11.0,7.0,19.0,0.0012842522826974853,4,297,0.7711475605568805,1.1588035963919395e-05,154.36399738440352,COMPLETE
987,0.6558415293693542,2023-09-04 21:48:09.748515,2023-09-04 21:48:10.137023,0 days 00:00:00.388508,Sigmoid,,,,44,20,,,,0.0024721041798283073,1,177,0.7330571520070961,0.034057787416875936,189.01701378099847,COMPLETE
988,0.2954845130443573,2023-09-04 21:48:10.137402,2023-09-04 21:48:11.064594,0 days 00:00:00.927192,ReLU,Leaky,Sigmoid,,35,17,21.0,10.0,,0.01171147919501687,3,209,0.7637035993469374,3.7789195747072706e-05,172.1654773288303,COMPLETE
989,0.4921945035457611,2023-09-04 21:48:11.065003,2023-09-04 21:48:11.800255,0 days 00:00:00.735252,ReLU,Leaky,Leaky,,33,21,15.0,22.0,,0.0008155173247008491,3,225,0.10183838464842938,0.041062202366366325,162.65089152018228,COMPLETE
990,0.32995492219924927,2023-09-04 21:48:11.800645,2023-09-04 21:48:12.630338,0 days 00:00:00.829693,ReLU,ReLU,Tanh,,65,19,6.0,23.0,,0.0035678974638132487,3,188,0.6942166841428707,0.002259263422479185,143.76419590541295,COMPLETE
991,0.28436514735221863,2023-09-04 21:48:12.630793,2023-09-04 21:48:13.533732,0 days 00:00:00.902939,Sigmoid,Tanh,Leaky,,37,20,22.0,17.0,,0.08578802073778746,3,197,0.7725530092103775,5.105757694736091e-05,654.3138190375435,COMPLETE
992,0.4474019706249237,2023-09-04 21:48:13.534135,2023-09-04 21:48:13.861765,0 days 00:00:00.327630,Leaky,Leaky,Leaky,,39,19,20.0,7.0,,0.07098545526969173,3,238,0.43592307340029884,0.008939873106245269,315.25968872070314,COMPLETE
993,0.34574657678604126,2023-09-04 21:48:13.862161,2023-09-04 21:48:14.456690,0 days 00:00:00.594529,ReLU,Sigmoid,ReLU,,58,18,24.0,8.0,,0.007657761966933688,3,215,0.5205450612274735,9.95999444352129e-05,344.54290228374936,COMPLETE
994,0.9108393788337708,2023-09-04 21:48:14.457102,2023-09-04 21:48:15.410115,0 days 00:00:00.953013,ReLU,Leaky,Leaky,,41,20,12.0,21.0,,2.4368291225049096e-05,3,228,0.16863309463091147,0.002989840161294548,278.09942887958726,COMPLETE
995,0.9972081780433655,2023-09-04 21:48:15.410531,2023-09-04 21:48:15.683391,0 days 00:00:00.272860,ReLU,Leaky,Sigmoid,,35,21,23.0,12.0,,0.0051356557463050935,3,145,0.5441902730481906,0.07521624997747739,168.5768051147461,COMPLETE
996,0.39430341124534607,2023-09-04 21:48:15.683793,2023-09-04 21:48:17.461323,0 days 00:00:01.777530,Sigmoid,Tanh,Tanh,,33,20,22.0,24.0,,0.0004935928510213301,3,170,0.39116581252974203,2.0007999982626455e-05,165.4438752567067,COMPLETE
997,0.3706790804862976,2023-09-04 21:48:17.461730,2023-09-04 21:48:17.806749,0 days 00:00:00.345019,ReLU,Leaky,Leaky,,37,19,21.0,22.0,,0.01529450963095265,3,201,0.2012029802991117,0.00015798263240410736,225.0868032949942,COMPLETE
998,0.49088069796562195,2023-09-04 21:48:17.807132,2023-09-04 21:48:18.109924,0 days 00:00:00.302792,ReLU,ReLU,Leaky,,32,18,20.0,9.0,,0.009554071121903476,3,184,0.2271279150406718,6.22994528648282e-05,153.11370340983072,COMPLETE
999,0.3387942612171173,2023-09-04 21:48:18.110313,2023-09-04 21:48:18.702274,0 days 00:00:00.591961,ReLU,Leaky,Leaky,,42,22,21.0,10.0,,0.012310294802807143,3,309,0.6370399343022258,0.000282501269322002,134.95327015412158,COMPLETE
1000,0.4446384012699127,2023-09-04 21:48:18.702703,2023-09-04 21:48:19.213327,0 days 00:00:00.510624,Sigmoid,Tanh,Sigmoid,,39,21,22.0,23.0,,0.002937209342415992,3,216,0.16163868925946384,0.00023255998716358083,181.06213567953193,COMPLETE
1001,0.39676570892333984,2023-09-04 21:48:19.213724,2023-09-04 21:48:20.273184,0 days 00:00:01.059460,ReLU,Leaky,Tanh,,35,17,19.0,22.0,,0.000697844365431273,3,205,0.21953229202954588,0.02337733128506132,123.44870486204651,COMPLETE
1002,0.31623274087905884,2023-09-04 21:48:20.273587,2023-09-04 21:48:20.893305,0 days 00:00:00.619718,ReLU,Leaky,Leaky,,37,20,20.0,23.0,,0.027047998991103973,3,243,0.7341667028190908,0.0004396224718822102,170.99947881698608,COMPLETE
1003,0.3046192526817322,2023-09-04 21:48:20.893694,2023-09-04 21:48:21.580322,0 days 00:00:00.686628,ReLU,Tanh,ReLU,,44,19,23.0,21.0,,0.004182324238731854,3,179,0.7720690091160102,0.0017147526409783814,344.4780003474309,COMPLETE
1004,0.32275691628456116,2023-09-04 21:48:21.580714,2023-09-04 21:48:22.247474,0 days 00:00:00.666760,Leaky,Leaky,Leaky,,34,20,21.0,8.0,,0.019866413055558002,3,192,0.6985742615470436,0.0033860036805720343,194.773605128697,COMPLETE
1005,0.4822252690792084,2023-09-04 21:48:22.247873,2023-09-04 21:48:25.953826,0 days 00:00:03.705953,Sigmoid,Sigmoid,Leaky,,39,22,22.0,24.0,,4.790564149314917e-05,3,233,0.7977007263289524,3.499451081666065e-05,407.64966920705945,COMPLETE
1006,0.31771981716156006,2023-09-04 21:48:25.954224,2023-09-04 21:48:27.204986,0 days 00:00:01.250762,ReLU,ReLU,Sigmoid,,32,21,20.0,11.0,,0.006823709284652415,3,280,0.5850933747735514,8.374432395687439e-05,164.86995237301556,COMPLETE
1007,0.3508707582950592,2023-09-04 21:48:27.205384,2023-09-04 21:48:27.987462,0 days 00:00:00.782078,ReLU,Leaky,Tanh,,41,18,24.0,9.0,,0.001122223744997649,3,199,0.45892412220357787,4.390328598797081e-05,116.98642294747489,COMPLETE
1008,0.5111223459243774,2023-09-04 21:48:27.987865,2023-09-04 21:48:30.129580,0 days 00:00:02.141715,ReLU,Tanh,Leaky,,49,19,21.0,23.0,,7.467831709485694e-05,3,223,0.491648250966277,0.000663863059642757,183.42626720479785,COMPLETE
1009,0.4694104790687561,2023-09-04 21:48:30.129987,2023-09-04 21:48:31.017740,0 days 00:00:00.887753,Sigmoid,Leaky,Leaky,,36,20,23.0,22.0,,0.016248968814621782,3,319,0.7386061349477928,0.011835455915586827,287.1733976323554,COMPLETE
1010,0.3156222403049469,2023-09-04 21:48:31.018132,2023-09-04 21:48:31.843827,0 days 00:00:00.825695,ReLU,Leaky,Leaky,,34,19,19.0,24.0,,0.008498259305098215,3,159,0.7229932516520862,0.005382663347198066,132.40066510155089,COMPLETE
1011,0.3144873082637787,2023-09-04 21:48:31.844229,2023-09-04 21:48:32.303935,0 days 00:00:00.459706,ReLU,Leaky,Sigmoid,,31,13,22.0,8.0,,0.005990909081690363,3,210,0.2597350647047399,2.7468900514696257e-05,146.01021869365985,COMPLETE
1012,0.5127413272857666,2023-09-04 21:48:32.304326,2023-09-04 21:48:36.845887,0 days 00:00:04.541561,ReLU,Tanh,ReLU,,37,16,20.0,4.0,,6.587250712874955e-05,3,247,0.7996237443100473,2.222406648042183e-05,247.93117838253377,COMPLETE
1013,0.5162209868431091,2023-09-04 21:48:36.846285,2023-09-04 21:48:39.634084,0 days 00:00:02.787799,Sigmoid,ReLU,Leaky,,40,21,21.0,10.0,,4.969585666735111e-05,3,184,0.6640130731140722,1.634613659819686e-05,168.48469269793966,COMPLETE
1014,0.3506528437137604,2023-09-04 21:48:39.634505,2023-09-04 21:48:40.217924,0 days 00:00:00.583419,ReLU,Leaky,Tanh,,35,20,23.0,9.0,,0.010647426330518043,3,232,0.41649387189205445,0.0001937116648963629,140.78903073680644,COMPLETE
1015,0.39408522844314575,2023-09-04 21:48:40.218336,2023-09-04 21:48:41.295180,0 days 00:00:01.076844,ReLU,Leaky,Leaky,,39,18,22.0,23.0,,0.002018740122900184,3,330,0.7509239748932767,6.729165373791342e-05,131.46253567054623,COMPLETE
1016,0.35047924518585205,2023-09-04 21:48:41.295597,2023-09-04 21:48:42.147079,0 days 00:00:00.851482,Leaky,Tanh,Leaky,,42,21,21.0,21.0,,0.0015256579216618251,3,194,0.3333153439273087,0.00012443474630599425,360.4715226371333,COMPLETE
1017,0.8632078170776367,2023-09-04 21:48:42.147563,2023-09-04 21:48:43.788142,0 days 00:00:01.640579,ReLU,Leaky,Sigmoid,,33,19,20.0,7.0,,1.9398441506086793e-05,3,169,0.3519840814489169,5.312372089691969e-05,111.5069451416738,COMPLETE
1018,0.40649864077568054,2023-09-04 21:48:43.788556,2023-09-04 21:48:44.078687,0 days 00:00:00.290131,Sigmoid,Leaky,Leaky,,38,20,22.0,22.0,,0.03444303298027778,3,216,0.17955152737139873,3.1632297849150086e-05,400.18388951078373,COMPLETE
1019,0.4971797466278076,2023-09-04 21:48:44.079091,2023-09-04 21:48:44.740657,0 days 00:00:00.661566,ReLU,Sigmoid,Tanh,,36,20,23.0,24.0,,0.013369834961152443,3,273,0.5074442340224972,0.020675872494961303,218.13453801472983,COMPLETE
1020,0.3704844117164612,2023-09-04 21:48:44.741065,2023-09-04 21:48:45.483547,0 days 00:00:00.742482,ReLU,ReLU,,,46,21,21.0,,,0.0038983045744096856,2,289,0.688493004568122,9.938162260278074e-05,400.911333211263,COMPLETE
1021,0.3484896421432495,2023-09-04 21:48:45.483949,2023-09-04 21:48:47.197703,0 days 00:00:01.713754,ReLU,Tanh,Leaky,,32,18,19.0,23.0,,0.0008983637558967456,3,202,0.7708302061072655,0.00035636482447400596,247.55873777808213,COMPLETE
