number,value,datetime_start,datetime_complete,duration,params_activation1,params_activation2,params_activation3,params_activation4,params_batch_size,params_fl1,params_fl2,params_fl3,params_fl4,params_learning_rate,params_n_layers,params_num_epochs,params_train_size,params_weight_decay,user_attrs_mre,state
1759,0.48173147439956665,2023-09-04 22:13:31.112628,2023-09-04 22:13:32.209481,0 days 00:00:01.096853,ReLU,ReLU,Tanh,Leaky,37,20,22.0,21.0,11.0,0.0007310425116200702,4,208,0.12193130607054413,0.0009809217252638189,174.75765104854807,COMPLETE
1760,0.6271167397499084,2023-09-04 22:13:32.210532,2023-09-04 22:13:41.306333,0 days 00:00:09.095801,ReLU,Leaky,Leaky,,32,20,15.0,19.0,,2.1138812624776707e-05,3,235,0.46677959739263186,0.004429597747899048,167.1112345918696,COMPLETE
1761,0.5201202034950256,2023-09-04 22:13:41.307346,2023-09-04 22:13:43.262318,0 days 00:00:01.954972,ReLU,Leaky,Sigmoid,,28,23,21.0,23.0,,0.024218824739664857,3,263,0.7995421026846355,0.0018928796634666701,350.8672252836682,COMPLETE
1762,0.30721133947372437,2023-09-04 22:13:43.263399,2023-09-04 22:13:45.217540,0 days 00:00:01.954141,ReLU,Sigmoid,Leaky,,34,19,10.0,11.0,,0.009465170135016944,3,170,0.7146297838420747,0.00018700465299027416,235.2763913062311,COMPLETE
1763,0.29589033126831055,2023-09-04 22:13:45.218598,2023-09-04 22:13:48.587738,0 days 00:00:03.369140,Tanh,Tanh,Leaky,,38,17,17.0,7.0,,0.0038230324324691335,3,214,0.6775339939846943,1.709301535012897e-05,176.3548098050631,COMPLETE
1764,0.4437151849269867,2023-09-04 22:13:48.588756,2023-09-04 22:14:02.968217,0 days 00:00:14.379461,Sigmoid,Leaky,ReLU,,26,22,22.0,20.0,,0.0002641993745914031,3,193,0.7469047367516685,0.0001019486484521523,215.28934221811244,COMPLETE
1765,0.3412141501903534,2023-09-04 22:14:02.969221,2023-09-04 22:14:04.984486,0 days 00:00:02.015265,ReLU,Leaky,Leaky,Leaky,31,21,20.0,22.0,10.0,0.005366824357651375,4,226,0.34471510987566295,0.007115864633185854,144.14282501220703,COMPLETE
1766,0.26539182662963867,2023-09-04 22:14:04.985544,2023-09-04 22:14:07.331881,0 days 00:00:02.346337,ReLU,Leaky,Tanh,,36,19,23.0,17.0,,0.00709080255192062,3,189,0.5528153502777629,1.2439334750882866e-05,116.2304225248449,COMPLETE
1767,0.45542144775390625,2023-09-04 22:14:07.333064,2023-09-04 22:14:08.644488,0 days 00:00:01.311424,ReLU,Tanh,Leaky,,41,18,14.0,8.0,,0.002293966594041955,3,55,0.23970030878831022,0.029870648352513133,196.8101685957475,COMPLETE
1768,0.5694499611854553,2023-09-04 22:14:08.645597,2023-09-04 22:14:12.912589,0 days 00:00:04.266992,Sigmoid,Leaky,Sigmoid,,62,20,19.0,9.0,,0.0005293842401602383,3,203,0.7698848483699945,0.006293952364141307,169.59104513007904,COMPLETE
1769,0.408112108707428,2023-09-04 22:14:12.913644,2023-09-04 22:14:14.153088,0 days 00:00:01.239444,ReLU,Leaky,ReLU,Tanh,55,19,7.0,7.0,5.0,0.016646123511694977,4,178,0.40331030857007605,0.0003802654165453219,179.48870653983874,COMPLETE
1770,0.4431658983230591,2023-09-04 22:14:14.154110,2023-09-04 22:14:28.083670,0 days 00:00:13.929560,ReLU,Tanh,Leaky,,33,18,21.0,23.0,,5.862006407693588e-05,3,219,0.7988413671359557,3.465223316733466e-05,187.2736438071891,COMPLETE
1771,0.5413573384284973,2023-09-04 22:14:28.084726,2023-09-04 22:14:35.243303,0 days 00:00:07.158577,ReLU,Leaky,Leaky,,43,20,18.0,9.0,,6.495934634373712e-05,3,460,0.22765753381823223,4.7548383460442415e-05,193.59733407393745,COMPLETE
1772,0.2816341519355774,2023-09-04 22:14:35.244350,2023-09-04 22:14:37.783837,0 days 00:00:02.539487,ReLU,ReLU,,,47,12,22.0,,,0.01365641914709981,2,239,0.7196827482311422,0.00013649640259956304,170.5355663877545,COMPLETE
1773,0.4476853907108307,2023-09-04 22:14:37.784865,2023-09-04 22:14:40.857104,0 days 00:00:03.072239,Sigmoid,Leaky,Tanh,,39,21,21.0,8.0,,0.0011257834870688009,3,251,0.2649912676199135,0.00021765971911366001,562.497997601827,COMPLETE
1774,0.373855322599411,2023-09-04 22:14:40.858129,2023-09-04 22:14:43.450449,0 days 00:00:02.592320,ReLU,Leaky,ReLU,,35,20,23.0,15.0,,0.0029895446787059957,3,197,0.745040668953359,1.0012615466390697e-05,150.84812573688785,COMPLETE
1775,0.3905918598175049,2023-09-04 22:14:43.451506,2023-09-04 22:14:54.377299,0 days 00:00:10.925793,ReLU,Tanh,Leaky,ReLU,30,19,19.0,22.0,7.0,0.0003533252111432565,4,209,0.799540403104827,0.0025008550980871653,644.135888784903,COMPLETE
1776,0.5423133969306946,2023-09-04 22:14:54.378375,2023-09-04 22:14:55.254127,0 days 00:00:00.875752,ReLU,Sigmoid,Sigmoid,,33,21,22.0,21.0,,0.00793733738074106,3,85,0.30359496189196417,0.009864150689949105,322.6931530761719,COMPLETE
1777,0.37055546045303345,2023-09-04 22:14:55.255153,2023-09-04 22:14:57.039124,0 days 00:00:01.783971,Sigmoid,Leaky,Leaky,,45,22,20.0,23.0,,0.0018401885609236643,3,159,0.16696893408372857,2.908309055240785e-05,173.0356956074256,COMPLETE
1778,0.4115692377090454,2023-09-04 22:14:57.040189,2023-09-04 22:14:57.660642,0 days 00:00:00.620453,ReLU,Leaky,Leaky,,57,18,21.0,10.0,,0.01068722534235031,3,185,0.2219192835001165,5.820497600723153e-05,129.56575669913457,COMPLETE
1779,0.3699900507926941,2023-09-04 22:14:57.661728,2023-09-04 22:15:02.290519,0 days 00:00:04.628791,ReLU,Tanh,ReLU,,37,23,9.0,8.0,,0.0015125802528624262,3,227,0.6939906881733177,8.456075227576199e-05,135.26988544683346,COMPLETE
1780,0.4090110659599304,2023-09-04 22:15:02.291542,2023-09-04 22:15:05.548057,0 days 00:00:03.256515,Leaky,Leaky,Leaky,Leaky,29,20,22.0,22.0,13.0,0.0025926389244611326,4,216,0.39203015760921023,0.0008753078541540063,168.6776559908096,COMPLETE
1781,0.8663926720619202,2023-09-04 22:15:05.549091,2023-09-04 22:15:08.356224,0 days 00:00:02.807133,ReLU,Leaky,Tanh,,39,19,10.0,9.0,,2.9903133396821433e-05,3,172,0.20841490494216422,0.015918736035938196,100.49754683915958,COMPLETE
1782,0.3272499740123749,2023-09-04 22:15:08.357267,2023-09-04 22:15:09.916086,0 days 00:00:01.558819,ReLU,Leaky,Leaky,,34,21,23.0,8.0,,0.04549271614799325,3,199,0.6523001481324315,0.000267905518018267,124.62040915855995,COMPLETE
1783,0.5150920152664185,2023-09-04 22:15:09.917125,2023-09-04 22:15:11.294749,0 days 00:00:01.377624,Sigmoid,Tanh,Sigmoid,,32,17,23.0,16.0,,0.09051560043190557,3,364,0.7259660240566698,1.934988060093171e-05,214.8430384585732,COMPLETE
1784,1.0216747522354126,2023-09-04 22:15:11.295785,2023-09-04 22:15:15.420487,0 days 00:00:04.124702,ReLU,Leaky,ReLU,Leaky,41,19,21.0,9.0,9.0,1.3063935473999029e-05,4,66,0.76743731159778,0.00016228397293852338,194.41360727945963,COMPLETE
1785,0.28275442123413086,2023-09-04 22:15:15.421539,2023-09-04 22:15:17.577565,0 days 00:00:02.156026,ReLU,Leaky,Leaky,,36,20,22.0,23.0,,0.003830704684988021,3,50,0.7457794637890015,0.001599576210782686,131.7004692554474,COMPLETE
1786,0.4256885349750519,2023-09-04 22:15:17.578616,2023-09-04 22:15:18.264136,0 days 00:00:00.685520,ReLU,ReLU,Leaky,,27,18,20.0,7.0,,0.012671412560269504,3,242,0.14758731036911876,3.9293572172572164e-05,424.0430308374865,COMPLETE
1787,0.33110281825065613,2023-09-04 22:15:18.265210,2023-09-04 22:15:22.455650,0 days 00:00:04.190440,Sigmoid,Tanh,Leaky,,30,21,18.0,21.0,,0.008746773264664361,3,232,0.7108265686804897,6.5768130780319e-05,135.57726252629206,COMPLETE
1788,0.28069981932640076,2023-09-04 22:15:22.456747,2023-09-04 22:15:24.873708,0 days 00:00:02.416961,ReLU,Leaky,Tanh,,37,19,21.0,22.0,,0.005126060805379023,3,205,0.7694187495502801,0.0001254423437803107,357.24882037823016,COMPLETE
1789,0.9949926733970642,2023-09-04 22:15:24.874727,2023-09-04 22:15:25.513511,0 days 00:00:00.638784,Tanh,Leaky,ReLU,Sigmoid,43,18,19.0,17.0,1.0,0.002098210873425158,4,149,0.13696396520462603,0.015822121269021563,129.81944680213928,COMPLETE
1790,0.8685858249664307,2023-09-04 22:15:25.514562,2023-09-04 22:15:35.607428,0 days 00:00:10.092866,ReLU,Sigmoid,Leaky,,40,22,20.0,18.0,,1.0755172810306009e-05,3,189,0.7735487572351887,0.0068035217368878275,108.11122385660808,COMPLETE
1791,0.28020673990249634,2023-09-04 22:15:35.608520,2023-09-04 22:15:38.836232,0 days 00:00:03.227712,ReLU,Leaky,Sigmoid,,35,20,12.0,8.0,,0.01901226417439788,3,213,0.7997450169142386,0.001241172551995995,238.4184948603312,COMPLETE
1792,0.4871937036514282,2023-09-04 22:15:38.837271,2023-09-04 22:15:47.917550,0 days 00:00:09.080279,Sigmoid,Tanh,Leaky,,32,20,22.0,10.0,,0.00015610309639284132,3,164,0.6734315111944428,1.4374800656186417e-05,221.5919070360137,COMPLETE
1793,0.2677135467529297,2023-09-04 22:15:47.918598,2023-09-04 22:15:50.178488,0 days 00:00:02.259890,ReLU,Leaky,ReLU,Leaky,34,19,22.0,23.0,19.0,0.02843191093803241,4,222,0.7296392655441735,4.9749306313661015e-05,173.8293660481771,COMPLETE
1794,0.5118932723999023,2023-09-04 22:15:50.179537,2023-09-04 22:15:51.088313,0 days 00:00:00.908776,ReLU,Leaky,Leaky,,31,23,23.0,6.0,,0.0064464085682689656,3,180,0.17953464315482937,2.6527825662884846e-05,209.46926805449695,COMPLETE
1795,0.3849305510520935,2023-09-04 22:15:51.089371,2023-09-04 22:15:52.847651,0 days 00:00:01.758280,ReLU,Tanh,Tanh,,38,14,20.0,19.0,,0.01543783232865564,3,201,0.45099302716059597,0.00018577633635960856,341.5041526632106,COMPLETE
1796,0.42065659165382385,2023-09-04 22:15:52.848710,2023-09-04 22:15:53.721680,0 days 00:00:00.872970,ReLU,Leaky,Leaky,,24,17,17.0,9.0,,0.002981646156700038,3,191,0.14173582070705618,0.0005422343538438685,346.85717353820803,COMPLETE
1797,0.2882101833820343,2023-09-04 22:15:53.722742,2023-09-04 22:15:56.611328,0 days 00:00:02.888586,Sigmoid,Leaky,,,50,19,21.0,,,0.01038746984487963,2,406,0.7024925673490915,0.00010908139078440594,116.59178076850043,COMPLETE
1798,0.29526349902153015,2023-09-04 22:15:56.612392,2023-09-04 22:15:58.782549,0 days 00:00:02.170157,ReLU,Leaky,Sigmoid,,28,21,19.0,22.0,,0.004106526973463295,3,170,0.5802785164763995,3.406969028015648e-05,132.90382755163944,COMPLETE
1799,0.3494757413864136,2023-09-04 22:15:58.783621,2023-09-04 22:16:03.362397,0 days 00:00:04.578776,ReLU,ReLU,Leaky,ReLU,44,18,23.0,20.0,14.0,0.0009117880001379419,4,212,0.7999122934838258,0.0006761552091966068,160.01732073889838,COMPLETE
1800,0.35016921162605286,2023-09-04 22:16:03.363477,2023-09-04 22:16:05.559163,0 days 00:00:02.195686,ReLU,Tanh,ReLU,,40,20,13.0,7.0,,0.003398672828985169,3,226,0.33600529572655596,2.1677111342548455e-05,182.5973777311394,COMPLETE
1801,0.48190590739250183,2023-09-04 22:16:05.560230,2023-09-04 22:16:10.808378,0 days 00:00:05.248148,Sigmoid,Leaky,Leaky,,35,22,22.0,8.0,,0.0003927482493840963,3,256,0.6201325480981038,0.0002520254792441029,250.9075412043819,COMPLETE
1802,0.41893908381462097,2023-09-04 22:16:10.809475,2023-09-04 22:16:11.911211,0 days 00:00:01.101736,ReLU,Sigmoid,Leaky,,33,19,11.0,21.0,,0.011332789537537441,3,201,0.3623266372120838,0.00015721839895770044,226.50460131415005,COMPLETE
1803,0.3486509621143341,2023-09-04 22:16:11.912289,2023-09-04 22:16:20.939376,0 days 00:00:09.027087,ReLU,Leaky,Tanh,,42,21,20.0,16.0,,0.0002084297536258637,3,183,0.7476295760789038,0.00020456763407401417,163.14794738436007,COMPLETE
1804,0.32840418815612793,2023-09-04 22:16:20.940446,2023-09-04 22:16:23.790352,0 days 00:00:02.849906,Leaky,Tanh,ReLU,Leaky,48,20,21.0,9.0,6.0,0.00841623106242772,4,218,0.7664031206278453,0.0003601425987485449,3501.857117997839,COMPLETE
1805,0.39284101128578186,2023-09-04 22:16:23.791440,2023-09-04 22:16:35.053724,0 days 00:00:11.262284,ReLU,Leaky,Leaky,,30,18,10.0,13.0,,0.0006393506677070307,3,289,0.7288287222416864,0.002161759968465013,204.19854007297093,COMPLETE
1806,0.3900335729122162,2023-09-04 22:16:35.054811,2023-09-04 22:16:47.157976,0 days 00:00:12.103165,ReLU,Leaky,Sigmoid,,38,10,16.0,22.0,,8.353546191614413e-05,3,247,0.6881820742063424,4.3081245464422785e-05,14178.354038871734,COMPLETE
1807,0.6666498780250549,2023-09-04 22:16:47.159019,2023-09-04 22:16:48.120967,0 days 00:00:00.961948,Sigmoid,,,,36,19,,,,0.001362566744756517,1,108,0.13770815578869777,1.1555029732612658e-05,172.2125692014341,COMPLETE
1808,0.35175690054893494,2023-09-04 22:16:48.121977,2023-09-04 22:16:50.891665,0 days 00:00:02.769688,ReLU,Leaky,Leaky,,32,20,22.0,23.0,,0.0024398894159094503,3,230,0.5002850070638646,8.1646721688997e-05,130.21197046999072,COMPLETE
1809,0.35622507333755493,2023-09-04 22:16:50.892729,2023-09-04 22:16:54.475350,0 days 00:00:03.582621,ReLU,Tanh,Leaky,Tanh,29,15,23.0,8.0,8.0,0.013913679126611216,4,131,0.7686518901262807,1.548312351298467e-05,157.8754724775042,COMPLETE
1810,0.30814051628112793,2023-09-04 22:16:54.476430,2023-09-04 22:16:56.199390,0 days 00:00:01.722960,ReLU,Leaky,ReLU,,34,22,20.0,22.0,,0.0059535718637063395,3,272,0.386669840324528,3.0519228961235554e-05,203.14936864098837,COMPLETE
1811,0.5556854009628296,2023-09-04 22:16:56.200460,2023-09-04 22:17:03.562474,0 days 00:00:07.362014,Sigmoid,Leaky,Tanh,,45,17,21.0,10.0,,9.958735819386333e-05,3,158,0.7441823226240785,0.003103801180438976,206.45958709716797,COMPLETE
1812,0.4338398873806,2023-09-04 22:17:03.563536,2023-09-04 22:17:07.876734,0 days 00:00:04.313198,Tanh,Tanh,Leaky,,89,18,19.0,8.0,,0.0007603590524062191,3,193,0.5325168233716842,3.8030287519577476e-05,147.9753933051707,COMPLETE
1813,0.5008785724639893,2023-09-04 22:17:07.877848,2023-09-04 22:17:09.293299,0 days 00:00:01.415451,ReLU,Leaky,Sigmoid,,40,20,22.0,9.0,,0.0011030834720646128,3,207,0.3237662433535845,0.00013426251397963892,180.33753845214844,COMPLETE
1814,0.5827931761741638,2023-09-04 22:17:09.294354,2023-09-04 22:17:10.231316,0 days 00:00:00.936962,ReLU,ReLU,Leaky,,31,21,8.0,17.0,,0.02162531085921059,3,175,0.24217735728678266,0.03540081665635105,153.95873141288757,COMPLETE
1815,0.477413535118103,2023-09-04 22:17:10.232449,2023-09-04 22:17:13.724428,0 days 00:00:03.491979,ReLU,Leaky,ReLU,Leaky,26,19,18.0,21.0,2.0,0.004597753187705256,4,218,0.27128731242370185,5.251218120691901e-05,168.02762048221328,COMPLETE
1816,0.48299479484558105,2023-09-04 22:17:13.725522,2023-09-04 22:17:19.785145,0 days 00:00:06.059623,Sigmoid,Sigmoid,Leaky,,37,6,23.0,23.0,,0.0020439436838345626,3,236,0.6459164016247988,0.00028870394771653835,191.4079527701101,COMPLETE
1817,0.3339598774909973,2023-09-04 22:17:19.786169,2023-09-04 22:17:21.456834,0 days 00:00:01.670665,ReLU,Leaky,Leaky,,42,20,9.0,20.0,,0.00273450791845752,3,197,0.7073524310472133,0.0011848866431940187,323.4083015688004,COMPLETE
1818,0.2551586627960205,2023-09-04 22:17:21.457895,2023-09-04 22:17:23.950760,0 days 00:00:02.492865,ReLU,Tanh,Tanh,,33,19,21.0,11.0,,0.006949895679156602,3,186,0.7706668149880992,6.896182847185134e-05,173.1206141291438,COMPLETE
1819,0.34498724341392517,2023-09-04 22:17:23.951842,2023-09-04 22:17:25.077161,0 days 00:00:01.125319,ReLU,Leaky,ReLU,ReLU,52,23,23.0,18.0,7.0,0.003364569140657461,4,214,0.1850056201988308,1.9149970680915034e-05,129.72703008940726,COMPLETE
1820,0.5241776704788208,2023-09-04 22:17:25.078249,2023-09-04 22:17:25.604069,0 days 00:00:00.525820,ReLU,Leaky,Leaky,,39,22,22.0,7.0,,0.009500793552178628,3,168,0.10615529035679418,2.4951144512656767e-05,163.9138150215149,COMPLETE
1821,0.8749580383300781,2023-09-04 22:17:25.605149,2023-09-04 22:17:32.531806,0 days 00:00:06.926657,Sigmoid,Tanh,Sigmoid,,35,21,21.0,23.0,,2.2292502525143503e-05,3,205,0.433792898934064,9.949732333620205e-05,109.09070345250572,COMPLETE
1822,0.303631067276001,2023-09-04 22:17:32.532875,2023-09-04 22:17:35.544688,0 days 00:00:03.011813,ReLU,Leaky,Leaky,,28,18,19.0,9.0,,0.011905989841082015,3,225,0.7315450007771439,0.00022617050639791526,211.4437671661377,COMPLETE
1823,0.45615625381469727,2023-09-04 22:17:35.545733,2023-09-04 22:17:36.472552,0 days 00:00:00.926819,ReLU,Leaky,Leaky,Leaky,37,24,22.0,22.0,18.0,0.016753381050439616,4,77,0.29224044011138584,0.00016198321230961166,173.6340649922689,COMPLETE
1824,0.9627476334571838,2023-09-04 22:17:36.473611,2023-09-04 22:17:40.612355,0 days 00:00:04.138744,ReLU,Leaky,ReLU,,46,20,21.0,6.0,,1.8271056444811012e-05,3,97,0.6691685497860735,0.0016293735538688203,129.63238234372483,COMPLETE
1825,0.6438201069831848,2023-09-04 22:17:40.613438,2023-09-04 22:17:53.226702,0 days 00:00:12.613264,Sigmoid,Tanh,Leaky,,30,19,22.0,8.0,,4.721092518431291e-05,3,182,0.7999405729308097,1.345416606354191e-05,170.720831147917,COMPLETE
1826,0.4185040295124054,2023-09-04 22:17:53.227758,2023-09-04 22:17:55.866905,0 days 00:00:02.639147,ReLU,Leaky,Tanh,,32,21,11.0,19.0,,0.0005095923836298449,3,141,0.2005215463525097,5.6494020886189416e-05,208.28231881865372,COMPLETE
1827,0.3070945739746094,2023-09-04 22:17:55.867966,2023-09-04 22:18:01.427188,0 days 00:00:05.559222,ReLU,ReLU,Leaky,,35,19,20.0,9.0,,0.0017132825406437112,3,244,0.7460161243879593,0.00990698547355556,29982.845530634342,COMPLETE
1828,0.6175450086593628,2023-09-04 22:18:01.428245,2023-09-04 22:18:06.484074,0 days 00:00:05.055829,Leaky,Leaky,Sigmoid,,42,18,18.0,10.0,,3.375665119868779e-05,3,196,0.36956065519353803,0.004830473643480337,151.5651312069017,COMPLETE
1829,0.6031203866004944,2023-09-04 22:18:06.485128,2023-09-04 22:18:07.531194,0 days 00:00:01.046066,ReLU,Sigmoid,ReLU,Leaky,40,20,23.0,15.0,5.0,0.00497340981598962,4,210,0.12393104677049264,0.00011649633378101036,156.86879559220938,COMPLETE
1830,0.34509432315826416,2023-09-04 22:18:07.532249,2023-09-04 22:18:09.309586,0 days 00:00:01.777337,ReLU,Tanh,Leaky,,33,22,20.0,8.0,,0.007807430705500535,3,279,0.3142002080078701,0.0004219919152878017,133.55037778218588,COMPLETE
1831,0.4860851466655731,2023-09-04 22:18:09.310634,2023-09-04 22:18:11.245426,0 days 00:00:01.934792,Sigmoid,Leaky,Leaky,,38,17,10.0,12.0,,0.003878135167725745,3,189,0.1330213618928139,3.148092779259329e-05,271.08450454437804,COMPLETE
1832,0.6086859107017517,2023-09-04 22:18:11.246488,2023-09-04 22:18:16.363978,0 days 00:00:05.117490,ReLU,Leaky,Tanh,,36,21,21.0,21.0,,3.076103912118469e-05,3,265,0.2326703972091017,0.0008881365526538303,178.577563562933,COMPLETE
1833,0.3227156400680542,2023-09-04 22:18:16.365031,2023-09-04 22:18:21.273842,0 days 00:00:04.908811,ReLU,Leaky,Leaky,,31,20,19.0,23.0,,0.0009626978649896322,3,235,0.4203702022023511,0.0038564783296923546,345.51780157378226,COMPLETE
1834,0.5978606343269348,2023-09-04 22:18:21.274898,2023-09-04 22:18:22.272274,0 days 00:00:00.997376,Tanh,Tanh,ReLU,Sigmoid,29,19,23.0,22.0,9.0,0.0012846931872618427,4,202,0.1150075142445487,4.3012426811321584e-05,212.28775988884692,COMPLETE
1835,0.35193347930908203,2023-09-04 22:18:22.273355,2023-09-04 22:18:24.404414,0 days 00:00:02.131059,ReLU,Leaky,Sigmoid,,44,18,22.0,14.0,,0.0026280876440538028,3,176,0.4757785117438554,0.00019439610083017217,177.83306835543723,COMPLETE
1836,0.41988205909729004,2023-09-04 22:18:24.405538,2023-09-04 22:18:26.988051,0 days 00:00:02.582513,Sigmoid,Leaky,Leaky,,27,19,21.0,8.0,,0.014282207863424622,3,223,0.25280803057776663,0.0020337957669807785,318.73884016744205,COMPLETE
1837,0.32418644428253174,2023-09-04 22:18:26.989106,2023-09-04 22:18:28.841821,0 days 00:00:01.852715,ReLU,Tanh,Leaky,,34,21,20.0,7.0,,0.009579156096775449,3,162,0.5583140434864623,9.028837268975906e-05,212.3158598203917,COMPLETE
1838,0.348719984292984,2023-09-04 22:18:28.842855,2023-09-04 22:18:31.457977,0 days 00:00:02.615122,ReLU,Leaky,,,41,20,17.0,,,0.003257157186113742,2,214,0.7004801186492726,0.00014231727583544066,239.06892887238533,COMPLETE
1839,0.5287245512008667,2023-09-04 22:18:31.459164,2023-09-04 22:18:50.854855,0 days 00:00:19.395691,ReLU,Leaky,ReLU,ReLU,38,23,22.0,9.0,21.0,7.289585396222115e-05,4,299,0.7686883149536072,0.0003012274853726742,150.8630220547169,COMPLETE
1840,0.34689220786094666,2023-09-04 22:18:50.855915,2023-09-04 22:18:54.649848,0 days 00:00:03.793933,Sigmoid,ReLU,Leaky,,57,17,23.0,10.0,,0.002101337949395174,3,195,0.7241374252951599,1.2033736135421185e-05,154.87706789057304,COMPLETE
1841,0.3273821473121643,2023-09-04 22:18:54.650944,2023-09-04 22:18:57.262628,0 days 00:00:02.611684,ReLU,Leaky,Tanh,,32,20,19.0,23.0,,0.011335957953991564,3,151,0.7998101430455502,0.0006501387862779364,146.94719378153482,COMPLETE
1842,0.42635083198547363,2023-09-04 22:18:57.263691,2023-09-04 22:18:58.308903,0 days 00:00:01.045212,ReLU,Tanh,Leaky,,25,21,21.0,8.0,,0.005700693956895721,3,59,0.15599238593386772,2.424349618337066e-05,223.51228166663128,COMPLETE
1843,0.5255454778671265,2023-09-04 22:18:58.309945,2023-09-04 22:18:58.886831,0 days 00:00:00.576886,ReLU,Sigmoid,Sigmoid,,36,16,20.0,21.0,,0.07447453930399033,3,228,0.100084539608179,0.0010399169074290927,173.83231735229492,COMPLETE
1844,0.5408128499984741,2023-09-04 22:18:58.887913,2023-09-04 22:19:16.363376,0 days 00:00:17.475463,ReLU,Leaky,Leaky,Leaky,34,18,15.0,17.0,3.0,2.231947459451316e-05,4,255,0.7525716276856731,1.5997535747631706e-05,315.46245966892616,COMPLETE
1845,0.5034306645393372,2023-09-04 22:19:16.364446,2023-09-04 22:19:17.844311,0 days 00:00:01.479865,Sigmoid,Leaky,ReLU,,30,19,6.0,7.0,,0.03598726461700854,3,206,0.19707040841231008,0.002672946062152522,157.64450073242188,COMPLETE
1846,0.36390650272369385,2023-09-04 22:19:17.845366,2023-09-04 22:19:28.451116,0 days 00:00:10.605750,ReLU,Tanh,Leaky,,40,22,22.0,22.0,,0.0004484942538371385,3,173,0.7998134100687854,0.04553698117252241,190.74986532888104,COMPLETE
1847,0.46595892310142517,2023-09-04 22:19:28.452178,2023-09-04 22:19:32.141028,0 days 00:00:03.688850,ReLU,Leaky,Tanh,,55,18,10.0,18.0,,0.0002983722392059759,3,186,0.3498876574389407,0.017053117678144502,986.0852825205814,COMPLETE
1848,0.28482306003570557,2023-09-04 22:19:32.142075,2023-09-04 22:19:34.048328,0 days 00:00:01.906253,ReLU,Leaky,Leaky,,47,19,9.0,9.0,,0.017228637901237617,3,218,0.6909834226669557,0.0013468752404425634,138.9035871552258,COMPLETE
1849,0.38381263613700867,2023-09-04 22:19:34.049397,2023-09-04 22:19:39.071637,0 days 00:00:05.022240,Sigmoid,Leaky,ReLU,Leaky,32,20,21.0,22.0,4.0,0.004232342929444388,4,71,0.6145188314565093,0.0005097510983010491,218.52146266883528,COMPLETE
1850,0.6074739694595337,2023-09-04 22:19:39.072732,2023-09-04 22:19:41.265417,0 days 00:00:02.192685,ReLU,Tanh,Sigmoid,,28,21,18.0,20.0,,0.0016254645909153786,3,239,0.7693635756601801,0.01228626119159506,356.0253475734166,COMPLETE
