number,value,datetime_start,datetime_complete,duration,params_activation1,params_activation2,params_activation3,params_activation4,params_batch_size,params_fl1,params_fl2,params_fl3,params_fl4,params_learning_rate,params_n_layers,params_num_epochs,params_train_size,params_weight_decay,user_attrs_mre,state
1035,0.29794150590896606,2023-09-04 21:51:14.542594,2023-09-04 21:51:15.487986,0 days 00:00:00.945392,Tanh,Leaky,Leaky,,27,11,15.0,9.0,,0.011700708303845538,3,371,0.6710328133052347,1.2918818520911571e-05,98.30840887025346,COMPLETE
1036,0.3547724187374115,2023-09-04 21:51:15.488430,2023-09-04 21:51:18.778367,0 days 00:00:03.289937,Tanh,Leaky,,,22,13,11.0,,,0.0006105242088060682,2,359,0.799486270312078,7.806222698848454e-05,105.89535766839981,COMPLETE
1037,0.3270694613456726,2023-09-04 21:51:18.778797,2023-09-04 21:51:19.707192,0 days 00:00:00.928395,ReLU,Leaky,Leaky,,30,11,13.0,14.0,,0.01709676470375271,3,384,0.7335707879285546,8.962233855114159e-05,146.67241986592612,COMPLETE
1038,0.3586618900299072,2023-09-04 21:51:19.707940,2023-09-04 21:51:20.799462,0 days 00:00:01.091522,Tanh,Leaky,Leaky,,24,14,17.0,6.0,,0.006825182807470162,3,341,0.6327107348635943,0.002207476227417955,107.84487704013256,COMPLETE
1039,0.3216925859451294,2023-09-04 21:51:20.799882,2023-09-04 21:51:29.255878,0 days 00:00:08.455996,Tanh,Leaky,,,15,12,16.0,,,0.0002662400113491398,2,427,0.6909708973284757,2.8089567333191935e-05,110.43379167620645,COMPLETE
1040,0.4719504117965698,2023-09-04 21:51:29.256280,2023-09-04 21:51:29.529284,0 days 00:00:00.273004,Sigmoid,Leaky,Leaky,,18,10,18.0,13.0,,0.023229004817976462,3,328,0.2796073023101288,0.016346435215827456,135.0904459953308,COMPLETE
1041,0.4096774160861969,2023-09-04 21:51:29.529696,2023-09-04 21:51:29.912409,0 days 00:00:00.382713,Tanh,Leaky,Leaky,,58,12,14.0,15.0,,0.03526298454499007,3,254,0.4874521537154821,0.039786368636255745,121.33139532965583,COMPLETE
1042,0.35978737473487854,2023-09-04 21:51:29.912821,2023-09-04 21:51:31.647791,0 days 00:00:01.734970,ReLU,Leaky,,,26,9,16.0,,,0.0009423472573928891,2,377,0.5207409533974455,0.00017300367963795455,402.13343330443377,COMPLETE
1043,0.31882306933403015,2023-09-04 21:51:31.648251,2023-09-04 21:51:36.277791,0 days 00:00:04.629540,Tanh,Sigmoid,Leaky,,28,23,17.0,16.0,,0.001965669587933563,3,416,0.7483651429472354,0.00024888470139872073,104.86031534974005,COMPLETE
1044,0.324970543384552,2023-09-04 21:51:36.278560,2023-09-04 21:51:38.712718,0 days 00:00:02.434158,Tanh,,,,22,11,,,,0.010898168561056307,1,353,0.7664653857816045,0.0001228459271228821,100.89697303146612,COMPLETE
1045,0.33081480860710144,2023-09-04 21:51:38.713234,2023-09-04 21:51:40.766901,0 days 00:00:02.053667,Tanh,Leaky,,,35,12,15.0,,,0.0012224786937326435,2,367,0.7125568662655262,0.00047730837386010137,94.96742366387592,COMPLETE
1046,0.3329879343509674,2023-09-04 21:51:40.767298,2023-09-04 21:51:41.154505,0 days 00:00:00.387207,ReLU,Leaky,Leaky,,25,11,12.0,3.0,,0.015909658649087714,3,437,0.4252082586698204,2.0797682056250384e-05,112.15457219662873,COMPLETE
1047,0.4256657660007477,2023-09-04 21:51:41.154924,2023-09-04 21:51:41.908924,0 days 00:00:00.754000,Tanh,Sigmoid,Tanh,,20,13,16.0,14.0,,0.0007521080024552306,3,392,0.12510083331970595,0.0028766175099331683,212.6433630136343,COMPLETE
1048,0.3409271538257599,2023-09-04 21:51:41.909352,2023-09-04 21:51:42.497455,0 days 00:00:00.588103,Tanh,Leaky,Leaky,,32,11,15.0,12.0,,0.0034119080105976477,3,400,0.31512211826005865,4.469029013388159e-05,186.45062611897785,COMPLETE
1049,0.43856140971183777,2023-09-04 21:51:42.497889,2023-09-04 21:51:47.685644,0 days 00:00:05.187755,Tanh,Leaky,,,47,24,17.0,,,2.687438874528031e-05,2,406,0.799604760603592,0.0006905725252532739,102.25345739439213,COMPLETE
1050,0.8088799715042114,2023-09-04 21:51:47.686071,2023-09-04 21:51:50.209431,0 days 00:00:02.523360,ReLU,ReLU,Leaky,,12,10,16.0,15.0,,2.1914569983939215e-05,3,360,0.10874987488397558,5.596453564642493e-05,97.88061981201172,COMPLETE
1051,0.34147292375564575,2023-09-04 21:51:50.209859,2023-09-04 21:51:51.196580,0 days 00:00:00.986721,Leaky,Leaky,Leaky,,29,22,14.0,10.0,,0.008974110934357106,3,346,0.5685905412493722,0.0013214983079958746,100.42231013857085,COMPLETE
1052,0.38516637682914734,2023-09-04 21:51:51.197009,2023-09-04 21:52:02.366862,0 days 00:00:11.169853,Tanh,Sigmoid,,,16,12,18.0,,,0.00038986871405548626,2,384,0.6613773731469251,0.004164958267901747,116.74732473404681,COMPLETE
1053,0.9964855313301086,2023-09-04 21:52:02.367599,2023-09-04 21:52:04.243084,0 days 00:00:01.875485,Tanh,Leaky,Sigmoid,,23,12,13.0,4.0,,0.019417263703338468,3,370,0.737722541937498,0.06540605039049766,100.22623564067639,COMPLETE
1054,0.37576961517333984,2023-09-04 21:52:04.243864,2023-09-04 21:52:09.977390,0 days 00:00:05.733526,Tanh,Leaky,,,18,10,15.0,,,0.002421257907027106,2,325,0.7027888090637796,1.1626724763169503e-05,94.20261513559441,COMPLETE
1055,0.3358158767223358,2023-09-04 21:52:09.978145,2023-09-04 21:52:11.763582,0 days 00:00:01.785437,ReLU,Sigmoid,Leaky,,21,11,17.0,9.0,,0.005480079558425278,3,352,0.29953850573395957,0.005231252837252274,813.6393518862517,COMPLETE
1056,0.3336789011955261,2023-09-04 21:52:11.764359,2023-09-04 21:52:13.095647,0 days 00:00:01.331288,Tanh,Leaky,Leaky,,26,12,16.0,8.0,,0.09577776748379709,3,417,0.7689767535036993,0.00015464907198498926,98.80104303359985,COMPLETE
1057,0.30881738662719727,2023-09-04 21:52:13.096426,2023-09-04 21:52:14.433140,0 days 00:00:01.336714,Tanh,Tanh,,,24,11,17.0,,,0.02979475800006827,2,296,0.5995911465765584,0.00034750499450973704,116.20204385121663,COMPLETE
1058,0.40666890144348145,2023-09-04 21:52:14.433891,2023-09-04 21:52:15.151681,0 days 00:00:00.717790,ReLU,Leaky,Leaky,,28,13,15.0,13.0,,0.013697885477185328,3,379,0.3785064350996724,0.01812394634243704,102.80978012084961,COMPLETE
1059,0.62538743019104,2023-09-04 21:52:15.152455,2023-09-04 21:52:27.704967,0 days 00:00:12.552512,Tanh,Sigmoid,Leaky,,19,10,18.0,5.0,,1.3642466932416405e-05,3,454,0.21469309432899614,0.00028139245888678105,103.08757951711243,COMPLETE
1060,0.36046335101127625,2023-09-04 21:52:27.705755,2023-09-04 21:52:41.874530,0 days 00:00:14.168775,Tanh,Leaky,,,51,11,14.0,,,9.979302178148942e-05,2,430,0.7250145960979608,0.001796736118378254,116.75367369540902,COMPLETE
1061,0.4071659445762634,2023-09-04 21:52:41.875281,2023-09-04 21:52:42.735334,0 days 00:00:00.860053,Tanh,Leaky,Tanh,,22,9,17.0,12.0,,0.0078809912672869,3,341,0.14585023486600535,0.00019021101189848033,129.92594760801734,COMPLETE
1062,0.39461877942085266,2023-09-04 21:52:42.736103,2023-09-04 21:52:49.525322,0 days 00:00:06.789219,ReLU,Leaky,Leaky,,31,11,15.0,17.0,,0.0005088050647029759,3,391,0.6788399337685272,0.07028451428602729,101.62300218854632,COMPLETE
1063,0.34104040265083313,2023-09-04 21:52:49.526094,2023-09-04 21:52:52.159685,0 days 00:00:02.633591,Tanh,Sigmoid,,,26,12,16.0,,,0.004352843443951785,2,364,0.7658183430346144,0.0005892777027478822,90.66935076032367,COMPLETE
1064,0.4609293043613434,2023-09-04 21:52:52.160437,2023-09-04 21:52:54.863847,0 days 00:00:02.703410,Sigmoid,Leaky,Leaky,,14,1,16.0,14.0,,0.012554042623534566,3,403,0.7466355672200765,0.00011221115321909271,95.71272314162482,COMPLETE
1065,0.34189674258232117,2023-09-04 21:52:54.864625,2023-09-04 21:53:11.586410,0 days 00:00:16.721785,Tanh,Leaky,,,24,12,18.0,,,0.00018250508341154792,2,356,0.629098534258867,0.00023077304917948983,123.68418942039321,COMPLETE
1066,0.3353327214717865,2023-09-04 21:53:11.587159,2023-09-04 21:53:12.882073,0 days 00:00:01.294914,Tanh,Sigmoid,Leaky,,40,11,16.0,6.0,,0.0807252268612271,3,336,0.7033585023206672,1.7702313344926796e-05,95.18403180440266,COMPLETE
1067,0.9302136898040771,2023-09-04 21:53:12.882845,2023-09-04 21:53:19.639399,0 days 00:00:06.756554,ReLU,Leaky,Leaky,,20,10,13.0,18.0,,1.7277401816943905e-05,3,374,0.14087201157807483,0.00703158007596265,108.07995709505948,COMPLETE
1068,0.4073508381843567,2023-09-04 21:53:19.640236,2023-09-04 21:53:19.969866,0 days 00:00:00.329630,Tanh,Leaky,,,30,13,15.0,,,0.055845557699921056,2,385,0.18932454858581685,0.013451283484973516,283.88870708759015,COMPLETE
1069,0.5467067360877991,2023-09-04 21:53:19.970618,2023-09-04 21:53:25.555506,0 days 00:00:05.584888,Tanh,Sigmoid,Leaky,,60,21,11.0,8.0,,2.943686266141915e-05,3,443,0.24117876973508237,6.982146389453626e-05,109.74524562999304,COMPLETE
1070,0.2866255044937134,2023-09-04 21:53:25.556310,2023-09-04 21:54:07.167574,0 days 00:00:41.611264,Tanh,Leaky,Leaky,,17,11,17.0,11.0,,0.0001268612338789801,3,410,0.7758460219677609,2.472981705771568e-05,148.40782840660466,COMPLETE
1071,0.35873356461524963,2023-09-04 21:54:07.168359,2023-09-04 21:54:08.210709,0 days 00:00:01.042350,ReLU,Leaky,,,27,12,18.0,,,0.010292101769864693,2,424,0.3190249079050899,0.011438267214955116,117.81373286891628,COMPLETE
1072,0.34813573956489563,2023-09-04 21:54:08.211469,2023-09-04 21:54:11.629564,0 days 00:00:03.418095,Tanh,Leaky,Leaky,,33,10,14.0,24.0,,0.006644266609420504,3,265,0.7335734751699353,0.027705304609939477,111.54465318159623,COMPLETE
1073,0.43820255994796753,2023-09-04 21:54:11.630370,2023-09-04 21:54:13.376728,0 days 00:00:01.746358,Tanh,Sigmoid,Tanh,,23,23,17.0,7.0,,0.001245903314128754,3,349,0.16040717049867795,3.6545577989512774e-05,114.61516869205168,COMPLETE
1074,0.42742234468460083,2023-09-04 21:54:13.377516,2023-09-04 21:54:15.618290,0 days 00:00:02.240774,Leaky,ReLU,,,21,11,6.0,,,0.015801338649853423,2,363,0.7726415805428579,9.282696731952976e-05,103.6590549863618,COMPLETE
1075,0.335455983877182,2023-09-04 21:54:15.619057,2023-09-04 21:54:41.414479,0 days 00:00:25.795422,Tanh,Leaky,Leaky,,25,15,12.0,14.0,,8.186784225267646e-05,3,397,0.6663118082392909,0.005539367403957849,114.92393870317666,COMPLETE
1076,0.3425182104110718,2023-09-04 21:54:41.415248,2023-09-04 21:54:43.051176,0 days 00:00:01.635928,ReLU,Leaky,,,29,22,16.0,,,0.024800965348128208,2,369,0.40367314414165884,0.0011672625043629124,110.16418382233265,COMPLETE
1077,0.31424838304519653,2023-09-04 21:54:43.051964,2023-09-04 21:54:55.886589,0 days 00:00:12.834625,Tanh,Sigmoid,Sigmoid,,16,12,15.0,10.0,,0.0007156190064106777,3,321,0.7192069897234615,0.00013066465135714013,121.70686718700378,COMPLETE
1078,0.38347476720809937,2023-09-04 21:54:55.887373,2023-09-04 21:54:56.893247,0 days 00:00:01.005874,Tanh,Leaky,Leaky,,19,12,18.0,13.0,,0.0016085868541273328,3,434,0.11594992780112834,5.938808581410385e-05,141.42267297815394,COMPLETE
1079,0.44341862201690674,2023-09-04 21:54:56.894025,2023-09-04 21:55:14.991389,0 days 00:00:18.097364,ReLU,Leaky,,,23,10,14.0,,,5.3339195966375965e-05,2,283,0.7419687850018967,3.094022226649742e-05,104.68356493083833,COMPLETE
1080,0.34877365827560425,2023-09-04 21:55:14.992159,2023-09-04 21:55:16.358609,0 days 00:00:01.366450,Tanh,Sigmoid,Leaky,,27,13,16.0,15.0,,0.01883593287008075,3,341,0.3660384316585736,0.0003987113099179119,111.54329659598214,COMPLETE
1081,0.341211199760437,2023-09-04 21:55:16.359385,2023-09-04 21:55:19.420113,0 days 00:00:03.060728,Tanh,Leaky,,,25,11,16.0,,,0.0008532242921216421,2,356,0.3252285070209634,0.0008007566735128775,181.19183828180488,COMPLETE
1082,0.3189425766468048,2023-09-04 21:55:19.420877,2023-09-04 21:55:20.721395,0 days 00:00:01.300518,Tanh,Tanh,Leaky,,21,11,17.0,24.0,,0.04264178998043675,3,419,0.5441990202930941,4.529132595164748e-05,124.59549713134766,COMPLETE
1083,0.33902502059936523,2023-09-04 21:55:20.722171,2023-09-04 21:55:29.456600,0 days 00:00:08.734429,ReLU,Leaky,Leaky,,28,12,15.0,4.0,,0.001067730063660919,3,385,0.6908984155826196,0.0001798459196213649,101.05452409027316,COMPLETE
1084,0.3469257056713104,2023-09-04 21:55:29.457368,2023-09-04 21:55:33.526051,0 days 00:00:04.068683,Tanh,Leaky,Leaky,,10,14,12.0,21.0,,0.011053033625496455,3,374,0.41487319902687303,1.0484402705693517e-05,97.40000552222843,COMPLETE
1085,0.41246896982192993,2023-09-04 21:55:33.526835,2023-09-04 21:55:34.877519,0 days 00:00:01.350684,Tanh,Sigmoid,,,18,8,17.0,,,0.014475035621429093,2,394,0.2880093133789429,7.928810123995495e-05,121.08509865785257,COMPLETE
1086,0.37311744689941406,2023-09-04 21:55:34.878294,2023-09-04 21:55:37.013842,0 days 00:00:02.135548,Tanh,Leaky,Tanh,,31,11,19.0,16.0,,0.008211501942948724,3,405,0.7765394514443362,0.002344252862903788,92.26801275437877,COMPLETE
1087,0.3960288166999817,2023-09-04 21:55:37.014626,2023-09-04 21:55:45.838848,0 days 00:00:08.824222,ReLU,Leaky,Leaky,,55,9,15.0,1.0,,0.000620359147311009,3,348,0.7999556493908174,0.000291580708665385,123.0464794176845,COMPLETE
1088,0.3462877571582794,2023-09-04 21:55:45.839648,2023-09-04 21:55:48.274462,0 days 00:00:02.434814,Tanh,Sigmoid,,,25,12,17.0,,,0.00951076040974207,2,358,0.7499109324245242,0.0034068887620595074,109.47318006816663,COMPLETE
1089,0.3618510067462921,2023-09-04 21:55:48.275247,2023-09-04 21:55:49.378438,0 days 00:00:01.103191,Tanh,Leaky,Leaky,,23,10,18.0,9.0,,0.002204240014416537,3,335,0.2676872984983646,0.0001463898315068897,133.34140300750732,COMPLETE
1090,0.29463449120521545,2023-09-04 21:55:49.379223,2023-09-04 21:55:54.036821,0 days 00:00:04.657598,Sigmoid,Leaky,,,21,11,16.0,,,0.012426736413447624,2,314,0.6542451119325938,0.0002152998777218123,99.90860260009765,COMPLETE
1091,0.3829384744167328,2023-09-04 21:55:54.037589,2023-09-04 21:56:08.226500,0 days 00:00:14.188911,Tanh,Sigmoid,Leaky,,34,22,14.0,13.0,,0.0003260946191696799,3,365,0.7105415359705424,0.0005522462609272772,119.9860616830679,COMPLETE
1092,0.39699164032936096,2023-09-04 21:56:08.227295,2023-09-04 21:56:27.011870,0 days 00:00:18.784575,ReLU,Leaky,Leaky,,14,24,15.0,7.0,,0.00021180928164526327,3,382,0.5076362510194511,0.056966742519086525,135.66760121859036,COMPLETE
1093,0.31196868419647217,2023-09-04 21:56:27.012669,2023-09-04 21:56:29.666116,0 days 00:00:02.653447,Tanh,Leaky,,,29,13,17.0,,,0.0030086567944672426,2,415,0.5845113252118245,0.00011672958742777225,88.18958645179623,COMPLETE
1094,0.3069467842578888,2023-09-04 21:56:29.666896,2023-09-04 21:56:32.560689,0 days 00:00:02.893793,Tanh,Leaky,Leaky,,27,9,13.0,6.0,,0.01985943068389868,3,450,0.7544334237445915,2.3248503583899443e-05,90.3281234741211,COMPLETE
1095,0.32290947437286377,2023-09-04 21:56:32.561465,2023-09-04 21:56:56.041197,0 days 00:00:23.479732,Tanh,Sigmoid,Leaky,,19,12,18.0,2.0,,0.0004653974878627302,3,434,0.7987746812619482,0.0010140857726745353,94.86019638837394,COMPLETE
1096,0.35747015476226807,2023-09-04 21:56:56.041981,2023-09-04 21:57:24.257563,0 days 00:00:28.215582,ReLU,Leaky,,,16,12,16.0,,,0.00016165811002011817,2,376,0.6796358391038726,0.0017452966054068385,119.00046748952893,COMPLETE
1097,0.40936681628227234,2023-09-04 21:57:24.258330,2023-09-04 21:57:24.824071,0 days 00:00:00.565741,Tanh,Leaky,Leaky,,23,11,17.0,20.0,,0.034524808317036984,3,329,0.180352528553376,0.00024200539445360167,110.41883127312911,COMPLETE
1098,0.3825744390487671,2023-09-04 21:57:24.824860,2023-09-04 21:57:25.936909,0 days 00:00:01.112049,Tanh,ReLU,Tanh,,26,10,16.0,14.0,,0.016329253668172256,3,393,0.3632345127708797,0.015413054841008543,106.6311343157733,COMPLETE
1099,0.35802772641181946,2023-09-04 21:57:25.937709,2023-09-04 21:57:28.467157,0 days 00:00:02.529448,ReLU,Sigmoid,,,22,10,15.0,,,0.027574157877799776,2,345,0.7257874753995049,0.0004632776712356282,121.69567066914327,COMPLETE
1100,0.32559970021247864,2023-09-04 21:57:28.467938,2023-09-04 21:57:31.228254,0 days 00:00:02.760316,Leaky,Leaky,Sigmoid,,31,13,15.0,23.0,,0.005965194301399541,3,354,0.6252606083867734,9.899613213382789e-05,97.11517513499541,COMPLETE
1101,0.38498467206954956,2023-09-04 21:57:31.229049,2023-09-04 21:57:33.915986,0 days 00:00:02.686937,Tanh,Leaky,Leaky,,20,12,19.0,11.0,,0.001346710813581178,3,407,0.2465658228318871,0.0003274957722960038,113.74970415900735,COMPLETE
1102,0.436489462852478,2023-09-04 21:57:33.916776,2023-09-04 21:57:46.962678,0 days 00:00:13.045902,Tanh,,,,25,17,,,,3.4843425999786375e-05,1,274,0.7646148219177772,0.00016731746379864342,97.60278311959148,COMPLETE
1103,0.41959965229034424,2023-09-04 21:57:46.963436,2023-09-04 21:58:18.607091,0 days 00:00:31.643655,Tanh,Sigmoid,,,18,11,17.0,,,4.0706927922629915e-05,2,428,0.6992518825451745,3.733273195841757e-05,124.20692730841236,COMPLETE
1104,0.45780161023139954,2023-09-04 21:58:18.607867,2023-09-04 21:58:24.307027,0 days 00:00:05.699160,ReLU,Leaky,Leaky,,29,20,18.0,5.0,,4.880430988457336e-05,3,366,0.16144753620117144,5.773702621426818e-05,109.89529848359322,COMPLETE
1105,0.348218709230423,2023-09-04 21:58:24.307816,2023-09-04 21:58:26.405888,0 days 00:00:02.098072,Tanh,Leaky,,,24,21,14.0,,,0.0017904598306233734,2,248,0.4401617978509482,2.9629882315264585e-05,258.3145469809478,COMPLETE
1106,0.31404197216033936,2023-09-04 21:58:26.406707,2023-09-04 21:58:29.005522,0 days 00:00:02.598815,Tanh,Leaky,Leaky,,27,12,16.0,24.0,,0.004460469610951895,3,387,0.4492674416853281,0.0001989294098795115,101.83331219903354,COMPLETE
1107,0.3561449348926544,2023-09-04 21:58:29.006312,2023-09-04 21:58:29.989012,0 days 00:00:00.982700,Tanh,Tanh,Leaky,,37,11,17.0,12.0,,0.022290239146393862,3,258,0.34377242175590556,0.0015066270366333144,108.82515549659729,COMPLETE
1108,0.3258545994758606,2023-09-04 21:58:29.989810,2023-09-04 21:58:34.024605,0 days 00:00:04.034795,ReLU,Sigmoid,,,21,23,15.0,,,0.007213770419969317,2,343,0.7987358956692887,4.886240481255454e-05,111.45167042658879,COMPLETE
1109,0.31310775876045227,2023-09-04 21:58:34.025840,2023-09-04 21:58:37.111609,0 days 00:00:03.085769,Tanh,Leaky,Leaky,,13,11,16.0,3.0,,0.011212541680299564,3,106,0.7402051677446034,0.00013680124080203582,108.2430648803711,COMPLETE
1110,0.35127881169319153,2023-09-04 21:58:37.113467,2023-09-04 21:58:39.223413,0 days 00:00:02.109946,Tanh,Leaky,,,33,11,13.0,,,0.001008594284015629,2,302,0.22740421901776842,0.008868788935511187,119.7718962449294,COMPLETE
1111,0.4147492051124573,2023-09-04 21:58:39.224271,2023-09-04 21:58:57.278240,0 days 00:00:18.053969,Tanh,Sigmoid,Leaky,,23,12,14.0,15.0,,0.00012226616421339093,3,235,0.7131258283878279,0.0026968334701316828,129.03235213908744,COMPLETE
1112,0.3382250666618347,2023-09-04 21:58:57.279130,2023-09-04 21:59:02.300468,0 days 00:00:05.021338,ReLU,Leaky,Leaky,,16,10,12.0,8.0,,0.014272375718260573,3,376,0.6438508588699678,0.0007123249165929857,104.24344840416542,COMPLETE
1113,0.3463476300239563,2023-09-04 21:59:02.301334,2023-09-04 21:59:14.975471,0 days 00:00:12.674137,Tanh,Leaky,,,18,13,16.0,,,0.00024798536641763684,2,399,0.47967128861633435,0.0002705079596167811,103.76912924913856,COMPLETE
1114,0.3553074896335602,2023-09-04 21:59:14.976262,2023-09-04 21:59:19.292037,0 days 00:00:04.315775,Sigmoid,Sigmoid,Tanh,,25,12,18.0,10.0,,0.008876218569522788,3,420,0.7688997186965152,7.029618872599293e-05,115.89745566628196,COMPLETE
1115,0.41775017976760864,2023-09-04 21:59:19.292844,2023-09-04 21:59:20.175237,0 days 00:00:00.882393,Tanh,Leaky,Leaky,,20,9,17.0,13.0,,0.005443880500031026,3,443,0.15463731961349164,0.00010137480944888895,123.97540219624837,COMPLETE
1116,0.326128214597702,2023-09-04 21:59:20.176069,2023-09-04 21:59:32.732218,0 days 00:00:12.556149,Tanh,Leaky,,,28,10,15.0,,,0.0003735773603260179,2,358,0.47418377666030875,0.00040203332182339144,108.37477751151144,COMPLETE
1117,0.4151448607444763,2023-09-04 21:59:32.733017,2023-09-04 21:59:33.339523,0 days 00:00:00.606506,ReLU,Leaky,Leaky,,30,11,19.0,23.0,,0.012413962969882193,3,410,0.1734272621229828,4.210306784727429e-05,103.23408197473597,COMPLETE
1118,0.31802669167518616,2023-09-04 21:59:33.340376,2023-09-04 21:59:39.052268,0 days 00:00:05.711892,Tanh,Sigmoid,Leaky,,22,16,18.0,19.0,,0.0034521055690919216,3,368,0.7482157144165295,0.006412631480355782,146.95123427661497,COMPLETE
1119,0.33644619584083557,2023-09-04 21:59:39.053075,2023-09-04 21:59:40.880291,0 days 00:00:01.827216,Tanh,Leaky,,,26,12,9.0,,,0.01857028641594947,2,335,0.6781762022282983,1.5159235083788573e-05,93.62072306665881,COMPLETE
1120,0.34994760155677795,2023-09-04 21:59:40.881085,2023-09-04 21:59:43.380039,0 days 00:00:02.498954,ReLU,Leaky,Leaky,,32,13,16.0,24.0,,0.0008003024720225074,3,352,0.2616920536358228,0.004390997793287935,291.8577768537733,COMPLETE
1121,0.42306438088417053,2023-09-04 21:59:43.380849,2023-09-04 22:00:07.144847,0 days 00:00:23.763998,Tanh,Sigmoid,,,24,11,17.0,,,9.86605929265593e-05,2,392,0.7230351379668359,2.069952980185702e-05,125.98093108741604,COMPLETE
1122,0.3248823285102844,2023-09-04 22:00:07.145377,2023-09-04 22:00:12.933161,0 days 00:00:05.787784,Tanh,Leaky,Leaky,,17,12,15.0,16.0,,0.00030442788417237607,3,380,0.5455144298634733,8.719709390842357e-05,142.09658308334002,COMPLETE
1123,0.3954092264175415,2023-09-04 22:00:12.933890,2023-09-04 22:00:14.328263,0 days 00:00:01.394373,Leaky,ReLU,Sigmoid,,22,23,16.0,12.0,,0.0014717769004482782,3,364,0.6037734118447394,0.05168664305358777,96.38898483587771,COMPLETE
1124,0.410540372133255,2023-09-04 22:00:14.329672,2023-09-04 22:00:14.583966,0 days 00:00:00.254294,Tanh,Leaky,,,100,19,15.0,,,0.009812309099757006,2,327,0.10051514029028262,0.0002075309208220763,258.33810609759706,COMPLETE
1125,0.4233047664165497,2023-09-04 22:00:14.584700,2023-09-04 22:00:15.438307,0 days 00:00:00.853607,ReLU,Sigmoid,Leaky,,27,10,17.0,14.0,,0.002385913551037,3,218,0.1901314909267775,0.002009292892170751,107.16804851185192,COMPLETE
1126,0.3629525601863861,2023-09-04 22:00:15.439316,2023-09-04 22:00:16.364111,0 days 00:00:00.924795,Tanh,Leaky,Leaky,,20,11,11.0,9.0,,0.046671295248638674,3,348,0.34067220077620114,0.0001574193728353369,134.8416037126021,COMPLETE
1127,0.3205138146877289,2023-09-04 22:00:16.366432,2023-09-04 22:00:28.426513,0 days 00:00:12.060081,Tanh,Leaky,,,35,12,14.0,,,0.000548841242548391,2,417,0.7992024994717744,0.0003147312655084854,117.16343780635863,COMPLETE
1128,0.3172830641269684,2023-09-04 22:00:28.431966,2023-09-04 22:00:29.237495,0 days 00:00:00.805529,Tanh,Leaky,Tanh,,30,10,16.0,6.0,,0.027244457154585115,3,424,0.7696706085629311,2.7276838251027047e-05,99.43989038467407,COMPLETE
