number,value,datetime_start,datetime_complete,duration,params_activation1,params_activation2,params_activation3,params_activation4,params_batch_size,params_fl1,params_fl2,params_fl3,params_fl4,params_learning_rate,params_n_layers,params_num_epochs,params_train_size,params_weight_decay,user_attrs_mre,state
1223,0.4328361749649048,2023-09-04 22:04:49.259235,2023-09-04 22:04:49.787154,0 days 00:00:00.527919,Tanh,Leaky,Leaky,,19,12,16.0,6.0,,0.02009177001724681,3,419,0.30568309738727184,0.033219577133228005,123.4181302388509,COMPLETE
1224,0.506601870059967,2023-09-04 22:04:49.787750,2023-09-04 22:04:52.186142,0 days 00:00:02.398392,ReLU,Sigmoid,,,88,10,15.0,,,5.554814188407165e-05,2,309,0.6004900059255245,0.0016879745045237594,103.20116644306862,COMPLETE
1225,0.32779496908187866,2023-09-04 22:04:52.186663,2023-09-04 22:04:56.439809,0 days 00:00:04.253146,Tanh,Leaky,Leaky,,22,11,17.0,21.0,,0.000499824716305748,3,380,0.5151174633161962,0.0009281296521425378,91.59905190163471,COMPLETE
1226,0.40265214443206787,2023-09-04 22:04:56.440513,2023-09-04 22:04:56.849229,0 days 00:00:00.408716,Tanh,Leaky,,,31,12,18.0,,,0.005400466643523261,2,358,0.17898629275431951,0.0001243586917537156,173.1837167572557,COMPLETE
1227,0.24450358748435974,2023-09-04 22:04:56.849715,2023-09-04 22:04:59.534806,0 days 00:00:02.685091,Tanh,Leaky,Leaky,,17,13,11.0,12.0,,0.012252130854291486,3,334,0.7998560538623095,4.446478303408672e-05,111.73806904637536,COMPLETE
1228,0.28061041235923767,2023-09-04 22:04:59.535649,2023-09-04 22:05:05.216625,0 days 00:00:05.680976,Tanh,Tanh,Leaky,,13,20,12.0,12.0,,0.010042040745665564,3,320,0.7977666339848242,5.557345845436771e-05,97.21636222390568,COMPLETE
1229,0.45852065086364746,2023-09-04 22:05:05.218913,2023-09-04 22:05:06.010608,0 days 00:00:00.791695,ReLU,,,,15,3,,,,0.008033582047065639,1,323,0.16879119518422858,4.857375287982503e-05,439.8678421270652,COMPLETE
1230,0.34924060106277466,2023-09-04 22:05:06.011539,2023-09-04 22:05:07.781619,0 days 00:00:01.770080,Tanh,Sigmoid,Leaky,,16,23,12.0,11.0,,0.011939544403024605,3,330,0.40622059836836466,4.4823490242242385e-05,114.14851044445503,COMPLETE
1231,0.33533480763435364,2023-09-04 22:05:07.785546,2023-09-04 22:05:10.739499,0 days 00:00:02.953953,Tanh,Leaky,,,14,18,13.0,,,0.0020170260122983853,2,296,0.7730038835418104,3.584789817314761e-05,106.09238560994466,COMPLETE
1232,0.284379780292511,2023-09-04 22:05:10.740379,2023-09-04 22:05:13.967417,0 days 00:00:03.227038,Tanh,Leaky,Leaky,,16,14,11.0,11.0,,0.006255591936132166,3,313,0.7730320690660285,3.971312498835018e-05,87.42291320800781,COMPLETE
1233,0.38155096769332886,2023-09-04 22:05:13.968308,2023-09-04 22:05:15.288629,0 days 00:00:01.320321,ReLU,Leaky,,,17,4,11.0,,,0.009721705300181757,2,333,0.20560199325712003,6.168395952669318e-05,112.06669235229492,COMPLETE
1234,0.34679490327835083,2023-09-04 22:05:15.289522,2023-09-04 22:05:19.076616,0 days 00:00:03.787094,Sigmoid,Sigmoid,Tanh,ReLU,19,13,11.0,10.0,16.0,0.03226826405707743,4,423,0.7999672133279283,4.217315885413955e-05,105.73125866481236,COMPLETE
1235,0.4816121757030487,2023-09-04 22:05:19.077739,2023-09-04 22:05:19.694205,0 days 00:00:00.616466,Tanh,Leaky,Leaky,,18,24,12.0,12.0,,0.012686078309250065,3,320,0.1599972054334067,0.09770727317284376,703.5180251177619,COMPLETE
1236,0.31476253271102905,2023-09-04 22:05:19.695335,2023-09-04 22:05:22.111876,0 days 00:00:02.416541,Tanh,Leaky,Leaky,,17,22,11.0,12.0,,0.015005699070439315,3,401,0.7998107021828524,5.530982377673548e-05,93.89031671594691,COMPLETE
1237,0.30837777256965637,2023-09-04 22:05:22.116407,2023-09-04 22:05:34.763424,0 days 00:00:12.647017,ReLU,Sigmoid,Leaky,,20,7,12.0,11.0,,0.00042021461040824974,3,387,0.7475100385988701,3.218690048165214e-05,89.22328515052796,COMPLETE
1238,0.36433929204940796,2023-09-04 22:05:34.764308,2023-09-04 22:05:49.135476,0 days 00:00:14.371168,Tanh,Leaky,,,14,13,10.0,,,0.00025140255229667456,2,434,0.42084207491159403,2.5623984043506143e-05,115.74798067252475,COMPLETE
1239,0.3524313271045685,2023-09-04 22:05:49.136280,2023-09-04 22:06:04.532234,0 days 00:00:15.395954,Tanh,Leaky,Leaky,,11,21,9.0,11.0,,0.00032967567154187823,3,453,0.7477353322472099,0.014981668653778975,108.10517867570071,COMPLETE
1240,0.3253064751625061,2023-09-04 22:06:04.533175,2023-09-04 22:06:12.716486,0 days 00:00:08.183311,Tanh,Sigmoid,,,18,15,10.0,,,0.0008313845302961703,2,411,0.4624266037013094,6.9721082260649e-05,100.8251970119386,COMPLETE
1241,0.3152448236942291,2023-09-04 22:06:12.716927,2023-09-04 22:06:14.988969,0 days 00:00:02.272042,ReLU,Leaky,Leaky,,18,8,11.0,12.0,,0.02343625553616418,3,337,0.7688238151693709,4.5961723182176316e-05,90.92725744002905,COMPLETE
1242,0.37520140409469604,2023-09-04 22:06:14.989837,2023-09-04 22:06:15.956474,0 days 00:00:00.966637,Tanh,Leaky,ReLU,,20,13,10.0,11.0,,0.0027734619735880063,3,424,0.12957989727865815,3.872949527228229e-05,122.3273362504675,COMPLETE
1243,0.31395405530929565,2023-09-04 22:06:15.957260,2023-09-04 22:06:19.093412,0 days 00:00:03.136152,Tanh,Leaky,,,16,14,12.0,,,0.004812905634325832,2,327,0.7301277759219762,8.770853429234639e-05,93.46667807442802,COMPLETE
1244,0.38819658756256104,2023-09-04 22:06:19.094195,2023-09-04 22:06:22.482319,0 days 00:00:03.388124,Leaky,Sigmoid,Sigmoid,,13,12,18.0,12.0,,0.0010704980542130978,3,276,0.14997195080217085,2.302518050927397e-05,137.6026679447719,COMPLETE
1245,0.307297021150589,2023-09-04 22:06:22.483125,2023-09-04 22:06:28.636153,0 days 00:00:06.153028,Tanh,Leaky,Leaky,,20,17,11.0,10.0,,0.0014818095151985713,3,377,0.6779745034783107,5.3732946887822464e-05,108.86144065856934,COMPLETE
1246,0.350131630897522,2023-09-04 22:06:28.638353,2023-09-04 22:06:29.961727,0 days 00:00:01.323374,ReLU,ReLU,,,15,20,10.0,,,0.007347740141859354,2,388,0.3574066356019774,0.0013744861524238108,107.32662406334511,COMPLETE
1247,0.3102143406867981,2023-09-04 22:06:29.962522,2023-09-04 22:06:36.498656,0 days 00:00:06.536134,Tanh,Leaky,Leaky,,21,9,13.0,9.0,,0.010690876255902813,3,399,0.7692473896387437,0.0055269838475548744,105.37900083358974,COMPLETE
1248,0.33436450362205505,2023-09-04 22:06:36.499547,2023-09-04 22:06:42.514450,0 days 00:00:06.014903,Tanh,Sigmoid,Tanh,,23,9,14.0,23.0,,0.004026466862658716,3,477,0.6338695373276606,2.9291043055173984e-05,672.1859581687233,COMPLETE
1249,0.3446176052093506,2023-09-04 22:06:42.515347,2023-09-04 22:06:44.706222,0 days 00:00:02.190875,Tanh,Leaky,,,18,16,11.0,,,0.008973845556598284,2,167,0.7990836791095077,7.594899450217283e-05,101.5590410232544,COMPLETE
1250,0.30480626225471497,2023-09-04 22:06:44.707062,2023-09-04 22:06:47.801954,0 days 00:00:03.094892,ReLU,Leaky,Leaky,,35,22,11.0,20.0,,0.029377379746954677,3,287,0.7043472307989452,0.0006657205438667372,99.7803407396589,COMPLETE
1251,0.3443896472454071,2023-09-04 22:06:47.802776,2023-09-04 22:06:48.449670,0 days 00:00:00.646894,Tanh,Sigmoid,,,94,13,11.0,,,0.05051556736584227,2,444,0.5557037227220335,1.3478570800723384e-05,99.88961383274624,COMPLETE
1252,0.3398979604244232,2023-09-04 22:06:48.450482,2023-09-04 22:06:49.545940,0 days 00:00:01.095458,Tanh,Leaky,Leaky,,24,12,11.0,18.0,,0.03793550743404056,3,346,0.3245089434216356,9.878799835581629e-05,117.90291002061632,COMPLETE
1253,0.2982918322086334,2023-09-04 22:06:49.546780,2023-09-04 22:07:32.532431,0 days 00:00:42.985651,Tanh,Leaky,Leaky,,16,17,19.0,7.0,,9.447103398507769e-05,3,406,0.7430639708815924,3.415737940286886e-05,96.29339892758524,COMPLETE
1254,0.35438722372055054,2023-09-04 22:07:32.533371,2023-09-04 22:07:37.266525,0 days 00:00:04.733154,ReLU,Tanh,,,21,12,10.0,,,0.0005923315398024679,2,368,0.660920727886345,0.002865200160505278,103.10154302496659,COMPLETE
1255,0.2999194860458374,2023-09-04 22:07:37.267214,2023-09-04 22:07:38.269831,0 days 00:00:01.002617,Tanh,Leaky,Leaky,,27,13,12.0,12.0,,0.012693312382912913,3,186,0.7263962459149732,4.4765239050805995e-05,102.60577981131418,COMPLETE
1256,0.4433530569076538,2023-09-04 22:07:38.270402,2023-09-04 22:07:39.086810,0 days 00:00:00.816408,Tanh,Sigmoid,Leaky,,25,15,13.0,23.0,,0.01784634392555239,3,337,0.7667257866186743,0.026690978146126185,113.02771441141765,COMPLETE
1257,0.29083603620529175,2023-09-04 22:07:39.087301,2023-09-04 22:07:40.036930,0 days 00:00:00.949629,ReLU,Leaky,,,18,10,10.0,,,0.015265689315248205,2,354,0.7993560181041584,6.563978686678295e-05,76.16632764092807,COMPLETE
1258,0.31441742181777954,2023-09-04 22:07:40.037430,2023-09-04 22:07:41.980421,0 days 00:00:01.942991,Tanh,Leaky,ReLU,,30,12,18.0,24.0,,0.0007334073188867592,3,434,0.4955791089368811,0.00010592562653326445,97.43185987628874,COMPLETE
1259,0.35717537999153137,2023-09-04 22:07:41.980859,2023-09-04 22:07:42.462066,0 days 00:00:00.481207,Sigmoid,Sigmoid,,,21,19,10.0,,,0.08350070270433763,2,414,0.69527670309536,0.0007413568868498254,123.22084935506184,COMPLETE
1260,0.30350419878959656,2023-09-04 22:07:42.462618,2023-09-04 22:07:43.551091,0 days 00:00:01.088473,Tanh,Leaky,Leaky,,23,21,14.0,11.0,,0.002082564042251647,3,310,0.5831232737398724,0.0005496542962008526,100.87754513355011,COMPLETE
1261,0.36371004581451416,2023-09-04 22:07:43.551586,2023-09-04 22:07:46.654091,0 days 00:00:03.102505,Tanh,Leaky,Tanh,,26,8,17.0,6.0,,0.0001972480379299605,3,245,0.388159143221917,0.00012483419671878578,176.1556242339465,COMPLETE
1262,0.2939022183418274,2023-09-04 22:07:46.654597,2023-09-04 22:07:49.056062,0 days 00:00:02.401465,ReLU,Sigmoid,,,10,23,14.0,,,0.006029873083560921,2,379,0.7464703664315104,1.9171827656013904e-05,91.46711775835823,COMPLETE
1263,0.3171028792858124,2023-09-04 22:07:49.056516,2023-09-04 22:07:49.986405,0 days 00:00:00.929889,Tanh,Leaky,Leaky,,19,11,4.0,10.0,,0.02350033896933556,3,262,0.7217038860626388,2.7907502001629782e-05,79.43525511642983,COMPLETE
1264,0.3998081088066101,2023-09-04 22:07:49.986881,2023-09-04 22:07:52.333200,0 days 00:00:02.346319,Tanh,Leaky,,,16,12,18.0,,,0.00014548621733485487,2,389,0.1333708215706815,8.120496198713462e-05,123.77190983632536,COMPLETE
1265,0.5486713647842407,2023-09-04 22:07:52.333657,2023-09-04 22:07:55.450344,0 days 00:00:03.116687,Tanh,Leaky,Leaky,,23,19,17.0,4.0,,1.3070197888785992e-05,3,362,0.23072330663360416,0.0024178198924323948,240.11996030017158,COMPLETE
1266,0.5658684372901917,2023-09-04 22:07:55.450799,2023-09-04 22:08:04.735074,0 days 00:00:09.284275,ReLU,Sigmoid,Leaky,,29,11,11.0,8.0,,2.950642626260897e-05,3,427,0.7682743179279747,5.413861191965926e-05,119.55564721350926,COMPLETE
1267,0.38087984919548035,2023-09-04 22:08:04.735561,2023-09-04 22:08:15.178999,0 days 00:00:10.443438,Tanh,Leaky,,,13,10,19.0,,,6.675006531064801e-05,2,348,0.6343973745310182,0.0010086938536830723,177.3598202672498,COMPLETE
1268,0.3233526647090912,2023-09-04 22:08:15.179459,2023-09-04 22:08:15.533377,0 days 00:00:00.353918,Tanh,Leaky,Leaky,,32,12,15.0,13.0,,0.010593521725076837,3,371,0.28631262407319275,3.98772644432078e-05,113.21742002425655,COMPLETE
1269,0.31499192118644714,2023-09-04 22:08:15.533836,2023-09-04 22:08:17.241433,0 days 00:00:01.707597,Leaky,Sigmoid,Leaky,,26,9,12.0,23.0,,0.002911866221784365,3,225,0.7998246909387048,0.000148591925785764,101.66374024348472,COMPLETE
1270,0.3551054298877716,2023-09-04 22:08:17.241913,2023-09-04 22:08:18.733074,0 days 00:00:01.491161,Tanh,Leaky,,,28,24,14.0,,,0.0005208110407091927,2,398,0.6888001846624352,0.009580503205221396,111.65253944856575,COMPLETE
1271,0.30937573313713074,2023-09-04 22:08:18.733539,2023-09-04 22:08:20.963527,0 days 00:00:02.229988,ReLU,ReLU,Sigmoid,,24,11,18.0,12.0,,0.0012756537031130054,3,459,0.7448919524260029,0.0007942998554834366,113.43648331586053,COMPLETE
1272,1.0063645839691162,2023-09-04 22:08:20.964198,2023-09-04 22:08:21.250927,0 days 00:00:00.286729,Tanh,Leaky,ReLU,Sigmoid,20,13,13.0,24.0,11.0,0.007454059687045653,4,328,0.18410847513554626,0.03743200959690647,105.70415912974964,COMPLETE
1273,0.33969300985336304,2023-09-04 22:08:21.251375,2023-09-04 22:08:21.993434,0 days 00:00:00.742059,Tanh,Leaky,Leaky,,22,12,15.0,22.0,,0.0009428010122163902,3,343,0.22215005482286607,0.0004477147580819852,5354.071123172075,COMPLETE
1274,0.3406134843826294,2023-09-04 22:08:21.993881,2023-09-04 22:08:22.747966,0 days 00:00:00.754085,Tanh,Sigmoid,,,15,7,2.0,,,0.061994000535913175,2,412,0.6129079710935281,2.419627552284815e-05,109.27403683132596,COMPLETE
1275,0.339078426361084,2023-09-04 22:08:22.748413,2023-09-04 22:08:23.744011,0 days 00:00:00.995598,ReLU,Leaky,Leaky,,18,10,17.0,7.0,,0.008864048058194967,3,382,0.6647471879137051,8.850460372818235e-05,114.53496789932251,COMPLETE
1276,0.34315967559814453,2023-09-04 22:08:23.744473,2023-09-04 22:08:24.336397,0 days 00:00:00.591924,Tanh,Leaky,Tanh,,25,11,19.0,9.0,,0.012810299568519888,3,363,0.7108866342377521,0.006146754039598746,298.2009097012606,COMPLETE
1277,0.41042882204055786,2023-09-04 22:08:24.336864,2023-09-04 22:08:24.822953,0 days 00:00:00.486089,Tanh,Sigmoid,,,30,12,14.0,,,0.0017261794168771662,2,392,0.10290453616336018,0.0019337852068811153,229.61960326924043,COMPLETE
1278,0.3542352616786957,2023-09-04 22:08:24.823377,2023-09-04 22:08:25.431716,0 days 00:00:00.608339,ReLU,Tanh,Leaky,,27,11,18.0,21.0,,0.003710091769921805,3,406,0.1695252341785531,3.649853045735217e-05,253.4885431372601,COMPLETE
1279,0.3022747337818146,2023-09-04 22:08:25.432157,2023-09-04 22:08:26.145509,0 days 00:00:00.713352,Tanh,Leaky,Leaky,,22,22,17.0,23.0,,0.01683732436811374,3,357,0.759236393226366,0.0039531088144448,92.03035163879395,COMPLETE
1280,0.3096334934234619,2023-09-04 22:08:26.145970,2023-09-04 22:08:26.592423,0 days 00:00:00.446453,Tanh,Leaky,,,33,12,15.0,,,0.019870280042668494,2,443,0.43936418212882195,0.0001613281834200829,104.05071258544922,COMPLETE
1281,0.4327639043331146,2023-09-04 22:08:26.592921,2023-09-04 22:08:42.835870,0 days 00:00:16.242949,Tanh,Sigmoid,Leaky,,17,4,17.0,13.0,,0.00010798193441000056,3,420,0.7999764022219251,1.7355122333084423e-05,104.86114567347936,COMPLETE
1282,0.46738073229789734,2023-09-04 22:08:42.836429,2023-09-04 22:08:44.068543,0 days 00:00:01.232114,Sigmoid,Leaky,,,20,13,11.0,,,0.004988970089857876,2,338,0.731232845232329,0.018477703139216022,107.73465067545573,COMPLETE
1283,0.4188937842845917,2023-09-04 22:08:44.069014,2023-09-04 22:08:44.696228,0 days 00:00:00.627214,ReLU,Leaky,Leaky,,23,14,16.0,24.0,,0.027247321753319228,3,316,0.571139380532121,0.05102197888784114,107.92065906524658,COMPLETE
1284,0.32307612895965576,2023-09-04 22:08:44.696691,2023-09-04 22:08:45.697598,0 days 00:00:01.000907,Tanh,Leaky,Leaky,,25,11,12.0,6.0,,0.010592349317084467,3,372,0.4793837932453865,0.0012280047369667842,100.37835410789206,COMPLETE
1285,0.3437257707118988,2023-09-04 22:08:45.698071,2023-09-04 22:08:46.273261,0 days 00:00:00.575190,Tanh,Sigmoid,,,28,9,14.0,,,0.014354036330281206,2,354,0.27948885796055983,0.00488895275380801,112.84537160396576,COMPLETE
1286,0.39591336250305176,2023-09-04 22:08:46.273758,2023-09-04 22:08:50.177532,0 days 00:00:03.903774,Tanh,Leaky,ReLU,,19,10,15.0,5.0,,0.00032575323396515457,3,378,0.30836980705789796,6.659347400461464e-05,111.90542860633822,COMPLETE
1287,0.37355297803878784,2023-09-04 22:08:50.178085,2023-09-04 22:08:50.521775,0 days 00:00:00.343690,ReLU,Leaky,Leaky,,21,12,18.0,11.0,,0.04264382931937131,3,393,0.2387398839237331,0.0003724006396279005,113.8022232055664,COMPLETE
1288,0.345054566860199,2023-09-04 22:08:50.522306,2023-09-04 22:08:54.017287,0 days 00:00:03.494981,Tanh,Sigmoid,,,15,11,17.0,,,0.0014795397715593305,2,255,0.7696826403914301,4.980234872132537e-05,142.57339477539062,COMPLETE
1289,0.30391329526901245,2023-09-04 22:08:54.017889,2023-09-04 22:08:54.814301,0 days 00:00:00.796412,Tanh,Leaky,Leaky,,30,19,15.0,3.0,,0.008982314754681423,3,431,0.5348555260189233,0.0001228192816791832,105.54171877129133,COMPLETE
1290,0.33874234557151794,2023-09-04 22:08:54.814859,2023-09-04 22:08:57.202283,0 days 00:00:02.387424,Tanh,Leaky,Tanh,,26,10,13.0,13.0,,0.0011990370873233669,3,344,0.6977713378094788,0.00010795292950141605,112.10725287980931,COMPLETE
1291,0.3771468997001648,2023-09-04 22:08:57.202746,2023-09-04 22:08:57.832199,0 days 00:00:00.629453,ReLU,Sigmoid,,,24,21,16.0,,,0.012061584660008727,2,361,0.7416641992362379,1.000084623049948e-05,98.04977258046468,COMPLETE
1292,1.0127954483032227,2023-09-04 22:08:57.832792,2023-09-04 22:08:58.369337,0 days 00:00:00.536545,Tanh,Leaky,Leaky,,22,12,18.0,1.0,,1.049041528832719e-05,3,404,0.6610112752466701,0.04405693502863834,100.24302134794347,COMPLETE
1293,0.31868308782577515,2023-09-04 22:08:58.369918,2023-09-04 22:08:59.812001,0 days 00:00:01.442083,Tanh,Leaky,Leaky,,18,11,16.0,22.0,,0.0023340454975581226,3,385,0.7666891735263044,0.0015290898555150123,103.1219586824116,COMPLETE
1294,0.3256049156188965,2023-09-04 22:08:59.812707,2023-09-04 22:09:00.218795,0 days 00:00:00.406088,Leaky,Leaky,,,28,23,17.0,,,0.006076891570187774,2,328,0.26242113900704794,0.0005872454663244493,113.94349880218506,COMPLETE
1295,0.35404762625694275,2023-09-04 22:09:00.219262,2023-09-04 22:09:03.086731,0 days 00:00:02.867469,Tanh,Sigmoid,Leaky,,12,12,15.0,23.0,,0.0007633257488148357,3,369,0.37597400558686417,0.002932293016426082,113.57760302225749,COMPLETE
1296,0.37771371006965637,2023-09-04 22:09:03.087243,2023-09-04 22:09:03.605278,0 days 00:00:00.518035,ReLU,Leaky,,,35,13,16.0,,,0.015936884080393638,2,335,0.7225474825017503,3.113712454867879e-05,97.95402116041917,COMPLETE
1297,0.2606564164161682,2023-09-04 22:09:03.605883,2023-09-04 22:09:04.266342,0 days 00:00:00.660459,Tanh,ReLU,Leaky,,32,11,19.0,8.0,,0.02187029355627395,3,420,0.7695434708051625,7.611018597354084e-05,97.77661743164063,COMPLETE
1298,0.32127389311790466,2023-09-04 22:09:04.266787,2023-09-04 22:09:04.798758,0 days 00:00:00.531971,Tanh,ReLU,Sigmoid,,34,11,15.0,8.0,,0.022951547501736537,3,422,0.4090280977671412,7.342043435787876e-05,107.06892992999103,COMPLETE
1299,0.26164641976356506,2023-09-04 22:09:04.799219,2023-09-04 22:09:05.879115,0 days 00:00:01.079896,Tanh,ReLU,Leaky,,32,10,20.0,8.0,,0.020878721308263383,3,423,0.7746088427052125,8.357333725301944e-05,98.97001328579215,COMPLETE
1300,0.38242095708847046,2023-09-04 22:09:05.879592,2023-09-04 22:09:06.374244,0 days 00:00:00.494652,Tanh,ReLU,Leaky,,33,8,20.0,8.0,,0.023747768693892096,3,415,0.7705376523741262,6.920814925342871e-05,138.07548438178168,COMPLETE
1301,0.3384104073047638,2023-09-04 22:09:06.374780,2023-09-04 22:09:06.778709,0 days 00:00:00.403929,ReLU,ReLU,Leaky,,34,22,20.0,9.0,,0.023172064871877313,3,422,0.7747374373851528,8.47574624342742e-05,101.55171040126255,COMPLETE
1302,0.339102178812027,2023-09-04 22:09:06.779301,2023-09-04 22:09:07.506084,0 days 00:00:00.726783,Tanh,Sigmoid,Leaky,,36,10,20.0,8.0,,0.029579581686026354,3,420,0.5235716845703778,7.537511791431243e-05,99.27208427760912,COMPLETE
1303,0.29037949442863464,2023-09-04 22:09:07.506543,2023-09-04 22:09:08.416205,0 days 00:00:00.909662,Tanh,ReLU,Leaky,,33,11,19.0,8.0,,0.026346883854465063,3,418,0.7721640547137602,5.633601251413844e-05,86.5963332717483,COMPLETE
1304,0.4581398665904999,2023-09-04 22:09:08.416746,2023-09-04 22:09:09.857350,0 days 00:00:01.440604,Tanh,ReLU,Leaky,,32,1,21.0,7.0,,0.02122107575112086,3,409,0.7993192071104617,0.006571031939184841,116.84292615693191,COMPLETE
1305,0.39163270592689514,2023-09-04 22:09:09.857925,2023-09-04 22:09:10.062418,0 days 00:00:00.204493,ReLU,ReLU,Leaky,,36,18,20.0,7.0,,0.0203058501047251,3,411,0.11052662701495812,6.100048793568555e-05,126.71110290527344,COMPLETE
1306,0.3528505861759186,2023-09-04 22:09:10.062895,2023-09-04 22:09:10.775939,0 days 00:00:00.713044,Tanh,ReLU,Leaky,,38,12,20.0,8.0,,0.027168698604663425,3,405,0.7503510386783903,0.010675603736976787,87.72283387184143,COMPLETE
1307,0.3408847451210022,2023-09-04 22:09:10.776510,2023-09-04 22:09:11.542357,0 days 00:00:00.765847,Tanh,ReLU,Leaky,,30,12,14.0,9.0,,0.03625927119748129,3,427,0.7998721607752473,8.561288190643278e-05,91.15030359338832,COMPLETE
1308,0.3853055536746979,2023-09-04 22:09:11.542855,2023-09-04 22:09:11.902662,0 days 00:00:00.359807,Tanh,ReLU,Leaky,,31,13,20.0,7.0,,0.01890799834784514,3,436,0.32521010897368463,5.491053821780523e-05,227.1980946858724,COMPLETE
1309,0.2720429003238678,2023-09-04 22:09:11.903267,2023-09-04 22:09:13.239601,0 days 00:00:01.336334,Sigmoid,ReLU,Leaky,,31,24,21.0,8.0,,0.029776195233537327,3,414,0.7997509934086184,6.631821600421112e-05,97.93908187866211,COMPLETE
1310,0.3454943299293518,2023-09-04 22:09:13.240218,2023-09-04 22:09:13.661249,0 days 00:00:00.421031,ReLU,ReLU,Leaky,,34,17,20.0,9.0,,0.020397524672095012,3,401,0.3427076640538745,8.194225761439453e-05,200.35994400516634,COMPLETE
1311,0.3952820301055908,2023-09-04 22:09:13.661924,2023-09-04 22:09:13.940324,0 days 00:00:00.278400,Tanh,ReLU,Leaky,,32,9,21.0,8.0,,0.018138915020900606,3,434,0.10040883788949526,4.666959387872666e-05,195.02596916036404,COMPLETE
1312,0.36369192600250244,2023-09-04 22:09:13.941091,2023-09-04 22:09:15.441675,0 days 00:00:01.500584,Tanh,Tanh,Leaky,,32,16,20.0,7.0,,0.00043413896772843714,3,421,0.2710278214366252,9.733199869871819e-05,122.01174310196278,COMPLETE
1313,0.3105344772338867,2023-09-04 22:09:15.442135,2023-09-04 22:09:16.257214,0 days 00:00:00.815079,ReLU,ReLU,Leaky,,30,20,20.0,9.0,,0.03162771561703607,3,412,0.7487956469588751,6.028771624260004e-05,82.81635235201928,COMPLETE
1314,0.41030406951904297,2023-09-04 22:09:16.257723,2023-09-04 22:09:16.457418,0 days 00:00:00.199695,Tanh,ReLU,Leaky,,29,11,19.0,7.0,,0.023870234529952784,3,399,0.11961249770818544,0.0097431829905726,117.00896034240722,COMPLETE
1315,0.3578260540962219,2023-09-04 22:09:16.457949,2023-09-04 22:09:17.030974,0 days 00:00:00.573025,Tanh,ReLU,Leaky,,34,11,12.0,8.0,,0.017464180856369103,3,428,0.5884901084393531,0.012551398890427974,108.46215267839104,COMPLETE
1316,0.3378549814224243,2023-09-04 22:09:17.031435,2023-09-04 22:09:22.929247,0 days 00:00:05.897812,Tanh,ReLU,Leaky,,30,10,19.0,9.0,,0.0002830392437954606,3,405,0.46746192822675264,9.358632436804257e-05,101.46812308982567,COMPLETE
