number,value,datetime_start,datetime_complete,duration,params_activation1,params_activation2,params_activation3,params_activation4,params_batch_size,params_fl1,params_fl2,params_fl3,params_fl4,params_learning_rate,params_n_layers,params_num_epochs,params_train_size,params_weight_decay,user_attrs_mre,state
1816,0.4169062376022339,2023-09-04 21:54:21.933986,2023-09-04 21:54:22.514069,0 days 00:00:00.580083,Leaky,Tanh,,,43,21,22.0,,,0.0073744359450206845,2,250,0.2237028566961787,1.908583626034342e-05,143.6269536336263,COMPLETE
1817,0.43055814504623413,2023-09-04 21:54:22.514567,2023-09-04 21:54:25.308426,0 days 00:00:02.793859,Leaky,ReLU,,,38,24,15.0,,,0.00039915402433381256,2,134,0.7998761745091053,0.006644067648887408,143.18066884510552,COMPLETE
1818,0.48476120829582214,2023-09-04 21:54:25.308916,2023-09-04 21:54:27.568405,0 days 00:00:02.259489,Leaky,Sigmoid,,,47,23,23.0,,,0.0002910390705860665,2,226,0.4179043780642727,0.0005443045977315017,161.78263341853048,COMPLETE
1819,0.3013656735420227,2023-09-04 21:54:27.568910,2023-09-04 21:54:29.731784,0 days 00:00:02.162874,Leaky,ReLU,,,34,22,18.0,,,0.0023587583387718308,2,378,0.6277482597632329,0.0009506063197143097,143.84319015010712,COMPLETE
1820,0.6036100387573242,2023-09-04 21:54:29.732307,2023-09-04 21:54:30.365561,0 days 00:00:00.633254,Leaky,Tanh,,,27,20,22.0,,,0.013031350404725896,2,113,0.7129913357741655,0.042557387162028115,146.231310088059,COMPLETE
1821,0.34289324283599854,2023-09-04 21:54:30.366085,2023-09-04 21:54:31.147922,0 days 00:00:00.781837,Leaky,Sigmoid,,,51,21,21.0,,,0.006581292273336587,2,266,0.4778352583047522,0.000247052590965199,130.62719070079714,COMPLETE
1822,0.49827274680137634,2023-09-04 21:54:31.148427,2023-09-04 21:54:31.607374,0 days 00:00:00.458947,Tanh,ReLU,,,41,24,16.0,,,0.008660554662193906,2,318,0.14935708215092358,1.72630656422728e-05,213.44359817504883,COMPLETE
1823,0.5090465545654297,2023-09-04 21:54:31.608360,2023-09-04 21:54:32.220799,0 days 00:00:00.612439,Leaky,ReLU,,,37,22,23.0,,,0.01511010083512547,2,172,0.1646175558479672,1.1794389294846768e-05,165.68412340604343,COMPLETE
1824,0.37419235706329346,2023-09-04 21:54:32.221299,2023-09-04 21:54:33.984206,0 days 00:00:01.762907,Leaky,Sigmoid,,,45,21,17.0,,,0.004747925770322006,2,491,0.6736647381511883,0.0008110837481114009,155.0024154551708,COMPLETE
1825,0.3121194541454315,2023-09-04 21:54:33.984743,2023-09-04 21:54:34.965450,0 days 00:00:00.980707,Leaky,Tanh,,,36,23,19.0,,,0.010151278448015857,2,238,0.7672667300807132,1.478254833899772e-05,171.41910525730677,COMPLETE
1826,0.3002088665962219,2023-09-04 21:54:34.965981,2023-09-04 21:54:35.771163,0 days 00:00:00.805182,Leaky,ReLU,,,39,24,21.0,,,0.011983997753860146,2,361,0.7396345112840709,0.00032957144343910745,243.15296219806282,COMPLETE
1827,0.4758242070674896,2023-09-04 21:54:35.771672,2023-09-04 21:54:35.969042,0 days 00:00:00.197370,Leaky,Leaky,,,42,23,24.0,,,0.019928095581365678,2,292,0.10991076725087598,0.0013680297024150894,210.7030669318305,COMPLETE
1828,0.5431904792785645,2023-09-04 21:54:35.969551,2023-09-04 21:54:37.738127,0 days 00:00:01.768576,Sigmoid,ReLU,,,32,22,22.0,,,0.0003223726757886426,2,178,0.3695603757488967,3.328091929102983e-05,186.17725393745337,COMPLETE
1829,0.32932230830192566,2023-09-04 21:54:37.738609,2023-09-04 21:54:39.104989,0 days 00:00:01.366380,Leaky,Sigmoid,,,25,23,18.0,,,0.00516429693166347,2,144,0.7999694337305219,0.00063116801539197,122.39114444538698,COMPLETE
1830,0.4224720001220703,2023-09-04 21:54:39.105491,2023-09-04 21:54:41.850718,0 days 00:00:02.745227,Leaky,Tanh,,,44,22,21.0,,,0.00011754374667971928,2,218,0.6938264444782746,0.00020264360775751949,157.96842039615737,COMPLETE
1831,0.3567298352718353,2023-09-04 21:54:41.851223,2023-09-04 21:54:42.654865,0 days 00:00:00.803642,Tanh,ReLU,,,34,21,22.0,,,0.01457793787169861,2,160,0.7253789189852867,0.0004718456516681808,255.80441250271267,COMPLETE
1832,0.6191794276237488,2023-09-04 21:54:42.655442,2023-09-04 21:54:43.031875,0 days 00:00:00.376433,Leaky,Sigmoid,,,29,24,23.0,,,0.007978446851934391,2,193,0.3370931622233878,0.024572487543622436,177.5573782151745,COMPLETE
1833,0.4016404449939728,2023-09-04 21:54:43.032381,2023-09-04 21:54:44.137716,0 days 00:00:01.105335,Leaky,ReLU,,,40,21,17.0,,,0.0020252262417725935,2,127,0.4315404217376086,2.538075171566562e-05,212.45425923665366,COMPLETE
1834,0.3541829586029053,2023-09-04 21:54:44.138300,2023-09-04 21:54:44.986441,0 days 00:00:00.848141,Leaky,Tanh,,,38,19,18.0,,,0.006215184793912281,2,206,0.7713865918868954,0.0003850377713381134,215.14170370296557,COMPLETE
1835,0.37149083614349365,2023-09-04 21:54:44.987015,2023-09-04 21:54:46.438622,0 days 00:00:01.451607,Leaky,,,,36,23,,,,0.00299814980207778,1,256,0.49604845123008656,1.0055413780731847e-05,219.48830228726538,COMPLETE
1836,0.4985063970088959,2023-09-04 21:54:46.439221,2023-09-04 21:54:47.450043,0 days 00:00:01.010822,Leaky,ReLU,,,42,21,21.0,,,0.0039242179351275655,2,229,0.603935104357623,0.02305934997804078,165.54090033637152,COMPLETE
1837,0.4204119145870209,2023-09-04 21:54:47.450686,2023-09-04 21:54:50.609330,0 days 00:00:03.158644,Leaky,Sigmoid,,,35,20,22.0,,,0.0015421899776052832,2,386,0.7452311175839145,0.0038050179989385603,286.0996345251649,COMPLETE
1838,0.5104177594184875,2023-09-04 21:54:50.609952,2023-09-04 21:54:50.975733,0 days 00:00:00.365781,Leaky,ReLU,Sigmoid,,31,22,19.0,4.0,,0.010368829477221723,3,308,0.10049219386873763,0.0002799519269800291,203.22295829041363,COMPLETE
1839,0.32641443610191345,2023-09-04 21:54:50.976395,2023-09-04 21:54:51.935726,0 days 00:00:00.959331,Leaky,Sigmoid,,,39,23,23.0,,,0.012702295667192366,2,217,0.6556246421033299,1.3469578991775969e-05,139.61553741903867,COMPLETE
1840,0.9554939270019531,2023-09-04 21:54:51.936490,2023-09-04 21:54:53.203505,0 days 00:00:01.267015,Tanh,ReLU,,,54,13,16.0,,,1.4916353838727928e-05,2,274,0.2678244562950442,4.075402742395273e-05,127.48786514170848,COMPLETE
1841,0.4562324285507202,2023-09-04 21:54:53.204085,2023-09-04 21:54:53.403494,0 days 00:00:00.199409,Leaky,Tanh,,,45,24,22.0,,,0.018066498080502074,2,151,0.12370065751439034,5.721548795514145e-05,192.5473868233817,COMPLETE
1842,0.8015872240066528,2023-09-04 21:54:53.404150,2023-09-04 21:54:54.450447,0 days 00:00:01.046297,Leaky,Leaky,,,33,21,24.0,,,2.4692294374686404e-05,2,136,0.2766982517238406,0.001490462321839318,112.8282076330746,COMPLETE
1843,0.3809967637062073,2023-09-04 21:54:54.451076,2023-09-04 21:54:55.046123,0 days 00:00:00.595047,Leaky,ReLU,,,41,22,23.0,,,0.009158818091195073,2,168,0.3299446825956235,1.688442452061494e-05,354.4618254870903,COMPLETE
1844,0.5357433557510376,2023-09-04 21:54:55.047085,2023-09-04 21:54:57.655448,0 days 00:00:02.608363,Leaky,Sigmoid,,,37,20,13.0,,,0.0005523334400834367,2,186,0.21668399713257064,0.00022492171677093562,1610.9331211377216,COMPLETE
1845,0.3366699516773224,2023-09-04 21:54:57.656478,2023-09-04 21:54:59.791220,0 days 00:00:02.134742,Leaky,ReLU,,,39,23,14.0,,,0.007289143681900863,2,396,0.7996894067331811,0.004361226689211944,113.476534476647,COMPLETE
1846,0.6386517286300659,2023-09-04 21:54:59.791723,2023-09-04 21:55:03.091455,0 days 00:00:03.299732,Leaky,Tanh,,,43,17,21.0,,,3.5184781214873716e-05,2,200,0.5488053663678232,2.0983317358153505e-05,141.94439510345458,COMPLETE
1847,0.37945714592933655,2023-09-04 21:55:03.091963,2023-09-04 21:55:03.742053,0 days 00:00:00.650090,Leaky,ReLU,,,36,24,22.0,,,0.015893418704012695,2,123,0.7092223550130505,2.8504870994519974e-05,167.71060040122583,COMPLETE
1848,0.43735700845718384,2023-09-04 21:55:03.742563,2023-09-04 21:55:04.465298,0 days 00:00:00.722735,Tanh,Sigmoid,,,48,22,18.0,,,0.002493318925738094,2,298,0.10817072303908802,0.0021227608687991173,138.80019570677072,COMPLETE
1849,0.4552154541015625,2023-09-04 21:55:04.465798,2023-09-04 21:55:05.374952,0 days 00:00:00.909154,Leaky,ReLU,,,30,23,17.0,,,0.0008093560057310956,2,244,0.13503730125176505,0.0003524723124274894,210.38923565846568,COMPLETE
1850,0.3548230230808258,2023-09-04 21:55:05.375449,2023-09-04 21:55:06.644521,0 days 00:00:01.269072,Leaky,Tanh,,,34,24,15.0,,,0.0053645369377599466,2,146,0.7678141641276869,0.0027466286120330537,382.50068770514594,COMPLETE
1851,0.3716238737106323,2023-09-04 21:55:06.645056,2023-09-04 21:55:08.112318,0 days 00:00:01.467262,Sigmoid,Sigmoid,,,40,21,19.0,,,0.011429127006084191,2,176,0.7457402096564357,0.0005189217848397555,207.51900781559038,COMPLETE
1852,0.39189544320106506,2023-09-04 21:55:08.112814,2023-09-04 21:55:10.339466,0 days 00:00:02.226652,Leaky,ReLU,,,38,22,21.0,,,0.0006585404493015333,2,159,0.6907540834629471,0.0006886057599198165,151.4231006934208,COMPLETE
1853,0.3313309848308563,2023-09-04 21:55:10.339979,2023-09-04 21:55:10.980165,0 days 00:00:00.640186,Leaky,ReLU,,,33,20,23.0,,,0.02092769443365612,2,279,0.720740535479685,1.1574979930168732e-05,126.59417118745692,COMPLETE
1854,0.335427850484848,2023-09-04 21:55:10.980674,2023-09-04 21:55:12.394268,0 days 00:00:01.413594,Leaky,Sigmoid,,,27,23,21.0,,,0.008533261795709023,2,229,0.7712646655764243,0.00026635676701685133,136.9907901820852,COMPLETE
1855,0.31142666935920715,2023-09-04 21:55:12.394771,2023-09-04 21:55:13.198537,0 days 00:00:00.803766,Leaky,Tanh,,,41,21,22.0,,,0.012677188377992183,2,477,0.5885950083173868,0.00039003953435660563,202.0615423293341,COMPLETE
1856,0.5623137354850769,2023-09-04 21:55:13.199058,2023-09-04 21:55:13.762398,0 days 00:00:00.563340,Leaky,Leaky,,,36,22,20.0,,,0.006816550425763993,2,207,0.20134875646315725,0.02996055862638305,136.12373666202322,COMPLETE
1857,0.3387872874736786,2023-09-04 21:55:13.762935,2023-09-04 21:55:14.384502,0 days 00:00:00.621567,Tanh,ReLU,,,43,24,16.0,,,0.014930871981241576,2,258,0.6431182097423346,3.541049934280105e-05,155.29214477539062,COMPLETE
1858,0.3186139762401581,2023-09-04 21:55:14.385499,2023-09-04 21:55:16.668692,0 days 00:00:02.283193,Leaky,ReLU,,,45,18,22.0,,,0.009705298098030564,2,184,0.6770691660573688,1.5244509234728065e-05,638.1580185428743,COMPLETE
1859,0.7747937440872192,2023-09-04 21:55:16.669674,2023-09-04 21:55:18.626911,0 days 00:00:01.957237,Leaky,Sigmoid,,,38,23,19.0,,,9.097189764199048e-05,2,108,0.2825231736436266,2.3184988640156076e-05,133.50960597285518,COMPLETE
1860,0.3355902135372162,2023-09-04 21:55:18.627415,2023-09-04 21:55:19.264393,0 days 00:00:00.636978,Leaky,Tanh,,,31,22,19.0,,,0.01738826047604011,2,403,0.7449660493283793,0.00043880219444633606,142.56300735473633,COMPLETE
1861,0.700347363948822,2023-09-04 21:55:19.264918,2023-09-04 21:55:19.693750,0 days 00:00:00.428832,Leaky,ReLU,,,35,24,21.0,,,0.0034747032935879977,2,214,0.7995578923933334,0.06182375933916668,605.9627583821615,COMPLETE
1862,0.5662943124771118,2023-09-04 21:55:19.694285,2023-09-04 21:55:21.079205,0 days 00:00:01.384920,Leaky,Sigmoid,,,29,21,20.0,,,0.00010989400500727749,2,266,0.17681208931941023,0.0003143823625322089,1179.0325317382812,COMPLETE
1863,0.5702881217002869,2023-09-04 21:55:21.079707,2023-09-04 21:55:26.198529,0 days 00:00:05.118822,Leaky,ReLU,,,25,19,23.0,,,2.151900208224945e-05,2,236,0.7169870719959218,6.439292605742533e-05,228.47067422381903,COMPLETE
1864,0.41672903299331665,2023-09-04 21:55:26.199031,2023-09-04 21:55:26.684990,0 days 00:00:00.485959,Leaky,Tanh,,,47,20,24.0,,,0.050750587410830335,2,287,0.3625207054335422,0.001863525154510652,178.81718725907174,COMPLETE
1865,0.3953711688518524,2023-09-04 21:55:26.685496,2023-09-04 21:55:27.608816,0 days 00:00:00.923320,Leaky,ReLU,,,40,23,18.0,,,0.004613666900096404,2,194,0.7687720024315532,0.007227500421358901,125.17891193258352,COMPLETE
1866,0.7392072677612305,2023-09-04 21:55:27.609339,2023-09-04 21:55:28.929799,0 days 00:00:01.320460,Leaky,Sigmoid,,,42,22,17.0,,,3.9239319629023595e-05,2,135,0.49746420401275576,0.0008052625442924912,106.54297219735605,COMPLETE
1867,0.5631009936332703,2023-09-04 21:55:28.930285,2023-09-04 21:55:31.450791,0 days 00:00:02.520506,Tanh,ReLU,,,37,21,15.0,,,5.835808520780491e-05,2,167,0.7440891660719204,1.0016427385748567e-05,154.46902059223837,COMPLETE
1868,0.3510773479938507,2023-09-04 21:55:31.451296,2023-09-04 21:55:32.195368,0 days 00:00:00.744072,Leaky,Leaky,,,34,23,22.0,,,0.006039735735066032,2,218,0.7105176134621954,0.00020683293936640086,133.48750908430233,COMPLETE
1869,0.39726030826568604,2023-09-04 21:55:32.195866,2023-09-04 21:55:32.670029,0 days 00:00:00.474163,Leaky,Tanh,,,32,24,21.0,,,0.011013888443311434,2,152,0.31209089612335356,1.3817387551812462e-05,162.3581005859375,COMPLETE
1870,0.940860390663147,2023-09-04 21:55:32.670549,2023-09-04 21:55:35.243116,0 days 00:00:02.572567,Leaky,Sigmoid,,,50,22,20.0,,,1.6788180973939426e-05,2,179,0.6723669740014445,0.00017133487630261214,114.96716756128066,COMPLETE
1871,0.38069427013397217,2023-09-04 21:55:35.244098,2023-09-04 21:55:37.168079,0 days 00:00:01.923981,Leaky,ReLU,,,38,21,22.0,,,0.0011354453159928804,2,116,0.5371188634917728,0.0017648395230750649,124.31148654016955,COMPLETE
1872,0.5781716704368591,2023-09-04 21:55:37.168585,2023-09-04 21:55:38.083071,0 days 00:00:00.914486,Leaky,ReLU,,,40,9,14.0,,,0.0016951440786236091,2,222,0.40788666729472844,0.052594761470570434,155.84993182288275,COMPLETE
1873,0.5472149848937988,2023-09-04 21:55:38.083568,2023-09-04 21:55:44.256527,0 days 00:00:06.172959,Sigmoid,Sigmoid,Leaky,,44,20,17.0,6.0,,0.0003855979680094417,3,374,0.7721540085708353,0.0006095926913961613,249.9881803339178,COMPLETE
1874,0.31512579321861267,2023-09-04 21:55:44.257136,2023-09-04 21:55:45.603899,0 days 00:00:01.346763,Leaky,Tanh,,,42,24,23.0,,,0.008005257361267016,2,201,0.7353021237292257,7.023507123683674e-05,126.55598423092864,COMPLETE
1875,0.5403369069099426,2023-09-04 21:55:45.604468,2023-09-04 21:55:48.240861,0 days 00:00:02.636393,Tanh,ReLU,,,36,23,16.0,,,0.00016336934521969594,2,393,0.28486065931628823,1.9460808953950447e-05,379.16705920192726,COMPLETE
1876,0.481581449508667,2023-09-04 21:55:48.241472,2023-09-04 21:55:48.870584,0 days 00:00:00.629112,Leaky,ReLU,,,39,5,23.0,,,0.013439868554148963,2,144,0.17727575249303662,0.005066593325832206,211.5106667412652,COMPLETE
1877,0.3628554940223694,2023-09-04 21:55:48.871220,2023-09-04 21:55:52.335636,0 days 00:00:03.464416,Leaky,Sigmoid,,,33,22,18.0,,,0.0008930892970710985,2,129,0.7684108836433398,0.0010719942914830815,245.1350634079571,COMPLETE
1878,0.34103015065193176,2023-09-04 21:55:52.336174,2023-09-04 21:55:52.758596,0 days 00:00:00.422422,Leaky,ReLU,,,37,23,19.0,,,0.022586157674960694,2,244,0.4711024711676156,2.8764280303801635e-05,129.65923055013022,COMPLETE
1879,0.3276078999042511,2023-09-04 21:55:52.759170,2023-09-04 21:55:55.536223,0 days 00:00:02.777053,Leaky,Tanh,,,46,21,21.0,,,0.0028213095767205603,2,159,0.5241817193034098,4.4593063302882885e-05,127.56441672643025,COMPLETE
1880,0.37944740056991577,2023-09-04 21:55:55.536787,2023-09-04 21:55:56.429273,0 days 00:00:00.892486,Leaky,Sigmoid,,,53,22,22.0,,,0.004116548521950395,2,277,0.3476611013524473,1.2119161650964158e-05,194.05651092529297,COMPLETE
1881,0.5531594753265381,2023-09-04 21:55:56.429789,2023-09-04 21:55:56.913528,0 days 00:00:00.483739,Leaky,ReLU,,,35,15,20.0,,,0.010239203066177122,2,172,0.6894308631408544,0.03815992801615649,167.79615490253155,COMPLETE
1882,0.49459537863731384,2023-09-04 21:55:56.914030,2023-09-04 21:55:57.520130,0 days 00:00:00.606100,Leaky,Leaky,,,41,24,21.0,,,0.007008455642615657,2,484,0.4308913477670253,0.021661320286846468,630.344010876071,COMPLETE
1883,0.3052869141101837,2023-09-04 21:55:57.520690,2023-09-04 21:55:58.430691,0 days 00:00:00.910001,Leaky,ReLU,,,28,20,24.0,,,0.013919860344235329,2,188,0.7199177943395173,0.0004844304900165591,150.87610337999132,COMPLETE
1884,0.5870035290718079,2023-09-04 21:55:58.431253,2023-09-04 21:56:00.330596,0 days 00:00:01.899343,Tanh,Tanh,,,39,23,23.0,,,3.640036616173886e-05,2,226,0.3823880723403406,0.0003123501634535406,141.375828700783,COMPLETE
1885,0.32837867736816406,2023-09-04 21:56:00.331123,2023-09-04 21:56:00.996120,0 days 00:00:00.664997,Leaky,Sigmoid,,,31,21,19.0,,,0.018420127589736483,2,348,0.7985685449590174,0.0002624163084864404,155.7766980489095,COMPLETE
1886,0.5005538463592529,2023-09-04 21:56:00.996650,2023-09-04 21:56:01.211581,0 days 00:00:00.214931,Leaky,,,,44,22,,,,0.07529468223653103,1,407,0.32659307207188387,1.7267297035244826e-05,146.0092102686564,COMPLETE
1887,0.5995920896530151,2023-09-04 21:56:01.212099,2023-09-04 21:56:01.523533,0 days 00:00:00.311434,Leaky,ReLU,,,42,24,18.0,,,0.005244675791817002,2,324,0.6279289263171998,0.08291020108308725,693.8565979003906,COMPLETE
1888,0.5075292587280273,2023-09-04 21:56:01.524059,2023-09-04 21:56:07.573425,0 days 00:00:06.049366,Leaky,Sigmoid,,,34,23,22.0,,,8.320703979583349e-05,2,254,0.7462046004722331,0.0003821787823931641,143.68776465588667,COMPLETE
1889,0.4814702570438385,2023-09-04 21:56:07.573923,2023-09-04 21:56:08.419973,0 days 00:00:00.846050,Leaky,ReLU,,,37,22,16.0,,,0.001335975349107384,2,208,0.16401919769287168,0.011272742350381997,149.7054127913255,COMPLETE
1890,0.5905327796936035,2023-09-04 21:56:08.420477,2023-09-04 21:56:09.118835,0 days 00:00:00.698358,Leaky,Tanh,,,40,21,20.0,,,0.0020066053060711305,2,297,0.7717292277791549,0.06553786162936734,189.02590049185403,COMPLETE
1891,0.35056909918785095,2023-09-04 21:56:09.119359,2023-09-04 21:56:09.885850,0 days 00:00:00.766491,Leaky,ReLU,,,32,24,22.0,,,0.00852164797023345,2,267,0.6991504199997025,0.0034326189003520504,443.7436902845228,COMPLETE
1892,0.4420289099216461,2023-09-04 21:56:09.886363,2023-09-04 21:56:10.432497,0 days 00:00:00.546134,Tanh,Sigmoid,,,38,23,4.0,,,0.011433801842002312,2,142,0.25051625410233913,0.0005654917235601052,206.22242001453077,COMPLETE
1893,0.3289617896080017,2023-09-04 21:56:10.432995,2023-09-04 21:56:11.090125,0 days 00:00:00.657130,Leaky,ReLU,,,26,22,23.0,,,0.01628340504677097,2,285,0.744998100764563,0.0008919413116511277,165.33784321376257,COMPLETE
1894,0.3319016098976135,2023-09-04 21:56:11.090653,2023-09-04 21:56:12.379989,0 days 00:00:01.289336,Leaky,Tanh,,,35,21,15.0,,,0.009228586169750395,2,232,0.6709299342545119,1.3392959322767403e-05,113.86808915571733,COMPLETE
1895,0.48595109581947327,2023-09-04 21:56:12.380500,2023-09-04 21:56:13.267645,0 days 00:00:00.887145,Leaky,ReLU,,,29,20,21.0,,,0.006256078115340674,2,174,0.7167560165539463,0.03058832490484317,162.93931612761125,COMPLETE
1896,0.32992109656333923,2023-09-04 21:56:13.268157,2023-09-04 21:56:14.333177,0 days 00:00:01.065020,Leaky,Sigmoid,,,22,24,19.0,,,0.01274661942468291,2,164,0.7719592875378067,0.00020813489510419946,136.17112550281342,COMPLETE
1897,0.35662585496902466,2023-09-04 21:56:14.333684,2023-09-04 21:56:14.917300,0 days 00:00:00.583616,Sigmoid,Leaky,,,43,22,21.0,,,0.09622748829641789,2,121,0.7996122506644553,5.321614143494035e-05,123.69669260297503,COMPLETE
1898,0.4930175840854645,2023-09-04 21:56:14.917808,2023-09-04 21:56:20.340872,0 days 00:00:05.423064,Leaky,ReLU,Sigmoid,,36,23,17.0,7.0,,8.73579791573801e-05,3,389,0.5689615264947587,2.2025882919903496e-05,154.41506348048506,COMPLETE
1899,0.4155641496181488,2023-09-04 21:56:20.341390,2023-09-04 21:56:26.288090,0 days 00:00:05.946700,Leaky,Tanh,,,46,21,22.0,,,0.00014050071411604565,2,469,0.7429652899117196,0.0015418360561193808,169.71334959245695,COMPLETE
1900,0.3189065158367157,2023-09-04 21:56:26.288616,2023-09-04 21:56:27.317540,0 days 00:00:01.028924,Leaky,Sigmoid,,,40,23,18.0,,,0.0077491415419833985,2,150,0.7996470624111974,3.626505151166782e-05,142.19625263829386,COMPLETE
1901,0.31336522102355957,2023-09-04 21:56:27.318099,2023-09-04 21:56:27.900304,0 days 00:00:00.582205,Leaky,ReLU,,,49,24,20.0,,,0.021172177118450188,2,191,0.700523224363768,0.0004556424071412254,646.8821775855088,COMPLETE
1902,0.5579046607017517,2023-09-04 21:56:27.900816,2023-09-04 21:56:32.961769,0 days 00:00:05.060953,Tanh,ReLU,,,34,22,23.0,,,1.3232213914132625e-05,2,366,0.6482184281513987,1.7189629683502647e-05,179.16898510625452,COMPLETE
1903,0.7921649813652039,2023-09-04 21:56:32.962271,2023-09-04 21:56:33.288741,0 days 00:00:00.326470,Leaky,Sigmoid,,,37,19,22.0,,,0.01467877229607286,2,202,0.2455925946867958,0.04909148980315377,164.30820632562404,COMPLETE
1904,0.5086733102798462,2023-09-04 21:56:33.289258,2023-09-04 21:56:33.603201,0 days 00:00:00.313943,Leaky,Tanh,,,44,21,21.0,,,0.010862236086583162,2,134,0.11758926859533257,2.630560441647475e-05,696.1181552593524,COMPLETE
1905,0.3255990445613861,2023-09-04 21:56:33.603734,2023-09-04 21:56:34.996948,0 days 00:00:01.393214,Leaky,ReLU,,,41,20,20.0,,,0.0036481266252729556,2,240,0.7500456697253386,1.1929887743235802e-05,131.65856162623356,COMPLETE
1906,0.6579342484474182,2023-09-04 21:56:34.997501,2023-09-04 21:56:35.514780,0 days 00:00:00.517279,Leaky,Sigmoid,,,30,23,24.0,,,0.005307206643496579,2,157,0.6101122602501038,0.03389507787631831,139.939300264631,COMPLETE
1907,0.3767505884170532,2023-09-04 21:56:35.515298,2023-09-04 21:56:35.912579,0 days 00:00:00.397281,Leaky,ReLU,,,38,22,16.0,,,0.006839001721557867,2,311,0.29653533623720263,0.00030882171349385637,127.79103024800618,COMPLETE
1908,0.3540826439857483,2023-09-04 21:56:35.913094,2023-09-04 21:56:36.489090,0 days 00:00:00.575996,Leaky,Tanh,,,33,24,19.0,,,0.008815328331270298,2,180,0.39695757422362016,0.00024093010181468216,153.9062734750601,COMPLETE
1909,0.42638900876045227,2023-09-04 21:56:36.489585,2023-09-04 21:56:37.086278,0 days 00:00:00.596693,Leaky,ReLU,,,39,21,22.0,,,0.002557234967500263,2,215,0.19260663913638673,0.0006631178026926382,231.62256167011876,COMPLETE
1910,0.426233172416687,2023-09-04 21:56:37.086770,2023-09-04 21:56:37.368765,0 days 00:00:00.281995,Leaky,Leaky,,,42,24,17.0,,,0.017570380219356974,2,355,0.1816600648503265,0.0003635455872412323,179.7302309119183,COMPLETE
1911,0.3818068206310272,2023-09-04 21:56:37.369264,2023-09-04 21:56:38.512421,0 days 00:00:01.143157,Tanh,Sigmoid,,,35,23,23.0,,,0.011517534735648148,2,269,0.7223426314179343,0.0028532990993170733,144.40190288837138,COMPLETE
