number,value,datetime_start,datetime_complete,duration,params_activation1,params_activation2,params_activation3,params_activation4,params_batch_size,params_fl1,params_fl2,params_fl3,params_fl4,params_learning_rate,params_n_layers,params_num_epochs,params_train_size,params_weight_decay,user_attrs_mre,state
763,0.5286622047424316,2023-09-04 21:30:20.161605,2023-09-04 21:30:28.221562,0 days 00:00:08.059957,Leaky,Tanh,ReLU,,44,24,14.0,7.0,,6.617521075490808e-05,3,247,0.5201917182719812,2.220338300549859e-05,150.11569430084847,COMPLETE
764,0.8130162954330444,2023-09-04 21:30:28.222235,2023-09-04 21:30:32.029124,0 days 00:00:03.806889,Leaky,ReLU,,,71,22,20.0,,,2.3561222080078723e-05,2,137,0.7244052479448474,0.00013002762991794848,172.4486098463518,COMPLETE
765,0.6461431980133057,2023-09-04 21:30:32.029781,2023-09-04 21:30:37.695623,0 days 00:00:05.665842,Leaky,Sigmoid,,,97,23,22.0,,,4.7754974714431174e-05,2,276,0.6636757279222276,0.003386035197970278,117.39221470597862,COMPLETE
766,0.5704938769340515,2023-09-04 21:30:37.696294,2023-09-04 21:30:42.481682,0 days 00:00:04.785388,Leaky,Tanh,,,93,24,17.0,,,6.202086680725781e-05,2,200,0.7454755163060369,0.003193577909870899,180.8182936859131,COMPLETE
767,0.6158744096755981,2023-09-04 21:30:42.482346,2023-09-04 21:31:09.712870,0 days 00:00:27.230524,Leaky,Sigmoid,,,23,21,16.0,,,1.3102197838820778e-05,2,449,0.7036107590571462,0.0002653169968105477,212.07772528089765,COMPLETE
768,0.42248812317848206,2023-09-04 21:31:09.713541,2023-09-04 21:31:10.626646,0 days 00:00:00.913105,Tanh,ReLU,,,39,23,18.0,,,0.049298307795583515,2,160,0.3191855342138642,1.1678868786412729e-05,199.8900778127271,COMPLETE
769,0.6744358539581299,2023-09-04 21:31:10.627304,2023-09-04 21:31:16.154201,0 days 00:00:05.526897,Leaky,Tanh,Leaky,Leaky,68,22,21.0,3.0,12.0,0.00010432660339854798,4,180,0.5894548271227572,8.557640309682744e-05,187.76527726915148,COMPLETE
770,0.3845711648464203,2023-09-04 21:31:16.154916,2023-09-04 21:31:16.833699,0 days 00:00:00.678783,Leaky,Sigmoid,,,74,24,19.0,,,0.01394625343262961,2,461,0.2274970640514103,1.5557964410925638e-05,287.8519687652588,COMPLETE
771,0.33288633823394775,2023-09-04 21:31:16.834410,2023-09-04 21:31:19.432169,0 days 00:00:02.597759,Leaky,ReLU,,,32,23,20.0,,,0.01026436556385344,2,307,0.7991808057018094,3.564687408160514e-05,137.2845567743829,COMPLETE
772,0.5958309173583984,2023-09-04 21:31:19.432845,2023-09-04 21:31:19.717942,0 days 00:00:00.285097,Leaky,Sigmoid,,,43,23,19.0,,,0.08828420305525603,2,332,0.1078756465622121,0.00046063288290092646,214.7251007080078,COMPLETE
773,0.3560921251773834,2023-09-04 21:31:19.718604,2023-09-04 21:31:21.675271,0 days 00:00:01.956667,Leaky,Tanh,,,56,20,20.0,,,0.006696415906778178,2,485,0.6315075202191358,2.5655196182200423e-05,137.03240374664762,COMPLETE
774,0.3623226583003998,2023-09-04 21:31:21.675972,2023-09-04 21:31:23.032357,0 days 00:00:01.356385,Tanh,ReLU,,,86,22,18.0,,,0.005596419462754439,2,320,0.3270858987717417,0.0016443884533813317,179.4859940003012,COMPLETE
775,0.3125465512275696,2023-09-04 21:31:23.033035,2023-09-04 21:31:25.100570,0 days 00:00:02.067535,Leaky,Sigmoid,ReLU,ReLU,91,24,17.0,20.0,10.0,0.015593956462974299,4,150,0.7662945157149553,0.00014872392760060393,170.319106500799,COMPLETE
776,0.9296042323112488,2023-09-04 21:31:25.101276,2023-09-04 21:31:27.854611,0 days 00:00:02.753335,Sigmoid,Tanh,,,37,23,21.0,,,1.544188213578524e-05,2,97,0.4530020649626682,0.0024848044663964225,136.13362160908807,COMPLETE
777,0.4411182105541229,2023-09-04 21:31:27.855302,2023-09-04 21:31:28.730679,0 days 00:00:00.875377,Leaky,Sigmoid,,,34,24,19.0,,,0.01140891869365528,2,216,0.1615607151477389,1.9725328522622383e-05,144.40858033124138,COMPLETE
778,0.4572272300720215,2023-09-04 21:31:28.731360,2023-09-04 21:31:29.905884,0 days 00:00:01.174524,Leaky,ReLU,,,40,15,20.0,,,0.004306371288662103,2,130,0.1730026501016232,0.000672878878426015,350.6475539861941,COMPLETE
779,0.4605647623538971,2023-09-04 21:31:29.906564,2023-09-04 21:31:30.317429,0 days 00:00:00.410865,Leaky,Tanh,,,78,21,18.0,,,0.02436274550785617,2,407,0.1343493632921675,0.001026855479205848,149.78182248716,COMPLETE
780,0.38383811712265015,2023-09-04 21:31:30.318120,2023-09-04 21:31:31.400930,0 days 00:00:01.082810,ReLU,Sigmoid,,,58,22,21.0,,,0.01994199387426559,2,292,0.7210426201193496,0.0003640973851849947,137.79911927253968,COMPLETE
781,0.3483460247516632,2023-09-04 21:31:31.401594,2023-09-04 21:31:32.945468,0 days 00:00:01.543874,Leaky,Leaky,,,52,23,19.0,,,0.0078084684028022705,2,167,0.6847589851552552,1.2133246017350914e-05,118.04612599248472,COMPLETE
782,0.7169522643089294,2023-09-04 21:31:32.946151,2023-09-04 21:31:38.781137,0 days 00:00:05.834986,Tanh,ReLU,Sigmoid,Tanh,65,24,22.0,9.0,3.0,4.291156735743351e-05,4,141,0.752729632703276,5.4310262244781304e-05,115.8767364177298,COMPLETE
783,0.4457035958766937,2023-09-04 21:31:38.781832,2023-09-04 21:31:39.182985,0 days 00:00:00.401153,Leaky,Tanh,,,97,24,15.0,,,0.009353914982374475,2,118,0.1232224514022072,0.00019250835344517111,141.08006119728088,COMPLETE
784,0.4816378355026245,2023-09-04 21:31:39.183668,2023-09-04 21:31:39.761158,0 days 00:00:00.577490,Leaky,Sigmoid,,,36,23,16.0,,,0.05774315953259145,2,392,0.1336130209357252,1.6414849452353078e-05,636.9081488037109,COMPLETE
785,0.50313401222229,2023-09-04 21:31:39.761825,2023-09-04 21:31:40.049685,0 days 00:00:00.287860,Leaky,ReLU,,,72,22,17.0,,,0.013079674477777218,2,173,0.13034922596980839,0.00010738753201832548,205.63089990615845,COMPLETE
786,0.44203099608421326,2023-09-04 21:31:40.050353,2023-09-04 21:31:40.778184,0 days 00:00:00.727831,Leaky,Tanh,,,42,20,19.0,,,0.017705732456358387,2,356,0.18666088503670825,2.9342614430357146e-05,148.19983017235472,COMPLETE
787,0.31565916538238525,2023-09-04 21:31:40.778856,2023-09-04 21:31:43.257470,0 days 00:00:02.478614,Leaky,Sigmoid,,,81,21,24.0,,,0.006030645489349206,2,156,0.7756331852652711,1.4369288937186787e-05,152.99618487887912,COMPLETE
788,0.39755815267562866,2023-09-04 21:31:43.258146,2023-09-04 21:31:44.233314,0 days 00:00:00.975168,Leaky,Sigmoid,,,95,23,20.0,,,0.010025103073299915,2,426,0.2122917166990194,7.781068712700745e-05,139.1395322311023,COMPLETE
789,0.5615131258964539,2023-09-04 21:31:44.233989,2023-09-04 21:31:55.953680,0 days 00:00:11.719691,Tanh,Tanh,,,27,23,18.0,,,5.111642074386151e-05,2,193,0.7997816591571851,1.1309491368661904e-05,285.0550706300093,COMPLETE
790,0.4801701307296753,2023-09-04 21:31:55.954354,2023-09-04 21:31:56.608780,0 days 00:00:00.654426,Leaky,ReLU,,,60,22,13.0,,,0.007658964060608959,2,369,0.14518974629663828,2.1380771496631068e-05,433.82580170074067,COMPLETE
791,0.31785503029823303,2023-09-04 21:31:56.609469,2023-09-04 21:31:59.139738,0 days 00:00:02.530269,Leaky,Sigmoid,ReLU,Sigmoid,75,24,14.0,19.0,15.0,0.012067005612949815,4,179,0.7373608826539915,0.00029708966279560513,139.14118889196595,COMPLETE
792,0.5980454683303833,2023-09-04 21:31:59.140448,2023-09-04 21:31:59.577282,0 days 00:00:00.436834,Leaky,Tanh,,,46,24,16.0,,,0.0036714613318272376,2,142,0.12798809913440232,0.04095766887592855,233.57108270554315,COMPLETE
793,0.42600706219673157,2023-09-04 21:31:59.577960,2023-09-04 21:32:00.862697,0 days 00:00:01.284737,Leaky,,,,38,10,,,,0.014822471208212068,1,285,0.6609516863780099,1.003563306001303e-05,9378.167626953125,COMPLETE
794,0.36092934012413025,2023-09-04 21:32:00.863345,2023-09-04 21:32:03.988243,0 days 00:00:03.124898,Leaky,ReLU,ReLU,,100,18,19.0,16.0,,0.0017600712056391706,3,148,0.5709867810117689,6.317376801739314e-05,227.69111612680797,COMPLETE
795,0.48308974504470825,2023-09-04 21:32:03.988935,2023-09-04 21:32:21.411433,0 days 00:00:17.422498,Tanh,Sigmoid,,,44,23,20.0,,,9.952013629803584e-05,2,476,0.7012060998095374,4.156293567381164e-05,190.3334440183239,COMPLETE
796,0.4977417588233948,2023-09-04 21:32:21.412118,2023-09-04 21:32:24.083598,0 days 00:00:02.671480,Leaky,Tanh,,,41,21,21.0,,,0.00027627437343013606,2,382,0.11331584452463626,0.004599741808549236,179.0280429780171,COMPLETE
797,0.34147337079048157,2023-09-04 21:32:24.084285,2023-09-04 21:32:27.239503,0 days 00:00:03.155218,Leaky,ReLU,,,88,22,17.0,,,0.004489077610834078,2,398,0.7440892644893228,0.00023339438339404204,265.4996942187112,COMPLETE
798,0.3212619125843048,2023-09-04 21:32:27.240186,2023-09-04 21:32:29.525613,0 days 00:00:02.285427,Leaky,Sigmoid,,,77,24,18.0,,,0.00892357787306434,2,131,0.7159167202685851,0.0001652713638829522,2720.355988625919,COMPLETE
799,0.32805347442626953,2023-09-04 21:32:29.526280,2023-09-04 21:32:30.842659,0 days 00:00:01.316379,Leaky,Tanh,,,96,23,23.0,,,0.038417548488552326,2,209,0.7715693785267106,0.0005212840976662763,181.81912139892577,COMPLETE
800,0.33613771200180054,2023-09-04 21:32:30.843338,2023-09-04 21:32:31.791780,0 days 00:00:00.948442,Leaky,Sigmoid,,,69,24,22.0,,,0.022060848687068067,2,161,0.6834317214325145,2.583083813733169e-05,148.31879138946533,COMPLETE
801,0.44654232263565063,2023-09-04 21:32:31.792460,2023-09-04 21:32:32.886243,0 days 00:00:01.093783,Tanh,ReLU,Leaky,,30,8,20.0,17.0,,0.028773474112682683,3,166,0.34113912277544844,0.003009400491370342,251.03599964488637,COMPLETE
802,0.4103811979293823,2023-09-04 21:32:32.886923,2023-09-04 21:32:40.945942,0 days 00:00:08.059019,Sigmoid,Sigmoid,,,49,22,18.0,,,0.0012555929958110526,2,267,0.6277698031085608,0.0001239866433796816,136.50441430481186,COMPLETE
803,0.3468887209892273,2023-09-04 21:32:40.946605,2023-09-04 21:32:43.114359,0 days 00:00:02.167754,Leaky,Tanh,,,92,22,19.0,,,0.0023679570354470623,2,414,0.7436218425505782,0.0008891447785215506,174.46999402977954,COMPLETE
804,0.6169907450675964,2023-09-04 21:32:43.115030,2023-09-04 21:32:48.981003,0 days 00:00:05.865973,Leaky,ReLU,Tanh,Sigmoid,35,1,15.0,10.0,14.0,0.000818096028582179,4,295,0.7996157864616241,1.4214196398391499e-05,1034.5144456463095,COMPLETE
805,0.4545139968395233,2023-09-04 21:32:48.981707,2023-09-04 21:32:49.586382,0 days 00:00:00.604675,ReLU,Sigmoid,,,98,23,17.0,,,0.006644594202348634,2,107,0.13079248683437877,3.521485816326048e-05,242.94056808614286,COMPLETE
806,0.4923834502696991,2023-09-04 21:32:49.587067,2023-09-04 21:32:50.705163,0 days 00:00:01.118096,Leaky,Leaky,,,43,21,20.0,,,0.011120166814947145,2,311,0.1576356662748911,0.008798074866079138,181.0526066655698,COMPLETE
807,0.30528005957603455,2023-09-04 21:32:50.705830,2023-09-04 21:32:52.828242,0 days 00:00:02.122412,Leaky,Tanh,,,39,24,16.0,,,0.015695562493193416,2,184,0.6594867801851102,1.694359911243851e-05,376.3138585973669,COMPLETE
808,0.9284141659736633,2023-09-04 21:32:52.828924,2023-09-04 21:32:53.244201,0 days 00:00:00.415277,Leaky,Sigmoid,,,83,23,19.0,,,0.018742506373037378,2,122,0.7164929946501377,0.07759167584837434,106.56590779622395,COMPLETE
809,0.6941816210746765,2023-09-04 21:32:53.244897,2023-09-04 21:32:54.065987,0 days 00:00:00.821090,Leaky,ReLU,,,54,24,21.0,,,0.005288574310760089,2,138,0.7696117822673857,0.07059472503598488,132.1614284515381,COMPLETE
810,0.6111855506896973,2023-09-04 21:32:54.066697,2023-09-04 21:32:55.178468,0 days 00:00:01.111771,Tanh,Tanh,,,73,23,18.0,,,0.013137756966779886,2,435,0.687234244980207,0.02908422499654526,152.85542610364084,COMPLETE
811,0.3353615999221802,2023-09-04 21:32:55.179146,2023-09-04 21:32:58.920794,0 days 00:00:03.741648,Leaky,Sigmoid,,,62,22,20.0,,,0.007938109952188537,2,276,0.7450691511164842,1.2596504057013567e-05,120.6425510053875,COMPLETE
812,0.5078191757202148,2023-09-04 21:32:58.921471,2023-09-04 21:33:10.160975,0 days 00:00:11.239504,Leaky,ReLU,ReLU,Sigmoid,75,24,19.0,15.0,4.0,0.00018675816440506235,4,469,0.47189675036500506,9.345337648980148e-05,148.60957107055924,COMPLETE
813,0.34715428948402405,2023-09-04 21:33:10.161703,2023-09-04 21:33:11.552724,0 days 00:00:01.391021,Leaky,Tanh,,,40,23,17.0,,,0.03455307005426173,2,151,0.7081074525637596,1.9380905318550124e-05,373.5839042663574,COMPLETE
814,0.5841770768165588,2023-09-04 21:33:11.553414,2023-09-04 21:33:15.514360,0 days 00:00:03.960946,Leaky,Sigmoid,,,45,24,21.0,,,8.379671133529009e-05,2,175,0.4171061528656928,0.0006769013235467506,121.93043151855468,COMPLETE
815,0.34712526202201843,2023-09-04 21:33:15.515066,2023-09-04 21:33:16.688643,0 days 00:00:01.173577,Leaky,ReLU,,,80,22,18.0,,,0.009957183085083357,2,452,0.5472320227538502,4.566492793620479e-05,124.74496023995536,COMPLETE
816,0.4087238907814026,2023-09-04 21:33:16.689335,2023-09-04 21:33:22.703802,0 days 00:00:06.014467,Tanh,Tanh,,,47,21,23.0,,,0.000346006826967403,2,156,0.7634638945714542,0.0001926167399077269,142.53627160879282,COMPLETE
817,0.31228575110435486,2023-09-04 21:33:22.704493,2023-09-04 21:33:24.723300,0 days 00:00:02.018807,Leaky,Sigmoid,,,85,23,20.0,,,0.011791845587395666,2,192,0.6196884774695699,0.00041859114013999407,147.87582919908607,COMPLETE
818,1.033332347869873,2023-09-04 21:33:24.723985,2023-09-04 21:33:24.988303,0 days 00:00:00.264318,Leaky,Sigmoid,Sigmoid,Leaky,36,20,16.0,22.0,13.0,0.006839794745436761,4,201,0.10329256877635568,0.004703185034234832,126.5130545876243,COMPLETE
819,0.31250888109207153,2023-09-04 21:33:24.989011,2023-09-04 21:33:25.840067,0 days 00:00:00.851056,Leaky,Tanh,,,98,24,24.0,,,0.016665240307226124,2,388,0.7263280172533786,2.4509513897617655e-05,174.59975934028625,COMPLETE
820,0.55918288230896,2023-09-04 21:33:25.840751,2023-09-04 21:33:26.290073,0 days 00:00:00.449322,Leaky,ReLU,,,94,23,19.0,,,0.009178241786060642,2,133,0.11255020342171845,1.1469186381886009e-05,239.24465370178223,COMPLETE
821,0.43881455063819885,2023-09-04 21:33:26.290759,2023-09-04 21:33:29.396161,0 days 00:00:03.105402,Leaky,Sigmoid,,,66,19,18.0,,,0.0009826638013360916,2,143,0.5295326359735765,0.0017824341255793508,139.72223625983392,COMPLETE
822,0.40393397212028503,2023-09-04 21:33:29.396858,2023-09-04 21:33:31.320429,0 days 00:00:01.923571,Leaky,Tanh,,,41,21,17.0,,,0.005126321885361437,2,404,0.28758171521210346,0.0011527713128825696,301.5994034513421,COMPLETE
823,0.6344808340072632,2023-09-04 21:33:31.321130,2023-09-04 21:33:37.734622,0 days 00:00:06.413492,Tanh,ReLU,,,38,24,19.0,,,2.048512790733218e-05,2,165,0.6615636294374548,0.00341533579349244,126.324365234375,COMPLETE
824,0.49896490573883057,2023-09-04 21:33:37.735308,2023-09-04 21:33:38.309138,0 days 00:00:00.573830,Leaky,Sigmoid,Tanh,ReLU,50,22,22.0,23.0,7.0,0.023820928664003406,4,91,0.2013836671209022,0.0014914857115657203,1338.7588953653972,COMPLETE
825,0.47313567996025085,2023-09-04 21:33:38.309867,2023-09-04 21:33:38.774496,0 days 00:00:00.464629,Leaky,Tanh,,,71,23,21.0,,,0.014517193527600994,2,440,0.19448224928241048,0.004368486689725629,142.75128520618784,COMPLETE
826,0.6847057342529297,2023-09-04 21:33:38.775171,2023-09-04 21:33:46.273644,0 days 00:00:07.498473,Sigmoid,ReLU,,,33,24,20.0,,,3.6653093154004777e-05,2,290,0.37984395978885765,3.0631639018908106e-05,162.15486058202282,COMPLETE
827,0.5442984104156494,2023-09-04 21:33:46.274337,2023-09-04 21:33:47.671638,0 days 00:00:01.397301,Leaky,Sigmoid,,,100,22,19.0,,,0.0007544169762808991,2,116,0.35038005463312044,0.006508297224913876,180.6868650502172,COMPLETE
828,0.3877868950366974,2023-09-04 21:33:47.672332,2023-09-04 21:33:49.086220,0 days 00:00:01.413888,Leaky,Tanh,,,43,23,18.0,,,0.00799610488363015,2,421,0.44405359453417076,0.0001443551050163423,231.859044958044,COMPLETE
829,0.6224246025085449,2023-09-04 21:33:49.086902,2023-09-04 21:33:52.481987,0 days 00:00:03.395085,ReLU,,,,77,21,,,,4.6500797387879696e-05,1,149,0.7685551034994139,0.0003301016588634479,159.16688486393667,COMPLETE
830,0.3246162533760071,2023-09-04 21:33:52.482659,2023-09-04 21:33:56.399335,0 days 00:00:03.916676,Leaky,Sigmoid,,,96,24,16.0,,,0.006014098031588747,2,300,0.6858742635207287,0.00010685691156902756,106.83244073655871,COMPLETE
831,0.4079184830188751,2023-09-04 21:33:56.400032,2023-09-04 21:33:58.180967,0 days 00:00:01.780935,Tanh,Leaky,,,41,23,14.0,,,0.002792245681405646,2,128,0.2787774601628752,1.6594890799570413e-05,243.39925384521484,COMPLETE
832,0.44511333107948303,2023-09-04 21:33:58.181669,2023-09-04 21:34:01.397178,0 days 00:00:03.215509,Leaky,ReLU,ReLU,Sigmoid,38,22,15.0,7.0,2.0,0.011302798388272951,4,234,0.7318881121745006,7.413265679232177e-05,1600.1588709904597,COMPLETE
833,0.6013106107711792,2023-09-04 21:34:01.397886,2023-09-04 21:34:02.038979,0 days 00:00:00.641093,Leaky,Tanh,Tanh,,90,23,2.0,14.0,,0.004000644141268078,3,172,0.11785637583417545,0.020503123623816493,222.12626436441252,COMPLETE
834,0.593821108341217,2023-09-04 21:34:02.039693,2023-09-04 21:34:02.842699,0 days 00:00:00.803006,Leaky,Sigmoid,,,45,6,17.0,,,0.019463614865606174,2,185,0.48451306713895076,0.017781818718462426,203.02418631094474,COMPLETE
835,0.46019795536994934,2023-09-04 21:34:02.843374,2023-09-04 21:34:05.019362,0 days 00:00:02.175988,Leaky,ReLU,,,92,24,19.0,,,0.00042114770031334727,2,376,0.14947239986640073,1.377459622122811e-05,1024.411168402814,COMPLETE
836,0.3505227863788605,2023-09-04 21:34:05.020078,2023-09-04 21:34:06.245520,0 days 00:00:01.225442,Leaky,Sigmoid,,,74,24,20.0,,,0.012465768730284406,2,490,0.5861855333365507,0.00022432938707120882,125.9213581459195,COMPLETE
837,0.3332176208496094,2023-09-04 21:34:06.246213,2023-09-04 21:34:07.469826,0 days 00:00:01.223613,Leaky,Tanh,,,78,22,20.0,,,0.008629969117976982,2,157,0.7697000419584987,2.108031578158193e-05,135.25172530280219,COMPLETE
838,0.40327104926109314,2023-09-04 21:34:07.470507,2023-09-04 21:34:13.673882,0 days 00:00:06.203375,Tanh,ReLU,,,40,23,18.0,,,0.0033053986753114905,2,137,0.7994244732854475,0.00957005239164781,192.25041744482778,COMPLETE
839,0.3769749701023102,2023-09-04 21:34:13.674578,2023-09-04 21:34:15.066815,0 days 00:00:01.392237,Leaky,Sigmoid,,,43,20,21.0,,,0.014303420915640304,2,281,0.5042897705499945,0.000557798929042126,209.89184213191905,COMPLETE
840,0.6372540593147278,2023-09-04 21:34:15.067505,2023-09-04 21:34:17.644713,0 days 00:00:02.577208,Leaky,Tanh,,,69,21,18.0,,,5.940185609273217e-05,2,399,0.13520731315552198,0.0007474555040534069,150.3577070116698,COMPLETE
841,0.3459290564060211,2023-09-04 21:34:17.645446,2023-09-04 21:34:19.936234,0 days 00:00:02.290788,Leaky,Sigmoid,,,36,24,19.0,,,0.006837958769648544,2,165,0.6443105978764082,1.1790518056184454e-05,157.62031718662806,COMPLETE
842,0.41123801469802856,2023-09-04 21:34:19.936908,2023-09-04 21:34:26.045451,0 days 00:00:06.108543,Leaky,ReLU,,,99,23,20.0,,,0.00024488009779130327,2,460,0.39421844345610085,5.120415239646356e-05,121.81551616502844,COMPLETE
843,0.3161625266075134,2023-09-04 21:34:26.046146,2023-09-04 21:34:28.398807,0 days 00:00:02.352661,Leaky,Tanh,Leaky,Tanh,95,12,22.0,6.0,11.0,0.010901637284963874,4,307,0.7108895992942436,0.0024575305915000784,222.86515482584636,COMPLETE
844,0.2924547493457794,2023-09-04 21:34:28.399529,2023-09-04 21:34:30.089857,0 days 00:00:01.690328,Tanh,Sigmoid,,,87,22,23.0,,,0.017306528981920727,2,180,0.7442816966418477,0.0002826433174651992,151.7583830356598,COMPLETE
845,0.3134806752204895,2023-09-04 21:34:30.090544,2023-09-04 21:34:30.950565,0 days 00:00:00.860021,Tanh,Sigmoid,,,87,22,24.0,,,0.020752218079566183,2,170,0.7456174782997753,0.0003131307080341617,195.29189060756138,COMPLETE
846,0.5990940928459167,2023-09-04 21:34:30.950948,2023-09-04 21:34:31.425229,0 days 00:00:00.474281,Tanh,ReLU,,,86,22,23.0,,,0.00015865630940416306,2,178,0.1683283619238573,0.00021293020941802094,235.9715847915478,COMPLETE
847,0.5229453444480896,2023-09-04 21:34:31.425605,2023-09-04 21:34:31.576619,0 days 00:00:00.151014,Tanh,Tanh,,,88,22,24.0,,,0.016937333720581066,2,156,0.10956241820139488,0.0002764700870691784,404.5005364668997,COMPLETE
848,0.36860471963882446,2023-09-04 21:34:31.576998,2023-09-04 21:34:32.241011,0 days 00:00:00.664013,Tanh,Sigmoid,,,82,7,23.0,,,0.028068430383960626,2,254,0.7700123943307042,0.0002382833248044593,246.83276278730753,COMPLETE
849,0.4067743718624115,2023-09-04 21:34:32.241397,2023-09-04 21:34:32.559804,0 days 00:00:00.318407,Tanh,Tanh,,,88,22,24.0,,,0.023737161446834597,2,145,0.7995260639894376,0.00026207545151247396,277.31974161082303,COMPLETE
850,0.36715713143348694,2023-09-04 21:34:32.560230,2023-09-04 21:34:33.133325,0 days 00:00:00.573095,Tanh,ReLU,,,85,21,23.0,,,0.018942580719439425,2,365,0.7428813940713171,0.000488019221483491,158.45407257080078,COMPLETE
851,0.34342071413993835,2023-09-04 21:34:33.133719,2023-09-04 21:34:33.655293,0 days 00:00:00.521574,Tanh,Sigmoid,,,84,23,22.0,,,0.0164871847767012,2,167,0.723257584562813,0.00017746314826582105,149.99273463657923,COMPLETE
852,0.5307541489601135,2023-09-04 21:34:33.655693,2023-09-04 21:34:34.310720,0 days 00:00:00.655027,Tanh,Sigmoid,ReLU,,87,22,23.0,21.0,,0.0005067667727058694,3,159,0.24951322228456466,0.00031279379289422804,250.92207749084858,COMPLETE
853,0.5715367794036865,2023-09-04 21:34:34.311111,2023-09-04 21:34:37.162900,0 days 00:00:02.851789,Tanh,Tanh,,,87,23,23.0,,,1.2088499558207769e-05,2,321,0.7770275955634752,0.00039586031921972676,166.32898681260343,COMPLETE
854,0.3323706388473511,2023-09-04 21:34:37.163267,2023-09-04 21:34:37.727220,0 days 00:00:00.563953,Tanh,ReLU,,,89,23,24.0,,,0.014442488619626995,2,181,0.7475009209146365,0.00012196987719095777,118.27626734766467,COMPLETE
855,0.33552995324134827,2023-09-04 21:34:37.727609,2023-09-04 21:34:38.243951,0 days 00:00:00.516342,Tanh,Sigmoid,Tanh,Sigmoid,84,21,23.0,13.0,5.0,0.021979736587847742,4,391,0.693008758212696,0.0003527506829092305,153.6612240184437,COMPLETE
856,0.44866710901260376,2023-09-04 21:34:38.244347,2023-09-04 21:34:38.410204,0 days 00:00:00.165857,Tanh,Tanh,,,89,22,24.0,,,0.041968878277947035,2,143,0.18458091823536985,0.0001577161530398955,217.96651973280797,COMPLETE
857,0.3422876298427582,2023-09-04 21:34:38.410577,2023-09-04 21:34:39.977141,0 days 00:00:01.566564,Tanh,Leaky,,,91,9,22.0,,,0.004716480006832195,2,413,0.7733627222582087,3.7906714715165976e-05,121.80591382037153,COMPLETE
858,0.3555995523929596,2023-09-04 21:34:39.977593,2023-09-04 21:34:40.347716,0 days 00:00:00.370123,Tanh,ReLU,,,90,24,22.0,,,0.017839321364327303,2,431,0.7167553891076518,2.8905432582049464e-05,132.0420185969426,COMPLETE
