number,value,datetime_start,datetime_complete,duration,params_activation1,params_activation2,params_activation3,params_activation4,params_batch_size,params_fl1,params_fl2,params_fl3,params_fl4,params_learning_rate,params_n_layers,params_num_epochs,params_train_size,params_weight_decay,user_attrs_mre,state
1783,0.2968492805957794,2023-09-04 22:27:08.169199,2023-09-04 22:27:09.495697,0 days 00:00:01.326498,ReLU,Leaky,Leaky,,32,20,19.0,15.0,,0.0035046279490404497,3,411,0.7545047670138926,0.0003324691559317832,88.33873428836945,COMPLETE
1784,0.27391737699508667,2023-09-04 22:27:09.496207,2023-09-04 22:27:10.574134,0 days 00:00:01.077927,ReLU,ReLU,Leaky,,33,21,19.0,15.0,,0.0030820542816445942,3,63,0.7701005188865075,0.00024758571806006414,102.9281757899693,COMPLETE
1785,0.3624403476715088,2023-09-04 22:27:10.574704,2023-09-04 22:27:19.782561,0 days 00:00:09.207857,ReLU,Leaky,Leaky,,32,20,20.0,15.0,,2.4029315296689588e-05,3,398,0.7989898896695998,0.00028057658601625624,113.48785017003965,COMPLETE
1786,0.3361731171607971,2023-09-04 22:27:19.783077,2023-09-04 22:27:20.190291,0 days 00:00:00.407214,ReLU,Sigmoid,Leaky,,29,21,20.0,16.0,,0.00406385957482385,3,414,0.2895169001994522,0.00021489721122746103,138.1603136062622,COMPLETE
1787,0.3415188193321228,2023-09-04 22:27:20.190811,2023-09-04 22:27:21.107723,0 days 00:00:00.916912,ReLU,Leaky,Leaky,,32,21,19.0,15.0,,0.0024972968446416344,3,429,0.7417391948685238,0.0003163826491680836,94.78563131937166,COMPLETE
1788,0.31714752316474915,2023-09-04 22:27:21.108357,2023-09-04 22:27:22.622360,0 days 00:00:01.514003,ReLU,Leaky,Leaky,,35,20,19.0,15.0,,0.0025217492217163517,3,405,0.7652026577831952,0.0002333851551929416,131.4708496314892,COMPLETE
1789,0.3254048228263855,2023-09-04 22:27:22.622865,2023-09-04 22:27:23.530337,0 days 00:00:00.907472,ReLU,ReLU,Leaky,,32,20,20.0,14.0,,0.004297087375416366,3,417,0.7993993686334125,0.0004486362091409707,95.73165728594806,COMPLETE
1790,0.38337257504463196,2023-09-04 22:27:23.530861,2023-09-04 22:27:23.807103,0 days 00:00:00.276242,ReLU,Leaky,Leaky,,37,21,19.0,14.0,,0.0032464740383968075,3,399,0.13060607039193206,1.0004216508288682e-05,114.42766437530517,COMPLETE
1791,0.41046833992004395,2023-09-04 22:27:23.807621,2023-09-04 22:27:24.212585,0 days 00:00:00.404964,ReLU,Sigmoid,Leaky,,33,21,20.0,16.0,,0.003992048176793422,3,396,0.16724922832882613,0.0002787657244391035,112.63862261855812,COMPLETE
1792,0.33602192997932434,2023-09-04 22:27:24.213094,2023-09-04 22:27:24.883308,0 days 00:00:00.670214,ReLU,Leaky,Leaky,,31,20,19.0,15.0,,0.0020703393595494796,3,421,0.3103111433520071,0.0003726377190168055,108.95650646503155,COMPLETE
1793,0.30545976758003235,2023-09-04 22:27:24.883833,2023-09-04 22:27:25.927858,0 days 00:00:01.044025,ReLU,Leaky,Leaky,,30,21,19.0,14.0,,0.002945078483625671,3,408,0.725427207146142,0.0002039456542351088,95.59604466215093,COMPLETE
1794,0.39927127957344055,2023-09-04 22:27:25.928365,2023-09-04 22:27:26.514872,0 days 00:00:00.586507,ReLU,Sigmoid,Leaky,,30,20,20.0,16.0,,0.0036729881362631165,3,433,0.20688605176366356,0.00022389636215609774,4010.3249990609975,COMPLETE
1795,0.36103707551956177,2023-09-04 22:27:26.515374,2023-09-04 22:27:27.014812,0 days 00:00:00.499438,ReLU,Leaky,Leaky,,31,21,19.0,14.0,,0.002643476386475352,3,395,0.27467474788874463,0.00035450465123066136,157.2052402496338,COMPLETE
1796,0.34523797035217285,2023-09-04 22:27:27.015370,2023-09-04 22:27:27.593199,0 days 00:00:00.577829,ReLU,ReLU,Leaky,,34,21,20.0,15.0,,0.004723115263687525,3,404,0.2895341676635419,0.0006019592657886825,126.01611150105795,COMPLETE
1797,0.3904556334018707,2023-09-04 22:27:27.593711,2023-09-04 22:27:28.040715,0 days 00:00:00.447004,ReLU,Leaky,Leaky,,29,20,19.0,15.0,,0.0007479841422317363,3,422,0.1845956002311332,0.0002858204875075756,113.49177275032832,COMPLETE
1798,0.368752658367157,2023-09-04 22:27:28.041249,2023-09-04 22:27:28.379124,0 days 00:00:00.337875,ReLU,Leaky,Leaky,,31,19,20.0,14.0,,0.003110060747707657,3,391,0.1996167806334679,0.00017490292023161611,452.8654098510742,COMPLETE
1799,0.28674742579460144,2023-09-04 22:27:28.379628,2023-09-04 22:27:29.307855,0 days 00:00:00.928227,ReLU,Sigmoid,Leaky,,30,21,21.0,15.0,,0.028219241849133644,3,409,0.7515702486459209,0.00023796916632414997,91.67747106307593,COMPLETE
1800,0.2991842031478882,2023-09-04 22:27:29.308365,2023-09-04 22:27:30.556989,0 days 00:00:01.248624,ReLU,Leaky,Leaky,,27,21,19.0,16.0,,0.004066581381207387,3,393,0.7220884798377533,0.00044806897706174616,88.92856037373446,COMPLETE
1801,0.3900306224822998,2023-09-04 22:27:30.557515,2023-09-04 22:27:31.471618,0 days 00:00:00.914103,ReLU,ReLU,Leaky,,28,21,19.0,14.0,,0.0021842510359558528,3,436,0.7685598533941456,0.00019674424847198558,111.87600729200575,COMPLETE
1802,0.3238557279109955,2023-09-04 22:27:31.472138,2023-09-04 22:27:31.946212,0 days 00:00:00.474074,ReLU,Leaky,Leaky,,28,20,20.0,16.0,,0.045123671970473726,3,413,0.4548456042823967,0.00032380596373147736,122.20728654127855,COMPLETE
1803,0.3682035207748413,2023-09-04 22:27:31.946737,2023-09-04 22:27:32.199234,0 days 00:00:00.252497,ReLU,Leaky,Leaky,,33,20,19.0,15.0,,0.003814380068119909,3,422,0.2218571342028876,0.00026144896730002096,113.23234786987305,COMPLETE
1804,0.3714384138584137,2023-09-04 22:27:32.199858,2023-09-04 22:27:32.956705,0 days 00:00:00.756847,ReLU,Tanh,Leaky,,30,22,19.0,14.0,,0.001915088004808874,3,401,0.3549992162333835,0.0007278546833733372,235.1494855123853,COMPLETE
1805,0.8671277165412903,2023-09-04 22:27:32.957197,2023-09-04 22:27:35.044914,0 days 00:00:02.087717,ReLU,Sigmoid,Leaky,,29,21,18.0,16.0,,1.465401489659453e-05,3,389,0.16454389908026534,0.00038921300580630933,99.93217036779252,COMPLETE
1806,0.35229018330574036,2023-09-04 22:27:35.045416,2023-09-04 22:27:36.248913,0 days 00:00:01.203497,ReLU,Leaky,Leaky,,35,20,13.0,13.0,,0.0008284260663879499,3,415,0.4957571617123873,0.00018121626027133852,103.74880889524897,COMPLETE
1807,0.3207454979419708,2023-09-04 22:27:36.249417,2023-09-04 22:27:36.851813,0 days 00:00:00.602396,ReLU,ReLU,Leaky,,26,21,5.0,15.0,,0.027490439663745345,3,425,0.7465927249593899,0.00022446242756230856,113.15254502069382,COMPLETE
1808,0.42114296555519104,2023-09-04 22:27:36.852319,2023-09-04 22:27:37.164091,0 days 00:00:00.311772,ReLU,Leaky,Sigmoid,,29,22,20.0,14.0,,0.07059554825639941,3,406,0.26711963136864714,0.0004918144934169664,334.57840828273606,COMPLETE
1809,0.33589041233062744,2023-09-04 22:27:37.164590,2023-09-04 22:27:41.453508,0 days 00:00:04.288918,ReLU,Leaky,Leaky,,31,21,19.0,13.0,,2.9602521283504405e-05,3,206,0.771275449068343,0.00032604466939963305,112.88178542053815,COMPLETE
1810,0.4069724977016449,2023-09-04 22:27:41.454000,2023-09-04 22:27:42.507272,0 days 00:00:01.053272,ReLU,Sigmoid,Leaky,,25,22,12.0,15.0,,0.0029242325723013193,3,393,0.7204933637221245,0.03096689651321678,104.28329620361328,COMPLETE
1811,0.2948662340641022,2023-09-04 22:27:42.507779,2023-09-04 22:27:43.752941,0 days 00:00:01.245162,ReLU,Leaky,Leaky,,28,21,14.0,15.0,,0.0010925014431696746,3,388,0.7728425829324646,0.00017269419440182315,102.44286682128906,COMPLETE
1812,0.31979334354400635,2023-09-04 22:27:43.753533,2023-09-04 22:27:44.296023,0 days 00:00:00.542490,ReLU,ReLU,Leaky,,26,22,20.0,16.0,,0.020977546168042368,3,436,0.33193991601383277,1.5507560889747495e-05,106.05879936218261,COMPLETE
1813,0.4249696135520935,2023-09-04 22:27:44.296556,2023-09-04 22:27:44.838796,0 days 00:00:00.542240,ReLU,Leaky,Leaky,,24,20,18.0,6.0,,0.004855156575070534,3,405,0.12112132988244646,0.00026021643377488045,233.10296928108514,COMPLETE
1814,0.2743767499923706,2023-09-04 22:27:44.839344,2023-09-04 22:27:53.463604,0 days 00:00:08.624260,ReLU,Sigmoid,Leaky,,32,21,19.0,14.0,,0.00011825104067957935,3,415,0.7994195286421909,0.0016745193813663124,119.28966479933405,COMPLETE
1815,0.3443987965583801,2023-09-04 22:27:53.464093,2023-09-04 22:27:54.221725,0 days 00:00:00.757632,ReLU,Leaky,ReLU,,27,19,18.0,16.0,,0.03373039753081082,3,398,0.7383140942443593,1.923270632369008e-05,103.29671267805428,COMPLETE
1816,0.3308415412902832,2023-09-04 22:27:54.222223,2023-09-04 22:27:55.268531,0 days 00:00:01.046308,ReLU,Leaky,Leaky,,25,22,21.0,14.0,,0.0018265346033215287,3,384,0.7079095451399976,0.0002079844582402213,92.40372299566502,COMPLETE
1817,0.31552988290786743,2023-09-04 22:27:55.269052,2023-09-04 22:27:56.146912,0 days 00:00:00.877860,ReLU,Leaky,Leaky,,23,19,19.0,13.0,,0.0035977488920548133,3,429,0.7467747518019464,0.00013632568127161407,101.96167322794597,COMPLETE
1818,0.39139196276664734,2023-09-04 22:27:56.147427,2023-09-04 22:27:56.612187,0 days 00:00:00.464760,ReLU,ReLU,Tanh,,30,21,13.0,15.0,,0.05638950196990264,3,411,0.7735168876830257,0.0002873260282287043,130.9670639038086,COMPLETE
1819,0.36457499861717224,2023-09-04 22:27:56.612695,2023-09-04 22:27:57.272719,0 days 00:00:00.660024,ReLU,Sigmoid,Leaky,,33,24,14.0,5.0,,0.0027710354980290714,3,385,0.3248095205998134,0.011979820985387933,117.14215275026717,COMPLETE
1820,0.33795222640037537,2023-09-04 22:27:57.273219,2023-09-04 22:27:57.976598,0 days 00:00:00.703379,ReLU,Leaky,Leaky,,28,23,12.0,12.0,,0.0023475911420434907,3,396,0.35783673912887076,0.002102741443492064,143.16224793025427,COMPLETE
1821,0.3489015996456146,2023-09-04 22:27:57.977103,2023-09-04 22:27:59.009637,0 days 00:00:01.032534,ReLU,Leaky,Leaky,,25,20,20.0,14.0,,0.001203966842678616,3,362,0.79988816477024,0.00038012203826291686,113.02746539645725,COMPLETE
1822,0.36189278960227966,2023-09-04 22:27:59.010136,2023-09-04 22:27:59.508598,0 days 00:00:00.498462,ReLU,Leaky,Leaky,,23,22,9.0,6.0,,0.022701656054385396,3,400,0.3735074937991419,0.024566879447750108,124.29113138133081,COMPLETE
1823,0.33865904808044434,2023-09-04 22:27:59.509104,2023-09-04 22:28:00.388585,0 days 00:00:00.879481,ReLU,Sigmoid,Leaky,,27,21,18.0,23.0,,0.04030288057796423,3,428,0.7220325714488596,0.0005660636113885805,109.08091408865792,COMPLETE
1824,0.40408021211624146,2023-09-04 22:28:00.389091,2023-09-04 22:28:00.618277,0 days 00:00:00.229186,ReLU,ReLU,Leaky,,39,21,19.0,24.0,,0.08160262237559934,3,420,0.1527594328232294,0.006372713707706137,241.99895653357873,COMPLETE
1825,0.34619662165641785,2023-09-04 22:28:00.618797,2023-09-04 22:28:01.437136,0 days 00:00:00.818339,ReLU,Leaky,Leaky,,23,22,20.0,13.0,,0.005260263169565083,3,365,0.4004173498982109,0.00015628027118167723,198.2754391140408,COMPLETE
1826,0.6685734391212463,2023-09-04 22:28:01.437638,2023-09-04 22:28:05.881975,0 days 00:00:04.444337,ReLU,Tanh,ReLU,,29,24,19.0,15.0,,1.031025936482521e-05,3,356,0.1961467319088185,0.0011610848169369842,261.24752884768367,COMPLETE
1827,0.3651159703731537,2023-09-04 22:28:05.882485,2023-09-04 22:28:07.213097,0 days 00:00:01.330612,ReLU,Leaky,Leaky,,37,21,18.0,16.0,,0.0008084895880351476,3,380,0.30263471017618687,0.08061811473707416,246.31575116039028,COMPLETE
1828,0.44014424085617065,2023-09-04 22:28:07.213641,2023-09-04 22:28:08.116151,0 days 00:00:00.902510,ReLU,Leaky,Sigmoid,,26,22,18.0,15.0,,0.004452773555360749,3,408,0.749692433794089,0.049322387809556105,129.27664005055146,COMPLETE
1829,0.40564975142478943,2023-09-04 22:28:08.116665,2023-09-04 22:28:08.456934,0 days 00:00:00.340269,ReLU,Sigmoid,Leaky,,23,23,13.0,12.0,,0.017968995744522567,3,351,0.22316183747702734,0.0288448569652396,131.70916513296274,COMPLETE
1830,0.34073981642723083,2023-09-04 22:28:08.457444,2023-09-04 22:28:09.895058,0 days 00:00:01.437614,ReLU,ReLU,Tanh,,31,13,14.0,6.0,,0.0015521671504632722,3,422,0.7648727026746468,0.00819347435001319,96.37755072294776,COMPLETE
1831,0.33526480197906494,2023-09-04 22:28:09.895565,2023-09-04 22:28:19.964415,0 days 00:00:10.068850,ReLU,Leaky,Leaky,,25,15,20.0,14.0,,5.803347262681288e-05,3,394,0.7050643448380507,0.00022676625522188696,99.16113082222317,COMPLETE
1832,0.40815305709838867,2023-09-04 22:28:19.964923,2023-09-04 22:28:20.201165,0 days 00:00:00.236242,ReLU,Leaky,Leaky,,34,20,10.0,15.0,,0.030229338722000974,3,439,0.1816180638578881,0.015328372054474276,146.65025052157316,COMPLETE
1833,0.32233449816703796,2023-09-04 22:28:20.201671,2023-09-04 22:28:20.752483,0 days 00:00:00.550812,ReLU,Sigmoid,Leaky,,27,14,11.0,23.0,,0.02182071454828665,3,366,0.4197083451159207,0.00019305542054908606,104.93063534007354,COMPLETE
1834,0.38109275698661804,2023-09-04 22:28:20.753036,2023-09-04 22:28:21.093980,0 days 00:00:00.340944,ReLU,Leaky,Leaky,,22,20,19.0,16.0,,0.0033898199081975884,3,374,0.14767394285512725,0.0009223197073063329,120.08085205078125,COMPLETE
1835,0.350533664226532,2023-09-04 22:28:21.094498,2023-09-04 22:28:23.208314,0 days 00:00:02.113816,ReLU,Leaky,Leaky,,24,21,19.0,13.0,,0.000600868808600049,3,114,0.7303234034061058,0.004196189092019424,106.42562829880487,COMPLETE
1836,0.44641637802124023,2023-09-04 22:28:23.208820,2023-09-04 22:28:23.711967,0 days 00:00:00.503147,Sigmoid,ReLU,Leaky,,29,10,12.0,24.0,,0.0009179619803656262,3,387,0.2324638433448585,0.00266404528779902,106.1506138194691,COMPLETE
1837,0.4078732132911682,2023-09-04 22:28:23.712478,2023-09-04 22:28:24.423835,0 days 00:00:00.711357,ReLU,Leaky,Leaky,,31,22,20.0,14.0,,0.00026434403056371455,3,403,0.1386956193291389,0.00028582299243474894,113.61549024517034,COMPLETE
1838,0.3480030298233032,2023-09-04 22:28:24.424347,2023-09-04 22:28:25.354434,0 days 00:00:00.930087,ReLU,Sigmoid,ReLU,,27,13,18.0,15.0,,0.002244631393272222,3,417,0.39920587587780826,0.0016383326859232795,118.83157394181437,COMPLETE
1839,0.37437400221824646,2023-09-04 22:28:25.354934,2023-09-04 22:28:25.866101,0 days 00:00:00.511167,ReLU,Leaky,Leaky,,36,10,2.0,12.0,,0.04986570804591349,3,355,0.7674618808403683,0.00010675149352542893,106.60748915238814,COMPLETE
1840,0.36323660612106323,2023-09-04 22:28:25.866596,2023-09-04 22:28:26.241120,0 days 00:00:00.374524,ReLU,Leaky,Leaky,,25,23,21.0,14.0,,0.018852333255610403,3,382,0.26078406894037,2.2907227434522627e-05,100.6785967596646,COMPLETE
1841,0.40830886363983154,2023-09-04 22:28:26.241622,2023-09-04 22:28:29.781146,0 days 00:00:03.539524,ReLU,ReLU,Tanh,,22,24,19.0,15.0,,5.7549947081307944e-05,3,411,0.23085069534937433,0.019649367905075,4847.252030774044,COMPLETE
1842,0.34939274191856384,2023-09-04 22:28:29.781676,2023-09-04 22:28:31.306099,0 days 00:00:01.524423,ReLU,Leaky,Leaky,,29,13,13.0,16.0,,0.002693057186879661,3,368,0.6986308306858797,0.00023451806915023764,111.79951836722238,COMPLETE
1843,0.39490053057670593,2023-09-04 22:28:31.306606,2023-09-04 22:28:33.928242,0 days 00:00:02.621636,ReLU,Sigmoid,Leaky,,24,20,14.0,22.0,,0.00017003948573398415,3,394,0.3353896242876721,0.0006615349304465796,230.86461189814978,COMPLETE
1844,0.4381081163883209,2023-09-04 22:28:33.928742,2023-09-04 22:28:35.782011,0 days 00:00:01.853269,Sigmoid,Leaky,Leaky,,27,19,18.0,5.0,,0.00015821235880329962,3,431,0.17369765717322433,0.010760652907478208,155.3777899234853,COMPLETE
1845,0.25580915808677673,2023-09-04 22:28:35.782507,2023-09-04 22:28:36.946848,0 days 00:00:01.164341,ReLU,Leaky,Leaky,,26,18,19.0,13.0,,0.004896903598294258,3,352,0.7699488980759833,0.00042179303329509737,79.6582294040256,COMPLETE
1846,0.4898410141468048,2023-09-04 22:28:36.947361,2023-09-04 22:28:44.561656,0 days 00:00:07.614295,ReLU,Leaky,Leaky,,33,15,19.0,13.0,,1.2949416443132322e-05,3,352,0.7252509680981474,0.00045839852940427205,109.7855652028864,COMPLETE
1847,0.3591575622558594,2023-09-04 22:28:44.562168,2023-09-04 22:28:45.457798,0 days 00:00:00.895630,ReLU,,,,31,18,,,,0.004954441336995957,1,349,0.7447365517735594,0.00038965884732741773,123.5756599789574,COMPLETE
1848,0.2904084324836731,2023-09-04 22:28:45.458276,2023-09-04 22:28:46.835346,0 days 00:00:01.377070,ReLU,Leaky,Leaky,,29,20,19.0,13.0,,0.004236913234361139,3,346,0.688327456503782,0.0005240977475670138,96.46360421949818,COMPLETE
1849,0.389871746301651,2023-09-04 22:28:46.835853,2023-09-04 22:28:47.078782,0 days 00:00:00.242929,ReLU,Leaky,Leaky,,28,19,19.0,13.0,,0.004665714201442478,3,355,0.12547571807711538,0.0004931118478505555,219.22123091561454,COMPLETE
1850,0.3403463363647461,2023-09-04 22:28:47.079289,2023-09-04 22:28:47.844398,0 days 00:00:00.765109,ReLU,Leaky,Leaky,,26,17,20.0,12.0,,0.004984439483241553,3,345,0.7198089286224976,0.00039973961846160336,114.16718529010642,COMPLETE
1851,0.29189297556877136,2023-09-04 22:28:47.844917,2023-09-04 22:28:49.561805,0 days 00:00:01.716888,ReLU,Leaky,Leaky,,31,18,19.0,13.0,,0.005622717150580243,3,353,0.7503798305075156,0.0004049440278907492,102.07833108669374,COMPLETE
1852,0.45843222737312317,2023-09-04 22:28:49.562301,2023-09-04 22:28:53.124970,0 days 00:00:03.562669,ReLU,Leaky,Sigmoid,,27,21,20.0,12.0,,3.422601578842191e-05,3,357,0.31801390777639055,0.00032616578876872146,108.06437683105469,COMPLETE
1853,0.3046683371067047,2023-09-04 22:28:53.125482,2023-09-04 22:28:54.136152,0 days 00:00:01.010670,ReLU,Leaky,ReLU,,29,20,19.0,13.0,,0.003908867350228158,3,343,0.7694701984134911,0.00047770074738566216,88.08746133199553,COMPLETE
1854,0.29761213064193726,2023-09-04 22:28:54.136670,2023-09-04 22:28:55.521017,0 days 00:00:01.384347,ReLU,Leaky,Leaky,,25,16,19.0,12.0,,0.003454753896014759,3,363,0.7994651968041481,0.00033995242221570166,90.7838192815366,COMPLETE
1855,0.31597965955734253,2023-09-04 22:28:55.521531,2023-09-04 22:28:57.817293,0 days 00:00:02.295762,ReLU,Leaky,Leaky,,23,17,18.0,13.0,,0.0042329344255925,3,345,0.7061981294143146,0.0005569588308263917,109.71591934204102,COMPLETE
1856,0.357860803604126,2023-09-04 22:28:57.818284,2023-09-04 22:29:00.002824,0 days 00:00:02.184540,ReLU,Leaky,Tanh,,22,22,20.0,13.0,,0.005187336854335265,3,355,0.7409802762795625,0.020251276620732173,104.88991526010874,COMPLETE
1857,0.369183212518692,2023-09-04 22:29:00.003325,2023-09-04 22:29:00.383090,0 days 00:00:00.379765,ReLU,Leaky,Leaky,,30,18,19.0,14.0,,0.006034562604063188,3,359,0.25386177364406765,0.014852874063209037,127.46628112792969,COMPLETE
1858,0.3222169280052185,2023-09-04 22:29:00.383597,2023-09-04 22:29:01.705049,0 days 00:00:01.321452,ReLU,Leaky,Leaky,,27,19,18.0,12.0,,0.003667916443750609,3,336,0.683800651609047,0.0003194471698622932,95.60067125956218,COMPLETE
1859,0.5061684250831604,2023-09-04 22:29:01.705563,2023-09-04 22:29:06.169973,0 days 00:00:04.464410,ReLU,Leaky,Leaky,,34,16,19.0,14.0,,1.2801680663420936e-05,3,348,0.5114979029553814,0.0002875560293857724,101.56901175400307,COMPLETE
1860,0.32253995537757874,2023-09-04 22:29:06.170471,2023-09-04 22:29:07.486414,0 days 00:00:01.315943,ReLU,Leaky,Leaky,,25,17,20.0,13.0,,0.0031275048468230706,3,363,0.7726293816355558,0.00041792189660718853,104.82913174836531,COMPLETE
1861,0.3587523102760315,2023-09-04 22:29:07.486943,2023-09-04 22:29:08.121630,0 days 00:00:00.634687,ReLU,Leaky,Leaky,,28,21,19.0,12.0,,0.0058785819100123475,3,338,0.46486098111599766,0.0002484525699795405,122.63844381796348,COMPLETE
1862,0.3500807583332062,2023-09-04 22:29:08.122147,2023-09-04 22:29:08.476785,0 days 00:00:00.354638,ReLU,Leaky,Leaky,,22,20,18.0,11.0,,0.004175922366918415,3,362,0.2115630318562878,0.000757071625537582,112.99834652604729,COMPLETE
1863,0.35638418793678284,2023-09-04 22:29:08.477304,2023-09-04 22:29:09.464788,0 days 00:00:00.987484,ReLU,Leaky,Leaky,,32,19,19.0,14.0,,0.0011314902614675063,3,353,0.5445887323177089,0.0003625379675007257,113.56644189553182,COMPLETE
1864,0.40848401188850403,2023-09-04 22:29:09.465284,2023-09-04 22:29:10.079078,0 days 00:00:00.613794,ReLU,Leaky,ReLU,,24,23,20.0,14.0,,0.0050040567582562935,3,344,0.15145755939535627,0.00017610643612371964,128.8223659808819,COMPLETE
1865,0.369459867477417,2023-09-04 22:29:10.080106,2023-09-04 22:29:10.599484,0 days 00:00:00.519378,ReLU,Leaky,Leaky,,26,18,18.0,14.0,,0.0015787387976772215,3,366,0.1365175906970841,0.00027737951525474644,277.6824990296975,COMPLETE
1866,0.4606646001338959,2023-09-04 22:29:10.599985,2023-09-04 22:29:10.792027,0 days 00:00:00.192042,ReLU,Leaky,Leaky,,29,22,20.0,13.0,,0.09423522761673904,3,350,0.14283384840979252,0.00020379780905771004,220.51683279184195,COMPLETE
1867,0.3597349524497986,2023-09-04 22:29:10.792522,2023-09-04 22:29:11.407097,0 days 00:00:00.614575,ReLU,Leaky,Tanh,,22,22,19.0,13.0,,0.005753067920765821,3,360,0.7195760234745321,0.06617300689292499,93.37953346653988,COMPLETE
1868,0.319649875164032,2023-09-04 22:29:11.407606,2023-09-04 22:29:13.313599,0 days 00:00:01.905993,ReLU,Leaky,Leaky,,49,21,19.0,12.0,,0.0004569615346338281,3,340,0.45638735209533104,0.0034629030685058943,872.8818365300743,COMPLETE
1869,0.47843846678733826,2023-09-04 22:29:13.314102,2023-09-04 22:29:13.585434,0 days 00:00:00.271332,ReLU,Leaky,Leaky,,24,23,21.0,13.0,,0.09477639155568414,3,372,0.1273550828436072,0.00013812420104454326,102.89284871419271,COMPLETE
1870,0.3809666633605957,2023-09-04 22:29:13.585926,2023-09-04 22:29:13.998128,0 days 00:00:00.412202,ReLU,Leaky,Leaky,,26,19,18.0,14.0,,0.0019137062189814873,3,358,0.1879434439672357,0.0054115207857102065,111.74098603621773,COMPLETE
1871,0.3055177628993988,2023-09-04 22:29:13.998630,2023-09-04 22:29:15.937675,0 days 00:00:01.939045,ReLU,Leaky,Leaky,,30,16,19.0,14.0,,0.0006316647825982257,3,346,0.7542517624578613,0.0005343625855279599,96.74215219187182,COMPLETE
1872,0.3899672031402588,2023-09-04 22:29:15.938174,2023-09-04 22:29:16.326879,0 days 00:00:00.388705,ReLU,Leaky,Leaky,,27,14,18.0,15.0,,0.001318540038420791,3,369,0.11747715097824937,0.00036238450846253596,122.18546830362348,COMPLETE
1873,0.30738767981529236,2023-09-04 22:29:16.327386,2023-09-04 22:29:22.469555,0 days 00:00:06.142169,ReLU,Leaky,Sigmoid,,22,21,20.0,12.0,,0.000206232489729359,3,332,0.770856932589441,0.0006628978600372226,88.03216734060793,COMPLETE
1874,0.43790361285209656,2023-09-04 22:29:22.470053,2023-09-04 22:29:24.762150,0 days 00:00:02.292097,ReLU,Leaky,Leaky,,32,20,18.0,15.0,,2.4712814164605312e-05,3,352,0.2239869176523266,0.0004536471900412477,130.43690839680758,COMPLETE
1875,0.3332737684249878,2023-09-04 22:29:24.762653,2023-09-04 22:29:25.285279,0 days 00:00:00.522626,ReLU,Leaky,Leaky,,24,22,19.0,11.0,,0.01593010745540458,3,140,0.35175398070784897,1.7894211827491357e-05,101.98900761323817,COMPLETE
