number,value,datetime_start,datetime_complete,duration,params_activation1,params_activation2,params_activation3,params_activation4,params_batch_size,params_fl1,params_fl2,params_fl3,params_fl4,params_learning_rate,params_n_layers,params_num_epochs,params_train_size,params_weight_decay,user_attrs_mre,state
359,0.4429713785648346,2023-09-04 20:56:48.521513,2023-09-04 20:56:51.656572,0 days 00:00:03.135059,Sigmoid,Leaky,Sigmoid,Sigmoid,16,23,11.0,15.0,19.0,0.0002579459171434003,4,270,0.20330895372780558,1.816925946756397e-05,319.671326107449,COMPLETE
360,0.3829878270626068,2023-09-04 20:56:51.656970,2023-09-04 20:56:55.293439,0 days 00:00:03.636469,ReLU,ReLU,Sigmoid,Tanh,83,22,12.0,13.0,14.0,8.757157256942905e-05,4,336,0.7006283932215835,3.991127922331456e-05,103.93284259523664,COMPLETE
361,0.37014520168304443,2023-09-04 20:56:55.293774,2023-09-04 20:57:17.792735,0 days 00:00:22.498961,Tanh,Sigmoid,Sigmoid,Sigmoid,26,24,11.0,20.0,16.0,0.0001221043813557268,4,349,0.651856307307781,2.0259672773155843e-05,114.48381090574074,COMPLETE
362,0.29454684257507324,2023-09-04 20:57:17.793321,2023-09-04 20:57:19.086331,0 days 00:00:01.293010,Sigmoid,Tanh,Sigmoid,Tanh,91,20,9.0,20.0,15.0,0.052465887160830664,4,245,0.7601773921658482,1.3465200189114437e-05,97.13929025750411,COMPLETE
363,0.2790010869503021,2023-09-04 20:57:19.086925,2023-09-04 20:57:20.835653,0 days 00:00:01.748728,Leaky,Leaky,Sigmoid,Sigmoid,52,12,17.0,21.0,17.0,0.014811410739822825,4,258,0.7257768093830278,1.6144317020485262e-05,89.18619599213471,COMPLETE
364,0.3693840205669403,2023-09-04 20:57:20.836248,2023-09-04 20:57:21.661208,0 days 00:00:00.824960,Leaky,Leaky,Sigmoid,Sigmoid,51,12,16.0,22.0,17.0,0.015175951673152218,4,261,0.33106033798698886,1.58374142391833e-05,114.93472402236041,COMPLETE
365,0.3545449674129486,2023-09-04 20:57:21.661815,2023-09-04 20:57:23.551693,0 days 00:00:01.889878,Sigmoid,Leaky,ReLU,Sigmoid,48,11,17.0,21.0,18.0,0.018941659640317875,4,251,0.4107138691001362,2.3074569725397013e-05,213.4330573448768,COMPLETE
366,0.3144895136356354,2023-09-04 20:57:23.552300,2023-09-04 20:57:24.984535,0 days 00:00:01.432235,Leaky,Leaky,Sigmoid,Sigmoid,52,12,17.0,21.0,19.0,0.025325508836199488,4,388,0.732067121289054,0.0013051063253042997,121.93967641194662,COMPLETE
367,0.32782432436943054,2023-09-04 20:57:24.985114,2023-09-04 20:57:26.216913,0 days 00:00:01.231799,Leaky,Leaky,,,50,12,17.0,,,0.01443126661011013,2,354,0.6935428432248835,1.6947303117530888e-05,90.11793064426732,COMPLETE
368,0.31491658091545105,2023-09-04 20:57:26.217471,2023-09-04 20:57:27.749538,0 days 00:00:01.532067,Leaky,Leaky,Leaky,Sigmoid,45,12,15.0,21.0,17.0,0.03070267596568576,4,276,0.725335245742749,1.2149778272168496e-05,105.94124655887998,COMPLETE
369,0.289140522480011,2023-09-04 20:57:27.750131,2023-09-04 20:57:29.630201,0 days 00:00:01.880070,Leaky,Leaky,Tanh,Sigmoid,38,11,16.0,21.0,16.0,0.011987328410552613,4,260,0.7990652344071091,3.346921658199604e-05,95.42386074723869,COMPLETE
370,0.9764209985733032,2023-09-04 20:57:29.630802,2023-09-04 20:57:30.864714,0 days 00:00:01.233912,Leaky,Sigmoid,Sigmoid,Sigmoid,49,21,17.0,20.0,8.0,0.000327965460084397,4,372,0.7714240369205001,0.004891971152047064,100.26717443051545,COMPLETE
371,0.3878701627254486,2023-09-04 20:57:30.865299,2023-09-04 20:57:32.382270,0 days 00:00:01.516971,Leaky,Leaky,Sigmoid,Sigmoid,52,13,16.0,23.0,10.0,0.002472168141786326,4,398,0.31407093698000216,2.1293445766887244e-05,129.8803507486979,COMPLETE
372,0.384196400642395,2023-09-04 20:57:32.382928,2023-09-04 20:57:33.367952,0 days 00:00:00.985024,ReLU,Sigmoid,Leaky,Sigmoid,35,21,10.0,15.0,14.0,0.016580137576323112,4,290,0.35872682641690123,1.4440420817466425e-05,327.03946685791016,COMPLETE
373,0.31851208209991455,2023-09-04 20:57:33.368553,2023-09-04 20:57:40.072940,0 days 00:00:06.704387,Sigmoid,Leaky,Sigmoid,ReLU,30,21,12.0,22.0,18.0,0.0018648306931456332,4,358,0.6750774989820784,2.571785539890433e-05,117.35512799632792,COMPLETE
374,0.4499816298484802,2023-09-04 20:57:40.073581,2023-09-04 20:57:41.611096,0 days 00:00:01.537515,Sigmoid,,,,95,22,,,,0.0006185396359862537,1,345,0.7458770813473962,1.000044826846645e-05,101.96384459656555,COMPLETE
375,0.3098125457763672,2023-09-04 20:57:41.611655,2023-09-04 20:57:43.381014,0 days 00:00:01.769359,ReLU,Sigmoid,Leaky,Sigmoid,46,10,18.0,20.0,17.0,0.02161686993389458,4,148,0.7190077904885188,1.8126778501822807e-05,94.0697153264826,COMPLETE
376,0.3238472044467926,2023-09-04 20:57:43.381647,2023-09-04 20:57:44.550875,0 days 00:00:01.169228,Sigmoid,Leaky,Sigmoid,Sigmoid,85,20,17.0,19.0,13.0,0.04036370956314807,4,373,0.767949480836286,0.00041794875881279197,112.17358088493347,COMPLETE
377,0.42887082695961,2023-09-04 20:57:44.551498,2023-09-04 20:57:50.698665,0 days 00:00:06.147167,Sigmoid,Sigmoid,ReLU,Sigmoid,25,24,6.0,20.0,16.0,0.0014552202024410738,4,486,0.24335970484044925,3.889968379091243e-05,158.6505889491031,COMPLETE
378,0.3313230276107788,2023-09-04 20:57:50.699255,2023-09-04 20:58:00.044929,0 days 00:00:09.345674,Sigmoid,Sigmoid,Sigmoid,Sigmoid,15,22,13.0,19.0,15.0,0.011782529160146374,4,384,0.6947713020797497,2.7302175276869625e-05,98.1804350789388,COMPLETE
379,0.3243667185306549,2023-09-04 20:58:00.045527,2023-09-04 20:58:01.763200,0 days 00:00:01.717673,ReLU,Leaky,Leaky,Sigmoid,53,19,17.0,21.0,18.0,0.015851517880726352,4,455,0.618645376548062,0.0006581305651781402,98.71037891932896,COMPLETE
380,0.4697614014148712,2023-09-04 20:58:01.763803,2023-09-04 20:58:03.100551,0 days 00:00:01.336748,Sigmoid,Tanh,Sigmoid,ReLU,21,23,11.0,14.0,2.0,0.01014214851888267,4,135,0.14865454664226546,1.2670826446009083e-05,288.2199738066075,COMPLETE
381,0.36290547251701355,2023-09-04 20:58:03.101159,2023-09-04 20:58:04.557575,0 days 00:00:01.456416,Leaky,Sigmoid,Sigmoid,,18,12,16.0,20.0,,0.01912002849074702,3,412,0.41105861613494177,2.0592234712215686e-05,94.19678203876202,COMPLETE
382,1.014117956161499,2023-09-04 20:58:04.558174,2023-09-04 20:58:06.726304,0 days 00:00:02.168130,Sigmoid,Leaky,Leaky,Sigmoid,27,3,18.0,22.0,14.0,0.0032505935879389046,4,362,0.7435039740650385,0.033885563528021134,100.29252014160156,COMPLETE
383,0.3873431980609894,2023-09-04 20:58:06.726901,2023-09-04 20:58:13.342116,0 days 00:00:06.615215,ReLU,Sigmoid,Sigmoid,Sigmoid,49,21,17.0,19.0,16.0,0.0004916066094923742,4,256,0.7990652349345189,0.0003656567637262966,92.93215818183367,COMPLETE
384,0.24972358345985413,2023-09-04 20:58:13.342702,2023-09-04 20:58:26.349331,0 days 00:00:13.006629,Sigmoid,Leaky,Sigmoid,Sigmoid,10,24,10.0,15.0,13.0,0.013290967029656202,4,120,0.6665964370040026,1.6272519771841683e-05,99.35968505859375,COMPLETE
385,0.9778791069984436,2023-09-04 20:58:26.349930,2023-09-04 20:58:27.618849,0 days 00:00:01.268919,Sigmoid,Leaky,Sigmoid,Sigmoid,13,24,10.0,15.0,15.0,1.0244978287983637e-05,4,110,0.3827546143238659,1.5853227531260667e-05,104.46944376627604,COMPLETE
386,0.32793059945106506,2023-09-04 20:58:27.619437,2023-09-04 20:58:33.079917,0 days 00:00:05.460480,Sigmoid,Leaky,Leaky,Sigmoid,10,24,10.0,21.0,20.0,0.013411790453628699,4,341,0.6503458447611163,1.7448675539355303e-05,100.98386836051941,COMPLETE
387,0.35933440923690796,2023-09-04 20:58:33.080508,2023-09-04 20:58:36.085851,0 days 00:00:03.005343,Sigmoid,,,,15,24,,,,0.013457438830952321,1,105,0.6311560781547114,1.4593719535160987e-05,104.52376092648974,COMPLETE
388,0.30794456601142883,2023-09-04 20:58:36.086395,2023-09-04 20:58:44.966669,0 days 00:00:08.880274,Sigmoid,Leaky,Sigmoid,Sigmoid,12,23,11.0,15.0,19.0,0.010000212301828305,4,127,0.6651231225124501,1.231857847446416e-05,97.0238883847096,COMPLETE
389,0.49854111671447754,2023-09-04 20:58:44.967270,2023-09-04 20:59:25.026685,0 days 00:00:40.059415,Sigmoid,Leaky,Leaky,Sigmoid,10,24,10.0,20.0,12.0,2.5525542400645032e-05,4,368,0.42290657248934616,2.021535045201822e-05,541.9824110736017,COMPLETE
390,0.37118983268737793,2023-09-04 20:59:25.027261,2023-09-04 20:59:29.304500,0 days 00:00:04.277239,Sigmoid,Leaky,Sigmoid,Sigmoid,13,11,12.0,19.0,14.0,0.017119743265509888,4,354,0.6962312379453593,0.0018185730624653653,218.0575185139974,COMPLETE
391,0.29810601472854614,2023-09-04 20:59:29.305076,2023-09-04 20:59:32.786761,0 days 00:00:03.481685,Sigmoid,Leaky,ReLU,Sigmoid,88,23,11.0,20.0,6.0,0.003989847232762775,4,243,0.7593532763407357,2.40236667380675e-05,102.07051356922497,COMPLETE
392,0.3925391435623169,2023-09-04 20:59:32.787342,2023-09-04 20:59:36.924437,0 days 00:00:04.137095,Sigmoid,Leaky,Sigmoid,Sigmoid,11,24,10.0,21.0,13.0,0.0047500682402125466,4,118,0.7186916616796385,0.001249052537045155,104.42455751755658,COMPLETE
393,0.422976016998291,2023-09-04 20:59:36.924779,2023-09-04 20:59:37.591622,0 days 00:00:00.666843,Sigmoid,Leaky,Tanh,,24,23,18.0,16.0,,0.0008022271918722875,3,67,0.27496767103658315,1.7121181233776736e-05,112.42699432373047,COMPLETE
394,0.3627547323703766,2023-09-04 20:59:37.591974,2023-09-04 20:59:37.771803,0 days 00:00:00.179829,ReLU,Leaky,Leaky,ReLU,32,11,9.0,20.0,17.0,0.011714215906822907,4,283,0.17264573017738086,3.0805730584545424e-05,171.1525825832201,COMPLETE
395,1.0684099197387695,2023-09-04 20:59:37.772148,2023-09-04 20:59:38.016143,0 days 00:00:00.243995,Sigmoid,Tanh,Sigmoid,Leaky,92,13,17.0,21.0,3.0,0.007647000667335116,4,92,0.7732736651712298,0.006120307906609746,101.94871563381619,COMPLETE
396,0.37111473083496094,2023-09-04 20:59:38.016546,2023-09-04 20:59:38.997364,0 days 00:00:00.980818,Sigmoid,Leaky,Sigmoid,Sigmoid,28,22,14.0,19.0,15.0,0.014904570766427556,4,218,0.6763562604491036,1.4407822938112179e-05,115.97987998404155,COMPLETE
397,0.3345092535018921,2023-09-04 20:59:38.997720,2023-09-04 20:59:41.800107,0 days 00:00:02.802387,Sigmoid,Leaky,Leaky,Sigmoid,10,23,13.0,22.0,18.0,0.024624612636054213,4,332,0.6365936549673451,1.9672061332863905e-05,99.48063903159283,COMPLETE
398,0.34064722061157227,2023-09-04 20:59:41.800449,2023-09-04 20:59:42.036895,0 days 00:00:00.236446,ReLU,Leaky,Sigmoid,Sigmoid,86,24,16.0,15.0,19.0,0.06721747732191766,4,85,0.7385069814845605,2.3375665667358897e-05,103.04314041137695,COMPLETE
399,0.39838460087776184,2023-09-04 20:59:42.037252,2023-09-04 20:59:45.332855,0 days 00:00:03.295603,Sigmoid,Leaky,Sigmoid,Sigmoid,90,24,18.0,21.0,14.0,0.0005490584089069416,4,361,0.7971169535907814,1.1744899787392106e-05,107.92499199234138,COMPLETE
400,0.35231202840805054,2023-09-04 20:59:45.333193,2023-09-04 20:59:46.230482,0 days 00:00:00.897289,Sigmoid,,,,22,12,,,,0.009092366247711928,1,121,0.45744748843893307,1.550639613081514e-05,116.21973139123071,COMPLETE
401,0.37674233317375183,2023-09-04 20:59:46.230789,2023-09-04 20:59:46.328575,0 days 00:00:00.097786,Leaky,Sigmoid,,,44,22,11.0,,,0.01895128475756644,2,376,0.11306779263651548,3.180422697486105e-05,212.79646696867766,COMPLETE
402,0.317199170589447,2023-09-04 20:59:46.328891,2023-09-04 20:59:48.011972,0 days 00:00:01.683081,ReLU,Leaky,Leaky,ReLU,40,23,17.0,20.0,16.0,0.0003972693389850846,4,273,0.7637667255330961,2.6291017244186052e-05,93.53224918760102,COMPLETE
403,1.0266501903533936,2023-09-04 20:59:48.012313,2023-09-04 20:59:48.872404,0 days 00:00:00.860091,Sigmoid,Tanh,Sigmoid,Leaky,20,23,9.0,24.0,15.0,5.206198848426307e-05,4,232,0.7110846007784412,0.016753566122482983,101.15338398860051,COMPLETE
404,0.3223320543766022,2023-09-04 20:59:48.872752,2023-09-04 20:59:55.686929,0 days 00:00:06.814177,Sigmoid,ReLU,Sigmoid,Sigmoid,14,22,10.0,15.0,5.0,0.011254568871041303,4,176,0.6204430294044088,1.8553762216726578e-05,123.5157474224384,COMPLETE
405,0.3497905731201172,2023-09-04 20:59:55.687539,2023-09-04 21:00:06.862342,0 days 00:00:11.174803,Sigmoid,Sigmoid,ReLU,Sigmoid,12,24,18.0,19.0,11.0,0.005361288163689683,4,204,0.6840318925125423,4.590409512110912e-05,102.2164261092001,COMPLETE
406,0.3047371804714203,2023-09-04 21:00:06.862939,2023-09-04 21:00:10.850436,0 days 00:00:03.987497,ReLU,Leaky,Leaky,Sigmoid,17,20,12.0,22.0,17.0,0.002807514048232312,4,256,0.73925975169689,0.0005790657715919232,92.55462947036281,COMPLETE
407,0.3660922050476074,2023-09-04 21:00:10.851022,2023-09-04 21:00:17.326132,0 days 00:00:06.475110,Sigmoid,Sigmoid,Sigmoid,Sigmoid,55,12,17.0,21.0,13.0,0.001980841511139459,4,267,0.7682837011291961,1.0095256680056537e-05,118.80174432673924,COMPLETE
408,0.3693687915802002,2023-09-04 21:00:17.326730,2023-09-04 21:00:34.216451,0 days 00:00:16.889721,Sigmoid,ReLU,Sigmoid,ReLU,47,18,9.0,18.0,12.0,0.00028585946845105596,4,350,0.6570551304230146,0.000748510087673416,115.52722191946847,COMPLETE
409,0.32951056957244873,2023-09-04 21:00:34.217041,2023-09-04 21:00:36.017271,0 days 00:00:01.800230,ReLU,Leaky,Leaky,Leaky,25,22,11.0,14.0,14.0,0.014108335453746844,4,225,0.5889936959170787,1.3087698579574806e-05,103.29713029127855,COMPLETE
410,0.34892818331718445,2023-09-04 21:00:36.017868,2023-09-04 21:00:37.442959,0 days 00:00:01.425091,Sigmoid,Sigmoid,Sigmoid,Sigmoid,83,24,16.0,20.0,13.0,0.02256849647971676,4,298,0.3905329826915135,2.1333283818255618e-05,108.42404927705464,COMPLETE
411,0.3904314935207367,2023-09-04 21:00:37.443547,2023-09-04 21:00:42.615027,0 days 00:00:05.171480,Sigmoid,Leaky,Sigmoid,Sigmoid,30,23,18.0,19.0,15.0,0.0024431440425450764,4,186,0.36119375244348195,5.5496766885632565e-05,191.37115457322864,COMPLETE
412,0.40528208017349243,2023-09-04 21:00:42.615620,2023-09-04 21:00:47.573350,0 days 00:00:04.957730,Leaky,Sigmoid,Leaky,Sigmoid,94,13,17.0,20.0,16.0,0.00016289403957779215,4,157,0.7978441929372727,3.573903169911514e-05,114.72493923697502,COMPLETE
413,0.34305912256240845,2023-09-04 21:00:47.573940,2023-09-04 21:00:50.645615,0 days 00:00:03.071675,Sigmoid,ReLU,Sigmoid,Sigmoid,37,21,19.0,16.0,18.0,0.00691747048794445,4,142,0.712712165864534,1.651557356837605e-05,100.00753974914551,COMPLETE
414,0.4590127766132355,2023-09-04 21:00:50.646247,2023-09-04 21:00:51.140177,0 days 00:00:00.493930,ReLU,Leaky,Sigmoid,Sigmoid,89,22,10.0,21.0,14.0,0.08352918313050486,4,433,0.2553753041784543,2.8337780803288836e-05,128.06305718421936,COMPLETE
415,0.6840133666992188,2023-09-04 21:00:51.140768,2023-09-04 21:01:13.396050,0 days 00:00:22.255282,Sigmoid,Sigmoid,Leaky,ReLU,23,23,9.0,20.0,17.0,1.3824668358911779e-05,4,243,0.7444344374543445,0.00023408517824724572,96.86983427196864,COMPLETE
416,0.2968849837779999,2023-09-04 21:01:13.396659,2023-09-04 21:01:15.791767,0 days 00:00:02.395108,Sigmoid,Leaky,Sigmoid,,42,24,12.0,19.0,,0.01683283930068425,3,365,0.6919524416467747,2.206925857330664e-05,126.3352990327058,COMPLETE
417,0.365820974111557,2023-09-04 21:01:15.792353,2023-09-04 21:01:16.588688,0 days 00:00:00.796335,ReLU,Tanh,ReLU,Leaky,52,19,15.0,21.0,15.0,0.010039284062308194,4,345,0.324065189420539,1.3036889259330494e-05,163.08453054989084,COMPLETE
418,0.3347713351249695,2023-09-04 21:01:16.589284,2023-09-04 21:01:23.218970,0 days 00:00:06.629686,Sigmoid,Sigmoid,Sigmoid,Sigmoid,27,20,18.0,22.0,16.0,0.0036997052743827606,4,382,0.48754892723333004,1.5694798032088873e-05,186.12151991476225,COMPLETE
419,0.361285924911499,2023-09-04 21:01:23.219570,2023-09-04 21:01:25.588468,0 days 00:00:02.368898,Sigmoid,ReLU,Tanh,Tanh,51,21,16.0,18.0,14.0,0.013891201796097067,4,206,0.34240089500918186,0.002067619231913729,153.65318632579985,COMPLETE
420,0.3482076823711395,2023-09-04 21:01:25.589052,2023-09-04 21:01:28.593820,0 days 00:00:03.004768,Sigmoid,,,,19,23,,,,0.008343555391827942,1,219,0.7721308197152774,0.0002530100147815494,108.55715254241345,COMPLETE
421,0.3306596279144287,2023-09-04 21:01:28.594366,2023-09-04 21:01:29.023984,0 days 00:00:00.429618,ReLU,Leaky,,,87,22,17.0,,,0.012207912939609001,2,166,0.2932869537262774,4.19744108449917e-05,168.85241021050348,COMPLETE
422,1.026703119277954,2023-09-04 21:01:29.024549,2023-09-04 21:01:29.591796,0 days 00:00:00.567247,Sigmoid,Sigmoid,Leaky,Sigmoid,48,23,7.0,20.0,13.0,0.0016384508631641897,4,325,0.6116499662810342,0.006875355909044986,100.0564734141032,COMPLETE
423,0.37029075622558594,2023-09-04 21:01:29.592384,2023-09-04 21:01:31.161506,0 days 00:00:01.569122,Leaky,Leaky,Sigmoid,Sigmoid,54,11,10.0,15.0,18.0,0.0013639195234305293,4,373,0.28832204109462695,5.790258976829554e-05,111.42160061106962,COMPLETE
424,0.3110251724720001,2023-09-04 21:01:31.162094,2023-09-04 21:01:33.068355,0 days 00:00:01.906261,Sigmoid,Sigmoid,Sigmoid,Tanh,91,22,11.0,20.0,15.0,0.020895575863378816,4,359,0.7997469060840317,1.9063827346904328e-05,94.64080905914307,COMPLETE
425,0.43249183893203735,2023-09-04 21:01:33.068951,2023-09-04 21:01:40.989483,0 days 00:00:07.920532,Sigmoid,ReLU,Leaky,Sigmoid,29,24,18.0,19.0,20.0,0.0007207184019418949,4,230,0.7232899355583873,2.7775305383701804e-05,127.69388878231956,COMPLETE
426,0.48069998621940613,2023-09-04 21:01:40.990071,2023-09-04 21:01:48.588636,0 days 00:00:07.598565,Sigmoid,Leaky,Sigmoid,ReLU,24,21,9.0,15.0,12.0,0.00013842315294385668,4,181,0.6687791374303305,2.3163268495386272e-05,123.60988035254715,COMPLETE
427,0.32481759786605835,2023-09-04 21:01:48.588980,2023-09-04 21:01:52.145119,0 days 00:00:03.556139,ReLU,Sigmoid,Sigmoid,Leaky,50,12,17.0,14.0,19.0,0.004987409210513808,4,195,0.7421596078590956,1.1975069051692127e-05,117.52880216235957,COMPLETE
428,0.46702829003334045,2023-09-04 21:01:52.145707,2023-09-04 21:01:53.329943,0 days 00:00:01.184236,Sigmoid,Leaky,Leaky,Sigmoid,43,22,18.0,21.0,16.0,0.0009477239187303937,4,103,0.502367872711398,0.0014456155518199172,117.37702897666158,COMPLETE
429,0.33788609504699707,2023-09-04 21:01:53.330278,2023-09-04 21:01:54.266038,0 days 00:00:00.935760,ReLU,Sigmoid,Sigmoid,Tanh,17,20,8.0,18.0,13.0,0.016475204093291042,4,340,0.6483291522130005,3.533399730494198e-05,112.67001481489702,COMPLETE
430,0.34318023920059204,2023-09-04 21:01:54.266371,2023-09-04 21:01:55.746504,0 days 00:00:01.480133,Sigmoid,ReLU,Sigmoid,Sigmoid,53,23,13.0,19.0,7.0,0.006361477522486392,4,369,0.6995532214606608,0.0017339230730761377,122.40749009450276,COMPLETE
431,0.4640212059020996,2023-09-04 21:01:55.746841,2023-09-04 21:01:59.071158,0 days 00:00:03.324317,Sigmoid,Leaky,Leaky,Sigmoid,79,24,17.0,20.0,17.0,7.526086518206524e-05,4,470,0.3930548308782505,1.4501059997905602e-05,119.08553009033203,COMPLETE
432,0.3369891047477722,2023-09-04 21:01:59.071504,2023-09-04 21:01:59.496400,0 days 00:00:00.424896,Tanh,Tanh,Sigmoid,Tanh,34,10,19.0,16.0,14.0,0.026642361288958246,4,355,0.547027679676095,1.6935264126895536e-05,106.92759307861328,COMPLETE
433,0.3979060649871826,2023-09-04 21:01:59.496737,2023-09-04 21:01:59.955352,0 days 00:00:00.458615,Sigmoid,Sigmoid,ReLU,Sigmoid,21,23,16.0,21.0,14.0,0.010632329805155317,4,212,0.22109000416743918,6.800614523301705e-05,134.70229215400164,COMPLETE
434,0.3829265236854553,2023-09-04 21:01:59.955686,2023-09-04 21:02:05.486442,0 days 00:00:05.530756,ReLU,Leaky,Sigmoid,ReLU,11,21,15.0,21.0,15.0,9.648225598085465e-05,4,247,0.2852668062042893,0.00039150732780579957,362.1290824982801,COMPLETE
435,0.3989955186843872,2023-09-04 21:02:05.486781,2023-09-04 21:02:11.069805,0 days 00:00:05.583024,Sigmoid,ReLU,Leaky,,26,22,9.0,20.0,,0.00026086087607641846,3,236,0.7605800527614146,4.9063638447053764e-05,124.29966302645408,COMPLETE
436,0.3603200912475586,2023-09-04 21:02:11.070133,2023-09-04 21:02:11.604456,0 days 00:00:00.534323,Leaky,Sigmoid,Sigmoid,Leaky,46,24,18.0,19.0,17.0,0.09557253074253783,4,265,0.7200241073290171,1.9819510860010606e-05,107.66873779296876,COMPLETE
437,0.3608313500881195,2023-09-04 21:02:11.604792,2023-09-04 21:02:12.448490,0 days 00:00:00.843698,Sigmoid,Leaky,Sigmoid,Sigmoid,39,12,11.0,18.0,4.0,0.012766846619289703,4,199,0.4250573033879258,2.488142972781764e-05,115.99714528401692,COMPLETE
438,0.35329562425613403,2023-09-04 21:02:12.448831,2023-09-04 21:02:12.958719,0 days 00:00:00.509888,Tanh,,,,97,21,,,,0.008770112728705075,1,392,0.768825724258376,0.009583700903492576,93.72014469570584,COMPLETE
439,0.38265663385391235,2023-09-04 21:02:12.959028,2023-09-04 21:02:25.401661,0 days 00:00:12.442633,ReLU,Sigmoid,Leaky,Sigmoid,15,11,10.0,22.0,16.0,0.00018821378585851401,4,379,0.5822120024294778,3.0763475790491285e-05,152.58829925053982,COMPLETE
440,0.44077929854393005,2023-09-04 21:02:25.402003,2023-09-04 21:02:25.538314,0 days 00:00:00.136311,Sigmoid,Leaky,Sigmoid,Tanh,93,23,8.0,14.0,15.0,0.019239648269803948,4,440,0.17603153138598482,4.2607886707147256e-05,179.6199282942147,COMPLETE
441,0.97303307056427,2023-09-04 21:02:25.538643,2023-09-04 21:02:25.684257,0 days 00:00:00.145614,Sigmoid,ReLU,Sigmoid,Sigmoid,50,5,17.0,20.0,13.0,0.004328276897075685,4,252,0.4025852206613196,0.012336056983600917,107.35215412486683,COMPLETE
442,0.37031853199005127,2023-09-04 21:02:25.684586,2023-09-04 21:02:27.305406,0 days 00:00:01.620820,Sigmoid,Sigmoid,Leaky,Sigmoid,86,22,14.0,17.0,19.0,0.002916084627162434,4,221,0.7407306915403005,1.1013092447416594e-05,114.63971530689912,COMPLETE
443,0.31255772709846497,2023-09-04 21:02:27.305745,2023-09-04 21:02:32.840779,0 days 00:00:05.535034,ReLU,Tanh,Sigmoid,Tanh,55,23,7.0,13.0,14.0,0.00023296825746414496,4,364,0.7996127016840624,0.00015269812009186817,103.14268889793983,COMPLETE
444,0.30494534969329834,2023-09-04 21:02:32.841106,2023-09-04 21:02:33.388460,0 days 00:00:00.547354,Tanh,Leaky,Sigmoid,Sigmoid,48,24,12.0,15.0,16.0,0.016540170743506537,4,349,0.6814093002430686,0.0003529802449786269,93.55701555524554,COMPLETE
445,0.4619634747505188,2023-09-04 21:02:33.388791,2023-09-04 21:02:34.813186,0 days 00:00:01.424395,Sigmoid,Sigmoid,ReLU,ReLU,23,19,19.0,20.0,14.0,0.00047565205142498457,4,193,0.31572948631969,0.0023352642176536174,116.45704411525352,COMPLETE
446,0.39853209257125854,2023-09-04 21:02:34.813516,2023-09-04 21:02:35.178398,0 days 00:00:00.364882,Sigmoid,Leaky,Tanh,Leaky,28,22,17.0,19.0,18.0,0.06128136613775047,4,150,0.24130079453957393,1.8080630346539298e-05,216.224843476948,COMPLETE
447,0.8702130317687988,2023-09-04 21:02:35.178738,2023-09-04 21:02:36.176391,0 days 00:00:00.997653,Sigmoid,ReLU,Leaky,Sigmoid,89,13,8.0,21.0,17.0,3.4722444185962294e-05,4,171,0.37788354040613276,0.00018110629582309277,118.83592848749886,COMPLETE
