number,value,datetime_start,datetime_complete,duration,params_activation1,params_activation2,params_activation3,params_activation4,params_batch_size,params_fl1,params_fl2,params_fl3,params_fl4,params_learning_rate,params_n_layers,params_num_epochs,params_train_size,params_weight_decay,user_attrs_mre,state
469,0.35237494111061096,2023-09-04 21:59:19.666420,2023-09-04 21:59:21.665259,0 days 00:00:01.998839,ReLU,ReLU,ReLU,,42,19,16.0,17.0,,0.010068858696281836,3,240,0.6859328642330786,2.7143718751260123e-05,101.66548538208008,COMPLETE
470,0.3369939625263214,2023-09-04 21:59:21.666021,2023-09-04 21:59:24.322274,0 days 00:00:02.656253,ReLU,ReLU,Tanh,,44,6,17.0,16.0,,0.008757810602935472,3,215,0.6263935131472997,1.9926652915696e-05,94.61077903633687,COMPLETE
471,0.34917089343070984,2023-09-04 21:59:24.322860,2023-09-04 21:59:25.709130,0 days 00:00:01.386270,ReLU,ReLU,Tanh,Leaky,41,19,16.0,18.0,7.0,0.01382405725275038,4,258,0.6486232358269471,0.0007230581376723025,88.83649708674504,COMPLETE
472,0.7869740724563599,2023-09-04 21:59:25.709756,2023-09-04 21:59:30.290985,0 days 00:00:04.581229,ReLU,ReLU,Tanh,,39,18,16.0,17.0,,1.1863347864794275e-05,3,249,0.25730504532478904,3.055343248662392e-05,101.00521421623996,COMPLETE
473,0.3538067638874054,2023-09-04 21:59:30.291692,2023-09-04 21:59:32.207150,0 days 00:00:01.915458,ReLU,ReLU,ReLU,,43,19,17.0,16.0,,0.012148553473110944,3,228,0.7022542928890952,2.3149080486788802e-05,95.02131779988606,COMPLETE
474,0.2832363247871399,2023-09-04 21:59:32.207759,2023-09-04 21:59:33.997651,0 days 00:00:01.789892,ReLU,ReLU,Tanh,,37,20,8.0,18.0,,0.006063711263049742,3,242,0.7996417315027339,1.1853594084371825e-05,90.32788111368815,COMPLETE
475,0.3356214463710785,2023-09-04 21:59:33.998249,2023-09-04 21:59:35.945874,0 days 00:00:01.947625,ReLU,ReLU,Tanh,,40,18,16.0,19.0,,0.007975137959763666,3,259,0.7211557649143505,0.0002730268703295135,98.38101020226112,COMPLETE
476,0.32015690207481384,2023-09-04 21:59:35.946470,2023-09-04 21:59:39.263749,0 days 00:00:03.317279,ReLU,ReLU,ReLU,,33,20,7.0,17.0,,0.010937713816929115,3,273,0.6498962925295276,0.013915214476206679,138.9392088651657,COMPLETE
477,0.4578588902950287,2023-09-04 21:59:39.264397,2023-09-04 21:59:45.842064,0 days 00:00:06.577667,Leaky,,,,36,2,,,,0.0004033111980277583,1,207,0.691625833186759,1.5963298388297092e-05,112.991883614213,COMPLETE
478,0.3707815706729889,2023-09-04 21:59:45.842636,2023-09-04 21:59:46.510329,0 days 00:00:00.667693,ReLU,ReLU,Tanh,,31,19,12.0,23.0,,0.0048298085734215365,3,226,0.21293583243211248,0.0004181502905202167,127.37360763549805,COMPLETE
479,0.32508495450019836,2023-09-04 21:59:46.510967,2023-09-04 21:59:49.483311,0 days 00:00:02.972344,Leaky,ReLU,Leaky,,41,21,15.0,15.0,,0.0032888789298178723,3,248,0.7392970230307077,3.4038998206254344e-05,109.55430497794316,COMPLETE
480,0.28922200202941895,2023-09-04 21:59:49.484053,2023-09-04 21:59:50.723386,0 days 00:00:01.239333,ReLU,ReLU,Tanh,,44,19,10.0,15.0,,0.016447321868125107,3,237,0.5870034607427724,4.494937161563685e-05,85.34634399414062,COMPLETE
481,0.2671966552734375,2023-09-04 21:59:50.724038,2023-09-04 21:59:53.207243,0 days 00:00:02.483205,ReLU,ReLU,Tanh,ReLU,28,20,18.0,16.0,9.0,0.006769026095493855,4,252,0.7644307061827046,1.9305767996145834e-05,143.49119883570177,COMPLETE
482,0.3561781942844391,2023-09-04 21:59:53.207969,2023-09-04 21:59:54.992714,0 days 00:00:01.784745,Leaky,ReLU,ReLU,ReLU,28,20,18.0,16.0,10.0,0.006595317877009979,4,265,0.7665472602526019,0.0011831047911281048,113.3667610168457,COMPLETE
483,0.2572001516819,2023-09-04 21:59:54.993489,2023-09-04 21:59:58.333354,0 days 00:00:03.339865,ReLU,ReLU,Tanh,ReLU,26,21,18.0,15.0,9.0,0.007501466067512653,4,255,0.7997986607496178,1.8982268647907447e-05,105.98307407924108,COMPLETE
484,0.35446926951408386,2023-09-04 21:59:58.334165,2023-09-04 21:59:59.265768,0 days 00:00:00.931603,ReLU,ReLU,Tanh,ReLU,26,21,18.0,16.0,9.0,0.007158895841735975,4,264,0.20506005533928745,1.8564212780045703e-05,115.43411421775818,COMPLETE
485,0.29236268997192383,2023-09-04 21:59:59.266443,2023-09-04 22:00:01.229075,0 days 00:00:01.962632,ReLU,ReLU,Tanh,ReLU,26,21,19.0,17.0,12.0,0.008421627890566047,4,253,0.7772195770511693,2.5568724011156397e-05,95.87973899841309,COMPLETE
486,0.31071797013282776,2023-09-04 22:00:01.229699,2023-09-04 22:00:04.330469,0 days 00:00:03.100770,ReLU,ReLU,ReLU,ReLU,28,21,18.0,16.0,8.0,0.005551343591722369,4,280,0.7997746930026192,2.371617437762083e-05,98.64819727188501,COMPLETE
487,0.3173035979270935,2023-09-04 22:00:04.331075,2023-09-04 22:00:05.833309,0 days 00:00:01.502234,ReLU,ReLU,Tanh,ReLU,25,21,18.0,16.0,9.0,0.009753618481211453,4,258,0.4161694292931828,0.004163044744478072,120.6637429131402,COMPLETE
488,0.3739372789859772,2023-09-04 22:00:05.833839,2023-09-04 22:00:06.309515,0 days 00:00:00.475676,ReLU,ReLU,Tanh,ReLU,28,22,17.0,17.0,11.0,0.0015970136998026058,4,272,0.230505951446774,2.0025624296246374e-05,121.7882586109395,COMPLETE
489,0.312042772769928,2023-09-04 22:00:06.309985,2023-09-04 22:00:06.934681,0 days 00:00:00.624696,ReLU,Sigmoid,Tanh,ReLU,27,22,18.0,16.0,7.0,0.007386486926249566,4,250,0.7537487487661991,1.721642076098311e-05,103.40457996569182,COMPLETE
490,0.3514660596847534,2023-09-04 22:00:06.935071,2023-09-04 22:00:07.461090,0 days 00:00:00.526019,ReLU,ReLU,ReLU,ReLU,24,20,19.0,15.0,6.0,0.006149138254252566,4,258,0.2976693906683406,6.06412561780614e-05,126.83197268924198,COMPLETE
491,0.32971876859664917,2023-09-04 22:00:07.461465,2023-09-04 22:00:08.155171,0 days 00:00:00.693706,ReLU,Tanh,Tanh,ReLU,30,21,18.0,21.0,10.0,0.009230409025950253,4,244,0.7998551787435082,2.9272784125276717e-05,97.49584761909817,COMPLETE
492,0.457854688167572,2023-09-04 22:00:08.155548,2023-09-04 22:00:08.334607,0 days 00:00:00.179059,ReLU,ReLU,Leaky,ReLU,83,22,17.0,18.0,8.0,0.003977318460134491,4,460,0.11875162725664713,7.595891384903085e-05,126.08449300130208,COMPLETE
493,0.3003350794315338,2023-09-04 22:00:08.334996,2023-09-04 22:00:09.501686,0 days 00:00:01.166690,ReLU,ReLU,Tanh,Tanh,22,21,19.0,14.0,12.0,0.005221022433079247,4,267,0.7331182913423797,1.4538281071925712e-05,94.53174591064453,COMPLETE
494,0.24307198822498322,2023-09-04 22:00:09.502057,2023-09-04 22:00:10.942974,0 days 00:00:01.440917,ReLU,Tanh,ReLU,ReLU,23,20,18.0,15.0,13.0,0.006438152280362882,4,251,0.7629945846982028,0.00010134309459333167,93.03579004799447,COMPLETE
495,0.36868324875831604,2023-09-04 22:00:10.943485,2023-09-04 22:00:11.820203,0 days 00:00:00.876718,ReLU,ReLU,ReLU,ReLU,24,22,17.0,15.0,16.0,0.005948365404483669,4,247,0.7171694880485541,0.0001111081785481167,98.3694093492296,COMPLETE
496,0.29398998618125916,2023-09-04 22:00:11.820610,2023-09-04 22:00:12.975921,0 days 00:00:01.155311,ReLU,Tanh,ReLU,ReLU,22,12,18.0,17.0,14.0,0.0069286801760888575,4,240,0.75582188084831,3.95816867163773e-05,67.74496686458588,COMPLETE
497,0.392755389213562,2023-09-04 22:00:12.976329,2023-09-04 22:00:19.349541,0 days 00:00:06.373212,ReLU,ReLU,ReLU,ReLU,22,20,18.0,15.0,13.0,6.94204832069734e-05,4,254,0.3849460195055761,2.359194294294584e-05,111.62511012239277,COMPLETE
498,0.3465012311935425,2023-09-04 22:00:19.350338,2023-09-04 22:00:20.243241,0 days 00:00:00.892903,ReLU,Tanh,ReLU,ReLU,24,21,17.0,14.0,15.0,0.004658289867524211,4,236,0.5280493296379335,3.2230107502207495e-05,122.63597583770752,COMPLETE
499,0.3410833477973938,2023-09-04 22:00:20.243933,2023-09-04 22:00:22.996091,0 days 00:00:02.752158,ReLU,ReLU,ReLU,ReLU,25,22,18.0,15.0,11.0,0.0008082382741910662,4,250,0.6836696555504412,2.0404700669731995e-05,96.25004996022871,COMPLETE
500,0.300350546836853,2023-09-04 22:00:22.996614,2023-09-04 22:00:24.347747,0 days 00:00:01.351133,ReLU,ReLU,ReLU,Leaky,21,23,17.0,13.0,17.0,0.00401206244362222,4,285,0.7181891419862471,4.469975887698962e-05,109.4271337574926,COMPLETE
501,0.3376692533493042,2023-09-04 22:00:24.348233,2023-09-04 22:00:25.457984,0 days 00:00:01.109751,ReLU,Tanh,ReLU,ReLU,27,21,18.0,16.0,18.0,0.0019613177338278906,4,262,0.7666419143554277,2.7222533910365942e-05,111.80759184701103,COMPLETE
502,0.32258695363998413,2023-09-04 22:00:25.458567,2023-09-04 22:00:26.383176,0 days 00:00:00.924609,ReLU,ReLU,ReLU,Leaky,30,22,19.0,16.0,9.0,0.007469807211543927,4,302,0.5627668780198505,5.244992123420992e-05,97.68378134334789,COMPLETE
503,0.38371744751930237,2023-09-04 22:00:26.383628,2023-09-04 22:00:27.465875,0 days 00:00:01.082247,ReLU,Leaky,ReLU,Leaky,23,20,18.0,15.0,13.0,0.00599030706588965,4,246,0.3481284140962671,0.00016556151306233003,101.1282433219578,COMPLETE
504,0.3219517171382904,2023-09-04 22:00:27.466440,2023-09-04 22:00:29.217025,0 days 00:00:01.750585,ReLU,Tanh,ReLU,Tanh,26,21,19.0,14.0,11.0,0.005253941987510475,4,270,0.739898231644876,3.371455805887936e-05,105.6297390460968,COMPLETE
505,0.2968307435512543,2023-09-04 22:00:29.218254,2023-09-04 22:00:33.359607,0 days 00:00:04.141353,ReLU,ReLU,ReLU,ReLU,29,23,11.0,16.0,23.0,0.008285970451610414,4,230,0.7060142485950158,1.771922442132596e-05,106.85219192504883,COMPLETE
506,0.38660717010498047,2023-09-04 22:00:33.360944,2023-09-04 22:00:33.924002,0 days 00:00:00.563058,ReLU,Tanh,Sigmoid,Leaky,100,22,17.0,22.0,10.0,0.0037287967591055553,4,220,0.24451175472595377,7.644582974336387e-05,115.10915029273843,COMPLETE
507,0.32379254698753357,2023-09-04 22:00:33.924825,2023-09-04 22:00:37.142213,0 days 00:00:03.217388,Sigmoid,ReLU,Leaky,Leaky,20,20,16.0,17.0,12.0,0.006643443686364594,4,239,0.4095383219461866,9.19142187070723e-05,156.20208028157552,COMPLETE
508,0.3207203447818756,2023-09-04 22:00:37.143076,2023-09-04 22:00:38.670205,0 days 00:00:01.527129,ReLU,ReLU,ReLU,,27,23,9.0,24.0,,0.0028681345975433057,3,254,0.2829267045420311,0.00013281035731324195,118.36801774161202,COMPLETE
509,0.29617026448249817,2023-09-04 22:00:38.671236,2023-09-04 22:00:41.517421,0 days 00:00:02.846185,Tanh,Tanh,Tanh,,87,22,17.0,12.0,,0.0015331151746898208,3,245,0.7707111774112658,0.00024140796491001443,91.69441580003307,COMPLETE
510,0.3803293704986572,2023-09-04 22:00:41.518019,2023-09-04 22:00:41.937340,0 days 00:00:00.419321,ReLU,ReLU,Tanh,ReLU,98,21,18.0,6.0,20.0,0.004715997357774683,4,264,0.4631667642267766,1.2388102183774758e-05,1937.5398646763392,COMPLETE
511,0.4205397367477417,2023-09-04 22:00:41.937880,2023-09-04 22:00:42.661068,0 days 00:00:00.723188,Tanh,Tanh,ReLU,,28,20,10.0,11.0,,0.0006598713913137726,3,191,0.2015211593708389,2.3209211913616508e-05,407.3924492730035,COMPLETE
512,0.36618855595588684,2023-09-04 22:00:42.661605,2023-09-04 22:00:43.129165,0 days 00:00:00.467560,ReLU,ReLU,Tanh,,31,22,8.0,15.0,,0.008903018055814647,3,231,0.7421331028786151,1.4071205937397812e-05,106.73023023103413,COMPLETE
513,0.3205912113189697,2023-09-04 22:00:43.129570,2023-09-04 22:00:49.533059,0 days 00:00:06.403489,Tanh,Sigmoid,Tanh,,24,16,16.0,5.0,,0.0003722735550184301,3,256,0.6808765006863784,6.343468637218571e-05,108.15323570370674,COMPLETE
514,0.3895839750766754,2023-09-04 22:00:49.533436,2023-09-04 22:00:49.943986,0 days 00:00:00.410550,ReLU,ReLU,ReLU,,100,23,19.0,4.0,,0.0009984356267970296,3,274,0.1503436030711182,3.8838003192162846e-05,122.48130922317505,COMPLETE
515,0.3297353684902191,2023-09-04 22:00:49.944371,2023-09-04 22:00:50.517568,0 days 00:00:00.573197,Tanh,Tanh,Tanh,,85,21,11.0,10.0,,0.006895417482702011,3,241,0.36662054809704575,2.7683926350435158e-05,139.1142583653547,COMPLETE
516,0.3801148533821106,2023-09-04 22:00:50.518181,2023-09-04 22:00:51.004334,0 days 00:00:00.486153,ReLU,ReLU,Tanh,Leaky,98,21,15.0,16.0,14.0,0.005372769742131344,4,251,0.2726559008409656,1.8600020875733235e-05,134.36174647013345,COMPLETE
517,0.36530762910842896,2023-09-04 22:00:51.004991,2023-09-04 22:00:51.979157,0 days 00:00:00.974166,Tanh,Tanh,Sigmoid,,88,12,9.0,23.0,,0.001347079461290421,3,221,0.7699613806197454,0.0003043557892597137,105.75898321351009,COMPLETE
518,0.3009074032306671,2023-09-04 22:00:51.979661,2023-09-04 22:00:52.912057,0 days 00:00:00.932396,ReLU,ReLU,Tanh,,47,20,8.0,17.0,,0.01232892571075946,3,233,0.7212181876010859,1.584856158655381e-05,110.76660957336426,COMPLETE
519,0.49725136160850525,2023-09-04 22:00:52.912602,2023-09-04 22:01:06.422542,0 days 00:00:13.509940,ReLU,Tanh,ReLU,,30,8,6.0,6.0,,1.786197888340002e-05,3,264,0.7475588775775074,2.1714963161798973e-05,102.34195657209916,COMPLETE
520,0.33059215545654297,2023-09-04 22:01:06.423234,2023-09-04 22:01:07.583633,0 days 00:00:01.160399,Tanh,ReLU,Tanh,,27,22,17.0,7.0,,0.004371805422536758,3,204,0.29936342425152423,0.00010334871289472044,182.17800161000844,COMPLETE
521,0.3279881775379181,2023-09-04 22:01:07.584290,2023-09-04 22:01:08.129127,0 days 00:00:00.544837,ReLU,ReLU,Tanh,ReLU,99,23,18.0,13.0,21.0,0.031665241515838084,4,245,0.33278990775773537,3.171833958509511e-05,133.37419535319012,COMPLETE
522,0.32328495383262634,2023-09-04 22:01:08.129779,2023-09-04 22:01:09.198970,0 days 00:00:01.069191,Tanh,Tanh,Leaky,,96,20,16.0,10.0,,0.009100338701622919,3,255,0.5996888403584473,0.00021929134950660601,118.56467522515192,COMPLETE
523,0.3557475209236145,2023-09-04 22:01:09.199610,2023-09-04 22:01:15.922511,0 days 00:00:06.722901,ReLU,ReLU,ReLU,,32,22,15.0,18.0,,0.00015117659402007054,3,278,0.3154232040251364,1.0108783808709805e-05,150.56776466516914,COMPLETE
524,0.3798808753490448,2023-09-04 22:01:15.923163,2023-09-04 22:01:16.783106,0 days 00:00:00.859943,Tanh,Tanh,,,25,21,11.0,,,0.09158254213038142,2,240,0.43570426233298687,0.004550545120862568,122.3809269991788,COMPLETE
525,0.3472631275653839,2023-09-04 22:01:16.783740,2023-09-04 22:01:19.517186,0 days 00:00:02.733446,ReLU,ReLU,Tanh,Tanh,29,13,10.0,14.0,16.0,0.0027212541027880504,4,228,0.6661375700442492,2.598482722105927e-05,90.7247341840695,COMPLETE
526,0.42318832874298096,2023-09-04 22:01:19.517871,2023-09-04 22:01:20.607959,0 days 00:00:01.090088,Sigmoid,ReLU,Tanh,,39,23,16.0,15.0,,0.007664956654285622,3,211,0.1813642992675452,0.00014888791397227156,125.64301109313965,COMPLETE
527,0.29671019315719604,2023-09-04 22:01:20.608611,2023-09-04 22:01:22.323353,0 days 00:00:01.714742,ReLU,Tanh,ReLU,,52,21,15.0,11.0,,0.01433415841623823,3,268,0.7998112512034365,1.2404890929065362e-05,97.94050371324694,COMPLETE
528,0.3580698072910309,2023-09-04 22:01:22.324021,2023-09-04 22:01:23.007071,0 days 00:00:00.683050,Tanh,ReLU,Tanh,,83,20,9.0,16.0,,0.003325262058317254,3,250,0.35460301034203573,3.562120686303475e-05,211.00062952286157,COMPLETE
529,0.396330863237381,2023-09-04 22:01:23.007734,2023-09-04 22:01:23.952204,0 days 00:00:00.944470,ReLU,Leaky,Tanh,Leaky,98,17,12.0,5.0,8.0,0.005660094801467004,4,236,0.23621644831749444,1.8868632121303516e-05,124.30631256103516,COMPLETE
530,0.2930227816104889,2023-09-04 22:01:23.952855,2023-09-04 22:01:29.100044,0 days 00:00:05.147189,Tanh,Tanh,ReLU,,26,24,7.0,22.0,,0.0020487110198671612,3,262,0.7024434172508607,5.0308643728150395e-05,96.59249355918483,COMPLETE
531,0.2517545223236084,2023-09-04 22:01:29.100690,2023-09-04 22:01:32.851018,0 days 00:00:03.750328,ReLU,ReLU,Tanh,,23,22,19.0,16.0,,0.010874077425984719,3,291,0.7687301779962453,1.5518290056000834e-05,85.65466984835538,COMPLETE
532,0.3344115614891052,2023-09-04 22:01:32.851670,2023-09-04 22:01:33.913327,0 days 00:00:01.061657,ReLU,ReLU,Tanh,,26,22,18.0,16.0,,0.011173409782397769,3,312,0.4781208598267825,2.2254799768940883e-05,108.30865514846076,COMPLETE
533,0.28596124053001404,2023-09-04 22:01:33.913974,2023-09-04 22:01:38.671882,0 days 00:00:04.757908,Tanh,ReLU,Sigmoid,Leaky,22,22,19.0,17.0,22.0,0.010198987818988113,4,287,0.730585764951745,1.5055758791679708e-05,92.20790942509969,COMPLETE
534,0.3338472247123718,2023-09-04 22:01:38.672672,2023-09-04 22:01:40.275479,0 days 00:00:01.602807,ReLU,Tanh,Tanh,,17,23,19.0,16.0,,0.013784607161223657,3,276,0.5104282070589338,3.908860856125273e-05,101.34787859235492,COMPLETE
535,0.3035818636417389,2023-09-04 22:01:40.276168,2023-09-04 22:01:47.168009,0 days 00:00:06.891841,Tanh,ReLU,ReLU,,24,22,19.0,15.0,,0.0004580371979761337,3,290,0.6275678182144792,2.9805091668462558e-05,93.95037769135975,COMPLETE
536,0.34857669472694397,2023-09-04 22:01:47.168758,2023-09-04 22:01:51.778428,0 days 00:00:04.609670,ReLU,Tanh,Leaky,,20,21,20.0,17.0,,0.023128045115278762,3,282,0.768521924917387,1.7153214811937477e-05,101.6105908763652,COMPLETE
537,0.3601534366607666,2023-09-04 22:01:51.779077,2023-09-04 22:02:15.842047,0 days 00:00:24.062970,ReLU,ReLU,Tanh,ReLU,25,23,19.0,16.0,9.0,2.954545333364085e-05,4,297,0.698046001125117,2.3800467078922034e-05,107.95855818212233,COMPLETE
538,0.36751723289489746,2023-09-04 22:02:15.842749,2023-09-04 22:02:22.249579,0 days 00:00:06.406830,Tanh,Sigmoid,Tanh,,23,22,18.0,2.0,,0.0006104810349318315,3,276,0.21820926153823256,2.0360781841510084e-05,116.15175839626428,COMPLETE
539,0.3347034156322479,2023-09-04 22:02:22.250226,2023-09-04 22:02:23.997664,0 days 00:00:01.747438,ReLU,ReLU,Tanh,,23,22,17.0,17.0,,0.04432872663615697,3,269,0.732837423024193,5.730849105257363e-05,236.8314695812407,COMPLETE
540,0.3073982894420624,2023-09-04 22:02:23.998341,2023-09-04 22:02:25.833132,0 days 00:00:01.834791,Tanh,Tanh,ReLU,,19,21,11.0,16.0,,0.0124542438260164,3,256,0.7667845999440499,2.8991928787557105e-05,89.663757748074,COMPLETE
541,1.0110474824905396,2023-09-04 22:02:25.833806,2023-09-04 22:02:29.300225,0 days 00:00:03.466419,ReLU,ReLU,Tanh,Leaky,28,23,15.0,23.0,12.0,1.0678973482405965e-05,4,261,0.10369390424186896,1.4853708776056094e-05,140.49503569036608,COMPLETE
542,0.31953713297843933,2023-09-04 22:02:29.300927,2023-09-04 22:02:30.156010,0 days 00:00:00.855083,Tanh,Tanh,Tanh,,86,24,16.0,15.0,,0.015959835308609917,3,247,0.5755290007543274,0.0003086489991900596,109.1680838844993,COMPLETE
543,0.35375550389289856,2023-09-04 22:02:30.156750,2023-09-04 22:02:31.968019,0 days 00:00:01.811269,ReLU,ReLU,ReLU,,21,21,17.0,16.0,,0.03351730836848849,3,269,0.6675006480871665,8.970034918108232e-05,97.85245305841619,COMPLETE
544,0.3671072721481323,2023-09-04 22:02:31.968771,2023-09-04 22:02:32.220544,0 days 00:00:00.251773,ReLU,Tanh,,,96,22,18.0,,,0.008486163820133423,2,223,0.12513527389403725,4.8193707100603755e-05,121.90781918693992,COMPLETE
545,0.36017122864723206,2023-09-04 22:02:32.221224,2023-09-04 22:02:33.415850,0 days 00:00:01.194626,Leaky,ReLU,Tanh,,22,23,20.0,18.0,,0.010284556958094248,3,253,0.3958269226313725,1.1854539431536607e-05,130.97854614257812,COMPLETE
546,0.3863145112991333,2023-09-04 22:02:33.416512,2023-09-04 22:02:33.932403,0 days 00:00:00.515891,Tanh,ReLU,Tanh,ReLU,100,20,14.0,6.0,4.0,0.05558727849141734,4,241,0.24226653535168957,3.4852990812537143e-05,119.66872363620334,COMPLETE
547,0.3606966733932495,2023-09-04 22:02:33.933078,2023-09-04 22:02:34.657002,0 days 00:00:00.723924,Sigmoid,Tanh,ReLU,,78,21,15.0,7.0,,0.025064668112272072,3,263,0.25799168120675187,0.0005283215366816029,119.22326689500075,COMPLETE
548,0.40605422854423523,2023-09-04 22:02:34.657719,2023-09-04 22:02:48.281486,0 days 00:00:13.623767,ReLU,ReLU,Sigmoid,,31,11,10.0,15.0,,4.374304899956187e-05,3,234,0.7105591629332435,2.3975433977044544e-05,122.18631463988214,COMPLETE
549,0.3084614872932434,2023-09-04 22:02:48.282293,2023-09-04 22:02:49.223754,0 days 00:00:00.941461,Tanh,Tanh,Leaky,,88,22,19.0,7.0,,0.03681433505048677,3,286,0.748372553587964,0.0014405466309963082,102.87260200237405,COMPLETE
550,0.3699913024902344,2023-09-04 22:02:49.224407,2023-09-04 22:02:52.831885,0 days 00:00:03.607478,Leaky,ReLU,Tanh,Leaky,29,23,16.0,9.0,10.0,0.0007900951723842696,4,216,0.7993468590081324,1.735110710658485e-05,98.52434930136037,COMPLETE
551,0.3831055760383606,2023-09-04 22:02:52.832557,2023-09-04 22:02:54.853298,0 days 00:00:02.020741,ReLU,ReLU,Tanh,,25,14,14.0,19.0,,8.701055378370191e-05,3,247,0.15756514402298172,0.00829154774620784,103.78857069749098,COMPLETE
552,0.36809292435646057,2023-09-04 22:02:54.853680,2023-09-04 22:02:55.364698,0 days 00:00:00.511018,Tanh,Tanh,ReLU,,98,24,12.0,21.0,,0.0013310170246619256,3,271,0.37357118612222456,7.11622581138356e-05,146.268983568464,COMPLETE
553,0.3349153697490692,2023-09-04 22:02:55.365284,2023-09-04 22:02:55.831464,0 days 00:00:00.466180,ReLU,ReLU,Tanh,,27,20,18.0,22.0,,0.01942323107075706,3,259,0.6792265688807892,0.00025579962606318705,99.47409862942166,COMPLETE
554,0.33977726101875305,2023-09-04 22:02:55.832024,2023-09-04 22:02:56.167595,0 days 00:00:00.335571,Leaky,Tanh,Tanh,ReLU,81,22,15.0,24.0,5.0,0.007707254199133001,4,237,0.492655716654488,0.0002036035534696819,116.53175206338206,COMPLETE
555,0.4073181748390198,2023-09-04 22:02:56.168130,2023-09-04 22:02:56.370529,0 days 00:00:00.202399,ReLU,Leaky,ReLU,,33,21,17.0,16.0,,0.030048849278809135,3,253,0.21764862186922615,2.0156989724349783e-05,116.70622871035621,COMPLETE
556,0.3094569146633148,2023-09-04 22:02:56.370982,2023-09-04 22:02:56.851519,0 days 00:00:00.480537,Tanh,ReLU,Tanh,,100,21,13.0,15.0,,0.011636560945667824,3,279,0.7688402986689796,4.2365039429233247e-05,80.21344342912947,COMPLETE
557,0.30760326981544495,2023-09-04 22:02:56.851996,2023-09-04 22:02:57.296438,0 days 00:00:00.444442,Leaky,ReLU,Tanh,,90,20,14.0,17.0,,0.015272774931384262,3,227,0.7196036329154343,0.00013914784519522563,417.53584943498885,COMPLETE
558,0.28706181049346924,2023-09-04 22:02:57.296959,2023-09-04 22:02:58.936939,0 days 00:00:01.639980,ReLU,Tanh,ReLU,Tanh,23,22,13.0,9.0,18.0,0.0064111965020575085,4,244,0.7430453338400819,2.6744782086494233e-05,79.36212678389116,COMPLETE
559,0.3346819579601288,2023-09-04 22:02:58.937343,2023-09-04 22:02:59.206587,0 days 00:00:00.269244,Tanh,ReLU,Tanh,,97,23,19.0,10.0,,0.021152735734182727,3,174,0.2627574982786799,1.4238782275464936e-05,105.73582617441814,COMPLETE
560,0.40128520131111145,2023-09-04 22:02:59.206965,2023-09-04 22:02:59.379482,0 days 00:00:00.172517,ReLU,Tanh,Sigmoid,,36,24,15.0,16.0,,0.0452427590280359,3,258,0.1905236510089746,2.1245818577514773e-05,210.34000597502055,COMPLETE
561,0.31622475385665894,2023-09-04 22:02:59.379878,2023-09-04 22:03:02.454428,0 days 00:00:03.074550,Leaky,ReLU,Tanh,,57,20,11.0,8.0,,0.0005243499409684556,3,198,0.7720740396924034,3.535640332182743e-05,88.67068868783804,COMPLETE
