number,value,datetime_start,datetime_complete,duration,params_activation1,params_activation2,params_activation3,params_activation4,params_batch_size,params_fl1,params_fl2,params_fl3,params_fl4,params_learning_rate,params_n_layers,params_num_epochs,params_train_size,params_weight_decay,user_attrs_mre,state
1025,0.39010050892829895,2023-09-04 22:25:47.433460,2023-09-04 22:25:48.462524,0 days 00:00:01.029064,ReLU,ReLU,Tanh,,25,23,13.0,17.0,,0.005256521460342443,3,140,0.19700672746229875,0.002228715102219572,141.48944636753626,COMPLETE
1026,0.6756932735443115,2023-09-04 22:25:48.463329,2023-09-04 22:25:54.592946,0 days 00:00:06.129617,Tanh,Tanh,ReLU,,98,22,10.0,16.0,,1.0424165532183191e-05,3,217,0.7992712688022562,7.127451429748025e-05,100.77073581537343,COMPLETE
1027,0.3084193766117096,2023-09-04 22:25:54.593747,2023-09-04 22:26:00.754569,0 days 00:00:06.160822,Tanh,ReLU,Sigmoid,ReLU,13,19,7.0,15.0,22.0,0.029133856276268005,4,275,0.7473862406003207,3.0275911680114496e-05,90.30512938628326,COMPLETE
1028,0.3387022316455841,2023-09-04 22:26:00.755379,2023-09-04 22:26:02.267555,0 days 00:00:01.512176,ReLU,Leaky,Tanh,Leaky,43,23,15.0,7.0,7.0,0.011079423487244566,4,248,0.6955907451972605,1.8188143936103544e-05,116.71325214092548,COMPLETE
1029,0.29446977376937866,2023-09-04 22:26:02.268364,2023-09-04 22:26:04.903255,0 days 00:00:02.634891,Tanh,ReLU,ReLU,,22,18,14.0,16.0,,0.008131195853304258,3,241,0.6196532898627312,3.498415935145558e-05,96.54448805914984,COMPLETE
1030,0.3186182677745819,2023-09-04 22:26:04.904042,2023-09-04 22:26:14.473047,0 days 00:00:09.569005,ReLU,ReLU,Tanh,ReLU,29,20,11.0,21.0,23.0,0.0004147681315205548,4,260,0.49679820801965874,0.017768800933553014,104.15867372222294,COMPLETE
1031,0.3153458535671234,2023-09-04 22:26:14.473855,2023-09-04 22:26:17.313791,0 days 00:00:02.839936,Tanh,Tanh,ReLU,,49,21,17.0,10.0,,0.0015258582749345898,3,287,0.7723344590084376,0.00041626523178998534,103.87566363225218,COMPLETE
1032,0.4037196636199951,2023-09-04 22:26:17.314586,2023-09-04 22:26:18.164214,0 days 00:00:00.849628,Leaky,ReLU,Leaky,,27,21,9.0,11.0,,0.01799944461969544,3,253,0.20808821177547476,0.001113661733956561,109.12451804024833,COMPLETE
1033,0.32334616780281067,2023-09-04 22:26:18.165004,2023-09-04 22:26:25.133386,0 days 00:00:06.968382,Tanh,ReLU,Tanh,Leaky,72,22,16.0,9.0,8.0,0.00010065584603212923,4,267,0.5273604474286406,0.001426964738742359,133.64627603823772,COMPLETE
1034,0.4116738438606262,2023-09-04 22:26:25.134220,2023-09-04 22:26:30.673726,0 days 00:00:05.539506,ReLU,Tanh,Sigmoid,,33,22,10.0,6.0,,0.00019867205117883168,3,231,0.7989918595923413,2.30501543149482e-05,100.8532724091501,COMPLETE
1035,0.3119109272956848,2023-09-04 22:26:30.674177,2023-09-04 22:26:31.599180,0 days 00:00:00.925003,Tanh,ReLU,ReLU,Sigmoid,24,20,12.0,20.0,5.0,0.021952133246686364,4,243,0.7169971846989046,0.00022515637371880868,92.92901119109123,COMPLETE
1036,0.39557603001594543,2023-09-04 22:26:31.599609,2023-09-04 22:26:32.041079,0 days 00:00:00.441470,ReLU,Sigmoid,Tanh,,31,23,13.0,8.0,,0.0028183135205914504,3,252,0.14388932430282317,5.267931221376604e-05,119.67296297004424,COMPLETE
1037,0.32766643166542053,2023-09-04 22:26:32.041538,2023-09-04 22:26:33.015390,0 days 00:00:00.973852,Tanh,ReLU,Tanh,ReLU,37,23,14.0,16.0,21.0,0.005659810290148882,4,150,0.7454882133152094,1.3331093208752018e-05,107.42405107286241,COMPLETE
1038,0.3587433695793152,2023-09-04 22:26:33.015881,2023-09-04 22:26:33.694142,0 days 00:00:00.678261,Tanh,ReLU,ReLU,,17,21,15.0,1.0,,0.014999064936098724,3,272,0.33752682639023013,0.0005404505820496026,256.2450150709886,COMPLETE
1039,0.32586827874183655,2023-09-04 22:26:33.694703,2023-09-04 22:26:34.275384,0 days 00:00:00.580681,ReLU,Tanh,Tanh,,26,19,11.0,14.0,,0.008339255768713952,3,221,0.2560200929289731,2.7392621665502464e-05,150.3540946266868,COMPLETE
1040,0.3451126217842102,2023-09-04 22:26:34.275854,2023-09-04 22:26:34.585311,0 days 00:00:00.309457,Tanh,ReLU,Sigmoid,Leaky,45,20,9.0,7.0,13.0,0.03205077551224728,4,235,0.27977227405184196,1.5380907787609127e-05,123.83213206699916,COMPLETE
1041,0.40927520394325256,2023-09-04 22:26:34.585753,2023-09-04 22:26:35.581523,0 days 00:00:00.995770,Sigmoid,ReLU,ReLU,,29,13,12.0,17.0,,0.004618786202331058,3,245,0.767295480416428,1.9828472525656756e-05,153.13293680330602,COMPLETE
1042,0.377292662858963,2023-09-04 22:26:35.581941,2023-09-04 22:26:36.482537,0 days 00:00:00.900596,Leaky,ReLU,Tanh,Leaky,22,22,10.0,19.0,8.0,0.0009733928996409289,4,261,0.4371006611030836,4.3445936277476144e-05,243.11110149730337,COMPLETE
1043,0.35592615604400635,2023-09-04 22:26:36.482971,2023-09-04 22:26:36.865939,0 days 00:00:00.382968,ReLU,Tanh,ReLU,,27,21,8.0,15.0,,0.006929458593497776,3,304,0.24458341868934605,0.001019091131913872,108.70151500701904,COMPLETE
1044,0.39378005266189575,2023-09-04 22:26:36.866374,2023-09-04 22:26:37.230724,0 days 00:00:00.364350,Tanh,ReLU,Tanh,ReLU,66,22,15.0,16.0,11.0,0.003487299717505529,4,227,0.2995120142154362,0.00015022082671104005,113.05148864746094,COMPLETE
1045,0.34683722257614136,2023-09-04 22:26:37.231229,2023-09-04 22:26:37.619872,0 days 00:00:00.388643,Tanh,ReLU,Tanh,,97,23,17.0,18.0,,0.0011028956284817471,3,255,0.672046819676754,8.170571272575171e-05,97.16051503774283,COMPLETE
1046,0.24720486998558044,2023-09-04 22:26:37.620312,2023-09-04 22:26:39.621773,0 days 00:00:02.001461,ReLU,ReLU,Leaky,Leaky,20,19,22.0,5.0,9.0,0.010526965150537368,4,239,0.7999142872767911,3.562790971652031e-05,112.7392551280834,COMPLETE
1047,1.0078153610229492,2023-09-04 22:26:39.622193,2023-09-04 22:26:40.269725,0 days 00:00:00.647532,ReLU,ReLU,Leaky,Leaky,19,20,23.0,4.0,9.0,0.011296343778878112,4,265,0.7265253122029456,0.04589217408749431,100.43796825408936,COMPLETE
1048,0.3089340925216675,2023-09-04 22:26:40.270156,2023-09-04 22:26:42.077753,0 days 00:00:01.807597,Tanh,ReLU,ReLU,Leaky,21,22,21.0,4.0,10.0,0.009046778751290268,4,279,0.7682083440794006,0.006656469322827595,105.41636538038067,COMPLETE
1049,0.3000740706920624,2023-09-04 22:26:42.078184,2023-09-04 22:26:46.539067,0 days 00:00:04.460883,ReLU,ReLU,Leaky,Leaky,16,21,24.0,5.0,9.0,0.013358061101507283,4,246,0.7014080755380302,1.1277088758191075e-05,87.94171308434528,COMPLETE
1050,0.2934235632419586,2023-09-04 22:26:46.539529,2023-09-04 22:26:48.333628,0 days 00:00:01.794099,Tanh,ReLU,Leaky,Leaky,20,23,6.0,5.0,9.0,0.010661662430355186,4,482,0.7402500138104778,0.00028605720132136435,92.95301703250769,COMPLETE
1051,0.9482294321060181,2023-09-04 22:26:48.334407,2023-09-04 22:26:49.393727,0 days 00:00:01.059320,Leaky,ReLU,Leaky,Leaky,17,12,21.0,5.0,10.0,0.013064093092851451,4,240,0.5702372781208592,0.030679533857535708,99.73873549241286,COMPLETE
1052,0.36086010932922363,2023-09-04 22:26:49.394186,2023-09-04 22:26:50.183060,0 days 00:00:00.788874,Tanh,ReLU,Leaky,Leaky,21,20,21.0,5.0,8.0,0.010483091588547266,4,257,0.4321383153230161,0.003932762224168407,584.6454451711554,COMPLETE
1053,0.32813507318496704,2023-09-04 22:26:50.183493,2023-09-04 22:26:51.470696,0 days 00:00:01.287203,ReLU,ReLU,Leaky,Leaky,18,21,6.0,4.0,11.0,0.009829819019816919,4,253,0.6427645768141609,0.0018329286428045031,103.00488496438051,COMPLETE
1054,0.36284416913986206,2023-09-04 22:26:51.471120,2023-09-04 22:26:52.089309,0 days 00:00:00.618189,Tanh,ReLU,Leaky,Leaky,20,22,21.0,5.0,8.0,0.06025838525303813,4,268,0.7992654649432758,0.0003813324949898379,111.67467753092448,COMPLETE
1055,0.9792520999908447,2023-09-04 22:26:52.089754,2023-09-04 22:26:53.332549,0 days 00:00:01.242795,ReLU,ReLU,Leaky,Leaky,23,19,22.0,3.0,7.0,2.0085554597129158e-05,4,240,0.11021080904513936,0.0006845772090586793,97.51589018503824,COMPLETE
1056,0.30993160605430603,2023-09-04 22:26:53.332996,2023-09-04 22:26:54.905807,0 days 00:00:01.572811,Tanh,ReLU,Leaky,Leaky,15,21,16.0,6.0,9.0,0.007363044910113229,4,247,0.405826140599387,2.917314983737029e-05,99.11571681499481,COMPLETE
1057,0.34211477637290955,2023-09-04 22:26:54.906261,2023-09-04 22:26:56.342172,0 days 00:00:01.435911,Tanh,ReLU,Leaky,Leaky,18,23,17.0,5.0,24.0,0.008353264017381233,4,283,0.7700052930085001,2.2249578943372897e-05,120.76680649651422,COMPLETE
1058,0.34112536907196045,2023-09-04 22:26:56.342619,2023-09-04 22:26:56.849331,0 days 00:00:00.506712,ReLU,ReLU,Sigmoid,Leaky,19,20,22.0,6.0,10.0,0.013121453113645128,4,233,0.21586767824425956,1.5798704048526832e-05,499.64832878112793,COMPLETE
1059,0.45724189281463623,2023-09-04 22:26:56.849779,2023-09-04 22:27:04.337366,0 days 00:00:07.487587,Tanh,ReLU,Leaky,ReLU,23,22,22.0,4.0,12.0,1.4164701053309382e-05,4,262,0.722171344520077,0.012521969168131423,109.7524974327961,COMPLETE
1060,0.34218159317970276,2023-09-04 22:27:04.337790,2023-09-04 22:27:05.987461,0 days 00:00:01.649671,Leaky,ReLU,Leaky,Leaky,21,21,23.0,5.0,14.0,0.006313216798766044,4,271,0.6765328393055139,3.49254359078828e-05,89.50452622913178,COMPLETE
1061,0.3570288121700287,2023-09-04 22:27:05.988303,2023-09-04 22:27:08.550543,0 days 00:00:02.562240,ReLU,ReLU,Leaky,ReLU,25,10,13.0,6.0,7.0,0.000604313795096043,4,251,0.3254273729396527,4.583090041389931e-05,117.04861174511308,COMPLETE
1062,0.3207888603210449,2023-09-04 22:27:08.550994,2023-09-04 22:27:09.812886,0 days 00:00:01.261892,Tanh,ReLU,Leaky,Leaky,19,23,23.0,6.0,8.0,0.009027945609711884,4,294,0.589723053987767,1.7343488874281206e-05,99.04493589179461,COMPLETE
1063,0.32666194438934326,2023-09-04 22:27:09.813342,2023-09-04 22:27:10.838447,0 days 00:00:01.025105,Tanh,ReLU,Leaky,Sigmoid,23,18,16.0,17.0,10.0,0.01160765502434756,4,239,0.5309703486035192,6.708126406629203e-05,108.61357948996805,COMPLETE
1064,0.3288697898387909,2023-09-04 22:27:10.838891,2023-09-04 22:27:12.298452,0 days 00:00:01.459561,ReLU,ReLU,Leaky,Leaky,22,9,5.0,5.0,9.0,0.005456701859531327,4,256,0.7483074847098123,2.4973156532013537e-05,99.70574967757516,COMPLETE
1065,0.33569830656051636,2023-09-04 22:27:12.298902,2023-09-04 22:27:13.154102,0 days 00:00:00.855200,Tanh,ReLU,Leaky,ReLU,25,22,22.0,6.0,15.0,0.007152895496074667,4,211,0.7994893497671456,0.004923972994068019,108.48262141301082,COMPLETE
1066,1.1070188283920288,2023-09-04 22:27:13.154541,2023-09-04 22:27:13.558828,0 days 00:00:00.404287,Sigmoid,ReLU,ReLU,Tanh,31,19,24.0,17.0,11.0,0.014631368701717842,4,227,0.7089913526727586,0.021505714366074888,100.1907103402274,COMPLETE
1067,0.29026228189468384,2023-09-04 22:27:13.559256,2023-09-04 22:27:14.250605,0 days 00:00:00.691349,ReLU,ReLU,ReLU,Leaky,34,20,12.0,7.0,7.0,0.009644397935140632,4,247,0.7505585560541228,0.0004910478064026239,107.71974509102958,COMPLETE
1068,0.39580535888671875,2023-09-04 22:27:14.251054,2023-09-04 22:27:14.543764,0 days 00:00:00.292710,Tanh,Leaky,Sigmoid,ReLU,27,23,24.0,15.0,17.0,0.004129096283366556,4,262,0.1285236437104049,5.718265545155012e-05,108.79590526380036,COMPLETE
1069,0.38472092151641846,2023-09-04 22:27:14.544198,2023-09-04 22:27:14.977068,0 days 00:00:00.432870,Tanh,ReLU,ReLU,Leaky,24,22,14.0,16.0,6.0,0.0020897704027024893,4,276,0.2292014410912373,0.0009235825100810288,109.29949188232422,COMPLETE
1070,0.45605382323265076,2023-09-04 22:27:14.977540,2023-09-04 22:27:15.203426,0 days 00:00:00.225886,ReLU,ReLU,Leaky,ReLU,29,21,13.0,4.0,10.0,0.0065922974170297575,4,234,0.11787230886643575,1.3294286791029847e-05,133.34284062539376,COMPLETE
1071,0.38950884342193604,2023-09-04 22:27:15.203867,2023-09-04 22:27:15.434071,0 days 00:00:00.230204,Leaky,ReLU,,,42,20,15.0,,,0.09980186655643677,2,246,0.26302180780902984,2.139722113680445e-05,126.78467893600464,COMPLETE
1072,0.3312975764274597,2023-09-04 22:27:15.434478,2023-09-04 22:27:22.969780,0 days 00:00:07.535302,Tanh,ReLU,ReLU,Tanh,21,19,23.0,18.0,9.0,0.0001297942379042995,4,256,0.7715332926907188,3.771043297377464e-05,105.89182098255408,COMPLETE
1073,0.3424263596534729,2023-09-04 22:27:22.970212,2023-09-04 22:27:28.707284,0 days 00:00:05.737072,ReLU,ReLU,ReLU,Leaky,25,22,16.0,6.0,24.0,0.0002397455684484079,4,267,0.5611074676152222,0.011435380941317169,142589.58152650984,COMPLETE
1074,0.41494378447532654,2023-09-04 22:27:28.707723,2023-09-04 22:27:34.768972,0 days 00:00:06.061249,Tanh,ReLU,Sigmoid,ReLU,32,21,12.0,16.0,8.0,0.00031506222720689605,4,222,0.7266998872965864,0.0027256996809576156,121.00115599073806,COMPLETE
1075,0.6782095432281494,2023-09-04 22:27:34.769399,2023-09-04 22:27:35.288383,0 days 00:00:00.518984,Tanh,,,,36,20,,,,3.277356015059557e-05,1,239,0.10446440865701428,9.341189209188637e-05,104.96867657904845,COMPLETE
1076,0.35415658354759216,2023-09-04 22:27:35.288794,2023-09-04 22:27:36.023583,0 days 00:00:00.734789,ReLU,Sigmoid,ReLU,Leaky,28,23,20.0,4.0,11.0,0.015825525983322628,4,248,0.3762531221925646,0.003177750935962055,110.03511623460419,COMPLETE
1077,0.27195659279823303,2023-09-04 22:27:36.024022,2023-09-04 22:27:41.092561,0 days 00:00:05.068539,Tanh,ReLU,Leaky,Tanh,18,22,14.0,15.0,12.0,0.00047478928796776794,4,284,0.6856214143572922,2.910764729506732e-05,115.48400821325914,COMPLETE
1078,0.3784385025501251,2023-09-04 22:27:41.092985,2023-09-04 22:27:41.962267,0 days 00:00:00.869282,Tanh,ReLU,Leaky,Tanh,15,22,14.0,14.0,13.0,0.0005802451729985836,4,303,0.17152256490766457,1.9141537489097082e-05,111.83416966029576,COMPLETE
1079,0.3606800436973572,2023-09-04 22:27:41.962696,2023-09-04 22:27:49.450302,0 days 00:00:07.487606,ReLU,ReLU,Leaky,Tanh,12,21,22.0,14.0,12.0,0.00019910583248338652,4,291,0.6595672484261887,0.06000811627829168,118.08626330982555,COMPLETE
1080,0.33109596371650696,2023-09-04 22:27:49.450742,2023-09-04 22:27:51.089139,0 days 00:00:01.638397,Leaky,ReLU,Leaky,Tanh,18,23,14.0,15.0,12.0,0.0009348375258022719,4,296,0.6467017545208804,2.5199764426152932e-05,107.18155436613122,COMPLETE
1081,0.367857962846756,2023-09-04 22:27:51.089587,2023-09-04 22:27:53.075710,0 days 00:00:01.986123,Tanh,ReLU,Leaky,Tanh,17,19,14.0,16.0,13.0,0.002644350645610187,4,292,0.6001598201919767,0.009032395131327963,101.7750914255778,COMPLETE
1082,0.33150774240493774,2023-09-04 22:27:53.076170,2023-09-04 22:28:00.561240,0 days 00:00:07.485070,Tanh,ReLU,Leaky,Tanh,13,20,4.0,15.0,14.0,0.0005107632801045149,4,272,0.6856477666691358,0.0005889549316230778,102.04803676336584,COMPLETE
1083,0.3800510764122009,2023-09-04 22:28:00.561691,2023-09-04 22:28:03.064203,0 days 00:00:02.502512,ReLU,ReLU,Leaky,Tanh,14,22,14.0,15.0,11.0,0.0004338580900045062,4,291,0.6265429669919947,1.1026937624973655e-05,100.87818670272827,COMPLETE
1084,0.41997647285461426,2023-09-04 22:28:03.064640,2023-09-04 22:28:14.212283,0 days 00:00:11.147643,Tanh,ReLU,Leaky,Tanh,17,21,13.0,14.0,10.0,2.251086438777142e-05,4,308,0.6829183266991158,0.0012503323684919946,102.87425085786101,COMPLETE
1085,0.36094582080841064,2023-09-04 22:28:14.212726,2023-09-04 22:28:16.510704,0 days 00:00:02.297978,ReLU,ReLU,Sigmoid,Tanh,15,23,14.0,15.0,11.0,0.00038602180720106566,4,289,0.7990197841119534,3.0389547842156426e-05,95.70502830038265,COMPLETE
1086,0.38517987728118896,2023-09-04 22:28:16.511136,2023-09-04 22:28:20.686482,0 days 00:00:04.175346,Tanh,ReLU,Leaky,Tanh,19,22,15.0,15.0,16.0,0.0002826432605427616,4,280,0.1951617645700236,0.0008299034940251362,102.6836425499982,COMPLETE
1087,0.39206311106681824,2023-09-04 22:28:20.686934,2023-09-04 22:28:21.196645,0 days 00:00:00.509711,Tanh,ReLU,Leaky,Tanh,20,24,13.0,15.0,12.0,0.05010896157420766,4,279,0.31010873997170035,0.00010747056858925066,210.67993848077182,COMPLETE
1088,0.3252377212047577,2023-09-04 22:28:21.197099,2023-09-04 22:28:26.608161,0 days 00:00:05.411062,ReLU,Leaky,Leaky,Tanh,16,11,14.0,14.0,9.0,0.0004939852808674774,4,284,0.706534102459489,0.0024259877875786864,80.0558966729874,COMPLETE
1089,0.2867964208126068,2023-09-04 22:28:26.608939,2023-09-04 22:28:28.368223,0 days 00:00:01.759284,Leaky,ReLU,Leaky,Tanh,18,20,15.0,15.0,23.0,0.0033479325282227417,4,281,0.6661800126025557,0.000351943828953483,96.92274109522502,COMPLETE
1090,0.3025457262992859,2023-09-04 22:28:28.368670,2023-09-04 22:28:33.582219,0 days 00:00:05.213549,Tanh,ReLU,Leaky,Leaky,21,20,13.0,16.0,13.0,0.00021619731583558035,4,312,0.7472144991917876,0.00019689410713963744,113.12166982622288,COMPLETE
1091,0.26979801058769226,2023-09-04 22:28:33.582663,2023-09-04 22:28:35.260523,0 days 00:00:01.677860,ReLU,ReLU,Leaky,Sigmoid,17,21,15.0,16.0,10.0,0.0011311456691906778,4,285,0.7727133839673013,0.00013399048777403802,96.1995792388916,COMPLETE
1092,0.2695503234863281,2023-09-04 22:28:35.260968,2023-09-04 22:28:37.581077,0 days 00:00:02.320109,ReLU,ReLU,Leaky,Sigmoid,16,21,14.0,16.0,11.0,0.0024552301805802735,4,297,0.7000950152553049,0.0001184645603939657,103.55676334187136,COMPLETE
1093,0.3711082637310028,2023-09-04 22:28:37.581536,2023-09-04 22:28:38.710358,0 days 00:00:01.128822,ReLU,ReLU,Leaky,Sigmoid,12,21,14.0,16.0,11.0,0.0016957303546246785,4,304,0.18068494948392474,0.0001264344076743349,161.83651714083516,COMPLETE
1094,0.3580305874347687,2023-09-04 22:28:38.710795,2023-09-04 22:28:40.022645,0 days 00:00:01.311850,ReLU,ReLU,Leaky,Sigmoid,15,21,14.0,16.0,11.0,0.0016488762984700738,4,312,0.6246795791947646,9.170562068511609e-05,100.99842093972599,COMPLETE
1095,0.33322763442993164,2023-09-04 22:28:40.023092,2023-09-04 22:28:42.711590,0 days 00:00:02.688498,ReLU,ReLU,Leaky,Sigmoid,15,21,14.0,16.0,12.0,0.0008369034209400284,4,309,0.6533017500203184,0.0001428951410851532,96.26214643837748,COMPLETE
1096,0.3655022978782654,2023-09-04 22:28:42.712028,2023-09-04 22:28:43.427838,0 days 00:00:00.715810,ReLU,ReLU,Leaky,Sigmoid,15,21,15.0,16.0,10.0,0.0013257948879368874,4,297,0.27878278291914943,0.00010242033405233191,720.1946180188978,COMPLETE
1097,0.3258518576622009,2023-09-04 22:28:43.428263,2023-09-04 22:28:51.483192,0 days 00:00:08.054929,ReLU,Sigmoid,Leaky,Sigmoid,18,21,14.0,16.0,10.0,0.0003941415450519015,4,320,0.6895913223540077,0.00012766902921041866,102.99429514988717,COMPLETE
1098,0.35748887062072754,2023-09-04 22:28:51.483629,2023-09-04 22:28:56.102531,0 days 00:00:04.618902,ReLU,ReLU,Leaky,Sigmoid,14,21,15.0,17.0,12.0,0.0007134508301148814,4,288,0.6763160220822717,0.00015445129332028565,116.42292478810187,COMPLETE
1099,0.351336270570755,2023-09-04 22:28:56.102973,2023-09-04 22:28:57.178727,0 days 00:00:01.075754,ReLU,ReLU,Leaky,Sigmoid,16,21,15.0,15.0,11.0,0.0007044839084479517,4,298,0.42696381356532603,0.000118602170370684,135.97928873697916,COMPLETE
1100,0.34123438596725464,2023-09-04 22:28:57.179157,2023-09-04 22:29:00.694592,0 days 00:00:03.515435,ReLU,ReLU,Leaky,Sigmoid,12,21,14.0,16.0,10.0,0.00034664442270853984,4,286,0.3870645332643762,9.534836762175562e-05,128.45261728195916,COMPLETE
1101,0.35901275277137756,2023-09-04 22:29:00.695028,2023-09-04 22:29:02.632444,0 days 00:00:01.937416,ReLU,ReLU,Leaky,Sigmoid,17,20,14.0,17.0,9.0,0.0011692386193280654,4,294,0.7067528986848332,0.00010487936808832319,95.29303492032565,COMPLETE
1102,0.30849573016166687,2023-09-04 22:29:02.632872,2023-09-04 22:29:05.137653,0 days 00:00:02.504781,ReLU,ReLU,Leaky,Sigmoid,21,21,15.0,15.0,12.0,0.0006330444726055485,4,297,0.7220600965456517,4.204457352062391e-05,89.95742540101747,COMPLETE
1103,0.33824652433395386,2023-09-04 22:29:05.138106,2023-09-04 22:29:08.244250,0 days 00:00:03.106144,ReLU,ReLU,Leaky,Sigmoid,17,21,14.0,16.0,13.0,0.0013706216216709244,4,298,0.6951659188210855,0.00014165509901756335,105.5555783440085,COMPLETE
1104,0.36658379435539246,2023-09-04 22:29:08.244677,2023-09-04 22:29:09.514068,0 days 00:00:01.269391,ReLU,ReLU,Leaky,Sigmoid,14,20,15.0,17.0,10.0,0.00077894501303378,4,305,0.33733029842208384,7.92591163676768e-05,122.14990167450486,COMPLETE
1105,0.4825524389743805,2023-09-04 22:29:09.514506,2023-09-04 22:29:10.275817,0 days 00:00:00.761311,ReLU,ReLU,Leaky,Sigmoid,16,22,15.0,16.0,11.0,0.0004530480113581157,4,291,0.11409935232531364,6.627737706551289e-05,119.85932426452636,COMPLETE
1106,0.32289770245552063,2023-09-04 22:29:10.276250,2023-09-04 22:29:12.012898,0 days 00:00:01.736648,ReLU,ReLU,Leaky,Sigmoid,16,20,14.0,15.0,9.0,0.0024566453236797587,4,303,0.654984880865543,0.00010874491241941011,94.605726039156,COMPLETE
1107,0.333065390586853,2023-09-04 22:29:12.013324,2023-09-04 22:29:14.080315,0 days 00:00:02.066991,ReLU,ReLU,Leaky,Sigmoid,18,21,14.0,15.0,8.0,0.0017675066110335045,4,289,0.5394703693335382,0.00016619121376620617,105.1959433304636,COMPLETE
1108,0.39507368206977844,2023-09-04 22:29:14.080747,2023-09-04 22:29:15.361243,0 days 00:00:01.280496,ReLU,ReLU,Leaky,Sigmoid,19,22,14.0,16.0,12.0,0.0019462939725742783,4,283,0.22646438807941513,0.00012465027078615155,102.42648078070746,COMPLETE
1109,0.2886101305484772,2023-09-04 22:29:15.362048,2023-09-04 22:29:18.021162,0 days 00:00:02.659114,ReLU,Leaky,Leaky,Sigmoid,11,21,15.0,16.0,11.0,0.002793410154203618,4,323,0.6042580454265695,9.160827703630479e-05,98.19856671589177,COMPLETE
1110,0.361438512802124,2023-09-04 22:29:18.021609,2023-09-04 22:29:19.864778,0 days 00:00:01.843169,ReLU,ReLU,Leaky,Sigmoid,13,22,13.0,17.0,9.0,0.0014024721252870337,4,285,0.7213944437165118,7.825889312390351e-05,109.07100035014905,COMPLETE
1111,0.3145671486854553,2023-09-04 22:29:19.865236,2023-09-04 22:29:21.065883,0 days 00:00:01.200647,ReLU,ReLU,Leaky,Sigmoid,17,20,15.0,17.0,10.0,0.0009598197061620652,4,303,0.4101983523958884,0.00017577875859559744,153.51309290472068,COMPLETE
1112,0.3793000876903534,2023-09-04 22:29:21.066325,2023-09-04 22:29:22.128956,0 days 00:00:01.062631,ReLU,ReLU,Leaky,Sigmoid,19,21,14.0,15.0,8.0,0.0010340033058829628,4,286,0.445938971599368,5.190499467932361e-05,124.50882428757687,COMPLETE
1113,0.35089969635009766,2023-09-04 22:29:22.129395,2023-09-04 22:29:31.645805,0 days 00:00:09.516410,ReLU,ReLU,Leaky,Sigmoid,14,20,14.0,16.0,11.0,0.00010505361153026593,4,278,0.6381669179453066,0.00024732129977909044,113.3537144834696,COMPLETE
1114,0.37308821082115173,2023-09-04 22:29:31.646281,2023-09-04 22:29:32.865358,0 days 00:00:01.219077,ReLU,ReLU,Leaky,Sigmoid,17,21,13.0,17.0,9.0,0.0011673695365387816,4,275,0.7454112340837202,6.306196111867499e-05,129.98078842163085,COMPLETE
