number,value,datetime_start,datetime_complete,duration,params_activation1,params_activation2,params_activation3,params_activation4,params_batch_size,params_fl1,params_fl2,params_fl3,params_fl4,params_learning_rate,params_n_layers,params_num_epochs,params_train_size,params_weight_decay,user_attrs_mre,state
562,0.3215256929397583,2023-09-04 22:03:02.454821,2023-09-04 22:03:04.004160,0 days 00:00:01.549339,Tanh,Sigmoid,ReLU,Leaky,20,22,10.0,23.0,19.0,0.002292482657546086,4,248,0.7018745404909983,0.00044018026034972206,161.03480710481344,COMPLETE
563,0.337836354970932,2023-09-04 22:03:04.004557,2023-09-04 22:03:04.424854,0 days 00:00:00.420297,ReLU,ReLU,Leaky,,85,23,16.0,15.0,,0.009205152654784578,3,236,0.6454267161400541,0.0011143202699643736,96.61815359933036,COMPLETE
564,0.3051147758960724,2023-09-04 22:03:04.425324,2023-09-04 22:03:05.500227,0 days 00:00:01.074903,ReLU,Tanh,Tanh,,50,21,12.0,17.0,,0.00367613494611266,3,263,0.747548451114365,9.086085570341845e-05,94.77007850768074,COMPLETE
565,0.3569676876068115,2023-09-04 22:03:05.500631,2023-09-04 22:03:08.166250,0 days 00:00:02.665619,Leaky,ReLU,Tanh,,26,19,14.0,7.0,,0.00011582599788615616,3,225,0.3175062652066032,3.0195630750567243e-05,102.33353217230903,COMPLETE
566,0.38875284790992737,2023-09-04 22:03:08.166836,2023-09-04 22:03:08.988672,0 days 00:00:00.821836,Tanh,Tanh,ReLU,,28,22,18.0,6.0,,0.026604167736381464,3,292,0.775753853788944,0.0009589271716194573,100.28932291666666,COMPLETE
567,0.42441508173942566,2023-09-04 22:03:08.989088,2023-09-04 22:03:09.175759,0 days 00:00:00.186671,ReLU,ReLU,Tanh,ReLU,73,23,14.0,16.0,13.0,0.0636714271747036,4,185,0.17067614714290133,1.674418855213682e-05,116.33594594682965,COMPLETE
568,0.3752087354660034,2023-09-04 22:03:09.176191,2023-09-04 22:03:11.317972,0 days 00:00:02.141781,Tanh,,,,96,21,,,,0.0003351284378382259,1,215,0.7988474944619204,1.3379356424300422e-05,112.74423157447993,COMPLETE
569,0.3635116517543793,2023-09-04 22:03:11.318358,2023-09-04 22:03:12.038730,0 days 00:00:00.720372,Leaky,Tanh,Tanh,,30,24,17.0,23.0,,0.038960312044880804,3,252,0.6857241596374772,2.4940622429238716e-05,110.44102790138938,COMPLETE
570,0.3829481303691864,2023-09-04 22:03:12.039148,2023-09-04 22:03:12.601400,0 days 00:00:00.562252,ReLU,ReLU,ReLU,,98,20,15.0,14.0,,0.07677158224729137,3,275,0.7209889875962153,1.8952947449056805e-05,120.13638779923723,COMPLETE
571,0.3376663327217102,2023-09-04 22:03:12.602007,2023-09-04 22:03:13.296672,0 days 00:00:00.694665,Tanh,ReLU,Tanh,Leaky,89,22,11.0,18.0,14.0,0.017363468033479667,4,242,0.7441300617052726,0.0006298150550105249,104.46032177318226,COMPLETE
572,0.3602848947048187,2023-09-04 22:03:13.297059,2023-09-04 22:03:14.078888,0 days 00:00:00.781829,Sigmoid,Tanh,Tanh,,100,13,9.0,9.0,,0.007968311201465102,3,267,0.6064904866036537,0.0025742934623081072,128.104736984417,COMPLETE
573,0.33006173372268677,2023-09-04 22:03:14.079443,2023-09-04 22:03:14.649453,0 days 00:00:00.570010,ReLU,ReLU,ReLU,,24,12,16.0,5.0,,0.004837261871449422,3,253,0.4560025965248505,0.049581806324403926,118.06377792358398,COMPLETE
574,0.3552682399749756,2023-09-04 22:03:14.650188,2023-09-04 22:03:18.441357,0 days 00:00:03.791169,Leaky,Tanh,Tanh,,34,21,14.0,21.0,,0.0002771167398997626,3,231,0.4372229767899437,1.0243520578626959e-05,110.2459041380779,COMPLETE
575,0.32557764649391174,2023-09-04 22:03:18.442161,2023-09-04 22:03:21.164130,0 days 00:00:02.721969,ReLU,ReLU,Sigmoid,ReLU,32,23,13.0,22.0,17.0,0.013952353509032104,4,243,0.6640695269882447,0.00012806944687762708,106.82256665437117,COMPLETE
576,0.3868509531021118,2023-09-04 22:03:21.165223,2023-09-04 22:03:21.605416,0 days 00:00:00.440193,Tanh,ReLU,Tanh,,38,20,13.0,19.0,,0.006638864186763704,3,261,0.16247389545006838,5.591505786766022e-05,144.60639686584472,COMPLETE
577,0.2977512776851654,2023-09-04 22:03:21.605938,2023-09-04 22:03:22.583392,0 days 00:00:00.977454,ReLU,Tanh,Leaky,,86,24,12.0,10.0,,0.010687459587180852,3,235,0.7166005506396563,0.00036412423777428785,86.4971321261659,COMPLETE
578,0.41717180609703064,2023-09-04 22:03:22.584076,2023-09-04 22:03:27.508350,0 days 00:00:04.924274,Leaky,Leaky,ReLU,,95,19,15.0,24.0,,2.3019385984473524e-05,3,270,0.7995032877909121,4.510520118088354e-05,94.89496273464627,COMPLETE
579,0.3171151876449585,2023-09-04 22:03:27.508943,2023-09-04 22:03:29.527980,0 days 00:00:02.019037,Tanh,ReLU,Tanh,Leaky,92,22,18.0,16.0,10.0,0.0010196456988931658,4,220,0.7647873971308008,0.0001093376872201902,101.22049026489258,COMPLETE
580,0.3415663242340088,2023-09-04 22:03:29.528439,2023-09-04 22:03:31.711720,0 days 00:00:02.183281,ReLU,Tanh,Tanh,,28,21,10.0,15.0,,0.021691080637997698,3,301,0.6998009931983761,3.131536676220366e-05,100.87556226325758,COMPLETE
581,0.3515293300151825,2023-09-04 22:03:31.712572,2023-09-04 22:03:33.584720,0 days 00:00:01.872148,Tanh,ReLU,Tanh,,97,20,14.0,10.0,,0.0026150588524639007,3,250,0.7464905794831618,1.2260431271434805e-05,84.23284851074219,COMPLETE
582,0.3341572880744934,2023-09-04 22:03:33.586708,2023-09-04 22:03:34.956658,0 days 00:00:01.369950,Leaky,ReLU,ReLU,,26,14,17.0,14.0,,0.031241618845316625,3,158,0.5517512041591125,1.64390622215657e-05,145.9396542635831,COMPLETE
583,0.5255736708641052,2023-09-04 22:03:34.958284,2023-09-04 22:03:35.322793,0 days 00:00:00.364509,ReLU,Tanh,Tanh,ReLU,87,22,19.0,17.0,6.0,0.05194789180141033,4,322,0.2005974217403806,0.005577154888899386,587.4553864577721,COMPLETE
584,0.35862067341804504,2023-09-04 22:03:35.323680,2023-09-04 22:03:35.920367,0 days 00:00:00.596687,ReLU,ReLU,Tanh,,84,19,15.0,8.0,,0.01232077857354702,3,280,0.2721556236499794,0.0001635582733790763,99.79379018147786,COMPLETE
585,0.36090850830078125,2023-09-04 22:03:35.921071,2023-09-04 22:03:37.444332,0 days 00:00:01.523261,Tanh,Tanh,ReLU,,99,23,2.0,9.0,,0.004220100962618379,3,343,0.633414644496385,2.357467973093715e-05,121.0589713648746,COMPLETE
586,0.3505896031856537,2023-09-04 22:03:37.445004,2023-09-04 22:03:39.337575,0 days 00:00:01.892571,Leaky,ReLU,Tanh,,37,9,11.0,8.0,,0.0033280618840751627,3,258,0.7704996398498793,3.924492076544057e-05,114.05845582251455,COMPLETE
587,0.3138201832771301,2023-09-04 22:03:39.339604,2023-09-04 22:03:42.095672,0 days 00:00:02.756068,ReLU,ReLU,Tanh,,24,24,12.0,16.0,,0.02559001450288118,3,207,0.718989677422145,0.0007318769221646391,97.1748780992296,COMPLETE
588,0.4597320258617401,2023-09-04 22:03:42.096251,2023-09-04 22:03:50.653745,0 days 00:00:08.557494,Tanh,Sigmoid,ReLU,Tanh,30,20,16.0,6.0,9.0,0.00010977923870713847,4,243,0.3482712226949577,0.0004870320536429275,115.01083738224987,COMPLETE
589,0.4610002338886261,2023-09-04 22:03:50.654485,2023-09-04 22:03:51.290541,0 days 00:00:00.636056,ReLU,Tanh,,,94,21,14.0,,,0.0012057513407423412,2,228,0.13031919889915494,0.0013677999861733282,110.23348469042595,COMPLETE
590,0.3358737826347351,2023-09-04 22:03:51.291148,2023-09-04 22:03:53.988135,0 days 00:00:02.696987,Leaky,ReLU,Sigmoid,,35,23,20.0,11.0,,0.005858171580278491,3,252,0.6722885926222765,0.004759437430844687,144.09910531771385,COMPLETE
591,0.35364004969596863,2023-09-04 22:03:53.989565,2023-09-04 22:03:55.145311,0 days 00:00:01.155746,Tanh,Tanh,Tanh,,22,22,18.0,19.0,,0.01778963127609702,3,237,0.2956538399150162,0.0019544428793817886,103.36422729492188,COMPLETE
592,0.3651617467403412,2023-09-04 22:03:55.146014,2023-09-04 22:03:58.711049,0 days 00:00:03.565035,ReLU,ReLU,Leaky,,18,19,13.0,15.0,,0.008898785143628952,3,266,0.7457449948883577,0.025883636838085873,101.91000348871404,COMPLETE
593,0.30622896552085876,2023-09-04 22:03:58.711870,2023-09-04 22:04:00.597063,0 days 00:00:01.885193,Leaky,Tanh,Tanh,Leaky,90,24,14.0,17.0,15.0,0.006912022804671384,4,259,0.7730236431700558,0.00028337997718378186,155.84173470956307,COMPLETE
594,0.3884269893169403,2023-09-04 22:04:00.603367,2023-09-04 22:04:01.111909,0 days 00:00:00.508542,ReLU,ReLU,ReLU,,97,21,15.0,16.0,,0.03570315603338133,3,245,0.32474349862469315,0.013377244480197436,161.849462890625,COMPLETE
595,0.3412742018699646,2023-09-04 22:04:01.112801,2023-09-04 22:04:03.643492,0 days 00:00:02.530691,Sigmoid,ReLU,Tanh,,26,10,16.0,7.0,,0.004883219118940608,3,220,0.6996676233025557,7.929594005609516e-05,105.41608031590779,COMPLETE
596,0.5214084386825562,2023-09-04 22:04:03.644221,2023-09-04 22:04:04.022066,0 days 00:00:00.377845,Tanh,Tanh,Tanh,ReLU,40,22,9.0,23.0,3.0,0.021450339816491342,4,231,0.10353790478557941,2.744697468402918e-05,140.68775126139323,COMPLETE
597,0.3914567232131958,2023-09-04 22:04:04.022925,2023-09-04 22:04:04.521193,0 days 00:00:00.498268,ReLU,ReLU,ReLU,,100,15,10.0,9.0,,0.010332076440111462,3,275,0.24462359167770364,1.9847668966408454e-05,102.53200808438388,COMPLETE
598,0.35276365280151367,2023-09-04 22:04:04.521785,2023-09-04 22:04:05.106676,0 days 00:00:00.584891,Tanh,Tanh,Tanh,,32,23,13.0,20.0,,0.027803341803731327,3,252,0.3912834174651514,1.4110783663405219e-05,512.7016762181332,COMPLETE
599,0.3037288784980774,2023-09-04 22:04:05.108251,2023-09-04 22:04:06.390013,0 days 00:00:01.281762,Leaky,ReLU,Tanh,,64,22,19.0,10.0,,0.013632383318448755,3,239,0.799172993977421,3.2040936123258485e-05,95.57644902104917,COMPLETE
600,0.3100961744785309,2023-09-04 22:04:06.392173,2023-09-04 22:04:07.035206,0 days 00:00:00.643033,ReLU,ReLU,ReLU,Leaky,88,21,14.0,16.0,11.0,0.03931636682347048,4,263,0.7292115261111983,2.135301592693643e-05,109.62247258966619,COMPLETE
601,0.34137192368507385,2023-09-04 22:04:07.036290,2023-09-04 22:04:07.554226,0 days 00:00:00.517936,Tanh,Tanh,Tanh,,98,19,15.0,7.0,,0.016196310197257823,3,286,0.28982758046182633,0.00021715253497501307,110.18258830479213,COMPLETE
602,0.30980297923088074,2023-09-04 22:04:07.554891,2023-09-04 22:04:09.011989,0 days 00:00:01.457098,ReLU,ReLU,Tanh,,60,20,11.0,15.0,,0.0030237747681185435,3,211,0.48358180710050097,1.5340819684670215e-05,102.20803392437142,COMPLETE
603,0.3435707092285156,2023-09-04 22:04:09.012855,2023-09-04 22:04:14.999154,0 days 00:00:05.986299,Leaky,Tanh,ReLU,,43,23,17.0,18.0,,0.0002513559252790597,3,246,0.7405175198259014,1.1600133907300344e-05,87.71516827174595,COMPLETE
604,0.4010215699672699,2023-09-04 22:04:15.000070,2023-09-04 22:04:15.687582,0 days 00:00:00.687512,ReLU,Leaky,Sigmoid,Sigmoid,28,20,12.0,6.0,8.0,0.008155389220331549,4,199,0.14504066891042097,4.1954941785414816e-05,123.30259755452474,COMPLETE
605,0.32095205783843994,2023-09-04 22:04:15.688450,2023-09-04 22:04:20.491556,0 days 00:00:04.803106,Tanh,ReLU,Leaky,,21,24,18.0,17.0,,0.0015832324493776828,3,271,0.5078901129094073,2.6186831082756907e-05,105.89015558603647,COMPLETE
606,0.31961512565612793,2023-09-04 22:04:20.492202,2023-09-04 22:04:21.493000,0 days 00:00:01.000798,ReLU,ReLU,Tanh,,92,21,14.0,9.0,,0.005669052916623966,3,230,0.683798723620741,6.048372710162831e-05,110.23606199376724,COMPLETE
607,0.3373669981956482,2023-09-04 22:04:21.493699,2023-09-04 22:04:22.100343,0 days 00:00:00.606644,Leaky,Tanh,Tanh,,96,22,13.0,10.0,,0.04848980961356305,3,254,0.7770160782675944,3.430662666445026e-05,95.63629967825753,COMPLETE
608,0.47885316610336304,2023-09-04 22:04:22.101235,2023-09-04 22:04:23.732093,0 days 00:00:01.630858,Tanh,ReLU,ReLU,ReLU,37,12,15.0,22.0,13.0,6.009304600665426e-05,4,239,0.11836574866434627,1.8112791630363755e-05,177.54927075757143,COMPLETE
609,0.2825565040111542,2023-09-04 22:04:23.732499,2023-09-04 22:04:24.838566,0 days 00:00:01.106067,ReLU,Tanh,Tanh,,29,23,19.0,8.0,,0.004035580129510339,3,264,0.799736770213961,0.0005663400237580575,122.60352456229073,COMPLETE
610,0.48814207315444946,2023-09-04 22:04:24.838985,2023-09-04 22:04:26.206334,0 days 00:00:01.367349,Tanh,ReLU,Tanh,,25,22,17.0,20.0,,5.954124388701275e-05,3,224,0.1347099742130985,2.2254390588900562e-05,351.9108057022095,COMPLETE
611,0.288729727268219,2023-09-04 22:04:26.206984,2023-09-04 22:04:26.865251,0 days 00:00:00.658267,Leaky,Sigmoid,ReLU,,39,21,14.0,9.0,,0.03265462431979403,3,248,0.6512526060414199,0.0015984655003503797,383.0317882191051,COMPLETE
612,0.28314417600631714,2023-09-04 22:04:26.865664,2023-09-04 22:04:27.283968,0 days 00:00:00.418304,ReLU,ReLU,Tanh,,94,19,15.0,15.0,,0.018181504341960385,3,257,0.7236817585097726,0.000368911042911287,84.31329461300012,COMPLETE
613,0.31869977712631226,2023-09-04 22:04:27.284416,2023-09-04 22:04:27.774420,0 days 00:00:00.490004,ReLU,Tanh,,,100,11,16.0,,,0.023390607964241195,2,236,0.7517756841005895,1.6937944279607388e-05,110.04905700683594,COMPLETE
614,0.3250133991241455,2023-09-04 22:04:27.775035,2023-09-04 22:04:28.474937,0 days 00:00:00.699902,Tanh,ReLU,Tanh,,34,20,11.0,5.0,,0.007344186905456997,3,280,0.449042441666447,0.0031270153243648864,110.29771089553833,COMPLETE
615,1.105954885482788,2023-09-04 22:04:28.475504,2023-09-04 22:04:29.861926,0 days 00:00:01.386422,Leaky,Tanh,ReLU,Leaky,98,24,10.0,16.0,11.0,1.1432358075830143e-05,4,307,0.18093583008720007,4.697689053324548e-05,433.5346712491411,COMPLETE
616,0.30891233682632446,2023-09-04 22:04:29.862482,2023-09-04 22:04:30.786041,0 days 00:00:00.923559,ReLU,ReLU,Tanh,,31,22,9.0,24.0,,0.012401827408039237,3,246,0.6979254822232454,2.7061000206411715e-05,80.88436796607041,COMPLETE
617,0.44675710797309875,2023-09-04 22:04:30.786449,2023-09-04 22:04:30.993253,0 days 00:00:00.206804,Tanh,Tanh,Sigmoid,,69,13,13.0,21.0,,0.056411521931516,3,267,0.6055688636726476,0.011468637431256406,140.90428670247397,COMPLETE
618,0.33081942796707153,2023-09-04 22:04:30.993647,2023-09-04 22:04:32.141826,0 days 00:00:01.148179,Sigmoid,ReLU,Tanh,ReLU,84,23,12.0,14.0,12.0,0.009273542781961774,4,216,0.5784300409880032,0.0009560318864067909,101.40745385211447,COMPLETE
619,0.36872002482414246,2023-09-04 22:04:32.142302,2023-09-04 22:04:32.617518,0 days 00:00:00.475216,ReLU,ReLU,Leaky,,45,21,14.0,23.0,,0.0008414582629555607,3,252,0.15241313334753975,1.2275883106852423e-05,172.2500749813613,COMPLETE
620,0.4011510908603668,2023-09-04 22:04:32.618056,2023-09-04 22:04:35.266884,0 days 00:00:02.648828,Leaky,Tanh,ReLU,,23,22,18.0,11.0,,0.00014524302503521298,3,258,0.36280267877425915,3.7774925374227706e-05,120.91132593678904,COMPLETE
621,0.26245373487472534,2023-09-04 22:04:35.267276,2023-09-04 22:04:35.784432,0 days 00:00:00.517156,Tanh,ReLU,Tanh,Leaky,27,20,16.0,8.0,24.0,0.029928485696409605,4,232,0.767994016509383,1.3996807572329328e-05,109.54571228027343,COMPLETE
622,0.3552926778793335,2023-09-04 22:04:35.784983,2023-09-04 22:04:36.385000,0 days 00:00:00.600017,Tanh,ReLU,Tanh,Leaky,27,19,17.0,8.0,23.0,0.015442706427750443,4,225,0.7636259264181594,1.4663886889293134e-05,101.55564639442845,COMPLETE
623,0.4878264367580414,2023-09-04 22:04:36.385451,2023-09-04 22:04:36.960413,0 days 00:00:00.574962,Tanh,Tanh,Tanh,Leaky,29,19,16.0,9.0,24.0,0.029703743983649476,4,231,0.7678589063869048,0.08587436445667589,124.13075898822986,COMPLETE
624,0.3382493257522583,2023-09-04 22:04:36.960829,2023-09-04 22:04:37.746790,0 days 00:00:00.785961,Tanh,ReLU,ReLU,Leaky,26,20,17.0,8.0,22.0,0.021294065498146907,4,220,0.7372862312724592,1.0737850496920407e-05,101.40679290771484,COMPLETE
625,0.31182628870010376,2023-09-04 22:04:37.747439,2023-09-04 22:04:38.858060,0 days 00:00:01.110621,Tanh,Tanh,Tanh,Leaky,24,19,16.0,7.0,22.0,0.025040477156665217,4,206,0.7731785093935142,1.3565765485193924e-05,99.94991556803386,COMPLETE
626,0.333918958902359,2023-09-04 22:04:38.858591,2023-09-04 22:04:39.916898,0 days 00:00:01.058307,Tanh,ReLU,Tanh,Leaky,27,18,17.0,8.0,24.0,0.0022629914950679083,4,234,0.797363098391187,7.28101319675694e-05,103.73665416941924,COMPLETE
627,0.36969298124313354,2023-09-04 22:04:39.917325,2023-09-04 22:04:41.198378,0 days 00:00:01.281053,Tanh,Leaky,ReLU,Leaky,28,20,20.0,9.0,20.0,0.0006266687517946232,4,240,0.2538013555292917,1.775404284249915e-05,1800.420728579972,COMPLETE
628,0.31789544224739075,2023-09-04 22:04:41.198928,2023-09-04 22:04:43.963130,0 days 00:00:02.764202,Tanh,ReLU,Tanh,Leaky,31,20,16.0,8.0,23.0,0.0003693749762304481,4,217,0.5247672416364393,0.009605533061736395,124.28746574155745,COMPLETE
629,0.2839456796646118,2023-09-04 22:04:43.963598,2023-09-04 22:04:46.089965,0 days 00:00:02.126367,Tanh,Tanh,Tanh,ReLU,25,23,9.0,7.0,21.0,0.005989289246087306,4,228,0.7258762846363934,0.00010757938825899862,114.82975245884487,COMPLETE
630,0.275276243686676,2023-09-04 22:04:46.090407,2023-09-04 22:04:46.963982,0 days 00:00:00.873575,Tanh,ReLU,ReLU,Tanh,27,24,18.0,6.0,7.0,0.011023253228205613,4,189,0.7488986212636063,0.000635910014396868,126.18960202973464,COMPLETE
631,0.30750441551208496,2023-09-04 22:04:46.964457,2023-09-04 22:04:47.778295,0 days 00:00:00.813838,Tanh,ReLU,ReLU,Tanh,29,23,18.0,6.0,9.0,0.009503611918694966,4,189,0.7666393564895452,0.0005473155417048213,109.48682648794991,COMPLETE
632,0.4429328441619873,2023-09-04 22:04:47.778721,2023-09-04 22:04:50.485212,0 days 00:00:02.706491,Tanh,Tanh,ReLU,Leaky,25,24,17.0,6.0,5.0,0.00018788972749989963,4,178,0.3791773205291804,0.0007343462476935755,111.0443441412422,COMPLETE
633,0.3003448247909546,2023-09-04 22:04:50.485617,2023-09-04 22:04:51.545366,0 days 00:00:01.059749,Tanh,ReLU,ReLU,Tanh,28,24,18.0,5.0,7.0,0.010985881080446477,4,160,0.7133130310836996,0.0006870464976845626,89.212402735001,COMPLETE
634,0.3158147633075714,2023-09-04 22:04:51.545746,2023-09-04 22:04:52.944800,0 days 00:00:01.399054,Tanh,Tanh,ReLU,Tanh,21,24,18.0,7.0,6.0,0.006917819862595739,4,193,0.752807353536985,0.00017834221741600835,131.21724700927734,COMPLETE
635,0.3687814772129059,2023-09-04 22:04:52.945191,2023-09-04 22:04:53.536933,0 days 00:00:00.591742,Tanh,ReLU,ReLU,Tanh,27,24,19.0,6.0,7.0,0.0017753220668597653,4,184,0.21073764772404713,0.000823933615111398,119.34886852662954,COMPLETE
636,0.6805201768875122,2023-09-04 22:04:53.537346,2023-09-04 22:04:57.159439,0 days 00:00:03.622093,Tanh,ReLU,ReLU,Tanh,23,24,19.0,5.0,8.0,1.4962639345885782e-05,4,243,0.33360506754098934,0.0005041836131080136,97.81878115807051,COMPLETE
637,0.26909664273262024,2023-09-04 22:04:57.159914,2023-09-04 22:04:58.092273,0 days 00:00:00.932359,Tanh,Tanh,ReLU,Tanh,30,24,18.0,6.0,9.0,0.012741744740796165,4,168,0.797171916161389,0.0009951611719943164,80.4449354318472,COMPLETE
638,0.3654318153858185,2023-09-04 22:04:58.092755,2023-09-04 22:04:59.072401,0 days 00:00:00.979646,Tanh,Sigmoid,ReLU,Tanh,30,24,18.0,6.0,10.0,0.013428868785017953,4,175,0.42179563659429536,0.0011923246498581545,119.33090097763959,COMPLETE
639,0.30938687920570374,2023-09-04 22:04:59.073148,2023-09-04 22:05:00.762622,0 days 00:00:01.689474,Tanh,ReLU,ReLU,Tanh,32,24,18.0,5.0,9.0,0.012041963756242481,4,147,0.5378802488129063,0.001123331280160422,123.62469446936319,COMPLETE
640,0.3436320722103119,2023-09-04 22:05:00.763585,2023-09-04 22:05:11.911028,0 days 00:00:11.147443,Tanh,Tanh,ReLU,Tanh,30,24,18.0,6.0,8.0,7.987570339219927e-05,4,161,0.7771488377146168,0.0017513519510032934,106.89121739168345,COMPLETE
641,0.3977569043636322,2023-09-04 22:05:11.911807,2023-09-04 22:05:13.033120,0 days 00:00:01.121313,Tanh,ReLU,ReLU,Tanh,33,24,18.0,6.0,7.0,0.015203545814473711,4,174,0.7992982656818304,0.02212355988008483,102.44963691348121,COMPLETE
642,0.37005874514579773,2023-09-04 22:05:13.033572,2023-09-04 22:05:13.606460,0 days 00:00:00.572888,Tanh,Tanh,ReLU,Tanh,29,24,19.0,5.0,10.0,0.010373631936627683,4,147,0.3074064080789431,0.0006924389213140958,131.02303363430886,COMPLETE
643,0.3156394064426422,2023-09-04 22:05:13.606914,2023-09-04 22:05:17.158019,0 days 00:00:03.551105,Tanh,ReLU,ReLU,Tanh,27,24,17.0,4.0,12.0,0.017613619034947986,4,165,0.7972750646879423,0.0008144063571187647,91.43577472583668,COMPLETE
644,0.3332166075706482,2023-09-04 22:05:17.158782,2023-09-04 22:05:18.614346,0 days 00:00:01.455564,ReLU,ReLU,ReLU,Tanh,31,24,19.0,6.0,9.0,0.014566162940359223,4,134,0.410772221188888,0.0009316162049496065,100.45740952030305,COMPLETE
645,0.3569221496582031,2023-09-04 22:05:18.615189,2023-09-04 22:05:19.560577,0 days 00:00:00.945388,Tanh,Tanh,ReLU,Tanh,26,23,18.0,7.0,11.0,0.011926067194003583,4,185,0.19004810299839525,0.0013236287213464178,118.8512986127068,COMPLETE
646,0.3063189685344696,2023-09-04 22:05:19.561513,2023-09-04 22:05:22.838982,0 days 00:00:03.277469,ReLU,ReLU,ReLU,Sigmoid,30,24,17.0,6.0,6.0,0.004494876248576709,4,168,0.7626915064231813,0.0008783494564355555,110.05356159210206,COMPLETE
647,0.33593806624412537,2023-09-04 22:05:22.839654,2023-09-04 22:05:27.548777,0 days 00:00:04.709123,Tanh,Tanh,ReLU,ReLU,27,8,17.0,6.0,4.0,0.0010679505477109675,4,150,0.7987711832914226,0.0066655089919585705,112.56085098621458,COMPLETE
648,0.33484721183776855,2023-09-04 22:05:27.549401,2023-09-04 22:05:28.781326,0 days 00:00:01.231925,ReLU,ReLU,ReLU,ReLU,33,5,18.0,13.0,8.0,0.003463714657622134,4,155,0.7459376257220331,0.00046935716476761237,92.90880802699498,COMPLETE
649,0.3418886959552765,2023-09-04 22:05:28.781739,2023-09-04 22:05:29.087656,0 days 00:00:00.305917,Tanh,ReLU,ReLU,Tanh,25,23,19.0,7.0,14.0,0.019467300044092466,4,174,0.1477105647737038,0.0005774480436245954,649.3151417607846,COMPLETE
650,0.31404241919517517,2023-09-04 22:05:29.088086,2023-09-04 22:05:30.042294,0 days 00:00:00.954208,ReLU,Tanh,ReLU,ReLU,29,24,18.0,6.0,10.0,0.010109685344549119,4,140,0.7475701623884484,0.001980459735709557,89.392863778507,COMPLETE
651,1.0032422542572021,2023-09-04 22:05:30.042693,2023-09-04 22:05:33.471531,0 days 00:00:03.428838,Tanh,ReLU,ReLU,Tanh,36,4,19.0,7.0,11.0,1.320676557981223e-05,4,166,0.7121372548482322,0.00029751617217816946,99.79908122786556,COMPLETE
652,0.7295132279396057,2023-09-04 22:05:33.471959,2023-09-04 22:05:35.481688,0 days 00:00:02.009729,ReLU,Leaky,Sigmoid,ReLU,32,23,17.0,10.0,6.0,4.6396582104103784e-05,4,182,0.2188047094291383,0.0009996817686395384,102.99171942406959,COMPLETE
653,0.2907978296279907,2023-09-04 22:05:35.482382,2023-09-04 22:05:38.748293,0 days 00:00:03.265911,Tanh,Tanh,Leaky,Sigmoid,27,23,16.0,15.0,15.0,0.01390521415697189,4,171,0.7998443715538247,0.00039818290260191933,98.42415428161621,COMPLETE
654,0.4342600405216217,2023-09-04 22:05:38.749026,2023-09-04 22:05:40.002401,0 days 00:00:01.253375,ReLU,ReLU,ReLU,ReLU,30,21,18.0,11.0,2.0,0.005073933503523118,4,293,0.2857450282799998,5.165670381989583e-05,105.98739213209886,COMPLETE
