number,value,datetime_start,datetime_complete,duration,params_activation1,params_activation2,params_activation3,params_activation4,params_batch_size,params_fl1,params_fl2,params_fl3,params_fl4,params_learning_rate,params_n_layers,params_num_epochs,params_train_size,params_weight_decay,user_attrs_mre,state
1258,0.5804392695426941,2023-09-04 21:32:00.881874,2023-09-04 21:32:03.143420,0 days 00:00:02.261546,Tanh,Leaky,Sigmoid,,89,13,9.0,14.0,,0.00011505704786283297,3,191,0.7996947713145779,0.00020048851466878821,192.65953339581714,COMPLETE
1259,0.42285674810409546,2023-09-04 21:32:03.143867,2023-09-04 21:32:03.480458,0 days 00:00:00.336591,Tanh,Sigmoid,Leaky,Tanh,83,17,24.0,5.0,11.0,0.014029886745641916,4,155,0.29363994030586893,0.00034793258708195387,201.6513133146325,COMPLETE
1260,0.33173397183418274,2023-09-04 21:32:03.481010,2023-09-04 21:32:04.915768,0 days 00:00:01.434758,Tanh,ReLU,Sigmoid,,72,18,11.0,18.0,,0.0025341079510926338,3,219,0.695166015332484,0.00010607046675139743,163.80338577997117,COMPLETE
1261,0.5697910189628601,2023-09-04 21:32:04.916212,2023-09-04 21:32:05.039756,0 days 00:00:00.123544,ReLU,ReLU,Sigmoid,,81,19,23.0,6.0,,0.018317418127977277,3,173,0.10331474456997947,0.00027023570068849986,3143.3899810791017,COMPLETE
1262,0.3410673141479492,2023-09-04 21:32:05.040187,2023-09-04 21:32:05.395789,0 days 00:00:00.355602,Tanh,Sigmoid,ReLU,Sigmoid,78,18,9.0,17.0,17.0,0.04680395020547874,4,192,0.529879790791104,0.00016822922590859364,231.2565430671938,COMPLETE
1263,0.6723359823226929,2023-09-04 21:32:05.396235,2023-09-04 21:32:06.317607,0 days 00:00:00.921372,Tanh,Leaky,Tanh,,75,19,6.0,15.0,,0.00020770541045885262,3,145,0.768419923845126,0.05653305885971063,172.4170016994724,COMPLETE
1264,0.9486731886863708,2023-09-04 21:32:06.318077,2023-09-04 21:32:06.635119,0 days 00:00:00.317042,Tanh,ReLU,Sigmoid,,68,17,10.0,8.0,,0.025475027286297032,3,206,0.7256412095876288,0.09978912636925083,211.28286888485863,COMPLETE
1265,0.4337387979030609,2023-09-04 21:32:06.635672,2023-09-04 21:32:06.825896,0 days 00:00:00.190224,Tanh,Sigmoid,Sigmoid,,85,16,22.0,12.0,,0.02110822057751388,3,168,0.1707775715681021,0.00013185948956350596,174.4810782767631,COMPLETE
1266,0.309794545173645,2023-09-04 21:32:06.826355,2023-09-04 21:32:07.484939,0 days 00:00:00.658584,Tanh,ReLU,Leaky,,80,18,10.0,16.0,,0.032583965253146385,3,268,0.6164566696183749,0.00018916598447833824,135.25774888431326,COMPLETE
1267,0.7199722528457642,2023-09-04 21:32:07.485403,2023-09-04 21:32:07.672750,0 days 00:00:00.187347,Tanh,Sigmoid,Sigmoid,,76,17,11.0,7.0,,0.016455912484341424,3,431,0.1255166739373139,0.00022849342016727553,150.85540821241295,COMPLETE
1268,0.36739200353622437,2023-09-04 21:32:07.673230,2023-09-04 21:32:08.997253,0 days 00:00:01.324023,ReLU,ReLU,ReLU,,83,4,9.0,22.0,,0.0012887955799930227,3,224,0.4062893280693602,0.0010888200757726407,145.5586334637233,COMPLETE
1269,0.30273598432540894,2023-09-04 21:32:08.997715,2023-09-04 21:32:11.351467,0 days 00:00:02.353752,Tanh,Leaky,,,53,18,10.0,,,0.0006164423025041339,2,257,0.7635291377916092,0.00011332444248230775,216.81272535467866,COMPLETE
1270,0.49608075618743896,2023-09-04 21:32:11.351919,2023-09-04 21:32:13.187272,0 days 00:00:01.835353,Tanh,Sigmoid,,,78,20,8.0,,,0.0005219542198127682,2,194,0.7480080739651066,0.00015182789915847144,224.13943866847717,COMPLETE
1271,0.27370667457580566,2023-09-04 21:32:13.187733,2023-09-04 21:32:14.076861,0 days 00:00:00.889128,Tanh,ReLU,,,94,18,23.0,,,0.0020304917568346867,2,114,0.6572832947023171,1.040995873661827e-05,223.36134338378906,COMPLETE
1272,0.3724276125431061,2023-09-04 21:32:14.077291,2023-09-04 21:32:14.330535,0 days 00:00:00.253244,Tanh,ReLU,,,71,19,24.0,,,0.010404097782552251,2,132,0.38924889460506173,1.2887358946069984e-05,148.13225936889648,COMPLETE
1273,0.37641093134880066,2023-09-04 21:32:14.330985,2023-09-04 21:32:14.561302,0 days 00:00:00.230317,Tanh,Sigmoid,,,74,17,9.0,,,0.027091863465976175,2,333,0.27179405224189174,9.983853558242703e-05,296.6623306274414,COMPLETE
1274,0.3200822174549103,2023-09-04 21:32:14.561768,2023-09-04 21:32:14.913741,0 days 00:00:00.351973,ReLU,Leaky,,,60,19,7.0,,,0.05957913955749053,2,207,0.3449828319286489,0.0007746829264188446,118.39266289605035,COMPLETE
1275,0.2905133366584778,2023-09-04 21:32:14.914203,2023-09-04 21:32:17.416844,0 days 00:00:02.502641,Tanh,ReLU,Tanh,,81,15,11.0,11.0,,0.00038228176142532323,3,262,0.7062914753993756,1.5146920567928127e-05,235.5508090011946,COMPLETE
1276,0.3451150953769684,2023-09-04 21:32:17.417303,2023-09-04 21:32:18.146948,0 days 00:00:00.729645,Tanh,Sigmoid,,,78,16,10.0,,,0.012390100123210861,2,269,0.77216068950502,0.00019682076051584765,110.26620610555013,COMPLETE
1277,0.3885124623775482,2023-09-04 21:32:18.147401,2023-09-04 21:32:18.587603,0 days 00:00:00.440202,Tanh,ReLU,,,63,20,9.0,,,0.007677321580933854,2,182,0.7999195211700827,0.00041350805156997446,128.29800553755328,COMPLETE
1278,0.3719581961631775,2023-09-04 21:32:18.588067,2023-09-04 21:32:18.914631,0 days 00:00:00.326564,Tanh,,,,86,18,,,,0.038598158234746605,1,323,0.4801499853520032,0.00013115136839891427,140.1306821715157,COMPLETE
1279,0.38721805810928345,2023-09-04 21:32:18.915076,2023-09-04 21:32:19.364459,0 days 00:00:00.449383,Tanh,Sigmoid,,,76,17,10.0,,,0.02204707156034922,2,247,0.7372712394117167,0.006451667243893023,204.0863152480707,COMPLETE
1280,0.47875910997390747,2023-09-04 21:32:19.364884,2023-09-04 21:32:19.793651,0 days 00:00:00.428767,Tanh,ReLU,,,70,19,8.0,,,0.0008158168488596586,2,160,0.16918021319285842,0.0005788350481101762,775.8790526007214,COMPLETE
1281,0.3151301145553589,2023-09-04 21:32:19.794095,2023-09-04 21:32:21.763832,0 days 00:00:01.969737,ReLU,Leaky,,,80,17,11.0,,,0.0006990911567735279,2,276,0.6768054734535146,2.9177195847263254e-05,211.89956995218742,COMPLETE
1282,0.42138707637786865,2023-09-04 21:32:21.764281,2023-09-04 21:32:22.045054,0 days 00:00:00.280773,Tanh,ReLU,,,84,18,8.0,,,0.031399697988875104,2,415,0.2794217543905421,0.00015968003457341186,121.70289785820141,COMPLETE
1283,0.6372178196907043,2023-09-04 21:32:22.045491,2023-09-04 21:32:23.387872,0 days 00:00:01.342381,Tanh,Sigmoid,,,82,16,23.0,,,3.37925380521614e-05,2,210,0.507181986575643,1.8592352084187093e-05,183.20635038103376,COMPLETE
1284,0.4197213053703308,2023-09-04 21:32:23.388360,2023-09-04 21:32:23.537583,0 days 00:00:00.149223,Tanh,ReLU,,,66,19,6.0,,,0.014973880843077412,2,199,0.13998192921088426,0.0002189364242608786,168.2511439005534,COMPLETE
1285,0.29765549302101135,2023-09-04 21:32:23.538135,2023-09-04 21:32:24.707113,0 days 00:00:01.168978,Tanh,Sigmoid,Sigmoid,,73,18,21.0,4.0,,0.018388571399363066,3,364,0.7707234008373037,0.0002903810366305178,143.97300814115084,COMPLETE
1286,0.7767689824104309,2023-09-04 21:32:24.707595,2023-09-04 21:32:26.919475,0 days 00:00:02.211880,Tanh,Leaky,,,79,17,22.0,,,1.220824359386708e-05,2,256,0.7227986663133737,0.00011706315474387687,256.7192690372467,COMPLETE
1287,0.3496580123901367,2023-09-04 21:32:26.919918,2023-09-04 21:32:27.382883,0 days 00:00:00.462965,Tanh,ReLU,,,77,20,7.0,,,0.006458712307545116,2,233,0.5910101456616101,0.00016314540411951222,160.7925270928277,COMPLETE
1288,0.4483490586280823,2023-09-04 21:32:27.383306,2023-09-04 21:32:27.732445,0 days 00:00:00.349139,ReLU,Tanh,,,74,14,9.0,,,0.042898908508848976,2,188,0.770938031630345,0.009244831784040102,195.83821526889145,COMPLETE
1289,0.4500940442085266,2023-09-04 21:32:27.732884,2023-09-04 21:32:27.940416,0 days 00:00:00.207532,Tanh,Tanh,,,82,21,10.0,,,0.024182045528805346,2,264,0.16394692772715966,0.004598967420829942,913.4549026489258,COMPLETE
1290,0.2830192744731903,2023-09-04 21:32:27.940854,2023-09-04 21:32:28.696314,0 days 00:00:00.755460,Tanh,Sigmoid,,,69,18,11.0,,,0.029074963840180486,2,169,0.7996748848848683,9.392512987691209e-05,190.62448586990584,COMPLETE
1291,0.304980993270874,2023-09-04 21:32:28.696742,2023-09-04 21:32:29.035737,0 days 00:00:00.338995,Tanh,ReLU,,,88,19,24.0,,,0.036283415720830006,2,344,0.7472001787103139,0.00013839583259806092,148.01757960165702,COMPLETE
1292,0.3102656304836273,2023-09-04 21:32:29.036151,2023-09-04 21:32:29.860530,0 days 00:00:00.824379,Tanh,Tanh,Sigmoid,,76,16,12.0,18.0,,0.00864958518846312,3,288,0.6976390623823828,0.0002316887689561612,184.44100815210587,COMPLETE
1293,0.3982486128807068,2023-09-04 21:32:29.860990,2023-09-04 21:32:33.293695,0 days 00:00:03.432705,Tanh,ReLU,,,49,17,9.0,,,0.0002186753142767685,2,310,0.7242181808847487,0.00017860365883468364,157.67703348276567,COMPLETE
1294,0.5314901471138,2023-09-04 21:32:33.294158,2023-09-04 21:32:33.870778,0 days 00:00:00.576620,ReLU,Tanh,,,84,18,10.0,,,0.004488367631665759,2,120,0.7689569637490471,0.04520534853770919,217.3930172729492,COMPLETE
1295,0.3902835547924042,2023-09-04 21:32:33.871209,2023-09-04 21:32:35.099176,0 days 00:00:01.227967,Tanh,Sigmoid,,,80,17,8.0,,,0.003368212614594974,2,281,0.6440007358181707,0.00011585426201718062,256.84185810832236,COMPLETE
1296,0.5192333459854126,2023-09-04 21:32:35.099621,2023-09-04 21:32:39.044201,0 days 00:00:03.944580,Tanh,Leaky,,,79,19,9.0,,,0.00012293460191706475,2,302,0.509924110004434,0.0001403480806354691,991.8529014334773,COMPLETE
1297,0.28871873021125793,2023-09-04 21:32:39.044658,2023-09-04 21:32:39.383840,0 days 00:00:00.339182,Tanh,Tanh,,,71,18,23.0,,,0.01955590958584641,2,243,0.43221285492560263,0.0003518098734558336,199.7123021212491,COMPLETE
1298,0.39568039774894714,2023-09-04 21:32:39.384300,2023-09-04 21:32:39.575574,0 days 00:00:00.191274,Tanh,ReLU,,,78,17,11.0,,,0.013240310954763017,2,268,0.21197336633341943,0.0012934288561085973,177.13523463199013,COMPLETE
1299,0.4918109178543091,2023-09-04 21:32:39.576037,2023-09-04 21:32:39.805884,0 days 00:00:00.229847,Tanh,Tanh,Leaky,ReLU,75,18,9.0,8.0,22.0,0.002629564480312206,4,141,0.11843857669796011,0.00028725171416015856,200.43502675569974,COMPLETE
1300,0.36977627873420715,2023-09-04 21:32:39.806352,2023-09-04 21:32:42.532966,0 days 00:00:02.726614,Tanh,Sigmoid,,,86,20,10.0,,,0.0009300113434990097,2,317,0.7439453677385889,9.656872859583792e-05,245.9473136637113,COMPLETE
1301,0.30889084935188293,2023-09-04 21:32:42.533412,2023-09-04 21:32:43.634999,0 days 00:00:01.101587,ReLU,Tanh,Sigmoid,,82,16,7.0,19.0,,0.011176724803417996,3,220,0.6902450374962745,0.000481004848667161,180.36491443492747,COMPLETE
1302,0.3605234622955322,2023-09-04 21:32:43.635471,2023-09-04 21:32:44.516917,0 days 00:00:00.881446,Tanh,ReLU,,,90,17,12.0,,,0.023830527193527896,2,275,0.798833394372072,0.00018862206703083962,199.16079109593443,COMPLETE
1303,0.5826422572135925,2023-09-04 21:32:44.517723,2023-09-04 21:32:45.993386,0 days 00:00:01.475663,Tanh,Tanh,,,72,18,8.0,,,8.05261709831423e-05,2,299,0.19554411625731066,0.00015722976598271695,1028.276404543465,COMPLETE
1304,0.7037144899368286,2023-09-04 21:32:45.993814,2023-09-04 21:32:47.839236,0 days 00:00:01.845422,Tanh,Sigmoid,,,67,19,11.0,,,4.4673448606525006e-05,2,181,0.7693126329009676,0.0007104534413042543,140.16884823793865,COMPLETE
1305,0.39384809136390686,2023-09-04 21:32:47.839705,2023-09-04 21:32:48.080901,0 days 00:00:00.241196,Tanh,Leaky,,,77,17,24.0,,,0.016794178140015267,2,253,0.281152517435738,0.0002456451019129171,177.13091735839845,COMPLETE
1306,0.6277696490287781,2023-09-04 21:32:48.081338,2023-09-04 21:32:48.371201,0 days 00:00:00.289863,Tanh,ReLU,,,80,18,10.0,,,0.04663259396848352,2,289,0.5715612355246313,0.058488124296463495,266.97991894137476,COMPLETE
1307,0.3292214274406433,2023-09-04 21:32:48.371675,2023-09-04 21:32:48.927272,0 days 00:00:00.555597,ReLU,Tanh,,,59,19,22.0,,,0.030593701610924198,2,282,0.7158895236977346,0.00404023220927834,13358.24037982048,COMPLETE
1308,0.38686519861221313,2023-09-04 21:32:48.927706,2023-09-04 21:32:51.536116,0 days 00:00:02.608410,Tanh,Tanh,,,84,16,7.0,,,0.00025124012771781865,2,304,0.747645539037768,0.00011692726821925326,303.34385006051315,COMPLETE
1309,0.9515223503112793,2023-09-04 21:32:51.536544,2023-09-04 21:32:52.552273,0 days 00:00:01.015729,Tanh,ReLU,ReLU,,74,19,8.0,13.0,,2.031679516931426e-05,3,444,0.13355601151858085,0.0009648567295996544,109.65978481533291,COMPLETE
1310,0.3095622956752777,2023-09-04 21:32:52.552705,2023-09-04 21:32:53.347090,0 days 00:00:00.794385,Tanh,Sigmoid,,,54,17,9.0,,,0.02092126028078233,2,326,0.7693326055685111,0.0002009895238992429,137.33371782302856,COMPLETE
1311,0.6186321377754211,2023-09-04 21:32:53.347538,2023-09-04 21:32:54.443812,0 days 00:00:01.096274,Tanh,Tanh,,,81,20,23.0,,,6.562922816676176e-05,2,211,0.40465054357549485,0.00013785470849215017,303.2750905113763,COMPLETE
1312,0.516441822052002,2023-09-04 21:32:54.444235,2023-09-04 21:32:54.578075,0 days 00:00:00.133840,Tanh,ReLU,,,69,21,10.0,,,0.05671632102234751,2,189,0.10123589054008311,0.005607948778691173,1141.8046068464007,COMPLETE
1313,0.3679664731025696,2023-09-04 21:32:54.578543,2023-09-04 21:32:54.809192,0 days 00:00:00.230649,Tanh,Tanh,,,77,15,8.0,,,0.026170947778125616,2,259,0.14858444464095316,8.5274557104643e-05,214.34845849239466,COMPLETE
1314,0.27637526392936707,2023-09-04 21:32:54.809626,2023-09-04 21:32:55.388778,0 days 00:00:00.579152,ReLU,Leaky,,,79,18,12.0,,,0.014419718103242768,2,200,0.7329848676806792,0.00010316207788859844,1423.9992091737945,COMPLETE
1315,0.5023720264434814,2023-09-04 21:32:55.389210,2023-09-04 21:32:55.654594,0 days 00:00:00.265384,Tanh,Sigmoid,,,83,18,10.0,,,0.034001620308439943,2,272,0.24208507777193367,0.013757184137323243,246.03070882161458,COMPLETE
1316,0.3238222897052765,2023-09-04 21:32:55.655032,2023-09-04 21:32:56.171752,0 days 00:00:00.516720,Tanh,Tanh,,,75,17,21.0,,,0.009556011129706594,2,312,0.7987409568668314,0.0005445173605019992,171.14616173638237,COMPLETE
1317,0.31358423829078674,2023-09-04 21:32:56.172182,2023-09-04 21:32:57.114144,0 days 00:00:00.941962,Tanh,ReLU,Sigmoid,,86,19,9.0,15.0,,0.0010817309386236356,3,291,0.6907927832993677,0.0001668225065961064,1210.4484718640645,COMPLETE
1318,0.2980247735977173,2023-09-04 21:32:57.114713,2023-09-04 21:32:57.609424,0 days 00:00:00.494711,Tanh,Tanh,,,81,16,6.0,,,0.01814134348703696,2,384,0.7696271640378335,3.268489607760584e-05,190.9212916692098,COMPLETE
1319,0.7495466470718384,2023-09-04 21:32:57.609922,2023-09-04 21:32:59.282457,0 days 00:00:01.672535,Tanh,Sigmoid,,,46,18,11.0,,,2.5573989595671657e-05,2,403,0.22342866890315718,1.3330368895390363e-05,118.76425059202587,COMPLETE
1320,0.4205806851387024,2023-09-04 21:32:59.282895,2023-09-04 21:32:59.804942,0 days 00:00:00.522047,Tanh,ReLU,,,72,20,23.0,,,0.003943458638411294,2,298,0.3533781969748106,0.02903832334466413,462.96939600894325,COMPLETE
1321,0.3468177914619446,2023-09-04 21:32:59.805415,2023-09-04 21:33:00.274788,0 days 00:00:00.469373,ReLU,Tanh,,,65,17,24.0,,,0.03864564924168821,2,108,0.5352812559442143,0.0002158273742376774,140.51353270919233,COMPLETE
1322,0.3411196172237396,2023-09-04 21:33:00.275220,2023-09-04 21:33:01.034836,0 days 00:00:00.759616,Tanh,ReLU,,,78,18,10.0,,,0.006275436579301584,2,153,0.7228851183513579,0.00013173943992405142,152.78665325309657,COMPLETE
1323,0.3199921250343323,2023-09-04 21:33:01.035260,2023-09-04 21:33:01.570467,0 days 00:00:00.535207,Tanh,Leaky,,,62,17,11.0,,,0.022483994408041802,2,128,0.6641311929607877,0.0009688405450685234,178.77302612304686,COMPLETE
1324,0.2685375213623047,2023-09-04 21:33:01.570899,2023-09-04 21:33:02.856692,0 days 00:00:01.285793,Tanh,Tanh,,,51,9,9.0,,,0.0054017608266633595,2,175,0.799169074057729,0.0013792907233433403,212.71853289396867,COMPLETE
1325,0.4029003381729126,2023-09-04 21:33:02.857506,2023-09-04 21:33:06.180259,0 days 00:00:03.322753,Tanh,Sigmoid,Tanh,,88,19,8.0,14.0,,0.00043364028404569463,3,238,0.5084768144720674,0.0004124476607538846,263.142883621344,COMPLETE
1326,0.3094857931137085,2023-09-04 21:33:06.180717,2023-09-04 21:33:07.356052,0 days 00:00:01.175335,Tanh,Tanh,,,76,16,9.0,,,0.015332369353062479,2,422,0.7493836168363824,0.00026330877813303264,191.55386557945837,COMPLETE
1327,0.6139371991157532,2023-09-04 21:33:07.356883,2023-09-04 21:33:07.928902,0 days 00:00:00.572019,ReLU,ReLU,,,84,17,7.0,,,0.0017736516885657405,2,279,0.15703754248432747,0.00018239584186770884,145.55456963138303,COMPLETE
1328,0.28522059321403503,2023-09-04 21:33:07.929720,2023-09-04 21:33:08.826263,0 days 00:00:00.896543,Tanh,Tanh,,,79,18,11.0,,,0.01173490411884054,2,265,0.7676340572306366,1.650058066882212e-05,186.32522465632513,COMPLETE
1329,0.3687116205692291,2023-09-04 21:33:08.826709,2023-09-04 21:33:09.218693,0 days 00:00:00.391984,Tanh,Sigmoid,,,82,15,22.0,,,0.026052085024119445,2,318,0.5557108856164361,2.2996042700355572e-05,274.60623423258465,COMPLETE
1330,0.5562118887901306,2023-09-04 21:33:09.219138,2023-09-04 21:33:11.530556,0 days 00:00:02.311418,Tanh,ReLU,,,74,19,4.0,,,7.40018032322566e-05,2,306,0.6041878103368175,0.00012035158555030734,191.38124333799274,COMPLETE
1331,0.8349400758743286,2023-09-04 21:33:11.530998,2023-09-04 21:33:12.442871,0 days 00:00:00.911873,Tanh,Tanh,,,92,18,10.0,,,1.3782090048370153e-05,2,292,0.24416111039205796,0.0003157538784973294,129.23150718375427,COMPLETE
1332,0.5048599243164062,2023-09-04 21:33:12.443312,2023-09-04 21:33:12.710534,0 days 00:00:00.267222,Tanh,Leaky,,,68,17,24.0,,,0.029809096260301555,2,272,0.33765846412233363,0.019792367348978542,122.68869819641114,COMPLETE
1333,0.2844855487346649,2023-09-04 21:33:12.711002,2023-09-04 21:33:13.278523,0 days 00:00:00.567521,Sigmoid,Tanh,,,77,20,8.0,,,0.020186438277227534,2,256,0.4792437808276898,0.00014950627449241877,168.8998014151332,COMPLETE
1334,0.6901736259460449,2023-09-04 21:33:13.278971,2023-09-04 21:33:13.405198,0 days 00:00:00.126227,Tanh,Sigmoid,Sigmoid,,80,18,23.0,20.0,,0.04169243879835082,3,248,0.10025007198390368,9.026829373518462e-05,163.3373663160536,COMPLETE
1335,0.3372736871242523,2023-09-04 21:33:13.405662,2023-09-04 21:33:13.897903,0 days 00:00:00.492241,ReLU,ReLU,,,71,19,11.0,,,0.051023081620434015,2,335,0.711362291554097,0.00022607477935249453,130.202933453499,COMPLETE
1336,0.3608490228652954,2023-09-04 21:33:13.898346,2023-09-04 21:33:14.345395,0 days 00:00:00.447049,Tanh,Tanh,,,85,17,9.0,,,0.034228772549809806,2,282,0.7995896278977553,0.00010835478492804885,157.90645822664587,COMPLETE
1337,0.47573718428611755,2023-09-04 21:33:14.345835,2023-09-04 21:33:14.719392,0 days 00:00:00.373557,Tanh,ReLU,,,78,16,5.0,,,0.017458022608026216,2,180,0.4614726007191683,0.00017102597687067574,328.16088205013637,COMPLETE
1338,0.5377275943756104,2023-09-04 21:33:14.719835,2023-09-04 21:33:16.142955,0 days 00:00:01.423120,Tanh,Tanh,,,82,18,10.0,,,0.00016393444194555388,2,200,0.5749483834571169,0.003423482195928137,781.579080505371,COMPLETE
1339,0.4931316673755646,2023-09-04 21:33:16.143412,2023-09-04 21:33:18.988959,0 days 00:00:02.845547,Leaky,Sigmoid,,,73,19,12.0,,,5.53630529380537e-05,2,302,0.7399445938272448,0.0007735252421438778,253.18664457308535,COMPLETE
1340,0.39547431468963623,2023-09-04 21:33:18.989405,2023-09-04 21:33:19.227076,0 days 00:00:00.237671,Tanh,Tanh,,,80,17,9.0,,,0.01342245230049067,2,288,0.29893252655647745,7.899497002651301e-05,174.7383945465088,COMPLETE
1341,0.42864394187927246,2023-09-04 21:33:19.227538,2023-09-04 21:33:19.873358,0 days 00:00:00.645820,Tanh,ReLU,Sigmoid,,76,18,7.0,9.0,,0.026013393267026043,3,222,0.7677036655458744,0.02204782150677599,608.5767638008549,COMPLETE
1342,0.4278748333454132,2023-09-04 21:33:19.873812,2023-09-04 21:33:20.416170,0 days 00:00:00.542358,Tanh,Leaky,,,69,18,10.0,,,0.02245034870809798,2,310,0.681441678084449,0.006563544804837071,151.4073594291255,COMPLETE
1343,0.6159684062004089,2023-09-04 21:33:20.416631,2023-09-04 21:33:20.543560,0 days 00:00:00.126929,ReLU,Tanh,,,75,21,8.0,,,0.010650478880315662,2,167,0.10514886702291393,0.0001288517450960611,324.8606128692627,COMPLETE
1344,0.9874441623687744,2023-09-04 21:33:20.544022,2023-09-04 21:33:21.463873,0 days 00:00:00.919851,Leaky,Sigmoid,,,87,17,9.0,,,3.772198745653224e-05,2,263,0.279173399740918,0.00019663097391250795,501.06655210777836,COMPLETE
1345,0.2682953476905823,2023-09-04 21:33:21.464322,2023-09-04 21:33:22.057824,0 days 00:00:00.593502,Tanh,ReLU,,,83,19,10.0,,,0.030531862250310897,2,323,0.6342064968747427,0.0011679225681544166,148.8135073343913,COMPLETE
1346,0.3814750015735626,2023-09-04 21:33:22.058271,2023-09-04 21:33:22.646327,0 days 00:00:00.588056,Tanh,Tanh,,,44,20,11.0,,,0.06587827339134422,2,355,0.7441635546050824,0.0025270820849988542,219.80998916625975,COMPLETE
1347,0.3962859809398651,2023-09-04 21:33:22.646810,2023-09-04 21:33:24.308734,0 days 00:00:01.661924,Leaky,Tanh,,,58,17,23.0,,,0.000267772015187463,2,275,0.41718860590927603,0.00015133316305060218,278.2902940683328,COMPLETE
1348,0.550156831741333,2023-09-04 21:33:24.309208,2023-09-04 21:33:24.818519,0 days 00:00:00.509311,Tanh,Sigmoid,,,78,16,6.0,,,0.002199342561571789,2,185,0.23046257331392592,0.00026769300496576,278.9158316598812,COMPLETE
1349,0.3061775267124176,2023-09-04 21:33:24.818983,2023-09-04 21:33:25.902165,0 days 00:00:01.083182,Tanh,ReLU,Leaky,,81,19,10.0,10.0,,0.0015201951339927511,3,295,0.714008608564917,0.00037222686895532916,138.6314520234043,COMPLETE
1350,0.42366641759872437,2023-09-04 21:33:25.902649,2023-09-04 21:33:26.132960,0 days 00:00:00.230311,Tanh,Tanh,,,72,18,8.0,,,0.008115431233391243,2,283,0.14440307844524622,0.00968731647002391,129.6526416380014,COMPLETE
1351,0.3641291558742523,2023-09-04 21:33:26.133426,2023-09-04 21:33:26.579037,0 days 00:00:00.445611,Leaky,Leaky,,,85,18,24.0,,,0.018803739297331257,2,195,0.7737249238320847,0.032045117982595496,150.44506890433175,COMPLETE
1352,0.3212462365627289,2023-09-04 21:33:26.579490,2023-09-04 21:33:27.112481,0 days 00:00:00.532991,ReLU,ReLU,,,79,17,10.0,,,0.014634679885345284,2,269,0.7485823647707166,2.1478375652483563e-05,201.83752147968,COMPLETE
1353,0.40405163168907166,2023-09-04 21:33:27.112942,2023-09-04 21:33:27.371187,0 days 00:00:00.258245,Tanh,Sigmoid,,,70,16,22.0,,,0.03612638757645971,2,214,0.3903617234347016,0.00807011169502516,151.68334660385594,COMPLETE
