number,value,datetime_start,datetime_complete,duration,params_activation1,params_activation2,params_activation3,params_activation4,params_batch_size,params_fl1,params_fl2,params_fl3,params_fl4,params_learning_rate,params_n_layers,params_num_epochs,params_train_size,params_weight_decay,user_attrs_mre,state
446,0.2439388483762741,2023-09-04 22:14:53.447714,2023-09-04 22:14:54.461708,0 days 00:00:01.013994,Leaky,Leaky,Sigmoid,Sigmoid,69,10,18.0,13.0,6.0,0.008186107583920972,4,220,0.6872958594868438,0.0004992766291489736,113.46860692408178,COMPLETE
447,0.3105883300304413,2023-09-04 22:14:54.462065,2023-09-04 22:14:54.802124,0 days 00:00:00.340059,Tanh,Leaky,Sigmoid,Leaky,70,23,20.0,13.0,11.0,0.0065649250811259,4,217,0.6811169744231165,0.0003995971645443528,119.83955715013587,COMPLETE
448,0.30678439140319824,2023-09-04 22:14:54.802497,2023-09-04 22:14:55.063664,0 days 00:00:00.261167,Leaky,Leaky,Sigmoid,Sigmoid,69,22,21.0,13.0,10.0,0.00785958473003676,4,209,0.4109539240346948,0.0005449774295234173,101.68879954020183,COMPLETE
449,0.3574282228946686,2023-09-04 22:14:55.064045,2023-09-04 22:14:55.421938,0 days 00:00:00.357893,Tanh,Leaky,Sigmoid,Leaky,62,20,20.0,12.0,4.0,0.00869015519335132,4,223,0.6238463921312196,0.00047864953480697344,144.73204681396484,COMPLETE
450,0.3149140179157257,2023-09-04 22:14:55.422313,2023-09-04 22:14:56.581296,0 days 00:00:01.158983,Leaky,Sigmoid,Sigmoid,Sigmoid,65,24,19.0,13.0,5.0,0.011153162965785644,4,242,0.6657790978544663,0.00036618516374090163,117.78539830988103,COMPLETE
451,0.3226723372936249,2023-09-04 22:14:56.581664,2023-09-04 22:14:57.210531,0 days 00:00:00.628867,Tanh,Leaky,Sigmoid,Leaky,53,21,22.0,14.0,3.0,0.008965461583558642,4,228,0.3461198024560367,0.00010630616759745662,225.47528183628137,COMPLETE
452,0.23945027589797974,2023-09-04 22:14:57.210899,2023-09-04 22:14:57.790032,0 days 00:00:00.579133,Leaky,Leaky,Sigmoid,Sigmoid,73,19,21.0,12.0,6.0,0.053446258788230054,4,212,0.6983068511623661,0.0006590928717864053,109.88698543201794,COMPLETE
453,0.39444687962532043,2023-09-04 22:14:57.790407,2023-09-04 22:14:58.369385,0 days 00:00:00.578978,Leaky,Leaky,Sigmoid,Sigmoid,80,10,21.0,12.0,2.0,0.07690775747769218,4,200,0.4474610968297028,0.0005264709655313295,146.63569442085597,COMPLETE
454,0.30483588576316833,2023-09-04 22:14:58.369734,2023-09-04 22:14:58.732089,0 days 00:00:00.362355,Leaky,Leaky,Sigmoid,Sigmoid,74,9,22.0,12.0,7.0,0.037643124531310704,4,211,0.5985446501637353,0.0006714458479599229,254.1314796447754,COMPLETE
455,0.37445715069770813,2023-09-04 22:14:58.732438,2023-09-04 22:14:59.360117,0 days 00:00:00.627679,Leaky,Leaky,Sigmoid,Sigmoid,76,21,15.0,12.0,4.0,0.050888485618185146,4,183,0.6371118435840548,0.0007372422149313406,149.07813873291016,COMPLETE
456,0.44833120703697205,2023-09-04 22:14:59.360725,2023-09-04 22:15:00.641097,0 days 00:00:01.280372,Leaky,Sigmoid,Sigmoid,Sigmoid,74,5,21.0,11.0,11.0,0.0440080528103355,4,202,0.6856507588955469,0.000812074813717344,164.25836368136936,COMPLETE
457,0.3280770182609558,2023-09-04 22:15:00.641522,2023-09-04 22:15:01.009358,0 days 00:00:00.367836,Leaky,Leaky,,,78,19,23.0,,,0.058989169824055436,2,218,0.7111188468167253,0.0004901212500814076,115.06386795043946,COMPLETE
458,0.3036291301250458,2023-09-04 22:15:01.009707,2023-09-04 22:15:01.752852,0 days 00:00:00.743145,Leaky,Leaky,Sigmoid,Sigmoid,36,18,22.0,13.0,5.0,0.05251870106043903,4,272,0.5745537821171642,0.0003104663631545298,11004.003440163353,COMPLETE
459,0.4091644287109375,2023-09-04 22:15:01.753253,2023-09-04 22:15:01.970620,0 days 00:00:00.217367,Leaky,Leaky,Sigmoid,Sigmoid,76,20,21.0,12.0,10.0,0.060288152796796744,4,211,0.2290548474153693,0.003012788763859523,146.6642854690552,COMPLETE
460,0.36373066902160645,2023-09-04 22:15:01.970983,2023-09-04 22:15:02.487972,0 days 00:00:00.516989,Leaky,Leaky,Sigmoid,Sigmoid,86,15,21.0,13.0,6.0,0.0922892809288433,4,236,0.6572188462455234,0.0009117400252410117,192.50633193035515,COMPLETE
461,0.2783012390136719,2023-09-04 22:15:02.488330,2023-09-04 22:15:03.757090,0 days 00:00:01.268760,Leaky,Leaky,Sigmoid,Sigmoid,71,21,18.0,11.0,12.0,0.0023109315068424565,4,191,0.6952248305418395,0.0006068809533994774,123.3553194729787,COMPLETE
462,0.35165151953697205,2023-09-04 22:15:03.757468,2023-09-04 22:15:04.416595,0 days 00:00:00.659127,Leaky,Tanh,Sigmoid,Sigmoid,33,11,20.0,14.0,2.0,0.013657746409867728,4,262,0.37206226566236483,0.00043561390937479975,282.16427725332755,COMPLETE
463,0.37288159132003784,2023-09-04 22:15:04.417085,2023-09-04 22:15:05.207327,0 days 00:00:00.790242,ReLU,Sigmoid,Sigmoid,Sigmoid,30,20,17.0,24.0,5.0,0.025767146878226534,4,327,0.7245793321228956,0.0006217712187777639,131.00295853614807,COMPLETE
464,0.2964259386062622,2023-09-04 22:15:05.207712,2023-09-04 22:15:05.637814,0 days 00:00:00.430102,Leaky,Leaky,Sigmoid,Sigmoid,84,22,21.0,14.0,10.0,0.014974934985635882,4,222,0.6180455568955345,0.0002866321283984351,127.4251901626587,COMPLETE
465,0.43762850761413574,2023-09-04 22:15:05.638203,2023-09-04 22:15:05.842210,0 days 00:00:00.204007,Leaky,Leaky,Tanh,Sigmoid,79,10,20.0,16.0,7.0,0.03856005446979493,4,247,0.3550985785060373,0.00018896862058267655,144.34342369666467,COMPLETE
466,0.41186532378196716,2023-09-04 22:15:05.842560,2023-09-04 22:15:06.213355,0 days 00:00:00.370795,Leaky,Leaky,Sigmoid,Tanh,82,22,21.0,13.0,1.0,0.021873279495512057,4,309,0.38646866642226085,0.00034701762780742435,146.83455041738657,COMPLETE
467,1.2653934955596924,2023-09-04 22:15:06.213729,2023-09-04 22:15:06.512610,0 days 00:00:00.298881,Leaky,Leaky,Sigmoid,Sigmoid,91,23,19.0,24.0,6.0,0.0013571471914722675,4,208,0.20289820250342294,0.08998651477574691,747.155939512615,COMPLETE
468,0.3341172933578491,2023-09-04 22:15:06.512964,2023-09-04 22:15:06.729108,0 days 00:00:00.216144,Leaky,Leaky,Sigmoid,Sigmoid,87,19,22.0,12.0,13.0,0.012631594797251374,4,276,0.24027294940597402,9.20500379230259e-05,95.74004411697388,COMPLETE
469,0.34975185990333557,2023-09-04 22:15:06.729488,2023-09-04 22:15:07.080476,0 days 00:00:00.350988,Leaky,Leaky,Sigmoid,Sigmoid,72,21,18.0,17.0,12.0,0.017424546126650422,4,346,0.6829780744584522,5.068643515680241e-05,139.27142051414208,COMPLETE
470,0.3892541527748108,2023-09-04 22:15:07.080849,2023-09-04 22:15:07.497513,0 days 00:00:00.416664,ReLU,Sigmoid,Sigmoid,Sigmoid,47,20,22.0,24.0,3.0,0.029493617473793563,4,232,0.7364876753371468,6.886700282315924e-05,134.3419647216797,COMPLETE
471,0.40612027049064636,2023-09-04 22:15:07.497873,2023-09-04 22:15:07.780028,0 days 00:00:00.282155,Sigmoid,Leaky,Sigmoid,,84,24,20.0,16.0,,0.061867550520413775,3,260,0.7022035173077571,0.0002679132009422306,159.52822143554687,COMPLETE
472,0.4353877604007721,2023-09-04 22:15:07.780374,2023-09-04 22:15:08.016358,0 days 00:00:00.235984,Leaky,Leaky,Sigmoid,ReLU,88,16,21.0,16.0,11.0,0.006463444912336808,4,240,0.33788387953206295,1.3061435265335758e-05,141.84674028669085,COMPLETE
473,0.46788763999938965,2023-09-04 22:15:08.016740,2023-09-04 22:15:08.129963,0 days 00:00:00.113223,Leaky,Leaky,Sigmoid,Sigmoid,80,9,19.0,24.0,4.0,0.09886275592865373,4,218,0.12224105709628046,0.0007137606792638012,119.26571782430013,COMPLETE
474,0.3929392397403717,2023-09-04 22:15:08.130313,2023-09-04 22:15:08.390582,0 days 00:00:00.260269,Tanh,Leaky,Sigmoid,Sigmoid,85,21,20.0,10.0,6.0,0.07473541204941696,4,194,0.6620123547319136,1.737475334309792e-05,2104.102512904576,COMPLETE
475,0.3967079222202301,2023-09-04 22:15:08.390953,2023-09-04 22:15:09.043205,0 days 00:00:00.652252,Leaky,Tanh,Sigmoid,Leaky,37,19,21.0,17.0,5.0,0.012470282360053377,4,335,0.731341282259757,0.007624324101180376,145.47395604451498,COMPLETE
476,0.30597516894340515,2023-09-04 22:15:09.043570,2023-09-04 22:15:09.991386,0 days 00:00:00.947816,Tanh,Leaky,Tanh,Sigmoid,82,10,18.0,15.0,5.0,0.01582485354515507,4,254,0.5398294727969285,0.0001704494622603055,169.66648649833573,COMPLETE
477,0.2788439691066742,2023-09-04 22:15:09.992019,2023-09-04 22:15:10.923226,0 days 00:00:00.931207,Leaky,Sigmoid,Sigmoid,Leaky,89,20,20.0,13.0,10.0,0.022588618515133944,4,318,0.776853649941018,1.0213303223479734e-05,135.21927282945165,COMPLETE
478,0.36906465888023376,2023-09-04 22:15:10.923598,2023-09-04 22:15:11.608906,0 days 00:00:00.685308,Tanh,Leaky,Sigmoid,Sigmoid,77,11,21.0,23.0,6.0,0.009717718682159208,4,203,0.7475686628304378,0.0011723665409868204,111.98726498639142,COMPLETE
479,0.4943890869617462,2023-09-04 22:15:11.609267,2023-09-04 22:15:11.959377,0 days 00:00:00.350110,Leaky,Leaky,Sigmoid,Sigmoid,34,23,23.0,11.0,11.0,0.04412877650703826,4,230,0.6439542476276731,3.923294138013376e-05,204.86764322916667,COMPLETE
480,0.30894574522972107,2023-09-04 22:15:11.959802,2023-09-04 22:15:12.641108,0 days 00:00:00.681306,Tanh,Leaky,Sigmoid,Leaky,84,21,22.0,8.0,4.0,0.002114394689932002,4,301,0.1786281152409832,0.0005293805082633979,106.38951384621944,COMPLETE
481,0.3187573254108429,2023-09-04 22:15:12.641496,2023-09-04 22:15:13.439988,0 days 00:00:00.798492,Leaky,Leaky,Sigmoid,Sigmoid,81,8,19.0,24.0,5.0,0.007805355856540287,4,216,0.7086445648236013,2.511579112577637e-05,187.95637987662053,COMPLETE
482,0.3172670602798462,2023-09-04 22:15:13.440361,2023-09-04 22:15:14.231869,0 days 00:00:00.791508,Tanh,Leaky,Sigmoid,Leaky,83,22,20.0,23.0,3.0,0.01962002327800503,4,281,0.798601056018743,6.07966410853806e-05,81.19890152461944,COMPLETE
483,0.2852681279182434,2023-09-04 22:15:14.232233,2023-09-04 22:15:14.722175,0 days 00:00:00.489942,ReLU,Sigmoid,Sigmoid,Sigmoid,68,18,21.0,15.0,7.0,0.015295973654587807,4,490,0.6821782854169481,0.00020723385657308498,128.83532072368422,COMPLETE
484,0.28889015316963196,2023-09-04 22:15:14.722544,2023-09-04 22:15:15.307394,0 days 00:00:00.584850,Leaky,Leaky,Sigmoid,Tanh,86,20,16.0,14.0,5.0,0.011693339979619083,4,246,0.7440483517281122,2.1833623686037012e-05,112.17129745483399,COMPLETE
485,0.32935988903045654,2023-09-04 22:15:15.307786,2023-09-04 22:15:15.898030,0 days 00:00:00.590244,Tanh,Leaky,Sigmoid,Leaky,35,22,20.0,24.0,12.0,0.014260471253906722,4,223,0.4711198575139372,0.00011654082126749404,124.86556811210437,COMPLETE
486,0.3919546902179718,2023-09-04 22:15:15.898399,2023-09-04 22:15:16.743862,0 days 00:00:00.845463,Leaky,Leaky,Tanh,Sigmoid,75,10,19.0,16.0,6.0,0.0009985009774585287,4,233,0.5805250495066789,0.00040964979087640565,115.80752168852707,COMPLETE
487,0.6485700607299805,2023-09-04 22:15:16.744230,2023-09-04 22:15:17.212863,0 days 00:00:00.468633,Tanh,Tanh,Sigmoid,Sigmoid,79,19,21.0,14.0,2.0,0.0018585136492018169,4,272,0.5314161837303704,8.312077883339811e-05,188.88487594604493,COMPLETE
488,0.39341577887535095,2023-09-04 22:15:17.213245,2023-09-04 22:15:17.944860,0 days 00:00:00.731615,Leaky,Leaky,Sigmoid,Leaky,38,20,20.0,13.0,9.0,0.023581257534602554,4,173,0.7172590502570744,0.000849933801260336,154.85803010728625,COMPLETE
489,0.29596471786499023,2023-09-04 22:15:17.945242,2023-09-04 22:15:18.310147,0 days 00:00:00.364905,Leaky,Leaky,Sigmoid,Sigmoid,86,21,17.0,15.0,11.0,0.009979115522300162,4,356,0.7705803217968753,0.0002496150532161041,113.90350205557687,COMPLETE
490,0.6405687928199768,2023-09-04 22:15:18.310553,2023-09-04 22:15:18.628572,0 days 00:00:00.318019,Tanh,Sigmoid,Sigmoid,Leaky,93,11,19.0,24.0,4.0,0.00468839170974538,4,261,0.2560594932937032,4.8216422174509876e-05,193.03828114100864,COMPLETE
491,0.42959892749786377,2023-09-04 22:15:18.628958,2023-09-04 22:15:19.840383,0 days 00:00:01.211425,Leaky,Leaky,Sigmoid,Sigmoid,82,9,22.0,7.0,6.0,0.0011906310832249156,4,291,0.6186495580604903,0.006912363862669066,183.64585204351516,COMPLETE
492,0.29710644483566284,2023-09-04 22:15:19.840845,2023-09-04 22:15:20.250136,0 days 00:00:00.409291,Tanh,Leaky,Sigmoid,Sigmoid,84,21,21.0,23.0,12.0,0.03159143664753687,4,208,0.665364324555363,0.00015543573606991934,110.8433081490653,COMPLETE
493,0.22263899445533752,2023-09-04 22:15:20.250652,2023-09-04 22:15:21.277170,0 days 00:00:01.026518,Sigmoid,Leaky,Sigmoid,Leaky,32,18,20.0,12.0,7.0,0.018598087674380866,4,253,0.7434920041321517,1.259999340420849e-05,188.7817233692516,COMPLETE
494,0.316316694021225,2023-09-04 22:15:21.277661,2023-09-04 22:15:21.859577,0 days 00:00:00.581916,Sigmoid,Leaky,Sigmoid,Leaky,30,18,19.0,12.0,7.0,0.012408835046115339,4,255,0.42686197500958833,1.603126925619968e-05,191.6814219156901,COMPLETE
495,0.2860475778579712,2023-09-04 22:15:21.860081,2023-09-04 22:15:23.052061,0 days 00:00:01.191980,Leaky,Leaky,Sigmoid,Leaky,31,19,20.0,12.0,8.0,0.017213416048214324,4,251,0.7722785623534982,1.0124941374508164e-05,140.18001699447632,COMPLETE
496,0.281855046749115,2023-09-04 22:15:23.052449,2023-09-04 22:15:25.331242,0 days 00:00:02.278793,Sigmoid,Leaky,Sigmoid,Leaky,32,18,20.0,13.0,7.0,0.01592578794150569,4,269,0.7021905181594829,2.011823511355024e-05,101.83879310206363,COMPLETE
497,0.3527686297893524,2023-09-04 22:15:25.331620,2023-09-04 22:15:26.290578,0 days 00:00:00.958958,Sigmoid,Sigmoid,Sigmoid,Leaky,35,19,18.0,11.0,8.0,0.01078843572683127,4,239,0.3156930516581225,1.2946277820693689e-05,102.99863064414576,COMPLETE
498,0.4079850912094116,2023-09-04 22:15:26.291031,2023-09-04 22:15:26.667034,0 days 00:00:00.376003,Sigmoid,Leaky,Sigmoid,Leaky,38,19,20.0,11.0,7.0,0.06839612369724002,4,265,0.15867417280296311,1.1959294025193453e-05,136.33253407478333,COMPLETE
499,0.3459872007369995,2023-09-04 22:15:26.667423,2023-09-04 22:15:27.635651,0 days 00:00:00.968228,Sigmoid,Leaky,Sigmoid,Leaky,32,17,19.0,12.0,7.0,0.01916224165635566,4,247,0.44111400259221517,0.0014629416323287043,166.42648001278147,COMPLETE
500,0.4273851811885834,2023-09-04 22:15:27.636057,2023-09-04 22:15:27.954250,0 days 00:00:00.318193,Leaky,Leaky,Sigmoid,Leaky,27,19,20.0,17.0,10.0,0.007869225809797807,4,150,0.20152895884266292,0.0021197859865360233,123.47906247307273,COMPLETE
501,0.5937579274177551,2023-09-04 22:15:27.954628,2023-09-04 22:15:28.249312,0 days 00:00:00.294684,Sigmoid,Tanh,Sigmoid,Leaky,35,17,19.0,13.0,9.0,0.013767234187330136,4,256,0.21064163151051776,1.2904395330953365e-05,468.2879693773058,COMPLETE
502,0.511282205581665,2023-09-04 22:15:28.249696,2023-09-04 22:15:29.735899,0 days 00:00:01.486203,Sigmoid,Leaky,Sigmoid,Leaky,33,18,17.0,16.0,6.0,0.0016723508361683155,4,283,0.3240097458928188,1.5945604403912417e-05,260.43048923116334,COMPLETE
503,0.4097382426261902,2023-09-04 22:15:29.736288,2023-09-04 22:15:30.082600,0 days 00:00:00.346312,ReLU,,,,73,20,,,,0.025029239474959553,1,389,0.79820381989429,0.0005681873468873231,146.98686408996582,COMPLETE
504,0.3268400728702545,2023-09-04 22:15:30.082932,2023-09-04 22:15:31.316266,0 days 00:00:01.233334,Sigmoid,Leaky,Sigmoid,ReLU,33,24,18.0,12.0,13.0,0.04862039011274896,4,239,0.7241073403275653,0.0002091739347981522,129.97008568899972,COMPLETE
505,0.5790685415267944,2023-09-04 22:15:31.316628,2023-09-04 22:15:31.692068,0 days 00:00:00.375440,Leaky,Sigmoid,Sigmoid,Leaky,79,14,20.0,14.0,1.0,0.012965553041083487,4,323,0.11051741290220302,0.0003141730216032251,105.32888420478447,COMPLETE
506,0.6024431586265564,2023-09-04 22:15:31.692439,2023-09-04 22:15:36.859992,0 days 00:00:05.167553,Sigmoid,Leaky,Leaky,Leaky,30,10,19.0,15.0,6.0,6.314054637940913e-05,4,332,0.48691034700655594,0.0009993853859167285,164.73786648210273,COMPLETE
507,0.39890122413635254,2023-09-04 22:15:36.860347,2023-09-04 22:15:37.537551,0 days 00:00:00.677204,Leaky,Leaky,Sigmoid,Leaky,37,11,20.0,16.0,14.0,0.002749359958552312,4,248,0.3577051923156324,0.0004573428455409462,121.19452570355128,COMPLETE
508,0.33293285965919495,2023-09-04 22:15:37.537923,2023-09-04 22:15:38.108577,0 days 00:00:00.570654,Leaky,Leaky,Tanh,Leaky,77,20,21.0,12.0,7.0,0.009108155076027934,4,263,0.6432675039222121,1.0033313843072648e-05,102.43266954608993,COMPLETE
509,0.3687070310115814,2023-09-04 22:15:38.108969,2023-09-04 22:15:38.393751,0 days 00:00:00.284782,Leaky,Leaky,Sigmoid,Leaky,57,18,14.0,17.0,11.0,0.016664416257113998,4,306,0.2770732509891252,0.00012925568156158063,116.03116490290715,COMPLETE
510,1.0250425338745117,2023-09-04 22:15:38.394109,2023-09-04 22:15:38.510770,0 days 00:00:00.116661,Sigmoid,Leaky,Sigmoid,Leaky,81,10,20.0,15.0,10.0,0.006478416408504647,4,275,0.10162690718488047,0.025054717660523536,101.40353196667087,COMPLETE
511,1.0140000581741333,2023-09-04 22:15:38.511139,2023-09-04 22:15:38.784383,0 days 00:00:00.273244,Leaky,Sigmoid,Sigmoid,Sigmoid,50,19,19.0,16.0,6.0,0.011166638619277301,4,449,0.682727088328848,0.011591100719581493,104.99733479817708,COMPLETE
512,0.2754034399986267,2023-09-04 22:15:38.784756,2023-09-04 22:15:39.195385,0 days 00:00:00.410629,Leaky,Leaky,Sigmoid,Leaky,81,20,20.0,14.0,7.0,0.03743265715862655,4,229,0.7521098367231579,0.0001887939640766821,113.79576086228893,COMPLETE
513,0.22925454378128052,2023-09-04 22:15:39.195778,2023-09-04 22:15:40.324476,0 days 00:00:01.128698,ReLU,ReLU,Sigmoid,,83,9,22.0,17.0,,0.01957983971565446,3,342,0.76883833862034,0.00036544981307671615,107.6917773307638,COMPLETE
514,0.42800796031951904,2023-09-04 22:15:40.324839,2023-09-04 22:15:42.846700,0 days 00:00:02.521861,ReLU,ReLU,,,83,9,22.0,,,0.0005854470948985046,2,354,0.6969366322205562,0.0002719534725695371,113.06757548703986,COMPLETE
515,0.4065413177013397,2023-09-04 22:15:42.847049,2023-09-04 22:15:43.123250,0 days 00:00:00.276201,ReLU,ReLU,Sigmoid,Tanh,83,9,22.0,3.0,8.0,0.019291508976933283,4,347,0.7243866581047024,0.004471687251561932,139.16682470412482,COMPLETE
516,0.3759506046772003,2023-09-04 22:15:43.123609,2023-09-04 22:15:43.383215,0 days 00:00:00.259606,ReLU,Sigmoid,Sigmoid,,80,9,22.0,16.0,,0.020235604961476333,3,339,0.18412589127754977,0.0003807850503772023,116.3780510817902,COMPLETE
517,0.3073832094669342,2023-09-04 22:15:43.383617,2023-09-04 22:15:43.736458,0 days 00:00:00.352841,ReLU,ReLU,Sigmoid,,85,9,23.0,18.0,,0.027508906914756517,3,323,0.5171292747697557,0.00023608049758962473,110.91267516396262,COMPLETE
518,0.33363521099090576,2023-09-04 22:15:43.736819,2023-09-04 22:15:44.755844,0 days 00:00:01.019025,ReLU,ReLU,Sigmoid,Sigmoid,78,10,22.0,15.0,11.0,0.004114889735424969,4,341,0.7489453219753087,2.9693731288408642e-05,96.7640100815717,COMPLETE
519,0.850374162197113,2023-09-04 22:15:44.756233,2023-09-04 22:15:47.833712,0 days 00:00:03.077479,ReLU,ReLU,Sigmoid,,82,7,23.0,17.0,,1.8793222208124433e-05,3,347,0.6667579804625949,4.0961691038546314e-05,147.38300543353606,COMPLETE
520,0.674027681350708,2023-09-04 22:15:47.834062,2023-09-04 22:15:50.535600,0 days 00:00:02.701538,Tanh,ReLU,Sigmoid,,85,9,21.0,16.0,,3.350788086754535e-05,3,336,0.6067966810486819,0.00016340841178653326,343.6274008977981,COMPLETE
521,0.38732948899269104,2023-09-04 22:15:50.535965,2023-09-04 22:15:50.879548,0 days 00:00:00.343583,ReLU,ReLU,Sigmoid,Sigmoid,81,8,1.0,16.0,9.0,0.01471937494542834,4,362,0.419245323447262,5.7190383845223835e-05,118.93289167230779,COMPLETE
522,0.5041526556015015,2023-09-04 22:15:50.879955,2023-09-04 22:15:51.319680,0 days 00:00:00.439725,ReLU,Tanh,Tanh,Sigmoid,36,10,23.0,15.0,12.0,0.025604428458755848,4,316,0.714554204393175,0.00036042190045543237,135.84024810791016,COMPLETE
523,0.3311620354652405,2023-09-04 22:15:51.320059,2023-09-04 22:15:51.658449,0 days 00:00:00.338390,ReLU,Leaky,Sigmoid,,83,8,21.0,17.0,,0.055635195512284526,3,293,0.7657067077181374,1.6488090363158e-05,128.67488748055916,COMPLETE
524,0.4182772934436798,2023-09-04 22:15:51.658823,2023-09-04 22:15:52.673835,0 days 00:00:01.015012,ReLU,ReLU,Sigmoid,Sigmoid,24,11,18.0,16.0,18.0,0.031126981412796996,4,380,0.6423418184159716,2.5528290730260945e-05,122.96681089658995,COMPLETE
525,0.28938278555870056,2023-09-04 22:15:52.674217,2023-09-04 22:15:53.181967,0 days 00:00:00.507750,Tanh,ReLU,Sigmoid,Sigmoid,85,19,5.0,13.0,6.0,0.0173645618950067,4,327,0.6886633062948216,3.627136891322624e-05,114.41492358121005,COMPLETE
526,0.4091901183128357,2023-09-04 22:15:53.182333,2023-09-04 22:15:54.142028,0 days 00:00:00.959695,Sigmoid,ReLU,Sigmoid,ReLU,29,8,22.0,15.0,11.0,0.012917792131185808,4,266,0.7312916637368135,0.0001236445872353144,217.8215068095439,COMPLETE
527,0.32036128640174866,2023-09-04 22:15:54.142393,2023-09-04 22:15:55.029077,0 days 00:00:00.886684,Tanh,Sigmoid,,,79,20,21.0,,,0.0031510556850023338,2,330,0.7512475295429876,1.223581344913915e-05,223.82113358347038,COMPLETE
528,0.3214716613292694,2023-09-04 22:15:55.029446,2023-09-04 22:15:55.789978,0 days 00:00:00.760532,Tanh,Leaky,Sigmoid,Sigmoid,34,10,22.0,11.0,13.0,0.01022022899585206,4,251,0.7770079161443791,0.000280783558997598,153.9675750732422,COMPLETE
529,0.6693001985549927,2023-09-04 22:15:55.790358,2023-09-04 22:15:57.422378,0 days 00:00:01.632020,ReLU,Leaky,Sigmoid,Sigmoid,83,9,21.0,14.0,10.0,0.00026699788453960095,4,301,0.3055473351910044,4.813086217276558e-05,124.29265102754003,COMPLETE
530,0.24743196368217468,2023-09-04 22:15:57.422756,2023-09-04 22:15:58.086485,0 days 00:00:00.663729,Tanh,Tanh,,,88,16,18.0,,,0.008165973709445199,2,281,0.7049181095082874,0.00018020742306769304,111.5862958908081,COMPLETE
531,0.2935352623462677,2023-09-04 22:15:58.086845,2023-09-04 22:15:58.729804,0 days 00:00:00.642959,Leaky,Leaky,Leaky,Sigmoid,39,19,21.0,16.0,7.0,0.02184735579319134,4,351,0.7990301841617757,0.00022470850674963743,121.87107385907855,COMPLETE
532,0.3761427104473114,2023-09-04 22:15:58.730183,2023-09-04 22:15:59.241498,0 days 00:00:00.511315,Tanh,Leaky,Sigmoid,Sigmoid,81,7,17.0,6.0,5.0,0.015249956932833255,4,186,0.6612021607675541,0.0007558565918313509,379.1686703225841,COMPLETE
533,0.27952077984809875,2023-09-04 22:15:59.241991,2023-09-04 22:15:59.719365,0 days 00:00:00.477374,Leaky,Leaky,Sigmoid,,70,10,20.0,15.0,,0.0437864779754691,3,258,0.733421115940899,0.00010051069979922848,109.0748743057251,COMPLETE
534,0.4223782420158386,2023-09-04 22:15:59.719861,2023-09-04 22:16:01.385503,0 days 00:00:01.665642,Tanh,Sigmoid,Sigmoid,Sigmoid,76,20,19.0,17.0,8.0,0.001006852419329508,4,241,0.5825070868979172,0.0003187402537920696,154.40470515785879,COMPLETE
535,0.9881696701049805,2023-09-04 22:16:01.385988,2023-09-04 22:16:01.573289,0 days 00:00:00.187301,Leaky,Leaky,Sigmoid,Sigmoid,86,20,22.0,15.0,10.0,0.07315772206930243,4,317,0.5612045676484496,0.01669070975658809,154.0412363688151,COMPLETE
