number,value,datetime_start,datetime_complete,duration,params_activation1,params_activation2,params_activation3,params_activation4,params_batch_size,params_fl1,params_fl2,params_fl3,params_fl4,params_learning_rate,params_n_layers,params_num_epochs,params_train_size,params_weight_decay,user_attrs_mre,state
468,0.2689771354198456,2023-09-04 21:29:04.075262,2023-09-04 21:29:06.002681,0 days 00:00:01.927419,Tanh,Leaky,,,30,11,16.0,,,0.0034010356713932675,2,436,0.6684423342702832,6.958366835849317e-05,87.40041063652664,COMPLETE
469,0.37918156385421753,2023-09-04 21:29:06.003246,2023-09-04 21:29:06.688132,0 days 00:00:00.684886,Tanh,Leaky,,,30,10,16.0,,,0.003566370050776601,2,483,0.21953326397364334,6.603485032823821e-05,132.85638322501347,COMPLETE
470,0.3603266477584839,2023-09-04 21:29:06.688459,2023-09-04 21:29:07.127964,0 days 00:00:00.439505,Leaky,Leaky,,,32,12,14.0,,,0.00303111700297073,2,428,0.6329669332144867,7.534174414889627e-05,105.26023680588295,COMPLETE
471,0.30728307366371155,2023-09-04 21:29:07.128386,2023-09-04 21:29:08.143899,0 days 00:00:01.015513,Tanh,Leaky,,,35,11,18.0,,,0.0020002592145120747,2,248,0.6042532644903864,9.11687172557893e-05,103.30220872927934,COMPLETE
472,0.3216855525970459,2023-09-04 21:29:08.144226,2023-09-04 21:29:08.871147,0 days 00:00:00.726921,Tanh,Leaky,,,30,17,17.0,,,0.003506322390811276,2,416,0.6785633616205955,5.6661923903205594e-05,107.80734820698582,COMPLETE
473,0.37112247943878174,2023-09-04 21:29:08.871496,2023-09-04 21:29:09.694753,0 days 00:00:00.823257,Tanh,Leaky,,,28,11,15.0,,,0.0011012474736626933,2,441,0.35806881140162805,0.00010371204081276202,107.02114486694336,COMPLETE
474,0.3431348502635956,2023-09-04 21:29:09.695094,2023-09-04 21:29:11.202786,0 days 00:00:01.507692,Tanh,Leaky,,,30,24,16.0,,,0.0008926278474799256,2,440,0.5068557040329245,4.5797635682337236e-05,106.25440466208536,COMPLETE
475,0.332092821598053,2023-09-04 21:29:11.203105,2023-09-04 21:29:13.024776,0 days 00:00:01.821671,Tanh,Leaky,,,32,10,13.0,,,0.005046962828771934,2,434,0.531335300137446,7.740712778132252e-05,108.95279742825416,COMPLETE
476,0.33554914593696594,2023-09-04 21:29:13.025336,2023-09-04 21:29:13.318909,0 days 00:00:00.293573,Tanh,Leaky,,,28,13,7.0,,,0.004715483580458612,2,462,0.2694930190655868,6.848630388189183e-05,229.52610985008445,COMPLETE
477,0.34853652119636536,2023-09-04 21:29:13.319238,2023-09-04 21:29:13.567331,0 days 00:00:00.248093,Tanh,Leaky,,,37,12,11.0,,,0.018893395653490463,2,442,0.31154569279643496,0.00012298561087792877,97.7891011093602,COMPLETE
478,0.2895420789718628,2023-09-04 21:29:13.567670,2023-09-04 21:29:16.431594,0 days 00:00:02.863924,Tanh,Leaky,,,18,11,17.0,,,0.0016302151343421294,2,418,0.6769803024201541,8.883864958116247e-05,136.86067831856863,COMPLETE
479,0.3317123055458069,2023-09-04 21:29:16.431994,2023-09-04 21:29:17.252992,0 days 00:00:00.820998,Tanh,Leaky,Tanh,ReLU,27,23,17.0,10.0,6.0,0.002749449149690001,4,423,0.6012861667500977,0.0012963336601949306,103.37464502122667,COMPLETE
480,0.3898555338382721,2023-09-04 21:29:17.253323,2023-09-04 21:29:18.835663,0 days 00:00:01.582340,Sigmoid,Leaky,,,31,14,19.0,,,0.003989968412442477,2,436,0.6515222986812327,0.0017737217210356839,105.18380528575969,COMPLETE
481,0.3507034480571747,2023-09-04 21:29:18.836008,2023-09-04 21:29:19.573283,0 days 00:00:00.737275,Tanh,,,,21,10,,,,0.013793680402944729,1,442,0.7144132757929912,0.0009553659716309532,102.62021709623791,COMPLETE
482,0.3008142113685608,2023-09-04 21:29:19.573602,2023-09-04 21:29:20.492815,0 days 00:00:00.919213,Tanh,ReLU,,,25,11,15.0,,,0.01990984759896568,2,425,0.732269563059504,3.4786357715259285e-05,94.41053025618844,COMPLETE
483,0.2794211804866791,2023-09-04 21:29:20.493142,2023-09-04 21:29:21.537247,0 days 00:00:01.044105,Tanh,Leaky,,,16,21,14.0,,,0.006792779767849042,2,402,0.5569135385738913,0.0005966055929824933,99.07073679837313,COMPLETE
484,0.32630521059036255,2023-09-04 21:29:21.537585,2023-09-04 21:29:22.357491,0 days 00:00:00.819906,Tanh,Leaky,,,14,20,13.0,,,0.006862351736545237,2,433,0.37376212934570596,0.000629649108450176,111.92933969912322,COMPLETE
485,0.34049075841903687,2023-09-04 21:29:22.357808,2023-09-04 21:29:23.474129,0 days 00:00:01.116321,Tanh,Leaky,,,15,21,14.0,,,0.00537684026265323,2,413,0.6101098616150005,0.0007847283212698746,116.17898396083287,COMPLETE
486,0.45463913679122925,2023-09-04 21:29:23.474567,2023-09-04 21:29:26.330584,0 days 00:00:02.856017,Tanh,Leaky,,,11,20,13.0,,,0.00023097219265687705,2,449,0.7487142170991039,0.022585120405536504,92.84910882037619,COMPLETE
487,0.3042164146900177,2023-09-04 21:29:26.330906,2023-09-04 21:29:27.409299,0 days 00:00:01.078393,Tanh,Leaky,,,17,22,10.0,,,0.007116574229421551,2,406,0.5716005925235724,0.0005413493659281859,123.81188869476318,COMPLETE
488,0.32146942615509033,2023-09-04 21:29:27.409644,2023-09-04 21:29:28.472465,0 days 00:00:01.062821,Tanh,Tanh,,,13,21,14.0,,,0.005623377115538882,2,416,0.5687787308615049,0.000560131128095559,93.75768520957546,COMPLETE
489,0.3552362024784088,2023-09-04 21:29:28.472813,2023-09-04 21:29:30.641096,0 days 00:00:02.168283,Leaky,Leaky,,,16,21,12.0,,,0.0005186114724438457,2,396,0.7983404782633748,0.008244269717838792,108.30053080683169,COMPLETE
490,0.36165687441825867,2023-09-04 21:29:30.641611,2023-09-04 21:29:31.541706,0 days 00:00:00.900095,Tanh,Leaky,,,34,21,18.0,,,0.00032007117720197283,2,426,0.25952685363935757,0.0008306239422090221,128.70005616687592,COMPLETE
491,0.38738617300987244,2023-09-04 21:29:31.542062,2023-09-04 21:29:33.607786,0 days 00:00:02.065724,Tanh,Leaky,,,19,21,13.0,,,0.0006376939076760194,2,388,0.5401068594716493,0.0006324838697039263,101.28318149671642,COMPLETE
492,0.30601027607917786,2023-09-04 21:29:33.608123,2023-09-04 21:29:34.625740,0 days 00:00:01.017617,Tanh,Leaky,,,29,22,14.0,,,0.009415781867789878,2,403,0.551808241194744,0.00011021538319310138,94.01605743408203,COMPLETE
493,0.2640220820903778,2023-09-04 21:29:34.626076,2023-09-04 21:29:37.017643,0 days 00:00:02.391567,Tanh,Leaky,,,16,22,17.0,,,0.00847819040070767,2,396,0.588630287528291,0.0001410028065593358,106.56983726255355,COMPLETE
494,0.3175226151943207,2023-09-04 21:29:37.017993,2023-09-04 21:29:37.641443,0 days 00:00:00.623450,Tanh,Leaky,,,15,22,16.0,,,0.00890930049972734,2,398,0.5769316840825044,0.0001558350708673591,215.10129516601563,COMPLETE
495,0.32412955164909363,2023-09-04 21:29:37.641816,2023-09-04 21:29:38.356832,0 days 00:00:00.715016,ReLU,Leaky,,,17,22,17.0,,,0.007465600146109887,2,404,0.5975554874537515,0.002227168757372417,98.71253967285156,COMPLETE
496,0.39182958006858826,2023-09-04 21:29:38.357173,2023-09-04 21:29:49.029763,0 days 00:00:10.672590,Tanh,Leaky,,,11,23,17.0,,,2.757977075434219e-05,2,413,0.48342095100716165,0.00012695692304617425,115.72691182651474,COMPLETE
497,0.3160531520843506,2023-09-04 21:29:49.030129,2023-09-04 21:29:49.702958,0 days 00:00:00.672829,Tanh,Leaky,,,15,22,16.0,,,0.01090338385669307,2,389,0.49697268553139395,0.00046944260921151547,106.15079769011467,COMPLETE
498,0.33888253569602966,2023-09-04 21:29:49.703300,2023-09-04 21:29:50.501942,0 days 00:00:00.798642,Tanh,Leaky,,,14,21,16.0,,,0.008608858866983458,2,393,0.5422964349778627,0.0029381867288280758,95.32531984390751,COMPLETE
499,0.32132312655448914,2023-09-04 21:29:50.502496,2023-09-04 21:29:52.165755,0 days 00:00:01.663259,ReLU,Leaky,,,18,20,17.0,,,0.011698861233094082,2,455,0.6252138230346754,0.00016809655475353725,98.94954318091983,COMPLETE
500,0.35818997025489807,2023-09-04 21:29:52.166185,2023-09-04 21:29:52.779400,0 days 00:00:00.613215,Tanh,Leaky,,,13,22,17.0,,,0.013825795059259,2,154,0.5940220548085857,0.0006745106555621363,107.23943328857422,COMPLETE
501,0.48712441325187683,2023-09-04 21:29:52.779724,2023-09-04 21:29:53.984232,0 days 00:00:01.204508,Tanh,Sigmoid,,,17,23,15.0,,,0.00041291422761774877,2,410,0.295290415196729,0.09725196993265119,104.07822493010876,COMPLETE
502,0.3734600245952606,2023-09-04 21:29:53.984549,2023-09-04 21:29:55.746107,0 days 00:00:01.761558,ReLU,Leaky,,,31,22,14.0,,,0.00019479337087864338,2,133,0.5572889720307151,0.00013251881956530563,155.3670617583999,COMPLETE
503,0.36600157618522644,2023-09-04 21:29:55.746430,2023-09-04 21:29:56.023711,0 days 00:00:00.277281,Tanh,Leaky,,,16,21,16.0,,,0.006587149557806843,2,382,0.23836879196348523,0.006361163141038919,233.8285223642985,COMPLETE
504,0.3388151228427887,2023-09-04 21:29:56.024304,2023-09-04 21:29:57.071567,0 days 00:00:01.047263,Sigmoid,Leaky,,,28,23,15.0,,,0.015340636809623318,2,432,0.5657809545217124,0.00019895682122523657,96.01482370164659,COMPLETE
505,0.38851267099380493,2023-09-04 21:29:57.071999,2023-09-04 21:30:14.986431,0 days 00:00:17.914432,Tanh,Sigmoid,,,12,9,17.0,,,0.00014864255286031156,2,423,0.7660616383979463,0.0004424059830924021,118.79242311301806,COMPLETE
506,0.32027074694633484,2023-09-04 21:30:14.986761,2023-09-04 21:30:15.451384,0 days 00:00:00.464623,Tanh,Leaky,,,19,19,16.0,,,0.01007528795849897,2,393,0.4342872382232861,0.0005253564004393322,152.58749968430092,COMPLETE
507,0.3692793548107147,2023-09-04 21:30:15.451718,2023-09-04 21:30:16.343587,0 days 00:00:00.891869,ReLU,ReLU,,,27,9,18.0,,,0.0007626736461356413,2,381,0.249601211549551,0.0008701000780906023,105.54131235603158,COMPLETE
508,0.3541624844074249,2023-09-04 21:30:16.343935,2023-09-04 21:30:16.911769,0 days 00:00:00.567834,Tanh,Leaky,,,33,10,14.0,,,0.01265406404892551,2,376,0.5168018818081122,0.00014852026275617518,94.59699379129613,COMPLETE
509,0.3486327528953552,2023-09-04 21:30:16.912115,2023-09-04 21:30:17.457101,0 days 00:00:00.544986,Tanh,Leaky,,,10,24,12.0,,,0.008004316247249036,2,399,0.3893942690182663,0.004235238721087352,107.61958278309216,COMPLETE
510,0.3712040185928345,2023-09-04 21:30:17.457459,2023-09-04 21:30:19.465427,0 days 00:00:02.007968,Tanh,Leaky,ReLU,,17,21,17.0,1.0,,0.02580145879862191,3,451,0.746353622194002,6.240846605569247e-05,110.63150901794434,COMPLETE
511,0.36197447776794434,2023-09-04 21:30:19.465780,2023-09-04 21:30:19.729212,0 days 00:00:00.263432,ReLU,Tanh,ReLU,,29,8,16.0,16.0,,0.016701342309749345,3,382,0.5345697660032855,8.15923984531797e-05,110.5457627432687,COMPLETE
512,0.3382042944431305,2023-09-04 21:30:19.729573,2023-09-04 21:30:20.065992,0 days 00:00:00.336419,Tanh,Sigmoid,,,26,22,11.0,,,0.01090397073410988,2,389,0.20833011958200484,0.004824056966638989,116.17595298617493,COMPLETE
513,0.3530995845794678,2023-09-04 21:30:20.066366,2023-09-04 21:30:22.979578,0 days 00:00:02.913212,Tanh,Leaky,Sigmoid,,14,20,15.0,9.0,,0.0005503448646664473,3,370,0.34054154690027366,0.0012123628653334334,120.7002915566012,COMPLETE
514,0.3641764521598816,2023-09-04 21:30:22.979920,2023-09-04 21:30:31.306655,0 days 00:00:08.326735,Leaky,Leaky,ReLU,,20,7,18.0,21.0,,0.0003087288808521196,3,365,0.7994204146978642,0.011525954721487113,100.62478421824846,COMPLETE
515,0.32847294211387634,2023-09-04 21:30:31.307006,2023-09-04 21:30:31.936964,0 days 00:00:00.629958,ReLU,Leaky,,,31,10,17.0,,,0.021977488441530923,2,409,0.6520101014508288,0.00018146638145734103,108.50020617973513,COMPLETE
516,0.4423748552799225,2023-09-04 21:30:31.937312,2023-09-04 21:30:33.104563,0 days 00:00:01.167251,Tanh,Sigmoid,ReLU,,19,11,12.0,4.0,,0.013781137510489407,3,377,0.7031446549692351,0.013360927962473634,125.242919921875,COMPLETE
517,0.38766101002693176,2023-09-04 21:30:33.104923,2023-09-04 21:30:38.587270,0 days 00:00:05.482347,Tanh,Leaky,,,25,11,13.0,,,0.00013077338551389475,2,437,0.4776614427847956,0.00010131683920876933,198.57916945887376,COMPLETE
518,0.44235968589782715,2023-09-04 21:30:38.587587,2023-09-04 21:30:39.033938,0 days 00:00:00.446351,Tanh,Leaky,Tanh,,23,1,15.0,24.0,,0.03196642011759502,3,388,0.5838045007584649,0.0026863629543626534,158.79170684814454,COMPLETE
519,0.450914204120636,2023-09-04 21:30:39.034349,2023-09-04 21:30:39.592359,0 days 00:00:00.558010,ReLU,,,,16,12,,,,0.04489712169457148,1,362,0.7711982805338541,0.00012518508622204818,126.11877739947775,COMPLETE
520,0.3700288236141205,2023-09-04 21:30:39.592732,2023-09-04 21:30:40.329998,0 days 00:00:00.737266,Tanh,Leaky,ReLU,,28,10,16.0,3.0,,0.018302113642597456,3,398,0.7288797263754997,0.020515150304136375,116.48473358154297,COMPLETE
521,0.3411145508289337,2023-09-04 21:30:40.330424,2023-09-04 21:30:41.465434,0 days 00:00:01.135010,Tanh,Sigmoid,Sigmoid,,22,11,18.0,2.0,,0.006714252434594434,3,369,0.6261435815975084,0.0015104425326824538,170.1715609741211,COMPLETE
522,0.39792269468307495,2023-09-04 21:30:41.465921,2023-09-04 21:30:45.828239,0 days 00:00:04.362318,Tanh,Leaky,,,18,23,17.0,,,1.663612014062308e-05,2,428,0.28260735560245326,0.003327647046217929,99.15159517805154,COMPLETE
523,0.47527480125427246,2023-09-04 21:30:45.828566,2023-09-04 21:30:51.497812,0 days 00:00:05.669246,ReLU,Leaky,ReLU,,24,24,16.0,17.0,,1.2050404562520613e-05,3,374,0.45433115936935564,0.015729400771536305,223.5545262219434,COMPLETE
524,0.35871195793151855,2023-09-04 21:30:51.498158,2023-09-04 21:30:51.703538,0 days 00:00:00.205380,Tanh,Leaky,,,72,12,15.0,,,0.009075566311393179,2,384,0.31845901160202444,0.0006660894777337373,293.03380291278546,COMPLETE
525,0.3734845221042633,2023-09-04 21:30:51.703871,2023-09-04 21:30:51.904123,0 days 00:00:00.200252,Tanh,Leaky,ReLU,,36,18,14.0,9.0,,0.0638218876187297,3,360,0.13396775850380999,0.0004021528127665919,257.5385124206543,COMPLETE
526,0.39179596304893494,2023-09-04 21:30:51.904459,2023-09-04 21:30:54.787437,0 days 00:00:02.882978,Sigmoid,Sigmoid,Leaky,,30,9,16.0,5.0,,0.0008275837671112944,3,418,0.6759522339339217,0.0020973945577694606,124.03386204059308,COMPLETE
527,0.3439374566078186,2023-09-04 21:30:54.787780,2023-09-04 21:30:55.253484,0 days 00:00:00.465704,Tanh,Leaky,,,26,21,17.0,,,0.012349874883933415,2,405,0.7449268775950523,0.005550778195663536,89.90725395896219,COMPLETE
528,0.28270018100738525,2023-09-04 21:30:55.253817,2023-09-04 21:30:56.768438,0 days 00:00:01.514621,ReLU,ReLU,Tanh,,20,11,18.0,8.0,,0.016304654887882793,3,442,0.7030043857133328,0.00015920035560881848,87.4813705970501,COMPLETE
529,0.3228081464767456,2023-09-04 21:30:56.768797,2023-09-04 21:30:59.575346,0 days 00:00:02.806549,Tanh,Leaky,Leaky,,83,10,13.0,13.0,,0.0010710700401296317,3,377,0.7713580283149977,5.006324570746518e-05,111.09307122900783,COMPLETE
530,0.3348483443260193,2023-09-04 21:30:59.575720,2023-09-04 21:31:00.114980,0 days 00:00:00.539260,Tanh,Leaky,,,34,23,14.0,,,0.010405020433503196,2,59,0.4976366720053477,9.371579545625868e-05,175.16491794586182,COMPLETE
531,0.3976418077945709,2023-09-04 21:31:00.115329,2023-09-04 21:31:19.696679,0 days 00:00:19.581350,Tanh,Sigmoid,Leaky,,15,10,15.0,12.0,,3.599015379451656e-05,3,392,0.7442652428120261,6.912496076743231e-05,118.84764400793581,COMPLETE
532,0.2867768406867981,2023-09-04 21:31:19.697029,2023-09-04 21:31:22.023313,0 days 00:00:02.326284,ReLU,Leaky,,,21,12,16.0,,,0.0021517459068203684,2,464,0.7979168488633679,0.00021247873343049775,94.84913034439087,COMPLETE
533,0.40390413999557495,2023-09-04 21:31:22.023639,2023-09-04 21:31:22.630761,0 days 00:00:00.607122,Tanh,Leaky,ReLU,,24,22,1.0,22.0,,0.00585488048582192,3,368,0.34039636462673434,0.0005859327711092123,109.95720812739158,COMPLETE
534,0.3253016769886017,2023-09-04 21:31:22.631117,2023-09-04 21:31:23.574554,0 days 00:00:00.943437,Tanh,Leaky,,,17,20,17.0,,,0.007954884727494666,2,355,0.710766588632912,0.00013446970563536515,109.26189684186663,COMPLETE
535,0.3948206305503845,2023-09-04 21:31:23.574884,2023-09-04 21:31:24.305653,0 days 00:00:00.730769,ReLU,Tanh,Leaky,,27,11,19.0,16.0,,0.0006594920420964422,3,385,0.10980472235171662,0.00011063835169996881,545.721297854469,COMPLETE
536,0.396377831697464,2023-09-04 21:31:24.305987,2023-09-04 21:31:27.411964,0 days 00:00:03.105977,Tanh,Leaky,,,32,10,14.0,,,0.00021432572918153486,2,362,0.6616885946064806,0.0010084955976613617,118.89557574546501,COMPLETE
537,0.2744064927101135,2023-09-04 21:31:27.412305,2023-09-04 21:31:28.000782,0 days 00:00:00.588477,Tanh,Sigmoid,Leaky,,29,12,20.0,23.0,,0.014271163666731784,3,370,0.7720050937501787,3.544725853612014e-05,108.13673858642578,COMPLETE
538,0.384583055973053,2023-09-04 21:31:28.001127,2023-09-04 21:31:28.201641,0 days 00:00:00.200514,Leaky,Sigmoid,Leaky,,29,13,20.0,7.0,,0.015274744239748027,3,358,0.15721992053181366,3.073752179321482e-05,121.5771107673645,COMPLETE
539,0.3198677897453308,2023-09-04 21:31:28.201977,2023-09-04 21:31:28.774345,0 days 00:00:00.572368,Tanh,Sigmoid,Leaky,,31,8,20.0,10.0,,0.02107245475197343,3,368,0.30507889310985375,5.69481869037123e-05,103.72102872786984,COMPLETE
540,0.33737683296203613,2023-09-04 21:31:28.774706,2023-09-04 21:31:29.251210,0 days 00:00:00.476504,Tanh,Sigmoid,,,27,5,16.0,,,0.013168008307328892,2,351,0.41993731184026895,2.1940741789797485e-05,137.41491771879652,COMPLETE
541,0.3714393675327301,2023-09-04 21:31:29.251559,2023-09-04 21:31:29.956701,0 days 00:00:00.705142,ReLU,Sigmoid,ReLU,,30,12,24.0,8.0,,0.01749429149293983,3,373,0.7598925364366025,3.787506671519872e-05,105.31861591339111,COMPLETE
542,0.3584825098514557,2023-09-04 21:31:29.957069,2023-09-04 21:31:30.552032,0 days 00:00:00.594963,Tanh,Sigmoid,,,33,12,15.0,,,0.011781597678627267,2,352,0.6090470142702203,2.1808565455650523e-05,100.93488542423692,COMPLETE
543,0.304167240858078,2023-09-04 21:31:30.552378,2023-09-04 21:31:31.479015,0 days 00:00:00.926637,Tanh,Sigmoid,Sigmoid,,28,13,21.0,24.0,,0.014679522033696647,3,255,0.5296568269706872,5.3900004740655767e-05,188.15652840597588,COMPLETE
544,0.3144335448741913,2023-09-04 21:31:31.479370,2023-09-04 21:31:32.034602,0 days 00:00:00.555232,Tanh,Sigmoid,Leaky,,68,12,16.0,15.0,,0.019579382057580145,3,366,0.7723424936640008,2.556381298302469e-05,93.09491509331598,COMPLETE
545,0.3470296561717987,2023-09-04 21:31:32.034972,2023-09-04 21:31:32.586374,0 days 00:00:00.551402,ReLU,Sigmoid,,,29,24,20.0,,,0.02751309996908306,2,375,0.7260402386164925,4.758269573100386e-05,101.88634134928385,COMPLETE
546,0.3862830102443695,2023-09-04 21:31:32.586727,2023-09-04 21:31:33.222764,0 days 00:00:00.636037,Tanh,Sigmoid,Leaky,,13,12,21.0,24.0,,0.01139605943305241,3,357,0.2259688870790667,1.1627694615758156e-05,123.94176313612196,COMPLETE
547,0.2967674136161804,2023-09-04 21:31:33.223127,2023-09-04 21:31:33.992447,0 days 00:00:00.769320,Tanh,Sigmoid,,,26,21,22.0,,,0.023545767397279743,2,363,0.7723544975930262,3.5766195051526725e-05,137.66326120737438,COMPLETE
548,0.33246123790740967,2023-09-04 21:31:33.992800,2023-09-04 21:31:34.472567,0 days 00:00:00.479767,ReLU,Sigmoid,Leaky,,31,22,17.0,13.0,,0.015155199181492475,3,380,0.2675088412743465,7.280638660003376e-05,122.24637353831324,COMPLETE
549,0.26316407322883606,2023-09-04 21:31:34.472906,2023-09-04 21:31:35.377632,0 days 00:00:00.904726,Tanh,Sigmoid,Leaky,,25,11,15.0,23.0,,0.03377645390092279,3,395,0.7984723484290871,3.9825707614858045e-05,86.2970729154699,COMPLETE
550,0.4922502934932709,2023-09-04 21:31:35.378010,2023-09-04 21:31:36.816968,0 days 00:00:01.438958,Tanh,Sigmoid,Leaky,,77,11,15.0,24.0,,7.17718185671351e-05,3,406,0.21689620580080543,3.5097399120386385e-05,146.28347099943113,COMPLETE
551,0.24529005587100983,2023-09-04 21:31:36.817307,2023-09-04 21:31:38.084441,0 days 00:00:01.267134,Tanh,Leaky,Leaky,,28,12,15.0,24.0,,0.009559094098106638,3,416,0.6876751026371634,2.1033191795976365e-05,106.21947516164472,COMPLETE
552,0.3446567952632904,2023-09-04 21:31:38.084807,2023-09-04 21:31:38.404650,0 days 00:00:00.319843,Tanh,Leaky,Leaky,,28,13,15.0,23.0,,0.03179786158803745,3,416,0.37538306770505375,3.70917392500609e-05,108.04767513275146,COMPLETE
553,0.3348623812198639,2023-09-04 21:31:38.405016,2023-09-04 21:31:39.065343,0 days 00:00:00.660327,Tanh,ReLU,Leaky,,29,12,23.0,23.0,,0.03537842876491079,3,423,0.6474841669633297,1.746796309419577e-05,127.51928063594934,COMPLETE
554,0.31725600361824036,2023-09-04 21:31:39.065713,2023-09-04 21:31:39.832409,0 days 00:00:00.766696,Tanh,Leaky,Leaky,,26,13,14.0,22.0,,0.047249571466040925,3,415,0.6909098456136855,1.295710965912198e-05,130.09672142477598,COMPLETE
555,0.3206280469894409,2023-09-04 21:31:39.832813,2023-09-04 21:31:40.585615,0 days 00:00:00.752802,Tanh,Sigmoid,Leaky,,15,12,15.0,24.0,,0.06453838172873647,3,410,0.5692364840635376,1.029941135431179e-05,199.75733520507814,COMPLETE
556,0.3535163700580597,2023-09-04 21:31:40.585982,2023-09-04 21:31:40.821847,0 days 00:00:00.235865,Tanh,Leaky,Leaky,,33,12,15.0,23.0,,0.009731364626156466,3,434,0.2508108830144231,2.854675222232894e-05,134.2702125266746,COMPLETE
557,0.3846534192562103,2023-09-04 21:31:40.822207,2023-09-04 21:31:41.411003,0 days 00:00:00.588796,Tanh,Leaky,Leaky,,26,13,14.0,24.0,,0.049694230939994685,3,422,0.6744193045894827,1.912643634141329e-05,100.66876073984,COMPLETE
558,0.39051541686058044,2023-09-04 21:31:41.411364,2023-09-04 21:31:41.968316,0 days 00:00:00.556952,Tanh,Leaky,Leaky,,25,12,15.0,23.0,,0.07538009163119462,3,407,0.6190263686109015,0.0003677053434349853,100.84094766470102,COMPLETE
559,0.36401820182800293,2023-09-04 21:31:41.968656,2023-09-04 21:31:42.309651,0 days 00:00:00.340995,Tanh,Sigmoid,Leaky,,31,13,21.0,23.0,,0.041439626087182296,3,424,0.700668979015587,6.193572451583155e-05,128.9193542480469,COMPLETE
560,0.3113879859447479,2023-09-04 21:31:42.310022,2023-09-04 21:31:43.371385,0 days 00:00:01.061363,Tanh,Leaky,Leaky,,36,23,15.0,23.0,,0.009003639031835972,3,172,0.43877645170000235,2.5642079926776433e-05,136.61916369483583,COMPLETE
561,0.3580595850944519,2023-09-04 21:31:43.372043,2023-09-04 21:32:05.381649,0 days 00:00:22.009606,Tanh,Tanh,ReLU,,13,12,14.0,24.0,,1.0530870324455793e-05,3,440,0.7257081029552798,1.826326728988826e-05,120.17392217462714,COMPLETE
562,0.330610454082489,2023-09-04 21:32:05.382102,2023-09-04 21:32:05.918066,0 days 00:00:00.535964,Tanh,Leaky,Leaky,,23,11,15.0,24.0,,0.040491636269935606,3,398,0.5909687849309716,4.2940516141734576e-05,107.5576347682787,COMPLETE
