number,value,datetime_start,datetime_complete,duration,params_activation1,params_activation2,params_activation3,params_activation4,params_batch_size,params_fl1,params_fl2,params_fl3,params_fl4,params_learning_rate,params_n_layers,params_num_epochs,params_train_size,params_weight_decay,user_attrs_mre,state
1150,0.5159125924110413,2023-09-04 22:21:19.226103,2023-09-04 22:21:23.160446,0 days 00:00:03.934343,Tanh,Sigmoid,,,78,20,6.0,,,0.00020789623161998082,2,223,0.48393693666568877,0.05436394938286698,142.0107876559544,COMPLETE
1151,0.4629499614238739,2023-09-04 22:21:23.161224,2023-09-04 22:21:23.446758,0 days 00:00:00.285534,Sigmoid,Tanh,,,48,20,5.0,,,0.02228455154652263,2,200,0.10150415889278772,0.03597957792842546,112.86033331829569,COMPLETE
1152,0.43455514311790466,2023-09-04 22:21:23.447522,2023-09-04 22:21:24.102554,0 days 00:00:00.655032,Tanh,,,,51,14,,,,0.0008933145627509129,1,68,0.1897978069431456,0.014212346971156288,135.31638044469497,COMPLETE
1153,0.33263295888900757,2023-09-04 22:21:24.103305,2023-09-04 22:21:27.206247,0 days 00:00:03.102942,ReLU,Sigmoid,,,12,21,17.0,,,0.014965081630772972,2,50,0.38281502445276383,0.00011845336310595227,137.06874237060546,COMPLETE
1154,0.4029071033000946,2023-09-04 22:21:27.207021,2023-09-04 22:21:28.354457,0 days 00:00:01.147436,Tanh,Sigmoid,Sigmoid,,17,21,7.0,4.0,,0.0069227274599230814,3,208,0.21787307694668218,6.63204573586326e-05,917.997308254242,COMPLETE
1155,0.5048184990882874,2023-09-04 22:21:28.355311,2023-09-04 22:21:41.097374,0 days 00:00:12.742063,Tanh,Tanh,ReLU,Sigmoid,41,24,21.0,5.0,10.0,3.865994074046521e-05,4,216,0.7703201444320985,0.017209760558594762,115.60767848403366,COMPLETE
1156,0.39282846450805664,2023-09-04 22:21:41.098215,2023-09-04 22:21:42.175784,0 days 00:00:01.077569,Tanh,Leaky,,,10,22,4.0,,,0.07321363915727719,2,81,0.21882199410945405,0.00019762158627693356,113.53497248110564,COMPLETE
1157,0.3605852425098419,2023-09-04 22:21:42.176597,2023-09-04 22:21:42.929032,0 days 00:00:00.752435,Tanh,Sigmoid,,,47,20,15.0,,,0.0371758412633313,2,92,0.5641174938810987,2.217263501069707e-05,203.97581699916296,COMPLETE
1158,0.3505110442638397,2023-09-04 22:21:42.929813,2023-09-04 22:21:43.616956,0 days 00:00:00.687143,ReLU,,,,43,21,,,,0.017569472190698595,1,63,0.31564281625307283,4.150043997970602e-05,92.80150894891648,COMPLETE
1159,0.36483296751976013,2023-09-04 22:21:43.617724,2023-09-04 22:21:44.194104,0 days 00:00:00.576380,Tanh,Tanh,,,37,23,13.0,,,0.012187613748686503,2,232,0.17351374213000167,0.001019311162405128,141.757586504962,COMPLETE
1160,0.2939845323562622,2023-09-04 22:21:44.194880,2023-09-04 22:21:46.242467,0 days 00:00:02.047587,Leaky,Sigmoid,Tanh,,44,18,14.0,8.0,,0.003734716901014808,3,75,0.7998096507473832,0.0001401670976655259,103.72606177079051,COMPLETE
1161,0.3979165256023407,2023-09-04 22:21:46.243268,2023-09-04 22:21:46.970007,0 days 00:00:00.726739,Tanh,Sigmoid,,,14,22,12.0,,,0.027525736875391667,2,225,0.13941907293686806,8.312063574444791e-05,134.42921631911705,COMPLETE
1162,0.38898518681526184,2023-09-04 22:21:46.970815,2023-09-04 22:21:49.646244,0 days 00:00:02.675429,Tanh,,,,52,12,,,,0.0007639452029216153,1,98,0.7107274528042785,0.0002696032177604569,111.95942049610372,COMPLETE
1163,0.39138397574424744,2023-09-04 22:21:49.647091,2023-09-04 22:21:52.813146,0 days 00:00:03.166055,ReLU,Tanh,ReLU,,40,20,6.0,4.0,,0.0013692699513953212,3,86,0.7345118802001357,0.06789019568163981,107.8833524642452,COMPLETE
1164,0.3360755741596222,2023-09-04 22:21:52.813945,2023-09-04 22:21:54.554098,0 days 00:00:01.740153,Tanh,Sigmoid,Sigmoid,Leaky,50,16,21.0,7.0,9.0,0.007991060310241273,4,124,0.6868591539243335,3.095127561502918e-05,105.34542781284877,COMPLETE
1165,0.3583681583404541,2023-09-04 22:21:54.554918,2023-09-04 22:21:56.523303,0 days 00:00:01.968385,Sigmoid,Tanh,,,19,21,8.0,,,0.010445627718744254,2,59,0.3038637166866713,0.00017290470328229287,102.2765814682533,COMPLETE
1166,0.3568395674228668,2023-09-04 22:21:56.524171,2023-09-04 22:21:57.411902,0 days 00:00:00.887731,Tanh,Sigmoid,,,96,15,4.0,,,0.02217993720512956,2,235,0.756468651339207,5.900792271574551e-05,108.6956533616589,COMPLETE
1167,0.4166889786720276,2023-09-04 22:21:57.412690,2023-09-04 22:22:00.966768,0 days 00:00:03.554078,Tanh,Leaky,,,54,19,2.0,,,0.0009539245018086684,2,109,0.7169917208247648,0.0031783599406808643,122.03249233140858,COMPLETE
1168,0.3976947069168091,2023-09-04 22:22:00.967537,2023-09-04 22:22:01.737349,0 days 00:00:00.769812,Tanh,ReLU,ReLU,,16,21,14.0,9.0,,0.03128034828678889,3,211,0.13566193494469211,0.00011092989799514064,136.8767092568534,COMPLETE
1169,0.35049062967300415,2023-09-04 22:22:01.738152,2023-09-04 22:22:03.390967,0 days 00:00:01.652815,ReLU,,,,45,20,,,,0.0028165884013690826,1,220,0.42386575379718877,0.005351414288078739,120.9158674586903,COMPLETE
1170,0.3156578838825226,2023-09-04 22:22:03.391767,2023-09-04 22:22:04.389589,0 days 00:00:00.997822,Tanh,Sigmoid,,,36,23,20.0,,,0.058216419527832276,2,135,0.7695982247647233,4.587462001833695e-05,90.00372060139973,COMPLETE
1171,0.31400904059410095,2023-09-04 22:22:04.390394,2023-09-04 22:22:06.647954,0 days 00:00:02.257560,Tanh,Tanh,Tanh,ReLU,47,22,7.0,6.0,7.0,0.005990502905063363,4,70,0.7389912906898152,2.533048063646076e-05,87.724830999607,COMPLETE
1172,0.3812613785266876,2023-09-04 22:22:06.648831,2023-09-04 22:22:07.481893,0 days 00:00:00.833062,Tanh,Sigmoid,,,12,14,15.0,,,0.013147616286026856,2,194,0.12565679889172285,3.7366994789994006e-05,132.8680217967314,COMPLETE
1173,0.3143828809261322,2023-09-04 22:22:07.482685,2023-09-04 22:22:08.499495,0 days 00:00:01.016810,Tanh,Sigmoid,,,90,24,6.0,,,0.045729753416552874,2,243,0.6374913536766212,0.0002198935313039627,227.21010553269159,COMPLETE
1174,0.45705708861351013,2023-09-04 22:22:08.500305,2023-09-04 22:22:09.640019,0 days 00:00:01.139714,Leaky,ReLU,ReLU,,69,2,22.0,23.0,,0.017499858063827065,3,80,0.6852266817863941,0.006969520072502861,119.09972667694092,COMPLETE
1175,0.4322589635848999,2023-09-04 22:22:09.640842,2023-09-04 22:22:10.647513,0 days 00:00:01.006671,ReLU,,,,18,17,,,,0.03506974376880226,1,91,0.7692016150423099,0.011110670368951421,117.01749992370605,COMPLETE
1176,0.32964637875556946,2023-09-04 22:22:10.648495,2023-09-04 22:22:12.116605,0 days 00:00:01.468110,Tanh,Tanh,,,42,20,5.0,,,0.008989181476312278,2,68,0.7994318606323615,2.0061992628594643e-05,114.46010220435357,COMPLETE
1177,0.3316235840320587,2023-09-04 22:22:12.117467,2023-09-04 22:22:13.322983,0 days 00:00:01.205516,Tanh,Sigmoid,,,39,21,12.0,,,0.025228596888995376,2,59,0.7099091446968809,7.399264088682174e-05,92.54275101881761,COMPLETE
1178,0.38034960627555847,2023-09-04 22:22:13.323776,2023-09-04 22:22:26.404860,0 days 00:00:13.081084,Sigmoid,Tanh,Sigmoid,,10,19,13.0,7.0,,0.0017139398902535259,3,229,0.7475855566106153,0.0011524577485745458,116.63997747959235,COMPLETE
1179,0.48940056562423706,2023-09-04 22:22:26.405687,2023-09-04 22:22:29.206055,0 days 00:00:02.800368,Tanh,Sigmoid,Tanh,Sigmoid,49,22,7.0,24.0,4.0,0.0003563175306123099,4,103,0.3781090898188179,0.0007785939937127843,132.62452438502635,COMPLETE
1180,0.9048303365707397,2023-09-04 22:22:29.206881,2023-09-04 22:22:32.096963,0 days 00:00:02.890082,Tanh,ReLU,,,52,21,11.0,,,1.783221535772121e-05,2,75,0.7996114691010656,0.002203776270816145,102.10330495198568,COMPLETE
1181,0.3646334409713745,2023-09-04 22:22:32.097765,2023-09-04 22:22:34.706708,0 days 00:00:02.608943,ReLU,Leaky,,,14,13,14.0,,,0.0020493732361960486,2,145,0.35438794342942,0.000471599040531835,108.70445401060815,COMPLETE
1182,0.33429354429244995,2023-09-04 22:22:34.707523,2023-09-04 22:22:35.473140,0 days 00:00:00.765617,Tanh,,,,46,20,,,,0.015089797269759337,1,213,0.5208313748037657,9.14411488187273e-05,110.42663269042968,COMPLETE
1183,0.30373629927635193,2023-09-04 22:22:35.473930,2023-09-04 22:22:40.055185,0 days 00:00:04.581255,Tanh,Sigmoid,,,38,21,16.0,,,0.0034252926933992364,2,117,0.6630207320905022,0.0003381806901355656,114.025390625,COMPLETE
1184,0.3725126087665558,2023-09-04 22:22:40.056016,2023-09-04 22:22:40.835775,0 days 00:00:00.779759,Tanh,Tanh,ReLU,,58,22,13.0,5.0,,0.020549195795292456,3,237,0.27407911157101816,0.00014566891518992818,161.84205055236816,COMPLETE
1185,0.5278643369674683,2023-09-04 22:22:40.836632,2023-09-04 22:22:46.904829,0 days 00:00:06.068197,Tanh,Sigmoid,,,20,15,5.0,,,0.00010901638143884504,2,85,0.7200839979949641,0.0005949337055239579,121.4613966997932,COMPLETE
1186,0.36719223856925964,2023-09-04 22:22:46.905624,2023-09-04 22:22:51.918665,0 days 00:00:05.013041,ReLU,ReLU,ReLU,Leaky,16,20,3.0,4.0,2.0,0.0006811482141738174,4,205,0.39029873932594344,2.8593573113240566e-05,129.9796674486617,COMPLETE
1187,0.4458872377872467,2023-09-04 22:22:51.919494,2023-09-04 22:22:52.690114,0 days 00:00:00.770620,Tanh,Tanh,,,71,21,15.0,,,0.00425137899150118,2,224,0.7501400809215305,0.09967099524099686,181.51169031316584,COMPLETE
1188,0.3913561701774597,2023-09-04 22:22:52.690886,2023-09-04 22:22:53.035133,0 days 00:00:00.344247,Leaky,,,,65,22,,,,0.007114555250051647,1,100,0.16878723039488866,5.65731452525179e-05,212.44849112374442,COMPLETE
1189,0.29997923970222473,2023-09-04 22:22:53.035965,2023-09-04 22:22:54.309228,0 days 00:00:01.273263,Tanh,Sigmoid,,,56,21,6.0,,,0.011584373320256405,2,50,0.6156668702677978,0.00012196291145508984,102.83800833565849,COMPLETE
1190,0.7288151383399963,2023-09-04 22:22:54.310184,2023-09-04 22:23:03.356484,0 days 00:00:09.046300,Tanh,Sigmoid,Sigmoid,,12,20,5.0,3.0,,7.108103153186607e-05,3,61,0.7722114631073675,0.0013283379020015574,93.43857949679015,COMPLETE
1191,0.42441192269325256,2023-09-04 22:23:03.357305,2023-09-04 22:23:04.012950,0 days 00:00:00.655645,Sigmoid,Tanh,,,44,23,14.0,,,0.005395445976271859,2,79,0.6823907958267633,0.01989593968525955,127.26407623291016,COMPLETE
1192,0.5875584483146667,2023-09-04 22:23:04.013756,2023-09-04 22:23:19.353475,0 days 00:00:15.339719,Tanh,ReLU,Tanh,Sigmoid,41,19,17.0,16.0,1.0,0.00017954882281590904,4,246,0.7214378187953842,0.0027185934693612687,173.6268905391538,COMPLETE
1193,0.43492162227630615,2023-09-04 22:23:19.354312,2023-09-04 22:23:26.272769,0 days 00:00:06.918457,ReLU,Sigmoid,,,53,22,7.0,,,8.778877558695724e-05,2,197,0.772740225968693,3.294719686774013e-05,110.95366111019541,COMPLETE
1194,0.35319045186042786,2023-09-04 22:23:26.273568,2023-09-04 22:23:26.766334,0 days 00:00:00.492766,Tanh,,,,48,21,,,,0.02667040403190088,1,218,0.20380751137958594,0.00025879517261370526,115.14778583805736,COMPLETE
1195,0.37430644035339355,2023-09-04 22:23:26.767137,2023-09-04 22:23:27.225598,0 days 00:00:00.458461,Tanh,Leaky,,,85,20,6.0,,,0.0367238438019387,2,93,0.23564160171841517,0.0003969500007264776,872.4459690903172,COMPLETE
1196,0.8759825229644775,2023-09-04 22:23:27.226401,2023-09-04 22:23:28.005131,0 days 00:00:00.778730,Tanh,Tanh,ReLU,,37,13,24.0,14.0,,3.921899799571408e-05,3,66,0.1158262144775077,0.00018083993729972993,133.0992887092359,COMPLETE
1197,0.34364819526672363,2023-09-04 22:23:28.005956,2023-09-04 22:23:28.622092,0 days 00:00:00.616136,Tanh,Sigmoid,,,50,21,8.0,,,0.009104073756178513,2,163,0.2243284166002148,4.6045700077639804e-05,312.4080762165349,COMPLETE
1198,0.9784556031227112,2023-09-04 22:23:28.622880,2023-09-04 22:23:33.240874,0 days 00:00:04.617994,ReLU,ReLU,ReLU,,43,14,4.0,13.0,,1.537389846436908e-05,3,127,0.5581142884323151,0.0008218663997569181,105.77216615451603,COMPLETE
1199,0.39194950461387634,2023-09-04 22:23:33.241691,2023-09-04 22:23:34.125676,0 days 00:00:00.883985,Leaky,Sigmoid,,,18,20,14.0,,,0.01876447048928441,2,150,0.2540293097742059,0.00010482070125492269,116.00858570979192,COMPLETE
1200,0.35237932205200195,2023-09-04 22:23:34.126463,2023-09-04 22:23:35.133070,0 days 00:00:01.006607,Tanh,,,,46,23,,,,0.01412694268920416,1,112,0.34634125945617433,2.447339370620999e-05,342.9416191226146,COMPLETE
1201,0.3894241750240326,2023-09-04 22:23:35.133858,2023-09-04 22:23:35.852122,0 days 00:00:00.718264,Tanh,Tanh,,,62,19,15.0,,,0.011195856868245454,2,234,0.21301487189050833,0.00013543471027212137,106.83216663942498,COMPLETE
1202,1.0085545778274536,2023-09-04 22:23:35.852912,2023-09-04 22:23:36.945711,0 days 00:00:01.092799,Tanh,Sigmoid,Sigmoid,ReLU,21,21,21.0,8.0,14.0,0.04580606496303085,4,88,0.3669215175626051,0.003600240277567429,103.12139333089193,COMPLETE
1203,0.9201974868774414,2023-09-04 22:23:36.946548,2023-09-04 22:23:41.473657,0 days 00:00:04.527109,ReLU,ReLU,,,13,16,16.0,,,1.0610991370251185e-05,2,76,0.40707377073858675,1.910466426687203e-05,102.24650493421052,COMPLETE
1204,0.4254477918148041,2023-09-04 22:23:41.474469,2023-09-04 22:23:42.375007,0 days 00:00:00.900538,Tanh,Tanh,Tanh,,51,22,5.0,6.0,,0.002371209385522213,3,212,0.14650362988761428,7.100743321235482e-05,123.942095471667,COMPLETE
1205,0.326002836227417,2023-09-04 22:23:42.375862,2023-09-04 22:23:44.856646,0 days 00:00:02.480784,Sigmoid,Sigmoid,,,10,12,13.0,,,0.030713442628967694,2,226,0.4559392761444942,0.00020773432968764706,111.64295196533203,COMPLETE
1206,0.4156520962715149,2023-09-04 22:23:44.857460,2023-09-04 22:23:45.344302,0 days 00:00:00.486842,Tanh,,,,39,18,,,,0.08293884965398679,1,69,0.3088719758273288,4.027952286770884e-05,134.92650159200033,COMPLETE
1207,0.35486137866973877,2023-09-04 22:23:45.345102,2023-09-04 22:23:46.136272,0 days 00:00:00.791170,Tanh,Sigmoid,,,93,24,2.0,,,0.023590502219902356,2,57,0.7423599068758956,5.796546679596516e-05,109.48320826777706,COMPLETE
1208,0.46402737498283386,2023-09-04 22:23:46.137063,2023-09-04 22:23:48.703233,0 days 00:00:02.566170,Tanh,Tanh,ReLU,,41,10,20.0,10.0,,0.00010588612164301717,3,173,0.19474721360479413,0.001749888520091724,122.71748307950234,COMPLETE
1209,0.3490045964717865,2023-09-04 22:23:48.704050,2023-09-04 22:23:50.923376,0 days 00:00:02.219326,ReLU,Leaky,,,35,22,3.0,,,0.008148946349854557,2,100,0.5435003659277035,0.0046232493963357674,113.80107768889397,COMPLETE
1210,0.3113277554512024,2023-09-04 22:23:50.924175,2023-09-04 22:23:52.475326,0 days 00:00:01.551151,Tanh,ReLU,ReLU,Sigmoid,54,15,18.0,12.0,15.0,0.017288655376389822,4,203,0.6990623574950412,0.0001577349720995414,242.53912648847026,COMPLETE
1211,0.47489994764328003,2023-09-04 22:23:52.476156,2023-09-04 22:24:00.147623,0 days 00:00:07.671467,Tanh,Sigmoid,,,16,20,23.0,,,6.443232369327612e-05,2,187,0.33545321494131114,0.007624147600833758,107.7382945912407,COMPLETE
1212,0.3972146511077881,2023-09-04 22:24:00.148439,2023-09-04 22:24:01.672572,0 days 00:00:01.524133,Leaky,Sigmoid,,,47,21,22.0,,,0.006382117347162419,2,240,0.5976926898800673,0.03153760877181911,113.5117889072584,COMPLETE
1213,0.382234662771225,2023-09-04 22:24:01.673394,2023-09-04 22:24:01.969497,0 days 00:00:00.296103,Tanh,,,,19,21,,,,0.05494627008386138,1,79,0.10485782693484128,3.3825426385855716e-05,132.04363462660046,COMPLETE
1214,0.315860778093338,2023-09-04 22:24:01.970267,2023-09-04 22:24:03.925565,0 days 00:00:01.955298,Tanh,Tanh,Sigmoid,,44,20,6.0,11.0,,0.010144038297249346,3,217,0.7409468356508273,8.731135317070765e-05,99.80029688126001,COMPLETE
1215,0.45648759603500366,2023-09-04 22:24:03.926376,2023-09-04 22:24:06.244967,0 days 00:00:02.318591,ReLU,ReLU,,,49,23,15.0,,,7.535799603748517e-05,2,89,0.5000084083441135,5.1468732805594874e-05,115.52132698659146,COMPLETE
1216,0.3662760555744171,2023-09-04 22:24:06.245780,2023-09-04 22:24:24.682318,0 days 00:00:18.436538,Tanh,Sigmoid,Tanh,Leaky,14,22,6.0,5.0,6.0,0.00039036643296224425,4,227,0.4459139340398452,0.00027480214370064946,121.4760332244435,COMPLETE
1217,0.3506210744380951,2023-09-04 22:24:24.683172,2023-09-04 22:24:26.860189,0 days 00:00:02.177017,Tanh,Tanh,,,12,21,12.0,,,0.03441406821621138,2,70,0.7734539518526669,2.291846332290906e-05,119.14454336727367,COMPLETE
1218,0.27703094482421875,2023-09-04 22:24:26.860993,2023-09-04 22:24:31.159131,0 days 00:00:04.298138,Sigmoid,,,,18,20,,,,0.013936699786926817,1,138,0.6562637969954652,2.725535395823581e-05,91.12496840648161,COMPLETE
1219,0.45131734013557434,2023-09-04 22:24:31.159925,2023-09-04 22:24:32.560363,0 days 00:00:01.400438,Tanh,Sigmoid,,,42,19,7.0,,,0.004722884749106108,2,156,0.36271681584549614,0.022037976897738624,127.23986465211898,COMPLETE
1220,0.7717684507369995,2023-09-04 22:24:32.561166,2023-09-04 22:24:52.615506,0 days 00:00:20.054340,Tanh,Sigmoid,ReLU,,21,9,13.0,3.0,,1.1196319986377413e-05,3,247,0.705375540842835,0.00011420819736900845,112.65043226234343,COMPLETE
1221,0.34079334139823914,2023-09-04 22:24:52.616343,2023-09-04 22:25:00.313426,0 days 00:00:07.697083,ReLU,ReLU,,,37,14,8.0,,,0.0004563542242400765,2,166,0.7714316489286812,0.01494169873950498,105.12438169732151,COMPLETE
1222,1.184398889541626,2023-09-04 22:25:00.314215,2023-09-04 22:25:00.988938,0 days 00:00:00.674723,Tanh,Tanh,,,45,21,4.0,,,1.1672875776825354e-05,2,59,0.1520533568894641,0.00018693148882164775,440.62372757216633,COMPLETE
1223,0.31925809383392334,2023-09-04 22:25:00.989751,2023-09-04 22:25:02.128901,0 days 00:00:01.139150,Tanh,,,,67,20,,,,0.021503665962685145,1,84,0.7292921647677023,7.099090804284785e-05,111.17695305564187,COMPLETE
1224,0.3959355652332306,2023-09-04 22:25:02.129692,2023-09-04 22:25:03.565535,0 days 00:00:01.435843,Tanh,Leaky,Sigmoid,,40,16,14.0,7.0,,0.0031872714684514193,3,111,0.15524446455271906,0.005479271222434819,246.2921690382399,COMPLETE
1225,0.34553927183151245,2023-09-04 22:25:03.566337,2023-09-04 22:25:08.527274,0 days 00:00:04.960937,Leaky,Sigmoid,,,48,22,5.0,,,0.0005200955154867202,2,468,0.7977444538158677,0.00023728518840855276,127.97169323730469,COMPLETE
1226,0.4863457977771759,2023-09-04 22:25:08.528205,2023-09-04 22:25:13.077668,0 days 00:00:04.549463,Tanh,Tanh,ReLU,Sigmoid,51,21,15.0,4.0,13.0,0.00013014100591527658,4,98,0.6844905251429335,0.010717567423735534,113.69615632660535,COMPLETE
1227,0.38171061873435974,2023-09-04 22:25:13.078502,2023-09-04 22:25:14.001737,0 days 00:00:00.923235,ReLU,Sigmoid,,,55,23,1.0,,,0.02763073440742981,2,238,0.29883864277948075,0.0005167675730289268,199.13943218362743,COMPLETE
1228,0.3128988742828369,2023-09-04 22:25:14.002520,2023-09-04 22:25:14.921122,0 days 00:00:00.918602,Tanh,ReLU,,,60,22,6.0,,,0.04007430382824763,2,220,0.7523487662368846,4.389922380735829e-05,84.5066343943278,COMPLETE
1229,0.3638777732849121,2023-09-04 22:25:14.921919,2023-09-04 22:25:18.339062,0 days 00:00:03.417143,Tanh,,,,16,20,,,,0.005158231865045176,1,50,0.7258982868269883,1.9013293053002593e-05,99.32204895019531,COMPLETE
1230,0.3456175625324249,2023-09-04 22:25:18.339891,2023-09-04 22:25:21.575343,0 days 00:00:03.235452,Tanh,Sigmoid,Tanh,,45,21,17.0,9.0,,0.007454043761395707,3,208,0.7990970928262372,9.333553228322013e-05,98.26834288097564,COMPLETE
1231,0.3343222439289093,2023-09-04 22:25:21.576158,2023-09-04 22:25:26.453741,0 days 00:00:04.877583,Sigmoid,Tanh,,,20,15,14.0,,,0.011694028703456994,2,329,0.750233150193077,0.00013823326457010508,102.5818091759315,COMPLETE
1232,0.3133029043674469,2023-09-04 22:25:26.454554,2023-09-04 22:25:28.648012,0 days 00:00:02.193458,Tanh,Sigmoid,,,12,24,11.0,,,0.01568553048199704,2,75,0.699316863172254,3.0746244282899064e-05,96.91605096114309,COMPLETE
1233,0.44048452377319336,2023-09-04 22:25:28.648888,2023-09-04 22:25:30.194496,0 days 00:00:01.545608,ReLU,ReLU,ReLU,ReLU,10,21,3.0,6.0,18.0,0.0037584660332604714,4,231,0.12185965893077172,3.621047368188001e-05,187.20597457885742,COMPLETE
1234,0.4105492830276489,2023-09-04 22:25:30.195336,2023-09-04 22:25:34.167958,0 days 00:00:03.972622,Tanh,Tanh,Sigmoid,,42,21,12.0,8.0,,0.00025777671333711554,3,91,0.6391592815765551,0.0009127394443969252,117.7887700678228,COMPLETE
1235,0.34863534569740295,2023-09-04 22:25:34.168860,2023-09-04 22:25:36.170474,0 days 00:00:02.001614,Tanh,Sigmoid,,,15,19,16.0,,,0.01973065539474694,2,147,0.7707153878332957,0.0001619615687821676,108.55117275840358,COMPLETE
1236,0.34706008434295654,2023-09-04 22:25:36.171374,2023-09-04 22:25:37.289515,0 days 00:00:01.118141,Tanh,,,,39,17,,,,0.008892556362406847,1,197,0.3740752515436123,0.0014920672333850588,104.30183463261045,COMPLETE
1237,0.3266758620738983,2023-09-04 22:25:37.290324,2023-09-04 22:25:40.305488,0 days 00:00:03.015164,Tanh,Leaky,,,36,20,4.0,,,0.0016144506763619067,2,66,0.7272887267862616,0.00038773677871098856,114.07967307350852,COMPLETE
1238,0.3934181034564972,2023-09-04 22:25:40.306326,2023-09-04 22:25:40.998478,0 days 00:00:00.692152,ReLU,Sigmoid,,,52,12,13.0,,,0.02535552385175458,2,119,0.18082001528975533,6.315907157749856e-05,229.64774796058393,COMPLETE
1239,0.33875271677970886,2023-09-04 22:25:40.999293,2023-09-04 22:25:44.821637,0 days 00:00:03.822344,Tanh,Tanh,Leaky,,47,22,5.0,5.0,,0.001182254225355782,3,184,0.6729538606212001,4.755810397639138e-05,96.41484586654171,COMPLETE
1240,0.3712714612483978,2023-09-04 22:25:44.822470,2023-09-04 22:25:45.248044,0 days 00:00:00.425574,Leaky,ReLU,,,57,21,7.0,,,0.030575676209640534,2,104,0.2836626367389091,0.00011375970306507936,125.7369873046875,COMPLETE
1241,0.5785791277885437,2023-09-04 22:25:45.248880,2023-09-04 22:25:54.256992,0 days 00:00:09.008112,Tanh,Sigmoid,ReLU,Sigmoid,49,22,6.0,3.0,9.0,5.4262400955700665e-05,4,173,0.7718928537322476,0.00021589244258958952,95.2961986299195,COMPLETE
1242,0.43358269333839417,2023-09-04 22:25:54.257851,2023-09-04 22:25:55.963161,0 days 00:00:01.705310,Tanh,Tanh,,,43,20,15.0,,,0.0001895080323126222,2,82,0.34310225202079475,0.00031466863203610953,111.3707132106874,COMPLETE
1243,0.4207743704319,2023-09-04 22:25:55.963979,2023-09-04 22:25:56.740194,0 days 00:00:00.776215,ReLU,,,,74,21,,,,0.006780824897600186,1,214,0.706873890925825,0.078964849116113,108.50259448635963,COMPLETE
1244,0.32950881123542786,2023-09-04 22:25:56.740975,2023-09-04 22:26:04.046922,0 days 00:00:07.305947,Tanh,Sigmoid,,,18,21,7.0,,,0.0008827477427694997,2,248,0.461054979882738,8.104313114214389e-05,116.5740926037096,COMPLETE
1245,0.34770262241363525,2023-09-04 22:26:04.047712,2023-09-04 22:26:11.912841,0 days 00:00:07.865129,Sigmoid,ReLU,Tanh,,22,15,14.0,2.0,,0.0025717324377204065,3,157,0.7996023040550001,2.2697374334558247e-05,114.0446698388388,COMPLETE
