number,value,datetime_start,datetime_complete,duration,params_activation1,params_activation2,params_activation3,params_activation4,params_batch_size,params_fl1,params_fl2,params_fl3,params_fl4,params_learning_rate,params_n_layers,params_num_epochs,params_train_size,params_weight_decay,user_attrs_mre,state
1115,0.43356961011886597,2023-09-04 21:50:24.981897,2023-09-04 21:50:26.972771,0 days 00:00:01.990874,ReLU,Leaky,Leaky,,48,18,23.0,19.0,,5.4448819703174374e-05,3,254,0.3876915558754919,0.00013978146637264857,319.8405923918476,COMPLETE
1116,0.43898674845695496,2023-09-04 21:50:26.973190,2023-09-04 21:50:27.249699,0 days 00:00:00.276509,ReLU,Sigmoid,Tanh,Leaky,51,16,24.0,18.0,18.0,0.009515241175355854,4,85,0.14304529546039624,0.00020218771626039834,253.68999002494064,COMPLETE
1117,0.2925616204738617,2023-09-04 21:50:27.250115,2023-09-04 21:50:27.649494,0 days 00:00:00.399379,ReLU,Leaky,Leaky,Leaky,46,20,23.0,18.0,21.0,0.01936205853630726,4,105,0.5095552962856894,0.0001583361187640458,225.167972271259,COMPLETE
1118,0.26617124676704407,2023-09-04 21:50:27.649992,2023-09-04 21:50:29.506478,0 days 00:00:01.856486,ReLU,Tanh,,,45,19,24.0,,,0.0025338070817553264,2,277,0.6903151639523878,0.00030251678484804703,2061.293990616946,COMPLETE
1119,0.9992331266403198,2023-09-04 21:50:29.507238,2023-09-04 21:50:31.229449,0 days 00:00:01.722211,ReLU,Leaky,Leaky,Leaky,45,20,23.0,16.0,10.0,1.3824381627250888e-05,4,203,0.19075434795989762,0.0001279492946045383,857.3942603501193,COMPLETE
1120,0.3389119505882263,2023-09-04 21:50:31.229869,2023-09-04 21:50:31.927542,0 days 00:00:00.697673,ReLU,Leaky,,,52,18,23.0,,,0.004416862639162974,2,187,0.7437312745230886,0.0002479390995762761,503.2607438223703,COMPLETE
1121,0.3696221709251404,2023-09-04 21:50:31.927951,2023-09-04 21:50:32.558470,0 days 00:00:00.630519,ReLU,ReLU,Leaky,,45,21,23.0,17.0,,0.027272909581404423,3,212,0.768228273648686,0.00019807277394345518,140.55434057447644,COMPLETE
1122,0.3636196255683899,2023-09-04 21:50:32.558876,2023-09-04 21:50:32.909805,0 days 00:00:00.350929,ReLU,Tanh,Tanh,Tanh,48,19,24.0,18.0,16.0,0.011183022385160947,4,248,0.32043245105235535,4.8575121411264934e-05,161.41781550816128,COMPLETE
1123,0.5702751874923706,2023-09-04 21:50:32.910229,2023-09-04 21:50:33.265311,0 days 00:00:00.355082,ReLU,Leaky,ReLU,ReLU,43,21,18.0,17.0,13.0,0.0014796517589145295,4,231,0.12749233431457846,3.9030852289958746e-05,206.79430171421595,COMPLETE
1124,0.509776771068573,2023-09-04 21:50:33.265728,2023-09-04 21:50:34.275991,0 days 00:00:01.010263,ReLU,Leaky,,,50,20,23.0,,,6.746646391270406e-05,2,217,0.25923410974859007,1.914703508046861e-05,225.87743402296496,COMPLETE
1125,0.4209679365158081,2023-09-04 21:50:34.276390,2023-09-04 21:50:37.166402,0 days 00:00:02.890012,ReLU,Leaky,Leaky,Tanh,47,11,20.0,17.0,20.0,0.00013328009030627442,4,199,0.6457016774922871,0.007648168353346964,273.8728072966762,COMPLETE
1126,0.3317045271396637,2023-09-04 21:50:37.166806,2023-09-04 21:50:38.246360,0 days 00:00:01.079554,ReLU,Tanh,Leaky,Sigmoid,43,19,23.0,14.0,11.0,0.014416158769149638,4,72,0.711555591115181,0.00014339313765417808,190.87353989173627,COMPLETE
1127,0.3568207919597626,2023-09-04 21:50:38.246787,2023-09-04 21:50:38.881717,0 days 00:00:00.634930,ReLU,Leaky,Leaky,Leaky,44,17,12.0,19.0,23.0,0.0037797385881232614,4,76,0.7465358984762765,0.0001766528107243605,155.47507214546204,COMPLETE
1128,0.3150310516357422,2023-09-04 21:50:38.882130,2023-09-04 21:50:39.445685,0 days 00:00:00.563555,ReLU,ReLU,Tanh,Tanh,54,18,20.0,16.0,15.0,0.016729916848195477,4,382,0.3321028137863551,3.5323896310899755e-05,120.66205159355613,COMPLETE
1129,0.3466200828552246,2023-09-04 21:50:39.446106,2023-09-04 21:50:44.594603,0 days 00:00:05.148497,ReLU,Sigmoid,Leaky,Leaky,42,20,19.0,14.0,17.0,0.00041788051709335216,4,264,0.799964161287955,2.6347719721290558e-05,201.37353229522705,COMPLETE
1130,0.35685989260673523,2023-09-04 21:50:44.595028,2023-09-04 21:50:44.784537,0 days 00:00:00.189509,ReLU,Leaky,,,41,23,14.0,,,0.010523975285506615,2,180,0.18521527733186233,0.00011369302521235191,152.53309392929077,COMPLETE
1131,0.31618860363960266,2023-09-04 21:50:44.784943,2023-09-04 21:50:46.286075,0 days 00:00:01.501132,ReLU,Tanh,,,49,20,24.0,,,0.013508167496692418,2,243,0.6841947305295153,5.3933440927925946e-05,180.10943558636833,COMPLETE
1132,0.2336248904466629,2023-09-04 21:50:46.286485,2023-09-04 21:50:47.166048,0 days 00:00:00.879563,ReLU,Leaky,Leaky,ReLU,40,18,10.0,8.0,7.0,0.0031354984870272345,4,65,0.7698125120402156,1.1808046265404423e-05,213.92258955792684,COMPLETE
1133,0.39819028973579407,2023-09-04 21:50:47.166467,2023-09-04 21:50:47.699413,0 days 00:00:00.532946,ReLU,Leaky,Leaky,ReLU,44,17,9.0,19.0,8.0,0.0034840669015174545,4,75,0.24201310017302002,1.2593152338616381e-05,135.99612213134765,COMPLETE
1134,0.307435542345047,2023-09-04 21:50:47.699853,2023-09-04 21:50:48.744795,0 days 00:00:01.044942,ReLU,Leaky,ReLU,ReLU,42,18,11.0,16.0,5.0,0.005097183676132907,4,76,0.5331626005980329,1.5761617986512153e-05,6790.255394504495,COMPLETE
1135,0.5597786903381348,2023-09-04 21:50:48.745302,2023-09-04 21:50:49.018910,0 days 00:00:00.273608,ReLU,Tanh,Leaky,ReLU,44,17,10.0,12.0,2.0,0.0009185697794938796,4,50,0.12376384305859704,1.3255732283739842e-05,127.07459991455079,COMPLETE
1136,0.47915709018707275,2023-09-04 21:50:49.019331,2023-09-04 21:50:49.381176,0 days 00:00:00.361845,ReLU,ReLU,Tanh,ReLU,41,18,9.0,20.0,7.0,0.0011770164751486914,4,77,0.11744651921674673,1.1736488309972224e-05,290.56281692103335,COMPLETE
1137,0.2999683618545532,2023-09-04 21:50:49.381617,2023-09-04 21:50:50.342783,0 days 00:00:00.961166,Tanh,Leaky,Leaky,ReLU,40,18,10.0,20.0,12.0,0.0030749996135596576,4,58,0.7198487778962761,1.7534030289556174e-05,130.4242235548953,COMPLETE
1138,0.34836238622665405,2023-09-04 21:50:50.343224,2023-09-04 21:50:50.896196,0 days 00:00:00.552972,ReLU,Leaky,Leaky,ReLU,46,17,11.0,14.0,11.0,0.0043098876789638505,4,61,0.3504422654111503,1.4658132068802647e-05,202.6335583773526,COMPLETE
1139,0.3532767593860626,2023-09-04 21:50:50.896630,2023-09-04 21:50:51.222642,0 days 00:00:00.326012,ReLU,Tanh,,,41,18,10.0,,,0.005269792006524566,2,59,0.22321673284949556,1.1539612635783974e-05,161.484083272643,COMPLETE
1140,0.4366829991340637,2023-09-04 21:50:51.223084,2023-09-04 21:50:52.152674,0 days 00:00:00.929590,ReLU,Leaky,Leaky,Tanh,43,18,9.0,9.0,1.0,0.00867252143963331,4,54,0.6668352873643099,1.0965863505277958e-05,196.2009337803103,COMPLETE
1141,0.636444628238678,2023-09-04 21:50:52.153107,2023-09-04 21:50:53.095346,0 days 00:00:00.942239,ReLU,Leaky,Tanh,Sigmoid,40,17,10.0,15.0,7.0,8.691507807465033e-05,4,56,0.5841821293434282,1.3682179360474344e-05,176.08160509381975,COMPLETE
1142,0.4221493899822235,2023-09-04 21:50:53.095802,2023-09-04 21:50:54.032479,0 days 00:00:00.936677,ReLU,ReLU,Leaky,ReLU,43,9,10.0,11.0,10.0,0.000754674085482265,4,193,0.17191419885815748,1.06435677977999e-05,134.1928205056624,COMPLETE
1143,0.3676098585128784,2023-09-04 21:50:54.032936,2023-09-04 21:50:54.314553,0 days 00:00:00.281617,ReLU,Sigmoid,,,40,18,10.0,,,0.019129309562353303,2,84,0.24771456095095415,2.138495600329227e-05,590.3327579941861,COMPLETE
1144,0.47079119086265564,2023-09-04 21:50:54.314977,2023-09-04 21:50:55.247670,0 days 00:00:00.932693,ReLU,Tanh,ReLU,Tanh,42,19,10.0,8.0,3.0,0.004214698458936073,4,206,0.46754093039131206,2.8877297544929774e-05,391.3674396715666,COMPLETE
1145,0.4119795262813568,2023-09-04 21:50:55.248499,2023-09-04 21:50:56.738642,0 days 00:00:01.490143,ReLU,Leaky,Leaky,Sigmoid,46,19,11.0,13.0,13.0,0.059860025965579974,4,68,0.7440321805610125,1.559838058804615e-05,507.8698663711548,COMPLETE
1146,0.33398565649986267,2023-09-04 21:50:56.739082,2023-09-04 21:50:59.412072,0 days 00:00:02.672990,ReLU,Leaky,Leaky,Leaky,39,18,11.0,15.0,8.0,0.0013332389248291502,4,88,0.7074556930049871,0.0028580274677994597,252.50458006425336,COMPLETE
1147,0.48176297545433044,2023-09-04 21:50:59.412510,2023-09-04 21:50:59.844882,0 days 00:00:00.432372,Tanh,Tanh,Leaky,ReLU,44,19,9.0,10.0,17.0,0.011943446579030948,4,64,0.28571265621418224,0.015962455967536832,209.7195848034274,COMPLETE
1148,0.9355420470237732,2023-09-04 21:50:59.845306,2023-09-04 21:51:01.068405,0 days 00:00:01.223099,ReLU,Leaky,Tanh,Leaky,41,18,10.0,13.0,5.0,1.051963364807683e-05,4,75,0.6122790991370737,0.0008742441496204245,203.23388997395833,COMPLETE
1149,0.4846336543560028,2023-09-04 21:51:01.068829,2023-09-04 21:51:01.349714,0 days 00:00:00.280885,ReLU,Leaky,Leaky,ReLU,51,19,8.0,9.0,18.0,0.0019428307324531689,4,104,0.11128834804264719,0.0002735807419142102,186.68036200295032,COMPLETE
1150,0.3557104468345642,2023-09-04 21:51:01.350161,2023-09-04 21:51:02.050010,0 days 00:00:00.699849,ReLU,ReLU,Leaky,Sigmoid,40,19,10.0,8.0,15.0,0.022671689745150943,4,187,0.4359763448184333,0.0014020245729473614,292.33448264382105,COMPLETE
1151,0.28985297679901123,2023-09-04 21:51:02.050449,2023-09-04 21:51:02.731991,0 days 00:00:00.681542,ReLU,Leaky,Leaky,Tanh,47,18,10.0,24.0,2.0,0.009817510954245314,4,65,0.7673755366671452,0.00038558777075527043,280.46601126534597,COMPLETE
1152,0.35605567693710327,2023-09-04 21:51:02.732417,2023-09-04 21:51:03.818373,0 days 00:00:01.085956,ReLU,Tanh,ReLU,Leaky,38,16,12.0,9.0,6.0,0.006202939063746757,4,60,0.7248757808215648,0.02277208079983684,245.33230705980984,COMPLETE
1153,0.6225197911262512,2023-09-04 21:51:03.818803,2023-09-04 21:51:04.866146,0 days 00:00:01.047343,ReLU,Leaky,Tanh,ReLU,42,17,11.0,8.0,24.0,9.970655406964989e-05,4,51,0.7695516438129009,0.03861704491608807,106.43444958855125,COMPLETE
1154,0.36583012342453003,2023-09-04 21:51:04.866567,2023-09-04 21:51:05.188381,0 days 00:00:00.321814,ReLU,,,,44,19,,,,0.01583581482550663,1,71,0.6756140502049381,1.0240225638403722e-05,132.82267134530204,COMPLETE
1155,0.5503577589988708,2023-09-04 21:51:05.188793,2023-09-04 21:51:05.613555,0 days 00:00:00.424762,ReLU,Leaky,Leaky,Leaky,56,6,9.0,10.0,20.0,0.0009687456840045183,4,54,0.2711289094496591,0.00022214967630278647,248.5523637842249,COMPLETE
1156,0.4689958989620209,2023-09-04 21:51:05.613992,2023-09-04 21:51:05.960839,0 days 00:00:00.346847,ReLU,Tanh,Leaky,Sigmoid,39,18,16.0,18.0,8.0,0.00481052809597075,4,61,0.13635453486066382,0.0022541456303287843,161.07184976046202,COMPLETE
1157,0.8703787326812744,2023-09-04 21:51:05.961280,2023-09-04 21:51:07.239469,0 days 00:00:01.278189,ReLU,Sigmoid,Leaky,ReLU,38,19,11.0,19.0,22.0,3.027159081663328e-05,4,57,0.7406329127685555,4.225738001503064e-05,106.29941759611431,COMPLETE
1158,0.3658158779144287,2023-09-04 21:51:07.239921,2023-09-04 21:51:08.665687,0 days 00:00:01.425766,ReLU,ReLU,Tanh,Leaky,53,17,20.0,15.0,4.0,0.00035218495051783763,4,86,0.7714902811992362,1.8632636145238087e-05,922.3596500130587,COMPLETE
1159,0.26865580677986145,2023-09-04 21:51:08.666132,2023-09-04 21:51:09.761864,0 days 00:00:01.095732,Tanh,Leaky,Leaky,Tanh,42,18,19.0,12.0,10.0,0.003282365916421992,4,102,0.7051385035650236,0.0019937748349369558,133.75761440344024,COMPLETE
1160,0.4194730520248413,2023-09-04 21:51:09.762331,2023-09-04 21:51:11.205643,0 days 00:00:01.443312,ReLU,Leaky,Leaky,Leaky,29,19,20.0,7.0,9.0,0.0006256189605133315,4,174,0.36453751568798604,3.135727017179506e-05,237.20416194370816,COMPLETE
1161,0.3202676773071289,2023-09-04 21:51:11.206109,2023-09-04 21:51:11.816336,0 days 00:00:00.610227,ReLU,Tanh,,,39,18,21.0,,,0.007837030456704296,2,51,0.6329582427837673,2.4907349260064958e-05,134.11983523898655,COMPLETE
1162,0.4983285069465637,2023-09-04 21:51:11.816773,2023-09-04 21:51:12.247491,0 days 00:00:00.430718,ReLU,Leaky,ReLU,Sigmoid,40,19,1.0,24.0,15.0,0.013367864687257003,4,70,0.743465559153109,0.00017582159765023575,469.3041127522786,COMPLETE
1163,0.3467741310596466,2023-09-04 21:51:12.247946,2023-09-04 21:51:13.298404,0 days 00:00:01.050458,ReLU,Leaky,Leaky,ReLU,37,19,20.0,20.0,11.0,0.002375736347117806,4,198,0.7737783422147719,0.024754045205232632,414.0702290852865,COMPLETE
1164,0.27093857526779175,2023-09-04 21:51:13.298842,2023-09-04 21:51:13.976410,0 days 00:00:00.677568,ReLU,ReLU,Leaky,Leaky,45,20,21.0,8.0,5.0,0.009639121003649505,4,97,0.7209970124917513,3.687329850092327e-05,599.3106070382255,COMPLETE
1165,0.4927648901939392,2023-09-04 21:51:13.976860,2023-09-04 21:51:15.167252,0 days 00:00:01.190392,ReLU,Tanh,,,42,18,7.0,,,0.0001778326830309975,2,94,0.6602262603082949,0.06414816205672398,229.8186733164686,COMPLETE
1166,0.9374079704284668,2023-09-04 21:51:15.167687,2023-09-04 21:51:15.993234,0 days 00:00:00.825547,ReLU,Leaky,Tanh,Tanh,47,20,10.0,9.0,18.0,1.819001394091962e-05,4,209,0.12047848058972555,0.00014760046357426397,100.08909121426669,COMPLETE
1167,0.3693163990974426,2023-09-04 21:51:15.993689,2023-09-04 21:51:16.274763,0 days 00:00:00.281074,ReLU,Leaky,Leaky,ReLU,49,17,20.0,10.0,23.0,0.030773835312030783,4,194,0.21619439553181835,0.00028252906747759323,278.07142464773995,COMPLETE
1168,0.33473753929138184,2023-09-04 21:51:16.275214,2023-09-04 21:51:17.868230,0 days 00:00:01.593016,Tanh,Leaky,Leaky,,40,19,9.0,15.0,,0.0037987919873504502,3,183,0.6895514001508695,0.0006257728880675501,382.5130935823075,COMPLETE
1169,0.34408244490623474,2023-09-04 21:51:17.868677,2023-09-04 21:51:18.426941,0 days 00:00:00.558264,ReLU,Tanh,Leaky,,37,20,19.0,21.0,,0.03905489970021908,3,286,0.769990438809507,0.0034025472685546326,491.0307429387019,COMPLETE
1170,0.3662298023700714,2023-09-04 21:51:18.427418,2023-09-04 21:51:18.886080,0 days 00:00:00.458662,ReLU,Sigmoid,Tanh,,44,18,20.0,11.0,,0.015898355264439525,3,62,0.3058028662246376,0.00021291171606551904,225.57989685058592,COMPLETE
1171,0.2968011498451233,2023-09-04 21:51:18.886558,2023-09-04 21:51:19.887958,0 days 00:00:01.001400,ReLU,Leaky,ReLU,,35,19,21.0,9.0,,0.019674704668723144,3,61,0.7356556333180384,4.0913046389664645e-05,341.35704881317764,COMPLETE
1172,0.3582943379878998,2023-09-04 21:51:19.888397,2023-09-04 21:51:20.656753,0 days 00:00:00.768356,ReLU,ReLU,Leaky,,28,17,21.0,7.0,,0.012178110447270352,3,71,0.7749048029139048,0.0015905136123976647,512.3788024902344,COMPLETE
1173,0.36442986130714417,2023-09-04 21:51:20.657227,2023-09-04 21:51:21.479854,0 days 00:00:00.822627,ReLU,Leaky,Leaky,,38,20,19.0,24.0,,0.0016645813848594707,3,66,0.48470182634391556,2.4026904586413303e-05,261.5818860603101,COMPLETE
1174,0.24086973071098328,2023-09-04 21:51:21.480323,2023-09-04 21:51:22.639096,0 days 00:00:01.158773,ReLU,Tanh,Leaky,,31,19,21.0,9.0,,0.0029387556135820865,3,214,0.743682850739317,1.3325293807442636e-05,295.70888073039504,COMPLETE
1175,0.32490023970603943,2023-09-04 21:51:22.639619,2023-09-04 21:51:23.392541,0 days 00:00:00.752922,ReLU,Tanh,Leaky,,30,19,21.0,8.0,,0.002616079942975064,3,203,0.7479803489930423,1.5089728594150961e-05,299.04860496520996,COMPLETE
1176,0.33824625611305237,2023-09-04 21:51:23.392999,2023-09-04 21:51:25.032860,0 days 00:00:01.639861,ReLU,Tanh,Tanh,,31,19,17.0,9.0,,0.0029760495573735333,3,210,0.7739385817075511,1.4357802304064317e-05,142.3279792323257,COMPLETE
1177,0.24409857392311096,2023-09-04 21:51:25.033375,2023-09-04 21:51:26.188170,0 days 00:00:01.154795,ReLU,Tanh,Leaky,,29,18,22.0,8.0,,0.002140157972458711,3,195,0.7237446091903478,1.1475684147791188e-05,209.26681870680588,COMPLETE
1178,0.3470626771450043,2023-09-04 21:51:26.188693,2023-09-04 21:51:27.963027,0 days 00:00:01.774334,ReLU,Tanh,Leaky,,27,17,22.0,8.0,,0.0021610291959475816,3,197,0.7066107479215853,1.1643608157009044e-05,154.89788513183595,COMPLETE
1179,0.3478585183620453,2023-09-04 21:51:27.963481,2023-09-04 21:51:28.760840,0 days 00:00:00.797359,ReLU,Tanh,Leaky,,26,18,22.0,8.0,,0.002284096987496219,3,189,0.23252931403282892,1.1148341656667312e-05,223.3984262217646,COMPLETE
1180,0.5064921975135803,2023-09-04 21:51:28.761300,2023-09-04 21:51:29.068198,0 days 00:00:00.306898,ReLU,Tanh,ReLU,,28,17,22.0,8.0,,0.002825664892838428,3,199,0.14868311729507286,1.2854496755732343e-05,151.68937191433378,COMPLETE
1181,0.30853426456451416,2023-09-04 21:51:29.068663,2023-09-04 21:51:33.209417,0 days 00:00:04.140754,ReLU,Tanh,Leaky,Leaky,28,18,22.0,7.0,3.0,0.0020332214058329037,4,178,0.7281744572917429,1.2230214219073263e-05,173.0938322851263,COMPLETE
1182,0.2690451145172119,2023-09-04 21:51:33.209966,2023-09-04 21:51:34.392563,0 days 00:00:01.182597,ReLU,Tanh,Tanh,,29,18,22.0,6.0,,0.0026561682465748647,3,186,0.798461346387755,1.0189033623192663e-05,155.30830974968111,COMPLETE
1183,0.3914749026298523,2023-09-04 21:51:34.393012,2023-09-04 21:51:34.837314,0 days 00:00:00.444302,ReLU,Tanh,Leaky,,26,18,22.0,8.0,,0.0034485150270222235,3,204,0.26484604728538025,1.4385547735328651e-05,123.64444065093994,COMPLETE
1184,0.3084568977355957,2023-09-04 21:51:34.837753,2023-09-04 21:51:36.211457,0 days 00:00:01.373704,ReLU,Tanh,Leaky,,29,17,22.0,8.0,,0.001858013906749228,3,391,0.44706871772094375,1.4333519374934587e-05,114.96707112738427,COMPLETE
1185,0.4641181528568268,2023-09-04 21:51:36.211927,2023-09-04 21:51:36.563385,0 days 00:00:00.351458,ReLU,Tanh,Leaky,,29,18,22.0,7.0,,0.0030233565973591735,3,192,0.16311589177865188,0.017386591509193482,319.3095404177296,COMPLETE
1186,0.2776421904563904,2023-09-04 21:51:36.563829,2023-09-04 21:51:38.039481,0 days 00:00:01.475652,ReLU,Tanh,Leaky,,27,18,22.0,7.0,,0.002395230288012104,3,213,0.7472510009708141,1.014594748164527e-05,251.89298961201652,COMPLETE
1187,0.30459049344062805,2023-09-04 21:51:38.039945,2023-09-04 21:51:39.960418,0 days 00:00:01.920473,ReLU,Tanh,Tanh,,30,18,22.0,8.0,,0.001643384006739466,3,172,0.5715353704470675,1.2547374031680884e-05,299.9103664232337,COMPLETE
1188,0.35621970891952515,2023-09-04 21:51:39.960867,2023-09-04 21:51:42.663290,0 days 00:00:02.702423,ReLU,Tanh,ReLU,,24,18,21.0,9.0,,0.003463681850224158,3,197,0.5526333353324844,1.7621509346208744e-05,145.88549355899588,COMPLETE
1189,0.31839844584465027,2023-09-04 21:51:42.663833,2023-09-04 21:51:43.985719,0 days 00:00:01.321886,ReLU,Tanh,Leaky,,31,17,23.0,8.0,,0.002758624806097002,3,204,0.7708704917558479,1.70422876583134e-05,177.41862594249636,COMPLETE
1190,0.29159530997276306,2023-09-04 21:51:43.986542,2023-09-04 21:51:45.029514,0 days 00:00:01.042972,ReLU,Tanh,Leaky,,27,15,22.0,9.0,,0.004009488039519767,3,185,0.7048321596938294,1.1775409805358916e-05,161.64698083060128,COMPLETE
1191,0.3641044497489929,2023-09-04 21:51:45.029970,2023-09-04 21:51:45.943783,0 days 00:00:00.913813,ReLU,Tanh,Tanh,,30,17,21.0,8.0,,0.0022553880834959216,3,192,0.7473711167759441,1.3894402432133464e-05,806.7575134277344,COMPLETE
1192,0.5735262036323547,2023-09-04 21:51:45.944254,2023-09-04 21:51:48.151159,0 days 00:00:02.206905,ReLU,Tanh,Leaky,,31,19,18.0,9.0,,2.1640003645686098e-05,3,217,0.3238143452243535,1.680421214792276e-05,119.74989262594056,COMPLETE
1193,0.3499957323074341,2023-09-04 21:51:48.151627,2023-09-04 21:51:49.341253,0 days 00:00:01.189626,ReLU,Tanh,Leaky,Sigmoid,29,18,8.0,8.0,12.0,0.00349384497143824,4,206,0.34465929618778396,1.0029578031115286e-05,519.2965548971425,COMPLETE
1194,0.4091498851776123,2023-09-04 21:51:49.341728,2023-09-04 21:51:53.066797,0 days 00:00:03.725069,ReLU,Tanh,Leaky,,31,19,10.0,7.0,,0.0002184897208166745,3,176,0.7683276288629841,1.4797841742655811e-05,166.92328240654686,COMPLETE
1195,0.37567850947380066,2023-09-04 21:51:53.067346,2023-09-04 21:51:55.139590,0 days 00:00:02.072244,ReLU,Leaky,ReLU,,25,18,11.0,9.0,,0.0017517901526425256,3,197,0.7983134912723721,1.238106331232325e-05,200.02202474659887,COMPLETE
1196,0.32301437854766846,2023-09-04 21:51:55.140074,2023-09-04 21:51:56.851552,0 days 00:00:01.711478,ReLU,Tanh,Leaky,,27,13,22.0,8.0,,0.0013499378452454475,3,213,0.37584564198498166,1.89782366765309e-05,117.49763158424614,COMPLETE
1197,0.3724629282951355,2023-09-04 21:51:56.851993,2023-09-04 21:51:58.481274,0 days 00:00:01.629281,ReLU,Leaky,Tanh,,31,19,9.0,9.0,,0.0027577272362733288,3,181,0.7988839459609179,0.013417855067170172,159.87775539344466,COMPLETE
1198,0.4111205041408539,2023-09-04 21:51:58.481707,2023-09-04 21:52:02.489533,0 days 00:00:04.007826,ReLU,Leaky,Leaky,,28,17,3.0,9.0,,0.004439790652562115,3,190,0.6784621972840122,1.2880030067368241e-05,371.1386542363998,COMPLETE
1199,0.5239015817642212,2023-09-04 21:52:02.489992,2023-09-04 21:52:02.717086,0 days 00:00:00.227094,ReLU,Tanh,,,32,16,21.0,,,0.07835525391526253,2,405,0.29186550485281854,0.00947109733251392,619.1791062788529,COMPLETE
1200,0.38497212529182434,2023-09-04 21:52:02.717538,2023-09-04 21:52:05.253539,0 days 00:00:02.536001,ReLU,,,,32,19,,,,0.0008254583790683812,1,205,0.7255359387092981,1.788479306710546e-05,155.45219003857665,COMPLETE
1201,0.4255797863006592,2023-09-04 21:52:05.253967,2023-09-04 21:52:05.947239,0 days 00:00:00.693272,ReLU,Leaky,Leaky,,29,18,23.0,8.0,,0.0011663347002524177,3,164,0.3528737695584709,0.00033952903821518826,1241.5202352232852,COMPLETE
1202,0.38133424520492554,2023-09-04 21:52:05.947670,2023-09-04 21:52:06.632365,0 days 00:00:00.684695,ReLU,Leaky,Sigmoid,,32,19,22.0,7.0,,0.0019557359413139254,3,217,0.49838681708552274,0.0005116426080415384,161.10117874145507,COMPLETE
1203,0.9601910710334778,2023-09-04 21:52:06.632835,2023-09-04 21:52:07.026885,0 days 00:00:00.394050,ReLU,Tanh,Leaky,,33,18,21.0,9.0,,1.4670908588383357e-05,3,50,0.21515745964347624,0.0010670649430668995,136.94176818847657,COMPLETE
1204,0.3757762312889099,2023-09-04 21:52:07.027315,2023-09-04 21:52:08.162069,0 days 00:00:01.134754,ReLU,Leaky,Tanh,,32,19,22.0,8.0,,0.005452398007015109,3,197,0.4233955040754752,0.0001684794879893664,147.32375878998727,COMPLETE
1205,0.3185042440891266,2023-09-04 21:52:08.162558,2023-09-04 21:52:09.606725,0 days 00:00:01.444167,ReLU,Leaky,Leaky,,30,18,23.0,8.0,,0.002384199688042787,3,173,0.7184468405231244,0.0002418418594200412,156.0969573512222,COMPLETE
1206,0.47731488943099976,2023-09-04 21:52:09.607206,2023-09-04 21:52:10.286222,0 days 00:00:00.679016,ReLU,Sigmoid,Leaky,ReLU,22,19,21.0,9.0,20.0,0.0033699932029720506,4,207,0.1830536953156278,0.0007711680289129874,208.31853251303397,COMPLETE
