number,value,datetime_start,datetime_complete,duration,params_activation1,params_activation2,params_activation3,params_activation4,params_batch_size,params_fl1,params_fl2,params_fl3,params_fl4,params_learning_rate,params_n_layers,params_num_epochs,params_train_size,params_weight_decay,user_attrs_mre,state
1948,0.41264134645462036,2023-09-04 23:03:17.268336,2023-09-04 23:03:17.568099,0 days 00:00:00.299763,Sigmoid,ReLU,ReLU,,33,22,13.0,17.0,,0.015235375066382192,3,320,0.10155390133173137,1.0107041975727425e-05,184.29937101665297,COMPLETE
1949,0.32762381434440613,2023-09-04 23:03:17.568601,2023-09-04 23:03:18.368944,0 days 00:00:00.800343,Tanh,ReLU,ReLU,,36,23,12.0,18.0,,0.010822486960829505,3,392,0.7267016874807113,1.1522211695443999e-05,87.05702724456788,COMPLETE
1950,0.3136504292488098,2023-09-04 23:03:18.369458,2023-09-04 23:03:18.872176,0 days 00:00:00.502718,ReLU,Tanh,ReLU,Sigmoid,34,22,13.0,5.0,14.0,0.017762513119873435,4,322,0.6934493379239519,1.2518128235715588e-05,101.87344402737088,COMPLETE
1951,0.33552682399749756,2023-09-04 23:03:18.872691,2023-09-04 23:03:19.352872,0 days 00:00:00.480181,Tanh,ReLU,,,36,24,13.0,,,0.012961885859591096,2,332,0.7495797381909151,1.1497952922554726e-05,96.89414978027344,COMPLETE
1952,0.3264960050582886,2023-09-04 23:03:19.353387,2023-09-04 23:03:20.372111,0 days 00:00:01.018724,ReLU,ReLU,ReLU,Sigmoid,33,23,12.0,18.0,14.0,0.009886906720619986,4,222,0.7712063249368764,1.268076298640566e-05,117.70713920593262,COMPLETE
1953,0.34766876697540283,2023-09-04 23:03:20.372626,2023-09-04 23:03:20.893391,0 days 00:00:00.520765,Tanh,ReLU,ReLU,,34,22,12.0,17.0,,0.014965656505038736,3,332,0.7205847792968689,0.0057557888113355105,117.42514627630061,COMPLETE
1954,0.31777462363243103,2023-09-04 23:03:20.893889,2023-09-04 23:03:21.515310,0 days 00:00:00.621421,ReLU,ReLU,ReLU,,38,22,13.0,17.0,,0.010416708684296679,3,336,0.7709685980809023,1.4636661813900318e-05,117.9346176673626,COMPLETE
1955,0.3243251442909241,2023-09-04 23:03:21.515828,2023-09-04 23:03:24.262794,0 days 00:00:02.746966,Tanh,ReLU,ReLU,Sigmoid,32,23,13.0,18.0,13.0,0.0003787119844917959,4,135,0.6590713405954819,1.4979273060453418e-05,85.32111285174335,COMPLETE
1956,0.3919019103050232,2023-09-04 23:03:24.263320,2023-09-04 23:03:24.760901,0 days 00:00:00.497581,ReLU,Tanh,ReLU,,36,22,14.0,17.0,,0.09893570209574684,3,217,0.7421225744557725,0.0027056668911463987,119.10481172449448,COMPLETE
1957,0.3463924825191498,2023-09-04 23:03:24.761412,2023-09-04 23:03:26.956486,0 days 00:00:02.195074,Tanh,ReLU,ReLU,Sigmoid,33,23,12.0,17.0,12.0,0.0005512815772903325,4,355,0.4935001788500998,0.00017781057243754358,190.4377089606391,COMPLETE
1958,0.336029589176178,2023-09-04 23:03:26.956998,2023-09-04 23:03:28.128755,0 days 00:00:01.171757,ReLU,ReLU,ReLU,,35,22,13.0,17.0,,0.014922896348579292,3,237,0.7719923161019898,0.0018858933317998162,95.26780516525795,COMPLETE
1959,0.29825687408447266,2023-09-04 23:03:28.129259,2023-09-04 23:03:28.770961,0 days 00:00:00.641702,Tanh,Leaky,ReLU,Sigmoid,38,22,14.0,18.0,14.0,0.02060934355255378,4,310,0.7051286782812218,0.0004747624374610062,106.56257629394531,COMPLETE
1960,0.43113747239112854,2023-09-04 23:03:28.771475,2023-09-04 23:03:29.180638,0 days 00:00:00.409163,Sigmoid,ReLU,ReLU,,32,22,14.0,8.0,,0.01210043316741697,3,243,0.12573202783783416,0.0003275661606133288,284.9162976153485,COMPLETE
1961,0.29567253589630127,2023-09-04 23:03:29.181157,2023-09-04 23:03:30.510578,0 days 00:00:01.329421,ReLU,ReLU,ReLU,Sigmoid,35,23,13.0,17.0,12.0,0.009610957126988942,4,246,0.7987659292231941,4.5471805310366066e-05,90.53318143358418,COMPLETE
1962,0.38511812686920166,2023-09-04 23:03:30.511098,2023-09-04 23:03:31.073424,0 days 00:00:00.562326,Tanh,ReLU,ReLU,,32,23,12.0,7.0,,0.05952333707923851,3,308,0.7332166432966167,0.008231943728004534,133.96328204611072,COMPLETE
1963,0.4309527575969696,2023-09-04 23:03:31.073937,2023-09-04 23:03:31.304810,0 days 00:00:00.230873,ReLU,Tanh,,,37,22,13.0,,,0.0018202521239221244,2,320,0.10033984658408306,0.0036635223060699925,192.74024035883886,COMPLETE
1964,0.33930525183677673,2023-09-04 23:03:31.305320,2023-09-04 23:03:32.225305,0 days 00:00:00.919985,Tanh,ReLU,ReLU,,39,22,12.0,17.0,,0.002386650988855051,3,342,0.42911364053334955,1.3257502615825047e-05,107.55514417375836,COMPLETE
1965,0.32669153809547424,2023-09-04 23:03:32.225813,2023-09-04 23:03:32.492571,0 days 00:00:00.266758,ReLU,,,,76,23,,,,0.017573404641309225,1,332,0.5927988946098188,0.0001455406684186059,100.44022598266602,COMPLETE
1966,0.3984581530094147,2023-09-04 23:03:32.493093,2023-09-04 23:03:32.945897,0 days 00:00:00.452804,Tanh,ReLU,ReLU,Sigmoid,34,23,14.0,18.0,13.0,0.05132025847708331,4,323,0.3537540685710631,0.006786068846916214,126.44455324370286,COMPLETE
1967,0.35747218132019043,2023-09-04 23:03:32.946411,2023-09-04 23:03:33.587114,0 days 00:00:00.640703,ReLU,ReLU,ReLU,,32,22,13.0,7.0,,0.023923575697306285,3,230,0.6746844710742527,0.0005793008333175872,121.5319692171537,COMPLETE
1968,0.30606457591056824,2023-09-04 23:03:33.587627,2023-09-04 23:03:34.084917,0 days 00:00:00.497290,Tanh,ReLU,ReLU,,53,24,14.0,19.0,,0.013453087364233571,3,316,0.7691154070761936,9.041864870865105e-05,92.49395497639973,COMPLETE
1969,0.29538631439208984,2023-09-04 23:03:34.085431,2023-09-04 23:03:34.992680,0 days 00:00:00.907249,ReLU,ReLU,ReLU,Sigmoid,34,23,13.0,9.0,12.0,0.010724252575602193,4,354,0.7475446361124959,0.0011772429385951274,81.37960382409997,COMPLETE
1970,0.30642908811569214,2023-09-04 23:03:34.993192,2023-09-04 23:03:38.653560,0 days 00:00:03.660368,Tanh,Tanh,ReLU,Sigmoid,15,22,14.0,6.0,16.0,0.0002152163201246349,4,373,0.4623978628618041,1.1993200154241212e-05,124.7189669822579,COMPLETE
1971,0.39360156655311584,2023-09-04 23:03:38.654112,2023-09-04 23:03:39.247905,0 days 00:00:00.593793,ReLU,Sigmoid,ReLU,,36,22,12.0,5.0,,0.008803679168852555,3,324,0.27503538190100274,0.05362246097555795,107.15648411342076,COMPLETE
1972,0.3518451452255249,2023-09-04 23:03:39.248413,2023-09-04 23:03:40.411987,0 days 00:00:01.163574,Tanh,ReLU,ReLU,,50,21,13.0,18.0,,0.0011100275693364738,3,315,0.7999872109742208,1.0063824723449684e-05,123.93003165885193,COMPLETE
1973,0.37891441583633423,2023-09-04 23:03:40.412494,2023-09-04 23:03:43.483409,0 days 00:00:03.070915,Sigmoid,ReLU,ReLU,Sigmoid,19,23,14.0,17.0,11.0,0.0015444483738858794,4,326,0.2630065247627917,0.00011391952266251692,232.9761691138858,COMPLETE
1974,0.3560865819454193,2023-09-04 23:03:43.483938,2023-09-04 23:03:43.848232,0 days 00:00:00.364294,ReLU,Leaky,ReLU,,31,22,12.0,8.0,,0.03156194009818381,3,355,0.25566436751341737,3.6889348213097834e-05,360.5796518036814,COMPLETE
1975,0.28766679763793945,2023-09-04 23:03:43.848744,2023-09-04 23:03:45.793010,0 days 00:00:01.944266,Tanh,ReLU,ReLU,Sigmoid,20,22,14.0,17.0,15.0,0.003439543896571022,4,261,0.7230598014779841,0.00026609518737683106,877.4742986505681,COMPLETE
1976,0.3348085284233093,2023-09-04 23:03:45.793527,2023-09-04 23:03:46.940795,0 days 00:00:01.147268,ReLU,ReLU,ReLU,,36,21,13.0,6.0,,0.0029807664612568133,3,347,0.6339336999333433,0.0008772045419557504,88.90813718523297,COMPLETE
1977,0.34407493472099304,2023-09-04 23:03:46.941300,2023-09-04 23:03:51.835635,0 days 00:00:04.894335,Tanh,ReLU,ReLU,,39,23,8.0,4.0,,5.746909019545568e-05,3,324,0.692256441720331,3.119939647447093e-05,111.55797626354077,COMPLETE
1978,0.324729859828949,2023-09-04 23:03:51.836144,2023-09-04 23:03:56.711876,0 days 00:00:04.875732,ReLU,Tanh,ReLU,Sigmoid,17,24,14.0,7.0,15.0,0.00026603440101064516,4,377,0.7999795670706522,1.5448951745202602e-05,121.27111497961957,COMPLETE
1979,0.4617294669151306,2023-09-04 23:03:56.712411,2023-09-04 23:03:57.113028,0 days 00:00:00.400617,Tanh,ReLU,ReLU,,33,21,13.0,13.0,,0.008540092904283335,3,235,0.3436404063779525,0.07101361388841129,122.52374725341797,COMPLETE
1980,0.4030023515224457,2023-09-04 23:03:57.113541,2023-09-04 23:03:57.473482,0 days 00:00:00.359941,ReLU,ReLU,Leaky,Sigmoid,22,17,12.0,17.0,11.0,0.011657432526836452,4,331,0.14553014073111187,0.00019122816423753155,205.15539073944092,COMPLETE
1981,0.2975730001926422,2023-09-04 23:03:57.474012,2023-09-04 23:03:58.188980,0 days 00:00:00.714968,Tanh,ReLU,ReLU,,31,22,14.0,6.0,,0.02027891697088719,3,364,0.747416500611308,5.2487087546346e-05,86.10676600138346,COMPLETE
1982,0.3511732816696167,2023-09-04 23:03:58.189485,2023-09-04 23:04:00.823642,0 days 00:00:02.634157,ReLU,,,,37,22,,,,0.0001772276504440228,1,358,0.7688164343233017,7.029035650904582e-05,100.75960885992956,COMPLETE
1983,0.45581257343292236,2023-09-04 23:04:00.824141,2023-09-04 23:04:05.340539,0 days 00:00:04.516398,Tanh,ReLU,Sigmoid,Sigmoid,12,21,12.0,18.0,12.0,8.47358379832635e-05,4,253,0.2397738852981053,0.00023322221677236844,134.52195284394878,COMPLETE
1984,0.36564528942108154,2023-09-04 23:04:05.341066,2023-09-04 23:04:10.720465,0 days 00:00:05.379399,Sigmoid,ReLU,,,34,23,22.0,,,0.00017395299428038717,2,340,0.71745367243135,0.0023646691549560027,111.61733113457174,COMPLETE
1985,0.3617001175880432,2023-09-04 23:04:10.720966,2023-09-04 23:04:12.142469,0 days 00:00:01.421503,ReLU,Tanh,ReLU,,18,21,15.0,17.0,,0.0001859634675486833,3,241,0.19938952100679705,0.008878688993771228,114.57397425094707,COMPLETE
1986,0.28403589129447937,2023-09-04 23:04:12.142992,2023-09-04 23:04:13.573623,0 days 00:00:01.430631,Tanh,ReLU,Leaky,Sigmoid,21,23,13.0,5.0,13.0,0.003932255615618413,4,221,0.7699704771509512,4.0932120647549426e-05,102.25489597320556,COMPLETE
1987,0.3443051278591156,2023-09-04 23:04:13.574146,2023-09-04 23:04:14.064651,0 days 00:00:00.490505,ReLU,Leaky,ReLU,,23,22,23.0,7.0,,0.013947620625913844,3,248,0.2951892199407536,1.8392520153370757e-05,113.42562081473214,COMPLETE
1988,0.29630085825920105,2023-09-04 23:04:14.065160,2023-09-04 23:04:17.850334,0 days 00:00:03.785174,Tanh,ReLU,ReLU,,31,23,15.0,16.0,,0.0005471061119650174,3,263,0.7991758819285759,0.001627942286579644,75.9066250472419,COMPLETE
1989,0.3937508463859558,2023-09-04 23:04:17.850857,2023-09-04 23:04:18.285692,0 days 00:00:00.434835,ReLU,ReLU,Sigmoid,Sigmoid,40,24,8.0,6.0,11.0,0.027482246095053703,4,235,0.16875237706497226,0.0001393337758601276,584.3066952175565,COMPLETE
1990,0.31933870911598206,2023-09-04 23:04:18.286211,2023-09-04 23:04:19.913484,0 days 00:00:01.627273,Tanh,ReLU,ReLU,,33,21,14.0,8.0,,0.0007903287076534173,3,116,0.5339097887172752,0.0003931233746286868,110.50840357371739,COMPLETE
1991,0.3269176781177521,2023-09-04 23:04:19.914004,2023-09-04 23:04:21.504954,0 days 00:00:01.590950,ReLU,ReLU,Leaky,Sigmoid,20,16,13.0,17.0,14.0,0.0021186310604677273,4,255,0.39977060431961897,0.0001104170379733258,104.44252125809832,COMPLETE
1992,0.31994765996932983,2023-09-04 23:04:21.505483,2023-09-04 23:04:22.032292,0 days 00:00:00.526809,Tanh,Tanh,ReLU,,35,22,21.0,16.0,,0.016407654413490087,3,228,0.5610569434680304,2.4638530403640625e-05,680.215456206223,COMPLETE
1993,0.3620472848415375,2023-09-04 23:04:22.032811,2023-09-04 23:04:26.281885,0 days 00:00:04.249074,ReLU,ReLU,ReLU,Sigmoid,15,18,14.0,18.0,24.0,7.901891311394044e-05,4,215,0.33180950212319665,1.652763757358467e-05,113.97027988877407,COMPLETE
1994,0.3704591691493988,2023-09-04 23:04:26.282412,2023-09-04 23:04:26.626146,0 days 00:00:00.343734,Tanh,ReLU,ReLU,,23,22,12.0,19.0,,0.04082067836984464,3,344,0.15299188958778373,0.0005075571430913241,212.05272992451987,COMPLETE
1995,0.2985094487667084,2023-09-04 23:04:26.626649,2023-09-04 23:04:28.003143,0 days 00:00:01.376494,ReLU,Sigmoid,Sigmoid,Sigmoid,18,21,16.0,16.0,13.0,0.007830946998288266,4,266,0.7433298198571202,0.00029290548885121183,105.07347237723214,COMPLETE
1996,0.3215525448322296,2023-09-04 23:04:28.003667,2023-09-04 23:04:29.691451,0 days 00:00:01.687784,Sigmoid,ReLU,Leaky,,37,23,13.0,5.0,,0.0048777671476001195,3,246,0.6877548728810354,0.0007103459961672256,101.64106828339246,COMPLETE
1997,0.34350326657295227,2023-09-04 23:04:29.691972,2023-09-04 23:04:30.169592,0 days 00:00:00.477620,Tanh,ReLU,ReLU,Sigmoid,31,21,15.0,11.0,15.0,0.010244748974280096,4,239,0.23600734684738117,5.7580888816628066e-05,131.8902990651685,COMPLETE
1998,0.33883845806121826,2023-09-04 23:04:30.170122,2023-09-04 23:04:31.221600,0 days 00:00:01.051478,ReLU,ReLU,Sigmoid,,21,22,16.0,17.0,,0.0025696108592007274,3,253,0.21637213466853894,0.027975341224200017,231.52734104932938,COMPLETE
1999,0.4039943218231201,2023-09-04 23:04:31.222112,2023-09-04 23:04:31.676839,0 days 00:00:00.454727,Tanh,Tanh,ReLU,,34,18,12.0,16.0,,0.0012777046300077653,3,271,0.10008631557595465,0.00016153196222130412,210.85053836598115,COMPLETE
