number,value,datetime_start,datetime_complete,duration,params_activation1,params_activation2,params_activation3,params_activation4,params_batch_size,params_fl1,params_fl2,params_fl3,params_fl4,params_learning_rate,params_n_layers,params_num_epochs,params_train_size,params_weight_decay,user_attrs_mre,state
1667,0.42256954312324524,2023-09-04 22:09:56.239660,2023-09-04 22:09:56.800972,0 days 00:00:00.561312,Sigmoid,Leaky,ReLU,,35,11,13.0,7.0,,0.009767797217755057,3,207,0.3192958519963375,0.005425314135189521,168.73623887547907,COMPLETE
1668,0.38475170731544495,2023-09-04 22:09:56.801505,2023-09-04 22:09:57.211155,0 days 00:00:00.409650,Tanh,Leaky,Tanh,Leaky,31,21,20.0,23.0,24.0,0.0028827679919969985,4,152,0.17055653351403835,6.6798136527347e-05,187.8948076938061,COMPLETE
1669,0.48299357295036316,2023-09-04 22:09:57.211726,2023-09-04 22:09:58.005420,0 days 00:00:00.793694,Sigmoid,ReLU,Sigmoid,,39,17,21.0,16.0,,0.06778367031922791,3,70,0.7698264041144868,0.000471160095980137,194.55873148064865,COMPLETE
1670,0.4400959610939026,2023-09-04 22:09:58.005918,2023-09-04 22:09:59.125764,0 days 00:00:01.119846,Sigmoid,Leaky,ReLU,,26,23,9.0,14.0,,0.0018492163402593215,3,238,0.1616848524418127,3.5869518922874185e-05,133.05666916628917,COMPLETE
1671,0.325943261384964,2023-09-04 22:09:59.126262,2023-09-04 22:09:59.711357,0 days 00:00:00.585095,Sigmoid,Sigmoid,Tanh,,42,18,18.0,22.0,,0.03752895645061396,3,218,0.7998624264266074,1.3758057772732327e-05,213.64780308650091,COMPLETE
1672,0.34236279129981995,2023-09-04 22:09:59.711882,2023-09-04 22:10:00.404146,0 days 00:00:00.692264,Sigmoid,Leaky,ReLU,,53,21,22.0,10.0,,0.012162193643794424,3,216,0.7438780437031066,0.0012385068954679987,262.35860842750185,COMPLETE
1673,1.0380057096481323,2023-09-04 22:10:00.404648,2023-09-04 22:10:00.671984,0 days 00:00:00.267336,Leaky,Leaky,Sigmoid,Sigmoid,36,19,20.0,9.0,11.0,0.0059484813292927825,4,204,0.18126349243003045,0.05419215400372031,103.00583044687907,COMPLETE
1674,0.31159552931785583,2023-09-04 22:10:00.672560,2023-09-04 22:10:02.296248,0 days 00:00:01.623688,Sigmoid,Leaky,ReLU,,33,13,14.0,8.0,,0.008237502465915906,3,123,0.6093874641501339,8.201562456656366e-05,196.59489926424894,COMPLETE
1675,0.2715185880661011,2023-09-04 22:10:02.296875,2023-09-04 22:10:04.392549,0 days 00:00:02.095674,Tanh,Leaky,,,47,22,19.0,,,0.0012759925049293948,2,353,0.799948844566611,0.002350346328993675,154.6179264775029,COMPLETE
1676,0.7388681769371033,2023-09-04 22:10:04.393155,2023-09-04 22:10:04.787050,0 days 00:00:00.393895,Sigmoid,Leaky,Tanh,,29,19,15.0,22.0,,0.00038055392889944803,3,59,0.11829903229545308,2.5534114458762692e-05,245.3246909965903,COMPLETE
1677,0.5513842105865479,2023-09-04 22:10:04.787649,2023-09-04 22:10:05.592144,0 days 00:00:00.804495,Sigmoid,Leaky,Sigmoid,,37,4,17.0,19.0,,0.00392915743288086,3,226,0.1167712001761391,1.8390248371306898e-05,216.24027158858928,COMPLETE
1678,0.40943804383277893,2023-09-04 22:10:05.592714,2023-09-04 22:10:06.720131,0 days 00:00:01.127417,Sigmoid,ReLU,ReLU,,32,19,22.0,23.0,,0.0022899315612367834,3,249,0.37310839016078196,4.978261140959386e-05,160.93151534687388,COMPLETE
1679,0.44257497787475586,2023-09-04 22:10:06.720674,2023-09-04 22:10:08.013536,0 days 00:00:01.292862,Sigmoid,Leaky,Tanh,Leaky,40,18,21.0,13.0,20.0,0.0009275961885055566,4,208,0.22741440078478317,3.104878251002958e-05,153.53242903489334,COMPLETE
1680,0.3833799362182617,2023-09-04 22:10:08.014073,2023-09-04 22:10:09.512906,0 days 00:00:01.498833,Sigmoid,Leaky,Sigmoid,,100,21,10.0,8.0,,0.00324951502600529,3,160,0.6883807057702336,1.0165898579635367e-05,156.69748668670655,COMPLETE
1681,0.3348751664161682,2023-09-04 22:10:09.513413,2023-09-04 22:10:10.195208,0 days 00:00:00.681795,Leaky,Sigmoid,ReLU,,34,19,20.0,7.0,,0.013596518784979967,3,227,0.7469521350278178,0.0008413260627882426,211.08103377730757,COMPLETE
1682,0.34321632981300354,2023-09-04 22:10:10.195947,2023-09-04 22:10:10.948515,0 days 00:00:00.752568,Tanh,Leaky,ReLU,,38,23,21.0,10.0,,0.004720773001871863,3,213,0.713218315324318,4.15275708902545e-05,170.04606776767307,COMPLETE
1683,0.809671938419342,2023-09-04 22:10:10.949105,2023-09-04 22:10:14.868087,0 days 00:00:03.918982,Sigmoid,Leaky,Tanh,,45,19,16.0,21.0,,1.3331559099291314e-05,3,234,0.7667815426406889,0.0015148129960825894,138.63248525114142,COMPLETE
1684,0.4683784544467926,2023-09-04 22:10:14.868594,2023-09-04 22:10:15.414208,0 days 00:00:00.545614,Sigmoid,Leaky,Sigmoid,,30,18,22.0,9.0,,0.009180152774251354,3,201,0.20007296044585124,0.0003532695463524615,164.49612525657372,COMPLETE
1685,0.496886670589447,2023-09-04 22:10:15.414749,2023-09-04 22:10:19.566810,0 days 00:00:04.152061,Sigmoid,Leaky,ReLU,ReLU,35,17,21.0,18.0,10.0,0.0006193828850896421,4,221,0.6675096275343007,0.012087664284397455,203.4430573334565,COMPLETE
1686,0.34492936730384827,2023-09-04 22:10:19.567393,2023-09-04 22:10:21.655937,0 days 00:00:02.088544,Sigmoid,Leaky,Tanh,,42,22,19.0,23.0,,0.0026408523744370278,3,203,0.5203721036081551,9.455660538342538e-05,163.2263058253697,COMPLETE
1687,0.47217652201652527,2023-09-04 22:10:21.656618,2023-09-04 22:10:22.192159,0 days 00:00:00.535541,Leaky,Leaky,Sigmoid,,49,21,20.0,22.0,,0.011256950852245675,3,150,0.2372004114303871,4.57753128757808e-05,156.30633805673332,COMPLETE
1688,0.4452823996543884,2023-09-04 22:10:22.192676,2023-09-04 22:10:24.390160,0 days 00:00:02.197484,Sigmoid,Leaky,ReLU,,32,19,11.0,4.0,,0.0011104200328914797,3,242,0.350935166088582,0.00010629230947468612,184.18694246162488,COMPLETE
1689,0.6290684342384338,2023-09-04 22:10:24.390715,2023-09-04 22:10:30.134968,0 days 00:00:05.744253,ReLU,ReLU,Tanh,Leaky,28,20,22.0,8.0,5.0,1.6816647827399973e-05,4,257,0.27878344545345,2.0254470542295594e-05,114.79669376477193,COMPLETE
1690,0.3226143419742584,2023-09-04 22:10:30.135649,2023-09-04 22:10:31.334819,0 days 00:00:01.199170,Tanh,Leaky,ReLU,,36,18,18.0,20.0,,0.006470013170082827,3,163,0.7996622846365196,0.017695238873376744,179.52954372829862,COMPLETE
1691,0.7466787695884705,2023-09-04 22:10:31.335496,2023-09-04 22:10:32.232226,0 days 00:00:00.896730,Sigmoid,Sigmoid,Sigmoid,,39,8,21.0,16.0,,0.0005225582573484229,3,212,0.728974445688694,0.0034390908876576628,879.5470071272416,COMPLETE
1692,0.33072641491889954,2023-09-04 22:10:32.232974,2023-09-04 22:10:33.220882,0 days 00:00:00.987908,ReLU,Leaky,ReLU,,44,20,19.0,12.0,,0.001894633585741851,3,230,0.5098544811748871,0.00041571797215412214,531.5149863688151,COMPLETE
1693,0.6263129711151123,2023-09-04 22:10:33.221599,2023-09-04 22:10:36.005955,0 days 00:00:02.784356,ReLU,Leaky,Tanh,,60,21,1.0,9.0,,6.610331409241825e-05,3,197,0.7554705470252069,7.549443731671048e-05,261.55050759872205,COMPLETE
1694,0.5161171555519104,2023-09-04 22:10:36.006493,2023-09-04 22:10:40.094962,0 days 00:00:04.088469,ReLU,Leaky,Sigmoid,Tanh,33,19,17.0,21.0,6.0,5.323389357699595e-05,4,169,0.7022121966353149,0.002591441279547291,149.52375387157915,COMPLETE
1695,0.4811224937438965,2023-09-04 22:10:40.095516,2023-09-04 22:10:40.422990,0 days 00:00:00.327474,ReLU,Leaky,ReLU,,30,22,22.0,8.0,,0.0037479393335859853,3,105,0.14670333246953443,1.593781423793512e-05,893.873653956822,COMPLETE
1696,0.4134921729564667,2023-09-04 22:10:40.423538,2023-09-04 22:10:41.419970,0 days 00:00:00.996432,Sigmoid,Leaky,Tanh,,38,17,20.0,22.0,,0.00785517188426316,3,219,0.566687270459098,0.0018113232158225284,177.36447310014205,COMPLETE
1697,0.40970852971076965,2023-09-04 22:10:41.420578,2023-09-04 22:10:41.882515,0 days 00:00:00.461937,ReLU,Leaky,ReLU,,26,21,22.0,23.0,,0.0047939296573947165,3,206,0.3114062326415771,1.2200869515660628e-05,165.0811083393712,COMPLETE
1698,0.35580119490623474,2023-09-04 22:10:41.883067,2023-09-04 22:10:42.644511,0 days 00:00:00.761444,ReLU,Leaky,Sigmoid,,41,18,21.0,9.0,,0.014482041559028132,3,197,0.7676668673592041,2.5733228825486306e-05,325.4979718182538,COMPLETE
1699,0.3810877203941345,2023-09-04 22:10:42.645051,2023-09-04 22:10:43.360582,0 days 00:00:00.715531,ReLU,ReLU,ReLU,Leaky,31,20,20.0,22.0,4.0,0.0015072496910362423,4,214,0.2991818425386277,0.000997004568991896,619.1674900378212,COMPLETE
1700,0.45006510615348816,2023-09-04 22:10:43.361126,2023-09-04 22:10:43.665383,0 days 00:00:00.304257,ReLU,Leaky,Tanh,,36,18,22.0,8.0,,0.010204341021240874,3,57,0.12678585041022508,0.014062666486114875,187.51332982381186,COMPLETE
1701,0.5102531909942627,2023-09-04 22:10:43.665935,2023-09-04 22:10:44.770944,0 days 00:00:01.105009,Sigmoid,Sigmoid,Sigmoid,,34,22,21.0,17.0,,0.0025458417893827134,3,141,0.25653606603507323,3.6418247589953716e-05,178.8415016011989,COMPLETE
1702,0.35932794213294983,2023-09-04 22:10:44.771473,2023-09-04 22:10:45.704531,0 days 00:00:00.933058,ReLU,Leaky,ReLU,,32,19,22.0,7.0,,0.0033312262380391588,3,237,0.7291722638861522,6.321943465067371e-05,127.56143580256281,COMPLETE
1703,0.33986184000968933,2023-09-04 22:10:45.705107,2023-09-04 22:10:47.186878,0 days 00:00:01.481771,ReLU,Leaky,,,95,20,19.0,,,0.0008613631724864991,2,288,0.4347009441309384,0.0005776733860240868,122.75168410936992,COMPLETE
1704,0.5050247311592102,2023-09-04 22:10:47.187408,2023-09-04 22:10:47.444820,0 days 00:00:00.257412,ReLU,Leaky,Tanh,,55,23,10.0,15.0,,0.005863909364468129,3,225,0.1089437009805368,5.8078705786765507e-05,186.24335644291895,COMPLETE
1705,0.945481538772583,2023-09-04 22:10:47.445359,2023-09-04 22:10:50.176257,0 days 00:00:02.730898,Sigmoid,Leaky,ReLU,ReLU,74,19,21.0,10.0,15.0,1.227224583978624e-05,4,248,0.6461120480302155,0.0007178692877809948,181.7605857849121,COMPLETE
1706,0.3095400035381317,2023-09-04 22:10:50.176941,2023-09-04 22:10:51.278993,0 days 00:00:01.102052,ReLU,,,,40,21,,,,0.01232613044154196,1,156,0.7489317505013636,1.4286907366953714e-05,398.0442353971712,COMPLETE
1707,0.3853859007358551,2023-09-04 22:10:51.279590,2023-09-04 22:10:51.725823,0 days 00:00:00.446233,ReLU,Leaky,Sigmoid,,28,18,18.0,23.0,,0.002121070612916214,3,207,0.18715541209939668,0.00013741889183553136,153.21864120483397,COMPLETE
1708,0.6024284362792969,2023-09-04 22:10:51.726444,2023-09-04 22:10:55.264247,0 days 00:00:03.537803,Leaky,Leaky,ReLU,,43,20,20.0,19.0,,3.717846892800027e-05,3,177,0.3387817052794068,3.0188700343886216e-05,293.38428424037784,COMPLETE
1709,0.365105003118515,2023-09-04 22:10:55.265258,2023-09-04 22:11:01.597410,0 days 00:00:06.332152,ReLU,Leaky,Tanh,,35,20,22.0,11.0,,0.00016936415302660408,3,196,0.400125173274796,0.005085534335013939,479.5371334309481,COMPLETE
1710,0.4934152662754059,2023-09-04 22:11:01.598443,2023-09-04 22:11:08.491904,0 days 00:00:06.893461,Sigmoid,ReLU,Sigmoid,Leaky,38,24,8.0,9.0,22.0,0.00029998940306220413,4,191,0.6867086134598086,0.00012441560286786997,242.77272033691406,COMPLETE
1711,0.35646575689315796,2023-09-04 22:11:08.492704,2023-09-04 22:11:08.974193,0 days 00:00:00.481489,ReLU,Leaky,ReLU,,47,21,9.0,21.0,,0.0072517344209058745,3,222,0.4137901976723591,0.001313696775731508,2714.8822760331004,COMPLETE
1712,0.34663018584251404,2023-09-04 22:11:08.974741,2023-09-04 22:11:10.486095,0 days 00:00:01.511354,ReLU,Sigmoid,Tanh,,30,19,11.0,6.0,,0.004247261837595617,3,93,0.766140630270193,4.594246990175034e-05,180.90944290161133,COMPLETE
1713,0.4065859913825989,2023-09-04 22:11:10.486628,2023-09-04 22:11:11.713905,0 days 00:00:01.227277,ReLU,Leaky,ReLU,,33,19,22.0,23.0,,0.002782167028461702,3,294,0.46117997060193633,0.02659456292530479,137.55415035199516,COMPLETE
1714,0.4202442765235901,2023-09-04 22:11:11.714447,2023-09-04 22:11:18.453175,0 days 00:00:06.738728,Tanh,Leaky,Sigmoid,,36,21,19.0,22.0,,0.00019815214715587155,3,233,0.5527391755085369,9.558365223310429e-05,220.31580850494777,COMPLETE
1715,0.404975950717926,2023-09-04 22:11:18.454215,2023-09-04 22:11:23.129210,0 days 00:00:04.674995,ReLU,Leaky,ReLU,,40,22,21.0,9.0,,0.0007244081927893825,3,209,0.36927134948671375,2.2257238905737292e-05,164.7971920634425,COMPLETE
1716,0.5286456942558289,2023-09-04 22:11:23.130256,2023-09-04 22:11:25.872875,0 days 00:00:02.742619,Sigmoid,Leaky,Tanh,Sigmoid,32,17,21.0,7.0,9.0,0.008935354208435093,4,171,0.7982024314329337,0.002173381521911573,200.50428919638358,COMPLETE
1717,0.4883692264556885,2023-09-04 22:11:25.873946,2023-09-04 22:11:27.255924,0 days 00:00:01.381978,ReLU,Leaky,Sigmoid,,69,19,20.0,8.0,,0.010948489651117436,3,183,0.524199496407879,7.312764775791749e-05,215.07376812874003,COMPLETE
1718,0.4394971430301666,2023-09-04 22:11:27.256963,2023-09-04 22:11:37.935501,0 days 00:00:10.678538,ReLU,Leaky,Leaky,,51,20,18.0,10.0,,0.00044448826109972224,3,202,0.727287136919665,0.04107563860235327,194.58148903821512,COMPLETE
1719,0.6072041988372803,2023-09-04 22:11:37.936549,2023-09-04 22:11:50.704464,0 days 00:00:12.767915,ReLU,Leaky,ReLU,Leaky,42,20,20.0,8.0,18.0,1.7472578091246234e-05,4,217,0.7720335092974822,3.9245886982467354e-05,149.24522990565146,COMPLETE
1720,0.4740651845932007,2023-09-04 22:11:50.705568,2023-09-04 22:11:54.483797,0 days 00:00:03.778229,Sigmoid,ReLU,Leaky,,34,18,10.0,20.0,,0.0013096418711921872,3,64,0.7054654520892414,0.00024913391336401264,191.50811517238617,COMPLETE
1721,0.3719445466995239,2023-09-04 22:11:54.484843,2023-09-04 22:11:59.064831,0 days 00:00:04.579988,ReLU,Leaky,Leaky,,37,23,22.0,9.0,,0.00105016356023066,3,165,0.47868475694404755,0.00015563623095209378,142.05011612806862,COMPLETE
1722,0.355231910943985,2023-09-04 22:11:59.065925,2023-09-04 22:12:00.561374,0 days 00:00:01.495449,ReLU,Leaky,Tanh,,27,22,21.0,21.0,,0.015231720588006368,3,242,0.425991886769915,0.0037222773338990317,159.7070267288773,COMPLETE
1723,0.9141610860824585,2023-09-04 22:12:00.562440,2023-09-04 22:12:04.335541,0 days 00:00:03.773101,ReLU,Sigmoid,Leaky,,29,19,23.0,7.0,,0.0001085765956862,3,80,0.4941943313150182,0.03419292233277948,110.17370433807373,COMPLETE
1724,0.32721826434135437,2023-09-04 22:12:04.336548,2023-09-04 22:12:07.584491,0 days 00:00:03.247943,ReLU,Leaky,ReLU,Leaky,24,21,22.0,18.0,7.0,0.003318331551704959,4,255,0.7436060745992358,1.774623586571345e-05,140.67377495765686,COMPLETE
1725,0.9810948967933655,2023-09-04 22:12:07.585647,2023-09-04 22:12:08.143517,0 days 00:00:00.557870,Sigmoid,Leaky,Sigmoid,,31,18,21.0,23.0,,0.0020904551293418057,3,231,0.29369390915851157,0.09588949331121503,101.83250219171697,COMPLETE
1726,0.2887933552265167,2023-09-04 22:12:08.144707,2023-09-04 22:12:10.286346,0 days 00:00:02.141639,ReLU,Tanh,Leaky,,38,20,19.0,22.0,,0.0052545770795340355,3,190,0.7720390738185554,0.00039610828082025946,133.40479570276597,COMPLETE
1727,0.45660752058029175,2023-09-04 22:12:10.287448,2023-09-04 22:12:13.251592,0 days 00:00:02.964144,ReLU,Leaky,Leaky,,45,19,23.0,8.0,,0.0016961358112367415,3,212,0.2595222775165793,0.04671688769642451,176.285999251575,COMPLETE
1728,0.31550484895706177,2023-09-04 22:12:13.252666,2023-09-04 22:12:15.562211,0 days 00:00:02.309545,ReLU,Leaky,ReLU,,35,20,22.0,22.0,,0.012695790282786237,3,128,0.5971185407662695,3.1260818817488716e-05,122.17334020705451,COMPLETE
1729,0.427613228559494,2023-09-04 22:12:15.563241,2023-09-04 22:12:16.902027,0 days 00:00:01.338786,Sigmoid,Tanh,,,33,16,20.0,,,0.0039321764730812295,2,200,0.14903067910173703,0.0011385478314083646,226.60998139814896,COMPLETE
1730,0.6783201098442078,2023-09-04 22:12:16.903074,2023-09-04 22:12:17.505575,0 days 00:00:00.602501,ReLU,Leaky,Leaky,ReLU,41,17,18.0,13.0,12.0,0.00835996200586203,4,178,0.11094154913047936,5.1744258409016134e-05,184.98303132898667,COMPLETE
1731,0.2896040976047516,2023-09-04 22:12:17.506632,2023-09-04 22:12:19.219242,0 days 00:00:01.712610,ReLU,Leaky,Tanh,,39,18,19.0,17.0,,0.0027856428231964204,3,224,0.6210744976175083,1.1899168741550337e-05,207.55915967155906,COMPLETE
1732,0.2882465720176697,2023-09-04 22:12:19.220255,2023-09-04 22:12:22.257067,0 days 00:00:03.036812,Leaky,ReLU,Leaky,,37,21,17.0,9.0,,0.006658980064930894,3,204,0.6690477689730552,0.008304588825068654,443.3629997516501,COMPLETE
1733,0.2948213815689087,2023-09-04 22:12:22.258114,2023-09-04 22:12:26.428744,0 days 00:00:04.170630,ReLU,Tanh,Sigmoid,,30,20,16.0,8.0,,0.009936280499356132,3,157,0.7301309168959029,0.00029451958465766373,152.20534443855286,COMPLETE
1734,0.38505038619041443,2023-09-04 22:12:26.429833,2023-09-04 22:12:28.314012,0 days 00:00:01.884179,Sigmoid,Leaky,Leaky,,58,19,21.0,23.0,,0.0031580789129920586,3,190,0.7732620269168783,0.00011914095371360427,248.03300066692074,COMPLETE
1735,0.5289146900177002,2023-09-04 22:12:28.315077,2023-09-04 22:12:29.559637,0 days 00:00:01.244560,ReLU,Sigmoid,ReLU,Tanh,34,23,22.0,22.0,4.0,0.03377516837565161,4,214,0.7015743192024244,1.0050319453163099e-05,221.1804903470553,COMPLETE
1736,0.354853093624115,2023-09-04 22:12:29.560706,2023-09-04 22:12:34.079766,0 days 00:00:04.519060,ReLU,Leaky,Leaky,,43,21,23.0,21.0,,0.00023051998175583664,3,226,0.28572698368004873,0.0005040620806511144,128.7551322869495,COMPLETE
1737,0.4395565092563629,2023-09-04 22:12:34.080806,2023-09-04 22:12:34.824509,0 days 00:00:00.743703,ReLU,Leaky,Tanh,,32,22,20.0,7.0,,0.01759812530806628,3,169,0.20606273374490922,0.00020425465687127898,140.71583121163505,COMPLETE
1738,0.30607032775878906,2023-09-04 22:12:34.825509,2023-09-04 22:12:38.479389,0 days 00:00:03.653880,Tanh,Tanh,Leaky,,29,20,21.0,10.0,,0.0023134255158673133,3,181,0.7987769313103803,2.536462050544311e-05,193.17464400310905,COMPLETE
1739,0.49220407009124756,2023-09-04 22:12:38.480439,2023-09-04 22:12:39.949064,0 days 00:00:01.468625,ReLU,Leaky,ReLU,,21,18,22.0,9.0,,0.0008254669203679154,3,196,0.10025310873361672,0.001709187735346682,207.9961577882158,COMPLETE
1740,1.0877782106399536,2023-09-04 22:12:39.950144,2023-09-04 22:12:41.861005,0 days 00:00:01.910861,Sigmoid,Leaky,Sigmoid,Leaky,36,19,20.0,23.0,8.0,0.0001298686888228483,4,72,0.7993154692118709,0.06096806032545656,113.82098488185717,COMPLETE
1741,0.2871460020542145,2023-09-04 22:12:41.862130,2023-09-04 22:12:45.467774,0 days 00:00:03.605644,ReLU,Tanh,Leaky,,40,18,10.0,20.0,,0.004675422614858061,3,239,0.7445760587732108,0.0028542102051622455,122.313729763031,COMPLETE
1742,0.3184460997581482,2023-09-04 22:12:45.468768,2023-09-04 22:12:47.093134,0 days 00:00:01.624366,ReLU,Leaky,Leaky,,46,19,22.0,8.0,,0.011544338250156685,3,116,0.7129072590430247,3.942685583677849e-05,294.00353956222534,COMPLETE
1743,0.2828199565410614,2023-09-04 22:12:47.094180,2023-09-04 22:12:48.417091,0 days 00:00:01.322911,ReLU,Leaky,Leaky,,49,20,12.0,9.0,,0.014863907531528818,3,208,0.5537498974826006,0.00016961328708833083,127.63235712051392,COMPLETE
1744,0.32168492674827576,2023-09-04 22:12:48.418177,2023-09-04 22:12:51.012770,0 days 00:00:02.594593,Sigmoid,Leaky,ReLU,Leaky,34,21,9.0,6.0,2.0,0.07177807921756124,4,219,0.7530266499277538,1.4766643419048996e-05,721.4087039723116,COMPLETE
1745,0.31089675426483154,2023-09-04 22:12:51.013838,2023-09-04 22:12:56.619825,0 days 00:00:05.605987,ReLU,Tanh,Tanh,,27,22,19.0,22.0,,0.001272311226115504,3,248,0.5280214428770005,0.0007417561188784878,182.50440752947773,COMPLETE
1746,0.4014967381954193,2023-09-04 22:12:56.620841,2023-09-04 22:12:57.938085,0 days 00:00:01.317244,ReLU,Leaky,Leaky,,31,19,23.0,12.0,,0.001541691626867453,3,191,0.17245494916382553,0.00011078667762514106,127.87351350223317,COMPLETE
1747,0.3328648507595062,2023-09-04 22:12:57.939115,2023-09-04 22:13:01.076786,0 days 00:00:03.137671,ReLU,ReLU,Sigmoid,,38,20,21.0,21.0,,0.0036735300229270135,3,206,0.685698470073072,5.592021060073813e-05,10158.465901692709,COMPLETE
1748,0.43475407361984253,2023-09-04 22:13:01.077809,2023-09-04 22:13:03.011971,0 days 00:00:01.934162,ReLU,Leaky,Leaky,,42,18,21.0,5.0,,0.0005953847188614742,3,150,0.2128804309578921,3.4145256594317435e-05,153.20634426690836,COMPLETE
1749,0.40696725249290466,2023-09-04 22:13:03.013009,2023-09-04 22:13:06.757137,0 days 00:00:03.744128,Sigmoid,Sigmoid,ReLU,ReLU,36,19,22.0,8.0,6.0,0.005944743673472492,4,175,0.43996250869971043,0.00014668675870221202,173.05164239572923,COMPLETE
1750,0.28177574276924133,2023-09-04 22:13:06.758176,2023-09-04 22:13:08.495877,0 days 00:00:01.737701,ReLU,Leaky,Leaky,,33,21,20.0,7.0,,0.0076864032045090925,3,233,0.6370055345797524,6.953839412827049e-05,4667.986710611979,COMPLETE
1751,0.3847709000110626,2023-09-04 22:13:08.496930,2023-09-04 22:13:09.776042,0 days 00:00:01.279112,ReLU,Tanh,Leaky,,53,22,18.0,10.0,,0.009931538926419044,3,215,0.2765734424352843,2.102177620021085e-05,175.71908807754517,COMPLETE
1752,0.412542462348938,2023-09-04 22:13:09.777104,2023-09-04 22:13:11.272886,0 days 00:00:01.495782,ReLU,Leaky,Tanh,,29,20,21.0,23.0,,0.0024850545618140445,3,196,0.189791510282216,0.021551076160278744,178.02966198022816,COMPLETE
1753,0.41958433389663696,2023-09-04 22:13:11.274013,2023-09-04 22:13:12.517433,0 days 00:00:01.243420,Sigmoid,Leaky,Leaky,,44,17,23.0,16.0,,0.012909850964924693,3,162,0.5838823045043126,4.343504662026649e-05,363.6919499150029,COMPLETE
1754,0.45310425758361816,2023-09-04 22:13:12.518564,2023-09-04 22:13:18.531366,0 days 00:00:06.012802,ReLU,Tanh,Sigmoid,Sigmoid,39,16,22.0,18.0,3.0,0.0018283836908139736,4,185,0.7721223286252793,8.511960836288689e-05,241.32196061329176,COMPLETE
1755,0.30148765444755554,2023-09-04 22:13:18.532412,2023-09-04 22:13:24.919424,0 days 00:00:06.387012,ReLU,Leaky,ReLU,,35,24,23.0,22.0,,0.0009450873735024286,3,223,0.7300964765528278,2.644263071232789e-05,130.3866729736328,COMPLETE
1756,0.30660873651504517,2023-09-04 22:13:24.920498,2023-09-04 22:13:26.542906,0 days 00:00:01.622408,Leaky,Leaky,Leaky,,41,19,20.0,8.0,,0.004524905907618778,3,141,0.7503705034524425,0.00023948913625564816,131.264408656529,COMPLETE
1757,0.3219689726829529,2023-09-04 22:13:26.543944,2023-09-04 22:13:28.465870,0 days 00:00:01.921926,ReLU,Leaky,Leaky,,79,18,19.0,14.0,,0.0030536997291640026,3,201,0.7725190840797961,0.0003173720118875813,722.6022632526901,COMPLETE
1758,1.040719747543335,2023-09-04 22:13:28.466910,2023-09-04 22:13:31.111592,0 days 00:00:02.644682,Sigmoid,Tanh,ReLU,,31,21,11.0,9.0,,1.5849558085017358e-05,3,181,0.15148799116095427,0.0014205948670060298,185.7836247228127,COMPLETE
