number,value,datetime_start,datetime_complete,duration,params_activation1,params_activation2,params_activation3,params_activation4,params_batch_size,params_fl1,params_fl2,params_fl3,params_fl4,params_learning_rate,params_n_layers,params_num_epochs,params_train_size,params_weight_decay,user_attrs_mre,state
1129,0.38393181562423706,2023-09-04 22:00:29.238388,2023-09-04 22:00:29.794903,0 days 00:00:00.556515,ReLU,Sigmoid,Leaky,,15,24,24.0,18.0,,0.006892347976901864,3,374,0.1396800176062058,0.000592833086399392,129.25334085736955,COMPLETE
1130,0.27677637338638306,2023-09-04 22:00:29.795701,2023-09-04 22:00:31.020201,0 days 00:00:01.224500,Tanh,Tanh,,,24,11,13.0,,,0.016005181304596085,2,405,0.6974877016635863,3.3935212165787834e-05,105.20071411132812,COMPLETE
1131,0.37209352850914,2023-09-04 22:00:31.022842,2023-09-04 22:00:31.704625,0 days 00:00:00.681783,Tanh,Leaky,Leaky,,19,12,18.0,22.0,,0.004207619645843752,3,359,0.23341731556590706,0.00012285926932435544,114.34328079223633,COMPLETE
1132,0.43868881464004517,2023-09-04 22:00:31.706998,2023-09-04 22:00:32.763836,0 days 00:00:01.056838,Tanh,Leaky,Leaky,,28,13,15.0,23.0,,0.038118860902161045,3,438,0.39731380225787055,0.022816091862405963,148.4389712524414,COMPLETE
1133,0.28784602880477905,2023-09-04 22:00:32.764738,2023-09-04 22:00:35.258619,0 days 00:00:02.493881,ReLU,Sigmoid,,,25,22,17.0,,,0.007965246721889686,2,339,0.6557600165682768,0.0002221034876608859,121.77619018554688,COMPLETE
1134,0.5340063571929932,2023-09-04 22:00:35.259763,2023-09-04 22:00:47.721387,0 days 00:00:12.461624,Tanh,Leaky,Leaky,,45,8,16.0,7.0,,1.4709853724476127e-05,3,386,0.7467669558711184,0.00090913969921082,112.58469473883278,COMPLETE
1135,0.35476911067962646,2023-09-04 22:00:47.722156,2023-09-04 22:00:50.506024,0 days 00:00:02.783868,Tanh,Leaky,Leaky,,22,11,18.0,8.0,,0.013250180351843877,3,291,0.7698146523069064,7.824877660695836e-05,103.68212396958295,COMPLETE
1136,0.4313570559024811,2023-09-04 22:00:50.506480,2023-09-04 22:00:50.854697,0 days 00:00:00.348217,Sigmoid,Sigmoid,,,17,10,19.0,,,0.0228604867507834,2,397,0.14905964211660874,0.001352327357254766,234.05161799940953,COMPLETE
1137,0.3466179072856903,2023-09-04 22:00:50.855257,2023-09-04 22:00:51.751998,0 days 00:00:00.896741,Tanh,Leaky,Leaky,,26,12,14.0,15.0,,0.011252323442650357,3,460,0.5281151051850571,0.0004698404385260852,120.90746871284817,COMPLETE
1138,0.38158002495765686,2023-09-04 22:00:51.752455,2023-09-04 22:01:02.459343,0 days 00:00:10.706888,ReLU,Leaky,Leaky,,23,11,12.0,14.0,,2.1142931191352412e-05,3,355,0.7257914660409376,0.0001733651267253334,131.87378353065168,COMPLETE
1139,0.33309468626976013,2023-09-04 22:01:02.459885,2023-09-04 22:01:04.217049,0 days 00:00:01.757164,Tanh,Leaky,,,29,21,17.0,,,0.0011853373283617164,2,373,0.5682616651611677,0.0002492328403666324,104.65583249901523,COMPLETE
1140,0.3877953290939331,2023-09-04 22:01:04.217489,2023-09-04 22:01:04.983956,0 days 00:00:00.766467,Tanh,Sigmoid,Tanh,,20,13,16.0,24.0,,0.0019412992263822305,3,346,0.2895721118564806,6.286254014443768e-05,125.9136997691372,COMPLETE
1141,0.27869558334350586,2023-09-04 22:01:04.984391,2023-09-04 22:01:05.749079,0 days 00:00:00.764688,ReLU,Leaky,,,27,11,15.0,,,0.01757941731972488,2,364,0.6898910134228563,0.0036819170737262025,98.11187470264925,COMPLETE
1142,0.32620832324028015,2023-09-04 22:01:05.749500,2023-09-04 22:01:06.805641,0 days 00:00:01.056141,Tanh,Leaky,Leaky,,58,12,16.0,24.0,,0.0008728568065971258,3,408,0.3796149907653325,0.0003517995412670135,651.5554011170293,COMPLETE
1143,0.4011351466178894,2023-09-04 22:01:06.806082,2023-09-04 22:01:07.077615,0 days 00:00:00.271533,Tanh,Sigmoid,Leaky,,32,10,17.0,13.0,,0.031601097975739345,3,319,0.17989598782552427,5.125324018022517e-05,263.0019503506747,COMPLETE
1144,0.3715992569923401,2023-09-04 22:01:07.078057,2023-09-04 22:01:07.298391,0 days 00:00:00.220334,Tanh,Leaky,,,24,11,15.0,,,0.009113432316594724,2,383,0.19972276596626942,0.003196863858249644,130.25255684230638,COMPLETE
1145,0.4044736325740814,2023-09-04 22:01:07.298819,2023-09-04 22:01:18.543305,0 days 00:00:11.244486,ReLU,Leaky,Leaky,,22,4,18.0,5.0,,7.281976797682612e-05,3,399,0.7717070981520908,1.8013329227425797e-05,101.38766133396847,COMPLETE
1146,0.45489367842674255,2023-09-04 22:01:18.543737,2023-09-04 22:01:19.105945,0 days 00:00:00.562208,Tanh,Sigmoid,Leaky,,18,11,10.0,6.0,,0.0029542870371867085,3,198,0.7274344447149887,0.03884439175270679,130.27828063964844,COMPLETE
1147,0.37798842787742615,2023-09-04 22:01:19.106411,2023-09-04 22:01:26.487660,0 days 00:00:07.381249,Tanh,Leaky,,,12,12,14.0,,,0.00015852909119393147,2,425,0.47052350095673323,0.00964097045531671,109.31482924164318,COMPLETE
1148,0.3095097243785858,2023-09-04 22:01:26.488100,2023-09-04 22:01:27.845536,0 days 00:00:01.357436,Tanh,ReLU,Sigmoid,,15,3,13.0,22.0,,0.014035735528802268,3,334,0.7995391811329071,0.00011376621802840902,146.44012260437012,COMPLETE
1149,0.377868115901947,2023-09-04 22:01:27.845976,2023-09-04 22:01:28.692034,0 days 00:00:00.846058,ReLU,Leaky,,,30,12,16.0,,,0.0006545668372019355,2,389,0.2512269181803223,2.4257867819879466e-05,288.3948460240518,COMPLETE
1150,0.486037015914917,2023-09-04 22:01:28.692469,2023-09-04 22:01:29.864337,0 days 00:00:01.171868,Tanh,Leaky,Leaky,,26,10,17.0,11.0,,0.0004527541427118046,3,432,0.669610099897074,0.07528741992693876,120.35099598005706,COMPLETE
1151,0.40106460452079773,2023-09-04 22:01:29.864779,2023-09-04 22:01:30.167061,0 days 00:00:00.302282,Tanh,Sigmoid,Leaky,,21,9,15.0,7.0,,0.07586040750934499,3,415,0.21983761670192725,0.000756732101418585,154.38397630055746,COMPLETE
1152,0.41098257899284363,2023-09-04 22:01:30.167507,2023-09-04 22:01:39.100973,0 days 00:00:08.933466,Leaky,Leaky,,,19,11,18.0,,,1.076701405717365e-05,2,348,0.7525649457480216,0.002406396999592719,101.205282342845,COMPLETE
1153,0.34705114364624023,2023-09-04 22:01:39.101425,2023-09-04 22:01:40.105067,0 days 00:00:01.003642,Tanh,Leaky,Tanh,,28,13,17.0,21.0,,0.005964691571712032,3,368,0.6361967776020679,0.00014561244212610717,121.85796038309734,COMPLETE
1154,0.6450366973876953,2023-09-04 22:01:40.105534,2023-09-04 22:01:42.117879,0 days 00:00:02.012345,ReLU,Sigmoid,Leaky,,25,12,16.0,23.0,,3.9946349273002596e-05,3,448,0.10925142660087209,0.005220523130982844,298.55240392684937,COMPLETE
1155,0.3773549795150757,2023-09-04 22:01:42.118320,2023-09-04 22:01:43.078985,0 days 00:00:00.960665,Tanh,Tanh,,,24,14,15.0,,,0.003762661136454212,2,272,0.3047180406687761,0.00018274765056668408,106.3695671231139,COMPLETE
1156,0.32701241970062256,2023-09-04 22:01:43.079402,2023-09-04 22:01:45.012137,0 days 00:00:01.932735,Tanh,Leaky,Leaky,,21,11,16.0,15.0,,0.0010019120059564617,3,377,0.7082014208749554,4.0222757475735716e-05,92.02430844988142,COMPLETE
1157,0.3106909692287445,2023-09-04 22:01:45.012569,2023-09-04 22:01:45.707822,0 days 00:00:00.695253,Tanh,Leaky,Leaky,,31,10,19.0,4.0,,0.021206045678720656,3,356,0.7396928175942284,0.00028734057900616725,79.95777105516002,COMPLETE
1158,0.4195099174976349,2023-09-04 22:01:45.708282,2023-09-04 22:01:46.502810,0 days 00:00:00.794528,ReLU,Sigmoid,,,17,23,14.0,,,0.00026208034534908953,2,339,0.12499681358197225,0.0006226970435409347,177.85083665518925,COMPLETE
1159,0.36029893159866333,2023-09-04 22:01:46.503253,2023-09-04 22:01:46.858294,0 days 00:00:00.355041,Tanh,Leaky,Leaky,,23,12,17.0,10.0,,0.005103950658780166,3,361,0.2799485921779615,8.916187591682777e-05,394.771965613732,COMPLETE
1160,0.39972198009490967,2023-09-04 22:01:46.858738,2023-09-04 22:01:47.146069,0 days 00:00:00.287331,Tanh,Leaky,,,27,11,12.0,,,0.011160803712280624,2,393,0.21263599235683706,3.22740163205696e-05,341.29041544596356,COMPLETE
1161,0.32456523180007935,2023-09-04 22:01:47.146491,2023-09-04 22:01:50.463234,0 days 00:00:03.316743,Sigmoid,Leaky,Leaky,Leaky,34,9,18.0,13.0,9.0,0.0016707209119282286,4,405,0.6170893647950049,0.00022585733270865833,115.6728851149754,COMPLETE
1162,0.3940620422363281,2023-09-04 22:01:50.463765,2023-09-04 22:01:50.767215,0 days 00:00:00.303450,ReLU,Sigmoid,Leaky,,14,12,15.0,23.0,,0.007380460168512145,3,370,0.12601539950569807,0.00040678013791496344,199.23417609078544,COMPLETE
1163,0.3284498155117035,2023-09-04 22:01:50.767667,2023-09-04 22:01:56.690629,0 days 00:00:05.922962,Tanh,Leaky,Leaky,,29,22,17.0,14.0,,6.203240575343854e-05,3,262,0.7726074664261058,6.364399706835068e-05,122.5815063068885,COMPLETE
1164,0.34358564019203186,2023-09-04 22:01:56.691071,2023-09-04 22:01:57.921077,0 days 00:00:01.230006,Tanh,Leaky,,,19,13,15.0,,,0.015943683317953303,2,327,0.6922782703958222,0.0005187652417851416,103.67247803357182,COMPLETE
1165,0.43352648615837097,2023-09-04 22:01:57.921556,2023-09-04 22:01:58.136660,0 days 00:00:00.215104,Tanh,Sigmoid,Tanh,,26,11,16.0,17.0,,0.009831867339142568,3,381,0.10503731536445844,0.00010480256745230653,9611.396086662045,COMPLETE
1166,0.37310874462127686,2023-09-04 22:01:58.137114,2023-09-04 22:01:58.698139,0 days 00:00:00.561025,ReLU,Leaky,Leaky,,21,10,16.0,22.0,,0.05369382623779649,3,347,0.7269543900349597,0.0010799030052215037,117.08630999396829,COMPLETE
1167,0.4240204095840454,2023-09-04 22:01:58.698736,2023-09-04 22:01:58.890616,0 days 00:00:00.191880,Tanh,Leaky,,,43,12,13.0,,,0.01368506059110078,2,414,0.15530384812834244,0.00014051977291142855,115.04935222201877,COMPLETE
1168,0.36946767568588257,2023-09-04 22:01:58.891051,2023-09-04 22:01:59.219260,0 days 00:00:00.328209,Tanh,Sigmoid,Leaky,,60,11,14.0,8.0,,0.06402359412722876,3,313,0.7725609308369039,0.0015417337336913776,109.65641276041667,COMPLETE
1169,0.317399263381958,2023-09-04 22:01:59.219725,2023-09-04 22:02:00.847483,0 days 00:00:01.627758,Tanh,Leaky,,,24,13,19.0,,,0.0012022886231549245,2,426,0.495651011141556,1.325149254015504e-05,175.89628996415573,COMPLETE
1170,0.3189137876033783,2023-09-04 22:02:00.847915,2023-09-04 22:02:04.466457,0 days 00:00:03.618542,ReLU,Leaky,Leaky,,16,21,18.0,24.0,,0.0003819039056397364,3,358,0.7482004100519642,4.978721647948462e-05,104.6241771813595,COMPLETE
1171,0.35828375816345215,2023-09-04 22:02:04.466896,2023-09-04 22:02:10.774584,0 days 00:00:06.307688,Tanh,Leaky,Sigmoid,,32,10,17.0,12.0,,0.00011502246295355524,3,398,0.5805298773583782,2.7030612572845436e-05,113.43475801860866,COMPLETE
1172,0.34286990761756897,2023-09-04 22:02:10.775083,2023-09-04 22:02:11.381110,0 days 00:00:00.606027,Leaky,ReLU,Leaky,,22,8,11.0,5.0,,0.026040649334168352,3,440,0.4295065969816661,0.00019372073271289243,149.34948992729187,COMPLETE
1173,0.35819029808044434,2023-09-04 22:02:11.381555,2023-09-04 22:02:13.452175,0 days 00:00:02.070620,Tanh,Sigmoid,,,25,12,16.0,,,0.0024419881456071747,2,352,0.6642767495592484,7.689684967878285e-05,106.47224811304396,COMPLETE
1174,0.3991922438144684,2023-09-04 22:02:13.452629,2023-09-04 22:02:14.070504,0 days 00:00:00.617875,Tanh,Leaky,Leaky,,29,24,14.0,9.0,,0.019087332579460797,3,386,0.7005469277863823,0.011982383025276449,123.64423282329852,COMPLETE
1175,0.34126994013786316,2023-09-04 22:02:14.070992,2023-09-04 22:02:14.977168,0 days 00:00:00.906176,ReLU,Leaky,Leaky,,19,11,15.0,14.0,,0.011437547743592917,3,341,0.7969970846743712,0.00025216614215074285,103.82940490722656,COMPLETE
1176,0.31986820697784424,2023-09-04 22:02:14.977679,2023-09-04 22:02:20.501624,0 days 00:00:05.523945,Tanh,,,,27,12,,,,0.00022217281501349636,1,368,0.7216413612496585,0.0001215878896891868,100.46457933342975,COMPLETE
1177,0.33847281336784363,2023-09-04 22:02:20.502250,2023-09-04 22:02:21.294979,0 days 00:00:00.792729,Tanh,Sigmoid,,,23,10,17.0,,,0.008799115579713596,2,374,0.7556270003760938,0.0008418679309071807,101.94122077678811,COMPLETE
1178,0.3885420858860016,2023-09-04 22:02:21.295443,2023-09-04 22:02:23.999215,0 days 00:00:02.703772,Tanh,Leaky,Leaky,,17,9,16.0,13.0,,0.0005192646449901919,3,411,0.7716672948232538,1.026439068659107e-05,110.57737935384115,COMPLETE
1179,0.3329786956310272,2023-09-04 22:02:23.999699,2023-09-04 22:02:25.623289,0 days 00:00:01.623590,ReLU,Leaky,,,21,20,15.0,,,0.0008121997135578033,2,332,0.7991436877345898,0.027374806677260412,101.77597758809074,COMPLETE
1180,0.3764939308166504,2023-09-04 22:02:25.623791,2023-09-04 22:02:29.812524,0 days 00:00:04.188733,Tanh,Tanh,Tanh,,25,11,18.0,7.0,,0.0006698439586318042,3,360,0.645738862380755,4.091750016463869e-05,115.73735713327167,COMPLETE
1181,0.39442571997642517,2023-09-04 22:02:29.812986,2023-09-04 22:02:30.202495,0 days 00:00:00.389509,Tanh,Sigmoid,Leaky,,31,12,17.0,12.0,,0.03746975293414998,3,392,0.20232465483293105,0.0020029048122880222,124.96026724957406,COMPLETE
1182,0.35239872336387634,2023-09-04 22:02:30.202956,2023-09-04 22:02:31.313484,0 days 00:00:01.110528,ReLU,Leaky,,,28,11,16.0,,,0.0014261777820752804,2,421,0.6871614132317201,0.002692162968201859,108.82754429051134,COMPLETE
1183,0.389394611120224,2023-09-04 22:02:31.313952,2023-09-04 22:02:31.607802,0 days 00:00:00.293850,Tanh,Leaky,Leaky,,20,11,15.0,24.0,,0.0064503584771664416,3,282,0.17318969040742843,0.00016332057566971153,240.0032342981409,COMPLETE
1184,0.3190169632434845,2023-09-04 22:02:31.608423,2023-09-04 22:02:32.636060,0 days 00:00:01.027637,Tanh,Leaky,Leaky,,23,13,19.0,23.0,,0.01341187741852321,3,381,0.7301180682552187,0.0002839621084683055,95.47018323625836,COMPLETE
1185,0.3296910524368286,2023-09-04 22:02:32.636764,2023-09-04 22:02:34.284311,0 days 00:00:01.647547,Sigmoid,Sigmoid,,,26,22,17.0,,,0.004981864984471491,2,436,0.7495726068797761,0.0003449963643383302,103.8932071685791,COMPLETE
1186,0.34053751826286316,2023-09-04 22:02:34.284751,2023-09-04 22:02:35.766292,0 days 00:00:01.481541,Tanh,Leaky,Leaky,,15,12,18.0,15.0,,0.015985661238294775,3,349,0.799452573574642,2.1887942585792044e-05,76.10635465734146,COMPLETE
1187,0.39531806111335754,2023-09-04 22:02:35.766771,2023-09-04 22:02:36.172836,0 days 00:00:00.406065,ReLU,Leaky,,,36,10,3.0,,,0.003163237650430134,2,405,0.25796351783831195,9.522844878435347e-05,162.3746181488037,COMPLETE
1188,0.35297486186027527,2023-09-04 22:02:36.173289,2023-09-04 22:02:43.277786,0 days 00:00:07.104497,Tanh,Sigmoid,Leaky,,12,23,14.0,6.0,,0.0003032787522748627,3,303,0.3650097261670322,1.655843576770737e-05,114.47114432054778,COMPLETE
1189,0.2882353365421295,2023-09-04 22:02:43.278256,2023-09-04 22:02:44.101864,0 days 00:00:00.823608,Tanh,Leaky,Leaky,,19,12,16.0,16.0,,0.02160299066129416,3,367,0.44410733006165426,0.00019361998422420576,95.73701972961426,COMPLETE
1190,0.3910854458808899,2023-09-04 22:02:44.102316,2023-09-04 22:02:44.610318,0 days 00:00:00.508002,Tanh,Leaky,,,33,11,17.0,,,0.031088491568490577,2,351,0.4083908460137998,0.022416974843027543,117.09754862683884,COMPLETE
1191,1.0433125495910645,2023-09-04 22:02:44.610785,2023-09-04 22:02:44.839554,0 days 00:00:00.228769,ReLU,Sigmoid,Leaky,,30,12,12.0,8.0,,0.010318884788137039,3,252,0.3909129707462486,0.03227516254667811,99.96627252752131,COMPLETE
1192,0.3202238082885742,2023-09-04 22:02:44.840035,2023-09-04 22:02:45.442523,0 days 00:00:00.602488,Tanh,Leaky,Tanh,,53,11,16.0,22.0,,0.012220837937720061,3,323,0.7150484191175495,6.808528057788938e-05,105.89070727374103,COMPLETE
1193,0.3216189742088318,2023-09-04 22:02:45.442986,2023-09-04 22:02:46.793397,0 days 00:00:01.350411,Tanh,Leaky,,,23,13,15.0,,,0.001966422536130463,2,341,0.6149204523017586,3.3246774939655184e-05,100.82509351457868,COMPLETE
1194,0.30500850081443787,2023-09-04 22:02:46.793842,2023-09-04 22:02:47.407802,0 days 00:00:00.613960,Tanh,Leaky,Leaky,,56,10,14.0,7.0,,0.007991670879318569,3,401,0.6746118003238316,0.0004743773983195027,99.72931497747248,COMPLETE
1195,0.3048734962940216,2023-09-04 22:02:47.408254,2023-09-04 22:02:52.763178,0 days 00:00:05.354924,ReLU,Sigmoid,Sigmoid,,18,11,16.0,13.0,,0.0010124965874434328,3,375,0.7505482676630718,0.0006410387115888124,110.76790201562082,COMPLETE
1196,0.4883163273334503,2023-09-04 22:02:52.763868,2023-09-04 22:02:55.797747,0 days 00:00:03.033879,Tanh,ReLU,,,28,12,17.0,,,8.513588316417271e-05,2,431,0.11665643042032742,0.00013819368905412726,116.64697088608885,COMPLETE
1197,0.3861022889614105,2023-09-04 22:02:55.798564,2023-09-04 22:02:57.626973,0 days 00:00:01.828409,Leaky,Leaky,Leaky,,25,11,18.0,10.0,,0.018080680110269254,3,362,0.7128557699990857,0.0510480091361753,197.77896990094865,COMPLETE
1198,0.34044724702835083,2023-09-04 22:02:57.627821,2023-09-04 22:03:12.379262,0 days 00:00:14.751441,Tanh,Leaky,,,21,10,15.0,,,0.00014800363852560821,2,384,0.457223181617558,4.734645084379892e-05,107.94101738929749,COMPLETE
1199,0.42393264174461365,2023-09-04 22:03:12.380193,2023-09-04 22:03:32.516919,0 days 00:00:20.136726,ReLU,Sigmoid,Leaky,,27,9,16.0,24.0,,4.283330075768859e-05,3,450,0.7672282150102836,0.020665191518352652,107.11384889390733,COMPLETE
1200,0.3013622462749481,2023-09-04 22:03:32.518557,2023-09-04 22:03:34.701956,0 days 00:00:02.183399,Tanh,Leaky,Leaky,,24,12,17.0,9.0,,0.02581321321584661,3,418,0.6533907103250358,0.0011546900026879955,176.93438357398622,COMPLETE
1201,0.3471622169017792,2023-09-04 22:03:34.703084,2023-09-04 22:03:36.765200,0 days 00:00:02.062116,Tanh,Leaky,,,22,13,13.0,,,0.014693680545654066,2,397,0.7386007032694366,0.003238514633243687,92.15372297498915,COMPLETE
1202,0.3211882412433624,2023-09-04 22:03:36.766246,2023-09-04 22:03:41.165396,0 days 00:00:04.399150,Tanh,Sigmoid,Leaky,,18,11,15.0,19.0,,0.00423114945271972,3,72,0.5088923839659093,0.00022623036329899715,99.39574358198378,COMPLETE
1203,0.3324681222438812,2023-09-04 22:03:41.166832,2023-09-04 22:03:42.244425,0 days 00:00:01.077593,ReLU,Leaky,,,26,10,18.0,,,0.009423102512147348,2,338,0.33191398065351785,8.125098137202859e-05,132.97814846038818,COMPLETE
1204,0.2866637110710144,2023-09-04 22:03:42.248804,2023-09-04 22:03:53.874284,0 days 00:00:11.625480,Tanh,Leaky,Leaky,,20,9,12.0,14.0,,0.0006165016011034746,3,357,0.772224105205254,5.9986444251887764e-05,101.06378115140475,COMPLETE
1205,0.38944998383522034,2023-09-04 22:03:53.875072,2023-09-04 22:04:09.808645,0 days 00:00:15.933573,Tanh,Tanh,Leaky,,29,12,17.0,11.0,,5.9375875752606446e-05,3,391,0.5514548066562025,0.00721282571954785,119.1686762153645,COMPLETE
1206,0.3073222041130066,2023-09-04 22:04:09.810236,2023-09-04 22:04:13.622100,0 days 00:00:03.811864,Tanh,Leaky,Tanh,,14,24,15.0,23.0,,0.0013368445439149643,3,379,0.6874853723268262,0.00015959110557759644,134.59379689286393,COMPLETE
1207,0.3770858347415924,2023-09-04 22:04:13.623106,2023-09-04 22:04:14.609127,0 days 00:00:00.986021,ReLU,Sigmoid,,,16,14,16.0,,,0.0024902243126689707,2,367,0.14257965385748367,0.004486187602783272,362.9212101697922,COMPLETE
1208,0.4772552251815796,2023-09-04 22:04:14.612523,2023-09-04 22:04:18.366310,0 days 00:00:03.753787,Tanh,Leaky,Leaky,,24,21,19.0,2.0,,0.00019128881427439616,3,353,0.10583542234981011,0.00010925572571598177,126.98221694038543,COMPLETE
1209,0.4587559401988983,2023-09-04 22:04:18.372723,2023-09-04 22:04:23.592426,0 days 00:00:05.219703,Tanh,Leaky,,,31,11,18.0,,,3.165378811003437e-05,2,330,0.2375920709784647,0.00039738273513539423,105.56722134676846,COMPLETE
1210,0.3508567214012146,2023-09-04 22:04:23.593184,2023-09-04 22:04:29.779460,0 days 00:00:06.186276,Sigmoid,Sigmoid,Leaky,,22,12,14.0,5.0,,0.006775474203126503,3,429,0.7990049816769687,2.8781767781946108e-05,103.26874492694805,COMPLETE
1211,0.35991010069847107,2023-09-04 22:04:29.780140,2023-09-04 22:04:30.235378,0 days 00:00:00.455238,Tanh,Leaky,Leaky,,39,18,16.0,4.0,,0.043161273481698584,3,407,0.3533264129405029,0.0003238672624435546,111.20252075195313,COMPLETE
1212,0.30253076553344727,2023-09-04 22:04:30.236037,2023-09-04 22:04:31.099973,0 days 00:00:00.863936,ReLU,Leaky,,,27,11,17.0,,,0.011352073937626989,2,441,0.7107949316014139,0.00026290050223330827,105.17312837258363,COMPLETE
1213,0.33310794830322266,2023-09-04 22:04:31.100455,2023-09-04 22:04:38.857609,0 days 00:00:07.757154,Tanh,Sigmoid,Leaky,,33,13,13.0,15.0,,0.0003794543472351148,3,342,0.7477473598075985,3.568407394002638e-05,97.98006496690724,COMPLETE
1214,0.37507128715515137,2023-09-04 22:04:38.858610,2023-09-04 22:04:41.375337,0 days 00:00:02.516727,Tanh,Leaky,Leaky,,20,7,15.0,3.0,,0.0007426905016785883,3,239,0.3184595228279119,0.012115153381304956,114.60122975131921,COMPLETE
1215,0.4335157573223114,2023-09-04 22:04:41.375946,2023-09-04 22:04:41.800289,0 days 00:00:00.424343,Tanh,Leaky,,,62,10,16.0,,,0.0035778070072679615,2,413,0.7728390106294791,0.07250110060423537,114.20485376428675,COMPLETE
1216,0.6540259122848511,2023-09-04 22:04:41.800804,2023-09-04 22:04:45.383531,0 days 00:00:03.582727,ReLU,Leaky,Leaky,,25,11,19.0,22.0,,1.6614455391148883e-05,3,267,0.33437066108721564,1.9425213671906443e-05,104.55510143037147,COMPLETE
1217,0.4862605333328247,2023-09-04 22:04:45.384003,2023-09-04 22:04:45.773572,0 days 00:00:00.389569,Tanh,Sigmoid,Tanh,,29,22,15.0,14.0,,0.001164920366671325,3,362,0.1905043303424577,0.08895578296863288,182.90318419716576,COMPLETE
1218,0.35006415843963623,2023-09-04 22:04:45.774076,2023-09-04 22:04:46.176755,0 days 00:00:00.402679,Tanh,Leaky,,,22,12,17.0,,,0.017704060889422633,2,348,0.27006713664759835,0.00019946266953434525,141.4913249160304,COMPLETE
1219,0.5229393243789673,2023-09-04 22:04:46.177419,2023-09-04 22:04:46.849537,0 days 00:00:00.672118,Leaky,Leaky,Sigmoid,,17,2,18.0,8.0,,0.0009383331797401214,3,373,0.11304431249590303,0.0005242637205375396,149.56694793701172,COMPLETE
1220,0.31121841073036194,2023-09-04 22:04:46.850153,2023-09-04 22:04:47.721013,0 days 00:00:00.870860,ReLU,ReLU,,,24,11,23.0,,,0.01376226822891002,2,397,0.7174403620340892,0.0022135144669528277,156.72307979699337,COMPLETE
1221,0.46596431732177734,2023-09-04 22:04:47.721555,2023-09-04 22:04:48.979512,0 days 00:00:01.257957,Tanh,Sigmoid,Leaky,,28,23,14.0,13.0,,0.0016219344119028922,3,389,0.295882430293749,0.0218843786740598,111.48482289445509,COMPLETE
1222,0.4204283058643341,2023-09-04 22:04:48.979976,2023-09-04 22:04:49.258790,0 days 00:00:00.278814,Tanh,Leaky,Leaky,,26,8,16.0,24.0,,0.008103438072236315,3,370,0.11861302827004498,0.0038278055177367945,141.3268754288957,COMPLETE
