number,value,datetime_start,datetime_complete,duration,params_activation1,params_activation2,params_activation3,params_activation4,params_batch_size,params_fl1,params_fl2,params_fl3,params_fl4,params_learning_rate,params_n_layers,params_num_epochs,params_train_size,params_weight_decay,user_attrs_mre,state
859,0.3878432512283325,2023-09-04 21:34:40.348090,2023-09-04 21:34:40.578546,0 days 00:00:00.230456,Tanh,Sigmoid,,,80,23,23.0,,,0.06262067963983982,2,122,0.36299546680114725,0.0004415807343331715,206.6536845157021,COMPLETE
860,0.6954604983329773,2023-09-04 21:34:40.578984,2023-09-04 21:34:41.199173,0 days 00:00:00.620189,Tanh,Tanh,,,76,11,22.0,,,6.579521142709685e-05,2,103,0.4330738404932921,0.0009355715206116726,168.78346296884482,COMPLETE
861,0.4803580343723297,2023-09-04 21:34:41.199555,2023-09-04 21:34:41.333111,0 days 00:00:00.133556,ReLU,Sigmoid,,,86,22,24.0,,,0.027698390671741378,2,349,0.1268030567131349,0.0038426043935604897,227.9041748046875,COMPLETE
862,1.0949978828430176,2023-09-04 21:34:41.333501,2023-09-04 21:34:41.442599,0 days 00:00:00.109098,Sigmoid,ReLU,Sigmoid,Sigmoid,93,24,23.0,8.0,17.0,0.0013364103215927877,4,150,0.10105812318853809,5.9207761886977136e-05,118.93408966064453,COMPLETE
863,0.42730915546417236,2023-09-04 21:34:41.443007,2023-09-04 21:34:43.567324,0 days 00:00:02.124317,Tanh,Tanh,,,48,21,18.0,,,0.00032004021212600324,2,174,0.7446479467725098,8.777644292767237e-05,181.8323657594878,COMPLETE
864,0.5481716394424438,2023-09-04 21:34:43.567713,2023-09-04 21:34:43.999553,0 days 00:00:00.431840,Tanh,Sigmoid,,,63,23,21.0,,,0.014044031158862992,2,163,0.6732826729990139,0.009931249183525892,219.64580535888672,COMPLETE
865,0.3212783634662628,2023-09-04 21:34:43.999981,2023-09-04 21:34:44.401473,0 days 00:00:00.401492,Leaky,ReLU,,,97,24,19.0,,,0.019504978520039424,2,296,0.7998618524752793,0.0002765051761960026,118.18280233987947,COMPLETE
866,0.8905467391014099,2023-09-04 21:34:44.401862,2023-09-04 21:34:45.788829,0 days 00:00:01.386967,Leaky,Sigmoid,,,71,22,22.0,,,3.589853560494741e-05,2,445,0.2109472554263654,0.00021901107642836355,136.45287262991573,COMPLETE
867,0.6431050896644592,2023-09-04 21:34:45.789202,2023-09-04 21:34:46.451625,0 days 00:00:00.662423,Leaky,Tanh,,,83,23,23.0,,,5.455315901771668e-05,2,136,0.35877590886484756,2.3995187805031024e-05,122.31154329636517,COMPLETE
868,0.3915156126022339,2023-09-04 21:34:46.452004,2023-09-04 21:34:46.621989,0 days 00:00:00.169985,Leaky,ReLU,,,94,24,18.0,,,0.03137280168630956,2,129,0.32075694244907454,0.0005952087846657362,169.7085908034752,COMPLETE
869,0.6243269443511963,2023-09-04 21:34:46.622373,2023-09-04 21:34:49.104016,0 days 00:00:02.481643,Tanh,Sigmoid,,,58,3,19.0,,,0.0006939209934839479,2,153,0.7081960892956839,0.00014366470572823992,181.37015378864763,COMPLETE
870,0.3517090976238251,2023-09-04 21:34:49.104709,2023-09-04 21:34:51.080124,0 days 00:00:01.975415,Leaky,Tanh,,,53,23,18.0,,,0.012732015977042668,2,383,0.6080091251482753,1.8521171027696184e-05,134.62447727748327,COMPLETE
871,0.42604005336761475,2023-09-04 21:34:51.080817,2023-09-04 21:34:52.681373,0 days 00:00:01.600556,Leaky,Sigmoid,ReLU,Sigmoid,67,5,21.0,18.0,21.0,0.009969964906240171,4,270,0.7677413837209737,0.0018923720266526614,177.65017631530762,COMPLETE
872,0.5963857173919678,2023-09-04 21:34:52.681784,2023-09-04 21:34:53.231982,0 days 00:00:00.550198,Leaky,ReLU,Tanh,,46,10,24.0,11.0,,0.002282400259050222,3,181,0.3316374736159841,0.04780585543957555,132.37785382337972,COMPLETE
873,0.3255971670150757,2023-09-04 21:34:53.232386,2023-09-04 21:34:54.293816,0 days 00:00:01.061430,Leaky,Tanh,,,73,21,19.0,,,0.005630436725763799,2,114,0.7998648831590265,7.281020875618203e-05,421.25172616903063,COMPLETE
874,0.3599961996078491,2023-09-04 21:34:54.294190,2023-09-04 21:34:54.751864,0 days 00:00:00.457674,Leaky,Sigmoid,,,44,24,5.0,,,0.05359378874360223,2,146,0.5624845007607723,0.000102017329927785,177.76318433808117,COMPLETE
875,0.37285545468330383,2023-09-04 21:34:54.752263,2023-09-04 21:34:55.248505,0 days 00:00:00.496242,Tanh,ReLU,,,92,22,20.0,,,0.01644275466725517,2,169,0.7408755255687695,3.352487870693908e-05,201.84738017894603,COMPLETE
876,0.4153480529785156,2023-09-04 21:34:55.248903,2023-09-04 21:34:55.676154,0 days 00:00:00.427251,Sigmoid,Tanh,,,98,23,17.0,,,0.012804905855780565,2,50,0.6852455464370968,0.00035194838270028665,181.43314666748046,COMPLETE
877,0.9904862642288208,2023-09-04 21:34:55.676519,2023-09-04 21:34:55.927655,0 days 00:00:00.251136,Leaky,Sigmoid,ReLU,Leaky,79,24,22.0,19.0,9.0,0.0019433301348482947,4,284,0.6488665914111891,0.012956318861445793,100.55747716567096,COMPLETE
878,0.35749539732933044,2023-09-04 21:34:55.928068,2023-09-04 21:34:56.875028,0 days 00:00:00.946960,ReLU,Tanh,,,90,22,20.0,,,0.004231284848860485,2,161,0.7226484531683344,0.0012121073843709897,124.14655826328037,COMPLETE
879,0.33349609375,2023-09-04 21:34:56.875425,2023-09-04 21:34:58.084869,0 days 00:00:01.209444,Leaky,ReLU,,,20,23,19.0,,,0.023537035086654647,2,189,0.7686624794832054,2.231121921630322e-05,304.9769141014586,COMPLETE
880,0.3185187876224518,2023-09-04 21:34:58.085250,2023-09-04 21:34:58.934248,0 days 00:00:00.848998,Leaky,Sigmoid,,,51,23,21.0,,,0.007244749683914655,2,405,0.7378076683533223,0.00017311980131413807,177.6525480850883,COMPLETE
881,0.38668176531791687,2023-09-04 21:34:58.934621,2023-09-04 21:34:59.347048,0 days 00:00:00.412427,Leaky,Leaky,,,85,24,18.0,,,0.010443130785891567,2,140,0.6818986952131056,0.007839890243815716,290.1337777842646,COMPLETE
882,0.6210656762123108,2023-09-04 21:34:59.347421,2023-09-04 21:35:00.337498,0 days 00:00:00.990077,Leaky,Sigmoid,,,42,22,18.0,,,0.00032007442994901915,2,421,0.11789871088796587,0.005554989183890262,197.29771673483927,COMPLETE
883,0.40753796696662903,2023-09-04 21:35:00.337897,2023-09-04 21:35:04.671034,0 days 00:00:04.333137,Tanh,Tanh,,,75,21,23.0,,,0.00022362574750582,2,336,0.7733022796260295,4.220733440370449e-05,201.35884925297327,COMPLETE
884,0.40409055352211,2023-09-04 21:35:04.671419,2023-09-04 21:35:06.151526,0 days 00:00:01.480107,Leaky,ReLU,,,25,24,17.0,,,0.0005828378884715133,2,76,0.7062281201067412,2.669280371598148e-05,159.3665606850072,COMPLETE
885,0.6702484488487244,2023-09-04 21:35:06.151919,2023-09-04 21:35:08.617173,0 days 00:00:02.465254,Leaky,Sigmoid,,,81,23,21.0,,,3.0275691076860106e-05,2,260,0.7996142411342633,1.5866238700158184e-05,151.72839710529033,COMPLETE
886,0.4065472483634949,2023-09-04 21:35:08.617553,2023-09-04 21:35:08.950264,0 days 00:00:00.332711,Leaky,Tanh,,,96,22,20.0,,,0.015512124732630656,2,456,0.25903671523108995,0.0007885843589274668,170.6269285413954,COMPLETE
887,0.322556734085083,2023-09-04 21:35:08.950630,2023-09-04 21:35:10.106964,0 days 00:00:01.156334,Leaky,ReLU,,,100,23,19.0,,,0.003257462736255916,2,394,0.7468806294700486,0.00038372237596922697,129.60542860098764,COMPLETE
888,0.5298399329185486,2023-09-04 21:35:10.107373,2023-09-04 21:35:12.060749,0 days 00:00:01.953376,Tanh,Sigmoid,Tanh,ReLU,46,21,18.0,12.0,10.0,0.0004131572648857887,4,153,0.5184589114827234,0.00020491276287179405,199.6876790165122,COMPLETE
889,0.5181548595428467,2023-09-04 21:35:12.061122,2023-09-04 21:35:12.291101,0 days 00:00:00.229979,Leaky,Tanh,,,61,24,22.0,,,0.005946519691671887,2,130,0.12110490679089542,0.00011976114340566139,271.56721525554417,COMPLETE
890,0.4901053309440613,2023-09-04 21:35:12.291477,2023-09-04 21:35:12.507898,0 days 00:00:00.216421,Leaky,ReLU,,,56,23,19.0,,,0.009542141812193466,2,304,0.10755753373841112,0.007130168476030725,155.90593124984147,COMPLETE
891,0.3693278729915619,2023-09-04 21:35:12.508274,2023-09-04 21:35:14.006235,0 days 00:00:01.497961,Leaky,Sigmoid,,,70,22,20.0,,,0.0016773691563928932,2,178,0.6391622249680604,1.9154162644697427e-05,222.63405994886762,COMPLETE
892,0.529087483882904,2023-09-04 21:35:14.006628,2023-09-04 21:35:16.257227,0 days 00:00:02.250599,Leaky,,,,65,24,,,,0.00012378817735366377,1,287,0.7135179450012983,3.0665929454614895e-05,158.6264650298328,COMPLETE
893,0.40126240253448486,2023-09-04 21:35:16.257610,2023-09-04 21:35:16.567457,0 days 00:00:00.309847,Tanh,Tanh,,,77,24,18.0,,,0.07649343986246807,2,163,0.7495105150181061,0.00026508568190615424,197.1634063720703,COMPLETE
894,0.5863660573959351,2023-09-04 21:35:16.567838,2023-09-04 21:35:25.284422,0 days 00:00:08.716584,Leaky,Sigmoid,Leaky,Sigmoid,43,23,17.0,20.0,15.0,0.00019276424157177997,4,375,0.6682849611147847,0.0026822263189547843,149.735624613444,COMPLETE
895,0.35049471259117126,2023-09-04 21:35:25.284822,2023-09-04 21:35:27.219247,0 days 00:00:01.934425,Leaky,ReLU,,,94,22,20.0,,,0.001425826249609961,2,472,0.7722538866551273,0.0005267956872730191,192.04475965711805,COMPLETE
896,0.30302250385284424,2023-09-04 21:35:27.219630,2023-09-04 21:35:27.877998,0 days 00:00:00.658368,Leaky,Tanh,,,74,23,21.0,,,0.012397002124235754,2,447,0.7023320078173253,6.442796625070377e-05,184.2494131059789,COMPLETE
897,0.4174031913280487,2023-09-04 21:35:27.878388,2023-09-04 21:35:28.346507,0 days 00:00:00.468119,Leaky,Sigmoid,,,72,24,19.0,,,0.007804700553298928,2,433,0.27015447551361566,1.361633745930069e-05,140.42667168511284,COMPLETE
898,0.46350938081741333,2023-09-04 21:35:28.346908,2023-09-04 21:35:28.760772,0 days 00:00:00.413864,Sigmoid,ReLU,,,87,23,24.0,,,0.019410513975662003,2,140,0.16279536797228908,0.00016918659389680488,300.81571230114014,COMPLETE
899,0.5857731103897095,2023-09-04 21:35:28.761267,2023-09-04 21:35:29.059394,0 days 00:00:00.298127,Leaky,Sigmoid,,,68,21,17.0,,,0.004776233277031995,2,172,0.24608300199516014,0.01658344648792207,132.7948243112275,COMPLETE
900,0.4261675477027893,2023-09-04 21:35:29.059949,2023-09-04 21:35:30.030894,0 days 00:00:00.970945,Tanh,Tanh,,,27,24,23.0,,,0.0009592240779966823,2,312,0.1927216646541702,4.7428673260266053e-05,149.622052675135,COMPLETE
901,0.38317975401878357,2023-09-04 21:35:30.031385,2023-09-04 21:35:30.418209,0 days 00:00:00.386824,Leaky,Sigmoid,Tanh,,98,22,19.0,4.0,,0.01564677381773011,3,152,0.5872383542093225,0.0010189943978250295,425.08473060244603,COMPLETE
902,0.36784428358078003,2023-09-04 21:35:30.418582,2023-09-04 21:35:33.074129,0 days 00:00:02.655547,ReLU,ReLU,,,42,23,18.0,,,0.0005992183485493219,2,111,0.7996021033583729,0.0001232303609152367,127.45289446856525,COMPLETE
903,0.6168212294578552,2023-09-04 21:35:33.074809,2023-09-04 21:35:33.769400,0 days 00:00:00.694591,Leaky,Tanh,,,91,21,13.0,,,0.010934550343127016,2,276,0.7509138675533618,0.06030352978111074,477.9132922363281,COMPLETE
904,0.47294336557388306,2023-09-04 21:35:33.770094,2023-09-04 21:35:34.967961,0 days 00:00:01.197867,Leaky,Sigmoid,,,89,20,3.0,,,0.008750405463799769,2,188,0.26828324885968025,1.0002705351193426e-05,681.8545568497454,COMPLETE
905,0.40150606632232666,2023-09-04 21:35:34.968663,2023-09-04 21:35:36.748223,0 days 00:00:01.779560,Leaky,ReLU,ReLU,Tanh,45,13,7.0,17.0,23.0,0.006221716636391321,4,130,0.5392226597021116,8.512771953664108e-05,174.66272575910702,COMPLETE
906,0.35803550481796265,2023-09-04 21:35:36.748938,2023-09-04 21:35:37.497257,0 days 00:00:00.748319,Tanh,Leaky,,,96,24,20.0,,,0.013270316530937899,2,385,0.7183642901496952,0.0006467757585560935,203.51314239501954,COMPLETE
907,0.36059102416038513,2023-09-04 21:35:37.497662,2023-09-04 21:35:38.063707,0 days 00:00:00.566045,Leaky,Tanh,,,30,22,19.0,,,0.03486303081561019,2,411,0.619173612246192,1.7109732162024674e-05,176.1481237972484,COMPLETE
908,0.3358462154865265,2023-09-04 21:35:38.064116,2023-09-04 21:35:38.619824,0 days 00:00:00.555708,Leaky,Sigmoid,,,40,23,22.0,,,0.024168185938420326,2,120,0.49142596034347513,2.2831151368700078e-05,127.77285693242,COMPLETE
909,0.3496611416339874,2023-09-04 21:35:38.620215,2023-09-04 21:35:39.346535,0 days 00:00:00.726320,Leaky,ReLU,,,83,8,20.0,,,0.018716461584633626,2,464,0.6691440140929655,0.000251465801284627,160.05241412208193,COMPLETE
910,0.6161573529243469,2023-09-04 21:35:39.346913,2023-09-04 21:35:39.615060,0 days 00:00:00.268147,Leaky,Tanh,,,48,22,21.0,,,0.007193013031534879,2,297,0.28295011253860536,0.0539028663580963,174.37481765747071,COMPLETE
911,0.9048907160758972,2023-09-04 21:35:39.615465,2023-09-04 21:35:43.377704,0 days 00:00:03.762239,Tanh,Sigmoid,,,76,24,17.0,,,1.5767213330013997e-05,2,361,0.7381750289836121,0.03314149215237859,121.47601455730745,COMPLETE
912,0.4620150327682495,2023-09-04 21:35:43.378095,2023-09-04 21:35:44.065885,0 days 00:00:00.687790,Leaky,Sigmoid,Sigmoid,Sigmoid,44,24,18.0,16.0,19.0,0.003965131618979317,4,146,0.15870090257423802,0.00014850166451034534,268.1827078518802,COMPLETE
913,0.5113993883132935,2023-09-04 21:35:44.066283,2023-09-04 21:35:44.884134,0 days 00:00:00.817851,Leaky,Tanh,,,100,23,19.0,,,0.0002852027200854737,2,156,0.4275708620814194,3.46990772643568e-05,150.84643290593073,COMPLETE
914,0.33142614364624023,2023-09-04 21:35:44.884522,2023-09-04 21:35:45.728728,0 days 00:00:00.844206,Leaky,ReLU,,,41,22,21.0,,,0.015095012348867443,2,85,0.7734599430984597,0.0001007519569380434,126.78432277463517,COMPLETE
915,0.46930715441703796,2023-09-04 21:35:45.729141,2023-09-04 21:35:46.179699,0 days 00:00:00.450558,Leaky,Sigmoid,,,95,21,20.0,,,0.002863537515833498,2,398,0.1534327955033091,1.4413674388735201e-05,179.1005771221892,COMPLETE
916,0.473044216632843,2023-09-04 21:35:46.180095,2023-09-04 21:35:46.415958,0 days 00:00:00.235863,Tanh,Tanh,Tanh,,79,23,18.0,14.0,,0.011234769215379881,3,136,0.1113981699125055,0.0013624166717954621,2151.5270657925994,COMPLETE
917,0.37801769375801086,2023-09-04 21:35:46.416348,2023-09-04 21:35:46.877084,0 days 00:00:00.460736,Leaky,ReLU,,,98,24,20.0,,,0.005555810336249319,2,164,0.42122394513821854,0.0008847598950486274,138.62002907729732,COMPLETE
918,0.36618664860725403,2023-09-04 21:35:46.877552,2023-09-04 21:35:47.980068,0 days 00:00:01.102516,Leaky,Sigmoid,,,23,23,24.0,,,0.009127703918629706,2,174,0.6937623355771,0.0003076222948670381,123.4683079439051,COMPLETE
919,0.6947753429412842,2023-09-04 21:35:47.980475,2023-09-04 21:35:49.104940,0 days 00:00:01.124465,Leaky,Tanh,,,64,22,22.0,,,3.1107767643270156e-05,2,196,0.3726432337013062,0.0004323091455007319,154.69120239724919,COMPLETE
920,0.3329675495624542,2023-09-04 21:35:49.105391,2023-09-04 21:35:49.679367,0 days 00:00:00.573976,Leaky,ReLU,,,39,24,23.0,,,0.020292389239266174,2,482,0.7294526817265924,2.012139678291907e-05,193.39399140456626,COMPLETE
921,0.33992230892181396,2023-09-04 21:35:49.680060,2023-09-04 21:35:51.345771,0 days 00:00:01.665711,Tanh,Sigmoid,ReLU,Sigmoid,93,23,19.0,19.0,12.0,0.01300623266139188,4,425,0.7719255088052787,1.3055722271565696e-05,313.72030178705853,COMPLETE
922,0.32820460200309753,2023-09-04 21:35:51.346177,2023-09-04 21:35:52.087643,0 days 00:00:00.741466,Leaky,Tanh,,,54,20,18.0,,,0.007927565059414598,2,290,0.6591182019988077,5.276961035236788e-05,140.17774521095166,COMPLETE
923,0.5238933563232422,2023-09-04 21:35:52.088042,2023-09-04 21:35:53.321297,0 days 00:00:01.233255,Sigmoid,Sigmoid,,,78,24,19.0,,,0.0011526441865386677,2,141,0.6994311262466245,0.00019237640359197567,231.3712962265556,COMPLETE
924,0.3453182578086853,2023-09-04 21:35:53.321686,2023-09-04 21:35:54.311041,0 days 00:00:00.989355,Leaky,ReLU,,,72,21,17.0,,,0.004927007515443057,2,179,0.7453633185329025,2.8048359189996058e-05,123.8905403137207,COMPLETE
925,0.4453894793987274,2023-09-04 21:35:54.311445,2023-09-04 21:35:54.553166,0 days 00:00:00.241721,Leaky,Tanh,,,86,22,21.0,,,0.01660765348162007,2,124,0.3980894403736328,0.005546926658241847,159.50690375434027,COMPLETE
926,0.4245315194129944,2023-09-04 21:35:54.553559,2023-09-04 21:35:54.883979,0 days 00:00:00.330420,Leaky,Sigmoid,,,42,24,19.0,,,0.01030541912540564,2,149,0.22744940436930397,3.999166404978165e-05,180.92183990478514,COMPLETE
927,0.2960525453090668,2023-09-04 21:35:54.884378,2023-09-04 21:35:55.455055,0 days 00:00:00.570677,ReLU,ReLU,,,75,23,20.0,,,0.0270579140856131,2,440,0.798403987550701,0.00013661984919360773,692.9124350914589,COMPLETE
928,0.3380627930164337,2023-09-04 21:35:55.455439,2023-09-04 21:35:55.993277,0 days 00:00:00.537838,ReLU,ReLU,,,75,23,20.0,,,0.027433682717252304,2,442,0.7996045376709707,0.0001396918083867716,145.96590096609933,COMPLETE
929,0.4017205238342285,2023-09-04 21:35:55.993704,2023-09-04 21:35:56.198941,0 days 00:00:00.205237,ReLU,Sigmoid,,,74,23,18.0,,,0.032621182834675674,2,441,0.21845018654725543,0.00012623508152842912,294.83302904211956,COMPLETE
930,0.32210198044776917,2023-09-04 21:35:56.199360,2023-09-04 21:35:56.551650,0 days 00:00:00.352290,ReLU,Tanh,,,73,23,17.0,,,0.02302220260327996,2,450,0.723781264833796,0.00010978694351297582,366.8618850708008,COMPLETE
931,0.41211867332458496,2023-09-04 21:35:56.552038,2023-09-04 21:35:56.840835,0 days 00:00:00.288797,ReLU,Sigmoid,Tanh,Leaky,75,22,22.0,15.0,6.0,0.025572536614004254,4,414,0.20304861960085377,0.00014084433632810558,180.8640832572148,COMPLETE
932,0.49261629581451416,2023-09-04 21:35:56.841246,2023-09-04 21:35:59.522956,0 days 00:00:02.681710,ReLU,Leaky,,,77,23,21.0,,,0.00012423195534248886,2,443,0.4812488991842447,8.161547892511757e-05,209.63866488282352,COMPLETE
933,0.3522217869758606,2023-09-04 21:35:59.523346,2023-09-04 21:36:00.008413,0 days 00:00:00.485067,ReLU,ReLU,,,76,23,19.0,,,0.04398020071153078,2,434,0.5766242701845701,0.00018255770259187126,3395.2322713216145,COMPLETE
934,0.7465201020240784,2023-09-04 21:36:00.008814,2023-09-04 21:36:00.135617,0 days 00:00:00.126803,ReLU,Tanh,,,70,22,20.0,,,0.030899044541809265,2,458,0.18822190673652475,0.07050851309362315,223.3949369950728,COMPLETE
935,0.6557763814926147,2023-09-04 21:36:00.136046,2023-09-04 21:36:00.282780,0 days 00:00:00.146734,ReLU,Sigmoid,,,78,24,18.0,,,0.03728953926176904,2,451,0.24071090424912317,0.025327423887263847,269.2004345703125,COMPLETE
936,0.3869212567806244,2023-09-04 21:36:00.283186,2023-09-04 21:36:00.529536,0 days 00:00:00.246350,ReLU,Tanh,,,72,23,18.0,,,0.02145123771963237,2,434,0.3546034942149543,0.00021600685805628253,125.74785614013672,COMPLETE
937,0.5841740965843201,2023-09-04 21:36:00.529936,2023-09-04 21:36:00.862793,0 days 00:00:00.332857,ReLU,ReLU,,,80,22,19.0,,,0.027941287780032274,2,431,0.7662522799877401,0.03838370313780657,767.0147115071615,COMPLETE
938,0.973310112953186,2023-09-04 21:36:00.863195,2023-09-04 21:36:01.214545,0 days 00:00:00.351350,Leaky,Sigmoid,Leaky,,73,23,20.0,3.0,,0.017061712324225237,3,452,0.6317075015235722,0.012822793726217644,102.08398019113848,COMPLETE
939,0.9680514931678772,2023-09-04 21:36:01.214956,2023-09-04 21:36:01.574344,0 days 00:00:00.359388,Leaky,Tanh,ReLU,Sigmoid,76,24,23.0,10.0,8.0,0.013303470551266657,4,462,0.6854420545082885,0.03280223681445448,104.53753503163655,COMPLETE
940,0.4231245219707489,2023-09-04 21:36:01.574740,2023-09-04 21:36:01.817856,0 days 00:00:00.243116,ReLU,ReLU,,,82,23,17.0,,,0.019434415481917735,2,428,0.29873517900312285,0.0001676119730585995,139.01019131407446,COMPLETE
941,0.3378468453884125,2023-09-04 21:36:01.818229,2023-09-04 21:36:02.347924,0 days 00:00:00.529695,ReLU,Sigmoid,,,74,24,24.0,,,0.014527535786516528,2,438,0.7484370258295774,9.865076805948338e-05,1548.1378479003906,COMPLETE
942,0.34879013895988464,2023-09-04 21:36:02.348318,2023-09-04 21:36:02.724903,0 days 00:00:00.376585,ReLU,Sigmoid,,,76,22,19.0,,,0.03793244257289512,2,435,0.44936041568852014,0.00012030370970208485,164.96992547171456,COMPLETE
943,0.45996665954589844,2023-09-04 21:36:02.725290,2023-09-04 21:36:08.076071,0 days 00:00:05.350781,ReLU,Tanh,,,47,21,20.0,,,6.997991413040324e-05,2,444,0.7164675552593555,6.919257396393362e-05,169.60448986775165,COMPLETE
944,0.5854954123497009,2023-09-04 21:36:08.076458,2023-09-04 21:36:11.169078,0 days 00:00:03.092620,Leaky,ReLU,,,78,24,21.0,,,4.451946147306458e-05,2,424,0.6047270744537144,0.041671905073273986,119.32097767883877,COMPLETE
945,0.39765995740890503,2023-09-04 21:36:11.169443,2023-09-04 21:36:11.994794,0 days 00:00:00.825351,ReLU,Sigmoid,,,88,23,18.0,,,0.011304472623191652,2,471,0.6551260576226555,0.003764945485612065,127.09843570746264,COMPLETE
946,0.33149728178977966,2023-09-04 21:36:11.995183,2023-09-04 21:36:12.431194,0 days 00:00:00.436011,ReLU,,,,70,22,,,,0.023415829102644104,1,453,0.7699087434710139,0.00015609649480548258,194.3476994832357,COMPLETE
947,0.3948417901992798,2023-09-04 21:36:12.431589,2023-09-04 21:36:12.631324,0 days 00:00:00.199735,Leaky,Tanh,,,66,23,17.0,,,0.0748924917125338,2,320,0.22460881869332897,0.00024466622817520485,127.85244848789313,COMPLETE
948,0.5219647288322449,2023-09-04 21:36:12.631789,2023-09-04 21:36:13.922547,0 days 00:00:01.290758,Leaky,ReLU,,,97,24,19.0,,,8.436161119771364e-05,2,416,0.2656302774179408,0.0005446240177131045,148.38342585930457,COMPLETE
949,0.38039088249206543,2023-09-04 21:36:13.922935,2023-09-04 21:36:14.616486,0 days 00:00:00.693551,Leaky,Sigmoid,Tanh,ReLU,50,22,18.0,21.0,16.0,0.017068562239630224,4,278,0.7254204359555944,0.0007246114541718028,147.14587141338149,COMPLETE
950,0.38549408316612244,2023-09-04 21:36:14.616891,2023-09-04 21:36:14.939462,0 days 00:00:00.322571,Leaky,Tanh,,,80,24,12.0,,,0.009342337544951507,2,446,0.2922442084936945,0.00037551857288484685,193.02395952251595,COMPLETE
951,0.615570068359375,2023-09-04 21:36:14.939864,2023-09-04 21:36:16.691988,0 days 00:00:01.752124,Leaky,Sigmoid,,,68,23,22.0,,,9.568796265055982e-05,2,186,0.6921656953894857,0.00029663734878234403,132.15621300153836,COMPLETE
952,0.8653273582458496,2023-09-04 21:36:16.692367,2023-09-04 21:36:17.411815,0 days 00:00:00.719448,ReLU,ReLU,,,74,21,19.0,,,3.5772266803966794e-05,2,304,0.14230548168507334,8.90691551935973e-05,232.4931919700221,COMPLETE
953,0.37802568078041077,2023-09-04 21:36:17.412201,2023-09-04 21:36:17.806020,0 days 00:00:00.393819,Leaky,Tanh,,,59,23,21.0,,,0.01217554857340684,2,373,0.3070774658291488,5.543946077853694e-05,137.2331006699714,COMPLETE
954,0.5344685912132263,2023-09-04 21:36:17.806413,2023-09-04 21:36:18.144907,0 days 00:00:00.338494,Leaky,Sigmoid,,,92,22,20.0,,,0.015110137880210421,2,224,0.7520935726635948,0.012013653515459086,169.7692011052912,COMPLETE
