number,value,datetime_start,datetime_complete,duration,params_activation1,params_activation2,params_activation3,params_activation4,params_batch_size,params_fl1,params_fl2,params_fl3,params_fl4,params_learning_rate,params_n_layers,params_num_epochs,params_train_size,params_weight_decay,user_attrs_mre,state
1876,0.4059253931045532,2023-09-04 22:29:25.285777,2023-09-04 22:29:30.135179,0 days 00:00:04.849402,ReLU,Leaky,Leaky,,28,24,20.0,13.0,,4.1343802046206685e-05,3,361,0.3729524982638176,0.04403847032805807,106.64298396229414,COMPLETE
1877,0.2895297110080719,2023-09-04 22:29:30.135715,2023-09-04 22:29:31.513966,0 days 00:00:01.378251,Leaky,Leaky,ReLU,,21,21,18.0,16.0,,0.0030391932367042876,3,370,0.7232170547753702,0.0002485096192526546,106.85493833368474,COMPLETE
1878,0.32947129011154175,2023-09-04 22:29:31.514480,2023-09-04 22:29:34.105236,0 days 00:00:02.590756,ReLU,ReLU,Leaky,,25,23,19.0,14.0,,0.0007070500819166034,3,339,0.689193162491782,0.0001196009267700431,97.74735702787127,COMPLETE
1879,0.3817537724971771,2023-09-04 22:29:34.105763,2023-09-04 22:29:34.491141,0 days 00:00:00.385378,ReLU,Leaky,Leaky,,30,22,21.0,6.0,,0.017606056996703763,3,354,0.3090391920271478,0.00016318848688302037,225.69584383283342,COMPLETE
1880,0.37757861614227295,2023-09-04 22:29:34.491648,2023-09-04 22:29:35.242122,0 days 00:00:00.750474,ReLU,Leaky,Tanh,,95,18,18.0,15.0,,0.000997812897467737,3,373,0.2375976745862337,0.021764230609195422,118.90088620028654,COMPLETE
1881,0.34058940410614014,2023-09-04 22:29:35.243101,2023-09-04 22:29:36.427443,0 days 00:00:01.184342,Leaky,Tanh,Leaky,,23,15,12.0,12.0,,0.0023290153710660536,3,363,0.7995671851726678,9.774869651143212e-05,85.58761088053386,COMPLETE
1882,0.28453129529953003,2023-09-04 22:29:36.427981,2023-09-04 22:29:37.352291,0 days 00:00:00.924310,ReLU,Leaky,Leaky,,26,20,11.0,13.0,,0.0043527686680940375,3,344,0.7406296315682638,0.00030135634802613744,92.55030604771206,COMPLETE
1883,0.6504718661308289,2023-09-04 22:29:37.352852,2023-09-04 22:29:39.366378,0 days 00:00:02.013526,ReLU,ReLU,Leaky,,44,13,20.0,14.0,,1.8662247956623206e-05,3,336,0.24490839836729655,0.0002003221909813244,103.8865490867978,COMPLETE
1884,0.38140869140625,2023-09-04 22:29:39.366909,2023-09-04 22:29:39.857562,0 days 00:00:00.490653,Leaky,Leaky,Leaky,,34,21,19.0,15.0,,0.003428677982233729,3,350,0.4953656919223374,0.0369890491942486,136.5764707837786,COMPLETE
1885,0.34749701619148254,2023-09-04 22:29:39.858108,2023-09-04 22:29:40.643576,0 days 00:00:00.785468,Sigmoid,Leaky,Leaky,,21,13,18.0,16.0,,0.006709144061054134,3,440,0.28835873754448915,0.0007806274612646523,101.85397584976688,COMPLETE
1886,0.37463054060935974,2023-09-04 22:29:40.644157,2023-09-04 22:29:41.673205,0 days 00:00:01.029048,ReLU,Leaky,Leaky,,28,14,10.0,11.0,,0.0017473372394936836,3,366,0.46450709388383427,0.014901257235542796,103.35638336637128,COMPLETE
1887,0.35651513934135437,2023-09-04 22:29:41.673756,2023-09-04 22:29:42.331000,0 days 00:00:00.657244,ReLU,Leaky,Leaky,,23,21,19.0,13.0,,0.01586038330115614,3,430,0.7724467600881032,1.2622519275499857e-05,96.2024097442627,COMPLETE
1888,0.3118378520011902,2023-09-04 22:29:42.331543,2023-09-04 22:29:47.982551,0 days 00:00:05.651008,Leaky,ReLU,ReLU,,36,22,20.0,14.0,,6.35108238742853e-05,3,376,0.7046499296083778,0.0002334644228935996,118.01797191042574,COMPLETE
1889,0.3481809198856354,2023-09-04 22:29:47.983102,2023-09-04 22:29:48.389754,0 days 00:00:00.406652,ReLU,Leaky,Leaky,,25,24,19.0,15.0,,0.0053098191357599505,3,353,0.4165974009385466,0.00032922321288642324,163.56139526367187,COMPLETE
1890,0.38296782970428467,2023-09-04 22:29:48.390262,2023-09-04 22:29:49.256768,0 days 00:00:00.866506,ReLU,Leaky,Leaky,,31,14,18.0,16.0,,0.0004995470535147308,3,360,0.1129883041669154,0.0011473605296288107,113.87350823868921,COMPLETE
1891,0.3386768400669098,2023-09-04 22:29:49.257267,2023-09-04 22:29:50.002572,0 days 00:00:00.745305,ReLU,Leaky,Tanh,,27,23,19.0,12.0,,0.0008832842859881974,3,424,0.21034746865316242,0.00893535404540015,141.34778099871696,COMPLETE
1892,0.3399486243724823,2023-09-04 22:29:50.003078,2023-09-04 22:29:50.903653,0 days 00:00:00.900575,Leaky,ReLU,Leaky,,21,20,20.0,7.0,,0.0025621452380614326,3,334,0.7467088364160444,8.13059613401052e-05,95.33986990792411,COMPLETE
1893,0.43668219447135925,2023-09-04 22:29:50.904211,2023-09-04 22:29:51.311333,0 days 00:00:00.407122,ReLU,Leaky,Leaky,,24,13,18.0,14.0,,0.07788710317953097,3,370,0.3221544948880955,0.0021696459763281646,122.38542999267578,COMPLETE
1894,0.3348376154899597,2023-09-04 22:29:51.311837,2023-09-04 22:29:52.145748,0 days 00:00:00.833911,ReLU,Leaky,Leaky,,29,22,11.0,15.0,,0.015190939763575606,3,344,0.5554358470036734,0.0001385526791840563,93.58513031005859,COMPLETE
1895,0.4022037982940674,2023-09-04 22:29:52.146262,2023-09-04 22:29:52.431467,0 days 00:00:00.285205,Leaky,Leaky,Leaky,,26,17,21.0,13.0,,0.004067885146604014,3,359,0.17503704213320356,0.00017108980011778296,341.5617636221427,COMPLETE
1896,0.4088647961616516,2023-09-04 22:29:52.431984,2023-09-04 22:29:52.906959,0 days 00:00:00.474975,ReLU,Leaky,Sigmoid,ReLU,21,13,19.0,13.0,6.0,0.006547402505773745,4,376,0.1585555289147182,0.0004170263114615494,125.8370585123698,COMPLETE
1897,0.3690556287765503,2023-09-04 22:29:52.907472,2023-09-04 22:29:53.734448,0 days 00:00:00.826976,ReLU,ReLU,Leaky,,32,21,12.0,16.0,,0.0028446043912879527,3,419,0.3857097258006454,0.0014660294170871896,304.40134499289775,COMPLETE
1898,0.3396235704421997,2023-09-04 22:29:53.735445,2023-09-04 22:29:56.147529,0 days 00:00:02.412084,Sigmoid,Leaky,Leaky,,23,21,19.0,15.0,,0.01896182485346626,3,350,0.7727661101332793,0.0002420697822497704,99.40919365681393,COMPLETE
1899,0.3037758469581604,2023-09-04 22:29:56.148044,2023-09-04 22:29:57.510688,0 days 00:00:01.362644,Leaky,Leaky,Leaky,,28,14,18.0,14.0,,0.0011583225110968686,3,329,0.6702791641044695,0.00027519613437121827,99.81103376908736,COMPLETE
1900,0.3009064793586731,2023-09-04 22:29:57.511198,2023-09-04 22:30:00.019250,0 days 00:00:02.508052,ReLU,Leaky,Leaky,,26,13,20.0,12.0,,0.0007209877364030099,3,363,0.7998309302737968,0.0009884445422468431,95.32230951368194,COMPLETE
1901,0.3415049910545349,2023-09-04 22:30:00.019783,2023-09-04 22:30:02.955326,0 days 00:00:02.935543,ReLU,Tanh,ReLU,,22,19,11.0,15.0,,0.00024684538585306693,3,438,0.7244231185565639,1.423034966926121e-05,109.91703687395368,COMPLETE
1902,0.3261256217956543,2023-09-04 22:30:02.955848,2023-09-04 22:30:05.604959,0 days 00:00:02.649111,ReLU,ReLU,Leaky,,24,15,10.0,6.0,,0.0014100763353194488,3,340,0.7454108909099426,0.0002100258021762811,109.68211967831566,COMPLETE
1903,0.4202124774456024,2023-09-04 22:30:05.605486,2023-09-04 22:30:05.968737,0 days 00:00:00.363251,Leaky,Leaky,Tanh,,29,24,9.0,11.0,,0.09751447926159147,3,377,0.29547382251952586,0.003307964604891777,127.6916131239671,COMPLETE
1904,0.37060046195983887,2023-09-04 22:30:05.969255,2023-09-04 22:30:06.703627,0 days 00:00:00.734372,ReLU,Leaky,Leaky,,21,20,19.0,14.0,,0.006007729782191839,3,351,0.4369569035001166,0.0006361693912831582,186.83666251046316,COMPLETE
1905,0.35695311427116394,2023-09-04 22:30:06.704143,2023-09-04 22:30:07.273872,0 days 00:00:00.569729,ReLU,Leaky,Leaky,,30,22,22.0,7.0,,0.0020847737662424764,3,426,0.5202977845373172,0.00011697537773177206,177.55675048828124,COMPLETE
1906,0.3829590678215027,2023-09-04 22:30:07.274386,2023-09-04 22:30:08.627996,0 days 00:00:01.353610,Leaky,Leaky,Leaky,,26,13,18.0,14.0,,0.00031605721545122415,3,370,0.25605071239532556,9.152491179410293e-05,108.98135354178292,COMPLETE
1907,0.33453553915023804,2023-09-04 22:30:08.628518,2023-09-04 22:30:09.220801,0 days 00:00:00.592283,ReLU,ReLU,Leaky,,33,12,20.0,16.0,,0.013926953767682645,3,358,0.6989168224324687,0.00031340287442808046,105.51328072181114,COMPLETE
1908,0.3416948914527893,2023-09-04 22:30:09.221313,2023-09-04 22:30:10.419315,0 days 00:00:01.198002,ReLU,Leaky,Leaky,,25,22,18.0,15.0,,0.0033700608091986263,3,417,0.7704456998125592,0.006249385962849223,104.20250875299627,COMPLETE
1909,0.35720548033714294,2023-09-04 22:30:10.419817,2023-09-04 22:30:12.179395,0 days 00:00:01.759578,ReLU,Leaky,Leaky,,28,21,12.0,13.0,,0.00014058332827940735,3,379,0.16430316328353267,0.0005599462234644224,125.88381185735767,COMPLETE
1910,0.33132681250572205,2023-09-04 22:30:12.179921,2023-09-04 22:30:13.886184,0 days 00:00:01.706263,Leaky,,,,22,23,,,,0.0046447649468435255,1,344,0.7303499970602465,0.00017845605714934793,105.39875404202208,COMPLETE
1911,0.3559376299381256,2023-09-04 22:30:13.886673,2023-09-04 22:30:14.354592,0 days 00:00:00.467919,ReLU,Leaky,Leaky,,92,12,13.0,14.0,,0.02064678252042133,3,367,0.5816312753472533,0.004062684821902431,118.23525778452556,COMPLETE
1912,0.4808664321899414,2023-09-04 22:30:14.355098,2023-09-04 22:30:22.299116,0 days 00:00:07.944018,Sigmoid,ReLU,Leaky,,24,13,19.0,12.0,,2.4301873979656573e-05,3,331,0.7669675752083138,0.0002056570986182624,103.7999977660335,COMPLETE
1913,0.4544868469238281,2023-09-04 22:30:22.299629,2023-09-04 22:30:23.093351,0 days 00:00:00.793722,ReLU,Leaky,ReLU,,20,12,19.0,15.0,,0.016457798329022694,3,431,0.7049607412114861,0.07423151900219471,96.73863006591797,COMPLETE
1914,0.3376213312149048,2023-09-04 22:30:23.093877,2023-09-04 22:30:23.644929,0 days 00:00:00.551052,Leaky,Leaky,Leaky,,31,12,20.0,16.0,,0.0009828027188545777,3,383,0.23883172932024818,0.00014835255855635645,305.15398794320913,COMPLETE
1915,0.5550163984298706,2023-09-04 22:30:23.645476,2023-09-04 22:30:26.792551,0 days 00:00:03.147075,ReLU,Leaky,Leaky,,27,20,18.0,7.0,,1.2815930159293395e-05,3,357,0.28184672237683506,0.0003528146434821642,111.18451513295749,COMPLETE
1916,0.43030184507369995,2023-09-04 22:30:26.793073,2023-09-04 22:30:27.783910,0 days 00:00:00.990837,ReLU,Leaky,Tanh,,23,12,19.0,13.0,,0.00041030506646148526,3,410,0.1905418596102167,0.0002632469952829727,112.1095866121987,COMPLETE
1917,1.0054742097854614,2023-09-04 22:30:27.784429,2023-09-04 22:30:29.425499,0 days 00:00:01.641070,ReLU,ReLU,Leaky,,25,21,21.0,11.0,,1.0149559859613131e-05,3,342,0.11753680712905891,0.0008551469818966615,115.46156157108776,COMPLETE
1918,0.37768369913101196,2023-09-04 22:30:29.426007,2023-09-04 22:30:30.666709,0 days 00:00:01.240702,Leaky,Leaky,Sigmoid,,21,13,20.0,14.0,,0.0066517734979826115,3,370,0.7405965191480377,0.00718295686622706,100.1483637491862,COMPLETE
1919,0.3009655773639679,2023-09-04 22:30:30.667337,2023-09-04 22:30:31.473162,0 days 00:00:00.805825,ReLU,Leaky,Leaky,,28,23,12.0,6.0,,0.024195530486582902,3,353,0.6689294238103854,1.009040095488753e-05,104.89274321662054,COMPLETE
1920,0.32230526208877563,2023-09-04 22:30:31.473665,2023-09-04 22:30:32.177173,0 days 00:00:00.703508,ReLU,Leaky,Leaky,,30,14,11.0,15.0,,0.014244316120624068,3,412,0.4294489184551628,7.522253834924319e-05,107.29596149678133,COMPLETE
1921,0.3094002604484558,2023-09-04 22:30:32.177698,2023-09-04 22:30:33.924351,0 days 00:00:01.746653,Leaky,ReLU,Leaky,,26,13,18.0,14.0,,0.005010847372536616,3,421,0.7727878440500214,0.00044547078775606253,82.73139419555665,COMPLETE
1922,0.3774574100971222,2023-09-04 22:30:33.924882,2023-09-04 22:30:36.369179,0 days 00:00:02.444297,ReLU,Tanh,Leaky,,33,12,19.0,16.0,,0.00016830925339376013,3,363,0.44859933250960526,0.00011331116417157849,110.31344558943563,COMPLETE
1923,0.26529526710510254,2023-09-04 22:30:36.369691,2023-09-04 22:30:37.492199,0 days 00:00:01.122508,ReLU,Leaky,Leaky,,23,22,19.0,5.0,,0.003693876328229299,3,334,0.7999672844692531,0.004360095198866437,96.7286444271312,COMPLETE
1924,0.3578028082847595,2023-09-04 22:30:37.492707,2023-09-04 22:30:38.498810,0 days 00:00:01.006103,Leaky,Leaky,Leaky,,20,12,18.0,15.0,,0.002796025058449156,3,383,0.4420250554991434,2.0480150821482304e-05,198.12648391723633,COMPLETE
1925,0.39205437898635864,2023-09-04 22:30:38.499346,2023-09-04 22:30:41.310200,0 days 00:00:02.810854,Sigmoid,Leaky,ReLU,,27,21,10.0,13.0,,0.0015891213151315382,3,345,0.38818949723151436,0.00018642861910369077,101.46031291602438,COMPLETE
1926,0.335077166557312,2023-09-04 22:30:41.310710,2023-09-04 22:30:42.134735,0 days 00:00:00.824025,ReLU,Leaky,Leaky,,23,16,20.0,12.0,,0.018933742598856003,3,444,0.536815741133038,0.0006599798969979867,98.66088405408357,COMPLETE
1927,0.3882372975349426,2023-09-04 22:30:42.135255,2023-09-04 22:30:42.475719,0 days 00:00:00.340464,ReLU,ReLU,Leaky,,35,19,18.0,7.0,,0.0023489763224103927,3,374,0.1333293088363171,0.00023454285070383107,463.7302258355277,COMPLETE
1928,0.2865029573440552,2023-09-04 22:30:42.476235,2023-09-04 22:30:43.805303,0 days 00:00:01.329068,ReLU,Leaky,Tanh,,29,9,20.0,6.0,,0.013295155532464869,3,406,0.7263423524246746,0.00037765779541963244,89.26580448473914,COMPLETE
1929,0.35948190093040466,2023-09-04 22:30:43.805825,2023-09-04 22:30:45.935260,0 days 00:00:02.129435,Leaky,Leaky,Leaky,,20,12,19.0,14.0,,0.0005096384852775116,3,352,0.35024422847943315,0.009833702543666646,113.98708559942584,COMPLETE
1930,0.34076622128486633,2023-09-04 22:30:45.935784,2023-09-04 22:30:47.130632,0 days 00:00:01.194848,ReLU,Leaky,Leaky,,25,24,19.0,16.0,,0.0012841500939493454,3,364,0.7989088630309196,1.6555011600049585e-05,119.26485806419736,COMPLETE
1931,0.3540898561477661,2023-09-04 22:30:47.131143,2023-09-04 22:30:47.445109,0 days 00:00:00.313966,ReLU,ReLU,Leaky,,22,18,13.0,13.0,,0.007500209771764794,3,428,0.2022779337932714,0.0012346262233205248,604.7675412495931,COMPLETE
1932,0.3611457943916321,2023-09-04 22:30:47.445626,2023-09-04 22:30:48.393602,0 days 00:00:00.947976,Leaky,Leaky,Leaky,,31,13,18.0,15.0,,0.005868553860255291,3,325,0.7493971711410499,0.057696478704750455,102.94092759631928,COMPLETE
1933,0.31215599179267883,2023-09-04 22:30:48.394108,2023-09-04 22:30:49.598908,0 days 00:00:01.204800,ReLU,Leaky,Leaky,,24,21,19.0,12.0,,0.015776487585182273,3,385,0.6766583321954054,0.0001511112288128739,94.96262334187826,COMPLETE
1934,0.40131646394729614,2023-09-04 22:30:49.599424,2023-09-04 22:30:50.070128,0 days 00:00:00.470704,ReLU,Leaky,Leaky,,27,10,20.0,15.0,,0.0625876462206014,3,418,0.7087715085379158,0.00029580911607356684,128.47151896158854,COMPLETE
1935,0.32960236072540283,2023-09-04 22:30:50.070637,2023-09-04 22:30:51.318587,0 days 00:00:01.247950,ReLU,Leaky,Leaky,,20,22,12.0,16.0,,0.004145143076853492,3,348,0.7532082769662729,9.941555946024069e-05,115.50895029703776,COMPLETE
1936,0.43550294637680054,2023-09-04 22:30:51.319629,2023-09-04 22:30:52.380424,0 days 00:00:01.060795,Sigmoid,ReLU,Leaky,,28,23,11.0,20.0,,0.0007403786226016839,3,338,0.10949233612597149,0.0020262962922912445,108.26533897886885,COMPLETE
1937,0.27054956555366516,2023-09-04 22:30:52.380960,2023-09-04 22:30:54.054471,0 days 00:00:01.673511,Leaky,Leaky,ReLU,,25,20,19.0,14.0,,0.0017495898967990978,3,358,0.7996444865689323,0.00021730216349547592,99.64599790411481,COMPLETE
1938,0.3861258625984192,2023-09-04 22:30:54.055048,2023-09-04 22:30:54.436545,0 days 00:00:00.381497,ReLU,Leaky,Leaky,,22,12,18.0,7.0,,0.023284975255968645,3,373,0.4741161353695453,0.003196431225532542,101.42039271763393,COMPLETE
1939,0.35059353709220886,2023-09-04 22:30:54.437066,2023-09-04 22:30:55.416573,0 days 00:00:00.979507,ReLU,Leaky,Sigmoid,,26,11,21.0,11.0,,0.002985699821601277,3,190,0.7721244877796299,0.013582839882812418,92.72074846540178,COMPLETE
1940,0.3944139778614044,2023-09-04 22:30:55.417315,2023-09-04 22:30:55.846275,0 days 00:00:00.428960,Leaky,ReLU,Leaky,,30,12,19.0,13.0,,0.012594674984803766,3,404,0.21807654284485414,2.43765732521169e-05,334.1421494917436,COMPLETE
1941,0.5347004532814026,2023-09-04 22:30:55.846801,2023-09-04 22:30:57.524182,0 days 00:00:01.677381,ReLU,Leaky,Tanh,,24,22,20.0,15.0,,2.3515705865090974e-05,3,387,0.10910237505108364,0.00013471828321821408,106.66917180891801,COMPLETE
1942,0.8389270305633545,2023-09-04 22:30:57.524710,2023-09-04 22:30:58.965710,0 days 00:00:01.441000,ReLU,Tanh,Leaky,,33,13,18.0,12.0,,1.43289842372498e-05,3,435,0.10444208475473178,0.0002775869220460092,103.56399699244005,COMPLETE
1943,0.38311606645584106,2023-09-04 22:30:58.966232,2023-09-04 22:31:03.741006,0 days 00:00:04.774774,Leaky,Leaky,Leaky,,21,11,13.0,13.0,,5.2735172393631565e-05,3,158,0.7300769882816798,0.0004952153180895531,102.81189969219739,COMPLETE
1944,0.4208053648471832,2023-09-04 22:31:03.741527,2023-09-04 22:31:06.494911,0 days 00:00:02.753384,ReLU,Leaky,Leaky,,29,14,19.0,14.0,,0.00010590210733248905,3,364,0.12973059663331435,8.480048977483275e-05,116.0683752835452,COMPLETE
1945,0.3276948928833008,2023-09-04 22:31:06.495937,2023-09-04 22:31:07.462877,0 days 00:00:00.966940,ReLU,Leaky,Leaky,,26,10,20.0,5.0,,0.018308837523689853,3,412,0.6914866833592588,0.00016614996061814973,106.5270260226342,COMPLETE
1946,0.323112428188324,2023-09-04 22:31:07.463402,2023-09-04 22:31:08.263928,0 days 00:00:00.800526,ReLU,ReLU,Leaky,,23,13,12.0,14.0,,0.008546331515674025,3,379,0.7501387594876402,0.00039227452767497925,86.63095590342645,COMPLETE
1947,0.33339202404022217,2023-09-04 22:31:08.264458,2023-09-04 22:31:08.769202,0 days 00:00:00.504744,Leaky,Leaky,Leaky,,20,21,18.0,15.0,,0.006889219766658864,3,395,0.3008211816664386,0.002645744008875095,133.85034548851752,COMPLETE
1948,0.3347565233707428,2023-09-04 22:31:08.769724,2023-09-04 22:31:18.137539,0 days 00:00:09.367815,ReLU,Leaky,Leaky,Sigmoid,32,12,18.0,6.0,9.0,7.224114909059611e-05,4,339,0.7994173395511707,0.005471099648776549,111.74701782946741,COMPLETE
1949,0.3534974455833435,2023-09-04 22:31:18.138062,2023-09-04 22:31:18.698208,0 days 00:00:00.560146,ReLU,Leaky,ReLU,,28,17,19.0,16.0,,0.004949999614520053,3,354,0.32666126436040754,0.0009236801326304441,126.92767646095969,COMPLETE
1950,0.4053278863430023,2023-09-04 22:31:18.698728,2023-09-04 22:31:20.618353,0 days 00:00:01.919625,Sigmoid,ReLU,Leaky,,41,12,10.0,15.0,,0.0009087788632171469,3,419,0.7132164739767023,0.00020111832857301458,120.48573181408794,COMPLETE
1951,0.31047478318214417,2023-09-04 22:31:20.618886,2023-09-04 22:31:26.168699,0 days 00:00:05.549813,Leaky,Leaky,Leaky,,24,20,20.0,13.0,,0.00025744655421940365,3,369,0.7696098464782766,0.018849570888045886,103.10623984085886,COMPLETE
1952,0.3249339163303375,2023-09-04 22:31:26.169215,2023-09-04 22:31:30.415938,0 days 00:00:04.246723,ReLU,Leaky,Tanh,,22,11,19.0,7.0,,0.0005757487827781854,3,328,0.6652643407786776,0.0003294929237842282,113.98631480588752,COMPLETE
1953,0.38952043652534485,2023-09-04 22:31:30.416452,2023-09-04 22:31:30.765706,0 days 00:00:00.349254,ReLU,Leaky,Leaky,,20,10,18.0,14.0,,0.00348642075204164,3,344,0.14328232476913436,0.00024741945435911204,124.33361519707574,COMPLETE
1954,0.3456554114818573,2023-09-04 22:31:30.766256,2023-09-04 22:31:34.275124,0 days 00:00:03.508868,ReLU,ReLU,Leaky,,27,12,13.0,16.0,,0.00032737312846097986,3,360,0.3916058885374905,0.0001234205942220428,106.10586719446941,COMPLETE
1955,0.31365951895713806,2023-09-04 22:31:34.275677,2023-09-04 22:31:35.355074,0 days 00:00:01.079397,Leaky,Leaky,Leaky,,25,15,11.0,15.0,,0.0022235017023867925,3,404,0.7454268876116654,7.268205219901366e-05,603.8041113876715,COMPLETE
1956,0.33301228284835815,2023-09-04 22:31:35.355628,2023-09-04 22:31:48.707424,0 days 00:00:13.351796,ReLU,Leaky,Leaky,,19,9,9.0,12.0,,7.559989485103108e-05,3,425,0.7716055679093601,0.0024164804521178613,98.51604454489315,COMPLETE
1957,0.3070354163646698,2023-09-04 22:31:48.708001,2023-09-04 22:31:49.702889,0 days 00:00:00.994888,ReLU,Leaky,Leaky,,31,23,20.0,11.0,,0.02134503606778043,3,389,0.7232903301761445,0.0001927476700062886,93.00668736508018,COMPLETE
1958,0.3425433933734894,2023-09-04 22:31:49.703471,2023-09-04 22:31:50.515701,0 days 00:00:00.812230,Leaky,Leaky,Leaky,,24,11,19.0,6.0,,0.013515002687361114,3,377,0.704723383222112,2.531873426902482e-05,117.48924691336495,COMPLETE
1959,0.31872716546058655,2023-09-04 22:31:50.516273,2023-09-04 22:31:51.149874,0 days 00:00:00.633601,ReLU,ReLU,Leaky,,84,13,21.0,14.0,,0.010009547100798252,3,347,0.47679153751922826,0.00143166399506022,103.89800819190773,COMPLETE
1960,0.3219734728336334,2023-09-04 22:31:51.150503,2023-09-04 22:31:51.874358,0 days 00:00:00.723855,ReLU,,,,22,21,,,,0.01634367452323283,1,369,0.6333484192943306,0.0006068446923195206,90.7842137406512,COMPLETE
1961,0.3253367245197296,2023-09-04 22:31:51.875200,2023-09-04 22:31:54.377239,0 days 00:00:02.502039,Sigmoid,Leaky,Sigmoid,,29,11,11.0,14.0,,0.008008463952636559,3,322,0.7492479602010137,0.0002755044922192579,106.86071168615463,COMPLETE
1962,0.3552148938179016,2023-09-04 22:31:54.377962,2023-09-04 22:31:55.394960,0 days 00:00:01.016998,Leaky,Leaky,Leaky,,26,22,19.0,13.0,,0.0061132100220764015,3,401,0.7738144006188548,0.039475932300747606,114.60538392908433,COMPLETE
1963,0.4103878438472748,2023-09-04 22:31:55.395579,2023-09-04 22:31:55.941798,0 days 00:00:00.546219,ReLU,Tanh,ReLU,,20,24,20.0,7.0,,0.0010387704961466655,3,356,0.15936600069867507,0.0018273198856326842,212.00838843451606,COMPLETE
1964,0.29125848412513733,2023-09-04 22:31:55.942480,2023-09-04 22:31:57.044586,0 days 00:00:01.102106,ReLU,Leaky,Leaky,,36,10,8.0,15.0,,0.026182231677287802,3,414,0.7998236909858722,1.8606336565543035e-05,119.88650467816521,COMPLETE
1965,0.38854336738586426,2023-09-04 22:31:57.045229,2023-09-04 22:31:57.548495,0 days 00:00:00.503266,ReLU,ReLU,Leaky,,27,12,18.0,16.0,,0.004483045627693984,3,389,0.4171533422299103,9.3564202116889e-05,110.50602149963379,COMPLETE
1966,0.2705633342266083,2023-09-04 22:31:57.549056,2023-09-04 22:31:58.852500,0 days 00:00:01.303444,Leaky,Leaky,Leaky,,22,20,12.0,13.0,,0.0018893104058041418,3,432,0.6907951156421688,0.00047636137087546127,86.50836522528466,COMPLETE
1967,0.329326331615448,2023-09-04 22:31:58.853071,2023-09-04 22:31:59.667517,0 days 00:00:00.814446,ReLU,Leaky,Tanh,,34,12,13.0,8.0,,0.012585804492162272,3,334,0.5601842998452782,0.00015438243575163437,101.52253913879395,COMPLETE
1968,0.3179295063018799,2023-09-04 22:31:59.668120,2023-09-04 22:32:01.509589,0 days 00:00:01.841469,ReLU,Leaky,Leaky,,30,13,14.0,10.0,,0.0012621644433309697,3,381,0.7318124665129816,0.00022863620786836434,116.11075982593354,COMPLETE
