number,value,datetime_start,datetime_complete,duration,params_activation1,params_activation2,params_activation3,params_activation4,params_batch_size,params_fl1,params_fl2,params_fl3,params_fl4,params_learning_rate,params_n_layers,params_num_epochs,params_train_size,params_weight_decay,user_attrs_mre,state
1943,0.30937981605529785,2023-09-04 22:24:59.545667,2023-09-04 22:25:01.900677,0 days 00:00:02.355010,ReLU,Tanh,Tanh,Leaky,31,21,22.0,15.0,6.0,0.0006519955535802347,4,202,0.7344633240346484,0.00013194798846820314,174.77056754903592,COMPLETE
1944,0.4110061526298523,2023-09-04 22:25:01.901206,2023-09-04 22:25:02.376155,0 days 00:00:00.474949,ReLU,Leaky,ReLU,,40,17,20.0,4.0,,0.0038485107441265597,3,222,0.24879392394030025,0.00029603352682942835,247.68258640222382,COMPLETE
1945,0.2942614257335663,2023-09-04 22:25:02.376694,2023-09-04 22:25:02.779188,0 days 00:00:00.402494,ReLU,Leaky,Leaky,,43,19,19.0,23.0,,0.04182549868778513,3,192,0.7112752513379613,6.447925844582539e-05,371.09054226345484,COMPLETE
1946,0.446560263633728,2023-09-04 22:25:02.779706,2023-09-04 22:25:03.577003,0 days 00:00:00.797297,Sigmoid,Leaky,,,47,21,17.0,,,0.0019451025087938343,2,239,0.20695680331519575,5.1402865610912186e-05,317.16157499444546,COMPLETE
1947,1.0507941246032715,2023-09-04 22:25:03.577522,2023-09-04 22:25:05.240516,0 days 00:00:01.662994,ReLU,Tanh,Sigmoid,,32,20,21.0,10.0,,1.0575501209424478e-05,3,214,0.16543464964576346,1.4711049205972e-05,99.77037472591222,COMPLETE
1948,0.3542642891407013,2023-09-04 22:25:05.241569,2023-09-04 22:25:05.820647,0 days 00:00:00.579078,ReLU,Leaky,Leaky,ReLU,27,20,22.0,7.0,23.0,0.002545753939841319,4,134,0.12586975260777603,0.0003365934780762471,429.1118056282165,COMPLETE
1949,0.44905123114585876,2023-09-04 22:25:05.821174,2023-09-04 22:25:07.205201,0 days 00:00:01.384027,Leaky,ReLU,Leaky,,30,3,23.0,8.0,,0.003166590646780018,3,203,0.7995895433838822,0.0009827747336980384,145.58071843927556,COMPLETE
1950,0.2763938903808594,2023-09-04 22:25:07.205735,2023-09-04 22:25:08.713877,0 days 00:00:01.508142,ReLU,Leaky,ReLU,,65,19,10.0,24.0,,0.007600682269552228,3,185,0.7521584143388125,1.8886185029267937e-05,167.26153000541356,COMPLETE
1951,0.45881932973861694,2023-09-04 22:25:08.715007,2023-09-04 22:25:13.441526,0 days 00:00:04.726519,Sigmoid,Sigmoid,Tanh,,39,18,18.0,9.0,,0.0003466629973290079,3,195,0.6841728742181924,0.0006085466221935916,241.27234935271434,COMPLETE
1952,0.697282612323761,2023-09-04 22:25:13.442045,2023-09-04 22:25:16.063008,0 days 00:00:02.620963,ReLU,,,,42,20,,,,1.387403318442839e-05,1,225,0.7659087664122862,4.3128967254937174e-05,173.34374043782552,COMPLETE
1953,0.45843783020973206,2023-09-04 22:25:16.063513,2023-09-04 22:25:17.613386,0 days 00:00:01.549873,ReLU,Tanh,Leaky,,45,21,20.0,23.0,,0.00019488881896490332,3,175,0.3559402112603764,0.0001144730007987598,331.76471958705355,COMPLETE
1954,0.49478575587272644,2023-09-04 22:25:17.613918,2023-09-04 22:25:18.716794,0 days 00:00:01.102876,ReLU,Leaky,Sigmoid,Sigmoid,32,19,22.0,8.0,3.0,0.005089018635512781,4,210,0.7269915584783807,0.00017205891460412814,214.35075667097763,COMPLETE
1955,0.7455679774284363,2023-09-04 22:25:18.717665,2023-09-04 22:25:19.441462,0 days 00:00:00.723797,Tanh,Leaky,Leaky,,29,18,21.0,6.0,,0.0013374732942095038,3,63,0.6173130608621327,0.06525007138915148,1116.6896449497767,COMPLETE
1956,0.44699084758758545,2023-09-04 22:25:19.442036,2023-09-04 22:25:19.705208,0 days 00:00:00.263172,ReLU,Leaky,ReLU,,39,17,19.0,14.0,,0.03003517808703271,3,217,0.2686938739196923,3.580912035685386e-05,167.82192310534026,COMPLETE
1957,0.5605046153068542,2023-09-04 22:25:19.705745,2023-09-04 22:25:20.864289,0 days 00:00:01.158544,Sigmoid,Tanh,Leaky,,54,20,22.0,9.0,,0.000289565444174732,3,106,0.5007761432898039,0.0002656317618521353,1799.67198123572,COMPLETE
1958,0.27149301767349243,2023-09-04 22:25:20.864810,2023-09-04 22:25:22.255064,0 days 00:00:01.390254,ReLU,Leaky,Leaky,,33,19,23.0,24.0,,0.0010533100457386245,3,235,0.7730054322425529,2.4861213769855483e-05,424.03149946909105,COMPLETE
1959,0.3020111322402954,2023-09-04 22:25:22.255701,2023-09-04 22:25:24.420570,0 days 00:00:02.164869,ReLU,Leaky,ReLU,Leaky,41,18,21.0,9.0,9.0,0.002412642783819828,4,259,0.7005239363286317,8.711821753470047e-05,131.43253072102866,COMPLETE
1960,0.270749568939209,2023-09-04 22:25:24.421138,2023-09-04 22:25:25.771026,0 days 00:00:01.349888,ReLU,Tanh,Leaky,,30,20,19.0,16.0,,0.004440164780396946,3,195,0.7986339211096941,0.0004630647804694478,149.22903292786842,COMPLETE
1961,0.3776330351829529,2023-09-04 22:25:25.771752,2023-09-04 22:25:27.023294,0 days 00:00:01.251542,Sigmoid,Leaky,Tanh,,38,19,9.0,23.0,,0.0034474732593739264,3,183,0.4087006374838832,0.00014730970675068343,123.5942683344302,COMPLETE
1962,0.3697187006473541,2023-09-04 22:25:27.023846,2023-09-04 22:25:29.615508,0 days 00:00:02.591662,ReLU,Leaky,Sigmoid,,26,21,23.0,7.0,,0.001563309488040352,3,247,0.7473080963200466,0.0002096248379743361,247.4630892771595,COMPLETE
1963,0.3815816640853882,2023-09-04 22:25:29.616049,2023-09-04 22:25:30.669651,0 days 00:00:01.053602,ReLU,ReLU,Leaky,,28,20,20.0,11.0,,0.0007812780656694301,3,204,0.39334409319506486,1.1270340310595585e-05,213.79786573137557,COMPLETE
1964,0.33216485381126404,2023-09-04 22:25:30.670201,2023-09-04 22:25:31.045299,0 days 00:00:00.375098,ReLU,Leaky,Leaky,,32,19,4.0,8.0,,0.009364031706659202,3,226,0.28229994816841963,2.965247591815501e-05,160.3564349583217,COMPLETE
1965,0.39379793405532837,2023-09-04 22:25:31.045851,2023-09-04 22:25:31.627437,0 days 00:00:00.581586,ReLU,Tanh,ReLU,,44,18,22.0,10.0,,0.006586140284745426,3,171,0.34145729367834055,5.250099474990711e-05,148.75785946023876,COMPLETE
1966,0.5057992935180664,2023-09-04 22:25:31.628107,2023-09-04 22:25:32.788545,0 days 00:00:01.160438,Sigmoid,Leaky,Leaky,Leaky,56,2,21.0,8.0,11.0,0.0019228899537886153,4,189,0.7305694593395194,7.182779464476293e-05,159.63316432765274,COMPLETE
1967,0.3269963264465332,2023-09-04 22:25:32.789123,2023-09-04 22:25:34.514900,0 days 00:00:01.725777,ReLU,Sigmoid,Tanh,,49,7,15.0,9.0,,0.002777574329515124,3,210,0.7621133756682024,1.6090246884869516e-05,166.17986997551876,COMPLETE
1968,0.30817151069641113,2023-09-04 22:25:34.515987,2023-09-04 22:25:36.696229,0 days 00:00:02.180242,ReLU,Leaky,Leaky,,35,21,20.0,23.0,,0.005781607338961685,3,218,0.6968914678932616,0.004839981004467226,171.8369140625,COMPLETE
1969,0.502680778503418,2023-09-04 22:25:36.697336,2023-09-04 22:25:37.781447,0 days 00:00:01.084111,ReLU,Tanh,Sigmoid,ReLU,52,20,11.0,7.0,10.0,0.008125074797875763,4,200,0.6437327467479369,0.01199662668107475,228.17088508605957,COMPLETE
1970,0.4156872630119324,2023-09-04 22:25:37.781982,2023-09-04 22:25:38.618320,0 days 00:00:00.836338,Sigmoid,Leaky,ReLU,,23,19,21.0,8.0,,0.0039862205083817295,3,234,0.31678634720141347,0.00012350600369463862,134.60941819221742,COMPLETE
1971,0.4194723665714264,2023-09-04 22:25:38.618879,2023-09-04 22:25:39.309752,0 days 00:00:00.690873,ReLU,Leaky,Leaky,,31,20,23.0,9.0,,0.0021033277514588486,3,180,0.37170334570587127,1.3501996010690465e-05,224.95525343153213,COMPLETE
1972,0.36685335636138916,2023-09-04 22:25:39.310312,2023-09-04 22:25:40.255610,0 days 00:00:00.945298,ReLU,Leaky,Leaky,,41,18,22.0,13.0,,0.00320174680486121,3,194,0.37073664840406156,2.039325288553905e-05,177.02183235570004,COMPLETE
1973,0.31441280245780945,2023-09-04 22:25:40.256150,2023-09-04 22:25:42.138344,0 days 00:00:01.882194,Leaky,Tanh,Tanh,,37,21,10.0,23.0,,0.001209921843673327,3,266,0.7727762648271964,4.197851768275101e-05,262.0532114457111,COMPLETE
1974,0.3952142894268036,2023-09-04 22:25:42.138885,2023-09-04 22:25:44.284754,0 days 00:00:02.145869,ReLU,Leaky,Leaky,Tanh,34,19,18.0,15.0,2.0,0.000901719904336168,4,205,0.7987356017475938,0.00010118388773703704,180.38491461742885,COMPLETE
1975,0.342637836933136,2023-09-04 22:25:44.285319,2023-09-04 22:25:45.633114,0 days 00:00:01.347795,Sigmoid,Leaky,ReLU,,39,18,19.0,12.0,,0.010069994381925967,3,225,0.7334289312853717,0.00039319324007840156,1111.535847383387,COMPLETE
1976,0.593306839466095,2023-09-04 22:25:45.634213,2023-09-04 22:25:49.963913,0 days 00:00:04.329700,ReLU,ReLU,Sigmoid,,30,17,21.0,24.0,,4.664995123804056e-05,3,214,0.460539801280464,0.0001773144274776683,195.3764589612729,COMPLETE
1977,0.38012459874153137,2023-09-04 22:25:49.964447,2023-09-04 22:25:50.332160,0 days 00:00:00.367713,ReLU,Tanh,Leaky,,28,20,20.0,8.0,,0.02295921555145375,3,186,0.24017594938562067,3.551034804751521e-05,211.83903924350082,COMPLETE
1978,0.3383972644805908,2023-09-04 22:25:50.332679,2023-09-04 22:25:51.134382,0 days 00:00:00.801703,ReLU,Leaky,Leaky,,42,21,22.0,10.0,,0.002357127172125822,3,244,0.5268699302721163,0.01840463158634667,405.45688012930066,COMPLETE
1979,0.38426998257637024,2023-09-04 22:25:51.134934,2023-09-04 22:25:52.206875,0 days 00:00:01.071941,Tanh,Sigmoid,,,33,19,23.0,,,0.018798963385088432,2,171,0.6707600176516818,0.001194507109354917,172.68360900878906,COMPLETE
1980,0.5135917663574219,2023-09-04 22:25:52.207477,2023-09-04 22:25:52.778821,0 days 00:00:00.571344,ReLU,Leaky,ReLU,Leaky,35,20,22.0,7.0,7.0,0.0016724430879038073,4,139,0.13358382971167834,0.008114264161328846,166.78224614461263,COMPLETE
1981,0.5291101336479187,2023-09-04 22:25:52.779354,2023-09-04 22:25:53.970572,0 days 00:00:01.191218,Sigmoid,Leaky,Leaky,,25,15,21.0,17.0,,0.0043887372120708515,3,280,0.33316302556980004,0.01910711272577638,230.1551307078158,COMPLETE
1982,0.6103748083114624,2023-09-04 22:25:53.971105,2023-09-04 22:25:54.545421,0 days 00:00:00.574316,ReLU,Tanh,Tanh,,37,18,20.0,9.0,,0.0005619779809635662,3,199,0.15710389691374949,1.0035263959350057e-05,149.25310363769532,COMPLETE
1983,0.35363996028900146,2023-09-04 22:25:54.545969,2023-09-04 22:25:55.123608,0 days 00:00:00.577639,ReLU,Leaky,Leaky,,46,21,12.0,6.0,,0.0073496136745083065,3,218,0.7515921163736149,0.0002289944020504681,333.0159266545222,COMPLETE
1984,0.30987057089805603,2023-09-04 22:25:55.124282,2023-09-04 22:25:56.830587,0 days 00:00:01.706305,ReLU,Leaky,Sigmoid,Leaky,32,19,23.0,7.0,5.0,0.0027629694585027697,4,206,0.422870624973609,0.00014599638558979245,152.25230193806587,COMPLETE
1985,0.5686458349227905,2023-09-04 22:25:56.831147,2023-09-04 22:26:00.793365,0 days 00:00:03.962218,Sigmoid,Tanh,Leaky,,39,20,13.0,23.0,,0.0001777560234066241,3,232,0.7119548999309581,4.565724262408473e-05,186.14115945224106,COMPLETE
1986,0.30379897356033325,2023-09-04 22:26:00.793892,2023-09-04 22:26:01.538735,0 days 00:00:00.744843,ReLU,Leaky,ReLU,,30,16,17.0,8.0,,0.00566876790597726,3,180,0.7701694862648475,2.5267512842879217e-05,143.1204394636483,COMPLETE
1987,0.2700729966163635,2023-09-04 22:26:01.539255,2023-09-04 22:26:03.135597,0 days 00:00:01.596342,ReLU,Leaky,Leaky,,36,19,11.0,22.0,,0.003743252744501704,3,78,0.7990931502292853,6.034259663618929e-05,121.42464959131529,COMPLETE
1988,0.34378331899642944,2023-09-04 22:26:03.136167,2023-09-04 22:26:03.500977,0 days 00:00:00.364810,ReLU,Leaky,Tanh,,44,20,22.0,9.0,,0.008988907014617029,3,192,0.22247768234451715,0.0002007875100970541,120.55958387586806,COMPLETE
1989,0.47308656573295593,2023-09-04 22:26:03.501514,2023-09-04 22:26:04.972323,0 days 00:00:01.470809,ReLU,Tanh,Leaky,Sigmoid,41,17,18.0,8.0,3.0,0.0007033570511999327,4,210,0.7412441202490202,0.0005302644887972595,181.12060324350992,COMPLETE
1990,0.3108345866203308,2023-09-04 22:26:04.972882,2023-09-04 22:26:06.806630,0 days 00:00:01.833748,Sigmoid,ReLU,ReLU,,28,19,21.0,24.0,,0.012043535396906615,3,225,0.7081899914980018,0.0013658861115801787,365.5400427793845,COMPLETE
1991,0.3751052916049957,2023-09-04 22:26:06.807167,2023-09-04 22:26:08.066174,0 days 00:00:01.259007,ReLU,Leaky,Sigmoid,,33,21,22.0,10.0,,0.003310811110492832,3,125,0.773438040596848,0.0002648898716317328,185.95565474660773,COMPLETE
1992,0.4354855418205261,2023-09-04 22:26:08.066729,2023-09-04 22:26:09.260317,0 days 00:00:01.193588,ReLU,Leaky,Leaky,,38,18,20.0,9.0,,0.0003784626463418529,3,69,0.6719739209143528,0.0008566647793202395,188.84414495938066,COMPLETE
1993,1.0079913139343262,2023-09-04 22:26:09.260864,2023-09-04 22:26:10.328087,0 days 00:00:01.067223,ReLU,Tanh,Leaky,Leaky,40,20,19.0,8.0,4.0,2.4428796501146872e-05,4,249,0.10533009343579469,3.108610166132122e-05,121.8808807618168,COMPLETE
1994,0.41689345240592957,2023-09-04 22:26:10.328710,2023-09-04 22:26:14.124975,0 days 00:00:03.796265,Sigmoid,Sigmoid,Leaky,,31,19,10.0,22.0,,0.0014830580150151248,3,167,0.7995049896684523,9.194515432308235e-05,184.9690658660706,COMPLETE
1995,0.4781341254711151,2023-09-04 22:26:14.125520,2023-09-04 22:26:14.559894,0 days 00:00:00.434374,ReLU,Leaky,ReLU,,35,20,14.0,6.0,,0.033443515723679894,3,198,0.49613865263803547,0.03272591703399263,244.57936096191406,COMPLETE
1996,0.4365120232105255,2023-09-04 22:26:14.560428,2023-09-04 22:26:14.808005,0 days 00:00:00.247577,ReLU,Leaky,Tanh,,43,18,21.0,23.0,,0.0143143159369786,3,189,0.10669354786598026,0.0007522829818539268,130.58891906738282,COMPLETE
1997,0.4484257698059082,2023-09-04 22:26:14.808623,2023-09-04 22:26:20.101520,0 days 00:00:05.292897,ReLU,Leaky,Leaky,,33,21,16.0,16.0,,6.771701128714668e-05,3,217,0.7439633068687345,1.7343288067573023e-05,203.15792614633585,COMPLETE
1998,1.0484280586242676,2023-09-04 22:26:20.102077,2023-09-04 22:26:20.939793,0 days 00:00:00.837716,Leaky,Tanh,Sigmoid,,29,19,24.0,23.0,,3.602365362461204e-05,3,238,0.3824345614222493,0.07128382708543535,100.48055947043679,COMPLETE
1999,0.5187432169914246,2023-09-04 22:26:20.940430,2023-09-04 22:26:21.500667,0 days 00:00:00.560237,Sigmoid,Leaky,Leaky,ReLU,59,20,23.0,14.0,6.0,0.0022059513013284533,4,356,0.1804957254830049,1.3198198006146528e-05,302.1153806882484,COMPLETE
