number,value,datetime_start,datetime_complete,duration,params_activation1,params_activation2,params_activation3,params_activation4,params_batch_size,params_fl1,params_fl2,params_fl3,params_fl4,params_learning_rate,params_n_layers,params_num_epochs,params_train_size,params_weight_decay,user_attrs_mre,state
381,0.3505302369594574,2023-09-04 21:58:32.012072,2023-09-04 21:58:32.390714,0 days 00:00:00.378642,Tanh,ReLU,,,21,21,13.0,,,0.004999452892415547,2,147,0.2896802391632502,1.3194122259547805e-05,148.06706438566508,COMPLETE
382,0.3620585799217224,2023-09-04 21:58:32.391025,2023-09-04 21:58:33.075564,0 days 00:00:00.684539,Tanh,ReLU,,,24,20,14.0,,,0.003914417042602223,2,151,0.7724946543536212,1.14163915488078e-05,99.47862752278645,COMPLETE
383,0.3199746608734131,2023-09-04 21:58:33.075913,2023-09-04 21:58:34.019587,0 days 00:00:00.943674,Tanh,ReLU,,,26,21,15.0,,,0.00593921235191018,2,173,0.5715103600835285,1.0305590635148143e-05,107.6884126663208,COMPLETE
384,0.291786253452301,2023-09-04 21:58:34.020193,2023-09-04 21:58:35.337820,0 days 00:00:01.317627,Tanh,ReLU,,,21,23,14.0,,,0.007504365297509178,2,160,0.7993793354739204,1.8123251825600726e-05,104.44946690609581,COMPLETE
385,0.34925752878189087,2023-09-04 21:58:35.338491,2023-09-04 21:58:36.196099,0 days 00:00:00.857608,Tanh,ReLU,,,18,21,13.0,,,0.003546582399312814,2,153,0.2738592300737469,1.3367764450501957e-05,101.32827235203163,COMPLETE
386,0.3912268877029419,2023-09-04 21:58:36.196856,2023-09-04 21:58:36.703073,0 days 00:00:00.506217,Tanh,ReLU,,,20,22,5.0,,,0.0020536946877062374,2,142,0.2578553417296017,1.617299064120378e-05,107.7273252275255,COMPLETE
387,0.36544838547706604,2023-09-04 21:58:36.703620,2023-09-04 21:58:39.049582,0 days 00:00:02.345962,Tanh,ReLU,,,23,20,8.0,,,0.0014073405485783698,2,168,0.7102724441529848,1.3968868128190764e-05,111.79645730991557,COMPLETE
388,0.3137987554073334,2023-09-04 21:58:39.049929,2023-09-04 21:58:40.031162,0 days 00:00:00.981233,Tanh,ReLU,,,16,20,15.0,,,0.005146746378217238,2,429,0.7674768950664973,1.2262871666409415e-05,86.40101623535156,COMPLETE
389,0.3444318473339081,2023-09-04 21:58:40.031512,2023-09-04 21:58:40.834778,0 days 00:00:00.803266,Tanh,ReLU,,,18,21,12.0,,,0.008528123166483907,2,180,0.48193136729252456,1.0102520107892241e-05,181.44251552847928,COMPLETE
390,0.4041596055030823,2023-09-04 21:58:40.835120,2023-09-04 21:58:41.885160,0 days 00:00:01.050040,Tanh,,,,91,2,,,,0.00670590317067904,1,152,0.7201090275710521,1.934102439571386e-05,109.22495105922623,COMPLETE
391,0.3219594955444336,2023-09-04 21:58:41.885474,2023-09-04 21:58:42.688236,0 days 00:00:00.802762,Tanh,ReLU,,,19,22,9.0,,,0.00976593779453515,2,168,0.6792234725490297,1.5176119703285434e-05,97.00057888031006,COMPLETE
392,0.31539326906204224,2023-09-04 21:58:42.688572,2023-09-04 21:58:44.549018,0 days 00:00:01.860446,Tanh,,,,21,22,,,,0.0036734255247568345,1,196,0.622904137905876,0.0009681089741635973,94.80858666073959,COMPLETE
393,0.30537664890289307,2023-09-04 21:58:44.549356,2023-09-04 21:58:45.639932,0 days 00:00:01.090576,Tanh,ReLU,,,16,21,14.0,,,0.0033228788867299425,2,159,0.7674024506230391,2.0909839434351303e-05,107.11166923276839,COMPLETE
394,0.3605309724807739,2023-09-04 21:58:45.640467,2023-09-04 21:58:47.772391,0 days 00:00:02.131924,Sigmoid,Leaky,,,32,21,5.0,,,0.002808507287063473,2,133,0.7437817517321539,1.2212908709764116e-05,99.23699984057197,COMPLETE
395,0.3512652516365051,2023-09-04 21:58:47.772813,2023-09-04 21:58:49.403002,0 days 00:00:01.630189,Tanh,ReLU,,,22,24,4.0,,,0.002350213338044088,2,176,0.7146810134270507,1.6926127412028336e-05,94.2825435931866,COMPLETE
396,0.3562798798084259,2023-09-04 21:58:49.403364,2023-09-04 21:58:49.875904,0 days 00:00:00.472540,Tanh,,,,70,20,,,,0.010002514827654563,1,146,0.7718561994744148,1.4391112127824173e-05,86.26208823067802,COMPLETE
397,0.34197551012039185,2023-09-04 21:58:49.876389,2023-09-04 21:58:50.289477,0 days 00:00:00.413088,Tanh,ReLU,,,35,20,15.0,,,0.01126596171215896,2,256,0.659137830345905,7.635903440129352e-05,100.31243432086447,COMPLETE
398,0.33455294370651245,2023-09-04 21:58:50.289815,2023-09-04 21:58:51.779176,0 days 00:00:01.489361,Tanh,Sigmoid,,,24,23,6.0,,,0.00544845014760629,2,169,0.7998935134154185,2.2873340453095565e-05,121.22707875569661,COMPLETE
399,0.33494800329208374,2023-09-04 21:58:51.779518,2023-09-04 21:58:54.269852,0 days 00:00:02.490334,Tanh,,,,27,12,,,,0.0007273315940266133,1,154,0.7440244474063543,1.0066140443238272e-05,85.83002481832133,COMPLETE
400,0.34327101707458496,2023-09-04 21:58:54.270174,2023-09-04 21:58:57.117009,0 days 00:00:02.846835,Tanh,ReLU,,,14,21,13.0,,,0.001103873067033733,2,141,0.6968812492071795,6.200720352582402e-05,118.67494132302024,COMPLETE
401,0.28655654191970825,2023-09-04 21:58:57.117323,2023-09-04 21:58:59.162085,0 days 00:00:02.044762,Tanh,Sigmoid,,,17,22,4.0,,,0.004443766790157859,2,250,0.7269192038752826,8.797393431108199e-05,103.97514608171251,COMPLETE
402,0.34092190861701965,2023-09-04 21:58:59.162411,2023-09-04 21:58:59.991916,0 days 00:00:00.829505,Tanh,Leaky,,,20,21,21.0,,,0.006834319431226097,2,73,0.7716372540904329,0.00032278824414745346,105.66180961362777,COMPLETE
403,0.3830382227897644,2023-09-04 21:58:59.992248,2023-09-04 21:59:01.119354,0 days 00:00:01.127106,Tanh,,,,34,11,,,,0.0017837004224948371,1,238,0.2924224938939145,0.00022159741838611674,545.9974714853231,COMPLETE
404,0.3093058466911316,2023-09-04 21:59:01.119695,2023-09-04 21:59:02.102565,0 days 00:00:00.982870,Tanh,Sigmoid,,,30,21,11.0,,,0.008491598504107451,2,85,0.6339567813175531,0.0006893967400238685,114.49311766077261,COMPLETE
405,0.3646961450576782,2023-09-04 21:59:02.102895,2023-09-04 21:59:02.913613,0 days 00:00:00.810718,Sigmoid,Sigmoid,,,37,19,10.0,,,0.012482255900650977,2,190,0.49819957566458384,0.00024396743163348407,101.2888764046334,COMPLETE
406,0.3547503352165222,2023-09-04 21:59:02.913935,2023-09-04 21:59:03.901432,0 days 00:00:00.987497,Tanh,,,,14,22,,,,0.006304380340694661,1,61,0.4222456124469639,1.437749302852685e-05,108.3964931300429,COMPLETE
407,0.300704687833786,2023-09-04 21:59:03.901749,2023-09-04 21:59:06.685643,0 days 00:00:02.783894,Tanh,Sigmoid,,,26,20,14.0,,,0.0031269120728050844,2,185,0.6861703076008019,1.7897483644778216e-05,111.67953803804185,COMPLETE
408,0.3142191469669342,2023-09-04 21:59:06.686054,2023-09-04 21:59:07.166822,0 days 00:00:00.480768,Leaky,ReLU,,,87,13,3.0,,,0.007992352366386811,2,160,0.7434729200265024,0.004502021244689582,116.40020972031813,COMPLETE
409,0.33322522044181824,2023-09-04 21:59:07.167132,2023-09-04 21:59:08.019583,0 days 00:00:00.852451,Tanh,,,,18,20,,,,0.010206788122451032,1,92,0.5977015393934092,2.626872703525117e-05,118.20894788659137,COMPLETE
410,0.3371708393096924,2023-09-04 21:59:08.019916,2023-09-04 21:59:08.753182,0 days 00:00:00.733266,Tanh,Sigmoid,,,22,21,7.0,,,0.016167168530516585,2,77,0.4691628152110577,0.0004441711590806719,107.9868918524848,COMPLETE
411,0.3367043435573578,2023-09-04 21:59:08.753522,2023-09-04 21:59:09.606109,0 days 00:00:00.852587,Tanh,Sigmoid,,,79,21,8.0,,,0.005434471901346437,2,168,0.7709470203137828,5.229769942165952e-05,94.962737013654,COMPLETE
412,0.32477468252182007,2023-09-04 21:59:09.606434,2023-09-04 21:59:10.486101,0 days 00:00:00.879667,Tanh,,,,12,22,,,,0.012495926493611283,1,136,0.7145354251844954,1.2477003926298933e-05,101.93834441048759,COMPLETE
413,0.2764677405357361,2023-09-04 21:59:10.486492,2023-09-04 21:59:11.332769,0 days 00:00:00.846277,Tanh,Sigmoid,,,20,23,5.0,,,0.019183643308144434,2,67,0.7430737728364828,6.754498749825172e-05,90.79834205873551,COMPLETE
414,0.39285656809806824,2023-09-04 21:59:11.333149,2023-09-04 21:59:12.683169,0 days 00:00:01.350020,Tanh,Sigmoid,,,19,24,5.0,,,0.0006361683459625682,2,56,0.6485396871043947,7.178425281960281e-05,124.71067660195487,COMPLETE
415,0.3418132960796356,2023-09-04 21:59:12.683513,2023-09-04 21:59:13.519909,0 days 00:00:00.836396,Tanh,Sigmoid,,,20,23,6.0,,,0.020302563766967728,2,265,0.6844767826604544,0.000931284501503928,190.45569745232078,COMPLETE
416,0.31918883323669434,2023-09-04 21:59:13.520281,2023-09-04 21:59:14.516665,0 days 00:00:00.996384,Tanh,Sigmoid,,,23,23,5.0,,,0.0048432910217674945,2,65,0.7212270079105164,0.00017068967111894494,119.67239450853924,COMPLETE
417,0.35675498843193054,2023-09-04 21:59:14.517007,2023-09-04 21:59:15.199981,0 days 00:00:00.682974,Tanh,Sigmoid,,,17,23,6.0,,,0.04500874245332883,2,226,0.7488185923798931,9.556219305312088e-05,90.91179656982422,COMPLETE
418,0.3685430586338043,2023-09-04 21:59:15.200322,2023-09-04 21:59:18.716001,0 days 00:00:03.515679,Tanh,Sigmoid,,,21,23,4.0,,,0.0002725355651242154,2,150,0.6990757996030672,0.00041110564987805246,125.56521143595377,COMPLETE
419,0.3740428388118744,2023-09-04 21:59:18.716360,2023-09-04 21:59:19.053342,0 days 00:00:00.336982,Tanh,Sigmoid,,,16,24,15.0,,,0.07493236037162578,2,245,0.32134686654230826,0.001393840048109611,109.24128757823597,COMPLETE
420,0.3993624746799469,2023-09-04 21:59:19.053672,2023-09-04 21:59:20.423486,0 days 00:00:01.369814,Tanh,Sigmoid,,,24,22,5.0,,,0.0004269955803567073,2,125,0.34655135241768686,0.0005195677159762573,138.2759288330078,COMPLETE
421,0.3137035071849823,2023-09-04 21:59:20.423858,2023-09-04 21:59:22.384447,0 days 00:00:01.960589,Tanh,Sigmoid,,,15,24,4.0,,,0.0014680384698479198,2,66,0.6637181735108902,6.962162364896e-05,112.3281557487719,COMPLETE
422,0.34693190455436707,2023-09-04 21:59:22.384784,2023-09-04 21:59:23.033689,0 days 00:00:00.648905,Tanh,Sigmoid,,,18,22,14.0,,,0.0064739383699685725,2,82,0.3027668062626357,1.0015554207438511e-05,360.2475357055664,COMPLETE
423,0.3622555732727051,2023-09-04 21:59:23.034044,2023-09-04 21:59:25.546298,0 days 00:00:02.512254,Tanh,ReLU,,,21,23,4.0,,,0.0009345801894692874,2,172,0.7464603699296589,0.00011371675889392588,118.57389778665977,COMPLETE
424,0.3033311665058136,2023-09-04 21:59:25.546671,2023-09-04 21:59:27.419538,0 days 00:00:01.872867,Sigmoid,Sigmoid,,,13,22,16.0,,,0.029235162226090988,2,56,0.7172665570713326,1.8374733427613395e-05,101.78388786315918,COMPLETE
425,0.4692915678024292,2023-09-04 21:59:27.419891,2023-09-04 21:59:30.818059,0 days 00:00:03.398168,Tanh,Sigmoid,Tanh,,19,21,22.0,3.0,,3.156322002224167e-05,3,208,0.36667897723242876,1.2191346715008755e-05,100.0992173414964,COMPLETE
426,0.3790757358074188,2023-09-04 21:59:30.818409,2023-09-04 21:59:31.442626,0 days 00:00:00.624217,Tanh,Sigmoid,Sigmoid,Sigmoid,83,21,5.0,16.0,15.0,0.009001103230849053,4,183,0.39633286242695254,0.0007891813243879827,119.26281554123452,COMPLETE
427,0.3435240387916565,2023-09-04 21:59:31.442981,2023-09-04 21:59:32.104593,0 days 00:00:00.661612,Tanh,ReLU,,,45,14,11.0,,,0.016066418597440502,2,291,0.7727345288471379,0.012108105774810038,100.78906458074397,COMPLETE
428,0.33773812651634216,2023-09-04 21:59:32.105079,2023-09-04 21:59:32.451161,0 days 00:00:00.346082,Tanh,Sigmoid,,,25,20,15.0,,,0.02289303856085585,2,101,0.3747424809439554,8.509219068223345e-05,394.5599681712963,COMPLETE
429,0.3094754219055176,2023-09-04 21:59:32.451507,2023-09-04 21:59:33.359593,0 days 00:00:00.908086,Tanh,Sigmoid,Leaky,Tanh,17,24,20.0,11.0,20.0,0.011336071694281706,4,231,0.5385126134404268,2.2474505149136895e-05,96.6334868839809,COMPLETE
430,0.29929906129837036,2023-09-04 21:59:33.360077,2023-09-04 21:59:34.893817,0 days 00:00:01.533740,Tanh,Sigmoid,,,15,23,6.0,,,0.004138639060899868,2,50,0.6755488411633715,1.5008707410513274e-05,109.81532623291015,COMPLETE
431,0.2632155120372772,2023-09-04 21:59:34.894177,2023-09-04 21:59:35.943511,0 days 00:00:01.049334,Tanh,ReLU,Leaky,,67,15,3.0,7.0,,0.03285076297890755,3,156,0.796568640948815,6.207524416510947e-05,99.10479536056519,COMPLETE
432,0.30093279480934143,2023-09-04 21:59:35.943860,2023-09-04 21:59:36.486168,0 days 00:00:00.542308,Tanh,ReLU,Leaky,,60,15,3.0,7.0,,0.034793658517258484,3,165,0.7987513727862808,0.001072118252739941,103.98598543802898,COMPLETE
433,0.3656087815761566,2023-09-04 21:59:36.486518,2023-09-04 21:59:37.032353,0 days 00:00:00.545835,Tanh,ReLU,Leaky,,22,15,13.0,8.0,,0.0359502693389456,3,73,0.25047820786869307,0.0002953784604910128,149.19480372410194,COMPLETE
434,0.3433668613433838,2023-09-04 21:59:37.032701,2023-09-04 21:59:37.631772,0 days 00:00:00.599071,Tanh,ReLU,Leaky,,58,15,2.0,4.0,,0.05610700288185837,3,197,0.7685019719127469,0.002199410891010798,122.13081043522533,COMPLETE
435,0.33615773916244507,2023-09-04 21:59:37.632159,2023-09-04 21:59:40.717663,0 days 00:00:03.085504,Tanh,ReLU,Leaky,,11,14,3.0,6.0,,0.03419667750243294,3,92,0.7989819303731337,6.316629263262405e-05,82.18935026945891,COMPLETE
436,0.3090411126613617,2023-09-04 21:59:40.718022,2023-09-04 21:59:41.297311,0 days 00:00:00.579289,Tanh,ReLU,Leaky,,65,22,7.0,8.0,,0.03148173846604188,3,156,0.7463242555768467,0.00011361154792824086,98.08189853402071,COMPLETE
437,0.30329135060310364,2023-09-04 21:59:41.297716,2023-09-04 21:59:43.184644,0 days 00:00:01.886928,Tanh,ReLU,Leaky,,20,14,1.0,5.0,,0.023300488503367422,3,81,0.7645992922851855,0.00014462622016254436,121.77754513970737,COMPLETE
438,0.34529614448547363,2023-09-04 21:59:43.185005,2023-09-04 21:59:43.491844,0 days 00:00:00.306839,Tanh,ReLU,Leaky,,57,15,14.0,1.0,,0.04094132617681788,3,177,0.2725284777093232,8.077561911850517e-05,341.007183464206,COMPLETE
439,0.31987783312797546,2023-09-04 21:59:43.492211,2023-09-04 21:59:44.263754,0 days 00:00:00.771543,Tanh,Leaky,Tanh,,24,21,9.0,7.0,,0.02796621243273444,3,95,0.5624463648111505,1.2108873481664218e-05,104.27560692864495,COMPLETE
440,0.35088613629341125,2023-09-04 21:59:44.264123,2023-09-04 21:59:44.917741,0 days 00:00:00.653618,Tanh,ReLU,,,28,22,17.0,,,0.006968091006021515,2,147,0.4179650603669727,0.0003585375996525415,144.64940000047872,COMPLETE
441,0.33470603823661804,2023-09-04 21:59:44.918120,2023-09-04 21:59:45.436682,0 days 00:00:00.518562,Tanh,Tanh,Leaky,,63,16,23.0,9.0,,0.02539764170834641,3,105,0.732705907773464,2.9537813309522904e-05,104.12124803331163,COMPLETE
442,0.3034052848815918,2023-09-04 21:59:45.437043,2023-09-04 21:59:46.780094,0 days 00:00:01.343051,Tanh,ReLU,,,13,21,12.0,,,0.019348822200103782,2,65,0.7758660149395208,0.00018552727251307051,96.63524913787842,COMPLETE
443,0.34310296177864075,2023-09-04 21:59:46.780493,2023-09-04 21:59:49.989842,0 days 00:00:03.209349,Leaky,ReLU,,,17,14,10.0,,,0.00047505758703039817,2,159,0.7118074658305287,9.781370750448681e-05,114.81448780406605,COMPLETE
444,0.3885035812854767,2023-09-04 21:59:49.990232,2023-09-04 21:59:51.029680,0 days 00:00:01.039448,Sigmoid,Sigmoid,Leaky,,19,24,13.0,6.0,,0.00556028416095498,3,88,0.354614280562198,1.630320263001363e-05,593.2879262288411,COMPLETE
445,0.3225294351577759,2023-09-04 21:59:51.030041,2023-09-04 21:59:52.360676,0 days 00:00:01.330635,Tanh,Tanh,,,55,22,21.0,,,0.00202704890418643,2,138,0.7439709528741394,1.9167052353945097e-05,90.02208251953125,COMPLETE
446,0.38394975662231445,2023-09-04 21:59:52.361034,2023-09-04 21:59:52.523371,0 days 00:00:00.162337,Tanh,ReLU,,,67,15,15.0,,,0.04725721428175691,2,239,0.45213216425384173,0.0006119918847505241,91.70058620677275,COMPLETE
447,0.40168461203575134,2023-09-04 21:59:52.523718,2023-09-04 21:59:52.884567,0 days 00:00:00.360849,Tanh,Sigmoid,Sigmoid,,60,23,3.0,2.0,,0.0074798574911014975,3,74,0.19671850789270742,5.7658098538148896e-05,128.47020082216005,COMPLETE
448,0.34860843420028687,2023-09-04 21:59:52.884963,2023-09-04 21:59:54.727121,0 days 00:00:01.842158,Tanh,Sigmoid,,,22,13,14.0,,,0.0029273533641773174,2,119,0.7985425248706732,1.3155238624887247e-05,118.38170634998994,COMPLETE
449,0.337012380361557,2023-09-04 21:59:54.727547,2023-09-04 21:59:55.481273,0 days 00:00:00.753726,Tanh,Sigmoid,,,69,20,22.0,,,0.009094144632304839,2,181,0.7995351999193727,3.612544931670672e-05,104.19326605115619,COMPLETE
450,0.34258130192756653,2023-09-04 21:59:55.481828,2023-09-04 21:59:56.909963,0 days 00:00:01.428135,Tanh,ReLU,,,10,21,6.0,,,0.014404742110143526,2,166,0.7545076419721382,4.73488725144569e-05,155.15744127546037,COMPLETE
451,0.49325090646743774,2023-09-04 21:59:56.910444,2023-09-04 22:00:01.012275,0 days 00:00:04.101831,Tanh,Sigmoid,Leaky,,15,16,14.0,4.0,,5.0007384452882016e-05,3,101,0.7052862212345616,6.959798770341293e-05,115.81556520367613,COMPLETE
452,0.3447894752025604,2023-09-04 22:00:01.012660,2023-09-04 22:00:01.412376,0 days 00:00:00.399716,Tanh,Tanh,,,26,20,10.0,,,0.027826006033363486,2,221,0.43778555923550044,0.00024366481303381406,123.7632476261684,COMPLETE
453,0.28528091311454773,2023-09-04 22:00:01.412811,2023-09-04 22:00:01.820429,0 days 00:00:00.407618,Tanh,Sigmoid,,,51,22,16.0,,,0.07517223803428962,2,249,0.7316502288427561,2.2790111776367506e-05,100.05875015258789,COMPLETE
454,0.31076139211654663,2023-09-04 22:00:01.820777,2023-09-04 22:00:02.528038,0 days 00:00:00.707261,Tanh,Leaky,,,20,21,20.0,,,0.0418912372274213,2,203,0.7701097633083489,1.0158816564679212e-05,98.34886741638184,COMPLETE
455,0.9492064118385315,2023-09-04 22:00:02.528367,2023-09-04 22:00:03.309608,0 days 00:00:00.781241,Sigmoid,Sigmoid,Leaky,,12,14,2.0,7.0,,0.00021420604548698518,3,86,0.11683473862476089,0.00014956438540154738,105.97984544620958,COMPLETE
456,0.33051955699920654,2023-09-04 22:00:03.309984,2023-09-04 22:00:05.074110,0 days 00:00:01.764126,Tanh,ReLU,,,17,21,13.0,,,0.019630144385599586,2,62,0.4943234799401366,1.4309098221682081e-05,118.56905275980631,COMPLETE
457,0.36770737171173096,2023-09-04 22:00:05.075013,2023-09-04 22:00:05.826004,0 days 00:00:00.750991,Tanh,Sigmoid,,,23,20,8.0,,,0.004523742015516361,2,158,0.32521551928271675,5.2405145350858666e-05,217.61920514023095,COMPLETE
458,0.336509108543396,2023-09-04 22:00:05.826428,2023-09-04 22:00:06.560730,0 days 00:00:00.734302,Tanh,Sigmoid,,,14,22,4.0,,,0.010248044682805357,2,113,0.29030907561139724,8.342477639762377e-05,113.25333840506417,COMPLETE
459,0.37702134251594543,2023-09-04 22:00:06.561198,2023-09-04 22:00:07.292355,0 days 00:00:00.731157,Tanh,Sigmoid,Leaky,,94,23,5.0,5.0,,0.0023664101204204572,3,79,0.624719902062505,1.1532136938914424e-05,116.43776335897324,COMPLETE
460,0.37841981649398804,2023-09-04 22:00:07.292811,2023-09-04 22:00:09.527533,0 days 00:00:02.234722,Tanh,ReLU,,,21,10,7.0,,,0.0008588285498853821,2,175,0.5889439903416073,0.00010547564908798477,99.63005896374187,COMPLETE
461,0.36519020795822144,2023-09-04 22:00:09.527925,2023-09-04 22:00:10.234684,0 days 00:00:00.706759,Tanh,Tanh,,,18,15,3.0,,,0.006061996239264012,2,92,0.3453757769910147,0.00019510549581977776,119.92252212524414,COMPLETE
462,0.4332355558872223,2023-09-04 22:00:10.235119,2023-09-04 22:00:20.876161,0 days 00:00:10.641042,Tanh,Sigmoid,Leaky,,15,21,15.0,3.0,,8.779015250560755e-05,3,189,0.6972977815196115,1.6201490617119264e-05,108.22930306732339,COMPLETE
463,0.2937087416648865,2023-09-04 22:00:20.876865,2023-09-04 22:00:22.431212,0 days 00:00:01.554347,Tanh,Sigmoid,,,72,14,14.0,,,0.06061660777861829,2,229,0.7361289535066564,6.2903606312411e-05,90.08855827181947,COMPLETE
464,0.2533119022846222,2023-09-04 22:00:22.431911,2023-09-04 22:00:24.065059,0 days 00:00:01.633148,Tanh,ReLU,,,41,20,9.0,,,0.0129347373284415,2,143,0.7749406333230364,2.7280756461451072e-05,117.7451178414481,COMPLETE
465,0.28595584630966187,2023-09-04 22:00:24.065647,2023-09-04 22:00:25.902062,0 days 00:00:01.836415,Leaky,Sigmoid,,,42,20,10.0,,,0.011653229944685529,2,124,0.7711851297458204,2.702346732787653e-05,82.3383552914574,COMPLETE
466,0.2958466112613678,2023-09-04 22:00:25.902675,2023-09-04 22:00:27.406790,0 days 00:00:01.504115,Tanh,,,,39,13,,,,0.013478883775479797,1,136,0.7692669336202191,3.072262117544896e-05,95.54741668701172,COMPLETE
467,0.32142242789268494,2023-09-04 22:00:27.407467,2023-09-04 22:00:28.519357,0 days 00:00:01.111890,Tanh,Sigmoid,,,40,19,9.0,,,0.015877523790670697,2,143,0.7987415065042579,2.3188100880715743e-05,102.20305299758911,COMPLETE
468,0.3347133696079254,2023-09-04 22:00:28.519990,2023-09-04 22:00:29.502464,0 days 00:00:00.982474,Tanh,ReLU,Tanh,,44,20,8.0,2.0,,0.018412966344802276,3,150,0.7441313624855082,3.759580457163357e-05,107.44461822509766,COMPLETE
469,0.34776967763900757,2023-09-04 22:00:29.503177,2023-09-04 22:00:30.533672,0 days 00:00:01.030495,Sigmoid,Sigmoid,,,37,8,9.0,,,0.013201499752580682,2,132,0.40809078077088934,4.445017274777407e-05,197.37148987300813,COMPLETE
470,0.401685893535614,2023-09-04 22:00:30.534317,2023-09-04 22:00:30.864897,0 days 00:00:00.330580,Tanh,Tanh,,,42,24,19.0,,,0.022291816970371327,2,108,0.2101030792874356,2.038269744823677e-05,114.06441083635603,COMPLETE
471,0.35637250542640686,2023-09-04 22:00:30.865642,2023-09-04 22:00:35.015028,0 days 00:00:04.149386,Tanh,Sigmoid,Leaky,,41,20,8.0,6.0,,0.001356899884292881,3,143,0.7715262860386501,2.802315127554553e-05,104.41083269119262,COMPLETE
472,0.3196350038051605,2023-09-04 22:00:35.016113,2023-09-04 22:00:35.877014,0 days 00:00:00.860901,Tanh,Sigmoid,,,38,19,10.0,,,0.032128228769610266,2,126,0.7211522598431477,0.0008329198684932711,100.15100562054178,COMPLETE
473,0.37930503487586975,2023-09-04 22:00:35.881160,2023-09-04 22:00:36.785156,0 days 00:00:00.903996,Tanh,,,,40,14,,,,0.010436082474242188,1,152,0.3323122423770043,0.0001253684814809929,196.675229879526,COMPLETE
474,0.34640389680862427,2023-09-04 22:00:36.785997,2023-09-04 22:00:37.393229,0 days 00:00:00.607232,Tanh,ReLU,,,36,15,9.0,,,0.024545154035361092,2,70,0.2250745221458048,0.004185578895851911,110.04947591382404,COMPLETE
475,0.39255085587501526,2023-09-04 22:00:37.394056,2023-09-04 22:00:38.976574,0 days 00:00:01.582518,Tanh,Sigmoid,Leaky,,12,20,12.0,4.0,,0.00829219007039712,3,213,0.2556869565016707,5.2038910837755925e-05,119.81299654642741,COMPLETE
476,0.3218253552913666,2023-09-04 22:00:38.977230,2023-09-04 22:00:40.289849,0 days 00:00:01.312619,Tanh,Sigmoid,,,46,19,11.0,,,0.017327129092908677,2,98,0.7998333391146702,0.0012395391192068647,148.89854669570923,COMPLETE
477,0.42027559876441956,2023-09-04 22:00:40.290509,2023-09-04 22:00:43.207499,0 days 00:00:02.916990,Tanh,,,,62,13,,,,0.000682318979539413,1,115,0.7381710951343656,3.355656627536227e-05,127.0858678403108,COMPLETE
