number,value,datetime_start,datetime_complete,duration,params_activation1,params_activation2,params_activation3,params_activation4,params_batch_size,params_fl1,params_fl2,params_fl3,params_fl4,params_learning_rate,params_n_layers,params_num_epochs,params_train_size,params_weight_decay,user_attrs_mre,state
1448,0.5195974111557007,2023-09-04 21:35:08.847210,2023-09-04 21:35:11.247841,0 days 00:00:02.400631,Tanh,Leaky,Tanh,,86,20,9.0,16.0,,4.1079378158559145e-05,3,226,0.7232837044940821,0.00019547693172025917,274.0002521076034,COMPLETE
1449,0.24187041819095612,2023-09-04 21:35:11.248301,2023-09-04 21:35:11.677400,0 days 00:00:00.429099,Tanh,ReLU,,,82,17,12.0,,,0.012159026434416294,2,373,0.7500708998204132,0.00011371525990746033,168.10754013061523,COMPLETE
1450,0.3754316568374634,2023-09-04 21:35:11.677849,2023-09-04 21:35:12.139528,0 days 00:00:00.461679,Tanh,ReLU,,,85,17,12.0,,,0.01157382120585715,2,359,0.6721074552661528,8.859149506939965e-05,2019.0684839365433,COMPLETE
1451,0.2974197566509247,2023-09-04 21:35:12.139990,2023-09-04 21:35:12.701459,0 days 00:00:00.561469,ReLU,ReLU,,,83,16,13.0,,,0.01086154298050763,2,379,0.693420337499747,6.988365747519262e-05,661.0910680135091,COMPLETE
1452,0.3641083836555481,2023-09-04 21:35:12.701933,2023-09-04 21:35:13.078454,0 days 00:00:00.376521,Tanh,ReLU,,,83,17,13.0,,,0.009929948911004429,2,146,0.6260095022510624,0.00010749731177667963,163.6623847961426,COMPLETE
1453,0.36285942792892456,2023-09-04 21:35:13.078919,2023-09-04 21:35:13.571946,0 days 00:00:00.493027,Tanh,ReLU,,,81,17,12.0,,,0.013018082729193867,2,370,0.5598643248090255,9.534925264808447e-05,121.99609514872233,COMPLETE
1454,0.5574862360954285,2023-09-04 21:35:13.572406,2023-09-04 21:35:13.764514,0 days 00:00:00.192108,Tanh,ReLU,,,84,16,12.0,,,0.009058180894616331,2,378,0.112258352837232,0.0001168879462487064,151.32962382923472,COMPLETE
1455,0.26716506481170654,2023-09-04 21:35:13.764977,2023-09-04 21:35:14.428087,0 days 00:00:00.663110,Tanh,ReLU,Leaky,,83,21,12.0,14.0,,0.007658513134994032,3,406,0.7142498897906404,7.537385067789177e-05,215.56583140446588,COMPLETE
1456,0.3257392942905426,2023-09-04 21:35:14.428551,2023-09-04 21:35:15.524509,0 days 00:00:01.095958,Tanh,ReLU,,,82,17,13.0,,,0.00189102177006073,2,387,0.5047395541170038,4.876143074513503e-05,182.06394345419747,COMPLETE
1457,0.36903706192970276,2023-09-04 21:35:15.524975,2023-09-04 21:35:15.977899,0 days 00:00:00.452924,ReLU,ReLU,,,81,17,12.0,,,0.011979853112663736,2,366,0.525886126099755,0.00012157254574758633,461.63089933849517,COMPLETE
1458,0.5047426223754883,2023-09-04 21:35:15.978776,2023-09-04 21:35:16.248241,0 days 00:00:00.269465,Tanh,ReLU,,,80,17,11.0,,,0.004272741403925163,2,388,0.13537335939112508,9.251500998496184e-05,804.8207286487926,COMPLETE
1459,0.5282480716705322,2023-09-04 21:35:16.248728,2023-09-04 21:35:16.410747,0 days 00:00:00.162019,Tanh,ReLU,,,86,16,12.0,,,0.014531687571632321,2,377,0.1242196990197977,6.232934239692435e-05,333.69372994559154,COMPLETE
1460,0.3398459851741791,2023-09-04 21:35:16.411219,2023-09-04 21:35:16.757224,0 days 00:00:00.346005,Tanh,ReLU,,,82,17,13.0,,,0.048919579148891536,2,352,0.7399723070314431,0.0001130922754753333,393.8589624865302,COMPLETE
1461,0.35330909490585327,2023-09-04 21:35:16.757689,2023-09-04 21:35:17.161409,0 days 00:00:00.403720,Tanh,ReLU,Sigmoid,,85,15,12.0,10.0,,0.038811840959859054,3,371,0.5781634705051473,0.00013572651504954587,193.30248123560196,COMPLETE
1462,0.33315643668174744,2023-09-04 21:35:17.161873,2023-09-04 21:35:19.432657,0 days 00:00:02.270784,Tanh,ReLU,,,80,8,12.0,,,0.0008586308493402403,2,397,0.6975475243639087,8.111134404047279e-05,9073.765706079912,COMPLETE
1463,0.4502720236778259,2023-09-04 21:35:19.433139,2023-09-04 21:35:20.314922,0 days 00:00:00.881783,Tanh,ReLU,,,89,17,12.0,,,0.00029852651964306384,2,364,0.3693098818311625,0.00013798962206620316,294.80883433901033,COMPLETE
1464,0.37570998072624207,2023-09-04 21:35:20.315399,2023-09-04 21:35:20.729273,0 days 00:00:00.413874,Sigmoid,ReLU,,,84,17,11.0,,,0.06714438080491193,2,397,0.7446912777279359,0.00010451255085473718,140.17032964606034,COMPLETE
1465,0.5644680261611938,2023-09-04 21:35:20.729741,2023-09-04 21:35:21.082523,0 days 00:00:00.352782,ReLU,ReLU,Sigmoid,,79,16,12.0,5.0,,0.016293805776795837,3,370,0.1977208576357127,1.0187329278213775e-05,152.9553699028201,COMPLETE
1466,0.3443012833595276,2023-09-04 21:35:21.082992,2023-09-04 21:35:21.909245,0 days 00:00:00.826253,Tanh,ReLU,,,82,17,11.0,,,0.011727965850002058,2,140,0.6707483024438504,4.050173963916104e-05,158.6883958515368,COMPLETE
1467,0.3909637928009033,2023-09-04 21:35:21.909715,2023-09-04 21:35:22.313432,0 days 00:00:00.403717,Tanh,ReLU,,,87,18,13.0,,,0.07598616028579197,2,388,0.1577523344804292,0.0001560575464978955,136.42028268178305,COMPLETE
1468,0.6141325831413269,2023-09-04 21:35:22.314285,2023-09-04 21:35:22.851112,0 days 00:00:00.536827,Tanh,ReLU,,,79,17,11.0,,,0.003321948650454601,2,340,0.3125163078375316,0.08919664409305315,456.66543209191525,COMPLETE
1469,0.3243061602115631,2023-09-04 21:35:22.852009,2023-09-04 21:35:23.945162,0 days 00:00:01.093153,Tanh,ReLU,,,84,16,12.0,,,0.03004273526415423,2,353,0.7226137654261023,0.005730363266201454,153.7099752223238,COMPLETE
1470,0.3377086818218231,2023-09-04 21:35:23.945600,2023-09-04 21:35:24.277313,0 days 00:00:00.331713,Tanh,ReLU,ReLU,,81,15,11.0,4.0,,0.057561292732660696,3,411,0.6514638059778621,1.0122715077389047e-05,353.9626781757061,COMPLETE
1471,0.3169247806072235,2023-09-04 21:35:24.277783,2023-09-04 21:35:24.698036,0 days 00:00:00.420253,Tanh,ReLU,,,78,17,12.0,,,0.01388210705164644,2,380,0.7657843046879471,0.0034370311559343645,161.34246232774524,COMPLETE
1472,0.278469443321228,2023-09-04 21:35:24.698497,2023-09-04 21:35:25.221808,0 days 00:00:00.523311,ReLU,ReLU,,,81,18,22.0,,,0.04087487306403371,2,372,0.7522119437977585,0.011824816800915362,309.2645431518555,COMPLETE
1473,1.1194279193878174,2023-09-04 21:35:25.222265,2023-09-04 21:35:26.375529,0 days 00:00:01.153264,Tanh,ReLU,,,78,18,11.0,,,1.084629551123059e-05,2,128,0.7064415491123572,0.006633978154065961,138.48550236225128,COMPLETE
1474,0.8760099411010742,2023-09-04 21:35:26.376001,2023-09-04 21:35:26.944862,0 days 00:00:00.568861,Tanh,ReLU,,,85,20,21.0,,,2.089108221478599e-05,2,152,0.2540412204574984,1.355441834692033e-05,117.68014134858784,COMPLETE
1475,0.5171995162963867,2023-09-04 21:35:26.945317,2023-09-04 21:35:27.369233,0 days 00:00:00.423916,Tanh,Sigmoid,Sigmoid,,82,19,13.0,18.0,,0.004998970356501002,3,332,0.22330872425025944,0.00011589348104303013,237.9470490559493,COMPLETE
1476,0.4748570919036865,2023-09-04 21:35:27.369728,2023-09-04 21:35:28.385586,0 days 00:00:01.015858,Tanh,ReLU,,,79,17,11.0,,,0.00028082038538583483,2,395,0.29280026927502667,8.875316315736935e-05,351.91736282037226,COMPLETE
1477,0.457529753446579,2023-09-04 21:35:28.386084,2023-09-04 21:35:28.893076,0 days 00:00:00.506992,Tanh,Leaky,,,88,18,14.0,,,0.006770542996161093,2,356,0.7725992243422966,0.05022489390114503,563.7427984873453,COMPLETE
1478,0.34155604243278503,2023-09-04 21:35:28.893543,2023-09-04 21:35:31.148290,0 days 00:00:02.254747,Tanh,Sigmoid,,,77,20,10.0,,,0.0006301403908590934,2,385,0.7383401464247458,0.00015027242359574188,451.4352271370266,COMPLETE
1479,0.32885193824768066,2023-09-04 21:35:31.149155,2023-09-04 21:35:32.387945,0 days 00:00:01.238790,Tanh,ReLU,,,83,16,24.0,,,0.0011360940998012697,2,360,0.3202735153103869,0.00012884851436796455,124.47172242337048,COMPLETE
1480,0.5267043113708496,2023-09-04 21:35:32.388555,2023-09-04 21:35:32.703178,0 days 00:00:00.314623,ReLU,Sigmoid,Tanh,,52,18,23.0,9.0,,0.016566895561258597,3,405,0.7703726903089785,0.0040104541008720825,319.9798095703125,COMPLETE
1481,0.3386167883872986,2023-09-04 21:35:32.703797,2023-09-04 21:35:33.307886,0 days 00:00:00.604089,Tanh,ReLU,,,86,17,23.0,,,0.006137549155769537,2,347,0.7994779494278856,6.645690300365585e-05,163.57719394616913,COMPLETE
1482,0.38404718041419983,2023-09-04 21:35:33.308443,2023-09-04 21:35:33.895067,0 days 00:00:00.586624,Tanh,,,,80,21,,,,0.009615549215256225,1,311,0.6102319992373775,9.745909139670341e-05,152.41232676786535,COMPLETE
1483,0.3391304910182953,2023-09-04 21:35:33.895545,2023-09-04 21:35:34.205956,0 days 00:00:00.310411,Tanh,ReLU,,,80,19,12.0,,,0.09929920461120598,2,284,0.691776484041903,0.00016761363791757182,155.32900209780092,COMPLETE
1484,0.43279409408569336,2023-09-04 21:35:34.206549,2023-09-04 21:35:35.054652,0 days 00:00:00.848103,Sigmoid,Leaky,,,84,6,11.0,,,0.002533602480383508,2,324,0.30755659425412984,5.477532587896646e-05,675.607407534564,COMPLETE
1485,0.31500715017318726,2023-09-04 21:35:35.055247,2023-09-04 21:35:35.425031,0 days 00:00:00.369784,Tanh,Sigmoid,,,90,17,24.0,,,0.03160386943480966,2,303,0.4483233407068162,0.0001125438990978256,114.36464358243076,COMPLETE
1486,0.32536980509757996,2023-09-04 21:35:35.425574,2023-09-04 21:35:36.353504,0 days 00:00:00.927930,Tanh,ReLU,,,77,12,19.0,,,0.001671976676612176,2,264,0.43786934943713574,0.00014390157750191827,153.51033416351714,COMPLETE
1487,0.9671635627746582,2023-09-04 21:35:36.353973,2023-09-04 21:35:37.077735,0 days 00:00:00.723762,ReLU,Sigmoid,Sigmoid,,82,16,10.0,6.0,,0.00011411357965453834,3,291,0.723180210117258,0.04787560045954993,148.3181178166316,COMPLETE
1488,0.5233978033065796,2023-09-04 21:35:37.078223,2023-09-04 21:35:37.266686,0 days 00:00:00.188463,Tanh,ReLU,,,57,18,11.0,,,0.019648659133323615,2,157,0.17855674877932337,0.0021484005243228924,112.80201374400745,COMPLETE
1489,0.36400914192199707,2023-09-04 21:35:37.267151,2023-09-04 21:35:37.625792,0 days 00:00:00.358641,Tanh,Leaky,,,78,19,13.0,,,0.026283903258409232,2,277,0.4932353727386372,7.748452460343592e-05,280.72471000052786,COMPLETE
1490,0.37008219957351685,2023-09-04 21:35:37.626659,2023-09-04 21:35:43.487454,0 days 00:00:05.860795,Tanh,ReLU,Leaky,,80,17,23.0,2.0,,0.0005068136629299676,3,315,0.5355727774861987,0.015524603856741233,155.56158735487196,COMPLETE
1491,0.28076666593551636,2023-09-04 21:35:43.488351,2023-09-04 21:35:45.267800,0 days 00:00:01.779449,Tanh,Sigmoid,,,40,18,10.0,,,0.013032965175148967,2,266,0.7543607637295558,0.00017285893388413354,169.16408674684288,COMPLETE
1492,0.30413690209388733,2023-09-04 21:35:45.268289,2023-09-04 21:35:45.581357,0 days 00:00:00.313068,Tanh,ReLU,,,76,17,18.0,,,0.047654648415131964,2,374,0.7719911673316602,0.0001237849595951018,894.6459456734035,COMPLETE
1493,0.38918066024780273,2023-09-04 21:35:45.581839,2023-09-04 21:35:47.794524,0 days 00:00:02.212685,Tanh,Sigmoid,,,46,19,24.0,,,0.0009599603513859875,2,389,0.728952132613265,0.00731632135017025,196.266093860973,COMPLETE
1494,0.34536421298980713,2023-09-04 21:35:47.795002,2023-09-04 21:35:48.201428,0 days 00:00:00.406426,Tanh,ReLU,,,82,18,20.0,,,0.022620746644360437,2,300,0.45913040614748285,9.21231658991058e-05,176.63898995139382,COMPLETE
1495,0.37027937173843384,2023-09-04 21:35:48.201896,2023-09-04 21:35:48.428661,0 days 00:00:00.226765,ReLU,Leaky,,,78,18,12.0,,,0.035172116543846735,2,118,0.16786479182122338,0.011970878056648539,215.86954330185714,COMPLETE
1496,0.3345659375190735,2023-09-04 21:35:48.429130,2023-09-04 21:35:48.933224,0 days 00:00:00.504094,Tanh,ReLU,Sigmoid,,84,20,22.0,11.0,,0.010789307256887516,3,286,0.6822356818251731,0.00020959281960468914,306.3721452192827,COMPLETE
1497,0.31002622842788696,2023-09-04 21:35:48.933715,2023-09-04 21:35:49.612507,0 days 00:00:00.678792,Tanh,Sigmoid,Tanh,Leaky,87,16,10.0,14.0,10.0,0.015567665981926661,4,420,0.7451101897552118,2.8046922405649267e-05,155.70920677904812,COMPLETE
1498,0.36095333099365234,2023-09-04 21:35:49.613030,2023-09-04 21:35:52.427991,0 days 00:00:02.814961,Tanh,ReLU,,,79,17,11.0,,,0.001338663645738498,2,363,0.6442040133055741,0.00031277342398467557,144.5031852722168,COMPLETE
1499,0.2675621807575226,2023-09-04 21:35:52.428475,2023-09-04 21:35:53.251650,0 days 00:00:00.823175,Leaky,Sigmoid,,,82,18,23.0,,,0.01833409353050694,2,108,0.7138305027556074,0.00014861075946130426,962.9606906467014,COMPLETE
1500,0.5108129382133484,2023-09-04 21:35:53.252147,2023-09-04 21:35:53.773009,0 days 00:00:00.520862,Tanh,ReLU,,,76,19,24.0,,,0.027575666931771582,2,277,0.7638432791404706,0.06425631171463457,173.81000859686668,COMPLETE
1501,0.5448440909385681,2023-09-04 21:35:53.773483,2023-09-04 21:35:54.267095,0 days 00:00:00.493612,Tanh,Leaky,Sigmoid,,80,20,10.0,10.0,,0.013433873851147192,3,323,0.33173707631808275,0.00010496507942465012,236.93147087097168,COMPLETE
1502,0.4930817484855652,2023-09-04 21:35:54.267586,2023-09-04 21:35:54.922744,0 days 00:00:00.655158,ReLU,ReLU,,,85,3,12.0,,,0.009071011216995373,2,310,0.771619779437145,0.01914893730778135,201.20142854149663,COMPLETE
1503,0.34813636541366577,2023-09-04 21:35:54.923308,2023-09-04 21:35:57.566653,0 days 00:00:02.643345,Tanh,Sigmoid,,,55,17,11.0,,,0.0005302358739534809,2,252,0.7002596705008558,0.004852310283184502,192.1006723434206,COMPLETE
1504,0.3715791702270508,2023-09-04 21:35:57.567127,2023-09-04 21:35:58.247284,0 days 00:00:00.680157,Leaky,ReLU,,,77,18,23.0,,,0.0008362261357348556,2,268,0.4009835479435163,0.00017890673440946133,308.30992889404297,COMPLETE
1505,0.5214749574661255,2023-09-04 21:35:58.247781,2023-09-04 21:35:58.536137,0 days 00:00:00.288356,Sigmoid,Sigmoid,,,63,15,24.0,,,0.021242275633674593,2,295,0.20343116842316922,0.0001306107910024732,732.1918590914819,COMPLETE
1506,0.3879658579826355,2023-09-04 21:35:58.536599,2023-09-04 21:35:59.006066,0 days 00:00:00.469467,Tanh,ReLU,,,82,21,11.0,,,0.038794167627297656,2,169,0.798911202273513,0.0030968736514867846,163.97151527404785,COMPLETE
1507,0.34727057814598083,2023-09-04 21:35:59.006520,2023-09-04 21:35:59.297344,0 days 00:00:00.290824,Tanh,Leaky,ReLU,,79,19,10.0,9.0,,0.028146632178064044,3,257,0.7424325147216921,1.3134518030638022e-05,159.34062025282117,COMPLETE
1508,0.38706499338150024,2023-09-04 21:35:59.297817,2023-09-04 21:36:00.124370,0 days 00:00:00.826553,Tanh,ReLU,,,59,16,22.0,,,0.0035961141722416472,2,283,0.48894973459752905,0.009294438234113874,131.74255356279392,COMPLETE
1509,0.3711310625076294,2023-09-04 21:36:00.124861,2023-09-04 21:36:00.473654,0 days 00:00:00.348793,Leaky,Sigmoid,,,84,17,12.0,,,0.015618618484711397,2,304,0.2826081790131109,7.316513342380389e-05,301.3004965586205,COMPLETE
1510,0.5076043605804443,2023-09-04 21:36:00.474123,2023-09-04 21:36:00.673949,0 days 00:00:00.199826,Tanh,ReLU,,,81,18,10.0,,,0.008050660968380774,2,98,0.1900656740596185,0.00024351416546105806,158.28022155761718,COMPLETE
1511,0.4133744239807129,2023-09-04 21:36:00.674407,2023-09-04 21:36:01.337690,0 days 00:00:00.663283,Tanh,Sigmoid,Sigmoid,,76,10,21.0,15.0,,0.00547697131428236,3,274,0.3939620908608345,0.00010676638203303186,504.1851386630658,COMPLETE
1512,0.34376463294029236,2023-09-04 21:36:01.338176,2023-09-04 21:36:01.909232,0 days 00:00:00.571056,Tanh,Tanh,,,78,17,9.0,,,0.0342083146576532,2,399,0.7988359782141826,0.00015450832102454715,152.73862404047057,COMPLETE
1513,0.5516621470451355,2023-09-04 21:36:01.909712,2023-09-04 21:36:02.223974,0 days 00:00:00.314262,ReLU,ReLU,,,86,19,23.0,,,0.022091738221268996,2,291,0.7346860558309828,0.0737548428008303,253.0384724934896,COMPLETE
1514,0.3672332763671875,2023-09-04 21:36:02.224455,2023-09-04 21:36:02.533560,0 days 00:00:00.309105,Leaky,Leaky,,,50,18,24.0,,,0.04488131586248127,2,328,0.27854328237560994,0.00011976889523462791,904.3452427076256,COMPLETE
1515,0.4477788805961609,2023-09-04 21:36:02.534020,2023-09-04 21:36:02.734232,0 days 00:00:00.200212,Tanh,Tanh,Tanh,,80,19,9.0,12.0,,0.012043552244519135,3,137,0.1585421070038768,0.00020409804223980426,142.18946249825615,COMPLETE
1516,0.437854140996933,2023-09-04 21:36:02.734762,2023-09-04 21:36:03.022658,0 days 00:00:00.287896,Tanh,ReLU,,,88,18,10.0,,,0.023918506794181536,2,375,0.3684709515284181,0.02683207354184874,680.5287915606831,COMPLETE
1517,0.3415772318840027,2023-09-04 21:36:03.023167,2023-09-04 21:36:03.671150,0 days 00:00:00.647983,Tanh,Sigmoid,,,83,16,13.0,,,0.01804136873393301,2,249,0.6742027495832009,0.0004158392387339936,180.3183953272153,COMPLETE
1518,0.37940654158592224,2023-09-04 21:36:03.671643,2023-09-04 21:36:04.159819,0 days 00:00:00.488176,Leaky,Tanh,,,43,17,11.0,,,0.053989733086832345,2,314,0.7687529257790607,8.301398644608985e-05,248.52224527994792,COMPLETE
1519,0.3542635142803192,2023-09-04 21:36:04.160317,2023-09-04 21:36:04.775509,0 days 00:00:00.615192,Tanh,ReLU,,,78,20,23.0,,,0.03131774794798637,2,298,0.7149570138072754,2.7756294977711412e-05,140.74186964957946,COMPLETE
1520,0.5365961790084839,2023-09-04 21:36:04.775995,2023-09-04 21:36:05.070281,0 days 00:00:00.294286,Tanh,Tanh,Sigmoid,,75,18,24.0,8.0,,0.002025820532099672,3,263,0.1487511298729517,0.00014055936904060768,187.78995090060764,COMPLETE
1521,0.3914227783679962,2023-09-04 21:36:05.070766,2023-09-04 21:36:06.928878,0 days 00:00:01.858112,ReLU,Sigmoid,,,53,17,9.0,,,0.0041521603376799224,2,283,0.6007574325594386,0.0026559305696813047,224.3877443196822,COMPLETE
1522,0.45914211869239807,2023-09-04 21:36:06.929368,2023-09-04 21:36:08.476814,0 days 00:00:01.547446,Tanh,ReLU,,,81,19,10.0,,,0.0002247511797785611,2,165,0.7486691777122136,0.00018276784728754638,237.24063535748107,COMPLETE
1523,0.6248525381088257,2023-09-04 21:36:08.477283,2023-09-04 21:36:08.638898,0 days 00:00:00.161615,Leaky,Leaky,,,77,18,12.0,,,0.003025328628245817,2,306,0.11907463537387442,4.808052522650293e-05,161.48355102539062,COMPLETE
1524,0.32116812467575073,2023-09-04 21:36:08.639447,2023-09-04 21:36:09.005096,0 days 00:00:00.365649,Tanh,Tanh,,,91,19,22.0,,,0.017932605319896936,2,275,0.3867220823416613,0.00026628867077120046,273.03158072538156,COMPLETE
1525,0.2695446014404297,2023-09-04 21:36:09.005607,2023-09-04 21:36:09.712605,0 days 00:00:00.706998,Tanh,Tanh,Sigmoid,,85,17,11.0,13.0,,0.010518056552531078,3,291,0.7691016014632697,9.70619205561754e-05,525.1483294377562,COMPLETE
1526,0.327603280544281,2023-09-04 21:36:09.713122,2023-09-04 21:36:10.144484,0 days 00:00:00.431362,Tanh,ReLU,,,80,18,23.0,,,0.025722381877826987,2,319,0.6589646564541964,0.00015894209879695393,148.60255709561434,COMPLETE
1527,0.3862769305706024,2023-09-04 21:36:10.144976,2023-09-04 21:36:10.692920,0 days 00:00:00.547944,Leaky,Sigmoid,,,83,22,11.0,,,0.01423674096393033,2,347,0.7154540619490883,6.162759564298965e-05,176.4448528289795,COMPLETE
1528,0.3992545008659363,2023-09-04 21:36:10.693474,2023-09-04 21:36:10.984981,0 days 00:00:00.291507,Sigmoid,Tanh,,,79,20,9.0,,,0.038526050215345525,2,387,0.3548266583314666,0.00012112085005810823,166.41578877766926,COMPLETE
1529,0.5057925581932068,2023-09-04 21:36:10.985467,2023-09-04 21:36:11.186508,0 days 00:00:00.201041,Tanh,ReLU,,,76,15,10.0,,,0.02094928905174582,2,402,0.11446899206297981,0.0013683037461574834,127.3688959757487,COMPLETE
1530,0.32468873262405396,2023-09-04 21:36:11.187015,2023-09-04 21:36:11.856136,0 days 00:00:00.669121,Tanh,Sigmoid,Leaky,,48,16,24.0,19.0,,0.02837443165644785,3,244,0.7756963572797485,8.367597981692101e-05,120.9506940339741,COMPLETE
1531,0.5049117803573608,2023-09-04 21:36:11.856629,2023-09-04 21:36:12.663770,0 days 00:00:00.807141,ReLU,Tanh,,,87,18,13.0,,,0.00037879311068854035,2,260,0.2259193835687458,0.00021634462066343508,131.4316052363469,COMPLETE
1532,0.5159932374954224,2023-09-04 21:36:12.664265,2023-09-04 21:36:14.295357,0 days 00:00:01.631092,Tanh,Leaky,,,75,17,10.0,,,0.00020624559035214776,2,269,0.46697661162669296,0.0001335197886547026,205.3731884300487,COMPLETE
1533,1.0109310150146484,2023-09-04 21:36:14.295837,2023-09-04 21:36:15.805032,0 days 00:00:01.509195,Leaky,ReLU,,,82,19,9.0,,,1.6182630028979835e-05,2,281,0.4180860524992148,0.00017982679829224316,130.5194812923988,COMPLETE
1534,0.582643985748291,2023-09-04 21:36:15.805504,2023-09-04 21:36:16.457773,0 days 00:00:00.652269,Tanh,Tanh,,,79,18,23.0,,,0.00015642317892437246,2,300,0.12808281116163087,0.0003029349882750092,1559.692126159668,COMPLETE
1535,0.3392888903617859,2023-09-04 21:36:16.458230,2023-09-04 21:36:17.147407,0 days 00:00:00.689177,Tanh,ReLU,Sigmoid,,84,17,11.0,7.0,,0.006426523241380184,3,362,0.3393110957957396,0.00010302656585654113,131.62012412331322,COMPLETE
1536,0.630526602268219,2023-09-04 21:36:17.147915,2023-09-04 21:36:17.748422,0 days 00:00:00.600507,Tanh,Sigmoid,,,81,19,24.0,,,0.01616848786026109,2,332,0.7422836732473403,0.02381217669057901,810.1087698209084,COMPLETE
1537,0.39913710951805115,2023-09-04 21:36:17.748899,2023-09-04 21:36:17.951659,0 days 00:00:00.202760,Leaky,Tanh,,,89,18,14.0,,,0.008379013585198842,2,425,0.1951810955142343,0.007127872599025193,158.05531467090952,COMPLETE
1538,0.9082648158073425,2023-09-04 21:36:17.952163,2023-09-04 21:36:18.580276,0 days 00:00:00.628113,Tanh,ReLU,,,78,14,12.0,,,5.926011436880098e-05,2,309,0.11061137096070615,3.7460850198797056e-05,268.5019100645985,COMPLETE
1539,0.2577953636646271,2023-09-04 21:36:18.580737,2023-09-04 21:36:19.090145,0 days 00:00:00.509408,Tanh,Tanh,,,77,20,9.0,,,0.011958409057820649,2,111,0.6956281561278941,0.00015436771879765498,147.00566299438478,COMPLETE
1540,0.7865333557128906,2023-09-04 21:36:19.090617,2023-09-04 21:36:20.365285,0 days 00:00:01.274668,ReLU,Sigmoid,,,86,16,10.0,,,4.474546633032237e-05,2,292,0.26972068281997486,0.0016923356176678746,352.40186743540306,COMPLETE
1541,0.35174864530563354,2023-09-04 21:36:20.365745,2023-09-04 21:36:21.353065,0 days 00:00:00.987320,Tanh,Leaky,Tanh,,81,17,22.0,4.0,,0.0005877516526294794,3,411,0.5201863407693855,7.152664337773303e-05,189.65301291398177,COMPLETE
1542,0.3270939290523529,2023-09-04 21:36:21.353633,2023-09-04 21:36:21.790527,0 days 00:00:00.436894,Leaky,Tanh,,,61,18,11.0,,,0.033774431991004446,2,93,0.7991887743443042,0.00011449079487629273,134.88412574029738,COMPLETE
1543,0.4712139964103699,2023-09-04 21:36:21.790992,2023-09-04 21:36:22.078832,0 days 00:00:00.287840,Tanh,ReLU,,,74,17,10.0,,,0.04363712942565823,2,155,0.7470631304361306,0.01378023624442709,143.35006822858537,COMPLETE
