number,value,datetime_start,datetime_complete,duration,params_activation1,params_activation2,params_activation3,params_activation4,params_batch_size,params_fl1,params_fl2,params_fl3,params_fl4,params_learning_rate,params_n_layers,params_num_epochs,params_train_size,params_weight_decay,user_attrs_mre,state
655,0.39626264572143555,2023-09-04 22:05:40.003086,2023-09-04 22:05:43.395711,0 days 00:00:03.392625,ReLU,Tanh,,,24,20,20.0,,,3.2983730070757944e-05,2,194,0.547566228152554,0.0006204443741162063,127.29040794765827,COMPLETE
656,0.3649764358997345,2023-09-04 22:05:43.396094,2023-09-04 22:05:44.234787,0 days 00:00:00.838693,Tanh,,,,29,24,,,,0.0028080395613959714,1,288,0.7671813744582304,3.192464452337053e-05,100.10607563365589,COMPLETE
657,0.3899315893650055,2023-09-04 22:05:44.235184,2023-09-04 22:05:44.569531,0 days 00:00:00.334347,ReLU,ReLU,ReLU,Tanh,34,22,10.0,5.0,9.0,0.09891960653161397,4,153,0.6910274762294802,3.967579957081174e-05,190.3791955801157,COMPLETE
658,0.3655048906803131,2023-09-04 22:05:44.569929,2023-09-04 22:05:45.287518,0 days 00:00:00.717589,Tanh,ReLU,ReLU,ReLU,41,23,8.0,16.0,8.0,0.008608788336883399,4,276,0.46465850595918495,0.0031336100847781613,178.4622492009943,COMPLETE
659,0.32520365715026855,2023-09-04 22:05:45.287952,2023-09-04 22:05:46.090274,0 days 00:00:00.802322,ReLU,Tanh,ReLU,ReLU,26,21,9.0,14.0,7.0,0.011221961702480954,4,246,0.7252793316031659,0.00012624707070580678,91.7837576184954,COMPLETE
660,0.3419874608516693,2023-09-04 22:05:46.090684,2023-09-04 22:05:46.551782,0 days 00:00:00.461098,Tanh,ReLU,Leaky,,22,20,17.0,23.0,,0.016591765622587233,3,296,0.1768306513452615,0.00024004091649922597,751.3050689697266,COMPLETE
661,0.9632549285888672,2023-09-04 22:05:46.552457,2023-09-04 22:05:47.268499,0 days 00:00:00.716042,Sigmoid,Tanh,ReLU,Tanh,86,22,16.0,7.0,10.0,0.07201874248793967,4,183,0.7647743900603732,0.06565380960883897,103.08682340734146,COMPLETE
662,0.4174758791923523,2023-09-04 22:05:47.269210,2023-09-04 22:05:47.749468,0 days 00:00:00.480258,ReLU,ReLU,ReLU,,82,23,18.0,12.0,,0.03400531059367918,3,270,0.1898654761771699,0.0004393294478046121,117.40333690643311,COMPLETE
663,0.34565746784210205,2023-09-04 22:05:47.750220,2023-09-04 22:05:48.846227,0 days 00:00:01.096007,Tanh,Sigmoid,ReLU,,35,16,19.0,24.0,,0.0039617978890924025,3,197,0.39955751158758057,6.323376441792472e-05,153.079448223114,COMPLETE
664,0.3000772297382355,2023-09-04 22:05:48.846933,2023-09-04 22:05:50.132575,0 days 00:00:01.285642,ReLU,ReLU,Sigmoid,,88,24,17.0,16.0,,0.008032863998711354,3,161,0.7404139064347746,2.612445392094398e-05,88.26523223876953,COMPLETE
665,0.38241109251976013,2023-09-04 22:05:50.133088,2023-09-04 22:05:50.384426,0 days 00:00:00.251338,Tanh,Tanh,ReLU,Sigmoid,28,20,16.0,15.0,13.0,0.013419179266114613,4,283,0.15763091116810343,0.0011719492864337095,173.20214477539062,COMPLETE
666,0.9859952330589294,2023-09-04 22:05:50.384823,2023-09-04 22:05:50.593539,0 days 00:00:00.208716,ReLU,ReLU,Sigmoid,,38,21,11.0,10.0,,0.028384272707454816,3,236,0.3067311740285999,0.05868355204160392,105.10089206695557,COMPLETE
667,0.37109309434890747,2023-09-04 22:05:50.593972,2023-09-04 22:05:51.194116,0 days 00:00:00.600144,Tanh,Tanh,ReLU,,31,7,18.0,16.0,,0.019842346260089072,3,257,0.6795514543511206,0.00015222110837374717,121.80941619873047,COMPLETE
668,0.34311380982398987,2023-09-04 22:05:51.194541,2023-09-04 22:05:51.774460,0 days 00:00:00.579919,ReLU,ReLU,Leaky,Leaky,90,23,10.0,6.0,9.0,0.006264105238070438,4,141,0.6290464432198044,8.518336058289576e-05,139.70671399434408,COMPLETE
669,0.3867775499820709,2023-09-04 22:05:51.774914,2023-09-04 22:05:52.108575,0 days 00:00:00.333661,Tanh,ReLU,ReLU,,24,12,10.0,17.0,,0.00254611500892345,3,247,0.17403091168336052,0.0006636561065271829,163.99362182617188,COMPLETE
670,0.283123254776001,2023-09-04 22:05:52.108995,2023-09-04 22:05:53.474801,0 days 00:00:01.365806,ReLU,Tanh,ReLU,,27,22,19.0,10.0,,0.0018944096760920813,3,241,0.7716550030908728,3.41402071882339e-05,117.42643924635284,COMPLETE
671,0.311480849981308,2023-09-04 22:05:53.475184,2023-09-04 22:05:54.462702,0 days 00:00:00.987518,Tanh,ReLU,ReLU,ReLU,42,24,17.0,13.0,16.0,0.005338435765526315,4,202,0.7101948477131284,2.899935522395139e-05,101.31910212834676,COMPLETE
672,0.3549342453479767,2023-09-04 22:05:54.463095,2023-09-04 22:05:55.066040,0 days 00:00:00.602945,ReLU,Tanh,Tanh,,33,11,18.0,5.0,,0.038754057023926806,3,263,0.49841654365693266,0.0021983228917318723,109.2188598170425,COMPLETE
673,0.32970961928367615,2023-09-04 22:05:55.066477,2023-09-04 22:05:56.093825,0 days 00:00:01.027348,Tanh,ReLU,Tanh,,28,21,8.0,9.0,,0.009122970193433985,3,252,0.7429349438224666,4.580714712196465e-05,91.81805337441934,COMPLETE
674,0.3798658549785614,2023-09-04 22:05:56.094304,2023-09-04 22:05:59.662699,0 days 00:00:03.568395,ReLU,ReLU,ReLU,Leaky,76,21,16.0,15.0,4.0,5.277037547146579e-05,4,232,0.7991450695318107,0.00036321995808862473,100.51120274642417,COMPLETE
675,0.3506642282009125,2023-09-04 22:05:59.663153,2023-09-04 22:06:00.473067,0 days 00:00:00.809914,ReLU,Tanh,Sigmoid,,25,20,20.0,14.0,,0.02459891721220273,3,270,0.34252445468921705,0.0025235590008088156,135.0864055857939,COMPLETE
676,0.32688403129577637,2023-09-04 22:06:00.473499,2023-09-04 22:06:02.305274,0 days 00:00:01.831775,Tanh,ReLU,Tanh,,19,23,18.0,5.0,,0.01212390300864881,3,240,0.653726554283091,0.0007920765469523661,107.05798803056989,COMPLETE
677,0.3181600868701935,2023-09-04 22:06:02.305988,2023-09-04 22:06:03.957542,0 days 00:00:01.651554,ReLU,Tanh,Leaky,ReLU,31,22,17.0,4.0,12.0,0.0009441166599668075,4,251,0.768528629440831,2.3508398547561702e-05,109.62686004638672,COMPLETE
678,0.31425154209136963,2023-09-04 22:06:03.959138,2023-09-04 22:06:04.541983,0 days 00:00:00.582845,Tanh,Leaky,ReLU,,36,24,15.0,23.0,,0.018055737789011504,3,261,0.7189550186663759,2.091768292661342e-05,105.9139031630296,COMPLETE
679,0.3530662953853607,2023-09-04 22:06:04.542624,2023-09-04 22:06:08.403194,0 days 00:00:03.860570,ReLU,ReLU,Tanh,,54,22,11.0,16.0,,0.0004053883099038207,3,279,0.7383505202324826,3.606634854292536e-05,94.76089511598859,COMPLETE
680,0.29835930466651917,2023-09-04 22:06:08.403968,2023-09-04 22:06:09.537007,0 days 00:00:01.133039,Tanh,Tanh,Tanh,,40,20,9.0,6.0,,0.00691551744295998,3,226,0.6934724113544137,0.0015112302618664215,97.70895274769177,COMPLETE
681,0.3708800971508026,2023-09-04 22:06:09.537386,2023-09-04 22:06:14.081370,0 days 00:00:04.543984,Sigmoid,ReLU,ReLU,Tanh,29,23,10.0,22.0,14.0,0.00021645779261902188,4,245,0.7721088010545337,0.0003338653775490242,98.3794643352558,COMPLETE
682,0.38277873396873474,2023-09-04 22:06:14.081802,2023-09-04 22:06:16.286242,0 days 00:00:02.204440,ReLU,ReLU,Tanh,,88,24,19.0,17.0,,7.558397033914717e-05,3,258,0.5815144428168124,0.017632950547204432,147.02930435653803,COMPLETE
683,0.38726821541786194,2023-09-04 22:06:16.286638,2023-09-04 22:06:16.800136,0 days 00:00:00.513498,Tanh,Tanh,Tanh,,80,21,16.0,11.0,,0.0014238552147591607,3,234,0.22671868078672927,0.0005789007235524502,138.72428144975143,COMPLETE
684,0.38575607538223267,2023-09-04 22:06:16.800552,2023-09-04 22:06:17.026331,0 days 00:00:00.225779,ReLU,ReLU,,,26,22,18.0,,,0.003342587897527481,2,189,0.12044437358967913,0.0002615188068210834,159.2486274186955,COMPLETE
685,0.31244921684265137,2023-09-04 22:06:17.026696,2023-09-04 22:06:17.905691,0 days 00:00:00.878995,Tanh,Tanh,ReLU,Leaky,91,23,5.0,7.0,3.0,0.004399754889727742,4,167,0.6703512554005037,2.9902024435841526e-05,163.61290298273533,COMPLETE
686,0.3561601936817169,2023-09-04 22:06:17.906079,2023-09-04 22:06:18.577294,0 days 00:00:00.671215,ReLU,ReLU,Tanh,,23,20,17.0,9.0,,0.029914208990237237,3,271,0.7446977797587288,0.008502196305925767,101.64526040213448,COMPLETE
687,0.33515843749046326,2023-09-04 22:06:18.577679,2023-09-04 22:06:19.525529,0 days 00:00:00.947850,Tanh,Sigmoid,ReLU,,39,24,11.0,6.0,,0.01628659972115507,3,297,0.7734883488328438,0.0010557766811436586,107.65919361943784,COMPLETE
688,1.0365487337112427,2023-09-04 22:06:19.525968,2023-09-04 22:06:21.703492,0 days 00:00:02.177524,ReLU,ReLU,Tanh,ReLU,86,21,19.0,15.0,1.0,0.0001944657573249762,4,248,0.44207585242592473,4.3295899142039135e-05,165.8814224735383,COMPLETE
689,0.3134845197200775,2023-09-04 22:06:21.703901,2023-09-04 22:06:22.535305,0 days 00:00:00.831404,Tanh,Tanh,Sigmoid,,43,13,8.0,10.0,,0.010882213364343366,3,256,0.7081890590107043,2.4753915819889984e-05,86.58219586885892,COMPLETE
690,0.4111408591270447,2023-09-04 22:06:22.535701,2023-09-04 22:06:22.730138,0 days 00:00:00.194437,ReLU,ReLU,Tanh,,31,19,12.0,16.0,,0.02128953036441897,3,155,0.10798538387539541,0.08355739773870546,324.26446574443094,COMPLETE
691,0.3251701593399048,2023-09-04 22:06:22.730519,2023-09-04 22:06:29.210110,0 days 00:00:06.479591,Tanh,Tanh,ReLU,Leaky,35,23,15.0,9.0,8.0,0.00011240976690150442,4,286,0.7293712013136898,0.004449640731449721,96.31076233870499,COMPLETE
692,0.34175390005111694,2023-09-04 22:06:29.210807,2023-09-04 22:06:38.160779,0 days 00:00:08.949972,ReLU,ReLU,Leaky,,28,22,16.0,7.0,,0.00046708813859764714,3,208,0.5433400601326817,5.339302030255131e-05,104.52429553589535,COMPLETE
693,0.2794196307659149,2023-09-04 22:06:38.161531,2023-09-04 22:06:40.461776,0 days 00:00:02.300245,Tanh,ReLU,Tanh,,25,10,17.0,24.0,,0.04313835708100678,3,241,0.7991628912594309,0.00019560916681852836,89.0408913748605,COMPLETE
694,0.3481895327568054,2023-09-04 22:06:40.462447,2023-09-04 22:06:41.443281,0 days 00:00:00.980834,ReLU,Tanh,ReLU,Tanh,37,20,18.0,17.0,5.0,0.00836442584488734,4,231,0.3582754504035225,1.9421246622698784e-05,118.86367416381836,COMPLETE
695,0.3580213487148285,2023-09-04 22:06:41.443983,2023-09-04 22:06:42.867612,0 days 00:00:01.423629,Tanh,ReLU,Tanh,,33,12,9.0,7.0,,0.014797174934072274,3,267,0.6214853880773252,6.39260940770744e-05,102.68087032863072,COMPLETE
696,0.33959877490997314,2023-09-04 22:06:42.868304,2023-09-04 22:06:44.807220,0 days 00:00:01.938916,ReLU,Tanh,Tanh,ReLU,21,24,15.0,16.0,7.0,0.0058098641569138765,4,250,0.7672493824644551,8.979710157085033e-05,86.89392174614801,COMPLETE
697,0.42681634426116943,2023-09-04 22:06:44.807977,2023-09-04 22:06:45.604828,0 days 00:00:00.796851,Tanh,ReLU,ReLU,,83,21,18.0,8.0,,0.0007676168892400788,3,224,0.10087285322419169,0.0005202332300623203,129.2636060649846,COMPLETE
698,0.33898431062698364,2023-09-04 22:06:45.605552,2023-09-04 22:06:46.848962,0 days 00:00:01.243410,ReLU,ReLU,Tanh,,89,22,16.0,6.0,,0.010272097260175033,3,239,0.7995780261615877,3.059129176724619e-05,84.2571053138146,COMPLETE
699,0.3519803285598755,2023-09-04 22:06:46.849639,2023-09-04 22:06:47.482604,0 days 00:00:00.632965,Tanh,Tanh,ReLU,,46,20,10.0,10.0,,0.03324133529104971,3,261,0.250109872674354,1.0006130457653534e-05,137.05679792516372,COMPLETE
700,0.4009675979614258,2023-09-04 22:06:47.483280,2023-09-04 22:06:57.982023,0 days 00:00:10.498743,ReLU,ReLU,Tanh,Sigmoid,30,23,7.0,15.0,19.0,3.813521176539461e-05,4,279,0.38458606067375545,0.00043123094755971467,114.52169955674039,COMPLETE
701,0.3597961366176605,2023-09-04 22:06:57.982717,2023-09-04 22:06:59.145902,0 days 00:00:01.163185,Sigmoid,Leaky,Tanh,,23,14,15.0,14.0,,0.024772295831386015,3,250,0.1468120885824292,0.0007346215982661582,268.4951512885816,COMPLETE
702,0.41205018758773804,2023-09-04 22:06:59.146590,2023-09-04 22:06:59.592789,0 days 00:00:00.446199,ReLU,Tanh,ReLU,,26,22,9.0,23.0,,0.004655725976265293,3,179,0.14099907367939785,3.65545352403743e-05,192.2290767033895,COMPLETE
703,0.5776100754737854,2023-09-04 22:06:59.593460,2023-09-04 22:07:10.239613,0 days 00:00:10.646153,Tanh,ReLU,Sigmoid,Leaky,28,21,11.0,9.0,10.0,1.9441142537010754e-05,4,235,0.4298960879507848,0.00017944059847994036,106.16113047498338,COMPLETE
704,0.3962775766849518,2023-09-04 22:07:10.240334,2023-09-04 22:07:10.801833,0 days 00:00:00.561499,ReLU,Tanh,Tanh,,38,19,19.0,12.0,,0.007340439979637342,3,214,0.22150638123346045,0.0012841671875519437,142.83212901927806,COMPLETE
705,0.3884800970554352,2023-09-04 22:07:10.802511,2023-09-04 22:07:11.308905,0 days 00:00:00.506394,Tanh,ReLU,Leaky,,42,23,17.0,22.0,,0.013294322826356076,3,262,0.19734001395008988,2.3207810367407323e-05,119.04966517857143,COMPLETE
706,0.38881996273994446,2023-09-04 22:07:11.309665,2023-09-04 22:07:12.030914,0 days 00:00:00.721249,ReLU,ReLU,ReLU,Tanh,24,18,1.0,16.0,11.0,0.0031304958914221753,4,199,0.12505918356812543,0.00010501404329350385,652.2147187928896,COMPLETE
707,0.34919410943984985,2023-09-04 22:07:12.031663,2023-09-04 22:07:13.360024,0 days 00:00:01.328361,Tanh,Tanh,Tanh,,32,24,18.0,11.0,,0.04479901514725762,3,243,0.6976245070998641,1.7071192941523445e-05,94.3242801319469,COMPLETE
708,0.3607354462146759,2023-09-04 22:07:13.360705,2023-09-04 22:07:13.871315,0 days 00:00:00.510610,ReLU,ReLU,Tanh,,29,20,21.0,17.0,,0.002194792460176551,3,271,0.1668255988021843,0.01247383681783575,146.6564108276367,COMPLETE
709,0.36640962958335876,2023-09-04 22:07:13.872002,2023-09-04 22:07:14.393651,0 days 00:00:00.521649,Tanh,Tanh,ReLU,ReLU,91,23,16.0,8.0,18.0,0.01844666793598165,4,127,0.1361814332497348,2.88543528578806e-05,106.96455015959563,COMPLETE
710,0.2969653308391571,2023-09-04 22:07:14.394350,2023-09-04 22:07:21.817723,0 days 00:00:07.423373,ReLU,ReLU,Tanh,,87,22,14.0,5.0,,0.00016796525243961374,3,254,0.7414744694729652,0.0071618312267672955,102.83726147028405,COMPLETE
711,0.5011017918586731,2023-09-04 22:07:21.818452,2023-09-04 22:07:32.815567,0 days 00:00:10.997115,Tanh,ReLU,ReLU,,27,21,12.0,6.0,,2.561270955491843e-05,3,225,0.6710697923251235,2.057163812969118e-05,119.19319108751085,COMPLETE
712,0.3294476866722107,2023-09-04 22:07:32.815970,2023-09-04 22:07:34.498245,0 days 00:00:01.682275,ReLU,Sigmoid,Tanh,Leaky,35,24,20.0,13.0,7.0,0.0037214299096086033,4,249,0.7516585978514468,0.0008654961886967996,102.70177035861545,COMPLETE
713,0.3367527425289154,2023-09-04 22:07:34.499060,2023-09-04 22:07:35.890067,0 days 00:00:01.391007,Tanh,Tanh,Tanh,,41,21,15.0,15.0,,0.009320955873847016,3,235,0.7191757595592393,0.0018245541039649607,104.08112135387603,COMPLETE
714,0.3566854000091553,2023-09-04 22:07:35.890661,2023-09-04 22:07:36.486683,0 days 00:00:00.596022,ReLU,ReLU,ReLU,,48,19,11.0,10.0,,0.02906697551471904,3,263,0.7752624990766921,0.03181298350924261,147.03852081298828,COMPLETE
715,0.2804777920246124,2023-09-04 22:07:36.487288,2023-09-04 22:07:37.464843,0 days 00:00:00.977555,Tanh,Tanh,Tanh,ReLU,85,20,17.0,16.0,13.0,0.0066017383879872285,4,242,0.6495804798327814,0.00031691943288564766,108.03364539146423,COMPLETE
716,0.4053485095500946,2023-09-04 22:07:37.465268,2023-09-04 22:07:52.318290,0 days 00:00:14.853022,ReLU,ReLU,ReLU,,26,22,18.0,7.0,,6.196112837223526e-05,3,259,0.6991019296728378,4.118363725195318e-05,95.3089628182783,COMPLETE
717,0.3465713858604431,2023-09-04 22:07:52.319003,2023-09-04 22:07:52.908991,0 days 00:00:00.589988,Tanh,ReLU,Tanh,,39,23,12.0,9.0,,0.011725182564806978,3,277,0.16139804543170877,0.0006263697202969395,964.6970260620117,COMPLETE
718,0.5375359654426575,2023-09-04 22:07:52.909686,2023-09-04 22:07:53.860425,0 days 00:00:00.950739,ReLU,Tanh,Sigmoid,Leaky,21,1,8.0,8.0,8.0,0.0809183084929123,4,220,0.32956632345233666,7.320742009962046e-05,153.63306596544055,COMPLETE
719,0.37412378191947937,2023-09-04 22:07:53.861120,2023-09-04 22:07:57.390486,0 days 00:00:03.529366,Tanh,ReLU,Leaky,,29,22,10.0,10.0,,0.0002775418708861176,3,303,0.24009035287169528,1.2464149247369025e-05,118.17774050659929,COMPLETE
720,0.3481414020061493,2023-09-04 22:07:57.391202,2023-09-04 22:07:58.753617,0 days 00:00:01.362415,ReLU,Tanh,,,31,15,16.0,,,0.005214731643583086,2,290,0.3079480556570112,0.017152502114454998,1048.4975301106772,COMPLETE
721,0.3397873640060425,2023-09-04 22:07:58.754290,2023-09-04 22:08:00.377640,0 days 00:00:01.623350,Sigmoid,ReLU,Tanh,,25,24,19.0,16.0,,0.02111917260172925,3,253,0.4828350635219553,2.581231313802779e-05,103.57499744046119,COMPLETE
722,0.36975136399269104,2023-09-04 22:08:00.378341,2023-09-04 22:08:01.584482,0 days 00:00:01.206141,Tanh,ReLU,ReLU,Tanh,34,19,14.0,24.0,11.0,0.037876816502283736,4,229,0.7489503239144172,1.534216339864727e-05,117.24869918823242,COMPLETE
723,0.3398303687572479,2023-09-04 22:08:01.585209,2023-09-04 22:08:03.785804,0 days 00:00:02.200595,ReLU,Tanh,Tanh,,92,21,17.0,15.0,,0.0005056492894803769,3,243,0.5688812948072162,0.00013195564815481943,121.82215834637077,COMPLETE
724,0.3950529098510742,2023-09-04 22:08:03.786527,2023-09-04 22:08:04.719812,0 days 00:00:00.933285,Tanh,ReLU,ReLU,,89,11,11.0,6.0,,0.014030668370356738,3,270,0.2705066931235278,5.287967259839621e-05,119.85960061209542,COMPLETE
725,0.3539189100265503,2023-09-04 22:08:04.720555,2023-09-04 22:08:11.083648,0 days 00:00:06.363093,ReLU,Tanh,Tanh,Leaky,23,23,15.0,23.0,12.0,0.0003493859837874807,4,209,0.719288936084599,0.0004815897876030808,95.63391953620358,COMPLETE
726,0.40437573194503784,2023-09-04 22:08:11.084374,2023-09-04 22:08:23.153827,0 days 00:00:12.069453,ReLU,ReLU,Tanh,,27,20,9.0,14.0,,2.8481885758313674e-05,3,170,0.7736430240870283,3.474375551217515e-05,105.84727163875804,COMPLETE
727,0.3293340802192688,2023-09-04 22:08:23.154530,2023-09-04 22:08:25.719952,0 days 00:00:02.565422,Tanh,Leaky,ReLU,,40,24,13.0,22.0,,0.008124249185990692,3,191,0.6023807294329149,1.7578464367354187e-05,251.13080876668295,COMPLETE
728,0.2905386984348297,2023-09-04 22:08:25.720665,2023-09-04 22:08:27.947502,0 days 00:00:02.226837,ReLU,Tanh,Tanh,ReLU,44,16,18.0,9.0,9.0,0.024162900499431723,4,249,0.7993340463675989,2.163234566936498e-05,89.31277115280564,COMPLETE
729,0.2916681170463562,2023-09-04 22:08:27.948221,2023-09-04 22:08:29.389822,0 days 00:00:01.441601,Tanh,ReLU,ReLU,,37,22,15.0,17.0,,0.004159287190945021,3,145,0.7444705681659329,2.89841071703051e-05,103.42958068847656,COMPLETE
730,0.3946031928062439,2023-09-04 22:08:29.390528,2023-09-04 22:08:29.899615,0 days 00:00:00.509087,ReLU,ReLU,Tanh,,30,21,14.0,16.0,,0.05417062108875254,3,238,0.20921155612299638,0.00020539464401816217,177.71816787719726,COMPLETE
731,0.4578748047351837,2023-09-04 22:08:29.900340,2023-09-04 22:08:35.927847,0 days 00:00:06.027507,Tanh,Tanh,Sigmoid,Tanh,25,23,16.0,7.0,5.0,0.00013694427290093797,4,257,0.18696313660926508,0.001057392061665585,267.14588292934553,COMPLETE
732,0.3114989399909973,2023-09-04 22:08:35.928588,2023-09-04 22:08:38.853271,0 days 00:00:02.924683,ReLU,ReLU,Tanh,,16,20,17.0,12.0,,0.01617217322845831,3,266,0.6781145273477707,1.306813621919323e-05,91.80064589888961,COMPLETE
733,0.5269052982330322,2023-09-04 22:08:38.853990,2023-09-04 22:08:44.702037,0 days 00:00:05.848047,Tanh,,,,27,21,,,,2.01695424572183e-05,1,233,0.4135890053447534,0.00339854645685203,182.36040631077321,COMPLETE
734,0.41008123755455017,2023-09-04 22:08:44.702767,2023-09-04 22:08:48.199018,0 days 00:00:03.496251,ReLU,Tanh,ReLU,,32,22,10.0,11.0,,0.0003137527557642459,3,244,0.280566576358195,4.926772366232926e-05,135.1435472745422,COMPLETE
735,0.9883322715759277,2023-09-04 22:08:48.199738,2023-09-04 22:08:48.958659,0 days 00:00:00.758921,Leaky,ReLU,Tanh,Sigmoid,50,24,23.0,5.0,9.0,0.0015638190665417382,4,222,0.7687872270778311,0.048627126712273414,100.50809288024902,COMPLETE
736,0.31081193685531616,2023-09-04 22:08:48.959403,2023-09-04 22:08:51.026425,0 days 00:00:02.067022,Tanh,Sigmoid,Leaky,,29,19,19.0,8.0,,0.010052214598225338,3,157,0.7174975112914265,2.522335728753463e-05,114.37648404029107,COMPLETE
737,0.3165270984172821,2023-09-04 22:08:51.027178,2023-09-04 22:08:54.682392,0 days 00:00:03.655214,ReLU,ReLU,ReLU,,87,22,14.0,15.0,,0.0013473541876744628,3,281,0.7450906519277298,0.004879663561003662,106.21356699543614,COMPLETE
738,0.3135932981967926,2023-09-04 22:08:54.683102,2023-09-04 22:08:59.217743,0 days 00:00:04.534641,Tanh,Tanh,Tanh,Leaky,22,20,13.0,9.0,10.0,0.0060151819708600136,4,255,0.7993942014200531,3.845099440800125e-05,94.66631789434524,COMPLETE
739,0.35311391949653625,2023-09-04 22:08:59.218486,2023-09-04 22:09:01.372879,0 days 00:00:02.154393,ReLU,ReLU,Tanh,,19,13,9.0,6.0,,0.0316414964880551,3,274,0.52179083047648,1.863043899612143e-05,97.17833537440146,COMPLETE
740,0.4110778868198395,2023-09-04 22:09:01.373619,2023-09-04 22:09:06.309242,0 days 00:00:04.935623,Leaky,Tanh,ReLU,,36,23,12.0,10.0,,0.00022177698336654943,3,235,0.26209052456893656,0.001473923720979371,122.97748065704995,COMPLETE
741,0.33707067370414734,2023-09-04 22:09:06.309979,2023-09-04 22:09:10.993025,0 days 00:00:04.683046,Tanh,ReLU,Tanh,ReLU,66,24,8.0,7.0,6.0,0.002607294337568596,4,263,0.6930663600546818,0.00042274122693506115,95.16047804917747,COMPLETE
742,0.3330618143081665,2023-09-04 22:09:10.993808,2023-09-04 22:09:11.700714,0 days 00:00:00.706906,ReLU,ReLU,ReLU,,84,22,18.0,17.0,,0.06437594343441129,3,249,0.768893337820826,0.0007261110728657705,97.04096342387952,COMPLETE
743,0.4605638086795807,2023-09-04 22:09:11.701455,2023-09-04 22:09:17.295184,0 days 00:00:05.593729,Tanh,Tanh,Tanh,,90,12,15.0,16.0,,6.811970972601525e-05,3,228,0.6368996716293388,0.02155837703726667,109.718391284608,COMPLETE
744,0.5284553170204163,2023-09-04 22:09:17.295923,2023-09-04 22:09:17.658086,0 days 00:00:00.362163,Sigmoid,ReLU,ReLU,Tanh,93,21,16.0,15.0,11.0,0.00771960150830948,4,215,0.13707332115613544,1.588382597731769e-05,146.98052188328333,COMPLETE
745,0.3745616674423218,2023-09-04 22:09:17.658888,2023-09-04 22:09:18.370447,0 days 00:00:00.711559,ReLU,Tanh,Tanh,,42,18,19.0,3.0,,0.01240113208289733,3,240,0.23607178212356827,3.109606710793814e-05,119.4196297781808,COMPLETE
746,0.3232087194919586,2023-09-04 22:09:18.371237,2023-09-04 22:09:21.060981,0 days 00:00:02.689744,Leaky,ReLU,Sigmoid,,33,19,18.0,23.0,,0.018765261730280508,3,255,0.7283130082099171,0.0036065277950275768,95.92934871855236,COMPLETE
747,0.3060149848461151,2023-09-04 22:09:21.061761,2023-09-04 22:09:23.196864,0 days 00:00:02.135103,Tanh,ReLU,Leaky,Leaky,28,23,17.0,11.0,16.0,0.0051356200621823405,4,177,0.6615835590952575,0.0002765326246538131,108.47148268563407,COMPLETE
