number,value,datetime_start,datetime_complete,duration,params_activation1,params_activation2,params_activation3,params_activation4,params_batch_size,params_fl1,params_fl2,params_fl3,params_fl4,params_learning_rate,params_n_layers,params_num_epochs,params_train_size,params_weight_decay,user_attrs_mre,state
862,0.503741443157196,2023-09-04 22:12:17.549468,2023-09-04 22:12:18.905564,0 days 00:00:01.356096,Tanh,,,,47,21,,,,2.81505838616175e-05,1,73,0.7740591190369926,0.06986138569293922,106.43574858364994,COMPLETE
863,0.7900490164756775,2023-09-04 22:12:18.906233,2023-09-04 22:12:19.958188,0 days 00:00:01.051955,Tanh,ReLU,,,58,20,14.0,,,1.4650121165749082e-05,2,59,0.7471742989757887,0.00028899736402166875,96.41095901747882,COMPLETE
864,0.4342155158519745,2023-09-04 22:12:19.958587,2023-09-04 22:12:20.288803,0 days 00:00:00.330216,Tanh,Tanh,ReLU,Sigmoid,41,21,5.0,4.0,18.0,0.04471943113594144,4,173,0.4904919719244283,0.01396774101254021,142.4058048248291,COMPLETE
865,0.45574676990509033,2023-09-04 22:12:20.289203,2023-09-04 22:12:21.131167,0 days 00:00:00.841964,ReLU,ReLU,,,53,22,6.0,,,0.00014166957900864325,2,196,0.21958424290314388,0.001979328559729491,164.3662544561892,COMPLETE
866,0.46121472120285034,2023-09-04 22:12:21.131574,2023-09-04 22:12:22.124548,0 days 00:00:00.992974,Sigmoid,Tanh,,,61,21,7.0,,,0.0003762329898611474,2,85,0.7982251213472795,1.502199289148253e-05,123.47388350542853,COMPLETE
867,0.3333069682121277,2023-09-04 22:12:22.124930,2023-09-04 22:12:23.009776,0 days 00:00:00.884846,Tanh,Leaky,,,35,20,14.0,,,0.001810311164893353,2,100,0.7060243939052468,3.9450989289655956e-05,98.84085230241742,COMPLETE
868,0.30860698223114014,2023-09-04 22:12:23.010162,2023-09-04 22:12:23.457950,0 days 00:00:00.447788,Tanh,,,,44,11,,,,0.012309227831128124,1,211,0.7442626950995993,5.6049349625892946e-05,96.76425366523938,COMPLETE
869,0.38620325922966003,2023-09-04 22:12:23.458345,2023-09-04 22:12:23.950771,0 days 00:00:00.492426,Tanh,ReLU,,,37,6,15.0,,,0.0023406000207884755,2,229,0.309679177042511,2.036630472355064e-05,118.94270563837307,COMPLETE
870,0.3272874057292938,2023-09-04 22:12:23.951190,2023-09-04 22:12:24.423067,0 days 00:00:00.471877,Tanh,Tanh,,,50,10,8.0,,,0.07190893712174426,2,58,0.7728375557993677,0.0007695584698828868,118.94257534251494,COMPLETE
871,0.34947800636291504,2023-09-04 22:12:24.423438,2023-09-04 22:12:25.400600,0 days 00:00:00.977162,ReLU,ReLU,Sigmoid,Leaky,40,22,5.0,9.0,21.0,0.0015519408556532322,4,241,0.7206610171993153,0.0088618138505373,103.68517557779948,COMPLETE
872,0.3784532845020294,2023-09-04 22:12:25.401026,2023-09-04 22:12:25.639144,0 days 00:00:00.238118,Tanh,Tanh,,,52,21,6.0,,,0.0010708876767234175,2,72,0.1347122376561683,2.5851905759492088e-05,200.91649648878308,COMPLETE
873,0.3352108895778656,2023-09-04 22:12:25.639553,2023-09-04 22:12:25.836704,0 days 00:00:00.197151,Leaky,,,,48,20,,,,0.02018699476482268,1,256,0.6626817854231012,0.019752618134874552,100.8228645324707,COMPLETE
874,0.5633596777915955,2023-09-04 22:12:25.837098,2023-09-04 22:12:26.314899,0 days 00:00:00.477801,Tanh,ReLU,,,65,24,23.0,,,5.437722160568646e-05,2,110,0.26711851369968104,4.3734092885114095e-05,153.52228948419744,COMPLETE
875,0.32444313168525696,2023-09-04 22:12:26.315306,2023-09-04 22:12:26.991606,0 days 00:00:00.676300,Tanh,ReLU,ReLU,ReLU,43,22,6.0,8.0,22.0,0.004392738092729168,4,50,0.7535744161944908,0.00015640710632092942,113.46081843520656,COMPLETE
876,0.35132652521133423,2023-09-04 22:12:26.992027,2023-09-04 22:12:28.312405,0 days 00:00:01.320378,Tanh,Tanh,,,38,21,22.0,,,0.006215579962039523,2,85,0.7752073422102562,0.0005182429391962736,102.4562255859375,COMPLETE
877,0.3262529671192169,2023-09-04 22:12:28.312836,2023-09-04 22:12:28.746367,0 days 00:00:00.433531,ReLU,ReLU,,,40,16,15.0,,,0.009983641848157879,2,93,0.4501385241465029,3.213278918395737e-05,84.47076416015625,COMPLETE
878,0.31358984112739563,2023-09-04 22:12:28.746899,2023-09-04 22:12:29.328222,0 days 00:00:00.581323,Tanh,Sigmoid,,,37,21,16.0,,,0.03363623557465443,2,78,0.7995108995364015,0.0011289522236893378,109.12083504416726,COMPLETE
879,0.6082580089569092,2023-09-04 22:12:29.328618,2023-09-04 22:12:29.497935,0 days 00:00:00.169317,Sigmoid,,,,46,12,,,,0.0008597663217644429,1,64,0.12202680805883724,0.012319061716338248,144.46148192882538,COMPLETE
880,0.522108793258667,2023-09-04 22:12:29.498306,2023-09-04 22:12:29.902981,0 days 00:00:00.404675,Tanh,Tanh,ReLU,Sigmoid,70,19,4.0,2.0,23.0,0.014565038411377384,4,167,0.2830093268832815,0.0002415214020155389,318.91456747055054,COMPLETE
881,0.8567378520965576,2023-09-04 22:12:29.903382,2023-09-04 22:12:30.982320,0 days 00:00:01.078938,Tanh,Sigmoid,,,55,20,6.0,,,3.564221902843499e-05,2,223,0.29088577425515455,1.5858424259593314e-05,1323.2248217663957,COMPLETE
882,0.3675112724304199,2023-09-04 22:12:30.982693,2023-09-04 22:12:31.118719,0 days 00:00:00.136026,Tanh,ReLU,,,77,22,8.0,,,0.01891289825143515,2,184,0.18662527490238826,8.490171419143527e-05,112.25135661937573,COMPLETE
883,0.325284868478775,2023-09-04 22:12:31.119109,2023-09-04 22:12:31.853515,0 days 00:00:00.734406,ReLU,,,,49,9,,,,0.006893438370298023,1,96,0.6909215855042669,3.774904322854518e-05,116.74332858354617,COMPLETE
884,0.31003859639167786,2023-09-04 22:12:31.853902,2023-09-04 22:12:32.750863,0 days 00:00:00.896961,Tanh,Tanh,,,35,21,5.0,,,0.005413456138419288,2,199,0.3777916409636056,0.0001902556737049666,187.73577204290427,COMPLETE
885,0.518077552318573,2023-09-04 22:12:32.751269,2023-09-04 22:12:33.702464,0 days 00:00:00.951195,Tanh,Sigmoid,,,51,17,7.0,,,0.00019703161740204666,2,78,0.7290163063434493,0.0008243024967403305,135.43458889692258,COMPLETE
886,0.382938951253891,2023-09-04 22:12:33.702844,2023-09-04 22:12:33.919248,0 days 00:00:00.216404,Leaky,Leaky,Tanh,,95,20,5.0,5.0,,0.008098071878460766,3,68,0.24648680772466056,6.169292399816192e-05,156.32058663801715,COMPLETE
887,0.6996824741363525,2023-09-04 22:12:33.919639,2023-09-04 22:12:34.060910,0 days 00:00:00.141271,Tanh,ReLU,Sigmoid,Leaky,33,22,13.0,1.0,15.0,0.09101324784899703,4,210,0.10280127675727435,4.766843319833372e-05,146.05314874649048,COMPLETE
888,1.1268473863601685,2023-09-04 22:12:34.061404,2023-09-04 22:12:35.094288,0 days 00:00:01.032884,ReLU,Sigmoid,,,86,21,7.0,,,1.238716022387218e-05,2,114,0.7525436836358662,0.07090468312367873,144.37359271133155,COMPLETE
889,0.2868422269821167,2023-09-04 22:12:35.094665,2023-09-04 22:12:36.047360,0 days 00:00:00.952695,Tanh,,,,44,15,,,,0.002948962544858332,1,89,0.7712427703041054,2.251910851836879e-05,122.54935015510111,COMPLETE
890,0.36456429958343506,2023-09-04 22:12:36.047719,2023-09-04 22:12:36.430417,0 days 00:00:00.382698,Tanh,Tanh,,,38,23,6.0,,,0.012048120345330425,2,173,0.4297249270857939,0.006773722883067274,145.94093864842466,COMPLETE
891,0.25941982865333557,2023-09-04 22:12:36.430807,2023-09-04 22:12:39.213267,0 days 00:00:02.782460,Tanh,Sigmoid,ReLU,,10,19,4.0,6.0,,0.016346460566061576,3,217,0.7273257911215174,1.30568484146227e-05,117.13191970513792,COMPLETE
892,0.3034333884716034,2023-09-04 22:12:39.213865,2023-09-04 22:12:40.376703,0 days 00:00:01.162838,Tanh,Sigmoid,ReLU,,10,19,3.0,6.0,,0.01031247628540694,3,220,0.6821236494538625,1.3080697962962808e-05,112.84754616873605,COMPLETE
893,0.4175582230091095,2023-09-04 22:12:40.377116,2023-09-04 22:12:44.118856,0 days 00:00:03.741740,Sigmoid,ReLU,ReLU,,12,19,2.0,7.0,,0.0002699466439589669,3,205,0.27065918748770257,1.4549466860415714e-05,126.81520765351087,COMPLETE
894,0.33048561215400696,2023-09-04 22:12:44.119279,2023-09-04 22:12:45.582446,0 days 00:00:01.463167,Tanh,Sigmoid,ReLU,,10,20,3.0,6.0,,0.01367344023329355,3,232,0.33534769142402615,1.679511078214246e-05,111.7194614757191,COMPLETE
895,0.33207523822784424,2023-09-04 22:12:45.582852,2023-09-04 22:12:46.802825,0 days 00:00:01.219973,ReLU,Tanh,ReLU,,13,20,4.0,5.0,,0.01689638468787415,3,213,0.7133399966329756,1.2932146239299e-05,92.56635175432477,COMPLETE
896,0.4061111509799957,2023-09-04 22:12:46.803275,2023-09-04 22:12:47.642295,0 days 00:00:00.839020,Tanh,ReLU,ReLU,,10,18,4.0,7.0,,0.0013592749000004582,3,225,0.16407731778546245,0.02161819828919052,130.42256246294295,COMPLETE
897,0.41516581177711487,2023-09-04 22:12:47.642866,2023-09-04 22:12:48.042304,0 days 00:00:00.399438,Tanh,Sigmoid,ReLU,,10,19,3.0,4.0,,0.04044894728609874,3,214,0.1788874085456159,1.7581458118673832e-05,106.98216524991122,COMPLETE
898,0.4168454110622406,2023-09-04 22:12:48.042820,2023-09-04 22:12:50.466712,0 days 00:00:02.423892,Tanh,Sigmoid,ReLU,,10,20,22.0,5.0,,0.000526722915642842,3,236,0.14573532395909272,1.0971756686522618e-05,119.82760197508568,COMPLETE
899,0.3502250909805298,2023-09-04 22:12:50.467128,2023-09-04 22:13:00.522577,0 days 00:00:10.055449,Leaky,Tanh,ReLU,,12,20,15.0,11.0,,1.5998719354548024e-05,3,220,0.7309530123973373,2.0335089678322373e-05,124.25247913707386,COMPLETE
900,0.32314765453338623,2023-09-04 22:13:00.522980,2023-09-04 22:13:01.592393,0 days 00:00:01.069413,Tanh,ReLU,ReLU,,13,20,14.0,4.0,,0.00930523964112891,3,198,0.6610255918029885,0.0003177284628790454,94.48126870614512,COMPLETE
901,1.007932186126709,2023-09-04 22:13:01.592793,2023-09-04 22:13:02.081464,0 days 00:00:00.488671,ReLU,Sigmoid,ReLU,,11,19,4.0,3.0,,0.011916555817297957,3,206,0.14220666192911954,0.03244907338062617,104.67903406479779,COMPLETE
902,0.3174400329589844,2023-09-04 22:13:02.081880,2023-09-04 22:13:02.551761,0 days 00:00:00.469881,Tanh,ReLU,ReLU,,89,21,23.0,6.0,,0.0036984295333457543,3,248,0.798312316937061,1.1597783803007024e-05,92.91479251259251,COMPLETE
903,0.40253207087516785,2023-09-04 22:13:02.552185,2023-09-04 22:13:05.134556,0 days 00:00:02.582371,Tanh,Tanh,ReLU,,11,20,9.0,8.0,,0.00023745891554304306,3,229,0.1601747841483458,1.4607709083813868e-05,124.3625252403026,COMPLETE
904,0.4898103177547455,2023-09-04 22:13:05.134958,2023-09-04 22:13:09.655353,0 days 00:00:04.520395,Tanh,Sigmoid,ReLU,,13,21,16.0,4.0,,6.33913400772678e-05,3,218,0.3497377939581278,0.00014661767869120917,106.73488119982798,COMPLETE
905,1.0035879611968994,2023-09-04 22:13:09.655789,2023-09-04 22:13:09.906469,0 days 00:00:00.250680,ReLU,Sigmoid,ReLU,,42,19,9.0,6.0,,0.0008047000302124084,3,195,0.4797545865889688,0.09108745016693136,100.96805752024932,COMPLETE
906,0.3557058572769165,2023-09-04 22:13:09.906886,2023-09-04 22:13:10.438948,0 days 00:00:00.532062,Tanh,ReLU,Sigmoid,,10,16,8.0,7.0,,0.007657880572680505,3,242,0.19183106281622597,0.00023280830356611169,106.04677605628967,COMPLETE
907,1.0698869228363037,2023-09-04 22:13:10.439330,2023-09-04 22:13:12.745133,0 days 00:00:02.305803,Sigmoid,Tanh,Leaky,,72,20,13.0,2.0,,1.9405954439180997e-05,3,187,0.7999147874812537,2.739376964947517e-05,128.24208640032273,COMPLETE
908,0.34222856163978577,2023-09-04 22:13:12.745517,2023-09-04 22:13:13.318979,0 days 00:00:00.573462,Tanh,Sigmoid,ReLU,,40,21,7.0,5.0,,0.015423398744931467,3,231,0.7025438609297969,1.0110468372887556e-05,111.18696165084839,COMPLETE
909,0.43331971764564514,2023-09-04 22:13:13.319368,2023-09-04 22:13:13.587395,0 days 00:00:00.268027,Tanh,Leaky,Leaky,,56,21,3.0,3.0,,0.033342613949861696,3,101,0.5335026485155723,0.006108047642227045,124.30450657435826,COMPLETE
910,0.33936765789985657,2023-09-04 22:13:13.587891,2023-09-04 22:13:14.808125,0 days 00:00:01.220234,Tanh,ReLU,Tanh,,12,20,21.0,4.0,,0.005488666659755563,3,160,0.7538090282887997,2.1249764171087705e-05,87.91393524169922,COMPLETE
911,0.2745187282562256,2023-09-04 22:13:14.808669,2023-09-04 22:13:15.863767,0 days 00:00:01.055098,ReLU,,,,14,21,,,,0.004582992954810895,1,211,0.7691931751812098,0.0014592430823314143,103.46893838735727,COMPLETE
912,0.311449259519577,2023-09-04 22:13:15.864230,2023-09-04 22:13:17.090049,0 days 00:00:01.225819,ReLU,,,,14,21,,,,0.004165111868126087,1,212,0.7300765381767093,0.0012946915626429988,106.4987907409668,COMPLETE
913,0.30977195501327515,2023-09-04 22:13:17.090562,2023-09-04 22:13:18.282415,0 days 00:00:01.191853,ReLU,,,,13,21,,,,0.004787216152025778,1,206,0.7701773194100308,0.002666360774514978,106.38472952493807,COMPLETE
914,0.33819153904914856,2023-09-04 22:13:18.282917,2023-09-04 22:13:18.874523,0 days 00:00:00.591606,ReLU,,,,12,21,,,,0.0035450499771859404,1,219,0.2044564608486908,0.00019201003126081317,129.96534276008606,COMPLETE
915,0.3634309768676758,2023-09-04 22:13:18.874900,2023-09-04 22:13:19.801419,0 days 00:00:00.926519,ReLU,,,,14,21,,,,0.004860229612556247,1,201,0.7003931188793654,0.0006764344036753343,104.07405543971706,COMPLETE
916,0.3809557855129242,2023-09-04 22:13:19.801795,2023-09-04 22:13:20.289421,0 days 00:00:00.487626,ReLU,,,,10,20,,,,0.006417325822015389,1,208,0.42238580924966207,0.00010451096266057078,116.83287449886924,COMPLETE
917,0.49191486835479736,2023-09-04 22:13:20.289934,2023-09-04 22:13:21.815252,0 days 00:00:01.525318,ReLU,,,,36,18,,,,3.440130062479975e-05,1,224,0.3922362700121195,0.001364437284652262,194.24482314927238,COMPLETE
918,0.43193319439888,2023-09-04 22:13:21.815660,2023-09-04 22:13:22.018431,0 days 00:00:00.202771,ReLU,,,,59,21,,,,0.004149648397313798,1,218,0.13290981675814598,3.4542891881241524e-05,107.69397565056296,COMPLETE
919,0.3838502764701843,2023-09-04 22:13:22.018795,2023-09-04 22:13:23.423273,0 days 00:00:01.404478,ReLU,,,,45,20,,,,7.402960987443152e-05,1,234,0.40745261562085644,0.015695496484899832,107.52001392331897,COMPLETE
920,0.31180670857429504,2023-09-04 22:13:23.423655,2023-09-04 22:13:24.895306,0 days 00:00:01.471651,ReLU,,,,12,21,,,,0.0028178255351609597,1,217,0.7501655615200618,0.0021018468704875537,89.59886029301857,COMPLETE
921,0.3615044951438904,2023-09-04 22:13:24.895690,2023-09-04 22:13:25.169147,0 days 00:00:00.273457,ReLU,,,,68,20,,,,0.049570892261314246,1,194,0.645865612949371,0.0013815569911449117,127.69676818847657,COMPLETE
922,0.4298640191555023,2023-09-04 22:13:25.169550,2023-09-04 22:13:25.291040,0 days 00:00:00.121490,ReLU,,,,39,22,,,,0.005661428588545154,1,225,0.10112516470713588,0.0017947804313251754,120.73532012014678,COMPLETE
923,0.37683671712875366,2023-09-04 22:13:25.291452,2023-09-04 22:13:25.487633,0 days 00:00:00.196181,ReLU,,,,75,21,,,,0.029749312157685354,1,206,0.7732765563739303,0.01129090864030972,106.93886269463434,COMPLETE
924,0.3429882824420929,2023-09-04 22:13:25.488003,2023-09-04 22:13:25.696525,0 days 00:00:00.208522,ReLU,,,,53,19,,,,0.038792538692278326,1,187,0.7225021349095513,0.0014996072067699946,491.0772346047794,COMPLETE
925,0.41861262917518616,2023-09-04 22:13:25.696895,2023-09-04 22:13:25.790065,0 days 00:00:00.093170,ReLU,,,,83,22,,,,0.02237755063201552,1,210,0.11403870063938376,0.0002758430342703362,165.5809105182516,COMPLETE
926,0.3542417585849762,2023-09-04 22:13:25.790438,2023-09-04 22:13:26.204128,0 days 00:00:00.413690,ReLU,,,,41,20,,,,0.004625499337527723,1,227,0.6809376421212681,0.0012030703604276013,110.67301326327853,COMPLETE
927,0.34727782011032104,2023-09-04 22:13:26.204500,2023-09-04 22:13:27.272880,0 days 00:00:01.068380,ReLU,,,,15,15,,,,0.006346154567332151,1,239,0.7701863976259402,0.00042624025573866526,101.07936495826358,COMPLETE
928,0.379819393157959,2023-09-04 22:13:27.273266,2023-09-04 22:13:28.180525,0 days 00:00:00.907259,Leaky,,,,35,21,,,,0.00033269384181460826,1,198,0.25170371346519615,0.0008679227534307086,119.34672511707653,COMPLETE
929,0.2969551384449005,2023-09-04 22:13:28.180906,2023-09-04 22:13:30.888134,0 days 00:00:02.707228,ReLU,Tanh,Leaky,Sigmoid,47,20,14.0,5.0,13.0,0.0030531478000525875,4,218,0.7448490033677199,0.0017725783246972855,104.12976197273501,COMPLETE
930,0.4286177456378937,2023-09-04 22:13:30.888570,2023-09-04 22:13:31.053109,0 days 00:00:00.164539,Sigmoid,,,,61,21,,,,0.06257353860277821,1,154,0.11128747398526513,0.002391673136398637,137.490959794554,COMPLETE
931,0.28648218512535095,2023-09-04 22:13:31.053470,2023-09-04 22:13:32.001863,0 days 00:00:00.948393,ReLU,ReLU,ReLU,,32,22,4.0,7.0,,0.001871963722099626,3,167,0.7992323293489925,0.001869113427663887,107.20451224722514,COMPLETE
932,0.36702653765678406,2023-09-04 22:13:32.002254,2023-09-04 22:13:33.211448,0 days 00:00:01.209194,ReLU,,,,10,21,,,,0.02947763577158462,1,174,0.7058390875224263,0.00013561636961694932,109.34338055234967,COMPLETE
933,0.328088641166687,2023-09-04 22:13:33.211941,2023-09-04 22:13:36.509567,0 days 00:00:03.297626,ReLU,Tanh,Sigmoid,,14,20,8.0,9.0,,0.00350028290053933,3,179,0.7421875929183042,0.001031844103857188,99.26549607428952,COMPLETE
934,1.0441027879714966,2023-09-04 22:13:36.509968,2023-09-04 22:13:36.848188,0 days 00:00:00.338220,Sigmoid,ReLU,Leaky,ReLU,37,21,2.0,8.0,17.0,0.007280899402854488,4,213,0.7717661452198251,0.003103211402956459,100.12806909734553,COMPLETE
935,0.40823644399642944,2023-09-04 22:13:36.848665,2023-09-04 22:13:39.019317,0 days 00:00:02.170652,Tanh,,,,48,22,,,,0.0006761682360432938,1,192,0.7996656818889399,0.0008755342381293109,121.95397170046543,COMPLETE
936,0.44591107964515686,2023-09-04 22:13:39.019758,2023-09-04 22:13:39.319000,0 days 00:00:00.299242,Leaky,Tanh,Leaky,,43,21,12.0,6.0,,0.0004767533538236255,3,231,0.1228184576529617,0.00015859881090224902,106.28741312026978,COMPLETE
937,0.3507654368877411,2023-09-04 22:13:39.319438,2023-09-04 22:13:39.538871,0 days 00:00:00.219433,ReLU,,,,63,20,,,,0.023780666343675164,1,223,0.6683462500087982,3.796503695107939e-05,108.99199829101562,COMPLETE
938,0.36605387926101685,2023-09-04 22:13:39.539288,2023-09-04 22:13:39.997814,0 days 00:00:00.458526,Tanh,ReLU,ReLU,,91,15,3.0,1.0,,0.0380685684722679,3,205,0.7274301491694897,0.010651224323334083,124.68403030023342,COMPLETE
939,0.32964712381362915,2023-09-04 22:13:39.998217,2023-09-04 22:13:40.649574,0 days 00:00:00.651357,Tanh,Tanh,Leaky,Tanh,50,19,4.0,2.0,22.0,0.0050645016711413585,4,142,0.6194092506570735,0.001413597798573588,108.32333924049554,COMPLETE
940,0.2977307140827179,2023-09-04 22:13:40.650042,2023-09-04 22:13:43.212045,0 days 00:00:02.562003,Tanh,ReLU,Sigmoid,,12,16,16.0,3.0,,0.008798599283990724,3,159,0.6997348625917226,0.00011669218964612457,130.00532866360848,COMPLETE
941,0.35761380195617676,2023-09-04 22:13:43.212510,2023-09-04 22:13:43.745648,0 days 00:00:00.533138,ReLU,,,,39,21,,,,0.00216218063227778,1,251,0.3398212482805043,0.037572185091459286,164.62911292182073,COMPLETE
942,0.3406547009944916,2023-09-04 22:13:43.746036,2023-09-04 22:13:45.194411,0 days 00:00:01.448375,Leaky,ReLU,ReLU,Tanh,57,22,15.0,5.0,24.0,0.0009732427665847525,4,239,0.7536799223454391,0.000371476824229933,96.85324776690939,COMPLETE
943,0.399446576833725,2023-09-04 22:13:45.195002,2023-09-04 22:13:45.595631,0 days 00:00:00.400629,Tanh,Tanh,Leaky,,81,20,13.0,7.0,,0.004041005094150466,3,188,0.7733076832392779,3.010666303878784e-05,90.09361267089844,COMPLETE
944,0.4435938894748688,2023-09-04 22:13:45.596206,2023-09-04 22:13:46.419668,0 days 00:00:00.823462,Tanh,,,,15,1,,,,0.020426221254133164,1,177,0.7278257463222707,4.300046678537333e-05,110.1352933247884,COMPLETE
945,0.7754127383232117,2023-09-04 22:13:46.420133,2023-09-04 22:13:49.372570,0 days 00:00:02.952437,Tanh,Leaky,Tanh,,12,21,7.0,3.0,,1.3834543740327847e-05,3,216,0.20749296405327078,0.0015620709923605696,161.5337618721856,COMPLETE
946,0.4714917242527008,2023-09-04 22:13:49.372983,2023-09-04 22:13:49.610357,0 days 00:00:00.237374,Tanh,ReLU,Leaky,Sigmoid,34,22,4.0,6.0,11.0,0.005891129155374794,4,128,0.10803038859814824,0.00021647569666350254,126.65482081923373,COMPLETE
947,0.3419642150402069,2023-09-04 22:13:49.610806,2023-09-04 22:13:49.926677,0 days 00:00:00.315871,ReLU,,,,41,20,,,,0.03280526798765902,1,166,0.6501927042956082,0.000185451784970527,129.63632202148438,COMPLETE
948,0.4473583698272705,2023-09-04 22:13:49.927086,2023-09-04 22:13:50.447145,0 days 00:00:00.520059,Sigmoid,Tanh,ReLU,,36,21,5.0,4.0,,0.017104587692043614,3,148,0.4553144848773954,0.004215884580982237,117.03146479679988,COMPLETE
949,0.39456450939178467,2023-09-04 22:13:50.447603,2023-09-04 22:13:52.467675,0 days 00:00:02.020072,Tanh,,,,53,22,,,,0.0002630409008420553,1,203,0.7706362132012152,2.662930262438339e-05,105.06462570716594,COMPLETE
950,0.3492961525917053,2023-09-04 22:13:52.468078,2023-09-04 22:13:52.935369,0 days 00:00:00.467291,Tanh,ReLU,Leaky,Leaky,46,20,14.0,2.0,12.0,0.02626807189345961,4,231,0.4958040048318104,9.592879663960927e-05,118.92286381577,COMPLETE
951,0.35741326212882996,2023-09-04 22:13:52.935813,2023-09-04 22:13:53.394386,0 days 00:00:00.458573,Tanh,,,,10,18,,,,0.007146153581329803,1,157,0.14324667169261124,0.0011263858125525983,450.6969566345215,COMPLETE
952,0.3670637011528015,2023-09-04 22:13:53.394781,2023-09-04 22:13:53.764103,0 days 00:00:00.369322,ReLU,Tanh,Sigmoid,,16,19,6.0,9.0,,0.010305572565985048,3,225,0.2226811793793469,3.1855125133470445e-05,121.32945037841797,COMPLETE
953,0.4084918200969696,2023-09-04 22:13:53.764582,2023-09-04 22:13:54.239500,0 days 00:00:00.474918,Tanh,ReLU,Leaky,,38,22,8.0,4.0,,0.0444817884071515,3,217,0.6897253409050785,0.017516038094627276,119.66946563720703,COMPLETE
954,0.3997860848903656,2023-09-04 22:13:54.239917,2023-09-04 22:14:24.346113,0 days 00:00:30.106196,Leaky,Tanh,ReLU,Tanh,13,21,5.0,5.0,20.0,1.699763503558935e-05,4,270,0.7439642182374896,0.02512550863442755,103.8171263800727,COMPLETE
955,0.31708917021751404,2023-09-04 22:14:24.346869,2023-09-04 22:14:25.711504,0 days 00:00:01.364635,Tanh,,,,31,21,,,,0.0138813249240414,1,244,0.5075194432471489,0.0024626187006029365,96.69296944659689,COMPLETE
956,0.3273574709892273,2023-09-04 22:14:25.712234,2023-09-04 22:14:26.252025,0 days 00:00:00.539791,Tanh,ReLU,Leaky,,54,15,9.0,13.0,,0.0196086339097744,3,165,0.22975993404122577,0.00048149667477550396,112.76951704354121,COMPLETE
957,0.3522571921348572,2023-09-04 22:14:26.252768,2023-09-04 22:14:27.241338,0 days 00:00:00.988570,ReLU,,,,43,17,,,,0.056090725998974675,1,138,0.718309351465623,5.1248849985955855e-05,96.96527888857085,COMPLETE
958,0.357588529586792,2023-09-04 22:14:27.242053,2023-09-04 22:14:28.476492,0 days 00:00:01.234439,Tanh,Tanh,ReLU,,17,21,1.0,8.0,,0.00844037214880065,3,181,0.38413153636856373,1.2711938271131103e-05,118.80123977661133,COMPLETE
