number,value,datetime_start,datetime_complete,duration,params_activation1,params_activation2,params_activation3,params_activation4,params_batch_size,params_fl1,params_fl2,params_fl3,params_fl4,params_learning_rate,params_n_layers,params_num_epochs,params_train_size,params_weight_decay,user_attrs_mre,state
388,0.3294741213321686,2023-09-04 21:17:24.089831,2023-09-04 21:17:24.511622,0 days 00:00:00.421791,Sigmoid,Tanh,,,63,17,13.0,,,0.029830993103070726,2,90,0.7690286194077152,0.0003799578180142135,866.7131026418585,COMPLETE
389,0.3038936257362366,2023-09-04 21:17:24.511929,2023-09-04 21:17:24.855763,0 days 00:00:00.343834,Tanh,Tanh,,,78,18,11.0,,,0.035524869518505385,2,460,0.5299847355149856,7.656384899726174e-05,414.86743786870215,COMPLETE
390,0.2996852397918701,2023-09-04 21:17:24.856085,2023-09-04 21:17:25.273673,0 days 00:00:00.417588,Tanh,ReLU,,,82,17,2.0,,,0.05274510575227401,2,70,0.7063312343664081,0.00016896834084085164,257.8440748850505,COMPLETE
391,0.2890177369117737,2023-09-04 21:17:25.273985,2023-09-04 21:17:25.856507,0 days 00:00:00.582522,Tanh,Tanh,,,68,18,10.0,,,0.018952378445754117,2,484,0.7354056636193997,0.0004603704149435864,200.45867467330675,COMPLETE
392,0.3039140999317169,2023-09-04 21:17:25.856818,2023-09-04 21:17:26.101350,0 days 00:00:00.244532,Tanh,Tanh,,,70,15,19.0,,,0.06797798790320564,2,84,0.7697887685037631,0.0001083162764852999,153.31365342573687,COMPLETE
393,0.31522059440612793,2023-09-04 21:17:26.101647,2023-09-04 21:17:27.123411,0 days 00:00:01.021764,Tanh,Sigmoid,,,65,14,9.0,,,0.010154646780342409,2,455,0.6834337308768844,0.0001362563538903256,158.05736736918604,COMPLETE
394,0.41881993412971497,2023-09-04 21:17:27.123724,2023-09-04 21:17:27.802101,0 days 00:00:00.678377,Sigmoid,Tanh,,,72,16,12.0,,,0.0019698948325193697,2,226,0.20274521066426604,0.00020416213740731678,134.15811687233173,COMPLETE
395,0.3963070809841156,2023-09-04 21:17:27.802412,2023-09-04 21:17:28.097374,0 days 00:00:00.294962,Tanh,Tanh,,,84,19,10.0,,,0.0031181515447887436,2,256,0.24399134619982074,0.0007698969376745364,192.20979075712316,COMPLETE
396,0.5949639678001404,2023-09-04 21:17:28.097690,2023-09-04 21:17:28.535716,0 days 00:00:00.438026,Tanh,Sigmoid,,,74,18,11.0,,,0.026499867685303213,2,288,0.6497706237965851,0.03281108906092422,1140.9575751410591,COMPLETE
397,0.2871309816837311,2023-09-04 21:17:28.536109,2023-09-04 21:17:29.024583,0 days 00:00:00.488474,Tanh,Tanh,,,67,17,9.0,,,0.013639868956784302,2,243,0.7291736599451917,9.722212216121334e-05,196.6556440080915,COMPLETE
398,0.331412136554718,2023-09-04 21:17:29.024904,2023-09-04 21:17:29.588521,0 days 00:00:00.563617,ReLU,Tanh,,,70,18,9.0,,,0.020346504078646573,2,262,0.76968998515275,0.00017677489047653147,428.59441048758373,COMPLETE
399,0.31219902634620667,2023-09-04 21:17:29.588839,2023-09-04 21:17:30.097977,0 days 00:00:00.509138,Tanh,ReLU,,,79,19,10.0,,,0.033570591661736135,2,100,0.7964654562935936,0.00012039021671472282,287.1144931499775,COMPLETE
400,0.5136914849281311,2023-09-04 21:17:30.098296,2023-09-04 21:17:30.374851,0 days 00:00:00.276555,Tanh,,,,61,17,,,,0.0017507363992621836,1,126,0.1473615480530042,0.0013155747404503502,136.31528357853966,COMPLETE
401,0.4280993938446045,2023-09-04 21:17:30.375142,2023-09-04 21:17:30.686769,0 days 00:00:00.311627,Tanh,Sigmoid,,,73,20,12.0,,,0.0400695285700974,2,297,0.7078897449258641,0.0030168283976151696,1627.0148709204889,COMPLETE
402,0.39886897802352905,2023-09-04 21:17:30.687078,2023-09-04 21:17:30.880625,0 days 00:00:00.193547,Sigmoid,Tanh,,,76,17,11.0,,,0.015642979108451915,2,280,0.17274430018830905,0.00015736893606927007,854.3630187545998,COMPLETE
403,0.30878546833992004,2023-09-04 21:17:30.880940,2023-09-04 21:17:31.219883,0 days 00:00:00.338943,Tanh,Leaky,,,82,18,10.0,,,0.04528785483224983,2,340,0.5769953576110294,0.0010318204367524562,212.98818969726562,COMPLETE
404,0.3372528553009033,2023-09-04 21:17:31.220190,2023-09-04 21:17:31.825127,0 days 00:00:00.604937,Tanh,Tanh,,,71,16,9.0,,,0.007811309340964745,2,493,0.6074026820426975,0.0002504023271309381,169.13758809942948,COMPLETE
405,0.34550929069519043,2023-09-04 21:17:31.825454,2023-09-04 21:17:32.158707,0 days 00:00:00.333253,Leaky,Sigmoid,,,69,19,13.0,,,0.09924540889886145,2,312,0.4510746619809585,2.29847075011711e-05,212.54322143554688,COMPLETE
406,0.37058719992637634,2023-09-04 21:17:32.159028,2023-09-04 21:17:32.595783,0 days 00:00:00.436755,Tanh,Tanh,,,74,18,10.0,,,0.024293098156272605,2,477,0.7995978864661792,8.181682609042396e-05,143.4619652884347,COMPLETE
407,0.31278401613235474,2023-09-04 21:17:32.596101,2023-09-04 21:17:33.063338,0 days 00:00:00.467237,Tanh,Tanh,,,78,18,9.0,,,0.030043992756553208,2,233,0.7443687439391363,6.991802259227917e-05,232.06456909179687,COMPLETE
408,0.49174511432647705,2023-09-04 21:17:33.063652,2023-09-04 21:17:33.711762,0 days 00:00:00.648110,Leaky,Sigmoid,,,81,15,12.0,,,0.0007419553461428546,2,79,0.6770058600283964,0.007579006448104874,643.9159136422073,COMPLETE
409,0.34272125363349915,2023-09-04 21:17:33.712066,2023-09-04 21:17:34.189120,0 days 00:00:00.477054,Tanh,Tanh,,,55,17,11.0,,,0.01758013655587941,2,249,0.7536387701297534,0.00010877886791917066,128.98942156535824,COMPLETE
410,0.3719336688518524,2023-09-04 21:17:34.189425,2023-09-04 21:17:34.462535,0 days 00:00:00.273110,Sigmoid,ReLU,,,65,16,8.0,,,0.061308619160418354,2,214,0.7098236799667154,0.00013911561121810422,178.121096097506,COMPLETE
411,0.3445129692554474,2023-09-04 21:17:34.462839,2023-09-04 21:17:34.674744,0 days 00:00:00.211905,Tanh,Leaky,,,76,19,10.0,,,0.021662678050497323,2,428,0.2680868491530438,0.0002038983988955033,170.27218598010492,COMPLETE
412,0.37765368819236755,2023-09-04 21:17:34.675056,2023-09-04 21:17:34.907903,0 days 00:00:00.232847,Tanh,Tanh,,,72,18,9.0,,,0.011093698030866161,2,112,0.31663308635889614,0.0002755954432767414,149.48526446024576,COMPLETE
413,0.3757665753364563,2023-09-04 21:17:34.908223,2023-09-04 21:17:35.231636,0 days 00:00:00.323413,Leaky,Sigmoid,,,68,19,11.0,,,0.026615106376355616,2,467,0.38128930027412705,9.034737507853729e-05,174.25239045279366,COMPLETE
414,0.3308744430541992,2023-09-04 21:17:35.231958,2023-09-04 21:17:35.562094,0 days 00:00:00.330136,Tanh,Tanh,,,75,17,8.0,,,0.049853598355956555,2,273,0.7689985355134635,0.00017042457086181072,176.0387578010559,COMPLETE
415,0.28829628229141235,2023-09-04 21:17:35.562402,2023-09-04 21:17:37.339431,0 days 00:00:01.777029,ReLU,Tanh,,,70,17,9.0,,,0.0013673078272269017,2,266,0.7246011605061154,5.989450092793138e-05,223.59356195321354,COMPLETE
416,1.1463850736618042,2023-09-04 21:17:37.339785,2023-09-04 21:17:37.537384,0 days 00:00:00.197599,Tanh,Tanh,,,84,18,9.0,,,2.198430134285033e-05,2,92,0.11706601999133877,0.00012001208101818923,204.72328003593114,COMPLETE
417,0.33905312418937683,2023-09-04 21:17:37.537696,2023-09-04 21:17:38.785364,0 days 00:00:01.247668,Leaky,Sigmoid,,,10,18,10.0,,,0.03704958582477271,2,66,0.42069143780199453,0.0003238282518677533,175.96739898681642,COMPLETE
418,0.4464486539363861,2023-09-04 21:17:38.785679,2023-09-04 21:17:38.952623,0 days 00:00:00.166944,Tanh,Tanh,,,67,19,11.0,,,0.0774514830461884,2,286,0.22445393109649653,0.00014858246484554107,701.4244022369385,COMPLETE
419,0.33530664443969727,2023-09-04 21:17:38.952937,2023-09-04 21:17:39.297360,0 days 00:00:00.344423,Tanh,ReLU,,,80,17,12.0,,,0.017279333734383652,2,304,0.6465138438660538,1.2630456291178777e-05,185.09631384872807,COMPLETE
420,0.3064490556716919,2023-09-04 21:17:39.297677,2023-09-04 21:17:40.712574,0 days 00:00:01.414897,Sigmoid,Leaky,,,73,20,8.0,,,0.012672548767086234,2,444,0.6864676096317862,0.00021475027475208376,158.55724113218247,COMPLETE
421,0.332141250371933,2023-09-04 21:17:40.712902,2023-09-04 21:17:41.959326,0 days 00:00:01.246424,Tanh,Tanh,,,78,16,10.0,,,0.002300433577309541,2,221,0.7679862457832957,0.00010106292085200984,266.545004900764,COMPLETE
422,0.3274533450603485,2023-09-04 21:17:41.959653,2023-09-04 21:17:42.412832,0 days 00:00:00.453179,Leaky,Sigmoid,,,63,18,14.0,,,0.03057493594362652,2,60,0.5202588369548217,0.0005866947377353145,167.2637233734131,COMPLETE
423,0.4459135830402374,2023-09-04 21:17:42.413144,2023-09-04 21:17:43.026649,0 days 00:00:00.613505,Tanh,Tanh,,,71,19,11.0,,,0.0009699318175988805,2,257,0.23910320189800693,0.000128487068697914,171.903773890904,COMPLETE
424,0.29220908880233765,2023-09-04 21:17:43.026948,2023-09-04 21:17:43.449387,0 days 00:00:00.422439,Tanh,Tanh,,,58,17,9.0,,,0.02200606964483196,2,293,0.7989853433861127,8.016104433222191e-05,173.93274754115512,COMPLETE
425,0.2980571687221527,2023-09-04 21:17:43.449693,2023-09-04 21:17:43.806039,0 days 00:00:00.356346,Leaky,Sigmoid,,,74,18,9.0,,,0.04219561501483492,2,277,0.7376979826181592,0.00016766214320739308,177.75701798333063,COMPLETE
426,0.3318321406841278,2023-09-04 21:17:43.806357,2023-09-04 21:17:44.147381,0 days 00:00:00.341024,Tanh,Tanh,,,69,18,10.0,,,0.009118247029540902,2,237,0.7083707210742672,0.00019431918491703994,7130.580451516544,COMPLETE
427,0.32491204142570496,2023-09-04 21:17:44.147705,2023-09-04 21:17:44.499968,0 days 00:00:00.352263,Tanh,Tanh,,,76,19,8.0,,,0.02715564842854838,2,458,0.5464115011284312,0.00041734388103393215,161.11033535003662,COMPLETE
428,0.31667646765708923,2023-09-04 21:17:44.500286,2023-09-04 21:17:44.942625,0 days 00:00:00.442339,Tanh,ReLU,,,72,17,12.0,,,0.014508794092366176,2,79,0.7475001160558704,0.0020109642623892736,943.8263619162819,COMPLETE
429,0.3277633488178253,2023-09-04 21:17:44.942951,2023-09-04 21:17:45.717368,0 days 00:00:00.774417,Leaky,Leaky,,,66,20,13.0,,,0.003265346614644846,2,92,0.6191788844045053,0.00025680098169614127,145.7619743347168,COMPLETE
430,0.32741355895996094,2023-09-04 21:17:45.717678,2023-09-04 21:17:46.676877,0 days 00:00:00.959199,Sigmoid,Sigmoid,,,60,16,10.0,,,0.019017239222261815,2,101,0.6640207730253355,0.00010931017032936809,173.54456344453416,COMPLETE
431,0.28444209694862366,2023-09-04 21:17:46.677190,2023-09-04 21:17:47.311614,0 days 00:00:00.634424,Tanh,Tanh,,,26,19,11.0,,,0.03427315294575058,2,248,0.7701775110348171,0.00015141409648397868,145.65833282470703,COMPLETE
432,0.3674733340740204,2023-09-04 21:17:47.311938,2023-09-04 21:17:47.510067,0 days 00:00:00.198129,Tanh,Tanh,,,77,18,8.0,,,0.06298382985292747,2,266,0.49989344126406643,6.5030690017841e-05,183.49924674400916,COMPLETE
433,0.29376542568206787,2023-09-04 21:17:47.510386,2023-09-04 21:17:48.046886,0 days 00:00:00.536500,Leaky,Tanh,,,81,17,9.0,,,0.024360568977540405,2,440,0.7995550118271616,0.00012621609057986364,156.9383987426758,COMPLETE
434,0.7677962779998779,2023-09-04 21:17:48.047191,2023-09-04 21:17:48.393460,0 days 00:00:00.346269,Tanh,Sigmoid,,,69,18,9.0,,,0.00015260032880894017,2,86,0.2580919441015126,8.73825722909076e-05,141.44330712251886,COMPLETE
435,0.3951410949230194,2023-09-04 21:17:48.393778,2023-09-04 21:17:48.663987,0 days 00:00:00.270209,Tanh,Tanh,,,79,19,10.0,,,0.049002473150038826,2,115,0.3437066511792067,0.00018492003931022157,199.82433686433015,COMPLETE
436,0.3270435333251953,2023-09-04 21:17:48.664349,2023-09-04 21:17:49.029304,0 days 00:00:00.364955,Tanh,Tanh,,,86,17,8.0,,,0.07892580424949965,2,395,0.7226823805116517,0.004306399605760564,347.42838119879,COMPLETE
437,0.3498828709125519,2023-09-04 21:17:49.029602,2023-09-04 21:17:49.337714,0 days 00:00:00.308112,Leaky,ReLU,,,83,18,11.0,,,0.015373497361992875,2,75,0.6913688109893857,0.00022832878140479916,136.8900754591998,COMPLETE
438,0.3145863115787506,2023-09-04 21:17:49.338029,2023-09-04 21:17:50.404944,0 days 00:00:01.066915,Sigmoid,Sigmoid,,,74,16,12.0,,,0.020545723744575303,2,450,0.7535974999015901,2.7678337618978498e-05,256.8979116688604,COMPLETE
439,0.39747288823127747,2023-09-04 21:17:50.405263,2023-09-04 21:17:50.875239,0 days 00:00:00.469976,Tanh,Leaky,,,71,20,9.0,,,0.006705069931301672,2,472,0.7276794997471316,0.0001467051379910427,164.69731934865317,COMPLETE
440,0.3484398126602173,2023-09-04 21:17:50.875574,2023-09-04 21:17:51.166846,0 days 00:00:00.291272,ReLU,Tanh,,,67,18,10.0,,,0.030155686978712664,2,229,0.4868544992194328,0.0006748346083447785,170.48515129089355,COMPLETE
441,0.3237990140914917,2023-09-04 21:17:51.167167,2023-09-04 21:17:51.591809,0 days 00:00:00.424642,Tanh,Tanh,,,65,17,8.0,,,0.041571024882093105,2,257,0.7709628086226344,3.422698665473729e-05,111.72127669896835,COMPLETE
442,0.2866303324699402,2023-09-04 21:17:51.592133,2023-09-04 21:17:52.093068,0 days 00:00:00.500935,Leaky,Sigmoid,,,53,19,9.0,,,0.024065223244387184,2,147,0.6633535651995549,0.00010153641782161075,281.51027215045434,COMPLETE
443,0.5537916421890259,2023-09-04 21:17:52.093375,2023-09-04 21:17:52.354505,0 days 00:00:00.261130,Tanh,Tanh,ReLU,,73,18,11.0,3.0,,0.013006780745128455,3,105,0.4000515752489383,0.000129059301771184,377.96512362831515,COMPLETE
444,0.47900959849357605,2023-09-04 21:17:52.354823,2023-09-04 21:17:52.823945,0 days 00:00:00.469122,Tanh,Tanh,,,70,17,7.0,,,0.01772432476691377,2,50,0.694291339981983,0.05054682435498617,640.982353515625,COMPLETE
445,0.37627172470092773,2023-09-04 21:17:52.824255,2023-09-04 21:17:57.758656,0 days 00:00:04.934401,Tanh,Sigmoid,,,77,16,13.0,,,0.0011124160159330493,2,279,0.735695048554161,0.0003142848941694333,912.9633528733339,COMPLETE
446,0.37790900468826294,2023-09-04 21:17:57.759197,2023-09-04 21:17:59.060500,0 days 00:00:01.301303,Leaky,Tanh,,,37,21,10.0,,,0.03515917376266285,2,415,0.7730256802109843,0.0001729213013264683,140.93859345572335,COMPLETE
447,0.45610511302948,2023-09-04 21:17:59.061053,2023-09-04 21:17:59.764889,0 days 00:00:00.703836,Tanh,ReLU,,,68,15,8.0,,,0.004636251905420909,2,290,0.1998088135653752,7.168700182154547e-05,309.51995586526806,COMPLETE
448,0.5500669479370117,2023-09-04 21:17:59.765216,2023-09-04 21:18:00.327272,0 days 00:00:00.562056,Sigmoid,Leaky,,,57,18,9.0,,,0.0015754555816857305,2,481,0.1005119124721808,0.00011170094554731444,355.71784338951113,COMPLETE
449,0.3964517414569855,2023-09-04 21:18:00.327585,2023-09-04 21:18:02.565237,0 days 00:00:02.237652,Tanh,Tanh,,,72,19,10.0,,,0.0002936211631221746,2,249,0.6341790740767004,0.0008264469441806495,678.6257913735018,COMPLETE
450,0.41442328691482544,2023-09-04 21:18:02.565565,2023-09-04 21:18:02.904598,0 days 00:00:00.339033,Leaky,Tanh,,,75,19,9.0,,,0.05530517411537056,2,463,0.7990044575721941,4.6041107146861494e-05,224.86156439012098,COMPLETE
451,0.3796444237232208,2023-09-04 21:18:02.904920,2023-09-04 21:18:03.147843,0 days 00:00:00.242923,Tanh,Sigmoid,,,62,18,11.0,,,0.02864906995739697,2,70,0.2871205805722176,9.092782596395941e-05,196.1277812321981,COMPLETE
452,0.28982293605804443,2023-09-04 21:18:03.148155,2023-09-04 21:18:03.546060,0 days 00:00:00.397905,Tanh,Tanh,,,80,17,12.0,,,0.009590944907330501,2,121,0.7464432181163512,0.00020531155406418604,215.49713316417876,COMPLETE
453,0.30925092101097107,2023-09-04 21:18:03.546378,2023-09-04 21:18:03.902175,0 days 00:00:00.355797,Tanh,Tanh,,,83,18,8.0,,,0.021618802689133135,2,500,0.7097594679818334,0.00014892726594087848,157.94397087097167,COMPLETE
454,0.4263646602630615,2023-09-04 21:18:03.902505,2023-09-04 21:18:04.727019,0 days 00:00:00.824514,Leaky,Sigmoid,,,71,15,13.0,,,0.002616478284487877,2,306,0.603640694701776,0.0002625864909417638,165.66138112769937,COMPLETE
455,0.3656640648841858,2023-09-04 21:18:04.727344,2023-09-04 21:18:05.319456,0 days 00:00:00.592112,Tanh,,,,74,20,,,,0.011953568664772238,1,266,0.677143531291049,0.0001265118622850959,178.11555793486446,COMPLETE
456,0.4822830557823181,2023-09-04 21:18:05.319787,2023-09-04 21:18:05.475813,0 days 00:00:00.156026,Tanh,Tanh,,,85,2,9.0,,,0.06750276885116009,2,243,0.32544140561879964,5.5577569910033526e-05,282.6002699329007,COMPLETE
457,0.3361758589744568,2023-09-04 21:18:05.476143,2023-09-04 21:18:06.237651,0 days 00:00:00.761508,Sigmoid,ReLU,,,77,14,11.0,,,0.032801770525548266,2,435,0.7667776196313513,0.00016792824722504994,140.88849183989734,COMPLETE
458,0.3439059555530548,2023-09-04 21:18:06.237971,2023-09-04 21:18:06.394829,0 days 00:00:00.156858,Leaky,Leaky,,,64,16,17.0,,,0.016450559196430004,2,170,0.2742679467318742,0.00010156410742996097,136.95301720403856,COMPLETE
459,0.5604803562164307,2023-09-04 21:18:06.395138,2023-09-04 21:18:06.882881,0 days 00:00:00.487743,Tanh,Tanh,Sigmoid,Tanh,69,17,10.0,7.0,20.0,0.04036607450910187,4,93,0.723151981919089,0.004091234231311952,8694.905933277027,COMPLETE
460,0.31631752848625183,2023-09-04 21:18:06.883219,2023-09-04 21:18:07.236268,0 days 00:00:00.353049,Tanh,Sigmoid,,,88,19,12.0,,,0.027195444604769515,2,210,0.578307065646804,7.770617727168669e-05,159.12455344686703,COMPLETE
461,0.3374640941619873,2023-09-04 21:18:07.236584,2023-09-04 21:18:07.769984,0 days 00:00:00.533400,Tanh,Tanh,,,67,18,7.0,,,0.008099987220427495,2,298,0.7476628645597848,0.00022678386217965331,134.77158663823053,COMPLETE
462,0.36592280864715576,2023-09-04 21:18:07.770302,2023-09-04 21:18:08.020129,0 days 00:00:00.249827,Leaky,Tanh,,,75,17,8.0,,,0.0870882767144443,2,271,0.3009331678849039,0.00013570445434023284,184.76230403355189,COMPLETE
463,0.3708789050579071,2023-09-04 21:18:08.020463,2023-09-04 21:18:08.249827,0 days 00:00:00.229364,ReLU,Sigmoid,,,72,18,10.0,,,0.020158262634655696,2,81,0.2490686572842882,0.0005152332212463743,205.53784284920528,COMPLETE
464,0.5234605073928833,2023-09-04 21:18:08.250156,2023-09-04 21:18:08.715370,0 days 00:00:00.465214,Tanh,Tanh,,,79,17,6.0,,,0.0010700647147405813,2,60,0.4530860091588956,0.013602376758231748,306.9590123494466,COMPLETE
465,0.35832446813583374,2023-09-04 21:18:08.715694,2023-09-04 21:18:09.257645,0 days 00:00:00.541951,Tanh,Tanh,,,70,19,9.0,,,0.04872670212242586,2,451,0.7997848872618059,0.00018802857430736048,119.70717381496056,COMPLETE
466,0.3305217921733856,2023-09-04 21:18:09.257973,2023-09-04 21:18:09.558261,0 days 00:00:00.300288,Leaky,ReLU,,,81,18,11.0,,,0.02402279396282765,2,235,0.7018835864037387,0.00037635426161657017,7361.76435250947,COMPLETE
467,0.6433705687522888,2023-09-04 21:18:09.558577,2023-09-04 21:18:09.648970,0 days 00:00:00.090393,Sigmoid,Leaky,,,73,20,9.0,,,0.03654909769032124,2,282,0.10667340808652719,0.018367352238496882,200.93734320278824,COMPLETE
468,0.28866156935691833,2023-09-04 21:18:09.649311,2023-09-04 21:18:10.222421,0 days 00:00:00.573110,Tanh,Tanh,,,68,19,8.0,,,0.013732286915651485,2,254,0.7663749804178506,0.0013912680062803304,160.37467041015626,COMPLETE
469,0.5708510279655457,2023-09-04 21:18:10.222830,2023-09-04 21:18:11.355187,0 days 00:00:01.132357,Tanh,Sigmoid,,,76,6,10.0,,,0.0006105282294081637,2,134,0.6664770339464144,0.06655342216145768,127.25917174437336,COMPLETE
470,0.4694949984550476,2023-09-04 21:18:11.355510,2023-09-04 21:18:12.057997,0 days 00:00:00.702487,Tanh,Tanh,,,66,16,9.0,,,0.000862170213513332,2,490,0.23184461508192644,0.00011901376984989796,282.3128880681218,COMPLETE
471,0.29085054993629456,2023-09-04 21:18:12.058548,2023-09-04 21:18:12.498089,0 days 00:00:00.439541,Leaky,Tanh,,,78,18,14.0,,,0.0576877595454201,2,105,0.7273752472196797,9.54633050502725e-05,196.59140241468276,COMPLETE
472,0.33630290627479553,2023-09-04 21:18:12.498424,2023-09-04 21:18:13.353786,0 days 00:00:00.855362,Tanh,Sigmoid,,,44,17,11.0,,,0.01847221198887575,2,218,0.7671047994312366,0.0027827759792003314,625.1927661895752,COMPLETE
473,0.3967011272907257,2023-09-04 21:18:13.354116,2023-09-04 21:18:13.535126,0 days 00:00:00.181010,Tanh,Tanh,,,60,10,7.0,,,0.028583117769319256,2,290,0.3736941981704031,0.00015427871525448058,192.55026301631221,COMPLETE
474,0.30936893820762634,2023-09-04 21:18:13.535431,2023-09-04 21:18:14.516978,0 days 00:00:00.981547,Leaky,Tanh,,,73,18,12.0,,,0.011320916328548621,2,366,0.6485453362341682,0.00021716385777644404,166.93587521144323,COMPLETE
475,0.32463374733924866,2023-09-04 21:18:14.517320,2023-09-04 21:18:17.496759,0 days 00:00:02.979439,Tanh,ReLU,,,71,19,10.0,,,0.0007405349925515366,2,427,0.6965997501947196,0.00027716365111126693,128.28281590526055,COMPLETE
476,0.34967124462127686,2023-09-04 21:18:17.497077,2023-09-04 21:18:18.282214,0 days 00:00:00.785137,Sigmoid,Sigmoid,,,75,17,8.0,,,0.02399625176134405,2,260,0.7404621696206058,8.138792958948098e-05,139.36671030798624,COMPLETE
477,0.30097895860671997,2023-09-04 21:18:18.282550,2023-09-04 21:18:18.921369,0 days 00:00:00.638819,Tanh,Leaky,,,69,20,9.0,,,0.01616918836443485,2,276,0.7659836330836702,2.049065223749658e-05,257.1587438275737,COMPLETE
478,0.2783881723880768,2023-09-04 21:18:18.921768,2023-09-04 21:18:20.330407,0 days 00:00:01.408639,Tanh,Tanh,,,55,18,9.0,,,0.0033321837872946226,2,96,0.7995832770161534,6.445575917241136e-05,128.4289894104004,COMPLETE
479,0.40372228622436523,2023-09-04 21:18:20.330969,2023-09-04 21:18:21.620531,0 days 00:00:01.289562,Leaky,Tanh,,,82,16,10.0,,,0.0015687385396512096,2,331,0.7150535823794965,0.002262037754830244,158.06278355916342,COMPLETE
480,0.3742278814315796,2023-09-04 21:18:21.621079,2023-09-04 21:18:21.937573,0 days 00:00:00.316494,Tanh,Sigmoid,,,79,18,11.0,,,0.03241506589019493,2,385,0.39074129247362355,0.00016959944305618098,228.15122881802645,COMPLETE
481,0.45631834864616394,2023-09-04 21:18:21.937908,2023-09-04 21:18:22.954767,0 days 00:00:01.016859,Tanh,Tanh,,,85,17,13.0,,,0.0020198927008766004,2,313,0.6288862675627993,0.02617168212903299,162.7685330155967,COMPLETE
482,0.32026568055152893,2023-09-04 21:18:22.955100,2023-09-04 21:18:23.391325,0 days 00:00:00.436225,Leaky,Tanh,,,64,19,8.0,,,0.07034899099695945,2,68,0.6841504970007497,0.0009761111259945708,216.4975592873313,COMPLETE
483,0.4501704275608063,2023-09-04 21:18:23.391658,2023-09-04 21:18:23.498077,0 days 00:00:00.106419,Tanh,Tanh,,,71,18,9.0,,,0.04023113946464801,2,459,0.17961738569073726,0.00011638480994782107,198.0174366877629,COMPLETE
484,0.48714855313301086,2023-09-04 21:18:23.498400,2023-09-04 21:18:23.715876,0 days 00:00:00.217476,Tanh,Sigmoid,,,73,17,12.0,,,0.02067880014970895,2,203,0.1558272407129924,0.0001489197285397842,186.24110584259034,COMPLETE
