number,value,datetime_start,datetime_complete,duration,params_activation1,params_activation2,params_activation3,params_activation4,params_batch_size,params_fl1,params_fl2,params_fl3,params_fl4,params_learning_rate,params_n_layers,params_num_epochs,params_train_size,params_weight_decay,user_attrs_mre,state
573,0.3888169527053833,2023-09-04 22:02:49.064748,2023-09-04 22:02:49.210105,0 days 00:00:00.145357,ReLU,Sigmoid,ReLU,,57,14,11.0,20.0,,0.056215498455038974,3,102,0.13537037018838094,2.69094352045703e-05,123.15468716621399,COMPLETE
574,0.3151771128177643,2023-09-04 22:02:49.210471,2023-09-04 22:02:50.858506,0 days 00:00:01.648035,ReLU,Sigmoid,ReLU,,18,13,10.0,21.0,,0.019167951282696546,3,94,0.7722929312290459,2.3817052663708622e-05,77.31240065892537,COMPLETE
575,0.35247141122817993,2023-09-04 22:02:50.858859,2023-09-04 22:02:51.127083,0 days 00:00:00.268224,ReLU,ReLU,ReLU,,16,14,10.0,18.0,,0.024236470254623742,3,82,0.300271344005468,1.7802708346796583e-05,338.7698160807292,COMPLETE
576,0.32910794019699097,2023-09-04 22:02:51.127466,2023-09-04 22:02:51.600940,0 days 00:00:00.473474,ReLU,Sigmoid,ReLU,,37,14,11.0,17.0,,0.014692845597822425,3,106,0.7229351997643327,3.269306291979751e-05,92.27044860839844,COMPLETE
577,0.373129278421402,2023-09-04 22:02:51.601304,2023-09-04 22:02:51.834048,0 days 00:00:00.232744,ReLU,Sigmoid,ReLU,,47,20,9.0,19.0,,0.04196655828451158,3,88,0.22852094536262518,0.003037283308484564,694.4187081473215,COMPLETE
578,0.2863040566444397,2023-09-04 22:02:51.834409,2023-09-04 22:02:52.406252,0 days 00:00:00.571843,ReLU,Tanh,ReLU,,42,23,10.0,18.0,,0.013039115217934919,3,74,0.6736192879331794,2.332527958199421e-05,97.89561992221408,COMPLETE
579,0.31284019351005554,2023-09-04 22:02:52.406602,2023-09-04 22:02:54.738490,0 days 00:00:02.331888,ReLU,Leaky,ReLU,,22,21,9.0,20.0,,0.001036368853034426,3,109,0.6390607346237533,0.00012795659453722688,107.52810354331105,COMPLETE
580,0.41975972056388855,2023-09-04 22:02:54.738872,2023-09-04 22:02:57.029106,0 days 00:00:02.290234,ReLU,ReLU,ReLU,,14,22,4.0,19.0,,0.0002319452676986921,3,98,0.40582419706930195,0.06655923244583586,99.73278948725486,COMPLETE
581,0.3262576460838318,2023-09-04 22:02:57.029454,2023-09-04 22:02:57.570316,0 days 00:00:00.540862,ReLU,Sigmoid,Leaky,,33,13,8.0,18.0,,0.027419614841290626,3,428,0.53754321567613,1.6982420048617973e-05,94.05935807661577,COMPLETE
582,1.1308432817459106,2023-09-04 22:02:57.570697,2023-09-04 22:02:58.126875,0 days 00:00:00.556178,Leaky,Sigmoid,Leaky,,19,20,7.0,4.0,,1.1867883850348194e-05,3,65,0.1718710327067082,0.0006490396526039876,142.73314208984374,COMPLETE
583,0.28218549489974976,2023-09-04 22:02:58.127250,2023-09-04 22:02:58.737446,0 days 00:00:00.610196,ReLU,Sigmoid,ReLU,,31,21,10.0,17.0,,0.02050714487875687,3,93,0.7994485165436592,1.2846836589495496e-05,95.95162709554036,COMPLETE
584,0.3920159637928009,2023-09-04 22:02:58.737815,2023-09-04 22:02:59.180197,0 days 00:00:00.442382,Sigmoid,ReLU,Leaky,,92,14,5.0,22.0,,0.017371642355424568,3,81,0.7487250108797227,0.00040486581738486354,104.79796867370605,COMPLETE
585,0.3507550060749054,2023-09-04 22:02:59.180582,2023-09-04 22:03:00.101448,0 days 00:00:00.920866,ReLU,,,,24,21,,,,0.00030499683279399444,1,56,0.7070416084811757,9.80890506745617e-05,105.63910320826939,COMPLETE
586,0.29778456687927246,2023-09-04 22:03:00.101813,2023-09-04 22:03:01.042836,0 days 00:00:00.941023,Tanh,,,,35,22,,,,0.005640643890243026,1,70,0.768610243850731,0.001938118034416091,117.00321644374303,COMPLETE
587,0.5347889065742493,2023-09-04 22:03:01.043166,2023-09-04 22:03:01.335184,0 days 00:00:00.292018,Tanh,Tanh,Leaky,Tanh,12,24,19.0,3.0,10.0,0.03452049442090361,4,210,0.17357631228914006,0.003121065810442245,124.80619946648093,COMPLETE
588,0.3006867468357086,2023-09-04 22:03:01.335565,2023-09-04 22:03:01.936270,0 days 00:00:00.600705,Leaky,Sigmoid,Tanh,,73,19,5.0,16.0,,0.010507020643920752,3,116,0.7999524988579951,3.0723346423374664e-05,99.2077504938299,COMPLETE
589,0.31453683972358704,2023-09-04 22:03:01.936661,2023-09-04 22:03:03.200767,0 days 00:00:01.264106,Tanh,Sigmoid,ReLU,Tanh,39,13,10.0,5.0,24.0,0.02481351828259739,4,220,0.7288583204150257,0.00017829283881958801,100.38031463623047,COMPLETE
590,0.2881232798099518,2023-09-04 22:03:03.201164,2023-09-04 22:03:05.441865,0 days 00:00:02.240701,Tanh,ReLU,Leaky,,15,20,2.0,21.0,,0.0032846507840180385,3,80,0.5546025714497639,0.00014806019646026092,188.6056939202386,COMPLETE
591,0.3457707464694977,2023-09-04 22:03:05.442232,2023-09-04 22:03:06.580072,0 days 00:00:01.137840,ReLU,Sigmoid,Sigmoid,,21,11,9.0,8.0,,0.012785043944956383,3,94,0.679797907383223,2.0359665301482938e-05,98.86207853044782,COMPLETE
592,0.4956021308898926,2023-09-04 22:03:06.580516,2023-09-04 22:03:06.705161,0 days 00:00:00.124645,Tanh,,,,18,14,,,,0.01569659289393834,1,263,0.10699453883615903,1.4325597294557375e-05,299.61356652301293,COMPLETE
593,0.4613438546657562,2023-09-04 22:03:06.705514,2023-09-04 22:03:07.038461,0 days 00:00:00.332947,Tanh,Sigmoid,Leaky,,29,22,12.0,7.0,,0.002141625587380394,3,106,0.10083850901775665,0.0002690759188086224,172.50422143936157,COMPLETE
594,0.367876797914505,2023-09-04 22:03:07.038824,2023-09-04 22:03:07.293698,0 days 00:00:00.254874,Tanh,,,,41,21,,,,0.029677327726246285,1,237,0.4450801545575312,0.009223639431603535,135.92047266806327,COMPLETE
595,0.46617749333381653,2023-09-04 22:03:07.294046,2023-09-04 22:03:09.824871,0 days 00:00:02.530825,Sigmoid,Tanh,ReLU,,20,23,18.0,4.0,,0.00015703976817479004,3,359,0.1560194482391139,3.965116310107659e-05,434.89797270198386,COMPLETE
596,0.4732820391654968,2023-09-04 22:03:09.825319,2023-09-04 22:03:10.065311,0 days 00:00:00.239992,Tanh,ReLU,Leaky,Tanh,65,22,3.0,3.0,19.0,0.020739014216730845,4,86,0.15024915444075124,2.562935664485664e-05,232.16354217529297,COMPLETE
597,0.45005324482917786,2023-09-04 22:03:10.066013,2023-09-04 22:03:20.761021,0 days 00:00:10.695008,Tanh,Sigmoid,,,17,20,11.0,,,8.399678759451384e-05,2,192,0.771105489413948,0.01985693381639712,117.4133448600769,COMPLETE
598,0.3344016969203949,2023-09-04 22:03:20.762390,2023-09-04 22:03:22.670196,0 days 00:00:01.907806,Tanh,Sigmoid,Leaky,,77,21,6.0,20.0,,0.003977114776392486,3,128,0.6104504007808111,0.0016904533192637543,127.6448811531067,COMPLETE
599,0.37013399600982666,2023-09-04 22:03:22.670806,2023-09-04 22:03:28.157259,0 days 00:00:05.486453,ReLU,,,,22,9,,,,0.0005724632794565663,1,250,0.36643122127146677,0.002703257761547178,119.68669784338766,COMPLETE
600,0.7339479923248291,2023-09-04 22:03:28.157839,2023-09-04 22:03:30.855810,0 days 00:00:02.697971,Tanh,ReLU,,,44,23,20.0,,,1.391159296739368e-05,2,61,0.7329789161871695,0.00021002683833792836,97.23968605917008,COMPLETE
601,0.326297789812088,2023-09-04 22:03:30.861956,2023-09-04 22:03:32.840669,0 days 00:00:01.978713,Tanh,Sigmoid,ReLU,,25,24,16.0,6.0,,0.005983390042377997,3,98,0.3593708564790617,0.003560326945163265,109.57758499404132,COMPLETE
602,0.3688548505306244,2023-09-04 22:03:32.841382,2023-09-04 22:03:34.455895,0 days 00:00:01.614513,Leaky,Tanh,Leaky,Leaky,15,12,4.0,12.0,16.0,0.04489559123003585,4,334,0.35038319715695787,0.0007729504186902915,185.16005904586225,COMPLETE
603,0.3482235372066498,2023-09-04 22:03:34.456470,2023-09-04 22:03:40.212093,0 days 00:00:05.755623,Tanh,Sigmoid,,,13,20,8.0,,,0.007951946720800185,2,73,0.7017291142215804,0.00011880785620946535,98.05650342743972,COMPLETE
604,0.29727819561958313,2023-09-04 22:03:40.214458,2023-09-04 22:03:42.023283,0 days 00:00:01.808825,Tanh,,,,36,21,,,,0.010336179394191824,1,227,0.767879137382945,8.813009377544262e-05,125.45300736538199,COMPLETE
605,0.2932024598121643,2023-09-04 22:03:42.024695,2023-09-04 22:03:43.453375,0 days 00:00:01.428680,Tanh,Sigmoid,,,19,22,23.0,,,0.03610383401319955,2,111,0.6598353183045705,1.1698804646146922e-05,107.10449251921281,COMPLETE
606,0.3094053566455841,2023-09-04 22:03:43.454331,2023-09-04 22:03:46.237130,0 days 00:00:02.782799,ReLU,Leaky,Tanh,,17,21,24.0,4.0,,0.017399741712954896,3,86,0.7441576079878274,1.8919597344517857e-05,92.90092648957905,COMPLETE
607,0.30343571305274963,2023-09-04 22:03:46.237760,2023-09-04 22:03:47.427351,0 days 00:00:01.189591,Tanh,ReLU,,,23,19,19.0,,,0.004861168164734889,2,206,0.7749863423315413,4.951007989515054e-05,103.09695522601788,COMPLETE
608,0.5539747476577759,2023-09-04 22:03:47.428130,2023-09-04 22:03:48.831189,0 days 00:00:01.403059,Tanh,Sigmoid,,,38,14,7.0,,,0.00011281349445313232,2,50,0.7099868304877893,0.0015482912401542574,111.93642181396484,COMPLETE
609,0.3205075263977051,2023-09-04 22:03:48.831741,2023-09-04 22:03:50.300397,0 days 00:00:01.468656,Tanh,Tanh,Leaky,,21,20,9.0,2.0,,0.022286958996361038,3,301,0.7992520198256915,3.6603347695954495e-05,92.62546081542969,COMPLETE
610,0.548754870891571,2023-09-04 22:03:50.301610,2023-09-04 22:04:04.883975,0 days 00:00:14.582365,Sigmoid,Sigmoid,Leaky,Tanh,11,13,21.0,7.0,4.0,4.464390009239715e-05,4,133,0.5187665853315818,6.942450549739429e-05,106.02475411551339,COMPLETE
611,0.35241031646728516,2023-09-04 22:04:04.884641,2023-09-04 22:04:05.656222,0 days 00:00:00.771581,Tanh,ReLU,,,68,17,3.0,,,0.011830802386155683,2,120,0.7432109943409928,1.632452041512771e-05,103.30937484215046,COMPLETE
612,1.079277753829956,2023-09-04 22:04:05.657159,2023-09-04 22:04:06.205307,0 days 00:00:00.548148,Tanh,,,,34,21,,,,2.8313906207560948e-05,1,100,0.1191228885337476,0.00014981859497116825,124.4659822845459,COMPLETE
613,0.3380897045135498,2023-09-04 22:04:06.206412,2023-09-04 22:04:07.500025,0 days 00:00:01.293613,ReLU,Sigmoid,,,27,15,6.0,,,0.07974950682442272,2,76,0.624948310071089,1.0063766203524792e-05,98.5171601266572,COMPLETE
614,0.45828312635421753,2023-09-04 22:04:07.500740,2023-09-04 22:04:08.185296,0 days 00:00:00.684556,Tanh,Sigmoid,ReLU,,60,23,5.0,5.0,,0.0016250459498007466,3,68,0.2143769941675599,2.7185025138196424e-05,134.13697781282312,COMPLETE
615,0.393481582403183,2023-09-04 22:04:08.186086,2023-09-04 22:04:16.896559,0 days 00:00:08.710473,Tanh,ReLU,,,20,22,11.0,,,2.122336164909906e-05,2,181,0.682185899877802,0.00029809249767060467,145.5009734433,COMPLETE
616,0.3386528193950653,2023-09-04 22:04:16.897175,2023-09-04 22:04:20.134311,0 days 00:00:03.237136,Leaky,Sigmoid,Sigmoid,,16,8,18.0,1.0,,0.01420671029493541,3,90,0.7531175576105751,0.005626752788789488,100.85730457305908,COMPLETE
617,0.3262298107147217,2023-09-04 22:04:20.136856,2023-09-04 22:04:21.212758,0 days 00:00:01.075902,Tanh,Tanh,Leaky,Tanh,53,20,10.0,22.0,21.0,0.027859299616707547,4,222,0.3775499682424748,0.0009830570416896897,104.37728379412395,COMPLETE
618,0.3583388924598694,2023-09-04 22:04:21.215034,2023-09-04 22:04:22.933432,0 days 00:00:01.718398,Tanh,Sigmoid,,,40,22,17.0,,,0.006953691711070794,2,238,0.42409710885690777,0.0010223848042666696,107.53707186381023,COMPLETE
619,0.3605456054210663,2023-09-04 22:04:22.934289,2023-09-04 22:04:23.445398,0 days 00:00:00.511109,Tanh,,,,18,23,,,,0.009252916599671965,1,169,0.17783160120206368,0.0001057877866576304,124.37942212693234,COMPLETE
620,0.3517073094844818,2023-09-04 22:04:23.445841,2023-09-04 22:04:24.959155,0 days 00:00:01.513314,ReLU,Sigmoid,Leaky,,23,14,4.0,15.0,,0.05410829731428937,3,83,0.7251007626032034,0.0011842652184963145,110.52410888671875,COMPLETE
621,0.3964182436466217,2023-09-04 22:04:24.959688,2023-09-04 22:04:25.120188,0 days 00:00:00.160500,Tanh,ReLU,,,95,21,20.0,,,0.02053560367250248,2,142,0.184533794354146,0.005893351676602886,248.53172571518843,COMPLETE
622,0.4679613411426544,2023-09-04 22:04:25.120615,2023-09-04 22:04:25.644353,0 days 00:00:00.523738,Sigmoid,Sigmoid,ReLU,,14,24,23.0,19.0,,0.033485342415192236,3,197,0.2524978025051873,0.0024478726123134445,123.84876867441031,COMPLETE
623,0.34800267219543457,2023-09-04 22:04:25.644929,2023-09-04 22:04:26.004805,0 days 00:00:00.359876,Tanh,,,,25,20,,,,0.024965032933404793,1,98,0.3289718497847397,0.000512873451879586,129.25050880169047,COMPLETE
624,0.4993022084236145,2023-09-04 22:04:26.005307,2023-09-04 22:04:30.882578,0 days 00:00:04.877271,Tanh,Tanh,Leaky,Tanh,12,12,16.0,6.0,23.0,3.8703782338340776e-05,4,62,0.7993088880341789,0.015288185141489396,113.40983507710118,COMPLETE
625,0.4104544222354889,2023-09-04 22:04:30.882964,2023-09-04 22:04:31.111319,0 days 00:00:00.228355,Tanh,Sigmoid,,,49,21,24.0,,,0.016039199014913557,2,256,0.2828412256923822,0.011492522530896098,119.04379295580316,COMPLETE
626,0.3627997934818268,2023-09-04 22:04:31.111793,2023-09-04 22:04:31.381542,0 days 00:00:00.269749,Tanh,ReLU,,,37,22,19.0,,,0.0030814707820138454,2,113,0.1669978288380129,0.0038870938714556506,215.49666654146634,COMPLETE
627,0.3769117295742035,2023-09-04 22:04:31.382045,2023-09-04 22:04:31.670752,0 days 00:00:00.288707,ReLU,Sigmoid,,,22,14,9.0,,,0.012859586312756088,2,152,0.23922503732528222,0.004264609590889114,1139.7704512984665,COMPLETE
628,0.6711772084236145,2023-09-04 22:04:31.671249,2023-09-04 22:04:32.241316,0 days 00:00:00.570067,Tanh,Sigmoid,Leaky,,32,13,6.0,17.0,,0.00017933336779928847,3,78,0.20079825780000388,2.182755350781193e-05,101.5427112090282,COMPLETE
629,0.3424742817878723,2023-09-04 22:04:32.241756,2023-09-04 22:04:33.342978,0 days 00:00:01.101222,Leaky,ReLU,,,20,21,10.0,,,0.04010163146484853,2,216,0.493373961159447,0.0026115741635711503,120.13484446207683,COMPLETE
630,0.3592396378517151,2023-09-04 22:04:33.343511,2023-09-04 22:04:33.465591,0 days 00:00:00.122080,Tanh,,,,42,19,,,,0.09171677713546707,1,93,0.14056198382529597,1.3589903909810425e-05,139.5634984555452,COMPLETE
631,0.3655427396297455,2023-09-04 22:04:33.466130,2023-09-04 22:04:34.834918,0 days 00:00:01.368788,Tanh,Leaky,,,16,18,12.0,,,0.001295179790861225,2,106,0.47531492043973034,5.918595660020483e-05,156.45108621770686,COMPLETE
632,0.4434749186038971,2023-09-04 22:04:34.835386,2023-09-04 22:04:43.026545,0 days 00:00:08.191159,Tanh,Tanh,ReLU,Tanh,18,15,5.0,10.0,9.0,6.090166339112963e-05,4,172,0.5817196555747822,4.405387184666437e-05,136.71523462339889,COMPLETE
633,0.34239068627357483,2023-09-04 22:04:43.026996,2023-09-04 22:04:44.298903,0 days 00:00:01.271907,Tanh,Sigmoid,Leaky,,45,23,5.0,9.0,,0.005748860180372273,3,126,0.7710558355591733,8.401318440705362e-05,107.33410884909433,COMPLETE
634,0.29593634605407715,2023-09-04 22:04:44.299387,2023-09-04 22:04:44.783444,0 days 00:00:00.484057,ReLU,Sigmoid,,,90,20,8.0,,,0.008302858869507457,2,69,0.6486138232532409,0.005068423289761673,116.58074021772904,COMPLETE
635,0.4121955633163452,2023-09-04 22:04:44.783817,2023-09-04 22:04:44.937787,0 days 00:00:00.153970,Tanh,,,,81,21,,,,0.06764026997966048,1,230,0.3361541228230186,0.02889301548095541,141.8780062866211,COMPLETE
636,0.30496475100517273,2023-09-04 22:04:44.938162,2023-09-04 22:04:45.781853,0 days 00:00:00.843691,Sigmoid,ReLU,Tanh,,35,24,22.0,3.0,,0.01864013838012202,3,183,0.7015720994032535,0.00022691924429252643,95.26751154119319,COMPLETE
637,0.43952852487564087,2023-09-04 22:04:45.782235,2023-09-04 22:04:46.084433,0 days 00:00:00.302198,Tanh,Sigmoid,,,39,22,11.0,,,0.029079015994743024,2,271,0.7488609467424906,0.047094223201510674,120.06884002685547,COMPLETE
638,0.311872661113739,2023-09-04 22:04:46.084794,2023-09-04 22:04:46.863844,0 days 00:00:00.779050,Tanh,Sigmoid,Leaky,,15,20,3.0,18.0,,0.01023320921933666,3,86,0.7207793927235352,0.0001335373959967112,120.01419067382812,COMPLETE
639,0.32356199622154236,2023-09-04 22:04:46.864236,2023-09-04 22:04:48.104337,0 days 00:00:01.240101,Tanh,Tanh,,,19,16,15.0,,,0.00431058488072478,2,142,0.7709155810757081,3.197676451072019e-05,188.71559426950853,COMPLETE
640,0.46365252137184143,2023-09-04 22:04:48.104777,2023-09-04 22:04:48.764144,0 days 00:00:00.659367,Tanh,Sigmoid,ReLU,Leaky,56,14,2.0,21.0,1.0,0.022561237166256316,4,287,0.23336077017955567,1.6260860700730163e-05,303.5086296851482,COMPLETE
641,0.32818278670310974,2023-09-04 22:04:48.764572,2023-09-04 22:04:49.354340,0 days 00:00:00.589768,ReLU,ReLU,,,24,21,17.0,,,0.007344477027326896,2,162,0.7995001648333542,0.00016493812408175428,116.89883836110432,COMPLETE
642,0.34161725640296936,2023-09-04 22:04:49.354725,2023-09-04 22:04:50.185919,0 days 00:00:00.831194,Tanh,,,,26,10,,,,0.01511409470650825,1,57,0.679597233595483,1.2327665571892077e-05,100.4075334783186,COMPLETE
643,0.7999014258384705,2023-09-04 22:04:50.186278,2023-09-04 22:04:52.479742,0 days 00:00:02.293464,Leaky,Sigmoid,Leaky,,29,19,4.0,2.0,,5.8192447725861676e-05,3,103,0.7408539517353866,7.117856565937596e-05,103.56319768220476,COMPLETE
644,0.558784008026123,2023-09-04 22:04:52.480108,2023-09-04 22:04:53.928069,0 days 00:00:01.447961,Tanh,Sigmoid,,,21,22,18.0,,,0.00014108746782407904,2,117,0.34808364098894146,0.08785703541232201,98.92765442937868,COMPLETE
645,0.40913891792297363,2023-09-04 22:04:53.928435,2023-09-04 22:05:09.000507,0 days 00:00:15.072072,Tanh,ReLU,,,13,23,9.0,,,4.90892109096392e-05,2,245,0.6985412335167518,5.668313004633633e-05,112.31479688371931,COMPLETE
646,0.38263097405433655,2023-09-04 22:05:09.001138,2023-09-04 22:05:17.233091,0 days 00:00:08.231953,Tanh,Tanh,Sigmoid,Tanh,16,21,19.0,20.0,18.0,0.0009688716519554083,4,132,0.7599520567317755,0.006700818474969326,115.3331728848544,COMPLETE
647,0.3131791353225708,2023-09-04 22:05:17.233498,2023-09-04 22:05:18.241318,0 days 00:00:01.007820,Tanh,Sigmoid,Leaky,,37,13,20.0,8.0,,0.012216212459956096,3,210,0.7202133601317008,1.887028299540529e-05,89.26003746364428,COMPLETE
648,0.3953384459018707,2023-09-04 22:05:18.241834,2023-09-04 22:05:19.544012,0 days 00:00:01.302178,Sigmoid,,,,33,20,,,,0.0021556228722981676,1,91,0.6318699425922331,9.29075142636313e-05,281.994138445173,COMPLETE
649,0.33887407183647156,2023-09-04 22:05:19.544370,2023-09-04 22:05:28.211263,0 days 00:00:08.666893,ReLU,Sigmoid,,,11,15,13.0,,,0.0006989925305983758,2,79,0.7699574761055433,0.0001158415192824704,167.2161318622058,COMPLETE
650,0.3171636462211609,2023-09-04 22:05:28.211645,2023-09-04 22:05:29.165537,0 days 00:00:00.953892,Tanh,ReLU,ReLU,,22,22,16.0,4.0,,0.03433684793050166,3,108,0.6570159294778758,3.6911718449735976e-05,92.70326417865175,COMPLETE
651,0.38416963815689087,2023-09-04 22:05:29.166003,2023-09-04 22:05:29.350828,0 days 00:00:00.184825,Tanh,Sigmoid,,,20,23,5.0,,,0.026720604694612796,2,478,0.17599309715342196,4.661873455177295e-05,397.7620335629112,COMPLETE
652,0.3583484888076782,2023-09-04 22:05:29.351231,2023-09-04 22:05:34.684954,0 days 00:00:05.333723,Tanh,Tanh,,,17,21,21.0,,,0.00018997345914174377,2,191,0.7378636463396488,1.0047687290623226e-05,96.00935343797295,COMPLETE
653,0.38850489258766174,2023-09-04 22:05:34.685337,2023-09-04 22:05:34.966999,0 days 00:00:00.281662,Tanh,Sigmoid,Leaky,,40,14,7.0,6.0,,0.017791577458250954,3,70,0.24590010468636428,2.387789835179743e-05,190.83373775997677,COMPLETE
654,0.36633506417274475,2023-09-04 22:05:34.967383,2023-09-04 22:05:35.603071,0 days 00:00:00.635688,Tanh,ReLU,,,71,24,10.0,,,0.006098297459585388,2,152,0.545761453419716,0.012835083011865598,104.89998636013124,COMPLETE
655,0.40287211537361145,2023-09-04 22:05:35.603432,2023-09-04 22:05:35.772649,0 days 00:00:00.169217,ReLU,,,,24,20,,,,0.046682919734813096,1,222,0.16008561667066137,0.00020104346041000635,129.53915882110596,COMPLETE
656,0.3982805907726288,2023-09-04 22:05:35.773001,2023-09-04 22:05:36.769124,0 days 00:00:00.996123,Leaky,Sigmoid,Leaky,,31,21,4.0,5.0,,0.009738377196669014,3,95,0.7711325954500541,0.031489724821545266,132.1777374267578,COMPLETE
657,0.3672862946987152,2023-09-04 22:05:36.769497,2023-09-04 22:05:36.990755,0 days 00:00:00.221258,Tanh,Sigmoid,,,18,12,14.0,,,0.021398005282775478,2,376,0.14802534244693105,1.465531537438463e-05,310.40739186604816,COMPLETE
658,0.36992427706718445,2023-09-04 22:05:36.991117,2023-09-04 22:05:37.375770,0 days 00:00:00.384653,Tanh,Leaky,ReLU,Tanh,63,22,12.0,16.0,17.0,0.011843056701116874,4,167,0.4458739260802215,0.0005526135059900747,106.865964617048,COMPLETE
659,0.3791460692882538,2023-09-04 22:05:37.376150,2023-09-04 22:05:37.848201,0 days 00:00:00.472051,Tanh,,,,13,20,,,,0.014262048957959806,1,202,0.20677359666740766,2.784545589576752e-05,132.93349687108454,COMPLETE
660,0.33455055952072144,2023-09-04 22:05:37.848574,2023-09-04 22:05:38.579468,0 days 00:00:00.730894,Tanh,Sigmoid,,,85,15,15.0,,,0.0049976101587915454,2,234,0.6054926748203543,6.374777426375574e-05,115.9812347094218,COMPLETE
661,0.3327605128288269,2023-09-04 22:05:38.579888,2023-09-04 22:05:39.107696,0 days 00:00:00.527808,Tanh,Tanh,Leaky,,43,22,7.0,2.0,,0.03252394955244722,3,177,0.3990837607702727,0.0015107440876649168,114.26613294161282,COMPLETE
662,1.0403435230255127,2023-09-04 22:05:39.108102,2023-09-04 22:05:39.431537,0 days 00:00:00.323435,Sigmoid,ReLU,,,36,21,11.0,,,2.5149900848119905e-05,2,83,0.13784934195401058,1.2130261207623635e-05,97.82510679313935,COMPLETE
663,0.29463836550712585,2023-09-04 22:05:39.431922,2023-09-04 22:05:40.907063,0 days 00:00:01.475141,ReLU,Sigmoid,Leaky,,22,23,10.0,1.0,,0.025645750525018253,3,50,0.7997843408287223,7.830305160166048e-05,92.9354221577547,COMPLETE
664,0.35013267397880554,2023-09-04 22:05:40.907453,2023-09-04 22:05:41.913437,0 days 00:00:01.005984,Tanh,Sigmoid,ReLU,Tanh,10,13,6.0,3.0,22.0,0.007985404303051563,4,122,0.2341133474628056,0.00014511221073796422,111.1776478507302,COMPLETE
665,0.3658181130886078,2023-09-04 22:05:41.913977,2023-09-04 22:05:42.146275,0 days 00:00:00.232298,Tanh,ReLU,,,20,19,19.0,,,0.003796022177857375,2,155,0.12248368646254729,1.8003891172555032e-05,157.5686821407742,COMPLETE
666,0.34037426114082336,2023-09-04 22:05:42.146892,2023-09-04 22:05:42.811351,0 days 00:00:00.664459,Tanh,Sigmoid,,,27,14,24.0,,,0.01851968899183319,2,141,0.6982195461038664,0.0004366218914558113,96.16452741622925,COMPLETE
667,0.3577378988265991,2023-09-04 22:05:42.811810,2023-09-04 22:05:43.988939,0 days 00:00:01.177129,Tanh,,,,15,20,,,,0.0016625022393560876,1,66,0.5145163315743907,0.0003433779873518729,100.72720163518733,COMPLETE
668,0.430463969707489,2023-09-04 22:05:43.989295,2023-09-04 22:05:45.690996,0 days 00:00:01.701701,Tanh,Tanh,Tanh,,38,21,3.0,7.0,,0.0003695229528321691,3,99,0.7315248068175706,0.022077995266518623,136.203191737936,COMPLETE
