number,value,datetime_start,datetime_complete,duration,params_activation1,params_activation2,params_activation3,params_activation4,params_batch_size,params_fl1,params_fl2,params_fl3,params_fl4,params_learning_rate,params_n_layers,params_num_epochs,params_train_size,params_weight_decay,user_attrs_mre,state
582,0.4413962960243225,2023-09-04 21:21:22.432091,2023-09-04 21:21:23.677368,0 days 00:00:01.245277,Tanh,Leaky,,,84,18,9.0,,,0.0012450020971095938,2,228,0.18263993974641038,0.00011666987855939676,142.9781047092395,COMPLETE
583,0.43447181582450867,2023-09-04 21:21:23.677987,2023-09-04 21:21:24.532150,0 days 00:00:00.854163,Tanh,Sigmoid,,,72,20,8.0,,,0.06344755979711507,2,78,0.5879548833704544,0.011748112917452607,152.7809412214491,COMPLETE
584,0.3196786344051361,2023-09-04 21:21:24.532737,2023-09-04 21:21:25.491029,0 days 00:00:00.958292,Leaky,Tanh,,,78,17,9.0,,,0.0138067256917261,2,181,0.37418120871325666,0.00029939268971411205,113.26947643573467,COMPLETE
585,0.4351516664028168,2023-09-04 21:21:25.491615,2023-09-04 21:21:25.897999,0 days 00:00:00.406384,Tanh,Tanh,,,81,19,24.0,,,0.019364237331511238,2,253,0.18038419551011534,1.1375107611293402e-05,126.69606147928441,COMPLETE
586,0.3032151460647583,2023-09-04 21:21:25.898605,2023-09-04 21:21:27.510306,0 days 00:00:01.611701,Tanh,Sigmoid,,,70,17,11.0,,,0.07965383259687017,2,296,0.7485724259606732,0.0002032793846333281,906.3233298561789,COMPLETE
587,0.4125900864601135,2023-09-04 21:21:27.510902,2023-09-04 21:21:27.980464,0 days 00:00:00.469562,ReLU,Tanh,,,74,21,10.0,,,0.02589126006331397,2,90,0.16450858376225727,0.00013513236125407564,168.88218256632487,COMPLETE
588,0.6390509605407715,2023-09-04 21:21:27.981068,2023-09-04 21:21:31.164988,0 days 00:00:03.183920,Sigmoid,ReLU,,,68,18,3.0,,,0.00041343034753145463,2,108,0.7732762624758868,0.09096384444144041,185.90586704678006,COMPLETE
589,0.32316359877586365,2023-09-04 21:21:31.165580,2023-09-04 21:21:32.490744,0 days 00:00:01.325164,Tanh,Tanh,,,77,18,6.0,,,0.010255133138926006,2,476,0.4845830407112336,5.917543032431273e-05,137.44792906878746,COMPLETE
590,0.34284707903862,2023-09-04 21:21:32.491347,2023-09-04 21:21:35.452649,0 days 00:00:02.961302,Leaky,Sigmoid,,,43,19,8.0,,,0.0516453060530146,2,500,0.7115087436457204,0.0012084010277204052,184.85477437852305,COMPLETE
591,0.2637324035167694,2023-09-04 21:21:35.453252,2023-09-04 21:21:38.705087,0 days 00:00:03.251835,Tanh,Leaky,,,72,19,12.0,,,0.0032397650830268843,2,263,0.798228908704736,9.024778255537466e-05,173.20231558423524,COMPLETE
592,0.4209793508052826,2023-09-04 21:21:38.705688,2023-09-04 21:21:40.309349,0 days 00:00:01.603661,Tanh,Leaky,,,72,20,13.0,,,0.003842802165149445,2,257,0.7950631878825698,7.562071598540853e-05,149.45791229834924,COMPLETE
593,0.31889456510543823,2023-09-04 21:21:40.309967,2023-09-04 21:21:41.930255,0 days 00:00:01.620288,Tanh,Leaky,,,73,19,12.0,,,0.005395824096993039,2,263,0.7679029910137034,0.0008697072371786367,158.461852482387,COMPLETE
594,0.5499009490013123,2023-09-04 21:21:41.930854,2023-09-04 21:21:42.374449,0 days 00:00:00.443595,Leaky,Leaky,,,75,19,12.0,,,0.001693472730884428,2,274,0.17412138066848715,9.524820111086656e-05,628.9662407077088,COMPLETE
595,0.4896799921989441,2023-09-04 21:21:42.375054,2023-09-04 21:21:45.726830,0 days 00:00:03.351776,Tanh,Sigmoid,,,70,19,12.0,,,0.0037650195671076127,2,265,0.7755175149806497,0.021832248846492062,450.2483782472864,COMPLETE
596,0.46286407113075256,2023-09-04 21:21:45.727423,2023-09-04 21:21:46.754857,0 days 00:00:01.027434,Tanh,,,,71,20,,,,0.003241893409537459,1,280,0.22683390022199929,0.00010229405106997959,147.46874853063514,COMPLETE
597,0.29758957028388977,2023-09-04 21:21:46.755469,2023-09-04 21:21:47.477208,0 days 00:00:00.721739,Tanh,Leaky,,,73,19,13.0,,,0.030932513139908628,2,269,0.7354592007391074,1.7757355223255626e-05,1245.8215611775715,COMPLETE
598,0.4030064046382904,2023-09-04 21:21:47.477808,2023-09-04 21:21:48.728074,0 days 00:00:01.250266,Sigmoid,Leaky,,,46,19,11.0,,,0.022491715108003258,2,313,0.4058760907389346,6.313570081953123e-05,505.2119015284947,COMPLETE
599,0.33798015117645264,2023-09-04 21:21:48.728688,2023-09-04 21:21:50.658633,0 days 00:00:01.929945,Tanh,Leaky,,,76,20,12.0,,,0.00529104540593865,2,67,0.7941226789772288,8.42438748792041e-05,110.2748408531075,COMPLETE
600,0.30892544984817505,2023-09-04 21:21:50.659313,2023-09-04 21:21:52.027373,0 days 00:00:01.368060,Leaky,Leaky,,,69,18,11.0,,,0.0028783291628537272,2,256,0.345373627771623,0.00011026577506548723,121.872788785684,COMPLETE
601,0.5478159785270691,2023-09-04 21:21:52.027983,2023-09-04 21:21:52.321238,0 days 00:00:00.293255,Tanh,Leaky,,,74,19,12.0,,,0.006259839903091176,2,144,0.13589081497515532,5.160508877465672e-05,216.33470314427427,COMPLETE
602,0.3243746757507324,2023-09-04 21:21:52.321829,2023-09-04 21:21:53.998510,0 days 00:00:01.676681,Tanh,Leaky,,,71,18,12.0,,,0.017688134793629514,2,284,0.7434440286660798,0.001564555277732568,127.14728559073755,COMPLETE
603,0.40578699111938477,2023-09-04 21:21:53.999116,2023-09-04 21:21:54.942590,0 days 00:00:00.943474,Tanh,Sigmoid,,,80,18,13.0,,,0.007606973064623899,2,273,0.21850151316546165,0.00022305522275240823,308.16709997003727,COMPLETE
604,0.270449161529541,2023-09-04 21:21:54.943201,2023-09-04 21:21:56.074723,0 days 00:00:01.131522,Leaky,Leaky,,,67,19,10.0,,,0.038152352249975395,2,291,0.7984097905428345,7.157786480900354e-05,149.31640058244977,COMPLETE
605,0.27163735032081604,2023-09-04 21:21:56.075328,2023-09-04 21:21:56.935005,0 days 00:00:00.859677,Leaky,Leaky,,,65,19,11.0,,,0.03873066847037571,2,93,0.7989593439991339,6.4890106730263e-05,197.91064392089845,COMPLETE
606,0.264829158782959,2023-09-04 21:21:56.935619,2023-09-04 21:21:58.924793,0 days 00:00:01.989174,Leaky,Leaky,,,67,18,10.0,,,0.03654859292863028,2,304,0.7980631191105916,4.8440651577178263e-05,167.65572082996368,COMPLETE
607,0.37336719036102295,2023-09-04 21:21:58.925396,2023-09-04 21:21:59.473541,0 days 00:00:00.548145,Leaky,Leaky,,,67,18,10.0,,,0.03287084373876298,2,314,0.1928822378309155,5.352258869665525e-05,268.6302059718541,COMPLETE
608,0.3920229375362396,2023-09-04 21:21:59.474146,2023-09-04 21:21:59.901479,0 days 00:00:00.427333,Leaky,Leaky,,,65,18,11.0,,,0.048118667684607354,2,97,0.12519691028612748,0.0035471406497216717,219.81161472253632,COMPLETE
609,0.3174029290676117,2023-09-04 21:21:59.902081,2023-09-04 21:22:00.853256,0 days 00:00:00.951175,Leaky,Leaky,,,68,18,13.0,,,0.027431098600395894,2,326,0.7620898810832522,8.756344835603787e-05,151.6161122639974,COMPLETE
610,0.3059512972831726,2023-09-04 21:22:00.853872,2023-09-04 21:22:02.874626,0 days 00:00:02.020754,Leaky,Leaky,,,71,5,10.0,,,0.0046895608878374994,2,306,0.7707573835933951,0.006719794477407428,206.73691733224052,COMPLETE
611,0.4690386652946472,2023-09-04 21:22:02.875231,2023-09-04 21:22:03.093224,0 days 00:00:00.217993,Leaky,Leaky,,,69,17,12.0,,,0.045335755713123774,2,300,0.10678482175163223,7.698879359331627e-05,201.71211059570314,COMPLETE
612,0.47330978512763977,2023-09-04 21:22:03.093826,2023-09-04 21:22:04.920412,0 days 00:00:01.826586,Leaky,Leaky,,,66,18,11.0,,,0.0004579535031669435,2,57,0.7987194484482386,0.0018385128850338288,177.04580153080454,COMPLETE
613,0.3326684236526489,2023-09-04 21:22:04.921022,2023-09-04 21:22:05.633343,0 days 00:00:00.712321,Leaky,Leaky,,,72,18,9.0,,,0.0332221753909327,2,116,0.6068432922499948,0.002418210634899601,155.91508592878068,COMPLETE
614,0.31881484389305115,2023-09-04 21:22:05.633964,2023-09-04 21:22:07.596049,0 days 00:00:01.962085,Leaky,Leaky,,,69,17,9.0,,,0.0025154594811109586,2,82,0.6843951347580391,4.538848593544075e-05,126.68918351869326,COMPLETE
615,0.33424416184425354,2023-09-04 21:22:07.596667,2023-09-04 21:22:08.541515,0 days 00:00:00.944848,Leaky,Leaky,,,73,18,11.0,,,0.025503495052942096,2,72,0.7206148055336105,4.27675677520872e-05,157.19186632560962,COMPLETE
616,0.44418445229530334,2023-09-04 21:22:08.542123,2023-09-04 21:22:09.336464,0 days 00:00:00.794341,Sigmoid,ReLU,,,67,17,10.0,,,0.0628650108964349,2,333,0.5283463964779633,9.798961938216672e-05,166.3321964039522,COMPLETE
617,0.297527939081192,2023-09-04 21:22:09.337077,2023-09-04 21:22:10.078482,0 days 00:00:00.741405,Leaky,Leaky,,,96,17,12.0,,,0.03879169799615838,2,490,0.4377134973920897,3.023589793331813e-05,307.89338372678174,COMPLETE
618,0.5094383955001831,2023-09-04 21:22:10.079096,2023-09-04 21:22:10.316714,0 days 00:00:00.237618,ReLU,Leaky,,,76,18,10.0,,,0.029740463660221383,2,247,0.12142817616827585,2.2840567318197938e-05,175.6219324384417,COMPLETE
619,0.8861283659934998,2023-09-04 21:22:10.317326,2023-09-04 21:22:11.491334,0 days 00:00:01.174008,Leaky,ReLU,,,70,16,9.0,,,1.6859108084138284e-05,2,102,0.2811618696149828,6.12185359587342e-05,118.05392732807235,COMPLETE
620,0.620173990726471,2023-09-04 21:22:11.491947,2023-09-04 21:22:15.424490,0 days 00:00:03.932543,Sigmoid,Tanh,,,64,18,11.0,,,0.0002948242635428322,2,131,0.7563794272979877,3.9451245633618235e-05,224.40296050792432,COMPLETE
621,0.5036305785179138,2023-09-04 21:22:15.425095,2023-09-04 21:22:18.834611,0 days 00:00:03.409516,Leaky,Leaky,,,74,18,10.0,,,0.00010801862032038505,2,307,0.29916088859423856,0.009099091910689907,658.3049186433177,COMPLETE
622,0.3290288746356964,2023-09-04 21:22:18.835224,2023-09-04 21:22:23.473445,0 days 00:00:04.638221,Leaky,Tanh,,,71,19,12.0,,,0.0014507239888239007,2,432,0.6383458989016532,0.00011253652583433009,142.8260512914413,COMPLETE
623,0.30087682604789734,2023-09-04 21:22:23.474044,2023-09-04 21:22:24.652787,0 days 00:00:01.178743,Tanh,Tanh,,,68,16,13.0,,,0.024090291907224726,2,479,0.47568059376226507,0.00013081246627685668,173.13364319882152,COMPLETE
624,0.4538975656032562,2023-09-04 21:22:24.653427,2023-09-04 21:22:29.542304,0 days 00:00:04.888877,Tanh,ReLU,,,78,17,9.0,,,0.0007028872569663224,2,258,0.7995565917628128,0.004824077205706799,171.6698058117395,COMPLETE
625,0.2619570791721344,2023-09-04 21:22:29.542914,2023-09-04 21:22:30.602081,0 days 00:00:01.059167,Leaky,Tanh,,,76,18,11.0,,,0.021805300520888905,2,84,0.6981116110659011,8.485796059928233e-05,230.79816360473632,COMPLETE
626,0.3467649221420288,2023-09-04 21:22:30.602688,2023-09-04 21:22:31.660603,0 days 00:00:01.057915,Leaky,Tanh,,,77,17,11.0,,,0.02131644711464716,2,86,0.6622425364268327,7.815420422581372e-05,159.62522888183594,COMPLETE
627,0.4073652923107147,2023-09-04 21:22:31.661226,2023-09-04 21:22:33.588328,0 days 00:00:01.927102,Leaky,Leaky,,,79,18,11.0,,,0.0006560436494347365,2,77,0.6957503162701973,0.002102367446385229,157.767405324168,COMPLETE
628,0.5013837814331055,2023-09-04 21:22:33.588931,2023-09-04 21:22:33.845658,0 days 00:00:00.256727,Leaky,Tanh,,,74,18,11.0,,,0.05571704920705455,2,82,0.1493809246347242,9.024994068934467e-05,518.1575341796874,COMPLETE
629,0.2810761630535126,2023-09-04 21:22:33.846257,2023-09-04 21:22:35.157038,0 days 00:00:01.310781,Leaky,Tanh,,,75,20,14.0,,,0.044032718758583174,2,90,0.6754829400359912,3.31626722830077e-05,222.6255792356005,COMPLETE
630,0.3923143446445465,2023-09-04 21:22:35.157659,2023-09-04 21:22:35.932788,0 days 00:00:00.775129,Leaky,Tanh,,,77,19,12.0,,,0.07292691648232656,2,64,0.7111969545979973,0.0005545909865109939,196.17290751139322,COMPLETE
631,0.3310033082962036,2023-09-04 21:22:35.933409,2023-09-04 21:22:38.680107,0 days 00:00:02.746698,Leaky,Leaky,Leaky,,51,17,10.0,22.0,,0.0021097308116871,3,107,0.6165858835905695,0.0001668035695202615,693.8026013496594,COMPLETE
632,0.3376706838607788,2023-09-04 21:22:38.680740,2023-09-04 21:22:39.512087,0 days 00:00:00.831347,Leaky,ReLU,,,76,19,12.0,,,0.027317374112034644,2,72,0.7489404467930109,0.00011584678355992952,400.1580102103097,COMPLETE
633,0.34614935517311096,2023-09-04 21:22:39.512711,2023-09-04 21:22:40.272113,0 days 00:00:00.759402,Leaky,Tanh,,,76,18,11.0,,,0.03484350742134604,2,96,0.6533426334582116,0.003779882073522027,216.13243629192485,COMPLETE
634,0.40576866269111633,2023-09-04 21:22:40.272721,2023-09-04 21:22:44.404730,0 days 00:00:04.132009,Leaky,Tanh,,,79,18,11.0,,,0.0005224822262642992,2,167,0.7132081244461377,0.06892351292125484,216.7564797772619,COMPLETE
635,0.310270756483078,2023-09-04 21:22:44.405335,2023-09-04 21:22:45.385926,0 days 00:00:00.980591,Leaky,Tanh,,,66,15,10.0,,,0.020350798078092935,2,78,0.7601868263845969,0.0003514534928913936,449.9702484130859,COMPLETE
636,0.5491377115249634,2023-09-04 21:22:45.386543,2023-09-04 21:22:46.067564,0 days 00:00:00.681021,Leaky,Leaky,,,73,17,20.0,,,0.0013682291796663073,2,60,0.2603823516047125,0.09700412401746857,126.38003997802734,COMPLETE
637,0.49222344160079956,2023-09-04 21:22:46.068187,2023-09-04 21:22:46.618052,0 days 00:00:00.549865,Sigmoid,Tanh,,,90,19,11.0,,,0.02434252530713303,2,85,0.151470301349879,0.001320953793142402,180.893480231963,COMPLETE
638,0.39099812507629395,2023-09-04 21:22:46.618666,2023-09-04 21:22:47.381336,0 days 00:00:00.762670,Leaky,Tanh,,,70,16,10.0,,,0.0984284550636052,2,470,0.6866824716433437,0.0008292292369026231,336.51762038010816,COMPLETE
639,0.46780750155448914,2023-09-04 21:22:47.381945,2023-09-04 21:22:48.221071,0 days 00:00:00.839126,Leaky,ReLU,,,78,18,12.0,,,0.030894579005485253,2,101,0.38683263380971256,0.02147140916582532,1483.1189109108666,COMPLETE
640,0.38882920145988464,2023-09-04 21:22:48.221667,2023-09-04 21:22:48.936838,0 days 00:00:00.715171,Sigmoid,Tanh,,,75,17,18.0,,,0.051306479633899796,2,388,0.23153356119054436,7.118680302652068e-05,157.83578029149015,COMPLETE
641,0.41115978360176086,2023-09-04 21:22:48.937451,2023-09-04 21:22:49.779909,0 days 00:00:00.842458,ReLU,Leaky,,,64,20,11.0,,,0.0400775974145679,2,69,0.31221847921082524,0.0026188741062143023,197.53344700700146,COMPLETE
642,0.3699098229408264,2023-09-04 21:22:49.780518,2023-09-04 21:22:50.708122,0 days 00:00:00.927604,Leaky,Tanh,,,72,19,10.0,,,0.08019023769154748,2,116,0.736446646795106,5.133939136662945e-05,435.11974999212447,COMPLETE
643,0.5256306529045105,2023-09-04 21:22:50.708752,2023-09-04 21:22:52.223587,0 days 00:00:01.514835,Leaky,Sigmoid,,,80,7,12.0,,,0.018364455370436523,2,94,0.7655645834407948,0.017878358384339887,310.1899040767125,COMPLETE
644,0.3425937294960022,2023-09-04 21:22:52.224203,2023-09-04 21:22:59.595687,0 days 00:00:07.371484,Leaky,Tanh,,,69,14,10.0,,,0.0008268420690543637,2,351,0.7197622851415956,0.00014900559412567047,156.22081914728338,COMPLETE
645,1.0835026502609253,2023-09-04 21:22:59.596313,2023-09-04 21:23:00.111426,0 days 00:00:00.515113,Tanh,Tanh,Sigmoid,Leaky,77,18,2.0,13.0,8.0,0.026728334704302498,4,87,0.7754057907715873,0.03257392614308645,103.03391682017933,COMPLETE
646,0.4113374352455139,2023-09-04 21:23:00.112098,2023-09-04 21:23:00.598710,0 days 00:00:00.486612,Sigmoid,Leaky,,,67,19,15.0,,,0.03585460161338007,2,493,0.19675981954129068,0.00026164538731932664,185.76032500571392,COMPLETE
647,0.33312177658081055,2023-09-04 21:23:00.599327,2023-09-04 21:23:01.440421,0 days 00:00:00.841094,Tanh,ReLU,,,74,21,9.0,,,0.06393210232074673,2,109,0.7980653124174641,0.00019566872884635534,173.1056195772611,COMPLETE
648,0.3455093801021576,2023-09-04 21:23:01.441050,2023-09-04 21:23:02.121505,0 days 00:00:00.680455,Tanh,Sigmoid,,,73,17,13.0,,,0.02427512773512086,2,446,0.26739734172603336,2.4779104524299346e-05,218.7716421353615,COMPLETE
649,0.36879417300224304,2023-09-04 21:23:02.122117,2023-09-04 21:23:02.622522,0 days 00:00:00.500405,Leaky,Tanh,,,71,18,11.0,,,0.02008764693323745,2,413,0.2867339874510056,9.977725027089868e-05,4074.5661753061654,COMPLETE
650,0.4890919029712677,2023-09-04 21:23:02.623155,2023-09-04 21:23:02.957774,0 days 00:00:00.334619,Tanh,Tanh,,,81,18,12.0,,,0.046204977021868404,2,323,0.1341893661107831,0.00014475018045749554,501.32490955699575,COMPLETE
651,1.0170131921768188,2023-09-04 21:23:02.958394,2023-09-04 21:23:04.680741,0 days 00:00:01.722347,Tanh,Sigmoid,,,68,19,9.0,,,3.830209527130077e-05,2,78,0.5559403825028891,0.0001260339345963399,279.7254914503831,COMPLETE
652,0.33595308661460876,2023-09-04 21:23:04.681364,2023-09-04 21:23:06.010427,0 days 00:00:01.329063,Leaky,Leaky,,,76,20,10.0,,,0.0023625472071526227,2,69,0.5078735529056673,0.0004285988741330148,395.53612241883206,COMPLETE
653,0.29246097803115845,2023-09-04 21:23:06.011051,2023-09-04 21:23:06.758969,0 days 00:00:00.747918,Tanh,Tanh,,,78,18,11.0,,,0.03131558546167714,2,302,0.6899830222477082,6.251918414140947e-05,127.97654017695675,COMPLETE
654,0.4093063771724701,2023-09-04 21:23:06.759607,2023-09-04 21:23:07.914963,0 days 00:00:01.155356,Sigmoid,Tanh,,,70,17,9.0,,,0.017743419155874757,2,457,0.5778306340369677,0.0011102352027901011,387.4156149291992,COMPLETE
655,0.3587328791618347,2023-09-04 21:23:07.915584,2023-09-04 21:23:08.683539,0 days 00:00:00.767955,Tanh,,,,65,16,,,,0.05568598375316494,1,97,0.6314965150699331,0.00019378002146751503,174.663657244514,COMPLETE
656,0.4673880934715271,2023-09-04 21:23:08.684163,2023-09-04 21:23:08.999657,0 days 00:00:00.315494,Leaky,Sigmoid,,,48,19,10.0,,,0.030209595107094027,2,484,0.21202727044735845,8.973570404677831e-05,211.54965744018554,COMPLETE
657,0.3664100468158722,2023-09-04 21:23:09.000282,2023-09-04 21:23:10.559065,0 days 00:00:01.558783,Tanh,Tanh,,,72,10,11.0,,,0.0032554190807881967,2,55,0.7409269761744218,0.0006760383195542836,186.55801003196024,COMPLETE
658,0.25608378648757935,2023-09-04 21:23:10.559677,2023-09-04 21:23:12.410831,0 days 00:00:01.851154,Tanh,ReLU,,,79,18,23.0,,,0.022458023263344545,2,195,0.7678443209087877,0.00010950304160526348,4727.381421638258,COMPLETE
659,0.3505921959877014,2023-09-04 21:23:12.411479,2023-09-04 21:23:12.892122,0 days 00:00:00.480643,Tanh,ReLU,,,81,17,21.0,,,0.022296669044696082,2,190,0.20189134727689753,0.00025303255564993414,142.99983352661133,COMPLETE
660,0.35551464557647705,2023-09-04 21:23:12.892763,2023-09-04 21:23:14.209959,0 days 00:00:01.317196,Leaky,ReLU,,,79,18,22.0,,,0.017252573037865187,2,194,0.7991284863806359,0.00016627360013296585,237.10144181685015,COMPLETE
661,0.42329826951026917,2023-09-04 21:23:14.210587,2023-09-04 21:23:14.487473,0 days 00:00:00.276886,Tanh,ReLU,,,83,18,22.0,,,0.021935218214764646,2,203,0.18510837348698184,1.8757321612012257e-05,214.20865161602313,COMPLETE
662,0.3577509820461273,2023-09-04 21:23:14.488102,2023-09-04 21:23:15.044998,0 days 00:00:00.556896,Tanh,ReLU,,,80,17,11.0,,,0.026846971927743105,2,213,0.32769138828265787,0.001688966907636444,321.5915103912354,COMPLETE
663,0.5101363658905029,2023-09-04 21:23:15.045604,2023-09-04 21:23:15.326182,0 days 00:00:00.280578,Leaky,ReLU,,,68,19,11.0,,,0.036126222576392385,2,198,0.17196262678170965,0.00013766758498207505,138.29941833496093,COMPLETE
664,0.3463346064090729,2023-09-04 21:23:15.326790,2023-09-04 21:23:16.346395,0 days 00:00:01.019605,Tanh,ReLU,,,63,18,23.0,,,0.015453642015727437,2,150,0.771943643643388,0.000115163066397801,122.6979128519694,COMPLETE
665,0.3710678219795227,2023-09-04 21:23:16.347020,2023-09-04 21:23:17.673007,0 days 00:00:01.325987,ReLU,ReLU,,,82,16,19.0,,,0.020682470684973645,2,178,0.7485476932503207,7.411063976140835e-05,135.14537155151368,COMPLETE
666,0.3156282305717468,2023-09-04 21:23:17.673634,2023-09-04 21:23:19.407456,0 days 00:00:01.733822,Sigmoid,ReLU,,,79,17,21.0,,,0.025770543143464986,2,238,0.7251511579933229,0.00032878695085941683,209.90414360388002,COMPLETE
667,0.37576761841773987,2023-09-04 21:23:19.408075,2023-09-04 21:23:21.818963,0 days 00:00:02.410888,Tanh,ReLU,,,70,19,20.0,,,0.0012804381862315042,2,424,0.4513864941931251,0.005594279599440169,165.02132800109405,COMPLETE
668,0.44668084383010864,2023-09-04 21:23:21.819582,2023-09-04 21:23:22.577970,0 days 00:00:00.758388,Tanh,ReLU,,,66,18,18.0,,,0.004581729737609208,2,316,0.27594325094276995,4.077005241389959e-05,253.68246004874246,COMPLETE
669,0.3388611674308777,2023-09-04 21:23:22.578592,2023-09-04 21:23:24.733604,0 days 00:00:02.155012,Leaky,ReLU,,,77,20,4.0,,,0.03182926882423941,2,208,0.7696244884348973,0.00021941363197109352,158.13441907442532,COMPLETE
670,0.34642666578292847,2023-09-04 21:23:24.734244,2023-09-04 21:23:25.888810,0 days 00:00:01.154566,Tanh,Leaky,,,45,17,10.0,,,0.03886909673427259,2,248,0.7991596462649234,1.4165877748383246e-05,154.70461440667873,COMPLETE
671,0.41786158084869385,2023-09-04 21:23:25.889168,2023-09-04 21:23:26.784564,0 days 00:00:00.895396,Tanh,Tanh,,,82,18,12.0,,,0.001718595362593302,2,216,0.5407199122083328,0.00010566669845146934,144.88293181199293,COMPLETE
672,0.2619906961917877,2023-09-04 21:23:26.784925,2023-09-04 21:23:27.554320,0 days 00:00:00.769395,Leaky,Tanh,,,24,19,16.0,,,0.01624540587815789,2,294,0.744958575278932,5.588728781496413e-05,375.8134399414063,COMPLETE
673,0.32115861773490906,2023-09-04 21:23:27.554691,2023-09-04 21:23:28.136306,0 days 00:00:00.581615,Leaky,Tanh,,,28,18,24.0,,,0.015343687430120753,2,290,0.3984462905328395,5.023590437433495e-05,143.31787267720924,COMPLETE
674,0.29231923818588257,2023-09-04 21:23:28.136683,2023-09-04 21:23:28.692768,0 days 00:00:00.556085,Leaky,ReLU,ReLU,,75,19,18.0,3.0,,0.01786318554699879,3,297,0.7107592085851773,5.5969402464193996e-05,495.89835840341993,COMPLETE
675,0.3819935619831085,2023-09-04 21:23:28.693133,2023-09-04 21:23:28.891799,0 days 00:00:00.198666,Leaky,Tanh,,,79,18,19.0,,,0.020773394711421138,2,307,0.33955072051104296,3.5070340336842965e-05,196.3898398659446,COMPLETE
676,0.4161798655986786,2023-09-04 21:23:28.892147,2023-09-04 21:23:29.067489,0 days 00:00:00.175342,Leaky,Leaky,,,88,19,15.0,,,0.014606905319290563,2,302,0.15605573698093206,6.252253751027396e-05,150.07076829479587,COMPLETE
677,0.41452211141586304,2023-09-04 21:23:29.067847,2023-09-04 21:23:29.367807,0 days 00:00:00.299960,Leaky,Tanh,,,32,17,17.0,,,0.024606176778474313,2,313,0.2481480245130052,0.00018354920912164342,191.1808791049691,COMPLETE
678,0.29736328125,2023-09-04 21:23:29.368162,2023-09-04 21:23:30.104165,0 days 00:00:00.736003,Leaky,Tanh,,,30,17,17.0,,,0.01798668434523424,2,293,0.7322785748999048,0.00407414518265072,401.689835357666,COMPLETE
