number,value,datetime_start,datetime_complete,duration,params_activation1,params_activation2,params_activation3,params_activation4,params_batch_size,params_fl1,params_fl2,params_fl3,params_fl4,params_learning_rate,params_n_layers,params_num_epochs,params_train_size,params_weight_decay,user_attrs_mre,state
189,0.4190806746482849,2023-09-04 21:15:57.209433,2023-09-04 21:15:57.806434,0 days 00:00:00.597001,Sigmoid,ReLU,,,90,8,17.0,,,0.005800813844652166,2,93,0.5597345910781171,1.7431867558111775e-05,164.4347663797358,COMPLETE
190,0.38278403878211975,2023-09-04 21:15:57.806743,2023-09-04 21:15:58.992114,0 days 00:00:01.185371,Tanh,Sigmoid,,,87,21,22.0,,,0.004084615570501986,2,141,0.7413180962275169,0.00014729152343150555,159.63076327709442,COMPLETE
191,0.32668355107307434,2023-09-04 21:15:58.992390,2023-09-04 21:15:59.491986,0 days 00:00:00.499596,Leaky,ReLU,,,90,22,19.0,,,0.009187780600184586,2,442,0.702131190241634,3.149530103884032e-05,150.4836667984251,COMPLETE
192,0.32188981771469116,2023-09-04 21:15:59.492291,2023-09-04 21:16:00.262717,0 days 00:00:00.770426,Leaky,ReLU,,,73,22,20.0,,,0.007574140877808699,2,131,0.6765469416993456,3.9553657847033635e-05,146.72438595511696,COMPLETE
193,0.40473440289497375,2023-09-04 21:16:00.262999,2023-09-04 21:16:00.535318,0 days 00:00:00.272319,Leaky,ReLU,,,98,9,19.0,,,0.011732730154656685,2,200,0.502907995269727,2.5800860356259824e-05,134.69663475884332,COMPLETE
194,0.32813310623168945,2023-09-04 21:16:00.535593,2023-09-04 21:16:01.145899,0 days 00:00:00.610306,Leaky,ReLU,,,66,23,18.0,,,0.009324706407388363,2,168,0.7795797777003775,0.0005093072099359677,165.31783441911665,COMPLETE
195,0.31411609053611755,2023-09-04 21:16:01.146205,2023-09-04 21:16:01.742378,0 days 00:00:00.596173,Leaky,ReLU,,,69,21,20.0,,,0.013681479542106169,2,385,0.6022566352125277,2.0149499295168032e-05,122.2618459753088,COMPLETE
196,0.33746883273124695,2023-09-04 21:16:01.742655,2023-09-04 21:16:02.633900,0 days 00:00:00.891245,Leaky,Sigmoid,,,35,19,20.0,,,0.013935500354410267,2,349,0.6033373810258719,2.0082559333226852e-05,125.77464150691378,COMPLETE
197,0.3637334704399109,2023-09-04 21:16:02.634209,2023-09-04 21:16:03.121959,0 days 00:00:00.487750,Leaky,Sigmoid,,,46,20,21.0,,,0.016168750929558027,2,216,0.6403678888277334,1.4693473459940387e-05,146.72802389235724,COMPLETE
198,0.3017404079437256,2023-09-04 21:16:03.122246,2023-09-04 21:16:03.588283,0 days 00:00:00.466037,Leaky,ReLU,,,75,21,20.0,,,0.01229704335906106,2,391,0.7995844975586625,1.561276008339958e-05,128.21478983561198,COMPLETE
199,0.29574814438819885,2023-09-04 21:16:03.588576,2023-09-04 21:16:05.523952,0 days 00:00:01.935376,Leaky,Sigmoid,,,42,21,18.0,,,0.006545253398912093,2,389,0.79137971354418,1.207356290100616e-05,102.11978761993186,COMPLETE
200,0.41991910338401794,2023-09-04 21:16:05.524227,2023-09-04 21:16:07.166698,0 days 00:00:01.642471,Leaky,Sigmoid,,,42,5,20.0,,,0.005812496753807049,2,363,0.7984969421002088,1.016666936239463e-05,184.1334148241126,COMPLETE
201,0.33906009793281555,2023-09-04 21:16:07.166997,2023-09-04 21:16:08.092485,0 days 00:00:00.925488,Leaky,Sigmoid,,,81,21,18.0,,,0.006442149894893797,2,399,0.7512016105087751,1.2366572051848663e-05,317.75484977648097,COMPLETE
202,0.3761950731277466,2023-09-04 21:16:08.092861,2023-09-04 21:16:12.128081,0 days 00:00:04.035220,Leaky,Sigmoid,,,59,20,19.0,,,0.00036489967278661935,2,371,0.773833168852031,1.3415321745860363e-05,179.56847050504865,COMPLETE
203,0.3146849274635315,2023-09-04 21:16:12.128367,2023-09-04 21:16:12.787335,0 days 00:00:00.658968,Leaky,Sigmoid,,,75,21,17.0,,,0.01092508908412625,2,117,0.7388998014963538,1.6283043667229026e-05,127.66911305018834,COMPLETE
204,0.32539722323417664,2023-09-04 21:16:12.787635,2023-09-04 21:16:14.360103,0 days 00:00:01.572468,Leaky,Sigmoid,,,41,23,18.0,,,0.004645230305628505,2,389,0.7932535208698015,1.5468172457241137e-05,131.23443760381681,COMPLETE
205,0.3523697257041931,2023-09-04 21:16:14.360415,2023-09-04 21:16:15.132367,0 days 00:00:00.771952,Tanh,Tanh,,,44,22,18.0,,,0.007090448485447443,2,419,0.7284560888701681,0.000278259099316537,136.67762471861758,COMPLETE
206,0.3810841739177704,2023-09-04 21:16:15.132660,2023-09-04 21:16:15.710571,0 days 00:00:00.577911,Leaky,Sigmoid,,,38,20,19.0,,,0.007960876589197786,2,84,0.330647027866886,1.1617620095072128e-05,146.8064709617978,COMPLETE
207,0.37714073061943054,2023-09-04 21:16:15.710854,2023-09-04 21:16:16.085938,0 days 00:00:00.375084,Leaky,ReLU,,,61,21,18.0,,,0.020270648657145326,2,459,0.7487458285785796,2.4256945270740734e-05,142.268326030058,COMPLETE
208,0.41101980209350586,2023-09-04 21:16:16.086243,2023-09-04 21:16:16.818261,0 days 00:00:00.732018,Leaky,Leaky,,,48,8,15.0,,,0.009613156988841437,2,151,0.796337645392728,0.00011693477095016336,153.17471749441964,COMPLETE
209,0.3213411271572113,2023-09-04 21:16:16.818557,2023-09-04 21:16:17.696231,0 days 00:00:00.877674,Tanh,Sigmoid,,,54,24,17.0,,,0.012498470839032438,2,390,0.7085123748599992,1.88850857555329e-05,164.39423093795776,COMPLETE
210,0.33270490169525146,2023-09-04 21:16:17.696596,2023-09-04 21:16:18.324550,0 days 00:00:00.627954,Leaky,ReLU,,,71,23,19.0,,,0.005133054088002433,2,127,0.7637258028645905,5.915360221414778e-05,141.36326659671843,COMPLETE
211,0.32438838481903076,2023-09-04 21:16:18.324876,2023-09-04 21:16:18.802939,0 days 00:00:00.478063,Leaky,ReLU,,,70,21,20.0,,,0.015675869595544883,2,410,0.7227492705636936,2.0210353760622688e-05,177.7145345259686,COMPLETE
212,0.3636213541030884,2023-09-04 21:16:18.803232,2023-09-04 21:16:19.242989,0 days 00:00:00.439757,Leaky,ReLU,,,35,21,20.0,,,0.013785012645573344,2,391,0.5222019294042733,1.552843379607818e-05,137.906526465165,COMPLETE
213,0.4009433686733246,2023-09-04 21:16:19.243285,2023-09-04 21:16:19.524028,0 days 00:00:00.280743,Leaky,ReLU,,,69,20,21.0,,,0.011265476946819465,2,379,0.30988660524335304,2.4079964671064486e-05,197.74610775806866,COMPLETE
214,0.6272854208946228,2023-09-04 21:16:19.524320,2023-09-04 21:16:20.236443,0 days 00:00:00.712123,Leaky,ReLU,,,77,22,20.0,,,5.343974182795106e-05,2,72,0.7999608275342561,3.3058552927586706e-05,123.48941633436415,COMPLETE
215,0.3065284788608551,2023-09-04 21:16:20.236724,2023-09-04 21:16:21.011169,0 days 00:00:00.774445,Leaky,ReLU,,,64,21,19.0,,,0.007841795102000325,2,386,0.657373747809443,0.0006453638630610149,129.4174328758603,COMPLETE
216,0.3543702960014343,2023-09-04 21:16:21.011465,2023-09-04 21:16:21.706551,0 days 00:00:00.695086,Leaky,Sigmoid,,,66,19,19.0,,,0.008106232930823038,2,369,0.6758485684167298,0.0007161712061237207,4985.314723659206,COMPLETE
217,0.3162498474121094,2023-09-04 21:16:21.706824,2023-09-04 21:16:22.914665,0 days 00:00:01.207841,Leaky,ReLU,,,22,22,18.0,,,0.0059804947533005194,2,291,0.7536181423623827,0.000357776655497107,126.95960811399064,COMPLETE
218,0.31919071078300476,2023-09-04 21:16:22.914954,2023-09-04 21:16:24.244881,0 days 00:00:01.329927,Tanh,Tanh,,,63,21,16.0,,,0.003983872683796842,2,137,0.7058474058612191,8.65710637839909e-05,124.10585751498702,COMPLETE
219,0.3272777795791626,2023-09-04 21:16:24.245168,2023-09-04 21:16:25.255857,0 days 00:00:01.010689,Leaky,Sigmoid,,,58,24,19.0,,,0.009874505289036523,2,101,0.7624461777896852,0.0010048503747486232,124.4110583630237,COMPLETE
220,0.43828147649765015,2023-09-04 21:16:25.256158,2023-09-04 21:16:25.689231,0 days 00:00:00.433073,Leaky,Sigmoid,,,61,20,18.0,,,0.007159311467864213,2,428,0.36762888181260356,0.0001984107608932726,252.37611368540172,COMPLETE
221,0.3179621696472168,2023-09-04 21:16:25.689522,2023-09-04 21:16:26.341811,0 days 00:00:00.652289,Leaky,ReLU,,,68,21,20.0,,,0.012600780102452809,2,406,0.6590512155362841,0.00016128537884183382,151.4198466406928,COMPLETE
222,0.33859190344810486,2023-09-04 21:16:26.342108,2023-09-04 21:16:26.622465,0 days 00:00:00.280357,Leaky,ReLU,,,65,22,19.0,,,0.017457117579241673,2,386,0.5617114680463581,0.0003507065280705898,126.01742322517164,COMPLETE
223,0.33777064085006714,2023-09-04 21:16:26.622765,2023-09-04 21:16:27.277432,0 days 00:00:00.654667,Leaky,ReLU,,,40,21,18.0,,,0.010758809704821355,2,384,0.6199454839103767,0.001270931315231439,234.43842626501012,COMPLETE
224,0.3383784592151642,2023-09-04 21:16:27.277715,2023-09-04 21:16:27.795363,0 days 00:00:00.517648,Leaky,ReLU,,,64,15,8.0,,,0.013770690339656642,2,393,0.5948887079482553,0.0004088339429225069,112.29731525358606,COMPLETE
225,0.3117513060569763,2023-09-04 21:16:27.795653,2023-09-04 21:16:28.577967,0 days 00:00:00.782314,Leaky,ReLU,,,37,21,17.0,,,0.008487153444174425,2,372,0.4834034268196483,1.3331789024019174e-05,105.29748975313626,COMPLETE
226,0.358954519033432,2023-09-04 21:16:28.578326,2023-09-04 21:16:29.070175,0 days 00:00:00.491849,Tanh,ReLU,,,42,9,17.0,,,0.006417148592420048,2,143,0.4701121698575217,1.24601684446484e-05,144.7544182671441,COMPLETE
227,0.39134830236434937,2023-09-04 21:16:29.070463,2023-09-04 21:16:29.664661,0 days 00:00:00.594198,Leaky,Sigmoid,,,37,22,17.0,,,0.00920193304466814,2,401,0.4207266115056449,0.0019850030533377534,384.80032621924556,COMPLETE
228,0.39242807030677795,2023-09-04 21:16:29.664969,2023-09-04 21:16:30.540722,0 days 00:00:00.875753,Sigmoid,ReLU,,,32,20,17.0,,,0.007943553473835834,2,373,0.5004740341422216,1.1637318803766373e-05,147.90053283691407,COMPLETE
229,0.34254512190818787,2023-09-04 21:16:30.541007,2023-09-04 21:16:31.501124,0 days 00:00:00.960117,Leaky,Sigmoid,,,34,23,18.0,,,0.0051363722869859595,2,279,0.48894652323298365,0.00022904375973478684,134.87400183516942,COMPLETE
230,0.33660539984703064,2023-09-04 21:16:31.501404,2023-09-04 21:16:32.517257,0 days 00:00:01.015853,Leaky,ReLU,,,36,21,18.0,,,0.002060565125259843,2,299,0.735344103931597,1.0128896316222112e-05,203.89044064194408,COMPLETE
231,0.39299729466438293,2023-09-04 21:16:32.517545,2023-09-04 21:16:32.793993,0 days 00:00:00.276448,Leaky,ReLU,,,73,21,19.0,,,0.009927162224020444,2,485,0.43721208717940074,1.766149825008749e-05,127.5400390625,COMPLETE
232,0.37860676646232605,2023-09-04 21:16:32.794304,2023-09-04 21:16:33.158095,0 days 00:00:00.363791,Leaky,ReLU,,,39,21,19.0,,,0.008566120639806291,2,380,0.27306570333850455,1.4489978682297899e-05,148.4479637145996,COMPLETE
233,0.35814347863197327,2023-09-04 21:16:33.158396,2023-09-04 21:16:33.561297,0 days 00:00:00.402901,Leaky,ReLU,,,68,20,16.0,,,0.01192455124933895,2,385,0.3823328513162413,2.085989858830568e-05,227.29510349697537,COMPLETE
234,0.35083717107772827,2023-09-04 21:16:33.561584,2023-09-04 21:16:34.175325,0 days 00:00:00.613741,Leaky,ReLU,,,88,22,21.0,,,0.002725907236937249,2,337,0.535865061531735,1.4430959396586536e-05,139.68822230288856,COMPLETE
235,0.3614932596683502,2023-09-04 21:16:34.175619,2023-09-04 21:16:35.051318,0 days 00:00:00.875699,Leaky,Tanh,,,37,22,18.0,,,0.003668586195575068,2,365,0.45115944552482934,2.8877240964800578e-05,192.73212309806578,COMPLETE
236,0.34081172943115234,2023-09-04 21:16:35.051607,2023-09-04 21:16:35.581504,0 days 00:00:00.529897,Tanh,ReLU,,,66,21,20.0,,,0.006852102005395061,2,121,0.6938700792224295,1.7353500059457314e-05,123.87479955499822,COMPLETE
237,0.39368200302124023,2023-09-04 21:16:35.581795,2023-09-04 21:16:35.914521,0 days 00:00:00.332726,Leaky,Sigmoid,,,62,23,17.0,,,0.01510341349062705,2,399,0.35711517500444995,2.2430166678008818e-05,563.7463234077065,COMPLETE
238,0.33011743426322937,2023-09-04 21:16:35.914802,2023-09-04 21:16:36.641094,0 days 00:00:00.726292,Leaky,ReLU,,,45,21,19.0,,,0.005492148410468148,2,155,0.5728319236943468,1.2957043907731004e-05,172.80864275005501,COMPLETE
239,0.3355922996997833,2023-09-04 21:16:36.641410,2023-09-04 21:16:37.135837,0 days 00:00:00.494427,Leaky,Sigmoid,,,95,20,20.0,,,0.010973452068898286,2,360,0.6465736196732764,2.7712826836471003e-05,129.7092939264634,COMPLETE
240,0.3542495667934418,2023-09-04 21:16:37.136141,2023-09-04 21:16:39.559554,0 days 00:00:02.423413,Tanh,ReLU,,,69,23,18.0,,,0.000970186179663577,2,415,0.7717210991825176,4.241022555632409e-05,127.57109738184401,COMPLETE
241,0.35628214478492737,2023-09-04 21:16:39.559853,2023-09-04 21:16:40.097328,0 days 00:00:00.537475,Leaky,Sigmoid,,,79,21,17.0,,,0.01087932473415268,2,117,0.7413836145858126,0.00045316621412583226,219.95576687516837,COMPLETE
242,0.3572370409965515,2023-09-04 21:16:40.097625,2023-09-04 21:16:40.796383,0 days 00:00:00.698758,Leaky,Sigmoid,,,71,21,17.0,,,0.008461978459313584,2,107,0.7290507463244609,0.0006672717530242786,151.02581055523598,COMPLETE
243,0.39868399500846863,2023-09-04 21:16:40.796662,2023-09-04 21:16:41.252279,0 days 00:00:00.455617,Leaky,Sigmoid,,,76,20,16.0,,,0.013414851113868854,2,131,0.7686170742091112,0.0003042933101762093,213.78446297023606,COMPLETE
244,0.3237285315990448,2023-09-04 21:16:41.252559,2023-09-04 21:16:41.890262,0 days 00:00:00.637703,Leaky,Sigmoid,,,74,22,18.0,,,0.017854336198333935,2,124,0.7121383088230127,1.643124112408949e-05,301.84430898746973,COMPLETE
245,0.4046110510826111,2023-09-04 21:16:41.890545,2023-09-04 21:16:42.349935,0 days 00:00:00.459390,Leaky,,,,74,24,,,,0.010111543003076772,1,111,0.39694475087009273,1.8805416849867355e-05,177.515084984189,COMPLETE
246,0.35193660855293274,2023-09-04 21:16:42.350206,2023-09-04 21:16:43.123131,0 days 00:00:00.772925,Leaky,Sigmoid,,,64,22,17.0,,,0.0074455950155774275,2,137,0.73973352570782,1.574479233614142e-05,155.77954823811848,COMPLETE
247,0.3856092691421509,2023-09-04 21:16:43.123418,2023-09-04 21:16:45.237456,0 days 00:00:02.114038,Leaky,Sigmoid,,,34,21,19.0,,,0.001495080923462051,2,148,0.6760618449534853,0.0001328392647416075,137.70306984153953,COMPLETE
248,0.34000125527381897,2023-09-04 21:16:45.237746,2023-09-04 21:16:45.708008,0 days 00:00:00.470262,Leaky,Sigmoid,,,59,20,18.0,,,0.012654648615073863,2,90,0.46624830058977945,0.00016479722930307037,172.40967440605164,COMPLETE
249,0.349638968706131,2023-09-04 21:16:45.708301,2023-09-04 21:16:46.123578,0 days 00:00:00.415277,Tanh,ReLU,,,56,19,18.0,,,0.022544530161094006,2,233,0.7746552839972742,9.734588117192947e-05,143.06352705114028,COMPLETE
250,0.33818089962005615,2023-09-04 21:16:46.123874,2023-09-04 21:16:47.071828,0 days 00:00:00.947954,Leaky,Leaky,,,83,21,13.0,,,0.004568300739328508,2,116,0.7006917647748071,0.0002500891391350996,129.42697801261113,COMPLETE
251,0.28691062331199646,2023-09-04 21:16:47.072114,2023-09-04 21:16:48.476043,0 days 00:00:01.403929,Leaky,Tanh,,,43,22,21.0,,,0.006371493755351772,2,393,0.7995062595128801,1.0150220787415714e-05,150.53671395658242,COMPLETE
252,0.27742576599121094,2023-09-04 21:16:48.476330,2023-09-04 21:16:49.598839,0 days 00:00:01.122509,Leaky,Tanh,,,43,22,22.0,,,0.006029968379514703,2,395,0.7980339118061707,1.010303384271645e-05,120.27106534517728,COMPLETE
253,0.362844318151474,2023-09-04 21:16:49.599177,2023-09-04 21:16:50.502174,0 days 00:00:00.902997,Tanh,Tanh,,,43,23,22.0,,,0.0065347082085676494,2,403,0.7971024038902912,1.024068365684027e-05,168.9717259482732,COMPLETE
254,0.3419055938720703,2023-09-04 21:16:50.502472,2023-09-04 21:16:51.490812,0 days 00:00:00.988340,Leaky,Tanh,,,47,8,22.0,,,0.0053485387600001625,2,375,0.7968229402762209,1.1741248362808018e-05,130.56877593994142,COMPLETE
255,0.33955156803131104,2023-09-04 21:16:51.491128,2023-09-04 21:16:52.232772,0 days 00:00:00.741644,Leaky,Tanh,,,41,10,21.0,,,0.006139331304446885,2,390,0.7637070449020844,1.230034024391145e-05,314.44505603496845,COMPLETE
256,0.3353278636932373,2023-09-04 21:16:52.233083,2023-09-04 21:16:52.947418,0 days 00:00:00.714335,Leaky,Tanh,Sigmoid,,44,22,21.0,20.0,,0.007632482492187329,3,395,0.7643406312170977,1.0336650916907289e-05,141.40752653642133,COMPLETE
257,0.38730132579803467,2023-09-04 21:16:52.947734,2023-09-04 21:16:54.021562,0 days 00:00:01.073828,Tanh,Tanh,,,39,7,23.0,,,0.004493364128620008,2,408,0.5164947092187375,1.3691616068443001e-05,254.2405697857892,COMPLETE
258,0.3602133095264435,2023-09-04 21:16:54.021866,2023-09-04 21:16:55.007642,0 days 00:00:00.985776,Leaky,Tanh,,,42,22,19.0,,,0.002264162901715643,2,145,0.7388526472416729,1.0341266235495286e-05,148.04777081807455,COMPLETE
259,0.32871466875076294,2023-09-04 21:16:55.007959,2023-09-04 21:16:55.777756,0 days 00:00:00.769797,Leaky,Tanh,,,40,23,22.0,,,0.005619633665994067,2,447,0.7993368650053109,6.270237519380321e-05,134.3038589477539,COMPLETE
260,0.3668314516544342,2023-09-04 21:16:55.778051,2023-09-04 21:16:58.341095,0 days 00:00:02.563044,Sigmoid,Tanh,,,44,24,23.0,,,0.00355871068109451,2,429,0.7188384107522534,3.525584245890941e-05,134.37684751024435,COMPLETE
261,0.3733992278575897,2023-09-04 21:16:58.341387,2023-09-04 21:16:58.733363,0 days 00:00:00.391976,Leaky,Tanh,,,50,16,21.0,,,0.008928830645607318,2,164,0.3338223820851024,1.3547445729159468e-05,150.32996567946213,COMPLETE
262,0.321391224861145,2023-09-04 21:16:58.733728,2023-09-04 21:16:59.536503,0 days 00:00:00.802775,Leaky,Tanh,,,45,23,15.0,,,0.006260403137977383,2,131,0.7677150701950742,7.753236699565801e-05,171.44895430742685,COMPLETE
263,0.4054807424545288,2023-09-04 21:16:59.536852,2023-09-04 21:17:00.492673,0 days 00:00:00.955821,Tanh,Tanh,ReLU,Leaky,37,22,18.0,4.0,7.0,0.004311033661566428,4,465,0.41531254281100916,0.00018968262676274093,193.72900351995153,COMPLETE
264,0.3386945426464081,2023-09-04 21:17:00.493053,2023-09-04 21:17:02.024353,0 days 00:00:01.531300,Leaky,Sigmoid,,,42,23,19.0,,,0.007277414725699238,2,77,0.7472209090029512,1.1955411310374728e-05,2976.960605719151,COMPLETE
265,0.3428913950920105,2023-09-04 21:17:02.024846,2023-09-04 21:17:02.928192,0 days 00:00:00.903346,Leaky,ReLU,,,39,24,20.0,,,0.008491660840871825,2,398,0.690871309691088,2.5055058887651655e-05,263.41777420043945,COMPLETE
266,0.4974096119403839,2023-09-04 21:17:02.928486,2023-09-04 21:17:04.333886,0 days 00:00:01.405400,Leaky,Sigmoid,,,46,9,22.0,,,0.0032809100301170566,2,143,0.32242635011607657,0.00010786588726491804,288.73738300883684,COMPLETE
267,0.36435362696647644,2023-09-04 21:17:04.334379,2023-09-04 21:17:05.722084,0 days 00:00:01.387705,Tanh,ReLU,,,35,22,18.0,,,0.0017628183333441181,2,265,0.797767698881168,1.4761798484929714e-05,158.2917984553746,COMPLETE
268,0.3196752369403839,2023-09-04 21:17:05.722380,2023-09-04 21:17:06.829331,0 days 00:00:01.106951,Leaky,Sigmoid,,,60,22,19.0,,,0.005028421219290382,2,380,0.7278883307615571,4.835014178390572e-05,142.0098878406343,COMPLETE
269,0.34616419672966003,2023-09-04 21:17:06.829634,2023-09-04 21:17:07.375161,0 days 00:00:00.545527,Leaky,Tanh,,,91,22,18.0,,,0.006866505824572244,2,156,0.48425103395816915,0.00013493943443843587,143.97847795988383,COMPLETE
270,0.41901829838752747,2023-09-04 21:17:07.375465,2023-09-04 21:17:07.582162,0 days 00:00:00.206697,Leaky,ReLU,,,52,14,21.0,,,0.009782975100135455,2,283,0.20387941390099956,1.2220353213346505e-05,156.10914791331572,COMPLETE
271,0.35844194889068604,2023-09-04 21:17:07.582452,2023-09-04 21:17:09.230097,0 days 00:00:01.647645,Tanh,Sigmoid,,,15,24,16.0,,,0.008651510878148876,2,189,0.5480055930372361,0.00046602607722379797,189.16478085517883,COMPLETE
272,0.3579222857952118,2023-09-04 21:17:09.230387,2023-09-04 21:17:09.928965,0 days 00:00:00.698578,Leaky,ReLU,,,30,23,20.0,,,0.005941877530820472,2,417,0.4388203350215773,1.0139941202761698e-05,137.31555345323352,COMPLETE
273,0.3616195321083069,2023-09-04 21:17:09.929274,2023-09-04 21:17:10.347168,0 days 00:00:00.417894,Leaky,Sigmoid,Leaky,Tanh,58,19,19.0,21.0,3.0,0.027838512323188846,4,97,0.6623421770351215,0.0006345017894819058,188.1254488188645,COMPLETE
274,0.34795331954956055,2023-09-04 21:17:10.347494,2023-09-04 21:17:10.762185,0 days 00:00:00.414691,Leaky,Leaky,,,54,20,17.0,,,0.0194419737325118,2,391,0.7673882695131427,0.007466346915484567,200.08287140817353,COMPLETE
275,0.3225743770599365,2023-09-04 21:17:10.762501,2023-09-04 21:17:11.853559,0 days 00:00:01.091058,Leaky,ReLU,,,41,21,18.0,,,0.01119251220306518,2,214,0.7202649664625661,1.8434677979310673e-05,8137.490228114984,COMPLETE
276,0.37738683819770813,2023-09-04 21:17:11.853945,2023-09-04 21:17:13.203657,0 days 00:00:01.349712,Tanh,Sigmoid,,,62,22,20.0,,,0.003957319356586437,2,140,0.348995054836194,3.191178928581959e-05,170.9706718989781,COMPLETE
277,0.36239534616470337,2023-09-04 21:17:13.203971,2023-09-04 21:17:13.696825,0 days 00:00:00.492854,Leaky,ReLU,,,38,23,19.0,,,0.01642052510077203,2,132,0.6288787289156046,0.0002587603651036961,139.89679557398745,COMPLETE
278,0.39594078063964844,2023-09-04 21:17:13.697117,2023-09-04 21:17:14.179260,0 days 00:00:00.482143,Leaky,Tanh,,,64,21,17.0,,,0.061939086879981585,2,354,0.7566590809841317,2.278658814474183e-05,132.7706249660916,COMPLETE
279,0.41129550337791443,2023-09-04 21:17:14.179571,2023-09-04 21:17:14.796524,0 days 00:00:00.616953,Leaky,Sigmoid,,,66,12,6.0,,,0.007428995100384581,2,372,0.7004137219046063,1.5266326788791366e-05,168.85406318077673,COMPLETE
280,0.3342050611972809,2023-09-04 21:17:14.796909,2023-09-04 21:17:17.054906,0 days 00:00:02.257997,Tanh,ReLU,,,33,22,18.0,,,0.0006266900690280134,2,407,0.7979101716698166,2.6463897760039446e-05,137.358211947563,COMPLETE
281,0.4305148124694824,2023-09-04 21:17:17.055293,2023-09-04 21:17:17.701443,0 days 00:00:00.646150,Leaky,Sigmoid,,,36,7,21.0,,,0.005296774234798645,2,252,0.2967205056485272,3.980332840231644e-05,190.21335983276367,COMPLETE
282,0.3673897087574005,2023-09-04 21:17:17.701760,2023-09-04 21:17:18.225653,0 days 00:00:00.523893,Leaky,Sigmoid,,,43,23,19.0,,,0.009461277489178589,2,198,0.37564395702584813,1.3547886995200024e-05,135.76158152399836,COMPLETE
283,0.4111645519733429,2023-09-04 21:17:18.225943,2023-09-04 21:17:20.016599,0 days 00:00:01.790656,Sigmoid,ReLU,,,48,20,17.0,,,0.0025144079198824508,2,182,0.7447455673078677,1.9939049409346647e-05,223.93732624837796,COMPLETE
284,0.33954647183418274,2023-09-04 21:17:20.016892,2023-09-04 21:17:20.597890,0 days 00:00:00.580998,Leaky,Tanh,,,89,9,18.0,,,0.011387964799051568,2,483,0.675841633582796,1.6321706766889898e-05,138.93247629801434,COMPLETE
