number,value,datetime_start,datetime_complete,duration,params_activation1,params_activation2,params_activation3,params_activation4,params_batch_size,params_fl1,params_fl2,params_fl3,params_fl4,params_learning_rate,params_n_layers,params_num_epochs,params_train_size,params_weight_decay,user_attrs_mre,state
371,0.27076923847198486,2023-09-04 21:23:34.323315,2023-09-04 21:23:37.908351,0 days 00:00:03.585036,Tanh,Leaky,Leaky,,28,20,22.0,22.0,,0.005632710696955718,3,218,0.7107894436242493,2.9740711969578345e-05,2563.2499755859376,COMPLETE
372,0.3018103837966919,2023-09-04 21:23:37.908922,2023-09-04 21:23:39.633411,0 days 00:00:01.724489,Tanh,Leaky,Leaky,,31,20,22.0,21.0,,0.004360949351693357,3,224,0.3572634656458581,3.83775996265733e-05,392.08940774423104,COMPLETE
373,0.3097319006919861,2023-09-04 21:23:39.634018,2023-09-04 21:23:42.888963,0 days 00:00:03.254945,Tanh,Leaky,Leaky,,30,21,22.0,21.0,,0.005356021366040704,3,236,0.6854802971263133,1.2715966573782692e-05,182.08957575017754,COMPLETE
374,0.48514536023139954,2023-09-04 21:23:42.889541,2023-09-04 21:23:53.797759,0 days 00:00:10.908218,Tanh,Leaky,Leaky,,32,19,21.0,17.0,,4.596953893541425e-05,3,177,0.7657424187732601,2.835900941372246e-05,210.55050891940877,COMPLETE
375,0.33269429206848145,2023-09-04 21:23:53.798331,2023-09-04 21:23:55.965644,0 days 00:00:02.167313,Tanh,Tanh,Leaky,,29,20,22.0,22.0,,0.006084497125824624,3,216,0.732475662352008,0.000968945493375491,294.2154897054036,COMPLETE
376,0.30476173758506775,2023-09-04 21:23:55.966211,2023-09-04 21:23:57.798165,0 days 00:00:01.831954,Tanh,Leaky,Leaky,,32,20,22.0,19.0,,0.0048947614298729125,3,319,0.6903648049411399,2.2049665726464486e-05,129.7436010837555,COMPLETE
377,0.5371158719062805,2023-09-04 21:23:57.798750,2023-09-04 21:23:58.420058,0 days 00:00:00.621308,Tanh,Leaky,Leaky,,43,21,21.0,20.0,,0.0035861141491490005,3,228,0.13260098608110343,3.394145263907394e-05,143.89802486613647,COMPLETE
378,0.42711231112480164,2023-09-04 21:23:58.420633,2023-09-04 21:24:09.564578,0 days 00:00:11.143945,Leaky,Sigmoid,Leaky,,28,22,23.0,10.0,,0.00030552122563035495,3,242,0.6205461721891488,4.893782058970917e-05,253.80134992743257,COMPLETE
379,0.29796743392944336,2023-09-04 21:24:09.565163,2023-09-04 21:24:12.326747,0 days 00:00:02.761584,Tanh,Leaky,Tanh,,31,19,21.0,9.0,,0.006504347173480811,3,232,0.7669864294741907,0.00033309330596198444,147.1435415578443,COMPLETE
380,0.25507432222366333,2023-09-04 21:24:12.327311,2023-09-04 21:24:14.041312,0 days 00:00:01.714001,ReLU,Leaky,Leaky,,33,20,24.0,21.0,,0.016616852536076754,3,190,0.7174180254343318,1.898438374526726e-05,109.95762739510371,COMPLETE
381,0.38105884194374084,2023-09-04 21:24:14.041878,2023-09-04 21:24:15.456698,0 days 00:00:01.414820,ReLU,Leaky,Leaky,,33,9,22.0,21.0,,0.017582883557630494,3,188,0.6539879885549323,1.7927585470699085e-05,169.28860708383414,COMPLETE
382,0.32695668935775757,2023-09-04 21:24:15.457277,2023-09-04 21:24:21.150843,0 days 00:00:05.693566,ReLU,Leaky,Leaky,,33,20,24.0,22.0,,0.000591094148184406,3,179,0.7073655391919681,2.2846038363794273e-05,146.5501916922775,COMPLETE
383,0.31986403465270996,2023-09-04 21:24:21.151433,2023-09-04 21:24:22.756473,0 days 00:00:01.605040,ReLU,,,,30,21,,,,0.013937605116619603,1,187,0.6825876769387207,2.5917027793871923e-05,389.88696434384303,COMPLETE
384,0.33710891008377075,2023-09-04 21:24:22.757033,2023-09-04 21:24:24.772797,0 days 00:00:02.015764,ReLU,Leaky,Leaky,,34,19,22.0,16.0,,0.019184935815618746,3,52,0.7282716049510024,3.060111732932752e-05,166.36332659040178,COMPLETE
385,0.30826660990715027,2023-09-04 21:24:24.773359,2023-09-04 21:24:26.187039,0 days 00:00:01.413680,ReLU,Leaky,Leaky,,32,21,23.0,18.0,,0.01596621268394974,3,199,0.3849730093942734,1.4795235750005456e-05,693.4324311755952,COMPLETE
386,0.3434554636478424,2023-09-04 21:24:26.187620,2023-09-04 21:24:28.714851,0 days 00:00:02.527231,ReLU,Leaky,Leaky,,27,20,21.0,21.0,,0.024538711875112917,3,206,0.5311060285641194,3.552570686835143e-05,177.16573760986327,COMPLETE
387,0.2543795108795166,2023-09-04 21:24:28.715427,2023-09-04 21:24:31.353899,0 days 00:00:02.638472,ReLU,Leaky,Leaky,,35,22,22.0,20.0,,0.012565054678285715,3,174,0.7469444167850665,0.0021836791333840894,150.42173385620117,COMPLETE
388,0.3288625478744507,2023-09-04 21:24:31.354484,2023-09-04 21:24:32.552146,0 days 00:00:01.197662,ReLU,Leaky,Leaky,,34,22,21.0,20.0,,0.01183188151848694,3,201,0.6345238420535002,0.0024779658387166542,377.53273408309275,COMPLETE
389,0.34653398394584656,2023-09-04 21:24:32.552722,2023-09-04 21:24:35.656790,0 days 00:00:03.104068,ReLU,Sigmoid,Leaky,,31,22,22.0,21.0,,0.014932471496730469,3,163,0.7044401356361498,0.0012987571444990549,197.28661933312048,COMPLETE
390,0.3671594262123108,2023-09-04 21:24:35.657428,2023-09-04 21:24:37.882717,0 days 00:00:02.225289,ReLU,Leaky,Leaky,,29,23,22.0,21.0,,0.0012795922342049813,3,169,0.3025698985147406,0.003426136660614936,189.01225147247314,COMPLETE
391,0.40700846910476685,2023-09-04 21:24:37.883296,2023-09-04 21:24:38.572466,0 days 00:00:00.689170,ReLU,Leaky,Leaky,,35,23,21.0,20.0,,0.021225705257319864,3,176,0.23994715721105841,2.0479779254930394e-05,282.9451691598603,COMPLETE
392,0.34489622712135315,2023-09-04 21:24:38.573038,2023-09-04 21:24:39.674029,0 days 00:00:01.100991,ReLU,Sigmoid,Leaky,,40,22,22.0,22.0,,0.013737864788791845,3,157,0.31187048494467595,0.0003542120311349049,2247.3237024943032,COMPLETE
393,0.3266919255256653,2023-09-04 21:24:39.674613,2023-09-04 21:24:42.484618,0 days 00:00:02.810005,ReLU,Tanh,Leaky,,33,21,21.0,1.0,,0.01057002296110204,3,196,0.7444356467604505,1.0234296091661849e-05,294.89953028902096,COMPLETE
394,0.3107265532016754,2023-09-04 21:24:42.485223,2023-09-04 21:24:43.568476,0 days 00:00:01.083253,ReLU,Leaky,Leaky,,37,22,14.0,21.0,,0.01682965571793309,3,189,0.6658940066489912,0.0006548272024597104,208.39383152553015,COMPLETE
395,0.3950285315513611,2023-09-04 21:24:43.569073,2023-09-04 21:24:44.797372,0 days 00:00:01.228299,ReLU,Leaky,Leaky,,58,21,20.0,21.0,,0.029817278448483007,3,177,0.7988552986577555,0.000485256031310489,145.0952929792733,COMPLETE
396,0.5502761006355286,2023-09-04 21:24:44.797937,2023-09-04 21:24:47.419060,0 days 00:00:02.621123,ReLU,Sigmoid,Sigmoid,,31,21,22.0,22.0,,0.013229635742461065,3,170,0.7162343375445672,0.002154773464220862,290.01478150833486,COMPLETE
397,0.37462112307548523,2023-09-04 21:24:47.419643,2023-09-04 21:24:59.096594,0 days 00:00:11.676951,Tanh,Leaky,Leaky,,38,22,23.0,20.0,,0.0006829344475258248,3,190,0.7449614382604893,0.01261755264216436,143.32037510118985,COMPLETE
398,0.3161219358444214,2023-09-04 21:24:59.097182,2023-09-04 21:25:01.289965,0 days 00:00:02.192783,ReLU,Leaky,Leaky,,35,20,22.0,19.0,,0.010192856881166827,3,335,0.5178904086926822,0.0010965350461885192,139.86633583351417,COMPLETE
399,0.33809468150138855,2023-09-04 21:25:01.290562,2023-09-04 21:25:03.326999,0 days 00:00:02.036437,ReLU,Sigmoid,Sigmoid,,25,21,23.0,22.0,,0.02144347915407657,3,213,0.3388584139158857,2.498825573354371e-05,482.7892729106702,COMPLETE
400,0.34365347027778625,2023-09-04 21:25:03.327580,2023-09-04 21:25:05.346586,0 days 00:00:02.019006,ReLU,Leaky,Leaky,,28,20,21.0,16.0,,0.017334724803208572,3,219,0.7999115475650883,0.0017539523848920714,138.1653120252821,COMPLETE
401,0.31117430329322815,2023-09-04 21:25:05.347169,2023-09-04 21:25:07.451016,0 days 00:00:02.103847,ReLU,Leaky,Leaky,,41,21,24.0,8.0,,0.012441787832295242,3,193,0.6814420934250336,1.4641264002880642e-05,1370.1181776258682,COMPLETE
402,0.9202020764350891,2023-09-04 21:25:07.451610,2023-09-04 21:25:07.732177,0 days 00:00:00.280567,Tanh,Sigmoid,Sigmoid,,56,21,20.0,18.0,,0.008293996872588366,3,182,0.3222590942822814,0.08036582461055675,100.55822337757458,COMPLETE
403,0.363221138715744,2023-09-04 21:25:07.732765,2023-09-04 21:25:08.778598,0 days 00:00:01.045833,ReLU,Tanh,Leaky,,39,20,22.0,15.0,,0.015140761735067624,3,208,0.33022637619064404,1.82216134816625e-05,166.36229687202268,COMPLETE
404,0.36068999767303467,2023-09-04 21:25:08.779186,2023-09-04 21:25:11.759904,0 days 00:00:02.980718,ReLU,Leaky,Sigmoid,,33,22,23.0,7.0,,0.018936501140392838,3,247,0.7633580559412174,0.0031146637938261825,188.42690992355347,COMPLETE
405,0.345175564289093,2023-09-04 21:25:11.760481,2023-09-04 21:25:12.756301,0 days 00:00:00.995820,ReLU,Leaky,Leaky,,30,19,21.0,9.0,,0.025875336354448938,3,221,0.4130788156811079,3.8714233521800816e-05,134.92524513831506,COMPLETE
406,0.3304468095302582,2023-09-04 21:25:12.756893,2023-09-04 21:25:15.669562,0 days 00:00:02.912669,Tanh,Sigmoid,Leaky,,37,20,21.0,23.0,,0.009649852115244837,3,237,0.565792734257268,0.0005263121118666731,126.24966430664062,COMPLETE
407,0.5684875845909119,2023-09-04 21:25:15.670190,2023-09-04 21:25:19.110989,0 days 00:00:03.440799,ReLU,Leaky,Sigmoid,,35,2,22.0,8.0,,0.012214527197366315,3,432,0.6001872483123191,0.001864216114479393,324.8365350341797,COMPLETE
408,0.291480153799057,2023-09-04 21:25:19.111570,2023-09-04 21:25:21.338350,0 days 00:00:02.226780,ReLU,Leaky,Leaky,,42,21,23.0,10.0,,0.03609673875709258,3,227,0.7270936740753565,3.0853766895792805e-05,259.74225749140203,COMPLETE
409,0.3874267637729645,2023-09-04 21:25:21.338944,2023-09-04 21:25:25.074604,0 days 00:00:03.735660,ReLU,Sigmoid,Tanh,,31,22,24.0,9.0,,0.0012262125259190656,3,212,0.35466666671608466,2.5979735448297507e-05,2522.7161510836695,COMPLETE
410,0.23819896578788757,2023-09-04 21:25:25.075194,2023-09-04 21:25:27.097393,0 days 00:00:02.022199,ReLU,Leaky,Leaky,,40,20,22.0,10.0,,0.008319318522595428,3,245,0.7665693365360021,4.193882936088735e-05,263.70976136860094,COMPLETE
411,0.3068799376487732,2023-09-04 21:25:27.097977,2023-09-04 21:25:28.122515,0 days 00:00:01.024538,Tanh,Leaky,Leaky,,39,20,21.0,10.0,,0.007525860669170482,3,253,0.7701338606373439,4.298450174845662e-05,142.32072067260742,COMPLETE
412,0.3656967282295227,2023-09-04 21:25:28.123099,2023-09-04 21:25:30.574251,0 days 00:00:02.451152,ReLU,Sigmoid,Leaky,,36,19,22.0,10.0,,0.009103718007762015,3,245,0.7444562855302741,0.003530366407085583,162.86863431063566,COMPLETE
413,0.30161044001579285,2023-09-04 21:25:30.574831,2023-09-04 21:25:34.182057,0 days 00:00:03.607226,ReLU,Leaky,Leaky,,34,20,22.0,10.0,,0.0009917266977580966,3,244,0.7770618975587219,5.151676833642334e-05,262.81819178263345,COMPLETE
414,0.6389473676681519,2023-09-04 21:25:34.182660,2023-09-04 21:25:46.858988,0 days 00:00:12.676328,ReLU,Tanh,Leaky,,38,18,21.0,2.0,,3.7578537822978825e-05,3,256,0.7128274803279574,0.0007291263777423292,152.89383307099342,COMPLETE
415,0.35601508617401123,2023-09-04 21:25:46.859585,2023-09-04 21:25:52.531758,0 days 00:00:05.672173,Sigmoid,Leaky,Leaky,,32,19,20.0,9.0,,0.011204251530618395,3,237,0.7980313496542563,0.0015100412029481884,141.92576686815283,COMPLETE
416,0.3578871786594391,2023-09-04 21:25:52.532351,2023-09-04 21:26:04.050908,0 days 00:00:11.518557,ReLU,Sigmoid,Leaky,,40,20,22.0,7.0,,0.0003442885636360648,3,230,0.7482981034317776,4.189058325603099e-05,244.17314748349398,COMPLETE
417,0.443668931722641,2023-09-04 21:26:04.051499,2023-09-04 21:26:04.811653,0 days 00:00:00.760154,Tanh,Leaky,Leaky,,36,20,22.0,11.0,,0.07605577230739421,3,253,0.3138514770123887,0.002248264463637422,149.68186740217538,COMPLETE
418,0.28328076004981995,2023-09-04 21:26:04.812243,2023-09-04 21:26:08.612441,0 days 00:00:03.800198,ReLU,Leaky,Sigmoid,,26,16,21.0,8.0,,0.007597474373062708,3,149,0.6974832818880962,0.0007972156010758218,321.76688385009766,COMPLETE
419,0.8969530463218689,2023-09-04 21:26:08.613024,2023-09-04 21:26:24.403067,0 days 00:00:15.790043,Sigmoid,Sigmoid,Leaky,,29,19,20.0,10.0,,1.202308256924184e-05,3,237,0.7655846956641968,0.001452563556603324,108.15016689381017,COMPLETE
420,0.41477030515670776,2023-09-04 21:26:24.403656,2023-09-04 21:26:32.191651,0 days 00:00:07.787995,ReLU,Leaky,Leaky,,33,18,22.0,9.0,,7.615572602152875e-05,3,244,0.40346704382347937,3.575897473802821e-05,385.49252813370504,COMPLETE
421,0.4970821440219879,2023-09-04 21:26:32.192255,2023-09-04 21:26:43.515344,0 days 00:00:11.323089,ReLU,Sigmoid,ReLU,,38,23,21.0,8.0,,9.274708757975075e-05,3,223,0.7256535545674812,1.1499953966087309e-05,317.7679034519623,COMPLETE
422,0.3384634554386139,2023-09-04 21:26:43.515945,2023-09-04 21:26:45.093842,0 days 00:00:01.577897,Sigmoid,Leaky,Sigmoid,,60,20,22.0,10.0,,0.015132666565008855,3,234,0.7691896570848809,5.819907587255908e-05,184.9353427886963,COMPLETE
423,0.31016790866851807,2023-09-04 21:26:45.094428,2023-09-04 21:26:46.328737,0 days 00:00:01.234309,ReLU,Leaky,Leaky,,34,21,21.0,22.0,,0.009182148445218781,3,167,0.685253952144815,4.682439407004319e-05,176.93034224076703,COMPLETE
424,0.3493291437625885,2023-09-04 21:26:46.329328,2023-09-04 21:26:50.277608,0 days 00:00:03.948280,Tanh,Tanh,Leaky,,20,7,23.0,9.0,,0.020989386895305506,3,259,0.7360427259398307,0.00020577989293373727,771.7531828446822,COMPLETE
425,0.38086941838264465,2023-09-04 21:26:50.278207,2023-09-04 21:26:53.484690,0 days 00:00:03.206483,ReLU,Sigmoid,,,40,17,21.0,,,0.006676203323126739,2,246,0.7988648278590484,0.0012909096399363166,158.97411872971225,COMPLETE
426,0.40063974261283875,2023-09-04 21:26:53.485260,2023-09-04 21:26:56.797459,0 days 00:00:03.312199,Sigmoid,Leaky,Sigmoid,,30,19,22.0,8.0,,0.052512647832634415,3,223,0.7145528262737239,0.0009269944007816335,460.28908680103444,COMPLETE
427,0.5402234792709351,2023-09-04 21:26:56.798046,2023-09-04 21:27:06.011318,0 days 00:00:09.213272,ReLU,Leaky,Leaky,,37,20,23.0,10.0,,3.175902854751776e-05,3,197,0.6556287399632735,2.0710683612344876e-05,154.91832012815524,COMPLETE
428,0.3066343367099762,2023-09-04 21:27:06.011915,2023-09-04 21:27:08.835073,0 days 00:00:02.823158,ReLU,Sigmoid,ReLU,,32,21,24.0,23.0,,0.011961633850013127,3,232,0.7509536652249689,1.406580779968204e-05,170.29749264187282,COMPLETE
429,0.32295194268226624,2023-09-04 21:27:08.835652,2023-09-04 21:27:10.564603,0 days 00:00:01.728951,Sigmoid,Leaky,Sigmoid,,35,18,20.0,9.0,,0.01648763180240647,3,218,0.7690412949571718,3.4884232998999e-05,1898.713795629041,COMPLETE
430,0.3617344796657562,2023-09-04 21:27:10.565204,2023-09-04 21:27:12.481724,0 days 00:00:01.916520,ReLU,Leaky,Leaky,,45,19,22.0,8.0,,0.028017697603027168,3,183,0.7994485784821969,6.375226972516856e-05,140.5264788175884,COMPLETE
431,0.3675463795661926,2023-09-04 21:27:12.482309,2023-09-04 21:27:15.749725,0 days 00:00:03.267416,Tanh,Sigmoid,Leaky,,28,20,22.0,7.0,,0.013428572957453573,3,326,0.4884150587686369,0.0011733364124308717,167.04664768584786,COMPLETE
432,0.37697821855545044,2023-09-04 21:27:15.750322,2023-09-04 21:27:16.503567,0 days 00:00:00.753245,ReLU,Leaky,Sigmoid,,52,21,23.0,21.0,,0.01046413313779856,3,242,0.27232301300992046,4.457160302234747e-05,161.9757610502697,COMPLETE
433,0.6538391709327698,2023-09-04 21:27:16.504155,2023-09-04 21:27:24.186907,0 days 00:00:07.682752,Sigmoid,Leaky,Leaky,,39,20,21.0,11.0,,6.823088933924168e-05,3,252,0.43430513653551717,3.008030488489477e-05,250.38638584197514,COMPLETE
434,0.3128318786621094,2023-09-04 21:27:24.187496,2023-09-04 21:27:26.719809,0 days 00:00:02.532313,ReLU,Sigmoid,ReLU,,41,22,22.0,9.0,,0.008490554601321075,3,228,0.7026514071477712,2.3424871438403227e-05,165.82112064001694,COMPLETE
435,0.2864719331264496,2023-09-04 21:27:26.720408,2023-09-04 21:27:28.131820,0 days 00:00:01.411412,ReLU,Tanh,Leaky,,31,19,20.0,8.0,,0.01970341172407058,3,240,0.7347075221061915,1.6036117716448968e-05,2112.9666082208805,COMPLETE
436,0.5469264984130859,2023-09-04 21:27:28.132430,2023-09-04 21:27:31.727116,0 days 00:00:03.594686,Sigmoid,Leaky,Sigmoid,,37,21,21.0,10.0,,0.0016526804257956532,3,217,0.39567739602153756,0.0018860665156314855,239.32371727364963,COMPLETE
437,0.31266728043556213,2023-09-04 21:27:31.727710,2023-09-04 21:27:34.432140,0 days 00:00:02.704430,ReLU,Leaky,Leaky,Sigmoid,34,17,23.0,7.0,4.0,0.0063303441606471274,4,200,0.675994386244174,0.0002525150099490841,599.124541526617,COMPLETE
438,0.40191006660461426,2023-09-04 21:27:34.432765,2023-09-04 21:27:35.101275,0 days 00:00:00.668510,Tanh,ReLU,Leaky,,43,20,22.0,23.0,,0.023199376022319838,3,250,0.18786309685079303,0.00273297707932519,395.22306654188367,COMPLETE
439,0.3192633390426636,2023-09-04 21:27:35.101865,2023-09-04 21:27:37.253072,0 days 00:00:02.151207,ReLU,Sigmoid,ReLU,,36,18,24.0,9.0,,0.045581995915101876,3,263,0.7711895898613534,0.0009395639513948795,152.16135592074008,COMPLETE
440,0.4771047830581665,2023-09-04 21:27:37.253676,2023-09-04 21:27:39.184759,0 days 00:00:01.931083,ReLU,Leaky,Sigmoid,,33,21,21.0,10.0,,0.015961464619585725,3,229,0.7394323759740662,1.2512231040809661e-05,302.41266918182373,COMPLETE
441,0.6306208372116089,2023-09-04 21:27:39.185458,2023-09-04 21:27:41.662778,0 days 00:00:02.477320,Sigmoid,Leaky,Leaky,,12,20,2.0,20.0,,0.0020733032885702544,3,174,0.7051618497664619,0.008133210003479703,297.46926922268335,COMPLETE
442,0.2989804744720459,2023-09-04 21:27:41.663427,2023-09-04 21:27:42.774075,0 days 00:00:01.110648,ReLU,ReLU,Leaky,,40,19,23.0,9.0,,0.01125828915224143,3,223,0.4827981554097488,4.9926160065897964e-05,120.46969259938886,COMPLETE
443,0.571438193321228,2023-09-04 21:27:42.774680,2023-09-04 21:27:45.247651,0 days 00:00:02.472971,Tanh,Sigmoid,Sigmoid,,54,22,22.0,21.0,,0.0008897224952291814,3,205,0.23524855696245903,3.986917095961658e-05,243.00651959780245,COMPLETE
444,0.3586569130420685,2023-09-04 21:27:45.248258,2023-09-04 21:27:58.288014,0 days 00:00:13.039756,ReLU,Leaky,Leaky,,30,20,20.0,22.0,,0.0002135375086070498,3,240,0.6356359277124904,5.8500058251880796e-05,112.55220607121785,COMPLETE
445,0.43775007128715515,2023-09-04 21:27:58.288626,2023-09-04 21:28:00.461695,0 days 00:00:02.173069,Sigmoid,Leaky,ReLU,,38,21,23.0,8.0,,0.0076029144752284466,3,261,0.43820886883191307,0.0037189553581650674,293.8974396676728,COMPLETE
446,0.2863113582134247,2023-09-04 21:28:00.462287,2023-09-04 21:28:04.248558,0 days 00:00:03.786271,ReLU,Sigmoid,Leaky,,28,19,22.0,11.0,,0.01330622887669902,3,212,0.7640079340064387,0.0004463935466163256,240.7082036336263,COMPLETE
447,0.2821944057941437,2023-09-04 21:28:04.249160,2023-09-04 21:28:08.325209,0 days 00:00:04.076049,ReLU,ReLU,Sigmoid,,23,22,21.0,9.0,,0.01810130980055529,3,191,0.7988262499175478,3.331411770767587e-05,132.05100915787068,COMPLETE
448,0.2750977575778961,2023-09-04 21:28:08.325811,2023-09-04 21:28:12.793870,0 days 00:00:04.468059,Sigmoid,Leaky,Leaky,,35,21,21.0,8.0,,0.005951719022009384,3,234,0.6766040682981367,1.867338917946816e-05,124.33003375173985,COMPLETE
449,0.3188142478466034,2023-09-04 21:28:12.794475,2023-09-04 21:28:14.121119,0 days 00:00:01.326644,ReLU,Tanh,Leaky,,32,19,24.0,10.0,,0.009568529797183381,3,250,0.7281720291319532,2.785167151793089e-05,494.0664993677384,COMPLETE
450,0.5114372372627258,2023-09-04 21:28:14.121547,2023-09-04 21:28:14.260839,0 days 00:00:00.139292,Tanh,Leaky,Sigmoid,,42,23,22.0,8.0,,0.004049285556720597,3,222,0.14010049530908092,6.72539224257681e-05,182.761476956881,COMPLETE
451,0.5904931426048279,2023-09-04 21:28:14.261272,2023-09-04 21:28:14.572162,0 days 00:00:00.310890,ReLU,Sigmoid,Leaky,,37,20,23.0,22.0,,0.013467797682624892,3,241,0.1726003071490526,8.870354036627849e-05,147.4544394356864,COMPLETE
452,0.3764326274394989,2023-09-04 21:28:14.572577,2023-09-04 21:28:15.259766,0 days 00:00:00.687189,Sigmoid,Leaky,ReLU,,34,20,22.0,7.0,,0.007043404729592357,3,496,0.38701693652467456,0.0006210947570053798,190.45431712317088,COMPLETE
453,0.4949615001678467,2023-09-04 21:28:15.260204,2023-09-04 21:28:15.408847,0 days 00:00:00.148643,ReLU,ReLU,Leaky,,40,18,21.0,23.0,,0.02371716939616604,3,206,0.11569144059408001,3.747097117810795e-05,175.88157515092328,COMPLETE
454,0.3945408761501312,2023-09-04 21:28:15.409177,2023-09-04 21:28:15.701325,0 days 00:00:00.292148,ReLU,Leaky,Sigmoid,,44,21,20.0,24.0,,0.010508495404635105,3,230,0.28471018005986265,2.3471147185819084e-05,171.36076519940352,COMPLETE
455,0.513257622718811,2023-09-04 21:28:15.701680,2023-09-04 21:28:15.878600,0 days 00:00:00.176920,ReLU,Sigmoid,Leaky,,32,20,18.0,11.0,,0.015302230167660063,3,258,0.10039112126134611,5.325874162082707e-05,263.4931307060774,COMPLETE
456,0.46713748574256897,2023-09-04 21:28:15.878949,2023-09-04 21:28:16.293149,0 days 00:00:00.414200,Sigmoid,Leaky,Leaky,,36,21,23.0,9.0,,0.018702903227170425,3,249,0.3213249912364405,0.0042968900852576875,192.84079962836373,COMPLETE
457,0.5638195276260376,2023-09-04 21:28:16.293504,2023-09-04 21:28:19.421109,0 days 00:00:03.127605,Tanh,ReLU,Sigmoid,,29,14,24.0,10.0,,0.00012882487548403446,3,218,0.30176890205797574,0.0001341146407544927,305.89493340308513,COMPLETE
458,0.33732667565345764,2023-09-04 21:28:19.421701,2023-09-04 21:28:20.773449,0 days 00:00:01.351748,ReLU,Leaky,ReLU,,26,22,9.0,14.0,,0.008407507902849868,3,235,0.7679895187461778,0.0014513092166320372,146.9306307705966,COMPLETE
459,0.30625781416893005,2023-09-04 21:28:20.773788,2023-09-04 21:28:22.114150,0 days 00:00:01.340362,ReLU,Sigmoid,Leaky,,38,19,22.0,8.0,,0.005189822366642434,3,186,0.6973030480453555,7.357619606332215e-05,176.67183723449708,COMPLETE
460,0.568398654460907,2023-09-04 21:28:22.114488,2023-09-04 21:28:23.793765,0 days 00:00:01.679277,Sigmoid,Leaky,Tanh,,41,20,21.0,10.0,,0.0001710063096353741,3,268,0.25801862918958013,0.004101259644348694,132.1002251354616,COMPLETE
461,0.3386995792388916,2023-09-04 21:28:23.794145,2023-09-04 21:28:24.124876,0 days 00:00:00.330731,ReLU,ReLU,Leaky,,31,21,15.0,9.0,,0.004180169467820382,3,400,0.212710076999323,0.0008202286983519005,118.4759873099949,COMPLETE
462,0.4785842001438141,2023-09-04 21:28:24.125307,2023-09-04 21:28:24.342190,0 days 00:00:00.216883,ReLU,Tanh,Sigmoid,,35,17,23.0,23.0,,0.011916772410433507,3,198,0.15074618686565297,0.001938906774068065,246.67491619403546,COMPLETE
463,0.28611651062965393,2023-09-04 21:28:24.342629,2023-09-04 21:28:26.542417,0 days 00:00:02.199788,Tanh,Leaky,Leaky,,39,18,22.0,20.0,,0.0010588846026049921,3,216,0.6527644899929381,4.4324478296403695e-05,331.9184070933949,COMPLETE
