number,value,datetime_start,datetime_complete,duration,params_activation1,params_activation2,params_activation3,params_activation4,params_batch_size,params_fl1,params_fl2,params_fl3,params_fl4,params_learning_rate,params_n_layers,params_num_epochs,params_train_size,params_weight_decay,user_attrs_mre,state
1115,0.3690797984600067,2023-09-04 22:29:32.865792,2023-09-04 22:29:35.077966,0 days 00:00:02.212174,ReLU,ReLU,Leaky,ReLU,10,22,15.0,15.0,12.0,0.0008869160596922528,4,282,0.6854715207010176,3.425574690849907e-05,89.96120332416736,COMPLETE
1116,0.31092989444732666,2023-09-04 22:29:35.078417,2023-09-04 22:29:36.722422,0 days 00:00:01.644005,ReLU,Sigmoid,Leaky,Sigmoid,19,22,14.0,16.0,10.0,0.0020895509805875906,4,316,0.7704674290714689,0.00014855848198971384,133.50967181812632,COMPLETE
1117,0.33630526065826416,2023-09-04 22:29:36.722882,2023-09-04 22:29:38.939788,0 days 00:00:02.216906,ReLU,ReLU,Leaky,ReLU,19,21,15.0,14.0,24.0,0.0006665056740761102,4,295,0.7294229089830976,0.0001934730079211689,91.26243082682292,COMPLETE
1118,0.35195356607437134,2023-09-04 22:29:38.940241,2023-09-04 22:29:41.511699,0 days 00:00:02.571458,ReLU,ReLU,Leaky,Tanh,17,20,13.0,16.0,14.0,0.0005251282290837061,4,304,0.7703559284018777,8.69027410913424e-05,98.34495377540588,COMPLETE
1119,0.9414175152778625,2023-09-04 22:29:41.512136,2023-09-04 22:29:41.769496,0 days 00:00:00.257360,ReLU,ReLU,Leaky,ReLU,16,21,14.0,17.0,13.0,0.002860249340641876,4,276,0.23967487495013556,0.07798457813972696,102.97612635294597,COMPLETE
1120,0.29318228363990784,2023-09-04 22:29:41.769936,2023-09-04 22:29:42.899493,0 days 00:00:01.129557,ReLU,ReLU,Leaky,Tanh,20,22,23.0,15.0,11.0,0.002480789012736054,4,287,0.7016316109786861,2.799770418050557e-05,108.48541144168738,COMPLETE
1121,0.9904102087020874,2023-09-04 22:29:42.899948,2023-09-04 22:29:43.527705,0 days 00:00:00.627757,ReLU,ReLU,Leaky,Sigmoid,13,20,15.0,16.0,15.0,0.0003915065832878483,4,296,0.7496664322920046,0.04838748995666392,99.88366907293147,COMPLETE
1122,0.3037613332271576,2023-09-04 22:29:43.528152,2023-09-04 22:29:50.506462,0 days 00:00:06.978310,ReLU,ReLU,Leaky,ReLU,20,19,13.0,17.0,7.0,0.0001568730806634187,4,273,0.7999968944359892,7.949040395744792e-05,121.30888332790799,COMPLETE
1123,0.33637234568595886,2023-09-04 22:29:50.506912,2023-09-04 22:29:53.168400,0 days 00:00:02.661488,ReLU,ReLU,Leaky,Tanh,18,21,14.0,15.0,9.0,0.00028651516642248337,4,278,0.6731728808658568,0.0002210412735653367,117.2072611941567,COMPLETE
1124,0.3851223587989807,2023-09-04 22:29:53.168838,2023-09-04 22:29:53.541395,0 days 00:00:00.372557,ReLU,ReLU,Leaky,ReLU,22,22,15.0,16.0,8.0,0.0011720097341022789,4,272,0.16879868928454816,0.0002624053076589235,113.5007326175005,COMPLETE
1125,0.3099886476993561,2023-09-04 22:29:53.541833,2023-09-04 22:30:03.383147,0 days 00:00:09.841314,ReLU,ReLU,Leaky,Tanh,15,20,13.0,14.0,10.0,0.00016708465760927784,4,288,0.7256761999070782,4.780237777531095e-05,99.43591263714958,COMPLETE
1126,0.41037219762802124,2023-09-04 22:30:03.383591,2023-09-04 22:30:03.791186,0 days 00:00:00.407595,ReLU,ReLU,Leaky,Sigmoid,22,22,15.0,15.0,4.0,0.0036246118203138483,4,271,0.14887476860087584,3.7742580615527864e-05,158.9312594799285,COMPLETE
1127,0.33012112975120544,2023-09-04 22:30:03.791638,2023-09-04 22:30:05.277767,0 days 00:00:01.486129,ReLU,ReLU,Leaky,ReLU,18,21,14.0,17.0,12.0,0.00201767362943561,4,314,0.7714163183822228,0.00011167016174455676,111.73278107514253,COMPLETE
1128,0.32966628670692444,2023-09-04 22:30:05.278207,2023-09-04 22:30:08.457792,0 days 00:00:03.179585,ReLU,ReLU,Leaky,Tanh,20,19,14.0,16.0,10.0,0.0002644341875274009,4,301,0.5100489599372201,2.3893694214188827e-05,115.46855180403766,COMPLETE
1129,0.34070995450019836,2023-09-04 22:30:08.458231,2023-09-04 22:30:10.228229,0 days 00:00:01.769998,ReLU,Leaky,Leaky,ReLU,16,20,22.0,18.0,8.0,0.0008458723538098978,4,280,0.30532442786354247,0.0017149067335326844,114.85097299707998,COMPLETE
1130,0.33936458826065063,2023-09-04 22:30:10.228671,2023-09-04 22:30:12.488186,0 days 00:00:02.259515,ReLU,ReLU,Sigmoid,Sigmoid,23,21,6.0,16.0,6.0,0.0013852743397859651,4,151,0.74543770808939,6.096141769877215e-05,117.91378131665681,COMPLETE
1131,0.3488888740539551,2023-09-04 22:30:12.488634,2023-09-04 22:30:12.995491,0 days 00:00:00.506857,ReLU,Tanh,Leaky,ReLU,20,22,13.0,18.0,22.0,0.002334797172785674,4,267,0.2899599345160044,0.00020405041239968054,136.37884250763923,COMPLETE
1132,0.3784371614456177,2023-09-04 22:30:12.995943,2023-09-04 22:30:13.369032,0 days 00:00:00.373089,Leaky,ReLU,Leaky,Tanh,21,22,15.0,17.0,9.0,0.003812902100926671,4,290,0.21119455647024651,0.00013263997330107685,942.8047337849935,COMPLETE
1133,0.35666996240615845,2023-09-04 22:30:13.369474,2023-09-04 22:30:15.683845,0 days 00:00:02.314371,Sigmoid,ReLU,Sigmoid,ReLU,26,20,21.0,15.0,13.0,0.0030125690118595998,4,267,0.6291022081908125,3.374514801376845e-05,99.36639333871695,COMPLETE
1134,0.414561003446579,2023-09-04 22:30:15.684308,2023-09-04 22:30:16.018777,0 days 00:00:00.334469,ReLU,ReLU,Leaky,Sigmoid,24,19,14.0,16.0,11.0,0.0044051466001338085,4,280,0.15360009541844455,0.00029956165428653977,269.34404422075323,COMPLETE
1135,0.33508065342903137,2023-09-04 22:30:16.019233,2023-09-04 22:30:16.743803,0 days 00:00:00.724570,ReLU,Tanh,,,19,21,13.0,,,0.003205777925565887,2,299,0.34529802247570274,2.788186799763826e-05,124.16062244616057,COMPLETE
1136,0.46166032552719116,2023-09-04 22:30:16.744248,2023-09-04 22:30:21.855708,0 days 00:00:05.111460,ReLU,ReLU,Leaky,Tanh,22,3,15.0,15.0,7.0,3.0270180439140324e-05,4,265,0.4682886994467615,0.003430107021696828,126.17873088908645,COMPLETE
1137,0.35470476746559143,2023-09-04 22:30:21.856151,2023-09-04 22:30:24.155285,0 days 00:00:02.299134,ReLU,ReLU,Sigmoid,ReLU,18,20,14.0,16.0,19.0,0.0009774522229597698,4,141,0.7110915858756178,5.288351848561794e-05,112.40273108849159,COMPLETE
1138,0.3456956446170807,2023-09-04 22:30:24.155724,2023-09-04 22:30:27.517107,0 days 00:00:03.361383,Leaky,ReLU,Leaky,Leaky,30,22,16.0,14.0,9.0,0.0007893403307006255,4,157,0.7732548702414455,2.0354315400822046e-05,101.81630353229802,COMPLETE
1139,0.3521748483181,2023-09-04 22:30:27.517542,2023-09-04 22:30:29.814245,0 days 00:00:02.296703,ReLU,Sigmoid,Sigmoid,Tanh,24,22,18.0,16.0,10.0,0.0006474850179942641,4,274,0.47063447366890165,0.0015104848357818217,125.781587108489,COMPLETE
1140,0.42128118872642517,2023-09-04 22:30:29.814682,2023-09-04 22:30:30.602669,0 days 00:00:00.787987,ReLU,ReLU,Leaky,ReLU,14,21,15.0,17.0,8.0,0.06597028639687162,4,287,0.48164183112394016,0.000159794545873653,131.73408285776773,COMPLETE
1141,1.0289192199707031,2023-09-04 22:30:30.603100,2023-09-04 22:30:31.020574,0 days 00:00:00.417474,ReLU,Tanh,Leaky,Leaky,27,19,13.0,15.0,18.0,0.00048091667988000924,4,266,0.6685988748368787,0.09461580970975564,99.5673828125,COMPLETE
1142,0.40948963165283203,2023-09-04 22:30:31.021015,2023-09-04 22:30:42.429619,0 days 00:00:11.408604,Sigmoid,ReLU,Sigmoid,Sigmoid,22,21,20.0,18.0,23.0,0.00016332893071310548,4,308,0.7442357783594651,1.7847991682112405e-05,112.29545390141475,COMPLETE
1143,0.3680887818336487,2023-09-04 22:30:42.430059,2023-09-04 22:30:50.604379,0 days 00:00:08.174320,Leaky,ReLU,Leaky,Leaky,17,22,14.0,14.0,11.0,5.3421576865680674e-05,4,275,0.5310867445709332,4.136999861129321e-05,116.65169971812855,COMPLETE
1144,0.3533743619918823,2023-09-04 22:30:50.604821,2023-09-04 22:30:51.067909,0 days 00:00:00.463088,ReLU,ReLU,Sigmoid,Tanh,29,20,15.0,17.0,12.0,0.0034146456400401554,4,260,0.37097511705365893,3.0089923345728953e-05,110.3152458190918,COMPLETE
1145,0.28996628522872925,2023-09-04 22:30:51.068353,2023-09-04 22:30:52.577374,0 days 00:00:01.509021,ReLU,Tanh,Leaky,ReLU,25,18,14.0,16.0,14.0,0.004233277555779816,4,262,0.6985046760722818,2.3204825540965117e-05,108.09055546351841,COMPLETE
1146,0.45601320266723633,2023-09-04 22:30:52.577812,2023-09-04 22:30:53.589814,0 days 00:00:01.012002,ReLU,ReLU,Leaky,Leaky,58,20,19.0,19.0,5.0,0.00036088314432667566,4,284,0.19194968649741845,7.495831133625068e-05,438.73148369474035,COMPLETE
1147,0.45307162404060364,2023-09-04 22:30:53.590257,2023-09-04 22:30:53.965641,0 days 00:00:00.375384,ReLU,ReLU,Sigmoid,Sigmoid,23,21,17.0,15.0,24.0,0.002469845758098005,4,273,0.16096571519905614,1.4663532918202397e-05,132.92036113739013,COMPLETE
1148,0.3998267948627472,2023-09-04 22:30:53.966094,2023-09-04 22:30:55.283578,0 days 00:00:01.317484,Leaky,ReLU,Leaky,ReLU,20,22,3.0,16.0,10.0,0.0015519786975974575,4,293,0.27050592061884965,0.00011193213532375746,127.07242504755656,COMPLETE
1149,0.38574957847595215,2023-09-04 22:30:55.284403,2023-09-04 22:30:58.482014,0 days 00:00:03.197611,ReLU,Tanh,Sigmoid,Tanh,27,20,13.0,17.0,9.0,0.00022738818979996104,4,259,0.22707337324388507,2.590763142504425e-05,115.0273020720679,COMPLETE
1150,0.3815445303916931,2023-09-04 22:30:58.482845,2023-09-04 22:31:01.774651,0 days 00:00:03.291806,ReLU,ReLU,Leaky,Leaky,33,8,16.0,16.0,7.0,0.0015904576999794511,4,135,0.7995209864818421,0.0011670157904766156,106.91163770887587,COMPLETE
1151,0.3630296587944031,2023-09-04 22:31:01.775469,2023-09-04 22:31:03.206029,0 days 00:00:01.430560,ReLU,ReLU,Tanh,ReLU,31,21,14.0,17.0,6.0,0.002058881256434587,4,269,0.3204680898361534,0.00017460910057050336,109.9146133050686,COMPLETE
1152,0.2975119650363922,2023-09-04 22:31:03.206874,2023-09-04 22:31:37.481861,0 days 00:00:34.274987,ReLU,Leaky,Sigmoid,Leaky,16,22,18.0,19.0,9.0,8.642053964863513e-05,4,281,0.7309526403532471,0.00034400479356211003,121.999924059016,COMPLETE
1153,0.4130670726299286,2023-09-04 22:31:37.482710,2023-09-04 22:31:42.110543,0 days 00:00:04.627833,Leaky,ReLU,Leaky,Sigmoid,28,19,15.0,15.0,11.0,0.0003353350401349406,4,164,0.25146569495874393,4.6276947553253386e-05,230.23806195142794,COMPLETE
1154,0.30460846424102783,2023-09-04 22:31:42.111410,2023-09-04 22:31:48.131270,0 days 00:00:06.019860,ReLU,ReLU,Tanh,Tanh,24,21,16.0,13.0,3.0,0.0011273038816775767,4,262,0.5680189955720838,1.726136351649445e-05,124.69360812874727,COMPLETE
1155,0.27236056327819824,2023-09-04 22:31:48.132281,2023-09-04 22:31:59.941199,0 days 00:00:11.808918,ReLU,Tanh,Tanh,ReLU,19,22,17.0,18.0,8.0,0.000508149775350132,4,257,0.7702914950039261,3.48558688947419e-05,105.83995208740234,COMPLETE
1156,0.29426106810569763,2023-09-04 22:31:59.942051,2023-09-04 22:32:06.174657,0 days 00:00:06.232606,Sigmoid,,,,21,21,,,,0.0046929918512134145,1,292,0.7229172951899034,1.013987819384065e-05,112.74687573088318,COMPLETE
1157,0.30925673246383667,2023-09-04 22:32:06.175466,2023-09-04 22:32:13.792929,0 days 00:00:07.617463,ReLU,ReLU,,,26,20,14.0,,,0.0005796600475603847,2,270,0.770473126513021,0.00013509801835328628,106.04785882859002,COMPLETE
1158,0.4410064220428467,2023-09-04 22:32:13.793764,2023-09-04 22:32:20.515714,0 days 00:00:06.721950,ReLU,ReLU,Leaky,Leaky,29,23,13.0,16.0,12.0,4.27096793494349e-05,4,254,0.2434161775109343,2.150176910159272e-05,119.71817356019508,COMPLETE
1159,0.32518142461776733,2023-09-04 22:32:20.516581,2023-09-04 22:32:21.748539,0 days 00:00:01.231958,Leaky,ReLU,Tanh,Tanh,62,22,15.0,15.0,10.0,0.005243272628159788,4,277,0.39955896683404307,5.6446608331686e-05,114.02443937821822,COMPLETE
1160,0.36675938963890076,2023-09-04 22:32:21.749427,2023-09-04 22:32:26.954540,0 days 00:00:05.205113,ReLU,Tanh,Sigmoid,Leaky,23,20,18.0,17.0,11.0,0.00024012182301409209,4,263,0.15688865129200777,2.8454813274664266e-05,207.2024949546752,COMPLETE
1161,0.34487807750701904,2023-09-04 22:32:26.955411,2023-09-04 22:32:29.424994,0 days 00:00:02.469583,ReLU,ReLU,Tanh,Sigmoid,26,21,14.0,20.0,10.0,0.003030797301288921,4,308,0.6502692191472056,1.2999545232089656e-05,101.5114285868983,COMPLETE
1162,0.39059773087501526,2023-09-04 22:32:29.425852,2023-09-04 22:32:52.066364,0 days 00:00:22.640512,ReLU,ReLU,Leaky,ReLU,30,4,13.0,16.0,17.0,0.0001271450781496768,4,298,0.750151138011522,6.642372946308694e-05,158.55471310199508,COMPLETE
1163,0.36773258447647095,2023-09-04 22:32:52.067242,2023-09-04 22:32:55.741233,0 days 00:00:03.673991,Leaky,ReLU,Tanh,Leaky,21,19,22.0,15.0,8.0,0.0007318771209200966,4,281,0.3490958608878617,0.009523273010739608,127.60356277889676,COMPLETE
1164,0.3309308588504791,2023-09-04 22:32:55.742112,2023-09-04 22:32:56.935505,0 days 00:00:01.193393,ReLU,Sigmoid,Tanh,Tanh,32,20,19.0,16.0,23.0,0.01243881611929784,4,252,0.6964225423854958,0.00025139348086130155,133.75504150390626,COMPLETE
1165,0.3333290219306946,2023-09-04 22:32:56.936352,2023-09-04 22:33:06.448395,0 days 00:00:09.512043,ReLU,ReLU,Sigmoid,ReLU,18,23,24.0,18.0,13.0,0.003765834215521235,4,330,0.7747229518391279,0.007470787039606499,89.70271907133214,COMPLETE
1166,0.3062382936477661,2023-09-04 22:33:06.449258,2023-09-04 22:33:08.894214,0 days 00:00:02.444956,ReLU,Tanh,Leaky,Leaky,25,21,16.0,14.0,7.0,0.017724084205583652,4,267,0.5928923410867186,3.9747522831814576e-05,92.61495139382102,COMPLETE
1167,0.3806198835372925,2023-09-04 22:33:08.895060,2023-09-04 22:33:10.330170,0 days 00:00:01.435110,ReLU,ReLU,Tanh,Sigmoid,23,22,15.0,16.0,12.0,0.0047012719358243684,4,255,0.2157130893681229,2.0393610946993316e-05,230.10902057994497,COMPLETE
1168,0.41267895698547363,2023-09-04 22:33:10.331025,2023-09-04 22:33:11.638046,0 days 00:00:01.307021,Sigmoid,ReLU,Tanh,ReLU,14,20,14.0,17.0,6.0,0.01193737655944065,4,251,0.17766988882483617,0.0010384760438693682,120.85699856665826,COMPLETE
1169,0.3342534005641937,2023-09-04 22:33:11.638938,2023-09-04 22:33:15.403427,0 days 00:00:03.764489,Leaky,ReLU,Leaky,Tanh,27,19,13.0,15.0,9.0,0.005815081994678794,4,288,0.7332731046418548,9.99101656478087e-05,94.92101372612848,COMPLETE
1170,0.8440704345703125,2023-09-04 22:33:15.404300,2023-09-04 22:33:19.297107,0 days 00:00:03.892807,ReLU,Tanh,Sigmoid,Leaky,30,22,18.0,16.0,1.0,0.0003365943016339513,4,263,0.13819957287706466,1.5216726396564106e-05,180.64730553572622,COMPLETE
1171,0.4122112989425659,2023-09-04 22:33:19.297981,2023-09-04 22:33:19.839233,0 days 00:00:00.541252,ReLU,ReLU,Tanh,ReLU,34,21,14.0,17.0,11.0,0.07252056923619746,4,147,0.19050121214490529,3.273482070256146e-05,127.98417578803168,COMPLETE
1172,0.368956983089447,2023-09-04 22:33:19.840105,2023-09-04 22:33:22.860641,0 days 00:00:03.020536,ReLU,ReLU,Leaky,Sigmoid,28,23,16.0,7.0,9.0,0.0013252852590465256,4,274,0.26006838058033754,0.0022768338834126944,133.91798400878906,COMPLETE
1173,0.278598815202713,2023-09-04 22:33:22.861514,2023-09-04 22:33:27.630349,0 days 00:00:04.768835,Tanh,ReLU,Tanh,Leaky,20,22,15.0,3.0,7.0,0.015421154374485308,4,247,0.7990143498070851,0.00046427949826035843,109.77948053871712,COMPLETE
1174,0.342862993478775,2023-09-04 22:33:27.631236,2023-09-04 22:33:30.452070,0 days 00:00:02.820834,ReLU,Tanh,Tanh,Tanh,25,21,23.0,19.0,10.0,0.0018377624614161765,4,258,0.687936757841417,2.3960270355863023e-05,99.97470878832269,COMPLETE
1175,0.3564913272857666,2023-09-04 22:33:30.452947,2023-09-04 22:33:31.533820,0 days 00:00:01.080873,Tanh,ReLU,Sigmoid,ReLU,16,23,17.0,15.0,22.0,0.00800992525157087,4,271,0.2792565354431777,7.966778081997273e-05,103.53661558363173,COMPLETE
1176,0.3361312448978424,2023-09-04 22:33:31.534687,2023-09-04 22:33:33.575566,0 days 00:00:02.040879,Leaky,ReLU,Leaky,Leaky,22,20,13.0,16.0,8.0,0.010362012895575508,4,162,0.7499866365695309,0.013814068381782639,125.9554258647718,COMPLETE
1177,0.3315570652484894,2023-09-04 22:33:33.576472,2023-09-04 22:33:37.121443,0 days 00:00:03.544971,ReLU,Leaky,Tanh,Tanh,32,22,18.0,14.0,24.0,0.0009951359262449105,4,473,0.49265648830991576,1.7414019082536647e-05,112.92238939312142,COMPLETE
1178,0.38912850618362427,2023-09-04 22:33:37.122353,2023-09-04 22:33:47.202717,0 days 00:00:10.080364,Tanh,ReLU,,,28,18,20.0,,,5.807420284982268e-05,2,300,0.4560296109861395,0.01864868591029169,99.83228408813477,COMPLETE
1179,0.3427797853946686,2023-09-04 22:33:47.203564,2023-09-04 22:33:50.374272,0 days 00:00:03.170708,ReLU,ReLU,Tanh,Sigmoid,19,21,15.0,20.0,10.0,0.0026525423285830695,4,285,0.6157759586748816,1.1639655092937837e-05,105.90523089784564,COMPLETE
1180,0.973263144493103,2023-09-04 22:33:50.375134,2023-09-04 22:33:55.217321,0 days 00:00:04.842187,Tanh,Tanh,Leaky,Leaky,23,19,14.0,17.0,11.0,1.805013498690342e-05,4,251,0.14441733542688964,0.026952857956138554,103.30262628684481,COMPLETE
1181,0.28155505657196045,2023-09-04 22:33:55.218154,2023-09-04 22:33:57.838620,0 days 00:00:02.620466,ReLU,ReLU,Tanh,ReLU,70,20,15.0,7.0,12.0,0.0040246888965351875,4,243,0.7996003133577219,0.0015491239893399601,94.11911870562841,COMPLETE
1182,0.37777599692344666,2023-09-04 22:33:57.839459,2023-09-04 22:33:58.459273,0 days 00:00:00.619814,Tanh,ReLU,Sigmoid,Leaky,31,21,21.0,18.0,20.0,0.006149621936067158,4,263,0.10632898970835539,0.004645938393848809,157.0892153845893,COMPLETE
1183,0.30630865693092346,2023-09-04 22:33:58.460121,2023-09-04 22:34:00.949953,0 days 00:00:02.489832,Tanh,ReLU,Tanh,Tanh,25,22,19.0,16.0,9.0,0.0032219185866042264,4,257,0.7148578128208322,4.452851838481522e-05,93.60706792558942,COMPLETE
1184,0.36663785576820374,2023-09-04 22:34:00.950794,2023-09-04 22:34:03.389788,0 days 00:00:02.438994,ReLU,Tanh,Leaky,ReLU,27,23,14.0,15.0,14.0,0.014583228084553139,4,279,0.7678915462922622,0.006601682149647298,118.52989020714394,COMPLETE
1185,0.35211142897605896,2023-09-04 22:34:03.390649,2023-09-04 22:34:21.308562,0 days 00:00:17.917913,Leaky,ReLU,Tanh,Sigmoid,18,20,16.0,2.0,13.0,0.00024520759734011894,4,246,0.6660875613068423,3.06490998540528e-05,125.5864567398336,COMPLETE
1186,0.3871707320213318,2023-09-04 22:34:21.309451,2023-09-04 22:34:48.021095,0 days 00:00:26.711644,Tanh,ReLU,Sigmoid,Leaky,21,22,7.0,16.0,5.0,6.702094719610022e-05,4,268,0.741838998581778,0.00019911262039605326,118.88651440748528,COMPLETE
1187,0.4067029654979706,2023-09-04 22:34:48.021979,2023-09-04 22:35:21.922797,0 days 00:00:33.900818,ReLU,Sigmoid,Tanh,,12,21,17.0,17.0,,2.5412033593552385e-05,3,253,0.7084590673344451,2.5217717999432156e-05,114.98116778950447,COMPLETE
1188,0.3655370771884918,2023-09-04 22:35:21.923634,2023-09-04 22:35:24.522133,0 days 00:00:02.598499,Tanh,ReLU,Leaky,ReLU,30,19,13.0,7.0,21.0,0.0006996600765181993,4,241,0.22062079244332825,1.3975410063104445e-05,110.21120711860307,COMPLETE
1189,0.31833142042160034,2023-09-04 22:35:24.523010,2023-09-04 22:35:30.685295,0 days 00:00:06.162285,ReLU,ReLU,Tanh,,25,22,14.0,5.0,,0.00042583628288270334,3,290,0.7697606420479917,1.9184220683927957e-05,111.63508059654707,COMPLETE
1190,0.44174933433532715,2023-09-04 22:35:30.686151,2023-09-04 22:35:31.394143,0 days 00:00:00.707992,Tanh,Tanh,ReLU,Tanh,34,23,15.0,13.0,8.0,0.005056735305619461,4,260,0.19906727072982197,0.0013898945551372257,145.57953841597944,COMPLETE
1191,0.3646213114261627,2023-09-04 22:35:31.394990,2023-09-04 22:35:33.108606,0 days 00:00:01.713616,Sigmoid,ReLU,Leaky,,28,21,18.0,8.0,,0.008795775907995202,3,129,0.18727672391458192,3.741252355025793e-05,195.18912063945425,COMPLETE
1192,0.3627481162548065,2023-09-04 22:35:33.109453,2023-09-04 22:35:38.653382,0 days 00:00:05.543929,ReLU,ReLU,Tanh,Leaky,23,20,13.0,15.0,11.0,0.0005904125627383796,4,316,0.7299096186439907,0.0029159766663217406,113.91369266833289,COMPLETE
1193,0.3293343782424927,2023-09-04 22:35:38.654268,2023-09-04 22:35:39.940219,0 days 00:00:01.285951,Tanh,ReLU,Sigmoid,,16,23,17.0,14.0,,0.018931112790307326,3,277,0.4171339034276714,0.00014002343372947556,147.9214155409071,COMPLETE
1194,0.3351324200630188,2023-09-04 22:35:39.941058,2023-09-04 22:35:42.221693,0 days 00:00:02.280635,Leaky,Tanh,ReLU,Sigmoid,20,20,14.0,17.0,23.0,0.011877351103691784,4,245,0.3925082496665956,0.0008137193227103084,123.06159952524546,COMPLETE
1195,0.37704741954803467,2023-09-04 22:35:42.222560,2023-09-04 22:36:05.652113,0 days 00:00:23.429553,ReLU,ReLU,Tanh,ReLU,26,18,20.0,19.0,15.0,4.0560661435290956e-05,4,268,0.7671272587975001,0.00034172154646737967,95.56763395622595,COMPLETE
1196,0.31473639607429504,2023-09-04 22:36:05.653015,2023-09-04 22:36:07.319065,0 days 00:00:01.666050,Tanh,ReLU,Leaky,,22,19,15.0,16.0,,0.007183746853260083,3,253,0.5621607844701394,0.0019566461699826805,120.18720944722493,COMPLETE
1197,0.5112014412879944,2023-09-04 22:36:07.319929,2023-09-04 22:36:07.849254,0 days 00:00:00.529325,ReLU,ReLU,ReLU,Leaky,29,21,18.0,18.0,10.0,0.00225806771257648,4,235,0.11259209521899056,2.164178625522648e-05,182.35168334960937,COMPLETE
1198,0.36224833130836487,2023-09-04 22:36:07.850139,2023-09-04 22:36:10.566094,0 days 00:00:02.715955,Tanh,Tanh,Tanh,Tanh,24,22,13.0,8.0,12.0,0.00421507544357286,4,295,0.5275395132662984,0.0035461053446703677,118.15737419128418,COMPLETE
1199,0.509096622467041,2023-09-04 22:36:10.566981,2023-09-04 22:36:25.730780,0 days 00:00:15.163799,ReLU,ReLU,Tanh,,18,21,19.0,7.0,,1.3753707475580009e-05,3,169,0.679106372328572,5.106659680153501e-05,103.48816396498822,COMPLETE
1200,0.3857158124446869,2023-09-04 22:36:25.731647,2023-09-04 22:36:43.179531,0 days 00:00:17.447884,Tanh,ReLU,Sigmoid,ReLU,32,22,12.0,16.0,8.0,9.981521958587186e-05,4,260,0.7096878755926953,2.759061376196447e-05,129.11589161799503,COMPLETE
1201,0.5855690240859985,2023-09-04 22:36:43.180443,2023-09-04 22:36:50.003788,0 days 00:00:06.823345,ReLU,Leaky,ReLU,,27,23,14.0,15.0,,1.5181463910069452e-05,3,244,0.2860501438269694,6.778129061080093e-05,126.04755117072433,COMPLETE
1202,0.33927810192108154,2023-09-04 22:36:50.004638,2023-09-04 22:36:52.890291,0 days 00:00:02.885653,Tanh,ReLU,Leaky,Leaky,14,20,6.0,17.0,9.0,0.010176540488688478,4,273,0.38810498892668654,0.00011508192310535444,107.86315046037946,COMPLETE
1203,0.2995394170284271,2023-09-04 22:36:52.891161,2023-09-04 22:36:55.287923,0 days 00:00:02.396762,Leaky,ReLU,Tanh,,30,22,15.0,16.0,,0.00556624887291645,3,154,0.4974219531887269,1.640167674464372e-05,102.142242871798,COMPLETE
1204,0.27622759342193604,2023-09-04 22:36:55.288784,2023-09-04 22:36:57.444586,0 days 00:00:02.155802,ReLU,Tanh,ReLU,Tanh,35,21,7.0,15.0,6.0,0.008043156019016515,4,253,0.74663441807403,1.004540123270175e-05,105.89902796064105,COMPLETE
