number,value,datetime_start,datetime_complete,duration,params_activation1,params_activation2,params_activation3,params_activation4,params_batch_size,params_fl1,params_fl2,params_fl3,params_fl4,params_learning_rate,params_n_layers,params_num_epochs,params_train_size,params_weight_decay,user_attrs_mre,state
1720,0.2996983826160431,2023-09-04 21:52:17.541974,2023-09-04 21:52:18.451051,0 days 00:00:00.909077,Leaky,ReLU,,,42,22,21.0,,,0.013293781635240821,2,407,0.7693105698453381,0.0001848511925791411,175.36888286045618,COMPLETE
1721,0.782341480255127,2023-09-04 21:52:18.451620,2023-09-04 21:52:21.198868,0 days 00:00:02.747248,Leaky,Sigmoid,,,27,23,19.0,,,1.9444070202035576e-05,2,238,0.3961996130379037,1.6708217196661874e-05,107.14355042401482,COMPLETE
1722,0.4115970730781555,2023-09-04 21:52:21.199348,2023-09-04 21:52:22.377333,0 days 00:00:01.177985,Tanh,,,,39,24,,,,0.0016744861407632806,1,166,0.4209392462070905,0.0011977954829414902,154.7316172955984,COMPLETE
1723,0.3398973047733307,2023-09-04 21:52:22.377810,2023-09-04 21:52:23.466657,0 days 00:00:01.088847,Leaky,ReLU,,,44,21,17.0,,,0.006418549174353637,2,426,0.6616642929645362,3.275252016648137e-05,122.66055450439453,COMPLETE
1724,0.2814272344112396,2023-09-04 21:52:23.467154,2023-09-04 21:52:24.223232,0 days 00:00:00.756078,Leaky,ReLU,,,37,22,23.0,,,0.009738736198687054,2,174,0.7469632469024977,1.17746434122544e-05,133.40435011121963,COMPLETE
1725,0.9579751491546631,2023-09-04 21:52:24.223747,2023-09-04 21:52:27.127922,0 days 00:00:02.904175,Leaky,Sigmoid,,,37,22,24.0,,,1.0407854514619643e-05,2,167,0.7062213745729027,1.2705262041226843e-05,103.86690886720211,COMPLETE
1726,0.41779085993766785,2023-09-04 21:52:27.128411,2023-09-04 21:52:27.397926,0 days 00:00:00.269515,Leaky,ReLU,,,36,21,24.0,,,0.009996518866923309,2,173,0.21226370370704448,1.2811456939159622e-05,118.41355200374828,COMPLETE
1727,0.3452853858470917,2023-09-04 21:52:27.398435,2023-09-04 21:52:28.003819,0 days 00:00:00.605384,Leaky,Leaky,,,39,21,23.0,,,0.008829952809658773,2,181,0.5119519549729189,1.2269186553591743e-05,151.9151773071289,COMPLETE
1728,0.3860074579715729,2023-09-04 21:52:28.004380,2023-09-04 21:52:28.404758,0 days 00:00:00.400378,Leaky,ReLU,,,36,22,24.0,,,0.007938675710337937,2,189,0.233495792640643,1.1356658022348225e-05,127.12077414772727,COMPLETE
1729,0.30714547634124756,2023-09-04 21:52:28.405280,2023-09-04 21:52:29.456458,0 days 00:00:01.051178,Leaky,Sigmoid,,,38,22,23.0,,,0.011122685873214662,2,182,0.6843973276227456,1.531623118550269e-05,316.2146880661232,COMPLETE
1730,0.4020405113697052,2023-09-04 21:52:29.456952,2023-09-04 21:52:31.829829,0 days 00:00:02.372877,Leaky,ReLU,,,37,21,23.0,,,0.00041223518992439126,2,177,0.6383752032698194,1.1322513045233993e-05,142.76096706067102,COMPLETE
1731,0.3167956471443176,2023-09-04 21:52:31.830335,2023-09-04 21:52:33.257245,0 days 00:00:01.426910,Leaky,Sigmoid,,,36,22,23.0,,,0.00950347394711428,2,168,0.7195242600357723,1.4276312001156527e-05,150.5565876680262,COMPLETE
1732,0.37081417441368103,2023-09-04 21:52:33.257760,2023-09-04 21:52:34.032802,0 days 00:00:00.775042,Leaky,ReLU,,,34,16,23.0,,,0.008620975221565616,2,177,0.7371495430002117,1.7233592736842433e-05,309.99281020391555,COMPLETE
1733,0.4003669321537018,2023-09-04 21:52:34.033312,2023-09-04 21:52:38.609582,0 days 00:00:04.576270,Leaky,ReLU,,,39,21,23.0,,,0.0007842384205602037,2,174,0.7010868340555412,0.005855088491415811,154.92265670244083,COMPLETE
1734,0.4513107240200043,2023-09-04 21:52:38.610084,2023-09-04 21:52:38.909167,0 days 00:00:00.299083,Leaky,Sigmoid,,,32,22,24.0,,,0.011797652737184075,2,160,0.1541899266267595,1.4277847062750951e-05,164.6433184814453,COMPLETE
1735,0.32821202278137207,2023-09-04 21:52:38.909688,2023-09-04 21:52:39.614464,0 days 00:00:00.704776,Leaky,ReLU,,,40,21,24.0,,,0.007204201897672776,2,167,0.6562378798748296,1.022925752354512e-05,127.2049935913086,COMPLETE
1736,0.4722959101200104,2023-09-04 21:52:39.614959,2023-09-04 21:52:42.314459,0 days 00:00:02.699500,Leaky,Sigmoid,Leaky,,33,20,23.0,2.0,,0.005477889970698181,3,188,0.3647910187457035,2.1758719520844558e-05,156.41451668444975,COMPLETE
1737,0.33072397112846375,2023-09-04 21:52:42.314985,2023-09-04 21:52:42.897408,0 days 00:00:00.582423,Leaky,ReLU,,,35,21,23.0,,,0.010386323109466543,2,189,0.7393925158992769,1.2178928208316206e-05,132.85218405723572,COMPLETE
1738,0.47085556387901306,2023-09-04 21:52:42.897928,2023-09-04 21:52:45.178588,0 days 00:00:02.280660,Leaky,Leaky,,,38,22,23.0,,,0.000151134935430401,2,160,0.7236853415540219,1.0088828113438402e-05,192.25810708999634,COMPLETE
1739,0.359157919883728,2023-09-04 21:52:45.179089,2023-09-04 21:52:45.906051,0 days 00:00:00.726962,Leaky,ReLU,,,35,22,24.0,,,0.013318560122680824,2,176,0.6190287746187544,1.4358453322215498e-05,123.66839848008267,COMPLETE
1740,0.40546831488609314,2023-09-04 21:52:45.906591,2023-09-04 21:52:46.624923,0 days 00:00:00.718332,Leaky,Sigmoid,,,40,20,23.0,,,0.006457733850401856,2,156,0.33242860318661044,2.102578357280344e-05,173.66605896645405,COMPLETE
1741,0.38874495029449463,2023-09-04 21:52:46.625420,2023-09-04 21:52:47.132504,0 days 00:00:00.507084,Leaky,ReLU,,,37,21,22.0,,,0.01160898606197314,2,180,0.4603054808234936,1.0017004757004321e-05,203.28000126328578,COMPLETE
1742,0.3799349069595337,2023-09-04 21:52:47.132999,2023-09-04 21:52:47.431681,0 days 00:00:00.298682,Leaky,ReLU,,,42,22,23.0,,,0.007988741900573276,2,195,0.35475186562275596,1.8899953169089078e-05,603.8709632610453,COMPLETE
1743,0.3772537410259247,2023-09-04 21:52:47.432192,2023-09-04 21:52:47.839896,0 days 00:00:00.407704,Leaky,Sigmoid,,,34,21,22.0,,,0.014602371335829336,2,163,0.3019852174237556,1.6206851411682713e-05,204.85013190375435,COMPLETE
1744,0.3123573958873749,2023-09-04 21:52:47.840387,2023-09-04 21:52:49.265367,0 days 00:00:01.424980,Leaky,ReLU,,,39,22,24.0,,,0.004846016767370828,2,188,0.6798522299186317,0.0007632328924829803,183.45071074250455,COMPLETE
1745,0.5442649722099304,2023-09-04 21:52:49.265864,2023-09-04 21:52:49.669192,0 days 00:00:00.403328,Leaky,Sigmoid,,,32,20,23.0,,,0.009175069952702727,2,151,0.12049717245683678,0.001994631982724107,187.91613133748373,COMPLETE
1746,0.5488581657409668,2023-09-04 21:52:49.669696,2023-09-04 21:52:51.536471,0 days 00:00:01.866775,Leaky,ReLU,,,41,22,22.0,,,3.798337873881868e-05,2,169,0.5730152741037594,1.3105440463469221e-05,134.0775913035376,COMPLETE
1747,0.32062387466430664,2023-09-04 21:52:51.536945,2023-09-04 21:52:52.443395,0 days 00:00:00.906450,Leaky,ReLU,,,37,21,23.0,,,0.00416537624826505,2,202,0.5278212649481551,2.7555796754071312e-05,112.70107645228289,COMPLETE
1748,0.4487296938896179,2023-09-04 21:52:52.443897,2023-09-04 21:52:52.898883,0 days 00:00:00.454986,Leaky,Sigmoid,,,38,22,22.0,,,0.007441488326901021,2,171,0.17245133100980153,0.0006041902544902662,159.65442478413485,COMPLETE
1749,0.41921472549438477,2023-09-04 21:52:52.899360,2023-09-04 21:52:56.126794,0 days 00:00:03.227434,Leaky,Leaky,,,35,20,23.0,,,0.00021964504824013246,2,183,0.745936813555072,1.7847764261758667e-05,152.37377216776864,COMPLETE
1750,0.3671424388885498,2023-09-04 21:52:56.127270,2023-09-04 21:52:57.327667,0 days 00:00:01.200397,Leaky,ReLU,,,46,21,22.0,,,0.00132984206686134,2,194,0.703411773083731,0.0010861489101624438,129.14715207007623,COMPLETE
1751,0.6087634563446045,2023-09-04 21:52:57.328168,2023-09-04 21:52:59.558792,0 days 00:00:02.230624,Leaky,ReLU,,,41,22,22.0,,,2.2480233604364587e-05,2,154,0.7638171511724745,0.0004573916568828643,157.93607905003933,COMPLETE
1752,0.44000276923179626,2023-09-04 21:52:59.559280,2023-09-04 21:53:00.206930,0 days 00:00:00.647650,Leaky,Sigmoid,,,43,19,23.0,,,0.0022096694212083096,2,148,0.19726585864118565,2.547547433912487e-05,192.23395017675452,COMPLETE
1753,0.3313460052013397,2023-09-04 21:53:00.207447,2023-09-04 21:53:00.924046,0 days 00:00:00.716599,Leaky,ReLU,,,33,22,24.0,,,0.01038406693137234,2,176,0.7506411600603082,1.4238697181759711e-05,279.3643092105263,COMPLETE
1754,0.49509143829345703,2023-09-04 21:53:00.924526,2023-09-04 21:53:01.343859,0 days 00:00:00.419333,Leaky,Sigmoid,,,31,21,22.0,,,0.006078734396933401,2,136,0.11379113129494486,1.2063226328409108e-05,154.0549943106515,COMPLETE
1755,0.6268112063407898,2023-09-04 21:53:01.344415,2023-09-04 21:53:01.889244,0 days 00:00:00.544829,Leaky,ReLU,,,39,20,14.0,,,0.012770523373386362,2,361,0.7170108820167479,0.05493284908642526,131.66634276418975,COMPLETE
1756,0.30201491713523865,2023-09-04 21:53:01.889742,2023-09-04 21:53:02.620865,0 days 00:00:00.731123,Leaky,ReLU,,,36,21,23.0,,,0.014800946282772861,2,159,0.7996424501777136,3.4988158703714136e-05,830.497812124399,COMPLETE
1757,0.40799739956855774,2023-09-04 21:53:02.621354,2023-09-04 21:53:03.829376,0 days 00:00:01.208022,Leaky,Sigmoid,,,51,22,22.0,,,0.001006640449796185,2,211,0.3169750108608777,0.00040009869087954676,187.43365333882554,COMPLETE
1758,0.49734580516815186,2023-09-04 21:53:03.829873,2023-09-04 21:53:04.445181,0 days 00:00:00.615308,Sigmoid,ReLU,,,40,21,6.0,,,0.0028577904556117226,2,228,0.10284090565984043,2.1898646286903405e-05,202.94528626559074,COMPLETE
1759,0.45453453063964844,2023-09-04 21:53:04.445664,2023-09-04 21:53:04.733415,0 days 00:00:00.287751,Leaky,Leaky,,,35,23,16.0,,,0.008527970857796822,2,262,0.13806940127833553,0.0005147511634605166,489.49950743558117,COMPLETE
1760,0.5629103183746338,2023-09-04 21:53:04.733909,2023-09-04 21:53:05.310580,0 days 00:00:00.576671,Tanh,Sigmoid,,,45,8,15.0,,,0.010604257770910256,2,313,0.27531505380975835,0.010934921324076958,161.0693678203382,COMPLETE
1761,0.401498407125473,2023-09-04 21:53:05.311078,2023-09-04 21:53:05.703384,0 days 00:00:00.392306,Leaky,ReLU,,,38,22,22.0,,,0.006225870687141991,2,184,0.16220289233354207,0.0013420733810173514,293.6669688283661,COMPLETE
1762,0.38795697689056396,2023-09-04 21:53:05.703888,2023-09-04 21:53:08.343719,0 days 00:00:02.639831,Leaky,ReLU,,,41,20,17.0,,,0.0005510592720524798,2,203,0.6729632128929927,1.0031617789406608e-05,123.92692400551782,COMPLETE
1763,0.3341561257839203,2023-09-04 21:53:08.344206,2023-09-04 21:53:09.043441,0 days 00:00:00.699235,Leaky,Sigmoid,,,48,24,24.0,,,0.012655230883970452,2,166,0.7684021170106332,1.7620129095520058e-05,146.24325768152872,COMPLETE
1764,0.3084472417831421,2023-09-04 21:53:09.043944,2023-09-04 21:53:09.753836,0 days 00:00:00.709892,Leaky,ReLU,,,43,23,23.0,,,0.016284460226671675,2,379,0.7330405655670472,0.0006311465449011779,141.65706800377887,COMPLETE
1765,0.5671752095222473,2023-09-04 21:53:09.754332,2023-09-04 21:53:10.248606,0 days 00:00:00.494274,Leaky,ReLU,,,28,22,2.0,,,0.0035383485588782347,2,143,0.10034200840817879,0.0003250671785529686,235.2907686033449,COMPLETE
1766,0.936599612236023,2023-09-04 21:53:10.249083,2023-09-04 21:53:12.326980,0 days 00:00:02.077897,Leaky,Sigmoid,Sigmoid,,33,21,22.0,3.0,,5.528845745176241e-05,3,130,0.5966008596653642,0.005433526252349434,186.3791525033804,COMPLETE
1767,0.38108763098716736,2023-09-04 21:53:12.327475,2023-09-04 21:53:12.719165,0 days 00:00:00.391690,Leaky,ReLU,,,37,23,17.0,,,0.0048153552129144095,2,220,0.24874739222209985,0.0010091974017673818,235.30253795276988,COMPLETE
1768,0.7163209319114685,2023-09-04 21:53:12.719665,2023-09-04 21:53:13.199946,0 days 00:00:00.480281,Leaky,Sigmoid,,,30,22,22.0,,,0.007829228403164868,2,282,0.4113758796248209,0.04137086319437297,131.39134276540656,COMPLETE
1769,0.5329099297523499,2023-09-04 21:53:13.200454,2023-09-04 21:53:16.116100,0 days 00:00:02.915646,Tanh,ReLU,,,35,21,23.0,,,2.2226528298344782e-05,2,196,0.7037577462796715,0.0008647852480750578,135.6719882731535,COMPLETE
1770,0.5877463817596436,2023-09-04 21:53:16.116591,2023-09-04 21:53:16.429214,0 days 00:00:00.312623,Leaky,Leaky,,,39,24,22.0,,,0.009416968400920328,2,175,0.12495940417255763,0.021258246348227306,151.11168197631835,COMPLETE
1771,0.4047579765319824,2023-09-04 21:53:16.429711,2023-09-04 21:53:16.705877,0 days 00:00:00.276166,Leaky,ReLU,,,44,23,18.0,,,0.0111923199169685,2,303,0.18599908800682463,1.542502258870442e-05,411.55690239800344,COMPLETE
1772,0.4289073944091797,2023-09-04 21:53:16.706376,2023-09-04 21:53:17.977466,0 days 00:00:01.271090,Leaky,Sigmoid,,,42,20,16.0,,,0.0015014107258552194,2,271,0.2292812027699915,4.0989789572223314e-05,368.74625224996754,COMPLETE
1773,0.5456482172012329,2023-09-04 21:53:17.977956,2023-09-04 21:53:19.701934,0 days 00:00:01.723978,Leaky,ReLU,,,37,22,15.0,,,5.956268943603139e-05,2,108,0.7676222115071715,1.2207704655018184e-05,135.57577062536168,COMPLETE
1774,0.3878827691078186,2023-09-04 21:53:19.702438,2023-09-04 21:53:21.699819,0 days 00:00:01.997381,Leaky,Sigmoid,,,24,21,23.0,,,0.007272917394033252,2,153,0.657572848646083,0.0023628724501000126,154.39379457327036,COMPLETE
1775,0.40340253710746765,2023-09-04 21:53:21.700405,2023-09-04 21:53:25.609810,0 days 00:00:03.909405,Leaky,ReLU,,,32,24,22.0,,,0.00015441212475423313,2,235,0.7412723159609201,0.00040335975135020856,137.4985617779671,COMPLETE
1776,0.3436500132083893,2023-09-04 21:53:25.610364,2023-09-04 21:53:26.446485,0 days 00:00:00.836121,Leaky,ReLU,,,40,23,14.0,,,0.01449486262564283,2,213,0.7691936158928635,2.3730792767313704e-05,122.57963068345013,COMPLETE
1777,0.3773300349712372,2023-09-04 21:53:26.447022,2023-09-04 21:53:28.570877,0 days 00:00:02.123855,Tanh,Sigmoid,,,34,22,24.0,,,0.0019944360320924923,2,256,0.7999838930436505,0.0007313847147487965,140.08332739205196,COMPLETE
1778,0.3748002350330353,2023-09-04 21:53:28.571459,2023-09-04 21:53:29.914396,0 days 00:00:01.342937,Leaky,ReLU,,,47,14,18.0,,,0.004132804714102009,2,164,0.6915310949218533,0.0003374322105550965,110.09514052779586,COMPLETE
1779,0.3382718861103058,2023-09-04 21:53:29.914979,2023-09-04 21:53:30.825465,0 days 00:00:00.910486,Leaky,ReLU,,,36,21,22.0,,,0.0054544823388775155,2,246,0.6237142328188402,0.0005168269240304562,135.2119836807251,COMPLETE
1780,0.457686185836792,2023-09-04 21:53:30.826036,2023-09-04 21:53:31.699242,0 days 00:00:00.873206,Leaky,Sigmoid,,,38,4,17.0,,,0.009582135006009145,2,290,0.3915890376319986,3.095459737692907e-05,176.66018842942643,COMPLETE
1781,0.35569626092910767,2023-09-04 21:53:31.699848,2023-09-04 21:53:32.419642,0 days 00:00:00.719794,Leaky,Leaky,,,41,24,23.0,,,0.016780969248037035,2,186,0.723611396729861,0.003225454766375867,136.99304751132397,COMPLETE
1782,0.541317880153656,2023-09-04 21:53:32.420135,2023-09-04 21:53:35.165121,0 days 00:00:02.744986,Leaky,ReLU,,,29,20,16.0,,,5.642723489361304e-05,2,206,0.4862868093487839,0.00762539411174791,305.9743807153794,COMPLETE
1783,0.3146286904811859,2023-09-04 21:53:35.165745,2023-09-04 21:53:36.323432,0 days 00:00:01.157687,Leaky,Sigmoid,,,45,23,21.0,,,0.012182308923794424,2,136,0.5233136488778857,0.00026692333999657356,153.06693818834094,COMPLETE
1784,0.5771161913871765,2023-09-04 21:53:36.324379,2023-09-04 21:53:40.350551,0 days 00:00:04.026172,Sigmoid,ReLU,,,26,22,23.0,,,0.0001346153707100457,2,146,0.7485313839485946,1.388988311608913e-05,454.7530290786534,COMPLETE
1785,0.3704838454723358,2023-09-04 21:53:40.351107,2023-09-04 21:53:41.290093,0 days 00:00:00.938986,Leaky,ReLU,,,39,21,22.0,,,0.002603086353907082,2,121,0.5713680847202879,1.1864079684864174e-05,134.3090211099653,COMPLETE
1786,0.6492443084716797,2023-09-04 21:53:41.290720,2023-09-04 21:53:42.277451,0 days 00:00:00.986731,Leaky,Sigmoid,,,34,24,18.0,,,0.0002756486591067886,2,230,0.20634779901329237,0.016675957724641144,112.07092081705729,COMPLETE
1787,0.3916390538215637,2023-09-04 21:53:42.278006,2023-09-04 21:53:43.427873,0 days 00:00:01.149867,Tanh,,,,31,22,,,,0.006797017596520094,1,170,0.4579497297199377,1.901834974515035e-05,134.31499206042682,COMPLETE
1788,0.3406951427459717,2023-09-04 21:53:43.428428,2023-09-04 21:53:44.391492,0 days 00:00:00.963064,Leaky,ReLU,,,37,23,22.0,,,0.013425191778507588,2,394,0.7999986226587842,0.00044401455730762454,635.6034898024338,COMPLETE
1789,0.4313648045063019,2023-09-04 21:53:44.392009,2023-09-04 21:53:48.471611,0 days 00:00:04.079602,Leaky,Sigmoid,,,41,12,21.0,,,0.0004158374074274148,2,219,0.71197641489631,2.5607561908770372e-05,149.0410874597558,COMPLETE
1790,0.78960120677948,2023-09-04 21:53:48.472098,2023-09-04 21:53:50.647245,0 days 00:00:02.175147,Leaky,ReLU,,,44,19,23.0,,,1.0303598505391429e-05,2,156,0.7712884859376067,1.579591845524732e-05,160.63614586072092,COMPLETE
1791,0.5695760250091553,2023-09-04 21:53:50.647770,2023-09-04 21:53:54.111417,0 days 00:00:03.463647,Leaky,ReLU,,,35,23,24.0,,,3.381840341705406e-05,2,275,0.3507777334670941,0.0005697304039702315,146.89930089777167,COMPLETE
1792,0.39637312293052673,2023-09-04 21:53:54.112379,2023-09-04 21:53:55.037240,0 days 00:00:00.924861,Leaky,Leaky,,,43,16,15.0,,,0.009618930252176482,2,195,0.297993037934582,0.00030393270549680044,144.78838823106554,COMPLETE
1793,0.5739957690238953,2023-09-04 21:53:55.038288,2023-09-04 21:53:56.118063,0 days 00:00:01.079775,Leaky,Sigmoid,,,33,24,22.0,,,0.018281015509442583,2,370,0.26606595649785547,0.013132569130857114,276.6935657319568,COMPLETE
1794,0.325539767742157,2023-09-04 21:53:56.119003,2023-09-04 21:53:58.563664,0 days 00:00:02.444661,Leaky,ReLU,,,39,21,17.0,,,0.003128641340112287,2,263,0.6724699802133136,0.00038468375613747525,120.53622131347656,COMPLETE
1795,0.38034558296203613,2023-09-04 21:53:58.564206,2023-09-04 21:53:59.788994,0 days 00:00:01.224788,Tanh,ReLU,,,37,19,13.0,,,0.007483823126466729,2,349,0.742218696584946,4.86424563464355e-05,195.72014925077363,COMPLETE
1796,0.5127226114273071,2023-09-04 21:53:59.789529,2023-09-04 21:54:00.803592,0 days 00:00:01.014063,Leaky,Sigmoid,,,41,20,21.0,,,0.0009251802652095181,2,183,0.2583636671549708,0.00023354553931266385,236.07602403984694,COMPLETE
1797,0.3323952555656433,2023-09-04 21:54:00.804101,2023-09-04 21:54:01.543662,0 days 00:00:00.739561,Leaky,ReLU,,,36,18,16.0,,,0.011524107633462176,2,385,0.6926296569692407,5.735712865863159e-05,169.19227964981744,COMPLETE
1798,0.32038798928260803,2023-09-04 21:54:01.544176,2023-09-04 21:54:02.546031,0 days 00:00:01.001855,Leaky,Sigmoid,,,49,22,23.0,,,0.008470510917678387,2,126,0.770149240196974,2.002074032467745e-05,1343.1889224582249,COMPLETE
1799,0.5245078206062317,2023-09-04 21:54:02.546515,2023-09-04 21:54:03.464150,0 days 00:00:00.917635,Leaky,ReLU,,,39,2,18.0,,,0.005994924189402203,2,241,0.7282857828306407,3.8389392417289155e-05,190.56848627726237,COMPLETE
1800,0.36070889234542847,2023-09-04 21:54:03.464685,2023-09-04 21:54:04.935106,0 days 00:00:01.470421,Leaky,ReLU,,,31,23,22.0,,,0.0017551021569736733,2,208,0.7676235601968358,0.0011561342595685544,130.1384008407593,COMPLETE
1801,0.5268794894218445,2023-09-04 21:54:04.935637,2023-09-04 21:54:05.615392,0 days 00:00:00.679755,Leaky,Sigmoid,,,42,22,17.0,,,0.015407479869936088,2,223,0.6517988974901493,0.009432797381432972,163.09595542730287,COMPLETE
1802,0.49338558316230774,2023-09-04 21:54:05.615896,2023-09-04 21:54:05.970082,0 days 00:00:00.354186,Leaky,ReLU,,,35,21,21.0,,,0.004693780007924624,2,170,0.11330365963728962,0.0006931718058165342,161.2837536834007,COMPLETE
1803,0.5047104358673096,2023-09-04 21:54:05.970588,2023-09-04 21:54:07.760367,0 days 00:00:01.789779,Leaky,Leaky,,,46,24,14.0,,,0.00023304718649558987,2,140,0.7209956931768846,0.013699366529280114,199.07426065717425,COMPLETE
1804,0.38341081142425537,2023-09-04 21:54:07.760896,2023-09-04 21:54:08.431759,0 days 00:00:00.670863,Tanh,Sigmoid,,,33,22,23.0,,,0.010027428536347607,2,180,0.43525109260705025,1.2183655146755492e-05,141.27458061606197,COMPLETE
1805,0.5152453780174255,2023-09-04 21:54:08.432261,2023-09-04 21:54:09.687124,0 days 00:00:01.254863,Sigmoid,ReLU,,,38,23,22.0,,,0.0007315213530356789,2,288,0.18931551153547246,1.4645864594430185e-05,214.4905465443929,COMPLETE
1806,0.4406273066997528,2023-09-04 21:54:09.687640,2023-09-04 21:54:10.094456,0 days 00:00:00.406816,Leaky,ReLU,Leaky,,30,21,21.0,5.0,,0.01252116320568223,3,302,0.14577936345703268,2.978395647829328e-05,203.96214604377747,COMPLETE
1807,0.3884819746017456,2023-09-04 21:54:10.094973,2023-09-04 21:54:10.438568,0 days 00:00:00.343595,Leaky,Sigmoid,,,43,24,18.0,,,0.008485778032381788,2,157,0.2351805950142187,1.0015915849365083e-05,207.2260863106206,COMPLETE
1808,0.4876132905483246,2023-09-04 21:54:10.439069,2023-09-04 21:54:10.911548,0 days 00:00:00.472479,Leaky,ReLU,,,23,20,23.0,,,0.005891227541566934,2,190,0.1537914049745531,0.016309275685026534,167.7486651102702,COMPLETE
1809,0.3545747995376587,2023-09-04 21:54:10.912044,2023-09-04 21:54:11.373089,0 days 00:00:00.461045,Leaky,ReLU,,,40,23,24.0,,,0.016126613764007678,2,200,0.3071085165129694,0.0004481234112326831,123.5827458268505,COMPLETE
1810,0.4215572774410248,2023-09-04 21:54:11.373590,2023-09-04 21:54:16.479698,0 days 00:00:05.106108,Leaky,Sigmoid,,,28,21,12.0,,,0.0010925307368724563,2,400,0.7450484174886909,0.005401922645204325,204.9929499472341,COMPLETE
1811,0.317306786775589,2023-09-04 21:54:16.480210,2023-09-04 21:54:17.156781,0 days 00:00:00.676571,Leaky,Tanh,,,37,22,15.0,,,0.019352346974294155,2,337,0.696056055588415,0.0003563295355155394,169.01312219528924,COMPLETE
1812,0.7519107460975647,2023-09-04 21:54:17.157311,2023-09-04 21:54:19.566871,0 days 00:00:02.409560,Leaky,ReLU,,,35,23,16.0,,,1.3421922854958082e-05,2,149,0.7698368259295797,0.0002850769719912142,132.82294735492476,COMPLETE
1813,0.9887761473655701,2023-09-04 21:54:19.567384,2023-09-04 21:54:19.863126,0 days 00:00:00.295742,Tanh,Sigmoid,,,32,24,22.0,,,0.0037212804933939273,2,163,0.7428847338456814,0.07704217284873217,109.9488032947887,COMPLETE
1814,0.48390814661979675,2023-09-04 21:54:19.863639,2023-09-04 21:54:21.329309,0 days 00:00:01.465670,Leaky,Leaky,,,21,22,19.0,,,0.0012950713550474477,2,212,0.2427428761849381,0.004655301115631357,389.234075962812,COMPLETE
1815,0.348262757062912,2023-09-04 21:54:21.329805,2023-09-04 21:54:21.933482,0 days 00:00:00.603677,Leaky,ReLU,,,40,20,21.0,,,0.010646869670840043,2,280,0.5540909252480585,2.2804623659355052e-05,139.78584792766165,COMPLETE
