number,value,datetime_start,datetime_complete,duration,params_activation1,params_activation2,params_activation3,params_activation4,params_batch_size,params_fl1,params_fl2,params_fl3,params_fl4,params_learning_rate,params_n_layers,params_num_epochs,params_train_size,params_weight_decay,user_attrs_mre,state
1317,0.3760419487953186,2023-09-04 22:09:22.929780,2023-09-04 22:09:23.284664,0 days 00:00:00.354884,ReLU,Sigmoid,Leaky,,32,12,20.0,7.0,,0.003880241639216526,3,414,0.19325667517847814,0.006785069831992463,196.8049501117907,COMPLETE
1318,0.4107421934604645,2023-09-04 22:09:23.285158,2023-09-04 22:09:32.879506,0 days 00:00:09.594348,Tanh,ReLU,Leaky,,28,11,21.0,9.0,,2.6625460389897358e-05,3,391,0.7239395678695094,0.0004626945700692247,113.52251633353855,COMPLETE
1319,0.37149128317832947,2023-09-04 22:09:32.880086,2023-09-04 22:09:33.177386,0 days 00:00:00.297300,Leaky,ReLU,Leaky,,29,13,20.0,7.0,,0.03352370839418579,3,442,0.1635037146340795,4.356680323649857e-05,125.183537569913,COMPLETE
1320,0.33298176527023315,2023-09-04 22:09:33.177933,2023-09-04 22:09:39.653713,0 days 00:00:06.475780,Tanh,ReLU,Leaky,,37,12,19.0,8.0,,0.0001190947992428202,3,428,0.7654634115689903,5.2753891674366025e-05,104.04614001874344,COMPLETE
1321,0.3619495630264282,2023-09-04 22:09:39.654393,2023-09-04 22:09:56.961014,0 days 00:00:17.306621,Tanh,ReLU,Leaky,,16,22,9.0,8.0,,2.292592487144322e-05,3,402,0.6200606970552996,6.990605795493404e-05,106.13797072984686,COMPLETE
1322,0.2957361340522766,2023-09-04 22:09:56.961461,2023-09-04 22:09:58.246410,0 days 00:00:01.284949,ReLU,ReLU,Leaky,,31,12,19.0,10.0,,0.003272374165357909,3,420,0.700049766606102,1.4929377371474156e-05,89.42342784486968,COMPLETE
1323,0.33424296975135803,2023-09-04 22:09:58.246904,2023-09-04 22:10:11.161044,0 days 00:00:12.914140,Tanh,ReLU,ReLU,,14,10,21.0,8.0,,0.00016298986608631158,3,392,0.7740924629636832,0.00030807137888498533,94.53446223226825,COMPLETE
1324,0.5062738656997681,2023-09-04 22:10:11.161521,2023-09-04 22:10:20.194292,0 days 00:00:09.032771,Tanh,ReLU,Leaky,,27,14,19.0,9.0,,1.9984216618848785e-05,3,385,0.33537929435686203,2.6341689348512935e-05,104.12325657435827,COMPLETE
1325,0.40884318947792053,2023-09-04 22:10:20.195152,2023-09-04 22:10:20.804077,0 days 00:00:00.608925,Tanh,ReLU,Leaky,,35,11,20.0,8.0,,0.015678315264054127,3,378,0.14221580661141675,3.4090681987684926e-05,130.4496627807617,COMPLETE
1326,0.38495999574661255,2023-09-04 22:10:20.804949,2023-09-04 22:10:21.742564,0 days 00:00:00.937615,ReLU,ReLU,Tanh,,33,11,21.0,7.0,,0.025062465120851987,3,414,0.25906188433785354,0.0007383881038185255,139.99404682832605,COMPLETE
1327,0.3087208569049835,2023-09-04 22:10:21.743430,2023-09-04 22:10:24.423333,0 days 00:00:02.679903,Tanh,ReLU,Leaky,,17,23,19.0,9.0,,0.020465670290976144,3,353,0.7360178012138537,2.2164993424780775e-05,92.69684251149495,COMPLETE
1328,0.42518946528434753,2023-09-04 22:10:24.424236,2023-09-04 22:10:25.172789,0 days 00:00:00.748553,Tanh,ReLU,Leaky,,29,12,19.0,6.0,,0.004584779545523908,3,434,0.15175821764430406,0.00023124385135005437,245.62130215293482,COMPLETE
1329,0.24703828990459442,2023-09-04 22:10:25.173701,2023-09-04 22:10:26.557871,0 days 00:00:01.384170,ReLU,ReLU,Leaky,,27,21,20.0,10.0,,0.007330814230015165,3,398,0.7987973658311232,0.0003927567767975376,101.35871315002441,COMPLETE
1330,0.30113187432289124,2023-09-04 22:10:26.558432,2023-09-04 22:10:27.757619,0 days 00:00:01.199187,ReLU,ReLU,Leaky,,27,20,19.0,9.0,,0.004996471383295204,3,399,0.7728888891247316,0.00035163923096601297,84.29537875153298,COMPLETE
1331,0.32561302185058594,2023-09-04 22:10:27.758123,2023-09-04 22:10:28.661813,0 days 00:00:00.903690,ReLU,ReLU,Leaky,,26,22,20.0,9.0,,0.006901831272018258,3,404,0.7209678593700842,0.0002815722211092172,95.22070813179016,COMPLETE
1332,0.43611982464790344,2023-09-04 22:10:28.662469,2023-09-04 22:10:28.986217,0 days 00:00:00.323748,ReLU,,,,25,22,,,,0.00668991521388247,1,395,0.35693453750455806,0.07389563454934131,174.46652165165654,COMPLETE
1333,0.33055996894836426,2023-09-04 22:10:28.986648,2023-09-04 22:10:29.534715,0 days 00:00:00.548067,ReLU,ReLU,Leaky,,27,20,20.0,10.0,,0.007938231970365927,3,407,0.254934620652025,0.007272352932835297,136.05376870291573,COMPLETE
1334,0.35195648670196533,2023-09-04 22:10:29.535318,2023-09-04 22:10:29.976287,0 days 00:00:00.440969,ReLU,ReLU,ReLU,,25,20,22.0,10.0,,0.0060833358967154775,3,396,0.2452578341112151,4.1276560247373575e-05,118.9031644967886,COMPLETE
1335,0.4204447567462921,2023-09-04 22:10:29.976777,2023-09-04 22:10:30.363944,0 days 00:00:00.387167,ReLU,ReLU,Leaky,,27,9,20.0,10.0,,0.007590445596150144,3,391,0.19619150116710266,7.842440462229562e-05,140.38106336091695,COMPLETE
1336,0.3847235441207886,2023-09-04 22:10:30.364474,2023-09-04 22:10:38.256595,0 days 00:00:07.892121,ReLU,ReLU,Leaky,,24,21,14.0,10.0,,0.0002184767722311429,3,412,0.43252337081397135,0.00019283015862792902,110.62272657273132,COMPLETE
1337,0.3353722393512726,2023-09-04 22:10:38.257547,2023-09-04 22:10:41.419881,0 days 00:00:03.162334,ReLU,ReLU,Tanh,,19,21,21.0,9.0,,0.005686153340842755,3,400,0.6788216901736165,0.0003522447218220156,83.15569395177505,COMPLETE
1338,0.3607232868671417,2023-09-04 22:10:41.420799,2023-09-04 22:10:43.290178,0 days 00:00:01.869379,ReLU,ReLU,Leaky,,26,21,21.0,9.0,,0.09860224406558173,3,384,0.7993221114454079,0.00010840717826429283,96.84893868186258,COMPLETE
1339,0.3427518308162689,2023-09-04 22:10:43.291020,2023-09-04 22:10:50.221672,0 days 00:00:06.930652,ReLU,ReLU,Leaky,,28,22,20.0,10.0,,0.00037516333435674306,3,407,0.6460083096122969,0.00013826004200343387,121.9238277989575,COMPLETE
1340,0.3677736520767212,2023-09-04 22:10:50.222580,2023-09-04 22:10:51.094564,0 days 00:00:00.871984,ReLU,ReLU,Sigmoid,,23,21,20.0,11.0,,0.00968355262669304,3,396,0.22093021511365268,5.110316711092488e-05,120.08526965550014,COMPLETE
1341,0.3221358358860016,2023-09-04 22:10:51.095464,2023-09-04 22:11:05.183359,0 days 00:00:14.087895,ReLU,Sigmoid,Leaky,,25,21,21.0,10.0,,0.00028743788693319494,3,385,0.7471881745423106,0.0002554833618590693,102.53380516429006,COMPLETE
1342,0.35331881046295166,2023-09-04 22:11:05.183833,2023-09-04 22:11:19.286785,0 days 00:00:14.102952,ReLU,ReLU,Leaky,,15,21,13.0,8.0,,4.2959084793484964e-05,3,423,0.7025477992326848,0.00784182554148329,125.66762261438852,COMPLETE
1343,0.32323992252349854,2023-09-04 22:11:19.287308,2023-09-04 22:11:20.500559,0 days 00:00:01.213251,ReLU,ReLU,Leaky,,20,21,21.0,9.0,,0.008426943105651298,3,376,0.773407149327807,0.0004214808897122993,88.7305390641496,COMPLETE
1344,0.3924839496612549,2023-09-04 22:11:20.501024,2023-09-04 22:11:23.562429,0 days 00:00:03.061405,ReLU,ReLU,Leaky,,28,21,20.0,8.0,,0.00017681341155003028,3,413,0.7463089957941673,8.96116320045069e-05,128.80711882653898,COMPLETE
1345,0.31177112460136414,2023-09-04 22:11:23.562968,2023-09-04 22:11:27.019049,0 days 00:00:03.456081,ReLU,ReLU,ReLU,,17,20,19.0,10.0,,0.00044395245939958457,3,407,0.5352060240578568,6.410515149098612e-05,111.01293512439051,COMPLETE
1346,0.3177877366542816,2023-09-04 22:11:27.019611,2023-09-04 22:11:28.281932,0 days 00:00:01.262321,ReLU,ReLU,Leaky,,23,19,20.0,11.0,,0.014633358597147659,3,392,0.7992097087942536,0.00017847829283603754,84.35723114013672,COMPLETE
1347,0.36175981163978577,2023-09-04 22:11:28.282422,2023-09-04 22:11:29.910708,0 days 00:00:01.628286,ReLU,ReLU,Tanh,,85,22,20.0,8.0,,0.0002508353879958352,3,370,0.7201733028086489,3.364444477189341e-05,111.07721179464589,COMPLETE
1348,0.31221407651901245,2023-09-04 22:11:29.911208,2023-09-04 22:11:49.652332,0 days 00:00:19.741124,ReLU,ReLU,Leaky,,13,21,20.0,9.0,,5.752519971032563e-05,3,381,0.671290266395047,7.695556744287751e-05,95.73184504471426,COMPLETE
1349,0.3133670687675476,2023-09-04 22:11:49.652877,2023-09-04 22:11:51.043042,0 days 00:00:01.390165,ReLU,ReLU,Leaky,,21,20,20.0,10.0,,0.007414081295400525,3,417,0.755631973105626,0.0003061711906377898,89.27056555314498,COMPLETE
1350,0.36317500472068787,2023-09-04 22:11:51.043528,2023-09-04 22:11:51.521637,0 days 00:00:00.478109,ReLU,ReLU,Leaky,,26,23,20.0,12.0,,0.018029458338678226,3,399,0.3111314871786852,0.004479460878849815,109.15590007885082,COMPLETE
1351,0.38231995701789856,2023-09-04 22:11:51.522132,2023-09-04 22:11:51.714729,0 days 00:00:00.192597,ReLU,ReLU,Leaky,,24,22,21.0,8.0,,0.011818222742829041,3,426,0.11391635945842979,0.0002332498263537046,167.33627961811266,COMPLETE
1352,0.29739898443222046,2023-09-04 22:11:51.715211,2023-09-04 22:11:54.431344,0 days 00:00:02.716133,ReLU,ReLU,Leaky,,17,21,15.0,9.0,,0.0005676330762997529,3,387,0.7716704890951214,2.693685427456592e-05,112.41895833333334,COMPLETE
1353,0.3434220254421234,2023-09-04 22:11:54.431954,2023-09-04 22:11:56.153258,0 days 00:00:01.721304,Sigmoid,ReLU,Leaky,,19,10,11.0,11.0,,0.0028137610982844944,3,368,0.5644100137285758,4.069386679305599e-05,96.60089733417217,COMPLETE
1354,0.2778327167034149,2023-09-04 22:11:56.153719,2023-09-04 22:11:57.618989,0 days 00:00:01.465270,ReLU,ReLU,ReLU,,27,9,21.0,7.0,,0.005045131444014533,3,407,0.6997016692637313,9.887114854958029e-05,112.24555546687199,COMPLETE
1355,0.2728525400161743,2023-09-04 22:11:57.619498,2023-09-04 22:11:58.488272,0 days 00:00:00.868774,ReLU,ReLU,Leaky,,22,20,15.0,7.0,,0.0272948317944562,3,363,0.7331739185371259,0.00012880239929947352,91.24375632957175,COMPLETE
1356,0.41769200563430786,2023-09-04 22:11:58.488787,2023-09-04 22:12:04.155414,0 days 00:00:05.666627,ReLU,ReLU,Tanh,,29,10,20.0,12.0,,3.775559522946089e-05,3,377,0.5160393947199512,2.118687958012103e-05,122.67460757794368,COMPLETE
1357,0.3699539005756378,2023-09-04 22:12:04.155897,2023-09-04 22:12:04.649507,0 days 00:00:00.493610,Leaky,ReLU,Sigmoid,,25,13,14.0,9.0,,0.009758969682812497,3,348,0.2988307098756665,5.503679171786469e-05,133.88239021301268,COMPLETE
1358,0.3720625340938568,2023-09-04 22:12:04.650021,2023-09-04 22:12:05.150622,0 days 00:00:00.500601,ReLU,ReLU,Leaky,,20,12,15.0,10.0,,0.006005802100975816,3,439,0.27453749637171004,0.00016958830105783394,102.97600246120143,COMPLETE
1359,0.3842698931694031,2023-09-04 22:12:05.151156,2023-09-04 22:12:05.413905,0 days 00:00:00.262749,ReLU,ReLU,Leaky,,23,11,13.0,8.0,,0.021896311234061522,3,394,0.20507231030914153,0.00038573736328084213,114.00829467773437,COMPLETE
1360,0.38563045859336853,2023-09-04 22:12:05.414388,2023-09-04 22:12:05.880415,0 days 00:00:00.466027,ReLU,ReLU,Leaky,,15,22,12.0,11.0,,0.03596500938263651,3,423,0.12081217157247408,0.024929429364525107,177.58417938976754,COMPLETE
1361,0.3287220597267151,2023-09-04 22:12:05.880926,2023-09-04 22:12:06.503116,0 days 00:00:00.622190,ReLU,ReLU,Leaky,,26,10,19.0,8.0,,0.014730814775823777,3,401,0.4493598570563428,1.2418749751013048e-05,98.92129372261665,COMPLETE
1362,0.2909276783466339,2023-09-04 22:12:06.503662,2023-09-04 22:12:10.099549,0 days 00:00:03.595887,Sigmoid,ReLU,Leaky,,18,23,14.0,13.0,,0.004003506964835585,3,415,0.6184813845056554,0.0002090955523119079,107.18909111669508,COMPLETE
1363,0.32244375348091125,2023-09-04 22:12:10.100049,2023-09-04 22:12:10.775376,0 days 00:00:00.675327,ReLU,ReLU,Leaky,,28,24,19.0,7.0,,0.008434649768009025,3,353,0.7990676507077452,1.5598791571076016e-05,113.58341548753822,COMPLETE
1364,0.38116785883903503,2023-09-04 22:12:10.775992,2023-09-04 22:12:11.414403,0 days 00:00:00.638411,ReLU,ReLU,ReLU,,21,9,15.0,9.0,,0.01098911158706297,3,388,0.5982473670288477,0.04104410865438536,112.8096243540446,COMPLETE
1365,0.33612099289894104,2023-09-04 22:12:11.414937,2023-09-04 22:12:19.226207,0 days 00:00:07.811270,Tanh,Sigmoid,Leaky,,24,12,10.0,12.0,,9.206038696997895e-05,3,364,0.6455069197628445,4.6341681650603925e-05,109.15936493087601,COMPLETE
1366,0.3342955708503723,2023-09-04 22:12:19.226737,2023-09-04 22:12:21.700917,0 days 00:00:02.474180,Tanh,ReLU,Tanh,,29,11,12.0,8.0,,0.0003459659807369952,3,372,0.7461973092263993,3.073919093576263e-05,119.89197364739613,COMPLETE
1367,0.30828845500946045,2023-09-04 22:12:21.701435,2023-09-04 22:12:23.792172,0 days 00:00:02.090737,Leaky,ReLU,Leaky,Leaky,17,13,11.0,10.0,1.0,0.017115023152816315,4,430,0.7707440784279991,6.55376421691628e-05,105.39469528198242,COMPLETE
1368,0.30638760328292847,2023-09-04 22:12:23.792646,2023-09-04 22:12:25.118240,0 days 00:00:01.325594,Tanh,ReLU,Leaky,,26,21,14.0,6.0,,0.006766374643631329,3,341,0.6811051086556743,0.005199555543421265,84.44135639585298,COMPLETE
1369,0.372959166765213,2023-09-04 22:12:25.118724,2023-09-04 22:12:30.863014,0 days 00:00:05.744290,ReLU,ReLU,Leaky,,21,11,15.0,7.0,,7.216426399639736e-05,3,379,0.39882107202480244,0.0009732203275740517,107.67084881624005,COMPLETE
1370,0.8332759737968445,2023-09-04 22:12:30.863490,2023-09-04 22:12:41.107383,0 days 00:00:10.243893,Tanh,Sigmoid,Leaky,,12,12,16.0,11.0,,1.4338734410196576e-05,3,446,0.12949733825158363,0.0001467160723429951,102.28624768107461,COMPLETE
1371,0.29976144433021545,2023-09-04 22:12:41.108339,2023-09-04 22:12:52.965130,0 days 00:00:11.856791,Tanh,ReLU,Leaky,,23,10,15.0,8.0,,0.0004886384185373699,3,408,0.7129129230913419,0.00010012857379495704,102.71090129591663,COMPLETE
1372,0.35219913721084595,2023-09-04 22:12:52.965611,2023-09-04 22:12:54.250532,0 days 00:00:01.284921,ReLU,Sigmoid,Leaky,,19,11,20.0,13.0,,0.01259654373690048,3,361,0.7997707135954968,0.008894135143542998,105.94528534833123,COMPLETE
1373,0.4968094825744629,2023-09-04 22:12:54.251011,2023-09-04 22:12:56.339854,0 days 00:00:02.088843,Tanh,Sigmoid,ReLU,,30,12,13.0,12.0,,0.00022543429942742835,3,393,0.15913189427530017,0.01662633696968602,199.46203754441854,COMPLETE
1374,0.2815631031990051,2023-09-04 22:12:56.340304,2023-09-04 22:12:57.610312,0 days 00:00:01.270008,Tanh,ReLU,Leaky,,25,13,14.0,9.0,,0.003130393745550683,3,419,0.7425389971015546,3.769957558379673e-05,100.2097962697347,COMPLETE
1375,0.40853431820869446,2023-09-04 22:12:57.610777,2023-09-04 22:12:59.731816,0 days 00:00:02.121039,Tanh,,,,27,22,,,,0.00012088171817227714,1,350,0.2813013172977577,0.0002654764419548197,112.06883632114955,COMPLETE
1376,0.3874467611312866,2023-09-04 22:12:59.732246,2023-09-04 22:13:00.282973,0 days 00:00:00.550727,ReLU,Sigmoid,Sigmoid,,15,20,15.0,6.0,,0.04650082082670412,3,379,0.24150733551522133,8.15199408762179e-05,126.07492024189717,COMPLETE
1377,0.28123387694358826,2023-09-04 22:13:00.283456,2023-09-04 22:13:01.819990,0 days 00:00:01.536534,Tanh,Tanh,Leaky,,24,9,5.0,7.0,,0.025646506557085225,3,403,0.7198184819607335,0.0004706244721953118,89.03805954729924,COMPLETE
1378,0.3979097902774811,2023-09-04 22:13:01.820434,2023-09-04 22:13:11.604789,0 days 00:00:09.784355,Tanh,Sigmoid,Tanh,,22,10,16.0,10.0,,7.61374379962418e-05,3,359,0.7646945996371552,0.00011287308376707626,112.27430308562468,COMPLETE
1379,0.5392167568206787,2023-09-04 22:13:11.605242,2023-09-04 22:13:15.074593,0 days 00:00:03.469351,ReLU,ReLU,Leaky,,19,12,20.0,9.0,,1.7796163173614198e-05,3,343,0.21725793390219156,0.046540435117971964,157.20532491255778,COMPLETE
1380,0.44896531105041504,2023-09-04 22:13:15.075073,2023-09-04 22:13:15.350783,0 days 00:00:00.275710,Tanh,Sigmoid,,,28,11,15.0,,,0.01922670283480953,2,386,0.1837432540062561,0.013531793460435372,586.6612615170686,COMPLETE
1381,0.30023664236068726,2023-09-04 22:13:15.351265,2023-09-04 22:13:17.380496,0 days 00:00:02.029231,Tanh,Sigmoid,Leaky,,16,10,14.0,13.0,,0.014300515187385081,3,431,0.6762873158452898,0.0012365629795179924,127.84656757419393,COMPLETE
1382,0.3005521893501282,2023-09-04 22:13:17.380954,2023-09-04 22:13:18.905008,0 days 00:00:01.524054,Sigmoid,ReLU,Leaky,,21,11,16.0,8.0,,0.010345263814935541,3,367,0.7699562095635003,0.00030902256978887054,90.15219262305726,COMPLETE
1383,0.3415650427341461,2023-09-04 22:13:18.905487,2023-09-04 22:13:20.748405,0 days 00:00:01.842918,Tanh,Sigmoid,,,30,12,22.0,,,0.004645839376776902,2,413,0.7024626952035284,0.0002011640316357708,98.23404484169156,COMPLETE
1384,0.48631855845451355,2023-09-04 22:13:20.748884,2023-09-04 22:13:20.972776,0 days 00:00:00.223892,ReLU,Sigmoid,Leaky,,26,21,19.0,7.0,,0.008917569136323108,3,397,0.12374367156615544,1.835119855619508e-05,198.00293159484863,COMPLETE
1385,0.3810843527317047,2023-09-04 22:13:20.973260,2023-09-04 22:13:21.248710,0 days 00:00:00.275450,Tanh,ReLU,Leaky,,42,11,7.0,12.0,,0.03009344172123034,3,374,0.20352856489159973,5.694003389573597e-05,117.80173931699811,COMPLETE
1386,0.34245625138282776,2023-09-04 22:13:21.249194,2023-09-04 22:13:33.367838,0 days 00:00:12.118644,Tanh,Sigmoid,,,18,12,15.0,,,0.00014580606649715097,2,453,0.6430581604641991,0.00016579603700416968,105.98355596007627,COMPLETE
1387,0.3959251046180725,2023-09-04 22:13:33.368804,2023-09-04 22:13:36.000916,0 days 00:00:02.632112,ReLU,Sigmoid,Leaky,,25,13,13.0,9.0,,0.0069068938027763375,3,354,0.7996872388482051,0.02496967018982198,103.97062381478243,COMPLETE
1388,0.3793126940727234,2023-09-04 22:13:36.001409,2023-09-04 22:13:37.054026,0 days 00:00:01.052617,Tanh,Tanh,ReLU,,14,9,15.0,7.0,,0.0747187383656322,3,332,0.7379400262764878,7.088298015125049e-05,115.82603613535564,COMPLETE
1389,0.36652567982673645,2023-09-04 22:13:37.054528,2023-09-04 22:13:37.924965,0 days 00:00:00.870437,Tanh,ReLU,,,49,19,16.0,,,0.0024263089356791868,2,438,0.36707469761035727,0.011017371087388686,131.76285680135092,COMPLETE
1390,0.37927594780921936,2023-09-04 22:13:37.925468,2023-09-04 22:13:38.230690,0 days 00:00:00.305222,ReLU,Sigmoid,Leaky,,23,12,12.0,11.0,,0.02105379563197301,3,386,0.22602628131771313,3.014706310900902e-05,172.1151943206787,COMPLETE
1391,0.33782869577407837,2023-09-04 22:13:38.231228,2023-09-04 22:13:39.436182,0 days 00:00:01.204954,Tanh,Sigmoid,Tanh,,27,23,21.0,14.0,,0.005595051289050307,3,423,0.4265235399477633,4.5931826935715275e-05,106.87586181017818,COMPLETE
1392,0.4201164245605469,2023-09-04 22:13:39.436724,2023-09-04 22:13:39.776230,0 days 00:00:00.339506,Leaky,ReLU,,,20,11,14.0,,,0.016239755892316615,2,410,0.3804740465774026,0.0637872667253017,111.68171611585115,COMPLETE
1393,0.3380741775035858,2023-09-04 22:13:39.776810,2023-09-04 22:13:40.440432,0 days 00:00:00.663622,Tanh,Sigmoid,Leaky,,31,10,19.0,6.0,,0.01201637853109749,3,344,0.7651064316803287,0.0005659088138633676,94.77614536991825,COMPLETE
1394,0.41347965598106384,2023-09-04 22:13:40.440949,2023-09-04 22:13:45.230136,0 days 00:00:04.789187,Tanh,Sigmoid,Leaky,,17,11,16.0,8.0,,0.0003643966514052038,3,402,0.5470987292832064,0.0001298643863602065,130.5304093232026,COMPLETE
1395,0.3536657392978668,2023-09-04 22:13:45.230602,2023-09-04 22:13:45.869840,0 days 00:00:00.639238,ReLU,ReLU,Leaky,,22,12,16.0,10.0,,0.03665953323317215,3,370,0.7277232608690789,0.0003703758336415131,106.57162475585938,COMPLETE
1396,0.4100494980812073,2023-09-04 22:13:45.870588,2023-09-04 22:13:46.163018,0 days 00:00:00.292430,Tanh,Sigmoid,,,29,22,11.0,,,0.008837818138152804,2,361,0.18094603066027878,2.307797922421242e-05,120.41537809371948,COMPLETE
1397,0.37358713150024414,2023-09-04 22:13:46.163620,2023-09-04 22:13:47.045570,0 days 00:00:00.881950,Tanh,Sigmoid,Leaky,,24,13,15.0,13.0,,0.014070996222665043,3,352,0.6845116834107814,0.006218106560041003,97.21089986165364,COMPLETE
1398,0.32917317748069763,2023-09-04 22:13:47.046434,2023-09-04 22:13:48.082250,0 days 00:00:01.035816,ReLU,ReLU,,,28,11,20.0,,,0.024865696583326585,2,393,0.3238413995400155,8.394226097504453e-05,113.1475596836635,COMPLETE
1399,0.3133343458175659,2023-09-04 22:13:48.083101,2023-09-04 22:13:48.968530,0 days 00:00:00.885429,Tanh,Tanh,Leaky,,20,12,15.0,12.0,,0.007517187509604299,3,418,0.5060998812963673,0.0008876018561874692,130.57262769426617,COMPLETE
1400,0.3389946520328522,2023-09-04 22:13:48.969019,2023-09-04 22:13:49.991234,0 days 00:00:01.022215,Tanh,Sigmoid,Sigmoid,,25,10,14.0,8.0,,0.010377295554424128,3,336,0.7475360296214799,0.00023480766031756502,101.65801895989313,COMPLETE
1401,0.32072913646698,2023-09-04 22:13:49.991846,2023-09-04 22:13:50.821824,0 days 00:00:00.829978,ReLU,Sigmoid,,,18,11,16.0,,,0.0174630440519999,2,378,0.7712205901251035,3.576335647476684e-05,93.04087624183067,COMPLETE
1402,0.3753238022327423,2023-09-04 22:13:50.822410,2023-09-04 22:13:51.409761,0 days 00:00:00.587351,Tanh,ReLU,Leaky,,22,12,12.0,14.0,,0.0019549632429904013,3,386,0.13711697528045064,0.00010142175096086115,121.28458300028761,COMPLETE
1403,0.3756397068500519,2023-09-04 22:13:51.410305,2023-09-04 22:13:57.152197,0 days 00:00:05.741892,Tanh,Sigmoid,ReLU,,26,11,19.0,11.0,,0.0002824533914730449,3,364,0.4584879451529758,5.8472616045066995e-05,198.1421357555502,COMPLETE
1404,0.3659467399120331,2023-09-04 22:13:57.152694,2023-09-04 22:14:00.634099,0 days 00:00:03.481405,Tanh,Sigmoid,,,16,21,16.0,,,0.0006462993686170759,2,431,0.799819550121317,0.00028843382501343056,338.2436936503709,COMPLETE
1405,0.4816829264163971,2023-09-04 22:14:00.634810,2023-09-04 22:14:00.987665,0 days 00:00:00.352855,ReLU,ReLU,Leaky,,31,13,15.0,13.0,,0.05880034193723212,3,403,0.22994551273574773,0.09937943550800844,117.92850112915039,COMPLETE
1406,0.34177616238594055,2023-09-04 22:14:00.988126,2023-09-04 22:14:03.864703,0 days 00:00:02.876577,Sigmoid,Sigmoid,Tanh,,24,10,15.0,9.0,,0.003739552588663221,3,347,0.4796396300480264,0.00018354963891859034,102.82370358902887,COMPLETE
1407,0.3614409565925598,2023-09-04 22:14:03.865304,2023-09-04 22:14:06.549029,0 days 00:00:02.683725,Tanh,Sigmoid,Leaky,,28,24,13.0,8.0,,0.0004957717360524315,3,325,0.2513355319211908,0.00042905261400376203,176.90933284884184,COMPLETE
1408,0.37142080068588257,2023-09-04 22:14:06.549594,2023-09-04 22:14:06.940435,0 days 00:00:00.390841,Tanh,ReLU,,,13,12,19.0,,,0.012775845688834104,2,372,0.14802656256872398,0.0001409698560851952,208.3525015341269,COMPLETE
1409,0.33213719725608826,2023-09-04 22:14:06.940910,2023-09-04 22:14:07.824138,0 days 00:00:00.883228,ReLU,Sigmoid,Leaky,,21,11,14.0,7.0,,0.019035267766923995,3,358,0.5975404244726064,0.0006829110739625874,123.98938632011414,COMPLETE
1410,0.34787243604660034,2023-09-04 22:14:07.824666,2023-09-04 22:14:08.486425,0 days 00:00:00.661759,Tanh,Tanh,Leaky,,19,9,16.0,12.0,,0.030755270586416535,3,412,0.7192563074907332,0.005540646169612507,117.35782488654641,COMPLETE
