number,value,datetime_start,datetime_complete,duration,params_activation1,params_activation2,params_activation3,params_activation4,params_batch_size,params_fl1,params_fl2,params_fl3,params_fl4,params_learning_rate,params_n_layers,params_num_epochs,params_train_size,params_weight_decay,user_attrs_mre,state
1912,0.3129483461380005,2023-09-04 21:56:38.512921,2023-09-04 21:56:39.888884,0 days 00:00:01.375963,Leaky,ReLU,,,36,21,21.0,,,0.00980499981415804,2,491,0.7726907466134209,1.4816860590399533e-05,310.4283564497785,COMPLETE
1913,0.41594526171684265,2023-09-04 21:56:39.889396,2023-09-04 21:56:40.255155,0 days 00:00:00.365759,Leaky,Tanh,,,92,22,15.0,,,0.01403609718180886,2,249,0.2569734371807617,8.497767757768215e-05,224.1870097110146,COMPLETE
1914,0.812721848487854,2023-09-04 21:56:40.255667,2023-09-04 21:56:40.595678,0 days 00:00:00.340011,Leaky,ReLU,,,32,1,20.0,,,0.02228880042110918,2,500,0.13237436930072494,0.00015632405621276402,615.2903930234237,COMPLETE
1915,0.3646230697631836,2023-09-04 21:56:40.596198,2023-09-04 21:56:41.610391,0 days 00:00:01.014193,Leaky,Sigmoid,,,100,20,22.0,,,0.004287980387942972,2,225,0.686064676246905,0.00010123548263107608,112.7035385616242,COMPLETE
1916,0.34099963307380676,2023-09-04 21:56:41.610939,2023-09-04 21:56:44.106010,0 days 00:00:02.495071,Leaky,ReLU,,,27,22,18.0,,,0.0010010281058296456,2,165,0.7996815616003535,4.5610052938513774e-05,118.01836376029904,COMPLETE
1917,0.357632577419281,2023-09-04 21:56:44.106517,2023-09-04 21:56:45.317847,0 days 00:00:01.211330,Leaky,Sigmoid,,,45,23,19.0,,,0.007527213356165285,2,140,0.7289750481847495,3.021285069613616e-05,133.01278159059123,COMPLETE
1918,0.47667163610458374,2023-09-04 21:56:45.318384,2023-09-04 21:56:46.150065,0 days 00:00:00.831681,Leaky,ReLU,,,41,21,23.0,,,0.0006852364486673805,2,195,0.18829144621134805,1.1826176173084626e-05,276.8376762977013,COMPLETE
1919,0.381683349609375,2023-09-04 21:56:46.150575,2023-09-04 21:56:46.747848,0 days 00:00:00.597273,Tanh,Tanh,,,39,24,18.0,,,0.006148233748200043,2,124,0.4932563919344031,2.095651200576658e-05,214.92899017333986,COMPLETE
1920,0.5580345392227173,2023-09-04 21:56:46.748384,2023-09-04 21:56:50.009953,0 days 00:00:03.261569,Leaky,ReLU,,,37,19,21.0,,,3.249357096781322e-05,2,209,0.7691110237442809,7.802259632084948e-05,130.5835317584316,COMPLETE
1921,0.4689590334892273,2023-09-04 21:56:50.010465,2023-09-04 21:56:51.052922,0 days 00:00:01.042457,Sigmoid,Sigmoid,,,35,23,16.0,,,0.002234379995595402,2,377,0.12205520319618406,0.0004466674705135884,199.24248488306634,COMPLETE
1922,0.35888779163360596,2023-09-04 21:56:51.053446,2023-09-04 21:56:51.596263,0 days 00:00:00.542817,Leaky,ReLU,,,30,22,14.0,,,0.0177491916265464,2,103,0.46015640721615925,0.0002626578278877357,189.23867876101764,COMPLETE
1923,0.5458009839057922,2023-09-04 21:56:51.596799,2023-09-04 21:56:52.641704,0 days 00:00:01.044905,Leaky,Tanh,,,43,23,22.0,,,0.00031157700315593347,2,410,0.12950261644651545,0.0005345177814136158,350.4193438387465,COMPLETE
1924,0.3946792483329773,2023-09-04 21:56:52.642278,2023-09-04 21:56:54.976117,0 days 00:00:02.333839,Leaky,Leaky,,,47,20,23.0,,,0.0004485997989749806,2,334,0.43275638024733565,0.0007917779489994137,136.63042465585178,COMPLETE
1925,0.3994279205799103,2023-09-04 21:56:54.976638,2023-09-04 21:56:55.764084,0 days 00:00:00.787446,Leaky,Sigmoid,,,39,21,24.0,,,0.003334039209607593,2,284,0.22940351245803225,1.0000680792913547e-05,169.9140467150458,COMPLETE
1926,0.8971237540245056,2023-09-04 21:56:55.764594,2023-09-04 21:56:57.111963,0 days 00:00:01.347369,Leaky,ReLU,Leaky,,52,24,21.0,2.0,,5.501930711937435e-05,3,383,0.15955071026025408,1.7992060992398537e-05,149.10078462047926,COMPLETE
1927,0.5850756764411926,2023-09-04 21:56:57.112487,2023-09-04 21:56:58.282267,0 days 00:00:01.169780,Leaky,ReLU,,,41,22,6.0,,,0.00017865134036191462,2,301,0.17127615428369536,0.0003490765976271325,230.44732823165944,COMPLETE
1928,0.3286541998386383,2023-09-04 21:56:58.282783,2023-09-04 21:56:58.934030,0 days 00:00:00.651247,Tanh,Tanh,,,33,23,22.0,,,0.01205103586519652,2,183,0.7436381699872419,0.0001698679947844525,139.3901725537849,COMPLETE
1929,0.5779508352279663,2023-09-04 21:56:58.934572,2023-09-04 21:57:02.325430,0 days 00:00:03.390858,Leaky,Sigmoid,,,36,22,20.0,,,4.304131853466494e-05,2,234,0.7050430749587719,1.4948494470566838e-05,132.13872394398746,COMPLETE
1930,0.3369513750076294,2023-09-04 21:57:02.325928,2023-09-04 21:57:03.037050,0 days 00:00:00.711122,Leaky,ReLU,,,55,24,19.0,,,0.008803348209383895,2,260,0.6623030657706492,0.00021806503706091896,190.37078704833985,COMPLETE
1931,0.5310946106910706,2023-09-04 21:57:03.037547,2023-09-04 21:57:03.357575,0 days 00:00:00.320028,Leaky,ReLU,,,38,21,17.0,,,0.09260367400725271,2,154,0.4081903152600828,0.004146570047135292,229.4813814163208,COMPLETE
1932,0.4351509213447571,2023-09-04 21:57:03.358089,2023-09-04 21:57:05.550721,0 days 00:00:02.192632,Leaky,Sigmoid,,,24,23,15.0,,,0.0005461468521862429,2,399,0.2655875181329146,2.5094705261875478e-05,147.43415367381724,COMPLETE
1933,0.6797671914100647,2023-09-04 21:57:05.551253,2023-09-04 21:57:06.281892,0 days 00:00:00.730639,Leaky,Tanh,,,44,21,13.0,,,9.626644216373544e-05,2,166,0.1953470757320143,0.0009647167323541049,132.77104003170888,COMPLETE
1934,0.3779582381248474,2023-09-04 21:57:06.282390,2023-09-04 21:57:07.296026,0 days 00:00:01.013636,Leaky,ReLU,,,42,20,23.0,,,0.0014967736204728388,2,277,0.7597722576023955,0.00040827929121071467,229.30785624186197,COMPLETE
1935,0.4405812621116638,2023-09-04 21:57:07.296539,2023-09-04 21:57:07.675110,0 days 00:00:00.378571,Leaky,Sigmoid,,,40,24,12.0,,,0.01490386388491582,2,224,0.14534799713691599,0.00027146383071633627,174.95962077173692,COMPLETE
1936,0.33528587222099304,2023-09-04 21:57:07.675628,2023-09-04 21:57:09.951977,0 days 00:00:02.276349,Leaky,ReLU,,,31,7,21.0,,,0.005550881169196067,2,291,0.723601395072697,0.0011933374148688082,140.37373441808364,COMPLETE
1937,0.3507730960845947,2023-09-04 21:57:09.952480,2023-09-04 21:57:10.847134,0 days 00:00:00.894654,Tanh,Leaky,,,34,18,22.0,,,0.011216797833903256,2,147,0.7623664439685367,3.28755550049815e-05,123.9382009700853,COMPLETE
1938,0.33660030364990234,2023-09-04 21:57:10.847642,2023-09-04 21:57:11.824431,0 days 00:00:00.976789,Leaky,Tanh,,,37,22,20.0,,,0.0071826377819934955,2,175,0.6879845703860891,1.3617417264530608e-05,303.28777523698477,COMPLETE
1939,0.8322007060050964,2023-09-04 21:57:11.824942,2023-09-04 21:57:12.961069,0 days 00:00:01.136127,Leaky,ReLU,,,28,23,18.0,,,1.6730381275555525e-05,2,128,0.3124261973217642,0.0017166923099529643,131.67520397901535,COMPLETE
1940,0.48387032747268677,2023-09-04 21:57:12.961576,2023-09-04 21:57:13.361895,0 days 00:00:00.400319,Leaky,,,,39,11,,,,0.0761215344044666,1,199,0.6366171274265314,0.0006762278670418623,365.5008201599121,COMPLETE
1941,0.3640836477279663,2023-09-04 21:57:13.362408,2023-09-04 21:57:14.085240,0 days 00:00:00.722832,Leaky,Sigmoid,,,33,22,19.0,,,0.024855452789220835,2,191,0.7669306633228005,0.0003130351627448727,204.09920687288852,COMPLETE
1942,0.5937965512275696,2023-09-04 21:57:14.085763,2023-09-04 21:57:15.879958,0 days 00:00:01.794195,Leaky,ReLU,,,93,21,16.0,,,4.631999132673333e-05,2,221,0.726368118389524,0.0005217897024217499,144.0197511905998,COMPLETE
1943,0.4373757243156433,2023-09-04 21:57:15.880448,2023-09-04 21:57:16.827571,0 days 00:00:00.947123,Leaky,Tanh,,,43,20,22.0,,,0.008966522165370016,2,117,0.7711588045862268,0.009649246024348166,164.29237390737063,COMPLETE
1944,0.3894488215446472,2023-09-04 21:57:16.828200,2023-09-04 21:57:21.086525,0 days 00:00:04.258325,Sigmoid,Sigmoid,,,35,22,23.0,,,0.0029296002861225984,2,212,0.5138699538585829,3.965262859721413e-05,131.25323353981486,COMPLETE
1945,0.47546055912971497,2023-09-04 21:57:21.087080,2023-09-04 21:57:21.317752,0 days 00:00:00.230672,Leaky,ReLU,,,38,23,21.0,,,0.013324057771600513,2,249,0.12850926845166302,1.1690457062884041e-05,179.10572991004358,COMPLETE
1946,0.3326311409473419,2023-09-04 21:57:21.318290,2023-09-04 21:57:22.144475,0 days 00:00:00.826185,Tanh,ReLU,,,46,24,24.0,,,0.04621874191611985,2,136,0.7998983593547595,6.773011921187128e-05,109.68474449301665,COMPLETE
1947,1.0122641324996948,2023-09-04 21:57:22.145140,2023-09-04 21:57:22.406330,0 days 00:00:00.261190,Leaky,Sigmoid,,,41,24,21.0,,,0.0044344057613267315,2,235,0.7038616730883631,0.09684835947946677,112.9139175415039,COMPLETE
1948,0.5340394973754883,2023-09-04 21:57:22.406991,2023-09-04 21:57:22.643183,0 days 00:00:00.236192,Leaky,Tanh,,,31,21,20.0,,,0.09787862271689793,2,185,0.3288588266156441,2.056997648507863e-05,188.93793131510418,COMPLETE
1949,0.37274467945098877,2023-09-04 21:57:22.643750,2023-09-04 21:57:22.951225,0 days 00:00:00.307475,Leaky,ReLU,,,100,23,17.0,,,0.01947315803709209,2,172,0.29334109456693486,1.6639389469793822e-05,120.0669856752668,COMPLETE
1950,0.3612648844718933,2023-09-04 21:57:22.951766,2023-09-04 21:57:23.831328,0 days 00:00:00.879562,Leaky,Leaky,,,36,20,22.0,,,0.009907035058964573,2,160,0.6649503816701983,0.0001814296904971821,139.23286503758925,COMPLETE
1951,0.36879682540893555,2023-09-04 21:57:23.831846,2023-09-04 21:57:25.267225,0 days 00:00:01.435379,Leaky,ReLU,,,94,22,20.0,,,0.0017559442791368846,2,270,0.7379603479072151,0.00022297358975303168,809.5641294417843,COMPLETE
1952,0.4472289979457855,2023-09-04 21:57:25.267781,2023-09-04 21:57:25.973617,0 days 00:00:00.705836,Leaky,Sigmoid,,,48,21,19.0,,,0.0066480769392792335,2,478,0.21734814985267828,0.005739949126418527,155.1747063913653,COMPLETE
1953,0.7536370754241943,2023-09-04 21:57:25.974205,2023-09-04 21:57:27.312507,0 days 00:00:01.338302,Leaky,Tanh,,,40,23,23.0,,,1.822095268547848e-05,2,148,0.438373369801731,5.70942886579928e-05,115.33018014237688,COMPLETE
1954,0.33226248621940613,2023-09-04 21:57:27.313006,2023-09-04 21:57:27.820644,0 days 00:00:00.507638,Leaky,ReLU,,,37,22,22.0,,,0.01652057342942291,2,213,0.5071383392779779,0.00033632618258010595,188.2001248873197,COMPLETE
1955,0.39275187253952026,2023-09-04 21:57:27.821177,2023-09-04 21:57:28.067845,0 days 00:00:00.246668,Tanh,Sigmoid,,,44,19,21.0,,,0.06227870372662209,2,203,0.20114686558866626,0.0005939442153733283,133.7628683202407,COMPLETE
1956,0.34852030873298645,2023-09-04 21:57:28.068403,2023-09-04 21:57:28.708764,0 days 00:00:00.640361,Leaky,ReLU,,,25,24,16.0,,,0.011240823916191819,2,258,0.5921556428721756,0.00041424806537795124,149.1589135834665,COMPLETE
1957,0.5655028223991394,2023-09-04 21:57:28.709296,2023-09-04 21:57:35.067508,0 days 00:00:06.358212,Leaky,Tanh,Sigmoid,,29,23,14.0,6.0,,7.349429049790356e-05,3,295,0.7437662813626407,2.4019828744007486e-05,152.23320671986724,COMPLETE
1958,0.5745906233787537,2023-09-04 21:57:35.068070,2023-09-04 21:57:42.054740,0 days 00:00:06.986670,Leaky,ReLU,,,32,22,15.0,,,2.4490583114745523e-05,2,402,0.7701127536819864,1.2881403593396895e-05,664.0201775090611,COMPLETE
1959,0.32189422845840454,2023-09-04 21:57:42.055276,2023-09-04 21:57:43.006537,0 days 00:00:00.951261,Leaky,Sigmoid,,,35,21,18.0,,,0.008073265486474229,2,111,0.7014518186257385,4.876805984640825e-05,109.144938764901,COMPLETE
1960,0.31291210651397705,2023-09-04 21:57:43.007088,2023-09-04 21:57:44.002442,0 days 00:00:00.995354,Leaky,ReLU,,,42,24,23.0,,,0.00551573730111877,2,392,0.7997782047845922,0.0021084270868791687,125.84533566334208,COMPLETE
1961,0.4253631830215454,2023-09-04 21:57:44.002969,2023-09-04 21:57:44.434131,0 days 00:00:00.431162,Leaky,Sigmoid,,,38,23,19.0,,,0.013380520507501374,2,131,0.23420999136162263,0.00027939020579547384,165.5063253735739,COMPLETE
1962,0.3315359055995941,2023-09-04 21:57:44.434678,2023-09-04 21:57:45.059386,0 days 00:00:00.624708,Leaky,ReLU,,,45,20,22.0,,,0.010050526544291265,2,177,0.7261183697058874,8.04762065539983e-05,136.4351537704468,COMPLETE
1963,0.43030592799186707,2023-09-04 21:57:45.059939,2023-09-04 21:57:47.912318,0 days 00:00:02.852379,Tanh,Tanh,,,40,21,21.0,,,0.0003741069140373478,2,412,0.34770540148350776,1.8636625922873247e-05,167.25229765142052,COMPLETE
1964,0.5306292772293091,2023-09-04 21:57:47.912828,2023-09-04 21:57:48.169619,0 days 00:00:00.256791,Leaky,Leaky,,,34,22,20.0,,,0.01637943036261301,2,241,0.10840825010744642,0.0007590428922348185,173.85112823486327,COMPLETE
1965,0.47783058881759644,2023-09-04 21:57:48.170152,2023-09-04 21:57:48.812716,0 days 00:00:00.642564,Leaky,ReLU,,,97,24,8.0,,,0.007499259516737131,2,158,0.6704205382111096,0.021772455772806273,280.8971614053805,COMPLETE
1966,0.7017202973365784,2023-09-04 21:57:48.813249,2023-09-04 21:57:50.015141,0 days 00:00:01.201892,Sigmoid,Sigmoid,,,27,23,17.0,,,0.00024721445609258774,2,279,0.13790937842470474,0.00048996211863254,114.7232158483143,COMPLETE
1967,0.505487322807312,2023-09-04 21:57:50.015664,2023-09-04 21:57:51.225401,0 days 00:00:01.209737,Leaky,ReLU,,,38,21,18.0,,,0.0021701776796139442,2,219,0.7996683770813995,0.025858526157626724,215.98386255900064,COMPLETE
1968,0.34671086072921753,2023-09-04 21:57:51.225923,2023-09-04 21:57:53.799823,0 days 00:00:02.573900,Leaky,Tanh,,,42,22,24.0,,,0.0012181487284155107,2,465,0.7475208024436051,1.158769845876214e-05,111.48169165072234,COMPLETE
1969,0.46609216928482056,2023-09-04 21:57:53.800401,2023-09-04 21:57:55.457906,0 days 00:00:01.657505,Leaky,ReLU,,,91,21,22.0,,,0.00013726301384735394,2,228,0.6252951374400525,2.8083882315800735e-05,147.7859004840516,COMPLETE
1970,0.8158631324768066,2023-09-04 21:57:55.458423,2023-09-04 21:57:56.400634,0 days 00:00:00.942211,Leaky,Sigmoid,,,33,23,19.0,,,3.2688730340260656e-05,2,142,0.2541931174351617,1.5519191974289728e-05,127.12946980436084,COMPLETE
1971,0.3272676467895508,2023-09-04 21:57:56.401227,2023-09-04 21:57:57.428326,0 days 00:00:01.027099,Leaky,ReLU,,,20,24,23.0,,,0.022015927077191175,2,197,0.7069873232468166,0.0001081599626214609,125.60819571358817,COMPLETE
1972,0.4757646322250366,2023-09-04 21:57:57.428870,2023-09-04 21:57:57.981903,0 days 00:00:00.553033,Leaky,Tanh,,,40,22,20.0,,,0.004393011461049956,2,167,0.15070915296318546,0.00037612052073717676,841.2595590444712,COMPLETE
1973,1.0308566093444824,2023-09-04 21:57:57.982452,2023-09-04 21:57:58.235759,0 days 00:00:00.253307,Tanh,Sigmoid,,,36,20,21.0,,,0.011865909423008159,2,185,0.5342572864850836,0.09001319653710278,109.85578600565593,COMPLETE
1974,0.38926181197166443,2023-09-04 21:57:58.236316,2023-09-04 21:58:00.771155,0 days 00:00:02.534839,Leaky,ReLU,,,43,22,17.0,,,0.0007553753821699224,2,307,0.7707174198118437,0.0002284637685313025,262.28310241699216,COMPLETE
1975,0.3130645453929901,2023-09-04 21:58:00.772156,2023-09-04 21:58:03.475291,0 days 00:00:02.703135,Leaky,ReLU,,,30,23,22.0,,,0.006144719037592512,2,154,0.5814686343929953,0.00014529484694805845,143.93175494286322,COMPLETE
1976,0.5957340598106384,2023-09-04 21:58:03.476316,2023-09-04 21:58:04.366503,0 days 00:00:00.890187,Leaky,Sigmoid,,,63,24,16.0,,,0.003306202240933355,2,204,0.11823437125524465,0.0003194315731872565,356.8464356784163,COMPLETE
1977,0.48722559213638306,2023-09-04 21:58:04.367505,2023-09-04 21:58:05.520144,0 days 00:00:01.152639,Leaky,Tanh,,,38,14,15.0,,,0.008858346859222484,2,261,0.21701217656533445,1.0088695931090878e-05,356.9108013576931,COMPLETE
1978,0.37348949909210205,2023-09-04 21:58:05.521169,2023-09-04 21:58:06.505975,0 days 00:00:00.984806,Leaky,Leaky,,,98,21,23.0,,,0.015522446182760002,2,363,0.5481141065521751,3.202209644721307e-05,148.14608099521735,COMPLETE
1979,0.34575939178466797,2023-09-04 21:58:06.506488,2023-09-04 21:58:07.400841,0 days 00:00:00.894353,Leaky,ReLU,,,36,19,21.0,,,0.012987175974740426,2,285,0.7403120114004269,1.413721442568919e-05,185.4436225171359,COMPLETE
1980,0.3627587854862213,2023-09-04 21:58:07.401370,2023-09-04 21:58:07.824315,0 days 00:00:00.422945,Leaky,ReLU,,,34,23,20.0,,,0.018448132868726232,2,343,0.6872195408627975,0.00018683294562387757,152.1135780697777,COMPLETE
1981,0.9478739500045776,2023-09-04 21:58:07.824869,2023-09-04 21:58:08.131563,0 days 00:00:00.306694,Tanh,Sigmoid,,,50,22,22.0,,,0.0004964293750565046,2,381,0.7717362634274014,0.09674142990821889,157.47395884195964,COMPLETE
1982,0.3608717918395996,2023-09-04 21:58:08.132105,2023-09-04 21:58:08.830715,0 days 00:00:00.698610,Leaky,Tanh,,,41,23,18.0,,,0.00981797108533793,2,232,0.7216415502691247,0.002606123799698281,182.09309179132634,COMPLETE
1983,0.39823296666145325,2023-09-04 21:58:08.831222,2023-09-04 21:58:09.639355,0 days 00:00:00.808133,Leaky,ReLU,,,47,20,19.0,,,0.0017714126926023845,2,136,0.28338079215949363,2.140792000667502e-05,132.89388993207146,COMPLETE
1984,0.36071789264678955,2023-09-04 21:58:09.639923,2023-09-04 21:58:10.526166,0 days 00:00:00.886243,Leaky,Sigmoid,,,94,24,23.0,,,0.007625248088944774,2,318,0.7712174778593386,0.0006127249619922167,146.6687599363781,COMPLETE
1985,0.47619351744651794,2023-09-04 21:58:10.526727,2023-09-04 21:58:14.313039,0 days 00:00:03.786312,Leaky,ReLU,,,23,21,17.0,,,0.0008880492961789232,2,173,0.746992276856281,0.01665229235485209,164.2557622655968,COMPLETE
1986,0.5167049765586853,2023-09-04 21:58:14.313592,2023-09-04 21:58:14.536937,0 days 00:00:00.223345,Leaky,Tanh,,,32,22,22.0,,,0.02485663641891157,2,121,0.1444762476678264,0.00044627597029577026,156.77426746913366,COMPLETE
1987,0.32234877347946167,2023-09-04 21:58:14.537482,2023-09-04 21:58:15.971066,0 days 00:00:01.433584,Leaky,ReLU,,,39,24,21.0,,,0.004842740022247281,2,215,0.7145870958226658,0.001124866150240771,116.19609392303781,COMPLETE
1988,0.49478134512901306,2023-09-04 21:58:15.971615,2023-09-04 21:58:16.666993,0 days 00:00:00.695378,Leaky,Sigmoid,,,45,23,20.0,,,0.02946060980196626,2,162,0.3626230340944122,0.006582125920289068,174.37645756114614,COMPLETE
1989,0.7227415442466736,2023-09-04 21:58:16.667688,2023-09-04 21:58:19.312142,0 days 00:00:02.644454,Sigmoid,ReLU,,,36,21,24.0,,,2.0989168109309556e-05,2,192,0.6537385290257538,3.855363858580629e-05,124.06128132343292,COMPLETE
1990,0.6081716418266296,2023-09-04 21:58:19.312651,2023-09-04 21:58:19.607637,0 days 00:00:00.294986,Leaky,Leaky,,,43,22,21.0,,,0.013910286500046299,2,272,0.16728247393472262,0.03437964271676201,287.6502577583745,COMPLETE
1991,0.4359234571456909,2023-09-04 21:58:19.608161,2023-09-04 21:58:19.966641,0 days 00:00:00.358480,Tanh,Tanh,,,96,24,23.0,,,0.010201425613043111,2,244,0.20868732849937904,0.0002536573457403047,2652.221410357763,COMPLETE
1992,0.4909864068031311,2023-09-04 21:58:19.967218,2023-09-04 21:58:20.545658,0 days 00:00:00.578440,Leaky,Sigmoid,,,100,21,18.0,,,0.006296582187660341,2,414,0.3823632420249255,0.012021420887352625,301.7318423262266,COMPLETE
1993,0.4181657135486603,2023-09-04 21:58:20.546229,2023-09-04 21:58:21.090574,0 days 00:00:00.544345,Leaky,ReLU,,,39,23,19.0,,,0.003971281805279355,2,141,0.20992315793104888,1.7011445485353962e-05,133.98036878133559,COMPLETE
1994,0.6511608958244324,2023-09-04 21:58:21.091129,2023-09-04 21:58:21.487299,0 days 00:00:00.396170,Leaky,ReLU,,,37,20,15.0,,,0.008178520482480245,2,151,0.6849245354260529,0.07467184511034036,220.06548614501952,COMPLETE
1995,0.4302748739719391,2023-09-04 21:58:21.487878,2023-09-04 21:58:22.141235,0 days 00:00:00.653357,Leaky,Sigmoid,,,41,22,22.0,,,0.0025562748957487207,2,294,0.24002076815927437,1.0020921426795433e-05,154.5636120686489,COMPLETE
1996,0.33446165919303894,2023-09-04 21:58:22.141764,2023-09-04 21:58:23.687553,0 days 00:00:01.545789,Leaky,Tanh,Leaky,,34,22,16.0,3.0,,0.01944599413588865,3,182,0.7692476506884582,0.00030499203096434987,144.5255140032087,COMPLETE
1997,0.5790269374847412,2023-09-04 21:58:23.688629,2023-09-04 21:58:31.063505,0 days 00:00:07.374876,Leaky,,,,27,21,,,,2.862880913875817e-05,1,397,0.7409058262773819,0.00039949591087229034,154.43446553804412,COMPLETE
1998,0.41654977202415466,2023-09-04 21:58:31.064087,2023-09-04 21:58:38.031588,0 days 00:00:06.967501,Leaky,ReLU,,,29,23,22.0,,,0.00019157302860882197,2,223,0.7993038810214596,0.0008789391162055224,136.21193188722893,COMPLETE
1999,0.44922253489494324,2023-09-04 21:58:38.032199,2023-09-04 21:58:42.702969,0 days 00:00:04.670770,Tanh,ReLU,,,66,24,21.0,,,0.00019677504310015056,2,209,0.799810217443498,2.5326914793040453e-05,241.52142118609123,COMPLETE
