number,value,datetime_start,datetime_complete,duration,params_activation1,params_activation2,params_activation3,params_activation4,params_batch_size,params_fl1,params_fl2,params_fl3,params_fl4,params_learning_rate,params_n_layers,params_num_epochs,params_train_size,params_weight_decay,user_attrs_mre,state
748,0.3432151675224304,2023-09-04 22:09:23.197621,2023-09-04 22:09:24.469898,0 days 00:00:01.272277,ReLU,Tanh,Tanh,,38,17,4.0,16.0,,0.02340295270348843,3,265,0.7720790475149134,2.257524070010399e-05,97.59655071440197,COMPLETE
749,0.4533357620239258,2023-09-04 22:09:24.470636,2023-09-04 22:09:25.208127,0 days 00:00:00.737491,Tanh,ReLU,ReLU,,24,21,14.0,22.0,,0.0010933081192051155,3,249,0.12637082299265492,7.04155784983048e-05,120.56163624354771,COMPLETE
750,0.663159191608429,2023-09-04 22:09:25.209030,2023-09-04 22:09:33.242985,0 days 00:00:08.033955,ReLU,Tanh,Tanh,ReLU,31,20,20.0,8.0,12.0,1.0980563008393976e-05,4,203,0.3959775703656027,9.118295802850071e-05,99.42028346320092,COMPLETE
751,0.472993403673172,2023-09-04 22:09:33.243744,2023-09-04 22:09:33.822565,0 days 00:00:00.578821,Leaky,Leaky,ReLU,,26,24,11.0,13.0,,0.03979567156080259,3,242,0.22784947283970963,0.07899611559432947,250.7307952077765,COMPLETE
752,0.32827165722846985,2023-09-04 22:09:33.823300,2023-09-04 22:09:35.197405,0 days 00:00:01.374105,Tanh,ReLU,Tanh,,45,23,13.0,6.0,,0.006724201618680305,3,285,0.4508331675859274,4.15202575265593e-05,89.59119720458985,COMPLETE
753,0.3613528609275818,2023-09-04 22:09:35.198140,2023-09-04 22:09:37.144310,0 days 00:00:01.946170,ReLU,Tanh,Tanh,Tanh,29,20,17.0,18.0,15.0,0.028501419740968793,4,230,0.7988862632981619,1.0048433558529189e-05,109.26363199407405,COMPLETE
754,0.37301871180534363,2023-09-04 22:09:37.145059,2023-09-04 22:09:52.047828,0 days 00:00:14.902769,ReLU,ReLU,ReLU,,35,22,10.0,17.0,,4.791349249266183e-05,3,273,0.7099597836222622,0.0006171084979457661,132.38503877409212,COMPLETE
755,0.30899661779403687,2023-09-04 22:09:52.048540,2023-09-04 22:09:53.390084,0 days 00:00:01.341544,Tanh,ReLU,Tanh,,40,21,18.0,9.0,,0.00964595220870775,3,256,0.7460472836229399,0.00015889346411995933,121.51962280273438,COMPLETE
756,0.36642390489578247,2023-09-04 22:09:53.390903,2023-09-04 22:09:58.102128,0 days 00:00:04.711225,ReLU,Tanh,ReLU,Leaky,27,24,15.0,14.0,7.0,0.00013586640441365282,4,245,0.15617958311839247,0.0009305609587038687,162.3224721480389,COMPLETE
757,0.3484746515750885,2023-09-04 22:09:58.102855,2023-09-04 22:10:01.726799,0 days 00:00:03.623944,Tanh,ReLU,Tanh,,30,19,12.0,10.0,,0.0019067812124207674,3,164,0.6882125764155615,0.010944216825631523,149.10625170097975,COMPLETE
758,0.3452904522418976,2023-09-04 22:10:01.727554,2023-09-04 22:10:02.141780,0 days 00:00:00.414226,Leaky,Tanh,Tanh,,86,23,14.0,7.0,,0.01606128482004605,3,221,0.2341077520089665,1.2698089596407526e-05,214.33542578560966,COMPLETE
759,0.3164355158805847,2023-09-04 22:10:02.142512,2023-09-04 22:10:06.803290,0 days 00:00:04.660778,ReLU,ReLU,Sigmoid,ReLU,23,22,16.0,16.0,17.0,0.0034692850016362184,4,187,0.7399332326011978,0.00022645134923012053,97.54869524637859,COMPLETE
760,0.4146948456764221,2023-09-04 22:10:06.804051,2023-09-04 22:10:07.360832,0 days 00:00:00.556781,Tanh,ReLU,ReLU,,89,22,9.0,6.0,,0.048859881355306584,3,266,0.21193717552338145,0.056306624318507,111.32588941400701,COMPLETE
761,0.3211461007595062,2023-09-04 22:10:07.361581,2023-09-04 22:10:09.771120,0 days 00:00:02.409539,ReLU,Tanh,Leaky,,25,21,13.0,15.0,,0.011195152092958176,3,236,0.7696995463229692,0.0005131240475612076,95.04076487223307,COMPLETE
762,0.2794755697250366,2023-09-04 22:10:09.771959,2023-09-04 22:10:11.524729,0 days 00:00:01.752770,Tanh,Sigmoid,Tanh,,92,24,19.0,23.0,,0.0348252524571484,3,251,0.7183292160256741,1.855981990377873e-05,111.3832338677078,COMPLETE
763,0.3742294907569885,2023-09-04 22:10:11.525495,2023-09-04 22:10:11.913064,0 days 00:00:00.387569,Leaky,ReLU,,,71,20,15.0,,,0.008107844722392059,2,292,0.1410935956736696,0.000357396446453527,163.8044389236805,COMPLETE
764,0.4188878834247589,2023-09-04 22:10:11.913780,2023-09-04 22:10:13.120005,0 days 00:00:01.206225,ReLU,Tanh,ReLU,Leaky,37,20,18.0,8.0,14.0,0.0007360202683555882,4,259,0.256287405864379,0.00915305337110692,379.782122404679,COMPLETE
765,0.3144310414791107,2023-09-04 22:10:13.120746,2023-09-04 22:10:27.586423,0 days 00:00:14.465677,Tanh,ReLU,Tanh,,33,19,14.0,9.0,,0.00018103039465147545,3,229,0.7998110789647579,0.0021789246641429802,92.37176546988009,COMPLETE
766,0.3366674780845642,2023-09-04 22:10:27.587158,2023-09-04 22:10:30.342352,0 days 00:00:02.755194,ReLU,ReLU,Tanh,ReLU,43,23,16.0,24.0,8.0,0.0044520388130748515,4,212,0.753530371482169,2.6732674515832834e-05,99.01997193046238,COMPLETE
767,0.35487523674964905,2023-09-04 22:10:30.343180,2023-09-04 22:10:31.881675,0 days 00:00:01.538495,Sigmoid,Tanh,ReLU,,26,6,9.0,5.0,,0.020490975659073395,3,196,0.4842669740911491,3.361105888259007e-05,115.83204854329428,COMPLETE
768,0.4907454550266266,2023-09-04 22:10:31.882444,2023-09-04 22:10:40.025837,0 days 00:00:08.143393,Tanh,ReLU,Tanh,,63,22,17.0,4.0,,1.7983919721322498e-05,3,246,0.670036871204858,1.4986079962821719e-05,95.69695471166595,COMPLETE
769,1.0304526090621948,2023-09-04 22:10:40.026572,2023-09-04 22:10:40.516325,0 days 00:00:00.489753,Leaky,Tanh,ReLU,Sigmoid,82,21,12.0,10.0,20.0,0.013176274533308116,4,276,0.5646766067533561,0.030973402658708564,112.77221973125751,COMPLETE
770,0.3975735902786255,2023-09-04 22:10:40.517165,2023-09-04 22:10:41.884164,0 days 00:00:01.366999,ReLU,ReLU,Tanh,,28,23,11.0,16.0,,0.005838150749834518,3,236,0.7195729543045867,0.09504405968463583,111.51733037045128,COMPLETE
771,0.390136182308197,2023-09-04 22:10:41.884879,2023-09-04 22:10:42.279603,0 days 00:00:00.394724,Tanh,ReLU,Tanh,,88,18,15.0,8.0,,0.026714128419183594,3,309,0.17705141965264207,0.00011589707820635492,128.9156459461559,COMPLETE
772,0.31583350896835327,2023-09-04 22:10:42.280309,2023-09-04 22:10:45.811402,0 days 00:00:03.531093,ReLU,Tanh,ReLU,Tanh,39,24,10.0,15.0,10.0,0.009035192487988217,4,258,0.6039603189863628,2.0372905482061107e-05,88.36510306344906,COMPLETE
773,0.2585732638835907,2023-09-04 22:10:45.812167,2023-09-04 22:10:48.126944,0 days 00:00:02.314777,Tanh,ReLU,Sigmoid,,21,22,13.0,6.0,,0.015755013616135956,3,265,0.7997399537782407,5.9745559390317174e-05,100.34580485026042,COMPLETE
774,0.3464019000530243,2023-09-04 22:10:48.127679,2023-09-04 22:10:48.598546,0 days 00:00:00.470867,Tanh,ReLU,Sigmoid,,25,21,18.0,6.0,,0.015233834337593129,3,272,0.11430759182474014,5.904177443582765e-05,124.82959393092564,COMPLETE
775,0.3307569921016693,2023-09-04 22:10:48.599256,2023-09-04 22:10:50.134762,0 days 00:00:01.535506,Tanh,ReLU,Sigmoid,,20,11,19.0,6.0,,0.006973167304036196,3,283,0.26868061728191295,4.835132125767897e-05,106.07268382227699,COMPLETE
776,0.37616169452667236,2023-09-04 22:10:50.135471,2023-09-04 22:10:52.873851,0 days 00:00:02.738380,Tanh,ReLU,Sigmoid,Leaky,20,20,14.0,7.0,13.0,0.02266325325410716,4,266,0.771217830760399,5.6980076426947555e-05,109.4718755086263,COMPLETE
777,0.2910357713699341,2023-09-04 22:10:52.874585,2023-09-04 22:10:57.463608,0 days 00:00:04.589023,Tanh,ReLU,Sigmoid,,17,24,17.0,5.0,,0.003131114661201509,3,273,0.7727713350156356,4.734019977768517e-05,89.62178130376907,COMPLETE
778,0.3856104910373688,2023-09-04 22:10:57.464362,2023-09-04 22:11:03.230195,0 days 00:00:05.765833,Tanh,ReLU,Sigmoid,,18,23,13.0,6.0,,0.0011454424216473466,3,288,0.7974710057923858,0.013838691240021683,96.79797956678603,COMPLETE
779,0.4027962386608124,2023-09-04 22:11:03.230912,2023-09-04 22:11:03.935879,0 days 00:00:00.704967,Tanh,ReLU,Sigmoid,ReLU,20,21,16.0,7.0,11.0,0.005078432080257102,4,264,0.11065493076192735,3.6619769758479244e-05,413.3280226763557,COMPLETE
780,1.0296080112457275,2023-09-04 22:11:03.936610,2023-09-04 22:11:07.497552,0 days 00:00:03.560942,Tanh,ReLU,Sigmoid,,22,22,7.0,6.0,,2.3891700844397178e-05,3,147,0.20681339840514762,0.005958870430847885,217.5540397799745,COMPLETE
781,0.3471340835094452,2023-09-04 22:11:07.498285,2023-09-04 22:11:10.047002,0 days 00:00:02.548717,Tanh,ReLU,Leaky,,23,23,8.0,5.0,,0.03350611197469889,3,278,0.7445363474502614,0.0026530575936614693,102.53912599625126,COMPLETE
782,0.37444645166397095,2023-09-04 22:11:10.047708,2023-09-04 22:11:11.425986,0 days 00:00:01.378278,Tanh,ReLU,Sigmoid,,22,20,15.0,6.0,,0.0038754169369666185,3,258,0.32386563583018424,3.870178537606136e-05,137.21900491153494,COMPLETE
783,0.37414926290512085,2023-09-04 22:11:11.426721,2023-09-04 22:11:12.358230,0 days 00:00:00.931509,Tanh,ReLU,Sigmoid,Tanh,19,22,18.0,7.0,9.0,0.018135725349143955,4,267,0.19940998383701708,3.131516477647835e-05,151.73495072584885,COMPLETE
784,0.4563891589641571,2023-09-04 22:11:12.359027,2023-09-04 22:11:14.677236,0 days 00:00:02.318209,Tanh,ReLU,Sigmoid,,15,19,14.0,5.0,,0.00045972278146486463,3,255,0.16453533216154018,7.506758065607015e-05,480.1049722454505,COMPLETE
785,0.367643803358078,2023-09-04 22:11:14.677732,2023-09-04 22:11:15.382221,0 days 00:00:00.704489,Tanh,ReLU,Sigmoid,ReLU,21,23,16.0,7.0,8.0,0.044344037341894973,4,264,0.33930580003372124,4.1572156247469865e-05,204.57440426475122,COMPLETE
786,0.325538694858551,2023-09-04 22:11:15.382683,2023-09-04 22:11:17.617384,0 days 00:00:02.234701,Tanh,ReLU,Sigmoid,,23,21,13.0,17.0,,0.011391524833664683,3,251,0.6991558331798475,0.0008936792324595003,102.91374254226685,COMPLETE
787,0.34438082575798035,2023-09-04 22:11:17.618096,2023-09-04 22:11:22.809398,0 days 00:00:05.191302,Tanh,ReLU,ReLU,,31,13,20.0,6.0,,0.0009378077619387517,3,280,0.5074197359112319,6.579119465046437e-05,107.78497143068175,COMPLETE
788,0.37510985136032104,2023-09-04 22:11:22.810142,2023-09-04 22:11:31.114102,0 days 00:00:08.303960,Leaky,ReLU,,,28,12,11.0,,,0.0002185861136618671,2,157,0.7994261540836085,0.0012818359927926919,113.0612644268449,COMPLETE
789,0.44895949959754944,2023-09-04 22:11:31.114542,2023-09-04 22:11:40.331179,0 days 00:00:09.216637,Tanh,Leaky,Sigmoid,Leaky,25,24,17.0,22.0,4.0,2.9912074741747728e-05,4,297,0.7367751481387915,0.001597832985648561,115.28088941477766,COMPLETE
790,0.3075372576713562,2023-09-04 22:11:40.331587,2023-09-04 22:11:42.171642,0 days 00:00:01.840055,Tanh,ReLU,ReLU,,24,22,10.0,6.0,,0.00611298369161783,3,259,0.6383845234653278,9.99199802005191e-05,97.21619900790128,COMPLETE
791,0.3397655487060547,2023-09-04 22:11:42.172345,2023-09-04 22:11:47.189419,0 days 00:00:05.017074,Leaky,ReLU,ReLU,,41,18,19.0,14.0,,0.000296888387098384,3,272,0.7681141979605619,0.0005879200778470538,100.75638066167417,COMPLETE
792,0.3165357708930969,2023-09-04 22:11:47.189826,2023-09-04 22:11:48.405460,0 days 00:00:01.215634,Tanh,ReLU,ReLU,Tanh,33,20,18.0,16.0,6.0,0.002543636677503002,4,133,0.6943928768698059,2.567533692114225e-05,122.34410125134038,COMPLETE
793,0.5113705992698669,2023-09-04 22:11:48.405888,2023-09-04 22:11:48.771943,0 days 00:00:00.366055,Tanh,ReLU,Sigmoid,,21,24,14.0,5.0,,0.061480408035881076,3,249,0.22720512280763988,4.6815339732881826e-05,136.75338293004918,COMPLETE
794,0.31501054763793945,2023-09-04 22:11:48.772552,2023-09-04 22:11:49.625181,0 days 00:00:00.852629,Leaky,Sigmoid,ReLU,,30,19,9.0,7.0,,0.025775180608745084,3,264,0.7276733355360091,3.297167767345827e-05,148.27112854851617,COMPLETE
795,0.27997246384620667,2023-09-04 22:11:49.625588,2023-09-04 22:11:51.351974,0 days 00:00:01.726386,Tanh,ReLU,Leaky,ReLU,18,22,8.0,15.0,10.0,0.00960215605797504,4,247,0.7627729917868609,2.409839093042913e-05,82.21636399768647,COMPLETE
796,0.40349727869033813,2023-09-04 22:11:51.352402,2023-09-04 22:11:52.217696,0 days 00:00:00.865294,Tanh,ReLU,ReLU,,27,21,15.0,2.0,,0.0967011071712453,3,256,0.6628633751410935,0.0004212024924883801,138.63663141350997,COMPLETE
797,0.5008854866027832,2023-09-04 22:11:52.218103,2023-09-04 22:11:52.402447,0 days 00:00:00.184344,Sigmoid,ReLU,ReLU,,94,24,12.0,16.0,,0.013632693740357082,3,285,0.12234657796949894,0.0007331535839564884,135.4674213597032,COMPLETE
798,0.2570054233074188,2023-09-04 22:11:52.402839,2023-09-04 22:11:54.760747,0 days 00:00:02.357908,Tanh,ReLU,Sigmoid,Leaky,24,23,13.0,17.0,7.0,0.007534011527325688,4,242,0.7991444058184742,2.8288702009410988e-05,87.80194854736328,COMPLETE
799,0.351962149143219,2023-09-04 22:11:54.761186,2023-09-04 22:11:55.631718,0 days 00:00:00.870532,Tanh,ReLU,Sigmoid,,24,23,12.0,18.0,,0.00845334362451333,3,239,0.288766390677372,0.001990466758517027,103.74616453382704,COMPLETE
800,0.32391420006752014,2023-09-04 22:11:55.632437,2023-09-04 22:11:56.547801,0 days 00:00:00.915364,Tanh,ReLU,Sigmoid,Leaky,21,23,13.0,17.0,5.0,0.007518292140975139,4,243,0.798874168105216,0.0029635509164911158,101.56276304825492,COMPLETE
801,0.3262954354286194,2023-09-04 22:11:56.548197,2023-09-04 22:11:57.256847,0 days 00:00:00.708650,Tanh,ReLU,Sigmoid,,24,24,12.0,18.0,,0.007068971710646019,3,243,0.7706545638789176,3.240443791152037e-05,90.16014417012532,COMPLETE
802,0.3516349196434021,2023-09-04 22:11:57.257226,2023-09-04 22:11:58.935384,0 days 00:00:01.678158,Tanh,ReLU,Sigmoid,,23,23,13.0,18.0,,0.010914536367861416,3,238,0.7978872230264789,0.005194524712044285,103.66282135585568,COMPLETE
803,0.3043103814125061,2023-09-04 22:11:58.935799,2023-09-04 22:11:59.784754,0 days 00:00:00.848955,Tanh,ReLU,Sigmoid,Sigmoid,27,23,13.0,5.0,7.0,0.009904241413523423,4,121,0.7551555589723881,2.749832042770007e-05,103.14245184536638,COMPLETE
804,0.28365910053253174,2023-09-04 22:11:59.785175,2023-09-04 22:12:01.192729,0 days 00:00:01.407554,Tanh,ReLU,Sigmoid,,22,24,11.0,7.0,,0.006490807687888741,3,250,0.7681439328424619,2.283005792851336e-05,91.72204465282206,COMPLETE
805,0.37775179743766785,2023-09-04 22:12:01.193144,2023-09-04 22:12:04.409809,0 days 00:00:03.216665,Tanh,ReLU,Sigmoid,,26,2,12.0,17.0,,0.008040831050724732,3,251,0.7988230878883069,0.002280642837731945,107.65812476021902,COMPLETE
806,0.611253023147583,2023-09-04 22:12:04.410532,2023-09-04 22:12:08.107038,0 days 00:00:03.696506,Tanh,ReLU,Sigmoid,ReLU,20,23,18.0,17.0,2.0,0.00011310432402424252,4,236,0.10029869481779004,3.7861574373722374e-05,111.08336752552097,COMPLETE
807,0.37101292610168457,2023-09-04 22:12:08.107806,2023-09-04 22:12:19.333686,0 days 00:00:11.225880,Tanh,ReLU,Sigmoid,,25,24,17.0,23.0,,0.0007227357094367675,3,244,0.454381192263942,0.004161497363728805,162.20525013032506,COMPLETE
808,0.45345234870910645,2023-09-04 22:12:19.334430,2023-09-04 22:12:19.758512,0 days 00:00:00.424082,Tanh,ReLU,Sigmoid,,29,23,19.0,24.0,,0.01818807260694633,3,257,0.10557247128803715,2.837800506188325e-05,2533.187050955636,COMPLETE
809,0.3425995707511902,2023-09-04 22:12:19.759266,2023-09-04 22:12:22.999280,0 days 00:00:03.240014,Tanh,ReLU,Sigmoid,Tanh,26,22,13.0,6.0,6.0,0.03623636024465752,4,167,0.7433024045958974,0.0028212799507667838,110.80138830236487,COMPLETE
810,0.4815238416194916,2023-09-04 22:12:23.000065,2023-09-04 22:12:33.978246,0 days 00:00:10.978181,Tanh,,,,23,23,,,,3.430500819521999e-05,1,230,0.7180319185025533,0.0018200835093318663,111.24477651844855,COMPLETE
811,0.4161342978477478,2023-09-04 22:12:33.978976,2023-09-04 22:12:34.944302,0 days 00:00:00.965326,Tanh,ReLU,Sigmoid,,28,24,10.0,8.0,,0.012857082845964778,3,244,0.1430250545171809,5.068115606842955e-05,122.25080345416892,COMPLETE
812,0.3794700503349304,2023-09-04 22:12:34.945068,2023-09-04 22:12:38.898640,0 days 00:00:03.953572,Tanh,ReLU,Sigmoid,,55,22,11.0,8.0,,0.0054766241631691625,3,153,0.7728807349761028,0.007446447798849886,670.2469466359992,COMPLETE
813,0.365784615278244,2023-09-04 22:12:38.899406,2023-09-04 22:12:40.521444,0 days 00:00:01.622038,Tanh,ReLU,Tanh,Leaky,24,23,17.0,18.0,8.0,0.021848841942328504,4,140,0.7441864377078664,0.00821430203332641,145.91702938079834,COMPLETE
814,0.3352459669113159,2023-09-04 22:12:40.522362,2023-09-04 22:12:41.842416,0 days 00:00:01.320054,Tanh,ReLU,Tanh,,26,24,16.0,6.0,,0.029226871877596032,3,256,0.47500624755071974,2.1796424104118397e-05,102.3000390625,COMPLETE
815,0.36430731415748596,2023-09-04 22:12:41.843157,2023-09-04 22:12:42.508800,0 days 00:00:00.665643,Tanh,ReLU,Leaky,,31,23,12.0,23.0,,0.01527975978696844,3,250,0.18140596722995217,4.2640655801857004e-05,98.80447387695312,COMPLETE
816,0.3764757812023163,2023-09-04 22:12:42.509539,2023-09-04 22:12:51.972696,0 days 00:00:09.463157,Tanh,ReLU,Tanh,ReLU,28,22,18.0,17.0,9.0,3.480144278787363e-05,4,236,0.3571585852074715,0.0013490155636713733,224.21816534915212,COMPLETE
817,0.29518941044807434,2023-09-04 22:12:51.973565,2023-09-04 22:12:53.451214,0 days 00:00:01.477649,Tanh,ReLU,Sigmoid,,22,24,7.0,22.0,,0.008929367557291935,3,262,0.3590320861887712,8.456545260008294e-05,126.42023606733842,COMPLETE
818,0.3445934057235718,2023-09-04 22:12:53.451980,2023-09-04 22:12:54.083909,0 days 00:00:00.631929,Tanh,ReLU,Tanh,,25,19,19.0,6.0,,0.011698475877435407,3,178,0.1496535832046413,2.88040782025877e-05,137799.01342773438,COMPLETE
819,0.35074105858802795,2023-09-04 22:12:54.084642,2023-09-04 22:13:11.820064,0 days 00:00:17.735422,ReLU,Leaky,Tanh,Leaky,29,23,13.0,13.0,3.0,9.823862212007494e-05,4,227,0.7638529211848364,1.9051313408530517e-05,477.02823749827917,COMPLETE
820,0.4515555500984192,2023-09-04 22:13:11.820819,2023-09-04 22:13:36.156529,0 days 00:00:24.335710,Tanh,ReLU,Tanh,,19,22,16.0,7.0,,1.2502555547599912e-05,3,244,0.7993016956459468,3.573957288470233e-05,129.2456895484299,COMPLETE
821,0.3588108420372009,2023-09-04 22:13:36.157261,2023-09-04 22:13:37.077242,0 days 00:00:00.919981,ReLU,ReLU,Tanh,,27,22,9.0,12.0,,0.04458919815586375,3,258,0.4118290207083245,0.00391546391875137,190.64104537963868,COMPLETE
822,0.3943694829940796,2023-09-04 22:13:37.077985,2023-09-04 22:13:53.654170,0 days 00:00:16.576185,Tanh,ReLU,Sigmoid,Tanh,32,24,17.0,5.0,7.0,8.523451704983592e-05,4,251,0.699370957019423,2.36194169941304e-05,119.93423191389715,COMPLETE
823,0.32578805088996887,2023-09-04 22:13:53.654954,2023-09-04 22:13:56.539079,0 days 00:00:02.884125,ReLU,ReLU,Tanh,,94,18,18.0,4.0,,0.001722794036386542,3,235,0.7302209309360709,0.02222483201680332,96.8814911752377,COMPLETE
824,0.38710370659828186,2023-09-04 22:13:56.539817,2023-09-04 22:14:11.911418,0 days 00:00:15.371601,Tanh,ReLU,Tanh,,22,19,10.0,9.0,,9.852807244707795e-05,3,267,0.5217012463320922,0.00012031633263046944,139.05713484974837,COMPLETE
825,0.3304412364959717,2023-09-04 22:14:11.912179,2023-09-04 22:14:14.553137,0 days 00:00:02.640958,Tanh,Sigmoid,Leaky,ReLU,24,23,13.0,9.0,7.0,0.02973892220147484,4,243,0.5918686070460791,0.001093566363227071,100.4775153023856,COMPLETE
826,0.36949267983436584,2023-09-04 22:14:14.553881,2023-09-04 22:14:15.699048,0 days 00:00:01.145167,ReLU,ReLU,,,30,20,16.0,,,0.007361948284861003,2,228,0.37074738823567394,6.382960687429859e-05,189.02553329467773,COMPLETE
827,0.4753364026546478,2023-09-04 22:14:15.699766,2023-09-04 22:14:21.496805,0 days 00:00:05.797039,Tanh,ReLU,Tanh,,25,14,12.0,17.0,,3.6916197056119676e-05,3,251,0.22030542036786555,0.005156813256094527,120.07695025561816,COMPLETE
828,0.4218384921550751,2023-09-04 22:14:21.497534,2023-09-04 22:14:32.765534,0 days 00:00:11.268000,Sigmoid,ReLU,Sigmoid,,26,22,8.0,14.0,,0.0005692176228319478,3,263,0.4422780948794642,3.0560409047397515e-05,107.43399549709073,COMPLETE
829,0.6137096285820007,2023-09-04 22:14:32.766270,2023-09-04 22:14:40.589053,0 days 00:00:07.822783,ReLU,ReLU,Tanh,,34,24,11.0,8.0,,1.4123382478463686e-05,3,236,0.4249905567098481,1.684697533067579e-05,94.19785024351992,COMPLETE
830,0.39746108651161194,2023-09-04 22:14:40.589788,2023-09-04 22:14:41.187317,0 days 00:00:00.597529,Tanh,ReLU,Tanh,Leaky,29,20,18.0,7.0,6.0,0.01944113531147761,4,222,0.17351709531958515,2.0618111280804228e-05,119.44277763366699,COMPLETE
831,0.36449161171913147,2023-09-04 22:14:41.188164,2023-09-04 22:14:55.679061,0 days 00:00:14.490897,ReLU,ReLU,Tanh,,27,23,19.0,16.0,,5.770321895122457e-05,3,255,0.6137935758523995,5.474555976547472e-05,115.13370433134192,COMPLETE
832,0.415900319814682,2023-09-04 22:14:55.679826,2023-09-04 22:14:56.154379,0 days 00:00:00.474553,Tanh,ReLU,Tanh,,31,3,15.0,6.0,,0.0058781351103866985,3,243,0.13091012533622717,4.0541512614498846e-05,142.47818728855677,COMPLETE
833,0.4606163799762726,2023-09-04 22:14:56.155107,2023-09-04 22:14:56.506761,0 days 00:00:00.351654,ReLU,ReLU,Sigmoid,Tanh,78,21,9.0,7.0,8.0,0.025117856009661096,4,269,0.10611411901223203,0.00598408983756148,121.45379526474896,COMPLETE
834,0.31790706515312195,2023-09-04 22:14:56.507518,2023-09-04 22:15:09.221306,0 days 00:00:12.713788,Tanh,ReLU,Tanh,,17,22,14.0,6.0,,0.00023291706724105343,3,162,0.5641126537483966,2.6217363768178686e-05,107.87624505125446,COMPLETE
835,0.7337292432785034,2023-09-04 22:15:09.222075,2023-09-04 22:15:10.644487,0 days 00:00:01.422412,ReLU,ReLU,Leaky,Sigmoid,20,15,20.0,17.0,5.0,0.07666116882416273,4,250,0.7506650962574942,3.3790763499174365e-05,119.34908572110263,COMPLETE
836,0.3673352301120758,2023-09-04 22:15:10.645320,2023-09-04 22:15:11.702663,0 days 00:00:01.057343,Tanh,ReLU,Tanh,,23,24,12.0,15.0,,0.009773627221023564,3,233,0.3909044036936083,0.009982932918384316,113.45330290360884,COMPLETE
837,0.3786257803440094,2023-09-04 22:15:11.703468,2023-09-04 22:15:12.253883,0 days 00:00:00.550415,ReLU,Leaky,Tanh,,95,17,17.0,18.0,,0.03833669808790253,3,256,0.3111135447779971,1.753345559278492e-05,111.71459036162405,COMPLETE
838,0.33140984177589417,2023-09-04 22:15:12.254631,2023-09-04 22:15:14.739806,0 days 00:00:02.485175,Tanh,ReLU,Sigmoid,ReLU,27,12,6.0,23.0,10.0,0.0046598646560908116,4,244,0.7732557988733776,0.0016491708581151052,121.06109591892788,COMPLETE
839,0.3745828866958618,2023-09-04 22:15:14.740629,2023-09-04 22:15:25.801863,0 days 00:00:11.061234,ReLU,ReLU,Tanh,,32,20,10.0,21.0,,0.0002573925417135302,3,264,0.6797534988260705,4.463460043873421e-05,118.50702935398215,COMPLETE
840,0.4351103901863098,2023-09-04 22:15:25.802619,2023-09-04 22:15:33.961046,0 days 00:00:08.158427,Tanh,ReLU,ReLU,,47,19,21.0,5.0,,4.684104691381573e-05,3,172,0.7994161973522361,2.5315032331130758e-05,132.67163258929585,COMPLETE
