number,value,datetime_start,datetime_complete,duration,params_activation1,params_activation2,params_activation3,params_activation4,params_batch_size,params_fl1,params_fl2,params_fl3,params_fl4,params_learning_rate,params_n_layers,params_num_epochs,params_train_size,params_weight_decay,user_attrs_mre,state
1050,0.4146076440811157,2023-09-04 21:37:42.871424,2023-09-04 21:37:43.068480,0 days 00:00:00.197056,Leaky,ReLU,,,100,23,20.0,,,0.0939625128714354,2,160,0.16057712639096555,0.009191847185516291,130.0297132219587,COMPLETE
1051,0.5427370667457581,2023-09-04 21:37:43.068918,2023-09-04 21:37:51.583785,0 days 00:00:08.514867,Leaky,Sigmoid,,,25,24,24.0,,,1.6036997790415253e-05,2,403,0.7992285499908914,2.949143738675641e-05,135.45196357140173,COMPLETE
1052,0.2879794239997864,2023-09-04 21:37:51.584202,2023-09-04 21:37:52.688308,0 days 00:00:01.104106,Leaky,Tanh,,,39,20,22.0,,,0.011393153480240172,2,491,0.7441188026743542,1.6732900375441845e-05,308.2773684148919,COMPLETE
1053,0.46773889660835266,2023-09-04 21:37:52.688740,2023-09-04 21:37:53.035248,0 days 00:00:00.346508,Leaky,Tanh,Tanh,,38,20,21.0,16.0,,0.011041033525482021,3,473,0.2340622843885388,1.1842832521961853e-05,242.8867455376519,COMPLETE
1054,0.3309003412723541,2023-09-04 21:37:53.035681,2023-09-04 21:37:53.816997,0 days 00:00:00.781316,Tanh,,,,39,20,,,,0.012662435924830046,1,466,0.7461293475248081,1.4195254113383505e-05,189.61964440345764,COMPLETE
1055,0.37253138422966003,2023-09-04 21:37:53.817412,2023-09-04 21:37:54.525688,0 days 00:00:00.708276,Leaky,Tanh,,,38,20,22.0,,,0.014610801024189908,2,488,0.771596148581768,0.004766455819149939,207.13868748864462,COMPLETE
1056,0.4773387014865875,2023-09-04 21:37:54.526079,2023-09-04 21:38:00.565428,0 days 00:00:06.039349,Leaky,Tanh,,,40,19,22.0,,,7.648786098033338e-05,2,412,0.7294092004946856,5.175664804903207e-05,155.64471383696622,COMPLETE
1057,0.7530872821807861,2023-09-04 21:38:00.566191,2023-09-04 21:38:11.125744,0 days 00:00:10.559553,Leaky,Tanh,ReLU,ReLU,39,4,22.0,19.0,12.0,1.0384183695650756e-05,4,429,0.751077347630349,1.7854365113128406e-05,116.96381266133768,COMPLETE
1058,0.392269104719162,2023-09-04 21:38:11.126199,2023-09-04 21:38:11.486328,0 days 00:00:00.360129,Leaky,Tanh,,,42,21,23.0,,,0.011028854622289596,2,422,0.2620406133328077,0.00021099714312872706,143.9023126775568,COMPLETE
1059,0.3148151636123657,2023-09-04 21:38:11.486728,2023-09-04 21:38:12.214294,0 days 00:00:00.727566,Leaky,Tanh,,,37,21,22.0,,,0.012533698379731647,2,390,0.7986199701746789,0.00010475317333603069,128.7130151143888,COMPLETE
1060,0.3623233735561371,2023-09-04 21:38:12.214986,2023-09-04 21:38:13.828299,0 days 00:00:01.613313,Tanh,Tanh,,,40,20,23.0,,,0.00929000415944425,2,475,0.6974012199098413,1.1576357291279944e-05,134.6403465270996,COMPLETE
1061,0.35027074813842773,2023-09-04 21:38:13.828749,2023-09-04 21:38:14.395531,0 days 00:00:00.566782,Leaky,Tanh,,,35,20,22.0,,,0.017174299463143822,2,485,0.5593539926356864,0.0003548312999233316,136.6335843108421,COMPLETE
1062,0.43757784366607666,2023-09-04 21:38:14.395969,2023-09-04 21:38:22.292065,0 days 00:00:07.896096,Leaky,Tanh,,,41,21,22.0,,,0.00013261956568155658,2,488,0.4030642740970236,1.5897864164952433e-05,162.18138152263202,COMPLETE
1063,0.3510502576828003,2023-09-04 21:38:22.292462,2023-09-04 21:38:22.915678,0 days 00:00:00.623216,ReLU,Tanh,,,34,24,21.0,,,0.02353175397421369,2,489,0.6665244054900519,0.0008275977836855763,156.04364131047174,COMPLETE
1064,0.3555203676223755,2023-09-04 21:38:22.916099,2023-09-04 21:38:23.362661,0 days 00:00:00.446562,Leaky,Tanh,,,38,21,22.0,,,0.014957363312938511,2,467,0.49840908173196113,8.666576052871715e-05,138.5195924859298,COMPLETE
1065,0.33306729793548584,2023-09-04 21:38:23.363084,2023-09-04 21:38:23.864028,0 days 00:00:00.500944,Leaky,Tanh,Leaky,Sigmoid,97,24,23.0,17.0,13.0,0.009800657430817237,4,437,0.7245439191834311,0.00015469822192534406,125.67590462289205,COMPLETE
1066,0.38238751888275146,2023-09-04 21:38:23.864569,2023-09-04 21:38:24.305563,0 days 00:00:00.440994,Leaky,Tanh,,,32,24,23.0,,,0.012762115861483257,2,456,0.30808236027935826,0.002487235496035849,228.19757608266977,COMPLETE
1067,0.3644430935382843,2023-09-04 21:38:24.305994,2023-09-04 21:38:24.925127,0 days 00:00:00.619133,Leaky,Tanh,,,41,24,21.0,,,0.021284057890954215,2,480,0.7710474347202474,1.0086965788412756e-05,132.3547819088667,COMPLETE
1068,0.3736608624458313,2023-09-04 21:38:24.925542,2023-09-04 21:38:25.828980,0 days 00:00:00.903438,Tanh,Tanh,,,37,19,21.0,,,0.010950214317133285,2,487,0.7486327568188287,0.00137250407689674,148.61844059458952,COMPLETE
1069,0.39687493443489075,2023-09-04 21:38:25.829393,2023-09-04 21:38:33.203214,0 days 00:00:07.373821,Leaky,Tanh,,,41,21,22.0,,,0.0001055822121548783,2,500,0.7995026571852143,0.00028425527340057564,143.95330125427247,COMPLETE
1070,0.36273831129074097,2023-09-04 21:38:33.203675,2023-09-04 21:38:33.879663,0 days 00:00:00.675988,Sigmoid,Tanh,,,43,23,22.0,,,0.015537033750297202,2,477,0.37482049768393677,3.932878063728943e-05,146.27017983829273,COMPLETE
1071,0.5534219741821289,2023-09-04 21:38:33.880084,2023-09-04 21:38:34.262607,0 days 00:00:00.382523,Leaky,Tanh,,,29,24,21.0,,,0.04206999518490502,2,370,0.380049640414062,0.013162292895343639,181.33085107803345,COMPLETE
1072,0.31532713770866394,2023-09-04 21:38:34.263075,2023-09-04 21:38:34.703601,0 days 00:00:00.440526,Leaky,ReLU,,,91,21,24.0,,,0.032429897917364114,2,498,0.694284560815807,1.3423277978954432e-05,172.7606493361453,COMPLETE
1073,0.3537953794002533,2023-09-04 21:38:34.704160,2023-09-04 21:38:35.241764,0 days 00:00:00.537604,Leaky,Tanh,Tanh,,95,20,23.0,5.0,,0.008137650341430385,3,493,0.48591507133132855,0.00018917606818042717,174.3289770943778,COMPLETE
1074,0.5193758010864258,2023-09-04 21:38:35.242269,2023-09-04 21:38:35.522042,0 days 00:00:00.279773,Leaky,Leaky,,,77,23,20.0,,,0.019241241696182385,2,269,0.7230189617475623,0.03623580502337247,1059.7906056279721,COMPLETE
1075,0.5427188277244568,2023-09-04 21:38:35.522516,2023-09-04 21:38:37.754880,0 days 00:00:02.232364,Tanh,Tanh,ReLU,Tanh,39,22,21.0,18.0,5.0,0.0001510773663998668,4,427,0.19802019121474068,0.00012607794765472197,153.30950262694233,COMPLETE
1076,0.5637704730033875,2023-09-04 21:38:37.755341,2023-09-04 21:38:37.952961,0 days 00:00:00.197620,Leaky,ReLU,,,85,23,20.0,,,0.013249258192638672,2,290,0.18352055687260185,0.045536417695915134,168.93480256887582,COMPLETE
1077,0.4595554769039154,2023-09-04 21:38:37.953364,2023-09-04 21:38:38.130394,0 days 00:00:00.177030,ReLU,Tanh,,,98,24,22.0,,,0.009600324636201503,2,185,0.12524239486928296,1.875378892198854e-05,262.9061265211839,COMPLETE
1078,0.3892558217048645,2023-09-04 21:38:38.130814,2023-09-04 21:38:41.095934,0 days 00:00:02.965120,Leaky,ReLU,,,93,22,21.0,,,0.00021342329226067182,2,407,0.6505400727925074,0.0004515304397934233,142.76746040362983,COMPLETE
1079,0.46689820289611816,2023-09-04 21:38:41.096341,2023-09-04 21:38:41.346477,0 days 00:00:00.250136,Leaky,Tanh,,,44,23,23.0,,,0.026353111035029846,2,492,0.23182029265810353,2.5667157425450178e-05,200.29408493041993,COMPLETE
1080,0.3238779902458191,2023-09-04 21:38:41.346924,2023-09-04 21:38:41.951438,0 days 00:00:00.604514,Leaky,ReLU,,,75,24,20.0,,,0.016788887261316766,2,398,0.7647686233862072,0.001153217126279541,180.8896537914611,COMPLETE
1081,0.4322751462459564,2023-09-04 21:38:41.951867,2023-09-04 21:38:42.280403,0 days 00:00:00.328536,Leaky,Tanh,,,42,22,22.0,,,0.07010213524322396,2,376,0.5347979803498233,0.0005775942604141968,502.13088346782484,COMPLETE
1082,0.3574189841747284,2023-09-04 21:38:42.280815,2023-09-04 21:38:43.026276,0 days 00:00:00.745461,Tanh,ReLU,,,36,23,13.0,,,0.011878710376796792,2,178,0.682260306988841,0.00010801177735664687,148.17039396324935,COMPLETE
1083,0.5092915892601013,2023-09-04 21:38:43.026704,2023-09-04 21:38:43.376792,0 days 00:00:00.350088,Leaky,Tanh,Tanh,Sigmoid,23,24,20.0,9.0,16.0,0.007692654794546538,4,417,0.10735151331651113,1.352980648422415e-05,262.23412557748645,COMPLETE
1084,0.5004863142967224,2023-09-04 21:38:43.377230,2023-09-04 21:38:47.963653,0 days 00:00:04.586423,Leaky,ReLU,,,39,23,21.0,,,6.201236241212408e-05,2,479,0.44093713941515794,6.628054587196271e-05,160.84975395122999,COMPLETE
1085,0.35485026240348816,2023-09-04 21:38:47.964082,2023-09-04 21:38:51.344801,0 days 00:00:03.380719,Leaky,Tanh,,,11,21,15.0,,,0.0030616747703255203,2,499,0.7421756723478926,0.00022579919935112127,145.49134826660156,COMPLETE
1086,0.5599455237388611,2023-09-04 21:38:51.345217,2023-09-04 21:38:53.635872,0 days 00:00:02.290655,Leaky,Tanh,,,81,22,12.0,,,3.09579303017355e-05,2,446,0.39719686408517607,0.00032754977632055613,165.14074166473253,COMPLETE
1087,0.3327151834964752,2023-09-04 21:38:53.636313,2023-09-04 21:38:54.068616,0 days 00:00:00.432303,Leaky,ReLU,,,88,24,16.0,,,0.014329456620195219,2,199,0.7079959738021169,2.1395252526672893e-05,123.00571146878329,COMPLETE
1088,0.3795280158519745,2023-09-04 21:38:54.069022,2023-09-04 21:38:54.977803,0 days 00:00:00.908781,Tanh,Tanh,,,70,23,24.0,,,0.010011224620812036,2,309,0.7698629923604526,0.0021827640524005724,344.72188967750185,COMPLETE
1089,0.327115923166275,2023-09-04 21:38:54.978196,2023-09-04 21:38:55.353789,0 days 00:00:00.375593,Leaky,Leaky,,,78,24,23.0,,,0.019565167112987943,2,354,0.5934872156368424,1.5463755866409503e-05,123.20181832662443,COMPLETE
1090,0.36915549635887146,2023-09-04 21:38:55.354182,2023-09-04 21:38:55.819914,0 days 00:00:00.465732,ReLU,ReLU,ReLU,Sigmoid,98,22,22.0,11.0,8.0,0.006817789099701935,4,93,0.3925144909806611,0.00014535799468080342,183.44196793527314,COMPLETE
1091,0.36712321639060974,2023-09-04 21:38:55.820326,2023-09-04 21:38:56.109948,0 days 00:00:00.289622,Leaky,Tanh,,,73,21,21.0,,,0.05232327295031665,2,297,0.2893155587713902,1.1831789208092941e-05,354.882707127985,COMPLETE
1092,1.0764278173446655,2023-09-04 21:38:56.110357,2023-09-04 21:38:56.622452,0 days 00:00:00.512095,Leaky,ReLU,Sigmoid,,96,23,20.0,14.0,,2.148892887711762e-05,3,226,0.1277269431235975,3.338307439508153e-05,109.58107916232758,COMPLETE
1093,0.38620391488075256,2023-09-04 21:38:56.622876,2023-09-04 21:38:56.972955,0 days 00:00:00.350079,Leaky,Tanh,,,43,24,19.0,,,0.03351206005524832,2,282,0.4712300895497545,1.6766859756738183e-05,156.78111365533644,COMPLETE
1094,0.7886579036712646,2023-09-04 21:38:56.973376,2023-09-04 21:39:02.974890,0 days 00:00:06.001514,Sigmoid,ReLU,,,40,20,14.0,,,1.2653715714707564e-05,2,384,0.7248795981000081,0.0006432474042910885,107.8140276869138,COMPLETE
1095,0.5528098344802856,2023-09-04 21:39:02.975317,2023-09-04 21:39:05.561054,0 days 00:00:02.585737,Leaky,Tanh,,,33,23,20.0,,,3.64411694463723e-05,2,180,0.6259171390753486,0.0002471183779810811,139.26600100199383,COMPLETE
1096,0.3211938738822937,2023-09-04 21:39:05.561545,2023-09-04 21:39:06.751003,0 days 00:00:01.189458,Tanh,Tanh,,,37,22,19.0,,,0.011630755361454527,2,74,0.7715473883127798,5.179467048300894e-05,137.1715158404726,COMPLETE
1097,0.32873690128326416,2023-09-04 21:39:06.751414,2023-09-04 21:39:07.237416,0 days 00:00:00.486002,Leaky,ReLU,,,100,24,21.0,,,0.008658642995852244,2,430,0.6802235538663659,0.00017088592822023395,221.17963551666776,COMPLETE
1098,0.3694497048854828,2023-09-04 21:39:07.237824,2023-09-04 21:39:07.755414,0 days 00:00:00.517590,Leaky,Tanh,,,83,23,16.0,,,0.015038945531811964,2,335,0.7350125665145076,7.780874588695536e-05,126.61625595092774,COMPLETE
1099,0.38186654448509216,2023-09-04 21:39:07.755853,2023-09-04 21:39:08.014292,0 days 00:00:00.258439,Leaky,ReLU,,,86,24,19.0,,,0.018514706627633555,2,169,0.2505927899270685,0.00038048816775643933,159.79937217975484,COMPLETE
1100,0.33263111114501953,2023-09-04 21:39:08.014716,2023-09-04 21:39:08.611960,0 days 00:00:00.597244,Leaky,Tanh,Tanh,Leaky,89,22,22.0,15.0,19.0,0.024941372620374675,4,455,0.6479006845725241,0.003622493036413887,955.3158833430364,COMPLETE
1101,0.3417600989341736,2023-09-04 21:39:08.612384,2023-09-04 21:39:09.062221,0 days 00:00:00.449837,Leaky,ReLU,,,74,21,20.0,,,0.012540449526636199,2,413,0.7688872933302477,2.64796276259561e-05,520.4828979492188,COMPLETE
1102,0.34182190895080566,2023-09-04 21:39:09.062636,2023-09-04 21:39:10.910848,0 days 00:00:01.848212,Leaky,Tanh,,,93,23,21.0,,,0.001410700279833149,2,440,0.5055038847571591,0.0009080025992341795,139.10446038647234,COMPLETE
1103,0.8771716952323914,2023-09-04 21:39:10.911250,2023-09-04 21:39:12.273040,0 days 00:00:01.361790,ReLU,Leaky,,,42,23,17.0,,,1.6973747019185166e-05,2,170,0.41552405315000834,9.704773059650993e-05,116.68170372458066,COMPLETE
1104,0.639066755771637,2023-09-04 21:39:12.273440,2023-09-04 21:39:12.504488,0 days 00:00:00.231048,Tanh,,,,45,24,,,,0.0020464305386309043,1,316,0.7063684892787391,0.07305645489277988,227.40429059196921,COMPLETE
1105,0.5290249586105347,2023-09-04 21:39:12.504894,2023-09-04 21:39:14.770675,0 days 00:00:02.265781,Leaky,ReLU,,,69,22,20.0,,,0.00029100685590320634,2,273,0.5722083929515767,0.022592962124633978,166.71998660468356,COMPLETE
1106,0.4933794438838959,2023-09-04 21:39:14.771089,2023-09-04 21:39:15.033154,0 days 00:00:00.262065,Leaky,Tanh,,,80,24,19.0,,,0.009782764427266236,2,194,0.11660004596784694,0.0004824083129204148,229.57799880981446,COMPLETE
1107,0.29994723200798035,2023-09-04 21:39:15.033580,2023-09-04 21:39:16.059770,0 days 00:00:01.026190,Leaky,Sigmoid,,,96,23,23.0,,,0.0076653119255646485,2,393,0.7992688785973157,1.1558120637757427e-05,124.48320722579956,COMPLETE
1108,0.32022157311439514,2023-09-04 21:39:16.060208,2023-09-04 21:39:17.482539,0 days 00:00:01.422331,Leaky,Sigmoid,,,96,22,24.0,,,0.007033453389189389,2,394,0.7977736408156316,1.14477408615966e-05,111.74076944027307,COMPLETE
1109,0.4147146940231323,2023-09-04 21:39:17.482964,2023-09-04 21:39:17.853332,0 days 00:00:00.370368,Leaky,Sigmoid,,,96,21,23.0,,,0.007131949981771748,2,400,0.1570801005035356,1.0138372043231485e-05,152.18922724405925,COMPLETE
1110,0.5073707699775696,2023-09-04 21:39:17.853763,2023-09-04 21:39:18.120547,0 days 00:00:00.266784,Leaky,Sigmoid,ReLU,ReLU,97,22,24.0,21.0,15.0,0.005786036680713069,4,380,0.1013635232252621,1.172664322327436e-05,241.2285216071389,COMPLETE
1111,0.3332999050617218,2023-09-04 21:39:18.121018,2023-09-04 21:39:19.356199,0 days 00:00:01.235181,Tanh,Sigmoid,,,95,23,23.0,,,0.008046669186739894,2,400,0.774808590005986,1.4267377957210633e-05,150.47142421023946,COMPLETE
1112,0.3290932774543762,2023-09-04 21:39:19.356621,2023-09-04 21:39:20.319614,0 days 00:00:00.962993,Leaky,Sigmoid,,,94,22,24.0,,,0.004897357087577154,2,386,0.7750249638352346,1.3050902267535485e-05,422.08518281989143,COMPLETE
1113,0.38664621114730835,2023-09-04 21:39:20.320086,2023-09-04 21:39:20.883635,0 days 00:00:00.563549,Leaky,Sigmoid,,,99,23,23.0,,,0.0063088031247086635,2,411,0.7990637961703806,1.2003454920229007e-05,136.16920600503178,COMPLETE
1114,0.3372247517108917,2023-09-04 21:39:20.884079,2023-09-04 21:39:21.814131,0 days 00:00:00.930052,Leaky,Sigmoid,,,94,22,23.0,,,0.008410800824753036,2,387,0.7996852027080832,1.0080677774490476e-05,416.0712491781405,COMPLETE
1115,0.3486616909503937,2023-09-04 21:39:21.814560,2023-09-04 21:39:22.639265,0 days 00:00:00.824705,Leaky,Sigmoid,,,97,23,23.0,,,0.008674578136904185,2,371,0.7459197841600931,1.5884682157042e-05,138.61039853096008,COMPLETE
1116,0.3670516014099121,2023-09-04 21:39:22.639782,2023-09-04 21:39:25.611475,0 days 00:00:02.971693,Leaky,Sigmoid,,,98,21,23.0,,,0.00042110077055016804,2,375,0.7491678876913396,1.3252172167370666e-05,584.5479380289713,COMPLETE
1117,0.3579969108104706,2023-09-04 21:39:25.611911,2023-09-04 21:39:27.866999,0 days 00:00:02.255088,ReLU,Sigmoid,Leaky,Sigmoid,98,22,22.0,10.0,21.0,0.0016998108823986005,4,400,0.7986560374354076,0.0001334212252542286,285.87239149140146,COMPLETE
1118,0.3512059152126312,2023-09-04 21:39:27.867450,2023-09-04 21:39:28.444685,0 days 00:00:00.577235,Tanh,Sigmoid,,,95,20,24.0,,,0.006969094062817673,2,60,0.7506144630435453,1.6113436189491752e-05,168.4497268676758,COMPLETE
1119,0.38652896881103516,2023-09-04 21:39:28.445077,2023-09-04 21:39:28.780056,0 days 00:00:00.334979,Leaky,Sigmoid,,,91,23,22.0,,,0.009992601247553131,2,385,0.193899145830627,0.0001919049413218441,220.5874524597728,COMPLETE
1120,0.5835306644439697,2023-09-04 21:39:28.780487,2023-09-04 21:39:29.430067,0 days 00:00:00.649580,Sigmoid,Sigmoid,Tanh,,96,23,23.0,12.0,,0.0005430925002938574,3,411,0.15210525915677792,1.1712714592943614e-05,143.5792462485177,COMPLETE
1121,0.3892631232738495,2023-09-04 21:39:29.430525,2023-09-04 21:39:30.026182,0 days 00:00:00.595657,Leaky,Sigmoid,,,92,22,22.0,,,0.006195778891381249,2,399,0.30384990660415717,1.8801838547198403e-05,180.3886109976933,COMPLETE
1122,0.4246180057525635,2023-09-04 21:39:30.026617,2023-09-04 21:39:31.354366,0 days 00:00:01.327749,Leaky,Sigmoid,,,100,23,22.0,,,0.0039171819880794625,2,384,0.765057230207374,0.005094378611741724,392.1382845878601,COMPLETE
1123,0.3670755922794342,2023-09-04 21:39:31.354795,2023-09-04 21:39:34.438395,0 days 00:00:03.083600,Leaky,Sigmoid,,,98,21,24.0,,,0.0008978852584505222,2,392,0.7306631532019514,1.0098943888993811e-05,134.84119740310982,COMPLETE
1124,0.3132740557193756,2023-09-04 21:39:34.438817,2023-09-04 21:39:34.809364,0 days 00:00:00.370547,Leaky,Sigmoid,,,94,22,23.0,,,0.038986646335841695,2,363,0.7992348763042039,0.00011645589426071151,166.4409927368164,COMPLETE
1125,0.40806904435157776,2023-09-04 21:39:34.809778,2023-09-04 21:39:35.211209,0 days 00:00:00.401431,Tanh,Sigmoid,,,96,23,24.0,,,0.0109309106237373,2,419,0.21450747298597111,0.0007622362834934539,148.65177970708802,COMPLETE
1126,0.9667767882347107,2023-09-04 21:39:35.211632,2023-09-04 21:39:35.338055,0 days 00:00:00.126423,Leaky,Sigmoid,ReLU,Tanh,98,23,23.0,13.0,15.0,0.008015294951774598,4,430,0.17451761013207873,0.015986377961495834,106.33157157897949,COMPLETE
1127,0.37850213050842285,2023-09-04 21:39:35.338500,2023-09-04 21:39:35.904989,0 days 00:00:00.566489,Leaky,Sigmoid,,,92,22,22.0,,,0.07638282953325581,2,469,0.5367105300219719,1.4402984787367247e-05,143.39744207594129,COMPLETE
1128,0.42682093381881714,2023-09-04 21:39:35.905738,2023-09-04 21:39:36.382256,0 days 00:00:00.476518,Leaky,Tanh,,,44,21,23.0,,,0.06375542866794284,2,390,0.6085595143687627,0.00026488199568773426,184.13513692220053,COMPLETE
1129,0.3042249083518982,2023-09-04 21:39:36.382670,2023-09-04 21:39:38.281780,0 days 00:00:01.899110,Leaky,Sigmoid,,,40,23,21.0,,,0.004975966168611491,2,409,0.7455423680497733,9.009899071462553e-05,147.23052251906623,COMPLETE
1130,0.33372077345848083,2023-09-04 21:39:38.282196,2023-09-04 21:39:38.828434,0 days 00:00:00.546238,ReLU,Tanh,,,99,22,22.0,,,0.009248103018958516,2,290,0.7133442005248122,0.0010649529824624266,164.37606722513834,COMPLETE
1131,0.5897242426872253,2023-09-04 21:39:38.828847,2023-09-04 21:39:38.981424,0 days 00:00:00.152577,Leaky,Sigmoid,,,95,23,20.0,,,0.028640020925804623,2,393,0.2263856669506887,0.027023576601139705,215.0890185546875,COMPLETE
1132,0.3170081079006195,2023-09-04 21:39:38.981842,2023-09-04 21:39:39.618044,0 days 00:00:00.636202,Leaky,Tanh,,,90,21,21.0,,,0.02232311081944407,2,399,0.76826171619249,0.0005435389119032091,169.75754070281982,COMPLETE
1133,0.42999985814094543,2023-09-04 21:39:39.618461,2023-09-04 21:39:40.811769,0 days 00:00:01.193308,Tanh,Sigmoid,,,35,23,20.0,,,0.0012878729865347714,2,346,0.14866043494010478,0.00039767162669922474,292.2343337420121,COMPLETE
1134,0.38750597834587097,2023-09-04 21:39:40.812295,2023-09-04 21:39:41.435050,0 days 00:00:00.622755,Leaky,Tanh,,,100,20,21.0,,,0.011696051444686948,2,377,0.7236942929093725,0.008468005295055883,155.36845005580358,COMPLETE
1135,0.5474311113357544,2023-09-04 21:39:41.435510,2023-09-04 21:39:41.795585,0 days 00:00:00.360075,Leaky,Sigmoid,Sigmoid,Sigmoid,38,22,8.0,6.0,17.0,0.007164599993190483,4,418,0.1386040089810479,5.897932963634625e-05,270.6215303861178,COMPLETE
1136,0.45623788237571716,2023-09-04 21:39:41.796041,2023-09-04 21:39:42.056200,0 days 00:00:00.260159,Leaky,Tanh,,,42,23,22.0,,,0.005776136706297348,2,305,0.13879699343411983,0.00016195425484053283,617.2733113606771,COMPLETE
1137,0.3328534662723541,2023-09-04 21:39:42.056620,2023-09-04 21:39:43.367166,0 days 00:00:01.310546,Leaky,Sigmoid,,,84,24,24.0,,,0.00267867788045845,2,438,0.769330369493058,0.0003022629573396479,158.4742222377232,COMPLETE
1138,0.3595687448978424,2023-09-04 21:39:43.367611,2023-09-04 21:39:45.566854,0 days 00:00:02.199243,Leaky,Tanh,,,93,15,14.0,,,0.00075648822207283,2,406,0.7498603573884772,1.0009587227299974e-05,136.99587208988103,COMPLETE
1139,0.5889197587966919,2023-09-04 21:39:45.567278,2023-09-04 21:39:46.009572,0 days 00:00:00.442294,Tanh,Sigmoid,Tanh,,87,22,16.0,24.0,,0.014016714957132387,3,448,0.3873026508861534,0.016995627526844484,947.6588660606972,COMPLETE
1140,0.36964020133018494,2023-09-04 21:39:46.010009,2023-09-04 21:39:46.703961,0 days 00:00:00.693952,Leaky,Tanh,,,16,24,23.0,,,0.010326982006609073,2,286,0.35251951960468125,1.2964660699117473e-05,429.18308772597203,COMPLETE
1141,0.3676989674568176,2023-09-04 21:39:46.704407,2023-09-04 21:39:47.521042,0 days 00:00:00.816635,Leaky,Sigmoid,,,40,23,15.0,,,0.016964484448149846,2,102,0.700879539706361,0.00022892757825666033,144.05537664240057,COMPLETE
1142,0.3399151861667633,2023-09-04 21:39:47.521478,2023-09-04 21:39:49.719373,0 days 00:00:02.197895,Sigmoid,Tanh,,,46,21,20.0,,,0.008381471582996949,2,296,0.7685528140279397,1.773914000153673e-05,122.88268280029297,COMPLETE
1143,0.9884605407714844,2023-09-04 21:39:49.720137,2023-09-04 21:39:53.333688,0 days 00:00:03.613551,Leaky,Sigmoid,,,96,23,21.0,,,1.0065773309360443e-05,2,393,0.5903150064231117,0.0017752094532232834,109.92564720173222,COMPLETE
1144,0.3019215166568756,2023-09-04 21:39:53.334113,2023-09-04 21:39:54.041491,0 days 00:00:00.707378,ReLU,Leaky,ReLU,Sigmoid,98,22,22.0,22.0,10.0,0.012740539270666077,4,424,0.7301170137650815,0.0006603375489156746,168.2035777607902,COMPLETE
