number,value,datetime_start,datetime_complete,duration,params_activation1,params_activation2,params_activation3,params_activation4,params_batch_size,params_fl1,params_fl2,params_fl3,params_fl4,params_learning_rate,params_n_layers,params_num_epochs,params_train_size,params_weight_decay,user_attrs_mre,state
381,0.36298704147338867,2023-09-04 21:18:41.080683,2023-09-04 21:18:41.319786,0 days 00:00:00.239103,Leaky,Tanh,,,47,24,14.0,,,0.026695351754435298,2,166,0.4046258699692183,0.00021194086915135184,4155.5578206380205,COMPLETE
382,0.33020004630088806,2023-09-04 21:18:41.320100,2023-09-04 21:18:41.742401,0 days 00:00:00.422301,Leaky,Tanh,,,43,24,12.0,,,0.02118595878913308,2,150,0.796524470955464,0.00018941212156466545,135.16981479099817,COMPLETE
383,0.3722916543483734,2023-09-04 21:18:41.742719,2023-09-04 21:18:42.262894,0 days 00:00:00.520175,Sigmoid,Tanh,,,47,24,17.0,,,0.0863476514791325,2,162,0.752377706369899,0.00022691930257236968,7394.75744941907,COMPLETE
384,0.370108962059021,2023-09-04 21:18:42.263193,2023-09-04 21:18:43.236321,0 days 00:00:00.973128,Leaky,Tanh,,,45,24,10.0,,,0.0011536614651439137,2,157,0.34329415774546407,1.0122629391681551e-05,180.90934199436455,COMPLETE
385,0.3702891170978546,2023-09-04 21:18:43.236627,2023-09-04 21:18:43.573893,0 days 00:00:00.337266,Tanh,Tanh,,,41,23,12.0,,,0.0191026345664723,2,144,0.36898371644115785,0.00028660937674795,188.6830361106179,COMPLETE
386,0.31440505385398865,2023-09-04 21:18:43.574199,2023-09-04 21:18:44.187035,0 days 00:00:00.612836,Leaky,Tanh,ReLU,ReLU,100,23,18.0,20.0,15.0,0.029173291119980925,4,174,0.6525374932267052,0.00037256168590412423,153.27950221470425,COMPLETE
387,0.34161677956581116,2023-09-04 21:18:44.187588,2023-09-04 21:18:45.024558,0 days 00:00:00.836970,Leaky,Tanh,,,43,23,13.0,,,0.015529369825238044,2,182,0.7978517960332348,1.4721531438739327e-05,155.13188150193957,COMPLETE
388,0.3330683708190918,2023-09-04 21:18:45.024868,2023-09-04 21:18:45.447174,0 days 00:00:00.422306,ReLU,ReLU,,,79,24,21.0,,,0.021925119938441692,2,157,0.6867068779732255,0.0004307358331300017,664.6950284996811,COMPLETE
389,0.3415316045284271,2023-09-04 21:18:45.447509,2023-09-04 21:18:46.140016,0 days 00:00:00.692507,Leaky,Tanh,,,48,15,16.0,,,0.013162142905986236,2,418,0.722429687577093,0.0001548631444048203,143.80622729920503,COMPLETE
390,0.3355257213115692,2023-09-04 21:18:46.140333,2023-09-04 21:18:46.591123,0 days 00:00:00.450790,Leaky,ReLU,,,50,24,10.0,,,0.017205923030941976,2,54,0.5720468193960138,0.00082195565135318,127.90780291349992,COMPLETE
391,0.4005506932735443,2023-09-04 21:18:46.591440,2023-09-04 21:18:46.981652,0 days 00:00:00.390212,Tanh,Tanh,,,40,22,14.0,,,0.04879946495270271,2,274,0.7648163403516677,0.0006349959841963422,182.46980041503906,COMPLETE
392,0.4483712911605835,2023-09-04 21:18:46.981974,2023-09-04 21:18:51.935811,0 days 00:00:04.953837,Leaky,ReLU,Sigmoid,,37,23,20.0,6.0,,0.0003006725053620438,3,406,0.5166053230567426,0.00025870178409533197,182.54846886695898,COMPLETE
393,0.34673863649368286,2023-09-04 21:18:51.936126,2023-09-04 21:18:52.915362,0 days 00:00:00.979236,Leaky,Tanh,,,69,24,11.0,,,0.011936130459737805,2,395,0.7995778599358638,1.7500267780043926e-05,204.41102608301307,COMPLETE
394,0.35750991106033325,2023-09-04 21:18:52.915683,2023-09-04 21:18:53.683864,0 days 00:00:00.768181,Leaky,ReLU,,,65,23,18.0,,,0.00958058618315755,2,169,0.7416170780723319,1.3168943611972969e-05,108.51343190511068,COMPLETE
395,0.306255042552948,2023-09-04 21:18:53.684209,2023-09-04 21:18:54.685913,0 days 00:00:01.001704,Leaky,Tanh,,,45,22,17.0,,,0.014114759575965067,2,105,0.6889149420941253,0.0011285179041287396,193.8837070694889,COMPLETE
396,0.5390713810920715,2023-09-04 21:18:54.686234,2023-09-04 21:18:55.019415,0 days 00:00:00.333181,Tanh,Tanh,,,44,2,17.0,,,0.015770442587590226,2,107,0.6949931660585479,0.001228290296097712,143.50106018066407,COMPLETE
397,0.3584192395210266,2023-09-04 21:18:55.019749,2023-09-04 21:18:55.611892,0 days 00:00:00.592143,Leaky,Tanh,,,49,22,17.0,,,0.023812216723139542,2,104,0.7203234506956344,0.0019989790282974656,444.9716497927296,COMPLETE
398,0.33498865365982056,2023-09-04 21:18:55.612207,2023-09-04 21:18:56.415864,0 days 00:00:00.803657,Leaky,Tanh,,,42,22,16.0,,,0.018594640626866357,2,94,0.7652911293582112,1.007888624331251e-05,29288.255311129386,COMPLETE
399,0.36022284626960754,2023-09-04 21:18:56.416176,2023-09-04 21:18:57.026724,0 days 00:00:00.610548,Leaky,Tanh,,,46,23,17.0,,,0.014061114516444474,2,102,0.7398827969482418,0.00013448307156028116,130.63483867239444,COMPLETE
400,0.40168142318725586,2023-09-04 21:18:57.027039,2023-09-04 21:18:57.611707,0 days 00:00:00.584668,Leaky,Tanh,,,44,22,11.0,,,0.0652297237284199,2,83,0.6824250892515572,0.001083461746810724,143.33141700257647,COMPLETE
401,0.2805582582950592,2023-09-04 21:18:57.612042,2023-09-04 21:18:58.485299,0 days 00:00:00.873257,Leaky,Tanh,,,46,23,22.0,,,0.01137081586384049,2,303,0.7702866568322998,1.9732539713760652e-05,130.57765326866738,COMPLETE
402,0.3431189954280853,2023-09-04 21:18:58.485638,2023-09-04 21:18:58.839069,0 days 00:00:00.353431,Tanh,Tanh,Leaky,Leaky,72,23,22.0,18.0,11.0,0.011405409573374992,4,297,0.4275167487965172,1.9391808002599668e-05,3337.751030500545,COMPLETE
403,0.4165065884590149,2023-09-04 21:18:58.839400,2023-09-04 21:18:59.047891,0 days 00:00:00.208491,Leaky,Tanh,,,46,24,21.0,,,0.010831556024282336,2,267,0.2235392733697439,2.4305119892121786e-05,447.47494252522785,COMPLETE
404,0.4349592328071594,2023-09-04 21:18:59.048200,2023-09-04 21:18:59.388859,0 days 00:00:00.340659,Leaky,Sigmoid,,,42,24,22.0,,,0.09877610734384332,2,310,0.7684063305061614,1.6602485571287932e-05,149.63757012107155,COMPLETE
405,0.30474716424942017,2023-09-04 21:18:59.389176,2023-09-04 21:19:00.174180,0 days 00:00:00.785004,Leaky,Tanh,,,90,23,23.0,,,0.008780070340973155,2,291,0.7705358934698702,1.2761078071406609e-05,159.36407496420185,COMPLETE
406,0.33644747734069824,2023-09-04 21:19:00.174495,2023-09-04 21:19:00.459187,0 days 00:00:00.284692,Leaky,Tanh,,,86,23,24.0,,,0.042273631639393246,2,143,0.7374039263786503,1.3462879536323727e-05,153.93182169596355,COMPLETE
407,0.38200974464416504,2023-09-04 21:19:00.459493,2023-09-04 21:19:00.790668,0 days 00:00:00.331175,Leaky,Tanh,,,91,23,23.0,,,0.009171566491562198,2,285,0.3304777196055829,1.2833029255900124e-05,177.12035115559897,COMPLETE
408,0.3598862886428833,2023-09-04 21:19:00.790988,2023-09-04 21:19:01.240593,0 days 00:00:00.449605,Tanh,Tanh,,,88,24,23.0,,,0.012137347993459472,2,300,0.7975925631342622,1.1399440573015662e-05,206.42348788646942,COMPLETE
409,0.4639734923839569,2023-09-04 21:19:01.240911,2023-09-04 21:19:02.321191,0 days 00:00:01.080280,Sigmoid,Tanh,,,93,23,9.0,,,0.0014405931738417223,2,290,0.3090438441812671,1.5245558006836774e-05,198.46576761706123,COMPLETE
410,0.33876532316207886,2023-09-04 21:19:02.321492,2023-09-04 21:19:02.856328,0 days 00:00:00.534836,Leaky,Tanh,,,90,23,21.0,,,0.010216753029018942,2,304,0.7692109533711948,0.00010156496235508204,239.73346283476232,COMPLETE
411,0.3264136016368866,2023-09-04 21:19:02.856650,2023-09-04 21:19:03.671727,0 days 00:00:00.815077,Leaky,Tanh,,,48,24,22.0,,,0.033233321482571895,2,321,0.7153919690789344,5.196746876033048e-05,124.03244530976708,COMPLETE
412,0.34843161702156067,2023-09-04 21:19:03.672083,2023-09-04 21:19:03.993680,0 days 00:00:00.321597,Leaky,Tanh,,,94,23,24.0,,,0.025409160910710923,2,288,0.4715422756302891,1.002554255323062e-05,131.30479999889027,COMPLETE
413,0.3492376208305359,2023-09-04 21:19:03.994082,2023-09-04 21:19:07.055335,0 days 00:00:03.061253,ReLU,Tanh,,,51,24,23.0,,,0.001016904941472987,2,284,0.7469935093569451,0.00016451620240286494,206.30852346067076,COMPLETE
414,0.48224544525146484,2023-09-04 21:19:07.055653,2023-09-04 21:19:10.217838,0 days 00:00:03.162185,Leaky,Leaky,,,83,23,2.0,,,0.0017158863558377534,2,276,0.7698352286919117,1.2380843748378874e-05,178.4504049290492,COMPLETE
415,0.39228489995002747,2023-09-04 21:19:10.218382,2023-09-04 21:19:10.530508,0 days 00:00:00.312126,Tanh,Tanh,,,74,24,23.0,,,0.01692331443770672,2,155,0.5397391727086909,0.00025089830626234453,143.82771809895834,COMPLETE
416,0.4311380982398987,2023-09-04 21:19:10.530813,2023-09-04 21:19:10.828224,0 days 00:00:00.297411,Leaky,,,,89,17,,,,0.013106306018913348,1,279,0.26279926113949637,1.8656944099845064e-05,117.20091111589186,COMPLETE
417,0.3000820577144623,2023-09-04 21:19:10.828519,2023-09-04 21:19:11.422599,0 days 00:00:00.594080,Leaky,Tanh,ReLU,,39,23,24.0,24.0,,0.008299445526673504,3,301,0.7993446105872966,2.874901971858948e-05,141.08171721427672,COMPLETE
418,0.3127652704715729,2023-09-04 21:19:11.422934,2023-09-04 21:19:12.375994,0 days 00:00:00.953060,Leaky,Tanh,ReLU,,35,23,23.0,24.0,,0.008531696401343903,3,291,0.7998975662487908,2.8833949158270508e-05,148.7327757490442,COMPLETE
419,0.3202143907546997,2023-09-04 21:19:12.376341,2023-09-04 21:19:13.055228,0 days 00:00:00.678887,Leaky,Tanh,ReLU,,39,23,11.0,22.0,,0.011752352337713762,3,291,0.799148568952724,3.92790538220105e-05,171.15540907118054,COMPLETE
420,0.3880368769168854,2023-09-04 21:19:13.055572,2023-09-04 21:19:14.137558,0 days 00:00:01.081986,Leaky,Tanh,ReLU,Tanh,40,14,23.0,21.0,18.0,0.01964756355159166,4,299,0.38631415028013694,0.0001920867697242613,153.1600346969346,COMPLETE
421,0.3452713191509247,2023-09-04 21:19:14.138136,2023-09-04 21:19:16.563015,0 days 00:00:02.424879,Tanh,Tanh,ReLU,,37,12,24.0,16.0,,0.010084898972099842,3,320,0.762557343356441,1.4532894682976578e-05,162.01914199517697,COMPLETE
422,0.367665559053421,2023-09-04 21:19:16.563347,2023-09-04 21:19:18.059393,0 days 00:00:01.496046,Leaky,Tanh,ReLU,ReLU,41,24,24.0,23.0,15.0,0.0006817464991939045,4,309,0.6284561491871009,7.246171151316192e-05,135.60058182936447,COMPLETE
423,0.34342676401138306,2023-09-04 21:19:18.059724,2023-09-04 21:19:19.254800,0 days 00:00:01.195076,Leaky,Tanh,ReLU,Sigmoid,39,23,24.0,19.0,4.0,0.015424687703213641,4,306,0.7216038264852622,2.1880069581136382e-05,274.9791567442847,COMPLETE
424,0.7577050924301147,2023-09-04 21:19:19.255129,2023-09-04 21:19:19.732893,0 days 00:00:00.477764,Leaky,Tanh,ReLU,,43,24,22.0,1.0,,0.008036736884161686,3,270,0.2951282018793154,1.2275477630829895e-05,160.25276071885054,COMPLETE
425,0.3531724512577057,2023-09-04 21:19:19.733232,2023-09-04 21:19:21.089606,0 days 00:00:01.356374,Leaky,Tanh,ReLU,Sigmoid,38,24,24.0,20.0,8.0,0.012280691947122849,4,313,0.7687930941263653,0.00012922429215700033,181.4526948928833,COMPLETE
426,0.31770968437194824,2023-09-04 21:19:21.089941,2023-09-04 21:19:21.671278,0 days 00:00:00.581337,Tanh,Tanh,,,96,23,22.0,,,0.009391645913520043,2,190,0.7404536359265472,3.554012581061966e-05,145.00156609671455,COMPLETE
427,0.3555760383605957,2023-09-04 21:19:21.671617,2023-09-04 21:19:22.912864,0 days 00:00:01.241247,Leaky,Tanh,,,98,23,23.0,,,0.002459290580284994,2,335,0.7069239685334358,0.0003052434148181913,131.06313559449748,COMPLETE
428,0.4161425828933716,2023-09-04 21:19:22.913198,2023-09-04 21:19:23.157374,0 days 00:00:00.244176,Leaky,Tanh,,,77,22,24.0,,,0.014329557253100594,2,298,0.2532845880181993,1.6754281180377283e-05,1123.7734436035157,COMPLETE
429,0.4874858856201172,2023-09-04 21:19:23.157687,2023-09-04 21:19:26.947962,0 days 00:00:03.790275,Leaky,Tanh,Tanh,ReLU,35,24,22.0,8.0,18.0,5.202156090788933e-05,4,171,0.773678678554149,0.00021313553256857695,148.54303295291655,COMPLETE
430,0.3885263502597809,2023-09-04 21:19:26.948292,2023-09-04 21:19:27.181085,0 days 00:00:00.232793,Leaky,Tanh,,,92,23,21.0,,,0.03124928713964878,2,243,0.3549498379975773,2.6838849326964996e-05,405.9846645923371,COMPLETE
431,0.3539060652256012,2023-09-04 21:19:27.181396,2023-09-04 21:19:27.653149,0 days 00:00:00.471753,Tanh,ReLU,,,81,24,23.0,,,0.00717536805867477,2,151,0.6501556675370088,9.478703126273863e-05,151.88827809116296,COMPLETE
432,0.3354431986808777,2023-09-04 21:19:27.653534,2023-09-04 21:19:28.306228,0 days 00:00:00.652694,Leaky,Tanh,,,41,23,10.0,,,0.01946256391815416,2,164,0.7398870460718705,1.1476248462822206e-05,112.4572758881942,COMPLETE
433,0.39292052388191223,2023-09-04 21:19:28.306559,2023-09-04 21:19:28.642204,0 days 00:00:00.335645,Leaky,Tanh,,,43,22,21.0,,,0.010424190581406971,2,300,0.266777478753961,1.5101693384337804e-05,292.52351094908636,COMPLETE
434,0.4171401560306549,2023-09-04 21:19:28.642564,2023-09-04 21:19:32.781299,0 days 00:00:04.138735,Sigmoid,ReLU,,,85,23,22.0,,,0.0007864802458834257,2,445,0.7986806875610649,0.0003439635046822296,137.37866370383273,COMPLETE
435,0.32714855670928955,2023-09-04 21:19:32.781600,2023-09-04 21:19:33.506605,0 days 00:00:00.725005,Leaky,Tanh,,,45,22,15.0,,,0.008193255985724453,2,136,0.7038868363251326,0.000504208133283607,181.52936379951342,COMPLETE
436,0.3516881763935089,2023-09-04 21:19:33.506928,2023-09-04 21:19:33.854547,0 days 00:00:00.347619,Leaky,Leaky,,,88,24,6.0,,,0.014020213590040048,2,281,0.6734471626233088,2.0561316447200287e-05,187.94960312616257,COMPLETE
437,0.5355941653251648,2023-09-04 21:19:33.854866,2023-09-04 21:19:34.123539,0 days 00:00:00.268673,ReLU,ReLU,,,95,23,20.0,,,0.011054979682622961,2,175,0.3222786141143595,0.03459242331750836,226.8136453779917,COMPLETE
438,0.48582199215888977,2023-09-04 21:19:34.123863,2023-09-04 21:19:34.255430,0 days 00:00:00.131567,Leaky,Tanh,,,39,24,21.0,,,0.023226821282887267,2,144,0.10562402274628271,5.295482919985785e-05,243.35421485900878,COMPLETE
439,0.3470577001571655,2023-09-04 21:19:34.255758,2023-09-04 21:19:34.980684,0 days 00:00:00.724926,Tanh,Tanh,,,99,22,9.0,,,0.0067495323112379685,2,160,0.603834455900362,0.00015902175988106068,164.0503246166088,COMPLETE
440,0.3524303436279297,2023-09-04 21:19:34.980988,2023-09-04 21:19:35.305335,0 days 00:00:00.324347,Leaky,ReLU,,,75,23,24.0,,,0.016552547100310545,2,149,0.4948855165576773,4.349411822440174e-05,135.84222030639648,COMPLETE
441,0.3533506989479065,2023-09-04 21:19:35.305670,2023-09-04 21:19:36.085742,0 days 00:00:00.780072,Leaky,Tanh,,,78,24,23.0,,,0.00932769639349392,2,289,0.572168313521147,0.0001131559570798507,124.96517540426815,COMPLETE
442,0.31600749492645264,2023-09-04 21:19:36.086294,2023-09-04 21:19:37.325860,0 days 00:00:01.239566,Leaky,ReLU,Sigmoid,,37,23,20.0,24.0,,0.01261755647642861,3,351,0.7528606576855859,1.2009330544928859e-05,150.6475777461611,COMPLETE
443,0.400890052318573,2023-09-04 21:19:37.326192,2023-09-04 21:19:37.610884,0 days 00:00:00.284692,Leaky,Tanh,,,33,22,21.0,,,0.07767755199439673,2,182,0.4545231413878571,1.688545371062732e-05,239.54117614746093,COMPLETE
444,0.37004125118255615,2023-09-04 21:19:37.611213,2023-09-04 21:19:38.618135,0 days 00:00:01.006922,Tanh,Sigmoid,,,46,23,22.0,,,0.002974672851035537,2,196,0.3995019286875673,2.9165465216205185e-05,193.9534878797934,COMPLETE
445,0.36254626512527466,2023-09-04 21:19:38.618464,2023-09-04 21:19:38.989682,0 days 00:00:00.371218,Leaky,Tanh,,,91,24,13.0,,,0.008393428909698538,2,50,0.7199828156584436,0.00024833865663619276,158.27654411679222,COMPLETE
446,0.40828266739845276,2023-09-04 21:19:38.989995,2023-09-04 21:19:44.024029,0 days 00:00:05.034034,Leaky,ReLU,Tanh,Leaky,42,22,11.0,10.0,12.0,0.00022194567587914896,4,260,0.7757807261135978,0.00041613343140319426,156.8287636390099,COMPLETE
447,0.362473726272583,2023-09-04 21:19:44.024389,2023-09-04 21:19:45.067257,0 days 00:00:01.042868,Leaky,Sigmoid,,,49,23,15.0,,,0.006017445782229572,2,135,0.6320297265296134,1.0112220185837612e-05,129.80789239065987,COMPLETE
448,0.36222654581069946,2023-09-04 21:19:45.067589,2023-09-04 21:19:45.352320,0 days 00:00:00.284731,Leaky,Tanh,,,100,24,20.0,,,0.0170342519350827,2,165,0.7442381634182416,1.4052654656073968e-05,382.5452551072644,COMPLETE
449,0.9870572686195374,2023-09-04 21:19:45.352661,2023-09-04 21:19:46.330299,0 days 00:00:00.977638,Tanh,Sigmoid,,,73,22,20.0,,,1.3753975577869086e-05,2,303,0.22990720425457586,2.2307655920403267e-05,183.27320781241943,COMPLETE
450,0.36515191197395325,2023-09-04 21:19:46.330612,2023-09-04 21:19:46.879447,0 days 00:00:00.548835,Leaky,Tanh,,,52,23,16.0,,,0.01313734638712553,2,423,0.6983231783114197,0.00014145746327734902,178.30295416649352,COMPLETE
451,0.3642688989639282,2023-09-04 21:19:46.879774,2023-09-04 21:19:47.255907,0 days 00:00:00.376133,Leaky,ReLU,,,40,24,22.0,,,0.011260711698665951,2,155,0.5276254835145008,7.954248701338061e-05,333.0735159481273,COMPLETE
452,0.3508872985839844,2023-09-04 21:19:47.256222,2023-09-04 21:19:47.657063,0 days 00:00:00.400841,Leaky,Sigmoid,,,97,23,23.0,,,0.00743534622575132,2,499,0.24911710010924426,1.785960860329278e-05,140.5071280694777,COMPLETE
453,0.37122806906700134,2023-09-04 21:19:47.657431,2023-09-04 21:19:47.961213,0 days 00:00:00.303782,Leaky,Tanh,Tanh,Sigmoid,36,22,14.0,18.0,16.0,0.022217467518415353,4,142,0.2958794003905514,3.429541384718073e-05,135.39317270914714,COMPLETE
454,0.37203049659729004,2023-09-04 21:19:47.961553,2023-09-04 21:19:48.459456,0 days 00:00:00.497903,Tanh,ReLU,,,89,24,20.0,,,0.009682045931686421,2,479,0.41849421020955224,0.00018887875256124728,139.3968154589335,COMPLETE
455,0.3996247947216034,2023-09-04 21:19:48.460014,2023-09-04 21:19:49.320862,0 days 00:00:00.860848,Leaky,,,,93,23,,,,0.027355197200215196,1,209,0.7974876461612929,0.0009395056675654408,184.29657325744628,COMPLETE
456,0.3717191219329834,2023-09-04 21:19:49.321403,2023-09-04 21:19:50.146625,0 days 00:00:00.825222,Leaky,Tanh,,,44,23,18.0,,,0.005117871269862511,2,323,0.3646212085497676,1.421657435304674e-05,132.27963239881728,COMPLETE
457,0.3395746350288391,2023-09-04 21:19:50.146969,2023-09-04 21:19:52.219467,0 days 00:00:02.072498,Leaky,Leaky,,,10,22,19.0,,,0.01546761591433401,2,128,0.6669368489207514,2.3672557886093255e-05,113.20886575950766,COMPLETE
458,0.6098240613937378,2023-09-04 21:19:52.219814,2023-09-04 21:19:52.935995,0 days 00:00:00.716181,Sigmoid,Sigmoid,,,42,22,19.0,,,0.0403616201072029,2,273,0.7643765608698718,0.0037606572840612955,186.7149871826172,COMPLETE
459,0.350603848695755,2023-09-04 21:19:52.936405,2023-09-04 21:19:53.218945,0 days 00:00:00.282540,Leaky,Tanh,,,47,24,21.0,,,0.01862334648795067,2,182,0.7242242390111244,0.0005325340482822523,144.42978782653807,COMPLETE
460,0.44151946902275085,2023-09-04 21:19:53.219360,2023-09-04 21:19:53.394768,0 days 00:00:00.175408,Leaky,ReLU,,,38,23,15.0,,,0.006182137173650915,2,168,0.1338245709433692,1.1392726263380243e-05,126.92504752950465,COMPLETE
461,0.3071000576019287,2023-09-04 21:19:53.395086,2023-09-04 21:19:54.430206,0 days 00:00:01.035120,Tanh,Sigmoid,Leaky,,76,21,21.0,19.0,,0.010961084126880325,3,156,0.7704666675903065,0.00021722197715950842,136.9420888712118,COMPLETE
462,0.3399263918399811,2023-09-04 21:19:54.430540,2023-09-04 21:19:56.111326,0 days 00:00:01.680786,Leaky,Tanh,,,82,22,20.0,,,0.0012151643078897939,2,313,0.4376508021507941,6.549317997115615e-05,128.28328317270493,COMPLETE
463,0.393422394990921,2023-09-04 21:19:56.111649,2023-09-04 21:19:56.969271,0 days 00:00:00.857622,Leaky,Sigmoid,,,87,24,18.0,,,0.0019784029301702553,2,464,0.22039768592899092,1.0063205286778231e-05,194.93487881325387,COMPLETE
464,0.37618136405944824,2023-09-04 21:19:56.969679,2023-09-04 21:19:57.499060,0 days 00:00:00.529381,ReLU,Tanh,,,71,23,24.0,,,0.008934839042895014,2,296,0.7370259904793288,0.00034346114172292895,136.62815612217165,COMPLETE
465,0.37529292702674866,2023-09-04 21:19:57.499399,2023-09-04 21:19:57.872479,0 days 00:00:00.373080,Leaky,ReLU,,,79,24,22.0,,,0.014126809015555311,2,143,0.7990838498589765,0.00010398389017936647,138.2982153756278,COMPLETE
466,0.3921245038509369,2023-09-04 21:19:57.872801,2023-09-04 21:19:59.890005,0 days 00:00:02.017204,Leaky,Tanh,,,45,5,16.0,,,0.004334228187302136,2,174,0.6907552225281237,1.8658618824659508e-05,164.14530695701131,COMPLETE
467,0.41407668590545654,2023-09-04 21:19:59.890565,2023-09-04 21:20:01.031295,0 days 00:00:01.140730,Tanh,Sigmoid,,,34,14,12.0,,,0.0077938257562537305,2,367,0.4805090727218813,0.00016523358096495356,125.34481019793816,COMPLETE
468,0.39115238189697266,2023-09-04 21:20:01.031606,2023-09-04 21:20:03.897848,0 days 00:00:02.866242,Leaky,ReLU,,,40,18,19.0,,,0.0010412982068418357,2,408,0.545351538601489,4.976413265674127e-05,134.69550537978202,COMPLETE
469,0.37362682819366455,2023-09-04 21:20:03.898172,2023-09-04 21:20:04.625300,0 days 00:00:00.727128,Leaky,Tanh,,,95,23,20.0,,,0.012269622240393399,2,284,0.6504490161449387,2.8121114144015976e-05,140.0013959017667,COMPLETE
470,0.39255356788635254,2023-09-04 21:20:04.625627,2023-09-04 21:20:05.839877,0 days 00:00:01.214250,Leaky,Sigmoid,,,91,21,21.0,,,0.0015511286089566977,2,150,0.7121221450351376,1.3436772889758131e-05,170.57257400512697,COMPLETE
471,0.33797499537467957,2023-09-04 21:20:05.840212,2023-09-04 21:20:06.725722,0 days 00:00:00.885510,Leaky,Tanh,,,85,22,18.0,,,0.010003783963848992,2,135,0.7514086148273288,0.00012955806641190933,135.43528747558594,COMPLETE
472,0.4024069905281067,2023-09-04 21:20:06.726052,2023-09-04 21:20:07.124700,0 days 00:00:00.398648,Tanh,ReLU,Tanh,Sigmoid,42,24,20.0,22.0,11.0,0.007000697942083304,4,162,0.20220856629348127,3.81752566437253e-05,136.36368621341765,COMPLETE
473,0.3514977991580963,2023-09-04 21:20:07.125030,2023-09-04 21:20:07.946781,0 days 00:00:00.821751,Leaky,Sigmoid,,,98,23,19.0,,,0.0035731056925162033,2,122,0.6039399400547424,1.5966482435777697e-05,136.06100088651064,COMPLETE
474,0.32497960329055786,2023-09-04 21:20:07.947101,2023-09-04 21:20:08.560800,0 days 00:00:00.613699,Leaky,Tanh,,,38,22,18.0,,,0.014587647366751508,2,188,0.6756402937936505,0.0006538373261488813,147.08187137179905,COMPLETE
475,0.32960203289985657,2023-09-04 21:20:08.561112,2023-09-04 21:20:09.723511,0 days 00:00:01.162399,Leaky,Tanh,,,36,23,17.0,,,0.0056291483514675535,2,377,0.7994265764630353,1.987933048731237e-05,339.7723347838496,COMPLETE
476,1.0339754819869995,2023-09-04 21:20:09.723855,2023-09-04 21:20:10.280457,0 days 00:00:00.556602,Leaky,Sigmoid,,,90,21,19.0,,,2.8911186625214924e-05,2,158,0.28680957906727483,1.2751351610688108e-05,696.4733795938613,COMPLETE
