number,value,datetime_start,datetime_complete,duration,params_activation1,params_activation2,params_activation3,params_activation4,params_batch_size,params_fl1,params_fl2,params_fl3,params_fl4,params_learning_rate,params_n_layers,params_num_epochs,params_train_size,params_weight_decay,user_attrs_mre,state
563,0.3228965699672699,2023-09-04 21:32:05.918498,2023-09-04 21:32:11.808833,0 days 00:00:05.890335,Sigmoid,Leaky,Leaky,,18,22,15.0,23.0,,0.0014036753570073922,3,429,0.6426702541504196,4.2948946064354e-05,112.26501155245131,COMPLETE
564,0.3026909828186035,2023-09-04 21:32:11.809209,2023-09-04 21:32:12.687401,0 days 00:00:00.878192,Tanh,Sigmoid,Leaky,,30,12,16.0,22.0,,0.010658258377125121,3,412,0.7400977691708881,3.3896375362406734e-05,104.87177965117664,COMPLETE
565,0.3525241017341614,2023-09-04 21:32:12.687790,2023-09-04 21:32:13.070038,0 days 00:00:00.382248,Tanh,Leaky,Leaky,,16,11,14.0,24.0,,0.03736381715935192,3,402,0.3331651141205041,3.790375104076512e-05,105.53811681838263,COMPLETE
566,0.335114061832428,2023-09-04 21:32:13.070413,2023-09-04 21:32:15.062807,0 days 00:00:01.992394,Tanh,Leaky,Tanh,,27,4,16.0,21.0,,0.002433790680831954,3,399,0.5220237503907331,5.2756290033782216e-05,104.1240413732696,COMPLETE
567,0.33576133847236633,2023-09-04 21:32:15.063428,2023-09-04 21:32:22.454908,0 days 00:00:07.391480,Tanh,Leaky,ReLU,,24,7,15.0,24.0,,0.0002580054109575839,3,420,0.6762332693825152,1.5300574587436288e-05,92.32212124930487,COMPLETE
568,0.3320602476596832,2023-09-04 21:32:22.455278,2023-09-04 21:32:23.432942,0 days 00:00:00.977664,Tanh,Sigmoid,Leaky,,19,21,14.0,23.0,,0.007669579185022962,3,273,0.4782426637530396,4.7841035105919885e-05,111.17385371526082,COMPLETE
569,0.43521320819854736,2023-09-04 21:32:23.433305,2023-09-04 21:32:25.083909,0 days 00:00:01.650604,Tanh,Leaky,Leaky,,22,3,16.0,24.0,,0.001232926578304322,3,449,0.39889492456717246,1.3305884702389126e-05,98.45936239919355,COMPLETE
570,0.3993232548236847,2023-09-04 21:32:25.084369,2023-09-04 21:32:25.736807,0 days 00:00:00.652438,Leaky,Leaky,Leaky,,28,20,22.0,1.0,,0.012484503459840172,3,430,0.7062224923723204,2.3603542979076317e-05,119.29865976969401,COMPLETE
571,0.25746339559555054,2023-09-04 21:32:25.737281,2023-09-04 21:32:28.454593,0 days 00:00:02.717312,Tanh,Leaky,ReLU,,25,12,19.0,6.0,,0.000983318680604945,3,403,0.7991919240932995,3.2240514752093275e-05,105.04583340599423,COMPLETE
572,0.3305295407772064,2023-09-04 21:32:28.454951,2023-09-04 21:32:30.615460,0 days 00:00:02.160509,Tanh,Sigmoid,ReLU,,25,13,20.0,6.0,,0.0010524166589194093,3,411,0.796186902020461,2.9673349254682133e-05,126.83877903582102,COMPLETE
573,0.30279240012168884,2023-09-04 21:32:30.615830,2023-09-04 21:32:32.952239,0 days 00:00:02.336409,Tanh,Leaky,ReLU,,24,12,20.0,7.0,,0.0009414951452080518,3,395,0.79903413444749,2.9287840493506014e-05,85.43628262925422,COMPLETE
574,0.3576739430427551,2023-09-04 21:32:32.952623,2023-09-04 21:32:33.676378,0 days 00:00:00.723755,Tanh,Leaky,ReLU,,23,12,19.0,6.0,,0.08313921496986158,3,390,0.7422790615210241,2.628612143305748e-05,150.49142485398514,COMPLETE
575,0.30270978808403015,2023-09-04 21:32:33.676740,2023-09-04 21:32:35.256773,0 days 00:00:01.580033,Tanh,Leaky,ReLU,,26,12,19.0,5.0,,0.0016342846086927483,3,409,0.7995226927233698,2.0523830595881997e-05,101.11393122519216,COMPLETE
576,0.32731929421424866,2023-09-04 21:32:35.257123,2023-09-04 21:32:40.524360,0 days 00:00:05.267237,Tanh,Sigmoid,ReLU,,20,13,20.0,4.0,,0.000777782922278574,3,401,0.7491830726231764,2.8380403414693235e-05,105.18203080807879,COMPLETE
577,0.3646172285079956,2023-09-04 21:32:40.524733,2023-09-04 21:32:43.041641,0 days 00:00:02.516908,Tanh,Leaky,ReLU,,22,12,19.0,7.0,,0.0006637828477009227,3,394,0.7713216609870999,2.336230143704978e-05,95.20192131629356,COMPLETE
578,0.3067205846309662,2023-09-04 21:32:43.042007,2023-09-04 21:32:46.191571,0 days 00:00:03.149564,Tanh,ReLU,ReLU,,25,19,19.0,8.0,,0.0004053269945595232,3,403,0.7198610651389495,3.33944226863256e-05,109.26771907388729,COMPLETE
579,0.344693660736084,2023-09-04 21:32:46.191934,2023-09-04 21:32:49.478887,0 days 00:00:03.286953,Tanh,,,,16,24,,,,0.0005498577068259048,1,389,0.35089244983722395,4.0640258763908816e-05,105.72123665731462,COMPLETE
580,0.38696977496147156,2023-09-04 21:32:49.479229,2023-09-04 21:32:50.095776,0 days 00:00:00.616547,Tanh,Leaky,ReLU,,22,13,20.0,7.0,,0.0011808856621064183,3,346,0.2359212782732354,1.8877645640600024e-05,111.24134015280103,COMPLETE
581,0.43575865030288696,2023-09-04 21:32:50.096131,2023-09-04 21:32:50.452799,0 days 00:00:00.356668,Sigmoid,Leaky,ReLU,,18,11,19.0,5.0,,0.0009754111072981952,3,412,0.17449124113058587,1.666347817254232e-05,138.9949637965152,COMPLETE
582,0.3555002808570862,2023-09-04 21:32:50.453155,2023-09-04 21:33:03.873010,0 days 00:00:13.419855,Tanh,Sigmoid,,,14,14,18.0,,,0.00017273671421990015,2,398,0.7650053057411479,2.8789725522873765e-05,119.16570552270016,COMPLETE
583,0.3431749641895294,2023-09-04 21:33:03.873352,2023-09-04 21:33:04.799143,0 days 00:00:00.925791,Tanh,Leaky,ReLU,,26,23,18.0,6.0,,0.0018314879608632296,3,342,0.6907871904285443,4.3302307546193976e-05,90.86584882038396,COMPLETE
584,0.3314951956272125,2023-09-04 21:33:04.799493,2023-09-04 21:33:08.099455,0 days 00:00:03.299962,Tanh,Leaky,Sigmoid,,20,12,18.0,7.0,,0.00044574407915441434,3,242,0.7262351471992305,3.060188012379064e-05,104.01302357209035,COMPLETE
585,0.3533935248851776,2023-09-04 21:33:08.099838,2023-09-04 21:33:08.641170,0 days 00:00:00.541332,Tanh,Sigmoid,,,12,22,19.0,,,0.05476986665766422,2,267,0.36025285497470616,2.5706337056314e-05,240.02284353750724,COMPLETE
586,0.5255011320114136,2023-09-04 21:33:08.641585,2023-09-04 21:33:08.885747,0 days 00:00:00.244162,Tanh,Leaky,ReLU,,24,11,19.0,3.0,,0.09278083479991646,3,390,0.30260009256147036,2.183881173130015e-05,152.51129235161676,COMPLETE
587,0.2749783992767334,2023-09-04 21:33:08.886134,2023-09-04 21:33:11.588797,0 days 00:00:02.702663,Tanh,Leaky,ReLU,,64,6,18.0,23.0,,0.0013726576267464507,3,418,0.7622471854115016,0.00045720567651391116,131.27803325653076,COMPLETE
588,0.3842857778072357,2023-09-04 21:33:11.589153,2023-09-04 21:33:13.382839,0 days 00:00:01.793686,Tanh,Tanh,ReLU,,64,6,18.0,23.0,,0.001332172045664486,3,422,0.7698857344165618,0.00043480333951141897,97.5067269007365,COMPLETE
589,0.3963194191455841,2023-09-04 21:33:13.383192,2023-09-04 21:33:14.550992,0 days 00:00:01.167800,Tanh,Leaky,ReLU,,28,5,19.0,22.0,,0.0008756464883848802,3,348,0.740391346527012,3.86657436768658e-05,150.78413772583008,COMPLETE
590,0.3816610276699066,2023-09-04 21:33:14.551361,2023-09-04 21:33:15.260864,0 days 00:00:00.709503,Leaky,Sigmoid,ReLU,,26,5,18.0,21.0,,0.0019527307846894737,3,418,0.1975402907835919,1.958698876202813e-05,274.9396927642822,COMPLETE
591,0.36195603013038635,2023-09-04 21:33:15.261225,2023-09-04 21:33:16.204584,0 days 00:00:00.943359,Tanh,Leaky,ReLU,,70,5,18.0,24.0,,0.0015301311719040241,3,352,0.7728969468084551,0.0002861157404879694,118.22895724956805,COMPLETE
592,0.3425035774707794,2023-09-04 21:33:16.204965,2023-09-04 21:33:16.623300,0 days 00:00:00.418335,Tanh,Leaky,ReLU,,67,4,18.0,23.0,,0.029237855464757632,3,417,0.7990090332579265,3.235206992538688e-05,116.0043231594947,COMPLETE
593,0.3179575204849243,2023-09-04 21:33:16.623671,2023-09-04 21:33:18.252380,0 days 00:00:01.628709,Tanh,Leaky,ReLU,,61,6,17.0,23.0,,0.0011392062432238578,3,357,0.7043331508133226,0.00033722423277731555,100.71702789745743,COMPLETE
594,0.3177187740802765,2023-09-04 21:33:18.252737,2023-09-04 21:33:22.351506,0 days 00:00:04.098769,Tanh,Sigmoid,ReLU,,23,6,20.0,24.0,,0.0009110266978387251,3,287,0.7436784769029561,0.0023839624732861883,108.49576940164937,COMPLETE
595,0.3069068491458893,2023-09-04 21:33:22.351861,2023-09-04 21:33:24.006459,0 days 00:00:01.654598,Tanh,Leaky,ReLU,,66,6,18.0,22.0,,0.0012321754519344769,3,383,0.7221299501773172,0.0018882515486249164,112.21093538072374,COMPLETE
596,0.3336490988731384,2023-09-04 21:33:24.006817,2023-09-04 21:33:25.726066,0 days 00:00:01.719249,Tanh,Leaky,ReLU,,27,12,17.0,22.0,,0.0008326273562727859,3,362,0.6680821826971504,1.4225241502817446e-05,103.48499049910579,COMPLETE
597,0.29512593150138855,2023-09-04 21:33:25.726440,2023-09-04 21:33:26.138598,0 days 00:00:00.412158,Tanh,Leaky,ReLU,,69,7,19.0,18.0,,0.05892888135442525,3,426,0.7639405764284501,1.0113142566189482e-05,91.48919382402974,COMPLETE
598,0.29523226618766785,2023-09-04 21:33:26.138963,2023-09-04 21:33:27.497849,0 days 00:00:01.358886,ReLU,Sigmoid,ReLU,,63,11,17.0,23.0,,0.0014510347413833494,3,255,0.7459830616384288,0.00040135077078544336,116.5038490976606,COMPLETE
599,0.31510165333747864,2023-09-04 21:33:27.498196,2023-09-04 21:33:28.786058,0 days 00:00:01.287862,Tanh,Leaky,Tanh,,24,12,18.0,20.0,,0.0024686069729465635,3,349,0.45886436641490813,0.0004885562402358982,114.90360947597173,COMPLETE
600,0.3360963761806488,2023-09-04 21:33:28.786426,2023-09-04 21:33:29.323615,0 days 00:00:00.537189,Tanh,Leaky,ReLU,,21,6,16.0,8.0,,0.018637207459343934,3,339,0.6946695920168797,0.00024464348962619555,103.70806924920333,COMPLETE
601,0.3597535490989685,2023-09-04 21:33:29.323992,2023-09-04 21:33:32.617920,0 days 00:00:03.293928,Sigmoid,Leaky,Leaky,,29,7,17.0,6.0,,0.0006353259351164688,3,408,0.7690326396781675,4.3973267419393176e-05,115.12382140716949,COMPLETE
602,0.372858464717865,2023-09-04 21:33:32.618300,2023-09-04 21:33:35.710574,0 days 00:00:03.092274,Tanh,Sigmoid,ReLU,,25,13,20.0,7.0,,0.0010386928575697296,3,369,0.24342754807966405,2.4644469415613205e-05,110.46302401403867,COMPLETE
603,0.48349225521087646,2023-09-04 21:33:35.710924,2023-09-04 21:33:36.053528,0 days 00:00:00.342604,ReLU,Leaky,Leaky,,22,11,21.0,23.0,,0.09915439239140272,3,376,0.7339245348711576,1.66947908659347e-05,134.5845191261985,COMPLETE
604,0.2862291932106018,2023-09-04 21:33:36.053874,2023-09-04 21:33:36.598552,0 days 00:00:00.544678,Tanh,ReLU,Leaky,,28,7,19.0,7.0,,0.028828873166655677,3,362,0.7086913073859706,5.336355853779401e-05,117.11039479573567,COMPLETE
605,0.3253878355026245,2023-09-04 21:33:36.598941,2023-09-04 21:33:36.925126,0 days 00:00:00.326185,Tanh,Leaky,Sigmoid,,62,12,16.0,6.0,,0.023440125491638375,3,230,0.4122153622120463,0.0037286197826886815,116.80469665527343,COMPLETE
606,0.37223362922668457,2023-09-04 21:33:36.925484,2023-09-04 21:33:37.309119,0 days 00:00:00.383635,Tanh,Leaky,Leaky,,25,11,17.0,24.0,,0.0029353581259655825,3,382,0.31724831732860287,0.000751897653436943,550.5255308151245,COMPLETE
607,0.4377788305282593,2023-09-04 21:33:37.309495,2023-09-04 21:33:39.151110,0 days 00:00:01.841615,Tanh,Sigmoid,ReLU,,27,12,18.0,8.0,,0.016868770550450735,3,277,0.7780333290011194,0.0001956063274657051,121.30410598160384,COMPLETE
608,0.43576881289482117,2023-09-04 21:33:39.151519,2023-09-04 21:33:39.267371,0 days 00:00:00.115852,ReLU,Leaky,Leaky,,59,23,16.0,4.0,,0.07133365343720634,3,263,0.11577389392585861,0.0027618310058242015,132.45492645263673,COMPLETE
609,0.34349924325942993,2023-09-04 21:33:39.267754,2023-09-04 21:33:39.952803,0 days 00:00:00.685049,Tanh,Leaky,Leaky,,64,13,16.0,22.0,,0.0016054940102431955,3,414,0.3811010162711606,0.00034616455506933494,112.76953657618108,COMPLETE
610,0.3035649061203003,2023-09-04 21:33:39.953174,2023-09-04 21:33:40.574208,0 days 00:00:00.621034,Tanh,Sigmoid,Leaky,,30,8,17.0,23.0,,0.03652353198682042,3,393,0.6574871012464537,0.00022798109013973393,100.45464062690735,COMPLETE
611,0.32357972860336304,2023-09-04 21:33:40.574582,2023-09-04 21:33:41.134646,0 days 00:00:00.560064,Tanh,Leaky,ReLU,,23,24,18.0,7.0,,0.009804688989392976,3,339,0.27715985354175043,0.0014585938561128544,103.90796227548637,COMPLETE
612,0.3204279839992523,2023-09-04 21:33:41.135011,2023-09-04 21:33:41.781423,0 days 00:00:00.646412,Leaky,Tanh,Leaky,,19,11,19.0,24.0,,0.053859682693978415,3,354,0.7494848539526411,3.230238973450642e-05,88.29450378417968,COMPLETE
613,0.33903083205223083,2023-09-04 21:33:41.781793,2023-09-04 21:33:43.593782,0 days 00:00:01.811989,ReLU,Leaky,Leaky,,21,15,18.0,5.0,,0.0020284264514781806,3,371,0.7946947739334373,0.0005089816179817795,99.8415641784668,COMPLETE
614,0.41696083545684814,2023-09-04 21:33:43.594141,2023-09-04 21:33:47.580371,0 days 00:00:03.986230,Tanh,,,,67,11,,,,0.0007716045625928738,1,430,0.6838313644439192,0.01502070326150858,106.21116931182785,COMPLETE
615,0.3871854543685913,2023-09-04 21:33:47.580717,2023-09-04 21:33:47.920351,0 days 00:00:00.339634,Tanh,Leaky,Tanh,,24,12,17.0,21.0,,0.015696155327517062,3,358,0.22516121927425153,0.0002624786078055971,116.04948446485731,COMPLETE
616,0.4274858236312866,2023-09-04 21:33:47.920722,2023-09-04 21:33:55.857387,0 days 00:00:07.936665,Tanh,Sigmoid,ReLU,,27,23,16.0,8.0,,2.3470749717516845e-05,3,330,0.7988474437843044,0.0018682181726233029,123.49017470388702,COMPLETE
617,0.35829582810401917,2023-09-04 21:33:55.857774,2023-09-04 21:33:56.835774,0 days 00:00:00.978000,ReLU,Leaky,Leaky,,29,14,17.0,6.0,,0.012451961508285743,3,406,0.7208427615313443,0.061661626163148735,109.70014439458433,COMPLETE
618,0.342514306306839,2023-09-04 21:33:56.836141,2023-09-04 21:33:58.779113,0 days 00:00:01.942972,Tanh,Leaky,Leaky,,66,12,16.0,23.0,,0.0005097498000994217,3,347,0.7484504876767311,0.00040054049441294424,98.50768641184068,COMPLETE
619,0.30493268370628357,2023-09-04 21:33:58.779493,2023-09-04 21:34:01.028275,0 days 00:00:02.248782,Tanh,Leaky,Leaky,,22,13,18.0,7.0,,0.0011383039428630541,3,386,0.7130108187198765,0.00030600610204213375,92.10031445106763,COMPLETE
620,0.3332032263278961,2023-09-04 21:34:01.028649,2023-09-04 21:34:01.909469,0 days 00:00:00.880820,Tanh,Sigmoid,ReLU,,32,5,15.0,19.0,,0.020162669211185005,3,375,0.6381631486830759,2.2262627266259972e-05,159.72620941162108,COMPLETE
621,0.908351480960846,2023-09-04 21:34:01.909826,2023-09-04 21:34:02.392122,0 days 00:00:00.482296,Tanh,Leaky,Leaky,,25,11,19.0,3.0,,0.014785371247250515,3,365,0.7992139210834346,0.049635746324655665,99.00059747695923,COMPLETE
622,0.3972074091434479,2023-09-04 21:34:02.392480,2023-09-04 21:34:03.176351,0 days 00:00:00.783871,ReLU,Leaky,Leaky,,18,12,17.0,22.0,,0.048821674176620936,3,395,0.7549738031871909,0.01972818396550052,106.11141835088316,COMPLETE
623,0.3874044716358185,2023-09-04 21:34:03.176707,2023-09-04 21:34:12.407822,0 days 00:00:09.231115,Tanh,Leaky,ReLU,,20,11,16.0,17.0,,0.00010288722316025,3,344,0.6849316838919796,0.02872109976504568,117.35283255022625,COMPLETE
624,0.4345003366470337,2023-09-04 21:34:12.408193,2023-09-04 21:34:12.717197,0 days 00:00:00.309004,Tanh,Sigmoid,Leaky,,99,6,15.0,5.0,,0.00332030369660848,3,404,0.17935403655194973,0.0011584034472611245,215.44324139681729,COMPLETE
625,0.33465588092803955,2023-09-04 21:34:12.717551,2023-09-04 21:34:13.481757,0 days 00:00:00.764206,Tanh,Leaky,Sigmoid,,27,11,18.0,24.0,,0.011215434183431008,3,382,0.7226355173671504,0.00017049873248388978,96.93579448353161,COMPLETE
626,0.3409581780433655,2023-09-04 21:34:13.482159,2023-09-04 21:34:14.609669,0 days 00:00:01.127510,Sigmoid,Leaky,,,23,12,16.0,,,0.025498144643426226,2,299,0.7695823901285503,5.0305517095156916e-05,98.15423000560088,COMPLETE
627,0.32881680130958557,2023-09-04 21:34:14.610078,2023-09-04 21:34:15.366186,0 days 00:00:00.756108,ReLU,Leaky,Leaky,,80,13,20.0,9.0,,0.0012998201287427664,3,418,0.4243802500781365,0.004344204124730629,108.2573471069336,COMPLETE
628,0.41634777188301086,2023-09-04 21:34:15.366550,2023-09-04 21:34:16.150168,0 days 00:00:00.783618,Tanh,Sigmoid,ReLU,,30,17,15.0,7.0,,0.004180390047678856,3,359,0.1597779951703185,0.0005131236555124325,345.53564698817365,COMPLETE
629,0.31362730264663696,2023-09-04 21:34:16.150825,2023-09-04 21:34:18.711203,0 days 00:00:02.560378,Tanh,Leaky,,,39,11,17.0,,,0.009141056140404296,2,368,0.7392259563107725,1.5622257359317804e-05,105.1419097236965,COMPLETE
630,0.3244999051094055,2023-09-04 21:34:18.711560,2023-09-04 21:34:20.263170,0 days 00:00:01.551610,Tanh,Leaky,Leaky,,25,24,18.0,6.0,,0.0007141941047674708,3,353,0.32603859522643225,3.8503193739858216e-05,127.5177077698193,COMPLETE
631,0.3750286102294922,2023-09-04 21:34:20.263530,2023-09-04 21:34:20.739289,0 days 00:00:00.475759,Tanh,ReLU,Leaky,,21,7,17.0,7.0,,0.017526964497721592,3,247,0.4688604251104931,0.0002031703099569715,112.78759543100993,COMPLETE
632,0.34898319840431213,2023-09-04 21:34:20.739663,2023-09-04 21:34:24.344533,0 days 00:00:03.604870,ReLU,Sigmoid,,,27,12,16.0,,,0.0003531389919800251,2,334,0.7990724886031457,0.0022140844874383933,97.258655834198,COMPLETE
633,0.31230804324150085,2023-09-04 21:34:24.345132,2023-09-04 21:34:25.483813,0 days 00:00:01.138681,Tanh,Leaky,Leaky,,61,11,17.0,8.0,,0.013114527069600262,3,434,0.7020109870083859,0.0016132604237373972,119.8238793649981,COMPLETE
634,0.3145686089992523,2023-09-04 21:34:25.484444,2023-09-04 21:34:30.202972,0 days 00:00:04.718528,Tanh,Leaky,ReLU,,23,12,15.0,23.0,,0.0009383170501937087,3,388,0.6637201979665205,0.0008172637648497136,98.54435403937967,COMPLETE
635,0.3387558162212372,2023-09-04 21:34:30.203336,2023-09-04 21:34:33.329378,0 days 00:00:03.126042,Tanh,Leaky,Leaky,,17,13,19.0,8.0,,0.0017925595690736454,3,378,0.7676303842775627,0.0030039351725418733,96.9537871389678,COMPLETE
636,0.4599534571170807,2023-09-04 21:34:33.330028,2023-09-04 21:34:33.981470,0 days 00:00:00.651442,Leaky,Sigmoid,,,19,23,18.0,,,0.08225882665273572,2,399,0.3074300730740052,0.02758825586466276,156.46700241986443,COMPLETE
637,0.36922281980514526,2023-09-04 21:34:33.982096,2023-09-04 21:34:51.661249,0 days 00:00:17.679153,ReLU,Leaky,Leaky,,29,11,16.0,2.0,,5.8585773285292274e-05,3,283,0.7285917481458658,0.0002331985977542288,112.16189901399107,COMPLETE
638,0.35164642333984375,2023-09-04 21:34:51.661936,2023-09-04 21:34:53.202957,0 days 00:00:01.541021,Tanh,Leaky,Tanh,,25,6,21.0,24.0,,0.035996101968398926,3,425,0.7678035274791902,6.04725600697473e-05,90.708790026213,COMPLETE
639,0.39922526478767395,2023-09-04 21:34:53.203610,2023-09-04 21:34:53.771051,0 days 00:00:00.567441,Tanh,Leaky,,,15,12,15.0,,,0.008227984537358242,2,349,0.11379223846487162,0.00045184097203923286,107.39883152131111,COMPLETE
640,0.3908732533454895,2023-09-04 21:34:53.771684,2023-09-04 21:34:54.359990,0 days 00:00:00.588306,Tanh,Tanh,ReLU,,31,8,17.0,6.0,,0.011467153542147852,3,412,0.15255025863830798,0.000689599307483696,294.7925275166829,COMPLETE
641,0.46164408326148987,2023-09-04 21:34:54.360655,2023-09-04 21:34:55.077044,0 days 00:00:00.716389,ReLU,Sigmoid,Leaky,,21,2,19.0,24.0,,0.014867214667910947,3,371,0.2561311067070655,0.0002866156058264046,252.44820709228514,COMPLETE
642,0.3249761760234833,2023-09-04 21:34:55.077678,2023-09-04 21:34:55.934635,0 days 00:00:00.856957,Tanh,Leaky,,,26,11,18.0,,,0.02156850228361532,2,195,0.35453752589091836,2.9098854641101576e-05,111.17744643599899,COMPLETE
643,0.2651633322238922,2023-09-04 21:34:55.935283,2023-09-04 21:34:58.305292,0 days 00:00:02.370009,Tanh,Leaky,Leaky,,17,11,17.0,9.0,,0.010661851608822622,3,318,0.679950351896626,4.518751261220487e-05,88.79087861378987,COMPLETE
644,0.3305818736553192,2023-09-04 21:34:58.305940,2023-09-04 21:35:00.506590,0 days 00:00:02.200650,Tanh,Leaky,Leaky,,17,10,16.0,8.0,,0.009528193021024908,3,308,0.4473573660898375,4.338862690904275e-05,126.32843960032744,COMPLETE
645,0.38745617866516113,2023-09-04 21:35:00.507239,2023-09-04 21:35:07.205939,0 days 00:00:06.698700,Tanh,Sigmoid,Leaky,,14,11,17.0,23.0,,0.002346729822918375,3,326,0.6478491372212031,5.528964690943238e-05,94.38734399118731,COMPLETE
646,0.41783401370048523,2023-09-04 21:35:07.206586,2023-09-04 21:35:08.103357,0 days 00:00:00.896771,ReLU,Leaky,,,10,10,16.0,,,0.001407285444096332,2,335,0.10215242136967219,3.808457682785677e-05,118.89958470042158,COMPLETE
647,0.3172874450683594,2023-09-04 21:35:08.104010,2023-09-04 21:35:10.451283,0 days 00:00:02.347273,Tanh,Leaky,Leaky,,16,11,16.0,9.0,,0.010968274598343623,3,324,0.6741732586072553,4.273296258025141e-05,113.95421733026919,COMPLETE
648,0.3002493679523468,2023-09-04 21:35:10.451943,2023-09-04 21:35:13.895443,0 days 00:00:03.443500,Tanh,Leaky,Leaky,,18,11,17.0,9.0,,0.0083736063577813,3,317,0.6239603937016113,6.727051870652487e-05,81.16849238698076,COMPLETE
649,0.3164103627204895,2023-09-04 21:35:13.896106,2023-09-04 21:35:18.944276,0 days 00:00:05.048170,Tanh,Sigmoid,Leaky,Sigmoid,17,11,15.0,9.0,14.0,0.006046443755095096,4,313,0.6898581021627134,3.1532219396738104e-05,105.69314297762784,COMPLETE
650,0.4176276922225952,2023-09-04 21:35:18.944931,2023-09-04 21:35:26.274727,0 days 00:00:07.329796,Sigmoid,Leaky,,,12,22,17.0,,,0.0006202585816741337,2,339,0.2658534503854389,4.852350467913572e-05,116.02836992536272,COMPLETE
651,0.3173007667064667,2023-09-04 21:35:26.275359,2023-09-04 21:35:35.582640,0 days 00:00:09.307281,Tanh,Leaky,Leaky,,15,10,15.0,8.0,,0.0009184315328370821,3,343,0.6485034939194856,0.0001655760166306796,93.79017475087156,COMPLETE
652,0.35236382484436035,2023-09-04 21:35:35.583273,2023-09-04 21:35:39.807782,0 days 00:00:04.224509,ReLU,Leaky,Leaky,,19,10,16.0,14.0,,0.0010892156000875794,3,271,0.39758039445423865,0.0014254298661118816,114.77741737825325,COMPLETE
653,0.4671802520751953,2023-09-04 21:35:39.808452,2023-09-04 21:36:00.180039,0 days 00:00:20.371587,Tanh,Sigmoid,,,19,11,16.0,,,1.3830437226907716e-05,2,291,0.6965286132848004,0.001004100951222791,115.89760663009591,COMPLETE
654,0.29041922092437744,2023-09-04 21:36:00.180715,2023-09-04 21:36:05.791878,0 days 00:00:05.611163,Tanh,ReLU,Leaky,,14,11,14.0,22.0,,0.007765312907160247,3,321,0.7147111780975532,0.0002183851600627253,139.13144501395848,COMPLETE
655,0.4401314854621887,2023-09-04 21:36:05.792522,2023-09-04 21:36:12.112275,0 days 00:00:06.319753,Tanh,Leaky,Leaky,,17,12,17.0,23.0,,0.0002712871277806157,3,332,0.2107604850752129,0.03785831932888686,169.5818494951896,COMPLETE
656,0.3708326518535614,2023-09-04 21:36:12.112922,2023-09-04 21:36:14.141215,0 days 00:00:02.028293,ReLU,Leaky,,,20,16,15.0,,,0.005075366994738547,2,347,0.4861198943648566,0.0003307291294641593,105.739501953125,COMPLETE
