number,value,datetime_start,datetime_complete,duration,params_activation1,params_activation2,params_activation3,params_activation4,params_batch_size,params_fl1,params_fl2,params_fl3,params_fl4,params_learning_rate,params_n_layers,params_num_epochs,params_train_size,params_weight_decay,user_attrs_mre,state
765,0.7405686378479004,2023-09-04 22:09:00.050991,2023-09-04 22:09:06.447119,0 days 00:00:06.396128,Tanh,Sigmoid,,,14,10,16.0,,,1.6462205292737965e-05,2,63,0.7466475595117004,3.266076218951132e-05,107.30869063120039,COMPLETE
766,0.4861706495285034,2023-09-04 22:09:06.447810,2023-09-04 22:09:08.013949,0 days 00:00:01.566139,Tanh,,,,24,21,,,,0.0004088565092736893,1,178,0.1162143757078182,0.00022823205304491623,206.20554604691065,COMPLETE
767,0.320894330739975,2023-09-04 22:09:08.014624,2023-09-04 22:09:09.554913,0 days 00:00:01.540289,Tanh,ReLU,,,67,22,13.0,,,0.013113944332391294,2,155,0.7991642069584216,8.017806121946135e-05,101.72310638427734,COMPLETE
768,0.3855809271335602,2023-09-04 22:09:09.555677,2023-09-04 22:09:11.976110,0 days 00:00:02.420433,Tanh,Sigmoid,,,19,23,17.0,,,0.018274436643058962,2,143,0.6985695641320001,0.006484831528272742,123.05374932289124,COMPLETE
769,0.8811351656913757,2023-09-04 22:09:11.976888,2023-09-04 22:09:23.200186,0 days 00:00:11.223298,ReLU,Sigmoid,Sigmoid,,39,21,9.0,5.0,,1.1474988203564177e-05,3,247,0.6570526610458699,2.019978361073218e-05,97.74374961080821,COMPLETE
770,0.34556061029434204,2023-09-04 22:09:23.200874,2023-09-04 22:09:25.561579,0 days 00:00:02.360705,Tanh,Tanh,,,21,20,6.0,,,0.007161040174452824,2,97,0.767090257301036,0.00014290866722732566,114.4437489663401,COMPLETE
771,0.3442811071872711,2023-09-04 22:09:25.562361,2023-09-04 22:09:36.406690,0 days 00:00:10.844329,Sigmoid,,,,12,10,,,,0.002518967972096709,1,169,0.7258885614572538,5.663000950465302e-05,99.5071634054184,COMPLETE
772,0.34015268087387085,2023-09-04 22:09:36.407343,2023-09-04 22:09:38.205133,0 days 00:00:01.797790,Tanh,ReLU,,,55,19,15.0,,,0.024334118957585128,2,88,0.7695636154399422,1.2069910081014233e-05,88.94525559743245,COMPLETE
773,0.38021552562713623,2023-09-04 22:09:38.205974,2023-09-04 22:09:38.865689,0 days 00:00:00.659715,Tanh,Sigmoid,Leaky,,26,22,3.0,2.0,,0.014458216813271208,3,73,0.13412789575581038,0.00034626715046057654,287.1208439418248,COMPLETE
774,0.4046423137187958,2023-09-04 22:09:38.866452,2023-09-04 22:09:40.428816,0 days 00:00:01.562364,Tanh,Sigmoid,,,17,11,5.0,,,0.001599883614208678,2,211,0.1102472076338977,0.004364144977610701,207.99009638566238,COMPLETE
775,0.35941287875175476,2023-09-04 22:09:40.429538,2023-09-04 22:09:41.122728,0 days 00:00:00.693190,Tanh,ReLU,Leaky,,62,24,23.0,4.0,,0.009358836686943265,3,57,0.29556307732502046,0.00010278667808836215,136.34299020206228,COMPLETE
776,0.3651360869407654,2023-09-04 22:09:41.123422,2023-09-04 22:09:42.162702,0 days 00:00:01.039280,ReLU,,,,36,15,,,,0.005538864182488472,1,232,0.2529221450288403,0.002222932981671606,114.56326631639824,COMPLETE
777,0.3614698052406311,2023-09-04 22:09:42.163346,2023-09-04 22:09:45.485986,0 days 00:00:03.322640,Leaky,Sigmoid,,,20,21,2.0,,,0.004147511212442949,2,224,0.6271944803487656,0.016320552138356786,112.02194357818027,COMPLETE
778,0.37725499272346497,2023-09-04 22:09:45.486641,2023-09-04 22:09:46.586419,0 days 00:00:01.099778,Tanh,Tanh,,,23,20,19.0,,,0.03208082158169189,2,105,0.5387497476103108,0.0001881519872843002,105.15493883405414,COMPLETE
779,0.9511678218841553,2023-09-04 22:09:46.587100,2023-09-04 22:09:47.564700,0 days 00:00:00.977600,Tanh,Sigmoid,,,80,23,20.0,,,2.0267979783360165e-05,2,82,0.27882466706046594,6.627446694440596e-05,108.7620794714951,COMPLETE
780,0.751355767250061,2023-09-04 22:09:47.565362,2023-09-04 22:09:51.546412,0 days 00:00:03.981050,Tanh,,,,45,22,,,,1.4395179811389518e-05,1,139,0.6833528976955805,3.132895341950153e-05,106.90717688910395,COMPLETE
781,0.3037938177585602,2023-09-04 22:09:51.547090,2023-09-04 22:09:57.489050,0 days 00:00:05.941960,Tanh,ReLU,Leaky,,15,21,21.0,6.0,,0.0011557527376737675,3,200,0.7432025855867734,1.0079723077060283e-05,84.39201324462891,COMPLETE
782,0.36773452162742615,2023-09-04 22:09:57.489741,2023-09-04 22:09:57.971813,0 days 00:00:00.482072,Tanh,Leaky,,,29,22,7.0,,,0.05978457718509777,2,184,0.1774521194739814,4.4728847281960076e-05,180.3775388277494,COMPLETE
783,0.3467993140220642,2023-09-04 22:09:57.972500,2023-09-04 22:10:00.126747,0 days 00:00:02.154247,ReLU,Sigmoid,,,33,9,18.0,,,0.02065985438047013,2,262,0.7995043945042012,0.00016138665144761993,100.81250324249268,COMPLETE
784,0.4580402970314026,2023-09-04 22:10:00.127403,2023-09-04 22:10:03.206316,0 days 00:00:03.078913,Sigmoid,Sigmoid,Leaky,,40,18,12.0,9.0,,0.0007004039171174799,3,159,0.26407910588664263,2.5434072205483655e-05,124.28327030205877,COMPLETE
785,0.3082205355167389,2023-09-04 22:10:03.207017,2023-09-04 22:10:05.205240,0 days 00:00:01.998223,Tanh,ReLU,,,19,19,5.0,,,0.015843595227725566,2,74,0.5189531058571772,1.566156439603162e-05,129.9958947317941,COMPLETE
786,0.4207305908203125,2023-09-04 22:10:05.205959,2023-09-04 22:10:07.151744,0 days 00:00:01.945785,Tanh,Tanh,Sigmoid,,13,18,4.0,8.0,,0.09179468898745269,3,93,0.5666330010433247,0.0006373802545457134,121.18675189548068,COMPLETE
787,0.43711918592453003,2023-09-04 22:10:07.152471,2023-09-04 22:10:11.505155,0 days 00:00:04.352684,Tanh,,,,21,16,,,,0.0005326924990254814,1,152,0.7175757452394103,0.03812017441570288,121.75579499035346,COMPLETE
788,0.37323665618896484,2023-09-04 22:10:11.505840,2023-09-04 22:10:15.932685,0 days 00:00:04.426845,Tanh,Sigmoid,,,17,20,15.0,,,0.010876607273139636,2,169,0.4702391193316271,0.004501162502146975,141.0269015312195,COMPLETE
789,0.43687310814857483,2023-09-04 22:10:15.933393,2023-09-04 22:10:25.033248,0 days 00:00:09.099855,Tanh,Sigmoid,,,42,21,20.0,,,6.916734674449198e-05,2,218,0.7687768227255966,0.03684270281859384,103.46200414535103,COMPLETE
790,0.9801197648048401,2023-09-04 22:10:25.033914,2023-09-04 22:10:25.499276,0 days 00:00:00.465362,ReLU,ReLU,Leaky,,38,23,23.0,1.0,,0.028097840896012655,3,98,0.4140007536739798,0.012203158511742638,100.42099970037287,COMPLETE
791,0.3375147581100464,2023-09-04 22:10:25.499984,2023-09-04 22:10:27.555394,0 days 00:00:02.055410,Leaky,,,,31,21,,,,0.0019627178322819835,1,239,0.502774057730423,3.807965027761927e-05,115.58615981207953,COMPLETE
792,0.4286647439002991,2023-09-04 22:10:27.556107,2023-09-04 22:10:28.938081,0 days 00:00:01.381974,Tanh,Sigmoid,,,52,24,14.0,,,0.03884020920161761,2,63,0.7479105549108153,0.030755133963840976,118.89092826843262,COMPLETE
793,0.44320225715637207,2023-09-04 22:10:28.938781,2023-09-04 22:10:34.767317,0 days 00:00:05.828536,Tanh,Tanh,,,27,20,9.0,,,6.966646274828746e-05,2,107,0.7024775693320414,0.026228328457050507,116.0199397434698,COMPLETE
794,0.4027799665927887,2023-09-04 22:10:34.768025,2023-09-04 22:10:37.178074,0 days 00:00:02.410049,Tanh,ReLU,Tanh,,24,15,6.0,15.0,,0.00032423007329577066,3,50,0.4343307381817238,7.75896950859668e-05,111.47161254882812,COMPLETE
795,0.5035924315452576,2023-09-04 22:10:37.178775,2023-09-04 22:10:38.281918,0 days 00:00:01.103143,Tanh,Sigmoid,,,22,22,22.0,,,0.007750307301746164,2,82,0.7689794362114799,0.07453721170173051,100.1172594342913,COMPLETE
796,0.3373508155345917,2023-09-04 22:10:38.282895,2023-09-04 22:10:39.657458,0 days 00:00:01.374563,Tanh,Sigmoid,,,34,21,5.0,,,0.07813965552057638,2,177,0.6703315326895313,0.0001251868965950924,105.9452483078529,COMPLETE
797,0.2830227017402649,2023-09-04 22:10:39.658164,2023-09-04 22:10:45.676398,0 days 00:00:06.018234,ReLU,ReLU,Leaky,,15,20,13.0,6.0,,0.006116300036408874,3,147,0.7996830358707393,1.896482685725186e-05,101.26700655619304,COMPLETE
798,0.47839564085006714,2023-09-04 22:10:45.677121,2023-09-04 22:10:53.123670,0 days 00:00:07.446549,Sigmoid,,,,18,16,,,,0.00010982958109467532,1,198,0.4588889162936431,0.00024911408100861305,110.49760760683002,COMPLETE
799,0.37879809737205505,2023-09-04 22:10:53.124329,2023-09-04 22:10:57.848340,0 days 00:00:04.724011,Tanh,Sigmoid,,,20,11,17.0,,,0.0031437449755648502,2,90,0.7267399643019696,5.065672125644093e-05,97.71329979529747,COMPLETE
800,0.3819189965724945,2023-09-04 22:10:57.849069,2023-09-04 22:11:02.009585,0 days 00:00:04.160516,Tanh,Tanh,,,12,21,16.0,,,0.0008972933978734842,2,161,0.22715421771011818,0.0004472133383999284,116.38696633398006,COMPLETE
801,0.38693055510520935,2023-09-04 22:11:02.010270,2023-09-04 22:11:03.526977,0 days 00:00:01.516707,Tanh,Sigmoid,ReLU,,10,22,3.0,3.0,,0.012103480166433495,3,229,0.12594946670150117,1.3488221418118853e-05,162.67781781135722,COMPLETE
802,0.32009047269821167,2023-09-04 22:11:03.527678,2023-09-04 22:11:04.862218,0 days 00:00:01.334540,Tanh,ReLU,,,36,23,11.0,,,0.022419125383666107,2,210,0.5908448853606504,9.846266484712765e-05,87.74091653262867,COMPLETE
803,0.3280009627342224,2023-09-04 22:11:04.862899,2023-09-04 22:11:06.244863,0 days 00:00:01.381964,Tanh,,,,57,20,,,,0.01773685372120374,1,69,0.7467900498091302,2.2662553513725517e-05,101.52322509765625,COMPLETE
804,0.3030829131603241,2023-09-04 22:11:06.245519,2023-09-04 22:11:08.403535,0 days 00:00:02.158016,ReLU,Sigmoid,,,22,21,8.0,,,0.025687903107974357,2,132,0.6352778739892299,0.00020970265062424717,105.79585032992892,COMPLETE
805,0.38579192757606506,2023-09-04 22:11:08.404201,2023-09-04 22:11:21.953183,0 days 00:00:13.548982,Leaky,Sigmoid,Leaky,,16,22,19.0,2.0,,0.00012770655105451894,3,247,0.3747025586273169,6.830566450247463e-05,118.72148848931316,COMPLETE
806,0.4408643841743469,2023-09-04 22:11:21.953878,2023-09-04 22:11:26.503762,0 days 00:00:04.549884,Tanh,ReLU,,,24,2,4.0,,,0.0037321893293202385,2,497,0.7064796944021585,0.00012358839177123305,104.11809017783717,COMPLETE
807,0.49784305691719055,2023-09-04 22:11:26.504466,2023-09-04 22:11:28.520993,0 days 00:00:02.016527,Tanh,,,,19,23,,,,0.0001821909649763344,1,220,0.12792031106134208,0.000161687022123186,104.1424096882014,COMPLETE
808,0.28016048669815063,2023-09-04 22:11:28.521662,2023-09-04 22:11:29.827928,0 days 00:00:01.306266,Tanh,Tanh,,,49,21,6.0,,,0.013360030401284926,2,346,0.773228562847429,2.9391336752562335e-05,113.66523003578186,COMPLETE
809,0.27120110392570496,2023-09-04 22:11:29.828649,2023-09-04 22:11:31.051974,0 days 00:00:01.223325,Tanh,Tanh,,,49,21,6.0,,,0.012809807531158696,2,76,0.7680290609658114,2.8906165953365366e-05,107.99973907470704,COMPLETE
810,0.2585863471031189,2023-09-04 22:11:31.052645,2023-09-04 22:11:33.887197,0 days 00:00:02.834552,Tanh,Tanh,,,49,21,7.0,,,0.008995436742251405,2,81,0.7714232655154248,3.621624935029101e-05,105.16460057851431,COMPLETE
811,0.37841448187828064,2023-09-04 22:11:33.887928,2023-09-04 22:11:34.917488,0 days 00:00:01.029560,Sigmoid,Tanh,,,48,21,7.0,,,0.00958171826657289,2,70,0.2629803568077575,3.473120306931781e-05,118.10613381522042,COMPLETE
812,0.35835760831832886,2023-09-04 22:11:34.918162,2023-09-04 22:11:36.155504,0 days 00:00:01.237342,Tanh,Tanh,,,49,21,7.0,,,0.0069866720839245,2,79,0.33447919407845056,2.8349147360230805e-05,119.34649978858837,COMPLETE
813,0.35567954182624817,2023-09-04 22:11:36.156200,2023-09-04 22:11:36.510429,0 days 00:00:00.354229,ReLU,Tanh,,,50,20,6.0,,,0.00860347647838215,2,79,0.14107998916041986,3.3689576668245615e-05,127.54011009479392,COMPLETE
814,0.3531213402748108,2023-09-04 22:11:36.511126,2023-09-04 22:11:37.239169,0 days 00:00:00.728043,Tanh,Tanh,,,47,20,6.0,,,0.010778786355463707,2,60,0.20090680608990819,4.003288780221764e-05,108.41568689179002,COMPLETE
815,0.3346809148788452,2023-09-04 22:11:37.239872,2023-09-04 22:11:39.133994,0 days 00:00:01.894122,Tanh,Tanh,,,45,21,7.0,,,0.008980222332485112,2,86,0.7658615474641061,2.7222341663510355e-05,104.02361619737414,COMPLETE
816,0.31772613525390625,2023-09-04 22:11:39.134702,2023-09-04 22:11:40.915263,0 days 00:00:01.780561,Tanh,Tanh,,,47,21,6.0,,,0.012240603388703114,2,74,0.797304884351354,4.620864734040457e-05,104.76127518055051,COMPLETE
817,0.37257927656173706,2023-09-04 22:11:40.915950,2023-09-04 22:11:43.115474,0 days 00:00:02.199524,Tanh,Tanh,,,46,20,7.0,,,0.01088041875904754,2,83,0.7435988009485249,0.010171735072852246,128.3150611604963,COMPLETE
818,0.3503108322620392,2023-09-04 22:11:43.116201,2023-09-04 22:11:44.235880,0 days 00:00:01.119679,Leaky,Tanh,,,43,21,6.0,,,0.007396737557669482,2,64,0.7735824554852068,0.05907117843695791,116.05784893035889,COMPLETE
819,0.35065534710884094,2023-09-04 22:11:44.236565,2023-09-04 22:11:45.047627,0 days 00:00:00.811062,Tanh,Tanh,,,53,21,5.0,,,0.008736921595708703,2,90,0.3934336078937919,4.0718136138675235e-05,132.2834817010003,COMPLETE
820,0.2310483306646347,2023-09-04 22:11:45.048335,2023-09-04 22:11:47.030461,0 days 00:00:01.982126,ReLU,Tanh,,,53,21,6.0,,,0.013915456566821404,2,73,0.7288666923746231,2.4505346099395413e-05,137.6328194601494,COMPLETE
821,0.3488060534000397,2023-09-04 22:11:47.031140,2023-09-04 22:11:47.961898,0 days 00:00:00.930758,ReLU,Tanh,,,49,20,5.0,,,0.013901689814615674,2,64,0.7986884416687489,0.008253382326761857,111.72332800002326,COMPLETE
822,0.6780087947845459,2023-09-04 22:11:47.962602,2023-09-04 22:11:50.417431,0 days 00:00:02.454829,ReLU,Tanh,,,54,22,7.0,,,3.5714675844827555e-05,2,71,0.7368158366755932,2.536047101609885e-05,97.50897055612484,COMPLETE
823,0.3017198145389557,2023-09-04 22:11:50.418127,2023-09-04 22:11:52.488575,0 days 00:00:02.070448,ReLU,Tanh,,,51,21,6.0,,,0.010471912841426203,2,58,0.7568559875577733,2.268889447073637e-05,95.59110953591086,COMPLETE
824,0.4485433101654053,2023-09-04 22:11:52.489251,2023-09-04 22:11:52.986386,0 days 00:00:00.497135,ReLU,Tanh,,,51,20,6.0,,,0.0013833900322274572,2,66,0.10245739242250661,3.182295806579664e-05,200.3993271336411,COMPLETE
825,0.32202357053756714,2023-09-04 22:11:52.987063,2023-09-04 22:11:54.871353,0 days 00:00:01.884290,ReLU,Tanh,,,51,21,6.0,,,0.006117726958227337,2,80,0.724052920696549,2.4724886828124613e-05,105.63614438614755,COMPLETE
826,0.3802196681499481,2023-09-04 22:11:54.872038,2023-09-04 22:11:55.256730,0 days 00:00:00.384692,ReLU,Tanh,,,53,19,7.0,,,0.0076805495836373885,2,75,0.14902079334405244,2.8662352830748665e-05,126.40297555923462,COMPLETE
827,0.3654250502586365,2023-09-04 22:11:55.257448,2023-09-04 22:11:56.062491,0 days 00:00:00.805043,ReLU,Tanh,,,55,22,7.0,,,0.012815131486308138,2,57,0.3186706171289933,1.983031607954675e-05,101.27868469901706,COMPLETE
828,0.2922239303588867,2023-09-04 22:11:56.063178,2023-09-04 22:11:58.442022,0 days 00:00:02.378844,ReLU,Tanh,,,52,20,6.0,,,0.004916803201097651,2,75,0.7740209881800788,3.5749188631198416e-05,89.06413972377777,COMPLETE
829,0.35912832617759705,2023-09-04 22:11:58.442719,2023-09-04 22:11:59.718396,0 days 00:00:01.275677,ReLU,,,,47,21,,,,0.009877983818683182,1,73,0.73959830265504,0.0010125820259294666,94.19064979553222,COMPLETE
830,0.3097360134124756,2023-09-04 22:11:59.719054,2023-09-04 22:12:00.873976,0 days 00:00:01.154922,ReLU,Tanh,,,49,21,5.0,,,0.016048287814158745,2,59,0.7722406577832303,0.007477476521021508,108.94893046787807,COMPLETE
831,0.36068686842918396,2023-09-04 22:12:00.874652,2023-09-04 22:12:01.772634,0 days 00:00:00.897982,ReLU,Tanh,Sigmoid,ReLU,45,22,6.0,10.0,16.0,0.011564302328253359,4,82,0.3672852308575592,2.0263512096251775e-05,121.636536189488,COMPLETE
832,0.3240562975406647,2023-09-04 22:12:01.773352,2023-09-04 22:12:02.484512,0 days 00:00:00.711160,ReLU,Tanh,,,52,21,5.0,,,0.005731047893999974,2,71,0.24016869372313737,3.087429679814758e-05,300.93543282201733,COMPLETE
833,0.38741010427474976,2023-09-04 22:12:02.484941,2023-09-04 22:12:03.558639,0 days 00:00:01.073698,ReLU,Tanh,,,53,19,7.0,,,0.0004654829055900969,2,90,0.7108398712055736,0.00553721096927776,90.01895718044705,COMPLETE
834,0.3422549068927765,2023-09-04 22:12:03.559008,2023-09-04 22:12:03.971437,0 days 00:00:00.412429,ReLU,Tanh,,,49,20,6.0,,,0.002732714549546292,2,97,0.30882589211446926,3.677477964112729e-05,105.466433244593,COMPLETE
835,0.358775794506073,2023-09-04 22:12:03.971840,2023-09-04 22:12:04.196736,0 days 00:00:00.224896,ReLU,,,,46,22,,,,0.008447742069581661,1,64,0.3513847248126403,2.446134848907753e-05,118.73028874397278,COMPLETE
836,0.9159761667251587,2023-09-04 22:12:04.197129,2023-09-04 22:12:04.884489,0 days 00:00:00.687360,Sigmoid,Tanh,,,50,10,8.0,,,1.8072234597422925e-05,2,51,0.799911408472935,0.00032967043932685013,107.44752113491882,COMPLETE
837,0.34667062759399414,2023-09-04 22:12:04.884874,2023-09-04 22:12:05.376092,0 days 00:00:00.491218,ReLU,Tanh,ReLU,Sigmoid,55,21,5.0,7.0,19.0,0.014874082221900108,4,86,0.7416391121800415,0.002323172930486204,103.11848940168109,COMPLETE
838,0.34917956590652466,2023-09-04 22:12:05.376495,2023-09-04 22:12:05.590428,0 days 00:00:00.213933,ReLU,Tanh,,,44,20,6.0,,,0.013027099464142622,2,69,0.2862007866946457,2.236132518744919e-05,119.33720696490744,COMPLETE
839,0.3276206851005554,2023-09-04 22:12:05.590821,2023-09-04 22:12:06.287335,0 days 00:00:00.696514,Leaky,Leaky,,,47,17,5.0,,,0.006841789303987374,2,79,0.7699977516156755,0.0011471021771192291,100.18691802978516,COMPLETE
840,0.3550831377506256,2023-09-04 22:12:06.287709,2023-09-04 22:12:06.866113,0 days 00:00:00.578404,ReLU,,,,50,22,,,,0.004730585937500815,1,50,0.6943910250300709,0.01853523192087442,112.11615783691406,COMPLETE
841,0.40495309233665466,2023-09-04 22:12:06.866487,2023-09-04 22:12:08.081318,0 days 00:00:01.214831,Sigmoid,ReLU,,,54,20,7.0,,,0.001146328494860914,2,99,0.7243173213718528,2.9150026714905316e-05,103.61691315005524,COMPLETE
842,0.4025207459926605,2023-09-04 22:12:08.081697,2023-09-04 22:12:08.277636,0 days 00:00:00.195939,Tanh,Tanh,,,44,21,8.0,,,0.010335668064291178,2,86,0.13150954912355345,1.8434311364995283e-05,115.65111559490825,COMPLETE
843,0.3395289182662964,2023-09-04 22:12:08.278166,2023-09-04 22:12:08.722617,0 days 00:00:00.444451,Tanh,ReLU,ReLU,Leaky,57,21,6.0,5.0,20.0,0.04905101545290093,4,67,0.7549242415046673,4.4296855823099086e-05,80.58546182383661,COMPLETE
844,0.3712650239467621,2023-09-04 22:12:08.723172,2023-09-04 22:12:09.056106,0 days 00:00:00.332934,Tanh,,,,56,20,,,,0.003981780567449674,1,81,0.2424500902697584,0.00037700758839895456,110.97874714415751,COMPLETE
845,0.4232262372970581,2023-09-04 22:12:09.056470,2023-09-04 22:12:09.211109,0 days 00:00:00.154639,Tanh,ReLU,,,52,22,7.0,,,0.016026990783616853,2,92,0.11242458587668096,0.000260813765390993,617.8943765428331,COMPLETE
846,0.28042417764663696,2023-09-04 22:12:09.211526,2023-09-04 22:12:10.206272,0 days 00:00:00.994746,Leaky,Tanh,,,41,21,5.0,,,0.008387643934901245,2,60,0.798233198366538,1.8129607422940402e-05,86.19804598490397,COMPLETE
847,0.3658517301082611,2023-09-04 22:12:10.206753,2023-09-04 22:12:10.551993,0 days 00:00:00.345240,Tanh,ReLU,,,48,22,5.0,,,0.006657549058012407,2,105,0.7511277299865532,0.04729449180301425,121.68573034377326,COMPLETE
848,0.39798256754875183,2023-09-04 22:12:10.552359,2023-09-04 22:12:10.683724,0 days 00:00:00.131365,ReLU,,,,59,20,,,,0.003372708303026314,1,66,0.1740641189014198,4.0074413814773385e-05,207.8459733532321,COMPLETE
849,0.37597277760505676,2023-09-04 22:12:10.684195,2023-09-04 22:12:10.872809,0 days 00:00:00.188614,Tanh,Tanh,,,42,8,6.0,,,0.01800988614409758,2,191,0.19053961654047644,0.0005082845537821794,255.37340274933845,COMPLETE
850,0.8405164480209351,2023-09-04 22:12:10.873179,2023-09-04 22:12:11.942196,0 days 00:00:01.069017,Tanh,ReLU,,,48,19,4.0,,,2.2580420360763065e-05,2,76,0.7997070767043761,2.622876781712631e-05,119.43202319898103,COMPLETE
851,0.5519481301307678,2023-09-04 22:12:11.942597,2023-09-04 22:12:13.535357,0 days 00:00:01.592760,Tanh,Tanh,Tanh,Sigmoid,45,21,8.0,3.0,17.0,9.296625909187925e-05,4,94,0.6948221267484062,5.1106580282693426e-05,114.28753029031957,COMPLETE
852,0.3406898081302643,2023-09-04 22:12:13.535787,2023-09-04 22:12:14.513963,0 days 00:00:00.978176,Sigmoid,ReLU,,,51,21,6.0,,,0.010484828902917678,2,237,0.727274088455726,3.4295597993694414e-05,114.65013013567243,COMPLETE
853,0.43641549348831177,2023-09-04 22:12:14.514357,2023-09-04 22:12:14.743984,0 days 00:00:00.229627,Tanh,,,,43,22,,,,0.0053460185545506755,1,72,0.7669543861535021,0.0538598347136677,131.1574935913086,COMPLETE
854,0.3997688293457031,2023-09-04 22:12:14.744367,2023-09-04 22:12:14.970099,0 days 00:00:00.225732,ReLU,Leaky,,,40,20,7.0,,,0.002321880467301748,2,227,0.19854545583962713,2.3039354110798133e-05,126.21331861542492,COMPLETE
855,0.43876442313194275,2023-09-04 22:12:14.970479,2023-09-04 22:12:15.188326,0 days 00:00:00.217847,Tanh,Tanh,,,46,11,5.0,,,0.012533093045972504,2,104,0.14984142261114483,1.7196172975564498e-05,257.5365189772386,COMPLETE
856,0.33048444986343384,2023-09-04 22:12:15.188732,2023-09-04 22:12:15.917539,0 days 00:00:00.728807,Tanh,ReLU,Sigmoid,ReLU,50,21,6.0,12.0,14.0,0.007718756389651637,4,207,0.721780603710606,0.0001995400793709191,123.36846251714798,COMPLETE
857,0.47188663482666016,2023-09-04 22:12:15.917939,2023-09-04 22:12:16.392775,0 days 00:00:00.474836,Tanh,ReLU,,,56,22,5.0,,,0.00016485992607310964,2,115,0.22288667268770765,5.09282835676562e-05,176.56625127377717,COMPLETE
858,0.43599623441696167,2023-09-04 22:12:16.393163,2023-09-04 22:12:16.522156,0 days 00:00:00.128993,Tanh,Tanh,,,54,20,7.0,,,0.015089282165365097,2,81,0.11722767597320415,0.000597343411228177,130.43282687279486,COMPLETE
859,0.4493464231491089,2023-09-04 22:12:16.522536,2023-09-04 22:12:16.814220,0 days 00:00:00.291684,Leaky,,,,39,19,,,,0.057846110209201586,1,218,0.6779276986136764,0.09220433291604015,114.04337907874066,COMPLETE
860,0.357628732919693,2023-09-04 22:12:16.814602,2023-09-04 22:12:17.093986,0 days 00:00:00.279384,ReLU,ReLU,,,42,21,4.0,,,0.009051769675495326,2,92,0.35301339478208665,3.066101882597485e-05,104.49390769004822,COMPLETE
861,0.49371567368507385,2023-09-04 22:12:17.094408,2023-09-04 22:12:17.549038,0 days 00:00:00.454630,Tanh,Tanh,,,38,22,4.0,,,0.0006401255841605557,2,182,0.16891038006089037,0.06144729003971934,120.10881853970615,COMPLETE
