number,value,datetime_start,datetime_complete,duration,params_activation1,params_activation2,params_activation3,params_activation4,params_batch_size,params_fl1,params_fl2,params_fl3,params_fl4,params_learning_rate,params_n_layers,params_num_epochs,params_train_size,params_weight_decay,user_attrs_mre,state
743,0.47587695717811584,2023-09-04 21:38:43.979826,2023-09-04 21:38:47.554833,0 days 00:00:03.575007,Sigmoid,Tanh,Tanh,,56,20,22.0,24.0,,0.0004241356652111252,3,172,0.3826746577940199,2.625874403653035e-05,140.216103930806,COMPLETE
744,0.4647952914237976,2023-09-04 21:38:47.555530,2023-09-04 21:38:48.342087,0 days 00:00:00.786557,ReLU,Leaky,Leaky,,38,19,11.0,10.0,,0.0020746382059827605,3,236,0.13116674037191225,1.7303003854798293e-05,141.93900726780748,COMPLETE
745,0.3342672884464264,2023-09-04 21:38:48.342769,2023-09-04 21:38:49.812735,0 days 00:00:01.469966,Tanh,ReLU,Sigmoid,,34,21,14.0,23.0,,0.005691582615656735,3,183,0.36257750817614076,6.137485181354351e-05,242.67293629747755,COMPLETE
746,1.0019797086715698,2023-09-04 21:38:49.813419,2023-09-04 21:38:54.004663,0 days 00:00:04.191244,ReLU,Leaky,Leaky,Sigmoid,41,20,23.0,8.0,6.0,3.7580588918130444e-05,4,280,0.17802714889648885,0.00024051157815843953,110.75879309517997,COMPLETE
747,0.5318149924278259,2023-09-04 21:38:54.005378,2023-09-04 21:38:58.506294,0 days 00:00:04.500916,Sigmoid,Tanh,ReLU,,36,20,8.0,11.0,,0.001193734441875706,3,227,0.2513167509964909,0.0008773083146741819,150.4424877754917,COMPLETE
748,0.3146713376045227,2023-09-04 21:38:58.506993,2023-09-04 21:39:00.400581,0 days 00:00:01.893588,ReLU,Leaky,Leaky,,45,16,24.0,23.0,,0.011320569476357772,3,241,0.6255426735642508,3.234472837170533e-05,130.5426824818487,COMPLETE
749,0.6359843015670776,2023-09-04 21:39:00.401281,2023-09-04 21:39:01.062571,0 days 00:00:00.661290,ReLU,Leaky,Sigmoid,,32,15,21.0,9.0,,0.00846563815758625,3,190,0.10153788816192048,0.00802696422331154,277.5365724407259,COMPLETE
750,0.3090692162513733,2023-09-04 21:39:01.063273,2023-09-04 21:39:03.690799,0 days 00:00:02.627526,Sigmoid,Leaky,Tanh,,30,22,22.0,22.0,,0.004823106341665361,3,313,0.46044631755878834,3.967712837394642e-05,336.5677766345796,COMPLETE
751,0.5070191025733948,2023-09-04 21:39:03.691507,2023-09-04 21:39:05.521868,0 days 00:00:01.830361,Tanh,ReLU,Leaky,,39,18,17.0,13.0,,0.017349300187010315,3,205,0.2030276171635976,0.05629452997898282,158.45162828833656,COMPLETE
752,0.590336799621582,2023-09-04 21:39:05.522582,2023-09-04 21:39:18.821916,0 days 00:00:13.299334,ReLU,Tanh,Sigmoid,,42,21,13.0,9.0,,2.3271297424617908e-05,3,258,0.799953308803948,2.3742543988817832e-05,187.11236915292665,COMPLETE
753,0.40135467052459717,2023-09-04 21:39:18.822625,2023-09-04 21:39:20.588696,0 days 00:00:01.766071,Leaky,Leaky,Leaky,,37,19,20.0,16.0,,0.013504316415557889,3,216,0.4691879178054361,0.013429887115073695,262.10396093251757,COMPLETE
754,0.3978962004184723,2023-09-04 21:39:20.589401,2023-09-04 21:39:23.298139,0 days 00:00:02.708738,ReLU,Leaky,ReLU,,34,20,23.0,10.0,,0.0033694698012375094,3,268,0.3172386758085945,0.0026113012917299344,135.3336037280513,COMPLETE
755,0.5169045925140381,2023-09-04 21:39:23.298896,2023-09-04 21:39:42.119316,0 days 00:00:18.820420,Sigmoid,Leaky,Leaky,,24,17,19.0,8.0,,0.00010135150438793897,3,248,0.7429864182540453,4.809648414292687e-05,233.6325628526749,COMPLETE
756,0.28457218408584595,2023-09-04 21:39:42.120042,2023-09-04 21:39:44.114676,0 days 00:00:01.994634,ReLU,Tanh,Tanh,,47,22,22.0,22.0,,0.0069352615329604204,3,335,0.6864656975247523,9.098771499056587e-05,408.1858374554178,COMPLETE
757,0.41402554512023926,2023-09-04 21:39:44.115392,2023-09-04 21:39:49.302452,0 days 00:00:05.187060,ReLU,Leaky,Sigmoid,,27,19,20.0,12.0,,0.0014288714245758235,3,229,0.7536122437339445,0.0004517346997771644,542.2574368829596,COMPLETE
758,0.5266484618186951,2023-09-04 21:39:49.303150,2023-09-04 21:39:55.438362,0 days 00:00:06.135212,Sigmoid,Sigmoid,Leaky,,67,21,21.0,24.0,,0.0003420783519418372,3,183,0.7182335702222323,0.00011282832050526542,1153.0746028045487,COMPLETE
759,0.3190346658229828,2023-09-04 21:39:55.439051,2023-09-04 21:39:56.964185,0 days 00:00:01.525134,Tanh,ReLU,Leaky,,36,20,22.0,21.0,,0.0582269107958671,3,197,0.6616508793628259,1.4462405722986013e-05,170.1666364998653,COMPLETE
760,0.26641684770584106,2023-09-04 21:39:56.964878,2023-09-04 21:39:59.944897,0 days 00:00:02.980019,ReLU,Leaky,Sigmoid,,32,21,23.0,23.0,,0.00971976198306774,3,239,0.7706326480681738,6.667707454106412e-05,197.48391624118972,COMPLETE
761,0.898354172706604,2023-09-04 21:39:59.945610,2023-09-04 21:40:04.074045,0 days 00:00:04.128435,Sigmoid,Tanh,Leaky,,39,20,21.0,8.0,,1.1976786250893814e-05,3,172,0.3314784633860788,5.4194521341567935e-05,106.00165624396746,COMPLETE
762,0.5181474685668945,2023-09-04 21:40:04.074760,2023-09-04 21:40:16.834537,0 days 00:00:12.759777,ReLU,Leaky,ReLU,,43,19,20.0,11.0,,4.461309908396155e-05,3,287,0.7038130160107938,3.067515639148926e-05,275.20070486035496,COMPLETE
763,0.3058231472969055,2023-09-04 21:40:16.835241,2023-09-04 21:40:19.336439,0 days 00:00:02.501198,ReLU,Leaky,Leaky,,29,18,22.0,10.0,,0.025615593699571563,3,222,0.7374922919565814,2.1092438069568295e-05,141.29723461254224,COMPLETE
764,0.5741273760795593,2023-09-04 21:40:19.337152,2023-09-04 21:40:27.843233,0 days 00:00:08.506081,Sigmoid,Leaky,Tanh,,34,13,19.0,6.0,,5.580379257119977e-05,3,254,0.42941310881141687,3.8794816809930506e-05,150.09319789015402,COMPLETE
765,0.5931740999221802,2023-09-04 21:40:27.843961,2023-09-04 21:40:31.489846,0 days 00:00:03.645885,Tanh,ReLU,Sigmoid,,41,21,21.0,7.0,,0.0024653831130931184,3,161,0.7675313709036605,0.023721410119635907,227.22062672206334,COMPLETE
766,0.24794892966747284,2023-09-04 21:40:31.490548,2023-09-04 21:40:41.840029,0 days 00:00:10.349481,ReLU,Tanh,Leaky,,37,20,20.0,22.0,,0.0007653021904321708,3,209,0.7748813646700214,0.00016281020085389804,273.3811985138924,COMPLETE
767,0.3155255913734436,2023-09-04 21:40:41.840736,2023-09-04 21:40:44.473554,0 days 00:00:02.632818,Leaky,Tanh,Leaky,,36,20,20.0,22.0,,0.00057069136185892,3,208,0.7987165224326117,0.00020380246561378884,166.16104196947674,COMPLETE
768,0.22522464394569397,2023-09-04 21:40:44.474278,2023-09-04 21:40:50.434447,0 days 00:00:05.960169,ReLU,Leaky,Leaky,,34,20,19.0,22.0,,0.0009481456140834308,3,210,0.7714293213450967,0.00015541470876495996,1024.4247826645055,COMPLETE
769,0.29025334119796753,2023-09-04 21:40:50.435150,2023-09-04 21:40:57.305606,0 days 00:00:06.870456,ReLU,Leaky,Leaky,,33,19,19.0,22.0,,0.0008825663812141184,3,205,0.7685074477138549,0.00016159693493909683,262.62672903685444,COMPLETE
770,0.4149322807788849,2023-09-04 21:40:57.306309,2023-09-04 21:41:00.852977,0 days 00:00:03.546668,ReLU,Leaky,Leaky,,34,20,18.0,22.0,,0.0009593703776553279,3,209,0.7990167373828291,0.0001547887254249008,132.9022388458252,COMPLETE
771,0.39334678649902344,2023-09-04 21:41:00.853667,2023-09-04 21:41:03.002173,0 days 00:00:02.148506,ReLU,Leaky,Leaky,,32,19,18.0,21.0,,0.000707272259915329,3,214,0.21271491496906,0.00016982125369111622,132.37383952183006,COMPLETE
772,0.5275200605392456,2023-09-04 21:41:03.002889,2023-09-04 21:41:04.648321,0 days 00:00:01.645432,ReLU,Leaky,Leaky,,31,20,18.0,22.0,,0.0008901685814666644,3,200,0.15316387589287345,0.00015168177079803995,120.92202699080758,COMPLETE
773,0.31611835956573486,2023-09-04 21:41:04.649107,2023-09-04 21:41:06.547055,0 days 00:00:01.897948,ReLU,Leaky,Leaky,,35,20,19.0,22.0,,0.0030213861149746587,3,216,0.770646560609543,0.00018391289242631985,176.71542555286038,COMPLETE
774,0.3062843382358551,2023-09-04 21:41:06.547768,2023-09-04 21:41:10.168309,0 days 00:00:03.620541,ReLU,Leaky,Leaky,,33,19,19.0,21.0,,0.0008296909560858856,3,194,0.7443536527638603,0.00012410044317798596,126.92452761332194,COMPLETE
775,0.47180718183517456,2023-09-04 21:41:10.169019,2023-09-04 21:41:11.347840,0 days 00:00:01.178821,ReLU,Leaky,Leaky,,30,20,19.0,23.0,,0.0006981107281561278,3,205,0.11319106916922686,0.00023030233246954605,241.350690546724,COMPLETE
776,0.23604105412960052,2023-09-04 21:41:11.348543,2023-09-04 21:41:15.694980,0 days 00:00:04.346437,ReLU,Leaky,Leaky,,35,19,20.0,22.0,,0.0011385701638210316,3,192,0.7731860271248338,0.00015009810779447182,111.88996772243551,COMPLETE
777,0.3553970456123352,2023-09-04 21:41:15.695677,2023-09-04 21:41:18.338202,0 days 00:00:02.642525,ReLU,Leaky,Leaky,,35,18,19.0,21.0,,0.0010058721851200832,3,199,0.3005233613052383,0.00014270343061352457,137.22271832552823,COMPLETE
778,0.3570390045642853,2023-09-04 21:41:18.338900,2023-09-04 21:41:19.807989,0 days 00:00:01.469089,ReLU,Leaky,Leaky,,37,19,19.0,22.0,,0.0010556423045956036,3,218,0.22999705179230187,0.00013297048793353672,154.32538604736328,COMPLETE
779,0.34159475564956665,2023-09-04 21:41:19.808695,2023-09-04 21:41:22.091227,0 days 00:00:02.282532,ReLU,Leaky,Leaky,,36,19,20.0,22.0,,0.001565601212531502,3,212,0.743975316688955,0.00011933107631132449,158.2548641204834,COMPLETE
780,0.287070095539093,2023-09-04 21:41:22.091941,2023-09-04 21:41:26.380762,0 days 00:00:04.288821,ReLU,Leaky,Leaky,,35,19,20.0,21.0,,0.0012715132579586624,3,192,0.7733224603396077,0.0001917902984723116,135.04599708980984,COMPLETE
781,0.5826126337051392,2023-09-04 21:41:26.381484,2023-09-04 21:41:28.874467,0 days 00:00:02.492983,ReLU,Leaky,Leaky,,37,18,18.0,22.0,,0.0006265874112865146,3,208,0.7314901355284902,0.08719051939508297,168.90730523003472,COMPLETE
782,0.42721226811408997,2023-09-04 21:41:28.875175,2023-09-04 21:41:30.213744,0 days 00:00:01.338569,ReLU,Leaky,Leaky,,34,19,20.0,21.0,,0.001149142023591464,3,199,0.18580657997281533,0.0035176346871593623,189.664624190912,COMPLETE
783,0.4579493999481201,2023-09-04 21:41:30.214451,2023-09-04 21:41:31.074145,0 days 00:00:00.859694,ReLU,Leaky,Leaky,,36,18,20.0,22.0,,0.0015866184163794807,3,222,0.11917568957216884,0.001210331171356351,264.15810112104026,COMPLETE
784,0.29562845826148987,2023-09-04 21:41:31.074883,2023-09-04 21:41:40.535479,0 days 00:00:09.460596,ReLU,Leaky,Leaky,,34,19,19.0,21.0,,0.0006448541754755071,3,210,0.7717782415276987,1.815744923313429e-05,106.21346100621254,COMPLETE
785,0.38873565196990967,2023-09-04 21:41:40.536189,2023-09-04 21:41:42.768194,0 days 00:00:02.232005,ReLU,Tanh,Leaky,,38,20,19.0,22.0,,0.0007649479987472281,3,188,0.24158478515824705,1.1981256770245207e-05,328.70272941589354,COMPLETE
786,0.4195152521133423,2023-09-04 21:41:42.768922,2023-09-04 21:41:49.515796,0 days 00:00:06.746874,ReLU,ReLU,Leaky,,33,20,20.0,22.0,,0.0007485912072872221,3,203,0.50513159982556,0.02070948272167594,175.93357304164343,COMPLETE
787,0.3942611515522003,2023-09-04 21:41:49.516512,2023-09-04 21:41:51.280428,0 days 00:00:01.763916,ReLU,Leaky,Leaky,,37,19,20.0,21.0,,0.0011535777751666837,3,198,0.21767976531049318,2.4711161166722398e-05,117.05634240543141,COMPLETE
788,0.3997710943222046,2023-09-04 21:41:51.281131,2023-09-04 21:42:00.720728,0 days 00:00:09.439597,ReLU,Leaky,Leaky,,35,17,19.0,23.0,,0.0008627905289946552,3,219,0.7428314649438761,0.024343695669419567,442.55154874032,COMPLETE
789,0.37021932005882263,2023-09-04 21:42:00.721465,2023-09-04 21:42:06.393274,0 days 00:00:05.671809,ReLU,Tanh,Leaky,,33,18,18.0,22.0,,0.0013018420297194236,3,213,0.7995424356274069,0.00100329096745348,161.48700585526026,COMPLETE
790,0.6703795194625854,2023-09-04 21:42:06.393997,2023-09-04 21:42:16.151295,0 days 00:00:09.757298,ReLU,Leaky,Leaky,,37,20,19.0,4.0,,2.0411482424497904e-05,3,193,0.7072291742088751,0.005629676247202278,131.55150667496915,COMPLETE
791,0.36437878012657166,2023-09-04 21:42:16.152062,2023-09-04 21:42:23.343322,0 days 00:00:07.191260,ReLU,Leaky,Leaky,,35,19,24.0,21.0,,0.0005015391734443464,3,225,0.522173611215577,0.0001154268551758333,202.87947247823078,COMPLETE
792,0.37659284472465515,2023-09-04 21:42:23.344034,2023-09-04 21:42:27.459741,0 days 00:00:04.115707,ReLU,ReLU,Leaky,,32,20,17.0,22.0,,0.0005704749896026974,3,179,0.7481964370323931,0.011143758382370576,254.45043922538187,COMPLETE
793,0.49708297848701477,2023-09-04 21:42:27.460468,2023-09-04 21:42:29.107309,0 days 00:00:01.646841,ReLU,Leaky,Leaky,,37,18,5.0,23.0,,0.0004834507323939696,3,203,0.17903271616323294,0.0019535673576349484,1180.1663035164893,COMPLETE
794,0.3491520285606384,2023-09-04 21:42:29.108009,2023-09-04 21:42:32.882919,0 days 00:00:03.774910,ReLU,Tanh,,,38,20,20.0,,,0.001993178765302842,2,188,0.7700309039477267,0.0024034813101590762,205.8439318028892,COMPLETE
795,0.44171762466430664,2023-09-04 21:42:32.883608,2023-09-04 21:42:35.671195,0 days 00:00:02.787587,ReLU,Leaky,Leaky,,35,19,20.0,22.0,,0.00024242674560384197,3,216,0.15872602171164632,0.06449924004227564,148.26749554386845,COMPLETE
796,0.29106417298316956,2023-09-04 21:42:35.671938,2023-09-04 21:42:39.071811,0 days 00:00:03.399873,ReLU,Leaky,Tanh,,33,20,20.0,20.0,,0.0016874116679228837,3,301,0.7212926632212777,0.0002603793046790102,245.45567479626885,COMPLETE
797,0.3002292513847351,2023-09-04 21:42:39.072511,2023-09-04 21:42:43.500038,0 days 00:00:04.427527,ReLU,Leaky,Leaky,,54,19,24.0,21.0,,0.0007887569381258234,3,225,0.5315428533485502,2.9319566133792215e-05,110.81931320089379,COMPLETE
798,0.34607186913490295,2023-09-04 21:42:43.500745,2023-09-04 21:42:47.940983,0 days 00:00:04.440238,ReLU,Tanh,Leaky,,31,18,21.0,7.0,,0.0010690875321332494,3,324,0.7698084671355129,0.00013978756460566972,184.23666067684397,COMPLETE
799,0.3795236349105835,2023-09-04 21:42:47.941697,2023-09-04 21:42:52.559411,0 days 00:00:04.617714,ReLU,ReLU,Leaky,,39,20,20.0,23.0,,0.0006266961114102917,3,207,0.411376973870377,0.008720898724397663,148.744207239151,COMPLETE
800,0.4079452455043793,2023-09-04 21:42:52.560131,2023-09-04 21:42:57.033271,0 days 00:00:04.473140,ReLU,Leaky,Leaky,,36,19,23.0,22.0,,0.00014500756808793854,3,134,0.44604856561938744,0.00010014789543051702,239.71213349299646,COMPLETE
801,0.4542364180088043,2023-09-04 21:42:57.033984,2023-09-04 21:42:59.651305,0 days 00:00:02.617321,ReLU,Leaky,Tanh,,34,20,21.0,8.0,,0.00226952188402476,3,190,0.3444657777188671,0.04448893504333178,280.95193741347765,COMPLETE
802,0.2891339957714081,2023-09-04 21:42:59.652212,2023-09-04 21:43:07.076121,0 days 00:00:07.423909,ReLU,Leaky,Leaky,,38,21,19.0,23.0,,0.00046159214925351556,3,180,0.7200587412213543,3.406921281887521e-05,277.5122455465383,COMPLETE
803,0.2848764657974243,2023-09-04 21:43:07.076850,2023-09-04 21:43:18.512706,0 days 00:00:11.435856,Leaky,Tanh,Leaky,,29,20,12.0,21.0,,0.0003760509276899804,3,214,0.7498733501550168,2.4110614615532975e-05,148.27830860532563,COMPLETE
804,0.3207867741584778,2023-09-04 21:43:18.513397,2023-09-04 21:43:23.019250,0 days 00:00:04.505853,ReLU,Leaky,Leaky,Leaky,32,19,21.0,22.0,14.0,0.0012874465932230102,4,226,0.5937951144819441,0.0001931094935249557,186.38556172297552,COMPLETE
805,0.32133010029792786,2023-09-04 21:43:23.019990,2023-09-04 21:43:28.841972,0 days 00:00:05.821982,ReLU,ReLU,Leaky,,36,6,20.0,8.0,,0.0027202007364850738,3,314,0.7741122084472435,0.0007000343291503257,185.64448221447398,COMPLETE
806,0.5253897905349731,2023-09-04 21:43:28.842693,2023-09-04 21:43:32.074741,0 days 00:00:03.232048,ReLU,Leaky,Tanh,,34,18,21.0,23.0,,0.0009284751560344174,3,200,0.6905799277973893,0.09851823849510503,267.8508416537581,COMPLETE
807,0.2983410358428955,2023-09-04 21:43:32.075443,2023-09-04 21:43:46.342164,0 days 00:00:14.266721,ReLU,Tanh,Leaky,,31,21,22.0,22.0,,0.00029352680675856393,3,234,0.7370059439303513,0.0005570145802765216,138.51394845685388,COMPLETE
808,0.27854815125465393,2023-09-04 21:43:46.342859,2023-09-04 21:43:49.405716,0 days 00:00:03.062857,ReLU,Leaky,Leaky,,21,19,23.0,20.0,,0.0036848995504342964,3,172,0.7978688533773227,0.00016639670252314716,192.28512382507324,COMPLETE
809,1.0886881351470947,2023-09-04 21:43:49.406425,2023-09-04 21:43:52.679101,0 days 00:00:03.272676,ReLU,Leaky,Leaky,,39,8,19.0,8.0,,1.4802828750244027e-05,3,217,0.2012408598698116,0.006324089060379846,129.39497941540134,COMPLETE
810,0.486594021320343,2023-09-04 21:43:52.679815,2023-09-04 21:43:54.005028,0 days 00:00:01.325213,ReLU,Leaky,Leaky,,37,17,9.0,7.0,,0.0018859659447508603,3,109,0.14066554948030283,0.007617217002140883,240.15207693311902,COMPLETE
811,0.46083319187164307,2023-09-04 21:43:54.005735,2023-09-04 21:44:01.784239,0 days 00:00:07.778504,Leaky,Tanh,Leaky,,28,20,20.0,9.0,,0.00010303458426690473,3,230,0.36606535776013704,0.0016115236260399195,320.2612333878227,COMPLETE
812,0.45407867431640625,2023-09-04 21:44:01.784947,2023-09-04 21:44:02.545732,0 days 00:00:00.760785,ReLU,ReLU,Tanh,,33,21,21.0,21.0,,0.00097977865815492,3,195,0.12077430463904396,1.589295729469623e-05,230.21247408466954,COMPLETE
813,0.8975211977958679,2023-09-04 21:44:02.546459,2023-09-04 21:44:06.265829,0 days 00:00:03.719370,ReLU,Leaky,Leaky,,35,20,23.0,5.0,,2.8905006066017204e-05,3,143,0.3361405969645206,0.06008888276327712,138.44911626002173,COMPLETE
814,0.44471275806427,2023-09-04 21:44:06.266557,2023-09-04 21:44:07.691998,0 days 00:00:01.425441,ReLU,Leaky,Leaky,,31,18,22.0,23.0,,0.0007479913860461222,3,209,0.12872727594068512,2.084722325934174e-05,157.02961773342557,COMPLETE
815,0.300658643245697,2023-09-04 21:44:07.692700,2023-09-04 21:44:13.007521,0 days 00:00:05.314821,ReLU,Leaky,Tanh,,39,21,21.0,22.0,,0.0005362926231081049,3,331,0.7993105792964179,0.00031756005973603615,149.29558258056642,COMPLETE
816,0.3462926745414734,2023-09-04 21:44:13.008230,2023-09-04 21:44:15.065808,0 days 00:00:02.057578,ReLU,Tanh,Leaky,,36,19,24.0,9.0,,0.0038314058825708185,3,185,0.40299773745661516,0.004743124730772863,259.68294763565063,COMPLETE
817,0.4081970453262329,2023-09-04 21:44:15.066661,2023-09-04 21:44:16.706897,0 days 00:00:01.640236,ReLU,Leaky,,,33,11,16.0,,,0.0016543429644442047,2,98,0.22968913943751132,2.8112718619689794e-05,211.80973006267936,COMPLETE
818,0.46120232343673706,2023-09-04 21:44:16.707610,2023-09-04 21:44:17.577849,0 days 00:00:00.870239,ReLU,ReLU,Leaky,,26,20,20.0,23.0,,0.0030287029130306523,3,163,0.1485327730674265,0.0031511002211779314,180.18422349294028,COMPLETE
819,0.6046028733253479,2023-09-04 21:44:17.578559,2023-09-04 21:44:18.242360,0 days 00:00:00.663801,ReLU,Leaky,Leaky,,38,20,22.0,22.0,,0.013136682252619946,3,224,0.7125095224412888,0.08334690126307717,277.2952407836914,COMPLETE
820,0.3957030773162842,2023-09-04 21:44:18.242744,2023-09-04 21:44:25.758224,0 days 00:00:07.515480,Leaky,Leaky,Leaky,,35,19,21.0,9.0,,8.107280982795061e-05,3,204,0.7500824852233701,0.00022742742948313017,186.56497895483878,COMPLETE
821,0.3993603587150574,2023-09-04 21:44:25.758907,2023-09-04 21:44:26.690530,0 days 00:00:00.931623,ReLU,,,,61,21,,,,0.0011174541730222642,1,352,0.27089987548042144,3.880014593179969e-05,184.1167394802365,COMPLETE
822,0.3206479549407959,2023-09-04 21:44:26.690881,2023-09-04 21:44:27.358833,0 days 00:00:00.667952,ReLU,Tanh,Tanh,,30,20,23.0,8.0,,0.015512969204886573,3,192,0.7612094347380498,0.00014204927565869907,153.26167323671538,COMPLETE
823,0.3489462733268738,2023-09-04 21:44:27.359201,2023-09-04 21:44:27.908725,0 days 00:00:00.549524,ReLU,Leaky,Leaky,,98,18,20.0,23.0,,0.0044772020484666495,3,175,0.5744082988732664,1.360315610597053e-05,153.511070505778,COMPLETE
824,0.38369274139404297,2023-09-04 21:44:27.909103,2023-09-04 21:44:29.261384,0 days 00:00:01.352281,ReLU,Leaky,Leaky,,32,21,7.0,21.0,,0.0013916618805751065,3,308,0.6879934878164422,0.00011147950875762044,914.5200157688089,COMPLETE
825,0.4658287763595581,2023-09-04 21:44:29.261760,2023-09-04 21:44:29.933645,0 days 00:00:00.671885,ReLU,Tanh,Leaky,,40,19,19.0,24.0,,0.07555189958557276,3,126,0.7733827120601162,3.042521139396314e-05,432.35061732700893,COMPLETE
826,0.9390605092048645,2023-09-04 21:44:29.934018,2023-09-04 21:44:30.988878,0 days 00:00:01.054860,ReLU,ReLU,Leaky,,58,20,22.0,7.0,,1.79181185104484e-05,3,216,0.25939442397600315,1.809728633084431e-05,116.92453847108064,COMPLETE
827,0.3986958861351013,2023-09-04 21:44:30.989254,2023-09-04 21:44:31.837828,0 days 00:00:00.848574,ReLU,Leaky,Tanh,,37,21,21.0,8.0,,0.0023261689342327107,3,152,0.7998595094877142,0.000865188871634904,135.71833726836414,COMPLETE
828,0.32909920811653137,2023-09-04 21:44:31.838242,2023-09-04 21:44:32.654526,0 days 00:00:00.816284,Leaky,Leaky,Leaky,,34,17,18.0,20.0,,0.011959535038179724,3,229,0.7217988183399023,3.481537167340136e-05,759.8515908377511,COMPLETE
829,0.3308342397212982,2023-09-04 21:44:32.654939,2023-09-04 21:44:33.285753,0 days 00:00:00.630814,ReLU,Leaky,Leaky,,28,18,19.0,22.0,,0.01694821735556516,3,201,0.47035402914218966,4.281010561134085e-05,139.67333612209413,COMPLETE
830,0.3488079905509949,2023-09-04 21:44:33.286143,2023-09-04 21:44:34.561928,0 days 00:00:01.275785,ReLU,Tanh,Leaky,,36,10,20.0,23.0,,0.0032509235607844733,3,182,0.6693898833786467,9.421830567170641e-05,157.10918406436318,COMPLETE
831,0.46106183528900146,2023-09-04 21:44:34.562318,2023-09-04 21:44:40.971510,0 days 00:00:06.409192,Sigmoid,Leaky,Leaky,,30,20,22.0,24.0,,0.000573574856161787,3,293,0.6224180455957604,0.011577634181686945,170.00863105531724,COMPLETE
832,0.33762216567993164,2023-09-04 21:44:40.971897,2023-09-04 21:44:44.700118,0 days 00:00:03.728221,ReLU,ReLU,Tanh,,39,19,23.0,6.0,,0.0001787861690252782,3,220,0.74374432200102,2.8051778711783244e-05,186.29016089005904,COMPLETE
833,0.5335891842842102,2023-09-04 21:44:44.700499,2023-09-04 21:44:44.864104,0 days 00:00:00.163605,ReLU,Leaky,Leaky,,33,21,21.0,22.0,,0.01989748073096881,3,233,0.10061324080575258,0.003901208127160503,207.94222717285157,COMPLETE
834,0.3126688599586487,2023-09-04 21:44:44.864511,2023-09-04 21:44:46.667494,0 days 00:00:01.802983,Sigmoid,Leaky,Leaky,,14,20,23.0,9.0,,0.011095218359250878,3,209,0.4897145530372451,0.00017180519567692475,133.13532129923502,COMPLETE
835,0.2855443060398102,2023-09-04 21:44:46.667906,2023-09-04 21:44:51.153217,0 days 00:00:04.485311,ReLU,Tanh,Leaky,,35,19,22.0,21.0,,0.0004050225745028083,3,323,0.7188057941308716,2.3693391689497546e-05,208.3446973274494,COMPLETE
