number,value,datetime_start,datetime_complete,duration,params_activation1,params_activation2,params_activation3,params_activation4,params_batch_size,params_fl1,params_fl2,params_fl3,params_fl4,params_learning_rate,params_n_layers,params_num_epochs,params_train_size,params_weight_decay,user_attrs_mre,state
1597,0.35617750883102417,2023-09-04 22:20:09.478480,2023-09-04 22:20:16.494652,0 days 00:00:07.016172,Leaky,Leaky,Leaky,,19,11,8.0,12.0,,8.86184699729432e-05,3,331,0.5753795775023149,4.957286732633733e-05,115.80604328538222,COMPLETE
1598,0.38752785325050354,2023-09-04 22:20:16.495150,2023-09-04 22:20:18.331202,0 days 00:00:01.836052,Leaky,ReLU,Leaky,,14,19,18.0,15.0,,0.012448231685728313,3,350,0.7995291351061121,0.05622795770599204,121.73128568209134,COMPLETE
1599,0.3689729571342468,2023-09-04 22:20:18.331675,2023-09-04 22:20:18.960854,0 days 00:00:00.629179,Leaky,Leaky,ReLU,,12,13,21.0,23.0,,0.018100637813054682,3,363,0.21801927357531187,1.662095300213952e-05,108.39905889410721,COMPLETE
1600,0.3247125744819641,2023-09-04 22:20:18.961355,2023-09-04 22:20:19.885221,0 days 00:00:00.923866,Leaky,Leaky,Leaky,,17,11,12.0,20.0,,0.025184971832971335,3,323,0.6862438894482941,0.0001658136940779916,115.98714955647786,COMPLETE
1601,0.4081157445907593,2023-09-04 22:20:19.885700,2023-09-04 22:20:26.253253,0 days 00:00:06.367553,Leaky,Leaky,Leaky,,19,12,19.0,16.0,,1.146056194959881e-05,3,340,0.46440899805744995,3.230461466925952e-05,102.37410428664263,COMPLETE
1602,0.33467286825180054,2023-09-04 22:20:26.253737,2023-09-04 22:20:27.485307,0 days 00:00:01.231570,Leaky,ReLU,Tanh,,15,12,19.0,14.0,,0.007146738923669159,3,404,0.746267886413952,6.116041469520842e-05,91.25666309225149,COMPLETE
1603,0.3058318793773651,2023-09-04 22:20:27.485830,2023-09-04 22:20:28.596919,0 days 00:00:01.111089,Tanh,Leaky,Leaky,,17,14,10.0,12.0,,0.004716543785464399,3,370,0.5001662110320324,0.0002585742989925772,110.10849494934082,COMPLETE
1604,0.2832596004009247,2023-09-04 22:20:28.597457,2023-09-04 22:20:30.040647,0 days 00:00:01.443190,Tanh,Leaky,Leaky,,19,13,11.0,8.0,,0.010150103649529292,3,310,0.7635804592836056,0.00034974026921829693,111.03246040344239,COMPLETE
1605,0.3764621317386627,2023-09-04 22:20:30.041456,2023-09-04 22:20:42.118471,0 days 00:00:12.077015,Sigmoid,Leaky,Leaky,,16,11,20.0,18.0,,0.0001347915079358097,3,352,0.7170163436111051,0.0006633330320511364,119.70043149861422,COMPLETE
1606,0.41719943284988403,2023-09-04 22:20:42.118952,2023-09-04 22:20:42.640519,0 days 00:00:00.521567,Tanh,Tanh,Leaky,,13,12,18.0,22.0,,0.014670105637324017,3,403,0.16753909852973767,0.01172919426244228,139.73609924316406,COMPLETE
1607,0.36749669909477234,2023-09-04 22:20:42.641029,2023-09-04 22:20:44.626389,0 days 00:00:01.985360,Leaky,Leaky,Leaky,,17,22,19.0,6.0,,0.0009874748423674396,3,335,0.7660821256615706,0.00010212484650529678,103.99536200932094,COMPLETE
1608,0.3252338469028473,2023-09-04 22:20:44.626909,2023-09-04 22:20:46.158236,0 days 00:00:01.531327,Tanh,ReLU,Leaky,,14,11,12.0,7.0,,0.009093905666096407,3,359,0.45627736170001254,0.002947940092995381,101.75612019684355,COMPLETE
1609,0.4184587895870209,2023-09-04 22:20:46.158750,2023-09-04 22:20:46.604584,0 days 00:00:00.445834,Tanh,Leaky,Sigmoid,,18,20,13.0,13.0,,0.011956020029087504,3,371,0.17811765580663108,0.014309693817463824,238.154967145222,COMPLETE
1610,0.4446619749069214,2023-09-04 22:20:46.605092,2023-09-04 22:20:50.563510,0 days 00:00:03.958418,Tanh,Leaky,Leaky,,19,12,20.0,23.0,,2.5446515192308963e-05,3,351,0.27030107277953935,0.00022772621807683793,135.72473546650335,COMPLETE
1611,0.3314325213432312,2023-09-04 22:20:50.564017,2023-09-04 22:20:51.238572,0 days 00:00:00.674555,Tanh,Leaky,Leaky,,15,13,18.0,17.0,,0.08592195147355401,3,398,0.6636388911130859,1.2608998328440634e-05,110.1078177059398,COMPLETE
1612,0.3923061788082123,2023-09-04 22:20:51.239085,2023-09-04 22:20:52.264946,0 days 00:00:01.025861,Leaky,ReLU,ReLU,,10,11,11.0,15.0,,0.05189253299322863,3,365,0.7996450899670169,4.2203738328387424e-05,119.19276762008667,COMPLETE
1613,0.38512125611305237,2023-09-04 22:20:52.265409,2023-09-04 22:20:52.725201,0 days 00:00:00.459792,Tanh,Leaky,Leaky,,20,12,19.0,24.0,,0.005721318690717736,3,317,0.26364693695117014,0.00013151559668525946,118.53954453901811,COMPLETE
1614,0.283005028963089,2023-09-04 22:20:52.725713,2023-09-04 22:20:55.005665,0 days 00:00:02.279952,Tanh,Leaky,Tanh,,22,11,18.0,14.0,,0.001835225442334186,3,340,0.732685473545006,1.110888471797943e-05,113.63511093803073,COMPLETE
1615,0.36912551522254944,2023-09-04 22:20:55.006614,2023-09-04 22:20:58.144824,0 days 00:00:03.138210,Tanh,Leaky,Leaky,,12,14,10.0,7.0,,0.020694918017372953,3,374,0.7020426667850687,0.010250997180725294,124.44296152451459,COMPLETE
1616,0.3245420455932617,2023-09-04 22:20:58.145313,2023-09-04 22:20:59.372497,0 days 00:00:01.227184,Leaky,ReLU,Leaky,,15,22,19.0,8.0,,0.016038734988001877,3,357,0.541756635282941,0.0013243598964782172,104.11450840876653,COMPLETE
1617,0.4258987605571747,2023-09-04 22:20:59.373049,2023-09-04 22:21:03.240991,0 days 00:00:03.867942,Tanh,Leaky,Leaky,,17,24,20.0,9.0,,2.2112834359368374e-05,3,330,0.2374036449457652,0.0004789676653284084,178.86847691391455,COMPLETE
1618,0.3227207362651825,2023-09-04 22:21:03.241480,2023-09-04 22:21:04.722913,0 days 00:00:01.481433,Tanh,Leaky,Leaky,,22,13,12.0,23.0,,0.03391095906277708,3,406,0.7998886329812523,2.287261821883369e-05,110.90232394603973,COMPLETE
1619,0.2603215277194977,2023-09-04 22:21:04.723544,2023-09-04 22:21:07.237574,0 days 00:00:02.514030,Tanh,Leaky,Leaky,,20,12,18.0,16.0,,0.002562148869274273,3,344,0.7470787584131549,0.00020150536433538965,118.58112716674805,COMPLETE
1620,0.34947699308395386,2023-09-04 22:21:07.238485,2023-09-04 22:21:08.834529,0 days 00:00:01.596044,Tanh,ReLU,Leaky,,23,11,18.0,16.0,,0.004532500307398044,3,368,0.33719396683508585,0.00031038550137964406,101.14909172058105,COMPLETE
1621,0.3045627474784851,2023-09-04 22:21:08.835428,2023-09-04 22:21:11.388041,0 days 00:00:02.552613,Tanh,Leaky,Leaky,,20,12,18.0,16.0,,0.0025649815301233107,3,394,0.6219896399713181,0.00025787889237047977,99.32846762917258,COMPLETE
1622,0.38912808895111084,2023-09-04 22:21:11.388549,2023-09-04 22:21:11.941861,0 days 00:00:00.553312,Tanh,Leaky,ReLU,,22,11,18.0,17.0,,0.0013403607584610425,3,358,0.6928327087977416,0.08112732425890114,111.5840700934915,COMPLETE
1623,0.3668918311595917,2023-09-04 22:21:11.942364,2023-09-04 22:21:12.176829,0 days 00:00:00.234465,Tanh,Leaky,Leaky,,23,12,18.0,16.0,,0.005095589290307535,3,348,0.12204394017545803,0.0002078321219726215,135.67399628957114,COMPLETE
1624,0.40159353613853455,2023-09-04 22:21:12.177321,2023-09-04 22:21:12.581322,0 days 00:00:00.404001,Tanh,Tanh,Leaky,,21,11,18.0,17.0,,0.002452173742240576,3,381,0.10565315498412524,0.00023275083251862074,417.60547637939453,COMPLETE
1625,0.27368587255477905,2023-09-04 22:21:12.581812,2023-09-04 22:21:14.463966,0 days 00:00:01.882154,Tanh,Leaky,Tanh,,22,12,19.0,17.0,,0.0032959723338438014,3,364,0.6502552086134523,0.0002853090140477402,95.2811671217827,COMPLETE
1626,0.4133550822734833,2023-09-04 22:21:14.464537,2023-09-04 22:21:14.731202,0 days 00:00:00.266665,Tanh,ReLU,Leaky,,20,12,18.0,16.0,,0.00394317407461478,3,397,0.15474575648188318,0.0001955872161537935,185.8790984380813,COMPLETE
1627,0.316359281539917,2023-09-04 22:21:14.731715,2023-09-04 22:21:17.089365,0 days 00:00:02.357650,Tanh,Leaky,Leaky,,23,11,19.0,16.0,,0.0010173235546630862,3,353,0.7282718059683764,0.00038945812419245355,93.07117314772172,COMPLETE
1628,0.3172488808631897,2023-09-04 22:21:17.089867,2023-09-04 22:21:17.935551,0 days 00:00:00.845684,Tanh,Leaky,Leaky,,20,12,19.0,16.0,,0.0032830789781212602,3,376,0.6940107348215674,5.688978192527893e-05,100.33697715172401,COMPLETE
1629,0.3343678414821625,2023-09-04 22:21:17.936073,2023-09-04 22:21:20.103821,0 days 00:00:02.167748,Tanh,Leaky,Leaky,,19,11,18.0,18.0,,0.002758093290879789,3,411,0.7361216670027361,0.004674143642101716,100.96431788276223,COMPLETE
1630,0.33789312839508057,2023-09-04 22:21:20.104348,2023-09-04 22:21:20.773524,0 days 00:00:00.669176,Tanh,ReLU,Sigmoid,,40,11,18.0,17.0,,0.003619924582295595,3,364,0.2869542663284635,4.043863940396918e-05,399.34397624451435,COMPLETE
1631,0.38777872920036316,2023-09-04 22:21:20.774034,2023-09-04 22:21:31.248833,0 days 00:00:10.474799,Tanh,Leaky,Leaky,,23,23,19.0,16.0,,1.3564961285683398e-05,3,393,0.7487109813665135,0.0002459614489445531,116.29965477863341,COMPLETE
1632,0.3818477988243103,2023-09-04 22:21:31.249413,2023-09-04 22:21:31.790781,0 days 00:00:00.541368,Tanh,Leaky,Leaky,,22,10,19.0,17.0,,0.0014710478219517266,3,345,0.29561428663663997,1.8771150392408024e-05,238.49375719901843,COMPLETE
1633,0.3487357795238495,2023-09-04 22:21:31.791274,2023-09-04 22:21:33.782450,0 days 00:00:01.991176,Tanh,Leaky,Leaky,,12,12,18.0,17.0,,0.001762158034803826,3,387,0.491212285239834,0.0026164335435283686,98.53600226508246,COMPLETE
1634,0.3894899785518646,2023-09-04 22:21:33.782928,2023-09-04 22:21:36.544990,0 days 00:00:02.762062,Tanh,ReLU,ReLU,,20,11,20.0,16.0,,0.0020725997887637466,3,375,0.6750951967872334,0.035113360672938236,136.3368968963623,COMPLETE
1635,0.36320698261260986,2023-09-04 22:21:36.545484,2023-09-04 22:21:38.136628,0 days 00:00:01.591144,Tanh,Leaky,Leaky,,18,12,18.0,17.0,,0.003933820209115099,3,487,0.7042186322766915,0.025381693090194044,105.81949935913086,COMPLETE
1636,0.29374316334724426,2023-09-04 22:21:38.137116,2023-09-04 22:21:39.324812,0 days 00:00:01.187696,Tanh,Leaky,Leaky,,23,12,19.0,8.0,,0.004753297890021923,3,358,0.7702218496217376,7.442477271685299e-05,87.7972183227539,COMPLETE
1637,0.4648091793060303,2023-09-04 22:21:39.325333,2023-09-04 22:21:45.627341,0 days 00:00:06.302008,Tanh,Leaky,Tanh,,24,10,21.0,24.0,,1.9576611968303764e-05,3,331,0.570066748761358,0.017509269936280606,174.69768162292297,COMPLETE
1638,0.3248416781425476,2023-09-04 22:21:45.627876,2023-09-04 22:21:50.022966,0 days 00:00:04.395090,Tanh,Leaky,Leaky,Leaky,14,11,18.0,6.0,4.0,0.00114187710050747,4,403,0.7202994293194995,3.418901664133598e-05,95.31717649070166,COMPLETE
1639,0.34218302369117737,2023-09-04 22:21:50.023459,2023-09-04 22:21:53.389156,0 days 00:00:03.365697,Tanh,ReLU,Leaky,,16,21,18.0,7.0,,0.0006996850915225208,3,367,0.7472679098402031,0.00019296838992725998,90.53690976681916,COMPLETE
1640,0.41152235865592957,2023-09-04 22:21:53.389652,2023-09-04 22:21:53.748938,0 days 00:00:00.359286,Tanh,Leaky,Leaky,,21,12,19.0,18.0,,0.005604166356388627,3,351,0.214374492611781,4.746958093883508e-05,105.14472770690918,COMPLETE
1641,0.3119228780269623,2023-09-04 22:21:53.749435,2023-09-04 22:21:54.810516,0 days 00:00:01.061081,Tanh,Leaky,Leaky,,19,11,20.0,9.0,,0.006615754131967588,3,410,0.7706619386793279,0.00034028320746530934,90.23685809544155,COMPLETE
1642,0.4007703959941864,2023-09-04 22:21:54.811009,2023-09-04 22:21:56.327291,0 days 00:00:01.516282,Tanh,,,,12,10,,,,0.0030355459671343537,1,383,0.38541043789265234,0.024039084349431233,183.25761900556847,COMPLETE
1643,0.33492210507392883,2023-09-04 22:21:56.327844,2023-09-04 22:21:58.898922,0 days 00:00:02.571078,Tanh,Tanh,Leaky,,24,12,19.0,22.0,,0.0007887182237612469,3,341,0.44941062425446243,0.0011635201755385775,97.00821638403472,COMPLETE
1644,0.41643962264060974,2023-09-04 22:21:58.899418,2023-09-04 22:21:59.375100,0 days 00:00:00.475682,Tanh,Leaky,Leaky,,21,11,18.0,15.0,,0.001645981660521191,3,125,0.14281035971499786,0.00028243321249645594,126.55158896524398,COMPLETE
1645,0.3548332154750824,2023-09-04 22:21:59.375588,2023-09-04 22:22:00.979792,0 days 00:00:01.604204,Tanh,ReLU,Leaky,,16,12,20.0,8.0,,0.00130633165464584,3,370,0.6644348822536662,0.001771755861467294,118.2359739263007,COMPLETE
1646,0.4110018014907837,2023-09-04 22:22:00.980315,2023-09-04 22:22:01.335591,0 days 00:00:00.355276,Tanh,Leaky,Leaky,,18,11,18.0,17.0,,0.0030112756973260024,3,358,0.1345922735500162,2.4333164383806916e-05,743.7861893112595,COMPLETE
1647,0.3403487205505371,2023-09-04 22:22:01.336080,2023-09-04 22:22:03.545284,0 days 00:00:02.209204,Tanh,Leaky,Leaky,,10,21,19.0,23.0,,0.0019275926227181124,3,394,0.6197884868297545,0.0006484531695831466,110.15459276282269,COMPLETE
1648,0.34484046697616577,2023-09-04 22:22:03.545905,2023-09-04 22:22:04.805517,0 days 00:00:01.259612,Tanh,Leaky,ReLU,,14,10,19.0,16.0,,0.018532114883793256,3,348,0.5201581947641788,0.00017895531963655744,92.2359733581543,COMPLETE
1649,0.35663992166519165,2023-09-04 22:22:04.806036,2023-09-04 22:22:06.315733,0 days 00:00:01.509697,Sigmoid,ReLU,Tanh,,22,12,17.0,11.0,,0.0039284238775122516,3,322,0.7153654225214081,0.00043237081834106815,100.09036155983254,COMPLETE
1650,0.37120214104652405,2023-09-04 22:22:06.316227,2023-09-04 22:22:13.351998,0 days 00:00:07.035771,Tanh,Leaky,Leaky,,17,22,20.0,7.0,,7.595282823650357e-05,3,381,0.37813832737019654,0.005019009328079849,118.87460103127435,COMPLETE
1651,0.30251723527908325,2023-09-04 22:22:13.352508,2023-09-04 22:22:14.363046,0 days 00:00:01.010538,Tanh,Leaky,Leaky,,24,11,21.0,24.0,,0.002093443793179675,3,405,0.7479682858667557,0.00021852136590389473,102.91254775588577,COMPLETE
1652,0.3643724024295807,2023-09-04 22:22:14.363545,2023-09-04 22:22:14.716117,0 days 00:00:00.352572,Tanh,Leaky,Sigmoid,,20,23,18.0,9.0,,0.013060449121841965,3,335,0.1942552776858871,6.12949238581745e-05,198.35313310294316,COMPLETE
1653,0.3740576505661011,2023-09-04 22:22:14.716671,2023-09-04 22:22:15.199008,0 days 00:00:00.482337,Tanh,Leaky,Leaky,,19,12,17.0,8.0,,0.0025881697924498783,3,365,0.3146801204099213,0.003409593548709173,123.94018064226422,COMPLETE
1654,0.32666152715682983,2023-09-04 22:22:15.199500,2023-09-04 22:22:16.514852,0 days 00:00:01.315352,Tanh,ReLU,Leaky,,24,11,18.0,15.0,,0.004460795564214581,3,50,0.7737237907832193,0.001026292060282405,98.86769884282893,COMPLETE
1655,0.3175584673881531,2023-09-04 22:22:16.515343,2023-09-04 22:22:17.452782,0 days 00:00:00.937439,Tanh,Leaky,Leaky,,15,10,19.0,15.0,,0.006874951095379307,3,373,0.448520564974774,2.9041046103513465e-05,109.50131596745672,COMPLETE
1656,0.33469778299331665,2023-09-04 22:22:17.453278,2023-09-04 22:22:18.214076,0 days 00:00:00.760798,Tanh,Leaky,Leaky,,21,12,20.0,22.0,,0.014069919692059464,3,389,0.40994880466173006,0.0008550868047701213,115.49361801147461,COMPLETE
1657,0.3158431053161621,2023-09-04 22:22:18.214618,2023-09-04 22:22:18.948476,0 days 00:00:00.733858,Tanh,Leaky,Leaky,,47,11,13.0,17.0,,0.028296232968761006,3,354,0.729466795321858,7.912686110468841e-05,107.82076975504557,COMPLETE
1658,0.38232457637786865,2023-09-04 22:22:18.948993,2023-09-04 22:22:19.406320,0 days 00:00:00.457327,Tanh,ReLU,Leaky,,90,24,17.0,7.0,,0.0008922210010343836,3,412,0.36920637958500324,3.4929238585347094e-05,123.18970854853241,COMPLETE
1659,0.30757591128349304,2023-09-04 22:22:19.406822,2023-09-04 22:22:21.269828,0 days 00:00:01.863006,Tanh,Leaky,ReLU,,13,11,18.0,12.0,,0.023272011884039944,3,341,0.6887563872875768,5.257470583623066e-05,93.47863527623619,COMPLETE
1660,0.3566432297229767,2023-09-04 22:22:21.270445,2023-09-04 22:22:21.954347,0 days 00:00:00.683902,Tanh,Leaky,Leaky,,16,20,19.0,10.0,,0.005732435653824055,3,377,0.23126414102904544,0.00574813678167297,113.24673163372537,COMPLETE
1661,0.316944420337677,2023-09-04 22:22:21.954831,2023-09-04 22:22:23.080381,0 days 00:00:01.125550,Tanh,Leaky,Tanh,,25,21,17.0,23.0,,0.011030803745514418,3,398,0.7729002191641098,0.0003093129547344341,112.17678921039288,COMPLETE
1662,0.3615487217903137,2023-09-04 22:22:23.081330,2023-09-04 22:22:23.809500,0 days 00:00:00.728170,Tanh,Tanh,Leaky,,18,12,22.0,8.0,,0.008209920533908304,3,326,0.12293946628339637,0.0002435680617179556,185.8485117594401,COMPLETE
1663,0.3691849410533905,2023-09-04 22:22:23.810419,2023-09-04 22:22:25.596636,0 days 00:00:01.786217,Tanh,ReLU,Leaky,,22,10,18.0,9.0,,0.0011389486328191765,3,307,0.2069536737950311,9.438449853410988e-05,139.4750615509463,COMPLETE
1664,0.34069132804870605,2023-09-04 22:22:25.597228,2023-09-04 22:22:26.542531,0 days 00:00:00.945303,Sigmoid,Leaky,Leaky,,19,12,19.0,6.0,,0.040580529448258754,3,348,0.7458718672113529,0.00018619351264742703,107.17300838894315,COMPLETE
1665,0.3509809076786041,2023-09-04 22:22:26.543034,2023-09-04 22:22:27.215824,0 days 00:00:00.672790,Tanh,Leaky,Leaky,,23,11,17.0,24.0,,0.01717359367814513,3,357,0.7994400310564259,0.0014468183026784493,94.59119214509663,COMPLETE
1666,0.3274848163127899,2023-09-04 22:22:27.216330,2023-09-04 22:22:28.472354,0 days 00:00:01.256024,Tanh,Leaky,Leaky,,12,12,20.0,16.0,,0.020412395727403058,3,364,0.6984658417838712,4.2257668787954926e-05,115.64865845900316,COMPLETE
1667,0.2931773364543915,2023-09-04 22:22:28.472833,2023-09-04 22:22:31.400212,0 days 00:00:02.927379,Tanh,ReLU,Leaky,,17,11,13.0,18.0,,0.0015222413251976012,3,385,0.6460117041001594,0.00037257892494816074,101.90758008542268,COMPLETE
1668,0.2889530658721924,2023-09-04 22:22:31.400753,2023-09-04 22:22:32.219462,0 days 00:00:00.818709,Tanh,Leaky,Leaky,,25,12,18.0,14.0,,0.011672601644605917,3,339,0.7276124441690892,1.5037744646329443e-05,102.27842238853718,COMPLETE
1669,0.3891131281852722,2023-09-04 22:22:32.219978,2023-09-04 22:22:52.492636,0 days 00:00:20.272658,Tanh,Leaky,ReLU,,14,10,19.0,16.0,,5.377092999332581e-05,3,416,0.7667550264721388,0.03609375148637885,118.6191771030426,COMPLETE
1670,0.3162706196308136,2023-09-04 22:22:52.493138,2023-09-04 22:22:52.970648,0 days 00:00:00.477510,Tanh,Leaky,Leaky,,20,11,17.0,13.0,,0.007249531215411701,3,374,0.26346220317461116,0.0005192616342564609,196.37071587057676,COMPLETE
1671,0.390084832906723,2023-09-04 22:22:52.971132,2023-09-04 22:22:53.253440,0 days 00:00:00.282308,Tanh,Leaky,Leaky,,22,22,19.0,15.0,,0.015315674094477177,3,392,0.1669787597524683,0.0001569472050454538,237.0584856669108,COMPLETE
1672,0.3261338174343109,2023-09-04 22:22:53.253930,2023-09-04 22:22:56.175391,0 days 00:00:02.921461,Tanh,ReLU,Tanh,,16,10,20.0,11.0,,0.0007241757009119306,3,401,0.6006066812672277,0.0007252700671925978,117.01097023010254,COMPLETE
1673,0.39399006962776184,2023-09-04 22:22:56.175890,2023-09-04 22:22:57.822466,0 days 00:00:01.646576,Tanh,Leaky,Leaky,,25,12,1.0,8.0,,0.002270911756808491,3,361,0.3565190845404053,0.007487232416019049,180.55964193418043,COMPLETE
1674,0.3453269600868225,2023-09-04 22:22:57.823126,2023-09-04 22:22:59.889572,0 days 00:00:02.066446,Tanh,Leaky,Sigmoid,,18,11,19.0,7.0,,0.009850471681307075,3,334,0.7993278737318306,0.002160242423105974,93.21814967967846,COMPLETE
1675,0.4046574831008911,2023-09-04 22:22:59.890090,2023-09-04 22:23:06.415532,0 days 00:00:06.525442,Tanh,Leaky,Leaky,,10,20,18.0,23.0,,5.456773657052488e-05,3,352,0.25278887273695394,6.537461573539892e-05,102.76720326597041,COMPLETE
1676,0.3957398235797882,2023-09-04 22:23:06.416016,2023-09-04 22:23:06.837168,0 days 00:00:00.421152,Tanh,ReLU,Leaky,,21,13,17.0,13.0,,0.006264294821105157,3,368,0.18249847668247748,0.00012389552791755684,116.23682040259952,COMPLETE
1677,0.35703128576278687,2023-09-04 22:23:06.837645,2023-09-04 22:23:07.788042,0 days 00:00:00.950397,Tanh,Leaky,Leaky,,14,19,20.0,9.0,,0.01302328560946585,3,380,0.6672261776256605,0.00022749216572936487,100.40448538462321,COMPLETE
1678,0.3435715138912201,2023-09-04 22:23:07.788532,2023-09-04 22:23:08.557900,0 days 00:00:00.769368,Tanh,Leaky,Leaky,,24,12,21.0,6.0,,0.004540129479958503,3,407,0.5402942116414966,2.0585785760637058e-05,111.50449886837521,COMPLETE
1679,0.3484121263027191,2023-09-04 22:23:08.558387,2023-09-04 22:23:09.227741,0 days 00:00:00.669354,Tanh,Leaky,Leaky,,19,12,18.0,17.0,,0.008236866182024034,3,317,0.42334783705257323,2.8923927865947095e-05,95.25675511360168,COMPLETE
1680,0.4435499906539917,2023-09-04 22:23:09.228241,2023-09-04 22:23:10.164547,0 days 00:00:00.936306,Sigmoid,ReLU,Leaky,,82,23,17.0,12.0,,0.002856764029505307,3,345,0.7440206643171979,0.04051484235816178,108.0419510432652,COMPLETE
1681,0.4036439061164856,2023-09-04 22:23:10.165474,2023-09-04 22:23:14.895273,0 days 00:00:04.729799,Tanh,Leaky,ReLU,,26,22,13.0,15.0,,4.056814418184236e-05,3,389,0.30820681936360295,7.357417730713711e-05,139.46762545862663,COMPLETE
1682,0.2869948148727417,2023-09-04 22:23:14.895786,2023-09-04 22:23:16.300791,0 days 00:00:01.405005,Tanh,Tanh,Leaky,,16,11,19.0,8.0,,0.01596526482771979,3,362,0.7084327029139348,0.00026741212028996383,96.54208002334985,COMPLETE
1683,0.37176820635795593,2023-09-04 22:23:16.301285,2023-09-04 22:23:17.501251,0 days 00:00:01.199966,Tanh,Leaky,Leaky,,12,13,24.0,24.0,,0.027474384140356706,3,416,0.7697972361608048,0.0016422024248881836,105.99408489724864,COMPLETE
1684,0.38325437903404236,2023-09-04 22:23:17.501754,2023-09-04 22:23:17.939427,0 days 00:00:00.437673,Tanh,Leaky,Tanh,,22,21,18.0,22.0,,0.023175657567474542,3,375,0.3469053229823253,5.0048157157971206e-05,109.33463684082031,COMPLETE
1685,0.3275489807128906,2023-09-04 22:23:17.939919,2023-09-04 22:23:19.031097,0 days 00:00:01.091178,Tanh,Leaky,Leaky,,17,24,20.0,14.0,,0.010629212415125846,3,400,0.7284750475518461,3.9046744437705895e-05,91.25253346761068,COMPLETE
1686,0.41428884863853455,2023-09-04 22:23:19.031590,2023-09-04 22:23:19.369198,0 days 00:00:00.337608,Tanh,ReLU,Leaky,,24,11,17.0,7.0,,0.01910284644323061,3,329,0.1573313866576669,0.0001601835610220254,136.41554069519043,COMPLETE
1687,0.43525430560112,2023-09-04 22:23:19.369713,2023-09-04 22:23:26.082276,0 days 00:00:06.712563,Tanh,Leaky,Leaky,,19,12,19.0,16.0,,2.176335005436189e-05,3,352,0.4714213116820934,9.496386846150867e-05,105.45022355426441,COMPLETE
1688,0.2992076277732849,2023-09-04 22:23:26.082772,2023-09-04 22:23:28.224471,0 days 00:00:02.141699,Tanh,Leaky,Leaky,,22,10,13.0,14.0,,0.003511569575957493,3,380,0.6890562229228419,0.00019809499342291511,91.54926474697619,COMPLETE
1689,0.2802250385284424,2023-09-04 22:23:28.224956,2023-09-04 22:23:30.465168,0 days 00:00:02.240212,Tanh,Leaky,Leaky,,14,12,18.0,10.0,,0.005612000067419674,3,370,0.7698488958524867,0.00034957514097204087,93.24131577103226,COMPLETE
