number,value,datetime_start,datetime_complete,duration,params_activation1,params_activation2,params_activation3,params_activation4,params_batch_size,params_fl1,params_fl2,params_fl3,params_fl4,params_learning_rate,params_n_layers,params_num_epochs,params_train_size,params_weight_decay,user_attrs_mre,state
193,0.28973114490509033,2023-09-04 21:15:22.218495,2023-09-04 21:15:22.733994,0 days 00:00:00.515499,Tanh,Tanh,,,70,17,12.0,,,0.03529189777955108,2,75,0.637602450781264,0.00022757578331187222,315.4649828018681,COMPLETE
194,0.3353160619735718,2023-09-04 21:15:22.734355,2023-09-04 21:15:24.020627,0 days 00:00:01.286272,Leaky,Tanh,,,75,14,9.0,,,0.0019186576018969377,2,424,0.6900571506427784,0.0001517865537467681,133.57885532753141,COMPLETE
195,0.3041744530200958,2023-09-04 21:15:24.020917,2023-09-04 21:15:24.528645,0 days 00:00:00.507728,Sigmoid,ReLU,,,66,18,10.0,,,0.041219249633929485,2,500,0.6590778515433348,0.00012395317376807187,173.21034240722656,COMPLETE
196,0.2978375256061554,2023-09-04 21:15:24.528913,2023-09-04 21:15:25.145055,0 days 00:00:00.616142,Tanh,Tanh,,,61,17,11.0,,,0.030313317353999763,2,307,0.7286737689757871,8.256350167310328e-05,279.34645055552,COMPLETE
197,0.34578055143356323,2023-09-04 21:15:25.145329,2023-09-04 21:15:25.506623,0 days 00:00:00.361294,Leaky,Sigmoid,,,54,19,8.0,,,0.07433252233019035,2,193,0.577771043049739,0.00011102050466721281,189.62930297851562,COMPLETE
198,0.5924051403999329,2023-09-04 21:15:25.506904,2023-09-04 21:15:25.864354,0 days 00:00:00.357450,Leaky,Tanh,,,68,16,12.0,,,0.0005727425444782178,2,116,0.19110392298254966,0.00014409655938354583,189.500735184242,COMPLETE
199,0.3139816224575043,2023-09-04 21:15:25.864632,2023-09-04 21:15:26.830171,0 days 00:00:00.965539,Sigmoid,Sigmoid,,,64,6,16.0,,,0.050615145048772604,2,452,0.766397430303519,0.00032556924787460187,160.76766839278372,COMPLETE
200,0.2678873538970947,2023-09-04 21:15:26.830441,2023-09-04 21:15:27.187484,0 days 00:00:00.357043,Tanh,Tanh,,,73,18,9.0,,,0.02125746812635095,2,253,0.7065330451081125,0.00019283128220614154,118.1012346368087,COMPLETE
201,0.274183452129364,2023-09-04 21:15:27.187773,2023-09-04 21:15:27.509026,0 days 00:00:00.321253,Tanh,Tanh,,,73,18,9.0,,,0.02110814241169659,2,246,0.7020913387423675,0.0002090808712422286,149.33112182617188,COMPLETE
202,0.28685152530670166,2023-09-04 21:15:27.509311,2023-09-04 21:15:27.970594,0 days 00:00:00.461283,Tanh,Tanh,,,73,18,8.0,,,0.022029800636047574,2,255,0.709238811869155,0.00017737856333444637,424.7488726806641,COMPLETE
203,0.35078510642051697,2023-09-04 21:15:27.970867,2023-09-04 21:15:28.985080,0 days 00:00:01.014213,Tanh,Tanh,,,74,19,9.0,,,0.0025035585159389833,2,245,0.68491224594041,0.00024433642791935967,182.21896140358666,COMPLETE
204,0.23290486633777618,2023-09-04 21:15:28.985363,2023-09-04 21:15:29.588037,0 days 00:00:00.602674,Tanh,Tanh,,,80,18,9.0,,,0.019701464857792554,2,290,0.7404684800030986,0.00014531191408312337,180.8233383178711,COMPLETE
205,0.25285372138023376,2023-09-04 21:15:29.588316,2023-09-04 21:15:30.781266,0 days 00:00:01.192950,Tanh,Tanh,,,78,18,9.0,,,0.018795186916547964,2,266,0.7494722902807435,0.00016079934426043002,321.997841796875,COMPLETE
206,0.386837363243103,2023-09-04 21:15:30.781731,2023-09-04 21:15:31.958298,0 days 00:00:01.176567,Tanh,Tanh,,,80,18,9.0,,,0.011965977193698438,2,282,0.7573275490326833,0.00014213965406804634,125.02164952895221,COMPLETE
207,0.46081802248954773,2023-09-04 21:15:31.958570,2023-09-04 21:15:32.213629,0 days 00:00:00.255059,Tanh,Sigmoid,,,78,18,9.0,,,0.016274788834866667,2,289,0.2661727649069863,0.00011937672331964272,233.66618461039528,COMPLETE
208,0.3984123468399048,2023-09-04 21:15:32.213902,2023-09-04 21:15:32.385903,0 days 00:00:00.172001,Tanh,ReLU,,,83,18,8.0,,,0.014715673769196498,2,255,0.2152564995921395,0.000202767327461406,177.7467859056261,COMPLETE
209,0.27785295248031616,2023-09-04 21:15:32.386171,2023-09-04 21:15:32.773650,0 days 00:00:00.387479,Tanh,Leaky,,,79,18,7.0,,,0.02134379275200261,2,274,0.7429993615311149,9.604661881357491e-05,106.614685240246,COMPLETE
210,0.3496600091457367,2023-09-04 21:15:32.773928,2023-09-04 21:15:33.173580,0 days 00:00:00.399652,Tanh,Leaky,,,79,10,7.0,,,0.019549044620187833,2,287,0.7464167149941295,0.00016391507851709137,154.14760052074087,COMPLETE
211,0.3130945861339569,2023-09-04 21:15:33.173850,2023-09-04 21:15:33.523498,0 days 00:00:00.349648,Tanh,Leaky,,,77,19,8.0,,,0.018937724610758815,2,263,0.76652104226475,0.00010002503891237322,161.06090376112195,COMPLETE
212,0.25566890835762024,2023-09-04 21:15:33.523780,2023-09-04 21:15:33.957182,0 days 00:00:00.433402,Tanh,Leaky,,,80,18,7.0,,,0.022751049495288563,2,233,0.7979127636509213,0.00013199954556879342,506.0424476036659,COMPLETE
213,0.30385252833366394,2023-09-04 21:15:33.957649,2023-09-04 21:15:35.035486,0 days 00:00:01.077837,Tanh,Leaky,,,80,18,6.0,,,0.020182412661698988,2,266,0.7980606210409975,0.00013324296236757208,141.99400424957275,COMPLETE
214,0.35039228200912476,2023-09-04 21:15:35.035957,2023-09-04 21:15:35.898731,0 days 00:00:00.862774,Tanh,Leaky,,,85,19,7.0,,,0.01366774986046464,2,299,0.7403996753214118,0.0001500976045138554,166.62098990546332,COMPLETE
215,0.2469443827867508,2023-09-04 21:15:35.899004,2023-09-04 21:15:36.506499,0 days 00:00:00.607495,Tanh,Leaky,,,81,18,8.0,,,0.023412376048783958,2,270,0.771056813837119,0.00020049211896209026,317.6129227823286,COMPLETE
216,0.29710039496421814,2023-09-04 21:15:36.506847,2023-09-04 21:15:37.013956,0 days 00:00:00.507109,Tanh,Leaky,,,82,18,8.0,,,0.022694558150019483,2,268,0.799827386837179,0.0002358454329153552,97.8935554072542,COMPLETE
217,0.3597697615623474,2023-09-04 21:15:37.014238,2023-09-04 21:15:37.548406,0 days 00:00:00.534168,Tanh,Leaky,,,76,18,7.0,,,0.02710726848284541,2,272,0.7663086016693045,0.0001968076273330184,140.79045439603036,COMPLETE
218,0.2849721908569336,2023-09-04 21:15:37.548697,2023-09-04 21:15:37.818002,0 days 00:00:00.269305,Tanh,Leaky,,,78,18,9.0,,,0.023053046552164037,2,233,0.7338244525757796,0.0002968292299994663,163.62285723005022,COMPLETE
219,0.27996155619621277,2023-09-04 21:15:37.818284,2023-09-04 21:15:38.437433,0 days 00:00:00.619149,Tanh,Leaky,,,80,17,9.0,,,0.01795055937384276,2,251,0.7598505803641606,0.0011502371135469378,145.60121409098306,COMPLETE
220,0.36919358372688293,2023-09-04 21:15:38.437790,2023-09-04 21:15:38.855398,0 days 00:00:00.417608,Tanh,Leaky,,,80,17,9.0,,,0.029670203412038812,2,276,0.7697456248425124,0.00010943768044593463,149.0720974392361,COMPLETE
221,0.2998329699039459,2023-09-04 21:15:38.855682,2023-09-04 21:15:39.334100,0 days 00:00:00.478418,Tanh,Leaky,,,81,18,8.0,,,0.01751019327725589,2,258,0.7985381309023061,0.0009741176487829536,157.20350051879882,COMPLETE
222,0.30579113960266113,2023-09-04 21:15:39.334376,2023-09-04 21:15:40.092935,0 days 00:00:00.758559,Tanh,Leaky,,,76,17,8.0,,,0.010915930949838679,2,220,0.7114425169551483,0.0014013599786236051,658.9764221892959,COMPLETE
223,0.32439881563186646,2023-09-04 21:15:40.093215,2023-09-04 21:15:40.534705,0 days 00:00:00.441490,Tanh,Leaky,,,79,18,6.0,,,0.021872890961811515,2,269,0.7561783804692277,0.000415195994950513,344.7057644526164,COMPLETE
224,0.38824692368507385,2023-09-04 21:15:40.534984,2023-09-04 21:15:41.006843,0 days 00:00:00.471859,Tanh,Leaky,,,75,16,9.0,,,0.018371803259380984,2,250,0.7338002856445048,0.00017925016166306943,406.145154766008,COMPLETE
225,0.3900335133075714,2023-09-04 21:15:41.007127,2023-09-04 21:15:41.319260,0 days 00:00:00.312133,Tanh,Leaky,,,82,17,7.0,,,0.026682113852664214,2,225,0.6992330465650082,0.0008770539154099512,152.17796304490832,COMPLETE
226,0.3169507384300232,2023-09-04 21:15:41.319534,2023-09-04 21:15:41.822295,0 days 00:00:00.502761,Tanh,Leaky,,,78,18,9.0,,,0.015738343913158696,2,252,0.7760979676908072,0.0015468373034035817,535.549093858251,COMPLETE
227,0.3137233257293701,2023-09-04 21:15:41.822668,2023-09-04 21:15:42.513556,0 days 00:00:00.690888,Tanh,Leaky,,,77,17,8.0,,,0.024624403616102464,2,276,0.7199738330069289,0.0010292165667420189,123.50707087797277,COMPLETE
228,0.34629181027412415,2023-09-04 21:15:42.513921,2023-09-04 21:15:42.803174,0 days 00:00:00.289253,Tanh,Tanh,,,82,19,8.0,,,0.007811832586149922,2,284,0.4359122206917049,0.0001456403413601245,159.8233819101371,COMPLETE
229,0.30978527665138245,2023-09-04 21:15:42.803521,2023-09-04 21:15:43.129560,0 days 00:00:00.326039,Tanh,Tanh,,,73,18,9.0,,,0.031324078232015995,2,237,0.7510437799470365,2.7932407966999833e-05,113.15709108294863,COMPLETE
230,0.39935511350631714,2023-09-04 21:15:43.129858,2023-09-04 21:15:43.539432,0 days 00:00:00.409574,Tanh,Tanh,,,46,17,10.0,,,0.021758612206321415,2,244,0.6846527641490924,0.0020808562453241337,206.01657598158891,COMPLETE
231,0.3507203459739685,2023-09-04 21:15:43.539735,2023-09-04 21:15:43.906807,0 days 00:00:00.367072,Tanh,Leaky,,,86,19,7.0,,,0.014159424790478523,2,265,0.7035558176930118,0.00012096136349167133,136.27832155449445,COMPLETE
232,0.36357247829437256,2023-09-04 21:15:43.907275,2023-09-04 21:15:44.910456,0 days 00:00:01.003181,Tanh,Tanh,,,83,19,9.0,,,0.01829415844215316,2,262,0.7990750481964074,0.00012745744059402276,198.04081404836555,COMPLETE
233,0.5232194662094116,2023-09-04 21:15:44.910936,2023-09-04 21:15:45.162721,0 days 00:00:00.251785,Tanh,ReLU,,,85,20,9.0,,,0.015949704926512952,2,292,0.14401134178208166,0.00010028782861953999,872.0150909423828,COMPLETE
234,0.2887634336948395,2023-09-04 21:15:45.163191,2023-09-04 21:15:45.635659,0 days 00:00:00.472468,Tanh,Tanh,,,80,18,8.0,,,0.011523844840619375,2,252,0.7303483911953391,0.00016174634601263317,151.55811389287314,COMPLETE
235,0.37594977021217346,2023-09-04 21:15:45.635981,2023-09-04 21:15:46.008642,0 days 00:00:00.372661,Tanh,Tanh,,,89,19,10.0,,,0.08058167764085643,2,381,0.6717802337640325,0.0002071756630203564,149.39587724473742,COMPLETE
236,0.31122684478759766,2023-09-04 21:15:46.008927,2023-09-04 21:15:46.696822,0 days 00:00:00.687895,ReLU,Sigmoid,,,75,16,9.0,,,0.026669784825299782,2,445,0.7719036950107577,0.00012116722210877662,361.4899747606734,COMPLETE
237,0.512010395526886,2023-09-04 21:15:46.697113,2023-09-04 21:15:46.903218,0 days 00:00:00.206105,Leaky,Leaky,,,84,20,7.0,,,0.02035344021425453,2,456,0.7168847861021823,0.08734112323051088,215.72635832287017,COMPLETE
238,0.27656176686286926,2023-09-04 21:15:46.903502,2023-09-04 21:15:47.882479,0 days 00:00:00.978977,Tanh,Tanh,,,87,18,8.0,,,0.005434045892188436,2,274,0.7472879229633602,8.808561513407812e-05,168.10888751486073,COMPLETE
239,0.36659595370292664,2023-09-04 21:15:47.882768,2023-09-04 21:15:49.054182,0 days 00:00:01.171414,Tanh,Tanh,,,87,17,8.0,,,0.003469460950137215,2,277,0.7655625407154159,8.059085594778047e-05,150.284038066864,COMPLETE
240,0.2697218656539917,2023-09-04 21:15:49.054662,2023-09-04 21:15:49.991666,0 days 00:00:00.937004,Tanh,Tanh,,,72,18,8.0,,,0.006760371470792642,2,271,0.7466240708081545,8.917899901248156e-05,167.55611903492996,COMPLETE
241,0.31540513038635254,2023-09-04 21:15:49.991975,2023-09-04 21:15:50.257085,0 days 00:00:00.265110,Tanh,Tanh,,,71,18,8.0,,,0.0076577923861063275,2,271,0.7431144212582446,9.513989845724443e-05,133.78935036292444,COMPLETE
242,0.32136860489845276,2023-09-04 21:15:50.257374,2023-09-04 21:15:50.695296,0 days 00:00:00.437922,Tanh,Tanh,,,72,18,8.0,,,0.010270467324882555,2,256,0.7992558265855111,7.325089559685599e-05,108.30882154192243,COMPLETE
243,0.289961576461792,2023-09-04 21:15:50.695591,2023-09-04 21:15:51.350717,0 days 00:00:00.655126,Tanh,Tanh,,,75,18,9.0,,,0.005703059528611587,2,299,0.742796694143451,0.0006062947755786991,122.45929954421352,COMPLETE
244,0.3210248053073883,2023-09-04 21:15:51.351006,2023-09-04 21:15:52.865737,0 days 00:00:01.514731,Tanh,Tanh,,,79,17,9.0,,,0.0013361002488027174,2,276,0.7685881624490029,3.706049252199977e-05,2004.8690554681652,COMPLETE
245,0.3586435914039612,2023-09-04 21:15:52.866028,2023-09-04 21:15:53.385935,0 days 00:00:00.519907,Tanh,Tanh,,,71,18,7.0,,,0.0070158727658792925,2,287,0.6942732623904102,9.065493284081248e-05,148.49694141588714,COMPLETE
246,0.36319777369499207,2023-09-04 21:15:53.386232,2023-09-04 21:15:53.694763,0 days 00:00:00.308531,Tanh,Tanh,,,77,17,8.0,,,0.030694770667895648,2,261,0.3996127587459622,0.00014478187189694458,148.32524068014962,COMPLETE
247,0.32891952991485596,2023-09-04 21:15:53.695055,2023-09-04 21:15:54.125016,0 days 00:00:00.429961,Tanh,Tanh,,,91,24,6.0,,,0.009718305629765346,2,464,0.7315634561594685,0.00010872270912571657,162.03913370768228,COMPLETE
248,0.3106529712677002,2023-09-04 21:15:54.125313,2023-09-04 21:15:54.826694,0 days 00:00:00.701381,Tanh,Sigmoid,,,73,18,10.0,,,0.0044727312043561064,2,246,0.7695582144981565,4.590674100184747e-05,161.93205449352524,COMPLETE
249,0.31601276993751526,2023-09-04 21:15:54.826990,2023-09-04 21:15:56.648237,0 days 00:00:01.821247,Tanh,Tanh,,,74,17,9.0,,,0.0036971815556149806,2,266,0.6771134423398818,6.30848862147506e-05,157.4132056802006,COMPLETE
250,0.32886695861816406,2023-09-04 21:15:56.648729,2023-09-04 21:15:57.538313,0 days 00:00:00.889584,Tanh,Tanh,,,69,19,8.0,,,0.024439854585145034,2,361,0.7090866067944492,0.0002343087844249939,153.0319790507472,COMPLETE
251,0.3304027020931244,2023-09-04 21:15:57.538606,2023-09-04 21:15:57.865969,0 days 00:00:00.327363,Tanh,Sigmoid,,,56,16,7.0,,,0.01294503831134525,2,229,0.346412651653575,0.00017575636591527486,289.00893147786456,COMPLETE
252,0.47991496324539185,2023-09-04 21:15:57.866255,2023-09-04 21:15:58.014921,0 days 00:00:00.148666,Tanh,Tanh,,,51,18,9.0,,,0.09737180381314316,2,285,0.3274002204661177,8.207948871920859e-05,579.8391909391984,COMPLETE
253,0.3233092725276947,2023-09-04 21:15:58.015220,2023-09-04 21:15:58.436204,0 days 00:00:00.420984,Tanh,Tanh,,,77,17,10.0,,,0.00862427719306791,2,270,0.4491185654533431,0.00010408915224618774,177.12046918477097,COMPLETE
254,0.3281230926513672,2023-09-04 21:15:58.436494,2023-09-04 21:15:59.211190,0 days 00:00:00.774696,Tanh,Sigmoid,,,81,15,9.0,,,0.0060628708598212885,2,255,0.4872300368863525,0.00014540904901489413,172.53428503183218,COMPLETE
255,0.3994818925857544,2023-09-04 21:15:59.211481,2023-09-04 21:15:59.615697,0 days 00:00:00.404216,Leaky,Leaky,,,79,16,8.0,,,0.034387018893226956,2,473,0.7424619759262407,0.011905997848427654,145.7831588745117,COMPLETE
256,0.25802725553512573,2023-09-04 21:15:59.615987,2023-09-04 21:16:00.150542,0 days 00:00:00.534555,Tanh,Tanh,,,71,18,8.0,,,0.019580435093785205,2,210,0.7987368863583161,0.0001972030302610606,201.60481790395883,COMPLETE
257,0.30543065071105957,2023-09-04 21:16:00.150830,2023-09-04 21:16:00.540072,0 days 00:00:00.389242,Tanh,Tanh,,,71,18,8.0,,,0.01913926199407468,2,201,0.7981754097222452,6.13096716924039e-05,235.30765430347338,COMPLETE
258,0.30185064673423767,2023-09-04 21:16:00.540373,2023-09-04 21:16:00.921358,0 days 00:00:00.380985,Tanh,Tanh,,,73,17,7.0,,,0.02715227979818691,2,237,0.773581407169638,0.00012591212204607084,158.73321718782992,COMPLETE
259,0.3380095958709717,2023-09-04 21:16:00.921649,2023-09-04 21:16:01.231714,0 days 00:00:00.310065,Tanh,Tanh,,,69,18,9.0,,,0.023004129896778608,2,216,0.7694574702211666,2.329337020308852e-05,162.59847233213227,COMPLETE
260,0.3454931378364563,2023-09-04 21:16:01.232007,2023-09-04 21:16:01.525033,0 days 00:00:00.293026,Tanh,Tanh,,,75,17,8.0,,,0.0328114615636019,2,345,0.7391822897580755,0.0001785546249221519,166.08491846720378,COMPLETE
261,0.29602545499801636,2023-09-04 21:16:01.525328,2023-09-04 21:16:01.797531,0 days 00:00:00.272203,Tanh,Tanh,,,71,13,10.0,,,0.01780913220087381,2,207,0.797877144156336,8.723412614367236e-05,169.85113708496092,COMPLETE
262,0.3587014675140381,2023-09-04 21:16:01.797829,2023-09-04 21:16:02.065834,0 days 00:00:00.268005,Tanh,Tanh,,,76,22,9.0,,,0.0217732125029944,2,248,0.7551040960652439,0.00020364028924276458,140.19798454871545,COMPLETE
263,0.39126351475715637,2023-09-04 21:16:02.066131,2023-09-04 21:16:02.651702,0 days 00:00:00.585571,Sigmoid,Leaky,,,72,18,7.0,,,0.04094947321797938,2,231,0.7187941758998995,0.0012579354908143704,207.42674446105957,COMPLETE
264,0.5743102431297302,2023-09-04 21:16:02.652007,2023-09-04 21:16:04.110317,0 days 00:00:01.458310,Tanh,Tanh,,,67,18,8.0,,,5.213384414483271e-05,2,170,0.6624546652734636,0.00013747648033163456,187.46826755299287,COMPLETE
265,0.31061023473739624,2023-09-04 21:16:04.110605,2023-09-04 21:16:04.451322,0 days 00:00:00.340717,Tanh,Tanh,,,48,16,8.0,,,0.027190139688450875,2,279,0.763693481648248,5.4156849709675994e-05,166.58295440673828,COMPLETE
266,0.3251330256462097,2023-09-04 21:16:04.451613,2023-09-04 21:16:05.036138,0 days 00:00:00.584525,ReLU,Tanh,,,74,17,9.0,,,0.00538615389181434,2,483,0.7172437032666212,0.00010847307997761984,196.3748595714569,COMPLETE
267,0.3227183520793915,2023-09-04 21:16:05.036429,2023-09-04 21:16:05.942894,0 days 00:00:00.906465,Tanh,Leaky,,,78,19,10.0,,,0.0024930601121855587,2,260,0.6887915048936101,7.256701202171079e-05,139.66453742980957,COMPLETE
268,0.29099681973457336,2023-09-04 21:16:05.943193,2023-09-04 21:16:06.382949,0 days 00:00:00.439756,Sigmoid,Tanh,,,69,18,9.0,,,0.06292866536852805,2,272,0.7445257580117596,1.032223665580976e-05,1064.1700834794478,COMPLETE
269,0.3741142153739929,2023-09-04 21:16:06.383240,2023-09-04 21:16:06.627041,0 days 00:00:00.243801,Tanh,Tanh,,,76,17,8.0,,,0.015728716855316727,2,241,0.5317314642622037,0.00016477076591441488,143.35933384750828,COMPLETE
270,0.3399093747138977,2023-09-04 21:16:06.627359,2023-09-04 21:16:07.085924,0 days 00:00:00.458565,Tanh,Leaky,,,82,19,7.0,,,0.03067731930704618,2,459,0.7752161276670935,9.572067534479263e-05,145.82375553676061,COMPLETE
271,0.33759909868240356,2023-09-04 21:16:07.086232,2023-09-04 21:16:07.436959,0 days 00:00:00.350727,Tanh,Tanh,,,53,23,11.0,,,0.08088645805757122,2,91,0.6557001859722235,0.00025771596783486715,140.6831720525568,COMPLETE
272,0.3338273763656616,2023-09-04 21:16:07.437259,2023-09-04 21:16:07.906862,0 days 00:00:00.469603,Tanh,Tanh,,,80,16,10.0,,,0.019655381334835395,2,187,0.7989262096755669,3.5893586664324044e-05,119.59164288579201,COMPLETE
273,0.3152361512184143,2023-09-04 21:16:07.907143,2023-09-04 21:16:08.402959,0 days 00:00:00.495816,Sigmoid,Sigmoid,,,44,18,9.0,,,0.03867479579333513,2,309,0.3994578603417237,0.00012035629681811642,181.7017620311064,COMPLETE
274,0.3211754560470581,2023-09-04 21:16:08.403279,2023-09-04 21:16:08.790351,0 days 00:00:00.387072,Tanh,Tanh,,,73,17,8.0,,,0.023674903759590176,2,295,0.7272948173953908,0.0001483434443589432,184.48458304056308,COMPLETE
275,0.2993800938129425,2023-09-04 21:16:08.790654,2023-09-04 21:16:09.256372,0 days 00:00:00.465718,Leaky,Leaky,,,66,15,9.0,,,0.006619860728640223,2,261,0.6947754845126457,0.0007442344353594438,249.1518991088867,COMPLETE
276,0.3355537950992584,2023-09-04 21:16:09.256668,2023-09-04 21:16:10.369553,0 days 00:00:01.112885,Tanh,Tanh,,,69,19,8.0,,,0.03454277033546043,2,468,0.7493684608265103,0.00019806235178675122,153.10311293168502,COMPLETE
277,0.29485592246055603,2023-09-04 21:16:10.370037,2023-09-04 21:16:11.774964,0 days 00:00:01.404927,Tanh,Sigmoid,,,71,18,10.0,,,0.004045272294459235,2,249,0.712360688404976,8.403058893286831e-05,203.65538386294716,COMPLETE
278,0.3436843752861023,2023-09-04 21:16:11.775271,2023-09-04 21:16:12.328572,0 days 00:00:00.553301,Leaky,Tanh,,,50,18,7.0,,,0.014037466963125517,2,218,0.798011096144968,0.0004915897070515591,214.22203667219296,COMPLETE
279,0.3856189250946045,2023-09-04 21:16:12.328884,2023-09-04 21:16:12.627036,0 days 00:00:00.298152,Tanh,Tanh,,,78,17,9.0,,,0.0266093044877374,2,449,0.425139461355054,0.0001152391112069377,130.64939923556346,COMPLETE
280,0.3744700253009796,2023-09-04 21:16:12.627315,2023-09-04 21:16:13.238689,0 days 00:00:00.611374,Sigmoid,Sigmoid,,,74,12,10.0,,,0.0537679124557631,2,272,0.7654697396148891,0.00015990151430910187,125.89882002610426,COMPLETE
281,0.3376031517982483,2023-09-04 21:16:13.238978,2023-09-04 21:16:13.527632,0 days 00:00:00.288654,Tanh,Leaky,,,57,17,6.0,,,0.0997638854481568,2,66,0.3783321873485242,7.012264888243371e-05,198.849307184634,COMPLETE
282,0.3225117623806,2023-09-04 21:16:13.527946,2023-09-04 21:16:13.805985,0 days 00:00:00.278039,Leaky,Tanh,,,76,16,8.0,,,0.02050964164365429,2,284,0.6718644480632273,0.00013412766245281065,165.37002661920363,COMPLETE
283,0.35639601945877075,2023-09-04 21:16:13.806295,2023-09-04 21:16:14.338628,0 days 00:00:00.532333,Tanh,Tanh,,,81,19,9.0,,,0.06968460521127517,2,103,0.7388679777552045,9.674788093652902e-05,162.553355662028,COMPLETE
284,0.31909510493278503,2023-09-04 21:16:14.338932,2023-09-04 21:16:15.243444,0 days 00:00:00.904512,Leaky,Sigmoid,,,67,18,11.0,,,0.017876825308393476,2,263,0.770279710423102,0.00033436654170476357,473.4554800553755,COMPLETE
285,0.33662107586860657,2023-09-04 21:16:15.243744,2023-09-04 21:16:15.594183,0 days 00:00:00.350439,Tanh,Tanh,,,79,18,9.0,,,0.0440065411189537,2,240,0.7091375555885464,0.00018873010795464245,153.80435474102313,COMPLETE
286,0.3812507390975952,2023-09-04 21:16:15.594496,2023-09-04 21:16:16.656038,0 days 00:00:01.061542,Sigmoid,Leaky,,,72,17,8.0,,,0.00497623084174921,2,130,0.6466912350240289,4.4495940461008284e-05,152.67198245708758,COMPLETE
287,0.3366657495498657,2023-09-04 21:16:16.656346,2023-09-04 21:16:16.869771,0 days 00:00:00.213425,Tanh,Tanh,,,70,19,7.0,,,0.026635143849029853,2,202,0.29418718789156517,0.001151656531953097,149.71389753553603,COMPLETE
288,0.6019468903541565,2023-09-04 21:16:16.870060,2023-09-04 21:16:17.074718,0 days 00:00:00.204658,ReLU,Sigmoid,,,84,21,9.0,,,0.003065965947718565,2,50,0.275134689280834,0.00021905718094645388,151.64466369628906,COMPLETE
289,0.3874383270740509,2023-09-04 21:16:17.075008,2023-09-04 21:16:17.300121,0 days 00:00:00.225113,Leaky,Tanh,,,74,20,10.0,,,0.03272167831099731,2,460,0.799253116914544,0.00011192299680230176,168.84709587097169,COMPLETE
290,0.27208220958709717,2023-09-04 21:16:17.300412,2023-09-04 21:16:17.813984,0 days 00:00:00.513572,Tanh,Tanh,,,59,17,8.0,,,0.009734832540722448,2,228,0.7362622104492291,0.00014291753847489879,238.3765749018243,COMPLETE
