number,value,datetime_start,datetime_complete,duration,params_activation1,params_activation2,params_activation3,params_activation4,params_batch_size,params_fl1,params_fl2,params_fl3,params_fl4,params_learning_rate,params_n_layers,params_num_epochs,params_train_size,params_weight_decay,user_attrs_mre,state
1145,0.4532533288002014,2023-09-04 21:39:54.041969,2023-09-04 21:39:54.487091,0 days 00:00:00.445122,Leaky,Tanh,,,31,24,21.0,,,0.0022002367628864614,2,256,0.14183510436969388,0.00010845051115339882,165.0990425181166,COMPLETE
1146,0.3377240300178528,2023-09-04 21:39:54.487524,2023-09-04 21:39:55.794439,0 days 00:00:01.306915,Leaky,Sigmoid,,,79,23,20.0,,,0.0033568196113207454,2,481,0.6750556231863779,7.418693267431533e-05,129.00223570792906,COMPLETE
1147,0.4118652641773224,2023-09-04 21:39:55.794866,2023-09-04 21:39:56.612817,0 days 00:00:00.817951,Tanh,Tanh,,,44,21,23.0,,,0.0025569447720178574,2,494,0.27389491757227497,0.00013532332548873697,472.66000763357505,COMPLETE
1148,0.7906777858734131,2023-09-04 21:39:56.613256,2023-09-04 21:39:56.890287,0 days 00:00:00.277031,Leaky,Sigmoid,,,37,22,20.0,,,0.021445732036821617,2,454,0.7740925591555364,0.06467718622177072,114.93545825664813,COMPLETE
1149,0.41703706979751587,2023-09-04 21:39:56.890715,2023-09-04 21:40:03.193422,0 days 00:00:06.302707,Leaky,Tanh,Tanh,Leaky,77,23,19.0,16.0,18.0,7.156039935686772e-05,4,500,0.7992341399435954,1.5207371160312857e-05,736.4981879577637,COMPLETE
1150,0.43916192650794983,2023-09-04 21:40:03.193841,2023-09-04 21:40:09.905195,0 days 00:00:06.711354,Leaky,Sigmoid,,,26,24,16.0,,,0.00022103092459476793,2,367,0.70883807751149,0.0013286927685141282,500.84133857082605,COMPLETE
1151,0.31876978278160095,2023-09-04 21:40:09.905603,2023-09-04 21:40:10.247160,0 days 00:00:00.341557,Leaky,Tanh,,,94,22,21.0,,,0.03187895469593323,2,464,0.7435604724908562,0.00018350884935939904,191.34225695060962,COMPLETE
1152,0.96108478307724,2023-09-04 21:40:10.247563,2023-09-04 21:40:11.064418,0 days 00:00:00.816855,Leaky,Sigmoid,,,42,23,22.0,,,5.501246920229463e-05,2,86,0.46373592184498147,1.2444554060530752e-05,173.52999842444132,COMPLETE
1153,0.3995417058467865,2023-09-04 21:40:11.064850,2023-09-04 21:40:11.498666,0 days 00:00:00.433816,Tanh,Tanh,,,39,19,20.0,,,0.010618631714355882,2,243,0.3219334856807103,2.1238578012106117e-05,167.99981180826822,COMPLETE
1154,0.4059720039367676,2023-09-04 21:40:11.499098,2023-09-04 21:40:11.676324,0 days 00:00:00.177226,Leaky,Sigmoid,,,97,20,24.0,,,0.09618664211771724,2,325,0.188394247396465,0.00036178813730525895,146.84075127578365,COMPLETE
1155,0.504696249961853,2023-09-04 21:40:11.676784,2023-09-04 21:40:11.918915,0 days 00:00:00.242131,Leaky,Sigmoid,,,89,24,19.0,,,0.005331027301220439,2,274,0.10022306437104782,0.0004897287220141945,185.4764163937189,COMPLETE
1156,0.3339783549308777,2023-09-04 21:40:11.919339,2023-09-04 21:40:12.283574,0 days 00:00:00.364235,Leaky,Tanh,Leaky,,82,23,23.0,20.0,,0.015801146538752867,3,111,0.4281924473377927,0.0002075717733886667,127.99449273814325,COMPLETE
1157,0.3939931392669678,2023-09-04 21:40:12.284012,2023-09-04 21:40:12.920610,0 days 00:00:00.636598,ReLU,,,,91,24,,,,0.006638795946034659,1,402,0.5729091361122705,0.0007688426195504469,145.05236060466243,COMPLETE
1158,0.5741757750511169,2023-09-04 21:40:12.921004,2023-09-04 21:40:13.298297,0 days 00:00:00.377293,Leaky,Sigmoid,,,44,21,15.0,,,0.008703606397495334,2,161,0.7995674396536958,0.015261030962884344,121.54794935746627,COMPLETE
1159,0.3640081286430359,2023-09-04 21:40:13.298720,2023-09-04 21:40:14.173284,0 days 00:00:00.874564,Leaky,Tanh,,,100,22,20.0,,,0.00426306504585337,2,434,0.6616848068119404,4.869316811265715e-05,143.69397996601305,COMPLETE
1160,0.32712027430534363,2023-09-04 21:40:14.173719,2023-09-04 21:40:14.767348,0 days 00:00:00.593629,Leaky,Sigmoid,ReLU,Sigmoid,86,24,3.0,19.0,23.0,0.02592475630779602,4,383,0.7288850247946206,1.637765496838941e-05,127.22518531312333,COMPLETE
1161,0.6574488878250122,2023-09-04 21:40:14.767793,2023-09-04 21:40:15.297463,0 days 00:00:00.529670,Tanh,Tanh,,,35,23,22.0,,,0.000361113635254547,2,447,0.5154129173623587,0.04419599471528548,186.8260033017113,COMPLETE
1162,0.5716869235038757,2023-09-04 21:40:15.297905,2023-09-04 21:40:17.339080,0 days 00:00:02.041175,Leaky,Sigmoid,,,40,22,5.0,,,0.00016494822876334095,2,155,0.6900849144457883,0.00015317808599536026,133.7038321710402,COMPLETE
1163,0.6378954648971558,2023-09-04 21:40:17.339498,2023-09-04 21:40:23.122680,0 days 00:00:05.783182,Leaky,Leaky,,,41,23,21.0,,,2.0634465539709094e-05,2,426,0.7531520844498868,0.015310022420098277,154.29685415348536,COMPLETE
1164,0.8943043351173401,2023-09-04 21:40:23.123111,2023-09-04 21:40:23.571552,0 days 00:00:00.448441,Leaky,Tanh,,,93,24,19.0,,,3.8686079410113564e-05,2,150,0.2047943993185295,9.671038498528339e-05,124.01051844278972,COMPLETE
1165,0.34235072135925293,2023-09-04 21:40:23.572002,2023-09-04 21:40:24.259095,0 days 00:00:00.687093,Leaky,Sigmoid,,,38,21,19.0,,,0.01394768008324463,2,376,0.7996381309800764,1.1797765649897965e-05,142.72798805236818,COMPLETE
1166,0.5874742269515991,2023-09-04 21:40:24.259569,2023-09-04 21:40:24.738831,0 days 00:00:00.479262,Sigmoid,Tanh,,,80,22,20.0,,,0.0009872843913423426,2,407,0.6255494544301918,0.02698846897829322,125.55657339995761,COMPLETE
1167,0.3876490592956543,2023-09-04 21:40:24.739281,2023-09-04 21:40:25.013744,0 days 00:00:00.274463,Leaky,Sigmoid,,,76,23,19.0,,,0.018167001013077673,2,309,0.24146142905996643,1.4136601372934977e-05,386.7466526031494,COMPLETE
1168,0.366858571767807,2023-09-04 21:40:25.014179,2023-09-04 21:40:25.415712,0 days 00:00:00.401533,Tanh,Tanh,,,46,24,24.0,,,0.011506907345387665,2,284,0.33584044198958474,0.0002856494446095237,429.14453397478377,COMPLETE
1169,0.35279420018196106,2023-09-04 21:40:25.416139,2023-09-04 21:40:25.948237,0 days 00:00:00.532098,Leaky,Sigmoid,,,97,23,22.0,,,0.007859861069334964,2,263,0.7077031234127236,1.9718712778193405e-05,152.79679820576652,COMPLETE
1170,0.6027944087982178,2023-09-04 21:40:25.948677,2023-09-04 21:40:26.464156,0 days 00:00:00.515479,Leaky,Tanh,Tanh,ReLU,42,24,21.0,1.0,11.0,0.009970045793964736,4,358,0.36989371203396443,0.000909937863595489,188.00445348566228,COMPLETE
1171,0.44039487838745117,2023-09-04 21:40:26.464598,2023-09-04 21:40:27.828618,0 days 00:00:01.364020,ReLU,Sigmoid,,,95,21,23.0,,,0.001108625445965638,2,389,0.2875044990433274,0.000413173612028132,159.55687595946011,COMPLETE
1172,0.3541997969150543,2023-09-04 21:40:27.829020,2023-09-04 21:40:28.426914,0 days 00:00:00.597894,Leaky,Tanh,,,88,23,20.0,,,0.013744417721849983,2,459,0.7557768821291929,0.00013435304939991995,185.59733015491116,COMPLETE
1173,0.3617981970310211,2023-09-04 21:40:28.427329,2023-09-04 21:40:29.032824,0 days 00:00:00.605495,Leaky,Sigmoid,,,34,20,16.0,,,0.041632497224118804,2,50,0.5464816706187181,7.522871276699346e-05,265.27596846870756,COMPLETE
1174,0.6149539351463318,2023-09-04 21:40:29.033262,2023-09-04 21:40:30.199372,0 days 00:00:01.166110,Leaky,Tanh,,,78,17,17.0,,,4.3034599074242404e-05,2,117,0.7247261886633021,0.0025790001731997784,159.63360021868323,COMPLETE
1175,0.9117873907089233,2023-09-04 21:40:30.199801,2023-09-04 21:40:30.414581,0 days 00:00:00.214780,Tanh,Sigmoid,,,99,14,12.0,,,0.02029622928440637,2,419,0.4465588955318786,0.05584608421255896,158.8345990862165,COMPLETE
1176,0.41961008310317993,2023-09-04 21:40:30.415028,2023-09-04 21:40:32.820411,0 days 00:00:02.405383,Leaky,Tanh,,,28,22,20.0,,,0.0004719546013458655,2,300,0.3082888188611464,0.00024068599635382738,182.57749750773112,COMPLETE
1177,0.5859730839729309,2023-09-04 21:40:32.820844,2023-09-04 21:40:33.601152,0 days 00:00:00.780308,Leaky,Sigmoid,ReLU,,84,24,19.0,17.0,,0.0005800713810397185,3,147,0.34186251261548356,0.017080746626009873,170.99167866609534,COMPLETE
1178,0.3644218444824219,2023-09-04 21:40:33.601593,2023-09-04 21:40:34.092649,0 days 00:00:00.491056,Leaky,Tanh,,,39,22,22.0,,,0.05978587469106722,2,397,0.7722896961896747,0.0006239150366361445,258.3893290928432,COMPLETE
1179,0.38160577416419983,2023-09-04 21:40:34.093113,2023-09-04 21:40:34.786761,0 days 00:00:00.693648,Leaky,Sigmoid,Sigmoid,Sigmoid,37,23,23.0,14.0,6.0,0.005869055922799959,4,438,0.365826539212938,4.036913721039367e-05,138.95669866012315,COMPLETE
1180,0.49834924936294556,2023-09-04 21:40:34.787205,2023-09-04 21:40:35.516476,0 days 00:00:00.729271,Leaky,Leaky,,,43,24,21.0,,,0.007277541509878524,2,162,0.6739277476010734,0.03130691654545658,145.15113969282672,COMPLETE
1181,0.32710832357406616,2023-09-04 21:40:35.516890,2023-09-04 21:40:36.314323,0 days 00:00:00.797433,Tanh,Sigmoid,,,96,20,15.0,,,0.009186193259241145,2,479,0.6493601339801324,0.00011589294206000475,149.62641165597097,COMPLETE
1182,0.391369104385376,2023-09-04 21:40:36.314752,2023-09-04 21:40:36.614628,0 days 00:00:00.299876,Leaky,Tanh,,,75,23,19.0,,,0.01637508718911017,2,139,0.25139032682957113,1.1734130339886016e-05,140.62736018254208,COMPLETE
1183,0.6367147564888,2023-09-04 21:40:36.615056,2023-09-04 21:40:38.086399,0 days 00:00:01.471343,Leaky,ReLU,,,20,2,20.0,,,0.0006789528132544202,2,380,0.10774386854980472,6.591807770760562e-05,205.3859016563977,COMPLETE
1184,0.3663282096385956,2023-09-04 21:40:38.086821,2023-09-04 21:40:38.661992,0 days 00:00:00.575171,ReLU,Sigmoid,,,91,22,21.0,,,0.011536723236542612,2,127,0.7398015431871016,0.00033971818266939467,136.01952017507244,COMPLETE
1185,0.3391306400299072,2023-09-04 21:40:38.662435,2023-09-04 21:40:39.340025,0 days 00:00:00.677590,Leaky,Tanh,Tanh,Tanh,36,23,16.0,23.0,24.0,0.025382517368154178,4,282,0.698284311654201,0.00017558314649096773,123.78223139444987,COMPLETE
1186,1.0932527780532837,2023-09-04 21:40:39.340468,2023-09-04 21:40:40.283622,0 days 00:00:00.943154,Leaky,Sigmoid,,,41,21,17.0,,,2.3739942136845258e-05,2,294,0.1502144262700307,1.687469523239855e-05,188.2401543701587,COMPLETE
1187,0.6272985339164734,2023-09-04 21:40:40.284047,2023-09-04 21:40:40.484007,0 days 00:00:00.199960,Leaky,ReLU,,,98,24,20.0,,,0.0045517263925224085,2,153,0.1334960841979596,0.0648648281287755,244.358205304827,COMPLETE
1188,0.4879258871078491,2023-09-04 21:40:40.484800,2023-09-04 21:40:48.315677,0 days 00:00:07.830877,Leaky,Tanh,,,45,23,22.0,,,0.0001370869016507592,2,471,0.7996120283859387,0.018353756658537508,141.78373642129756,COMPLETE
1189,0.35954517126083374,2023-09-04 21:40:48.316100,2023-09-04 21:40:48.908264,0 days 00:00:00.592164,Tanh,Sigmoid,,,93,22,9.0,,,0.01380242718909882,2,442,0.556862895475584,2.277633301804897e-05,2187.3844261640384,COMPLETE
1190,0.3547342121601105,2023-09-04 21:40:48.908754,2023-09-04 21:40:50.053036,0 days 00:00:01.144282,Leaky,Tanh,,,32,19,18.0,,,0.010201746777175903,2,407,0.4965636838103355,1.3731095174666921e-05,150.29822619993294,COMPLETE
1191,0.44257447123527527,2023-09-04 21:40:50.053828,2023-09-04 21:40:50.765379,0 days 00:00:00.711551,Sigmoid,ReLU,,,48,24,13.0,,,0.01901813150601917,2,167,0.767455539444537,0.0012588449979552884,4271.2863552517365,COMPLETE
1192,0.3317037522792816,2023-09-04 21:40:50.765808,2023-09-04 21:40:52.137760,0 days 00:00:01.371952,Leaky,Sigmoid,,,100,23,19.0,,,0.007025495218116385,2,316,0.7232402640249849,0.0015676990550880082,159.7236371972095,COMPLETE
1193,0.34106653928756714,2023-09-04 21:40:52.138220,2023-09-04 21:40:52.893334,0 days 00:00:00.755114,Leaky,Tanh,,,82,22,19.0,,,0.01571534271298796,2,77,0.6135189907472363,0.007203699975994589,128.59159723917642,COMPLETE
1194,0.7688815593719482,2023-09-04 21:40:52.893753,2023-09-04 21:40:53.595802,0 days 00:00:00.702049,Leaky,Sigmoid,ReLU,Sigmoid,43,24,20.0,15.0,22.0,0.04702572936981982,4,430,0.75398348985843,0.004263088585686098,153.29474894205728,COMPLETE
1195,0.33560600876808167,2023-09-04 21:40:53.596297,2023-09-04 21:40:54.093455,0 days 00:00:00.497158,Leaky,ReLU,,,86,21,21.0,,,0.012118463036677503,2,158,0.48124578021021075,2.0031773712863033e-05,166.11277896410797,COMPLETE
1196,0.37816452980041504,2023-09-04 21:40:54.093895,2023-09-04 21:40:54.490014,0 days 00:00:00.396119,Tanh,Tanh,,,97,23,17.0,,,0.008501219732853673,2,146,0.2734136531164899,9.089654612790361e-05,134.11829515682754,COMPLETE
1197,0.3549858629703522,2023-09-04 21:40:54.490494,2023-09-04 21:40:55.388861,0 days 00:00:00.898367,Leaky,Sigmoid,,,78,24,24.0,,,0.0034929387619132223,2,98,0.6853434095536031,0.000530043291436406,137.6571839001714,COMPLETE
1198,0.4615808129310608,2023-09-04 21:40:55.389266,2023-09-04 21:40:55.699262,0 days 00:00:00.309996,ReLU,Tanh,,,39,22,18.0,,,0.005358271226126772,2,389,0.2211388436923185,0.011190886778074803,126.54957565307618,COMPLETE
1199,0.32686105370521545,2023-09-04 21:40:55.699683,2023-09-04 21:40:56.234179,0 days 00:00:00.534496,Leaky,ReLU,,,41,23,23.0,,,0.02878813691638523,2,417,0.7667038256504448,5.727253333850759e-05,120.32817482948303,COMPLETE
1200,1.0155611038208008,2023-09-04 21:40:56.234604,2023-09-04 21:40:56.524402,0 days 00:00:00.289798,Leaky,Sigmoid,Leaky,Sigmoid,76,21,22.0,18.0,4.0,0.02267769690548238,4,368,0.7178051727735572,0.02199115082313936,103.72747178511186,COMPLETE
1201,0.392593652009964,2023-09-04 21:40:56.524851,2023-09-04 21:41:00.575841,0 days 00:00:04.050990,Leaky,Tanh,,,95,24,20.0,,,0.0001673763283827627,2,461,0.799901206517077,1.1847061201423456e-05,141.71077433687486,COMPLETE
1202,1.002672553062439,2023-09-04 21:41:00.576258,2023-09-04 21:41:00.985994,0 days 00:00:00.409736,Leaky,Sigmoid,,,44,23,19.0,,,0.0001246320754369522,2,450,0.7418972954889886,0.08184477783206678,582.4571215820313,COMPLETE
1203,0.639900267124176,2023-09-04 21:41:00.986426,2023-09-04 21:41:01.418929,0 days 00:00:00.432503,Tanh,ReLU,,,80,22,23.0,,,0.002737327035733005,2,272,0.520228871838538,0.0525957162977382,345.3389248934659,COMPLETE
1204,0.5315489172935486,2023-09-04 21:41:01.419362,2023-09-04 21:41:04.211554,0 days 00:00:02.792192,Leaky,Tanh,,,24,23,17.0,,,8.797539485256732e-05,2,132,0.6417552684728948,0.00020329026858147722,192.91254887436375,COMPLETE
1205,0.35196784138679504,2023-09-04 21:41:04.211996,2023-09-04 21:41:04.618967,0 days 00:00:00.406971,Leaky,Leaky,,,88,24,21.0,,,0.010244962909189425,2,402,0.6972118334784992,4.453379288638719e-05,267.4170659383138,COMPLETE
1206,0.4906744360923767,2023-09-04 21:41:04.619381,2023-09-04 21:41:04.920491,0 days 00:00:00.301110,Leaky,Sigmoid,,,74,22,20.0,,,0.006416240189056193,2,289,0.10406316973773017,0.00014853239266588317,2199.02343257781,COMPLETE
1207,0.49994274973869324,2023-09-04 21:41:04.920922,2023-09-04 21:41:05.130519,0 days 00:00:00.209597,Leaky,ReLU,,,37,21,16.0,,,0.013019951178539945,2,337,0.125400275488052,1.5296614372041418e-05,207.57606263594195,COMPLETE
1208,0.44289788603782654,2023-09-04 21:41:05.130959,2023-09-04 21:41:06.378272,0 days 00:00:01.247313,Leaky,,,,90,23,,,,0.0013399688621542174,1,394,0.3208970209582932,2.98265097165736e-05,151.0727937643006,COMPLETE
1209,0.5003490447998047,2023-09-04 21:41:06.378699,2023-09-04 21:41:10.267974,0 days 00:00:03.889275,Tanh,Tanh,Tanh,,41,24,18.0,8.0,,6.664889834138116e-05,3,231,0.7750942882437701,0.00011493855579488362,171.67007730327128,COMPLETE
1210,0.4080868065357208,2023-09-04 21:41:10.268427,2023-09-04 21:41:10.795762,0 days 00:00:00.527335,Leaky,Sigmoid,,,92,24,19.0,,,0.01586923879171493,2,167,0.665280156853494,0.0039380513554198165,206.61383671914376,COMPLETE
1211,0.3441755771636963,2023-09-04 21:41:10.796196,2023-09-04 21:41:11.404628,0 days 00:00:00.608432,ReLU,Sigmoid,,,46,23,22.0,,,0.03688133582292022,2,119,0.7406444306529644,0.0008575629278198034,267.863400050572,COMPLETE
1212,0.4543095827102661,2023-09-04 21:41:11.405079,2023-09-04 21:41:11.589749,0 days 00:00:00.184670,Leaky,Tanh,,,73,22,21.0,,,0.007763720950032172,2,305,0.17016512053915983,1.0028285469073247e-05,264.30784004612974,COMPLETE
1213,0.38205623626708984,2023-09-04 21:41:11.590224,2023-09-04 21:41:12.218426,0 days 00:00:00.628202,Leaky,ReLU,ReLU,Leaky,99,22,19.0,10.0,3.0,0.018838914103950728,4,69,0.5988206458326804,0.0002743760633450918,150.88872241973877,COMPLETE
1214,0.3638017773628235,2023-09-04 21:41:12.218902,2023-09-04 21:41:13.477329,0 days 00:00:01.258427,Leaky,Sigmoid,,,95,20,18.0,,,0.0023066015868040486,2,146,0.7695097007466547,3.5597013431109515e-05,145.1604359247913,COMPLETE
1215,0.5364267230033875,2023-09-04 21:41:13.477747,2023-09-04 21:41:14.589287,0 days 00:00:01.111540,Sigmoid,Tanh,,,77,21,20.0,,,0.0008544337894377219,2,108,0.799838264536664,1.3705965697652946e-05,158.2088139851888,COMPLETE
1216,0.520441472530365,2023-09-04 21:41:14.589703,2023-09-04 21:41:15.414937,0 days 00:00:00.825234,Leaky,ReLU,,,97,23,24.0,,,0.00023356340832539587,2,158,0.41528857061638025,0.001921053966365173,180.83325504351265,COMPLETE
1217,0.37743639945983887,2023-09-04 21:41:15.415362,2023-09-04 21:41:16.006213,0 days 00:00:00.590851,Leaky,Sigmoid,,,39,24,16.0,,,0.009880335956468816,2,484,0.3624220292497643,0.0010653578914989552,562.0096514020647,COMPLETE
1218,0.32197266817092896,2023-09-04 21:41:16.006702,2023-09-04 21:41:16.509128,0 days 00:00:00.502426,Tanh,Tanh,,,43,23,18.0,,,0.012221527575105749,2,379,0.712409473759728,0.0003300086625708701,125.22249765107127,COMPLETE
1219,0.977271318435669,2023-09-04 21:41:16.509578,2023-09-04 21:41:17.079546,0 days 00:00:00.569968,Leaky,Sigmoid,,,83,24,17.0,,,2.9860505431980007e-05,2,136,0.29101975654363105,0.00041509195549884153,155.9188279544606,COMPLETE
1220,0.6364439725875854,2023-09-04 21:41:17.080017,2023-09-04 21:41:22.602943,0 days 00:00:05.522926,Leaky,Tanh,,,35,5,20.0,,,2.720180521841426e-05,2,176,0.7392795680428602,1.7608744170020045e-05,142.07997022975576,COMPLETE
1221,0.38086190819740295,2023-09-04 21:41:22.603364,2023-09-04 21:41:23.257683,0 days 00:00:00.654319,Leaky,ReLU,Tanh,ReLU,30,23,23.0,7.0,12.0,0.00866778115088626,4,425,0.4329916804198172,0.00017258801787505327,263.3101637990851,COMPLETE
1222,0.5807837843894958,2023-09-04 21:41:23.258207,2023-09-04 21:41:25.186125,0 days 00:00:01.927918,Leaky,Sigmoid,,,47,22,19.0,,,0.00015620286571911446,2,410,0.2383877790085988,2.4248842711413075e-05,200.0529372610697,COMPLETE
1223,0.3425178527832031,2023-09-04 21:41:25.186614,2023-09-04 21:41:25.988527,0 days 00:00:00.801913,Leaky,Tanh,,,93,21,21.0,,,0.0046281177779464895,2,442,0.6848962104937455,0.00023807248868914306,169.17264296982316,COMPLETE
1224,0.6393135190010071,2023-09-04 21:41:25.989030,2023-09-04 21:41:28.406712,0 days 00:00:02.417682,ReLU,Sigmoid,,,76,24,17.0,,,3.371394162994612e-05,2,249,0.7623889277529255,0.005138066081192027,190.6641713337726,COMPLETE
1225,0.38425830006599426,2023-09-04 21:41:28.407127,2023-09-04 21:41:28.796211,0 days 00:00:00.389084,Tanh,ReLU,,,100,22,15.0,,,0.021680993730625,2,280,0.45019403528649155,8.197433651563773e-05,7677.048205766521,COMPLETE
1226,0.4622938632965088,2023-09-04 21:41:28.796642,2023-09-04 21:41:37.255790,0 days 00:00:08.459148,Leaky,Tanh,Sigmoid,Sigmoid,41,23,22.0,14.0,18.0,9.166263392384638e-05,4,454,0.7209360885778896,1.2149317050983329e-05,172.17921481363572,COMPLETE
1227,0.34357258677482605,2023-09-04 21:41:37.256244,2023-09-04 21:41:37.889781,0 days 00:00:00.633537,Leaky,Sigmoid,,,44,24,11.0,,,0.015428370033397174,2,296,0.6460075976914197,0.0007183488858563488,212.5021908569336,COMPLETE
1228,0.6386474967002869,2023-09-04 21:41:37.890214,2023-09-04 21:41:38.035219,0 days 00:00:00.145005,Leaky,Leaky,,,86,23,14.0,,,0.03207265228576376,2,433,0.3388142558883901,0.0627927749612328,305.9401062011719,COMPLETE
1229,0.4419305622577667,2023-09-04 21:41:38.035643,2023-09-04 21:41:38.314503,0 days 00:00:00.278860,Leaky,ReLU,,,33,22,19.0,,,0.006210164672726834,2,322,0.1414546331291662,0.00010645248274000883,647.076595373321,COMPLETE
1230,0.3589068353176117,2023-09-04 21:41:38.314926,2023-09-04 21:41:39.443583,0 days 00:00:01.128657,Leaky,Tanh,,,97,20,20.0,,,0.0016976080077051635,2,219,0.7678308760544271,0.00012503731695069902,181.7187221646309,COMPLETE
1231,0.3780806064605713,2023-09-04 21:41:39.444057,2023-09-04 21:41:40.035821,0 days 00:00:00.591764,Tanh,Sigmoid,ReLU,,38,21,19.0,12.0,,0.010914003965335053,3,152,0.5775723643173791,1.0086995735472592e-05,143.89946231326542,COMPLETE
1232,0.41771745681762695,2023-09-04 21:41:40.036279,2023-09-04 21:41:43.059818,0 days 00:00:03.023539,Leaky,Tanh,,,94,16,18.0,,,0.0002110260007253884,2,391,0.7011186318298068,0.0006105519590814786,215.45980887644737,COMPLETE
1233,0.8501711487770081,2023-09-04 21:41:43.060239,2023-09-04 21:41:44.403204,0 days 00:00:01.342965,Leaky,Sigmoid,,,90,23,21.0,,,3.979366983391504e-05,2,466,0.20897251589719326,1.9937335858538106e-05,153.2506163110037,COMPLETE
1234,0.7770413160324097,2023-09-04 21:41:44.403634,2023-09-04 21:41:45.282343,0 days 00:00:00.878709,Leaky,ReLU,,,80,24,20.0,,,2.5665179653115784e-05,2,166,0.39379914113314346,0.0035432131017734876,99.89517386562854,COMPLETE
1235,0.32787615060806274,2023-09-04 21:41:45.282765,2023-09-04 21:41:46.146965,0 days 00:00:00.864200,Leaky,Tanh,,,74,22,24.0,,,0.008979743509852173,2,414,0.7999594312546349,1.6206631111419927e-05,3576.794761657715,COMPLETE
1236,1.084059476852417,2023-09-04 21:41:46.147390,2023-09-04 21:41:46.686440,0 days 00:00:00.539050,Leaky,Sigmoid,,,42,24,23.0,,,1.1990735495143795e-05,2,140,0.15973090281787264,0.027855961126646848,254.26466881888254,COMPLETE
1237,0.4187007546424866,2023-09-04 21:41:46.686932,2023-09-04 21:41:47.383816,0 days 00:00:00.696884,Tanh,ReLU,,,40,23,18.0,,,0.0016031957295328156,2,156,0.19525350726914434,0.003152869344753691,133.89094846676556,COMPLETE
1238,0.49114394187927246,2023-09-04 21:41:47.384299,2023-09-04 21:41:47.653259,0 days 00:00:00.268960,ReLU,Tanh,Tanh,Sigmoid,88,21,22.0,20.0,7.0,0.01405083815584983,4,369,0.1159293169578244,0.00021098959174773327,248.45181914906442,COMPLETE
1239,0.40116339921951294,2023-09-04 21:41:47.653976,2023-09-04 21:41:50.942756,0 days 00:00:03.288780,Leaky,Sigmoid,,,72,22,21.0,,,0.0006474264867471616,2,349,0.7324155552312895,0.0005038340260485526,159.18612736480625,COMPLETE
