number,value,datetime_start,datetime_complete,duration,params_activation1,params_activation2,params_activation3,params_activation4,params_batch_size,params_fl1,params_fl2,params_fl3,params_fl4,params_learning_rate,params_n_layers,params_num_epochs,params_train_size,params_weight_decay,user_attrs_mre,state
1694,0.23670972883701324,2023-09-04 22:46:11.025516,2023-09-04 22:46:13.001546,0 days 00:00:01.976030,Tanh,Leaky,Sigmoid,Leaky,33,18,22.0,21.0,22.0,0.01515553733938563,4,250,0.7252715565622337,2.232860509188772e-05,92.95387502817007,COMPLETE
1695,0.6907934546470642,2023-09-04 22:46:13.002545,2023-09-04 22:46:20.836103,0 days 00:00:07.833558,ReLU,Leaky,Sigmoid,ReLU,91,19,19.0,24.0,7.0,3.460747472937677e-05,4,280,0.6655945733481166,0.0001831735024879857,172.2897830418178,COMPLETE
1696,0.4339498281478882,2023-09-04 22:46:20.837104,2023-09-04 22:46:21.825848,0 days 00:00:00.988744,Tanh,Leaky,Sigmoid,Tanh,87,17,21.0,20.0,18.0,0.012538915198521966,4,268,0.20213886626428432,3.6711479897878666e-05,159.1570610739968,COMPLETE
1697,0.4399905502796173,2023-09-04 22:46:21.826851,2023-09-04 22:46:22.743575,0 days 00:00:00.916724,Leaky,Leaky,ReLU,Sigmoid,79,20,20.0,15.0,4.0,0.019601940275167533,4,236,0.509528632132398,9.29143361961808e-05,164.0988461421086,COMPLETE
1698,0.4552026093006134,2023-09-04 22:46:22.744575,2023-09-04 22:46:23.685593,0 days 00:00:00.941018,Sigmoid,Leaky,Sigmoid,Leaky,84,21,19.0,14.0,5.0,0.014270414150382141,4,258,0.2588922459086619,6.412074718282958e-05,187.55039427015515,COMPLETE
1699,0.37062355875968933,2023-09-04 22:46:23.686620,2023-09-04 22:46:25.225437,0 days 00:00:01.538817,Tanh,ReLU,Sigmoid,Leaky,88,18,22.0,23.0,17.0,0.008108679944933144,4,229,0.7710136525454687,0.0001327575237018503,111.0639458733636,COMPLETE
1700,0.3640208840370178,2023-09-04 22:46:25.226447,2023-09-04 22:46:26.586362,0 days 00:00:01.359915,Tanh,Leaky,Sigmoid,,81,21,20.0,22.0,,0.017046001420633002,3,245,0.7990008699063444,0.00021912943525662895,163.73147190638952,COMPLETE
1701,0.3991129696369171,2023-09-04 22:46:26.587348,2023-09-04 22:46:28.798834,0 days 00:00:02.211486,ReLU,Tanh,Sigmoid,Sigmoid,30,19,23.0,19.0,15.0,0.032119968845725634,4,179,0.36336421894362625,0.00015535276223355032,145.0790340717022,COMPLETE
1702,0.33798328042030334,2023-09-04 22:46:28.799829,2023-09-04 22:46:31.153329,0 days 00:00:02.353500,Leaky,Leaky,ReLU,Leaky,85,15,21.0,23.0,20.0,0.0026590403949081753,4,292,0.40513898939302284,1.2344484851137462e-05,118.44537771665134,COMPLETE
1703,0.43628087639808655,2023-09-04 22:46:31.154346,2023-09-04 22:46:33.317730,0 days 00:00:02.163384,Sigmoid,Leaky,Sigmoid,Leaky,83,17,19.0,16.0,2.0,0.010370269712917428,4,215,0.39508885175945285,9.618748002576579e-05,493.40608719020213,COMPLETE
1704,0.28383567929267883,2023-09-04 22:46:33.318741,2023-09-04 22:46:37.527439,0 days 00:00:04.208698,Tanh,Sigmoid,Sigmoid,Sigmoid,48,10,21.0,24.0,7.0,0.006606419397029798,4,240,0.7391873987799692,5.198797533243179e-05,175.94001569747925,COMPLETE
1705,0.46794334053993225,2023-09-04 22:46:37.528456,2023-09-04 22:46:39.247555,0 days 00:00:01.719099,Tanh,Leaky,Sigmoid,Leaky,54,19,20.0,16.0,9.0,0.02292360959924145,4,301,0.4249845480256686,0.0078075533947475515,190.02853623876032,COMPLETE
1706,0.44271278381347656,2023-09-04 22:46:39.248609,2023-09-04 22:46:44.786578,0 days 00:00:05.537969,ReLU,Leaky,ReLU,Sigmoid,90,14,18.0,23.0,19.0,0.00020140855942682754,4,256,0.4594677376610781,7.107757571527859e-05,111.02290761470795,COMPLETE
1707,0.7587096691131592,2023-09-04 22:46:44.787604,2023-09-04 22:46:45.296881,0 days 00:00:00.509277,Tanh,Leaky,Sigmoid,Leaky,32,22,20.0,15.0,3.0,0.08901859977373995,4,166,0.11604168650278937,0.07982496188003421,101.97842491997613,COMPLETE
1708,0.8892176747322083,2023-09-04 22:46:45.297912,2023-09-04 22:47:00.612924,0 days 00:00:15.315012,Sigmoid,Leaky,Sigmoid,Leaky,27,18,17.0,24.0,1.0,1.2982698742236826e-05,4,223,0.6247177437725997,0.0002762532473174586,374.13312198656024,COMPLETE
1709,0.3676575720310211,2023-09-04 22:47:00.613927,2023-09-04 22:47:05.305324,0 days 00:00:04.691397,Leaky,Leaky,Sigmoid,Sigmoid,78,16,19.0,11.0,5.0,0.0035787482698913494,4,268,0.7031597712418346,0.0052641945863687745,126.28520553918193,COMPLETE
1710,0.7670407891273499,2023-09-04 22:47:05.306315,2023-09-04 22:47:14.671927,0 days 00:00:09.365612,Tanh,Leaky,Leaky,ReLU,86,20,21.0,22.0,17.0,1.6386392160467445e-05,4,277,0.7515408109027846,0.00011706423332094277,92.47237616583759,COMPLETE
1711,0.3560858964920044,2023-09-04 22:47:14.672957,2023-09-04 22:47:16.453457,0 days 00:00:01.780500,Tanh,Leaky,Sigmoid,Leaky,88,21,20.0,23.0,4.0,0.0021426724328406713,4,230,0.1842481718719039,0.0001563819840833257,173.83006169245795,COMPLETE
1712,1.1145875453948975,2023-09-04 22:47:16.454503,2023-09-04 22:47:18.076603,0 days 00:00:01.622100,ReLU,Leaky,ReLU,Sigmoid,83,12,21.0,16.0,7.0,8.751656248522292e-05,4,306,0.12329182585828728,0.01822571909169584,209.25134338378905,COMPLETE
1713,0.327704519033432,2023-09-04 22:47:18.077603,2023-09-04 22:47:23.551803,0 days 00:00:05.474200,Sigmoid,Leaky,Sigmoid,Leaky,46,18,22.0,17.0,13.0,0.011447954217239485,4,248,0.7213571664592525,0.0001991088444966503,126.42942520141601,COMPLETE
1714,1.1368931531906128,2023-09-04 22:47:23.552837,2023-09-04 22:47:24.590692,0 days 00:00:01.037855,Leaky,ReLU,Sigmoid,Leaky,35,19,18.0,18.0,18.0,0.0014179315426654602,4,289,0.7726913479276375,0.027075256836774836,101.14989124644886,COMPLETE
1715,0.8517858386039734,2023-09-04 22:47:24.591736,2023-09-04 22:47:26.921249,0 days 00:00:02.329513,Tanh,Leaky,Sigmoid,Sigmoid,85,9,19.0,24.0,16.0,3.905653748078538e-05,4,195,0.2244650290358127,7.998251163701553e-05,230.5079772949219,COMPLETE
1716,0.5394976735115051,2023-09-04 22:47:26.922251,2023-09-04 22:47:34.771151,0 days 00:00:07.848900,Tanh,Leaky,Tanh,Leaky,92,20,20.0,21.0,8.0,5.91011812668763e-05,4,261,0.6829636146369388,0.0006526076881940993,140.12223827610526,COMPLETE
1717,0.3236905336380005,2023-09-04 22:47:34.772218,2023-09-04 22:47:37.301551,0 days 00:00:02.529333,Sigmoid,Leaky,ReLU,Leaky,81,17,19.0,14.0,6.0,0.014574463741407926,4,239,0.7998606045650517,1.803048769957143e-05,134.831934819456,COMPLETE
1718,0.31541693210601807,2023-09-04 22:47:37.302625,2023-09-04 22:47:40.041408,0 days 00:00:02.738783,ReLU,Leaky,Sigmoid,Sigmoid,29,23,20.0,22.0,19.0,0.019395523211196114,4,207,0.5950761133156576,0.00036233216692475244,384.98623813726965,COMPLETE
1719,0.32532116770744324,2023-09-04 22:47:40.042485,2023-09-04 22:47:57.677534,0 days 00:00:17.635049,Tanh,Leaky,Sigmoid,Leaky,32,19,21.0,23.0,6.0,0.00035293940115554474,4,251,0.7451651220756721,0.0001773717761767697,107.5816114188198,COMPLETE
1720,0.5541693568229675,2023-09-04 22:47:57.678630,2023-09-04 22:47:58.453305,0 days 00:00:00.774675,Leaky,Leaky,Sigmoid,Sigmoid,23,11,22.0,8.0,4.0,0.026773306144573922,4,231,0.10054480601796358,0.0005459699371480163,352.41873931884766,COMPLETE
1721,0.28206610679626465,2023-09-04 22:47:58.454339,2023-09-04 22:47:59.569750,0 days 00:00:01.115411,Tanh,Leaky,ReLU,Leaky,87,18,20.0,24.0,5.0,0.009148377412545478,4,221,0.7137984576277814,4.2076645580074033e-05,103.22946020273062,COMPLETE
1722,0.8203655481338501,2023-09-04 22:47:59.570773,2023-09-04 22:48:00.160521,0 days 00:00:00.589748,Sigmoid,Leaky,,,42,21,21.0,,,0.01700955588335885,2,153,0.15487374601401815,0.0634808450298986,157.00004177093507,COMPLETE
1723,0.39754271507263184,2023-09-04 22:48:00.161487,2023-09-04 22:48:01.993061,0 days 00:00:01.831574,Tanh,Leaky,Sigmoid,Tanh,80,22,19.0,15.0,20.0,0.012292221016234115,4,323,0.6503433746907442,0.006396453779508711,946.4870904775767,COMPLETE
1724,0.6445763111114502,2023-09-04 22:48:01.994108,2023-09-04 22:48:09.606063,0 days 00:00:07.611955,ReLU,,,,51,20,,,,2.085854140927913e-05,1,270,0.7708968511029771,0.0018891747265755326,129.66675203111436,COMPLETE
1725,0.3063880503177643,2023-09-04 22:48:09.607051,2023-09-04 22:48:10.841611,0 days 00:00:01.234560,Leaky,Leaky,Sigmoid,Leaky,83,18,18.0,12.0,7.0,0.023848407563699138,4,244,0.35636349933390243,0.00012908322794719104,87.05522813188269,COMPLETE
1726,1.141417384147644,2023-09-04 22:48:10.842638,2023-09-04 22:48:11.625638,0 days 00:00:00.783000,Tanh,Leaky,Sigmoid,ReLU,77,19,22.0,23.0,3.0,0.005468333298068902,4,281,0.566746927985321,5.886553131048517e-05,141.87869576846853,COMPLETE
1727,0.47458574175834656,2023-09-04 22:48:11.626673,2023-09-04 22:48:14.600404,0 days 00:00:02.973731,Sigmoid,ReLU,Sigmoid,Sigmoid,85,10,20.0,22.0,21.0,0.002594565436798787,4,311,0.7439562012218683,0.00010292341694934762,155.7555594444275,COMPLETE
1728,0.5405913591384888,2023-09-04 22:48:14.601430,2023-09-04 22:48:22.407432,0 days 00:00:07.806002,Tanh,Tanh,ReLU,Leaky,89,17,21.0,15.0,19.0,2.868262036098226e-05,4,259,0.6871749156446313,1.4741945373472996e-05,141.28598225715078,COMPLETE
1729,0.4196453392505646,2023-09-04 22:48:22.408517,2023-09-04 22:48:26.657855,0 days 00:00:04.249338,ReLU,Leaky,Sigmoid,Sigmoid,36,20,20.0,16.0,18.0,0.001080752541153874,4,184,0.7706371932236828,0.00023534164075888922,97.05429252249296,COMPLETE
1730,0.30803269147872925,2023-09-04 22:48:26.658999,2023-09-04 22:48:29.720147,0 days 00:00:03.061148,Tanh,Sigmoid,Sigmoid,Leaky,33,18,17.0,23.0,15.0,0.04749221490652765,4,298,0.5371530210633573,1.1945881990597952e-05,167.33310304369246,COMPLETE
1731,0.3572680354118347,2023-09-04 22:48:29.721199,2023-09-04 22:48:30.631714,0 days 00:00:00.910515,Leaky,Leaky,Sigmoid,Leaky,87,19,19.0,24.0,5.0,0.014225481949733507,4,236,0.22023608484562218,3.121011676688083e-05,92.46901564164595,COMPLETE
1732,1.0507454872131348,2023-09-04 22:48:30.632860,2023-09-04 22:48:31.302945,0 days 00:00:00.670085,Sigmoid,Leaky,ReLU,Sigmoid,83,18,20.0,13.0,17.0,0.007361912550351902,4,253,0.3864058038469373,0.022737361386269455,103.60068092346191,COMPLETE
1733,0.3326853811740875,2023-09-04 22:48:31.303991,2023-09-04 22:48:32.806074,0 days 00:00:01.502083,Tanh,Leaky,Sigmoid,Leaky,30,19,21.0,17.0,6.0,0.019496716133875207,4,226,0.25074342355739077,0.00029536600834956814,102.22407133682914,COMPLETE
1734,0.43134504556655884,2023-09-04 22:48:32.807379,2023-09-04 22:48:36.778504,0 days 00:00:03.971125,Tanh,Leaky,Sigmoid,Sigmoid,26,13,19.0,23.0,16.0,0.01037176053137227,4,243,0.722589019004413,2.216122925606786e-05,107.50187733968099,COMPLETE
1735,0.26790651679039,2023-09-04 22:48:36.779554,2023-09-04 22:48:39.586291,0 days 00:00:02.806737,ReLU,Leaky,Sigmoid,Leaky,38,21,23.0,14.0,2.0,0.016091949077339962,4,288,0.7985711199080646,0.00015766853475055102,106.229247655624,COMPLETE
1736,0.36587077379226685,2023-09-04 22:48:39.587304,2023-09-04 22:48:41.487919,0 days 00:00:01.900615,Sigmoid,Leaky,Leaky,Leaky,75,10,20.0,24.0,14.0,0.012672464053246723,4,216,0.40500508582649136,6.98136445217752e-05,124.41901933824694,COMPLETE
1737,0.3435075879096985,2023-09-04 22:48:41.489006,2023-09-04 22:48:42.518730,0 days 00:00:01.029724,Tanh,Leaky,Sigmoid,Sigmoid,85,18,21.0,15.0,8.0,0.008556563713667609,4,234,0.31655152926980046,8.613025755550099e-05,159.78221373862408,COMPLETE
1738,1.0865821838378906,2023-09-04 22:48:42.519790,2023-09-04 22:48:42.985321,0 days 00:00:00.465531,Leaky,Leaky,ReLU,Leaky,91,2,20.0,22.0,4.0,0.021720584220178155,4,265,0.14225421089738435,0.0015647244007236838,102.01925804501488,COMPLETE
1739,0.40506577491760254,2023-09-04 22:48:42.986365,2023-09-04 22:48:43.721496,0 days 00:00:00.735131,Tanh,Leaky,Sigmoid,ReLU,28,17,22.0,16.0,6.0,0.03626352443522755,4,274,0.10812741852464496,1.0014872618861485e-05,180.38259482383728,COMPLETE
1740,0.4202916920185089,2023-09-04 22:48:43.722554,2023-09-04 22:48:46.899455,0 days 00:00:03.176901,ReLU,Leaky,Sigmoid,,81,22,18.0,24.0,,0.0004449144541287765,3,248,0.7428217231305717,0.0009293209858251338,442.7745819091797,COMPLETE
1741,0.3131971061229706,2023-09-04 22:48:46.900463,2023-09-04 22:48:49.041997,0 days 00:00:02.141534,Sigmoid,Leaky,Sigmoid,Leaky,87,16,19.0,23.0,18.0,0.030820446351004938,4,258,0.7016867916160775,2.728445916119911e-05,137.2583444313925,COMPLETE
1742,0.8275788426399231,2023-09-04 22:48:49.043022,2023-09-04 22:48:50.901378,0 days 00:00:01.858356,Tanh,ReLU,Tanh,Sigmoid,31,19,21.0,22.0,5.0,0.07710068190083383,4,228,0.6618198365708728,0.000186411774650415,211.23538832231,COMPLETE
1743,0.2593371868133545,2023-09-04 22:48:50.902417,2023-09-04 22:48:52.630116,0 days 00:00:01.727699,Leaky,Leaky,ReLU,Leaky,60,20,20.0,21.0,9.0,0.017165596914850888,4,206,0.7643928241857975,0.0001124648555311343,88.94515112674597,COMPLETE
1744,0.37788572907447815,2023-09-04 22:48:52.631170,2023-09-04 22:48:54.375526,0 days 00:00:01.744356,Tanh,Leaky,Sigmoid,Sigmoid,84,11,20.0,15.0,17.0,0.003397356024533485,4,302,0.44034991404097634,5.323057837485115e-05,124.96665158952986,COMPLETE
1745,0.7274609804153442,2023-09-04 22:48:54.376632,2023-09-04 22:49:01.983507,0 days 00:00:07.606875,Tanh,Leaky,Sigmoid,Leaky,89,10,19.0,16.0,3.0,3.953551491432342e-05,4,243,0.7244692475309499,0.00014204080145560554,330.1819567896211,COMPLETE
1746,0.9866176843643188,2023-09-04 22:49:01.984538,2023-09-04 22:49:03.088555,0 days 00:00:01.104017,Sigmoid,Leaky,Sigmoid,Leaky,79,20,21.0,17.0,20.0,0.01115816346863306,4,282,0.773152486905085,0.006621362915010421,138.17864459493885,COMPLETE
1747,0.35430067777633667,2023-09-04 22:49:03.089557,2023-09-04 22:49:04.941537,0 days 00:00:01.851980,ReLU,Leaky,ReLU,Sigmoid,34,21,22.0,23.0,7.0,0.013837791230139595,4,221,0.6137476450473146,0.00731389332248287,189.21886942936823,COMPLETE
1748,0.40129297971725464,2023-09-04 22:49:04.942558,2023-09-04 22:49:05.879822,0 days 00:00:00.937264,Tanh,Leaky,Sigmoid,Tanh,82,23,10.0,24.0,5.0,0.026412588944440405,4,236,0.23282597076083278,0.0010599540420879099,162.39140687165437,COMPLETE
1749,0.43974822759628296,2023-09-04 22:49:05.880866,2023-09-04 22:49:11.090222,0 days 00:00:05.209356,Leaky,Leaky,Sigmoid,Leaky,56,18,18.0,22.0,19.0,0.00024641331265749827,4,252,0.32582242217681145,0.00021772784692226284,142.50246868436298,COMPLETE
1750,0.39672142267227173,2023-09-04 22:49:11.091250,2023-09-04 22:49:12.558498,0 days 00:00:01.467248,Tanh,Leaky,Sigmoid,Sigmoid,93,15,20.0,23.0,23.0,0.009364265173696673,4,270,0.351229003635111,0.002599225135408763,137.06615568462172,COMPLETE
1751,0.2978677749633789,2023-09-04 22:49:12.559499,2023-09-04 22:49:14.861737,0 days 00:00:02.302238,Sigmoid,Tanh,Sigmoid,Leaky,85,19,21.0,16.0,16.0,0.0060716150423632655,4,193,0.6874594066068083,8.64806907389282e-05,215.85358541152056,COMPLETE
1752,0.9153650403022766,2023-09-04 22:49:14.862812,2023-09-04 22:49:15.577328,0 days 00:00:00.714516,ReLU,Sigmoid,ReLU,Leaky,88,20,23.0,24.0,1.0,0.001570423177953921,4,173,0.23810751854214746,0.04290038557535112,101.78103847503662,COMPLETE
1753,0.4587624669075012,2023-09-04 22:49:15.578347,2023-09-04 22:49:16.339176,0 days 00:00:00.760829,Tanh,Leaky,Sigmoid,ReLU,83,17,19.0,20.0,17.0,0.020998892482530042,4,313,0.11698153468227108,4.595768879201441e-05,352.3074608627631,COMPLETE
1754,0.42110803723335266,2023-09-04 22:49:16.340241,2023-09-04 22:49:17.355528,0 days 00:00:01.015287,Leaky,Leaky,Sigmoid,Sigmoid,90,18,20.0,14.0,6.0,0.002048297573150648,4,293,0.1505481202503586,0.000313101278184432,181.39201856126974,COMPLETE
1755,0.6723865270614624,2023-09-04 22:49:17.356589,2023-09-04 22:49:30.886259,0 days 00:00:13.529670,Tanh,ReLU,Sigmoid,Leaky,39,21,21.0,12.0,8.0,5.1416205902898576e-05,4,211,0.799562332364895,0.0029510642957019688,188.0401944707355,COMPLETE
1756,0.320324569940567,2023-09-04 22:49:30.887331,2023-09-04 22:49:32.630299,0 days 00:00:01.742968,Sigmoid,Leaky,ReLU,Leaky,96,19,19.0,23.0,18.0,0.01567891803550675,4,263,0.7344258237118051,0.00012794316829034587,118.04674530029297,COMPLETE
1757,0.4546162188053131,2023-09-04 22:49:32.631422,2023-09-04 22:49:34.043755,0 days 00:00:01.412333,Tanh,Leaky,Sigmoid,Sigmoid,80,18,17.0,15.0,4.0,0.01241640804011623,4,243,0.4217190208601466,0.0013980583698219014,443.2892532348633,COMPLETE
1758,0.2805997431278229,2023-09-04 22:49:34.044801,2023-09-04 22:49:36.330874,0 days 00:00:02.286073,ReLU,Leaky,Sigmoid,Leaky,86,12,20.0,23.0,5.0,0.004097786711498237,4,229,0.7535313040402777,1.4327783889455527e-05,114.03833783467611,COMPLETE
1759,1.0890238285064697,2023-09-04 22:49:36.331938,2023-09-04 22:49:37.681859,0 days 00:00:01.349921,Tanh,Leaky,Sigmoid,Sigmoid,30,9,22.0,16.0,19.0,0.0008409736561898755,4,254,0.7085527659061517,0.026684531971674405,102.98308445857121,COMPLETE
1760,0.6161826252937317,2023-09-04 22:49:37.682884,2023-09-04 22:49:39.421400,0 days 00:00:01.738516,Leaky,Leaky,Sigmoid,Leaky,84,17,11.0,24.0,20.0,0.0029501510604778283,4,277,0.13243072572904407,0.012550268980946272,3550.3355823998313,COMPLETE
1761,0.9547138810157776,2023-09-04 22:49:39.422432,2023-09-04 22:49:40.053314,0 days 00:00:00.630882,Sigmoid,Leaky,Leaky,Leaky,44,19,20.0,10.0,7.0,0.007408330759680144,4,236,0.12436533222764576,0.07024872431654215,103.46255050166961,COMPLETE
1762,0.37604594230651855,2023-09-04 22:49:40.054364,2023-09-04 22:49:40.924777,0 days 00:00:00.870413,Tanh,Leaky,ReLU,Sigmoid,34,22,19.0,22.0,6.0,0.01830675643049731,4,325,0.3717231020322317,0.00025704786316349716,108.06874802533318,COMPLETE
1763,0.571638822555542,2023-09-04 22:49:40.925803,2023-09-04 22:49:45.484823,0 days 00:00:04.559020,ReLU,Leaky,Sigmoid,Leaky,82,18,21.0,18.0,18.0,4.208927855131111e-05,4,246,0.7702999098249704,6.818240500061619e-05,125.87629578753216,COMPLETE
1764,0.2369236797094345,2023-09-04 22:49:45.485345,2023-09-04 22:49:46.518002,0 days 00:00:01.032657,Tanh,Leaky,Sigmoid,Sigmoid,88,21,20.0,15.0,5.0,0.010467331531830703,4,219,0.6561900869405548,0.00019677850455871633,90.88865787281709,COMPLETE
1765,0.3287324607372284,2023-09-04 22:49:46.518539,2023-09-04 22:49:47.377536,0 days 00:00:00.858997,Sigmoid,Leaky,Sigmoid,Leaky,32,20,22.0,23.0,17.0,0.014826927897447186,4,259,0.30278004561487426,9.534356210924992e-05,7601.690741373698,COMPLETE
1766,0.3630179464817047,2023-09-04 22:49:47.378068,2023-09-04 22:49:48.850058,0 days 00:00:01.471990,Leaky,Leaky,Tanh,Leaky,28,11,19.0,24.0,3.0,0.023452022179351842,4,228,0.7406654910371578,1.8025261940534138e-05,123.62614805048162,COMPLETE
1767,0.27166569232940674,2023-09-04 22:49:48.851077,2023-09-04 22:49:49.995271,0 days 00:00:01.144194,Tanh,ReLU,ReLU,ReLU,36,19,21.0,16.0,2.0,0.006491324587963174,4,287,0.706268128093986,0.00016559656762736975,1105.7306920831854,COMPLETE
1768,0.3115513026714325,2023-09-04 22:49:49.995795,2023-09-04 22:49:50.968457,0 days 00:00:00.972662,Tanh,Leaky,Sigmoid,Sigmoid,86,9,20.0,23.0,13.0,0.01318568959930775,4,202,0.7699449845699751,5.919269290020125e-05,197.78921341569458,COMPLETE
1769,0.30545127391815186,2023-09-04 22:49:50.969044,2023-09-04 22:49:51.570954,0 days 00:00:00.601910,ReLU,Leaky,Sigmoid,Leaky,91,18,18.0,14.0,16.0,0.017840277063040203,4,301,0.7988737970298939,0.0005176043245448547,129.8763795332475,COMPLETE
1770,0.49639421701431274,2023-09-04 22:49:51.571455,2023-09-04 22:49:51.951456,0 days 00:00:00.380001,Sigmoid,Leaky,Sigmoid,Sigmoid,81,14,21.0,17.0,4.0,0.028881433641123402,4,266,0.6760424184057352,0.00010635307816540827,188.21035621279762,COMPLETE
1771,0.32690364122390747,2023-09-04 22:49:51.951967,2023-09-04 22:49:52.366828,0 days 00:00:00.414861,Tanh,Leaky,ReLU,Leaky,84,19,20.0,22.0,6.0,0.008906901857514835,4,241,0.7289071452068354,0.00023642089935168117,104.85909461975098,COMPLETE
1772,0.40054386854171753,2023-09-04 22:49:52.367351,2023-09-04 22:49:52.935895,0 days 00:00:00.568544,Leaky,Leaky,Sigmoid,Tanh,25,16,21.0,24.0,19.0,0.011316752017111202,4,253,0.45644572168235215,0.0001355566378750629,166.69610562531844,COMPLETE
1773,0.44841623306274414,2023-09-04 22:49:52.936914,2023-09-04 22:49:53.491418,0 days 00:00:00.554504,Tanh,Leaky,Sigmoid,Leaky,87,11,19.0,15.0,15.0,0.005509880799824093,4,217,0.23374613486792736,7.905035920713895e-05,165.71963399251302,COMPLETE
1774,0.39549168944358826,2023-09-04 22:49:53.491938,2023-09-04 22:49:54.203708,0 days 00:00:00.711770,Sigmoid,Tanh,Sigmoid,Sigmoid,78,10,18.0,23.0,21.0,0.02130218205902217,4,274,0.7675306202314532,3.497519187342262e-05,141.29054562250772,COMPLETE
1775,0.5094252824783325,2023-09-04 22:49:54.204221,2023-09-04 22:49:54.700222,0 days 00:00:00.496001,ReLU,Leaky,Sigmoid,Leaky,85,20,20.0,16.0,7.0,0.01493274747784165,4,162,0.29197779825006864,1.1925724699073224e-05,207.84545764588472,COMPLETE
1776,0.39805173873901367,2023-09-04 22:49:54.700743,2023-09-04 22:49:56.571752,0 days 00:00:01.871009,Tanh,Leaky,ReLU,Leaky,89,7,23.0,21.0,5.0,0.0001392885101983887,4,235,0.5161950668146732,0.0001803110500012533,110.14610589210024,COMPLETE
1777,0.4112246036529541,2023-09-04 22:49:56.572257,2023-09-04 22:49:57.144677,0 days 00:00:00.572420,Leaky,Sigmoid,,,82,19,22.0,,,0.002534477944621032,2,313,0.34912431646247805,0.00037031427197635095,174.6124304675181,COMPLETE
1778,0.3764888346195221,2023-09-04 22:49:57.145169,2023-09-04 22:49:57.544756,0 days 00:00:00.399587,Tanh,Leaky,Sigmoid,Sigmoid,31,17,20.0,24.0,18.0,0.04028904678676595,4,226,0.19024961235655954,0.0004348817091639399,192.96707270695612,COMPLETE
1779,0.3635256886482239,2023-09-04 22:49:57.545278,2023-09-04 22:50:00.450899,0 days 00:00:02.905621,Sigmoid,Leaky,Sigmoid,Leaky,94,21,19.0,23.0,17.0,0.0016872485238824952,4,248,0.7469016535727048,0.0019306594294629322,170.0115213533727,COMPLETE
1780,0.35158267617225647,2023-09-04 22:50:00.451937,2023-09-04 22:50:01.077123,0 days 00:00:00.625186,Tanh,Leaky,Sigmoid,,33,18,21.0,22.0,,0.01799440170115644,3,290,0.1360269140609466,2.427153450076997e-05,87.41458320617676,COMPLETE
1781,0.45479223132133484,2023-09-04 22:50:01.077652,2023-09-04 22:50:01.600736,0 days 00:00:00.523084,ReLU,Leaky,ReLU,Sigmoid,40,22,20.0,24.0,9.0,0.0011454341072897128,4,259,0.16419513687419743,4.816306840334204e-05,102.2658016320431,COMPLETE
1782,0.7053781747817993,2023-09-04 22:50:01.601267,2023-09-04 22:50:04.372574,0 days 00:00:02.771307,Tanh,ReLU,Sigmoid,ReLU,80,19,19.0,15.0,5.0,0.0001449560594868649,4,237,0.6239623678724232,0.00011168355077899855,108.9048676953537,COMPLETE
