number,value,datetime_start,datetime_complete,duration,params_activation1,params_activation2,params_activation3,params_activation4,params_activation5,params_batch_size,params_fl1,params_fl2,params_fl3,params_fl4,params_fl5,params_learning_rate,params_n_layers,params_num_epochs,params_train_size,params_weight_decay,state
485,0.1347862184047699,2023-08-23 21:15:54.504163,2023-08-23 21:16:03.779944,0 days 00:00:09.275781,Leaky,Leaky,Leaky,Tanh,,10,18,24.0,23.0,16.0,,0.00770276709517226,4,60,0.7983229384002586,4.249064238178309e-05,COMPLETE
486,0.16343770921230316,2023-08-23 21:16:03.780311,2023-08-23 21:16:12.826820,0 days 00:00:09.046509,Leaky,Leaky,Leaky,Tanh,,10,21,24.0,23.0,16.0,,0.007599122142590586,4,60,0.7988453593883488,4.687747279308408e-05,COMPLETE
487,0.13917258381843567,2023-08-23 21:16:12.827172,2023-08-23 21:16:21.562752,0 days 00:00:08.735580,Leaky,Leaky,Leaky,Tanh,,10,20,24.0,23.0,16.0,,0.006246125698264552,4,60,0.7742385977174531,4.5913522060118645e-05,COMPLETE
488,0.1701853722333908,2023-08-23 21:16:21.563130,2023-08-23 21:16:30.292058,0 days 00:00:08.728928,Leaky,Leaky,Leaky,Tanh,,10,20,24.0,23.0,16.0,,0.0012464196200173625,4,60,0.777606266160215,3.8260626385792135e-05,COMPLETE
489,0.1772533506155014,2023-08-23 21:16:30.292393,2023-08-23 21:16:38.220384,0 days 00:00:07.927991,Leaky,Leaky,Leaky,Tanh,,10,20,24.0,22.0,16.0,,0.006727745587924619,4,60,0.710276673690765,4.497550057678169e-05,COMPLETE
490,0.20281389355659485,2023-08-23 21:16:38.220727,2023-08-23 21:16:41.806188,0 days 00:00:03.585461,Leaky,Leaky,Leaky,Tanh,,10,18,24.0,23.0,15.0,,0.004925835885498579,4,60,0.306717200860329,6.725427864924347e-05,COMPLETE
491,0.19501782953739166,2023-08-23 21:16:41.806571,2023-08-23 21:16:45.489987,0 days 00:00:03.683416,Leaky,Leaky,Leaky,Tanh,,10,19,24.0,23.0,16.0,,0.008459698872948503,4,60,0.281737926521497,5.318395737766534e-05,COMPLETE
492,0.17648878693580627,2023-08-23 21:16:45.490345,2023-08-23 21:16:55.450515,0 days 00:00:09.960170,Leaky,Leaky,Leaky,Tanh,,10,19,24.0,22.0,15.0,,0.00587679035937157,4,60,0.7988187905507589,9.805859377244682e-05,COMPLETE
493,0.17453469336032867,2023-08-23 21:16:55.450888,2023-08-23 21:17:04.906893,0 days 00:00:09.456005,Leaky,Leaky,Leaky,Tanh,,10,20,24.0,22.0,16.0,,0.0069816695273316,4,60,0.7637141349600661,4.8622336897229314e-05,COMPLETE
494,0.1451001763343811,2023-08-23 21:17:04.907244,2023-08-23 21:17:13.466209,0 days 00:00:08.558965,Leaky,Leaky,Leaky,Tanh,,10,21,24.0,23.0,17.0,,0.00789157940906274,4,60,0.7332022084708301,6.001145991501573e-05,COMPLETE
495,0.14096462726593018,2023-08-23 21:17:13.466547,2023-08-23 21:17:21.255398,0 days 00:00:07.788851,Leaky,Leaky,Leaky,Tanh,,10,20,23.0,24.0,16.0,,0.005281491377676922,4,60,0.703186453948359,3.87661986896469e-05,COMPLETE
496,0.14763925969600677,2023-08-23 21:17:21.255723,2023-08-23 21:17:29.920296,0 days 00:00:08.664573,Tanh,Leaky,Leaky,Tanh,,10,20,23.0,24.0,16.0,,0.004135365542646145,4,60,0.7467479099863652,4.2640226765791446e-05,COMPLETE
497,0.18046540021896362,2023-08-23 21:17:29.920632,2023-08-23 21:17:38.770248,0 days 00:00:08.849616,Leaky,Leaky,Leaky,Tanh,,10,20,23.0,24.0,16.0,,0.005274412081969627,4,60,0.7046487392626184,3.641927448030005e-05,COMPLETE
498,0.1564287543296814,2023-08-23 21:17:38.770583,2023-08-23 21:17:48.954608,0 days 00:00:10.184025,Tanh,Leaky,Leaky,Tanh,Sigmoid,10,20,24.0,24.0,16.0,22.0,0.003600841238537292,5,60,0.7991472507916454,3.247861150219145e-05,COMPLETE
499,0.17487594485282898,2023-08-23 21:17:48.954947,2023-08-23 21:17:54.459588,0 days 00:00:05.504641,Leaky,Leaky,Leaky,Tanh,,10,21,23.0,23.0,17.0,,0.00479428956177677,4,60,0.48962465028417246,4.43648138069592e-05,COMPLETE
