number,value,datetime_start,datetime_complete,duration,params_activation1,params_activation2,params_activation3,params_activation4,params_batch_size,params_fl1,params_fl2,params_fl3,params_fl4,params_learning_rate,params_n_layers,params_num_epochs,params_train_size,params_weight_decay,state
499,0.19636167585849762,2023-09-03 20:19:29.805006,2023-09-03 20:19:43.790148,0 days 00:00:13.985142,ReLU,ReLU,Leaky,ReLU,16,17,10.0,7.0,17.0,0.007285265770302746,4,60,0.7276212809656968,0.00013725223421130734,COMPLETE
