number,value,datetime_start,datetime_complete,duration,params_activation1,params_activation2,params_activation3,params_activation4,params_batch_size,params_fl1,params_fl2,params_fl3,params_fl4,params_learning_rate,params_n_layers,params_num_epochs,params_train_size,params_weight_decay,user_attrs_mre,state
1063,0.4119589626789093,2023-09-05 15:14:22.617073,2023-09-05 15:14:25.662884,0 days 00:00:03.045811,ReLU,Sigmoid,,,74,5,13.0,,,0.0028420112048732245,2,414,0.5394765725901254,1.590689996062195e-05,134.56441359747024,COMPLETE
1064,0.5789852142333984,2023-09-05 15:14:25.663271,2023-09-05 15:14:26.779338,0 days 00:00:01.116067,ReLU,Leaky,,,48,14,11.0,,,0.0014445386718384885,2,426,0.5745898367133159,0.0988374911328286,136.10968855315565,COMPLETE
1065,0.45931389927864075,2023-09-05 15:14:26.779733,2023-09-05 15:14:27.459154,0 days 00:00:00.679421,Leaky,Tanh,,,71,15,13.0,,,0.004033939420403844,2,408,0.7998222219796313,0.0289991499115305,128.87764739990234,COMPLETE
1066,0.31810715794563293,2023-09-05 15:14:27.459541,2023-09-05 15:14:29.426919,0 days 00:00:01.967378,ReLU,Tanh,,,76,13,14.0,,,0.002393277115991693,2,382,0.7441399714402585,2.492677392069779e-05,107.76343386935204,COMPLETE
1067,0.6040918827056885,2023-09-05 15:14:29.427329,2023-09-05 15:14:34.140679,0 days 00:00:04.713350,ReLU,Tanh,,,83,14,12.0,,,1.4553376481180659e-05,2,373,0.4792343222314739,0.00033161805380091326,150.5232163907376,COMPLETE
1068,0.3818129897117615,2023-09-05 15:14:34.141085,2023-09-05 15:14:47.770431,0 days 00:00:13.629346,ReLU,Leaky,,,34,15,5.0,,,0.00010869349026127756,2,419,0.6938256175887311,4.844350308055236e-05,163.85894928342688,COMPLETE
1069,0.3443824350833893,2023-09-05 15:14:47.770869,2023-09-05 15:14:52.799202,0 days 00:00:05.028333,Leaky,Tanh,,,74,14,13.0,,,0.0002698530674977899,2,399,0.6604872012059284,0.0032489758559126375,99.96756490071614,COMPLETE
1070,0.5520913004875183,2023-09-05 15:14:52.799594,2023-09-05 15:15:05.164493,0 days 00:00:12.364899,ReLU,,,,30,13,,,,2.8670896490836005e-05,1,412,0.7473279589079194,0.00010535707743454645,303.34029836562075,COMPLETE
1071,0.37312212586402893,2023-09-05 15:15:05.164887,2023-09-05 15:15:06.468494,0 days 00:00:01.303607,ReLU,Tanh,,,73,15,11.0,,,0.0018994247235708068,2,370,0.7044978365977881,0.00040640157780909503,193.54262900352478,COMPLETE
1072,0.37555307149887085,2023-09-05 15:15:06.468900,2023-09-05 15:15:07.549118,0 days 00:00:01.080218,ReLU,Leaky,,,78,14,12.0,,,0.0013092537071544852,2,428,0.3137546086379512,0.009062298512769924,118.47345151739606,COMPLETE
1073,0.335391104221344,2023-09-05 15:15:07.549493,2023-09-05 15:15:08.616345,0 days 00:00:01.066852,Leaky,Tanh,,,80,15,14.0,,,0.0033293882216127806,2,391,0.7732667958503321,0.0004665181817926459,130.4941723393459,COMPLETE
1074,0.45552876591682434,2023-09-05 15:15:08.616729,2023-09-05 15:15:08.900102,0 days 00:00:00.283373,ReLU,Sigmoid,,,51,13,13.0,,,0.012962097174890299,2,405,0.10615836433175722,0.0006274963347246898,133.66625213623047,COMPLETE
1075,0.44463273882865906,2023-09-05 15:15:08.900501,2023-09-05 15:15:13.293693,0 days 00:00:04.393192,ReLU,Tanh,,,76,14,10.0,,,0.00019776581359184266,2,418,0.38852239225242724,0.0395227354731586,157.53487597013773,COMPLETE
1076,0.4116097688674927,2023-09-05 15:15:13.294091,2023-09-05 15:15:13.805979,0 days 00:00:00.511888,Tanh,Leaky,,,71,16,14.0,,,0.09909483516141458,2,366,0.7984758977595166,1.2233316187236676e-05,130.86534042358397,COMPLETE
1077,0.5701256990432739,2023-09-05 15:15:13.806383,2023-09-05 15:15:22.067343,0 days 00:00:08.260960,ReLU,Tanh,,,73,12,12.0,,,2.1227011783578943e-05,2,428,0.7257348498134273,3.595145551674427e-05,163.1443597847056,COMPLETE
1078,0.42059558629989624,2023-09-05 15:15:22.067725,2023-09-05 15:15:25.404336,0 days 00:00:03.336611,ReLU,Tanh,,,35,4,13.0,,,0.0016495991069842262,2,360,0.6767679711194349,1.973021412069559e-05,145.4314201424975,COMPLETE
1079,0.3922097384929657,2023-09-05 15:15:25.404739,2023-09-05 15:15:26.747482,0 days 00:00:01.342743,Leaky,Tanh,,,47,14,14.0,,,0.0024660175012549495,2,414,0.5377033224247576,0.00034641165027553424,125.20183805985884,COMPLETE
1080,0.36052292585372925,2023-09-05 15:15:26.747868,2023-09-05 15:15:28.685156,0 days 00:00:01.937288,ReLU,Leaky,,,49,5,13.0,,,0.0020847638547494313,2,404,0.34655842540134024,1.4275842377500045e-05,143.98761634577335,COMPLETE
1081,0.41665753722190857,2023-09-05 15:15:28.685591,2023-09-05 15:15:30.725268,0 days 00:00:02.039677,ReLU,Tanh,,,32,13,11.0,,,0.0012581533998279762,2,379,0.5897041030234912,0.0005006269101856674,689.6031691607307,COMPLETE
1082,0.4345444440841675,2023-09-05 15:15:30.725675,2023-09-05 15:15:35.860280,0 days 00:00:05.134605,ReLU,Tanh,,,77,15,12.0,,,6.197454148167738e-05,2,426,0.45661639376869795,0.003975500991091166,330.04090139899455,COMPLETE
1083,0.398160457611084,2023-09-05 15:15:35.860687,2023-09-05 15:15:36.381442,0 days 00:00:00.520755,Leaky,Leaky,,,70,12,15.0,,,0.0030962983919143403,2,396,0.2593928140575844,0.0007151737070446151,150.87737963276524,COMPLETE
1084,0.40508151054382324,2023-09-05 15:15:36.381829,2023-09-05 15:15:38.059213,0 days 00:00:01.677384,ReLU,Tanh,,,75,14,12.0,,,0.00029728443326341227,2,356,0.15920504095244067,1.0113920980436482e-05,126.54772317007686,COMPLETE
1085,0.36168432235717773,2023-09-05 15:15:38.059621,2023-09-05 15:15:38.901845,0 days 00:00:00.842224,ReLU,Tanh,,,35,15,13.0,,,0.017454042885825423,2,417,0.7466359341595757,0.005714690412067025,240.69725036621094,COMPLETE
1086,0.38037747144699097,2023-09-05 15:15:38.902237,2023-09-05 15:15:40.212315,0 days 00:00:01.310078,ReLU,Tanh,,,72,14,14.0,,,0.0016233477440167645,2,384,0.7032242707884012,0.00016042405312358387,114.6056884765625,COMPLETE
1087,0.449984610080719,2023-09-05 15:15:40.212700,2023-09-05 15:15:41.629115,0 days 00:00:01.416415,ReLU,Sigmoid,,,74,13,12.0,,,0.004099680657228179,2,409,0.32332627499341504,0.02288634320761144,132.85251079461514,COMPLETE
1088,0.4116745591163635,2023-09-05 15:15:41.629501,2023-09-05 15:15:42.144801,0 days 00:00:00.515300,Leaky,Leaky,,,77,16,14.0,,,0.005706977349709299,2,433,0.2914291373369468,4.180678751953625e-05,155.50538421095465,COMPLETE
1089,0.4291355311870575,2023-09-05 15:15:42.145196,2023-09-05 15:15:45.505943,0 days 00:00:03.360747,ReLU,Tanh,,,34,6,13.0,,,0.0011447115096774754,2,365,0.6513838761676204,0.00310767482004299,146.65427433048282,COMPLETE
1090,0.3917335569858551,2023-09-05 15:15:45.506341,2023-09-05 15:15:47.796452,0 days 00:00:02.290111,ReLU,Tanh,,,46,14,13.0,,,0.0024084067594321345,2,396,0.7727144790344299,7.544213432337087e-05,132.6988827669168,COMPLETE
1091,0.5739297866821289,2023-09-05 15:15:47.796850,2023-09-05 15:15:50.137619,0 days 00:00:02.340769,ReLU,Leaky,,,36,15,11.0,,,6.75643553914914e-05,2,216,0.23579775344936177,0.0006026617091310531,150.405743210404,COMPLETE
1092,0.5766538977622986,2023-09-05 15:15:50.138030,2023-09-05 15:15:51.173862,0 days 00:00:01.035832,Leaky,Tanh,,,70,2,15.0,,,0.0013855252987632694,2,352,0.2886703512334547,4.720972384525786e-05,206.0113543494273,COMPLETE
1093,0.38681983947753906,2023-09-05 15:15:51.174299,2023-09-05 15:15:51.797746,0 days 00:00:00.623447,ReLU,Tanh,,,80,15,15.0,,,0.0028348395245955003,2,423,0.1875574494868309,3.0511927119739643e-05,637.0585551711748,COMPLETE
1094,0.518460750579834,2023-09-05 15:15:51.798304,2023-09-05 15:15:55.348955,0 days 00:00:03.550651,ReLU,Sigmoid,,,75,13,3.0,,,0.0019576415968222873,2,406,0.5001367418658983,1.0003710864095348e-05,389.6163051863362,COMPLETE
1095,0.3117344379425049,2023-09-05 15:15:55.349361,2023-09-05 15:15:56.894517,0 days 00:00:01.545156,ReLU,Tanh,,,32,14,14.0,,,0.0034808995241189843,2,370,0.7377663276841067,2.4583137282565786e-05,130.99226034255256,COMPLETE
1096,0.3897792100906372,2023-09-05 15:15:56.894932,2023-09-05 15:15:58.395832,0 days 00:00:01.500900,ReLU,Leaky,,,31,14,12.0,,,0.000940415446300117,2,370,0.22011736980882385,9.740471023264805e-05,118.63553100824356,COMPLETE
1097,0.5842098593711853,2023-09-05 15:15:58.396227,2023-09-05 15:15:59.618745,0 days 00:00:01.222518,Leaky,Tanh,,,30,16,13.0,,,0.07179350285169621,2,379,0.6880831929075709,0.061473201247531195,151.174072265625,COMPLETE
1098,0.42799150943756104,2023-09-05 15:15:59.619137,2023-09-05 15:16:00.076457,0 days 00:00:00.457320,ReLU,Tanh,,,33,10,14.0,,,0.005291087587149758,2,370,0.1265275817064656,2.741825445219811e-05,314.4792599995931,COMPLETE
1099,0.36199891567230225,2023-09-05 15:16:00.076852,2023-09-05 15:16:02.323888,0 days 00:00:02.247036,Tanh,Tanh,,,36,13,15.0,,,0.0011541137553507084,2,375,0.7194245875563161,3.320312115585388e-05,106.2924415363985,COMPLETE
1100,0.44838130474090576,2023-09-05 15:16:02.324279,2023-09-05 15:16:10.225003,0 days 00:00:07.900724,ReLU,Leaky,,,28,16,13.0,,,5.968391259986204e-05,2,362,0.3975475104615458,0.004687861051207771,185.5564875734445,COMPLETE
1101,0.3932008743286133,2023-09-05 15:16:10.225402,2023-09-05 15:16:11.445453,0 days 00:00:01.220051,ReLU,ReLU,,,33,6,12.0,,,0.0039005375786727134,2,372,0.4459149436706045,5.666402658783464e-05,119.60524913242885,COMPLETE
1102,0.39523687958717346,2023-09-05 15:16:11.445889,2023-09-05 15:16:13.268530,0 days 00:00:01.822641,Leaky,ReLU,,,29,15,12.0,,,0.0015037541971998965,2,359,0.6606962985440062,2.429870739221045e-05,123.71417086732154,COMPLETE
1103,0.3498820662498474,2023-09-05 15:16:13.268936,2023-09-05 15:16:14.876311,0 days 00:00:01.607375,ReLU,Tanh,,,31,14,11.0,,,0.002079785623422573,2,368,0.7254912674661503,0.0003894885375663293,250.58447584995002,COMPLETE
1104,0.3590570092201233,2023-09-05 15:16:14.876706,2023-09-05 15:16:18.633439,0 days 00:00:03.756733,ReLU,ReLU,,,31,15,14.0,,,0.00032860522710351323,2,358,0.436082929746921,0.006864048827430709,158.395603775289,COMPLETE
1105,0.3378477394580841,2023-09-05 15:16:18.633830,2023-09-05 15:16:19.628160,0 days 00:00:00.994330,ReLU,ReLU,,,32,20,13.0,,,0.048350063698709075,2,380,0.6867052284557664,1.712974072181424e-05,110.26658957345145,COMPLETE
1106,0.8038563132286072,2023-09-05 15:16:19.628558,2023-09-05 15:16:30.102402,0 days 00:00:10.473844,Leaky,Tanh,,,34,2,14.0,,,1.4239829942161103e-05,2,363,0.6320486585589087,0.010217628654278554,152.54498581058724,COMPLETE
1107,0.5662712454795837,2023-09-05 15:16:30.102802,2023-09-05 15:16:30.452167,0 days 00:00:00.349365,ReLU,ReLU,,,33,1,10.0,,,0.06060098924042171,2,353,0.21280458109958397,4.2301202567498156e-05,165.00071770804269,COMPLETE
1108,0.35753363370895386,2023-09-05 15:16:30.452546,2023-09-05 15:16:33.810729,0 days 00:00:03.358183,ReLU,Leaky,,,30,14,15.0,,,0.0009877587911673444,2,374,0.7456004148783154,0.0025508230398550947,186.07826302268288,COMPLETE
1109,0.42640694975852966,2023-09-05 15:16:33.811128,2023-09-05 15:16:43.203733,0 days 00:00:09.392605,ReLU,ReLU,,,29,4,13.0,,,0.0001761779772358718,2,354,0.7997893761078926,0.000521936501338582,140.3481586239744,COMPLETE
1110,0.37784603238105774,2023-09-05 15:16:43.204128,2023-09-05 15:16:44.323757,0 days 00:00:01.119629,ReLU,Tanh,,,36,13,12.0,,,0.002623569074525634,2,387,0.36878024131651904,2.3134798371830895e-05,146.45977473258972,COMPLETE
1111,0.38053542375564575,2023-09-05 15:16:44.324158,2023-09-05 15:16:47.099214,0 days 00:00:02.775056,Leaky,ReLU,,,38,12,14.0,,,0.0012951897269241719,2,384,0.60300169257294,0.00018557392793949444,103.31743236791307,COMPLETE
1112,0.4154929220676422,2023-09-05 15:16:47.099614,2023-09-05 15:16:48.745656,0 days 00:00:01.646042,ReLU,ReLU,,,33,13,13.0,,,0.00038411722025868034,2,363,0.1483224573409208,0.0003102743254908127,121.95064066106623,COMPLETE
1113,0.4101536273956299,2023-09-05 15:16:48.746051,2023-09-05 15:16:49.779112,0 days 00:00:01.033061,ReLU,Sigmoid,,,35,3,17.0,,,0.007336625590975624,2,351,0.5604660416625422,0.00012518666745546053,125.07434122185958,COMPLETE
1114,0.34158608317375183,2023-09-05 15:16:49.779650,2023-09-05 15:16:50.715890,0 days 00:00:00.936240,ReLU,Tanh,,,48,16,16.0,,,0.015935906380411514,2,366,0.7104770633251419,1.372196912528338e-05,108.84670639038086,COMPLETE
1115,0.702319860458374,2023-09-05 15:16:50.716320,2023-09-05 15:16:56.908356,0 days 00:00:06.192036,Leaky,ReLU,,,38,5,15.0,,,1.0101910555492285e-05,2,347,0.4205783772959374,0.0007925705899706662,194.10637721960413,COMPLETE
1116,0.3412603437900543,2023-09-05 15:16:56.908771,2023-09-05 15:16:58.442306,0 days 00:00:01.533535,ReLU,ReLU,,,32,14,11.0,,,0.0017051041803851103,2,355,0.5124577195919121,1.201388219282224e-05,102.18924674987792,COMPLETE
1117,0.2853454053401947,2023-09-05 15:16:58.442728,2023-09-05 15:16:59.921223,0 days 00:00:01.478495,ReLU,Tanh,,,50,15,14.0,,,0.003387324488184388,2,390,0.7598096339031645,0.00040164392533836694,97.37813921327944,COMPLETE
1118,0.44214922189712524,2023-09-05 15:16:59.921685,2023-09-05 15:17:01.601550,0 days 00:00:01.679865,ReLU,ReLU,,,50,16,14.0,,,0.004531852046092137,2,381,0.7707241649055383,0.00040814181493923187,143.4259925842285,COMPLETE
1119,0.354112833738327,2023-09-05 15:17:01.601950,2023-09-05 15:17:02.996285,0 days 00:00:01.394335,ReLU,Leaky,,,51,15,14.0,,,0.0038757734539760485,2,378,0.7703903507735964,0.00032305039378429344,118.82623016357422,COMPLETE
1120,0.42431193590164185,2023-09-05 15:17:02.996705,2023-09-05 15:17:03.539684,0 days 00:00:00.542979,ReLU,ReLU,,,52,16,14.0,,,0.007951405516100653,2,385,0.13367457286866932,0.0004149995921724452,197.74088287353516,COMPLETE
1121,0.3950340747833252,2023-09-05 15:17:03.540090,2023-09-05 15:17:04.835935,0 days 00:00:01.295845,ReLU,Tanh,,,47,15,15.0,,,0.004540666915481985,2,387,0.745322826014127,0.0005550496369489295,371.74671977275125,COMPLETE
1122,0.2972998321056366,2023-09-05 15:17:04.836329,2023-09-05 15:17:06.246324,0 days 00:00:01.409995,ReLU,ReLU,,,50,15,14.0,,,0.0034229866158166683,2,375,0.7995320023132508,0.00028909128753643005,98.9218387214505,COMPLETE
1123,0.3380588889122009,2023-09-05 15:17:06.246732,2023-09-05 15:17:07.932511,0 days 00:00:01.685779,ReLU,ReLU,,,51,15,14.0,,,0.004000871272683261,2,389,0.7775856734786288,0.00028789861207983996,146.26463724772137,COMPLETE
1124,0.308819442987442,2023-09-05 15:17:07.932922,2023-09-05 15:17:08.826039,0 days 00:00:00.893117,ReLU,ReLU,,,53,16,14.0,,,0.003391628367303707,2,228,0.7987147855443335,0.00023254682810125798,144.10472082322644,COMPLETE
1125,0.3304244577884674,2023-09-05 15:17:08.826441,2023-09-05 15:17:10.775311,0 days 00:00:01.948870,ReLU,ReLU,,,54,16,14.0,,,0.0034283856741649022,2,391,0.7982338511793723,0.000301646195532776,111.71563667721219,COMPLETE
1126,0.3547351062297821,2023-09-05 15:17:10.775747,2023-09-05 15:17:11.703730,0 days 00:00:00.927983,ReLU,ReLU,,,51,16,14.0,,,0.00499572556033384,2,274,0.7939640953750797,0.00024569012161427487,96.81789350509644,COMPLETE
1127,0.30891963839530945,2023-09-05 15:17:11.704136,2023-09-05 15:17:12.835621,0 days 00:00:01.131485,ReLU,ReLU,,,53,16,14.0,,,0.0034846717640113598,2,375,0.7727208324706936,0.0002576688046430393,105.3165644691104,COMPLETE
1128,0.33123961091041565,2023-09-05 15:17:12.836030,2023-09-05 15:17:14.152395,0 days 00:00:01.316365,ReLU,ReLU,,,50,16,14.0,,,0.003606523295406639,2,230,0.7996049719704167,0.00020431485444176082,99.52072624538256,COMPLETE
1129,0.3853648900985718,2023-09-05 15:17:14.152782,2023-09-05 15:17:15.495831,0 days 00:00:01.343049,ReLU,ReLU,,,52,16,14.0,,,0.0034151435823505023,2,375,0.7749847617556855,0.00022876034653020503,96.08680068969727,COMPLETE
1130,0.4507182836532593,2023-09-05 15:17:15.496222,2023-09-05 15:17:16.580785,0 days 00:00:01.084563,ReLU,ReLU,,,55,16,14.0,,,0.004543651660992704,2,255,0.7536479417883826,0.0003515932929326241,137.84402720133463,COMPLETE
1131,0.322767972946167,2023-09-05 15:17:16.581200,2023-09-05 15:17:18.590519,0 days 00:00:02.009319,ReLU,ReLU,,,54,16,14.0,,,0.0033018188976992645,2,379,0.7663147011506968,0.00018060937277443792,107.45695593418219,COMPLETE
1132,0.42343711853027344,2023-09-05 15:17:18.590927,2023-09-05 15:17:19.323552,0 days 00:00:00.732625,ReLU,ReLU,,,53,17,15.0,,,0.005086953018938488,2,222,0.7730920420295854,0.0002626247661652004,182.21040989802435,COMPLETE
1133,0.32103803753852844,2023-09-05 15:17:19.323947,2023-09-05 15:17:20.175579,0 days 00:00:00.851632,ReLU,ReLU,,,53,16,14.0,,,0.003891975555068745,2,175,0.7994518997998635,0.00025365152714944457,118.06371561686198,COMPLETE
1134,0.3810620605945587,2023-09-05 15:17:20.175971,2023-09-05 15:17:20.671205,0 days 00:00:00.495234,ReLU,ReLU,,,54,17,14.0,,,0.0030545083209050222,2,199,0.24136723878017147,0.00027870698751423367,157.6810440650353,COMPLETE
1135,0.3700138032436371,2023-09-05 15:17:20.671604,2023-09-05 15:17:21.587027,0 days 00:00:00.915423,ReLU,ReLU,,,52,16,15.0,,,0.008406499028055401,2,191,0.7460699278474188,0.0002226621537094071,201.96798391903147,COMPLETE
1136,0.3928303122520447,2023-09-05 15:17:21.587422,2023-09-05 15:17:22.032267,0 days 00:00:00.444845,ReLU,ReLU,,,53,16,14.0,,,0.004289913798265442,2,235,0.16648891543816105,0.0003463383143685402,381.5276862511268,COMPLETE
1137,0.4192388355731964,2023-09-05 15:17:22.032673,2023-09-05 15:17:23.234576,0 days 00:00:01.201903,ReLU,ReLU,,,50,16,15.0,,,0.0031594779005230905,2,376,0.7978566340303945,0.00020743762163575046,254.0570920618569,COMPLETE
1138,0.40048936009407043,2023-09-05 15:17:23.234971,2023-09-05 15:17:24.199084,0 days 00:00:00.964113,ReLU,ReLU,,,54,15,14.0,,,0.0029355203039772323,2,139,0.7420614156266259,0.00015824363757932348,171.10914158176732,COMPLETE
1139,0.3891579806804657,2023-09-05 15:17:24.199498,2023-09-05 15:17:24.993746,0 days 00:00:00.794248,ReLU,ReLU,,,50,17,15.0,,,0.004024805353572589,2,383,0.4625911720770316,0.00030968705366333284,117.9565938313802,COMPLETE
1140,0.3946308195590973,2023-09-05 15:17:24.994158,2023-09-05 15:17:26.104720,0 days 00:00:01.110562,ReLU,ReLU,,,52,16,14.0,,,0.0049875445653173025,2,248,0.741231677572334,0.0002525529865347698,103.86503510248093,COMPLETE
1141,0.5571051239967346,2023-09-05 15:17:26.105119,2023-09-05 15:17:27.538064,0 days 00:00:01.432945,ReLU,ReLU,,,55,15,15.0,,,3.4160285262165755e-05,2,371,0.10279426481617528,0.00044227365235451093,168.60431510740213,COMPLETE
1142,0.4738626778125763,2023-09-05 15:17:27.538473,2023-09-05 15:17:28.676410,0 days 00:00:01.137937,ReLU,ReLU,,,52,15,14.0,,,0.0036136373989935455,2,243,0.7672272151911438,0.05874474472934274,140.41918870879383,COMPLETE
1143,0.3682445287704468,2023-09-05 15:17:28.676803,2023-09-05 15:17:30.399021,0 days 00:00:01.722218,Tanh,ReLU,,,49,17,14.0,,,0.0027434421536092547,2,261,0.727237964219148,0.00031602897592064285,114.74779557448167,COMPLETE
1144,0.42908456921577454,2023-09-05 15:17:30.399420,2023-09-05 15:17:31.016940,0 days 00:00:00.617520,ReLU,,,,54,16,,,,0.004503972546764262,1,372,0.19979223162358276,0.00018239826612031208,144.42049717667078,COMPLETE
1145,0.36552736163139343,2023-09-05 15:17:31.017332,2023-09-05 15:17:33.188800,0 days 00:00:02.171468,ReLU,ReLU,,,50,15,15.0,,,0.003025300376624628,2,387,0.7979514460872906,8.324529848992061e-05,118.31570082444411,COMPLETE
1146,0.3172416687011719,2023-09-05 15:17:33.189204,2023-09-05 15:17:34.492382,0 days 00:00:01.303178,ReLU,Tanh,,,50,16,15.0,,,0.005655545483042364,2,378,0.7529948660313693,6.937110411557874e-05,101.85812346140544,COMPLETE
1147,0.3931826949119568,2023-09-05 15:17:34.492796,2023-09-05 15:17:34.818942,0 days 00:00:00.326146,ReLU,ReLU,,,53,16,14.0,,,0.003489942775126367,2,390,0.29833420065832383,0.00037688402647333613,118.9789599609375,COMPLETE
1148,0.3948323130607605,2023-09-05 15:17:34.819340,2023-09-05 15:17:35.408196,0 days 00:00:00.588856,ReLU,ReLU,,,56,15,14.0,,,0.0037689942468543537,2,371,0.22648947517912923,0.00026680499407979335,128.86852960025564,COMPLETE
1149,0.3829399347305298,2023-09-05 15:17:35.408586,2023-09-05 15:17:36.130164,0 days 00:00:00.721578,ReLU,Tanh,,,49,15,13.0,,,0.02004344362374689,2,384,0.484944616357344,0.0004755316236016211,222.62651598131333,COMPLETE
1150,0.405516654253006,2023-09-05 15:17:36.130583,2023-09-05 15:17:37.460851,0 days 00:00:01.330268,ReLU,ReLU,,,49,17,14.0,,,0.0029140598195301,2,393,0.5197658902646447,0.0002254359980672583,178.4620740553912,COMPLETE
1151,0.3845745325088501,2023-09-05 15:17:37.461274,2023-09-05 15:17:38.371446,0 days 00:00:00.910172,ReLU,ReLU,,,52,15,15.0,,,0.0024166269813055137,2,372,0.3316810620307974,0.0003754038801565595,109.55583922503746,COMPLETE
1152,0.39620673656463623,2023-09-05 15:17:38.371871,2023-09-05 15:17:39.816827,0 days 00:00:01.444956,ReLU,Tanh,,,51,15,13.0,,,0.0027596086976549037,2,155,0.4146093909126301,0.011524795851884725,114.927836300282,COMPLETE
1153,0.3559398651123047,2023-09-05 15:17:39.817252,2023-09-05 15:17:40.680397,0 days 00:00:00.863145,ReLU,ReLU,,,55,16,14.0,,,0.006693724523601969,2,370,0.5383937650371299,0.0002860233009837459,114.92708136818625,COMPLETE
1154,0.35238298773765564,2023-09-05 15:17:40.680801,2023-09-05 15:17:41.363191,0 days 00:00:00.682390,ReLU,ReLU,,,51,15,13.0,,,0.005953681076358424,2,383,0.5737523737282721,0.0006766069480001501,207.12835545693673,COMPLETE
1155,0.5567412972450256,2023-09-05 15:17:41.363600,2023-09-05 15:17:46.113965,0 days 00:00:04.750365,ReLU,Tanh,,,48,17,15.0,,,2.5801717941131217e-05,2,366,0.34951371371844475,6.38060048423514e-05,211.62878426306887,COMPLETE
1156,0.33622097969055176,2023-09-05 15:17:46.114379,2023-09-05 15:17:47.445335,0 days 00:00:01.330956,ReLU,ReLU,,,54,16,14.0,,,0.0033421368910752473,2,394,0.7186156954573338,5.1534116686544573e-05,146.96109150074147,COMPLETE
1157,0.38544976711273193,2023-09-05 15:17:47.445755,2023-09-05 15:17:48.684801,0 days 00:00:01.239046,ReLU,ReLU,,,53,15,13.0,,,0.009283794565826474,2,378,0.7680601381691712,3.559278735930116e-05,111.36849295574686,COMPLETE
1158,0.3562650978565216,2023-09-05 15:17:48.685211,2023-09-05 15:17:50.097125,0 days 00:00:01.411914,ReLU,Sigmoid,,,48,16,15.0,,,0.00463730413157055,2,391,0.7307488563714571,0.0003441998124620014,252.91673836341272,COMPLETE
1159,0.3945663273334503,2023-09-05 15:17:50.097534,2023-09-05 15:17:51.879911,0 days 00:00:01.782377,ReLU,Tanh,,,49,15,14.0,,,0.004235799228553861,2,212,0.7994159473143869,0.0002094048270038723,118.04132492815862,COMPLETE
