number,value,datetime_start,datetime_complete,duration,params_activation1,params_activation2,params_activation3,params_activation4,params_batch_size,params_fl1,params_fl2,params_fl3,params_fl4,params_learning_rate,params_n_layers,params_num_epochs,params_train_size,params_weight_decay,user_attrs_mre,state
287,0.3691236078739166,2023-09-05 14:37:54.319726,2023-09-05 14:37:56.097909,0 days 00:00:01.778183,Leaky,ReLU,,,46,7,16.0,,,0.002585786494497713,2,329,0.7203759529988956,0.00033293363965077597,113.38496535571653,COMPLETE
288,0.54347163438797,2023-09-05 14:37:56.098190,2023-09-05 14:37:57.142149,0 days 00:00:01.043959,ReLU,ReLU,Leaky,ReLU,41,9,14.0,12.0,1.0,0.0017361868361238475,4,303,0.3281762087900066,0.03159225868272371,140.26098008589312,COMPLETE
289,0.433030366897583,2023-09-05 14:37:57.142436,2023-09-05 14:38:02.797011,0 days 00:00:05.654575,Sigmoid,ReLU,,,54,24,15.0,,,0.0005797922968848995,2,249,0.644971599630426,0.0028073588852201427,302.79871463392635,COMPLETE
290,0.39607763290405273,2023-09-05 14:38:02.797297,2023-09-05 14:38:04.389906,0 days 00:00:01.592609,ReLU,ReLU,,,68,6,16.0,,,0.0014567609061073182,2,361,0.6746189530342065,0.0004901693540171392,137.45265350341796,COMPLETE
291,0.41487962007522583,2023-09-05 14:38:04.390177,2023-09-05 14:38:06.097462,0 days 00:00:01.707285,ReLU,ReLU,,,47,8,15.0,,,0.0008420500473329825,2,284,0.4406754641559945,0.0038181999796143957,150.77158537365142,COMPLETE
292,0.40301334857940674,2023-09-05 14:38:06.097736,2023-09-05 14:38:06.464009,0 days 00:00:00.366273,ReLU,ReLU,,,45,23,14.0,,,0.09317855236887326,2,320,0.7546966610841324,0.0059128297192597035,126.15478388468425,COMPLETE
293,0.37238022685050964,2023-09-05 14:38:06.464285,2023-09-05 14:38:07.270505,0 days 00:00:00.806220,ReLU,Leaky,,,43,16,20.0,,,0.003795982909295353,2,339,0.7102302791164515,0.0002599609880356452,100.29371724809918,COMPLETE
294,0.40498217940330505,2023-09-05 14:38:07.270785,2023-09-05 14:38:10.585284,0 days 00:00:03.314499,Tanh,,,,66,10,,,,0.0006939377532020486,1,299,0.46493830594518154,0.0004209265432775845,125.7782305459115,COMPLETE
295,0.4691287875175476,2023-09-05 14:38:10.585557,2023-09-05 14:38:17.488985,0 days 00:00:06.903428,Sigmoid,ReLU,,,70,9,15.0,,,0.0005136713272518552,2,353,0.6401244057764951,0.008426614625182984,157.46113223327117,COMPLETE
296,0.3172476887702942,2023-09-05 14:38:17.489270,2023-09-05 14:38:20.855826,0 days 00:00:03.366556,ReLU,ReLU,,,73,24,16.0,,,0.0012122096434678536,2,445,0.766289595892662,0.002241099032887043,107.03301119517131,COMPLETE
297,0.39274391531944275,2023-09-05 14:38:20.856100,2023-09-05 14:38:29.754655,0 days 00:00:08.898555,ReLU,ReLU,,,75,15,16.0,,,9.424279995493495e-05,2,442,0.7715355719236833,0.0023543128788026386,170.5746725091028,COMPLETE
298,0.38745051622390747,2023-09-05 14:38:29.754937,2023-09-05 14:38:31.256226,0 days 00:00:01.501289,ReLU,ReLU,,,52,24,16.0,,,0.0011075597402511296,2,371,0.7996891537878094,0.021561125301103323,114.14216882211191,COMPLETE
299,0.3485274016857147,2023-09-05 14:38:31.256519,2023-09-05 14:38:32.682165,0 days 00:00:01.425646,Leaky,ReLU,,,50,24,15.0,,,0.0012292336745826774,2,333,0.7437116558378837,0.004638079482757965,199.01845564932194,COMPLETE
300,0.38692229986190796,2023-09-05 14:38:32.682494,2023-09-05 14:38:34.264375,0 days 00:00:01.581881,ReLU,ReLU,,,42,8,17.0,,,0.0014725090276851145,2,440,0.49705123619582225,0.002881435128371718,177.73822650909423,COMPLETE
301,0.3941352069377899,2023-09-05 14:38:34.264666,2023-09-05 14:38:36.340763,0 days 00:00:02.076097,ReLU,ReLU,,,73,24,16.0,,,0.0009395027817980376,2,451,0.7676432612287445,0.0001479010282706057,123.7441537687094,COMPLETE
302,0.4028034210205078,2023-09-05 14:38:36.341057,2023-09-05 14:38:38.834451,0 days 00:00:02.493394,Sigmoid,ReLU,,,38,11,15.0,,,0.0018086389385887894,2,464,0.5245489252980193,0.00035526594143481396,127.13321456909179,COMPLETE
303,0.34147822856903076,2023-09-05 14:38:38.834754,2023-09-05 14:38:42.336648,0 days 00:00:03.501894,ReLU,ReLU,,,47,9,14.0,,,0.0012356564066644876,2,475,0.7337669481224849,0.0021904382772628666,99.08927345275879,COMPLETE
304,0.38057008385658264,2023-09-05 14:38:42.336973,2023-09-05 14:38:51.897727,0 days 00:00:09.560754,ReLU,ReLU,,,40,24,13.0,,,5.138547193632441e-05,2,344,0.689887759358496,0.0006230888888736444,168.88223379711772,COMPLETE
305,0.3207266628742218,2023-09-05 14:38:51.898023,2023-09-05 14:38:57.276503,0 days 00:00:05.378480,ReLU,ReLU,,,22,7,11.0,,,0.001014273642470578,2,327,0.7703827346342891,0.00024100220140701648,107.05239938806605,COMPLETE
306,0.41577407717704773,2023-09-05 14:38:57.276779,2023-09-05 14:39:05.205070,0 days 00:00:07.928291,ReLU,Sigmoid,,,19,6,16.0,,,0.000825507469759544,2,324,0.799098110214696,0.0002539991546115777,171.81351945665148,COMPLETE
307,0.5344770550727844,2023-09-05 14:39:05.205351,2023-09-05 14:39:18.898268,0 days 00:00:13.692917,Sigmoid,ReLU,,,25,7,11.0,,,8.082436426082624e-05,2,316,0.7422792131960837,0.00031302064345084557,173.04904611804818,COMPLETE
308,0.37293487787246704,2023-09-05 14:39:18.898555,2023-09-05 14:39:23.141031,0 days 00:00:04.242476,ReLU,ReLU,,,21,7,14.0,,,0.0015313046924392418,2,432,0.7693357358911339,0.0004719411578683575,145.07764146386123,COMPLETE
309,0.4160327911376953,2023-09-05 14:39:23.141306,2023-09-05 14:39:27.340582,0 days 00:00:04.199276,Leaky,ReLU,,,32,7,12.0,,,0.000995927756458414,2,458,0.7156749362846349,0.00023285725080697618,462.72973132524334,COMPLETE
310,0.34196823835372925,2023-09-05 14:39:27.340865,2023-09-05 14:39:29.787112,0 days 00:00:02.446247,ReLU,ReLU,,,15,8,10.0,,,0.0013064159767857604,2,234,0.6649155515531666,0.0003703355182484038,99.20203715998952,COMPLETE
311,0.3124052882194519,2023-09-05 14:39:29.787404,2023-09-05 14:39:32.709943,0 days 00:00:02.922539,ReLU,ReLU,,,35,14,11.0,,,0.0007349950452852104,2,352,0.7434918942964223,0.0002930485262471413,103.72615710171786,COMPLETE
312,0.3784014582633972,2023-09-05 14:39:32.710226,2023-09-05 14:39:34.321543,0 days 00:00:01.611317,ReLU,Leaky,,,35,13,11.0,,,0.002108517710481657,2,353,0.5687486395944079,0.00029717944686129624,161.85844027611518,COMPLETE
313,0.3600013554096222,2023-09-05 14:39:34.321829,2023-09-05 14:39:39.429439,0 days 00:00:05.107610,ReLU,ReLU,,,28,13,12.0,,,0.0005812849543796303,2,357,0.6269408953408264,0.0002167946793471384,128.15573637109054,COMPLETE
314,0.3901827037334442,2023-09-05 14:39:39.429727,2023-09-05 14:39:47.612724,0 days 00:00:08.182997,Sigmoid,ReLU,,,37,14,10.0,,,0.000739307349009455,2,382,0.7042590812084343,0.00014572353588792927,159.77954964139568,COMPLETE
315,0.4693146347999573,2023-09-05 14:39:47.613009,2023-09-05 14:39:58.592115,0 days 00:00:10.979106,ReLU,ReLU,,,36,14,11.0,,,2.7792336330875006e-05,2,344,0.7345703298419723,0.00028618292745003794,141.9478856463765,COMPLETE
316,0.3253110647201538,2023-09-05 14:39:58.592401,2023-09-05 14:40:03.985578,0 days 00:00:05.393177,ReLU,ReLU,,,31,17,11.0,,,0.0006508092958483707,2,369,0.7672619107969925,0.0035166406639441715,124.23680007289833,COMPLETE
317,0.3417406678199768,2023-09-05 14:40:03.985869,2023-09-05 14:40:08.492714,0 days 00:00:04.506845,ReLU,ReLU,,,30,17,11.0,,,0.0006380476256935887,2,375,0.680248909616038,0.003610624343355541,118.90431166428786,COMPLETE
318,0.3675655722618103,2023-09-05 14:40:08.493026,2023-09-05 14:40:10.599568,0 days 00:00:02.106542,Leaky,ReLU,,,34,18,10.0,,,0.0007339205730907545,2,364,0.6536009713817914,0.0028906984892471737,125.87150518445002,COMPLETE
319,0.4616192877292633,2023-09-05 14:40:10.599848,2023-09-05 14:40:18.778460,0 days 00:00:08.178612,ReLU,ReLU,,,32,12,11.0,,,0.00013389307988891227,2,365,0.7271217752654427,0.004655128344889492,131.78279850736578,COMPLETE
320,0.4146469533443451,2023-09-05 14:40:18.778751,2023-09-05 14:40:25.836162,0 days 00:00:07.057411,Sigmoid,ReLU,,,37,17,11.0,,,0.0005083194511915095,2,357,0.7657554269902973,0.0035539164456904245,179.60007946307843,COMPLETE
321,0.35337990522384644,2023-09-05 14:40:25.836450,2023-09-05 14:40:28.633497,0 days 00:00:02.797047,Tanh,ReLU,,,35,13,12.0,,,0.0005878474699848529,2,370,0.6927151474791255,0.0025439976495140776,212.73343703326057,COMPLETE
322,0.34901952743530273,2023-09-05 14:40:28.633787,2023-09-05 14:40:33.922884,0 days 00:00:05.289097,ReLU,ReLU,,,18,19,11.0,,,0.00043405881975590354,2,349,0.627065020162431,0.000179883293588017,261.5342801048642,COMPLETE
323,0.38384392857551575,2023-09-05 14:40:33.923187,2023-09-05 14:40:38.744323,0 days 00:00:04.821136,ReLU,Leaky,,,32,14,9.0,,,0.0007752749592219032,2,338,0.582563427288702,1.2363599964969729e-05,105.96847773444723,COMPLETE
324,0.38929563760757446,2023-09-05 14:40:38.744634,2023-09-05 14:40:50.076888,0 days 00:00:11.332254,ReLU,ReLU,,,24,24,13.0,,,0.00010927331978534181,2,422,0.7423706239245655,0.0031584656651374617,106.2936503092448,COMPLETE
325,0.29475414752960205,2023-09-05 14:40:50.077190,2023-09-05 14:40:51.669238,0 days 00:00:01.592048,ReLU,ReLU,,,63,23,12.0,,,0.0011174319303062872,2,349,0.7135088729642405,0.0021401290031162405,272.68705607096354,COMPLETE
326,0.37297356128692627,2023-09-05 14:40:51.669521,2023-09-05 14:40:54.209414,0 days 00:00:02.539893,ReLU,ReLU,,,62,23,12.0,,,0.0010405509737882715,2,359,0.6570518439362353,0.0021372253612909346,112.17228400707245,COMPLETE
327,0.40500393509864807,2023-09-05 14:40:54.209695,2023-09-05 14:40:59.856940,0 days 00:00:05.647245,Sigmoid,ReLU,,,64,23,12.0,,,0.0008880023637202834,2,351,0.5497178773300305,0.0002385806423438823,154.91211726421912,COMPLETE
328,0.40667423605918884,2023-09-05 14:40:59.857242,2023-09-05 14:41:02.182525,0 days 00:00:02.325283,ReLU,ReLU,,,66,5,10.0,,,0.0012124466089248988,2,344,0.6950048104855673,0.002561126703438991,320.23558346978547,COMPLETE
329,0.3510030508041382,2023-09-05 14:41:02.182828,2023-09-05 14:41:03.682093,0 days 00:00:01.499265,Leaky,ReLU,,,64,6,11.0,,,0.00176022652237324,2,335,0.7147697422458313,0.0004128684732370015,144.21635644095284,COMPLETE
330,0.3611716628074646,2023-09-05 14:41:03.682387,2023-09-05 14:41:05.170378,0 days 00:00:01.487991,ReLU,ReLU,,,44,24,11.0,,,0.0006428494719348628,2,382,0.6614016097820784,0.00031284045307359496,124.86922481142241,COMPLETE
331,0.386209100484848,2023-09-05 14:41:05.170663,2023-09-05 14:41:07.727756,0 days 00:00:02.557093,ReLU,ReLU,,,39,20,12.0,,,0.001104896861826132,2,359,0.6854907806060321,0.0020753584276752184,124.21561773892107,COMPLETE
332,0.3859993815422058,2023-09-05 14:41:07.728041,2023-09-05 14:41:10.410964,0 days 00:00:02.682923,ReLU,ReLU,,,62,23,13.0,,,0.0008004722923125203,2,329,0.6095903026011045,0.0031339806498472175,146.91169336397354,COMPLETE
333,0.3645661175251007,2023-09-05 14:41:10.411256,2023-09-05 14:41:15.669344,0 days 00:00:05.258088,Sigmoid,ReLU,,,33,24,12.0,,,0.0013489476124722343,2,447,0.7312954277931826,0.00020136835344259952,126.89931994884998,COMPLETE
334,0.31688082218170166,2023-09-05 14:41:15.669635,2023-09-05 14:41:17.286392,0 days 00:00:01.616757,ReLU,ReLU,,,46,15,13.0,,,0.0009749690073417056,2,348,0.7676999143096478,0.0003763597021508912,115.0598882039388,COMPLETE
335,0.42470917105674744,2023-09-05 14:41:17.286685,2023-09-05 14:41:21.990282,0 days 00:00:04.703597,ReLU,Sigmoid,,,67,13,13.0,,,0.0009270292195615222,2,369,0.7664950402878258,0.00047284759909231453,138.77780655262083,COMPLETE
336,0.30641791224479675,2023-09-05 14:41:21.990570,2023-09-05 14:41:26.488159,0 days 00:00:04.497589,ReLU,ReLU,,,45,15,13.0,,,0.0007463139682913223,2,350,0.7739174140899421,0.0008143552392754858,95.42658204298753,COMPLETE
337,0.28950026631355286,2023-09-05 14:41:26.488454,2023-09-05 14:41:29.125470,0 days 00:00:02.637016,ReLU,ReLU,,,44,16,13.0,,,0.0006362426472610512,2,350,0.7965045226712428,0.0007017321123806726,103.3739786257689,COMPLETE
338,0.40555906295776367,2023-09-05 14:41:29.125754,2023-09-05 14:41:33.410055,0 days 00:00:04.284301,ReLU,ReLU,,,44,15,13.0,,,0.0006467590543283196,2,343,0.7947754638679531,0.0005491768918464545,193.03121233319902,COMPLETE
339,0.3997538089752197,2023-09-05 14:41:33.410338,2023-09-05 14:41:38.513478,0 days 00:00:05.103140,ReLU,ReLU,,,45,15,13.0,,,0.0007245773078475743,2,367,0.7688668208630552,0.0008062399927258964,520.2180887858073,COMPLETE
340,0.3575485348701477,2023-09-05 14:41:38.513765,2023-09-05 14:41:41.334241,0 days 00:00:02.820476,ReLU,ReLU,,,43,16,13.0,,,0.0007063254730353967,2,352,0.7711199699241151,0.0007050431722145108,184.16110791658102,COMPLETE
341,0.40506625175476074,2023-09-05 14:41:41.334525,2023-09-05 14:41:43.429619,0 days 00:00:02.095094,ReLU,ReLU,,,41,15,13.0,,,0.0009034565603356914,2,338,0.7375411565236044,0.0008814503019256438,104.60277761539943,COMPLETE
342,0.37665703892707825,2023-09-05 14:41:43.429906,2023-09-05 14:41:46.651179,0 days 00:00:03.221273,ReLU,ReLU,,,41,14,13.0,,,0.0005234032105039118,2,360,0.40670246546380046,0.0005851824225261397,1084.0709629251498,COMPLETE
343,0.35678744316101074,2023-09-05 14:41:46.651460,2023-09-05 14:41:57.922776,0 days 00:00:11.271316,ReLU,ReLU,,,39,16,12.0,,,0.00014968224826075104,2,346,0.7923553858826581,0.00038628986093323573,123.23130485225964,COMPLETE
344,0.3434096872806549,2023-09-05 14:41:57.923059,2023-09-05 14:42:01.794214,0 days 00:00:03.871155,ReLU,Leaky,,,46,15,13.0,,,0.0006174628373351979,2,486,0.7432194420703869,0.000795761895806041,134.7246122427866,COMPLETE
345,0.38343381881713867,2023-09-05 14:42:01.794507,2023-09-05 14:42:04.534055,0 days 00:00:02.739548,ReLU,ReLU,,,43,16,10.0,,,0.0008026337405916284,2,332,0.7152741454073467,0.002457725476056438,104.5799984741211,COMPLETE
346,0.3699387013912201,2023-09-05 14:42:04.534340,2023-09-05 14:42:06.576816,0 days 00:00:02.042476,ReLU,ReLU,Leaky,Tanh,63,14,12.0,19.0,15.0,0.0009691953806827987,4,433,0.7974252691314301,0.0006627723220370067,112.8426045179367,COMPLETE
347,0.42631635069847107,2023-09-05 14:42:06.577124,2023-09-05 14:42:11.589785,0 days 00:00:05.012661,ReLU,ReLU,,,36,15,14.0,,,0.00011789306749440098,2,354,0.3186676147991822,0.0019156416936854344,160.22283418299787,COMPLETE
348,0.5372330546379089,2023-09-05 14:42:11.590070,2023-09-05 14:42:16.138143,0 days 00:00:04.548073,ReLU,ReLU,,,44,16,11.0,,,0.0006270903825016386,2,338,0.39390334331762056,0.08456931018490987,150.32322753247598,COMPLETE
349,0.3942347466945648,2023-09-05 14:42:16.138430,2023-09-05 14:42:19.596973,0 days 00:00:03.458543,ReLU,ReLU,,,60,15,13.0,,,0.0005031726136835481,2,375,0.42585932159923606,0.0002681390380743323,115.58289342916237,COMPLETE
350,0.38013866543769836,2023-09-05 14:42:19.597258,2023-09-05 14:42:22.515902,0 days 00:00:02.918644,ReLU,ReLU,,,47,17,12.0,,,0.0007900625200733536,2,349,0.7576988661347784,6.979911691971306e-05,118.99339236853258,COMPLETE
351,0.35194364190101624,2023-09-05 14:42:22.516191,2023-09-05 14:42:25.443031,0 days 00:00:02.926840,ReLU,ReLU,,,65,14,14.0,,,0.001037095404064353,2,327,0.7209174060987169,0.00036569360771919143,111.40184701603951,COMPLETE
352,0.38245779275894165,2023-09-05 14:42:25.443312,2023-09-05 14:42:27.055483,0 days 00:00:01.612171,Leaky,ReLU,,,27,15,11.0,,,0.004571174181728283,2,385,0.7693742110949692,0.00042443936176401575,335.5946894465266,COMPLETE
353,0.5440560579299927,2023-09-05 14:42:27.055775,2023-09-05 14:42:32.319330,0 days 00:00:05.263555,ReLU,ReLU,,,45,16,17.0,,,1.0613934432362384e-05,2,363,0.3904047847979538,0.0038461319732170747,137.64283910073524,COMPLETE
354,0.39654624462127686,2023-09-05 14:42:32.319618,2023-09-05 14:42:33.273767,0 days 00:00:00.954149,ReLU,ReLU,,,42,24,12.0,,,0.0021567704531421836,2,415,0.3481561372780008,0.002676227879303548,123.7115302808357,COMPLETE
355,0.3966730237007141,2023-09-05 14:42:33.274060,2023-09-05 14:42:34.071220,0 days 00:00:00.797160,ReLU,Leaky,,,38,15,14.0,,,0.007536524009492414,2,346,0.7423733521148708,0.0018386697477508148,156.82146072387695,COMPLETE
356,0.3564907908439636,2023-09-05 14:42:34.071502,2023-09-05 14:42:37.889797,0 days 00:00:03.818295,ReLU,ReLU,,,34,23,13.0,,,0.0007142820524584853,2,317,0.6990388233081274,0.000740474986068064,123.94051168746307,COMPLETE
357,0.35050490498542786,2023-09-05 14:42:37.890113,2023-09-05 14:42:39.472009,0 days 00:00:01.581896,ReLU,ReLU,,,30,24,12.0,,,0.001153182984715646,2,333,0.7668940448958957,0.0005281021739518262,126.52928829193115,COMPLETE
358,0.3989463150501251,2023-09-05 14:42:39.472296,2023-09-05 14:42:43.763638,0 days 00:00:04.291342,Tanh,ReLU,,,40,14,10.0,,,0.0005684227149877661,2,360,0.7996257208353231,0.000922982799599131,106.39731418725216,COMPLETE
359,0.3716442883014679,2023-09-05 14:42:43.763938,2023-09-05 14:42:45.185934,0 days 00:00:01.421996,ReLU,,,,61,14,,,,0.0017016579025435322,1,341,0.4504385767778736,0.0002389220584417588,124.07709118652343,COMPLETE
360,0.45955565571784973,2023-09-05 14:42:45.186208,2023-09-05 14:42:53.016823,0 days 00:00:07.830615,Leaky,Sigmoid,,,46,5,13.0,,,0.00018016629387464388,2,322,0.6691407080403335,0.00034416161352962733,245.91748781381926,COMPLETE
361,0.39316219091415405,2023-09-05 14:42:53.017123,2023-09-05 14:42:55.360495,0 days 00:00:02.343372,ReLU,ReLU,,,48,16,14.0,,,0.0008752974414125613,2,392,0.7238401260328725,0.0004382367462544885,110.35374350076194,COMPLETE
362,0.39825230836868286,2023-09-05 14:42:55.360786,2023-09-05 14:43:13.547039,0 days 00:00:18.186253,ReLU,ReLU,,,22,23,13.0,,,5.7342536409841446e-05,2,371,0.7455581676363678,1.572630861650231e-05,111.43768047322482,COMPLETE
363,0.3781491219997406,2023-09-05 14:43:13.547358,2023-09-05 14:43:14.608959,0 days 00:00:01.061601,ReLU,ReLU,,,63,24,11.0,,,0.002486923992689277,2,458,0.5483780577088625,0.0022492449789413864,142.26796032133558,COMPLETE
364,0.4069434106349945,2023-09-05 14:43:14.609263,2023-09-05 14:43:16.003479,0 days 00:00:01.394216,ReLU,ReLU,,,67,13,17.0,,,0.00046368260978709005,2,333,0.2368457101779035,0.0015252431783275967,123.58597248732441,COMPLETE
365,0.44284823536872864,2023-09-05 14:43:16.003770,2023-09-05 14:43:17.575456,0 days 00:00:01.571686,ReLU,ReLU,,,56,4,18.0,,,0.001025713864560456,2,356,0.6991895790654691,0.0002882616912750497,358.69383948957415,COMPLETE
366,0.362893670797348,2023-09-05 14:43:17.575750,2023-09-05 14:43:19.295020,0 days 00:00:01.719270,ReLU,ReLU,,,65,15,14.0,,,0.0012671708604099945,2,349,0.5277866654186283,0.0041107319264200365,118.63412626799162,COMPLETE
367,0.35713452100753784,2023-09-05 14:43:19.295303,2023-09-05 14:43:20.934525,0 days 00:00:01.639222,ReLU,ReLU,,,43,18,19.0,,,0.0018717029118597921,2,315,0.6390048284675269,0.0029802600286679606,219.22969689002403,COMPLETE
368,0.3980081081390381,2023-09-05 14:43:20.934820,2023-09-05 14:43:23.483218,0 days 00:00:02.548398,Leaky,ReLU,,,40,23,12.0,,,0.0006569865119410121,2,340,0.7997649291915008,0.0006086959861059957,165.21170737526634,COMPLETE
369,0.35746559500694275,2023-09-05 14:43:23.483501,2023-09-05 14:43:26.493328,0 days 00:00:03.009827,ReLU,Leaky,,,36,12,11.0,,,0.0008419159216629825,2,326,0.678300881330923,0.001985434933899025,136.96064916931758,COMPLETE
370,0.30310216546058655,2023-09-05 14:43:26.493627,2023-09-05 14:43:28.059473,0 days 00:00:01.565846,ReLU,ReLU,,,58,17,14.0,,,0.0014771561191715705,2,436,0.7213964906867537,0.00244545542674789,182.39003477234772,COMPLETE
371,0.3910440504550934,2023-09-05 14:43:28.059763,2023-09-05 14:43:30.018891,0 days 00:00:01.959128,ReLU,ReLU,,,60,17,14.0,,,0.0015491832037336196,2,442,0.6009097103068102,0.002304738748777362,170.94244111259027,COMPLETE
372,0.4390493333339691,2023-09-05 14:43:30.019174,2023-09-05 14:43:31.167395,0 days 00:00:01.148221,ReLU,ReLU,,,58,17,13.0,,,0.0013530427159718986,2,433,0.7107430816585306,0.002785786177318265,142.44076223934397,COMPLETE
373,0.3810386061668396,2023-09-05 14:43:31.167681,2023-09-05 14:43:32.540490,0 days 00:00:01.372809,ReLU,ReLU,,,58,16,9.0,,,0.0018584113018250987,2,452,0.5074437788258286,0.0014368014976469854,108.89689858015194,COMPLETE
374,0.3790084421634674,2023-09-05 14:43:32.540775,2023-09-05 14:43:33.702911,0 days 00:00:01.162136,ReLU,ReLU,,,61,18,13.0,,,0.0015909495832692605,2,427,0.3734609790029531,0.003510972011765608,191.55874549865723,COMPLETE
375,0.39127883315086365,2023-09-05 14:43:33.703205,2023-09-05 14:43:41.112587,0 days 00:00:07.409382,ReLU,ReLU,,,59,19,14.0,,,8.803552030770734e-05,2,412,0.58091935500008,0.0018853934178969791,183.61537387070146,COMPLETE
376,0.3476901650428772,2023-09-05 14:43:41.112884,2023-09-05 14:43:42.487172,0 days 00:00:01.374288,Leaky,ReLU,,,62,16,12.0,,,0.00114511758931095,2,424,0.47646350630497475,0.00021302283168489106,112.44885527569315,COMPLETE
377,0.3450828492641449,2023-09-05 14:43:42.487476,2023-09-05 14:43:44.336235,0 days 00:00:01.848759,ReLU,ReLU,,,56,18,13.0,,,0.0013293488370158468,2,444,0.6458667200266901,0.02718971785779131,121.3584097530065,COMPLETE
378,0.35024628043174744,2023-09-05 14:43:44.336532,2023-09-05 14:43:45.802656,0 days 00:00:01.466124,ReLU,ReLU,,,63,24,14.0,,,0.0023452602360507484,2,376,0.6763234894606336,0.0025141706329427902,95.49207136366103,COMPLETE
379,0.34785160422325134,2023-09-05 14:43:45.802957,2023-09-05 14:43:47.614538,0 days 00:00:01.811581,ReLU,ReLU,,,60,24,10.0,,,0.0009934900733156605,2,354,0.7385990684408809,0.0001514944995866172,122.6744330406189,COMPLETE
380,0.36613044142723083,2023-09-05 14:43:47.614832,2023-09-05 14:43:49.266056,0 days 00:00:01.651224,ReLU,ReLU,,,65,17,11.0,,,0.0015496630454584577,2,436,0.7137542011642405,0.0002695058173201182,141.4266890513746,COMPLETE
381,0.34441012144088745,2023-09-05 14:43:49.266345,2023-09-05 14:43:50.763512,0 days 00:00:01.497167,ReLU,Leaky,,,38,24,23.0,,,0.0020683773042869456,2,366,0.4293641013917318,0.0016691779617717382,280.43745822906493,COMPLETE
382,0.43294331431388855,2023-09-05 14:43:50.763812,2023-09-05 14:43:51.616452,0 days 00:00:00.852640,ReLU,ReLU,,,34,7,17.0,,,0.0011708981114587687,2,343,0.1628732973876372,0.001226246187000549,126.06656886509487,COMPLETE
383,0.4186461865901947,2023-09-05 14:43:51.616753,2023-09-05 14:43:55.780879,0 days 00:00:04.164126,Tanh,Sigmoid,,,41,15,14.0,,,0.00041299514847346685,2,332,0.30541868579086284,0.0031370420406689097,127.64485779727798,COMPLETE
