number,value,datetime_start,datetime_complete,duration,params_activation1,params_activation2,params_activation3,params_activation4,params_batch_size,params_fl1,params_fl2,params_fl3,params_fl4,params_learning_rate,params_n_layers,params_num_epochs,params_train_size,params_weight_decay,user_attrs_mre,state
578,0.34677618741989136,2023-09-05 14:53:12.595427,2023-09-05 14:53:15.946814,0 days 00:00:03.351387,Sigmoid,Leaky,,,61,16,15.0,,,0.0011232556762932947,2,324,0.7631064457480017,2.8016733151438895e-05,107.4702525755175,COMPLETE
579,0.41035592555999756,2023-09-05 14:53:15.947131,2023-09-05 14:53:17.016461,0 days 00:00:01.069330,ReLU,ReLU,,,47,18,17.0,,,0.02816608161972267,2,343,0.6886457541704079,0.0004134136647683564,140.4263006070765,COMPLETE
580,0.37918704748153687,2023-09-05 14:53:17.016786,2023-09-05 14:53:17.614856,0 days 00:00:00.598070,ReLU,ReLU,,,75,19,15.0,,,0.0039087130954573905,2,364,0.5271452881335834,0.0006118099355790567,111.84830379486084,COMPLETE
581,0.353254497051239,2023-09-05 14:53:17.615187,2023-09-05 14:53:18.368248,0 days 00:00:00.753061,ReLU,ReLU,,,65,8,18.0,,,0.005031903924068377,2,427,0.24570988794460882,0.011592195910113305,154.40148803710937,COMPLETE
582,0.3542819321155548,2023-09-05 14:53:18.368578,2023-09-05 14:53:20.782517,0 days 00:00:02.413939,ReLU,Sigmoid,,,51,23,16.0,,,0.0009732836352927843,2,296,0.7202888010109089,0.0008050478786214891,112.53893932853778,COMPLETE
583,0.40902528166770935,2023-09-05 14:53:20.782926,2023-09-05 14:53:21.533251,0 days 00:00:00.750325,ReLU,ReLU,,,39,24,13.0,,,0.0025854249151905204,2,351,0.25822284784119687,0.00026498347136132806,215.9460696265811,COMPLETE
584,0.5421186089515686,2023-09-05 14:53:21.533601,2023-09-05 14:53:29.091364,0 days 00:00:07.557763,ReLU,ReLU,,,64,8,12.0,,,2.632638058313531e-05,2,331,0.7994274485543141,0.001462316896010333,140.3261237475807,COMPLETE
585,0.41570213437080383,2023-09-05 14:53:29.091684,2023-09-05 14:53:34.539456,0 days 00:00:05.447772,Leaky,Leaky,,,41,7,14.0,,,0.0005357377505532426,2,339,0.7429576788583334,0.0074006788684119924,144.63101477801482,COMPLETE
586,0.42741844058036804,2023-09-05 14:53:34.539773,2023-09-05 14:53:36.872387,0 days 00:00:02.332614,ReLU,ReLU,,,60,23,16.0,,,0.0007950929999288056,2,267,0.5798988704469554,0.041752296867254665,171.27330236919855,COMPLETE
587,0.3812982738018036,2023-09-05 14:53:36.872698,2023-09-05 14:53:39.965188,0 days 00:00:03.092490,ReLU,ReLU,,,43,14,15.0,,,0.00043638589620767797,2,318,0.30696121695304635,0.0021049506428502444,121.36998889629658,COMPLETE
588,0.38142651319503784,2023-09-05 14:53:39.965516,2023-09-05 14:53:42.700449,0 days 00:00:02.734933,ReLU,,,,63,24,,,,0.0006352860360709587,1,356,0.6515777734629382,7.387498450295693e-05,112.02761386584685,COMPLETE
589,0.3959254324436188,2023-09-05 14:53:42.700759,2023-09-05 14:53:44.259542,0 days 00:00:01.558783,ReLU,Tanh,,,56,15,13.0,,,0.002065722701161505,2,305,0.48169472351276577,0.00037204819657480633,118.09621040188536,COMPLETE
590,0.38192233443260193,2023-09-05 14:53:44.259857,2023-09-05 14:53:45.386316,0 days 00:00:01.126459,Sigmoid,ReLU,ReLU,Tanh,67,6,17.0,18.0,20.0,0.008828230400540487,4,329,0.42981620238449253,1.4100229993471815e-05,124.74754874936995,COMPLETE
591,0.3855022192001343,2023-09-05 14:53:45.386659,2023-09-05 14:53:46.543606,0 days 00:00:01.156947,ReLU,ReLU,,,46,16,14.0,,,0.001386029547573542,2,347,0.6220100573136055,0.0025456700450396308,146.7385397338867,COMPLETE
592,0.38742515444755554,2023-09-05 14:53:46.543921,2023-09-05 14:53:51.477230,0 days 00:00:04.933309,ReLU,ReLU,,,59,24,15.0,,,0.0003505011140689358,2,453,0.6947207963411715,0.00031024901070547065,150.99777082963422,COMPLETE
593,0.34874752163887024,2023-09-05 14:53:51.477563,2023-09-05 14:53:55.895988,0 days 00:00:04.418425,ReLU,ReLU,,,35,17,12.0,,,0.0009014806977596523,2,339,0.7687617792896646,0.0011353448340583785,120.27951578455647,COMPLETE
594,0.3877857029438019,2023-09-05 14:53:55.896310,2023-09-05 14:54:01.140794,0 days 00:00:05.244484,Leaky,Leaky,,,62,7,13.0,,,0.0005492046184556188,2,369,0.731039865573093,0.00021287473999361762,467.7640348605024,COMPLETE
595,0.47749584913253784,2023-09-05 14:54:01.141116,2023-09-05 14:54:01.912556,0 days 00:00:00.771440,ReLU,ReLU,Leaky,,37,22,19.0,21.0,,0.0007260830115133925,3,322,0.10256218935219262,0.0019502216834498837,150.08280968666077,COMPLETE
596,0.44013509154319763,2023-09-05 14:54:01.912882,2023-09-05 14:54:02.552693,0 days 00:00:00.639811,ReLU,ReLU,,,79,23,14.0,,,0.0032480870962466307,2,380,0.22566519590501183,0.04786281914910936,133.15130397251673,COMPLETE
597,0.38487130403518677,2023-09-05 14:54:02.553011,2023-09-05 14:54:03.833424,0 days 00:00:01.280413,ReLU,ReLU,,,44,21,16.0,,,0.0011117723115499289,2,352,0.29675881576421087,0.0004767528395862485,102.7772164778276,COMPLETE
598,0.37959060072898865,2023-09-05 14:54:03.833739,2023-09-05 14:54:05.073887,0 days 00:00:01.240148,ReLU,ReLU,,,65,5,15.0,,,0.0015946162481893205,2,334,0.24981847969964374,0.0013971807001219119,114.05986418547454,COMPLETE
599,0.43334847688674927,2023-09-05 14:54:05.074206,2023-09-05 14:54:06.403481,0 days 00:00:01.329275,Tanh,ReLU,,,54,24,14.0,,,0.00046369531146363854,2,311,0.11053910567024824,0.0006026823302616696,138.01863669735826,COMPLETE
600,0.39149320125579834,2023-09-05 14:54:06.403800,2023-09-05 14:54:07.678554,0 days 00:00:01.274754,ReLU,Leaky,,,48,15,12.0,,,0.002275242969926876,2,363,0.27700492990715636,0.006783963662918288,149.97143773563573,COMPLETE
601,0.45717769861221313,2023-09-05 14:54:07.678868,2023-09-05 14:54:13.701233,0 days 00:00:06.022365,ReLU,ReLU,,,73,14,13.0,,,4.8265823555689295e-05,2,344,0.6636663121982238,0.002372428632752103,147.70489774748336,COMPLETE
602,0.33852705359458923,2023-09-05 14:54:13.701556,2023-09-05 14:54:16.099137,0 days 00:00:02.397581,ReLU,ReLU,,,61,23,14.0,,,0.0006042422629758306,2,393,0.7124413831278725,0.009947984803381936,119.09436812094592,COMPLETE
603,0.44237858057022095,2023-09-05 14:54:16.099456,2023-09-05 14:54:18.017346,0 days 00:00:01.917890,Sigmoid,ReLU,,,63,16,15.0,,,0.0012511522839855115,2,321,0.23208514141181713,0.004327539140978911,126.20307371351454,COMPLETE
604,0.36626294255256653,2023-09-05 14:54:18.017673,2023-09-05 14:54:19.194134,0 days 00:00:01.176461,ReLU,Tanh,,,40,7,20.0,,,0.019007146096360467,2,334,0.7576152457611542,0.0008035429911658526,131.75602474728146,COMPLETE
605,0.4655614197254181,2023-09-05 14:54:19.194455,2023-09-05 14:54:26.865755,0 days 00:00:07.671300,Leaky,ReLU,,,57,24,15.0,,,2.6778281848284803e-05,2,353,0.6819469779975149,4.810425569613544e-05,284.509477350597,COMPLETE
606,0.3948207497596741,2023-09-05 14:54:26.866082,2023-09-05 14:54:33.889053,0 days 00:00:07.022971,ReLU,ReLU,Tanh,,10,8,13.0,9.0,,0.0008648994219311252,3,435,0.551643722639596,1.2569926753832043e-05,130.19807624816895,COMPLETE
607,0.3486911356449127,2023-09-05 14:54:33.889565,2023-09-05 14:54:36.798916,0 days 00:00:02.909351,ReLU,Leaky,,,67,17,16.0,,,0.0003122122508772452,2,343,0.3320668228440514,0.00015501371783315765,138.44377530331644,COMPLETE
608,0.4145008623600006,2023-09-05 14:54:36.799257,2023-09-05 14:54:39.679611,0 days 00:00:02.880354,ReLU,ReLU,,,20,23,12.0,,,0.0003843984408889568,2,331,0.20898519014789238,0.00039243534573148837,119.83235082779339,COMPLETE
609,0.3585825562477112,2023-09-05 14:54:39.679936,2023-09-05 14:54:41.029896,0 days 00:00:01.349960,ReLU,Sigmoid,,,42,24,14.0,,,0.0017975029179876484,2,105,0.6122874602141806,0.00018961045491578974,103.10479312472873,COMPLETE
610,0.37915459275245667,2023-09-05 14:54:41.030222,2023-09-05 14:54:41.624089,0 days 00:00:00.593867,ReLU,ReLU,,,64,22,15.0,,,0.01049887524913499,2,409,0.7282369173212594,0.0015772380301141615,131.23784432044397,COMPLETE
611,0.40718913078308105,2023-09-05 14:54:41.624412,2023-09-05 14:54:43.922566,0 days 00:00:02.298154,ReLU,ReLU,,,60,24,13.0,,,0.0007299389682556524,2,301,0.768240332696077,0.00030376274761191824,130.5652959764618,COMPLETE
612,0.48540714383125305,2023-09-05 14:54:43.922900,2023-09-05 14:54:44.866068,0 days 00:00:00.943168,ReLU,ReLU,,,46,15,16.0,,,0.0010425912176230078,2,371,0.18767292050043344,2.6533944015487483e-05,157.20432383619894,COMPLETE
613,0.4215351939201355,2023-09-05 14:54:44.866413,2023-09-05 14:54:45.214125,0 days 00:00:00.347712,Leaky,ReLU,,,38,18,12.0,,,0.09833932212209122,2,360,0.5044149732766381,0.00010490442461773215,248.97079576764787,COMPLETE
614,0.3708477318286896,2023-09-05 14:54:45.214455,2023-09-05 14:54:48.144417,0 days 00:00:02.929962,ReLU,Leaky,,,50,14,14.0,,,0.000474344215182519,2,315,0.6454689964015409,0.01428844819383405,299.75431311221524,COMPLETE
615,0.3671500086784363,2023-09-05 14:54:48.144731,2023-09-05 14:54:48.497597,0 days 00:00:00.352866,ReLU,ReLU,,,76,10,16.0,,,0.04745440229352386,2,344,0.698514796267295,0.0006912107275757591,238.76655758128447,COMPLETE
616,0.5152532458305359,2023-09-05 14:54:48.497920,2023-09-05 14:54:49.307867,0 days 00:00:00.809947,ReLU,Tanh,,,69,23,13.0,,,0.0005989258163817123,2,327,0.13486249057508298,0.00049265557038994,255.55284387925093,COMPLETE
617,0.4099175035953522,2023-09-05 14:54:49.308188,2023-09-05 14:54:55.864748,0 days 00:00:06.556560,Sigmoid,ReLU,Sigmoid,,66,16,15.0,12.0,,0.0014498777831715589,3,243,0.7415748802371168,0.0009395160889205849,151.69348568386502,COMPLETE
618,0.392141193151474,2023-09-05 14:54:55.865085,2023-09-05 14:54:56.500262,0 days 00:00:00.635177,ReLU,ReLU,,,71,8,14.0,,,0.014397284980543604,2,355,0.670373334164169,0.022946455960782857,187.55970764160156,COMPLETE
619,0.35106417536735535,2023-09-05 14:54:56.500585,2023-09-05 14:54:57.373422,0 days 00:00:00.872837,ReLU,ReLU,,,45,23,15.0,,,0.002980895839667125,2,339,0.5765555322929213,0.006342029627371856,143.82928075545874,COMPLETE
620,0.34840965270996094,2023-09-05 14:54:57.373739,2023-09-05 14:54:58.165674,0 days 00:00:00.791935,ReLU,ReLU,,,61,6,17.0,,,0.004199944491769328,2,348,0.7728362200042742,0.001894364940743611,138.7005982832475,COMPLETE
621,0.41045722365379333,2023-09-05 14:54:58.165992,2023-09-05 14:54:59.210263,0 days 00:00:01.044271,ReLU,ReLU,,,58,7,22.0,,,0.0009212096511756312,2,326,0.21041076728786126,0.0001277400888097705,119.00677352481418,COMPLETE
622,0.3642558455467224,2023-09-05 14:54:59.210587,2023-09-05 14:55:04.237855,0 days 00:00:05.027268,Leaky,Leaky,,,42,19,13.0,,,0.0005235883645176942,2,311,0.7989136176666808,0.0029295364339844056,126.58809977401921,COMPLETE
623,0.38464364409446716,2023-09-05 14:55:04.238185,2023-09-05 14:55:06.892463,0 days 00:00:02.654278,ReLU,ReLU,,,64,24,12.0,,,0.0007523413769206666,2,364,0.44614326998543014,0.0012426838046760015,118.02510093803981,COMPLETE
624,0.5401502251625061,2023-09-05 14:55:06.892784,2023-09-05 14:55:08.701274,0 days 00:00:01.808490,Tanh,ReLU,,,73,24,14.0,,,7.185500189035138e-05,2,336,0.18050927471083933,0.00023804107073062134,142.74325195948282,COMPLETE
625,0.38788098096847534,2023-09-05 14:55:08.701603,2023-09-05 14:55:13.479000,0 days 00:00:04.777397,ReLU,ReLU,,,62,9,11.0,,,0.0002046109885061969,2,424,0.3726144171946577,0.002506181961378334,117.70049123943977,COMPLETE
626,0.4802873432636261,2023-09-05 14:55:13.479326,2023-09-05 14:55:20.956485,0 days 00:00:07.477159,ReLU,ReLU,,,66,17,15.0,,,1.4860571318426363e-05,2,377,0.7046225200062634,0.005192627626269417,135.87723059616292,COMPLETE
627,0.49628883600234985,2023-09-05 14:55:20.956809,2023-09-05 14:55:26.230008,0 days 00:00:05.273199,ReLU,ReLU,,,40,23,13.0,,,4.1313020474035196e-05,2,461,0.2732461625365816,0.0003774940225095778,166.0437818680306,COMPLETE
628,0.42696690559387207,2023-09-05 14:55:26.230354,2023-09-05 14:55:28.782756,0 days 00:00:02.552402,ReLU,Leaky,ReLU,,34,16,10.0,14.0,,0.00041321926010609334,3,323,0.1651548643928343,0.00822052404456316,174.71623767089844,COMPLETE
629,0.4237574636936188,2023-09-05 14:55:28.783104,2023-09-05 14:55:29.671951,0 days 00:00:00.888847,ReLU,Tanh,,,59,22,14.0,,,0.0011623926832563369,2,351,0.19070534619020532,0.003918776370869872,130.56262998652636,COMPLETE
630,0.414638876914978,2023-09-05 14:55:29.672265,2023-09-05 14:55:32.255544,0 days 00:00:02.583279,Sigmoid,ReLU,,,44,24,16.0,,,0.0006313811612539112,2,334,0.7314151166239632,0.0017257353836165328,114.86640038651026,COMPLETE
631,0.36311471462249756,2023-09-05 14:55:32.255859,2023-09-05 14:55:38.131639,0 days 00:00:05.875780,ReLU,ReLU,,,48,7,13.0,,,0.00029577160592266947,2,447,0.634475335706678,0.0005672045099710762,145.2422569187875,COMPLETE
632,0.41071298718452454,2023-09-05 14:55:38.131971,2023-09-05 14:55:38.620162,0 days 00:00:00.488191,ReLU,Sigmoid,,,14,15,12.0,,,0.011940276088305377,2,320,0.15153481879649436,4.6170343656562077e-05,176.2841365419585,COMPLETE
633,0.3310283422470093,2023-09-05 14:55:38.620521,2023-09-05 14:55:40.179140,0 days 00:00:01.558619,Leaky,ReLU,,,68,11,16.0,,,0.002459446443643921,2,358,0.6784713283047823,0.0032332510856915896,137.3391385759626,COMPLETE
634,0.33983758091926575,2023-09-05 14:55:40.179489,2023-09-05 14:55:40.947470,0 days 00:00:00.767981,ReLU,ReLU,,,64,18,15.0,,,0.017833868321409714,2,308,0.7552343051626148,0.00045942701301422305,130.20294618606567,COMPLETE
635,0.37534481287002563,2023-09-05 14:55:40.947800,2023-09-05 14:55:42.483742,0 days 00:00:01.535942,ReLU,ReLU,,,62,23,14.0,,,0.0017847787092850084,2,346,0.6053808686759627,1.7242742362032874e-05,117.51693537205826,COMPLETE
636,0.37535783648490906,2023-09-05 14:55:42.484080,2023-09-05 14:55:43.507054,0 days 00:00:01.022974,ReLU,Leaky,,,39,24,13.0,,,0.0009513340724802218,2,387,0.2599492440345111,3.5736623800375054e-05,121.61663272164084,COMPLETE
637,0.5937106609344482,2023-09-05 14:55:43.507386,2023-09-05 14:55:48.577635,0 days 00:00:05.070249,ReLU,ReLU,,,36,15,14.0,,,2.5147706639236913e-05,2,294,0.38909304812240575,7.940927873088428e-05,157.45145462970345,COMPLETE
638,0.5135864019393921,2023-09-05 14:55:48.577970,2023-09-05 14:55:50.519536,0 days 00:00:01.941566,ReLU,ReLU,,,42,8,15.0,,,0.0013134979267084618,2,366,0.7207244623783177,0.069235740966066,126.42507889021688,COMPLETE
639,0.4468449652194977,2023-09-05 14:55:50.519871,2023-09-05 14:55:59.294516,0 days 00:00:08.774645,ReLU,ReLU,Leaky,,52,21,5.0,8.0,,6.388801414482393e-05,3,340,0.6580802236264363,0.00027145988039903876,125.76629800235524,COMPLETE
640,0.4255113899707794,2023-09-05 14:55:59.294871,2023-09-05 14:55:59.784835,0 days 00:00:00.489964,Leaky,ReLU,,,75,14,17.0,,,0.005787687377754471,2,330,0.4029934764969111,0.0022659293946938404,157.09354158727135,COMPLETE
641,0.3642331063747406,2023-09-05 14:55:59.785171,2023-09-05 14:56:02.084392,0 days 00:00:02.299221,ReLU,ReLU,,,46,24,15.0,,,0.0007183856930598193,2,177,0.5289236844462428,0.001051292651424458,104.31321580531234,COMPLETE
642,0.42471909523010254,2023-09-05 14:56:02.084721,2023-09-05 14:56:04.096131,0 days 00:00:02.011410,ReLU,Tanh,,,70,16,12.0,,,0.0004624863276930281,2,353,0.2927255350099243,0.000342555449687852,230.1084231762176,COMPLETE
643,0.37618908286094666,2023-09-05 14:56:04.096457,2023-09-05 14:56:06.117187,0 days 00:00:02.020730,ReLU,Leaky,,,68,20,11.0,,,0.0005511436714088361,2,315,0.2428060349653168,0.0060787270365543,148.56732497416752,COMPLETE
644,0.3455028533935547,2023-09-05 14:56:06.117511,2023-09-05 14:56:09.172398,0 days 00:00:03.054887,ReLU,ReLU,,,65,17,13.0,,,0.00035992155418050186,2,342,0.4192760692593716,0.009089432545332201,107.48148081253986,COMPLETE
645,0.8122022151947021,2023-09-05 14:56:09.172716,2023-09-05 14:56:16.507759,0 days 00:00:07.335043,Sigmoid,ReLU,,,56,7,14.0,,,1.2475273587071114e-05,2,329,0.6988304138872103,0.0013727065508728565,142.0981941339093,COMPLETE
646,0.4521861672401428,2023-09-05 14:56:16.508088,2023-09-05 14:56:20.388448,0 days 00:00:03.880360,ReLU,,,,44,22,,,,0.000771109505787093,1,438,0.7745477793479054,0.0006794283431541139,111.54051213176704,COMPLETE
647,0.5872460603713989,2023-09-05 14:56:20.388754,2023-09-05 14:56:28.757783,0 days 00:00:08.369029,ReLU,ReLU,,,60,23,16.0,,,1.0668111462295541e-05,2,372,0.7433542206921974,0.028661046538293284,128.5779627112932,COMPLETE
648,0.39196181297302246,2023-09-05 14:56:28.758120,2023-09-05 14:56:30.538899,0 days 00:00:01.780779,Tanh,ReLU,,,72,9,13.0,,,0.0010272111256839729,2,359,0.7112109864359868,0.012183573628253376,158.26041512960916,COMPLETE
649,0.4068732261657715,2023-09-05 14:56:30.539224,2023-09-05 14:56:32.545997,0 days 00:00:02.006773,ReLU,ReLU,,,66,6,19.0,,,0.0015831186864277555,2,321,0.7984546625650958,0.025102010511977153,129.6854168204374,COMPLETE
650,0.42537397146224976,2023-09-05 14:56:32.546338,2023-09-05 14:56:38.154251,0 days 00:00:05.607913,Leaky,ReLU,,,62,13,15.0,,,0.00023566722392490404,2,281,0.673830463921796,0.004350570872970093,112.076857434473,COMPLETE
651,0.39450955390930176,2023-09-05 14:56:38.154576,2023-09-05 14:56:40.793230,0 days 00:00:02.638654,ReLU,ReLU,,,33,8,14.0,,,0.0006338779247531017,2,304,0.4572624518321804,0.00020894471243559248,123.2592490591654,COMPLETE
652,0.35215502977371216,2023-09-05 14:56:40.793563,2023-09-05 14:56:43.126404,0 days 00:00:02.332841,ReLU,Leaky,,,38,24,12.0,,,0.0008470011851838789,2,345,0.6428292504725883,0.0003059837535668824,111.3487845829555,COMPLETE
653,0.46861737966537476,2023-09-05 14:56:43.126725,2023-09-05 14:56:43.480363,0 days 00:00:00.353638,ReLU,ReLU,,,58,23,15.0,,,0.008020122392426268,2,333,0.17525243979845392,0.002063199111176435,186.20979817708334,COMPLETE
654,0.3532533645629883,2023-09-05 14:56:43.480682,2023-09-05 14:56:46.695996,0 days 00:00:03.215314,ReLU,ReLU,ReLU,Leaky,41,17,13.0,10.0,4.0,0.0005029259089342302,4,353,0.7529774981656326,0.00263466662126926,115.33208307043299,COMPLETE
655,0.3590167462825775,2023-09-05 14:56:46.696337,2023-09-05 14:56:47.554606,0 days 00:00:00.858269,ReLU,ReLU,,,63,14,15.0,,,0.002081590539369689,2,337,0.7250128862595363,0.000932116981843595,115.03127856132312,COMPLETE
656,0.3831918239593506,2023-09-05 14:56:47.554930,2023-09-05 14:56:49.260726,0 days 00:00:01.705796,ReLU,Tanh,Leaky,,47,24,14.0,21.0,,0.0035278628377031656,3,317,0.6909882031714635,0.0004222122854347978,113.77093546731132,COMPLETE
657,0.5354644656181335,2023-09-05 14:56:49.261063,2023-09-05 14:56:52.482305,0 days 00:00:03.221242,Sigmoid,Sigmoid,,,43,15,16.0,,,0.001224874347404829,2,133,0.6201369400864304,0.0032868461817068526,498.27822910394883,COMPLETE
658,0.39629730582237244,2023-09-05 14:56:52.482640,2023-09-05 14:56:54.908748,0 days 00:00:02.426108,ReLU,ReLU,,,67,16,11.0,,,0.000394753911900903,2,397,0.36006778027871794,8.139743531627307e-05,1763.3265117776805,COMPLETE
659,0.3547613322734833,2023-09-05 14:56:54.909083,2023-09-05 14:56:55.464454,0 days 00:00:00.555371,ReLU,Leaky,,,78,18,10.0,,,0.06431470928389377,2,326,0.7603647695404361,0.0002489729280692128,115.12804970374474,COMPLETE
660,0.37537652254104614,2023-09-05 14:56:55.464791,2023-09-05 14:56:59.769940,0 days 00:00:04.305149,Leaky,ReLU,,,36,7,12.0,,,0.0014700561530769255,2,361,0.7256475901294321,0.0016264244205583052,129.14543281969173,COMPLETE
661,0.3562593162059784,2023-09-05 14:56:59.771709,2023-09-05 14:57:00.388745,0 days 00:00:00.617036,ReLU,ReLU,,,64,24,14.0,,,0.0026625550549835915,2,348,0.4863495356226629,0.0074055156393235235,107.6344144484576,COMPLETE
662,0.40640318393707275,2023-09-05 14:57:00.389197,2023-09-05 14:57:03.123271,0 days 00:00:02.734074,ReLU,ReLU,,,54,23,17.0,,,0.0006455134599968667,2,340,0.5881615002767515,0.0005244037245177223,170.1053401560023,COMPLETE
663,0.49774813652038574,2023-09-05 14:57:03.123628,2023-09-05 14:57:06.303421,0 days 00:00:03.179793,ReLU,ReLU,,,61,8,13.0,,,9.097792846614765e-05,2,371,0.2570877460406992,0.0012349854085732246,167.71097447480153,COMPLETE
664,0.35101521015167236,2023-09-05 14:57:06.303757,2023-09-05 14:57:07.224691,0 days 00:00:00.920934,ReLU,ReLU,,,49,10,15.0,,,0.018884057199611434,2,308,0.5183370170044173,2.2743796749192903e-05,115.18473958969116,COMPLETE
665,0.3773363530635834,2023-09-05 14:57:07.225049,2023-09-05 14:57:07.527192,0 days 00:00:00.302143,ReLU,ReLU,,,69,24,16.0,,,0.006235454055547598,2,417,0.1586200760706932,0.00010033766920017826,132.61835897193765,COMPLETE
666,0.44365403056144714,2023-09-05 14:57:07.527533,2023-09-05 14:57:08.010748,0 days 00:00:00.483215,ReLU,ReLU,,,45,22,14.0,,,0.0010211791778754055,2,325,0.11709005956760474,0.005453642195876149,128.63126990500461,COMPLETE
667,0.3643251657485962,2023-09-05 14:57:08.011086,2023-09-05 14:57:08.883419,0 days 00:00:00.872333,ReLU,Leaky,Sigmoid,,74,23,12.0,17.0,,0.004603436759808295,3,350,0.6585957602453854,0.00016251974290543158,124.90649528503418,COMPLETE
668,0.45796796679496765,2023-09-05 14:57:08.883766,2023-09-05 14:57:10.037119,0 days 00:00:01.153353,Leaky,ReLU,,,40,15,14.0,,,0.0005331087078893656,2,468,0.10323100201331972,0.0008414864848403862,3502.7865728048914,COMPLETE
669,0.3673262596130371,2023-09-05 14:57:10.037467,2023-09-05 14:57:13.281246,0 days 00:00:03.243779,ReLU,ReLU,,,22,23,13.0,,,0.000886042194217211,2,335,0.6878382586526868,0.0003635440476964109,116.88845530918667,COMPLETE
670,0.43815532326698303,2023-09-05 14:57:13.281590,2023-09-05 14:57:20.209469,0 days 00:00:06.927879,Sigmoid,ReLU,,,59,6,21.0,,,0.00044173559898792524,2,362,0.7657860333324654,0.002069565249747649,136.03638450164254,COMPLETE
671,0.4089140295982361,2023-09-05 14:57:20.209817,2023-09-05 14:57:21.420904,0 days 00:00:01.211087,ReLU,Tanh,,,65,9,18.0,,,0.001746353257388959,2,343,0.5573263705055956,0.010293802907225175,618.6080451213138,COMPLETE
672,0.3696555197238922,2023-09-05 14:57:21.421257,2023-09-05 14:57:24.419093,0 days 00:00:02.997836,ReLU,Leaky,,,63,16,4.0,,,0.0007482067683393782,2,380,0.7999093516601665,9.03159597280136e-05,114.49246408057026,COMPLETE
673,0.3651062250137329,2023-09-05 14:57:24.419435,2023-09-05 14:57:30.373125,0 days 00:00:05.953690,Tanh,ReLU,,,43,24,15.0,,,0.0003206787315015368,2,316,0.7104076582148262,0.0028488132725841904,118.06247509650464,COMPLETE
674,0.464089572429657,2023-09-05 14:57:30.373465,2023-09-05 14:57:32.630421,0 days 00:00:02.256956,ReLU,ReLU,,,71,24,11.0,,,0.0006133914405073795,2,330,0.3325091387501725,0.05648854183894662,189.6055380779764,COMPLETE
