number,value,datetime_start,datetime_complete,duration,params_activation1,params_activation2,params_activation3,params_activation4,params_batch_size,params_fl1,params_fl2,params_fl3,params_fl4,params_learning_rate,params_n_layers,params_num_epochs,params_train_size,params_weight_decay,user_attrs_mre,state
1645,0.44146642088890076,2023-09-05 15:36:18.539221,2023-09-05 15:36:20.549456,0 days 00:00:02.010235,ReLU,ReLU,,,45,21,15.0,,,0.0008330733559582844,2,226,0.3448553121583667,0.0329579206666466,142.90933617011652,COMPLETE
1646,0.39287376403808594,2023-09-05 15:36:20.549895,2023-09-05 15:36:22.401354,0 days 00:00:01.851459,Leaky,ReLU,,,37,16,13.0,,,0.000998828368039703,2,351,0.34973262957207585,0.011833202657545467,119.03016649443528,COMPLETE
1647,0.4308331310749054,2023-09-05 15:36:22.401801,2023-09-05 15:36:23.678929,0 days 00:00:01.277128,ReLU,Tanh,,,80,15,14.0,,,0.0013358943621792243,2,380,0.7450637752050233,0.002061966786407205,126.47048330307007,COMPLETE
1648,0.5887085199356079,2023-09-05 15:36:23.679391,2023-09-05 15:36:27.448454,0 days 00:00:03.769063,Sigmoid,ReLU,,,49,18,11.0,,,2.8202407605746463e-05,2,361,0.2843588109162904,0.000531636386460851,117.31606520972423,COMPLETE
1649,0.5341699719429016,2023-09-05 15:36:27.448901,2023-09-05 15:36:33.140119,0 days 00:00:05.691218,ReLU,ReLU,,,84,14,15.0,,,1.8193735026757565e-05,2,331,0.720517506268815,0.0002928980528651117,154.05260190934933,COMPLETE
1650,0.5295764207839966,2023-09-05 15:36:33.140575,2023-09-05 15:36:35.071181,0 days 00:00:01.930606,Leaky,Sigmoid,,,44,8,1.0,,,0.0018395225790287,2,367,0.7995146924833211,4.528815177767455e-05,141.84206754244292,COMPLETE
1651,0.38625332713127136,2023-09-05 15:36:35.071625,2023-09-05 15:36:40.269688,0 days 00:00:05.198063,ReLU,ReLU,,,47,6,16.0,,,0.00023595162951295422,2,348,0.41535555938391117,0.0001657743112021712,116.15324283468313,COMPLETE
1652,0.6876447796821594,2023-09-05 15:36:40.270143,2023-09-05 15:36:41.793824,0 days 00:00:01.523681,ReLU,ReLU,,,51,15,12.0,,,2.3172742111649582e-05,2,101,0.43629867587483845,0.0009083163669624262,130.7651393625996,COMPLETE
1653,0.3619799315929413,2023-09-05 15:36:41.794262,2023-09-05 15:36:52.733196,0 days 00:00:10.938934,Leaky,Tanh,,,39,17,14.0,,,7.375185116311798e-05,2,412,0.6647046082210074,0.00036178980015498643,120.56509593852515,COMPLETE
1654,0.41054266691207886,2023-09-05 15:36:52.733628,2023-09-05 15:36:53.031944,0 days 00:00:00.298316,ReLU,ReLU,,,36,16,13.0,,,0.013424685395634666,2,389,0.215968022412713,0.0015297556774894288,203.77070756392047,COMPLETE
1655,0.3849479556083679,2023-09-05 15:36:53.032377,2023-09-05 15:36:56.464395,0 days 00:00:03.432018,ReLU,ReLU,,,42,14,15.0,,,0.0001667640729315923,2,341,0.25143411177830716,0.0004415389908096692,177.37994436224884,COMPLETE
1656,0.35232800245285034,2023-09-05 15:36:56.464836,2023-09-05 15:37:03.203566,0 days 00:00:06.738730,Leaky,ReLU,,,48,9,13.0,,,0.0002903989495263733,2,375,0.7683724141328809,1.3304595131559202e-05,110.41085202086205,COMPLETE
1657,0.3665975034236908,2023-09-05 15:37:03.204033,2023-09-05 15:37:04.707823,0 days 00:00:01.503790,Tanh,Tanh,,,77,15,12.0,,,0.0012891233236923204,2,404,0.3324579906059251,5.925702452385487e-05,111.00721618456718,COMPLETE
1658,0.41107767820358276,2023-09-05 15:37:04.708256,2023-09-05 15:37:05.903607,0 days 00:00:01.195351,ReLU,ReLU,,,55,16,17.0,,,0.0006804163002140414,2,353,0.19866437827942354,0.004369107566424439,131.239912077438,COMPLETE
1659,0.5108588933944702,2023-09-05 15:37:05.904051,2023-09-05 15:37:08.978686,0 days 00:00:03.074635,ReLU,ReLU,,,45,13,14.0,,,6.972662388118321e-05,2,211,0.39570027874211117,0.00022816421626105577,161.0989232718662,COMPLETE
1660,0.3306127190589905,2023-09-05 15:37:08.979121,2023-09-05 15:37:10.926371,0 days 00:00:01.947250,Leaky,ReLU,,,53,22,15.0,,,0.0016525532176458531,2,361,0.7036474080557794,0.0005758310365549764,108.184837433229,COMPLETE
1661,0.4656504690647125,2023-09-05 15:37:10.926803,2023-09-05 15:37:13.403887,0 days 00:00:02.477084,ReLU,Tanh,,,38,15,14.0,,,0.0001283030418975146,2,384,0.13998641894604913,0.0003215381826394924,198.95334321260452,COMPLETE
1662,0.3883722126483917,2023-09-05 15:37:13.404330,2023-09-05 15:37:16.073818,0 days 00:00:02.669488,ReLU,ReLU,,,46,14,16.0,,,0.00039675568417408305,2,322,0.2772883814824529,0.0001332859801033681,143.33892533910557,COMPLETE
1663,0.3742406964302063,2023-09-05 15:37:16.074254,2023-09-05 15:37:17.538834,0 days 00:00:01.464580,Leaky,Sigmoid,,,49,19,13.0,,,0.008193462829639083,2,243,0.7453954485070251,1.0150373319915043e-05,118.26259895607278,COMPLETE
1664,0.394603967666626,2023-09-05 15:37:17.539277,2023-09-05 15:37:19.147241,0 days 00:00:01.607964,ReLU,ReLU,,,43,14,12.0,,,0.00099347334674327,2,337,0.3626218686339911,3.744308105336243e-05,179.33609562426543,COMPLETE
1665,0.41372188925743103,2023-09-05 15:37:19.147686,2023-09-05 15:37:20.455839,0 days 00:00:01.308153,ReLU,ReLU,,,41,16,11.0,,,0.0008494873570658522,2,398,0.20949232570504417,0.00663377807323334,294.28721059511787,COMPLETE
1666,0.37439173460006714,2023-09-05 15:37:20.456279,2023-09-05 15:37:23.847911,0 days 00:00:03.391632,Leaky,Tanh,,,57,15,9.0,,,0.000518290584014253,2,366,0.549295431498255,0.0026652120430818754,119.67089642364967,COMPLETE
1667,0.3166610896587372,2023-09-05 15:37:23.848361,2023-09-05 15:37:25.373168,0 days 00:00:01.524807,ReLU,ReLU,,,50,16,18.0,,,0.0019724019241333635,2,350,0.7703051219271192,0.0012841565474617218,124.18468788691929,COMPLETE
1668,0.39638635516166687,2023-09-05 15:37:25.373635,2023-09-05 15:37:26.691064,0 days 00:00:01.317429,ReLU,ReLU,,,36,9,14.0,,,0.006703687140573547,2,375,0.6015731235793452,0.0007016992644232494,3420.400380452474,COMPLETE
1669,0.3643473982810974,2023-09-05 15:37:26.691497,2023-09-05 15:37:28.276163,0 days 00:00:01.584666,Leaky,ReLU,,,47,17,15.0,,,0.000726485277662085,2,331,0.4968454899963054,0.000459798070708205,115.72396314711798,COMPLETE
1670,0.5171791911125183,2023-09-05 15:37:28.276605,2023-09-05 15:37:32.354208,0 days 00:00:04.077603,ReLU,ReLU,,,40,8,14.0,,,8.201962584741605e-05,2,343,0.2975132062752692,0.00025097917050425413,211.63580566940084,COMPLETE
1671,0.385273814201355,2023-09-05 15:37:32.354646,2023-09-05 15:37:33.792692,0 days 00:00:01.438046,ReLU,Tanh,,,52,15,16.0,,,0.0014597492446917456,2,356,0.637548814326878,0.00383112159359195,136.1601534329928,COMPLETE
1672,0.36022597551345825,2023-09-05 15:37:33.793151,2023-09-05 15:37:37.258602,0 days 00:00:03.465451,Sigmoid,ReLU,,,44,14,13.0,,,0.0024259309771106066,2,365,0.6860158735946037,0.0010828568597871838,121.41498997414759,COMPLETE
1673,0.34405091404914856,2023-09-05 15:37:37.259057,2023-09-05 15:37:38.574562,0 days 00:00:01.315505,Leaky,ReLU,,,78,15,12.0,,,0.002041720962237117,2,414,0.7333793717756318,0.0003825827156407188,124.6293990861124,COMPLETE
1674,0.41036444902420044,2023-09-05 15:37:38.575002,2023-09-05 15:37:39.494831,0 days 00:00:00.919829,ReLU,ReLU,,,46,13,15.0,,,0.0012196505746337424,2,386,0.11789188850521741,7.898678626253851e-05,119.23534930528268,COMPLETE
1675,0.40567201375961304,2023-09-05 15:37:39.495284,2023-09-05 15:37:42.842535,0 days 00:00:03.347251,ReLU,Tanh,,,49,18,17.0,,,0.00019202491018339057,2,345,0.27196249345595314,0.0001104461726141794,123.8223315252774,COMPLETE
1676,0.4151533246040344,2023-09-05 15:37:42.842982,2023-09-05 15:37:43.567672,0 days 00:00:00.724690,Leaky,Sigmoid,,,38,16,13.0,,,0.07099733382755528,2,259,0.7469905016500997,0.0008807707518389744,169.18119412376768,COMPLETE
1677,0.3556579351425171,2023-09-05 15:37:43.568112,2023-09-05 15:37:53.462550,0 days 00:00:09.894438,ReLU,ReLU,,,43,12,15.0,,,0.00016640565915387547,2,374,0.7127622378414675,1.4564633002094563e-05,137.7923555833133,COMPLETE
1678,0.35738733410835266,2023-09-05 15:37:53.463000,2023-09-05 15:37:56.870142,0 days 00:00:03.407142,Tanh,ReLU,,,51,16,14.0,,,0.0005912823887422704,2,462,0.7715599487716871,0.001818352175040908,177.16200978519353,COMPLETE
1679,0.3964245021343231,2023-09-05 15:37:56.870596,2023-09-05 15:37:57.380888,0 days 00:00:00.510292,ReLU,ReLU,,,48,14,15.0,,,0.006114982243182999,2,356,0.22918809756419273,0.00018022746974233935,282.43653927209243,COMPLETE
1680,0.42012715339660645,2023-09-05 15:37:57.381319,2023-09-05 15:37:57.967936,0 days 00:00:00.586617,Leaky,Tanh,,,98,17,14.0,,,0.0010325662696032225,2,396,0.12854809661183988,0.00028687445941238206,221.38477113785282,COMPLETE
1681,0.37056320905685425,2023-09-05 15:37:57.968378,2023-09-05 15:38:02.584948,0 days 00:00:04.616570,ReLU,ReLU,,,54,5,12.0,,,0.00040241516478916055,2,333,0.45583161513427223,1.1958745601143556e-05,137.9624292598748,COMPLETE
1682,0.4234297573566437,2023-09-05 15:38:02.585388,2023-09-05 15:38:03.857300,0 days 00:00:01.271912,ReLU,ReLU,,,41,15,13.0,,,0.027626260246481564,2,403,0.6746911869689559,0.023424561624771172,120.08513973070228,COMPLETE
1683,0.40331581234931946,2023-09-05 15:38:03.857745,2023-09-05 15:38:14.296890,0 days 00:00:10.439145,Leaky,ReLU,,,46,11,8.0,,,0.0001099666228635273,2,368,0.7982176129229082,0.003192424886270265,113.66648412787396,COMPLETE
1684,0.571639358997345,2023-09-05 15:38:14.297345,2023-09-05 15:38:15.308927,0 days 00:00:01.011582,ReLU,Tanh,,,35,1,11.0,,,0.01833176372083822,2,117,0.7298067376975313,0.004976161784311017,157.73106129964194,COMPLETE
1685,0.43003401160240173,2023-09-05 15:38:15.309359,2023-09-05 15:38:16.069696,0 days 00:00:00.760337,ReLU,ReLU,,,56,15,14.0,,,0.002745547339552247,2,353,0.23643773227365944,0.002175672188582643,175.97647197594804,COMPLETE
1686,0.3411494195461273,2023-09-05 15:38:16.070134,2023-09-05 15:38:18.268027,0 days 00:00:02.197893,Leaky,ReLU,,,39,14,16.0,,,0.0016348918262410453,2,340,0.5389083168892126,0.0006106586314934176,185.65756194124518,COMPLETE
1687,0.5115014314651489,2023-09-05 15:38:18.268478,2023-09-05 15:38:18.503184,0 days 00:00:00.234706,ReLU,ReLU,,,44,7,13.0,,,0.052160033171281955,2,384,0.2220480398467568,3.536018255839925e-05,132.6857738494873,COMPLETE
1688,0.4011940360069275,2023-09-05 15:38:18.503642,2023-09-05 15:38:22.201982,0 days 00:00:03.698340,ReLU,ReLU,,,50,13,12.0,,,0.0008199362756059263,2,177,0.7725051793440699,0.00048081467375588657,113.31755044725206,COMPLETE
1689,0.3497180938720703,2023-09-05 15:38:22.202417,2023-09-05 15:38:24.123928,0 days 00:00:01.921511,Leaky,Tanh,,,36,16,15.0,,,0.0022437715291873874,2,365,0.7998317627263418,0.0003467260407626748,105.78725362707067,COMPLETE
1690,0.36002546548843384,2023-09-05 15:38:24.124369,2023-09-05 15:38:27.464037,0 days 00:00:03.339668,ReLU,Sigmoid,,,47,17,14.0,,,0.00047987254765787185,2,321,0.317611953620378,8.34564170756924e-05,124.92349127407732,COMPLETE
1691,0.41363051533699036,2023-09-05 15:38:27.464486,2023-09-05 15:38:32.288334,0 days 00:00:04.823848,ReLU,ReLU,,,42,6,13.0,,,0.00029872241231462723,2,348,0.571099640411818,0.0002043345666650652,162.19542112306917,COMPLETE
1692,0.36752480268478394,2023-09-05 15:38:32.288771,2023-09-05 15:38:32.761634,0 days 00:00:00.472863,Leaky,ReLU,,,81,15,14.0,,,0.010050948345678865,2,288,0.7002261146510517,1.000199772703239e-05,134.1178207397461,COMPLETE
1693,0.3306344747543335,2023-09-05 15:38:32.762099,2023-09-05 15:38:35.926272,0 days 00:00:03.164173,ReLU,ReLU,,,52,4,15.0,,,0.0013567621747527926,2,376,0.7444697967966909,0.0003991741087616095,127.32566651564377,COMPLETE
1694,0.4824316203594208,2023-09-05 15:38:35.926713,2023-09-05 15:38:36.878728,0 days 00:00:00.952015,ReLU,Tanh,Sigmoid,Sigmoid,49,22,11.0,22.0,3.0,0.014678866038762195,4,360,0.667808647912899,0.0007748986593189722,139.53942701551648,COMPLETE
1695,0.5365111231803894,2023-09-05 15:38:36.879204,2023-09-05 15:38:44.605289,0 days 00:00:07.726085,Leaky,ReLU,,,45,14,12.0,,,1.0289120431343233e-05,2,410,0.5211488423566396,0.00015494661849325514,122.71724898175495,COMPLETE
1696,0.3950512409210205,2023-09-05 15:38:44.605726,2023-09-05 15:38:45.218163,0 days 00:00:00.612437,ReLU,ReLU,,,58,20,13.0,,,0.002815400332203378,2,331,0.2640122200749796,5.449204663123878e-05,177.08928775787354,COMPLETE
1697,0.6482753753662109,2023-09-05 15:38:45.218611,2023-09-05 15:38:45.515958,0 days 00:00:00.297347,Sigmoid,ReLU,,,38,15,16.0,,,0.0017884309989886981,2,343,0.1618450994941301,0.09080337081895283,557.4070355645541,COMPLETE
1698,0.40695056319236755,2023-09-05 15:38:45.516408,2023-09-05 15:38:46.529775,0 days 00:00:01.013367,ReLU,Tanh,,,54,16,10.0,,,0.0006493471622818844,2,233,0.11823140116581068,0.011134066400634518,154.94768838514074,COMPLETE
1699,0.48245003819465637,2023-09-05 15:38:46.530208,2023-09-05 15:38:53.647608,0 days 00:00:07.117400,Leaky,ReLU,,,78,8,7.0,,,6.567966584382542e-05,2,394,0.724749295023024,0.0014958431023428041,338.5119914718086,COMPLETE
1700,0.5526812076568604,2023-09-05 15:38:53.648059,2023-09-05 15:38:55.418154,0 days 00:00:01.770095,ReLU,ReLU,,,48,15,14.0,,,5.833847772829966e-05,2,382,0.12264777702337279,0.00025255681563541817,141.11639689899863,COMPLETE
1701,0.4607464671134949,2023-09-05 15:38:55.418597,2023-09-05 15:38:56.131066,0 days 00:00:00.712469,ReLU,Sigmoid,,,41,10,15.0,,,0.005724810425015408,2,357,0.19566501335334624,0.0011621209968349126,138.40252873926988,COMPLETE
1702,0.3887077569961548,2023-09-05 15:38:56.131499,2023-09-05 15:38:56.702272,0 days 00:00:00.570773,Tanh,ReLU,,,59,17,13.0,,,0.008655582274746419,2,369,0.42504844043353757,0.0059964650033429556,241.37604378365182,COMPLETE
1703,0.3805863559246063,2023-09-05 15:38:56.702719,2023-09-05 15:39:03.829596,0 days 00:00:07.126877,Leaky,,,,35,16,,,,0.00025121708909568534,1,354,0.6417701063646546,0.01876183747643759,134.48273881374868,COMPLETE
1704,0.3817026913166046,2023-09-05 15:39:03.830032,2023-09-05 15:39:06.846367,0 days 00:00:03.016335,ReLU,Tanh,,,43,15,12.0,,,0.001083035969049348,2,420,0.771189555693849,1.4948536667125336e-05,109.65005626493287,COMPLETE
1705,0.36182400584220886,2023-09-05 15:39:06.846813,2023-09-05 15:39:07.761487,0 days 00:00:00.914674,ReLU,ReLU,,,52,14,15.0,,,0.0023078940584624562,2,196,0.6954501543030833,0.0003063442511405495,114.04030196731155,COMPLETE
1706,0.34667953848838806,2023-09-05 15:39:07.761960,2023-09-05 15:39:09.913985,0 days 00:00:02.152025,Leaky,ReLU,,,46,16,14.0,,,0.0034302289585942843,2,390,0.7538570602584757,0.0024871733722095766,114.35870509952694,COMPLETE
1707,0.3042084872722626,2023-09-05 15:39:09.914433,2023-09-05 15:39:13.842469,0 days 00:00:03.928036,ReLU,ReLU,,,37,9,15.0,,,0.0008312830794848004,2,338,0.616291572038526,0.0005357722379066577,104.2728964612375,COMPLETE
1708,0.4327332675457001,2023-09-05 15:39:13.842925,2023-09-05 15:39:24.807128,0 days 00:00:10.964203,ReLU,ReLU,,,34,9,15.0,,,4.065835072055483e-05,2,406,0.6103645920296048,0.0006022767941239078,126.5107955556785,COMPLETE
1709,0.34711962938308716,2023-09-05 15:39:24.807575,2023-09-05 15:39:30.097592,0 days 00:00:05.290017,ReLU,ReLU,,,36,8,15.0,,,0.0007997635367557005,2,377,0.6302862561686836,0.0005133416666540609,121.9920662513146,COMPLETE
1710,0.42513301968574524,2023-09-05 15:39:30.098066,2023-09-05 15:39:30.818172,0 days 00:00:00.720106,ReLU,ReLU,,,35,9,14.0,,,0.04068140643462073,2,362,0.6492513148170881,0.0006266907087110366,200.53879963267934,COMPLETE
1711,0.5064108967781067,2023-09-05 15:39:30.818645,2023-09-05 15:39:39.475186,0 days 00:00:08.656541,ReLU,ReLU,,,37,9,15.0,,,1.434844855379961e-05,2,339,0.6119072861885655,0.0006944231032710809,132.89470800889276,COMPLETE
1712,0.369961142539978,2023-09-05 15:39:39.475642,2023-09-05 15:39:40.925463,0 days 00:00:01.449821,ReLU,ReLU,,,34,9,14.0,,,0.0007150775057017479,2,349,0.11004407626660928,0.0004532774522769709,225.62766217292472,COMPLETE
1713,0.4520713984966278,2023-09-05 15:39:40.925907,2023-09-05 15:39:42.706788,0 days 00:00:01.780881,ReLU,ReLU,,,37,8,15.0,,,0.0009217860694790126,2,394,0.1905218034156663,0.00406214561338674,176.99543497148255,COMPLETE
1714,0.37861204147338867,2023-09-05 15:39:42.707229,2023-09-05 15:39:43.992716,0 days 00:00:01.285487,ReLU,ReLU,,,35,9,14.0,,,0.0042060337635828875,2,370,0.5900472182938508,0.0006087300084187267,133.78509044647217,COMPLETE
1715,0.44156399369239807,2023-09-05 15:39:43.993165,2023-09-05 15:39:47.038114,0 days 00:00:03.044949,ReLU,ReLU,,,50,8,15.0,,,0.000603000144894963,2,214,0.6525026558660122,0.0008216449817505782,134.24504495174327,COMPLETE
1716,0.40017038583755493,2023-09-05 15:39:47.038550,2023-09-05 15:39:47.554658,0 days 00:00:00.516108,ReLU,ReLU,,,48,9,15.0,,,0.007046491545435102,2,469,0.6303893004335369,0.0005083512479752226,164.2994155883789,COMPLETE
1717,0.3665369749069214,2023-09-05 15:39:47.555094,2023-09-05 15:39:48.172676,0 days 00:00:00.617582,ReLU,ReLU,,,35,8,14.0,,,0.002990487740654084,2,222,0.4762197336658795,0.0005293150853448234,149.57422608595627,COMPLETE
1718,0.36870652437210083,2023-09-05 15:39:48.173123,2023-09-05 15:39:48.899046,0 days 00:00:00.725923,ReLU,ReLU,,,38,8,15.0,,,0.01103921313710533,2,401,0.6589752952375353,0.0006740879716278968,168.8311595916748,COMPLETE
1719,0.3475613594055176,2023-09-05 15:39:48.899485,2023-09-05 15:39:52.404214,0 days 00:00:03.504729,ReLU,ReLU,,,37,10,14.0,,,0.0009721409770343593,2,417,0.6024540997068983,0.003542215204153333,134.39018581935338,COMPLETE
1720,0.38946250081062317,2023-09-05 15:39:52.404654,2023-09-05 15:39:55.141662,0 days 00:00:02.737008,ReLU,ReLU,,,51,8,14.0,,,0.0007684328385256419,2,346,0.6785833940881576,0.0004140290039608509,377.5809346020706,COMPLETE
1721,0.40377721190452576,2023-09-05 15:39:55.142099,2023-09-05 15:39:56.022668,0 days 00:00:00.880569,ReLU,ReLU,,,33,9,13.0,,,0.005332263122159889,2,384,0.4099469152280351,0.0007555281736629702,186.4671357620594,COMPLETE
1722,0.3889567255973816,2023-09-05 15:39:56.023106,2023-09-05 15:39:56.822666,0 days 00:00:00.799560,ReLU,ReLU,,,53,9,15.0,,,0.0024816761588159248,2,359,0.5850679188381046,0.0005014174090483308,193.01388750578226,COMPLETE
1723,0.4863271117210388,2023-09-05 15:39:56.823117,2023-09-05 15:40:04.594625,0 days 00:00:07.771508,ReLU,ReLU,,,56,10,13.0,,,2.5637233695525783e-05,2,368,0.6876448341524153,0.005175848891994401,126.68509317480999,COMPLETE
1724,0.36285632848739624,2023-09-05 15:40:04.595101,2023-09-05 15:40:05.292309,0 days 00:00:00.697208,ReLU,ReLU,,,49,8,14.0,,,0.0031932916571926506,2,350,0.5552092979567732,0.00039753034587841927,126.76280235521722,COMPLETE
1725,0.3868130147457123,2023-09-05 15:40:05.292777,2023-09-05 15:40:05.565964,0 days 00:00:00.273187,ReLU,ReLU,,,47,9,12.0,,,0.031549166166707665,2,338,0.18789385516787876,0.003020391987530337,126.41860737520106,COMPLETE
1726,0.40011247992515564,2023-09-05 15:40:05.566428,2023-09-05 15:40:07.316153,0 days 00:00:01.749725,ReLU,ReLU,,,37,10,15.0,,,0.0012201966174628682,2,376,0.4870172890003382,0.000915907023443195,152.36378763957197,COMPLETE
1727,0.45587876439094543,2023-09-05 15:40:07.316613,2023-09-05 15:40:08.064164,0 days 00:00:00.747551,ReLU,ReLU,,,77,8,13.0,,,0.0018821215387499722,2,414,0.17197242797284232,0.000347183241204782,132.66779716865167,COMPLETE
1728,0.346728652715683,2023-09-05 15:40:08.064625,2023-09-05 15:40:09.515246,0 days 00:00:01.450621,ReLU,ReLU,,,52,8,11.0,,,0.0041938951977683004,2,359,0.6319004738952793,0.0005581238488353264,106.11320210926569,COMPLETE
1729,0.4587510824203491,2023-09-05 15:40:09.515720,2023-09-05 15:40:10.465265,0 days 00:00:00.949545,ReLU,ReLU,,,80,9,13.0,,,0.0008871622785380531,2,388,0.2064296375911951,0.00043318328402987434,152.1002696218666,COMPLETE
1730,0.4072319269180298,2023-09-05 15:40:10.465718,2023-09-05 15:40:11.107385,0 days 00:00:00.641667,ReLU,ReLU,,,50,7,14.0,,,0.012867260177564665,2,334,0.3023559472284304,0.004729130369629454,192.5514048823604,COMPLETE
1731,0.4380630552768707,2023-09-05 15:40:11.107827,2023-09-05 15:40:11.857098,0 days 00:00:00.749271,ReLU,ReLU,,,35,9,12.0,,,0.0014548078555659952,2,325,0.14486287948320725,0.003948144192855613,161.35691826088916,COMPLETE
1732,0.34667208790779114,2023-09-05 15:40:11.857543,2023-09-05 15:40:13.166380,0 days 00:00:01.308837,ReLU,ReLU,,,55,8,15.0,,,0.002289582713121296,2,347,0.44342567605418115,0.007078564448147361,135.1766044616699,COMPLETE
1733,0.38524019718170166,2023-09-05 15:40:13.166827,2023-09-05 15:40:13.635354,0 days 00:00:00.468527,ReLU,ReLU,,,47,18,15.0,,,0.003403127236981878,2,405,0.18134901104711565,0.0007155064442242763,114.88607392992292,COMPLETE
1734,0.37162578105926514,2023-09-05 15:40:13.635817,2023-09-05 15:40:14.311066,0 days 00:00:00.675249,ReLU,ReLU,,,45,9,14.0,,,0.020185036453201174,2,364,0.5026222620470359,0.0003331988278491001,201.80083847045898,COMPLETE
1735,0.3683689534664154,2023-09-05 15:40:14.311526,2023-09-05 15:40:15.215016,0 days 00:00:00.903490,ReLU,ReLU,,,59,7,10.0,,,0.0078526570209658,2,381,0.5718893630334547,0.009155671420689855,116.95716452091298,COMPLETE
1736,0.45453718304634094,2023-09-05 15:40:15.215462,2023-09-05 15:40:15.905148,0 days 00:00:00.689686,ReLU,ReLU,,,39,10,14.0,,,0.0005643607434603509,2,58,0.2552692734801596,0.0002771628208672222,146.44086916693325,COMPLETE
1737,0.3554060459136963,2023-09-05 15:40:15.905617,2023-09-05 15:40:17.519421,0 days 00:00:01.613804,ReLU,ReLU,,,36,10,12.0,,,0.002750766776354828,2,341,0.706652020080782,0.0004722949076167759,114.30299450800969,COMPLETE
1738,0.3676679730415344,2023-09-05 15:40:17.519879,2023-09-05 15:40:22.571180,0 days 00:00:05.051301,ReLU,ReLU,,,49,8,13.0,,,0.000682085904278628,2,373,0.6628312376239662,0.0005835231243499665,100.3354479128176,COMPLETE
1739,0.3362451493740082,2023-09-05 15:40:22.571627,2023-09-05 15:40:24.668978,0 days 00:00:02.097351,ReLU,ReLU,,,34,7,14.0,,,0.0011534709975889032,2,351,0.5255294705246889,0.0034075263577478974,117.66320549358021,COMPLETE
1740,0.6389139294624329,2023-09-05 15:40:24.669419,2023-09-05 15:40:29.319409,0 days 00:00:04.649990,ReLU,ReLU,,,54,8,11.0,,,1.3692922372687206e-05,2,397,0.3719064943263726,1.8575966520255097e-05,104.17962002694156,COMPLETE
1741,0.42215943336486816,2023-09-05 15:40:29.319854,2023-09-05 15:40:30.099215,0 days 00:00:00.779361,ReLU,ReLU,,,86,9,15.0,,,0.0019412427863807575,2,319,0.21439614771780946,1.2039597243880932e-05,164.62356555823123,COMPLETE
