number,value,datetime_start,datetime_complete,duration,params_activation1,params_activation2,params_activation3,params_activation4,params_batch_size,params_fl1,params_fl2,params_fl3,params_fl4,params_learning_rate,params_n_layers,params_num_epochs,params_train_size,params_weight_decay,user_attrs_mre,state
675,0.4109993278980255,2023-09-05 14:57:32.630783,2023-09-05 14:57:41.458895,0 days 00:00:08.828112,ReLU,ReLU,,,67,7,8.0,,,0.00015039023536711802,2,428,0.7417320975145786,0.01594495847471721,141.2109067863393,COMPLETE
676,0.4118525981903076,2023-09-05 14:57:41.459230,2023-09-05 14:57:41.973286,0 days 00:00:00.514056,ReLU,ReLU,,,61,13,16.0,,,0.0012609006612129242,2,300,0.10823229267554536,0.004002968760479216,123.55672802142243,COMPLETE
677,0.39788833260536194,2023-09-05 14:57:41.973618,2023-09-05 14:57:44.535676,0 days 00:00:02.562058,ReLU,ReLU,,,35,14,13.0,,,0.0022413873839249227,2,354,0.6725432654247879,0.0006353044323591256,152.01500398566924,COMPLETE
678,0.39362436532974243,2023-09-05 14:57:44.536011,2023-09-05 14:57:45.149096,0 days 00:00:00.613085,Leaky,ReLU,,,57,17,12.0,,,0.014022087942919662,2,191,0.6240882035033628,0.0050971022439172,149.17075658727575,COMPLETE
679,0.3537500202655792,2023-09-05 14:57:45.149431,2023-09-05 14:57:47.441935,0 days 00:00:02.292504,ReLU,Leaky,Tanh,,65,8,14.0,14.0,,0.0011108924281625608,3,449,0.7084297383891246,0.00019233666477546396,132.36028429256973,COMPLETE
680,0.38109710812568665,2023-09-05 14:57:47.442302,2023-09-05 14:57:48.871145,0 days 00:00:01.428843,ReLU,ReLU,,,46,23,15.0,,,0.0008305312287549178,2,340,0.7730342706164162,0.0002988485028271187,147.46567376454672,COMPLETE
681,0.6029481887817383,2023-09-05 14:57:48.871502,2023-09-05 14:57:51.118864,0 days 00:00:02.247362,ReLU,Sigmoid,,,37,22,13.0,,,0.00042894648747773557,2,327,0.6467725797581515,0.06958164208798599,127.03130198160807,COMPLETE
682,0.3359003961086273,2023-09-05 14:57:51.119209,2023-09-05 14:57:54.452969,0 days 00:00:03.333760,ReLU,ReLU,,,41,24,15.0,,,0.0005337495480705743,2,365,0.7353834048196501,0.0004505473536422195,105.50528069904873,COMPLETE
683,0.325051486492157,2023-09-05 14:57:54.453321,2023-09-05 14:57:55.982881,0 days 00:00:01.529560,ReLU,ReLU,,,60,16,14.0,,,0.003104682321003384,2,349,0.6902014484713737,0.0014831307556661605,111.53297929360834,COMPLETE
684,0.3701811134815216,2023-09-05 14:57:55.983238,2023-09-05 14:57:56.991267,0 days 00:00:01.008029,Sigmoid,Tanh,,,32,24,16.0,,,0.0402000252383953,2,313,0.5451207144066417,0.00013182912268091428,147.20856602986655,COMPLETE
685,0.3700251579284668,2023-09-05 14:57:56.991631,2023-09-05 14:57:59.439603,0 days 00:00:02.447972,ReLU,ReLU,,,63,19,12.0,,,0.0006961452995704793,2,289,0.4199435052402432,0.006281766159114576,111.77336008172286,COMPLETE
686,0.3838639259338379,2023-09-05 14:57:59.439950,2023-09-05 14:57:59.737440,0 days 00:00:00.297490,ReLU,ReLU,,,70,20,13.0,,,0.009517271254148063,2,335,0.22941929606969244,0.0018093519160438292,143.0535168117947,COMPLETE
687,0.5765928626060486,2023-09-05 14:57:59.737791,2023-09-05 14:58:03.242316,0 days 00:00:03.504525,Leaky,Leaky,,,44,12,14.0,,,3.812866002786445e-05,2,320,0.2786945388126221,0.00023748369062987778,168.63662428855895,COMPLETE
688,0.3418647348880768,2023-09-05 14:58:03.242683,2023-09-05 14:58:04.962826,0 days 00:00:01.720143,ReLU,ReLU,,,66,14,15.0,,,0.001355302114753732,2,356,0.7512732255671559,0.002364666738596559,125.84947947966747,COMPLETE
689,0.4146052598953247,2023-09-05 14:58:04.963173,2023-09-05 14:58:08.278095,0 days 00:00:03.314922,ReLU,ReLU,,,68,23,16.0,,,0.00010809245303001565,2,344,0.32399258573015255,0.001141564287570289,162.38320348429124,COMPLETE
690,0.3975125253200531,2023-09-05 14:58:08.278457,2023-09-05 14:58:12.122209,0 days 00:00:03.843752,ReLU,ReLU,,,48,6,11.0,,,0.0009727868443127321,2,458,0.4525503578651042,0.008186314914792586,224.04678833536255,COMPLETE
691,0.32511836290359497,2023-09-05 14:58:12.122564,2023-09-05 14:58:13.630078,0 days 00:00:01.507514,ReLU,ReLU,ReLU,,38,15,17.0,11.0,,0.0018116577502180213,3,370,0.7195678048155255,0.0007869469882766428,114.71117267608642,COMPLETE
692,0.33968082070350647,2023-09-05 14:58:13.630466,2023-09-05 14:58:17.822993,0 days 00:00:04.192527,ReLU,ReLU,,,73,7,18.0,,,0.0003566953224460537,2,332,0.6674638240038082,0.0003738233147772357,122.56457157624074,COMPLETE
693,0.3914359211921692,2023-09-05 14:58:17.823342,2023-09-05 14:58:18.593676,0 days 00:00:00.770334,ReLU,Leaky,,,76,17,13.0,,,0.007250921999555227,2,387,0.3102545781244572,0.0033269793897649827,572.9754487879136,COMPLETE
694,0.40576088428497314,2023-09-05 14:58:18.594026,2023-09-05 14:58:36.065117,0 days 00:00:17.471091,ReLU,ReLU,,,17,24,3.0,,,8.229133712101227e-05,2,356,0.5865159886028687,0.0005510824242606897,144.1559443741702,COMPLETE
695,0.34652620553970337,2023-09-05 14:58:36.065486,2023-09-05 14:58:42.164780,0 days 00:00:06.099294,Leaky,ReLU,,,64,8,14.0,,,0.0002698415974825573,2,410,0.7750465951030382,0.0045774909097090685,105.72124087062708,COMPLETE
696,0.4157789349555969,2023-09-05 14:58:42.165128,2023-09-05 14:58:43.418117,0 days 00:00:01.252989,Tanh,ReLU,,,26,18,12.0,,,0.031836253554797675,2,321,0.6943047331872434,1.2219179748938008e-05,173.09906768798828,COMPLETE
697,0.5524104833602905,2023-09-05 14:58:43.418469,2023-09-05 14:58:50.549522,0 days 00:00:07.131053,ReLU,Tanh,,,59,23,15.0,,,3.1722541509510754e-05,2,307,0.7446851582747663,2.2258674549920508e-05,253.98365818483433,COMPLETE
698,0.35276204347610474,2023-09-05 14:58:50.549892,2023-09-05 14:58:52.312998,0 days 00:00:01.763106,Sigmoid,ReLU,,,62,24,14.0,,,0.005118920327034526,2,340,0.3890148678743848,0.0002821338230795366,122.18892979815723,COMPLETE
699,0.41994062066078186,2023-09-05 14:58:52.313353,2023-09-05 14:58:53.636261,0 days 00:00:01.322908,ReLU,ReLU,,,42,21,13.0,,,0.0006062732931880018,2,328,0.14365261641563107,0.0001126960255821198,118.727328328253,COMPLETE
700,0.3730888366699219,2023-09-05 14:58:53.636659,2023-09-05 14:58:56.389274,0 days 00:00:02.752615,ReLU,Leaky,,,40,15,16.0,,,0.0004974615316205562,2,351,0.3488403501443061,0.0017711504847259321,109.86271359843593,COMPLETE
701,0.38229039311408997,2023-09-05 14:58:56.389643,2023-09-05 14:58:58.058377,0 days 00:00:01.668734,ReLU,ReLU,,,51,16,20.0,,,0.0015215926611219432,2,377,0.6097852175790583,0.0026828883187255148,234.43886345311216,COMPLETE
702,0.5323227643966675,2023-09-05 14:58:58.058747,2023-09-05 14:58:59.560036,0 days 00:00:01.501289,ReLU,ReLU,Leaky,Sigmoid,56,22,15.0,16.0,15.0,0.0007826430198527437,4,434,0.6353950517922109,0.0004213970714381676,146.9646510703891,COMPLETE
703,0.4673752188682556,2023-09-05 14:58:59.560406,2023-09-05 14:59:00.696445,0 days 00:00:01.136039,ReLU,ReLU,,,34,12,10.0,,,0.0011725094665677163,2,363,0.17027886347668714,0.0003396923670079533,134.6501841310595,COMPLETE
704,0.3934285342693329,2023-09-05 14:59:00.696792,2023-09-05 14:59:04.113902,0 days 00:00:03.417110,ReLU,ReLU,ReLU,,45,23,13.0,20.0,,0.00044336654749250944,3,346,0.7960777200171921,0.0193720127786621,120.57109541303656,COMPLETE
705,0.4017830491065979,2023-09-05 14:59:04.114254,2023-09-05 14:59:04.852703,0 days 00:00:00.738449,ReLU,ReLU,,,47,24,14.0,,,0.03298080470402836,2,336,0.7252236109325073,0.0006952357454231896,136.64060592651367,COMPLETE
706,0.4021746814250946,2023-09-05 14:59:04.853056,2023-09-05 14:59:05.723203,0 days 00:00:00.870147,Leaky,Sigmoid,,,72,14,11.0,,,0.0038199425092821705,2,321,0.43251765833615574,0.006454730068026338,180.99046082427537,COMPLETE
707,0.4475294351577759,2023-09-05 14:59:05.723545,2023-09-05 14:59:06.940542,0 days 00:00:01.216997,ReLU,ReLU,,,66,7,12.0,,,0.0009706372355189332,2,347,0.23865892835282243,0.001350165662195779,282.59743467388734,COMPLETE
708,0.655299723148346,2023-09-05 14:59:06.940880,2023-09-05 14:59:08.502001,0 days 00:00:01.561121,ReLU,Leaky,,,61,17,15.0,,,2.4164998758749323e-05,2,330,0.14367376575700053,0.003753379301284913,111.61497312603575,COMPLETE
709,0.3781416416168213,2023-09-05 14:59:08.502360,2023-09-05 14:59:13.483095,0 days 00:00:04.980735,ReLU,ReLU,,,64,7,14.0,,,0.0006784430665181451,2,312,0.665291612775118,0.010032817378715907,158.47436461337776,COMPLETE
710,0.3860817551612854,2023-09-05 14:59:13.483439,2023-09-05 14:59:15.712892,0 days 00:00:02.229453,ReLU,ReLU,,,43,9,13.0,,,0.0021585565035390428,2,300,0.7048497205051049,0.0009300909552435134,160.4381473820384,COMPLETE
711,0.5948757529258728,2023-09-05 14:59:15.713244,2023-09-05 14:59:18.241173,0 days 00:00:02.527929,ReLU,Tanh,,,58,5,15.0,,,0.0001449242163833546,2,358,0.21491092068478435,0.0023344899598256716,286.6781126480529,COMPLETE
712,0.4511716663837433,2023-09-05 14:59:18.241518,2023-09-05 14:59:25.684572,0 days 00:00:07.443054,Sigmoid,,,,69,13,,,,0.0005670118095565299,1,442,0.7575645251214375,0.0005290237550996665,167.99127474698153,COMPLETE
713,0.38470259308815,2023-09-05 14:59:25.684906,2023-09-05 14:59:27.302876,0 days 00:00:01.617970,ReLU,ReLU,,,63,23,12.0,,,0.0008670008152744261,2,473,0.47136918148572604,0.029933652092740414,115.48464497980082,COMPLETE
714,0.5602996349334717,2023-09-05 14:59:27.303220,2023-09-05 14:59:28.058708,0 days 00:00:00.755488,ReLU,ReLU,,,39,8,14.0,,,0.0014213431558804434,2,208,0.20629532358410232,0.08670157758699251,125.48963071093146,COMPLETE
715,0.39719709753990173,2023-09-05 14:59:28.059046,2023-09-05 14:59:28.961792,0 days 00:00:00.902746,Leaky,ReLU,,,29,24,16.0,,,0.010910798071026549,2,70,0.7723578316496345,1.4890351013787602e-05,141.99713171096076,COMPLETE
716,0.36063095927238464,2023-09-05 14:59:28.962138,2023-09-05 14:59:29.436331,0 days 00:00:00.474193,ReLU,Leaky,,,67,15,13.0,,,0.024868740798840192,2,339,0.5728187013468498,0.00018924072520429397,130.56873849722055,COMPLETE
717,0.6187106370925903,2023-09-05 14:59:29.436676,2023-09-05 14:59:32.470063,0 days 00:00:03.033387,ReLU,ReLU,Sigmoid,,61,1,14.0,8.0,,0.0011504936734906116,3,367,0.6883125415356742,0.007680878307254544,262.55693473815916,COMPLETE
718,0.3737243413925171,2023-09-05 14:59:32.470417,2023-09-05 14:59:36.976457,0 days 00:00:04.506040,ReLU,ReLU,,,45,23,15.0,,,0.0004901308633781265,2,319,0.5048835579686559,0.0020147299375010406,135.09040332550697,COMPLETE
719,0.38424310088157654,2023-09-05 14:59:36.976799,2023-09-05 14:59:40.347506,0 days 00:00:03.370707,ReLU,ReLU,,,65,24,17.0,,,0.00036078324531165716,2,345,0.7223900162346752,0.005546181754486328,110.8800305233726,COMPLETE
720,0.5223419666290283,2023-09-05 14:59:40.347872,2023-09-05 14:59:49.563466,0 days 00:00:09.215594,Tanh,ReLU,,,49,16,16.0,,,1.2555608932258532e-05,2,330,0.7993790173815757,0.00023692161944628047,131.1375200213808,COMPLETE
721,0.4387436807155609,2023-09-05 14:59:49.563818,2023-09-05 14:59:50.027120,0 days 00:00:00.463302,ReLU,ReLU,,,75,15,12.0,,,0.0028003315166039333,2,422,0.18308152382998558,0.0029769903686307692,138.67086994798876,COMPLETE
722,0.4221644103527069,2023-09-05 14:59:50.027471,2023-09-05 14:59:51.527585,0 days 00:00:01.500114,ReLU,Leaky,,,59,7,14.0,,,0.0007327118747216518,2,355,0.12130139834084858,0.0011030637811173531,153.02399249009684,COMPLETE
723,0.2854364216327667,2023-09-05 14:59:51.527932,2023-09-05 14:59:54.028315,0 days 00:00:02.500383,ReLU,ReLU,,,36,10,13.0,,,0.0018985886970308366,2,399,0.6462736687358446,0.00033785404244835896,119.09977776663644,COMPLETE
724,0.39652925729751587,2023-09-05 14:59:54.028657,2023-09-05 14:59:54.806530,0 days 00:00:00.777873,Leaky,ReLU,,,37,9,12.0,,,0.001846657519217928,2,397,0.1592771122127306,0.0002915987415847594,151.00715396715248,COMPLETE
725,0.420710951089859,2023-09-05 14:59:54.806879,2023-09-05 14:59:56.437464,0 days 00:00:01.630585,Sigmoid,ReLU,,,37,10,13.0,,,0.05297798448124781,2,377,0.5980327312295318,0.00040349001895439144,131.60653570142844,COMPLETE
726,0.3429127335548401,2023-09-05 14:59:56.437815,2023-09-05 14:59:59.332893,0 days 00:00:02.895078,ReLU,Tanh,,,35,10,13.0,,,0.0023418999665396133,2,412,0.6296160040862063,0.0003043860617889959,127.62214415100799,COMPLETE
727,0.3912905752658844,2023-09-05 14:59:59.333242,2023-09-05 15:00:01.401047,0 days 00:00:02.067805,ReLU,ReLU,,,36,9,13.0,,,0.0017019653475570564,2,387,0.6508284645937413,0.0003333810460817773,147.5772156185574,COMPLETE
728,0.35357025265693665,2023-09-05 15:00:01.401387,2023-09-05 15:00:03.213316,0 days 00:00:01.811929,ReLU,ReLU,,,32,11,11.0,,,0.0015698935567316878,2,421,0.6518357829514477,0.00037116062416800324,126.953842430784,COMPLETE
729,0.4144115447998047,2023-09-05 15:00:03.213662,2023-09-05 15:00:04.022465,0 days 00:00:00.808803,ReLU,ReLU,,,35,9,12.0,,,0.05489403207765919,2,432,0.6059762064289638,0.0002509269840478008,212.39690344674247,COMPLETE
730,0.4907538890838623,2023-09-05 15:00:04.022817,2023-09-05 15:00:05.021473,0 days 00:00:00.998656,ReLU,Leaky,Leaky,,33,9,12.0,9.0,,0.0020637720967397913,3,376,0.16258030268048046,0.0005110957347880401,245.57950798034668,COMPLETE
731,0.33732086420059204,2023-09-05 15:00:05.021830,2023-09-05 15:00:06.922462,0 days 00:00:01.900632,ReLU,ReLU,,,38,10,11.0,,,0.0013433322770292958,2,404,0.6790360547918474,0.0004618406012718494,119.85446629379734,COMPLETE
732,0.39431360363960266,2023-09-05 15:00:06.922803,2023-09-05 15:00:10.714290,0 days 00:00:03.791487,ReLU,Sigmoid,,,55,10,1.0,,,0.0010951433625963018,2,365,0.3623450051275271,0.001662886981464002,166.9107724428177,COMPLETE
733,0.36630979180336,2023-09-05 15:00:10.714634,2023-09-05 15:00:11.702142,0 days 00:00:00.987508,Leaky,ReLU,,,40,12,13.0,,,0.0015484973691393324,2,402,0.30074080327433184,0.0005888272843400134,232.84620867277445,COMPLETE
734,0.5236493349075317,2023-09-05 15:00:11.702482,2023-09-05 15:00:13.411686,0 days 00:00:01.709204,ReLU,ReLU,,,41,8,13.0,,,0.0024963730329673967,2,387,0.5614793157223763,0.050954806203265965,187.72933562814373,COMPLETE
735,0.38346558809280396,2023-09-05 15:00:13.412036,2023-09-05 15:00:15.557739,0 days 00:00:02.145703,ReLU,ReLU,,,38,9,12.0,,,0.000870795935139709,2,444,0.2925684960043025,0.0004221086944520856,122.70404806644959,COMPLETE
736,0.6446202993392944,2023-09-05 15:00:15.558112,2023-09-05 15:00:20.805235,0 days 00:00:05.247123,ReLU,ReLU,,,33,8,10.0,,,1.4486724385897303e-05,2,412,0.26403516002151256,0.03303406622660214,119.79629586969764,COMPLETE
737,0.4044400155544281,2023-09-05 15:00:20.805591,2023-09-05 15:00:21.325307,0 days 00:00:00.519716,ReLU,ReLU,,,43,13,16.0,,,0.04253653806924241,2,392,0.6465790536213858,0.0003336504690714291,293.0100900750411,COMPLETE
738,0.367875874042511,2023-09-05 15:00:21.325651,2023-09-05 15:00:32.281341,0 days 00:00:10.955690,Sigmoid,Leaky,,,36,11,13.0,,,0.00017964951708748873,2,370,0.6780024158674005,0.0002048460291181233,118.54626279263883,COMPLETE
739,0.487170934677124,2023-09-05 15:00:32.281692,2023-09-05 15:00:32.686754,0 days 00:00:00.405062,ReLU,Tanh,,,34,11,15.0,,,0.001860546853583473,2,455,0.11307983301206415,0.00026209412336743946,137.96480572412884,COMPLETE
740,0.3710715174674988,2023-09-05 15:00:32.687101,2023-09-05 15:00:33.697825,0 days 00:00:01.010724,ReLU,ReLU,Tanh,,53,8,12.0,10.0,,0.0012891140129974402,3,355,0.19562802747179284,0.00015174657486643467,585.4081270875049,COMPLETE
741,0.3532254099845886,2023-09-05 15:00:33.698188,2023-09-05 15:00:36.302413,0 days 00:00:02.604225,ReLU,ReLU,,,30,10,15.0,,,0.0006294165611256323,2,429,0.6290719208111647,0.0015007554076914174,127.87835552074291,COMPLETE
742,0.34599319100379944,2023-09-05 15:00:36.302764,2023-09-05 15:00:38.749346,0 days 00:00:02.446582,ReLU,ReLU,,,62,14,14.0,,,0.0010140473711191316,2,360,0.7475712568331437,0.0006658049623320899,99.72411745403885,COMPLETE
743,0.3805305063724518,2023-09-05 15:00:38.749688,2023-09-05 15:00:39.138080,0 days 00:00:00.388392,Leaky,ReLU,,,57,8,13.0,,,0.02269986654129263,2,381,0.7029236742340166,0.000831652545680244,130.02196400960287,COMPLETE
744,0.3995976746082306,2023-09-05 15:00:39.138420,2023-09-05 15:00:45.343917,0 days 00:00:06.205497,ReLU,Leaky,,,85,9,16.0,,,0.000111250881960514,2,348,0.7343165455315099,2.9298533954192398e-05,117.92543310406565,COMPLETE
745,0.3611454367637634,2023-09-05 15:00:45.344275,2023-09-05 15:00:48.644775,0 days 00:00:03.300500,Tanh,ReLU,,,24,22,17.0,,,0.0007694845601958496,2,146,0.3455184128856459,0.002280002400591825,107.89608257764006,COMPLETE
746,0.4206944406032562,2023-09-05 15:00:48.645145,2023-09-05 15:00:49.679207,0 days 00:00:01.034062,ReLU,ReLU,,,60,18,13.0,,,0.0005649981375321799,2,370,0.10002769765364795,0.0012219085423133798,115.8509407314003,COMPLETE
747,0.41420799493789673,2023-09-05 15:00:49.679565,2023-09-05 15:00:50.366344,0 days 00:00:00.686779,ReLU,ReLU,,,39,17,11.0,,,0.002866514128594615,2,397,0.16723701075729852,0.0027716249211099018,130.82930062831133,COMPLETE
748,0.402260422706604,2023-09-05 15:00:50.366694,2023-09-05 15:01:03.851889,0 days 00:00:13.485195,ReLU,ReLU,,,63,8,15.0,,,8.03230767773607e-05,2,341,0.7767922837066956,6.146686843673771e-05,131.49065622905832,COMPLETE
749,0.48072510957717896,2023-09-05 15:01:03.852240,2023-09-05 15:01:11.514054,0 days 00:00:07.661814,ReLU,ReLU,,,47,13,12.0,,,3.251238100643361e-05,2,353,0.6036353364748073,0.00046089550234326135,142.87230846631965,COMPLETE
750,0.37496641278266907,2023-09-05 15:01:11.514403,2023-09-05 15:01:14.090054,0 days 00:00:02.575651,ReLU,ReLU,,,44,10,16.0,,,0.0012082528595512597,2,360,0.6663857533303674,3.306408965739224e-05,150.22949824613684,COMPLETE
751,0.4331390857696533,2023-09-05 15:01:14.090417,2023-09-05 15:01:16.286450,0 days 00:00:02.196033,Sigmoid,Leaky,,,42,11,14.0,,,0.0020636247624286168,2,339,0.20002282695870358,0.0020019853600968733,180.94966227972685,COMPLETE
752,0.41140079498291016,2023-09-05 15:01:16.286790,2023-09-05 15:01:17.759679,0 days 00:00:01.472889,ReLU,Tanh,ReLU,,35,14,22.0,1.0,,0.0009374924321234275,3,353,0.2815878734699388,0.0002163271525066837,252.61846558944038,COMPLETE
753,0.3940833508968353,2023-09-05 15:01:17.760045,2023-09-05 15:01:18.726407,0 days 00:00:00.966362,Leaky,ReLU,,,60,15,15.0,,,0.03272881406748438,2,420,0.7033508017689841,0.013552692544727277,139.9761084623115,COMPLETE
754,0.3980259895324707,2023-09-05 15:01:18.726751,2023-09-05 15:01:18.889479,0 days 00:00:00.162728,ReLU,ReLU,,,83,7,13.0,,,0.08385086422323944,2,345,0.1881951953335917,0.0035425674099047793,127.62247103736514,COMPLETE
755,0.3777133822441101,2023-09-05 15:01:18.889824,2023-09-05 15:01:19.415011,0 days 00:00:00.525187,ReLU,ReLU,,,46,9,14.0,,,0.05892891223351339,2,439,0.3791564740198585,0.00036682714078184583,122.3350762759938,COMPLETE
756,0.36228445172309875,2023-09-05 15:01:19.415355,2023-09-05 15:01:33.160001,0 days 00:00:13.744646,ReLU,Sigmoid,,,19,21,12.0,,,0.0002338474949421619,2,336,0.7471873377595559,0.0010373517311318091,132.2111108361221,COMPLETE
757,0.3695959150791168,2023-09-05 15:01:33.160357,2023-09-05 15:01:33.614726,0 days 00:00:00.454369,ReLU,ReLU,,,40,16,15.0,,,0.01181209614205729,2,367,0.5028200129583066,0.0002929105372040338,175.72961586400083,COMPLETE
758,0.3573121726512909,2023-09-05 15:01:33.615070,2023-09-05 15:01:35.658310,0 days 00:00:02.043240,ReLU,ReLU,,,64,6,16.0,,,0.001512559203170037,2,380,0.40678765903591185,0.004549000286333421,110.4199626390324,COMPLETE
759,0.35263609886169434,2023-09-05 15:01:35.658650,2023-09-05 15:01:39.224125,0 days 00:00:03.565475,ReLU,Leaky,,,50,7,19.0,,,0.0006595067978779526,2,330,0.7990380787206854,0.00016996596057644006,101.54721453762794,COMPLETE
760,0.3693467974662781,2023-09-05 15:01:39.224465,2023-09-05 15:01:39.878595,0 days 00:00:00.654130,ReLU,ReLU,,,59,8,24.0,,,0.04353757387734542,2,407,0.6394569588380826,0.0007004785819241499,119.5445044732863,COMPLETE
761,0.37948063015937805,2023-09-05 15:01:39.878930,2023-09-05 15:01:40.545620,0 days 00:00:00.666690,Leaky,ReLU,,,61,17,13.0,,,0.012526484474892323,2,351,0.683486231579333,0.0005390997176514349,153.98062108357746,COMPLETE
762,0.37260833382606506,2023-09-05 15:01:40.545951,2023-09-05 15:01:41.605215,0 days 00:00:01.059264,ReLU,ReLU,,,37,9,9.0,,,0.0035731087154105964,2,362,0.32077635721117526,0.0016765712531917449,209.75788941254487,COMPLETE
763,0.3434329628944397,2023-09-05 15:01:41.605558,2023-09-05 15:01:43.895053,0 days 00:00:02.289495,ReLU,ReLU,,,42,23,14.0,,,0.0007802211710733128,2,345,0.48867006953590947,1.837634342994656e-05,114.70013610318176,COMPLETE
764,0.4568540155887604,2023-09-05 15:01:43.895404,2023-09-05 15:01:45.461329,0 days 00:00:01.565925,Sigmoid,ReLU,Leaky,,79,16,17.0,13.0,,0.0005050330130087861,3,338,0.12135998391071855,0.0032656632713400947,170.11849009496925,COMPLETE
765,0.33730968832969666,2023-09-05 15:01:45.461682,2023-09-05 15:01:49.773163,0 days 00:00:04.311481,ReLU,Tanh,,,31,14,14.0,,,0.001082041852231074,2,461,0.7313093271975155,3.720678920702158e-05,137.15660254160562,COMPLETE
766,0.3247893154621124,2023-09-05 15:01:49.773624,2023-09-05 15:01:50.959569,0 days 00:00:01.185945,ReLU,Leaky,,,65,12,12.0,,,0.0017738165322775188,2,327,0.7674681789452699,0.0025686396535429274,98.39274157010593,COMPLETE
767,0.37175145745277405,2023-09-05 15:01:50.959911,2023-09-05 15:01:52.244278,0 days 00:00:01.284367,ReLU,ReLU,,,62,22,13.0,,,0.00134003022131026,2,360,0.5244448324652192,5.244429488730214e-05,2653.4471296479433,COMPLETE
768,0.516712486743927,2023-09-05 15:01:52.244623,2023-09-05 15:01:52.927466,0 days 00:00:00.682843,ReLU,ReLU,,,96,15,11.0,,,0.0006226869250470104,2,349,0.1342919842893845,0.0003306525167089188,142.6868411892063,COMPLETE
769,0.3365853428840637,2023-09-05 15:01:52.927810,2023-09-05 15:01:56.403295,0 days 00:00:03.475485,Tanh,ReLU,,,45,7,15.0,,,0.00042746846266525064,2,335,0.5729307050834641,0.00041893243438250767,112.52955688664943,COMPLETE
770,0.34197163581848145,2023-09-05 15:01:56.403642,2023-09-05 15:01:57.085617,0 days 00:00:00.681975,ReLU,ReLU,,,63,18,10.0,,,0.007578040232435763,2,371,0.7188940935176739,0.00024814648337128937,98.18111877441406,COMPLETE
771,0.6397096514701843,2023-09-05 15:01:57.085957,2023-09-05 15:01:58.651531,0 days 00:00:01.565574,Leaky,ReLU,,,82,16,16.0,,,5.1399192404186815e-05,2,324,0.175375734328782,0.0020294883224544636,162.40145666805316,COMPLETE
