number,value,datetime_start,datetime_complete,duration,params_activation1,params_activation2,params_activation3,params_activation4,params_batch_size,params_fl1,params_fl2,params_fl3,params_fl4,params_learning_rate,params_n_layers,params_num_epochs,params_train_size,params_weight_decay,user_attrs_mre,state
966,0.40131425857543945,2023-09-05 15:11:26.537005,2023-09-05 15:11:27.707934,0 days 00:00:01.170929,ReLU,Tanh,,,75,14,11.0,,,0.0030293510630397024,2,389,0.7281569070192745,1.6748708012363787e-05,122.27532530667489,COMPLETE
967,0.33758947253227234,2023-09-05 15:11:27.708334,2023-09-05 15:11:30.236053,0 days 00:00:02.527719,ReLU,Tanh,,,72,14,14.0,,,0.002325608236048363,2,410,0.7505038030325383,2.2614460982112e-05,99.14800953042918,COMPLETE
968,0.4318017363548279,2023-09-05 15:11:30.236437,2023-09-05 15:11:32.262183,0 days 00:00:02.025746,Tanh,Tanh,,,79,14,13.0,,,0.0019954128033704936,2,424,0.7983917569620512,0.0255254533525675,126.06785053453947,COMPLETE
969,0.31730493903160095,2023-09-05 15:11:32.262562,2023-09-05 15:11:33.391946,0 days 00:00:01.129384,Leaky,Tanh,,,75,13,12.0,,,0.0024360286011334254,2,414,0.7198176338749107,1.3175344202975428e-05,113.08652191162109,COMPLETE
970,0.38458651304244995,2023-09-05 15:11:33.392328,2023-09-05 15:11:34.626712,0 days 00:00:01.234384,Leaky,Leaky,,,73,14,12.0,,,0.00457493855989358,2,404,0.7289740747338918,1.5176952478127667e-05,216.19715169270833,COMPLETE
971,0.3465518355369568,2023-09-05 15:11:34.627123,2023-09-05 15:11:36.352230,0 days 00:00:01.725107,Leaky,Tanh,,,75,13,12.0,,,0.0022942645221040686,2,412,0.7623349397592948,1.0060055706557485e-05,131.84535049810643,COMPLETE
972,0.38073867559432983,2023-09-05 15:11:36.352612,2023-09-05 15:11:37.329511,0 days 00:00:00.976899,Leaky,Tanh,,,78,13,12.0,,,0.003079260280628597,2,424,0.7142109031379832,1.5007011034215122e-05,115.70133894317004,COMPLETE
973,0.4925978183746338,2023-09-05 15:11:37.329893,2023-09-05 15:11:37.725754,0 days 00:00:00.395861,Leaky,Tanh,,,75,13,11.0,,,0.0022303215867024743,2,416,0.11842892151867072,1.894704304709873e-05,178.4755583604177,COMPLETE
974,0.35930055379867554,2023-09-05 15:11:37.726162,2023-09-05 15:11:40.404584,0 days 00:00:02.678422,Leaky,Tanh,,,77,13,11.0,,,0.001965958609286544,2,419,0.7979512904666783,0.0006423459887652271,124.57796490478516,COMPLETE
975,0.38454103469848633,2023-09-05 15:11:40.404966,2023-09-05 15:11:42.523686,0 days 00:00:02.118720,Leaky,Tanh,,,76,14,12.0,,,0.0026517121481356566,2,408,0.7502760724296255,2.7801330380265978e-05,172.5133530700091,COMPLETE
976,0.357475608587265,2023-09-05 15:11:42.524057,2023-09-05 15:11:50.872012,0 days 00:00:08.347955,Leaky,Tanh,,,74,13,12.0,,,8.916248077009059e-05,2,431,0.7247404220885635,0.0007903418431449592,168.46842011276917,COMPLETE
977,0.3891116976737976,2023-09-05 15:11:50.872401,2023-09-05 15:11:51.637705,0 days 00:00:00.765304,Leaky,Tanh,,,72,12,12.0,,,0.003328827603228049,2,399,0.40135725505278896,1.2420969022736157e-05,262.3326479593913,COMPLETE
978,0.41660505533218384,2023-09-05 15:11:51.638160,2023-09-05 15:11:52.097072,0 days 00:00:00.458912,Tanh,Tanh,,,75,14,13.0,,,0.006072656893906664,2,418,0.18220607104992848,1.3032624245814362e-05,251.73155769141945,COMPLETE
979,0.5059269070625305,2023-09-05 15:11:52.097467,2023-09-05 15:12:00.600310,0 days 00:00:08.502843,Leaky,Tanh,,,80,13,10.0,,,1.8857003894111774e-05,2,427,0.7686580172549277,1.39505766908262e-05,140.65441342427525,COMPLETE
980,0.2933199405670166,2023-09-05 15:12:00.600695,2023-09-05 15:12:02.104733,0 days 00:00:01.504038,Leaky,Tanh,,,74,14,11.0,,,0.0026551474907114013,2,410,0.79873786356632,1.0343811384668676e-05,116.28613836115056,COMPLETE
981,0.3009910583496094,2023-09-05 15:12:02.105121,2023-09-05 15:12:03.022880,0 days 00:00:00.917759,Leaky,Tanh,,,77,14,13.0,,,0.002533898927634154,2,408,0.482121878906998,1.0837145570753317e-05,115.38281134403113,COMPLETE
982,0.38220715522766113,2023-09-05 15:12:03.023382,2023-09-05 15:12:03.682085,0 days 00:00:00.658703,Leaky,Tanh,,,80,14,13.0,,,0.003996951660901497,2,409,0.44787024936005737,1.2299935781842815e-05,115.05986389160157,COMPLETE
983,0.39017540216445923,2023-09-05 15:12:03.682610,2023-09-05 15:12:04.513786,0 days 00:00:00.831176,Leaky,Tanh,,,79,14,13.0,,,0.0027728497644014124,2,390,0.4923981187145885,1.3067703076319619e-05,1235.5217398950608,COMPLETE
984,0.38891664147377014,2023-09-05 15:12:04.514297,2023-09-05 15:12:05.264277,0 days 00:00:00.749980,Leaky,Tanh,,,77,14,13.0,,,0.0033026118388005334,2,395,0.41732986998771615,1.2629879304118193e-05,140.05212264764504,COMPLETE
985,0.3549984097480774,2023-09-05 15:12:05.264785,2023-09-05 15:12:06.568700,0 days 00:00:01.303915,Leaky,Tanh,,,78,13,12.0,,,0.0027338531768165025,2,408,0.4354287998999917,1.0515308091477467e-05,117.00881979398638,COMPLETE
986,0.3360252380371094,2023-09-05 15:12:06.569115,2023-09-05 15:12:08.542425,0 days 00:00:01.973310,Leaky,Tanh,,,77,14,13.0,,,0.0022175615160095114,2,415,0.5277626992094889,1.0507534048181005e-05,117.42088184217467,COMPLETE
987,0.39445286989212036,2023-09-05 15:12:08.542817,2023-09-05 15:12:09.319600,0 days 00:00:00.776783,Leaky,Tanh,,,74,13,12.0,,,0.003788048843144982,2,402,0.35391900994729153,1.587385934453379e-05,126.13203356001112,COMPLETE
988,0.3613021969795227,2023-09-05 15:12:09.319981,2023-09-05 15:12:10.308064,0 days 00:00:00.988083,Leaky,Tanh,,,76,15,13.0,,,0.0026142827990946146,2,397,0.5488121381725862,1.0732238200378586e-05,216.47868855794272,COMPLETE
989,0.3666130006313324,2023-09-05 15:12:10.308454,2023-09-05 15:12:10.957970,0 days 00:00:00.649516,Leaky,Tanh,,,81,14,12.0,,,0.0031157504669363993,2,405,0.40159405511433743,1.2333396861675213e-05,106.80278805324009,COMPLETE
990,0.3525260090827942,2023-09-05 15:12:10.958352,2023-09-05 15:12:11.550424,0 days 00:00:00.592072,Leaky,Tanh,,,75,14,13.0,,,0.004395874317500724,2,420,0.39024835508974093,1.0346933025712969e-05,112.60627873738606,COMPLETE
991,0.3705289959907532,2023-09-05 15:12:11.550812,2023-09-05 15:12:13.108029,0 days 00:00:01.557217,Leaky,Tanh,,,73,13,12.0,,,0.002329266033082967,2,413,0.4902887963660123,1.5532874350237902e-05,183.51645213634043,COMPLETE
992,0.3417240083217621,2023-09-05 15:12:13.108463,2023-09-05 15:12:14.488406,0 days 00:00:01.379943,Leaky,Tanh,,,73,15,11.0,,,0.0025717081283449807,2,393,0.5151477764704221,1.615829094362448e-05,143.96653067547342,COMPLETE
993,0.3713722229003906,2023-09-05 15:12:14.488827,2023-09-05 15:12:15.824393,0 days 00:00:01.335566,Leaky,Tanh,,,78,14,13.0,,,0.0020732318652090923,2,402,0.5286831979374463,1.2926172978331174e-05,116.29697753570892,COMPLETE
994,0.3820097744464874,2023-09-05 15:12:15.824794,2023-09-05 15:12:16.788367,0 days 00:00:00.963573,Leaky,Tanh,,,77,13,13.0,,,0.0036324445160176833,2,423,0.5129985094965823,1.746279801988014e-05,161.05100227124763,COMPLETE
995,0.3648146688938141,2023-09-05 15:12:16.788869,2023-09-05 15:12:18.389299,0 days 00:00:01.600430,Leaky,Tanh,,,72,15,12.0,,,0.0026843444983868435,2,414,0.7024043139892155,1.9517345611723424e-05,110.37981395479999,COMPLETE
996,0.3846941292285919,2023-09-05 15:12:18.389679,2023-09-05 15:12:18.827924,0 days 00:00:00.438245,Leaky,Tanh,,,75,4,13.0,,,0.003107367241517087,2,428,0.13705464375516907,1.2698772205181918e-05,130.9758329603407,COMPLETE
997,0.38565921783447266,2023-09-05 15:12:18.828334,2023-09-05 15:12:19.800944,0 days 00:00:00.972610,Leaky,Tanh,,,82,14,12.0,,,0.0019796575173424693,2,410,0.37985096768145915,1.0143618199645715e-05,146.62096337957698,COMPLETE
998,0.35021281242370605,2023-09-05 15:12:19.801348,2023-09-05 15:12:20.221955,0 days 00:00:00.420607,Leaky,Tanh,,,75,14,13.0,,,0.004805118486256456,2,436,0.2736438090548366,1.4774990280216105e-05,109.27176513671876,COMPLETE
999,0.3508627116680145,2023-09-05 15:12:20.222349,2023-09-05 15:12:21.122193,0 days 00:00:00.899844,Leaky,Tanh,,,73,15,11.0,,,0.002319812451538077,2,397,0.359119662527985,1.0260079476203173e-05,109.86671738397507,COMPLETE
1000,0.3743835985660553,2023-09-05 15:12:21.122597,2023-09-05 15:12:21.841555,0 days 00:00:00.718958,Leaky,Tanh,,,72,12,14.0,,,0.019618255668718304,2,414,0.5779291168622144,1.6610489276852817e-05,124.66879172074168,COMPLETE
1001,0.5724011063575745,2023-09-05 15:12:21.841939,2023-09-05 15:12:30.455480,0 days 00:00:08.613541,Leaky,Tanh,,,78,15,12.0,,,1.0169555843194286e-05,2,421,0.7833117048964733,1.2868702518140216e-05,144.13789634070318,COMPLETE
1002,0.3952339291572571,2023-09-05 15:12:30.455860,2023-09-05 15:12:31.581741,0 days 00:00:01.125881,Leaky,Tanh,,,76,13,13.0,,,0.001817072454374516,2,385,0.5531715452892519,4.5762713050260235e-05,129.7511976030138,COMPLETE
1003,0.34908053278923035,2023-09-05 15:12:31.582125,2023-09-05 15:12:32.370164,0 days 00:00:00.788039,Leaky,Tanh,,,75,14,11.0,,,0.003237307464915621,2,403,0.4142146783049196,3.604601681725161e-05,107.04794202532086,COMPLETE
1004,0.37119874358177185,2023-09-05 15:12:32.370585,2023-09-05 15:12:33.120955,0 days 00:00:00.750370,Leaky,Tanh,,,71,13,13.0,,,0.0038902507630345796,2,432,0.4442685810181563,2.2087301623916836e-05,141.58588409423828,COMPLETE
1005,0.35902026295661926,2023-09-05 15:12:33.121354,2023-09-05 15:12:34.101783,0 days 00:00:00.980429,Leaky,Tanh,,,74,14,14.0,,,0.006951426563407398,2,417,0.7962023296740578,0.0005601483175475505,124.34338796706427,COMPLETE
1006,0.359962522983551,2023-09-05 15:12:34.102189,2023-09-05 15:12:34.891932,0 days 00:00:00.789743,Leaky,Tanh,,,81,15,12.0,,,0.002653643131380156,2,441,0.3749169467458181,2.0635528825452505e-05,118.17342696318755,COMPLETE
1007,0.3593911826610565,2023-09-05 15:12:34.892319,2023-09-05 15:12:36.812780,0 days 00:00:01.920461,Leaky,Tanh,,,72,14,10.0,,,0.0020150350722554383,2,427,0.7406316429099739,0.0008131001039077011,115.30963085008705,COMPLETE
1008,0.3733786940574646,2023-09-05 15:12:36.813165,2023-09-05 15:12:37.644988,0 days 00:00:00.831823,Leaky,Tanh,,,71,13,13.0,,,0.0016491276865730512,2,405,0.32690604781728494,0.0006022091666341182,5016.064244712271,COMPLETE
1009,0.45151445269584656,2023-09-05 15:12:37.645381,2023-09-05 15:12:38.152702,0 days 00:00:00.507321,Leaky,,,,78,15,,,,0.002334816110656935,1,390,0.12238808559310695,7.32110311382583e-05,148.0340042597131,COMPLETE
1010,0.4098277986049652,2023-09-05 15:12:38.153080,2023-09-05 15:12:38.434341,0 days 00:00:00.281261,Leaky,Tanh,,,76,14,14.0,,,0.005803521229250184,2,420,0.1153323518332044,1.0064718178125733e-05,271.5614065396584,COMPLETE
1011,0.33693766593933105,2023-09-05 15:12:38.434726,2023-09-05 15:12:39.122913,0 days 00:00:00.688187,Leaky,Tanh,,,74,15,13.0,,,0.030256707281156325,2,410,0.6976119722351494,1.4167002802602368e-05,149.77716434363163,COMPLETE
1012,0.5165437459945679,2023-09-05 15:12:39.123313,2023-09-05 15:12:44.680894,0 days 00:00:05.557581,Leaky,Tanh,,,76,12,12.0,,,5.119380667355191e-05,2,433,0.46361569704368677,0.00046723380199480873,177.88113038589444,COMPLETE
1013,0.3662053644657135,2023-09-05 15:12:44.681285,2023-09-05 15:12:45.473931,0 days 00:00:00.792646,Leaky,Tanh,,,71,14,14.0,,,0.00305629236284203,2,400,0.4690701206713332,2.6828778372054526e-05,114.83901765611436,COMPLETE
1014,0.37507644295692444,2023-09-05 15:12:45.474332,2023-09-05 15:12:46.792796,0 days 00:00:01.318464,Leaky,Tanh,,,79,13,13.0,,,0.002003169387835423,2,425,0.4339336149313628,0.000688798170641627,123.40447529084092,COMPLETE
1015,0.3857247531414032,2023-09-05 15:12:46.793224,2023-09-05 15:12:47.396376,0 days 00:00:00.603152,Leaky,Tanh,,,73,15,12.0,,,0.002474830411075468,2,443,0.16175180530615604,1.726053125651216e-05,130.12410347678446,COMPLETE
1016,0.433960497379303,2023-09-05 15:12:47.396766,2023-09-05 15:12:48.762704,0 days 00:00:01.365938,Leaky,Tanh,,,77,14,11.0,,,0.001793833911955409,2,411,0.7217223650909792,0.0006388639067337056,131.6621388677341,COMPLETE
1017,0.3616065979003906,2023-09-05 15:12:48.763116,2023-09-05 15:12:49.804353,0 days 00:00:01.041237,Leaky,Tanh,,,74,13,13.0,,,0.004626032507655453,2,394,0.7468900715414948,0.004164506322773181,127.5291182848872,COMPLETE
1018,0.3909222483634949,2023-09-05 15:12:49.804764,2023-09-05 15:12:50.489796,0 days 00:00:00.685032,Leaky,Tanh,,,71,15,14.0,,,0.004068759752458748,2,435,0.4674940429344388,1.2017318850092691e-05,622.061076387446,COMPLETE
1019,0.4037136733531952,2023-09-05 15:12:50.490186,2023-09-05 15:12:58.205075,0 days 00:00:07.714889,Leaky,Tanh,,,74,14,13.0,,,9.971864860115282e-05,2,419,0.6854100025588123,5.008508158818548e-05,117.75175572579687,COMPLETE
1020,0.5192208290100098,2023-09-05 15:12:58.205461,2023-09-05 15:12:59.510034,0 days 00:00:01.304573,Leaky,Tanh,,,80,13,11.0,,,0.00016193817623956787,2,404,0.10471786758742084,0.011843795611362014,314.04130425783666,COMPLETE
1021,0.647969663143158,2023-09-05 15:12:59.510415,2023-09-05 15:13:00.888986,0 days 00:00:01.378571,Leaky,Tanh,,,77,14,14.0,,,2.3425120218765613e-05,2,423,0.10645088365366771,0.0008309689139088408,127.78301688119875,COMPLETE
1022,0.39131712913513184,2023-09-05 15:13:00.889368,2023-09-05 15:13:01.374407,0 days 00:00:00.485039,Leaky,Tanh,,,85,15,12.0,,,0.003195842317743998,2,411,0.2045637201389757,3.758192090213907e-05,118.3212222805271,COMPLETE
1023,0.366061806678772,2023-09-05 15:13:01.374791,2023-09-05 15:13:01.789812,0 days 00:00:00.415021,Leaky,Tanh,,,72,15,14.0,,,0.02449079930202308,2,431,0.4558441777329838,0.0004589611331651474,110.7994807107108,COMPLETE
1024,0.4101525843143463,2023-09-05 15:13:01.790207,2023-09-05 15:13:02.373387,0 days 00:00:00.583180,Leaky,Tanh,,,74,14,13.0,,,0.001729137501601822,2,451,0.15462991758187003,0.01630028526975978,124.07540535304857,COMPLETE
1025,0.3904891312122345,2023-09-05 15:13:02.373773,2023-09-05 15:13:03.490091,0 days 00:00:01.116318,Leaky,Tanh,,,70,14,12.0,,,0.0026196271424527356,2,442,0.5163795135159004,2.3067892840978266e-05,121.55515498331148,COMPLETE
1026,0.4053329527378082,2023-09-05 15:13:03.490471,2023-09-05 15:13:07.279391,0 days 00:00:03.788920,Leaky,Tanh,,,76,13,13.0,,,0.00010737773228201893,2,388,0.36267050708249926,1.4047429163957711e-05,127.71455703814006,COMPLETE
1027,0.3557874262332916,2023-09-05 15:13:07.279777,2023-09-05 15:13:07.530897,0 days 00:00:00.251120,Leaky,Tanh,,,75,14,13.0,,,0.03837789140842459,2,415,0.13137066377306159,0.0044751539174296235,144.2767655054728,COMPLETE
1028,0.59617018699646,2023-09-05 15:13:07.531282,2023-09-05 15:13:11.329102,0 days 00:00:03.797820,Leaky,Tanh,,,72,12,14.0,,,1.8838245261017426e-05,2,425,0.3083327724514211,0.0007145934758822725,146.88946985581342,COMPLETE
1029,0.4082897901535034,2023-09-05 15:13:11.329508,2023-09-05 15:13:13.068090,0 days 00:00:01.738582,ReLU,Sigmoid,,,73,15,12.0,,,0.0021683071687107016,2,435,0.5009063645214674,0.0005148709624159618,203.31321873940712,COMPLETE
1030,0.3608594536781311,2023-09-05 15:13:13.068486,2023-09-05 15:13:14.731672,0 days 00:00:01.663186,Leaky,Tanh,,,78,15,10.0,,,0.0015538099676693196,2,400,0.42739116241198377,1.1989437660798793e-05,129.5217456011705,COMPLETE
1031,0.4368445575237274,2023-09-05 15:13:14.732068,2023-09-05 15:13:15.380526,0 days 00:00:00.648458,ReLU,Tanh,,,70,14,14.0,,,0.026657071051548933,2,407,0.7729717444609502,0.00043469694451288873,257.32869805230035,COMPLETE
1032,0.4547792077064514,2023-09-05 15:13:15.380905,2023-09-05 15:13:16.378629,0 days 00:00:00.997724,ReLU,Tanh,,,32,14,11.0,,,0.007159027904671382,2,410,0.7999629002359636,0.038710553694750134,116.13336181640625,COMPLETE
1033,0.37486767768859863,2023-09-05 15:13:16.379020,2023-09-05 15:13:21.787818,0 days 00:00:05.408798,Tanh,Leaky,,,80,12,13.0,,,0.00022709395889891577,2,417,0.7181621213392967,1.8762121113351587e-05,160.39493060934132,COMPLETE
1034,0.297191321849823,2023-09-05 15:13:21.788246,2023-09-05 15:13:24.095769,0 days 00:00:02.307523,ReLU,Tanh,,,76,5,12.0,,,0.002983803613713921,2,380,0.7482625331759383,1.0145972743736453e-05,94.59357037460595,COMPLETE
1035,0.3195139169692993,2023-09-05 15:13:24.096173,2023-09-05 15:13:27.124692,0 days 00:00:03.028519,ReLU,Tanh,,,77,4,11.0,,,0.0034481006622672215,2,383,0.7569711740865779,1.0221739842059941e-05,124.88785657695695,COMPLETE
1036,0.5884153246879578,2023-09-05 15:13:27.125088,2023-09-05 15:13:34.900750,0 days 00:00:07.775662,ReLU,Tanh,,,82,5,11.0,,,3.9739606219361284e-05,2,385,0.7994253014784888,1.0234374989100009e-05,120.3216909037008,COMPLETE
1037,0.3941401541233063,2023-09-05 15:13:34.901152,2023-09-05 15:13:36.047996,0 days 00:00:01.146844,Leaky,Tanh,,,79,4,12.0,,,0.0028023520223929175,2,379,0.2737122454694373,1.1976303291440446e-05,371.477674092332,COMPLETE
1038,0.3724631369113922,2023-09-05 15:13:36.048388,2023-09-05 15:13:37.463911,0 days 00:00:01.415523,ReLU,Tanh,,,76,5,12.0,,,0.0035954426302860654,2,389,0.5628035037332096,1.5048389670091076e-05,128.5130074469598,COMPLETE
1039,0.40875139832496643,2023-09-05 15:13:37.464300,2023-09-05 15:13:38.470815,0 days 00:00:01.006515,ReLU,Tanh,,,75,3,11.0,,,0.0043226272342043156,2,379,0.22938915935798737,1.3964066535457327e-05,142.21127231104845,COMPLETE
1040,0.42777639627456665,2023-09-05 15:13:38.471238,2023-09-05 15:13:39.671441,0 days 00:00:01.200203,ReLU,Tanh,,,75,4,12.0,,,0.0027937308949140833,2,398,0.7493203559285446,1.1519638687054461e-05,123.80727319550095,COMPLETE
1041,0.34165093302726746,2023-09-05 15:13:39.671908,2023-09-05 15:13:40.916193,0 days 00:00:01.244285,Leaky,Tanh,,,76,15,12.0,,,0.003259225585170194,2,397,0.6823381119728436,1.699075991566067e-05,123.5442604651818,COMPLETE
1042,0.49994081258773804,2023-09-05 15:13:40.916619,2023-09-05 15:13:43.201791,0 days 00:00:02.285172,ReLU,Tanh,,,78,2,12.0,,,0.0048264776488762115,2,388,0.7695509590955578,1.2348682837562257e-05,157.2149713566873,COMPLETE
1043,0.34327027201652527,2023-09-05 15:13:43.202203,2023-09-05 15:13:46.536230,0 days 00:00:03.334027,ReLU,Tanh,,,73,5,12.0,,,0.001995774634405898,2,393,0.7120514750364118,3.274440977840683e-05,115.24119181913488,COMPLETE
1044,0.5648946166038513,2023-09-05 15:13:46.536644,2023-09-05 15:13:48.760239,0 days 00:00:02.223595,ReLU,Tanh,,,79,3,11.0,,,5.500560074889539e-05,2,403,0.19100961251179074,1.0171591827532482e-05,135.58638424553882,COMPLETE
1045,0.37861478328704834,2023-09-05 15:13:48.760666,2023-09-05 15:13:49.263422,0 days 00:00:00.502756,ReLU,Tanh,,,78,13,12.0,,,0.00232560153804344,2,396,0.3016573051592988,2.1046515195395932e-05,124.6475144845468,COMPLETE
1046,0.5551882386207581,2023-09-05 15:13:49.263843,2023-09-05 15:13:57.188626,0 days 00:00:07.924783,Leaky,Tanh,,,75,5,12.0,,,4.30809721583684e-05,2,406,0.7416922763602107,0.014086199241935174,155.13067085754696,COMPLETE
1047,0.36173689365386963,2023-09-05 15:13:57.189016,2023-09-05 15:13:59.188148,0 days 00:00:01.999132,ReLU,Tanh,,,73,5,11.0,,,0.002418599653397109,2,387,0.76904714100085,0.0001088843797893499,126.34743491639482,COMPLETE
1048,0.38744673132896423,2023-09-05 15:13:59.188551,2023-09-05 15:13:59.418381,0 days 00:00:00.229830,ReLU,Tanh,,,76,13,14.0,,,0.014487829077066078,2,378,0.11356010294705736,1.389206613382132e-05,138.84210968017578,COMPLETE
1049,0.4119884967803955,2023-09-05 15:13:59.418788,2023-09-05 15:14:00.941775,0 days 00:00:01.522987,ReLU,Tanh,,,81,3,13.0,,,0.0037228731389029796,2,404,0.6755347378407326,1.2735646033599727e-05,113.74438757183908,COMPLETE
1050,0.5954644083976746,2023-09-05 15:14:00.942172,2023-09-05 15:14:08.830238,0 days 00:00:07.888066,Leaky,Tanh,,,73,4,12.0,,,1.2002003972540309e-05,2,413,0.7102648842443323,0.005499109177651331,133.53964680447706,COMPLETE
1051,0.37378865480422974,2023-09-05 15:14:08.830626,2023-09-05 15:14:09.382362,0 days 00:00:00.551736,ReLU,Leaky,,,53,14,13.0,,,0.0029819887329122657,2,371,0.24868012648147894,0.00038535988110045084,146.5132652416564,COMPLETE
1052,0.3821023404598236,2023-09-05 15:14:09.382745,2023-09-05 15:14:09.963598,0 days 00:00:00.580853,ReLU,Tanh,,,33,15,6.0,,,0.0050895303890182925,2,401,0.48970065847581645,6.183906429344832e-05,162.89697820490056,COMPLETE
1053,0.35041365027427673,2023-09-05 15:14:09.963987,2023-09-05 15:14:11.908564,0 days 00:00:01.944577,Tanh,Sigmoid,,,77,12,14.0,,,0.0018104065898667417,2,376,0.7299689605327084,2.803531840582417e-05,111.60029174804687,COMPLETE
1054,0.3880540132522583,2023-09-05 15:14:11.908964,2023-09-05 15:14:12.231082,0 days 00:00:00.322118,ReLU,Tanh,,,74,13,10.0,,,0.046760059313528494,2,417,0.3395765154513143,1.759783475249575e-05,112.96452896683304,COMPLETE
1055,0.43777209520339966,2023-09-05 15:14:12.231471,2023-09-05 15:14:13.105128,0 days 00:00:00.873657,ReLU,Tanh,,,72,11,11.0,,,0.0023362648002684698,2,392,0.7711490219221486,0.019608989189066905,148.07191232534555,COMPLETE
1056,0.3692416846752167,2023-09-05 15:14:13.105528,2023-09-05 15:14:13.581992,0 days 00:00:00.476464,Leaky,Leaky,,,77,15,13.0,,,0.0014923702150917769,2,382,0.19640711650942877,0.0005520605200303235,121.16527170949168,COMPLETE
1057,0.37334558367729187,2023-09-05 15:14:13.582377,2023-09-05 15:14:14.491808,0 days 00:00:00.909431,ReLU,Tanh,,,75,14,12.0,,,0.002915032320900449,2,421,0.3880104415501112,7.820882274812245e-05,197.6846652984619,COMPLETE
1058,0.42322400212287903,2023-09-05 15:14:14.492207,2023-09-05 15:14:14.763065,0 days 00:00:00.270858,ReLU,Tanh,,,52,13,14.0,,,0.0058868730260204175,2,410,0.14547355788447497,0.003950948278659416,128.90304008690086,COMPLETE
1059,0.555313229560852,2023-09-05 15:14:14.763483,2023-09-05 15:14:15.412028,0 days 00:00:00.648545,ReLU,Leaky,,,31,14,13.0,,,0.0037921933407677575,2,399,0.2652714458588147,0.08628220226916436,132.94899980411972,COMPLETE
1060,0.3509216904640198,2023-09-05 15:14:15.412431,2023-09-05 15:14:17.126785,0 days 00:00:01.714354,Leaky,Tanh,,,79,14,12.0,,,0.002039193275694662,2,407,0.48239296576678087,0.00013699574131348767,120.08057076590401,COMPLETE
1061,0.42698392271995544,2023-09-05 15:14:17.127189,2023-09-05 15:14:18.034308,0 days 00:00:00.907119,ReLU,Tanh,,,33,11,14.0,,,0.0017449238943476333,2,422,0.1276598051484331,1.003470599861536e-05,131.41950779106782,COMPLETE
1062,0.5896461009979248,2023-09-05 15:14:18.034705,2023-09-05 15:14:22.616669,0 days 00:00:04.581964,ReLU,Tanh,,,71,15,9.0,,,1.8941543174655306e-05,2,394,0.4162749138246179,0.004842509615080775,222.06338315082687,COMPLETE
