number,value,datetime_start,datetime_complete,duration,params_activation1,params_activation2,params_activation3,params_activation4,params_batch_size,params_fl1,params_fl2,params_fl3,params_fl4,params_learning_rate,params_n_layers,params_num_epochs,params_train_size,params_weight_decay,user_attrs_mre,state
869,0.39437830448150635,2023-09-05 15:06:40.280991,2023-09-05 15:06:41.378633,0 days 00:00:01.097642,ReLU,Tanh,,,64,24,15.0,,,0.0008834423766642357,2,432,0.2388463794666034,6.86976780871789e-05,236.3021630774011,COMPLETE
870,0.36434751749038696,2023-09-05 15:06:41.378987,2023-09-05 15:06:42.659175,0 days 00:00:01.280188,Tanh,ReLU,,,34,7,11.0,,,0.021040922632500313,2,353,0.7456299248134707,0.00014706782175567633,108.65683195326064,COMPLETE
871,0.3670169413089752,2023-09-05 15:06:42.659526,2023-09-05 15:06:45.069260,0 days 00:00:02.409734,ReLU,ReLU,,,30,24,14.0,,,0.0010408858815412114,2,345,0.6877078183360787,0.002374792192441105,142.30303898979636,COMPLETE
872,0.3866164982318878,2023-09-05 15:06:45.069613,2023-09-05 15:06:49.931163,0 days 00:00:04.861550,Sigmoid,ReLU,,,38,23,12.0,,,0.0005558140072191865,2,363,0.7742486913165435,0.0016523440490810845,187.2083526085163,COMPLETE
873,0.5431321263313293,2023-09-05 15:06:49.931518,2023-09-05 15:06:50.196002,0 days 00:00:00.264484,ReLU,ReLU,ReLU,,66,6,16.0,9.0,,0.0007314260168744959,3,331,0.14450259625810694,2.2656637387737714e-05,178.92227516174316,COMPLETE
874,0.7550738453865051,2023-09-05 15:06:50.196361,2023-09-05 15:06:51.445455,0 days 00:00:01.249094,Leaky,ReLU,,,91,16,17.0,,,1.499540269433066e-05,2,308,0.15050543095072236,0.03674095197526697,105.92002172593946,COMPLETE
875,0.38939762115478516,2023-09-05 15:06:51.445804,2023-09-05 15:06:53.081770,0 days 00:00:01.635966,ReLU,ReLU,,,61,24,14.0,,,0.0012179457647022373,2,348,0.46996365499063286,9.449694351546197e-05,911.8537188938686,COMPLETE
876,0.38205841183662415,2023-09-05 15:06:53.082132,2023-09-05 15:06:59.362392,0 days 00:00:06.280260,ReLU,ReLU,,,42,17,13.0,,,0.00015566386426498535,2,421,0.6551950725105127,1.564142153355844e-05,121.22534207486913,COMPLETE
877,0.428346186876297,2023-09-05 15:06:59.362747,2023-09-05 15:07:05.565200,0 days 00:00:06.202453,ReLU,ReLU,,,46,3,15.0,,,0.00045256566464126747,2,323,0.7320300990204572,0.000543142843951088,125.9472570942424,COMPLETE
878,0.3447530269622803,2023-09-05 15:07:05.565558,2023-09-05 15:07:30.290256,0 days 00:00:24.724698,ReLU,ReLU,,,11,23,18.0,,,3.6502067928968376e-05,2,337,0.6118631266622973,0.0003015150210709223,106.67392318680308,COMPLETE
879,0.34155333042144775,2023-09-05 15:07:30.290676,2023-09-05 15:07:32.426279,0 days 00:00:02.135603,ReLU,Tanh,,,54,15,2.0,,,0.0022636325491714768,2,404,0.5571369390301127,0.00041658616911225923,102.84440149812617,COMPLETE
880,0.37192296981811523,2023-09-05 15:07:32.426636,2023-09-05 15:07:33.288717,0 days 00:00:00.862081,ReLU,ReLU,,,36,9,12.0,,,0.001593151952404909,2,354,0.19123783418350185,0.002019504632880073,139.25194653962788,COMPLETE
881,0.33682388067245483,2023-09-05 15:07:33.289084,2023-09-05 15:07:38.579232,0 days 00:00:05.290148,ReLU,ReLU,,,32,8,13.0,,,0.0003835413915410875,2,339,0.4923266339308924,0.001226384465449017,118.18295516286578,COMPLETE
882,0.3868583142757416,2023-09-05 15:07:38.579597,2023-09-05 15:07:39.277741,0 days 00:00:00.698144,Leaky,ReLU,,,68,24,16.0,,,0.05770783210894,2,437,0.7080356953041579,0.0003560768013934984,113.01684165000916,COMPLETE
883,0.38883769512176514,2023-09-05 15:07:39.278094,2023-09-05 15:07:40.650243,0 days 00:00:01.372149,ReLU,ReLU,,,63,18,15.0,,,0.0008073277723648055,2,362,0.2526596908165629,5.3348554915324396e-05,113.45364908071664,COMPLETE
884,0.6083574891090393,2023-09-05 15:07:40.650596,2023-09-05 15:07:42.225386,0 days 00:00:01.574790,ReLU,Sigmoid,,,40,14,7.0,,,0.0009820422322569936,2,324,0.26799926378759137,0.0028253442131081063,236.53134835881295,COMPLETE
885,0.4060724973678589,2023-09-05 15:07:42.225739,2023-09-05 15:07:50.610737,0 days 00:00:08.384998,Sigmoid,ReLU,,,48,7,14.0,,,0.0006185849035971026,2,314,0.7503617303195064,0.0006998470996227417,124.72304440152114,COMPLETE
886,0.3905201256275177,2023-09-05 15:07:50.611099,2023-09-05 15:07:52.307499,0 days 00:00:01.696400,ReLU,ReLU,,,43,24,14.0,,,0.0012472681152836769,2,301,0.6801473699316604,2.9061462451516702e-05,137.025148421999,COMPLETE
887,0.39702919125556946,2023-09-05 15:07:52.307870,2023-09-05 15:07:53.711052,0 days 00:00:01.403182,ReLU,ReLU,,,60,6,12.0,,,0.00187005388927064,2,446,0.7137394732965111,0.00012904951026314974,148.91469717025757,COMPLETE
888,0.3813483715057373,2023-09-05 15:07:53.711404,2023-09-05 15:07:55.811540,0 days 00:00:02.100136,ReLU,ReLU,Leaky,,51,8,13.0,10.0,,0.0005167358862026609,3,332,0.4005360330248622,0.0008703439772068023,146.29537725448608,COMPLETE
889,0.40953150391578674,2023-09-05 15:07:55.811923,2023-09-05 15:07:56.646437,0 days 00:00:00.834514,ReLU,ReLU,,,66,23,15.0,,,0.015583067692758712,2,264,0.7734315155849636,0.00010205374432128982,131.65803572710823,COMPLETE
890,0.38068145513534546,2023-09-05 15:07:56.646792,2023-09-05 15:08:07.107696,0 days 00:00:10.460904,ReLU,ReLU,,,45,24,16.0,,,3.712185457740345e-05,2,409,0.6671930046051019,1.0826896755279298e-05,128.16361245899154,COMPLETE
891,0.40440139174461365,2023-09-05 15:08:07.108069,2023-09-05 15:08:10.085901,0 days 00:00:02.977832,Leaky,Tanh,,,37,16,19.0,,,0.0006777535602003385,2,346,0.6417067719009432,0.00018191216042818932,13902.417633928571,COMPLETE
892,0.4168826639652252,2023-09-05 15:08:10.086265,2023-09-05 15:08:12.847186,0 days 00:00:02.760921,Tanh,ReLU,,,34,17,13.0,,,0.001464093850725478,2,417,0.7387353375683885,0.0014965007483492573,125.93593877478492,COMPLETE
893,0.4190751910209656,2023-09-05 15:08:12.847548,2023-09-05 15:08:13.180170,0 days 00:00:00.332622,ReLU,ReLU,,,62,24,12.0,,,0.03702488361191239,2,353,0.5950468267350485,0.0005091759193572702,192.90225524902343,COMPLETE
894,0.4201372563838959,2023-09-05 15:08:13.180534,2023-09-05 15:08:14.098297,0 days 00:00:00.917763,ReLU,ReLU,,,65,7,14.0,,,0.0010109056228140118,2,427,0.12431211947897429,0.0036632654821309994,156.3996223691362,COMPLETE
895,0.3906199336051941,2023-09-05 15:08:14.098665,2023-09-05 15:08:14.844843,0 days 00:00:00.746178,ReLU,ReLU,,,39,23,23.0,,,0.0026999619745765617,2,337,0.2069494200843357,0.0002723186349931879,464.0197424950538,COMPLETE
896,0.33394739031791687,2023-09-05 15:08:14.845221,2023-09-05 15:08:19.577676,0 days 00:00:04.732455,ReLU,ReLU,,,69,22,11.0,,,0.00033200811461226104,2,322,0.6967315812023668,0.002360785627992244,113.66648817456458,COMPLETE
897,0.9214227199554443,2023-09-05 15:08:19.578045,2023-09-05 15:08:21.966044,0 days 00:00:02.387999,ReLU,ReLU,,,58,9,15.0,,,1.033357588934841e-05,2,455,0.15336458846384823,0.0003969976357310164,152.40065431699648,COMPLETE
898,0.4139266610145569,2023-09-05 15:08:21.966423,2023-09-05 15:08:23.394792,0 days 00:00:01.428369,ReLU,ReLU,Sigmoid,,74,13,13.0,15.0,,0.0007925215942005915,3,345,0.7713815284934038,0.0006155560566821234,148.5352977884227,COMPLETE
899,0.41837170720100403,2023-09-05 15:08:23.395175,2023-09-05 15:08:28.466934,0 days 00:00:05.071759,Sigmoid,ReLU,,,43,15,16.0,,,0.00044656098471818864,2,359,0.32679464080340426,0.00023088555797678545,273.44373429917357,COMPLETE
900,0.32770639657974243,2023-09-05 15:08:28.467307,2023-09-05 15:08:29.910176,0 days 00:00:01.442869,ReLU,ReLU,,,63,23,14.0,,,0.0012477348474436234,2,288,0.7978135013795484,0.00010735494902191757,95.40526115288169,COMPLETE
901,0.37044256925582886,2023-09-05 15:08:29.910539,2023-09-05 15:08:32.929199,0 days 00:00:03.018660,ReLU,ReLU,,,28,24,17.0,,,0.000565673768612368,2,333,0.3532081762061099,0.0018718026160048716,118.94523747762044,COMPLETE
902,0.3624543845653534,2023-09-05 15:08:32.929565,2023-09-05 15:08:34.078112,0 days 00:00:01.148547,Leaky,ReLU,,,41,14,21.0,,,0.04772081972794156,2,367,0.7300297318128558,0.00011437311187015787,126.58433096749442,COMPLETE
903,0.36368101835250854,2023-09-05 15:08:34.078475,2023-09-05 15:08:35.473160,0 days 00:00:01.394685,ReLU,Tanh,,,18,8,15.0,,,0.0051769251412437265,2,316,0.5390455193493596,0.00031897230204526217,125.94981384277344,COMPLETE
904,0.3703056573867798,2023-09-05 15:08:35.473534,2023-09-05 15:08:37.604012,0 days 00:00:02.130478,ReLU,ReLU,,,35,16,13.0,,,0.0009163373476465797,2,350,0.3772486465292862,4.265626437754823e-05,144.06514753493587,COMPLETE
905,0.35958346724510193,2023-09-05 15:08:37.604390,2023-09-05 15:08:40.695602,0 days 00:00:03.091212,ReLU,Sigmoid,,,45,24,11.0,,,0.0006745735902145308,2,340,0.621035899256392,0.003026770126919422,118.33070423977433,COMPLETE
906,0.395437628030777,2023-09-05 15:08:40.695969,2023-09-05 15:08:41.432621,0 days 00:00:00.736652,ReLU,ReLU,,,31,18,12.0,,,0.0017688446818364598,2,327,0.1665672555532306,0.0013964421967369175,937.3375491371638,COMPLETE
907,0.43164339661598206,2023-09-05 15:08:41.432996,2023-09-05 15:08:45.732351,0 days 00:00:04.299355,ReLU,ReLU,ReLU,,61,15,22.0,7.0,,0.00017917202870638548,3,304,0.3870288293074447,0.00046105307618472623,129.6102997378299,COMPLETE
908,0.3735679090023041,2023-09-05 15:08:45.732752,2023-09-05 15:08:47.456277,0 days 00:00:01.723525,ReLU,ReLU,,,70,23,14.0,,,0.001105778124805973,2,360,0.6997057048127674,2.1675420110036936e-05,115.63817348250423,COMPLETE
909,0.33654481172561646,2023-09-05 15:08:47.456650,2023-09-05 15:08:48.659469,0 days 00:00:01.202819,ReLU,ReLU,,,47,22,16.0,,,0.002150034454319324,2,389,0.7525966183409922,0.0007748066457897583,117.20601654052734,COMPLETE
910,0.5185049176216125,2023-09-05 15:08:48.659840,2023-09-05 15:08:49.527192,0 days 00:00:00.867352,Leaky,,,,37,7,,,,0.0013856827419877445,1,248,0.25127797280966513,0.07823885207314502,176.81944834391277,COMPLETE
911,0.3653593063354492,2023-09-05 15:08:49.527596,2023-09-05 15:08:52.421509,0 days 00:00:02.893913,ReLU,ReLU,,,49,17,15.0,,,0.0004959164817043999,2,330,0.29788129719499457,1.436610966302975e-05,123.14661489950645,COMPLETE
912,0.4022860825061798,2023-09-05 15:08:52.421887,2023-09-05 15:08:53.141744,0 days 00:00:00.719857,Sigmoid,Leaky,,,65,6,15.0,,,0.05833564215929533,2,342,0.6614048648962458,0.0010919409791272387,136.34951782226562,COMPLETE
913,0.3203470706939697,2023-09-05 15:08:53.142123,2023-09-05 15:08:54.502968,0 days 00:00:01.360845,ReLU,ReLU,,,67,24,13.0,,,0.0007818067619797353,2,437,0.7230482075267255,0.0009734476737972108,129.63276409711995,COMPLETE
914,0.42227375507354736,2023-09-05 15:08:54.503330,2023-09-05 15:08:56.265912,0 days 00:00:01.762582,ReLU,ReLU,,,67,20,13.0,,,0.000750767785754807,2,436,0.7996469501508612,0.0010774066184588503,115.94686044229043,COMPLETE
915,0.33845949172973633,2023-09-05 15:08:56.266291,2023-09-05 15:08:59.490066,0 days 00:00:03.223775,ReLU,ReLU,,,68,23,12.0,,,0.0006444097531159833,2,435,0.7401047162595499,2.673588318800603e-05,129.03964828491212,COMPLETE
916,0.4210268557071686,2023-09-05 15:08:59.490441,2023-09-05 15:09:00.573082,0 days 00:00:01.082641,Tanh,ReLU,,,71,24,13.0,,,0.0129892782840541,2,450,0.76699267040223,0.0009144182449789709,129.96977412447015,COMPLETE
917,0.3677365481853485,2023-09-05 15:09:00.573465,2023-09-05 15:09:02.362604,0 days 00:00:01.789139,ReLU,ReLU,Leaky,ReLU,67,16,13.0,17.0,21.0,0.0008373485770877411,4,428,0.5166004519021535,0.0009773275517826736,138.93973252831435,COMPLETE
918,0.3848190903663635,2023-09-05 15:09:02.362982,2023-09-05 15:09:04.797636,0 days 00:00:02.434654,ReLU,Tanh,,,69,9,12.0,,,0.0005595386860297401,2,117,0.7159057317609298,1.007050441050866e-05,135.34471319475745,COMPLETE
919,0.39391660690307617,2023-09-05 15:09:04.798015,2023-09-05 15:09:09.245978,0 days 00:00:04.447963,ReLU,ReLU,,,64,21,13.0,,,0.0003932587704120299,2,438,0.46894868862197,0.0012856165067258922,128.31103270220908,COMPLETE
920,0.4355546236038208,2023-09-05 15:09:09.246342,2023-09-05 15:09:09.809798,0 days 00:00:00.563456,ReLU,ReLU,,,67,14,12.0,,,0.0007614933262787209,2,443,0.10894134210141947,0.0016393897816607775,681.7157511609665,COMPLETE
921,0.43041205406188965,2023-09-05 15:09:09.810181,2023-09-05 15:09:12.584717,0 days 00:00:02.774536,ReLU,ReLU,,,66,13,13.0,,,0.00020520805769385015,2,455,0.23726920683137154,0.0007800276548624432,122.12126225297169,COMPLETE
922,0.4268031418323517,2023-09-05 15:09:12.585097,2023-09-05 15:09:13.088696,0 days 00:00:00.503599,Leaky,Leaky,,,70,8,13.0,,,0.08579746352656771,2,427,0.45107909572324784,0.0023091315414576256,2636.2776227678573,COMPLETE
923,0.4072241485118866,2023-09-05 15:09:13.089066,2023-09-05 15:09:15.203412,0 days 00:00:02.114346,ReLU,ReLU,Tanh,,72,24,12.0,13.0,,0.0006471729778618102,3,420,0.7485671159103434,0.003830088299017309,470.3199505974265,COMPLETE
924,0.361490398645401,2023-09-05 15:09:15.203788,2023-09-05 15:09:18.209638,0 days 00:00:03.005850,ReLU,ReLU,,,65,15,10.0,,,0.0009162091675372598,2,441,0.7115937213312907,0.0012681375657455282,123.20806906256877,COMPLETE
925,0.41866812109947205,2023-09-05 15:09:18.210004,2023-09-05 15:09:20.555930,0 days 00:00:02.345926,ReLU,ReLU,,,63,23,13.0,,,0.0004589933594522628,2,449,0.28380916420055263,0.00020684691570565695,125.87191003719663,COMPLETE
926,0.5800483226776123,2023-09-05 15:09:20.556298,2023-09-05 15:09:21.222462,0 days 00:00:00.666164,Sigmoid,ReLU,,,68,24,13.0,,,0.0002969945198408892,2,413,0.11041633494133037,0.0018808562725330115,206.8213000413848,COMPLETE
927,0.46961158514022827,2023-09-05 15:09:21.222841,2023-09-05 15:09:30.597760,0 days 00:00:09.374919,ReLU,ReLU,,,66,22,12.0,,,2.231668636664021e-05,2,415,0.7737274494487894,0.0009450663558986486,165.18832040809724,COMPLETE
928,0.378754198551178,2023-09-05 15:09:30.598130,2023-09-05 15:09:36.688823,0 days 00:00:06.090693,ReLU,ReLU,,,65,8,11.0,,,0.0005560560783758122,2,433,0.684248159198178,0.00015527024102638992,109.00675358566335,COMPLETE
929,0.582728385925293,2023-09-05 15:09:36.689202,2023-09-05 15:09:47.164136,0 days 00:00:10.474934,ReLU,Sigmoid,,,60,16,14.0,,,1.2266110520616836e-05,2,465,0.7306827753882533,0.0027221091444903306,124.47989354287425,COMPLETE
930,0.34974512457847595,2023-09-05 15:09:47.164528,2023-09-05 15:09:51.679442,0 days 00:00:04.514914,Leaky,ReLU,,,63,7,13.0,,,0.0007935545885664107,2,422,0.5781767381408434,0.0006456012432758648,106.15240980133296,COMPLETE
931,0.4162185788154602,2023-09-05 15:09:51.679829,2023-09-05 15:09:52.008471,0 days 00:00:00.328642,ReLU,Leaky,,,62,24,14.0,,,0.04122273517785545,2,459,0.41893106655238943,0.003032599901237986,118.30785179138184,COMPLETE
932,0.4319343566894531,2023-09-05 15:09:52.009180,2023-09-05 15:09:53.759215,0 days 00:00:01.750035,ReLU,ReLU,,,76,23,12.0,,,0.0002527320001708031,2,403,0.25822445213209105,3.9991638790652146e-05,148.28607752504905,COMPLETE
933,0.4745963215827942,2023-09-05 15:09:53.759607,2023-09-05 15:09:55.487312,0 days 00:00:01.727705,ReLU,Tanh,,,69,17,12.0,,,0.0010592757019796072,2,444,0.7592306712032814,0.04715979676440631,187.07169179280598,COMPLETE
934,0.34421178698539734,2023-09-05 15:09:55.487797,2023-09-05 15:09:57.204529,0 days 00:00:01.716732,ReLU,ReLU,,,73,19,13.0,,,0.0007198943187883243,2,428,0.7994928693840411,0.00141152147680644,111.1473435853657,COMPLETE
935,0.41425496339797974,2023-09-05 15:09:57.204921,2023-09-05 15:09:58.536736,0 days 00:00:01.331815,ReLU,ReLU,,,64,24,14.0,,,0.0003802648180351992,2,315,0.22962627683343462,0.0010594427818156438,122.47310521385886,COMPLETE
936,0.33529824018478394,2023-09-05 15:09:58.537108,2023-09-05 15:10:03.051203,0 days 00:00:04.514095,ReLU,ReLU,,,67,23,13.0,,,0.0005600868613122094,2,429,0.6521993779160575,0.001696310000069005,106.04652452668385,COMPLETE
937,0.367716521024704,2023-09-05 15:10:03.051636,2023-09-05 15:10:06.643138,0 days 00:00:03.591502,ReLU,ReLU,ReLU,,59,18,20.0,5.0,,0.0008909722403738556,3,449,0.7101785288404737,0.0020254762671169293,144.46744900658018,COMPLETE
938,0.35154101252555847,2023-09-05 15:10:06.643842,2023-09-05 15:10:11.893335,0 days 00:00:05.249493,Leaky,ReLU,,,57,15,11.0,,,0.0006510586901073019,2,320,0.6758979838376123,0.0002627271490537676,117.92268743100374,COMPLETE
939,0.3701629042625427,2023-09-05 15:10:11.893733,2023-09-05 15:10:15.164206,0 days 00:00:03.270473,ReLU,ReLU,,,43,10,14.0,,,0.0004696664945278728,2,439,0.7369148274946424,5.67175014040371e-05,122.70468514306205,COMPLETE
940,0.4012433588504791,2023-09-05 15:10:15.164579,2023-09-05 15:10:17.641756,0 days 00:00:02.477177,Sigmoid,Leaky,,,45,7,12.0,,,0.0010039643990656095,2,92,0.6978744050731491,0.0007328490919347142,136.0501870694368,COMPLETE
941,0.33309364318847656,2023-09-05 15:10:17.642139,2023-09-05 15:10:19.540769,0 days 00:00:01.898630,Tanh,ReLU,,,71,14,17.0,,,0.0039074344047204035,2,398,0.7633295310047972,0.0036413388057072757,104.34324836730957,COMPLETE
942,0.37035953998565674,2023-09-05 15:10:19.541136,2023-09-05 15:10:20.529433,0 days 00:00:00.988297,ReLU,ReLU,,,61,9,13.0,,,0.0025983098672430842,2,298,0.550079703867004,0.00011891601372532883,115.04458632559147,COMPLETE
943,0.38310644030570984,2023-09-05 15:10:20.529814,2023-09-05 15:10:24.850367,0 days 00:00:04.320553,ReLU,ReLU,,,64,6,14.0,,,0.0008224257583155205,2,312,0.6132346406915122,8.033491491323917e-05,121.12510045915202,COMPLETE
944,0.3165924549102783,2023-09-05 15:10:24.850760,2023-09-05 15:10:26.919590,0 days 00:00:02.068830,ReLU,Tanh,,,67,24,13.0,,,0.0005953292928763075,2,417,0.7265954938504017,1.3373198487236992e-05,111.48724778493245,COMPLETE
945,0.37140944600105286,2023-09-05 15:10:26.919974,2023-09-05 15:10:29.865254,0 days 00:00:02.945280,ReLU,Tanh,,,68,24,13.0,,,0.0004022657286108769,2,409,0.7322949703473072,5.8983780790259705e-05,125.19059179821154,COMPLETE
946,0.33552780747413635,2023-09-05 15:10:29.865634,2023-09-05 15:10:30.400278,0 days 00:00:00.534644,ReLU,Tanh,Leaky,,69,22,13.0,6.0,,0.03571147406711292,3,418,0.7753151682714946,3.120858193931573e-05,115.0002564324273,COMPLETE
947,0.3344796597957611,2023-09-05 15:10:30.400664,2023-09-05 15:10:34.467397,0 days 00:00:04.066733,ReLU,Tanh,,,70,23,16.0,,,0.00053181945855743,2,408,0.7243850594943222,1.3094518595051549e-05,132.48449135804788,COMPLETE
948,0.3889240622520447,2023-09-05 15:10:34.467787,2023-09-05 15:10:37.114634,0 days 00:00:02.646847,ReLU,Leaky,,,67,24,13.0,,,0.000349169842601287,2,421,0.31723753084370593,1.5615193489969495e-05,177.9423368165819,COMPLETE
949,0.45705345273017883,2023-09-05 15:10:37.115028,2023-09-05 15:10:38.170810,0 days 00:00:01.055782,Leaky,Tanh,,,67,16,16.0,,,0.0011566065228010146,2,415,0.17634092730564643,2.536091857301262e-05,212.56344407328058,COMPLETE
950,0.39803749322891235,2023-09-05 15:10:38.171197,2023-09-05 15:10:43.755281,0 days 00:00:05.584084,ReLU,Tanh,,,70,7,13.0,,,0.0006303885611590092,2,430,0.7438905845083984,1.8666306874367006e-05,123.71118505073316,COMPLETE
951,0.4385709762573242,2023-09-05 15:10:43.755669,2023-09-05 15:10:44.018236,0 days 00:00:00.262567,ReLU,Tanh,,,72,13,12.0,,,0.09688296175089789,2,402,0.2161538506366372,1.192789585126052e-05,164.1078154465248,COMPLETE
952,0.42019200325012207,2023-09-05 15:10:44.018625,2023-09-05 15:10:46.073275,0 days 00:00:02.054650,ReLU,Tanh,,,67,8,14.0,,,0.0016234378775247089,2,423,0.6966511863086329,2.2767952484965714e-05,155.15296615600585,COMPLETE
953,0.4857567250728607,2023-09-05 15:10:46.073672,2023-09-05 15:10:55.888839,0 days 00:00:09.815167,ReLU,Tanh,,,66,23,12.0,,,1.6295972787792775e-05,2,413,0.7996131774108581,1.4514368036152071e-05,110.53366280987534,COMPLETE
954,0.38232824206352234,2023-09-05 15:10:55.889231,2023-09-05 15:11:02.072602,0 days 00:00:06.183371,Sigmoid,Tanh,,,69,17,16.0,,,0.00045594889885559235,2,434,0.49343259218615015,1.3916983547472123e-05,155.9294898389122,COMPLETE
955,0.40033817291259766,2023-09-05 15:11:02.073041,2023-09-05 15:11:04.399487,0 days 00:00:02.326446,ReLU,Tanh,,,50,24,13.0,,,0.0007142959728765784,2,395,0.3404243917813538,2.7273367110856137e-05,113.67637282151442,COMPLETE
956,0.317667692899704,2023-09-05 15:11:04.399865,2023-09-05 15:11:06.665879,0 days 00:00:02.266014,ReLU,Tanh,,,74,14,14.0,,,0.0032883315660649248,2,420,0.7535502175755836,1.989193595818666e-05,126.52882191051137,COMPLETE
957,0.48008936643600464,2023-09-05 15:11:06.666251,2023-09-05 15:11:07.036597,0 days 00:00:00.370346,ReLU,Tanh,,,74,14,14.0,,,0.0030809801078982837,2,424,0.11289269211970385,1.9092421240772098e-05,154.12509146796333,COMPLETE
958,0.3143607974052429,2023-09-05 15:11:07.036986,2023-09-05 15:11:08.368110,0 days 00:00:01.331124,ReLU,Tanh,,,74,14,13.0,,,0.002247837110671746,2,406,0.7654522562855995,0.0005629987118821386,131.2631151753087,COMPLETE
959,0.3516947031021118,2023-09-05 15:11:08.368483,2023-09-05 15:11:10.052597,0 days 00:00:01.684114,ReLU,Tanh,,,77,14,13.0,,,0.0027379230099481584,2,403,0.7664746500857024,1.7994924476449746e-05,154.4881241798401,COMPLETE
960,0.4096958041191101,2023-09-05 15:11:10.053002,2023-09-05 15:11:11.465356,0 days 00:00:01.412354,Leaky,Tanh,,,76,14,14.0,,,0.0035959782461120176,2,413,0.7510991693435533,0.0005355564732288577,168.48930370273874,COMPLETE
961,0.3626464903354645,2023-09-05 15:11:11.465721,2023-09-05 15:11:13.674052,0 days 00:00:02.208331,ReLU,Tanh,,,76,13,14.0,,,0.00357839321893408,2,398,0.7713533690878833,1.048660877150154e-05,209.39481593540737,COMPLETE
962,0.40516307950019836,2023-09-05 15:11:13.674432,2023-09-05 15:11:13.867649,0 days 00:00:00.193217,ReLU,Tanh,,,74,14,13.0,,,0.04860565253839671,2,407,0.13056921833951562,1.134161250764274e-05,142.4839454419685,COMPLETE
963,0.40498194098472595,2023-09-05 15:11:13.868030,2023-09-05 15:11:22.080627,0 days 00:00:08.212597,ReLU,Tanh,,,74,14,14.0,,,2.5367095940614868e-05,2,393,0.7741896970563709,2.0333852706459987e-05,127.06864463281995,COMPLETE
964,0.37111011147499084,2023-09-05 15:11:22.081034,2023-09-05 15:11:23.875123,0 days 00:00:01.794089,ReLU,Tanh,,,78,13,13.0,,,0.0024218024363300006,2,404,0.7413835150696919,3.4523188075152614e-05,124.32474288940429,COMPLETE
965,0.3412110507488251,2023-09-05 15:11:23.875582,2023-09-05 15:11:26.536611,0 days 00:00:02.661029,ReLU,Tanh,,,73,13,12.0,,,0.002901462857631073,2,418,0.7734485243524778,0.0005505024292369655,124.52579051692311,COMPLETE
