number,value,datetime_start,datetime_complete,duration,params_activation1,params_activation2,params_activation3,params_activation4,params_batch_size,params_fl1,params_fl2,params_fl3,params_fl4,params_learning_rate,params_n_layers,params_num_epochs,params_train_size,params_weight_decay,user_attrs_mre,state
1354,0.38936665654182434,2023-09-05 15:23:08.823474,2023-09-05 15:23:09.737731,0 days 00:00:00.914257,ReLU,ReLU,,,44,17,5.0,,,0.02107968861183607,2,367,0.5740518537873353,0.006120109349111277,151.4998073577881,COMPLETE
1355,0.3953450918197632,2023-09-05 15:23:09.738145,2023-09-05 15:23:10.517038,0 days 00:00:00.778893,ReLU,ReLU,,,44,18,6.0,,,0.03346376749178247,2,373,0.7964111202451682,0.00024066086590909526,124.95858764648438,COMPLETE
1356,0.5637169480323792,2023-09-05 15:23:10.517454,2023-09-05 15:23:20.379905,0 days 00:00:09.862451,Leaky,ReLU,,,47,17,3.0,,,1.4479676797303413e-05,2,356,0.7984138135124534,0.004286095388565456,141.45338898562312,COMPLETE
1357,0.39120548963546753,2023-09-05 15:23:20.380322,2023-09-05 15:23:21.406269,0 days 00:00:01.025947,Sigmoid,ReLU,,,49,17,9.0,,,0.008659291076994665,2,183,0.7986985800950944,0.00018804697584417173,128.37508501325334,COMPLETE
1358,0.37461012601852417,2023-09-05 15:23:21.406694,2023-09-05 15:23:22.114732,0 days 00:00:00.708038,ReLU,ReLU,,,45,17,6.0,,,0.006352349711674428,2,365,0.7455488908765991,0.0032093444017584362,111.00659975798234,COMPLETE
1359,0.38292986154556274,2023-09-05 15:23:22.115164,2023-09-05 15:23:22.406484,0 days 00:00:00.291320,ReLU,ReLU,,,47,17,8.0,,,0.014205498699476961,2,107,0.12241525074265146,0.0051969598279624635,146.26924861561167,COMPLETE
1360,0.32396918535232544,2023-09-05 15:23:22.406909,2023-09-05 15:23:23.327369,0 days 00:00:00.920460,ReLU,ReLU,,,43,16,9.0,,,0.0034399037059528706,2,355,0.5429696908235474,9.157842853003602e-05,103.22002719697498,COMPLETE
1361,0.3663384020328522,2023-09-05 15:23:23.327786,2023-09-05 15:23:24.320648,0 days 00:00:00.992862,ReLU,ReLU,,,49,18,10.0,,,0.002470638055202064,2,347,0.3088320745642336,0.003825862409327503,160.43532393699468,COMPLETE
1362,0.3558131456375122,2023-09-05 15:23:24.321102,2023-09-05 15:23:25.708099,0 days 00:00:01.386997,Tanh,ReLU,,,47,17,5.0,,,0.0017338150434564694,2,379,0.5050552337544341,0.00025973231060647043,113.28582606903494,COMPLETE
1363,0.36132919788360596,2023-09-05 15:23:25.708542,2023-09-05 15:23:28.004408,0 days 00:00:02.295866,Leaky,ReLU,,,45,18,8.0,,,0.0009215457717846995,2,361,0.6843358197451699,0.00016583744875148216,120.19468816121419,COMPLETE
1364,0.43540167808532715,2023-09-05 15:23:28.004831,2023-09-05 15:23:33.469354,0 days 00:00:05.464523,ReLU,ReLU,,,41,16,10.0,,,0.0001043486406031794,2,350,0.40636542019412414,0.001000635053698659,156.83075190952846,COMPLETE
1365,0.5619385242462158,2023-09-05 15:23:33.469758,2023-09-05 15:23:33.786260,0 days 00:00:00.316502,ReLU,ReLU,,,43,2,5.0,,,0.0022431173718952813,2,373,0.10573883664200165,0.0003272542412294661,232.00214658464705,COMPLETE
1366,0.5213742256164551,2023-09-05 15:23:33.786676,2023-09-05 15:23:38.983828,0 days 00:00:05.197152,ReLU,ReLU,,,48,17,8.0,,,4.833132179281136e-05,2,338,0.44057298238146525,0.003021599775144173,131.6300779940814,COMPLETE
1367,0.42725813388824463,2023-09-05 15:23:38.984263,2023-09-05 15:23:47.859239,0 days 00:00:08.874976,Leaky,ReLU,,,51,17,7.0,,,4.927459787489894e-05,2,359,0.7503493099304701,0.0024937276078597303,133.9212606105964,COMPLETE
1368,0.6066756844520569,2023-09-05 15:23:47.859654,2023-09-05 15:23:56.106509,0 days 00:00:08.246855,ReLU,ReLU,,,45,16,7.0,,,1.999663675879853e-05,2,344,0.6515203026085802,4.582000977208e-05,143.75944720867068,COMPLETE
1369,0.3748170733451843,2023-09-05 15:23:56.106944,2023-09-05 15:23:57.242217,0 days 00:00:01.135273,ReLU,ReLU,,,47,16,11.0,,,0.004840393394608881,2,376,0.7997474421280445,0.021618298631058845,110.43645095825195,COMPLETE
1370,0.5755641460418701,2023-09-05 15:23:57.242641,2023-09-05 15:24:06.703756,0 days 00:00:09.461115,ReLU,ReLU,,,42,18,4.0,,,1.3217494297843881e-05,2,354,0.7113265846116216,0.00022284073720648035,138.43966640321548,COMPLETE
1371,0.4985784888267517,2023-09-05 15:24:06.704175,2023-09-05 15:24:08.091672,0 days 00:00:01.387497,ReLU,ReLU,,,50,16,1.0,,,0.0011486894523778245,2,334,0.33915749400122314,4.079317108427177e-05,141.1569207290123,COMPLETE
1372,0.37031373381614685,2023-09-05 15:24:08.092088,2023-09-05 15:24:08.748756,0 days 00:00:00.656668,Leaky,ReLU,,,38,21,10.0,,,0.011712015672278945,2,365,0.7445280989019528,1.6704893198606953e-05,1751.8328985916942,COMPLETE
1373,0.42502909898757935,2023-09-05 15:24:08.749195,2023-09-05 15:24:09.831623,0 days 00:00:01.082428,ReLU,ReLU,,,52,17,8.0,,,0.002875922646456931,2,340,0.7685811645902999,0.04424789843587587,166.6389850616455,COMPLETE
1374,0.34622523188591003,2023-09-05 15:24:09.832051,2023-09-05 15:24:10.726222,0 days 00:00:00.894171,ReLU,ReLU,Tanh,Tanh,42,10,15.0,23.0,17.0,0.0019718449387207157,4,372,0.6042143167102794,0.006271609758877814,134.8698095703125,COMPLETE
1375,0.3444778323173523,2023-09-05 15:24:10.726667,2023-09-05 15:24:12.387661,0 days 00:00:01.660994,ReLU,ReLU,,,34,16,15.0,,,0.0014337728210570815,2,350,0.6804442225804467,1.4546438512687124e-05,118.41308248267984,COMPLETE
1376,0.3742233216762543,2023-09-05 15:24:12.388098,2023-09-05 15:24:13.228110,0 days 00:00:00.840012,Leaky,ReLU,,,46,17,7.0,,,0.004037253404727517,2,332,0.31971311524214885,0.00038046148036022714,143.19710575450551,COMPLETE
1377,0.3284471035003662,2023-09-05 15:24:13.228531,2023-09-05 15:24:17.880433,0 days 00:00:04.651902,ReLU,ReLU,,,49,18,11.0,,,0.00028800016100256887,2,364,0.7132900417756421,0.00010667434453435772,111.8365744326977,COMPLETE
1378,0.40295085310935974,2023-09-05 15:24:17.880852,2023-09-05 15:24:24.465458,0 days 00:00:06.584606,ReLU,ReLU,,,40,16,11.0,,,0.00013004850554825133,2,343,0.4926808495313205,3.134390668933505e-05,138.95384287486618,COMPLETE
1379,0.3250665068626404,2023-09-05 15:24:24.465876,2023-09-05 15:24:29.792506,0 days 00:00:05.326630,Sigmoid,ReLU,,,36,16,15.0,,,0.0007978252247762712,2,210,0.7352874505266518,0.0014029674307418194,111.72853142874581,COMPLETE
1380,0.40604501962661743,2023-09-05 15:24:29.792928,2023-09-05 15:24:30.691620,0 days 00:00:00.898692,ReLU,Sigmoid,,,54,17,15.0,,,0.005553266803321334,2,378,0.2583888253401121,0.004960605185658957,124.4852155183491,COMPLETE
1381,0.3407706618309021,2023-09-05 15:24:30.692038,2023-09-05 15:24:31.631762,0 days 00:00:00.939724,Leaky,ReLU,,,45,16,14.0,,,0.0026065437499015083,2,353,0.7710334994749589,7.262148332770342e-05,123.29834525815902,COMPLETE
1382,0.37651222944259644,2023-09-05 15:24:31.632174,2023-09-05 15:24:33.202237,0 days 00:00:01.570063,ReLU,ReLU,,,32,16,12.0,,,0.0034112983308919867,2,329,0.6975069940875529,0.0002786753187996945,145.68289582625678,COMPLETE
1383,0.39880460500717163,2023-09-05 15:24:33.202718,2023-09-05 15:24:33.513911,0 days 00:00:00.311193,ReLU,ReLU,,,38,9,9.0,,,0.015540357558312304,2,369,0.11537541726651507,1.222846586418206e-05,237.7237777709961,COMPLETE
1384,0.4135130047798157,2023-09-05 15:24:33.514330,2023-09-05 15:24:38.452293,0 days 00:00:04.937963,ReLU,ReLU,,,48,17,14.0,,,6.461071910779095e-05,2,360,0.3634595618890239,0.00013626692761803012,141.9424384435018,COMPLETE
1385,0.4331851005554199,2023-09-05 15:24:38.452745,2023-09-05 15:24:39.689499,0 days 00:00:01.236754,ReLU,,,,57,8,,,,0.001084751444788468,1,343,0.14021555965692373,2.5894724472209606e-05,158.04303130075988,COMPLETE
1386,0.4076346457004547,2023-09-05 15:24:39.689921,2023-09-05 15:24:40.720087,0 days 00:00:01.030166,Tanh,ReLU,,,35,15,15.0,,,0.0017283819868076158,2,148,0.4318450059874043,0.0084219932038079,216.35830719616948,COMPLETE
1387,0.4039076864719391,2023-09-05 15:24:40.720526,2023-09-05 15:24:41.411044,0 days 00:00:00.690518,Leaky,ReLU,,,43,11,14.0,,,0.0021115330827601274,2,383,0.13843339687845893,0.00020773188759651452,118.09412125053755,COMPLETE
1388,0.38862505555152893,2023-09-05 15:24:41.411471,2023-09-05 15:24:49.118947,0 days 00:00:07.707476,ReLU,ReLU,,,51,18,12.0,,,6.784087264674036e-05,2,356,0.6557339356985492,2.3528305395132308e-05,141.72931819015673,COMPLETE
1389,0.41360214352607727,2023-09-05 15:24:49.119385,2023-09-05 15:24:49.580256,0 days 00:00:00.460871,ReLU,ReLU,,,40,22,15.0,,,0.008959239052236613,2,237,0.27506121191138766,0.0040568711538116935,154.5840549468994,COMPLETE
1390,0.4074842035770416,2023-09-05 15:24:49.580683,2023-09-05 15:25:01.527413,0 days 00:00:11.946730,ReLU,ReLU,,,30,15,10.0,,,9.241097508672997e-05,2,329,0.7458285165928769,0.001974826978283924,149.3971844936939,COMPLETE
1391,0.6115483045578003,2023-09-05 15:25:01.527852,2023-09-05 15:25:06.829412,0 days 00:00:05.301560,Leaky,Sigmoid,,,53,17,11.0,,,2.878062604767829e-05,2,347,0.4665044210778065,0.001190306829339494,763.461066078384,COMPLETE
1392,0.3452916443347931,2023-09-05 15:25:06.829843,2023-09-05 15:25:07.166589,0 days 00:00:00.336746,ReLU,ReLU,,,46,16,7.0,,,0.011205041458154987,2,374,0.1887532596857162,0.000347485023713327,134.22731929355197,COMPLETE
1393,0.3704919219017029,2023-09-05 15:25:07.167016,2023-09-05 15:25:09.630075,0 days 00:00:02.463059,ReLU,ReLU,,,33,15,14.0,,,0.0013886816209330922,2,365,0.632359249966824,5.6991249166362385e-05,174.44291360037667,COMPLETE
1394,0.5294187068939209,2023-09-05 15:25:09.630514,2023-09-05 15:25:19.018719,0 days 00:00:09.388205,ReLU,ReLU,,,44,4,13.0,,,3.144089850929298e-05,2,340,0.7694275290828702,3.812531761761784e-05,145.47695043227253,COMPLETE
1395,0.8453242778778076,2023-09-05 15:25:19.019158,2023-09-05 15:25:21.905552,0 days 00:00:02.886394,ReLU,ReLU,,,49,8,6.0,,,1.1103383982392529e-05,2,218,0.38642114506250885,0.00040517351556096143,323.06045581222673,COMPLETE
1396,0.3797012269496918,2023-09-05 15:25:21.905979,2023-09-05 15:25:24.001369,0 days 00:00:02.095390,Leaky,ReLU,,,37,9,14.0,,,0.002928641962437174,2,352,0.7997400882369021,1.00336033058543e-05,125.20825170298092,COMPLETE
1397,0.4081410765647888,2023-09-05 15:25:24.001809,2023-09-05 15:25:25.599602,0 days 00:00:01.597793,ReLU,ReLU,,,41,6,12.0,,,0.0007529578870490697,2,74,0.5411505042323386,0.0002477958016041854,228.62357990161792,COMPLETE
1398,0.3744075298309326,2023-09-05 15:25:25.600015,2023-09-05 15:25:26.018507,0 days 00:00:00.418492,ReLU,ReLU,,,35,3,14.0,,,0.023343166604780332,2,385,0.2304765320457586,0.0001588946389671297,207.2529807457557,COMPLETE
1399,0.41745269298553467,2023-09-05 15:25:26.018929,2023-09-05 15:25:27.496475,0 days 00:00:01.477546,ReLU,ReLU,,,38,12,2.0,,,0.0009921017785510405,2,337,0.14968256764105167,0.001724381626379527,146.07908633761934,COMPLETE
1400,0.30490392446517944,2023-09-05 15:25:27.496894,2023-09-05 15:25:28.507872,0 days 00:00:01.010978,Leaky,ReLU,,,47,15,15.0,,,0.004181137251573286,2,361,0.723427493395925,1.8847227039472242e-05,113.91001191010346,COMPLETE
1401,0.38096821308135986,2023-09-05 15:25:28.508301,2023-09-05 15:25:29.572176,0 days 00:00:01.063875,Leaky,ReLU,,,47,15,15.0,,,0.003899015614210997,2,366,0.7194745746328377,1.9825859522054876e-05,119.69078983404698,COMPLETE
1402,0.3682848811149597,2023-09-05 15:25:29.572610,2023-09-05 15:25:31.328929,0 days 00:00:01.756319,Leaky,Sigmoid,,,48,16,15.0,,,0.004336412212331321,2,371,0.6889717648013451,1.604084478509964e-05,138.1240369769889,COMPLETE
1403,0.31645312905311584,2023-09-05 15:25:31.329360,2023-09-05 15:25:32.066145,0 days 00:00:00.736785,Leaky,ReLU,,,85,15,15.0,,,0.003431477129375721,2,360,0.7685248494037047,1.3395995408450615e-05,209.2257482740614,COMPLETE
1404,0.3458371162414551,2023-09-05 15:25:32.066585,2023-09-05 15:25:33.285548,0 days 00:00:01.218963,Leaky,ReLU,,,50,15,16.0,,,0.005202398600672098,2,379,0.531803882427838,1.2450847258506297e-05,106.40056300163269,COMPLETE
1405,0.3439558148384094,2023-09-05 15:25:33.285991,2023-09-05 15:25:35.400906,0 days 00:00:02.114915,Leaky,ReLU,,,45,15,3.0,,,0.003316756366876358,2,375,0.6666677360407571,2.6055519315246107e-05,139.57292441434637,COMPLETE
1406,0.39830145239830017,2023-09-05 15:25:35.401338,2023-09-05 15:25:36.199673,0 days 00:00:00.798335,Leaky,ReLU,,,48,15,15.0,,,0.0040800130826728915,2,368,0.29656415360666893,2.0146230959922645e-05,122.80697003532859,COMPLETE
1407,0.32668888568878174,2023-09-05 15:25:36.200104,2023-09-05 15:25:37.098813,0 days 00:00:00.898709,Leaky,ReLU,,,46,16,16.0,,,0.005584166893714851,2,366,0.7301928773753853,1.4434959369745583e-05,126.57849955558777,COMPLETE
1408,0.40338724851608276,2023-09-05 15:25:37.099256,2023-09-05 15:25:44.742110,0 days 00:00:07.642854,Leaky,ReLU,,,47,15,15.0,,,0.00018873692827376458,2,359,0.6163294166969594,1.894374564171805e-05,130.79650885281788,COMPLETE
1409,0.34001001715660095,2023-09-05 15:25:44.742539,2023-09-05 15:25:46.272752,0 days 00:00:01.530213,Leaky,ReLU,,,45,16,15.0,,,0.002782618708411981,2,380,0.5754959056327227,1.2118443913811005e-05,127.1348608834403,COMPLETE
1410,0.44142717123031616,2023-09-05 15:25:46.273183,2023-09-05 15:25:46.883033,0 days 00:00:00.609850,Leaky,ReLU,,,44,15,16.0,,,0.006628993132505533,2,358,0.3744649005726033,0.0008364809378795414,241.67060435901988,COMPLETE
1411,0.38333940505981445,2023-09-05 15:25:46.883465,2023-09-05 15:25:48.656578,0 days 00:00:01.773113,Leaky,ReLU,,,43,15,15.0,,,0.0025132869547732405,2,374,0.7460422273983786,0.018588386781913747,110.48014301364705,COMPLETE
1412,0.6015270352363586,2023-09-05 15:25:48.657017,2023-09-05 15:25:52.113835,0 days 00:00:03.456818,Leaky,Sigmoid,,,51,16,15.0,,,3.60755000416009e-05,2,387,0.2633353805912532,1.5462265844268445e-05,144.85228772619283,COMPLETE
1413,0.3000358045101166,2023-09-05 15:25:52.114268,2023-09-05 15:25:54.014207,0 days 00:00:01.899939,Leaky,ReLU,,,48,15,15.0,,,0.0033276605468057726,2,355,0.7985526770588582,0.0002941710560624774,119.32839328139576,COMPLETE
1414,0.32522186636924744,2023-09-05 15:25:54.014631,2023-09-05 15:25:55.039542,0 days 00:00:01.024911,Leaky,ReLU,,,49,16,16.0,,,0.003485970674743775,2,366,0.7999402733716213,0.00030892108534131966,119.40159040178571,COMPLETE
1415,0.35421788692474365,2023-09-05 15:25:55.039970,2023-09-05 15:25:56.617060,0 days 00:00:01.577090,Leaky,ReLU,,,48,16,16.0,,,0.004135350441912238,2,359,0.7705898878195659,0.0004485732421099654,160.74663168923897,COMPLETE
1416,0.3891552984714508,2023-09-05 15:25:56.617486,2023-09-05 15:25:57.967413,0 days 00:00:01.349927,Leaky,ReLU,,,50,15,15.0,,,0.002948803672899494,2,376,0.7992312638089232,0.036448549173175485,139.97353777678117,COMPLETE
1417,0.36875224113464355,2023-09-05 15:25:57.967843,2023-09-05 15:25:58.823742,0 days 00:00:00.855899,Leaky,ReLU,,,47,15,15.0,,,0.004513484721113802,2,355,0.7710504999285946,2.2297599213884536e-05,114.3759897166285,COMPLETE
1418,0.4158180058002472,2023-09-05 15:25:58.824177,2023-09-05 15:25:59.123654,0 days 00:00:00.299477,Leaky,ReLU,,,50,16,16.0,,,0.0034924158639350463,2,387,0.1063841832157399,0.0001858835857261969,144.7899522261186,COMPLETE
1419,0.41301316022872925,2023-09-05 15:25:59.124089,2023-09-05 15:25:59.548428,0 days 00:00:00.424339,Leaky,ReLU,,,46,15,15.0,,,0.003339810713194307,2,365,0.15290666381583173,1.6977332816234238e-05,119.09993317167638,COMPLETE
1420,0.39476853609085083,2023-09-05 15:25:59.548861,2023-09-05 15:26:00.927169,0 days 00:00:01.378308,Leaky,ReLU,,,49,16,16.0,,,0.0025159534004752437,2,352,0.5088553027764363,0.00026741605150253865,345.10749674479166,COMPLETE
1421,0.34532466530799866,2023-09-05 15:26:00.927613,2023-09-05 15:26:03.194547,0 days 00:00:02.266934,Leaky,ReLU,,,52,15,15.0,,,0.003120811655435926,2,380,0.7993704808059039,2.9766020850606946e-05,107.02699031600032,COMPLETE
1422,0.3447818458080292,2023-09-05 15:26:03.194973,2023-09-05 15:26:04.449593,0 days 00:00:01.254620,Leaky,Sigmoid,,,47,15,15.0,,,0.005050160264769844,2,391,0.41092838746493515,0.0009514042935866813,110.99717612015574,COMPLETE
1423,0.6259261965751648,2023-09-05 15:26:04.450027,2023-09-05 15:26:04.917383,0 days 00:00:00.467356,Leaky,ReLU,,,48,16,15.0,,,0.003970856556468637,2,366,0.34571954724960835,0.07750649529659862,177.30401709771925,COMPLETE
1424,0.338144987821579,2023-09-05 15:26:04.917815,2023-09-05 15:26:07.032231,0 days 00:00:02.114416,Leaky,ReLU,,,49,17,15.0,,,0.0026178449474704916,2,351,0.7631003000897588,0.00048093410133240566,114.53718983968099,COMPLETE
1425,0.3124074339866638,2023-09-05 15:26:07.032660,2023-09-05 15:26:08.482425,0 days 00:00:01.449765,Leaky,ReLU,,,46,16,16.0,,,0.002170319556699024,2,372,0.7453857541331341,1.1708405739631179e-05,111.21301034780649,COMPLETE
1426,0.4103553891181946,2023-09-05 15:26:08.482855,2023-09-05 15:26:09.599104,0 days 00:00:01.116249,Leaky,ReLU,,,52,15,15.0,,,0.004523614500189667,2,360,0.437007364291534,0.0261218032112912,120.12952706473214,COMPLETE
1427,0.4403190314769745,2023-09-05 15:26:09.599543,2023-09-05 15:26:09.996736,0 days 00:00:00.397193,Leaky,ReLU,,,45,17,15.0,,,0.006653443096745045,2,349,0.13074944172276584,0.0006955897382203311,305.41673453909453,COMPLETE
1428,0.42068594694137573,2023-09-05 15:26:09.997169,2023-09-05 15:26:10.467189,0 days 00:00:00.470020,Leaky,ReLU,,,51,16,14.0,,,0.0030683311336961207,2,384,0.1097574579735436,1.0132644046891838e-05,125.37713106714114,COMPLETE
1429,0.41584640741348267,2023-09-05 15:26:10.467615,2023-09-05 15:26:12.004072,0 days 00:00:01.536457,Leaky,ReLU,,,49,15,16.0,,,0.002317415693222802,2,373,0.7096862044426977,0.0003337453418451919,148.89917942735016,COMPLETE
1430,0.3586908280849457,2023-09-05 15:26:12.004533,2023-09-05 15:26:12.419382,0 days 00:00:00.414849,Leaky,ReLU,,,46,16,14.0,,,0.0036773163396512667,2,359,0.20142217416166103,0.0027540037320252,127.59193640814887,COMPLETE
1431,0.39784881472587585,2023-09-05 15:26:12.419809,2023-09-05 15:26:13.596642,0 days 00:00:01.176833,Leaky,ReLU,,,47,15,15.0,,,0.0029160385690005387,2,396,0.48324539623738744,0.0012703891847002159,169.04977150568885,COMPLETE
1432,0.4057835340499878,2023-09-05 15:26:13.597073,2023-09-05 15:26:14.295254,0 days 00:00:00.698181,Leaky,Sigmoid,,,54,21,15.0,,,0.007666369288266396,2,200,0.771079436922436,0.002162628076939143,153.28033599853515,COMPLETE
1433,0.3886853754520416,2023-09-05 15:26:14.295760,2023-09-05 15:26:15.085763,0 days 00:00:00.790003,Leaky,ReLU,,,44,18,14.0,,,0.07608999249608499,2,348,0.7286293154647567,0.00022105832096386142,158.07202119093674,COMPLETE
1434,0.36120980978012085,2023-09-05 15:26:15.086201,2023-09-05 15:26:16.581689,0 days 00:00:01.495488,Leaky,ReLU,,,43,15,16.0,,,0.001980905052198419,2,177,0.7691328167297115,0.00010418958037775314,112.77112887768035,COMPLETE
1435,0.4577564299106598,2023-09-05 15:26:16.582152,2023-09-05 15:26:23.364487,0 days 00:00:06.782335,Leaky,ReLU,,,52,17,15.0,,,1.7101420798106173e-05,2,256,0.7996070913662018,0.03247217367629461,134.45688179135323,COMPLETE
1436,0.39504092931747437,2023-09-05 15:26:23.364936,2023-09-05 15:26:24.131068,0 days 00:00:00.766132,Leaky,ReLU,,,48,16,14.0,,,0.005214952424274877,2,379,0.5811806258878087,0.024251744383079255,132.8582265517291,COMPLETE
1437,0.6399204134941101,2023-09-05 15:26:24.131507,2023-09-05 15:26:24.693424,0 days 00:00:00.561917,Leaky,ReLU,,,50,1,14.0,,,0.046458976327239034,2,364,0.454112025435737,0.0003963439666234107,252.65774488449097,COMPLETE
1438,0.34314727783203125,2023-09-05 15:26:24.693873,2023-09-05 15:26:26.218121,0 days 00:00:01.524248,Leaky,ReLU,,,45,10,14.0,,,0.0036570457710861965,2,391,0.686424429509849,1.5120710734728479e-05,105.93863341767909,COMPLETE
1439,0.3324553370475769,2023-09-05 15:26:26.218567,2023-09-05 15:26:28.434816,0 days 00:00:02.216249,Leaky,ReLU,,,42,5,15.0,,,0.002345604030026375,2,356,0.7397850947676738,3.3740300870853987e-05,103.82925969904119,COMPLETE
1440,0.3889096975326538,2023-09-05 15:26:28.435253,2023-09-05 15:26:29.789750,0 days 00:00:01.354497,Leaky,ReLU,,,55,16,16.0,,,0.0017814857659127355,2,226,0.6426512076329847,0.00012701144864010196,130.85702896118164,COMPLETE
1441,0.30860134959220886,2023-09-05 15:26:29.790212,2023-09-05 15:26:30.489255,0 days 00:00:00.699043,Leaky,ReLU,,,47,15,15.0,,,0.004545996002316069,2,369,0.7694043938550724,0.0005212219951392067,122.18981767737347,COMPLETE
1442,0.45571860671043396,2023-09-05 15:26:30.489711,2023-09-05 15:26:30.883168,0 days 00:00:00.393457,Leaky,ReLU,,,51,15,14.0,,,0.0038005524581595494,2,372,0.12833908168214672,0.0005367908791698918,175.2465428594333,COMPLETE
1443,0.41963595151901245,2023-09-05 15:26:30.883636,2023-09-05 15:26:31.948130,0 days 00:00:01.064494,Leaky,Sigmoid,,,88,15,15.0,,,0.004330743111239715,2,380,0.7005716691053445,0.00068713966664029,149.18698654174804,COMPLETE
1444,0.3236181139945984,2023-09-05 15:26:31.948552,2023-09-05 15:26:33.382655,0 days 00:00:01.434103,Leaky,ReLU,,,49,15,14.0,,,0.004788977820726146,2,370,0.7156365260575918,0.00046082053110811964,122.05346570696149,COMPLETE
1445,0.41277503967285156,2023-09-05 15:26:33.383075,2023-09-05 15:26:35.053629,0 days 00:00:01.670554,Leaky,ReLU,,,48,15,15.0,,,0.0031686266480377085,2,382,0.6628949004028301,0.0005420171005077072,185.67183271135602,COMPLETE
1446,0.3579450249671936,2023-09-05 15:26:35.054059,2023-09-05 15:26:36.150207,0 days 00:00:01.096148,Leaky,ReLU,,,52,15,14.0,,,0.004168661287796493,2,374,0.6074038975483943,0.0005886129848031506,111.35634136199951,COMPLETE
1447,0.3757595419883728,2023-09-05 15:26:36.150636,2023-09-05 15:26:36.749272,0 days 00:00:00.598636,Leaky,ReLU,,,50,14,15.0,,,0.0049179120183493715,2,367,0.21202061168759745,7.403285310647186e-05,112.34367337434188,COMPLETE
1448,0.34622159600257874,2023-09-05 15:26:36.749699,2023-09-05 15:26:37.587375,0 days 00:00:00.837676,Leaky,ReLU,,,46,15,16.0,,,0.0038550676200290947,2,386,0.5163633195246243,2.3742082736177092e-05,109.50961099019865,COMPLETE
1449,0.39233970642089844,2023-09-05 15:26:37.587836,2023-09-05 15:26:38.440897,0 days 00:00:00.853061,Sigmoid,ReLU,,,48,15,14.0,,,0.006109334909956656,2,376,0.29619283210287956,0.0008153885507232475,124.91016795537243,COMPLETE
1450,0.4487270414829254,2023-09-05 15:26:38.441344,2023-09-05 15:26:39.463175,0 days 00:00:01.021831,Leaky,ReLU,,,53,14,14.0,,,0.0027608671660214064,2,395,0.7462519308937994,0.05323474864266199,133.43206650171524,COMPLETE
