number,value,datetime_start,datetime_complete,duration,params_activation1,params_activation2,params_activation3,params_activation4,params_batch_size,params_fl1,params_fl2,params_fl3,params_fl4,params_learning_rate,params_n_layers,params_num_epochs,params_train_size,params_weight_decay,user_attrs_mre,state
1936,0.37016719579696655,2023-09-05 15:48:24.885378,2023-09-05 15:48:25.947995,0 days 00:00:01.062617,ReLU,Tanh,,,40,24,8.0,,,0.0015444360784705466,2,365,0.3278318050249739,1.1593232921270803e-05,106.98219617207845,COMPLETE
1937,0.3445182144641876,2023-09-05 15:48:25.948475,2023-09-05 15:48:28.138644,0 days 00:00:02.190169,ReLU,ReLU,,,75,23,11.0,,,0.0005200806966171671,2,382,0.4973221353687111,0.0023768148684627792,103.1312318024812,COMPLETE
1938,0.3687395453453064,2023-09-05 15:48:28.139115,2023-09-05 15:48:32.296618,0 days 00:00:04.157503,ReLU,ReLU,,,34,21,13.0,,,0.00037586727640067687,2,423,0.5822651528390339,2.05491361622585e-05,152.8300766290403,COMPLETE
1939,0.3632248640060425,2023-09-05 15:48:32.297117,2023-09-05 15:48:33.586109,0 days 00:00:01.288992,ReLU,ReLU,,,43,22,12.0,,,0.002382412726852265,2,346,0.7291381515555495,0.001485593964163317,119.95446245060411,COMPLETE
1940,0.37486737966537476,2023-09-05 15:48:33.586596,2023-09-05 15:48:34.709083,0 days 00:00:01.122487,ReLU,ReLU,,,81,23,10.0,,,0.0011907525591746458,2,403,0.20842301216218348,0.0010677355008734957,104.43125406901042,COMPLETE
1941,0.3083779513835907,2023-09-05 15:48:34.709574,2023-09-05 15:48:36.607981,0 days 00:00:01.898407,ReLU,Tanh,,,30,22,13.0,,,0.0018933831017535724,2,329,0.6287740101954368,6.242125896599175e-05,98.30584703411972,COMPLETE
1942,0.4125605821609497,2023-09-05 15:48:36.608477,2023-09-05 15:48:37.905364,0 days 00:00:01.296887,ReLU,ReLU,,,38,24,9.0,,,0.0006099150814048571,2,393,0.12007610046528705,3.413467860875424e-05,117.74695563938307,COMPLETE
1943,0.5219937562942505,2023-09-05 15:48:37.905852,2023-09-05 15:48:47.419285,0 days 00:00:09.513433,ReLU,ReLU,,,41,23,23.0,,,1.0021515891572979e-05,2,356,0.6854131541532693,0.028573950358004807,126.16618366455764,COMPLETE
1944,0.38789093494415283,2023-09-05 15:48:47.419768,2023-09-05 15:48:48.680091,0 days 00:00:01.260323,ReLU,ReLU,,,79,24,12.0,,,0.0008172622736382605,2,452,0.7341632671001092,1.0119620965921894e-05,124.37561905384064,COMPLETE
1945,0.4105592966079712,2023-09-05 15:48:48.680597,2023-09-05 15:48:51.453308,0 days 00:00:02.772711,ReLU,ReLU,,,33,7,11.0,,,0.0009704002756183212,2,338,0.45575627677335406,1.407714196234853e-05,120.84447570074173,COMPLETE
1946,0.4107345640659332,2023-09-05 15:48:51.453789,2023-09-05 15:48:54.177211,0 days 00:00:02.723422,Sigmoid,Tanh,,,38,23,13.0,,,0.001670039032045225,2,372,0.378302310139301,0.003206625169008576,126.63763944114127,COMPLETE
1947,0.3828127384185791,2023-09-05 15:48:54.177722,2023-09-05 15:48:55.013656,0 days 00:00:00.835934,ReLU,ReLU,,,44,24,13.0,,,0.0021872710164495364,2,356,0.40207743708852056,0.017685024455379332,114.07769370565609,COMPLETE
1948,0.3200242221355438,2023-09-05 15:48:55.014138,2023-09-05 15:48:56.953671,0 days 00:00:01.939533,ReLU,Leaky,,,36,9,12.0,,,0.0013985009797737283,2,412,0.48110529757457493,0.0006412480031691085,104.98146625094944,COMPLETE
1949,0.3965451121330261,2023-09-05 15:48:56.954161,2023-09-05 15:48:57.294911,0 days 00:00:00.340750,ReLU,ReLU,,,42,21,13.0,,,0.0025640908377770827,2,384,0.10278099900562551,0.0018873329749287127,176.75345078954157,COMPLETE
1950,0.7203962206840515,2023-09-05 15:48:57.295383,2023-09-05 15:48:59.672725,0 days 00:00:02.377342,ReLU,ReLU,,,44,23,8.0,,,1.1826678180712726e-05,2,348,0.17399833169839418,2.563352453464349e-05,135.67831065736968,COMPLETE
1951,0.3566049337387085,2023-09-05 15:48:59.673203,2023-09-05 15:49:02.171003,0 days 00:00:02.497800,ReLU,ReLU,,,77,7,11.0,,,0.0010764804084290288,2,364,0.6504888433043523,7.624771385134586e-05,147.9053935108569,COMPLETE
1952,0.4105294346809387,2023-09-05 15:49:02.171486,2023-09-05 15:49:03.671915,0 days 00:00:01.500429,ReLU,ReLU,,,40,22,12.0,,,0.0004588833758181612,2,322,0.24132530666450547,0.004266316601951215,124.37493223302505,COMPLETE
1953,0.4876445233821869,2023-09-05 15:49:03.672401,2023-09-05 15:49:14.111078,0 days 00:00:10.438677,Tanh,Tanh,,,36,4,7.0,,,0.0001011593307548271,2,334,0.7489217400208174,0.0007818189444981983,153.67567832170133,COMPLETE
1954,0.35499557852745056,2023-09-05 15:49:14.111549,2023-09-05 15:49:17.186480,0 days 00:00:03.074931,ReLU,ReLU,,,45,12,11.0,,,0.0006868622887083707,2,344,0.6918097613219264,1.8255435059775238e-05,148.48484815068605,COMPLETE
1955,0.37341171503067017,2023-09-05 15:49:17.186962,2023-09-05 15:49:17.565922,0 days 00:00:00.378960,ReLU,ReLU,,,69,9,13.0,,,0.043569505148390475,2,378,0.7166145483869183,0.007691945992352071,134.2577269417899,COMPLETE
1956,0.6539020538330078,2023-09-05 15:49:17.566392,2023-09-05 15:49:18.723905,0 days 00:00:01.157513,ReLU,ReLU,,,33,8,12.0,,,0.0003480130201250612,2,354,0.14070472530626027,0.08623842405118178,153.29520137493427,COMPLETE
1957,0.5306593179702759,2023-09-05 15:49:18.724374,2023-09-05 15:49:20.397824,0 days 00:00:01.673450,ReLU,,,,42,3,,,,0.0008793712191107401,1,368,0.7657818837570824,1.1637751804169987e-05,273.1874513898577,COMPLETE
1958,0.33861789107322693,2023-09-05 15:49:20.398296,2023-09-05 15:49:22.152795,0 days 00:00:01.754499,ReLU,ReLU,,,39,10,13.0,,,0.0019873370663274145,2,419,0.5210430364102264,0.0011927793205239643,6298.571728515625,COMPLETE
1959,0.35428372025489807,2023-09-05 15:49:22.153275,2023-09-05 15:49:23.019281,0 days 00:00:00.866006,ReLU,Tanh,,,75,5,12.0,,,0.0012920556261090859,2,441,0.6703972892958417,0.00010418816142470554,112.69905369456221,COMPLETE
1960,0.36672815680503845,2023-09-05 15:49:23.019755,2023-09-05 15:49:25.178827,0 days 00:00:02.159072,ReLU,ReLU,,,35,24,9.0,,,0.0006081040511777452,2,308,0.6100957473712484,1.0009380949806444e-05,130.11337642180615,COMPLETE
1961,0.5084269046783447,2023-09-05 15:49:25.179309,2023-09-05 15:49:25.750082,0 days 00:00:00.570773,ReLU,ReLU,,,44,22,13.0,,,0.07127780869414359,2,391,0.7446349988351235,0.038781287154600594,143.60865065630745,COMPLETE
1962,0.4104841947555542,2023-09-05 15:49:25.750555,2023-09-05 15:49:26.902904,0 days 00:00:01.152349,ReLU,ReLU,,,31,23,10.0,,,0.00249466320753517,2,338,0.703854290857738,0.0028070784177409106,129.3033956712292,COMPLETE
1963,0.36836057901382446,2023-09-05 15:49:26.903380,2023-09-05 15:49:28.513866,0 days 00:00:01.610486,ReLU,ReLU,,,42,18,12.0,,,0.0017331152692446076,2,403,0.40975455463635,0.003688916506909818,249.64817151521382,COMPLETE
1964,0.4294951260089874,2023-09-05 15:49:28.514339,2023-09-05 15:49:30.556321,0 days 00:00:02.041982,Sigmoid,Tanh,,,60,19,8.0,,,0.0010704899264918418,2,358,0.20117550105396187,0.0006640494264178396,145.42463203623325,COMPLETE
1965,0.302553653717041,2023-09-05 15:49:30.556800,2023-09-05 15:49:36.393807,0 days 00:00:05.837007,ReLU,ReLU,,,78,8,13.0,,,0.0005313509847041314,2,348,0.7689254855252164,0.005557499626870629,109.69224027123782,COMPLETE
1966,0.39002636075019836,2023-09-05 15:49:36.394279,2023-09-05 15:49:42.816261,0 days 00:00:06.421982,ReLU,ReLU,,,78,13,13.0,,,0.00034415013167965263,2,366,0.7717196822883684,0.006750472492414649,143.5513933272589,COMPLETE
1967,0.3620525002479553,2023-09-05 15:49:42.816753,2023-09-05 15:49:45.024898,0 days 00:00:02.208145,ReLU,ReLU,,,80,23,13.0,,,0.0006129479905714507,2,357,0.77847686440177,0.005867591270461024,116.66249540873936,COMPLETE
1968,0.381343275308609,2023-09-05 15:49:45.025372,2023-09-05 15:49:47.276721,0 days 00:00:02.251349,ReLU,Leaky,,,70,24,13.0,,,0.000551691919520291,2,373,0.7986015453619565,0.00533289152796193,119.65605231558922,COMPLETE
1969,0.3790045380592346,2023-09-05 15:49:47.277201,2023-09-05 15:49:51.392358,0 days 00:00:04.115157,Tanh,ReLU,,,82,7,13.0,,,0.00034903930193875703,2,360,0.7683714669950109,0.006642004935951551,135.21870697578882,COMPLETE
1970,0.32680031657218933,2023-09-05 15:49:51.392831,2023-09-05 15:49:56.565610,0 days 00:00:05.172779,ReLU,ReLU,,,81,8,13.0,,,0.0004312589311672671,2,349,0.7448836311237549,0.004513901885439114,101.32249728116122,COMPLETE
1971,0.4373602867126465,2023-09-05 15:49:56.566085,2023-09-05 15:49:59.396845,0 days 00:00:02.830760,ReLU,Tanh,,,78,9,12.0,,,0.000482650740515168,2,379,0.7698073002810726,0.009272456380305888,133.0633943228886,COMPLETE
1972,0.3811734616756439,2023-09-05 15:49:59.397328,2023-09-05 15:50:03.238297,0 days 00:00:03.840969,ReLU,ReLU,,,81,19,13.0,,,0.0004708021623316779,2,369,0.7409189836128861,0.0060473994804539355,218.7813044427668,COMPLETE
1973,0.34684503078460693,2023-09-05 15:50:03.238770,2023-09-05 15:50:06.863608,0 days 00:00:03.624838,ReLU,ReLU,,,83,11,12.0,,,0.0005445695583421047,2,348,0.766340090718699,0.005317320996470915,101.06594998074561,COMPLETE
1974,0.35493651032447815,2023-09-05 15:50:06.864082,2023-09-05 15:50:08.989241,0 days 00:00:02.125159,ReLU,ReLU,,,78,24,13.0,,,0.0006747187801861698,2,430,0.36025257619581746,0.004758020634068466,105.50517841685902,COMPLETE
1975,0.4284264147281647,2023-09-05 15:50:08.989725,2023-09-05 15:50:11.557097,0 days 00:00:02.567372,ReLU,ReLU,,,80,18,12.0,,,0.0005244738759075856,2,362,0.3586166942243998,4.957685031564326e-05,142.68815180834602,COMPLETE
1976,0.46451348066329956,2023-09-05 15:50:11.557579,2023-09-05 15:50:15.868333,0 days 00:00:04.310754,ReLU,Tanh,,,77,10,13.0,,,0.0007224351361016953,2,353,0.7982285543521838,0.0073126880259698586,170.707316596553,COMPLETE
1977,0.3615410327911377,2023-09-05 15:50:15.868808,2023-09-05 15:50:21.137518,0 days 00:00:05.268710,ReLU,ReLU,,,78,21,13.0,,,0.0004184009774337209,2,393,0.5428976972202313,0.008236712607001245,162.79378199206732,COMPLETE
1978,0.6890822052955627,2023-09-05 15:50:21.138013,2023-09-05 15:50:28.023164,0 days 00:00:06.885151,ReLU,ReLU,,,79,6,12.0,,,1.294080781499591e-05,2,382,0.7291652295565418,4.8579621235877184e-05,158.27250949000813,COMPLETE
1979,0.4976878762245178,2023-09-05 15:50:28.023637,2023-09-05 15:50:31.868465,0 days 00:00:03.844828,ReLU,ReLU,,,100,23,13.0,,,2.5576395214656002e-05,2,366,0.46848883440045863,0.003929624227839055,135.66196547961627,COMPLETE
1980,0.3829958736896515,2023-09-05 15:50:31.868947,2023-09-05 15:50:34.777078,0 days 00:00:02.908131,ReLU,ReLU,,,76,13,12.0,,,0.0005748140141278453,2,352,0.5616248991516642,0.005016890124157456,190.54747392664004,COMPLETE
1981,0.4829578101634979,2023-09-05 15:50:34.777572,2023-09-05 15:50:35.823270,0 days 00:00:01.045698,ReLU,ReLU,,,77,8,13.0,,,0.0007669760842721018,2,373,0.111652243787414,0.005792588956038708,253.3287911825622,COMPLETE
1982,0.45938965678215027,2023-09-05 15:50:35.823755,2023-09-05 15:50:42.296893,0 days 00:00:06.473138,Sigmoid,Tanh,,,76,22,12.0,,,0.00044657481756296387,2,404,0.7414066302110863,0.0034565286507249257,577.5895657285431,COMPLETE
1983,0.38596105575561523,2023-09-05 15:50:42.297379,2023-09-05 15:50:46.317224,0 days 00:00:04.019845,ReLU,ReLU,,,74,9,13.0,,,0.0006136574524311595,2,345,0.7780840697429975,0.015859143149809386,126.70524410325653,COMPLETE
1984,0.36751726269721985,2023-09-05 15:50:46.317700,2023-09-05 15:50:48.654724,0 days 00:00:02.337024,ReLU,ReLU,,,80,20,12.0,,,0.000743566324998298,2,361,0.43707409203637654,0.002389192733133854,120.993758196992,COMPLETE
1985,0.42628011107444763,2023-09-05 15:50:48.655200,2023-09-05 15:50:51.102960,0 days 00:00:02.447760,ReLU,ReLU,,,76,22,11.0,,,0.0005444202998076583,2,414,0.312679008025193,0.009790349732761407,140.77412045298945,COMPLETE
1986,0.34705400466918945,2023-09-05 15:50:51.103434,2023-09-05 15:50:52.590942,0 days 00:00:01.487508,Tanh,ReLU,,,75,23,13.0,,,0.0007843550933995627,2,382,0.7267830252971289,2.8029798466956015e-05,115.76717923138592,COMPLETE
1987,0.4396706223487854,2023-09-05 15:50:52.591419,2023-09-05 15:50:54.663886,0 days 00:00:02.072467,ReLU,Tanh,,,77,18,11.0,,,0.00042392072606437675,2,343,0.7743100570822478,0.004592683805327797,107.40369153490253,COMPLETE
1988,0.37843433022499084,2023-09-05 15:50:54.664354,2023-09-05 15:50:56.506272,0 days 00:00:01.841918,ReLU,ReLU,,,78,8,12.0,,,0.0006385303645768456,2,354,0.33928490446441706,1.6160273820669397e-05,143.03407718824303,COMPLETE
1989,0.542217493057251,2023-09-05 15:50:56.506750,2023-09-05 15:50:57.063088,0 days 00:00:00.556338,ReLU,ReLU,,,80,7,13.0,,,0.0027963950262810226,2,374,0.11606855904194992,0.0010032202719099828,231.5380970839913,COMPLETE
1990,0.41880562901496887,2023-09-05 15:50:57.063567,2023-09-05 15:50:58.885722,0 days 00:00:01.822155,ReLU,ReLU,,,74,24,13.0,,,0.00036176165702079345,2,398,0.3987388625764445,0.0016099521973317952,186.5708437745676,COMPLETE
1991,0.3763102889060974,2023-09-05 15:50:58.886198,2023-09-05 15:51:02.107517,0 days 00:00:03.221319,ReLU,Leaky,,,81,13,12.0,,,0.0004897156778024984,2,364,0.5059065296420127,1.3383148874295848e-05,130.83600131509758,COMPLETE
1992,0.4162624478340149,2023-09-05 15:51:02.107992,2023-09-05 15:51:03.571336,0 days 00:00:01.463344,ReLU,ReLU,,,83,14,10.0,,,0.0008127208499151822,2,336,0.1680729327218013,0.021923210583169955,134.83867169346456,COMPLETE
1993,0.41809090971946716,2023-09-05 15:51:03.571818,2023-09-05 15:51:06.212701,0 days 00:00:02.640883,ReLU,Tanh,,,79,6,11.0,,,0.0008994353258957648,2,387,0.744075883992516,0.006854342192069584,119.54150445120675,COMPLETE
1994,0.45067793130874634,2023-09-05 15:51:06.213188,2023-09-05 15:51:10.843847,0 days 00:00:04.630659,ReLU,ReLU,,,84,8,13.0,,,0.0006789751204258674,2,350,0.5930742228550999,0.0038693852438922314,158.05767768106344,COMPLETE
1995,0.4024331271648407,2023-09-05 15:51:10.844329,2023-09-05 15:51:11.624038,0 days 00:00:00.779709,ReLU,ReLU,,,73,5,12.0,,,0.002679484477705621,2,358,0.28853002905835995,0.0028823894647126967,126.35902574327257,COMPLETE
1996,0.37728238105773926,2023-09-05 15:51:11.624516,2023-09-05 15:51:12.593577,0 days 00:00:00.969061,ReLU,ReLU,,,72,23,7.0,,,0.002964915741121027,2,420,0.7186572438515751,0.00208984589194568,145.90235088182533,COMPLETE
1997,0.37507709860801697,2023-09-05 15:51:12.594049,2023-09-05 15:51:16.233117,0 days 00:00:03.639068,ReLU,ReLU,,,75,14,9.0,,,0.000502559898110742,2,340,0.7748168338186399,3.6442521974996064e-05,127.5374575075896,COMPLETE
1998,0.3884825110435486,2023-09-05 15:51:16.233594,2023-09-05 15:51:18.586984,0 days 00:00:02.353390,ReLU,Tanh,,,79,21,13.0,,,0.0009171351483616216,2,371,0.7984335345578055,0.0009045915893791393,118.79026218761098,COMPLETE
1999,0.35157355666160583,2023-09-05 15:51:18.587469,2023-09-05 15:51:19.811640,0 days 00:00:01.224171,Sigmoid,ReLU,,,76,18,12.0,,,0.06528416456416579,2,428,0.6990825459971518,1.9467937243348973e-05,113.24375349475491,COMPLETE
