number,value,datetime_start,datetime_complete,duration,params_activation1,params_activation2,params_activation3,params_activation4,params_batch_size,params_fl1,params_fl2,params_fl3,params_fl4,params_learning_rate,params_n_layers,params_num_epochs,params_train_size,params_weight_decay,user_attrs_mre,state
1548,0.41207680106163025,2023-09-05 15:30:20.333922,2023-09-05 15:30:20.800444,0 days 00:00:00.466522,ReLU,ReLU,,,79,10,13.0,,,0.0034145700191126897,2,408,0.10588790416139739,0.009302553859742716,190.22027333577475,COMPLETE
1549,0.3329446613788605,2023-09-05 15:30:20.800883,2023-09-05 15:30:22.452346,0 days 00:00:01.651463,ReLU,ReLU,,,47,14,15.0,,,0.0015547492415657822,2,336,0.7286183173154913,1.001495785843672e-05,138.33959424495697,COMPLETE
1550,0.36766061186790466,2023-09-05 15:30:22.452772,2023-09-05 15:30:23.076727,0 days 00:00:00.623955,Leaky,Tanh,,,54,16,12.0,,,0.004584743500398694,2,379,0.2410561894397997,2.136006257495584e-05,124.75801827251047,COMPLETE
1551,0.5835398435592651,2023-09-05 15:30:23.077154,2023-09-05 15:30:28.159671,0 days 00:00:05.082517,Sigmoid,ReLU,,,34,3,4.0,,,7.95243131271964e-05,2,399,0.2888018590902878,0.00030956378250232623,151.61477181188445,COMPLETE
1552,0.3772638440132141,2023-09-05 15:30:28.160096,2023-09-05 15:30:29.514312,0 days 00:00:01.354216,ReLU,ReLU,,,52,15,13.0,,,0.006793591320226917,2,364,0.6744915668226057,0.002292801680037424,593.9453441074917,COMPLETE
1553,0.3896179795265198,2023-09-05 15:30:29.514736,2023-09-05 15:30:29.836585,0 days 00:00:00.321849,ReLU,ReLU,,,50,15,14.0,,,0.01613247847866194,2,345,0.3705125628740449,1.515566774788126e-05,182.71291391473068,COMPLETE
1554,0.3392904996871948,2023-09-05 15:30:29.837021,2023-09-05 15:30:31.888377,0 days 00:00:02.051356,ReLU,ReLU,,,32,17,13.0,,,0.001970290809530502,2,387,0.7995358857611182,0.0005041254897552405,157.97096930609808,COMPLETE
1555,0.3888493478298187,2023-09-05 15:30:31.888809,2023-09-05 15:30:33.286807,0 days 00:00:01.397998,Leaky,Tanh,,,45,8,15.0,,,0.0028252657776382177,2,372,0.7480187148074859,0.00023495995992303456,138.48154174804688,COMPLETE
1556,0.3780187666416168,2023-09-05 15:30:33.287228,2023-09-05 15:30:35.835194,0 days 00:00:02.547966,ReLU,ReLU,,,40,11,14.0,,,0.0008540828146562355,2,219,0.3423775105103225,0.00016472650546706062,230.50641160975388,COMPLETE
1557,0.40032345056533813,2023-09-05 15:30:35.835626,2023-09-05 15:30:36.502309,0 days 00:00:00.666683,Tanh,ReLU,,,48,14,5.0,,,0.027910662189290784,2,361,0.38516390569268427,0.002854812546866861,128.67201042175293,COMPLETE
1558,0.313846617937088,2023-09-05 15:30:36.502732,2023-09-05 15:30:38.792688,0 days 00:00:02.289956,ReLU,ReLU,,,42,15,12.0,,,0.002357964613565925,2,352,0.7166777527629253,0.0009572902591678789,105.28898938496907,COMPLETE
1559,0.39732810854911804,2023-09-05 15:30:38.793128,2023-09-05 15:30:41.096200,0 days 00:00:02.303072,Leaky,Tanh,,,36,9,16.0,,,0.0011590681516991325,2,342,0.3006733356934707,0.0006805446121999606,225.84558365561745,COMPLETE
1560,0.4664958715438843,2023-09-05 15:30:41.096622,2023-09-05 15:30:47.978708,0 days 00:00:06.882086,ReLU,Sigmoid,,,46,16,14.0,,,0.0002251299982645154,2,378,0.5130228292260364,5.547925217742396e-05,203.3295742620236,COMPLETE
1561,0.4083918035030365,2023-09-05 15:30:47.979136,2023-09-05 15:30:48.694662,0 days 00:00:00.715526,ReLU,ReLU,,,49,17,12.0,,,0.0038241274083937243,2,407,0.24648203703476884,0.00121114768589267,180.22118851945206,COMPLETE
1562,0.4170815944671631,2023-09-05 15:30:48.695105,2023-09-05 15:30:50.732207,0 days 00:00:02.037102,Leaky,ReLU,,,56,15,15.0,,,0.0003057344307924888,2,393,0.14804987432513866,0.00019834215580931405,124.61689210848044,COMPLETE
1563,0.5405130982398987,2023-09-05 15:30:50.732647,2023-09-05 15:30:54.437780,0 days 00:00:03.705133,ReLU,ReLU,,,51,16,13.0,,,4.098352253275396e-05,2,355,0.3093388268485503,0.00028451858137504,142.01699448706398,COMPLETE
1564,0.4388619661331177,2023-09-05 15:30:54.438199,2023-09-05 15:30:54.820661,0 days 00:00:00.382462,ReLU,Tanh,,,37,5,15.0,,,0.040101985733447844,2,367,0.12457662154542212,0.004752720760616903,513.7344312314634,COMPLETE
1565,0.734211802482605,2023-09-05 15:30:54.821101,2023-09-05 15:30:59.247774,0 days 00:00:04.426673,ReLU,ReLU,,,43,7,16.0,,,1.1923668738501413e-05,2,335,0.35414923831872497,0.00036316991929787344,112.68213660396746,COMPLETE
1566,0.3754401206970215,2023-09-05 15:30:59.248204,2023-09-05 15:31:00.322835,0 days 00:00:01.074631,Leaky,ReLU,,,29,13,13.0,,,0.0029759818045919997,2,348,0.4000556274919574,4.189174147180314e-05,140.09434291294642,COMPLETE
1567,0.39264562726020813,2023-09-05 15:31:00.323287,2023-09-05 15:31:03.908693,0 days 00:00:03.585406,ReLU,ReLU,,,45,14,6.0,,,0.0006733863087026841,2,385,0.5705561235985244,1.2341478813371269e-05,143.45530713762557,COMPLETE
1568,0.38833197951316833,2023-09-05 15:31:03.909137,2023-09-05 15:31:04.477878,0 days 00:00:00.568741,ReLU,Tanh,,,58,15,14.0,,,0.005191962773980864,2,373,0.15482535378841597,0.00010298656269933295,204.073455174764,COMPLETE
1569,0.37380608916282654,2023-09-05 15:31:04.478302,2023-09-05 15:31:07.684836,0 days 00:00:03.206534,Leaky,ReLU,,,39,17,14.0,,,0.0013971453710526533,2,362,0.7686388697751686,0.0005817168405498974,126.45309689965579,COMPLETE
1570,0.33616143465042114,2023-09-05 15:31:07.685270,2023-09-05 15:31:09.167574,0 days 00:00:01.482304,ReLU,ReLU,,,47,6,12.0,,,0.0019303421331381121,2,341,0.6638694746659439,1.6824463744100795e-05,173.1652128158077,COMPLETE
1571,0.3842795193195343,2023-09-05 15:31:09.168014,2023-09-05 15:31:10.402205,0 days 00:00:01.234191,ReLU,Sigmoid,,,52,22,13.0,,,0.024508086795799505,2,397,0.7047118527774957,0.0054533131972537155,124.17499588012696,COMPLETE
1572,0.41927164793014526,2023-09-05 15:31:10.402638,2023-09-05 15:31:21.690141,0 days 00:00:11.287503,Leaky,ReLU,,,35,16,15.0,,,5.6327670813286806e-05,2,356,0.7419061902761385,0.001912506923764367,160.05889007482637,COMPLETE
1573,0.4405808448791504,2023-09-05 15:31:21.690572,2023-09-05 15:31:33.824728,0 days 00:00:12.134156,ReLU,ReLU,,,32,13,14.0,,,5.641905559151579e-05,2,332,0.7701471933921652,0.025067903132040274,222.77933906647095,COMPLETE
1574,0.4056752920150757,2023-09-05 15:31:33.825176,2023-09-05 15:31:35.423078,0 days 00:00:01.597902,ReLU,Tanh,,,48,14,12.0,,,0.0009715990553859223,2,377,0.15871663365186475,0.0004121446330609354,165.2034152664301,COMPLETE
1575,0.4289862811565399,2023-09-05 15:31:35.423520,2023-09-05 15:31:36.845914,0 days 00:00:01.422394,Sigmoid,ReLU,,,54,15,13.0,,,0.0024140309497229636,2,369,0.6259090476179124,0.0036909615186500487,128.88246401618508,COMPLETE
1576,0.3935363292694092,2023-09-05 15:31:36.846339,2023-09-05 15:31:38.257688,0 days 00:00:01.411349,ReLU,,,,43,14,,,,0.003274301001730865,1,207,0.3154634292242187,0.007658889288671576,131.22955483450016,COMPLETE
1577,0.32573723793029785,2023-09-05 15:31:38.258109,2023-09-05 15:31:39.545061,0 days 00:00:01.286952,Leaky,ReLU,,,50,15,15.0,,,0.0016667841594475397,2,408,0.728264559484794,2.91387019456617e-05,208.53994445800782,COMPLETE
1578,0.37311962246894836,2023-09-05 15:31:39.545508,2023-09-05 15:31:40.858152,0 days 00:00:01.312644,ReLU,ReLU,,,41,16,14.0,,,0.004226712062558045,2,189,0.45771939379578047,0.0002421942718200558,217.80502783733866,COMPLETE
1579,0.5338781476020813,2023-09-05 15:31:40.858582,2023-09-05 15:31:41.328501,0 days 00:00:00.469919,ReLU,Tanh,,,82,19,16.0,,,0.000733145640981959,2,385,0.10082713585813147,0.0004962258659521739,131.57517679229036,COMPLETE
1580,0.3207814693450928,2023-09-05 15:31:41.328939,2023-09-05 15:31:42.209539,0 days 00:00:00.880600,Leaky,ReLU,,,38,16,11.0,,,0.011787548943570276,2,348,0.7997390803911029,2.1050569362040598e-05,97.9907241821289,COMPLETE
1581,0.38413503766059875,2023-09-05 15:31:42.209971,2023-09-05 15:31:43.136423,0 days 00:00:00.926452,Tanh,ReLU,,,44,14,12.0,,,0.001164501346136816,2,359,0.23048593493016717,0.00032283517278466304,113.249476088691,COMPLETE
1582,0.3762167692184448,2023-09-05 15:31:43.136849,2023-09-05 15:31:43.944432,0 days 00:00:00.807583,ReLU,ReLU,,,46,8,15.0,,,0.0026978712715740347,2,337,0.28188427022759893,1.1907908462058884e-05,137.54597358181053,COMPLETE
1583,0.38340312242507935,2023-09-05 15:31:43.944860,2023-09-05 15:31:46.088541,0 days 00:00:02.143681,ReLU,Tanh,,,34,17,14.0,,,0.0036549170693039716,2,229,0.6854634581908016,0.001065664659499713,117.37366911944221,COMPLETE
1584,0.4309503138065338,2023-09-05 15:31:46.088974,2023-09-05 15:31:47.818821,0 days 00:00:01.729847,Leaky,ReLU,,,48,15,13.0,,,0.0021560416288341927,2,353,0.7668955388615394,0.06552228395660004,128.18617196810447,COMPLETE
1585,0.3760589361190796,2023-09-05 15:31:47.819258,2023-09-05 15:31:48.735384,0 days 00:00:00.916126,ReLU,Sigmoid,,,79,16,14.0,,,0.017295563866868903,2,397,0.5481261106484678,0.0001527163650316294,118.0280249810988,COMPLETE
1586,0.41474854946136475,2023-09-05 15:31:48.735823,2023-09-05 15:31:49.561455,0 days 00:00:00.825632,ReLU,ReLU,,,52,15,13.0,,,0.004786665259147017,2,369,0.7451366263195424,0.0423210637457298,220.03292600570185,COMPLETE
1587,0.35451775789260864,2023-09-05 15:31:49.561892,2023-09-05 15:31:50.023744,0 days 00:00:00.461852,ReLU,ReLU,,,49,15,15.0,,,0.022427391697844124,2,344,0.7048446601383662,0.0008256398787793543,116.7833890914917,COMPLETE
1588,0.3115684986114502,2023-09-05 15:31:50.024173,2023-09-05 15:31:55.926369,0 days 00:00:05.902196,Leaky,Tanh,,,40,14,16.0,,,0.00023979224647538913,2,329,0.7695726808717767,0.00156393233202842,137.95172762023617,COMPLETE
1589,0.4124942123889923,2023-09-05 15:31:55.926808,2023-09-05 15:32:04.295395,0 days 00:00:08.368587,Leaky,ReLU,,,41,10,17.0,,,0.00014713775520704215,2,328,0.7719670585755087,0.001914237855301816,121.0675933131968,COMPLETE
1590,0.44755303859710693,2023-09-05 15:32:04.295834,2023-09-05 15:32:08.780076,0 days 00:00:04.484242,Leaky,ReLU,,,38,21,16.0,,,0.00024309894171297666,2,327,0.7988398331027531,0.019094305070153285,120.89543782858024,COMPLETE
1591,0.3842950165271759,2023-09-05 15:32:08.780690,2023-09-05 15:32:16.135073,0 days 00:00:07.354383,Leaky,ReLU,,,40,20,17.0,,,0.00021556111596647375,2,332,0.7619516754599012,0.0012804375459694822,141.5916506657835,COMPLETE
1592,0.4642847180366516,2023-09-05 15:32:16.135500,2023-09-05 15:32:21.345932,0 days 00:00:05.210432,Leaky,Tanh,,,40,7,16.0,,,0.0005146552142576738,2,336,0.7717244863508266,0.03312141729676561,134.88471896662188,COMPLETE
1593,0.469494491815567,2023-09-05 15:32:21.346379,2023-09-05 15:32:22.291442,0 days 00:00:00.945063,Leaky,ReLU,,,40,12,16.0,,,0.0008972791415817434,2,325,0.10821568860457084,0.0013331219615103091,167.3654309908549,COMPLETE
1594,0.3766477704048157,2023-09-05 15:32:22.291885,2023-09-05 15:32:24.404745,0 days 00:00:02.112860,Leaky,ReLU,Tanh,Leaky,44,13,17.0,24.0,22.0,0.0001751746081670563,4,337,0.1659646944669309,0.0016116640302229828,138.8559040252819,COMPLETE
1595,0.6693004369735718,2023-09-05 15:32:24.405203,2023-09-05 15:32:27.616432,0 days 00:00:03.211229,Leaky,ReLU,,,40,17,16.0,,,1.0487299743802495e-05,2,327,0.23657504481084596,0.0020761188774159767,165.10727810640947,COMPLETE
1596,0.4286975562572479,2023-09-05 15:32:27.616874,2023-09-05 15:32:33.005365,0 days 00:00:05.388491,Leaky,Tanh,,,42,14,17.0,,,0.00020064675282089123,2,342,0.40184619570600894,0.001391118525611674,136.5987541020265,COMPLETE
1597,0.3912982940673828,2023-09-05 15:32:33.005791,2023-09-05 15:32:39.245905,0 days 00:00:06.240114,Leaky,ReLU,,,42,16,16.0,,,0.00015486302426342976,2,337,0.4891309950123747,0.0016782672496181805,231.32284292339924,COMPLETE
1598,0.43112292885780334,2023-09-05 15:32:39.246328,2023-09-05 15:32:46.441431,0 days 00:00:07.195103,Leaky,Sigmoid,,,39,9,16.0,,,0.00026793653418563174,2,282,0.7303127368017518,0.0001266496231864274,126.33938972442505,COMPLETE
1599,0.3929177224636078,2023-09-05 15:32:46.441884,2023-09-05 15:32:52.505755,0 days 00:00:06.063871,Leaky,ReLU,,,38,8,16.0,,,0.00019285177689248777,2,345,0.42831994411970986,0.00018819728511512845,143.7704125888106,COMPLETE
1600,0.5711740255355835,2023-09-05 15:32:52.506214,2023-09-05 15:32:59.427849,0 days 00:00:06.921635,Leaky,ReLU,,,41,15,16.0,,,1.6373090704255187e-05,2,333,0.5319162804534492,0.0025108052217055117,184.02293936697927,COMPLETE
1601,0.5809594988822937,2023-09-05 15:32:59.428330,2023-09-05 15:33:01.054341,0 days 00:00:01.626011,Leaky,Tanh,,,43,14,16.0,,,0.00015526228216095606,2,327,0.11525589403326991,0.017366188876869033,157.14902911638265,COMPLETE
1602,0.34345170855522156,2023-09-05 15:33:01.054774,2023-09-05 15:33:03.725787,0 days 00:00:02.671013,Leaky,ReLU,,,39,16,7.0,,,0.0007773848704847491,2,344,0.7658715304233072,0.001085723682805902,105.20099843934526,COMPLETE
1603,0.36867353320121765,2023-09-05 15:33:03.726216,2023-09-05 15:33:10.827322,0 days 00:00:07.101106,Leaky,ReLU,,,44,15,16.0,,,0.0002078152164868318,2,347,0.5870758011940127,0.00027245887344675107,129.98054998334055,COMPLETE
1604,0.3405921161174774,2023-09-05 15:33:10.827759,2023-09-05 15:33:17.127734,0 days 00:00:06.299975,Leaky,ReLU,,,43,15,16.0,,,0.0002501363632762339,2,342,0.6527854915202913,0.0017235463188964408,125.58255478739738,COMPLETE
1605,0.38693419098854065,2023-09-05 15:33:17.128184,2023-09-05 15:33:24.272322,0 days 00:00:07.144138,Leaky,Tanh,,,41,16,11.0,,,0.00021656546207941214,2,253,0.7431759085033938,6.304183203517624e-05,117.65341575592163,COMPLETE
1606,0.38613569736480713,2023-09-05 15:33:24.272763,2023-09-05 15:33:30.184538,0 days 00:00:05.911775,Leaky,ReLU,,,38,18,17.0,,,0.00026311957498975825,2,337,0.6992565091929204,0.0014875050867618595,135.3835395038992,COMPLETE
1607,0.36082640290260315,2023-09-05 15:33:30.184997,2023-09-05 15:33:34.014943,0 days 00:00:03.829946,Leaky,ReLU,,,46,14,16.0,,,0.00042990483981037206,2,327,0.7975455757265505,0.00021571603135439943,116.03144033027418,COMPLETE
1608,0.39462751150131226,2023-09-05 15:33:34.015406,2023-09-05 15:33:35.946509,0 days 00:00:01.931103,Leaky,ReLU,,,37,17,15.0,,,0.0003480767245109198,2,352,0.17825053489832812,0.0003563165053635049,125.76836336576022,COMPLETE
1609,0.3731139898300171,2023-09-05 15:33:35.946942,2023-09-05 15:33:40.628456,0 days 00:00:04.681514,Leaky,ReLU,,,45,15,12.0,,,0.0003002831731100311,2,351,0.5079688134035514,0.00030739764830096234,107.78973404053718,COMPLETE
1610,0.3977923095226288,2023-09-05 15:33:40.628883,2023-09-05 15:33:48.739652,0 days 00:00:08.110769,Leaky,Tanh,,,42,4,15.0,,,0.0003345856061264985,2,337,0.7738833366408594,0.00041121265188583816,129.70722647592532,COMPLETE
1611,0.6070492267608643,2023-09-05 15:33:48.740079,2023-09-05 15:33:56.461282,0 days 00:00:07.721203,Leaky,Sigmoid,,,55,16,12.0,,,4.264458498656044e-05,2,350,0.7186142522340064,0.0022077888016295154,166.2643308367048,COMPLETE
1612,0.37278279662132263,2023-09-05 15:33:56.461717,2023-09-05 15:34:03.114293,0 days 00:00:06.652576,Leaky,ReLU,,,40,22,11.0,,,0.0003208908732490392,2,357,0.6739984162122094,9.759588925837817e-05,315.68286672452604,COMPLETE
1613,0.4203644394874573,2023-09-05 15:34:03.114739,2023-09-05 15:34:10.462544,0 days 00:00:07.347805,Leaky,ReLU,,,47,13,9.0,,,9.65859651722092e-05,2,339,0.6208790689350524,0.00027713252449103597,185.523021371667,COMPLETE
1614,0.40446826815605164,2023-09-05 15:34:10.462981,2023-09-05 15:34:19.508700,0 days 00:00:09.045719,Leaky,ReLU,,,51,6,8.0,,,0.0002771009618185869,2,412,0.7475405338306514,0.015000311254662734,156.73254982503255,COMPLETE
1615,0.4192931354045868,2023-09-05 15:34:19.509142,2023-09-05 15:34:26.513888,0 days 00:00:07.004746,Leaky,Tanh,,,37,14,15.0,,,0.00010932568498698605,2,348,0.47357501556372367,0.00018042432172925326,129.3842847758326,COMPLETE
1616,0.339503675699234,2023-09-05 15:34:26.514324,2023-09-05 15:34:29.432485,0 days 00:00:02.918161,Leaky,ReLU,,,45,15,15.0,,,0.0010753309338897533,2,329,0.7989785408234237,0.00023367896560810877,99.98417388916016,COMPLETE
1617,0.32807454466819763,2023-09-05 15:34:29.432938,2023-09-05 15:34:34.343539,0 days 00:00:04.910601,Leaky,ReLU,,,49,9,3.0,,,0.00039862447496315375,2,355,0.7999832802609766,0.009668097776222136,155.88175166736949,COMPLETE
1618,0.38913705945014954,2023-09-05 15:34:34.343969,2023-09-05 15:34:37.091915,0 days 00:00:02.747946,Leaky,ReLU,,,59,17,16.0,,,0.00012055190206624216,2,200,0.4462264940706103,0.0001421516330009324,125.42517986297608,COMPLETE
1619,0.5627621412277222,2023-09-05 15:34:37.092347,2023-09-05 15:34:40.114465,0 days 00:00:03.022118,Sigmoid,Tanh,,,42,16,4.0,,,8.73001682378674e-05,2,239,0.3269300825690035,5.1316427226594245e-05,139.3129408130087,COMPLETE
1620,0.4827633798122406,2023-09-05 15:34:40.114904,2023-09-05 15:34:42.079874,0 days 00:00:01.964970,Leaky,ReLU,,,39,15,12.0,,,0.00014478393328206545,2,324,0.1328967478398944,0.002871675928136571,337.98602120670273,COMPLETE
1621,0.3771023452281952,2023-09-05 15:34:42.080306,2023-09-05 15:34:45.071946,0 days 00:00:02.991640,Leaky,ReLU,,,47,14,17.0,,,0.00042527788125234665,2,345,0.7182485943347348,0.0006181731081597592,122.41785606971153,COMPLETE
1622,0.3851068615913391,2023-09-05 15:34:45.072384,2023-09-05 15:34:49.648451,0 days 00:00:04.576067,Tanh,ReLU,,,53,5,15.0,,,0.000681981264103082,2,409,0.7524746350495904,7.061270486198797e-05,231.76643881568296,COMPLETE
1623,0.34332332015037537,2023-09-05 15:34:49.648974,2023-09-05 15:34:53.133437,0 days 00:00:03.484463,Leaky,Tanh,,,78,8,12.0,,,0.0012069258176060243,2,359,0.6925058654582079,0.0004952890206682281,122.03245494593328,COMPLETE
1624,0.6551989912986755,2023-09-05 15:34:53.133889,2023-09-05 15:34:55.536317,0 days 00:00:02.402428,Leaky,Sigmoid,,,50,3,16.0,,,8.536990620168945e-05,2,274,0.2487733165824761,0.02450114590749889,117.07773108377944,COMPLETE
1625,0.3840774595737457,2023-09-05 15:34:55.536764,2023-09-05 15:34:59.492416,0 days 00:00:03.955652,Leaky,ReLU,,,56,12,13.0,,,0.00026457162050264234,2,336,0.3769764062542445,0.000996966331368584,141.28207624526252,COMPLETE
1626,0.40899989008903503,2023-09-05 15:34:59.492858,2023-09-05 15:35:05.561598,0 days 00:00:06.068740,Leaky,ReLU,,,45,7,15.0,,,0.00035423046708664044,2,345,0.7673042042981112,0.005916378212555781,199.01044788099315,COMPLETE
1627,0.42715150117874146,2023-09-05 15:35:05.562058,2023-09-05 15:35:14.385157,0 days 00:00:08.823099,Leaky,ReLU,,,43,16,5.0,,,0.00011423807421629899,2,401,0.5950597661105851,0.0012148560250729722,241.81034386841733,COMPLETE
1628,0.40724992752075195,2023-09-05 15:35:14.385586,2023-09-05 15:35:21.082319,0 days 00:00:06.696733,Leaky,Tanh,,,37,15,6.0,,,0.00022689089031950637,2,217,0.7332703760001726,0.0003428184145474278,136.63259806830763,COMPLETE
1629,0.4009528160095215,2023-09-05 15:35:21.082864,2023-09-05 15:35:29.499824,0 days 00:00:08.416960,Sigmoid,ReLU,,,48,17,12.0,,,0.00034874295455463784,2,357,0.6571985699098853,0.0017153283647331373,118.04360092120345,COMPLETE
1630,0.6228158473968506,2023-09-05 15:35:29.500253,2023-09-05 15:35:29.966989,0 days 00:00:00.466736,Leaky,ReLU,,,40,13,15.0,,,0.0008494246723176401,2,331,0.11178669719651795,0.0500334144833049,180.89522593730206,COMPLETE
1631,0.39303654432296753,2023-09-05 15:35:29.967418,2023-09-05 15:35:36.783589,0 days 00:00:06.816171,Leaky,ReLU,,,51,11,16.0,,,0.00016128088737356845,2,266,0.7719703278311904,0.00011021305613888645,174.18189950813925,COMPLETE
1632,0.3613390326499939,2023-09-05 15:35:36.784035,2023-09-05 15:35:41.789730,0 days 00:00:05.005695,Tanh,ReLU,,,46,14,13.0,,,0.0001962348273537046,2,350,0.4699912121443885,0.0004112647470707726,115.05698890426532,COMPLETE
1633,0.38558706641197205,2023-09-05 15:35:41.790170,2023-09-05 15:35:47.819023,0 days 00:00:06.028853,ReLU,Tanh,,,90,15,13.0,,,0.00012985993800108614,2,361,0.7202859279057923,7.324902633335604e-05,134.20772203778296,COMPLETE
1634,0.3769163489341736,2023-09-05 15:35:47.819472,2023-09-05 15:35:48.818862,0 days 00:00:00.999390,Leaky,ReLU,,,54,18,15.0,,,0.0014502467237798903,2,340,0.20150761955160018,8.798005515478319e-05,106.46848042805989,COMPLETE
1635,0.362907737493515,2023-09-05 15:35:48.819306,2023-09-05 15:35:51.345260,0 days 00:00:02.525954,ReLU,ReLU,,,44,16,2.0,,,0.0010632384909687598,2,401,0.7995786574340296,0.013611277186658215,137.69375228881836,COMPLETE
1636,0.3814396560192108,2023-09-05 15:35:51.345696,2023-09-05 15:35:58.883626,0 days 00:00:07.537930,ReLU,Sigmoid,,,36,15,12.0,,,0.0003196862156043961,2,410,0.683035673534814,0.002426365244728467,192.05485569745645,COMPLETE
1637,0.4430217146873474,2023-09-05 15:35:58.884068,2023-09-05 15:36:02.349441,0 days 00:00:03.465373,Leaky,ReLU,,,49,13,11.0,,,0.00015221674096988557,2,134,0.7468560109085584,0.00025194112779273385,126.02567758133162,COMPLETE
1638,0.398234099149704,2023-09-05 15:36:02.349863,2023-09-05 15:36:05.993951,0 days 00:00:03.644088,ReLU,Tanh,,,41,14,16.0,,,0.00017380009404683008,2,323,0.7072221237910018,0.0007296941751903277,136.61348178570088,COMPLETE
1639,0.35669490694999695,2023-09-05 15:36:05.994384,2023-09-05 15:36:10.253897,0 days 00:00:04.259513,ReLU,ReLU,,,39,16,13.0,,,0.000550479030379737,2,394,0.5153083547049476,0.0002015757294769432,109.68987848226307,COMPLETE
1640,0.5008480548858643,2023-09-05 15:36:10.254335,2023-09-05 15:36:14.455764,0 days 00:00:04.201429,Leaky,ReLU,,,47,15,12.0,,,0.0004701220040444134,2,355,0.5580454572170431,0.08259353340495351,138.52180899343182,COMPLETE
1641,0.395084947347641,2023-09-05 15:36:14.456211,2023-09-05 15:36:15.021644,0 days 00:00:00.565433,ReLU,ReLU,,,42,10,15.0,,,0.001599227868358264,2,363,0.15476917412676278,1.019030823097886e-05,153.7021486331255,COMPLETE
1642,0.33345696330070496,2023-09-05 15:36:15.022090,2023-09-05 15:36:17.914030,0 days 00:00:02.891940,ReLU,,,,51,7,,,,0.0006349795559839115,1,344,0.7707283487738448,0.0031307800169687113,112.0240603110773,COMPLETE
1643,0.6358963847160339,2023-09-05 15:36:17.914461,2023-09-05 15:36:18.274243,0 days 00:00:00.359782,Leaky,Tanh,,,53,17,14.0,,,0.05457003695451584,2,390,0.6268972936143312,0.05528057960046489,186.6277348445012,COMPLETE
1644,0.4283091425895691,2023-09-05 15:36:18.274682,2023-09-05 15:36:18.538762,0 days 00:00:00.264080,ReLU,ReLU,,,58,14,13.0,,,0.0339654855218208,2,337,0.16835586871014638,0.008068885856311466,129.80479073524475,COMPLETE
