number,value,datetime_start,datetime_complete,duration,params_activation1,params_activation2,params_activation3,params_activation4,params_batch_size,params_fl1,params_fl2,params_fl3,params_fl4,params_learning_rate,params_n_layers,params_num_epochs,params_train_size,params_weight_decay,user_attrs_mre,state
1451,0.35042062401771545,2023-09-05 15:26:39.463596,2023-09-05 15:26:40.634403,0 days 00:00:01.170807,Leaky,ReLU,,,57,15,15.0,,,0.0032583926533133324,2,369,0.47225237058759945,4.80789609090068e-05,108.19108715572872,COMPLETE
1452,0.4258250296115875,2023-09-05 15:26:40.634827,2023-09-05 15:26:40.929906,0 days 00:00:00.295079,Leaky,Tanh,,,50,14,15.0,,,0.00553253764728788,2,361,0.10060201470850448,1.7905289584430205e-05,153.3714671584795,COMPLETE
1453,0.3701149523258209,2023-09-05 15:26:40.930335,2023-09-05 15:26:41.860854,0 days 00:00:00.930519,Leaky,ReLU,,,53,15,14.0,,,0.0025640872951034066,2,386,0.5594939813200445,1.0083075298227499e-05,176.61517756035988,COMPLETE
1454,0.535670280456543,2023-09-05 15:26:41.861291,2023-09-05 15:26:42.505546,0 days 00:00:00.644255,Tanh,Sigmoid,,,48,15,14.0,,,0.004535301099108082,2,365,0.16139335205431982,0.0006343740017242575,234.50613101323447,COMPLETE
1455,0.36942577362060547,2023-09-05 15:26:42.505991,2023-09-05 15:26:43.921894,0 days 00:00:01.415903,Leaky,ReLU,,,51,14,15.0,,,0.0032041581419646834,2,379,0.17128110400587948,0.0032887608388260537,101.7857443002554,COMPLETE
1456,0.4035552144050598,2023-09-05 15:26:43.922763,2023-09-05 15:26:45.554140,0 days 00:00:01.631377,Leaky,ReLU,,,55,14,16.0,,,0.0020691789879486826,2,361,0.39017605028469854,0.002569196621280057,109.12357624467597,COMPLETE
1457,0.33684486150741577,2023-09-05 15:26:45.554563,2023-09-05 15:26:46.827690,0 days 00:00:01.273127,Leaky,Tanh,,,48,9,14.0,,,0.0026614699203914515,2,389,0.7099065718743043,0.0004447197278295704,100.99946578668089,COMPLETE
1458,0.5218888521194458,2023-09-05 15:26:46.828121,2023-09-05 15:26:49.136162,0 days 00:00:02.308041,Sigmoid,ReLU,,,84,15,4.0,,,0.0035932277334398775,2,370,0.7487116375093927,1.2172419699450583e-05,189.5054812113444,COMPLETE
1459,0.5854648947715759,2023-09-05 15:26:49.136601,2023-09-05 15:26:54.771923,0 days 00:00:05.635322,Leaky,ReLU,,,47,14,15.0,,,2.231079531796183e-05,2,377,0.4234878829794915,3.894695909156221e-05,149.10848422265497,COMPLETE
1460,0.3922244608402252,2023-09-05 15:26:54.772387,2023-09-05 15:26:55.846805,0 days 00:00:01.074418,Leaky,,,,92,15,,,,0.0016948701033377164,1,356,0.6748235070473404,0.000681504473192171,104.57620432407042,COMPLETE
1461,0.3384493291378021,2023-09-05 15:26:55.847276,2023-09-05 15:26:56.432759,0 days 00:00:00.585483,Tanh,ReLU,,,50,15,14.0,,,0.004355622784807298,2,398,0.3312478857842989,6.034109097948716e-05,105.43236090920188,COMPLETE
1462,0.38495320081710815,2023-09-05 15:26:56.433189,2023-09-05 15:26:57.627219,0 days 00:00:01.194030,Leaky,Tanh,Sigmoid,ReLU,46,16,14.0,20.0,13.0,0.002918868492168453,4,364,0.28756339083792093,0.0005215795524722882,188.61686635335286,COMPLETE
1463,0.3766317367553711,2023-09-05 15:26:57.627676,2023-09-05 15:26:58.351637,0 days 00:00:00.723961,Leaky,ReLU,,,44,15,16.0,,,0.036979427984445166,2,402,0.7266245019895441,0.001757580249530006,153.6670068105062,COMPLETE
1464,0.40229684114456177,2023-09-05 15:26:58.352076,2023-09-05 15:26:59.300282,0 days 00:00:00.948206,Leaky,ReLU,,,47,14,15.0,,,0.0021210797339897246,2,216,0.22744771607392603,2.2407343592290583e-05,112.56158868698847,COMPLETE
1465,0.36685776710510254,2023-09-05 15:26:59.300736,2023-09-05 15:26:59.823793,0 days 00:00:00.523057,Leaky,ReLU,,,53,16,15.0,,,0.005890402236179842,2,387,0.3625940229225288,1.635968854379092e-05,113.23565735688081,COMPLETE
1466,0.7294361591339111,2023-09-05 15:26:59.824238,2023-09-05 15:27:03.452880,0 days 00:00:03.628642,Sigmoid,Tanh,,,49,15,14.0,,,1.3147237827834174e-05,2,372,0.27402137551612205,8.839506850593791e-05,105.63353667720672,COMPLETE
1467,0.36814144253730774,2023-09-05 15:27:03.453312,2023-09-05 15:27:05.396482,0 days 00:00:01.943170,Leaky,ReLU,,,46,8,13.0,,,0.003687924032988245,2,357,0.7675628584129033,0.0007940656973352562,103.98167176177536,COMPLETE
1468,0.37866196036338806,2023-09-05 15:27:05.396932,2023-09-05 15:27:06.279630,0 days 00:00:00.882698,Leaky,Sigmoid,,,57,6,15.0,,,0.020864480330478406,2,379,0.5215295009172901,0.0011248473784443488,204.22441160912607,COMPLETE
1469,0.3943088948726654,2023-09-05 15:27:06.280057,2023-09-05 15:27:07.354821,0 days 00:00:01.074764,Tanh,ReLU,,,81,11,16.0,,,0.0015095845340191909,2,352,0.17615778082571304,0.0022899826201266808,118.92237584731159,COMPLETE
1470,0.4063282907009125,2023-09-05 15:27:07.355248,2023-09-05 15:27:08.694816,0 days 00:00:01.339568,Leaky,ReLU,,,50,14,14.0,,,0.002580860696430755,2,248,0.6949484812793059,0.003427663225090009,212.99914638812726,COMPLETE
1471,0.35844847559928894,2023-09-05 15:27:08.695241,2023-09-05 15:27:17.437999,0 days 00:00:08.742758,Leaky,Tanh,,,51,14,14.0,,,0.00021327727307163087,2,392,0.7712546807795196,0.0003772509753407312,112.05707011111947,COMPLETE
1472,0.37404513359069824,2023-09-05 15:27:17.438445,2023-09-05 15:27:18.009484,0 days 00:00:00.571039,Leaky,ReLU,,,42,16,13.0,,,0.005203845463436742,2,366,0.6425431015696358,3.0137142244558427e-05,208.53953475952147,COMPLETE
1473,0.3409123718738556,2023-09-05 15:27:18.009918,2023-09-05 15:27:19.700229,0 days 00:00:01.690311,ReLU,ReLU,,,44,15,15.0,,,0.003464010989624987,2,356,0.7303485671929101,0.016162126530052483,120.36898641117284,COMPLETE
1474,0.32885754108428955,2023-09-05 15:27:19.700662,2023-09-05 15:27:20.796447,0 days 00:00:01.095785,Leaky,ReLU,,,54,15,13.0,,,0.0019035806322782556,2,403,0.7671990721462735,1.4411864815063039e-05,106.17406063988095,COMPLETE
1475,0.3899054229259491,2023-09-05 15:27:20.796871,2023-09-05 15:27:21.790935,0 days 00:00:00.994064,ReLU,ReLU,,,47,16,8.0,,,0.002413200078950599,2,193,0.39903439184342154,4.888622537527937e-05,124.19428877397017,COMPLETE
1476,0.43999359011650085,2023-09-05 15:27:21.791380,2023-09-05 15:27:22.309398,0 days 00:00:00.518018,ReLU,Tanh,,,52,16,14.0,,,0.0030697166984297634,2,372,0.21991822708187211,0.0014512826734163259,223.95399876644737,COMPLETE
1477,0.38583749532699585,2023-09-05 15:27:22.309836,2023-09-05 15:27:24.636380,0 days 00:00:02.326544,Leaky,ReLU,,,45,14,16.0,,,0.001293872250330787,2,348,0.4969561329439411,1.0008374946523216e-05,113.15279315766834,COMPLETE
1478,0.4574698805809021,2023-09-05 15:27:24.636819,2023-09-05 15:27:26.902397,0 days 00:00:02.265578,ReLU,ReLU,,,48,8,2.0,,,0.0015807291772794848,2,235,0.5375725172596055,0.0001174283313837525,131.1457495571168,COMPLETE
1479,0.5165309906005859,2023-09-05 15:27:26.902825,2023-09-05 15:27:33.510897,0 days 00:00:06.608072,Sigmoid,ReLU,,,42,10,14.0,,,8.84111944000466e-05,2,379,0.4489522769129536,0.00016747825730367716,145.83007689704996,COMPLETE
1480,0.37610387802124023,2023-09-05 15:27:33.511357,2023-09-05 15:27:34.845339,0 days 00:00:01.333982,ReLU,Sigmoid,,,49,15,13.0,,,0.0046218668593013545,2,361,0.587678403878803,0.00047884553832550536,115.2111114017547,COMPLETE
1481,0.4703909158706665,2023-09-05 15:27:34.845770,2023-09-05 15:27:42.506555,0 days 00:00:07.660785,ReLU,Tanh,,,55,14,15.0,,,6.896594603597031e-05,2,394,0.6223940114848387,0.0010455556257475739,1231.0525262900414,COMPLETE
1482,0.47728681564331055,2023-09-05 15:27:42.506988,2023-09-05 15:27:43.031854,0 days 00:00:00.524866,Leaky,ReLU,,,51,16,14.0,,,0.0038429195570108088,2,86,0.12494713737689842,1.855961374091873e-05,275.0202043114639,COMPLETE
1483,0.6397099494934082,2023-09-05 15:27:43.032291,2023-09-05 15:27:44.271950,0 days 00:00:01.239659,ReLU,ReLU,,,44,15,6.0,,,0.002250732372409327,2,367,0.3119032699005095,0.09820222269452795,195.301602935791,COMPLETE
1484,0.39859524369239807,2023-09-05 15:27:44.272384,2023-09-05 15:27:55.905951,0 days 00:00:11.633567,Tanh,ReLU,,,41,16,13.0,,,3.648787159892633e-05,2,382,0.7990997342439237,1.1920021110654977e-05,142.43083478518182,COMPLETE
1485,0.3832029104232788,2023-09-05 15:27:55.906372,2023-09-05 15:27:57.304792,0 days 00:00:01.398420,ReLU,Tanh,,,46,9,15.0,,,0.003127450825927801,2,348,0.7042995191778021,7.15114971790882e-05,111.74991847850659,COMPLETE
1486,0.43188202381134033,2023-09-05 15:27:57.305227,2023-09-05 15:27:58.161937,0 days 00:00:00.856710,Leaky,ReLU,,,49,15,14.0,,,0.026058287228188978,2,205,0.6730592097733291,0.0029997428144033513,147.5517095677993,COMPLETE
1487,0.3891482353210449,2023-09-05 15:27:58.162357,2023-09-05 15:27:58.968892,0 days 00:00:00.806535,ReLU,ReLU,,,58,14,13.0,,,0.09307635273442458,2,361,0.742590601805417,0.0006282810134766674,197.89510530414003,COMPLETE
1488,0.4958207309246063,2023-09-05 15:27:58.969312,2023-09-05 15:27:59.318386,0 days 00:00:00.349074,ReLU,ReLU,,,40,16,15.0,,,0.06343472746271518,2,404,0.335606512486328,0.0019377749701767273,149.9707893371582,COMPLETE
1489,0.4133995771408081,2023-09-05 15:27:59.318807,2023-09-05 15:28:03.020838,0 days 00:00:03.702031,Leaky,Tanh,,,47,8,14.0,,,0.0012162520252018342,2,355,0.7243710353187924,0.00034978283712767434,154.17906323906516,COMPLETE
1490,0.39178183674812317,2023-09-05 15:28:03.021268,2023-09-05 15:28:03.688254,0 days 00:00:00.666986,ReLU,ReLU,,,51,6,15.0,,,0.002771546356842572,2,391,0.25586931512721034,0.0004273163178897785,116.14274619282156,COMPLETE
1491,0.40110912919044495,2023-09-05 15:28:03.688672,2023-09-05 15:28:04.557792,0 days 00:00:00.869120,ReLU,ReLU,,,53,15,5.0,,,0.0018353496222591372,2,373,0.20751376835974028,8.90649416643582e-05,126.9197413345863,COMPLETE
1492,0.37619897723197937,2023-09-05 15:28:04.558207,2023-09-05 15:28:05.621891,0 days 00:00:01.063684,ReLU,ReLU,,,44,14,16.0,,,0.005997488404765763,2,346,0.7677897258467817,0.0038044636246425617,181.4986712137858,COMPLETE
1493,0.42097556591033936,2023-09-05 15:28:05.622308,2023-09-05 15:28:06.399920,0 days 00:00:00.777612,Leaky,Sigmoid,,,48,15,12.0,,,0.004235571798759232,2,382,0.11949552744965135,0.0008478614787075341,129.87695217132568,COMPLETE
1494,0.33255675435066223,2023-09-05 15:28:06.400347,2023-09-05 15:28:07.084806,0 days 00:00:00.684459,ReLU,ReLU,,,39,11,13.0,,,0.01634503578411454,2,366,0.4158470432854712,2.5424517341778834e-05,117.41540989731297,COMPLETE
1495,0.42450663447380066,2023-09-05 15:28:07.085251,2023-09-05 15:28:07.625429,0 days 00:00:00.540178,ReLU,Tanh,,,28,4,14.0,,,0.06941946148341133,2,354,0.15209221563723227,1.3677175360287043e-05,229.6656857577237,COMPLETE
1496,0.42499807476997375,2023-09-05 15:28:07.625853,2023-09-05 15:28:08.961596,0 days 00:00:01.335743,Leaky,ReLU,,,56,5,15.0,,,0.0022643723270678894,2,373,0.3563052518927822,0.03697796331013929,248.84503555297852,COMPLETE
1497,0.5001436471939087,2023-09-05 15:28:08.962019,2023-09-05 15:28:17.823124,0 days 00:00:08.861105,ReLU,ReLU,,,46,7,13.0,,,5.889765626776111e-05,2,344,0.7461671327954111,0.0005406197116968552,180.060476369636,COMPLETE
1498,0.45711299777030945,2023-09-05 15:28:17.823549,2023-09-05 15:28:20.353247,0 days 00:00:02.529698,ReLU,ReLU,,,43,21,16.0,,,0.0002523143524168002,2,392,0.2415772859654255,3.76246622074785e-05,1336.8420346625232,COMPLETE
1499,0.3396912217140198,2023-09-05 15:28:20.353677,2023-09-05 15:28:21.415646,0 days 00:00:01.061969,ReLU,Tanh,,,53,14,14.0,,,0.003267603416595561,2,360,0.7990327968767401,0.0015957326817831903,107.43197240584936,COMPLETE
1500,0.34693124890327454,2023-09-05 15:28:21.416067,2023-09-05 15:28:22.357854,0 days 00:00:00.941787,Leaky,ReLU,,,50,16,13.0,,,0.0015171735514850656,2,404,0.47569425915986047,0.00013877083229911995,107.26625033291903,COMPLETE
1501,0.4014352262020111,2023-09-05 15:28:22.358277,2023-09-05 15:28:27.683282,0 days 00:00:05.325005,ReLU,ReLU,,,82,15,8.0,,,0.0001863167341034064,2,349,0.6931632542873247,0.00020233114685599257,305.84150058049534,COMPLETE
1502,0.45458662509918213,2023-09-05 15:28:27.683694,2023-09-05 15:28:32.934227,0 days 00:00:05.250533,ReLU,,,,49,15,,,,0.00012259699766973997,1,269,0.7168597151030701,5.6677317901079626e-05,164.38312788612336,COMPLETE
1503,0.32449010014533997,2023-09-05 15:28:32.934656,2023-09-05 15:28:34.614914,0 days 00:00:01.680258,Leaky,ReLU,,,45,14,12.0,,,0.0026762749630195003,2,384,0.6518711338403383,0.0004148942317850881,102.28603461129325,COMPLETE
1504,0.47348159551620483,2023-09-05 15:28:34.615327,2023-09-05 15:28:36.403294,0 days 00:00:01.787967,Sigmoid,Tanh,,,42,15,14.0,,,0.0010863954877889318,2,369,0.14162127616140657,0.001018718580507067,142.5755480233725,COMPLETE
1505,0.4298204481601715,2023-09-05 15:28:36.403700,2023-09-05 15:28:37.017739,0 days 00:00:00.614039,ReLU,ReLU,,,47,16,15.0,,,0.004036287142109559,2,358,0.18695758260111917,0.07100413083971749,130.65176363344546,COMPLETE
1506,0.3681195080280304,2023-09-05 15:28:37.018151,2023-09-05 15:28:38.059393,0 days 00:00:01.041242,ReLU,ReLU,,,39,12,13.0,,,0.006656822362246919,2,344,0.7690483022113599,0.00024826286866342387,131.85938110351563,COMPLETE
1507,0.5155265927314758,2023-09-05 15:28:38.059815,2023-09-05 15:28:38.783790,0 days 00:00:00.723975,Leaky,Sigmoid,,,51,9,3.0,,,0.049736094334897875,2,378,0.7423294015975237,0.0003535290247923133,146.99689624927663,COMPLETE
1508,0.3831022083759308,2023-09-05 15:28:38.784219,2023-09-05 15:28:43.410434,0 days 00:00:04.626215,ReLU,ReLU,,,55,16,12.0,,,0.00013325711453248082,2,364,0.6681423182281256,1.9649858845016106e-05,113.79467780280007,COMPLETE
1509,0.36655279994010925,2023-09-05 15:28:43.410859,2023-09-05 15:28:44.254612,0 days 00:00:00.843753,Tanh,Tanh,,,58,8,14.0,,,0.032938665430725024,2,395,0.7682757817648617,0.002684397723315561,113.30876653334674,COMPLETE
1510,0.33042794466018677,2023-09-05 15:28:44.255034,2023-09-05 15:28:45.504985,0 days 00:00:01.249951,ReLU,ReLU,,,45,14,15.0,,,0.002076284930929684,2,168,0.607086206007396,1.1695393840728965e-05,165.85736208829013,COMPLETE
1511,0.34473201632499695,2023-09-05 15:28:45.505411,2023-09-05 15:28:46.559335,0 days 00:00:01.053924,ReLU,ReLU,,,49,15,13.0,,,0.004722734845481036,2,222,0.7055689971932849,0.0007308841809008039,118.99650119599842,COMPLETE
1512,0.35997939109802246,2023-09-05 15:28:46.559770,2023-09-05 15:28:47.687651,0 days 00:00:01.127881,Leaky,ReLU,,,41,15,14.0,,,0.0029915989358952604,2,350,0.5513047452872898,0.0005544009783601801,114.84705108642578,COMPLETE
1513,0.38438543677330017,2023-09-05 15:28:47.688064,2023-09-05 15:28:48.957214,0 days 00:00:01.269150,ReLU,ReLU,,,47,16,15.0,,,0.0017043062036783962,2,404,0.7985666908900767,4.379447106443226e-05,122.63700953396884,COMPLETE
1514,0.4226875901222229,2023-09-05 15:28:48.957636,2023-09-05 15:28:51.281482,0 days 00:00:02.323846,ReLU,Tanh,,,52,7,16.0,,,0.003757950860223054,2,374,0.7400862805863435,0.004571781706584708,117.22990043958028,COMPLETE
1515,0.35155579447746277,2023-09-05 15:28:51.281899,2023-09-05 15:28:52.610528,0 days 00:00:01.328629,Leaky,ReLU,,,43,22,12.0,,,0.001374317828697663,2,356,0.7186987858702765,0.00017270722835652572,109.52309093069523,COMPLETE
1516,0.41825440526008606,2023-09-05 15:28:52.610955,2023-09-05 15:28:53.851992,0 days 00:00:01.241037,ReLU,ReLU,,,38,16,13.0,,,0.002460851618787294,2,385,0.5659009358184782,0.027497085304654258,1760.3605789483763,COMPLETE
1517,0.4490526020526886,2023-09-05 15:28:53.852423,2023-09-05 15:28:54.672087,0 days 00:00:00.819664,ReLU,ReLU,,,31,14,15.0,,,0.005431214269576372,2,365,0.49848537631621315,0.05131179911056329,138.76009447821255,COMPLETE
1518,0.4022638499736786,2023-09-05 15:28:54.672527,2023-09-05 15:28:57.774297,0 days 00:00:03.101770,Leaky,Tanh,,,47,14,7.0,,,0.0009349639619919171,2,342,0.7999526665465272,0.00026847178802047206,128.79051462809244,COMPLETE
1519,0.3536284267902374,2023-09-05 15:28:57.774827,2023-09-05 15:28:59.176476,0 days 00:00:01.401649,ReLU,ReLU,,,37,13,14.0,,,0.020193873770708016,2,354,0.6831784920001469,1.4374521380988716e-05,115.55305941899617,COMPLETE
1520,0.3422815203666687,2023-09-05 15:28:59.176899,2023-09-05 15:29:00.441755,0 days 00:00:01.264856,ReLU,Sigmoid,,,53,15,14.0,,,0.0029011896970024403,2,373,0.7559240819732534,0.0024014639448375797,115.24771713256835,COMPLETE
1521,0.5826940536499023,2023-09-05 15:29:00.442171,2023-09-05 15:29:10.195000,0 days 00:00:09.752829,ReLU,ReLU,,,50,15,15.0,,,1.6769676843211332e-05,2,391,0.7694200477504923,0.00043987111517336747,852.1287284519361,COMPLETE
1522,0.38002967834472656,2023-09-05 15:29:10.195426,2023-09-05 15:29:11.151049,0 days 00:00:00.955623,Leaky,ReLU,,,45,16,13.0,,,0.0018827639742754006,2,406,0.37635337127555746,0.00029248089174149636,116.65724277496338,COMPLETE
1523,0.33554157614707947,2023-09-05 15:29:11.151478,2023-09-05 15:29:12.528282,0 days 00:00:01.376804,ReLU,Tanh,,,80,15,12.0,,,0.003387986585904224,2,342,0.6386367147235749,0.0019484562991046335,108.83161485051534,COMPLETE
1524,0.42894691228866577,2023-09-05 15:29:12.528704,2023-09-05 15:29:14.220014,0 days 00:00:01.691310,ReLU,ReLU,,,48,9,14.0,,,0.0022052481460986964,2,361,0.7236672017636974,0.01408644294637416,171.47993191805753,COMPLETE
1525,0.36338114738464355,2023-09-05 15:29:14.220443,2023-09-05 15:29:15.658764,0 days 00:00:01.438321,Leaky,ReLU,,,40,16,16.0,,,0.0010962126711416733,2,382,0.433409737958062,2.7707059275665862e-05,105.9217776298523,COMPLETE
1526,0.36534786224365234,2023-09-05 15:29:15.659194,2023-09-05 15:29:16.862347,0 days 00:00:01.203153,ReLU,ReLU,,,33,20,13.0,,,0.004546479755114524,2,242,0.3242253370358572,0.0006288048772107833,152.46573893229166,COMPLETE
1527,0.6192259192466736,2023-09-05 15:29:16.862777,2023-09-05 15:29:17.322156,0 days 00:00:00.459379,Sigmoid,Tanh,,,43,8,15.0,,,0.001380285772636648,2,353,0.6840348092339744,0.04064252126022739,298.93431549072267,COMPLETE
1528,0.4103637635707855,2023-09-05 15:29:17.322594,2023-09-05 15:29:17.803135,0 days 00:00:00.480541,ReLU,ReLU,,,55,14,13.0,,,0.08950403033612515,2,342,0.45243964955763794,3.3255225305880614e-05,125.47311074393136,COMPLETE
1529,0.40833377838134766,2023-09-05 15:29:17.803575,2023-09-05 15:29:22.097740,0 days 00:00:04.294165,Leaky,ReLU,,,36,15,12.0,,,0.00014151989577842154,2,371,0.2616966234244703,0.0008977661103625138,152.46688410920916,COMPLETE
1530,0.37611183524131775,2023-09-05 15:29:22.098180,2023-09-05 15:29:22.434030,0 days 00:00:00.335850,ReLU,ReLU,,,46,16,14.0,,,0.007517478336486347,2,230,0.19623067663450036,0.0033094753198575897,158.3129172188895,COMPLETE
1531,0.36826092004776,2023-09-05 15:29:22.434458,2023-09-05 15:29:22.725921,0 days 00:00:00.291463,ReLU,Tanh,,,51,14,14.0,,,0.04638553599773727,2,396,0.18239317668478222,0.000349793400077818,277.3345397024444,COMPLETE
1532,0.5663418769836426,2023-09-05 15:29:22.726342,2023-09-05 15:29:31.824570,0 days 00:00:09.098228,Tanh,ReLU,,,49,13,16.0,,,2.020125182537785e-05,2,365,0.7480487478926466,1.746630205690084e-05,180.3847226495612,COMPLETE
1533,0.5039709210395813,2023-09-05 15:29:31.825017,2023-09-05 15:29:43.458365,0 days 00:00:11.633348,ReLU,Sigmoid,,,41,6,15.0,,,5.071435744986721e-05,2,381,0.7994713964507685,0.0013339571877054113,192.58663371729412,COMPLETE
1534,0.4985262155532837,2023-09-05 15:29:43.458797,2023-09-05 15:29:47.554108,0 days 00:00:04.095311,Leaky,ReLU,,,44,5,12.0,,,9.753818569733556e-05,2,210,0.5354797753920822,0.00021310189234842615,2830.5494038899737,COMPLETE
1535,0.37139925360679626,2023-09-05 15:29:47.554550,2023-09-05 15:29:48.166427,0 days 00:00:00.611877,ReLU,ReLU,,,39,15,13.0,,,0.002573042681226176,2,350,0.13667915020768087,0.00011080496859248664,129.57991536458334,COMPLETE
1536,0.5738328099250793,2023-09-05 15:29:48.166910,2023-09-05 15:29:48.825791,0 days 00:00:00.658881,ReLU,ReLU,,,34,7,1.0,,,0.0036768415128263223,2,359,0.2168235329244661,0.004061479945109259,244.65839114431608,COMPLETE
1537,0.3639359474182129,2023-09-05 15:29:48.826248,2023-09-05 15:29:51.256577,0 days 00:00:02.430329,Leaky,Tanh,,,57,4,15.0,,,0.001727307203497916,2,387,0.7102673815432017,6.84089533899373e-05,167.1516428767024,COMPLETE
1538,0.3866022527217865,2023-09-05 15:29:51.257017,2023-09-05 15:29:52.163473,0 days 00:00:00.906456,ReLU,ReLU,,,48,15,14.0,,,0.0031261756078904738,2,371,0.7715880378121323,1.203939729719335e-05,142.29158878326416,COMPLETE
1539,0.36570557951927185,2023-09-05 15:29:52.163909,2023-09-05 15:29:52.785363,0 days 00:00:00.621454,ReLU,ReLU,,,53,22,13.0,,,0.0054042183689995546,2,403,0.4820664817523614,0.0001386911310182352,127.44759565080915,COMPLETE
1540,0.37419191002845764,2023-09-05 15:29:52.785799,2023-09-05 15:29:54.270070,0 days 00:00:01.484271,Leaky,ReLU,,,46,14,15.0,,,0.0021419271680420578,2,339,0.5909503467664299,0.00046919690757143647,268.9747469284955,COMPLETE
1541,0.492167204618454,2023-09-05 15:29:54.270505,2023-09-05 15:30:05.308236,0 days 00:00:11.037731,ReLU,Tanh,,,36,16,14.0,,,3.1224687568628915e-05,2,351,0.7415164792629467,0.012175689525189435,134.55615362618383,COMPLETE
1542,0.3714664876461029,2023-09-05 15:30:05.308675,2023-09-05 15:30:05.894942,0 days 00:00:00.586267,ReLU,ReLU,,,50,12,13.0,,,0.06612433332672651,2,362,0.6964563536268868,2.485901733482233e-05,136.8207928050648,COMPLETE
1543,0.41872960329055786,2023-09-05 15:30:05.895374,2023-09-05 15:30:11.897259,0 days 00:00:06.001885,ReLU,ReLU,,,42,15,14.0,,,0.0001152253180117686,2,377,0.4213747771716711,0.0003893707532384522,147.91716837187346,COMPLETE
1544,0.39389902353286743,2023-09-05 15:30:11.897696,2023-09-05 15:30:12.966679,0 days 00:00:01.068983,Leaky,ReLU,,,30,14,12.0,,,0.00402668262066146,2,392,0.6487175695480473,0.001559844941141243,123.21657168480658,COMPLETE
1545,0.36795154213905334,2023-09-05 15:30:12.967103,2023-09-05 15:30:17.259182,0 days 00:00:04.292079,ReLU,Sigmoid,,,26,2,15.0,,,0.0012374806283244751,2,347,0.7702930389374185,8.82421108783705e-05,134.88797393499635,COMPLETE
1546,0.34958651661872864,2023-09-05 15:30:17.259642,2023-09-05 15:30:19.788110,0 days 00:00:02.528468,ReLU,Tanh,,,44,13,16.0,,,0.0008973299321482531,2,367,0.6162042869679621,0.006885530098549456,149.66739997513798,COMPLETE
1547,0.3578823506832123,2023-09-05 15:30:19.788537,2023-09-05 15:30:20.333493,0 days 00:00:00.544956,Leaky,ReLU,,,38,16,14.0,,,0.0026356935062433135,2,355,0.26792427654649215,0.0007561500025660731,483.3730803699028,COMPLETE
