number,value,datetime_start,datetime_complete,duration,params_activation1,params_activation2,params_activation3,params_activation4,params_batch_size,params_fl1,params_fl2,params_fl3,params_fl4,params_learning_rate,params_n_layers,params_num_epochs,params_train_size,params_weight_decay,user_attrs_mre,state
481,0.3815563917160034,2023-09-05 14:48:42.454408,2023-09-05 14:48:47.020079,0 days 00:00:04.565671,Leaky,ReLU,,,36,14,12.0,,,0.0005308498254184383,2,331,0.37765481734613204,0.017618288574697223,130.16479142774054,COMPLETE
482,0.3966555893421173,2023-09-05 14:48:47.020386,2023-09-05 14:48:51.158141,0 days 00:00:04.137755,ReLU,ReLU,,,37,13,12.0,,,0.0006419143463277858,2,338,0.7466747649500038,0.0011581367803892215,102.59675721388597,COMPLETE
483,0.4117637276649475,2023-09-05 14:48:51.158443,2023-09-05 14:48:52.359714,0 days 00:00:01.201271,ReLU,ReLU,,,28,15,11.0,,,0.010413353644512116,2,317,0.7262937474932932,0.0012888949872939279,404.4013931274414,COMPLETE
484,0.557137668132782,2023-09-05 14:48:52.360015,2023-09-05 14:48:57.004204,0 days 00:00:04.644189,ReLU,ReLU,,,30,16,12.0,,,3.9472259982092425e-05,2,307,0.2940596521964834,0.0009341663059618104,178.08947145045775,COMPLETE
485,0.35247930884361267,2023-09-05 14:48:57.004517,2023-09-05 14:49:00.943166,0 days 00:00:03.938649,ReLU,,,,34,13,,,,0.0008141325278690873,1,324,0.7979849311055234,0.0007664933319248278,397.37506912693834,COMPLETE
486,0.436594694852829,2023-09-05 14:49:00.943471,2023-09-05 14:49:03.359578,0 days 00:00:02.416107,ReLU,ReLU,,,32,15,13.0,,,0.0005119293948538152,2,337,0.7532973318522941,0.0013368346431910615,177.79956771388197,COMPLETE
487,0.39581000804901123,2023-09-05 14:49:03.359904,2023-09-05 14:49:05.506338,0 days 00:00:02.146434,ReLU,Sigmoid,,,45,11,13.0,,,0.001120491901995544,2,344,0.21856353182036473,0.001783391928898672,136.71135931396483,COMPLETE
488,0.4818935990333557,2023-09-05 14:49:05.506652,2023-09-05 14:49:11.890663,0 days 00:00:06.384011,ReLU,ReLU,,,72,14,12.0,,,7.242481244164266e-05,2,329,0.7174539637464118,0.0001625517415652421,139.04741661744276,COMPLETE
489,0.4007914066314697,2023-09-05 14:49:11.890975,2023-09-05 14:49:26.378108,0 days 00:00:14.487133,ReLU,ReLU,,,35,15,2.0,,,4.85771267032644e-05,2,421,0.7745050603886158,0.0059433220392189,119.53615028218249,COMPLETE
490,0.3627757132053375,2023-09-05 14:49:26.378419,2023-09-05 14:49:28.968385,0 days 00:00:02.589966,ReLU,Leaky,,,38,14,11.0,,,0.0006809910724217665,2,352,0.32749151261290516,0.0015844300430072945,122.53240371536423,COMPLETE
491,0.3667052090167999,2023-09-05 14:49:28.968697,2023-09-05 14:49:33.769332,0 days 00:00:04.800635,ReLU,ReLU,,,21,7,13.0,,,0.000978592591910038,2,319,0.696695521520711,0.0005164732340276272,144.23910981706044,COMPLETE
492,0.37950828671455383,2023-09-05 14:49:33.769658,2023-09-05 14:49:35.713449,0 days 00:00:01.943791,Leaky,ReLU,,,73,16,13.0,,,0.0004962967901002951,2,339,0.35127964280585644,0.00214324269503791,186.0521326546717,COMPLETE
493,0.3411962687969208,2023-09-05 14:49:35.713764,2023-09-05 14:49:36.257144,0 days 00:00:00.543380,ReLU,Tanh,,,48,18,12.0,,,0.02650996868392631,2,354,0.3193508887661901,0.0002660865999440869,108.15243583501771,COMPLETE
494,0.39040476083755493,2023-09-05 14:49:36.257459,2023-09-05 14:49:39.590821,0 days 00:00:03.333362,ReLU,ReLU,,,26,13,11.0,,,0.0008984984579332461,2,434,0.35916455321457696,0.0006247636277983046,108.64095409369908,COMPLETE
495,0.35025280714035034,2023-09-05 14:49:39.591123,2023-09-05 14:49:45.408992,0 days 00:00:05.817869,ReLU,ReLU,,,68,6,14.0,,,0.0004049282903170082,2,331,0.7436867069774143,0.013804327896041553,116.73523138600883,COMPLETE
496,0.39593109488487244,2023-09-05 14:49:45.409291,2023-09-05 14:49:45.855656,0 days 00:00:00.446365,ReLU,ReLU,,,31,8,13.0,,,0.05095689342130818,2,312,0.39497952029745587,0.007187565576194286,694.2769433884393,COMPLETE
497,0.3696725368499756,2023-09-05 14:49:45.855966,2023-09-05 14:49:46.920133,0 days 00:00:01.064167,ReLU,ReLU,,,43,12,18.0,,,0.005722038262773074,2,345,0.7997657890222946,5.777928901717539e-05,144.98907380945542,COMPLETE
498,0.5200241208076477,2023-09-05 14:49:46.920441,2023-09-05 14:49:55.148230,0 days 00:00:08.227789,ReLU,ReLU,,,55,14,12.0,,,2.0471452547324082e-05,2,357,0.7190150166657233,0.00019322246948019113,875.4031519742907,COMPLETE
499,0.40522798895835876,2023-09-05 14:49:55.148538,2023-09-05 14:49:58.229564,0 days 00:00:03.081026,ReLU,Leaky,,,69,23,14.0,,,0.0005875552203425363,2,457,0.6367950286234277,0.029632226896078844,308.60690616782193,COMPLETE
500,0.43226170539855957,2023-09-05 14:49:58.229877,2023-09-05 14:49:59.705675,0 days 00:00:01.475798,ReLU,ReLU,,,71,16,10.0,,,0.001220862952060363,2,328,0.7514671972086311,0.009074711053952727,112.37507521938271,COMPLETE
501,0.4048203229904175,2023-09-05 14:49:59.705987,2023-09-05 14:50:02.711295,0 days 00:00:03.005308,ReLU,ReLU,,,45,17,11.0,,,0.0007570427086913866,2,319,0.6888868606558953,0.005059182263795872,116.02894246680106,COMPLETE
502,0.5126210451126099,2023-09-05 14:50:02.711618,2023-09-05 14:50:14.988733,0 days 00:00:12.277115,ReLU,ReLU,,,33,22,13.0,,,1.733591303585976e-05,2,338,0.7708841649134751,0.001742065077532212,196.41354137623804,COMPLETE
503,0.4131242632865906,2023-09-05 14:50:14.989066,2023-09-05 14:50:15.979206,0 days 00:00:00.990140,Tanh,ReLU,,,39,23,14.0,,,0.00045853907288546144,2,348,0.10162343229233893,0.001047505968867462,442.33693913598756,COMPLETE
504,0.4904346466064453,2023-09-05 14:50:15.979516,2023-09-05 14:50:18.305814,0 days 00:00:02.326298,ReLU,Tanh,,,74,15,13.0,,,0.0006411009379313158,2,488,0.5227253348230042,0.055422741119739494,284.40653832558473,COMPLETE
505,0.3656618595123291,2023-09-05 14:50:18.306125,2023-09-05 14:50:21.811011,0 days 00:00:03.504886,Leaky,ReLU,,,66,7,12.0,,,0.0008975327710120239,2,375,0.5868868099972541,0.00041884286397246903,106.14429263160342,COMPLETE
506,0.4852988123893738,2023-09-05 14:50:21.811321,2023-09-05 14:50:30.844287,0 days 00:00:09.032966,ReLU,ReLU,,,29,23,16.0,,,1.4831387420353486e-05,2,367,0.47351202199695963,0.0002352111709224858,413.07586630423646,COMPLETE
507,0.3554961681365967,2023-09-05 14:50:30.844606,2023-09-05 14:50:33.430209,0 days 00:00:02.585603,ReLU,Sigmoid,,,42,4,14.0,,,0.00344394482150203,2,306,0.7233894550955368,0.003591342257981437,154.34575321363366,COMPLETE
508,0.42793622612953186,2023-09-05 14:50:33.430509,2023-09-05 14:50:33.929602,0 days 00:00:00.499093,ReLU,ReLU,,,47,24,13.0,,,0.0024305285896694937,2,391,0.1745508296250866,9.836251200485025e-05,131.41771806989397,COMPLETE
509,0.41850170493125916,2023-09-05 14:50:33.929906,2023-09-05 14:50:35.917802,0 days 00:00:01.987896,ReLU,Leaky,,,35,23,16.0,,,0.001284035361578776,2,336,0.2518217984670398,0.07705712571488603,156.90099162929104,COMPLETE
510,0.4096507728099823,2023-09-05 14:50:35.918116,2023-09-05 14:50:36.338868,0 days 00:00:00.420752,ReLU,ReLU,,,18,12,11.0,,,0.004612999684438588,2,442,0.12783457275719823,0.0021307516553606275,143.28107432315224,COMPLETE
511,0.33432209491729736,2023-09-05 14:50:36.339172,2023-09-05 14:50:39.484157,0 days 00:00:03.144985,ReLU,ReLU,,,57,24,20.0,,,0.0005745984171237406,2,323,0.6937954749068441,0.005858046506464564,106.36196109610545,COMPLETE
512,0.38541093468666077,2023-09-05 14:50:39.484461,2023-09-05 14:50:42.929336,0 days 00:00:03.444875,ReLU,ReLU,,,24,14,14.0,,,0.0010904440081141971,2,351,0.6499910390849309,0.004740207802934179,111.54489960067573,COMPLETE
513,0.37788495421409607,2023-09-05 14:50:42.929643,2023-09-05 14:50:43.768382,0 days 00:00:00.838739,ReLU,ReLU,,,49,15,12.0,,,0.01595373882195489,2,359,0.6087252899160538,0.010435781588576656,117.50619888305664,COMPLETE
514,0.6196950078010559,2023-09-05 14:50:43.768703,2023-09-05 14:50:44.207097,0 days 00:00:00.438394,ReLU,ReLU,,,70,13,15.0,,,0.0007431965207063214,2,342,0.19259989584087311,0.0984647801244429,141.13920321529858,COMPLETE
515,0.3662843704223633,2023-09-05 14:50:44.207401,2023-09-05 14:50:46.505585,0 days 00:00:02.298184,ReLU,ReLU,,,68,8,13.0,,,0.0004277311281876046,2,330,0.7423672422623291,0.0008225885450368636,155.17171198981148,COMPLETE
516,0.38903677463531494,2023-09-05 14:50:46.505898,2023-09-05 14:50:48.504495,0 days 00:00:01.998597,ReLU,ReLU,,,12,24,14.0,,,0.0019678489429410277,2,353,0.23661980360205748,0.0002929482429329144,231.00685034857855,COMPLETE
517,0.39924171566963196,2023-09-05 14:50:48.504898,2023-09-05 14:50:50.293570,0 days 00:00:01.788672,Leaky,Leaky,,,59,5,12.0,,,0.0013739551421470119,2,316,0.77114930357579,0.0003830358624355547,196.74549072265626,COMPLETE
518,0.32079583406448364,2023-09-05 14:50:50.293891,2023-09-05 14:50:54.303733,0 days 00:00:04.009842,ReLU,ReLU,,,64,17,15.0,,,0.0005189293474395926,2,365,0.7100422306659346,0.0013808944069414477,112.82881022240831,COMPLETE
519,0.3585765063762665,2023-09-05 14:50:54.304070,2023-09-05 14:50:56.464327,0 days 00:00:02.160257,ReLU,ReLU,,,63,17,15.0,,,0.0005565313853224777,2,382,0.7102535880340967,0.001513510398456637,137.48944220212425,COMPLETE
520,0.3598465323448181,2023-09-05 14:50:56.464709,2023-09-05 14:50:58.489246,0 days 00:00:02.024537,ReLU,Tanh,,,61,18,15.0,,,0.0008375227270069277,2,413,0.799885108107502,0.0009082821498365122,118.74487088050371,COMPLETE
521,0.35522159934043884,2023-09-05 14:50:58.489581,2023-09-05 14:51:00.777583,0 days 00:00:02.288002,ReLU,ReLU,,,64,17,9.0,,,0.000688179875120514,2,481,0.3390243176817032,0.0015755550836874372,106.852757714789,COMPLETE
522,0.45434197783470154,2023-09-05 14:51:00.777943,2023-09-05 14:51:02.410439,0 days 00:00:01.632496,ReLU,ReLU,,,66,16,16.0,,,0.0005076694906992061,2,374,0.1554732543428799,0.0012450476776220893,241.61934804778966,COMPLETE
523,0.34258952736854553,2023-09-05 14:51:02.410776,2023-09-05 14:51:04.749909,0 days 00:00:02.339133,ReLU,ReLU,,,62,18,6.0,,,0.0009950313741221154,2,367,0.7440104688573509,0.0011742357635699256,254.3875966389974,COMPLETE
524,0.42369383573532104,2023-09-05 14:51:04.750222,2023-09-05 14:51:05.273795,0 days 00:00:00.523573,ReLU,ReLU,,,65,17,15.0,,,0.001589746118088039,2,302,0.1336612666011109,0.0009942720817459362,161.89484425594932,COMPLETE
525,0.40885037183761597,2023-09-05 14:51:05.274121,2023-09-05 14:51:07.179807,0 days 00:00:01.905686,ReLU,ReLU,,,53,17,15.0,,,0.0006927100185492961,2,256,0.2673016043762168,0.019932531941901453,172.4212766808657,COMPLETE
526,0.4349237382411957,2023-09-05 14:51:07.180141,2023-09-05 14:51:07.641986,0 days 00:00:00.461845,Tanh,ReLU,,,59,16,14.0,,,0.0026263818713051813,2,465,0.17468897658808127,0.0007136705870027394,135.4208185831706,COMPLETE
527,0.31581637263298035,2023-09-05 14:51:07.642310,2023-09-05 14:51:11.470969,0 days 00:00:03.828659,ReLU,Leaky,,,64,18,16.0,,,0.0005994342898396977,2,323,0.7219960488632877,0.0005118756173859807,109.62899369133844,COMPLETE
528,0.36761602759361267,2023-09-05 14:51:11.471313,2023-09-05 14:51:14.634197,0 days 00:00:03.162884,ReLU,Leaky,ReLU,ReLU,65,16,16.0,14.0,7.0,0.00046767233399435385,4,311,0.44518794063701894,0.0005109925260490217,185.0899570376374,COMPLETE
529,0.35716602206230164,2023-09-05 14:51:14.634522,2023-09-05 14:51:17.870987,0 days 00:00:03.236465,ReLU,Leaky,,,64,18,16.0,,,0.0005718378884416818,2,323,0.6850216410369726,0.0005528889894247546,111.61583523750305,COMPLETE
530,0.3967805802822113,2023-09-05 14:51:17.871303,2023-09-05 14:51:19.082801,0 days 00:00:01.211498,ReLU,Leaky,,,63,19,17.0,,,0.0008635401890685666,2,330,0.21112934633590355,0.0007000591065051536,126.65526513368386,COMPLETE
531,0.4528314471244812,2023-09-05 14:51:19.083112,2023-09-05 14:51:20.317936,0 days 00:00:01.234824,Leaky,,,,62,6,,,,0.0042449232470951155,1,223,0.7152727327305117,0.00045213917790807624,112.82321012192878,COMPLETE
532,0.4913298487663269,2023-09-05 14:51:20.318240,2023-09-05 14:51:20.748519,0 days 00:00:00.430279,ReLU,Leaky,,,61,23,16.0,,,0.0003866511701741289,2,52,0.24024677919680992,0.00013704084221435742,128.03303117018478,COMPLETE
533,0.343973308801651,2023-09-05 14:51:20.748833,2023-09-05 14:51:21.315720,0 days 00:00:00.566887,ReLU,Leaky,,,66,22,16.0,,,0.0035726773720331493,2,319,0.3171979043476196,0.008208984109498135,126.2416763305664,COMPLETE
534,0.34318310022354126,2023-09-05 14:51:21.316087,2023-09-05 14:51:23.398439,0 days 00:00:02.082352,ReLU,Leaky,,,45,23,15.0,,,0.0011235008420656155,2,339,0.6797956962044153,0.000583525183651977,130.825856590271,COMPLETE
535,0.3428666591644287,2023-09-05 14:51:23.398758,2023-09-05 14:51:26.028938,0 days 00:00:02.630180,ReLU,Leaky,,,67,24,17.0,,,0.0004889186718155183,2,324,0.5635237161877515,0.0003464872873986031,100.35637558562846,COMPLETE
536,0.38135185837745667,2023-09-05 14:51:26.029252,2023-09-05 14:51:27.175634,0 days 00:00:01.146382,ReLU,Leaky,,,64,7,15.0,,,0.0013753212230734613,2,303,0.21657201657212144,0.0016561621754326164,117.33784859135466,COMPLETE
537,0.4314540922641754,2023-09-05 14:51:27.176013,2023-09-05 14:51:28.921041,0 days 00:00:01.745028,Sigmoid,Leaky,,,100,16,14.0,,,0.001831539407374177,2,334,0.7122057824854523,0.0013481917683484867,157.34657601329766,COMPLETE
538,0.3916524052619934,2023-09-05 14:51:28.921362,2023-09-05 14:51:31.171048,0 days 00:00:02.249686,ReLU,ReLU,,,60,24,16.0,,,0.0007696964814379892,2,313,0.40440265250427515,0.006909857810467778,110.06512323304928,COMPLETE
539,0.35975557565689087,2023-09-05 14:51:31.171369,2023-09-05 14:51:33.603099,0 days 00:00:02.431730,ReLU,Leaky,,,58,22,15.0,,,0.0005952519125881974,2,449,0.3408276017360407,0.00041895660565639424,337.02495595949506,COMPLETE
540,0.4243548512458801,2023-09-05 14:51:33.603412,2023-09-05 14:51:38.608138,0 days 00:00:05.004726,ReLU,Sigmoid,,,42,23,14.0,,,0.00033653083004267243,2,500,0.27137562315090147,0.0004783436920286847,162.78996227578756,COMPLETE
541,0.3996175527572632,2023-09-05 14:51:38.608450,2023-09-05 14:51:39.608460,0 days 00:00:01.000010,ReLU,Tanh,,,65,17,15.0,,,0.00676653985016497,2,431,0.6561933171128024,0.012809140122655757,108.25490158081055,COMPLETE
542,0.36265280842781067,2023-09-05 14:51:39.608773,2023-09-05 14:51:42.606192,0 days 00:00:02.997419,ReLU,Leaky,,,16,15,17.0,,,0.0009840105998105797,2,345,0.416135313753921,0.0018057796789579578,237.27030246229057,COMPLETE
543,0.35708102583885193,2023-09-05 14:51:42.606526,2023-09-05 14:51:45.136820,0 days 00:00:02.530294,ReLU,ReLU,,,62,24,16.0,,,0.00040820020096502793,2,328,0.7361129992853026,0.00017187045954092302,111.60495897376019,COMPLETE
544,0.37007424235343933,2023-09-05 14:51:45.137143,2023-09-05 14:51:54.003925,0 days 00:00:08.866782,ReLU,ReLU,,,45,23,14.0,,,0.00010867237458908965,2,335,0.696974215740637,0.009060895851651705,120.21748418096286,COMPLETE
545,0.3046707510948181,2023-09-05 14:51:54.004241,2023-09-05 14:51:55.520916,0 days 00:00:01.516675,Leaky,ReLU,,,40,7,15.0,,,0.002793663964376496,2,345,0.5032105865143766,0.00027730129515951606,106.54489792717828,COMPLETE
546,0.415820837020874,2023-09-05 14:51:55.521237,2023-09-05 14:51:57.631851,0 days 00:00:02.110614,Sigmoid,ReLU,,,40,6,16.0,,,0.002970501935232178,2,342,0.590500733869179,0.0002806905427308204,132.82415529138902,COMPLETE
547,0.36553332209587097,2023-09-05 14:51:57.632181,2023-09-05 14:51:58.658156,0 days 00:00:01.025975,Leaky,Tanh,,,40,7,15.0,,,0.0037822896711353082,2,348,0.5442379097293502,0.00021563161866583496,116.4692084572532,COMPLETE
548,0.39372900128364563,2023-09-05 14:51:58.658476,2023-09-05 14:52:00.808047,0 days 00:00:02.149571,Leaky,ReLU,,,43,7,15.0,,,0.0023006195213040267,2,322,0.6305571965866672,0.0003327479723598259,313.3359208381039,COMPLETE
549,0.36867401003837585,2023-09-05 14:52:00.808358,2023-09-05 14:52:02.773399,0 days 00:00:01.965041,Leaky,Leaky,,,39,7,16.0,,,0.002591197568355466,2,334,0.6164997816972231,1.8804248747090832e-05,133.80848633615594,COMPLETE
550,0.3519013822078705,2023-09-05 14:52:02.773728,2023-09-05 14:52:03.880987,0 days 00:00:01.107259,Leaky,ReLU,,,37,8,15.0,,,0.0016617792985981357,2,352,0.7639318223403172,0.00022253813733381111,133.45527186538234,COMPLETE
551,0.3892536759376526,2023-09-05 14:52:03.881303,2023-09-05 14:52:05.661096,0 days 00:00:01.779793,Leaky,ReLU,,,42,8,17.0,,,0.001994786972710764,2,341,0.4694653624952962,0.0006207001561329351,139.78729018344674,COMPLETE
552,0.38348838686943054,2023-09-05 14:52:05.661416,2023-09-05 14:52:07.420886,0 days 00:00:01.759470,Leaky,ReLU,,,38,7,15.0,,,0.0011673654677710598,2,313,0.5419379510651705,0.0002986837833743114,126.64603932698567,COMPLETE
553,0.38696223497390747,2023-09-05 14:52:07.421207,2023-09-05 14:52:08.898085,0 days 00:00:01.476878,Leaky,ReLU,,,41,6,16.0,,,0.001341665746154344,2,356,0.3771780244824653,0.0004102108907426189,323.52474391206783,COMPLETE
554,0.3394588828086853,2023-09-05 14:52:08.898411,2023-09-05 14:52:10.311081,0 days 00:00:01.412670,Leaky,ReLU,,,44,8,14.0,,,0.0033247241369330645,2,327,0.7374268846004214,0.000256031938183126,112.31780989626621,COMPLETE
555,0.4793751537799835,2023-09-05 14:52:10.311419,2023-09-05 14:52:19.085612,0 days 00:00:08.774193,Leaky,ReLU,,,43,7,15.0,,,3.241311203474938e-05,2,346,0.6629971745054448,0.0003480774860755515,639.4512964590436,COMPLETE
556,0.33839741349220276,2023-09-05 14:52:19.085936,2023-09-05 14:52:20.518180,0 days 00:00:01.432244,Leaky,Leaky,,,41,16,18.0,,,0.0029804969461197425,2,330,0.5098033608725657,0.002021479570646562,7860.248818217844,COMPLETE
557,0.3769972026348114,2023-09-05 14:52:20.518564,2023-09-05 14:52:23.158571,0 days 00:00:02.640007,Leaky,ReLU,Tanh,,77,8,13.0,10.0,,0.0008515015766385262,3,337,0.7675291045180646,0.016385885355762644,134.70302073160806,COMPLETE
558,0.41625770926475525,2023-09-05 14:52:23.158891,2023-09-05 14:52:32.443805,0 days 00:00:09.284914,ReLU,ReLU,,,47,15,16.0,,,9.245677735168123e-05,2,361,0.7231720113043205,0.0005303575922278385,156.24129669950278,COMPLETE
559,0.41503047943115234,2023-09-05 14:52:32.444125,2023-09-05 14:52:34.267551,0 days 00:00:01.823426,Tanh,ReLU,,,60,18,15.0,,,0.0015880672591944238,2,320,0.6696026749898049,0.0010003610793567744,148.04730042957124,COMPLETE
560,0.37891045212745667,2023-09-05 14:52:34.267864,2023-09-05 14:52:37.058345,0 days 00:00:02.790481,ReLU,Tanh,,,55,6,14.0,,,0.001007872161050169,2,303,0.5664645918665294,0.00018498283852815914,117.64851303605843,COMPLETE
561,0.3717867434024811,2023-09-05 14:52:37.058664,2023-09-05 14:52:42.460000,0 days 00:00:05.401336,ReLU,ReLU,,,39,24,13.0,,,0.0001778651076570869,2,348,0.3597596449985692,0.0013920611969369188,160.31413036653365,COMPLETE
562,0.37678462266921997,2023-09-05 14:52:42.460319,2023-09-05 14:52:45.126160,0 days 00:00:02.665841,ReLU,ReLU,,,37,17,15.0,,,0.0007031037037652747,2,337,0.6334912442622956,0.0007579471112388335,152.5220520019531,COMPLETE
563,0.4299199879169464,2023-09-05 14:52:45.126469,2023-09-05 14:52:46.809601,0 days 00:00:01.683132,Sigmoid,ReLU,,,46,15,13.0,,,0.0020039892445116365,2,311,0.2017844441791012,0.0022706276964694853,165.60669723434827,COMPLETE
564,0.5776911973953247,2023-09-05 14:52:46.809916,2023-09-05 14:52:49.271124,0 days 00:00:02.461208,ReLU,Leaky,,,63,7,21.0,,,5.339077840555966e-05,2,359,0.22522591381943535,0.0003547086878338716,135.38564695820503,COMPLETE
565,0.4074845016002655,2023-09-05 14:52:49.271457,2023-09-05 14:52:50.599489,0 days 00:00:01.328032,Leaky,Sigmoid,,,60,24,16.0,,,0.004023270113255885,2,346,0.7415299464463502,0.00023966020794752462,128.1423740386963,COMPLETE
566,0.37581780552864075,2023-09-05 14:52:50.599814,2023-09-05 14:52:51.195209,0 days 00:00:00.595395,ReLU,ReLU,,,57,16,14.0,,,0.008447937371077418,2,330,0.7050119042142377,0.00011311944846264359,125.57640533447265,COMPLETE
567,0.5143399238586426,2023-09-05 14:52:51.195528,2023-09-05 14:52:51.450150,0 days 00:00:00.254622,ReLU,ReLU,ReLU,,62,2,14.0,23.0,,0.03955763772979296,3,318,0.2909279738478334,0.07448458755669575,169.99708862304686,COMPLETE
568,0.38155317306518555,2023-09-05 14:52:51.450470,2023-09-05 14:52:52.612217,0 days 00:00:01.161747,ReLU,ReLU,,,64,8,13.0,,,0.001208705306372,2,418,0.46076050965009224,0.0002844886548112396,161.80943016778855,COMPLETE
569,0.4413648545742035,2023-09-05 14:52:52.612528,2023-09-05 14:52:56.097338,0 days 00:00:03.484810,ReLU,ReLU,,,44,7,15.0,,,0.0005896295086359425,2,355,0.2778092997723552,0.03549883612590185,122.80938341694494,COMPLETE
570,0.4167736768722534,2023-09-05 14:52:56.097647,2023-09-05 14:52:57.474504,0 days 00:00:01.376857,ReLU,ReLU,,,41,24,16.0,,,0.0008303988135600771,2,340,0.49528291273568975,0.0004791317208513063,182.84020637063418,COMPLETE
571,0.34264278411865234,2023-09-05 14:52:57.474815,2023-09-05 14:52:58.787769,0 days 00:00:01.312954,ReLU,Leaky,,,49,20,15.0,,,0.004858444835299516,2,324,0.7759382269194606,0.00013317032317747252,268.7871532034367,COMPLETE
572,0.41138574481010437,2023-09-05 14:52:58.788088,2023-09-05 14:52:59.865836,0 days 00:00:01.077748,ReLU,ReLU,,,58,11,13.0,,,0.006087953408254834,2,349,0.6008691612966841,0.0018011786220605047,312.44918932233537,COMPLETE
573,0.4915432929992676,2023-09-05 14:52:59.866154,2023-09-05 14:53:07.136132,0 days 00:00:07.269978,ReLU,ReLU,,,62,6,7.0,,,0.0001389025907892546,2,361,0.6785262174655514,0.0010625490513140035,142.4620596127497,COMPLETE
574,0.41306397318840027,2023-09-05 14:53:07.136449,2023-09-05 14:53:08.800412,0 days 00:00:01.663963,Tanh,ReLU,,,36,17,14.0,,,0.0014623276631957963,2,334,0.645274702230352,0.00016405519080225215,173.4034777189556,COMPLETE
575,0.36850881576538086,2023-09-05 14:53:08.800721,2023-09-05 14:53:11.278173,0 days 00:00:02.477452,ReLU,Tanh,,,66,24,13.0,,,0.000677166159118339,2,312,0.7421992887529363,2.0690749349739273e-05,113.73169204048489,COMPLETE
576,0.41576912999153137,2023-09-05 14:53:11.278509,2023-09-05 14:53:12.162792,0 days 00:00:00.884283,Leaky,ReLU,,,43,15,14.0,,,0.005466145984203742,2,402,0.7964541863682025,0.020281052514030947,144.07667880588107,COMPLETE
577,0.5867753624916077,2023-09-05 14:53:12.163104,2023-09-05 14:53:12.595096,0 days 00:00:00.431992,ReLU,ReLU,Sigmoid,,45,24,14.0,11.0,,0.07254570671289425,3,441,0.7122493848621011,1.365901524887562e-05,163.05522346496582,COMPLETE
