number,value,datetime_start,datetime_complete,duration,params_activation1,params_activation2,params_activation3,params_activation4,params_batch_size,params_fl1,params_fl2,params_fl3,params_fl4,params_learning_rate,params_n_layers,params_num_epochs,params_train_size,params_weight_decay,user_attrs_mre,state
0,0.613554060459137,2023-09-05 14:14:09.853251,2023-09-05 14:14:10.632533,0 days 00:00:00.779282,Sigmoid,Tanh,Leaky,Sigmoid,37,10,18.0,6.0,7.0,0.014364540628950847,4,321,0.19433503235510213,0.002498155431770606,194.3862888502038,COMPLETE
1,0.7845820784568787,2023-09-05 14:14:10.632866,2023-09-05 14:14:11.073862,0 days 00:00:00.440996,Tanh,Leaky,Sigmoid,,78,21,9.0,13.0,,0.00010230006531408318,3,119,0.1078050064264902,7.007860420991934e-05,118.69825725395138,COMPLETE
2,0.3965592384338379,2023-09-05 14:14:11.074162,2023-09-05 14:14:11.904061,0 days 00:00:00.829899,Leaky,ReLU,,,30,19,7.0,,,0.003501521035515045,2,121,0.23262327972404323,0.003790621186767353,276.3780479984007,COMPLETE
3,0.39833852648735046,2023-09-05 14:14:11.904329,2023-09-05 14:14:21.738536,0 days 00:00:09.834207,Leaky,Leaky,Tanh,,51,24,21.0,12.0,,7.273430883195843e-05,3,390,0.5715978788292734,2.21504406927635e-05,137.33725600426558,COMPLETE
4,0.5346022248268127,2023-09-05 14:14:21.738821,2023-09-05 14:14:25.271640,0 days 00:00:03.532819,Leaky,,,,56,8,,,,0.00016305212512102282,1,142,0.593742665546871,0.03737167389731607,699.907352931063,COMPLETE
5,0.5615161657333374,2023-09-05 14:14:25.271892,2023-09-05 14:14:25.669461,0 days 00:00:00.397569,Leaky,Sigmoid,Leaky,Sigmoid,98,2,15.0,1.0,6.0,0.001954936444366264,4,129,0.32981384309906925,8.958187802177074e-05,134.07443367562644,COMPLETE
6,0.3170677721500397,2023-09-05 14:14:25.669737,2023-09-05 14:14:29.616186,0 days 00:00:03.946449,ReLU,Leaky,,,64,7,14.0,,,0.00042481717037189305,2,430,0.6894334804418834,0.003183681850675377,134.51941960974585,COMPLETE
7,0.6193010807037354,2023-09-05 14:14:29.616458,2023-09-05 14:14:44.966779,0 days 00:00:15.350321,Sigmoid,,,,22,20,,,,1.383508245228781e-05,1,494,0.5809953850178233,1.3538439943867737e-05,128.61282944775786,COMPLETE
8,0.4364404082298279,2023-09-05 14:14:44.967032,2023-09-05 14:14:48.171252,0 days 00:00:03.204220,Sigmoid,Leaky,Tanh,ReLU,62,5,7.0,19.0,19.0,0.001983985638013345,4,303,0.526450421196404,1.7759493144875844e-05,187.4662110299775,COMPLETE
9,0.9559191465377808,2023-09-05 14:14:48.171528,2023-09-05 14:14:54.527224,0 days 00:00:06.355696,Sigmoid,Sigmoid,ReLU,Leaky,49,10,1.0,10.0,10.0,2.3355815028013055e-05,4,316,0.33067682062956866,0.00029601725684108956,99.85753636420527,COMPLETE
10,0.5909600853919983,2023-09-05 14:14:54.527504,2023-09-05 14:14:54.925613,0 days 00:00:00.398109,ReLU,ReLU,,,80,14,23.0,,,0.04242452806180379,2,457,0.7261119418861403,0.08639098421056504,171.94100494384764,COMPLETE
11,0.37015536427497864,2023-09-05 14:14:54.925865,2023-09-05 14:14:57.421272,0 days 00:00:02.495407,ReLU,ReLU,,,20,14,11.0,,,0.000665874097566295,2,214,0.22636889433294335,0.002986058439871393,113.86129264564781,COMPLETE
12,0.36515650153160095,2023-09-05 14:14:57.421529,2023-09-05 14:15:08.191818,0 days 00:00:10.770289,ReLU,ReLU,,,17,15,13.0,,,0.0004155791349023447,2,213,0.7952623392420595,0.006979928672472895,118.2220596405397,COMPLETE
13,0.33673983812332153,2023-09-05 14:15:08.192083,2023-09-05 14:15:19.463634,0 days 00:00:11.271551,ReLU,Tanh,,,11,16,15.0,,,0.00035364186635847424,2,212,0.7900735182371059,0.010148719430437967,109.36864634393488,COMPLETE
14,0.5911859273910522,2023-09-05 14:15:19.463880,2023-09-05 14:15:23.082693,0 days 00:00:03.618813,ReLU,,,,74,1,,,,0.0003667074924252459,1,379,0.43638394894613586,0.017003810795462215,266.2418022457717,COMPLETE
15,0.3879270553588867,2023-09-05 14:15:23.082938,2023-09-05 14:15:26.276018,0 days 00:00:03.193080,ReLU,Tanh,Sigmoid,,38,6,17.0,22.0,,0.0009294749894102126,3,228,0.7422664346199263,0.0005357998592668518,134.8032730647496,COMPLETE
16,0.46812885999679565,2023-09-05 14:15:26.276290,2023-09-05 14:15:31.148244,0 days 00:00:04.871954,Tanh,Tanh,,,11,16,19.0,,,0.00021323364540674986,2,66,0.4045731976092126,0.011326252392943827,134.7587312640566,COMPLETE
17,0.39517033100128174,2023-09-05 14:15:31.148506,2023-09-05 14:15:42.817485,0 days 00:00:11.668979,ReLU,Tanh,ReLU,,67,11,14.0,24.0,,5.8345662875445463e-05,3,379,0.794652258937284,0.0011980548170336198,141.4104866692133,COMPLETE
18,0.4317808747291565,2023-09-05 14:15:42.817767,2023-09-05 14:15:43.213155,0 days 00:00:00.395388,ReLU,,,,89,17,,,,0.007045219954096982,1,252,0.46555833200049423,0.01987099842780076,143.63165225982667,COMPLETE
19,0.42113596200942993,2023-09-05 14:15:43.213393,2023-09-05 14:15:48.070033,0 days 00:00:04.856640,ReLU,Leaky,,,40,4,3.0,,,0.0008908832919864274,2,185,0.6566492317695308,0.0012802718090818505,205.75487349226668,COMPLETE
20,0.3838822543621063,2023-09-05 14:15:48.070284,2023-09-05 14:15:51.680525,0 days 00:00:03.610241,Tanh,Leaky,ReLU,,67,8,16.0,17.0,,0.0004027435277655299,3,412,0.6436350306862451,0.007495002635579798,138.1507563146745,COMPLETE
21,0.3633286654949188,2023-09-05 14:15:51.680796,2023-09-05 14:16:03.155267,0 days 00:00:11.474471,ReLU,ReLU,,,12,13,12.0,,,0.0003031849590081798,2,193,0.7538563077464387,0.006215820568618692,131.4973301046035,COMPLETE
22,0.3644932806491852,2023-09-05 14:16:03.155516,2023-09-05 14:16:42.223275,0 days 00:00:39.067759,ReLU,Tanh,,,11,12,11.0,,,0.00019303576198147912,2,265,0.7978580209330481,0.0050845171104952165,110.00776926676433,COMPLETE
23,0.5196378231048584,2023-09-05 14:16:42.223682,2023-09-05 14:16:56.483117,0 days 00:00:14.259435,ReLU,ReLU,,,28,18,12.0,,,3.661038380826436e-05,2,176,0.49266990274135264,0.0025261126621869932,128.9343806180087,COMPLETE
24,0.4367256164550781,2023-09-05 14:16:56.483526,2023-09-05 14:17:12.642814,0 days 00:00:16.159288,ReLU,,,,29,13,,,,0.00015014067426175523,1,344,0.6397290820978586,0.02772975980901779,129.66663617865984,COMPLETE
25,0.5763598084449768,2023-09-05 14:17:12.643058,2023-09-05 14:17:18.845267,0 days 00:00:06.202209,ReLU,Sigmoid,,,10,8,9.0,,,0.0003377904995737526,2,54,0.5290398192517294,0.010930100847270249,146.1472853201407,COMPLETE
26,0.5596794486045837,2023-09-05 14:17:18.845528,2023-09-05 14:17:26.030584,0 days 00:00:07.185056,ReLU,ReLU,Leaky,,58,16,20.0,1.0,,7.705269456481164e-05,3,288,0.6806888440409858,0.00660337397355396,122.34343674447801,COMPLETE
27,0.4159860610961914,2023-09-05 14:17:26.030835,2023-09-05 14:17:28.610123,0 days 00:00:02.579288,ReLU,Tanh,,,43,23,15.0,,,0.0015406569802731856,2,171,0.6685007410230684,0.0412608660253379,111.48873996734619,COMPLETE
28,0.41092032194137573,2023-09-05 14:17:28.610374,2023-09-05 14:17:37.225814,0 days 00:00:08.615440,Tanh,,,,24,12,,,,0.0006623163136817936,1,249,0.5358863477079155,0.001906978218531749,125.57039590245749,COMPLETE
29,0.471747487783432,2023-09-05 14:17:37.226071,2023-09-05 14:17:38.585512,0 days 00:00:01.359441,Sigmoid,Leaky,,,48,10,9.0,,,0.003400979078176474,2,87,0.40557673459414234,0.003802749207549289,178.311063306085,COMPLETE
30,0.3506752848625183,2023-09-05 14:17:38.585914,2023-09-05 14:17:58.743736,0 days 00:00:20.157822,ReLU,Tanh,Sigmoid,,16,7,13.0,6.0,,0.00024477077408082467,3,334,0.6928547723347643,0.0023599238173272648,161.290259320971,COMPLETE
31,0.43796101212501526,2023-09-05 14:17:58.744005,2023-09-05 14:18:18.097691,0 days 00:00:19.353686,ReLU,Tanh,Sigmoid,,16,7,13.0,6.0,,0.00012694467398051185,3,343,0.6031300598435066,0.001843533348163318,225.35168238698094,COMPLETE
32,0.5546210408210754,2023-09-05 14:18:18.097949,2023-09-05 14:18:25.819794,0 days 00:00:07.721845,ReLU,Tanh,Sigmoid,,16,3,16.0,6.0,,0.0002417358362276204,3,451,0.6993340997399464,0.000757153340847856,258.421332243447,COMPLETE
33,0.37123146653175354,2023-09-05 14:18:25.820053,2023-09-05 14:18:31.197131,0 days 00:00:05.377078,ReLU,Tanh,,,33,9,11.0,,,0.0005746569744132324,2,342,0.7145309587259812,0.0037848033623082795,249.06144287867576,COMPLETE
34,0.5070704221725464,2023-09-05 14:18:31.197378,2023-09-05 14:18:48.404879,0 days 00:00:17.207501,ReLU,Tanh,Sigmoid,,24,6,14.0,9.0,,0.00011798219975001324,3,409,0.589537141240374,0.011571864989014245,147.42296558169264,COMPLETE
35,0.3809027671813965,2023-09-05 14:18:48.405144,2023-09-05 14:18:53.071680,0 days 00:00:04.666536,Leaky,Leaky,,,34,21,17.0,,,0.0002464490756490467,2,207,0.4809635395000439,0.004529627095783057,117.48516801474752,COMPLETE
36,0.3808378577232361,2023-09-05 14:18:53.071945,2023-09-05 14:18:58.049316,0 days 00:00:04.977371,Tanh,Tanh,Tanh,,15,18,18.0,15.0,,0.0013155263827862688,3,158,0.603055317753012,0.0023561977204201697,117.44248302562816,COMPLETE
37,0.4992351233959198,2023-09-05 14:18:58.049577,2023-09-05 14:18:59.393910,0 days 00:00:01.344333,Leaky,ReLU,,,73,11,12.0,,,9.289733062701668e-05,2,279,0.16557571451495998,0.007056932560018021,187.39933410425766,COMPLETE
38,0.5745350122451782,2023-09-05 14:18:59.394172,2023-09-05 14:19:19.630912,0 days 00:00:20.236740,ReLU,Sigmoid,Sigmoid,Tanh,26,14,7.0,4.0,24.0,5.1370453690548025e-05,4,463,0.5455058504158303,0.0016147240278116164,155.7557734578011,COMPLETE
39,0.4537351727485657,2023-09-05 14:19:19.631201,2023-09-05 14:19:26.619845,0 days 00:00:06.988644,Sigmoid,Leaky,Sigmoid,,19,5,10.0,9.0,,0.0005322398731841963,3,105,0.7269946813384719,0.0006939268696768645,157.95402403331937,COMPLETE
40,0.41825681924819946,2023-09-05 14:19:26.620108,2023-09-05 14:19:32.212707,0 days 00:00:05.592599,Leaky,,,,83,9,,,,0.0002597184112788385,1,427,0.6295785806031532,0.0031011808460779627,125.10113989943922,COMPLETE
41,0.3701995015144348,2023-09-05 14:19:32.212955,2023-09-05 14:19:50.565447,0 days 00:00:18.352492,ReLU,Tanh,,,11,12,14.0,,,0.00016722911599826342,2,253,0.7862765801670188,0.004934418195020163,143.51544331763074,COMPLETE
42,0.417441725730896,2023-09-05 14:19:50.565705,2023-09-05 14:20:05.624311,0 days 00:00:15.058606,ReLU,Tanh,,,12,13,10.0,,,0.0001806504902269628,2,304,0.7956864436316973,0.004608422549181213,137.37904757331398,COMPLETE
43,0.4543312191963196,2023-09-05 14:20:05.624563,2023-09-05 14:20:16.933415,0 days 00:00:11.308852,ReLU,Tanh,,,21,15,12.0,,,0.00010093129917967096,2,233,0.711771676892029,0.002572395764433077,123.98007277460057,COMPLETE
44,0.3605576157569885,2023-09-05 14:20:16.933670,2023-09-05 14:20:23.043827,0 days 00:00:06.110157,ReLU,Tanh,,,14,11,8.0,,,0.0003943429668393986,2,195,0.5673056243927735,0.0013465284267903113,107.91990920475551,COMPLETE
45,0.3716374635696411,2023-09-05 14:20:23.044075,2023-09-05 14:20:25.499416,0 days 00:00:02.455341,ReLU,ReLU,,,61,7,5.0,,,0.0008361456452344748,2,140,0.5851973672262728,0.0010453193619052504,145.85042697361538,COMPLETE
46,0.43653982877731323,2023-09-05 14:20:25.499673,2023-09-05 14:20:29.307732,0 days 00:00:03.808059,Sigmoid,Leaky,,,53,9,8.0,,,0.0003518079854224991,2,208,0.5574915262858027,0.0003808956469328381,135.07615782664374,COMPLETE
47,0.35115188360214233,2023-09-05 14:20:29.307988,2023-09-05 14:20:35.193825,0 days 00:00:05.885837,ReLU,Tanh,Leaky,,33,10,4.0,4.0,,0.00044928114154975455,3,157,0.6690734915684401,0.0012721500715169606,119.64011732939701,COMPLETE
48,0.49552908539772034,2023-09-05 14:20:35.194094,2023-09-05 14:20:39.092494,0 days 00:00:03.898400,ReLU,Tanh,Leaky,,45,11,2.0,4.0,,0.0004814952227866825,3,492,0.6670273316083634,0.0002599294874015024,156.35972371495757,COMPLETE
49,0.3697989881038666,2023-09-05 14:20:39.092754,2023-09-05 14:20:41.558020,0 days 00:00:02.465266,ReLU,Tanh,Leaky,Tanh,33,10,5.0,2.0,1.0,0.0010913628928517053,4,151,0.5014837857561522,0.0011528640100100798,131.78900166829428,COMPLETE
50,0.561640202999115,2023-09-05 14:20:41.558290,2023-09-05 14:20:47.285897,0 days 00:00:05.727607,Tanh,Tanh,Leaky,,20,7,4.0,4.0,,0.0005067806765156846,3,111,0.6165721669487553,0.0016192017711404508,141.1454163284989,COMPLETE
51,0.4207212030887604,2023-09-05 14:20:47.286167,2023-09-05 14:21:02.802991,0 days 00:00:15.516824,ReLU,Sigmoid,Leaky,,15,15,15.0,8.0,,0.00028050738355128436,3,195,0.7437291265074256,0.0031371248735632077,154.14411465241946,COMPLETE
52,0.481613427400589,2023-09-05 14:21:02.803261,2023-09-05 14:21:18.462564,0 days 00:00:15.659303,ReLU,ReLU,,,14,5,5.0,,,0.00034418887197740173,2,227,0.723802191440713,0.0019976360569350935,170.26267188656172,COMPLETE
53,0.4271150529384613,2023-09-05 14:21:18.462825,2023-09-05 14:21:22.998667,0 days 00:00:04.535842,ReLU,Tanh,ReLU,,23,13,1.0,7.0,,0.0007242280048073678,3,127,0.6538766803636353,0.0012842313808451686,159.45676795296046,COMPLETE
54,0.3985455632209778,2023-09-05 14:21:22.998933,2023-09-05 14:21:25.769484,0 days 00:00:02.770551,ReLU,Tanh,,,66,11,7.0,,,0.00044857755184679685,2,167,0.5732090088230815,0.0008873926638799828,118.59926536697114,COMPLETE
55,0.4482300877571106,2023-09-05 14:21:25.769753,2023-09-05 14:21:37.106963,0 days 00:00:11.337210,ReLU,Leaky,,,19,9,13.0,,,0.00015272757388496558,2,191,0.7441091009407766,0.009188367297119669,243.93015293301087,COMPLETE
56,0.4325917661190033,2023-09-05 14:21:37.107221,2023-09-05 14:21:41.732231,0 days 00:00:04.625010,ReLU,ReLU,Tanh,,27,6,22.0,13.0,,0.0010937885859323945,3,371,0.675036284696261,0.016613716124412963,133.26200746235094,COMPLETE
57,0.39295411109924316,2023-09-05 14:21:41.732495,2023-09-05 14:21:52.545845,0 days 00:00:10.813350,Leaky,Tanh,,,10,16,16.0,,,0.0002131884051911118,2,238,0.5213834545495293,0.0027226230976320925,111.80488262900823,COMPLETE
58,0.37913650274276733,2023-09-05 14:21:52.546098,2023-09-05 14:21:57.241937,0 days 00:00:04.695839,ReLU,,,,36,14,,,,0.0007821942943068418,1,324,0.7990593597447532,0.005939224522884168,117.79001197129666,COMPLETE
59,0.3829687237739563,2023-09-05 14:21:57.242190,2023-09-05 14:22:01.442018,0 days 00:00:04.199828,ReLU,Tanh,,,31,10,14.0,,,0.000310534807157895,2,183,0.4589436211459345,0.0005791578971940073,111.4504883979839,COMPLETE
60,0.40858837962150574,2023-09-05 14:22:01.442272,2023-09-05 14:22:09.243890,0 days 00:00:07.801618,Sigmoid,Leaky,Leaky,Leaky,18,19,10.0,3.0,16.0,0.0018959024735733547,4,138,0.627570974996412,0.003559439449416138,558.2731146131243,COMPLETE
61,0.36866289377212524,2023-09-05 14:22:09.244164,2023-09-05 14:22:30.626580,0 days 00:00:21.382416,ReLU,Tanh,,,13,12,11.0,,,0.00019350351875303815,2,262,0.7629551886269524,0.005495862578071635,114.84090621598804,COMPLETE
62,0.42194899916648865,2023-09-05 14:22:30.626834,2023-09-05 14:22:40.957527,0 days 00:00:10.330693,ReLU,Tanh,,,10,8,8.0,,,0.000395296529618063,2,265,0.6724134259752241,0.009937344339432181,488.11296011548524,COMPLETE
63,0.4150235950946808,2023-09-05 14:22:40.957803,2023-09-05 14:22:54.332120,0 days 00:00:13.374317,ReLU,Tanh,,,22,14,13.0,,,0.00013127919538229928,2,289,0.7099513241811668,0.0044655639810968414,125.7782242170727,COMPLETE
64,0.41276562213897705,2023-09-05 14:22:54.332380,2023-09-05 14:23:04.288327,0 days 00:00:09.955947,ReLU,Sigmoid,,,14,12,11.0,,,0.0005629426170468745,2,221,0.7576086127169145,0.002012699971858631,117.18614202387192,COMPLETE
65,0.45054468512535095,2023-09-05 14:23:04.288586,2023-09-05 14:23:18.079063,0 days 00:00:13.790477,ReLU,Tanh,Sigmoid,,17,17,12.0,11.0,,0.0002516663745482028,3,201,0.6885007702115064,0.007213538649747917,175.33788189484704,COMPLETE
66,0.40048113465309143,2023-09-05 14:23:18.079342,2023-09-05 14:23:23.323012,0 days 00:00:05.243670,ReLU,ReLU,,,70,11,6.0,,,0.0001886394050458278,2,242,0.7986940047234264,0.001478501978982905,275.30729057375066,COMPLETE
67,0.511477530002594,2023-09-05 14:23:23.323272,2023-09-05 14:23:25.599284,0 days 00:00:02.276012,Tanh,Tanh,,,100,3,15.0,,,0.0006737136840896741,2,162,0.6341817424674714,0.0025888779134305086,558.9040095953294,COMPLETE
68,0.39909878373146057,2023-09-05 14:23:25.599537,2023-09-05 14:23:32.965618,0 days 00:00:07.366081,ReLU,,,,26,8,,,,0.0003192541481309667,1,329,0.5587225675669223,0.0038180828032407196,119.59171933966168,COMPLETE
69,0.46987685561180115,2023-09-05 14:23:32.965862,2023-09-05 14:23:37.861190,0 days 00:00:04.895328,ReLU,Tanh,Leaky,,56,13,17.0,5.0,,8.550868837273136e-05,3,217,0.5955520069839229,0.005811313022210401,222.52648148778397,COMPLETE
70,0.38138800859451294,2023-09-05 14:23:37.861481,2023-09-05 14:23:59.944617,0 days 00:00:22.083136,ReLU,Leaky,,,13,10,9.0,,,0.00013012202890721255,2,363,0.7466418826451265,0.008409953708975442,142.9625561988065,COMPLETE
71,0.39299294352531433,2023-09-05 14:23:59.944880,2023-09-05 14:24:06.004400,0 days 00:00:06.059520,ReLU,ReLU,,,17,15,13.0,,,0.00042076210881447494,2,181,0.7090777793442047,0.012044157340366193,159.49127725454477,COMPLETE
72,0.417379766702652,2023-09-05 14:24:06.004663,2023-09-05 14:24:10.427301,0 days 00:00:04.422638,ReLU,ReLU,,,63,16,14.0,,,0.0002447098265892458,2,199,0.7627356293978633,0.00653534877278321,142.24299176853506,COMPLETE
73,0.42457714676856995,2023-09-05 14:24:10.427568,2023-09-05 14:24:15.680321,0 days 00:00:05.252753,ReLU,ReLU,,,24,17,11.0,,,0.0005841253304842892,2,150,0.6547731058876914,0.00209584286310761,253.0361196344549,COMPLETE
74,0.37912261486053467,2023-09-05 14:24:15.680581,2023-09-05 14:24:27.212434,0 days 00:00:11.531853,ReLU,ReLU,,,10,14,16.0,,,0.0003511005806789988,2,307,0.6917762878619796,0.003349906654622748,98.87845527468704,COMPLETE
75,0.38586190342903137,2023-09-05 14:24:27.212689,2023-09-05 14:24:30.999076,0 days 00:00:03.786387,Leaky,Tanh,,,20,15,15.0,,,0.0009173097811393497,2,271,0.7999219726208675,0.01416928717985605,129.03455446477523,COMPLETE
76,0.42075178027153015,2023-09-05 14:24:30.999337,2023-09-05 14:24:40.110511,0 days 00:00:09.111174,ReLU,ReLU,Sigmoid,,16,13,13.0,15.0,,0.00043866034159648797,3,172,0.6203522100429264,0.02294412029425906,173.77791905223876,COMPLETE
77,0.42795079946517944,2023-09-05 14:24:40.110780,2023-09-05 14:25:04.024652,0 days 00:00:23.913872,Sigmoid,Tanh,,,13,11,10.0,,,0.00017179094694745608,2,291,0.7315941395310354,0.00785351820305162,135.56313082770384,COMPLETE
78,0.3450307548046112,2023-09-05 14:25:04.024922,2023-09-05 14:25:10.694355,0 days 00:00:06.669433,ReLU,Leaky,,,59,12,12.0,,,0.0002771423240594274,2,398,0.6496586875647407,0.004362258914579035,126.01821290441306,COMPLETE
79,0.37770238518714905,2023-09-05 14:25:10.694613,2023-09-05 14:25:18.306497,0 days 00:00:07.611884,ReLU,Leaky,,,52,12,12.0,,,0.000283911520104343,2,397,0.5675274276269161,0.004530244221593899,145.8776360230722,COMPLETE
80,0.39528387784957886,2023-09-05 14:25:18.306764,2023-09-05 14:25:30.144958,0 days 00:00:11.838194,Tanh,Leaky,Leaky,,59,7,8.0,8.0,,0.0001101488864718397,3,445,0.655531037549141,0.0016915538477566877,127.84546056168803,COMPLETE
81,0.3849996030330658,2023-09-05 14:25:30.145230,2023-09-05 14:25:37.720962,0 days 00:00:07.575732,ReLU,Leaky,,,41,14,14.0,,,0.00022745425558554758,2,439,0.6964826092889261,0.0025698507569495792,138.97642501326632,COMPLETE
82,0.38815823197364807,2023-09-05 14:25:37.721213,2023-09-05 14:25:43.374553,0 days 00:00:05.653340,ReLU,Leaky,,,64,4,12.0,,,0.0006349752057863796,2,468,0.7585349300141953,0.005502431349414788,123.0368438569626,COMPLETE
83,0.34761694073677063,2023-09-05 14:25:43.374844,2023-09-05 14:25:48.413169,0 days 00:00:05.038325,ReLU,Tanh,,,50,18,13.0,,,0.0004192489017574568,2,426,0.6023601677339767,0.010161841974895612,130.44847410728488,COMPLETE
84,0.37391963601112366,2023-09-05 14:25:48.413427,2023-09-05 14:25:51.804586,0 days 00:00:03.391159,ReLU,Tanh,,,46,19,13.0,,,0.00048152899467383776,2,420,0.5323632200453011,0.010816309704488752,117.94406747257008,COMPLETE
85,0.45763930678367615,2023-09-05 14:25:51.804846,2023-09-05 14:25:59.474695,0 days 00:00:07.669849,ReLU,Tanh,,,59,20,3.0,,,0.00032964085854468486,2,470,0.5942785324525437,0.0037125811454274092,196.2117019056001,COMPLETE
86,0.3874419033527374,2023-09-05 14:25:59.474953,2023-09-05 14:26:04.431683,0 days 00:00:04.956730,ReLU,Tanh,,,54,18,11.0,,,0.00028529843440426854,2,389,0.609474146564254,0.00857943122855517,122.06099382778893,COMPLETE
87,0.437618613243103,2023-09-05 14:26:04.431942,2023-09-05 14:26:18.514008,0 days 00:00:14.082066,ReLU,Sigmoid,,,30,9,15.0,,,0.0002062181672013017,2,432,0.6446486290846178,0.014137352381551341,136.87775993347168,COMPLETE
88,0.37197789549827576,2023-09-05 14:26:18.514266,2023-09-05 14:26:29.821850,0 days 00:00:11.307584,ReLU,Tanh,Tanh,,50,10,11.0,7.0,,0.00015652694071805268,3,407,0.6870963643506389,0.002180213280585866,123.47982472524593,COMPLETE
89,0.40801969170570374,2023-09-05 14:26:29.822144,2023-09-05 14:26:37.903434,0 days 00:00:08.081290,Leaky,,,,38,6,,,,0.00043508181665933687,1,417,0.581438672848389,0.0014583060334577391,124.31331705875535,COMPLETE
90,0.3978979289531708,2023-09-05 14:26:37.903686,2023-09-05 14:26:40.877858,0 days 00:00:02.974172,ReLU,Leaky,,,78,12,18.0,,,0.0007159397211646587,2,480,0.7211807855545114,0.004647591036094474,149.09499578475953,COMPLETE
91,0.3686274290084839,2023-09-05 14:26:40.878108,2023-09-05 14:26:48.167398,0 days 00:00:07.289290,ReLU,Tanh,,,12,17,14.0,,,0.0005201174188747377,2,207,0.769493465352253,0.005993601166278644,117.60303317799287,COMPLETE
92,0.3260927200317383,2023-09-05 14:26:48.167655,2023-09-05 14:26:52.715007,0 days 00:00:04.547352,ReLU,ReLU,,,70,13,12.0,,,0.00037943919290358224,2,358,0.6732028954128133,0.003003328441904665,119.96924591064453,COMPLETE
93,0.331445574760437,2023-09-05 14:26:52.715252,2023-09-05 14:26:57.482893,0 days 00:00:04.767641,ReLU,ReLU,,,72,22,12.0,,,0.00037046619242214746,2,355,0.6275554254746576,0.0030613359820741985,122.65617636683997,COMPLETE
94,0.365959107875824,2023-09-05 14:26:57.483159,2023-09-05 14:27:00.863360,0 days 00:00:03.380201,ReLU,ReLU,,,73,24,9.0,,,0.00040467472453863243,2,358,0.6239178137301026,0.0033782271922974953,116.59722449391934,COMPLETE
