number,value,datetime_start,datetime_complete,duration,params_activation1,params_activation2,params_activation3,params_activation4,params_batch_size,params_fl1,params_fl2,params_fl3,params_fl4,params_learning_rate,params_n_layers,params_num_epochs,params_train_size,params_weight_decay,user_attrs_mre,state
772,0.34271445870399475,2023-09-05 15:01:58.651879,2023-09-05 15:01:59.273161,0 days 00:00:00.621282,ReLU,Leaky,,,58,8,15.0,,,0.0032154521798418733,2,344,0.6660457286903917,0.0014404730495029,133.9723698752267,COMPLETE
773,0.3878239095211029,2023-09-05 15:01:59.273509,2023-09-05 15:02:03.409846,0 days 00:00:04.136337,ReLU,ReLU,,,28,6,13.0,,,0.0008655468400591091,2,450,0.5317290068399168,0.0009582950626059756,179.37361466803517,COMPLETE
774,0.3930549919605255,2023-09-05 15:02:03.410192,2023-09-05 15:02:04.585310,0 days 00:00:01.175118,ReLU,ReLU,,,66,23,14.0,,,0.0043697640064002995,2,357,0.6211038926617735,0.004149294941803426,127.74550911688036,COMPLETE
775,0.36417198181152344,2023-09-05 15:02:04.585652,2023-09-05 15:02:06.945750,0 days 00:00:02.360098,ReLU,,,,39,15,,,,0.0024606348123431578,1,163,0.6936161903569922,0.00026988863677038894,178.6322031956093,COMPLETE
776,0.3781701326370239,2023-09-05 15:02:06.946080,2023-09-05 15:02:10.231115,0 days 00:00:03.285035,ReLU,ReLU,Sigmoid,,44,24,21.0,22.0,,0.000548004126697835,3,336,0.7531008797711405,0.00012212413806589074,129.74236136988588,COMPLETE
777,0.36405909061431885,2023-09-05 15:02:10.231466,2023-09-05 15:02:12.467282,0 days 00:00:02.235816,ReLU,ReLU,,,48,22,13.0,,,0.0006731419519878557,2,429,0.30348654407014536,0.0004727747262906355,150.68341622893342,COMPLETE
778,0.49403929710388184,2023-09-05 15:02:12.467617,2023-09-05 15:02:15.308118,0 days 00:00:02.840501,Sigmoid,ReLU,ReLU,Tanh,34,13,11.0,18.0,13.0,0.00031705626160005945,4,309,0.12668019131866942,2.4641398737079318e-05,146.94378936175005,COMPLETE
779,0.3649909198284149,2023-09-05 15:02:15.308478,2023-09-05 15:02:16.872779,0 days 00:00:01.564301,ReLU,ReLU,,,56,10,12.0,,,0.0010348271559973178,2,386,0.4619687913256939,0.001259915254545288,121.27252138577975,COMPLETE
780,0.4740082323551178,2023-09-05 15:02:16.873128,2023-09-05 15:02:17.316100,0 days 00:00:00.442972,Leaky,Leaky,,,41,7,15.0,,,0.09369762749432145,2,350,0.7123751960770104,0.0008005863798316137,155.20765904017858,COMPLETE
781,0.32925793528556824,2023-09-05 15:02:17.316447,2023-09-05 15:02:19.756639,0 days 00:00:02.440192,ReLU,Tanh,,,64,14,14.0,,,0.0016344493314227968,2,327,0.765844111486393,0.002340723240179779,129.98988448248969,COMPLETE
782,0.3769132196903229,2023-09-05 15:02:19.756987,2023-09-05 15:02:22.004141,0 days 00:00:02.247154,ReLU,ReLU,,,61,9,16.0,,,0.0012316800627982195,2,375,0.44233513410111136,0.019384080140934498,205.03337864675922,COMPLETE
783,0.4184330403804779,2023-09-05 15:02:22.004481,2023-09-05 15:02:25.130764,0 days 00:00:03.126283,ReLU,ReLU,,,13,23,12.0,,,0.0007475613986680811,2,316,0.330142953869575,1.637733059564052e-05,140.29915364583334,COMPLETE
784,0.3854120671749115,2023-09-05 15:02:25.131113,2023-09-05 15:02:30.665469,0 days 00:00:05.534356,ReLU,Sigmoid,,,67,17,15.0,,,0.0004455912333533722,2,339,0.7993602291756152,0.0005959607118916808,128.67396185650088,COMPLETE
785,0.4007033109664917,2023-09-05 15:02:30.665803,2023-09-05 15:02:34.360023,0 days 00:00:03.694220,ReLU,ReLU,,,38,8,14.0,,,0.0005556034049203179,2,356,0.6552749887186529,0.0003701108710022531,107.52404106364531,COMPLETE
786,0.7340026497840881,2023-09-05 15:02:34.360369,2023-09-05 15:02:37.676842,0 days 00:00:03.316473,ReLU,ReLU,,,46,12,13.0,,,1.1141241217838187e-05,2,365,0.24538206932095696,0.004877706776502025,110.88161558386398,COMPLETE
787,0.30010509490966797,2023-09-05 15:02:37.677195,2023-09-05 15:02:41.565094,0 days 00:00:03.887899,ReLU,ReLU,,,36,24,15.0,,,0.0009037464431223361,2,415,0.7276054889629302,0.0029413558393686407,115.02242367326721,COMPLETE
788,0.44651010632514954,2023-09-05 15:02:41.565442,2023-09-05 15:02:43.450328,0 days 00:00:01.884886,ReLU,Leaky,,,36,24,16.0,,,0.0009132712366217559,2,448,0.2169942348014374,0.047811748194220245,143.15420310879932,COMPLETE
789,0.38620421290397644,2023-09-05 15:02:43.450679,2023-09-05 15:02:45.623950,0 days 00:00:02.173271,Leaky,ReLU,,,35,24,15.0,,,0.0010582164211239192,2,420,0.4009700456808376,0.003378457916499644,169.888217653547,COMPLETE
790,0.31638360023498535,2023-09-05 15:02:45.624294,2023-09-05 15:02:48.332813,0 days 00:00:02.708519,ReLU,ReLU,,,33,24,16.0,,,0.0013244212647553952,2,414,0.7420024527819311,3.761611662365172e-05,110.18159227247362,COMPLETE
791,0.34615594148635864,2023-09-05 15:02:48.333162,2023-09-05 15:02:49.920033,0 days 00:00:01.586871,ReLU,ReLU,,,32,24,17.0,,,0.0014296565221436628,2,421,0.7454852038916219,5.472077447728245e-05,114.57261498029843,COMPLETE
792,0.6097988486289978,2023-09-05 15:02:49.920385,2023-09-05 15:02:50.851544,0 days 00:00:00.931159,Sigmoid,ReLU,Leaky,,35,24,16.0,1.0,,0.0013897521794953896,3,412,0.7425201651703912,0.0651744107588435,171.26340935446999,COMPLETE
793,0.3313782513141632,2023-09-05 15:02:50.851907,2023-09-05 15:02:53.701027,0 days 00:00:02.849120,ReLU,ReLU,,,33,24,18.0,,,0.0011168476234333265,2,428,0.7761903132546071,7.157138679707245e-05,136.24682637264854,COMPLETE
794,0.3727529048919678,2023-09-05 15:02:53.701379,2023-09-05 15:02:56.466491,0 days 00:00:02.765112,ReLU,ReLU,,,31,24,16.0,,,0.0009383249121012854,2,411,0.7306917386912148,1.1123566061909238e-05,226.3926742955258,COMPLETE
795,0.40105292201042175,2023-09-05 15:02:56.466840,2023-09-05 15:02:57.468499,0 days 00:00:01.001659,ReLU,ReLU,,,33,24,16.0,,,0.0012942951291500162,2,434,0.19772140500800384,4.3136523518503926e-05,144.73192739486694,COMPLETE
796,0.3303881883621216,2023-09-05 15:02:57.468852,2023-09-05 15:02:59.260942,0 days 00:00:01.792090,Tanh,ReLU,,,34,24,17.0,,,0.0018670174734909948,2,417,0.7691211022818855,0.00272809495438229,104.70488380899235,COMPLETE
797,0.37364476919174194,2023-09-05 15:02:59.261291,2023-09-05 15:03:00.178830,0 days 00:00:00.917539,ReLU,ReLU,,,30,24,17.0,,,0.017323345128584782,2,406,0.7061996384291734,4.069435475503687e-05,175.82829920450845,COMPLETE
798,0.3549728989601135,2023-09-05 15:03:00.179170,2023-09-05 15:03:02.226998,0 days 00:00:02.047828,ReLU,ReLU,,,37,24,16.0,,,0.001616422123720177,2,435,0.7322095980020807,3.608188597024118e-05,138.06447184085846,COMPLETE
799,0.3943025469779968,2023-09-05 15:03:02.227346,2023-09-05 15:03:04.413405,0 days 00:00:02.186059,ReLU,ReLU,Tanh,,30,24,16.0,11.0,,0.0011391490261621962,3,439,0.7643676724103314,1.1688815022998637e-05,111.08263646001402,COMPLETE
800,0.3615570664405823,2023-09-05 15:03:04.413756,2023-09-05 15:03:07.558564,0 days 00:00:03.144808,Leaky,ReLU,,,38,23,17.0,,,0.0008221792996755532,2,324,0.691872061482219,6.989816369525719e-05,109.66385924141362,COMPLETE
801,0.38471782207489014,2023-09-05 15:03:07.558919,2023-09-05 15:03:08.594310,0 days 00:00:01.035391,ReLU,ReLU,,,36,24,16.0,,,0.0012574713301912684,2,419,0.3096087937730747,7.724608243037698e-05,171.3516514737841,COMPLETE
802,0.3828342854976654,2023-09-05 15:03:08.594662,2023-09-05 15:03:09.030469,0 days 00:00:00.435807,ReLU,ReLU,,,33,23,12.0,,,0.014301165797663742,2,405,0.4762262435885925,4.686737609222927e-05,128.6320634729722,COMPLETE
803,0.3732985258102417,2023-09-05 15:03:09.030817,2023-09-05 15:03:12.354913,0 days 00:00:03.324096,ReLU,ReLU,,,36,24,15.0,,,0.0010402590635516693,2,425,0.7224853239413148,0.00017505893000011722,111.23023062485915,COMPLETE
804,0.3776320219039917,2023-09-05 15:03:12.355260,2023-09-05 15:03:13.414413,0 days 00:00:01.059153,ReLU,ReLU,,,31,23,17.0,,,0.024684322050511767,2,425,0.7519467657474223,1.3341606416447158e-05,111.74765890615957,COMPLETE
805,0.3491121530532837,2023-09-05 15:03:13.414761,2023-09-05 15:03:18.004690,0 days 00:00:04.589929,Sigmoid,ReLU,,,34,24,16.0,,,0.000877262316051379,2,435,0.7963131156832786,6.461494764978577e-05,115.168655958332,COMPLETE
806,0.3592824339866638,2023-09-05 15:03:18.005045,2023-09-05 15:03:19.019868,0 days 00:00:01.014823,ReLU,ReLU,,,32,23,12.0,,,0.00853954933723631,2,426,0.6817921640215078,0.0006637423288133542,154.59898297540073,COMPLETE
807,0.4649922847747803,2023-09-05 15:03:19.020207,2023-09-05 15:03:19.667268,0 days 00:00:00.647061,ReLU,Tanh,,,39,24,11.0,,,0.0015132104480839583,2,444,0.15206387910142855,0.000203276123717891,150.03086055798477,COMPLETE
808,0.388021856546402,2023-09-05 15:03:19.667614,2023-09-05 15:03:22.479256,0 days 00:00:02.811642,ReLU,ReLU,,,37,16,15.0,,,0.0007452765041357216,2,415,0.7232353416522294,1.0509910805160783e-05,115.19420420328775,COMPLETE
809,0.39618992805480957,2023-09-05 15:03:22.479605,2023-09-05 15:03:23.249300,0 days 00:00:00.769695,Leaky,ReLU,,,35,24,9.0,,,0.0019392727343371112,2,398,0.2651083622555418,0.0009235674063939322,117.01610578339675,COMPLETE
810,0.376951664686203,2023-09-05 15:03:23.249651,2023-09-05 15:03:24.934304,0 days 00:00:01.684653,ReLU,ReLU,,,28,17,13.0,,,0.0012228049942981586,2,407,0.7669432674298814,3.1354933941323866e-05,280.97765159606934,COMPLETE
811,0.3775903284549713,2023-09-05 15:03:24.934655,2023-09-05 15:03:25.550199,0 days 00:00:00.615544,ReLU,ReLU,,,40,7,15.0,,,0.02278977823684575,2,416,0.5573899690729203,0.0005065312486090553,149.6000534057617,COMPLETE
812,0.3725202679634094,2023-09-05 15:03:25.550541,2023-09-05 15:03:27.404458,0 days 00:00:01.853917,ReLU,ReLU,,,42,23,11.0,,,0.0008883554324568678,2,426,0.3361211645191381,8.149543706619952e-05,108.90816349769706,COMPLETE
813,0.3721410632133484,2023-09-05 15:03:27.404812,2023-09-05 15:03:28.044626,0 days 00:00:00.639814,ReLU,ReLU,ReLU,,40,24,16.0,23.0,,0.0006898252876023372,3,439,0.18425249870750704,8.996194290429684e-05,127.24860394385553,COMPLETE
814,0.37505313754081726,2023-09-05 15:03:28.044998,2023-09-05 15:03:29.711765,0 days 00:00:01.666767,ReLU,ReLU,,,37,6,10.0,,,0.0016327881378239784,2,431,0.7002757563825323,0.00017480267978027645,130.32460909756747,COMPLETE
815,0.34966355562210083,2023-09-05 15:03:29.712110,2023-09-05 15:03:38.765529,0 days 00:00:09.053419,ReLU,ReLU,,,35,23,12.0,,,0.00020093485412803837,2,416,0.7997964004702349,0.00015126343891482577,113.04427475816621,COMPLETE
816,0.44040751457214355,2023-09-05 15:03:38.765888,2023-09-05 15:03:46.269457,0 days 00:00:07.503569,ReLU,ReLU,,,34,18,15.0,,,5.491642142343348e-05,2,440,0.3707320607420098,0.00013360051784815823,163.74598156322133,COMPLETE
817,0.406742125749588,2023-09-05 15:03:46.269821,2023-09-05 15:03:48.068045,0 days 00:00:01.798224,Leaky,Sigmoid,,,32,19,18.0,,,0.0009828357623802146,2,315,0.1584120437274807,2.002563533968263e-05,131.5296553178267,COMPLETE
818,0.3841838836669922,2023-09-05 15:03:48.068413,2023-09-05 15:03:50.717468,0 days 00:00:02.649055,ReLU,ReLU,,,43,5,13.0,,,0.0013949213048888758,2,400,0.7373382812360021,0.0017406234361799105,126.28426896764877,COMPLETE
819,0.48912376165390015,2023-09-05 15:03:50.717808,2023-09-05 15:04:00.100491,0 days 00:00:09.382683,Sigmoid,Tanh,,,39,15,17.0,,,0.00012361216280698,2,335,0.6778990289861024,0.0001249948049873326,152.18921003199335,COMPLETE
820,0.3721076548099518,2023-09-05 15:04:00.100839,2023-09-05 15:04:02.260863,0 days 00:00:02.160024,Tanh,ReLU,,,37,16,16.0,,,0.0007114840353579839,2,329,0.18097549854054454,8.74091358744538e-05,119.52592892116971,COMPLETE
821,0.33127471804618835,2023-09-05 15:04:02.261228,2023-09-05 15:04:08.275625,0 days 00:00:06.014397,ReLU,ReLU,,,42,24,15.0,,,0.0002726879031482131,2,303,0.7654485005861459,1.537195314685818e-05,90.84594863891601,COMPLETE
822,0.35746631026268005,2023-09-05 15:04:08.275980,2023-09-05 15:04:10.887180,0 days 00:00:02.611200,ReLU,ReLU,,,47,8,13.0,,,0.0011421998392355276,2,431,0.7113816900238813,0.00014196481435861688,117.98819306317498,COMPLETE
823,0.36990195512771606,2023-09-05 15:04:10.887532,2023-09-05 15:04:11.467446,0 days 00:00:00.579914,ReLU,ReLU,Leaky,,87,24,14.0,12.0,,0.002027879151128583,3,449,0.2028630511203549,0.0026006386446003472,121.64040111673289,COMPLETE
824,0.35394036769866943,2023-09-05 15:04:11.467806,2023-09-05 15:04:13.194744,0 days 00:00:01.726938,ReLU,ReLU,,,27,23,12.0,,,0.0008133647021598653,2,343,0.29217400518940306,0.0007364751942344232,110.40861937578987,COMPLETE
825,0.3712215721607208,2023-09-05 15:04:13.195095,2023-09-05 15:04:15.945140,0 days 00:00:02.750045,ReLU,ReLU,,,44,7,16.0,,,0.0006347600593021709,2,406,0.6665588274191607,7.670231375867347e-05,114.75592019822862,COMPLETE
826,0.3459338843822479,2023-09-05 15:04:15.945498,2023-09-05 15:04:21.437630,0 days 00:00:05.492132,ReLU,ReLU,,,25,24,12.0,,,0.0003894516144004742,2,332,0.5919165677866921,1.1219517538530485e-05,127.16061107928937,COMPLETE
827,0.3874109387397766,2023-09-05 15:04:21.437986,2023-09-05 15:04:27.410862,0 days 00:00:05.972876,Leaky,ReLU,,,50,17,13.0,,,0.0001475842115356791,2,317,0.5427122128763766,4.3714219518865476e-05,218.63042115413052,COMPLETE
828,0.36218592524528503,2023-09-05 15:04:27.411200,2023-09-05 15:04:30.742429,0 days 00:00:03.331229,ReLU,ReLU,,,33,8,11.0,,,0.0010745741889739678,2,421,0.7412898518098286,0.002181432861845345,128.95809551121033,COMPLETE
829,0.34694990515708923,2023-09-05 15:04:30.742777,2023-09-05 15:04:32.023503,0 days 00:00:01.280726,ReLU,ReLU,,,35,15,15.0,,,0.0016016368728194146,2,345,0.43399342046473277,0.001179568359853791,126.43976435585627,COMPLETE
830,0.5872499346733093,2023-09-05 15:04:32.023851,2023-09-05 15:04:38.882766,0 days 00:00:06.858915,ReLU,Tanh,,,39,24,14.0,,,1.7771459472763195e-05,2,323,0.5052381174950036,6.309046530423817e-05,144.97159016612144,COMPLETE
831,0.38220468163490295,2023-09-05 15:04:38.883114,2023-09-05 15:04:39.631414,0 days 00:00:00.748300,ReLU,ReLU,,,41,23,15.0,,,0.016768147678938212,2,334,0.6951654923695709,0.0004063417448300481,115.50712738037109,COMPLETE
832,0.5829076766967773,2023-09-05 15:04:39.631766,2023-09-05 15:04:49.308469,0 days 00:00:09.676703,Sigmoid,ReLU,,,46,20,13.0,,,1.6739255437525275e-05,2,344,0.7641585870050132,2.168887367076336e-05,146.82966318795846,COMPLETE
833,0.3775307238101959,2023-09-05 15:04:49.308821,2023-09-05 15:04:50.858089,0 days 00:00:01.549268,ReLU,ReLU,,,37,16,16.0,,,0.0013146964996806905,2,413,0.7233994991828692,4.0707402359339337e-05,175.62107755699935,COMPLETE
834,0.36799564957618713,2023-09-05 15:04:50.858434,2023-09-05 15:04:51.565629,0 days 00:00:00.707195,ReLU,ReLU,,,41,23,20.0,,,0.006539718144950706,2,308,0.4114641615410447,6.39002104516235e-05,118.82572995699368,COMPLETE
835,0.357095867395401,2023-09-05 15:04:51.565976,2023-09-05 15:04:54.458667,0 days 00:00:02.892691,ReLU,ReLU,,,44,6,14.0,,,0.0005156506058020244,2,275,0.6369975019659655,0.00030495796358665037,118.4355335708492,COMPLETE
836,0.4469059109687805,2023-09-05 15:04:54.459015,2023-09-05 15:04:55.523483,0 days 00:00:01.064468,Leaky,ReLU,,,48,14,15.0,,,0.0008902146982380018,2,293,0.2115513333434891,2.5239763629725832e-05,143.33657008917757,COMPLETE
837,0.40884241461753845,2023-09-05 15:04:55.523846,2023-09-05 15:05:00.747856,0 days 00:00:05.224010,ReLU,ReLU,Sigmoid,,31,7,12.0,16.0,,0.0007622224983631267,3,326,0.7748818448724276,0.0014646802506102,134.25453433655855,COMPLETE
838,0.3752920925617218,2023-09-05 15:05:00.748220,2023-09-05 15:05:02.209035,0 days 00:00:01.460815,ReLU,ReLU,,,38,15,13.0,,,0.019767095884081334,2,340,0.6672628628571232,2.611033174727206e-05,171.1125830078125,COMPLETE
839,0.3710026741027832,2023-09-05 15:05:02.209387,2023-09-05 15:05:03.360056,0 days 00:00:01.150669,ReLU,Sigmoid,,,52,24,14.0,,,0.00217697124906344,2,443,0.7125775492469423,8.967128457615652e-05,109.55712426227072,COMPLETE
840,0.4124174416065216,2023-09-05 15:05:03.360407,2023-09-05 15:05:04.341956,0 days 00:00:00.981549,ReLU,ReLU,,,33,24,15.0,,,0.000605334429798848,2,352,0.1384189459748025,1.321342834540316e-05,141.28187610257058,COMPLETE
841,0.3635929524898529,2023-09-05 15:05:04.342319,2023-09-05 15:05:05.594800,0 days 00:00:01.252481,ReLU,,,,43,17,,,,0.0009990386654395234,1,315,0.7971709494543219,1.785858127042837e-05,137.1169944296078,COMPLETE
842,0.4085533916950226,2023-09-05 15:05:05.595146,2023-09-05 15:05:06.295137,0 days 00:00:00.699991,ReLU,ReLU,,,45,8,11.0,,,0.0017404322734496068,2,334,0.1674188229991539,4.22596641434287e-05,130.45293758883335,COMPLETE
843,0.36194613575935364,2023-09-05 15:05:06.295500,2023-09-05 15:05:09.863218,0 days 00:00:03.567718,Tanh,ReLU,,,36,9,16.0,,,0.00047945245110456516,2,348,0.7429434713208329,0.00010896126809226282,140.52290841198842,COMPLETE
844,0.37674352526664734,2023-09-05 15:05:09.863567,2023-09-05 15:05:11.381002,0 days 00:00:01.517435,ReLU,ReLU,,,39,23,13.0,,,0.0012695545905416846,2,431,0.6937659333651888,5.9701821587829375e-05,192.50647331686582,COMPLETE
845,0.5738745927810669,2023-09-05 15:05:11.381370,2023-09-05 15:05:29.585557,0 days 00:00:18.204187,Sigmoid,ReLU,,,15,18,13.0,,,2.2126388464462347e-05,2,325,0.6135339483896212,1.8990779653259392e-05,184.1315685096154,COMPLETE
846,0.39431440830230713,2023-09-05 15:05:29.585912,2023-09-05 15:05:34.579581,0 days 00:00:04.993669,Leaky,Tanh,,,29,16,19.0,,,0.00035405416543393063,2,394,0.7469317562203609,5.315474606730871e-05,124.81994849443436,COMPLETE
847,0.3849068284034729,2023-09-05 15:05:34.579933,2023-09-05 15:05:36.953160,0 days 00:00:02.373227,ReLU,ReLU,,,49,24,17.0,,,0.0007113601471099865,2,332,0.3393936171941443,3.129960526757428e-05,128.51119366581577,COMPLETE
848,0.3380177617073059,2023-09-05 15:05:36.953515,2023-09-05 15:05:41.388615,0 days 00:00:04.435100,ReLU,ReLU,,,21,14,12.0,,,0.0006127996115488631,2,453,0.6618851946433701,0.0006067997918176161,239.1900169295494,COMPLETE
849,0.5219592452049255,2023-09-05 15:05:41.388969,2023-09-05 15:05:42.228596,0 days 00:00:00.839627,ReLU,ReLU,ReLU,Leaky,34,22,14.0,2.0,4.0,0.0782341030577362,4,338,0.5810092376677353,5.0350130195406835e-05,121.95442381359283,COMPLETE
850,0.3561176061630249,2023-09-05 15:05:42.228983,2023-09-05 15:05:44.146268,0 days 00:00:01.917285,ReLU,ReLU,,,46,23,15.0,,,0.0014703558760985082,2,318,0.7118814142956249,0.0029591381932937153,120.90498288472493,COMPLETE
851,0.37532174587249756,2023-09-05 15:05:44.146616,2023-09-05 15:05:46.484365,0 days 00:00:02.337749,ReLU,ReLU,,,42,7,16.0,,,0.0009276693019540694,2,349,0.2216580271669886,0.0019289412145394526,159.59349763393402,COMPLETE
852,0.36479201912879944,2023-09-05 15:05:46.484781,2023-09-05 15:05:46.925402,0 days 00:00:00.440621,ReLU,ReLU,Leaky,,35,19,14.0,8.0,,0.0024652186255149384,3,424,0.2283305984002846,1.6566890506682537e-05,113.43037083943685,COMPLETE
853,0.5851259231567383,2023-09-05 15:05:46.925782,2023-09-05 15:05:49.185072,0 days 00:00:02.259290,ReLU,ReLU,,,78,8,15.0,,,7.146116905653894e-05,2,297,0.2829877864397773,4.031092162945884e-05,141.53307707301695,COMPLETE
854,0.5997840762138367,2023-09-05 15:05:49.185427,2023-09-05 15:05:51.136306,0 days 00:00:01.950879,ReLU,ReLU,,,32,15,12.0,,,5.018135386250656e-05,2,357,0.1043547919489851,3.4545045577332966e-05,170.52504300670464,COMPLETE
855,0.4303934872150421,2023-09-05 15:05:51.136657,2023-09-05 15:05:52.211773,0 days 00:00:01.075116,Leaky,Tanh,,,63,24,13.0,,,0.0004119589724134893,2,307,0.12965643832353155,8.919051175337476e-05,137.89056402868806,COMPLETE
856,0.3935917913913727,2023-09-05 15:05:52.212119,2023-09-05 15:06:01.234586,0 days 00:00:09.022467,ReLU,ReLU,,,44,24,16.0,,,9.507787351943444e-05,2,339,0.7693718873748996,0.00021543919627182626,117.62039708634154,COMPLETE
857,0.44903892278671265,2023-09-05 15:06:01.234949,2023-09-05 15:06:02.321595,0 days 00:00:01.086646,ReLU,ReLU,,,41,7,14.0,,,0.0011384510307647835,2,328,0.11941512358528816,0.0008342005662314784,327.6211077434261,COMPLETE
858,0.38717955350875854,2023-09-05 15:06:02.321947,2023-09-05 15:06:02.771189,0 days 00:00:00.449242,ReLU,ReLU,,,65,23,15.0,,,0.0802267740373777,2,412,0.3727839661173567,5.194769750418047e-05,115.64125951131184,COMPLETE
859,0.3678860068321228,2023-09-05 15:06:02.771653,2023-09-05 15:06:14.213148,0 days 00:00:11.441495,ReLU,ReLU,,,38,9,17.0,,,0.0003053708497520537,2,440,0.6855553361499168,3.320127145913166e-05,125.61837698854046,COMPLETE
860,0.5690984725952148,2023-09-05 15:06:14.213506,2023-09-05 15:06:21.235987,0 days 00:00:07.022481,Sigmoid,ReLU,Tanh,,47,24,10.0,1.0,,6.487694203630779e-05,3,349,0.4447073392800435,0.00046737299998676806,130.86395971959504,COMPLETE
861,0.39144057035446167,2023-09-05 15:06:21.236357,2023-09-05 15:06:22.068083,0 days 00:00:00.831726,ReLU,ReLU,,,62,21,11.0,,,0.0008052442125884804,2,319,0.14696257344641472,0.00035953329438447935,117.22694518862392,COMPLETE
862,0.5745508074760437,2023-09-05 15:06:22.068425,2023-09-05 15:06:22.774074,0 days 00:00:00.705649,ReLU,Sigmoid,,,68,17,13.0,,,0.010235169795318555,2,343,0.7992925257620302,0.03460449352683119,159.58361605940195,COMPLETE
863,0.5872279405593872,2023-09-05 15:06:22.774464,2023-09-05 15:06:26.569341,0 days 00:00:03.794877,ReLU,ReLU,,,80,16,12.0,,,0.00012831050600786974,2,399,0.357271567438398,0.09654418754959607,138.21992270868822,COMPLETE
864,0.3808348774909973,2023-09-05 15:06:26.569690,2023-09-05 15:06:28.865115,0 days 00:00:02.295425,Leaky,ReLU,,,77,14,15.0,,,0.0005011164983890854,2,358,0.7236666908890715,0.001067945755317402,105.18894430796306,COMPLETE
865,0.4121466279029846,2023-09-05 15:06:28.865461,2023-09-05 15:06:32.347330,0 days 00:00:03.481869,ReLU,ReLU,,,36,22,14.0,,,0.0006269355716860892,2,331,0.5257379536669775,2.4140531057509693e-05,108.81099644222775,COMPLETE
866,0.33319810032844543,2023-09-05 15:06:32.347702,2023-09-05 15:06:34.926439,0 days 00:00:02.578737,ReLU,ReLU,,,23,23,16.0,,,0.001886836094704893,2,313,0.6350812564999082,0.0002451985815049366,103.65712132529607,COMPLETE
867,0.3629453182220459,2023-09-05 15:06:34.926788,2023-09-05 15:06:36.163150,0 days 00:00:01.236362,ReLU,ReLU,,,44,15,13.0,,,0.0014270666970369462,2,339,0.42710682025385754,3.082092717025794e-05,114.4804525633116,COMPLETE
868,0.39656034111976624,2023-09-05 15:06:36.163510,2023-09-05 15:06:40.280609,0 days 00:00:04.117099,ReLU,ReLU,,,40,8,8.0,,,0.000234841713943774,2,324,0.3146738346256936,0.0032928895861859347,142.0668088418466,COMPLETE
