number,value,datetime_start,datetime_complete,duration,params_activation1,params_activation2,params_activation3,params_activation4,params_batch_size,params_fl1,params_fl2,params_fl3,params_fl4,params_learning_rate,params_n_layers,params_num_epochs,params_train_size,params_weight_decay,user_attrs_mre,state
384,0.4190707504749298,2023-09-05 14:43:55.781193,2023-09-05 14:44:04.162319,0 days 00:00:08.381126,ReLU,ReLU,,,69,14,13.0,,,3.312814297216452e-05,2,402,0.7667098900089507,0.0003558649218362105,436.74590062383396,COMPLETE
385,0.39080995321273804,2023-09-05 14:44:04.162612,2023-09-05 14:44:06.795849,0 days 00:00:02.633237,Leaky,ReLU,,,31,13,12.0,,,0.000815354634355595,2,326,0.6253239296203716,0.00233694643088303,139.83288242115694,COMPLETE
386,0.35329827666282654,2023-09-05 14:44:06.796148,2023-09-05 14:44:11.401327,0 days 00:00:04.605179,ReLU,ReLU,,,44,6,11.0,,,0.0009998839209441903,2,353,0.6662556293469438,0.0009557523642967901,119.24734051678632,COMPLETE
387,0.42824506759643555,2023-09-05 14:44:11.401618,2023-09-05 14:44:19.090970,0 days 00:00:07.689352,ReLU,ReLU,,,63,10,16.0,,,6.844314801976837e-05,2,363,0.7370766801215561,0.0001725580907390616,164.01648752091674,COMPLETE
388,0.2993234694004059,2023-09-05 14:44:19.091263,2023-09-05 14:44:22.691546,0 days 00:00:03.600283,ReLU,ReLU,,,67,23,13.0,,,0.0005245848832252384,2,339,0.6982911216035742,0.0053464768684074945,101.26736806233724,COMPLETE
389,0.36942797899246216,2023-09-05 14:44:22.691845,2023-09-05 14:44:25.940210,0 days 00:00:03.248365,ReLU,ReLU,,,67,23,13.0,,,0.0005417889716631108,2,339,0.46099159601536704,0.00359136739593739,127.71351779953706,COMPLETE
390,0.3233546316623688,2023-09-05 14:44:25.940511,2023-09-05 14:44:27.887344,0 days 00:00:01.946833,ReLU,ReLU,,,68,23,14.0,,,0.0004930032088017397,2,494,0.6953364700856159,0.0055701977886329895,108.24582049311424,COMPLETE
391,0.38516873121261597,2023-09-05 14:44:27.887641,2023-09-05 14:44:28.325885,0 days 00:00:00.438244,ReLU,ReLU,,,66,23,14.0,,,0.026470272767574434,2,348,0.6995345345542595,0.008465015616124859,114.1212833404541,COMPLETE
392,0.3233377933502197,2023-09-05 14:44:28.326186,2023-09-05 14:44:33.727554,0 days 00:00:05.401368,ReLU,ReLU,,,71,24,14.0,,,0.0004230902297793071,2,321,0.7204984508116393,0.0068224531005762834,133.17555873068497,COMPLETE
393,0.3884997069835663,2023-09-05 14:44:33.727849,2023-09-05 14:44:38.114192,0 days 00:00:04.386343,ReLU,ReLU,,,71,24,14.0,,,0.0004143015756184452,2,487,0.6857939613495749,0.006920237197701987,115.08989434675736,COMPLETE
394,0.34555813670158386,2023-09-05 14:44:38.114491,2023-09-05 14:44:40.550440,0 days 00:00:02.435949,ReLU,ReLU,,,72,23,14.0,,,0.00041584288391121384,2,465,0.7164396264611028,0.0058886740249748494,145.52340195818644,COMPLETE
395,0.3820933699607849,2023-09-05 14:44:40.550738,2023-09-05 14:44:44.643941,0 days 00:00:04.093203,ReLU,Leaky,,,68,24,14.0,,,0.0005129756838627714,2,483,0.6905043285177528,0.005640480872320797,125.80869989809783,COMPLETE
396,0.31435129046440125,2023-09-05 14:44:44.644233,2023-09-05 14:44:47.625564,0 days 00:00:02.981331,ReLU,ReLU,,,73,24,13.0,,,0.00045803053800945774,2,322,0.7268166444834794,0.00570399665206318,136.94721616194553,COMPLETE
397,0.34485307335853577,2023-09-05 14:44:47.625871,2023-09-05 14:44:50.220385,0 days 00:00:02.594514,ReLU,ReLU,,,76,23,13.0,,,0.0003814970737334334,2,325,0.6660364705138635,0.0049833648046447,136.80710333165987,COMPLETE
398,0.3818221390247345,2023-09-05 14:44:50.220701,2023-09-05 14:44:52.755341,0 days 00:00:02.534640,ReLU,ReLU,,,72,24,14.0,,,0.0004879078048296673,2,318,0.7420619769781597,0.007251271357256098,109.12473046875,COMPLETE
399,0.3560260534286499,2023-09-05 14:44:52.755637,2023-09-05 14:44:54.437670,0 days 00:00:01.682033,ReLU,ReLU,,,74,24,13.0,,,0.0005366377417391399,2,316,0.4084801787907026,0.006256611700889071,115.7042897205479,COMPLETE
400,0.3291948437690735,2023-09-05 14:44:54.437980,2023-09-05 14:44:59.966907,0 days 00:00:05.528927,ReLU,ReLU,,,69,23,13.0,,,0.00035350636309953163,2,473,0.710664840986391,0.007121434070698467,127.64038656105775,COMPLETE
401,0.32963478565216064,2023-09-05 14:44:59.967201,2023-09-05 14:45:03.535022,0 days 00:00:03.567821,ReLU,ReLU,,,74,24,14.0,,,0.0003068754364669419,2,334,0.7640825441227027,0.005034653080170432,130.1470178722662,COMPLETE
402,0.5219818949699402,2023-09-05 14:45:03.535318,2023-09-05 14:45:08.741832,0 days 00:00:05.206514,ReLU,ReLU,,,77,23,13.0,,,1.942700166372775e-05,2,309,0.6557864050363056,0.004327215520737721,117.7344785770552,COMPLETE
403,0.3884667456150055,2023-09-05 14:45:08.742135,2023-09-05 14:45:11.164779,0 days 00:00:02.422644,ReLU,ReLU,,,70,11,14.0,,,0.00043876410772036227,2,329,0.6908979929567632,0.005293512974115138,133.1381871700287,COMPLETE
404,0.3646877408027649,2023-09-05 14:45:11.165080,2023-09-05 14:45:13.597450,0 days 00:00:02.432370,ReLU,ReLU,,,72,24,13.0,,,0.0006031181143203195,2,491,0.7276375244902852,0.005436923095143713,107.22456378321493,COMPLETE
405,0.390019953250885,2023-09-05 14:45:13.597741,2023-09-05 14:45:18.057929,0 days 00:00:04.460188,ReLU,ReLU,Tanh,Sigmoid,70,15,12.0,13.0,19.0,0.0004421258850090429,4,321,0.7712003573284998,0.0044324955557303045,149.65704669228083,COMPLETE
406,0.4017210602760315,2023-09-05 14:45:18.058251,2023-09-05 14:45:23.846335,0 days 00:00:05.788084,ReLU,Sigmoid,,,68,16,15.0,,,0.0003300614164898225,2,500,0.7444957055677264,0.009978558372607771,121.19411971603614,COMPLETE
407,0.32306548953056335,2023-09-05 14:45:23.846665,2023-09-05 14:45:28.321573,0 days 00:00:04.474908,ReLU,ReLU,,,65,23,14.0,,,0.0005388930146803308,2,499,0.710493579509523,0.00770657944728734,101.59124376147574,COMPLETE
408,0.3792338967323303,2023-09-05 14:45:28.321876,2023-09-05 14:45:31.054130,0 days 00:00:02.732254,ReLU,ReLU,,,65,23,14.0,,,0.000517184147136416,2,498,0.672623532573093,0.006757847663135649,136.5885651403194,COMPLETE
409,0.3535090386867523,2023-09-05 14:45:31.054430,2023-09-05 14:45:33.769804,0 days 00:00:02.715374,ReLU,Leaky,,,64,23,14.0,,,0.0006111653864320362,2,496,0.6467285420208352,0.011978022949768644,119.33968145707074,COMPLETE
410,0.4051451086997986,2023-09-05 14:45:33.770126,2023-09-05 14:45:35.653238,0 days 00:00:01.883112,ReLU,ReLU,,,66,24,13.0,,,0.0007061440378130565,2,495,0.7014144581414197,0.007397269279406055,108.19470567600702,COMPLETE
411,0.41702958941459656,2023-09-05 14:45:35.653544,2023-09-05 14:45:45.607021,0 days 00:00:09.953477,ReLU,ReLU,,,62,22,13.0,,,3.987096388529937e-05,2,477,0.7114198247603021,0.005908224535517099,133.294767639672,COMPLETE
412,0.3874715566635132,2023-09-05 14:45:45.607326,2023-09-05 14:45:48.874162,0 days 00:00:03.266836,ReLU,ReLU,,,74,23,14.0,,,0.0004454435894792656,2,486,0.6710251570574167,0.009289342674384604,162.48551682294425,COMPLETE
413,0.35228702425956726,2023-09-05 14:45:48.874457,2023-09-05 14:45:51.884098,0 days 00:00:03.009641,ReLU,ReLU,,,67,13,12.0,,,0.0005628687392518673,2,462,0.7272049469190791,0.008271031762713568,102.42254800665869,COMPLETE
414,0.3855530917644501,2023-09-05 14:45:51.884419,2023-09-05 14:45:55.111355,0 days 00:00:03.226936,ReLU,ReLU,,,65,24,15.0,,,0.0004007436514714249,2,483,0.6287968821667248,0.004546379199901006,112.73867651298221,COMPLETE
415,0.3656555116176605,2023-09-05 14:45:55.111656,2023-09-05 14:45:58.263548,0 days 00:00:03.151892,ReLU,ReLU,,,69,23,14.0,,,0.0006809385453434356,2,382,0.6863992799308121,0.004170237487921854,114.87619655888255,COMPLETE
416,0.38815680146217346,2023-09-05 14:45:58.263835,2023-09-05 14:46:00.923869,0 days 00:00:02.660034,ReLU,ReLU,,,61,24,14.0,,,0.0004765344107544026,2,362,0.3656189531451531,0.006454262430295933,114.54728913002826,COMPLETE
417,0.38613900542259216,2023-09-05 14:46:00.924167,2023-09-05 14:46:03.766412,0 days 00:00:02.842245,Tanh,ReLU,,,71,23,12.0,,,0.00036017481271917283,2,342,0.28716242116677676,0.0036223112425319876,128.40862573099415,COMPLETE
418,0.39173269271850586,2023-09-05 14:46:03.766731,2023-09-05 14:46:07.597501,0 days 00:00:03.830770,ReLU,ReLU,,,64,3,13.0,,,0.0007488710052839469,2,357,0.7416223631635863,0.004945022589052984,125.94654178619385,COMPLETE
419,0.37901821732521057,2023-09-05 14:46:07.597810,2023-09-05 14:46:09.410551,0 days 00:00:01.812741,ReLU,ReLU,,,67,22,15.0,,,0.0005791463769333873,2,469,0.35059650814080917,0.007937823310948102,110.57960661922593,COMPLETE
420,0.3899966776371002,2023-09-05 14:46:09.410851,2023-09-05 14:46:12.894139,0 days 00:00:03.483288,ReLU,ReLU,,,63,24,13.0,,,0.0004880425190677908,2,334,0.6457580988597116,0.01036138466144525,144.78426627022878,COMPLETE
421,0.4160689115524292,2023-09-05 14:46:12.894447,2023-09-05 14:46:14.904043,0 days 00:00:02.009596,ReLU,Leaky,,,76,14,14.0,,,0.0006229926432432908,2,376,0.3052596223548104,0.0031268836239275646,133.09073705673217,COMPLETE
422,0.3658367991447449,2023-09-05 14:46:14.904372,2023-09-05 14:46:18.745821,0 days 00:00:03.841449,ReLU,Tanh,,,61,22,15.0,,,0.00031654562643194175,2,351,0.7027519943837653,0.0042142123733284265,120.19439158969455,COMPLETE
423,0.39720624685287476,2023-09-05 14:46:18.746122,2023-09-05 14:46:22.129245,0 days 00:00:03.383123,ReLU,ReLU,,,58,6,13.0,,,0.0007719128114772185,2,340,0.3860396595498302,0.013069263155411539,128.08580182347487,COMPLETE
424,0.368605375289917,2023-09-05 14:46:22.129547,2023-09-05 14:46:22.472489,0 days 00:00:00.342942,ReLU,ReLU,,,70,23,12.0,,,0.010252320170047123,2,371,0.4416324234948699,0.006495664772790851,144.81807678222657,COMPLETE
425,0.39995527267456055,2023-09-05 14:46:22.472792,2023-09-05 14:46:24.652295,0 days 00:00:02.179503,ReLU,,,,73,7,,,,0.0009002990188783447,1,477,0.3688706254553261,0.002680338222798088,274.59817838120733,COMPLETE
426,0.3699033558368683,2023-09-05 14:46:24.652583,2023-09-05 14:46:26.835194,0 days 00:00:02.182611,ReLU,ReLU,,,68,24,14.0,,,0.0003904664078969255,2,490,0.26580552976346894,0.005618102831050619,120.86951351505158,COMPLETE
427,0.37113460898399353,2023-09-05 14:46:26.835495,2023-09-05 14:46:29.081898,0 days 00:00:02.246403,ReLU,ReLU,,,65,16,12.0,,,0.0004966542387407248,2,327,0.7675207774151188,0.00863162198612323,117.8904888676662,COMPLETE
428,0.4319360852241516,2023-09-05 14:46:29.082195,2023-09-05 14:46:33.231603,0 days 00:00:04.149408,ReLU,ReLU,,,60,17,13.0,,,0.0005780228854818455,2,349,0.7269267412736089,0.003603571887938344,175.21870297225064,COMPLETE
429,0.32697829604148865,2023-09-05 14:46:33.231899,2023-09-05 14:46:36.997212,0 days 00:00:03.765313,ReLU,ReLU,,,63,24,15.0,,,0.0002809396284798933,2,361,0.6718721006722076,0.0028818597105321046,124.17505034601501,COMPLETE
430,0.3370891213417053,2023-09-05 14:46:36.997507,2023-09-05 14:46:41.063986,0 days 00:00:04.066479,ReLU,ReLU,,,63,24,14.0,,,0.00029896337696769796,2,388,0.659025119072929,0.002824331489333538,115.54682915131627,COMPLETE
431,0.36039257049560547,2023-09-05 14:46:41.064287,2023-09-05 14:46:47.311372,0 days 00:00:06.247085,ReLU,ReLU,,,62,24,15.0,,,0.00026105290894813167,2,367,0.6256291828316836,0.0023496383299169486,129.72911080833006,COMPLETE
432,0.3292253613471985,2023-09-05 14:46:47.311666,2023-09-05 14:46:50.895432,0 days 00:00:03.583766,ReLU,Sigmoid,,,59,23,14.0,,,0.00033868837439186806,2,362,0.6888947130073398,1.0757598947373012e-05,103.79865133194696,COMPLETE
433,0.3745485246181488,2023-09-05 14:46:50.895732,2023-09-05 14:46:53.521006,0 days 00:00:02.625274,ReLU,ReLU,,,66,24,15.0,,,0.00025954828705094043,2,356,0.6735625696928381,0.003265312041592504,126.39098144980038,COMPLETE
434,0.3380145728588104,2023-09-05 14:46:53.521304,2023-09-05 14:46:56.663474,0 days 00:00:03.142170,ReLU,ReLU,,,64,23,13.0,,,0.0003863757858194973,2,368,0.6442705228783078,0.004122020515678566,109.80551197714435,COMPLETE
435,0.34857115149497986,2023-09-05 14:46:56.663773,2023-09-05 14:46:57.962045,0 days 00:00:01.298272,ReLU,ReLU,,,67,24,15.0,,,0.0007367922334390598,2,500,0.7056109876017603,0.0019944305920970005,121.30470955371857,COMPLETE
436,0.4762454628944397,2023-09-05 14:46:57.962344,2023-09-05 14:47:09.143211,0 days 00:00:11.180867,ReLU,Tanh,,,29,23,14.0,,,1.3636450479909036e-05,2,346,0.6184567741362041,0.002707841467432266,131.65905075955254,COMPLETE
437,0.37138432264328003,2023-09-05 14:47:09.143514,2023-09-05 14:47:12.616112,0 days 00:00:03.472598,ReLU,ReLU,,,63,24,12.0,,,0.0004654787713964388,2,358,0.6791523054697722,0.0034589230081649267,107.30802110184071,COMPLETE
438,0.39539244771003723,2023-09-05 14:47:12.616419,2023-09-05 14:47:14.795110,0 days 00:00:02.178691,ReLU,Leaky,,,60,22,13.0,,,0.0006492738031558855,2,394,0.7197930670965762,1.867818516783679e-05,100.0895424282428,COMPLETE
439,0.4175224304199219,2023-09-05 14:47:14.795413,2023-09-05 14:47:17.431807,0 days 00:00:02.636394,Tanh,ReLU,,,69,23,15.0,,,0.000316849998733568,2,343,0.7480487264636436,2.9843148518354853e-05,119.1841655883789,COMPLETE
440,0.4139248728752136,2023-09-05 14:47:17.432121,2023-09-05 14:47:17.822644,0 days 00:00:00.390523,ReLU,ReLU,,,57,24,14.0,,,0.03488622212563731,2,377,0.3842216003390571,0.0023803661774125175,196.42197286671606,COMPLETE
441,0.38464879989624023,2023-09-05 14:47:17.822951,2023-09-05 14:47:18.085049,0 days 00:00:00.262098,ReLU,ReLU,,,73,15,14.0,,,0.013375900019218545,2,353,0.4921500304853687,0.000120923277509402,172.04567942899817,COMPLETE
442,0.3728225529193878,2023-09-05 14:47:18.085348,2023-09-05 14:47:20.062062,0 days 00:00:01.976714,ReLU,ReLU,,,65,14,12.0,,,0.000862443601347486,2,338,0.33266847911366293,0.0048557567986675185,132.6176683795986,COMPLETE
443,0.42680031061172485,2023-09-05 14:47:20.062383,2023-09-05 14:47:22.593928,0 days 00:00:02.531545,ReLU,ReLU,,,62,17,13.0,,,0.000556693475556891,2,367,0.6572283064259606,0.015459628711946395,1946.5483316736897,COMPLETE
444,0.3548649549484253,2023-09-05 14:47:22.594242,2023-09-05 14:47:28.199519,0 days 00:00:05.605277,ReLU,ReLU,,,67,23,15.0,,,0.0002224083955721674,2,333,0.5906327066987086,0.0020349809040732065,138.04604687848249,COMPLETE
445,0.4202921688556671,2023-09-05 14:47:28.199823,2023-09-05 14:47:30.630172,0 days 00:00:02.430349,ReLU,ReLU,,,71,24,14.0,,,0.000454816226015088,2,358,0.5665449134027304,0.0030208639824589314,126.29339240579044,COMPLETE
446,0.3871776759624481,2023-09-05 14:47:30.630472,2023-09-05 14:47:35.834180,0 days 00:00:05.203708,ReLU,ReLU,,,23,24,13.0,,,0.0006738361699872636,2,350,0.7002599795511391,0.006523868004117306,131.41905981918862,COMPLETE
447,0.3699158728122711,2023-09-05 14:47:35.834493,2023-09-05 14:47:40.004049,0 days 00:00:04.169556,ReLU,ReLU,,,64,13,11.0,,,0.0003615227545860131,2,344,0.7440674335625673,0.010720025611703403,171.84148418841585,COMPLETE
448,0.34998470544815063,2023-09-05 14:47:40.004354,2023-09-05 14:47:42.336933,0 days 00:00:02.332579,ReLU,ReLU,,,61,22,14.0,,,0.0009913801708084156,2,455,0.6816656294659036,0.0016584803185974383,102.63975641748927,COMPLETE
449,0.3857444226741791,2023-09-05 14:47:42.337243,2023-09-05 14:47:43.126376,0 days 00:00:00.789133,ReLU,Tanh,,,69,15,12.0,,,0.004485816804158683,2,327,0.7109890883772295,0.003772055560019835,114.49519669382195,COMPLETE
450,0.32239386439323425,2023-09-05 14:47:43.126684,2023-09-05 14:47:44.211114,0 days 00:00:01.084430,ReLU,Leaky,,,59,12,15.0,,,0.003281597749230139,2,371,0.6412247061928401,0.005350189024927939,165.94407682598762,COMPLETE
451,0.3973930776119232,2023-09-05 14:47:44.211420,2023-09-05 14:47:46.186704,0 days 00:00:01.975284,ReLU,Leaky,,,58,13,15.0,,,0.0008204484331300098,2,334,0.19897911822320816,0.007762320729142008,151.12869076486362,COMPLETE
452,0.347931444644928,2023-09-05 14:47:46.187008,2023-09-05 14:47:47.802724,0 days 00:00:01.615716,ReLU,Leaky,,,74,7,15.0,,,0.0036708645411617138,2,360,0.6359989107656362,0.005445143969856201,117.79000222811135,COMPLETE
453,0.38786181807518005,2023-09-05 14:47:47.803033,2023-09-05 14:47:48.788472,0 days 00:00:00.985439,ReLU,Leaky,,,66,12,15.0,,,0.003746672350331209,2,372,0.4173177571823894,0.00532509740056233,121.21335051331339,COMPLETE
454,0.35139918327331543,2023-09-05 14:47:48.788785,2023-09-05 14:47:49.782499,0 days 00:00:00.993714,ReLU,Leaky,,,55,12,10.0,,,0.002911619797691216,2,346,0.6590723021982791,0.006273569063159521,318.0126681857639,COMPLETE
455,0.4319010376930237,2023-09-05 14:47:49.782850,2023-09-05 14:47:51.141158,0 days 00:00:01.358308,ReLU,Sigmoid,,,56,14,13.0,,,0.0005466865550907953,2,322,0.11939510764364128,0.004361199488879935,117.61749092244213,COMPLETE
456,0.3955996334552765,2023-09-05 14:47:51.141473,2023-09-05 14:47:51.906976,0 days 00:00:00.765503,ReLU,Leaky,,,71,16,12.0,,,0.007327270302885975,2,353,0.7668755133256147,0.007755234431319422,117.30211268833705,COMPLETE
457,0.36035096645355225,2023-09-05 14:47:51.907288,2023-09-05 14:47:54.483934,0 days 00:00:02.576646,ReLU,Leaky,,,27,24,15.0,,,0.0007092098810983296,2,339,0.25345720088219287,0.0048642425277146874,112.71687733043323,COMPLETE
458,0.3375793993473053,2023-09-05 14:47:54.484244,2023-09-05 14:47:55.593312,0 days 00:00:01.109068,ReLU,Leaky,,,68,11,11.0,,,0.0031391442638535765,2,382,0.6053369102816282,0.0007838132015793625,136.10674491761222,COMPLETE
459,0.3873324394226074,2023-09-05 14:47:55.593622,2023-09-05 14:47:56.610452,0 days 00:00:01.016830,ReLU,Leaky,,,59,7,13.0,,,0.002902489978450215,2,365,0.39875802489984163,0.0038863761410059777,160.94128589630128,COMPLETE
460,0.4000396728515625,2023-09-05 14:47:56.610758,2023-09-05 14:48:00.515624,0 days 00:00:03.904866,Tanh,Leaky,,,76,12,14.0,,,0.0004209117317516001,2,333,0.7318698861000711,0.008996029713494237,119.15284792582194,COMPLETE
461,0.3475531339645386,2023-09-05 14:48:00.515941,2023-09-05 14:48:01.293332,0 days 00:00:00.777391,ReLU,ReLU,,,63,15,14.0,,,0.0069430455613936045,2,492,0.685480125960651,0.0062585696322468385,114.71467528472076,COMPLETE
462,0.3877624571323395,2023-09-05 14:48:01.293625,2023-09-05 14:48:01.735064,0 days 00:00:00.441439,ReLU,ReLU,,,72,24,15.0,,,0.005758635059933337,2,356,0.3079578698609856,0.00021276806306301283,132.65829565169963,COMPLETE
463,0.396337628364563,2023-09-05 14:48:01.735365,2023-09-05 14:48:02.962858,0 days 00:00:01.227493,ReLU,ReLU,,,79,6,12.0,,,0.0033448599748027584,2,343,0.28168199176178293,9.695660243251048e-05,105.72049438287013,COMPLETE
464,0.4083739221096039,2023-09-05 14:48:02.963167,2023-09-05 14:48:04.069700,0 days 00:00:01.106533,ReLU,Tanh,,,65,23,15.0,,,0.0027556981900040316,2,373,0.7664836727230722,0.04732521390988657,130.0204645792643,COMPLETE
465,0.38554736971855164,2023-09-05 14:48:04.070004,2023-09-05 14:48:04.734820,0 days 00:00:00.664816,ReLU,ReLU,,,60,16,13.0,,,0.004417597876215147,2,321,0.708591065726881,0.0032537284567096727,118.07334245954242,COMPLETE
466,0.3572382926940918,2023-09-05 14:48:04.735120,2023-09-05 14:48:06.518580,0 days 00:00:01.783460,ReLU,ReLU,,,62,24,14.0,,,0.0010151491897764477,2,329,0.6487376815907069,0.0014347445578810794,110.31534203817678,COMPLETE
467,0.3525814414024353,2023-09-05 14:48:06.518890,2023-09-05 14:48:07.600940,0 days 00:00:01.082050,ReLU,ReLU,,,70,23,16.0,,,0.005279520999858921,2,447,0.7352981241713878,6.0575316543879537e-05,104.41440259493314,COMPLETE
468,0.3362508714199066,2023-09-05 14:48:07.601253,2023-09-05 14:48:10.725822,0 days 00:00:03.124569,ReLU,Leaky,,,95,24,11.0,,,0.0005304584463598827,2,350,0.620918179817613,0.005208561246736242,116.00708945738066,COMPLETE
469,0.37540629506111145,2023-09-05 14:48:10.726137,2023-09-05 14:48:14.512426,0 days 00:00:03.786289,ReLU,ReLU,,,67,15,19.0,,,0.0006404268612885364,2,336,0.6651292517732698,0.00019124059656914393,103.2794412669569,COMPLETE
470,0.4822981357574463,2023-09-05 14:48:14.512732,2023-09-05 14:48:18.448552,0 days 00:00:03.935820,ReLU,ReLU,,,57,17,14.0,,,0.00026491841817043583,2,364,0.7974773445591279,0.0025701457633299815,270.45717263523534,COMPLETE
471,0.38283827900886536,2023-09-05 14:48:18.448852,2023-09-05 14:48:22.694578,0 days 00:00:04.245726,ReLU,ReLU,Tanh,Leaky,61,14,13.0,19.0,11.0,0.0007794847569092634,4,479,0.6971137693118725,0.0115428448004702,115.22040481567383,COMPLETE
472,0.38010725378990173,2023-09-05 14:48:22.694907,2023-09-05 14:48:24.008941,0 days 00:00:01.314034,ReLU,ReLU,,,64,13,12.0,,,0.002299284217810819,2,500,0.4312507719618364,0.00023972130235707368,322.3194743036066,COMPLETE
473,0.3767096996307373,2023-09-05 14:48:24.009240,2023-09-05 14:48:25.869552,0 days 00:00:01.860312,ReLU,ReLU,,,69,7,15.0,,,0.001136876815829589,2,470,0.7612951489952345,0.007302553486467906,136.48509849201548,COMPLETE
474,0.4942178428173065,2023-09-05 14:48:25.869849,2023-09-05 14:48:26.069676,0 days 00:00:00.199827,ReLU,ReLU,,,75,23,10.0,,,0.07540740988520404,2,313,0.34627811422496035,0.02440603834949244,236.53882913028494,COMPLETE
475,0.33015722036361694,2023-09-05 14:48:26.069977,2023-09-05 14:48:29.036168,0 days 00:00:02.966191,ReLU,ReLU,,,66,24,13.0,,,0.0004480598911721079,2,404,0.7211628443634335,0.004214123672869827,117.53144441801926,COMPLETE
476,0.3855278491973877,2023-09-05 14:48:29.036479,2023-09-05 14:48:32.771086,0 days 00:00:03.734607,ReLU,Tanh,,,59,23,14.0,,,0.00036893374916813047,2,348,0.6714040887312727,0.0006564266289049232,126.28764028603074,COMPLETE
477,0.4391023814678192,2023-09-05 14:48:32.771421,2023-09-05 14:48:33.786457,0 days 00:00:01.015036,ReLU,ReLU,,,31,24,15.0,,,0.0009147388193060305,2,325,0.1484650313025664,0.002789627775510123,1070.3558528839596,COMPLETE
478,0.3074798583984375,2023-09-05 14:48:33.786780,2023-09-05 14:48:37.466820,0 days 00:00:03.680040,ReLU,ReLU,,,33,14,12.0,,,0.0006008722475995267,2,339,0.7504113911352616,0.001140153521815798,190.06240281780947,COMPLETE
479,0.4028579592704773,2023-09-05 14:48:37.467129,2023-09-05 14:48:38.351906,0 days 00:00:00.884777,ReLU,Leaky,,,33,14,12.0,,,0.0006025455905976873,2,80,0.2228450016993202,0.0008913718770448949,124.34177150726319,COMPLETE
480,0.3508703410625458,2023-09-05 14:48:38.352219,2023-09-05 14:48:42.454106,0 days 00:00:04.101887,Tanh,ReLU,,,33,14,11.0,,,0.0007267066682388995,2,342,0.7703608063363677,0.0011630965774780256,112.18510526364987,COMPLETE
