number,value,datetime_start,datetime_complete,duration,params_activation1,params_activation2,params_activation3,params_activation4,params_batch_size,params_fl1,params_fl2,params_fl3,params_fl4,params_learning_rate,params_n_layers,params_num_epochs,params_train_size,params_weight_decay,user_attrs_mre,state
190,0.34779274463653564,2023-09-05 14:32:28.331062,2023-09-05 14:32:32.749582,0 days 00:00:04.418520,ReLU,ReLU,Tanh,,58,22,17.0,6.0,,0.0003584861967630321,3,302,0.597240307942301,0.001109084730943325,168.9672860380393,COMPLETE
191,0.3633262515068054,2023-09-05 14:32:32.749857,2023-09-05 14:32:36.368447,0 days 00:00:03.618590,ReLU,ReLU,Tanh,,59,22,17.0,6.0,,0.0003534704465832072,3,303,0.6488108589912244,0.0008394615891769545,117.22276040127403,COMPLETE
192,0.42602211236953735,2023-09-05 14:32:36.368715,2023-09-05 14:32:39.842228,0 days 00:00:03.473513,ReLU,ReLU,Tanh,,61,23,18.0,4.0,,0.00039964502478126077,3,313,0.5952642249585047,0.0011358324392005375,115.08817945880655,COMPLETE
193,0.3752491772174835,2023-09-05 14:32:39.842499,2023-09-05 14:32:44.260316,0 days 00:00:04.417817,ReLU,ReLU,Tanh,,56,22,13.0,6.0,,0.00024782793842124923,3,298,0.3777610575021847,0.0016607469754415694,116.6338934418339,COMPLETE
194,0.5087226629257202,2023-09-05 14:32:44.260592,2023-09-05 14:32:47.134015,0 days 00:00:02.873423,ReLU,ReLU,Tanh,,58,20,16.0,1.0,,0.0004975943050323043,3,326,0.578386913702972,0.0008982091522021148,152.83225933473503,COMPLETE
195,0.4059567451477051,2023-09-05 14:32:47.134287,2023-09-05 14:32:49.825703,0 days 00:00:02.691416,ReLU,ReLU,ReLU,,62,23,17.0,5.0,,0.0006995445198792668,3,282,0.6794153903129785,0.0013436614466459836,178.38876198433542,COMPLETE
196,0.3985254466533661,2023-09-05 14:32:49.825985,2023-09-05 14:32:53.095519,0 days 00:00:03.269534,ReLU,ReLU,Leaky,,68,21,23.0,7.0,,0.00030672319644796885,3,370,0.5087159753256444,0.0006155670236311509,9567.378843001134,COMPLETE
197,0.37136223912239075,2023-09-05 14:32:53.095797,2023-09-05 14:32:53.519051,0 days 00:00:00.423254,Tanh,Tanh,,,60,16,14.0,,,0.053929880016790485,2,437,0.4569944315446211,0.002538614458624958,130.0795497894287,COMPLETE
198,0.3846445679664612,2023-09-05 14:32:53.519312,2023-09-05 14:33:00.258995,0 days 00:00:06.739683,ReLU,ReLU,ReLU,,64,21,12.0,9.0,,0.00016973402801823053,3,311,0.6239437475687045,0.0031182307923960477,113.4947111368946,COMPLETE
199,0.3814958333969116,2023-09-05 14:33:00.259278,2023-09-05 14:33:03.875152,0 days 00:00:03.615874,ReLU,Leaky,,,70,22,18.0,,,0.0005668492856083501,2,328,0.5592754922335923,0.0010906384494106536,99.89286054644668,COMPLETE
200,0.3676795959472656,2023-09-05 14:33:03.875421,2023-09-05 14:33:11.482063,0 days 00:00:07.606642,ReLU,Sigmoid,Tanh,,78,24,11.0,4.0,,0.00038142022918538073,3,350,0.7270656527482457,0.0017205433102386067,161.35574401855467,COMPLETE
201,0.39517828822135925,2023-09-05 14:33:11.482339,2023-09-05 14:33:18.076985,0 days 00:00:06.594646,ReLU,Tanh,Leaky,,37,10,13.0,5.0,,0.00044593503833035257,3,396,0.6712470508947164,0.0013428059183927426,219.34359653333095,COMPLETE
202,0.9553009867668152,2023-09-05 14:33:18.077263,2023-09-05 14:33:19.927752,0 days 00:00:01.850489,ReLU,Tanh,Leaky,,62,14,15.0,3.0,,0.0002713673055514329,3,336,0.7011896408631558,0.014338587989129757,107.08139737447102,COMPLETE
203,0.3771438002586365,2023-09-05 14:33:19.928027,2023-09-05 14:33:23.223643,0 days 00:00:03.295616,ReLU,Tanh,Leaky,,33,13,16.0,3.0,,0.0006737476607704127,3,96,0.6029464024273573,0.009977046899780144,195.82986211776733,COMPLETE
204,0.4755553901195526,2023-09-05 14:33:23.223924,2023-09-05 14:33:23.856810,0 days 00:00:00.632886,ReLU,Tanh,Sigmoid,,66,11,14.0,24.0,,0.017110565800615426,3,320,0.637769853728416,0.022657432222302775,246.9918670654297,COMPLETE
205,0.3833370506763458,2023-09-05 14:33:23.857083,2023-09-05 14:33:27.855832,0 days 00:00:03.998749,ReLU,ReLU,,,57,12,13.0,,,0.0004587458703525598,2,269,0.47588496453500545,0.0019002241281413101,155.77366709088747,COMPLETE
206,0.39833495020866394,2023-09-05 14:33:27.856105,2023-09-05 14:33:31.570705,0 days 00:00:03.714600,ReLU,Tanh,Leaky,,54,22,20.0,2.0,,0.00022237029293908,3,426,0.6660754711603827,0.001441767346004938,243.4772691659048,COMPLETE
207,0.42164430022239685,2023-09-05 14:33:31.570985,2023-09-05 14:33:34.313986,0 days 00:00:02.743001,ReLU,ReLU,ReLU,,60,23,6.0,7.0,,0.0003439560349021885,3,121,0.6118132991582501,0.0007698683945094577,174.72737253993012,COMPLETE
208,0.35244694352149963,2023-09-05 14:33:34.314276,2023-09-05 14:33:40.251368,0 days 00:00:05.937092,ReLU,ReLU,,,69,7,12.0,,,0.000525502733758123,2,295,0.717171587517522,0.00103694981635128,136.6896303597143,COMPLETE
209,0.37273508310317993,2023-09-05 14:33:40.251645,2023-09-05 14:33:42.772628,0 days 00:00:02.520983,ReLU,ReLU,ReLU,,75,6,17.0,16.0,,0.0010596560885594024,3,153,0.5307345828777909,0.002364421678968379,144.02096709194564,COMPLETE
210,0.4204625189304352,2023-09-05 14:33:42.772945,2023-09-05 14:33:44.834813,0 days 00:00:02.061868,Leaky,Tanh,,,65,21,4.0,,,0.0007918045717010063,2,406,0.7855205830570874,0.037807857617406765,128.53143987762795,COMPLETE
211,0.35006850957870483,2023-09-05 14:33:44.835094,2023-09-05 14:33:48.060037,0 days 00:00:03.224943,ReLU,ReLU,,,69,7,12.0,,,0.000573139985421482,2,296,0.7239674758247661,0.0010881653909585176,120.57560824170525,COMPLETE
212,0.38649940490722656,2023-09-05 14:33:48.060304,2023-09-05 14:33:52.689761,0 days 00:00:04.629457,ReLU,ReLU,,,73,7,13.0,,,0.0005820232079078507,2,305,0.682028712756203,0.000916306597337008,128.6173435315084,COMPLETE
213,0.41562291979789734,2023-09-05 14:33:52.690033,2023-09-05 14:33:57.671665,0 days 00:00:04.981632,ReLU,ReLU,,,71,6,12.0,,,0.0004435378386728066,2,284,0.6434599905190398,0.0012361551345897227,147.39234158690547,COMPLETE
214,0.39584994316101074,2023-09-05 14:33:57.671934,2023-09-05 14:34:01.436105,0 days 00:00:03.764171,ReLU,ReLU,,,68,23,1.0,,,0.0003689860197590357,2,318,0.49997537885005805,0.001606252541926789,609.7955416577329,COMPLETE
215,0.3311048150062561,2023-09-05 14:34:01.436370,2023-09-05 14:34:04.364757,0 days 00:00:02.928387,ReLU,ReLU,,,47,22,15.0,,,0.0006558688448203009,2,290,0.7562027665992372,0.000509892734142367,92.90777808929158,COMPLETE
216,0.3374048173427582,2023-09-05 14:34:04.365044,2023-09-05 14:34:07.234961,0 days 00:00:02.869917,ReLU,ReLU,,,51,8,15.0,,,0.0009157073779556007,2,294,0.757130855906585,0.000594945468652172,137.08959663863732,COMPLETE
217,0.3580481708049774,2023-09-05 14:34:07.235229,2023-09-05 14:34:08.494192,0 days 00:00:01.258963,ReLU,ReLU,,,52,22,15.0,,,0.0012189719757928024,2,259,0.7985050424591928,0.0007020031815057852,118.53477892668352,COMPLETE
218,0.34656694531440735,2023-09-05 14:34:08.494475,2023-09-05 14:34:12.205122,0 days 00:00:03.710647,ReLU,ReLU,,,47,8,15.0,,,0.0007559295136304537,2,298,0.7658851720885815,0.0005121675789199606,174.40585561042283,COMPLETE
219,0.4043676257133484,2023-09-05 14:34:12.205388,2023-09-05 14:34:13.902601,0 days 00:00:01.697213,ReLU,ReLU,,,50,8,15.0,,,0.000829757317739682,2,284,0.7613943583901078,0.000547335821300002,176.0233140211839,COMPLETE
220,0.3677724301815033,2023-09-05 14:34:13.902875,2023-09-05 14:34:16.138404,0 days 00:00:02.235529,ReLU,ReLU,,,49,22,16.0,,,0.0009402714483809469,2,297,0.7559431034780097,0.000548011485256012,109.22300247918992,COMPLETE
221,0.36040908098220825,2023-09-05 14:34:16.138677,2023-09-05 14:34:18.123794,0 days 00:00:01.985117,ReLU,ReLU,,,47,8,15.0,,,0.0006805640686087586,2,287,0.7421184478401964,0.0004581099337264844,146.58182739257813,COMPLETE
222,0.3505862057209015,2023-09-05 14:34:18.124061,2023-09-05 14:34:21.988643,0 days 00:00:03.864582,ReLU,ReLU,,,51,8,14.0,,,0.0009354878364231315,2,276,0.7772587824885995,0.0006499157595737979,117.96849485051712,COMPLETE
223,0.37898123264312744,2023-09-05 14:34:21.988919,2023-09-05 14:34:24.930036,0 days 00:00:02.941117,ReLU,ReLU,,,48,22,15.0,,,0.0006763836857849059,2,291,0.7180443573162866,0.00038996368776003155,155.17899516590853,COMPLETE
224,0.3274838328361511,2023-09-05 14:34:24.930307,2023-09-05 14:34:27.471244,0 days 00:00:02.540937,ReLU,ReLU,,,41,9,16.0,,,0.0013810506598151359,2,297,0.7983642444384509,0.0004256499223179973,138.95727633252557,COMPLETE
225,0.34057560563087463,2023-09-05 14:34:27.471509,2023-09-05 14:34:29.783887,0 days 00:00:02.312378,ReLU,ReLU,,,52,9,16.0,,,0.0015231408988317981,2,308,0.7964048707249017,0.00037346856959845977,113.57785911121587,COMPLETE
226,0.3276718556880951,2023-09-05 14:34:29.784164,2023-09-05 14:34:31.043115,0 days 00:00:01.258951,ReLU,ReLU,,,46,9,16.0,,,0.001825820635442959,2,313,0.7786867378126363,0.0003084105933063262,106.84676863930441,COMPLETE
227,0.33679938316345215,2023-09-05 14:34:31.043387,2023-09-05 14:34:34.676564,0 days 00:00:03.633177,ReLU,ReLU,,,42,9,16.0,,,0.00145637933258865,2,309,0.7903137995195475,0.0003314399815459244,94.38794496680508,COMPLETE
228,0.3297719955444336,2023-09-05 14:34:34.676832,2023-09-05 14:34:39.652120,0 days 00:00:04.975288,Sigmoid,ReLU,,,43,9,16.0,,,0.001602170927134194,2,313,0.7985911995385963,0.00031932243254158944,141.69022975945325,COMPLETE
229,0.3413172662258148,2023-09-05 14:34:39.652394,2023-09-05 14:34:44.933590,0 days 00:00:05.281196,Sigmoid,ReLU,,,44,9,16.0,,,0.00207858742816686,2,311,0.7923492425677678,0.00028981024564372757,122.86495343889509,COMPLETE
230,0.36742231249809265,2023-09-05 14:34:44.933871,2023-09-05 14:34:47.877769,0 days 00:00:02.943898,Sigmoid,ReLU,,,47,9,16.0,,,0.0020113579019787192,2,310,0.7993514381350576,0.0002896710289612388,242.87857690187965,COMPLETE
231,0.3477272689342499,2023-09-05 14:34:47.878037,2023-09-05 14:34:51.501311,0 days 00:00:03.623274,Sigmoid,ReLU,,,40,9,16.0,,,0.0024845222331559584,2,309,0.7884871685249564,0.0003298801219638476,144.77268934249878,COMPLETE
232,0.38232338428497314,2023-09-05 14:34:51.501574,2023-09-05 14:34:53.813060,0 days 00:00:02.311486,Sigmoid,ReLU,,,43,9,16.0,,,0.0016934969801757917,2,315,0.7954423089879965,0.0003693223697749732,105.97683736165365,COMPLETE
233,0.3206873834133148,2023-09-05 14:34:53.813331,2023-09-05 14:34:58.911656,0 days 00:00:05.098325,Sigmoid,ReLU,,,42,9,16.0,,,0.001487457710041678,2,324,0.7538363699708323,0.0002511083749626903,126.4516627592199,COMPLETE
234,0.3880201578140259,2023-09-05 14:34:58.911922,2023-09-05 14:35:01.871660,0 days 00:00:02.959738,Sigmoid,ReLU,,,38,9,16.0,,,0.0015213373248479335,2,306,0.747565930769923,0.0002359126453769929,163.69718916698167,COMPLETE
235,0.38309818506240845,2023-09-05 14:35:01.871942,2023-09-05 14:35:05.460748,0 days 00:00:03.588806,Sigmoid,ReLU,,,42,10,16.0,,,0.0017462673769810737,2,324,0.766098667121442,0.0002485686288937663,197.7430511733233,COMPLETE
236,0.37617722153663635,2023-09-05 14:35:05.461018,2023-09-05 14:35:09.638178,0 days 00:00:04.177160,Sigmoid,ReLU,,,40,9,16.0,,,0.002125467364429381,2,315,0.7532771539503069,0.00020069560277934394,222.11342912561753,COMPLETE
237,0.4085195064544678,2023-09-05 14:35:09.638461,2023-09-05 14:35:16.878932,0 days 00:00:07.240471,Sigmoid,ReLU,,,45,10,15.0,,,0.0014267250041287989,2,308,0.7784228696128984,0.00042165027950901704,169.0502524433831,COMPLETE
238,0.37094634771347046,2023-09-05 14:35:16.879201,2023-09-05 14:35:18.304883,0 days 00:00:01.425682,Sigmoid,ReLU,,,44,9,15.0,,,0.0025357931481782003,2,324,0.7968875722847933,0.00032782685677524735,125.28476134590481,COMPLETE
239,0.39582452178001404,2023-09-05 14:35:18.305155,2023-09-05 14:35:24.121875,0 days 00:00:05.816720,Sigmoid,ReLU,,,42,9,16.0,,,0.001284608340333474,2,306,0.7358869538888482,0.000286175093243743,133.91450908930614,COMPLETE
240,0.3769941031932831,2023-09-05 14:35:24.122145,2023-09-05 14:35:27.780234,0 days 00:00:03.658089,Sigmoid,Leaky,,,45,10,15.0,,,0.0019198521740407658,2,290,0.7610034115252152,0.0004484457745302099,127.51789313554764,COMPLETE
241,0.373766154050827,2023-09-05 14:35:27.780621,2023-09-05 14:35:30.998601,0 days 00:00:03.217980,Sigmoid,ReLU,,,41,9,16.0,,,0.0016041468255641655,2,329,0.7314015571195601,0.00036927496935504784,109.12242348410867,COMPLETE
242,0.3571467399597168,2023-09-05 14:35:30.998870,2023-09-05 14:35:35.238298,0 days 00:00:04.239428,Sigmoid,ReLU,,,45,10,17.0,,,0.0011577759333899031,2,317,0.7986921001516808,0.0002583769014755402,137.06828154419824,COMPLETE
243,0.3508133292198181,2023-09-05 14:35:35.238582,2023-09-05 14:35:38.677348,0 days 00:00:03.438766,Sigmoid,ReLU,,,43,9,16.0,,,0.0032397842139745615,2,334,0.765253513161834,0.0001848097299049547,126.59091862461023,COMPLETE
244,0.40303733944892883,2023-09-05 14:35:38.677617,2023-09-05 14:35:40.552357,0 days 00:00:01.874740,ReLU,ReLU,,,42,8,16.0,,,0.0013166227701065663,2,318,0.7150908325168581,0.00034688510258693456,180.03696020325617,COMPLETE
245,0.4269130229949951,2023-09-05 14:35:40.552648,2023-09-05 14:35:42.340900,0 days 00:00:01.788252,Tanh,ReLU,,,40,8,17.0,,,0.0018820096965131742,2,300,0.7382362035206645,0.0004906001188423184,111.44716941704185,COMPLETE
246,0.3083149790763855,2023-09-05 14:35:42.341188,2023-09-05 14:35:44.802911,0 days 00:00:02.461723,ReLU,ReLU,,,44,8,15.0,,,0.0015059542986765176,2,340,0.6998577744292663,0.0003858031132884601,96.35453138960169,COMPLETE
247,0.33593061566352844,2023-09-05 14:35:44.803204,2023-09-05 14:35:53.181601,0 days 00:00:08.378397,Sigmoid,ReLU,,,46,8,15.0,,,0.0015057128347519223,2,325,0.6996841705712701,0.0003149258502839772,152.72509384155273,COMPLETE
248,0.4039613902568817,2023-09-05 14:35:53.181895,2023-09-05 14:35:57.597748,0 days 00:00:04.415853,Sigmoid,ReLU,,,46,8,15.0,,,0.001489050989126194,2,342,0.6965296773556613,0.0003151190199571029,116.08921024255585,COMPLETE
249,0.44763290882110596,2023-09-05 14:35:57.598047,2023-09-05 14:35:59.972733,0 days 00:00:02.374686,Sigmoid,ReLU,,,44,9,15.0,,,0.001605489311384947,2,326,0.762919194242854,0.0004695157586251318,317.62970676422117,COMPLETE
250,0.37249210476875305,2023-09-05 14:35:59.973008,2023-09-05 14:36:03.395464,0 days 00:00:03.422456,Sigmoid,ReLU,,,46,8,15.0,,,0.0022685301622100053,2,312,0.7090512920631583,0.00038823299205923854,147.35411001889761,COMPLETE
251,0.3739604353904724,2023-09-05 14:36:03.395735,2023-09-05 14:36:07.193737,0 days 00:00:03.798002,Sigmoid,ReLU,,,48,9,14.0,,,0.0018661617548397056,2,325,0.7432468326124454,0.0002994048388013226,112.95555654253279,COMPLETE
252,0.41647863388061523,2023-09-05 14:36:07.194020,2023-09-05 14:36:10.815153,0 days 00:00:03.621133,Sigmoid,ReLU,,,39,8,16.0,,,0.0011808170461534155,2,341,0.7013829600365172,0.00040346775650696126,115.39921888757925,COMPLETE
253,0.3708992302417755,2023-09-05 14:36:10.815438,2023-09-05 14:36:14.078749,0 days 00:00:03.263311,ReLU,ReLU,,,44,7,14.0,,,0.0013745025569985238,2,305,0.7790622594748593,0.00020841146517126035,1612.9693581717354,COMPLETE
254,0.36601966619491577,2023-09-05 14:36:14.079016,2023-09-05 14:36:19.121535,0 days 00:00:05.042519,Sigmoid,ReLU,,,51,10,15.0,,,0.0020472387745141857,2,293,0.7960510257038766,0.0002786744665644673,152.54522969172552,COMPLETE
255,0.3819049596786499,2023-09-05 14:36:19.121800,2023-09-05 14:36:20.344523,0 days 00:00:01.222723,ReLU,ReLU,,,43,9,15.0,,,0.0030152980482638174,2,330,0.733777594566352,0.0003364556162340962,175.50458579839662,COMPLETE
256,0.38161784410476685,2023-09-05 14:36:20.344795,2023-09-05 14:36:21.405811,0 days 00:00:01.061016,ReLU,ReLU,,,46,8,16.0,,,0.0016882922484096259,2,319,0.68192230469441,0.00026344496614819454,126.31399227323986,COMPLETE
257,0.30464836955070496,2023-09-05 14:36:21.406082,2023-09-05 14:36:23.906325,0 days 00:00:02.500243,Leaky,ReLU,,,48,8,15.0,,,0.0010845976096105932,2,356,0.7606384612400056,0.0004376239938223379,105.41553406093432,COMPLETE
258,0.33456629514694214,2023-09-05 14:36:23.906594,2023-09-05 14:36:27.981087,0 days 00:00:04.074493,Sigmoid,ReLU,,,49,8,15.0,,,0.0011980276562863583,2,349,0.7609848826957801,0.00047340839199009,141.09087381864848,COMPLETE
259,0.3942793011665344,2023-09-05 14:36:27.981361,2023-09-05 14:36:30.570324,0 days 00:00:02.588963,Leaky,ReLU,,,49,8,15.0,,,0.0011353043257201134,2,357,0.7476124309524701,0.0004740245970049633,136.98371638083944,COMPLETE
260,0.3936481177806854,2023-09-05 14:36:30.570601,2023-09-05 14:36:33.502197,0 days 00:00:02.931596,Leaky,ReLU,,,48,7,15.0,,,0.0010083388003067322,2,340,0.7041643876792973,0.0005898336169871889,155.02296395137392,COMPLETE
261,0.415336549282074,2023-09-05 14:36:33.502465,2023-09-05 14:36:37.698045,0 days 00:00:04.195580,Leaky,Sigmoid,,,49,7,14.0,,,0.0014426248365228469,2,355,0.7284923321354594,0.00043018723128716196,144.72417198739402,COMPLETE
262,0.40010660886764526,2023-09-05 14:36:37.698330,2023-09-05 14:36:41.544891,0 days 00:00:03.846561,Leaky,ReLU,,,53,8,15.0,,,0.00114386885269402,2,346,0.7586840718854398,0.0005271281843358731,103.95423712319885,COMPLETE
263,0.4226221740245819,2023-09-05 14:36:41.545180,2023-09-05 14:36:43.234522,0 days 00:00:01.689342,Leaky,ReLU,,,51,8,14.0,,,0.0009378666196998735,2,334,0.357245062339642,0.0006285992018848831,144.14835670812806,COMPLETE
264,0.32218101620674133,2023-09-05 14:36:43.234791,2023-09-05 14:36:46.150009,0 days 00:00:02.915218,ReLU,ReLU,,,36,24,15.0,,,0.0013625053822583178,2,348,0.6870890533187362,0.00041939405974818965,344.0862719084087,COMPLETE
265,0.3920903503894806,2023-09-05 14:36:46.150279,2023-09-05 14:36:47.354097,0 days 00:00:01.203818,ReLU,ReLU,,,46,24,14.0,,,0.0013293566950850456,2,347,0.23039377605542632,0.0003871159030886427,153.9977131467877,COMPLETE
266,0.37298545241355896,2023-09-05 14:36:47.354385,2023-09-05 14:36:49.421593,0 days 00:00:02.067208,ReLU,ReLU,,,41,24,15.0,,,0.0016543871090551106,2,365,0.6862969778275984,0.00043591082508249583,127.21295273471885,COMPLETE
267,0.3289986252784729,2023-09-05 14:36:49.421885,2023-09-05 14:36:51.274632,0 days 00:00:01.852747,Leaky,ReLU,,,35,24,23.0,,,0.0013571079807810592,2,346,0.7275183513717428,0.00034526335157041347,97.66056712757458,COMPLETE
268,0.3458280861377716,2023-09-05 14:36:51.274912,2023-09-05 14:36:53.782643,0 days 00:00:02.507731,Leaky,ReLU,,,36,24,14.0,,,0.0012017980164143864,2,351,0.7086823693671425,0.0003239979832349255,103.86575278752967,COMPLETE
269,0.4246843159198761,2023-09-05 14:36:53.782937,2023-09-05 14:36:57.313592,0 days 00:00:03.530655,Leaky,ReLU,,,34,24,24.0,,,0.0009947891955828692,2,345,0.7309537239631324,0.0590727033376676,149.54354367310972,COMPLETE
270,0.34272700548171997,2023-09-05 14:36:57.313867,2023-09-05 14:36:59.748106,0 days 00:00:02.434239,Leaky,ReLU,,,42,24,23.0,,,0.0013467962488135094,2,364,0.6801515422908984,0.0005269973502505217,121.28291934660112,COMPLETE
271,0.39757442474365234,2023-09-05 14:36:59.748378,2023-09-05 14:37:01.238514,0 days 00:00:01.490136,Leaky,ReLU,,,37,24,22.0,,,0.0009087961808950279,2,335,0.26444400049711614,0.0002134316975323945,114.93969549560546,COMPLETE
272,0.3762020170688629,2023-09-05 14:37:01.238792,2023-09-05 14:37:02.822392,0 days 00:00:01.583600,Leaky,ReLU,,,39,23,21.0,,,0.001785822194359887,2,356,0.7141644833360071,0.0003524250636812076,658.9823690561147,COMPLETE
273,0.3696214556694031,2023-09-05 14:37:02.822674,2023-09-05 14:37:04.336607,0 days 00:00:01.513933,Tanh,ReLU,,,47,7,23.0,,,0.0011094841837601846,2,339,0.18653390072939904,0.0004724642225260807,113.32963285224382,COMPLETE
274,0.4518170952796936,2023-09-05 14:37:04.336875,2023-09-05 14:37:17.550497,0 days 00:00:13.213622,Sigmoid,ReLU,,,29,23,22.0,,,6.610996131580874e-05,2,326,0.762224133141959,0.00017512804022680144,156.98739839331503,COMPLETE
275,0.5191999077796936,2023-09-05 14:37:17.550782,2023-09-05 14:37:26.962140,0 days 00:00:09.411358,Leaky,ReLU,,,31,24,24.0,,,1.1807981363004032e-05,2,274,0.6901195781754752,0.0005693016346059598,125.29766049350265,COMPLETE
276,0.35864269733428955,2023-09-05 14:37:26.962423,2023-09-05 14:37:28.230179,0 days 00:00:01.267756,ReLU,ReLU,,,49,23,15.0,,,0.0013807070847036789,2,345,0.6602131285737726,0.0006815959822389513,119.1931837576407,COMPLETE
277,0.4461873173713684,2023-09-05 14:37:28.230452,2023-09-05 14:37:29.058710,0 days 00:00:00.828258,ReLU,ReLU,,,45,8,15.0,,,0.0008300153385865464,2,334,0.11184307350120577,0.0002315490109464956,216.9461975969587,COMPLETE
278,0.3937930464744568,2023-09-05 14:37:29.058989,2023-09-05 14:37:37.687795,0 days 00:00:08.628806,ReLU,Sigmoid,,,35,7,15.0,,,0.0010785459420082095,2,351,0.7395762388489523,0.0004200518305774553,180.87208674504205,COMPLETE
279,0.37262094020843506,2023-09-05 14:37:37.688065,2023-09-05 14:37:40.116251,0 days 00:00:02.428186,Sigmoid,ReLU,,,26,8,14.0,,,0.002829907277210899,2,372,0.7667266622571333,0.0003164873014635136,165.7779862837358,COMPLETE
280,0.619601309299469,2023-09-05 14:37:40.116524,2023-09-05 14:37:43.821069,0 days 00:00:03.704545,ReLU,ReLU,,,72,24,14.0,,,1.8267638337484765e-05,2,321,0.4248755597840293,0.0002710606942039766,146.00706859838184,COMPLETE
281,0.39166340231895447,2023-09-05 14:37:43.821351,2023-09-05 14:37:45.018310,0 days 00:00:01.196959,ReLU,ReLU,,,42,23,15.0,,,0.002244470305372756,2,362,0.7175286937978314,3.459022283755233e-05,134.3152718316941,COMPLETE
282,0.35344353318214417,2023-09-05 14:37:45.018587,2023-09-05 14:37:46.316040,0 days 00:00:01.297453,ReLU,ReLU,,,48,9,16.0,,,0.0015984430165608028,2,330,0.6664076583417862,0.0003956640609799998,119.39281741055575,COMPLETE
283,0.3484869599342346,2023-09-05 14:37:46.316317,2023-09-05 14:37:48.914351,0 days 00:00:02.598034,ReLU,ReLU,,,44,23,11.0,,,0.0008331073972643425,2,340,0.7439186912984491,0.0005476462668417368,104.48074978000516,COMPLETE
284,0.43590638041496277,2023-09-05 14:37:48.914625,2023-09-05 14:37:50.937353,0 days 00:00:02.022728,Sigmoid,ReLU,,,50,24,10.0,,,0.0012965222434298612,2,293,0.6904422624302876,0.0032587031441250417,136.9509020885789,COMPLETE
285,0.4481973350048065,2023-09-05 14:37:50.937627,2023-09-05 14:37:52.116484,0 days 00:00:01.178857,ReLU,ReLU,,,71,8,15.0,,,0.0020302157031173414,2,319,0.7999496527607347,0.01620607884443751,131.03398895263672,COMPLETE
286,0.35603412985801697,2023-09-05 14:37:52.116759,2023-09-05 14:37:54.319445,0 days 00:00:02.202686,ReLU,ReLU,,,39,10,14.0,,,0.0010481720796335452,2,348,0.7670805452916447,0.0007366664372852658,343.8438018798828,COMPLETE
