number,value,datetime_start,datetime_complete,duration,params_activation1,params_activation2,params_activation3,params_batch_size,params_fl1,params_fl2,params_fl3,params_learning_rate,params_n_layers,params_num_epochs,params_train_size,params_weight_decay,state
107,0.19383525848388672,2023-09-01 23:13:57.626670,2023-09-01 23:14:34.814389,0 days 00:00:37.187719,Tanh,Tanh,,2,9,12.0,,0.004953621724524246,2,100,0.7625846646098118,5.5808067278485055e-05,COMPLETE
108,0.22079434990882874,2023-09-01 23:14:34.814664,2023-09-01 23:14:37.514424,0 days 00:00:02.699760,Tanh,Tanh,,10,8,5.0,,0.009646038979077053,2,40,0.6406692006335651,4.3840023985030074e-05,COMPLETE
109,0.2202882021665573,2023-09-01 23:14:37.514689,2023-09-01 23:14:52.006829,0 days 00:00:14.492140,Leaky,Leaky,,4,8,9.0,,0.007250911155445373,2,100,0.585375732569719,3.355436617151184e-05,COMPLETE
110,0.2022121548652649,2023-09-01 23:14:52.007101,2023-09-01 23:14:56.631314,0 days 00:00:04.624213,Tanh,Tanh,,16,4,19.0,,0.00367717974308436,2,100,0.6679285740772478,2.308880327593462e-05,COMPLETE
111,0.19235529005527496,2023-09-01 23:14:56.631586,2023-09-01 23:15:00.957697,0 days 00:00:04.326111,Leaky,Tanh,,16,12,13.0,,0.01636456548562689,2,100,0.6261093858752069,8.287968632102392e-05,COMPLETE
112,0.16996067762374878,2023-09-01 23:15:00.957969,2023-09-01 23:15:05.837257,0 days 00:00:04.879288,Leaky,Tanh,,16,11,12.0,,0.02411991740687884,2,100,0.7086724431027681,5.2398164149114706e-05,COMPLETE
113,0.18929702043533325,2023-09-01 23:15:05.837562,2023-09-01 23:15:10.885960,0 days 00:00:05.048398,Leaky,Tanh,,16,10,12.0,,0.026904289733702836,2,100,0.732444010727344,5.438571242384734e-05,COMPLETE
114,0.1798056662082672,2023-09-01 23:15:10.886254,2023-09-01 23:15:15.733276,0 days 00:00:04.847022,Leaky,Tanh,,16,11,11.0,,0.012578079103204968,2,100,0.7019317064013089,4.2272562704008536e-05,COMPLETE
115,0.18922099471092224,2023-09-01 23:15:15.733545,2023-09-01 23:15:35.322038,0 days 00:00:19.588493,Leaky,Sigmoid,,4,6,15.0,,0.023778919709686024,2,100,0.7803128142442641,6.489476206136324e-05,COMPLETE
116,0.204930379986763,2023-09-01 23:15:35.322317,2023-09-01 23:16:11.104135,0 days 00:00:35.781818,Tanh,Leaky,,2,7,10.0,,0.03199718066063967,2,100,0.7316551783533837,2.918171967226652e-05,COMPLETE
117,0.17985232174396515,2023-09-01 23:16:11.104415,2023-09-01 23:16:15.712110,0 days 00:00:04.607695,Tanh,Tanh,,16,9,23.0,,0.010699213706289495,2,100,0.6653682882494233,4.949408668780556e-05,COMPLETE
118,0.18804091215133667,2023-09-01 23:16:15.712388,2023-09-01 23:16:18.679543,0 days 00:00:02.967155,Tanh,ReLU,,30,13,16.0,,0.05058573219053242,2,100,0.7038166778302614,3.723877910925237e-05,COMPLETE
119,0.18978740274906158,2023-09-01 23:16:18.679813,2023-09-01 23:16:22.986900,0 days 00:00:04.307087,ReLU,Tanh,,16,8,14.0,,0.019716462140790487,2,100,0.6161548918718858,7.38538580499357e-05,COMPLETE
120,0.1824081987142563,2023-09-01 23:16:22.987190,2023-09-01 23:16:28.786542,0 days 00:00:05.799352,Tanh,Leaky,,12,10,11.0,,0.006068745208496229,2,100,0.6440832818924239,0.00023055535109115345,COMPLETE
121,0.1893424391746521,2023-09-01 23:16:28.786814,2023-09-01 23:16:33.969769,0 days 00:00:05.182955,Leaky,Tanh,,16,11,13.0,,0.017604647325098564,2,100,0.7475987075025813,0.00013354989082069431,COMPLETE
122,0.179295614361763,2023-09-01 23:16:33.970036,2023-09-01 23:16:37.923710,0 days 00:00:03.953674,Leaky,Tanh,,16,12,13.0,,0.014150953403231376,2,100,0.5652783211482636,0.00010355062801555754,COMPLETE
123,0.20071546733379364,2023-09-01 23:16:37.923977,2023-09-01 23:16:42.309121,0 days 00:00:04.385144,Leaky,Tanh,,16,9,12.0,,0.007809820234767893,2,100,0.6325379693717432,8.21401525245379e-05,COMPLETE
124,0.16029365360736847,2023-09-01 23:16:42.309391,2023-09-01 23:16:47.061148,0 days 00:00:04.751757,Leaky,Tanh,,16,11,15.0,,0.00913093406638982,2,100,0.6811686859455534,0.00012091544304955431,COMPLETE
125,0.18392080068588257,2023-09-01 23:16:47.061411,2023-09-01 23:17:04.110818,0 days 00:00:17.049407,Leaky,Tanh,,4,6,16.0,,0.009174960215476114,2,100,0.6814942673947972,5.0104989155776236e-05,COMPLETE
126,0.2019995152950287,2023-09-01 23:17:04.111112,2023-09-01 23:17:43.083290,0 days 00:00:38.972178,Tanh,Tanh,,2,7,15.0,,0.012917194187012242,2,100,0.7975668054784341,0.00016358057356176788,COMPLETE
127,0.1734175980091095,2023-09-01 23:17:43.083574,2023-09-01 23:17:45.074179,0 days 00:00:01.990605,Leaky,Leaky,,16,12,14.0,,0.010880843140611201,2,40,0.7139213431128446,5.980324494372333e-05,COMPLETE
128,0.19450324773788452,2023-09-01 23:17:45.074464,2023-09-01 23:17:47.173707,0 days 00:00:02.099243,Leaky,Leaky,,16,14,14.0,,0.004356311094131783,2,40,0.7581198687762362,0.00012690298634184652,COMPLETE
129,0.18001343309879303,2023-09-01 23:17:47.173981,2023-09-01 23:17:48.825272,0 days 00:00:01.651291,Leaky,Leaky,,16,13,15.0,,0.0031682215179572003,2,40,0.5907122250144043,9.454837979603254e-05,COMPLETE
130,0.1955994814634323,2023-09-01 23:17:48.825558,2023-09-01 23:17:50.838359,0 days 00:00:02.012801,Leaky,Leaky,,16,11,17.0,,0.005597378313350764,2,40,0.7238971497484791,1.9452540464262746e-05,COMPLETE
131,0.21511749923229218,2023-09-01 23:17:50.838639,2023-09-01 23:17:52.783279,0 days 00:00:01.944640,Leaky,Leaky,,16,12,14.0,,0.010754846220197165,2,40,0.6983628903130796,5.445669670205174e-05,COMPLETE
132,0.18833060562610626,2023-09-01 23:17:52.783551,2023-09-01 23:17:55.549942,0 days 00:00:02.766391,Tanh,Leaky,,16,10,11.0,,0.008825045940382317,2,60,0.6630288133130746,6.365064126954e-05,COMPLETE
133,0.1903490275144577,2023-09-01 23:17:55.550222,2023-09-01 23:18:03.302213,0 days 00:00:07.751991,Leaky,Tanh,,4,11,10.0,,0.00680381515750578,2,40,0.7681703839043899,3.215727598574631e-05,COMPLETE
134,0.17759694159030914,2023-09-01 23:18:03.302505,2023-09-01 23:18:10.765471,0 days 00:00:07.462966,Tanh,Tanh,,10,7,16.0,,0.020998623004194358,2,100,0.7100263026070923,4.27662429296465e-05,COMPLETE
135,0.1945304572582245,2023-09-01 23:18:10.765749,2023-09-01 23:18:16.485960,0 days 00:00:05.720211,Tanh,Tanh,,8,9,12.0,,0.011472497469542962,2,60,0.7392354890317887,2.4274762334161978e-05,COMPLETE
136,0.1549166738986969,2023-09-01 23:18:16.486239,2023-09-01 23:18:21.162874,0 days 00:00:04.676635,Tanh,Leaky,,16,12,13.0,,0.014344423723913369,2,100,0.6770632584745198,7.443277549608814e-05,COMPLETE
137,0.2062968909740448,2023-09-01 23:18:21.163147,2023-09-01 23:18:25.375736,0 days 00:00:04.212589,Leaky,Leaky,,16,15,14.0,,0.007972192279501793,2,100,0.6096111942191124,7.390695800804597e-05,COMPLETE
138,0.2049160748720169,2023-09-01 23:18:25.376015,2023-09-01 23:18:27.662709,0 days 00:00:02.286694,Tanh,Leaky,,16,12,13.0,,0.010316387187951043,2,60,0.5465682856287342,0.00011097174474679573,COMPLETE
139,0.18488720059394836,2023-09-01 23:18:27.663001,2023-09-01 23:18:31.237686,0 days 00:00:03.574685,Tanh,Leaky,,16,13,12.0,,0.01330961944015707,2,80,0.6450090422530763,8.930713005782408e-05,COMPLETE
140,0.2543402314186096,2023-09-01 23:18:31.237959,2023-09-01 23:18:35.890595,0 days 00:00:04.652636,Sigmoid,Leaky,,16,5,15.0,,0.0015310078063182151,2,100,0.6747702299077385,3.746166052012035e-05,COMPLETE
141,0.17608438432216644,2023-09-01 23:18:35.890872,2023-09-01 23:19:09.622658,0 days 00:00:33.731786,Tanh,Leaky,,2,12,11.0,,0.014960978033379525,2,100,0.6975588797936844,6.525322834598716e-05,COMPLETE
142,0.16244708001613617,2023-09-01 23:19:09.622948,2023-09-01 23:19:28.428657,0 days 00:00:18.805709,Tanh,Sigmoid,,4,10,8.0,,0.01949110493497808,2,100,0.7635510392304834,5.8059602098063594e-05,COMPLETE
143,0.22264623641967773,2023-09-01 23:19:28.428937,2023-09-01 23:19:47.055778,0 days 00:00:18.626841,Tanh,Sigmoid,,4,11,9.0,,0.023767598649037533,2,100,0.7632736053017861,2.7989339277432723e-05,COMPLETE
144,0.18109376728534698,2023-09-01 23:19:47.056058,2023-09-01 23:20:05.989373,0 days 00:00:18.933315,Tanh,Sigmoid,,4,8,10.0,,0.004979947189032218,2,100,0.7751174903561013,0.0001969405022818849,COMPLETE
145,0.20459602773189545,2023-09-01 23:20:05.989661,2023-09-01 23:20:23.804474,0 days 00:00:17.814813,Tanh,Sigmoid,,4,6,8.0,,0.008846300865905536,2,100,0.7322053034010142,7.436990803769948e-05,COMPLETE
146,0.18303616344928741,2023-09-01 23:20:23.804764,2023-09-01 23:20:40.350961,0 days 00:00:16.546197,Tanh,Sigmoid,,4,10,13.0,,0.002195814655135474,2,100,0.6759891675207408,4.5317563281567535e-05,COMPLETE
147,0.18102358281612396,2023-09-01 23:20:40.351254,2023-09-01 23:20:43.324769,0 days 00:00:02.973515,Tanh,Sigmoid,,16,7,9.0,,0.018237023371145775,2,60,0.7327841717836167,0.00013233070269085608,COMPLETE
148,0.19640254974365234,2023-09-01 23:20:43.325032,2023-09-01 23:20:46.496241,0 days 00:00:03.171209,ReLU,Leaky,,30,8,12.0,,0.01175933951218174,2,100,0.7936428256689294,6.11363924806934e-05,COMPLETE
149,0.22386574745178223,2023-09-01 23:20:46.496517,2023-09-01 23:20:52.889213,0 days 00:00:06.392696,Leaky,ReLU,,4,7,11.0,,0.006610966531282436,2,40,0.648703902197153,9.996072112775687e-05,COMPLETE
150,0.17326371371746063,2023-09-01 23:20:52.889491,2023-09-01 23:20:57.064542,0 days 00:00:04.175051,Tanh,Leaky,,16,9,20.0,,0.0028637693485293308,2,100,0.6118314227138283,3.5582157076483845e-05,COMPLETE
151,0.17677457630634308,2023-09-01 23:20:57.064819,2023-09-01 23:21:01.234903,0 days 00:00:04.170084,Tanh,Leaky,,16,10,19.0,,0.0029753439810217227,2,100,0.6101750298933318,3.433244482311268e-05,COMPLETE
152,0.2169370949268341,2023-09-01 23:21:01.235179,2023-09-01 23:21:05.259562,0 days 00:00:04.024383,Tanh,Leaky,,16,9,14.0,,0.0018897969416649045,2,100,0.5913518359777598,4.3679354233999955e-05,COMPLETE
153,0.19937190413475037,2023-09-01 23:21:05.259839,2023-09-01 23:21:08.710836,0 days 00:00:03.450997,Tanh,Leaky,,16,11,20.0,,0.002616116402268411,2,100,0.5002319152755133,5.485141013504044e-05,COMPLETE
154,0.1571023315191269,2023-09-01 23:21:08.711117,2023-09-01 23:21:13.575935,0 days 00:00:04.864818,Tanh,Leaky,,16,8,21.0,,0.004253803675120777,2,100,0.7108187274091659,2.7562530018897967e-05,COMPLETE
155,0.18317946791648865,2023-09-01 23:21:13.576207,2023-09-01 23:21:46.208596,0 days 00:00:32.632389,Tanh,Tanh,,2,8,21.0,,0.003583309874274861,2,100,0.6839678874601772,2.5080934185367704e-05,COMPLETE
156,0.15302959084510803,2023-09-01 23:21:46.208879,2023-09-01 23:21:51.373888,0 days 00:00:05.165009,Tanh,Leaky,,16,9,21.0,,0.004337782142454349,2,100,0.7572928148908712,1.9864092955036404e-05,COMPLETE
157,0.1654159426689148,2023-09-01 23:21:51.374158,2023-09-01 23:22:09.653334,0 days 00:00:18.279176,Tanh,Tanh,,4,8,23.0,,0.004332681976436368,2,100,0.7494450482410129,1.7584850485596648e-05,COMPLETE
158,0.22734799981117249,2023-09-01 23:22:09.653609,2023-09-01 23:22:29.081107,0 days 00:00:19.427498,Tanh,Tanh,,4,9,23.0,,0.004963963639181538,2,100,0.7992271135743836,1.7053600121517704e-05,COMPLETE
159,0.21906356513500214,2023-09-01 23:22:29.081376,2023-09-01 23:22:47.470444,0 days 00:00:18.389068,Tanh,Leaky,,4,8,22.0,,0.0042770636134723036,2,100,0.7513980423986791,2.1129161099755898e-05,COMPLETE
160,0.1840467005968094,2023-09-01 23:22:47.470741,2023-09-01 23:23:06.046758,0 days 00:00:18.576017,Tanh,Tanh,,4,10,24.0,,0.0076894920379283575,2,100,0.7643663919634078,1.2199515637169183e-05,COMPLETE
161,0.16227023303508759,2023-09-01 23:23:06.047032,2023-09-01 23:23:23.481355,0 days 00:00:17.434323,Tanh,Tanh,,4,7,22.0,,0.005916104515110285,2,100,0.7154650796991455,1.9064648056898776e-05,COMPLETE
162,0.19790469110012054,2023-09-01 23:23:23.481646,2023-09-01 23:23:40.911963,0 days 00:00:17.430317,Tanh,Tanh,,4,8,22.0,,0.0039629424690328305,2,100,0.7126056991933727,1.60730986286806e-05,COMPLETE
163,0.1705888956785202,2023-09-01 23:23:40.912236,2023-09-01 23:23:57.057592,0 days 00:00:16.145356,Tanh,Tanh,,4,7,21.0,,0.005604970041735942,2,100,0.6614429671149924,1.9641949045183485e-05,COMPLETE
164,0.19157610833644867,2023-09-01 23:23:57.057866,2023-09-01 23:24:13.215631,0 days 00:00:16.157765,Tanh,Tanh,,4,6,21.0,,0.00530528905142834,2,100,0.6599235477695224,1.9129128933021875e-05,COMPLETE
165,0.1852995604276657,2023-09-01 23:24:13.215904,2023-09-01 23:24:30.014736,0 days 00:00:16.798832,Tanh,Tanh,,4,8,23.0,,0.003536049776858663,2,100,0.6877587115442381,2.3126663597016565e-05,COMPLETE
166,0.1834508776664734,2023-09-01 23:24:30.015018,2023-09-01 23:24:48.236788,0 days 00:00:18.221770,Tanh,Tanh,,4,9,21.0,,0.006747889991201667,2,100,0.7448686823680764,2.7527798660362924e-05,COMPLETE
167,0.23509828746318817,2023-09-01 23:24:48.237058,2023-09-01 23:24:52.452546,0 days 00:00:04.215488,Tanh,Leaky,,4,7,22.0,,0.00427527210694221,2,60,0.2841819582290751,2.078956728769842e-05,COMPLETE
168,0.19468529522418976,2023-09-01 23:24:52.452814,2023-09-01 23:25:08.020331,0 days 00:00:15.567517,Tanh,Tanh,,4,6,23.0,,0.008244266500852707,2,100,0.6374778729947098,1.339118148524816e-05,COMPLETE
169,0.19665716588497162,2023-09-01 23:25:08.020598,2023-09-01 23:25:27.027346,0 days 00:00:19.006748,Tanh,Sigmoid,,4,8,22.0,,0.0015662450811810456,2,100,0.7738383618516116,1.7239990742615307e-05,COMPLETE
170,0.24467328190803528,2023-09-01 23:25:27.027620,2023-09-01 23:25:30.304510,0 days 00:00:03.276890,Tanh,Tanh,,12,9,20.0,,0.0012246820673659526,2,100,0.37059516324422853,1.2045718524449509e-05,COMPLETE
171,0.17904132604599,2023-09-01 23:25:30.304782,2023-09-01 23:25:47.518887,0 days 00:00:17.214105,Tanh,Tanh,,4,7,23.0,,0.005599531760608766,2,100,0.7036675335114837,2.883577130753361e-05,COMPLETE
172,0.19516628980636597,2023-09-01 23:25:47.519159,2023-09-01 23:25:49.315410,0 days 00:00:01.796251,Tanh,Tanh,,30,7,24.0,,0.006268785895532038,2,100,0.4448847569449442,2.456110246936343e-05,COMPLETE
173,0.21462085843086243,2023-09-01 23:25:49.315678,2023-09-01 23:26:24.026041,0 days 00:00:34.710363,Tanh,Tanh,,2,7,21.0,,0.009111397391373732,2,100,0.7281973551199935,3.245392075496415e-05,COMPLETE
174,0.18742038309574127,2023-09-01 23:26:24.026314,2023-09-01 23:26:40.322635,0 days 00:00:16.296321,Tanh,Tanh,,4,8,21.0,,0.01603795609492903,2,100,0.6689979750390921,1.6031044329590508e-05,COMPLETE
175,0.1557646244764328,2023-09-01 23:26:40.322910,2023-09-01 23:26:58.697324,0 days 00:00:18.374414,Tanh,Tanh,,4,24,19.0,,0.00459104984162031,2,100,0.7523004559530958,1.913789811428523e-05,COMPLETE
176,0.16923631727695465,2023-09-01 23:26:58.697603,2023-09-01 23:27:10.499697,0 days 00:00:11.802094,Tanh,Leaky,,4,10,19.0,,0.002284885369978478,2,60,0.799052557799616,1.8641954830810968e-05,COMPLETE
177,0.16697019338607788,2023-09-01 23:27:10.499976,2023-09-01 23:27:30.154039,0 days 00:00:19.654063,Sigmoid,Tanh,,4,17,19.0,,0.0025826167962210308,2,100,0.7982318933144631,1.9977399829785764e-05,COMPLETE
178,0.18039660155773163,2023-09-01 23:27:30.154314,2023-09-01 23:27:45.854381,0 days 00:00:15.700067,Sigmoid,Leaky,,4,23,18.0,,0.002425309152205439,2,80,0.7991951724721541,1.426175886278356e-05,COMPLETE
179,0.20487920939922333,2023-09-01 23:27:45.854662,2023-09-01 23:27:57.284511,0 days 00:00:11.429849,Sigmoid,ReLU,,4,10,19.0,,0.0030366015427760874,2,60,0.7688255974223326,1.1315510292228945e-05,COMPLETE
180,0.19902320206165314,2023-09-01 23:27:57.284800,2023-09-01 23:28:15.633470,0 days 00:00:18.348670,Sigmoid,Tanh,,4,11,18.0,,0.001779484945681168,2,100,0.7481256174108679,2.0656588909924536e-05,COMPLETE
181,0.15923085808753967,2023-09-01 23:28:15.633751,2023-09-01 23:28:34.406196,0 days 00:00:18.772445,Sigmoid,Tanh,,4,18,20.0,,0.004547695127395301,2,100,0.7595546242937686,1.8519940197607452e-05,COMPLETE
182,0.17448608577251434,2023-09-01 23:28:34.406484,2023-09-01 23:28:53.311897,0 days 00:00:18.905413,Sigmoid,Tanh,,4,17,20.0,,0.002174625044300169,2,100,0.7694645164891404,1.69097682526426e-05,COMPLETE
183,0.18448923528194427,2023-09-01 23:28:53.312171,2023-09-01 23:29:11.175448,0 days 00:00:17.863277,Sigmoid,Tanh,,4,21,19.0,,0.004008128801051343,2,100,0.7299314138046324,1.3850131089654099e-05,COMPLETE
184,0.16328176856040955,2023-09-01 23:29:11.175723,2023-09-01 23:29:30.415900,0 days 00:00:19.240177,Sigmoid,Tanh,,4,18,18.0,,0.0034264750465285137,2,100,0.7882033376918304,2.363993776809794e-05,COMPLETE
185,0.1754024475812912,2023-09-01 23:29:30.416196,2023-09-01 23:29:49.396053,0 days 00:00:18.979857,Sigmoid,Tanh,,4,18,18.0,,0.003114128997883767,2,100,0.7770975698441059,2.3026561907041343e-05,COMPLETE
186,0.16858741641044617,2023-09-01 23:29:49.396331,2023-09-01 23:30:07.673540,0 days 00:00:18.277209,Sigmoid,Tanh,,4,19,20.0,,0.0046732344457340305,2,100,0.7464844125485827,1.7757582621316656e-05,COMPLETE
187,0.20162197947502136,2023-09-01 23:30:07.673814,2023-09-01 23:30:25.861759,0 days 00:00:18.187945,Sigmoid,Tanh,,4,18,20.0,,0.004838477540957527,2,100,0.7425060797462952,2.4301554295236114e-05,COMPLETE
188,0.17115429043769836,2023-09-01 23:30:25.862043,2023-09-01 23:30:44.477255,0 days 00:00:18.615212,Sigmoid,Tanh,,4,19,19.0,,0.0036815281801433953,2,100,0.7595845138488997,1.4808263579820882e-05,COMPLETE
189,0.17197667062282562,2023-09-01 23:30:44.477535,2023-09-01 23:31:01.734534,0 days 00:00:17.256999,Sigmoid,Tanh,,4,20,20.0,,0.0032969976156363642,2,100,0.7063541069693194,1.0084662327301513e-05,COMPLETE
190,0.1562412828207016,2023-09-01 23:31:01.734808,2023-09-01 23:31:19.764620,0 days 00:00:18.029812,Sigmoid,Tanh,,4,17,19.0,,0.004576427995243932,2,100,0.7384707087789362,2.810902949831606e-05,COMPLETE
191,0.15444372594356537,2023-09-01 23:31:19.764895,2023-09-01 23:31:37.757620,0 days 00:00:17.992725,Sigmoid,Tanh,,4,17,19.0,,0.004651438685863034,2,100,0.7345574642466813,2.8452759421518788e-05,COMPLETE
192,0.15891295671463013,2023-09-01 23:31:37.757910,2023-09-01 23:31:57.329689,0 days 00:00:19.571779,Sigmoid,Tanh,,4,17,19.0,,0.004220554903524307,2,100,0.7988424134520258,2.9836305211776432e-05,COMPLETE
193,0.18180625140666962,2023-09-01 23:31:57.329976,2023-09-01 23:32:16.909844,0 days 00:00:19.579868,Sigmoid,Tanh,,4,17,19.0,,0.003549617510013694,2,100,0.7976481704812651,2.843769917549003e-05,COMPLETE
194,0.1936856508255005,2023-09-01 23:32:16.910124,2023-09-01 23:32:35.691433,0 days 00:00:18.781309,Sigmoid,Tanh,,4,16,18.0,,0.004608833177758847,2,100,0.7690387696464739,2.9140005843271836e-05,COMPLETE
195,0.16475997865200043,2023-09-01 23:32:35.691723,2023-09-01 23:32:53.451903,0 days 00:00:17.760180,Sigmoid,Tanh,,4,17,19.0,,0.002920768568095358,2,100,0.7241952740545338,2.3163770464743422e-05,COMPLETE
196,0.17363831400871277,2023-09-01 23:32:53.452176,2023-09-01 23:33:10.899389,0 days 00:00:17.447213,Sigmoid,Tanh,,4,17,18.0,,0.0040715323735957725,2,100,0.7146371739091377,2.1772243846673675e-05,COMPLETE
197,0.17513936758041382,2023-09-01 23:33:10.899670,2023-09-01 23:33:27.650042,0 days 00:00:16.750372,Sigmoid,Tanh,,4,16,19.0,,0.00273792906835509,2,100,0.68463178199436,3.4888411443126865e-05,COMPLETE
198,0.20589248836040497,2023-09-01 23:33:27.650316,2023-09-01 23:33:37.246126,0 days 00:00:09.595810,Sigmoid,Tanh,,4,17,17.0,,0.0026392718866623966,2,100,0.39332121960253297,2.535266419236127e-05,COMPLETE
199,0.2257615625858307,2023-09-01 23:33:37.246404,2023-09-01 23:33:42.878456,0 days 00:00:05.632052,Sigmoid,Tanh,,4,16,19.0,,0.004028816139175303,2,100,0.22943017832722024,2.1713844103345906e-05,COMPLETE
200,0.17135584354400635,2023-09-01 23:33:42.878748,2023-09-01 23:34:00.870661,0 days 00:00:17.991913,Sigmoid,Tanh,,4,18,18.0,,0.002999444269833408,2,100,0.735545054897125,1.7651448554688233e-05,COMPLETE
201,0.184535950422287,2023-09-01 23:34:00.870929,2023-09-01 23:34:19.632506,0 days 00:00:18.761577,Sigmoid,Tanh,,4,24,20.0,,0.004922815330122616,2,100,0.7629481183117295,2.7260081761315684e-05,COMPLETE
202,0.19212551414966583,2023-09-01 23:34:19.632791,2023-09-01 23:34:29.865648,0 days 00:00:10.232857,Sigmoid,Tanh,,4,18,18.0,,0.003598610541754258,2,100,0.41681363805348437,3.222710243798818e-05,COMPLETE
203,0.17104290425777435,2023-09-01 23:34:29.865923,2023-09-01 23:34:49.382083,0 days 00:00:19.516160,Sigmoid,Tanh,,4,16,19.0,,0.0056322308970276295,2,100,0.7991207368741016,3.965390016038115e-05,COMPLETE
204,0.16679821908473969,2023-09-01 23:34:49.382366,2023-09-01 23:35:06.397881,0 days 00:00:17.015515,Sigmoid,Tanh,,4,15,20.0,,0.006973695783311783,2,100,0.6936362127646238,2.4245471331854218e-05,COMPLETE
205,0.1781158298254013,2023-09-01 23:35:06.398160,2023-09-01 23:35:23.259568,0 days 00:00:16.861408,Sigmoid,Tanh,,4,17,20.0,,0.007399820838313157,2,100,0.6893473321493186,2.17898539385959e-05,COMPLETE
206,0.17789016664028168,2023-09-01 23:35:23.259851,2023-09-01 23:35:40.873070,0 days 00:00:17.613219,Sigmoid,Tanh,,4,15,21.0,,0.004446377961224556,2,100,0.7224620396359874,1.5993395894230434e-05,COMPLETE
207,0.1722540259361267,2023-09-01 23:35:40.873354,2023-09-01 23:35:59.071411,0 days 00:00:18.198057,Sigmoid,Tanh,,4,18,20.0,,0.005880430813957517,2,100,0.7421970548812576,2.4438395192460444e-05,COMPLETE
208,0.2003556340932846,2023-09-01 23:35:59.071685,2023-09-01 23:36:01.838741,0 days 00:00:02.767056,Sigmoid,Sigmoid,,30,17,22.0,,0.003440059618150251,2,100,0.6879429681340811,0.0005229649437421647,COMPLETE
209,0.17549237608909607,2023-09-01 23:36:01.839021,2023-09-01 23:36:11.601995,0 days 00:00:09.762974,Sigmoid,Tanh,,8,22,20.0,,0.007063701534552208,2,100,0.7646737919115936,1.947341578517194e-05,COMPLETE
210,0.20265913009643555,2023-09-01 23:36:11.602271,2023-09-01 23:36:29.072446,0 days 00:00:17.470175,Sigmoid,Tanh,,4,18,22.0,,0.004837791964059609,2,100,0.7146632055193117,3.129784174331428e-05,COMPLETE
211,0.1816030740737915,2023-09-01 23:36:29.072728,2023-09-01 23:36:44.786295,0 days 00:00:15.713567,Sigmoid,Tanh,,4,17,19.0,,0.012955949679691832,2,100,0.6417698289589866,2.466918371286413e-05,COMPLETE
212,0.1778380572795868,2023-09-01 23:36:44.786582,2023-09-01 23:37:01.289264,0 days 00:00:16.502682,Sigmoid,Tanh,,4,16,19.0,,0.006190348964624697,2,100,0.6741714344052543,3.848350397164963e-05,COMPLETE
213,0.17415526509284973,2023-09-01 23:37:01.289540,2023-09-01 23:37:20.886428,0 days 00:00:19.596888,Sigmoid,Tanh,,4,20,21.0,,0.010676487885108155,2,100,0.798479133486505,2.7984852835344542e-05,COMPLETE
