number,value,datetime_start,datetime_complete,duration,params_activation1,params_batch_size,params_fl1,params_learning_rate,params_n_layers,params_num_epochs,params_train_size,params_weight_decay,state
0,0.3373962342739105,2023-09-01 22:59:42.626690,2023-09-01 22:59:43.188988,0 days 00:00:00.562298,ReLU,30,4,0.0011139145740516382,1,60,0.27509070143490355,0.007197790470083683,COMPLETE
1,0.36199259757995605,2023-09-01 22:59:43.189252,2023-09-01 22:59:44.057615,0 days 00:00:00.868363,Leaky,8,2,0.005357032823742494,1,60,0.13782733978876927,0.027771202868410443,COMPLETE
2,0.23839572072029114,2023-09-01 22:59:44.057871,2023-09-01 22:59:46.559652,0 days 00:00:02.501781,ReLU,12,19,0.015387402929405887,1,100,0.3396302640598253,1.2678364505157777e-05,COMPLETE
3,0.3270462155342102,2023-09-01 22:59:46.559911,2023-09-01 22:59:47.801394,0 days 00:00:01.241483,Sigmoid,12,14,0.09895635497058781,1,100,0.17007255443291822,0.005406285035799214,COMPLETE
4,0.40055471658706665,2023-09-01 22:59:47.801663,2023-09-01 22:59:55.030181,0 days 00:00:07.228518,Leaky,2,12,1.5056153662126791e-05,1,60,0.32633728979865806,0.0014999847993062716,COMPLETE
5,0.707932710647583,2023-09-01 22:59:55.030444,2023-09-01 22:59:56.076873,0 days 00:00:01.046429,Tanh,4,21,1.1915211473240148e-05,1,40,0.13501914168571555,0.030327495839525813,COMPLETE
6,0.7571154236793518,2023-09-01 22:59:56.077131,2023-09-01 22:59:56.543204,0 days 00:00:00.466073,ReLU,30,6,5.236341681555949e-05,1,80,0.174753283566907,0.0004451140229374746,COMPLETE
7,0.25477761030197144,2023-09-01 22:59:56.543473,2023-09-01 22:59:58.843404,0 days 00:00:02.299931,ReLU,10,3,0.015181733301874773,1,40,0.7130520036379104,2.212900465365675e-05,COMPLETE
8,0.22092977166175842,2023-09-01 22:59:58.843650,2023-09-01 23:00:02.707924,0 days 00:00:03.864274,Leaky,16,24,0.024316043812505073,1,100,0.7190939024049908,6.522726164731927e-05,COMPLETE
9,0.22515633702278137,2023-09-01 23:00:02.708155,2023-09-01 23:00:06.246380,0 days 00:00:03.538225,Leaky,4,19,0.010579633691219968,1,60,0.3068566321634161,6.0571506119032616e-05,COMPLETE
10,0.2406655251979828,2023-09-01 23:00:06.246608,2023-09-01 23:00:10.011979,0 days 00:00:03.765371,Sigmoid,16,24,0.06902434751560893,1,100,0.6962194072597067,0.00014803585792105728,COMPLETE
11,0.21726290881633759,2023-09-01 23:00:10.012220,2023-09-01 23:00:17.528122,0 days 00:00:07.515902,Leaky,4,17,0.002659159358395797,1,80,0.4895705985291862,6.261205806929873e-05,COMPLETE
12,0.2237258106470108,2023-09-01 23:00:17.528363,2023-09-01 23:00:19.794218,0 days 00:00:02.265855,Leaky,16,13,0.0014195718535206928,1,80,0.5185470317972942,0.00010683729880188797,COMPLETE
13,0.22185367345809937,2023-09-01 23:00:19.794468,2023-09-01 23:00:27.682071,0 days 00:00:07.887603,Leaky,4,24,0.0003718902839420025,1,80,0.5134380490016934,3.736131110209727e-05,COMPLETE
14,0.19770343601703644,2023-09-01 23:00:27.682314,2023-09-01 23:00:31.947110,0 days 00:00:04.264796,Tanh,16,16,0.0028987809916061744,1,100,0.7958126364947938,1.0294186301324455e-05,COMPLETE
15,0.20988096296787262,2023-09-01 23:00:31.947357,2023-09-01 23:00:35.347670,0 days 00:00:03.400313,Tanh,10,16,0.003139330672047539,1,80,0.5203406591251191,1.2982242277838685e-05,COMPLETE
16,0.27492555975914,2023-09-01 23:00:35.347904,2023-09-01 23:00:41.562913,0 days 00:00:06.215009,Tanh,10,10,0.0003706227043613588,1,100,0.7664490120053482,1.6539664206000722e-05,COMPLETE
17,0.23709306120872498,2023-09-01 23:00:41.563163,2023-09-01 23:00:45.010005,0 days 00:00:03.446842,Tanh,10,8,0.0038735791074868808,1,80,0.5336180050590905,1.068723579302741e-05,COMPLETE
18,0.2752598822116852,2023-09-01 23:00:45.010246,2023-09-01 23:00:50.921710,0 days 00:00:05.911464,Tanh,2,16,0.0004843546594211504,1,40,0.39811546350106497,0.00021025360734579207,COMPLETE
19,0.1943892538547516,2023-09-01 23:00:50.921952,2023-09-01 23:00:57.049225,0 days 00:00:06.127273,Tanh,8,16,0.003103083593987695,1,100,0.6186528977885509,2.6485475442312024e-05,COMPLETE
20,0.20790986716747284,2023-09-01 23:00:57.049455,2023-09-01 23:01:04.893695,0 days 00:00:07.844240,Tanh,8,11,0.007304803696976949,1,100,0.7917128678009058,2.9097702001606194e-05,COMPLETE
21,0.2170209437608719,2023-09-01 23:01:04.893936,2023-09-01 23:01:12.700895,0 days 00:00:07.806959,Tanh,8,10,0.008129077418756993,1,100,0.7906136605621744,4.456280025936087e-05,COMPLETE
22,0.20116941630840302,2023-09-01 23:01:12.701130,2023-09-01 23:01:18.940065,0 days 00:00:06.238935,Tanh,8,11,0.001792582291887809,1,100,0.6253511418478318,2.6770965738269667e-05,COMPLETE
23,0.19291041791439056,2023-09-01 23:01:18.940306,2023-09-01 23:01:25.319547,0 days 00:00:06.379241,Tanh,8,14,0.0017659490848476965,1,100,0.6389113527099838,1.0451016379174025e-05,COMPLETE
24,0.21774421632289886,2023-09-01 23:01:25.319794,2023-09-01 23:01:31.565531,0 days 00:00:06.245737,Tanh,8,14,0.0008316453928239591,1,100,0.6264804915445827,1.035732481056321e-05,COMPLETE
25,0.20519010722637177,2023-09-01 23:01:31.565775,2023-09-01 23:01:34.887980,0 days 00:00:03.322205,Tanh,16,18,0.003337596787693361,1,100,0.6153619810319911,2.4859828474237547e-05,COMPLETE
26,0.2881603240966797,2023-09-01 23:01:34.888213,2023-09-01 23:01:39.322817,0 days 00:00:04.434604,Sigmoid,8,21,0.0007449445004534877,1,100,0.4460800241737799,1.0283794618840985e-05,COMPLETE
27,0.21647784113883972,2023-09-01 23:01:39.323057,2023-09-01 23:01:45.331084,0 days 00:00:06.008027,Tanh,8,14,0.001860967422869432,1,100,0.6010410457452021,0.00025297963284916795,COMPLETE
28,0.3075255751609802,2023-09-01 23:01:45.331313,2023-09-01 23:01:47.602100,0 days 00:00:02.270787,Tanh,16,21,0.0002175067480123673,1,100,0.41492685169866494,0.00010094447529018992,COMPLETE
29,0.2583284378051758,2023-09-01 23:01:47.602335,2023-09-01 23:01:48.476084,0 days 00:00:00.873749,Tanh,30,17,0.0011530951071407087,1,100,0.2574490420217167,2.365919057946524e-05,COMPLETE
30,0.22627657651901245,2023-09-01 23:01:48.476314,2023-09-01 23:01:50.858492,0 days 00:00:02.382178,Tanh,8,8,0.004690826947741904,1,40,0.5987302838211952,3.994133069200713e-05,COMPLETE
31,0.2149403691291809,2023-09-01 23:01:50.858738,2023-09-01 23:01:57.412470,0 days 00:00:06.553732,Tanh,8,15,0.0019428945543650434,1,100,0.6542700099797834,2.111955735594907e-05,COMPLETE
32,0.22567985951900482,2023-09-01 23:01:57.412712,2023-09-01 23:02:03.301897,0 days 00:00:05.889185,Tanh,8,12,0.0019166883571112548,1,100,0.589053852217843,3.08078409132183e-05,COMPLETE
33,0.22909709811210632,2023-09-01 23:02:03.302146,2023-09-01 23:02:07.281320,0 days 00:00:03.979174,Tanh,8,9,0.005731059928375671,1,60,0.6729971339840705,1.783695841647759e-05,COMPLETE
34,0.29373958706855774,2023-09-01 23:02:07.281562,2023-09-01 23:02:12.676390,0 days 00:00:05.394828,ReLU,12,6,0.0011798158709509087,1,100,0.7930768538386923,7.832904225622283e-05,COMPLETE
35,0.22149749100208282,2023-09-01 23:02:12.676638,2023-09-01 23:02:18.231612,0 days 00:00:05.554974,Sigmoid,8,13,0.0023632430702399915,1,100,0.5694163685467601,1.7329871432132505e-05,COMPLETE
36,0.21658846735954285,2023-09-01 23:02:18.231854,2023-09-01 23:02:28.235475,0 days 00:00:10.003621,Tanh,2,19,0.005678866083417393,1,60,0.4606232207516708,3.5947355777295645e-05,COMPLETE
37,0.3982803225517273,2023-09-01 23:02:28.235718,2023-09-01 23:02:32.846072,0 days 00:00:04.610354,Tanh,12,15,0.004036054885427977,1,100,0.677116000767072,0.09419084287950016,COMPLETE
38,0.23814094066619873,2023-09-01 23:02:32.846309,2023-09-01 23:02:34.625581,0 days 00:00:01.779272,ReLU,30,11,0.0013522340036684277,1,100,0.553097673483017,1.0211794592671462e-05,COMPLETE
39,0.17860369384288788,2023-09-01 23:02:34.625820,2023-09-01 23:02:41.280568,0 days 00:00:06.654748,Tanh,8,15,0.014096011731908858,1,100,0.6854979847571543,5.431967828664218e-05,COMPLETE
40,0.20291149616241455,2023-09-01 23:02:41.280803,2023-09-01 23:02:42.799865,0 days 00:00:01.519062,Sigmoid,16,19,0.018970691057446358,1,40,0.7152896500136082,4.945918418185392e-05,COMPLETE
41,0.19114890694618225,2023-09-01 23:02:42.800105,2023-09-01 23:02:49.102260,0 days 00:00:06.302155,Tanh,8,15,0.011238225675465114,1,100,0.6484878642464099,1.7168860814129805e-05,COMPLETE
42,0.1953185349702835,2023-09-01 23:02:49.102503,2023-09-01 23:02:56.111259,0 days 00:00:07.008756,Tanh,8,16,0.010788767142291607,1,100,0.7213991493169014,1.6788043793416307e-05,COMPLETE
43,0.1908033937215805,2023-09-01 23:02:56.111503,2023-09-01 23:03:02.852215,0 days 00:00:06.740712,Tanh,8,15,0.012760166910774707,1,100,0.6959568160326827,1.6551539282865212e-05,COMPLETE
44,0.20733581483364105,2023-09-01 23:03:02.852460,2023-09-01 23:03:09.240311,0 days 00:00:06.387851,Tanh,8,14,0.025536989037932754,1,100,0.6600114601627103,5.0848062574002585e-05,COMPLETE
45,0.2867819368839264,2023-09-01 23:03:09.240552,2023-09-01 23:03:12.473144,0 days 00:00:03.232592,ReLU,8,18,0.03669941549185338,1,60,0.5485228872110598,0.0007379657951691688,COMPLETE
46,0.22823509573936462,2023-09-01 23:03:12.473389,2023-09-01 23:03:17.118469,0 days 00:00:04.645080,Tanh,8,13,0.012339876001055771,1,100,0.4795388346019759,8.309370918680792e-05,COMPLETE
47,0.17877507209777832,2023-09-01 23:03:17.118710,2023-09-01 23:03:24.114176,0 days 00:00:06.995466,Tanh,8,17,0.008177447992567604,1,100,0.7219953641950053,1.4746324708488156e-05,COMPLETE
48,0.19587373733520508,2023-09-01 23:03:24.114421,2023-09-01 23:03:31.226600,0 days 00:00:07.112179,Leaky,8,20,0.008957192158884639,1,100,0.731354925766804,1.6440098935733614e-05,COMPLETE
49,0.22389987111091614,2023-09-01 23:03:31.226867,2023-09-01 23:03:36.329375,0 days 00:00:05.102508,Tanh,4,15,0.0179315708156892,1,40,0.6882896914103901,6.296464686805244e-05,COMPLETE
50,0.46741506457328796,2023-09-01 23:03:36.329615,2023-09-01 23:03:55.801844,0 days 00:00:19.472229,Sigmoid,2,1,0.04376514915548317,1,100,0.5494885344613324,1.4044786747628333e-05,COMPLETE
51,0.2162315845489502,2023-09-01 23:03:55.802088,2023-09-01 23:04:02.217028,0 days 00:00:06.414940,Tanh,8,17,0.014091308349087327,1,100,0.6599595756883967,3.073582955932023e-05,COMPLETE
52,0.2051047682762146,2023-09-01 23:04:02.217271,2023-09-01 23:04:09.266603,0 days 00:00:07.049332,Tanh,8,17,0.007679849633304709,1,100,0.7243693135332663,2.185251182247559e-05,COMPLETE
53,0.2105933278799057,2023-09-01 23:04:09.266840,2023-09-01 23:04:14.933088,0 days 00:00:05.666248,Tanh,8,15,0.0058327950092277306,1,100,0.5822522426641144,1.5547776978383595e-05,COMPLETE
54,0.2083309292793274,2023-09-01 23:04:14.933334,2023-09-01 23:04:18.884926,0 days 00:00:03.951592,Tanh,8,14,0.010824674562664602,1,80,0.5082787531909719,3.9700672709222565e-05,COMPLETE
55,0.2289728820323944,2023-09-01 23:04:18.885168,2023-09-01 23:04:23.842703,0 days 00:00:04.957535,Tanh,12,18,0.022613708196987922,1,100,0.7380753485225358,2.336791466200539e-05,COMPLETE
56,0.21504560112953186,2023-09-01 23:04:23.842957,2023-09-01 23:04:25.876968,0 days 00:00:02.034011,Leaky,30,12,0.004138320368200912,1,100,0.6380279480523476,1.3712445538081592e-05,COMPLETE
57,0.17047414183616638,2023-09-01 23:04:25.877259,2023-09-01 23:04:30.262163,0 days 00:00:04.384904,Tanh,8,13,0.015316619810096414,1,60,0.7493902396402419,5.3792796276411835e-05,COMPLETE
58,0.2015289068222046,2023-09-01 23:04:30.262408,2023-09-01 23:04:33.826660,0 days 00:00:03.564252,ReLU,10,13,0.015184903654553272,1,60,0.7448224919367402,5.536239837641859e-05,COMPLETE
59,0.18317288160324097,2023-09-01 23:04:33.826914,2023-09-01 23:04:38.302670,0 days 00:00:04.475756,Tanh,8,14,0.029526034462864423,1,60,0.7661705161943543,0.00011829182895521962,COMPLETE
60,0.20104119181632996,2023-09-01 23:04:38.302917,2023-09-01 23:04:42.908960,0 days 00:00:04.606043,Tanh,8,16,0.029131981552926154,1,60,0.7876546258492952,0.00014028979012903906,COMPLETE
61,0.22309419512748718,2023-09-01 23:04:42.909198,2023-09-01 23:04:46.949976,0 days 00:00:04.040778,Tanh,8,14,0.051970457702419114,1,60,0.6890712790883324,3.406871039650217e-05,COMPLETE
62,0.19186954200267792,2023-09-01 23:04:46.950224,2023-09-01 23:04:51.369523,0 days 00:00:04.419299,Tanh,8,15,0.019474277003270396,1,60,0.7543752426434509,4.751041592117843e-05,COMPLETE
63,0.2749398648738861,2023-09-01 23:04:51.369776,2023-09-01 23:04:59.848014,0 days 00:00:08.478238,Tanh,4,15,0.08036448478967505,1,60,0.7586292281702027,7.772517256438867e-05,COMPLETE
64,0.1995968073606491,2023-09-01 23:04:59.848263,2023-09-01 23:05:04.540969,0 days 00:00:04.692706,Tanh,8,13,0.028669563583120294,1,60,0.7999862371194715,0.00010842791878755707,COMPLETE
65,0.20708546042442322,2023-09-01 23:05:04.541219,2023-09-01 23:05:08.721170,0 days 00:00:04.179951,Tanh,8,18,0.019638357999762657,1,60,0.7141715820330203,4.8818252222961185e-05,COMPLETE
66,0.2035204917192459,2023-09-01 23:05:08.721421,2023-09-01 23:05:12.406066,0 days 00:00:03.684645,Tanh,8,11,0.01415154377755647,1,60,0.627818125900446,6.483444617301509e-05,COMPLETE
67,0.23349007964134216,2023-09-01 23:05:12.406317,2023-09-01 23:05:16.447976,0 days 00:00:04.041659,Tanh,8,12,0.03366500117348726,1,60,0.6914834798738777,3.904486480674919e-05,COMPLETE
68,0.22086524963378906,2023-09-01 23:05:16.448216,2023-09-01 23:05:19.156704,0 days 00:00:02.708488,Leaky,10,16,0.023453811149069474,1,60,0.5674811948972132,2.081452647793786e-05,COMPLETE
69,0.3305297791957855,2023-09-01 23:05:19.156950,2023-09-01 23:05:35.498403,0 days 00:00:16.341453,Tanh,2,22,0.061008163888419786,1,60,0.7523815327549455,2.847551305769239e-05,COMPLETE
70,0.20824691653251648,2023-09-01 23:05:35.498647,2023-09-01 23:05:40.202773,0 days 00:00:04.704126,Tanh,8,17,0.04064867612129423,1,80,0.6048452618256199,0.00013553041243367188,COMPLETE
71,0.2111537754535675,2023-09-01 23:05:40.203012,2023-09-01 23:05:43.989700,0 days 00:00:03.786688,Tanh,8,15,0.009183812798624203,1,60,0.6472742965956086,1.2720797917588725e-05,COMPLETE
72,0.1868920624256134,2023-09-01 23:05:43.989942,2023-09-01 23:05:47.942290,0 days 00:00:03.952348,Tanh,8,14,0.01699156762631431,1,60,0.6794633255110496,1.2512124312743235e-05,COMPLETE
73,0.19614751636981964,2023-09-01 23:05:47.942541,2023-09-01 23:05:51.960728,0 days 00:00:04.018187,Tanh,8,13,0.01561216913831387,1,60,0.688776228665342,1.852801855083057e-05,COMPLETE
74,0.23695002496242523,2023-09-01 23:05:51.960969,2023-09-01 23:05:56.325165,0 days 00:00:04.364196,Tanh,8,14,0.011447261060518913,1,60,0.7503265408017944,2.8241889887755403e-05,COMPLETE
75,0.2074141949415207,2023-09-01 23:05:56.325405,2023-09-01 23:05:59.850267,0 days 00:00:03.524862,Tanh,8,16,0.020029628248968104,1,60,0.6029445314613435,1.3028239356674658e-05,COMPLETE
76,0.1822301745414734,2023-09-01 23:05:59.850516,2023-09-01 23:06:01.368177,0 days 00:00:01.517661,Sigmoid,30,15,0.02946504251227748,1,60,0.7978351393893087,4.434280287154468e-05,COMPLETE
77,0.21664266288280487,2023-09-01 23:06:01.368417,2023-09-01 23:06:02.211948,0 days 00:00:00.843531,Sigmoid,30,17,0.031253579925955684,1,40,0.6583179873381988,2.2831895934418128e-05,COMPLETE
78,0.21907417476177216,2023-09-01 23:06:02.212191,2023-09-01 23:06:03.725341,0 days 00:00:01.513150,Sigmoid,30,10,0.006384037559677127,1,60,0.7977571788366892,3.384704566795601e-05,COMPLETE
79,0.23044010996818542,2023-09-01 23:06:03.725584,2023-09-01 23:06:05.483408,0 days 00:00:01.757824,Sigmoid,30,12,0.007879192612882061,1,80,0.699699835469702,1.831540436117369e-05,COMPLETE
80,0.20861919224262238,2023-09-01 23:06:05.483648,2023-09-01 23:06:06.484891,0 days 00:00:01.001243,Sigmoid,30,13,0.0425976654862336,1,60,0.5189186909048894,1.2757151400973125e-05,COMPLETE
81,0.2056746482849121,2023-09-01 23:06:06.485136,2023-09-01 23:06:10.907253,0 days 00:00:04.422117,Tanh,8,15,0.016884178419441374,1,60,0.7614055776490155,4.542649785330156e-05,COMPLETE
82,0.22067034244537354,2023-09-01 23:06:10.907503,2023-09-01 23:06:15.093354,0 days 00:00:04.185851,Sigmoid,8,14,0.024971731560202427,1,60,0.7218102525679799,5.591560023545826e-05,COMPLETE
83,0.181559756398201,2023-09-01 23:06:15.093619,2023-09-01 23:06:22.405564,0 days 00:00:07.311945,Tanh,4,15,0.013315900184659241,1,60,0.6596064410382092,3.88675584734688e-05,COMPLETE
84,0.2126813530921936,2023-09-01 23:06:22.405807,2023-09-01 23:06:24.960432,0 days 00:00:02.554625,ReLU,12,16,0.012703744948408615,1,60,0.6328191093841904,2.8784445270090274e-05,COMPLETE
85,0.20455902814865112,2023-09-01 23:06:24.960674,2023-09-01 23:06:31.391558,0 days 00:00:06.430884,Tanh,4,14,0.009954539136605852,1,60,0.5822371864753986,3.8094158293998025e-05,COMPLETE
86,0.19866156578063965,2023-09-01 23:06:31.391795,2023-09-01 23:06:43.452936,0 days 00:00:12.061141,Tanh,4,15,0.012899516128924317,1,100,0.658213997043012,6.814652024559874e-05,COMPLETE
87,0.22757400572299957,2023-09-01 23:06:43.453182,2023-09-01 23:06:48.607550,0 days 00:00:05.154368,Tanh,4,17,0.007162585435944688,1,40,0.7016008440655442,2.413474681359379e-05,COMPLETE
88,0.3113296926021576,2023-09-01 23:06:48.607787,2023-09-01 23:06:55.321305,0 days 00:00:06.713518,Leaky,4,16,0.03375742438546083,1,60,0.6090545336112823,1.9679089628058938e-05,COMPLETE
89,0.21123741567134857,2023-09-01 23:06:55.321550,2023-09-01 23:06:58.133515,0 days 00:00:02.811965,Tanh,16,13,0.009373723073439541,1,100,0.5357164507323312,1.4113692721307349e-05,COMPLETE
90,0.18224962055683136,2023-09-01 23:06:58.133753,2023-09-01 23:07:22.107888,0 days 00:00:23.974135,Sigmoid,2,14,0.005151468984177518,1,100,0.6677463273004853,1.0274842354741283e-05,COMPLETE
91,0.20713160932064056,2023-09-01 23:07:22.108153,2023-09-01 23:07:46.423455,0 days 00:00:24.315302,Sigmoid,2,14,0.015546905513609433,1,100,0.6787907407541272,1.106319898504077e-05,COMPLETE
92,0.20812737941741943,2023-09-01 23:07:46.423698,2023-09-01 23:08:09.151708,0 days 00:00:22.728010,Sigmoid,2,15,0.021675673358944714,1,100,0.6351662690068521,1.6416870978080823e-05,COMPLETE
93,0.20780670642852783,2023-09-01 23:08:09.151957,2023-09-01 23:08:34.833397,0 days 00:00:25.681440,Sigmoid,2,12,0.011602983484349837,1,100,0.7214892827626959,3.4268831593601067e-05,COMPLETE
94,0.1742347627878189,2023-09-01 23:08:34.833654,2023-09-01 23:09:02.471969,0 days 00:00:27.638315,Sigmoid,2,14,0.006660083561744225,1,100,0.7709258799299467,1.0218279656709404e-05,COMPLETE
95,0.2262110412120819,2023-09-01 23:09:02.472218,2023-09-01 23:09:30.062870,0 days 00:00:27.590652,Sigmoid,2,11,0.004716274114418455,1,100,0.7738141608459225,1.1661737785985048e-05,COMPLETE
96,0.2164452075958252,2023-09-01 23:09:30.063120,2023-09-01 23:09:57.489246,0 days 00:00:27.426126,Sigmoid,2,14,0.007376877653001293,1,100,0.7644846539481922,1.0560017499064223e-05,COMPLETE
97,0.19180679321289062,2023-09-01 23:09:57.489493,2023-09-01 23:10:12.063129,0 days 00:00:14.573636,Sigmoid,2,12,0.004943963876789467,1,60,0.6812774092182124,1.5030203501714207e-05,COMPLETE
98,0.1851625293493271,2023-09-01 23:10:12.063372,2023-09-01 23:10:38.279742,0 days 00:00:26.216370,Sigmoid,2,13,0.02591456804019628,1,100,0.7318743008855908,2.511546861714927e-05,COMPLETE
99,0.19401036202907562,2023-09-01 23:10:38.279988,2023-09-01 23:10:59.363795,0 days 00:00:21.083807,Sigmoid,2,13,0.01767503024164757,1,80,0.7339090180393617,2.581441228190053e-05,COMPLETE
100,0.2366267889738083,2023-09-01 23:10:59.364049,2023-09-01 23:11:27.180103,0 days 00:00:27.816054,Sigmoid,2,5,0.04938352813610478,1,100,0.7785964287297993,2.080804912966394e-05,COMPLETE
101,0.19653189182281494,2023-09-01 23:11:27.180357,2023-09-01 23:11:52.622702,0 days 00:00:25.442345,Sigmoid,2,14,0.02635914221476563,1,100,0.7127200002570773,1.5198080959949928e-05,COMPLETE
102,0.18751628696918488,2023-09-01 23:11:52.622964,2023-09-01 23:12:16.664176,0 days 00:00:24.041212,Sigmoid,2,15,0.009027771065460224,1,100,0.6714238546257628,3.17624903691091e-05,COMPLETE
103,0.19038143754005432,2023-09-01 23:12:16.664432,2023-09-01 23:12:45.078867,0 days 00:00:28.414435,Sigmoid,2,16,0.006175100283100836,1,100,0.7964286575694904,4.168993535495458e-05,COMPLETE
104,0.18195044994354248,2023-09-01 23:12:45.079120,2023-09-01 23:13:08.644799,0 days 00:00:23.565679,Sigmoid,2,13,0.01010125663731258,1,100,0.6583112088572958,3.223747776430991e-05,COMPLETE
105,0.22136040031909943,2023-09-01 23:13:08.645053,2023-09-01 23:13:30.721077,0 days 00:00:22.076024,Sigmoid,2,11,0.022670078088709536,1,100,0.6161893533272161,9.461375208170218e-05,COMPLETE
106,0.1791350543498993,2023-09-01 23:13:30.721321,2023-09-01 23:13:34.245890,0 days 00:00:03.524569,Sigmoid,10,13,0.015844246253865695,1,60,0.7380286021594185,5.397562766804079e-05,COMPLETE
107,0.21077272295951843,2023-09-01 23:13:34.246156,2023-09-01 23:13:40.059057,0 days 00:00:05.812901,Sigmoid,10,13,0.03106615171558404,1,100,0.7364043339142718,5.498846436725165e-05,COMPLETE
108,0.2058091014623642,2023-09-01 23:13:40.059304,2023-09-01 23:13:43.657912,0 days 00:00:03.598608,Sigmoid,10,13,0.013529332299929123,1,60,0.7615164848708386,7.200998189702888e-05,COMPLETE
109,0.21999169886112213,2023-09-01 23:13:43.658159,2023-09-01 23:13:45.738726,0 days 00:00:02.080567,Sigmoid,10,12,0.00970908213646985,1,40,0.6554614566958336,5.988086372690886e-05,COMPLETE
110,0.20569512248039246,2023-09-01 23:13:45.738974,2023-09-01 23:13:50.383477,0 days 00:00:04.644503,Sigmoid,10,10,0.0036873635100871764,1,100,0.5902903906792324,8.70433962961863e-05,COMPLETE
111,0.17864833772182465,2023-09-01 23:13:50.383747,2023-09-01 23:14:05.700343,0 days 00:00:15.316596,Sigmoid,2,14,0.016834044454142733,1,60,0.7095954037389129,4.7430066185582e-05,COMPLETE
112,0.2064840942621231,2023-09-01 23:14:05.700596,2023-09-01 23:14:21.176244,0 days 00:00:15.475648,Sigmoid,2,13,0.021206198143776372,1,60,0.7176722370794694,3.891070072486105e-05,COMPLETE
113,0.19929873943328857,2023-09-01 23:14:21.176496,2023-09-01 23:14:37.215778,0 days 00:00:16.039282,Sigmoid,2,12,0.028013912110540943,1,60,0.7444851903572901,4.5300620618756795e-05,COMPLETE
114,0.18729278445243835,2023-09-01 23:14:37.216022,2023-09-01 23:14:52.357727,0 days 00:00:15.141705,Sigmoid,2,14,0.016193154541500457,1,60,0.7024208464336318,2.6116385565170688e-05,COMPLETE
