number,value,datetime_start,datetime_complete,duration,params_activation1,params_batch_size,params_fl1,params_learning_rate,params_n_layers,params_num_epochs,params_train_size,params_weight_decay,state
460,0.21101628243923187,2023-09-02 00:22:03.796519,2023-09-02 00:22:07.164053,0 days 00:00:03.367534,Tanh,10,16,0.003263097160607651,1,100,0.4273683448956989,2.594457195494699e-05,COMPLETE
461,0.209283709526062,2023-09-02 00:22:07.164340,2023-09-02 00:22:30.989760,0 days 00:00:23.825420,Tanh,2,15,0.006610176978005171,1,100,0.6632551677341743,2.231952555132164e-05,COMPLETE
462,0.20292928814888,2023-09-02 00:22:30.990058,2023-09-02 00:22:38.263947,0 days 00:00:07.273889,Tanh,8,15,0.00400677486225621,1,100,0.7560821080989982,1.5849019541415642e-05,COMPLETE
463,0.21031290292739868,2023-09-02 00:22:38.264236,2023-09-02 00:23:03.588380,0 days 00:00:25.324144,Tanh,2,16,0.00553316076387104,1,100,0.7055981631510924,0.00039170586311039387,COMPLETE
464,0.2029096782207489,2023-09-02 00:23:03.588673,2023-09-02 00:23:09.437163,0 days 00:00:05.848490,Leaky,10,15,0.00217600997789069,1,100,0.7471538585281013,1.3194010454795484e-05,COMPLETE
465,0.3433438539505005,2023-09-02 00:23:09.437448,2023-09-02 00:23:34.174361,0 days 00:00:24.736913,Tanh,2,19,1.7760314382823203e-05,1,100,0.6898917338575586,1.9211953775300874e-05,COMPLETE
466,0.23682855069637299,2023-09-02 00:23:34.174652,2023-09-02 00:24:00.086307,0 days 00:00:25.911655,Tanh,2,16,0.008053222313994388,1,100,0.7220339869239951,2.9547278545338023e-05,COMPLETE
467,0.24006864428520203,2023-09-02 00:24:00.086643,2023-09-02 00:24:01.786668,0 days 00:00:01.700025,Tanh,8,19,0.004522035569821071,1,60,0.2898210073620509,0.0006311865389667934,COMPLETE
468,0.22624626755714417,2023-09-02 00:24:01.786947,2023-09-02 00:24:13.857853,0 days 00:00:12.070906,Tanh,2,16,0.002590868831884123,1,100,0.3361049869892659,1.1661872526135004e-05,COMPLETE
469,0.23638956248760223,2023-09-02 00:24:13.858147,2023-09-02 00:24:17.474640,0 days 00:00:03.616493,Tanh,10,15,0.006712761113421948,1,60,0.7650679072675443,1.4345724859371144e-05,COMPLETE
470,0.21836595237255096,2023-09-02 00:24:17.474926,2023-09-02 00:24:36.179755,0 days 00:00:18.704829,Sigmoid,2,15,0.009586082996093924,1,80,0.6491539510139936,0.0007340136420060663,COMPLETE
471,0.19666603207588196,2023-09-02 00:24:36.180054,2023-09-02 00:24:43.074388,0 days 00:00:06.894334,Tanh,8,9,0.005323745125470387,1,100,0.7223502477457606,2.152854273466598e-05,COMPLETE
472,0.3847982883453369,2023-09-02 00:24:43.074677,2023-09-02 00:25:04.929769,0 days 00:00:21.855092,Tanh,2,18,0.09023208185238946,1,100,0.6078511875207493,0.0009226650183246426,COMPLETE
473,0.4757258892059326,2023-09-02 00:25:04.930081,2023-09-02 00:25:08.552181,0 days 00:00:03.622100,Sigmoid,10,17,3.096733283109541e-05,1,60,0.7647034835154506,0.00022423314006140936,COMPLETE
474,0.23956485092639923,2023-09-02 00:25:08.552467,2023-09-02 00:25:19.611271,0 days 00:00:11.058804,Tanh,2,19,0.008053517144688643,1,100,0.30552999559399174,3.616031921689267e-05,COMPLETE
475,0.2017049342393875,2023-09-02 00:25:19.611563,2023-09-02 00:25:44.375603,0 days 00:00:24.764040,ReLU,2,16,0.0036043911722269993,1,100,0.6894354439901175,1.689388256585324e-05,COMPLETE
476,0.18657559156417847,2023-09-02 00:25:44.375915,2023-09-02 00:25:48.696135,0 days 00:00:04.320220,Tanh,8,14,0.001942214371382202,1,60,0.7446855440449669,1.0279354694570174e-05,COMPLETE
477,0.16191698610782623,2023-09-02 00:25:48.696426,2023-09-02 00:26:12.781268,0 days 00:00:24.084842,Sigmoid,2,15,0.005987278447819037,1,100,0.6690424356025907,1.2494636250555223e-05,COMPLETE
478,0.2023247480392456,2023-09-02 00:26:12.781576,2023-09-02 00:26:32.299171,0 days 00:00:19.517595,Tanh,2,15,0.005775609735522609,1,100,0.5444405210755947,1.237914623878451e-05,COMPLETE
479,0.18545635044574738,2023-09-02 00:26:32.299470,2023-09-02 00:26:56.289282,0 days 00:00:23.989812,Sigmoid,2,16,0.006486082240886504,1,100,0.6681613565400609,1.412623546636517e-05,COMPLETE
480,0.19652174413204193,2023-09-02 00:26:56.289584,2023-09-02 00:27:19.020084,0 days 00:00:22.730500,Tanh,2,15,0.004569018796044179,1,100,0.6319357894940257,1.0176069920523858e-05,COMPLETE
481,0.21693481504917145,2023-09-02 00:27:19.020398,2023-09-02 00:27:33.365187,0 days 00:00:14.344789,Tanh,2,15,0.007269515779960695,1,100,0.3993834103360448,1.226507583001281e-05,COMPLETE
482,0.18496277928352356,2023-09-02 00:27:33.365477,2023-09-02 00:27:57.415803,0 days 00:00:24.050326,Sigmoid,2,16,0.005208232206585578,1,100,0.6703861824185298,1.7093388705914892e-05,COMPLETE
483,0.20187373459339142,2023-09-02 00:27:57.416106,2023-09-02 00:28:16.349774,0 days 00:00:18.933668,Tanh,2,20,0.008720913491935506,1,100,0.5284906178014732,2.4371583222036788e-05,COMPLETE
484,0.22307530045509338,2023-09-02 00:28:16.350064,2023-09-02 00:28:41.853243,0 days 00:00:25.503179,Leaky,2,15,0.0031729446060845125,1,100,0.7084167229783147,1.524763707830316e-05,COMPLETE
485,0.18445876240730286,2023-09-02 00:28:41.853550,2023-09-02 00:29:09.396090,0 days 00:00:27.542540,Sigmoid,2,17,0.0060692616828342625,1,100,0.7703189375235147,1.9990728060452187e-05,COMPLETE
486,0.18447184562683105,2023-09-02 00:29:09.396380,2023-09-02 00:29:14.240732,0 days 00:00:04.844352,Tanh,12,18,0.004209288546366698,1,100,0.7223665125876448,0.00014999757570764849,COMPLETE
487,0.27390214800834656,2023-09-02 00:29:14.241019,2023-09-02 00:29:16.056286,0 days 00:00:01.815267,Tanh,2,15,0.010528270254941229,1,40,0.12502723109404562,1.1864959909063218e-05,COMPLETE
488,0.18364264070987701,2023-09-02 00:29:16.056580,2023-09-02 00:29:22.580249,0 days 00:00:06.523669,Sigmoid,8,14,0.007373767343667303,1,100,0.6799391977184664,1.3869569207417202e-05,COMPLETE
489,0.2612761855125427,2023-09-02 00:29:22.580536,2023-09-02 00:29:33.105217,0 days 00:00:10.524681,Tanh,2,8,0.0054568320012154895,1,100,0.2954734550179726,0.00010931020126193654,COMPLETE
490,0.224441796541214,2023-09-02 00:29:33.105500,2023-09-02 00:29:49.963431,0 days 00:00:16.857931,Tanh,2,16,0.002654337341109237,1,100,0.4717913286922038,0.004555743393878399,COMPLETE
491,0.2559753656387329,2023-09-02 00:29:49.963727,2023-09-02 00:29:57.680230,0 days 00:00:07.716503,Sigmoid,2,18,0.004220143674906277,1,100,0.21537784000131216,1.8099003896586915e-05,COMPLETE
492,0.24559712409973145,2023-09-02 00:29:57.680526,2023-09-02 00:30:00.219514,0 days 00:00:02.538988,Tanh,8,16,0.008338508455333637,1,100,0.261853780931521,0.0002915456794756052,COMPLETE
493,0.2984224557876587,2023-09-02 00:30:00.219803,2023-09-02 00:30:21.556466,0 days 00:00:21.336663,Tanh,2,17,0.0001458066602265468,1,100,0.5968206811985335,0.006802256382968237,COMPLETE
494,0.20202289521694183,2023-09-02 00:30:21.556771,2023-09-02 00:30:23.542820,0 days 00:00:01.986049,Sigmoid,16,19,0.006558972923379928,1,100,0.37644399465892847,1.151605260515312e-05,COMPLETE
495,0.17638620734214783,2023-09-02 00:30:23.543110,2023-09-02 00:30:51.215059,0 days 00:00:27.671949,Tanh,2,14,0.010880546441364852,1,100,0.7714468030566966,0.00019348881369129692,COMPLETE
496,0.23304630815982819,2023-09-02 00:30:51.215360,2023-09-02 00:31:18.855367,0 days 00:00:27.640007,Tanh,2,14,0.010825475128631844,1,100,0.7705214404544848,0.00017873477500641793,COMPLETE
497,0.22973135113716125,2023-09-02 00:31:18.855683,2023-09-02 00:31:46.660392,0 days 00:00:27.804709,Tanh,2,14,0.003499685026924365,1,100,0.7750074184710612,0.00014166339389060548,COMPLETE
498,0.33558189868927,2023-09-02 00:31:46.660703,2023-09-02 00:32:13.364745,0 days 00:00:26.704042,Sigmoid,2,14,0.00014446786365892217,1,100,0.7438617083162083,0.0001293488999561065,COMPLETE
499,0.21193477511405945,2023-09-02 00:32:13.365048,2023-09-02 00:32:36.265053,0 days 00:00:22.900005,Tanh,2,14,0.011259922879909906,1,80,0.7942519833231747,0.0011426286252762053,COMPLETE
