number,value,datetime_start,datetime_complete,duration,params_activation1,params_batch_size,params_fl1,params_learning_rate,params_n_layers,params_num_epochs,params_train_size,params_weight_decay,state
345,0.20871786773204803,2023-09-02 00:00:33.694165,2023-09-02 00:00:36.623605,0 days 00:00:02.929440,Tanh,10,17,0.007753979038799234,1,80,0.46307206700185843,1.526531067442594e-05,COMPLETE
346,0.21115975081920624,2023-09-02 00:00:36.623880,2023-09-02 00:00:42.524703,0 days 00:00:05.900823,Tanh,10,18,0.05185393621538228,1,100,0.7516302199200726,1.900566434553413e-05,COMPLETE
347,0.1963670253753662,2023-09-02 00:00:42.524972,2023-09-02 00:00:48.218693,0 days 00:00:05.693721,Tanh,10,19,0.00591631090886522,1,100,0.7247353956884154,2.202083755640857e-05,COMPLETE
348,0.19533801078796387,2023-09-02 00:00:48.218962,2023-09-02 00:00:54.257597,0 days 00:00:06.038635,Tanh,10,18,0.0015088682464848568,1,100,0.7665658638960857,5.825628548829628e-05,COMPLETE
349,0.2105647176504135,2023-09-02 00:00:54.257874,2023-09-02 00:01:00.508315,0 days 00:00:06.250441,Tanh,10,19,0.0007268550452359364,1,100,0.7978112176677776,1.7669793054011594e-05,COMPLETE
350,0.22124828398227692,2023-09-02 00:01:00.508582,2023-09-02 00:01:03.582634,0 days 00:00:03.074052,Tanh,10,18,0.010455504673539728,1,100,0.3889767454770948,2.114852658094714e-05,COMPLETE
351,0.2349293977022171,2023-09-02 00:01:03.582904,2023-09-02 00:01:07.527459,0 days 00:00:03.944555,Tanh,10,18,0.008267499633831202,1,100,0.5010495250157389,3.725851841004389e-05,COMPLETE
352,0.21035338938236237,2023-09-02 00:01:07.527728,2023-09-02 00:01:13.340349,0 days 00:00:05.812621,ReLU,10,18,0.002311467544457411,1,100,0.7411961838640546,5.429510624460258e-05,COMPLETE
353,0.21270844340324402,2023-09-02 00:01:13.340628,2023-09-02 00:01:15.584544,0 days 00:00:02.243916,Tanh,10,19,0.00348190448702686,1,40,0.7107045249715789,1.4370372892576148e-05,COMPLETE
354,0.21190139651298523,2023-09-02 00:01:15.584815,2023-09-02 00:01:18.409670,0 days 00:00:02.824855,Tanh,8,19,0.00646262534853969,1,100,0.2904859904836398,6.358003211181809e-05,COMPLETE
355,0.21282772719860077,2023-09-02 00:01:18.409938,2023-09-02 00:01:22.564460,0 days 00:00:04.154522,Tanh,8,18,0.010572485372082392,1,100,0.4305763455880924,2.9435375684175834e-05,COMPLETE
356,0.20630794763565063,2023-09-02 00:01:22.564739,2023-09-02 00:01:24.970950,0 days 00:00:02.406211,Tanh,30,18,0.008960550428724484,1,100,0.7654270460257029,1.794135910292293e-05,COMPLETE
357,0.18673968315124512,2023-09-02 00:01:24.971227,2023-09-02 00:01:29.342415,0 days 00:00:04.371188,Leaky,10,18,0.0013380475960129154,1,80,0.6953688378468865,4.803265215469198e-05,COMPLETE
358,0.21806935966014862,2023-09-02 00:01:29.342687,2023-09-02 00:01:32.700405,0 days 00:00:03.357718,Tanh,8,19,0.0043530468159370134,1,100,0.34784781192006325,0.0007557954011645465,COMPLETE
359,0.337025910615921,2023-09-02 00:01:32.700677,2023-09-02 00:01:38.476443,0 days 00:00:05.775766,Tanh,10,21,0.0001191042448777388,1,100,0.736580410793964,0.005279015264159609,COMPLETE
360,0.29461294412612915,2023-09-02 00:01:38.476711,2023-09-02 00:01:40.145193,0 days 00:00:01.668482,Tanh,8,20,0.011721872998359188,1,100,0.16905715830915705,2.3751509585344306e-05,COMPLETE
361,0.22138138115406036,2023-09-02 00:01:40.145464,2023-09-02 00:01:45.452307,0 days 00:00:05.306843,Tanh,12,17,0.006858610226110485,1,100,0.7986656692199178,4.009570338781975e-05,COMPLETE
362,0.21386189758777618,2023-09-02 00:01:45.452578,2023-09-02 00:02:12.837182,0 days 00:00:27.384604,Tanh,2,11,0.005513147937528978,1,100,0.7630612275634001,1.5027903397422623e-05,COMPLETE
363,0.1988672912120819,2023-09-02 00:02:12.837473,2023-09-02 00:02:13.761305,0 days 00:00:00.923832,Tanh,30,16,0.008893781460856258,1,40,0.7206173776312849,1.3254663764435906e-05,COMPLETE
364,0.20578716695308685,2023-09-02 00:02:13.761575,2023-09-02 00:02:17.341114,0 days 00:00:03.579539,Tanh,16,18,0.007462176670998776,1,100,0.6826604960658215,5.2079295782714436e-05,COMPLETE
365,0.17979727685451508,2023-09-02 00:02:17.341399,2023-09-02 00:02:44.823848,0 days 00:00:27.482449,Tanh,2,17,0.001735769294858338,1,100,0.770225991394349,6.569047782298473e-05,COMPLETE
366,0.20994313061237335,2023-09-02 00:02:44.824167,2023-09-02 00:03:10.169730,0 days 00:00:25.345563,Tanh,2,17,0.002035646862165398,1,100,0.7085949012270005,1.7760169863019385e-05,COMPLETE
367,0.19847999513149261,2023-09-02 00:03:10.170013,2023-09-02 00:03:36.915668,0 days 00:00:26.745655,Tanh,2,17,0.002694856641599677,1,100,0.7468916752749154,0.00030643826429081696,COMPLETE
368,0.18949568271636963,2023-09-02 00:03:36.915944,2023-09-02 00:04:01.446055,0 days 00:00:24.530111,Tanh,2,17,0.0037487139359527605,1,100,0.6843071277621371,1.016111640852839e-05,COMPLETE
369,0.2938818037509918,2023-09-02 00:04:01.446355,2023-09-02 00:04:06.248556,0 days 00:00:04.802201,Tanh,2,19,0.0019818832276471596,1,100,0.1340576151895699,7.85970437017475e-05,COMPLETE
370,0.24947932362556458,2023-09-02 00:04:06.248828,2023-09-02 00:04:13.375629,0 days 00:00:07.126801,Tanh,2,16,0.005330458760747103,1,100,0.19925161916487813,6.65423574700892e-05,COMPLETE
371,0.2166711390018463,2023-09-02 00:04:13.375906,2023-09-02 00:04:22.502388,0 days 00:00:09.126482,Tanh,2,18,0.004313384797453579,1,100,0.25451958162398264,6.666807767218388e-05,COMPLETE
372,0.20887376368045807,2023-09-02 00:04:22.502669,2023-09-02 00:04:42.157874,0 days 00:00:19.655205,ReLU,2,18,0.0028409390704977966,1,100,0.5491136308649786,1.2907752460900226e-05,COMPLETE
373,0.32145193219184875,2023-09-02 00:04:42.158155,2023-09-02 00:04:49.485645,0 days 00:00:07.327490,Tanh,8,2,0.003319947195388521,1,100,0.7701006785967868,1.0005843793701208e-05,COMPLETE
374,0.23445197939872742,2023-09-02 00:04:49.485912,2023-09-02 00:05:01.944229,0 days 00:00:12.458317,Tanh,2,17,0.011579264680685463,1,100,0.3479638017907177,2.120972733226188e-05,COMPLETE
375,0.21376824378967285,2023-09-02 00:05:01.944519,2023-09-02 00:05:28.356178,0 days 00:00:26.411659,Tanh,2,17,0.0016294700415213287,1,100,0.7389811932278051,5.565954664209706e-05,COMPLETE
376,0.22939634323120117,2023-09-02 00:05:28.356457,2023-09-02 00:05:32.457372,0 days 00:00:04.100915,Tanh,10,18,0.002368963050203851,1,100,0.5176227746684015,3.3631083862222604e-05,COMPLETE
377,0.20385749638080597,2023-09-02 00:05:32.457650,2023-09-02 00:05:39.391468,0 days 00:00:06.933818,Tanh,8,16,0.006656561161850683,1,100,0.7207690801155566,2.796986611217342e-05,COMPLETE
378,0.2027820199728012,2023-09-02 00:05:39.391744,2023-09-02 00:05:58.440195,0 days 00:00:19.048451,Leaky,2,19,0.001681236781150383,1,80,0.6658329066817716,8.187531671809477e-05,COMPLETE
379,0.17992062866687775,2023-09-02 00:05:58.440481,2023-09-02 00:06:27.154867,0 days 00:00:28.714386,Tanh,2,12,0.013793993738287587,1,100,0.798953677630641,1.3343949655561102e-05,COMPLETE
380,0.20149832963943481,2023-09-02 00:06:27.155197,2023-09-02 00:06:54.851318,0 days 00:00:27.696121,Tanh,2,12,0.013162655858120395,1,100,0.7699916997535523,1.628457312521469e-05,COMPLETE
381,0.19878533482551575,2023-09-02 00:06:54.851608,2023-09-02 00:07:23.438823,0 days 00:00:28.587215,Tanh,2,12,0.000705105380879741,1,100,0.7965093513743452,1.3344535423573894e-05,COMPLETE
382,0.21156449615955353,2023-09-02 00:07:23.439123,2023-09-02 00:07:30.824031,0 days 00:00:07.384908,Tanh,8,16,0.012951260287316513,1,100,0.7680211732244934,1.2614856641281375e-05,COMPLETE
383,0.18100635707378387,2023-09-02 00:07:30.824320,2023-09-02 00:07:57.427701,0 days 00:00:26.603381,Tanh,2,17,0.0011121363191810133,1,100,0.7394146561313826,1.6162237810736834e-05,COMPLETE
384,0.21587221324443817,2023-09-02 00:07:57.427983,2023-09-02 00:08:24.112420,0 days 00:00:26.684437,Tanh,2,17,0.0010455173047512834,1,100,0.7431566557734676,1.4922542131052646e-05,COMPLETE
385,0.21059660613536835,2023-09-02 00:08:24.112716,2023-09-02 00:08:51.601286,0 days 00:00:27.488570,Tanh,2,18,0.0005080468811592126,1,100,0.7648717294107279,1.7561088513624615e-05,COMPLETE
386,0.1870337724685669,2023-09-02 00:08:51.601574,2023-09-02 00:09:20.411640,0 days 00:00:28.810066,Tanh,2,17,0.005814578779545325,1,100,0.7973568854096753,1.8444809049720225e-05,COMPLETE
387,0.2612888813018799,2023-09-02 00:09:20.411926,2023-09-02 00:09:46.334074,0 days 00:00:25.922148,Tanh,2,5,0.0009015890757235368,1,100,0.7257840177389352,1.2229086469160178e-05,COMPLETE
388,0.3074888586997986,2023-09-02 00:09:46.334379,2023-09-02 00:10:11.672106,0 days 00:00:25.337727,Tanh,2,17,4.5544523416653366e-05,1,100,0.7088397886000795,1.0021113719463365e-05,COMPLETE
389,0.20092958211898804,2023-09-02 00:10:11.672415,2023-09-02 00:10:38.289409,0 days 00:00:26.616994,Tanh,2,19,0.0007769656284787416,1,100,0.7445040688700647,1.509366628771098e-05,COMPLETE
390,0.17536000907421112,2023-09-02 00:10:38.289688,2023-09-02 00:10:44.360040,0 days 00:00:06.070352,Tanh,10,18,0.004631660067463014,1,100,0.7714840267437917,0.00010020247475889467,COMPLETE
391,0.17651242017745972,2023-09-02 00:10:44.360321,2023-09-02 00:10:50.434941,0 days 00:00:06.074620,Tanh,10,11,0.004618393146227733,1,100,0.774020674467519,0.00010309679480489436,COMPLETE
392,0.20662982761859894,2023-09-02 00:10:50.435219,2023-09-02 00:10:54.241028,0 days 00:00:03.805809,Tanh,10,11,0.0046065495656072535,1,100,0.4812802882913452,0.0001005755665807054,COMPLETE
393,0.19410409033298492,2023-09-02 00:10:54.241309,2023-09-02 00:11:00.343366,0 days 00:00:06.102057,Tanh,10,12,0.004027384702430504,1,100,0.7720126454073157,0.00011808196073283303,COMPLETE
394,0.20316444337368011,2023-09-02 00:11:00.343649,2023-09-02 00:11:06.643280,0 days 00:00:06.299631,Tanh,10,18,0.0013703423683053715,1,100,0.7978220781750971,8.995050122157513e-05,COMPLETE
395,0.19862167537212372,2023-09-02 00:11:06.643569,2023-09-02 00:11:12.735077,0 days 00:00:06.091508,Tanh,10,10,0.004661436235970468,1,100,0.7722055302249337,0.0001032974491245032,COMPLETE
396,0.21245139837265015,2023-09-02 00:11:12.735355,2023-09-02 00:11:19.009503,0 days 00:00:06.274148,Tanh,10,11,0.003474959877382421,1,100,0.7982214891181613,7.341965578831575e-05,COMPLETE
397,0.22428444027900696,2023-09-02 00:11:19.009784,2023-09-02 00:11:24.979505,0 days 00:00:05.969721,Tanh,10,10,0.0054099675483794425,1,100,0.7571313287443846,0.00012435306281326415,COMPLETE
398,0.23537501692771912,2023-09-02 00:11:24.979781,2023-09-02 00:11:27.331377,0 days 00:00:02.351596,Tanh,10,19,0.0039549449911324835,1,40,0.7423877370560343,9.055533499829312e-05,COMPLETE
399,0.19559118151664734,2023-09-02 00:11:27.331662,2023-09-02 00:11:33.412954,0 days 00:00:06.081292,Tanh,10,11,0.002885243280893333,1,100,0.7717397701125829,0.0001595877030878745,COMPLETE
400,0.18256895244121552,2023-09-02 00:11:33.413235,2023-09-02 00:11:39.083959,0 days 00:00:05.670724,Tanh,10,11,0.005453515726359593,1,100,0.7194991637430842,7.733266342966407e-05,COMPLETE
401,0.19101014733314514,2023-09-02 00:11:39.084252,2023-09-02 00:11:45.387266,0 days 00:00:06.303014,ReLU,10,18,0.006857107015560197,1,100,0.7974854168885173,0.00014199795688311023,COMPLETE
402,0.22409385442733765,2023-09-02 00:11:45.387544,2023-09-02 00:11:48.084508,0 days 00:00:02.696964,Tanh,10,10,0.004866935959884675,1,100,0.3403108092788811,6.390393635766233e-05,COMPLETE
403,0.21526403725147247,2023-09-02 00:11:48.084803,2023-09-02 00:11:54.002628,0 days 00:00:05.917825,Tanh,10,12,0.0012757096773903529,1,100,0.7477841639031731,0.00010524904409796427,COMPLETE
404,0.22793039679527283,2023-09-02 00:11:54.002909,2023-09-02 00:11:57.885135,0 days 00:00:03.882226,Tanh,8,18,0.0031525475330625836,1,100,0.40130352496632565,7.604341930106416e-05,COMPLETE
405,0.20343591272830963,2023-09-02 00:11:57.885442,2023-09-02 00:12:01.545700,0 days 00:00:03.660258,Tanh,10,18,0.0064090207787328955,1,100,0.4616484016327839,5.884712180059656e-05,COMPLETE
406,0.22845305502414703,2023-09-02 00:12:01.545980,2023-09-02 00:12:04.693733,0 days 00:00:03.147753,Leaky,8,19,0.008116154681872647,1,100,0.32348495277949857,0.0004660586258162931,COMPLETE
407,0.2056213915348053,2023-09-02 00:12:04.694014,2023-09-02 00:12:08.442558,0 days 00:00:03.748544,Tanh,16,18,0.0041007143343454065,1,100,0.7161936418358398,0.00013312961023347804,COMPLETE
408,0.23062343895435333,2023-09-02 00:12:08.442838,2023-09-02 00:12:11.396841,0 days 00:00:02.954003,Tanh,12,13,0.005732391396381443,1,100,0.4392326407274406,0.0001960483674165131,COMPLETE
409,0.32303503155708313,2023-09-02 00:12:11.397119,2023-09-02 00:12:14.458481,0 days 00:00:03.061362,Tanh,10,12,0.0002746525237257371,1,100,0.38574516999133734,1.2038002867111968e-05,COMPLETE
410,0.22759318351745605,2023-09-02 00:12:14.458765,2023-09-02 00:12:20.415335,0 days 00:00:05.956570,Tanh,8,11,0.007779822356894782,1,80,0.7704224870565476,9.165899825662406e-05,COMPLETE
411,0.18893709778785706,2023-09-02 00:12:20.415617,2023-09-02 00:12:25.837354,0 days 00:00:05.421737,Tanh,8,19,0.009666464050273415,1,100,0.5628935933406288,6.473965400341652e-05,COMPLETE
412,0.21027551591396332,2023-09-02 00:12:25.837641,2023-09-02 00:12:32.135442,0 days 00:00:06.297801,Tanh,10,17,0.01801311883419241,1,100,0.7999348427767078,0.00011192565462773242,COMPLETE
413,0.21743066608905792,2023-09-02 00:12:32.135728,2023-09-02 00:12:35.757324,0 days 00:00:03.621596,Tanh,8,18,0.0017083068560024828,1,100,0.3742059311168042,5.097867036477021e-05,COMPLETE
414,0.20191329717636108,2023-09-02 00:12:35.757609,2023-09-02 00:12:41.288943,0 days 00:00:05.531334,Tanh,10,13,0.06838927452020699,1,100,0.7049619130329909,1.0147023440687403e-05,COMPLETE
415,0.19393889605998993,2023-09-02 00:12:41.289224,2023-09-02 00:12:51.928329,0 days 00:00:10.639105,Tanh,2,20,0.004650041873695269,1,40,0.7391674061636239,1.3778011115332778e-05,COMPLETE
416,0.20602521300315857,2023-09-02 00:12:51.928609,2023-09-02 00:13:19.222061,0 days 00:00:27.293452,Tanh,2,17,0.006248264041390408,1,100,0.759553032990365,0.0001745070143832866,COMPLETE
417,0.20858065783977509,2023-09-02 00:13:19.222345,2023-09-02 00:13:25.963035,0 days 00:00:06.740690,ReLU,8,18,0.003582259003715517,1,100,0.6958274119883533,1.2332283238295138e-05,COMPLETE
418,0.23333226144313812,2023-09-02 00:13:25.963313,2023-09-02 00:13:28.376724,0 days 00:00:02.413411,Tanh,10,12,0.0023567365646250146,1,100,0.304305337606966,4.5456385939713544e-05,COMPLETE
419,0.21088293194770813,2023-09-02 00:13:28.377009,2023-09-02 00:13:54.487161,0 days 00:00:26.110152,Tanh,2,16,0.0081838484905516,1,100,0.7281413285874134,7.782827721738109e-05,COMPLETE
420,0.2825580835342407,2023-09-02 00:13:54.487463,2023-09-02 00:14:22.190035,0 days 00:00:27.702572,Tanh,2,13,0.006753326462200935,1,100,0.7710015877877996,0.013628435033852677,COMPLETE
421,0.2369159311056137,2023-09-02 00:14:22.190336,2023-09-02 00:14:29.393706,0 days 00:00:07.203370,Tanh,8,18,0.009759995610415505,1,100,0.7469107116771329,0.0018314801796894375,COMPLETE
422,0.22882196307182312,2023-09-02 00:14:29.393979,2023-09-02 00:14:38.660338,0 days 00:00:09.266359,Leaky,2,17,0.0050684983635659086,1,100,0.25861277988912007,0.00025680444903574697,COMPLETE
423,0.3925754427909851,2023-09-02 00:14:38.660615,2023-09-02 00:14:41.191539,0 days 00:00:02.530924,Tanh,10,19,1.2026860300087284e-05,1,80,0.39788992334521733,0.00036629169239578343,COMPLETE
424,0.2066129893064499,2023-09-02 00:14:41.191825,2023-09-02 00:15:06.041270,0 days 00:00:24.849445,Tanh,2,13,0.016429262120533014,1,100,0.6926810705522665,5.9956384942874336e-05,COMPLETE
425,0.18631574511528015,2023-09-02 00:15:06.041570,2023-09-02 00:15:11.158455,0 days 00:00:05.116885,Tanh,12,16,0.01105352107823126,1,100,0.7710905388214031,9.732687427994557e-05,COMPLETE
426,0.21572522819042206,2023-09-02 00:15:11.158733,2023-09-02 00:15:28.745304,0 days 00:00:17.586571,Tanh,2,23,0.00767623361917861,1,100,0.4886781841920694,1.2083609943275487e-05,COMPLETE
427,0.2194603979587555,2023-09-02 00:15:28.745588,2023-09-02 00:15:33.795024,0 days 00:00:05.049436,Tanh,8,20,0.0006008971986823303,1,100,0.5209476873064972,7.137169774144815e-05,COMPLETE
428,0.19097812473773956,2023-09-02 00:15:33.795299,2023-09-02 00:15:59.589640,0 days 00:00:25.794341,Tanh,2,12,0.005598549181108192,1,100,0.7195744922879771,5.062493063925e-05,COMPLETE
429,0.2095276564359665,2023-09-02 00:15:59.589943,2023-09-02 00:16:03.603368,0 days 00:00:04.013425,Tanh,16,18,0.014224705687915165,1,100,0.7727888708109403,0.0006932287609419739,COMPLETE
430,0.19536520540714264,2023-09-02 00:16:03.603647,2023-09-02 00:16:09.873489,0 days 00:00:06.269842,Tanh,10,17,0.004074791815453134,1,100,0.7976877913313992,1.919801525163035e-05,COMPLETE
431,0.18923237919807434,2023-09-02 00:16:09.873780,2023-09-02 00:16:20.472967,0 days 00:00:10.599187,Tanh,2,13,0.0012641869859059014,1,40,0.7372501529504866,0.00015576710628287154,COMPLETE
432,0.21961960196495056,2023-09-02 00:16:20.473264,2023-09-02 00:16:45.812518,0 days 00:00:25.339254,ReLU,2,16,0.0025915017012386444,1,100,0.7051202390918648,1.0134968934479612e-05,COMPLETE
433,0.23686951398849487,2023-09-02 00:16:45.812808,2023-09-02 00:16:48.191237,0 days 00:00:02.378429,Tanh,8,10,0.009581902559265266,1,100,0.24498753290091801,0.0002745307894243523,COMPLETE
434,0.33237123489379883,2023-09-02 00:16:48.191521,2023-09-02 00:16:51.453511,0 days 00:00:03.261990,Tanh,2,14,0.07670197055786095,1,60,0.15147613794632334,1.4552977650125952e-05,COMPLETE
435,0.23643635213375092,2023-09-02 00:16:51.453801,2023-09-02 00:16:57.281799,0 days 00:00:05.827998,Tanh,10,9,0.006931254037666211,1,100,0.7469704510517605,2.385326415978689e-05,COMPLETE
436,0.252763032913208,2023-09-02 00:16:57.282087,2023-09-02 00:17:07.078591,0 days 00:00:09.796504,Tanh,2,19,0.000431376184774571,1,100,0.27369090372648036,0.00011730331371642591,COMPLETE
437,0.21658100187778473,2023-09-02 00:17:07.078871,2023-09-02 00:17:11.689892,0 days 00:00:04.611021,Tanh,8,14,0.0008767150860464423,1,60,0.7992819949812145,8.51315238072412e-05,COMPLETE
438,0.26209163665771484,2023-09-02 00:17:11.690174,2023-09-02 00:17:18.209324,0 days 00:00:06.519150,Leaky,2,18,0.012730572551321108,1,100,0.1820170945590977,0.0030935851738716795,COMPLETE
439,0.2276086062192917,2023-09-02 00:17:18.209607,2023-09-02 00:17:21.400217,0 days 00:00:03.190610,Tanh,10,16,0.017279806492848777,1,60,0.6754049728421496,4.156443467053091e-05,COMPLETE
440,0.220261350274086,2023-09-02 00:17:21.400496,2023-09-02 00:17:32.901161,0 days 00:00:11.500665,Tanh,2,12,0.003163477848523894,1,100,0.3212027358651285,5.413062138287582e-05,COMPLETE
441,0.17666824162006378,2023-09-02 00:17:32.901450,2023-09-02 00:17:53.368181,0 days 00:00:20.466731,Tanh,2,17,0.004610406766958156,1,100,0.5724307480565656,1.4284737082788087e-05,COMPLETE
442,0.21110226213932037,2023-09-02 00:17:53.368490,2023-09-02 00:17:58.735855,0 days 00:00:05.367365,Tanh,8,17,0.0047320333857359025,1,100,0.5564669403366095,1.5167131563655524e-05,COMPLETE
443,0.19331930577754974,2023-09-02 00:17:58.736146,2023-09-02 00:18:26.062463,0 days 00:00:27.326317,Tanh,2,17,0.0037638812713211988,1,100,0.7683811527033042,1.1975732310686092e-05,COMPLETE
444,0.19107525050640106,2023-09-02 00:18:26.062752,2023-09-02 00:18:31.759280,0 days 00:00:05.696528,Tanh,10,17,0.005404519509855647,1,100,0.7287061926371647,1.7142825629950017e-05,COMPLETE
445,0.2259751260280609,2023-09-02 00:18:31.759565,2023-09-02 00:19:00.130884,0 days 00:00:28.371319,Tanh,2,18,0.006093801274117083,1,100,0.7992679323112641,0.001230441154662251,COMPLETE
446,0.1787092238664627,2023-09-02 00:19:00.131162,2023-09-02 00:19:25.548021,0 days 00:00:25.416859,Tanh,2,16,0.004784470531762893,1,100,0.7104886760431909,1.3213371618994826e-05,COMPLETE
447,0.20410458743572235,2023-09-02 00:19:25.548324,2023-09-02 00:19:32.210963,0 days 00:00:06.662639,Tanh,8,16,0.004556988220796966,1,100,0.6936673005342341,1.9259777799094635e-05,COMPLETE
448,0.2082369178533554,2023-09-02 00:19:32.211246,2023-09-02 00:19:52.744676,0 days 00:00:20.533430,Tanh,2,16,0.0033886452080359782,1,100,0.5746574812845959,0.0009261890848946212,COMPLETE
449,0.19660381972789764,2023-09-02 00:19:52.744972,2023-09-02 00:19:57.517552,0 days 00:00:04.772580,Tanh,10,16,0.004172390775727822,1,100,0.6104963597233736,1.1654189296030969e-05,COMPLETE
450,0.20860759913921356,2023-09-02 00:19:57.517846,2023-09-02 00:20:22.995824,0 days 00:00:25.477978,Tanh,2,17,0.005611062660210232,1,100,0.7106228696103163,2.156433030033101e-05,COMPLETE
451,0.21100609004497528,2023-09-02 00:20:22.996114,2023-09-02 00:20:29.438154,0 days 00:00:06.442040,Tanh,8,16,0.007317614566971664,1,100,0.6705685922884015,1.5368130873067465e-05,COMPLETE
452,0.21218743920326233,2023-09-02 00:20:29.438444,2023-09-02 00:20:32.570042,0 days 00:00:03.131598,Tanh,12,17,0.004820445168419356,1,80,0.5867532859289815,1.0175988217166093e-05,COMPLETE
453,0.21288813650608063,2023-09-02 00:20:32.570328,2023-09-02 00:20:45.747477,0 days 00:00:13.177149,Tanh,2,18,0.0029148354644480154,1,100,0.36732540492618226,1.3558277437374347e-05,COMPLETE
454,0.21888013184070587,2023-09-02 00:20:45.747760,2023-09-02 00:20:49.309677,0 days 00:00:03.561917,Tanh,10,17,0.006221143604853884,1,100,0.4526727478734838,9.643072059678938e-05,COMPLETE
455,0.2139846682548523,2023-09-02 00:20:49.309965,2023-09-02 00:21:15.557848,0 days 00:00:26.247883,Tanh,2,9,0.0038045084612192675,1,100,0.7334541439256891,0.0005396192619817913,COMPLETE
456,0.19571374356746674,2023-09-02 00:21:15.558151,2023-09-02 00:21:19.150708,0 days 00:00:03.592557,Tanh,16,17,0.0011196855210324052,1,100,0.6905635402271855,0.00012814045006797264,COMPLETE
457,0.2163117378950119,2023-09-02 00:21:19.150990,2023-09-02 00:21:29.810041,0 days 00:00:10.659051,ReLU,2,16,0.008563021947318427,1,40,0.7423052037219039,1.8005606663731703e-05,COMPLETE
458,0.3671797215938568,2023-09-02 00:21:29.810356,2023-09-02 00:21:36.716824,0 days 00:00:06.906468,Tanh,8,18,0.004786173218692619,1,100,0.7179206292373705,0.03859218813771958,COMPLETE
459,0.1747882217168808,2023-09-02 00:21:36.717112,2023-09-02 00:22:03.796210,0 days 00:00:27.079098,Tanh,2,16,0.002102093964427254,1,100,0.7585404933235242,2.409670397612739e-05,COMPLETE
