number,value,datetime_start,datetime_complete,duration,params_activation1,params_activation2,params_activation3,params_batch_size,params_fl1,params_fl2,params_fl3,params_learning_rate,params_n_layers,params_num_epochs,params_train_size,params_weight_decay,state
214,0.1730204075574875,2023-09-01 23:37:20.886710,2023-09-01 23:37:38.895794,0 days 00:00:18.009084,Sigmoid,Tanh,,4,15,19.0,,0.0019550154748380955,2,100,0.7337117279202344,1.3232051565899772e-05,COMPLETE
215,0.16101416945457458,2023-09-01 23:37:38.896080,2023-09-01 23:37:51.848981,0 days 00:00:12.952901,ReLU,Tanh,,4,19,20.0,,0.004081794483293728,2,100,0.5230518177053907,0.00016385147388083305,COMPLETE
216,0.17235510051250458,2023-09-01 23:37:51.849258,2023-09-01 23:38:00.561633,0 days 00:00:08.712375,ReLU,Tanh,,4,19,20.0,,0.004206473456636728,2,100,0.35173645481547416,0.00017948538853877565,COMPLETE
217,0.20116503536701202,2023-09-01 23:38:00.561918,2023-09-01 23:38:13.652819,0 days 00:00:13.090901,ReLU,Tanh,,4,18,21.0,,0.002437348624729479,2,100,0.529174016406325,0.00033212993626458405,COMPLETE
218,0.17658445239067078,2023-09-01 23:38:13.653094,2023-09-01 23:38:30.956738,0 days 00:00:17.303644,ReLU,Tanh,,4,17,19.0,,0.003183843298337478,2,100,0.7036729119572903,0.0001523157319524851,COMPLETE
219,0.19916023313999176,2023-09-01 23:38:30.957018,2023-09-01 23:38:45.322934,0 days 00:00:14.365916,ReLU,Tanh,,4,18,20.0,,0.005237942159120334,2,100,0.5822452088572893,0.0007691602890878376,COMPLETE
220,0.19906465709209442,2023-09-01 23:38:45.323205,2023-09-01 23:38:51.979563,0 days 00:00:06.656358,Sigmoid,Sigmoid,,12,17,21.0,,0.0038487908358485665,2,100,0.7637493132127945,0.00012004238575742218,COMPLETE
221,0.18005460500717163,2023-09-01 23:38:51.979842,2023-09-01 23:39:05.675237,0 days 00:00:13.695395,ReLU,Tanh,,4,17,20.0,,0.002878943955792473,2,100,0.556738707880462,1.960018498993083e-05,COMPLETE
222,0.1764606535434723,2023-09-01 23:39:05.675519,2023-09-01 23:39:17.386015,0 days 00:00:11.710496,Sigmoid,Tanh,,4,19,18.0,,0.00672784812366589,2,100,0.4754939687573476,3.290224178052759e-05,COMPLETE
223,0.20025967061519623,2023-09-01 23:39:17.386293,2023-09-01 23:39:25.613836,0 days 00:00:08.227543,Sigmoid,Tanh,,4,18,6.0,,0.004766604297375205,2,100,0.3352829643509834,0.00022958820787840475,COMPLETE
224,0.3655848205089569,2023-09-01 23:39:25.614121,2023-09-01 23:39:41.454412,0 days 00:00:15.840291,Sigmoid,Tanh,,4,16,19.0,,2.5530521317877492e-05,2,100,0.6476414316052637,2.598754295158644e-05,COMPLETE
225,0.20600010454654694,2023-09-01 23:39:41.454700,2023-09-01 23:39:44.011978,0 days 00:00:02.557278,Sigmoid,Tanh,,30,15,19.0,,0.008026645020543975,2,100,0.6238124194797944,2.0142279207089562e-05,COMPLETE
226,0.17607073485851288,2023-09-01 23:39:44.012252,2023-09-01 23:39:58.138250,0 days 00:00:14.125998,Tanh,ReLU,,4,19,19.0,,0.009183247508942128,2,100,0.5713446541443694,4.398720347291153e-05,COMPLETE
227,0.20562876760959625,2023-09-01 23:39:58.138550,2023-09-01 23:40:12.833144,0 days 00:00:14.694594,ReLU,Tanh,,4,17,20.0,,0.0037973988467620286,2,80,0.7391001664717138,0.0023237270388929573,COMPLETE
228,0.16432920098304749,2023-09-01 23:40:12.833429,2023-09-01 23:40:29.653186,0 days 00:00:16.819757,Tanh,Tanh,,4,18,18.0,,0.005476516253502323,2,100,0.6924880331975283,9.12503494528516e-05,COMPLETE
229,0.17257578670978546,2023-09-01 23:40:29.653478,2023-09-01 23:40:46.386527,0 days 00:00:16.733049,Tanh,Tanh,,4,18,18.0,,0.005449493575430933,2,100,0.6894328522678573,7.923577363035986e-05,COMPLETE
230,0.25596898794174194,2023-09-01 23:40:46.386803,2023-09-01 23:40:51.266490,0 days 00:00:04.879687,Sigmoid,Tanh,,16,14,17.0,,0.0009800806946982734,2,100,0.7235593904612508,0.000103265216883125,COMPLETE
231,0.175808846950531,2023-09-01 23:40:51.266763,2023-09-01 23:41:09.761881,0 days 00:00:18.495118,Tanh,Tanh,,4,18,18.0,,0.00436232456368531,2,100,0.7619933823590325,0.00014180747263860678,COMPLETE
232,0.17747876048088074,2023-09-01 23:41:09.762154,2023-09-01 23:41:25.964528,0 days 00:00:16.202374,Tanh,Tanh,,4,19,19.0,,0.0032381968138218598,2,100,0.6650375351721368,2.2815546837728224e-05,COMPLETE
233,0.15376125276088715,2023-09-01 23:41:25.964806,2023-09-01 23:41:43.276478,0 days 00:00:17.311672,Tanh,Tanh,,4,17,20.0,,0.01238269265208567,2,100,0.7079700006600262,1.683196354448107e-05,COMPLETE
234,0.16328215599060059,2023-09-01 23:41:43.276791,2023-09-01 23:42:00.454958,0 days 00:00:17.178167,Tanh,Tanh,,4,17,20.0,,0.015347217980310988,2,100,0.7040621449304347,1.4768639715172462e-05,COMPLETE
235,0.17952202260494232,2023-09-01 23:42:00.455245,2023-09-01 23:42:17.630663,0 days 00:00:17.175418,Tanh,Tanh,,4,17,20.0,,0.015098635109744758,2,100,0.7056462341663003,1.445539337224015e-05,COMPLETE
236,0.19228461384773254,2023-09-01 23:42:17.630947,2023-09-01 23:42:36.368244,0 days 00:00:18.737297,Tanh,Tanh,,4,20,21.0,,0.019569657411139734,2,100,0.7700897503931282,1.6347435748023403e-05,COMPLETE
237,0.16728292405605316,2023-09-01 23:42:36.368524,2023-09-01 23:42:45.372971,0 days 00:00:09.004447,Tanh,Tanh,,8,16,17.0,,0.012560111254226977,2,100,0.7178331185435971,1.2197084980471636e-05,COMPLETE
238,0.18438059091567993,2023-09-01 23:42:45.373248,2023-09-01 23:43:04.972516,0 days 00:00:19.599268,Tanh,Tanh,,4,23,21.0,,0.016250391862970223,2,100,0.7996065050128972,1.73140284572886e-05,COMPLETE
239,0.25783538818359375,2023-09-01 23:43:04.972795,2023-09-01 23:43:18.649466,0 days 00:00:13.676671,Sigmoid,,,4,17,,,0.000578757056122212,1,100,0.7445362577215631,1.433014471237769e-05,COMPLETE
240,0.17268051207065582,2023-09-01 23:43:18.649738,2023-09-01 23:43:23.274138,0 days 00:00:04.624400,Tanh,Tanh,,16,18,20.0,,0.00998668942405148,2,100,0.6831915856651603,0.00012529099147066296,COMPLETE
241,0.144439697265625,2023-09-01 23:43:23.274410,2023-09-01 23:43:40.371018,0 days 00:00:17.096608,Tanh,Tanh,,4,16,20.0,,0.004949319704685455,2,100,0.7062796288238296,1.9527895701558402e-05,COMPLETE
242,0.16788935661315918,2023-09-01 23:43:40.371301,2023-09-01 23:43:57.537361,0 days 00:00:17.166060,Tanh,Tanh,,4,16,20.0,,0.004980667116524882,2,100,0.7103524133246621,1.857889384448495e-05,COMPLETE
243,0.15114639699459076,2023-09-01 23:43:57.537647,2023-09-01 23:44:15.353665,0 days 00:00:17.816018,Tanh,Tanh,,4,16,20.0,,0.006633014561136005,2,100,0.7387061689848774,2.1533525013101558e-05,COMPLETE
244,0.1565747708082199,2023-09-01 23:44:15.353957,2023-09-01 23:44:31.623467,0 days 00:00:16.269510,Tanh,Tanh,,4,16,20.0,,0.006616359022064049,2,100,0.6714078113346285,9.491433741621142e-05,COMPLETE
245,0.1676853746175766,2023-09-01 23:44:31.623768,2023-09-01 23:44:47.691504,0 days 00:00:16.067736,Tanh,Tanh,,4,16,21.0,,0.005698246832778693,2,100,0.65955350750762,9.846636371861724e-05,COMPLETE
246,0.16229763627052307,2023-09-01 23:44:47.691790,2023-09-01 23:45:09.940158,0 days 00:00:22.248368,Tanh,Tanh,Tanh,4,17,20.0,23.0,0.0065488540599165064,3,100,0.7389193882028948,9.082123262214174e-05,COMPLETE
247,0.1679634004831314,2023-09-01 23:45:09.940441,2023-09-01 23:45:32.307611,0 days 00:00:22.367170,Tanh,Tanh,Tanh,4,17,20.0,24.0,0.006242040787835585,3,100,0.7440773236482878,0.00011693599245705396,COMPLETE
248,0.16619060933589935,2023-09-01 23:45:32.307903,2023-09-01 23:45:50.071702,0 days 00:00:17.763799,Tanh,Tanh,,4,16,22.0,,0.004557759222496169,2,100,0.7324832883868789,9.11578530667263e-05,COMPLETE
249,0.17122958600521088,2023-09-01 23:45:50.071987,2023-09-01 23:46:02.161376,0 days 00:00:12.089389,Tanh,Tanh,Tanh,4,17,20.0,20.0,0.007264507626769718,3,100,0.4041907532781728,0.00015986664585532104,COMPLETE
250,0.17370101809501648,2023-09-01 23:46:02.161661,2023-09-01 23:46:24.870720,0 days 00:00:22.709059,Tanh,Tanh,Tanh,4,17,21.0,15.0,0.005531311626940442,3,100,0.7605189883193705,8.52697494227018e-05,COMPLETE
251,0.16782146692276,2023-09-01 23:46:24.871010,2023-09-01 23:46:41.244890,0 days 00:00:16.373880,Tanh,Tanh,,4,18,20.0,,0.0040248131244398026,2,100,0.6797235664584048,7.325803493442933e-05,COMPLETE
252,0.2741451561450958,2023-09-01 23:46:41.245170,2023-09-01 23:46:41.765040,0 days 00:00:00.519870,Tanh,Sigmoid,,30,17,20.0,,0.005825069963116045,2,100,0.11438964634290083,1.6066143609534954e-05,COMPLETE
253,0.16231104731559753,2023-09-01 23:46:41.765316,2023-09-01 23:46:59.051430,0 days 00:00:17.286114,Tanh,Tanh,,4,16,21.0,,0.008331803781417136,2,100,0.713154338102301,9.593698266191686e-05,COMPLETE
254,0.1744815707206726,2023-09-01 23:46:59.051708,2023-09-01 23:47:16.187680,0 days 00:00:17.135972,Tanh,Tanh,,4,16,21.0,,0.008447100400151626,2,100,0.7113271097294168,0.00010708345361356287,COMPLETE
255,0.18331801891326904,2023-09-01 23:47:16.187960,2023-09-01 23:47:26.867728,0 days 00:00:10.679768,Tanh,Tanh,,4,16,21.0,,0.007161157316114818,2,100,0.43923955593187236,9.07402434454791e-05,COMPLETE
256,0.22045670449733734,2023-09-01 23:47:26.868020,2023-09-01 23:47:30.973396,0 days 00:00:04.105376,Tanh,Tanh,,4,16,22.0,,0.012150339213496598,2,100,0.16767932979315756,0.0001308235730757012,COMPLETE
257,0.16289184987545013,2023-09-01 23:47:30.973678,2023-09-01 23:47:42.520045,0 days 00:00:11.546367,Tanh,Tanh,Leaky,4,17,19.0,20.0,0.009013151130310013,3,100,0.3809550922759898,7.329457333614095e-05,COMPLETE
258,0.18790626525878906,2023-09-01 23:47:42.520332,2023-09-01 23:47:50.139329,0 days 00:00:07.618997,Tanh,Tanh,,4,17,19.0,,0.008232662763398117,2,100,0.312078708574466,7.068423306350501e-05,COMPLETE
259,0.14698168635368347,2023-09-01 23:47:50.139611,2023-09-01 23:48:06.324550,0 days 00:00:16.184939,Tanh,Tanh,Leaky,4,18,19.0,21.0,0.0064268437870977115,3,100,0.5349390081982708,7.720107650690882e-05,COMPLETE
260,0.21115455031394958,2023-09-01 23:48:06.324842,2023-09-01 23:48:22.387348,0 days 00:00:16.062506,Tanh,Tanh,Leaky,4,18,1.0,21.0,0.006850018772799457,3,100,0.5426544355136749,8.384063913897068e-05,COMPLETE
261,0.1482544094324112,2023-09-01 23:48:22.387638,2023-09-01 23:48:37.830722,0 days 00:00:15.443084,Tanh,Tanh,Leaky,4,18,20.0,22.0,0.006282096831927609,3,100,0.5095670969198889,7.563715366177227e-05,COMPLETE
262,0.1777896136045456,2023-09-01 23:48:37.831022,2023-09-01 23:48:54.355945,0 days 00:00:16.524923,Tanh,ReLU,Leaky,4,15,20.0,22.0,0.009163615113554293,3,100,0.52905808430185,6.847292691734807e-05,COMPLETE
263,0.15182076394557953,2023-09-01 23:48:54.356243,2023-09-01 23:48:59.727845,0 days 00:00:05.371602,Tanh,Tanh,Leaky,12,18,20.0,20.0,0.008042072686655468,3,100,0.49716644593031,7.202603691999487e-05,COMPLETE
264,0.17826053500175476,2023-09-01 23:48:59.728137,2023-09-01 23:49:02.146992,0 days 00:00:02.418855,Tanh,Sigmoid,Leaky,30,22,21.0,19.0,0.007835438621860353,3,100,0.48669781146983915,6.702829150959094e-05,COMPLETE
265,0.17957431077957153,2023-09-01 23:49:02.147284,2023-09-01 23:49:06.574745,0 days 00:00:04.427461,Tanh,Tanh,Leaky,12,19,19.0,22.0,0.006657468863211562,3,80,0.5119698454930663,8.246564414903591e-05,COMPLETE
266,0.17104768753051758,2023-09-01 23:49:06.575035,2023-09-01 23:49:12.049812,0 days 00:00:05.474777,Tanh,Tanh,Leaky,12,18,20.0,18.0,0.008648879438924298,3,100,0.5064631375955582,5.461316308424569e-05,COMPLETE
267,0.15767252445220947,2023-09-01 23:49:12.050109,2023-09-01 23:49:17.407597,0 days 00:00:05.357488,Tanh,Tanh,Leaky,12,18,20.0,23.0,0.006373365924582633,3,100,0.49631762009868896,7.343733038483902e-05,COMPLETE
268,0.14374935626983643,2023-09-01 23:49:17.407893,2023-09-01 23:49:25.528885,0 days 00:00:08.120992,Tanh,Tanh,Leaky,8,18,21.0,23.0,0.006167849166848038,3,100,0.5169875633102993,7.47804425434009e-05,COMPLETE
269,0.16752029955387115,2023-09-01 23:49:25.529183,2023-09-01 23:49:30.483552,0 days 00:00:04.954369,Tanh,Tanh,Leaky,12,19,21.0,23.0,0.006559558134917049,3,100,0.4576662272049647,7.455708030381655e-05,COMPLETE
270,0.1626138836145401,2023-09-01 23:49:30.483855,2023-09-01 23:49:38.541474,0 days 00:00:08.057619,Tanh,Tanh,Leaky,8,18,21.0,22.0,0.0078876108994335,3,100,0.5129658542083585,0.0001023080359594182,COMPLETE
271,0.15818488597869873,2023-09-01 23:49:38.541784,2023-09-01 23:49:46.505819,0 days 00:00:07.964035,Tanh,Tanh,Leaky,8,19,22.0,24.0,0.005941501734496457,3,100,0.505814774986231,0.00010300281224893842,COMPLETE
272,0.16217529773712158,2023-09-01 23:49:46.506118,2023-09-01 23:49:54.261437,0 days 00:00:07.755319,Tanh,Tanh,Leaky,8,20,22.0,24.0,0.0056912287390842985,3,100,0.4895296321693168,9.783127496375362e-05,COMPLETE
273,0.15596291422843933,2023-09-01 23:49:54.261746,2023-09-01 23:50:02.203392,0 days 00:00:07.941646,Tanh,Tanh,Leaky,8,20,22.0,24.0,0.0059382667403857356,3,100,0.5026620885503574,0.00012382617075119446,COMPLETE
274,0.16051338613033295,2023-09-01 23:50:02.203697,2023-09-01 23:50:10.051085,0 days 00:00:07.847388,Tanh,Tanh,Leaky,8,20,22.0,24.0,0.005415354117921129,3,100,0.4977899231239294,0.00011169469037043385,COMPLETE
275,0.16658762097358704,2023-09-01 23:50:10.051387,2023-09-01 23:50:17.694201,0 days 00:00:07.642814,Tanh,Tanh,Leaky,8,21,22.0,24.0,0.00537879292178405,3,100,0.48333116747974364,0.0001123076135404033,COMPLETE
276,0.18296931684017181,2023-09-01 23:50:17.694520,2023-09-01 23:50:25.509177,0 days 00:00:07.814657,Tanh,Tanh,Leaky,8,20,23.0,24.0,0.004875229298010912,3,100,0.4956306207236786,0.00014895697603437257,COMPLETE
277,0.1849435567855835,2023-09-01 23:50:25.509480,2023-09-01 23:50:32.934809,0 days 00:00:07.425329,Tanh,Tanh,Leaky,8,20,21.0,22.0,0.006084321528928906,3,100,0.4709109202392936,0.0001717768555455658,COMPLETE
278,0.15871967375278473,2023-09-01 23:50:32.935111,2023-09-01 23:50:40.588206,0 days 00:00:07.653095,ReLU,Tanh,Leaky,8,19,22.0,24.0,0.00533130401678328,3,100,0.4834722481811786,0.0001202272985163492,COMPLETE
279,0.19078722596168518,2023-09-01 23:50:40.588502,2023-09-01 23:50:48.848091,0 days 00:00:08.259589,ReLU,Tanh,Leaky,8,19,22.0,24.0,0.004792471374649925,3,100,0.5193342014387664,0.0001241671362255175,COMPLETE
280,0.1786690354347229,2023-09-01 23:50:48.848392,2023-09-01 23:50:56.810209,0 days 00:00:07.961817,ReLU,Tanh,Leaky,8,20,22.0,22.0,0.005223235144270928,3,100,0.5025471562546991,0.00011501192393206841,COMPLETE
281,0.179429292678833,2023-09-01 23:50:56.810514,2023-09-01 23:51:04.355716,0 days 00:00:07.545202,ReLU,Tanh,Leaky,8,19,23.0,23.0,0.006406863242647653,3,100,0.4766802981357722,0.00020577131902640218,COMPLETE
282,0.16712768375873566,2023-09-01 23:51:04.356019,2023-09-01 23:51:12.872280,0 days 00:00:08.516261,ReLU,Tanh,Leaky,8,19,22.0,24.0,0.005018401750350462,3,100,0.5371367531418046,0.00011120365044233544,COMPLETE
283,0.17266111075878143,2023-09-01 23:51:12.872585,2023-09-01 23:51:20.827963,0 days 00:00:07.955378,ReLU,Tanh,Leaky,8,20,22.0,21.0,0.004312853357164654,3,100,0.5000978648220492,0.0001318266528856682,COMPLETE
284,0.1473054438829422,2023-09-01 23:51:20.828266,2023-09-01 23:51:28.539411,0 days 00:00:07.711145,Tanh,Tanh,Leaky,8,21,23.0,23.0,0.0058334940670697775,3,100,0.48956397933377543,0.00029310783662244675,COMPLETE
285,0.17831288278102875,2023-09-01 23:51:28.539709,2023-09-01 23:51:35.713552,0 days 00:00:07.173843,Tanh,Leaky,Leaky,8,21,23.0,21.0,0.007405583320317419,3,100,0.45476502090773135,0.00016047048986104999,COMPLETE
286,0.1960441619157791,2023-09-01 23:51:35.713846,2023-09-01 23:51:43.982086,0 days 00:00:08.268240,ReLU,Tanh,Leaky,8,19,21.0,23.0,0.00040197890544995383,3,100,0.5217400455080026,0.00026455732446897763,COMPLETE
287,0.24861985445022583,2023-09-01 23:51:43.982390,2023-09-01 23:51:49.039573,0 days 00:00:05.057183,Tanh,Tanh,Leaky,12,19,20.0,22.0,0.00016386471278096384,3,100,0.4663921406463259,0.00014108104254095086,COMPLETE
288,0.18565882742404938,2023-09-01 23:51:49.039875,2023-09-01 23:51:56.782677,0 days 00:00:07.742802,Tanh,Tanh,Sigmoid,8,21,23.0,23.0,0.004257163463278779,3,100,0.49339809575383803,0.0001874794485888643,COMPLETE
289,0.28536829352378845,2023-09-01 23:51:56.782972,2023-09-01 23:52:03.881225,0 days 00:00:07.098253,Tanh,Tanh,ReLU,8,23,22.0,21.0,0.00610054681483989,3,80,0.5338771354571608,0.019656478339086667,COMPLETE
290,0.15994806587696075,2023-09-01 23:52:03.881528,2023-09-01 23:52:08.990863,0 days 00:00:05.109335,Tanh,ReLU,Leaky,12,19,21.0,23.0,0.0038738206375391417,3,100,0.4588638909751586,0.0004517027274479549,COMPLETE
291,0.16264323890209198,2023-09-01 23:52:08.991175,2023-09-01 23:52:13.827109,0 days 00:00:04.835934,Tanh,ReLU,Leaky,12,19,21.0,23.0,0.0038992680487528754,3,100,0.4423359399949697,0.0002594932299069176,COMPLETE
292,0.17050519585609436,2023-09-01 23:52:13.827431,2023-09-01 23:52:19.859740,0 days 00:00:06.032309,Tanh,ReLU,Leaky,12,20,20.0,23.0,0.004618204606164546,3,100,0.5547351891508245,0.00017761591278941767,COMPLETE
293,0.16833403706550598,2023-09-01 23:52:19.860037,2023-09-01 23:52:28.114584,0 days 00:00:08.254547,Tanh,ReLU,Leaky,8,18,21.0,24.0,0.005086774107051219,3,100,0.5158773608783461,0.0003281474892546085,COMPLETE
294,0.17538850009441376,2023-09-01 23:52:28.114881,2023-09-01 23:52:33.366218,0 days 00:00:05.251337,ReLU,ReLU,Leaky,12,24,24.0,20.0,0.003559687360802309,3,100,0.47264568692885534,0.00033716217469017824,COMPLETE
295,0.16964221000671387,2023-09-01 23:52:33.366527,2023-09-01 23:52:38.711259,0 days 00:00:05.344732,Tanh,ReLU,Leaky,12,19,20.0,22.0,0.0068736575731815205,3,100,0.4867334772402206,0.00013624928971564664,COMPLETE
296,0.16406814754009247,2023-09-01 23:52:38.711568,2023-09-01 23:52:47.236947,0 days 00:00:08.525379,Tanh,Leaky,Leaky,8,18,22.0,23.0,0.0055777887873917666,3,100,0.5408723329456483,0.00011456878122216669,COMPLETE
297,0.16976141929626465,2023-09-01 23:52:47.237245,2023-09-01 23:52:54.498599,0 days 00:00:07.261354,Tanh,ReLU,Sigmoid,8,19,21.0,13.0,0.004230687896267765,3,100,0.4577591305002089,0.00023923979600088863,COMPLETE
298,0.1767103374004364,2023-09-01 23:52:54.498908,2023-09-01 23:52:56.684494,0 days 00:00:02.185586,Tanh,Tanh,Leaky,12,18,20.0,7.0,0.006966904341098008,3,40,0.5025137512294692,0.00028993188484321053,COMPLETE
299,0.1895921379327774,2023-09-01 23:52:56.684783,2023-09-01 23:53:03.977025,0 days 00:00:07.292242,Tanh,Leaky,ReLU,8,21,20.0,21.0,0.005238302223896208,3,100,0.4299237081528653,0.0007932377712205993,COMPLETE
300,0.1655793935060501,2023-09-01 23:53:03.977325,2023-09-01 23:53:09.658260,0 days 00:00:05.680935,Tanh,Tanh,Leaky,12,20,21.0,24.0,0.003720291832459725,3,100,0.5226055200521841,0.0005057767999553157,COMPLETE
301,0.18371528387069702,2023-09-01 23:53:09.658560,2023-09-01 23:53:18.599936,0 days 00:00:08.941376,ReLU,Tanh,Leaky,8,22,23.0,19.0,0.004539209362549307,3,100,0.5625197371257656,0.0003579973417263263,COMPLETE
302,0.3068093955516815,2023-09-01 23:53:18.600235,2023-09-01 23:53:25.974787,0 days 00:00:07.374552,Tanh,Tanh,Leaky,8,19,22.0,22.0,0.09437984992111115,3,100,0.46802464085413914,0.00022719983893240733,COMPLETE
303,0.1970091462135315,2023-09-01 23:53:25.975089,2023-09-01 23:53:29.276550,0 days 00:00:03.301461,Tanh,,,12,18,,,0.006077079403943125,1,100,0.48544355728525135,0.00019959184026925624,COMPLETE
304,0.16350659728050232,2023-09-01 23:53:29.276829,2023-09-01 23:53:35.924586,0 days 00:00:06.647757,Tanh,Tanh,Leaky,8,18,19.0,23.0,0.007182307371138481,3,100,0.4219763367916492,8.45069682861732e-05,COMPLETE
305,0.18113449215888977,2023-09-01 23:53:35.924919,2023-09-01 23:53:44.006179,0 days 00:00:08.081260,Tanh,Tanh,Leaky,8,19,20.0,24.0,0.00948676094590567,3,100,0.5142055600519863,0.00017540508507147887,COMPLETE
306,0.15149037539958954,2023-09-01 23:53:44.006486,2023-09-01 23:53:50.010004,0 days 00:00:06.003518,Tanh,Leaky,Leaky,12,20,21.0,20.0,0.0040966241701080024,3,100,0.5535253046483394,0.000435885781676641,COMPLETE
307,0.1657499521970749,2023-09-01 23:53:50.010319,2023-09-01 23:53:56.110457,0 days 00:00:06.100138,Tanh,Leaky,Leaky,12,20,22.0,20.0,0.005469036784006195,3,100,0.5638350362369645,0.000608191106838399,COMPLETE
308,0.18094182014465332,2023-09-01 23:53:56.110766,2023-09-01 23:54:01.037037,0 days 00:00:04.926271,Tanh,Leaky,Leaky,12,20,21.0,19.0,0.0033333179809053167,3,100,0.4540853833957292,0.0004112697765507585,COMPLETE
309,0.17489802837371826,2023-09-01 23:54:01.037340,2023-09-01 23:54:06.970351,0 days 00:00:05.933011,Tanh,Leaky,Leaky,12,21,21.0,22.0,0.010187988212913194,3,100,0.5474395679676924,4.5918735771324906e-05,COMPLETE
310,0.17970457673072815,2023-09-01 23:54:06.970659,2023-09-01 23:54:12.299019,0 days 00:00:05.328360,Tanh,Leaky,Leaky,12,13,21.0,23.0,0.004740690661652325,3,100,0.4928561000667935,6.236257335791282e-05,COMPLETE
311,0.19001862406730652,2023-09-01 23:54:12.299320,2023-09-01 23:54:17.481038,0 days 00:00:05.181718,Tanh,Leaky,Tanh,12,18,22.0,20.0,0.007469462947241906,3,100,0.4790103707877209,0.0004266632172000307,COMPLETE
312,0.1608581691980362,2023-09-01 23:54:17.481343,2023-09-01 23:54:25.810661,0 days 00:00:08.329318,Tanh,Leaky,Leaky,8,14,24.0,24.0,0.005874927552990367,3,100,0.5329991482888405,0.0004097354746065797,COMPLETE
313,0.1471310406923294,2023-09-01 23:54:25.810951,2023-09-01 23:54:32.260204,0 days 00:00:06.449253,Tanh,Leaky,Leaky,8,20,19.0,21.0,0.0037311384460905987,3,80,0.5111485948486065,6.75265004862863e-05,COMPLETE
314,0.1710704118013382,2023-09-01 23:54:32.260508,2023-09-01 23:54:38.225881,0 days 00:00:05.965373,Tanh,Leaky,Leaky,10,21,19.0,21.0,0.0007475036091248395,3,80,0.5825500451520718,5.026893033867729e-05,COMPLETE
315,0.1663867086172104,2023-09-01 23:54:38.226184,2023-09-01 23:54:42.972828,0 days 00:00:04.746644,Tanh,Leaky,Leaky,12,18,19.0,21.0,0.0011736536697993533,3,80,0.5492595131858931,6.49888535981805e-05,COMPLETE
316,0.19364604353904724,2023-09-01 23:54:42.973133,2023-09-01 23:54:49.532855,0 days 00:00:06.559722,Tanh,Leaky,Sigmoid,8,19,20.0,19.0,0.003448643577708425,3,80,0.5180511889398978,0.0005366466032649851,COMPLETE
317,0.17147153615951538,2023-09-01 23:54:49.533159,2023-09-01 23:54:53.442104,0 days 00:00:03.908945,Tanh,Leaky,Leaky,12,18,19.0,17.0,0.004089709880210382,3,80,0.45186617640969223,0.0007017341701821969,COMPLETE
318,0.17736081779003143,2023-09-01 23:54:53.442408,2023-09-01 23:54:59.807950,0 days 00:00:06.365542,Tanh,Leaky,Leaky,8,20,19.0,22.0,0.002920456755319877,3,80,0.5049107342249796,0.0004649436788553438,COMPLETE
