number,value,params_activation_1,params_activation_2,params_activation_3,params_batch_size,params_epochs,params_layer_1,params_layer_2,params_layer_3,params_learning_rate,params_num_layers,params_train_size,params_weight_decay,user_attrs_mape,user_attrs_mse,user_attrs_r2,state
237,0.22979289293289185,Tanh,Tanh,,66,479,18,16.0,,0.008933179055378139,2,0.7031281562536154,0.00039115007647303097,0.6284999847412109,0.22979289293289185,0.7583634257316589,COMPLETE
238,0.3128109276294708,Tanh,Leaky,,69,486,19,17.0,,0.013447089581287507,2,0.3854401847405048,0.0005899325599990165,0.4738815128803253,0.3128109276294708,0.6974043846130371,COMPLETE
239,0.23803716897964478,Tanh,Leaky,,71,486,18,18.0,,0.014489567478342841,2,0.6266399800757415,0.0004958848653976008,0.5253927707672119,0.23803716897964478,0.7284741997718811,COMPLETE
240,0.21886439621448517,Tanh,Leaky,,68,488,20,16.0,,0.01011147865270763,2,0.6534740135523491,0.00044866069092320377,12.341653823852539,0.21886439621448517,0.7624356746673584,COMPLETE
241,0.22049225866794586,Tanh,Leaky,,61,471,16,13.0,,0.012009897811859325,2,0.723763853642267,0.0006119294240505892,2.9164249897003174,0.22049225866794586,0.7674406170845032,COMPLETE
242,0.21741671860218048,Tanh,Leaky,,63,492,17,15.0,,0.016782810670280292,2,0.7644117352095141,0.0007125673854910529,0.42316243052482605,0.21741671860218048,0.7843581438064575,COMPLETE
243,0.2654274106025696,Tanh,Leaky,,68,498,19,16.0,,0.012001652706143763,2,0.5342622299837559,0.0003818714749329218,0.8247268199920654,0.2654274106025696,0.720676839351654,COMPLETE
244,0.1985921412706375,Tanh,Leaky,,58,484,21,17.0,,0.008359706581672538,2,0.7005956970289299,0.0004989046856154692,0.609541654586792,0.1985921412706375,0.7899901270866394,COMPLETE
245,0.20293179154396057,Tanh,Leaky,,58,483,21,17.0,,0.008566458971757751,2,0.692951175303986,0.00030981089424468426,0.46955424547195435,0.20293179154396057,0.7505589723587036,COMPLETE
246,0.21486932039260864,Tanh,Leaky,,65,482,22,17.0,,0.009354926435640155,2,0.7011007014224406,0.00028868746337835845,0.6274969577789307,0.21486932039260864,0.776587963104248,COMPLETE
247,0.2219403237104416,Tanh,Leaky,,57,476,22,18.0,,0.008684597418975072,2,0.7237625838496357,0.00023642149706978307,4.095322132110596,0.2219403237104416,0.7645229697227478,COMPLETE
248,0.20051147043704987,Tanh,Leaky,,54,467,21,17.0,,0.007315338288897663,2,0.6676021377372134,0.0003416624291953594,0.609792172908783,0.20051147043704987,0.7946165800094604,COMPLETE
249,0.30684012174606323,ReLU,Leaky,,54,465,21,17.0,,0.006831654735504728,2,0.3704443049364669,0.0003007026487584078,0.4982270896434784,0.30684012174606323,0.6591846942901611,COMPLETE
250,0.22032462060451508,Sigmoid,Leaky,,58,471,21,17.0,,0.007412722442568551,2,0.706338764434725,0.00035848690927920915,0.6117207407951355,0.22032462060451508,0.7859915494918823,COMPLETE
251,0.2785734236240387,Leaky,Leaky,,53,479,21,14.0,,0.007451098033273635,2,0.46409737012940044,0.00020202381745109782,0.4673904478549957,0.2785734236240387,0.7166167497634888,COMPLETE
252,0.22148287296295166,Tanh,Leaky,,56,425,21,15.0,,0.008361893927218127,2,0.654217342783852,0.0002495755136168537,0.757595956325531,0.22148287296295166,0.7488760352134705,COMPLETE
253,0.2556699812412262,Tanh,Leaky,,53,450,22,18.0,,0.005485759068042837,2,0.5969528216750422,0.0003195675600836679,0.499344140291214,0.2556699812412262,0.7377046346664429,COMPLETE
254,0.21492336690425873,Tanh,Leaky,,59,372,21,16.0,,0.006680672890510662,2,0.7490782008529425,1.4788033147541874e-05,0.741219699382782,0.21492336690425873,0.7671549320220947,COMPLETE
255,0.40158939361572266,Tanh,Sigmoid,,55,464,20,15.0,,0.0045508326654371085,2,0.6336974578177594,0.04051991496398035,0.6346909999847412,0.40158939361572266,0.6132017374038696,COMPLETE
256,0.19694076478481293,Tanh,Leaky,,61,488,21,17.0,,0.010147611213726074,2,0.6961166804550036,0.000443399097153144,0.5326928496360779,0.19694076478481293,0.7877076864242554,COMPLETE
257,0.23596139252185822,Tanh,Leaky,,61,487,22,18.0,,0.009895788829588355,2,0.7991183917194072,1.0917370652026367e-05,0.5154401659965515,0.23596139252185822,0.7598694562911987,COMPLETE
258,0.28008389472961426,Tanh,Leaky,,62,482,21,17.0,,7.730277050538324e-05,2,0.6857971133857101,0.00045496770109737636,0.5140042304992676,0.28008389472961426,0.7301982641220093,COMPLETE
259,0.2684999704360962,Tanh,Leaky,,59,470,20,17.0,,0.008946040726898905,2,0.5252330860611355,0.000373575156266986,0.7471661567687988,0.2684999704360962,0.7470320463180542,COMPLETE
260,0.22222772240638733,Tanh,Leaky,,58,431,20,16.0,,0.01951093383573681,2,0.7400816026240314,0.0007489327778108108,0.4260082542896271,0.22222772240638733,0.7665081024169922,COMPLETE
261,0.20587635040283203,Tanh,Leaky,,56,458,21,11.0,,0.00716462509380858,2,0.6621979954019054,0.00026648730480436755,10.987029075622559,0.20587635040283203,0.7906588315963745,COMPLETE
262,0.3132373094558716,Tanh,Leaky,,56,473,21,6.0,,0.005555049602019696,2,0.3208931098435684,0.00027265661176996257,0.5276138186454773,0.3132373094558716,0.6300828456878662,COMPLETE
263,0.22444933652877808,Tanh,ReLU,,61,484,22,14.0,,0.014820674530400783,2,0.6601569714225256,0.00018042577807729536,2.323509454727173,0.22444933652877808,0.7303318381309509,COMPLETE
264,0.24121984839439392,Tanh,Leaky,,58,191,21,18.0,,0.006667371648558177,2,0.6174284022859766,0.0003201021191366474,0.512137234210968,0.24121984839439392,0.7491569519042969,COMPLETE
265,0.3235021233558655,Tanh,Tanh,,52,139,21,11.0,,0.0109214454015949,2,0.39192639907128135,0.0003699104360411891,0.524287223815918,0.3235021233558655,0.6878188252449036,COMPLETE
266,0.21542654931545258,Tanh,Leaky,,54,461,20,10.0,,0.02236195291902987,2,0.7128835188317085,0.000456106135896153,0.8636854290962219,0.21542654931545258,0.777418851852417,COMPLETE
267,0.23730863630771637,Tanh,Leaky,,64,475,21,16.0,,0.009872964332146714,2,0.6443706841883329,0.00023405398115073554,1.038185954093933,0.23730863630771637,0.7453341484069824,COMPLETE
268,0.2594069242477417,Tanh,Leaky,,55,442,22,17.0,,0.007800847760272567,2,0.5075695692154303,0.0005583871926935913,0.9593708515167236,0.2594069242477417,0.751486599445343,COMPLETE
269,0.30233126878738403,Tanh,Leaky,,42,490,20,1.0,,0.02645690076971072,2,0.4419250986821625,0.00031684941992136056,0.4889083802700043,0.30233126878738403,0.7102250456809998,COMPLETE
270,0.2699586749076843,Tanh,Leaky,,24,462,21,15.0,,0.004679776928742568,2,0.5584424754659852,0.00025361491479557045,0.9070674777030945,0.2699586749076843,0.723700761795044,COMPLETE
271,0.2247123420238495,Tanh,Leaky,,56,403,20,8.0,,0.01792480136844075,2,0.6690914525414843,0.0006938734626592687,0.8194613456726074,0.2247123420238495,0.7692346572875977,COMPLETE
272,0.23705154657363892,Tanh,Leaky,,51,222,22,5.0,,0.006149559221062309,2,0.7455065779791777,0.0004600863966759229,0.4630531668663025,0.23705154657363892,0.7708547115325928,COMPLETE
273,0.2096102237701416,Leaky,Leaky,,12,490,20,17.0,,0.001025329154738425,2,0.6979342712151531,0.00020459929665010148,0.8959386944770813,0.2096102237701416,0.7825124263763428,COMPLETE
274,0.2244701087474823,Leaky,Leaky,,59,485,20,17.0,,0.0007237879268441023,2,0.697251284714625,0.00017311622064464786,0.6373302340507507,0.2244701087474823,0.7808117866516113,COMPLETE
275,0.2518852651119232,Leaky,Leaky,,26,491,20,18.0,,0.0010494787506403701,2,0.5979603539570311,0.00020872508818048225,0.4508507549762726,0.2518852651119232,0.7572697401046753,COMPLETE
276,0.23510923981666565,Leaky,Sigmoid,,37,474,21,13.0,,0.0014404861912498614,2,0.6365635363747387,0.00028501309331212173,0.5242551565170288,0.23510923981666565,0.771964430809021,COMPLETE
277,0.2262173593044281,Leaky,Leaky,,14,479,21,17.0,,0.0009476531074020118,2,0.6669146866028415,2.6360637171115696e-05,0.6606425642967224,0.2262173593044281,0.7812430262565613,COMPLETE
278,0.21235895156860352,Leaky,Leaky,,19,487,19,16.0,,0.0011811004160031389,2,0.6979697162485144,0.00019676874768024782,0.6032534241676331,0.21235895156860352,0.7840499877929688,COMPLETE
279,0.24213162064552307,Sigmoid,Leaky,,22,499,23,17.0,,0.043421499467045224,2,0.7253349128134322,0.00023860091295054242,0.5451274514198303,0.24213162064552307,0.7552704215049744,COMPLETE
280,0.2173103243112564,ReLU,Leaky,,14,469,20,18.0,,0.000757795212926726,2,0.6774502676112876,0.000402364660778924,0.6319533586502075,0.2173103243112564,0.7310900688171387,COMPLETE
281,0.23524300754070282,Leaky,Leaky,,57,500,19,16.0,,0.007096259426237067,2,0.650118912037246,0.00014888622492517867,1.0776870250701904,0.23524300754070282,0.7439800500869751,COMPLETE
282,0.2612321972846985,Tanh,Leaky,,46,389,20,14.0,,0.009713424188698253,2,0.5813092717820953,0.00034128611563123896,0.551231324672699,0.2612321972846985,0.7347535490989685,COMPLETE
283,0.27615121006965637,Tanh,Leaky,,61,483,21,15.0,,0.03498304445153737,2,0.4328522047975535,0.000271052042359719,0.4902772009372711,0.27615121006965637,0.6748373508453369,COMPLETE
284,0.22674871981143951,Tanh,Leaky,,29,377,19,17.0,,0.004335974019924698,2,0.7218608446008563,0.0037471080572216023,0.96998131275177,0.22674871981143951,0.78388512134552,COMPLETE
285,0.20876145362854004,Tanh,Leaky,,53,490,20,19.0,,0.013359816255934237,2,0.6910433279073595,0.0008726732390283022,0.4859406650066376,0.20876145362854004,0.7755613923072815,COMPLETE
286,0.3434383273124695,Tanh,Leaky,,51,491,20,19.0,,0.013057282192289684,2,0.25632695905616837,0.0009802762459317662,0.6515878438949585,0.3434383273124695,0.5893815755844116,COMPLETE
287,0.25254684686660767,Tanh,Leaky,,53,477,15,19.0,,0.01474500136058767,2,0.6208096296582711,0.000824694297777432,0.5789347887039185,0.25254684686660767,0.7466815710067749,COMPLETE
288,0.2381589412689209,Tanh,Leaky,,49,488,22,16.0,,0.010269844016435065,2,0.686545236160399,0.004921966281876639,0.5506316423416138,0.2381589412689209,0.7644976377487183,COMPLETE
289,0.2439216673374176,Tanh,ReLU,,55,466,19,18.0,,0.013001441722066628,2,0.6547343325582388,0.0005107410434933851,0.6769567728042603,0.2439216673374176,0.7404857873916626,COMPLETE
290,0.20668600499629974,Tanh,Leaky,,57,411,21,18.0,,0.0012860548175880084,2,0.6958071494244671,0.000853435174705874,0.44170933961868286,0.20668600499629974,0.7993257641792297,COMPLETE
291,0.21032430231571198,Tanh,Leaky,,59,500,20,17.0,,0.0016765068247617495,2,0.6975869159481101,0.000962127816171794,0.5949404239654541,0.21032430231571198,0.7930010557174683,COMPLETE
292,0.25825998187065125,Tanh,Tanh,,57,419,19,18.0,,0.0012199301211171932,2,0.6261854739202866,0.0007300686034283842,0.4645877182483673,0.25825998187065125,0.749259352684021,COMPLETE
293,0.3985055685043335,Tanh,Leaky,,62,407,21,19.0,,0.008209545716513982,2,0.105385945381311,0.00011840601370939091,0.7504211664199829,0.3985055685043335,0.5317592620849609,COMPLETE
294,0.2315479815006256,Tanh,Leaky,,55,431,17,17.0,,0.0010801298648067893,2,0.6723387968732477,0.0008592474983092852,0.41057562828063965,0.2315479815006256,0.7782434821128845,COMPLETE
295,0.33710500597953796,Tanh,Leaky,,60,413,1,18.0,,0.001469816901157616,2,0.7020949879812118,0.0006334677912045402,1.2439959049224854,0.33710500597953796,0.6735212802886963,COMPLETE
296,0.39207926392555237,Tanh,Leaky,,57,394,19,17.0,,2.0124837534226636e-05,2,0.6554601370716037,0.0007485334700182925,0.6326301097869873,0.39207926392555237,0.626401424407959,COMPLETE
297,0.22182022035121918,Leaky,Leaky,,12,483,21,16.0,,0.0009684964383148727,2,0.7167241351588333,0.0009382270063193685,0.6969850063323975,0.22182022035121918,0.7842334508895874,COMPLETE
298,0.32872307300567627,Tanh,Leaky,,35,492,20,18.0,,0.010503446308816672,2,0.1760586870488218,7.073726735588261e-05,0.5831136107444763,0.32872307300567627,0.4674034118652344,COMPLETE
299,0.22142764925956726,Tanh,Leaky,,58,476,16,17.0,,0.000859312125254601,2,0.6718833141335969,0.000577294995454856,0.4814791977405548,0.22142764925956726,0.7880669236183167,COMPLETE
300,0.2831226587295532,Sigmoid,Leaky,,94,456,20,16.0,,0.0013222079632072936,2,0.6375099001806226,0.0010682796022377062,0.6791271567344666,0.2831226587295532,0.7294635772705078,COMPLETE
301,0.2721808850765228,ReLU,Leaky,,54,400,22,18.0,,0.008707951805951079,2,0.4777323680407609,0.005759132358089359,0.7134911417961121,0.2721808850765228,0.7395539283752441,COMPLETE
302,0.3972642421722412,Tanh,Sigmoid,,64,469,19,7.0,,0.00022717617632785569,2,0.5948236969131006,0.009502965148334762,0.583200216293335,0.3972642421722412,0.6236362457275391,COMPLETE
303,0.2842947244644165,Tanh,Leaky,,18,489,15,11.0,,0.011697868344627625,2,0.4937203407187392,0.0002932967396895316,0.6815606355667114,0.2842947244644165,0.7031898498535156,COMPLETE
304,0.22143207490444183,Tanh,Leaky,,56,480,20,16.0,,0.0071509349379348065,2,0.7324640301042324,0.00022264594487628281,0.6356604099273682,0.22143207490444183,0.7372891902923584,COMPLETE
305,0.3008081912994385,Tanh,Leaky,,63,459,17,3.0,,0.056143461599605454,2,0.3524392706329879,0.004168680523086829,0.5025290250778198,0.3008081912994385,0.7048896551132202,COMPLETE
306,0.1961924284696579,Tanh,Leaky,,60,414,21,17.0,,0.01708285755111201,2,0.687671948227662,0.00046871877144449777,0.54288649559021,0.1961924284696579,0.7729982137680054,COMPLETE
307,0.19939973950386047,Tanh,Leaky,,60,422,21,17.0,,0.019676023385086488,2,0.6930272127563886,0.00045468165887577416,0.5216503143310547,0.19939973950386047,0.7894049286842346,COMPLETE
308,0.20932862162590027,Tanh,Leaky,,60,415,22,17.0,,0.02021348806809128,2,0.6638283230643044,0.0004981845324862835,1.4532628059387207,0.20932862162590027,0.7769973278045654,COMPLETE
309,0.2798069417476654,Tanh,Leaky,,60,410,23,17.0,,0.02074792115701078,2,0.44715961609654525,0.0004948354839839418,0.47823354601860046,0.2798069417476654,0.7147278785705566,COMPLETE
310,0.3241000175476074,Tanh,Leaky,,61,415,22,17.0,,0.018037145517357505,2,0.28910455448798433,0.00045579341688408337,0.5937067866325378,0.3241000175476074,0.6128994226455688,COMPLETE
311,0.2306879609823227,Tanh,Leaky,,62,429,22,18.0,,0.020543179371455528,2,0.6192694798455601,0.0006284336239161806,0.45508047938346863,0.2306879609823227,0.7512930631637573,COMPLETE
312,0.3073723018169403,Tanh,Leaky,,59,425,21,16.0,,0.016085243079654695,2,0.3173876920406055,0.0003970288124548726,0.5199977159500122,0.3073723018169403,0.6493588089942932,COMPLETE
313,0.22681142389774323,Tanh,Leaky,,60,437,21,17.0,,0.014509843164896246,2,0.6475886907919244,0.0005371746227430868,0.664523184299469,0.22681142389774323,0.744931697845459,COMPLETE
314,0.22634872794151306,Tanh,Leaky,,58,417,23,15.0,,0.0254347016173195,2,0.7359439674853105,0.00035896395325515435,0.6484900712966919,0.22634872794151306,0.7705827355384827,COMPLETE
315,0.3932105004787445,Tanh,Tanh,,57,406,22,19.0,,0.01866874340214664,2,0.1317308320394917,0.0004616894932682482,0.683728814125061,0.3932105004787445,0.46439671516418457,COMPLETE
316,0.2969297766685486,Tanh,ReLU,,62,423,21,17.0,,0.0003426985003847921,2,0.5736627822284891,0.0006903275052808712,0.4841521680355072,0.2969297766685486,0.7262883186340332,COMPLETE
317,0.3276578187942505,Tanh,Leaky,,64,440,22,16.0,,0.02197967637384912,2,0.2754399117203035,0.0005592906099130343,0.5910800099372864,0.3276578187942505,0.6355315446853638,COMPLETE
318,0.2064191848039627,Tanh,Leaky,,59,411,21,18.0,,0.014163824468060826,2,0.6682750975952043,0.00036165099857305696,0.6569735407829285,0.2064191848039627,0.7917845249176025,COMPLETE
319,0.20065318048000336,Tanh,Leaky,,56,399,21,18.0,,0.013561014950157711,2,0.7057044830643056,0.00032523734592895354,4.189472198486328,0.20065318048000336,0.7868341207504272,COMPLETE
320,0.20479445159435272,Tanh,Leaky,,56,403,21,18.0,,0.01327979614909112,2,0.7108999803917748,0.00032641082143030996,4.925423622131348,0.20479445159435272,0.7737338542938232,COMPLETE
321,0.21635636687278748,Tanh,Leaky,,56,405,21,19.0,,0.01314671413221541,2,0.7175018227866536,0.00031637287542309256,1.6852140426635742,0.21635636687278748,0.787224531173706,COMPLETE
322,0.22595393657684326,Tanh,Leaky,,54,406,21,18.0,,0.0005204673059097836,2,0.7452421448594193,0.00026285406996513435,0.6963910460472107,0.22595393657684326,0.7826720476150513,COMPLETE
323,0.21170492470264435,Tanh,Leaky,,58,420,21,18.0,,0.011236602976987085,2,0.6987534621488026,0.0003337612379786323,0.7083425521850586,0.21170492470264435,0.777241051197052,COMPLETE
324,0.324057936668396,Tanh,Leaky,,56,401,21,19.0,,0.0006049653711709149,2,0.33831767849831546,0.0004027762452551364,0.5409838557243347,0.324057936668396,0.6918027400970459,COMPLETE
325,0.2232528030872345,Tanh,Leaky,,52,413,21,18.0,,0.012978926435099023,2,0.7603448228631051,0.00029676362485426796,0.6029577255249023,0.2232528030872345,0.772446870803833,COMPLETE
326,0.3116630017757416,Tanh,Leaky,,58,432,22,20.0,,0.00963138004854931,2,0.38311784415813055,0.0003722166199589564,0.5105172395706177,0.3116630017757416,0.6754970550537109,COMPLETE
327,0.2016979604959488,Tanh,Leaky,Leaky,55,395,21,18.0,16.0,0.015290010704774962,3,0.7126670216137141,0.00024970314316107473,3.353182315826416,0.2016979604959488,0.780876874923706,COMPLETE
328,0.30295076966285706,Tanh,Leaky,Leaky,56,398,21,18.0,17.0,0.01560599726591127,3,0.30862328095046315,0.00025382663818062447,0.504480242729187,0.30295076966285706,0.6117942333221436,COMPLETE
329,0.298222154378891,Tanh,Leaky,,59,388,21,18.0,,0.008369645556494873,2,0.36561652352830065,0.0003163982598437688,0.4751524031162262,0.298222154378891,0.7082791328430176,COMPLETE
330,0.2446567416191101,Tanh,,,55,410,21,,,0.011351363599383508,1,0.7251490409254245,0.00023898942479822562,1.5497835874557495,0.2446567416191101,0.7581634521484375,COMPLETE
331,0.21477970480918884,Tanh,Leaky,Leaky,61,399,22,18.0,14.0,0.01686774658555529,3,0.7705322134346541,0.0004330385230771179,0.4148181974887848,0.21477970480918884,0.7592601180076599,COMPLETE
332,0.25565943121910095,Sigmoid,Sigmoid,Leaky,57,425,21,17.0,21.0,0.005965024398732273,3,0.7178019015390348,0.00034900624530763766,0.516026496887207,0.25565943121910095,0.7560750842094421,COMPLETE
333,0.22323185205459595,ReLU,Leaky,Tanh,54,397,21,18.0,9.0,0.01023844982516494,3,0.7409334121247628,0.0002672270838725896,2.1992952823638916,0.22323185205459595,0.762957751750946,COMPLETE
334,0.21004299819469452,Tanh,Leaky,ReLU,58,389,16,17.0,14.0,0.014982171296316339,3,0.7984519435366051,0.0004018886631463984,0.525696873664856,0.21004299819469452,0.7781502604484558,COMPLETE
335,0.24182884395122528,Tanh,Leaky,,74,411,22,19.0,,0.007665209392306427,2,0.640195216808902,0.00030097340299975705,0.5258989930152893,0.24182884395122528,0.7457936406135559,COMPLETE
336,0.2589946687221527,Tanh,Leaky,,51,447,21,17.0,,0.011753196106495596,2,0.5105123430391754,0.0004701332486804649,1.2164419889450073,0.2589946687221527,0.758905291557312,COMPLETE
337,0.2065783590078354,Tanh,Leaky,,63,434,21,18.0,,0.009588009382517972,2,0.6983559186801684,0.00021570082745359898,0.5478214621543884,0.2065783590078354,0.776291012763977,COMPLETE
338,0.2759779095649719,Tanh,Leaky,,66,435,22,18.0,,0.009055445566553454,2,0.4172945767063877,0.00017764360022200473,0.504514753818512,0.2759779095649719,0.6898536682128906,COMPLETE
339,0.20412230491638184,Tanh,Leaky,,63,442,21,19.0,,0.013981150892698387,2,0.7031635842619135,0.00025338616175679,0.669236421585083,0.20412230491638184,0.7796894311904907,COMPLETE
340,0.2403695434331894,Tanh,Leaky,,63,442,21,20.0,,0.014322062496967885,2,0.6115906976843083,0.00021565000807766108,0.46001243591308594,0.2403695434331894,0.7261506915092468,COMPLETE
341,0.20927812159061432,Tanh,Leaky,,64,423,22,19.0,,0.031209032107242542,2,0.6952200350213706,0.00023414482349194097,0.6112082004547119,0.20927812159061432,0.771349310874939,COMPLETE
342,0.304281622171402,Tanh,ReLU,,62,430,23,18.0,,0.017805005308895137,2,0.3590058812290112,0.00015987402588692664,0.4816271960735321,0.304281622171402,0.6806071996688843,COMPLETE
343,0.21258798241615295,Tanh,Leaky,,65,443,21,18.0,,0.013154362322400436,2,0.6686901904561156,0.00018727610577877482,0.553827166557312,0.21258798241615295,0.7533328533172607,COMPLETE
344,0.2576465308666229,Tanh,Leaky,,60,422,21,19.0,,0.02346241753345612,2,0.5269604240994276,0.00024008237924104492,10.53596019744873,0.2576465308666229,0.7346528172492981,COMPLETE
345,0.36010023951530457,Tanh,Tanh,,60,452,21,18.0,,0.01683217653938677,2,0.23663583364575122,0.0002799428975778091,0.7863191366195679,0.36010023951530457,0.5335871577262878,COMPLETE
346,0.2074231058359146,Tanh,Leaky,,62,432,22,17.0,,0.01108976132405223,2,0.7568903632175646,0.00033773081890300607,0.7344955801963806,0.2074231058359146,0.7788600325584412,COMPLETE
347,0.33877402544021606,Tanh,Leaky,,64,412,20,19.0,,0.000353297892855773,2,0.3296917533935223,0.00019412353025635538,0.5910388231277466,0.33877402544021606,0.6752179861068726,COMPLETE
348,0.2648165225982666,Tanh,,,66,438,22,,,0.008669942222274579,1,0.7070711750569203,0.007214504307033183,0.5397923588752747,0.2648165225982666,0.7442868947982788,COMPLETE
349,0.23333384096622467,Tanh,Leaky,,59,208,21,17.0,,0.01292752535224156,2,0.6491130161913387,0.0002821435443773091,0.9060440063476562,0.23333384096622467,0.7431662082672119,COMPLETE
350,0.30455532670021057,Tanh,Leaky,,57,420,20,18.0,,0.01904079744874119,2,0.37236131308618076,0.0001414133673533408,0.5078096985816956,0.30455532670021057,0.6863114833831787,COMPLETE
351,0.3281351625919342,Tanh,Leaky,,61,406,21,17.0,,0.0001814454856731207,2,0.46130508039967955,0.00035256335213721546,0.5446100831031799,0.3281351625919342,0.6982793211936951,COMPLETE
352,0.20238280296325684,Tanh,Leaky,,30,448,20,16.0,,0.007118887752170957,2,0.6849613275243543,0.0002187703590226321,0.41681593656539917,0.20238280296325684,0.7714396715164185,COMPLETE
353,0.20247113704681396,Tanh,Leaky,,29,446,20,9.0,,0.006724231177604752,2,0.6763028988341617,0.00021640097788450504,0.4826793372631073,0.20247113704681396,0.7836817502975464,COMPLETE
354,0.2306618094444275,Tanh,Leaky,,24,448,20,12.0,,0.006814556505245787,2,0.6221642267701326,0.00021367873555143237,0.5099879503250122,0.2306618094444275,0.737399697303772,COMPLETE
355,0.2150682806968689,Tanh,Leaky,,30,453,20,16.0,,0.0059381772031251116,2,0.6596667952064776,0.0001881855227094186,0.8872213363647461,0.2150682806968689,0.7582865953445435,COMPLETE
