number,value,params_activation_1,params_batch_size,params_epochs,params_layer_1,params_learning_rate,params_num_layers,params_train_size,params_weight_decay,user_attrs_mape,user_attrs_mse,user_attrs_r2,state
0,1.068148136138916,Tanh,96,218,4,4.207988669606632e-05,1,0.4582013868952863,0.0024810409748678114,2.3031656742095947,1.068148136138916,0.05761528015136719,COMPLETE
1,1.2096595764160156,Tanh,98,59,5,5.3370327626039544e-05,1,0.5646386642932582,7.068974950624602e-05,2.0596091747283936,1.2096595764160156,0.00862652063369751,COMPLETE
2,1.0468560457229614,Sigmoid,22,325,19,0.0006672367170464204,1,0.18358318781006536,0.0002920433847181409,1.8179045915603638,1.0468560457229614,0.2126917839050293,COMPLETE
3,0.9132094383239746,Sigmoid,25,324,20,0.07286653737491042,1,0.1144846978456873,0.06245139574743072,1.3986681699752808,0.9132094383239746,0.15094369649887085,COMPLETE
4,1.1309258937835693,Sigmoid,55,105,16,0.00010842262717330161,1,0.10741277311947185,0.0433792069749094,1.8580970764160156,1.1309258937835693,0.03266942501068115,COMPLETE
5,0.9418038725852966,Leaky,80,487,23,0.002463768595899745,1,0.7054270142609772,0.03795853142670639,1.323219895362854,0.9418038725852966,0.22766470909118652,COMPLETE
6,0.8718633651733398,Leaky,34,225,14,0.000132965214572995,1,0.560305062386961,0.00026730883107816685,1.7375315427780151,0.8718633651733398,0.27422744035720825,COMPLETE
7,0.8182722330093384,ReLU,28,398,18,0.00672093005015611,1,0.10115491015452849,0.018274508859816022,3.6838254928588867,0.8182722330093384,0.24321871995925903,COMPLETE
8,1.0637764930725098,Sigmoid,66,439,8,0.00017535949529764417,1,0.1989897438445013,1.795698422567761e-05,1.4946694374084473,1.0637764930725098,0.14094042778015137,COMPLETE
9,0.7258478999137878,ReLU,74,103,12,0.012130221181165156,1,0.48647145240701695,0.0017583640270008513,1.5624275207519531,0.7258478999137878,0.3483598828315735,COMPLETE
10,0.7619463205337524,ReLU,53,143,10,0.0267005212249283,1,0.35535684006392254,0.00362403824754904,8.254998207092285,0.7619463205337524,0.3989156484603882,COMPLETE
11,0.7547134160995483,ReLU,50,154,10,0.030140816146116214,1,0.35332893336418875,0.0030385196773828633,2.9377357959747314,0.7547134160995483,0.4067126512527466,COMPLETE
12,0.8504427671432495,ReLU,74,168,11,0.018123389502009382,1,0.34437469870491566,0.006247363182693483,2.575129508972168,0.8504427671432495,0.409689724445343,COMPLETE
13,0.9346055388450623,ReLU,42,57,1,0.09292477109148908,1,0.4085334403008444,0.0014403910932208489,1.2586768865585327,0.9346055388450623,0.21582549810409546,COMPLETE
14,0.6172295212745667,ReLU,81,170,13,0.007521480559113653,1,0.7989400854982043,0.008460541955859567,1.64687180519104,0.6172295212745667,0.2829190492630005,COMPLETE
15,0.7384350299835205,ReLU,85,226,14,0.005598576473073856,1,0.7443668660257697,0.011048841890429291,1.5019780397415161,0.7384350299835205,0.2758585214614868,COMPLETE
16,0.9588636755943298,ReLU,67,297,7,0.0017072141344095578,1,0.7134534178663385,0.010786845740314407,1.2720450162887573,0.9588636755943298,0.23506969213485718,COMPLETE
17,0.7499268651008606,ReLU,88,106,14,0.007317917930011454,1,0.5554603121161996,0.0005922677140279313,1.8704125881195068,0.7499268651008606,0.35086512565612793,COMPLETE
18,1.0338963270187378,Tanh,66,189,23,1.441921723216123e-05,1,0.4894773779636544,0.0011590830495281806,1.1885383129119873,1.0338963270187378,0.086215078830719,COMPLETE
19,0.8030750155448914,Leaky,11,94,12,0.0006098490339611196,1,0.7627771864548374,0.005610538260615647,1.3789299726486206,0.8030750155448914,0.27410244941711426,COMPLETE
20,0.9062249064445496,ReLU,77,264,17,0.011691100847720279,1,0.6158996623138556,0.025735507249165523,1.8106104135513306,0.9062249064445496,0.33054810762405396,COMPLETE
21,0.8343256711959839,ReLU,86,239,14,0.003890863978081623,1,0.7727502498166334,0.012172501785352669,1.5594531297683716,0.8343256711959839,0.2786816358566284,COMPLETE
22,0.8641278743743896,ReLU,87,185,15,0.004867328570454592,1,0.7947232278224929,0.008383817212822747,1.5617871284484863,0.8641278743743896,0.285716712474823,COMPLETE
23,0.9098777770996094,ReLU,71,138,8,0.011446126693143209,1,0.6427054115107973,0.0975067281482226,1.5393279790878296,0.9098777770996094,0.19575411081314087,COMPLETE
24,0.8557359576225281,ReLU,92,201,13,0.0016911899936374254,1,0.6029106795512144,0.018492614507198496,1.5883315801620483,0.8557359576225281,0.3418748378753662,COMPLETE
25,0.7015902400016785,ReLU,81,277,12,0.0033920960644973396,1,0.48688969385520825,0.004858648030951189,1.5744307041168213,0.7015902400016785,0.3746601343154907,COMPLETE
26,0.7033984661102295,ReLU,59,368,10,0.0010360651358520257,1,0.47089383836551457,0.0025008242665185212,1.4900089502334595,0.7033984661102295,0.3773317337036133,COMPLETE
27,0.7610272169113159,Leaky,59,388,5,0.0007468769134096882,1,0.4441591285146401,0.00396794269746618,1.8378300666809082,0.7610272169113159,0.3489760160446167,COMPLETE
28,0.7332990169525146,Tanh,43,345,9,0.001378113345413943,1,0.5036325567775066,0.005488948165773833,1.5519909858703613,0.7332990169525146,0.378181517124176,COMPLETE
29,0.9306183457374573,Tanh,61,269,3,0.00031951625842932985,1,0.43075592226373205,0.0026014825727894747,2.0404019355773926,0.9306183457374573,0.21866780519485474,COMPLETE
30,0.8597202301025391,ReLU,79,353,6,0.0027427556938983914,1,0.6550341503205233,0.0022939394798632945,1.8099333047866821,0.8597202301025391,0.2734314799308777,COMPLETE
31,0.7458952069282532,ReLU,94,298,12,0.0031821526493289536,1,0.5122994409716217,0.0015763596715476227,1.6832501888275146,0.7458952069282532,0.35944437980651855,COMPLETE
32,0.6984911561012268,ReLU,98,389,11,0.0010904595034198728,1,0.47094794014662966,0.0007432078100128081,1.42935049533844,0.6984911561012268,0.38134336471557617,COMPLETE
33,0.7558870315551758,ReLU,99,407,10,0.0009174863016571421,1,0.4001898675509815,0.000857981903815826,1.2654328346252441,0.7558870315551758,0.3853189945220947,COMPLETE
34,0.8238320350646973,ReLU,100,445,16,0.00038515621983402994,1,0.29851940186142684,0.0005301939935993238,3.417191743850708,0.8238320350646973,0.3689846396446228,COMPLETE
35,1.0039949417114258,Sigmoid,93,374,11,0.0016343121444206776,1,0.5909104590358645,0.004290005458618819,2.070708990097046,1.0039949417114258,0.19667726755142212,COMPLETE
36,0.8088431358337402,Tanh,83,428,21,0.0011881734084548965,1,0.6657940886373043,0.002376167546251278,1.5255275964736938,0.8088431358337402,0.29125046730041504,COMPLETE
37,0.7726112604141235,Sigmoid,90,494,8,0.0028795010203605787,1,0.5350155812305929,0.00018082751794973434,1.614964246749878,0.7726112604141235,0.34966808557510376,COMPLETE
38,0.7664016485214233,Leaky,81,312,13,0.0022641703821429074,1,0.5591961441915974,0.0009354989763181109,1.93367600440979,0.7664016485214233,0.36043089628219604,COMPLETE
39,0.6963021755218506,ReLU,96,462,16,0.0009299950015066283,1,0.46008556852715327,0.006934140299379508,1.7304669618606567,0.6963021755218506,0.3898046612739563,COMPLETE
40,0.8587225079536438,ReLU,95,460,19,0.0005856221635821731,1,0.6818667475332675,0.007569267627301173,1.4089438915252686,0.8587225079536438,0.28457266092300415,COMPLETE
41,0.65863037109375,ReLU,90,477,17,0.0013709254650276226,1,0.4574686412089548,0.004109758344311334,1.3566049337387085,0.65863037109375,0.4175775647163391,COMPLETE
42,0.714095413684845,ReLU,97,471,17,0.004323378169720761,1,0.4452174905195547,0.016559584152452213,1.9043545722961426,0.714095413684845,0.39110493659973145,COMPLETE
43,0.7178213596343994,ReLU,90,425,16,0.0018023715892545376,1,0.38600188929574314,0.0044624971143297715,1.5595494508743286,0.7178213596343994,0.4112657904624939,COMPLETE
44,0.7704288363456726,ReLU,100,478,21,0.00041477904587771005,1,0.47085905442587295,0.036388695490051894,1.3612961769104004,0.7704288363456726,0.31799453496932983,COMPLETE
45,0.988944947719574,Sigmoid,83,500,15,0.0010342828165019798,1,0.5260693293316121,0.007216475055894018,2.1775591373443604,0.988944947719574,0.18543797731399536,COMPLETE
46,0.7688937187194824,ReLU,76,458,18,0.002686969709769485,1,0.5948719411086082,0.001751322420735104,1.5983718633651733,0.7688937187194824,0.39267873764038086,COMPLETE
47,0.7492632865905762,ReLU,70,420,15,0.006510723659880191,1,0.3177053976381477,0.0037623696568534013,1.991380214691162,0.7492632865905762,0.4383929967880249,COMPLETE
48,0.7956550121307373,ReLU,96,408,19,0.0002546335332672911,1,0.27135279938734863,0.009768529184300625,1.7947518825531006,0.7956550121307373,0.3321911096572876,COMPLETE
49,0.7576392292976379,Leaky,90,244,11,0.0006502932418471585,1,0.41722657577950156,0.0032879186702711744,1.5058406591415405,0.7576392292976379,0.33372753858566284,COMPLETE
50,0.8301210403442383,ReLU,81,328,13,0.0038861430175226954,1,0.6900703268872821,0.006276102896002285,1.5877233743667603,0.8301210403442383,0.2796841859817505,COMPLETE
51,0.6952725648880005,ReLU,47,377,9,0.001020448980821061,1,0.47249527685558834,0.002136269397969279,1.3202934265136719,0.6952725648880005,0.38838160037994385,COMPLETE
52,0.6667438745498657,ReLU,40,445,11,0.0010978051387237767,1,0.4707021110928992,0.0012569959941698937,1.3533289432525635,0.6667438745498657,0.4097028374671936,COMPLETE
53,0.7458524107933044,ReLU,40,388,9,0.0009060572757691927,1,0.37509518018258436,0.001230862585082115,1.3140078783035278,0.7458524107933044,0.3787499666213989,COMPLETE
54,0.7198150753974915,ReLU,48,451,11,0.0005430107879858037,1,0.5494083894113994,0.0017811589890139527,1.454837679862976,0.7198150753974915,0.3805796504020691,COMPLETE
55,0.7140173316001892,ReLU,32,473,9,0.001356633755393706,1,0.4487517144169225,0.0005137745665188793,13.582101821899414,0.7140173316001892,0.39915889501571655,COMPLETE
56,0.6782775521278381,ReLU,36,440,15,0.0020948582989131336,1,0.40563361985598523,0.0008984040952094005,1.6407688856124878,0.6782775521278381,0.43285834789276123,COMPLETE
57,0.7563825845718384,Sigmoid,37,438,17,0.0018830370886136888,1,0.40857331422694715,0.001431039384494371,1.3731849193572998,0.7563825845718384,0.37526416778564453,COMPLETE
58,0.7378045916557312,ReLU,22,486,16,0.002094343247649467,1,0.35069481257566965,0.0030742603421637683,2.4872519969940186,0.7378045916557312,0.41777926683425903,COMPLETE
59,0.9830217361450195,Tanh,47,463,14,0.00019585474879423514,1,0.6261525377820889,0.01180860956110986,1.9092296361923218,0.9830217361450195,0.22194349765777588,COMPLETE
60,0.6900230646133423,ReLU,25,438,20,0.007755752573473069,1,0.73673082410026,0.007666200423230103,1.4266237020492554,0.6900230646133423,0.2955077886581421,COMPLETE
61,0.6768962144851685,ReLU,23,438,24,0.008927562282395102,1,0.7295323793160737,0.006869559395059637,1.508446216583252,0.6768962144851685,0.2847134470939636,COMPLETE
62,0.6439377665519714,ReLU,20,434,23,0.009038780455194625,1,0.7220038989245571,0.005093191393389652,1.9760587215423584,0.6439377665519714,0.2957068085670471,COMPLETE
63,0.7668566703796387,ReLU,20,440,24,0.008677768099714543,1,0.7513893207687539,0.015273727638402023,1.3045785427093506,0.7668566703796387,0.2670973539352417,COMPLETE
64,0.6600582003593445,ReLU,15,412,22,0.015618554526926363,1,0.7220408173608467,0.008550682534722605,1.397568702697754,0.6600582003593445,0.26628339290618896,COMPLETE
65,0.9177826046943665,ReLU,12,416,23,0.017058392027769216,1,0.710327285306286,0.005443547700629461,1.5273338556289673,0.9177826046943665,0.24373924732208252,COMPLETE
66,0.6323004961013794,ReLU,16,78,24,0.00551400954454535,1,0.7966105010864103,0.024679296936927362,1.245308756828308,0.6323004961013794,0.26122307777404785,COMPLETE
67,0.6567266583442688,Leaky,16,77,24,0.025806857105232027,1,0.7991909361948203,0.02333750762150463,1.3495173454284668,0.6567266583442688,0.22215121984481812,COMPLETE
68,0.8723812103271484,Leaky,18,129,22,0.032596636324512554,1,0.7561059630550553,0.02392577166556049,1.2165918350219727,0.8723812103271484,0.1662169098854065,COMPLETE
69,0.6269972920417786,Leaky,14,75,23,0.006165862617988086,1,0.7991841764862762,0.012859232660902185,1.3692477941513062,0.6269972920417786,0.2619327902793884,COMPLETE
70,0.8923500180244446,Leaky,15,76,22,0.0062244730661940115,1,0.7753646911370846,0.02596596529143806,1.1063438653945923,0.8923500180244446,0.23928362131118774,COMPLETE
71,0.6189708113670349,Leaky,15,52,23,0.005304079280011002,1,0.7954790121676394,0.013299787225003664,1.3198819160461426,0.6189708113670349,0.2740333676338196,COMPLETE
72,0.883101224899292,Leaky,16,78,23,0.004772933298759908,1,0.7938734567120619,0.013105700811512154,1.3198903799057007,0.883101224899292,0.2665577530860901,COMPLETE
73,0.8448783755302429,Leaky,13,55,22,0.014875934797547369,1,0.6530690361359346,0.010384432992652693,1.5642399787902832,0.8448783755302429,0.2729119062423706,COMPLETE
74,0.9343076348304749,Leaky,27,119,24,0.021068519409462142,1,0.700238044594761,0.01943363123696158,1.2047889232635498,0.9343076348304749,0.2034580111503601,COMPLETE
75,0.6259455680847168,Leaky,10,80,21,0.010470989502060657,1,0.7973991536662295,0.013969198318963807,1.5078070163726807,0.6259455680847168,0.2732542157173157,COMPLETE
76,0.9861223101615906,Leaky,10,77,23,0.010104610952633698,1,0.7946844672272995,0.045864752916397834,1.2050307989120483,0.9861223101615906,0.1826290488243103,COMPLETE
77,0.6284271478652954,Leaky,19,93,21,0.00571011585343836,1,0.7969698835927331,0.014438853392667927,1.3254624605178833,0.6284271478652954,0.26548272371292114,COMPLETE
78,0.6208043694496155,Leaky,18,97,21,0.004990503830139044,1,0.7953855298476078,0.014351051461630173,1.3192559480667114,0.6208043694496155,0.2708089351654053,COMPLETE
79,0.8655199408531189,Leaky,20,92,21,0.0058475770679412885,1,0.6736960578717867,0.015016844920031457,1.4496396780014038,0.8655199408531189,0.25955599546432495,COMPLETE
80,0.8245253562927246,Leaky,29,157,20,0.004849304666110167,1,0.6396778878215393,0.01380267160969697,1.4735511541366577,0.8245253562927246,0.31411027908325195,COMPLETE
81,0.6459906697273254,Leaky,17,67,24,0.011905395717267949,1,0.7977660461465769,0.01973567170120361,1.2100712060928345,0.6459906697273254,0.23676055669784546,COMPLETE
82,0.7728347778320312,Leaky,19,65,21,0.010883586361158118,1,0.7437761401711556,0.019103399277142382,1.2187799215316772,0.7728347778320312,0.23884356021881104,COMPLETE
83,0.9581856727600098,Leaky,10,94,23,0.007463221702325846,1,0.7031110667354771,0.03146633173783925,1.3496791124343872,0.9581856727600098,0.20231199264526367,COMPLETE
84,0.7728117108345032,Leaky,13,112,22,0.01345423101876139,1,0.7536280544812914,0.010314186749493153,1.4798152446746826,0.7728117108345032,0.2610171437263489,COMPLETE
85,0.8735572099685669,Leaky,25,64,20,0.00355919708157205,1,0.6910356354431944,0.018571840917338434,1.335068702697754,0.8735572099685669,0.24391311407089233,COMPLETE
86,0.6340310573577881,Leaky,18,52,23,0.010475733392634658,1,0.7989285801197341,0.011666172031916354,1.3390296697616577,0.6340310573577881,0.25924915075302124,COMPLETE
87,0.8464574813842773,Leaky,22,51,21,0.005485789891841516,1,0.6710526813037381,0.00911494795844359,1.5185264348983765,0.8464574813842773,0.2660418152809143,COMPLETE
88,0.8772485256195068,Leaky,14,98,23,0.007409815330505406,1,0.6190774114337667,0.012246906322739315,1.436429738998413,0.8772485256195068,0.346640944480896,COMPLETE
89,0.6985843777656555,Leaky,18,86,19,0.004137308483744135,1,0.7330468845841259,0.015047751476603146,1.2709087133407593,0.6985843777656555,0.27893126010894775,COMPLETE
90,0.8271276354789734,Leaky,29,124,22,0.0032110597041711897,1,0.7740708880567312,0.009666947376667626,1.4607524871826172,0.8271276354789734,0.2896464467048645,COMPLETE
91,0.9172379374504089,Leaky,23,110,24,0.010136811785069894,1,0.7862514537933601,0.03020420101885543,1.1124260425567627,0.9172379374504089,0.21335846185684204,COMPLETE
92,0.7109622359275818,Leaky,17,65,23,0.011489873343885655,1,0.7273314811162273,0.020285630560201048,1.2159748077392578,0.7109622359275818,0.23515385389328003,COMPLETE
93,0.628648042678833,Leaky,20,135,24,0.0054532177772298514,1,0.7998098325925509,0.013523216266872048,1.32073175907135,0.628648042678833,0.2714594006538391,COMPLETE
94,0.859574019908905,Leaky,20,152,21,0.006272359274257896,1,0.6571972540378866,0.015179161837299369,1.4283512830734253,0.859574019908905,0.2797737717628479,COMPLETE
95,0.8771547079086304,Leaky,12,173,20,0.005124320855763557,1,0.6995466202755706,0.0055922394350973546,1.4498207569122314,0.8771547079086304,0.2622731328010559,COMPLETE
96,0.7943041920661926,Tanh,32,141,18,0.008760683970904947,1,0.757907602724286,0.012104540172312281,1.4352139234542847,0.7943041920661926,0.2685965895652771,COMPLETE
97,0.8155723810195923,Leaky,27,105,22,0.003851041075409166,1,0.5827249534473122,0.008323171043691006,1.6742972135543823,0.8155723810195923,0.37340837717056274,COMPLETE
98,0.6715594530105591,Leaky,21,84,2,0.007323695362377146,1,0.7996012703398442,0.01157392521982688,1.8917381763458252,0.6715594530105591,0.2149854302406311,COMPLETE
99,0.8667546510696411,Leaky,14,50,24,0.00255049516065647,1,0.6304105039867737,0.016147375208955095,1.3815025091171265,0.8667546510696411,0.3202276825904846,COMPLETE
100,1.1296823024749756,Sigmoid,24,207,23,0.005596710283809751,1,0.7152410212234767,0.042234155873704014,1.2009966373443604,1.1296823024749756,0.09868550300598145,COMPLETE
101,0.8554071187973022,Leaky,17,67,24,0.013480334619754635,1,0.7619275730827892,0.021941475798449045,1.161971926689148,0.8554071187973022,0.22085386514663696,COMPLETE
102,0.6407737731933594,Leaky,11,131,23,0.009343384606258595,1,0.7988065445513923,0.026669127824677716,1.4376682043075562,0.6407737731933594,0.2458057403564453,COMPLETE
103,0.8203330636024475,Leaky,11,135,23,0.00886598354580546,1,0.7534992513765001,0.025766034931854025,1.231393575668335,0.8203330636024475,0.22708940505981445,COMPLETE
104,0.8809109330177307,Leaky,10,115,21,0.006715496750070846,1,0.6769605876269841,0.016982253337457752,1.425000548362732,0.8809109330177307,0.25357162952423096,COMPLETE
105,0.9560073614120483,Leaky,14,102,22,0.004706847200078298,1,0.719825904343096,0.008646219372267422,1.4020479917526245,0.9560073614120483,0.25675249099731445,COMPLETE
106,0.8041876554489136,Leaky,19,87,23,0.0032967064485919456,1,0.7663669440941073,0.013704177115966816,1.337706208229065,0.8041876554489136,0.2822425961494446,COMPLETE
107,0.777978777885437,Tanh,55,130,22,0.004318275366241495,1,0.7306487070105097,0.030488196133440684,1.7695796489715576,0.777978777885437,0.1882440447807312,COMPLETE
108,0.8406433463096619,Leaky,12,147,24,0.009470849301084303,1,0.6856454769928143,0.006728700901326259,1.4310851097106934,0.8406433463096619,0.25080716609954834,COMPLETE
109,0.8364450931549072,Leaky,63,174,21,0.007685761211290826,1,0.7752137294543918,0.011210033135238757,1.5084261894226074,0.8364450931549072,0.285383403301239,COMPLETE
110,0.6193716526031494,Leaky,15,72,23,0.005781762659031455,1,0.7999654925676737,0.004778037263391401,1.467208743095398,0.6193716526031494,0.28146761655807495,COMPLETE
111,0.7012922167778015,Leaky,15,74,23,0.005540270482783287,1,0.7358214189865738,0.005893449399852154,1.3690203428268433,0.7012922167778015,0.28499168157577515,COMPLETE
112,0.6111375689506531,Leaky,18,100,24,0.006207849634247876,1,0.795555182585011,0.009272482421629754,1.3315951824188232,0.6111375689506531,0.28156012296676636,COMPLETE
113,0.816756010055542,Leaky,16,58,24,0.006169589294510399,1,0.7685459567870805,0.009753891191883239,1.2951456308364868,0.816756010055542,0.2824329137802124,COMPLETE
114,0.8961946368217468,Leaky,18,97,22,0.0039467674585205005,1,0.7942739003901573,0.017047921647461047,1.2606014013290405,0.8961946368217468,0.2574625611305237,COMPLETE
115,0.8093175292015076,Leaky,12,121,24,0.0027173924572571353,1,0.6529029927773156,0.0074636188580722365,1.491518259048462,0.8093175292015076,0.31015920639038086,COMPLETE
116,0.9178929924964905,Leaky,21,86,19,0.012466530436911916,1,0.6960921446065014,0.02441601191842108,1.2019238471984863,0.9178929924964905,0.22056150436401367,COMPLETE
117,0.7997113466262817,Leaky,14,161,5,0.004861857673538273,1,0.753347094515526,0.0138368790581355,1.264684796333313,0.7997113466262817,0.2464277148246765,COMPLETE
118,0.7483450174331665,Sigmoid,10,70,20,0.007434504459748075,1,0.7998259801762798,0.010927294087261515,1.5231045484542847,0.7483450174331665,0.12214529514312744,COMPLETE
119,0.8194881081581116,Leaky,25,104,23,0.003110650003960083,1,0.6080163812425301,0.004804478463626691,1.4856045246124268,0.8194881081581116,0.3814535140991211,COMPLETE
120,0.9077725410461426,Leaky,16,59,22,0.017296957660171707,1,0.6715086582426029,0.021347091266633457,1.4396952390670776,0.9077725410461426,0.2129799723625183,COMPLETE
121,0.9427856802940369,Leaky,18,82,23,0.00954348428356199,1,0.7192029541378093,0.004709304099241205,1.3015550374984741,0.9427856802940369,0.26221418380737305,COMPLETE
122,0.7596426010131836,Leaky,19,92,24,0.006423613137970134,1,0.7523279476837765,0.008258954394209761,1.329824686050415,0.7596426010131836,0.2822832465171814,COMPLETE
123,0.9146087765693665,Leaky,13,114,23,0.008175517074582578,1,0.7087380149328932,0.006594228508667547,1.4413495063781738,0.9146087765693665,0.24876725673675537,COMPLETE
124,0.6231407523155212,Leaky,22,73,22,0.010531473458850625,1,0.7988689552488817,0.009840817874701733,1.3336890935897827,0.6231407523155212,0.2637650966644287,COMPLETE
125,0.8411782383918762,Leaky,22,74,21,0.010912923042493833,1,0.770822713573106,0.012970232817992878,1.227984070777893,0.8411782383918762,0.25946861505508423,COMPLETE
126,0.9575191736221313,Leaky,16,50,22,0.014227912446239959,1,0.793065476468073,0.017223371576219147,1.2280371189117432,0.9575191736221313,0.19599276781082153,COMPLETE
127,0.7471864223480225,Leaky,23,91,6,0.005039291384244049,1,0.7389981567715309,0.01038911120657232,1.284875512123108,0.7471864223480225,0.24558836221694946,COMPLETE
128,0.8150596618652344,Leaky,13,59,24,0.00668893377681014,1,0.6446745328377574,0.008642677021900611,1.5820311307907104,0.8150596618652344,0.28477025032043457,COMPLETE
