number,value,params_activation_1,params_batch_size,params_epochs,params_layer_1,params_learning_rate,params_num_layers,params_train_size,params_weight_decay,user_attrs_mape,user_attrs_mse,user_attrs_r2,state
257,0.23021532595157623,Tanh,86,449,22,0.055557921556308724,1,0.5482674995186537,7.657414627952845e-05,1.1889749765396118,0.23021532595157623,0.7739630937576294,COMPLETE
258,0.22239726781845093,Tanh,96,470,23,0.03160954708503259,1,0.6951790018570033,0.000137074065762287,0.8688601851463318,0.22239726781845093,0.7898026704788208,COMPLETE
259,0.23456324636936188,Tanh,61,458,22,0.0843582072576955,1,0.3924703835475713,9.053065068366289e-05,5.939603805541992,0.23456324636936188,0.7344605922698975,COMPLETE
260,0.20827142894268036,Sigmoid,65,482,21,0.04213929296960307,1,0.7982028492962667,3.970859233626995e-05,0.8626644611358643,0.20827142894268036,0.7841984033584595,COMPLETE
261,0.21220816671848297,Tanh,90,466,24,0.06719618547714216,1,0.7637040014331442,0.00023816418654247116,0.9603196382522583,0.21220816671848297,0.7908862829208374,COMPLETE
262,0.20016834139823914,Tanh,84,473,22,0.05054118472041515,1,0.7224774072506398,6.231452457348582e-05,0.8900197148323059,0.20016834139823914,0.8100053071975708,COMPLETE
263,0.21638017892837524,Tanh,83,475,22,0.0498680589790763,1,0.6553125982239019,5.5137944072013765e-05,13.558130264282227,0.21638017892837524,0.7417004108428955,COMPLETE
264,0.2509535849094391,Tanh,85,488,23,0.0014522547204116809,1,0.38223138808727714,6.348912601587489e-05,1.9192774295806885,0.2509535849094391,0.748281717300415,COMPLETE
265,0.23207074403762817,Tanh,87,453,23,0.057702573778430716,1,0.7170932792728185,3.895321995253737e-05,0.9992886185646057,0.23207074403762817,0.7806735038757324,COMPLETE
266,0.2352714091539383,Tanh,80,444,22,0.09843551415684237,1,0.7994117822603392,0.0001209832154873949,1.0273748636245728,0.2352714091539383,0.7660553455352783,COMPLETE
267,0.19554679095745087,Tanh,83,472,23,0.07595285246282794,1,0.7463512901550439,8.686618446533623e-05,0.9687372446060181,0.19554679095745087,0.8060379028320312,COMPLETE
268,0.4218398332595825,Tanh,82,475,22,0.00022475194261612798,1,0.6196448578636636,9.258642881352703e-05,1.2934614419937134,0.4218398332595825,0.6064503788948059,COMPLETE
269,0.2929143011569977,Tanh,84,486,6,0.03768105031112955,1,0.362866519419986,7.829376253740985e-05,2.612002372741699,0.2929143011569977,0.65403151512146,COMPLETE
270,0.28134220838546753,ReLU,95,463,22,0.08296047487587176,1,0.7326961127386127,0.00018102123992756497,0.8196730613708496,0.28134220838546753,0.7231513261795044,COMPLETE
271,0.23347942531108856,Tanh,98,472,24,0.061014028194083386,1,0.45395472629981815,6.449409114521427e-05,1.363754153251648,0.23347942531108856,0.7348870038986206,COMPLETE
272,0.265551894903183,Tanh,92,482,21,0.04698987342237126,1,0.5149364834725945,0.00016050722511112784,1.091953158378601,0.265551894903183,0.7394309043884277,COMPLETE
273,0.26495811343193054,Tanh,81,461,23,0.07055305033505878,1,0.7048656199988913,0.00021601512491091225,0.926341712474823,0.26495811343193054,0.7576401233673096,COMPLETE
274,0.24231408536434174,Tanh,85,470,22,0.0022771913520228874,1,0.6848417835985643,3.557935981571058e-05,0.7356127500534058,0.24231408536434174,0.7854039072990417,COMPLETE
275,0.20543482899665833,Tanh,76,493,22,0.07997346844612861,1,0.7450178707576449,0.00014096618994816448,0.870757520198822,0.20543482899665833,0.8022878766059875,COMPLETE
276,0.211943581700325,Tanh,93,478,23,0.0982036740601832,1,0.7678791574414173,8.259877053553644e-05,1.29867422580719,0.211943581700325,0.7457761764526367,COMPLETE
277,0.25532039999961853,Tanh,83,457,21,0.05881025084031465,1,0.3480988290929858,5.084758821461921e-05,2.040283203125,0.25532039999961853,0.6740070581436157,COMPLETE
278,0.24398887157440186,Tanh,90,467,23,0.000860056990901068,1,0.7218285638865268,6.903764377688992e-05,1.1754652261734009,0.24398887157440186,0.7859734892845154,COMPLETE
279,0.2426595687866211,Tanh,51,482,24,0.04675348822526506,1,0.5919664284609489,0.00010233151632332395,0.9147471189498901,0.2426595687866211,0.7358484268188477,COMPLETE
280,0.20542004704475403,Tanh,95,454,22,0.033317620042742795,1,0.7633366612470314,0.0002071793956767261,1.2489246129989624,0.20542004704475403,0.796329140663147,COMPLETE
281,0.280392050743103,Tanh,89,435,21,0.06754443191408163,1,0.2732776905602659,0.0001426232282761215,1.2795722484588623,0.280392050743103,0.6857781410217285,COMPLETE
282,0.2427125722169876,Tanh,72,472,22,0.003265868015795073,1,0.6574665387044518,5.825297497513576e-05,1.4411976337432861,0.2427125722169876,0.7792234420776367,COMPLETE
283,0.2122422605752945,Sigmoid,86,463,23,0.08350583470026082,1,0.7447902275352738,3.2482475946064554e-05,0.9328374862670898,0.2122422605752945,0.789172887802124,COMPLETE
284,0.21989881992340088,Tanh,99,490,22,0.05243175590261085,1,0.6962213197039331,0.000179305488904659,0.8157517313957214,0.21989881992340088,0.7990548014640808,COMPLETE
285,0.2212838977575302,Tanh,97,474,23,0.04365316094565001,1,0.7695166550923974,8.827403130491962e-05,0.8571178317070007,0.2212838977575302,0.7816847562789917,COMPLETE
286,0.23393601179122925,Tanh,92,448,21,0.09933812415484779,1,0.7359982638612871,0.00011580259231931706,1.3632051944732666,0.23393601179122925,0.7886062860488892,COMPLETE
287,0.20477022230625153,Tanh,94,459,22,0.05975362078551941,1,0.772748173009411,0.00023605352552943487,1.2737897634506226,0.20477022230625153,0.782922089099884,COMPLETE
288,0.23077601194381714,Tanh,80,484,23,0.0017956127623909208,1,0.7165726753330744,0.0001519856658689734,1.368638515472412,0.23077601194381714,0.7978441715240479,COMPLETE
289,0.24654385447502136,Tanh,87,467,24,0.07224314364077257,1,0.530950483406231,7.757630214923587e-05,1.08359956741333,0.24654385447502136,0.7456446290016174,COMPLETE
290,0.2481444925069809,Tanh,84,441,22,0.035168885498099156,1,0.6782881016980312,0.00012317175826203654,0.8488344550132751,0.2481444925069809,0.7440112829208374,COMPLETE
291,0.2487083226442337,Tanh,96,477,21,0.07767294831990665,1,0.7988227867604776,0.0001843866948981402,0.899150550365448,0.2487083226442337,0.7333523631095886,COMPLETE
292,0.22099755704402924,Tanh,91,496,23,0.056288617403339423,1,0.7420076865206925,5.880569574812638e-05,1.0197151899337769,0.22099755704402924,0.7824229598045349,COMPLETE
293,0.207538440823555,Tanh,82,453,22,0.04140870151305974,1,0.771123653249679,5.050544941735071e-05,1.2492709159851074,0.207538440823555,0.7841323018074036,COMPLETE
294,0.24839450418949127,ReLU,89,466,23,0.025510426192256835,1,0.6336919685551855,9.545005155475836e-05,0.996945321559906,0.24839450418949127,0.7177732586860657,COMPLETE
295,0.2925719916820526,Tanh,86,486,4,0.06637959343798147,1,0.7143263871025645,0.0002602047962188284,2.552232265472412,0.2925719916820526,0.7405558824539185,COMPLETE
296,0.23761393129825592,Tanh,93,457,22,0.08446361532325813,1,0.46953707988246207,6.876998394908325e-05,1.0746824741363525,0.23761393129825592,0.7201246619224548,COMPLETE
297,0.22029231488704681,Tanh,100,432,22,0.05022773387962177,1,0.7992867643467225,0.0001550652471413865,0.9698505997657776,0.22029231488704681,0.7409371733665466,COMPLETE
298,0.6040592193603516,Tanh,88,472,24,1.273588309947581e-05,1,0.7467209744795767,0.00010889995009287505,1.5593373775482178,0.6040592193603516,0.44361042976379395,COMPLETE
299,0.5872601270675659,Tanh,84,450,21,3.002491510237829e-05,1,0.5489724081029337,0.0002071635559950759,1.914690613746643,0.5872601270675659,0.45838993787765503,COMPLETE
300,0.25199031829833984,Tanh,55,478,23,0.09890994018854712,1,0.4162042997185322,0.00012588316407781267,2.5499157905578613,0.25199031829833984,0.745141327381134,COMPLETE
301,0.31719785928726196,Tanh,91,463,21,0.06461646316614379,1,0.21228423423261653,7.333063683983314e-05,0.853990912437439,0.31719785928726196,0.6308698654174805,COMPLETE
302,0.2698582112789154,Tanh,79,486,22,0.00037302371478329727,1,0.7721792332324316,0.00017503224793912942,1.7841264009475708,0.2698582112789154,0.7502695322036743,COMPLETE
303,0.2250661849975586,Tanh,82,444,23,0.04082171963425641,1,0.6848030007855666,0.00022957284935967807,0.7320319414138794,0.2250661849975586,0.7926888465881348,COMPLETE
304,0.198350191116333,Tanh,95,471,22,0.07939776860159614,1,0.723860760850049,2.827235774247693e-05,1.066864252090454,0.198350191116333,0.8003069758415222,COMPLETE
305,0.24299806356430054,Tanh,59,462,22,0.07991644253998649,1,0.71101604919809,2.305699351628273e-05,1.0629316568374634,0.24299806356430054,0.7470861673355103,COMPLETE
306,0.23864085972309113,Tanh,96,469,23,0.0864931051301285,1,0.47990099339564596,4.7715453504696666e-05,1.0520187616348267,0.23864085972309113,0.7491923570632935,COMPLETE
307,0.26419004797935486,Sigmoid,98,450,24,0.06575784246459848,1,0.670619755522525,3.2582099246678544e-05,4.494190692901611,0.26419004797935486,0.7439135313034058,COMPLETE
308,0.2027629017829895,Tanh,85,428,22,0.07254912395599043,1,0.7378792058318121,8.66215254356783e-05,1.0598448514938354,0.2027629017829895,0.7769201993942261,COMPLETE
309,0.5739910006523132,Tanh,86,499,21,7.292062459117041e-05,1,0.7178629630009771,8.698033404180862e-05,1.866550087928772,0.5739910006523132,0.5003394484519958,COMPLETE
310,0.2017449140548706,Tanh,95,440,23,0.08200656227547323,1,0.7417443390766628,5.9056804401846285e-05,0.9975850582122803,0.2017449140548706,0.7996172904968262,COMPLETE
311,0.22426466643810272,Tanh,95,443,24,0.09813229162629643,1,0.688584448881692,2.559760941071368e-05,1.2290642261505127,0.22426466643810272,0.7893577814102173,COMPLETE
312,0.25522926449775696,Tanh,94,479,23,0.08381009382882326,1,0.3312400006151701,5.717432948756728e-05,3.1838245391845703,0.25522926449775696,0.611998975276947,COMPLETE
313,0.24190901219844818,Tanh,97,438,23,0.05552180357188172,1,0.5607450377047573,4.3382828818415543e-05,0.829250156879425,0.24190901219844818,0.7393627166748047,COMPLETE
314,0.19138771295547485,Tanh,90,460,23,0.09949169115680075,1,0.7424031950623132,6.371323069830675e-05,1.3296328783035278,0.19138771295547485,0.794834315776825,COMPLETE
315,0.23312510550022125,Tanh,89,468,24,0.08677407223741385,1,0.6447579650170433,1.6726526184691307e-05,1.007959008216858,0.23312510550022125,0.7677092552185059,COMPLETE
316,0.24344418942928314,Tanh,91,490,23,0.03103248374701701,1,0.45161334593867475,4.8349879363656064e-05,1.8185386657714844,0.24344418942928314,0.7188951969146729,COMPLETE
317,0.2988395392894745,ReLU,87,462,22,0.08394151970520566,1,0.6039890653619675,6.363437221791474e-05,0.9731752276420593,0.2988395392894745,0.6407520771026611,COMPLETE
318,0.21550559997558594,Tanh,99,476,21,0.004121673064261791,1,0.7543518435481265,3.9567704798327084e-05,1.0317630767822266,0.21550559997558594,0.793510377407074,COMPLETE
319,0.21700948476791382,Tanh,95,484,22,0.09755685059721572,1,0.7069609990294625,6.400132450139185e-05,0.8764076232910156,0.21700948476791382,0.7865601778030396,COMPLETE
320,0.23137922585010529,Tanh,89,468,9,0.0553819826262247,1,0.7572393858899665,5.146029570857969e-05,0.9982301592826843,0.23137922585010529,0.7880940437316895,COMPLETE
321,0.2572515904903412,Tanh,91,459,24,0.07010442286121588,1,0.36422608756090047,1.9439996017527327e-05,4.4856367111206055,0.2572515904903412,0.6746749877929688,COMPLETE
322,0.25137510895729065,Tanh,97,477,23,0.048772247632109654,1,0.721073509482907,7.233000487028962e-05,1.0115776062011719,0.25137510895729065,0.7526289224624634,COMPLETE
323,0.21473343670368195,Tanh,87,470,22,0.09988623620678513,1,0.6658547406986929,3.0658874881471756e-05,0.9573766589164734,0.21473343670368195,0.7759867906570435,COMPLETE
324,0.19680315256118774,Tanh,93,449,21,0.06204761002338386,1,0.7686501876828009,5.510970850431949e-05,0.9002911448478699,0.19680315256118774,0.8102395534515381,COMPLETE
325,0.28938668966293335,Tanh,92,457,21,0.06018802688611772,1,0.3090663173727726,3.721704758654459e-05,2.019263982772827,0.28938668966293335,0.6533050537109375,COMPLETE
326,0.3762478232383728,Tanh,89,500,20,0.03760857297383621,1,0.1496744119916742,4.3240051348220536e-05,0.9204906821250916,0.3762478232383728,0.4860668182373047,COMPLETE
327,0.21039995551109314,Tanh,84,450,21,0.04867610201155924,1,0.7669862930183015,0.00010001432237400547,0.9249029159545898,0.21039995551109314,0.7949382066726685,COMPLETE
328,0.20130881667137146,Tanh,90,488,22,0.00684486101251826,1,0.7718048870681327,0.00013230282576663115,0.8104877471923828,0.20130881667137146,0.8030312061309814,COMPLETE
329,0.2376582771539688,Tanh,88,493,21,0.06931587495310938,1,0.48642171924120664,0.00013191722470865777,1.1461468935012817,0.2376582771539688,0.7578920722007751,COMPLETE
330,0.2570476531982422,Tanh,83,483,22,0.005847618376509104,1,0.40337518463112687,0.0001134596531583414,1.3542619943618774,0.2570476531982422,0.7380937337875366,COMPLETE
331,0.2576984465122223,Sigmoid,87,487,20,0.02968592366199033,1,0.38085391312573996,1.2684474946931973e-05,1.9584338665008545,0.2576984465122223,0.6639351844787598,COMPLETE
332,0.24613118171691895,Tanh,90,467,22,0.026573829852179466,1,0.4366670467963032,7.375090432573522e-05,3.4650745391845703,0.24613118171691895,0.7217651009559631,COMPLETE
333,0.25054341554641724,Tanh,85,457,21,0.07127579687249837,1,0.5126980734426769,5.149814856782222e-05,1.0750083923339844,0.25054341554641724,0.7459549903869629,COMPLETE
334,0.4261952042579651,Tanh,93,478,22,0.007454573782172295,1,0.6965521625370082,0.040178892953536854,1.356818675994873,0.4261952042579651,0.6244035959243774,COMPLETE
335,0.19777481257915497,Tanh,90,491,23,0.0029235340209674185,1,0.7684209972440726,0.00013516501249072931,0.9307491183280945,0.19777481257915497,0.8121026754379272,COMPLETE
336,0.40666818618774414,Tanh,86,463,23,0.00023333259225195017,1,0.5821851701731642,0.00010122931977013035,1.3827643394470215,0.40666818618774414,0.6059805154800415,COMPLETE
337,0.21255835890769958,Tanh,94,447,24,0.001760504462856746,1,0.7397087009841395,7.341546245124342e-05,0.9091001152992249,0.21255835890769958,0.8082205653190613,COMPLETE
338,0.26118502020835876,Tanh,83,474,23,0.0023609438322924033,1,0.7211766363766374,0.0041832500088174185,1.008005142211914,0.26118502020835876,0.7715424299240112,COMPLETE
339,0.2384478747844696,Tanh,98,482,23,0.059484639947484354,1,0.799312628177231,5.8560231884770725e-05,1.1146652698516846,0.2384478747844696,0.7699462175369263,COMPLETE
340,0.2884274125099182,Tanh,48,429,22,0.0033086240513945,1,0.2238761620411196,0.0001497153054791731,0.984483540058136,0.2884274125099182,0.6888542175292969,COMPLETE
341,0.2850516736507416,ReLU,88,461,23,0.0001563674826406366,1,0.7620022783726121,4.5992477092515216e-05,1.461233139038086,0.2850516736507416,0.7351873517036438,COMPLETE
342,0.23517002165317535,Tanh,80,495,24,0.04222047553622048,1,0.6904769722793485,2.778413097360328e-05,1.546717882156372,0.23517002165317535,0.7798111438751221,COMPLETE
343,0.3862669765949249,Tanh,96,470,21,0.0009388641869841203,1,0.25984621751848214,0.005733376756883196,1.2545217275619507,0.3862669765949249,0.5873828530311584,COMPLETE
344,0.24255621433258057,Tanh,91,449,23,0.0013047756044097876,1,0.7336988139020463,3.655035808353291e-05,1.0933223962783813,0.24255621433258057,0.7885547876358032,COMPLETE
345,0.46965911984443665,Tanh,100,478,7,0.08279024879768411,1,0.10861530292528439,8.522553291214398e-05,1.351141095161438,0.46965911984443665,0.4220311641693115,COMPLETE
346,0.43798449635505676,Tanh,86,457,22,0.0031736625398193718,1,0.7752074844537585,0.048219628551223206,4.9280853271484375,0.43798449635505676,0.5988495349884033,COMPLETE
347,0.261861652135849,Tanh,93,441,23,0.0025799344154580632,1,0.633305650905325,0.0001591766171351017,0.880108654499054,0.261861652135849,0.7521170377731323,COMPLETE
348,0.257750928401947,Tanh,76,467,22,0.0007155663948282806,1,0.7137168305709856,0.00011260317185394207,1.063810110092163,0.257750928401947,0.7737893462181091,COMPLETE
349,0.22232426702976227,Tanh,89,490,24,0.008815363625007901,1,0.7691210369467277,7.925611092413438e-05,1.10076904296875,0.22232426702976227,0.7603393793106079,COMPLETE
350,0.2970103621482849,Tanh,71,473,21,0.0005607277676868711,1,0.6666280069986638,5.982557688767583e-05,0.9594660997390747,0.2970103621482849,0.731620192527771,COMPLETE
351,0.5340653657913208,Tanh,84,452,22,0.004522872630399551,1,0.2887946548970035,0.09648459468428115,1.6324455738067627,0.5340653657913208,0.44727641344070435,COMPLETE
352,0.2147555649280548,Tanh,82,482,23,0.035227107930169685,1,0.7410561328592432,0.00013549162521016002,0.923321008682251,0.2147555649280548,0.7163431644439697,COMPLETE
353,0.24436822533607483,Tanh,94,461,22,0.06341928873443822,1,0.7999257601080066,0.006873421715853578,1.024652123451233,0.24436822533607483,0.7651525735855103,COMPLETE
354,0.2372385412454605,Tanh,96,466,23,0.024047324186795935,1,0.7041584701113457,0.00010011557938387462,0.9388917088508606,0.2372385412454605,0.7894436120986938,COMPLETE
355,0.32597845792770386,Sigmoid,91,500,21,0.0010609474269182607,1,0.7480416798980097,6.732057916693467e-05,1.5340566635131836,0.32597845792770386,0.6992958188056946,COMPLETE
356,0.20468638837337494,Tanh,87,437,22,0.09949455452533877,1,0.7748936378117023,2.884151221680145e-05,1.336679220199585,0.20468638837337494,0.7909473776817322,COMPLETE
357,0.22452063858509064,Tanh,98,477,24,0.002816067334413567,1,0.7261018455980407,0.00016573199679795146,1.1921343803405762,0.22452063858509064,0.8039937615394592,COMPLETE
358,0.2384091019630432,Tanh,69,448,23,0.021747352365669992,1,0.3149883420602688,0.0002734248723035964,1.3602187633514404,0.2384091019630432,0.6612668037414551,COMPLETE
359,0.4350211024284363,Tanh,78,488,22,0.07770587138071189,1,0.770936045316345,0.02858133183571592,1.9051513671875,0.4350211024284363,0.48396527767181396,COMPLETE
360,0.26617759466171265,Tanh,85,457,21,0.052148397922396665,1,0.33366936890736165,4.042047773278859e-05,2.1390419006347656,0.26617759466171265,0.5968037843704224,COMPLETE
361,0.23319117724895477,Tanh,92,470,22,0.07189467225813229,1,0.49987927306081403,5.1863009615541844e-05,1.0803911685943604,0.23319117724895477,0.7346611618995667,COMPLETE
362,0.252257764339447,Tanh,89,464,24,0.005263495883177977,1,0.41332933704627833,0.00011689781178418403,1.8565014600753784,0.252257764339447,0.7395398616790771,COMPLETE
363,0.23211078345775604,Tanh,95,481,23,0.0038012899690067652,1,0.6751467671775543,9.055208622090614e-05,0.9523401856422424,0.23211078345775604,0.7902679443359375,COMPLETE
364,0.26950013637542725,Leaky,88,456,23,0.04195911285938035,1,0.7991183917194072,0.013664711848810612,0.9980452656745911,0.26950013637542725,0.7107394933700562,COMPLETE
365,0.217612162232399,Tanh,81,472,21,0.05834989629056864,1,0.7442970118465776,6.811977955462452e-05,1.0190753936767578,0.217612162232399,0.7783849239349365,COMPLETE
366,0.2368115484714508,ReLU,90,443,22,0.08479699050260499,1,0.5317853516851742,0.00013875335252292584,1.1414940357208252,0.2368115484714508,0.7246207594871521,COMPLETE
367,0.2287900298833847,Tanh,85,426,22,0.06671271123739149,1,0.7023328581337343,3.4348409109557026e-05,0.8451536893844604,0.2287900298833847,0.7727811932563782,COMPLETE
368,0.2854430079460144,Tanh,93,491,21,0.04701383567847792,1,0.2701255961275083,5.4096821678834285e-05,1.2298702001571655,0.2854430079460144,0.6432380676269531,COMPLETE
369,0.2027788758277893,Tanh,83,481,23,0.09935502309508855,1,0.7550170638438639,2.1793378430147973e-05,1.0802507400512695,0.2027788758277893,0.7777712345123291,COMPLETE
370,0.23282210528850555,Tanh,97,463,20,0.07758761678669333,1,0.5711273999169564,0.00019426878196339626,0.8487293124198914,0.23282210528850555,0.7795776724815369,COMPLETE
371,0.5822597742080688,Tanh,87,158,22,0.00010401544448428044,1,0.36686755152200784,7.88587856907436e-05,5.015140533447266,0.5822597742080688,0.41258037090301514,COMPLETE
372,0.31554779410362244,Tanh,91,451,23,0.03604807894171201,1,0.18182477762764784,0.00016678569476529922,0.9172861576080322,0.31554779410362244,0.6162111163139343,COMPLETE
373,0.24604913592338562,Tanh,95,473,24,0.0550318889037124,1,0.6467048182518125,0.0002535028572943913,1.0399047136306763,0.24604913592338562,0.7531814575195312,COMPLETE
374,0.5656452775001526,Tanh,85,463,22,3.3424701075217727e-05,1,0.292663455239863,0.00011298053443515622,2.0342087745666504,0.5656452775001526,0.409881591796875,COMPLETE
375,0.6286354064941406,Tanh,93,486,21,0.00040160097909428194,1,0.1207919788632938,9.547486724722386e-05,1.3252737522125244,0.6286354064941406,0.4132509231567383,COMPLETE
376,0.24446895718574524,Tanh,66,435,23,0.001557640254054782,1,0.612348065973259,4.3107429160200255e-05,1.9186158180236816,0.24446895718574524,0.7708908319473267,COMPLETE
377,0.2547357380390167,Tanh,88,474,22,0.0641260490242365,1,0.3486008294632186,0.0037520452511285887,2.42608380317688,0.2547357380390167,0.7307643890380859,COMPLETE
378,0.21324054896831512,Tanh,80,453,23,0.08680557116049425,1,0.7993089475117324,6.274916473875179e-05,0.9391731023788452,0.21324054896831512,0.787318766117096,COMPLETE
379,0.22360815107822418,Tanh,90,444,22,0.001866281095878444,1,0.715566669450704,0.00014113093749398706,1.3396766185760498,0.22360815107822418,0.8037998080253601,COMPLETE
380,0.3758434057235718,Sigmoid,98,492,22,0.044029852894866994,1,0.7698621938271175,0.009472905433244394,1.3986796140670776,0.3758434057235718,0.6494532823562622,COMPLETE
381,0.3308538794517517,Tanh,74,467,23,0.07236557991006748,1,0.2304949405851151,0.0001815201522559126,1.212899923324585,0.3308538794517517,0.5730012059211731,COMPLETE
382,0.21963344514369965,Tanh,100,479,24,0.02957852102297914,1,0.7375649415132672,2.6415103716884016e-05,0.8696616291999817,0.21963344514369965,0.7569709420204163,COMPLETE
383,0.2614552676677704,Tanh,83,459,21,0.05412545089385024,1,0.4671894462280108,7.502156446339559e-05,1.193313717842102,0.2614552676677704,0.6944775581359863,COMPLETE
384,0.21228186786174774,Tanh,96,475,22,0.0864823058328793,1,0.6860421245733065,0.00022589793979476222,0.7512456774711609,0.21228186786174774,0.8032344579696655,COMPLETE
385,0.29633453488349915,Tanh,86,453,23,0.0011112546624762328,1,0.7695440186871271,0.017140266692413864,1.1585925817489624,0.29633453488349915,0.7244164943695068,COMPLETE
