number,value,params_activation_1,params_batch_size,params_epochs,params_layer_1,params_learning_rate,params_num_layers,params_train_size,params_weight_decay,user_attrs_mape,user_attrs_mse,user_attrs_r2,state
387,0.813398540019989,Leaky,17,244,23,0.005126014785735476,1,0.6109321191023913,0.0005726610459877252,1.7491610050201416,0.813398540019989,0.3933226466178894,COMPLETE
388,0.6960297226905823,Leaky,73,198,24,0.0015261573011958519,1,0.4294903903218724,0.0008003205685796963,1.779125452041626,0.6960297226905823,0.41315531730651855,COMPLETE
389,0.7607049345970154,Tanh,11,233,23,2.046810989745265e-05,1,0.7995908581186207,0.002130149145243365,1.8970167636871338,0.7607049345970154,0.11966556310653687,COMPLETE
390,0.6981600522994995,Leaky,87,159,24,0.008884181073352433,1,0.28083165007702254,0.003383359991295401,5.315507888793945,0.6981600522994995,0.4224550127983093,COMPLETE
391,0.7198694348335266,Leaky,14,176,23,0.007158561989650997,1,0.39331685842310976,0.0013945845175957355,1.4838883876800537,0.7198694348335266,0.3827933073043823,COMPLETE
392,0.8675212264060974,Leaky,10,257,22,0.010988649926309607,1,0.7217799658951944,0.0010727743582598572,1.8884634971618652,0.8675212264060974,0.25492608547210693,COMPLETE
393,0.721857488155365,Leaky,13,218,24,0.013742062702945246,1,0.7465309218787399,0.005252868618436541,1.3332549333572388,0.721857488155365,0.2873905301094055,COMPLETE
394,0.8185262084007263,Leaky,16,192,24,0.05443893547293938,1,0.2995683886727039,0.0019913290313928753,3.591189384460449,0.8185262084007263,0.20740175247192383,COMPLETE
395,0.6235586404800415,Leaky,12,266,23,0.029288480651145334,1,0.799187867517378,0.002751087749287351,1.4337525367736816,0.6235586404800415,0.22682088613510132,COMPLETE
396,0.7508480548858643,Leaky,21,225,16,0.017220632719634456,1,0.7534649188156549,0.0016816610161318251,1.3536403179168701,0.7508480548858643,0.27400004863739014,COMPLETE
397,0.7637872695922852,Leaky,19,240,24,0.00943192626808143,1,0.7684264028668709,0.0012327837627638344,1.6024242639541626,0.7637872695922852,0.31619107723236084,COMPLETE
398,0.8480232954025269,Leaky,15,248,23,0.00037617828722702305,1,0.10812258033705958,0.0008734768594254418,1.6207594871520996,0.8480232954025269,0.27684688568115234,COMPLETE
399,0.5940774083137512,Leaky,13,185,24,0.0033490956947525136,1,0.7997480621702474,0.0032088109268500016,1.6842514276504517,0.5940774083137512,0.3111764192581177,COMPLETE
400,0.8731956481933594,Leaky,17,214,22,0.004038419370089468,1,0.7123105393483332,0.002271479184448726,1.4305177927017212,0.8731956481933594,0.29793328046798706,COMPLETE
401,0.6846349239349365,Leaky,10,207,24,0.0034351152673512742,1,0.7372910549224698,0.0014822395659032002,1.5613646507263184,0.6846349239349365,0.3003365397453308,COMPLETE
402,0.8522481918334961,Sigmoid,14,188,23,0.0021159511123307836,1,0.7717563208264269,0.001884849530800851,1.3863667249679565,0.8522481918334961,0.2625975012779236,COMPLETE
403,0.7324667572975159,Tanh,12,255,24,0.007159420967442805,1,0.3491262658354385,0.004056382891408616,1.6392419338226318,0.7324667572975159,0.4061620235443115,COMPLETE
404,0.7933480143547058,Leaky,15,235,24,0.0046659722734158976,1,0.7704568571298643,0.0025883530889697277,1.5540103912353516,0.7933480143547058,0.30510908365249634,COMPLETE
405,0.853786051273346,Leaky,27,223,23,0.006593633339659246,1,0.6974237020634352,0.0009823168539916797,1.4181196689605713,0.853786051273346,0.27198326587677,COMPLETE
406,0.7653095722198486,ReLU,12,197,23,8.120060574376211e-05,1,0.7338091534425036,0.0014264605882161612,1.4310832023620605,0.7653095722198486,0.21308106184005737,COMPLETE
407,0.6100042462348938,Leaky,17,244,24,0.002983864380946012,1,0.798378147892929,0.0031428904577863958,1.7058357000350952,0.6100042462348938,0.29272282123565674,COMPLETE
408,0.7008277177810669,Leaky,10,168,23,0.00570233873122145,1,0.3728343681516335,0.0007589888841707839,1.4443676471710205,0.7008277177810669,0.38269442319869995,COMPLETE
409,0.6981832385063171,Leaky,14,264,24,0.013846809874014336,1,0.4508394776666851,0.001166159383591066,1.3895542621612549,0.6981832385063171,0.3720465898513794,COMPLETE
410,0.8122938871383667,Leaky,12,231,22,0.00850191436560699,1,0.6505068462943582,0.001695223916147627,1.7444255352020264,0.8122938871383667,0.2912829518318176,COMPLETE
411,0.7327008843421936,Leaky,16,251,9,0.01135627159783598,1,0.7521839541029115,0.0021190263531342826,1.3931547403335571,0.7327008843421936,0.2938768267631531,COMPLETE
412,0.7535767555236816,Leaky,19,182,24,0.019737567342141618,1,0.7652067469928648,0.0006244739834846429,1.7320246696472168,0.7535767555236816,0.3137010931968689,COMPLETE
413,0.8044759035110474,Leaky,14,206,23,0.015484009019351973,1,0.5351299787892694,0.006347838788373019,2.675008535385132,0.8044759035110474,0.305891215801239,COMPLETE
414,0.9028637409210205,Leaky,11,234,24,0.0012904191724755344,1,0.7160578805945808,0.0024930230587853737,1.5427979230880737,0.9028637409210205,0.2872595191001892,COMPLETE
415,0.7587037086486816,Leaky,13,276,23,0.00182445744548109,1,0.265751493865943,0.0013290433771284095,1.5101300477981567,0.7587037086486816,0.4028295874595642,COMPLETE
416,0.7488513588905334,Tanh,16,258,24,0.012389358659944855,1,0.5072149310281295,0.0004470217591733262,1.6443551778793335,0.7488513588905334,0.35827046632766724,COMPLETE
417,0.6143490076065063,Leaky,10,240,11,0.002651842237114776,1,0.7993231727582712,0.004417704783073335,1.5064219236373901,0.6143490076065063,0.28646320104599,COMPLETE
418,0.7686862349510193,Leaky,18,216,24,0.008398715551215852,1,0.7707494387017325,0.0008996525668552531,1.5916721820831299,0.7686862349510193,0.3216922879219055,COMPLETE
419,0.6131982803344727,Leaky,13,153,22,0.0005664570667366358,1,0.7998454250121072,0.0018502236249763452,1.769569993019104,0.6131982803344727,0.2898451089859009,COMPLETE
420,0.8349472880363464,Leaky,15,247,23,0.00017488822312607108,1,0.30873676512142856,0.001080656572847918,2.9352948665618896,0.8349472880363464,0.35078853368759155,COMPLETE
421,0.65037602186203,Leaky,12,199,10,0.021245139153699667,1,0.12134339223865168,0.0015781795627209441,2.206359386444092,0.65037602186203,0.30595993995666504,COMPLETE
422,0.8254163861274719,Leaky,10,189,24,0.010003204997588043,1,0.33141357265338756,0.003130337061567062,1.7018165588378906,0.8254163861274719,0.39588940143585205,COMPLETE
423,0.8702588677406311,Leaky,14,176,24,0.015662426009066675,1,0.6808871492028536,0.0022268909224434567,1.7385200262069702,0.8702588677406311,0.2631182074546814,COMPLETE
424,0.6973378658294678,Leaky,38,233,23,0.00497074216423509,1,0.7410687555001875,0.0012713136192571968,1.4024112224578857,0.6973378658294678,0.3041725158691406,COMPLETE
425,0.8121227622032166,Leaky,16,226,23,0.01209969230890179,1,0.5902510280981539,0.0036625947377981363,1.3890091180801392,0.8121227622032166,0.33862799406051636,COMPLETE
426,0.636914849281311,Sigmoid,20,265,24,0.007851481078033294,1,0.7998427802797843,0.005333493077576751,1.6038724184036255,0.636914849281311,0.26292306184768677,COMPLETE
427,0.6970152258872986,Leaky,12,254,22,0.017632069847855876,1,0.7477409152448716,0.0003200307111677445,1.5697294473648071,0.6970152258872986,0.2959672212600708,COMPLETE
428,0.7916691899299622,Leaky,14,163,24,0.006392355769674769,1,0.7679511809602171,0.0025677091485440196,1.5955522060394287,0.7916691899299622,0.29826128482818604,COMPLETE
429,0.7411494255065918,ReLU,30,242,23,0.0005001044939510792,1,0.5551937524291783,0.0016769975609613936,2.001584053039551,0.7411494255065918,0.3739049434661865,COMPLETE
430,0.7927277684211731,Tanh,18,396,24,0.0011541452576091726,1,0.239417277764943,0.001955416414165344,1.4639368057250977,0.7927277684211731,0.38307011127471924,COMPLETE
431,0.8438840508460999,Leaky,22,212,23,0.01034854298539998,1,0.20650127563016096,0.0007670282897984959,1.5867611169815063,0.8438840508460999,0.2435479760169983,COMPLETE
432,0.8956325650215149,Leaky,11,185,24,0.014047127507889647,1,0.7106374815306797,0.0010002945754500488,1.5679792165756226,0.8956325650215149,0.27077925205230713,COMPLETE
433,0.7561429142951965,Leaky,15,221,24,0.024234729234444224,1,0.7681923201847087,3.23283268979682e-05,1.4929966926574707,0.7561429142951965,0.32812362909317017,COMPLETE
434,0.6521323919296265,Leaky,13,201,21,0.012360277610345864,1,0.7295969691094214,0.0013404130624237011,1.5161651372909546,0.6521323919296265,0.3085964322090149,COMPLETE
435,0.8545894622802734,Leaky,10,340,23,0.0036924151143708965,1,0.17633089993646134,0.003029747365742567,1.5883209705352783,0.8545894622802734,0.2698674201965332,COMPLETE
436,0.6837189197540283,Leaky,93,250,24,0.008864318359491386,1,0.4956656446980019,0.0006495762843277621,2.0269031524658203,0.6837189197540283,0.4066197872161865,COMPLETE
437,0.7774909734725952,Leaky,17,171,24,0.018136278012192558,1,0.7719540116221663,8.055607167002229e-05,1.4499688148498535,0.7774909734725952,0.31907325983047485,COMPLETE
438,0.5923663973808289,Leaky,12,238,23,0.010700427412379799,1,0.799145282986447,0.0011531321079414677,1.4924522638320923,0.5923663973808289,0.3000497817993164,COMPLETE
439,0.7157019972801208,Leaky,13,241,23,0.014984892065142849,1,0.7423183809481679,0.0011552826760126104,1.5111360549926758,0.7157019972801208,0.2744123935699463,COMPLETE
440,0.577870786190033,Leaky,15,229,24,0.011079509471280119,1,0.7992077337746709,0.0008468684361161406,1.587531328201294,0.577870786190033,0.3082095980644226,COMPLETE
441,0.7045310139656067,Leaky,12,228,24,0.011550932419979926,1,0.48003981370890786,0.0007927375273101374,1.8508120775222778,0.7045310139656067,0.38431316614151,COMPLETE
442,0.8041471242904663,Leaky,15,234,23,0.0006640164394372413,1,0.7717618780068031,0.0005730844590223279,1.5831539630889893,0.8041471242904663,0.3039736747741699,COMPLETE
443,0.8310890793800354,Leaky,11,287,24,0.009809832081079587,1,0.6829196356282656,0.0009494908554007334,1.677681565284729,0.8310890793800354,0.30219072103500366,COMPLETE
444,0.5956586599349976,Tanh,14,222,22,0.010826681883977788,1,0.7998200130550152,0.0008900308757423868,1.3845304250717163,0.5956586599349976,0.2920364737510681,COMPLETE
445,0.6173386573791504,Tanh,14,213,22,0.009524636937892588,1,0.7218145617297801,0.0008427124185382105,1.8690099716186523,0.6173386573791504,0.331784725189209,COMPLETE
446,0.9322261810302734,ReLU,10,220,22,3.97577713732223e-05,1,0.27082039481013104,0.0007029284456778258,2.1905338764190674,0.9322261810302734,0.2149592638015747,COMPLETE
447,0.7145174741744995,Tanh,13,223,22,0.007058156793527992,1,0.13643641029868642,0.0005175038512537685,1.6856203079223633,0.7145174741744995,0.23095840215682983,COMPLETE
448,0.7711913585662842,Tanh,12,228,23,0.01072723024725522,1,0.318471370790262,0.0009894257651574187,1.7719435691833496,0.7711913585662842,0.39101338386535645,COMPLETE
449,0.7035147547721863,Tanh,14,235,23,0.00800968834983858,1,0.750305129207367,0.001165608259202304,1.3715194463729858,0.7035147547721863,0.3263845443725586,COMPLETE
450,0.7795016169548035,Tanh,15,213,21,0.0008937008728872283,1,0.6449409881718118,0.0009460196140348104,1.4382340908050537,0.7795016169548035,0.31926220655441284,COMPLETE
451,0.7679914236068726,Tanh,12,205,23,0.005851148189552538,1,0.7738725671879698,0.0007279162101444501,1.4022420644760132,0.7679914236068726,0.3395903706550598,COMPLETE
452,0.6108992099761963,Tanh,10,240,23,0.00220179818388188,1,0.7998473389774479,0.001159194390914443,1.5587507486343384,0.6108992099761963,0.2930223345756531,COMPLETE
453,0.7022467851638794,Tanh,16,221,8,0.01271571526293612,1,0.4440573249008407,0.001391244316451202,1.9187530279159546,0.7022467851638794,0.39804697036743164,COMPLETE
454,1.0372192859649658,Sigmoid,13,231,22,0.00011462293068078114,1,0.20405034325988522,0.0008685009263307746,1.7839550971984863,1.0372192859649658,0.17842721939086914,COMPLETE
455,0.7228180766105652,Tanh,15,247,24,0.009846002833644342,1,0.5289565087688655,0.0006263324252206668,1.7193715572357178,0.7228180766105652,0.3775092363357544,COMPLETE
456,0.7901669144630432,Leaky,11,210,23,0.013880789146150362,1,0.7429821510822806,0.03103769750115617,1.2369076013565063,0.7901669144630432,0.20431673526763916,COMPLETE
457,0.8198265433311462,Leaky,12,227,24,0.0013048609416790656,1,0.6175389457433674,0.00103500782196813,1.9814817905426025,0.8198265433311462,0.3882051110267639,COMPLETE
458,0.8752771019935608,Leaky,14,237,7,0.007884471599018675,1,0.25199491435150606,0.0015268896579783149,1.9778918027877808,0.8752771019935608,0.35833191871643066,COMPLETE
459,0.868328332901001,Leaky,16,244,24,0.010676628753174223,1,0.7100507290975385,0.0012232002816075416,1.5985499620437622,0.868328332901001,0.29184073209762573,COMPLETE
460,0.7367692589759827,Leaky,10,218,23,0.01499316507537035,1,0.7695046485743203,0.0008438660840912033,1.4860520362854004,0.7367692589759827,0.3362838625907898,COMPLETE
461,0.8321244120597839,Tanh,12,227,24,0.004195641516128545,1,0.10525219718931438,0.0014898594523162227,1.7303752899169922,0.8321244120597839,0.22614890336990356,COMPLETE
462,0.9764941334724426,Leaky,14,196,23,2.1424105693991272e-05,1,0.7742146647087125,0.0010637443008318862,1.5003095865249634,0.9764941334724426,0.163152813911438,COMPLETE
463,0.7075925469398499,Leaky,16,249,22,0.002797021963357988,1,0.2809691229273059,0.000667956521071364,4.817826747894287,0.7075925469398499,0.4214397072792053,COMPLETE
464,0.6445216536521912,Leaky,13,236,24,0.012537472263052959,1,0.797931917399371,0.024436685182634903,1.3953324556350708,0.6445216536521912,0.2372204065322876,COMPLETE
465,0.8246159553527832,Leaky,11,206,19,0.034084293040256564,1,0.3204971237926193,0.0013403967648618028,1.614564061164856,0.8246159553527832,0.2580670118331909,COMPLETE
466,0.6653265953063965,Leaky,17,256,24,0.008959520720392966,1,0.7392065609043238,0.000297048790038137,1.4935147762298584,0.6653265953063965,0.32382941246032715,COMPLETE
467,0.8490107655525208,Leaky,10,241,23,0.006476497475998702,1,0.7007032301401374,0.0008433992950107757,1.592767596244812,0.8490107655525208,0.2839515209197998,COMPLETE
468,0.8180116415023804,Leaky,14,223,24,0.02052386529198299,1,0.7707252335038174,0.0016542261305321283,1.2882606983184814,0.8180116415023804,0.28679388761520386,COMPLETE
469,0.9546495676040649,Leaky,12,214,23,0.011491840286663278,1,0.18905772707830415,0.00047229858842799964,2.3894236087799072,0.9546495676040649,0.2494126558303833,COMPLETE
470,0.5825451612472534,Leaky,15,233,24,0.004675893867460467,1,0.7985837249003788,0.001180948371090153,1.8023067712783813,0.5825451612472534,0.3220566511154175,COMPLETE
471,0.7220213413238525,Leaky,15,232,24,0.004536641991729955,1,0.25539396789766095,0.0018155977519921072,1.723327875137329,0.7220213413238525,0.4085792899131775,COMPLETE
472,0.6681805849075317,Tanh,13,220,23,0.005136610730819824,1,0.4196866361056292,0.0002115789752069093,1.968289852142334,0.6681805849075317,0.39501887559890747,COMPLETE
473,0.6016181111335754,Leaky,12,193,22,0.006028710590231714,1,0.799255523129704,0.00039083694123727864,1.9427756071090698,0.6016181111335754,0.29593902826309204,COMPLETE
474,0.8368052244186401,Leaky,15,230,24,0.007541839156869054,1,0.33622636153759217,0.0012560014924538428,1.616025686264038,0.8368052244186401,0.39904046058654785,COMPLETE
475,0.6551302075386047,Leaky,10,204,23,0.005205126211295548,1,0.7327156052713383,0.0008999006757602442,1.5411968231201172,0.6551302075386047,0.3181192874908447,COMPLETE
476,0.6534612774848938,Leaky,50,236,24,0.007252662061531513,1,0.4644867272182289,0.0014955510528261474,1.5702836513519287,0.6534612774848938,0.40734797716140747,COMPLETE
477,0.7133467793464661,Leaky,13,244,23,0.0035909706405273805,1,0.7538362757308363,0.0010647260332725416,1.521867275238037,0.7133467793464661,0.3252318501472473,COMPLETE
478,0.8795756697654724,Sigmoid,16,211,24,0.009297868707395587,1,0.20972608710873497,0.0020759824778301137,1.4126815795898438,0.8795756697654724,0.3204019069671631,COMPLETE
479,0.8210221529006958,ReLU,14,224,24,0.015491909790342224,1,0.6681745985458803,0.0005535706137226955,1.7127971649169922,0.8210221529006958,0.26414215564727783,COMPLETE
480,0.5860902667045593,Leaky,12,238,23,0.004378465948436319,1,0.7997029849533236,0.0007493370379557268,1.7188465595245361,0.5860902667045593,0.3099285960197449,COMPLETE
481,0.8977841734886169,Leaky,17,216,24,0.09945340327837145,1,0.7524888219277932,0.0006270840543812084,1.1091452836990356,0.8977841734886169,0.006343185901641846,COMPLETE
482,0.7449278235435486,Leaky,14,229,23,0.01370237328033117,1,0.3832266234347263,0.0006893556975455415,1.7860106229782104,0.7449278235435486,0.3613925576210022,COMPLETE
483,0.8342793583869934,Leaky,12,197,23,0.0030059042280267093,1,0.24591182884447157,0.0008666840817491783,1.6883066892623901,0.8342793583869934,0.34484630823135376,COMPLETE
484,0.6244649291038513,Tanh,63,237,22,0.005020177364112254,1,0.7998542711593524,0.0005144883892096637,1.5722914934158325,0.6244649291038513,0.26682937145233154,COMPLETE
485,0.9120001792907715,Leaky,15,188,24,0.0034254728157530425,1,0.7172080555450248,0.001872532682261869,1.7088149785995483,0.9120001792907715,0.28217965364456177,COMPLETE
486,0.7627213597297668,Leaky,10,249,24,0.01708487994585986,1,0.7681279413335904,0.0007509939333282239,1.4002636671066284,0.7627213597297668,0.28980618715286255,COMPLETE
487,0.7545273900032043,Leaky,13,204,23,0.0029926900979455376,1,0.2669296866670972,0.00233139424629504,1.524578332901001,0.7545273900032043,0.4095115065574646,COMPLETE
488,0.7271722555160522,Leaky,16,220,24,0.004335032902761029,1,0.14211074755852096,0.0015611558023121595,5.074893951416016,0.7271722555160522,0.26918673515319824,COMPLETE
489,0.6791430711746216,Leaky,12,230,24,0.001722628639182067,1,0.4244471229870112,0.001056417224448291,1.8484801054000854,0.6791430711746216,0.4158461093902588,COMPLETE
490,0.9020010828971863,Leaky,18,243,22,0.002348340661522802,1,0.18320411777986575,0.031024446935176725,1.3994137048721313,0.9020010828971863,0.31533557176589966,COMPLETE
491,0.7020149827003479,Leaky,14,237,23,0.0003612952155315585,1,0.41507108890859906,0.0007806272677770634,2.898003578186035,0.7020149827003479,0.40468281507492065,COMPLETE
492,0.7206204533576965,Tanh,10,253,24,0.003998675049207331,1,0.5520935628859864,0.001285223711955046,1.7154873609542847,0.7206204533576965,0.38279038667678833,COMPLETE
493,0.7274501323699951,Leaky,13,222,23,0.01163262452532706,1,0.3521495811439144,8.785690788356525e-05,3.0092763900756836,0.7274501323699951,0.40955108404159546,COMPLETE
494,0.9342349767684937,Leaky,16,208,24,0.01974990978335518,1,0.3668610334363072,0.04959401021895269,1.427718162536621,0.9342349767684937,0.2688264846801758,COMPLETE
495,0.8149232864379883,Leaky,12,195,22,0.0008164787777401442,1,0.5712444189595786,0.02088247344149492,1.405641794204712,0.8149232864379883,0.34799033403396606,COMPLETE
496,0.7855404615402222,Leaky,15,246,23,0.0015502082636454848,1,0.7686287603236353,0.0003630652326667379,1.5560299158096313,0.7855404615402222,0.3098576068878174,COMPLETE
497,0.7206472754478455,Leaky,11,230,2,0.005746029133132733,1,0.7258393136466196,0.0005601955801257885,2.1881470680236816,0.7206472754478455,0.20541560649871826,COMPLETE
498,0.6066154837608337,Leaky,14,262,24,0.013737288396710212,1,0.7998914505584814,0.0027535005218027567,1.3519901037216187,0.6066154837608337,0.2864292860031128,COMPLETE
499,0.792635977268219,Leaky,17,182,23,0.0038027695202093844,1,0.1968004204438948,1.3309242353283188e-05,1.546695590019226,0.792635977268219,0.28338491916656494,COMPLETE
