number,value,params_activation_1,params_activation_2,params_activation_3,params_batch_size,params_epochs,params_layer_1,params_layer_2,params_layer_3,params_learning_rate,params_num_layers,params_train_size,params_weight_decay,user_attrs_mape,user_attrs_mse,user_attrs_r2,state
475,0.2185736447572708,Tanh,Leaky,,67,418,20,12.0,,0.018953007860115036,2,0.6963942360612304,0.001203837971227679,0.4315938353538513,0.2185736447572708,0.7589337825775146,COMPLETE
476,0.3219389319419861,Tanh,Leaky,,62,394,20,17.0,,0.009641275814948289,2,0.30441944129814064,0.0005875920124059721,0.5417572259902954,0.3219389319419861,0.6823275685310364,COMPLETE
477,0.329586923122406,Tanh,Leaky,,64,426,20,12.0,,0.015772533344457072,2,0.16577424563064205,0.0038186422001561422,1.4367320537567139,0.329586923122406,0.6051058769226074,COMPLETE
478,0.21042592823505402,Tanh,Leaky,,67,440,11,21.0,,0.02229151505966603,2,0.7608892381266754,0.000781680124725001,0.6090465188026428,0.21042592823505402,0.7858765125274658,COMPLETE
479,0.22009702026844025,ReLU,Leaky,,29,428,20,17.0,,0.0005900246134368091,2,0.6815953076033981,0.0014111176358994045,0.508277952671051,0.22009702026844025,0.7882091999053955,COMPLETE
480,0.2376585751771927,Tanh,Leaky,,62,408,19,18.0,,0.041005188097487065,2,0.7199205830736796,0.0009731886430776641,0.44677281379699707,0.2376585751771927,0.7382943630218506,COMPLETE
481,0.2367706000804901,Tanh,Leaky,,73,490,21,16.0,,0.01154664429910637,2,0.6332676344089035,0.0004901354780188651,0.5398184657096863,0.2367706000804901,0.7554740905761719,COMPLETE
482,0.3626900613307953,Tanh,Sigmoid,,69,417,16,19.0,,0.014364260701062987,2,0.3080296587129586,0.0014960324047926011,0.5419012308120728,0.3626900613307953,0.6481451988220215,COMPLETE
483,0.3237776756286621,Tanh,Leaky,,26,433,17,16.0,,0.06328149408250086,2,0.21788013492281577,0.002244616423747708,0.5936015844345093,0.3237776756286621,0.6334291100502014,COMPLETE
484,0.2957203984260559,Tanh,Leaky,,66,448,20,18.0,,0.00844604539622023,2,0.4220271226783853,0.0006178932518781159,0.5088316798210144,0.2957203984260559,0.700278103351593,COMPLETE
485,0.27917009592056274,Sigmoid,Leaky,,63,399,21,17.0,,0.004019875495556058,2,0.7708378055644529,0.0026107335978275952,0.49724826216697693,0.27917009592056274,0.7348847389221191,COMPLETE
486,0.2767947316169739,Tanh,Leaky,,17,444,20,12.0,,0.02913943602120836,2,0.5844742243388609,0.0008460563824767206,0.6259379386901855,0.2767947316169739,0.7395795583724976,COMPLETE
487,0.37512266635894775,Tanh,Leaky,,31,477,19,17.0,,0.00046657463488022064,2,0.697527875182795,0.09781012387739454,0.6573740243911743,0.37512266635894775,0.6316814422607422,COMPLETE
488,0.3191855549812317,Leaky,Leaky,,60,424,15,18.0,,0.03597119697876957,2,0.28522335105322144,0.00011901771631167645,0.8884395956993103,0.3191855549812317,0.5894988775253296,COMPLETE
489,0.2289372831583023,Tanh,Leaky,,65,500,24,17.0,,0.048021904922153726,2,0.661094644424866,8.360019532122039e-05,3.011753559112549,0.2289372831583023,0.7562661170959473,COMPLETE
490,0.3569486141204834,Tanh,,,78,238,20,,,0.010668268417940252,1,0.18811781729022328,0.00044842054380438617,0.7341720461845398,0.3569486141204834,0.5829424858093262,COMPLETE
491,0.31556856632232666,Tanh,Leaky,,62,486,21,20.0,,0.06572641660678291,2,0.22416256438110338,0.00033997590990258,0.5202003121376038,0.31556856632232666,0.6304003000259399,COMPLETE
492,0.2221280336380005,Tanh,Leaky,,60,408,22,18.0,,0.013152360652350642,2,0.7310754624729066,0.00020074155755310668,0.8386226296424866,0.2221280336380005,0.76368248462677,COMPLETE
493,0.1927243024110794,Tanh,Leaky,,64,437,21,16.0,,0.0063182378560274685,2,0.6828594667160944,0.0010740003103833977,0.6520891785621643,0.1927243024110794,0.8069252371788025,COMPLETE
494,0.2310500144958496,Tanh,Leaky,,65,437,9,14.0,,0.09836837659958683,2,0.6791762133652158,0.0011063502104333542,0.5528651475906372,0.2310500144958496,0.7595000863075256,COMPLETE
495,0.3409934937953949,Tanh,ReLU,,64,442,21,16.0,,0.018759736163499238,2,0.1599243514554493,0.0009198048568659587,0.630921483039856,0.3409934937953949,0.43091821670532227,COMPLETE
496,0.26717761158943176,Tanh,Tanh,,63,431,22,16.0,,0.0066848894525322845,2,0.5545589885522436,0.0001691782743050617,0.979469895362854,0.26717761158943176,0.676889181137085,COMPLETE
497,0.21264779567718506,Tanh,Leaky,,68,449,21,15.0,,0.023225718710720614,2,0.7127960766957396,1.4628581094498933e-05,2.1215806007385254,0.21264779567718506,0.7619000673294067,COMPLETE
498,0.23659184575080872,Tanh,Leaky,,61,420,21,16.0,,0.01549249129107278,2,0.6487009991259776,0.0011879265174897157,1.4122096300125122,0.23659184575080872,0.7580248117446899,COMPLETE
499,0.23130035400390625,Sigmoid,Leaky,,58,467,20,13.0,,0.008347114831458778,2,0.7566388196197711,6.77008220632916e-05,0.6716030836105347,0.23130035400390625,0.7794016003608704,COMPLETE
