number,value,params_activation_1,params_batch_size,params_epochs,params_layer_1,params_learning_rate,params_num_layers,params_train_size,params_weight_decay,user_attrs_mape,user_attrs_mse,user_attrs_r2,state
258,0.8273626565933228,Leaky,20,247,23,0.021922208905225032,1,0.7743939231090567,0.0009659998698891681,1.46113920211792,0.8273626565933228,0.2904716730117798,COMPLETE
259,0.8201897144317627,Leaky,17,257,24,0.08714531663386721,1,0.3930264542501459,0.0005054098010961375,1.9868589639663696,0.8201897144317627,0.287814736366272,COMPLETE
260,0.7395861148834229,Leaky,13,236,23,0.012198152029435947,1,0.4091034920651945,0.0017889118880150033,1.4598121643066406,0.7395861148834229,0.3817483186721802,COMPLETE
261,0.6008598804473877,Leaky,14,220,24,0.016904232255884923,1,0.7984198728169565,0.0034991841213973503,1.261985182762146,0.6008598804473877,0.30083703994750977,COMPLETE
262,0.6853572726249695,Leaky,14,261,23,0.02382869814453739,1,0.7387341585840007,0.0030543168944479823,1.2930644750595093,0.6853572726249695,0.2922287583351135,COMPLETE
263,0.8370610475540161,Leaky,10,229,24,0.01581060386603029,1,0.6851422313463505,0.0034851402619277523,1.5538249015808105,0.8370610475540161,0.22471362352371216,COMPLETE
264,0.8250080943107605,Tanh,12,245,23,0.0360537694350352,1,0.7682224497140306,0.002977597791697862,1.605351209640503,0.8250080943107605,0.21283507347106934,COMPLETE
265,0.5918298363685608,Leaky,15,235,24,0.01808899643898465,1,0.7990529425712228,0.00390840621243439,1.2944214344024658,0.5918298363685608,0.2989542484283447,COMPLETE
266,0.7096110582351685,Leaky,11,219,23,0.01920758909047974,1,0.7436779914403847,0.0025435110738624795,1.3284351825714111,0.7096110582351685,0.2870919108390808,COMPLETE
267,0.9183910489082336,Leaky,13,239,24,0.028105133729552274,1,0.7101085580775917,0.003936857056096636,1.571760892868042,0.9183910489082336,0.22976446151733398,COMPLETE
268,0.8525896668434143,Leaky,15,193,24,0.04398985962072,1,0.7690389374816925,0.002226995336909999,1.5889191627502441,0.8525896668434143,0.23265594244003296,COMPLETE
269,0.8338484764099121,Leaky,13,231,23,0.00014362066776407031,1,0.362866519419986,0.00354867532237656,1.5753744840621948,0.8338484764099121,0.34253519773483276,COMPLETE
270,0.7187756896018982,Leaky,10,209,23,0.009805841361670169,1,0.7414750630021425,0.0026984517442998762,1.5448520183563232,0.7187756896018982,0.2815476059913635,COMPLETE
271,0.8021198511123657,Leaky,16,223,24,0.018512435570446132,1,0.7699533978276017,0.0040849701282421125,1.3736066818237305,0.8021198511123657,0.28820961713790894,COMPLETE
272,0.9543861150741577,Leaky,12,156,1,0.013716508204482124,1,0.5149364834725945,0.0018457236909109453,1.5657691955566406,0.9543861150741577,0.1877550482749939,COMPLETE
273,0.7710262537002563,Leaky,18,249,24,0.023198495389861233,1,0.7707806846660845,0.0015886089760163526,1.293391466140747,0.7710262537002563,0.31908851861953735,COMPLETE
274,0.8084471225738525,Leaky,14,234,24,0.010389937958492981,1,0.658892319454848,0.002118695136038476,2.065229892730713,0.8084471225738525,0.32197046279907227,COMPLETE
275,0.5979637503623962,Leaky,11,241,23,0.008035928017100928,1,0.7987494086864112,0.0011476559325859532,1.737568736076355,0.5979637503623962,0.29039430618286133,COMPLETE
276,0.9129894375801086,Leaky,10,255,23,0.007852616137208222,1,0.719744523187884,0.0011825931648402545,1.5670149326324463,0.9129894375801086,0.2807978391647339,COMPLETE
277,0.7298997640609741,Leaky,12,243,23,0.008054097734323184,1,0.5073465108242035,0.0010881279579292831,2.6827051639556885,0.7298997640609741,0.356847882270813,COMPLETE
278,0.8121820092201233,Leaky,11,216,24,5.254601024597736e-05,1,0.7452188223113254,0.0013512432307333576,1.4639474153518677,0.8121820092201233,0.2059394121170044,COMPLETE
279,0.6001363396644592,Leaky,13,179,24,0.01067464845295788,1,0.7999125433755204,0.0031892124211755847,1.556107997894287,0.6001363396644592,0.289070725440979,COMPLETE
280,0.6322280168533325,Sigmoid,14,174,23,0.009861547868144355,1,0.7993129131663668,0.002854353551465017,1.4602562189102173,0.6322280168533325,0.2611194849014282,COMPLETE
281,0.8552424311637878,Leaky,16,226,24,0.0004007394763385895,1,0.3413535906720514,0.002403828934548184,4.206601619720459,0.8552424311637878,0.40851354598999023,COMPLETE
282,0.8827474117279053,Leaky,13,163,24,0.013438915944690204,1,0.6982628353492977,0.003571877053527508,1.4941740036010742,0.8827474117279053,0.24580997228622437,COMPLETE
283,0.7659631371498108,Tanh,19,184,23,0.010878795528923789,1,0.7656994945864278,6.101597617490979e-05,1.5540332794189453,0.7659631371498108,0.30914169549942017,COMPLETE
284,0.6504718065261841,Leaky,14,247,24,0.008488663698729101,1,0.7285249924020702,0.001432691713904125,1.6523542404174805,0.6504718065261841,0.30716246366500854,COMPLETE
285,0.6112778186798096,Leaky,16,201,23,0.015928019994524634,1,0.7980975327664686,0.0010623358295926131,1.5054516792297363,0.6112778186798096,0.2806272506713867,COMPLETE
286,0.7764462232589722,Leaky,12,258,24,0.0131155476652552,1,0.7655035616198924,0.002192903106142687,1.405213475227356,0.7764462232589722,0.29246336221694946,COMPLETE
287,0.716923713684082,Leaky,10,233,24,0.010539748585387226,1,0.7468010329669902,0.001735431450052119,1.5738158226013184,0.716923713684082,0.2996975779533386,COMPLETE
288,0.7885807156562805,Leaky,13,170,23,0.0017956127623909208,1,0.7715338190075809,0.0012198274719335779,1.4656782150268555,0.7885807156562805,0.31335288286209106,COMPLETE
289,0.8384931683540344,Leaky,18,242,23,9.736097265571783e-05,1,0.5592880059535722,0.0031017824676191144,1.6748021841049194,0.8384931683540344,0.3002857565879822,COMPLETE
290,0.8412359356880188,Leaky,16,221,24,0.016597664515864755,1,0.6342370104446413,0.0008285722240509263,1.8144112825393677,0.8412359356880188,0.3419371247291565,COMPLETE
291,0.5962250828742981,Leaky,14,212,24,0.007431633408929884,1,0.7988986006087955,0.0019275216477208298,1.5876750946044922,0.5962250828742981,0.30077606439590454,COMPLETE
292,0.8324850797653198,Leaky,12,207,24,0.007487325022064722,1,0.6854148316825163,0.002623234667290936,1.6945617198944092,0.8324850797653198,0.2555392384529114,COMPLETE
293,0.5950969457626343,Leaky,10,195,23,0.008581835416458196,1,0.7998693860581382,0.002084628326541029,1.4802802801132202,0.5950969457626343,0.3030815124511719,COMPLETE
294,0.9263912439346313,Leaky,10,193,22,0.0008308064174883303,1,0.7201777837425963,0.0020201918910044783,1.5568280220031738,0.9263912439346313,0.28108644485473633,COMPLETE
295,0.7623317837715149,Tanh,10,203,23,0.0006026408536743373,1,0.7479751202089215,0.00239471024804723,1.4281703233718872,0.7623317837715149,0.26314038038253784,COMPLETE
296,0.772168755531311,Leaky,12,184,23,0.007960879654916006,1,0.7688122729388656,0.0019279257174120272,1.438106894493103,0.772168755531311,0.3112982511520386,COMPLETE
297,0.6090050935745239,Leaky,12,179,23,0.008716860586461948,1,0.7995154631418613,0.002834583282464959,1.4844646453857422,0.6090050935745239,0.28777092695236206,COMPLETE
298,1.1994765996932983,Leaky,75,193,22,1.273588309947581e-05,1,0.4426594568306066,0.0037766745899565405,1.4633970260620117,1.1994765996932983,-0.030634284019470215,COMPLETE
299,0.8546298146247864,Leaky,21,212,23,3.002491510237829e-05,1,0.7426447987596827,0.004712680704207783,1.586734414100647,0.8546298146247864,0.1553821563720703,COMPLETE
300,0.6743959784507751,Leaky,15,160,24,0.009417035574028199,1,0.4162042997185322,0.0018449949434258795,1.7980504035949707,0.6743959784507751,0.4049413800239563,COMPLETE
301,0.8857600092887878,Leaky,10,255,23,0.007293646169934534,1,0.7089289798387522,0.002275760604422507,1.4536625146865845,0.8857600092887878,0.2772250771522522,COMPLETE
302,0.7896677255630493,Leaky,13,273,7,0.054866153288919514,1,0.2752882378789847,0.0005461325618940112,1.7353111505508423,0.7896677255630493,0.271300733089447,COMPLETE
303,0.8086976408958435,Leaky,17,173,24,0.019917873217037252,1,0.7720421812943281,0.003105841886701951,1.4227192401885986,0.8086976408958435,0.2893275022506714,COMPLETE
304,0.6414462924003601,Sigmoid,12,200,23,0.014313935190886692,1,0.7983580559614334,0.0015748486655477259,1.7440950870513916,0.6414462924003601,0.2524465322494507,COMPLETE
305,0.7844712138175964,Leaky,15,248,24,0.011487209825336776,1,0.736005042590089,0.0693399704683565,0.9996196031570435,0.7844712138175964,0.19199210405349731,COMPLETE
306,0.7967699766159058,Leaky,11,147,22,0.009650933500007413,1,0.7680436396172375,0.0013696751174837856,1.4027225971221924,0.7967699766159058,0.29410505294799805,COMPLETE
307,0.808659553527832,Leaky,14,262,24,0.018770922943093828,1,0.5786132000483545,0.0024915491070725444,1.71244215965271,0.808659553527832,0.3441983461380005,COMPLETE
308,0.7437295317649841,Tanh,19,184,23,0.007167122811796578,1,0.5236718412517704,0.0019272451361238543,1.4720568656921387,0.7437295317649841,0.3848465085029602,COMPLETE
309,0.8563770651817322,Leaky,16,229,24,0.00027811724675032935,1,0.6772651818183794,0.004360265234077479,1.5486661195755005,0.8563770651817322,0.2793619632720947,COMPLETE
310,0.8260828256607056,Leaky,10,210,14,0.002181894267780458,1,0.6242577047880674,0.0007032909547915821,1.7065048217773438,0.8260828256607056,0.3393201231956482,COMPLETE
311,0.7774059176445007,Leaky,13,242,18,0.011741781407876184,1,0.7668472663939204,0.0010100995578338089,1.4532502889633179,0.7774059176445007,0.2987617254257202,COMPLETE
312,0.6775838136672974,Leaky,17,166,23,0.016164591043009133,1,0.732151767801069,0.003541816530095657,1.4176112413406372,0.6775838136672974,0.29540157318115234,COMPLETE
313,0.5971900820732117,Leaky,12,191,24,0.009210226418695882,1,0.798507899020951,0.0015591909410253527,1.4520336389541626,0.5971900820732117,0.3037838935852051,COMPLETE
314,0.8325240015983582,Leaky,12,189,22,0.009009567872254098,1,0.24518860019003363,0.0016427662292923587,1.5002872943878174,0.8325240015983582,0.3693990707397461,COMPLETE
315,0.6853856444358826,Leaky,10,179,24,0.0011919668646881779,1,0.474820889669853,0.0012845805264076928,1.561126708984375,0.6853856444358826,0.40129393339157104,COMPLETE
316,0.8401318192481995,Leaky,12,194,23,0.0005150760353453431,1,0.3378443003894831,0.0015091793708669895,2.0154829025268555,0.8401318192481995,0.4099845290184021,COMPLETE
317,0.7562899589538574,Leaky,14,252,24,0.008259844528920023,1,0.7604419166472526,0.001942876430536941,1.4784281253814697,0.7562899589538574,0.29141664505004883,COMPLETE
318,0.7902618050575256,Leaky,40,198,23,0.006884369856953975,1,0.32677045162549684,0.0009386676719036571,1.9401718378067017,0.7902618050575256,0.4200364351272583,COMPLETE
319,0.7112722396850586,Leaky,12,154,24,0.01053508851369526,1,0.44639530116874715,0.002103238824339279,1.834517002105713,0.7112722396850586,0.39216428995132446,COMPLETE
320,0.6445399522781372,Leaky,15,239,23,0.013291992928209975,1,0.7232316357268805,0.0012450261223774211,1.8801496028900146,0.6445399522781372,0.2835177779197693,COMPLETE
321,0.7596587538719177,Tanh,10,173,24,0.009355757895096756,1,0.7707626795142194,0.0016593823049852274,1.528734803199768,0.7596587538719177,0.3348391056060791,COMPLETE
322,0.5987840890884399,Leaky,18,259,24,0.01226905018941162,1,0.7994685655792366,0.002566260830753212,1.4456655979156494,0.5987840890884399,0.289063036441803,COMPLETE
323,0.7684416770935059,Leaky,35,265,24,0.01187545716161695,1,0.154177689270389,0.0024705089597624645,2.012960195541382,0.7684416770935059,0.19898688793182373,COMPLETE
324,0.6010735630989075,Leaky,22,263,24,0.010176356647457186,1,0.7988014240614582,0.0028449834334426634,1.413761854171753,0.6010735630989075,0.29180604219436646,COMPLETE
325,0.7453126311302185,Leaky,20,255,12,0.007678198876778298,1,0.3090663173727726,0.0007287243660237645,3.072303533554077,0.7453126311302185,0.3887549638748169,COMPLETE
326,0.6835680603981018,Leaky,18,282,24,0.01400251604784929,1,0.7435235766959136,0.0008793314953729805,1.5339441299438477,0.6835680603981018,0.30537211894989014,COMPLETE
327,0.8559382557868958,Leaky,17,272,24,0.002516231836058585,1,0.7017135435628897,0.0022223364383984366,1.648660659790039,0.8559382557868958,0.28961431980133057,COMPLETE
328,0.7060520648956299,Leaky,19,297,24,0.011454877519147066,1,0.5520694065660502,0.0006129907696298746,1.3744643926620483,0.7060520648956299,0.39011919498443604,COMPLETE
329,0.8146457672119141,Sigmoid,16,248,23,0.0007945824023436839,1,0.46221593306429176,0.0014615852192297516,1.780108094215393,0.8146457672119141,0.26022785902023315,COMPLETE
330,0.7114884853363037,Leaky,14,239,24,0.006481825178518635,1,0.3081336333931864,0.0010888407313706812,2.9094645977020264,0.7114884853363037,0.43618714809417725,COMPLETE
331,0.754325270652771,Leaky,11,256,13,0.008597842066919052,1,0.7670815184376846,0.0026141094829771738,1.513584017753601,0.754325270652771,0.32538336515426636,COMPLETE
332,0.7118791341781616,Leaky,57,186,23,0.012732846332596508,1,0.3854220054757018,0.001259149091363255,1.7275140285491943,0.7118791341781616,0.40370774269104004,COMPLETE
333,0.6007371544837952,ReLU,16,233,24,0.009905213871084177,1,0.7989979557457797,0.0018882599542421395,1.4719558954238892,0.6007371544837952,0.2849089503288269,COMPLETE
334,0.8047236800193787,Leaky,13,245,24,0.0015969152058064669,1,0.6580193122222459,0.0028879938996094374,1.7008857727050781,0.8047236800193787,0.3280026912689209,COMPLETE
335,0.7225577235221863,Leaky,18,181,23,0.014624687629170912,1,0.7456007471294065,0.0016095713480378355,1.4067384004592896,0.7225577235221863,0.27996504306793213,COMPLETE
336,0.8814699649810791,Tanh,12,164,24,0.012348947879678792,1,0.7141793338883298,0.0008029250800330968,1.4578641653060913,0.8814699649810791,0.2864137887954712,COMPLETE
337,0.724320650100708,Leaky,10,251,23,0.00866426047880323,1,0.368189081472778,0.002242577566001501,1.4915591478347778,0.724320650100708,0.3584384322166443,COMPLETE
338,0.7835994958877563,Leaky,15,230,24,0.006561505745521852,1,0.7682752021138589,0.001035784285238244,1.7553927898406982,0.7835994958877563,0.3052425980567932,COMPLETE
339,0.6099269390106201,Leaky,20,313,23,0.015577226593310503,1,0.7995671710860387,0.0013037804718231678,1.450524091720581,0.6099269390106201,0.28004246950149536,COMPLETE
340,0.6818884015083313,Leaky,14,270,24,0.01080646098883186,1,0.7449362199689028,0.00044362611487017037,1.4512367248535156,0.6818884015083313,0.31836622953414917,COMPLETE
341,0.7107210159301758,Leaky,45,259,22,0.013647389996950435,1,0.4040018532457696,0.0033301165850386765,1.4274487495422363,0.7107210159301758,0.4175216555595398,COMPLETE
342,0.8668515682220459,Leaky,12,243,24,0.029991980912978375,1,0.2020032187532642,2.778413097360328e-05,1.8574306964874268,0.8668515682220459,0.26444268226623535,COMPLETE
343,0.8086655735969543,Leaky,17,191,23,0.017561931859333076,1,0.7707025040049892,0.004267327218018306,1.3993806838989258,0.8086655735969543,0.28663694858551025,COMPLETE
344,0.6419289112091064,Leaky,15,228,24,0.0076678366904873495,1,0.7227759267288862,0.0009392711911230504,1.6452616453170776,0.6419289112091064,0.2998380661010742,COMPLETE
345,0.8197843432426453,Leaky,10,204,22,0.009865372949901476,1,0.577977103032067,0.0017514683318324096,1.9475514888763428,0.8197843432426453,0.3559143543243408,COMPLETE
346,0.811298668384552,Leaky,24,172,23,0.0031736625398193718,1,0.617996229897648,0.001449702916154833,1.660665512084961,0.811298668384552,0.3949347734451294,COMPLETE
347,0.7279373407363892,Leaky,12,248,24,0.011787096631704158,1,0.5124212110174879,1.111873223634774e-05,1.7661160230636597,0.7279373407363892,0.37355589866638184,COMPLETE
348,0.8273983001708984,Tanh,14,235,24,0.0007155663948282806,1,0.7737515197870722,0.0024125451634581093,1.4132920503616333,0.8273983001708984,0.29092663526535034,COMPLETE
349,0.8470697999000549,Leaky,16,178,23,0.025222605649229773,1,0.6886390453409748,0.0011534419537460535,1.683421015739441,0.8470697999000549,0.23828911781311035,COMPLETE
350,0.7414745092391968,Leaky,13,260,23,0.00020997821791835184,1,0.7451235142809514,0.0020155064026861572,1.476973056793213,0.7414745092391968,0.27506929636001587,COMPLETE
351,0.8929678201675415,Leaky,65,213,22,0.01473488910139615,1,0.2887946548970035,0.09648459468428115,1.3173656463623047,0.8929678201675415,0.29233336448669434,COMPLETE
352,0.749914288520813,Leaky,11,224,24,0.009043432225802084,1,0.49791233886365116,0.003093807483097604,1.699324131011963,0.749914288520813,0.3457142114639282,COMPLETE
353,0.7565605044364929,Sigmoid,18,194,24,0.0003155557358219302,1,0.799936653923189,0.0014884569665673715,1.963478922843933,0.7565605044364929,0.1267988681793213,COMPLETE
354,0.7787541747093201,Leaky,14,359,24,0.019248955741669373,1,0.7693612372214872,0.0007680061588072932,1.3714003562927246,0.7787541747093201,0.3040429353713989,COMPLETE
355,0.7245658040046692,Leaky,53,239,23,0.0010609474269182607,1,0.7429300228932247,0.001732534341618196,1.478672981262207,0.7245658040046692,0.28184300661087036,COMPLETE
356,0.7069211602210999,ReLU,21,156,17,0.011495065473425149,1,0.3827972094657705,0.0022197901005686083,1.4536185264587402,0.7069211602210999,0.40744543075561523,COMPLETE
357,0.6093599200248718,Leaky,10,251,15,0.005514374334639872,1,0.7986617773652358,0.00484473132282488,1.5912455320358276,0.6093599200248718,0.28227150440216064,COMPLETE
358,0.7591826915740967,Leaky,16,268,24,0.015143956394141962,1,0.25666748885792695,0.00039333428597240115,1.5778619050979614,0.7591826915740967,0.35837674140930176,COMPLETE
359,0.7079476714134216,Leaky,12,167,23,0.008017405193652448,1,0.4299802367599991,0.000648747890230718,1.5697383880615234,0.7079476714134216,0.39582788944244385,COMPLETE
360,0.8081406354904175,Leaky,14,202,23,0.010224448520151917,1,0.33366936890736165,0.001022061611400494,1.979695439338684,0.8081406354904175,0.3824697732925415,COMPLETE
361,0.8931581974029541,Leaky,12,280,24,0.06504635053012317,1,0.16440518152249142,0.0012650288294756575,1.5045868158340454,0.8931581974029541,0.07527655363082886,COMPLETE
362,0.770491898059845,Tanh,18,240,24,0.021845434001605712,1,0.3524529453624013,0.0008779526059803572,1.9799797534942627,0.770491898059845,0.33269548416137695,COMPLETE
363,0.7424390316009521,Leaky,16,220,23,0.0018879290978214682,1,0.2894490320076513,0.00020729516310619926,1.4454458951950073,0.7424390316009521,0.4077204465866089,COMPLETE
364,0.9155325889587402,Leaky,10,183,24,0.006681841291288303,1,0.7155238908426373,0.0027508237570009796,1.624774694442749,0.9155325889587402,0.26935064792633057,COMPLETE
365,0.6116877198219299,Leaky,13,254,22,0.012801125260271107,1,0.7994810343470219,0.0018542752936519286,1.47709321975708,0.6116877198219299,0.28064894676208496,COMPLETE
366,0.8046654462814331,Leaky,15,246,23,0.01730594663981074,1,0.7632953603183362,0.0014418141203952379,1.565721869468689,0.8046654462814331,0.2632542848587036,COMPLETE
367,0.8442705869674683,Leaky,12,209,24,0.009140603166956822,1,0.6773829513030455,0.003483495670631925,1.5024158954620361,0.8442705869674683,0.28379273414611816,COMPLETE
368,0.809028148651123,Leaky,19,234,24,0.011794711669753318,1,0.7704629904304601,0.00573243132668808,1.3350192308425903,0.809028148651123,0.2894635796546936,COMPLETE
369,0.7145143747329712,Leaky,14,262,23,0.013945008570421243,1,0.740310155981489,0.0024617709163295164,1.4479236602783203,0.7145143747329712,0.27205389738082886,COMPLETE
370,0.8755029439926147,Leaky,10,190,24,0.00740122005307806,1,0.7055993544995777,0.00014385205443291074,1.6162683963775635,0.8755029439926147,0.2725942134857178,COMPLETE
371,0.80820232629776,Leaky,32,225,23,0.01025017330064075,1,0.5910651635344147,0.001177452110791055,1.6212807893753052,0.80820232629776,0.35314691066741943,COMPLETE
372,0.8245940804481506,Leaky,17,176,24,0.015009017438106847,1,0.7760843902212682,0.0020726054123134446,1.410261631011963,0.8245940804481506,0.2844560742378235,COMPLETE
373,0.6905313730239868,Leaky,13,242,24,0.0024170133832196036,1,0.7416191894511402,0.0038256525632287728,1.5707542896270752,0.6905313730239868,0.3137015104293823,COMPLETE
374,0.6102113127708435,Leaky,15,198,23,0.017919721726308725,1,0.7997175420020555,0.0015841374531501804,1.3502603769302368,0.6102113127708435,0.21120685338974,COMPLETE
375,0.7512490153312683,Tanh,11,231,22,0.0060673246755645355,1,0.7666385360164185,0.0029100924204417036,1.3706636428833008,0.7512490153312683,0.33049118518829346,COMPLETE
376,0.6744862198829651,Leaky,20,251,23,0.01205098794434941,1,0.5414160443765881,0.0009463666328989901,1.5304762125015259,0.6744862198829651,0.39324432611465454,COMPLETE
377,0.8708827495574951,Leaky,12,167,24,0.026762036035672617,1,0.2265421481581176,0.0012157622633344719,1.6597411632537842,0.8708827495574951,0.1604042649269104,COMPLETE
378,0.6696867346763611,Leaky,16,216,3,0.008436964287621229,1,0.7993039158417804,0.000711788169964875,1.2481112480163574,0.6696867346763611,0.2240961194038391,COMPLETE
379,0.7136551141738892,Sigmoid,14,145,24,0.0382105108538164,1,0.7313342280912858,0.0018123198516580767,1.4550049304962158,0.7136551141738892,0.2484729290008545,COMPLETE
380,0.8663672208786011,Leaky,10,259,22,0.010257115209372157,1,0.36901524037546285,0.04930812567247221,1.1004259586334229,0.8663672208786011,0.27626627683639526,COMPLETE
381,0.8944360017776489,ReLU,13,185,24,0.07465404313001128,1,0.6539970579815293,0.0022667578798214526,2.1139934062957764,0.8944360017776489,0.13384723663330078,COMPLETE
382,0.9591756463050842,Leaky,18,239,23,1.027481048027031e-05,1,0.7648807595776248,0.001431544660068234,1.3214598894119263,0.9591756463050842,0.14001977443695068,COMPLETE
383,0.6235564351081848,Leaky,84,273,24,0.021540431727110284,1,0.4671894462280108,0.0010537036927070257,1.4485883712768555,0.6235564351081848,0.43156880140304565,COMPLETE
384,0.8474249839782715,Leaky,23,228,23,0.01651656455570925,1,0.6928426530356867,0.004180677336586224,1.4238594770431519,0.8474249839782715,0.2656538486480713,COMPLETE
385,0.7735670208930969,Leaky,12,206,24,0.0009189949171503633,1,0.7676988111944549,0.002625170656962625,1.6292212009429932,0.7735670208930969,0.31421607732772827,COMPLETE
386,0.7454758882522583,Leaky,15,249,24,0.013015704660921511,1,0.29471919339270874,0.001697184804591975,1.9721715450286865,0.7454758882522583,0.42176353931427,COMPLETE
