number,value,params_activation_1,params_batch_size,params_epochs,params_layer_1,params_learning_rate,params_num_layers,params_train_size,params_weight_decay,user_attrs_mape,user_attrs_mse,user_attrs_r2,state
129,0.8607219457626343,Leaky,20,104,22,0.0040085928352768,1,0.679957285004336,0.013195647893013628,1.4222668409347534,0.8607219457626343,0.2768397331237793,COMPLETE
130,0.865967333316803,Tanh,15,83,20,0.019437096958241657,1,0.7674163496927678,0.0284416372609589,1.3005086183547974,0.865967333316803,0.23314785957336426,COMPLETE
131,0.9743291139602661,Leaky,18,71,23,0.009945934592123203,1,0.7203537728913854,0.005810768279917284,1.331152319908142,0.9743291139602661,0.24398767948150635,COMPLETE
132,0.7396345138549805,Leaky,20,289,23,0.008601069241121351,1,0.7427386686431808,0.018849579697522816,1.2286611795425415,0.7396345138549805,0.26576751470565796,COMPLETE
133,0.6014477610588074,Leaky,11,190,24,0.011871524297599436,1,0.7961694062979036,0.004014040197596774,1.4465281963348389,0.6014477610588074,0.28902894258499146,COMPLETE
134,0.8527176380157471,Leaky,11,128,24,0.01227637007581563,1,0.7929049554487989,0.0036506277719500794,1.5834704637527466,0.8527176380157471,0.2867986559867859,COMPLETE
135,0.623781144618988,Leaky,10,187,24,0.0054804626202895595,1,0.7998839996434699,0.0075603043351012335,1.4588501453399658,0.623781144618988,0.2763422131538391,COMPLETE
136,0.7796241641044617,Leaky,14,195,24,0.005848446008337451,1,0.7594546686621894,0.007440875888915395,1.3784793615341187,0.7796241641044617,0.28376638889312744,COMPLETE
137,0.9195260405540466,Leaky,17,59,24,0.0045163485024020365,1,0.7100462524356911,0.009450699956663571,1.4181007146835327,0.9195260405540466,0.2541586756706238,COMPLETE
138,0.8788877725601196,Sigmoid,12,227,21,0.0076889605617905775,1,0.6933205676829982,0.004262692951444762,1.318743348121643,0.8788877725601196,0.24456185102462769,COMPLETE
139,0.7084684371948242,Leaky,71,185,22,0.0034620639061982953,1,0.7390399005925494,0.011625480321993838,1.489001989364624,0.7084684371948242,0.28820258378982544,COMPLETE
140,0.8093445897102356,Leaky,10,98,24,0.005520726064446252,1,0.7729708175610733,0.006467310677455448,1.3645915985107422,0.8093445897102356,0.2972453236579895,COMPLETE
141,0.907227635383606,Leaky,14,136,23,0.015350911921111245,1,0.791979395550084,0.014990351853417598,1.264837622642517,0.907227635383606,0.2162255048751831,COMPLETE
142,0.6244407296180725,Leaky,12,204,23,0.010774412956948217,1,0.7977463928023796,0.010003559482417967,1.5255835056304932,0.6244407296180725,0.26579415798187256,COMPLETE
143,0.7754368782043457,Leaky,16,210,23,0.011775271438919247,1,0.7525164358848092,0.008002486962092019,1.254215955734253,0.7754368782043457,0.26524531841278076,COMPLETE
144,0.608464777469635,Leaky,12,184,22,0.006940835114869385,1,0.7965382428063392,0.011417981494552497,1.2844316959381104,0.608464777469635,0.2886609435081482,COMPLETE
145,0.6598500609397888,Leaky,12,180,22,0.0065228077492300515,1,0.7256689434871718,0.009530482822786282,1.4190542697906494,0.6598500609397888,0.29297226667404175,COMPLETE
146,0.8130702972412109,Leaky,10,220,21,0.004705373909278502,1,0.7654572614329204,0.014598081224402775,1.2329323291778564,0.8130702972412109,0.27066105604171753,COMPLETE
147,0.6117411851882935,Leaky,15,169,24,0.006909529183833685,1,0.7994677582061275,0.005113088784944783,1.4648568630218506,0.6117411851882935,0.2889951467514038,COMPLETE
148,0.8751181364059448,Leaky,13,198,24,0.0069087493118455655,1,0.6983079056542486,0.003273279768148282,1.4014548063278198,0.8751181364059448,0.2556816339492798,COMPLETE
149,0.7141702771186829,Leaky,15,165,22,0.008089781568012008,1,0.7382371089070029,0.005476948295705396,1.453582525253296,0.7141702771186829,0.2741135358810425,COMPLETE
150,0.884955644607544,Leaky,10,192,4,0.014042180510303877,1,0.6675067690267263,0.007187950874340865,1.459641456604004,0.884955644607544,0.22832971811294556,COMPLETE
151,0.6219269633293152,Leaky,16,172,24,0.005571252681809515,1,0.7983893304779764,0.010180064291667507,1.3828798532485962,0.6219269633293152,0.2798882722854614,COMPLETE
152,0.6176294088363647,Leaky,13,178,24,0.004033670036407567,1,0.7996740857225791,0.010325710812104861,1.3974617719650269,0.6176294088363647,0.2818254828453064,COMPLETE
153,0.7742218375205994,Leaky,13,171,23,0.003945386854086922,1,0.76052210267614,0.009542495743342701,1.4248597621917725,0.7742218375205994,0.292156457901001,COMPLETE
154,0.7928241491317749,Leaky,15,153,24,0.006907369816157004,1,0.7669653295630093,0.006274521570326512,1.4321116209030151,0.7928241491317749,0.29335933923721313,COMPLETE
155,0.9205513596534729,Leaky,12,255,23,0.004396914887424686,1,0.7153345904844806,0.0041112576144732875,1.4164042472839355,0.9205513596534729,0.2692562937736511,COMPLETE
156,0.7315792441368103,Leaky,18,208,22,0.0028791705816795083,1,0.7473147038580802,0.007801444079981845,1.4245858192443848,0.7315792441368103,0.28673070669174194,COMPLETE
157,0.5889900922775269,Leaky,14,178,24,0.009954487413260566,1,0.7957822453689442,0.0026912186335683384,1.3842188119888306,0.5889900922775269,0.30221056938171387,COMPLETE
158,0.8902217149734497,Leaky,14,183,24,0.011387225863968257,1,0.704649931692609,0.0028590083690693637,1.50715970993042,0.8902217149734497,0.25687509775161743,COMPLETE
159,0.8159028887748718,Leaky,10,178,24,0.00977076354302036,1,0.7731698453416953,0.005490106398833673,1.3937455415725708,0.8159028887748718,0.2764814496040344,COMPLETE
160,0.5999711155891418,Leaky,12,165,23,0.008215441098077075,1,0.7974753411779834,0.004700211022611452,1.4117681980133057,0.5999711155891418,0.29261457920074463,COMPLETE
161,0.6580110192298889,Leaky,12,165,23,0.007978756368370987,1,0.7278955929577132,0.0047182566420527735,1.5324236154556274,0.6580110192298889,0.3036220669746399,COMPLETE
162,0.8412556648254395,Leaky,51,189,24,0.006269932070941594,1,0.7928422232575185,0.003739952688735041,1.60133957862854,0.8412556648254395,0.2992374897003174,COMPLETE
163,0.6065261960029602,Leaky,16,203,23,0.008639071653318117,1,0.7974464305259481,0.00244489310795055,1.4428473711013794,0.6065261960029602,0.2962645888328552,COMPLETE
164,0.7496370673179626,Leaky,16,199,23,0.008721424200238814,1,0.7547081869425993,0.002359080222758167,1.4429875612258911,0.7496370673179626,0.2917998433113098,COMPLETE
165,0.5990514159202576,Leaky,17,168,24,0.016807959565781443,1,0.7987664454042608,0.0020410047953482425,1.5382393598556519,0.5990514159202576,0.30164992809295654,COMPLETE
166,0.6992038488388062,Leaky,17,165,24,0.013822559405551934,1,0.7403465706859796,0.002713141852724924,1.4807207584381104,0.6992038488388062,0.293987512588501,COMPLETE
167,0.7711746096611023,Tanh,15,147,24,0.016458108520628005,1,0.5788309866168336,0.0031847622356184304,1.476845622062683,0.7711746096611023,0.39333343505859375,COMPLETE
168,0.6005232334136963,Leaky,13,214,23,0.020385483201819973,1,0.7986429697941447,0.0018525848163422995,1.2927310466766357,0.6005232334136963,0.28936904668807983,COMPLETE
169,0.870303213596344,Leaky,17,229,24,0.01959774813639804,1,0.6783845204790314,0.001954919710838038,1.6836820840835571,0.870303213596344,0.25274890661239624,COMPLETE
170,0.8532029390335083,Leaky,21,214,23,0.029856207023628296,1,0.6352073904065142,0.0021827180287456492,1.6929993629455566,0.8532029390335083,0.3102806806564331,COMPLETE
171,0.805194616317749,Leaky,13,188,23,0.016473996903723583,1,0.7674043143970619,0.002873801201058412,1.5510610342025757,0.805194616317749,0.28194522857666016,COMPLETE
172,0.739453136920929,Leaky,68,175,24,0.022219183339753326,1,0.7650951697101481,0.0015449497458022144,1.6152491569519043,0.739453136920929,0.3340946435928345,COMPLETE
173,0.6042300462722778,Leaky,12,202,23,0.01186051201757829,1,0.7985068098881657,0.0018057867459025012,1.5837501287460327,0.6042300462722778,0.29700344800949097,COMPLETE
174,0.6023389101028442,Leaky,15,237,22,0.02328887039768396,1,0.7991992662242837,0.0017007316166028753,1.4261746406555176,0.6023389101028442,0.3000115156173706,COMPLETE
175,0.6671948432922363,Leaky,15,232,22,0.02204982764736749,1,0.7288059648972441,0.0017959269902770706,1.412362813949585,0.6671948432922363,0.28059375286102295,COMPLETE
176,0.7480106353759766,Sigmoid,18,160,22,0.0280756669252557,1,0.49641624799141454,0.002381409830017922,1.841450572013855,0.7480106353759766,0.34731876850128174,COMPLETE
177,0.8376039266586304,Leaky,14,218,23,0.042551183686608436,1,0.7611223901532219,0.001351148202921605,1.4484378099441528,0.8376039266586304,0.22647196054458618,COMPLETE
178,0.6059957146644592,Leaky,16,237,22,0.013315216405639034,1,0.7998079113838268,0.001973771570077816,1.5248618125915527,0.6059957146644592,0.29380083084106445,COMPLETE
179,0.8979847431182861,Leaky,15,236,22,0.017446696186939926,1,0.7053712612956364,0.0019730929256628845,1.5965451002120972,0.8979847431182861,0.23291438817977905,COMPLETE
180,0.6876396536827087,Leaky,17,254,23,0.012803907158903815,1,0.7347133072101347,0.0016990403556346781,1.3678675889968872,0.6876396536827087,0.28242337703704834,COMPLETE
181,0.7968792915344238,Leaky,19,200,22,0.02439900605060754,1,0.7718292668238069,0.0025560703149611385,1.2118579149246216,0.7968792915344238,0.304420530796051,COMPLETE
182,0.5968369245529175,Leaky,16,179,23,0.014791936672355725,1,0.7988643755910437,0.0021293759063116834,1.297412633895874,0.5968369245529175,0.29168379306793213,COMPLETE
183,0.832935631275177,Leaky,12,177,23,0.01954518468528229,1,0.7667674973390213,0.002045372252536295,1.5392600297927856,0.832935631275177,0.21233093738555908,COMPLETE
184,0.5913622379302979,Leaky,16,245,24,0.014784678917739404,1,0.7966405506187185,0.0016413338318885579,1.3307029008865356,0.5913622379302979,0.29746705293655396,COMPLETE
185,0.9336479306221008,Leaky,13,248,23,0.01746837871770895,1,0.21674292638375275,0.001131450710024848,1.8271427154541016,0.9336479306221008,0.28484147787094116,COMPLETE
186,0.7209358811378479,Leaky,44,275,24,0.014424355140963178,1,0.5283627165530342,0.0014946141050586285,1.6096175909042358,0.7209358811378479,0.3838197588920593,COMPLETE
187,0.5934348702430725,Leaky,14,220,23,0.014603295831638271,1,0.7998445350530821,0.0017833014296577286,1.4881105422973633,0.5934348702430725,0.30409568548202515,COMPLETE
188,0.6784110069274902,Leaky,78,239,23,0.015141153438831571,1,0.7345922558967799,0.0016829074182918874,1.5195528268814087,0.6784110069274902,0.2796894907951355,COMPLETE
189,0.7088542580604553,Leaky,14,224,24,0.024242922023796232,1,0.746791762865901,0.002198908763411861,1.5754534006118774,0.7088542580604553,0.29458290338516235,COMPLETE
190,0.8988560438156128,Leaky,16,263,23,0.013592101359623897,1,0.7039133959475375,0.0013591618894901144,1.4353586435317993,0.8988560438156128,0.2523430585861206,COMPLETE
191,0.620154082775116,Leaky,12,214,22,0.011651260528322037,1,0.7982337999876489,0.0032509481604753895,1.602049469947815,0.620154082775116,0.2575755715370178,COMPLETE
192,0.8044817447662354,Leaky,13,214,22,0.019767679515064977,1,0.766822067582612,0.0031970914341055106,1.5922719240188599,0.8044817447662354,0.27236413955688477,COMPLETE
193,0.5879301428794861,Leaky,11,202,24,0.01199187992860473,1,0.7952902119255454,0.0026446338854590086,1.4985400438308716,0.5879301428794861,0.30398041009902954,COMPLETE
194,0.5896549224853516,Leaky,11,196,24,0.012618735560167607,1,0.7993884451570313,0.0024083939633628847,1.6612329483032227,0.5896549224853516,0.3176151514053345,COMPLETE
195,0.6693518161773682,Leaky,59,203,24,0.013223377536390243,1,0.43651935874766434,0.0019172280312495132,3.483736276626587,0.6693518161773682,0.41917622089385986,COMPLETE
196,0.7809785604476929,Leaky,11,195,24,0.016672429891984995,1,0.7704039960531128,0.0024708616725006363,1.3925179243087769,0.7809785604476929,0.3059181571006775,COMPLETE
197,0.7046008110046387,Leaky,11,185,24,0.01148712926771506,1,0.7406856665572158,0.0027306181284139255,1.5770978927612305,0.7046008110046387,0.29171979427337646,COMPLETE
198,0.7804578542709351,Leaky,14,206,24,0.00949651130405884,1,0.7665017606610719,0.0016041121370866096,1.6042879819869995,0.7804578542709351,0.307003378868103,COMPLETE
199,0.9026219844818115,Tanh,10,221,23,0.020529406297696482,1,0.7197454540758091,0.002138765452736286,1.4384098052978516,0.9026219844818115,0.2923949360847473,COMPLETE
200,0.5763736963272095,Leaky,12,242,23,0.014993577323340918,1,0.7962911929746803,0.0018781516094193995,1.3234471082687378,0.5763736963272095,0.3042648434638977,COMPLETE
201,0.7946286201477051,Leaky,13,247,23,0.014709867196471441,1,0.772023997957096,0.0017999848034410786,1.5906575918197632,0.7946286201477051,0.30356645584106445,COMPLETE
202,0.5866416692733765,Leaky,12,238,24,0.00891880584805577,1,0.796349567853303,0.0013012562563221048,1.6020121574401855,0.5866416692733765,0.3045696020126343,COMPLETE
203,0.597231924533844,Leaky,12,239,24,0.012705151960191723,1,0.7987312048372542,0.0012736040156005836,1.6666600704193115,0.597231924533844,0.2959177494049072,COMPLETE
204,0.5895500779151917,Leaky,11,239,24,0.012214740082595706,1,0.7990025088963043,0.0010362799651787281,1.4924577474594116,0.5895500779151917,0.2815368175506592,COMPLETE
205,0.699918270111084,Leaky,10,241,24,0.01703791020110501,1,0.7416244217944221,0.001099514942622881,1.5666584968566895,0.699918270111084,0.30408215522766113,COMPLETE
206,0.5915051698684692,Leaky,12,261,24,0.013010911537011515,1,0.7998553035530998,0.001150541820779437,1.4672365188598633,0.5915051698684692,0.28137463331222534,COMPLETE
207,0.7800160646438599,Leaky,12,262,24,0.012305059982055984,1,0.7629049616990201,0.0009751279439216203,1.7765564918518066,0.7800160646438599,0.2797369360923767,COMPLETE
208,0.7630950212478638,Leaky,11,234,23,0.01357657793077303,1,0.5647587213944621,0.0012821270311588796,1.4600110054016113,0.7630950212478638,0.37194347381591797,COMPLETE
209,0.7913990020751953,Leaky,12,253,24,0.010689661424031402,1,0.3179250580767008,0.0011860938606505626,1.831061840057373,0.7913990020751953,0.3953288793563843,COMPLETE
210,0.7910172343254089,Leaky,11,229,24,0.017883759312683944,1,0.3608439583724306,0.0014070140543143786,3.1377615928649902,0.7910172343254089,0.39309489727020264,COMPLETE
211,0.5815278887748718,Leaky,14,249,24,0.009918109508991966,1,0.7958550168006653,0.0008699257021033859,1.3112647533416748,0.5815278887748718,0.31276923418045044,COMPLETE
212,0.5749698281288147,Leaky,14,245,23,0.01208456503537788,1,0.7994506378018755,0.0008066561638626898,1.606053113937378,0.5749698281288147,0.3258490562438965,COMPLETE
213,0.7279137969017029,Leaky,14,243,23,0.014802940339918108,1,0.3864715905069295,0.0008302612032690276,1.5779210329055786,0.7279137969017029,0.39607149362564087,COMPLETE
214,0.7629703283309937,Leaky,10,265,23,0.011480959737740173,1,0.7681867254998117,0.0007010270253736832,1.5702089071273804,0.7629703283309937,0.3151754140853882,COMPLETE
215,0.6728993654251099,Leaky,13,253,23,0.009427787194187805,1,0.7404083801964182,0.0009381229055838604,1.3820821046829224,0.6728993654251099,0.3102431893348694,COMPLETE
216,0.6147540807723999,Leaky,16,281,24,0.012494642958366381,1,0.7980002423789193,0.0011024505387407454,1.457145094871521,0.6147540807723999,0.2793230414390564,COMPLETE
217,0.7442718744277954,Leaky,12,245,23,0.025145152274374343,1,0.11761553978749503,0.0015986661114498423,2.5840930938720703,0.7442718744277954,0.28888362646102905,COMPLETE
218,0.7868713140487671,Leaky,14,236,24,0.0153003877720384,1,0.7660393464175702,0.0013005849869995947,1.5689469575881958,0.7868713140487671,0.28630131483078003,COMPLETE
219,0.9028486609458923,Leaky,10,226,23,0.00935939137073932,1,0.7165075132269765,0.0019468415852442822,1.6512196063995361,0.9028486609458923,0.2734397053718567,COMPLETE
220,0.619458794593811,Sigmoid,16,255,24,0.019140753310139758,1,0.7997709400504927,0.0023692343929048168,1.5866786241531372,0.619458794593811,0.274399995803833,COMPLETE
221,0.6014205813407898,Leaky,14,220,24,0.011145248956776791,1,0.7985504910242521,0.0015201583516890173,1.7560642957687378,0.6014205813407898,0.2863752245903015,COMPLETE
222,0.7739543318748474,Leaky,12,219,24,0.011260206263374635,1,0.7660961030458293,0.001615591354219969,1.6416352987289429,0.7739543318748474,0.30679017305374146,COMPLETE
223,0.6009232997894287,Leaky,14,235,24,0.013456258555044518,1,0.7995910430927807,0.0011128069024020964,1.8323509693145752,0.6009232997894287,0.2964913845062256,COMPLETE
224,0.7119167447090149,Leaky,14,239,24,0.013261723517664772,1,0.7485125182030552,0.001036132731321594,1.5671173334121704,0.7119167447090149,0.29615432024002075,COMPLETE
225,0.7792428135871887,Leaky,16,230,24,0.016645110835890944,1,0.7682193144503114,0.0014092965261389347,1.5543124675750732,0.7792428135871887,0.30948811769485474,COMPLETE
226,0.7073851823806763,Leaky,14,247,23,0.021914977332419632,1,0.48908213216475194,0.0008225297770937621,1.5597692728042603,0.7073851823806763,0.37362855672836304,COMPLETE
227,0.6073831915855408,Leaky,17,222,24,0.013081357691730288,1,0.7995740752605353,0.0012748620819117667,1.5981168746948242,0.6073831915855408,0.2848673462867737,COMPLETE
228,0.7419918179512024,Leaky,14,260,23,0.010460970568723707,1,0.5389598917226046,0.0018940512351232923,1.8145264387130737,0.7419918179512024,0.3634271025657654,COMPLETE
229,0.6370335221290588,Leaky,12,236,24,0.015514064110680098,1,0.7265867502318046,0.0010767530522404803,1.6319152116775513,0.6370335221290588,0.3186032772064209,COMPLETE
230,0.755303680896759,Leaky,10,208,24,0.03329072106241976,1,0.7421891752487462,0.0015229585426336362,1.4360413551330566,0.755303680896759,0.1819857954978943,COMPLETE
231,0.6039791703224182,Leaky,17,218,24,0.012255310483706849,1,0.7980229368372226,0.0013283367808713225,1.4534540176391602,0.6039791703224182,0.28913670778274536,COMPLETE
232,0.6135104298591614,Leaky,15,270,24,0.01193693993953574,1,0.7989900317185443,0.002175993496760818,1.6364285945892334,0.6135104298591614,0.27106648683547974,COMPLETE
233,0.7611157298088074,Leaky,17,214,23,0.00894996134906621,1,0.7702219139069807,0.00096116887729093,1.3458112478256226,0.7611157298088074,0.3240525722503662,COMPLETE
234,0.8028941750526428,Leaky,13,226,24,0.01497532694748911,1,0.7669167452899704,0.0017182598705342506,1.6227585077285767,0.8028941750526428,0.2620472311973572,COMPLETE
235,0.7732858657836914,Leaky,15,194,23,0.018551899339656213,1,0.7699638523835429,0.002676012646987388,1.239315152168274,0.7732858657836914,0.32160043716430664,COMPLETE
236,0.5950018763542175,Leaky,19,243,24,0.010909935482978802,1,0.799190028055354,0.0012306787242074844,1.4481570720672607,0.5950018763542175,0.2948506474494934,COMPLETE
237,0.696402907371521,Leaky,19,245,24,0.012816760678409748,1,0.7425442087676064,0.0007371977938868763,1.5824991464614868,0.696402907371521,0.3028106689453125,COMPLETE
238,0.7833771705627441,Leaky,13,240,24,0.010738517803255394,1,0.7726526248487202,0.0012318842107488634,1.7185158729553223,0.7833771705627441,0.3161999583244324,COMPLETE
239,0.8743014931678772,Leaky,12,232,24,0.015340356949656199,1,0.7018431825093723,0.0014604505905180772,1.4596904516220093,0.8743014931678772,0.2715338468551636,COMPLETE
240,0.6043146848678589,Leaky,17,252,24,0.01046430719596391,1,0.7993327858274912,0.001140170262079948,1.5875904560089111,0.6043146848678589,0.2875758409500122,COMPLETE
241,0.5985122323036194,Leaky,18,253,24,0.01082112165283788,1,0.7988368197661501,0.0011366505913519489,1.6163856983184814,0.5985122323036194,0.2810162305831909,COMPLETE
242,0.6066035628318787,Leaky,18,253,24,0.010590150102730227,1,0.7997776078856951,0.0009454323557557263,1.6299151182174683,0.6066035628318787,0.28840285539627075,COMPLETE
243,0.6928774118423462,Leaky,14,247,24,0.00969402142891947,1,0.7456900644687448,0.0011764103224423507,1.4213461875915527,0.6928774118423462,0.3099585175514221,COMPLETE
244,0.8068971633911133,Leaky,17,259,24,0.012190004673484862,1,0.775793195468016,0.0011054032823887506,1.660341501235962,0.8068971633911133,0.29897189140319824,COMPLETE
245,0.7237722873687744,Leaky,11,276,24,0.008747163301657682,1,0.7437831492835166,0.0006203062664002637,1.6634938716888428,0.7237722873687744,0.2737986445426941,COMPLETE
246,0.6904557347297668,Leaky,19,224,23,0.02149097301217632,1,0.45697499308879735,0.0013859398307078407,1.3721853494644165,0.6904557347297668,0.3705647587776184,COMPLETE
247,0.6036851406097412,Leaky,15,266,24,0.01632400833493088,1,0.7998384780172721,0.0008744934126579367,1.3887429237365723,0.6036851406097412,0.28371989727020264,COMPLETE
248,0.7726108431816101,Leaky,14,266,23,0.016600976654679515,1,0.7676088228746367,0.0008549929498848022,1.4834924936294556,0.7726108431816101,0.309811532497406,COMPLETE
249,0.6860652565956116,Leaky,10,213,24,0.018930758247499287,1,0.7259394621519631,0.0007406712450240557,1.7086001634597778,0.6860652565956116,0.2125091552734375,COMPLETE
250,0.5956075191497803,Tanh,12,242,24,0.01404045585351835,1,0.7989251847573922,0.001726112001366674,1.5786365270614624,0.5956075191497803,0.29500913619995117,COMPLETE
251,0.6939374208450317,Tanh,15,242,24,0.015815202127978992,1,0.42503206914885433,0.0009754640088067375,1.6678892374038696,0.6939374208450317,0.3717002272605896,COMPLETE
252,0.7204568982124329,Tanh,13,287,24,0.013805265876110197,1,0.7540100961286818,0.0016242744233656888,1.560487151145935,0.7204568982124329,0.31840699911117554,COMPLETE
253,0.791976809501648,Tanh,15,269,24,0.026021273792271055,1,0.26475959307470615,0.001303571939867489,1.5869367122650146,0.791976809501648,0.3597325086593628,COMPLETE
254,0.7972795367240906,Tanh,12,232,24,0.019258850880317223,1,0.5979588806510251,0.001529967947593256,1.8819185495376587,0.7972795367240906,0.36398613452911377,COMPLETE
255,0.7737560868263245,Tanh,12,250,23,0.014293640643801767,1,0.7674044214091783,0.0008242289674042455,1.4511033296585083,0.7737560868263245,0.3104006052017212,COMPLETE
256,0.6902327537536621,Leaky,15,239,24,0.001429233958480055,1,0.4798710273915699,0.0006634028726815172,1.7261006832122803,0.6902327537536621,0.4069616198539734,COMPLETE
257,0.9164398908615112,Sigmoid,10,226,24,0.008249075297240435,1,0.718799207298543,0.0021206722186028577,1.4006658792495728,0.9164398908615112,0.2844401001930237,COMPLETE
