number,value,params_activation_1,params_batch_size,params_epochs,params_layer_1,params_learning_rate,params_num_layers,params_train_size,params_weight_decay,user_attrs_mape,user_attrs_mse,user_attrs_r2,state
0,1.1723301410675049,Tanh,96,218,4,4.207988669606632e-05,1,0.4582013868952863,0.0024810409748678114,1.673295497894287,1.1723301410675049,-0.15640580654144287,COMPLETE
1,0.8356426954269409,Tanh,98,59,5,5.3370327626039544e-05,1,0.5646386642932582,7.068974950624602e-05,1.3365156650543213,0.8356426954269409,0.21450740098953247,COMPLETE
2,0.5221473574638367,Sigmoid,22,325,19,0.0006672367170464204,1,0.18358318781006536,0.0002920433847181409,1.132546067237854,0.5221473574638367,0.45840030908584595,COMPLETE
3,0.6805701851844788,Sigmoid,25,324,20,0.07286653737491042,1,0.1144846978456873,0.06245139574743072,1.2599549293518066,0.6805701851844788,0.3720877170562744,COMPLETE
4,1.1478548049926758,Sigmoid,55,105,16,0.00010842262717330161,1,0.10741277311947185,0.0433792069749094,1.0795029401779175,1.1478548049926758,-0.06054818630218506,COMPLETE
5,0.342858225107193,Leaky,80,487,23,0.002463768595899745,1,0.7054270142609772,0.03795853142670639,1.26983642578125,0.342858225107193,0.7021281719207764,COMPLETE
6,0.5004595518112183,Leaky,34,225,14,0.000132965214572995,1,0.560305062386961,0.00026730883107816685,1.6152993440628052,0.5004595518112183,0.5305960178375244,COMPLETE
7,0.4183284640312195,ReLU,28,398,18,0.00672093005015611,1,0.10115491015452849,0.018274508859816022,2.0187816619873047,0.4183284640312195,0.6208838224411011,COMPLETE
8,0.6022337079048157,Sigmoid,66,439,8,0.00017535949529764417,1,0.1989897438445013,1.795698422567761e-05,1.1115647554397583,0.6022337079048157,0.3752697706222534,COMPLETE
9,0.2516736388206482,ReLU,74,103,12,0.012130221181165156,1,0.48647145240701695,0.0017583640270008513,0.9287704825401306,0.2516736388206482,0.7591007947921753,COMPLETE
10,0.2559066712856293,ReLU,53,143,10,0.0267005212249283,1,0.35535684006392254,0.00362403824754904,4.7660231590271,0.2559066712856293,0.7367811799049377,COMPLETE
11,0.25243327021598816,ReLU,50,154,10,0.030140816146116214,1,0.35332893336418875,0.0030385196773828633,2.82560658454895,0.25243327021598816,0.731850266456604,COMPLETE
12,0.26386505365371704,ReLU,74,168,11,0.018123389502009382,1,0.34437469870491566,0.006247363182693483,3.203209638595581,0.26386505365371704,0.7253056764602661,COMPLETE
13,0.566869854927063,ReLU,42,57,1,0.09292477109148908,1,0.4085334403008444,0.0014403910932208489,1.9599531888961792,0.566869854927063,0.451160192489624,COMPLETE
14,0.26267287135124207,ReLU,81,170,13,0.007521480559113653,1,0.7989400854982043,0.008460541955859567,0.9230019450187683,0.26267287135124207,0.7491745948791504,COMPLETE
15,0.2666878402233124,ReLU,11,258,9,0.0016651843278623977,1,0.262445590653426,0.0007054382978969138,1.192703366279602,0.2666878402233124,0.7106367945671082,COMPLETE
16,0.2712831497192383,ReLU,67,141,6,0.02473611720952045,1,0.2859194443173659,0.0012146426764433754,1.4327256679534912,0.2712831497192383,0.7162083387374878,COMPLETE
17,0.25569161772727966,ReLU,44,100,15,0.0057638269763561675,1,0.49867741340987076,0.011072448678802882,1.153146505355835,0.25569161772727966,0.7573337554931641,COMPLETE
18,0.7817237973213196,Tanh,58,209,12,1.7153925205497972e-05,1,0.5742231821323024,0.003982898916785526,1.5128228664398193,0.7817237973213196,0.2536187171936035,COMPLETE
19,0.301327109336853,Leaky,89,310,7,0.0441316972840006,1,0.42006358242441727,0.017883344135712822,7.786687850952148,0.301327109336853,0.7014830708503723,COMPLETE
20,0.45251962542533875,ReLU,44,114,2,0.011979647960385826,1,0.6727457967612802,0.0005234312934955064,2.3700716495513916,0.45251962542533875,0.5836193561553955,COMPLETE
21,0.26428908109664917,ReLU,43,93,15,0.005022994376518759,1,0.49316963035707667,0.010690500113671803,1.1134670972824097,0.26428908109664917,0.748399019241333,COMPLETE
22,0.28011566400527954,ReLU,62,82,17,0.013282169988846675,1,0.4877265297330461,0.002453484287818803,1.1084095239639282,0.28011566400527954,0.7233405709266663,COMPLETE
23,0.45543643832206726,ReLU,52,170,12,0.04111834324236489,1,0.3724749264778991,0.09751071174994365,2.2914066314697266,0.45543643832206726,0.5390771627426147,COMPLETE
24,0.25086748600006104,ReLU,36,117,21,0.003936693195721117,1,0.4771809673821574,0.005452520623493093,1.4529502391815186,0.25086748600006104,0.7589327096939087,COMPLETE
25,0.27001795172691345,ReLU,73,141,24,0.0024805835857070525,1,0.32231972973961565,0.0017557022435081913,4.074911117553711,0.27001795172691345,0.7227375507354736,COMPLETE
26,0.27313345670700073,ReLU,34,192,20,0.013637861847668544,1,0.4049166322987091,0.004688750174124541,3.0533955097198486,0.27313345670700073,0.7319749593734741,COMPLETE
27,0.33080464601516724,Leaky,11,131,10,0.0006012847905242794,1,0.42332816025494296,0.0009347463354382333,8.548980712890625,0.33080464601516724,0.6770308613777161,COMPLETE
28,0.26119881868362427,Tanh,36,258,21,0.04412023518509862,1,0.30196763445965646,0.0027109483806494355,1.5004745721817017,0.26119881868362427,0.7049954533576965,COMPLETE
29,0.3728289306163788,Tanh,50,225,3,0.0036252635317416413,1,0.4548350251913619,0.00169659887753061,3.986626625061035,0.3728289306163788,0.6291900873184204,COMPLETE
30,0.28654539585113525,ReLU,63,50,22,0.007871195946229134,1,0.386074570177826,0.0054673044861595485,2.790618896484375,0.28654539585113525,0.7155719995498657,COMPLETE
31,0.2812010943889618,ReLU,48,86,14,0.004507543961060216,1,0.49941847852732757,0.015207143282676161,1.5617856979370117,0.2812010943889618,0.7332454323768616,COMPLETE
32,0.2780967056751251,ReLU,40,114,16,0.009895089040083413,1,0.5606484890056105,0.007182778071567072,0.9086548686027527,0.2780967056751251,0.7386327981948853,COMPLETE
33,0.25660064816474915,ReLU,89,78,8,0.023544715193325155,1,0.4505285649805853,0.003429157713785262,1.9036915302276611,0.25660064816474915,0.7458943128585815,COMPLETE
34,0.32286399602890015,ReLU,19,184,5,0.001000395263934179,1,0.5377980088374363,0.010359766988010962,1.3455679416656494,0.32286399602890015,0.6966879367828369,COMPLETE
35,0.3428448438644409,Sigmoid,30,113,18,0.00566928503706887,1,0.6198268652274896,0.002401554223708173,1.31562340259552,0.3428448438644409,0.680147647857666,COMPLETE
36,0.4225448668003082,Tanh,47,71,15,0.015751595678865082,1,0.4824971707757202,0.033784509822857474,1.6814501285552979,0.4225448668003082,0.5931425094604492,COMPLETE
37,0.594257116317749,Sigmoid,57,356,11,0.0033822507022745205,1,0.6003651261600516,0.02616782987331703,1.4481439590454102,0.594257116317749,0.43527501821517944,COMPLETE
38,0.28652262687683105,Leaky,19,159,13,0.007206238744422841,1,0.5246538336518823,0.01204033115278657,1.2318257093429565,0.28652262687683105,0.7304669618606567,COMPLETE
39,0.33842357993125916,ReLU,38,121,19,0.06841083561592647,1,0.4419483735379007,0.02042360801686009,2.250572919845581,0.33842357993125916,0.6333680748939514,COMPLETE
40,0.2667180299758911,ReLU,28,196,17,0.01154037597233375,1,0.6386162034277304,0.006029911377463156,1.117196798324585,0.2667180299758911,0.7463067770004272,COMPLETE
41,0.262967973947525,ReLU,53,150,10,0.02670278590455054,1,0.35195356102943615,0.004198787184138083,2.058746099472046,0.262967973947525,0.7295276522636414,COMPLETE
42,0.2580571472644806,ReLU,60,98,9,0.019540426590738593,1,0.36386791338202373,0.002643466855683118,3.5464510917663574,0.2580571472644806,0.7345390319824219,COMPLETE
43,0.2672041356563568,ReLU,70,140,11,0.034292236922555876,1,0.3296410872049278,0.007879139625880792,11.793802261352539,0.2672041356563568,0.7138030529022217,COMPLETE
44,0.2564864754676819,ReLU,46,234,8,0.00814441153408642,1,0.3985226247624745,0.0018332666364896963,4.569276809692383,0.2564864754676819,0.7478553056716919,COMPLETE
45,0.31903275847435,Sigmoid,99,67,14,0.06377116423931888,1,0.5409029920887573,0.003747600347749597,1.2701821327209473,0.31903275847435,0.7004803419113159,COMPLETE
46,0.27881962060928345,ReLU,56,99,10,0.018384292780926584,1,0.24582187373380274,0.0011404154073465444,1.0939432382583618,0.27881962060928345,0.7106605172157288,COMPLETE
47,0.27782610058784485,ReLU,32,295,6,0.035295542391771455,1,0.3772298781449429,0.007493714787472015,4.607050895690918,0.27782610058784485,0.715786874294281,COMPLETE
48,0.236937016248703,Leaky,40,179,12,0.009907371406540548,1,0.4589606003330442,0.0004996677956857664,1.575089931488037,0.236937016248703,0.7598775625228882,COMPLETE
49,0.24112172424793243,Leaky,38,183,12,0.00546640877019483,1,0.4575032497346097,0.00036463725169478536,1.4515033960342407,0.24112172424793243,0.7616443037986755,COMPLETE
50,0.26691189408302307,Leaky,22,250,13,0.010056584766680528,1,0.4385294063168788,0.00034073934245773383,17.82183265686035,0.26691189408302307,0.7285165786743164,COMPLETE
51,0.24437148869037628,Leaky,38,177,12,0.005495846245693048,1,0.47832093566413336,0.000249888724642048,1.1093600988388062,0.24437148869037628,0.7644280791282654,COMPLETE
52,0.2495681494474411,Leaky,40,176,12,0.003753876337919942,1,0.46287018643584676,0.00017540690678538985,1.3905922174453735,0.2495681494474411,0.7535033226013184,COMPLETE
53,0.2457830011844635,Leaky,38,488,12,0.0034753604177562465,1,0.4666943158221023,0.00017339681704076047,1.5056228637695312,0.2457830011844635,0.7536170482635498,COMPLETE
54,0.25358113646507263,Leaky,38,493,12,0.002230065819298547,1,0.5745440337874874,0.00015259596444897242,0.8552951216697693,0.25358113646507263,0.7556053400039673,COMPLETE
55,0.2541967034339905,Leaky,26,356,14,0.0040572225360485225,1,0.4633928498530271,0.00015516863676104958,1.06838059425354,0.2541967034339905,0.742073118686676,COMPLETE
56,0.255761057138443,Leaky,33,451,11,0.005662307041497746,1,0.5247436485438258,0.00047744322910649265,0.982559084892273,0.255761057138443,0.7580650448799133,COMPLETE
57,0.2539918124675751,Leaky,39,211,13,0.003327608590824851,1,0.6819855215351491,0.00020141599667554638,0.8219504356384277,0.2539918124675751,0.7680425643920898,COMPLETE
58,0.26536691188812256,Leaky,42,283,9,0.0017374420795430597,1,0.41031836472175237,9.424102436389269e-05,2.9220528602600098,0.26536691188812256,0.7435030937194824,COMPLETE
59,0.2455643117427826,Leaky,35,241,16,0.005094193855197498,1,0.4355742170174525,0.00028521355234143467,3.017011880874634,0.2455643117427826,0.7584567070007324,COMPLETE
60,0.24598786234855652,Leaky,23,239,16,0.002824918784373562,1,0.4336400849297311,0.00033608272586073374,2.3712966442108154,0.24598786234855652,0.7593421339988708,COMPLETE
61,0.2443772405385971,Leaky,23,243,16,0.0026999786830863965,1,0.4327872131143711,0.00036145269392517796,2.3130836486816406,0.2443772405385971,0.760320246219635,COMPLETE
62,0.24833019077777863,Leaky,22,240,16,0.0028180147947468475,1,0.42696574733025916,0.00031915685483445595,5.022794246673584,0.24833019077777863,0.7544368505477905,COMPLETE
63,0.2526249587535858,Leaky,18,208,17,0.005589883711552361,1,0.5102032811714875,0.0004618647467415187,0.9803383350372314,0.2526249587535858,0.7626638412475586,COMPLETE
64,0.24903586506843567,Leaky,15,275,16,0.002197949987978722,1,0.41245145524466387,0.00024031412767579782,1.9232105016708374,0.24903586506843567,0.7557944059371948,COMPLETE
65,0.2647550404071808,Leaky,25,270,15,0.007340869267401375,1,0.392413560513799,0.0006906598447539697,6.639564514160156,0.2647550404071808,0.7302162647247314,COMPLETE
66,0.2648037374019623,Leaky,28,331,15,0.001362729673530202,1,0.44109777025237407,0.00037507437879848865,1.414019227027893,0.2648037374019623,0.741611123085022,COMPLETE
67,0.2547348141670227,Leaky,30,199,18,0.002880057138438932,1,0.4817065585743969,0.0002815293991424356,1.0163688659667969,0.2547348141670227,0.7526717185974121,COMPLETE
68,0.2538749873638153,Leaky,35,219,12,0.004539005339545584,1,0.3798941181798486,0.0006355001813239334,2.334852695465088,0.2538749873638153,0.7443510293960571,COMPLETE
69,0.24787300825119019,Leaky,14,243,14,0.009491779499984023,1,0.5648295150183366,0.0008535528373382291,0.7419532537460327,0.24787300825119019,0.7657751441001892,COMPLETE
70,0.2546044588088989,Leaky,32,402,13,0.0052753789095286024,1,0.515764832880549,0.00011303856691428834,0.9931192398071289,0.2546044588088989,0.7431508302688599,COMPLETE
71,0.23342271149158478,Leaky,16,243,14,0.00880257442976611,1,0.5862779824986585,0.0008660381282204678,0.8647510409355164,0.23342271149158478,0.7754126787185669,COMPLETE
72,0.2507479786872864,Leaky,23,230,14,0.006546159291994315,1,0.471763821967305,0.00022535845257417493,1.207736611366272,0.2507479786872864,0.7533155083656311,COMPLETE
73,0.2559482753276825,Leaky,16,183,17,0.013601243340960212,1,0.590329976560107,0.0004078945593867332,0.9956200122833252,0.2559482753276825,0.7358800768852234,COMPLETE
74,0.24036303162574768,Leaky,13,293,16,0.0044419298732752965,1,0.5430423334229016,0.0005300105528033049,1.085951328277588,0.24036303162574768,0.7612197399139404,COMPLETE
75,0.24732114374637604,Leaky,10,264,11,0.009188308690735234,1,0.5482829667452492,0.0005664798105547431,2.0614473819732666,0.24732114374637604,0.7670310139656067,COMPLETE
76,0.24411745369434357,Leaky,12,305,18,0.004319405463636057,1,0.6132633815075277,0.0007411960026077424,0.972426176071167,0.24411745369434357,0.7723826766014099,COMPLETE
77,0.24571171402931213,Leaky,13,306,19,0.006608906368359375,1,0.624907874876251,0.0008303760814420576,0.8722707033157349,0.24571171402931213,0.765673041343689,COMPLETE
78,0.22630338370800018,Leaky,17,327,20,0.004434570992423614,1,0.7561709903479479,0.0005318805082343838,1.1268118619918823,0.22630338370800018,0.7915247678756714,COMPLETE
79,0.25309574604034424,Leaky,18,314,20,0.011388508935026237,1,0.7160016865025891,0.0005815082974527814,1.6767780780792236,0.25309574604034424,0.7760053277015686,COMPLETE
80,0.22484910488128662,Tanh,20,339,19,0.004522379048594191,1,0.7329807266839814,0.000439060354890987,1.0941801071166992,0.22484910488128662,0.8040071725845337,COMPLETE
81,0.23819877207279205,Tanh,13,338,19,0.00838174050621249,1,0.7754076987850512,0.0004256184715502678,4.973330497741699,0.23819877207279205,0.7787572741508484,COMPLETE
82,0.2280518263578415,Tanh,12,338,19,0.00797526215144927,1,0.7739964923107692,0.0007904692810366679,5.154440402984619,0.2280518263578415,0.7886627316474915,COMPLETE
83,0.23443599045276642,Tanh,11,338,21,0.015581860147408248,1,0.7889699096547254,0.0010605267993511126,1.156853437423706,0.23443599045276642,0.7724894285202026,COMPLETE
84,0.2263430953025818,Tanh,10,341,21,0.00853319889164807,1,0.7918176306485633,0.001002566100979858,1.1294476985931396,0.2263430953025818,0.7861394882202148,COMPLETE
85,0.2612849473953247,Tanh,10,345,22,0.017117008407864637,1,0.7878863666465652,0.0010704351147190706,0.9176241755485535,0.2612849473953247,0.7499434351921082,COMPLETE
86,0.23147733509540558,Tanh,16,370,21,0.008934278685158574,1,0.7395832438976263,0.0012512722859987922,1.1579680442810059,0.23147733509540558,0.7900976538658142,COMPLETE
87,0.22805172204971313,Tanh,16,380,21,0.014775924749055962,1,0.7485610350769674,0.0012880527883658529,1.2548589706420898,0.22805172204971313,0.7896299362182617,COMPLETE
88,0.23241378366947174,Tanh,16,378,23,0.01420361081341173,1,0.7148793695738439,0.0012310507982687506,3.6654813289642334,0.23241378366947174,0.7934207320213318,COMPLETE
89,0.22611860930919647,Tanh,16,384,24,0.015362915756249804,1,0.7439776835781575,0.0011621271597168981,0.8270140290260315,0.22611860930919647,0.7923463582992554,COMPLETE
90,0.252626895904541,Tanh,16,379,24,0.01981101724961686,1,0.7354651181465817,0.0013985256466124039,1.4574840068817139,0.252626895904541,0.7656874656677246,COMPLETE
91,0.24037756025791168,Tanh,19,386,23,0.015189850229244331,1,0.7413535567328783,0.0010039843592644154,0.8918418288230896,0.24037756025791168,0.7814904451370239,COMPLETE
92,0.26026326417922974,Tanh,16,371,21,0.013460232561436927,1,0.6728227929290931,0.0013118272234482753,0.880378246307373,0.26026326417922974,0.7582892179489136,COMPLETE
93,0.2353493869304657,Tanh,20,415,22,0.02181447383847283,1,0.7998023127706007,0.0009471761363164503,0.951327383518219,0.2353493869304657,0.7566763758659363,COMPLETE
94,0.2545158565044403,Tanh,21,361,23,0.011788087286039632,1,0.7003274603450277,0.0017510722808840114,1.1886438131332397,0.2545158565044403,0.7760922312736511,COMPLETE
95,0.25233951210975647,Tanh,16,321,20,0.015509151450199606,1,0.6563625979399935,0.0013839320762962818,2.7075424194335938,0.25233951210975647,0.7638363242149353,COMPLETE
96,0.22971850633621216,Tanh,10,411,21,0.02539199917740871,1,0.7511783651940575,0.0007882858527635002,1.3242928981781006,0.22971850633621216,0.773884117603302,COMPLETE
97,0.23030249774456024,Tanh,17,416,24,0.021493496901232985,1,0.7493920905349583,0.0008126615369327909,1.1355890035629272,0.23030249774456024,0.782331645488739,COMPLETE
98,0.24141262471675873,Tanh,25,433,24,0.024684905489621364,1,0.7502285556820489,0.0007165556951964027,1.0771348476409912,0.24141262471675873,0.7698230147361755,COMPLETE
99,0.26082077622413635,Tanh,18,403,22,0.030139987133991075,1,0.7169716775189268,0.002114714114427555,2.2497975826263428,0.26082077622413635,0.7583222389221191,COMPLETE
100,0.267412394285202,Tanh,14,416,23,0.022457144349944513,1,0.6953925248495468,0.001217501296042977,0.9910455346107483,0.267412394285202,0.7605152726173401,COMPLETE
101,0.22125445306301117,Tanh,17,387,21,0.01111679902294327,1,0.7564652415735991,0.0008162597305130784,1.0901871919631958,0.22125445306301117,0.7900574803352356,COMPLETE
102,0.24039578437805176,Tanh,12,386,21,0.011504082903295193,1,0.6540191810572061,0.001547076599915661,1.551971673965454,0.24039578437805176,0.7808565497398376,COMPLETE
103,0.20457834005355835,Tanh,10,463,20,0.017667298800969712,1,0.755018449091989,0.0007641012640686702,1.0084450244903564,0.20457834005355835,0.8054816126823425,COMPLETE
104,0.2331448346376419,Tanh,10,464,20,0.01949790082125209,1,0.754083375086328,0.0006788070299558809,1.2077854871749878,0.2331448346376419,0.7721273899078369,COMPLETE
105,0.21161986887454987,Tanh,14,363,21,0.02753338493436454,1,0.7548469528937712,0.0008360369723217857,1.1294231414794922,0.21161986887454987,0.7977907657623291,COMPLETE
106,0.24051854014396667,Tanh,14,472,22,0.036506886445769215,1,0.7575516500241055,0.0008268882075672177,1.2908189296722412,0.24051854014396667,0.7593162059783936,COMPLETE
107,0.23535430431365967,Tanh,20,419,19,0.026882258161069855,1,0.6769499457223559,0.0005321881720243316,0.9264689683914185,0.23535430431365967,0.7876709699630737,COMPLETE
108,0.25988954305648804,Tanh,12,437,20,0.03027439567473491,1,0.6476555705173839,0.0006523406603240016,1.3656970262527466,0.25988954305648804,0.737841010093689,COMPLETE
109,0.2471834421157837,Tanh,18,347,20,0.051158977117475087,1,0.7677463364321067,0.000915581065380856,1.6302707195281982,0.2471834421157837,0.7484318017959595,COMPLETE
110,0.22193633019924164,Tanh,10,395,24,0.01802953227688198,1,0.7999598450003353,0.0004631240055542315,1.0218040943145752,0.22193633019924164,0.7875604033470154,COMPLETE
111,0.23905427753925323,Tanh,10,394,24,0.016854587173845654,1,0.7185589281870729,0.0005921245225525931,1.2232227325439453,0.23905427753925323,0.7884146571159363,COMPLETE
112,0.23443926870822906,Tanh,14,364,22,0.023985253724210703,1,0.795330715849166,0.0007925569495536512,0.8024950623512268,0.23443926870822906,0.7657018899917603,COMPLETE
113,0.25208088755607605,Tanh,12,350,21,0.019911324874173002,1,0.6912750989797393,0.0004743324758655736,1.1197642087936401,0.25208088755607605,0.7739380598068237,COMPLETE
114,0.21378305554389954,Tanh,21,393,24,0.010433363805601942,1,0.7544403825132382,0.001073386321690105,1.0971142053604126,0.21378305554389954,0.8002760410308838,COMPLETE
115,0.22958824038505554,Sigmoid,20,327,19,0.010785798987569406,1,0.7698907306001214,0.00108343359352938,1.1480541229248047,0.22958824038505554,0.7859227061271667,COMPLETE
116,0.26890480518341064,Sigmoid,20,392,19,0.006718733137349605,1,0.6960921446065014,0.0010541446147150808,1.4775643348693848,0.26890480518341064,0.7623140811920166,COMPLETE
117,0.24495559930801392,Sigmoid,27,331,20,0.011155965252048212,1,0.7779189269949676,0.0015344470067076847,0.9854154586791992,0.24495559930801392,0.771172285079956,COMPLETE
118,0.2731834948062897,Sigmoid,21,326,23,0.007926418521328117,1,0.7997914078396215,0.0019499280814265268,1.0319955348968506,0.2731834948062897,0.7404434680938721,COMPLETE
119,0.2598924934864044,Tanh,14,373,18,0.012808227955394689,1,0.6382788776558,0.00043293786228452177,1.160172700881958,0.2598924934864044,0.7369151711463928,COMPLETE
120,0.25556179881095886,Sigmoid,24,426,19,0.009846330505402042,1,0.7241484400872267,0.0010528939895921028,1.5906459093093872,0.25556179881095886,0.7746089100837708,COMPLETE
121,0.22118431329727173,Tanh,10,407,22,0.01802381887505618,1,0.7639885334590019,0.0006920456167738947,1.16530179977417,0.22118431329727173,0.7806724309921265,COMPLETE
122,0.23978912830352783,Tanh,95,361,22,0.016903373658508726,1,0.6709618956369627,0.0006164236941806494,1.9770939350128174,0.23978912830352783,0.770632803440094,COMPLETE
123,0.21888130903244019,Tanh,12,406,23,0.013198012252638006,1,0.7670755377650799,0.0015365310493779696,0.9285239577293396,0.21888130903244019,0.7951476573944092,COMPLETE
124,0.24395352602005005,Tanh,12,387,23,0.013983245112041853,1,0.7274264705006489,0.002135879207707661,0.9132013320922852,0.24395352602005005,0.7820565104484558,COMPLETE
125,0.2541027367115021,Tanh,14,447,24,0.007644975158358238,1,0.7021716718817562,0.0015767100585697812,0.7978397607803345,0.2541027367115021,0.7789007425308228,COMPLETE
126,0.2542455792427063,Tanh,12,402,23,0.006354339658725055,1,0.6155090629480352,0.0005226241365946517,2.022240161895752,0.2542455792427063,0.7653135657310486,COMPLETE
127,0.25696930289268494,Tanh,17,353,22,0.0184443408737296,1,0.6688041443858559,0.0007016206314784269,1.2932474613189697,0.25696930289268494,0.7621110677719116,COMPLETE
