number,value,params_activation_1,params_activation_2,params_activation_3,params_batch_size,params_epochs,params_layer_1,params_layer_2,params_layer_3,params_learning_rate,params_num_layers,params_train_size,params_weight_decay,user_attrs_mape,user_attrs_mse,user_attrs_r2,state
356,0.18730781972408295,Sigmoid,Leaky,,26,444,20,17.0,,0.0069345220054293924,2,0.6923133166698789,0.0001523917942472344,0.5616346001625061,0.18730781972408295,0.8177184462547302,COMPLETE
357,0.2500915825366974,Tanh,Leaky,,25,444,20,4.0,,0.006959138958179943,2,0.5890988634988532,0.00013686841567033315,0.5208783745765686,0.2500915825366974,0.7598659992218018,COMPLETE
358,0.2443658411502838,Sigmoid,Sigmoid,,27,443,20,10.0,,0.005479089151985398,2,0.636766936142816,0.00016719520115865665,0.4481823742389679,0.2443658411502838,0.7570158839225769,COMPLETE
359,0.2325434535741806,Sigmoid,Leaky,,31,434,20,9.0,,0.0077138038545789996,2,0.676868249996059,0.00010888145793717599,0.6008005738258362,0.2325434535741806,0.7508178949356079,COMPLETE
360,0.2631147801876068,Sigmoid,Leaky,,23,455,21,8.0,,0.00861265647084391,2,0.5663531889190097,0.00014514880421051605,1.3088089227676392,0.2631147801876068,0.7409985065460205,COMPLETE
361,0.25136709213256836,Sigmoid,Leaky,,28,439,21,6.0,,0.006222599691602085,2,0.7395777582377778,0.00021490548079668463,0.5088039636611938,0.25136709213256836,0.7500951886177063,COMPLETE
362,0.2692706882953644,Sigmoid,Leaky,,33,455,22,17.0,,0.00934800887424463,2,0.5554687067788994,0.0002606111452149958,0.9115620255470276,0.2692706882953644,0.7297935485839844,COMPLETE
363,0.3244892954826355,Sigmoid,Leaky,,21,431,20,16.0,,0.0075358228050186535,2,0.30220535032794765,0.00015357864481214563,0.5394147038459778,0.3244892954826355,0.6693935394287109,COMPLETE
364,0.2751326858997345,Tanh,Leaky,,25,446,21,5.0,,0.010328953082899798,2,0.7029869676705836,0.012067483688800998,0.5184280872344971,0.2751326858997345,0.7321790456771851,COMPLETE
365,0.22810973227024078,ReLU,Leaky,,29,458,20,17.0,,0.006809857771287953,2,0.6635203069865651,0.00019748321554874433,3.3268229961395264,0.22810973227024078,0.763114869594574,COMPLETE
366,0.3182312846183777,Sigmoid,Leaky,,26,465,21,10.0,,0.004951076203818424,2,0.34540211750653,0.0002439483786129007,0.49596092104911804,0.3182312846183777,0.701197624206543,COMPLETE
367,0.31353479623794556,Tanh,Leaky,,30,426,20,17.0,,0.008173756443834822,2,0.7222703554604681,0.021481961767252703,0.6032336950302124,0.31353479623794556,0.6994160413742065,COMPLETE
368,0.22963783144950867,Tanh,ReLU,,27,448,21,16.0,,0.010582973973554944,2,0.7682785223487127,0.0003437704647737481,0.5121333599090576,0.22963783144950867,0.7126480937004089,COMPLETE
369,0.20521746575832367,Tanh,Leaky,,64,436,20,10.0,,0.028576917432282304,2,0.6869739964912711,0.0004109545774787184,0.6677514910697937,0.20521746575832367,0.7906114459037781,COMPLETE
370,0.24764753878116608,Tanh,Leaky,,34,461,20,11.0,,0.02448423378081484,2,0.604645271085998,0.00044319292717852213,0.4644097685813904,0.24764753878116608,0.7471123933792114,COMPLETE
371,0.22602176666259766,Tanh,Tanh,Leaky,40,445,20,16.0,20.0,0.03860881256544291,3,0.6488832301059294,0.0003961411177651746,1.7171188592910767,0.22602176666259766,0.7621868848800659,COMPLETE
372,0.20470675826072693,Tanh,Leaky,,66,467,20,11.0,,0.03551259364590588,2,0.6833277108823163,0.00030580157171047163,0.8289334774017334,0.20470675826072693,0.7739917635917664,COMPLETE
373,0.22274795174598694,Tanh,Leaky,,21,468,20,10.0,,0.03391742058951992,2,0.7408912957100073,0.00030515654437518805,1.1203891038894653,0.22274795174598694,0.7739163041114807,COMPLETE
374,0.34174296259880066,Sigmoid,Leaky,,67,455,20,11.0,,0.03977891435053401,2,0.199668881512414,0.00043596964658634943,0.6087216734886169,0.34174296259880066,0.5847177505493164,COMPLETE
375,0.2076202780008316,Tanh,Leaky,,66,467,20,10.0,,0.024979343703490718,2,0.6887709700519479,0.0002931500087221942,0.47751912474632263,0.2076202780008316,0.7651605606079102,COMPLETE
376,0.2462257593870163,Tanh,Leaky,,32,452,4,8.0,,0.031129132551106397,2,0.7744996635706641,0.00010115065407805197,0.4375723898410797,0.2462257593870163,0.7629284262657166,COMPLETE
377,0.21222065389156342,Tanh,Leaky,,65,472,20,12.0,,0.028863667807574406,2,0.7168422301592847,0.0003270786673248895,1.3099586963653564,0.21222065389156342,0.7697764039039612,COMPLETE
378,0.32094264030456543,Tanh,Leaky,,44,438,22,9.0,,0.0054325392724755206,2,0.3293633487693619,0.00013006792788150371,0.5406319499015808,0.32094264030456543,0.5983911156654358,COMPLETE
379,0.2468871772289276,Tanh,Leaky,,63,246,19,11.0,,0.03223252739614902,2,0.6308878418505313,0.00025373430304616643,0.7615938186645508,0.2468871772289276,0.7507414817810059,COMPLETE
380,0.338166207075119,Tanh,Leaky,,72,464,20,11.0,,0.02922729771984495,2,0.22667923058927505,0.0005296493578168805,0.5933248400688171,0.338166207075119,0.5621373653411865,COMPLETE
381,0.24510745704174042,Tanh,Leaky,,24,474,21,15.0,,0.00627810278263584,2,0.7999233423957218,0.00017196907922829285,0.5773024559020996,0.24510745704174042,0.7270427942276001,COMPLETE
382,0.34501194953918457,Tanh,Sigmoid,,70,448,22,9.0,,0.020642658791815656,2,0.2749798166628982,8.229928469521675e-05,0.6431995034217834,0.34501194953918457,0.552651047706604,COMPLETE
383,0.32247069478034973,ReLU,Leaky,,37,427,19,12.0,,0.039981799355756124,2,0.2546943098524873,0.0004932972612922315,0.7537071108818054,0.32247069478034973,0.6442856788635254,COMPLETE
384,0.2820219099521637,Tanh,Leaky,,64,459,20,10.0,,0.01593584034008704,2,0.4137772668771494,0.00038265768271214117,0.47587594389915466,0.2820219099521637,0.673311710357666,COMPLETE
385,0.23845116794109344,Tanh,Leaky,,29,439,21,3.0,,0.07902555060765562,2,0.6822749444410559,0.00028871145305696324,0.8410860300064087,0.23845116794109344,0.7365907430648804,COMPLETE
386,0.22711041569709778,Tanh,Leaky,,26,478,21,11.0,,0.0077330574969592634,2,0.7401641940159311,0.0003988949284650086,2.215111255645752,0.22711041569709778,0.7640743255615234,COMPLETE
387,0.3272883892059326,Tanh,Leaky,,61,231,20,17.0,,0.012268460051466269,2,0.29153673155054877,0.00023962762660496005,0.7363591194152832,0.3272883892059326,0.6598752737045288,COMPLETE
388,0.21122045814990997,Tanh,Leaky,,66,461,19,10.0,,0.008950497175596962,2,0.7016834801866443,0.00033795020131529945,1.0341315269470215,0.21122045814990997,0.7645009160041809,COMPLETE
389,0.24024224281311035,Tanh,Leaky,,68,448,21,13.0,,0.01454255146167145,2,0.6540423802222739,0.0004712482957456645,0.9224990606307983,0.24024224281311035,0.7222882509231567,COMPLETE
390,0.22696922719478607,Tanh,Leaky,,63,424,20,16.0,,0.022650054332929288,2,0.7230539841198277,0.0005952763706238893,0.6810911893844604,0.22696922719478607,0.7613034844398499,COMPLETE
391,0.2557271420955658,Sigmoid,Leaky,,60,435,17,12.0,,0.02836966433113607,2,0.6139980558181812,0.00029662086288726185,0.48105666041374207,0.2557271420955658,0.7392696142196655,COMPLETE
392,0.21238626539707184,Tanh,Leaky,,58,470,22,9.0,,0.04815663828445848,2,0.6807118488443036,0.00012138694831318473,0.6705567836761475,0.21238626539707184,0.7398407459259033,COMPLETE
393,0.2681357264518738,Tanh,Tanh,,55,455,20,17.0,,0.0051979588237181604,2,0.755078236395619,0.0066997950729686855,0.5277245044708252,0.2681357264518738,0.7459917068481445,COMPLETE
394,0.27315253019332886,Tanh,ReLU,,61,480,21,2.0,,0.011275117448881546,2,0.5314788566210833,0.00020838386594034374,0.9076032042503357,0.27315253019332886,0.7315231561660767,COMPLETE
395,0.24154327809810638,Tanh,Leaky,,28,500,19,11.0,,0.006789176886043298,2,0.6429206912084886,0.0004137195827271496,0.6979454755783081,0.24154327809810638,0.7423030734062195,COMPLETE
396,0.2263689935207367,Tanh,Leaky,,23,180,20,16.0,,0.01764678416675882,2,0.7098263641789001,0.0003417779283812336,3.57643723487854,0.2263689935207367,0.7681480646133423,COMPLETE
397,0.21510493755340576,Tanh,Leaky,,56,445,21,20.0,,0.008070368052212964,2,0.674093967235539,0.00015812233875834767,0.5221986174583435,0.21510493755340576,0.759661078453064,COMPLETE
398,0.22672535479068756,Tanh,Leaky,,52,421,22,7.0,,0.035180688894055914,2,0.7314454539433259,0.0002497837793231471,1.484063744544983,0.22672535479068756,0.7520627379417419,COMPLETE
399,0.29402825236320496,Tanh,Leaky,,59,434,19,17.0,,8.471726507698797e-05,2,0.7681426132508371,0.0004965676407793016,0.5502251386642456,0.29402825236320496,0.7203724384307861,COMPLETE
400,0.26648926734924316,Tanh,Leaky,,65,464,21,16.0,,0.011094675478359342,2,0.49929807638152,0.0006172068359498619,0.8080295920372009,0.26648926734924316,0.7357989549636841,COMPLETE
401,0.39736753702163696,Tanh,Leaky,,62,475,23,17.0,,0.02308444884343667,2,0.11198875308604372,0.0003896035251169806,0.7670359015464783,0.39736753702163696,0.28784817457199097,COMPLETE
402,0.2004435658454895,Tanh,Leaky,,53,483,20,17.0,,0.013837145662080738,2,0.6970169995312923,0.0011084450376029138,0.47412732243537903,0.2004435658454895,0.79190593957901,COMPLETE
403,0.3519652485847473,Tanh,Leaky,,26,457,20,17.0,,0.049549563141585914,2,0.7064367378428383,0.050723941229201736,2.144667863845825,0.3519652485847473,0.637528657913208,COMPLETE
404,0.2560310959815979,Sigmoid,Leaky,,67,470,20,10.0,,0.014548296235411677,2,0.6584380287510262,0.0012040316309941878,0.5207048654556274,0.2560310959815979,0.7547131776809692,COMPLETE
405,0.32858121395111084,Tanh,Leaky,,31,440,10,17.0,,0.017483116934340005,2,0.26419105556195177,0.005596563057753687,1.77280855178833,0.32858121395111084,0.6653004884719849,COMPLETE
406,0.3865529000759125,ReLU,Leaky,Leaky,48,485,21,9.0,6.0,2.3274014516907243e-05,3,0.628670591891707,0.00029071931117627387,0.6161450147628784,0.3865529000759125,0.6276003122329712,COMPLETE
407,0.2306346297264099,Tanh,Leaky,,53,418,21,16.0,,0.013261121007747744,2,0.7340681699530012,0.00018588104013764992,0.691294252872467,0.2306346297264099,0.7330470085144043,COMPLETE
408,0.33052384853363037,Tanh,Sigmoid,,50,429,21,18.0,,0.057765910703309394,2,0.6801634558085546,0.008023945323011898,0.6562908291816711,0.33052384853363037,0.678733766078949,COMPLETE
409,0.26110178232192993,Tanh,Leaky,,57,200,20,15.0,,0.021693326766840187,2,0.5985899846832476,0.0007177551072274052,0.4588676989078522,0.26110178232192993,0.7203543186187744,COMPLETE
410,0.2200830578804016,Tanh,Leaky,,63,448,22,8.0,,0.01582197436476647,2,0.760222016648122,0.00044361852603827593,0.5062825679779053,0.2200830578804016,0.7826067209243774,COMPLETE
411,0.2749464213848114,Tanh,Leaky,,60,396,15,17.0,,0.010234450688926424,2,0.4307104725368922,0.0002429105802447721,0.5154749155044556,0.2749464213848114,0.6970046758651733,COMPLETE
412,0.3192386031150818,Tanh,Leaky,,72,480,17,16.0,,0.018530714822755655,2,0.3834641128708552,0.00033129552816147485,0.5334813594818115,0.3192386031150818,0.6601904630661011,COMPLETE
413,0.3148525357246399,Tanh,Leaky,,54,465,20,17.0,,3.420532765064351e-05,2,0.7001902420031481,0.0005497182136896129,0.5550966262817383,0.3148525357246399,0.6953343152999878,COMPLETE
414,0.21730154752731323,Tanh,Leaky,,58,457,21,18.0,,0.01232392609992596,2,0.6531309967792047,0.00036460045880790494,10.352311134338379,0.21730154752731323,0.7579581141471863,COMPLETE
415,0.23641298711299896,Tanh,Leaky,,20,440,20,17.0,,0.006659983466850673,2,0.7211423785874846,0.0012769202568944243,0.5819160342216492,0.23641298711299896,0.768469512462616,COMPLETE
416,0.226751446723938,Tanh,Leaky,,76,475,22,16.0,,0.0004888561158816065,2,0.6814457952703687,0.00021477595249049737,0.545004665851593,0.226751446723938,0.7818058729171753,COMPLETE
417,0.7089928984642029,Sigmoid,Leaky,,62,384,21,9.0,,1.537834150075254e-05,2,0.7487776268770654,0.0002652805251936423,0.8483572006225586,0.7089928984642029,0.32656151056289673,COMPLETE
418,0.3481460511684418,Tanh,ReLU,,56,401,20,15.0,,0.01425171351884619,2,0.21469141843696338,0.00046154199257540305,0.5964354276657104,0.3481460511684418,0.566062331199646,COMPLETE
419,0.2534451186656952,Tanh,Tanh,,64,449,21,19.0,,0.028661860025882963,2,0.5614355248213979,0.00040370382112737155,1.252875804901123,0.2534451186656952,0.7196224927902222,COMPLETE
420,0.2322217971086502,Tanh,Leaky,,46,468,16,18.0,,0.009581138389055563,2,0.6274080879176975,0.0003100760298064459,0.4830904006958008,0.2322217971086502,0.7484143376350403,COMPLETE
421,0.21824759244918823,Tanh,Leaky,,23,483,19,17.0,,0.005294101416132877,2,0.7799981304929481,0.0005530817721735652,0.5081718564033508,0.21824759244918823,0.7825489044189453,COMPLETE
422,0.32377347350120544,Tanh,Leaky,,60,426,20,16.0,,0.024629983494227705,2,0.2842988346228175,0.0011104049605080615,0.989327609539032,0.32377347350120544,0.6406399607658386,COMPLETE
423,0.22313353419303894,Tanh,Leaky,,28,416,17,17.0,,0.0006435826442189111,2,0.7061321665260958,0.00017759426651411275,0.7223595976829529,0.22313353419303894,0.7848175764083862,COMPLETE
424,0.2197600156068802,Tanh,,,52,452,14,,,0.004367185748735772,1,0.6649646313547245,0.00026459472183163515,0.49624624848365784,0.2197600156068802,0.7585541605949402,COMPLETE
425,0.1985955834388733,Tanh,Leaky,,69,432,21,18.0,,0.012415263295851225,2,0.7254015301237883,0.0006777780804224643,1.1573697328567505,0.1985955834388733,0.799354612827301,COMPLETE
426,0.306523859500885,Tanh,Leaky,,69,434,23,19.0,,0.011604492080903112,2,0.3379935890950176,0.000680614838070876,0.5137426853179932,0.306523859500885,0.6815227270126343,COMPLETE
427,0.22715316712856293,Tanh,Leaky,,67,166,22,18.0,,0.007898238152879091,2,0.7348515738128785,0.0007615969261553394,0.536233127117157,0.22715316712856293,0.7814826369285583,COMPLETE
428,0.2237999588251114,Tanh,Leaky,,70,430,21,18.0,,0.00965490345724361,2,0.7773128018899691,0.0006287658505519234,0.5157809257507324,0.2237999588251114,0.7692673206329346,COMPLETE
429,0.21259945631027222,ReLU,Leaky,,62,439,22,18.0,,0.01240238829119955,2,0.7107394398377891,0.0005085422438185821,3.0960774421691895,0.21259945631027222,0.7815284132957458,COMPLETE
430,0.22252944111824036,Tanh,Leaky,,68,418,21,18.0,,0.038013514050262175,2,0.739280774900076,0.0005365992630840181,1.945589303970337,0.22252944111824036,0.7531160116195679,COMPLETE
431,0.3241361677646637,Tanh,Leaky,Sigmoid,65,260,21,17.0,14.0,0.014676502390764224,3,0.6426885984636782,0.011799641876824566,0.7322013974189758,0.3241361677646637,0.68930983543396,COMPLETE
432,0.3522694408893585,Tanh,Leaky,,64,462,22,10.0,,0.007034419988817906,2,0.17575286860959846,0.0001215600402247759,0.5881699323654175,0.3522694408893585,0.5030238628387451,COMPLETE
433,0.27768298983573914,Sigmoid,Sigmoid,,66,446,22,19.0,,0.00989907531708347,2,0.5783365330751544,0.0004276007593435963,0.4864022731781006,0.27768298983573914,0.7401212453842163,COMPLETE
434,0.29190370440483093,Tanh,Leaky,,35,430,15,18.0,,0.008008096860070342,2,0.3935959313189887,4.987921724872023e-05,0.4860280156135559,0.29190370440483093,0.7172218561172485,COMPLETE
435,0.9169681668281555,Tanh,Leaky,,66,490,16,20.0,,1.078382998435797e-05,2,0.13290182217347618,3.7465177219501296e-05,0.9310064315795898,0.9169681668281555,0.1050834059715271,COMPLETE
436,0.31696584820747375,Tanh,Leaky,,24,473,21,17.0,,0.00041972797731743965,2,0.3618056706417748,0.0009750828643812705,0.5056295394897461,0.31696584820747375,0.7100880146026611,COMPLETE
437,0.2148912400007248,Tanh,Leaky,,59,443,21,11.0,,0.005842257481445745,2,0.6847137849197243,0.0001473244143054045,0.4897882342338562,0.2148912400007248,0.7364466190338135,COMPLETE
438,0.2736826539039612,Tanh,Leaky,,69,455,21,17.0,,0.013677189737000064,2,0.5216551977023605,0.004471813036128195,0.5632884502410889,0.2736826539039612,0.7385971546173096,COMPLETE
439,0.2684817612171173,Leaky,Leaky,,30,410,20,19.0,,0.01186760331267492,2,0.5412726095966287,0.0006873391154258801,1.0423656702041626,0.2684817612171173,0.7391327023506165,COMPLETE
440,0.28296327590942383,Tanh,Leaky,,64,481,22,13.0,,0.0007590292104088859,2,0.7502249614045193,0.009231933738958583,0.5311828255653381,0.28296327590942383,0.7321047782897949,COMPLETE
441,0.20884382724761963,Tanh,Leaky,,58,464,21,18.0,,0.01851624076991516,2,0.71185466646038,0.0003382707130047752,1.8442999124526978,0.20884382724761963,0.7907493114471436,COMPLETE
442,0.2809477150440216,Tanh,Leaky,,72,424,20,18.0,,0.009055504173659143,2,0.4568509377525179,0.0004581625383452319,0.508220374584198,0.2809477150440216,0.7208228707313538,COMPLETE
443,0.20796455442905426,Tanh,Leaky,,62,434,21,17.0,,0.006155815949051519,2,0.6620974934791035,2.0157126416852162e-05,12.294084548950195,0.20796455442905426,0.782665491104126,COMPLETE
444,0.2846735715866089,Sigmoid,ReLU,,33,452,22,17.0,,0.004167824265877726,2,0.47445665464414066,0.0002237105182499874,0.5241631269454956,0.2846735715866089,0.7358847856521606,COMPLETE
445,0.3439660370349884,Tanh,Leaky,,25,493,20,18.0,,0.095143981941791,2,0.24523130209108465,0.0007964825905214992,0.8061864972114563,0.3439660370349884,0.5772788524627686,COMPLETE
446,0.24801328778266907,Tanh,Tanh,,61,440,17,10.0,,0.010783013060547714,2,0.7887126800529443,0.0003720814407822463,0.5340110659599304,0.24801328778266907,0.7590919733047485,COMPLETE
447,0.20448850095272064,Tanh,Leaky,,67,472,16,12.0,,0.015332233810222372,2,0.6891488988620271,0.0005897112670033243,0.5910146832466125,0.20448850095272064,0.7295986413955688,COMPLETE
448,0.2377985119819641,Tanh,Leaky,,67,484,21,12.0,,0.020668281262188677,2,0.610349975922644,0.0014188002754614455,0.47913143038749695,0.2377985119819641,0.7590282559394836,COMPLETE
449,0.21079319715499878,Tanh,Leaky,,65,471,20,12.0,,0.014765533816102624,2,0.6892063915731828,0.0006739582844226057,0.5749431848526001,0.21079319715499878,0.7799780368804932,COMPLETE
450,0.24209393560886383,Tanh,Leaky,,68,479,21,11.0,,0.025298339513218894,2,0.6375665201294174,0.0006040576166397737,0.880703866481781,0.24209393560886383,0.7299468517303467,COMPLETE
451,0.3151080310344696,Tanh,Leaky,,42,491,20,12.0,,0.033887330988307665,2,0.3167685868616032,0.006296506362233413,0.5314624309539795,0.3151080310344696,0.6487746834754944,COMPLETE
452,0.22826462984085083,Tanh,Leaky,,71,422,16,11.0,,0.017368776522447973,2,0.6734888663816166,9.726622574777345e-05,0.4548594057559967,0.22826462984085083,0.7200697660446167,COMPLETE
453,0.33501747250556946,Tanh,Leaky,,70,402,21,10.0,,4.605856183432919e-05,2,0.6974596155295617,0.0001840913374156253,0.5480890870094299,0.33501747250556946,0.6742743253707886,COMPLETE
454,0.35760214924812317,Tanh,Leaky,,65,473,15,11.0,,0.007113258843862755,2,0.443538039878913,0.02164587739687685,0.5605507493019104,0.35760214924812317,0.665107250213623,COMPLETE
455,0.22051595151424408,ReLU,Leaky,,63,416,22,17.0,,0.005011792588565103,2,0.64829861624422,0.0005253706195661076,1.1711732149124146,0.22051595151424408,0.7498557567596436,COMPLETE
456,0.2652949094772339,Tanh,Leaky,,67,461,20,13.0,,0.01552176672648999,2,0.4777359466115211,0.0010420103446023416,0.5260688066482544,0.2652949094772339,0.7415329217910767,COMPLETE
457,0.33307453989982605,Tanh,Sigmoid,,55,215,21,17.0,,0.05376221392400733,2,0.7152764454654652,0.005354215827107386,0.8376296162605286,0.33307453989982605,0.6764644980430603,COMPLETE
458,0.23938050866127014,Sigmoid,Leaky,,27,429,23,20.0,,0.020694958084045683,2,0.6162488191888412,0.0003878575501026923,0.5203245878219604,0.23938050866127014,0.7558327317237854,COMPLETE
459,0.2638850808143616,Tanh,Leaky,,60,484,14,16.0,,0.00026234524442858174,2,0.799518668642884,0.0008405902091635063,0.48871228098869324,0.2638850808143616,0.7584267258644104,COMPLETE
460,0.37357813119888306,Tanh,Leaky,,63,445,20,12.0,,0.008655356935531823,2,0.7504616214602311,0.05340965275238464,0.7324197292327881,0.37357813119888306,0.6452534198760986,COMPLETE
461,0.26769116520881653,Tanh,Leaky,,58,455,13,19.0,,0.012771964118816433,2,0.4986134643334799,0.003165580995005772,0.9749807119369507,0.26769116520881653,0.7462109327316284,COMPLETE
462,0.21086715161800385,Tanh,Leaky,,53,438,22,9.0,,0.010865958602327615,2,0.6649801959428038,0.00022447341668975387,0.6637560725212097,0.21086715161800385,0.7598198056221008,COMPLETE
463,0.22513091564178467,Leaky,Leaky,,50,492,6,18.0,,0.03098437910495319,2,0.7216906566376903,0.0003229109529965751,0.5676916241645813,0.22513091564178467,0.7805429100990295,COMPLETE
464,0.3018956184387207,Tanh,Leaky,,66,405,21,17.0,,0.016659081148530038,2,0.3481480627091759,0.0002650515347774328,0.4981270730495453,0.3018956184387207,0.6869957447052002,COMPLETE
465,0.2976378798484802,Tanh,Leaky,,61,500,20,18.0,,0.0001167945226151828,2,0.6902639956362826,0.014596151689549072,0.613815188407898,0.2976378798484802,0.7126485109329224,COMPLETE
466,0.2529340386390686,Tanh,Leaky,,37,474,21,16.0,,0.04346345130960208,2,0.5986943105056166,0.0005681623919521718,0.5208158493041992,0.2529340386390686,0.752151370048523,COMPLETE
467,0.3222653567790985,Tanh,Leaky,,69,464,16,11.0,,0.0058024663962465035,2,0.38215656581923974,0.00015078159876862526,0.5232399702072144,0.3222653567790985,0.6171481609344482,COMPLETE
468,0.21814346313476562,Tanh,ReLU,ReLU,56,423,17,19.0,11.0,0.007552138310540347,3,0.6401142256042393,0.0004464818546814698,0.4825022518634796,0.21814346313476562,0.7564797401428223,COMPLETE
469,0.22210200130939484,Tanh,Leaky,,75,451,22,18.0,,0.010346605054525731,2,0.6686284162031029,0.00030033381229866986,0.5593621134757996,0.22210200130939484,0.7666853070259094,COMPLETE
470,0.22358514368534088,Tanh,Tanh,,22,413,21,17.0,,0.013511056659043487,2,0.7497346757511418,0.0007180932647671842,0.5707993507385254,0.22358514368534088,0.7771593928337097,COMPLETE
471,0.22088171541690826,Sigmoid,Leaky,,59,482,20,16.0,,0.025853610477110628,2,0.7094789161796174,0.0003866224465833765,0.788259744644165,0.22088171541690826,0.7644615769386292,COMPLETE
472,0.19935166835784912,Tanh,Leaky,,64,434,20,12.0,,0.008883402920666163,2,0.6875222949943547,0.0011721234605171918,0.7180331945419312,0.19935166835784912,0.8046502470970154,COMPLETE
473,0.21311445534229279,Tanh,Leaky,,64,431,19,13.0,,0.008909224961748195,2,0.7327707238808175,0.0012764251175521734,0.8523128032684326,0.21311445534229279,0.7762799263000488,COMPLETE
474,0.28068459033966064,Tanh,Leaky,,65,436,19,13.0,,0.012345383719772368,2,0.40223098324414325,0.0010610288577573253,0.5300708413124084,0.28068459033966064,0.716815710067749,COMPLETE
