number,value,params_activation_1,params_batch_size,params_epochs,params_layer_1,params_learning_rate,params_num_layers,params_train_size,params_weight_decay,user_attrs_mape,user_attrs_mse,user_attrs_r2,state
759,0.28765809535980225,Sigmoid,97,356,21,8.437356316512838e-05,1,0.6541103261224744,0.0001983441845642097,0.8903512954711914,0.28765809535980225,0.7363801002502441,COMPLETE
760,0.35921600461006165,Sigmoid,47,316,20,0.01035132260152924,1,0.11153897950254096,0.0814721708188994,0.6760297417640686,0.35921600461006165,0.6628961563110352,COMPLETE
761,0.1752241998910904,Sigmoid,45,324,21,0.08213199587232614,1,0.7061284437275117,1.9486081401154693e-05,0.8040103316307068,0.1752241998910904,0.8370819091796875,COMPLETE
762,0.33841660618782043,Leaky,99,342,22,0.00011997549880406908,1,0.21541264371270744,0.013456999345723652,0.9346425533294678,0.33841660618782043,0.672250509262085,COMPLETE
763,0.6841698288917542,Sigmoid,39,330,20,2.689671217952983e-05,1,0.4800054231190685,0.0015974530603290204,1.6198080778121948,0.6841698288917542,0.3945962190628052,COMPLETE
764,0.1537829488515854,Sigmoid,50,219,21,0.0082265967725448,1,0.6758052584970667,8.172699138065575e-05,0.9001028537750244,0.1537829488515854,0.8606712222099304,COMPLETE
765,0.20160505175590515,Sigmoid,50,224,20,0.00574430048327551,1,0.5993380117550348,0.00011484512811638769,1.3113683462142944,0.20160505175590515,0.8244569897651672,COMPLETE
766,0.16103193163871765,Sigmoid,52,204,21,0.0067661276557131455,1,0.6470937846709578,7.899683206302334e-05,0.7356792092323303,0.16103193163871765,0.851919949054718,COMPLETE
767,0.37938565015792847,Sigmoid,48,248,22,0.05966716415962434,1,0.11577961276968082,8.599282196677316e-05,0.7232442498207092,0.37938565015792847,0.6447170376777649,COMPLETE
768,0.9083862900733948,Sigmoid,50,398,10,2.1540674414083404e-05,1,0.45813384845102006,0.00014843124305492263,1.1882179975509644,0.9083862900733948,0.21167010068893433,COMPLETE
769,0.16905918717384338,Sigmoid,53,223,20,0.008184052179322006,1,0.7181920091757308,0.00010134349102247516,0.6701528429985046,0.16905918717384338,0.8465086817741394,COMPLETE
770,0.1981503963470459,Sigmoid,49,196,21,0.002289092085296793,1,0.6816507966124757,0.00017712904682715206,0.959088146686554,0.1981503963470459,0.8232625722885132,COMPLETE
771,0.2632201015949249,Sigmoid,55,209,22,0.004345674817873057,1,0.21600184522804464,0.0003132820393278263,0.8501583337783813,0.2632201015949249,0.7460635304450989,COMPLETE
772,0.1717802733182907,Sigmoid,47,220,20,0.005996971942079711,1,0.7603537998514978,0.0002452866979465261,0.7480561137199402,0.1717802733182907,0.8494160175323486,COMPLETE
773,0.6492750644683838,Sigmoid,49,193,21,3.320524171720083e-05,1,0.6283743341012493,0.00046920867645366683,0.7924712896347046,0.6492750644683838,0.4027411937713623,COMPLETE
774,0.4030752182006836,Sigmoid,52,352,19,0.00016342797832849518,1,0.28666691655010795,0.06519867566500491,9.516332626342773,0.4030752182006836,0.6377707123756409,COMPLETE
775,0.16600720584392548,Sigmoid,78,212,21,0.008257788535781648,1,0.797667672748935,0.00014025329918670692,0.7091118693351746,0.16600720584392548,0.8585914373397827,COMPLETE
776,0.20021048188209534,Sigmoid,51,237,22,0.0013341985551137661,1,0.6624605930595444,8.122825613034916e-05,0.8975773453712463,0.20021048188209534,0.8178490400314331,COMPLETE
777,0.1778409779071808,Sigmoid,45,219,13,0.03235918261125224,1,0.7088633521434944,0.00021730350216306733,0.6109275221824646,0.1778409779071808,0.835659384727478,COMPLETE
778,0.23020094633102417,Sigmoid,53,337,20,0.0006965124764349111,1,0.6277561569800036,1.3703055754625908e-05,0.8650246858596802,0.23020094633102417,0.7879732251167297,COMPLETE
779,0.2457907795906067,Tanh,48,185,21,0.0036777073426964694,1,0.2035257327989973,0.0001657760005778745,0.8299068808555603,0.2457907795906067,0.7594832181930542,COMPLETE
780,0.3068407475948334,Sigmoid,56,241,20,0.0008638679014985577,1,0.5846126282081002,0.00572011781851284,1.2088876962661743,0.3068407475948334,0.7312788963317871,COMPLETE
781,0.24801190197467804,Sigmoid,51,229,19,0.00656121619272379,1,0.39847281602460466,0.00036723666222578756,1.199112892150879,0.24801190197467804,0.7868859767913818,COMPLETE
782,0.2837252914905548,Sigmoid,46,365,21,0.0008031193352067049,1,0.15882570429127435,0.0001245001382700408,0.9782536029815674,0.2837252914905548,0.7160547971725464,COMPLETE
783,0.26003333926200867,Sigmoid,44,345,22,0.004813539668937796,1,0.351693639509858,0.00026926447314377255,1.0627790689468384,0.26003333926200867,0.7805699110031128,COMPLETE
784,0.1908007115125656,Leaky,64,321,20,0.04699394099053207,1,0.7375579960473246,0.0002014836328181167,0.6696598529815674,0.1908007115125656,0.8267848491668701,COMPLETE
785,0.30332112312316895,Sigmoid,55,231,21,0.008765082143764709,1,0.10548877487131496,9.887691936624391e-05,0.7098180055618286,0.30332112312316895,0.7224107980728149,COMPLETE
786,0.20039650797843933,Sigmoid,49,359,22,0.07094790900066875,1,0.5223689744137199,0.00015327851833883831,1.1784651279449463,0.20039650797843933,0.8242815732955933,COMPLETE
787,0.3304916024208069,Sigmoid,39,329,21,3.2976591641221255e-05,1,0.6823745832418351,0.0008025503482124757,0.7995812892913818,0.3304916024208069,0.7055093050003052,COMPLETE
788,0.24403779208660126,Sigmoid,46,375,20,0.0072851198256122665,1,0.1383801101862069,7.389923732511729e-05,0.975574254989624,0.24403779208660126,0.7565188407897949,COMPLETE
789,0.24393492937088013,Sigmoid,37,170,21,0.010046656562832535,1,0.38982943616949056,0.0003059739897530429,0.8051317930221558,0.24393492937088013,0.7976937294006348,COMPLETE
790,0.2826938033103943,Sigmoid,53,338,20,8.177393409450956e-05,1,0.6472254624423389,0.00018491580599821716,0.8966417908668518,0.2826938033103943,0.7400434017181396,COMPLETE
791,0.17025506496429443,Sigmoid,30,321,19,0.0030275979465223223,1,0.6970584075766724,0.00040565215910107655,0.8234537243843079,0.17025506496429443,0.8426369428634644,COMPLETE
792,0.18051549792289734,Tanh,43,353,23,0.005245110696020713,1,0.6682153988302818,0.00011431347536793652,0.7759063243865967,0.18051549792289734,0.8361037969589233,COMPLETE
793,0.23202674090862274,Leaky,75,346,21,0.004338336530375204,1,0.6033396603382822,0.011458585128924817,1.29718816280365,0.23202674090862274,0.7973234057426453,COMPLETE
794,0.32535260915756226,Sigmoid,58,257,22,0.00632439094689254,1,0.42276567208510435,0.01673371812678747,2.2749805450439453,0.32535260915756226,0.7173207998275757,COMPLETE
795,0.9513421654701233,Sigmoid,48,310,21,1.0649797812863761e-05,1,0.5562531077264259,0.0005660251462386632,0.9986299872398376,0.9513421654701233,0.1692630648612976,COMPLETE
796,0.27404138445854187,Sigmoid,41,331,5,0.001718651179033582,1,0.12633014981242371,0.00023517339792513087,0.6333751678466797,0.27404138445854187,0.7276848554611206,COMPLETE
797,0.33015215396881104,Sigmoid,67,317,20,0.008364340917981604,1,0.2828465416856785,0.03416146148504949,3.316706418991089,0.33015215396881104,0.7030837535858154,COMPLETE
798,0.32971420884132385,Sigmoid,86,338,20,0.01024459216832261,1,0.18374235624895846,0.061690760159470726,1.0106608867645264,0.32971420884132385,0.6750253438949585,COMPLETE
799,0.2546677589416504,Sigmoid,33,327,16,0.015794097413133357,1,0.7182213643491796,0.01038271118844187,0.6886286735534668,0.2546677589416504,0.7687833905220032,COMPLETE
800,0.20295435190200806,Sigmoid,50,385,21,0.005674504814702133,1,0.637744645328604,0.0018766341425575483,1.0266046524047852,0.20295435190200806,0.8155030608177185,COMPLETE
801,0.4900534451007843,Sigmoid,46,362,22,5.1333414213489644e-05,1,0.45386959897224444,0.0001380942589516598,1.146591305732727,0.4900534451007843,0.5746766924858093,COMPLETE
802,0.28401365876197815,Leaky,54,349,9,0.007540585601943597,1,0.3284900503687074,0.0002736148029552514,1.4805004596710205,0.28401365876197815,0.7540571093559265,COMPLETE
803,0.2101486623287201,Sigmoid,42,305,20,0.0036124366785206365,1,0.7642707787831811,0.001279507774218888,1.1654740571975708,0.2101486623287201,0.8153896331787109,COMPLETE
804,0.2924495339393616,Sigmoid,36,155,19,0.0342431643762155,1,0.26309640157479747,0.00016826229529147446,4.460344314575195,0.2924495339393616,0.7288883328437805,COMPLETE
805,0.2705684006214142,Tanh,51,337,21,0.0011739217164849157,1,0.3151293648944957,1.0120726604150689e-05,1.2713087797164917,0.2705684006214142,0.7584148645401001,COMPLETE
806,0.24006223678588867,Sigmoid,44,205,21,0.0022691611536283236,1,0.6627682122048654,0.0036887926912562946,0.9307529926300049,0.24006223678588867,0.7818172574043274,COMPLETE
807,0.29080700874328613,Sigmoid,39,319,21,0.012150986498581453,1,0.25155676539210187,6.65900196369687e-05,1.0390743017196655,0.29080700874328613,0.7228696346282959,COMPLETE
808,0.2201489359140396,Sigmoid,48,328,22,0.027941519483279737,1,0.6906405548450308,0.0032585814509593866,0.7328649759292603,0.2201489359140396,0.7977526187896729,COMPLETE
809,0.18631374835968018,Sigmoid,57,369,20,0.006720502405100612,1,0.6227984247410986,0.00020114642728925766,1.0529543161392212,0.18631374835968018,0.8318021297454834,COMPLETE
810,0.2839946448802948,Sigmoid,47,216,22,0.0052204601991111,1,0.1165177566118311,9.206526624511511e-05,0.6665387749671936,0.2839946448802948,0.7345565557479858,COMPLETE
811,0.17693178355693817,Leaky,53,345,21,0.021609365333217067,1,0.7388422542392824,0.0002409365631080279,0.7278820872306824,0.17693178355693817,0.8397023677825928,COMPLETE
812,0.36732760071754456,Sigmoid,61,314,20,0.008443908964449881,1,0.3724563790840933,0.02836720513564196,1.7454907894134521,0.36732760071754456,0.7017080187797546,COMPLETE
813,0.676958441734314,Sigmoid,44,300,21,1.798456247375268e-05,1,0.6561649258361902,0.009409685272237678,0.8000888824462891,0.676958441734314,0.3808782696723938,COMPLETE
814,0.15585444867610931,Sigmoid,41,357,23,0.004374881707923079,1,0.7073365075499873,0.00033251892904452145,0.7809768915176392,0.15585444867610931,0.8553156852722168,COMPLETE
815,0.27022573351860046,Sigmoid,50,237,20,0.00933187434450803,1,0.3094775537330772,0.0010450349436258483,1.0245811939239502,0.27022573351860046,0.7610085010528564,COMPLETE
816,0.25606241822242737,Sigmoid,38,332,19,0.006519105909241558,1,0.1330250901385496,0.0001227428702699912,0.6511192321777344,0.25606241822242737,0.7460305690765381,COMPLETE
817,0.1991414725780487,Tanh,90,340,21,0.005372896672735963,1,0.5852745308787584,0.0004560702769375236,1.0688731670379639,0.1991414725780487,0.8255541324615479,COMPLETE
818,0.6290889382362366,Sigmoid,35,323,22,1.681162773865677e-05,1,0.6821476056164122,0.0001595086611331499,0.7483924627304077,0.6290889382362366,0.4394386410713196,COMPLETE
819,0.19436559081077576,Sigmoid,21,353,20,0.0014105956852872115,1,0.6400825761405023,0.00022176473835293288,1.0057240724563599,0.19436559081077576,0.8243871331214905,COMPLETE
820,0.24184191226959229,Leaky,46,310,21,0.0411264874275242,1,0.7296743688154469,0.0002997878001433349,0.9070801138877869,0.24184191226959229,0.7819768190383911,COMPLETE
821,0.21983787417411804,Sigmoid,55,344,20,0.010818066087787471,1,0.6780142747269582,0.004601618338645674,1.0486747026443481,0.21983787417411804,0.8014779090881348,COMPLETE
822,0.21211504936218262,Sigmoid,72,298,22,0.01798546613548906,1,0.6117842433558431,0.00018224854300086496,1.2689931392669678,0.21211504936218262,0.8158011436462402,COMPLETE
823,0.2908305525779724,Sigmoid,52,334,19,0.000394183525196557,1,0.5435410885286059,0.00013565676641306623,1.3051683902740479,0.2908305525779724,0.7470539808273315,COMPLETE
824,0.2388635128736496,Sigmoid,42,368,21,0.0005453299873949402,1,0.7578182626975057,0.00011215294359423338,0.8510664701461792,0.2388635128736496,0.7890802621841431,COMPLETE
825,0.1819915473461151,Sigmoid,49,321,20,0.0027808579835979547,1,0.6541789172778568,0.0003786666872585702,0.8206402659416199,0.1819915473461151,0.8332166075706482,COMPLETE
826,0.4439012408256531,Sigmoid,45,311,21,4.449367865888889e-05,1,0.5036335514008637,1.2895803727755136e-05,1.9596216678619385,0.4439012408256531,0.6115874648094177,COMPLETE
827,0.20690512657165527,Sigmoid,51,274,21,0.013892841999141396,1,0.6943432319445246,0.0029953772759433862,0.946596622467041,0.20690512657165527,0.8096445202827454,COMPLETE
828,0.21218690276145935,Leaky,40,356,22,0.0074703366615905846,1,0.6245012163978699,0.0002634971813380999,0.9665486812591553,0.21218690276145935,0.8094007968902588,COMPLETE
829,0.160670205950737,Sigmoid,44,330,20,0.004011702701786153,1,0.7130888663817971,0.00020767312051085668,0.8171680569648743,0.160670205950737,0.8516094088554382,COMPLETE
830,0.31310686469078064,Tanh,60,345,21,0.008950694959880883,1,0.3563069949112311,8.394444454806265e-05,1.0903581380844116,0.31310686469078064,0.7389891743659973,COMPLETE
831,0.24424822628498077,Sigmoid,47,303,1,0.006013518540935013,1,0.6704753078288038,0.0001565008820914637,1.076238751411438,0.24424822628498077,0.7760257124900818,COMPLETE
832,0.30638042092323303,Sigmoid,27,250,20,5.5319713174513785e-05,1,0.7849402570916403,0.0005630650598696049,0.8803263306617737,0.30638042092323303,0.7346510887145996,COMPLETE
833,0.2641366720199585,Sigmoid,38,323,21,0.0001440502796623606,1,0.6450324323352975,0.0002344827122853386,0.925565779209137,0.2641366720199585,0.7587045431137085,COMPLETE
834,0.19635549187660217,Sigmoid,43,375,20,0.011263963629999657,1,0.5736747647622792,0.00018481746170040983,0.9112346768379211,0.19635549187660217,0.8272812962532043,COMPLETE
835,0.172838494181633,Sigmoid,63,334,22,0.023599160225143245,1,0.7222119485057402,0.0003349904418041365,0.5437095761299133,0.172838494181633,0.8446235656738281,COMPLETE
836,0.3192826211452484,Sigmoid,32,282,21,0.06541062014502828,1,0.14777700651584808,2.2418886954848944e-05,3.4629478454589844,0.3192826211452484,0.6786782741546631,COMPLETE
837,0.2320026457309723,Leaky,54,316,20,0.004751963680432296,1,0.6058489628241095,0.008474057959402755,2.076935052871704,0.2320026457309723,0.7984203696250916,COMPLETE
838,0.15976661443710327,Sigmoid,49,349,19,0.0074794007772934065,1,0.6924254536936129,0.00028199688045505415,0.8137965798377991,0.15976661443710327,0.852557361125946,COMPLETE
839,0.1882062703371048,Sigmoid,52,361,21,0.00603173171351855,1,0.4777340108988942,0.0001036340516918916,9.037885665893555,0.1882062703371048,0.8347892761230469,COMPLETE
840,0.175466388463974,Sigmoid,82,294,8,0.009390164531165823,1,0.6654723183232932,0.000672189475824039,0.8527359962463379,0.175466388463974,0.8399745225906372,COMPLETE
841,0.18258105218410492,Sigmoid,46,339,12,0.003341005929277898,1,0.748937064166954,7.094531788048874e-05,0.7500366568565369,0.18258105218410492,0.8371562361717224,COMPLETE
842,0.297603040933609,Sigmoid,41,327,22,0.08170830761437145,1,0.2300295346632489,0.0001404898295363851,1.2398611307144165,0.297603040933609,0.7117984294891357,COMPLETE
843,0.3981788158416748,Tanh,48,262,21,0.049431268386572774,1,0.12138876017434697,2.5013215790699626e-05,0.8584263324737549,0.3981788158416748,0.6246453523635864,COMPLETE
844,0.2556211054325104,Sigmoid,43,304,20,0.0075567021240022115,1,0.30529160998468374,0.0001994403776812231,1.1184662580490112,0.2556211054325104,0.7715754508972168,COMPLETE
845,0.18938858807086945,Sigmoid,85,351,22,0.027530373395639542,1,0.6235701548264311,0.00046127014506315144,0.9962130784988403,0.18938858807086945,0.8294656276702881,COMPLETE
846,0.31805649399757385,Leaky,88,388,19,0.014533479429897123,1,0.2773880799924307,0.0001672469644350589,7.8038153648376465,0.31805649399757385,0.7131397724151611,COMPLETE
847,0.2609299421310425,Sigmoid,57,316,17,0.004752211948708954,1,0.19443851831441217,0.0020633520038107907,2.8251423835754395,0.2609299421310425,0.7409601211547852,COMPLETE
848,0.26452723145484924,Sigmoid,34,327,21,0.0021641273400549,1,0.13356257838475455,0.00026948640092163247,0.6876001954078674,0.26452723145484924,0.737175464630127,COMPLETE
849,0.2640707492828369,Sigmoid,45,339,23,8.503972573278585e-05,1,0.6962729240576362,0.005489528577712323,0.9531587958335876,0.2640707492828369,0.7588951587677002,COMPLETE
850,0.1732061207294464,Sigmoid,51,311,18,0.006687083934161758,1,0.6489128823254404,0.00023063727088147237,0.7786459922790527,0.1732061207294464,0.8409992456436157,COMPLETE
851,0.16195997595787048,Sigmoid,40,363,20,0.011952229813651554,1,0.722513735698361,9.044204734646994e-05,0.5752053260803223,0.16195997595787048,0.8545291423797607,COMPLETE
852,0.2036178857088089,Sigmoid,14,296,21,0.003926174204822045,1,0.4367058655324805,0.0001194567064710828,1.1520575284957886,0.2036178857088089,0.8222980499267578,COMPLETE
853,0.248382106423378,Sigmoid,54,283,20,0.00846643050977964,1,0.3794940180193834,0.00039393927791316275,8.339120864868164,0.248382106423378,0.7963322401046753,COMPLETE
854,0.3192163407802582,Sigmoid,36,336,21,0.03690527827301762,1,0.6769713491376514,0.043335627678801905,1.2945358753204346,0.3192163407802582,0.7116546630859375,COMPLETE
855,0.2551550269126892,Leaky,49,347,21,0.0009392107257621031,1,0.22290941028603745,0.0015344943573790285,0.9315367937088013,0.2551550269126892,0.747455358505249,COMPLETE
856,0.2766275107860565,Tanh,47,271,19,0.00025335446247556,1,0.16911829241328555,0.0003268098325015195,2.093888759613037,0.2766275107860565,0.7186212539672852,COMPLETE
857,0.20678122341632843,Sigmoid,43,378,22,0.005539442797223049,1,0.59622657352372,0.0001780066911397714,1.094351887702942,0.20678122341632843,0.8206990957260132,COMPLETE
858,0.25402987003326416,Sigmoid,65,322,20,0.010015623473739351,1,0.21187033731607446,0.00014477564335032552,0.943568766117096,0.25402987003326416,0.7498481273651123,COMPLETE
859,0.18911708891391754,Sigmoid,39,357,21,0.020561754307375658,1,0.77068205487819,0.000223800065467749,1.3432666063308716,0.18911708891391754,0.8346698880195618,COMPLETE
860,0.28565624356269836,Sigmoid,59,331,22,0.00019729258628909532,1,0.7977134581934245,0.0026188062926279614,0.8635953068733215,0.28565624356269836,0.7566717863082886,COMPLETE
861,0.29786795377731323,Sigmoid,56,307,20,0.006875783845054142,1,0.19749375462749658,0.012335518069390424,1.129729986190796,0.29786795377731323,0.706366240978241,COMPLETE
862,0.2873390316963196,Sigmoid,52,343,21,0.005122682174925459,1,0.6407667180940164,0.017388437000847252,1.1201223134994507,0.2873390316963196,0.7406758666038513,COMPLETE
863,0.7949010133743286,Sigmoid,92,370,20,2.4019413561641172e-05,1,0.694838645303313,0.026513334959484693,0.9566327333450317,0.7949010133743286,0.2686803936958313,COMPLETE
864,0.16090303659439087,Sigmoid,45,214,19,0.008427655407211566,1,0.6650980649715231,0.00010805485017975133,0.8391836881637573,0.16090303659439087,0.8544696569442749,COMPLETE
865,0.19428901374340057,Leaky,50,320,21,0.0030660406771274044,1,0.7461861124555633,5.726887073450484e-05,0.7458390593528748,0.19428901374340057,0.8251785635948181,COMPLETE
866,0.8430355191230774,Sigmoid,69,291,20,3.152179158733322e-05,1,0.6299368149973555,0.09961453596576364,0.9629570841789246,0.8430355191230774,0.22825628519058228,COMPLETE
867,0.2522581219673157,Sigmoid,37,304,22,0.005958760539877135,1,0.16223259759276712,0.00026246129173220113,1.0544805526733398,0.2522581219673157,0.7418482303619385,COMPLETE
868,0.2892787754535675,Tanh,41,351,21,1.4679348381399029e-05,1,0.7183880445454714,0.00017570054974647,0.8269473314285278,0.2892787754535675,0.7373595237731934,COMPLETE
869,0.17716236412525177,Sigmoid,47,333,22,0.016388044302449983,1,0.6647594871833563,0.00013279102427493747,0.6322795152664185,0.17716236412525177,0.8397637605667114,COMPLETE
870,0.23240752518177032,Sigmoid,42,181,21,0.0041250548224605115,1,0.5573662723448967,1.1961689654548038e-05,2.4208507537841797,0.23240752518177032,0.7952765822410583,COMPLETE
871,0.22538597881793976,Sigmoid,54,313,21,0.0007041195313059994,1,0.6913153082075532,0.00033084916170402314,0.9081624746322632,0.22538597881793976,0.7932860851287842,COMPLETE
872,0.302971750497818,Sigmoid,45,326,20,0.0017442372204234022,1,0.23338737364977405,0.00794234177130508,1.0239657163619995,0.302971750497818,0.7088651657104492,COMPLETE
873,0.23137949407100677,Leaky,50,342,20,0.01043000553732904,1,0.609439505634199,0.00021577575344179547,1.154889464378357,0.23137949407100677,0.7979781627655029,COMPLETE
874,0.2526380717754364,Sigmoid,48,296,3,0.012761347831408625,1,0.2636350450316338,6.847841776557129e-05,1.343453049659729,0.2526380717754364,0.7660499811172485,COMPLETE
875,0.20615744590759277,Sigmoid,43,362,23,0.0076091977073955,1,0.40481505178956745,0.00015639909674177664,1.2089757919311523,0.20615744590759277,0.822981595993042,COMPLETE
876,0.18543195724487305,Sigmoid,77,423,7,0.00670858510004746,1,0.644999362611751,0.0003946136577189995,0.9032743573188782,0.18543195724487305,0.8301706910133362,COMPLETE
877,0.15491017699241638,Sigmoid,30,316,21,0.004716885703098653,1,0.723702286149625,9.027349331654523e-05,0.6302509307861328,0.15491017699241638,0.8612905144691467,COMPLETE
878,0.25251519680023193,Sigmoid,30,304,22,0.00427644633723183,1,0.2531540155916557,9.92092411002775e-05,1.2202796936035156,0.25251519680023193,0.7597389221191406,COMPLETE
879,0.2176281064748764,Sigmoid,29,312,22,0.0033813876254247376,1,0.4264660642396223,7.360294482447817e-05,3.263350248336792,0.2176281064748764,0.8121041655540466,COMPLETE
880,0.16108021140098572,Sigmoid,31,288,21,0.004798609301102377,1,0.7478212541271022,7.820532401768334e-05,0.646955132484436,0.16108021140098572,0.8555546402931213,COMPLETE
881,0.25194603204727173,Sigmoid,29,320,22,0.0028641292136404677,1,0.14095803636618573,9.16003273955157e-05,0.8148026466369629,0.25194603204727173,0.7453885078430176,COMPLETE
882,0.17472828924655914,Tanh,25,298,21,0.003760806335076132,1,0.7128237483656782,0.00012166597329038445,0.7458581328392029,0.17472828924655914,0.8386257886886597,COMPLETE
883,0.2879273295402527,Leaky,31,312,21,0.005296160845777529,1,0.18950156287130057,9.780138425251889e-05,0.9024256467819214,0.2879273295402527,0.7217197418212891,COMPLETE
884,0.2576334476470947,Sigmoid,27,277,22,0.004691575193463328,1,0.15341837723528684,8.300040236467744e-05,1.1911505460739136,0.2576334476470947,0.7416150569915771,COMPLETE
