number,value,params_activation_1,params_batch_size,params_epochs,params_layer_1,params_learning_rate,params_num_layers,params_train_size,params_weight_decay,user_attrs_mape,user_attrs_mse,user_attrs_r2,state
252,0.15508946776390076,Sigmoid,97,358,21,0.025030514013097298,1,0.7066734494684807,0.00020472324311294668,0.5984893441200256,0.15508946776390076,0.8558025360107422,COMPLETE
253,0.1570471227169037,Sigmoid,98,360,21,0.06305748646059522,1,0.7064232098164634,0.0005338286057221575,0.6060094833374023,0.1570471227169037,0.8539823889732361,COMPLETE
254,0.17434942722320557,Sigmoid,96,359,21,0.07399671314643598,1,0.7377688977160327,0.00047738058267842793,0.7557353973388672,0.17434942722320557,0.8417198657989502,COMPLETE
255,0.19102658331394196,Sigmoid,90,361,21,0.04707543569194075,1,0.5624143388598206,0.0005166483522005094,3.322664260864258,0.19102658331394196,0.8334201574325562,COMPLETE
256,0.15288351476192474,Sigmoid,97,371,21,0.027496123943743633,1,0.6684851040262105,0.00037226702678598274,0.7370016574859619,0.15288351476192474,0.8611918687820435,COMPLETE
257,0.1566411703824997,Sigmoid,93,376,21,0.029819160470303006,1,0.7062130687882615,0.0004028151965480355,0.6638694405555725,0.1566411703824997,0.8543598055839539,COMPLETE
258,0.20827548205852509,Leaky,98,371,21,0.0328087807803524,1,0.7638573961878997,0.00040087272019438675,0.8302315473556519,0.20827548205852509,0.8170351982116699,COMPLETE
259,0.1584327667951584,Sigmoid,97,399,21,0.027682425206727347,1,0.7037206923435968,0.0005770267512926306,0.5976795554161072,0.1584327667951584,0.8511967658996582,COMPLETE
260,0.16837327182292938,Sigmoid,100,378,21,0.022490265350835238,1,0.7272039591798045,0.00045100119017033394,0.7755858898162842,0.16837327182292938,0.8472633361816406,COMPLETE
261,0.2028065025806427,Sigmoid,94,387,21,0.06343232045845788,1,0.4522149580057923,0.00037530451202668225,1.0076794624328613,0.2028065025806427,0.8234306573867798,COMPLETE
262,0.20097407698631287,Sigmoid,98,375,20,0.02818740157791324,1,0.5425171199986706,0.0007814849308005069,22.572120666503906,0.20097407698631287,0.826349139213562,COMPLETE
263,0.19482503831386566,Tanh,92,368,21,0.020366353466822036,1,0.6954736641953935,0.00033950293333956914,0.7350632548332214,0.19482503831386566,0.8212624192237854,COMPLETE
264,0.18199200928211212,Sigmoid,100,357,22,0.03534430234960018,1,0.76634936036759,0.0002870222132647167,0.7776142358779907,0.18199200928211212,0.8388526439666748,COMPLETE
265,0.17299994826316833,Sigmoid,97,363,20,0.026005266274318435,1,0.677263896785537,0.0006315638583541119,0.872003972530365,0.17299994826316833,0.8438154458999634,COMPLETE
266,0.2115696668624878,Sigmoid,95,348,21,0.08789132387302119,1,0.5976750444527026,0.00033855286844069966,0.9782435297966003,0.2115696668624878,0.8169665336608887,COMPLETE
267,0.21680980920791626,ReLU,89,395,4,0.022866053343092,1,0.7154100063045968,0.0004302170629875085,0.7291300296783447,0.21680980920791626,0.8007761836051941,COMPLETE
268,0.19172164797782898,Sigmoid,91,353,20,0.030249114367401502,1,0.6325320085640047,0.0002741054319008075,0.7710911631584167,0.19172164797782898,0.8254712224006653,COMPLETE
269,0.16152626276016235,Sigmoid,63,382,22,0.040185089770019555,1,0.6767372529854758,0.0002556587597178389,0.6722040772438049,0.16152626276016235,0.8540947437286377,COMPLETE
270,0.18110664188861847,Sigmoid,96,365,20,0.024860680664248513,1,0.7349594808955816,0.000371874325048545,0.6531558036804199,0.18110664188861847,0.834732174873352,COMPLETE
271,0.18076181411743164,Sigmoid,87,374,21,0.019826308397062165,1,0.6531701458620325,0.0003125269783454688,0.7944508790969849,0.18076181411743164,0.8342020511627197,COMPLETE
272,0.2090953290462494,Sigmoid,92,348,20,0.03203771213493998,1,0.5149364834725945,0.00021954920421926239,2.089271068572998,0.2090953290462494,0.815710723400116,COMPLETE
273,0.341606467962265,Sigmoid,98,338,21,0.04874135579446137,1,0.106964828487127,0.000447268052083207,0.6828213930130005,0.341606467962265,0.6741868257522583,COMPLETE
274,0.30491265654563904,Sigmoid,83,354,21,0.054340899267806074,1,0.2159841270739173,0.0002453728325730535,1.0241116285324097,0.30491265654563904,0.7058414220809937,COMPLETE
275,0.16188699007034302,Sigmoid,99,339,22,0.016765599067037937,1,0.7013664134456359,0.0005287217169773857,0.8233829736709595,0.16188699007034302,0.8500586748123169,COMPLETE
276,0.1958215981721878,Sigmoid,94,358,18,0.026193914204693934,1,0.777245082562691,0.0008994662011712488,0.95110023021698,0.1958215981721878,0.8308037519454956,COMPLETE
277,0.1956656128168106,Sigmoid,96,345,17,0.041651319481453335,1,0.6273955639420558,0.00018815557376215114,0.8134844899177551,0.1956656128168106,0.819782018661499,COMPLETE
278,0.1862395703792572,Tanh,99,332,20,0.03721101380943165,1,0.6698906420797606,0.0003111098972151576,0.9273528456687927,0.1862395703792572,0.8290178775787354,COMPLETE
279,0.3528613746166229,Sigmoid,94,371,19,0.05883577776028044,1,0.7087270913602487,0.08971999816984133,0.6984854936599731,0.3528613746166229,0.6739252209663391,COMPLETE
280,0.18199212849140167,Sigmoid,44,280,21,0.03247042976344948,1,0.7428686980807733,0.00022919835290378728,0.6660699844360352,0.18199212849140167,0.8349767923355103,COMPLETE
281,0.20218941569328308,Sigmoid,78,319,20,0.01719315593519444,1,0.5828026388778859,0.0003785716216332818,1.3056726455688477,0.20218941569328308,0.8223040699958801,COMPLETE
282,0.22545236349105835,Leaky,58,348,22,0.02245652443294626,1,0.6062751499766258,0.003665637929714155,1.6552740335464478,0.22545236349105835,0.8041117191314697,COMPLETE
283,0.26048409938812256,Sigmoid,30,381,19,0.014634716445304492,1,0.3458554352392395,0.00016351305303570607,1.1609463691711426,0.26048409938812256,0.7790255546569824,COMPLETE
284,0.21170425415039062,Sigmoid,54,360,21,0.0010470817832792928,1,0.6526046295561742,0.0002078264907338638,0.878746747970581,0.21170425415039062,0.8056735396385193,COMPLETE
285,0.18971647322177887,Sigmoid,97,267,6,0.07414605499789469,1,0.6946682999247362,0.0002808027869305399,0.9372292757034302,0.18971647322177887,0.825458288192749,COMPLETE
286,0.24983195960521698,Sigmoid,39,230,20,0.08659490669279118,1,0.6724278231336798,0.005446529260669053,1.0187591314315796,0.24983195960521698,0.7719271183013916,COMPLETE
287,0.18510103225708008,Sigmoid,43,329,19,0.0030350674312399776,1,0.7502455833922862,0.00033245024210584246,0.764457643032074,0.18510103225708008,0.8357502818107605,COMPLETE
288,0.17011502385139465,Sigmoid,40,304,21,0.005076054816319549,1,0.6365531835962225,3.3684087849716195e-05,0.8273922204971313,0.17011502385139465,0.847110390663147,COMPLETE
289,0.4627799987792969,Sigmoid,71,319,22,9.736097265571783e-05,1,0.41955749444975976,0.012899389243298028,1.286514163017273,0.4627799987792969,0.5948268175125122,COMPLETE
290,0.23489272594451904,Tanh,51,243,20,0.00016838967669496183,1,0.7959217960858,0.0005910818806629087,0.7444426417350769,0.23489272594451904,0.8009997010231018,COMPLETE
291,0.21513517200946808,Sigmoid,45,340,2,0.01940986400993728,1,0.7170316125280899,0.0005026615808783666,1.0972208976745605,0.21513517200946808,0.803409218788147,COMPLETE
292,0.20738977193832397,Sigmoid,41,354,20,0.011205786885102789,1,0.4580085072171125,0.00018999983968166393,1.3244223594665527,0.20738977193832397,0.8200197815895081,COMPLETE
293,0.17361311614513397,Sigmoid,100,295,21,0.05007048553374339,1,0.684079281091271,0.00025664102913239826,0.8966719508171082,0.17361311614513397,0.8440507054328918,COMPLETE
294,0.25420674681663513,ReLU,37,366,22,0.0062466408789077195,1,0.3957808850188558,0.0001566260683363324,2.2083842754364014,0.25420674681663513,0.7841310501098633,COMPLETE
295,0.24886943399906158,Sigmoid,44,332,18,0.003809575018673155,1,0.16319655456697382,0.00043141948959968886,0.9760934710502625,0.24886943399906158,0.746064305305481,COMPLETE
296,0.18282945454120636,Sigmoid,53,338,10,0.031089743412485042,1,0.6463001076527891,0.00022324081503557975,0.7015165686607361,0.18282945454120636,0.8311806917190552,COMPLETE
297,0.21114149689674377,Sigmoid,92,280,20,0.03828640127101184,1,0.6078026624112316,0.0002883610582082268,0.9798049926757812,0.21114149689674377,0.8149961829185486,COMPLETE
298,0.8058838248252869,Sigmoid,42,344,19,1.273588309947581e-05,1,0.7273885657746175,0.0006667923245531365,0.8740495443344116,0.8058838248252869,0.2689576745033264,COMPLETE
299,0.5313003659248352,Sigmoid,39,218,21,3.002491510237829e-05,1,0.6718637723230865,0.00013440058241435732,0.7171122431755066,0.5313003659248352,0.5145516991615295,COMPLETE
300,0.16880306601524353,Sigmoid,46,324,21,0.002046806812742652,1,0.7042836841948075,0.0001669617911289352,0.7990329265594482,0.16880306601524353,0.8418933153152466,COMPLETE
301,0.2792375087738037,Sigmoid,96,307,20,0.008707947249157067,1,0.12185410396185373,0.00018445557084739535,0.6431093215942383,0.2792375087738037,0.7305567860603333,COMPLETE
302,0.3010527193546295,Sigmoid,50,352,21,0.00037302371478329727,1,0.5369572762763881,0.0003537035656269935,1.782916784286499,0.3010527193546295,0.7398787140846252,COMPLETE
303,0.21750344336032867,Sigmoid,27,374,22,0.09621440466451028,1,0.7585302461464609,0.00025235911342861444,1.0600717067718506,0.21750344336032867,0.808529257774353,COMPLETE
304,0.1768464297056198,Tanh,88,314,20,0.004612019258225036,1,0.6533147882590864,0.0012299943485714955,0.8038789629936218,0.1768464297056198,0.8377933502197266,COMPLETE
305,0.2028982788324356,Sigmoid,35,362,19,0.06468516346453479,1,0.6247716344161378,0.00039876150812925647,0.7385702133178711,0.2028982788324356,0.8163638710975647,COMPLETE
306,0.15621231496334076,Sigmoid,43,333,21,0.0064781653200044345,1,0.6885321234906135,0.00014052177167589861,0.8399655222892761,0.15621231496334076,0.8581177592277527,COMPLETE
307,0.17187735438346863,Leaky,41,298,20,0.005611782110945673,1,0.6688501597905427,0.00014685686828124343,0.7492560744285583,0.17187735438346863,0.8420906066894531,COMPLETE
308,0.19317319989204407,Sigmoid,43,342,21,0.01265243928374462,1,0.5833607707598116,0.0001276210763919068,0.7729025483131409,0.19317319989204407,0.8304048776626587,COMPLETE
309,0.2636365592479706,Sigmoid,56,325,21,0.00027811724675032935,1,0.7290104261114595,8.852908168617447e-05,0.8228822350502014,0.2636365592479706,0.7616350650787354,COMPLETE
310,0.1590525507926941,Sigmoid,38,351,20,0.009961743111012488,1,0.6877566341238847,0.00020127615470875494,0.6383198499679565,0.1590525507926941,0.8552688956260681,COMPLETE
311,0.27577945590019226,Sigmoid,94,287,20,0.001453549843304325,1,0.4711580928124765,0.00016168555115256167,1.485312581062317,0.27577945590019226,0.760062575340271,COMPLETE
312,0.18272338807582855,Sigmoid,69,314,21,0.02588895222928641,1,0.6468336349413223,0.00012998695931599894,0.6513078212738037,0.18272338807582855,0.8317603468894958,COMPLETE
313,0.19212161004543304,Sigmoid,98,274,19,0.00763005914721355,1,0.6161946396542178,0.0002137481115194588,1.218585729598999,0.19212161004543304,0.8293657302856445,COMPLETE
314,0.17423805594444275,Sigmoid,43,394,18,0.0024822558464233264,1,0.7715603153200058,0.00018313452887995342,0.9045065641403198,0.17423805594444275,0.8481203317642212,COMPLETE
315,0.2928387224674225,Sigmoid,52,386,20,0.0033435726750549,1,0.35141742956526134,0.0015648578401393587,1.5118374824523926,0.2928387224674225,0.7528870105743408,COMPLETE
316,0.196394681930542,ReLU,33,303,21,0.015191137044568625,1,0.7203827466743069,1.899327632639101e-05,0.7005875110626221,0.196394681930542,0.8226897120475769,COMPLETE
317,0.15334056317806244,Sigmoid,61,359,21,0.0062426857554280365,1,0.669484566740599,0.00024860558275241256,0.8948746919631958,0.15334056317806244,0.8592216968536377,COMPLETE
318,0.16649974882602692,Sigmoid,37,368,20,0.00604936213920023,1,0.6384397882700846,0.0002806292413472118,0.7632485032081604,0.16649974882602692,0.8488364219665527,COMPLETE
319,0.17338652908802032,Tanh,64,362,21,0.004498507401856968,1,0.6728795465981602,0.0002524165563018852,0.858239471912384,0.17338652908802032,0.8419119119644165,COMPLETE
320,0.19402474164962769,Sigmoid,90,357,19,0.006678978004901416,1,0.5669167055322984,0.0003255110111253648,1.461360216140747,0.19402474164962769,0.830284059047699,COMPLETE
321,0.1624433696269989,Sigmoid,85,373,22,0.005274061708600215,1,0.6975275746578624,0.0002333415921592562,0.7836369872093201,0.1624433696269989,0.8500431776046753,COMPLETE
322,0.19502389430999756,Sigmoid,49,191,21,0.003945241751449003,1,0.6580318533360201,0.00029111847615167434,1.00909423828125,0.19502389430999756,0.8224860429763794,COMPLETE
323,0.22052617371082306,Sigmoid,74,297,20,0.04508515097511464,1,0.5977873536022104,6.234407873333479e-05,0.7210784554481506,0.22052617371082306,0.8072693943977356,COMPLETE
324,0.15301202237606049,Sigmoid,39,334,21,0.008399199095793498,1,0.681716372315193,0.00019265042680168803,0.7526411414146423,0.15301202237606049,0.8635231256484985,COMPLETE
325,0.28000861406326294,Sigmoid,81,322,22,0.0550975222318645,1,0.3090663173727726,0.0008647421240001992,0.993123471736908,0.28000861406326294,0.7523564100265503,COMPLETE
326,0.1704510599374771,Sigmoid,36,310,21,0.009674761094190763,1,0.6348642938932886,0.00018918034933000752,0.7149131894111633,0.1704510599374771,0.8459656238555908,COMPLETE
327,0.2738366723060608,Sigmoid,39,335,21,0.008340991522410383,1,0.23694473048833145,0.00011461771508267534,0.9759092330932617,0.2738366723060608,0.7393125295639038,COMPLETE
328,0.19022314250469208,Sigmoid,40,328,20,0.011494981269312324,1,0.6173373437176295,0.0001534785388515218,2.0449678897857666,0.19022314250469208,0.8294622898101807,COMPLETE
329,0.19860675930976868,Sigmoid,37,380,22,0.0056123182006374865,1,0.48642171924120664,0.00020796779452110476,1.986781120300293,0.19860675930976868,0.8231981992721558,COMPLETE
330,0.29320189356803894,Sigmoid,96,261,21,0.0065236924099232995,1,0.4416901339899626,0.0023058605173518916,1.5388132333755493,0.29320189356803894,0.7450547218322754,COMPLETE
331,0.2669186294078827,Tanh,41,352,20,0.004891022118547007,1,0.27489429795745207,7.693312914548497e-05,1.8094637393951416,0.2669186294078827,0.7605340480804443,COMPLETE
332,0.14631536602973938,Sigmoid,62,287,21,0.008470692972985645,1,0.6635009939260634,9.844325856384082e-05,0.7586809396743774,0.14631536602973938,0.867408275604248,COMPLETE
333,0.195632666349411,Sigmoid,61,317,22,0.008402914768795067,1,0.5126980734426769,9.691005518754283e-05,1.559138536453247,0.195632666349411,0.826612114906311,COMPLETE
334,0.3193871080875397,Sigmoid,71,283,21,0.0036884876502713943,1,0.1916060151988035,0.040178892953536854,0.98011314868927,0.3193871080875397,0.684252142906189,COMPLETE
335,0.2508419156074524,Sigmoid,58,291,20,0.0029235340209674185,1,0.4028390650201453,8.648249474826787e-05,1.1862648725509644,0.2508419156074524,0.7861537933349609,COMPLETE
336,0.1529848724603653,Leaky,56,334,21,0.006733342774630581,1,0.6621643713339264,0.0003409939263477207,0.7111302018165588,0.1529848724603653,0.8608148097991943,COMPLETE
337,0.30004802346229553,Leaky,66,331,21,0.006848641335245093,1,0.368189081472778,0.0001190935569377908,0.8559665679931641,0.30004802346229553,0.7566038966178894,COMPLETE
338,0.18284837901592255,Leaky,62,336,20,0.0058813679471359775,1,0.6576210150505987,0.00032189534766792157,0.903111457824707,0.18284837901592255,0.8335683941841125,COMPLETE
339,0.17990164458751678,Leaky,61,315,22,0.007640452938041401,1,0.6282376283517721,0.00010392523149398551,0.9206116795539856,0.17990164458751678,0.8345110416412354,COMPLETE
340,0.1613609939813614,ReLU,57,425,21,0.001766644842293107,1,0.6628805389326823,0.00013947179911140555,0.7362064719200134,0.1613609939813614,0.8533455729484558,COMPLETE
341,0.28602221608161926,Sigmoid,59,324,20,0.004529648155099256,1,0.4040018532457696,0.0020069504132653976,1.5785714387893677,0.28602221608161926,0.75692218542099,COMPLETE
342,0.2092549055814743,Leaky,55,272,21,0.005414512155975893,1,0.6105143594362509,0.0002614724928237377,1.180047631263733,0.2092549055814743,0.8178001046180725,COMPLETE
343,0.1758657991886139,Leaky,78,344,20,0.009501352683071672,1,0.6778871292135883,7.152417940684606e-05,0.9935680627822876,0.1758657991886139,0.8411864042282104,COMPLETE
344,0.1794862598180771,Leaky,54,336,21,0.006576393491291033,1,0.635178022208861,0.0003643698521304383,0.8028165698051453,0.1794862598180771,0.8380100727081299,COMPLETE
345,0.24260470271110535,Leaky,50,305,7,0.008564072826010204,1,0.5532031609974235,0.0002134785096040173,3.252870559692383,0.24260470271110535,0.788999080657959,COMPLETE
346,0.17114722728729248,Tanh,59,327,19,0.004359468816551964,1,0.7033081082668842,0.00017154000967501546,0.8627005219459534,0.17114722728729248,0.8406819105148315,COMPLETE
347,0.1736389398574829,Sigmoid,56,306,22,0.0071702675513125175,1,0.6506501870817071,1.111873223634774e-05,0.633194625377655,0.1736389398574829,0.8397826552391052,COMPLETE
348,0.2734917104244232,Sigmoid,53,318,20,0.0007155663948282806,1,0.5907165851491706,0.00027063211177098784,1.2076555490493774,0.2734917104244232,0.7595580816268921,COMPLETE
349,0.21309860050678253,Sigmoid,52,296,3,0.005263607138936892,1,0.7404690684570618,0.0007653421932629247,0.772347629070282,0.21309860050678253,0.8055475354194641,COMPLETE
350,0.29527992010116577,Sigmoid,65,406,21,0.0005607277676868711,1,0.4232923439718935,0.0001317393004241366,3.353283643722534,0.29527992010116577,0.7437446117401123,COMPLETE
351,0.26884981989860535,Sigmoid,69,348,20,0.010948993759247853,1,0.2887946548970035,0.0003305075515840115,1.5381317138671875,0.26884981989860535,0.7598251104354858,COMPLETE
352,0.25484320521354675,Sigmoid,41,287,9,0.003259243724343961,1,0.2040400832838089,0.00017494789035400518,0.9694589972496033,0.25484320521354675,0.7506250739097595,COMPLETE
353,0.15229196846485138,Sigmoid,44,334,21,0.008121567094145254,1,0.6804784860672427,0.00022995088133128002,0.8079005479812622,0.15229196846485138,0.8638848662376404,COMPLETE
354,0.2193116843700409,Sigmoid,39,329,22,0.0011421555160949538,1,0.6746324422632504,0.0017865859620012573,1.0832140445709229,0.2193116843700409,0.8009668588638306,COMPLETE
355,0.17666734755039215,Sigmoid,76,318,21,0.01320657528689372,1,0.648024940374612,0.0011054675798187735,0.876626193523407,0.17666734755039215,0.8377060890197754,COMPLETE
356,0.20108671486377716,Leaky,51,335,21,0.009266749819393598,1,0.5308090234917621,0.00021664785880424583,2.9010579586029053,0.20108671486377716,0.8241821527481079,COMPLETE
357,0.20776396989822388,Sigmoid,44,311,22,0.006035127046854118,1,0.61260779746577,0.00015420832049709227,1.4420628547668457,0.20776396989822388,0.8197863101959229,COMPLETE
358,0.28912094235420227,Sigmoid,22,343,21,0.008128740727798877,1,0.3149883420602688,0.006022665711668766,1.0703086853027344,0.28912094235420227,0.7418497204780579,COMPLETE
359,0.2820715606212616,Sigmoid,47,321,20,0.004054464772139324,1,0.6908339939736681,0.02858133183571592,1.045287013053894,0.2820715606212616,0.7408652901649475,COMPLETE
360,0.2904787063598633,Tanh,55,253,5,0.011099966245270161,1,0.33366936890736165,5.4786915381496955e-05,1.85927152633667,0.2904787063598633,0.7489943504333496,COMPLETE
361,0.20143023133277893,Sigmoid,42,301,21,0.005169091033009769,1,0.49987927306081403,0.00011136160636312501,1.566801905632019,0.20143023133277893,0.8239457607269287,COMPLETE
362,0.17890743911266327,Sigmoid,60,332,21,0.0025918561771065005,1,0.6677750237578802,0.00023886280766733807,0.9561651945114136,0.17890743911266327,0.8373032808303833,COMPLETE
363,0.1808066964149475,Sigmoid,45,339,22,0.006621586040153527,1,0.633712256711619,0.00018705031132203764,0.856157660484314,0.1808066964149475,0.8358710408210754,COMPLETE
364,0.3025074005126953,Sigmoid,92,325,20,0.008088838395222186,1,0.7991183917194072,0.013664711848810612,0.9213213920593262,0.3025074005126953,0.7437346577644348,COMPLETE
365,0.16328488290309906,Sigmoid,32,291,21,0.009989955075349784,1,0.7049574975008268,8.26738785689218e-05,0.6216475963592529,0.16328488290309906,0.8474841117858887,COMPLETE
366,0.24544784426689148,ReLU,49,283,20,0.00019600645461467051,1,0.5930958846263058,0.00014338362971027835,1.1800202131271362,0.24544784426689148,0.7855508327484131,COMPLETE
367,0.1948472410440445,Sigmoid,35,308,21,0.02147490542097092,1,0.4876125900297022,9.854755419863874e-05,3.5299477577209473,0.1948472410440445,0.8269563913345337,COMPLETE
368,0.18441453576087952,Sigmoid,30,346,22,0.01602990412916143,1,0.6749952555353139,0.00025754350337841935,0.859656810760498,0.18441453576087952,0.8326372504234314,COMPLETE
369,0.242367222905159,Sigmoid,40,367,21,0.004489700996118323,1,0.3818497801735197,0.00020987751607474365,0.8676431775093079,0.242367222905159,0.8021547794342041,COMPLETE
370,0.18293362855911255,Sigmoid,53,331,12,0.005914917309478811,1,0.7334005961220463,0.00016650218770250936,0.7833326458930969,0.18293362855911255,0.8318719863891602,COMPLETE
371,0.3136536180973053,Sigmoid,47,316,13,0.0009224759579213181,1,0.36686755152200784,0.0002963251853850952,1.120708703994751,0.3136536180973053,0.7448934316635132,COMPLETE
372,0.21352750062942505,Sigmoid,43,277,20,0.029391768991162342,1,0.5691652028677993,0.00011995148039370061,1.1027456521987915,0.21352750062942505,0.8119478225708008,COMPLETE
373,0.243743434548378,Leaky,87,339,21,0.013863530109355026,1,0.17530271523642102,0.006812282521583918,389.9893493652344,0.243743434548378,0.7527971267700195,COMPLETE
374,0.20197246968746185,Tanh,63,359,20,0.0074587081725020245,1,0.6374480606333544,0.00042078099431991253,0.664898157119751,0.20197246968746185,0.81639564037323,COMPLETE
375,0.2739041745662689,Sigmoid,46,296,22,0.003621052509624682,1,0.318856053130821,0.00019492906725395394,1.237070918083191,0.2739041745662689,0.7570298314094543,COMPLETE
376,0.17671211063861847,Sigmoid,38,351,20,0.0022889625652445463,1,0.6908096254469361,0.0002450111401750694,0.9036588668823242,0.17671211063861847,0.8376573324203491,COMPLETE
377,0.23377667367458344,Sigmoid,51,204,22,0.005062289696159451,1,0.65449152156893,0.0037520452511285887,1.0523666143417358,0.23377667367458344,0.7858713865280151,COMPLETE
378,0.29088273644447327,Sigmoid,41,324,21,0.0012428453014300524,1,0.2979421722031913,0.0001413472155858561,1.5191020965576172,0.29088273644447327,0.7419897317886353,COMPLETE
