number,value,params_activation_1,params_batch_size,params_epochs,params_layer_1,params_learning_rate,params_num_layers,params_train_size,params_weight_decay,user_attrs_mape,user_attrs_mse,user_attrs_r2,state
885,0.2793081998825073,Sigmoid,39,325,21,0.0004751388702987298,1,0.5101087786221644,6.168809304399925e-05,1.337465763092041,0.2793081998825073,0.7538341283798218,COMPLETE
886,0.30869340896606445,Sigmoid,33,335,21,0.0059022873952773456,1,0.7442633092624099,0.04590115143697777,0.8233963251113892,0.30869340896606445,0.7207443714141846,COMPLETE
887,0.24549934267997742,Sigmoid,34,238,22,0.003633917935441081,1,0.7662680636262688,0.002298765521568052,0.9462471604347229,0.24549934267997742,0.7826191782951355,COMPLETE
888,0.282138854265213,Sigmoid,34,305,21,0.005668143080084542,1,0.2845010395802206,0.0001139651697524668,2.1478207111358643,0.282138854265213,0.7446252107620239,COMPLETE
889,0.19327659904956818,Sigmoid,31,355,21,0.02422618007875511,1,0.7152269184460074,0.0011442215963131251,1.0177961587905884,0.19327659904956818,0.8224005699157715,COMPLETE
890,0.1676788628101349,Sigmoid,32,316,22,0.004634195207961311,1,0.6795221931637279,4.580393179490672e-05,0.8788531422615051,0.1676788628101349,0.8493068814277649,COMPLETE
891,0.4934537708759308,Leaky,28,197,21,1.2265988887384543e-05,1,0.6971204794570619,0.00013608292188066178,0.9279271364212036,0.4934537708759308,0.5439114570617676,COMPLETE
892,0.25820058584213257,Sigmoid,30,126,21,0.0025733871695601414,1,0.5416466529257634,2.9818941542668123e-05,2.3347887992858887,0.25820058584213257,0.7763844132423401,COMPLETE
893,0.1879764348268509,Sigmoid,36,65,22,0.03129552705173199,1,0.6545664217799184,1.905231884674585e-05,0.7257173657417297,0.1879764348268509,0.8278222680091858,COMPLETE
894,0.9227685332298279,Sigmoid,38,286,21,4.788242219669604e-05,1,0.1050563783853169,8.61877102310567e-05,0.9063549041748047,0.9227685332298279,0.1555137038230896,COMPLETE
895,0.19066619873046875,Tanh,29,345,20,0.006837147787119721,1,0.7292561922368043,0.00011441122637324502,0.6198189854621887,0.19066619873046875,0.8276106715202332,COMPLETE
896,0.3435823917388916,Sigmoid,26,373,21,0.007942326951555369,1,0.1101524666483089,0.00015138937767599696,0.6872985363006592,0.3435823917388916,0.6751425266265869,COMPLETE
897,0.26722463965415955,Sigmoid,42,328,20,0.002029183681970739,1,0.38466712525985947,0.00018639069711675815,1.0327873229980469,0.26722463965415955,0.7781050205230713,COMPLETE
898,0.18878604471683502,Sigmoid,62,230,23,0.0428824253853596,1,0.5721310200300245,6.082697983378644e-05,0.6020827889442444,0.18878604471683502,0.835137128829956,COMPLETE
899,0.2078106701374054,Sigmoid,40,296,22,0.05127090142005949,1,0.7748933857592465,0.0004560394009997892,1.1988945007324219,0.2078106701374054,0.821195662021637,COMPLETE
900,0.24857553839683533,Leaky,44,338,21,0.005547719044437967,1,0.3148508821478857,0.003510514588586204,1.1096359491348267,0.24857553839683533,0.7774472832679749,COMPLETE
901,0.19191011786460876,Sigmoid,33,363,20,0.003901753919048535,1,0.6205707147126902,0.0005155789625806895,1.2256861925125122,0.19191011786460876,0.8291273713111877,COMPLETE
902,0.27104586362838745,Sigmoid,94,318,21,0.006414481595126709,1,0.6788118179324566,0.017915796479220553,1.0306452512741089,0.27104586362838745,0.7556771039962769,COMPLETE
903,0.17023001611232758,Sigmoid,24,351,20,0.0032566243255556437,1,0.6522079482455823,0.00013412322822407423,0.7249882221221924,0.17023001611232758,0.8434864282608032,COMPLETE
904,0.32975485920906067,Sigmoid,67,302,22,0.004632008017321909,1,0.3632025245993447,0.006994216947922254,1.6963056325912476,0.32975485920906067,0.7296102046966553,COMPLETE
905,0.18866564333438873,Sigmoid,58,329,6,0.008950890839603598,1,0.7075973625459457,0.00020343412064642715,0.9697758555412292,0.18866564333438873,0.8250917792320251,COMPLETE
906,0.19723550975322723,Sigmoid,90,255,21,0.020838606006440753,1,0.4823279296273784,0.00010664248929844497,2.0788826942443848,0.19723550975322723,0.8225687146186829,COMPLETE
907,0.2902887761592865,Tanh,36,339,11,0.016217822475095196,1,0.5910877113780596,0.03125260540895977,1.3723032474517822,0.2902887761592865,0.7447908520698547,COMPLETE
908,0.30921563506126404,Sigmoid,40,383,20,0.0072578920981921985,1,0.10123937571600922,0.0002906973605294082,0.7067039012908936,0.30921563506126404,0.707900881767273,COMPLETE
909,0.27016109228134155,Leaky,42,313,21,0.09099239623081325,1,0.5108569186885096,0.000790388397462008,1.7170207500457764,0.27016109228134155,0.762444019317627,COMPLETE
910,0.20318621397018433,Sigmoid,45,321,22,0.0010607298954639804,1,0.6751418639089299,0.00016033021355066503,1.0530307292938232,0.20318621397018433,0.8156012892723083,COMPLETE
911,0.24402445554733276,Sigmoid,56,285,20,0.010292904246153808,1,0.2125145285876149,0.0007306809604565649,0.865053653717041,0.24402445554733276,0.7601971626281738,COMPLETE
912,0.2737593650817871,Sigmoid,79,349,19,0.06339344505524902,1,0.3452666076298784,0.00023896720099804056,1.1471282243728638,0.2737593650817871,0.7675060033798218,COMPLETE
913,0.41360387206077576,Sigmoid,38,333,21,3.849705509245122e-05,1,0.7378293917603098,0.08595735148803363,0.7372334003448486,0.41360387206077576,0.6245168447494507,COMPLETE
914,0.8853410482406616,Sigmoid,44,309,21,1.005906941086354e-05,1,0.6240351582332259,7.668552949283684e-05,0.9421968460083008,0.8853410482406616,0.20473265647888184,COMPLETE
915,0.36299875378608704,Sigmoid,27,342,22,0.000622945889330234,1,0.33016474953045993,0.055653942361659166,1.487446904182434,0.36299875378608704,0.6836830377578735,COMPLETE
916,0.2614997625350952,Sigmoid,60,265,15,0.005198235610043254,1,0.20211451617238285,0.00019035889543630644,1.050707221031189,0.2614997625350952,0.7438393831253052,COMPLETE
917,0.832920253276825,Sigmoid,46,369,20,2.6875404030726924e-05,1,0.16169284184904895,0.000606493570730196,1.0996984243392944,0.832920253276825,0.14401477575302124,COMPLETE
918,0.195352703332901,Leaky,42,359,21,0.028811514010893786,1,0.6985980789129739,0.0014878208458812964,0.7907332181930542,0.195352703332901,0.8200060129165649,COMPLETE
919,0.20452511310577393,Sigmoid,41,300,24,0.006391576656718166,1,0.4739764508914892,5.248514084495051e-05,1.443284511566162,0.20452511310577393,0.8229473233222961,COMPLETE
920,0.3742891252040863,Sigmoid,44,470,20,0.0001155675688248405,1,0.41070816270387156,0.05073530725996861,1.2363897562026978,0.3742891252040863,0.6741805672645569,COMPLETE
921,0.18204057216644287,Tanh,35,326,21,0.002551849561262872,1,0.642597640037963,9.464730110524831e-05,1.0308375358581543,0.18204057216644287,0.8365546464920044,COMPLETE
922,0.14991702139377594,Sigmoid,32,279,20,0.008364464245859378,1,0.6668832233416838,0.00013073073191785338,0.6621496081352234,0.14991702139377594,0.8635941743850708,COMPLETE
923,0.2653466463088989,Sigmoid,31,262,19,0.0012361399919372383,1,0.17186789810082692,0.00012413780482004318,1.4082963466644287,0.2653466463088989,0.7317023277282715,COMPLETE
924,0.24707143008708954,Sigmoid,32,273,19,0.008946227519977711,1,0.13702075886618756,0.0008878872048882653,0.6866905689239502,0.24707143008708954,0.7525054216384888,COMPLETE
925,0.23671533167362213,Sigmoid,30,282,19,0.00029185844889780904,1,0.6627658958529624,0.00010823755124240453,0.9251248836517334,0.23671533167362213,0.7848591208457947,COMPLETE
926,0.27052587270736694,Sigmoid,29,269,20,0.0077748672714805424,1,0.29075935326834373,0.000133862687877027,1.2958908081054688,0.27052587270736694,0.7596268653869629,COMPLETE
927,0.29309138655662537,Leaky,32,279,20,0.011923491789917341,1,0.33556272542040266,0.00014354082805903277,18.20997428894043,0.29309138655662537,0.747818112373352,COMPLETE
928,0.18542364239692688,Sigmoid,28,248,10,0.009482578680696008,1,0.6176420212163244,6.805694355583507e-05,1.638556957244873,0.18542364239692688,0.833908200263977,COMPLETE
929,0.5465367436408997,Sigmoid,32,274,18,0.00015153602852023505,1,0.12108144722660412,0.01313760571174251,0.7236935496330261,0.5465367436408997,0.4847915768623352,COMPLETE
930,0.19420801103115082,Sigmoid,34,290,20,0.006052025148392304,1,0.5919101674812337,9.082634432937483e-05,0.9461499452590942,0.19420801103115082,0.8299156427383423,COMPLETE
931,0.23063835501670837,Sigmoid,28,289,19,0.007890001053886164,1,0.6458526261766041,0.004530768065707898,0.7917335629463196,0.23063835501670837,0.787035346031189,COMPLETE
932,0.26324084401130676,Sigmoid,30,284,20,0.00033076471137383846,1,0.7989940263184866,0.00011727002219090061,0.8419772982597351,0.26324084401130676,0.7769988179206848,COMPLETE
933,0.2613547444343567,Sigmoid,34,273,20,9.433968718493582e-05,1,0.6717076777043145,0.00017307469820352766,0.9794789552688599,0.2613547444343567,0.7612006068229675,COMPLETE
934,0.20554189383983612,Tanh,38,298,20,0.004569358994865012,1,0.6344938109540997,8.639687190664564e-05,0.8076366186141968,0.20554189383983612,0.8137286901473999,COMPLETE
935,0.3377058207988739,Sigmoid,35,279,20,0.00020239420242572985,1,0.18110063034963128,0.03686134628186138,0.9213601350784302,0.3377058207988739,0.6643776297569275,COMPLETE
936,0.16118396818637848,Sigmoid,33,266,21,0.0108181972415353,1,0.681176114542842,0.00015601128202536572,0.6411372423171997,0.16118396818637848,0.8562342524528503,COMPLETE
937,0.18626143038272858,Sigmoid,53,293,21,0.0068380866012521715,1,0.609461012689146,0.0003643118012988987,1.3651719093322754,0.18626143038272858,0.8373715877532959,COMPLETE
938,0.26807066798210144,Leaky,37,302,19,0.00010611749554483986,1,0.4396532124962666,0.00010078932187225135,1.3190981149673462,0.26807066798210144,0.7661710381507874,COMPLETE
939,0.20265096426010132,Sigmoid,32,309,18,0.0038877865578056366,1,0.4437195501335846,0.0001279162053260705,1.113545536994934,0.20265096426010132,0.822053074836731,COMPLETE
940,0.19615057110786438,Sigmoid,36,292,20,0.09911939121465217,1,0.713026352048242,3.688848832530765e-05,1.0884665250778198,0.19615057110786438,0.818840742111206,COMPLETE
941,0.348717600107193,Sigmoid,40,283,21,0.005447554581237276,1,0.23930443028257314,0.06405299224518947,0.984703004360199,0.348717600107193,0.6698412299156189,COMPLETE
942,0.2971264719963074,Sigmoid,47,319,20,0.0003801929725926046,1,0.24502089336269905,0.00030758133882188263,0.9882904887199402,0.2971264719963074,0.7156012058258057,COMPLETE
943,0.1630944162607193,Sigmoid,55,308,19,0.008503199698205576,1,0.6609149930883683,7.013609224004093e-05,0.7586972117424011,0.1630944162607193,0.8510220050811768,COMPLETE
944,0.26687243580818176,Sigmoid,65,318,16,0.013780334206323191,1,0.2998381232754669,0.0002480722728707998,1.18355393409729,0.26687243580818176,0.7640752792358398,COMPLETE
945,0.1920166015625,Leaky,46,258,23,0.009338816483602203,1,0.7369033234867177,0.0009255499886216768,0.6350193023681641,0.1920166015625,0.825454592704773,COMPLETE
946,0.19057658314704895,Sigmoid,74,294,21,0.006914778593135758,1,0.5295215882561852,0.0001534237020325086,2.46449613571167,0.19057658314704895,0.832944929599762,COMPLETE
947,0.2494390904903412,Tanh,44,330,22,0.0031819447912836197,1,0.6920537540350588,0.040930775705531365,0.9068513512611389,0.2494390904903412,0.7693451046943665,COMPLETE
948,0.17550921440124512,Sigmoid,34,306,20,0.005717642535559066,1,0.6364544634195755,0.00041147792461556054,0.8686869740486145,0.17550921440124512,0.8419891595840454,COMPLETE
949,0.262119323015213,Sigmoid,31,203,14,0.0042189110834700665,1,0.21849649983509636,0.00020248374324245794,0.8706873059272766,0.262119323015213,0.7459052205085754,COMPLETE
950,0.30589550733566284,Sigmoid,43,325,22,0.012458379780539559,1,0.5813559068808689,0.013857259041545009,0.9574279189109802,0.30589550733566284,0.7302514314651489,COMPLETE
951,0.3230598568916321,Sigmoid,83,277,21,0.000904787241036158,1,0.38887273569420316,1.5713372802517342e-05,1.681537389755249,0.3230598568916321,0.7307866215705872,COMPLETE
952,0.2712257206439972,Sigmoid,48,335,21,0.00736622216315514,1,0.2589477669905635,0.00010648218831456757,1.4250868558883667,0.2712257206439972,0.745698094367981,COMPLETE
953,0.2846665382385254,Sigmoid,51,316,20,7.277976254057605e-05,1,0.6637511731841234,0.00016803973999205646,0.8935806155204773,0.2846665382385254,0.7420337200164795,COMPLETE
954,0.1829579770565033,Leaky,39,297,21,0.0019833061889503395,1,0.7158136232719974,0.002400627363174052,0.7987247705459595,0.1829579770565033,0.8318822383880615,COMPLETE
955,0.24851632118225098,Sigmoid,72,325,4,0.005059479081110972,1,0.22380770001718528,0.00029499186713790346,0.9772771596908569,0.24851632118225098,0.7548948526382446,COMPLETE
956,0.9967395067214966,Sigmoid,41,287,22,1.4991742683981584e-05,1,0.14726224440588398,0.0013216461149448033,1.3894472122192383,0.9967395067214966,-0.006219387054443359,COMPLETE
957,0.16016632318496704,Sigmoid,53,336,20,0.011029187266442616,1,0.7587167030244597,0.0001386814570638487,0.6616448163986206,0.16016632318496704,0.8590037822723389,COMPLETE
958,0.161148339509964,Sigmoid,30,310,19,0.006303199149155843,1,0.6873942894660325,0.0002323353786553053,0.706505537033081,0.161148339509964,0.8532805442810059,COMPLETE
959,0.26112091541290283,Sigmoid,25,319,21,0.008108597171157533,1,0.3169498255403188,8.444237954380282e-05,1.202028512954712,0.26112091541290283,0.7678586840629578,COMPLETE
960,0.257973849773407,Tanh,46,242,20,0.009985478491279802,1,0.6070087137879114,0.009117127875560849,2.010531425476074,0.257973849773407,0.7764430046081543,COMPLETE
961,0.23728658258914948,Sigmoid,36,268,21,0.0007222397804775997,1,0.6414289375956629,0.0005452775726608332,0.9339003562927246,0.23728658258914948,0.7862356305122375,COMPLETE
962,0.26851075887680054,Sigmoid,57,341,22,0.056377793553624066,1,0.36411681789595607,0.00018915962098142334,0.861362099647522,0.26851075887680054,0.7801016569137573,COMPLETE
963,0.3304206132888794,Leaky,62,301,21,0.07350648346029365,1,0.17994531966681993,4.592060562910549e-05,1.366105318069458,0.3304206132888794,0.6701561212539673,COMPLETE
964,0.2069147527217865,Sigmoid,49,223,20,0.005060023451224576,1,0.5580647220928786,0.00011772318139736006,1.3236976861953735,0.2069147527217865,0.8177931308746338,COMPLETE
965,0.17048777639865875,Sigmoid,27,325,9,0.0035365788886460208,1,0.6646787780676592,0.0003472459073422123,0.8352587223052979,0.17048777639865875,0.8456417322158813,COMPLETE
966,0.2975187599658966,Sigmoid,42,332,21,0.002442716033635311,1,0.11060888807427505,0.0002530652653604773,0.6555938720703125,0.2975187599658966,0.7205551862716675,COMPLETE
967,0.16790476441383362,Sigmoid,45,282,17,0.006350263668742781,1,0.6999008322312728,0.00016906455480582869,0.8406994342803955,0.16790476441383362,0.8461909294128418,COMPLETE
968,0.3644160330295563,Sigmoid,37,308,13,0.01394668634677456,1,0.10714841795833088,0.00020961428376421008,0.7035748958587646,0.3644160330295563,0.652431845664978,COMPLETE
969,0.2618335485458374,Sigmoid,55,343,20,0.008004479192410398,1,0.625758428618116,0.006008755909464458,1.2960304021835327,0.2618335485458374,0.7632665038108826,COMPLETE
970,0.2185141146183014,Sigmoid,52,294,22,0.001282456413025601,1,0.7384385001830197,0.0005017806453646685,0.8096188306808472,0.2185141146183014,0.8020294308662415,COMPLETE
971,0.18124738335609436,Leaky,43,315,21,0.009550885621850476,1,0.6786477488688392,0.00013100848226635134,0.6538819670677185,0.18124738335609436,0.8366221189498901,COMPLETE
972,0.20478293299674988,Sigmoid,39,330,19,0.004404219392092363,1,0.427447986045117,9.43149596008026e-05,12.460941314697266,0.20478293299674988,0.8213719129562378,COMPLETE
973,0.24206635355949402,Tanh,88,344,22,0.00023292533089389346,1,0.7668528173634457,0.001094315424021215,0.9918004870414734,0.24206635355949402,0.7864388823509216,COMPLETE
974,0.17438609898090363,Sigmoid,47,272,20,0.005653435582332428,1,0.649277892577098,0.0002850016885254647,0.7761242389678955,0.17438609898090363,0.8383419513702393,COMPLETE
975,0.20750918984413147,Sigmoid,51,213,21,0.007030188450876184,1,0.4607712630459678,6.515100775058641e-05,1.2046196460723877,0.20750918984413147,0.821431577205658,COMPLETE
976,0.29581916332244873,Sigmoid,33,291,20,0.011275942259902227,1,0.3370675766921532,0.006568169635959473,2.1998775005340576,0.29581916332244873,0.7429393529891968,COMPLETE
977,0.17185020446777344,Sigmoid,85,321,19,0.016706890005857244,1,0.7172879215213434,0.0001511301002905374,0.748605489730835,0.17185020446777344,0.8434697389602661,COMPLETE
978,0.29353654384613037,Sigmoid,41,303,21,0.0003006380038589108,1,0.6097287425691967,5.523294232095981e-05,1.3659405708312988,0.29353654384613037,0.7439881563186646,COMPLETE
979,0.44664686918258667,Sigmoid,49,352,21,3.914762217694978e-05,1,0.531462772595006,0.000652252606827262,1.4069149494171143,0.44664686918258667,0.6100602149963379,COMPLETE
980,0.24002167582511902,Leaky,68,258,20,0.008380894527513772,1,0.4593175446197867,0.0003973612629640924,1.6666063070297241,0.24002167582511902,0.7920395731925964,COMPLETE
981,0.1576129049062729,Sigmoid,45,336,23,0.0041025346028522825,1,0.6896534671551656,0.00019145914461750875,0.8135315179824829,0.1576129049062729,0.8552722334861755,COMPLETE
982,0.16975098848342896,Sigmoid,43,316,22,0.0062083342713040906,1,0.6568787344059346,0.00011264131601478932,0.7608179450035095,0.16975098848342896,0.8450957536697388,COMPLETE
983,0.2588329613208771,Sigmoid,58,324,21,0.0050642521489893694,1,0.20816888670420097,7.961119652776099e-05,0.8803732991218567,0.2588329613208771,0.746391773223877,COMPLETE
984,0.3266250789165497,Sigmoid,60,281,20,0.0005763472232060601,1,0.2682416930637647,0.024044776861863456,1.7714778184890747,0.3266250789165497,0.7008868455886841,COMPLETE
985,0.16430014371871948,Tanh,47,334,22,0.007452148666957088,1,0.7255632636059444,0.002052442328563255,0.8050550818443298,0.16430014371871948,0.8536211848258972,COMPLETE
986,0.16526912152767181,Sigmoid,54,303,21,0.009841430275336202,1,0.6341709553671445,0.00023311737392914787,0.8007254004478455,0.16526912152767181,0.8502256870269775,COMPLETE
987,0.20013871788978577,Sigmoid,52,351,20,0.0014149695598978504,1,0.6776739645276825,0.00031624544201525837,1.0106587409973145,0.20013871788978577,0.8193145990371704,COMPLETE
988,0.2659279704093933,Sigmoid,40,311,21,0.0015815469728384607,1,0.1518771483517942,0.00015686195008375256,8.338037490844727,0.2659279704093933,0.7327823042869568,COMPLETE
989,0.19737784564495087,Sigmoid,29,290,19,0.003522997921421449,1,0.5818372224535926,0.00012798709435719107,1.167493462562561,0.19737784564495087,0.8262409567832947,COMPLETE
990,0.24120771884918213,Leaky,49,328,20,0.002705421095955932,1,0.14097995009316333,0.00020701639273087944,0.9274311661720276,0.24120771884918213,0.7562404274940491,COMPLETE
991,0.7624504566192627,Sigmoid,80,435,21,3.237729649158473e-05,1,0.4934184623844743,0.08528323097510368,0.9132959842681885,0.7624504566192627,0.32521969079971313,COMPLETE
992,0.2570277452468872,Sigmoid,37,84,2,0.01219956945697732,1,0.20035061885375322,0.00010591640369079833,1.129537582397461,0.2570277452468872,0.7465209364891052,COMPLETE
993,0.17761123180389404,Sigmoid,35,344,22,0.0800926763193537,1,0.7062237921073238,0.00028161463103067196,0.7828475832939148,0.17761123180389404,0.834862470626831,COMPLETE
994,0.2749711871147156,Sigmoid,45,299,12,0.0061172858763118565,1,0.12409194211924583,0.00016759384100887526,0.5862812399864197,0.2749711871147156,0.7327438592910767,COMPLETE
995,0.2201661765575409,Sigmoid,42,336,21,0.008213441734869355,1,0.4144642816800299,0.0002485007905081705,1.3399306535720825,0.2201661765575409,0.8095465302467346,COMPLETE
996,0.5719533562660217,Sigmoid,38,316,20,2.158706552676344e-05,1,0.77030151506445,0.0003466727235082659,1.036196231842041,0.5719533562660217,0.4994446635246277,COMPLETE
997,0.2674310803413391,Sigmoid,32,325,21,0.004546948242087909,1,0.1363552761500404,0.0038896869696782243,0.7325686812400818,0.2674310803413391,0.7312204837799072,COMPLETE
998,0.3799239993095398,Tanh,44,347,18,1.887891513982236e-05,1,0.6548341069334664,0.0004227325865613288,0.7860217094421387,0.3799239993095398,0.6520072221755981,COMPLETE
999,0.25190654397010803,Leaky,63,246,17,0.01791092718993729,1,0.6246873982615301,3.887812770627481e-05,0.9980217218399048,0.25190654397010803,0.7720081806182861,COMPLETE
