number,value,params_activation_1,params_activation_2,params_activation_3,params_batch_size,params_epochs,params_layer_1,params_layer_2,params_layer_3,params_learning_rate,params_num_layers,params_train_size,params_weight_decay,user_attrs_mape,user_attrs_mse,user_attrs_r2,state
113,0.4881589412689209,Sigmoid,ReLU,ReLU,55,465,15,23.0,22.0,0.037890313416172515,3,0.7297488875026432,0.0004271212909434176,2.418044090270996,0.44018107652664185,0.4881589412689209,COMPLETE
114,0.14961957931518555,Sigmoid,ReLU,ReLU,43,500,14,10.0,21.0,0.08250865781752686,3,0.7655144016123681,0.0006359298673954628,1.3402117490768433,0.7619872093200684,0.14961957931518555,COMPLETE
115,0.5054782629013062,Sigmoid,ReLU,ReLU,36,424,12,8.0,6.0,0.05586497259919893,3,0.7025497108173634,0.0009017257894361955,0.8314672112464905,0.4382930099964142,0.5054782629013062,COMPLETE
116,0.5789477825164795,Sigmoid,Leaky,Tanh,49,477,13,3.0,23.0,0.06553177156970079,3,0.7401378915747319,0.00020053665768434215,2.0337448120117188,0.36210307478904724,0.5789477825164795,COMPLETE
117,0.32519984245300293,Leaky,ReLU,Sigmoid,10,483,15,2.0,20.0,0.04567905789451134,3,0.6833318917534267,0.00048188801870234624,1.0525320768356323,0.5722588300704956,0.32519984245300293,COMPLETE
118,-0.19134974479675293,Sigmoid,Leaky,Leaky,62,457,16,9.0,12.0,0.025965943990650976,3,0.6493199417501837,0.0003624462231552252,2.604299306869507,0.9113778471946716,-0.19134974479675293,COMPLETE
119,0.3120133876800537,Tanh,Sigmoid,Sigmoid,29,437,11,7.0,24.0,0.09896007764258186,3,0.7712058148247597,0.000288669114946581,2.902562141418457,0.6164734959602356,0.3120133876800537,COMPLETE
120,0.4305764436721802,Sigmoid,,,33,289,23,,,0.05424325313865592,1,0.5567508435523824,0.0013342529287806968,0.8560574054718018,0.5016287565231323,0.4305764436721802,COMPLETE
121,0.5749249458312988,Sigmoid,Leaky,Tanh,50,477,13,3.0,22.0,0.06908595938223148,3,0.749519442209925,0.00022933482137158667,3.828437328338623,0.3862706422805786,0.5749249458312988,COMPLETE
122,0.4945216178894043,Sigmoid,Leaky,Tanh,48,492,13,2.0,23.0,0.06874998955353064,3,0.7314324077706215,0.00018365201932297366,2.484039783477783,0.43470925092697144,0.4945216178894043,COMPLETE
123,0.5120269060134888,Sigmoid,Leaky,Tanh,52,473,14,4.0,23.0,0.08255968599102619,3,0.7071205184371806,0.00038163198527516707,0.7605947256088257,0.43248894810676575,0.5120269060134888,COMPLETE
124,0.020897626876831055,Sigmoid,Leaky,Tanh,56,485,12,1.0,21.0,0.03873401156916012,3,0.7771873984142684,0.0006207388155232328,1.4739129543304443,0.8243639469146729,0.020897626876831055,COMPLETE
125,0.5397353172302246,Sigmoid,Leaky,ReLU,38,191,7,12.0,24.0,0.057476347417037894,3,0.7380291692426276,0.00021006130472507899,3.157421112060547,0.3958256244659424,0.5397353172302246,COMPLETE
126,0.3573116660118103,ReLU,ReLU,Sigmoid,42,465,15,5.0,20.0,0.04724506494652265,3,0.7980012912759665,0.0007824627275944911,1.0236084461212158,0.567682147026062,0.3573116660118103,COMPLETE
127,0.4897838234901428,Sigmoid,Leaky,ReLU,46,500,14,1.0,19.0,0.0850032113082999,3,0.6109217748580612,0.0004518089534853804,0.7602314949035645,0.4629049301147461,0.4897838234901428,COMPLETE
128,0.20977550745010376,Sigmoid,ReLU,ReLU,40,477,17,4.0,23.0,0.0322459332827146,3,0.6628356296763023,0.000280475222561588,1.1451092958450317,0.6314188838005066,0.20977550745010376,COMPLETE
129,0.4826323986053467,Sigmoid,Leaky,Tanh,13,445,10,3.0,22.0,0.0682884465077334,3,0.708074362831984,0.0009588435607149617,0.7749286890029907,0.45854124426841736,0.4826323986053467,COMPLETE
130,0.3382897973060608,Sigmoid,Sigmoid,Sigmoid,54,491,13,13.0,16.0,0.017318708117025225,3,0.683884649568935,0.00015242064133825993,1.1551631689071655,0.5611580014228821,0.3382897973060608,COMPLETE
131,0.4388701319694519,Sigmoid,ReLU,ReLU,41,484,13,9.0,21.0,0.0736757113787706,3,0.7527872239424928,0.0006398841012698593,7.354026794433594,0.509905219078064,0.4388701319694519,COMPLETE
132,0.6822294592857361,Sigmoid,ReLU,ReLU,44,469,13,9.0,21.0,0.06264306102875684,3,0.7510996355079815,0.0005357862349805422,3.4760730266571045,0.28876179456710815,0.6822294592857361,COMPLETE
133,0.30008465051651,Sigmoid,ReLU,ReLU,49,465,14,10.0,22.0,0.06113618359715361,3,0.7313651665999561,0.0005252244456461392,1.7816740274429321,0.6019241809844971,0.30008465051651,COMPLETE
134,0.22748732566833496,Sigmoid,ReLU,ReLU,44,453,15,14.0,21.0,0.041540827956964406,3,0.6365723458466761,0.00032980216297265596,2.7498881816864014,0.6169077157974243,0.22748732566833496,COMPLETE
135,0.33536893129348755,Sigmoid,ReLU,ReLU,51,471,12,8.0,24.0,0.04925574704330721,3,0.7991540761785499,0.0007762467767051675,0.8884164094924927,0.5870639681816101,0.33536893129348755,COMPLETE
136,0.34180760383605957,Tanh,Leaky,Sigmoid,47,491,11,11.0,23.0,0.08684302750266776,3,0.32311810652908746,0.0004308173549724417,1.6641135215759277,0.6770315170288086,0.34180760383605957,COMPLETE
137,0.6216127276420593,Sigmoid,ReLU,ReLU,44,480,13,10.0,22.0,0.06153100204916185,3,0.7012732466315359,0.0010301900212947629,0.8241667747497559,0.3353634178638458,0.6216127276420593,COMPLETE
138,0.053644776344299316,Sigmoid,ReLU,ReLU,36,462,16,10.0,9.0,0.09957781513822553,3,0.6793480348818935,0.0011011946543187854,1.527164101600647,0.8025489449501038,0.053644776344299316,COMPLETE
139,-0.9523004293441772,Sigmoid,ReLU,ReLU,44,500,14,9.0,2.0,0.03516137929610478,3,0.5968691796436446,0.0015511792313231243,2.302239179611206,1.6758882999420166,-0.9523004293441772,COMPLETE
140,0.08769142627716064,Leaky,ReLU,ReLU,39,481,12,6.0,19.0,0.028277412178966198,3,0.7099364266861636,0.0009396136968435272,1.1703764200210571,0.8085761070251465,0.08769142627716064,COMPLETE
141,0.6641801595687866,Sigmoid,ReLU,ReLU,42,473,13,12.0,14.0,0.05911810533365603,3,0.7507252602386628,0.0005589892828561005,3.5517213344573975,0.3051633834838867,0.6641801595687866,COMPLETE
142,0.4991694688796997,Sigmoid,ReLU,ReLU,42,470,13,12.0,14.0,0.05567010796646505,3,0.7666791852678602,0.0005486276460777338,1.2623628377914429,0.4487714469432831,0.4991694688796997,COMPLETE
143,0.44053465127944946,Sigmoid,ReLU,ReLU,38,453,14,11.0,15.0,0.07611033471340721,3,0.7130428881511728,0.000715578002287494,1.3233317136764526,0.4958523213863373,0.44053465127944946,COMPLETE
144,0.18745046854019165,Sigmoid,ReLU,ReLU,45,490,15,15.0,13.0,0.04372661959418794,3,0.6643636239516706,0.001205849636832267,1.039674162864685,0.6492573618888855,0.18745046854019165,COMPLETE
145,0.32288700342178345,Sigmoid,ReLU,ReLU,42,483,13,13.0,14.0,0.054870640077015094,3,0.756056946234782,0.0008141746664313374,1.0719847679138184,0.6153004169464111,0.32288700342178345,COMPLETE
146,0.49242955446243286,Sigmoid,ReLU,ReLU,34,307,14,9.0,20.0,0.0839179723437047,3,0.7983419782929956,0.0005643179953597467,1.0302056074142456,0.4483334422111511,0.49242955446243286,COMPLETE
147,0.4485318064689636,Sigmoid,Tanh,Sigmoid,47,462,12,10.0,21.0,0.06242594007795255,3,0.6920273978168949,0.0003800520564788402,1.6057080030441284,0.4677553176879883,0.4485318064689636,COMPLETE
148,-0.24038589000701904,Sigmoid,ReLU,ReLU,40,446,16,11.0,1.0,0.006227433866458768,3,0.7331563614680804,0.0004911645690977075,1.380749225616455,1.0667264461517334,-0.24038589000701904,COMPLETE
149,0.3853604793548584,Tanh,ReLU,Leaky,44,473,13,12.0,22.0,0.04802409758685175,3,0.6323821049335457,0.0006698053919361134,1.3918312788009644,0.49083444476127625,0.3853604793548584,COMPLETE
150,-0.32869696617126465,Sigmoid,ReLU,ReLU,21,433,15,10.0,17.0,0.01252084561482858,3,0.42129758872737655,0.0014280094175502449,2.8788914680480957,1.1830705404281616,-0.32869696617126465,COMPLETE
151,0.4117164611816406,Sigmoid,Leaky,Sigmoid,53,480,14,2.0,22.0,0.06233121707354403,3,0.7517173560235721,0.0003043586414064094,4.618309020996094,0.5345801115036011,0.4117164611816406,COMPLETE
152,0.4574229121208191,Sigmoid,Leaky,ReLU,49,491,13,2.0,23.0,0.0722241337084777,3,0.7209746692823723,0.0002237210030215963,1.0707244873046875,0.5082229375839233,0.4574229121208191,COMPLETE
153,0.5833103656768799,Sigmoid,Sigmoid,Sigmoid,59,474,12,1.0,12.0,0.03859376395895892,3,0.7757912424461006,0.0004429563565323508,0.8786084055900574,0.35083553194999695,0.5833103656768799,COMPLETE
154,0.0395430326461792,Sigmoid,Sigmoid,Sigmoid,57,500,12,1.0,11.0,0.020221944297619025,3,0.7731376665278806,0.0004318735940562388,1.5889387130737305,0.8086652755737305,0.0395430326461792,COMPLETE
155,0.3172813653945923,Sigmoid,Sigmoid,Sigmoid,63,458,9,1.0,12.0,0.03868270130863049,3,0.6911317359685987,0.0005962487626461794,1.1437805891036987,0.5790819525718689,0.3172813653945923,COMPLETE
156,0.6840763092041016,Sigmoid,Sigmoid,Sigmoid,60,471,11,8.0,13.0,0.0986576617915165,3,0.7734829814940059,0.0010631043225897239,0.9400593042373657,0.2659947872161865,0.6840763092041016,COMPLETE
157,0.3608139157295227,Sigmoid,Sigmoid,Sigmoid,64,474,10,8.0,13.0,0.03233244115293321,3,0.6584411223093806,0.001069098493279507,0.9002014994621277,0.5107335448265076,0.3608139157295227,COMPLETE
158,0.46397215127944946,ReLU,Sigmoid,Sigmoid,59,466,11,14.0,12.0,0.09899636380984708,3,0.7974550070349696,0.0008217921894037804,1.1682649850845337,0.47346964478492737,0.46397215127944946,COMPLETE
159,0.4728773236274719,Sigmoid,Sigmoid,Sigmoid,59,492,11,2.0,14.0,0.049627967588546505,3,0.727449962796856,0.0012725264327196903,1.2086304426193237,0.4937470555305481,0.4728773236274719,COMPLETE
160,-0.07061529159545898,Sigmoid,Sigmoid,Sigmoid,69,453,12,1.0,13.0,0.025329371969696975,3,0.2317408153300235,0.0020011479002860736,1.0000085830688477,1.6192803382873535,-0.07061529159545898,COMPLETE
161,0.5461616516113281,Sigmoid,Sigmoid,Sigmoid,56,483,13,9.0,11.0,0.08075680252219436,3,0.7660901674869984,0.0009452198307598013,1.5513466596603394,0.4066638946533203,0.5461616516113281,COMPLETE
162,0.39063191413879395,Sigmoid,Sigmoid,Sigmoid,60,481,14,10.0,20.0,0.07099178532338588,3,0.7523983369577696,0.00048504884195204283,5.005889892578125,0.5537398457527161,0.39063191413879395,COMPLETE
163,0.3219672441482544,Sigmoid,ReLU,ReLU,66,471,8,9.0,14.0,0.003280867989315628,3,0.6975766996192022,0.0007246334454152811,0.9217017889022827,0.5751073956489563,0.3219672441482544,COMPLETE
164,0.6516429781913757,Sigmoid,Sigmoid,ReLU,37,493,12,13.0,21.0,0.05739610934987335,3,0.7722121562977509,0.0006357845238846235,0.9038839936256409,0.2933022975921631,0.6516429781913757,COMPLETE
165,0.5080347061157227,Sigmoid,Sigmoid,Sigmoid,37,491,20,13.0,22.0,0.05610463071133282,3,0.7218255413472224,0.0003709653698170724,1.0573232173919678,0.4608157277107239,0.5080347061157227,COMPLETE
166,0.628028154373169,Sigmoid,Sigmoid,ReLU,54,129,12,13.0,13.0,0.041787985458521394,3,0.7977544686003524,0.00026107942989001817,1.0111796855926514,0.32856014370918274,0.628028154373169,COMPLETE
167,0.26856935024261475,Sigmoid,Sigmoid,ReLU,53,147,9,13.0,13.0,0.046684907446579306,3,0.6702758589677729,0.0002631073085958953,1.2563024759292603,0.5844404101371765,0.26856935024261475,COMPLETE
168,0.475547730922699,Sigmoid,Sigmoid,ReLU,51,256,11,14.0,15.0,0.09859533998223383,3,0.7378253851219885,0.0010369888545134613,1.9298820495605469,0.45102670788764954,0.475547730922699,COMPLETE
169,0.3395414352416992,Tanh,Sigmoid,,55,333,12,12.0,,0.06564808014580055,2,0.501914221795118,0.00033367166161579975,1.2183613777160645,0.6134071946144104,0.3395414352416992,COMPLETE
170,0.11628323793411255,Sigmoid,Tanh,ReLU,46,494,21,14.0,15.0,0.053866204250830066,3,0.47952958616872693,0.0017380506611224355,8.589383125305176,0.8100800514221191,0.11628323793411255,COMPLETE
171,0.34644168615341187,Sigmoid,Sigmoid,ReLU,58,151,10,13.0,12.0,0.009878896896526058,3,0.772062362673485,0.0004249263155433884,1.3672606945037842,0.5502692461013794,0.34644168615341187,COMPLETE
172,0.13427889347076416,Sigmoid,Sigmoid,ReLU,61,105,12,1.0,10.0,0.04045264029363214,3,0.7878095256805325,0.0006979565183036192,2.26910400390625,0.7646854519844055,0.13427889347076416,COMPLETE
173,0.6052301526069641,Sigmoid,Sigmoid,Sigmoid,31,227,11,12.0,21.0,0.03658755218569212,3,0.7462572319463076,0.0005173885447799103,8.283781051635742,0.3587319552898407,0.6052301526069641,COMPLETE
174,0.0900501012802124,Sigmoid,Sigmoid,ReLU,26,229,10,12.0,21.0,0.001830651202790191,3,0.7066586016175054,0.0008794033628362816,1.3331533670425415,0.806485652923584,0.0900501012802124,COMPLETE
175,0.6818744540214539,Sigmoid,Sigmoid,Sigmoid,30,462,15,13.0,21.0,0.01460792235097268,3,0.7406384700204265,0.0005671373409749457,1.9368793964385986,0.27358660101890564,0.6818744540214539,COMPLETE
176,0.2523752450942993,Sigmoid,Sigmoid,Sigmoid,28,132,7,11.0,20.0,0.01745880268908277,3,0.7983345513159161,0.0005724391861071694,1.562592625617981,0.660371720790863,0.2523752450942993,COMPLETE
177,0.4122055768966675,Leaky,Sigmoid,Sigmoid,31,213,15,12.0,21.0,0.013973251918815316,3,0.7529938250787683,0.0002586059942951299,6.402260780334473,0.534135639667511,0.4122055768966675,COMPLETE
178,0.5556840300559998,Sigmoid,Sigmoid,Sigmoid,33,179,11,15.0,21.0,0.028725886666275232,3,0.7364546443440277,0.0004843663475868137,2.353616952896118,0.3821098208427429,0.5556840300559998,COMPLETE
179,0.2768155336380005,Sigmoid,Sigmoid,Sigmoid,31,271,15,11.0,22.0,0.03282527849684291,3,0.5243782119952077,0.0003685726106982445,1.9768211841583252,0.6850144863128662,0.2768155336380005,COMPLETE
180,0.17519229650497437,Sigmoid,Sigmoid,Sigmoid,24,58,13,13.0,20.0,0.01588714521877833,3,0.679359777643573,0.0006677314451096851,1.3934452533721924,0.6994715332984924,0.17519229650497437,COMPLETE
181,0.3718831539154053,Sigmoid,Leaky,ReLU,42,200,14,13.0,22.0,0.02279258871278274,3,0.7085004005942767,0.0008364117296999324,1.0228151082992554,0.5566979646682739,0.3718831539154053,COMPLETE
182,-0.48953866958618164,Sigmoid,ReLU,ReLU,37,462,14,12.0,24.0,0.06331756695463595,3,0.18304492526167537,0.00113827733633254,3.094757556915283,1.9875322580337524,-0.48953866958618164,COMPLETE
183,0.506523609161377,Sigmoid,Sigmoid,Leaky,35,72,13,13.0,21.0,0.08091320527474745,3,0.7473461879850435,0.0005325136727218745,2.1179940700531006,0.44842779636383057,0.506523609161377,COMPLETE
184,0.1459481120109558,Sigmoid,ReLU,ReLU,39,486,15,14.0,20.0,0.007545177159323265,3,0.6531781520635147,0.0006332103438451209,1.5078442096710205,0.6533463001251221,0.1459481120109558,COMPLETE
185,0.15796959400177002,Sigmoid,Leaky,Sigmoid,35,164,11,5.0,22.0,0.04466643183384653,3,0.7119810488779837,0.0003111883858935953,1.1929212808609009,0.7462888360023499,0.15796959400177002,COMPLETE
186,0.6416279673576355,Sigmoid,ReLU,ReLU,38,479,14,10.0,21.0,0.07239587603989657,3,0.7695367728072642,0.0007687346890871509,1.3858370780944824,0.32112088799476624,0.6416279673576355,COMPLETE
187,0.5727647542953491,Tanh,Sigmoid,ReLU,38,354,16,8.0,21.0,0.05697965822609591,3,0.7986890378391551,0.0007260351034382202,0.964451253414154,0.3773738741874695,0.5727647542953491,COMPLETE
188,0.4314787983894348,Sigmoid,ReLU,Sigmoid,41,468,12,10.0,18.0,0.08737982531116996,3,0.7559114580764816,0.0005118104540394529,0.6601037383079529,0.5166218280792236,0.4314787983894348,COMPLETE
189,0.4941468834877014,ReLU,Leaky,ReLU,28,441,13,10.0,20.0,0.07271733688014642,3,0.7312753094238594,0.00039187678689300755,3.767592668533325,0.4350315034389496,0.4941468834877014,COMPLETE
190,0.537969172000885,Sigmoid,ReLU,ReLU,33,475,18,11.0,19.0,0.051830058675243346,3,0.7701653287436785,0.0008884813472133168,1.9019569158554077,0.4140048027038574,0.537969172000885,COMPLETE
191,0.41018033027648926,Sigmoid,ReLU,ReLU,43,494,14,12.0,21.0,0.06932362835932405,3,0.6882887135476405,0.0013215793708708482,1.2207629680633545,0.5002850890159607,0.41018033027648926,COMPLETE
192,-0.31657564640045166,Sigmoid,ReLU,ReLU,40,481,14,13.0,23.0,0.08696893455922625,3,0.7310140331187088,0.0006037317958842642,1.9776033163070679,1.1322494745254517,-0.31657564640045166,COMPLETE
193,0.4882344603538513,Sigmoid,ReLU,ReLU,30,500,15,10.0,14.0,0.006136569832441864,3,0.693504436004233,0.001053177877272275,1.386555790901184,0.43407952785491943,0.4882344603538513,COMPLETE
194,0.601591169834137,Sigmoid,ReLU,ReLU,36,459,13,14.0,22.0,0.010922308057668705,3,0.7693734939749017,0.0007917763658595816,1.433896541595459,0.3569960296154022,0.601591169834137,COMPLETE
195,0.6120330691337585,Sigmoid,ReLU,Sigmoid,35,458,13,14.0,22.0,0.010738740120560059,3,0.7991709633339771,0.0008242947588974916,0.7575849890708923,0.34268850088119507,0.6120330691337585,COMPLETE
196,0.6005998849868774,Sigmoid,ReLU,Sigmoid,35,467,12,15.0,22.0,0.010422136896842892,3,0.7976729709789631,0.0007878341345202028,0.8195160627365112,0.3527873754501343,0.6005998849868774,COMPLETE
197,0.5525814294815063,Sigmoid,ReLU,Sigmoid,36,459,12,16.0,22.0,0.008711453657635685,3,0.7785987776486968,0.0007492179844230773,0.9367638826370239,0.376708060503006,0.5525814294815063,COMPLETE
198,0.48184919357299805,Sigmoid,ReLU,Sigmoid,34,453,12,15.0,22.0,0.006808381680525282,3,0.7996218799877639,0.0008724536040225428,0.8048486709594727,0.45767897367477417,0.48184919357299805,COMPLETE
199,0.6612163186073303,Sigmoid,ReLU,Sigmoid,32,414,13,14.0,22.0,0.01157313125764285,3,0.7552082339127086,0.000632175267386732,4.04667854309082,0.3078566789627075,0.6612163186073303,COMPLETE
200,0.4288560748100281,Sigmoid,ReLU,Sigmoid,32,424,13,16.0,23.0,0.011100342294125798,3,0.7633800238022176,0.000743508991208788,1.24527108669281,0.5117760896682739,0.4288560748100281,COMPLETE
201,0.4483214020729065,Sigmoid,ReLU,Sigmoid,35,400,13,15.0,22.0,0.013074093686408899,3,0.799944918563255,0.0006208581008408284,1.0445137023925781,0.4872938394546509,0.4483214020729065,COMPLETE
202,0.7187727093696594,Sigmoid,ReLU,Sigmoid,37,378,12,14.0,21.0,0.009758481604539949,3,0.7506649665861356,0.0009696197323601132,1.9669393301010132,0.25555452704429626,0.7187727093696594,COMPLETE
203,0.5081081390380859,Sigmoid,ReLU,Sigmoid,38,470,12,15.0,21.0,0.010594059254632242,3,0.7566360637418822,0.0009405433553067123,2.9062814712524414,0.44698789715766907,0.5081081390380859,COMPLETE
204,0.32959306240081787,Sigmoid,ReLU,Sigmoid,36,417,11,14.0,22.0,0.009271238191129263,3,0.74328231479131,0.0007628497946371948,3.5482192039489746,0.6092065572738647,0.32959306240081787,COMPLETE
205,0.526016891002655,Sigmoid,ReLU,Sigmoid,32,448,13,14.0,21.0,0.008099255481057333,3,0.7660800649418658,0.001027280502002445,1.060577154159546,0.42471471428871155,0.526016891002655,COMPLETE
206,0.5463983416557312,Sigmoid,ReLU,Sigmoid,30,366,12,14.0,23.0,0.012163526436447376,3,0.736419450034988,0.0006297682984967005,3.0047082901000977,0.39009547233581543,0.5463983416557312,COMPLETE
207,0.6128005981445312,Sigmoid,ReLU,Sigmoid,36,464,13,14.0,22.0,0.01530403408041223,3,0.7994732000113047,0.0008665791797471325,0.867430567741394,0.342010498046875,0.6128005981445312,COMPLETE
208,0.5250248312950134,Sigmoid,ReLU,Sigmoid,34,465,12,15.0,22.0,0.013296133242242795,3,0.7954279840399494,0.0011772651897886,0.6315280795097351,0.41954225301742554,0.5250248312950134,COMPLETE
209,0.6212960481643677,Sigmoid,ReLU,Sigmoid,37,477,13,14.0,21.0,0.010364847184619667,3,0.7722220435106962,0.0008349594258257779,0.7796036005020142,0.31885313987731934,0.6212960481643677,COMPLETE
210,0.44841140508651733,Sigmoid,ReLU,Sigmoid,37,477,13,14.0,21.0,0.014132786476488884,3,0.7587312339126017,0.0014385354657075182,1.090153694152832,0.4942534267902374,0.44841140508651733,COMPLETE
211,0.6057182550430298,Sigmoid,ReLU,Sigmoid,39,468,13,17.0,22.0,0.011791680920649717,3,0.7751040917127934,0.0008289724147850525,0.942725419998169,0.3319690227508545,0.6057182550430298,COMPLETE
212,0.6164038777351379,Sigmoid,ReLU,Sigmoid,39,461,13,18.0,22.0,0.009152161444209684,3,0.7700925327577111,0.0009607638015702044,1.439477801322937,0.34372302889823914,0.6164038777351379,COMPLETE
213,0.5885993242263794,Sigmoid,ReLU,Sigmoid,39,457,13,19.0,21.0,0.015459096737855633,3,0.7710137591740766,0.0009686055534989814,1.1717026233673096,0.3686373829841614,0.5885993242263794,COMPLETE
214,0.5461028814315796,Sigmoid,ReLU,Sigmoid,40,461,13,18.0,22.0,0.011273197036757032,3,0.7336081952861044,0.0008685359087893251,1.8873313665390015,0.3903495669364929,0.5461028814315796,COMPLETE
215,0.5723943710327148,Sigmoid,ReLU,Sigmoid,38,445,14,19.0,7.0,0.011361205549802557,3,0.7613777473174566,0.0012084438204159563,0.6559717059135437,0.38315796852111816,0.5723943710327148,COMPLETE
216,0.5133711099624634,Sigmoid,ReLU,Sigmoid,37,476,13,18.0,21.0,0.01896377681604515,3,0.7249037458119082,0.0010264787940343822,0.8624036908149719,0.45581716299057007,0.5133711099624634,COMPLETE
217,-0.10946321487426758,Sigmoid,ReLU,Sigmoid,41,451,14,17.0,22.0,0.008948146206014628,3,0.43428724861068224,0.0005396596882068688,2.7034363746643066,0.9306938052177429,-0.10946321487426758,COMPLETE
218,0.5193636417388916,Sigmoid,ReLU,Sigmoid,33,437,13,17.0,21.0,0.008985199504010957,3,0.7769374908611963,0.0006703327676266141,1.1707658767700195,0.40467604994773865,0.5193636417388916,COMPLETE
219,0.5790553689002991,Sigmoid,,,39,469,12,,,0.015627500711968383,1,0.7404724534038054,0.0008170394107907583,1.781957745552063,0.36201056838035583,0.5790553689002991,COMPLETE
220,0.596856951713562,Sigmoid,ReLU,,36,482,14,14.0,,0.007363156571436862,2,0.7976907149579061,0.0013398458554287652,0.5552378296852112,0.35609346628189087,0.596856951713562,COMPLETE
221,0.43789058923721313,Sigmoid,ReLU,Sigmoid,37,484,13,18.0,23.0,0.013988336678616212,3,0.7633506253532254,0.0006429669471210029,1.4489164352416992,0.5036807060241699,0.43789058923721313,COMPLETE
222,0.44397109746932983,Sigmoid,ReLU,Sigmoid,34,475,13,14.0,23.0,0.0057423474933590455,3,0.7191527882621438,0.0005283118860876325,0.8441605567932129,0.520823061466217,0.44397109746932983,COMPLETE
223,0.5678797960281372,Sigmoid,ReLU,Sigmoid,43,461,12,13.0,22.0,0.01829638131044997,3,0.7718966656148598,0.0008700098412800104,0.7758539915084839,0.3638274371623993,0.5678797960281372,COMPLETE
224,0.646368145942688,Sigmoid,ReLU,Sigmoid,40,486,14,21.0,22.0,0.009563353957101289,3,0.7426130574620495,0.0007214910389280652,1.8919744491577148,0.30412188172340393,0.646368145942688,COMPLETE
225,0.39379626512527466,Sigmoid,ReLU,Sigmoid,40,471,14,13.0,21.0,0.009675975915366099,3,0.7998375842802851,1.0177061653002549e-05,1.5225058794021606,0.5354555249214172,0.39379626512527466,COMPLETE
