number,value,params_activation_1,params_batch_size,params_epochs,params_layer_1,params_learning_rate,params_num_layers,params_train_size,params_weight_decay,user_attrs_mape,user_attrs_mse,user_attrs_r2,state
257,0.24024255573749542,ReLU,79,209,22,0.0013980052783279168,1,0.5564622223119396,0.002344826632442826,1.5375604629516602,0.24024255573749542,0.6382626295089722,COMPLETE
258,0.2529228925704956,ReLU,80,170,17,0.0018504312720319625,1,0.4936295497563877,0.004121638404909979,3.038773536682129,0.2529228925704956,0.6580492258071899,COMPLETE
259,0.640221357345581,ReLU,83,189,20,0.08714531663386721,1,0.5194018057504831,0.0030552819184615112,5.36310338973999,0.640221357345581,0.22453844547271729,COMPLETE
260,0.264687716960907,ReLU,81,213,18,0.002343185468603964,1,0.6341204700653131,0.004691823321396013,1.2644010782241821,0.264687716960907,0.645803689956665,COMPLETE
261,0.43828296661376953,ReLU,77,243,23,0.00705210735478072,1,0.5724831992428934,0.010127279596384696,1.6247217655181885,0.43828296661376953,0.41177958250045776,COMPLETE
262,1.054365873336792,ReLU,87,206,21,0.04469845741422254,1,0.42154092596892834,0.0017116530925684853,2.672212600708008,1.054365873336792,-0.11577033996582031,COMPLETE
263,0.2841288447380066,ReLU,83,258,19,0.00302738224629165,1,0.5388319035248473,0.005358258828343663,2.300629138946533,0.2841288447380066,0.6690038442611694,COMPLETE
264,0.23614872992038727,ReLU,31,217,20,0.0015769978105189,1,0.5966104465863901,0.00364753389537267,1.1729389429092407,0.23614872992038727,0.6894934773445129,COMPLETE
265,0.44617873430252075,Sigmoid,79,231,22,0.001081065048442768,1,0.47618040824130636,0.019060840469887957,9.697775840759277,0.44617873430252075,0.3796759843826294,COMPLETE
266,0.3270365595817566,ReLU,86,200,21,0.0013163419579008745,1,0.6566004111003982,0.002845146884334776,1.186672568321228,0.3270365595817566,0.584120512008667,COMPLETE
267,0.231759712100029,ReLU,74,247,18,0.0019606917579993673,1,0.5653738632023293,0.004046450047326709,1.6345453262329102,0.231759712100029,0.6705173254013062,COMPLETE
268,0.29526033997535706,ReLU,84,223,23,0.0016750149593716308,1,0.7369168035530121,0.00817908884879703,1.5327659845352173,0.29526033997535706,0.6410881280899048,COMPLETE
269,0.2592516541481018,ReLU,81,238,13,0.0036663637392451926,1,0.5139230656696053,0.0013450410796687514,2.859861135482788,0.2592516541481018,0.6681157350540161,COMPLETE
270,0.3149290382862091,ReLU,71,191,18,0.004919440004642656,1,0.6140710170915333,0.0025025752048483435,1.3895741701126099,0.3149290382862091,0.6070220470428467,COMPLETE
271,0.2801295816898346,ReLU,84,215,19,0.0027366465352216614,1,0.5377887113889093,0.0033764153980767523,2.290977716445923,0.2801295816898346,0.6736627817153931,COMPLETE
272,0.3759123384952545,ReLU,78,204,21,0.0021736517379025103,1,0.4583926814576451,0.00033980471519887145,5.1780242919921875,0.3759123384952545,0.4476996660232544,COMPLETE
273,0.2621437609195709,ReLU,82,227,19,0.0013482702534029372,1,0.5871655830550578,0.005088191385270094,1.1709394454956055,0.2621437609195709,0.65531325340271,COMPLETE
274,0.46588125824928284,ReLU,86,182,22,0.0007106377658207077,1,0.40372637600789985,0.0008798914269756802,1.5685068368911743,0.46588125824928284,0.48666369915008545,COMPLETE
275,0.24619822204113007,ReLU,80,254,20,0.0010484441562295791,1,0.5604275402841543,0.0060725126905320104,1.783482551574707,0.24619822204113007,0.6499907970428467,COMPLETE
276,0.26404720544815063,ReLU,76,267,17,0.0016436186419391103,1,0.5099375473620225,0.02576124892935997,2.69683837890625,0.26404720544815063,0.66197669506073,COMPLETE
277,0.342373251914978,ReLU,82,211,18,0.002418573443105766,1,0.38715365223150916,0.004106354504719636,1.4177535772323608,0.342373251914978,0.6008979082107544,COMPLETE
278,0.7260695695877075,Tanh,88,233,23,0.012683947452078494,1,0.3078713218410874,0.0002317802932387088,7.169500827789307,0.7260695695877075,-0.06109189987182617,COMPLETE
279,0.21494410932064056,ReLU,84,283,20,0.0019290773847865878,1,0.4893515640225121,0.006871070068335726,2.875859260559082,0.21494410932064056,0.7093963623046875,COMPLETE
280,0.21622231602668762,ReLU,85,222,20,0.002012535431064108,1,0.4915611313447163,0.007841679211737878,3.005856990814209,0.21622231602668762,0.7076681852340698,COMPLETE
281,0.2659565806388855,ReLU,85,243,20,0.003031813681202317,1,0.47780389156301184,0.007684973341714152,10.424768447875977,0.2659565806388855,0.6302395462989807,COMPLETE
282,0.2168460190296173,ReLU,88,224,20,0.002035187581976089,1,0.4951259408329396,0.009376034472572473,3.0116381645202637,0.2168460190296173,0.7068250179290771,COMPLETE
283,0.2216230183839798,ReLU,90,234,20,0.0019808723941878124,1,0.4939608158161117,0.008820646119812038,3.08697509765625,0.2216230183839798,0.7003664970397949,COMPLETE
284,0.268184095621109,ReLU,94,237,20,0.002618802337822262,1,0.4822139222326197,0.011216382945646301,10.770916938781738,0.268184095621109,0.6271426677703857,COMPLETE
285,0.3608790636062622,ReLU,91,248,21,0.005899958854237118,1,0.49117654584853293,0.009401668017066572,2.9538345336914062,0.3608790636062622,0.5120928287506104,COMPLETE
286,0.3992825746536255,ReLU,87,230,20,0.03230923478484351,1,0.4600781388380051,0.013151004446957812,6.226092338562012,0.3992825746536255,0.4133634567260742,COMPLETE
287,0.43345895409584045,ReLU,90,238,21,0.004376747234805062,1,0.43985867264066525,0.009018438237082033,2.7902817726135254,0.43345895409584045,0.4383392930030823,COMPLETE
288,0.215354323387146,ReLU,89,287,20,0.0021893736850382268,1,0.49089224173898166,0.0075818482613008225,2.6367321014404297,0.215354323387146,0.7088417410850525,COMPLETE
289,0.29255881905555725,ReLU,90,274,20,0.003470941064659638,1,0.46915143311144014,0.007459835969140028,5.201440811157227,0.29255881905555725,0.5701648592948914,COMPLETE
290,0.3302558362483978,Sigmoid,89,308,21,0.0024054581691147895,1,0.5038524202309882,0.008676433544155893,2.674581527709961,0.3302558362483978,0.5772188901901245,COMPLETE
291,0.2303881198167801,ReLU,93,288,20,0.0020531240283589713,1,0.4787968036563352,0.006751911701497817,9.523845672607422,0.2303881198167801,0.6796904802322388,COMPLETE
292,0.22615909576416016,ReLU,87,296,20,0.002952534099597471,1,0.4964390301413475,0.007514450726035002,3.1980793476104736,0.22615909576416016,0.6942337155342102,COMPLETE
293,0.3228648900985718,ReLU,88,278,21,0.002831447021779737,1,0.49769867505477383,0.007024149668791054,2.8434364795684814,0.3228648900985718,0.5634878277778625,COMPLETE
294,0.46300190687179565,ReLU,89,301,22,0.0031255163867161127,1,0.44082677554678906,0.008027428649683852,3.6782233715057373,0.46300190687179565,0.4000585675239563,COMPLETE
295,0.34461525082588196,ReLU,91,294,20,0.00423877028033004,1,0.47095244937794717,0.009419520528832746,5.36501932144165,0.34461525082588196,0.4936821460723877,COMPLETE
296,0.414995938539505,ReLU,87,281,22,0.0023277180970767124,1,0.4541637991364302,0.006626828012001397,2.3891568183898926,0.414995938539505,0.4686529040336609,COMPLETE
297,0.3261220455169678,ReLU,88,293,19,0.003417923806274947,1,0.5196184873800616,0.01048656949227408,3.120915174484253,0.3261220455169678,0.6049879789352417,COMPLETE
298,0.34560710191726685,ReLU,86,304,21,0.002721899438381005,1,0.5009399114036348,0.0011398926360144837,2.558331251144409,0.34560710191726685,0.55756676197052,COMPLETE
299,0.3367326259613037,ReLU,85,244,20,0.0019850782905648013,1,0.4202878679247306,0.0006308083199697853,1.24000883102417,0.3367326259613037,0.6436566114425659,COMPLETE
300,0.2750416100025177,ReLU,88,291,19,0.002446103173515239,1,0.5232666198066623,0.006538578520381785,2.987105131149292,0.2750416100025177,0.6668586730957031,COMPLETE
301,0.3202464282512665,Tanh,86,286,22,0.0017916108550241484,1,0.48989367070662493,0.00010654488205105253,3.5486645698547363,0.3202464282512665,0.5670279860496521,COMPLETE
302,0.5355297327041626,ReLU,90,256,21,0.0039212238233690706,1,0.4330899626174656,0.0021130461960293823,3.2710070610046387,0.5355297327041626,0.306079626083374,COMPLETE
303,0.2372591644525528,ReLU,84,268,20,0.0019927071387917557,1,0.45828383646029536,0.007450357343489926,4.784278392791748,0.2372591644525528,0.6514126062393188,COMPLETE
304,0.28073880076408386,ReLU,87,228,19,0.003255958066186274,1,0.5301045875543767,0.00575545018808172,2.2946619987487793,0.28073880076408386,0.6729530692100525,COMPLETE
305,0.2506326138973236,ReLU,85,259,20,0.002359923289660352,1,0.5018297524941719,0.0693399704683565,2.4327175617218018,0.2506326138973236,0.6791495084762573,COMPLETE
306,0.30253100395202637,ReLU,93,193,21,0.0016590518025688713,1,0.4656988220748944,0.01268109165670448,4.7826972007751465,0.30253100395202637,0.5555134415626526,COMPLETE
307,0.28560182452201843,ReLU,89,281,22,0.0012139988125972813,1,0.5325880932823862,0.001833804671012228,2.2332024574279785,0.28560182452201843,0.6672878861427307,COMPLETE
308,0.3506557047367096,ReLU,84,316,20,0.002943251398084849,1,0.5072590972786498,0.0007765385993704608,3.5439066886901855,0.3506557047367096,0.5511037111282349,COMPLETE
309,0.7959272265434265,ReLU,86,251,19,7.292062459117041e-05,1,0.4053396865069465,0.00891307853312849,1.4886846542358398,0.7959272265434265,0.12299895286560059,COMPLETE
310,0.4559713900089264,ReLU,96,225,21,0.004920880918487533,1,0.7037546463346663,0.0057118067636878975,2.3242037296295166,0.4559713900089264,0.4904095530509949,COMPLETE
311,0.31475841999053955,ReLU,92,236,22,0.000829860779479323,1,0.365280591353954,0.0005139467302642519,1.5985183715820312,0.31475841999053955,0.5882833003997803,COMPLETE
312,0.27744436264038086,ReLU,87,201,19,0.0021112133042378712,1,0.48089794759522875,0.0014798014801375703,13.314179420471191,0.27744436264038086,0.6142680644989014,COMPLETE
313,0.3972373306751251,ReLU,84,243,21,0.0016061947983564667,1,0.3347106618175013,0.002350864661108864,2.733311414718628,0.3972373306751251,0.4284469485282898,COMPLETE
314,0.47335392236709595,Sigmoid,83,298,20,0.001454708243477289,1,0.24518860019003363,0.016074673258831114,3.280482769012451,0.47335392236709595,0.3553653359413147,COMPLETE
315,0.4409206211566925,ReLU,69,265,22,0.0025877413517647967,1,0.35141742956526134,0.0028694588837954904,1.7483009099960327,0.4409206211566925,0.38706284761428833,COMPLETE
316,0.3274849057197571,ReLU,85,224,20,0.0018618645432513404,1,0.44611457723433157,0.007876330490509228,2.352508544921875,0.3274849057197571,0.58069908618927,COMPLETE
317,0.3212030231952667,ReLU,87,234,23,0.0010609531888688593,1,0.5422860864441958,0.006466899560274031,2.5846428871154785,0.3212030231952667,0.6258141994476318,COMPLETE
318,0.4374420940876007,ReLU,89,178,21,0.020107987311930524,1,0.6351426526256564,0.005379193273170093,1.896539568901062,0.4374420940876007,0.41462957859039307,COMPLETE
319,0.27137818932533264,ReLU,83,204,19,0.0022260913923647764,1,0.5231396402362485,0.0032051737046535794,2.8436481952667236,0.27137818932533264,0.6712960004806519,COMPLETE
320,0.6345561146736145,ReLU,85,222,20,0.058844030620251266,1,0.4940706238852048,0.00934520364279002,6.2992353439331055,0.6345561146736145,0.14208239316940308,COMPLETE
321,0.3097091615200043,ReLU,91,251,19,0.0035480752934683997,1,0.6555431305070952,0.01163023296901895,1.6574456691741943,0.3097091615200043,0.6061551570892334,COMPLETE
322,0.4024893343448639,ReLU,83,195,15,0.0013176581733526285,1,0.3885990782703258,0.0009130764762081138,1.4838162660598755,0.4024893343448639,0.5308209657669067,COMPLETE
323,0.2712431252002716,Tanh,88,331,22,0.0017245718857699121,1,0.6032662246167613,0.0025912926639533136,1.236714243888855,0.2712431252002716,0.6615346670150757,COMPLETE
324,0.5792062282562256,ReLU,86,209,20,0.00018133944702635696,1,0.4738732203883596,0.00392992016279358,10.343804359436035,0.5792062282562256,0.19472742080688477,COMPLETE
325,0.4182542562484741,ReLU,84,231,21,0.002733977777436846,1,0.32037173109183137,0.005259022808980255,3.3586742877960205,0.4182542562484741,0.4063504934310913,COMPLETE
326,0.2871773838996887,ReLU,86,245,23,0.0009476519018171542,1,0.5478517673888541,0.007379098177850313,2.0268168449401855,0.2871773838996887,0.5675920248031616,COMPLETE
327,0.47620832920074463,ReLU,83,215,21,0.0020543655655531935,1,0.2596211494200982,0.0017774791414476142,13.258625984191895,0.47620832920074463,0.3958781361579895,COMPLETE
328,0.766008198261261,ReLU,89,274,20,4.297192412759978e-05,1,0.5124383319213138,0.0014137879347448513,3.1413257122039795,0.766008198261261,0.019385039806365967,COMPLETE
329,0.434346467256546,ReLU,82,186,19,0.001201184183186813,1,0.42085516271066425,0.003403317066327421,1.4494850635528564,0.434346467256546,0.5403579473495483,COMPLETE
330,0.32690155506134033,ReLU,85,225,22,0.001547637547492368,1,0.45140409054996067,0.00611006278055783,1.975691556930542,0.32690155506134033,0.5814460515975952,COMPLETE
331,0.4471660256385803,ReLU,84,287,20,0.00029426154464525336,1,0.5939356612179373,0.0021312844838885523,1.2807471752166748,0.4471660256385803,0.41203171014785767,COMPLETE
332,0.36956965923309326,ReLU,87,234,21,0.003735974960076774,1,0.6873465135030288,0.004608788707318653,2.046926975250244,0.36956965923309326,0.5799479484558105,COMPLETE
333,0.39265164732933044,ReLU,82,209,22,0.0024568728345264546,1,0.28802570402679717,0.009994015671885636,1.7723701000213623,0.39265164732933044,0.47325873374938965,COMPLETE
334,0.3604574501514435,ReLU,91,262,19,0.00046075709079289464,1,0.4848259486334484,0.040178892953536854,12.997663497924805,0.3604574501514435,0.4988546371459961,COMPLETE
335,0.29203638434410095,ReLU,80,199,20,0.0017884705344933746,1,0.6239928405580162,0.0027422275649670886,1.4440957307815552,0.29203638434410095,0.6223959922790527,COMPLETE
336,0.31297072768211365,ReLU,87,241,23,0.0029327555246348503,1,0.5407466429216098,0.00801854369278474,2.697786331176758,0.31297072768211365,0.6354044675827026,COMPLETE
337,0.7201948165893555,Sigmoid,85,219,21,0.0020595914834528124,1,0.19589274153266117,0.0006972742855281925,1.6786876916885376,0.7201948165893555,0.1459013819694519,COMPLETE
338,0.41379034519195557,ReLU,67,71,19,0.0015076973108865018,1,0.5158371194266725,0.0011234796570280712,3.5778818130493164,0.41379034519195557,0.49880069494247437,COMPLETE
339,0.25513264536857605,ReLU,83,232,20,0.0011148345091907277,1,0.5881248351827635,0.00361785852377157,1.1788264513015747,0.25513264536857605,0.664531946182251,COMPLETE
340,0.40578675270080566,ReLU,89,166,21,0.000603141509148956,1,0.7652510798752902,0.004957052791164878,0.9122701287269592,0.40578675270080566,0.5657973289489746,COMPLETE
341,0.5818130970001221,ReLU,80,206,22,0.0001563674826406366,1,0.5488278282248421,0.00040709757912617685,1.4462003707885742,0.5818130970001221,0.12395387887954712,COMPLETE
342,0.2613980174064636,ReLU,82,252,19,0.0023063611124173773,1,0.4659633507657216,0.006965215230280608,5.299642562866211,0.2613980174064636,0.6159471273422241,COMPLETE
343,0.3706356883049011,ReLU,86,223,16,0.0013562786966923343,1,0.273566342745464,0.005858486077092929,1.9143030643463135,0.3706356883049011,0.47661012411117554,COMPLETE
344,0.21836906671524048,ReLU,84,242,20,0.001782138125296743,1,0.4940506874350977,0.0032079271469088433,3.1217668056488037,0.21836906671524048,0.704765796661377,COMPLETE
345,0.663447916507721,ReLU,84,248,22,0.0015907627099966267,1,0.10861530292528439,0.002986459128256645,5.902616500854492,0.663447916507721,-0.004529595375061035,COMPLETE
346,0.2962473928928375,ReLU,59,240,20,0.0018285933716690667,1,0.4336444262281502,0.048219628551223206,2.5005698204040527,0.2962473928928375,0.6161331534385681,COMPLETE
347,0.33916175365448,Tanh,81,258,23,0.0012590062705635729,1,0.6156683975853748,0.003775229880938635,1.328347086906433,0.33916175365448,0.5614626407623291,COMPLETE
348,0.35090288519859314,ReLU,78,229,21,0.0008521515008674704,1,0.34769417611630277,0.0024404642871079817,1.6181734800338745,0.35090288519859314,0.5121992230415344,COMPLETE
349,0.3645801246166229,ReLU,83,241,19,0.006455347451399701,1,0.5715987418757811,0.0030629371839221257,1.5832762718200684,0.3645801246166229,0.510696291923523,COMPLETE
350,0.2687632441520691,ReLU,81,219,22,0.0018229896750283755,1,0.5236583175027716,0.004304462444045681,3.1906280517578125,0.2687632441520691,0.6744632720947266,COMPLETE
351,0.24991288781166077,ReLU,53,212,21,0.015731354334260518,1,0.549121575681964,0.09648459468428115,1.6570985317230225,0.24991288781166077,0.623701810836792,COMPLETE
352,0.2599546015262604,ReLU,85,232,14,0.001526883347061804,1,0.4866165182004466,0.0022964362932297155,2.979978322982788,0.2599546015262604,0.6485422849655151,COMPLETE
353,0.27587196230888367,ReLU,79,190,20,0.002093519265456422,1,0.663735141677918,0.0033807034097936683,1.5714877843856812,0.27587196230888367,0.6593494415283203,COMPLETE
354,0.2984510362148285,ReLU,72,198,12,0.0009817350602465988,1,0.5914162320972034,0.0019570066532431226,1.4548553228378296,0.2984510362148285,0.6075736284255981,COMPLETE
355,0.254163920879364,ReLU,83,268,19,0.0012251631573342255,1,0.4680152723777939,0.004207262397092729,5.625653266906738,0.254163920879364,0.6265756487846375,COMPLETE
356,1.0987346172332764,ReLU,85,256,22,0.007720163206526141,1,0.3827972094657705,1.3239266202045512e-05,3.44339919090271,1.0987346172332764,-0.3570183515548706,COMPLETE
357,0.3038467764854431,ReLU,82,225,20,0.0023162829449502684,1,0.442746876685051,0.06226590388536158,2.7309622764587402,0.3038467764854431,0.6062861680984497,COMPLETE
358,0.29628971219062805,Leaky,80,238,21,0.0017340444114613803,1,0.5084020196879981,0.0028385958778485007,2.666818141937256,0.29628971219062805,0.6207010746002197,COMPLETE
359,0.30264151096343994,ReLU,88,213,23,0.001390914326991062,1,0.5328599411834857,0.02858133183571592,2.4983930587768555,0.30264151096343994,0.6474374532699585,COMPLETE
360,0.2316576987504959,ReLU,84,174,19,0.0025957282104071976,1,0.5670110794243851,0.0048343431224224295,1.6234616041183472,0.2316576987504959,0.6706624031066895,COMPLETE
361,0.3446718156337738,ReLU,40,246,18,0.010483078384436547,1,0.6246968805311007,0.0002761145563272808,1.7310305833816528,0.3446718156337738,0.5543381571769714,COMPLETE
362,1.3757681846618652,Sigmoid,87,206,21,0.002017164749408249,1,0.13238181706548713,0.003571222009777091,3.9117300510406494,1.3757681846618652,-0.7819185256958008,COMPLETE
363,0.31695419549942017,ReLU,90,222,20,0.0007317827785453664,1,0.6015123902742691,0.0005672337173833229,1.1315821409225464,0.31695419549942017,0.6044949889183044,COMPLETE
364,0.3560764491558075,ReLU,82,236,22,0.001496131311978232,1,0.4060128948990626,0.005545026558795743,1.4127962589263916,0.3560764491558075,0.6076533198356628,COMPLETE
365,0.31992965936660767,ReLU,84,200,20,0.0011491658701463184,1,0.7310160126313622,0.0026904284242957885,1.438744068145752,0.31992965936660767,0.6111006736755371,COMPLETE
366,0.7019818425178528,ReLU,77,214,19,2.3231200576844604e-05,1,0.5066577644275148,0.0016198762117990394,2.0624277591705322,0.7019818425178528,0.10134923458099365,COMPLETE
367,0.2986890971660614,ReLU,86,230,21,0.004325117528384381,1,0.5555382029690985,0.0038836815914002065,2.120046854019165,0.2986890971660614,0.5502586364746094,COMPLETE
368,0.528359591960907,ReLU,80,187,2,0.0033170203274455992,1,0.482688552530059,0.014003065959196941,13.253022193908691,0.528359591960907,0.2654196619987488,COMPLETE
369,0.4275883734226227,ReLU,74,248,19,0.0018413521698901303,1,0.29546398081667175,0.004666533205974979,1.8887022733688354,0.4275883734226227,0.4263911843299866,COMPLETE
370,0.3047502040863037,ReLU,94,222,20,0.0023585388822392494,1,0.36885674424252723,0.00014385205443291074,1.6652674674987793,0.3047502040863037,0.6013743877410889,COMPLETE
371,0.47982579469680786,Tanh,84,256,23,0.0016040541823284856,1,0.2295199343558703,0.00037904855534633776,3.6762189865112305,0.47982579469680786,0.32425087690353394,COMPLETE
372,0.33527064323425293,ReLU,88,269,22,0.002705656884746949,1,0.46245443852115736,0.010531464968222336,5.095795631408691,0.33527064323425293,0.5074114799499512,COMPLETE
373,0.22629737854003906,ReLU,82,210,20,0.002040886336467238,1,0.5810201409927567,0.003466327632925456,1.209936261177063,0.22629737854003906,0.6962858438491821,COMPLETE
374,0.30220144987106323,ReLU,86,234,21,0.0013276101471125148,1,0.5294535413995958,3.0052907838432938e-05,2.3377842903137207,0.30220144987106323,0.6479501724243164,COMPLETE
375,0.6001816987991333,ReLU,92,194,17,0.0009537157320581132,1,0.2087730920871737,0.0008196314145600065,1.886095404624939,0.6001816987991333,0.341566264629364,COMPLETE
376,0.5765538215637207,ReLU,81,278,19,0.0001265980595255895,1,0.5023067216794551,0.006294932429734951,2.664891004562378,0.5765538215637207,0.2619174122810364,COMPLETE
377,0.24195465445518494,ReLU,79,224,18,0.0016775116210118574,1,0.5515525805878142,0.00045702797760884385,1.740838646888733,0.24195465445518494,0.635684609413147,COMPLETE
378,0.46791887283325195,ReLU,84,240,22,0.00311368507066206,1,0.44499120886464294,0.002136319290681741,2.834912061691284,0.46791887283325195,0.40089207887649536,COMPLETE
379,0.3050076961517334,ReLU,89,216,20,0.0011366701467001603,1,0.6167182963919414,0.0031362735565533873,1.3278335332870483,0.3050076961517334,0.6056240200996399,COMPLETE
380,0.24955815076828003,Leaky,86,207,23,0.0022162500687529243,1,0.5784962715709455,0.0010199583960646965,1.2214241027832031,0.24955815076828003,0.6650675535202026,COMPLETE
381,0.5743627548217773,ReLU,83,227,21,0.07465404313001128,1,0.5279253225471134,0.00449521317774032,4.1430206298828125,0.5743627548217773,0.30430901050567627,COMPLETE
382,0.356617271900177,ReLU,78,246,20,0.008205441794856945,1,0.6496809104294972,0.0013249245947471746,2.068622350692749,0.356617271900177,0.5465039014816284,COMPLETE
383,0.30271515250205994,ReLU,70,201,18,0.0013653064151405996,1,0.332624133685798,0.01778708763552383,3.248155355453491,0.30271515250205994,0.5644473433494568,COMPLETE
384,0.35644662380218506,ReLU,85,263,11,0.005999523514880294,1,0.48465604643140064,0.0006449751528363644,9.080416679382324,0.35644662380218506,0.504430890083313,COMPLETE
385,0.6227356791496277,ReLU,81,233,22,9.287548387216172e-05,1,0.4622397261457023,0.005258547134458888,1.996709942817688,0.6227356791496277,0.08506029844284058,COMPLETE
