number,value,params_activation_1,params_batch_size,params_epochs,params_layer_1,params_learning_rate,params_num_layers,params_train_size,params_weight_decay,user_attrs_mape,user_attrs_mse,user_attrs_r2,state
380,1.548742413520813,Sigmoid,51,427,20,0.0003136911993890753,1,0.5784962715709455,0.018275212101118654,1.4259207248687744,1.548742413520813,0.08357465267181396,COMPLETE
381,1.7099015712738037,ReLU,30,413,23,0.00011535946494565804,1,0.6805980353134783,0.005503996019439512,2.1029109954833984,1.7099015712738037,-0.047312259674072266,COMPLETE
382,0.5165948271751404,Sigmoid,61,464,8,0.0002155572345325637,1,0.7990098785699647,5.268948218698875e-05,1.0276408195495605,0.5165948271751404,0.19673413038253784,COMPLETE
383,0.6668452024459839,Leaky,41,483,18,0.0004251308334308978,1,0.7371721577359217,0.00026293049935681797,3.697136640548706,0.6668452024459839,0.24765390157699585,COMPLETE
384,3.3678996562957764,Sigmoid,34,268,6,0.0002510200251636089,1,0.3973964109188077,0.0008310998779339681,1.0506222248077393,3.3678996562957764,-0.1048053503036499,COMPLETE
385,2.2473061084747314,Sigmoid,38,445,24,0.00017916438454890392,1,0.2874339421374331,0.013555631596388442,1.0661083459854126,2.2473061084747314,0.051023244857788086,COMPLETE
386,0.649859607219696,Sigmoid,40,456,21,0.00033593490019365467,1,0.7686232412836828,2.017722472889191e-05,1.5860488414764404,0.649859607219696,0.2665519118309021,COMPLETE
387,2.655890941619873,Sigmoid,54,62,22,0.0007376561668334364,1,0.5391289402241444,0.010571540341979184,1.0179492235183716,2.655890941619873,-0.08095157146453857,COMPLETE
388,2.230424404144287,Sigmoid,36,395,23,0.0005103908240120762,1,0.34236957291687004,0.007687642597866319,1.1807819604873657,2.230424404144287,0.21803361177444458,COMPLETE
389,0.6228513121604919,Sigmoid,58,471,22,3.1362254034835575e-05,1,0.7995908581186207,0.0006371197231628537,0.9957491159439087,0.6228513121604919,0.03151339292526245,COMPLETE
390,1.756870985031128,Sigmoid,33,434,19,0.0003899104225312982,1,0.28083165007702254,0.0026287444009979533,1.38681161403656,1.756870985031128,0.22525298595428467,COMPLETE
391,1.700670838356018,Tanh,46,490,24,7.718749938421129e-05,1,0.7061700766201219,1.0024521933187061e-05,1.895625352859497,1.700670838356018,-0.020631074905395508,COMPLETE
392,0.8572724461555481,Sigmoid,48,288,24,0.0002795928574073652,1,0.7436480345578584,6.145089487396839e-05,7.245392799377441,0.8572724461555481,0.1000632643699646,COMPLETE
393,0.6821706295013428,Sigmoid,38,480,21,0.0002173085072289574,1,0.7707372533369272,0.004214411645215796,1.512080430984497,0.6821706295013428,0.23008489608764648,COMPLETE
394,0.6422368884086609,Sigmoid,35,452,22,0.0006136122737312688,1,0.7377616805621262,9.820317669912318e-05,2.9193108081817627,0.6422368884086609,0.2754174470901489,COMPLETE
395,1.6170334815979004,Leaky,43,466,23,0.0003231559605902912,1,0.2697386344695161,0.015704364181572512,1.4435360431671143,1.6170334815979004,0.28418904542922974,COMPLETE
396,6.87033748626709,Sigmoid,32,441,20,9.559463345720892e-05,1,0.1737418259027006,0.00942166583332318,0.9734930992126465,6.87033748626709,-0.15072405338287354,COMPLETE
397,0.517375648021698,Sigmoid,50,425,21,0.006026387859613046,1,0.7991272278624979,0.021955118296125238,1.2832545042037964,0.517375648021698,0.19552010297775269,COMPLETE
398,9.993149757385254,Sigmoid,40,460,20,0.0008999482004467818,1,0.10812258033705958,0.0016799112314227606,4.095153331756592,9.993149757385254,-0.22496140003204346,COMPLETE
399,2.012212038040161,Sigmoid,36,172,24,0.00015260161038313145,1,0.7044719207239936,0.012080783482257464,1.2483547925949097,2.012212038040161,-0.20759761333465576,COMPLETE
400,7.343286037445068,Sigmoid,42,490,23,0.00024136923140879627,1,0.24190137768954145,0.006832705845497667,1.0071659088134766,7.343286037445068,-0.09863042831420898,COMPLETE
401,1.4728286266326904,Sigmoid,38,474,23,0.09755286280014455,1,0.7629622323341451,0.00047516789589558534,3.0481011867523193,1.4728286266326904,-0.6622717380523682,COMPLETE
402,2.8309414386749268,Sigmoid,45,450,22,0.0015920951600411634,1,0.6532677059394536,0.01428593692382733,3.018872022628784,2.8309414386749268,-0.8701412677764893,COMPLETE
403,2.2755286693573,Sigmoid,34,384,21,0.0004463099664938141,1,0.3491262658354385,0.00012258878188456406,1.4676309823989868,2.2755286693573,0.22064101696014404,COMPLETE
404,0.7219471335411072,Sigmoid,31,432,24,0.0023493226281154065,1,0.745427462433049,2.786362389265319e-05,5.262365818023682,0.7219471335411072,0.24212336540222168,COMPLETE
405,0.4439447522163391,Sigmoid,100,442,18,0.00035749881367904145,1,0.7719065498199134,0.0006439051289849232,1.43766450881958,0.4439447522163391,0.2552567720413208,COMPLETE
406,2.6679775714874268,ReLU,37,216,17,0.0002936224062350262,1,0.3763852723069409,1.931235126616278e-05,1.0496737957000732,2.6679775714874268,0.07353055477142334,COMPLETE
407,1.7326719760894775,Sigmoid,29,433,18,0.00017745942927923332,1,0.710263341816291,0.001161879437342817,1.41294264793396,1.7326719760894775,-0.03983604907989502,COMPLETE
408,0.6514163613319397,Sigmoid,18,418,18,0.00037474602329271733,1,0.768629213365983,0.0006549186023089385,2.2101762294769287,0.6514163613319397,0.26479488611221313,COMPLETE
409,2.4526965618133545,Sigmoid,26,440,18,0.0005104505028591502,1,0.4508394776666851,7.836276233771702e-05,1.4445607662200928,2.4526965618133545,0.17640453577041626,COMPLETE
410,1.6424305438995361,Leaky,66,448,19,0.00024466893622654754,1,0.6090607976491669,0.0031409531369415104,3.9063303470611572,1.6424305438995361,0.09514397382736206,COMPLETE
411,1.72860586643219,Sigmoid,39,425,17,0.00020548032273177828,1,0.6729187050363562,0.0009270212476288025,2.6373305320739746,1.72860586643219,-0.058768630027770996,COMPLETE
412,0.6311672925949097,Tanh,100,444,19,0.0003158598099475322,1,0.7286222618896022,6.557797716436766e-05,5.976988792419434,0.6311672925949097,0.28790634870529175,COMPLETE
413,2.3992254734039307,Sigmoid,75,316,18,0.00041085118063330004,1,0.5351299787892694,0.03137399077233379,1.106455683708191,2.3992254734039307,0.02351170778274536,COMPLETE
414,0.4900759160518646,Sigmoid,93,438,20,0.0002610623268476569,1,0.7719642244616978,0.0022702759686064875,1.0396679639816284,0.4900759160518646,0.1778690218925476,COMPLETE
415,2.378014326095581,Sigmoid,90,454,21,6.734863021942541e-05,1,0.265751493865943,0.0019991624357335656,0.9918859004974365,2.378014326095581,-0.0526738166809082,COMPLETE
416,0.8165934681892395,Sigmoid,74,481,21,0.00013242615615798733,1,0.7451772650405859,8.125805464838784e-05,5.179525852203369,0.8165934681892395,0.14276671409606934,COMPLETE
417,0.5702118277549744,Sigmoid,88,461,19,0.000549551229529072,1,0.7989974980950024,0.0007122152430222207,1.4497495889663696,0.5702118277549744,0.11336380243301392,COMPLETE
418,3.3417580127716064,Sigmoid,34,493,22,0.0001891856744146599,1,0.5073418447948177,0.0004182995445763211,5.6988139152526855,3.3417580127716064,0.008027851581573486,COMPLETE
419,2.8422937393188477,Sigmoid,24,299,21,0.00032297250104813325,1,0.39162927386463,0.00047782318746559166,1.0824470520019531,2.8422937393188477,0.06761437654495239,COMPLETE
420,0.6859690546989441,Sigmoid,81,414,20,0.00038482168512323704,1,0.7688326258158162,0.0002726871702046821,1.4914953708648682,0.6859690546989441,0.2257978916168213,COMPLETE
421,1.82631516456604,Sigmoid,71,473,17,0.0002647014189822616,1,0.7181994348877865,0.011158490773095513,1.508609414100647,1.82631516456604,-0.028003692626953125,COMPLETE
422,0.5267838835716248,Leaky,36,444,22,0.00021932642970507815,1,0.7992459296372539,0.0016163816336088055,1.3096604347229004,0.5267838835716248,0.18089091777801514,COMPLETE
423,6.846870422363281,Sigmoid,98,429,20,0.0007072192376309078,1,0.2100546961000282,0.0013730549082629278,1.201802372932434,6.846870422363281,-0.010273098945617676,COMPLETE
424,0.6888087391853333,Sigmoid,93,465,21,0.001291912812981728,1,0.7534921916005085,0.000237198897548997,4.935615539550781,0.6888087391853333,0.2769109606742859,COMPLETE
425,1.541110873222351,Sigmoid,33,454,22,0.025251818846019996,1,0.698207959236268,0.0009804588724422266,1.5773392915725708,1.541110873222351,0.049395620822906494,COMPLETE
426,0.4548816680908203,Sigmoid,41,435,23,0.000341891256766523,1,0.7998324953938848,0.017180174103533886,1.1531671285629272,0.4548816680908203,0.29269349575042725,COMPLETE
427,3.227201223373413,Sigmoid,42,421,18,0.0002928835774533902,1,0.4251953602329041,0.0003200307111677445,1.389159917831421,3.227201223373413,-0.009728193283081055,COMPLETE
428,0.6185292601585388,Sigmoid,78,435,23,0.0004737275502742014,1,0.7325315699139149,0.00014424186992713668,4.343010902404785,0.6185292601585388,0.30216479301452637,COMPLETE
429,0.759941577911377,Sigmoid,41,428,24,0.00017058274093916973,1,0.7710174286198044,0.017797637186981134,1.575492024421692,0.759941577911377,0.14231067895889282,COMPLETE
430,1.9284650087356567,Sigmoid,77,401,23,0.0002179411509641095,1,0.6269124655675609,6.896044664355424e-05,1.6455292701721191,1.9284650087356567,-0.05522620677947998,COMPLETE
431,0.5054692625999451,ReLU,20,438,18,0.0003398105375801677,1,0.7998526872978275,0.00022345469032989724,1.2236255407333374,0.5054692625999451,0.2140336036682129,COMPLETE
432,2.3018298149108887,Sigmoid,30,444,23,0.00026037468763865843,1,0.3002685008770452,0.00036111412346647944,1.104881763458252,2.3018298149108887,0.08625733852386475,COMPLETE
433,0.9298341274261475,Sigmoid,35,409,19,0.00014210051985951358,1,0.7440281250033249,3.23283268979682e-05,3.8154690265655518,0.9298341274261475,0.023890316486358643,COMPLETE
434,0.9847226142883301,Sigmoid,37,420,24,2.0600384045441007e-05,1,0.7693796888438791,0.000338807864699063,1.4750101566314697,0.9847226142883301,-0.11138296127319336,COMPLETE
435,10.81599235534668,Tanh,40,448,23,0.00045646978826128967,1,0.15356645186389228,0.02454124243201332,1.7768841981887817,10.81599235534668,-0.3509056568145752,COMPLETE
436,1.698776125907898,Sigmoid,38,433,20,0.0009403939487834729,1,0.6748864351480666,0.019697028687234015,3.1866965293884277,1.698776125907898,-0.04049789905548096,COMPLETE
437,7.871275424957275,Leaky,86,453,24,0.00011181130662353562,1,0.11988252436460652,8.055607167002229e-05,1.0567938089370728,7.871275424957275,-0.16202318668365479,COMPLETE
438,2.0854108333587646,Sigmoid,32,441,21,0.0005984600329450436,1,0.3331192163881499,2.0257028373496264e-05,1.521298885345459,2.0854108333587646,0.26887404918670654,COMPLETE
439,2.1232686042785645,Sigmoid,28,429,17,4.398603627680033e-05,1,0.723918956108558,0.008432760278042597,1.1254972219467163,2.1232686042785645,-0.19515395164489746,COMPLETE
440,0.6625614762306213,Sigmoid,34,500,23,0.0002949500816325406,1,0.763737688419936,0.002498017142689953,1.844210147857666,0.6625614762306213,0.25221627950668335,COMPLETE
441,2.860382318496704,Sigmoid,42,460,24,0.0003649273031368226,1,0.48003981370890786,0.01669002857324888,1.6740355491638184,2.860382318496704,0.11660337448120117,COMPLETE
442,0.4658415615558624,Sigmoid,36,487,20,0.00020496609391146932,1,0.7720208699001334,0.00017215689277513246,1.2380154132843018,0.4658415615558624,0.2185235619544983,COMPLETE
443,1.5746245384216309,Sigmoid,39,336,22,0.0002546465733208808,1,0.6998986708514897,0.009921221378310249,1.5038920640945435,1.5746245384216309,0.02872335910797119,COMPLETE
444,2.8089303970336914,Sigmoid,45,447,21,0.0003230972091362374,1,0.41535920314567504,0.0006322431515015541,1.893139362335205,2.8089303970336914,0.12114059925079346,COMPLETE
445,8.256155014038086,Sigmoid,32,278,19,0.00017995053960201277,1,0.243273020164427,3.752804198116113e-05,1.0229049921035767,8.256155014038086,-0.24029111862182617,COMPLETE
446,0.6489450931549072,Sigmoid,43,437,24,0.00043694388022825657,1,0.7412339301292967,0.00019113036841901483,3.231898069381714,0.6489450931549072,0.2678491473197937,COMPLETE
447,0.50938880443573,Sigmoid,37,454,21,0.001711161172750724,1,0.7981069065569693,0.03764188069540229,1.3027762174606323,0.50938880443573,0.2079390287399292,COMPLETE
448,0.822622537612915,Sigmoid,53,228,22,0.00023718185477665578,1,0.7457781960181441,0.00048542238774555913,5.8681182861328125,0.822622537612915,0.13643765449523926,COMPLETE
449,0.7811861038208008,Leaky,34,481,23,0.04550920969660856,1,0.7678254557986214,0.00013587847261803645,2.225649118423462,0.7811861038208008,0.11833351850509644,COMPLETE
450,1.7272424697875977,Sigmoid,40,423,24,0.0008055385089963526,1,0.718638198737083,0.01312226737108575,1.7571386098861694,1.7272424697875977,0.027762770652770996,COMPLETE
451,2.4657928943634033,Sigmoid,35,466,20,0.0002981123706892111,1,0.31804056087666743,0.00024345389578509088,1.0607452392578125,2.4657928943634033,0.0806836485862732,COMPLETE
452,0.4730786979198456,Sigmoid,44,439,23,0.00038245808406172374,1,0.7998494922347307,0.011821031314226398,1.2228678464889526,0.4730786979198456,0.264398455619812,COMPLETE
453,6.9407219886779785,Sigmoid,37,253,22,0.0005148095948963498,1,0.1972052773874277,1.598065345198706e-05,1.498337984085083,6.9407219886779785,-0.07123565673828125,COMPLETE
454,3.5922036170959473,Sigmoid,39,448,16,0.0001618932076985189,1,0.47047429923634826,0.003952240555658947,1.0323727130889893,3.5922036170959473,-0.15677011013031006,COMPLETE
455,2.4407784938812256,ReLU,31,457,18,0.00023215795774620036,1,0.5289565087688655,0.0005774613791762019,1.721381664276123,2.4407784938812256,0.006599545478820801,COMPLETE
456,1.4021474123001099,Sigmoid,41,476,21,0.0003306252895600849,1,0.6454064210879893,0.0029834598954713927,2.2019715309143066,1.4021474123001099,0.07373088598251343,COMPLETE
457,1.614072322845459,Sigmoid,33,412,20,0.0002730528075558307,1,0.5870800264819729,0.021502630602773586,2.364727258682251,1.614072322845459,0.07418495416641235,COMPLETE
458,7.107990741729736,Sigmoid,36,490,21,0.00040759824897313053,1,0.25199491435150606,0.0011785553131961998,1.0619174242019653,7.107990741729736,-0.06780672073364258,COMPLETE
459,8.130741119384766,Sigmoid,14,436,24,1.3358416035292998e-05,1,0.2270794727161576,3.1837396426879727e-05,1.2450320720672607,8.130741119384766,-0.201157808303833,COMPLETE
460,1.168688178062439,Tanh,22,428,22,0.007631994461922632,1,0.7702417471573779,0.0003372212849954417,2.5225565433502197,1.168688178062439,-0.31901121139526367,COMPLETE
461,0.8128752708435059,Sigmoid,48,468,23,0.00020181931071609963,1,0.7385486759655735,4.1733481669301946e-05,3.74995493888855,0.8128752708435059,0.0829002857208252,COMPLETE
462,2.787588596343994,Sigmoid,51,448,24,0.0010432618161122518,1,0.43760345639180814,0.015536426200379833,126.0634994506836,2.787588596343994,0.1355750560760498,COMPLETE
463,0.7316939234733582,Sigmoid,17,461,13,0.020861506217876583,1,0.7993347169278661,0.0007892135452824582,1.6473318338394165,0.7316939234733582,-0.13772857189178467,COMPLETE
464,2.240236520767212,Leaky,38,478,19,0.015997403124188413,1,0.25889403658290255,0.001738608419567242,1.9608228206634521,2.240236520767212,0.008316278457641602,COMPLETE
465,1.9254704713821411,Sigmoid,35,373,22,0.000644165641282888,1,0.3204971237926193,0.008597739738788567,1.5193952322006226,1.9254704713821411,0.2821309566497803,COMPLETE
466,1.9376918077468872,Sigmoid,41,445,21,0.00027670970880366245,1,0.28595746788565196,0.000297048790038137,1.1456553936004639,1.9376918077468872,0.18176501989364624,COMPLETE
467,4.145961761474609,Sigmoid,29,52,23,6.419093135944828e-05,1,0.35679847253595104,0.005861503844213083,1.0814812183380127,4.145961761474609,-0.4199744462966919,COMPLETE
468,1.7331926822662354,Sigmoid,82,427,24,0.046001582929607786,1,0.7077303234948473,0.004549410178189864,2.2226929664611816,1.7331926822662354,-0.04014849662780762,COMPLETE
469,0.7113025784492493,Sigmoid,43,454,20,0.002009385280194801,1,0.767693729915623,1.4275652919110645e-05,1.6906026601791382,0.7113025784492493,0.19720584154129028,COMPLETE
470,0.5853074789047241,Sigmoid,97,488,22,0.00035678760095628496,1,0.7410007475187502,5.7237032703371574e-05,4.859339714050293,0.5853074789047241,0.3396461606025696,COMPLETE
471,1.7750723361968994,Sigmoid,55,437,18,0.00022121991682112183,1,0.6798915490934181,0.00010103619049784445,1.3824793100357056,1.7750723361968994,-0.08722925186157227,COMPLETE
472,0.5348540544509888,Sigmoid,38,76,21,0.0004433121058071034,1,0.772189263749421,5.411103684174235e-05,1.0918234586715698,0.5348540544509888,0.10275107622146606,COMPLETE
473,2.364006996154785,Sigmoid,46,473,24,0.00012709326403057282,1,0.29512013272665477,0.010123311868907376,1.0349899530410767,2.364006996154785,0.001743614673614502,COMPLETE
474,0.4815821051597595,Sigmoid,34,499,23,0.0003331951186204472,1,0.7721024198544684,2.544219996959461e-05,1.4823112487792969,0.4815821051597595,0.19211792945861816,COMPLETE
475,1.9177507162094116,Sigmoid,37,462,14,0.005205126211295548,1,0.7218053392644329,0.00015812316749532515,2.1803841590881348,1.9177507162094116,-0.07947134971618652,COMPLETE
476,3.0411109924316406,Sigmoid,31,417,21,0.00010303907366579626,1,0.37098055652541545,0.00018390288586968932,1.0271735191345215,3.0411109924316406,-0.05366408824920654,COMPLETE
477,2.8815929889678955,Sigmoid,39,444,20,0.008909058390349776,1,0.45163077646863437,0.017957720114911535,2.4932167530059814,2.8815929889678955,0.032384634017944336,COMPLETE
478,7.68625545501709,Sigmoid,36,483,24,0.013675014332811757,1,0.20542831140185744,0.025719491199766048,1.8173288106918335,7.68625545501709,-0.1341264247894287,COMPLETE
479,4.000908851623535,Leaky,33,455,23,0.0005505459157674491,1,0.49243507418586624,2.121220177805857e-05,6.468049049377441,4.000908851623535,-0.22187888622283936,COMPLETE
480,0.45368579030036926,ReLU,41,432,22,0.00017973919197984207,1,0.7996932451306488,8.595878765020769e-05,1.2009587287902832,0.45368579030036926,0.2945529818534851,COMPLETE
481,0.5795222520828247,ReLU,40,418,22,0.00015388279375754587,1,0.7518477894305815,6.663032731378409e-05,5.342419147491455,0.5795222520828247,0.39163637161254883,COMPLETE
482,1.5633621215820312,ReLU,91,429,21,0.0001886744127591054,1,0.6889045204855468,3.7054920913713195e-05,1.093996524810791,1.5633621215820312,0.035670340061187744,COMPLETE
483,0.4393346607685089,ReLU,35,471,21,0.00017388209326809397,1,0.7724782282895962,4.518377906069697e-05,1.3198513984680176,0.4393346607685089,0.26299047470092773,COMPLETE
484,0.4499898850917816,ReLU,35,475,21,0.00014786316264261487,1,0.7997833907092003,2.2775493666141035e-05,1.1787010431289673,0.4499898850917816,0.30029982328414917,COMPLETE
485,1.896288275718689,ReLU,35,471,21,0.00015971602613579878,1,0.5597487576725284,3.0084265079493825e-05,1.3531907796859741,1.896288275718689,0.1884387731552124,COMPLETE
486,1.886928915977478,ReLU,33,471,21,0.00017751476886735022,1,0.278350063658596,4.984793993285209e-05,1.3784724473953247,1.886928915977478,0.16789984703063965,COMPLETE
487,0.4389643371105194,ReLU,35,466,21,0.00012754539062729647,1,0.7983183210970088,2.8551847870329587e-05,1.137366533279419,0.4389643371105194,0.31744372844696045,COMPLETE
488,9.478894233703613,ReLU,35,463,21,0.0001431689240129166,1,0.14211074755852096,3.597329997219763e-05,1.0402283668518066,9.478894233703613,-0.2684624195098877,COMPLETE
489,0.7066011428833008,ReLU,32,462,20,0.0001131997050507426,1,0.7363975412181217,2.304929160229098e-05,2.6536519527435303,0.7066011428833008,0.20280063152313232,COMPLETE
490,7.956649303436279,ReLU,34,470,22,0.0001505409797710368,1,0.23326971278032102,4.474944850693632e-05,1.3372886180877686,7.956649303436279,-0.19039583206176758,COMPLETE
491,0.43229544162750244,ReLU,36,406,21,0.00010363188581737624,1,0.777245834316003,4.531918469741908e-05,1.2481778860092163,0.43229544162750244,0.2747991681098938,COMPLETE
492,0.43469375371932983,ReLU,36,400,21,9.464279064886431e-05,1,0.7960967711426697,3.7067940015500765e-05,1.0316078662872314,0.43469375371932983,0.32408416271209717,COMPLETE
493,0.4357571303844452,ReLU,32,410,21,0.00010484825663027886,1,0.7978040959654532,2.6699519729215407e-05,1.0586572885513306,0.4357571303844452,0.32243067026138306,COMPLETE
494,0.6934255957603455,ReLU,31,415,21,9.720065392113585e-05,1,0.7502562463625181,2.771889736443766e-05,5.53640604019165,0.6934255957603455,0.27206432819366455,COMPLETE
495,0.44260695576667786,ReLU,32,412,21,8.627146277179841e-05,1,0.7995048111296864,3.689502290165686e-05,1.043844223022461,0.44260695576667786,0.3117797374725342,COMPLETE
496,3.8936102390289307,ReLU,32,399,20,9.931490501800724e-05,1,0.40564208554420633,3.796417612141471e-05,0.8997488617897034,3.8936102390289307,-0.23093438148498535,COMPLETE
497,0.4566100835800171,ReLU,29,409,21,8.873777052069808e-05,1,0.7750286234669741,4.248312131879432e-05,1.2953400611877441,0.4566100835800171,0.23400992155075073,COMPLETE
498,0.529863715171814,ReLU,33,388,20,0.00010783592727770974,1,0.7998923066295965,2.708244407019739e-05,1.1134345531463623,0.529863715171814,0.17610210180282593,COMPLETE
499,0.5769393444061279,ReLU,30,413,20,8.276830330299607e-05,1,0.7991559580214936,4.458025447109947e-05,1.0852552652359009,0.5769393444061279,0.10290306806564331,COMPLETE
