number,value,params_activation_1,params_batch_size,params_epochs,params_layer_1,params_learning_rate,params_num_layers,params_train_size,params_weight_decay,user_attrs_mape,user_attrs_mse,user_attrs_r2,state
386,0.4443739354610443,Sigmoid,88,218,19,0.0038688502553743294,1,0.28237163658215364,0.0038473383171019958,9.619466781616211,0.4443739354610443,0.3724812865257263,COMPLETE
387,0.3023105263710022,ReLU,83,178,21,0.0017492876700455587,1,0.681737932500934,0.0023447941587617285,1.152613878250122,0.3023105263710022,0.6498197317123413,COMPLETE
388,0.3506988286972046,ReLU,86,253,20,0.0025651127760249717,1,0.42103876343818064,0.0064916880136657125,1.357811450958252,0.3506988286972046,0.6288770437240601,COMPLETE
389,0.35344749689102173,ReLU,91,227,19,0.028040980519047583,1,0.5544328001612919,0.008179716911551376,2.0478596687316895,0.35344749689102173,0.46780794858932495,COMPLETE
390,0.4814893901348114,ReLU,80,241,17,0.004800428272302862,1,0.5951676660220668,0.002756278683206234,2.058131694793701,0.4814893901348114,0.3669007420539856,COMPLETE
391,0.4075584411621094,ReLU,57,207,21,0.002047718448114568,1,0.24256127105069536,0.004168122069428824,3.8603756427764893,0.4075584411621094,0.4260265827178955,COMPLETE
392,0.5666323900222778,ReLU,76,191,24,0.00021818433952696648,1,0.520788231284441,6.145089487396839e-05,1.939928650856018,0.5666323900222778,0.31367236375808716,COMPLETE
393,0.2839537262916565,ReLU,19,219,23,0.0015099899496813312,1,0.49672383290106636,0.005397057594497526,3.607132911682129,0.2839537262916565,0.6160956025123596,COMPLETE
394,0.40448805689811707,ReLU,82,235,22,0.0018717626923440318,1,0.2995683886727039,0.0004926730876477759,1.9890953302383423,0.40448805689811707,0.45738017559051514,COMPLETE
395,0.9120911955833435,ReLU,84,199,18,1.0566556511087366e-05,1,0.2697386344695161,0.008836500135566297,5.598057746887207,0.9120911955833435,-0.15708661079406738,COMPLETE
396,0.3032994866371155,Tanh,88,282,20,0.0011953417796404197,1,0.5773875176673243,0.0032884288400341364,1.1828935146331787,0.3032994866371155,0.592941164970398,COMPLETE
397,0.2837141454219818,ReLU,85,216,21,0.0029980362363209788,1,0.6325515857709391,0.0019493312094523473,1.5677651166915894,0.2837141454219818,0.6203432083129883,COMPLETE
398,0.3966295123100281,ReLU,79,245,22,0.00037617828722702305,1,0.47620604993513577,0.006303665612143166,10.77506160736084,0.3966295123100281,0.44856446981430054,COMPLETE
399,0.27940183877944946,ReLU,50,227,19,0.0023603121766489757,1,0.535777632290722,0.002599296685947433,2.354757070541382,0.27940183877944946,0.6745105981826782,COMPLETE
400,0.230301171541214,ReLU,82,272,20,0.0015207402552778518,1,0.5686175091975408,0.011600313114888326,1.8998143672943115,0.230301171541214,0.6725909113883972,COMPLETE
401,0.7426524758338928,ReLU,65,262,21,0.09755286280014455,1,0.5985584911636066,0.004854382821118341,2.0780134201049805,0.7426524758338928,0.023503363132476807,COMPLETE
402,0.31331852078437805,ReLU,90,209,19,0.0009402607485450801,1,0.5032016687915316,0.003096723206870978,2.5312843322753906,0.31331852078437805,0.5989013910293579,COMPLETE
403,0.288303941488266,ReLU,87,184,18,0.0018557103266489273,1,0.4315497595156125,0.0003348077956645372,2.9672770500183105,0.288303941488266,0.6264259815216064,COMPLETE
404,0.3223625123500824,ReLU,83,252,20,0.0006837795229290985,1,0.44955174648673646,0.0040294920805573125,1.7268062829971313,0.3223625123500824,0.5872576832771301,COMPLETE
405,1.6163755655288696,Leaky,81,237,22,0.00356373947539698,1,0.1682727304037216,0.007233992302141682,2.490466594696045,1.6163755655288696,-0.7493340969085693,COMPLETE
406,0.2731831669807434,ReLU,85,223,20,0.0013395174587119832,1,0.5397933852299508,0.003777924465399627,2.462399482727051,0.2731831669807434,0.6817550659179688,COMPLETE
407,0.23550044000148773,ReLU,86,203,21,0.0025714711331157073,1,0.5568392366508326,0.005535095120601896,1.5850961208343506,0.23550044000148773,0.6454029083251953,COMPLETE
408,0.2789615988731384,ReLU,78,216,23,0.0021280683500405576,1,0.5127375639087004,0.009849729294092927,2.662360668182373,0.2789615988731384,0.6428838968276978,COMPLETE
409,0.8873345255851746,ReLU,83,230,22,2.5142746210356887e-05,1,0.3126917369503845,0.004422271155688639,7.685774326324463,0.8873345255851746,-0.2967677116394043,COMPLETE
410,0.2765364944934845,ReLU,80,197,19,0.0016302944855335084,1,0.4787330634806484,0.0016731810913249827,13.168498992919922,0.2765364944934845,0.615530252456665,COMPLETE
411,0.30484798550605774,ReLU,89,209,20,0.0011881888275624458,1,0.6148450832851681,0.002675910486068927,1.3357337713241577,0.30484798550605774,0.6058304905891418,COMPLETE
412,0.4221764802932739,Sigmoid,84,247,21,0.005279947927451425,1,0.3896359297040157,0.0007824036156692666,1.6735690832138062,0.4221764802932739,0.5078718066215515,COMPLETE
413,0.20950470864772797,ReLU,87,238,19,0.0028895843424691244,1,0.5721762703099951,0.0032927688662436265,1.1698590517044067,0.20950470864772797,0.7188233137130737,COMPLETE
414,0.35247915983200073,ReLU,88,236,19,0.0019410879902114649,1,0.3579996861419727,0.0011475513668531912,1.6383048295974731,0.35247915983200073,0.5389429926872253,COMPLETE
415,0.8299546241760254,ReLU,87,259,18,6.734863021942541e-05,1,0.5246840537212036,0.0035637982577667363,1.7245194911956787,0.8299546241760254,-0.005273938179016113,COMPLETE
416,0.21493345499038696,ReLU,90,242,20,0.002432329568755923,1,0.5564472843362953,0.015163094761839331,1.7490015029907227,0.21493345499038696,0.6763709783554077,COMPLETE
417,0.25049862265586853,ReLU,90,245,20,0.002824605393130003,1,0.4926900484766524,0.020854390334418233,3.4752607345581055,0.25049862265586853,0.6613267660140991,COMPLETE
418,0.32090818881988525,ReLU,93,253,21,0.0025428061708952974,1,0.4598983700927812,0.015033039179334597,4.601365566253662,0.32090818881988525,0.5285131931304932,COMPLETE
419,0.7924157381057739,ReLU,91,237,20,0.0032554271047009102,1,0.21427137957354903,0.023279635199213763,1.839740514755249,0.7924157381057739,0.13067448139190674,COMPLETE
420,0.22718381881713867,ReLU,93,246,21,0.0023134010096716477,1,0.5485198993734125,0.017521824985045644,1.6710336208343506,0.22718381881713867,0.6579253673553467,COMPLETE
421,0.3568668067455292,ReLU,96,229,20,0.0022034238920374326,1,0.31921152538167913,0.01322239947579479,2.790472984313965,0.3568668067455292,0.4934808611869812,COMPLETE
422,0.24190284311771393,Tanh,90,240,20,0.0034425611514570737,1,0.5850143270995268,0.012556500314677576,1.2045797109603882,0.24190284311771393,0.6753417253494263,COMPLETE
423,0.2656487822532654,ReLU,91,262,22,0.0018203564879872816,1,0.5163555761002893,0.029303201948919253,3.1732640266418457,0.2656487822532654,0.678235650062561,COMPLETE
424,0.39487141370773315,ReLU,46,271,15,0.002799691283498191,1,0.7155932974355811,0.015543534110545853,1.5399444103240967,0.39487141370773315,0.5868734121322632,COMPLETE
425,0.6638668775558472,ReLU,88,253,21,0.036386264751385435,1,0.4785440513204476,0.010432990197970156,11.735543251037598,0.6638668775558472,0.07702338695526123,COMPLETE
426,0.22294621169567108,ReLU,74,228,23,0.004032061241020357,1,0.7717647435812581,0.007979849547043607,0.9643016457557678,0.22294621169567108,0.5098972320556641,COMPLETE
427,0.38546672463417053,ReLU,76,238,24,0.004296878097043224,1,0.7481445535491922,0.007853440038142114,2.0298376083374023,0.38546672463417053,0.5589144825935364,COMPLETE
428,0.3696795403957367,ReLU,72,229,23,0.004038565964281808,1,0.6634170523876574,0.009019173161289177,2.2582991123199463,0.3696795403957367,0.543514609336853,COMPLETE
429,0.3612256944179535,ReLU,73,252,24,0.0050792648730843505,1,0.7481523799187896,0.011839659481374927,1.9758652448654175,0.3612256944179535,0.5866532325744629,COMPLETE
430,0.5295321345329285,Leaky,76,245,23,0.014308878679051543,1,0.702008363430686,0.006870169978122948,2.3945538997650146,0.5295321345329285,0.4081985354423523,COMPLETE
431,0.9632688164710999,ReLU,73,288,24,0.023277831372649563,1,0.7079164912218968,0.00022345469032989724,2.9890687465667725,0.9632688164710999,-0.07654249668121338,COMPLETE
432,0.28589192032814026,ReLU,68,133,23,0.003985452451548358,1,0.668333556804777,0.00869705360057125,1.554437279701233,0.28589192032814026,0.6469767093658447,COMPLETE
433,0.25983482599258423,ReLU,99,233,22,0.003352823257669294,1,0.6404161792858032,0.002163480548896245,1.4473885297775269,0.25983482599258423,0.6522976756095886,COMPLETE
434,0.5343426465988159,ReLU,89,241,22,0.006387076567044058,1,0.6865244771194224,0.0005698788370193647,2.3981945514678955,0.5343426465988159,0.392667293548584,COMPLETE
435,0.391840398311615,ReLU,75,223,23,0.0010575690700705147,1,0.4054116173428563,0.05537828526267902,1.4056694507598877,0.391840398311615,0.5682464241981506,COMPLETE
436,0.5706619620323181,Sigmoid,70,229,21,0.0003105009040132051,1,0.6318224843474435,0.009815824940463201,1.1842572689056396,0.5706619620323181,0.23635917901992798,COMPLETE
437,0.19684448838233948,ReLU,61,258,20,0.0029638791683008077,1,0.7729510523313566,0.02277392004391295,0.991705596446991,0.19684448838233948,0.567276656627655,COMPLETE
438,0.36075955629348755,ReLU,61,261,20,0.0005631830718861085,1,0.7367178416991974,0.014809898569147682,1.3534480333328247,0.36075955629348755,0.5614687204360962,COMPLETE
439,0.32024648785591125,ReLU,58,274,20,0.003567887904007037,1,0.6943716350641846,0.08504607443732379,1.580549716949463,0.32024648785591125,0.6360085010528564,COMPLETE
440,0.34562504291534424,ReLU,74,260,20,0.004627630680065205,1,0.43444087461373726,0.02816764966525907,2.926361083984375,0.34562504291534424,0.5521513223648071,COMPLETE
441,0.27230802178382874,ReLU,61,268,21,0.002946841351614254,1,0.7682775272531217,0.022017459733320133,0.9851852655410767,0.27230802178382874,0.7086231112480164,COMPLETE
442,0.31034794449806213,ReLU,92,147,20,0.0028049675943541035,1,0.4542900100039639,0.046312840654014635,1.7355992794036865,0.31034794449806213,0.6026407480239868,COMPLETE
443,0.3141880929470062,ReLU,62,257,21,0.0022945153123709074,1,0.7661357558525506,0.01814755764914023,1.000335931777954,0.3141880929470062,0.6638103127479553,COMPLETE
444,0.36320915818214417,ReLU,67,251,22,0.013446260764502898,1,0.6777269728344744,0.031477271207227396,1.8990626335144043,0.36320915818214417,0.5792779922485352,COMPLETE
445,0.22796206176280975,ReLU,87,282,20,0.0031150083883679813,1,0.7900513558699818,0.019266220407743707,1.0641237497329712,0.22796206176280975,0.5295371413230896,COMPLETE
446,0.26773563027381897,Tanh,59,241,21,0.008896176935513084,1,0.7097054123243237,0.021803313097090816,1.7583281993865967,0.26773563027381897,0.7007805109024048,COMPLETE
447,0.3103921413421631,ReLU,95,246,13,0.003916775824674187,1,0.37130497480402114,0.04252303392962592,1.6907126903533936,0.3103921413421631,0.5939944982528687,COMPLETE
448,0.22510464489459991,ReLU,66,239,14,0.002694356247347164,1,0.7917945158533156,0.002395650234536587,0.9879218339920044,0.22510464489459991,0.5354341864585876,COMPLETE
449,0.29676494002342224,ReLU,89,267,22,0.04550920969660856,1,0.7579916323273529,0.03183505615979357,1.1005442142486572,0.29676494002342224,0.6824535727500916,COMPLETE
450,0.3246563673019409,ReLU,86,229,23,0.0008570290280139286,1,0.7437031236534002,0.0009911759047985984,1.0456000566482544,0.3246563673019409,0.6284991502761841,COMPLETE
451,0.2912224531173706,ReLU,70,252,20,0.005743880445480978,1,0.4976409948224296,0.026186068708582488,3.410696268081665,0.2912224531173706,0.6062682867050171,COMPLETE
452,0.47356581687927246,ReLU,86,223,21,0.019802409929099842,1,0.7334421255834336,0.012059173196544044,2.586449146270752,0.47356581687927246,0.42434394359588623,COMPLETE
453,0.4144150912761688,ReLU,88,234,22,0.0022318008003966326,1,0.25844002362371116,0.001420982390284379,15.319751739501953,0.4144150912761688,0.4742695093154907,COMPLETE
454,0.7585409879684448,ReLU,77,244,19,0.00011462293068078114,1,0.4119810356416748,0.03538908959395754,1.5377118587493896,0.7585409879684448,0.16419333219528198,COMPLETE
455,0.30130040645599365,Leaky,64,280,21,0.0013928705871793065,1,0.4831134779053494,0.024140151682251077,11.963626861572266,0.30130040645599365,0.5811008810997009,COMPLETE
456,0.2569967210292816,ReLU,90,221,20,0.0024944142564923984,1,0.4622516478384879,0.002933592696610782,5.3508806228637695,0.2569967210292816,0.6224136352539062,COMPLETE
457,0.18197229504585266,ReLU,85,256,20,0.001982185436366725,1,0.7776361055966753,0.00321520392107035,0.854469895362854,0.18197229504585266,0.5999702215194702,COMPLETE
458,0.2600184381008148,ReLU,85,264,20,0.0032745736745817054,1,0.7695385460178478,0.0017560503052997274,1.0236687660217285,0.2600184381008148,0.7217732667922974,COMPLETE
459,0.804111897945404,ReLU,56,257,19,1.3358416035292998e-05,1,0.7389601580451901,0.008304154093633434,1.2538769245147705,0.804111897945404,0.02253955602645874,COMPLETE
460,0.23755322396755219,ReLU,87,272,20,0.002019627568885338,1,0.7556764999946691,0.0003372212849954417,1.4735314846038818,0.23755322396755219,0.7281703352928162,COMPLETE
461,0.19495876133441925,ReLU,55,255,20,0.002595270489462862,1,0.7760589011786673,0.0020766587211910126,0.9933746457099915,0.19495876133441925,0.5714221000671387,COMPLETE
462,0.3176259696483612,ReLU,91,253,19,0.0005169382003056807,1,0.7854382611905273,0.002215903779566614,1.1024329662322998,0.3176259696483612,0.3017627000808716,COMPLETE
463,0.25174185633659363,ReLU,52,267,20,0.003992019551311029,1,0.788655918259168,0.00198397586288236,0.8985618352890015,0.25174185633659363,0.4804609417915344,COMPLETE
464,0.29009488224983215,Sigmoid,44,252,20,0.015997403124188413,1,0.7229947904223079,0.0015344555619663362,1.3367024660110474,0.29009488224983215,0.6964938640594482,COMPLETE
465,0.2706514894962311,ReLU,56,277,21,0.002707520938096418,1,0.7983629954963133,0.002630452058355853,1.1273247003555298,0.2706514894962311,0.44143563508987427,COMPLETE
466,0.20731016993522644,ReLU,88,260,20,0.0020084964415876335,1,0.7986227859970523,0.015806571279757032,0.9412853717803955,0.20731016993522644,0.5721580386161804,COMPLETE
467,0.3267036974430084,ReLU,89,52,20,0.00981415716606986,1,0.7134926782038106,0.00041363804461297144,1.73642897605896,0.3267036974430084,0.6348782777786255,COMPLETE
468,0.25865626335144043,ReLU,55,261,19,0.0020691240993286385,1,0.7609150762529867,0.015735392510811123,0.9293923377990723,0.25865626335144043,0.7232308387756348,COMPLETE
469,0.2980828583240509,ReLU,88,264,20,0.001740009037297136,1,0.4410088243644704,0.01523804558898314,2.8095219135284424,0.2980828583240509,0.6137548685073853,COMPLETE
470,0.19809259474277496,ReLU,93,288,19,0.0021968693090721244,1,0.79803262572608,0.018636556347464528,0.9753549695014954,0.19809259474277496,0.5911810398101807,COMPLETE
471,0.20931239426136017,ReLU,94,276,19,0.0018802781354248894,1,0.7915795719705688,0.018381290305446014,0.9722784161567688,0.20931239426136017,0.5680258870124817,COMPLETE
472,0.21366871893405914,ReLU,93,293,19,0.0015479444573286325,1,0.7920910419154341,0.017224109584736334,0.9500793814659119,0.21366871893405914,0.5590354204177856,COMPLETE
473,0.20838984847068787,ReLU,93,306,19,0.001664914509474875,1,0.7906290715743045,0.017203902358406863,0.9626595377922058,0.20838984847068787,0.569929838180542,COMPLETE
474,0.19953234493732452,Tanh,96,303,19,0.002278270237105759,1,0.7951447296009142,0.020436223487202154,0.9610579609870911,0.19953234493732452,0.5882097482681274,COMPLETE
475,0.20104360580444336,Tanh,95,306,19,0.002301861456465106,1,0.7942908853105431,0.01894009381423877,0.9756404757499695,0.20104360580444336,0.5850908160209656,COMPLETE
476,0.20140141248703003,Tanh,97,313,19,0.002366498014828577,1,0.788210316704037,0.020102948051685752,0.9707739949226379,0.20140141248703003,0.5843523740768433,COMPLETE
477,0.20472346246242523,Tanh,100,318,19,0.002431787368464696,1,0.7927861508350585,0.01861398044104396,0.9805708527565002,0.20472346246242523,0.5774964094161987,COMPLETE
478,0.20427720248699188,Tanh,98,318,19,0.0023665518253305896,1,0.7966237835230097,0.01830505254646722,0.9850685000419617,0.20427720248699188,0.5784174203872681,COMPLETE
479,0.20481278002262115,Tanh,99,323,19,0.00252574895117646,1,0.7902762585177405,0.01907073731896687,0.9676138162612915,0.20481278002262115,0.5773121118545532,COMPLETE
480,0.21456864476203918,Tanh,98,322,19,0.0028777128393984654,1,0.7964246742352136,0.022723804054699037,0.9181183576583862,0.21456864476203918,0.5571781396865845,COMPLETE
481,0.21444551646709442,Tanh,98,343,19,0.0030449558849842276,1,0.7961219195686734,0.020471816120057627,0.8986485004425049,0.21444551646709442,0.5574322938919067,COMPLETE
482,0.19085729122161865,Tanh,98,337,19,0.0032367326286731873,1,0.7850726853439302,0.01930318018386067,0.8769347071647644,0.19085729122161865,0.5804383158683777,COMPLETE
483,0.20845498144626617,Tanh,98,324,19,0.0030975804152964426,1,0.7938146282134473,0.019516963107494567,0.9022794961929321,0.20845498144626617,0.5697954297065735,COMPLETE
484,0.23036636412143707,Tanh,100,343,19,0.003297956659014292,1,0.7986541974789155,0.02206235534954995,0.9112672805786133,0.23036636412143707,0.5245752334594727,COMPLETE
485,0.20631901919841766,Tanh,98,326,19,0.0030808117992533256,1,0.7927850575009362,0.019318750610002988,0.8987188935279846,0.20631901919841766,0.5742035508155823,COMPLETE
486,0.2294929325580597,Tanh,97,336,19,0.003396651024585379,1,0.794769946344201,0.01936146125076103,0.9021587371826172,0.2294929325580597,0.52637779712677,COMPLETE
487,0.2511137127876282,Tanh,98,326,18,0.003316195266213333,1,0.7981565743272043,0.01811739670100984,0.9963206052780151,0.2511137127876282,0.48175734281539917,COMPLETE
488,0.2889392673969269,Tanh,100,359,19,0.004534398138100704,1,0.7582240277158753,0.01901261398823615,0.731352686882019,0.2889392673969269,0.6908272504806519,COMPLETE
489,0.2799987196922302,Tanh,96,311,19,0.002914335024482893,1,0.763396237426901,0.02551561317596947,0.9672134518623352,0.2799987196922302,0.7003938555717468,COMPLETE
490,0.30671268701553345,Tanh,97,320,18,0.003761800220645154,1,0.7688215729742188,0.01890260826529717,1.0129987001419067,0.30671268701553345,0.671809196472168,COMPLETE
491,0.3041268587112427,Tanh,99,309,19,0.0028695809274568457,1,0.7411217885113348,0.023211763279140887,1.9993336200714111,0.3041268587112427,0.6303101778030396,COMPLETE
492,0.23787827789783478,Tanh,95,346,18,0.004981410384983747,1,0.7960549943345337,0.017289453812199,0.9760189652442932,0.23787827789783478,0.5090723037719727,COMPLETE
493,0.2925097942352295,Tanh,98,331,19,0.0035305701037106727,1,0.7590767540814313,0.021130996518310283,0.9271807670593262,0.2925097942352295,0.6870067119598389,COMPLETE
494,0.2915811240673065,Tanh,100,313,19,0.002688777779120087,1,0.7299602407227203,0.01709061249817657,1.9948264360427856,0.2915811240673065,0.6455605030059814,COMPLETE
495,0.23919206857681274,Tanh,95,326,18,0.0031181772244043456,1,0.7994372678226125,0.0266835449705702,0.9410865902900696,0.23919206857681274,0.5063608884811401,COMPLETE
496,0.26567399501800537,Tanh,97,342,19,0.0025054658716214284,1,0.7677419372774044,0.019864294809157003,0.9595710635185242,0.26567399501800537,0.7157217264175415,COMPLETE
497,0.3263940215110779,Tanh,96,303,19,0.004223055426823725,1,0.7396843534439967,0.024975634219353844,2.0085811614990234,0.3263940215110779,0.6032426953315735,COMPLETE
498,0.1877957284450531,Tanh,98,318,19,0.003185846547532625,1,0.7998529901286489,0.016270452056199272,0.8680991530418396,0.1877957284450531,0.6124314665794373,COMPLETE
499,0.30265045166015625,Tanh,94,315,18,0.0025131096667959417,1,0.7644692472653744,0.01612543723196269,0.8965581655502319,0.30265045166015625,0.6761559247970581,COMPLETE
