number,value,params_activation_1,params_batch_size,params_epochs,params_layer_1,params_learning_rate,params_num_layers,params_train_size,params_weight_decay,user_attrs_mape,user_attrs_mse,user_attrs_r2,state
0,4.364418029785156,Tanh,96,218,4,4.207988669606632e-05,1,0.4582013868952863,0.0024810409748678114,1.3649541139602661,4.364418029785156,-0.40544044971466064,COMPLETE
1,2.3229153156280518,Tanh,98,59,5,5.3370327626039544e-05,1,0.5646386642932582,7.068974950624602e-05,1.1938467025756836,2.3229153156280518,0.0058536529541015625,COMPLETE
2,6.152126789093018,Sigmoid,22,325,19,0.0006672367170464204,1,0.18358318781006536,0.0002920433847181409,1.1251897811889648,6.152126789093018,-0.030429840087890625,COMPLETE
3,8.923795700073242,Sigmoid,25,324,20,0.07286653737491042,1,0.1144846978456873,0.06245139574743072,1.6622477769851685,8.923795700073242,-0.31740498542785645,COMPLETE
4,11.008907318115234,Sigmoid,55,105,16,0.00010842262717330161,1,0.10741277311947185,0.0433792069749094,1.0161796808242798,11.008907318115234,-0.34947311878204346,COMPLETE
5,1.8462836742401123,Leaky,80,487,23,0.002463768595899745,1,0.7054270142609772,0.03795853142670639,2.0792057514190674,1.8462836742401123,-0.10801839828491211,COMPLETE
6,2.470079183578491,Leaky,34,225,14,0.000132965214572995,1,0.560305062386961,0.00026730883107816685,1.0373400449752808,2.470079183578491,-0.0571286678314209,COMPLETE
7,11.697737693786621,ReLU,28,398,18,0.00672093005015611,1,0.10115491015452849,0.018274508859816022,5.283767223358154,11.697737693786621,-0.4339100122451782,COMPLETE
8,7.467614650726318,Sigmoid,66,439,8,0.00017535949529764417,1,0.1989897438445013,1.795698422567761e-05,1.05594003200531,7.467614650726318,-0.1525566577911377,COMPLETE
9,3.918950080871582,ReLU,74,103,12,0.012130221181165156,1,0.48647145240701695,0.0017583640270008513,6.553075790405273,3.918950080871582,-0.19684863090515137,COMPLETE
10,0.5711085796356201,Leaky,79,491,22,0.0017404157466432903,1,0.7508950765561601,0.010540963318040455,7.514201641082764,0.5711085796356201,0.40046876668930054,COMPLETE
11,0.5313118100166321,Leaky,81,492,23,0.0017143477552760739,1,0.7959603266871323,0.00974371454191917,1.5035803318023682,0.5313118100166321,0.173850417137146,COMPLETE
12,0.49851539731025696,Leaky,50,498,24,0.0008233011500597547,1,0.7920771485203731,0.007015697292702693,1.4376533031463623,0.49851539731025696,0.22484636306762695,COMPLETE
13,3.4862663745880127,Leaky,46,397,24,1.3625220514033477e-05,1,0.3885347402137153,0.006377498741418522,1.0431039333343506,3.4862663745880127,-0.14363431930541992,COMPLETE
14,0.47074681520462036,Leaky,48,431,11,0.0004608727640677891,1,0.7989400854982043,0.004582661415004826,1.332437515258789,0.47074681520462036,0.26802438497543335,COMPLETE
15,2.101529359817505,Leaky,11,405,10,0.00046145129346657833,1,0.34053695267341566,0.0015056820284628394,1.523931622505188,2.101529359817505,0.2632230520248413,COMPLETE
16,1.8481731414794922,Leaky,45,343,1,0.0005787231346792016,1,0.5818540160656134,0.004326277961525457,1.029300332069397,1.8481731414794922,-0.0936051607131958,COMPLETE
17,1.8702392578125,Leaky,55,447,8,0.00038104125703148945,1,0.664780967691038,0.09789579231127454,2.7287731170654297,1.8702392578125,-0.20008337497711182,COMPLETE
18,3.0032107830047607,Tanh,38,257,14,0.0002765630200682984,1,0.42759772428707027,0.000520919995712054,1.6804571151733398,3.0032107830047607,0.06035411357879639,COMPLETE
19,2.8499691486358643,ReLU,64,362,11,0.0010112336711233178,1,0.6391932093004027,0.017677483672454534,2.510866403579712,2.8499691486358643,-0.5499234199523926,COMPLETE
20,0.7598134279251099,Leaky,47,448,16,0.004459090734115458,1,0.7985587478143563,0.004551412170464143,1.9639390707015991,0.7598134279251099,-0.18145227432250977,COMPLETE
21,0.5103112459182739,Leaky,89,497,22,0.0014426745537641772,1,0.7720798506046097,0.010572268314157132,1.5354740619659424,0.5103112459182739,0.1439231038093567,COMPLETE
22,3.621903896331787,Leaky,60,453,21,0.0009596612251478277,1,0.542755860971844,0.0033925133945763484,2.2107908725738525,3.621903896331787,-0.47412025928497314,COMPLETE
23,2.483316659927368,Leaky,90,499,17,0.0003895852682376518,1,0.6427054115107973,0.01694558305394319,2.374837636947632,2.483316659927368,-0.35052359104156494,COMPLETE
24,0.5153025388717651,Leaky,40,419,24,0.0011028079016015776,1,0.7784512591535914,0.0009736230693016851,1.5499389171600342,0.5153025388717651,0.1355499029159546,COMPLETE
25,3.023920774459839,Leaky,69,379,21,0.00023206061355064394,1,0.48955423065634407,0.006336681224505786,2.8074440956115723,3.023920774459839,0.07649356126785278,COMPLETE
26,2.9662821292877197,Leaky,51,469,14,0.00302782223876808,1,0.6551656681675923,0.002692493157435523,2.2503702640533447,2.9662821292877197,-0.9595482349395752,COMPLETE
27,1.9941284656524658,ReLU,89,428,19,0.0014100273375261846,1,0.675266456406652,0.02957418164991369,2.9494245052337646,1.9941284656524658,-0.22140085697174072,COMPLETE
28,2.826058864593506,Tanh,55,297,9,0.0007263199141021033,1,0.5259712429025307,0.008053366332069257,2.51880145072937,2.826058864593506,0.184018075466156,COMPLETE
29,3.519751787185669,Tanh,88,171,6,9.461020054687196e-05,1,0.4407306095642104,0.002468965255462274,25.63442611694336,3.519751787185669,-0.09146702289581299,COMPLETE
30,1.9906734228134155,Leaky,31,372,1,0.0003378491963411718,1,0.7125826917838683,0.01726202192030061,0.9678710699081421,1.9906734228134155,-0.194671630859375,COMPLETE
31,0.5158695578575134,Leaky,40,423,24,0.0010821748578680528,1,0.7851307833844967,0.0010279035652394778,1.5491403341293335,0.5158695578575134,0.1345987319946289,COMPLETE
32,2.6447594165802,Leaky,36,472,22,0.00068183639599293,1,0.5834885671532325,0.0013307754391598881,2.6016526222229004,2.6447594165802,-0.5649629831314087,COMPLETE
33,2.1173691749572754,Leaky,42,415,24,0.00021231578971541562,1,0.6154207324970031,0.0007930281269173267,2.537013292312622,2.1173691749572754,-0.158591628074646,COMPLETE
34,0.695462703704834,Leaky,19,462,20,0.002529902168152458,1,0.7389960131364538,0.002235308118671907,5.005374908447266,0.695462703704834,0.2153671383857727,COMPLETE
35,1.617450475692749,Sigmoid,58,296,22,0.0005979729175724322,1,0.6069286776734921,0.0038409688210195967,7.184375286102295,1.617450475692749,0.10890614986419678,COMPLETE
36,3.5892763137817383,Tanh,100,472,20,0.0011881734084548965,1,0.5174161031282095,0.005253479749960286,4.362687110900879,3.5892763137817383,-0.03634941577911377,COMPLETE
37,2.023669481277466,Leaky,49,342,6,6.679163771171935e-05,1,0.7111122507900246,0.0007106030774586263,1.4774541854858398,2.023669481277466,-0.21447372436523438,COMPLETE
38,0.45623770356178284,Sigmoid,19,498,18,0.00015014485717730803,1,0.7961319256805287,0.010919045460313616,1.0939080715179443,0.45623770356178284,0.2905849814414978,COMPLETE
39,1.482740879058838,Sigmoid,11,500,18,0.00013404591258944602,1,0.5842662518493706,0.009888642301399976,1.523551344871521,1.482740879058838,0.12262922525405884,COMPLETE
40,1.778801679611206,Sigmoid,20,473,15,5.4252421523923264e-05,1,0.6922135538622404,0.03191048676548724,1.1384081840515137,1.778801679611206,-0.09721934795379639,COMPLETE
41,0.4558751583099365,Sigmoid,25,440,23,0.00031119790800285263,1,0.771989616898109,0.01189712037129544,1.4839410781860352,0.4558751583099365,0.2352427840232849,COMPLETE
42,1.6473957300186157,Sigmoid,25,438,21,0.00018814665781855975,1,0.7052805424460901,0.01290081424585951,1.4863113164901733,1.6473957300186157,0.0113411545753479,COMPLETE
43,1.72152841091156,Sigmoid,15,478,19,0.00027033909838669763,1,0.7264866570214225,0.02671946192887242,1.7436676025390625,1.72152841091156,0.03097909688949585,COMPLETE
44,0.4845041334629059,Sigmoid,29,393,23,0.00042170346739123314,1,0.7833676257025132,0.007104003246850415,1.5206581354141235,0.4845041334629059,0.18721604347229004,COMPLETE
45,2.166947841644287,Sigmoid,25,192,13,0.0001359245479115169,1,0.6196622219746075,0.007216475055894018,1.4507145881652832,2.166947841644287,-0.1857203245162964,COMPLETE
46,0.5180384516716003,Sigmoid,33,389,17,0.00045674824666572873,1,0.7976012258492299,0.006318259715531854,1.3886412382125854,0.5180384516716003,0.19448941946029663,COMPLETE
47,2.7845659255981445,Sigmoid,30,354,23,8.559860698205329e-05,1,0.5616634177310172,0.060141999630611266,1.0930439233779907,2.7845659255981445,-0.1917206048965454,COMPLETE
48,2.227260112762451,Sigmoid,16,445,12,3.6064657295339216e-05,1,0.6695454192519857,0.013691491935973113,1.9323657751083374,2.227260112762451,-0.42917418479919434,COMPLETE
49,7.475114822387695,Sigmoid,27,407,23,0.00030668654618976645,1,0.25664071311051445,0.003273202565550731,1.0089137554168701,7.475114822387695,-0.12295842170715332,COMPLETE
50,2.880478858947754,Sigmoid,22,326,19,0.0005167719769805927,1,0.5057357677386308,0.022811788192759662,10.54914665222168,2.880478858947754,0.1449546217918396,COMPLETE
51,0.5566835403442383,ReLU,75,488,22,0.0019460751222548302,1,0.7453422829753417,0.010511697220470021,6.542441368103027,0.5566835403442383,0.41561174392700195,COMPLETE
52,0.4766252338886261,Sigmoid,51,459,23,0.0003915546870486878,1,0.7988235128615035,0.009103143807328492,1.3455116748809814,0.4766252338886261,0.25888389348983765,COMPLETE
53,0.515841543674469,Sigmoid,51,432,24,0.00015441978148662477,1,0.7962234132387513,0.004672373581330603,1.2530640363693237,0.515841543674469,0.1979055404663086,COMPLETE
54,2.4382669925689697,Sigmoid,60,457,21,0.0007428752587116203,1,0.6592773668022566,0.008180203005584072,3.6349668502807617,2.4382669925689697,-0.564571738243103,COMPLETE
55,1.7765724658966064,Sigmoid,44,456,23,0.0004043531626327201,1,0.7149154512739947,0.04125867203474741,1.6963024139404297,1.7765724658966064,-4.291534423828125e-06,COMPLETE
56,1.9515447616577148,Sigmoid,36,394,11,0.00021977389504691263,1,0.6068389187554416,0.022268799804084586,4.945767879486084,1.9515447616577148,-0.07515478134155273,COMPLETE
57,1.803170084953308,Sigmoid,16,481,20,0.0003256498774518664,1,0.5521511311095149,0.01397547829648058,1.7772436141967773,1.803170084953308,0.2170696258544922,COMPLETE
58,0.6192944049835205,Sigmoid,54,435,23,0.00048191586018400543,1,0.7414856297567236,0.0054782654090899646,4.219112396240234,0.6192944049835205,0.3013015389442444,COMPLETE
59,3.1745498180389404,ReLU,65,411,17,0.0008184969984591665,1,0.6522701687863747,0.007794881249058045,2.9039580821990967,3.1745498180389404,-1.0971314907073975,COMPLETE
60,3.8139476776123047,Sigmoid,22,64,22,0.00017998669622747694,1,0.4661293183007653,0.0036100094824950634,0.9594986438751221,3.8139476776123047,-0.22817659378051758,COMPLETE
61,0.6308549642562866,Leaky,51,497,21,0.0005903895420584077,1,0.7565590885917354,0.011788955499584943,4.980968475341797,0.6308549642562866,0.3377489447593689,COMPLETE
62,1.8503776788711548,Tanh,68,464,24,0.0008038449587377752,1,0.6808433736344119,0.018597861563375076,3.6309313774108887,1.8503776788711548,-0.133353590965271,COMPLETE
63,0.5280718207359314,Leaky,94,482,22,0.0014717154196251668,1,0.7915264084664215,0.009427688552394889,1.5030016899108887,0.5280718207359314,0.17888832092285156,COMPLETE
64,0.6096093058586121,Leaky,61,446,23,0.00024270316611268148,1,0.7465087579501531,0.005535136302508185,7.180147647857666,0.6096093058586121,0.3600519895553589,COMPLETE
65,1.9811882972717285,Sigmoid,46,488,9,0.0003131904053596758,1,0.6335577689685056,0.014257967627293604,1.3525726795196533,1.9811882972717285,-0.0774468183517456,COMPLETE
66,1.9987034797668457,Leaky,83,244,3,0.00044355695556099443,1,0.695681653312505,0.007760020906313271,1.0336517095565796,1.9987034797668457,-0.23286163806915283,COMPLETE
67,0.5434960126876831,ReLU,29,500,24,0.0009258125981250296,1,0.799198668546312,0.002239254935009763,1.6406861543655396,0.5434960126876831,0.15490490198135376,COMPLETE
68,0.6711981296539307,Leaky,42,461,18,0.0006382892398369183,1,0.7420333580052758,0.004469201393485531,4.826247692108154,0.6711981296539307,0.2427428960800171,COMPLETE
69,2.5350751876831055,Sigmoid,33,426,21,0.0017717014344679973,1,0.5921566297170153,0.00297562152632536,3.62434983253479,2.5350751876831055,-0.45409274101257324,COMPLETE
70,1.9259955883026123,Tanh,38,376,13,0.00011627013657353618,1,0.6360967096703674,0.011208379314751294,1.6322059631347656,1.9259955883026123,-0.04743087291717529,COMPLETE
71,0.6009237170219421,Leaky,48,419,24,0.0010231709756370751,1,0.7607977288815125,0.0017759048446953835,1.7536535263061523,0.6009237170219421,0.3217822313308716,COMPLETE
72,1.8656235933303833,Leaky,57,451,23,0.0012038498143475663,1,0.686645300286503,0.006217569158823385,2.133537769317627,1.8656235933303833,-0.15077388286590576,COMPLETE
73,0.6257034540176392,Leaky,40,389,20,0.0003657365339876824,1,0.7559639347481478,0.004036432344345118,4.645833969116211,0.6257034540176392,0.3431568741798401,COMPLETE
74,2.2101728916168213,Leaky,52,470,22,0.0006519220472306258,1,0.6980325852689379,0.01768125198053551,1.958219051361084,2.2101728916168213,-0.3633023500442505,COMPLETE
75,1.6531927585601807,Leaky,43,441,23,0.0012483844563082474,1,0.7179553521698352,0.008776394887029602,1.7347313165664673,1.6531927585601807,0.06944417953491211,COMPLETE
76,0.5079204440116882,Leaky,26,402,24,0.0005243500521823791,1,0.7968827054011522,0.006937405993589583,1.5551875829696655,0.5079204440116882,0.2102222442626953,COMPLETE
77,0.5280399322509766,Leaky,13,484,11,0.00023923592830210407,1,0.7967257356989085,0.006431991858347733,1.4792377948760986,0.5280399322509766,0.1789379119873047,COMPLETE
78,2.182162046432495,Sigmoid,25,404,24,0.0005381180706263324,1,0.6689565726754065,0.010000871393616599,3.441673517227173,2.182162046432495,-0.4002358913421631,COMPLETE
79,2.1806905269622803,Leaky,19,137,22,0.00040144133724903365,1,0.5368270325658843,0.015590461673563554,1.5623213052749634,2.1806905269622803,0.11245578527450562,COMPLETE
80,2.2070560455322266,Sigmoid,74,430,20,0.0001591411848469743,1,0.6404184066361018,0.004836244500606548,1.346839427947998,2.2070560455322266,-0.20028245449066162,COMPLETE
81,0.6589194536209106,Leaky,32,417,24,0.0008080071562690333,1,0.7472365389602108,0.011683465799840385,6.309312343597412,0.6589194536209106,0.3082877993583679,COMPLETE
82,0.6914810538291931,Leaky,35,467,23,0.0003083676659796285,1,0.7578451075514958,0.00278552367482783,1.7150108814239502,0.6914810538291931,0.21957695484161377,COMPLETE
83,1.8492088317871094,Leaky,27,368,10,0.0005106709342010097,1,0.7160904591433159,0.00723720211266872,1.7030231952667236,1.8492088317871094,-0.04089021682739258,COMPLETE
84,1.924331545829773,Leaky,39,381,22,0.0009666680895106046,1,0.6796919806295832,0.003663676559545109,2.885401487350464,1.924331545829773,-0.17865025997161865,COMPLETE
85,2.6522250175476074,Sigmoid,23,347,24,0.0014747676549822315,1,0.6230806869826465,0.02180845246625057,3.426947593688965,2.6522250175476074,-0.45125651359558105,COMPLETE
86,0.44799235463142395,Leaky,48,454,21,0.00026741624983704187,1,0.7989323119040158,0.008644044304946972,1.0980679988861084,0.44799235463142395,0.3034058213233948,COMPLETE
87,0.6462716460227966,Leaky,49,453,21,0.00019647276061340407,1,0.765937685488764,0.00886567435434209,1.5388011932373047,0.6462716460227966,0.27060139179229736,COMPLETE
88,1.5138133764266968,ReLU,53,479,21,0.0002600288349111124,1,0.5782905072703548,0.012938341625806888,1.3558064699172974,1.5138133764266968,0.10424292087554932,COMPLETE
89,0.521833598613739,Tanh,56,400,16,0.0003869277685110194,1,0.7985642276553379,0.006880981003466618,1.629818320274353,0.521833598613739,0.18858832120895386,COMPLETE
90,1.7473722696304321,Sigmoid,20,491,19,0.00027673153432807284,1,0.7256266502377786,0.005154146859770449,1.865176796913147,1.7473722696304321,0.01643204689025879,COMPLETE
91,0.6394109725952148,Leaky,49,440,23,0.0005935355822621308,1,0.7648326128517803,0.01038073425071105,2.0704431533813477,0.6394109725952148,0.2783445119857788,COMPLETE
92,1.6187225580215454,Leaky,46,461,23,0.0004643423944890103,1,0.7194287740056643,0.014372487669243978,1.898866057395935,1.6187225580215454,0.08884686231613159,COMPLETE
93,2.9780170917510986,Leaky,18,422,24,0.0008229822739290744,1,0.6656295126553572,0.005629399494712494,2.8718369007110596,2.9780170917510986,-0.9109152555465698,COMPLETE
94,0.6182954907417297,Leaky,30,473,22,0.00020324942769549232,1,0.7712079517678426,0.031080227027823808,1.6174474954605103,0.6182954907417297,0.30217599868774414,COMPLETE
95,1.6846339702606201,Sigmoid,41,411,22,0.0006841455524212688,1,0.6943515145488903,0.008880052692386614,1.8756206035614014,1.6846339702606201,-0.03913390636444092,COMPLETE
96,1.7950429916381836,Leaky,24,433,23,0.00041916467539590666,1,0.7261636479824971,0.00705968312962906,1.8272762298583984,1.7950429916381836,-0.010401129722595215,COMPLETE
97,2.60746431350708,Sigmoid,44,286,24,0.002065597293448114,1,0.6519746383062589,0.01942091794375052,2.828444004058838,2.60746431350708,-0.722510576248169,COMPLETE
98,0.5262676477432251,Leaky,27,494,20,0.0003645130673053987,1,0.7995673115186862,0.004408006445442821,1.218544840812683,0.5262676477432251,0.1816936731338501,COMPLETE
99,0.6629221439361572,Sigmoid,37,330,15,0.0005337269988587928,1,0.7598361431945563,0.012196830800615201,1.7696797847747803,0.6629221439361572,0.2518092393875122,COMPLETE
100,2.9194962978363037,Leaky,59,449,21,0.0011074789828135869,1,0.6089705809264123,0.01473475768011281,5.141998767852783,2.9194962978363037,-0.6084234714508057,COMPLETE
101,0.4868181347846985,Sigmoid,51,430,24,0.00016667863383205479,1,0.7721740850562754,0.003432298829744464,1.3037927150726318,0.4868181347846985,0.18333417177200317,COMPLETE
102,1.901788592338562,Sigmoid,51,388,24,0.00016239200020080538,1,0.7042825148060142,0.003097010683253309,1.2208791971206665,1.901788592338562,-0.1413288116455078,COMPLETE
103,0.4546286463737488,Sigmoid,54,437,23,0.00031029032399632777,1,0.7732944016716432,0.005874393143553782,1.2762095928192139,0.4546286463737488,0.23733389377593994,COMPLETE
104,0.6340256929397583,Sigmoid,62,439,22,0.00028006565705904755,1,0.7671077294987597,0.00531620079926822,1.8757227659225464,0.6340256929397583,0.28442251682281494,COMPLETE
105,0.6580268740653992,Sigmoid,63,457,23,0.0003299390507359969,1,0.7357955468499717,0.008064787548631712,4.0322771072387695,0.6580268740653992,0.25760287046432495,COMPLETE
106,2.0022549629211426,Sigmoid,55,475,12,0.0002100452805992194,1,0.6840385633393781,0.006106806886238485,1.8381139039993286,2.0022549629211426,-0.22637832164764404,COMPLETE
107,0.48977944254875183,Sigmoid,53,423,23,0.0001338818331830925,1,0.7765293043728481,0.0039593913349814,1.112195611000061,0.48977944254875183,0.17836642265319824,COMPLETE
108,0.8836702108383179,Sigmoid,53,428,23,0.00011576230617753159,1,0.7289052334848263,0.004087765655871044,2.4663918018341064,0.8836702108383179,0.003028273582458496,COMPLETE
109,0.5389578938484192,Sigmoid,58,400,10,0.00013977848381192465,1,0.775532197829026,0.003840653983087142,1.1628217697143555,0.5389578938484192,0.09586668014526367,COMPLETE
110,0.5098279118537903,Sigmoid,47,411,23,0.00017901231886545315,1,0.7999653876392263,0.002554179200574611,1.1209819316864014,0.5098279118537903,0.20725619792938232,COMPLETE
111,0.5214326977729797,Sigmoid,48,420,23,0.00016983274364046368,1,0.7920616830625875,0.0031835978512267894,1.1459269523620605,0.5214326977729797,0.1892116665840149,COMPLETE
112,1.7976552248001099,Sigmoid,50,408,24,0.00025092072354860294,1,0.7045928085904547,0.0022781004356989417,1.4670045375823975,1.7976552248001099,-0.07883477210998535,COMPLETE
113,0.799079418182373,Sigmoid,46,361,22,0.00018475993263381165,1,0.7342191639339919,0.004822720815585566,4.189356327056885,0.799079418182373,0.09846508502960205,COMPLETE
114,1.8663393259048462,Sigmoid,54,447,23,9.465065171038859e-05,1,0.6594745372767223,0.006310848709995906,1.4832137823104858,1.8663393259048462,-0.19758093357086182,COMPLETE
115,0.7733279466629028,Sigmoid,47,414,24,0.0002271259999256364,1,0.770253265098295,0.0025881835170788966,1.8433321714401245,0.7733279466629028,0.12720245122909546,COMPLETE
116,1.6006817817687988,Sigmoid,56,394,21,0.0003456136904496701,1,0.6874413872755384,0.003460979283960417,1.4107556343078613,1.6006817817687988,0.012650370597839355,COMPLETE
117,0.8700818419456482,Sigmoid,51,434,23,0.00012244049282016987,1,0.7364879818590292,0.009320897662398884,2.4945685863494873,0.8700818419456482,0.018358886241912842,COMPLETE
118,0.4675654172897339,Sigmoid,14,462,22,0.00013804181912344116,1,0.7998223368899838,0.0019524211796257847,1.31302011013031,0.4675654172897339,0.2729712128639221,COMPLETE
119,1.836688756942749,Sigmoid,14,455,22,9.507954362121868e-05,1,0.64005294730716,0.001940262765024947,1.6487642526626587,1.836688756942749,0.0011376738548278809,COMPLETE
120,0.6392260193824768,ReLU,13,466,24,0.00013776081411535308,1,0.7623558482057325,0.001517599755454368,1.8040519952774048,0.6392260193824768,0.2785532474517822,COMPLETE
121,0.5738722681999207,Sigmoid,11,442,23,0.00028865510064630744,1,0.7884051709901982,0.004452679017722697,1.5037133693695068,0.5738722681999207,0.10767215490341187,COMPLETE
122,0.4735620617866516,Sigmoid,16,424,22,0.0001749138632633929,1,0.7955594706207886,0.00273562405411573,1.3225009441375732,0.4735620617866516,0.2636469006538391,COMPLETE
123,1.7373167276382446,Sigmoid,16,422,21,7.695774246275239e-05,1,0.7095449970802652,0.0073163775710684805,1.131410837173462,1.7373167276382446,-0.04262351989746094,COMPLETE
124,0.648727536201477,Sigmoid,18,484,22,0.00015091494193310846,1,0.742929386431031,0.0020085025368928515,7.300562381744385,0.648727536201477,0.3189869523048401,COMPLETE
125,1.5690393447875977,Sigmoid,22,428,22,0.0002372010543729834,1,0.6703131002865017,0.0028980210444454423,3.1236603260040283,1.5690393447875977,-0.006811261177062988,COMPLETE
126,0.7003644704818726,Sigmoid,10,447,24,0.0004777668690974942,1,0.7647381304554406,0.003493656705838308,1.713751196861267,0.7003644704818726,0.2095508575439453,COMPLETE
