number,value,params_activation_1,params_batch_size,params_epochs,params_layer_1,params_learning_rate,params_num_layers,params_train_size,params_weight_decay,user_attrs_mape,user_attrs_mse,user_attrs_r2,state
258,0.6063330769538879,ReLU,59,278,22,0.007629729423776861,1,0.6707165203649197,0.0005503833284650386,1.5507391691207886,0.6063330769538879,0.3772966265678406,COMPLETE
259,0.8124359846115112,ReLU,64,247,20,0.08714531663386721,1,0.5599093855403039,0.06335591431412879,1.3459303379058838,0.8124359846115112,0.2185843586921692,COMPLETE
260,0.6914976239204407,Sigmoid,68,235,21,0.004323067383998452,1,0.6130109708891998,0.00042290028785277615,1.3176029920578003,0.6914976239204407,0.36478209495544434,COMPLETE
261,0.639862596988678,ReLU,42,258,21,0.0062005109094680055,1,0.45335624192520524,0.0012195763958602658,1.5751210451126099,0.639862596988678,0.3976636528968811,COMPLETE
262,0.7055378556251526,ReLU,61,272,21,0.04469845741422254,1,0.6538010497448167,0.0009542440668547781,1.4528292417526245,0.7055378556251526,0.2853711247444153,COMPLETE
263,0.5867810249328613,ReLU,55,253,22,0.003345974844556478,1,0.6783182184556826,0.000668900278854269,1.424057960510254,0.5867810249328613,0.40163934230804443,COMPLETE
264,0.6431207060813904,ReLU,63,241,19,0.002806748388113039,1,0.709813225423407,0.00015318976743195755,1.465615153312683,0.6431207060813904,0.3376231789588928,COMPLETE
265,0.63834547996521,ReLU,70,286,20,0.008503592058142594,1,0.633776895889899,0.0004834559385994611,1.9062583446502686,0.63834547996521,0.37644052505493164,COMPLETE
266,0.6596190929412842,ReLU,65,266,22,0.005468377959277043,1,0.5816978370247194,0.0003044604245639463,1.7474435567855835,0.6596190929412842,0.4015563726425171,COMPLETE
267,0.5952194333076477,Tanh,59,230,21,0.006841202075884806,1,0.6812213692696072,0.0011072800957546115,1.3997442722320557,0.5952194333076477,0.3926645517349243,COMPLETE
268,0.6536253690719604,ReLU,66,217,21,0.004276716912015613,1,0.614149081047984,0.0007330004853843551,1.5662641525268555,0.6536253690719604,0.40110909938812256,COMPLETE
269,0.6639066338539124,ReLU,61,248,22,0.005006747668423713,1,0.362866519419986,0.0008732935854359899,3.6864240169525146,0.6639066338539124,0.36128872632980347,COMPLETE
270,0.6950486898422241,ReLU,63,260,20,0.008368710573916433,1,0.3207290130933732,0.0004167706002844746,1.8827651739120483,0.6950486898422241,0.3208783268928528,COMPLETE
271,0.5880388617515564,ReLU,68,235,23,0.005949612433753072,1,0.6457004202920343,0.0005718886954373979,1.3185665607452393,0.5880388617515564,0.39639854431152344,COMPLETE
272,0.6256718039512634,ReLU,57,208,21,0.007111952086136042,1,0.5149364834725945,0.00035576678343534604,1.5658217668533325,0.6256718039512634,0.3969421982765198,COMPLETE
273,0.5858175754547119,ReLU,65,275,21,0.004078240424785175,1,0.7108002037630498,0.0012859359550578752,1.3367341756820679,0.5858175754547119,0.3978174924850464,COMPLETE
274,0.7789627909660339,Leaky,62,253,20,0.011214831381914592,1,0.22678839399262704,0.0006727648623515119,2.6046957969665527,0.7789627909660339,0.22572201490402222,COMPLETE
275,0.5968997478485107,ReLU,45,265,22,0.00931855949736004,1,0.6639738881938566,0.00099462409934542,1.4644571542739868,0.5968997478485107,0.3814447522163391,COMPLETE
276,0.5875011086463928,ReLU,72,239,22,0.005559921862237815,1,0.7473708137810993,0.0005305079638246514,1.3733539581298828,0.5875011086463928,0.4111485481262207,COMPLETE
277,0.6958793997764587,ReLU,67,225,23,0.0023992525061467414,1,0.5977659421922678,0.022802076566274143,1.254741907119751,0.6958793997764587,0.34697484970092773,COMPLETE
278,0.6383644938468933,ReLU,60,248,21,0.0009545206866319763,1,0.37912191519359967,0.0008276412660719354,2.2961087226867676,0.6383644938468933,0.37612003087997437,COMPLETE
279,0.8012449145317078,ReLU,64,258,21,0.006804454290174955,1,0.18576115192055415,0.00029068004311353805,1.884598970413208,0.8012449145317078,0.19538956880569458,COMPLETE
280,0.6049012541770935,ReLU,66,389,20,0.00478005959702661,1,0.694369146912913,0.000359952049178952,1.5375254154205322,0.6049012541770935,0.38124746084213257,COMPLETE
281,0.6011402010917664,ReLU,69,135,22,0.003565296415176386,1,0.6381954362938361,0.0007293678991176342,1.6224215030670166,0.6011402010917664,0.4065120816230774,COMPLETE
282,0.6856203079223633,ReLU,56,268,8,0.007912321603751663,1,0.7213950792824447,0.0013749996087176009,1.487129807472229,0.6856203079223633,0.29449325799942017,COMPLETE
283,0.6676194071769714,Sigmoid,63,243,19,0.006235891910310319,1,0.34790733724905776,0.0010539759404692571,6.928069114685059,0.6676194071769714,0.3489631414413452,COMPLETE
284,0.5878989696502686,ReLU,36,283,21,0.0048795011255281665,1,0.6647596345112277,0.00046140576619046233,1.3588919639587402,0.5878989696502686,0.3922320008277893,COMPLETE
285,0.6189515590667725,ReLU,59,229,22,0.009633551808403133,1,0.6241578357415332,0.00023005225159170088,1.949559211730957,0.6189515590667725,0.4063464403152466,COMPLETE
286,0.6435632705688477,Leaky,61,257,21,0.00037700175227623194,1,0.6837625216803489,2.5854543360660363e-05,1.1896337270736694,0.6435632705688477,0.3346724510192871,COMPLETE
287,0.7922706007957458,ReLU,67,274,20,7.870429853090597e-05,1,0.7613093258055117,0.0006295782277281366,1.2548561096191406,0.7922706007957458,0.2420823574066162,COMPLETE
288,0.5796008706092834,ReLU,65,216,21,0.0076303112068656686,1,0.6489307664125319,0.0009241514044758411,1.3728160858154297,0.5796008706092834,0.41015368700027466,COMPLETE
289,0.652204692363739,ReLU,70,248,22,0.005823146170561766,1,0.42098629878023625,0.000522926894617205,1.5201902389526367,0.652204692363739,0.372835636138916,COMPLETE
290,0.603175699710846,ReLU,63,263,23,0.01172924789426795,1,0.7198962573974105,0.00041620900853760054,1.2030781507492065,0.603175699710846,0.39233100414276123,COMPLETE
291,0.7702925205230713,ReLU,59,236,20,0.003949436121857886,1,0.5811969505637984,0.046034345246196214,1.1990247964859009,0.7702925205230713,0.29980719089508057,COMPLETE
292,0.6798240542411804,ReLU,31,290,21,0.006810241625133728,1,0.45909925914172317,0.000688456287920984,4.096023082733154,0.6798240542411804,0.35177773237228394,COMPLETE
293,0.6386313438415527,ReLU,64,225,20,0.004756785431731483,1,0.6883026664110187,0.0008074313920770923,1.369541883468628,0.6386313438415527,0.3465549349784851,COMPLETE
294,0.6415441632270813,ReLU,61,252,22,0.0008308064174883303,1,0.3957808850188558,0.00027891782677696346,1.6988224983215332,0.6415441632270813,0.37466901540756226,COMPLETE
295,0.6469802856445312,Tanh,39,241,21,0.0029208532236176202,1,0.6108228531092882,0.001094109612086982,1.2843890190124512,0.6469802856445312,0.40580761432647705,COMPLETE
296,0.5836382508277893,ReLU,67,269,22,0.008767035325202227,1,0.649356492546048,0.000345042576252474,1.4008793830871582,0.5836382508277893,0.4069686532020569,COMPLETE
297,0.6453155875205994,ReLU,62,258,21,0.005582336759290764,1,0.5348903144934529,0.00057944680489752,2.073868989944458,0.6453155875205994,0.36848902702331543,COMPLETE
298,0.6153160333633423,ReLU,58,279,21,0.007510240426426592,1,0.6660405422604793,0.01474917456028964,1.2496123313903809,0.6153160333633423,0.36519157886505127,COMPLETE
299,0.5900077223777771,ReLU,69,245,22,0.0037783108498821373,1,0.6265280945479185,0.0014140080900392794,1.5823062658309937,0.5900077223777771,0.4317895770072937,COMPLETE
300,0.6181182265281677,Leaky,73,497,19,0.010159902982978643,1,0.7061158374513361,0.0008369150224221817,1.3711596727371216,0.6181182265281677,0.368522584438324,COMPLETE
301,0.6289893984794617,ReLU,65,233,23,0.006281710486191933,1,0.7395278286027658,0.00046819767647609335,1.5443313121795654,0.6289893984794617,0.3562355041503906,COMPLETE
302,0.7009131908416748,ReLU,51,264,20,0.0046543572839281636,1,0.5110964063566092,0.0001963906680321862,1.4963181018829346,0.7009131908416748,0.31700271368026733,COMPLETE
303,0.6450538635253906,ReLU,63,252,21,0.005611844731299611,1,0.7794549506634224,0.0002444692610717389,1.4749656915664673,0.6450538635253906,0.40572482347488403,COMPLETE
304,0.6491800546646118,ReLU,66,219,13,0.0012211212830890304,1,0.6803258147056568,0.0011686595262431691,1.297309160232544,0.6491800546646118,0.33427053689956665,COMPLETE
305,0.6705638766288757,ReLU,60,242,22,0.00841177944907413,1,0.5500439288738875,0.0003862603540653074,14.242026329040527,0.6705638766288757,0.35601937770843506,COMPLETE
306,0.6882370114326477,ReLU,55,207,24,0.0018697914549835144,1,0.5988405433192622,0.0006804878287393017,1.484433650970459,0.6882370114326477,0.3567628264427185,COMPLETE
307,0.5903535485267639,Sigmoid,64,271,21,0.012254993837963734,1,0.6411919354280533,0.0009044898891684717,1.623021125793457,0.5903535485267639,0.40766918659210205,COMPLETE
308,0.6161234974861145,ReLU,77,258,20,0.00661437928649391,1,0.6992169732947843,0.000549276629764134,1.4152345657348633,0.6161234974861145,0.3633023500442505,COMPLETE
309,0.551082193851471,ReLU,68,227,21,0.0033575076398968512,1,0.6609677444187338,0.0003377668780981758,1.2792807817459106,0.551082193851471,0.425009548664093,COMPLETE
310,0.8556155562400818,ReLU,71,227,21,0.0033440900120837924,1,0.10244318284337518,0.00029031804538050667,2.4766197204589844,0.8556155562400818,0.03250318765640259,COMPLETE
311,0.6389907002449036,ReLU,68,214,22,0.0014890722774650632,1,0.47213523244794925,0.00033415485491817605,13.420182228088379,0.6389907002449036,0.3857148289680481,COMPLETE
312,0.8199806213378906,ReLU,69,234,21,0.004129855439715773,1,0.148985104573983,0.0004070281293123943,2.6940417289733887,0.8199806213378906,0.15419232845306396,COMPLETE
313,0.6331830620765686,ReLU,70,222,21,0.005061343908845375,1,0.44542429826395574,0.0007495272526056206,1.534873127937317,0.6331830620765686,0.4073014259338379,COMPLETE
314,0.666869044303894,ReLU,66,284,4,0.0030447272508352064,1,0.6238563263801188,0.00048222788086020645,1.2915408611297607,0.666869044303894,0.3645055294036865,COMPLETE
315,0.5895771980285645,ReLU,68,274,22,0.004157348665922878,1,0.6499871153657109,0.00025687936366067303,1.3446552753448486,0.5895771980285645,0.39906805753707886,COMPLETE
316,0.6665809750556946,ReLU,71,252,20,0.005189549164976024,1,0.5778034021732017,0.0010053057556172367,1.844762921333313,0.6665809750556946,0.38697725534439087,COMPLETE
317,0.6291552782058716,ReLU,62,237,11,0.006190073358621752,1,0.6773589699924946,0.001582435799396959,1.3704469203948975,0.6291552782058716,0.3600829839706421,COMPLETE
318,0.6254596710205078,ReLU,67,265,21,0.0026764072704698483,1,0.32677045162549684,0.0005963580562091528,2.342787742614746,0.6254596710205078,0.39574313163757324,COMPLETE
319,0.591659665107727,ReLU,64,228,22,0.003660212209307339,1,0.6595204095873458,0.0003114375290985044,1.364789605140686,0.591659665107727,0.39113521575927734,COMPLETE
320,0.6742506623268127,ReLU,57,248,20,0.004404468555069075,1,0.6018645149660229,0.0012785546905272724,1.471624732017517,0.6742506623268127,0.37140536308288574,COMPLETE
321,0.6528106927871704,Tanh,66,295,22,0.0021361749914653116,1,0.6219617770515821,0.0007963400122657263,1.3493154048919678,0.6528106927871704,0.3748723864555359,COMPLETE
322,0.5772212147712708,ReLU,61,357,21,0.007874546799705154,1,0.6671492164764821,0.000394321335098812,1.413164734840393,0.5772212147712708,0.4060378074645996,COMPLETE
323,0.5831068158149719,ReLU,61,198,21,0.009626566460855086,1,0.6912565507151737,0.0004500180545226426,1.4265573024749756,0.5831068158149719,0.3969498872756958,COMPLETE
324,0.6278362274169922,ReLU,59,443,22,0.00018133944702635696,1,0.7236821298509669,0.0006938926151675422,1.3044263124465942,0.6278362274169922,0.3336339592933655,COMPLETE
325,0.6340237259864807,ReLU,61,429,21,0.007769529507737396,1,0.3090663173727726,0.00016895298070070003,2.744560956954956,0.6340237259864807,0.36551332473754883,COMPLETE
326,0.6951931715011597,ReLU,58,452,20,0.012016811055297035,1,0.3454656464931557,0.0005431410685177241,4.515061378479004,0.6951931715011597,0.3391910195350647,COMPLETE
327,0.5977246165275574,ReLU,63,349,21,0.007513333849161456,1,0.6324012876412138,0.0010380056238019858,1.7271286249160767,0.5977246165275574,0.4241923689842224,COMPLETE
328,0.605288028717041,ReLU,62,208,22,0.0007732594677559397,1,0.6612864911195029,0.0002083786083366588,1.329581618309021,0.605288028717041,0.3684520125389099,COMPLETE
329,0.6766871213912964,ReLU,60,221,21,0.0005901789520599271,1,0.48642171924120664,0.0008934703342884375,1.6744847297668457,0.6766871213912964,0.3550686240196228,COMPLETE
330,0.6633830666542053,ReLU,64,238,19,0.00925555927526814,1,0.5660794479350724,0.0006357144532093413,1.7565321922302246,0.6633830666542053,0.36846643686294556,COMPLETE
331,0.6306509375572205,ReLU,73,244,20,0.006350032834555907,1,0.27489429795745207,0.0004000558312834282,1.63188636302948,0.6306509375572205,0.36603063344955444,COMPLETE
332,0.6905664205551147,ReLU,57,229,22,0.015060874728507617,1,0.4366670467963032,0.0012348110156850394,1.882607340812683,0.6905664205551147,0.3478781580924988,COMPLETE
333,0.692520797252655,ReLU,69,365,15,0.059621419455175816,1,0.6869885380582128,0.0005218302646347319,2.002288579940796,0.692520797252655,0.28761041164398193,COMPLETE
334,0.5799915194511414,ReLU,60,256,21,0.005129366244490707,1,0.643956497609797,0.0009416598528570872,1.7770793437957764,0.5799915194511414,0.40600717067718506,COMPLETE
335,0.6316134929656982,ReLU,65,473,21,0.007062702489899756,1,0.6036880228431158,0.00014767063178492288,1.6766493320465088,0.6316134929656982,0.41550499200820923,COMPLETE
336,0.5947364568710327,ReLU,62,415,22,0.010380830238022307,1,0.7137966892384929,0.0006760058363151956,1.2317566871643066,0.5947364568710327,0.3950367569923401,COMPLETE
337,0.6692838668823242,Sigmoid,67,277,23,0.0045392593671783376,1,0.368189081472778,0.00037023172768949297,1.8121200799942017,0.6692838668823242,0.3553310036659241,COMPLETE
338,0.6883589625358582,ReLU,64,249,21,0.020706145143923448,1,0.4115904950292578,0.00028650509723932303,1.7228070497512817,0.6883589625358582,0.332785427570343,COMPLETE
339,0.6037381291389465,ReLU,59,266,20,0.007997252239573932,1,0.6758159058685037,0.0007970039370078424,1.505070447921753,0.6037381291389465,0.3887222409248352,COMPLETE
340,0.7140042185783386,ReLU,68,392,22,0.003384759276521577,1,0.24421501744130852,0.0004701417753514769,2.504448413848877,0.7140042185783386,0.2944241762161255,COMPLETE
341,0.6504310965538025,ReLU,54,233,21,0.0058382775464647,1,0.7525222367819875,0.0014938807065512552,1.5817512273788452,0.6504310965538025,0.3622312545776367,COMPLETE
342,0.6656047105789185,ReLU,65,214,22,0.006582185235585829,1,0.38524652817755334,0.0010926228933305678,1.9374871253967285,0.6656047105789185,0.3513801097869873,COMPLETE
343,0.7299392223358154,ReLU,62,111,21,0.0002919112803430421,1,0.623216170307842,0.0005785882942263734,1.2184404134750366,0.7299392223358154,0.30248087644577026,COMPLETE
344,0.6215755939483643,Tanh,71,152,20,0.008900596460565197,1,0.6580417751432499,0.0008328094645307098,1.2835499048233032,0.6215755939483643,0.37926220893859863,COMPLETE
345,0.628115713596344,ReLU,63,242,23,0.00516069298961539,1,0.7172555929336338,0.00023755335503729976,1.5027331113815308,0.628115713596344,0.3617671728134155,COMPLETE
346,0.5889958739280701,ReLU,56,257,20,0.013455296660530339,1,0.6937091535373974,0.0003402460732607624,1.3889782428741455,0.5889958739280701,0.395662784576416,COMPLETE
347,0.5950310826301575,ReLU,61,285,21,0.017554391041401142,1,0.6380024568126273,1.111873223634774e-05,1.7794220447540283,0.5950310826301575,0.4125434160232544,COMPLETE
348,0.641602635383606,ReLU,65,271,22,0.004095248286405249,1,0.5886930909856118,0.0006845898876736051,1.7460017204284668,0.641602635383606,0.3977512717247009,COMPLETE
349,0.5706402659416199,ReLU,58,222,21,0.006914640230198035,1,0.6710780485859859,0.0004363883349437095,1.4069814682006836,0.5706402659416199,0.4139530658721924,COMPLETE
350,0.639492928981781,ReLU,58,216,21,0.006425822922752088,1,0.39504645302541125,0.0004186242029032733,2.0051636695861816,0.639492928981781,0.3752550482749939,COMPLETE
351,0.7080100178718567,ReLU,56,204,21,0.007349833455317777,1,0.2887946548970035,0.09648459468428115,3.6430888175964355,0.7080100178718567,0.27619796991348267,COMPLETE
352,0.7636325359344482,ReLU,59,224,22,0.005510552541120803,1,0.2040400832838089,0.0004604718638028675,5.768570899963379,0.7636325359344482,0.20624274015426636,COMPLETE
353,0.7251865863800049,ReLU,60,228,20,0.0005118269074389629,1,0.794906367674372,0.00029180148851977455,1.3037424087524414,0.7251865863800049,0.3269008994102478,COMPLETE
354,0.627186119556427,ReLU,58,488,22,0.008499158313687836,1,0.7415431490438394,0.0003359901518398395,1.3931498527526855,0.627186119556427,0.36390912532806396,COMPLETE
355,0.5979920029640198,ReLU,53,238,21,0.0010609474269182607,1,0.665434312569618,0.0017157760205972086,1.2498635053634644,0.5979920029640198,0.38176387548446655,COMPLETE
356,0.6470629572868347,ReLU,61,218,23,0.004720229537903454,1,0.61548596800389,0.0012565102027838886,1.6894073486328125,0.6470629572868347,0.40886592864990234,COMPLETE
357,0.6212531328201294,ReLU,63,233,20,0.002567180345689665,1,0.7050394753307831,0.00038883054181467885,1.3819143772125244,0.6212531328201294,0.3621811866760254,COMPLETE
358,0.5864270925521851,ReLU,68,250,21,0.003653911732185808,1,0.6392774868569162,0.0001246926835533627,1.8912510871887207,0.5864270925521851,0.411726176738739,COMPLETE
359,0.6751156449317932,Sigmoid,60,242,9,0.005864625657003834,1,0.5613060391942407,0.0002448178972015379,1.3848152160644531,0.6751156449317932,0.3503524661064148,COMPLETE
360,0.6399762630462646,ReLU,57,209,22,0.007144975977782027,1,0.33366936890736165,0.0005362487476114118,2.583087682723999,0.6399762630462646,0.3858215808868408,COMPLETE
361,0.6511405110359192,ReLU,67,224,21,0.010483078384436547,1,0.49987927306081403,0.0010110856110903624,1.6550372838974,0.6511405110359192,0.37154966592788696,COMPLETE
362,0.6036280393600464,ReLU,63,234,22,0.004567664227512792,1,0.6786215132676163,0.0007996884679251747,1.3380796909332275,0.6036280393600464,0.3812945485115051,COMPLETE
363,0.6704343557357788,ReLU,69,256,19,0.008377095047647692,1,0.5985459937650303,0.00020729516310619926,1.7601332664489746,0.6704343557357788,0.3734014630317688,COMPLETE
364,0.7885168790817261,ReLU,55,244,21,1.0917370652026367e-05,1,0.6467955091616038,0.000459633724349279,1.0674370527267456,0.7885168790817261,0.19138801097869873,COMPLETE
365,0.6163281798362732,ReLU,66,362,20,0.005650248818819925,1,0.691878214690438,0.00031181504148417575,1.3442031145095825,0.6163281798362732,0.3644168972969055,COMPLETE
366,0.8160296678543091,ReLU,62,221,22,2.3231200576844604e-05,1,0.7295064227542012,0.0005817083653424664,1.2531644105911255,0.8160296678543091,0.12824201583862305,COMPLETE
367,0.755937397480011,ReLU,70,189,21,0.0032579084076910314,1,0.11444270737804044,0.00039179494416042323,4.094934940338135,0.755937397480011,0.14435571432113647,COMPLETE
368,0.6251341700553894,ReLU,59,265,23,0.006536468971987569,1,0.6217621377658487,0.0009028318600818928,2.1516273021698,0.6251341700553894,0.4013751745223999,COMPLETE
369,0.6071486473083496,Tanh,64,250,21,0.00433478241772135,1,0.6718104676203427,0.0011484549965141728,1.291932463645935,0.6071486473083496,0.3780295252799988,COMPLETE
370,0.6997789740562439,ReLU,74,231,20,0.007671352389487452,1,0.5258307179165861,0.0006848497028346936,1.5066931247711182,0.6997789740562439,0.3299376964569092,COMPLETE
371,0.5748866200447083,ReLU,61,277,22,0.005503628805345623,1,0.6457870196126914,0.0002738312021567743,1.2166147232055664,0.5748866200447083,0.4098988175392151,COMPLETE
372,0.6197893619537354,ReLU,60,201,22,0.004968263569375349,1,0.6372827153634234,0.0002882423992602215,1.7439311742782593,0.6197893619537354,0.3946179747581482,COMPLETE
373,0.6783390045166016,ReLU,58,294,23,0.001678522159678882,1,0.7627986905995324,0.00025877991590620255,1.612402319908142,0.6783390045166016,0.3517147898674011,COMPLETE
374,0.9794939160346985,ReLU,62,173,22,3.3424701075217727e-05,1,0.58218466867893,0.0002122414041545548,1.241463303565979,0.9794939160346985,0.11203521490097046,COMPLETE
375,0.6182342171669006,ReLU,57,239,22,0.0038213841661147406,1,0.6133216603809014,0.0003301744410601504,1.665913462638855,0.6182342171669006,0.4320827126502991,COMPLETE
376,0.7498788833618164,ReLU,60,213,6,0.0001265980595255895,1,0.6546056768243645,0.0003808011361901293,1.2446925640106201,0.7498788833618164,0.2426566481590271,COMPLETE
377,0.5933763384819031,ReLU,61,225,22,0.005531732569600746,1,0.6987865569621244,0.00048741781916914015,1.3926942348480225,0.5933763384819031,0.3851001262664795,COMPLETE
378,0.6416968107223511,ReLU,23,401,21,0.005895159378181294,1,0.7207139655107887,0.000267427411401447,1.624059796333313,0.6416968107223511,0.3385167717933655,COMPLETE
379,0.6778298020362854,ReLU,63,320,23,0.004345695191172659,1,0.5533507311164693,0.0014390038862746525,13.576311111450195,0.6778298020362854,0.3549959659576416,COMPLETE
380,0.5734014511108398,ReLU,72,280,21,0.0028721083571220745,1,0.646825966565171,0.0004252238545775775,1.3240411281585693,0.5734014511108398,0.4119855761528015,COMPLETE
381,0.6728214025497437,ReLU,76,280,22,0.0015226022834614605,1,0.6008919456958415,0.0005202672429721921,1.5697505474090576,0.6728214025497437,0.37208986282348633,COMPLETE
382,0.656429648399353,ReLU,74,274,20,0.0037274708015018676,1,0.6320053765009838,0.00017435159388265673,1.4414061307907104,0.656429648399353,0.36763995885849,COMPLETE
383,0.6383106112480164,ReLU,72,270,22,0.0035631131015724893,1,0.4671894462280108,0.0003350688354205269,5.506226539611816,0.6383106112480164,0.3851662874221802,COMPLETE
384,0.7194187045097351,Sigmoid,69,278,21,0.002524199725813958,1,0.43546284984586686,0.0006108119120291736,1.243721842765808,0.7194187045097351,0.3176206350326538,COMPLETE
385,0.6157235503196716,ReLU,71,292,21,0.0029102163645816363,1,0.643373501892218,0.017140266692413864,1.3404731750488281,0.6157235503196716,0.36796486377716064,COMPLETE
386,0.6136298775672913,ReLU,67,82,21,0.0029955347579866823,1,0.29471919339270874,0.0010180826102969215,18.312074661254883,0.6136298775672913,0.38472408056259155,COMPLETE
