number,value,params_activation_1,params_batch_size,params_epochs,params_layer_1,params_learning_rate,params_num_layers,params_train_size,params_weight_decay,user_attrs_mape,user_attrs_mse,user_attrs_r2,state
127,0.11114040017127991,Leaky,87,391,23,0.0005061686194092375,1,0.5619789925443476,0.017866351902725792,0.7875446677207947,0.11114040017127991,0.5958762168884277,COMPLETE
128,0.11261323094367981,ReLU,89,254,21,0.0006509966861142876,1,0.650531041890656,0.054892626958715066,0.9937795996665955,0.11261323094367981,0.6877744197845459,COMPLETE
129,0.2118484526872635,Leaky,96,329,6,0.000980272019386114,1,0.4531471904480459,0.09875553761052538,1.0264626741409302,0.2118484526872635,0.29505085945129395,COMPLETE
130,0.1837860345840454,Leaky,93,271,17,0.0003846152318391047,1,0.5974306581522414,0.04139894523321834,1.0665708780288696,0.1837860345840454,0.3898998498916626,COMPLETE
131,0.09449896216392517,Leaky,95,376,23,0.0003843026480241605,1,0.4854184803310931,0.02053668085053631,0.6405051946640015,0.09449896216392517,0.5501865148544312,COMPLETE
132,0.10680645704269409,Leaky,95,409,24,0.00026102993453843755,1,0.4898052928626445,0.025482396329460116,0.8555822372436523,0.10680645704269409,0.5126377940177917,COMPLETE
133,0.1167704239487648,Leaky,98,386,23,0.0004667763394186696,1,0.4296025792620277,0.03516562931340712,0.6805425882339478,0.1167704239487648,0.594447135925293,COMPLETE
134,0.12870492041110992,Leaky,92,369,22,0.0006843491930050317,1,0.4563082695943012,0.018977321773452762,0.6504982709884644,0.12870492041110992,0.5717201232910156,COMPLETE
135,0.10799200087785721,Leaky,99,379,24,0.0003533039482113254,1,0.5170487944885844,0.03102445020757028,0.7731196880340576,0.10799200087785721,0.5535842180252075,COMPLETE
136,0.14601871371269226,Leaky,90,353,23,0.00017002145264647596,1,0.5503351726289422,0.013048498052652931,0.7700042128562927,0.14601871371269226,0.441736102104187,COMPLETE
137,0.15727762877941132,ReLU,94,287,22,0.003505308535736587,1,0.7288889074343907,0.04803557317172214,0.8554133176803589,0.15727762877941132,0.6812742948532104,COMPLETE
138,0.1453852653503418,Leaky,96,320,21,0.004396836791915194,1,0.7633534914059338,0.022957020128926465,0.6781718730926514,0.1453852653503418,0.7365977764129639,COMPLETE
139,0.08827957510948181,Tanh,86,402,5,0.001756469260608585,1,0.4709070918795014,0.002259652588066891,0.9172412753105164,0.08827957510948181,0.5594242811203003,COMPLETE
140,0.10013718158006668,Tanh,83,399,4,0.0022619927143095425,1,0.47046999204086576,0.001219812010450238,0.8135825991630554,0.10013718158006668,0.5002467036247253,COMPLETE
141,0.23014941811561584,Tanh,88,427,6,0.0015745370719328637,1,0.4383460006637075,0.0015539911220085367,1.107364535331726,0.23014941811561584,0.20067304372787476,COMPLETE
142,0.11573401838541031,Leaky,86,306,4,0.0011347778595169047,1,0.4996619586193124,0.05963769278657481,0.7161915898323059,0.11573401838541031,0.47190093994140625,COMPLETE
143,1.0315093994140625,Tanh,91,405,23,0.0018530905190868453,1,0.4062593421543716,0.0030039348096349413,2.8074772357940674,1.0315093994140625,-0.29998183250427246,COMPLETE
144,0.14242708683013916,Tanh,84,117,5,0.0027290947191163126,1,0.5243422003254746,0.015866010903601093,0.787009596824646,0.14242708683013916,0.41123688220977783,COMPLETE
145,0.12410242855548859,Tanh,98,420,15,0.00022539709308115857,1,0.4653247118497459,0.02765201462624175,0.733264148235321,0.12410242855548859,0.38064366579055786,COMPLETE
146,0.23311318457126617,Leaky,94,388,6,0.00043217466972698563,1,0.5791773180895593,0.03978440655790535,1.329373836517334,0.23311318457126617,0.1932692527770996,COMPLETE
147,0.09972688555717468,ReLU,13,374,5,0.0008269534674150282,1,0.6820639103865617,0.002053013104299046,0.8460677862167358,0.09972688555717468,0.7542545199394226,COMPLETE
148,0.513912558555603,Leaky,92,391,20,0.0013920676755795832,1,0.4238750439572606,0.07492194538835241,0.7879201173782349,0.513912558555603,0.3888259530067444,COMPLETE
149,0.10881274193525314,Leaky,96,365,24,0.0002966995747227677,1,0.49196481009735854,0.02192746404107094,0.8763030767440796,0.10881274193525314,0.5034830570220947,COMPLETE
150,0.10258549451828003,Leaky,89,438,7,0.0005860572745789933,1,0.5442012287394802,0.03383568091375375,0.8529435396194458,0.10258549451828003,0.607791543006897,COMPLETE
151,0.09555614739656448,Leaky,95,377,23,0.0004704630878588026,1,0.4820422476889784,0.01732703928542445,0.7470744848251343,0.09555614739656448,0.545154333114624,COMPLETE
152,0.1183071956038475,Leaky,100,383,22,0.000451467273087858,1,0.45131902875868646,0.010368692508509844,0.5873446464538574,0.1183071956038475,0.6063197255134583,COMPLETE
153,0.1145641878247261,Leaky,95,412,23,0.0006804657409837967,1,0.5128314323409026,0.019503863878147763,0.6774275302886963,0.1145641878247261,0.5012257099151611,COMPLETE
154,0.08864901959896088,Leaky,79,361,23,0.0003698276349937356,1,0.4751957078738913,0.0009228531267977981,0.6023637056350708,0.08864901959896088,0.5780321359634399,COMPLETE
155,0.20146039128303528,Sigmoid,79,361,24,0.0003258957161959456,1,0.4465838813387627,0.0010509886149390546,0.7548226714134216,0.20146039128303528,0.32961827516555786,COMPLETE
156,0.9770568013191223,Leaky,80,338,21,0.0019977243938495044,1,0.31176518420050675,0.0006914353130220688,2.36954927444458,0.9770568013191223,-0.8470962047576904,COMPLETE
157,0.13619902729988098,Leaky,76,396,22,0.0003912300400046211,1,0.7665817440764404,0.04916429228595661,0.9782115817070007,0.13619902729988098,0.7532409429550171,COMPLETE
158,0.17665980756282806,ReLU,73,296,5,0.000569985706704831,1,0.4758640089322455,0.0008491938062826693,0.9383222460746765,0.17665980756282806,0.15910226106643677,COMPLETE
159,0.10327223688364029,Leaky,85,353,22,0.0009010468030852803,1,0.6339197936269808,0.006428393440904033,0.6326053142547607,0.10327223688364029,0.6961181163787842,COMPLETE
160,0.6884270906448364,Leaky,81,283,12,0.00025341991453176695,1,0.3884016166102457,0.0013477351883887684,0.5664457082748413,0.6884270906448364,0.08745795488357544,COMPLETE
161,0.09532159566879272,Leaky,98,375,23,0.0004930748869860208,1,0.4881240602773252,0.0008833216890999423,0.6365224123001099,0.09532159566879272,0.5650436878204346,COMPLETE
162,0.10344340652227402,Leaky,98,371,23,0.00036968589390725233,1,0.534897609042541,0.0009164834553467406,0.7468677163124084,0.10344340652227402,0.5905411243438721,COMPLETE
163,0.11855760961771011,Leaky,97,383,24,0.0005229963322863172,1,0.4967291357632445,0.0006543148713352461,1.1391072273254395,0.11855760961771011,0.4590167999267578,COMPLETE
164,0.09847179800271988,Leaky,93,274,23,0.0006799077399422451,1,0.47262048893402314,0.0005596463248499829,0.6719297766685486,0.09847179800271988,0.5312758684158325,COMPLETE
165,0.7322391271591187,Leaky,100,400,22,0.0016163425596796073,1,0.43565682939751915,0.0010961957671089945,2.0041890144348145,0.7322391271591187,-1.543123722076416,COMPLETE
166,0.09941733628511429,Leaky,87,346,23,0.00028030860344763897,1,0.5148886489781146,0.001589361886521111,0.6628121733665466,0.09941733628511429,0.5890300273895264,COMPLETE
167,0.4629814922809601,Leaky,91,362,24,0.0024354200302567144,1,0.7975193746969187,0.0004897481156555491,2.2380194664001465,0.4629814922809601,0.23910480737686157,COMPLETE
168,0.2077455222606659,Tanh,97,374,14,0.0005237632577067605,1,0.7222916300520397,0.0008270596404361497,1.343048095703125,0.2077455222606659,0.5614049434661865,COMPLETE
169,0.13751105964183807,Leaky,82,392,21,0.0007513733890115286,1,0.5698178407354471,0.027448586551782107,0.9991788268089294,0.13751105964183807,0.4999883770942688,COMPLETE
170,0.14057214558124542,ReLU,43,407,22,0.0010949235685397507,1,0.613120652315159,0.001878350510851398,0.7313690185546875,0.14057214558124542,0.5586984157562256,COMPLETE
171,0.09465821832418442,Leaky,95,381,23,0.00042961705475445935,1,0.48165005859480947,0.0013307351622945127,0.6476446390151978,0.09465821832418442,0.5494284629821777,COMPLETE
172,0.09147149324417114,Leaky,94,383,23,0.000397547233136155,1,0.46097368778429654,0.0009992108675964892,0.5906615257263184,0.09147149324417114,0.543494462966919,COMPLETE
173,0.11176681518554688,Leaky,93,391,23,0.00038329405143262363,1,0.45410558306882826,0.0023104055106313325,0.6230987310409546,0.11176681518554688,0.6280835866928101,COMPLETE
174,0.6022151708602905,Leaky,94,382,22,0.00021304928577944274,1,0.41160005360280794,0.0011775941041681976,0.8067277073860168,0.6022151708602905,0.24104541540145874,COMPLETE
175,0.2723625898361206,Leaky,90,403,6,0.0003319407230589598,1,0.4540594043940623,0.0013496268667566433,1.2194912433624268,0.2723625898361206,0.09368336200714111,COMPLETE
176,0.5926555395126343,Leaky,96,417,24,0.0003267970301018734,1,0.42753470802306226,0.0616674873304564,0.8037292957305908,0.5926555395126343,0.2951803207397461,COMPLETE
177,0.22601282596588135,Leaky,47,362,2,0.0004107363733069918,1,0.5027764145633538,0.00360381381619554,0.8015302419662476,0.22601282596588135,0.016015470027923584,COMPLETE
178,0.1153954267501831,Leaky,92,479,23,0.0006226779063690689,1,0.47562872815036095,0.00181395599248555,0.718839168548584,0.1153954267501831,0.4507196545600891,COMPLETE
179,0.10569921135902405,Leaky,68,384,22,0.00024529004983219155,1,0.5441060418764173,0.001039106846262562,0.5329527854919434,0.10569921135902405,0.5958870649337769,COMPLETE
180,0.24647508561611176,ReLU,78,304,6,0.0034989496982518868,1,0.51970376051238,0.037704847958885845,1.1484898328781128,0.24647508561611176,-0.01887524127960205,COMPLETE
181,0.09808018058538437,Leaky,98,373,23,0.0004850163386276997,1,0.48472892622489244,0.0007273852605708647,0.6340895891189575,0.09808018058538437,0.5331399440765381,COMPLETE
182,0.11405261605978012,Leaky,96,370,23,0.0004372550584451275,1,0.4429785294598972,0.0009843409015435499,0.637795627117157,0.11405261605978012,0.6204773187637329,COMPLETE
183,0.1166703924536705,Leaky,99,393,24,0.0005093906778827864,1,0.46115105109788856,0.0014646382399044551,0.7951726317405701,0.1166703924536705,0.41773462295532227,COMPLETE
184,0.100679412484169,Leaky,94,379,18,0.0006105754762993177,1,0.4962379305966216,0.0008388089359468308,1.3739391565322876,0.100679412484169,0.5405957698822021,COMPLETE
185,0.2378019094467163,Leaky,88,356,7,0.0028011302612650094,1,0.6490318100503933,0.0012635019448469125,1.7860286235809326,0.2378019094467163,0.3406826853752136,COMPLETE
186,0.11834371089935303,Leaky,98,259,22,0.000302298635180764,1,0.4791987581978562,0.03011008186497068,0.6269176602363586,0.11834371089935303,0.43668586015701294,COMPLETE
187,0.15370194613933563,Tanh,95,462,23,0.0007800198003630745,1,0.6944779177461081,0.023622960158746882,1.0302871465682983,0.15370194613933563,0.6382958889007568,COMPLETE
188,0.21593248844146729,Sigmoid,100,399,21,0.002161042068596941,1,0.7395087267379793,0.002197967724792956,1.481147289276123,0.21593248844146729,0.5624091625213623,COMPLETE
189,0.10500950366258621,Leaky,91,290,24,0.00039291058711488563,1,0.5534377392065416,0.08364817434460972,0.6949625611305237,0.10500950366258621,0.5985239744186401,COMPLETE
190,0.09431706368923187,Leaky,84,271,19,0.0005636252344494442,1,0.5105564267808576,0.007587957589574518,0.6662220358848572,0.09431706368923187,0.5893749594688416,COMPLETE
191,0.10625997185707092,Leaky,84,267,23,0.0005246124898075116,1,0.5079653834690632,0.005121858646759737,0.6911219358444214,0.10625997185707092,0.5373795032501221,COMPLETE
192,0.08185714483261108,Leaky,84,254,19,0.0006259792168986234,1,0.4611889289222229,0.007195903626127283,0.5989089608192444,0.08185714483261108,0.5914766788482666,COMPLETE
193,0.08308923244476318,Leaky,82,243,19,0.0008764773305478081,1,0.4625440541343969,0.004131273673665394,0.593911349773407,0.08308923244476318,0.585327684879303,COMPLETE
194,0.08180137723684311,Leaky,81,233,19,0.0009476387034411821,1,0.46536792776879754,0.006144202821893656,0.597261905670166,0.08180137723684311,0.5917549729347229,COMPLETE
195,0.5372807383537292,Leaky,80,229,19,0.0006956139141380685,1,0.4277998939102549,0.008358948012330237,0.9326671361923218,0.5372807383537292,0.36103516817092896,COMPLETE
196,0.10519593954086304,Leaky,83,218,18,0.0012849763520657528,1,0.4628790812784845,0.005052392674895367,0.6581821441650391,0.10519593954086304,0.4750000834465027,COMPLETE
197,0.1044129952788353,Leaky,78,249,19,0.0008144889243432542,1,0.4399930438288569,0.007565140629279033,0.7065168619155884,0.1044129952788353,0.637365460395813,COMPLETE
198,0.495734840631485,Leaky,82,243,19,0.0008766363176986025,1,0.41288348921638923,0.0045272821588441346,0.8785780072212219,0.495734840631485,0.3752394914627075,COMPLETE
199,0.1720980405807495,ReLU,86,255,17,0.0013028508759147022,1,0.46081257518875063,0.003934613736313125,0.7412981986999512,0.1720980405807495,0.14111262559890747,COMPLETE
200,0.14549721777439117,Leaky,84,225,20,0.0019197714070901721,1,0.5284942357428853,0.006199537732827439,1.0799275636672974,0.14549721777439117,0.39854562282562256,COMPLETE
201,0.08445260673761368,Leaky,80,236,19,0.0009764252258621014,1,0.48201141661351005,0.009177650533931016,0.7874794602394104,0.08445260673761368,0.5980069637298584,COMPLETE
202,0.08100028336048126,Leaky,81,215,19,0.0011334660319692166,1,0.46516863395379165,0.013552121848428187,0.612736165523529,0.08100028336048126,0.5957529544830322,COMPLETE
203,0.12037323415279388,Leaky,76,216,18,0.0009541284380995426,1,0.44573276497984415,0.007556042169753058,0.7695257663726807,0.12037323415279388,0.5994447469711304,COMPLETE
204,0.08225752413272858,Leaky,81,198,19,0.0010859652087357712,1,0.46279158864271447,0.005942869845401043,0.5988692045211792,0.08225752413272858,0.5894784927368164,COMPLETE
205,0.08273305743932724,Leaky,80,240,19,0.0010616812957406855,1,0.464348761709887,0.009154761902702908,0.6179247498512268,0.08273305743932724,0.5871052742004395,COMPLETE
206,0.528276264667511,Leaky,80,182,19,0.0011479175116947446,1,0.42611238223626274,0.006226060485400827,1.144972562789917,0.528276264667511,0.3717438578605652,COMPLETE
207,0.08490102738142014,Leaky,81,188,20,0.001388976974116505,1,0.4578219930956913,0.009983819031960491,0.7685319185256958,0.08490102738142014,0.5762856006622314,COMPLETE
208,0.45980745553970337,Leaky,81,208,20,0.0015535411592126906,1,0.3911704708290682,0.009398188810167846,0.7023270726203918,0.45980745553970337,0.3905038833618164,COMPLETE
209,0.1704915463924408,Tanh,78,200,18,0.0010367622725545094,1,0.44490415795893096,0.012848304724956778,0.7964311242103577,0.1704915463924408,0.432670533657074,COMPLETE
210,0.09589419513940811,Leaky,79,235,20,0.0013946993235300102,1,0.46616312738978544,0.009826588942901456,0.8754900097846985,0.09589419513940811,0.5214221477508545,COMPLETE
211,0.09648272395133972,Leaky,82,193,19,0.001756457075206859,1,0.4692016095632199,0.009059967074644354,0.6658262014389038,0.09648272395133972,0.5184849500656128,COMPLETE
212,0.1194349154829979,Leaky,76,184,18,0.0010630045227121342,1,0.4547431315083823,0.005940507830449328,0.7590792179107666,0.1194349154829979,0.6025670766830444,COMPLETE
213,0.16587044298648834,Leaky,81,238,19,0.0015728382738928693,1,0.43362801981061194,0.012460399831140126,1.1024715900421143,0.16587044298648834,0.4239189624786377,COMPLETE
214,0.09343643486499786,Leaky,80,205,19,0.0012297990635584208,1,0.4938108262302214,0.01100356650974947,0.9120528697967529,0.09343643486499786,0.5736457109451294,COMPLETE
215,0.49801555275917053,Leaky,78,161,18,0.0021655997153126718,1,0.4102779718156742,0.006675152662660014,1.1514173746109009,0.49801555275917053,0.37236523628234863,COMPLETE
216,0.08251050859689713,Leaky,82,229,19,0.000921308761036711,1,0.471413973585655,0.005205492521721969,0.5965526103973389,0.08251050859689713,0.5882159471511841,COMPLETE
217,0.09094870835542679,ReLU,82,229,20,0.0010831148270586605,1,0.4773152506920839,0.004766471598418714,1.4853637218475342,0.09094870835542679,0.5670856237411499,COMPLETE
218,0.08821099996566772,ReLU,82,232,20,0.000948024949651175,1,0.4827959493112377,0.005101706718840805,1.3548368215560913,0.08821099996566772,0.5801171064376831,COMPLETE
219,0.09782599657773972,ReLU,83,233,20,0.0009320012766568467,1,0.5062169650440476,0.004051531377605242,0.9503107070922852,0.09782599657773972,0.5740982294082642,COMPLETE
220,0.12847667932510376,ReLU,79,219,19,0.0009041100182116121,1,0.7603958757682233,0.0031345156938945647,1.0796278715133667,0.12847667932510376,0.7672319412231445,COMPLETE
221,0.08585434406995773,ReLU,82,229,20,0.001217125540578268,1,0.46901066055850116,0.004374049309213848,0.7917153835296631,0.08585434406995773,0.571527898311615,COMPLETE
222,0.11672072857618332,ReLU,84,243,19,0.0015412414626009472,1,0.4831152585890218,0.00513335295864981,1.0109283924102783,0.11672072857618332,0.4444112777709961,COMPLETE
223,0.1386667639017105,ReLU,81,225,20,0.0013007609297630294,1,0.4447056509995008,0.005817248241331017,0.7190374732017517,0.1386667639017105,0.5385710000991821,COMPLETE
224,0.08772129565477371,ReLU,85,250,19,0.0010630828940328286,1,0.46992322881560106,0.004287303112531741,0.6384665966033936,0.08772129565477371,0.5622105002403259,COMPLETE
225,0.10189740359783173,ReLU,82,250,19,0.0010935993331080227,1,0.5000571138087557,0.0032947619890299562,0.6733363270759583,0.10189740359783173,0.5563726425170898,COMPLETE
226,0.4020724892616272,ReLU,74,193,20,0.00125361599066499,1,0.35823825892234795,0.004374983036700657,0.61961829662323,0.4020724892616272,0.406707763671875,COMPLETE
227,0.15406757593154907,ReLU,79,238,18,0.001769053107023949,1,0.4646674674173534,0.0028415230786857557,0.7601670026779175,0.15406757593154907,0.2310970425605774,COMPLETE
228,0.36320820450782776,ReLU,85,220,19,0.0009514282043954041,1,0.23913761820215454,0.005363016146940289,1.4053339958190918,0.36320820450782776,0.12139379978179932,COMPLETE
229,0.5362564325332642,ReLU,80,255,20,0.0008099551457812538,1,0.41873999549392915,0.004058153026137402,0.7668495178222656,0.5362564325332642,0.3622533679008484,COMPLETE
230,0.13888324797153473,ReLU,83,236,19,0.0013758011234220088,1,0.43604830268847744,0.00713828656651822,0.9099041819572449,0.13888324797153473,0.5176476240158081,COMPLETE
231,0.08097679913043976,ReLU,82,211,18,0.0007563125979694644,1,0.47850781290000816,0.0036946212494111093,0.7429239153862,0.08097679913043976,0.6145517826080322,COMPLETE
232,0.08062667399644852,ReLU,77,211,18,0.0007791299081778664,1,0.4847275679965266,0.003611290029916266,0.727166473865509,0.08062667399644852,0.6162183284759521,COMPLETE
233,0.1756013184785843,ReLU,81,212,17,0.0010069849287792894,1,0.7957217842259907,0.0033741967734143025,1.8133628368377686,0.1756013184785843,0.7114048600196838,COMPLETE
234,0.12303528189659119,ReLU,77,202,18,0.000763881977125102,1,0.45421482406882835,0.0025765686619735914,0.7152760624885559,0.12303528189659119,0.5905864834785461,COMPLETE
235,0.0941087007522583,ReLU,58,229,19,0.0009047198449783016,1,0.4949311095579588,0.0038915162892329863,0.8005961179733276,0.0941087007522583,0.5705781579017639,COMPLETE
236,0.09450925886631012,ReLU,85,176,18,0.0011570043870626008,1,0.520468535311926,0.004516528489475583,0.7499426007270813,0.09450925886631012,0.6093189716339111,COMPLETE
237,0.08532596379518509,ReLU,83,195,18,0.0007101018269486193,1,0.4812306934292364,0.003559148162534469,0.8178083300590515,0.08532596379518509,0.593849778175354,COMPLETE
238,0.09352583438158035,ReLU,83,163,18,0.0007207715999842525,1,0.4889651530912353,0.003650032957418768,0.8631606101989746,0.09352583438158035,0.5732377767562866,COMPLETE
239,0.21932484209537506,ReLU,82,196,17,0.0008001728325836466,1,0.7293357310826539,0.0026938664444878745,1.3823931217193604,0.21932484209537506,0.5555345416069031,COMPLETE
240,0.11124912649393082,ReLU,85,209,17,0.0010566421143352225,1,0.47387127571623694,0.00567401205514953,0.9108890891075134,0.11124912649393082,0.47045600414276123,COMPLETE
241,0.08491506427526474,ReLU,81,223,19,0.0006603304018724468,1,0.4573288360157429,0.004756200655930582,0.6037716865539551,0.08491506427526474,0.5762155652046204,COMPLETE
242,0.10886604338884354,ReLU,81,219,19,0.0006563962799365657,1,0.44723259037304663,0.004484835840399055,0.6319642663002014,0.10886604338884354,0.6377362012863159,COMPLETE
243,0.08511816710233688,ReLU,77,210,19,0.0008385577922321634,1,0.4847934398505163,0.005185990405971095,0.7115194201469421,0.08511816710233688,0.5948389768600464,COMPLETE
244,0.09649860113859177,ReLU,78,188,19,0.0008365099712807255,1,0.5022515121191844,0.0070335535964087285,0.6789634227752686,0.09649860113859177,0.5798772573471069,COMPLETE
245,0.13154420256614685,ReLU,75,210,18,0.0006778411870714551,1,0.676570828866063,0.0051214949007474435,0.8292984366416931,0.13154420256614685,0.6758507490158081,COMPLETE
246,0.08879054337739944,ReLU,80,248,20,0.0009204043125546477,1,0.48421630088442263,0.00804481700778412,1.3799351453781128,0.08879054337739944,0.5773584842681885,COMPLETE
247,0.10476604849100113,ReLU,76,224,19,0.0007771376139042467,1,0.5297425511862072,0.00611145411814873,0.7328817248344421,0.10476604849100113,0.5853056907653809,COMPLETE
248,0.08002883940935135,ReLU,77,202,18,0.0010177913132250506,1,0.4602272179260321,0.0038418516788201232,0.6250010132789612,0.08002883940935135,0.6006011366844177,COMPLETE
249,0.13088420033454895,ReLU,77,201,18,0.001200254148689827,1,0.45236411290434414,0.00355765328114478,0.8092783689498901,0.13088420033454895,0.5644683241844177,COMPLETE
250,0.12580996751785278,ReLU,79,212,18,0.0006404957862862423,1,0.4310070540698234,0.00424578751998666,0.8138540983200073,0.12580996751785278,0.5630521178245544,COMPLETE
251,0.1238231211900711,ReLU,72,201,19,0.0014424350626096958,1,0.767293225156349,0.008287628219951883,0.8042711615562439,0.1238231211900711,0.7756630182266235,COMPLETE
252,0.4961654543876648,ReLU,80,191,19,0.0010846652385663974,1,0.40348476095293,0.003054959770823665,0.8719218373298645,0.4961654543876648,0.37469685077667236,COMPLETE
253,0.06918773800134659,ReLU,77,219,18,0.0007574357366353321,1,0.458605037335195,0.010919898390043821,0.5900517702102661,0.06918773800134659,0.6547056436538696,COMPLETE
254,0.06764981895685196,ReLU,74,220,18,0.0008303586158662832,1,0.45929701803467554,0.010997525217731558,0.5808537006378174,0.06764981895685196,0.6623809337615967,COMPLETE
