number,value,params_activation_1,params_batch_size,params_epochs,params_layer_1,params_learning_rate,params_num_layers,params_train_size,params_weight_decay,user_attrs_mape,user_attrs_mse,user_attrs_r2,state
255,0.3582197427749634,ReLU,74,219,18,0.0007777372416440284,1,0.3260029283274756,0.009713929854335581,0.6452471017837524,0.3582197427749634,0.366502046585083,COMPLETE
256,0.45155069231987,ReLU,77,208,17,0.0009568121041052816,1,0.3772745472005445,0.011700038005160252,0.8130678534507751,0.45155069231987,0.3672128915786743,COMPLETE
257,0.5691221952438354,ReLU,75,225,17,0.0006985618508993098,1,0.423237767798073,0.014696047294351578,0.8487421274185181,0.5691221952438354,0.32316750288009644,COMPLETE
258,0.07740489393472672,ReLU,70,244,18,0.0008606523984333576,1,0.45824129492754234,0.009027519006932763,0.6142464876174927,0.07740489393472672,0.6136964559555054,COMPLETE
259,0.1108318567276001,ReLU,73,214,18,0.0008158140892733468,1,0.4419189406885544,0.010865016503298663,0.8195993304252625,0.1108318567276001,0.6150722503662109,COMPLETE
260,0.1245032548904419,ReLU,76,202,16,0.0006300305030430556,1,0.4516789155392973,0.0069344593995128035,0.6084898114204407,0.1245032548904419,0.5857016444206238,COMPLETE
261,0.5005744695663452,ReLU,78,242,18,0.0008598730753663474,1,0.40301570542357706,0.00863887943501693,0.911064863204956,0.5005744695663452,0.36914026737213135,COMPLETE
262,0.12301339954137802,ReLU,73,235,17,0.0007316712162964736,1,0.5085312758029019,0.009610491775310412,0.9178937673568726,0.12301339954137802,0.46444064378738403,COMPLETE
263,0.14631028473377228,ReLU,71,180,18,0.0012602176453810514,1,0.70926999453547,0.013610367813755244,1.1112258434295654,0.14631028473377228,0.671238899230957,COMPLETE
264,0.07791511714458466,ReLU,68,225,18,0.000628081912156194,1,0.46818587585703697,0.006418837968450483,0.622491717338562,0.07791511714458466,0.6111500859260559,COMPLETE
265,0.32256555557250977,ReLU,76,222,18,0.0005803322071106322,1,0.2812467647531487,0.006774329633427521,0.7251559495925903,0.32256555557250977,0.3210749626159668,COMPLETE
266,0.22870662808418274,Sigmoid,68,194,18,0.0006302147572558252,1,0.43324127956283137,0.010975734506020247,0.8266574144363403,0.22870662808418274,0.20568400621414185,COMPLETE
267,0.08011460304260254,ReLU,71,212,19,0.0009120864832164293,1,0.4586155398540839,0.008263199462896647,0.5835695862770081,0.08011460304260254,0.6001731157302856,COMPLETE
268,0.10688812285661697,ReLU,69,209,19,0.0009167656278934836,1,0.4515546182177702,0.008443046726981911,0.6250118017196655,0.10688812285661697,0.6443179845809937,COMPLETE
269,0.11704887449741364,ReLU,66,217,19,0.0009756439231927882,1,0.5961319334257222,0.007447742530505919,0.8265955448150635,0.11704887449741364,0.611441969871521,COMPLETE
270,0.5313351154327393,ReLU,73,242,19,0.000843442900755922,1,0.42025730908371234,0.009205715208133753,0.9328013062477112,0.5313351154327393,0.3681061267852783,COMPLETE
271,0.0827954038977623,ReLU,67,229,19,0.0007547274969341662,1,0.46250292361515927,0.005784785317113175,0.5923726558685303,0.0827954038977623,0.5867940783500671,COMPLETE
272,0.8870549201965332,ReLU,65,232,17,0.021134536459211036,1,0.4592103003993936,0.011006732916173611,3.1400575637817383,0.8870549201965332,-3.4270129203796387,COMPLETE
273,0.13504910469055176,ReLU,70,488,18,0.0005764646778870448,1,0.4388285984719266,0.005901528001184431,0.9972594976425171,0.13504910469055176,0.5309638977050781,COMPLETE
274,0.1090439185500145,ReLU,70,224,18,0.001070132549866091,1,0.6253647349529763,0.014905710862530307,0.9854629635810852,0.1090439185500145,0.6706525683403015,COMPLETE
275,0.16278810799121857,ReLU,67,241,19,0.0007218196625507296,1,0.7383379404263889,0.00685849801237849,1.0961135625839233,0.16278810799121857,0.6701071262359619,COMPLETE
276,0.09829890727996826,ReLU,72,255,17,0.0005991858252926358,1,0.4635047421427734,0.01250413276196536,0.7751915454864502,0.09829890727996826,0.5094209909439087,COMPLETE
277,0.2502792179584503,ReLU,68,230,19,0.0001341105799236815,1,0.6707428504318236,0.008554695377975994,0.6701965928077698,0.2502792179584503,0.3481453061103821,COMPLETE
278,0.4711361825466156,ReLU,63,262,19,0.0014537376545601137,1,0.391023711295029,0.006027196741374543,0.8160521984100342,0.4711361825466156,0.37548714876174927,COMPLETE
279,0.5465262532234192,Sigmoid,69,219,18,4.722515237948154e-05,1,0.7750904749356001,0.009905280875754445,1.76786208152771,0.5465262532234192,0.044268786907196045,COMPLETE
280,0.10008787363767624,ReLU,71,237,20,0.0010153844153027339,1,0.5069728439435669,0.007363925430725838,0.9745944142341614,0.10008787363767624,0.5642507672309875,COMPLETE
281,0.26128119230270386,ReLU,74,246,18,0.0023632904783067927,1,0.5407313457394091,0.005427643482137648,0.9323391318321228,0.26128119230270386,-0.03422653675079346,COMPLETE
282,0.5154531598091125,ReLU,71,174,19,0.0007646715456472588,1,0.41202990655670196,0.015621032284646171,0.893926739692688,0.5154531598091125,0.3503890633583069,COMPLETE
283,0.4026556611061096,ReLU,31,226,20,6.184835152529377e-05,1,0.43423109212429967,0.0077893021209279895,0.7313967943191528,0.4026556611061096,-0.39845454692840576,COMPLETE
284,0.11409130692481995,Leaky,79,203,16,0.001173687444652522,1,0.4932944143642984,0.011635944627311044,0.8965122699737549,0.11409130692481995,0.4793967008590698,COMPLETE
285,0.10085200518369675,ReLU,78,217,17,0.000638183976129295,1,0.46015069734640146,0.00017805700279135522,0.8072429299354553,0.10085200518369675,0.49667924642562866,COMPLETE
286,0.9544785022735596,Leaky,63,234,19,0.000907085873809156,1,0.1381635580629065,0.006262552865720518,1.8459502458572388,0.9544785022735596,-1.9557514190673828,COMPLETE
287,0.25392669439315796,ReLU,75,211,18,0.0029254255195749175,1,0.5214916351127064,0.009260820529478356,1.1481393575668335,0.25392669439315796,-0.04967856407165527,COMPLETE
288,0.42279988527297974,Leaky,80,248,19,0.0013741878715722057,1,0.36126731355833797,0.0025100440375904944,0.7921568155288696,0.42279988527297974,0.3761226534843445,COMPLETE
289,0.28440073132514954,ReLU,77,226,20,9.736097265571783e-05,1,0.47221161325295735,0.013486068763941225,0.98026442527771,0.28440073132514954,-0.3537428379058838,COMPLETE
290,0.1663118302822113,Leaky,81,187,19,0.0005280136499384963,1,0.7089358214337715,0.0054207937635556,0.9479491114616394,0.1663118302822113,0.6262951493263245,COMPLETE
291,0.1210259199142456,Leaky,78,203,18,0.0007542610479132622,1,0.4453696301652894,0.017567406655697025,0.7000015377998352,0.1210259199142456,0.5972728729248047,COMPLETE
292,0.5247042179107666,ReLU,75,237,11,0.0020115808194560007,1,0.4231214385916291,0.007819623525656426,1.105798363685608,0.5247042179107666,0.37599194049835205,COMPLETE
293,0.08271414041519165,Leaky,80,216,18,0.0010306133807384545,1,0.49198106459118346,0.01021533146991281,1.0738685131072998,0.08271414041519165,0.6225720047950745,COMPLETE
294,0.09118619561195374,Leaky,67,214,18,0.0012588634990846504,1,0.49519770114374406,0.010805572407511756,1.1357825994491577,0.09118619561195374,0.5839136838912964,COMPLETE
295,0.1640736311674118,Leaky,72,255,17,0.001021693411687153,1,0.5302811769618129,0.01250677495824193,0.8435333371162415,0.1640736311674118,0.3505491614341736,COMPLETE
296,0.15704870223999023,Leaky,79,201,18,0.000885583826810074,1,0.7952754623982438,0.008807806814694908,1.8372873067855835,0.15704870223999023,0.7418954968452454,COMPLETE
297,0.18481174111366272,Leaky,74,232,17,0.0010942351308540653,1,0.560265881773101,5.372681904106727e-05,0.9542830586433411,0.18481174111366272,0.3279956579208374,COMPLETE
298,0.16903163492679596,Leaky,100,217,13,1.273588309947581e-05,1,0.47314006764772565,0.010556467297437708,1.35575270652771,0.16903163492679596,0.19541221857070923,COMPLETE
299,0.39285898208618164,Leaky,83,146,18,3.002491510237829e-05,1,0.499333409031804,0.006638281878289036,1.362210988998413,0.39285898208618164,-0.7926315069198608,COMPLETE
300,0.09743722528219223,Leaky,79,209,20,0.0016175938219400794,1,0.746495748671325,0.022263178492772318,0.6711019277572632,0.09743722528219223,0.813064455986023,COMPLETE
301,0.09031324088573456,Leaky,70,195,19,0.0008512756972969256,1,0.47938960750360116,0.002060990451738495,0.7451726794242859,0.09031324088573456,0.5701104402542114,COMPLETE
302,0.1589348465204239,Leaky,77,244,18,0.0014190869013802827,1,0.4414193582544301,0.009015334838120372,1.0835552215576172,0.1589348465204239,0.44800686836242676,COMPLETE
303,0.504880964756012,Leaky,81,261,18,0.0026092039155310763,1,0.34347601135103806,0.014759544160372654,0.881834864616394,0.504880964756012,0.2115161418914795,COMPLETE
304,0.14366202056407928,Sigmoid,84,225,19,0.0009286950190322392,1,0.6071545557982946,0.003033795884388331,0.9941406846046448,0.14366202056407928,0.548998236656189,COMPLETE
305,0.245550274848938,Leaky,59,235,6,0.0011644257287269629,1,0.5209981994530163,0.006905017845202277,1.2875843048095703,0.245550274848938,-0.015052199363708496,COMPLETE
306,0.12781506776809692,Leaky,76,206,20,0.0007110161422569833,1,0.5811304025887587,0.026358366258086168,0.7929019927978516,0.12781506776809692,0.5576726198196411,COMPLETE
307,0.12881354987621307,Leaky,97,51,17,0.001752922209629507,1,0.4594517435646199,0.011795407793313064,0.9925447702407837,0.12881354987621307,0.3571320176124573,COMPLETE
308,0.1056051179766655,ReLU,79,221,18,0.0005517318458110114,1,0.4884585046901409,0.035109170605956315,0.9341192245483398,0.1056051179766655,0.5181195735931396,COMPLETE
309,0.4926031529903412,Leaky,82,247,19,0.0010461928840324116,1,0.4011294823380923,0.008483756445961988,0.8554332256317139,0.4926031529903412,0.3791862726211548,COMPLETE
310,0.13114811480045319,ReLU,74,215,19,0.0007988983732544002,1,0.6783556734580034,0.01847299894086002,0.8195915818214417,0.13114811480045319,0.6768267154693604,COMPLETE
311,0.6384313702583313,Leaky,65,449,17,0.00018021035139278722,1,0.42811623045869224,0.004059410877776114,0.8275302648544312,0.6384313702583313,0.24074113368988037,COMPLETE
312,0.11646197736263275,ReLU,52,229,19,0.001258786782061744,1,0.6403448449563262,0.005770597837604518,0.6805142760276794,0.11646197736263275,0.6573069095611572,COMPLETE
313,0.5155609846115112,Leaky,99,186,20,0.004440919978754519,1,0.5127726337958384,0.007436212684602704,2.026362657546997,0.5155609846115112,-1.2445805072784424,COMPLETE
314,0.07447415590286255,Leaky,80,242,18,0.0006740844607082522,1,0.47005208766026224,0.003493333255385346,0.5962995886802673,0.07447415590286255,0.6283228397369385,COMPLETE
315,0.10394816845655441,ReLU,72,263,18,0.0006138566903628151,1,0.5433086585698321,0.0033208581384422133,0.8439779281616211,0.10394816845655441,0.6025817394256592,COMPLETE
316,0.08110526204109192,Leaky,77,243,18,0.0007039995596354121,1,0.47805878448908523,0.002416570749313106,0.7323196530342102,0.08110526204109192,0.6139402389526367,COMPLETE
317,0.4665977358818054,Leaky,76,238,16,0.0005528770869130858,1,0.37482843175452035,0.003850995318773851,0.781036913394928,0.4665977358818054,0.3461264967918396,COMPLETE
318,0.11819478869438171,ReLU,40,247,17,0.000721355404259374,1,0.49753756484403533,0.0025103094368227265,1.264298915863037,0.11819478869438171,0.4606723189353943,COMPLETE
319,0.3606116771697998,Sigmoid,78,270,18,0.000494533752494118,1,0.7620683905435047,0.0029196705711850074,1.1162664890289307,0.3606116771697998,0.3466605544090271,COMPLETE
320,0.07438421994447708,Leaky,69,255,18,0.0006470055485383483,1,0.4700915730510148,0.0034009435053648884,0.5960183143615723,0.07438421994447708,0.6287716627120972,COMPLETE
321,0.11719056218862534,Leaky,71,257,18,0.0006562511938810621,1,0.44251585287031336,0.003327195294604083,0.8436182141304016,0.11719056218862534,0.5929880142211914,COMPLETE
322,0.17544066905975342,ReLU,67,247,15,0.000796378423316766,1,0.4660967878843467,0.00371827044224172,1.0052345991134644,0.17544066905975342,0.1244305968284607,COMPLETE
323,0.16084566712379456,Leaky,70,254,16,0.0006504695298512014,1,0.707396124772275,0.004542129832770848,1.1585052013397217,0.16084566712379456,0.6385776996612549,COMPLETE
324,1.403103232383728,ReLU,68,267,17,0.0035968359137613574,1,0.47419896396788347,0.004911072021113759,4.011723041534424,1.403103232383728,-5.678748607635498,COMPLETE
325,0.5430525541305542,Leaky,74,241,18,0.0007807621024117324,1,0.41999760004454695,0.002712107241409304,0.9339386820793152,0.5430525541305542,0.3541709780693054,COMPLETE
326,0.9318317770957947,ReLU,76,228,18,0.08862686174615657,1,0.4462735069404069,0.04209586205091972,2.2875306606292725,0.9318317770957947,-2.1007730960845947,COMPLETE
327,0.15954409539699554,Leaky,70,277,17,0.0005331298085999061,1,0.6490659395345264,0.004428673162763025,1.0916218757629395,0.15954409539699554,0.5576562881469727,COMPLETE
328,0.10857804864645004,ReLU,73,254,18,0.0009491647131585261,1,0.5059225785559902,0.0032845737985291784,0.9865298867225647,0.10857804864645004,0.5272873640060425,COMPLETE
329,0.07550793886184692,Leaky,77,218,19,0.0006283246216257458,1,0.45770433747127953,0.029702250475533373,0.5699057579040527,0.07550793886184692,0.6231635808944702,COMPLETE
330,0.5595221519470215,Leaky,76,215,2,0.0005975441580296589,1,0.7322095436201,0.02889233857689767,0.6486994624137878,0.5595221519470215,-0.13388097286224365,COMPLETE
331,0.46234655380249023,ReLU,78,207,6,0.0005147434596795905,1,0.27489429795745207,0.03488382666555125,1.3665822744369507,0.46234655380249023,0.026868700981140137,COMPLETE
332,0.46040505170822144,Leaky,69,228,18,0.002223197615330429,1,0.3916044287739052,0.022920635874772766,0.9552040696144104,0.46040505170822144,0.38971173763275146,COMPLETE
333,0.5072826743125916,ReLU,74,218,19,0.0006753731802511327,1,0.4112443278373806,0.029246443300722107,0.9901239275932312,0.5072826743125916,0.36068612337112427,COMPLETE
334,0.12157870829105377,Leaky,66,199,7,0.0004508802443403658,1,0.48759573486200714,0.01879604522489917,1.2296855449676514,0.12157870829105377,0.4452313780784607,COMPLETE
335,0.5204483270645142,ReLU,77,209,18,0.0029376019117994365,1,0.4487345482264506,0.006096321664368223,1.4312998056411743,0.5204483270645142,-0.7318494319915771,COMPLETE
336,0.10265283286571503,Leaky,61,224,19,0.0007410318929353792,1,0.4318372756191054,0.02481903085077224,0.6919509172439575,0.10265283286571503,0.6434786319732666,COMPLETE
337,0.1325591802597046,Tanh,79,233,17,0.000596973968323505,1,0.47250937746089455,0.044399066010020666,1.414448857307434,0.1325591802597046,0.3690204620361328,COMPLETE
338,0.07746244966983795,Leaky,72,220,18,0.0007742779228002411,1,0.5235047119044023,0.014587121060804533,0.6411418318748474,0.07746244966983795,0.6797868013381958,COMPLETE
339,0.14426130056381226,Leaky,72,216,17,0.0008992356481558571,1,0.5436952189666758,0.015147147210503245,0.9279279708862305,0.14426130056381226,0.44845515489578247,COMPLETE
340,0.08722833544015884,Leaky,75,201,18,0.0011089534866703373,1,0.5026140881084978,0.020196791843324867,0.8872186541557312,0.08722833544015884,0.620236873626709,COMPLETE
341,0.32171642780303955,Leaky,73,216,5,0.0004808617898406399,1,0.7962900020123161,0.002150463257137435,2.2585113048553467,0.32171642780303955,0.4712693691253662,COMPLETE
342,0.07834102213382721,Leaky,80,238,18,0.0006835943547309889,1,0.5227774867773735,0.013186255416585635,0.6405490040779114,0.07834102213382721,0.6761549711227417,COMPLETE
343,0.19669698178768158,Leaky,75,222,15,0.0006020888686563081,1,0.51833313717877,0.013441567660791397,1.1200889348983765,0.19669698178768158,0.18689680099487305,COMPLETE
344,0.1731913983821869,Leaky,77,207,17,0.0007029316589014487,1,0.592269341736675,0.03440488235756463,1.1480379104614258,0.1731913983821869,0.42506998777389526,COMPLETE
345,0.1046086996793747,Leaky,80,236,18,0.0008343135881630681,1,0.5648673154055839,0.020830927379342674,0.8818687796592712,0.1046086996793747,0.6196264624595642,COMPLETE
346,0.10620223730802536,Leaky,77,222,18,0.0005022010714018558,1,0.5364063326542181,0.017757573420702995,0.75681072473526,0.10620223730802536,0.5796208381652832,COMPLETE
347,0.1576804220676422,Leaky,72,196,17,0.0006554103522885435,1,0.6106851436044991,1.111873223634774e-05,1.0941240787506104,0.1576804220676422,0.5049899220466614,COMPLETE
348,0.15221261978149414,Leaky,83,262,18,0.004322697353921673,1,0.674169387785483,0.025637473975088247,0.6851950287818909,0.15221261978149414,0.6249198913574219,COMPLETE
349,0.1798953264951706,Sigmoid,79,205,16,0.03575539321135388,1,0.5161066673649068,0.014592991879075475,0.9240931272506714,0.1798953264951706,0.2563512325286865,COMPLETE
350,0.11939685791730881,Leaky,75,213,18,0.0019834086907614475,1,0.7019904603710677,0.030514338615666072,0.7718793749809265,0.11939685791730881,0.7317137122154236,COMPLETE
351,0.22396773099899292,Leaky,78,250,18,0.0024519348037074524,1,0.49287886435460687,0.012249938862708547,1.9920523166656494,0.22396773099899292,-0.02197396755218506,COMPLETE
352,0.07212238013744354,Leaky,81,235,17,0.0031095401588602917,1,0.754683236381806,0.05069955862874017,0.8743602633476257,0.07212238013744354,0.8616315722465515,COMPLETE
353,0.27847006916999817,Leaky,84,239,17,0.000581869610104998,1,0.799876825095327,0.04778550024920481,1.8635624647140503,0.27847006916999817,0.5423433780670166,COMPLETE
354,0.07787509262561798,Leaky,17,230,8,0.0022626906602573396,1,0.7478037009041215,0.05945684299334658,0.9784982204437256,0.07787509262561798,0.8505948781967163,COMPLETE
355,0.14114810526371002,Leaky,26,230,10,0.003078055509700554,1,0.7422907600960987,0.055894728629249664,1.036612868309021,0.14114810526371002,0.7139610052108765,COMPLETE
356,0.12672458589076996,Leaky,82,246,12,0.0067807935913976125,1,0.723201015823394,0.06267322686756029,0.7620607614517212,0.12672458589076996,0.7324573993682861,COMPLETE
357,0.08590307831764221,ReLU,56,235,19,0.0026698770298471124,1,0.7462031302406318,0.05467266790044445,0.7437166571617126,0.08590307831764221,0.8351929783821106,COMPLETE
358,0.2643797993659973,Leaky,10,256,8,0.0032120161272820493,1,0.5628760211026268,0.04269335084527871,1.1508227586746216,0.2643797993659973,0.0386737585067749,COMPLETE
359,0.21305225789546967,ReLU,34,224,3,0.0007783008803216555,1,0.7625188158303747,0.0018395174318091487,1.6315138339996338,0.21305225789546967,0.6140018105506897,COMPLETE
360,0.14764365553855896,Leaky,71,244,11,0.00047012612350759837,1,0.6552468965182613,0.06793882759012866,0.6970599293708801,0.14764365553855896,0.5906507968902588,COMPLETE
361,0.10757158696651459,ReLU,74,230,9,0.002343182969630262,1,0.7054083458253101,0.04399028198511621,0.8784440159797668,0.10757158696651459,0.7582852244377136,COMPLETE
362,0.7956855297088623,Leaky,69,273,19,0.001809846076415383,1,0.21573494622845765,0.03853326882788412,3.2185091972351074,0.7956855297088623,-1.0860309600830078,COMPLETE
363,0.28229454159736633,Tanh,81,240,17,0.003993153222820721,1,0.44628546255368634,0.052590998353643885,0.9379437565803528,0.28229454159736633,0.060633718967437744,COMPLETE
364,0.8073405623435974,Leaky,86,226,18,1.0917370652026367e-05,1,0.3720845857214089,0.0004034051654271307,1.4820698499679565,0.8073405623435974,-0.13137829303741455,COMPLETE
365,0.3508561849594116,ReLU,52,262,19,0.0006895433104126121,1,0.3162267581116882,0.0029040716528254337,0.7731142044067383,0.3508561849594116,0.37952423095703125,COMPLETE
366,0.39609482884407043,Leaky,30,251,18,2.3231200576844604e-05,1,0.4763701031730924,0.002456356114328686,1.3780486583709717,0.39609482884407043,-0.8854049444198608,COMPLETE
367,1.4422316551208496,ReLU,76,210,20,0.005613860955121368,1,0.4309611731035365,0.003511286935220249,4.696009635925293,1.4422316551208496,-4.008983612060547,COMPLETE
368,0.10624151676893234,Leaky,78,234,19,0.0009008604826622517,1,0.5378781166898245,0.005028553438067649,0.7255785465240479,0.10624151676893234,0.579465389251709,COMPLETE
369,0.43784064054489136,ReLU,36,221,18,0.0005767102673457921,1,0.3376554482750282,0.06540208502265196,0.7919556498527527,0.43784064054489136,0.271420419216156,COMPLETE
370,0.10487466305494308,Leaky,72,198,17,0.0007583744156032787,1,0.4814110882296783,0.0937216668055623,1.3427808284759521,0.10487466305494308,0.5007983446121216,COMPLETE
371,0.22536468505859375,Sigmoid,83,240,19,0.00043927183958706597,1,0.6821524780003415,0.01638420780127846,0.8212371468544006,0.22536468505859375,0.4446597099304199,COMPLETE
372,0.07843087613582611,Leaky,80,223,14,0.003763931780868921,1,0.7652354868719761,0.07401544995338045,1.172332763671875,0.07843087613582611,0.8579025864601135,COMPLETE
373,0.11553055793046951,ReLU,80,95,14,0.0032037490357960086,1,0.7495424639216974,0.08068327967675748,1.253609299659729,0.11553055793046951,0.7783519625663757,COMPLETE
374,0.09113892167806625,Leaky,77,215,16,0.002698188824860976,1,0.7570417709306125,0.07597897467940133,1.0771855115890503,0.09113892167806625,0.8251478672027588,COMPLETE
375,0.12288925796747208,Leaky,74,206,17,0.004809222739237598,1,0.7230006986039474,0.05820854618172574,0.8480049967765808,0.12288925796747208,0.7405545711517334,COMPLETE
376,0.07523402571678162,ReLU,79,192,13,0.00356216911482992,1,0.7701916977207434,0.04069444337247971,0.6907330751419067,0.07523402571678162,0.8636944890022278,COMPLETE
377,0.07267225533723831,ReLU,78,283,14,0.003353039812860589,1,0.7691246864971197,0.06687002953065277,1.1214326620101929,0.07267225533723831,0.8683357834815979,COMPLETE
378,0.12759177386760712,ReLU,23,186,14,0.003544363386313697,1,0.7786947767514381,0.07022627150515587,1.9848815202713013,0.12759177386760712,0.776875376701355,COMPLETE
379,0.070382259786129,ReLU,75,221,14,0.0032517454881379622,1,0.789153285359567,0.04783533293090325,1.2039047479629517,0.070382259786129,0.8843290209770203,COMPLETE
380,0.07204684615135193,ReLU,75,221,14,0.0032319132505857517,1,0.7872388242781768,0.04930812567247221,1.2441781759262085,0.07204684615135193,0.8815933465957642,COMPLETE
381,0.07895790785551071,ReLU,73,195,13,0.0036541569253850663,1,0.7726558312163776,0.039441837247580436,0.8109804391860962,0.07895790785551071,0.861923336982727,COMPLETE
382,0.09174028784036636,ReLU,18,191,13,0.0038038629403673047,1,0.7816929122616751,0.039923011557964065,0.6988190412521362,0.09174028784036636,0.8395702838897705,COMPLETE
