number,value,params_activation_1,params_batch_size,params_epochs,params_layer_1,params_learning_rate,params_num_layers,params_train_size,params_weight_decay,user_attrs_mape,user_attrs_mse,user_attrs_r2,state
387,0.6202248930931091,ReLU,72,62,23,0.00465549580166992,1,0.6858023196718984,0.00044065233221291894,1.4835506677627563,0.6202248930931091,0.36047762632369995,COMPLETE
388,0.835087239742279,ReLU,70,120,20,0.005146013657102506,1,0.16552270910889405,0.0001065800654485865,1.8773072957992554,0.835087239742279,0.1450243592262268,COMPLETE
389,0.6195114850997925,ReLU,65,258,22,0.0021048746279682955,1,0.6188731520767285,0.00024296744286505205,1.5265769958496094,0.6195114850997925,0.42798542976379395,COMPLETE
390,0.6289583444595337,ReLU,67,247,21,0.006524623353033099,1,0.28083165007702254,0.0015177655452128624,2.046950101852417,0.6289583444595337,0.35578209161758423,COMPLETE
391,0.6010761857032776,ReLU,56,285,17,0.00422002177493743,1,0.6642926050352168,0.000744583991125834,1.4663937091827393,0.6010761857032776,0.3768486976623535,COMPLETE
392,0.7085615992546082,Tanh,64,234,22,0.0008486425344320976,1,0.7500704791816031,6.145089487396839e-05,1.2662698030471802,0.7085615992546082,0.3001847267150879,COMPLETE
393,0.7583647966384888,ReLU,58,252,21,0.02440714779511198,1,0.5870648463651656,0.03087455861127042,1.3376693725585938,0.7583647966384888,0.2864300608634949,COMPLETE
394,0.64227294921875,ReLU,66,264,19,0.003134489533049192,1,0.2995683886727039,0.0020017782219743843,2.330592393875122,0.64227294921875,0.35206079483032227,COMPLETE
395,0.7334330677986145,ReLU,69,301,20,0.005249111128809543,1,0.2697386344695161,0.0013004604659287878,2.4871714115142822,0.7334330677986145,0.280272901058197,COMPLETE
396,0.796743631362915,ReLU,73,224,16,0.006669635398408663,1,0.21774496573421268,0.000925732123817604,12.588533401489258,0.796743631362915,0.20221054553985596,COMPLETE
397,0.7102217078208923,ReLU,62,241,20,0.0011850332202325994,1,0.24249862099017605,0.0003039034058379046,6.009535789489746,0.7102217078208923,0.29266613721847534,COMPLETE
398,0.65573650598526,ReLU,64,218,21,0.00037617828722702305,1,0.7108388117145631,0.000524435487082982,1.1969552040100098,0.65573650598526,0.32594531774520874,COMPLETE
399,0.5999658107757568,ReLU,54,259,23,0.002436950257406826,1,0.6527811432819409,0.0006515616259636045,1.4013563394546509,0.5999658107757568,0.38949787616729736,COMPLETE
400,0.6444578766822815,ReLU,59,232,22,0.009164001640903334,1,0.495248402451501,0.0004189648191534726,1.713573932647705,0.6444578766822815,0.3823133707046509,COMPLETE
401,0.7595065236091614,ReLU,68,271,14,0.09755286280014455,1,0.40673238529161004,0.00019769238851663829,2.5083978176116943,0.7595065236091614,0.2680498957633972,COMPLETE
402,0.5763240456581116,ReLU,66,247,21,0.004050969156091249,1,0.6869371656107844,0.0003592889627174858,1.3921955823898315,0.5763240456581116,0.40714091062545776,COMPLETE
403,0.6344135999679565,ReLU,62,254,22,0.0036471082709782702,1,0.3491262658354385,0.00034713432370415465,14.146489143371582,0.6344135999679565,0.38070911169052124,COMPLETE
404,0.5940017700195312,ReLU,65,246,21,0.0042774133444393216,1,0.695064057698276,0.0002625763023044954,1.4177136421203613,0.5940017700195312,0.39426708221435547,COMPLETE
405,0.5968639254570007,ReLU,60,265,22,0.0019157341725133791,1,0.7313986722575354,0.0012022971389844266,1.4539299011230469,0.5968639254570007,0.3679785132408142,COMPLETE
406,0.7757056951522827,ReLU,63,279,21,8.120060574376211e-05,1,0.6216005660538492,0.0025978464532311215,1.14814031124115,0.7757056951522827,0.2571887969970703,COMPLETE
407,0.8123837113380432,Sigmoid,71,250,20,0.0031526584913595503,1,0.7939413587210943,0.0008438553453937461,1.306127667427063,0.8123837113380432,0.24852383136749268,COMPLETE
408,0.6511414051055908,ReLU,67,209,21,0.00488298156927398,1,0.3728343681516335,0.00032459222419816005,2.6249892711639404,0.6511414051055908,0.3645123243331909,COMPLETE
409,0.6370719075202942,ReLU,61,235,20,0.004172503666772735,1,0.6916924983918541,0.001716362809854589,1.4963442087173462,0.6370719075202942,0.3430251479148865,COMPLETE
410,0.6405434012413025,ReLU,58,260,22,0.005504683743418018,1,0.4136166017295375,0.001047067765808101,1.6676186323165894,0.6405434012413025,0.38008975982666016,COMPLETE
411,0.5990884304046631,ReLU,64,270,23,0.0037636391793448055,1,0.648465921401931,0.00023269915161585852,1.4022198915481567,0.5990884304046631,0.3903217315673828,COMPLETE
412,0.7934848666191101,ReLU,68,243,21,4.11607504496677e-05,1,0.565756928123203,0.00038310665944110597,1.2019542455673218,0.7934848666191101,0.24461090564727783,COMPLETE
413,0.6500920653343201,ReLU,66,227,22,0.005687089386475258,1,0.5351299787892694,0.0007487101938998705,2.0340309143066406,0.6500920653343201,0.36381471157073975,COMPLETE
414,0.6734597086906433,ReLU,56,253,20,0.002958206834293809,1,0.3579996861419727,0.0005599868941343949,11.37703800201416,0.6734597086906433,0.35687708854675293,COMPLETE
415,0.574370265007019,ReLU,60,216,21,0.004783617430904207,1,0.6731110494150347,0.0009269736209856508,1.302655816078186,0.574370265007019,0.4138869643211365,COMPLETE
416,0.5988435745239258,Tanh,59,286,21,0.0023406974967105634,1,0.7180685868545903,0.0009759392307334418,1.3349288702011108,0.5988435745239258,0.3924965262413025,COMPLETE
417,0.7082656621932983,ReLU,52,204,22,0.004589480286734376,1,0.7697223160809821,0.020854390334418233,1.3771392107009888,0.7082656621932983,0.33440101146698,COMPLETE
418,0.6194421648979187,ReLU,70,218,21,0.0007240893434136821,1,0.6796718847936429,0.0013169769586893853,1.1990711688995361,0.6194421648979187,0.36441266536712646,COMPLETE
419,0.6354350447654724,ReLU,64,191,21,0.003624538802828847,1,0.39162927386463,0.0002887406034211247,2.597029209136963,0.6354350447654724,0.38231974840164185,COMPLETE
420,0.6127792000770569,ReLU,75,280,23,0.01140416042610968,1,0.7406291449275235,0.001159993291441728,1.4147764444351196,0.6127792000770569,0.3743654489517212,COMPLETE
421,0.8980369567871094,ReLU,62,294,22,0.004821041596330645,1,0.12134339223865168,0.0008526977792911959,2.6613473892211914,0.8980369567871094,-0.022908329963684082,COMPLETE
422,0.6127718687057495,ReLU,58,272,22,0.0005921097168939936,1,0.6736863938798974,0.00022594594554486638,1.3286985158920288,0.6127718687057495,0.3760194182395935,COMPLETE
423,0.6218461394309998,ReLU,60,217,20,0.007022169476566458,1,0.7057355218877713,0.001638133253374546,1.4596437215805054,0.6218461394309998,0.363200843334198,COMPLETE
424,0.7353934645652771,ReLU,66,231,21,0.009667082064779646,1,0.1927732264534218,0.000358331312145388,2.50596022605896,0.7353934645652771,0.24125486612319946,COMPLETE
425,0.6818961501121521,Leaky,69,261,22,0.036386264751385435,1,0.4551479587434575,0.0004798080606485521,2.008288621902466,0.6818961501121521,0.35099780559539795,COMPLETE
426,0.6508988738059998,ReLU,56,214,18,0.00390608929468603,1,0.607365442717472,0.0010258156302155057,1.5551676750183105,0.6508988738059998,0.39986371994018555,COMPLETE
427,0.6095461845397949,ReLU,72,287,20,0.048326772997135156,1,0.6668527068824143,0.00028117519113017065,1.227146029472351,0.6095461845397949,0.3727753162384033,COMPLETE
428,0.6328101754188538,ReLU,62,238,7,0.0028219843783088353,1,0.6417522663580217,0.0001898546806399608,1.5168684720993042,0.6328101754188538,0.3607938885688782,COMPLETE
429,0.5770549774169922,ReLU,65,275,21,0.005312354163604136,1,0.6975553747962278,0.0007812976166620821,1.4153549671173096,0.5770549774169922,0.4007842540740967,COMPLETE
430,0.6518482565879822,ReLU,67,226,21,0.006391233121350224,1,0.5177848039157716,0.0004211711585054847,1.6748111248016357,0.6518482565879822,0.37657469511032104,COMPLETE
431,0.6992713212966919,ReLU,61,200,23,0.007914023319844749,1,0.20650127563016096,0.0005801515756440492,18.731719970703125,0.6992713212966919,0.28172487020492554,COMPLETE
432,0.7052146792411804,ReLU,63,264,22,0.00019773780844347332,1,0.6261364471081036,0.0008826637897283474,1.2446867227554321,0.7052146792411804,0.3208388686180115,COMPLETE
433,0.65274977684021,ReLU,59,248,20,0.004498477006727735,1,0.5949234380017747,3.23283268979682e-05,1.8023501634597778,0.65274977684021,0.38599932193756104,COMPLETE
434,0.7160429358482361,Sigmoid,57,238,21,0.003471087374330513,1,0.7550619762325899,0.001324168423767164,1.2202805280685425,0.7160429358482361,0.3006353974342346,COMPLETE
435,0.7927936315536499,ReLU,69,210,22,0.005890499565720712,1,0.17633089993646134,0.000336964799653977,2.3190231323242188,0.7927936315536499,0.2030143141746521,COMPLETE
436,0.5991063117980957,ReLU,64,256,20,0.02736035201484187,1,0.6770225203769931,0.0006630058257004823,1.3976320028305054,0.5991063117980957,0.3888481855392456,COMPLETE
437,0.6062866449356079,ReLU,54,224,21,0.008999610305940271,1,0.3086408315072244,0.002028194064112311,2.223776340484619,0.6062866449356079,0.3915862441062927,COMPLETE
438,0.6493380665779114,ReLU,60,267,19,0.0015715360589891006,1,0.7188403825895798,0.00026853228298490557,1.4133776426315308,0.6493380665779114,0.34166955947875977,COMPLETE
439,0.6245191097259521,ReLU,67,244,22,0.005124184221324911,1,0.42147944491883965,0.0010728506829900345,1.5594782829284668,0.6245191097259521,0.39929068088531494,COMPLETE
440,0.6295823454856873,ReLU,17,281,12,0.007026047510102286,1,0.6603445350091658,0.0004837360877653623,1.4009828567504883,0.6295823454856873,0.34155529737472534,COMPLETE
441,0.6666691303253174,Tanh,65,232,21,0.004519119974457933,1,0.48003981370890786,0.0004032478133474984,1.7055504322052002,0.6666691303253174,0.37355470657348633,COMPLETE
442,0.7171078324317932,ReLU,63,254,21,0.011212887086442105,1,0.6325422032715818,0.046312840654014635,1.1778219938278198,0.7171078324317932,0.3091866970062256,COMPLETE
443,0.622703492641449,ReLU,70,272,20,0.006328298071292206,1,0.6958764862347755,0.0007538730493508711,1.5319324731826782,0.622703492641449,0.36428260803222656,COMPLETE
444,0.5968277454376221,ReLU,61,246,22,0.0032033812754569966,1,0.6485671540796225,0.0003146525635448573,1.3314251899719238,0.5968277454376221,0.39262235164642334,COMPLETE
445,0.6337274312973022,ReLU,27,262,21,0.004039327902075633,1,0.6070066663171325,0.0014803100505375465,1.5837322473526,0.6337274312973022,0.41569602489471436,COMPLETE
446,0.7340725064277649,ReLU,58,219,23,0.06899618209107136,1,0.7453002157944786,0.00020284475568690624,1.6851298809051514,0.7340725064277649,0.26071542501449585,COMPLETE
447,0.6562841534614563,ReLU,68,236,22,0.001271724195628369,1,0.3350566163914127,0.0006075172924024428,3.8675825595855713,0.6562841534614563,0.37045419216156006,COMPLETE
448,0.6233847141265869,ReLU,73,255,21,0.0023094027151176334,1,0.2907006344305404,0.0009306014077508411,2.7861456871032715,0.6233847141265869,0.3673238158226013,COMPLETE
449,0.6496844291687012,Leaky,65,288,21,0.0073737421781311365,1,0.5736969485376741,0.00023751511236799917,1.975783109664917,0.6496844291687012,0.3967457413673401,COMPLETE
450,0.6120489835739136,ReLU,63,225,20,0.005423096691918411,1,0.6749731361590713,0.001157271060658661,1.4053336381912231,0.6120489835739136,0.37916994094848633,COMPLETE
451,0.6252503395080566,ReLU,60,275,22,0.008941543723679168,1,0.721425641736415,0.00039195998674207097,1.424143671989441,0.6252503395080566,0.35661429166793823,COMPLETE
452,0.6047958135604858,ReLU,66,266,22,0.00489325743095417,1,0.6292419822462312,0.00015993525124896585,1.6397068500518799,0.6047958135604858,0.41929399967193604,COMPLETE
453,0.633755624294281,ReLU,62,210,20,0.0009755986869036818,1,0.6593963684044846,0.0005049055164920372,1.1970887184143066,0.633755624294281,0.35673701763153076,COMPLETE
454,0.7086247801780701,ReLU,56,246,21,0.00011462293068078114,1,0.697809337415728,0.0008395258390399232,1.1814568042755127,0.7086247801780701,0.26416176557540894,COMPLETE
455,0.7309415936470032,ReLU,71,237,23,0.00022848238159049224,1,0.4459826383941812,0.0006685939371056783,1.2250003814697266,0.7309415936470032,0.317585825920105,COMPLETE
456,0.6289993524551392,ReLU,68,257,21,0.00573891535555691,1,0.2715449623006971,0.0004466588075202788,1.770261287689209,0.6289993524551392,0.37074601650238037,COMPLETE
457,0.7037845849990845,Sigmoid,64,232,22,0.004147864239845018,1,0.6076600527859582,0.0003302339978464491,1.310049057006836,0.7037845849990845,0.35286498069763184,COMPLETE
458,0.6945137977600098,ReLU,59,299,20,0.00791673224005612,1,0.25199491435150606,0.0009613302431740979,5.42414665222168,0.6945137977600098,0.32831382751464844,COMPLETE
459,0.6339291334152222,ReLU,62,250,21,0.0004502158835997965,1,0.6782460707608537,0.0002764327334839653,1.1537871360778809,0.6339291334152222,0.35356080532073975,COMPLETE
460,0.6485739946365356,ReLU,66,276,22,0.00651105215138387,1,0.3167738885752079,0.0005719803981354345,2.8372137546539307,0.6485739946365356,0.3620893955230713,COMPLETE
461,0.5651209354400635,ReLU,58,221,21,0.0027629265159954046,1,0.6459494056640086,0.00074068980678379,1.2665700912475586,0.5651209354400635,0.41992294788360596,COMPLETE
462,0.884855329990387,ReLU,54,213,21,1.6080247279569744e-05,1,0.5811060652662118,0.0007577093719009847,1.1227525472640991,0.884855329990387,0.19567006826400757,COMPLETE
463,0.6709755659103394,ReLU,57,193,22,0.003145238714124915,1,0.6317301130346767,0.027195951976943095,1.2327580451965332,0.6709755659103394,0.3576710820198059,COMPLETE
464,0.5917569994926453,ReLU,59,204,21,0.0026164455959373605,1,0.6425620792256527,0.0011643208449543154,1.739848256111145,0.5917569994926453,0.39085763692855835,COMPLETE
465,0.66251140832901,Tanh,55,220,20,0.010152337485204898,1,0.3204971237926193,0.0007393723561978019,1.874222993850708,0.66251140832901,0.35267001390457153,COMPLETE
466,0.6642568111419678,ReLU,57,226,22,0.013941281097784362,1,0.6066015978431814,0.011878966089212217,1.612781286239624,0.6642568111419678,0.38645267486572266,COMPLETE
467,0.5978044867515564,ReLU,60,218,23,0.0019305256854248538,1,0.6542379467186811,0.0033112626956962737,1.3283389806747437,0.5978044867515564,0.39624476432800293,COMPLETE
468,0.6553841233253479,ReLU,58,199,21,0.0075345222263927016,1,0.35556097019934496,6.955431238585306e-05,6.305528163909912,0.6553841233253479,0.369670569896698,COMPLETE
469,0.6792576909065247,ReLU,79,227,20,0.002009385280194801,1,0.5349446275629476,0.000957940281787597,1.4837692975997925,0.6792576909065247,0.33527302742004395,COMPLETE
470,0.6350554823875427,ReLU,61,285,22,0.0026848851850433805,1,0.5013950504832941,0.0006418865659459194,1.4710298776626587,0.6350554823875427,0.3794112205505371,COMPLETE
471,0.7475646138191223,ReLU,61,181,19,0.0033505280512523446,1,0.21401082748021638,0.0008023655946439023,488.5946350097656,0.7475646138191223,0.2459128499031067,COMPLETE
472,0.5861114859580994,ReLU,59,208,18,0.031088530307022213,1,0.7226225215682586,0.002728969665268611,1.3060318231582642,0.5861114859580994,0.37647610902786255,COMPLETE
473,0.6440294981002808,Leaky,63,267,21,0.006012615211019032,1,0.7716047089310625,0.0015096809389599434,1.484876275062561,0.6440294981002808,0.39079004526138306,COMPLETE
474,0.667636513710022,ReLU,56,238,21,0.005011765897372081,1,0.33622636153759217,0.0017851921470173266,3.923818588256836,0.667636513710022,0.36216145753860474,COMPLETE
475,0.7355911731719971,ReLU,63,229,23,0.008957367465824458,1,0.22732103359267747,0.0011763075696954763,25.417678833007812,0.7355911731719971,0.2599087357521057,COMPLETE
476,0.6290492415428162,ReLU,58,262,20,0.011354600215414137,1,0.6267055265836928,9.928164592118294e-05,1.9142242670059204,0.6290492415428162,0.39513546228408813,COMPLETE
477,0.5962866544723511,ReLU,60,214,22,0.0015481224852755928,1,0.6644530562178067,0.002193899438800929,1.3312084674835205,0.5962866544723511,0.3818141222000122,COMPLETE
478,0.7052920460700989,ReLU,61,280,21,0.0068129855199755025,1,0.19330769334267564,0.0005464383594185792,4.039135932922363,0.7052920460700989,0.26885122060775757,COMPLETE
479,0.6370058655738831,ReLU,64,240,22,0.0037950312711172757,1,0.3620464358386449,0.000949720227715775,3.9460747241973877,0.6370058655738831,0.38371115922927856,COMPLETE
480,0.5988322496414185,ReLU,53,269,21,0.016546417053272002,1,0.7045918701991561,0.0006724192829779085,1.371120572090149,0.5988322496414185,0.3878018260002136,COMPLETE
481,0.7981753349304199,Sigmoid,68,221,20,0.00029206794367129645,1,0.545658078442988,0.0008611202628662642,1.4088460206985474,0.7981753349304199,0.2251541018486023,COMPLETE
482,0.6447346806526184,ReLU,70,251,21,0.004953072512990358,1,0.5859695925867721,0.00018564301340686333,1.5987412929534912,0.6447346806526184,0.40387725830078125,COMPLETE
483,0.6091434955596924,ReLU,74,231,22,0.0022969881860548324,1,0.6524050752901308,0.0143290906900118,1.2700666189193726,0.6091434955596924,0.38015902042388916,COMPLETE
484,0.6935851573944092,ReLU,57,259,4,0.005950826132026494,1,0.6140299555837813,0.0004907366789843528,1.4368301630020142,0.6935851573944092,0.36449551582336426,COMPLETE
485,0.6130295991897583,ReLU,62,242,21,0.0009109961683789361,1,0.6848317387081969,0.0013248870987196426,1.3280110359191895,0.6130295991897583,0.3664630055427551,COMPLETE
486,0.5921834707260132,ReLU,65,309,22,0.007762829725550808,1,0.7379713067828779,0.0010417284707889807,1.3074641227722168,0.5921834707260132,0.38917362689971924,COMPLETE
487,0.7616662383079529,ReLU,59,290,1,0.0045844215813920725,1,0.2669296866670972,0.0006848156148126518,1.4015552997589111,0.7616662383079529,0.25197529792785645,COMPLETE
488,0.6614178419113159,ReLU,63,273,21,0.009118013628869305,1,0.3759902600740123,0.00023417013941565918,2.3662216663360596,0.6614178419113159,0.3552194833755493,COMPLETE
489,0.6573336124420166,Tanh,72,223,19,0.003367082783406244,1,0.4244471229870112,0.0005804183689834347,1.3386279344558716,0.6573336124420166,0.36870741844177246,COMPLETE
490,0.5956523418426514,ReLU,67,261,20,0.006277353391984949,1,0.6464582730453284,3.09678490999517e-05,1.3601428270339966,0.5956523418426514,0.3891676068305969,COMPLETE
491,0.7041690945625305,ReLU,61,234,22,0.00010881978559129003,1,0.6727861942572922,0.0004115638007131962,1.1789575815200806,0.7041690945625305,0.28143441677093506,COMPLETE
492,0.6360503435134888,ReLU,64,250,21,0.005329541165751663,1,0.5713541480906162,0.0007966100060219639,1.8207935094833374,0.6360503435134888,0.4044255018234253,COMPLETE
493,0.6443248391151428,ReLU,55,242,23,0.004034113866990704,1,0.3967008085199569,0.0012174328570648586,2.074047565460205,0.6443248391151428,0.3736756443977356,COMPLETE
494,0.5986872315406799,ReLU,69,208,24,0.012216629104394574,1,0.7043389521078577,0.0004765321772771413,1.5842061042785645,0.5986872315406799,0.38795006275177,COMPLETE
495,0.7815825343132019,ReLU,59,266,3,0.0027281249388817624,1,0.789281533403498,0.02088247344149492,1.3346425294876099,0.7815825343132019,0.2734009623527527,COMPLETE
496,0.6213979125022888,ReLU,65,280,21,0.007297767217663108,1,0.6158063183927615,0.0009068315346835595,1.6053621768951416,0.6213979125022888,0.43231260776519775,COMPLETE
497,0.7844155430793762,ReLU,62,255,20,0.005358224028100831,1,0.23008907810426377,0.0002899689437460216,5.215086460113525,0.7844155430793762,0.2109723687171936,COMPLETE
498,0.5907188057899475,Leaky,77,231,22,0.00956626813580561,1,0.6429646479014351,0.001494935047159949,1.7137120962142944,0.5907188057899475,0.3919263482093811,COMPLETE
499,0.7010200023651123,ReLU,67,217,21,0.08569129202858777,1,0.28793553332149036,1.3309242353283188e-05,24.30168914794922,0.7010200023651123,0.28634577989578247,COMPLETE
500,0.7280278205871582,ReLU,60,297,22,5.426044443860771e-05,1,0.6784477988448206,0.0005825711778400602,1.2273766994476318,0.7280278205871582,0.2576051950454712,COMPLETE
501,0.7668562531471252,ReLU,57,244,21,0.00013067010295034404,1,0.5968713794367573,0.0003652057818740926,1.2078136205673218,0.7668562531471252,0.2829973101615906,COMPLETE
502,0.8275624513626099,ReLU,70,270,16,0.006568768587518954,1,0.13544683009666617,0.0010530892873100222,2.1004889011383057,0.8275624513626099,0.0999823808670044,COMPLETE
503,0.6345555782318115,ReLU,63,254,23,0.001788125641146409,1,0.7366500382592621,0.016409920751170114,1.3014086484909058,0.6345555782318115,0.3421235680580139,COMPLETE
504,0.8018127083778381,ReLU,65,222,20,0.004449266489400647,1,0.18077642160230492,0.004108345511856801,1.9410579204559326,0.8018127083778381,0.1863582730293274,COMPLETE
505,0.8051696419715881,Sigmoid,61,238,21,0.003507586869496458,1,0.6350595167214552,0.07504491168959483,1.1115930080413818,0.8051696419715881,0.2096002697944641,COMPLETE
506,0.6036236882209778,ReLU,51,278,22,0.008306693067381203,1,0.7080593402123214,4.187505324174498e-05,1.4085875749588013,0.6036236882209778,0.37849754095077515,COMPLETE
507,0.7010872960090637,ReLU,58,204,20,0.005767390840619216,1,0.4796376032620831,0.0007370685697621432,1.7393537759780884,0.7010872960090637,0.3398098945617676,COMPLETE
508,0.6165908575057983,ReLU,68,263,21,0.007306882522836209,1,0.31509021086549893,0.00024056365239250507,2.1343095302581787,0.6165908575057983,0.38997238874435425,COMPLETE
509,0.5740697979927063,ReLU,65,230,23,0.004707220625776714,1,0.6637984870385119,8.147453132408626e-05,1.350134253501892,0.5740697979927063,0.4051029682159424,COMPLETE
510,0.6758595705032349,ReLU,62,227,24,0.00018138428072706213,1,0.6673023692674019,8.653693299684089e-05,1.1713919639587402,0.6758595705032349,0.30453866720199585,COMPLETE
511,0.607318639755249,ReLU,64,212,23,0.004874730842925892,1,0.6893980404250928,3.034433662307815e-05,1.5142202377319336,0.607318639755249,0.3823552131652832,COMPLETE
512,0.7421940565109253,ReLU,60,232,22,0.010988208021578646,1,0.251368983469563,8.226687246697326e-05,4.303062915802002,0.7421940565109253,0.2797045111656189,COMPLETE
513,0.6762149930000305,ReLU,33,220,23,0.0005952624871362636,1,0.3323959835912846,3.497561979373207e-05,2.695082187652588,0.6762149930000305,0.34773963689804077,COMPLETE
514,1.0936800241470337,Tanh,66,238,22,1.2616089420188237e-05,1,0.1709859405524071,0.00017136282818283515,1.43729829788208,1.0936800241470337,-0.1022038459777832,COMPLETE
515,0.640084445476532,ReLU,56,230,24,0.006307974708287378,1,0.7667231929384825,0.00015856814066294358,1.328031301498413,0.640084445476532,0.3908306956291199,COMPLETE
