number,value,params_activation_1,params_batch_size,params_epochs,params_layer_1,params_learning_rate,params_num_layers,params_train_size,params_weight_decay,user_attrs_mape,user_attrs_mse,user_attrs_r2,state
128,0.2852262854576111,Tanh,79,226,17,0.002891948743928757,1,0.5897864582016964,0.00486887233021005,1.4117790460586548,0.2852262854576111,0.6249625086784363,COMPLETE
129,0.3049747347831726,ReLU,83,189,20,0.002290263748746928,1,0.6946734523970642,0.0037223837642340624,1.638387680053711,0.3049747347831726,0.6533663868904114,COMPLETE
130,0.2943240702152252,ReLU,87,179,18,0.0054936904802338924,1,0.6588687753390128,0.00655257041802301,1.6446129083633423,0.2943240702152252,0.6365644931793213,COMPLETE
131,0.23181624710559845,ReLU,78,235,20,0.0019203100810774706,1,0.5685656350152501,0.0032313839016170354,1.9991700649261475,0.23181624710559845,0.6704369783401489,COMPLETE
132,0.2659081518650055,ReLU,81,235,20,0.001965784939788807,1,0.5418224756878562,0.004139933321536097,2.736954689025879,0.2659081518650055,0.6902300119400024,COMPLETE
133,0.2634996473789215,ReLU,76,215,19,0.00233242033262431,1,0.5862865745345159,0.0030870431097424437,1.3071951866149902,0.2634996473789215,0.6535303592681885,COMPLETE
134,0.2852171063423157,ReLU,78,247,21,0.0030765341256545975,1,0.5342068577633843,0.005092395813091988,2.3597214221954346,0.2852171063423157,0.6677360534667969,COMPLETE
135,0.2985619008541107,ReLU,92,205,19,0.004000414265083102,1,0.6304419130355422,0.0025828577985130365,1.7607345581054688,0.2985619008541107,0.6004744172096252,COMPLETE
136,0.23677009344100952,ReLU,89,220,17,0.0015699753491127187,1,0.5597007445628335,0.003929765457951236,1.3776668310165405,0.23677009344100952,0.6633943319320679,COMPLETE
137,0.2544785141944885,ReLU,85,234,18,0.001769198121942313,1,0.6078741751438956,0.005726888338643184,1.1379926204681396,0.2544785141944885,0.682453989982605,COMPLETE
138,0.3061681091785431,ReLU,83,197,21,0.0026152644739846926,1,0.6449748115298044,0.0022169683862701996,1.4392842054367065,0.3061681091785431,0.6106581687927246,COMPLETE
139,0.3644968271255493,Sigmoid,79,184,20,0.0021065486933563686,1,0.579634358416155,0.003030659932941121,1.1144654750823975,0.3644968271255493,0.5108081102371216,COMPLETE
140,0.2997083365917206,ReLU,75,172,21,0.001470006078760481,1,0.5329112520809434,0.004449838696004793,2.3273112773895264,0.2997083365917206,0.6508544683456421,COMPLETE
141,0.23685286939144135,ReLU,97,219,17,0.0015075214399426964,1,0.5640916046674928,0.00360715456612442,1.3741767406463623,0.23685286939144135,0.6632766723632812,COMPLETE
142,0.28601476550102234,ReLU,89,223,16,0.0033925279985946846,1,0.5953128948042743,0.004174314850595693,1.229103922843933,0.28601476550102234,0.6239258050918579,COMPLETE
143,0.26845917105674744,ReLU,81,207,19,0.0018312601477625612,1,0.5568108586067442,0.002689261877124909,1.8841516971588135,0.26845917105674744,0.5957763195037842,COMPLETE
144,0.24895155429840088,ReLU,88,255,18,0.002412501684916389,1,0.5501778827206231,0.00681320895768508,1.7701462507247925,0.24895155429840088,0.6251493096351624,COMPLETE
145,0.26248955726623535,ReLU,78,241,22,0.002764996916296601,1,0.6174927016646571,0.005423643038023585,1.615138292312622,0.26248955726623535,0.6606000661849976,COMPLETE
146,0.2186151146888733,ReLU,85,229,20,0.0013718056965997157,1,0.4754141669810407,0.003257351967900758,11.182672500610352,0.2186151146888733,0.6960585713386536,COMPLETE
147,0.21164613962173462,ReLU,85,233,20,0.0019883528960128213,1,0.47571460274757604,0.003245353573724272,10.697389602661133,0.21164613962173462,0.7057475447654724,COMPLETE
148,0.3829018771648407,Tanh,85,250,20,0.00097993871058079,1,0.5294134393550939,0.00318679402414059,2.056563377380371,0.3829018771648407,0.553938090801239,COMPLETE
149,0.2183116227388382,ReLU,83,261,20,0.001342241286208151,1,0.47389018230842866,0.0023370801349581615,10.981217384338379,0.2183116227388382,0.6964805126190186,COMPLETE
150,0.39534080028533936,ReLU,83,262,21,0.004022692320673925,1,0.4694851746420511,0.0020727675263006117,4.550724506378174,0.39534080028533936,0.4191548824310303,COMPLETE
151,0.21784380078315735,ReLU,86,237,20,0.001464656405063561,1,0.4800813799826082,0.0026535834228295146,10.943751335144043,0.21784380078315735,0.6971309185028076,COMPLETE
152,0.27545902132987976,ReLU,86,201,22,0.0014107449885167199,1,0.47486202591437193,0.002578421217629287,13.065841674804688,0.27545902132987976,0.6170282363891602,COMPLETE
153,0.4217894375324249,ReLU,83,213,21,0.002202757272934783,1,0.4115050446573484,0.00208405783419032,1.6715420484542847,0.4217894375324249,0.535246729850769,COMPLETE
154,0.2437838464975357,ReLU,91,243,20,0.0009888871558440015,1,0.4908262365058735,0.002525121651930205,2.9753825664520264,0.2437838464975357,0.6704051494598389,COMPLETE
155,0.33003854751586914,ReLU,87,229,23,0.001363545146075321,1,0.46704763993385606,0.0034070619329031005,5.0660014152526855,0.33003854751586914,0.5150986313819885,COMPLETE
156,0.262959361076355,ReLU,80,191,22,0.0015994476991992343,1,0.4886416646791434,0.001988161746777923,3.222334861755371,0.262959361076355,0.6444798707962036,COMPLETE
157,0.3470371961593628,ReLU,85,209,19,0.0032912185784111925,1,0.4390802928742084,0.00471108423092564,3.17018461227417,0.3470371961593628,0.5503215789794922,COMPLETE
158,0.29742008447647095,ReLU,76,260,21,0.0012757816819048918,1,0.5325020628103111,0.002699095224919018,2.265350580215454,0.29742008447647095,0.6535202264785767,COMPLETE
159,0.33187413215637207,ReLU,82,251,20,0.0026388681856047867,1,0.4112604267203865,0.005894493336101721,1.2800078392028809,0.33187413215637207,0.634320855140686,COMPLETE
160,0.2744601368904114,ReLU,73,220,23,0.002201080537630084,1,0.6039145826706211,0.0035404614935474784,1.2265256643295288,0.2744601368904114,0.6575204133987427,COMPLETE
161,0.23625639081001282,ReLU,78,236,20,0.0017432268253907222,1,0.5605169678154809,0.003094562051582449,2.023232936859131,0.23625639081001282,0.664124608039856,COMPLETE
162,0.2887885272502899,ReLU,80,231,19,0.001917109187801159,1,0.5304501303122833,0.0023209492554257523,2.4180872440338135,0.2887885272502899,0.6635755300521851,COMPLETE
163,0.30258870124816895,ReLU,84,240,21,0.0010707596193049805,1,0.45744736986020273,0.0032673524312928784,5.092981338500977,0.30258870124816895,0.5554286241531372,COMPLETE
164,0.24070440232753754,ReLU,75,200,18,0.0013417735044799458,1,0.49820754275240786,0.005006865830924339,2.851647138595581,0.24070440232753754,0.6745685338973999,COMPLETE
165,0.27106553316116333,ReLU,77,224,20,0.002839963831247325,1,0.6402442312348551,0.0038816826562393853,1.3998997211456299,0.27106553316116333,0.637269139289856,COMPLETE
166,0.23646411299705505,ReLU,82,213,22,0.001980569625064404,1,0.5867155336160813,0.002997902661053819,1.2379082441329956,0.23646411299705505,0.6890788078308105,COMPLETE
167,0.4095584452152252,Sigmoid,87,157,19,0.0034613217988952055,1,0.6685334340263024,0.0019240616539183523,1.4947314262390137,0.4095584452152252,0.49427151679992676,COMPLETE
168,0.2646893858909607,ReLU,79,249,20,0.0055536428611077686,1,0.5482591461473451,0.004426648009997747,1.8537566661834717,0.2646893858909607,0.6014525890350342,COMPLETE
169,0.29037365317344666,ReLU,90,235,21,0.0023380126168126097,1,0.6087758094930781,0.002536054264727293,1.435699224472046,0.29037365317344666,0.6376630067825317,COMPLETE
170,0.2709302008152008,ReLU,84,263,22,0.001511153449321684,1,0.520951904565151,0.006544369744246616,3.1750097274780273,0.2709302008152008,0.6718385815620422,COMPLETE
171,0.23800478875637054,ReLU,80,230,19,0.0018157222894687613,1,0.5662723827768222,0.003917423200097479,1.6386500597000122,0.23800478875637054,0.6616389751434326,COMPLETE
172,0.22853320837020874,ReLU,81,218,18,0.0017364401556148427,1,0.5755466676285539,0.005042751415889885,1.052227258682251,0.22853320837020874,0.6932851076126099,COMPLETE
173,0.24912407994270325,ReLU,82,214,18,0.0011542528859279468,1,0.593586805408241,0.0049473019817564525,1.0424598455429077,0.24912407994270325,0.6724324822425842,COMPLETE
174,0.27833250164985657,ReLU,86,194,23,0.0009309693395268628,1,0.575942616348028,0.00352580486024163,1.068448543548584,0.27833250164985657,0.626449465751648,COMPLETE
175,0.27649903297424316,ReLU,78,203,18,0.0016190996148307626,1,0.6349993021925502,0.0028780225378575173,1.1673264503479004,0.27649903297424316,0.6299982070922852,COMPLETE
176,0.233314648270607,ReLU,82,222,21,0.0025144506917245952,1,0.5442536940599101,0.00568289357071581,1.5921705961227417,0.233314648270607,0.6486940383911133,COMPLETE
177,0.23317797482013702,ReLU,77,241,20,0.0019965168314596787,1,0.5030957124532119,0.004320037460274756,2.693922281265259,0.23317797482013702,0.7014943361282349,COMPLETE
178,0.35031354427337646,ReLU,85,185,20,0.0013234317368031848,1,0.4249220820084856,0.009228403059947118,1.3062615394592285,0.35031354427337646,0.6292847394943237,COMPLETE
179,0.4033085107803345,Tanh,80,254,19,0.003025298236890397,1,0.3923266409379341,0.007084541379503027,1.3915482759475708,0.4033085107803345,0.529866099357605,COMPLETE
180,0.2617276608943939,ReLU,88,220,16,0.0022172071832831457,1,0.6158633360089687,0.0005018654911746913,1.2595984935760498,0.2617276608943939,0.6615852117538452,COMPLETE
181,0.23365868628025055,ReLU,76,242,20,0.0019097568377376597,1,0.5039858512888069,0.00433385052254193,2.669522523880005,0.23365868628025055,0.7008789777755737,COMPLETE
182,0.27583903074264526,ReLU,74,233,19,0.001630410683224844,1,0.4792877210754736,0.003276060499124176,13.013620376586914,0.27583903074264526,0.6164999008178711,COMPLETE
183,0.23778854310512543,ReLU,78,206,20,0.0021212834657926565,1,0.5257241435727859,0.005279646989019553,3.1102404594421387,0.23778854310512543,0.7119810581207275,COMPLETE
184,0.24106737971305847,ReLU,83,243,22,0.004205945330739134,1,0.5763692058773926,0.003643627137449251,1.4509541988372803,0.24106737971305847,0.6764630079269409,COMPLETE
185,0.2714107036590576,ReLU,72,228,21,0.0011115732741436549,1,0.5535337420125317,0.0024356571128717848,1.7910571098327637,0.2714107036590576,0.591332197189331,COMPLETE
186,0.22679726779460907,ReLU,81,217,20,0.001365103431507754,1,0.49218377745860586,0.00441398475477019,2.9703292846679688,0.22679726779460907,0.6933709383010864,COMPLETE
187,0.2864908277988434,ReLU,81,214,18,0.001348360660032904,1,0.44412730011561025,0.002853076986599487,1.5851261615753174,0.2864908277988434,0.6331865787506104,COMPLETE
188,0.3268299996852875,ReLU,84,205,23,0.0016361795599180344,1,0.46039883325866204,0.005348540563628111,5.031659126281738,0.3268299996852875,0.5198127031326294,COMPLETE
189,0.26232215762138367,ReLU,81,179,21,0.0008774304629695322,1,0.5830830926264577,0.0018950983767167763,1.0168370008468628,0.26232215762138367,0.6479369401931763,COMPLETE
190,0.2673605680465698,ReLU,86,192,19,0.002602026891907486,1,0.5255637602265631,0.003856381947009769,2.779103994369507,0.2673605680465698,0.6761622428894043,COMPLETE
191,0.23170042037963867,ReLU,79,219,20,0.0017703204679720185,1,0.5515319051110869,0.004385392842412001,1.9064260721206665,0.23170042037963867,0.6511245965957642,COMPLETE
192,0.26738882064819336,ReLU,79,225,21,0.0013004017069033716,1,0.5508972337243638,0.00458849417347468,1.7493857145309448,0.26738882064819336,0.597387969493866,COMPLETE
193,0.2827273905277252,ReLU,83,213,19,0.0016960949558284288,1,0.6018630390261818,0.003277685924541932,1.2118442058563232,0.2827273905277252,0.6472042202949524,COMPLETE
194,0.24664920568466187,ReLU,80,219,20,0.0010566933443864382,1,0.487617890935428,0.002279738207834318,2.9863533973693848,0.24664920568466187,0.6665312051773071,COMPLETE
195,0.20908811688423157,ReLU,85,236,22,0.0015121857366557343,1,0.5665573737165629,0.0062780377914942315,1.4458703994750977,0.20908811688423157,0.7027485966682434,COMPLETE
196,0.24196086823940277,ReLU,88,199,22,0.001440874359787717,1,0.5439081087133536,0.007274212682100948,1.5243035554885864,0.24196086823940277,0.635675311088562,COMPLETE
197,0.23054322600364685,ReLU,85,267,22,0.0011648944264412951,1,0.5979811910334641,0.006672767635648385,1.1089394092559814,0.23054322600364685,0.6968640089035034,COMPLETE
198,0.37095117568969727,Sigmoid,85,260,23,0.0011506128668370605,1,0.632412090411532,0.006374572544106197,1.1723724603652954,0.37095117568969727,0.5036054849624634,COMPLETE
199,0.23794816434383392,ReLU,90,272,22,0.0008571703068561275,1,0.5859652022621132,0.009778279055077898,1.1578876972198486,0.23794816434383392,0.6871274709701538,COMPLETE
200,0.38391637802124023,ReLU,86,249,23,0.0032801636901843593,1,0.6601547000000489,0.007912212936475177,2.402146100997925,0.38391637802124023,0.5259346961975098,COMPLETE
201,0.2642574608325958,ReLU,83,225,22,0.0014204504558766387,1,0.6151968846989634,0.005593127014153734,1.349006175994873,0.2642574608325958,0.6583141684532166,COMPLETE
202,0.24281476438045502,ReLU,82,235,21,0.0016517781323988727,1,0.5589335688593711,0.0047358095869040814,1.4775422811508179,0.24281476438045502,0.6548008918762207,COMPLETE
203,0.23816417157649994,ReLU,84,209,22,0.0022945393424358375,1,0.5924614724232176,0.003990938031305262,1.2555493116378784,0.23816417157649994,0.6868433952331543,COMPLETE
204,0.2795921862125397,ReLU,88,267,21,0.0012080752681982217,1,0.520383696066714,0.006136618917367133,2.819413900375366,0.2795921862125397,0.6613468527793884,COMPLETE
205,0.22466573119163513,ReLU,81,217,18,0.0018330976085727038,1,0.5673181640951002,0.005025862546534279,1.5203051567077637,0.22466573119163513,0.6806025505065918,COMPLETE
206,0.25774407386779785,ReLU,86,252,18,0.002583226673117581,1,0.610057506620152,0.005109934720306035,1.230391263961792,0.25774407386779785,0.6783791780471802,COMPLETE
207,0.24768657982349396,ReLU,81,206,17,0.000977763027558909,1,0.5782630184711929,0.0036345836585328518,1.1412806510925293,0.24768657982349396,0.6675794124603271,COMPLETE
208,0.3583604693412781,ReLU,92,230,18,0.002056993231869257,1,0.3484635556495291,0.00838819811398747,1.6178257465362549,0.3583604693412781,0.5018322467803955,COMPLETE
209,0.30426672101020813,ReLU,26,240,17,0.001518736890751133,1,0.5297464748631245,0.002691089004944132,2.005941867828369,0.30426672101020813,0.645544171333313,COMPLETE
210,0.33785346150398254,Tanh,84,196,22,0.0012227046152731783,1,0.63644367251252,0.006905276551384467,1.2768785953521729,0.33785346150398254,0.5478957295417786,COMPLETE
211,0.26588088274002075,ReLU,82,217,19,0.0017690094075238708,1,0.5565211134941989,0.004831873853091272,1.8806235790252686,0.26588088274002075,0.5996584892272949,COMPLETE
212,0.22770023345947266,ReLU,79,219,20,0.0018960326156516887,1,0.571511131004827,0.00425768943430847,1.1967905759811401,0.22770023345947266,0.6944030523300171,COMPLETE
213,0.2646438181400299,ReLU,76,228,23,0.002882047268814438,1,0.5786439386162202,0.0038025597025923923,1.3034093379974365,0.2646438181400299,0.644821047782898,COMPLETE
214,0.33154481649398804,ReLU,81,247,19,0.0014022117786180119,1,0.7014709558343574,0.0029821513824694885,1.4787178039550781,0.33154481649398804,0.6294678449630737,COMPLETE
215,0.43401774764060974,ReLU,85,209,21,0.002282043912338098,1,0.2947462502463193,0.005683378287937306,1.947543978691101,0.43401774764060974,0.41776615381240845,COMPLETE
216,0.2883829176425934,ReLU,83,222,20,0.0037108260950662352,1,0.5966238165510581,0.004047893195558525,1.6332826614379883,0.2883829176425934,0.620811939239502,COMPLETE
217,0.29671066999435425,ReLU,79,230,22,0.0018418847860102458,1,0.48415533723171006,0.0030710281294894608,12.321457862854004,0.29671066999435425,0.5874820351600647,COMPLETE
218,0.7146238088607788,ReLU,87,239,19,1.127356562825626e-05,1,0.5035161418075433,0.003589235024419488,2.015756130218506,0.7146238088607788,0.08516544103622437,COMPLETE
219,0.22748804092407227,ReLU,81,212,18,0.0014480809131315775,1,0.5657905334709574,0.011270410980668314,1.3905869722366333,0.22748804092407227,0.6765902042388916,COMPLETE
220,0.3217438757419586,ReLU,84,200,23,0.0010748225808429911,1,0.5381419636552645,0.01134087838518111,2.550647735595703,0.3217438757419586,0.625184178352356,COMPLETE
221,0.23401035368442535,ReLU,80,212,18,0.0014951286488314199,1,0.5722443079753323,0.01143715974635159,1.009194254875183,0.23401035368442535,0.68593430519104,COMPLETE
222,0.2280944585800171,ReLU,82,217,18,0.0020683112113331127,1,0.5629497762908607,0.004885092251822183,1.580782413482666,0.2280944585800171,0.6757280826568604,COMPLETE
223,0.23971711099147797,ReLU,82,187,17,0.0021152095244737334,1,0.5668083113223702,0.009125945851462031,1.3507397174835205,0.23971711099147797,0.6592047214508057,COMPLETE
224,0.21892718970775604,ReLU,84,217,18,0.0013016895615468181,1,0.4593512916538309,0.005748983977989357,4.5681257247924805,0.21892718970775604,0.6783463954925537,COMPLETE
225,0.2934647798538208,ReLU,82,214,20,0.0012363368376415546,1,0.45233379653949435,0.013833334189147952,1.8754761219024658,0.2934647798538208,0.6242573857307434,COMPLETE
226,0.3075716197490692,ReLU,85,205,21,0.0014283579205012847,1,0.46571176283131843,0.006443914155837064,4.898072719573975,0.3075716197490692,0.5481076240539551,COMPLETE
227,0.33013057708740234,ReLU,77,194,19,0.0009993514292003292,1,0.5215150384696365,2.063428573414755e-05,2.9100818634033203,0.33013057708740234,0.6001327037811279,COMPLETE
228,0.3898569643497467,ReLU,83,219,22,0.0016179544658246577,1,0.42756078865830566,0.00719144252066912,1.428133487701416,0.3898569643497467,0.5874384641647339,COMPLETE
229,0.2566884160041809,ReLU,80,259,17,0.0012669614404514906,1,0.49809379657775615,0.000766502001238013,3.133043050765991,0.2566884160041809,0.6529582142829895,COMPLETE
230,0.24181917309761047,ReLU,86,235,20,0.0025830393941330774,1,0.5421450574751026,0.020652477591224617,2.0020196437835693,0.24181917309761047,0.7182925343513489,COMPLETE
231,0.25335386395454407,ReLU,89,222,18,0.002083987720030147,1,0.6052443492977102,0.005130913119251571,1.156046986579895,0.25335386395454407,0.6838574409484863,COMPLETE
232,0.2252824902534485,ReLU,84,212,18,0.0015859971523438444,1,0.5643380959875706,0.004720759750264017,1.4408719539642334,0.2252824902534485,0.6797257661819458,COMPLETE
233,0.24446825683116913,ReLU,84,212,18,0.0015115784113980525,1,0.5550221554959887,0.005530041007978064,1.6915569305419922,0.24446825683116913,0.6318998336791992,COMPLETE
234,0.2555655539035797,ReLU,81,203,19,0.001771244093624975,1,0.46833780145983145,0.004287090139151815,5.539322853088379,0.2555655539035797,0.6245163679122925,COMPLETE
235,0.8926441669464111,ReLU,78,207,18,1.7218794969285743e-05,1,0.3730863515353174,0.0036121371140058643,1.4909781217575073,0.8926441669464111,-0.10248148441314697,COMPLETE
236,0.30229875445365906,ReLU,83,226,21,0.0011476612042971188,1,0.6161040968947393,0.015076801745241931,1.2953314781188965,0.30229875445365906,0.6091266870498657,COMPLETE
237,0.2809413969516754,ReLU,87,215,22,0.0013715811246927975,1,0.5180187603313745,0.002622477518792986,3.00059175491333,0.2809413969516754,0.6597126126289368,COMPLETE
238,0.34836822748184204,Sigmoid,85,196,19,0.0017825246650949584,1,0.5611101905740846,0.00043606246920629207,1.3122555017471313,0.34836822748184204,0.5047401785850525,COMPLETE
239,0.24882720410823822,ReLU,81,236,20,0.003068599966544044,1,0.5967952851415145,0.007778631108854149,1.4545849561691284,0.24882720410823822,0.6728228330612183,COMPLETE
240,0.3419785797595978,ReLU,83,249,16,0.0009107582461122085,1,0.43915769787226333,0.0009993739580707588,3.110487699508667,0.3419785797595978,0.5568763017654419,COMPLETE
241,0.23879201710224152,ReLU,87,219,18,0.0023158811125098527,1,0.5678910636461235,0.0045926301248440625,1.6512768268585205,0.23879201710224152,0.6605198383331299,COMPLETE
242,0.22976957261562347,ReLU,85,226,18,0.002038518922722723,1,0.5815551775346314,0.005866559151146076,1.092284083366394,0.22976957261562347,0.6916258335113525,COMPLETE
243,0.2767814099788666,ReLU,85,228,18,0.001533899594449147,1,0.5393284692394895,0.005794356649854767,2.319160223007202,0.2767814099788666,0.6775632500648499,COMPLETE
244,0.2578849792480469,ReLU,82,211,17,0.00189042497589279,1,0.5903117696629384,0.006066913094877578,1.235713243484497,0.2578849792480469,0.6609129905700684,COMPLETE
245,0.3020975887775421,ReLU,79,238,19,0.0012918667300726597,1,0.6204144788237038,0.0031920154540045955,1.433972716331482,0.3020975887775421,0.6093867421150208,COMPLETE
246,0.21818898618221283,ReLU,84,271,22,0.0025310554884063626,1,0.5689936601151312,0.004855277296562684,1.936318039894104,0.21818898618221283,0.6898102760314941,COMPLETE
247,0.23821738362312317,ReLU,81,222,17,0.002559673425303937,1,0.5439572042997274,0.00395694399118151,1.5836786031723022,0.23821738362312317,0.6413118839263916,COMPLETE
248,0.23970413208007812,ReLU,84,205,20,0.0035707010097084098,1,0.5086827858802916,0.004824202397647549,2.8680856227874756,0.23970413208007812,0.6931397914886475,COMPLETE
249,0.3406029939651489,ReLU,75,231,23,0.0029680828194358845,1,0.4838608552946434,0.0033833066808954004,11.851521492004395,0.3406029939651489,0.5264583826065063,COMPLETE
250,0.2568430006504059,ReLU,79,218,21,0.0020813237990649166,1,0.5739237021007754,0.002147889472221039,1.226301908493042,0.2568430006504059,0.6552904844284058,COMPLETE
251,0.3652629256248474,Tanh,18,274,19,0.004377350452579687,1,0.5305016420855349,0.0006413822921401168,2.6706936359405518,0.3652629256248474,0.5744866132736206,COMPLETE
252,0.22428466379642487,ReLU,82,197,18,0.0016323140387666311,1,0.5663497712177351,0.00496754150934998,1.4120677709579468,0.22428466379642487,0.6811443567276001,COMPLETE
253,0.26294955611228943,ReLU,82,180,21,0.001560714234258287,1,0.5511631139116913,0.004195834514015543,1.7290959358215332,0.26294955611228943,0.6040722727775574,COMPLETE
254,0.7277564406394958,ReLU,77,188,20,0.02337917164380104,1,0.45216465677814843,0.0028300967627899586,3.8222033977508545,0.7277564406394958,0.06820464134216309,COMPLETE
255,0.34368371963500977,ReLU,81,200,22,0.0016947903921204091,1,0.3260029283274756,0.004802460187440342,2.8018064498901367,0.34368371963500977,0.5121922492980957,COMPLETE
256,1.2999272346496582,ReLU,83,197,19,0.0025089372016298688,1,0.16036126524908806,0.0035134648347085857,2.0932767391204834,1.2999272346496582,-0.4068557024002075,COMPLETE
