number,value,params_activation_1,params_batch_size,params_epochs,params_layer_1,params_learning_rate,params_num_layers,params_train_size,params_weight_decay,user_attrs_mape,user_attrs_mse,user_attrs_r2,state
0,0.9809141755104065,Tanh,96,218,4,4.207988669606632e-05,1,0.4582013868952863,0.0024810409748678114,2.2561800479888916,0.9809141755104065,0.06230860948562622,COMPLETE
1,1.02102530002594,Tanh,98,59,5,5.3370327626039544e-05,1,0.5646386642932582,7.068974950624602e-05,1.7346937656402588,1.02102530002594,0.0274011492729187,COMPLETE
2,0.76811683177948,Sigmoid,22,325,19,0.0006672367170464204,1,0.18358318781006536,0.0002920433847181409,1.4562079906463623,0.76811683177948,0.2328498363494873,COMPLETE
3,0.7121369242668152,Sigmoid,25,324,20,0.07286653737491042,1,0.1144846978456873,0.06245139574743072,1.8889505863189697,0.7121369242668152,0.193933367729187,COMPLETE
4,0.8819460868835449,Sigmoid,55,105,16,0.00010842262717330161,1,0.10741277311947185,0.0433792069749094,1.3824735879898071,0.8819460868835449,0.025172948837280273,COMPLETE
5,0.6953982710838318,Leaky,80,487,23,0.002463768595899745,1,0.7054270142609772,0.03795853142670639,1.2436563968658447,0.6953982710838318,0.2878800630569458,COMPLETE
6,0.7324902415275574,Leaky,34,225,14,0.000132965214572995,1,0.560305062386961,0.00026730883107816685,1.2162237167358398,0.7324902415275574,0.29547762870788574,COMPLETE
7,0.8419925570487976,ReLU,28,398,18,0.00672093005015611,1,0.10115491015452849,0.018274508859816022,5.527563095092773,0.8419925570487976,0.0793008804321289,COMPLETE
8,0.7706108689308167,Sigmoid,66,439,8,0.00017535949529764417,1,0.1989897438445013,1.795698422567761e-05,1.9976575374603271,0.7706108689308167,0.1899903416633606,COMPLETE
9,0.7262560129165649,ReLU,74,103,12,0.012130221181165156,1,0.48647145240701695,0.0017583640270008513,1.8037793636322021,0.7262560129165649,0.3078259229660034,COMPLETE
10,0.640047550201416,Leaky,79,491,22,0.0017404157466432903,1,0.7508950765561601,0.010540963318040455,1.3556042909622192,0.640047550201416,0.3688727617263794,COMPLETE
11,0.6876221299171448,Leaky,81,492,23,0.0017143477552760739,1,0.7959603266871323,0.00974371454191917,1.3165035247802734,0.6876221299171448,0.33606618642807007,COMPLETE
12,0.6650977730751038,Leaky,50,498,24,0.0008233011500597547,1,0.7920771485203731,0.007015697292702693,1.2919509410858154,0.6650977730751038,0.3844088315963745,COMPLETE
13,0.8316073417663574,Leaky,46,397,24,1.3625220514033477e-05,1,0.3885347402137153,0.006377498741418522,1.1892527341842651,0.8316073417663574,0.1917300820350647,COMPLETE
14,0.7365455031394958,Leaky,48,431,11,0.0004608727640677891,1,0.7989400854982043,0.004582661415004826,1.4797102212905884,0.7365455031394958,0.2894601821899414,COMPLETE
15,0.6860708594322205,Leaky,11,340,21,0.0005282814379096309,1,0.34502471001319773,0.015874465408738395,3.6731181144714355,0.6860708594322205,0.346346378326416,COMPLETE
16,0.799180269241333,Leaky,64,493,1,0.0027783615926678024,1,0.6708513098432723,0.0012759639636121729,1.3156121969223022,0.799180269241333,0.1792427897453308,COMPLETE
17,0.8042938113212585,Leaky,39,252,16,0.0009519703005249732,1,0.6020630447723824,0.09832839855776031,1.174119234085083,0.8042938113212585,0.2501678466796875,COMPLETE
18,0.7551389932632446,Tanh,88,442,21,0.0003102351010378078,1,0.4482830572463902,0.003548505084635141,1.273844599723816,0.7551389932632446,0.30008894205093384,COMPLETE
19,0.6130658984184265,ReLU,59,373,24,0.005737169762863561,1,0.6377001981210907,0.015469348808276573,1.4030662775039673,0.6130658984184265,0.40118515491485596,COMPLETE
20,0.665891170501709,ReLU,63,379,17,0.008953128914813637,1,0.3269898349915564,0.015257066795346311,2.0864007472991943,0.665891170501709,0.35859549045562744,COMPLETE
21,0.606782078742981,ReLU,53,449,24,0.0017540195563574108,1,0.6432293275027745,0.005796145745012531,1.5286285877227783,0.606782078742981,0.3771432638168335,COMPLETE
22,0.6891234517097473,ReLU,58,445,22,0.0038722901399969047,1,0.6160924057887641,0.026981716186201227,1.2745741605758667,0.6891234517097473,0.37044090032577515,COMPLETE
23,0.6665113568305969,ReLU,72,344,20,0.0016862689471607952,1,0.5151102693902182,0.009688391762205602,1.2013211250305176,0.6665113568305969,0.3580893874168396,COMPLETE
24,0.6096477508544922,ReLU,40,294,24,0.01801349540150825,1,0.6482217899441791,0.004117711184332141,1.3510029315948486,0.6096477508544922,0.3783688545227051,COMPLETE
25,0.6389222741127014,ReLU,41,283,24,0.03204167011013813,1,0.6378411238200095,0.003234244390375393,1.5699628591537476,0.6389222741127014,0.3692108988761902,COMPLETE
26,0.7236549258232117,ReLU,35,289,14,0.017933697099232038,1,0.42926463882932103,0.0011691622402317434,1.5805283784866333,0.7236549258232117,0.3130616545677185,COMPLETE
27,0.6657906770706177,ReLU,56,173,19,0.02425853581910749,1,0.5187081861581943,0.004620211275345763,1.5139425992965698,0.6657906770706177,0.3627462387084961,COMPLETE
28,0.6668466925621033,ReLU,43,364,10,0.005012373702494415,1,0.6353734167485943,0.027466854809502943,1.2284842729568481,0.6668466925621033,0.34326356649398804,COMPLETE
29,0.6584000587463379,ReLU,14,171,22,0.005859697936150618,1,0.4275531049284024,0.0019559246769535192,1.6363911628723145,0.6584000587463379,0.3715013861656189,COMPLETE
30,0.6163110136985779,Tanh,50,303,24,0.010914182349918991,1,0.5089339126490061,0.002639952641437377,1.449581265449524,0.6163110136985779,0.39562439918518066,COMPLETE
31,0.6830296516418457,Tanh,51,311,24,0.011095613077184855,1,0.539523954112159,0.003068991346638393,1.593436598777771,0.6830296516418457,0.33999407291412354,COMPLETE
32,0.6003202199935913,Tanh,60,250,21,0.0037196323644766347,1,0.704459223432876,0.0006331677214064336,1.3520615100860596,0.6003202199935913,0.3862805962562561,COMPLETE
33,0.6052638292312622,Tanh,61,240,21,0.004038355016260931,1,0.6923611767347749,0.0006350535371230388,1.2856558561325073,0.6052638292312622,0.37721121311187744,COMPLETE
34,0.6238180994987488,Tanh,65,250,20,0.0031196649473742085,1,0.6837056466638044,0.0007671408686847366,1.266247272491455,0.6238180994987488,0.35335713624954224,COMPLETE
35,0.6782631874084473,Tanh,71,189,18,0.0420814104609889,1,0.5714274737534002,0.0005854580477182977,1.6843156814575195,0.6782631874084473,0.3648989200592041,COMPLETE
36,0.667060136795044,Tanh,32,205,21,0.0011881734084548965,1,0.7202764906930333,0.00048751595860202447,1.2366855144500732,0.667060136795044,0.32797062397003174,COMPLETE
37,0.6563111543655396,Tanh,55,255,6,0.0749077015595648,1,0.7011566277217273,0.000292011904758949,1.4167119264602661,0.6563111543655396,0.3265799283981323,COMPLETE
38,0.6951009631156921,Tanh,19,138,19,0.00366461331831034,1,0.5777118696780401,0.00015888467593959974,1.4941366910934448,0.6951009631156921,0.3607487678527832,COMPLETE
39,0.6733660697937012,Sigmoid,96,229,14,0.020860020036273717,1,0.4691011677277268,0.001773657824839986,3.1865830421447754,0.6733660697937012,0.35565340518951416,COMPLETE
40,0.6324601173400879,Tanh,37,130,22,0.008114335392840172,1,0.6916001872857097,0.0013148303831370307,1.3507293462753296,0.6324601173400879,0.34590864181518555,COMPLETE
41,0.6582556962966919,ReLU,60,268,23,0.005163808980095986,1,0.6175411413598006,0.0007940667733409255,1.6873139142990112,0.6582556962966919,0.39437270164489746,COMPLETE
42,0.681942343711853,ReLU,68,463,23,0.005408109603352801,1,0.5704395832668561,0.0004395664911494599,1.9920214414596558,0.681942343711853,0.3605350852012634,COMPLETE
43,0.7086246609687805,Sigmoid,59,416,20,0.015775910098643955,1,0.7350755130999426,0.006000625336681811,1.3655033111572266,0.7086246609687805,0.26077908277511597,COMPLETE
44,0.5942783951759338,ReLU,53,231,22,0.00248939639710358,1,0.641736003144482,0.001974989916700674,1.6520414352416992,0.5942783951759338,0.3997150659561157,COMPLETE
45,0.685196042060852,ReLU,53,220,18,0.002203792343814893,1,0.5468323995102741,0.0017607046231717736,11.392584800720215,0.685196042060852,0.3370782732963562,COMPLETE
46,0.6756282448768616,Tanh,45,236,21,0.0013121813793978516,1,0.7965577032765839,0.0008916143281413742,1.2705341577529907,0.6756282448768616,0.34764689207077026,COMPLETE
47,0.6530250310897827,ReLU,27,197,16,0.002257231477017147,1,0.7374992712620284,0.0026187267061592396,1.4749598503112793,0.6530250310897827,0.32413822412490845,COMPLETE
48,0.7601287364959717,Tanh,76,52,22,0.0008751670449098224,1,0.4846434062012516,0.0011480198083619728,1.4970898628234863,0.7601287364959717,0.2739208936691284,COMPLETE
49,0.6696096658706665,Sigmoid,31,85,19,0.003824115690450744,1,0.6875253854702837,0.0001838847189966199,1.20892333984375,0.6696096658706665,0.31276679039001465,COMPLETE
50,0.6752303838729858,ReLU,47,326,23,0.0015195903551885053,1,0.5868891488040717,0.004393058768624093,1.5701247453689575,0.6752303838729858,0.36465394496917725,COMPLETE
51,0.5950149893760681,ReLU,61,273,23,0.008301741150746897,1,0.6394050189998733,0.006325855498015405,1.7514020204544067,0.5950149893760681,0.4031112790107727,COMPLETE
52,0.6043413281440735,ReLU,69,270,23,0.007522733031167539,1,0.6375737134871526,0.00760299911665255,1.5279316902160645,0.6043413281440735,0.4097069501876831,COMPLETE
53,0.5826350450515747,ReLU,69,257,21,0.008247673477610531,1,0.7256094749247347,0.007313185008046919,1.36350417137146,0.5826350450515747,0.37281739711761475,COMPLETE
54,0.650898814201355,ReLU,69,269,20,0.008112595865419386,1,0.7626056989644784,0.007631497767085971,1.3983153104782104,0.650898814201355,0.37793922424316406,COMPLETE
55,0.5914207696914673,ReLU,62,241,21,0.0027309084228175342,1,0.7279705778933325,0.008781588933980544,1.3495378494262695,0.5914207696914673,0.36399900913238525,COMPLETE
56,0.5969456434249878,ReLU,84,208,17,0.0025655816881875737,1,0.7225365071928798,0.009839686278386954,1.334678292274475,0.5969456434249878,0.36495041847229004,COMPLETE
57,0.6755674481391907,ReLU,77,208,17,0.0026463939916382116,1,0.7423032162398727,0.011752154331718697,1.351366639137268,0.6755674481391907,0.3160826563835144,COMPLETE
58,0.7064118981361389,ReLU,82,166,17,0.0025988835184689893,1,0.7984858336280579,0.012343660648466422,1.3430639505386353,0.7064118981361389,0.32335466146469116,COMPLETE
59,0.6930834054946899,ReLU,90,221,19,0.013084322904114617,1,0.5947472996836187,0.008847509983712214,1.634775996208191,0.6930834054946899,0.3480600118637085,COMPLETE
60,0.7311394214630127,ReLU,85,250,16,0.0006454628194142841,1,0.7534848974588176,0.023609821250119827,1.2592860460281372,0.7311394214630127,0.2837504744529724,COMPLETE
61,0.5893754363059998,ReLU,63,275,22,0.00683518217226299,1,0.6612813541375383,0.007374333597137799,1.283077359199524,0.5893754363059998,0.38505494594573975,COMPLETE
62,0.581430196762085,ReLU,63,279,21,0.0044193757142734,1,0.6568099602642073,0.0057338199028492,1.241341471672058,0.581430196762085,0.4164581894874573,COMPLETE
63,0.5915261507034302,ReLU,63,306,22,0.007170566089976214,1,0.6620259669862734,0.006589891536592353,1.2781932353973389,0.5915261507034302,0.3833833932876587,COMPLETE
64,0.6402416825294495,ReLU,63,309,22,0.006520951681442958,1,0.5426384484493968,0.0054416568698574,2.6944727897644043,0.6402416825294495,0.3737325072288513,COMPLETE
65,0.7995879650115967,ReLU,73,284,1,0.01145030582576011,1,0.659966784210502,0.0042312256972747205,1.3489402532577515,0.7995879650115967,0.17716050148010254,COMPLETE
66,0.6003456711769104,ReLU,67,331,22,0.004752630323600327,1,0.6563922230562206,0.007258829717732231,1.3022167682647705,0.6003456711769104,0.3974740505218506,COMPLETE
67,0.6339213252067566,ReLU,63,350,20,0.0072357179748849905,1,0.6068457672127254,0.0036031459831886658,1.5060229301452637,0.6339213252067566,0.4144723415374756,COMPLETE
68,0.6451613903045654,ReLU,54,294,21,0.0019296426426620703,1,0.5139736765481937,0.0064891145712247175,1.3023712635040283,0.6451613903045654,0.3765246272087097,COMPLETE
69,0.6824935674667358,ReLU,56,316,23,0.009491779499984023,1,0.6052913431500477,0.013299999579375783,1.521276831626892,0.6824935674667358,0.3677186965942383,COMPLETE
70,0.6175127625465393,ReLU,57,275,22,0.003235637977147853,1,0.6646507455943785,0.017122977543229497,1.2588963508605957,0.6175127625465393,0.35980844497680664,COMPLETE
71,0.67527836561203,ReLU,62,264,15,0.004689752123862727,1,0.7500803812404493,0.010303702260679646,1.4072076082229614,0.67527836561203,0.33305710554122925,COMPLETE
72,0.6643085479736328,ReLU,66,235,18,0.002980949972752974,1,0.707278307591146,0.009170971830279194,1.433913230895996,0.6643085479736328,0.3187129497528076,COMPLETE
73,0.6285399794578552,ReLU,50,186,21,0.006332152103404141,1,0.5565758382092163,0.005227110646463618,1.608838677406311,0.6285399794578552,0.3945122957229614,COMPLETE
74,0.680016279220581,ReLU,70,300,12,0.014027179437783734,1,0.6244214330281032,0.020915133029383096,1.3192123174667358,0.680016279220581,0.3477775454521179,COMPLETE
75,0.5900348424911499,Leaky,75,209,20,0.009250648866793821,1,0.6676142697565155,0.0032300210522740345,1.2575136423110962,0.5900348424911499,0.3946024179458618,COMPLETE
76,0.5995656847953796,Leaky,76,280,20,0.009315234574012187,1,0.6669383786805059,0.0023473657276250415,1.4587347507476807,0.5995656847953796,0.3830452561378479,COMPLETE
77,0.7222926616668701,Leaky,65,262,3,0.012344771908014371,1,0.5901593343755603,0.003003087899650117,1.3053724765777588,0.7222926616668701,0.3183138966560364,COMPLETE
78,0.6461372971534729,Leaky,73,247,23,0.0044708163030141804,1,0.5313334983330997,0.0036223413854865978,2.0869498252868652,0.6461372971534729,0.36956101655960083,COMPLETE
79,0.6748188138008118,Leaky,52,230,8,0.005781630959891825,1,0.49773371331710947,0.005210271404920884,1.4369667768478394,0.6748188138008118,0.35204482078552246,COMPLETE
80,0.7209712266921997,Sigmoid,58,157,19,0.009383907047969502,1,0.7724460856179917,0.0021909221221351007,1.2915351390838623,0.7209712266921997,0.3228389024734497,COMPLETE
81,0.6146738529205322,ReLU,79,208,22,0.003127884750414692,1,0.7095540971675539,0.008093467720187401,1.3430439233779907,0.6146738529205322,0.3669217824935913,COMPLETE
82,0.6123197078704834,ReLU,83,185,21,0.004077783756618575,1,0.6726902852697215,0.012808848301865445,1.2895653247833252,0.6123197078704834,0.3751615881919861,COMPLETE
83,0.6050726771354675,ReLU,87,216,20,0.006010292011552069,1,0.6423735101642186,0.006270485633386294,1.6001323461532593,0.6050726771354675,0.38881170749664307,COMPLETE
84,0.5786851644515991,Leaky,93,244,24,0.007512728691582564,1,0.7267764107868004,0.010571990170520129,1.2651150226593018,0.5786851644515991,0.37644046545028687,COMPLETE
85,0.6342366337776184,Leaky,97,258,24,0.015591091163287055,1,0.5593834268781395,0.004307417262332611,1.695658564567566,0.6342366337776184,0.38835442066192627,COMPLETE
86,0.6448416709899902,Leaky,63,288,24,0.007403330485992454,1,0.7971017035790428,0.003063671190400652,1.4552195072174072,0.6448416709899902,0.3797941207885742,COMPLETE
87,0.6411489248275757,Leaky,93,237,23,0.011527675962951681,1,0.6137099219388513,0.006615042488612088,1.5842993259429932,0.6411489248275757,0.4125407338142395,COMPLETE
88,0.6083189249038696,Leaky,61,319,22,0.00836166042633396,1,0.7260447139161647,0.015139732874110972,1.263372540473938,0.6083189249038696,0.346778929233551,COMPLETE
89,0.649910032749176,Leaky,67,245,21,0.021133752648047077,1,0.6310152892802076,0.005354779536138615,1.8102023601531982,0.649910032749176,0.37608927488327026,COMPLETE
90,0.703374981880188,Sigmoid,65,296,23,0.004744236242536433,1,0.7622887970536982,0.0015254480830168972,1.208807349205017,0.703374981880188,0.32947617769241333,COMPLETE
91,0.6609458923339844,ReLU,93,197,20,0.0035508832137616524,1,0.7064311637607965,0.010343475777909599,1.3101074695587158,0.6609458923339844,0.3247693181037903,COMPLETE
92,0.6078704595565796,ReLU,75,213,21,0.0020952982188957264,1,0.6823096796427293,0.00833101227464886,1.2630854845046997,0.6078704595565796,0.3811609745025635,COMPLETE
93,0.6147018074989319,ReLU,99,280,22,0.0024155608240565064,1,0.7349835769882499,0.009007475823329746,1.3802623748779297,0.6147018074989319,0.35875725746154785,COMPLETE
94,0.6779888272285461,ReLU,79,225,23,0.007052792920590761,1,0.5765927018561443,0.010773374392100878,1.65272057056427,0.6779888272285461,0.3740222454071045,COMPLETE
95,0.6518847346305847,ReLU,72,256,19,0.0014452907528016636,1,0.6572980498670924,0.018128157743191216,1.2193104028701782,0.6518847346305847,0.34721940755844116,COMPLETE
96,0.5926355123519897,ReLU,90,307,24,0.0059891404881616175,1,0.7227687293169197,0.004061199642809782,1.5332170724868774,0.5926355123519897,0.3695356249809265,COMPLETE
97,0.6211528778076172,Leaky,92,334,24,0.005245822173690326,1,0.6842909694460976,0.004121771341038137,1.3985693454742432,0.6211528778076172,0.35784071683883667,COMPLETE
98,0.6234655976295471,ReLU,60,305,23,0.010007089168852538,1,0.7721127667010342,0.00279402100914292,1.346932291984558,0.6234655976295471,0.4124259948730469,COMPLETE
99,0.6156622767448425,ReLU,87,351,24,0.006267402631697853,1,0.6190150343150491,0.002382190814503972,1.709624171257019,0.6156622767448425,0.43153953552246094,COMPLETE
100,0.6136529445648193,ReLU,58,270,24,0.003935150269829432,1,0.721343518093875,0.0036177362134373167,1.325287103652954,0.6136529445648193,0.36854809522628784,COMPLETE
101,0.6254776120185852,ReLU,71,197,22,0.0025938303314844142,1,0.7118467045850149,0.007188025354735815,1.3972957134246826,0.6254776120185852,0.35904252529144287,COMPLETE
102,0.5893802642822266,ReLU,85,241,21,0.008332848249043298,1,0.6510640732912707,0.005119621930662852,1.310562014579773,0.5893802642822266,0.3973197937011719,COMPLETE
103,0.6328340768814087,ReLU,91,242,21,0.00862807512076356,1,0.5917113990269449,0.00491776303666437,1.6790428161621094,0.6328340768814087,0.40387266874313354,COMPLETE
104,0.585361659526825,ReLU,94,290,22,0.013676238554007345,1,0.6487483862606064,0.006455272091166632,1.3210970163345337,0.585361659526825,0.4042910933494568,COMPLETE
105,0.593910276889801,ReLU,95,288,20,0.013365808946566094,1,0.6785867347935841,0.005189285038159347,1.3342444896697998,0.593910276889801,0.39125508069992065,COMPLETE
106,0.6158257126808167,ReLU,100,289,20,0.014310971237057381,1,0.6772930373914214,0.0060217551707620574,1.2874650955200195,0.6158257126808167,0.37364059686660767,COMPLETE
107,0.6373340487480164,ReLU,94,303,21,0.010811285538551454,1,0.7632402194450607,0.004727198294513637,1.3975118398666382,0.6373340487480164,0.3893304467201233,COMPLETE
108,0.6312153339385986,ReLU,90,314,18,0.015010505195546161,1,0.6578526930973821,0.007234468406017039,1.4742352962493896,0.6312153339385986,0.3696354031562805,COMPLETE
109,0.630018949508667,Leaky,97,257,20,0.012700461746167738,1,0.6909753124107549,0.013244773953587887,1.2393991947174072,0.630018949508667,0.34843331575393677,COMPLETE
110,0.6582311987876892,ReLU,88,275,19,0.007336896883182431,1,0.5678416448731027,0.0039314531854289635,1.5355197191238403,0.6582311987876892,0.3776291012763977,COMPLETE
111,0.5964750051498413,ReLU,96,230,22,0.018306945498989233,1,0.6249769912336247,0.0031928297140103147,1.6791080236434937,0.5964750051498413,0.4285299777984619,COMPLETE
112,0.5812608599662781,ReLU,95,263,21,0.005147481812935452,1,0.7344481962976347,0.005634649745660644,1.2871086597442627,0.5812608599662781,0.39264392852783203,COMPLETE
113,0.594377338886261,ReLU,85,281,21,0.005420046968409062,1,0.731843793503536,0.008431572130443248,1.365052580833435,0.594377338886261,0.37241190671920776,COMPLETE
114,0.6543850898742676,ReLU,95,264,22,0.010179544382861718,1,0.7831568686650235,0.005306100408595076,1.3748488426208496,0.6543850898742676,0.3817170262336731,COMPLETE
115,0.6250963807106018,ReLU,99,323,20,0.006258958892980834,1,0.7484894828994688,0.0063647866345101015,1.3522437810897827,0.6250963807106018,0.3774471879005432,COMPLETE
116,0.7603841423988342,Sigmoid,88,297,19,0.008539507228908649,1,0.6960921446065014,0.011088857960091023,1.1395947933197021,0.7603841423988342,0.22372454404830933,COMPLETE
117,0.6885830163955688,ReLU,90,244,23,0.01168262012423907,1,0.6019010737024272,0.004228000026232153,1.9400336742401123,0.6885830163955688,0.35804349184036255,COMPLETE
118,0.6342374682426453,ReLU,94,309,21,0.004529321659068708,1,0.7992942011964669,0.0075587045391132986,1.4074615240097046,0.6342374682426453,0.3893735408782959,COMPLETE
119,0.5915868878364563,Leaky,98,290,22,0.027011339768688872,1,0.6618181752359316,0.005618750452382383,1.3805443048477173,0.5915868878364563,0.383320152759552,COMPLETE
120,0.6329351663589478,Leaky,98,254,23,0.024053147617439437,1,0.6532509622087855,0.01513952239092146,1.375044584274292,0.6329351663589478,0.35780996084213257,COMPLETE
121,0.6040797233581543,Leaky,95,292,22,0.0069847491996230604,1,0.6753388708570263,0.005556864635959185,1.4338538646697998,0.6040797233581543,0.3883763551712036,COMPLETE
122,0.624346911907196,Leaky,91,279,21,0.018776539308635362,1,0.7351802163348587,0.008862349335954464,1.4701176881790161,0.624346911907196,0.34869569540023804,COMPLETE
123,0.6004766225814819,Leaky,100,266,22,0.03179464632498382,1,0.636619331554501,0.003434307337716591,1.808522343635559,0.6004766225814819,0.4118388891220093,COMPLETE
124,0.6078848242759705,Leaky,81,286,20,0.009698522635845721,1,0.7121230163234813,0.004872294120150872,1.4660323858261108,0.6078848242759705,0.37783098220825195,COMPLETE
125,0.6489445567131042,ReLU,69,341,21,0.015867662147863757,1,0.6065379097683907,0.006195491011588623,1.6000970602035522,0.6489445567131042,0.4005959630012512,COMPLETE
126,0.6414538025856018,ReLU,92,261,22,0.00535489303113807,1,0.5345278270297893,0.002618168359976601,2.059108018875122,0.6414538025856018,0.37253499031066895,COMPLETE
127,0.6409502029418945,ReLU,97,328,24,0.003558412695920214,1,0.7583803197671402,0.010207438150864969,1.2775872945785522,0.6409502029418945,0.38016951084136963,COMPLETE
128,0.6187310814857483,Leaky,89,272,23,0.01297702966323692,1,0.657367107121266,0.007425273364441958,1.4103257656097412,0.6187310814857483,0.38041871786117554,COMPLETE
