number,value,params_activation_1,params_batch_size,params_epochs,params_layer_1,params_learning_rate,params_num_layers,params_train_size,params_weight_decay,user_attrs_mape,user_attrs_mse,user_attrs_r2,state
253,0.6545590162277222,Sigmoid,32,476,21,0.00023394744759603692,1,0.7440746968263039,0.013021920393528126,6.192178249359131,0.6545590162277222,0.3128651976585388,COMPLETE
254,3.4483754634857178,Sigmoid,35,489,20,0.0002870747349197007,1,0.5194292118641914,0.009564472553754177,1.6227154731750488,3.4483754634857178,0.00433349609375,COMPLETE
255,2.440391778945923,Sigmoid,38,466,21,0.0003750268354287165,1,0.393031345452668,0.012449106359284506,1.3156346082687378,2.440391778945923,0.19945424795150757,COMPLETE
256,0.4322693943977356,Sigmoid,34,454,21,0.00019649278105609975,1,0.7721678171292004,0.01565995781180111,1.2551331520080566,0.4322693943977356,0.27484285831451416,COMPLETE
257,1.6796306371688843,Sigmoid,33,454,21,0.0002033125158758713,1,0.7019720953784325,0.01767433814019077,1.4879553318023682,1.6796306371688843,-0.008004188537597656,COMPLETE
258,0.6858021020889282,Sigmoid,29,477,21,0.000171247352858528,1,0.7629382129376215,0.014970296340853647,1.6428431272506714,0.6858021020889282,0.2259863018989563,COMPLETE
259,1.8043861389160156,Sigmoid,36,451,20,0.00027172118316419426,1,0.7215677245623309,0.010687874071470985,1.55536687374115,1.8043861389160156,-0.01566016674041748,COMPLETE
260,0.6460257172584534,Sigmoid,34,496,22,0.0002313516825960196,1,0.7709005270655971,0.015317475321323966,1.8092098236083984,0.6460257172584534,0.27087897062301636,COMPLETE
261,0.537548840045929,ReLU,37,462,21,0.00043904246244908337,1,0.7995473527599883,0.02275112167583049,1.1651333570480347,0.537548840045929,0.1641523241996765,COMPLETE
262,1.6003776788711548,Sigmoid,30,470,21,0.00034124982844037415,1,0.66303747365234,0.012311073902051254,2.710855722427368,1.6003776788711548,-0.026920318603515625,COMPLETE
263,0.6088239550590515,Sigmoid,32,483,22,0.00029187823386799265,1,0.740439604301061,0.009507750291362705,4.161851406097412,0.6088239550590515,0.3131145238876343,COMPLETE
264,10.330708503723145,Sigmoid,35,453,20,0.00020503798903375359,1,0.10177515576406196,0.018521141731332312,1.972132682800293,10.330708503723145,-0.2663395404815674,COMPLETE
265,0.6454773545265198,Sigmoid,37,500,22,0.00024274264833822618,1,0.7690308160869533,0.0005722304642430483,1.7096198797225952,0.6454773545265198,0.27149784564971924,COMPLETE
266,1.4797722101211548,Sigmoid,38,448,21,0.0003860925512503107,1,0.5982666514320235,0.0001769816858196926,3.184569835662842,1.4797722101211548,0.15121805667877197,COMPLETE
267,1.9650510549545288,Tanh,34,459,22,0.00017359014745962805,1,0.7051765067437088,0.00912709269717448,2.248401165008545,1.9650510549545288,-0.17929470539093018,COMPLETE
268,0.4467025697231293,Sigmoid,38,475,21,0.0002996405367880425,1,0.7986665096100753,0.013259389756116818,1.202589511871338,0.4467025697231293,0.30541133880615234,COMPLETE
269,1.6924338340759277,Sigmoid,38,487,21,0.00033125808085292745,1,0.26186049260609345,0.012543875697027734,1.2070577144622803,1.6924338340759277,0.2508116364479065,COMPLETE
270,0.6373205184936523,Sigmoid,36,467,20,0.004525486807494949,1,0.7393826399646407,0.011312207693647528,3.199052333831787,0.6373205184936523,0.280964195728302,COMPLETE
271,0.47741594910621643,Sigmoid,35,472,22,0.0004512632844324452,1,0.7724417957091555,0.015012931044780107,1.403680443763733,0.47741594910621643,0.1991068720817566,COMPLETE
272,3.546370029449463,Sigmoid,32,483,21,0.00024028773991886698,1,0.5149364834725945,0.018579062196371978,1.5110684633255005,3.546370029449463,-0.02396094799041748,COMPLETE
273,1.6048070192337036,Sigmoid,24,478,21,0.00030210337455182485,1,0.6822888015836389,0.02764361803389824,2.8861236572265625,1.6048070192337036,0.017058074474334717,COMPLETE
274,0.48593246936798096,Sigmoid,38,459,20,0.00019900945462112015,1,0.7731277951971022,0.010458507122107849,1.1033530235290527,0.48593246936798096,0.18481993675231934,COMPLETE
275,0.4587068259716034,Sigmoid,39,470,22,0.00037065979193207094,1,0.7988053037422576,0.013729387563920637,1.2444732189178467,0.4587068259716034,0.28674566745758057,COMPLETE
276,0.4790404438972473,Sigmoid,39,491,20,0.00039170582104682385,1,0.7978129353565064,0.014105076114606548,1.2180488109588623,0.4790404438972473,0.2551284432411194,COMPLETE
277,0.6356617212295532,Sigmoid,41,473,22,0.0004345436790613045,1,0.7339355791611115,0.01640371918531597,2.7640106678009033,0.6356617212295532,0.2828356623649597,COMPLETE
278,2.2184367179870605,Sigmoid,36,467,16,0.00031804580170180014,1,0.3078713218410874,0.012782849231486527,1.104680061340332,2.2184367179870605,0.11936134099960327,COMPLETE
279,0.4699322581291199,Sigmoid,28,447,21,0.0003444143571021021,1,0.7999157371098188,0.009594270319471895,1.2931979894638062,0.4699322581291199,0.2692909240722656,COMPLETE
280,0.6334947943687439,Sigmoid,33,479,22,0.000265569158739549,1,0.7496791077528646,0.01107084111825441,5.96368408203125,0.6334947943687439,0.33497774600982666,COMPLETE
281,1.8945530652999878,Sigmoid,31,450,21,0.0004707821240263611,1,0.713988663197701,0.03623020624910803,2.0717926025390625,1.8945530652999878,-0.13698649406433105,COMPLETE
282,0.4691064953804016,Sigmoid,38,486,22,0.0003597941708216976,1,0.7990708439360844,0.008657681169092706,1.3066385984420776,0.4691064953804016,0.27057498693466187,COMPLETE
283,2.8621599674224854,Sigmoid,34,464,20,0.0002759140355415296,1,0.3750437964584106,0.02096365633573226,1.0815510749816895,2.8621599674224854,0.0060996413230896,COMPLETE
284,0.7260255217552185,Sigmoid,41,474,21,0.00024345358089886474,1,0.7544214835353378,0.013247486122369262,5.902268409729004,0.7260255217552185,0.23784202337265015,COMPLETE
285,0.655832827091217,ReLU,39,457,24,0.00031610289281223063,1,0.7700499075725299,0.05176329030803603,1.4793609380722046,0.655832827091217,0.2598103880882263,COMPLETE
286,9.127152442932129,Sigmoid,36,445,22,0.0001664116431463941,1,0.1381635580629065,0.017595897394811186,1.0654560327529907,9.127152442932129,-0.22139239311218262,COMPLETE
287,0.6714315414428711,Tanh,35,493,23,0.0003992418266399079,1,0.7316290423078966,0.013965238558058016,2.489478349685669,0.6714315414428711,0.24247956275939941,COMPLETE
288,0.6661364436149597,Sigmoid,37,467,21,0.0002780511520349924,1,0.7687242682548028,0.01065446967049327,1.6288918256759644,0.6661364436149597,0.24818146228790283,COMPLETE
289,1.895844578742981,Sigmoid,39,233,22,0.000887461724248291,1,0.5592880059535722,0.008462882503722013,1.596806287765503,1.895844578742981,0.18862861394882202,COMPLETE
290,1.7371025085449219,Sigmoid,34,308,24,0.0005168491491950953,1,0.6342370104446413,0.015568713832332437,1.9056955575942993,1.7371025085449219,0.055296480655670166,COMPLETE
291,7.317392826080322,Sigmoid,32,454,23,0.00022153843243741183,1,0.21838915061712488,0.0111471850936783,1.9947172403335571,7.317392826080322,-0.08100152015686035,COMPLETE
292,1.8945399522781372,Sigmoid,42,441,20,0.00013820356444985601,1,0.6858648534479733,0.024862735986288124,1.5367858409881592,1.8945399522781372,-0.1686103343963623,COMPLETE
293,0.4819195866584778,Sigmoid,37,475,19,0.00033334464695315697,1,0.7998702369154271,0.0073228965602333655,1.2685869932174683,0.4819195866584778,0.25065159797668457,COMPLETE
294,0.670382022857666,Sigmoid,40,484,21,0.0002591171701965033,1,0.7300434998229215,0.00934271684490228,3.035306692123413,0.670382022857666,0.24366360902786255,COMPLETE
295,2.8029582500457764,Sigmoid,31,464,23,0.002719605283459216,1,0.6171228338533422,0.01319400108754237,3.510500907897949,2.8029582500457764,-0.5337352752685547,COMPLETE
296,3.351605176925659,Sigmoid,84,445,22,0.00018830213609935577,1,0.439945131506873,0.006282706533769039,22.00902557373047,3.351605176925659,-0.03932511806488037,COMPLETE
297,0.4695279896259308,Sigmoid,36,455,15,0.00037730203535730865,1,0.7992735224508661,0.01151747882551014,1.3782589435577393,0.4695279896259308,0.26991957426071167,COMPLETE
298,0.9603686928749084,Sigmoid,35,499,24,5.581696030121709e-05,1,0.7510700125227371,0.016761498307014722,3.7094197273254395,0.9603686928749084,-0.008163809776306152,COMPLETE
299,1.8767560720443726,Sigmoid,26,435,21,0.0004616991344915569,1,0.7117651261999851,0.020977146359152942,2.2179906368255615,1.8767560720443726,-0.1263059377670288,COMPLETE
300,2.9606375694274902,Sigmoid,33,471,23,0.0016181747121566596,1,0.4162042997185322,0.008247413278939082,4.058732032775879,2.9606375694274902,0.07367438077926636,COMPLETE
301,0.6453492045402527,Leaky,39,448,24,0.0003045774647981514,1,0.7540365287549488,0.009569681287696627,5.784064769744873,0.6453492045402527,0.32253342866897583,COMPLETE
302,0.636655330657959,Sigmoid,30,458,22,0.00022222976295256002,1,0.769690413963158,0.006668651991290697,1.8916354179382324,0.636655330657959,0.2814546227455139,COMPLETE
303,0.4559727907180786,Sigmoid,42,485,21,0.0006215347089527845,1,0.7721405277930556,0.013433154922906683,1.3048415184020996,0.4559727907180786,0.23507905006408691,COMPLETE
304,1.683371901512146,Sigmoid,41,475,20,0.000536072105331515,1,0.7044017212842236,0.013220701098871392,2.0540103912353516,1.683371901512146,-0.010249495506286621,COMPLETE
305,0.6733851432800293,Sigmoid,42,482,21,0.0006756836327680845,1,0.7369257885352658,0.0693399704683565,3.672132730484009,0.6733851432800293,0.24027550220489502,COMPLETE
306,1.6849464178085327,Sigmoid,38,490,21,0.00010886618665854653,1,0.669396559719818,0.017114961574727187,1.6986104249954224,1.6849464178085327,-0.08118581771850586,COMPLETE
307,2.1438064575195312,Sigmoid,42,484,14,0.0006560951848827274,1,0.3313980829229004,0.014694465553095445,1.2673760652542114,2.1438064575195312,0.24840104579925537,COMPLETE
308,3.511911392211914,ReLU,43,464,20,0.000828047168566483,1,0.41296728265000543,0.011438851425203464,2.5783190727233887,3.511911392211914,-0.11026322841644287,COMPLETE
309,3.2306246757507324,Sigmoid,40,493,21,0.01527270682249051,1,0.4754639265782476,0.018411153369605585,3.197354316711426,3.2306246757507324,0.0022582411766052246,COMPLETE
310,0.4362592101097107,Sigmoid,37,278,24,0.0004301648458068045,1,0.771593910074202,0.02281669967939438,1.322821021080017,0.4362592101097107,0.268149733543396,COMPLETE
311,7.0737128257751465,Sigmoid,37,451,24,0.0005885572658654485,1,0.19678722293751433,0.02339998857588416,2.5898985862731934,7.0737128257751465,-0.09176158905029297,COMPLETE
312,2.649024248123169,Tanh,36,266,24,0.000456566488556512,1,0.4855604312577668,0.02802976044271386,2.4805071353912354,2.649024248123169,0.18187886476516724,COMPLETE
313,2.402745246887207,Sigmoid,22,148,24,0.00036672553730978074,1,0.29109550262372613,0.01409786067669632,1.0287779569625854,2.402745246887207,-0.014614582061767578,COMPLETE
314,0.6630407571792603,Sigmoid,38,463,24,0.0010831951986675088,1,0.7645473358431077,0.020203625563631533,1.4598004817962646,0.6630407571792603,0.2516753077507019,COMPLETE
315,3.1971256732940674,Leaky,34,337,23,0.0013293565075974986,1,0.35141742956526134,1.6726526184691307e-05,2.7030107975006104,3.1971256732940674,-0.09500205516815186,COMPLETE
316,3.4450812339782715,Sigmoid,39,439,24,7.892395403971484e-05,1,0.45161334593867475,0.010876332748949318,1.0468684434890747,3.4450812339782715,-0.15683019161224365,COMPLETE
317,1.7456413507461548,Sigmoid,36,469,23,0.00041370835194573145,1,0.7241180627361135,0.029084336234855013,1.624794363975525,1.7456413507461548,0.017406344413757324,COMPLETE
318,0.6604223847389221,Sigmoid,38,499,19,0.0005472506706791846,1,0.7678834645629168,0.017141659543449053,1.5051202774047852,0.6604223847389221,0.25463050603866577,COMPLETE
319,0.8283657431602478,Sigmoid,33,419,20,0.00015953750432139006,1,0.7430638847817018,0.01321554763487013,2.628715753555298,0.8283657431602478,0.13040858507156372,COMPLETE
320,0.7273957133293152,Sigmoid,44,103,24,0.058844030620251266,1,0.7713468257238529,0.009355441399020866,1.9656445980072021,0.7273957133293152,0.17904269695281982,COMPLETE
321,3.7504425048828125,Sigmoid,40,204,21,0.0004025474455091155,1,0.5112655980796907,0.022271881671507534,4.590513706207275,3.7504425048828125,-0.11328661441802979,COMPLETE
322,1.893730878829956,Sigmoid,35,191,20,0.000201189992759944,1,0.6914002904659168,0.015241660794703191,1.283838152885437,1.893730878829956,-0.16811120510101318,COMPLETE
323,0.5632023215293884,Sigmoid,95,445,24,0.0007393239480976851,1,0.7998647399528178,0.011607258188321158,1.520757794380188,0.5632023215293884,0.12426304817199707,COMPLETE
324,0.8463651537895203,Sigmoid,37,456,1,0.0002522866037749076,1,0.7320414962699898,0.009961884055399526,4.7542195320129395,0.8463651537895203,0.04511648416519165,COMPLETE
325,0.6600545048713684,Sigmoid,28,477,23,0.000311560234041609,1,0.7673054733753638,0.006835472236948256,2.032017946243286,0.6600545048713684,0.25504571199417114,COMPLETE
326,2.8860063552856445,Sigmoid,32,487,21,0.00047058409116325177,1,0.4930009266126529,0.03280157506176547,3.167508602142334,2.8860063552856445,0.11861270666122437,COMPLETE
327,1.5684632062911987,Sigmoid,55,286,17,0.00035445399568748376,1,0.6613556982187841,0.012646091073759646,1.8325222730636597,1.5684632062911987,-0.006441593170166016,COMPLETE
328,2.0039565563201904,Leaky,68,441,24,4.297192412759978e-05,1,0.709375434835984,0.005191745435948971,1.190311074256897,2.0039565563201904,-0.2026432752609253,COMPLETE
329,3.386748790740967,Sigmoid,35,459,23,0.00017793619951390706,1,0.46221593306429176,0.01552172489271019,1.1238782405853271,3.386748790740967,-0.09060907363891602,COMPLETE
330,0.8100929260253906,Sigmoid,39,469,20,0.00013712618369859434,1,0.7708373818152096,0.008451698590357678,1.134507656097412,0.8100929260253906,0.08570855855941772,COMPLETE
331,1.9818474054336548,Sigmoid,41,451,22,0.00022881109943473666,1,0.27489429795745207,0.0010818662407922977,1.1824523210525513,1.9818474054336548,0.12604254484176636,COMPLETE
332,2.5836873054504395,Sigmoid,37,432,21,0.00028218049280592073,1,0.3854220054757018,0.020070138820418915,1.2164181470870972,2.5836873054504395,0.10280078649520874,COMPLETE
333,7.138027191162109,ReLU,44,358,24,0.00035912180557188855,1,0.23172436932865673,0.01237403713488414,1.096013069152832,7.138027191162109,-0.06792151927947998,COMPLETE
334,0.6357757449150085,Sigmoid,33,461,23,0.00050422518739162,1,0.7390125912386136,0.040178892953536854,3.1793534755706787,0.6357757449150085,0.2827070355415344,COMPLETE
335,0.53072589635849,Sigmoid,60,481,22,0.0006316578459787956,1,0.7771482746609022,0.010600656506060107,1.4721966981887817,0.53072589635849,0.1096763014793396,COMPLETE
336,0.572201132774353,Tanh,31,447,21,0.00025285430848496495,1,0.7985277273214301,0.01611857911244191,1.5242035388946533,0.572201132774353,0.11027055978775024,COMPLETE
337,0.6924197673797607,Sigmoid,35,421,23,0.0003134002632588826,1,0.7526339394480087,0.007564087731668746,5.993415832519531,0.6924197673797607,0.2731202244758606,COMPLETE
338,1.978975534439087,Sigmoid,53,437,24,0.0002006065437675244,1,0.7174471442085043,0.0041832500088174185,1.3322889804840088,1.978975534439087,-0.11393380165100098,COMPLETE
339,0.448888897895813,Sigmoid,58,313,19,0.0004522877756223259,1,0.7993483972067421,4.2310401751545754e-05,1.1560739278793335,0.448888897895813,0.30201178789138794,COMPLETE
340,0.6526260375976562,Sigmoid,56,280,21,0.00045281482322563914,1,0.7463566277233886,4.4097717637989806e-05,5.751389026641846,0.6526260375976562,0.3148943781852722,COMPLETE
341,2.3593811988830566,Sigmoid,62,304,18,0.0010167432742283417,1,0.4040018532457696,0.00040709757912617685,1.6614521741867065,2.3593811988830566,0.25410014390945435,COMPLETE
342,8.71847915649414,Leaky,57,273,18,0.0005373585168694544,1,0.12926905879745154,2.778413097360328e-05,1.2786601781845093,8.71847915649414,-0.1667039394378662,COMPLETE
343,1.5855469703674316,Sigmoid,25,247,19,0.00039836115270245015,1,0.689559351835327,0.00017548370757205034,1.4954612255096436,1.5855469703674316,0.021986007690429688,COMPLETE
344,2.1698265075683594,Sigmoid,59,490,19,9.123484520878084e-05,1,0.6265248080248385,2.3872895472047446e-05,1.283944010734558,2.1698265075683594,-0.18729543685913086,COMPLETE
345,0.5258026123046875,Sigmoid,57,477,17,0.00040398991901076874,1,0.7722630144413283,1.4826058799428491e-05,1.578118085861206,0.5258026123046875,0.1179354190826416,COMPLETE
346,0.6897261738777161,Sigmoid,59,469,20,0.0031736625398193718,1,0.7720409495158632,0.0009735152577640659,1.6221967935562134,0.6897261738777161,-0.15705597400665283,COMPLETE
347,0.6361454129219055,Sigmoid,52,317,20,0.0007104143200999286,1,0.7333106758261049,1.111873223634774e-05,4.111941337585449,0.6361454129219055,0.282289981842041,COMPLETE
348,0.46357759833335876,Sigmoid,19,295,19,0.0003351465403096056,1,0.7970466247265785,0.0014040135735376364,1.1655023097991943,0.46357759833335876,0.27917200326919556,COMPLETE
349,1.918955683708191,Sigmoid,45,457,18,0.0004874310441729137,1,0.5609438142423447,0.0007653421932629247,1.442386507987976,1.918955683708191,0.17873769998550415,COMPLETE
350,1.7355995178222656,Sigmoid,40,484,24,0.0005994084432085769,1,0.7154997781360923,0.00021014154591363144,1.8157784938812256,1.7355995178222656,0.023058712482452393,COMPLETE
351,1.924888253211975,Sigmoid,54,324,24,0.0019458624501838694,1,0.5957568151881825,0.09648459468428115,2.8538379669189453,1.924888253211975,-0.10409581661224365,COMPLETE
352,0.661861777305603,Sigmoid,29,499,23,0.00030119090080470097,1,0.7504454590845193,0.02708185384151858,6.2956013679504395,0.661861777305603,0.3051990270614624,COMPLETE
353,0.46067631244659424,Sigmoid,38,258,21,0.00037300491318763035,1,0.7999075030535954,1.1236528488302517e-05,1.104992389678955,0.46067631244659424,0.28368324041366577,COMPLETE
354,7.306792736053467,Leaky,33,469,19,0.0002511834231169034,1,0.18952703022076703,0.0034382306982753946,2.2697031497955322,7.306792736053467,-0.12773525714874268,COMPLETE
355,0.8189196586608887,Sigmoid,43,452,20,0.0001598142933414152,1,0.7672918396191434,0.0011268876514967238,1.333896279335022,0.8189196586608887,0.07574641704559326,COMPLETE
356,3.0067381858825684,Sigmoid,36,234,23,0.00029234951275139095,1,0.36005885743193006,1.3239266202045512e-05,1.0301817655563354,3.0067381858825684,-0.041754841804504395,COMPLETE
357,3.3497684001922607,ReLU,71,120,21,0.00043392161132877464,1,0.44078697856961696,0.00010401971887208626,26.4039249420166,3.3497684001922607,-0.03875553607940674,COMPLETE
358,8.108843803405762,Sigmoid,46,476,3,0.0001231984343771832,1,0.25666748885792695,0.0007798964232481447,1.07297682762146,8.108843803405762,-0.2181612253189087,COMPLETE
359,2.991694688796997,Sigmoid,41,461,24,0.0008695769314091311,1,0.5012207079973431,3.8319978504599386e-05,18.88408660888672,2.991694688796997,0.11194115877151489,COMPLETE
360,2.655576467514038,Sigmoid,34,429,22,0.00019508903142690287,1,0.33366936890736165,0.00477937660694342,1.0334208011627197,2.655576467514038,0.06897914409637451,COMPLETE
361,1.682106852531433,Tanh,39,492,21,0.010483078384436547,1,0.6905692574287627,0.013590639775798066,2.1976866722106934,1.682106852531433,-0.0375751256942749,COMPLETE
362,7.293310642242432,Sigmoid,31,348,24,0.00034067067374710173,1,0.21573494622845765,0.018822246703275456,1.8350841999053955,7.293310642242432,-0.07744383811950684,COMPLETE
363,0.48301413655281067,Sigmoid,36,367,16,0.00022524432972548415,1,0.7987023210039927,0.00030530643573215184,1.0603574514389038,0.48301413655281067,0.24894964694976807,COMPLETE
364,1.1237576007843018,Sigmoid,23,407,22,1.0917370652026367e-05,1,0.7446379522974002,0.0004034051654271307,6.23468017578125,1.1237576007843018,-0.17968416213989258,COMPLETE
365,0.7270596027374268,Sigmoid,49,465,23,0.00028614095203140233,1,0.7705513769158691,0.0013623704519792749,2.0404610633850098,0.7270596027374268,0.17942208051681519,COMPLETE
366,3.322187662124634,Sigmoid,34,448,20,2.3231200576844604e-05,1,0.568966657790971,4.8819017232152176e-05,1.262772798538208,3.322187662124634,-0.42180848121643066,COMPLETE
367,1.860497236251831,Sigmoid,64,246,21,0.00040991330408319057,1,0.7177556194835667,0.0029446851682517934,1.2114976644515991,1.860497236251831,-0.04724431037902832,COMPLETE
368,0.6658176183700562,Sigmoid,38,478,23,0.0005393588629068259,1,0.7517599419593427,0.006211223752468829,4.182854175567627,0.6658176183700562,0.30104631185531616,COMPLETE
369,2.400423765182495,Leaky,41,442,24,0.00017456076130018745,1,0.3818497801735197,0.023440039970981697,1.4601315259933472,2.400423765182495,0.16644006967544556,COMPLETE
370,1.4376473426818848,Sigmoid,47,455,22,0.0002453123398328226,1,0.6491326393524766,0.00014385205443291074,1.744900107383728,1.4376473426818848,0.050279319286346436,COMPLETE
371,2.3493313789367676,Sigmoid,44,433,21,0.00034661866549269994,1,0.36686755152200784,0.010842446146039615,1.2008570432662964,2.3493313789367676,0.1860191822052002,COMPLETE
372,6.546197891235352,Sigmoid,27,420,23,0.0012200988000288112,1,0.18182477762764784,0.015421291841961383,2.0746262073516846,6.546197891235352,-0.09643340110778809,COMPLETE
373,2.426208257675171,Sigmoid,36,485,17,0.0006479422007106868,1,0.42553303191055847,0.012394868905190442,2.6420600414276123,2.426208257675171,0.2408868670463562,COMPLETE
374,0.4608197510242462,Sigmoid,39,469,24,0.0002798863830845997,1,0.7997119750297216,3.0052907838432938e-05,1.2770510911941528,0.4608197510242462,0.28346019983291626,COMPLETE
375,0.6898983716964722,Sigmoid,32,460,20,0.00021315184609901474,1,0.7677147318408298,1.763636838736094e-05,1.4368987083435059,0.6898983716964722,0.2213631272315979,COMPLETE
376,1.924001693725586,Sigmoid,35,474,22,0.00046522088531798463,1,0.3165417999866883,0.0005596164302017806,1.4564704895019531,1.924001693725586,0.2826785445213318,COMPLETE
377,1.799095630645752,Sigmoid,21,439,21,0.00036751350014253283,1,0.2997900080452851,0.009414133630411856,1.271357536315918,1.799095630645752,0.24029046297073364,COMPLETE
378,1.8916215896606445,Sigmoid,37,500,24,0.00014695091246237188,1,0.7237913863667222,0.00010034358794924773,1.4160670042037964,1.8916215896606445,-0.06476366519927979,COMPLETE
379,0.683776319026947,Sigmoid,43,451,21,0.0002760127015224904,1,0.7690050207696397,0.0035338478967261795,1.66628897190094,0.683776319026947,0.2282726764678955,COMPLETE
