number,value,params_activation_1,params_activation_2,params_activation_3,params_batch_size,params_epochs,params_layer_1,params_layer_2,params_layer_3,params_learning_rate,params_num_layers,params_train_size,params_weight_decay,user_attrs_mape,user_attrs_mse,user_attrs_r2,state
451,-0.32613980770111084,Sigmoid,,,42,491,14,,,0.009417479342874065,1,0.3884632688215588,0.00010367984014231305,2.251953363418579,1.166420817375183,-0.32613980770111084,COMPLETE
452,0.22916346788406372,Sigmoid,ReLU,Sigmoid,39,478,13,11.0,22.0,0.0007612988837878043,3,0.42766702141140805,0.0011477961667895418,1.9261072874069214,0.6863521337509155,0.22916346788406372,COMPLETE
453,0.4135082960128784,Sigmoid,Sigmoid,,27,75,14,10.0,,0.045519397836095994,2,0.6954983209625123,9.307344134912685e-05,0.8122875690460205,0.49746227264404297,0.4135082960128784,COMPLETE
454,0.29893070459365845,Sigmoid,ReLU,Sigmoid,37,413,11,12.0,21.0,0.0055147827219635985,3,0.6655356132732744,1.0059640826647179e-05,1.2015318870544434,0.5601804852485657,0.29893070459365845,COMPLETE
455,0.45608747005462646,Leaky,ReLU,ReLU,58,426,13,13.0,22.0,0.012053249656699115,3,0.7254797386551015,0.0006762073444909559,1.2062709331512451,0.5094738006591797,0.45608747005462646,COMPLETE
456,-0.29683220386505127,Sigmoid,ReLU,Sigmoid,49,384,16,1.0,12.0,0.058761546773908914,3,0.45756867073870233,0.0005274648038251215,1.0000029802322388,1.127272129058838,-0.29683220386505127,COMPLETE
457,-0.11186575889587402,Sigmoid,Sigmoid,ReLU,41,403,17,10.0,23.0,5.602822594596041e-05,3,0.24284527389016963,0.0008657172455300152,1.039943814277649,1.6816705465316772,-0.11186575889587402,COMPLETE
458,0.6034018993377686,Sigmoid,ReLU,Sigmoid,47,448,12,13.0,20.0,0.07698016849264513,3,0.7705473419310245,0.00041656640839516913,1.210738182067871,0.3553735315799713,0.6034018993377686,COMPLETE
459,-0.3238193988800049,Sigmoid,Leaky,ReLU,39,500,15,23.0,21.0,0.004340015586065841,3,0.2817246468074185,2.9265440621466158e-05,3.5667901039123535,1.1796576976776123,-0.3238193988800049,COMPLETE
460,0.3667060136795044,Tanh,ReLU,Sigmoid,29,111,14,9.0,22.0,0.02774814162246365,3,0.6259241314635018,0.00150141458299532,1.0408012866973877,0.5367879271507263,0.3667060136795044,COMPLETE
461,0.3374252915382385,Sigmoid,Tanh,ReLU,44,460,13,7.0,23.0,0.0008762751922745524,3,0.7486179175440729,0.0002860443551154044,10.248287200927734,0.6020893454551697,0.3374252915382385,COMPLETE
462,0.47038090229034424,Sigmoid,ReLU,Sigmoid,34,485,15,12.0,24.0,0.007415802615442339,3,0.7066590975112028,0.000743478006302518,0.9440465569496155,0.46939969062805176,0.47038090229034424,COMPLETE
463,0.4333398938179016,Sigmoid,Sigmoid,Sigmoid,42,438,12,10.0,19.0,0.01061017158387863,3,0.7999593885101063,0.0010612895522707849,0.8644744157791138,0.5005269646644592,0.4333398938179016,COMPLETE
464,-0.2895631790161133,Sigmoid,ReLU,ReLU,77,474,13,18.0,1.0,0.013633768307828805,3,0.1104049317068433,4.3984570257695704e-05,1.0,1.3608570098876953,-0.2895631790161133,COMPLETE
465,-0.19378662109375,ReLU,ReLU,Sigmoid,54,492,16,3.0,21.0,0.052149070302965804,3,0.22286337886714877,0.0006062703004333624,2.8449230194091797,1.835509181022644,-0.19378662109375,COMPLETE
466,-0.008867979049682617,Sigmoid,ReLU,Leaky,32,469,22,15.0,22.0,0.01722655515887284,3,0.484228175624529,0.002509680275684892,7.595479488372803,0.924802839756012,-0.008867979049682617,COMPLETE
467,-1.7718837261199951,Sigmoid,Sigmoid,ReLU,38,268,14,13.0,21.0,0.008436890379411189,3,0.2330166746556141,0.0009553401402153386,3.7609105110168457,4.192408561706543,-1.7718837261199951,COMPLETE
468,0.279361367225647,Sigmoid,ReLU,Sigmoid,40,481,18,5.0,22.0,0.0005161548746872865,3,0.33330147255163495,0.0004791428864086384,1.51222825050354,0.7853384613990784,0.279361367225647,COMPLETE
469,0.5230008363723755,Sigmoid,Leaky,Tanh,36,461,11,14.0,13.0,0.06702275531654514,3,0.7693898736556475,0.0012698891941140065,0.8978962898254395,0.4274172782897949,0.5230008363723755,COMPLETE
470,0.4546610116958618,Sigmoid,ReLU,ReLU,45,453,17,14.0,23.0,0.006496775044739501,3,0.6101947170253709,0.00017344003928632663,1.112513542175293,0.4947708547115326,0.4546610116958618,COMPLETE
471,0.3990784287452698,Sigmoid,ReLU,Sigmoid,40,476,14,21.0,16.0,0.08619926278401054,3,0.7258009528755925,0.0007797585151024925,1.5165879726409912,0.5628732442855835,0.3990784287452698,COMPLETE
472,0.44559788703918457,Sigmoid,Sigmoid,ReLU,31,487,13,11.0,22.0,0.04449716663103677,3,0.6839940189027944,0.00036593817076890895,0.9774785041809082,0.4701562523841858,0.44559788703918457,COMPLETE
473,0.3273116946220398,Sigmoid,ReLU,Sigmoid,42,467,12,13.0,20.0,0.03697253232026341,3,0.7484783263202462,0.0006511785997855427,5.071882247924805,0.6112797260284424,0.3273116946220398,COMPLETE
474,0.3039272427558899,Sigmoid,ReLU,Sigmoid,96,493,13,15.0,21.0,0.01039364748483291,3,0.7778106522147408,0.0031186205748721086,0.9667871594429016,0.5860646367073059,0.3039272427558899,COMPLETE
475,0.45994120836257935,Sigmoid,ReLU,ReLU,37,443,15,10.0,14.0,0.014808469237102252,3,0.7216534341792832,0.00013428190576813537,1.6739323139190674,0.5058640837669373,0.45994120836257935,COMPLETE
476,0.05981999635696411,Sigmoid,Sigmoid,Sigmoid,34,481,12,9.0,22.0,0.0033258202115576136,3,0.29587971960095366,5.469770798900848e-05,2.805877685546875,0.8541500568389893,0.05981999635696411,COMPLETE
477,0.08340811729431152,Sigmoid,ReLU,ReLU,38,327,16,14.0,20.0,0.00019443181262688422,3,0.6610572993535287,0.0005135892610822475,1.3386526107788086,0.7323911190032959,0.08340811729431152,COMPLETE
478,0.40169018507003784,Sigmoid,Leaky,Sigmoid,44,500,13,11.0,24.0,0.0020398743772500187,3,0.7534887837248051,0.0009141308585460278,8.89834976196289,0.543691098690033,0.40169018507003784,COMPLETE
479,0.49177759885787964,Sigmoid,ReLU,ReLU,42,473,15,12.0,21.0,0.056970171395361,3,0.6948581396375358,1.8510193876925718e-05,0.9516391754150391,0.43107426166534424,0.49177759885787964,COMPLETE
480,-0.33977699279785156,Leaky,ReLU,Sigmoid,47,457,12,6.0,23.0,0.07189743382761397,3,0.5084691748205676,0.004256425092687569,7.386646270751953,1.2443307638168335,-0.33977699279785156,COMPLETE
481,-0.8120371103286743,Tanh,Sigmoid,ReLU,40,485,14,2.0,15.0,0.001762710187805797,3,0.11460282296958378,0.0006929411946294964,3.100565195083618,1.8933137655258179,-0.8120371103286743,COMPLETE
482,0.4834604859352112,Sigmoid,ReLU,Sigmoid,36,465,13,8.0,21.0,0.02041253532509233,3,0.772682143732082,0.0004071896928877824,0.8591266870498657,0.4349050521850586,0.4834604859352112,COMPLETE
483,0.07020509243011475,Sigmoid,ReLU,,29,475,11,10.0,,0.009153815543637072,2,0.3511958401216316,1.3135025084729186e-05,6.5902323722839355,1.0359097719192505,0.07020509243011475,COMPLETE
484,0.48502326011657715,Sigmoid,ReLU,ReLU,33,433,10,13.0,22.0,0.006372259297621349,3,0.7276819327817595,0.0002572943907401985,0.7241664528846741,0.48237013816833496,0.48502326011657715,COMPLETE
485,0.21504884958267212,Sigmoid,Tanh,Sigmoid,61,492,14,14.0,20.0,0.0049538642623603414,3,0.7737888698811695,0.010588190221548688,1.4660232067108154,0.6608965992927551,0.21504884958267212,COMPLETE
486,0.3857530355453491,Sigmoid,Sigmoid,ReLU,38,450,17,15.0,23.0,0.0884835412416643,3,0.5868154390797985,0.0017175908588125208,1.7505732774734497,0.5272802114486694,0.3857530355453491,COMPLETE
487,0.4711619019508362,Sigmoid,ReLU,Sigmoid,43,480,16,6.0,22.0,0.012100127264520272,3,0.7986507109930542,0.001208704029686553,0.9945765733718872,0.4671190083026886,0.4711619019508362,COMPLETE
488,-0.40373754501342773,Sigmoid,Leaky,Sigmoid,46,463,13,13.0,21.0,0.04673971438331997,3,0.3719642591067466,0.0008025979697308338,11.419198989868164,1.1802183389663696,-0.40373754501342773,COMPLETE
489,0.5974582433700562,Sigmoid,ReLU,ReLU,41,487,14,16.0,22.0,0.003893530517724952,3,0.7421810086244579,7.266834038392935e-05,1.9446808099746704,0.3461841642856598,0.5974582433700562,COMPLETE
490,0.07616841793060303,Sigmoid,ReLU,Sigmoid,35,471,18,10.0,21.0,0.0011952164000199853,3,0.27261364625808016,0.0005947332796467853,5.317862033843994,0.8232278823852539,0.07616841793060303,COMPLETE
491,-1.0347635746002197,Sigmoid,Sigmoid,Leaky,39,184,12,9.0,21.0,0.023885602468789926,3,0.19345751689952564,2.2951136688861975e-05,2.9187049865722656,2.8930907249450684,-1.0347635746002197,COMPLETE
492,-2.5678253173828125,ReLU,ReLU,ReLU,44,459,15,11.0,23.0,0.03040318169369691,3,0.12524672016924432,0.0010494630442842705,3.9771666526794434,3.7278554439544678,-2.5678253173828125,COMPLETE
493,-0.3045145273208618,Sigmoid,ReLU,Sigmoid,31,373,16,1.0,19.0,0.002850634089300248,3,0.692825832285963,0.0005162532496496701,1.0137397050857544,1.1064893007278442,-0.3045145273208618,COMPLETE
494,0.02482837438583374,Sigmoid,ReLU,ReLU,27,493,13,4.0,13.0,0.0009636340895073593,3,0.17333594746543513,0.0003302907241686423,1.844763994216919,1.3011982440948486,0.02482837438583374,COMPLETE
495,0.061950623989105225,Sigmoid,ReLU,Sigmoid,49,480,12,14.0,22.0,0.09997959874843784,3,0.6522579571397434,0.00019518496427652234,2.6013171672821045,0.7176040410995483,0.061950623989105225,COMPLETE
496,-0.14953923225402832,Sigmoid,Sigmoid,ReLU,17,446,13,22.0,23.0,0.008279955779724246,3,0.31221569175636193,0.0008717804946843915,2.848289966583252,1.113892912864685,-0.14953923225402832,COMPLETE
497,0.49825960397720337,Sigmoid,Leaky,Tanh,52,468,14,12.0,22.0,0.06400363129092304,3,0.715971661439833,0.0006839398991270915,1.0948445796966553,0.4699718952178955,0.49825960397720337,COMPLETE
498,0.3558192849159241,Sigmoid,ReLU,Sigmoid,41,484,13,13.0,21.0,0.001516084800671905,3,0.4904817755257906,0.0013854490883628526,2.2038490772247314,0.5750428438186646,0.3558192849159241,COMPLETE
499,0.5754894018173218,Sigmoid,ReLU,ReLU,38,456,15,14.0,20.0,0.01628059149145,3,0.7405499234227663,0.0010241497351231791,1.5056930780410767,0.36507728695869446,0.5754894018173218,COMPLETE
