number,value,params_activation_1,params_batch_size,params_epochs,params_layer_1,params_learning_rate,params_num_layers,params_train_size,params_weight_decay,user_attrs_mape,user_attrs_mse,user_attrs_r2,state
903,0.9355039596557617,ReLU,54,217,22,1.648162879559403e-05,1,0.7610316002622076,9.169142040028927e-05,1.2550921440124512,0.9355039596557617,0.10227203369140625,COMPLETE
904,0.6249532103538513,ReLU,64,181,21,0.001956710607151999,1,0.7162456562267584,0.006994216947922254,1.2369322776794434,0.6249532103538513,0.3637293577194214,COMPLETE
905,0.6332824230194092,Tanh,61,278,20,0.018902205711605707,1,0.616207187857873,0.0014417109749533714,1.632514476776123,0.6332824230194092,0.4221022129058838,COMPLETE
906,0.6695656776428223,ReLU,59,243,21,0.0055639586343677674,1,0.2825772706562982,0.0006388531744036689,2.040922164916992,0.6695656776428223,0.32015931606292725,COMPLETE
907,0.9920362830162048,ReLU,64,262,22,1.0664978250067718e-05,1,0.7972000310220947,0.03125260540895977,1.2658631801605225,0.9920362830162048,0.0458638072013855,COMPLETE
908,0.8105273842811584,ReLU,56,232,21,0.002469107537483175,1,0.10078151616501209,0.0007306086066813579,3.0162079334259033,0.8105273842811584,0.10794270038604736,COMPLETE
909,0.6218670010566711,ReLU,76,173,20,0.008841178074081593,1,0.6838125403560557,0.001121782586935334,1.6177467107772827,0.6218670010566711,0.3571024537086487,COMPLETE
910,0.6035978198051453,ReLU,62,222,21,0.0010607298954639804,1,0.6545236762790944,0.0004441269084200767,1.1785986423492432,0.6035978198051453,0.39039379358291626,COMPLETE
911,0.7898772358894348,ReLU,58,256,22,0.0037091858272174085,1,0.2125145285876149,0.0002955384782178353,2.721522331237793,0.7898772358894348,0.2016701102256775,COMPLETE
912,0.6396642327308655,Leaky,60,270,21,0.006299686408758024,1,0.3452666076298784,0.0018233729501075102,4.701956748962402,0.6396642327308655,0.3919735550880432,COMPLETE
913,0.8170209527015686,ReLU,52,146,22,3.849705509245122e-05,1,0.7060419045464149,0.0005434964622800808,1.2180558443069458,0.8170209527015686,0.16532105207443237,COMPLETE
914,0.7949091792106628,ReLU,65,436,21,1.005906941086354e-05,1,0.7420577050443197,0.00023702734267109707,1.1928743124008179,0.7949091792106628,0.19380474090576172,COMPLETE
915,0.7258145809173584,ReLU,63,206,23,0.0013502074886760347,1,0.4573490350291011,0.055653942361659166,1.3791391849517822,0.7258145809173584,0.30355823040008545,COMPLETE
916,0.6156061291694641,ReLU,56,246,20,0.01183375459939044,1,0.630085715536741,0.0009504414613731517,1.8136862516403198,0.6156061291694641,0.4077877402305603,COMPLETE
917,0.7970755100250244,ReLU,61,240,21,2.6875404030726924e-05,1,0.3876126288554816,0.00034665356331220915,1.2547414302825928,0.7970755100250244,0.222082257270813,COMPLETE
918,0.7010841965675354,ReLU,66,224,22,0.023182598031676438,1,0.2493098316743373,4.812217098156972e-05,2.5417559146881104,0.7010841965675354,0.3189404606819153,COMPLETE
919,0.6648181676864624,ReLU,59,197,20,0.06761827079133499,1,0.6680562199799712,0.0006279754535608514,1.537174940109253,0.6648181676864624,0.31442511081695557,COMPLETE
920,0.8956303000450134,Sigmoid,64,214,21,0.0001155675688248405,1,0.5911279163522485,0.05073530725996861,1.0653084516525269,0.8956303000450134,0.1570006012916565,COMPLETE
921,0.5859775543212891,ReLU,62,288,22,0.004428111702863219,1,0.6915471026085959,1.0300202176082807e-05,1.4873483180999756,0.5859775543212891,0.3939809799194336,COMPLETE
922,0.6267861127853394,ReLU,57,256,23,0.0076049175306319656,1,0.6566357437205836,0.0008039777325609921,1.5939375162124634,0.6267861127853394,0.3709375858306885,COMPLETE
923,0.6118165850639343,ReLU,65,235,20,0.003295515081610816,1,0.6226420358745051,0.00019166745975535018,1.778739333152771,0.6118165850639343,0.41471415758132935,COMPLETE
924,0.8054267764091492,ReLU,61,265,19,0.005469474829932642,1,0.13702075886618756,0.0004383911737883639,2.2237930297851562,0.8054267764091492,0.11916923522949219,COMPLETE
925,0.7510140538215637,ReLU,71,277,15,0.00029185844889780904,1,0.2426660487205875,0.0012525917124128593,4.963951110839844,0.7510140538215637,0.25203967094421387,COMPLETE
926,0.5982639789581299,ReLU,59,253,21,0.0006548040176136505,1,0.7221916130453776,0.004108733978273443,1.2893081903457642,0.5982639789581299,0.362484872341156,COMPLETE
927,0.8200597167015076,ReLU,68,231,22,0.009167108195319353,1,0.17417264569736693,0.0005244790302703739,1.8371566534042358,0.8200597167015076,0.17296576499938965,COMPLETE
928,0.6286911368370056,ReLU,54,246,21,0.0065050205389229,1,0.2957362710183162,3.055931993208255e-05,29.677196502685547,0.6286911368370056,0.3604651689529419,COMPLETE
929,0.7323059439659119,Tanh,64,215,21,0.00015153602852023505,1,0.6463032796226936,0.00014230555433179698,1.1488150358200073,0.7323059439659119,0.24831336736679077,COMPLETE
930,0.6639917492866516,ReLU,62,204,22,0.002801253810953468,1,0.26714829205105384,5.826048084953078e-05,1.7443329095840454,0.6639917492866516,0.3500743508338928,COMPLETE
931,0.6153769493103027,ReLU,58,270,20,0.004114712630819391,1,0.6805135211862164,0.002250162532633183,1.3560034036636353,0.6153769493103027,0.37067294120788574,COMPLETE
932,0.6866453289985657,ReLU,74,224,21,0.00033076471137383846,1,0.41319452634928744,1.4364080944838523e-05,1.3095483779907227,0.6866453289985657,0.33367300033569336,COMPLETE
933,0.8251350522041321,ReLU,66,238,17,9.433968718493582e-05,1,0.6022721755325179,0.00036989509236817156,1.262831211090088,0.8251350522041321,0.2307378649711609,COMPLETE
934,0.6363470554351807,ReLU,60,260,22,0.005186712960462233,1,0.45725152278109166,0.0007070805643958199,1.9649930000305176,0.6363470554351807,0.38940513134002686,COMPLETE
935,0.7416028380393982,ReLU,63,247,20,0.00020239420242572985,1,0.18110063034963128,0.03686134628186138,1.4219809770584106,0.7416028380393982,0.2474563717842102,COMPLETE
936,0.7478035688400269,Leaky,67,229,23,0.015062782749760698,1,0.1935427758084095,1.8283247759744843e-05,4.080626010894775,0.7478035688400269,0.22478115558624268,COMPLETE
937,0.6252366900444031,ReLU,56,280,21,0.007035176144830331,1,0.7499538269496595,0.0003046529649088267,1.5086790323257446,0.6252366900444031,0.38033872842788696,COMPLETE
938,0.8957895636558533,ReLU,61,212,2,0.00010611749554483986,1,0.7043412116768163,0.001026945534307259,1.1881160736083984,0.8957895636558533,0.08421635627746582,COMPLETE
939,0.6995468735694885,ReLU,70,419,21,0.05288892317010256,1,0.5650026574213912,0.000261921583599272,2.2820940017700195,0.6995468735694885,0.3348500728607178,COMPLETE
940,0.5822288990020752,ReLU,65,237,22,0.004671299176625131,1,0.6332238534888105,0.001425652248383035,1.6207678318023682,0.5822288990020752,0.4312572479248047,COMPLETE
941,0.7201554775238037,ReLU,58,265,21,0.00017562539205011468,1,0.6739609467419324,0.06405299224518947,1.1406059265136719,0.7201554775238037,0.2685707211494446,COMPLETE
942,0.7947360873222351,ReLU,60,161,24,0.010735700752090687,1,0.22428287610461375,0.0008743887872857133,5.655782699584961,0.7947360873222351,0.22555387020111084,COMPLETE
943,0.5686843395233154,ReLU,63,196,22,0.008521849784163643,1,0.6532325396131086,0.00012701581666315698,1.331611156463623,0.5686843395233154,0.4230002760887146,COMPLETE
944,0.6247701644897461,ReLU,72,186,23,0.012407138118911564,1,0.6131137646228617,0.00012037845811669212,1.6465932130813599,0.6247701644897461,0.426078736782074,COMPLETE
945,0.6605814099311829,Sigmoid,63,191,23,0.009223241633506435,1,0.12224879510501348,0.0001844709705815283,2.1457979679107666,0.6605814099311829,0.25511693954467773,COMPLETE
946,0.7000625133514404,ReLU,67,177,24,0.00826170581340652,1,0.5293364925067181,0.0001469733101601998,2.001337766647339,0.7000625133514404,0.3219051957130432,COMPLETE
947,0.6146450638771057,ReLU,57,196,22,0.03150316378935881,1,0.6520399334674812,0.00020251284819637378,1.3859760761260986,0.6146450638771057,0.37321197986602783,COMPLETE
948,0.6571974754333496,ReLU,55,185,22,0.010998943504857963,1,0.4850919249572375,7.232691880924101e-05,2.3349180221557617,0.6571974754333496,0.3716668486595154,COMPLETE
949,0.6484686732292175,ReLU,62,202,23,0.00816569212870934,1,0.5900089304817833,0.000247467084082474,1.9548213481903076,0.6484686732292175,0.3879876136779785,COMPLETE
950,0.6148853898048401,ReLU,65,199,22,0.0017841420472778347,1,0.6314219837136641,0.00015327952136974017,1.5313602685928345,0.6148853898048401,0.4113665223121643,COMPLETE
951,0.6879871487617493,ReLU,59,196,22,0.00043625437537270684,1,0.39597042617220113,0.00011061959362120463,1.5546201467514038,0.6879871487617493,0.3293997049331665,COMPLETE
952,0.6928101181983948,ReLU,68,211,23,0.009976815014184981,1,0.2589477669905635,0.00022998386365784396,3.1135380268096924,0.6928101181983948,0.3155791759490967,COMPLETE
953,0.6395611763000488,ReLU,64,177,22,0.0067412889533524575,1,0.3772021935752223,0.0001677159668795826,2.3556857109069824,0.6395611763000488,0.37730705738067627,COMPLETE
954,0.5983040928840637,ReLU,61,192,22,0.00235878572679331,1,0.6567860082367755,0.00030853516684807764,1.323980689048767,0.5983040928840637,0.3995230197906494,COMPLETE
955,0.7073237895965576,Tanh,53,202,23,0.0011665830120201946,1,0.7990105293483197,8.012751066889052e-05,1.3962945938110352,0.7073237895965576,0.3176501393318176,COMPLETE
956,1.0880131721496582,ReLU,70,205,22,1.4991742683981584e-05,1,0.14726224440588398,0.000363095749216397,2.1210129261016846,1.0880131721496582,-0.13147926330566406,COMPLETE
957,0.7223363518714905,ReLU,12,180,21,0.00016825042151700896,1,0.5727220510710206,0.0004264114240694738,1.204724907875061,0.7223363518714905,0.32706785202026367,COMPLETE
958,0.6457615494728088,ReLU,63,218,22,0.007916690281933212,1,0.5085721275907891,0.00020339281756588272,1.6478139162063599,0.6457615494728088,0.3667442202568054,COMPLETE
959,0.7115209698677063,ReLU,60,193,21,0.006103103894033254,1,0.7048741954254506,0.05145743577665688,1.1927708387374878,0.7115209698677063,0.2695063352584839,COMPLETE
960,0.6434164047241211,ReLU,58,212,21,0.014300770345478128,1,0.7427738467826979,0.009117127875560849,1.2614126205444336,0.6434164047241211,0.3486310839653015,COMPLETE
961,0.6314626932144165,Leaky,66,185,22,0.0033635931338829596,1,0.6110031237795384,9.470686077926885e-05,1.4711577892303467,0.6314626932144165,0.421653687953949,COMPLETE
962,0.6634202599525452,ReLU,61,222,20,0.008534931279398847,1,0.6817130313244405,0.0002604517658600295,1.5169808864593506,0.6634202599525452,0.32307541370391846,COMPLETE
963,0.722192645072937,ReLU,55,170,23,0.09310451280912496,1,0.33902228754180647,6.18553979329541e-05,2.610306978225708,0.722192645072937,0.3167387843132019,COMPLETE
964,0.5711408853530884,ReLU,65,207,21,0.007046728577701294,1,0.6424116629370753,0.00013560173162049306,1.8363465070724487,0.5711408853530884,0.41207945346832275,COMPLETE
965,0.6116626858711243,ReLU,69,206,22,0.010569797765187829,1,0.7207900270411852,0.00011417425358843441,1.2947996854782104,0.6116626858711243,0.3694770336151123,COMPLETE
966,0.8475655317306519,ReLU,66,216,20,0.005770143946776395,1,0.11060888807427505,9.306652079439217e-05,2.85182523727417,0.8475655317306519,0.049941301345825195,COMPLETE
967,0.5997514724731445,ReLU,67,202,21,0.019118326757882716,1,0.659946691343172,0.00014438995919807375,1.4496142864227295,0.5997514724731445,0.3828080892562866,COMPLETE
968,0.7220792770385742,ReLU,65,212,21,0.002081395398274843,1,0.10714841795833088,0.00011450556328778121,2.726644992828369,0.7220792770385742,0.20187592506408691,COMPLETE
969,0.6548318862915039,ReLU,50,221,21,0.0003870155083103026,1,0.6918612182955425,0.000155731954053215,1.172448992729187,0.6548318862915039,0.32471030950546265,COMPLETE
970,0.6754941344261169,ReLU,68,227,23,0.000765650960459805,1,0.4418025249612986,0.00014240118488442104,1.3069992065429688,0.6754941344261169,0.3613651394844055,COMPLETE
971,0.5898793935775757,ReLU,72,205,22,0.0029942502200138396,1,0.6388488553924898,8.937375216083631e-05,1.598496675491333,0.5898793935775757,0.4192078709602356,COMPLETE
972,0.7826970815658569,Sigmoid,68,210,20,0.0005822397757205426,1,0.427447986045117,0.00018309670775094847,1.212999701499939,0.7826970815658569,0.25284940004348755,COMPLETE
973,0.6318576335906982,ReLU,65,219,21,0.00398466321093772,1,0.7700987389279765,0.00012758948327795916,1.374411940574646,0.6318576335906982,0.4062061309814453,COMPLETE
974,0.6989532113075256,ReLU,70,231,19,0.01281292562237429,1,0.5535890049649729,0.00019254532311775702,15.805952072143555,0.6989532113075256,0.3348954916000366,COMPLETE
975,0.7370615005493164,ReLU,64,225,22,0.00700907117846885,1,0.23490129389549744,4.194420286317098e-05,5.019494533538818,0.7370615005493164,0.27219635248184204,COMPLETE
976,0.6081175804138184,ReLU,67,208,21,0.009441562342580933,1,0.6100858466138602,0.00023562608302788156,1.705654501914978,0.6081175804138184,0.4435462951660156,COMPLETE
977,0.6263194680213928,ReLU,66,236,22,0.004736979725252776,1,0.4739472985868881,0.00012325369773707402,23.365825653076172,0.6263194680213928,0.40205252170562744,COMPLETE
978,0.8134631514549255,ReLU,75,222,16,0.0003006380038589108,1,0.15098012529322694,0.0417616761594226,1.382368803024292,0.8134631514549255,0.1548810601234436,COMPLETE
979,0.8780167698860168,Tanh,63,218,20,3.914762217694978e-05,1,0.5846942962495801,0.0002866287420562051,1.3668709993362427,0.8780167698860168,0.18556994199752808,COMPLETE
980,0.5980604887008667,ReLU,69,232,21,0.026202804781264043,1,0.6701627228627003,0.00016812962333740309,1.3782386779785156,0.5980604887008667,0.384207546710968,COMPLETE
981,0.8952733874320984,ReLU,64,197,22,0.005440760530030925,1,0.15813263024723054,0.0027335586256663717,2.7511723041534424,0.8952733874320984,0.0939936637878418,COMPLETE
982,0.6131740212440491,ReLU,57,240,20,0.0027591631422235535,1,0.7271065335777454,0.00034238959242787425,1.3562783002853394,0.6131740212440491,0.33909499645233154,COMPLETE
983,0.7318674921989441,ReLU,65,208,21,0.007531301399864288,1,0.20816888670420097,5.2397107211035514e-05,21.740680694580078,0.7318674921989441,0.2539295554161072,COMPLETE
984,0.6728358864784241,ReLU,71,248,23,0.029600594229803646,1,0.27015788127320584,0.024044776861863456,2.0770905017852783,0.6728358864784241,0.3397377133369446,COMPLETE
985,0.8561769127845764,Leaky,59,215,21,0.0037283493931071264,1,0.16454625322691652,3.088206489549795e-05,2.001260995864868,0.8561769127845764,0.11912178993225098,COMPLETE
986,0.8415126204490662,ReLU,67,229,22,2.5300145630295663e-05,1,0.6437175768578923,9.1224877632136e-05,1.231763243675232,0.8415126204490662,0.13817286491394043,COMPLETE
987,0.6011355519294739,ReLU,62,238,22,0.0014149695598978504,1,0.6843537649945624,6.233002691827677e-05,1.34552001953125,0.6011355519294739,0.3785349726676941,COMPLETE
988,0.7843971252441406,ReLU,73,246,21,0.08069660573275728,1,0.6143114344530037,0.012868528487956271,1.2830164432525635,0.7843971252441406,0.2799433469772339,COMPLETE
989,0.5930139422416687,ReLU,64,225,24,0.005905385555664339,1,0.7016840749464427,0.00020971587910240008,1.4335052967071533,0.5930139422416687,0.39306962490081787,COMPLETE
990,0.8720744252204895,ReLU,56,464,20,0.008183682892152051,1,0.14097995009316333,7.995180595451265e-05,2.194941282272339,0.8720744252204895,0.0712134838104248,COMPLETE
991,0.7779639959335327,ReLU,60,212,22,0.06296156886973268,1,0.494026346547912,0.08528323097510368,1.4987622499465942,0.7779639959335327,0.2575499415397644,COMPLETE
992,0.7529937028884888,ReLU,63,201,23,0.04603626316260478,1,0.20035061885375322,7.109753208378391e-05,3.3987374305725098,0.7529937028884888,0.20932579040527344,COMPLETE
993,0.6757534146308899,Sigmoid,69,254,6,0.004698169091038672,1,0.32712876444658434,0.00029365679425738344,2.0210812091827393,0.6757534146308899,0.34909588098526,COMPLETE
994,0.7754381895065308,ReLU,36,232,18,0.009604138665302367,1,0.12409194211924583,0.0018790127496352764,5.341808795928955,0.7754381895065308,0.13072144985198975,COMPLETE
995,0.5880178809165955,ReLU,66,242,21,0.00606328940984669,1,0.6553975375503432,1.2183587490843664e-05,1.3738200664520264,0.5880178809165955,0.4073736071586609,COMPLETE
996,0.8343040943145752,ReLU,78,220,21,2.158706552676344e-05,1,0.7579925949299902,0.00041935583286622526,1.1881470680236816,0.8343040943145752,0.1931867003440857,COMPLETE
997,0.6890456676483154,ReLU,59,226,19,0.0024536061813470594,1,0.3679862423604659,0.0038896869696782243,2.7799172401428223,0.6890456676483154,0.3486316204071045,COMPLETE
998,0.8807113766670227,ReLU,54,291,22,1.887891513982236e-05,1,0.6319247781136234,3.7925432477695034e-05,1.2289966344833374,0.8807113766670227,0.15158206224441528,COMPLETE
999,0.6327360272407532,ReLU,61,251,21,0.057064386230260805,1,0.6737492466070945,0.00022275361686744966,1.5100606679916382,0.6327360272407532,0.3556901216506958,COMPLETE
