number,value,datetime_start,datetime_complete,duration,params_activation1,params_activation2,params_activation3,params_activation4,params_batch_size,params_fl1,params_fl2,params_fl3,params_fl4,params_learning_rate,params_n_layers,params_num_epochs,params_train_size,params_weight_decay,user_attrs_mre,state
187,0.17414939403533936,2023-09-04 12:00:20.636206,2023-09-04 12:00:21.812806,0 days 00:00:01.176600,Tanh,Sigmoid,Leaky,,49,22,11.0,8.0,,0.01216175228050541,3,279,0.7346991721500539,4.514289941306288e-05,64.93281110127766,COMPLETE
188,0.19106602668762207,2023-09-04 12:00:21.813098,2023-09-04 12:00:22.475013,0 days 00:00:00.661915,Tanh,Sigmoid,Leaky,,45,23,11.0,8.0,,0.008623309734372024,3,160,0.7389626216124624,5.57092062561669e-05,120.59224139942842,COMPLETE
189,0.20902378857135773,2023-09-04 12:00:22.475307,2023-09-04 12:00:23.239910,0 days 00:00:00.764603,Tanh,Sigmoid,Leaky,,49,20,12.0,4.0,,0.012753968841461814,3,111,0.7441378571489693,6.978065299098596e-05,113.9468378339495,COMPLETE
190,0.19644473493099213,2023-09-04 12:00:23.240206,2023-09-04 12:00:24.204734,0 days 00:00:00.964528,Tanh,Sigmoid,Leaky,,56,23,9.0,10.0,,0.010605262164295366,3,289,0.6711378987751215,3.1488307025305605e-05,107.0096541896011,COMPLETE
191,0.21698632836341858,2023-09-04 12:00:24.205040,2023-09-04 12:00:24.678753,0 days 00:00:00.473713,Tanh,Sigmoid,Leaky,,52,22,13.0,7.0,,0.015601279837387516,3,276,0.4550776108086204,4.736173289441844e-05,279.1544883195744,COMPLETE
192,0.15751570463180542,2023-09-04 12:00:24.679065,2023-09-04 12:00:25.455219,0 days 00:00:00.776154,Tanh,Sigmoid,Sigmoid,,54,22,18.0,9.0,,0.018161641896353515,3,264,0.7091475919928726,4.266854037632621e-05,114.9009935028699,COMPLETE
193,0.19097362458705902,2023-09-04 12:00:25.455510,2023-09-04 12:00:26.917435,0 days 00:00:01.461925,Tanh,Sigmoid,Leaky,,54,22,17.0,8.0,,0.016651298109749708,3,368,0.7728609344946733,3.763157368733666e-05,75.75473915548885,COMPLETE
194,0.16447101533412933,2023-09-04 12:00:26.917728,2023-09-04 12:00:28.194070,0 days 00:00:01.276342,Tanh,Sigmoid,Sigmoid,,50,21,10.0,23.0,,0.012157281401986152,3,281,0.7238827517736787,2.6424036891750854e-05,2883.756803385417,COMPLETE
195,0.20026053488254547,2023-09-04 12:00:28.194359,2023-09-04 12:00:29.626439,0 days 00:00:01.432080,Tanh,Sigmoid,Sigmoid,,49,23,20.0,18.0,,0.012750246126223231,3,282,0.7252764081844357,2.6894811727382525e-05,172.84594461192256,COMPLETE
196,0.13843078911304474,2023-09-04 12:00:29.626751,2023-09-04 12:00:30.686964,0 days 00:00:01.060213,Tanh,Sigmoid,Sigmoid,,43,21,18.0,16.0,,0.017512525651592042,3,264,0.7731249302094841,1.6695340780579877e-05,95.63035372470287,COMPLETE
197,0.1837596744298935,2023-09-04 12:00:30.687254,2023-09-04 12:00:31.304792,0 days 00:00:00.617538,Tanh,Sigmoid,Sigmoid,,47,21,18.0,19.0,,0.01799788887208029,3,261,0.7743417408650562,0.0007478013616326705,118.30679163439521,COMPLETE
198,0.23322471976280212,2023-09-04 12:00:31.305084,2023-09-04 12:00:32.711973,0 days 00:00:01.406889,Tanh,Sigmoid,Sigmoid,,40,21,19.0,12.0,,0.02823441221328755,3,269,0.7693503666267214,4.978806639089777e-05,120.45963507183528,COMPLETE
199,0.18119776248931885,2023-09-04 12:00:32.712360,2023-09-04 12:00:34.566216,0 days 00:00:01.853856,Tanh,Sigmoid,Sigmoid,,43,20,23.0,24.0,,0.011664594607178497,3,248,0.7991456382678817,3.717269416366244e-05,75.30635343279157,COMPLETE
200,0.18443773686885834,2023-09-04 12:00:34.566518,2023-09-04 12:00:35.285427,0 days 00:00:00.718909,Tanh,Sigmoid,Sigmoid,,50,21,11.0,16.0,,0.019590336249174122,3,263,0.7035400626810007,0.0001381079214979854,108.36203120304988,COMPLETE
201,0.19865521788597107,2023-09-04 12:00:35.285742,2023-09-04 12:00:36.053897,0 days 00:00:00.768155,Tanh,Sigmoid,Sigmoid,,54,22,10.0,22.0,,0.014468315186316137,3,293,0.7436291205658248,1.631644162315058e-05,115.94132886614118,COMPLETE
202,0.18765120208263397,2023-09-04 12:00:36.054249,2023-09-04 12:00:37.046636,0 days 00:00:00.992387,Tanh,Sigmoid,Sigmoid,,31,22,10.0,9.0,,0.009769255099843017,3,286,0.7355610504133762,2.1169229447414868e-05,100.19466709446263,COMPLETE
203,0.23940065503120422,2023-09-04 12:00:37.046982,2023-09-04 12:00:37.736321,0 days 00:00:00.689339,Tanh,ReLU,Sigmoid,,46,23,15.0,8.0,,0.015113110764133905,3,253,0.753519520264749,1.4669956284605406e-05,90.78290904651989,COMPLETE
204,0.18919754028320312,2023-09-04 12:00:37.736632,2023-09-04 12:00:38.788701,0 days 00:00:01.052069,Tanh,Sigmoid,Sigmoid,,51,23,18.0,9.0,,0.012183613674221022,3,279,0.7184915126586119,1.855775537781516e-05,81.1247865062649,COMPLETE
205,0.2125493586063385,2023-09-04 12:00:38.789020,2023-09-04 12:00:39.251413,0 days 00:00:00.462393,Tanh,ReLU,Sigmoid,,57,19,16.0,23.0,,0.018501921700062613,3,236,0.771327895994474,2.360504792373917e-05,74.32950927734375,COMPLETE
206,0.2183944582939148,2023-09-04 12:00:39.251726,2023-09-04 12:00:39.891434,0 days 00:00:00.639708,Tanh,Tanh,Tanh,,37,22,11.0,21.0,,0.008417118669100753,3,302,0.5047523024978279,6.442076141987046e-05,86.12626217573117,COMPLETE
207,0.171813502907753,2023-09-04 12:00:39.891839,2023-09-04 12:00:40.580045,0 days 00:00:00.688206,Tanh,ReLU,Sigmoid,,53,24,22.0,14.0,,0.014863693332187492,3,332,0.6847515897089022,2.9885491817234507e-05,98.33854735525031,COMPLETE
208,0.20567826926708221,2023-09-04 12:00:40.580349,2023-09-04 12:00:41.083852,0 days 00:00:00.503503,Tanh,Sigmoid,Sigmoid,,53,24,21.0,14.0,,0.023791189535342146,3,328,0.6620706276595908,3.283472482196754e-05,82.04941910963792,COMPLETE
209,0.20311567187309265,2023-09-04 12:00:41.084173,2023-09-04 12:00:41.913194,0 days 00:00:00.829021,Tanh,ReLU,Sigmoid,,48,24,23.0,14.0,,0.016611637542036935,3,342,0.6926130637706935,0.00042079777420311263,73.55667877197266,COMPLETE
210,0.20424138009548187,2023-09-04 12:00:41.913493,2023-09-04 12:00:42.707798,0 days 00:00:00.794305,Tanh,Sigmoid,ReLU,,50,24,22.0,13.0,,0.010568565138887384,3,350,0.5474098158070941,4.185719858980938e-05,71.31593227386475,COMPLETE
211,0.22059977054595947,2023-09-04 12:00:42.708111,2023-09-04 12:00:43.158044,0 days 00:00:00.449933,Tanh,ReLU,Sigmoid,,55,22,22.0,5.0,,0.0137288739035807,3,264,0.7442189875036068,2.821412796748143e-05,233.50879114324397,COMPLETE
212,0.21614159643650055,2023-09-04 12:00:43.158368,2023-09-04 12:00:43.579061,0 days 00:00:00.420693,Leaky,ReLU,Sigmoid,,52,23,22.0,13.0,,0.020752733107142884,3,277,0.7950688707533107,2.3436164419567277e-05,94.96396516498767,COMPLETE
213,0.2068767100572586,2023-09-04 12:00:43.579367,2023-09-04 12:00:43.962422,0 days 00:00:00.383055,Tanh,ReLU,Sigmoid,,58,21,21.0,15.0,,0.014727400007121038,3,312,0.7199411863440787,1.6772860376374903e-05,100.35083354603161,COMPLETE
214,0.21217411756515503,2023-09-04 12:00:43.962726,2023-09-04 12:00:44.876812,0 days 00:00:00.914086,Tanh,ReLU,Sigmoid,,54,22,9.0,20.0,,0.0121256399994021,3,334,0.6102168293776704,9.024974847495119e-05,90.03615200904107,COMPLETE
215,0.16173578798770905,2023-09-04 12:00:44.877110,2023-09-04 12:00:45.490418,0 days 00:00:00.613308,Tanh,ReLU,Sigmoid,,51,23,19.0,7.0,,0.017744340406035713,3,248,0.7616011759359876,0.0002929720989436523,99.19801724341607,COMPLETE
216,0.1795913428068161,2023-09-04 12:00:45.490733,2023-09-04 12:00:45.973199,0 days 00:00:00.482466,Tanh,ReLU,Sigmoid,,49,24,19.0,17.0,,0.026420074750957402,3,246,0.766213622053718,0.00019553386762283237,84.5905435735529,COMPLETE
217,0.22175590693950653,2023-09-04 12:00:45.973495,2023-09-04 12:00:46.298901,0 days 00:00:00.325406,Tanh,ReLU,Sigmoid,,52,23,17.0,7.0,,0.01813098587393982,3,257,0.6900703681484864,0.00011271666455134495,127.78504085540771,COMPLETE
218,0.1952352523803711,2023-09-04 12:00:46.299211,2023-09-04 12:00:47.259685,0 days 00:00:00.960474,Tanh,Sigmoid,Sigmoid,,47,23,8.0,11.0,,0.009453555169950001,3,267,0.7739464773604161,0.00017966059434042044,89.206915150518,COMPLETE
219,0.2104414999485016,2023-09-04 12:00:47.259988,2023-09-04 12:00:47.860842,0 days 00:00:00.600854,Tanh,ReLU,Sigmoid,,51,24,18.0,8.0,,0.020683651381377118,3,234,0.7969945766028083,0.00023880601478319611,101.21599631473936,COMPLETE
220,0.19928006827831268,2023-09-04 12:00:47.861149,2023-09-04 12:00:48.826484,0 days 00:00:00.965335,Tanh,ReLU,Sigmoid,,55,23,18.0,9.0,,0.0012207760384480616,3,247,0.6421249377249483,5.5084791160509207e-05,104.34959690154545,COMPLETE
221,0.19475868344306946,2023-09-04 12:00:48.826810,2023-09-04 12:00:49.245511,0 days 00:00:00.418701,ReLU,ReLU,Sigmoid,,50,22,20.0,16.0,,0.01523646887755855,3,122,0.7182900078038374,1.9085212825124878e-05,934.5096711658296,COMPLETE
222,0.18316085636615753,2023-09-04 12:00:49.245828,2023-09-04 12:00:50.264219,0 days 00:00:01.018391,ReLU,ReLU,Sigmoid,,53,22,8.0,7.0,,0.012454137861547851,3,316,0.740765171427984,0.0003491718564628239,125.56360083111262,COMPLETE
223,0.21775680780410767,2023-09-04 12:00:50.264505,2023-09-04 12:00:50.576580,0 days 00:00:00.312075,Tanh,ReLU,Sigmoid,,56,21,19.0,4.0,,0.01695115813031932,3,326,0.5666632380295572,3.081968021529746e-05,102.23186839710583,COMPLETE
224,0.22391055524349213,2023-09-04 12:00:50.576878,2023-09-04 12:00:51.040557,0 days 00:00:00.463679,ReLU,ReLU,Sigmoid,,51,22,9.0,6.0,,0.010819519446763397,3,357,0.5171503839335984,0.004583280401824521,87.58216509137834,COMPLETE
225,0.18080903589725494,2023-09-04 12:00:51.040868,2023-09-04 12:00:51.640282,0 days 00:00:00.599414,ReLU,ReLU,Sigmoid,,48,23,10.0,5.0,,0.014064139491089122,3,273,0.7457917913140204,0.0005784779172396542,185.2860087733115,COMPLETE
226,0.22087045013904572,2023-09-04 12:00:51.640613,2023-09-04 12:00:53.215139,0 days 00:00:01.574526,Sigmoid,Sigmoid,Leaky,,53,20,17.0,7.0,,0.00791858187990596,3,143,0.7995678050566117,0.00028818789019130947,145.05864903376653,COMPLETE
227,0.1812407672405243,2023-09-04 12:00:53.215633,2023-09-04 12:00:55.201405,0 days 00:00:01.985772,ReLU,ReLU,Sigmoid,,59,23,9.0,4.0,,0.022127597649636083,3,263,0.7004961179741418,0.0001311416473356882,70.0837117070737,COMPLETE
228,0.21905943751335144,2023-09-04 12:00:55.201906,2023-09-04 12:00:55.623619,0 days 00:00:00.421713,Tanh,Sigmoid,Sigmoid,,49,22,12.0,6.0,,0.03184267284625371,3,285,0.20327194930600756,2.553771614073325e-05,139.93147604806083,COMPLETE
229,0.2560197114944458,2023-09-04 12:00:55.623927,2023-09-04 12:00:55.838304,0 days 00:00:00.214377,ReLU,ReLU,Sigmoid,,46,21,8.0,5.0,,0.016679955137165286,3,253,0.14000644770338197,7.132886134329625e-05,88.58379152987865,COMPLETE
230,0.1784026026725769,2023-09-04 12:00:55.838630,2023-09-04 12:00:56.981343,0 days 00:00:01.142713,ReLU,ReLU,Leaky,,56,4,9.0,3.0,,0.012530466343582207,3,346,0.7581036935882729,0.00015488210899528997,79.12035097394671,COMPLETE
231,0.16060446202754974,2023-09-04 12:00:56.981666,2023-09-04 12:00:57.687982,0 days 00:00:00.706316,ReLU,Sigmoid,Leaky,,96,20,9.0,1.0,,0.007072228075203819,3,135,0.6795940072385666,2.179536798754323e-05,286.9086088493689,COMPLETE
232,0.1873643696308136,2023-09-04 12:00:57.688291,2023-09-04 12:00:58.853709,0 days 00:00:01.165418,ReLU,Sigmoid,Leaky,,93,20,10.0,1.0,,0.008506487340239855,3,134,0.7186983189446343,2.0725948852273424e-05,134.2388235727946,COMPLETE
233,0.20585289597511292,2023-09-04 12:00:58.854008,2023-09-04 12:01:00.106340,0 days 00:00:01.252332,ReLU,Sigmoid,Leaky,,99,21,24.0,1.0,,0.006873124060532307,3,122,0.6855400424262603,1.4201541174641045e-05,97.37601761269359,COMPLETE
234,0.17792393267154694,2023-09-04 12:01:00.106655,2023-09-04 12:01:01.820682,0 days 00:00:01.714027,ReLU,Sigmoid,Leaky,,52,20,8.0,1.0,,0.00963053021498159,3,134,0.7640124318164402,0.0011629984886232221,115.64720352172851,COMPLETE
235,0.2368573546409607,2023-09-04 12:01:01.821188,2023-09-04 12:01:03.647482,0 days 00:00:01.826294,ReLU,Sigmoid,Leaky,,98,22,11.0,11.0,,0.0016947905962527313,3,147,0.6557598329637916,2.3623779638452827e-05,143.0725374978686,COMPLETE
236,0.9009400606155396,2023-09-04 12:01:03.648051,2023-09-04 12:01:06.219915,0 days 00:00:02.571864,ReLU,Sigmoid,Sigmoid,,96,23,22.0,2.0,,4.729451101275398e-05,3,115,0.799010663014214,4.6337725714141234e-05,115.72237124235734,COMPLETE
237,0.20737449824810028,2023-09-04 12:01:06.220219,2023-09-04 12:01:06.683485,0 days 00:00:00.463266,Tanh,ReLU,Tanh,,54,19,9.0,5.0,,0.018341306683216367,3,241,0.3715676296472267,1.7807489970908648e-05,78.59762426523062,COMPLETE
238,0.18792930245399475,2023-09-04 12:01:06.683838,2023-09-04 12:01:07.477994,0 days 00:00:00.794156,Leaky,Sigmoid,Sigmoid,,50,24,10.0,4.0,,0.014498661267315345,3,278,0.7272604635957511,2.9600569891892904e-05,77.87382557081139,COMPLETE
239,0.19169428944587708,2023-09-04 12:01:07.478297,2023-09-04 12:01:08.097675,0 days 00:00:00.619378,ReLU,ReLU,Sigmoid,,51,21,8.0,7.0,,0.010816656646963092,3,155,0.7514724756510442,5.9339342822619206e-05,105.39275696698357,COMPLETE
240,0.25085046887397766,2023-09-04 12:01:08.098005,2023-09-04 12:01:08.659093,0 days 00:00:00.561088,ReLU,Tanh,Leaky,,94,19,21.0,8.0,,0.002421037583871189,3,230,0.28856518086605054,3.604942128503038e-05,107.76108308596032,COMPLETE
241,0.1931392252445221,2023-09-04 12:01:08.659415,2023-09-04 12:01:09.284843,0 days 00:00:00.625428,ReLU,Sigmoid,Leaky,,90,21,9.0,2.0,,0.0062785008472146155,3,124,0.6752643089906202,2.2162329508055585e-05,664.1571557181222,COMPLETE
242,0.20839430391788483,2023-09-04 12:01:09.285147,2023-09-04 12:01:10.015102,0 days 00:00:00.729955,ReLU,Sigmoid,Leaky,,97,20,9.0,3.0,,0.00490688851404578,3,141,0.40601018764714186,2.6277897276563145e-05,102.35230332120842,COMPLETE
243,0.2026989609003067,2023-09-04 12:01:10.015413,2023-09-04 12:01:11.896172,0 days 00:00:01.880759,ReLU,Sigmoid,Leaky,,49,21,8.0,2.0,,0.0019029736961466855,3,127,0.6251484436059714,1.9726425832737247e-05,122.7254827904889,COMPLETE
244,0.17999833822250366,2023-09-04 12:01:11.896490,2023-09-04 12:01:12.658570,0 days 00:00:00.762080,ReLU,Sigmoid,Leaky,,95,22,20.0,5.0,,0.007444776108725722,3,134,0.7046065258876718,2.674950647463975e-05,93.3881285050336,COMPLETE
245,0.2009163796901703,2023-09-04 12:01:12.658887,2023-09-04 12:01:13.357005,0 days 00:00:00.698118,ReLU,Sigmoid,Sigmoid,,100,23,9.0,1.0,,0.01243615584861944,3,108,0.5912400451490964,1.5491476329629106e-05,83.45547866821289,COMPLETE
246,0.20703382790088654,2023-09-04 12:01:13.357322,2023-09-04 12:01:13.791115,0 days 00:00:00.433793,Tanh,ReLU,Sigmoid,,93,22,10.0,6.0,,0.005343098942239892,3,267,0.44534050390603136,3.806783655788528e-05,143.675582749503,COMPLETE
247,0.1931544691324234,2023-09-04 12:01:13.791433,2023-09-04 12:01:15.255778,0 days 00:00:01.464345,ReLU,Sigmoid,Sigmoid,,91,20,7.0,4.0,,0.0028686967513578744,3,290,0.7659837752983717,8.997856164750522e-05,79.26413567339787,COMPLETE
248,0.20120584964752197,2023-09-04 12:01:15.256187,2023-09-04 12:01:15.775371,0 days 00:00:00.519184,Tanh,ReLU,Leaky,,54,21,8.0,4.0,,0.019867519608609645,3,260,0.7377130059439863,1.3042849773668236e-05,109.50272211535224,COMPLETE
249,0.1805809736251831,2023-09-04 12:01:15.775705,2023-09-04 12:01:16.451240,0 days 00:00:00.675535,ReLU,Sigmoid,ReLU,,52,23,9.0,3.0,,0.00954534686917231,3,335,0.7702690780172378,2.1602203135418535e-05,124.14021816769161,COMPLETE
250,0.1674424111843109,2023-09-04 12:01:16.451555,2023-09-04 12:01:16.981342,0 days 00:00:00.529787,ReLU,ReLU,Sigmoid,,57,22,10.0,6.0,,0.014590061440472158,3,130,0.6943430643010521,0.0001959156742737744,235.07429840985466,COMPLETE
251,0.18236233294010162,2023-09-04 12:01:16.981663,2023-09-04 12:01:18.045817,0 days 00:00:01.064154,ReLU,ReLU,Sigmoid,,58,22,11.0,6.0,,0.015391254425761645,3,118,0.7166655488031303,0.0002329934164487446,87.63895250403363,COMPLETE
252,0.232741117477417,2023-09-04 12:01:18.046345,2023-09-04 12:01:18.633355,0 days 00:00:00.587010,Tanh,ReLU,Sigmoid,,61,22,5.0,5.0,,0.02504741622035276,3,147,0.30572670305182453,0.00019519336464485825,116.7923162954825,COMPLETE
253,0.24101783335208893,2023-09-04 12:01:18.633901,2023-09-04 12:01:18.983411,0 days 00:00:00.349510,ReLU,ReLU,Sigmoid,,56,23,11.0,6.0,,0.054559034988063033,3,273,0.11126608745475847,0.00015544243147603147,120.54735310872395,COMPLETE
254,0.1508454829454422,2023-09-04 12:01:18.983983,2023-09-04 12:01:20.585470,0 days 00:00:01.601487,ReLU,ReLU,Sigmoid,,54,24,10.0,8.0,,0.01673736676759365,3,256,0.7989907604794912,0.00010428614998242131,97.0224425217201,COMPLETE
255,0.15894116461277008,2023-09-04 12:01:20.586000,2023-09-04 12:01:21.534697,0 days 00:00:00.948697,Tanh,ReLU,Sigmoid,,54,24,10.0,8.0,,0.020186500694668038,3,258,0.7980457118546546,9.777406055554939e-05,78.88591781927614,COMPLETE
256,0.16514155268669128,2023-09-04 12:01:21.535107,2023-09-04 12:01:22.798983,0 days 00:00:01.263876,Tanh,ReLU,Sigmoid,,56,24,10.0,8.0,,0.0254782653812615,3,243,0.7708358991643427,0.00010598158309069723,80.36569545579994,COMPLETE
257,0.18318475782871246,2023-09-04 12:01:22.799288,2023-09-04 12:01:23.380356,0 days 00:00:00.581068,Tanh,ReLU,Sigmoid,,57,24,10.0,8.0,,0.02741972249903425,3,255,0.773526790664844,0.00011591994757334871,101.74886100522933,COMPLETE
258,0.20197072625160217,2023-09-04 12:01:23.380664,2023-09-04 12:01:23.745138,0 days 00:00:00.364474,Tanh,ReLU,Sigmoid,,55,24,10.0,8.0,,0.020027450054156747,3,247,0.4739642015159529,9.871568906026172e-05,96.2643669128418,COMPLETE
259,0.16594621539115906,2023-09-04 12:01:23.745473,2023-09-04 12:01:24.630164,0 days 00:00:00.884691,Tanh,ReLU,Sigmoid,,54,24,10.0,9.0,,0.024574514602388516,3,241,0.7742961196405919,0.00013096394998339777,80.63456217447917,COMPLETE
260,0.191554456949234,2023-09-04 12:01:24.630542,2023-09-04 12:01:25.172869,0 days 00:00:00.542327,Tanh,ReLU,Sigmoid,,58,24,10.0,9.0,,0.02405248303710632,3,235,0.7981560093526215,0.00012167352704185151,90.56873010706019,COMPLETE
261,0.17723245918750763,2023-09-04 12:01:25.173190,2023-09-04 12:01:25.589238,0 days 00:00:00.416048,Tanh,ReLU,Sigmoid,,54,24,10.0,10.0,,0.037442646948006815,3,224,0.7689256461369433,0.00014647608398605434,85.50921957833427,COMPLETE
262,0.21825571358203888,2023-09-04 12:01:25.589661,2023-09-04 12:01:26.111700,0 days 00:00:00.522039,Tanh,ReLU,Sigmoid,,57,24,4.0,9.0,,0.03045175266268557,3,245,0.7504544006263861,0.0001022471251158062,97.71468861897786,COMPLETE
263,0.20392055809497833,2023-09-04 12:01:26.112038,2023-09-04 12:01:26.433751,0 days 00:00:00.321713,Tanh,ReLU,Sigmoid,,56,24,23.0,10.0,,0.023661843263343342,3,255,0.42552118417974966,0.00013113379431576195,116.46525802612305,COMPLETE
264,0.20930397510528564,2023-09-04 12:01:26.434061,2023-09-04 12:01:27.074030,0 days 00:00:00.639969,Tanh,ReLU,Sigmoid,Sigmoid,54,24,10.0,8.0,14.0,0.02175417672653139,4,243,0.7719355408083504,8.181630963621125e-05,215.34109802246093,COMPLETE
265,0.16555702686309814,2023-09-04 12:01:27.074354,2023-09-04 12:01:28.129246,0 days 00:00:01.054892,Tanh,ReLU,Sigmoid,,59,24,11.0,7.0,,0.017070406069036734,3,231,0.7415817206371454,0.0001873273265159292,85.93541390555245,COMPLETE
266,0.1912851780653,2023-09-04 12:01:28.129557,2023-09-04 12:01:28.491755,0 days 00:00:00.362198,Tanh,ReLU,Sigmoid,,59,24,11.0,7.0,,0.026914624488676205,3,221,0.7977186502468129,0.00011188090601732298,103.68072389301501,COMPLETE
267,0.18290941417217255,2023-09-04 12:01:28.492070,2023-09-04 12:01:29.215431,0 days 00:00:00.723361,Tanh,ReLU,Sigmoid,,56,24,12.0,7.0,,0.018014568309903497,3,392,0.7439430577167624,0.0001815757504192932,73.27681946172947,COMPLETE
268,0.22031530737876892,2023-09-04 12:01:29.215761,2023-09-04 12:01:29.805234,0 days 00:00:00.589473,Sigmoid,ReLU,Sigmoid,,59,23,11.0,7.0,,0.02034284443363313,3,235,0.7726546892617142,0.0001497190962654514,113.51710058141637,COMPLETE
269,0.2295055091381073,2023-09-04 12:01:29.805750,2023-09-04 12:01:30.488666,0 days 00:00:00.682916,Tanh,Leaky,Sigmoid,,55,23,11.0,8.0,,0.017471349112195035,3,411,0.7232866244640811,0.00022114866020111302,95.51180415683322,COMPLETE
270,0.2251572161912918,2023-09-04 12:01:30.488975,2023-09-04 12:01:30.726310,0 days 00:00:00.237335,Tanh,ReLU,Sigmoid,,57,24,18.0,9.0,,0.034523050524984396,3,228,0.24659655527018892,0.0001693128738710406,2951.5681047712055,COMPLETE
271,0.22517889738082886,2023-09-04 12:01:30.726682,2023-09-04 12:01:31.060074,0 days 00:00:00.333392,Leaky,ReLU,Sigmoid,,53,23,10.0,7.0,,0.028535730484859956,3,209,0.32832862082560094,0.0002950561524137077,81.26243139568128,COMPLETE
272,0.21635030210018158,2023-09-04 12:01:31.060509,2023-09-04 12:01:31.649609,0 days 00:00:00.589100,Tanh,ReLU,Sigmoid,,55,23,10.0,8.0,,0.016489598482277004,3,251,0.7986795529979116,0.00012781034314867772,81.50730156898499,COMPLETE
273,0.17537079751491547,2023-09-04 12:01:31.649928,2023-09-04 12:01:32.272566,0 days 00:00:00.622638,Tanh,ReLU,Sigmoid,,52,24,6.0,6.0,,0.04592236972133805,3,238,0.7447854418477332,9.850469335456143e-05,121.30504564557756,COMPLETE
274,0.18041770160198212,2023-09-04 12:01:32.272878,2023-09-04 12:01:32.808585,0 days 00:00:00.535707,Tanh,Leaky,Sigmoid,,59,23,10.0,9.0,,0.023686835171052432,3,262,0.7094273636208356,7.612221543447042e-05,112.49323093189912,COMPLETE
275,0.16427385807037354,2023-09-04 12:01:32.808897,2023-09-04 12:01:33.286899,0 days 00:00:00.478002,ReLU,ReLU,Sigmoid,,54,24,10.0,8.0,,0.021100109699722168,3,252,0.7673663444494883,0.00021189404269183942,90.04487864176433,COMPLETE
276,0.17352059483528137,2023-09-04 12:01:33.287210,2023-09-04 12:01:34.018225,0 days 00:00:00.731015,ReLU,ReLU,Sigmoid,,57,24,10.0,8.0,,0.021316506695630254,3,260,0.7473763935234295,0.00020782239314663607,75.11059934828016,COMPLETE
277,0.22273112833499908,2023-09-04 12:01:34.018577,2023-09-04 12:01:34.405688,0 days 00:00:00.387111,ReLU,ReLU,Sigmoid,,54,24,19.0,7.0,,0.030543576015747757,3,251,0.7717644458656249,0.00027200473296111737,119.90648142496745,COMPLETE
278,0.21552737057209015,2023-09-04 12:01:34.405991,2023-09-04 12:01:34.778904,0 days 00:00:00.372913,Tanh,Tanh,Tanh,,60,16,11.0,8.0,,0.016961030791939443,3,266,0.7035661694661609,0.00017540495380689752,200.48987166086832,COMPLETE
279,0.1908911168575287,2023-09-04 12:01:34.779213,2023-09-04 12:01:35.502669,0 days 00:00:00.723456,ReLU,ReLU,Sigmoid,,34,24,12.0,9.0,,0.023372694099195613,3,242,0.7313853803854516,0.00015305477849637713,103.51720920685798,COMPLETE
