number,value,datetime_start,datetime_complete,duration,params_activation1,params_activation2,params_activation3,params_activation4,params_batch_size,params_fl1,params_fl2,params_fl3,params_fl4,params_learning_rate,params_n_layers,params_num_epochs,params_train_size,params_weight_decay,user_attrs_mre,state
388,0.14663192629814148,2023-09-04 12:03:31.819660,2023-09-04 12:03:32.450937,0 days 00:00:00.631277,ReLU,ReLU,,,72,17,24.0,,,0.0069131335875256585,2,185,0.5649723426616542,2.6920740190299522e-05,160.8685791913201,COMPLETE
389,0.595376193523407,2023-09-04 12:03:32.451263,2023-09-04 12:03:34.753792,0 days 00:00:02.302529,ReLU,ReLU,Tanh,,74,18,16.0,19.0,,1.2725901072540373e-05,3,192,0.6571150717793717,1.5514239225313198e-05,100.66568565368652,COMPLETE
390,0.1533767133951187,2023-09-04 12:03:34.754121,2023-09-04 12:03:35.455879,0 days 00:00:00.701758,Tanh,ReLU,,,77,16,14.0,,,0.013879324401633792,2,172,0.679751079706628,1.011327629880207e-05,70.65725129842758,COMPLETE
391,0.24170246720314026,2023-09-04 12:03:35.456209,2023-09-04 12:03:35.668540,0 days 00:00:00.212331,ReLU,ReLU,,,71,18,16.0,,,0.023116388299656166,2,167,0.5159972409712583,3.3013887916667936e-05,118.78006553649902,COMPLETE
392,0.2765970826148987,2023-09-04 12:03:35.668875,2023-09-04 12:03:35.799790,0 days 00:00:00.130915,ReLU,ReLU,,,88,17,18.0,,,0.01646529955095559,2,449,0.1420384294524714,3.992077186554386e-05,107.35969886779785,COMPLETE
393,0.1662731170654297,2023-09-04 12:03:35.800120,2023-09-04 12:03:36.170941,0 days 00:00:00.370821,ReLU,ReLU,,,86,15,19.0,,,0.011560915456420363,2,163,0.79937271657808,1.0409840730989316e-05,66.90967102050782,COMPLETE
394,0.26841798424720764,2023-09-04 12:03:36.171263,2023-09-04 12:03:36.450249,0 days 00:00:00.278986,ReLU,ReLU,,,76,17,12.0,,,0.008167542527325851,2,422,0.624980322958209,3.0311538618054334e-05,92.77915631807767,COMPLETE
395,0.28810766339302063,2023-09-04 12:03:36.450571,2023-09-04 12:03:36.558491,0 days 00:00:00.107920,ReLU,ReLU,,,87,18,8.0,,,0.021011894656052275,2,196,0.17878090714591166,1.603579576251293e-05,114.89592102050781,COMPLETE
396,0.1797255575656891,2023-09-04 12:03:36.558806,2023-09-04 12:03:36.778294,0 days 00:00:00.219488,ReLU,Sigmoid,,,71,16,15.0,,,0.038382057609678506,2,458,0.7020348879722174,1.3299989820248605e-05,75.78362250328064,COMPLETE
397,0.271465003490448,2023-09-04 12:03:36.778639,2023-09-04 12:03:37.230771,0 days 00:00:00.452132,Leaky,,,,73,20,,,,0.02597959849686037,1,443,0.7490281957345551,2.197634532245733e-05,160.8470115661621,COMPLETE
398,0.3137137293815613,2023-09-04 12:03:37.231078,2023-09-04 12:03:37.410594,0 days 00:00:00.179516,ReLU,ReLU,,,58,19,17.0,,,0.06709878207320154,2,430,0.4469845466901349,1.3467602668025224e-05,123.58968981574563,COMPLETE
399,0.18650752305984497,2023-09-04 12:03:37.410905,2023-09-04 12:03:37.729998,0 days 00:00:00.319093,ReLU,ReLU,,,78,17,13.0,,,0.010327026414445903,2,457,0.31358681219818757,3.730091164178122e-05,74.51355174436408,COMPLETE
400,0.21824520826339722,2023-09-04 12:03:37.730334,2023-09-04 12:03:38.334980,0 days 00:00:00.604646,Sigmoid,Leaky,,,84,16,24.0,,,0.014165596938679031,2,157,0.6675734891710415,2.0891130551112246e-05,427.0133001608927,COMPLETE
401,0.2611061632633209,2023-09-04 12:03:38.335311,2023-09-04 12:03:38.746937,0 days 00:00:00.411626,ReLU,ReLU,,,75,16,14.0,,,0.005507253871970903,2,412,0.4897175383277683,6.997310772441709e-05,94.7159699084712,COMPLETE
402,0.24233002960681915,2023-09-04 12:03:38.747263,2023-09-04 12:03:39.288620,0 days 00:00:00.541357,ReLU,ReLU,,,81,6,15.0,,,0.00338397991957837,2,438,0.27881062565622866,6.327999697007647e-05,122.24926455158833,COMPLETE
403,0.1916847676038742,2023-09-04 12:03:39.288952,2023-09-04 12:03:39.723576,0 days 00:00:00.434624,ReLU,Tanh,,,86,21,5.0,,,0.007092752047283336,2,465,0.36873228225127935,0.00010561821871545635,122.3395639038086,COMPLETE
404,0.28835529088974,2023-09-04 12:03:39.723898,2023-09-04 12:03:39.914935,0 days 00:00:00.191037,ReLU,ReLU,,,90,17,16.0,,,0.016454007492528695,2,453,0.2274106427183713,0.014356244556206776,153.26297251383463,COMPLETE
405,0.14030368626117706,2023-09-04 12:03:39.915251,2023-09-04 12:03:40.635801,0 days 00:00:00.720550,ReLU,Tanh,,,83,15,22.0,,,0.01190281147863146,2,217,0.7194547781555983,2.2567692531248265e-05,96.65126595568302,COMPLETE
406,0.18697340786457062,2023-09-04 12:03:40.636142,2023-09-04 12:03:41.334522,0 days 00:00:00.698380,ReLU,ReLU,,,79,19,13.0,,,0.009090822647636663,2,473,0.7723929832088272,0.00020907493080122124,103.30548406051378,COMPLETE
407,0.1519213169813156,2023-09-04 12:03:41.334861,2023-09-04 12:03:42.108226,0 days 00:00:00.773365,ReLU,Sigmoid,,,77,18,24.0,,,0.018629815273657573,2,229,0.6001676481786633,2.4177184550412362e-05,200.38119318455824,COMPLETE
408,0.17550444602966309,2023-09-04 12:03:42.108538,2023-09-04 12:03:42.423440,0 days 00:00:00.314902,ReLU,Tanh,,,82,17,21.0,,,0.046190972239868,2,209,0.6940325331861863,1.833988221895574e-05,119.81455004656756,COMPLETE
409,0.26146170496940613,2023-09-04 12:03:42.423778,2023-09-04 12:03:42.676815,0 days 00:00:00.253037,ReLU,ReLU,,,85,14,23.0,,,0.03287692622616302,2,448,0.39555416034917484,1.1827834874310475e-05,103.23878437763936,COMPLETE
410,0.11159377545118332,2023-09-04 12:03:42.677149,2023-09-04 12:03:43.425346,0 days 00:00:00.748197,Leaky,Tanh,,,88,21,13.0,,,0.005778117319788848,2,431,0.7335930902898838,1.4130735989487718e-05,57.18128564324177,COMPLETE
411,0.13642026484012604,2023-09-04 12:03:43.425692,2023-09-04 12:03:44.238959,0 days 00:00:00.813267,Leaky,ReLU,,,89,22,12.0,,,0.005390399729590493,2,433,0.7702699769116625,1.3006155633045446e-05,67.75544269664867,COMPLETE
412,0.14864933490753174,2023-09-04 12:03:44.239342,2023-09-04 12:03:45.139770,0 days 00:00:00.900428,Leaky,Tanh,,,87,20,13.0,,,0.006278063363335298,2,401,0.7387198487892677,7.737133230426931e-05,57.93472763429205,COMPLETE
413,0.267885684967041,2023-09-04 12:03:45.140086,2023-09-04 12:03:45.258550,0 days 00:00:00.118464,Leaky,Leaky,,,91,21,12.0,,,0.008407724355625451,2,420,0.10408330458151131,1.0253548683192939e-05,146.1144300948742,COMPLETE
414,0.14895883202552795,2023-09-04 12:03:45.258877,2023-09-04 12:03:46.450914,0 days 00:00:01.192037,Leaky,ReLU,,,61,22,13.0,,,0.003960714620276117,2,427,0.7718793462085468,4.097499103841197e-05,54.12855095698916,COMPLETE
415,0.21377946436405182,2023-09-04 12:03:46.451231,2023-09-04 12:03:47.057307,0 days 00:00:00.606076,Leaky,Tanh,,,88,19,23.0,,,0.004713116184607176,2,413,0.32779537155232086,2.4929525238284037e-05,88.4519148201778,COMPLETE
416,0.2767881453037262,2023-09-04 12:03:47.057639,2023-09-04 12:03:47.554305,0 days 00:00:00.496666,Leaky,ReLU,,,86,9,22.0,,,0.007227916595114198,2,439,0.7248418664346741,1.416783862306557e-05,128.05270495944552,COMPLETE
417,0.10592704266309738,2023-09-04 12:03:47.554620,2023-09-04 12:03:48.144689,0 days 00:00:00.590069,Leaky,Tanh,,,89,20,24.0,,,0.010113579399323119,2,444,0.7479620771753146,1.6222554145284606e-05,84.02330884066495,COMPLETE
418,0.13301479816436768,2023-09-04 12:03:48.144998,2023-09-04 12:03:49.081775,0 days 00:00:00.936777,Leaky,Tanh,ReLU,Sigmoid,92,21,13.0,23.0,11.0,0.010048950062364375,4,442,0.7511856116305246,1.1893291645043135e-05,56.44644512347321,COMPLETE
419,0.1716299206018448,2023-09-04 12:03:49.082142,2023-09-04 12:03:49.932640,0 days 00:00:00.850498,Leaky,Tanh,,,91,20,20.0,,,0.0012177942348464226,2,430,0.7948630086096706,1.6343925149657206e-05,87.90738441574742,COMPLETE
420,0.12673234939575195,2023-09-04 12:03:49.932981,2023-09-04 12:03:51.395688,0 days 00:00:01.462707,Tanh,Tanh,Leaky,,89,21,17.0,11.0,,0.006349330473796286,3,421,0.7974675730693915,1.1562742683095311e-05,69.42482136813076,COMPLETE
421,0.18826204538345337,2023-09-04 12:03:51.396043,2023-09-04 12:03:51.924315,0 days 00:00:00.528272,Leaky,Tanh,,,88,20,24.0,,,0.00801728391161042,2,435,0.7466261566433642,2.05331438671765e-05,85.57439925453879,COMPLETE
422,0.49174413084983826,2023-09-04 12:03:51.924668,2023-09-04 12:03:53.453833,0 days 00:00:01.529165,Leaky,Tanh,,,74,21,6.0,,,0.0008696303670694623,2,447,0.7211608959901565,0.07491195246159627,683.0194540170523,COMPLETE
423,0.16198064386844635,2023-09-04 12:03:53.454153,2023-09-04 12:03:54.195163,0 days 00:00:00.741010,Leaky,Tanh,,,76,20,21.0,,,0.011817685999483286,2,427,0.7615805411324303,1.5220633363554727e-05,70.87036089037285,COMPLETE
424,0.21262995898723602,2023-09-04 12:03:54.195491,2023-09-04 12:03:54.461632,0 days 00:00:00.266141,Leaky,Tanh,,,89,20,4.0,,,0.009553957608796132,2,321,0.4257719965746866,1.2191019420586891e-05,85.79547016040699,COMPLETE
425,0.15425145626068115,2023-09-04 12:03:54.461958,2023-09-04 12:03:55.212439,0 days 00:00:00.750481,Leaky,Tanh,,,100,18,16.0,,,0.007296839575524082,2,440,0.5421074731297959,1.818539655831443e-05,82.90789810180664,COMPLETE
426,0.18047067523002625,2023-09-04 12:03:55.212775,2023-09-04 12:03:56.715832,0 days 00:00:01.503057,Leaky,Tanh,,,72,19,22.0,,,0.0030154657755534615,2,452,0.7189555010456838,3.2560207374053015e-05,77.05312599674347,COMPLETE
427,0.17772896587848663,2023-09-04 12:03:56.716145,2023-09-04 12:03:57.565559,0 days 00:00:00.849414,Leaky,Tanh,,,87,19,23.0,,,0.005637497320344759,2,457,0.7748230655824706,0.00011622920804132499,72.80996912638346,COMPLETE
428,0.18564170598983765,2023-09-04 12:03:57.565892,2023-09-04 12:03:58.169345,0 days 00:00:00.603453,Leaky,Sigmoid,,,35,21,23.0,,,0.013004078395089491,2,414,0.35854318196102,1.5099240671828682e-05,68.80359371637894,COMPLETE
429,0.2173057496547699,2023-09-04 12:03:58.169683,2023-09-04 12:03:58.760038,0 days 00:00:00.590355,Sigmoid,Tanh,,,90,19,14.0,,,0.00886895435373589,2,483,0.7431203951361457,8.956461567537349e-05,123.75919101856373,COMPLETE
430,0.1917462795972824,2023-09-04 12:03:58.760368,2023-09-04 12:03:58.983022,0 days 00:00:00.222654,ReLU,Leaky,,,97,20,15.0,,,0.010354641021717933,2,445,0.3006206639455304,0.00013936360815423011,75.20879979567094,COMPLETE
431,0.19290639460086823,2023-09-04 12:03:58.983346,2023-09-04 12:03:59.470902,0 days 00:00:00.487556,Leaky,Tanh,,,84,18,7.0,,,0.01347840835112204,2,494,0.7974989070706452,0.0006246587169513695,102.96832163740949,COMPLETE
432,0.1780099868774414,2023-09-04 12:03:59.471238,2023-09-04 12:03:59.792100,0 days 00:00:00.320862,ReLU,Tanh,,,80,17,12.0,,,0.02606303637775812,2,461,0.2592207848858815,5.32847121803213e-05,81.83621409241583,COMPLETE
433,0.18486544489860535,2023-09-04 12:03:59.792451,2023-09-04 12:04:00.397843,0 days 00:00:00.605392,ReLU,Tanh,,,86,18,18.0,,,0.0067205328577067906,2,426,0.7095868013966926,6.297882968844438e-05,76.98709119830215,COMPLETE
434,0.1875610500574112,2023-09-04 12:04:00.398188,2023-09-04 12:04:01.281672,0 days 00:00:00.883484,ReLU,Tanh,,,75,17,13.0,,,0.01100046824018133,2,470,0.7500449203611673,0.0004064213224657463,129.65306112501355,COMPLETE
435,0.12985192239284515,2023-09-04 12:04:01.282004,2023-09-04 12:04:03.140867,0 days 00:00:01.858863,ReLU,Sigmoid,,,78,20,16.0,,,0.004348662267076873,2,449,0.6515075722974648,2.8973830425933102e-05,73.96145745721788,COMPLETE
436,0.17205354571342468,2023-09-04 12:04:03.141196,2023-09-04 12:04:03.927968,0 days 00:00:00.786772,ReLU,Tanh,,,87,17,21.0,,,0.008716481291508975,2,437,0.7704950294594999,1.9657795495777403e-05,170.68187789916993,COMPLETE
437,0.13014665246009827,2023-09-04 12:04:03.928305,2023-09-04 12:04:04.369403,0 days 00:00:00.441098,ReLU,ReLU,,,84,18,24.0,,,0.02164448625644994,2,479,0.7233074295920412,0.00017563804885046256,71.30285911560058,COMPLETE
438,0.27756667137145996,2023-09-04 12:04:04.369732,2023-09-04 12:04:04.901138,0 days 00:00:00.531406,ReLU,Tanh,,,91,21,22.0,,,0.005464033861157638,2,463,0.7993128329765341,0.03555171078711783,96.00671725802951,COMPLETE
439,0.1656952202320099,2023-09-04 12:04:04.901457,2023-09-04 12:04:05.394757,0 days 00:00:00.493300,Tanh,ReLU,,,80,17,17.0,,,0.016131671605896868,2,407,0.49218261478243636,1.3285788398010736e-05,69.13131895519439,COMPLETE
440,0.23250404000282288,2023-09-04 12:04:05.395082,2023-09-04 12:04:08.444336,0 days 00:00:03.049254,ReLU,Leaky,,,69,19,14.0,,,0.0005714082783615926,2,455,0.3483577619696832,2.5271626649704606e-05,163.45024480646308,COMPLETE
441,0.2243809849023819,2023-09-04 12:04:08.444912,2023-09-04 12:04:10.163675,0 days 00:00:01.718763,Leaky,Tanh,,,83,20,13.0,,,0.0077062887730221675,2,354,0.5640148571126435,0.0005497634988928299,90.06461486816406,COMPLETE
442,0.1747007519006729,2023-09-04 12:04:10.164241,2023-09-04 12:04:12.443902,0 days 00:00:02.279661,ReLU,ReLU,,,73,18,24.0,,,0.001685704000977617,2,181,0.5826031102560657,0.00014958325431525696,69.46024081820534,COMPLETE
443,0.1624326854944229,2023-09-04 12:04:12.444484,2023-09-04 12:04:14.486548,0 days 00:00:02.042064,ReLU,Tanh,,,88,22,20.0,,,0.012181195581006504,2,430,0.687388975508034,4.699000608120268e-05,82.11059695652553,COMPLETE
444,0.17033831775188446,2023-09-04 12:04:14.487112,2023-09-04 12:04:15.366585,0 days 00:00:00.879473,ReLU,ReLU,,,76,17,22.0,,,0.030361907368853334,2,488,0.7504451515923142,0.00010027050594115181,70.92246341705322,COMPLETE
445,0.2618810832500458,2023-09-04 12:04:15.367157,2023-09-04 12:04:16.598728,0 days 00:00:01.231571,ReLU,Tanh,,,85,18,15.0,,,0.014186264103187341,2,473,0.672239690611623,0.0032728064195367747,185.11414337158203,COMPLETE
446,0.16413597762584686,2023-09-04 12:04:16.599290,2023-09-04 12:04:18.864234,0 days 00:00:02.264944,ReLU,ReLU,Tanh,Tanh,81,17,23.0,16.0,19.0,0.019908323881606207,4,420,0.6295589050320248,1.0235705481286262e-05,74.85757980346679,COMPLETE
447,0.12710340321063995,2023-09-04 12:04:18.864823,2023-09-04 12:04:21.584360,0 days 00:00:02.719537,ReLU,Tanh,,,78,19,13.0,,,0.010747332432040423,2,444,0.7294399541263118,0.0007401136798571948,168.3240504545324,COMPLETE
448,0.16418221592903137,2023-09-04 12:04:21.584912,2023-09-04 12:04:22.954458,0 days 00:00:01.369546,Leaky,ReLU,,,83,16,16.0,,,0.006502164405083681,2,162,0.7699394315769141,0.0024468204721055605,74.36640725484709,COMPLETE
449,0.2211390882730484,2023-09-04 12:04:22.955033,2023-09-04 12:04:23.972092,0 days 00:00:01.017059,Sigmoid,Sigmoid,,,92,21,15.0,,,0.026058115261943984,2,463,0.3235507748395262,0.00026117489650705466,77.15076377656725,COMPLETE
450,0.23673585057258606,2023-09-04 12:04:23.972658,2023-09-04 12:04:25.182613,0 days 00:00:01.209955,ReLU,Tanh,,,90,17,21.0,,,0.003542440035216522,2,482,0.3444358975689303,8.004733169758593e-05,161.8884867668152,COMPLETE
451,0.26794296503067017,2023-09-04 12:04:25.183186,2023-09-04 12:04:25.658445,0 days 00:00:00.475259,ReLU,ReLU,,,86,10,23.0,,,0.009006823393767375,2,500,0.12142391432869114,0.0047696027369417745,80.78212274087441,COMPLETE
452,0.313472181558609,2023-09-04 12:04:25.659018,2023-09-04 12:04:35.523637,0 days 00:00:09.864619,ReLU,Tanh,,,74,20,12.0,,,8.615376394812756e-05,2,436,0.5045477632043209,0.00011163277314597071,113.90211667052102,COMPLETE
453,0.23307445645332336,2023-09-04 12:04:35.524210,2023-09-04 12:04:40.617291,0 days 00:00:05.093081,ReLU,,,,20,16,,,,0.004722328526503184,1,449,0.7010287382375134,0.0005949864622157649,81.36324877616687,COMPLETE
454,0.21608684957027435,2023-09-04 12:04:40.617829,2023-09-04 12:04:41.413510,0 days 00:00:00.795681,ReLU,ReLU,,,80,18,14.0,,,0.015235412787166528,2,471,0.7996174433012623,0.0008986902428956368,88.77898806617374,COMPLETE
455,0.188284769654274,2023-09-04 12:04:41.414059,2023-09-04 12:04:47.059360,0 days 00:00:05.645301,ReLU,Leaky,,,48,20,24.0,,,0.00037537451566578437,2,457,0.7434624532720475,3.466422754030235e-05,90.40870120661046,COMPLETE
456,0.23312810063362122,2023-09-04 12:04:47.059944,2023-09-04 12:04:52.057157,0 days 00:00:04.997213,Leaky,Tanh,,,77,3,17.0,,,0.001455234118786402,2,175,0.7678576156579889,0.000359070390750754,87.95612243037895,COMPLETE
457,0.15656119585037231,2023-09-04 12:04:52.057724,2023-09-04 12:04:53.583235,0 days 00:00:01.525511,ReLU,ReLU,ReLU,,85,18,22.0,24.0,,0.007791443829200674,3,430,0.7011234094398834,6.408037787434822e-05,73.78206696621207,COMPLETE
458,0.1661245971918106,2023-09-04 12:04:53.583826,2023-09-04 12:04:55.726741,0 days 00:00:02.142915,ReLU,Tanh,,,82,16,23.0,,,0.0020370126597770723,2,393,0.6573008015955686,0.00020690260286165032,76.2325177443655,COMPLETE
459,0.21242934465408325,2023-09-04 12:04:55.727298,2023-09-04 12:04:56.272100,0 days 00:00:00.544802,ReLU,ReLU,,,88,17,18.0,,,0.03685083295673712,2,444,0.21601094857755804,0.00047771150624327454,79.84305856742111,COMPLETE
460,0.23983824253082275,2023-09-04 12:04:56.272676,2023-09-04 12:04:58.173659,0 days 00:00:01.900983,ReLU,Tanh,,,95,14,19.0,,,0.0027037546372519557,2,466,0.40485790754724726,1.6393189664772295e-05,102.0257243944251,COMPLETE
461,0.13983216881752014,2023-09-04 12:04:58.174234,2023-09-04 12:04:59.045307,0 days 00:00:00.871073,ReLU,ReLU,,,98,17,15.0,,,0.019087814089952516,2,292,0.5258761280333646,0.00012575551502004258,86.88406963348389,COMPLETE
462,0.22845861315727234,2023-09-04 12:04:59.045875,2023-09-04 12:04:59.716359,0 days 00:00:00.670484,Leaky,Tanh,,,93,19,12.0,,,0.08333515809591138,2,454,0.74840390009285,0.001470123931915502,104.584228515625,COMPLETE
463,0.6084228157997131,2023-09-04 12:04:59.716916,2023-09-04 12:05:03.343867,0 days 00:00:03.626951,ReLU,ReLU,,,84,17,14.0,,,5.093395758199916e-05,2,477,0.16072665920411888,0.00016562791266534941,115.74247073127539,COMPLETE
464,0.5355672240257263,2023-09-04 12:05:03.344433,2023-09-04 12:05:19.529093,0 days 00:00:16.184660,Tanh,Tanh,,,71,21,13.0,,,1.5200645331050487e-05,2,491,0.7196632414722125,0.0007069390490007236,135.0580631108488,COMPLETE
465,0.2455713152885437,2023-09-04 12:05:19.529662,2023-09-04 12:05:20.588732,0 days 00:00:01.059070,ReLU,ReLU,,,67,12,6.0,,,0.005811390639836725,2,413,0.2814748213432291,1.4429425213529738e-05,249.8504337794344,COMPLETE
466,0.8490834832191467,2023-09-04 12:05:20.589290,2023-09-04 12:05:21.990540,0 days 00:00:01.401250,ReLU,Sigmoid,,,79,16,24.0,,,2.419030844381154e-05,2,148,0.20051094404133482,8.472770434805632e-05,123.46685641520732,COMPLETE
467,0.25196197628974915,2023-09-04 12:05:21.991118,2023-09-04 12:05:22.623322,0 days 00:00:00.632204,ReLU,Tanh,,,87,19,16.0,,,0.010889643662588858,2,420,0.26531712144310066,0.0009858378462282579,94.04246934254964,COMPLETE
468,0.1931254118680954,2023-09-04 12:05:22.623907,2023-09-04 12:05:24.860801,0 days 00:00:02.236894,ReLU,Leaky,,,41,18,14.0,,,0.022586644354636594,2,442,0.79976409976308,0.000423809827170554,98.88431186676026,COMPLETE
469,0.16109085083007812,2023-09-04 12:05:24.861370,2023-09-04 12:05:28.261177,0 days 00:00:03.399807,ReLU,ReLU,,,82,16,22.0,,,0.002235060623954016,2,467,0.7660681744741413,4.287821258213274e-05,68.49925137474423,COMPLETE
470,0.31326714158058167,2023-09-04 12:05:28.261748,2023-09-04 12:05:29.031212,0 days 00:00:00.769464,Leaky,Tanh,,,26,17,23.0,,,0.013787907648070172,2,436,0.17448025012407387,0.00054889324837174,164.27094891196802,COMPLETE
471,0.14156588912010193,2023-09-04 12:05:29.031789,2023-09-04 12:05:30.839253,0 days 00:00:01.807464,ReLU,ReLU,,,75,20,20.0,,,0.009588512793872928,2,455,0.7284852319198574,2.4727939922099644e-05,99.00979725519817,COMPLETE
472,0.17394699156284332,2023-09-04 12:05:30.839588,2023-09-04 12:05:31.207811,0 days 00:00:00.368223,ReLU,Tanh,,,89,18,15.0,,,0.029567248888285172,2,483,0.6123225857599677,0.00031488562931509937,332.13640795255964,COMPLETE
473,0.36199215054512024,2023-09-04 12:05:31.208145,2023-09-04 12:05:36.314532,0 days 00:00:05.106387,Sigmoid,ReLU,,,77,19,17.0,,,0.0002825896028101554,2,476,0.6848937943499859,0.006403211466245783,144.76621148566238,COMPLETE
474,0.20145605504512787,2023-09-04 12:05:36.314850,2023-09-04 12:05:36.994637,0 days 00:00:00.679787,ReLU,Tanh,,,85,17,21.0,,,0.006977672557865286,2,191,0.771161647409784,2.053257885083821e-05,100.63894536939718,COMPLETE
475,0.15084990859031677,2023-09-04 12:05:36.994974,2023-09-04 12:05:37.760676,0 days 00:00:00.765702,ReLU,ReLU,,,80,8,13.0,,,0.017588134124238406,2,424,0.7244792110407834,0.0008046657624894066,79.95617396394971,COMPLETE
476,0.22373683750629425,2023-09-04 12:05:37.761000,2023-09-04 12:05:38.031613,0 days 00:00:00.270613,ReLU,Tanh,,,83,11,24.0,,,0.012019062214177026,2,449,0.387885430425265,0.0012550385029316653,162.86614685058595,COMPLETE
477,0.6434439420700073,2023-09-04 12:05:38.031967,2023-09-04 12:05:42.362068,0 days 00:00:04.330101,Leaky,Sigmoid,,,86,15,16.0,,,1.0464588578567291e-05,2,460,0.6726731764864239,1.1954371919906869e-05,149.94597527877144,COMPLETE
478,0.2320229858160019,2023-09-04 12:05:42.362407,2023-09-04 12:05:42.638583,0 days 00:00:00.276176,ReLU,ReLU,,,73,21,22.0,,,0.008243443608743356,2,490,0.4313473574258857,0.0006303622162580445,77.46983662773582,COMPLETE
479,0.2009192705154419,2023-09-04 12:05:42.638964,2023-09-04 12:05:43.578166,0 days 00:00:00.939202,ReLU,Tanh,,,81,16,13.0,,,0.005148179404851738,2,431,0.7486659767649029,0.0001380275489341303,100.58611170450847,COMPLETE
480,0.1761590540409088,2023-09-04 12:05:43.578484,2023-09-04 12:05:43.822675,0 days 00:00:00.244191,ReLU,ReLU,,,88,14,23.0,,,0.024128269484232003,2,463,0.45980047394440643,0.00010939876171675153,60.61507058912708,COMPLETE
481,0.247064471244812,2023-09-04 12:05:43.823005,2023-09-04 12:05:44.456371,0 days 00:00:00.633366,ReLU,Tanh,,,90,20,12.0,,,0.014679922880553099,2,440,0.7031625632066653,0.0019339150684718836,87.91468558772918,COMPLETE
482,0.16761529445648193,2023-09-04 12:05:44.456723,2023-09-04 12:05:45.653963,0 days 00:00:01.197240,ReLU,Leaky,,,78,17,19.0,,,0.004152326647300218,2,471,0.7743842121715154,7.274741231280201e-05,70.60233586377437,COMPLETE
483,0.21542683243751526,2023-09-04 12:05:45.654337,2023-09-04 12:05:45.985452,0 days 00:00:00.331115,ReLU,Tanh,,,83,18,14.0,,,0.009744504586151488,2,403,0.63374249536782,0.010372718802889976,148.14232277870178,COMPLETE
484,0.3583287000656128,2023-09-04 12:05:45.985768,2023-09-04 12:05:46.899896,0 days 00:00:00.914128,Leaky,ReLU,,,76,13,23.0,,,0.0002329368070458533,2,171,0.33338465462412104,5.548395060336395e-05,226.61869017840826,COMPLETE
