number,value,datetime_start,datetime_complete,duration,params_activation1,params_activation2,params_activation3,params_activation4,params_batch_size,params_fl1,params_fl2,params_fl3,params_fl4,params_learning_rate,params_n_layers,params_num_epochs,params_train_size,params_weight_decay,user_attrs_mre,state
280,0.17827355861663818,2023-09-04 12:01:35.502977,2023-09-04 12:01:36.182017,0 days 00:00:00.679040,Tanh,ReLU,Sigmoid,,56,24,10.0,7.0,,0.01413355634399806,3,256,0.7961387589143951,0.00019715968964795975,93.37366935534355,COMPLETE
281,0.18472827970981598,2023-09-04 12:01:36.182340,2023-09-04 12:01:36.791606,0 days 00:00:00.609266,ReLU,Leaky,Sigmoid,,42,24,17.0,8.0,,0.019928867287025958,3,268,0.5471092199793317,0.00026980565889254027,90.17924251556397,COMPLETE
282,0.17550915479660034,2023-09-04 12:01:36.791916,2023-09-04 12:01:37.473862,0 days 00:00:00.681946,ReLU,ReLU,Sigmoid,,98,9,9.0,6.0,,0.026858853958070042,3,248,0.7653819917404205,0.0001161998168525107,114.06036262512207,COMPLETE
283,0.3224942684173584,2023-09-04 12:01:37.474189,2023-09-04 12:01:38.130374,0 days 00:00:00.656185,Tanh,ReLU,Sigmoid,,53,23,11.0,7.0,,0.01713169364955079,3,256,0.6694274815646493,0.021835448066900073,115.47459411621094,COMPLETE
284,0.2889476716518402,2023-09-04 12:01:38.130672,2023-09-04 12:01:39.180439,0 days 00:00:01.049767,Sigmoid,ReLU,ReLU,,58,23,10.0,9.0,,0.0005254875074560229,3,271,0.16754011611959263,8.714968126633847e-05,175.2130860050666,COMPLETE
285,0.18581335246562958,2023-09-04 12:01:39.180748,2023-09-04 12:01:39.968519,0 days 00:00:00.787771,ReLU,ReLU,Sigmoid,,54,23,9.0,6.0,,0.013417505151790656,3,239,0.7991811712259097,0.0004275032563555022,89.72650909423828,COMPLETE
286,0.21587422490119934,2023-09-04 12:01:39.968831,2023-09-04 12:01:40.578868,0 days 00:00:00.610037,ReLU,ReLU,Sigmoid,,80,19,5.0,8.0,,0.015471706035553371,3,382,0.720059709585509,0.0002132009318826838,114.48897988455636,COMPLETE
287,0.20112627744674683,2023-09-04 12:01:40.579175,2023-09-04 12:01:41.141670,0 days 00:00:00.562495,Tanh,Leaky,Sigmoid,,51,24,11.0,7.0,,0.020904343179177717,3,449,0.753074223219236,0.0001481775220128222,210.2743153725901,COMPLETE
288,0.1932692676782608,2023-09-04 12:01:41.141976,2023-09-04 12:01:41.818592,0 days 00:00:00.676616,ReLU,ReLU,Sigmoid,,55,20,10.0,20.0,,0.03385725359803006,3,262,0.6931823120118308,7.17662917492954e-05,83.66179202851795,COMPLETE
289,0.22542676329612732,2023-09-04 12:01:41.819008,2023-09-04 12:01:42.283579,0 days 00:00:00.464571,Tanh,,,,52,18,,,,0.011797914079685229,1,246,0.7505586638855696,0.00012975840325428885,69.97886121595228,COMPLETE
290,0.19669224321842194,2023-09-04 12:01:42.283883,2023-09-04 12:01:42.824960,0 days 00:00:00.541077,ReLU,ReLU,Sigmoid,,62,22,20.0,6.0,,0.018181676880410832,3,232,0.7238295218249295,1.0184690570530099e-05,81.29481179373605,COMPLETE
291,0.1765226423740387,2023-09-04 12:01:42.825262,2023-09-04 12:01:43.376060,0 days 00:00:00.550798,ReLU,ReLU,Sigmoid,,45,23,9.0,7.0,,0.02490810905416281,3,475,0.770503726609347,0.00010058312058421546,94.98126729329427,COMPLETE
292,0.19787666201591492,2023-09-04 12:01:43.376369,2023-09-04 12:01:43.685084,0 days 00:00:00.308715,Tanh,ReLU,Sigmoid,,96,24,10.0,22.0,,0.06911422426768911,3,281,0.37985609667996734,0.0003297787476585244,122.26668432484503,COMPLETE
293,0.21173320710659027,2023-09-04 12:01:43.685388,2023-09-04 12:01:47.211833,0 days 00:00:03.526445,Leaky,ReLU,Sigmoid,,56,12,13.0,9.0,,0.0007141798501540742,3,270,0.7995362633546608,0.0003523324107304438,175.1976294225576,COMPLETE
294,0.19369609653949738,2023-09-04 12:01:47.212146,2023-09-04 12:01:47.831285,0 days 00:00:00.619139,ReLU,ReLU,Sigmoid,,38,22,9.0,6.0,,0.01389531127742055,3,255,0.648825214455901,0.0005571207705989633,103.37299346923828,COMPLETE
295,0.22376708686351776,2023-09-04 12:01:47.831587,2023-09-04 12:01:48.024986,0 days 00:00:00.193399,Tanh,Leaky,Sigmoid,,74,24,18.0,19.0,,0.015647186208408312,3,243,0.329999511077336,0.00022700060659089732,121.36828094482422,COMPLETE
296,0.21276910603046417,2023-09-04 12:01:48.025292,2023-09-04 12:01:48.692977,0 days 00:00:00.667685,ReLU,ReLU,Sigmoid,,53,23,11.0,8.0,,0.011184309102491345,3,262,0.6893905596671143,0.00017886590300033748,82.10802732195172,COMPLETE
297,0.19622790813446045,2023-09-04 12:01:48.693292,2023-09-04 12:01:49.646305,0 days 00:00:00.953013,ReLU,ReLU,Tanh,,60,22,16.0,5.0,,0.0013260835546179423,3,136,0.5262513661048297,8.617076842069128e-05,93.43440562281116,COMPLETE
298,0.18748410046100616,2023-09-04 12:01:49.646635,2023-09-04 12:01:50.358651,0 days 00:00:00.712016,Tanh,ReLU,Sigmoid,,86,20,14.0,7.0,,0.02046842411887268,3,217,0.7372354601555611,6.0337277470729934e-05,101.39558310257762,COMPLETE
299,0.20091040432453156,2023-09-04 12:01:50.359181,2023-09-04 12:01:50.798474,0 days 00:00:00.439293,ReLU,ReLU,Sigmoid,,48,23,9.0,8.0,,0.027815632466174446,3,86,0.3680424046117498,0.0019135384201578898,120.81815438521535,COMPLETE
300,0.21694642305374146,2023-09-04 12:01:50.798782,2023-09-04 12:01:51.300292,0 days 00:00:00.501510,Tanh,Sigmoid,Sigmoid,,51,21,2.0,11.0,,0.08406861540128556,3,275,0.7673998775178105,0.0008919780994862,123.41876135932074,COMPLETE
301,0.18083682656288147,2023-09-04 12:01:51.300617,2023-09-04 12:01:51.807095,0 days 00:00:00.506478,ReLU,Tanh,Sigmoid,,100,22,12.0,6.0,,0.018018379492817233,3,172,0.7302009954837211,0.00013676040760872183,70.0590939839681,COMPLETE
302,0.2095574289560318,2023-09-04 12:01:51.807413,2023-09-04 12:01:52.264729,0 days 00:00:00.457316,ReLU,ReLU,Sigmoid,,58,24,10.0,5.0,,0.040452686086578406,3,253,0.7104108275007408,1.1741082950265978e-05,88.46910621379983,COMPLETE
303,0.1877439320087433,2023-09-04 12:01:52.265064,2023-09-04 12:01:52.749941,0 days 00:00:00.484877,Tanh,Leaky,Sigmoid,,55,21,21.0,7.0,,0.013440027303950034,3,229,0.7638065857434734,0.00026377663085626915,84.37009444060149,COMPLETE
304,0.20831298828125,2023-09-04 12:01:52.750253,2023-09-04 12:01:53.661589,0 days 00:00:00.911336,ReLU,Sigmoid,ReLU,,50,23,8.0,10.0,,0.023476484697056578,3,102,0.6800704857563395,6.793080271683116e-05,96.47185952322823,COMPLETE
305,0.20477358996868134,2023-09-04 12:01:53.662140,2023-09-04 12:01:54.224332,0 days 00:00:00.562192,Tanh,ReLU,Sigmoid,,53,24,19.0,9.0,,0.010460932434820363,3,130,0.7975094659350674,0.00011221448171085422,100.9139701298305,COMPLETE
306,0.25280237197875977,2023-09-04 12:01:54.224650,2023-09-04 12:01:56.785932,0 days 00:00:02.561282,ReLU,ReLU,Sigmoid,,57,7,10.0,8.0,,0.0009708546944419284,3,239,0.5176524885716814,0.0001626357276353905,97.59183559657141,COMPLETE
307,0.20702224969863892,2023-09-04 12:01:56.786253,2023-09-04 12:01:58.013713,0 days 00:00:01.227460,ReLU,Sigmoid,Sigmoid,,47,11,9.0,7.0,,0.016932375227871655,3,285,0.7472067787711663,1.7128614448606693e-05,122.23334020726821,COMPLETE
308,0.1971118301153183,2023-09-04 12:01:58.014037,2023-09-04 12:01:58.545390,0 days 00:00:00.531353,Tanh,ReLU,Sigmoid,,55,22,3.0,6.0,,0.008516611016967391,3,267,0.626895502931755,7.696875965021645e-05,148.54804929097494,COMPLETE
309,0.21821977198123932,2023-09-04 12:01:58.545707,2023-09-04 12:01:59.370484,0 days 00:00:00.824777,Sigmoid,ReLU,Sigmoid,,40,23,4.0,4.0,,0.02072011205182978,3,247,0.7995979103343699,1.3825448946699324e-05,87.14729309082031,COMPLETE
310,0.23955251276493073,2023-09-04 12:01:59.370810,2023-09-04 12:01:59.822768,0 days 00:00:00.451958,ReLU,Sigmoid,Sigmoid,,52,14,11.0,5.0,,0.012883554947450575,3,255,0.44133625920027836,9.94280587173978e-05,86.19319524997618,COMPLETE
311,0.20722708106040955,2023-09-04 12:01:59.823174,2023-09-04 12:02:00.131825,0 days 00:00:00.308651,Tanh,ReLU,Sigmoid,,50,23,10.0,8.0,,0.03015178310208244,3,293,0.7097024130913949,0.0004447919495757443,111.13174867630005,COMPLETE
312,0.16433268785476685,2023-09-04 12:02:00.132195,2023-09-04 12:02:01.420900,0 days 00:00:01.288705,ReLU,Leaky,Sigmoid,,54,21,9.0,6.0,,0.01559673758160622,3,273,0.7616907813496613,0.00019176227650386752,82.92391277003932,COMPLETE
313,0.199064239859581,2023-09-04 12:02:01.421436,2023-09-04 12:02:02.995497,0 days 00:00:01.574061,ReLU,Leaky,Sigmoid,,54,21,8.0,6.0,,0.015014151454189714,3,142,0.2811493605300451,0.00020681611461392671,113.4751143022017,COMPLETE
314,0.20857012271881104,2023-09-04 12:02:02.996115,2023-09-04 12:02:10.571461,0 days 00:00:07.575346,Tanh,Leaky,Sigmoid,,24,22,5.0,24.0,,0.00023760747257013903,3,188,0.7684425405291477,0.0001594481957610969,104.0757826081999,COMPLETE
315,0.18220128118991852,2023-09-04 12:02:10.571839,2023-09-04 12:02:11.072483,0 days 00:00:00.500644,ReLU,Leaky,Sigmoid,,52,21,7.0,7.0,,0.011375359932189836,3,113,0.7633251290835001,0.0003014114653720547,97.30771284836989,COMPLETE
316,0.19730263948440552,2023-09-04 12:02:11.072800,2023-09-04 12:02:11.733663,0 days 00:00:00.660863,ReLU,Leaky,Sigmoid,,56,22,15.0,7.0,,0.007388348140309909,3,263,0.5720173318003113,0.00024212933923427018,195.50009460449218,COMPLETE
317,0.18772444128990173,2023-09-04 12:02:11.733963,2023-09-04 12:02:12.411995,0 days 00:00:00.678032,Tanh,Leaky,Leaky,,54,24,9.0,6.0,,0.009809369141735759,3,270,0.7414873453065155,0.00018191954733317534,88.69620571136474,COMPLETE
318,0.19276003539562225,2023-09-04 12:02:12.412307,2023-09-04 12:02:13.147867,0 days 00:00:00.735560,Leaky,Leaky,Sigmoid,,50,23,10.0,18.0,,0.006048077461253763,3,250,0.6850617074137588,4.986003311556399e-05,95.87451640042391,COMPLETE
319,0.18852747976779938,2023-09-04 12:02:13.148184,2023-09-04 12:02:13.528258,0 days 00:00:00.380074,ReLU,Sigmoid,Tanh,,93,22,11.0,8.0,,0.015447733860788746,3,128,0.6542562119533745,0.00012897036202392178,103.08400277530446,COMPLETE
320,0.20021356642246246,2023-09-04 12:02:13.528570,2023-09-04 12:02:14.064993,0 days 00:00:00.536423,Tanh,Sigmoid,Sigmoid,,44,21,9.0,1.0,,0.02442305522670829,3,227,0.7995810843980581,0.00018881836974418093,114.93336853027344,COMPLETE
321,0.2158339023590088,2023-09-04 12:02:14.065303,2023-09-04 12:02:14.245848,0 days 00:00:00.180545,ReLU,Leaky,Sigmoid,,98,24,8.0,9.0,,0.012353646873778577,3,235,0.26313509509925603,0.0014540850898031572,837.916669957778,COMPLETE
322,0.16083364188671112,2023-09-04 12:02:14.246158,2023-09-04 12:02:15.012239,0 days 00:00:00.766081,ReLU,Tanh,Leaky,,48,23,10.0,10.0,,0.018854765074269805,3,274,0.7200866197118417,8.665338698655547e-05,99.39289038521903,COMPLETE
323,0.18161366879940033,2023-09-04 12:02:15.012550,2023-09-04 12:02:16.145813,0 days 00:00:01.133263,Tanh,Tanh,Leaky,,48,22,10.0,23.0,,0.004558321919556587,3,285,0.7681002424021837,8.495709206852077e-05,94.93663464562367,COMPLETE
324,0.19685277342796326,2023-09-04 12:02:16.146125,2023-09-04 12:02:16.787508,0 days 00:00:00.641383,ReLU,Tanh,Leaky,,46,23,11.0,10.0,,0.01946615709766661,3,269,0.7301690965812265,0.00010720157249708163,78.6466858807732,COMPLETE
325,0.18383511900901794,2023-09-04 12:02:16.787820,2023-09-04 12:02:17.403881,0 days 00:00:00.616061,ReLU,Tanh,Leaky,,52,24,10.0,10.0,,0.022123125674143578,3,276,0.769481928074436,0.00013469431153343494,93.16739968692555,COMPLETE
326,0.1935006082057953,2023-09-04 12:02:17.404187,2023-09-04 12:02:18.051179,0 days 00:00:00.646992,Tanh,Tanh,Leaky,,54,22,10.0,9.0,,0.033577443294180824,3,278,0.7157227575366079,0.00011298929518885589,95.44861152844551,COMPLETE
327,0.19210238754749298,2023-09-04 12:02:18.051491,2023-09-04 12:02:18.593707,0 days 00:00:00.542216,ReLU,Tanh,Leaky,,96,21,6.0,9.0,,0.01777449001964657,3,260,0.7400708657471183,6.752065857579502e-05,66.63198445060037,COMPLETE
328,0.39188677072525024,2023-09-04 12:02:18.594028,2023-09-04 12:02:20.034827,0 days 00:00:01.440799,Tanh,Tanh,Leaky,,48,1,4.0,8.0,,0.0022459957009170963,3,213,0.4852560446921783,8.712877483918073e-05,123.06270518068408,COMPLETE
329,0.2561558187007904,2023-09-04 12:02:20.035147,2023-09-04 12:02:20.397372,0 days 00:00:00.362225,ReLU,Sigmoid,ReLU,,56,23,9.0,8.0,,0.0018762764024579492,3,163,0.19175704256260306,0.00024875643488242905,99.14337101267346,COMPLETE
330,0.2267179638147354,2023-09-04 12:02:20.397681,2023-09-04 12:02:20.699855,0 days 00:00:00.302174,Tanh,ReLU,Leaky,,43,24,10.0,17.0,,0.0026819700347506057,3,124,0.2419131543826572,0.0001691947511608328,137.4390876965645,COMPLETE
331,0.30798953771591187,2023-09-04 12:02:20.700164,2023-09-04 12:02:20.979384,0 days 00:00:00.279220,ReLU,ReLU,Sigmoid,,53,21,9.0,7.0,,0.09811396033195183,3,137,0.7756077206914906,3.3590245833848526e-05,173.86767251150948,COMPLETE
332,0.22267542779445648,2023-09-04 12:02:20.979706,2023-09-04 12:02:22.982451,0 days 00:00:02.002745,ReLU,Sigmoid,Sigmoid,,58,23,11.0,9.0,,0.0011432807395347086,3,403,0.47328757085968554,0.000332424146827651,131.37793387011223,COMPLETE
333,0.21292518079280853,2023-09-04 12:02:22.982760,2023-09-04 12:02:23.253033,0 days 00:00:00.270273,Tanh,ReLU,Leaky,Sigmoid,77,22,8.0,12.0,7.0,0.026783313497751222,4,241,0.3909333120024615,0.00014676301436488648,136.29148575355268,COMPLETE
334,0.19107204675674438,2023-09-04 12:02:23.253352,2023-09-04 12:02:23.935774,0 days 00:00:00.682422,ReLU,ReLU,Sigmoid,,51,24,11.0,7.0,,0.015016962033296914,3,249,0.7091554888523486,0.0002106600814977219,98.43097248077393,COMPLETE
335,0.9678016901016235,2023-09-04 12:02:23.936122,2023-09-04 12:02:28.460086,0 days 00:00:04.523964,Sigmoid,Sigmoid,Sigmoid,,49,20,9.0,8.0,,1.1843435378279134e-05,3,262,0.7437442724800034,2.374144944903265e-05,108.0666872563253,COMPLETE
336,0.27819737792015076,2023-09-04 12:02:28.460397,2023-09-04 12:02:30.585111,0 days 00:00:02.124714,Tanh,ReLU,Sigmoid,,56,2,7.0,6.0,,0.0007645295626514813,3,201,0.5962008124694885,0.00010561373493647984,158.72204405466715,COMPLETE
337,0.21702535450458527,2023-09-04 12:02:30.585664,2023-09-04 12:02:31.447343,0 days 00:00:00.861679,ReLU,ReLU,Sigmoid,,53,23,10.0,7.0,,0.02022692797018527,3,116,0.37047953267571454,1.2190618841024574e-05,218.21363486013104,COMPLETE
338,0.2030174285173416,2023-09-04 12:02:31.447886,2023-09-04 12:02:34.335704,0 days 00:00:02.887818,ReLU,Sigmoid,Leaky,,51,21,18.0,11.0,,0.016668185297448578,3,151,0.774367303679431,0.0007404109632389073,89.1251282527529,COMPLETE
339,0.18915662169456482,2023-09-04 12:02:34.336053,2023-09-04 12:02:35.168542,0 days 00:00:00.832489,Tanh,ReLU,Sigmoid,,35,22,9.0,3.0,,0.02315926650807606,3,274,0.6627498525549782,2.8362623478725496e-05,112.61309716640375,COMPLETE
340,0.2283688336610794,2023-09-04 12:02:35.168863,2023-09-04 12:02:35.480764,0 days 00:00:00.311901,ReLU,Tanh,Sigmoid,,92,24,12.0,8.0,,0.04769539099592006,3,254,0.744051735944805,1.755046243247451e-05,129.80615520477295,COMPLETE
341,0.17780828475952148,2023-09-04 12:02:35.481080,2023-09-04 12:02:36.318669,0 days 00:00:00.837589,Tanh,ReLU,Sigmoid,,54,20,8.0,9.0,,0.008966888409859531,3,50,0.6988105237984724,7.519787282071763e-05,82.31265510559082,COMPLETE
342,0.19457022845745087,2023-09-04 12:02:36.319003,2023-09-04 12:02:37.367176,0 days 00:00:01.048173,ReLU,Sigmoid,Sigmoid,,47,23,21.0,1.0,,0.013300488447133288,3,302,0.7955613103303912,9.419937659116572e-05,69.17858028411865,COMPLETE
343,0.21469493210315704,2023-09-04 12:02:37.367509,2023-09-04 12:02:37.837447,0 days 00:00:00.469938,ReLU,ReLU,Leaky,,55,22,10.0,6.0,,0.03774362091657639,3,220,0.7698810841707581,0.0001252404683438385,90.95978458111102,COMPLETE
344,0.23171353340148926,2023-09-04 12:02:37.837756,2023-09-04 12:02:38.055250,0 days 00:00:00.217494,Tanh,ReLU,Sigmoid,,84,24,7.0,10.0,,0.02886607456536145,3,234,0.31624986877525285,3.9992552985139436e-05,115.8119261264801,COMPLETE
345,0.23805435001850128,2023-09-04 12:02:38.055571,2023-09-04 12:02:38.557654,0 days 00:00:00.502083,Leaky,Sigmoid,Tanh,,57,23,9.0,22.0,,0.010899836926659853,3,281,0.34982479532216304,6.0006290663582566e-05,111.83900632696637,COMPLETE
346,0.2319023162126541,2023-09-04 12:02:38.557967,2023-09-04 12:02:38.787747,0 days 00:00:00.229780,ReLU,ReLU,Sigmoid,,94,21,10.0,4.0,,0.018251739122166495,3,144,0.45233529060409094,0.0036737003858467333,108.3486670034903,COMPLETE
347,0.20660343766212463,2023-09-04 12:02:38.788057,2023-09-04 12:02:39.544493,0 days 00:00:00.756436,Tanh,ReLU,Sigmoid,,17,22,11.0,6.0,,0.015090826235655224,3,244,0.7226634328237717,2.1578753242653647e-05,78.3548821343316,COMPLETE
348,0.18930615484714508,2023-09-04 12:02:39.544804,2023-09-04 12:02:44.916996,0 days 00:00:05.372192,ReLU,Sigmoid,Sigmoid,,45,24,17.0,7.0,,0.00032696873847008534,3,266,0.798979892714335,0.0005289012605451616,97.51228246473728,COMPLETE
349,0.1902015060186386,2023-09-04 12:02:44.917327,2023-09-04 12:02:45.701195,0 days 00:00:00.783868,ReLU,ReLU,Leaky,,49,23,19.0,8.0,,0.003977836087865586,3,131,0.49306258630879474,1.5938644956548955e-05,100.64488983154297,COMPLETE
350,0.1815071403980255,2023-09-04 12:02:45.701531,2023-09-04 12:02:46.314852,0 days 00:00:00.613321,Tanh,ReLU,Sigmoid,,52,20,22.0,9.0,,0.007431231213997088,3,258,0.7528948178112318,0.0003684059200901638,100.17017925486846,COMPLETE
351,0.18080314993858337,2023-09-04 12:02:46.315174,2023-09-04 12:02:47.246531,0 days 00:00:00.931357,ReLU,Sigmoid,Sigmoid,,29,22,8.0,3.0,,0.021697805258350588,3,100,0.5587102818534327,0.00014968918156079762,94.25890250827955,COMPLETE
352,0.1972074806690216,2023-09-04 12:02:47.246858,2023-09-04 12:02:47.903332,0 days 00:00:00.656474,Tanh,ReLU,ReLU,,58,24,6.0,7.0,,0.01719208287669104,3,110,0.7995411509448009,3.2211735656571e-05,80.26187856573807,COMPLETE
353,0.19117160141468048,2023-09-04 12:02:47.903669,2023-09-04 12:02:48.783787,0 days 00:00:00.880118,ReLU,ReLU,Sigmoid,,55,21,9.0,6.0,,0.0119162797632731,3,273,0.67745892067451,0.0002813769257426617,76.31193102820446,COMPLETE
354,0.20050795376300812,2023-09-04 12:02:48.784118,2023-09-04 12:02:49.419146,0 days 00:00:00.635028,Tanh,Sigmoid,Leaky,,51,23,10.0,2.0,,0.025013787112110976,3,291,0.537320673165298,2.552280674893177e-05,113.08224066909479,COMPLETE
355,0.19457530975341797,2023-09-04 12:02:49.419476,2023-09-04 12:02:51.086676,0 days 00:00:01.667200,ReLU,Tanh,Sigmoid,,41,22,23.0,5.0,,0.009763907526213254,3,250,0.7200882094616537,0.00020612741264930406,148.7846733274914,COMPLETE
356,0.19701868295669556,2023-09-04 12:02:51.086999,2023-09-04 12:02:51.789932,0 days 00:00:00.702933,ReLU,ReLU,Sigmoid,,60,24,20.0,7.0,,0.005809106949123771,3,231,0.7510963485580237,2.0169064569941024e-05,72.05251589688388,COMPLETE
357,0.2031983733177185,2023-09-04 12:02:51.790263,2023-09-04 12:02:52.064382,0 days 00:00:00.274119,Tanh,ReLU,Sigmoid,,53,23,10.0,8.0,,0.014247236546171271,3,118,0.4980702961940187,8.794009079004138e-05,312.83611842564176,COMPLETE
358,0.18956375122070312,2023-09-04 12:02:52.064701,2023-09-04 12:02:53.432756,0 days 00:00:01.368055,ReLU,Sigmoid,Sigmoid,,97,21,9.0,4.0,,0.0030320454389157823,3,178,0.699348578264533,4.248756611404804e-05,83.31353982039325,COMPLETE
359,0.22310678660869598,2023-09-04 12:02:53.433078,2023-09-04 12:02:55.598487,0 days 00:00:02.165409,Sigmoid,ReLU,Leaky,,89,22,3.0,6.0,,0.0015570938006732376,3,268,0.7691072800898561,1.3657193104682924e-05,238.94474072402784,COMPLETE
360,0.3435889184474945,2023-09-04 12:02:55.598809,2023-09-04 12:02:57.267244,0 days 00:00:01.668435,Tanh,ReLU,Sigmoid,,100,23,5.0,5.0,,0.000857959243290774,3,431,0.6371496727692892,0.04005107848426552,160.23307155064174,COMPLETE
361,0.1803521364927292,2023-09-04 12:02:57.267575,2023-09-04 12:02:57.760737,0 days 00:00:00.493162,ReLU,Sigmoid,Sigmoid,,57,15,8.0,7.0,,0.020138322896238608,3,135,0.7998506946942796,0.00017550282396276137,267.701167179988,COMPLETE
362,0.17997942864894867,2023-09-04 12:02:57.761303,2023-09-04 12:03:00.840124,0 days 00:00:03.078821,ReLU,ReLU,Sigmoid,,54,24,11.0,21.0,,0.015842402749384532,3,262,0.7335882816831869,0.00011847849852061227,85.05384260608304,COMPLETE
363,0.2016209363937378,2023-09-04 12:03:00.840684,2023-09-04 12:03:02.391230,0 days 00:00:01.550546,Tanh,ReLU,Leaky,,50,13,10.0,8.0,,0.03247470469142041,3,240,0.764457005144641,1.0060074162711252e-05,91.70852851867676,COMPLETE
364,0.2123052179813385,2023-09-04 12:03:02.391788,2023-09-04 12:03:04.448062,0 days 00:00:02.056274,ReLU,Sigmoid,Sigmoid,,48,22,8.0,9.0,,0.012227487587981416,3,282,0.7223881087008809,6.375511994173526e-05,87.09214481554534,COMPLETE
365,0.2216162085533142,2023-09-04 12:03:04.448626,2023-09-04 12:03:05.474792,0 days 00:00:01.026166,Tanh,ReLU,Sigmoid,,56,24,12.0,10.0,,0.019142105513047084,3,224,0.6686930445936915,0.00024387898624659998,119.97731226140803,COMPLETE
366,0.18200436234474182,2023-09-04 12:03:05.475353,2023-09-04 12:03:07.164235,0 days 00:00:01.688882,ReLU,Tanh,Sigmoid,,52,17,9.0,15.0,,0.02449546455862116,3,125,0.74374785282388,7.592723876881031e-05,74.32647633552551,COMPLETE
367,0.28874051570892334,2023-09-04 12:03:07.164803,2023-09-04 12:03:07.643370,0 days 00:00:00.478567,Leaky,ReLU,Leaky,,46,5,11.0,6.0,,0.009000448076133184,3,255,0.15138507574047058,2.430362015940254e-05,307.33416355678014,COMPLETE
368,0.2229951173067093,2023-09-04 12:03:07.643960,2023-09-04 12:03:08.696884,0 days 00:00:01.052924,ReLU,Sigmoid,Sigmoid,,54,19,9.0,5.0,,0.06121498781723848,3,241,0.620043627947532,1.7535204857242326e-05,170.84597206115723,COMPLETE
369,0.21460509300231934,2023-09-04 12:03:08.697437,2023-09-04 12:03:10.230456,0 days 00:00:01.533019,Tanh,ReLU,Tanh,,59,20,10.0,13.0,,0.007368658709073896,3,142,0.4412648564336564,3.480473289819168e-05,115.03977937518425,COMPLETE
370,0.2029881477355957,2023-09-04 12:03:10.231013,2023-09-04 12:03:12.411961,0 days 00:00:02.180948,ReLU,ReLU,Sigmoid,,51,23,10.0,16.0,,0.014130304430674893,3,154,0.7036040130073296,0.0004990434811782866,207.3119319568981,COMPLETE
371,0.2204761803150177,2023-09-04 12:03:12.412515,2023-09-04 12:03:14.609557,0 days 00:00:02.197042,Tanh,Sigmoid,Sigmoid,,49,21,7.0,1.0,,0.04385927002388115,3,247,0.7699397787008989,0.00014564154888431697,142.16678384634164,COMPLETE
372,0.24102766811847687,2023-09-04 12:03:14.610110,2023-09-04 12:03:15.886389,0 days 00:00:01.276279,ReLU,ReLU,Sigmoid,,53,22,9.0,4.0,,0.003740401128571027,3,272,0.30901274192774775,5.178640501579249e-05,93.50703732720737,COMPLETE
