number,value,datetime_start,datetime_complete,duration,params_activation1,params_activation2,params_activation3,params_activation4,params_batch_size,params_fl1,params_fl2,params_fl3,params_fl4,params_learning_rate,params_n_layers,params_num_epochs,params_train_size,params_weight_decay,user_attrs_mre,state
472,0.22222959995269775,2023-09-04 11:56:24.414385,2023-09-04 11:56:25.327539,0 days 00:00:00.913154,ReLU,Leaky,Tanh,,15,11,23.0,8.0,,0.00567797648075693,3,249,0.2781425665348711,6.457874955188396e-05,113.35705062866211,COMPLETE
473,0.24262244999408722,2023-09-04 11:56:25.327873,2023-09-04 11:56:25.580262,0 days 00:00:00.252389,ReLU,ReLU,Tanh,,62,13,24.0,7.0,,0.0037203910823641263,3,98,0.2541894062036899,0.0002127940441837055,116.94912197715358,COMPLETE
474,0.1767137050628662,2023-09-04 11:56:25.580584,2023-09-04 11:56:26.479359,0 days 00:00:00.898775,ReLU,Leaky,Tanh,,64,12,23.0,7.0,,0.007520288232016474,3,458,0.683409275584363,5.7352312256622376e-05,189.6659014225006,COMPLETE
475,0.22638612985610962,2023-09-04 11:56:26.479688,2023-09-04 11:56:26.853104,0 days 00:00:00.373416,ReLU,Leaky,Tanh,,32,12,23.0,9.0,,0.005960595178775431,3,258,0.19266433377929798,0.0001279649192334958,87.73088137308757,COMPLETE
476,0.19953157007694244,2023-09-04 11:56:26.853432,2023-09-04 11:56:27.528518,0 days 00:00:00.675086,ReLU,Leaky,Tanh,,60,12,22.0,7.0,,0.002851242573958316,3,114,0.7398973876663971,4.668546624158954e-05,101.0591281709217,COMPLETE
477,0.1884329617023468,2023-09-04 11:56:27.528848,2023-09-04 11:56:28.317184,0 days 00:00:00.788336,ReLU,Leaky,Tanh,,64,13,22.0,8.0,,0.005116107790265007,3,132,0.7473350375153185,9.009798256191374e-05,92.84945825430063,COMPLETE
478,0.20287281274795532,2023-09-04 11:56:28.317522,2023-09-04 11:56:28.732513,0 days 00:00:00.414991,ReLU,Leaky,Tanh,,55,11,2.0,5.0,,0.007063961516236137,3,127,0.7991219012518687,0.0002822551822282292,113.02024043690075,COMPLETE
479,0.179183229804039,2023-09-04 11:56:28.732838,2023-09-04 11:56:30.146135,0 days 00:00:01.413297,ReLU,Leaky,Sigmoid,,29,14,24.0,6.0,,0.0044178270354569005,3,143,0.7112398602217879,0.00035395080401100844,111.35460565740412,COMPLETE
480,0.18177597224712372,2023-09-04 11:56:30.146458,2023-09-04 11:56:30.851155,0 days 00:00:00.704697,Leaky,Tanh,Tanh,,58,13,23.0,8.0,,0.00848188129972555,3,115,0.6706747069719413,3.508280784945112e-05,96.90892314910889,COMPLETE
481,0.25175854563713074,2023-09-04 11:56:30.851524,2023-09-04 11:56:31.105396,0 days 00:00:00.253872,ReLU,Leaky,Tanh,,59,24,21.0,6.0,,0.0021663635485246685,3,133,0.1667060151556145,6.0564698294385394e-05,88.65910575173118,COMPLETE
482,0.18756763637065887,2023-09-04 11:56:31.105737,2023-09-04 11:56:32.057138,0 days 00:00:00.951401,ReLU,Leaky,Sigmoid,,61,23,22.0,7.0,,0.006249996356355745,3,478,0.7601592652084765,9.46038987300461e-05,90.72622021174027,COMPLETE
483,0.20247367024421692,2023-09-04 11:56:32.057471,2023-09-04 11:56:33.787582,0 days 00:00:01.730111,ReLU,Leaky,Tanh,,62,24,23.0,9.0,,0.00038487150184093644,3,144,0.7076464112904028,0.0003894741730015858,149.0630163192749,COMPLETE
484,0.22000853717327118,2023-09-04 11:56:33.787910,2023-09-04 11:56:35.565854,0 days 00:00:01.777944,ReLU,Leaky,Tanh,,66,23,22.0,10.0,,0.0003295926978621802,3,124,0.7367609340041102,4.1650719843541053e-05,178.40838992211127,COMPLETE
485,0.231375589966774,2023-09-04 11:56:35.566177,2023-09-04 11:56:36.006742,0 days 00:00:00.440565,ReLU,Leaky,Sigmoid,,35,23,24.0,7.0,,0.002584920597093029,3,148,0.17592689810360335,8.42986527563144e-05,141.6197538514068,COMPLETE
486,0.21153691411018372,2023-09-04 11:56:36.007091,2023-09-04 11:56:36.368133,0 days 00:00:00.361042,ReLU,Leaky,,,60,24,20.0,,,0.008400240219729946,2,136,0.43777801038868464,2.93268837066854e-05,136.8266790480841,COMPLETE
487,0.2179175764322281,2023-09-04 11:56:36.368462,2023-09-04 11:56:37.984983,0 days 00:00:01.616521,ReLU,Leaky,Tanh,,62,23,1.0,8.0,,0.0018515402962444082,3,105,0.7718823351394347,5.0775205266250565e-05,248.71868634905135,COMPLETE
488,0.18220898509025574,2023-09-04 11:56:37.985313,2023-09-04 11:56:38.437623,0 days 00:00:00.452310,ReLU,Leaky,Tanh,Leaky,63,24,21.0,7.0,12.0,0.007353762062594532,4,395,0.4549525749779781,3.5408691589315144e-05,75.37574748503856,COMPLETE
489,0.21966281533241272,2023-09-04 11:56:38.437982,2023-09-04 11:56:39.337600,0 days 00:00:00.899618,ReLU,Leaky,Sigmoid,,55,22,23.0,8.0,,0.0007916135321656238,3,123,0.49767269491066185,0.0004650732660685007,86.78357619273511,COMPLETE
490,0.22523729503154755,2023-09-04 11:56:39.337943,2023-09-04 11:56:39.981755,0 days 00:00:00.643812,ReLU,Leaky,Tanh,,19,23,20.0,6.0,,0.003710679865603249,3,245,0.352965534296049,2.5394440489336336e-05,87.20364541718455,COMPLETE
491,0.20489226281642914,2023-09-04 11:56:39.982107,2023-09-04 11:56:40.579354,0 days 00:00:00.597247,Leaky,Tanh,Tanh,,15,24,22.0,8.0,,0.005246042008263965,3,137,0.3266179859430633,0.00011798045463933213,154.5510844477901,COMPLETE
492,0.22371937334537506,2023-09-04 11:56:40.579704,2023-09-04 11:56:40.880786,0 days 00:00:00.301082,ReLU,Leaky,Sigmoid,,67,23,21.0,7.0,,0.009067634078343573,3,267,0.40593390532984297,0.0054461271872980116,115.70736789703369,COMPLETE
493,0.2608216404914856,2023-09-04 11:56:40.881133,2023-09-04 11:56:42.335876,0 days 00:00:01.454743,ReLU,Leaky,,,12,8,2.0,,,0.09380704052244626,2,151,0.7994197332698291,0.0006055140945330413,120.81920288085938,COMPLETE
494,0.17318770289421082,2023-09-04 11:56:42.336218,2023-09-04 11:56:43.736473,0 days 00:00:01.400255,ReLU,Leaky,Tanh,,17,22,20.0,6.0,,0.006063499090599007,3,118,0.5479364952761684,3.06709089850097e-05,97.46969118985263,COMPLETE
495,0.1958278864622116,2023-09-04 11:56:43.736826,2023-09-04 11:56:44.411447,0 days 00:00:00.674621,ReLU,ReLU,Tanh,,50,10,24.0,20.0,,0.004408767262450466,3,131,0.7288495630449866,4.011310353268369e-05,114.10213068911904,COMPLETE
496,0.1869451105594635,2023-09-04 11:56:44.411801,2023-09-04 11:56:45.569651,0 days 00:00:01.157850,ReLU,Leaky,Tanh,,81,12,23.0,13.0,,0.0014445833827375866,3,145,0.6874304957567137,0.00020215333133618532,95.26488927467582,COMPLETE
497,0.3900098204612732,2023-09-04 11:56:45.569985,2023-09-04 11:56:49.748799,0 days 00:00:04.178814,ReLU,Leaky,Sigmoid,,19,23,15.0,5.0,,2.8526998054233888e-05,3,108,0.7661139460809013,0.00024061938849344729,124.95885071931062,COMPLETE
498,0.2070118933916092,2023-09-04 11:56:49.749140,2023-09-04 11:56:50.673929,0 days 00:00:00.924789,ReLU,Leaky,Tanh,,44,24,22.0,9.0,,0.009866231743585863,3,94,0.7128051125240202,7.944296012596127e-05,77.33063419659932,COMPLETE
499,0.21307756006717682,2023-09-04 11:56:50.674273,2023-09-04 11:56:51.080825,0 days 00:00:00.406552,ReLU,Leaky,Tanh,,50,13,21.0,7.0,,0.007631398122374635,3,413,0.7481074686724394,6.541743001616128e-05,136.66458493187315,COMPLETE
