number,value,datetime_start,datetime_complete,duration,params_activation1,params_activation2,params_activation3,params_activation4,params_batch_size,params_fl1,params_fl2,params_fl3,params_fl4,params_learning_rate,params_n_layers,params_num_epochs,params_train_size,params_weight_decay,user_attrs_mre,state
466,0.22844108939170837,2023-09-04 11:55:45.793609,2023-09-04 11:55:46.628568,0 days 00:00:00.834959,Tanh,Sigmoid,ReLU,,79,22,16.0,16.0,,0.008182601990966975,3,494,0.7974113459168649,2.247552971461313e-05,71.84331963857015,COMPLETE
467,0.11973795294761658,2023-09-04 11:55:46.628922,2023-09-04 11:55:47.412839,0 days 00:00:00.783917,Tanh,Tanh,ReLU,,80,22,17.0,17.0,,0.006880540209183318,3,488,0.7519674558380132,2.1061008948487303e-05,62.77242679919227,COMPLETE
468,0.11161789298057556,2023-09-04 11:55:47.413288,2023-09-04 11:55:47.972263,0 days 00:00:00.558975,Tanh,Tanh,ReLU,,80,23,18.0,17.0,,0.007544240920241601,3,487,0.7534407671119717,1.3453615533198196e-05,71.09549489835413,COMPLETE
469,0.16540612280368805,2023-09-04 11:55:47.972625,2023-09-04 11:55:48.918084,0 days 00:00:00.945459,Tanh,Tanh,ReLU,,79,23,17.0,17.0,,0.007236126404784217,3,491,0.7704771100315889,1.2625488483338618e-05,68.24492350987026,COMPLETE
470,0.2246527373790741,2023-09-04 11:55:48.918428,2023-09-04 11:55:50.358642,0 days 00:00:01.440214,Tanh,Tanh,ReLU,,13,22,17.0,17.0,,0.010113359618559244,3,493,0.7511948033118183,1.926505554161427e-05,95.84639287877965,COMPLETE
471,0.19511625170707703,2023-09-04 11:55:50.358993,2023-09-04 11:55:50.763698,0 days 00:00:00.404705,Tanh,Tanh,ReLU,,78,22,18.0,17.0,,0.007963358891102838,3,485,0.2821908398284691,2.0626004343336138e-05,90.74341164172536,COMPLETE
472,0.1486281007528305,2023-09-04 11:55:50.764048,2023-09-04 11:55:51.438027,0 days 00:00:00.673979,Tanh,Tanh,ReLU,,80,22,19.0,16.0,,0.006874103301860073,3,495,0.7734562484656047,1.2506420265299451e-05,70.88029472195372,COMPLETE
473,0.13907766342163086,2023-09-04 11:55:51.438358,2023-09-04 11:55:52.410122,0 days 00:00:00.971764,Tanh,Tanh,Leaky,,81,12,18.0,16.0,,0.008908860057242542,3,489,0.7987620263880945,1.4550186370448536e-05,992.5933411480629,COMPLETE
474,0.13289356231689453,2023-09-04 11:55:52.410464,2023-09-04 11:55:53.165710,0 days 00:00:00.755246,Tanh,Tanh,ReLU,,77,23,18.0,17.0,,0.006699419929581206,3,486,0.7404702545265701,1.8601728637889984e-05,73.90524516786847,COMPLETE
475,0.20253688097000122,2023-09-04 11:55:53.166051,2023-09-04 11:55:53.888186,0 days 00:00:00.722135,Tanh,Tanh,ReLU,,80,22,16.0,17.0,,0.010975480737304661,3,483,0.7499537557052748,1.9042344019011467e-05,79.39022064208984,COMPLETE
476,0.17310799658298492,2023-09-04 11:55:53.888516,2023-09-04 11:55:54.256262,0 days 00:00:00.367746,Tanh,ReLU,ReLU,,75,24,17.0,16.0,,0.008823834031923132,3,478,0.2946716910390883,6.754752091123912e-05,76.14017035166422,COMPLETE
477,0.1365010142326355,2023-09-04 11:55:54.256599,2023-09-04 11:55:54.900423,0 days 00:00:00.643824,Tanh,Tanh,ReLU,,78,23,17.0,17.0,,0.007238970333631011,3,492,0.7129185542942987,2.395147453622537e-05,122.02292461784519,COMPLETE
478,0.19194252789020538,2023-09-04 11:55:54.900766,2023-09-04 11:55:55.471759,0 days 00:00:00.570993,Tanh,Tanh,Sigmoid,,82,22,16.0,16.0,,0.011023266909038931,3,481,0.7994701684385096,4.5315309611909016e-05,152.97072526885242,COMPLETE
479,0.2453536093235016,2023-09-04 11:55:55.472107,2023-09-04 11:55:56.228339,0 days 00:00:00.756232,Tanh,Tanh,ReLU,,76,15,17.0,17.0,,0.005943859249721079,3,500,0.7678436188046894,0.0014530607882275008,82.5791912425648,COMPLETE
480,0.1354425996541977,2023-09-04 11:55:56.228672,2023-09-04 11:55:57.059216,0 days 00:00:00.830544,Tanh,Tanh,ReLU,,80,23,17.0,16.0,,0.00783499923840661,3,475,0.7283968015728886,2.670954569083392e-05,73.67906761169434,COMPLETE
481,0.26333948969841003,2023-09-04 11:55:57.059565,2023-09-04 11:55:58.386668,0 days 00:00:01.327103,Sigmoid,Tanh,ReLU,,78,22,16.0,18.0,,0.0009301288225451481,3,486,0.18968106784829009,1.3317665267593514e-05,99.02108290281939,COMPLETE
482,0.13657230138778687,2023-09-04 11:55:58.387258,2023-09-04 11:55:59.679407,0 days 00:00:01.292149,Tanh,Tanh,ReLU,,81,21,17.0,17.0,,0.0065007473439675344,3,473,0.7499321799811073,0.000678481306246092,64.08580796614937,COMPLETE
483,0.15370109677314758,2023-09-04 11:55:59.679779,2023-09-04 11:56:00.289596,0 days 00:00:00.609817,Tanh,Tanh,ReLU,,83,22,15.0,16.0,,0.009455113495990921,3,484,0.7068153629740807,3.0502325533196272e-05,80.39805875505719,COMPLETE
484,0.2943166494369507,2023-09-04 11:56:00.289951,2023-09-04 11:56:00.458490,0 days 00:00:00.168539,Tanh,Tanh,ReLU,,79,21,16.0,17.0,,0.0059989664484382315,3,474,0.12813066559375053,1.0197410194843906e-05,99.19006762297258,COMPLETE
485,0.1212773248553276,2023-09-04 11:56:00.458852,2023-09-04 11:56:01.433687,0 days 00:00:00.974835,Tanh,Tanh,ReLU,,50,22,16.0,16.0,,0.008021436029457717,3,499,0.7703316508688357,1.0485571944142517e-05,71.0185981326633,COMPLETE
486,0.13051575422286987,2023-09-04 11:56:01.434103,2023-09-04 11:56:02.216890,0 days 00:00:00.782787,Tanh,Tanh,ReLU,,73,23,16.0,18.0,,0.010949820261363737,3,497,0.7738320382086028,1.0407455815723225e-05,61.497798142609774,COMPLETE
487,0.18178525567054749,2023-09-04 11:56:02.217229,2023-09-04 11:56:11.632851,0 days 00:00:09.415622,Tanh,Tanh,Leaky,,49,21,16.0,6.0,,6.997331120909479e-05,3,492,0.7715549496257952,0.002284906607819342,85.4505927078123,COMPLETE
488,0.16654492914676666,2023-09-04 11:56:11.633213,2023-09-04 11:56:12.634046,0 days 00:00:01.000833,Tanh,Sigmoid,ReLU,,75,23,18.0,17.0,,0.009217726139671938,3,499,0.6936936127517136,1.2250123514158238e-05,80.93154699152166,COMPLETE
489,0.22736085951328278,2023-09-04 11:56:12.634441,2023-09-04 11:56:13.016486,0 days 00:00:00.382045,Tanh,Tanh,ReLU,,47,24,17.0,16.0,,0.007625344879012037,3,499,0.2554708825080027,1.5148665910949981e-05,70.52699905395508,COMPLETE
490,0.3590089976787567,2023-09-04 11:56:13.016921,2023-09-04 11:56:13.319376,0 days 00:00:00.302455,Tanh,Tanh,,,51,21,18.0,,,0.005632419028663489,2,500,0.2221867588209582,1.1493306850349361e-05,141.68764400482178,COMPLETE
491,0.19721923768520355,2023-09-04 11:56:13.319803,2023-09-04 11:56:14.237873,0 days 00:00:00.918070,Tanh,,,,46,22,,,,0.008553493364368567,1,468,0.7998332101466276,1.0351692913870636e-05,84.88743978647085,COMPLETE
492,0.149544820189476,2023-09-04 11:56:14.238269,2023-09-04 11:56:14.960103,0 days 00:00:00.721834,Tanh,Tanh,ReLU,,85,22,15.0,18.0,,0.011678733591460795,3,487,0.7279777620728397,3.527964828267627e-05,65.95905508313861,COMPLETE
493,0.1843310445547104,2023-09-04 11:56:14.960447,2023-09-04 11:56:16.082905,0 days 00:00:01.122458,Tanh,Tanh,ReLU,,53,20,9.0,17.0,,0.006444540784086171,3,476,0.7298914458909805,1.8053584546909058e-05,124.12761826948686,COMPLETE
494,0.10203525424003601,2023-09-04 11:56:16.083289,2023-09-04 11:56:17.668548,0 days 00:00:01.585259,Tanh,Tanh,Sigmoid,,55,21,18.0,16.0,,0.005322643658121169,3,226,0.7715743517994983,2.295790104450574e-05,74.44818728903066,COMPLETE
495,0.12911225855350494,2023-09-04 11:56:17.668891,2023-09-04 11:56:19.785905,0 days 00:00:02.117014,Sigmoid,Tanh,Sigmoid,,53,20,18.0,16.0,,0.0054496777809111534,3,227,0.7565122362710995,2.3442402080167176e-05,75.52098374617727,COMPLETE
496,0.2674412429332733,2023-09-04 11:56:19.786496,2023-09-04 11:56:20.924772,0 days 00:00:01.138276,Sigmoid,Tanh,Sigmoid,,51,21,19.0,16.0,,0.00539011296388378,3,232,0.20870950582505082,2.1834901207557068e-05,171.55792158928472,COMPLETE
497,0.14612708985805511,2023-09-04 11:56:20.925377,2023-09-04 11:56:22.721826,0 days 00:00:01.796449,ReLU,Tanh,Sigmoid,,54,23,18.0,16.0,,0.0049658014790087855,3,226,0.7647133554794977,2.7674927623839517e-05,77.15309458193572,COMPLETE
498,0.12436021864414215,2023-09-04 11:56:22.722170,2023-09-04 11:56:23.551522,0 days 00:00:00.829352,ReLU,Tanh,Sigmoid,,50,21,19.0,16.0,,0.004948558508341759,3,225,0.7462343424682446,3.2345259954331745e-05,73.94582333772078,COMPLETE
499,0.24786339700222015,2023-09-04 11:56:23.551903,2023-09-04 11:56:23.917393,0 days 00:00:00.365490,ReLU,Tanh,Sigmoid,,50,22,19.0,16.0,,0.0013522997770192512,3,227,0.2326194107049318,1.9121421086024365e-05,136.55220281427557,COMPLETE
