number,value,datetime_start,datetime_complete,duration,params_activation1,params_activation2,params_activation3,params_activation4,params_batch_size,params_fl1,params_fl2,params_fl3,params_fl4,params_learning_rate,params_n_layers,params_num_epochs,params_train_size,params_weight_decay,user_attrs_mre,state
187,0.17901873588562012,2023-09-04 11:51:11.567368,2023-09-04 11:51:12.002925,0 days 00:00:00.435557,ReLU,Leaky,Tanh,,87,17,22.0,11.0,,0.025993188419178363,3,182,0.44420227274224483,0.00010042728330119044,81.34615436900745,COMPLETE
188,0.31122052669525146,2023-09-04 11:51:12.003235,2023-09-04 11:51:12.161873,0 days 00:00:00.158638,ReLU,Leaky,Tanh,,90,18,23.0,11.0,,0.034574350649866144,3,172,0.41585748707041975,0.00014244528272566525,142.5940089755588,COMPLETE
189,0.25260046124458313,2023-09-04 11:51:12.162277,2023-09-04 11:51:12.400821,0 days 00:00:00.238544,ReLU,Leaky,Tanh,,85,21,22.0,13.0,,0.06181656825154973,3,217,0.43074988766687844,0.00010978359570131266,95.77727699279785,COMPLETE
190,0.21863573789596558,2023-09-04 11:51:12.401115,2023-09-04 11:51:12.666566,0 days 00:00:00.265451,ReLU,Leaky,Tanh,,89,18,23.0,11.0,,0.01441154764371516,3,189,0.4072813987583854,0.0001390654737412849,100.65917699477252,COMPLETE
191,0.25682374835014343,2023-09-04 11:51:12.666961,2023-09-04 11:51:12.945973,0 days 00:00:00.279012,ReLU,Leaky,Tanh,,81,19,21.0,9.0,,0.0206354631046899,3,200,0.3919501797999642,0.00020485985080473339,97.70039411272322,COMPLETE
192,0.21245141327381134,2023-09-04 11:51:12.946433,2023-09-04 11:51:13.197716,0 days 00:00:00.251283,ReLU,Leaky,Tanh,,86,20,3.0,10.0,,0.024737857572306288,3,209,0.3489400478713845,0.0001682122731497771,89.5322585635715,COMPLETE
193,0.2528896927833557,2023-09-04 11:51:13.198099,2023-09-04 11:51:13.460171,0 days 00:00:00.262072,ReLU,Leaky,Tanh,,59,18,21.0,12.0,,0.015229423964505672,3,225,0.3800433820826965,0.00025111257226293713,142.44304711478097,COMPLETE
194,0.2786334753036499,2023-09-04 11:51:13.460570,2023-09-04 11:51:15.160539,0 days 00:00:01.699969,ReLU,Leaky,Tanh,,84,19,22.0,10.0,,0.000523616502887639,3,182,0.42473545226815396,0.0002791494712549441,135.1052975497403,COMPLETE
195,0.1629796326160431,2023-09-04 11:51:15.161047,2023-09-04 11:51:15.815255,0 days 00:00:00.654208,ReLU,Leaky,Tanh,,87,19,22.0,8.0,,0.01912549985247897,3,196,0.40191839772588844,0.00021755321182985105,69.76346872723292,COMPLETE
196,0.2317238599061966,2023-09-04 11:51:15.815563,2023-09-04 11:51:15.992059,0 days 00:00:00.176496,ReLU,Leaky,Tanh,,91,20,23.0,7.0,,0.012263693070359391,3,190,0.40606441635142365,0.0002153703000560193,118.39873712713069,COMPLETE
197,0.1930551528930664,2023-09-04 11:51:15.992359,2023-09-04 11:51:16.496370,0 days 00:00:00.504011,ReLU,Leaky,Tanh,,88,17,22.0,6.0,,0.04036541563406763,3,196,0.5120422214854652,0.00011936501621292139,105.86840535826602,COMPLETE
198,0.1931431144475937,2023-09-04 11:51:16.496681,2023-09-04 11:51:16.935500,0 days 00:00:00.438819,ReLU,Leaky,Tanh,,93,20,22.0,8.0,,0.01652022459322707,3,232,0.4428035595754787,0.00015554197242252004,73.73292495464456,COMPLETE
199,0.20139311254024506,2023-09-04 11:51:16.935794,2023-09-04 11:51:17.138623,0 days 00:00:00.202829,Tanh,Leaky,Tanh,,79,21,22.0,12.0,,0.02952104341926597,3,217,0.3557608646534372,0.00019307783050554711,113.42575242784288,COMPLETE
200,0.15079806745052338,2023-09-04 11:51:17.138946,2023-09-04 11:51:17.710250,0 days 00:00:00.571304,ReLU,Leaky,Tanh,,87,19,23.0,7.0,,0.013630175617036498,3,244,0.4242208911397374,0.00013176846815818842,80.4668717995668,COMPLETE
201,0.15580783784389496,2023-09-04 11:51:17.710551,2023-09-04 11:51:18.251097,0 days 00:00:00.540546,ReLU,Leaky,Tanh,,87,19,23.0,7.0,,0.01300272295532684,3,244,0.42270418280703054,0.00013434778662306437,97.6703626031745,COMPLETE
202,0.19973419606685638,2023-09-04 11:51:18.251392,2023-09-04 11:51:18.741045,0 days 00:00:00.489653,ReLU,Leaky,Tanh,,69,19,23.0,8.0,,0.011112965252848092,3,244,0.4248871186045169,9.54740382663217e-05,68.76134385733769,COMPLETE
203,0.2524362802505493,2023-09-04 11:51:18.741353,2023-09-04 11:51:18.954584,0 days 00:00:00.213231,ReLU,Leaky,Tanh,,88,18,23.0,6.0,,0.013896584423058305,3,231,0.40080464779377667,0.00013223413392906094,2826.851558140346,COMPLETE
204,0.2528959810733795,2023-09-04 11:51:18.954886,2023-09-04 11:51:19.088837,0 days 00:00:00.133951,ReLU,Leaky,Tanh,,86,19,23.0,7.0,,0.09475656173735546,3,225,0.3679512700639237,0.0001384809154953392,120.0864616842831,COMPLETE
205,0.18144573271274567,2023-09-04 11:51:19.089133,2023-09-04 11:51:19.444103,0 days 00:00:00.354970,ReLU,Leaky,Tanh,,90,20,23.0,7.0,,0.008194353093544965,3,241,0.4236553805512579,0.00011117442137028447,77.24908711958905,COMPLETE
206,0.1871892511844635,2023-09-04 11:51:19.444408,2023-09-04 11:51:19.733881,0 days 00:00:00.289473,ReLU,Leaky,Tanh,,85,19,24.0,8.0,,0.023762139327811824,3,199,0.38872082571869365,0.00017143935579144308,104.88665618896485,COMPLETE
207,0.17043624818325043,2023-09-04 11:51:19.734175,2023-09-04 11:51:20.156430,0 days 00:00:00.422255,ReLU,Leaky,Sigmoid,,87,20,22.0,5.0,,0.010931250098457287,3,247,0.40337328115878796,6.844075616591454e-05,116.91499404907226,COMPLETE
208,0.20335888862609863,2023-09-04 11:51:20.156741,2023-09-04 11:51:20.481775,0 days 00:00:00.325034,ReLU,Leaky,Tanh,,87,20,22.0,5.0,,0.018236500738849186,3,248,0.4063493071947267,6.64684492741716e-05,161.52588865492078,COMPLETE
209,0.18970191478729248,2023-09-04 11:51:20.482073,2023-09-04 11:51:21.310818,0 days 00:00:00.828745,Sigmoid,Leaky,Sigmoid,,89,19,21.0,5.0,,0.01404364524723893,3,213,0.4678304257632355,8.870148484122654e-05,97.19789759318034,COMPLETE
210,0.2414737492799759,2023-09-04 11:51:21.311113,2023-09-04 11:51:21.686038,0 days 00:00:00.374925,ReLU,Leaky,Sigmoid,,92,19,21.0,6.0,,0.011857912949769874,3,165,0.4428177100622274,5.850230097978052e-05,105.02091279321787,COMPLETE
211,0.21200066804885864,2023-09-04 11:51:21.686338,2023-09-04 11:51:22.000650,0 days 00:00:00.314312,ReLU,Leaky,Sigmoid,,87,21,22.0,7.0,,0.010091169003895747,3,236,0.3903967656663732,7.686915733279401e-05,173.4908195842396,COMPLETE
212,0.19452030956745148,2023-09-04 11:51:22.000962,2023-09-04 11:51:22.284213,0 days 00:00:00.283251,ReLU,Leaky,Tanh,,90,20,23.0,4.0,,0.009220418347637978,3,246,0.3659145522051194,0.0001513913367528288,81.27198755173455,COMPLETE
213,0.17678487300872803,2023-09-04 11:51:22.284509,2023-09-04 11:51:22.689460,0 days 00:00:00.404951,ReLU,Leaky,Tanh,,84,20,22.0,3.0,,0.011224915781565205,3,226,0.41915849745727785,0.00011435516185872892,113.79218829119647,COMPLETE
214,0.28227388858795166,2023-09-04 11:51:22.689772,2023-09-04 11:51:22.893232,0 days 00:00:00.203460,ReLU,Leaky,Sigmoid,,81,21,23.0,8.0,,0.017681088875325813,3,181,0.399691991472159,9.214858525365465e-05,141.8331591796875,COMPLETE
215,0.26088404655456543,2023-09-04 11:51:22.893535,2023-09-04 11:51:23.150620,0 days 00:00:00.257085,ReLU,Leaky,Tanh,,86,19,24.0,6.0,,0.021575549306438544,3,219,0.37920902752784624,0.00018039416394392696,82.24035208565849,COMPLETE
216,0.25562340021133423,2023-09-04 11:51:23.150924,2023-09-04 11:51:23.409149,0 days 00:00:00.258225,ReLU,Leaky,Tanh,,94,20,20.0,9.0,,0.007067773302705178,3,388,0.3378407170896969,0.00021374109984671882,107.46344136082848,COMPLETE
217,0.15908551216125488,2023-09-04 11:51:23.409461,2023-09-04 11:51:23.811015,0 days 00:00:00.401554,ReLU,Leaky,Tanh,,88,18,22.0,9.0,,0.013790480197202002,3,254,0.4356857108733361,0.00012558542440925175,65.86278555943416,COMPLETE
218,0.15901073813438416,2023-09-04 11:51:23.811322,2023-09-04 11:51:24.234779,0 days 00:00:00.423457,ReLU,Leaky,Tanh,,88,18,22.0,9.0,,0.015260664775173856,3,256,0.4832913623962346,0.00013270585108700949,82.68212661743163,COMPLETE
219,0.164698988199234,2023-09-04 11:51:24.235090,2023-09-04 11:51:24.718043,0 days 00:00:00.482953,ReLU,Leaky,Tanh,,89,18,22.0,9.0,,0.014803608978052867,3,253,0.4883173526897094,0.0001259557024028775,106.70742931700589,COMPLETE
220,0.1749085783958435,2023-09-04 11:51:24.718340,2023-09-04 11:51:25.129950,0 days 00:00:00.411610,ReLU,Leaky,Tanh,,91,17,22.0,9.0,,0.017683475501603284,3,261,0.4853673013699009,0.00013169701603221357,71.45568862915039,COMPLETE
221,0.16933077573776245,2023-09-04 11:51:25.130254,2023-09-04 11:51:25.530529,0 days 00:00:00.400275,ReLU,Leaky,Tanh,,88,18,22.0,9.0,,0.014588461397385278,3,254,0.49801346785694267,0.0001543314335762321,63.054986539094344,COMPLETE
222,0.1862773895263672,2023-09-04 11:51:25.530851,2023-09-04 11:51:25.814249,0 days 00:00:00.283398,ReLU,Leaky,Tanh,,89,18,22.0,11.0,,0.016466851510415607,3,255,0.5369593685522257,0.0001565653525174363,77.52418419166848,COMPLETE
223,0.20174209773540497,2023-09-04 11:51:25.814602,2023-09-04 11:51:26.310099,0 days 00:00:00.495497,ReLU,Leaky,Tanh,,92,18,21.0,9.0,,0.01424819973461336,3,268,0.511810739940449,0.00014702646549070777,80.24408929998225,COMPLETE
224,0.19474363327026367,2023-09-04 11:51:26.310408,2023-09-04 11:51:26.700839,0 days 00:00:00.390431,ReLU,Leaky,Tanh,,89,18,22.0,9.0,,0.021492384866941012,3,257,0.4632453903429198,0.00011747766273502342,91.62597191852072,COMPLETE
225,0.18274471163749695,2023-09-04 11:51:26.701145,2023-09-04 11:51:27.201487,0 days 00:00:00.500342,ReLU,Leaky,Tanh,,88,17,21.0,10.0,,0.02589318727108338,3,273,0.4968153717352414,0.00018011088241014472,70.10928075066928,COMPLETE
226,0.21297115087509155,2023-09-04 11:51:27.201791,2023-09-04 11:51:27.400253,0 days 00:00:00.198462,ReLU,Leaky,Tanh,,91,18,22.0,10.0,,0.015060101211573246,3,252,0.46668103849515913,0.00013124928329653811,132.32965269542876,COMPLETE
227,0.18761849403381348,2023-09-04 11:51:27.400558,2023-09-04 11:51:27.875108,0 days 00:00:00.474550,ReLU,Leaky,Tanh,,86,18,23.0,8.0,,0.018720464422755226,3,206,0.44252958090898714,0.00011005445228532226,171.93143502597152,COMPLETE
228,0.16860659420490265,2023-09-04 11:51:27.875417,2023-09-04 11:51:28.257541,0 days 00:00:00.382124,ReLU,Leaky,Tanh,,93,16,22.0,9.0,,0.05355186584947874,3,241,0.4719981045728144,0.00016769750972888382,74.03653287887573,COMPLETE
229,0.20669148862361908,2023-09-04 11:51:28.257858,2023-09-04 11:51:28.451224,0 days 00:00:00.193366,ReLU,Leaky,Tanh,,90,17,23.0,9.0,,0.038370464543766525,3,191,0.48438550015391585,0.0002245560640647384,112.79173860095796,COMPLETE
230,0.18439818918704987,2023-09-04 11:51:28.451525,2023-09-04 11:51:28.833393,0 days 00:00:00.381868,ReLU,Leaky,Tanh,,88,16,21.0,9.0,,0.04886287252504216,3,248,0.4537030831332184,0.00015593718450834668,75.58081574135639,COMPLETE
231,0.21577231585979462,2023-09-04 11:51:28.833697,2023-09-04 11:51:29.235978,0 days 00:00:00.402281,ReLU,Leaky,Tanh,,94,17,22.0,8.0,,0.05277483400107263,3,240,0.5297857519806429,0.00018116115580255878,104.7556960893714,COMPLETE
232,0.2636246979236603,2023-09-04 11:51:29.236292,2023-09-04 11:51:29.496866,0 days 00:00:00.260574,ReLU,Leaky,Tanh,,96,19,22.0,10.0,,0.08153773963513847,3,242,0.49709342665132783,0.0001334455306633791,122.32944259643554,COMPLETE
233,0.18524807691574097,2023-09-04 11:51:29.497173,2023-09-04 11:51:29.937105,0 days 00:00:00.439932,ReLU,Leaky,Tanh,,93,18,21.0,8.0,,0.0135291754633919,3,259,0.4325177587005197,0.00016780027808374298,120.80561753570056,COMPLETE
234,0.1985681802034378,2023-09-04 11:51:29.937416,2023-09-04 11:51:30.310680,0 days 00:00:00.373264,ReLU,Leaky,Tanh,,55,18,22.0,9.0,,0.02803134313157063,3,263,0.4326276623063207,0.00021594210677793472,98.24723576136998,COMPLETE
235,0.2832789123058319,2023-09-04 11:51:30.310989,2023-09-04 11:51:30.608048,0 days 00:00:00.297059,ReLU,Leaky,Tanh,,85,19,23.0,11.0,,0.07568478064265734,3,249,0.4731602587398304,0.00010259006975442015,128.47090296591483,COMPLETE
236,0.24814996123313904,2023-09-04 11:51:30.608361,2023-09-04 11:51:30.989715,0 days 00:00:00.381354,ReLU,Leaky,Tanh,,91,16,22.0,10.0,,0.0015439274514926387,3,238,0.4553369444180987,0.00012483599198980975,183.62441190083823,COMPLETE
237,0.2507668137550354,2023-09-04 11:51:30.990029,2023-09-04 11:51:31.171890,0 days 00:00:00.181861,ReLU,Leaky,Tanh,,88,19,21.0,8.0,,0.022248535628165637,3,175,0.3166456594112098,0.00019316985079012691,118.1037837437221,COMPLETE
238,0.2044348567724228,2023-09-04 11:51:31.172204,2023-09-04 11:51:31.406970,0 days 00:00:00.234766,ReLU,Leaky,Tanh,,85,18,23.0,9.0,,0.01936467278235088,3,204,0.41911202544738696,0.0002535743581198705,91.71957124982562,COMPLETE
239,0.19342388212680817,2023-09-04 11:51:31.407278,2023-09-04 11:51:31.787843,0 days 00:00:00.380565,Tanh,Leaky,Tanh,,92,15,22.0,8.0,,0.0330559784324782,3,220,0.4738125550318411,0.0001530241611039726,113.7530664097179,COMPLETE
240,0.1629573255777359,2023-09-04 11:51:31.788156,2023-09-04 11:51:32.083933,0 days 00:00:00.295777,ReLU,Leaky,Tanh,,89,19,23.0,9.0,,0.013316506329872352,3,231,0.4192709864325069,0.0003202971331122378,275.91752088392104,COMPLETE
241,0.22143863141536713,2023-09-04 11:51:32.084254,2023-09-04 11:51:32.456902,0 days 00:00:00.372648,ReLU,Leaky,Tanh,,89,19,23.0,9.0,,0.013981847923334298,3,234,0.5025397839593084,0.0003115106915774508,76.81970475359661,COMPLETE
242,0.1983141154050827,2023-09-04 11:51:32.457227,2023-09-04 11:51:32.755444,0 days 00:00:00.298217,ReLU,Leaky,Tanh,,87,19,7.0,9.0,,0.0695249439479077,3,213,0.5388372947860659,0.0002195418895206462,111.01925929900139,COMPLETE
243,0.18729010224342346,2023-09-04 11:51:32.755763,2023-09-04 11:51:33.071427,0 days 00:00:00.315664,ReLU,Leaky,Tanh,,90,18,22.0,10.0,,0.017553363207182506,3,252,0.4198711180939623,0.00033644573790624137,454.2515102568127,COMPLETE
244,0.21060021221637726,2023-09-04 11:51:33.071759,2023-09-04 11:51:33.325425,0 days 00:00:00.253666,ReLU,Leaky,Tanh,,84,19,23.0,10.0,,0.052261507420496366,3,227,0.44189985406741455,0.000176024728513874,208.74476078578405,COMPLETE
245,0.2046620398759842,2023-09-04 11:51:33.325729,2023-09-04 11:51:33.588781,0 days 00:00:00.263052,ReLU,Leaky,Tanh,,87,19,22.0,8.0,,0.013226806857921535,3,243,0.3967627849634647,3.8511734869554346e-05,70.0821491690243,COMPLETE
246,0.16794821619987488,2023-09-04 11:51:33.589198,2023-09-04 11:51:33.913004,0 days 00:00:00.323806,ReLU,Tanh,Tanh,,93,18,24.0,9.0,,0.016258089689025475,3,201,0.4103855848371707,0.00010347994181800293,79.71818942115421,COMPLETE
247,0.22068071365356445,2023-09-04 11:51:33.913320,2023-09-04 11:51:34.371630,0 days 00:00:00.458310,ReLU,Tanh,Tanh,,90,18,24.0,9.0,,0.012061847342452409,3,198,0.4170580721324694,9.71233554326661e-05,93.02746028284872,COMPLETE
248,0.18498940765857697,2023-09-04 11:51:34.371988,2023-09-04 11:51:34.644439,0 days 00:00:00.272451,ReLU,Tanh,Tanh,,92,18,24.0,9.0,,0.05758065919481364,3,212,0.45360649995111224,0.00012152662399582462,76.23685617157908,COMPLETE
249,0.27704665064811707,2023-09-04 11:51:34.644781,2023-09-04 11:51:35.090443,0 days 00:00:00.445662,ReLU,Tanh,Tanh,,88,17,23.0,10.0,,0.015724111368828057,3,187,0.48049919448179523,0.012772497634979443,157.37575008251048,COMPLETE
250,0.5191766023635864,2023-09-04 11:51:35.090749,2023-09-04 11:51:36.525058,0 days 00:00:01.434309,Sigmoid,Leaky,Tanh,,86,19,2.0,11.0,,0.00013046349811434788,3,197,0.435482010449031,0.00010632894789099144,106.32449391166571,COMPLETE
251,0.11025054007768631,2023-09-04 11:51:36.525380,2023-09-04 11:51:37.236406,0 days 00:00:00.711026,ReLU,Tanh,Tanh,,84,18,24.0,9.0,,0.022385450160717437,3,221,0.7365825171433691,0.00026328747305716534,65.50314926682857,COMPLETE
252,0.19939608871936798,2023-09-04 11:51:37.236708,2023-09-04 11:51:37.496748,0 days 00:00:00.260040,ReLU,Tanh,Tanh,,84,18,24.0,8.0,,0.02584333539271362,3,220,0.5869480859481678,0.00026855044801089433,69.92516078119692,COMPLETE
253,0.13175493478775024,2023-09-04 11:51:37.497056,2023-09-04 11:51:37.929968,0 days 00:00:00.432912,ReLU,Tanh,Tanh,,82,19,24.0,9.0,,0.039425267507799754,3,207,0.7295535897148455,0.0003690003547860811,76.25436818599701,COMPLETE
254,0.31380027532577515,2023-09-04 11:51:37.930288,2023-09-04 11:51:38.074009,0 days 00:00:00.143721,ReLU,Tanh,Tanh,,82,19,24.0,9.0,,0.044989168904425496,3,206,0.3308133093855764,0.0003457169494378565,197.74239010281033,COMPLETE
255,0.13959573209285736,2023-09-04 11:51:38.074324,2023-09-04 11:51:38.761136,0 days 00:00:00.686812,ReLU,Tanh,Tanh,,82,19,24.0,8.0,,0.00893808304783165,3,223,0.7887916386212075,0.0002585658217812738,83.75813651571468,COMPLETE
256,0.1415274441242218,2023-09-04 11:51:38.761469,2023-09-04 11:51:39.097650,0 days 00:00:00.336181,ReLU,Tanh,Tanh,,82,19,24.0,8.0,,0.009831802920763615,3,215,0.7665005258843826,0.00040375806098323446,79.41196259208347,COMPLETE
257,0.1154538244009018,2023-09-04 11:51:39.097954,2023-09-04 11:51:39.897475,0 days 00:00:00.799521,ReLU,Tanh,Tanh,,82,19,24.0,7.0,,0.009437583063167958,3,222,0.788363430810397,0.00039980248959097344,89.68572952007425,COMPLETE
258,0.0958716943860054,2023-09-04 11:51:39.897771,2023-09-04 11:51:40.784583,0 days 00:00:00.886812,ReLU,Tanh,Tanh,,82,19,24.0,7.0,,0.008342917491093393,3,221,0.7595455627736654,0.0003509331801587216,90.39228955437156,COMPLETE
259,0.17219921946525574,2023-09-04 11:51:40.784981,2023-09-04 11:51:41.377640,0 days 00:00:00.592659,ReLU,Tanh,Tanh,,82,19,24.0,8.0,,0.007806666968746128,3,222,0.7620906784141471,0.0003939196278714715,78.45751840418035,COMPLETE
260,0.20794932544231415,2023-09-04 11:51:41.378036,2023-09-04 11:51:41.955895,0 days 00:00:00.577859,ReLU,Tanh,Tanh,,80,19,24.0,7.0,,0.008827335940519444,3,214,0.7774001397421579,0.00038365136992673653,96.87487992786225,COMPLETE
261,0.16377262771129608,2023-09-04 11:51:41.956289,2023-09-04 11:51:42.849592,0 days 00:00:00.893303,ReLU,Tanh,Tanh,,81,19,24.0,8.0,,0.009770715053196663,3,226,0.727246394186899,0.00032173994532049016,92.97044082426689,COMPLETE
262,0.13608771562576294,2023-09-04 11:51:42.849904,2023-09-04 11:51:44.334505,0 days 00:00:01.484601,ReLU,Tanh,Tanh,,83,19,24.0,7.0,,0.006220719322871603,3,215,0.7266377398935018,0.00045840248560731473,61.09155867935775,COMPLETE
263,0.17814600467681885,2023-09-04 11:51:44.335031,2023-09-04 11:51:45.439134,0 days 00:00:01.104103,ReLU,Tanh,Tanh,,83,19,24.0,7.0,,0.006194894466842735,3,213,0.7300955302433247,0.0004284501090729339,68.46996706585551,COMPLETE
264,0.15560691058635712,2023-09-04 11:51:45.439459,2023-09-04 11:51:46.329449,0 days 00:00:00.889990,ReLU,Tanh,Tanh,,83,19,24.0,15.0,,0.0074364615094757915,3,220,0.7861991649731007,0.00029481168044384105,59.82926559448242,COMPLETE
265,0.16674098372459412,2023-09-04 11:51:46.329750,2023-09-04 11:51:46.753961,0 days 00:00:00.424211,ReLU,Tanh,Tanh,,82,19,24.0,15.0,,0.007566562335298213,3,220,0.76125504663794,0.00027819620434217765,72.36345799763997,COMPLETE
266,0.1533394604921341,2023-09-04 11:51:46.754270,2023-09-04 11:51:47.378702,0 days 00:00:00.624432,ReLU,Tanh,Tanh,,83,19,24.0,7.0,,0.005711683819658357,3,209,0.7876212333707507,0.0003386219248517315,69.03113837864088,COMPLETE
267,0.13837756216526031,2023-09-04 11:51:47.379010,2023-09-04 11:51:48.299141,0 days 00:00:00.920131,ReLU,Tanh,Tanh,,79,20,24.0,7.0,,0.008908066893660884,3,213,0.7963513959859166,0.000372662096368479,76.27976825420673,COMPLETE
268,0.19353079795837402,2023-09-04 11:51:48.299447,2023-09-04 11:51:49.163657,0 days 00:00:00.864210,ReLU,Tanh,Tanh,,79,20,24.0,7.0,,0.005435415960590014,3,210,0.7897808518640176,0.0004712429245001538,61.824765912948116,COMPLETE
269,0.1743128001689911,2023-09-04 11:51:49.163965,2023-09-04 11:51:49.751302,0 days 00:00:00.587337,Tanh,Tanh,Tanh,,81,20,24.0,7.0,,0.006597884144455069,3,206,0.7976574144726677,0.00036494591915234634,109.5601111820766,COMPLETE
270,0.11371422559022903,2023-09-04 11:51:49.751623,2023-09-04 11:51:50.709832,0 days 00:00:00.958209,ReLU,Tanh,Tanh,,83,20,24.0,7.0,,0.004841245145898106,3,219,0.6888506368852404,0.00043544549521750233,78.52244586479372,COMPLETE
271,0.1582716554403305,2023-09-04 11:51:50.710145,2023-09-04 11:51:51.491953,0 days 00:00:00.781808,ReLU,Tanh,Tanh,,78,20,24.0,7.0,,0.004840173825241978,3,216,0.6932728580786219,0.00035596218333131777,71.6781137254503,COMPLETE
272,0.1754866987466812,2023-09-04 11:51:51.492267,2023-09-04 11:51:52.464601,0 days 00:00:00.972334,ReLU,Tanh,Tanh,,78,20,24.0,7.0,,0.004779081073630804,3,213,0.6602188057041576,0.0004838538589018422,67.15475929074171,COMPLETE
273,0.22391590476036072,2023-09-04 11:51:52.464918,2023-09-04 11:51:52.946598,0 days 00:00:00.481680,ReLU,Tanh,Tanh,,80,20,24.0,6.0,,0.004457436811847128,3,220,0.7524248999997806,0.000403386361048398,76.3025654384068,COMPLETE
274,0.20136572420597076,2023-09-04 11:51:52.946898,2023-09-04 11:51:53.442720,0 days 00:00:00.495822,ReLU,Tanh,Tanh,,83,19,24.0,7.0,,0.005135361602167233,3,208,0.7235043855299194,0.0003413205336581135,113.21742870933132,COMPLETE
275,0.19665680825710297,2023-09-04 11:51:53.443027,2023-09-04 11:51:54.774507,0 days 00:00:01.331480,ReLU,Tanh,Tanh,,78,20,24.0,14.0,,0.003562493126260135,3,204,0.7499865616681435,0.0004981494542719588,84.11313106536865,COMPLETE
276,0.17677873373031616,2023-09-04 11:51:54.774813,2023-09-04 11:51:56.357758,0 days 00:00:01.582945,Sigmoid,Tanh,Tanh,,84,19,24.0,6.0,,0.0066783619093033,3,224,0.6903260635719848,0.00028967998409124945,96.14008285750204,COMPLETE
277,0.09839971363544464,2023-09-04 11:51:56.358126,2023-09-04 11:51:57.093744,0 days 00:00:00.735618,ReLU,Tanh,Tanh,,81,20,24.0,16.0,,0.005878553206587669,3,214,0.7920089376801152,0.0004321058283756272,77.11610229198749,COMPLETE
278,0.11489088833332062,2023-09-04 11:51:57.094116,2023-09-04 11:51:58.704774,0 days 00:00:01.610658,ReLU,Tanh,Tanh,,80,20,24.0,15.0,,0.0058805240331545935,3,203,0.7777662121626354,0.0004376181727552489,69.95535288271697,COMPLETE
279,0.09443440288305283,2023-09-04 11:51:58.705087,2023-09-04 11:51:59.751169,0 days 00:00:01.046082,ReLU,Tanh,Tanh,,80,20,24.0,16.0,,0.005762987719174581,3,212,0.7718710161343322,0.00045428669095521376,62.06599549844231,COMPLETE
280,0.1792139708995819,2023-09-04 11:51:59.751498,2023-09-04 11:52:00.471514,0 days 00:00:00.720016,ReLU,Tanh,Tanh,,76,20,24.0,16.0,,0.005635922354152394,3,206,0.7667778416226925,0.0005445040367045125,68.7099666595459,COMPLETE
