number,value,datetime_start,datetime_complete,duration,params_activation1,params_activation2,params_activation3,params_activation4,params_batch_size,params_fl1,params_fl2,params_fl3,params_fl4,params_learning_rate,params_n_layers,params_num_epochs,params_train_size,params_weight_decay,user_attrs_mre,state
373,0.22135476768016815,2023-09-04 12:03:15.886958,2023-09-04 12:03:17.417884,0 days 00:00:01.530926,ReLU,Sigmoid,Leaky,,68,23,1.0,3.0,,0.01103292350018567,3,260,0.3998957971730613,2.9412480880736566e-05,138.81071615219116,COMPLETE
374,0.22474218904972076,2023-09-04 12:03:17.418453,2023-09-04 12:03:17.836361,0 days 00:00:00.417908,Tanh,ReLU,,,55,24,8.0,,,0.02816806270221873,2,250,0.22484202331634331,9.600145167489856e-05,87.92858417217548,COMPLETE
375,0.22491435706615448,2023-09-04 12:03:17.836906,2023-09-04 12:03:19.092865,0 days 00:00:01.255959,ReLU,ReLU,Sigmoid,,56,21,6.0,8.0,,0.017839083964302387,3,286,0.41797377608781067,1.4183438877489356e-05,87.8740550196448,COMPLETE
376,0.1919710636138916,2023-09-04 12:03:19.093427,2023-09-04 12:03:21.149873,0 days 00:00:02.056446,Tanh,Sigmoid,Sigmoid,,95,23,24.0,7.0,,0.021482625436683084,3,128,0.7724422321265605,0.0001193448598648262,91.87874576501679,COMPLETE
377,0.15277156233787537,2023-09-04 12:03:21.150447,2023-09-04 12:03:23.804912,0 days 00:00:02.654465,ReLU,ReLU,ReLU,,50,22,5.0,8.0,,0.015438420176198038,3,275,0.7421306164491349,0.00018748664020281584,131.26282501220703,COMPLETE
378,0.22059090435504913,2023-09-04 12:03:23.806348,2023-09-04 12:03:24.580575,0 days 00:00:00.774227,ReLU,ReLU,ReLU,,47,24,4.0,8.0,,0.0748491830483068,3,280,0.4284669541732985,0.00019584626181029386,125.14591563831677,COMPLETE
379,0.2033422887325287,2023-09-04 12:03:24.581135,2023-09-04 12:03:25.826458,0 days 00:00:01.245323,Tanh,ReLU,ReLU,,49,22,5.0,9.0,,0.01324010106602464,3,297,0.2711439311577693,0.00016604959705522406,1322.2985175952576,COMPLETE
380,0.19949118793010712,2023-09-04 12:03:25.827041,2023-09-04 12:03:27.547035,0 days 00:00:01.719994,ReLU,ReLU,ReLU,,43,23,4.0,2.0,,0.015968300220545125,3,64,0.7469135839612043,0.00026740031039288224,144.1701720101493,COMPLETE
381,0.22026044130325317,2023-09-04 12:03:27.547596,2023-09-04 12:03:30.039967,0 days 00:00:02.492371,ReLU,ReLU,ReLU,,50,21,5.0,8.0,,0.010152865915663051,3,272,0.7991505302807399,0.0009533838704756455,98.21429815957713,COMPLETE
382,0.19319844245910645,2023-09-04 12:03:30.040553,2023-09-04 12:03:32.018645,0 days 00:00:01.978092,Tanh,ReLU,ReLU,,51,24,19.0,9.0,,0.0020396440946489256,3,266,0.7091360048434081,0.00022063646518901634,221.39097314131888,COMPLETE
383,0.23893223702907562,2023-09-04 12:03:32.019235,2023-09-04 12:03:32.333920,0 days 00:00:00.314685,ReLU,ReLU,ReLU,,91,22,11.0,8.0,,0.005623681946812129,3,279,0.12235928505111557,0.00014869885820941185,105.24942292107477,COMPLETE
384,1.0039770603179932,2023-09-04 12:03:32.334509,2023-09-04 12:03:33.427517,0 days 00:00:01.093008,Sigmoid,ReLU,Leaky,,46,23,6.0,7.0,,0.037917390184006826,3,264,0.5806730446367865,0.07687556830095857,100.64750463312322,COMPLETE
385,0.1806616187095642,2023-09-04 12:03:33.428125,2023-09-04 12:03:34.672326,0 days 00:00:01.244201,Tanh,ReLU,ReLU,,52,19,5.0,8.0,,0.02171997183377107,3,287,0.6823276010376393,0.00017899186448616257,130.02449768066407,COMPLETE
386,0.18827500939369202,2023-09-04 12:03:34.672907,2023-09-04 12:03:36.018647,0 days 00:00:01.345740,ReLU,Tanh,Leaky,,49,24,10.0,8.0,,0.013339574744196473,3,273,0.7658976771067554,1.982846706340127e-05,253.12781491486922,COMPLETE
387,0.1939523071050644,2023-09-04 12:03:36.019227,2023-09-04 12:03:38.017256,0 days 00:00:01.998029,Tanh,ReLU,Sigmoid,,53,20,16.0,3.0,,0.007911179707300943,3,366,0.737443783901689,0.0007143437490457882,173.14855675948294,COMPLETE
388,0.23480750620365143,2023-09-04 12:03:38.017846,2023-09-04 12:03:38.609958,0 days 00:00:00.592112,ReLU,,,,51,22,,,,0.019062546727694675,1,92,0.2973338900233473,0.00012555694483345066,239.05843794973273,COMPLETE
389,0.15525223314762115,2023-09-04 12:03:38.610506,2023-09-04 12:03:40.563535,0 days 00:00:01.953029,ReLU,Sigmoid,Sigmoid,,98,23,6.0,10.0,,0.025979688238333888,3,255,0.7995352786077942,0.0004176231494573078,118.12576848156047,COMPLETE
390,0.20223063230514526,2023-09-04 12:03:40.564121,2023-09-04 12:03:41.765316,0 days 00:00:01.201195,ReLU,Sigmoid,Leaky,,96,21,6.0,10.0,,0.03011624807133615,3,257,0.7641821926154704,0.000352053649538456,82.72658746892756,COMPLETE
391,0.17990900576114655,2023-09-04 12:03:41.765890,2023-09-04 12:03:43.717722,0 days 00:00:01.951832,ReLU,Sigmoid,Sigmoid,,98,23,6.0,10.0,,0.02605643804943944,3,292,0.7990724803017308,0.0002599632712628832,100.44430570782356,COMPLETE
392,0.2656431496143341,2023-09-04 12:03:43.718299,2023-09-04 12:03:50.446239,0 days 00:00:06.727940,ReLU,Sigmoid,Sigmoid,,99,24,7.0,9.0,,0.00014394828395048877,3,280,0.5186175941103834,0.0002846092882035449,105.93367990766252,COMPLETE
393,0.1900913119316101,2023-09-04 12:03:50.446813,2023-09-04 12:03:51.692294,0 days 00:00:01.245481,ReLU,Sigmoid,Sigmoid,,96,22,5.0,11.0,,0.02452438716904275,3,263,0.6564076977843049,0.0004698555873981104,84.84854008601262,COMPLETE
394,0.21201272308826447,2023-09-04 12:03:51.692889,2023-09-04 12:03:52.248497,0 days 00:00:00.555608,ReLU,Sigmoid,Sigmoid,,100,23,6.0,9.0,,0.034615971072588556,3,271,0.34943017173443086,0.00030815804956117347,188.29761662976495,COMPLETE
395,0.1736486703157425,2023-09-04 12:03:52.249112,2023-09-04 12:03:53.702364,0 days 00:00:01.453252,ReLU,Sigmoid,Leaky,,95,24,5.0,11.0,,0.018507477728891605,3,257,0.7257466957034545,0.0003777027550594243,87.62873767671131,COMPLETE
396,0.21303674578666687,2023-09-04 12:03:53.702943,2023-09-04 12:03:57.918513,0 days 00:00:04.215570,ReLU,Sigmoid,Tanh,,65,21,7.0,10.0,,0.001455401169314063,3,245,0.7012045643680231,0.00021634589750078826,134.6989410862778,COMPLETE
397,0.20037518441677094,2023-09-04 12:03:57.919099,2023-09-04 12:03:59.504697,0 days 00:00:01.585598,ReLU,Sigmoid,Sigmoid,,97,20,4.0,1.0,,0.022506835289808555,3,118,0.7537645864800655,2.4902278356219693e-05,87.84850633409289,COMPLETE
398,0.19031938910484314,2023-09-04 12:03:59.505282,2023-09-04 12:04:00.564293,0 days 00:00:01.059011,ReLU,Sigmoid,Sigmoid,,98,22,7.0,4.0,,0.029928720554467058,3,277,0.4145182550274989,1.6666668403761338e-05,147.54295686575082,COMPLETE
399,0.2337610423564911,2023-09-04 12:04:00.564929,2023-09-04 12:04:01.743275,0 days 00:00:01.178346,ReLU,Sigmoid,ReLU,,47,22,8.0,9.0,,0.015192160144383265,3,253,0.3313898887832001,0.00018906963660225324,81.45388137462527,COMPLETE
400,0.1634620875120163,2023-09-04 12:04:01.743870,2023-09-04 12:04:03.991443,0 days 00:00:02.247573,ReLU,Tanh,Sigmoid,ReLU,48,21,5.0,10.0,21.0,0.01719431769819728,4,267,0.7989111938199689,2.1697945213969973e-05,100.96569442749023,COMPLETE
401,0.22430813312530518,2023-09-04 12:04:03.992060,2023-09-04 12:04:08.731966,0 days 00:00:04.739906,Leaky,Tanh,,,47,21,5.0,,,0.00047153810056143214,2,268,0.38808363051870726,2.1901906101242122e-05,88.41187191748804,COMPLETE
402,0.17797857522964478,2023-09-04 12:04:08.732408,2023-09-04 12:04:09.361025,0 days 00:00:00.628617,ReLU,Tanh,Sigmoid,ReLU,48,20,5.0,10.0,21.0,0.01931077114332634,4,263,0.7659126636069598,2.6483329738799898e-05,107.40477696171513,COMPLETE
403,0.2097228616476059,2023-09-04 12:04:09.361380,2023-09-04 12:04:09.681948,0 days 00:00:00.320568,ReLU,Tanh,Sigmoid,,44,21,5.0,9.0,,0.01655221721935283,3,286,0.30071167064744203,0.001217784555683884,236.13772268856272,COMPLETE
404,0.18745394051074982,2023-09-04 12:04:09.682284,2023-09-04 12:04:10.680543,0 days 00:00:00.998259,ReLU,Tanh,Sigmoid,ReLU,45,10,6.0,10.0,14.0,0.0230226855777958,4,274,0.729824793559291,1.999621113106711e-05,83.87444814046223,COMPLETE
405,0.22336119413375854,2023-09-04 12:04:10.680928,2023-09-04 12:04:11.365434,0 days 00:00:00.684506,ReLU,Tanh,Sigmoid,ReLU,50,24,4.0,11.0,20.0,0.0005675934010970279,4,298,0.19164834369271053,3.005528990472449e-05,138.1364416394915,COMPLETE
406,0.26313456892967224,2023-09-04 12:04:11.365768,2023-09-04 12:04:12.000921,0 days 00:00:00.635153,ReLU,Tanh,Sigmoid,,49,21,7.0,10.0,,0.0011377096280008737,3,253,0.1741383621605653,0.00015121338761639835,110.75618035023606,COMPLETE
407,0.19459031522274017,2023-09-04 12:04:12.001272,2023-09-04 12:04:12.557702,0 days 00:00:00.556430,ReLU,Tanh,Sigmoid,ReLU,52,20,6.0,9.0,16.0,0.026925425840828382,4,265,0.6863777114815497,0.00022421168704814026,85.93867577446832,COMPLETE
408,0.2077743411064148,2023-09-04 12:04:12.558181,2023-09-04 12:04:12.995434,0 days 00:00:00.437253,ReLU,ReLU,,,100,19,9.0,,,0.016148828600702082,2,239,0.7756859053651157,0.0001164837426118996,239.55501302083334,COMPLETE
409,0.19746430218219757,2023-09-04 12:04:12.995762,2023-09-04 12:04:14.318310,0 days 00:00:01.322548,ReLU,ReLU,Sigmoid,Tanh,45,23,18.0,10.0,21.0,0.003154159541207875,4,257,0.7372175195477135,0.0004428392988499165,94.31565801447088,COMPLETE
410,0.17782890796661377,2023-09-04 12:04:14.318658,2023-09-04 12:04:15.052212,0 days 00:00:00.733554,Tanh,ReLU,Sigmoid,ReLU,58,24,6.0,12.0,11.0,0.020567166107293054,4,278,0.7742984371019528,0.00010046056046301151,93.18658468458388,COMPLETE
411,0.261547714471817,2023-09-04 12:04:15.052665,2023-09-04 12:04:17.673122,0 days 00:00:02.620457,Sigmoid,Tanh,Sigmoid,ReLU,48,23,5.0,8.0,15.0,0.0006291249696911454,4,247,0.33662124453715203,2.5519070329910994e-05,197.76003410555572,COMPLETE
412,0.2387290596961975,2023-09-04 12:04:17.673463,2023-09-04 12:04:18.232821,0 days 00:00:00.559358,ReLU,ReLU,,,51,23,8.0,,,0.013827614472573508,2,268,0.7975235692333198,0.00014489244897577258,95.94575663975307,COMPLETE
413,0.23691464960575104,2023-09-04 12:04:18.233154,2023-09-04 12:04:19.161039,0 days 00:00:00.927885,ReLU,ReLU,Sigmoid,,42,20,4.0,11.0,,0.0580323492575218,3,290,0.7992996649559627,0.00031933972819781956,96.95544210294398,COMPLETE
414,0.20853453874588013,2023-09-04 12:04:19.161444,2023-09-04 12:04:19.728115,0 days 00:00:00.566671,Tanh,ReLU,Sigmoid,,39,24,9.0,9.0,,0.03370677596534931,3,260,0.7134715626198139,0.00016880736586975353,88.90898986816406,COMPLETE
415,0.2101711630821228,2023-09-04 12:04:19.728452,2023-09-04 12:04:20.337612,0 days 00:00:00.609160,ReLU,ReLU,Sigmoid,,53,21,5.0,8.0,,0.01782544161664168,3,280,0.7425811990490777,0.0005961800428062038,112.37525939941406,COMPLETE
416,0.20262549817562103,2023-09-04 12:04:20.337957,2023-09-04 12:04:21.175989,0 days 00:00:00.838032,Tanh,ReLU,Sigmoid,,50,22,9.0,7.0,,0.00420929414463191,3,234,0.6168698848280603,1.8597455237369782e-05,118.59735329367898,COMPLETE
417,0.1971420794725418,2023-09-04 12:04:21.176340,2023-09-04 12:04:21.613525,0 days 00:00:00.437185,ReLU,ReLU,,,55,24,10.0,,,0.02646092153288322,2,249,0.6484746080144046,0.00024518117665613847,104.71167616410689,COMPLETE
418,0.23174317181110382,2023-09-04 12:04:21.613901,2023-09-04 12:04:22.023581,0 days 00:00:00.409680,Leaky,Tanh,Sigmoid,,57,23,8.0,6.0,,0.004823902121106751,3,271,0.26331202038907775,2.1504214739082676e-05,90.30726305643718,COMPLETE
419,0.18728093802928925,2023-09-04 12:04:22.023939,2023-09-04 12:04:22.666133,0 days 00:00:00.642194,ReLU,ReLU,Sigmoid,,48,22,7.0,9.0,,0.022061378095203584,3,306,0.456915595908351,3.066857594335799e-05,78.15677459423358,COMPLETE
420,0.19414302706718445,2023-09-04 12:04:22.666522,2023-09-04 12:04:23.349763,0 days 00:00:00.683241,Tanh,ReLU,Sigmoid,,53,16,10.0,5.0,,0.01207802840418843,3,260,0.6910607615366272,0.00019145557378294655,81.14962281121149,COMPLETE
421,0.21778061985969543,2023-09-04 12:04:23.350100,2023-09-04 12:04:28.056480,0 days 00:00:04.706380,ReLU,ReLU,Sigmoid,,50,21,6.0,7.0,,0.0003698411446045244,3,249,0.7998438066866983,0.00040714619028936195,255.95063009606787,COMPLETE
422,0.20341652631759644,2023-09-04 12:04:28.056819,2023-09-04 12:04:29.016621,0 days 00:00:00.959802,Tanh,ReLU,ReLU,,12,24,9.0,8.0,,0.01610411943069595,3,286,0.2936903060162068,0.00012981623715297913,82.65024490356446,COMPLETE
423,0.1866607964038849,2023-09-04 12:04:29.017071,2023-09-04 12:04:29.502701,0 days 00:00:00.485630,ReLU,Sigmoid,Sigmoid,,54,22,19.0,7.0,,0.045948135830766755,3,240,0.7539837158896859,9.33362723313227e-05,152.68226946317233,COMPLETE
424,0.2697802782058716,2023-09-04 12:04:29.503171,2023-09-04 12:04:29.672863,0 days 00:00:00.169692,ReLU,ReLU,Sigmoid,Sigmoid,81,23,18.0,10.0,20.0,0.019861949844842065,4,274,0.10143299425928083,3.310974362518596e-05,924.5481008976063,COMPLETE
425,0.23242773115634918,2023-09-04 12:04:29.673307,2023-09-04 12:04:32.871979,0 days 00:00:03.198672,Tanh,Tanh,Sigmoid,,20,22,10.0,8.0,,0.0008488772474221179,3,265,0.7176823909856246,1.56279936812465e-05,132.50603613692724,COMPLETE
426,0.18064537644386292,2023-09-04 12:04:32.872415,2023-09-04 12:04:34.745166,0 days 00:00:01.872751,ReLU,ReLU,Sigmoid,,60,18,8.0,6.0,,0.002226047318342872,3,260,0.7517349573894014,2.3897608568652643e-05,77.20063919580284,COMPLETE
427,0.202159583568573,2023-09-04 12:04:34.745510,2023-09-04 12:04:35.143979,0 days 00:00:00.398469,ReLU,Sigmoid,Sigmoid,,46,20,5.0,9.0,,0.013697963908654576,3,108,0.3109146988812828,0.0015862141621532362,87.24438719315962,COMPLETE
428,0.1857440173625946,2023-09-04 12:04:35.144323,2023-09-04 12:04:35.649643,0 days 00:00:00.505320,Tanh,ReLU,Tanh,,51,24,8.0,5.0,,0.023811538564281802,3,137,0.5429314587671118,3.6493429000528845e-05,84.03085645039876,COMPLETE
429,0.19524748623371124,2023-09-04 12:04:35.650037,2023-09-04 12:04:36.203524,0 days 00:00:00.553487,ReLU,ReLU,Sigmoid,,98,19,9.0,7.0,,0.017552676135940574,3,250,0.6719311814773561,0.00011126358211542584,84.77450401306152,COMPLETE
430,0.18838874995708466,2023-09-04 12:04:36.203871,2023-09-04 12:04:36.994548,0 days 00:00:00.790677,Tanh,Sigmoid,Sigmoid,,56,23,7.0,8.0,,0.01156811318807128,3,280,0.769114563461903,0.0002147461632796587,91.4233876546224,COMPLETE
431,0.2429431825876236,2023-09-04 12:04:36.994893,2023-09-04 12:04:37.811068,0 days 00:00:00.816175,ReLU,ReLU,Sigmoid,,52,21,10.0,6.0,,0.002550522321495564,3,228,0.22964895281825976,0.00030247929265562627,134.42528776689008,COMPLETE
432,0.21934174001216888,2023-09-04 12:04:37.811414,2023-09-04 12:04:38.469913,0 days 00:00:00.658499,ReLU,ReLU,Sigmoid,,49,23,9.0,7.0,,0.028544541533721844,3,271,0.7256478175056325,0.0009485242365071169,97.02210977342394,COMPLETE
433,0.2009015530347824,2023-09-04 12:04:38.470282,2023-09-04 12:04:39.033416,0 days 00:00:00.563134,Tanh,Sigmoid,Sigmoid,,62,21,11.0,11.0,,0.015505668048683138,3,294,0.47894515760510353,1.8669458269996824e-05,86.13019048250638,COMPLETE
434,0.20922940969467163,2023-09-04 12:04:39.033873,2023-09-04 12:04:40.247630,0 days 00:00:01.213757,ReLU,ReLU,ReLU,,54,24,10.0,9.0,,0.0015774035423426265,3,256,0.7031763859188104,0.012140932184248991,141.96894215901693,COMPLETE
435,0.20887956023216248,2023-09-04 12:04:40.247984,2023-09-04 12:04:40.602671,0 days 00:00:00.354687,ReLU,Tanh,Sigmoid,,58,22,8.0,6.0,,0.03842342526089673,3,245,0.5060936754337313,0.0001622941595282452,99.96531519396552,COMPLETE
436,0.24922789633274078,2023-09-04 12:04:40.603014,2023-09-04 12:04:41.431344,0 days 00:00:00.828330,Sigmoid,ReLU,Sigmoid,,47,23,10.0,10.0,,0.019961138150247207,3,268,0.7706087918956714,0.0006162328059572141,93.83245958600726,COMPLETE
437,0.24251164495944977,2023-09-04 12:04:41.431683,2023-09-04 12:04:42.158347,0 days 00:00:00.726664,Tanh,Sigmoid,Sigmoid,,55,24,11.0,23.0,,0.0060686111143804025,3,236,0.5629255931209808,0.0032697596365985097,115.75180279767072,COMPLETE
438,0.20701339840888977,2023-09-04 12:04:42.158675,2023-09-04 12:04:42.959533,0 days 00:00:00.800858,ReLU,ReLU,Leaky,,52,22,6.0,19.0,,0.010061896133765272,3,280,0.7423507881977209,8.244420695156503e-05,84.24327590248801,COMPLETE
439,0.2031024545431137,2023-09-04 12:04:42.959902,2023-09-04 12:04:43.792614,0 days 00:00:00.832712,Tanh,ReLU,Sigmoid,,50,21,9.0,12.0,,0.003519236646750182,3,148,0.5991435293460419,0.0011238005512829983,115.44785849831321,COMPLETE
440,0.18077871203422546,2023-09-04 12:04:43.793067,2023-09-04 12:04:44.367394,0 days 00:00:00.574327,ReLU,Sigmoid,Sigmoid,,57,23,5.0,8.0,,0.013750615038158973,3,122,0.7704750190013295,2.4785947204910363e-05,109.92066701253255,COMPLETE
441,0.20357036590576172,2023-09-04 12:04:44.367845,2023-09-04 12:04:45.084270,0 days 00:00:00.716425,ReLU,ReLU,Sigmoid,Tanh,53,24,9.0,5.0,6.0,0.023630483055195807,4,257,0.6621748555855392,0.0001338320187465726,300.5090456510845,COMPLETE
442,0.18763253092765808,2023-09-04 12:04:45.084644,2023-09-04 12:04:45.685101,0 days 00:00:00.600457,Tanh,ReLU,Sigmoid,,49,22,8.0,2.0,,0.01827634986152569,3,80,0.7221336592900255,0.00025627710367861773,142.9213936328888,COMPLETE
443,0.23609864711761475,2023-09-04 12:04:45.685451,2023-09-04 12:04:46.465645,0 days 00:00:00.780194,Leaky,Sigmoid,Leaky,,100,21,10.0,9.0,,0.0010687132821447561,3,165,0.2864897627850247,0.006553641825018297,106.21828867594401,COMPLETE
444,0.19521448016166687,2023-09-04 12:04:46.465996,2023-09-04 12:04:47.065049,0 days 00:00:00.599053,ReLU,Tanh,Sigmoid,,45,20,7.0,1.0,,0.031039612582139196,3,241,0.7998799716009343,2.1337587882659832e-05,100.36421316641348,COMPLETE
445,0.20151196420192719,2023-09-04 12:04:47.065429,2023-09-04 12:04:47.426213,0 days 00:00:00.360784,ReLU,,,,43,23,,,,0.015145925971721954,1,130,0.6885627499204768,2.8058614331595138e-05,85.76418445728443,COMPLETE
446,0.20829954743385315,2023-09-04 12:04:47.426549,2023-09-04 12:04:48.018098,0 days 00:00:00.591549,Tanh,ReLU,Sigmoid,,55,22,17.0,8.0,,0.006834662094803585,3,265,0.7464828275037882,0.0001783250887511846,85.17431831359863,COMPLETE
447,0.22817955911159515,2023-09-04 12:04:48.018457,2023-09-04 12:04:48.281819,0 days 00:00:00.263362,ReLU,ReLU,Sigmoid,,52,24,4.0,7.0,,0.011793121100596514,3,287,0.37007781448854077,9.581542843617424e-05,110.36264892578124,COMPLETE
448,0.23596112430095673,2023-09-04 12:04:48.282196,2023-09-04 12:04:49.125691,0 days 00:00:00.843495,Tanh,Sigmoid,Sigmoid,,59,23,6.0,10.0,,0.021052676212062266,3,254,0.7736783294602829,0.0017941990816302115,130.03700759887695,COMPLETE
449,0.20479074120521545,2023-09-04 12:04:49.126055,2023-09-04 12:04:49.603984,0 days 00:00:00.477929,ReLU,ReLU,Leaky,,71,20,10.0,4.0,,0.008550996687323705,3,274,0.7140707336003057,0.0003681542072906093,241.25822494969225,COMPLETE
450,0.2219247668981552,2023-09-04 12:04:49.604332,2023-09-04 12:04:49.788014,0 days 00:00:00.183682,ReLU,Sigmoid,ReLU,,56,24,9.0,6.0,,0.01723959407685306,3,142,0.21597924149176412,4.0312842603898184e-05,114.47006166898288,COMPLETE
451,0.20673327147960663,2023-09-04 12:04:49.788375,2023-09-04 12:04:50.438617,0 days 00:00:00.650242,Tanh,ReLU,Sigmoid,,48,21,11.0,7.0,,0.02516045138321137,3,264,0.7983014440297915,1.626764339775925e-05,125.03319081952495,COMPLETE
452,0.3704615533351898,2023-09-04 12:04:50.439009,2023-09-04 12:04:50.820793,0 days 00:00:00.381784,ReLU,ReLU,Tanh,,36,22,5.0,5.0,,0.08023538853817144,3,250,0.39290894967229306,7.583778296426875e-05,114.98633801495588,COMPLETE
453,0.25340408086776733,2023-09-04 12:04:50.821154,2023-09-04 12:04:51.512141,0 days 00:00:00.690987,ReLU,Tanh,Sigmoid,,51,23,18.0,8.0,,0.0047438325935881655,3,298,0.7463351747957438,0.040209047776036566,139.87366073196,COMPLETE
454,0.20983755588531494,2023-09-04 12:04:51.512590,2023-09-04 12:04:52.312451,0 days 00:00:00.799861,Tanh,Sigmoid,Sigmoid,,54,18,9.0,9.0,,0.013375433300734521,3,234,0.6365919953146575,0.00021490408940713624,134.87887227760172,COMPLETE
455,0.19480717182159424,2023-09-04 12:04:52.312787,2023-09-04 12:04:52.937228,0 days 00:00:00.624441,ReLU,ReLU,Sigmoid,,97,22,8.0,6.0,,0.019955288600406622,3,277,0.7703024224652937,0.0001444384488948349,155.17533737182617,COMPLETE
456,0.15985073149204254,2023-09-04 12:04:52.937576,2023-09-04 12:04:53.516729,0 days 00:00:00.579153,Tanh,ReLU,Leaky,,47,24,7.0,7.0,,0.01574518111820487,3,110,0.7025722638583983,0.00011439870071022385,87.35937573832851,COMPLETE
457,0.4998907446861267,2023-09-04 12:04:53.517069,2023-09-04 12:04:54.947967,0 days 00:00:01.430898,Tanh,ReLU,Leaky,,41,24,7.0,7.0,,4.856724404608663e-05,3,120,0.41064288358537704,0.00011127931757204199,115.26615778605144,COMPLETE
458,0.21048033237457275,2023-09-04 12:04:54.948323,2023-09-04 12:04:55.503246,0 days 00:00:00.554923,Tanh,Sigmoid,Leaky,,44,24,7.0,8.0,,0.010018636752746102,3,98,0.35303103856782336,0.00016682489619102885,125.42461603338069,COMPLETE
459,0.22894185781478882,2023-09-04 12:04:55.503595,2023-09-04 12:04:55.827171,0 days 00:00:00.323576,Tanh,ReLU,Leaky,,47,24,8.0,9.0,,0.015670757759840854,3,114,0.2490765235478262,0.002788106772911008,1052.877864074707,COMPLETE
460,0.20477257668972015,2023-09-04 12:04:55.827549,2023-09-04 12:04:56.280777,0 days 00:00:00.453228,Tanh,Leaky,Leaky,,45,24,7.0,8.0,,0.052375293928158234,3,106,0.6711240258093073,0.00010478681724005747,118.84402370452881,COMPLETE
461,0.23661966621875763,2023-09-04 12:04:56.281253,2023-09-04 12:04:56.853004,0 days 00:00:00.571751,Tanh,ReLU,Leaky,,47,23,10.0,7.0,,0.012322156041381272,3,104,0.6892400453850636,0.0024970529884535374,109.11892293294271,COMPLETE
462,0.17013981938362122,2023-09-04 12:04:56.853470,2023-09-04 12:04:57.588133,0 days 00:00:00.734663,Tanh,Sigmoid,Leaky,,50,23,9.0,8.0,,0.015050460185095062,3,90,0.7089827304286782,0.0001238083176836384,229.20036036793778,COMPLETE
463,0.21117788553237915,2023-09-04 12:04:57.588612,2023-09-04 12:04:59.501179,0 days 00:00:01.912567,Tanh,Tanh,Leaky,,57,24,8.0,20.0,,0.000684081534441302,3,131,0.6504725666515903,8.262180889952587e-05,83.75930920084014,COMPLETE
464,0.18354767560958862,2023-09-04 12:04:59.501533,2023-09-04 12:05:00.261910,0 days 00:00:00.760377,Tanh,ReLU,Leaky,,53,14,19.0,17.0,,0.03716731711426005,3,112,0.7361066361634214,0.0001341894373749559,6542.508581252325,COMPLETE
465,0.23796051740646362,2023-09-04 12:05:00.262269,2023-09-04 12:05:01.434892,0 days 00:00:01.172623,Tanh,ReLU,ReLU,,15,23,11.0,11.0,,0.00047571999534988204,3,123,0.13637442045494513,0.0008262809690481897,157.08997828785965,COMPLETE
