number,value,datetime_start,datetime_complete,duration,params_activation1,params_activation2,params_activation3,params_activation4,params_batch_size,params_fl1,params_fl2,params_fl3,params_fl4,params_learning_rate,params_n_layers,params_num_epochs,params_train_size,params_weight_decay,user_attrs_mre,state
453,1.0809248685836792,2023-09-04 11:58:22.651146,2023-09-04 11:58:23.169238,0 days 00:00:00.518092,Sigmoid,Sigmoid,Leaky,Sigmoid,59,22,15.0,9.0,3.0,0.029994795492169626,4,409,0.3236796836299355,0.038260656157983665,100.25382080078126,COMPLETE
454,0.2171505093574524,2023-09-04 11:58:23.169852,2023-09-04 11:58:23.691130,0 days 00:00:00.521278,Leaky,Sigmoid,Tanh,Sigmoid,56,23,13.0,9.0,3.0,0.021997292342092675,4,426,0.2247491262607106,1.4635261598252356e-05,105.95470511394998,COMPLETE
455,0.22293706238269806,2023-09-04 11:58:23.691620,2023-09-04 11:58:24.526653,0 days 00:00:00.835033,Leaky,Sigmoid,Tanh,Sigmoid,51,22,14.0,10.0,3.0,0.015678119480279,4,469,0.7445677642816123,1.8258131726470173e-05,96.46156273818598,COMPLETE
456,0.214376762509346,2023-09-04 11:58:24.527116,2023-09-04 11:58:25.269973,0 days 00:00:00.742857,Leaky,ReLU,Leaky,Leaky,48,14,15.0,6.0,5.0,0.006305937909341932,4,418,0.7757228650206428,2.716244412477331e-05,109.4655033458363,COMPLETE
457,0.17831671237945557,2023-09-04 11:58:25.270327,2023-09-04 11:58:26.381553,0 days 00:00:01.111226,Tanh,Sigmoid,Tanh,Sigmoid,51,15,15.0,5.0,1.0,0.010718855004866834,4,437,0.7065104254211191,2.1370868240435565e-05,174.35536142122947,COMPLETE
458,0.20590466260910034,2023-09-04 11:58:26.381900,2023-09-04 11:58:27.141413,0 days 00:00:00.759513,Leaky,Sigmoid,Sigmoid,Sigmoid,25,21,13.0,15.0,6.0,0.02015413185066668,4,204,0.313068269587291,1.2655387448486063e-05,78.55061673103495,COMPLETE
459,0.19436587393283844,2023-09-04 11:58:27.141791,2023-09-04 11:58:29.045849,0 days 00:00:01.904058,ReLU,Tanh,Tanh,Sigmoid,22,22,24.0,9.0,5.0,0.011853437468389558,4,403,0.7400546227066755,1.7227393384214407e-05,148.28230516115823,COMPLETE
460,0.1923210769891739,2023-09-04 11:58:29.046221,2023-09-04 11:58:30.376857,0 days 00:00:01.330636,Leaky,Sigmoid,Leaky,Sigmoid,49,23,15.0,11.0,4.0,0.00899008230434797,4,431,0.7714766482702674,0.0006735829646293141,83.8463505160424,COMPLETE
461,0.1785607486963272,2023-09-04 11:58:30.377208,2023-09-04 11:58:30.840314,0 days 00:00:00.463106,Leaky,Leaky,Tanh,Sigmoid,49,21,21.0,10.0,7.0,0.01552266652919313,4,442,0.7238250836973744,0.0009242569835921931,89.70884813581195,COMPLETE
462,0.190670445561409,2023-09-04 11:58:30.840662,2023-09-04 11:58:31.286330,0 days 00:00:00.445668,Leaky,Tanh,Tanh,Sigmoid,81,20,14.0,8.0,12.0,0.024868165101934393,4,144,0.771490985101705,2.695557817431321e-05,131.86422023066768,COMPLETE
463,0.2173498123884201,2023-09-04 11:58:31.286699,2023-09-04 11:58:34.833711,0 days 00:00:03.547012,Leaky,Sigmoid,Leaky,Leaky,46,13,22.0,6.0,6.0,0.0007301641033421499,4,454,0.7970617860476366,1.4090141436996196e-05,83.10580695429935,COMPLETE
464,0.16710934042930603,2023-09-04 11:58:34.834091,2023-09-04 11:58:36.648902,0 days 00:00:01.814811,Leaky,Tanh,Tanh,Sigmoid,26,24,15.0,5.0,7.0,0.004377093085456034,4,424,0.620499207673784,2.0189653646869476e-05,65.17254583297238,COMPLETE
465,0.23429076373577118,2023-09-04 11:58:36.649304,2023-09-04 11:58:37.673298,0 days 00:00:01.023994,Leaky,Sigmoid,Tanh,Sigmoid,27,24,15.0,5.0,7.0,0.006034921387020291,4,420,0.33821531013832584,1.9418965543957406e-05,86.75591765857133,COMPLETE
466,0.20187507569789886,2023-09-04 11:58:37.673797,2023-09-04 11:58:39.353126,0 days 00:00:01.679329,Tanh,Tanh,Leaky,ReLU,25,24,15.0,4.0,8.0,0.005337570063936292,4,426,0.5978439152632858,1.5962115217737502e-05,98.43672847747803,COMPLETE
467,0.20455937087535858,2023-09-04 11:58:39.353492,2023-09-04 11:58:45.192158,0 days 00:00:05.838666,Leaky,Tanh,Sigmoid,Sigmoid,23,14,16.0,5.0,7.0,0.000985115658389658,4,416,0.6356986876925605,2.2577354077444892e-05,165.53982351114462,COMPLETE
468,0.186462864279747,2023-09-04 11:58:45.192547,2023-09-04 11:58:46.977945,0 days 00:00:01.785398,Leaky,ReLU,Tanh,Sigmoid,26,24,15.0,6.0,7.0,0.007111058856842077,4,434,0.6653126137337728,2.46752370433551e-05,93.998293195452,COMPLETE
469,0.20592884719371796,2023-09-04 11:58:46.978332,2023-09-04 11:58:47.589743,0 days 00:00:00.611411,Leaky,Sigmoid,Leaky,Sigmoid,67,24,13.0,4.0,8.0,0.0043390439116226705,4,410,0.6156799489027543,1.921674253142915e-05,96.1634772164481,COMPLETE
470,0.20918293297290802,2023-09-04 11:58:47.590109,2023-09-04 11:58:49.015957,0 days 00:00:01.425848,Leaky,Tanh,ReLU,Sigmoid,60,21,14.0,5.0,6.0,0.0018367385427776196,4,233,0.36036126629766907,2.926860418859483e-05,119.06795036018669,COMPLETE
471,0.19306418299674988,2023-09-04 11:58:49.016342,2023-09-04 11:58:50.491178,0 days 00:00:01.474836,ReLU,Sigmoid,Tanh,ReLU,28,15,14.0,5.0,8.0,0.002727557245496906,4,443,0.5013061316480791,1.270131747067443e-05,151.12190130985144,COMPLETE
472,0.19840773940086365,2023-09-04 11:58:50.491545,2023-09-04 11:58:50.886347,0 days 00:00:00.394802,Leaky,Tanh,Tanh,Sigmoid,93,20,16.0,6.0,7.0,0.017793904123641232,4,427,0.5151016068684999,0.0005192981073885987,82.84926378404772,COMPLETE
473,0.2525211274623871,2023-09-04 11:58:50.886723,2023-09-04 11:58:51.133522,0 days 00:00:00.246799,Leaky,Sigmoid,Leaky,Leaky,27,21,15.0,8.0,6.0,0.013296606569720657,4,468,0.1760299233824817,0.0010808997087237105,372.9582526165506,COMPLETE
474,0.2303328961133957,2023-09-04 11:58:51.133906,2023-09-04 11:58:52.035474,0 days 00:00:00.901568,Leaky,Tanh,Tanh,Sigmoid,24,20,12.0,7.0,7.0,0.00293338920126825,4,454,0.262866496309429,1.5963344046114836e-05,120.13117980957031,COMPLETE
475,0.20734113454818726,2023-09-04 11:58:52.035856,2023-09-04 11:58:54.023335,0 days 00:00:01.987479,Tanh,Sigmoid,Tanh,Sigmoid,21,14,14.0,6.0,6.0,0.010482880067451298,4,435,0.6923688128121306,0.0006548963166603925,339.5524060175969,COMPLETE
476,0.2204524129629135,2023-09-04 11:58:54.023695,2023-09-04 11:58:54.962576,0 days 00:00:00.938881,Leaky,Tanh,Sigmoid,Sigmoid,55,21,16.0,13.0,11.0,0.004709444360637754,4,402,0.6160797270156615,0.0050420640191712884,124.62855382551227,COMPLETE
477,0.21139734983444214,2023-09-04 11:58:54.962932,2023-09-04 11:58:55.829868,0 days 00:00:00.866936,Leaky,Tanh,Leaky,Sigmoid,89,12,15.0,5.0,7.0,0.003494372834370969,4,422,0.6621562200683306,2.2951538368001334e-05,128.79923349268296,COMPLETE
478,0.20274700224399567,2023-09-04 11:58:55.830243,2023-09-04 11:58:56.985041,0 days 00:00:01.154798,Sigmoid,Sigmoid,Tanh,ReLU,45,22,16.0,4.0,18.0,0.007590273051166187,4,444,0.7055473466068991,0.0003288449059435565,114.74466775964808,COMPLETE
479,0.23427467048168182,2023-09-04 11:58:56.985401,2023-09-04 11:58:57.502182,0 days 00:00:00.516781,Leaky,Tanh,Leaky,Sigmoid,47,24,18.0,7.0,8.0,0.014941571446745633,4,460,0.4397797379085153,0.00830053041261036,139.48127004262562,COMPLETE
480,0.27521052956581116,2023-09-04 11:58:57.502547,2023-09-04 11:58:57.709279,0 days 00:00:00.206732,Leaky,Sigmoid,Tanh,Sigmoid,50,17,14.0,8.0,7.0,0.012052997589547094,4,412,0.12879302967539916,1.1552264065760964e-05,134.9357077108847,COMPLETE
481,0.21482239663600922,2023-09-04 11:58:57.709636,2023-09-04 11:58:59.211125,0 days 00:00:01.501489,Leaky,ReLU,Tanh,Sigmoid,29,9,22.0,6.0,2.0,0.0023299504581193622,4,451,0.45853151116437646,3.0422326294898396e-05,89.04330098470052,COMPLETE
482,0.22270630300045013,2023-09-04 11:58:59.211509,2023-09-04 11:58:59.567454,0 days 00:00:00.355945,Leaky,Tanh,Leaky,Leaky,27,20,19.0,9.0,13.0,0.019383964509991376,4,432,0.2303250506429728,1.9124902847750776e-05,86.40026746477399,COMPLETE
483,0.2087564766407013,2023-09-04 11:58:59.567833,2023-09-04 11:59:00.281284,0 days 00:00:00.713451,Leaky,Sigmoid,Tanh,Sigmoid,42,19,17.0,7.0,6.0,0.009877544315028824,4,472,0.5493358691251304,1.4403706578512482e-05,105.01971963735727,COMPLETE
484,0.19854210317134857,2023-09-04 11:59:00.281659,2023-09-04 11:59:01.060902,0 days 00:00:00.779243,Tanh,Tanh,Sigmoid,ReLU,54,16,21.0,5.0,7.0,0.01651982856969545,4,444,0.7287255567558981,0.0004378124052733881,130.95773372650146,COMPLETE
485,0.20707428455352783,2023-09-04 11:59:01.061270,2023-09-04 11:59:04.418815,0 days 00:00:03.357545,Leaky,Sigmoid,Tanh,Sigmoid,52,13,18.0,6.0,12.0,0.0002461488827374809,4,461,0.6408107716434538,3.437387452042185e-05,174.32187101156404,COMPLETE
486,0.21151898801326752,2023-09-04 11:59:04.419192,2023-09-04 11:59:07.427483,0 days 00:00:03.008291,Leaky,Tanh,Leaky,Sigmoid,24,21,20.0,8.0,11.0,0.03432245207290684,4,381,0.680223008371602,4.747288425583624e-05,129.0369083404541,COMPLETE
487,0.22528795897960663,2023-09-04 11:59:07.428124,2023-09-04 11:59:09.106992,0 days 00:00:01.678868,ReLU,Leaky,Tanh,Sigmoid,44,22,19.0,5.0,6.0,0.012719393170256547,4,394,0.21607526167807395,1.0157929851613099e-05,599.988959590091,COMPLETE
488,0.21965333819389343,2023-09-04 11:59:09.107628,2023-09-04 11:59:19.140951,0 days 00:00:10.033323,Leaky,Sigmoid,Leaky,Sigmoid,29,15,3.0,9.0,8.0,0.00019480240102075623,4,252,0.5621395799924656,2.453937670363176e-05,129.09964216323127,COMPLETE
489,0.21891947090625763,2023-09-04 11:59:19.141325,2023-09-04 11:59:19.505348,0 days 00:00:00.364023,Leaky,Tanh,Tanh,Leaky,49,20,13.0,16.0,8.0,0.008015301995812924,4,422,0.28362484363866863,0.002646149601744521,96.76753860864883,COMPLETE
490,0.28929775953292847,2023-09-04 11:59:19.505712,2023-09-04 11:59:20.783061,0 days 00:00:01.277349,Leaky,Tanh,Tanh,Sigmoid,26,1,18.0,8.0,1.0,0.023832669314810536,4,435,0.7443956941281763,1.668010559205483e-05,113.20375844594595,COMPLETE
491,0.22508226335048676,2023-09-04 11:59:20.783433,2023-09-04 11:59:21.359399,0 days 00:00:00.575966,Leaky,,,,20,6,,,,0.01048645335542613,1,451,0.5314464811670655,3.946149077350934e-05,94.22391718084162,COMPLETE
492,0.19207996129989624,2023-09-04 11:59:21.359754,2023-09-04 11:59:22.826721,0 days 00:00:01.466967,Leaky,Sigmoid,Leaky,ReLU,41,21,15.0,7.0,7.0,0.0014813219797015554,4,407,0.711717124104825,0.003835474824696938,320.10967910289764,COMPLETE
493,0.2147337943315506,2023-09-04 11:59:22.827104,2023-09-04 11:59:24.061940,0 days 00:00:01.234836,Tanh,Tanh,Tanh,Sigmoid,47,23,17.0,6.0,6.0,0.01492269250535759,4,472,0.7499232583089496,0.0008001921134001042,110.91251359906113,COMPLETE
494,0.17197009921073914,2023-09-04 11:59:24.062331,2023-09-04 11:59:25.198329,0 days 00:00:01.135998,Leaky,Sigmoid,ReLU,Sigmoid,34,19,19.0,6.0,10.0,0.01897642621399643,4,428,0.693252636932832,5.25340896674897e-05,140.03343555539152,COMPLETE
495,0.2129054218530655,2023-09-04 11:59:25.198718,2023-09-04 11:59:26.160276,0 days 00:00:00.961558,Leaky,Tanh,Sigmoid,Sigmoid,44,21,16.0,7.0,5.0,0.006078400600537102,4,440,0.5736633196120896,2.1479026175325788e-05,144.42382515801324,COMPLETE
496,0.20933707058429718,2023-09-04 11:59:26.160664,2023-09-04 11:59:28.527370,0 days 00:00:02.366706,Leaky,ReLU,Tanh,Sigmoid,40,22,20.0,8.0,12.0,0.0008143837951778596,4,415,0.4008393607601664,1.3615904811378478e-05,305.16297760009763,COMPLETE
497,0.22495678067207336,2023-09-04 11:59:28.527768,2023-09-04 11:59:29.140169,0 days 00:00:00.612401,Leaky,Sigmoid,Leaky,Sigmoid,30,20,22.0,5.0,7.0,0.008870157289924964,4,464,0.24283769691106988,2.8989653100361057e-05,191.6169300785771,COMPLETE
498,0.25110507011413574,2023-09-04 11:59:29.140552,2023-09-04 11:59:29.384739,0 days 00:00:00.244187,ReLU,Tanh,Tanh,ReLU,35,14,18.0,9.0,6.0,0.012259361479796393,4,311,0.2013981924216777,1.8500809621449295e-05,146.37702337900797,COMPLETE
499,0.20160456001758575,2023-09-04 11:59:29.385113,2023-09-04 11:59:30.352874,0 days 00:00:00.967761,Leaky,Sigmoid,Leaky,Leaky,32,21,17.0,4.0,8.0,0.014425174634284632,4,447,0.7490093001937257,2.614623056232049e-05,125.24881911277771,COMPLETE
