number,value,datetime_start,datetime_complete,duration,params_activation1,params_activation2,params_activation3,params_activation4,params_batch_size,params_fl1,params_fl2,params_fl3,params_fl4,params_learning_rate,params_n_layers,params_num_epochs,params_train_size,params_weight_decay,state
493,0.19203121960163116,2023-09-04 01:20:21.584437,2023-09-04 01:20:23.052118,0 days 00:00:01.467681,ReLU,Leaky,ReLU,Sigmoid,30,22,11.0,18.0,19.0,0.0024053830436251405,4,60,0.6302140107121268,2.1741798653407928e-05,COMPLETE
494,0.2076282799243927,2023-09-04 01:20:23.052464,2023-09-04 01:20:35.979072,0 days 00:00:12.926608,ReLU,Leaky,Sigmoid,Sigmoid,2,23,7.0,17.0,17.0,0.0008645196425841168,4,60,0.46145962109154665,0.00011415788635028478,COMPLETE
495,0.19703957438468933,2023-09-04 01:20:35.979416,2023-09-04 01:20:44.943733,0 days 00:00:08.964317,ReLU,Leaky,ReLU,Sigmoid,8,23,8.0,15.0,19.0,0.0037114277916187755,4,100,0.7122452126049641,0.00033915644650430105,COMPLETE
496,0.1957956701517105,2023-09-04 01:20:44.944071,2023-09-04 01:20:56.053228,0 days 00:00:11.109157,Sigmoid,Leaky,ReLU,Sigmoid,4,24,12.0,19.0,21.0,0.008398802030865092,4,60,0.7415257887830229,8.544775692564668e-05,COMPLETE
497,0.21944311261177063,2023-09-04 01:20:56.053567,2023-09-04 01:21:08.777681,0 days 00:00:12.724114,ReLU,Leaky,ReLU,ReLU,2,22,8.0,16.0,18.0,0.0015642481909115258,4,100,0.26710527630753456,0.0009786507556771222,COMPLETE
498,0.23869189620018005,2023-09-04 01:21:08.778033,2023-09-04 01:21:11.619167,0 days 00:00:02.841134,ReLU,Sigmoid,ReLU,Sigmoid,8,21,9.0,14.0,20.0,0.00019472444182170033,4,60,0.3732824792986057,0.0002803618948072531,COMPLETE
499,0.19983302056789398,2023-09-04 01:21:11.619509,2023-09-04 01:21:16.780739,0 days 00:00:05.161230,ReLU,Leaky,ReLU,Sigmoid,16,20,7.0,13.0,19.0,0.0018799219133571073,4,100,0.7715843269028504,0.0005972525253026477,COMPLETE
