number,value,datetime_start,datetime_complete,duration,params_activation1,params_activation2,params_activation3,params_activation4,params_batch_size,params_fl1,params_fl2,params_fl3,params_fl4,params_learning_rate,params_n_layers,params_num_epochs,params_train_size,params_weight_decay,user_attrs_mre,state
0,0.3233259916305542,2023-09-04 11:57:32.428723,2023-09-04 11:57:33.634157,0 days 00:00:01.205434,Tanh,,,,74,6,,,,0.004677509274971815,1,402,0.27066592292663855,0.002784611090675547,143.28283342821845,COMPLETE
1,0.29543495178222656,2023-09-04 11:57:33.634615,2023-09-04 11:57:34.855850,0 days 00:00:01.221235,Sigmoid,Sigmoid,Leaky,Tanh,41,10,3.0,6.0,6.0,0.05068633839128465,4,160,0.3809894548111297,0.00010615936907338852,166.08717739220822,COMPLETE
2,0.2914464771747589,2023-09-04 11:57:34.856359,2023-09-04 11:57:35.029966,0 days 00:00:00.173607,ReLU,Leaky,Tanh,,38,19,8.0,15.0,,0.07147729694906275,3,280,0.10865878560882938,0.00014483137925582046,98.80053234100342,COMPLETE
3,0.43904727697372437,2023-09-04 11:57:35.030457,2023-09-04 11:57:36.796411,0 days 00:00:01.765954,ReLU,Leaky,,,87,13,24.0,,,0.0009957542314423216,2,177,0.23212234668218057,0.07770349122312123,126.83378066585563,COMPLETE
4,0.8165839314460754,2023-09-04 11:57:36.796870,2023-09-04 11:57:39.746835,0 days 00:00:02.949965,ReLU,Sigmoid,,,44,10,5.0,,,8.99035608571258e-05,2,270,0.16615944551345757,0.035242414819217804,134.54367076732495,COMPLETE
5,0.9529471397399902,2023-09-04 11:57:39.747301,2023-09-04 11:57:42.418502,0 days 00:00:02.671201,ReLU,Leaky,Leaky,,91,5,19.0,17.0,,1.8239099012688713e-05,3,302,0.18912928702427173,0.0022746577267553107,647.3746568288235,COMPLETE
6,0.961530327796936,2023-09-04 11:57:42.418976,2023-09-04 11:57:42.815511,0 days 00:00:00.396535,Tanh,Tanh,Leaky,Sigmoid,97,6,15.0,1.0,15.0,0.028443113003513588,4,277,0.61716203304261,0.03921116458793134,108.09754298283504,COMPLETE
7,0.2770565450191498,2023-09-04 11:57:42.816028,2023-09-04 11:57:46.436075,0 days 00:00:03.620047,Leaky,,,,67,22,,,,0.0009963759821580312,1,328,0.46367290069105765,0.0005679877994575398,100.41130192435567,COMPLETE
8,0.2550852596759796,2023-09-04 11:57:46.436466,2023-09-04 11:57:47.657706,0 days 00:00:01.221240,Leaky,Sigmoid,,,47,21,6.0,,,0.0020632897937421595,2,173,0.16740314474843718,0.0004689932689157064,115.17491886979442,COMPLETE
9,0.21448110044002533,2023-09-04 11:57:47.658115,2023-09-04 11:57:48.207370,0 days 00:00:00.549255,ReLU,Tanh,,,58,12,12.0,,,0.015854455234857144,2,144,0.22182380741253982,0.0016002567739955766,72.3115816530974,COMPLETE
10,0.5177804827690125,2023-09-04 11:57:48.207776,2023-09-04 11:57:49.347951,0 days 00:00:01.140175,Sigmoid,,,,18,1,,,,0.012669051655108295,1,63,0.3308515451179693,1.0873529235340252e-05,151.42284079159006,COMPLETE
11,0.3141744136810303,2023-09-04 11:57:49.348367,2023-09-04 11:57:50.131800,0 days 00:00:00.783433,Leaky,Tanh,,,57,15,11.0,,,0.005223233029626085,2,122,0.1535866491071171,0.0009449285171308857,122.34246370162087,COMPLETE
12,0.24328190088272095,2023-09-04 11:57:50.132215,2023-09-04 11:57:52.179756,0 days 00:00:02.047541,Leaky,ReLU,,,19,24,12.0,,,0.0032237377025234213,2,206,0.2316443504465621,0.007899145278678075,92.20698536306188,COMPLETE
13,0.2530354857444763,2023-09-04 11:57:52.180180,2023-09-04 11:57:53.585092,0 days 00:00:01.404912,Leaky,ReLU,Sigmoid,,16,17,14.0,24.0,,0.014133135103229588,3,50,0.23813297066298938,0.0075610236602531855,98.46395301818848,COMPLETE
14,0.2183127999305725,2023-09-04 11:57:53.585527,2023-09-04 11:57:59.803387,0 days 00:00:06.217860,ReLU,ReLU,,,29,24,11.0,,,0.00044704350702824827,2,224,0.30663513793673836,0.007285832430902364,84.38493268830436,COMPLETE
15,0.2908971607685089,2023-09-04 11:57:59.803811,2023-09-04 11:58:05.246239,0 days 00:00:05.442428,ReLU,Tanh,ReLU,,28,11,17.0,24.0,,0.0003094601624605204,3,464,0.3373250800255838,0.009190880401910443,134.84495919942856,COMPLETE
16,0.3872009217739105,2023-09-04 11:58:05.246677,2023-09-04 11:58:10.012343,0 days 00:00:04.765666,ReLU,,,,59,15,,,,0.0003471869273994064,1,223,0.5047841851166434,0.003048751326324532,161.23959767978823,COMPLETE
17,0.23982752859592438,2023-09-04 11:58:10.012742,2023-09-04 11:58:10.898806,0 days 00:00:00.886064,ReLU,ReLU,,,75,18,9.0,,,0.012763859228960256,2,115,0.796259431362745,0.016036947621818568,95.45281127929688,COMPLETE
18,0.3192478120326996,2023-09-04 11:58:10.899218,2023-09-04 11:58:11.370388,0 days 00:00:00.471170,ReLU,ReLU,ReLU,,32,13,1.0,8.0,,0.083593910202754,3,352,0.30164684949852816,0.0021539815311701436,109.81828409830729,COMPLETE
19,0.6148241758346558,2023-09-04 11:58:11.370826,2023-09-04 11:58:15.604324,0 days 00:00:04.233498,Tanh,,,,52,8,,,,0.0003433456116715342,1,228,0.4174061460152218,0.09280875726250601,175.72509444387336,COMPLETE
20,0.38142675161361694,2023-09-04 11:58:15.604720,2023-09-04 11:58:17.794825,0 days 00:00:02.190105,Sigmoid,Tanh,,,29,2,19.0,,,0.031324006127493025,2,103,0.297831543440118,0.023662156155522415,116.78188742660895,COMPLETE
21,0.18376168608665466,2023-09-04 11:58:17.795277,2023-09-04 11:58:19.297952,0 days 00:00:01.502675,ReLU,ReLU,,,75,18,9.0,,,0.012274774358484406,2,114,0.7588321559703008,0.015383803730745438,96.2829760675845,COMPLETE
22,0.20957592129707336,2023-09-04 11:58:19.298361,2023-09-04 11:58:20.818475,0 days 00:00:01.520114,ReLU,ReLU,,,65,24,10.0,,,0.007220379443674051,2,129,0.5484880543654952,0.006611450366557398,76.87131239238538,COMPLETE
23,0.1962837129831314,2023-09-04 11:58:20.818888,2023-09-04 11:58:21.877518,0 days 00:00:01.058630,ReLU,ReLU,,,67,21,8.0,,,0.007074203546757586,2,142,0.757697145727471,0.015439065144345688,100.19959437052408,COMPLETE
24,0.2762362062931061,2023-09-04 11:58:21.877933,2023-09-04 11:58:23.304994,0 days 00:00:01.427061,ReLU,ReLU,Sigmoid,,75,21,8.0,18.0,,0.009365203199151375,3,88,0.756014958118741,0.01898772154437662,118.08923174883869,COMPLETE
25,0.15623989701271057,2023-09-04 11:58:23.305431,2023-09-04 11:58:25.811546,0 days 00:00:02.506115,ReLU,ReLU,,,67,22,5.0,,,0.006441187584008764,2,81,0.6616266133994558,0.005477035591213121,62.48318980652609,COMPLETE
26,0.4567525386810303,2023-09-04 11:58:25.811960,2023-09-04 11:58:27.522482,0 days 00:00:01.710522,ReLU,,,,82,20,,,,0.002614470460225067,1,78,0.6511544482506861,0.046855930706612224,134.92441891401242,COMPLETE
27,0.27040085196495056,2023-09-04 11:58:27.522891,2023-09-04 11:58:28.502255,0 days 00:00:00.979364,ReLU,ReLU,,,68,16,5.0,,,0.03590570979077467,2,192,0.6725468406040427,0.01560089533688197,114.97742806711504,COMPLETE
28,0.26964300870895386,2023-09-04 11:58:28.502676,2023-09-04 11:58:29.939990,0 days 00:00:01.437314,Sigmoid,ReLU,Tanh,,82,22,7.0,10.0,,0.02412934900268228,3,92,0.5505954831770365,0.004429526854345069,149.51243979975862,COMPLETE
29,0.23651123046875,2023-09-04 11:58:29.940459,2023-09-04 11:58:31.946926,0 days 00:00:02.006467,Tanh,,,,79,19,,,,0.004658072737830362,1,426,0.7389455410315414,0.003966538174718735,203.7247533553686,COMPLETE
30,0.3062207102775574,2023-09-04 11:58:31.947331,2023-09-04 11:58:33.836012,0 days 00:00:01.888681,Tanh,,,,64,22,,,,0.006933295012525529,1,138,0.5959310626525682,0.012317380572413435,135.48367055257162,COMPLETE
31,0.2398199886083603,2023-09-04 11:58:33.836401,2023-09-04 11:58:34.632769,0 days 00:00:00.796368,ReLU,ReLU,,,71,24,10.0,,,0.0067245871291080304,2,123,0.5556806001566876,0.005198137106889445,193.32049462103075,COMPLETE
32,0.2051110565662384,2023-09-04 11:58:34.633186,2023-09-04 11:58:35.454527,0 days 00:00:00.821341,ReLU,ReLU,,,62,23,3.0,,,0.0075635329818124365,2,162,0.6996192808027165,0.011974628512978572,88.35673427581787,COMPLETE
33,0.34348130226135254,2023-09-04 11:58:35.454792,2023-09-04 11:58:35.909782,0 days 00:00:00.454990,ReLU,ReLU,,,48,19,3.0,,,0.04882418616034466,2,163,0.7043674696669145,0.02400345377696174,128.84916203816732,COMPLETE
34,0.27528831362724304,2023-09-04 11:58:35.910051,2023-09-04 11:58:36.262573,0 days 00:00:00.352522,ReLU,ReLU,,,61,21,3.0,,,0.020399691144450532,2,69,0.6774715235912036,0.011980053250819174,86.46339688982282,COMPLETE
35,0.42221179604530334,2023-09-04 11:58:36.262841,2023-09-04 11:58:36.868777,0 days 00:00:00.605936,ReLU,ReLU,,,72,17,5.0,,,0.0035328938981686853,2,155,0.7802660236882828,0.0570831343818855,153.87846739395806,COMPLETE
36,1.013737678527832,2023-09-04 11:58:36.869124,2023-09-04 11:58:37.107040,0 days 00:00:00.237916,ReLU,ReLU,ReLU,Leaky,53,23,1.0,2.0,24.0,0.002261521004876104,4,255,0.6215127454737797,0.030792662742361917,104.65468186598558,COMPLETE
37,0.9488213062286377,2023-09-04 11:58:37.107324,2023-09-04 11:58:37.222443,0 days 00:00:00.115119,Sigmoid,ReLU,Sigmoid,,85,20,7.0,20.0,,0.05194216669249794,3,190,0.4789036709086368,0.058670176533738405,104.0355488170277,COMPLETE
38,0.4441283345222473,2023-09-04 11:58:37.222728,2023-09-04 11:58:38.177283,0 days 00:00:00.954555,ReLU,Sigmoid,,,90,20,3.0,,,0.009197098377534801,2,103,0.7109271800867261,0.03136843130061796,139.29209996365952,COMPLETE
39,0.23612773418426514,2023-09-04 11:58:38.177585,2023-09-04 11:58:38.771389,0 days 00:00:00.593804,ReLU,ReLU,Tanh,,96,18,4.0,12.0,,0.022165365931120777,3,50,0.612184899682659,0.012310567605772142,98.84788099924724,COMPLETE
40,0.2466215044260025,2023-09-04 11:58:38.771840,2023-09-04 11:58:41.596658,0 days 00:00:02.824818,ReLU,Leaky,,,79,22,8.0,,,0.001531705052286971,2,172,0.7977461738136417,0.004291454269831803,96.65947070753718,COMPLETE
41,0.18640971183776855,2023-09-04 11:58:41.597083,2023-09-04 11:58:43.040684,0 days 00:00:01.443601,ReLU,ReLU,,,64,22,9.0,,,0.004314526781434605,2,138,0.6913407220682802,0.006197823574200893,79.23074531555176,COMPLETE
42,0.2910464406013489,2023-09-04 11:58:43.041109,2023-09-04 11:58:44.766295,0 days 00:00:01.725186,ReLU,ReLU,,,63,23,7.0,,,0.00436748659849774,2,149,0.706528384017842,0.019665992532854063,143.8476114078444,COMPLETE
43,0.18752121925354004,2023-09-04 11:58:44.766717,2023-09-04 11:58:45.575368,0 days 00:00:00.808651,ReLU,ReLU,,,69,23,9.0,,,0.010293449806142855,2,105,0.6571365090378911,0.0029546684895000496,87.36319412231445,COMPLETE
44,0.2180725783109665,2023-09-04 11:58:45.575809,2023-09-04 11:58:46.471444,0 days 00:00:00.895635,ReLU,Leaky,,,69,21,9.0,,,0.013343349872207321,2,107,0.5887404035453854,0.001700003233792968,100.70990482453377,COMPLETE
45,0.2778208255767822,2023-09-04 11:58:46.471866,2023-09-04 11:58:48.508019,0 days 00:00:02.036153,Tanh,Sigmoid,,,54,18,14.0,,,0.004249528890193409,2,135,0.5170846072381062,0.0030639872599431375,112.18975432022758,COMPLETE
46,0.3017090857028961,2023-09-04 11:58:48.508447,2023-09-04 11:58:49.161283,0 days 00:00:00.652836,Leaky,,,,75,19,,,,0.016503909166793968,1,79,0.43647317371210564,0.005755568073921834,189.94110811673679,COMPLETE
47,0.18769121170043945,2023-09-04 11:58:49.161694,2023-09-04 11:58:51.245753,0 days 00:00:02.084059,ReLU,ReLU,,,69,22,6.0,,,0.010243952141185656,2,356,0.6397603962118372,0.0010986264627220045,67.6070447248571,COMPLETE
48,0.138751819729805,2023-09-04 11:58:51.246208,2023-09-04 11:58:52.387027,0 days 00:00:01.140819,ReLU,ReLU,,,78,23,6.0,,,0.010111052641592134,2,304,0.6427283478470668,0.001476802642461988,69.75222892761231,COMPLETE
49,0.2883153557777405,2023-09-04 11:58:52.387452,2023-09-04 11:58:55.448879,0 days 00:00:03.061427,Sigmoid,Leaky,,,88,23,23.0,,,0.0029680271696841294,2,247,0.5037786460001951,0.0029415951133985522,103.88782921615912,COMPLETE
50,0.20441435277462006,2023-09-04 11:58:55.449303,2023-09-04 11:58:59.446146,0 days 00:00:03.996843,ReLU,Sigmoid,Leaky,,78,14,6.0,6.0,,0.0016434276111596383,3,333,0.5865375242183172,0.0012666650827841837,133.99665555087003,COMPLETE
51,0.1473078727722168,2023-09-04 11:58:59.446620,2023-09-04 11:59:00.562695,0 days 00:00:01.116075,ReLU,ReLU,,,71,22,6.0,,,0.009750438366414784,2,377,0.6463586192259835,0.0007042121442678393,123.72072869378167,COMPLETE
52,0.15471062064170837,2023-09-04 11:59:00.563123,2023-09-04 11:59:02.192599,0 days 00:00:01.629476,ReLU,ReLU,,,84,24,10.0,,,0.016932797310653374,2,296,0.650120618857086,0.0007221675645262402,92.8893018819518,COMPLETE
53,0.1640653908252716,2023-09-04 11:59:02.193049,2023-09-04 11:59:03.857819,0 days 00:00:01.664770,ReLU,ReLU,,,94,24,11.0,,,0.017276026727270435,2,302,0.6454348931267014,0.0006326095197624821,89.92470411820845,COMPLETE
54,0.15443700551986694,2023-09-04 11:59:03.858248,2023-09-04 11:59:05.118360,0 days 00:00:01.260112,Leaky,ReLU,,,100,24,11.0,,,0.01771467853791607,2,301,0.548738627724409,0.0006233233148091738,194.8726202866127,COMPLETE
55,0.17498691380023956,2023-09-04 11:59:05.118788,2023-09-04 11:59:06.333236,0 days 00:00:01.214448,Leaky,ReLU,,,99,24,13.0,,,0.019367677861676202,2,299,0.46898564838144147,0.0005657550899981561,85.33789540760553,COMPLETE
56,0.20321960747241974,2023-09-04 11:59:06.333678,2023-09-04 11:59:07.039433,0 days 00:00:00.705755,Leaky,ReLU,,,92,24,11.0,,,0.029201691321595984,2,382,0.5292791115536343,0.0003467063763429559,170.42928862571716,COMPLETE
57,0.22911207377910614,2023-09-04 11:59:07.039870,2023-09-04 11:59:08.169966,0 days 00:00:01.130096,Leaky,Tanh,Tanh,ReLU,94,24,13.0,21.0,1.0,0.04065693969964021,4,300,0.5712503151144996,0.0007983642431778572,268.6840968776394,COMPLETE
58,0.2714441418647766,2023-09-04 11:59:08.170451,2023-09-04 11:59:09.360013,0 days 00:00:01.189562,Leaky,,,,85,23,,,,0.016133169925721398,1,278,0.6253449647953889,0.00037083018361753654,104.9450473078975,COMPLETE
59,0.22202758491039276,2023-09-04 11:59:09.360446,2023-09-04 11:59:10.003162,0 days 00:00:00.642716,Leaky,ReLU,,,100,6,12.0,,,0.099731477287185,2,320,0.3931776833032609,0.0006982325477951473,123.18731949969036,COMPLETE
60,0.1998477578163147,2023-09-04 11:59:10.003593,2023-09-04 11:59:10.873670,0 days 00:00:00.870077,Tanh,ReLU,,,94,9,16.0,,,0.025428506597976987,2,404,0.4917594676918608,0.001553074358318765,77.62242090979288,COMPLETE
61,0.21494458615779877,2023-09-04 11:59:10.874097,2023-09-04 11:59:11.900536,0 days 00:00:01.026439,Leaky,ReLU,,,99,24,13.0,,,0.020965934562208306,2,295,0.456678870039936,0.0005413492844243864,74.21012878417969,COMPLETE
62,0.15719763934612274,2023-09-04 11:59:11.900976,2023-09-04 11:59:13.514473,0 days 00:00:01.613497,Leaky,ReLU,,,89,23,11.0,,,0.017106159708354718,2,263,0.5717408852195339,0.00025073209578287267,207.84412107605866,COMPLETE
63,0.2099154144525528,2023-09-04 11:59:13.514911,2023-09-04 11:59:14.492344,0 days 00:00:00.977433,Leaky,ReLU,,,88,22,10.0,,,0.06232928054398812,2,321,0.5306969180934388,0.0002979719820929272,81.78290930459666,COMPLETE
64,0.19497442245483398,2023-09-04 11:59:14.492846,2023-09-04 11:59:15.423977,0 days 00:00:00.931131,Leaky,ReLU,,,82,21,11.0,,,0.014709089289790516,2,347,0.5698898139572504,0.0002083149474272044,84.22848428262246,COMPLETE
65,0.20298101007938385,2023-09-04 11:59:15.424430,2023-09-04 11:59:16.308068,0 days 00:00:00.883638,Leaky,ReLU,,,91,20,12.0,,,0.038639985050129715,2,488,0.6274344950215801,0.0009722286696663766,156.10162811279298,COMPLETE
66,0.24281562864780426,2023-09-04 11:59:16.308492,2023-09-04 11:59:16.777477,0 days 00:00:00.468985,ReLU,Tanh,,,85,23,4.0,,,0.02986340834704945,2,265,0.6548959168353483,0.0008698043293279549,83.19583320617676,COMPLETE
67,0.2194773405790329,2023-09-04 11:59:16.777929,2023-09-04 11:59:18.074383,0 days 00:00:01.296454,Sigmoid,ReLU,,,96,21,15.0,,,0.011544702137791482,2,381,0.5524568985364109,0.000661030528188726,144.90501688294492,COMPLETE
68,0.19000963866710663,2023-09-04 11:59:18.074813,2023-09-04 11:59:19.784223,0 days 00:00:01.709410,ReLU,ReLU,ReLU,,79,24,5.0,14.0,,0.018158907266824353,3,286,0.7424191373333411,0.0004230615520199252,136.46230183476987,COMPLETE
69,0.3107086420059204,2023-09-04 11:59:19.784673,2023-09-04 11:59:21.265335,0 days 00:00:01.480662,Leaky,,,,82,22,,,,0.005428188236609669,1,237,0.6000621956850505,0.00047489792231635074,10155.167557198662,COMPLETE
70,0.1277710497379303,2023-09-04 11:59:21.265743,2023-09-04 11:59:22.549889,0 days 00:00:01.284146,ReLU,Leaky,,,93,23,11.0,,,0.009008786885119914,2,442,0.6636231364156566,0.00012969090786856368,60.698415950853,COMPLETE
71,0.17393355071544647,2023-09-04 11:59:22.550324,2023-09-04 11:59:24.857550,0 days 00:00:02.307226,ReLU,Leaky,,,93,23,11.0,,,0.008617167385154703,2,445,0.6603314663953636,9.901312439661735e-05,84.2719975384799,COMPLETE
72,0.13879293203353882,2023-09-04 11:59:24.857985,2023-09-04 11:59:31.470187,0 days 00:00:06.612202,ReLU,Leaky,,,11,23,10.0,,,0.005957760749766315,2,312,0.732347404437482,0.00026578171573859863,71.21921502626859,COMPLETE
73,0.1727197766304016,2023-09-04 11:59:31.470452,2023-09-04 11:59:32.395532,0 days 00:00:00.925080,ReLU,Leaky,,,33,20,10.0,,,0.005928581528230314,2,337,0.691058991260529,0.0002365380502610059,126.25148975605867,COMPLETE
74,0.1771242469549179,2023-09-04 11:59:32.395797,2023-09-04 11:59:33.034673,0 days 00:00:00.638876,ReLU,Leaky,,,40,22,7.0,,,0.007936581652821288,2,372,0.7301690340812929,0.00014218419716211208,70.51365888440931,COMPLETE
75,0.20022626221179962,2023-09-04 11:59:33.034950,2023-09-04 11:59:34.424521,0 days 00:00:01.389571,ReLU,Leaky,,,10,23,8.0,,,0.011913337640146543,2,413,0.59920170412855,0.0020084138844659234,86.72274521858462,COMPLETE
76,0.20261308550834656,2023-09-04 11:59:34.424793,2023-09-04 11:59:36.360310,0 days 00:00:01.935517,ReLU,Leaky,,,72,4,14.0,,,0.005557649113033173,2,315,0.797252810884674,0.0011147909472993215,98.73670750170682,COMPLETE
77,0.24385271966457367,2023-09-04 11:59:36.360746,2023-09-04 11:59:37.680832,0 days 00:00:01.320086,ReLU,Leaky,,,89,21,2.0,,,0.009699460069926755,2,444,0.7502899528680569,0.0002817137619762343,110.0880618428075,COMPLETE
78,0.19517561793327332,2023-09-04 11:59:37.681268,2023-09-04 11:59:39.992548,0 days 00:00:02.311280,Tanh,Leaky,,,22,22,10.0,,,0.0066867264039887995,2,266,0.5319851958440982,0.00048816688803760987,77.73804674650493,COMPLETE
79,0.1703520268201828,2023-09-04 11:59:39.993021,2023-09-04 11:59:41.168673,0 days 00:00:01.175652,ReLU,Sigmoid,,,50,23,6.0,,,0.01445809860970266,2,365,0.6722588506084434,0.0007876038143245594,101.99122828821982,COMPLETE
80,0.15820813179016113,2023-09-04 11:59:41.168930,2023-09-04 11:59:42.503303,0 days 00:00:01.334373,ReLU,Leaky,Sigmoid,,44,12,4.0,4.0,,0.0035265166155108827,3,213,0.7252383794014347,0.001317035474164859,75.62498589717981,COMPLETE
81,0.20164503157138824,2023-09-04 11:59:42.503759,2023-09-04 11:59:45.534179,0 days 00:00:03.030420,ReLU,Leaky,Sigmoid,,58,11,4.0,4.0,,0.003353162103022232,3,207,0.7013111045295729,0.001303130421951487,88.52660584785569,COMPLETE
82,0.1762792468070984,2023-09-04 11:59:45.534625,2023-09-04 11:59:47.023481,0 days 00:00:01.488856,ReLU,Leaky,Sigmoid,,77,13,5.0,10.0,,0.00816756527455852,3,312,0.7340304573312044,0.002420192038649066,88.57258739806058,COMPLETE
83,0.32277774810791016,2023-09-04 11:59:47.023765,2023-09-04 11:59:47.652006,0 days 00:00:00.628241,ReLU,Leaky,,,37,12,2.0,,,0.01159646784074184,2,249,0.6241985979547434,0.0014785844134007587,114.41441612243652,COMPLETE
84,0.22819098830223083,2023-09-04 11:59:47.652305,2023-09-04 11:59:48.362095,0 days 00:00:00.709790,ReLU,Leaky,Sigmoid,,44,11,12.0,4.0,,0.005445018638602038,3,286,0.578821306426018,0.0009171195334687895,95.42013127753076,COMPLETE
85,0.19452719390392303,2023-09-04 11:59:48.362380,2023-09-04 11:59:49.093623,0 days 00:00:00.731243,ReLU,Tanh,Sigmoid,ReLU,97,12,9.0,9.0,22.0,0.003789454077490485,4,345,0.7660734311324816,0.0018303950000516866,85.7930346402255,COMPLETE
86,0.19081324338912964,2023-09-04 11:59:49.094001,2023-09-04 11:59:51.166706,0 days 00:00:02.072705,Sigmoid,ReLU,,,11,14,8.0,,,0.02446819286420492,2,475,0.679524726087207,0.00039861272292184946,80.2116462352664,COMPLETE
87,0.1176370233297348,2023-09-04 11:59:51.166968,2023-09-04 11:59:52.155772,0 days 00:00:00.988804,ReLU,Leaky,,,85,8,4.0,,,0.009444297900179184,2,213,0.7268922891115824,0.0005985716800486505,89.23783150899041,COMPLETE
88,0.22785378992557526,2023-09-04 11:59:52.156031,2023-09-04 11:59:52.633190,0 days 00:00:00.477159,Leaky,ReLU,,,85,2,7.0,,,0.00863301855333743,2,233,0.6196706902575015,0.00018958380927297646,103.4222868460196,COMPLETE
89,0.24838081002235413,2023-09-04 11:59:52.633451,2023-09-04 11:59:53.474602,0 days 00:00:00.841151,ReLU,ReLU,,,73,4,2.0,,,0.013281744462038622,2,260,0.5581781920505202,0.000561348915823842,133.12864027632043,COMPLETE
90,0.2546350657939911,2023-09-04 11:59:53.474874,2023-09-04 11:59:53.886941,0 days 00:00:00.412067,ReLU,Sigmoid,,,86,7,5.0,,,0.01996241549070893,2,310,0.6454973605355114,0.0003337284911580914,105.92190242948986,COMPLETE
91,0.19223232567310333,2023-09-04 11:59:53.887393,2023-09-04 11:59:54.329807,0 days 00:00:00.442414,ReLU,Leaky,,,83,9,4.0,,,0.006758822813967983,2,216,0.718299100002826,0.0006938983729293697,68.42021541595459,COMPLETE
92,0.22956067323684692,2023-09-04 11:59:54.330066,2023-09-04 11:59:55.413882,0 days 00:00:01.083816,ReLU,Leaky,,,22,23,6.0,,,0.010863149392101134,2,273,0.774461779854381,0.0011496775296845382,61.79470732405379,COMPLETE
93,0.19079652428627014,2023-09-04 11:59:55.414142,2023-09-04 11:59:56.427607,0 days 00:00:01.013465,ReLU,Leaky,,,77,10,10.0,,,0.0047455432870402115,2,293,0.7172544685958172,0.00045006496160463063,73.1070559922085,COMPLETE
94,0.18814116716384888,2023-09-04 11:59:56.427906,2023-09-04 11:59:56.746888,0 days 00:00:00.318982,ReLU,Leaky,,,91,24,3.0,,,0.015689759293455903,2,191,0.6761755214985415,0.0009303200684388525,106.4920422953944,COMPLETE
95,0.24893689155578613,2023-09-04 11:59:56.747157,2023-09-04 11:59:57.441561,0 days 00:00:00.694404,ReLU,ReLU,,,66,24,4.0,,,0.009666985751653343,2,329,0.5948408131881878,0.0013339884359370303,135.71544305602117,COMPLETE
