number,value,datetime_start,datetime_complete,duration,params_activation1,params_activation2,params_activation3,params_activation4,params_batch_size,params_fl1,params_fl2,params_fl3,params_fl4,params_learning_rate,params_n_layers,params_num_epochs,params_train_size,params_weight_decay,state
209,0.2215193212032318,2023-09-03 19:00:58.736074,2023-09-03 19:01:01.142679,0 days 00:00:02.406605,Tanh,Sigmoid,,,30,24,22.0,,,0.0024373025343271118,2,100,0.7998607188762478,0.0009272388915288869,COMPLETE
210,0.20113205909729004,2023-09-03 19:01:01.142979,2023-09-03 19:01:16.661905,0 days 00:00:15.518926,Tanh,Leaky,,,4,22,21.0,,,0.0018049627221693723,2,100,0.7204230139072717,0.0004727575742107391,COMPLETE
211,0.20427821576595306,2023-09-03 19:01:16.662254,2023-09-03 19:01:23.121183,0 days 00:00:06.458929,Tanh,Leaky,,,8,23,24.0,,,0.0015742575796409155,2,100,0.6899212714950615,0.00013013159308223948,COMPLETE
212,0.19597765803337097,2023-09-03 19:01:23.121479,2023-09-03 19:01:30.090804,0 days 00:00:06.969325,Tanh,Leaky,,,8,24,23.0,,,0.001986422197817812,2,100,0.7461202885130889,0.0002467134829660846,COMPLETE
213,0.20159360766410828,2023-09-03 19:01:30.091105,2023-09-03 19:01:43.094550,0 days 00:00:13.003445,Tanh,Leaky,,,8,20,13.0,,,0.0008912715802404072,2,100,0.6955589163048427,0.0011701915355054808,COMPLETE
214,0.19314323365688324,2023-09-03 19:01:43.094854,2023-09-03 19:01:49.630116,0 days 00:00:06.535262,Tanh,Leaky,,,8,22,24.0,,,0.0015774361461790116,2,100,0.6241363831098273,0.0001754861775788525,COMPLETE
215,0.16986778378486633,2023-09-03 19:01:49.630413,2023-09-03 19:01:54.289685,0 days 00:00:04.659272,Tanh,Leaky,,,8,21,23.0,,,0.0026289558328569194,2,60,0.7585192455151056,0.0006710669949237562,COMPLETE
216,0.1892644315958023,2023-09-03 19:01:54.289988,2023-09-03 19:01:58.094992,0 days 00:00:03.805004,Tanh,Leaky,,,10,21,22.0,,,0.0029301082107684243,2,60,0.7625671282731487,0.0006329476803681474,COMPLETE
217,0.20556184649467468,2023-09-03 19:01:58.095294,2023-09-03 19:02:03.692767,0 days 00:00:05.597473,ReLU,ReLU,,,16,21,23.0,,,0.0037761640721278556,2,60,0.766533718445408,0.0007474807896127836,COMPLETE
218,0.20167531073093414,2023-09-03 19:02:03.693277,2023-09-03 19:02:12.020146,0 days 00:00:08.326869,Tanh,Leaky,Tanh,,8,20,2.0,20.0,,0.0024882810740605803,3,60,0.7207158995920396,0.0009701668462196884,COMPLETE
219,0.2304128259420395,2023-09-03 19:02:12.020456,2023-09-03 19:02:14.386879,0 days 00:00:02.366423,Tanh,Tanh,,,16,22,22.0,,,0.002319042789823159,2,60,0.7404593348312051,0.0006146377725463078,COMPLETE
220,0.4375011920928955,2023-09-03 19:02:14.387183,2023-09-03 19:02:17.515574,0 days 00:00:03.128391,Leaky,Leaky,,,12,20,23.0,,,1.3056991525791353e-05,2,60,0.7759899671896711,0.0004157981028434224,COMPLETE
221,0.2045811116695404,2023-09-03 19:02:17.515949,2023-09-03 19:02:24.055817,0 days 00:00:06.539868,Tanh,Leaky,,,8,23,24.0,,,0.0018591196026896556,2,100,0.671462363687997,0.00021874684218431634,COMPLETE
222,0.20994073152542114,2023-09-03 19:02:24.056122,2023-09-03 19:02:29.664150,0 days 00:00:05.608028,Tanh,Leaky,,,8,24,23.0,,,0.0014320582992907516,2,80,0.7159738663589434,0.0003188279156751606,COMPLETE
223,0.21174447238445282,2023-09-03 19:02:29.664458,2023-09-03 19:02:32.337105,0 days 00:00:02.672647,Tanh,Leaky,,,8,19,24.0,,,0.002969870617367854,2,40,0.6902698551677448,0.0014526135216754357,COMPLETE
224,0.1857859194278717,2023-09-03 19:02:32.337411,2023-09-03 19:02:39.631653,0 days 00:00:07.294242,Tanh,Leaky,,,8,21,22.0,,,0.0022667442398116937,2,100,0.7428985910133895,0.0008656609894767473,COMPLETE
225,0.18479447066783905,2023-09-03 19:02:39.631973,2023-09-03 19:02:47.229163,0 days 00:00:07.597190,Tanh,ReLU,,,8,22,24.0,,,0.0012312517342685217,2,100,0.7743621459770667,0.00015796429607144616,COMPLETE
226,0.1627163290977478,2023-09-03 19:02:47.229482,2023-09-03 19:02:51.397760,0 days 00:00:04.168278,Tanh,Leaky,,,16,23,23.0,,,0.0016868527476821555,2,100,0.7972738924852035,0.0020497030437570903,COMPLETE
227,0.14481870830059052,2023-09-03 19:02:51.398062,2023-09-03 19:02:55.640221,0 days 00:00:04.242159,Tanh,Leaky,,,16,23,23.0,,,0.003516544729791529,2,100,0.7957014152018519,0.0017583836565693333,COMPLETE
228,0.21864326298236847,2023-09-03 19:02:55.640530,2023-09-03 19:02:59.889381,0 days 00:00:04.248851,Sigmoid,Leaky,,,16,23,23.0,,,0.004771505257612691,2,100,0.7958190131263145,0.0017462957342393253,COMPLETE
229,0.1748780459165573,2023-09-03 19:02:59.889682,2023-09-03 19:03:04.478788,0 days 00:00:04.589106,Tanh,Leaky,Tanh,Tanh,16,23,22.0,17.0,13.0,0.003901819992972835,4,80,0.7989796326250271,0.002134328120596628,COMPLETE
230,0.13873927295207977,2023-09-03 19:03:04.479100,2023-09-03 19:03:08.459997,0 days 00:00:03.980897,Tanh,Leaky,,,16,24,22.0,,,0.006959218127634452,2,100,0.7660495571878956,0.0014567346488852009,COMPLETE
231,0.19464851915836334,2023-09-03 19:03:08.460291,2023-09-03 19:03:12.419968,0 days 00:00:03.959677,Tanh,Leaky,,,16,24,22.0,,,0.007585987467866397,2,100,0.7682143263195991,0.002605222029807411,COMPLETE
232,0.19092246890068054,2023-09-03 19:03:12.420276,2023-09-03 19:03:16.448424,0 days 00:00:04.028148,Tanh,Leaky,,,16,24,21.0,,,0.011917319868467316,2,100,0.7684808591578356,0.0013680936796385186,COMPLETE
233,0.19359028339385986,2023-09-03 19:03:16.448727,2023-09-03 19:03:20.205862,0 days 00:00:03.757135,Tanh,Leaky,,,16,24,22.0,,,0.003475463970455152,2,100,0.7359108313537565,0.001831238649519745,COMPLETE
234,0.1694568395614624,2023-09-03 19:03:20.206177,2023-09-03 19:03:24.310500,0 days 00:00:04.104323,Tanh,Leaky,,,16,23,23.0,,,0.005776376551932089,2,100,0.7951417496966482,0.0028884062606737613,COMPLETE
235,0.23690734803676605,2023-09-03 19:03:24.310789,2023-09-03 19:03:27.454735,0 days 00:00:03.143946,Tanh,,,,16,23,,,,0.007284039053523751,1,100,0.7998869196002341,0.0021783484028202274,COMPLETE
236,0.2067912071943283,2023-09-03 19:03:27.455057,2023-09-03 19:03:31.369730,0 days 00:00:03.914673,Tanh,Leaky,,,16,23,23.0,,,0.009344600541594335,2,100,0.7679828477310652,0.0031891898795663055,COMPLETE
237,0.18316014111042023,2023-09-03 19:03:31.370029,2023-09-03 19:03:33.586212,0 days 00:00:02.216183,Tanh,Leaky,,,16,23,23.0,,,0.0045787436109225805,2,60,0.7527118572798216,0.0021694970773614465,COMPLETE
238,0.20681241154670715,2023-09-03 19:03:33.586512,2023-09-03 19:03:37.415088,0 days 00:00:03.828576,Leaky,Leaky,,,16,24,23.0,,,0.006482794001606874,2,100,0.7951424435313378,0.0025994280121883276,COMPLETE
239,0.2960250973701477,2023-09-03 19:03:37.415414,2023-09-03 19:03:41.277999,0 days 00:00:03.862585,Tanh,Sigmoid,,,16,24,22.0,,,7.533637314228432e-05,2,100,0.7503639467848628,0.004117212759506066,COMPLETE
240,0.17360331118106842,2023-09-03 19:03:41.278317,2023-09-03 19:03:45.037256,0 days 00:00:03.758939,ReLU,Leaky,,,16,23,21.0,,,0.0059424452391291195,2,100,0.7197926132811721,0.0015318039268293379,COMPLETE
241,0.16669020056724548,2023-09-03 19:03:45.037571,2023-09-03 19:03:49.035288,0 days 00:00:03.997717,ReLU,Leaky,,,16,23,15.0,,,0.0061901897895096465,2,100,0.7991126495129551,0.0015764566602920014,COMPLETE
242,0.22040271759033203,2023-09-03 19:03:49.035592,2023-09-03 19:03:51.326352,0 days 00:00:02.290760,ReLU,Leaky,,,16,23,20.0,,,0.006404612241114591,2,100,0.45867750582687195,0.0015266075464970487,COMPLETE
243,0.17524154484272003,2023-09-03 19:03:51.326651,2023-09-03 19:03:55.056644,0 days 00:00:03.729993,ReLU,Leaky,,,16,24,15.0,,,0.005716948371600483,2,100,0.7774154218384665,0.001231245363924281,COMPLETE
244,0.2024596780538559,2023-09-03 19:03:55.056959,2023-09-03 19:03:56.811401,0 days 00:00:01.754442,ReLU,Leaky,,,16,4,16.0,,,0.006608094412014781,2,100,0.35987292712871605,0.0019204189822498276,COMPLETE
245,0.1902003139257431,2023-09-03 19:03:56.811704,2023-09-03 19:04:01.554810,0 days 00:00:04.743106,ReLU,Leaky,ReLU,,16,23,15.0,5.0,,0.008394768087718637,3,100,0.797884158794593,0.001532480280105402,COMPLETE
246,0.18501690030097961,2023-09-03 19:04:01.555118,2023-09-03 19:04:06.873624,0 days 00:00:05.318506,ReLU,Leaky,,,10,22,23.0,,,0.0052242131115208795,2,100,0.7172518861214312,0.0011302601915272883,COMPLETE
247,0.21655772626399994,2023-09-03 19:04:06.873922,2023-09-03 19:04:08.430938,0 days 00:00:01.557016,Tanh,Leaky,,,16,22,11.0,,,0.006134286341453703,2,80,0.3973896714283446,0.0017299515536360022,COMPLETE
248,0.20379124581813812,2023-09-03 19:04:08.431239,2023-09-03 19:04:33.007536,0 days 00:00:24.576297,Leaky,Leaky,,,2,23,14.0,,,0.00515909136289512,2,100,0.7385726797217493,0.0024358007739904543,COMPLETE
249,0.1743449568748474,2023-09-03 19:04:33.007844,2023-09-03 19:04:35.227688,0 days 00:00:02.219844,ReLU,Leaky,,,30,24,21.0,,,0.007896068310577395,2,100,0.7654653939478839,0.0013785133075823108,COMPLETE
250,0.1989794820547104,2023-09-03 19:04:35.227992,2023-09-03 19:04:38.163900,0 days 00:00:02.935908,ReLU,Sigmoid,,,16,24,18.0,,,0.004318911149889114,2,100,0.5957650146576974,0.0010499630587545053,COMPLETE
251,0.21248608827590942,2023-09-03 19:04:38.164209,2023-09-03 19:04:50.624423,0 days 00:00:12.460214,ReLU,Leaky,,,4,23,16.0,,,0.011171434624736597,2,100,0.7103994927711488,0.001949137513058781,COMPLETE
252,0.17041310667991638,2023-09-03 19:04:50.624712,2023-09-03 19:04:54.640813,0 days 00:00:04.016101,ReLU,Leaky,,,16,22,10.0,,,0.0026275255786724636,2,100,0.7968222065067919,0.001290730339888654,COMPLETE
253,0.16405342519283295,2023-09-03 19:04:54.641125,2023-09-03 19:04:58.503809,0 days 00:00:03.862684,ReLU,Leaky,,,12,22,13.0,,,0.0028051356541310564,2,60,0.7957664652285962,0.0010352210831006518,COMPLETE
254,0.17980536818504333,2023-09-03 19:04:58.504314,2023-09-03 19:05:01.846581,0 days 00:00:03.342267,ReLU,Leaky,,,12,7,10.0,,,0.002904605846688049,2,60,0.779456765960423,0.0009466740327867723,COMPLETE
255,0.14799031615257263,2023-09-03 19:05:01.847073,2023-09-03 19:05:07.271656,0 days 00:00:05.424583,ReLU,Leaky,Leaky,,12,22,8.0,8.0,,0.003400322438695647,3,60,0.7943220997136325,0.0011657008733886149,COMPLETE
256,0.1812724471092224,2023-09-03 19:05:07.271977,2023-09-03 19:05:10.814033,0 days 00:00:03.542056,ReLU,Leaky,Leaky,,12,22,9.0,8.0,,0.003483177064157018,3,60,0.796972322437547,0.0030171213856963327,COMPLETE
257,0.1876360923051834,2023-09-03 19:05:10.814340,2023-09-03 19:05:14.688564,0 days 00:00:03.874224,ReLU,Leaky,Leaky,,12,21,7.0,9.0,,0.0026952359160604253,3,60,0.7714610942487597,0.0011564776612405683,COMPLETE
258,0.20573709905147552,2023-09-03 19:05:14.688870,2023-09-03 19:05:17.016161,0 days 00:00:02.327291,ReLU,,,,12,22,,,,0.0033472570053335845,1,60,0.7989946371849267,0.0005638692189636455,COMPLETE
259,0.21417921781539917,2023-09-03 19:05:17.016470,2023-09-03 19:05:20.564091,0 days 00:00:03.547621,ReLU,Leaky,Leaky,,12,22,12.0,1.0,,0.0026248669787217187,3,60,0.7546620613588274,0.0007156977230706435,COMPLETE
260,0.1611069291830063,2023-09-03 19:05:20.564395,2023-09-03 19:05:24.502051,0 days 00:00:03.937656,ReLU,Leaky,Leaky,,12,21,9.0,12.0,,0.0040842565197244446,3,60,0.7995182604283348,2.1695559475191142e-05,COMPLETE
261,0.1826125830411911,2023-09-03 19:05:24.502385,2023-09-03 19:05:28.707498,0 days 00:00:04.205113,ReLU,Leaky,Leaky,,12,21,8.0,12.0,,0.004674463845733284,3,60,0.7557630295237632,0.00045161128806202626,COMPLETE
262,0.2000175565481186,2023-09-03 19:05:28.707838,2023-09-03 19:05:32.330722,0 days 00:00:03.622884,ReLU,Sigmoid,Leaky,,12,21,12.0,10.0,,0.004060488450827241,3,60,0.7989788491208017,3.343461294795298e-05,COMPLETE
263,0.21544863283634186,2023-09-03 19:05:32.331056,2023-09-03 19:05:33.702031,0 days 00:00:01.370975,ReLU,Leaky,Leaky,,12,22,5.0,7.0,,0.0038967066747379654,3,60,0.2627816352057615,0.00012649117824719056,COMPLETE
264,0.18662144243717194,2023-09-03 19:05:33.702559,2023-09-03 19:05:44.220617,0 days 00:00:10.518058,ReLU,Tanh,Leaky,,12,21,9.0,14.0,,0.003318415737961391,3,60,0.7504690825533973,0.0012453823619843773,COMPLETE
265,0.18034227192401886,2023-09-03 19:05:44.221149,2023-09-03 19:05:51.580446,0 days 00:00:07.359297,ReLU,Leaky,Leaky,,12,22,10.0,11.0,,0.0021387856067066934,3,60,0.5085408575183528,3.1639382663271634e-05,COMPLETE
266,0.20621176064014435,2023-09-03 19:05:51.580969,2023-09-03 19:05:59.576615,0 days 00:00:07.995646,ReLU,Leaky,Leaky,,12,21,7.0,9.0,,0.0017727120916495823,3,60,0.5580389458656547,2.6517296568521718e-05,COMPLETE
267,0.20915956795215607,2023-09-03 19:05:59.577156,2023-09-03 19:06:09.843024,0 days 00:00:10.265868,ReLU,Leaky,Tanh,,12,22,8.0,5.0,,0.003149977364698167,3,60,0.7681222277672525,1.3237057627777335e-05,COMPLETE
268,0.20715367794036865,2023-09-03 19:06:09.843332,2023-09-03 19:06:14.104844,0 days 00:00:04.261512,ReLU,Leaky,Leaky,,10,22,11.0,12.0,,0.002589154090756336,3,60,0.7975060451790189,0.0005157605902290277,COMPLETE
269,0.20069724321365356,2023-09-03 19:06:14.105165,2023-09-03 19:06:32.256570,0 days 00:00:18.151405,ReLU,Leaky,Leaky,,2,18,6.0,14.0,,0.005242818375794325,3,60,0.7366534688495767,4.1203930204759796e-05,COMPLETE
270,0.20329523086547852,2023-09-03 19:06:32.256881,2023-09-03 19:06:36.369059,0 days 00:00:04.112178,Leaky,Sigmoid,Tanh,,12,21,14.0,10.0,,0.0004785526215010918,3,60,0.7640900693583351,5.171716766952826e-05,COMPLETE
271,0.2079554945230484,2023-09-03 19:06:36.369422,2023-09-03 19:06:37.307473,0 days 00:00:00.938051,ReLU,Leaky,,,30,20,7.0,,,0.003751800843097193,2,40,0.799977892185893,1.1405098418634689e-05,COMPLETE
272,0.1779336780309677,2023-09-03 19:06:37.307777,2023-09-03 19:06:45.003422,0 days 00:00:07.695645,ReLU,Leaky,,,4,16,10.0,,,0.0020201985297069723,2,60,0.7372602289584412,5.3521788249640397e-05,COMPLETE
273,0.17780886590480804,2023-09-03 19:06:45.003749,2023-09-03 19:06:55.922230,0 days 00:00:10.918481,ReLU,Leaky,,,10,22,9.0,,,0.0024188578314838075,2,100,0.7650677554113978,2.4869021582253544e-05,COMPLETE
274,0.18289333581924438,2023-09-03 19:06:55.922596,2023-09-03 19:07:00.822153,0 days 00:00:04.899557,Sigmoid,Leaky,,,12,22,13.0,,,0.0030857575501936803,2,100,0.7427219683961162,2.2114604620700164e-05,COMPLETE
275,0.23862656950950623,2023-09-03 19:07:00.822479,2023-09-03 19:07:01.185701,0 days 00:00:00.363222,Leaky,Leaky,,,16,21,8.0,,,0.004306917091735893,2,60,0.10782630217453074,1.807936229870125e-05,COMPLETE
276,0.23089417815208435,2023-09-03 19:07:01.186012,2023-09-03 19:07:02.057688,0 days 00:00:00.871676,Tanh,Leaky,,,16,23,9.0,,,0.0017076821959122583,2,100,0.16455591190380606,0.0008033652727177253,COMPLETE
277,0.19059497117996216,2023-09-03 19:07:02.058013,2023-09-03 19:07:05.521087,0 days 00:00:03.463074,ReLU,Sigmoid,,,16,20,22.0,,,0.0021303605175313906,2,100,0.7056441231089179,7.207661503731205e-05,COMPLETE
278,0.22369730472564697,2023-09-03 19:07:05.521405,2023-09-03 19:07:07.658819,0 days 00:00:02.137414,Tanh,Leaky,,,12,19,9.0,,,0.002697136292995691,2,100,0.3346469120966815,1.4149798819886464e-05,COMPLETE
279,0.21091324090957642,2023-09-03 19:07:07.659174,2023-09-03 19:07:14.256077,0 days 00:00:06.596903,Tanh,Leaky,Sigmoid,,16,21,5.0,16.0,,0.0007357100097770024,3,100,0.5741976234420599,0.0010355078659907303,COMPLETE
280,0.19748541712760925,2023-09-03 19:07:14.256623,2023-09-03 19:07:45.600729,0 days 00:00:31.344106,Leaky,Leaky,,,2,22,10.0,,,0.0038506877139319376,2,60,0.5433319341646408,0.00039691604196119275,COMPLETE
281,0.18786928057670593,2023-09-03 19:07:45.601030,2023-09-03 19:07:49.406951,0 days 00:00:03.805921,Tanh,Leaky,,,16,23,14.0,,,0.0017497542716177605,2,100,0.7636413204528179,1.0066069854496146e-05,COMPLETE
282,0.2036387026309967,2023-09-03 19:07:49.407269,2023-09-03 19:07:52.874189,0 days 00:00:03.466920,Tanh,Leaky,,,10,23,11.0,,,0.0049303407857605105,2,100,0.4441458209413666,4.199304873010735e-05,COMPLETE
283,0.19652868807315826,2023-09-03 19:07:52.874488,2023-09-03 19:07:53.750819,0 days 00:00:00.876331,ReLU,Leaky,,,30,10,22.0,,,0.0032166749084055687,2,40,0.7275068354722647,0.0006517819740433642,COMPLETE
284,0.22137367725372314,2023-09-03 19:07:53.751137,2023-09-03 19:07:58.705758,0 days 00:00:04.954621,Tanh,Tanh,,,12,22,13.0,,,0.0024246095505564723,2,100,0.7732346342019311,0.0022815372134659005,COMPLETE
285,0.22855156660079956,2023-09-03 19:07:58.706057,2023-09-03 19:08:07.286053,0 days 00:00:08.579996,Tanh,,,,4,21,,,,0.0002490417496999767,1,100,0.6498665500655452,0.0016778155866805243,COMPLETE
286,0.2995436489582062,2023-09-03 19:08:07.286348,2023-09-03 19:08:10.188296,0 days 00:00:02.901948,Tanh,Sigmoid,ReLU,,16,22,17.0,8.0,,0.001364568957984648,3,60,0.7985913349520891,0.016919818709206537,COMPLETE
287,0.1935090571641922,2023-09-03 19:08:10.188597,2023-09-03 19:08:16.597951,0 days 00:00:06.409354,Sigmoid,ReLU,,,16,23,6.0,,,0.001973307576888123,2,100,0.6949577028453898,1.8789190724484138e-05,COMPLETE
288,0.18265102803707123,2023-09-03 19:08:16.598465,2023-09-03 19:08:23.665922,0 days 00:00:07.067457,ReLU,Leaky,,,16,19,23.0,,,0.002782665175336888,2,100,0.46259016597675023,0.0008419229568443446,COMPLETE
289,0.209689199924469,2023-09-03 19:08:23.666454,2023-09-03 19:08:38.087123,0 days 00:00:14.420669,Tanh,Leaky,,,12,20,8.0,,,0.004280499370755258,2,100,0.7392286792724484,0.0012488645062301476,COMPLETE
290,0.20787276327610016,2023-09-03 19:08:38.087646,2023-09-03 19:08:47.133028,0 days 00:00:09.045382,Leaky,Leaky,,,10,23,4.0,,,0.0015531568093354428,2,100,0.3879604862048645,0.00015278654333007654,COMPLETE
291,0.22344502806663513,2023-09-03 19:08:47.133559,2023-09-03 19:08:54.007449,0 days 00:00:06.873890,Tanh,Leaky,,,16,21,23.0,,,0.08932563014806878,2,60,0.7642013610863468,0.00033331387311408414,COMPLETE
292,0.19242987036705017,2023-09-03 19:08:54.007985,2023-09-03 19:09:39.081284,0 days 00:00:45.073299,Tanh,ReLU,Sigmoid,,2,23,22.0,4.0,,0.0022559892290213513,3,100,0.7995328549079812,0.0005169488263026813,COMPLETE
293,0.1937011033296585,2023-09-03 19:09:39.081590,2023-09-03 19:09:42.508831,0 days 00:00:03.427241,ReLU,Leaky,,,16,22,24.0,,,0.0005365561099427177,2,100,0.7105924735561372,0.0006610820651629022,COMPLETE
294,0.2050558179616928,2023-09-03 19:09:42.509131,2023-09-03 19:09:46.168856,0 days 00:00:03.659725,Tanh,Leaky,,,12,18,23.0,,,0.007374783992941156,2,80,0.740152823415506,0.0001046380413169246,COMPLETE
295,0.200532004237175,2023-09-03 19:09:46.169159,2023-09-03 19:09:49.377483,0 days 00:00:03.208324,Tanh,Sigmoid,,,16,20,22.0,,,0.005680335885863338,2,100,0.6634968742835282,2.917732048223271e-05,COMPLETE
296,0.2013593465089798,2023-09-03 19:09:49.377782,2023-09-03 19:09:50.982310,0 days 00:00:01.604528,Tanh,Leaky,Tanh,,30,24,24.0,20.0,,0.0035216508763167855,3,60,0.7701737256663603,0.0009773241130425368,COMPLETE
297,0.2359365075826645,2023-09-03 19:09:50.982620,2023-09-03 19:10:04.560901,0 days 00:00:13.578281,ReLU,ReLU,,,4,22,16.0,,,0.0011809918584881802,2,100,0.7994494395772993,0.001277254660016817,COMPLETE
298,0.27775487303733826,2023-09-03 19:10:04.561221,2023-09-03 19:10:09.475352,0 days 00:00:04.914131,Tanh,Leaky,Leaky,Leaky,16,2,23.0,7.0,6.0,0.0029733002316454965,4,100,0.7203913255483636,0.0018374619065516262,COMPLETE
299,0.21889707446098328,2023-09-03 19:10:09.475674,2023-09-03 19:10:12.137332,0 days 00:00:02.661658,Leaky,Leaky,,,12,17,21.0,,,0.0018512476857730103,2,100,0.4259702082824753,0.00012796355007030407,COMPLETE
300,0.1842467337846756,2023-09-03 19:10:12.137657,2023-09-03 19:10:14.902335,0 days 00:00:02.764678,Tanh,Leaky,,,10,23,15.0,,,0.0024868306750814658,2,60,0.6275618605715146,0.0001896689519374666,COMPLETE
301,0.2239157259464264,2023-09-03 19:10:14.902648,2023-09-03 19:10:18.916465,0 days 00:00:04.013817,ReLU,Leaky,Sigmoid,,16,21,7.0,23.0,,0.00042314306303301404,3,100,0.6811982467493194,4.2730174196784987e-05,COMPLETE
302,0.18627126514911652,2023-09-03 19:10:18.916779,2023-09-03 19:10:22.644712,0 days 00:00:03.727933,Tanh,ReLU,,,16,24,22.0,,,0.001511642329868237,2,100,0.7665665929500026,0.0007677806817857921,COMPLETE
303,0.17817558348178864,2023-09-03 19:10:22.645057,2023-09-03 19:10:30.705446,0 days 00:00:08.060389,Tanh,Leaky,,,12,21,13.0,,,0.003619571683493485,2,100,0.7414602472098565,7.858288270172161e-05,COMPLETE
304,0.22571730613708496,2023-09-03 19:10:30.705778,2023-09-03 19:10:32.988407,0 days 00:00:02.282629,Tanh,Sigmoid,,,16,23,24.0,,,0.0007846978366345733,2,80,0.5865272723520583,0.002856769166914045,COMPLETE
305,0.2217026799917221,2023-09-03 19:10:32.988711,2023-09-03 19:10:40.276441,0 days 00:00:07.287730,ReLU,Leaky,,,2,22,23.0,,,0.005033889660485883,2,60,0.3098034135305296,1.4214383841689366e-05,COMPLETE
306,0.17682495713233948,2023-09-03 19:10:40.276971,2023-09-03 19:10:50.282322,0 days 00:00:10.005351,Tanh,Leaky,,,16,22,22.0,,,0.009002035473062423,2,100,0.7018820903710058,0.0010253693611706417,COMPLETE
307,0.19498462975025177,2023-09-03 19:10:50.282821,2023-09-03 19:10:55.084673,0 days 00:00:04.801852,Tanh,,,,12,20,,,,0.002158438575103796,1,100,0.7710510184527429,0.0006114295000089167,COMPLETE
308,0.2756955325603485,2023-09-03 19:10:55.084976,2023-09-03 19:10:56.317239,0 days 00:00:01.232263,Leaky,ReLU,,,10,24,21.0,,,0.00014168074635819458,2,40,0.40034048192042565,0.002240449575389826,COMPLETE
309,0.2142820954322815,2023-09-03 19:10:56.317538,2023-09-03 19:10:58.045686,0 days 00:00:01.728148,ReLU,Tanh,Leaky,,30,23,23.0,6.0,,0.013212672445012829,3,100,0.4747358074235391,0.0015239092547627395,COMPLETE
310,0.20570679008960724,2023-09-03 19:10:58.046000,2023-09-03 19:11:01.611408,0 days 00:00:03.565408,Tanh,Leaky,,,16,22,22.0,,,0.0029607884414504754,2,100,0.7263620984186364,3.8671489323041683e-05,COMPLETE
311,0.17850027978420258,2023-09-03 19:11:01.611712,2023-09-03 19:11:06.982106,0 days 00:00:05.370394,Tanh,Leaky,,,4,21,23.0,,,0.004281690346637892,2,60,0.50058782221159,0.0002749371443627641,COMPLETE
312,0.2133139967918396,2023-09-03 19:11:06.982407,2023-09-03 19:11:09.122027,0 days 00:00:02.139620,Sigmoid,Leaky,,,16,23,11.0,,,0.0019334846268965922,2,80,0.539652504383651,0.00045345336377058964,COMPLETE
313,0.17620892822742462,2023-09-03 19:11:09.122332,2023-09-03 19:11:14.132846,0 days 00:00:05.010514,Tanh,Leaky,,,12,24,24.0,,,0.0025810086294854413,2,100,0.7738193633898761,0.0002051745677469009,COMPLETE
