number,value,datetime_start,datetime_complete,duration,params_activation1,params_activation2,params_activation3,params_activation4,params_batch_size,params_fl1,params_fl2,params_fl3,params_fl4,params_learning_rate,params_n_layers,params_num_epochs,params_train_size,params_weight_decay,user_attrs_mre,state
466,0.1945476233959198,2023-09-04 12:05:01.435232,2023-09-04 12:05:02.827121,0 days 00:00:01.391889,Sigmoid,Sigmoid,Leaky,,46,24,7.0,7.0,,0.011114009963430862,3,242,0.7076963753552957,0.00019202454625760401,81.72678485669587,COMPLETE
467,0.21165256202220917,2023-09-04 12:05:02.827477,2023-09-04 12:05:03.480653,0 days 00:00:00.653176,Tanh,ReLU,Leaky,,60,24,10.0,10.0,,0.017762656998195094,3,137,0.6258034153138677,9.865771344472329e-05,112.87550776055518,COMPLETE
468,0.2227897047996521,2023-09-04 12:05:03.481020,2023-09-04 12:05:04.825802,0 days 00:00:01.344782,Tanh,ReLU,Sigmoid,,49,23,6.0,9.0,,0.0016691804650647685,3,230,0.46456846655456785,6.382192076648362e-05,95.47657921832541,COMPLETE
469,0.2496463507413864,2023-09-04 12:05:04.826160,2023-09-04 12:05:05.001197,0 days 00:00:00.175037,Tanh,Sigmoid,Sigmoid,Leaky,98,22,8.0,8.0,22.0,0.008255608765552352,4,159,0.17107710828875955,0.00024392771684124664,158.64060850401182,COMPLETE
470,0.2163926512002945,2023-09-04 12:05:05.001600,2023-09-04 12:05:05.412706,0 days 00:00:00.411106,Leaky,ReLU,Sigmoid,,55,24,9.0,7.0,,0.02568750045736317,3,220,0.5254361722823733,0.0002940280187371893,111.63947830200195,COMPLETE
471,0.22679223120212555,2023-09-04 12:05:05.413068,2023-09-04 12:05:06.003130,0 days 00:00:00.590062,Tanh,Tanh,,,52,23,10.0,,,0.013803866792704794,2,253,0.7499892950168536,0.0012054545900044462,89.36233901977539,COMPLETE
472,0.3192167580127716,2023-09-04 12:05:06.003467,2023-09-04 12:05:06.230648,0 days 00:00:00.227181,ReLU,ReLU,Leaky,,94,23,11.0,4.0,,0.02092618805678921,3,113,0.1834839199215527,0.0954058746813331,119.92390550885882,COMPLETE
473,0.24547390639781952,2023-09-04 12:05:06.231000,2023-09-04 12:05:06.741213,0 days 00:00:00.510213,Tanh,Sigmoid,Sigmoid,,48,22,9.0,8.0,,0.016902066252544524,3,261,0.7275322481556761,1.232808596865656e-05,96.36984810462364,COMPLETE
474,0.2273460477590561,2023-09-04 12:05:06.741565,2023-09-04 12:05:07.122711,0 days 00:00:00.381146,ReLU,Leaky,Sigmoid,,57,24,8.0,1.0,,0.029670355198572116,3,247,0.7990723948739658,0.0001415555092442935,532.9327041625977,COMPLETE
475,0.19873882830142975,2023-09-04 12:05:07.123087,2023-09-04 12:05:07.736737,0 days 00:00:00.613650,Tanh,ReLU,ReLU,,51,21,12.0,10.0,,0.01024358408584915,3,123,0.3417749851034521,4.520011653290883e-05,94.11478805541992,COMPLETE
476,0.16052229702472687,2023-09-04 12:05:07.737180,2023-09-04 12:05:08.411721,0 days 00:00:00.674541,ReLU,ReLU,Sigmoid,,54,23,10.0,3.0,,0.013062612933893422,3,268,0.681879813518777,7.28239199080915e-05,118.21234439668201,COMPLETE
477,0.2302035242319107,2023-09-04 12:05:08.412090,2023-09-04 12:05:08.900593,0 days 00:00:00.488503,ReLU,Sigmoid,Sigmoid,,75,23,20.0,3.0,,0.012213243396716608,3,271,0.4825374243462489,0.0006561708096628669,101.09333587646485,COMPLETE
478,0.19097119569778442,2023-09-04 12:05:08.900948,2023-09-04 12:05:09.436539,0 days 00:00:00.535591,Tanh,ReLU,Tanh,,53,24,9.0,2.0,,0.022113335209101723,3,287,0.6787279805240481,7.242799356446977e-05,84.79806187947591,COMPLETE
479,0.2238379418849945,2023-09-04 12:05:09.436889,2023-09-04 12:05:12.710747,0 days 00:00:03.273858,ReLU,ReLU,Leaky,,43,23,7.0,4.0,,0.00022892862460700968,3,264,0.6003088068612268,9.332352845216355e-05,100.89249420166016,COMPLETE
480,0.19482778012752533,2023-09-04 12:05:12.711112,2023-09-04 12:05:13.176357,0 days 00:00:00.465245,ReLU,Sigmoid,Sigmoid,,54,23,8.0,3.0,,0.006883928974811218,3,259,0.3249659023756367,7.920457280747322e-05,166.16578047616142,COMPLETE
481,0.2165934145450592,2023-09-04 12:05:13.176718,2023-09-04 12:05:13.441334,0 days 00:00:00.264616,Tanh,ReLU,Sigmoid,,50,24,10.0,2.0,,0.009213522313578429,3,277,0.2121834263464491,7.045286767132652e-05,90.74196090698243,COMPLETE
482,0.2175203114748001,2023-09-04 12:05:13.441691,2023-09-04 12:05:13.942482,0 days 00:00:00.500791,ReLU,Tanh,Sigmoid,,52,11,7.0,3.0,,0.04189271735151002,3,254,0.7682069696407515,0.00011504937241848555,126.83399359385173,COMPLETE
483,0.2297528237104416,2023-09-04 12:05:13.942995,2023-09-04 12:05:15.492983,0 days 00:00:01.549988,Sigmoid,ReLU,Sigmoid,ReLU,46,24,6.0,4.0,19.0,0.003030039000091101,4,267,0.7488419819507726,5.1323956611964335e-05,126.8280257022742,COMPLETE
484,0.18745067715644836,2023-09-04 12:05:15.493462,2023-09-04 12:05:17.236426,0 days 00:00:01.742964,Tanh,Sigmoid,Leaky,,39,23,9.0,1.0,,0.005247054643592019,3,242,0.7256139169767685,8.984966341526954e-05,88.51402797469173,COMPLETE
485,0.23443135619163513,2023-09-04 12:05:17.236923,2023-09-04 12:05:21.051852,0 days 00:00:03.814929,ReLU,ReLU,Sigmoid,,49,24,10.0,18.0,,0.0003351742293942541,3,282,0.773812853972279,3.639470055914024e-05,122.60375773613089,COMPLETE
486,0.26246291399002075,2023-09-04 12:05:21.052211,2023-09-04 12:05:21.255602,0 days 00:00:00.203391,ReLU,ReLU,Sigmoid,,99,23,11.0,21.0,,0.01751237838302606,3,251,0.16378670106527574,0.0007454280693331732,115.09396913316515,COMPLETE
487,0.21228542923927307,2023-09-04 12:05:21.255971,2023-09-04 12:05:21.800363,0 days 00:00:00.544392,Tanh,Leaky,Sigmoid,,54,22,8.0,14.0,,0.013215444505704372,3,211,0.5856404169844688,6.501916648767778e-05,85.11993325723184,COMPLETE
488,0.19945760071277618,2023-09-04 12:05:21.800723,2023-09-04 12:05:22.466753,0 days 00:00:00.666030,ReLU,Sigmoid,Leaky,,51,9,19.0,4.0,,0.026131389777124217,3,267,0.4986889338251581,1.4488227118980618e-05,118.90570543397148,COMPLETE
489,0.207631915807724,2023-09-04 12:05:22.467108,2023-09-04 12:05:23.746139,0 days 00:00:01.279031,ReLU,ReLU,Sigmoid,,55,24,10.0,9.0,,0.002072128352727101,3,235,0.6453831670837492,2.8045260905181997e-05,103.07739015467027,COMPLETE
490,0.20325055718421936,2023-09-04 12:05:23.746502,2023-09-04 12:05:24.134177,0 days 00:00:00.387675,Tanh,ReLU,ReLU,,48,23,13.0,3.0,,0.03243439133358713,3,258,0.36065512513155706,0.00010496889456327455,87.89802511114823,COMPLETE
491,0.18349528312683105,2023-09-04 12:05:24.134528,2023-09-04 12:05:24.728437,0 days 00:00:00.593909,ReLU,Tanh,Sigmoid,,53,22,9.0,16.0,,0.019780702077204965,3,292,0.6973540300489343,1.679877922577075e-05,72.87978789385627,COMPLETE
492,0.2054625302553177,2023-09-04 12:05:24.728798,2023-09-04 12:05:25.156610,0 days 00:00:00.427812,Tanh,Sigmoid,Sigmoid,,50,24,7.0,5.0,,0.0653093847730187,3,272,0.46380201771114754,0.0004990101876523342,119.88684844970703,COMPLETE
493,0.15679596364498138,2023-09-04 12:05:25.156960,2023-09-04 12:05:25.836840,0 days 00:00:00.679880,ReLU,ReLU,Sigmoid,,56,21,6.0,8.0,,0.011500713639703774,3,245,0.797870121728358,2.0413034879356523e-05,79.76709407084697,COMPLETE
494,0.19407114386558533,2023-09-04 12:05:25.837192,2023-09-04 12:05:26.411877,0 days 00:00:00.574685,Leaky,ReLU,Leaky,,58,21,6.0,8.0,,0.049785755808771044,3,244,0.42284529052817144,1.9900035922935473e-05,350.8538444782126,COMPLETE
495,0.24270117282867432,2023-09-04 12:05:26.412232,2023-09-04 12:05:26.660633,0 days 00:00:00.248401,ReLU,ReLU,Sigmoid,,56,21,6.0,9.0,,0.011310126514092715,3,228,0.1804168315226587,2.2192301880611668e-05,150.12005432792333,COMPLETE
496,0.1758420467376709,2023-09-04 12:05:26.660979,2023-09-04 12:05:27.080844,0 days 00:00:00.419865,Tanh,Sigmoid,Sigmoid,,55,24,5.0,8.0,,0.014982398564247342,3,239,0.7708183074238936,2.988136577964672e-05,93.7611382224343,COMPLETE
497,0.2150804102420807,2023-09-04 12:05:27.081181,2023-09-04 12:05:27.720214,0 days 00:00:00.639033,ReLU,ReLU,Sigmoid,,96,21,11.0,8.0,,0.015598377046018182,3,248,0.7984415461291989,1.88100754198208e-05,80.4741296573561,COMPLETE
498,0.22764481604099274,2023-09-04 12:05:27.720580,2023-09-04 12:05:27.909117,0 days 00:00:00.188537,ReLU,,,,56,23,,,,0.011425111412348017,1,258,0.23373990373571313,2.4426001537459284e-05,141.70018272399903,COMPLETE
499,0.18004022538661957,2023-09-04 12:05:27.909445,2023-09-04 12:05:29.091570,0 days 00:00:01.182125,Tanh,ReLU,Sigmoid,,31,20,6.0,9.0,,0.02111902515314821,3,250,0.738511543186781,1.3102139832637186e-05,1669.3993308327415,COMPLETE
