number,value,datetime_start,datetime_complete,duration,params_activation1,params_activation2,params_activation3,params_activation4,params_batch_size,params_fl1,params_fl2,params_fl3,params_fl4,params_learning_rate,params_n_layers,params_num_epochs,params_train_size,params_weight_decay,state
314,0.2070789784193039,2023-09-03 19:11:14.133166,2023-09-03 19:11:21.776637,0 days 00:00:07.643471,ReLU,Sigmoid,,,16,20,9.0,,,0.0010991492665325736,2,100,0.7995919034650556,0.003410897406479162,COMPLETE
315,0.186306431889534,2023-09-03 19:11:21.777148,2023-09-03 19:11:27.745711,0 days 00:00:05.968563,Tanh,ReLU,Tanh,,16,22,22.0,16.0,,0.0016969310152154383,3,100,0.742552715760177,0.0008506018990342969,COMPLETE
316,0.18933714926242828,2023-09-03 19:11:27.746021,2023-09-03 19:11:30.350522,0 days 00:00:02.604501,Tanh,Leaky,,,12,24,23.0,,,0.0069276681137082526,2,60,0.668946485023676,0.000347009795490936,COMPLETE
317,0.1767844408750534,2023-09-03 19:11:30.350856,2023-09-03 19:11:37.418043,0 days 00:00:07.067187,ReLU,Leaky,,,10,23,21.0,,,0.003394655798458478,2,100,0.7079067917731547,0.001221263850604033,COMPLETE
318,0.19584809243679047,2023-09-03 19:11:37.418349,2023-09-03 19:11:39.720645,0 days 00:00:02.302296,Leaky,Leaky,,,16,19,8.0,,,0.0022401827614914106,2,100,0.4818531346255215,6.620712302081874e-05,COMPLETE
319,0.18825171887874603,2023-09-03 19:11:39.720956,2023-09-03 19:11:45.565754,0 days 00:00:05.844798,Tanh,Leaky,,,16,21,17.0,,,0.001331808638895835,2,100,0.7678538790021103,5.3686822316468215e-05,COMPLETE
320,0.2224111109972,2023-09-03 19:11:45.566274,2023-09-03 19:11:49.795338,0 days 00:00:04.229064,Tanh,,,,12,23,,,,0.004025815207822366,1,60,0.7473904286894777,3.195031654384847e-05,COMPLETE
321,0.18798288702964783,2023-09-03 19:11:49.795647,2023-09-03 19:11:51.478408,0 days 00:00:01.682761,Tanh,ReLU,Sigmoid,,30,22,5.0,18.0,,0.0029643396787570903,3,80,0.6050567369836124,0.00015105724675330273,COMPLETE
322,0.2792578935623169,2023-09-03 19:11:51.478713,2023-09-03 19:11:55.936376,0 days 00:00:04.457663,ReLU,Leaky,,,2,18,24.0,,,0.024510385259582882,2,100,0.13322247907314325,0.00010924544310367574,COMPLETE
323,0.17418533563613892,2023-09-03 19:11:55.936689,2023-09-03 19:11:59.729166,0 days 00:00:03.792477,Tanh,Leaky,,,16,24,22.0,,,0.005500443031505944,2,100,0.7990641384110044,0.0014781584117086056,COMPLETE
324,0.22997114062309265,2023-09-03 19:11:59.729474,2023-09-03 19:12:05.971065,0 days 00:00:06.241591,Tanh,Sigmoid,,,4,21,23.0,,,0.0015493615313210945,2,100,0.2997489614594347,0.000539195970452258,COMPLETE
325,0.2022821307182312,2023-09-03 19:12:05.971587,2023-09-03 19:12:09.038087,0 days 00:00:03.066500,ReLU,Leaky,,,16,22,14.0,,,0.002512658926545916,2,60,0.7225124707785251,0.0019525381916408705,COMPLETE
326,0.23114842176437378,2023-09-03 19:12:09.038396,2023-09-03 19:12:11.631421,0 days 00:00:02.593025,Tanh,ReLU,ReLU,,12,23,21.0,13.0,,0.0020696607660519893,3,100,0.22999658729916,0.0010792894503912594,COMPLETE
327,0.18397462368011475,2023-09-03 19:12:11.632017,2023-09-03 19:12:21.971558,0 days 00:00:10.339541,Leaky,Leaky,,,10,9,23.0,,,0.0034703936330783025,2,100,0.6425165352759605,8.629398013091357e-05,COMPLETE
328,0.20515622198581696,2023-09-03 19:12:21.971882,2023-09-03 19:12:25.249758,0 days 00:00:03.277876,Tanh,Leaky,,,16,19,15.0,,,0.0009520743565315585,2,100,0.6902489722283505,0.0007104914774079456,COMPLETE
329,0.20994199812412262,2023-09-03 19:12:25.250080,2023-09-03 19:12:27.557518,0 days 00:00:02.307438,Tanh,Leaky,,,8,21,24.0,,,0.004559730430186006,2,60,0.4266677844368601,0.0009336643304823487,COMPLETE
330,0.19606226682662964,2023-09-03 19:12:27.557846,2023-09-03 19:12:31.278736,0 days 00:00:03.720890,ReLU,Leaky,,,12,20,12.0,,,0.0006946820226442287,2,80,0.7595938882150711,2.4010233852351165e-05,COMPLETE
331,0.17848648130893707,2023-09-03 19:12:31.279042,2023-09-03 19:12:35.775122,0 days 00:00:04.496080,Tanh,ReLU,Leaky,,16,22,23.0,10.0,,0.0018403736897291694,3,100,0.7683157323727389,1.9580371726939258e-05,COMPLETE
332,0.20982667803764343,2023-09-03 19:12:35.775437,2023-09-03 19:12:37.629737,0 days 00:00:01.854300,Tanh,Leaky,,,16,24,22.0,,,0.002549641828285131,2,100,0.3772324877379395,0.00017867980486243755,COMPLETE
333,0.18127454817295074,2023-09-03 19:12:37.630051,2023-09-03 19:12:40.642858,0 days 00:00:03.012807,ReLU,Sigmoid,,,8,23,18.0,,,0.006085234891922922,2,40,0.7400909155395666,0.00038169154178542184,COMPLETE
334,0.20117181539535522,2023-09-03 19:12:40.643180,2023-09-03 19:12:53.008144,0 days 00:00:12.364964,Tanh,Leaky,,,2,23,22.0,,,0.0013150597853537054,2,100,0.3690843867067238,0.00026053765739544524,COMPLETE
335,0.20514218509197235,2023-09-03 19:12:53.008454,2023-09-03 19:12:55.888459,0 days 00:00:02.880005,Tanh,Tanh,,,12,22,24.0,,,0.00315951514978112,2,60,0.774207056357644,0.0016580177965210862,COMPLETE
336,0.15760578215122223,2023-09-03 19:12:55.888760,2023-09-03 19:12:59.686411,0 days 00:00:03.797651,Leaky,Leaky,,,16,24,23.0,,,0.0016717383661764228,2,100,0.7987186959723227,0.0026238552545739067,COMPLETE
337,0.17604859173297882,2023-09-03 19:12:59.686724,2023-09-03 19:13:03.173766,0 days 00:00:03.487042,Tanh,Leaky,,,16,24,23.0,,,0.000891914305718788,2,100,0.7023079415686675,0.002815909809775217,COMPLETE
338,0.19080425798892975,2023-09-03 19:13:03.174082,2023-09-03 19:13:06.929232,0 days 00:00:03.755150,ReLU,Leaky,,,16,24,24.0,,,0.0016046196207212256,2,100,0.6767125125338919,0.004408641343718133,COMPLETE
339,0.2148842066526413,2023-09-03 19:13:06.929545,2023-09-03 19:13:10.811570,0 days 00:00:03.882025,Leaky,Leaky,,,16,24,23.0,,,0.003913483867682729,2,100,0.7987465334226543,0.0021931305315345717,COMPLETE
340,0.3078650236129761,2023-09-03 19:13:10.811891,2023-09-03 19:13:13.391717,0 days 00:00:02.579826,Sigmoid,Leaky,Sigmoid,,16,23,10.0,15.0,,0.0005868671814185475,3,60,0.7205893741864304,0.003659781074863194,COMPLETE
341,0.20574408769607544,2023-09-03 19:13:13.392054,2023-09-03 19:13:16.222770,0 days 00:00:02.830716,Tanh,Leaky,,,16,24,7.0,,,0.0011865504476884546,2,80,0.7468689027281494,0.0013763365927012257,COMPLETE
342,0.19604356586933136,2023-09-03 19:13:16.223076,2023-09-03 19:13:18.745086,0 days 00:00:02.522010,Tanh,Leaky,,,16,23,24.0,,,0.0021964955598034004,2,100,0.516880543034233,0.002712858519512149,COMPLETE
343,0.1986851841211319,2023-09-03 19:13:18.745392,2023-09-03 19:13:19.936031,0 days 00:00:01.190639,ReLU,Leaky,,,30,23,23.0,,,0.007956236684976215,2,100,0.4140620781394857,0.0001447380600761177,COMPLETE
344,0.27503135800361633,2023-09-03 19:13:19.936348,2023-09-03 19:13:26.935238,0 days 00:00:06.998890,Tanh,ReLU,Tanh,,4,22,23.0,12.0,,2.8745022568690105e-05,3,100,0.3278711996524951,0.001928807761496551,COMPLETE
345,0.21237410604953766,2023-09-03 19:13:26.935567,2023-09-03 19:13:29.200729,0 days 00:00:02.265162,Tanh,Leaky,,,16,24,6.0,,,0.0048672464666021,2,60,0.7978892395885993,0.0012128153020555111,COMPLETE
346,0.1913367211818695,2023-09-03 19:13:29.201046,2023-09-03 19:13:32.804815,0 days 00:00:03.603769,Tanh,Leaky,,,16,24,24.0,,,0.002827524579965311,2,100,0.7430216043876046,0.00022132885533741956,COMPLETE
347,0.19772200286388397,2023-09-03 19:13:32.805143,2023-09-03 19:13:41.507494,0 days 00:00:08.702351,ReLU,Leaky,ReLU,Sigmoid,8,22,22.0,20.0,12.0,0.0017077370506880757,4,100,0.652214370286127,0.0009350518147871352,COMPLETE
348,0.20397484302520752,2023-09-03 19:13:41.507843,2023-09-03 19:13:46.101152,0 days 00:00:04.593309,Leaky,Leaky,,,12,16,23.0,,,0.0014238551154876807,2,100,0.7712863290617658,0.00011363254895580516,COMPLETE
349,0.1852899193763733,2023-09-03 19:13:46.101481,2023-09-03 19:13:48.130465,0 days 00:00:02.028984,Tanh,ReLU,,,16,23,9.0,,,0.001977732162504158,2,60,0.7088440788293497,3.489826283647307e-05,COMPLETE
350,0.21707406640052795,2023-09-03 19:13:48.130791,2023-09-03 19:13:49.465542,0 days 00:00:01.334751,Tanh,,,,16,24,,,,0.0035774860554518666,1,80,0.4404017210491261,0.002365305910238951,COMPLETE
351,0.1729891151189804,2023-09-03 19:13:49.465878,2023-09-03 19:13:55.309752,0 days 00:00:05.843874,ReLU,Leaky,Sigmoid,,12,17,23.0,23.0,,0.002467333425102587,3,100,0.7742624652054297,0.0007900307827616961,COMPLETE
352,0.22063574194908142,2023-09-03 19:13:55.310084,2023-09-03 19:14:02.313441,0 days 00:00:07.003357,Tanh,Leaky,,,8,22,3.0,,,0.005763313150473307,2,100,0.7992028408317325,4.7558089142639086e-05,COMPLETE
353,0.20076073706150055,2023-09-03 19:14:02.313761,2023-09-03 19:14:05.791811,0 days 00:00:03.478050,Tanh,Leaky,,,16,21,16.0,,,0.001092838224119676,2,100,0.7373155686908378,0.001613854586929757,COMPLETE
354,0.18509043753147125,2023-09-03 19:14:05.792125,2023-09-03 19:14:07.379348,0 days 00:00:01.587223,Tanh,Leaky,,,16,23,22.0,,,0.0030011797845097853,2,60,0.5526784805234823,0.00017893640661494469,COMPLETE
355,0.21580079197883606,2023-09-03 19:14:07.379674,2023-09-03 19:14:18.747331,0 days 00:00:11.367657,ReLU,ReLU,,,2,23,12.0,,,0.004252251309269372,2,100,0.3443220104621272,6.0827417448102546e-05,COMPLETE
356,0.18645992875099182,2023-09-03 19:14:18.747638,2023-09-03 19:14:22.827311,0 days 00:00:04.079673,Tanh,Leaky,,,12,21,24.0,,,0.009481973009686253,2,100,0.6711502653609057,0.0010959617660238924,COMPLETE
357,0.20738720893859863,2023-09-03 19:14:22.827611,2023-09-03 19:14:23.682926,0 days 00:00:00.855315,Leaky,Leaky,,,30,22,23.0,,,0.0018281769413051618,2,40,0.7497908229668079,0.00029778839233862047,COMPLETE
358,0.18228892982006073,2023-09-03 19:14:23.683232,2023-09-03 19:14:38.409690,0 days 00:00:14.726458,Tanh,Leaky,Tanh,,4,23,22.0,18.0,,0.0022369431383191807,3,100,0.7087750160794896,8.74147432221048e-05,COMPLETE
359,0.21564529836177826,2023-09-03 19:14:38.410009,2023-09-03 19:14:40.997064,0 days 00:00:02.587055,ReLU,Leaky,,,8,24,22.0,,,0.0013744646154619556,2,80,0.3595381690527705,0.00013347036169851023,COMPLETE
360,0.2531399726867676,2023-09-03 19:14:40.997377,2023-09-03 19:14:41.837496,0 days 00:00:00.840119,Tanh,ReLU,,,16,22,24.0,,,0.006946598050233044,2,60,0.2789910218516904,2.0715446287920144e-05,COMPLETE
361,0.22552356123924255,2023-09-03 19:14:41.837797,2023-09-03 19:14:43.072176,0 days 00:00:01.234379,Tanh,Leaky,,,16,23,8.0,,,0.0032421831547845945,2,100,0.25040466648271986,0.0006302084997584172,COMPLETE
362,0.19213242828845978,2023-09-03 19:14:43.072493,2023-09-03 19:14:47.747566,0 days 00:00:04.675073,Tanh,Leaky,Leaky,,12,24,23.0,11.0,,0.0025853828748349586,3,100,0.6313550654119029,1.0252176396365303e-05,COMPLETE
363,0.2477210909128189,2023-09-03 19:14:47.747891,2023-09-03 19:14:50.196766,0 days 00:00:02.448875,ReLU,Leaky,,,16,21,14.0,,,0.0017044227905613873,2,100,0.4795609659225086,0.06789665656327791,COMPLETE
364,0.19814646244049072,2023-09-03 19:14:50.197078,2023-09-03 19:14:54.568957,0 days 00:00:04.371879,Tanh,ReLU,,,8,22,13.0,,,0.0048744144711135185,2,60,0.7704479454004332,0.0012796978462833865,COMPLETE
365,0.224383145570755,2023-09-03 19:14:54.569260,2023-09-03 19:14:57.938249,0 days 00:00:03.368989,Sigmoid,Leaky,,,16,23,23.0,,,0.003773164035332322,2,100,0.7267695596663499,0.0007623974549457475,COMPLETE
366,0.23882977664470673,2023-09-03 19:14:57.938565,2023-09-03 19:15:05.593020,0 days 00:00:07.654455,Tanh,Tanh,,,12,11,11.0,,,0.0008116204628376042,2,100,0.4930022746926885,0.0019527625030777503,COMPLETE
367,0.1932803839445114,2023-09-03 19:15:05.593572,2023-09-03 19:15:17.593048,0 days 00:00:11.999476,Leaky,Leaky,Leaky,,16,24,22.0,6.0,,0.0020979866693043663,3,100,0.6887700207994192,1.3441387020097413e-05,COMPLETE
368,0.2162165641784668,2023-09-03 19:15:17.593593,2023-09-03 19:15:45.578925,0 days 00:00:27.985332,ReLU,Leaky,,,2,21,21.0,,,0.000311054272061395,2,80,0.7697221814731989,1.536433745222517e-05,COMPLETE
369,0.1819007843732834,2023-09-03 19:15:45.579256,2023-09-03 19:15:48.808773,0 days 00:00:03.229517,Tanh,Leaky,,,8,23,24.0,,,0.0028303961150047807,2,60,0.5870913968934495,3.0070189445147742e-05,COMPLETE
370,0.2337103635072708,2023-09-03 19:15:48.809077,2023-09-03 19:15:51.727142,0 days 00:00:02.918065,Tanh,,,,16,22,,,,0.001066067574057375,1,100,0.7997210216310113,0.0004441848963122041,COMPLETE
371,0.21637099981307983,2023-09-03 19:15:51.727439,2023-09-03 19:15:55.925126,0 days 00:00:04.197687,Tanh,ReLU,,,30,7,15.0,,,0.0015125369008313658,2,100,0.7426803675059156,0.0015282255017518079,COMPLETE
372,0.18440654873847961,2023-09-03 19:15:55.925644,2023-09-03 19:16:00.732987,0 days 00:00:04.807343,ReLU,Leaky,,,12,23,23.0,,,0.0021401469350882624,2,100,0.7243134360233198,0.0025497242872838384,COMPLETE
373,0.18732939660549164,2023-09-03 19:16:00.733312,2023-09-03 19:16:02.938621,0 days 00:00:02.205309,Tanh,Leaky,,,16,24,22.0,,,0.003400844063157881,2,60,0.7673168147761564,0.003445361148727881,COMPLETE
374,0.19678930938243866,2023-09-03 19:16:02.938919,2023-09-03 19:16:17.220542,0 days 00:00:14.281623,Tanh,Leaky,Sigmoid,,4,15,23.0,9.0,,0.00040090508323761435,3,100,0.6182854720521567,1.599187051317649e-05,COMPLETE
375,0.2570141553878784,2023-09-03 19:16:17.221091,2023-09-03 19:16:23.822296,0 days 00:00:06.601205,Leaky,Leaky,,,16,22,10.0,,,0.00015966267680694337,2,100,0.6737378379252624,0.0009033830364752235,COMPLETE
376,0.19604067504405975,2023-09-03 19:16:23.822615,2023-09-03 19:16:33.295479,0 days 00:00:09.472864,ReLU,ReLU,,,8,20,24.0,,,0.0005062588428609741,2,100,0.7989653680359591,0.001052520343504504,COMPLETE
377,0.16909588873386383,2023-09-03 19:16:33.296020,2023-09-03 19:16:42.451618,0 days 00:00:09.155598,Tanh,Leaky,,,12,23,22.0,,,0.00542106663692927,2,80,0.6994111560205062,0.00021751606041516856,COMPLETE
378,0.1897459626197815,2023-09-03 19:16:42.451925,2023-09-03 19:16:45.593216,0 days 00:00:03.141291,Tanh,Leaky,,,12,23,22.0,,,0.005587831128961338,2,80,0.6547200005540936,0.00019347333772055434,COMPLETE
379,0.18686985969543457,2023-09-03 19:16:45.593542,2023-09-03 19:16:48.935119,0 days 00:00:03.341577,Tanh,Leaky,,,12,24,21.0,,,0.006461231725476429,2,80,0.6935906043412795,0.00021467751226596067,COMPLETE
380,0.20270377397537231,2023-09-03 19:16:48.935431,2023-09-03 19:16:50.652264,0 days 00:00:01.716833,Tanh,Leaky,,,12,24,22.0,,,0.007811898629852124,2,80,0.32239142251295533,0.00025268858132201347,COMPLETE
381,0.20673868060112,2023-09-03 19:16:50.652584,2023-09-03 19:16:54.939128,0 days 00:00:04.286544,Tanh,ReLU,Tanh,,12,23,23.0,3.0,,0.0054736838884847415,3,80,0.706537617433501,0.00034340965437957546,COMPLETE
382,0.2553636133670807,2023-09-03 19:16:54.939449,2023-09-03 19:16:55.991113,0 days 00:00:01.051664,Tanh,Leaky,,,12,23,21.0,,,0.0047509518336927995,2,80,0.19934800003608777,0.00017709812786700005,COMPLETE
383,0.19454430043697357,2023-09-03 19:16:55.991416,2023-09-03 19:16:59.687879,0 days 00:00:03.696463,Tanh,Leaky,,,12,24,22.0,,,0.0099192329146919,2,80,0.7353948726043082,0.0001478468336680256,COMPLETE
384,0.2107762098312378,2023-09-03 19:16:59.688190,2023-09-03 19:17:01.716141,0 days 00:00:02.027951,Tanh,Leaky,,,12,23,23.0,,,0.00422102078628009,2,80,0.4009163789551254,0.00029150786707058963,COMPLETE
385,0.19558553397655487,2023-09-03 19:17:01.716462,2023-09-03 19:17:05.965964,0 days 00:00:04.249502,Tanh,Tanh,Leaky,,8,23,17.0,14.0,,0.000643040101452465,3,60,0.5678665392317098,2.384596353882612e-05,COMPLETE
386,0.17548823356628418,2023-09-03 19:17:05.966281,2023-09-03 19:17:24.224006,0 days 00:00:18.257725,Tanh,Leaky,,,2,24,24.0,,,0.0067161996934432585,2,80,0.680507618662622,0.0005472409078890316,COMPLETE
387,0.19168642163276672,2023-09-03 19:17:24.224335,2023-09-03 19:17:26.120985,0 days 00:00:01.896650,Tanh,ReLU,,,12,21,20.0,,,0.014977324325920187,2,40,0.7546396570464468,0.0006325514285888504,COMPLETE
388,0.21604660153388977,2023-09-03 19:17:26.121286,2023-09-03 19:17:27.215623,0 days 00:00:01.094337,Tanh,Leaky,,,30,20,22.0,,,0.0013120288408383428,2,60,0.6451509639657486,0.00021733508025134241,COMPLETE
389,0.18424834311008453,2023-09-03 19:17:27.215971,2023-09-03 19:17:34.448421,0 days 00:00:07.232450,Tanh,Leaky,,,4,22,23.0,,,0.004280863006275621,2,60,0.7206407059413478,0.00011738907822572421,COMPLETE
390,0.23450669646263123,2023-09-03 19:17:34.448748,2023-09-03 19:17:37.875067,0 days 00:00:03.426319,Leaky,,,,12,22,,,,0.0001222018571485787,1,100,0.7527128220490819,0.004779145812832067,COMPLETE
391,0.2182147204875946,2023-09-03 19:17:37.875373,2023-09-03 19:17:43.973195,0 days 00:00:06.097822,Tanh,Leaky,ReLU,,8,24,21.0,13.0,,0.0340016307119077,3,80,0.6941525293795786,0.00015169738116893792,COMPLETE
392,0.20409362018108368,2023-09-03 19:17:43.973514,2023-09-03 19:17:46.300240,0 days 00:00:02.326726,Tanh,Leaky,,,12,21,22.0,,,0.0008949429227973143,2,100,0.3734324676880485,7.517838298644e-05,COMPLETE
393,0.19995853304862976,2023-09-03 19:17:46.300578,2023-09-03 19:17:48.539271,0 days 00:00:02.238693,Tanh,ReLU,,,16,23,23.0,,,0.001711908473691676,2,100,0.468227807041459,0.0007339850798576927,COMPLETE
394,0.20448727905750275,2023-09-03 19:17:48.539590,2023-09-03 19:17:51.689740,0 days 00:00:03.150150,Sigmoid,Leaky,,,8,24,19.0,,,0.008340313660219952,2,60,0.6042350503873208,0.00011390921920807331,COMPLETE
395,0.18280349671840668,2023-09-03 19:17:51.690066,2023-09-03 19:17:55.237671,0 days 00:00:03.547605,Tanh,Leaky,,,16,23,24.0,,,0.003602915263900426,2,100,0.7701164084212684,0.00039824887790298883,COMPLETE
396,0.17951592803001404,2023-09-03 19:17:55.237979,2023-09-03 19:17:59.688875,0 days 00:00:04.450896,Tanh,Leaky,,,12,17,16.0,,,0.005223103873569517,2,100,0.7222388547421276,0.00024390558026583358,COMPLETE
397,0.1837824583053589,2023-09-03 19:17:59.689206,2023-09-03 19:18:16.694694,0 days 00:00:17.005488,Tanh,Leaky,Sigmoid,,2,18,22.0,19.0,,0.0024489170374840438,3,100,0.4130928384896365,9.463037984247165e-05,COMPLETE
398,0.22331151366233826,2023-09-03 19:18:16.695035,2023-09-03 19:18:18.008849,0 days 00:00:01.313814,Leaky,ReLU,,,16,22,23.0,,,0.00036797225151972225,2,60,0.46084415508111326,0.0017829116038486571,COMPLETE
399,0.2600407004356384,2023-09-03 19:18:18.009180,2023-09-03 19:18:18.911265,0 days 00:00:00.902085,Tanh,Leaky,,,8,19,24.0,,,0.001212309305523747,2,80,0.12307094551690179,0.000481525409633643,COMPLETE
400,0.22405827045440674,2023-09-03 19:18:18.911575,2023-09-03 19:18:19.816191,0 days 00:00:00.904616,Tanh,Leaky,,,30,23,23.0,,,0.001889772961058378,2,100,0.30612570127648425,0.002918331233461915,COMPLETE
401,0.18484655022621155,2023-09-03 19:18:19.816496,2023-09-03 19:18:23.565319,0 days 00:00:03.748823,Tanh,Leaky,,,16,21,4.0,,,0.0027970797737600496,2,100,0.7991333403600522,1.1863598470501056e-05,COMPLETE
402,0.2075752466917038,2023-09-03 19:18:23.565650,2023-09-03 19:18:27.509874,0 days 00:00:03.944224,Tanh,Leaky,Tanh,,12,24,21.0,8.0,,0.0014905172901426976,3,100,0.5348185649417326,0.0009266574979938844,COMPLETE
403,0.22872720658779144,2023-09-03 19:18:27.510199,2023-09-03 19:18:28.543661,0 days 00:00:01.033462,Tanh,ReLU,,,16,22,5.0,,,0.0031034481827538914,2,60,0.3545871843593808,3.689051606508945e-05,COMPLETE
404,0.19612178206443787,2023-09-03 19:18:28.543992,2023-09-03 19:18:41.278945,0 days 00:00:12.734953,Tanh,Leaky,,,4,23,23.0,,,0.003912388148919689,2,100,0.7433358697426037,5.264371450858464e-05,COMPLETE
405,0.1754046231508255,2023-09-03 19:18:41.279286,2023-09-03 19:18:44.825918,0 days 00:00:03.546632,Leaky,Leaky,,,16,24,22.0,,,0.002193904835021163,2,100,0.7620817407844663,1.628697848252756e-05,COMPLETE
406,0.17785267531871796,2023-09-03 19:18:44.826240,2023-09-03 19:18:46.536202,0 days 00:00:01.709962,Tanh,Leaky,,,12,22,24.0,,,0.006031295653995412,2,40,0.696760867193898,0.0001844170674069561,COMPLETE
407,0.40297839045524597,2023-09-03 19:18:46.536514,2023-09-03 19:18:48.746635,0 days 00:00:02.210121,Tanh,Leaky,,,8,20,18.0,,,1.526304876244893e-05,2,80,0.314399256707369,2.529341649024008e-05,COMPLETE
408,0.2293195277452469,2023-09-03 19:18:48.746955,2023-09-03 19:18:51.661103,0 days 00:00:02.914148,Tanh,ReLU,Leaky,,10,22,3.0,24.0,,0.004508776451782201,3,100,0.32820613296291673,1.9152128489707964e-05,COMPLETE
409,0.2253621518611908,2023-09-03 19:18:51.661464,2023-09-03 19:18:53.591301,0 days 00:00:01.929837,Tanh,Leaky,,,16,21,22.0,,,0.00022857138277323816,2,60,0.6697299023797249,0.00029046850848172385,COMPLETE
410,0.24722899496555328,2023-09-03 19:18:53.591644,2023-09-03 19:18:57.157593,0 days 00:00:03.565949,Tanh,Tanh,,,16,4,23.0,,,0.0010711855920390347,2,100,0.7717265384343415,0.015592188685277576,COMPLETE
411,0.2609359920024872,2023-09-03 19:18:57.157933,2023-09-03 19:19:01.414166,0 days 00:00:04.256233,Sigmoid,Sigmoid,,,12,23,6.0,,,0.0017138865315365131,2,100,0.7161602330025534,0.0011348422338046732,COMPLETE
412,0.2065451443195343,2023-09-03 19:19:01.414479,2023-09-03 19:19:21.889387,0 days 00:00:20.474908,ReLU,Leaky,,,2,23,22.0,,,0.003209232113007514,2,100,0.6305906090876231,0.00012907830602311047,COMPLETE
413,0.19434234499931335,2023-09-03 19:19:21.889705,2023-09-03 19:19:27.262661,0 days 00:00:05.372956,Tanh,Leaky,Leaky,,8,24,24.0,17.0,,0.0023746918365913972,3,60,0.7390445571460209,0.002026663169504515,COMPLETE
414,0.20764347910881042,2023-09-03 19:19:27.262981,2023-09-03 19:19:28.844075,0 days 00:00:01.581094,Leaky,ReLU,,,16,15,21.0,,,0.00701754230642619,2,80,0.418476293212201,0.0005880830639412375,COMPLETE
415,0.2009728103876114,2023-09-03 19:19:28.844387,2023-09-03 19:19:36.215689,0 days 00:00:07.371302,Tanh,Leaky,,,12,8,23.0,,,0.0019064256416552385,2,100,0.7987172404027069,0.0008632186445173299,COMPLETE
416,0.21441879868507385,2023-09-03 19:19:36.216014,2023-09-03 19:19:37.312586,0 days 00:00:01.096572,Tanh,Leaky,,,30,20,22.0,,,0.0037716408967876855,2,100,0.3784124727878435,0.0013696276705327678,COMPLETE
417,0.2248900681734085,2023-09-03 19:19:37.312931,2023-09-03 19:19:40.093266,0 days 00:00:02.780335,ReLU,,,,16,21,,,,0.0014362703268000097,1,100,0.7651961156162896,0.00016521375563918522,COMPLETE
418,0.14643293619155884,2023-09-03 19:19:40.093573,2023-09-03 19:19:50.714453,0 days 00:00:10.620880,Tanh,Leaky,Sigmoid,Sigmoid,4,23,23.0,15.0,13.0,0.004986966232994129,4,60,0.7235972784056137,6.677469862150743e-05,COMPLETE
