number,value,datetime_start,datetime_complete,duration,params_activation1,params_activation2,params_activation3,params_activation4,params_batch_size,params_fl1,params_fl2,params_fl3,params_fl4,params_learning_rate,params_n_layers,params_num_epochs,params_train_size,params_weight_decay,user_attrs_mre,state
466,0.18481989204883575,2023-09-04 12:07:56.862564,2023-09-04 12:07:57.540725,0 days 00:00:00.678161,ReLU,Tanh,Sigmoid,,67,18,23.0,15.0,,0.01707881462872368,3,169,0.748157266318136,0.00024291408698994213,169.77258549565855,COMPLETE
467,0.1879727840423584,2023-09-04 12:07:57.541105,2023-09-04 12:07:58.298251,0 days 00:00:00.757146,ReLU,ReLU,Sigmoid,,62,17,22.0,14.0,,0.010314827921040175,3,180,0.7167948812696349,0.00033449078773557697,171.31833678025467,COMPLETE
468,0.21857823431491852,2023-09-04 12:07:58.298604,2023-09-04 12:07:58.782413,0 days 00:00:00.483809,ReLU,ReLU,Sigmoid,,57,16,22.0,13.0,,0.06567011846267352,3,199,0.7999705162537336,0.00014109412428950553,119.0629328974971,COMPLETE
469,0.17720860242843628,2023-09-04 12:07:58.782767,2023-09-04 12:07:59.783216,0 days 00:00:01.000449,ReLU,Tanh,Sigmoid,,64,17,24.0,18.0,,0.0050075425912764196,3,138,0.7635513854035251,2.8667795302247454e-05,96.80063236120975,COMPLETE
470,0.23248843848705292,2023-09-04 12:07:59.783553,2023-09-04 12:08:00.340822,0 days 00:00:00.557269,Sigmoid,ReLU,Sigmoid,,52,14,23.0,6.0,,0.007993477741067841,3,123,0.3690892170529478,0.00023137352682325312,102.97988516385438,COMPLETE
471,0.19831418991088867,2023-09-04 12:08:00.341160,2023-09-04 12:08:00.760906,0 days 00:00:00.419746,ReLU,ReLU,Sigmoid,,60,19,21.0,11.0,,0.023782311435440896,3,189,0.7532671619093545,0.0005037103680418266,142.23641082763672,COMPLETE
472,0.19773386418819427,2023-09-04 12:08:00.761272,2023-09-04 12:08:01.564110,0 days 00:00:00.802838,ReLU,Tanh,Sigmoid,,55,12,24.0,16.0,,0.005970561719404948,3,93,0.4287724771560765,0.00038027174486872416,101.61329914611063,COMPLETE
473,0.2623796761035919,2023-09-04 12:08:01.564448,2023-09-04 12:08:01.794139,0 days 00:00:00.229691,ReLU,ReLU,Sigmoid,,68,16,21.0,14.0,,0.014496845700510552,3,162,0.2465335649465882,0.04146078692573632,96.36733050224109,COMPLETE
474,0.19538962841033936,2023-09-04 12:08:01.794476,2023-09-04 12:08:03.701827,0 days 00:00:01.907351,ReLU,Tanh,Tanh,,65,15,23.0,10.0,,0.00043482515905544157,3,147,0.6817526316447299,4.7301164055029076e-05,129.60640835924212,COMPLETE
475,0.18230855464935303,2023-09-04 12:08:03.702179,2023-09-04 12:08:04.520815,0 days 00:00:00.818636,ReLU,ReLU,Sigmoid,,59,16,23.0,15.0,,0.009293278040124755,3,107,0.7168602643271109,0.00028198345501407614,119.55165100097656,COMPLETE
476,0.20383353531360626,2023-09-04 12:08:04.521168,2023-09-04 12:08:05.777162,0 days 00:00:01.255994,ReLU,ReLU,Sigmoid,,62,17,19.0,1.0,,0.00467381768289358,3,115,0.5937189102420579,1.06398755593449e-05,163.32291121709915,COMPLETE
477,0.19692008197307587,2023-09-04 12:08:05.777522,2023-09-04 12:08:06.353008,0 days 00:00:00.575486,ReLU,Tanh,Sigmoid,,56,19,22.0,12.0,,0.0073175584507713075,3,177,0.5494250389400723,0.00019147214077101218,78.80301417475161,COMPLETE
478,0.22591151297092438,2023-09-04 12:08:06.353368,2023-09-04 12:08:06.595269,0 days 00:00:00.241901,ReLU,ReLU,Sigmoid,,63,18,24.0,14.0,,0.011720326686357373,3,129,0.18920171964174548,0.0003204897305019365,84.10609722137451,COMPLETE
479,0.9656322002410889,2023-09-04 12:08:06.595622,2023-09-04 12:08:07.622947,0 days 00:00:01.027325,ReLU,Sigmoid,Sigmoid,,50,17,21.0,13.0,,2.7515122292867442e-05,3,190,0.21667413742706584,0.0012647929679392414,108.56684690776625,COMPLETE
480,0.2087264209985733,2023-09-04 12:08:07.623303,2023-09-04 12:08:08.427815,0 days 00:00:00.804512,ReLU,ReLU,Sigmoid,,58,16,23.0,16.0,,0.0015244466389446073,3,140,0.7713818474482362,0.000156762182215867,138.92173440115792,COMPLETE
481,0.24641810357570648,2023-09-04 12:08:08.428173,2023-09-04 12:08:09.043574,0 days 00:00:00.615401,ReLU,Tanh,ReLU,,45,15,20.0,17.0,,0.05576838779294293,3,204,0.7338258861731346,0.0016302788556575615,87.51505851745605,COMPLETE
482,0.2789093852043152,2023-09-04 12:08:09.043945,2023-09-04 12:08:09.344346,0 days 00:00:00.300401,ReLU,ReLU,Sigmoid,,54,13,22.0,14.0,,0.0023243119383405705,3,168,0.17217265225749082,0.00012196377396278683,98.44187557697296,COMPLETE
483,0.18556712567806244,2023-09-04 12:08:09.344691,2023-09-04 12:08:09.939358,0 days 00:00:00.594667,ReLU,ReLU,Sigmoid,,61,17,24.0,13.0,,0.01904204347957014,3,153,0.6560160134380157,0.0002483403155165809,70.72838415750643,COMPLETE
484,0.20554091036319733,2023-09-04 12:08:09.939706,2023-09-04 12:08:10.871449,0 days 00:00:00.931743,ReLU,Tanh,Sigmoid,,67,12,23.0,12.0,,0.003798982435076572,3,120,0.7626208823608397,0.0004033867477685395,114.10074869791667,COMPLETE
485,0.20416471362113953,2023-09-04 12:08:10.871805,2023-09-04 12:08:11.214050,0 days 00:00:00.342245,ReLU,ReLU,Sigmoid,,82,18,22.0,15.0,,0.006031435214647104,3,137,0.3321398477819432,2.328213286761619e-05,84.61890680649701,COMPLETE
486,0.2161206305027008,2023-09-04 12:08:11.214409,2023-09-04 12:08:11.381040,0 days 00:00:00.166631,ReLU,ReLU,Sigmoid,,64,16,24.0,10.0,,0.014925626557900749,3,180,0.22157841318917457,0.0005429899990851238,159.06237294123724,COMPLETE
487,0.19773925840854645,2023-09-04 12:08:11.381393,2023-09-04 12:08:12.057320,0 days 00:00:00.675927,ReLU,Tanh,Tanh,,69,15,20.0,11.0,,0.008648576905752898,3,101,0.7996923083691965,0.0002019935068857515,72.99031569740988,COMPLETE
488,0.2153344452381134,2023-09-04 12:08:12.057666,2023-09-04 12:08:14.419024,0 days 00:00:02.361358,ReLU,ReLU,Sigmoid,,57,17,23.0,14.0,,0.0005164549086747313,3,159,0.6952536408767631,0.009853232297706434,114.76332293816333,COMPLETE
489,0.3842642903327942,2023-09-04 12:08:14.419379,2023-09-04 12:08:16.372323,0 days 00:00:01.952944,ReLU,ReLU,Sigmoid,,66,17,22.0,13.0,,4.7965019555206764e-05,3,129,0.7996766233183311,9.559127456325203e-05,207.92583045663758,COMPLETE
490,0.23332801461219788,2023-09-04 12:08:16.372672,2023-09-04 12:08:17.172055,0 days 00:00:00.799383,ReLU,Tanh,Sigmoid,,53,16,23.0,15.0,,0.000983842759072642,3,170,0.3079732247060192,0.0002813008415316776,128.70136841940223,COMPLETE
491,0.17284026741981506,2023-09-04 12:08:17.172398,2023-09-04 12:08:17.929103,0 days 00:00:00.756705,Sigmoid,ReLU,Sigmoid,,60,18,21.0,13.0,,0.01041038431268132,3,188,0.7329979572848357,0.0003495806120957773,145.64427356330717,COMPLETE
492,0.2243025302886963,2023-09-04 12:08:17.929459,2023-09-04 12:08:18.516463,0 days 00:00:00.587004,ReLU,ReLU,Sigmoid,,59,16,22.0,12.0,,0.005201391106969088,3,116,0.6133613158070207,0.0034009840499195673,103.73681796680798,COMPLETE
493,0.18488922715187073,2023-09-04 12:08:18.516797,2023-09-04 12:08:19.091671,0 days 00:00:00.574874,ReLU,Tanh,Sigmoid,,62,15,24.0,16.0,,0.026506750743511272,3,148,0.7693635424126555,0.00018145566713774312,78.00935501522488,COMPLETE
494,0.2552182376384735,2023-09-04 12:08:19.092004,2023-09-04 12:08:19.437420,0 days 00:00:00.345416,ReLU,ReLU,Sigmoid,,64,14,23.0,17.0,,0.006734190637243719,3,86,0.19337184706510516,0.0004624125001358203,85.43649051614004,COMPLETE
495,0.17538756132125854,2023-09-04 12:08:19.437743,2023-09-04 12:08:19.940296,0 days 00:00:00.502553,ReLU,ReLU,Sigmoid,,57,19,24.0,14.0,,0.040767027182561484,3,199,0.7158055421464322,0.0002274330289074654,86.81102063578945,COMPLETE
496,0.24837109446525574,2023-09-04 12:08:19.940643,2023-09-04 12:08:20.276915,0 days 00:00:00.336272,ReLU,Tanh,Sigmoid,,79,17,21.0,15.0,,0.02023618218557201,3,132,0.7484708446584596,0.022964491143825393,154.85522261909816,COMPLETE
497,0.21374262869358063,2023-09-04 12:08:20.277262,2023-09-04 12:08:20.610786,0 days 00:00:00.333524,ReLU,ReLU,Sigmoid,,55,13,22.0,14.0,,0.01286819845483601,3,109,0.25237821440839664,6.662192162673666e-05,85.17876525878906,COMPLETE
498,0.22961078584194183,2023-09-04 12:08:20.611155,2023-09-04 12:08:21.181712,0 days 00:00:00.570557,ReLU,Tanh,Sigmoid,,60,16,18.0,11.0,,0.016210776078135706,3,124,0.6874331160818655,0.006414975096755482,148.77283919484992,COMPLETE
499,0.2779611349105835,2023-09-04 12:08:21.182050,2023-09-04 12:08:21.440355,0 days 00:00:00.258305,ReLU,ReLU,Tanh,,66,18,23.0,18.0,,0.0006519188023136891,3,176,0.12156585401541867,0.001045642941817928,107.34584923313089,COMPLETE
