number,value,datetime_start,datetime_complete,duration,params_activation1,params_activation2,params_activation3,params_activation4,params_batch_size,params_fl1,params_fl2,params_fl3,params_fl4,params_learning_rate,params_n_layers,params_num_epochs,params_train_size,params_weight_decay,user_attrs_mre,state
452,0.24200816452503204,2023-09-04 12:16:26.310465,2023-09-04 12:16:28.130727,0 days 00:00:01.820262,Tanh,ReLU,Leaky,Sigmoid,85,10,13.0,20.0,19.0,0.007383012479884191,4,243,0.39691002164575606,0.007050746765662429,116.91939514561703,COMPLETE
453,0.20718592405319214,2023-09-04 12:16:28.131387,2023-09-04 12:16:29.617673,0 days 00:00:01.486286,Tanh,Tanh,Leaky,Sigmoid,80,14,14.0,23.0,20.0,0.036039863480681326,4,371,0.4493542578298073,8.37220618257767e-05,119.72233701219746,COMPLETE
454,0.15849359333515167,2023-09-04 12:16:29.618318,2023-09-04 12:16:31.685173,0 days 00:00:02.066855,Tanh,Tanh,Leaky,Sigmoid,89,13,12.0,20.0,21.0,0.005151873983218154,4,389,0.6200322699481581,0.0005640835255360874,111.61274076762952,COMPLETE
455,0.13145685195922852,2023-09-04 12:16:31.685837,2023-09-04 12:16:33.886856,0 days 00:00:02.201019,ReLU,ReLU,Tanh,Sigmoid,87,11,11.0,1.0,22.0,0.01637374634871019,4,431,0.7730443491628929,0.00018719562935036474,105.98168701171875,COMPLETE
456,1.1712781190872192,2023-09-04 12:16:33.887512,2023-09-04 12:16:34.893276,0 days 00:00:01.005764,Tanh,Tanh,Leaky,Sigmoid,83,12,13.0,15.0,18.0,0.00013813778720067962,4,407,0.6960911624428009,0.08633787199359637,97.46551712699558,COMPLETE
457,0.15235444903373718,2023-09-04 12:16:34.893912,2023-09-04 12:16:37.625899,0 days 00:00:02.731987,Tanh,ReLU,Sigmoid,Leaky,74,10,13.0,13.0,21.0,0.023965893912092123,4,279,0.7368952467270171,0.0004215800407838705,106.71242496885102,COMPLETE
458,0.22009442746639252,2023-09-04 12:16:37.626564,2023-09-04 12:16:41.021616,0 days 00:00:03.395052,Tanh,Tanh,Leaky,Sigmoid,85,14,12.0,22.0,24.0,0.002374745878758175,4,378,0.773742372613387,0.001697218721082853,117.97981975604961,COMPLETE
459,0.17028744518756866,2023-09-04 12:16:41.022265,2023-09-04 12:16:43.200745,0 days 00:00:02.178480,Tanh,ReLU,Leaky,,81,13,15.0,24.0,,0.010731776084370365,3,396,0.5339840499134322,0.00027597494273222856,75.87566656815379,COMPLETE
460,0.29795557260513306,2023-09-04 12:16:43.201386,2023-09-04 12:16:45.293532,0 days 00:00:02.092146,Tanh,Sigmoid,Leaky,Sigmoid,64,12,14.0,21.0,10.0,0.001764823114194167,4,388,0.18107139052964444,0.0007762966283637489,130.66779448654478,COMPLETE
461,0.23144419491291046,2023-09-04 12:16:45.294181,2023-09-04 12:16:49.878621,0 days 00:00:04.584440,Tanh,Tanh,Tanh,Sigmoid,89,9,12.0,20.0,23.0,0.0004174750520924771,4,368,0.6425165610897652,6.78503883699538e-05,151.57746476393478,COMPLETE
462,0.15441136062145233,2023-09-04 12:16:49.879276,2023-09-04 12:16:52.139578,0 days 00:00:02.260302,Tanh,ReLU,Leaky,Sigmoid,86,16,13.0,19.0,19.0,0.01376723622053242,4,405,0.7241080580113319,0.0006565036469377411,86.17509935486991,COMPLETE
463,0.14853426814079285,2023-09-04 12:16:52.140251,2023-09-04 12:16:56.466565,0 days 00:00:04.326314,Tanh,Tanh,Leaky,Sigmoid,78,11,14.0,21.0,18.0,0.003953683167832661,4,383,0.6812353900692532,0.0005227733404160922,88.80372169131324,COMPLETE
464,0.1507023125886917,2023-09-04 12:16:56.467211,2023-09-04 12:16:59.390551,0 days 00:00:02.923340,Tanh,Tanh,Leaky,Sigmoid,91,12,23.0,20.0,20.0,0.01921995835559038,4,440,0.7994481437425357,0.0008872157124371926,79.61764567448543,COMPLETE
465,0.31450986862182617,2023-09-04 12:16:59.391205,2023-09-04 12:17:00.144531,0 days 00:00:00.753326,Tanh,ReLU,Tanh,Sigmoid,83,10,13.0,23.0,22.0,0.008825621600225812,4,150,0.27632387838829325,5.664751198127933e-05,195.75414049303208,COMPLETE
466,0.26658350229263306,2023-09-04 12:17:00.145187,2023-09-04 12:17:03.551061,0 days 00:00:03.405874,Tanh,Tanh,Leaky,Tanh,13,13,11.0,22.0,22.0,0.031040247340644152,4,413,0.500246997542282,0.010496285186183738,123.97563903808594,COMPLETE
467,0.1599453091621399,2023-09-04 12:17:03.551705,2023-09-04 12:17:06.036621,0 days 00:00:02.484916,Tanh,ReLU,Sigmoid,Sigmoid,88,11,12.0,21.0,23.0,0.011611145709759886,4,268,0.7524454325782332,0.00034802921074075533,85.83011410154145,COMPLETE
468,0.24047888815402985,2023-09-04 12:17:06.037273,2023-09-04 12:17:09.387761,0 days 00:00:03.350488,Sigmoid,Tanh,Leaky,Sigmoid,93,12,15.0,12.0,21.0,0.005554840136792009,4,358,0.7154771053385736,0.0010678953428400054,212.4288023128066,COMPLETE
469,0.166654571890831,2023-09-04 12:17:09.388424,2023-09-04 12:17:16.339828,0 days 00:00:06.951404,Tanh,Sigmoid,Leaky,Sigmoid,80,13,10.0,19.0,20.0,0.0029973106714134296,4,399,0.7517136955982776,0.000605506246753734,69.25334976292864,COMPLETE
470,0.4847254455089569,2023-09-04 12:17:16.340491,2023-09-04 12:17:34.099072,0 days 00:00:17.758581,Tanh,Leaky,Leaky,Sigmoid,84,14,13.0,17.0,14.0,2.5416369056390217e-05,4,476,0.6740605547489277,1.1457299521644289e-05,129.1248344453443,COMPLETE
471,0.19899976253509521,2023-09-04 12:17:34.099739,2023-09-04 12:17:38.277423,0 days 00:00:04.177684,Tanh,ReLU,Tanh,Leaky,76,11,3.0,20.0,19.0,0.0018919568259474528,4,373,0.7742006738036179,0.0001419986102849717,197.68683667129346,COMPLETE
472,0.26744192838668823,2023-09-04 12:17:38.278083,2023-09-04 12:17:39.372693,0 days 00:00:01.094610,Tanh,Tanh,Leaky,Sigmoid,87,12,7.0,3.0,21.0,0.007505910861869948,4,420,0.2568815741873924,0.0004736745378411795,140.13828575611115,COMPLETE
473,0.256652295589447,2023-09-04 12:17:39.373363,2023-09-04 12:17:39.969793,0 days 00:00:00.596430,Tanh,ReLU,Leaky,Sigmoid,90,11,12.0,21.0,17.0,0.015939941114567577,4,460,0.28455068732412564,4.4165822364764164e-05,155.50183690388997,COMPLETE
474,0.24467197060585022,2023-09-04 12:17:39.970455,2023-09-04 12:17:49.469604,0 days 00:00:09.499149,Tanh,Tanh,ReLU,Sigmoid,82,10,15.0,22.0,5.0,0.0008788438598959781,4,385,0.7994278470827537,0.0007037350100136955,158.14644048631806,COMPLETE
475,0.2040165662765503,2023-09-04 12:17:49.470273,2023-09-04 12:17:51.825382,0 days 00:00:02.355109,Tanh,Tanh,Leaky,Sigmoid,42,13,14.0,20.0,23.0,0.023869525311995262,4,394,0.7179706319889859,0.0019054525092080277,98.79280437122692,COMPLETE
476,0.22388270497322083,2023-09-04 12:17:51.826048,2023-09-04 12:17:52.916133,0 days 00:00:01.090085,Tanh,ReLU,Sigmoid,Sigmoid,86,9,24.0,23.0,19.0,0.01366344724744778,4,374,0.22409335543979914,9.457976808387034e-05,98.27454873789911,COMPLETE
477,0.15245510637760162,2023-09-04 12:17:52.916808,2023-09-04 12:17:57.063407,0 days 00:00:04.146599,Tanh,Tanh,Leaky,Sigmoid,30,15,13.0,11.0,6.0,0.009927301070094917,4,172,0.36705716687630663,0.00025643310992308607,76.49069967935252,COMPLETE
478,0.24916775524616241,2023-09-04 12:17:57.064088,2023-09-04 12:17:58.207272,0 days 00:00:01.143184,Tanh,ReLU,Tanh,Sigmoid,89,12,11.0,19.0,24.0,0.06451450217554551,4,365,0.7481702201617164,2.340767563071567e-05,99.15146209716796,COMPLETE
479,0.3791669011116028,2023-09-04 12:17:58.207951,2023-09-04 12:18:12.956787,0 days 00:00:14.748836,ReLU,Sigmoid,Leaky,Sigmoid,78,11,16.0,18.0,2.0,0.00032754445449763043,4,400,0.6091090689784754,0.0003939245758959641,96.49208868026733,COMPLETE
480,0.2197934240102768,2023-09-04 12:18:12.957444,2023-09-04 12:18:15.555427,0 days 00:00:02.597983,Tanh,Tanh,Leaky,Sigmoid,84,14,12.0,20.0,22.0,0.006003966002976961,4,487,0.6491077292229596,0.0012861513855276054,248.47091788676246,COMPLETE
481,0.1603422909975052,2023-09-04 12:18:15.556150,2023-09-04 12:18:16.464876,0 days 00:00:00.908726,Tanh,ReLU,Leaky,Sigmoid,92,13,14.0,21.0,13.0,0.04743182994837392,4,409,0.34820669715217895,0.00016994692960683124,80.84896757544541,COMPLETE
482,0.21533764898777008,2023-09-04 12:18:16.465552,2023-09-04 12:18:29.477744,0 days 00:00:13.012192,Tanh,Tanh,Leaky,Sigmoid,47,12,13.0,22.0,20.0,0.0002128135887112663,4,381,0.38297699904312416,0.0005526001832667797,78.31010470139353,COMPLETE
483,0.6241101622581482,2023-09-04 12:18:29.478426,2023-09-04 12:18:36.541438,0 days 00:00:07.063012,Tanh,ReLU,Tanh,Leaky,61,11,15.0,22.0,9.0,0.00018613710601676084,4,389,0.2434282046332721,0.0007686833433441477,108.4891836171285,COMPLETE
484,0.15188635885715485,2023-09-04 12:18:36.542110,2023-09-04 12:18:39.655044,0 days 00:00:03.112934,Tanh,Tanh,Leaky,Sigmoid,72,12,12.0,21.0,21.0,0.01919886601523416,4,359,0.7030345367764522,0.0003107319884116251,83.85297559655231,COMPLETE
485,0.15446308255195618,2023-09-04 12:18:39.655743,2023-09-04 12:18:42.588300,0 days 00:00:02.932557,Tanh,Tanh,Sigmoid,Sigmoid,81,10,14.0,19.0,18.0,0.028718039473527763,4,430,0.7382551563401639,0.00043542957592875194,87.93803069170784,COMPLETE
486,0.16901475191116333,2023-09-04 12:18:42.588980,2023-09-04 12:18:43.809199,0 days 00:00:01.220219,Tanh,ReLU,Leaky,Sigmoid,87,13,13.0,20.0,20.0,0.008135300619867137,4,417,0.771884647233993,0.0001242171148424691,91.27176607572116,COMPLETE
487,0.21675516664981842,2023-09-04 12:18:43.809848,2023-09-04 12:18:50.563999,0 days 00:00:06.754151,Tanh,Sigmoid,Leaky,Sigmoid,95,14,22.0,23.0,19.0,0.0008890814301090534,4,403,0.6974944059372311,0.0005950894807766888,84.01503926482648,COMPLETE
488,0.40782850980758667,2023-09-04 12:18:50.564647,2023-09-04 12:18:51.517342,0 days 00:00:00.952695,Tanh,Tanh,Leaky,Sigmoid,27,11,11.0,20.0,18.0,0.012134664525799147,4,377,0.13437513354402075,0.0009163779741482963,269.74584677053053,COMPLETE
489,0.20383957028388977,2023-09-04 12:18:51.518056,2023-09-04 12:18:53.652391,0 days 00:00:02.134335,Tanh,ReLU,Tanh,Sigmoid,85,12,5.0,24.0,19.0,0.004518680535204121,4,392,0.7718145253015075,0.00019423790458897398,84.97322543462117,COMPLETE
490,0.12812836468219757,2023-09-04 12:18:53.653106,2023-09-04 12:18:55.817815,0 days 00:00:02.164709,Tanh,Tanh,Leaky,Tanh,89,15,16.0,21.0,22.0,0.010101772392733525,4,369,0.7361570463311218,0.0006972287869278869,70.15450418912448,COMPLETE
491,0.21264757215976715,2023-09-04 12:18:55.818460,2023-09-04 12:18:57.026511,0 days 00:00:01.208051,Tanh,ReLU,Leaky,Sigmoid,80,10,13.0,22.0,22.0,0.006933932383486518,4,352,0.1593104591483833,1.8558391864567973e-05,148.31338596343994,COMPLETE
492,0.20002381503582,2023-09-04 12:18:57.027201,2023-09-04 12:18:59.960982,0 days 00:00:02.933781,Sigmoid,Tanh,Leaky,Sigmoid,83,13,21.0,21.0,23.0,0.016102451420702466,4,381,0.6693560556789795,0.0005126169800478442,109.17342648440844,COMPLETE
493,0.3122681677341461,2023-09-04 12:18:59.961651,2023-09-04 12:19:01.468155,0 days 00:00:01.506504,Tanh,Leaky,Leaky,Sigmoid,20,8,12.0,20.0,20.0,0.037892503806593196,4,408,0.5573503064298647,0.00025451568301596076,155.2066432407924,COMPLETE
494,0.2890625596046448,2023-09-04 12:19:01.468823,2023-09-04 12:19:02.660498,0 days 00:00:01.191675,Tanh,Tanh,Sigmoid,Sigmoid,87,11,14.0,19.0,21.0,0.02130144104325639,4,500,0.26814617038556066,0.0003862077522906181,143.43806861428652,COMPLETE
495,0.28714287281036377,2023-09-04 12:19:02.661162,2023-09-04 12:19:03.413416,0 days 00:00:00.752254,Tanh,ReLU,,,91,14,15.0,,,0.013799078000902515,2,390,0.33958907819694356,0.0008373589828319444,99.00506640495138,COMPLETE
496,0.21701014041900635,2023-09-04 12:19:03.414044,2023-09-04 12:19:05.676568,0 days 00:00:02.262524,Tanh,Tanh,Tanh,Sigmoid,76,12,19.0,22.0,8.0,0.053189252752266866,4,220,0.6393601261366044,0.0010015471545397649,262.3222251198508,COMPLETE
497,0.19418592751026154,2023-09-04 12:19:05.677212,2023-09-04 12:19:15.506636,0 days 00:00:09.829424,Tanh,ReLU,Leaky,Leaky,85,9,24.0,9.0,19.0,0.00028944502629662546,4,400,0.6982477175560328,0.0004901426529520423,99.76883334350586,COMPLETE
498,1.2264307737350464,2023-09-04 12:19:15.507297,2023-09-04 12:19:16.706336,0 days 00:00:01.199039,Tanh,Sigmoid,Leaky,Sigmoid,82,13,12.0,23.0,24.0,0.0084152894352246,4,470,0.5811670720142252,0.09404808049901153,110.26072120666504,COMPLETE
499,0.27213963866233826,2023-09-04 12:19:16.707011,2023-09-04 12:19:18.873250,0 days 00:00:02.166239,Tanh,Tanh,ReLU,Sigmoid,78,10,6.0,21.0,17.0,0.003659967544789616,4,444,0.2525791903039217,2.615340119575904e-05,131.7466249038924,COMPLETE
