number,value,datetime_start,datetime_complete,duration,params_activation1,params_activation2,params_activation3,params_activation4,params_batch_size,params_fl1,params_fl2,params_fl3,params_fl4,params_learning_rate,params_n_layers,params_num_epochs,params_train_size,params_weight_decay,user_attrs_mre,state
96,0.16939204931259155,2023-09-04 11:59:57.441849,2023-09-04 11:59:58.611797,0 days 00:00:01.169948,Leaky,Leaky,Sigmoid,,80,22,5.0,12.0,,0.006582732336029741,3,240,0.6442275839401249,0.0007791705793645481,84.83298923492431,COMPLETE
97,0.12507548928260803,2023-09-04 11:59:58.612071,2023-09-04 11:59:59.387650,0 days 00:00:00.775579,ReLU,ReLU,,,87,15,11.0,,,0.013259290170246773,2,427,0.7592638503775673,0.0005984802441886789,70.5845328030521,COMPLETE
98,0.20464186370372772,2023-09-04 11:59:59.387969,2023-09-04 11:59:59.686192,0 days 00:00:00.298223,Tanh,ReLU,,,89,16,10.0,,,0.023806512704060284,2,423,0.7653782008860115,0.0005637465913224421,107.20093683096079,COMPLETE
99,0.17209668457508087,2023-09-04 11:59:59.686467,2023-09-04 12:00:00.242205,0 days 00:00:00.555738,ReLU,ReLU,,,87,19,11.0,,,0.03320684593416062,2,454,0.6805931175414706,0.000599481936154371,85.57957652577183,COMPLETE
100,0.15386931598186493,2023-09-04 12:00:00.242475,2023-09-04 12:00:00.931276,0 days 00:00:00.688801,Leaky,ReLU,,,60,20,12.0,,,0.01370816664975013,2,392,0.5743826217372948,0.0004018951856836568,76.55936795748197,COMPLETE
101,0.21488837897777557,2023-09-04 12:00:00.931549,2023-09-04 12:00:01.666219,0 days 00:00:00.734670,Leaky,ReLU,,,60,23,12.0,,,0.012859550012986692,2,390,0.608757265951886,0.0003942030884139353,70.8961432320731,COMPLETE
102,0.2598385214805603,2023-09-04 12:00:01.666523,2023-09-04 12:00:02.027813,0 days 00:00:00.361290,Leaky,ReLU,,,97,22,13.0,,,0.016887124336269214,2,437,0.568138408570999,0.00027383651254700664,99.19231187729608,COMPLETE
103,0.20035941898822784,2023-09-04 12:00:02.028093,2023-09-04 12:00:02.430753,0 days 00:00:00.402660,Leaky,ReLU,,,71,21,11.0,,,0.019793978706106684,2,413,0.5079080217001559,0.0003415749390236317,83.84666243843411,COMPLETE
104,0.11929899454116821,2023-09-04 12:00:02.431035,2023-09-04 12:00:03.024647,0 days 00:00:00.593612,Leaky,ReLU,,,83,20,14.0,,,0.010103819723591699,2,427,0.6381215245725929,0.00047272759831908486,261.7834811056814,COMPLETE
105,0.2294204980134964,2023-09-04 12:00:03.024909,2023-09-04 12:00:03.485049,0 days 00:00:00.460140,Leaky,ReLU,,,80,20,14.0,,,0.008148480343495891,2,400,0.6455948101373007,0.0004429523793082726,111.09046803350034,COMPLETE
106,0.2452675849199295,2023-09-04 12:00:03.485305,2023-09-04 12:00:04.110505,0 days 00:00:00.625200,Sigmoid,ReLU,,,56,21,16.0,,,0.009744193387392434,2,426,0.6997010510949274,0.0007278371076992653,170.53449882344998,COMPLETE
107,0.10408629477024078,2023-09-04 12:00:04.110766,2023-09-04 12:00:04.751637,0 days 00:00:00.640871,ReLU,ReLU,,,75,17,15.0,,,0.013992400319091741,2,458,0.7945369614448473,0.0009246819984286182,73.99724442104123,COMPLETE
108,0.1335800290107727,2023-09-04 12:00:04.751924,2023-09-04 12:00:05.494018,0 days 00:00:00.742094,ReLU,ReLU,,,83,17,15.0,,,0.013870786355325447,2,474,0.7806594031928373,0.001001811212952727,71.22856979370117,COMPLETE
109,0.11033570021390915,2023-09-04 12:00:05.494276,2023-09-04 12:00:06.319659,0 days 00:00:00.825383,ReLU,ReLU,,,75,17,17.0,,,0.013771488883130846,2,473,0.7913526579928148,0.001057090481933409,65.20216745570086,COMPLETE
110,0.18937672674655914,2023-09-04 12:00:06.319939,2023-09-04 12:00:06.999666,0 days 00:00:00.679727,ReLU,ReLU,,,74,17,18.0,,,0.012244907154345641,2,472,0.795115578223758,0.0008698440630333927,97.0173168182373,COMPLETE
111,0.1730177253484726,2023-09-04 12:00:06.999945,2023-09-04 12:00:07.644615,0 days 00:00:00.644670,ReLU,ReLU,,,77,16,15.0,,,0.013284478865209995,2,462,0.7308814903943124,0.0010236301057606864,116.22386605398995,COMPLETE
112,0.22478406131267548,2023-09-04 12:00:07.644906,2023-09-04 12:00:07.980706,0 days 00:00:00.335800,ReLU,ReLU,,,80,15,17.0,,,0.010942455351020832,2,484,0.7621629391529984,0.0004782875587295595,78.4879811150687,COMPLETE
113,0.1472269743680954,2023-09-04 12:00:07.980977,2023-09-04 12:00:08.471629,0 days 00:00:00.490652,ReLU,ReLU,,,75,16,20.0,,,0.027987476649783793,2,458,0.7897630057394988,0.00060363393588268,76.11798751048552,COMPLETE
114,0.15677691996097565,2023-09-04 12:00:08.471921,2023-09-04 12:00:09.041838,0 days 00:00:00.569917,ReLU,ReLU,,,70,16,20.0,,,0.025572711273268756,2,459,0.7989355364565749,0.0016124046847594475,68.98339684064999,COMPLETE
115,0.149693101644516,2023-09-04 12:00:09.042105,2023-09-04 12:00:09.780568,0 days 00:00:00.738463,ReLU,Tanh,,,74,18,21.0,,,0.015068653669052875,2,432,0.7693609717955489,0.0009902933130927368,69.9449515024821,COMPLETE
116,0.12506245076656342,2023-09-04 12:00:09.780840,2023-09-04 12:00:10.419127,0 days 00:00:00.638287,ReLU,Tanh,,,75,17,22.0,,,0.02964601778072549,2,499,0.7527526988365989,0.0009612354521958266,79.12915837989664,COMPLETE
117,0.20683754980564117,2023-09-04 12:00:10.419388,2023-09-04 12:00:10.936489,0 days 00:00:00.517101,ReLU,Tanh,,,82,17,16.0,,,0.029858651962516653,2,495,0.744395935019547,0.0011780758564603202,86.55119555929433,COMPLETE
118,0.14983531832695007,2023-09-04 12:00:10.936765,2023-09-04 12:00:11.619930,0 days 00:00:00.683165,ReLU,Tanh,,,76,15,24.0,,,0.020641133247716086,2,498,0.7181009146493387,0.0008533280782278993,107.79249772869173,COMPLETE
119,0.1361863911151886,2023-09-04 12:00:11.620188,2023-09-04 12:00:12.628997,0 days 00:00:01.008809,ReLU,Tanh,,,84,17,22.0,,,0.007670901475841353,2,473,0.7450266773484674,0.0006405202334727446,304.62159261395857,COMPLETE
120,0.0983474850654602,2023-09-04 12:00:12.629261,2023-09-04 12:00:13.463879,0 days 00:00:00.834618,ReLU,Tanh,,,83,17,23.0,,,0.008187653801097788,2,475,0.7960891369241961,0.0005257906027617773,65.66623693116954,COMPLETE
121,0.1800716370344162,2023-09-04 12:00:13.464144,2023-09-04 12:00:14.018518,0 days 00:00:00.554374,ReLU,Tanh,,,83,17,23.0,,,0.00773758878011253,2,473,0.7991699023664134,0.0005123123607572371,192.9266078783118,COMPLETE
122,0.17112018167972565,2023-09-04 12:00:14.018820,2023-09-04 12:00:14.853685,0 days 00:00:00.834865,ReLU,Tanh,,,81,16,22.0,,,0.005121787135965062,2,481,0.752774041493503,0.0005937434163754817,77.24660532633463,COMPLETE
123,0.21416252851486206,2023-09-04 12:00:14.853964,2023-09-04 12:00:15.009512,0 days 00:00:00.155548,ReLU,Tanh,,,87,18,23.0,,,0.0431937565192538,2,450,0.7038454266418885,0.0011096781743514948,96.76943969726562,COMPLETE
124,0.1139470785856247,2023-09-04 12:00:15.009774,2023-09-04 12:00:16.441828,0 days 00:00:01.432054,ReLU,Tanh,,,78,14,21.0,,,0.006242689444000003,2,466,0.7649548134045089,0.0007143632046892149,62.10809759521484,COMPLETE
125,0.13776680827140808,2023-09-04 12:00:16.442093,2023-09-04 12:00:18.139494,0 days 00:00:01.697401,ReLU,Tanh,,,79,14,21.0,,,0.006063488707370745,2,471,0.7441703993465054,0.0014819879929543578,118.72728670181766,COMPLETE
126,0.19261498749256134,2023-09-04 12:00:18.139777,2023-09-04 12:00:18.521925,0 days 00:00:00.382148,ReLU,Tanh,,,78,14,22.0,,,0.0074046964163402415,2,466,0.6867732937616169,0.0018560426354008468,93.05325317382812,COMPLETE
127,0.18868094682693481,2023-09-04 12:00:18.522200,2023-09-04 12:00:19.099806,0 days 00:00:00.577606,ReLU,Tanh,,,84,14,22.0,,,0.008649447885217461,2,491,0.7534255273952106,0.002165852572336683,88.72076276632455,COMPLETE
128,0.13903851807117462,2023-09-04 12:00:19.100088,2023-09-04 12:00:20.032676,0 days 00:00:00.932588,ReLU,Tanh,,,86,15,21.0,,,0.004514715117091619,2,478,0.7703993620727342,0.0016522419539946797,99.32052500655011,COMPLETE
129,0.20144252479076385,2023-09-04 12:00:20.032979,2023-09-04 12:00:20.777250,0 days 00:00:00.744271,ReLU,Tanh,,,79,17,21.0,,,0.010788922677284457,2,466,0.7148357117294779,0.001411927976506731,930.6786597756778,COMPLETE
130,0.1943279206752777,2023-09-04 12:00:20.777519,2023-09-04 12:00:21.889643,0 days 00:00:01.112124,ReLU,Tanh,,,84,15,24.0,,,0.006236114957044399,2,443,0.6736327924516176,0.0008080798418365974,87.23498096297273,COMPLETE
131,0.12731806933879852,2023-09-04 12:00:21.889957,2023-09-04 12:00:23.366849,0 days 00:00:01.476892,ReLU,Tanh,,,81,13,23.0,,,0.006126426293007642,2,483,0.7341602490496238,0.0009864345318032028,81.58062037715206,COMPLETE
132,0.22242029011249542,2023-09-04 12:00:23.367121,2023-09-04 12:00:24.082055,0 days 00:00:00.714934,ReLU,Tanh,,,81,13,15.0,,,0.0069260400051419976,2,487,0.7505260426925924,0.0010139992434326465,97.6998062133789,COMPLETE
133,0.2249131053686142,2023-09-04 12:00:24.082323,2023-09-04 12:00:24.944279,0 days 00:00:00.861956,ReLU,Tanh,,,78,19,23.0,,,0.009256481749718793,2,469,0.7300033360151996,0.0012492942960495566,97.62768837074181,COMPLETE
134,0.1328967958688736,2023-09-04 12:00:24.944544,2023-09-04 12:00:26.133917,0 days 00:00:01.189373,ReLU,Tanh,,,76,14,20.0,,,0.002925025333309641,2,451,0.6875864274513913,0.000706665470172406,124.01481802421704,COMPLETE
135,0.2141391932964325,2023-09-04 12:00:26.134182,2023-09-04 12:00:27.818257,0 days 00:00:01.684075,ReLU,Tanh,,,76,14,20.0,,,0.005208073890386658,2,454,0.7970384054428227,0.0006808197114233902,74.99461202827288,COMPLETE
136,0.22794488072395325,2023-09-04 12:00:27.818527,2023-09-04 12:00:28.599809,0 days 00:00:00.781282,ReLU,Tanh,,,83,13,22.0,,,0.002855763861718502,2,496,0.6923078349996694,0.0008961938381470947,83.29797559035451,COMPLETE
137,0.22042728960514069,2023-09-04 12:00:28.600082,2023-09-04 12:00:29.116905,0 days 00:00:00.516823,ReLU,Tanh,,,87,17,18.0,,,0.003575843678354339,2,437,0.7669465230935675,0.0005132634460259147,88.60795510333517,COMPLETE
138,0.22210697829723358,2023-09-04 12:00:29.117178,2023-09-04 12:00:29.902571,0 days 00:00:00.785393,ReLU,Tanh,,,73,18,19.0,,,0.004410118684427804,2,480,0.7172232599506103,0.0007522280096157112,103.36681487594825,COMPLETE
139,0.22075311839580536,2023-09-04 12:00:29.902850,2023-09-04 12:00:30.752220,0 days 00:00:00.849370,Tanh,Tanh,,,89,13,21.0,,,0.005641328174082761,2,449,0.6686718324343968,0.0010129556079973723,111.66360213539816,COMPLETE
140,0.22633948922157288,2023-09-04 12:00:30.752486,2023-09-04 12:00:31.211131,0 days 00:00:00.458645,ReLU,Tanh,,,81,15,22.0,,,0.008046552286199644,2,487,0.799793471039052,0.0006773215885777007,89.94219908843169,COMPLETE
141,0.20178820192813873,2023-09-04 12:00:31.211448,2023-09-04 12:00:31.751084,0 days 00:00:00.539636,ReLU,Tanh,,,79,14,14.0,,,0.010532955336161508,2,461,0.7369210644555534,0.0013987834726267403,76.08646750450134,COMPLETE
142,0.18968231976032257,2023-09-04 12:00:31.751368,2023-09-04 12:00:32.303290,0 days 00:00:00.551922,ReLU,Tanh,,,91,17,23.0,,,0.012145447583561503,2,473,0.6982515194439122,0.0011788699431695886,112.31257163153754,COMPLETE
143,0.2419985830783844,2023-09-04 12:00:32.303565,2023-09-04 12:00:32.795762,0 days 00:00:00.492197,ReLU,Tanh,,,83,15,24.0,,,0.006544395668477054,2,499,0.7577907379272283,0.0015790095373554853,93.58559861294059,COMPLETE
144,0.21311716735363007,2023-09-04 12:00:32.796040,2023-09-04 12:00:34.023262,0 days 00:00:01.227222,ReLU,Sigmoid,,,76,18,21.0,,,0.009007360265739459,2,438,0.6275482004237153,0.0007927369474215526,125.18667971898638,COMPLETE
145,0.22615182399749756,2023-09-04 12:00:34.023539,2023-09-04 12:00:34.292470,0 days 00:00:00.268931,ReLU,Tanh,,,85,16,15.0,,,0.014675489484256501,2,417,0.6724454024813106,0.0022466812368875603,199.0897543334961,COMPLETE
146,0.10341379791498184,2023-09-04 12:00:34.292744,2023-09-04 12:00:35.402068,0 days 00:00:01.109324,ReLU,Tanh,,,78,13,19.0,,,0.00753575334264098,2,453,0.7080261583737794,0.0009249167605605969,67.48697643835568,COMPLETE
147,0.18060562014579773,2023-09-04 12:00:35.402355,2023-09-04 12:00:36.875772,0 days 00:00:01.473417,Sigmoid,Tanh,,,80,14,19.0,,,0.00429435103710828,2,451,0.7383837225424519,0.0005336369748591065,93.6287312902006,COMPLETE
148,0.20270898938179016,2023-09-04 12:00:36.876047,2023-09-04 12:00:37.371843,0 days 00:00:00.495796,ReLU,Tanh,,,77,11,20.0,,,0.007350318464314875,2,466,0.7010475158448819,0.0009117263540438828,78.01428875393337,COMPLETE
149,0.13535936176776886,2023-09-04 12:00:37.372150,2023-09-04 12:00:39.356113,0 days 00:00:01.983963,ReLU,Tanh,,,73,12,17.0,,,0.0024125419707569018,2,428,0.7674030553702865,0.0006363888695783592,78.4661229224432,COMPLETE
150,0.18397271633148193,2023-09-04 12:00:39.356474,2023-09-04 12:00:40.285546,0 days 00:00:00.929072,ReLU,Tanh,,,73,12,17.0,,,0.002589650331175889,2,428,0.773606881193966,0.0006344526789285519,83.25940036773682,COMPLETE
151,0.16215316951274872,2023-09-04 12:00:40.285829,2023-09-04 12:00:41.236352,0 days 00:00:00.950523,ReLU,Tanh,,,81,13,17.0,,,0.006217645880911884,2,478,0.7242734060766709,0.00043233110017463057,70.36287715517241,COMPLETE
152,0.21195708215236664,2023-09-04 12:00:41.236627,2023-09-04 12:00:42.040806,0 days 00:00:00.804179,ReLU,Tanh,,,72,19,16.0,,,0.003716222411768649,2,445,0.765774378153458,0.0007457003984917824,75.15233711829552,COMPLETE
153,0.23789876699447632,2023-09-04 12:00:42.041097,2023-09-04 12:00:43.409585,0 days 00:00:01.368488,ReLU,Tanh,,,75,13,18.0,,,0.0019511341418332441,2,458,0.7040447462922195,0.0010658922572067183,82.2339330444336,COMPLETE
154,0.21498946845531464,2023-09-04 12:00:43.409868,2023-09-04 12:00:45.927892,0 days 00:00:02.518024,ReLU,Tanh,,,86,7,20.0,,,0.005226874554362242,2,484,0.7430765337478482,0.00033997758174554143,90.93223628524906,COMPLETE
155,0.31350407004356384,2023-09-04 12:00:45.928165,2023-09-04 12:00:46.404020,0 days 00:00:00.475855,ReLU,Tanh,,,78,14,19.0,,,0.01189828524842761,2,434,0.7982743830669741,0.0005845734876364379,85.83881336933858,COMPLETE
156,0.14713269472122192,2023-09-04 12:00:46.404309,2023-09-04 12:00:47.025290,0 days 00:00:00.620981,ReLU,Tanh,,,68,15,22.0,,,0.008169205670356686,2,471,0.6607277092333229,0.0008663986604595272,94.58713616265192,COMPLETE
157,0.12007555365562439,2023-09-04 12:00:47.025595,2023-09-04 12:00:48.605046,0 days 00:00:01.579451,ReLU,Tanh,,,83,17,21.0,,,0.009910052231061452,2,421,0.7684409797241478,0.00046488361047487397,78.42345279666549,COMPLETE
158,0.13642357289791107,2023-09-04 12:00:48.605350,2023-09-04 12:00:49.039686,0 days 00:00:00.434336,ReLU,Tanh,,,83,17,16.0,,,0.014746414259798033,2,406,0.7687193375226904,0.0003815233961479567,93.14366255866156,COMPLETE
159,0.13429303467273712,2023-09-04 12:00:49.039965,2023-09-04 12:00:50.256873,0 days 00:00:01.216908,ReLU,Sigmoid,,,89,18,23.0,,,0.009979704356461045,2,453,0.687407298559905,0.0004737942993124237,77.74338077363514,COMPLETE
160,0.20271243155002594,2023-09-04 12:00:50.257149,2023-09-04 12:00:50.856520,0 days 00:00:00.599371,Tanh,Sigmoid,,,90,18,23.0,,,0.01747121968936115,2,424,0.7005563715920788,0.0005012828037483153,1313.0658732096354,COMPLETE
161,0.21879857778549194,2023-09-04 12:00:50.856788,2023-09-04 12:00:51.715108,0 days 00:00:00.858320,ReLU,Sigmoid,,,87,16,22.0,,,0.011976555143734666,2,442,0.7291524440441148,0.00045739851978721953,84.6890127999442,COMPLETE
162,0.16380125284194946,2023-09-04 12:00:51.715377,2023-09-04 12:00:52.406147,0 days 00:00:00.690770,ReLU,Sigmoid,,,93,17,23.0,,,0.008423894867532127,2,418,0.6815720831602209,0.0006533314068598097,79.00033982594807,COMPLETE
163,0.18967056274414062,2023-09-04 12:00:52.406414,2023-09-04 12:00:52.844737,0 days 00:00:00.438323,ReLU,Sigmoid,,,82,18,24.0,,,0.010118847100210382,2,454,0.7793787192956106,0.0005468047163757142,94.95550473531087,COMPLETE
164,0.19397728145122528,2023-09-04 12:00:52.845020,2023-09-04 12:00:53.444661,0 days 00:00:00.599641,ReLU,Tanh,,,85,16,18.0,,,0.009849339466476273,2,433,0.6531844101295844,0.0003430737242564778,89.21322825803595,COMPLETE
165,0.1781487762928009,2023-09-04 12:00:53.444946,2023-09-04 12:00:55.076461,0 days 00:00:01.631515,ReLU,Tanh,,,92,17,15.0,,,0.0014408365536842031,2,461,0.7989166521027329,0.0007220156264167657,76.90778376432073,COMPLETE
166,0.14932316541671753,2023-09-04 12:00:55.076740,2023-09-04 12:00:55.779086,0 days 00:00:00.702346,ReLU,Sigmoid,,,88,19,21.0,,,0.02231510514478875,2,449,0.7193424541378305,0.0004539761099338884,90.19292517269359,COMPLETE
167,0.10553734749555588,2023-09-04 12:00:55.779373,2023-09-04 12:00:56.456971,0 days 00:00:00.677598,ReLU,Tanh,,,95,16,22.0,,,0.013427016698915089,2,482,0.7541499636157523,0.0008489619403445623,76.49040337764856,COMPLETE
168,0.21218730509281158,2023-09-04 12:00:56.457242,2023-09-04 12:00:56.886835,0 days 00:00:00.429593,ReLU,Tanh,,,74,16,14.0,,,0.014296421833832753,2,490,0.6244290147201369,0.0010202993255968144,98.76799439220893,COMPLETE
169,0.21432051062583923,2023-09-04 12:00:56.887126,2023-09-04 12:00:57.185228,0 days 00:00:00.298102,ReLU,Tanh,,,98,16,20.0,,,0.01851708977987312,2,483,0.6834521115564766,0.0011202508676793098,108.48165079752604,COMPLETE
170,0.24396702647209167,2023-09-04 12:00:57.185517,2023-09-04 12:00:58.197902,0 days 00:00:01.012385,Sigmoid,Leaky,,,94,15,19.0,,,0.01324397613707127,2,464,0.7651441919222944,0.0008393055288931252,106.72596268801345,COMPLETE
171,0.23105673491954803,2023-09-04 12:00:58.198180,2023-09-04 12:00:58.678577,0 days 00:00:00.480397,ReLU,Tanh,,,84,17,22.0,,,0.007410449650865957,2,480,0.7356648626629221,0.00062046980984212,281.2624428488991,COMPLETE
172,0.2353208065032959,2023-09-04 12:00:58.678870,2023-09-04 12:00:58.928888,0 days 00:00:00.250018,ReLU,Tanh,,,95,18,23.0,,,0.01042311084790567,2,500,0.26961049224428807,0.0007480674629459301,178.4001472736227,COMPLETE
173,0.17656239867210388,2023-09-04 12:00:58.929202,2023-09-04 12:00:59.226544,0 days 00:00:00.297342,ReLU,Tanh,,,89,17,21.0,,,0.008921721432420962,2,440,0.7512442780795426,0.0005495402824638914,82.05239985539363,COMPLETE
174,0.13148316740989685,2023-09-04 12:00:59.226828,2023-09-04 12:00:59.981833,0 days 00:00:00.755005,ReLU,Tanh,,,81,18,13.0,,,0.011561196756444493,2,474,0.7126106008120381,0.00029279744857978754,61.77418648856027,COMPLETE
175,0.132033571600914,2023-09-04 12:00:59.982104,2023-09-04 12:01:00.578865,0 days 00:00:00.596761,ReLU,Tanh,,,81,18,14.0,,,0.011639586442951873,2,455,0.7047240197516629,0.00030579918094529254,86.49046189444405,COMPLETE
176,0.17007704079151154,2023-09-04 12:01:00.579147,2023-09-04 12:01:01.035343,0 days 00:00:00.456196,ReLU,Tanh,,,80,18,13.0,,,0.011770506686266445,2,454,0.3730198989613833,0.0003032987582072119,219.79759035612406,COMPLETE
177,0.11001628637313843,2023-09-04 12:01:01.035638,2023-09-04 12:01:01.984887,0 days 00:00:00.949249,ReLU,ReLU,,,82,19,13.0,,,0.01601418265282369,2,467,0.7054725261525577,0.00040856056274232857,72.95698721143934,COMPLETE
178,0.1857677698135376,2023-09-04 12:01:01.985165,2023-09-04 12:01:02.404253,0 days 00:00:00.419088,ReLU,ReLU,,,82,19,13.0,,,0.015923277472413035,2,488,0.6613104367854146,0.00033982726989884276,65.02575562639935,COMPLETE
179,0.25138604640960693,2023-09-04 12:01:02.404527,2023-09-04 12:01:02.728817,0 days 00:00:00.324290,ReLU,ReLU,,,78,19,14.0,,,0.01923652799293469,2,466,0.7134324287666353,0.00024410953995928185,93.43827302115304,COMPLETE
180,0.1598859429359436,2023-09-04 12:01:02.729091,2023-09-04 12:01:03.194149,0 days 00:00:00.465058,ReLU,ReLU,,,81,17,13.0,,,0.022364418987378374,2,473,0.6353032055905636,0.0001599032125920547,72.58261609077454,COMPLETE
181,0.14557881653308868,2023-09-04 12:01:03.194429,2023-09-04 12:01:03.856823,0 days 00:00:00.662394,ReLU,ReLU,,,86,18,14.0,,,0.013307274789622632,2,456,0.7009700761101022,0.00031148466847030857,83.35452330112457,COMPLETE
182,0.14143460988998413,2023-09-04 12:01:03.857093,2023-09-04 12:01:04.440309,0 days 00:00:00.583216,ReLU,ReLU,,,76,18,15.0,,,0.01133333458294367,2,449,0.6872873855244536,0.000407135853850559,72.36784988979123,COMPLETE
183,0.15589536726474762,2023-09-04 12:01:04.440683,2023-09-04 12:01:05.299429,0 days 00:00:00.858746,ReLU,Tanh,,,80,18,14.0,,,0.01572017302066414,2,478,0.7176862809957281,0.00021450669048548343,64.51422838621502,COMPLETE
184,0.2384098768234253,2023-09-04 12:01:05.299708,2023-09-04 12:01:05.630608,0 days 00:00:00.330900,ReLU,ReLU,,,84,17,13.0,,,0.01001327767055767,2,465,0.6005686065253403,0.000272739498679817,97.21699693467882,COMPLETE
185,0.18075458705425262,2023-09-04 12:01:05.630902,2023-09-04 12:01:06.314655,0 days 00:00:00.683753,ReLU,Leaky,,,82,16,14.0,,,0.012894801958395725,2,491,0.6679149668068767,0.00043495817623575786,74.87692150171252,COMPLETE
186,0.14358022809028625,2023-09-04 12:01:06.314941,2023-09-04 12:01:07.022403,0 days 00:00:00.707462,ReLU,Tanh,,,91,19,12.0,,,0.008927685572889386,2,445,0.737893927392731,0.0004829614187967961,73.3925568636726,COMPLETE
187,0.11032533645629883,2023-09-04 12:01:07.022697,2023-09-04 12:01:07.871171,0 days 00:00:00.848474,ReLU,Sigmoid,,,88,17,15.0,,,0.015698961330573746,2,459,0.7980883248741176,0.0001299349713009857,65.45326503954436,COMPLETE
188,0.2275848239660263,2023-09-04 12:01:07.871449,2023-09-04 12:01:08.231886,0 days 00:00:00.360437,ReLU,Tanh,,,77,16,15.0,,,0.017430770167622057,2,462,0.7951402418780018,0.00013981733593784813,83.64196477617536,COMPLETE
189,0.1245015412569046,2023-09-04 12:01:08.232181,2023-09-04 12:01:08.817171,0 days 00:00:00.584990,ReLU,ReLU,,,85,16,16.0,,,0.023668956978647657,2,477,0.769175024580568,7.942372844803236e-05,101.39779721773587,COMPLETE
190,0.21550048887729645,2023-09-04 12:01:08.817459,2023-09-04 12:01:09.505504,0 days 00:00:00.688045,ReLU,ReLU,,,87,15,15.0,,,0.020497904293333258,2,482,0.7621543819799295,8.105961563808722e-05,79.03700721263885,COMPLETE
191,0.2627049684524536,2023-09-04 12:01:09.505790,2023-09-04 12:01:09.921343,0 days 00:00:00.415553,ReLU,ReLU,,,86,16,16.0,,,0.027409966688495175,2,473,0.7745843235165264,0.00011377400044584534,113.55103868756976,COMPLETE
192,0.11982619017362595,2023-09-04 12:01:09.921620,2023-09-04 12:01:10.540890,0 days 00:00:00.619270,ReLU,ReLU,,,83,17,16.0,,,0.034296946377749424,2,180,0.7970560773759662,4.8325491406866305e-05,58.020777576374556,COMPLETE
193,0.18108902871608734,2023-09-04 12:01:10.541171,2023-09-04 12:01:11.229318,0 days 00:00:00.688147,ReLU,ReLU,,,80,17,16.0,,,0.04397707845186328,2,196,0.7312197107539612,6.701801077187832e-05,98.02301837551978,COMPLETE
