number,value,datetime_start,datetime_complete,duration,params_activation1,params_activation2,params_activation3,params_activation4,params_batch_size,params_fl1,params_fl2,params_fl3,params_fl4,params_learning_rate,params_n_layers,params_num_epochs,params_train_size,params_weight_decay,user_attrs_mre,state
280,0.19740931689739227,2023-09-04 12:05:09.053693,2023-09-04 12:05:09.487916,0 days 00:00:00.434223,ReLU,Tanh,Sigmoid,,83,19,22.0,11.0,,0.020733612441476187,3,112,0.5968911468823511,0.00023512236128028714,102.04400732578375,COMPLETE
281,0.19066771864891052,2023-09-04 12:05:09.488352,2023-09-04 12:05:09.841200,0 days 00:00:00.352848,ReLU,Tanh,Sigmoid,,86,20,22.0,12.0,,0.017517708059223876,3,90,0.5923831959537486,0.0001606661718125454,77.26204884052277,COMPLETE
282,0.20794928073883057,2023-09-04 12:05:09.841638,2023-09-04 12:05:10.199862,0 days 00:00:00.358224,ReLU,Tanh,Sigmoid,,84,19,23.0,11.0,,0.02409772516403727,3,99,0.6177655723765828,0.0003050896530944621,94.02140242053616,COMPLETE
283,0.19994378089904785,2023-09-04 12:05:10.200299,2023-09-04 12:05:10.761882,0 days 00:00:00.561583,ReLU,Tanh,Sigmoid,,80,19,22.0,12.0,,0.014534298791091515,3,100,0.640088570538343,0.000211543211318351,94.81981627795162,COMPLETE
284,0.2000184953212738,2023-09-04 12:05:10.762297,2023-09-04 12:05:11.238917,0 days 00:00:00.476620,ReLU,Tanh,Sigmoid,,88,20,24.0,13.0,,0.012983800644604181,3,80,0.5167973013214981,0.00018169000615206703,84.4035429587731,COMPLETE
285,0.24039305746555328,2023-09-04 12:05:11.239234,2023-09-04 12:05:11.396126,0 days 00:00:00.156892,ReLU,,,,81,20,,,,0.020110096017999905,1,146,0.28524839518760003,0.012991094711683047,91.32362966826467,COMPLETE
286,0.20692797005176544,2023-09-04 12:05:11.396441,2023-09-04 12:05:11.894593,0 days 00:00:00.498152,ReLU,Tanh,Sigmoid,,87,18,23.0,12.0,,0.01624006772085248,3,130,0.614621539374536,0.0002572449235657546,85.60185345736417,COMPLETE
287,0.19832371175289154,2023-09-04 12:05:11.894927,2023-09-04 12:05:12.391669,0 days 00:00:00.496742,ReLU,Tanh,Sigmoid,,85,18,23.0,11.0,,0.010744519801959241,3,117,0.5423492039805101,0.0002947052925530986,163.51322577981387,COMPLETE
288,0.19252145290374756,2023-09-04 12:05:12.392014,2023-09-04 12:05:12.972307,0 days 00:00:00.580293,ReLU,Tanh,Sigmoid,,82,17,24.0,13.0,,0.027755492506590804,3,66,0.6633172805160772,0.00013654526491015798,100.15783411142777,COMPLETE
289,0.22309710085391998,2023-09-04 12:05:12.972656,2023-09-04 12:05:13.705103,0 days 00:00:00.732447,ReLU,Tanh,Sigmoid,,40,19,22.0,13.0,,0.012520880395576223,3,148,0.5592942278544746,0.0013821599295320744,495.67157849398524,COMPLETE
290,0.22007431089878082,2023-09-04 12:05:13.705443,2023-09-04 12:05:14.520245,0 days 00:00:00.814802,ReLU,Tanh,Sigmoid,,89,17,21.0,11.0,,0.0005815934676333298,3,125,0.35901841811765517,0.00040916563153897787,117.50353387451172,COMPLETE
291,0.19670695066452026,2023-09-04 12:05:14.520579,2023-09-04 12:05:14.851513,0 days 00:00:00.330934,ReLU,Tanh,Sigmoid,,87,18,23.0,12.0,,0.014625194059679597,3,106,0.6917873857056858,0.00058532957978802,98.17748260498047,COMPLETE
292,0.22171610593795776,2023-09-04 12:05:14.851852,2023-09-04 12:05:16.466381,0 days 00:00:01.614529,ReLU,Tanh,Sigmoid,,81,20,24.0,14.0,,0.00039841811621863307,3,136,0.5860649371082356,0.002493367756944808,104.08464218588436,COMPLETE
293,0.1941923052072525,2023-09-04 12:05:16.466722,2023-09-04 12:05:17.071778,0 days 00:00:00.605056,ReLU,Tanh,Sigmoid,,86,21,22.0,13.0,,0.010769024084770621,3,156,0.573557437139584,0.0001938246385714549,133.5659969329834,COMPLETE
294,0.20365048944950104,2023-09-04 12:05:17.072113,2023-09-04 12:05:17.651716,0 days 00:00:00.579603,ReLU,Tanh,Sigmoid,,59,17,23.0,11.0,,0.010099065233126403,3,95,0.6454561255894458,0.00035399209497788663,110.42863352705793,COMPLETE
295,0.21945936977863312,2023-09-04 12:05:17.652195,2023-09-04 12:05:17.974871,0 days 00:00:00.322676,ReLU,Tanh,Tanh,,90,16,24.0,15.0,,0.018092145479083884,3,327,0.7702030938749478,0.00024037738485431653,110.29493268330891,COMPLETE
296,0.21830669045448303,2023-09-04 12:05:17.975300,2023-09-04 12:05:18.865038,0 days 00:00:00.889738,ReLU,Tanh,Sigmoid,,79,17,23.0,12.0,,0.008704642198008542,3,143,0.7366076363599317,0.00011111491292272481,77.20278908549875,COMPLETE
297,0.21777819097042084,2023-09-04 12:05:18.865364,2023-09-04 12:05:19.393517,0 days 00:00:00.528153,Sigmoid,Tanh,Sigmoid,,85,18,22.0,24.0,,0.013126202258929092,3,129,0.6899132249587813,0.00015740934745864588,93.41142359646884,COMPLETE
298,0.2184203714132309,2023-09-04 12:05:19.393856,2023-09-04 12:05:19.697845,0 days 00:00:00.303989,ReLU,Tanh,Sigmoid,,83,19,21.0,14.0,,0.0847495530623859,3,120,0.7693953867760611,0.0002922752167984984,406.0968983968099,COMPLETE
299,0.22189345955848694,2023-09-04 12:05:19.698172,2023-09-04 12:05:20.133148,0 days 00:00:00.434976,ReLU,Sigmoid,Sigmoid,,88,16,24.0,13.0,,0.007197024196354696,3,153,0.40782585896188467,0.00044815045022471344,596.3763477763191,COMPLETE
300,0.22400791943073273,2023-09-04 12:05:20.133484,2023-09-04 12:05:21.452795,0 days 00:00:01.319311,ReLU,Tanh,Sigmoid,,77,16,23.0,15.0,,0.001261655243996047,3,427,0.6140167208271311,0.00021330408513873847,93.15358934246126,COMPLETE
301,0.19970238208770752,2023-09-04 12:05:21.453129,2023-09-04 12:05:21.962710,0 days 00:00:00.509581,ReLU,Tanh,Sigmoid,,53,17,24.0,14.0,,0.009430256441345618,3,111,0.714606043267285,0.00034010740049758456,117.88210957845052,COMPLETE
302,0.21913635730743408,2023-09-04 12:05:21.963035,2023-09-04 12:05:23.903837,0 days 00:00:01.940802,ReLU,ReLU,Sigmoid,,58,17,23.0,13.0,,0.0007551229921665083,3,139,0.6635695344837408,0.0001248542264473388,269.3656457036519,COMPLETE
303,0.15516424179077148,2023-09-04 12:05:23.904168,2023-09-04 12:05:24.673744,0 days 00:00:00.769576,ReLU,ReLU,Sigmoid,,62,16,22.0,12.0,,0.015946334815419315,3,161,0.7997838240064945,0.0002406219427885882,72.5859923667096,COMPLETE
304,0.24020692706108093,2023-09-04 12:05:24.674077,2023-09-04 12:05:24.911023,0 days 00:00:00.236946,ReLU,Tanh,Sigmoid,,74,18,22.0,12.0,,0.016478389549744513,3,158,0.31051961147347107,0.0008185771196619991,104.27824716007008,COMPLETE
305,0.16565321385860443,2023-09-04 12:05:24.911350,2023-09-04 12:05:25.405842,0 days 00:00:00.494492,Tanh,ReLU,Sigmoid,,61,16,22.0,10.0,,0.0231079512684446,3,132,0.7956444208843739,0.0001822915110608907,117.0578542248956,COMPLETE
306,0.1868225783109665,2023-09-04 12:05:25.406172,2023-09-04 12:05:26.062657,0 days 00:00:00.656485,Tanh,ReLU,Sigmoid,,62,16,21.0,10.0,,0.021332881980251815,3,148,0.7988928584556404,0.00017198465480337453,71.41964741242238,COMPLETE
307,0.19475694000720978,2023-09-04 12:05:26.063035,2023-09-04 12:05:26.748744,0 days 00:00:00.685709,Tanh,Leaky,Sigmoid,,62,16,22.0,9.0,,0.021066553080338838,3,136,0.7991737384919801,0.00019991182219440665,74.63173889532322,COMPLETE
308,0.18409255146980286,2023-09-04 12:05:26.749079,2023-09-04 12:05:27.325756,0 days 00:00:00.576677,Tanh,ReLU,Sigmoid,,61,4,22.0,10.0,,0.016382439458732006,3,163,0.7540053638696224,0.0001443850388939885,78.18494987487793,COMPLETE
309,0.201066255569458,2023-09-04 12:05:27.326082,2023-09-04 12:05:27.911785,0 days 00:00:00.585703,Tanh,Tanh,ReLU,,60,15,23.0,10.0,,0.027807706283652613,3,148,0.7747252956005398,0.00025158116658682915,91.08396323067801,COMPLETE
310,0.19063833355903625,2023-09-04 12:05:27.912111,2023-09-04 12:05:29.444302,0 days 00:00:01.532191,Tanh,ReLU,Sigmoid,,91,17,20.0,11.0,,0.0009253066720969872,3,130,0.7983539142097205,6.652395175004144e-05,169.2688514513847,COMPLETE
311,0.19841258227825165,2023-09-04 12:05:29.444666,2023-09-04 12:05:31.136173,0 days 00:00:01.691507,ReLU,Tanh,Sigmoid,,20,15,23.0,11.0,,0.024439557465801377,3,142,0.7472018399114319,0.00018160923763622879,140.02691107855904,COMPLETE
312,0.21017326414585114,2023-09-04 12:05:31.136504,2023-09-04 12:05:33.043052,0 days 00:00:01.906548,ReLU,ReLU,Sigmoid,,58,16,22.0,13.0,,0.00025477174160205515,3,125,0.7179832404879598,9.057085047993933e-05,89.62115771484375,COMPLETE
313,0.18193380534648895,2023-09-04 12:05:33.043380,2023-09-04 12:05:33.444861,0 days 00:00:00.401481,ReLU,ReLU,Sigmoid,,82,16,23.0,14.0,,0.018582136506732575,3,165,0.5861804974779218,0.0002867797641102211,100.24251456009715,COMPLETE
314,0.20129963755607605,2023-09-04 12:05:33.445186,2023-09-04 12:05:33.950142,0 days 00:00:00.504956,ReLU,Tanh,Sigmoid,,64,17,22.0,9.0,,0.012829471772854458,3,156,0.69027900688363,0.00021453074408909676,129.05589621407645,COMPLETE
315,0.19265009462833405,2023-09-04 12:05:33.950469,2023-09-04 12:05:34.386496,0 days 00:00:00.436027,Tanh,ReLU,Sigmoid,,84,16,23.0,14.0,,0.015004298523459287,3,372,0.6351414735713682,0.0001314198735176481,140.5810979207357,COMPLETE
316,0.19556012749671936,2023-09-04 12:05:34.386844,2023-09-04 12:05:34.638915,0 days 00:00:00.252071,ReLU,Tanh,Sigmoid,,89,15,21.0,12.0,,0.02780024705275848,3,134,0.4461828115627319,0.0006989564475246548,92.77046610514323,COMPLETE
317,0.20985640585422516,2023-09-04 12:05:34.639294,2023-09-04 12:05:35.040843,0 days 00:00:00.401549,ReLU,ReLU,Sigmoid,,61,17,24.0,13.0,,0.011103885065076773,3,104,0.763332820272168,0.0002492167480815115,111.05881818135579,COMPLETE
318,0.21717000007629395,2023-09-04 12:05:35.041163,2023-09-04 12:05:35.880396,0 days 00:00:00.839233,ReLU,ReLU,Tanh,,59,16,23.0,10.0,,0.001600556614727704,3,78,0.7381835536950291,0.00016097506978190063,188.42741945054797,COMPLETE
319,0.29802829027175903,2023-09-04 12:05:35.880729,2023-09-04 12:05:37.330076,0 days 00:00:01.449347,ReLU,Leaky,Sigmoid,,57,17,22.0,11.0,,0.00011979910726975046,3,122,0.5521867361211571,0.0003284777045872197,103.88202210723377,COMPLETE
320,0.21895700693130493,2023-09-04 12:05:37.330390,2023-09-04 12:05:37.635233,0 days 00:00:00.304843,ReLU,,,,86,16,,,,0.0183887568439079,1,146,0.5084752100781605,0.0001073763325529909,116.33183905418883,COMPLETE
321,0.19500599801540375,2023-09-04 12:05:37.635554,2023-09-04 12:05:38.056728,0 days 00:00:00.421174,ReLU,Tanh,Sigmoid,,88,17,24.0,15.0,,0.03574916907091082,3,154,0.7739775004865947,0.00038040626439773755,155.85355697139616,COMPLETE
322,0.2127038985490799,2023-09-04 12:05:38.057045,2023-09-04 12:05:38.760292,0 days 00:00:00.703247,ReLU,ReLU,Sigmoid,,63,15,21.0,14.0,,0.0144822390088688,3,140,0.6722574673649885,0.003912058033808277,97.93968410117954,COMPLETE
323,0.21217699348926544,2023-09-04 12:05:38.760619,2023-09-04 12:05:40.500795,0 days 00:00:01.740176,Sigmoid,Sigmoid,,,55,18,23.0,,,0.006124146593211013,2,165,0.7068821737168985,0.0002793971743700599,95.84385675415957,COMPLETE
324,0.20328573882579803,2023-09-04 12:05:40.501109,2023-09-04 12:05:41.216123,0 days 00:00:00.715014,ReLU,Tanh,Sigmoid,,94,16,24.0,12.0,,0.011951364418576024,3,122,0.7411343280526599,0.0001797991868997693,150.6584641503506,COMPLETE
325,0.19443923234939575,2023-09-04 12:05:41.216451,2023-09-04 12:05:42.441571,0 days 00:00:01.225120,ReLU,ReLU,Sigmoid,,91,17,23.0,13.0,,0.0021855960311872712,3,97,0.7994717617909944,0.0002379692610441136,108.99814110195514,COMPLETE
326,0.20213568210601807,2023-09-04 12:05:42.441906,2023-09-04 12:05:43.111190,0 days 00:00:00.669284,ReLU,ReLU,Sigmoid,,59,15,22.0,15.0,,0.006045983614516445,3,133,0.613469045419554,7.846048681952602e-05,86.81500049665863,COMPLETE
327,0.20856060087680817,2023-09-04 12:05:43.111522,2023-09-04 12:05:43.791778,0 days 00:00:00.680256,ReLU,Tanh,Sigmoid,,57,18,24.0,14.0,,0.014422682774985757,3,110,0.6514246921770349,0.0017810537421191388,287.4286865883685,COMPLETE
328,0.2069377601146698,2023-09-04 12:05:43.792108,2023-09-04 12:05:45.372412,0 days 00:00:01.580304,ReLU,ReLU,Sigmoid,,65,16,22.0,13.0,,0.0010106819173857243,3,158,0.7696836982580303,0.00014354689356404772,88.08127183734246,COMPLETE
329,0.22152119874954224,2023-09-04 12:05:45.372734,2023-09-04 12:05:45.805283,0 days 00:00:00.432549,ReLU,Tanh,Sigmoid,,78,15,23.0,8.0,,0.022156928609994887,3,149,0.7186198144704319,0.0005405617323444877,144.24190592765808,COMPLETE
330,0.19689401984214783,2023-09-04 12:05:45.805616,2023-09-04 12:05:46.289277,0 days 00:00:00.483661,ReLU,ReLU,Sigmoid,,61,17,24.0,11.0,,0.010457313438566596,3,172,0.5754315152968227,0.0003229602923649019,85.37490414350461,COMPLETE
331,0.24904890358448029,2023-09-04 12:05:46.289609,2023-09-04 12:05:46.983920,0 days 00:00:00.694311,ReLU,Tanh,ReLU,ReLU,56,18,1.0,14.0,14.0,0.06704242903065182,4,129,0.7517601802276819,0.0002216925299035553,94.87476539611816,COMPLETE
332,0.17697381973266602,2023-09-04 12:05:46.984263,2023-09-04 12:05:47.618330,0 days 00:00:00.634067,Tanh,ReLU,Sigmoid,,84,20,23.0,12.0,,0.008120821693872387,3,116,0.6910338411042971,0.00039513741396001356,80.81850217423349,COMPLETE
333,0.2882436215877533,2023-09-04 12:05:47.618678,2023-09-04 12:05:47.942178,0 days 00:00:00.323500,ReLU,ReLU,Sigmoid,,90,17,22.0,13.0,,0.0015072833641662066,3,142,0.10337925856929205,0.00019633130790199554,100.22927884913203,COMPLETE
334,0.2531380355358124,2023-09-04 12:05:47.942498,2023-09-04 12:05:48.311490,0 days 00:00:00.368992,ReLU,Leaky,Sigmoid,,87,16,21.0,14.0,,0.00182545369312047,3,132,0.32583456852126247,5.870317958553906e-05,93.0730655670166,COMPLETE
335,0.18356408178806305,2023-09-04 12:05:48.311830,2023-09-04 12:05:48.998989,0 days 00:00:00.687159,ReLU,Tanh,Sigmoid,,63,17,23.0,11.0,,0.01825066231285197,3,94,0.7988998465761882,0.0002792693510304947,86.37806102207729,COMPLETE
336,0.18737810850143433,2023-09-04 12:05:48.999321,2023-09-04 12:05:49.744458,0 days 00:00:00.745137,ReLU,ReLU,Sigmoid,,59,16,24.0,15.0,,0.005527211199343224,3,86,0.6347179039051504,0.00016948363960072116,86.99009857177734,COMPLETE
337,0.3378422260284424,2023-09-04 12:05:49.744794,2023-09-04 12:05:52.181124,0 days 00:00:02.436330,ReLU,Tanh,Sigmoid,,61,16,23.0,13.0,,2.6487885848460794e-05,3,166,0.7318720610099768,0.0001289469099768687,99.93374358027815,COMPLETE
338,0.24427658319473267,2023-09-04 12:05:52.181453,2023-09-04 12:05:52.335156,0 days 00:00:00.153703,ReLU,ReLU,Sigmoid,,52,18,22.0,12.0,,0.012399999316501525,3,149,0.11723369580731148,0.00010648783371694848,109.99282836914062,COMPLETE
339,0.21784020960330963,2023-09-04 12:05:52.335486,2023-09-04 12:05:53.380607,0 days 00:00:01.045121,ReLU,ReLU,Sigmoid,,82,15,24.0,14.0,,0.0030635297525336692,3,114,0.7667215909282414,0.00032557449002801477,81.60310494027486,COMPLETE
340,0.19500033557415009,2023-09-04 12:05:53.380945,2023-09-04 12:05:53.757723,0 days 00:00:00.376778,ReLU,Tanh,Sigmoid,,55,17,23.0,15.0,,0.0069885777399839475,3,139,0.539614866912092,0.0004395927184821355,241.99763804468614,COMPLETE
341,0.3126930892467499,2023-09-04 12:05:53.758059,2023-09-04 12:05:54.140912,0 days 00:00:00.382853,ReLU,ReLU,Sigmoid,,93,1,24.0,10.0,,0.009712376090532335,3,103,0.23714863394719268,0.0002149653966302974,145.14841637862355,COMPLETE
342,0.21387647092342377,2023-09-04 12:05:54.141236,2023-09-04 12:05:55.292202,0 days 00:00:01.150966,ReLU,Tanh,Tanh,,58,16,22.0,12.0,,0.0012446116543039238,3,123,0.6022710051194746,3.401424029943784e-05,120.8565941704644,COMPLETE
343,0.19097386300563812,2023-09-04 12:05:55.292524,2023-09-04 12:05:55.582089,0 days 00:00:00.289565,ReLU,ReLU,Sigmoid,,85,19,23.0,13.0,,0.01612575811960575,3,161,0.43177993986900387,0.00027166234512902544,126.48540920681424,COMPLETE
344,0.2227872610092163,2023-09-04 12:05:55.582405,2023-09-04 12:05:56.669139,0 days 00:00:01.086734,Tanh,Tanh,Sigmoid,,60,17,23.0,14.0,,0.007902955261544007,3,172,0.6685784071119275,0.0010859537845010945,87.7182867588141,COMPLETE
345,0.9115177989006042,2023-09-04 12:05:56.669474,2023-09-04 12:05:58.556002,0 days 00:00:01.886528,Sigmoid,ReLU,Sigmoid,,80,21,20.0,11.0,,1.0009897266455864e-05,3,156,0.7156914528856383,0.0006758364316864998,114.58558879754482,COMPLETE
346,0.19497598707675934,2023-09-04 12:05:58.556339,2023-09-04 12:05:59.406485,0 days 00:00:00.850146,ReLU,ReLU,Sigmoid,,31,15,21.0,13.0,,0.004929551168607037,3,133,0.7737094143234835,0.0005072596997338813,147.45970055364793,COMPLETE
347,0.22739630937576294,2023-09-04 12:05:59.406812,2023-09-04 12:05:59.841244,0 days 00:00:00.434432,ReLU,Sigmoid,Sigmoid,,65,16,24.0,12.0,,0.012647256515092768,3,302,0.3929390461843489,0.00015991478099116463,96.02739303588868,COMPLETE
348,0.24042871594429016,2023-09-04 12:05:59.841579,2023-09-04 12:06:00.099872,0 days 00:00:00.258293,ReLU,Tanh,Sigmoid,,88,18,22.0,14.0,,0.00658088639874326,3,123,0.20234436050854412,0.0002456288359471956,145.09497980485884,COMPLETE
349,0.1893622726202011,2023-09-04 12:06:00.100196,2023-09-04 12:06:00.698419,0 days 00:00:00.598223,ReLU,Leaky,,,57,17,23.0,,,0.009980460064337376,2,144,0.7474615977454925,0.0003906635882039642,94.63763754708427,COMPLETE
350,0.19192945957183838,2023-09-04 12:06:00.698734,2023-09-04 12:06:01.236880,0 days 00:00:00.538146,ReLU,ReLU,Sigmoid,,62,16,24.0,12.0,,0.021851161439438646,3,114,0.6995313676621673,7.158921146867876e-05,68.57949128022065,COMPLETE
351,0.21806229650974274,2023-09-04 12:06:01.237231,2023-09-04 12:06:01.798802,0 days 00:00:00.561571,ReLU,Tanh,Sigmoid,,90,20,19.0,15.0,,0.008464683566104044,3,186,0.7995887633547728,0.00019388608248780936,97.89678006055878,COMPLETE
352,0.21098756790161133,2023-09-04 12:06:01.799137,2023-09-04 12:06:02.987722,0 days 00:00:01.188585,ReLU,ReLU,Sigmoid,,50,16,23.0,13.0,,0.0023438022262351156,3,107,0.496828852868806,0.00035624181710899904,136.4689737955729,COMPLETE
353,0.20901352167129517,2023-09-04 12:06:02.988190,2023-09-04 12:06:03.817344,0 days 00:00:00.829154,ReLU,Tanh,Sigmoid,,55,17,22.0,14.0,,0.0035405628084440766,3,153,0.4880138645029669,4.8154754253712595e-05,81.04259501418022,COMPLETE
354,0.17899370193481445,2023-09-04 12:06:03.817793,2023-09-04 12:06:05.057662,0 days 00:00:01.239869,ReLU,ReLU,ReLU,,92,15,23.0,9.0,,0.0007722725076160914,3,173,0.7399845387250433,9.173842749753394e-05,81.3254144056788,COMPLETE
355,0.1973418891429901,2023-09-04 12:06:05.058096,2023-09-04 12:06:05.365859,0 days 00:00:00.307763,ReLU,ReLU,Sigmoid,,58,18,24.0,15.0,,0.016075879779304327,3,140,0.3776018019841864,0.0002968859340846317,86.45288153255687,COMPLETE
356,0.2128683179616928,2023-09-04 12:06:05.366297,2023-09-04 12:06:05.667096,0 days 00:00:00.300799,ReLU,Tanh,Sigmoid,,75,16,21.0,11.0,,0.005090231007162676,3,128,0.46793287887106727,0.00013829135872700174,86.36834544520224,COMPLETE
357,0.1966605931520462,2023-09-04 12:06:05.667641,2023-09-04 12:06:06.413774,0 days 00:00:00.746133,Tanh,ReLU,Sigmoid,,86,19,22.0,10.0,,0.011671570288214434,3,165,0.7999098097324829,0.00022083161706698635,124.01141507284981,COMPLETE
358,0.2046194225549698,2023-09-04 12:06:06.414104,2023-09-04 12:06:07.021416,0 days 00:00:00.607312,ReLU,Tanh,Sigmoid,,60,15,24.0,14.0,,0.007430189614757329,3,152,0.6779672049678701,0.00011445476859970962,135.7778194972447,COMPLETE
359,0.20912107825279236,2023-09-04 12:06:07.021750,2023-09-04 12:06:07.288876,0 days 00:00:00.267126,ReLU,ReLU,Sigmoid,,63,18,23.0,13.0,,0.019501212209923555,3,95,0.4129003059474179,0.00018180682246353674,82.44942719595772,COMPLETE
360,0.22211450338363647,2023-09-04 12:06:07.289203,2023-09-04 12:06:08.096717,0 days 00:00:00.807514,ReLU,Tanh,Sigmoid,,53,17,23.0,16.0,,0.013866464032953555,3,135,0.6318318802950156,0.00024853961943281894,132.95229991566052,COMPLETE
361,0.19199775159358978,2023-09-04 12:06:08.097037,2023-09-04 12:06:08.708309,0 days 00:00:00.611272,ReLU,Leaky,Sigmoid,,84,17,4.0,4.0,,0.033898801710861515,3,119,0.7638114239786594,0.0009080363018647498,79.94146362940471,COMPLETE
362,0.17724791169166565,2023-09-04 12:06:08.708652,2023-09-04 12:06:09.702034,0 days 00:00:00.993382,ReLU,ReLU,Sigmoid,,56,16,22.0,12.0,,0.006255497805756662,3,181,0.7145778502068073,0.0005410632702811892,134.84847564697264,COMPLETE
363,0.22581163048744202,2023-09-04 12:06:09.702350,2023-09-04 12:06:11.003363,0 days 00:00:01.301013,ReLU,ReLU,Sigmoid,,95,14,24.0,15.0,,0.0004239519685096845,3,147,0.5784537221211883,0.009063430956881034,188.60882334806482,COMPLETE
364,0.22306543588638306,2023-09-04 12:06:11.003686,2023-09-04 12:06:11.769397,0 days 00:00:00.765711,ReLU,Tanh,Sigmoid,,67,16,23.0,14.0,,0.004194069125285469,3,163,0.6502971379543675,0.00031934412985786415,83.76245346069337,COMPLETE
365,0.23130114376544952,2023-09-04 12:06:11.769713,2023-09-04 12:06:12.191100,0 days 00:00:00.421387,ReLU,ReLU,Sigmoid,,87,15,22.0,13.0,,0.02364092538395885,3,74,0.7687825490098028,0.0073043083487087145,106.0138087272644,COMPLETE
366,0.21274663507938385,2023-09-04 12:06:12.191426,2023-09-04 12:06:13.042352,0 days 00:00:00.850926,ReLU,Tanh,Tanh,,64,17,24.0,11.0,,0.00954900683026052,3,106,0.7389509200719147,0.0004202655728096507,105.1007478948225,COMPLETE
367,0.30949029326438904,2023-09-04 12:06:13.042673,2023-09-04 12:06:14.019004,0 days 00:00:00.976331,Sigmoid,ReLU,Sigmoid,,89,16,23.0,12.0,,0.0014088173553601592,3,85,0.6960482013180305,0.0015258679997014219,123.46503358728745,COMPLETE
368,0.27231529355049133,2023-09-04 12:06:14.019331,2023-09-04 12:06:16.010872,0 days 00:00:01.991541,ReLU,Tanh,Sigmoid,,61,19,22.0,14.0,,0.00010448977487487997,3,127,0.771898574138722,0.00014793668238066807,156.40306625966952,COMPLETE
369,0.19736932218074799,2023-09-04 12:06:16.011196,2023-09-04 12:06:17.528330,0 days 00:00:01.517134,ReLU,ReLU,,,57,17,24.0,,,0.0006230709691458123,2,139,0.601998359905237,0.0002710852353935633,103.75405960631885,COMPLETE
370,0.18673229217529297,2023-09-04 12:06:17.528639,2023-09-04 12:06:18.073815,0 days 00:00:00.545176,Tanh,ReLU,Sigmoid,,59,18,23.0,11.0,,0.011234477305396721,3,404,0.799152494767778,0.00020887489359353218,97.95260152509135,COMPLETE
371,0.19159281253814697,2023-09-04 12:06:18.074141,2023-09-04 12:06:18.821483,0 days 00:00:00.747342,ReLU,Sigmoid,Sigmoid,,69,15,21.0,10.0,,0.008465708599867764,3,196,0.7329249320375969,8.52788096596523e-05,82.7763120543282,COMPLETE
372,0.24883678555488586,2023-09-04 12:06:18.821804,2023-09-04 12:06:19.153645,0 days 00:00:00.331841,ReLU,Tanh,Sigmoid,,54,16,2.0,13.0,,0.0058139185222412,3,173,0.16419521248262872,0.0003474766569370036,111.44693135579428,COMPLETE
