number,value,datetime_start,datetime_complete,duration,params_activation1,params_activation2,params_activation3,params_activation4,params_batch_size,params_fl1,params_fl2,params_fl3,params_fl4,params_learning_rate,params_n_layers,params_num_epochs,params_train_size,params_weight_decay,state
419,0.21102741360664368,2023-09-03 19:19:50.714788,2023-09-03 19:20:09.625994,0 days 00:00:18.911206,Tanh,Leaky,Sigmoid,Sigmoid,4,23,14.0,15.0,13.0,0.0057243756274578915,4,100,0.7070799991681398,7.764502740808193e-05,COMPLETE
420,0.21694442629814148,2023-09-03 19:20:09.626335,2023-09-03 19:20:20.586897,0 days 00:00:10.960562,Tanh,Leaky,Sigmoid,Sigmoid,4,24,20.0,16.0,10.0,0.005156141722885879,4,60,0.6497384198057526,0.00010944849187359991,COMPLETE
421,0.24382050335407257,2023-09-03 19:20:20.587239,2023-09-03 19:20:27.464845,0 days 00:00:06.877606,Tanh,ReLU,,,4,23,23.0,,,0.00466223386142793,2,100,0.1464953091897164,4.4374663338264165e-05,COMPLETE
422,0.23502761125564575,2023-09-03 19:20:27.465383,2023-09-03 19:20:46.282774,0 days 00:00:18.817391,ReLU,Leaky,Sigmoid,Sigmoid,4,24,24.0,21.0,16.0,7.338807458784795e-05,4,80,0.6742400399578808,0.0024087859900083462,COMPLETE
423,0.20125868916511536,2023-09-03 19:20:46.283132,2023-09-03 19:21:07.608468,0 days 00:00:21.325336,Leaky,Leaky,Sigmoid,Sigmoid,4,23,22.0,12.0,4.0,0.00807324379615133,4,100,0.7356591796982346,0.0016469509389203587,COMPLETE
424,0.21626684069633484,2023-09-03 19:21:07.608814,2023-09-03 19:21:10.848857,0 days 00:00:03.240043,Tanh,Sigmoid,Sigmoid,Tanh,16,23,23.0,11.0,20.0,0.006800901229831745,4,100,0.25032732923474,0.00013094440296406408,COMPLETE
425,0.20680247247219086,2023-09-03 19:21:10.849436,2023-09-03 19:21:18.520089,0 days 00:00:07.670653,Tanh,Leaky,Sigmoid,ReLU,4,24,21.0,14.0,16.0,0.010132672953254524,4,60,0.38633185501296635,0.000217812486295287,COMPLETE
426,0.17872528731822968,2023-09-03 19:21:18.520426,2023-09-03 19:21:36.370890,0 days 00:00:17.850464,Tanh,ReLU,Tanh,Leaky,4,22,12.0,16.0,10.0,0.0006175538517572549,4,100,0.5725146176125713,9.513405710554582e-05,COMPLETE
427,0.248677596449852,2023-09-03 19:21:36.371470,2023-09-03 19:21:38.290825,0 days 00:00:01.919355,ReLU,Leaky,Sigmoid,Sigmoid,12,9,15.0,22.0,6.0,0.004854708320105758,4,100,0.1955407136422216,0.006675246610851261,COMPLETE
428,0.3013896048069,2023-09-03 19:21:38.291165,2023-09-03 19:21:39.449062,0 days 00:00:01.157897,Tanh,Leaky,,,16,23,22.0,,,5.074722582378415e-05,2,80,0.2985731059478022,6.386665148585902e-05,COMPLETE
429,0.18987396359443665,2023-09-03 19:21:39.449392,2023-09-03 19:21:46.252797,0 days 00:00:06.803405,Tanh,,,,10,18,,,,0.00391130312046159,1,100,0.7991823616983624,0.00015863695176053776,COMPLETE
430,0.21417714655399323,2023-09-03 19:21:46.253103,2023-09-03 19:21:48.170764,0 days 00:00:01.917661,Tanh,Leaky,,,16,24,13.0,,,0.0008096731626719169,2,60,0.6948866412796542,6.579406663462818e-05,COMPLETE
431,0.20203886926174164,2023-09-03 19:21:48.171099,2023-09-03 19:21:52.814657,0 days 00:00:04.643558,ReLU,Leaky,,,12,16,23.0,,,0.0004700508139669591,2,100,0.6133859262112004,0.003420451953304637,COMPLETE
432,0.18990780413150787,2023-09-03 19:21:52.815185,2023-09-03 19:21:57.301242,0 days 00:00:04.486057,Leaky,ReLU,Leaky,,16,23,24.0,19.0,,0.003125404982742542,3,100,0.7272084377942132,2.6815697396912595e-05,COMPLETE
433,0.21624717116355896,2023-09-03 19:21:57.301600,2023-09-03 19:21:59.148293,0 days 00:00:01.846693,Tanh,Leaky,,,12,22,17.0,,,0.0012552395384869094,2,40,0.7717656654751269,0.001475680688283083,COMPLETE
434,0.19146235287189484,2023-09-03 19:21:59.148628,2023-09-03 19:22:11.623321,0 days 00:00:12.474693,Tanh,Leaky,,,4,24,22.0,,,0.006430969937800258,2,100,0.7425235117506198,0.0010976377486355358,COMPLETE
435,0.19480080902576447,2023-09-03 19:22:11.623629,2023-09-03 19:22:20.494791,0 days 00:00:08.871162,Tanh,Leaky,,,2,23,23.0,,,0.0015282916140731402,2,60,0.4500285886457391,0.0022909957405236,COMPLETE
436,0.19572800397872925,2023-09-03 19:22:20.495109,2023-09-03 19:22:22.195403,0 days 00:00:01.700294,ReLU,Tanh,,,16,22,6.0,,,0.002141872671116729,2,80,0.4447568403473271,0.00019778249080591823,COMPLETE
437,0.23971593379974365,2023-09-03 19:22:22.195735,2023-09-03 19:22:23.929138,0 days 00:00:01.733403,Sigmoid,Leaky,ReLU,,30,23,24.0,17.0,,0.0010384689107661477,3,100,0.4970800500170003,9.222538715767023e-05,COMPLETE
438,0.24179665744304657,2023-09-03 19:22:23.929460,2023-09-03 19:22:25.830165,0 days 00:00:01.900705,Tanh,Sigmoid,,,16,19,21.0,,,0.004264854077573852,2,100,0.3978580953967218,3.70951473000445e-05,COMPLETE
439,0.2043139785528183,2023-09-03 19:22:25.830485,2023-09-03 19:22:29.910267,0 days 00:00:04.079782,Tanh,ReLU,,,12,24,23.0,,,0.00021903325649289508,2,100,0.6682527650335024,0.00032684965850686746,COMPLETE
440,0.1761372685432434,2023-09-03 19:22:29.910590,2023-09-03 19:22:32.083758,0 days 00:00:02.173168,Tanh,Leaky,,,16,22,22.0,,,0.002712401877699328,2,60,0.7705951088678551,0.00013318057702675566,COMPLETE
441,0.19328530132770538,2023-09-03 19:22:32.084075,2023-09-03 19:22:43.912161,0 days 00:00:11.828086,ReLU,Leaky,,,4,6,23.0,,,0.005626732210020158,2,100,0.7138380911094399,0.002879370845796452,COMPLETE
442,0.20690220594406128,2023-09-03 19:22:43.912473,2023-09-03 19:22:45.604341,0 days 00:00:01.691868,Leaky,Leaky,,,16,22,24.0,,,0.003534540429837027,2,100,0.35479814929574094,0.0016817758186659303,COMPLETE
443,0.35447993874549866,2023-09-03 19:22:45.604652,2023-09-03 19:22:50.399524,0 days 00:00:04.794872,Tanh,Leaky,,,10,23,22.0,,,0.001786765242052864,2,80,0.7682234015120089,0.08848071128823462,COMPLETE
444,0.2090187519788742,2023-09-03 19:22:50.399839,2023-09-03 19:22:52.441494,0 days 00:00:02.041655,Tanh,ReLU,Sigmoid,,12,24,21.0,10.0,,0.007986095876954548,3,100,0.2652882144695475,0.00025907470443892324,COMPLETE
445,0.17561228573322296,2023-09-03 19:22:52.441815,2023-09-03 19:22:54.715264,0 days 00:00:02.273449,Tanh,Leaky,,,16,23,20.0,,,0.0023762186098613704,2,60,0.7989547799043741,0.0012498081515099255,COMPLETE
446,0.24444204568862915,2023-09-03 19:22:54.715584,2023-09-03 19:22:56.030491,0 days 00:00:01.314907,ReLU,Leaky,,,12,23,7.0,,,0.0012379505780413683,2,100,0.20927942049633563,8.111244495729725e-05,COMPLETE
447,0.2456166297197342,2023-09-03 19:22:56.030805,2023-09-03 19:22:57.113523,0 days 00:00:01.082718,Tanh,,,,16,24,,,,0.05579069316577632,1,100,0.28738513490408785,0.003911186224542315,COMPLETE
448,0.1902158111333847,2023-09-03 19:22:57.113831,2023-09-03 19:23:22.301149,0 days 00:00:25.187318,Tanh,Leaky,,,2,22,22.0,,,0.0030763623767741687,2,100,0.7340046365607708,0.0007979338363097792,COMPLETE
449,0.28864726424217224,2023-09-03 19:23:22.301459,2023-09-03 19:23:22.640984,0 days 00:00:00.339525,Tanh,Leaky,,,16,23,16.0,,,0.0007734480488168641,2,60,0.10287152829370784,0.0020131927530822333,COMPLETE
450,0.21593476831912994,2023-09-03 19:23:22.641337,2023-09-03 19:23:24.191537,0 days 00:00:01.550200,ReLU,ReLU,,,30,22,23.0,,,0.002026735451362752,2,80,0.6914131750029116,4.767444430533609e-05,COMPLETE
451,0.163519024848938,2023-09-03 19:23:24.191884,2023-09-03 19:23:31.442657,0 days 00:00:07.250773,Leaky,Leaky,Leaky,,12,24,24.0,7.0,,0.004945099256053942,3,100,0.6504906991217143,2.144371367515963e-05,COMPLETE
452,0.18878182768821716,2023-09-03 19:23:31.443006,2023-09-03 19:23:36.936829,0 days 00:00:05.493823,Leaky,Leaky,Leaky,,12,24,24.0,4.0,,0.0054622159173732185,3,100,0.7689762025655742,1.238454745269885e-05,COMPLETE
453,0.18207065761089325,2023-09-03 19:23:36.937145,2023-09-03 19:23:41.532808,0 days 00:00:04.595663,Leaky,Sigmoid,Leaky,,12,24,24.0,3.0,,0.0048663149165298555,3,100,0.6394285102700286,2.5285796723837663e-05,COMPLETE
454,0.18901851773262024,2023-09-03 19:23:41.533134,2023-09-03 19:23:44.395212,0 days 00:00:02.862078,Leaky,Leaky,Leaky,,12,24,24.0,7.0,,0.004475920818333437,3,60,0.663154476276431,3.227610695405702e-05,COMPLETE
455,0.18675315380096436,2023-09-03 19:23:44.395538,2023-09-03 19:23:47.887641,0 days 00:00:03.492103,Leaky,Leaky,Leaky,,12,24,24.0,8.0,,0.006991187753555115,3,100,0.4856682432954512,2.167151702469383e-05,COMPLETE
456,0.19309988617897034,2023-09-03 19:23:47.887973,2023-09-03 19:23:50.176459,0 days 00:00:02.288486,Leaky,Leaky,Leaky,,12,12,23.0,9.0,,0.005922705678224638,3,40,0.7989096399826244,1.7057369271188202e-05,COMPLETE
457,0.22903646528720856,2023-09-03 19:23:50.176795,2023-09-03 19:23:51.938681,0 days 00:00:01.761886,Leaky,ReLU,Leaky,,12,24,24.0,6.0,,0.003606526927312692,3,100,0.22942428786672148,1.8545365563073047e-05,COMPLETE
458,0.2043122947216034,2023-09-03 19:23:51.939017,2023-09-03 19:24:01.176670,0 days 00:00:09.237653,Leaky,Leaky,Tanh,,12,23,18.0,5.0,,0.004135904036383908,3,80,0.7455651678140967,0.00010500865731998385,COMPLETE
459,0.19061841070652008,2023-09-03 19:24:01.176990,2023-09-03 19:24:06.204322,0 days 00:00:05.027332,Leaky,Leaky,Leaky,,12,24,23.0,2.0,,0.013110925429280261,3,100,0.7006302370170594,0.00016658812967077746,COMPLETE
460,0.18052922189235687,2023-09-03 19:24:06.204648,2023-09-03 19:24:13.990625,0 days 00:00:07.785977,Leaky,Tanh,Leaky,,4,17,24.0,15.0,,0.009609972223320978,3,60,0.6369895837147752,1.5316387199589452e-05,COMPLETE
461,0.16406820714473724,2023-09-03 19:24:13.990951,2023-09-03 19:24:19.434547,0 days 00:00:05.443596,ReLU,Leaky,Sigmoid,,12,23,2.0,12.0,,0.005902452055031306,3,100,0.7499212399576931,5.951719244933733e-05,COMPLETE
462,0.18693950772285461,2023-09-03 19:24:19.434886,2023-09-03 19:24:24.689349,0 days 00:00:05.254463,ReLU,Leaky,Sigmoid,,12,24,4.0,12.0,,0.004776537852506183,3,100,0.7231710938345989,7.666152870461206e-05,COMPLETE
463,0.20554068684577942,2023-09-03 19:24:24.689686,2023-09-03 19:24:29.608241,0 days 00:00:04.918555,ReLU,ReLU,Sigmoid,,12,23,5.0,13.0,,0.000938775185028907,3,100,0.67819536737525,5.585799282847583e-05,COMPLETE
464,0.17713944613933563,2023-09-03 19:24:29.608570,2023-09-03 19:24:35.004238,0 days 00:00:05.395668,ReLU,Leaky,Sigmoid,,12,11,1.0,11.0,,0.0015539299813724684,3,100,0.7459252771538242,3.0058581887777826e-05,COMPLETE
465,0.21770228445529938,2023-09-03 19:24:35.004560,2023-09-03 19:24:37.461370,0 days 00:00:02.456810,ReLU,Leaky,Sigmoid,,12,24,3.0,10.0,,0.006918753145757462,3,80,0.4163076850378032,0.00010484903399716039,COMPLETE
466,0.2331625372171402,2023-09-03 19:24:37.461708,2023-09-03 19:24:38.486661,0 days 00:00:01.024953,ReLU,Sigmoid,Sigmoid,,12,23,13.0,7.0,,0.003530067464927573,3,60,0.21986971164423205,2.2288151366381063e-05,COMPLETE
467,0.24950683116912842,2023-09-03 19:24:38.486997,2023-09-03 19:24:40.888990,0 days 00:00:02.401993,ReLU,Leaky,Sigmoid,,12,24,4.0,14.0,,0.00018628880825602076,3,100,0.3233888672082638,4.1991241578003226e-05,COMPLETE
468,0.20759601891040802,2023-09-03 19:24:40.889332,2023-09-03 19:24:45.300524,0 days 00:00:04.411192,ReLU,Leaky,Tanh,,12,23,1.0,9.0,,0.010875529468976807,3,100,0.6116712697310034,0.00015334775933201962,COMPLETE
469,0.21095454692840576,2023-09-03 19:24:45.300840,2023-09-03 19:24:51.240285,0 days 00:00:05.939445,ReLU,ReLU,ReLU,,10,16,1.0,13.0,,0.03629035450477616,3,100,0.7105077215450364,5.638815305143675e-05,COMPLETE
470,0.27874132990837097,2023-09-03 19:24:51.240606,2023-09-03 19:24:54.682684,0 days 00:00:03.442078,ReLU,Leaky,Sigmoid,Sigmoid,12,20,2.0,15.0,24.0,0.0007062409272405824,4,60,0.6574982777471323,7.361881879407501e-05,COMPLETE
471,0.21972540020942688,2023-09-03 19:24:54.683021,2023-09-03 19:24:57.843292,0 days 00:00:03.160271,Sigmoid,Leaky,Leaky,,12,23,2.0,17.0,,0.004052206513725425,3,100,0.4327324904049315,0.00022756060926195032,COMPLETE
472,0.202228844165802,2023-09-03 19:24:57.843630,2023-09-03 19:25:24.062777,0 days 00:00:26.219147,ReLU,Leaky,Tanh,,2,24,11.0,20.0,,4.2090970237931194e-05,3,80,0.7671198920949134,0.0014564115732691228,COMPLETE
473,0.18703678250312805,2023-09-03 19:25:24.063108,2023-09-03 19:25:36.561982,0 days 00:00:12.498874,Leaky,Leaky,Sigmoid,,4,19,12.0,18.0,,0.002770558058497882,3,100,0.5990063078100802,0.00012687393737774306,COMPLETE
474,0.16313575208187103,2023-09-03 19:25:36.562315,2023-09-03 19:25:39.114556,0 days 00:00:02.552241,ReLU,ReLU,Leaky,,30,22,14.0,5.0,,0.008596986037354998,3,100,0.7453945761121129,0.00035929470692638144,COMPLETE
475,0.20415490865707397,2023-09-03 19:25:39.114878,2023-09-03 19:25:41.265578,0 days 00:00:02.150700,ReLU,ReLU,Leaky,,30,21,14.0,5.0,,0.001256630417906957,3,100,0.522090141156051,4.738031170512258e-05,COMPLETE
476,0.18285053968429565,2023-09-03 19:25:41.265912,2023-09-03 19:25:43.776870,0 days 00:00:02.510958,ReLU,ReLU,Leaky,,30,22,14.0,7.0,,0.008262181033522662,3,100,0.7553814108125907,0.00040132780922457677,COMPLETE
477,0.1781432330608368,2023-09-03 19:25:43.777207,2023-09-03 19:25:46.667962,0 days 00:00:02.890755,ReLU,ReLU,Leaky,,30,21,15.0,4.0,,0.009202222802028709,3,100,0.7998793710744513,0.00047066841933416503,COMPLETE
478,0.9482513666152954,2023-09-03 19:25:46.668302,2023-09-03 19:25:47.297010,0 days 00:00:00.628708,ReLU,ReLU,Leaky,,30,22,13.0,6.0,,1.0805379597033244e-05,3,100,0.16576421581876952,6.567979673541157e-05,COMPLETE
479,0.17516440153121948,2023-09-03 19:25:47.297337,2023-09-03 19:25:49.712224,0 days 00:00:02.414887,ReLU,ReLU,Leaky,,30,22,7.0,1.0,,0.0015529925291631603,3,100,0.7423646962417594,0.0010498552030076122,COMPLETE
480,0.19717563688755035,2023-09-03 19:25:49.712562,2023-09-03 19:25:51.582683,0 days 00:00:01.870121,ReLU,ReLU,Leaky,,30,20,14.0,8.0,,0.0005020838019089202,3,100,0.5638957446982251,3.694317514488563e-05,COMPLETE
481,0.24574364721775055,2023-09-03 19:25:51.583031,2023-09-03 19:25:52.782951,0 days 00:00:01.199920,ReLU,ReLU,Leaky,,30,21,16.0,5.0,,0.00029000299343356163,3,100,0.3488122116797288,0.0013037079454419793,COMPLETE
482,0.22854511439800262,2023-09-03 19:25:52.783302,2023-09-03 19:25:53.616823,0 days 00:00:00.833521,ReLU,ReLU,Sigmoid,,30,14,14.0,12.0,,0.0017384766967129706,3,100,0.23754405387252134,0.0003552289407449245,COMPLETE
483,0.23996546864509583,2023-09-03 19:25:53.617152,2023-09-03 19:25:55.825626,0 days 00:00:02.208474,ReLU,ReLU,Leaky,,8,22,14.0,3.0,,0.01899969960304221,3,60,0.33756687687216075,0.0017293799322294133,COMPLETE
484,0.20589131116867065,2023-09-03 19:25:55.825960,2023-09-03 19:26:06.872787,0 days 00:00:11.046827,Leaky,,,,4,24,,,,0.008640855132909934,1,100,0.7272827193011332,8.924381228498321e-05,COMPLETE
485,0.16831210255622864,2023-09-03 19:26:06.873130,2023-09-03 19:26:13.777451,0 days 00:00:06.904321,ReLU,Sigmoid,Tanh,,10,23,15.0,6.0,,0.01320266378889415,3,100,0.7700378551278579,0.0005144176947794898,COMPLETE
486,0.18423283100128174,2023-09-03 19:26:13.777800,2023-09-03 19:26:20.497226,0 days 00:00:06.719426,ReLU,Sigmoid,Tanh,,10,23,15.0,6.0,,0.017128769058515916,3,100,0.765536394093738,0.0004192732127359093,COMPLETE
487,0.20824727416038513,2023-09-03 19:26:20.497567,2023-09-03 19:26:26.013534,0 days 00:00:05.515967,ReLU,Sigmoid,Tanh,,10,23,15.0,4.0,,0.015064438072011598,3,100,0.3178043342655559,0.00061359215379782,COMPLETE
488,0.1945277601480484,2023-09-03 19:26:26.013877,2023-09-03 19:26:30.454639,0 days 00:00:04.440762,ReLU,Sigmoid,Tanh,,10,23,15.0,6.0,,0.02211383508125457,3,100,0.5057588889899604,0.0005744738067578746,COMPLETE
489,0.1802036017179489,2023-09-03 19:26:30.454998,2023-09-03 19:26:37.343321,0 days 00:00:06.888323,ReLU,Sigmoid,Tanh,,10,22,15.0,9.0,,0.011357837446193569,3,100,0.7998244073370092,0.00046425940873941185,COMPLETE
490,0.17260292172431946,2023-09-03 19:26:37.343652,2023-09-03 19:26:45.602636,0 days 00:00:08.258984,ReLU,Sigmoid,Tanh,,10,24,14.0,11.0,,0.011671420101060807,3,100,0.718899769310577,0.000307886903803638,COMPLETE
491,0.14462395012378693,2023-09-03 19:26:45.602971,2023-09-03 19:26:52.151237,0 days 00:00:06.548266,ReLU,Sigmoid,Tanh,,10,23,15.0,8.0,,0.023022089401885357,3,100,0.7695509640362572,2.9077145907346304e-05,COMPLETE
492,0.24409545958042145,2023-09-03 19:26:52.151565,2023-09-03 19:26:53.799538,0 days 00:00:01.647973,ReLU,Sigmoid,ReLU,,10,22,14.0,8.0,,0.011662991273815178,3,100,0.18517724110225958,6.0030015198701604e-05,COMPLETE
493,0.1823054850101471,2023-09-03 19:26:53.799877,2023-09-03 19:27:22.475816,0 days 00:00:28.675939,ReLU,Sigmoid,Tanh,,2,24,13.0,2.0,,0.007380109586454245,3,100,0.687849574147051,2.689210414196398e-05,COMPLETE
494,0.22106604278087616,2023-09-03 19:27:22.476412,2023-09-03 19:27:27.633882,0 days 00:00:05.157470,ReLU,Sigmoid,Sigmoid,,10,23,16.0,10.0,,0.03430066809665806,3,100,0.3411057057970377,1.926502841995517e-05,COMPLETE
495,0.20723353326320648,2023-09-03 19:27:27.634243,2023-09-03 19:27:35.696886,0 days 00:00:08.062643,ReLU,Tanh,Leaky,,8,22,13.0,9.0,,0.029654665346601987,3,100,0.7416872059887124,2.1428213890004895e-05,COMPLETE
496,0.2082251012325287,2023-09-03 19:27:35.697213,2023-09-03 19:27:36.441661,0 days 00:00:00.744448,Leaky,Leaky,Leaky,ReLU,30,21,8.0,11.0,14.0,0.01973080949531904,4,60,0.293408014662571,2.997478076504747e-05,COMPLETE
497,0.4095652401447296,2023-09-03 19:27:36.441999,2023-09-03 19:27:59.522357,0 days 00:00:23.080358,ReLU,Leaky,Sigmoid,,4,24,15.0,7.0,,0.05557691136362445,3,100,0.7648735484753607,0.0009307473529609087,COMPLETE
498,0.31853577494621277,2023-09-03 19:27:59.522691,2023-09-03 19:28:03.393012,0 days 00:00:03.870321,ReLU,,,,10,23,,,,0.09649853030974648,1,100,0.7215215727401703,0.03118693601918208,COMPLETE
499,0.22915993630886078,2023-09-03 19:28:03.393328,2023-09-03 19:28:04.725837,0 days 00:00:01.332509,Leaky,Leaky,Tanh,,8,22,16.0,16.0,,0.02260960333006364,3,100,0.1183649400034726,1.6929715636786735e-05,COMPLETE
