number,value,datetime_start,datetime_complete,duration,params_activation1,params_activation2,params_activation3,params_activation4,params_batch_size,params_fl1,params_fl2,params_fl3,params_fl4,params_learning_rate,params_n_layers,params_num_epochs,params_train_size,params_weight_decay,user_attrs_mre,state
281,0.15562637150287628,2023-09-04 11:52:00.471858,2023-09-04 11:52:01.366710,0 days 00:00:00.894852,ReLU,Tanh,Tanh,,79,20,24.0,16.0,,0.004160101905051301,3,498,0.7977446048696697,0.00044724497544094044,68.28469005707771,COMPLETE
282,0.13694819808006287,2023-09-04 11:52:01.367121,2023-09-04 11:52:02.301924,0 days 00:00:00.934803,ReLU,Tanh,Tanh,,80,20,24.0,16.0,,0.005633960217508266,3,449,0.7999821118990522,0.0004231186984666299,92.43356311132037,COMPLETE
283,0.14752081036567688,2023-09-04 11:52:02.302255,2023-09-04 11:52:03.955920,0 days 00:00:01.653665,ReLU,Tanh,Tanh,,77,20,24.0,16.0,,0.004129612128253429,3,214,0.789146449533377,0.00041779754595968466,73.81189231872558,COMPLETE
284,0.19741256535053253,2023-09-04 11:52:03.956449,2023-09-04 11:52:07.007880,0 days 00:00:03.051431,ReLU,Tanh,Tanh,,80,20,24.0,15.0,,0.0040412435587728335,3,433,0.7991075909701323,0.0004545522032700035,69.89737208048503,COMPLETE
285,0.19400654733181,2023-09-04 11:52:07.008420,2023-09-04 11:52:08.729644,0 days 00:00:01.721224,ReLU,Tanh,Tanh,,75,20,24.0,17.0,,0.0057135063837052595,3,489,0.7968513761055315,0.0006216765493363097,79.07175388336182,COMPLETE
286,0.1561686247587204,2023-09-04 11:52:08.730202,2023-09-04 11:52:12.157114,0 days 00:00:03.426912,ReLU,Tanh,Tanh,,80,21,24.0,16.0,,0.004086508277356648,3,401,0.747224846992806,0.000459674246947209,88.67350353664823,COMPLETE
287,0.10881707817316055,2023-09-04 11:52:12.157672,2023-09-04 11:52:14.240735,0 days 00:00:02.083063,ReLU,Tanh,Tanh,,78,20,24.0,16.0,,0.0033625957984889303,3,464,0.7726731368360429,0.000590359449488379,75.74274915059408,COMPLETE
288,0.1275552660226822,2023-09-04 11:52:14.241390,2023-09-04 11:52:14.979495,0 days 00:00:00.738105,ReLU,Tanh,Tanh,,77,21,24.0,16.0,,0.00464100714093779,3,481,0.7800064640633062,0.0006873767366253057,146.06657669392038,COMPLETE
289,0.2307874709367752,2023-09-04 11:52:14.979824,2023-09-04 11:52:15.997954,0 days 00:00:01.018130,ReLU,Tanh,Tanh,,77,20,24.0,15.0,,0.003381062872410047,3,461,0.7659676860069015,0.0007139642755474759,85.52753306146877,COMPLETE
290,0.17700406908988953,2023-09-04 11:52:15.998351,2023-09-04 11:52:18.075310,0 days 00:00:02.076959,ReLU,Tanh,ReLU,,75,21,24.0,17.0,,0.00593822799369784,3,469,0.7110376580989671,0.0005561650052612654,55.57570923699273,COMPLETE
291,0.17902503907680511,2023-09-04 11:52:18.075880,2023-09-04 11:52:19.312245,0 days 00:00:01.236365,ReLU,Tanh,Tanh,,81,21,24.0,16.0,,0.005087930765923419,3,485,0.742892736309166,0.000574853364035848,86.62678240423332,COMPLETE
292,0.16669635474681854,2023-09-04 11:52:19.312671,2023-09-04 11:52:20.435660,0 days 00:00:01.122989,ReLU,Tanh,Tanh,,77,20,24.0,16.0,,0.006970244086464495,3,202,0.7703995713698721,0.0006871546940479896,80.88957694724753,COMPLETE
293,0.19581210613250732,2023-09-04 11:52:20.436082,2023-09-04 11:52:21.579270,0 days 00:00:01.143188,ReLU,Tanh,Tanh,,81,21,24.0,17.0,,0.0033376290324521507,3,457,0.7308017918409095,0.0003992389828908144,72.60347646077474,COMPLETE
294,0.22353610396385193,2023-09-04 11:52:21.579577,2023-09-04 11:52:22.412870,0 days 00:00:00.833293,Leaky,Tanh,Tanh,,79,20,24.0,15.0,,0.007807266354164581,3,467,0.7702066199970429,0.0005170668641837311,81.31328376394804,COMPLETE
295,0.16707059741020203,2023-09-04 11:52:22.413202,2023-09-04 11:52:24.383024,0 days 00:00:01.969822,ReLU,Tanh,Tanh,,73,20,24.0,16.0,,0.002709999120865065,3,485,0.7994134001455372,0.0004132790372363622,298.1903521728516,COMPLETE
296,0.14274583756923676,2023-09-04 11:52:24.383553,2023-09-04 11:52:28.957231,0 days 00:00:04.573678,Tanh,Tanh,Tanh,,82,20,5.0,15.0,,0.004675174106034899,3,453,0.7044216560990318,0.000565717197101842,69.04295772664688,COMPLETE
297,0.2844403088092804,2023-09-04 11:52:28.957758,2023-09-04 11:52:30.905529,0 days 00:00:01.947771,Sigmoid,Tanh,Tanh,,78,21,6.0,17.0,,0.004375655989712294,3,351,0.6951419297149414,0.0006358091005004405,90.17846659610146,COMPLETE
298,0.13109229505062103,2023-09-04 11:52:30.905852,2023-09-04 11:52:32.161120,0 days 00:00:01.255268,Tanh,Tanh,Tanh,,81,20,5.0,14.0,,0.005582003689611269,3,448,0.7121287227108671,0.0008146604813890996,86.2810527983166,COMPLETE
299,0.19255958497524261,2023-09-04 11:52:32.161426,2023-09-04 11:52:33.761006,0 days 00:00:01.599580,Tanh,Tanh,Tanh,,80,21,4.0,14.0,,0.0038316540952226057,3,446,0.7126028786470616,0.0008424456411254661,87.25932684876865,COMPLETE
300,0.2868036925792694,2023-09-04 11:52:33.761310,2023-09-04 11:52:35.058314,0 days 00:00:01.297004,ReLU,,,,77,20,,,,0.00492170799612239,1,190,0.7397733613990567,0.0007316655698567415,103.13105773925781,COMPLETE
301,0.15583094954490662,2023-09-04 11:52:35.058612,2023-09-04 11:52:35.622921,0 days 00:00:00.564309,Tanh,Tanh,Tanh,,81,20,6.0,16.0,,0.006546248245999877,3,439,0.6762948657657104,0.0006073582950419449,77.94078063964844,COMPLETE
302,0.16988959908485413,2023-09-04 11:52:35.623230,2023-09-04 11:52:36.991241,0 days 00:00:01.368011,Tanh,Tanh,Tanh,,79,21,12.0,14.0,,0.0029893332684651232,3,445,0.7140718958380217,0.000903809394252862,199.99702507626694,COMPLETE
303,0.22347839176654816,2023-09-04 11:52:36.991551,2023-09-04 11:52:37.685911,0 days 00:00:00.694360,Tanh,Tanh,Tanh,,74,20,5.0,15.0,,0.004604650961028113,3,475,0.7419425417342225,0.0005249519130499293,87.36281035496638,COMPLETE
304,0.1959170252084732,2023-09-04 11:52:37.686220,2023-09-04 11:52:38.562781,0 days 00:00:00.876561,Tanh,Tanh,Tanh,,82,20,23.0,13.0,,0.00556723755052639,3,449,0.6506890173473531,0.0007598943901086557,82.84188437160057,COMPLETE
305,0.14567266404628754,2023-09-04 11:52:38.563093,2023-09-04 11:52:39.456700,0 days 00:00:00.893607,Tanh,Tanh,Tanh,,71,21,23.0,16.0,,0.007928093183761965,3,474,0.7149326060960433,0.0004889950461641654,79.8707198527322,COMPLETE
306,0.15954045951366425,2023-09-04 11:52:39.456997,2023-09-04 11:52:40.313660,0 days 00:00:00.856663,Tanh,Tanh,Tanh,,72,22,5.0,17.0,,0.007880060461490599,3,449,0.7078711995023375,0.0004938833400535636,93.03173896447936,COMPLETE
307,0.19464541971683502,2023-09-04 11:52:40.313973,2023-09-04 11:52:41.066048,0 days 00:00:00.752075,Tanh,Tanh,Tanh,,76,21,9.0,16.0,,0.0065748294592356945,3,459,0.751794362215214,0.0006041288118092656,81.88549552645001,COMPLETE
308,0.15017297863960266,2023-09-04 11:52:41.066356,2023-09-04 11:52:41.618155,0 days 00:00:00.551799,Tanh,Tanh,Tanh,,82,22,5.0,16.0,,0.008175900454824362,3,477,0.7223609778696299,0.0004173855932363243,66.48710268194026,COMPLETE
309,0.10348568856716156,2023-09-04 11:52:41.618459,2023-09-04 11:52:42.416307,0 days 00:00:00.797848,Tanh,Tanh,Tanh,,81,22,24.0,15.0,,0.008343053567094404,3,472,0.7304788753300323,0.00042975865135054287,3055.4885777064733,COMPLETE
310,0.21806666254997253,2023-09-04 11:52:42.416616,2023-09-04 11:52:42.913483,0 days 00:00:00.496867,Tanh,Tanh,Tanh,,81,22,4.0,15.0,,0.00845191225069289,3,480,0.6820396801961005,0.00042882427493805384,88.68156842487615,COMPLETE
311,0.18939675390720367,2023-09-04 11:52:42.913796,2023-09-04 11:52:43.719231,0 days 00:00:00.805435,Tanh,Tanh,Tanh,,70,22,5.0,16.0,,0.006758626281442198,3,471,0.7216457881733712,0.0005042706264523679,100.20640004475912,COMPLETE
312,0.17880301177501678,2023-09-04 11:52:43.719562,2023-09-04 11:52:44.651998,0 days 00:00:00.932436,Tanh,Tanh,Tanh,,79,22,5.0,14.0,,0.0054132040620943934,3,479,0.7418849675787486,0.000398537655132715,88.638496089626,COMPLETE
313,0.1746739149093628,2023-09-04 11:52:44.652355,2023-09-04 11:52:45.411813,0 days 00:00:00.759458,Tanh,Tanh,Tanh,,82,22,8.0,15.0,,0.003790482653499244,3,461,0.7631890218649208,0.0005726703815387807,97.77046908362438,COMPLETE
314,0.12386836856603622,2023-09-04 11:52:45.412158,2023-09-04 11:52:46.049601,0 days 00:00:00.637443,Tanh,Tanh,ReLU,,77,21,24.0,16.0,,0.008729474553441642,3,469,0.7116097072017087,0.00043487824296324694,116.35475189831791,COMPLETE
315,0.14158737659454346,2023-09-04 11:52:46.049912,2023-09-04 11:52:46.967068,0 days 00:00:00.917156,Tanh,Tanh,ReLU,,76,21,24.0,16.0,,0.007808444587478654,3,494,0.7017006691124926,0.0004300741490978493,127.11976146697998,COMPLETE
316,0.14702865481376648,2023-09-04 11:52:46.967376,2023-09-04 11:52:47.496705,0 days 00:00:00.529329,Tanh,Tanh,ReLU,,73,21,24.0,15.0,,0.0059976981439063175,3,500,0.6664993892169758,0.0006495580838325179,89.51482500348773,COMPLETE
317,0.16477173566818237,2023-09-04 11:52:47.497017,2023-09-04 11:52:49.997876,0 days 00:00:02.500859,Tanh,Tanh,ReLU,,69,21,24.0,15.0,,0.006233912267982575,3,493,0.6595098220490325,0.0007074883688230218,68.03292168962194,COMPLETE
318,0.20045322179794312,2023-09-04 11:52:49.998214,2023-09-04 11:52:50.686260,0 days 00:00:00.688046,Tanh,Tanh,ReLU,,75,21,24.0,16.0,,0.004858192428482616,3,499,0.6896870030183229,0.0004971360694521508,73.8421584075352,COMPLETE
319,0.2147320657968521,2023-09-04 11:52:50.686585,2023-09-04 11:52:51.100716,0 days 00:00:00.414131,Tanh,Tanh,ReLU,,72,21,24.0,15.0,,0.006060276636620514,3,465,0.7081878331415624,0.0003714570200863772,87.09521675109863,COMPLETE
320,0.13413742184638977,2023-09-04 11:52:51.101051,2023-09-04 11:52:51.681965,0 days 00:00:00.580914,Tanh,Tanh,ReLU,,74,21,24.0,17.0,,0.006860403203311929,3,486,0.6393706613456476,0.0006372788550118553,93.1893097559611,COMPLETE
321,0.16254153847694397,2023-09-04 11:52:51.682288,2023-09-04 11:52:52.373281,0 days 00:00:00.690993,Tanh,Tanh,ReLU,,74,22,24.0,17.0,,0.008095500633381634,3,485,0.6345938506671315,0.000780179467248182,58.00784288603684,COMPLETE
322,0.1065799742937088,2023-09-04 11:52:52.373600,2023-09-04 11:52:55.087436,0 days 00:00:02.713836,Tanh,Tanh,ReLU,,73,21,24.0,17.0,,0.007002335078847388,3,473,0.6755370070328294,0.0010243258417568964,65.29349854935047,COMPLETE
323,0.1294928342103958,2023-09-04 11:52:55.087978,2023-09-04 11:52:57.129501,0 days 00:00:02.041523,Tanh,Tanh,ReLU,Sigmoid,76,21,24.0,18.0,24.0,0.007193360592287394,4,473,0.6799908907212877,0.0008832421158197019,94.87838684082031,COMPLETE
324,0.19594493508338928,2023-09-04 11:52:57.130060,2023-09-04 11:52:58.942493,0 days 00:00:01.812433,Tanh,Tanh,ReLU,Sigmoid,76,22,24.0,18.0,24.0,0.007002357181870936,4,456,0.6828589867253548,0.0010503671871582325,123.60332402316007,COMPLETE
325,0.14136198163032532,2023-09-04 11:52:58.943057,2023-09-04 11:53:01.994272,0 days 00:00:03.051215,Tanh,Tanh,ReLU,Sigmoid,78,21,24.0,18.0,21.0,0.005025116307771525,4,484,0.6452172355485284,0.0011871186973913823,190.82837027090568,COMPLETE
326,0.1344165951013565,2023-09-04 11:53:01.994830,2023-09-04 11:53:04.612760,0 days 00:00:02.617930,Tanh,Tanh,ReLU,Sigmoid,77,21,24.0,18.0,20.0,0.0087138553513701,4,486,0.6424729940183969,0.0011241317894788517,89.66245377369417,COMPLETE
327,0.18002858757972717,2023-09-04 11:53:04.613104,2023-09-04 11:53:05.086518,0 days 00:00:00.473414,Tanh,Tanh,ReLU,Sigmoid,77,22,24.0,19.0,21.0,0.008556094081702995,4,490,0.6167093182735401,0.0013369965993920213,82.19488874162947,COMPLETE
328,0.1878480464220047,2023-09-04 11:53:05.086868,2023-09-04 11:53:05.840182,0 days 00:00:00.753314,Tanh,Tanh,ReLU,Sigmoid,76,21,23.0,18.0,21.0,0.006912727996389233,4,481,0.6775960481622306,0.001273012220844441,91.35994030879094,COMPLETE
329,0.18058116734027863,2023-09-04 11:53:05.840514,2023-09-04 11:53:06.398369,0 days 00:00:00.557855,Tanh,Tanh,ReLU,Sigmoid,74,21,24.0,18.0,18.0,0.009550455229873887,4,475,0.7524662280641403,0.0010234250545246523,74.63824238496669,COMPLETE
330,0.21690095961093903,2023-09-04 11:53:06.398704,2023-09-04 11:53:07.096524,0 days 00:00:00.697820,Tanh,Tanh,ReLU,Sigmoid,78,21,24.0,18.0,22.0,0.005491271306319856,4,470,0.6677059574042374,0.0011126175600613857,288.4728463620556,COMPLETE
331,0.18281154334545135,2023-09-04 11:53:07.096849,2023-09-04 11:53:07.725346,0 days 00:00:00.628497,Tanh,Tanh,ReLU,Sigmoid,79,22,24.0,17.0,18.0,0.008844267731175045,4,487,0.6411703013654196,0.0009661095622449499,86.08459116064984,COMPLETE
332,0.16688866913318634,2023-09-04 11:53:07.725687,2023-09-04 11:53:08.486248,0 days 00:00:00.760561,Tanh,Tanh,ReLU,Sigmoid,76,21,23.0,18.0,22.0,0.0068594112486543455,4,492,0.7391543589921296,0.0017409362428691556,87.59384663899739,COMPLETE
333,0.1903134435415268,2023-09-04 11:53:08.486593,2023-09-04 11:53:09.880823,0 days 00:00:01.394230,Tanh,Tanh,ReLU,Sigmoid,74,21,24.0,17.0,14.0,0.0023140327962023607,4,472,0.763782501226147,0.0008601426460520385,108.76331583658855,COMPLETE
334,0.152030348777771,2023-09-04 11:53:09.881156,2023-09-04 11:53:11.033688,0 days 00:00:01.152532,Tanh,Tanh,ReLU,Sigmoid,78,22,23.0,17.0,16.0,0.005224318868836563,4,480,0.6316252822736065,0.0008800878301554354,70.72804388839208,COMPLETE
335,0.23711247742176056,2023-09-04 11:53:11.034012,2023-09-04 11:53:11.502097,0 days 00:00:00.468085,Tanh,Tanh,ReLU,Sigmoid,80,21,24.0,19.0,20.0,0.009003378262909737,4,417,0.7021026349788945,0.0015079524564340014,89.50179315382435,COMPLETE
336,0.19661802053451538,2023-09-04 11:53:11.502423,2023-09-04 11:53:11.814173,0 days 00:00:00.311750,Tanh,Tanh,ReLU,Leaky,77,21,24.0,18.0,15.0,0.006796601035107036,4,464,0.6188116817324024,0.001377719247258899,77.4874279715798,COMPLETE
337,0.2044716328382492,2023-09-04 11:53:11.814491,2023-09-04 11:53:12.346139,0 days 00:00:00.531648,Tanh,Tanh,ReLU,Sigmoid,75,21,23.0,17.0,23.0,0.003075924502497922,4,488,0.5854246930124027,0.0007874815965193054,92.32639145269627,COMPLETE
338,0.14211566746234894,2023-09-04 11:53:12.346460,2023-09-04 11:53:13.491801,0 days 00:00:01.145341,Tanh,Tanh,ReLU,Sigmoid,80,22,24.0,17.0,17.0,0.007599635992865091,4,495,0.653041209811916,0.0010718770560122664,93.34432075763571,COMPLETE
339,0.22411565482616425,2023-09-04 11:53:13.492126,2023-09-04 11:53:14.000004,0 days 00:00:00.507878,Tanh,Tanh,ReLU,Sigmoid,78,14,24.0,16.0,13.0,0.0046271493428532385,4,471,0.7678200687290596,0.0012698123111999397,85.3740704444147,COMPLETE
340,0.1217947006225586,2023-09-04 11:53:14.000330,2023-09-04 11:53:14.807370,0 days 00:00:00.807040,Tanh,Tanh,ReLU,Leaky,73,21,11.0,17.0,20.0,0.006043334566442257,4,465,0.7289618730608994,0.0006741746298387781,63.171971981342026,COMPLETE
341,0.1636262983083725,2023-09-04 11:53:14.807705,2023-09-04 11:53:15.834967,0 days 00:00:01.027262,Tanh,Tanh,ReLU,Leaky,73,21,23.0,17.0,20.0,0.005889987927902954,4,455,0.7318051155493006,0.000693588645469313,93.70077362060547,COMPLETE
342,0.12738391757011414,2023-09-04 11:53:15.835295,2023-09-04 11:53:16.669010,0 days 00:00:00.833715,Tanh,Tanh,ReLU,Leaky,80,22,11.0,18.0,23.0,0.003986512929166895,4,464,0.7979522308413781,0.0009563287087687931,106.60715396587665,COMPLETE
343,0.17986899614334106,2023-09-04 11:53:16.669354,2023-09-04 11:53:17.350737,0 days 00:00:00.681383,Tanh,Tanh,ReLU,Leaky,79,23,9.0,19.0,23.0,0.0038925835448835704,4,431,0.7896463436786915,0.0009656769061659881,77.3670489901588,COMPLETE
344,0.13249734044075012,2023-09-04 11:53:17.351082,2023-09-04 11:53:18.522864,0 days 00:00:01.171782,Tanh,Tanh,ReLU,Leaky,71,22,11.0,18.0,22.0,0.003457326492315495,4,463,0.7981515794259627,0.0010941003488530608,89.32699209019758,COMPLETE
345,0.13008113205432892,2023-09-04 11:53:18.523214,2023-09-04 11:53:19.480267,0 days 00:00:00.957053,Tanh,Tanh,ReLU,Leaky,69,23,11.0,18.0,24.0,0.0035999934464834562,4,462,0.7414571616973313,0.0008455728894761612,163.77280097172178,COMPLETE
346,0.1750383973121643,2023-09-04 11:53:19.480626,2023-09-04 11:53:20.452276,0 days 00:00:00.971650,Tanh,Tanh,ReLU,Leaky,68,23,11.0,18.0,24.0,0.0033223958871494257,4,463,0.7348698754784452,0.0008881461011341586,65.2095393811242,COMPLETE
347,0.1721431463956833,2023-09-04 11:53:20.452607,2023-09-04 11:53:21.476997,0 days 00:00:01.024390,Tanh,Tanh,ReLU,Leaky,71,23,11.0,19.0,23.0,0.002663566449033949,4,465,0.7532267267724919,0.0008234695832257781,74.2068475292575,COMPLETE
348,0.31922000646591187,2023-09-04 11:53:21.477335,2023-09-04 11:53:21.982227,0 days 00:00:00.504892,Tanh,Tanh,ReLU,Leaky,66,22,10.0,18.0,22.0,0.0034635802456926515,4,437,0.7293436402012057,0.0010992411544531431,102.55752984408674,COMPLETE
349,0.15689826011657715,2023-09-04 11:53:21.982557,2023-09-04 11:53:24.104826,0 days 00:00:02.122269,Tanh,Tanh,ReLU,Leaky,70,23,10.0,19.0,20.0,0.0026702100197942284,4,455,0.7989868847645811,0.0006782277068599248,73.50138826081248,COMPLETE
350,0.18048903346061707,2023-09-04 11:53:24.105388,2023-09-04 11:53:26.519821,0 days 00:00:02.414433,Tanh,Tanh,ReLU,Leaky,73,22,11.0,18.0,24.0,0.004100824298264088,4,466,0.6920109009913287,0.0019087408924889004,108.00228219283254,COMPLETE
351,0.15194296836853027,2023-09-04 11:53:26.520171,2023-09-04 11:53:28.230016,0 days 00:00:01.709845,Tanh,Tanh,ReLU,Leaky,72,23,12.0,20.0,22.0,0.0021523205929964238,4,477,0.761175065109415,0.0007383989711605164,131.69850918098732,COMPLETE
352,0.1697463095188141,2023-09-04 11:53:28.230352,2023-09-04 11:53:29.275457,0 days 00:00:01.045105,Tanh,Tanh,ReLU,Leaky,70,22,11.0,17.0,19.0,0.004245171461136014,4,443,0.7999870800478146,0.0009564014277759868,77.86768754323323,COMPLETE
353,0.19241873919963837,2023-09-04 11:53:29.275800,2023-09-04 11:53:30.054699,0 days 00:00:00.778899,Tanh,Tanh,ReLU,Leaky,68,22,10.0,17.0,23.0,0.0031712145729585065,4,455,0.7212695518562453,0.0006653106486986334,88.06769641240437,COMPLETE
354,0.1484256237745285,2023-09-04 11:53:30.055042,2023-09-04 11:53:30.902026,0 days 00:00:00.846984,Tanh,Tanh,ReLU,Leaky,74,23,13.0,17.0,24.0,0.005821762416617817,4,469,0.6789588953368471,2.854028867198639e-05,103.1686220330707,COMPLETE
355,0.12208829820156097,2023-09-04 11:53:30.902365,2023-09-04 11:53:33.638619,0 days 00:00:02.736254,Tanh,Tanh,ReLU,Leaky,80,22,12.0,18.0,21.0,0.004638638514331577,4,459,0.7417726787002686,0.0005890911808709772,73.61225172344007,COMPLETE
356,0.21337822079658508,2023-09-04 11:53:33.639225,2023-09-04 11:53:36.080268,0 days 00:00:02.441043,Tanh,Tanh,ReLU,Leaky,71,22,12.0,18.0,21.0,0.003585053961497894,4,452,0.7408484872601739,0.0008339752069299519,119.20196936265478,COMPLETE
357,0.11465643346309662,2023-09-04 11:53:36.080841,2023-09-04 11:53:38.325556,0 days 00:00:02.244715,Tanh,Tanh,ReLU,Leaky,61,22,13.0,18.0,19.0,0.0047486161362414675,4,461,0.7041378574095569,0.0005888457788998253,61.01607475818043,COMPLETE
358,0.15541349351406097,2023-09-04 11:53:38.325893,2023-09-04 11:53:39.568336,0 days 00:00:01.242443,Tanh,Tanh,ReLU,Leaky,58,22,13.0,19.0,19.0,0.0043349267573117075,4,466,0.6712921951152981,0.0005900281527175057,125.06931531751478,COMPLETE
359,0.200496107339859,2023-09-04 11:53:39.568693,2023-09-04 11:53:40.664719,0 days 00:00:01.096026,Tanh,Tanh,ReLU,Leaky,66,23,10.0,18.0,22.0,0.004526147854591001,4,478,0.707538826350763,0.0006711673672349273,118.60291118006552,COMPLETE
360,0.18327023088932037,2023-09-04 11:53:40.665054,2023-09-04 11:53:42.074498,0 days 00:00:01.409444,Tanh,Tanh,ReLU,Leaky,61,22,12.0,18.0,20.0,0.00172667144574336,4,459,0.6066434482167355,0.0011651500389974342,83.67195884130334,COMPLETE
361,0.3556308448314667,2023-09-04 11:53:42.074850,2023-09-04 11:53:48.749291,0 days 00:00:06.674441,Tanh,Tanh,ReLU,Leaky,75,23,11.0,18.0,23.0,2.785246861313324e-05,4,471,0.6871317952724034,0.000823524162158352,129.32529603346646,COMPLETE
362,0.1764770895242691,2023-09-04 11:53:48.749637,2023-09-04 11:53:49.900642,0 days 00:00:01.151005,Tanh,Tanh,ReLU,Leaky,72,22,12.0,19.0,21.0,0.002984007839277511,4,461,0.7243513178129031,0.0005616857127735194,175.35368039872913,COMPLETE
363,0.17045308649539948,2023-09-04 11:53:49.900984,2023-09-04 11:53:50.912491,0 days 00:00:01.011507,Tanh,Tanh,ReLU,Leaky,65,23,11.0,17.0,24.0,0.003776144436719217,4,479,0.7568491473925895,0.0009440397781711194,86.0442921153286,COMPLETE
364,0.1598999947309494,2023-09-04 11:53:50.912843,2023-09-04 11:53:53.802745,0 days 00:00:02.889902,Tanh,Tanh,ReLU,Leaky,63,24,11.0,18.0,18.0,0.0010672288456970123,4,465,0.6560530401378261,0.0015414458750269205,63.72595632643927,COMPLETE
365,0.1876988559961319,2023-09-04 11:53:53.803191,2023-09-04 11:53:54.814118,0 days 00:00:01.010927,Tanh,Tanh,ReLU,Leaky,75,22,15.0,14.0,22.0,0.00506287743755919,4,474,0.7019039332807202,0.0007278554240242385,78.34897232055664,COMPLETE
366,0.18903778493404388,2023-09-04 11:53:54.814448,2023-09-04 11:53:55.626863,0 days 00:00:00.812415,Tanh,Tanh,ReLU,Tanh,73,21,14.0,17.0,21.0,0.006213958760463939,4,457,0.7585523991535738,0.000546198951256596,75.76488206824477,COMPLETE
367,0.2671912610530853,2023-09-04 11:53:55.627214,2023-09-04 11:53:56.183847,0 days 00:00:00.556633,Tanh,Tanh,ReLU,ReLU,77,22,12.0,20.0,19.0,0.005026397609497673,4,478,0.7286980743526923,0.027494407475569423,120.4821228451199,COMPLETE
368,0.17245735228061676,2023-09-04 11:53:56.184195,2023-09-04 11:53:57.403485,0 days 00:00:01.219290,Tanh,Tanh,ReLU,Leaky,69,22,10.0,18.0,23.0,0.002804097014587687,4,442,0.673427628287001,0.0031197776154682022,98.53535963849323,COMPLETE
369,0.1760512739419937,2023-09-04 11:53:57.403832,2023-09-04 11:53:58.523647,0 days 00:00:01.119815,Tanh,Tanh,ReLU,Leaky,80,21,16.0,17.0,10.0,0.003807339099997597,4,485,0.7002150107044188,0.0006588147166801686,83.26638533193854,COMPLETE
370,0.2460673302412033,2023-09-04 11:53:58.523984,2023-09-04 11:53:59.175240,0 days 00:00:00.651256,Tanh,Tanh,ReLU,Leaky,84,24,11.0,16.0,17.0,0.002316831104931344,4,467,0.7645654601017313,0.0010971683777574442,141.33318754684095,COMPLETE
371,0.274665892124176,2023-09-04 11:53:59.175575,2023-09-04 11:54:02.184478,0 days 00:00:03.008903,Tanh,Tanh,ReLU,Tanh,76,21,12.0,13.0,20.0,0.0003390762075545184,4,452,0.7340499158691997,0.000504640789530736,126.2614219072953,COMPLETE
372,0.20025427639484406,2023-09-04 11:54:02.184828,2023-09-04 11:54:02.739351,0 days 00:00:00.554523,Tanh,Tanh,ReLU,ReLU,81,22,13.0,19.0,22.0,0.006494559453677555,4,473,0.6384466648896062,0.0007995357966359587,76.77358869226967,COMPLETE
