number,value,datetime_start,datetime_complete,duration,params_activation1,params_activation2,params_activation3,params_activation4,params_batch_size,params_fl1,params_fl2,params_fl3,params_fl4,params_learning_rate,params_n_layers,params_num_epochs,params_train_size,params_weight_decay,user_attrs_mre,state
291,0.23554961383342743,2023-09-04 12:02:09.816612,2023-09-04 12:02:10.083052,0 days 00:00:00.266440,Tanh,ReLU,,,91,15,22.0,,,0.019517852186717907,2,475,0.7137909595140993,0.0009840711392655125,77.97787143873131,COMPLETE
292,0.18565420806407928,2023-09-04 12:02:10.083346,2023-09-04 12:02:10.292518,0 days 00:00:00.209172,ReLU,Leaky,,,94,17,13.0,,,0.016244037760916652,2,71,0.7987319038659989,0.0002462041902255122,113.4051468372345,COMPLETE
293,0.16697131097316742,2023-09-04 12:02:10.292854,2023-09-04 12:02:10.940121,0 days 00:00:00.647267,ReLU,Tanh,,,81,16,23.0,,,0.013164312068958035,2,465,0.753737688216539,0.0006542281458266562,103.87082488448532,COMPLETE
294,0.45038488507270813,2023-09-04 12:02:10.940403,2023-09-04 12:02:11.204789,0 days 00:00:00.264386,ReLU,ReLU,,,75,2,24.0,,,0.009372873932597744,2,482,0.6656149409886274,0.00014521354653110617,111.9516246629798,COMPLETE
295,0.19002903997898102,2023-09-04 12:02:11.205091,2023-09-04 12:02:12.938513,0 days 00:00:01.733422,ReLU,Tanh,,,100,11,15.0,,,0.0074433065071795096,2,425,0.7283997214167461,0.0011793650459790126,75.07999087488929,COMPLETE
296,0.3165064752101898,2023-09-04 12:02:12.939005,2023-09-04 12:02:13.293504,0 days 00:00:00.354499,ReLU,ReLU,Tanh,Sigmoid,79,18,20.0,19.0,19.0,0.005103257343135217,4,462,0.10739588462479657,6.0065819715957e-05,557.4139802932739,COMPLETE
297,0.18691006302833557,2023-09-04 12:02:13.294047,2023-09-04 12:02:14.945376,0 days 00:00:01.651329,ReLU,Sigmoid,,,85,17,14.0,,,0.02321494128787567,2,448,0.7674248164482151,0.00019595021239925684,83.15195683963964,COMPLETE
298,0.15609869360923767,2023-09-04 12:02:14.945668,2023-09-04 12:02:15.384846,0 days 00:00:00.439178,ReLU,Tanh,,,83,18,11.0,,,0.06189388834641431,2,363,0.6865220365765536,0.0008168169768632832,151.981809706915,COMPLETE
299,0.24341236054897308,2023-09-04 12:02:15.385164,2023-09-04 12:02:15.686926,0 days 00:00:00.301762,Sigmoid,ReLU,,,90,20,13.0,,,0.0289951431006444,2,434,0.3108447412332029,0.0036867148366158146,105.98033685199285,COMPLETE
300,0.1622561812400818,2023-09-04 12:02:15.687211,2023-09-04 12:02:16.021326,0 days 00:00:00.334115,ReLU,Tanh,Leaky,,96,14,2.0,14.0,,0.04390859692089725,3,472,0.5400155841542691,0.00010919521939942377,90.0501515156514,COMPLETE
301,0.14457319676876068,2023-09-04 12:02:16.021621,2023-09-04 12:02:17.764803,0 days 00:00:01.743182,ReLU,ReLU,,,88,15,12.0,,,0.010552733778532143,2,454,0.7407042448856032,0.0005729472098446103,61.862204204906114,COMPLETE
302,0.23397891223430634,2023-09-04 12:02:17.765287,2023-09-04 12:02:18.754774,0 days 00:00:00.989487,Leaky,Leaky,,,70,16,23.0,,,0.005948931873578858,2,484,0.35877151614952096,0.0015772704037193199,102.87816742488316,COMPLETE
303,0.1860450804233551,2023-09-04 12:02:18.755279,2023-09-04 12:02:20.446794,0 days 00:00:01.691515,ReLU,Tanh,,,82,19,16.0,,,0.014639863588035696,2,206,0.7081826297870953,0.0004596345130100451,398.3568372224507,COMPLETE
304,0.3176289200782776,2023-09-04 12:02:20.447281,2023-09-04 12:02:20.942320,0 days 00:00:00.495039,ReLU,,,,85,17,,,,0.018984122861704072,1,419,0.1884299021410402,0.00016724652067520775,160.5191637479342,COMPLETE
305,0.1366478055715561,2023-09-04 12:02:20.942806,2023-09-04 12:02:22.793359,0 days 00:00:01.850553,ReLU,ReLU,,,77,21,21.0,,,0.034857452535526405,2,255,0.7632100153156419,0.0002778591549795106,84.33721453802926,COMPLETE
306,0.14600010216236115,2023-09-04 12:02:22.793858,2023-09-04 12:02:24.163859,0 days 00:00:01.370001,ReLU,Tanh,,,81,17,14.0,,,0.012653932514441128,2,410,0.6438161265957929,8.376414160105756e-05,106.3568829886521,COMPLETE
307,0.21823088824748993,2023-09-04 12:02:24.164240,2023-09-04 12:02:24.624447,0 days 00:00:00.460207,ReLU,ReLU,,,87,3,22.0,,,0.003935052301992965,2,463,0.7989211829498193,0.0009137331007931457,85.20263456686949,COMPLETE
308,0.17907068133354187,2023-09-04 12:02:24.624765,2023-09-04 12:02:25.171208,0 days 00:00:00.546443,ReLU,Tanh,,,79,16,15.0,,,0.008051354305539339,2,439,0.5663244721886128,0.0007375645719504416,162.90596237182618,COMPLETE
309,0.20731499791145325,2023-09-04 12:02:25.171510,2023-09-04 12:02:29.127969,0 days 00:00:03.956459,ReLU,Sigmoid,,,74,18,24.0,,,0.0020652843799820833,2,186,0.7204254429111646,0.0001176350194359216,109.08392056964692,COMPLETE
310,0.3408283293247223,2023-09-04 12:02:29.128471,2023-09-04 12:02:29.802652,0 days 00:00:00.674181,ReLU,Tanh,,,84,14,16.0,,,0.01757412209558537,2,477,0.6226877294552964,0.041188375647154545,138.95162979761758,COMPLETE
311,0.25453755259513855,2023-09-04 12:02:29.802951,2023-09-04 12:02:30.083329,0 days 00:00:00.280378,ReLU,ReLU,,,92,16,20.0,,,0.02361641287483278,2,444,0.5871230106473223,0.0003621470470031253,90.7170557975769,COMPLETE
312,0.18907228112220764,2023-09-04 12:02:30.083629,2023-09-04 12:02:30.685608,0 days 00:00:00.601979,ReLU,Leaky,,,82,10,13.0,,,0.009342292583637203,2,456,0.7686364490279173,0.007341580662490072,81.91161447201135,COMPLETE
313,0.17371448874473572,2023-09-04 12:02:30.685902,2023-09-04 12:02:31.128986,0 days 00:00:00.443084,ReLU,Tanh,,,86,12,17.0,,,0.05259828031048435,2,473,0.6795221586972902,0.0012813745402613633,116.29995603339617,COMPLETE
314,0.25532829761505127,2023-09-04 12:02:31.129290,2023-09-04 12:02:31.528841,0 days 00:00:00.399551,ReLU,ReLU,,,72,20,21.0,,,0.006628323477905069,2,487,0.7390676756475706,0.017695507890970043,94.02248358726501,COMPLETE
315,0.2609478533267975,2023-09-04 12:02:31.529140,2023-09-04 12:02:31.900326,0 days 00:00:00.371186,Tanh,Tanh,,,98,15,18.0,,,0.02849544034130943,2,135,0.705663560340243,0.021279803646343787,101.88829683002673,COMPLETE
316,0.2098308652639389,2023-09-04 12:02:31.900626,2023-09-04 12:02:32.495533,0 days 00:00:00.594907,Leaky,ReLU,,,51,19,12.0,,,0.011048539539406299,2,112,0.7726046733502809,0.0005708623104088924,79.9461158953215,COMPLETE
317,0.1383916437625885,2023-09-04 12:02:32.495846,2023-09-04 12:02:33.544075,0 days 00:00:01.048229,ReLU,Tanh,,,77,13,22.0,,,0.015678017994108184,2,156,0.7976704322266533,6.543829568085921e-05,69.61843574878782,COMPLETE
318,0.1664462834596634,2023-09-04 12:02:33.544387,2023-09-04 12:02:34.138372,0 days 00:00:00.593985,ReLU,ReLU,,,80,17,14.0,,,0.004672058962249861,2,427,0.7428353167143643,9.808407813597941e-05,62.90997160398043,COMPLETE
319,0.24100184440612793,2023-09-04 12:02:34.138672,2023-09-04 12:02:34.544773,0 days 00:00:00.406101,ReLU,Tanh,,,27,18,19.0,,,0.03959389180302554,2,220,0.6597570210845324,2.9819476366472788e-05,139.31652620103625,COMPLETE
320,0.22522945702075958,2023-09-04 12:02:34.545073,2023-09-04 12:02:35.550684,0 days 00:00:01.005611,ReLU,ReLU,,,83,16,15.0,,,0.0010838716257752861,2,466,0.470159466558589,4.13007317358067e-05,125.88478475074245,COMPLETE
321,0.21360598504543304,2023-09-04 12:02:35.550989,2023-09-04 12:02:35.835762,0 days 00:00:00.284773,ReLU,Leaky,,,95,17,23.0,,,0.021626863602081974,2,449,0.6972936399267592,0.0010032864072465075,91.70632666128652,COMPLETE
322,0.3209320902824402,2023-09-04 12:02:35.836074,2023-09-04 12:02:35.975340,0 days 00:00:00.139266,ReLU,Tanh,,,89,13,13.0,,,0.013790526480731544,2,463,0.11814761568351875,0.00046823918743085693,155.20906292950664,COMPLETE
323,0.23180349171161652,2023-09-04 12:02:35.975642,2023-09-04 12:02:36.352151,0 days 00:00:00.376509,ReLU,Sigmoid,ReLU,,84,17,24.0,23.0,,0.009221561677998933,3,486,0.7337376311477732,1.723531494176421e-05,79.11858410305447,COMPLETE
324,0.23956753313541412,2023-09-04 12:02:36.352480,2023-09-04 12:02:36.698416,0 days 00:00:00.345936,ReLU,ReLU,Leaky,Leaky,86,18,17.0,14.0,9.0,0.005502443304658856,4,434,0.3698059474565156,4.506457069218816e-05,82.92528620633212,COMPLETE
325,0.18667922914028168,2023-09-04 12:02:36.698738,2023-09-04 12:02:37.100129,0 days 00:00:00.401391,ReLU,Tanh,,,93,15,14.0,,,0.012171022584372703,2,398,0.34266106783679723,7.592322038616346e-05,63.858284548709264,COMPLETE
326,0.15376700460910797,2023-09-04 12:02:37.100438,2023-09-04 12:02:37.567462,0 days 00:00:00.467024,ReLU,Tanh,,,81,16,22.0,,,0.03321318311808134,2,477,0.612254269574451,6.265738630891638e-05,95.7931710879008,COMPLETE
327,0.1788371205329895,2023-09-04 12:02:37.567776,2023-09-04 12:02:38.371395,0 days 00:00:00.803619,Sigmoid,ReLU,,,78,19,16.0,,,0.01687494826654689,2,271,0.7675053701210267,5.626390756952825e-05,78.42825698852539,COMPLETE
328,0.11319328099489212,2023-09-04 12:02:38.371701,2023-09-04 12:02:39.688103,0 days 00:00:01.316402,ReLU,Tanh,,,75,17,23.0,,,0.006951769109485605,2,453,0.7110170024288154,0.00013461382362806878,81.52867684713225,COMPLETE
329,0.16652515530586243,2023-09-04 12:02:39.688393,2023-09-04 12:02:40.323664,0 days 00:00:00.635271,ReLU,Tanh,,,75,20,23.0,,,0.0063489155007292394,2,178,0.7162248781831297,0.00013601500022559498,106.80527346474784,COMPLETE
330,0.20450958609580994,2023-09-04 12:02:40.323968,2023-09-04 12:02:40.635516,0 days 00:00:00.311548,Leaky,Tanh,,,73,17,23.0,,,0.025370393165304494,2,460,0.7484942422057492,0.0006584200255968051,116.65490595499675,COMPLETE
331,0.38128137588500977,2023-09-04 12:02:40.635838,2023-09-04 12:02:41.506421,0 days 00:00:00.870583,ReLU,Tanh,,,76,20,24.0,,,0.0034042705389431853,2,470,0.798729652952393,0.05336793652443683,118.76743427221326,COMPLETE
332,0.22540725767612457,2023-09-04 12:02:41.506716,2023-09-04 12:02:41.969225,0 days 00:00:00.462509,ReLU,Tanh,,,46,16,7.0,,,0.007599484594963316,2,494,0.4361933929548959,0.008872619505512777,122.69732251374617,COMPLETE
333,0.1723332405090332,2023-09-04 12:02:41.969525,2023-09-04 12:02:42.551271,0 days 00:00:00.581746,ReLU,Tanh,,,79,18,23.0,,,0.019364712137329473,2,452,0.6934510575664745,0.00017877715511350643,79.29499766511738,COMPLETE
334,0.1417798101902008,2023-09-04 12:02:42.551575,2023-09-04 12:02:42.995257,0 days 00:00:00.443682,ReLU,Tanh,,,75,14,9.0,,,0.04919158272545033,2,469,0.7653524800358947,0.0008314189784861437,133.741797952091,COMPLETE
335,0.21340450644493103,2023-09-04 12:02:42.995557,2023-09-04 12:02:43.249597,0 days 00:00:00.254040,ReLU,ReLU,,,77,17,22.0,,,0.004996335553493612,2,477,0.29202942041099766,0.0003470553268472904,127.61570692062378,COMPLETE
336,0.1291888803243637,2023-09-04 12:02:43.249893,2023-09-04 12:02:43.681165,0 days 00:00:00.431272,ReLU,Tanh,,,72,17,15.0,,,0.029226541428021044,2,195,0.7455806186596874,0.0011124254713921545,67.52488752092634,COMPLETE
337,0.1662389189004898,2023-09-04 12:02:43.681464,2023-09-04 12:02:44.062473,0 days 00:00:00.381009,ReLU,ReLU,,,82,18,23.0,,,0.03879167764122503,2,418,0.7169616434125685,0.0002423307704620399,79.65020823478699,COMPLETE
338,0.13009808957576752,2023-09-04 12:02:44.062769,2023-09-04 12:02:44.593036,0 days 00:00:00.530267,ReLU,Tanh,,,84,8,24.0,,,0.06727561061586512,2,456,0.7719495761519924,4.971804671130751e-05,114.3869917496391,COMPLETE
339,0.19703510403633118,2023-09-04 12:02:44.593380,2023-09-04 12:02:44.900683,0 days 00:00:00.307303,ReLU,ReLU,,,80,16,21.0,,,0.015190510634119312,2,447,0.42382867532117496,0.0001037714607870742,79.1644409534543,COMPLETE
340,0.26136544346809387,2023-09-04 12:02:44.901004,2023-09-04 12:02:45.768804,0 days 00:00:00.867800,ReLU,Tanh,,,87,14,22.0,,,0.0017628771019670914,2,500,0.6754806942448602,0.006324618568072173,115.26375016299161,COMPLETE
341,0.17678208649158478,2023-09-04 12:02:45.769124,2023-09-04 12:02:48.053162,0 days 00:00:02.284038,Tanh,Sigmoid,,,54,15,13.0,,,0.0027599497761197065,2,482,0.7996297336364708,0.0001526694227523542,94.71719699982674,COMPLETE
342,0.19725866615772247,2023-09-04 12:02:48.053453,2023-09-04 12:02:48.829723,0 days 00:00:00.776270,ReLU,Tanh,,,85,7,16.0,,,0.010438801965510445,2,282,0.3837975483836186,0.0005130867255096586,90.41122385660807,COMPLETE
343,0.20799119770526886,2023-09-04 12:02:48.830018,2023-09-04 12:02:49.920429,0 days 00:00:01.090411,Leaky,ReLU,,,67,17,23.0,,,0.007706201551369436,2,439,0.721470930696728,0.0004013445253667394,81.29976231118907,COMPLETE
344,0.32029658555984497,2023-09-04 12:02:49.920723,2023-09-04 12:02:50.336638,0 days 00:00:00.415915,ReLU,Tanh,,,78,21,15.0,,,0.08425798264358528,2,464,0.743907137801777,0.02717743576336012,118.1910398210798,COMPLETE
345,0.14606574177742004,2023-09-04 12:02:50.336936,2023-09-04 12:02:50.863472,0 days 00:00:00.526536,ReLU,ReLU,,,83,16,22.0,,,0.0212163458107375,2,239,0.6933874397453007,3.341622001170121e-05,86.84813499450684,COMPLETE
346,0.14301557838916779,2023-09-04 12:02:50.863783,2023-09-04 12:02:51.242062,0 days 00:00:00.378279,ReLU,Tanh,,,81,18,14.0,,,0.013107431185441885,2,486,0.7675556754909126,0.0007261863231427293,88.7376537322998,COMPLETE
347,0.15841008722782135,2023-09-04 12:02:51.242361,2023-09-04 12:02:51.913693,0 days 00:00:00.671332,ReLU,ReLU,,,88,17,17.0,,,0.0064521790905019945,2,454,0.6571047327946982,0.0015273522378815565,90.88300810919867,COMPLETE
348,0.2403196394443512,2023-09-04 12:02:51.913983,2023-09-04 12:02:52.529477,0 days 00:00:00.615494,ReLU,Tanh,,,74,19,24.0,,,0.003874154258115,2,169,0.41139730688664816,8.984973334490677e-05,132.82768112354063,COMPLETE
349,0.29282477498054504,2023-09-04 12:02:52.529783,2023-09-04 12:02:52.855601,0 days 00:00:00.325818,Sigmoid,ReLU,,,76,16,21.0,,,0.0249845162371711,2,470,0.7264531911331659,0.002042623417373166,569.8656248869719,COMPLETE
350,0.21267655491828918,2023-09-04 12:02:52.855899,2023-09-04 12:02:53.113637,0 days 00:00:00.257738,ReLU,Tanh,,,85,15,15.0,,,0.03195011119935324,2,412,0.3226655952466034,0.00021647336664204283,112.45530002675157,COMPLETE
351,0.2872828245162964,2023-09-04 12:02:53.113937,2023-09-04 12:02:53.649159,0 days 00:00:00.535222,ReLU,Tanh,,,79,13,23.0,,,0.00216177702952445,2,425,0.39000413038509324,0.0001289904314396274,169.13788775275736,COMPLETE
352,0.11542794853448868,2023-09-04 12:02:53.649471,2023-09-04 12:02:54.505502,0 days 00:00:00.856031,ReLU,ReLU,,,83,19,13.0,,,0.008792292727658352,2,446,0.7745283353272325,0.0006173887256200439,116.4788399238091,COMPLETE
353,0.19579239189624786,2023-09-04 12:02:54.505787,2023-09-04 12:02:54.837734,0 days 00:00:00.331947,ReLU,ReLU,,,82,20,13.0,,,0.008685066020630055,2,446,0.2387697906529266,0.0006245370491541575,80.19449561623966,COMPLETE
354,0.3415394425392151,2023-09-04 12:02:54.838033,2023-09-04 12:02:55.008948,0 days 00:00:00.170915,ReLU,,,,70,20,,,,0.011063634240506645,1,435,0.27628624490846543,0.0008647775974119206,132.3124546251799,COMPLETE
355,0.18710188567638397,2023-09-04 12:02:55.009235,2023-09-04 12:02:55.572835,0 days 00:00:00.563600,ReLU,ReLU,,,83,19,14.0,,,0.005576345523514159,2,457,0.6980038647622768,0.0005441864942245362,71.19579166836209,COMPLETE
356,0.3845010995864868,2023-09-04 12:02:55.573136,2023-09-04 12:02:55.782516,0 days 00:00:00.209380,ReLU,ReLU,,,80,5,14.0,,,0.007183836074643666,2,430,0.26076683097165165,4.19018607685686e-05,170.25191680244777,COMPLETE
357,0.2467040866613388,2023-09-04 12:02:55.782824,2023-09-04 12:02:56.284191,0 days 00:00:00.501367,Leaky,ReLU,,,86,19,13.0,,,0.00887948095117947,2,445,0.7486191819865159,0.0009972871490952948,83.71884702599567,COMPLETE
358,0.2147129476070404,2023-09-04 12:02:56.284521,2023-09-04 12:02:56.629271,0 days 00:00:00.344750,ReLU,ReLU,,,84,12,16.0,,,0.016545397670677527,2,182,0.30126859224836244,0.0004778598602370109,110.69864156511095,COMPLETE
359,0.20545461773872375,2023-09-04 12:02:56.629591,2023-09-04 12:02:57.241247,0 days 00:00:00.611656,ReLU,ReLU,,,64,17,18.0,,,0.012671867096286676,2,462,0.639743060582743,0.005020772084146979,154.42861758145418,COMPLETE
360,0.21316726505756378,2023-09-04 12:02:57.241562,2023-09-04 12:02:57.948612,0 days 00:00:00.707050,ReLU,ReLU,,,38,20,13.0,,,0.010350875248855512,2,477,0.7184697105786969,0.0013020430589725832,97.0642237663269,COMPLETE
361,0.2638092637062073,2023-09-04 12:02:57.948910,2023-09-04 12:02:58.370259,0 days 00:00:00.421349,ReLU,Sigmoid,,,81,15,22.0,,,0.014199176797573558,2,440,0.4507281716067044,0.002505700413196673,118.58113769005085,COMPLETE
362,0.18282242119312286,2023-09-04 12:02:58.370554,2023-09-04 12:02:58.812820,0 days 00:00:00.442266,ReLU,ReLU,Tanh,,83,16,24.0,16.0,,0.007218937241613126,3,453,0.4784005228129192,0.0006573905936190976,84.41012514554538,COMPLETE
363,0.509668231010437,2023-09-04 12:02:58.813134,2023-09-04 12:03:01.906839,0 days 00:00:03.093705,ReLU,ReLU,,,77,17,15.0,,,3.193130541006699e-05,2,384,0.5418797232100593,0.00040769618623674557,165.40914676586786,COMPLETE
364,0.25424864888191223,2023-09-04 12:03:01.907149,2023-09-04 12:03:02.341041,0 days 00:00:00.433892,ReLU,ReLU,,,87,13,3.0,,,0.004784481945909758,2,490,0.7660033478080769,0.00028424467534287186,90.16382305438702,COMPLETE
365,0.2743202745914459,2023-09-04 12:03:02.341330,2023-09-04 12:03:02.567008,0 days 00:00:00.225678,Tanh,ReLU,,,85,14,20.0,,,0.018353450881820783,2,465,0.21908466301226076,0.0007232624659165653,124.75134658813477,COMPLETE
366,0.28429174423217773,2023-09-04 12:03:02.567314,2023-09-04 12:03:02.706582,0 days 00:00:00.139268,ReLU,ReLU,,,80,17,21.0,,,0.009887724134173714,2,477,0.1616697354927414,0.0005437007039785271,115.01040729723479,COMPLETE
367,0.20452280342578888,2023-09-04 12:03:02.706883,2023-09-04 12:03:03.074502,0 days 00:00:00.367619,ReLU,Sigmoid,,,82,16,19.0,,,0.011469672254773997,2,471,0.515335086934824,0.0008687441998320957,119.30621604919433,COMPLETE
368,0.2549487352371216,2023-09-04 12:03:03.074808,2023-09-04 12:03:07.061797,0 days 00:00:03.986989,ReLU,ReLU,,,89,15,13.0,,,0.00014233656088660196,2,405,0.7409965382076101,5.400626048082866e-05,112.21438521396966,COMPLETE
369,0.19804558157920837,2023-09-04 12:03:07.062097,2023-09-04 12:03:07.330756,0 days 00:00:00.268659,ReLU,Tanh,,,78,18,12.0,,,0.006097865572451542,2,338,0.18585228766398962,2.9956672143392623e-05,104.32065929066052,COMPLETE
370,0.15942029654979706,2023-09-04 12:03:07.331055,2023-09-04 12:03:08.077207,0 days 00:00:00.746152,Leaky,Tanh,,,73,19,23.0,,,0.008210955006091473,2,448,0.6717408799518881,0.0010480665353023752,91.10883386584295,COMPLETE
371,0.18556679785251617,2023-09-04 12:03:08.077511,2023-09-04 12:03:08.450713,0 days 00:00:00.373202,ReLU,ReLU,,,84,14,16.0,,,0.021075961940433433,2,459,0.7680046702741636,7.419066289219038e-05,74.80597507953644,COMPLETE
372,0.15770485997200012,2023-09-04 12:03:08.451010,2023-09-04 12:03:08.909877,0 days 00:00:00.458867,ReLU,Tanh,Leaky,Leaky,86,21,14.0,7.0,3.0,0.015399611981571653,4,430,0.7131802726707245,0.0003413199597302533,77.66137498797792,COMPLETE
373,0.20330537855625153,2023-09-04 12:03:08.910199,2023-09-04 12:03:14.533852,0 days 00:00:05.623653,ReLU,ReLU,,,76,17,17.0,,,0.0002935452450010252,2,485,0.7998621240600587,0.0007793951736119845,112.68227087591113,COMPLETE
374,0.29780706763267517,2023-09-04 12:03:14.534159,2023-09-04 12:03:16.035517,0 days 00:00:01.501358,Sigmoid,Tanh,,,81,16,22.0,,,0.0014402190941913,2,441,0.6842256369690595,0.0006121557716140281,94.30209726969402,COMPLETE
375,0.18437953293323517,2023-09-04 12:03:16.035847,2023-09-04 12:03:16.813071,0 days 00:00:00.777224,ReLU,ReLU,,,83,17,23.0,,,0.012401020571264255,2,204,0.737985354148376,0.0011390910710607912,73.49118296305339,COMPLETE
376,0.13685433566570282,2023-09-04 12:03:16.813383,2023-09-04 12:03:17.356626,0 days 00:00:00.543243,ReLU,Tanh,,,79,19,15.0,,,0.04389402703312324,2,188,0.7704557413072061,0.0004979901430890277,126.71075655066448,COMPLETE
377,0.19512681663036346,2023-09-04 12:03:17.356931,2023-09-04 12:03:17.655820,0 days 00:00:00.298889,ReLU,ReLU,,,88,18,24.0,,,0.00443299266540425,2,420,0.2042710428987387,0.00045291323618095077,90.84195933622472,COMPLETE
378,0.24391455948352814,2023-09-04 12:03:17.656148,2023-09-04 12:03:19.936857,0 days 00:00:02.280709,ReLU,Tanh,,,74,16,14.0,,,0.00045300226893629363,2,469,0.28829156385118165,9.026882963536338e-05,98.31431205440431,COMPLETE
379,0.4163592755794525,2023-09-04 12:03:19.937170,2023-09-04 12:03:24.502694,0 days 00:00:04.565524,ReLU,Sigmoid,,,85,11,20.0,,,7.104417807852711e-05,2,452,0.7067026747622357,0.00016854930963330905,134.90647437509182,COMPLETE
380,0.1906445026397705,2023-09-04 12:03:24.503004,2023-09-04 12:03:24.941018,0 days 00:00:00.438014,ReLU,ReLU,,,17,20,22.0,,,0.018379110417071843,2,494,0.24910300869969346,1.982737506287915e-05,72.1422420950497,COMPLETE
381,0.1650792956352234,2023-09-04 12:03:24.941338,2023-09-04 12:03:25.879928,0 days 00:00:00.938590,ReLU,Tanh,,,82,15,13.0,,,0.00870913120605142,2,479,0.7391548597186618,0.0017958852451345085,82.12228947594052,COMPLETE
382,0.287460595369339,2023-09-04 12:03:25.880251,2023-09-04 12:03:26.387866,0 days 00:00:00.507615,ReLU,ReLU,,,90,13,1.0,,,0.02781490201142157,2,462,0.7712341664048021,4.542394846336267e-05,114.17330932617188,COMPLETE
383,0.24010728299617767,2023-09-04 12:03:26.388179,2023-09-04 12:03:28.055658,0 days 00:00:01.667479,Leaky,Tanh,,,79,18,23.0,,,0.0007448333669054474,2,436,0.40392818459245106,0.0007218325839662212,103.59872716267904,COMPLETE
384,0.15468567609786987,2023-09-04 12:03:28.055976,2023-09-04 12:03:30.068091,0 days 00:00:02.012115,ReLU,Tanh,,,84,16,21.0,,,0.0026327113198888197,2,471,0.5916605782108174,0.0008563955201763543,161.12427098351998,COMPLETE
385,0.12055133283138275,2023-09-04 12:03:30.068436,2023-09-04 12:03:30.809399,0 days 00:00:00.740963,ReLU,ReLU,,,71,17,24.0,,,0.0069274150668562585,2,175,0.6421168436242736,1.1180300533020075e-05,75.41074457302899,COMPLETE
386,0.17483873665332794,2023-09-04 12:03:30.809728,2023-09-04 12:03:31.087746,0 days 00:00:00.278018,ReLU,ReLU,,,75,17,24.0,,,0.05327610193569695,2,177,0.6401803373338074,5.2528908684377725e-05,92.53705749511718,COMPLETE
387,0.154744952917099,2023-09-04 12:03:31.088075,2023-09-04 12:03:31.819331,0 days 00:00:00.731256,ReLU,ReLU,,,69,17,24.0,,,0.009888124650031301,2,174,0.6154222717493336,1.7222093146260628e-05,71.91206257779834,COMPLETE
