number,value,datetime_start,datetime_complete,duration,params_activation1,params_activation2,params_activation3,params_activation4,params_batch_size,params_fl1,params_fl2,params_fl3,params_fl4,params_learning_rate,params_n_layers,params_num_epochs,params_train_size,params_weight_decay,user_attrs_mre,state
271,0.21116524934768677,2023-09-04 11:54:37.741449,2023-09-04 11:54:38.672813,0 days 00:00:00.931364,Tanh,Tanh,,,34,20,19.0,,,0.038793628079264904,2,490,0.7184667450624452,5.620620266089986e-05,74.53215408325195,COMPLETE
272,0.27884283661842346,2023-09-04 11:54:38.673142,2023-09-04 11:54:39.138045,0 days 00:00:00.464903,ReLU,Tanh,,,37,20,18.0,,,0.08928305985740628,2,482,0.7456529321809465,3.9454831086762105e-05,172.22628457205636,COMPLETE
273,0.19104143977165222,2023-09-04 11:54:39.138581,2023-09-04 11:54:40.181405,0 days 00:00:01.042824,Tanh,Tanh,,,30,19,17.0,,,0.019139704505863542,2,476,0.29999789467290167,1.0225535297790755e-05,267.66350274336963,COMPLETE
274,0.2007303386926651,2023-09-04 11:54:40.181942,2023-09-04 11:54:41.771597,0 days 00:00:01.589655,Leaky,Tanh,,,39,20,15.0,,,0.02574999006025236,2,494,0.695345632936882,2.6835643513230157e-05,127.62736101848323,COMPLETE
275,0.20967629551887512,2023-09-04 11:54:41.771923,2023-09-04 11:54:43.019363,0 days 00:00:01.247440,Leaky,Tanh,,,26,19,19.0,,,0.04592440074286087,2,483,0.7958794823367594,1.7150980883967633e-05,84.07851061139787,COMPLETE
276,0.22297611832618713,2023-09-04 11:54:43.019901,2023-09-04 11:54:44.915992,0 days 00:00:01.896091,Leaky,Tanh,Leaky,,32,18,17.0,8.0,,0.055303692320790715,3,470,0.6501409580050843,0.00012774360646928214,87.92687514732624,COMPLETE
277,0.4970664978027344,2023-09-04 11:54:44.916528,2023-09-04 11:54:45.906099,0 days 00:00:00.989571,ReLU,Tanh,Sigmoid,ReLU,36,20,16.0,7.0,5.0,0.04820555689398263,4,493,0.34549285602488594,4.241547782321556e-05,120.89747772216796,COMPLETE
278,0.1958325356245041,2023-09-04 11:54:45.906669,2023-09-04 11:54:47.877622,0 days 00:00:01.970953,Sigmoid,Tanh,ReLU,Leaky,41,21,18.0,12.0,6.0,0.013265622805343661,4,478,0.7630010345072126,1.2910499254839546e-05,78.17744918096633,COMPLETE
279,0.1655683070421219,2023-09-04 11:54:47.877963,2023-09-04 11:54:48.994946,0 days 00:00:01.116983,Leaky,Tanh,,,39,15,20.0,,,0.0209652653672393,2,456,0.7246760575532394,3.075582986700278e-05,107.58294469659978,COMPLETE
280,0.2453075796365738,2023-09-04 11:54:48.995272,2023-09-04 11:54:49.783271,0 days 00:00:00.787999,Leaky,Tanh,,,38,15,21.0,,,0.0015116049641376729,2,465,0.7292628246253173,3.151655258798575e-05,90.6900144304548,COMPLETE
281,0.19229985773563385,2023-09-04 11:54:49.783595,2023-09-04 11:54:50.867657,0 days 00:00:01.084062,Tanh,Tanh,,,35,14,20.0,,,0.016717059582405405,2,470,0.6853730301137422,4.857618712368169e-05,74.27640375597724,COMPLETE
282,0.2028178870677948,2023-09-04 11:54:50.868004,2023-09-04 11:54:51.864869,0 days 00:00:00.996865,Leaky,Tanh,,,28,15,20.0,,,0.012145797422066272,2,457,0.7173294219079794,3.625738774543703e-05,1489.6060776483446,COMPLETE
283,0.2060208022594452,2023-09-04 11:54:51.865297,2023-09-04 11:54:52.682566,0 days 00:00:00.817269,Leaky,Tanh,,,40,13,19.0,,,0.018983796066707314,2,485,0.7651462043454527,0.00158743344627658,124.44899519099745,COMPLETE
284,0.20780031383037567,2023-09-04 11:54:52.682888,2023-09-04 11:54:53.263934,0 days 00:00:00.581046,Leaky,Tanh,,,37,16,19.0,,,0.014938235450101355,2,498,0.7974489411458194,9.150442350271536e-05,99.03377532958984,COMPLETE
285,0.24543176591396332,2023-09-04 11:54:53.264253,2023-09-04 11:54:54.159118,0 days 00:00:00.894865,Leaky,Tanh,,,20,15,20.0,,,0.0012941867689128155,2,452,0.7528768134463297,0.060853277625569045,1432.5187334333148,COMPLETE
286,0.22565993666648865,2023-09-04 11:54:54.159447,2023-09-04 11:54:54.573556,0 days 00:00:00.414109,Leaky,Tanh,,,34,11,18.0,,,0.022080917356036123,2,464,0.7136506733751613,2.1966838408574503e-05,88.88902282714844,COMPLETE
287,0.22195495665073395,2023-09-04 11:54:54.573885,2023-09-04 11:54:54.871845,0 days 00:00:00.297960,ReLU,Tanh,,,52,14,18.0,,,0.011523701844263953,2,263,0.3188091962376798,0.00033766140034807387,90.26449938518245,COMPLETE
288,0.19791655242443085,2023-09-04 11:54:54.872153,2023-09-04 11:54:56.517666,0 days 00:00:01.645513,Leaky,Leaky,Leaky,ReLU,39,17,13.0,7.0,11.0,0.003196915630193676,4,477,0.4852513183368525,3.126181910184466e-05,77.52194121389678,COMPLETE
289,0.21326154470443726,2023-09-04 11:54:56.518004,2023-09-04 11:54:59.382539,0 days 00:00:02.864535,Leaky,Tanh,Sigmoid,Leaky,45,18,19.0,4.0,13.0,0.0006631949226888174,4,500,0.669287528861594,0.00010956745995359056,150.3788673027412,COMPLETE
290,0.20289155840873718,2023-09-04 11:54:59.382981,2023-09-04 11:55:00.132147,0 days 00:00:00.749166,Leaky,Tanh,Leaky,ReLU,30,20,14.0,8.0,10.0,0.015435719444302954,4,448,0.4164961054239823,1.617611921643147e-05,128.90000320062404,COMPLETE
291,0.22463460266590118,2023-09-04 11:55:00.132569,2023-09-04 11:55:00.523138,0 days 00:00:00.390569,Leaky,Tanh,Sigmoid,Leaky,24,19,18.0,7.0,12.0,0.03731620477190269,4,464,0.26570326410684375,7.645344203225572e-05,116.9849722290039,COMPLETE
292,0.19231674075126648,2023-09-04 11:55:00.523491,2023-09-04 11:55:01.638996,0 days 00:00:01.115505,Tanh,Sigmoid,Tanh,Tanh,50,22,18.0,8.0,15.0,0.008731633124998273,4,456,0.739252617823803,6.087372638058527e-05,82.67013161137419,COMPLETE
293,0.18905915319919586,2023-09-04 11:55:01.639456,2023-09-04 11:55:02.421832,0 days 00:00:00.782376,Leaky,Tanh,,,43,23,19.0,,,0.013882206517802543,2,478,0.6911031851149148,2.6840913720000192e-05,1298.9900410970051,COMPLETE
294,0.2144014835357666,2023-09-04 11:55:02.422161,2023-09-04 11:55:03.235312,0 days 00:00:00.813151,Leaky,Sigmoid,Leaky,ReLU,36,20,16.0,9.0,5.0,0.01828955857130238,4,472,0.769720513096229,4.3131621709398404e-05,102.22205243791852,COMPLETE
295,0.19554221630096436,2023-09-04 11:55:03.235697,2023-09-04 11:55:05.150085,0 days 00:00:01.914388,Leaky,Sigmoid,Tanh,Sigmoid,33,16,21.0,15.0,6.0,0.010917878773951582,4,444,0.7349486986223406,0.002711913327790548,94.22021507494378,COMPLETE
296,0.21712158620357513,2023-09-04 11:55:05.150418,2023-09-04 11:55:06.045523,0 days 00:00:00.895105,Leaky,Tanh,Tanh,,41,21,17.0,5.0,,0.002409097253879362,3,455,0.39742426296992595,0.00024982926859662077,88.60840705772499,COMPLETE
297,0.2238471508026123,2023-09-04 11:55:06.045926,2023-09-04 11:55:07.250027,0 days 00:00:01.204101,ReLU,,,,38,20,,,,0.0008450469044245871,1,341,0.3307721381500585,2.0141167064357583e-05,83.4201419136741,COMPLETE
298,0.18219828605651855,2023-09-04 11:55:07.250380,2023-09-04 11:55:10.244185,0 days 00:00:02.993805,Leaky,Sigmoid,ReLU,Sigmoid,45,21,17.0,7.0,3.0,0.0037331922249345716,4,488,0.6287443344862352,0.000620010132855536,102.34708493894284,COMPLETE
299,0.18505574762821198,2023-09-04 11:55:10.244747,2023-09-04 11:55:10.953390,0 days 00:00:00.708643,Leaky,Sigmoid,Tanh,Leaky,40,20,20.0,6.0,4.0,0.022724726721531568,4,463,0.3719085372393653,1.1870268816416321e-05,258.49023985251404,COMPLETE
300,0.20411939918994904,2023-09-04 11:55:10.953731,2023-09-04 11:55:11.495117,0 days 00:00:00.541386,Leaky,Tanh,Tanh,Sigmoid,48,22,15.0,8.0,11.0,0.030233925124811732,4,444,0.41159461900194955,3.538652460449219e-05,120.2269920526549,COMPLETE
301,0.20117779076099396,2023-09-04 11:55:11.495460,2023-09-04 11:55:12.215576,0 days 00:00:00.720116,Tanh,Sigmoid,Tanh,ReLU,37,21,18.0,9.0,7.0,0.04410825563723936,4,435,0.7063955783786031,0.0010080247531394188,96.92446000235421,COMPLETE
302,0.20946286618709564,2023-09-04 11:55:12.215912,2023-09-04 11:55:12.898168,0 days 00:00:00.682256,Leaky,Sigmoid,Leaky,Sigmoid,43,19,19.0,7.0,10.0,0.01687030836817671,4,485,0.6637609330479112,1.5179725439696905e-05,88.12305021286011,COMPLETE
303,0.18588517606258392,2023-09-04 11:55:12.898520,2023-09-04 11:55:14.057759,0 days 00:00:01.159239,Leaky,Tanh,Sigmoid,Sigmoid,26,20,16.0,8.0,8.0,0.01262360035919402,4,450,0.7736169163391802,2.404853785773481e-05,100.77296113967896,COMPLETE
304,0.24626381695270538,2023-09-04 11:55:14.058089,2023-09-04 11:55:14.849815,0 days 00:00:00.791726,Leaky,Sigmoid,Tanh,Sigmoid,40,15,18.0,6.0,7.0,0.0018176887204916137,4,471,0.4378360476732265,2.896090257582418e-05,362.79908851340963,COMPLETE
305,0.22605672478675842,2023-09-04 11:55:14.850171,2023-09-04 11:55:14.974831,0 days 00:00:00.124660,Leaky,Tanh,,,46,14,17.0,,,0.02066113886824829,2,433,0.22048871227448813,1.863648879510586e-05,135.98867840237088,COMPLETE
306,0.20515380799770355,2023-09-04 11:55:14.975230,2023-09-04 11:55:16.510250,0 days 00:00:01.535020,Sigmoid,Sigmoid,Tanh,ReLU,49,21,18.0,7.0,6.0,0.007789412231395777,4,457,0.7418976772633168,0.0003926313129825452,110.76540086076066,COMPLETE
307,0.19182994961738586,2023-09-04 11:55:16.510649,2023-09-04 11:55:17.305077,0 days 00:00:00.794428,ReLU,Leaky,Tanh,Sigmoid,35,20,19.0,8.0,12.0,0.010522934324192844,4,443,0.6984664777216714,0.0001632217095267471,87.45785675048828,COMPLETE
308,0.23004256188869476,2023-09-04 11:55:17.305476,2023-09-04 11:55:17.987528,0 days 00:00:00.682052,Leaky,Sigmoid,Tanh,Leaky,32,22,17.0,9.0,17.0,0.014372212762695513,4,471,0.796160657098564,5.199046915804177e-05,101.65401458740234,COMPLETE
309,0.19201867282390594,2023-09-04 11:55:17.987953,2023-09-04 11:55:18.747657,0 days 00:00:00.759704,Leaky,Tanh,Leaky,Sigmoid,29,21,18.0,8.0,5.0,0.004867804276106618,4,425,0.7250635304215711,3.9278406824288876e-05,95.03513654073079,COMPLETE
310,0.2299044132232666,2023-09-04 11:55:18.748023,2023-09-04 11:55:22.122332,0 days 00:00:03.374309,Leaky,Sigmoid,Tanh,Sigmoid,51,19,19.0,6.0,9.0,0.00039428323062543205,4,484,0.6784177585085743,2.2450939993398206e-05,125.33500854981774,COMPLETE
311,0.1606154441833496,2023-09-04 11:55:22.122761,2023-09-04 11:55:23.083643,0 days 00:00:00.960882,Tanh,Tanh,Tanh,Sigmoid,44,20,16.0,7.0,7.0,0.006780672793311648,4,328,0.762230438346253,1.3541700677888832e-05,109.58187940644055,COMPLETE
312,0.21997255086898804,2023-09-04 11:55:23.084069,2023-09-04 11:55:24.518453,0 days 00:00:01.434384,Tanh,Sigmoid,Tanh,Sigmoid,44,20,5.0,7.0,7.0,0.006454657074463928,4,417,0.7683871018415159,1.3584688068240131e-05,101.5531490265377,COMPLETE
313,0.21728280186653137,2023-09-04 11:55:24.518885,2023-09-04 11:55:25.359992,0 days 00:00:00.841107,Tanh,Tanh,Tanh,Sigmoid,47,21,16.0,8.0,6.0,0.008691836258431772,4,361,0.7972248561763814,1.0888435718301418e-05,96.44866540696886,COMPLETE
314,0.242264524102211,2023-09-04 11:55:25.360353,2023-09-04 11:55:25.999772,0 days 00:00:00.639419,Tanh,Sigmoid,Tanh,Sigmoid,42,13,16.0,7.0,7.0,0.006144931439456291,4,238,0.2920577440905601,1.611864403998135e-05,230.1098856850276,COMPLETE
315,0.21935169398784637,2023-09-04 11:55:26.000104,2023-09-04 11:55:26.791877,0 days 00:00:00.791773,Tanh,Tanh,,,45,21,16.0,,,0.0010968213419801688,2,441,0.7466366038638503,1.8392280339304348e-05,96.62193632125854,COMPLETE
316,0.1952466368675232,2023-09-04 11:55:26.792217,2023-09-04 11:55:28.411601,0 days 00:00:01.619384,Tanh,Sigmoid,Tanh,Sigmoid,42,20,15.0,9.0,8.0,0.00974641760376355,4,389,0.7552421876501302,0.0002800680322226448,89.36561695043592,COMPLETE
317,0.23755104839801788,2023-09-04 11:55:28.411952,2023-09-04 11:55:28.863595,0 days 00:00:00.451643,Tanh,Sigmoid,Tanh,Sigmoid,44,17,15.0,10.0,6.0,0.011987918811103202,4,376,0.3447169975673849,1.4345671917664773e-05,124.03291242550581,COMPLETE
318,0.24480995535850525,2023-09-04 11:55:28.864062,2023-09-04 11:55:29.101648,0 days 00:00:00.237586,ReLU,Tanh,Tanh,Sigmoid,47,22,17.0,8.0,8.0,0.016945215604107076,4,302,0.30938148873984905,2.7400298448595778e-05,109.22093309674945,COMPLETE
319,0.1997392475605011,2023-09-04 11:55:29.101998,2023-09-04 11:55:29.885187,0 days 00:00:00.783189,Leaky,Sigmoid,Sigmoid,ReLU,40,21,17.0,20.0,7.0,0.007356706610287487,4,405,0.5206676311434397,1.2832513287114057e-05,87.90793956409802,COMPLETE
320,0.25704601407051086,2023-09-04 11:55:29.885536,2023-09-04 11:55:30.867115,0 days 00:00:00.981579,Tanh,Tanh,Tanh,Sigmoid,42,19,20.0,9.0,7.0,0.05639080008978203,4,431,0.7210051317365391,2.1587719909350806e-05,182.00797963696857,COMPLETE
321,0.2052549570798874,2023-09-04 11:55:30.867467,2023-09-04 11:55:31.294829,0 days 00:00:00.427362,Leaky,Sigmoid,Tanh,Sigmoid,45,20,16.0,7.0,9.0,0.013406147015649387,4,452,0.4562848134305435,1.009546790015281e-05,102.40804474929283,COMPLETE
322,0.18502402305603027,2023-09-04 11:55:31.295184,2023-09-04 11:55:32.554988,0 days 00:00:01.259804,Leaky,Sigmoid,Tanh,Tanh,23,16,21.0,8.0,6.0,0.00874915533653006,4,316,0.3861877702040506,1.676168737584478e-05,78.31133780940887,COMPLETE
323,0.1922740936279297,2023-09-04 11:55:32.555367,2023-09-04 11:55:33.499011,0 days 00:00:00.943644,Leaky,Tanh,,,39,21,17.0,,,0.011829283980031139,2,70,0.7663119729272575,3.09237029540999e-05,84.43442581176758,COMPLETE
324,0.226962149143219,2023-09-04 11:55:33.499344,2023-09-04 11:55:35.647309,0 days 00:00:02.147965,ReLU,Sigmoid,Tanh,Sigmoid,49,22,18.0,7.0,18.0,0.0005874509963352369,4,497,0.6461054465304223,0.0007730671032100706,141.2740570326983,COMPLETE
325,0.213021919131279,2023-09-04 11:55:35.647792,2023-09-04 11:55:36.126225,0 days 00:00:00.478433,Tanh,Tanh,Tanh,ReLU,43,20,17.0,9.0,8.0,0.01526111462010414,4,490,0.37531973909192456,0.00013334377913302894,83.28705596923828,COMPLETE
326,0.21866081655025482,2023-09-04 11:55:36.126554,2023-09-04 11:55:37.231747,0 days 00:00:01.105193,Leaky,Sigmoid,Tanh,Sigmoid,38,21,19.0,2.0,7.0,0.005506387078707546,4,352,0.7149123718349601,7.139956551723551e-05,102.07960391574436,COMPLETE
327,1.057843804359436,2023-09-04 11:55:37.232185,2023-09-04 11:55:37.529791,0 days 00:00:00.297606,Sigmoid,Sigmoid,ReLU,Sigmoid,46,20,18.0,8.0,6.0,0.004788459236900049,4,324,0.7413205867573143,0.010847465257866687,100.03175290425618,COMPLETE
328,0.210604727268219,2023-09-04 11:55:37.530236,2023-09-04 11:55:40.415627,0 days 00:00:02.885391,Leaky,ReLU,,,27,19,16.0,,,0.00074422667333236,2,436,0.7715506994404261,2.425904069122405e-05,87.66991860525948,COMPLETE
329,0.23571258783340454,2023-09-04 11:55:40.415959,2023-09-04 11:55:40.723405,0 days 00:00:00.307446,Leaky,Tanh,Sigmoid,Sigmoid,54,21,20.0,6.0,5.0,0.010402968204076352,4,219,0.1925579636038486,0.00010049250542513105,98.52014343261719,COMPLETE
330,0.2578299045562744,2023-09-04 11:55:40.723744,2023-09-04 11:55:40.899361,0 days 00:00:00.175617,Leaky,Sigmoid,Tanh,ReLU,41,22,13.0,10.0,8.0,0.019084521810217237,4,462,0.15703750422986198,1.8531506069544424e-05,127.43648465474446,COMPLETE
331,0.38774731755256653,2023-09-04 11:55:40.899698,2023-09-04 11:55:41.507834,0 days 00:00:00.608136,Leaky,Tanh,Tanh,Sigmoid,21,18,19.0,7.0,9.0,0.09778066857395472,4,447,0.7993063891032208,4.7477491461444836e-05,153.53477360652045,COMPLETE
332,0.18185895681381226,2023-09-04 11:55:41.508170,2023-09-04 11:55:43.047075,0 days 00:00:01.538905,Leaky,Sigmoid,Tanh,Sigmoid,43,20,18.0,8.0,7.0,0.013901310489219228,4,420,0.6162445748063868,0.00017259254118748705,88.84890166325356,COMPLETE
333,0.18357393145561218,2023-09-04 11:55:43.047518,2023-09-04 11:55:43.977408,0 days 00:00:00.929890,Tanh,Tanh,Tanh,Sigmoid,39,15,17.0,5.0,10.0,0.022242197008623253,4,476,0.49716139407571786,3.3424141223125103e-05,105.27221802302769,COMPLETE
334,0.19256745278835297,2023-09-04 11:55:43.977773,2023-09-04 11:55:44.806937,0 days 00:00:00.829164,Leaky,Leaky,Tanh,,48,16,16.0,9.0,,0.016827880576050582,3,452,0.6930883167540344,1.2490717988045014e-05,66.49040455720862,COMPLETE
335,0.21723304688930511,2023-09-04 11:55:44.807295,2023-09-04 11:55:45.363634,0 days 00:00:00.556339,ReLU,Sigmoid,Tanh,ReLU,52,21,19.0,7.0,6.0,0.007618143246742212,4,428,0.7302610602390337,2.1676698256584098e-05,126.54650765878183,COMPLETE
336,0.18109934031963348,2023-09-04 11:55:45.363992,2023-09-04 11:55:46.490429,0 days 00:00:01.126437,Leaky,Sigmoid,Sigmoid,Sigmoid,25,19,14.0,9.0,5.0,0.010988790324147384,4,439,0.6688703051817896,2.7510301749782573e-05,1597.1668980189731,COMPLETE
337,0.1599908024072647,2023-09-04 11:55:46.490799,2023-09-04 11:55:47.667870,0 days 00:00:01.177071,Leaky,Tanh,Tanh,Sigmoid,37,23,22.0,8.0,9.0,0.009190943979183632,4,463,0.799906876408175,0.00019908850325357525,77.99238877069382,COMPLETE
338,0.17041823267936707,2023-09-04 11:55:47.668204,2023-09-04 11:55:48.561825,0 days 00:00:00.893621,Leaky,Tanh,Tanh,Sigmoid,37,23,24.0,10.0,4.0,0.008966011727887073,4,131,0.7966292264717746,8.99327132508793e-05,213.51415944099426,COMPLETE
339,0.17846910655498505,2023-09-04 11:55:48.562166,2023-09-04 11:55:49.810158,0 days 00:00:01.247992,Leaky,Tanh,Tanh,Sigmoid,36,22,18.0,10.0,3.0,0.008594271658733492,4,103,0.7823551428620696,8.15318126705807e-05,498.996533203125,COMPLETE
340,0.20690317451953888,2023-09-04 11:55:49.810491,2023-09-04 11:55:50.461484,0 days 00:00:00.650993,Leaky,Tanh,Tanh,Sigmoid,38,24,23.0,11.0,4.0,0.006975172292295407,4,149,0.7738819129733963,5.502376217266934e-05,87.99911053975423,COMPLETE
341,0.16397058963775635,2023-09-04 11:55:50.461827,2023-09-04 11:55:51.828771,0 days 00:00:01.366944,Leaky,Tanh,Tanh,ReLU,34,24,22.0,10.0,2.0,0.009334841139470793,4,132,0.7995886476971154,6.048280887042213e-05,95.90347920293394,COMPLETE
342,0.29069504141807556,2023-09-04 11:55:51.829124,2023-09-04 11:55:52.705259,0 days 00:00:00.876135,Leaky,Tanh,Tanh,ReLU,34,24,21.0,10.0,1.0,0.002239277002100447,4,152,0.28540834628724343,0.00013630688656618157,108.82622943347013,COMPLETE
343,0.18864844739437103,2023-09-04 11:55:52.705605,2023-09-04 11:55:54.569547,0 days 00:00:01.863942,Leaky,Tanh,Tanh,ReLU,33,23,24.0,11.0,3.0,0.009148518670195983,4,137,0.7999546132430236,6.519699218819687e-05,88.88474596463718,COMPLETE
344,0.2238864004611969,2023-09-04 11:55:54.569892,2023-09-04 11:55:54.996699,0 days 00:00:00.426807,Leaky,Tanh,,,36,24,23.0,,,0.009872294324853035,2,118,0.26683147013983705,8.311133540343728e-05,108.02466583251953,COMPLETE
345,0.200067400932312,2023-09-04 11:55:54.997029,2023-09-04 11:55:56.940700,0 days 00:00:01.943671,Leaky,Tanh,Tanh,ReLU,35,23,22.0,10.0,4.0,0.0005267461242078099,4,132,0.7453707457204538,6.27454233687578e-05,130.16506618923611,COMPLETE
346,0.1978989988565445,2023-09-04 11:55:56.941044,2023-09-04 11:55:57.501253,0 days 00:00:00.560209,Leaky,Tanh,Sigmoid,ReLU,32,24,23.0,11.0,3.0,0.011031438164288265,4,193,0.47668496243184943,4.5161031047368584e-05,108.3193223135812,COMPLETE
347,0.20234639942646027,2023-09-04 11:55:57.501598,2023-09-04 11:55:58.773512,0 days 00:00:01.271914,Leaky,Tanh,,,37,24,24.0,,,0.0008974052675062868,2,161,0.5947821009077597,0.00011393234988842782,134.25592635398687,COMPLETE
348,0.25471970438957214,2023-09-04 11:55:58.773850,2023-09-04 11:55:59.453598,0 days 00:00:00.679748,Tanh,Tanh,Tanh,ReLU,34,24,22.0,12.0,2.0,0.027318646077654583,4,264,0.25638985727560387,3.987463370256919e-05,375.4715603915128,COMPLETE
349,0.21307401359081268,2023-09-04 11:55:59.453962,2023-09-04 11:55:59.988834,0 days 00:00:00.534872,Leaky,Tanh,Tanh,ReLU,38,19,22.0,10.0,5.0,0.042299302606974135,4,176,0.7098245027478765,5.6802000483045654e-05,130.84014674595423,COMPLETE
350,0.17460866272449493,2023-09-04 11:55:59.989218,2023-09-04 11:56:00.602897,0 days 00:00:00.613679,Leaky,Tanh,Tanh,Tanh,73,23,22.0,10.0,6.0,0.008551373827422569,4,142,0.7657262401777858,7.423192715741085e-05,96.07329559326172,COMPLETE
351,0.23716819286346436,2023-09-04 11:56:00.603264,2023-09-04 11:56:00.821192,0 days 00:00:00.217928,Leaky,,,,73,23,,,,0.006486213476654654,1,113,0.40505888126826184,7.137409196479773e-05,392.24780622209823,COMPLETE
352,0.19686909019947052,2023-09-04 11:56:00.821620,2023-09-04 11:56:01.455565,0 days 00:00:00.633945,Leaky,Tanh,Tanh,Tanh,70,23,22.0,11.0,2.0,0.007298130669963123,4,51,0.5458631340564831,5.7500454489936356e-05,125.57980047487744,COMPLETE
353,0.19885985553264618,2023-09-04 11:56:01.455898,2023-09-04 11:56:02.647383,0 days 00:00:01.191485,Leaky,Tanh,Tanh,Tanh,31,23,22.0,10.0,1.0,0.0013120879563322547,4,124,0.7980436433952806,8.581819387008468e-05,152.88000615437826,COMPLETE
354,0.1789696216583252,2023-09-04 11:56:02.647783,2023-09-04 11:56:03.750048,0 days 00:00:01.102265,Leaky,Tanh,Tanh,Tanh,36,24,23.0,10.0,6.0,0.008889560179109163,4,137,0.6470738441522554,7.327147759694494e-05,121.37570758576089,COMPLETE
355,0.21231839060783386,2023-09-04 11:56:03.750398,2023-09-04 11:56:05.631956,0 days 00:00:01.881558,Tanh,Tanh,ReLU,Tanh,57,23,23.0,9.0,4.0,0.0020892112158135364,4,103,0.7498472253258154,0.00010528343816483786,133.24154747009277,COMPLETE
356,0.19446499645709991,2023-09-04 11:56:05.632334,2023-09-04 11:56:06.185135,0 days 00:00:00.552801,Leaky,Tanh,Sigmoid,Tanh,78,23,24.0,10.0,5.0,0.008754640584510366,4,482,0.575483094991334,4.9021917016017765e-05,77.49453128467907,COMPLETE
357,0.24939130246639252,2023-09-04 11:56:06.185490,2023-09-04 11:56:06.351542,0 days 00:00:00.166052,Leaky,Tanh,Tanh,Tanh,50,23,22.0,11.0,14.0,0.003894959212029032,4,499,0.11214380661509377,0.0013230627036045007,117.476389169693,COMPLETE
358,0.18553154170513153,2023-09-04 11:56:06.351910,2023-09-04 11:56:07.333218,0 days 00:00:00.981308,Sigmoid,Tanh,Tanh,ReLU,65,24,21.0,11.0,4.0,0.05228999974465789,4,143,0.7072093798235823,0.0002717086152747009,111.88193715413412,COMPLETE
359,0.2302761971950531,2023-09-04 11:56:07.333564,2023-09-04 11:56:07.945263,0 days 00:00:00.611699,Leaky,Tanh,,,34,23,24.0,,,0.06648957535972519,2,142,0.669902359016949,0.0001516722336433445,114.48414103190105,COMPLETE
360,0.2169666737318039,2023-09-04 11:56:07.945605,2023-09-04 11:56:08.373525,0 days 00:00:00.427920,Leaky,Tanh,Tanh,ReLU,62,24,23.0,12.0,13.0,0.03735998653438996,4,491,0.765340109578285,0.00021245862749981728,86.4142057245428,COMPLETE
361,0.2308402806520462,2023-09-04 11:56:08.373903,2023-09-04 11:56:21.699051,0 days 00:00:13.325148,Leaky,Tanh,Tanh,ReLU,37,22,22.0,9.0,24.0,2.3494705073024405e-05,4,474,0.7253674582264616,0.0004061425406833579,137.41006649999176,COMPLETE
362,0.22188237309455872,2023-09-04 11:56:21.699383,2023-09-04 11:56:24.169510,0 days 00:00:02.470127,Tanh,Tanh,Tanh,Tanh,86,23,22.0,10.0,6.0,0.00037205792764871134,4,134,0.7967773802809369,8.528296323593223e-05,138.434046236674,COMPLETE
