number,value,datetime_start,datetime_complete,duration,params_activation1,params_activation2,params_activation3,params_activation4,params_batch_size,params_fl1,params_fl2,params_fl3,params_fl4,params_learning_rate,params_n_layers,params_num_epochs,params_train_size,params_weight_decay,user_attrs_mre,state
378,0.18390728533267975,2023-09-04 11:54:42.655481,2023-09-04 11:54:44.251924,0 days 00:00:01.596443,ReLU,Leaky,Sigmoid,,15,23,20.0,17.0,,0.006091161289492664,3,118,0.5117243359333111,2.8025170913521627e-05,79.92778253555298,COMPLETE
379,0.14760719239711761,2023-09-04 11:54:44.252265,2023-09-04 11:54:45.941204,0 days 00:00:01.688939,ReLU,Leaky,Sigmoid,,20,23,21.0,18.0,,0.007565565747735744,3,131,0.799397459059206,2.5457553589250084e-05,91.74246797107514,COMPLETE
380,0.19262155890464783,2023-09-04 11:54:45.941540,2023-09-04 11:54:46.986811,0 days 00:00:01.045271,ReLU,Leaky,Sigmoid,,21,23,21.0,18.0,,0.007373367857589605,3,236,0.77424348892533,2.5511394939258956e-05,112.29883493695941,COMPLETE
381,0.1757480353116989,2023-09-04 11:54:46.987136,2023-09-04 11:54:48.077511,0 days 00:00:01.090375,ReLU,Leaky,Sigmoid,,20,23,21.0,18.0,,0.008256782214276991,3,134,0.7964552183522623,1.8825440580911892e-05,73.87831101594148,COMPLETE
382,0.2204999178647995,2023-09-04 11:54:48.077841,2023-09-04 11:54:49.662207,0 days 00:00:01.584366,ReLU,Leaky,Sigmoid,,14,23,20.0,19.0,,0.006651706262785048,3,414,0.798421513989229,2.26288517692876e-05,79.96573007517847,COMPLETE
383,0.1680196225643158,2023-09-04 11:54:49.662618,2023-09-04 11:54:50.996577,0 days 00:00:01.333959,ReLU,Leaky,Sigmoid,,18,23,20.0,19.0,,0.007267888497997745,3,215,0.7506958507036359,2.9997302127061377e-05,93.27920746803284,COMPLETE
384,0.2026909589767456,2023-09-04 11:54:50.996924,2023-09-04 11:54:52.677423,0 days 00:00:01.680499,ReLU,Leaky,Sigmoid,,20,24,19.0,20.0,,0.005339992829989531,3,219,0.7485416295722992,3.2678199304617794e-05,155.56277635362414,COMPLETE
385,0.18767255544662476,2023-09-04 11:54:52.677757,2023-09-04 11:54:55.108068,0 days 00:00:02.430311,ReLU,Leaky,Sigmoid,,12,23,20.0,18.0,,0.007603399704436865,3,128,0.7470056602845564,0.0003283532898227009,178.32784241896408,COMPLETE
386,0.1441883146762848,2023-09-04 11:54:55.108620,2023-09-04 11:54:57.967076,0 days 00:00:02.858456,ReLU,Leaky,Sigmoid,,17,24,19.0,19.0,,0.008626519173808274,3,136,0.7724028609668541,2.6812057407408563e-05,76.05351483821869,COMPLETE
387,0.1996249407529831,2023-09-04 11:54:57.967414,2023-09-04 11:54:58.742748,0 days 00:00:00.775334,ReLU,Leaky,Sigmoid,,18,24,19.0,19.0,,0.009366095697630888,3,122,0.7688011936623212,2.5757099589604925e-05,97.52946472167969,COMPLETE
388,0.2501334547996521,2023-09-04 11:54:58.743092,2023-09-04 11:55:00.213768,0 days 00:00:01.470676,ReLU,Leaky,Sigmoid,,19,24,19.0,20.0,,0.009978128490948401,3,112,0.7961135242869112,0.004065641933476483,188.2421648297991,COMPLETE
389,0.19038687646389008,2023-09-04 11:55:00.214099,2023-09-04 11:55:02.420029,0 days 00:00:02.205930,ReLU,Leaky,Sigmoid,,14,24,20.0,20.0,,0.0025269758910102798,3,127,0.7486480893460092,0.0011566345657399093,88.47829721140307,COMPLETE
390,0.20901216566562653,2023-09-04 11:55:02.420353,2023-09-04 11:55:03.575225,0 days 00:00:01.154872,ReLU,Leaky,Sigmoid,,18,24,19.0,21.0,,0.006802435370550406,3,138,0.7709336496715241,2.7187620120781486e-05,72.11658389751727,COMPLETE
391,0.2501411437988281,2023-09-04 11:55:03.575611,2023-09-04 11:55:09.726815,0 days 00:00:06.151204,ReLU,Leaky,Sigmoid,,16,24,20.0,19.0,,4.436244764784565e-05,3,143,0.7236599835074975,0.00012184606301437517,111.7323737511268,COMPLETE
392,0.18961164355278015,2023-09-04 11:55:09.727155,2023-09-04 11:55:10.990211,0 days 00:00:01.263056,ReLU,Tanh,Sigmoid,,21,23,20.0,22.0,,0.006013887711763247,3,133,0.7970522299809292,3.0537501021440253e-05,115.95898576216264,COMPLETE
393,0.48966699838638306,2023-09-04 11:55:10.990547,2023-09-04 11:55:11.288211,0 days 00:00:00.297664,ReLU,ReLU,Sigmoid,,18,1,2.0,18.0,,0.008293281301091441,3,143,0.263492415708087,0.0005856421996167226,291.70341195000543,COMPLETE
394,0.21460019052028656,2023-09-04 11:55:11.288546,2023-09-04 11:55:11.905217,0 days 00:00:00.616671,ReLU,Leaky,Sigmoid,,15,22,20.0,19.0,,0.0040072415837520865,3,119,0.21702637724090645,1.930483880935729e-05,91.94626115008099,COMPLETE
395,0.1954403519630432,2023-09-04 11:55:11.905565,2023-09-04 11:55:13.382912,0 days 00:00:01.477347,ReLU,Leaky,Sigmoid,,22,18,23.0,21.0,,0.012037396518510617,3,153,0.7495981017184759,0.0013926022168299192,103.8238938797352,COMPLETE
396,0.21187984943389893,2023-09-04 11:55:13.383237,2023-09-04 11:55:14.234814,0 days 00:00:00.851577,ReLU,Leaky,Sigmoid,,12,24,19.0,7.0,,0.009667713819508062,3,132,0.31816720869107235,0.0005156720924476386,98.8500308412494,COMPLETE
397,0.9805195331573486,2023-09-04 11:55:14.235163,2023-09-04 11:55:14.936412,0 days 00:00:00.701249,ReLU,Leaky,Sigmoid,,19,23,19.0,20.0,,0.00010698810222350588,3,255,0.767895976649608,0.09868598531835213,99.91662103989545,COMPLETE
398,0.22493813931941986,2023-09-04 11:55:14.936734,2023-09-04 11:55:16.625918,0 days 00:00:01.689184,ReLU,Leaky,Sigmoid,,20,9,20.0,18.0,,0.005175026689182627,3,242,0.7995872778796562,0.0018672949191638124,120.35624322225881,COMPLETE
399,0.19878648221492767,2023-09-04 11:55:16.626256,2023-09-04 11:55:19.067650,0 days 00:00:02.441394,ReLU,Leaky,Sigmoid,,16,24,18.0,19.0,,0.014209955800044475,3,143,0.7135624143342264,0.002390677616349069,85.01187214098479,COMPLETE
400,0.19821342825889587,2023-09-04 11:55:19.067981,2023-09-04 11:55:20.645070,0 days 00:00:01.577089,ReLU,Leaky,Sigmoid,,23,22,21.0,23.0,,0.0033130088082842747,3,111,0.7377666921983507,3.9508780612207905e-05,86.38454826510683,COMPLETE
401,0.20354723930358887,2023-09-04 11:55:20.645452,2023-09-04 11:55:23.560454,0 days 00:00:02.915002,ReLU,Leaky,Sigmoid,,17,23,19.0,22.0,,0.0009291575877682087,3,151,0.34206296164279004,0.003201010786088098,97.06881996050272,COMPLETE
402,0.2238139808177948,2023-09-04 11:55:23.560793,2023-09-04 11:55:23.848586,0 days 00:00:00.287793,ReLU,Leaky,Sigmoid,,53,24,18.0,20.0,,0.0650694974888752,3,159,0.37683353921966445,2.9601279185063573e-05,86.40382821219308,COMPLETE
403,0.17314466834068298,2023-09-04 11:55:23.848915,2023-09-04 11:55:25.572522,0 days 00:00:01.723607,ReLU,Tanh,Tanh,,14,23,21.0,6.0,,0.007513002436349086,3,211,0.6923865816420969,2.1727199113759467e-05,79.26014111493085,COMPLETE
404,0.21853886544704437,2023-09-04 11:55:25.572860,2023-09-04 11:55:26.083786,0 days 00:00:00.510926,ReLU,Leaky,Sigmoid,,18,22,20.0,19.0,,0.04787056853821437,3,126,0.24270647746104884,2.6103244675072853e-05,114.3400161743164,COMPLETE
405,0.1560146063566208,2023-09-04 11:55:26.084132,2023-09-04 11:55:26.493557,0 days 00:00:00.409425,ReLU,Leaky,Tanh,,95,23,19.0,22.0,,0.012209582764593744,3,139,0.768866549526169,3.3470421849554986e-05,69.02606275004726,COMPLETE
406,0.19679337739944458,2023-09-04 11:55:26.493891,2023-09-04 11:55:26.919171,0 days 00:00:00.425280,ReLU,Leaky,Tanh,,94,22,24.0,22.0,,0.011297141481941187,3,144,0.769187019539316,3.550403144304747e-05,102.27066016197205,COMPLETE
407,0.17910246551036835,2023-09-04 11:55:26.919514,2023-09-04 11:55:28.042201,0 days 00:00:01.122687,ReLU,Leaky,Tanh,,99,23,19.0,21.0,,0.0013892335034117562,3,138,0.7451836958914936,4.336077518524633e-05,158.50019978002175,COMPLETE
408,0.216826930642128,2023-09-04 11:55:28.042532,2023-09-04 11:55:28.324109,0 days 00:00:00.281577,ReLU,,,,91,23,,,,0.01169362137325747,1,134,0.3943906090459167,0.0010646245381779216,83.54435868696733,COMPLETE
409,0.16966502368450165,2023-09-04 11:55:28.324429,2023-09-04 11:55:28.741988,0 days 00:00:00.417559,ReLU,Leaky,Tanh,,97,20,18.0,23.0,,0.009276378586738774,3,436,0.7988324295294682,0.0007382279399936702,76.25420613442698,COMPLETE
410,0.19269895553588867,2023-09-04 11:55:28.742308,2023-09-04 11:55:29.295434,0 days 00:00:00.553126,ReLU,Leaky,Tanh,,90,21,18.0,24.0,,0.0092535191023653,3,475,0.45726955727326984,0.0012665477289017292,80.45818437848773,COMPLETE
411,0.18884602189064026,2023-09-04 11:55:29.295772,2023-09-04 11:55:29.884390,0 days 00:00:00.588618,ReLU,Leaky,Tanh,,97,20,19.0,23.0,,0.014315217056933605,3,421,0.7716709864689473,2.1093311979555694e-05,75.933874495486,COMPLETE
412,0.17114277184009552,2023-09-04 11:55:29.884718,2023-09-04 11:55:30.293010,0 days 00:00:00.408292,ReLU,Leaky,Tanh,,100,21,19.0,23.0,,0.010321023363081668,3,225,0.7229619508815849,0.0008392616776579046,108.35267571841969,COMPLETE
413,0.20446361601352692,2023-09-04 11:55:30.293335,2023-09-04 11:55:30.508281,0 days 00:00:00.214946,ReLU,Leaky,Tanh,,94,21,18.0,23.0,,0.009127679190055827,3,428,0.36320690237066905,0.0008715407692097505,164.20128815749595,COMPLETE
414,0.22955816984176636,2023-09-04 11:55:30.508629,2023-09-04 11:55:30.718752,0 days 00:00:00.210123,ReLU,Leaky,Tanh,,95,20,22.0,24.0,,0.010789894701742011,3,215,0.721130704635365,0.0007533277976060943,104.25528259277344,COMPLETE
415,0.18315289914608002,2023-09-04 11:55:30.719086,2023-09-04 11:55:31.199012,0 days 00:00:00.479926,ReLU,Leaky,Tanh,,100,21,19.0,23.0,,0.007521740456682227,3,462,0.7981936560299073,0.0007613994419331257,147.86943631558805,COMPLETE
416,0.22046053409576416,2023-09-04 11:55:31.199344,2023-09-04 11:55:31.369683,0 days 00:00:00.170339,ReLU,Leaky,Tanh,,97,20,18.0,22.0,,0.012713326927781625,3,231,0.19715889285697286,0.0010319231428710318,141.5870068524335,COMPLETE
417,0.18739274144172668,2023-09-04 11:55:31.370009,2023-09-04 11:55:31.816783,0 days 00:00:00.446774,ReLU,Leaky,Tanh,,98,20,19.0,24.0,,0.009816670315432853,3,405,0.7097353137583352,0.0007563686557898152,89.79373911807411,COMPLETE
418,0.18698763847351074,2023-09-04 11:55:31.817104,2023-09-04 11:55:32.162041,0 days 00:00:00.344937,ReLU,Leaky,Tanh,,98,21,18.0,23.0,,0.006956475345839055,3,445,0.7415959539121594,0.0009107015587054843,81.28505113389757,COMPLETE
419,0.1981925368309021,2023-09-04 11:55:32.162368,2023-09-04 11:55:32.595320,0 days 00:00:00.432952,ReLU,Leaky,Tanh,,96,19,19.0,22.0,,0.012746376080982289,3,148,0.6895613149112237,1.709693821898186e-05,86.94014245110588,COMPLETE
420,0.22210174798965454,2023-09-04 11:55:32.595673,2023-09-04 11:55:32.926386,0 days 00:00:00.330713,ReLU,Leaky,Tanh,,99,21,18.0,23.0,,0.010804475145205718,3,123,0.29288749783657514,0.0006357688581752607,80.83819295592227,COMPLETE
421,0.19823355972766876,2023-09-04 11:55:32.926713,2023-09-04 11:55:33.780391,0 days 00:00:00.853678,ReLU,ReLU,Tanh,,97,14,19.0,22.0,,0.008475497191675032,3,201,0.7758846212560938,0.008086279732269486,91.71814050808759,COMPLETE
422,0.18556421995162964,2023-09-04 11:55:33.780710,2023-09-04 11:55:34.327693,0 days 00:00:00.546983,ReLU,Leaky,Tanh,,95,21,18.0,22.0,,0.01581416010566597,3,191,0.7271194092868506,2.3174575039497443e-05,93.51506606392239,COMPLETE
423,0.19209299981594086,2023-09-04 11:55:34.328025,2023-09-04 11:55:34.724624,0 days 00:00:00.396599,ReLU,Leaky,Tanh,,98,22,19.0,21.0,,0.014014272279480188,3,489,0.4313081658434282,0.0006215570682271118,90.53412104587929,COMPLETE
424,0.223358616232872,2023-09-04 11:55:34.724941,2023-09-04 11:55:35.004377,0 days 00:00:00.279436,ReLU,Tanh,Tanh,,96,22,17.0,23.0,,0.005600692556690825,3,439,0.27702831729895,0.00032352264536220315,86.78442764282227,COMPLETE
425,0.1794784963130951,2023-09-04 11:55:35.004710,2023-09-04 11:55:36.696736,0 days 00:00:01.692026,ReLU,Leaky,Tanh,,45,22,19.0,21.0,,0.006377897944045318,3,241,0.7986610617541942,0.00010113387465296358,156.96358508155458,COMPLETE
426,0.15819551050662994,2023-09-04 11:55:36.697074,2023-09-04 11:55:39.160572,0 days 00:00:02.463498,ReLU,Leaky,Tanh,,100,13,18.0,22.0,,0.002467819935339979,3,133,0.7508394748097653,0.00021403996243580037,632.4184005852032,COMPLETE
427,0.26636672019958496,2023-09-04 11:55:39.160976,2023-09-04 11:55:39.370589,0 days 00:00:00.209613,ReLU,Leaky,Tanh,,100,13,18.0,23.0,,0.002643324391872286,3,129,0.16179402215007097,0.000131645164192691,86.40371625176792,COMPLETE
428,0.24392269551753998,2023-09-04 11:55:39.371006,2023-09-04 11:55:39.702233,0 days 00:00:00.331227,ReLU,Leaky,Tanh,,100,14,17.0,8.0,,0.0020372595688197457,3,115,0.3145462990798578,3.089024757211836e-05,94.1686330245713,COMPLETE
429,0.2137056589126587,2023-09-04 11:55:39.702656,2023-09-04 11:55:40.023415,0 days 00:00:00.320759,ReLU,Leaky,Tanh,,99,13,18.0,24.0,,0.004655713026847675,3,136,0.3458713949165465,0.00011042163570105388,124.24345742019952,COMPLETE
430,0.26718345284461975,2023-09-04 11:55:40.023865,2023-09-04 11:55:40.165031,0 days 00:00:00.141166,ReLU,Leaky,Tanh,,97,22,22.0,22.0,,0.003761635532317183,3,122,0.13566123138816075,1.6292729589463093e-05,152.94353256225585,COMPLETE
431,0.17795489728450775,2023-09-04 11:55:40.165473,2023-09-04 11:55:40.782399,0 days 00:00:00.616926,ReLU,Leaky,Tanh,,99,23,23.0,21.0,,0.0025530835564397374,3,135,0.7030604628357034,0.00037327905487157735,68.85440668852434,COMPLETE
432,0.19076621532440186,2023-09-04 11:55:40.782819,2023-09-04 11:55:41.173683,0 days 00:00:00.390864,ReLU,Leaky,Tanh,,95,13,18.0,8.0,,0.008111882574238111,3,129,0.7456782605051451,0.0005079109066939331,77.42790320611769,COMPLETE
433,0.21125428378582,2023-09-04 11:55:41.174088,2023-09-04 11:55:41.509496,0 days 00:00:00.335408,ReLU,Leaky,Sigmoid,,99,13,17.0,20.0,,0.0044992941881910956,3,144,0.5233254658718955,0.00022522393078909915,114.75416668041332,COMPLETE
434,0.2189820557832718,2023-09-04 11:55:41.509927,2023-09-04 11:55:45.120702,0 days 00:00:03.610775,ReLU,Leaky,Tanh,,15,8,17.0,22.0,,0.0011417266234103481,3,107,0.6839556352157365,0.00028522846009120553,103.47447280883789,COMPLETE
435,0.1932550072669983,2023-09-04 11:55:45.121275,2023-09-04 11:55:47.551282,0 days 00:00:02.430007,ReLU,Tanh,Sigmoid,ReLU,100,15,18.0,23.0,20.0,0.009606255648391397,4,222,0.7236786097095802,2.6221341103538026e-05,82.53810557197122,COMPLETE
436,0.22801324725151062,2023-09-04 11:55:47.551875,2023-09-04 11:55:48.391062,0 days 00:00:00.839187,Leaky,Leaky,Tanh,,100,24,18.0,20.0,,0.006874905862119178,3,173,0.31161325325013,3.513771479223477e-05,312.7381100124783,COMPLETE
437,0.2021244466304779,2023-09-04 11:55:48.391636,2023-09-04 11:55:50.670007,0 days 00:00:02.278371,ReLU,Leaky,Sigmoid,,12,22,19.0,7.0,,0.010867454799064426,3,138,0.759152853731887,1.970107368303395e-05,128.64849820344344,COMPLETE
438,0.21172252297401428,2023-09-04 11:55:50.670365,2023-09-04 11:55:56.413239,0 days 00:00:05.742874,ReLU,Leaky,Tanh,,16,13,16.0,21.0,,0.0005418877112857594,3,164,0.7641156737870826,0.00023201775321214532,82.7953969637553,COMPLETE
439,0.2993614971637726,2023-09-04 11:55:56.413554,2023-09-04 11:55:56.739091,0 days 00:00:00.325537,ReLU,Leaky,Sigmoid,,94,14,20.0,23.0,,0.0007882911850697715,3,117,0.1859267343024111,0.0003909725291307073,95.14523040416628,COMPLETE
440,0.19538670778274536,2023-09-04 11:55:56.739447,2023-09-04 11:55:57.052434,0 days 00:00:00.312987,ReLU,Leaky,Tanh,,97,18,17.0,22.0,,0.008422408549816204,3,434,0.4215096992568343,2.745951652844675e-05,85.70521303502525,COMPLETE
441,0.20562958717346191,2023-09-04 11:55:57.052768,2023-09-04 11:55:57.476363,0 days 00:00:00.423595,ReLU,Leaky,Tanh,,19,17,19.0,20.0,,0.005931156443494131,3,197,0.2886348673619968,0.00017003642165678697,132.1699710083008,COMPLETE
442,0.18826742470264435,2023-09-04 11:55:57.476705,2023-09-04 11:55:59.989130,0 days 00:00:02.512425,ReLU,ReLU,Sigmoid,,14,23,19.0,21.0,,0.011438395373790933,3,146,0.7218712689009684,2.270137874951016e-05,89.57053744408393,COMPLETE
443,0.21860668063163757,2023-09-04 11:55:59.989721,2023-09-04 11:56:02.775991,0 days 00:00:02.786270,ReLU,Leaky,Tanh,,17,24,20.0,24.0,,0.0032085551332525306,3,129,0.6799246548589669,0.000456319907843884,113.0134511201278,COMPLETE
444,0.23335550725460052,2023-09-04 11:56:02.776316,2023-09-04 11:56:02.929682,0 days 00:00:00.153366,ReLU,Leaky,ReLU,,93,23,18.0,19.0,,0.007433426473983874,3,157,0.2136160611395371,8.569233279128192e-05,244.41039828596445,COMPLETE
445,0.19861021637916565,2023-09-04 11:56:02.930034,2023-09-04 11:56:04.338178,0 days 00:00:01.408144,Leaky,Leaky,Sigmoid,,21,22,18.0,22.0,,0.012623679771335416,3,139,0.749482493903966,1.753523532752495e-05,105.86814289093017,COMPLETE
446,0.20709039270877838,2023-09-04 11:56:04.338524,2023-09-04 11:56:04.874320,0 days 00:00:00.535796,ReLU,Leaky,ReLU,,100,24,22.0,9.0,,0.0030714710656187605,3,207,0.44610091535393126,3.7099816003029136e-05,75.95337443881564,COMPLETE
447,0.16861650347709656,2023-09-04 11:56:04.874650,2023-09-04 11:56:05.318717,0 days 00:00:00.444067,ReLU,Leaky,Tanh,,96,23,2.0,7.0,,0.015329378715855558,3,122,0.799080413808583,3.0790171264933e-05,608.5066402659696,COMPLETE
448,0.19607454538345337,2023-09-04 11:56:05.319096,2023-09-04 11:56:05.996721,0 days 00:00:00.677625,ReLU,Tanh,Tanh,,96,23,16.0,7.0,,0.0016106638055573834,3,122,0.5109611600174006,4.1265915873416657e-05,81.42328401891197,COMPLETE
449,0.19069606065750122,2023-09-04 11:56:05.997059,2023-09-04 11:56:06.405889,0 days 00:00:00.408830,ReLU,Leaky,Tanh,,98,23,3.0,8.0,,0.010321140936289943,3,114,0.7985534540497713,3.146025433406478e-05,110.5691420032132,COMPLETE
450,0.20984745025634766,2023-09-04 11:56:06.406220,2023-09-04 11:56:06.712841,0 days 00:00:00.306621,ReLU,Leaky,Tanh,,98,24,17.0,6.0,,0.01478649437453069,3,131,0.7093874973831599,5.486004647012477e-05,92.16629852294922,COMPLETE
451,0.1976323425769806,2023-09-04 11:56:06.713176,2023-09-04 11:56:07.036850,0 days 00:00:00.323674,ReLU,Leaky,Tanh,,96,23,14.0,7.0,,0.008844123938361611,3,106,0.3776801223492423,1.5121350210113472e-05,101.87805795669556,COMPLETE
452,0.18136194348335266,2023-09-04 11:56:07.037183,2023-09-04 11:56:08.725825,0 days 00:00:01.688642,ReLU,Leaky,Tanh,,17,23,21.0,6.0,,0.0016433794645585975,3,129,0.7633093017655329,3.2260684705396825e-05,184.9244087414864,COMPLETE
453,0.24590303003787994,2023-09-04 11:56:08.726292,2023-09-04 11:56:09.514066,0 days 00:00:00.787774,ReLU,Leaky,Tanh,,95,6,17.0,8.0,,0.0010685825208804724,3,121,0.39900540632509757,4.7835335390861126e-05,101.17873943738701,COMPLETE
454,0.20616143941879272,2023-09-04 11:56:09.514390,2023-09-04 11:56:12.973097,0 days 00:00:03.458707,ReLU,,,,13,24,,,,0.0004337140617597262,1,141,0.7317665808083957,2.0041548034083016e-05,93.86853633417148,COMPLETE
455,0.1447373926639557,2023-09-04 11:56:12.973430,2023-09-04 11:56:13.960157,0 days 00:00:00.986727,ReLU,Leaky,Tanh,,48,22,23.0,7.0,,0.00513251161780819,3,230,0.7683038756180286,2.7307559556356282e-05,175.32096187884991,COMPLETE
456,0.284945547580719,2023-09-04 11:56:13.960496,2023-09-04 11:56:14.298122,0 days 00:00:00.337626,ReLU,Leaky,Tanh,,93,5,23.0,7.0,,0.0059620189440219564,3,230,0.22981853048018608,0.00015084778696038308,308.4829817551833,COMPLETE
457,0.20255817472934723,2023-09-04 11:56:14.298464,2023-09-04 11:56:14.900582,0 days 00:00:00.602118,ReLU,Leaky,Tanh,,57,22,24.0,8.0,,0.005201770349987085,3,221,0.5354807474408831,3.97207785554027e-05,78.79859690763513,COMPLETE
458,0.20102639496326447,2023-09-04 11:56:14.900921,2023-09-04 11:56:15.438552,0 days 00:00:00.537631,ReLU,Leaky,Tanh,,38,22,23.0,7.0,,0.0021712726842790363,3,231,0.3010426918677763,2.9699534530821855e-05,112.29324937300248,COMPLETE
459,0.20786114037036896,2023-09-04 11:56:15.438888,2023-09-04 11:56:15.698174,0 days 00:00:00.259286,ReLU,Leaky,Tanh,,47,22,24.0,7.0,,0.00695987691554904,3,211,0.26123364696409035,2.6235219099068866e-05,86.8431888703377,COMPLETE
460,0.1689763218164444,2023-09-04 11:56:15.698519,2023-09-04 11:56:16.404561,0 days 00:00:00.706042,ReLU,Leaky,Tanh,,60,22,20.0,7.0,,0.00451132262051038,3,247,0.6940931206185259,3.565393807847016e-05,122.00342040366314,COMPLETE
461,0.1828957498073578,2023-09-04 11:56:16.404901,2023-09-04 11:56:17.239578,0 days 00:00:00.834677,ReLU,Leaky,Tanh,,42,22,23.0,6.0,,0.004654470401957883,3,149,0.672143357136394,3.491184666877109e-05,76.18945736355252,COMPLETE
462,0.1783493310213089,2023-09-04 11:56:17.240008,2023-09-04 11:56:18.154847,0 days 00:00:00.914839,ReLU,Leaky,Tanh,,80,23,22.0,6.0,,0.0051102863126792145,3,238,0.6959697272673219,0.00018850629461718206,69.74806137084961,COMPLETE
463,0.21752241253852844,2023-09-04 11:56:18.155179,2023-09-04 11:56:18.576776,0 days 00:00:00.421597,ReLU,Leaky,Sigmoid,,84,22,21.0,5.0,,0.004314034150549633,3,137,0.33610982904207765,4.212718448398337e-05,91.36673634087862,COMPLETE
464,0.16480179131031036,2023-09-04 11:56:18.577114,2023-09-04 11:56:19.177294,0 days 00:00:00.600180,ReLU,Leaky,Tanh,,63,23,23.0,6.0,,0.0037318727640909357,3,126,0.7615346871312771,0.00025444693111164126,67.4012546023807,COMPLETE
465,0.18590131402015686,2023-09-04 11:56:19.177627,2023-09-04 11:56:19.813933,0 days 00:00:00.636306,ReLU,Leaky,Tanh,,65,23,23.0,6.0,,0.004236115657062589,3,104,0.746297917693444,0.00015719289936303818,73.38116250387053,COMPLETE
466,0.2026846706867218,2023-09-04 11:56:19.814266,2023-09-04 11:56:20.724616,0 days 00:00:00.910350,ReLU,Leaky,Tanh,,68,23,24.0,7.0,,0.0035545075863588032,3,122,0.6977867596964525,0.00010743700877473575,72.2133494868423,COMPLETE
467,0.3052671253681183,2023-09-04 11:56:20.725035,2023-09-04 11:56:20.842044,0 days 00:00:00.117009,ReLU,Tanh,Tanh,,52,22,22.0,6.0,,0.0033141819800090256,3,114,0.10140490157871151,0.00015826052346461849,167.51549625396729,COMPLETE
468,0.21701215207576752,2023-09-04 11:56:20.842382,2023-09-04 11:56:21.789074,0 days 00:00:00.946692,ReLU,Leaky,Tanh,,57,23,1.0,5.0,,0.00400689704765675,3,240,0.7699397975986204,0.0003132808357748376,392.0374480938089,COMPLETE
469,0.16857315599918365,2023-09-04 11:56:21.789417,2023-09-04 11:56:22.668837,0 days 00:00:00.879420,ReLU,Leaky,Tanh,,63,12,23.0,8.0,,0.006452844370528831,3,129,0.736267923636699,6.562631975677038e-05,68.4970127041057,COMPLETE
470,0.19640353322029114,2023-09-04 11:56:22.669289,2023-09-04 11:56:23.549309,0 days 00:00:00.880020,ReLU,Leaky,Tanh,,65,12,23.0,8.0,,0.005089035866586809,3,124,0.6629873124975262,5.155125218456734e-05,114.1934388478597,COMPLETE
471,0.17820079624652863,2023-09-04 11:56:23.549656,2023-09-04 11:56:24.414045,0 days 00:00:00.864389,ReLU,Leaky,Tanh,,61,12,23.0,9.0,,0.006379427652960727,3,129,0.7215706879674473,7.093256934461092e-05,74.08655997685024,COMPLETE
