number,value,datetime_start,datetime_complete,duration,params_activation1,params_activation2,params_activation3,params_activation4,params_batch_size,params_fl1,params_fl2,params_fl3,params_fl4,params_learning_rate,params_n_layers,params_num_epochs,params_train_size,params_weight_decay,user_attrs_mre,state
373,0.23193445801734924,2023-09-04 12:06:19.153953,2023-09-04 12:06:19.407927,0 days 00:00:00.253974,ReLU,ReLU,Sigmoid,,82,17,23.0,8.0,,0.09775430673662808,3,157,0.3724948528999857,0.00017754490946630624,103.51617072610294,COMPLETE
374,0.20043955743312836,2023-09-04 12:06:19.408251,2023-09-04 12:06:20.619345,0 days 00:00:01.211094,ReLU,Tanh,Sigmoid,,91,18,24.0,15.0,,0.001027730052907298,3,113,0.6693723196974553,5.926902392023651e-05,105.63467927105658,COMPLETE
375,0.21536555886268616,2023-09-04 12:06:20.619676,2023-09-04 12:06:22.015377,0 days 00:00:01.395701,ReLU,Leaky,Sigmoid,,62,15,22.0,14.0,,0.0019596701628249173,3,144,0.5288806384746974,0.0006362819127045542,137.88171144234119,COMPLETE
376,0.19681623578071594,2023-09-04 12:06:22.015704,2023-09-04 12:06:22.495897,0 days 00:00:00.480193,ReLU,ReLU,Sigmoid,,58,16,23.0,12.0,,0.014405984841667626,3,133,0.7533762740736774,2.0169305638921798e-05,106.93091451710669,COMPLETE
377,0.17056533694267273,2023-09-04 12:06:22.496222,2023-09-04 12:06:23.169070,0 days 00:00:00.672848,ReLU,ReLU,Sigmoid,,56,17,21.0,15.0,,0.017521246430026546,3,123,0.7119868760580955,0.0002500652087805516,78.93768683145213,COMPLETE
378,0.19463294744491577,2023-09-04 12:06:23.169393,2023-09-04 12:06:24.094903,0 days 00:00:00.925510,ReLU,ReLU,ReLU,Leaky,55,17,20.0,16.0,9.0,0.018805889248507787,4,121,0.7127358612337513,0.00028664928547063973,100.97231786391315,COMPLETE
379,0.2214336097240448,2023-09-04 12:06:24.095239,2023-09-04 12:06:24.728542,0 days 00:00:00.633303,ReLU,ReLU,Sigmoid,,51,18,21.0,15.0,,0.03036991492869067,3,100,0.7264537059606234,0.01609423263675948,137.57260647335568,COMPLETE
380,0.21116235852241516,2023-09-04 12:06:24.728870,2023-09-04 12:06:25.053423,0 days 00:00:00.324553,ReLU,ReLU,Sigmoid,,56,17,20.0,16.0,,0.023529107721335984,3,115,0.26581467081964805,0.00045958261513666886,83.2341357421875,COMPLETE
381,0.17617537081241608,2023-09-04 12:06:25.053749,2023-09-04 12:06:25.927943,0 days 00:00:00.874194,ReLU,ReLU,Sigmoid,,53,20,24.0,15.0,,0.017556419167097454,3,125,0.767337988294924,0.0002463857429412498,81.22354309082031,COMPLETE
382,0.19959351420402527,2023-09-04 12:06:25.928265,2023-09-04 12:06:26.624100,0 days 00:00:00.695835,ReLU,ReLU,Sigmoid,,59,17,21.0,15.0,,0.016013960286515177,3,109,0.6867121434460559,0.0003593916647634555,90.56824604670207,COMPLETE
383,0.21021272242069244,2023-09-04 12:06:26.624429,2023-09-04 12:06:27.143566,0 days 00:00:00.519137,Tanh,ReLU,Sigmoid,,28,18,20.0,14.0,,0.006883953618820099,3,130,0.32844686465045003,0.0022574658419082694,88.73637116261018,COMPLETE
384,0.23133467137813568,2023-09-04 12:06:27.143887,2023-09-04 12:06:29.051688,0 days 00:00:01.907801,ReLU,ReLU,Sigmoid,,57,21,24.0,14.0,,0.0003125054973536669,3,121,0.7437277697195591,0.000309784979290007,201.2146247674611,COMPLETE
385,0.21545717120170593,2023-09-04 12:06:29.052013,2023-09-04 12:06:29.705271,0 days 00:00:00.653258,ReLU,ReLU,Sigmoid,,60,17,23.0,13.0,,0.002805127876918167,3,90,0.47291527746829953,0.0002302779002413806,89.03783464431763,COMPLETE
386,0.25066202878952026,2023-09-04 12:06:29.705597,2023-09-04 12:06:29.970972,0 days 00:00:00.265375,ReLU,ReLU,Sigmoid,,55,13,24.0,23.0,,0.024798119597151336,3,278,0.4546840261157435,0.03341839839904161,116.41739654541016,COMPLETE
387,0.17234614491462708,2023-09-04 12:06:29.971297,2023-09-04 12:06:31.202480,0 days 00:00:01.231183,ReLU,ReLU,Sigmoid,,65,12,23.0,16.0,,0.004772435127643209,3,186,0.7730644133933977,0.00040369074136433646,83.49788344050029,COMPLETE
388,0.16961687803268433,2023-09-04 12:06:31.202805,2023-09-04 12:06:31.977390,0 days 00:00:00.774585,ReLU,ReLU,Sigmoid,,65,12,21.0,16.0,,0.004968877654995939,3,191,0.7753630349516817,0.0004642275715799673,120.57525844199985,COMPLETE
389,0.16376714408397675,2023-09-04 12:06:31.977714,2023-09-04 12:06:33.491470,0 days 00:00:01.513756,ReLU,ReLU,Sigmoid,,66,12,21.0,17.0,,0.004475511698815065,3,201,0.7702679690589891,0.00041129163871107767,101.15552871081294,COMPLETE
390,0.1953887939453125,2023-09-04 12:06:33.491807,2023-09-04 12:06:34.426192,0 days 00:00:00.934385,ReLU,ReLU,Sigmoid,,67,12,21.0,16.0,,0.003888987564600825,3,205,0.7722274171834349,0.000455638305438571,260.16150968036953,COMPLETE
391,0.20028476417064667,2023-09-04 12:06:34.426514,2023-09-04 12:06:35.576208,0 days 00:00:01.149694,ReLU,ReLU,Sigmoid,,68,13,20.0,16.0,,0.004951355042097411,3,190,0.772328258092436,0.00037334486442464266,81.31197096426276,COMPLETE
392,0.20769985020160675,2023-09-04 12:06:35.576528,2023-09-04 12:06:36.647938,0 days 00:00:01.071410,ReLU,ReLU,Sigmoid,,66,12,21.0,17.0,,0.002966727097103483,3,199,0.7480400304224233,0.0005451090517480132,120.53764085511904,COMPLETE
393,0.18929602205753326,2023-09-04 12:06:36.648269,2023-09-04 12:06:37.281801,0 days 00:00:00.633532,ReLU,ReLU,Sigmoid,,65,12,21.0,17.0,,0.0038779682577380326,3,178,0.7968134077755911,0.00030807626478837326,81.34910564422607,COMPLETE
394,0.2215484082698822,2023-09-04 12:06:37.282122,2023-09-04 12:06:38.334395,0 days 00:00:01.052273,Sigmoid,ReLU,,,71,12,21.0,,,0.004245463522406097,2,187,0.35322935194139427,0.00041666350671437695,100.60629065919318,COMPLETE
395,0.1796739399433136,2023-09-04 12:06:38.334705,2023-09-04 12:06:40.549672,0 days 00:00:02.214967,ReLU,ReLU,Sigmoid,,66,11,20.0,16.0,,0.0032594591751478963,3,196,0.7246096302790861,0.000286515319235454,99.18051235492413,COMPLETE
396,0.1565401405096054,2023-09-04 12:06:40.549997,2023-09-04 12:06:41.248673,0 days 00:00:00.698676,ReLU,ReLU,Tanh,,65,12,21.0,17.0,,0.005154924669031533,3,205,0.7997870004440834,0.00079278331464349,433.75424541126597,COMPLETE
397,0.20945261418819427,2023-09-04 12:06:41.249031,2023-09-04 12:06:41.945399,0 days 00:00:00.696368,ReLU,ReLU,Tanh,,65,11,21.0,17.0,,0.004628614268305213,3,208,0.7742754439386176,0.0006118544650041713,72.97146572536893,COMPLETE
398,0.17560988664627075,2023-09-04 12:06:41.945730,2023-09-04 12:06:43.049239,0 days 00:00:01.103509,Tanh,ReLU,Tanh,,69,12,19.0,16.0,,0.00449163036146143,3,203,0.796917849887043,0.000886743803168387,93.6518155690786,COMPLETE
399,0.204197496175766,2023-09-04 12:06:43.049576,2023-09-04 12:06:43.729893,0 days 00:00:00.680317,ReLU,Leaky,Tanh,,64,12,21.0,17.0,,0.0035169760316925173,3,191,0.7473369866938949,0.0006926926680325398,82.49375864664714,COMPLETE
400,0.20811009407043457,2023-09-04 12:06:43.730260,2023-09-04 12:06:45.396427,0 days 00:00:01.666167,ReLU,ReLU,Tanh,,66,12,21.0,17.0,,0.0024671065688454106,3,217,0.7689092782734134,0.0010773102497992927,125.95861630647079,COMPLETE
401,0.20298577845096588,2023-09-04 12:06:45.396766,2023-09-04 12:06:46.292940,0 days 00:00:00.896174,ReLU,ReLU,Tanh,,68,11,20.0,18.0,,0.00479254968814456,3,184,0.7441238314682769,0.0005043971265403269,74.55494958162308,COMPLETE
402,0.22661173343658447,2023-09-04 12:06:46.293258,2023-09-04 12:06:46.717411,0 days 00:00:00.424153,ReLU,ReLU,Tanh,,64,12,20.0,17.0,,0.005322455501944278,3,204,0.5141740722504184,4.0441148895967246e-05,75.88728625957782,COMPLETE
403,0.3966110050678253,2023-09-04 12:06:46.717763,2023-09-04 12:06:48.750478,0 days 00:00:02.032715,ReLU,,,,63,11,,,,4.657434467505664e-05,1,197,0.7677818331603721,0.00042180139257726965,101.18507516928736,COMPLETE
404,0.19116033613681793,2023-09-04 12:06:48.750782,2023-09-04 12:06:51.218962,0 days 00:00:02.468180,ReLU,ReLU,Tanh,,70,11,21.0,16.0,,0.0004989828046354462,3,188,0.7215376161162647,0.006557587384127785,111.46556484952886,COMPLETE
405,0.2088819295167923,2023-09-04 12:06:51.219285,2023-09-04 12:06:54.003701,0 days 00:00:02.784416,ReLU,Sigmoid,ReLU,,17,12,22.0,16.0,,0.005590181328364705,3,181,0.7942601215754495,0.0007786748312420946,84.80381381127143,COMPLETE
406,0.19438815116882324,2023-09-04 12:06:54.004042,2023-09-04 12:06:54.496281,0 days 00:00:00.492239,ReLU,ReLU,Sigmoid,,66,13,22.0,15.0,,0.003566947165094323,3,214,0.743728139309053,0.00035180187810476143,108.02984387946852,COMPLETE
407,0.23482584953308105,2023-09-04 12:06:54.496624,2023-09-04 12:06:56.468374,0 days 00:00:01.971750,ReLU,ReLU,Sigmoid,,63,13,21.0,15.0,,0.0011933602501029703,3,186,0.7711457522722567,0.0005728426176089024,114.43512465602667,COMPLETE
408,0.24254396557807922,2023-09-04 12:06:56.468700,2023-09-04 12:06:56.803525,0 days 00:00:00.334825,ReLU,ReLU,Sigmoid,,68,12,17.0,18.0,,0.004523739341343782,3,194,0.2836195786173307,7.196316937917897e-05,128.95682727165942,COMPLETE
409,0.2075710892677307,2023-09-04 12:06:56.803858,2023-09-04 12:06:57.539658,0 days 00:00:00.735800,ReLU,ReLU,Sigmoid,,64,12,22.0,17.0,,0.005372478584686424,3,174,0.7972094366066568,0.0014103675437941385,95.2616955301036,COMPLETE
410,0.1725185662508011,2023-09-04 12:06:57.539989,2023-09-04 12:06:58.925371,0 days 00:00:01.385382,Tanh,Leaky,Sigmoid,,72,11,22.0,16.0,,0.0032380880357526292,3,232,0.7023860598908918,0.0007273603866215266,128.92507059639746,COMPLETE
411,0.2077755182981491,2023-09-04 12:06:58.925697,2023-09-04 12:07:01.458849,0 days 00:00:02.533152,Tanh,ReLU,Sigmoid,,73,12,22.0,16.0,,0.0005995712518636702,3,201,0.7045491884625876,0.0008497112733119867,109.34799433466213,COMPLETE
412,0.1763489991426468,2023-09-04 12:07:01.459186,2023-09-04 12:07:01.841132,0 days 00:00:00.381946,Tanh,Leaky,Sigmoid,,69,11,22.0,16.0,,0.04580152886111851,3,229,0.7185525754785166,0.0007427897250951338,104.73657872126653,COMPLETE
413,0.23394657671451569,2023-09-04 12:07:01.841455,2023-09-04 12:07:02.372138,0 days 00:00:00.530683,Tanh,Leaky,Sigmoid,,72,11,21.0,16.0,,0.003988551078132071,3,252,0.4103567128004345,0.0006242900858954662,115.49335861206055,COMPLETE
414,0.23218806087970734,2023-09-04 12:07:02.372460,2023-09-04 12:07:09.549707,0 days 00:00:07.177247,Tanh,Leaky,Sigmoid,,67,11,22.0,17.0,,0.00021081618288478447,3,235,0.750875458436182,0.0005035594225130299,117.95556354928524,COMPLETE
415,0.2349947690963745,2023-09-04 12:07:09.550036,2023-09-04 12:07:10.880638,0 days 00:00:01.330602,Sigmoid,Leaky,Sigmoid,,71,13,21.0,16.0,,0.0031237007505098406,3,210,0.6959038481682656,3.5131797497214194e-05,217.8671163163095,COMPLETE
416,0.18018177151679993,2023-09-04 12:07:10.880987,2023-09-04 12:07:13.902666,0 days 00:00:03.021679,Tanh,Leaky,Sigmoid,,73,18,22.0,15.0,,0.0006623556020652591,3,241,0.7684924773952366,0.00043734027325351697,103.09205211911883,COMPLETE
417,0.19309113919734955,2023-09-04 12:07:13.903007,2023-09-04 12:07:14.448596,0 days 00:00:00.545589,Tanh,Leaky,Sigmoid,,65,17,22.0,15.0,,0.00613180232764542,3,195,0.5354909183506068,0.0003651656413519058,78.98866435459682,COMPLETE
418,0.20853233337402344,2023-09-04 12:07:14.448918,2023-09-04 12:07:15.774053,0 days 00:00:01.325135,Tanh,Leaky,Sigmoid,,62,10,21.0,16.0,,0.003968376824640351,3,211,0.7963838796940506,0.005383289950845721,77.24113510876167,COMPLETE
419,0.2324611097574234,2023-09-04 12:07:15.774397,2023-09-04 12:07:16.296768,0 days 00:00:00.522371,Tanh,Leaky,Sigmoid,,78,6,24.0,17.0,,0.005150608231023087,3,184,0.34401638541393087,0.00026991087495597627,95.81941424475775,COMPLETE
420,0.333517849445343,2023-09-04 12:07:16.297107,2023-09-04 12:07:16.811672,0 days 00:00:00.514565,ReLU,Leaky,Sigmoid,,66,16,22.0,15.0,,0.002464134649769466,3,202,0.43988818628716236,0.06462702096922408,92.14039107988465,COMPLETE
421,0.20405393838882446,2023-09-04 12:07:16.812016,2023-09-04 12:07:17.212313,0 days 00:00:00.400297,ReLU,ReLU,Tanh,,63,19,20.0,14.0,,0.02131403282860591,3,193,0.7318086909486191,0.001224303967178129,114.9168603515625,COMPLETE
422,0.20836684107780457,2023-09-04 12:07:17.212649,2023-09-04 12:07:17.540860,0 days 00:00:00.328211,ReLU,Tanh,Sigmoid,,70,18,24.0,16.0,,0.013706969873243664,3,183,0.4038862224700217,2.6949496842740888e-05,156.77682234111586,COMPLETE
423,0.1903865486383438,2023-09-04 12:07:17.541188,2023-09-04 12:07:18.065387,0 days 00:00:00.524199,ReLU,ReLU,Sigmoid,,61,17,23.0,13.0,,0.027710399885005794,3,170,0.7990906567037194,0.0007281932165268893,84.13935950494582,COMPLETE
424,0.2439703494310379,2023-09-04 12:07:18.065719,2023-09-04 12:07:19.237160,0 days 00:00:01.171441,ReLU,Sigmoid,Sigmoid,,75,16,21.0,17.0,,0.0008862184674202582,3,224,0.3050267025714751,0.0003161978213184401,134.25366973876953,COMPLETE
425,0.20732876658439636,2023-09-04 12:07:19.237481,2023-09-04 12:07:19.962009,0 days 00:00:00.724528,ReLU,Tanh,Sigmoid,,64,11,22.0,9.0,,0.006000143285293289,3,193,0.5664240230362245,0.00022174908717363719,461.80528653052545,COMPLETE
426,0.21116960048675537,2023-09-04 12:07:19.962337,2023-09-04 12:07:20.721330,0 days 00:00:00.758993,ReLU,ReLU,Sigmoid,,68,13,24.0,14.0,,0.003295052973917305,3,207,0.7012251442244487,0.0009944431770369218,234.19933359963554,COMPLETE
427,0.2300594598054886,2023-09-04 12:07:20.721651,2023-09-04 12:07:20.952660,0 days 00:00:00.231009,Tanh,ReLU,Sigmoid,,61,16,23.0,15.0,,0.006783040988498216,3,180,0.2106044591748808,0.0005144751132807997,1272.1457824707031,COMPLETE
428,0.20393460988998413,2023-09-04 12:07:20.953002,2023-09-04 12:07:21.587487,0 days 00:00:00.634485,ReLU,Tanh,Sigmoid,,67,12,24.0,13.0,,0.004859587520335307,3,288,0.7452035372299438,1.2414138786285756e-05,86.37047860788745,COMPLETE
429,0.19401763379573822,2023-09-04 12:07:21.587924,2023-09-04 12:07:22.357707,0 days 00:00:00.769783,ReLU,ReLU,Sigmoid,,62,17,22.0,14.0,,0.012978724644583198,3,259,0.7695947547651693,0.00038735484334269957,134.7563961713742,COMPLETE
430,0.19877415895462036,2023-09-04 12:07:22.358293,2023-09-04 12:07:23.536778,0 days 00:00:01.178485,ReLU,ReLU,Sigmoid,,35,18,20.0,18.0,,0.02025161497732339,3,114,0.730386348561157,0.0002629748448395592,77.87947947184244,COMPLETE
431,0.2131107747554779,2023-09-04 12:07:23.537098,2023-09-04 12:07:23.974365,0 days 00:00:00.437267,ReLU,Tanh,Sigmoid,,65,17,21.0,10.0,,0.008080055713460635,3,222,0.6800644604310551,0.000327993226890543,213.70402196248372,COMPLETE
432,0.21158669888973236,2023-09-04 12:07:23.974708,2023-09-04 12:07:24.569026,0 days 00:00:00.594318,ReLU,ReLU,Sigmoid,,63,19,23.0,15.0,,0.0043702446023448195,3,126,0.7524391601767396,0.002661634555916431,120.33413415206105,COMPLETE
433,0.19052734971046448,2023-09-04 12:07:24.569348,2023-09-04 12:07:25.166683,0 days 00:00:00.597335,ReLU,Leaky,Sigmoid,,76,16,23.0,13.0,,0.030717656351311396,3,166,0.47043766005320414,0.0006043303240887946,78.20915850471047,COMPLETE
434,0.21472610533237457,2023-09-04 12:07:25.167016,2023-09-04 12:07:26.828416,0 days 00:00:01.661400,ReLU,Tanh,ReLU,,59,18,21.0,16.0,,0.00038454429048684954,3,201,0.3645777897583726,0.00018518729710279317,154.84865771241448,COMPLETE
435,0.253055602312088,2023-09-04 12:07:26.828746,2023-09-04 12:07:27.063029,0 days 00:00:00.234283,ReLU,ReLU,Sigmoid,,66,17,24.0,17.0,,0.001909245937973028,3,50,0.17889651787013605,4.196123319553906e-05,128.29177688598634,COMPLETE
436,0.19756284356117249,2023-09-04 12:07:27.063356,2023-09-04 12:07:27.680512,0 days 00:00:00.617156,ReLU,ReLU,Tanh,,61,16,22.0,14.0,,0.010514509891757916,3,135,0.5593196385523569,0.00025558193745977463,764.7930236816406,COMPLETE
437,0.19055137038230896,2023-09-04 12:07:27.680847,2023-09-04 12:07:28.661474,0 days 00:00:00.980627,Tanh,Tanh,Sigmoid,,58,12,24.0,15.0,,0.015386536635820267,3,268,0.7112087840515326,0.00044258706953266585,84.21527123451233,COMPLETE
438,0.23208731412887573,2023-09-04 12:07:28.661850,2023-09-04 12:07:29.175923,0 days 00:00:00.514073,ReLU,ReLU,Sigmoid,,53,17,23.0,12.0,,0.0028316156241995926,3,107,0.2352932465873226,0.00923305465785083,1049.4851247948336,COMPLETE
439,0.17206379771232605,2023-09-04 12:07:29.176254,2023-09-04 12:07:30.047967,0 days 00:00:00.871713,ReLU,ReLU,Sigmoid,,48,16,19.0,13.0,,0.005513799593483135,3,178,0.7992863870799392,0.00020479807676385164,80.5415807203813,COMPLETE
440,0.21628338098526,2023-09-04 12:07:30.048302,2023-09-04 12:07:30.360053,0 days 00:00:00.311751,ReLU,ReLU,Sigmoid,,52,16,19.0,13.0,,0.005939802722710746,3,176,0.2911365394579841,0.00021323068441482165,135.55849065536108,COMPLETE
441,0.1872875839471817,2023-09-04 12:07:30.360371,2023-09-04 12:07:31.131458,0 days 00:00:00.771087,ReLU,ReLU,Sigmoid,,39,15,24.0,13.0,,0.0070442119983261,3,165,0.7736970322185186,0.00016654105510192652,128.29258346557617,COMPLETE
442,0.19096536934375763,2023-09-04 12:07:31.131795,2023-09-04 12:07:32.732043,0 days 00:00:01.600248,ReLU,ReLU,Sigmoid,,49,16,20.0,14.0,,0.00937312969301234,3,456,0.7958277356682633,0.00020544277371015515,68.43945847488031,COMPLETE
443,0.19600607454776764,2023-09-04 12:07:32.732482,2023-09-04 12:07:33.387154,0 days 00:00:00.654672,ReLU,ReLU,Sigmoid,,55,16,20.0,13.0,,0.012249025483506329,3,355,0.7687214897373428,0.0003074070841133315,104.53618828026023,COMPLETE
444,0.2332858443260193,2023-09-04 12:07:33.387553,2023-09-04 12:07:33.673607,0 days 00:00:00.286054,ReLU,ReLU,Sigmoid,,45,17,19.0,12.0,,0.01835145126336141,3,176,0.339064837293195,0.00011677524806265582,79.47582075330946,COMPLETE
445,0.21090900897979736,2023-09-04 12:07:33.674017,2023-09-04 12:07:34.167794,0 days 00:00:00.493777,ReLU,ReLU,Sigmoid,Tanh,42,15,20.0,13.0,5.0,0.040045642682732405,4,185,0.378610941510028,0.0002559843060974746,86.63665871871144,COMPLETE
446,0.21468830108642578,2023-09-04 12:07:34.168201,2023-09-04 12:07:34.571302,0 days 00:00:00.403101,ReLU,ReLU,Sigmoid,,57,16,21.0,14.0,,0.005346518844750484,3,120,0.31089461638383137,0.00015539783270208135,96.27434021571896,COMPLETE
447,0.20491668581962585,2023-09-04 12:07:34.571726,2023-09-04 12:07:35.208995,0 days 00:00:00.637269,ReLU,ReLU,Sigmoid,,60,17,23.0,12.0,,0.024316121664456864,3,155,0.7469106654206737,0.0003697976714775314,107.7827641413762,COMPLETE
448,0.22717323899269104,2023-09-04 12:07:35.209387,2023-09-04 12:07:35.805086,0 days 00:00:00.595699,ReLU,Tanh,Tanh,,43,19,20.0,13.0,,0.008179921538889735,3,190,0.7977771635753103,0.00022111132201382288,76.02691339563441,COMPLETE
449,0.22267964482307434,2023-09-04 12:07:35.805494,2023-09-04 12:07:36.608818,0 days 00:00:00.803324,Sigmoid,ReLU,Sigmoid,,54,18,24.0,14.0,,0.006614166632066816,3,139,0.25554101583952776,1.6176207675015025e-05,96.76493272047776,COMPLETE
450,0.2873685956001282,2023-09-04 12:07:36.609216,2023-09-04 12:07:37.008605,0 days 00:00:00.399389,ReLU,ReLU,Sigmoid,,48,2,21.0,10.0,,0.01475202108310435,3,160,0.2916843663460229,0.0002974242328427793,257.8005015055339,COMPLETE
451,0.26646196842193604,2023-09-04 12:07:37.009030,2023-09-04 12:07:38.977146,0 days 00:00:01.968116,ReLU,Tanh,Sigmoid,,62,16,23.0,12.0,,0.00018989889994967574,3,128,0.7690908102220224,0.00025231482532804826,127.10330361127853,COMPLETE
452,0.19112378358840942,2023-09-04 12:07:38.977481,2023-09-04 12:07:39.413927,0 days 00:00:00.436446,ReLU,ReLU,Sigmoid,,58,17,24.0,11.0,,0.011379612614358133,3,174,0.48241033711986603,5.444759095367663e-05,170.48634455754205,COMPLETE
453,0.18569236993789673,2023-09-04 12:07:39.414337,2023-09-04 12:07:39.998543,0 days 00:00:00.584206,ReLU,ReLU,Sigmoid,,56,15,23.0,13.0,,0.04681753662084835,3,149,0.7315590057730197,0.0001262725996149968,85.98520921979632,COMPLETE
454,0.1945989429950714,2023-09-04 12:07:39.998938,2023-09-04 12:07:40.791865,0 days 00:00:00.792927,ReLU,Tanh,Sigmoid,,47,16,19.0,14.0,,0.008978071342410705,3,116,0.7706466293518278,0.00018696561449819523,111.07660675048828,COMPLETE
455,0.23235052824020386,2023-09-04 12:07:40.792208,2023-09-04 12:07:41.343916,0 days 00:00:00.551708,ReLU,ReLU,Sigmoid,,51,18,21.0,15.0,,0.004387551243764569,3,101,0.44453800447454306,0.013683600327327263,233.46396423339843,COMPLETE
456,0.2965693473815918,2023-09-04 12:07:41.344250,2023-09-04 12:07:43.774494,0 days 00:00:02.430244,ReLU,ReLU,Sigmoid,,64,17,22.0,14.0,,8.798828047448095e-05,3,168,0.7357403531161741,0.0018016301458673874,172.39883014133997,COMPLETE
457,0.29446902871131897,2023-09-04 12:07:43.774859,2023-09-04 12:07:44.278922,0 days 00:00:00.504063,ReLU,Sigmoid,Sigmoid,,60,16,24.0,13.0,,0.0007808412546332728,3,141,0.13302136970219436,0.00034515259437288743,115.89862796431737,COMPLETE
458,0.19632788002490997,2023-09-04 12:07:44.279265,2023-09-04 12:07:45.116449,0 days 00:00:00.837184,ReLU,Tanh,ReLU,,80,17,18.0,11.0,,0.01944126920625221,3,182,0.7994868427733814,0.00046184955096905127,100.83423655741923,COMPLETE
459,0.22005002200603485,2023-09-04 12:07:45.117037,2023-09-04 12:07:46.703459,0 days 00:00:01.586422,ReLU,ReLU,Sigmoid,,63,15,23.0,12.0,,0.005688075088832584,3,130,0.4003078101855764,0.00016122607608360715,122.21700202094183,COMPLETE
460,0.23067879676818848,2023-09-04 12:07:46.704056,2023-09-04 12:07:53.041521,0 days 00:00:06.337465,ReLU,Tanh,Sigmoid,,58,18,21.0,14.0,,0.00015841338502440213,3,193,0.5207657161987177,0.0030122523187559374,340.94514212336566,COMPLETE
461,0.22350585460662842,2023-09-04 12:07:53.042105,2023-09-04 12:07:53.843357,0 days 00:00:00.801252,ReLU,ReLU,Tanh,,65,15,24.0,13.0,,0.0069687356636890015,3,120,0.27559897033683317,0.00010008411134058757,82.6599986336448,COMPLETE
462,0.800871729850769,2023-09-04 12:07:53.844010,2023-09-04 12:07:55.457101,0 days 00:00:01.613091,ReLU,ReLU,Sigmoid,,56,16,20.0,15.0,,1.927712222402234e-05,3,108,0.6594694562825152,0.0002936082899943902,196.9024807965314,COMPLETE
463,0.19995509088039398,2023-09-04 12:07:55.457441,2023-09-04 12:07:55.908076,0 days 00:00:00.450635,ReLU,Tanh,Sigmoid,,61,17,23.0,9.0,,0.003869306374801753,3,157,0.5061510191364675,0.00020131509347371489,112.9427001953125,COMPLETE
464,0.18572162091732025,2023-09-04 12:07:55.908423,2023-09-04 12:07:56.310431,0 days 00:00:00.402008,ReLU,ReLU,Sigmoid,,59,16,22.0,12.0,,0.03159944317180306,3,132,0.34389943525701994,1.9423135562350787e-05,74.90296958474552,COMPLETE
465,0.18159188330173492,2023-09-04 12:07:56.310799,2023-09-04 12:07:56.862226,0 days 00:00:00.551427,ReLU,ReLU,Sigmoid,,54,13,24.0,17.0,,0.01312843350938072,3,147,0.7974547152455204,0.0004122274330240433,85.13911743164063,COMPLETE
