number,value,datetime_start,datetime_complete,duration,params_activation1,params_activation2,params_activation3,params_activation4,params_batch_size,params_fl1,params_fl2,params_fl3,params_fl4,params_learning_rate,params_n_layers,params_num_epochs,params_train_size,params_weight_decay,user_attrs_mre,state
272,0.15277770161628723,2023-09-04 12:10:22.429503,2023-09-04 12:10:23.395586,0 days 00:00:00.966083,Tanh,Sigmoid,Leaky,Sigmoid,79,11,12.0,19.0,21.0,0.02236018551370755,4,340,0.7718146592780308,9.489847926834497e-05,98.30573908487956,COMPLETE
273,0.2582755386829376,2023-09-04 12:10:23.396077,2023-09-04 12:10:24.443528,0 days 00:00:01.047451,Tanh,Sigmoid,Leaky,Sigmoid,78,10,11.0,22.0,11.0,0.016001062187957816,4,362,0.7391297304286985,9.927080064536253e-05,95.29773930140904,COMPLETE
274,1.0707919597625732,2023-09-04 12:10:24.443903,2023-09-04 12:10:24.677809,0 days 00:00:00.233906,Tanh,Sigmoid,Leaky,Sigmoid,82,11,11.0,21.0,22.0,0.021198748549141586,4,124,0.7984114859932596,0.008205690293821698,102.62917391459148,COMPLETE
275,0.15425428748130798,2023-09-04 12:10:24.678156,2023-09-04 12:10:25.368543,0 days 00:00:00.690387,Tanh,Sigmoid,Tanh,Sigmoid,85,11,12.0,22.0,20.0,0.026767450753009923,4,351,0.7446196785122575,0.0001742247380135094,83.24031975928773,COMPLETE
276,0.2493242472410202,2023-09-04 12:10:25.368891,2023-09-04 12:10:25.883847,0 days 00:00:00.514956,Tanh,,,,81,10,,,,0.017166168202039016,1,370,0.7679301991779671,3.1802670667329226e-05,116.6881194114685,COMPLETE
277,0.14070650935173035,2023-09-04 12:10:25.884170,2023-09-04 12:10:26.487967,0 days 00:00:00.603797,Tanh,Tanh,Leaky,Sigmoid,84,12,13.0,20.0,18.0,0.012677168063776395,4,367,0.7038794001948472,0.00014749860499267564,79.92692787702694,COMPLETE
278,0.2172960638999939,2023-09-04 12:10:26.488321,2023-09-04 12:10:28.964383,0 days 00:00:02.476062,Tanh,Sigmoid,Leaky,Sigmoid,86,10,12.0,21.0,19.0,0.0005886611798409327,4,326,0.7309751262543916,0.00034603500681249443,193.70857903677657,COMPLETE
279,0.21421703696250916,2023-09-04 12:10:28.964739,2023-09-04 12:10:29.498678,0 days 00:00:00.533939,ReLU,Tanh,Leaky,Sigmoid,77,12,13.0,19.0,22.0,0.007928779041463694,4,344,0.5498983981170505,0.0007208696613957533,95.31724947149104,COMPLETE
280,0.1653720587491989,2023-09-04 12:10:29.499033,2023-09-04 12:10:30.696265,0 days 00:00:01.197232,Tanh,Tanh,Leaky,Sigmoid,83,11,12.0,21.0,22.0,0.01078522806125011,4,381,0.7684726425744998,0.0007740455107216935,90.21582990079312,COMPLETE
281,0.19605597853660583,2023-09-04 12:10:30.696713,2023-09-04 12:10:31.558519,0 days 00:00:00.861806,Tanh,Sigmoid,Leaky,ReLU,79,15,14.0,22.0,21.0,0.015142303790747642,4,357,0.799532217635603,0.0002082949904392498,77.34807659717316,COMPLETE
282,0.1427680402994156,2023-09-04 12:10:31.558875,2023-09-04 12:10:32.505210,0 days 00:00:00.946335,Tanh,Tanh,Leaky,Tanh,88,11,12.0,20.0,20.0,0.008940148658862768,4,376,0.6941921351955848,0.00032194608057011214,58.52321977326364,COMPLETE
283,0.3011782467365265,2023-09-04 12:10:32.505580,2023-09-04 12:10:34.018962,0 days 00:00:01.513382,Tanh,Tanh,Leaky,Sigmoid,81,12,15.0,20.0,19.0,0.0008026562619507068,4,363,0.48635187117091905,0.00036903820831325616,139.98061032362386,COMPLETE
284,0.18936501443386078,2023-09-04 12:10:34.019322,2023-09-04 12:10:34.317398,0 days 00:00:00.298076,Tanh,Tanh,Leaky,Sigmoid,85,11,13.0,21.0,21.0,0.018117030887327936,4,384,0.196072372841462,7.13506900965402e-05,106.00679095038052,COMPLETE
285,0.1513494849205017,2023-09-04 12:10:34.317755,2023-09-04 12:10:35.030701,0 days 00:00:00.712946,Tanh,Sigmoid,Leaky,Sigmoid,86,13,15.0,22.0,7.0,0.023276471484269597,4,315,0.7398365842195007,5.348199130969521e-05,87.57367397876496,COMPLETE
286,0.1799624115228653,2023-09-04 12:10:35.031063,2023-09-04 12:10:35.947205,0 days 00:00:00.916142,Tanh,Tanh,Leaky,Leaky,88,10,14.0,12.0,16.0,0.013491261967431646,4,388,0.7648814382084511,0.0009930163264741702,89.10539916466023,COMPLETE
287,0.14237725734710693,2023-09-04 12:10:35.947635,2023-09-04 12:10:36.712384,0 days 00:00:00.764749,Tanh,Tanh,Leaky,Sigmoid,82,12,10.0,19.0,17.0,0.0076088266131183425,4,374,0.7171451132427701,0.00016282486596879802,61.69909294128418,COMPLETE
288,0.25279298424720764,2023-09-04 12:10:36.712836,2023-09-04 12:10:38.874216,0 days 00:00:02.161380,Tanh,Sigmoid,Leaky,Sigmoid,79,15,13.0,20.0,19.0,0.0010497340202532293,4,397,0.7448749008915553,0.00012152007736752558,157.37144282166386,COMPLETE
289,0.16991040110588074,2023-09-04 12:10:38.874589,2023-09-04 12:10:39.263417,0 days 00:00:00.388828,Tanh,Tanh,Leaky,Sigmoid,83,9,5.0,23.0,18.0,0.03397895437336368,4,410,0.6534337637679573,0.0004912528799957288,120.218291015625,COMPLETE
290,0.19045758247375488,2023-09-04 12:10:39.263885,2023-09-04 12:10:40.009607,0 days 00:00:00.745722,Tanh,Tanh,Leaky,Sigmoid,77,12,12.0,22.0,20.0,0.010970203387968199,4,366,0.7996299013458265,0.0006652044645455885,128.28018895591177,COMPLETE
291,0.14127685129642487,2023-09-04 12:10:40.010063,2023-09-04 12:10:41.554377,0 days 00:00:01.544314,Tanh,Tanh,Leaky,Sigmoid,87,11,6.0,21.0,22.0,0.009349217682527115,4,352,0.7025493110871331,4.876126975025605e-05,245.94282771519252,COMPLETE
292,0.20226772129535675,2023-09-04 12:10:41.554830,2023-09-04 12:10:41.957440,0 days 00:00:00.402610,Tanh,Sigmoid,Leaky,Sigmoid,96,14,12.0,19.0,20.0,0.026571385685831242,4,390,0.7711025891463166,0.0008178780475637549,89.06837972005208,COMPLETE
293,0.21351948380470276,2023-09-04 12:10:41.957885,2023-09-04 12:10:42.513141,0 days 00:00:00.555256,Sigmoid,Tanh,Leaky,Sigmoid,84,10,13.0,22.0,21.0,0.016587792166076483,4,378,0.6858732430446964,0.0002587184375457153,141.31987783643933,COMPLETE
294,0.17819844186306,2023-09-04 12:10:42.513491,2023-09-04 12:10:43.567663,0 days 00:00:01.054172,Tanh,Leaky,Leaky,Sigmoid,93,13,11.0,20.0,23.0,0.002012185411287026,4,398,0.734473633735877,2.6064875685828022e-05,89.81439548068576,COMPLETE
295,0.17002853751182556,2023-09-04 12:10:43.568070,2023-09-04 12:10:44.506000,0 days 00:00:00.937930,Tanh,Tanh,Leaky,Sigmoid,81,11,13.0,21.0,18.0,0.012746338671691908,4,407,0.7653330558127937,0.00014329033512385482,95.31472508660678,COMPLETE
296,0.19528360664844513,2023-09-04 12:10:44.506369,2023-09-04 12:10:45.629363,0 days 00:00:01.122994,Tanh,ReLU,,,86,8,15.0,,,0.00666799255419132,2,368,0.7193538289964851,0.0005170121463728596,82.40780386557945,COMPLETE
297,0.2592582702636719,2023-09-04 12:10:45.629828,2023-09-04 12:10:46.199883,0 days 00:00:00.570055,Tanh,ReLU,Leaky,Sigmoid,89,12,14.0,5.0,19.0,0.010116024956194795,4,387,0.7685761296494611,0.0006426030501183972,82.59210761817727,COMPLETE
298,0.1759423464536667,2023-09-04 12:10:46.200240,2023-09-04 12:10:47.327398,0 days 00:00:01.127158,Tanh,Tanh,Leaky,Sigmoid,79,9,11.0,15.0,21.0,0.014149357245831684,4,347,0.6820990137562158,0.00023799037689284947,91.34696720264576,COMPLETE
299,0.18962222337722778,2023-09-04 12:10:47.327758,2023-09-04 12:10:47.901148,0 days 00:00:00.573390,Tanh,Sigmoid,Tanh,Sigmoid,83,11,1.0,19.0,11.0,0.02084865804992941,4,375,0.7385763103168878,0.00042417645288623916,84.0065706152665,COMPLETE
300,0.29564550518989563,2023-09-04 12:10:47.901506,2023-09-04 12:10:48.393839,0 days 00:00:00.492333,Tanh,ReLU,Leaky,Sigmoid,80,16,17.0,23.0,9.0,0.04733430141602128,4,358,0.526076614366915,2.1502218693823286e-05,240.34301970725835,COMPLETE
301,0.16497072577476501,2023-09-04 12:10:48.394204,2023-09-04 12:10:49.577882,0 days 00:00:01.183678,Tanh,Tanh,Leaky,Sigmoid,85,12,14.0,20.0,19.0,0.0026518719297123888,4,404,0.6575054397126147,0.0007713269211243197,96.09902627127511,COMPLETE
302,0.19110283255577087,2023-09-04 12:10:49.578251,2023-09-04 12:10:49.857307,0 days 00:00:00.279056,Tanh,ReLU,Leaky,Sigmoid,95,13,13.0,21.0,22.0,0.025581628158093547,4,457,0.4107854834841561,0.0010243976578632264,95.8395759828629,COMPLETE
303,0.2513611614704132,2023-09-04 12:10:49.857661,2023-09-04 12:10:50.539138,0 days 00:00:00.681477,ReLU,ReLU,Leaky,Sigmoid,91,14,20.0,18.0,20.0,0.008030145109687978,4,393,0.7749740889981742,0.0005897824303166459,79.79060952559762,COMPLETE
304,0.11108758300542831,2023-09-04 12:10:50.539486,2023-09-04 12:10:51.770123,0 days 00:00:01.230637,Tanh,Tanh,Sigmoid,Sigmoid,87,10,12.0,21.0,19.0,0.011154559581723117,4,381,0.7124971469290763,7.375562818363894e-05,58.602515567432754,COMPLETE
305,0.23654751479625702,2023-09-04 12:10:51.770535,2023-09-04 12:10:52.143722,0 days 00:00:00.373187,Tanh,ReLU,Sigmoid,Sigmoid,87,10,12.0,22.0,21.0,0.010690256639658781,4,381,0.30407414188195164,7.782699664496324e-05,347.01350086140184,COMPLETE
306,0.15899153053760529,2023-09-04 12:10:52.144103,2023-09-04 12:10:53.399241,0 days 00:00:01.255138,Tanh,Sigmoid,Sigmoid,Sigmoid,89,15,11.0,20.0,18.0,0.011906637023453834,4,389,0.705586297826901,0.0001363086533798087,79.11289488139906,COMPLETE
307,0.17985951900482178,2023-09-04 12:10:53.399611,2023-09-04 12:10:54.341730,0 days 00:00:00.942119,Tanh,Tanh,Sigmoid,Tanh,82,9,12.0,19.0,23.0,0.008637860853126995,4,415,0.4428575149853423,5.026040921614873e-05,84.93720406752367,COMPLETE
308,0.20975936949253082,2023-09-04 12:10:54.342092,2023-09-04 12:10:55.384100,0 days 00:00:01.042008,Tanh,ReLU,Sigmoid,Sigmoid,84,10,13.0,23.0,21.0,0.005713163761821212,4,400,0.6837769854111271,8.666772113983601e-05,80.38800440336529,COMPLETE
309,0.21726085245609283,2023-09-04 12:10:55.384473,2023-09-04 12:10:56.979029,0 days 00:00:01.594556,Tanh,ReLU,Sigmoid,Sigmoid,86,10,12.0,14.0,10.0,0.0011844723512197527,4,382,0.6477066558393371,6.526430885292902e-05,96.49898225069046,COMPLETE
310,0.15665338933467865,2023-09-04 12:10:56.979409,2023-09-04 12:11:01.504162,0 days 00:00:04.524753,Tanh,Tanh,Leaky,ReLU,76,13,17.0,21.0,20.0,0.0005017359194542405,4,370,0.7251668412531623,6.004549140530555e-05,152.216832773309,COMPLETE
311,0.2262348085641861,2023-09-04 12:11:01.504555,2023-09-04 12:11:02.146468,0 days 00:00:00.641913,Tanh,ReLU,Sigmoid,Sigmoid,81,9,11.0,20.0,24.0,0.007003709447343343,4,394,0.6211155973786471,0.0008451302527413893,129.2759878469068,COMPLETE
312,0.1881943643093109,2023-09-04 12:11:02.146878,2023-09-04 12:11:02.742981,0 days 00:00:00.596103,Tanh,Tanh,Leaky,Sigmoid,88,8,16.0,22.0,20.0,0.014198059375183196,4,407,0.459691241055581,0.000691257226079829,86.81171296772204,COMPLETE
313,0.1790311336517334,2023-09-04 12:11:02.743366,2023-09-04 12:11:03.370627,0 days 00:00:00.627261,Tanh,ReLU,Leaky,Leaky,84,12,12.0,21.0,23.0,0.009278289724779468,4,284,0.5763439992938637,4.5293641838247964e-05,92.72334887934666,COMPLETE
314,0.2491452991962433,2023-09-04 12:11:03.370998,2023-09-04 12:11:03.689378,0 days 00:00:00.318380,Leaky,Sigmoid,Leaky,Sigmoid,86,11,15.0,20.0,17.0,0.011707878260229336,4,374,0.5038925098475421,7.520920631496541e-05,121.27619058114512,COMPLETE
315,0.15704374015331268,2023-09-04 12:11:03.689818,2023-09-04 12:11:04.746732,0 days 00:00:01.056914,Tanh,ReLU,Leaky,Sigmoid,82,12,13.0,23.0,19.0,0.00789027574496668,4,336,0.7407443872405134,0.0005312545534337592,64.03708865825946,COMPLETE
316,0.16310566663742065,2023-09-04 12:11:04.747241,2023-09-04 12:11:05.228226,0 days 00:00:00.480985,Tanh,Tanh,Sigmoid,Sigmoid,88,14,12.0,18.0,22.0,0.03276248968084007,4,388,0.36300605560373184,7.370683187663582e-05,133.9658042362758,COMPLETE
317,0.22270211577415466,2023-09-04 12:11:05.228585,2023-09-04 12:11:05.551601,0 days 00:00:00.323016,Tanh,Leaky,Leaky,Sigmoid,78,10,10.0,8.0,20.0,0.01075872063874347,4,381,0.33323936508635776,4.4639010674416406e-05,95.96332060985075,COMPLETE
318,0.23356321454048157,2023-09-04 12:11:05.552014,2023-09-04 12:11:06.235454,0 days 00:00:00.683440,Sigmoid,ReLU,Leaky,Sigmoid,90,13,19.0,22.0,6.0,0.015107108919245488,4,400,0.7146595826181583,0.00010307151610251994,87.66716782251994,COMPLETE
319,0.44997748732566833,2023-09-04 12:11:06.235923,2023-09-04 12:11:07.246548,0 days 00:00:01.010625,Tanh,Tanh,Leaky,Sigmoid,80,1,9.0,21.0,18.0,0.005449069273459723,4,367,0.6769280884954368,0.0009792548855040687,154.2953406197684,COMPLETE
320,0.14022989571094513,2023-09-04 12:11:07.246903,2023-09-04 12:11:08.063949,0 days 00:00:00.817046,Tanh,ReLU,Leaky,Sigmoid,84,11,16.0,19.0,5.0,0.019509628024366992,4,416,0.7451419506412135,5.952875867510972e-05,624.8546439116856,COMPLETE
321,0.19222988188266754,2023-09-04 12:11:08.064311,2023-09-04 12:11:08.815429,0 days 00:00:00.751118,Tanh,Sigmoid,ReLU,Sigmoid,87,11,13.0,22.0,21.0,0.04773251205017836,4,388,0.7693514774795377,9.128439524469411e-05,81.3761534690857,COMPLETE
322,0.24056364595890045,2023-09-04 12:11:08.815916,2023-09-04 12:11:12.902289,0 days 00:00:04.086373,Tanh,ReLU,,,82,14,12.0,,,0.00019364991839736508,2,379,0.7997297215603473,0.0006519685667199506,107.34508754970791,COMPLETE
323,0.1415317952632904,2023-09-04 12:11:12.902661,2023-09-04 12:11:13.447136,0 days 00:00:00.544475,Tanh,Tanh,Leaky,Sigmoid,85,8,18.0,19.0,19.0,0.0132965630892427,4,406,0.7041414401151892,0.00017524729029230212,92.67110510433422,COMPLETE
324,0.17019465565681458,2023-09-04 12:11:13.447505,2023-09-04 12:11:14.113603,0 days 00:00:00.666098,Tanh,ReLU,Leaky,Sigmoid,77,12,13.0,20.0,22.0,0.006879448698590646,4,470,0.34946287340528953,0.00013448450834134881,159.7717777196912,COMPLETE
325,0.18001723289489746,2023-09-04 12:11:14.114063,2023-09-04 12:11:15.101037,0 days 00:00:00.986974,Tanh,Tanh,Leaky,Sigmoid,92,16,11.0,16.0,13.0,0.009452866227860086,4,428,0.41799915101880575,0.0004676422675805959,76.90328312811451,COMPLETE
326,0.21560238301753998,2023-09-04 12:11:15.101495,2023-09-04 12:11:15.775205,0 days 00:00:00.673710,Tanh,ReLU,Leaky,Sigmoid,80,13,17.0,21.0,18.0,0.004566980536092217,4,359,0.5502397524462742,0.0012306019695572563,88.81315807267731,COMPLETE
327,0.1602322906255722,2023-09-04 12:11:15.775692,2023-09-04 12:11:16.526485,0 days 00:00:00.750793,ReLU,Tanh,Tanh,Sigmoid,89,15,15.0,23.0,17.0,0.011707278289899441,4,399,0.7457066395555815,0.0008066880761022998,404.0039823882434,COMPLETE
328,0.1542949080467224,2023-09-04 12:11:16.526927,2023-09-04 12:11:17.127834,0 days 00:00:00.600907,Tanh,ReLU,Leaky,Sigmoid,83,10,16.0,20.0,20.0,0.016862949203424463,4,376,0.7193014065411314,0.0005693372911917604,86.53171943895745,COMPLETE
329,0.30318590998649597,2023-09-04 12:11:17.128209,2023-09-04 12:11:18.528642,0 days 00:00:01.400433,Tanh,Sigmoid,Sigmoid,Sigmoid,86,11,14.0,21.0,1.0,0.008335261795060772,4,393,0.3954870758765633,0.0003110948870768127,126.55612626917222,COMPLETE
330,0.16536973416805267,2023-09-04 12:11:18.529018,2023-09-04 12:11:19.833564,0 days 00:00:01.304546,Tanh,ReLU,Leaky,Sigmoid,79,12,13.0,22.0,21.0,0.009798454979864247,4,347,0.7625026681346467,0.00011665706498449602,93.20167250103421,COMPLETE
331,0.16866429150104523,2023-09-04 12:11:19.833923,2023-09-04 12:11:20.679323,0 days 00:00:00.845400,Tanh,Tanh,Leaky,Sigmoid,84,9,12.0,19.0,19.0,0.013871494498927899,4,366,0.6622213203782344,6.230980415599025e-05,78.05070165860451,COMPLETE
332,0.1657169610261917,2023-09-04 12:11:20.679751,2023-09-04 12:11:21.400221,0 days 00:00:00.720470,Tanh,ReLU,Leaky,Tanh,90,13,18.0,20.0,20.0,0.0063182960606935415,4,411,0.6940817781869194,8.560923324875748e-05,63.65802167809528,COMPLETE
333,0.23260949552059174,2023-09-04 12:11:21.400703,2023-09-04 12:11:21.665670,0 days 00:00:00.264967,Tanh,Tanh,Leaky,ReLU,88,10,17.0,21.0,21.0,0.011681048554738475,4,443,0.282801628958856,0.0001959116530756178,100.03710708618163,COMPLETE
334,0.16616401076316833,2023-09-04 12:11:21.666186,2023-09-04 12:11:22.827806,0 days 00:00:01.161620,Tanh,ReLU,Leaky,Sigmoid,81,11,13.0,22.0,22.0,0.025973027788469594,4,385,0.7720896405427609,0.000731604698390117,83.22126489527085,COMPLETE
335,0.16921775043010712,2023-09-04 12:11:22.828186,2023-09-04 12:11:24.154987,0 days 00:00:01.326801,Tanh,Sigmoid,Leaky,Sigmoid,75,12,16.0,18.0,19.0,0.01882252404804508,4,371,0.7378482879023451,0.0004437574056364737,106.4216088294983,COMPLETE
336,0.13711673021316528,2023-09-04 12:11:24.155348,2023-09-04 12:11:25.817078,0 days 00:00:01.661730,Leaky,ReLU,Leaky,Sigmoid,86,8,12.0,19.0,12.0,0.007999133804853117,4,395,0.7148378007019422,0.0010420902411149417,82.13048787386913,COMPLETE
337,0.2909873127937317,2023-09-04 12:11:25.817427,2023-09-04 12:11:26.254505,0 days 00:00:00.437078,Leaky,Tanh,Leaky,Sigmoid,86,8,12.0,19.0,12.0,0.007350509393110152,4,422,0.43554135087176865,0.0010403290416993519,109.58784183236055,COMPLETE
338,0.22527974843978882,2023-09-04 12:11:26.254905,2023-09-04 12:11:27.462964,0 days 00:00:01.208059,Leaky,ReLU,Leaky,Leaky,91,6,11.0,20.0,11.0,0.005313098294767929,4,398,0.7145497380099913,0.0005465462023845316,89.8039156595866,COMPLETE
339,0.1717810481786728,2023-09-04 12:11:27.463430,2023-09-04 12:11:28.115694,0 days 00:00:00.652264,Leaky,Tanh,Sigmoid,Sigmoid,88,13,12.0,23.0,11.0,0.008136618461973985,4,408,0.7670962437361137,0.0003800322228611154,91.85473828438,COMPLETE
340,0.23560549318790436,2023-09-04 12:11:28.116163,2023-09-04 12:11:28.667343,0 days 00:00:00.551180,Leaky,ReLU,Leaky,Sigmoid,85,7,12.0,20.0,14.0,0.0883674249935192,4,354,0.7980950747768419,0.0006518826069811043,186.25811398413873,COMPLETE
341,0.25053539872169495,2023-09-04 12:11:28.667870,2023-09-04 12:11:29.271531,0 days 00:00:00.603661,Leaky,Leaky,Leaky,Sigmoid,87,8,11.0,21.0,12.0,0.006633633057445012,4,296,0.7272395017102875,0.0012901643635831281,368.12335688893387,COMPLETE
342,0.2779702842235565,2023-09-04 12:11:29.271908,2023-09-04 12:11:29.475235,0 days 00:00:00.203327,Sigmoid,ReLU,Leaky,Sigmoid,78,15,13.0,19.0,12.0,0.03538486678326848,4,394,0.16864708441665574,3.445650477797282e-05,150.15093669891357,COMPLETE
343,0.2562602758407593,2023-09-04 12:11:29.475616,2023-09-04 12:11:30.044739,0 days 00:00:00.569123,Tanh,Tanh,Leaky,Sigmoid,90,7,8.0,22.0,21.0,0.009590871374776292,4,380,0.6910541004802377,0.000866260463987151,134.62588520050048,COMPLETE
344,0.20501242578029633,2023-09-04 12:11:30.045102,2023-09-04 12:11:30.915220,0 days 00:00:00.870118,Leaky,Sigmoid,Leaky,Sigmoid,48,12,13.0,21.0,8.0,0.008127177003116682,4,416,0.7502919542239489,0.00023491953844032243,95.93829150077624,COMPLETE
345,0.22855371236801147,2023-09-04 12:11:30.915610,2023-09-04 12:11:31.851794,0 days 00:00:00.936184,Leaky,ReLU,ReLU,Sigmoid,83,14,14.0,13.0,23.0,0.0021843786794706562,4,361,0.7999975428863152,3.611952271624187e-05,84.61171468098958,COMPLETE
346,0.33829572796821594,2023-09-04 12:11:31.852165,2023-09-04 12:11:32.335932,0 days 00:00:00.483767,Tanh,Tanh,Leaky,Sigmoid,85,13,10.0,19.0,20.0,0.0013849748791231967,4,329,0.7536058474150582,0.003892762281358766,101.8587181337418,COMPLETE
347,0.6076616048812866,2023-09-04 12:11:32.336324,2023-09-04 12:11:34.135559,0 days 00:00:01.799235,Tanh,ReLU,Leaky,Sigmoid,92,8,21.0,20.0,10.0,6.802979668368291e-05,4,404,0.21284660823723975,0.0020088133058299863,1309.4652926756603,COMPLETE
348,0.1885693371295929,2023-09-04 12:11:34.135947,2023-09-04 12:11:35.333235,0 days 00:00:01.197288,Tanh,ReLU,Leaky,Sigmoid,88,11,3.0,24.0,22.0,0.004514779863931657,4,373,0.6717178632691259,0.0002861808950082498,147.36939629088056,COMPLETE
349,0.2792929708957672,2023-09-04 12:11:35.333611,2023-09-04 12:11:35.876268,0 days 00:00:00.542657,Tanh,Tanh,Sigmoid,Sigmoid,81,12,12.0,23.0,21.0,0.015767120800635883,4,392,0.7068763648830204,0.00048022679106777324,130.21466954549155,COMPLETE
350,0.2798556685447693,2023-09-04 12:11:35.876641,2023-09-04 12:11:38.993560,0 days 00:00:03.116919,Tanh,Sigmoid,Tanh,Sigmoid,76,9,14.0,21.0,20.0,0.0009400936459775725,4,463,0.3306905074274603,1.3528443297021705e-05,104.97822808465894,COMPLETE
351,0.29215723276138306,2023-09-04 12:11:38.993931,2023-09-04 12:11:41.754502,0 days 00:00:02.760571,Tanh,ReLU,Leaky,Sigmoid,82,7,24.0,20.0,19.0,0.0016760453591801881,4,341,0.7731863731674014,0.0177002415932045,122.16995323478402,COMPLETE
352,0.15111538767814636,2023-09-04 12:11:41.754861,2023-09-04 12:11:42.746754,0 days 00:00:00.991893,Tanh,Tanh,Leaky,Sigmoid,86,12,13.0,22.0,21.0,0.010777846408418732,4,383,0.734704357103682,0.0007345252951067349,86.66681457968319,COMPLETE
353,0.1792954057455063,2023-09-04 12:11:42.747130,2023-09-04 12:11:43.549372,0 days 00:00:00.802242,Tanh,ReLU,Leaky,Sigmoid,89,14,12.0,20.0,15.0,0.005894530500492897,4,449,0.6384181154641545,0.0005708183176403642,89.13535907451923,COMPLETE
354,0.22329097986221313,2023-09-04 12:11:43.549755,2023-09-04 12:11:44.694682,0 days 00:00:01.144927,ReLU,Tanh,Leaky,Sigmoid,93,11,13.0,19.0,22.0,0.003173255249245075,4,401,0.4899028292794164,0.001057260631785121,94.48941040039062,COMPLETE
355,0.4373360872268677,2023-09-04 12:11:44.695060,2023-09-04 12:11:44.847979,0 days 00:00:00.152919,Tanh,ReLU,Leaky,Sigmoid,84,11,7.0,22.0,13.0,0.02119591478356982,4,370,0.10523381423839182,4.084958678086417e-05,142.43253884664395,COMPLETE
356,0.1671774536371231,2023-09-04 12:11:44.848363,2023-09-04 12:11:45.540818,0 days 00:00:00.692455,Tanh,ReLU,Leaky,Sigmoid,98,13,12.0,15.0,20.0,0.009296300158549747,4,353,0.7209099872188103,0.00035647985467921937,107.43977796114407,COMPLETE
357,0.17033299803733826,2023-09-04 12:11:45.541200,2023-09-04 12:11:48.897207,0 days 00:00:03.356007,Tanh,Sigmoid,Leaky,Tanh,79,12,11.0,21.0,16.0,0.0006599621012576528,4,430,0.7696179633435251,0.00044266227315311745,79.21256726408657,COMPLETE
358,0.1914890855550766,2023-09-04 12:11:48.897569,2023-09-04 12:11:49.429998,0 days 00:00:00.532429,Tanh,Tanh,Sigmoid,Sigmoid,87,15,15.0,20.0,11.0,0.013120234561659398,4,389,0.37114995407410795,0.0006514655141046468,100.29863893812981,COMPLETE
359,0.2210906744003296,2023-09-04 12:11:49.430376,2023-09-04 12:11:50.086542,0 days 00:00:00.656166,Tanh,ReLU,Leaky,ReLU,43,14,14.0,23.0,19.0,0.029326242481762382,4,412,0.6928980690550759,0.0014369245864414052,93.42141582347729,COMPLETE
360,0.2018640786409378,2023-09-04 12:11:50.086914,2023-09-04 12:11:50.819539,0 days 00:00:00.732625,Leaky,Tanh,Leaky,Sigmoid,80,8,13.0,21.0,21.0,0.00679950950301807,4,363,0.7444887985150052,0.0023616417960228083,111.43365884334483,COMPLETE
361,0.2034817337989807,2023-09-04 12:11:50.819927,2023-09-04 12:11:51.551623,0 days 00:00:00.731696,Tanh,ReLU,Leaky,Sigmoid,83,16,4.0,20.0,12.0,0.010805142462321053,4,377,0.7999884427468429,0.0008074837542295919,128.73450876871746,COMPLETE
