number,value,datetime_start,datetime_complete,duration,params_activation1,params_activation2,params_activation3,params_activation4,params_batch_size,params_fl1,params_fl2,params_fl3,params_fl4,params_learning_rate,params_n_layers,params_num_epochs,params_train_size,params_weight_decay,user_attrs_mre,state
0,0.39809462428092957,2023-09-04 11:57:36.032869,2023-09-04 11:57:56.954178,0 days 00:00:20.921309,Leaky,Leaky,,,21,7,4.0,,,2.163583462022655e-05,2,265,0.6908381358568874,0.02125553956356772,200.00517635705336,COMPLETE
1,0.2231275588274002,2023-09-04 11:57:56.954667,2023-09-04 11:58:03.416553,0 days 00:00:06.461886,Sigmoid,ReLU,Tanh,Sigmoid,12,8,15.0,19.0,24.0,0.015760312737210746,4,94,0.56663458371299,4.273176454773825e-05,88.46566571687397,COMPLETE
2,0.517694354057312,2023-09-04 11:58:03.417077,2023-09-04 11:58:05.581591,0 days 00:00:02.164514,ReLU,Sigmoid,Sigmoid,,34,20,17.0,18.0,,0.00016842652579703488,3,148,0.14854364569401995,0.010184440663365928,114.41344147759514,COMPLETE
3,0.23805607855319977,2023-09-04 11:58:05.582101,2023-09-04 11:58:05.883498,0 days 00:00:00.301397,Tanh,ReLU,,,63,23,8.0,,,0.05093729905851085,2,289,0.14483840149245086,0.005777525584637359,167.41743087768555,COMPLETE
4,0.28415432572364807,2023-09-04 11:58:05.883989,2023-09-04 11:58:07.149613,0 days 00:00:01.265624,Tanh,Leaky,,,98,5,1.0,,,0.004099527306740196,2,198,0.4205199899877877,1.095534407165451e-05,110.6605881114065,COMPLETE
5,0.25234559178352356,2023-09-04 11:58:07.150094,2023-09-04 11:58:07.823651,0 days 00:00:00.673557,ReLU,,,,32,19,,,,0.007286146241972356,1,214,0.4548586426402517,0.04409875768881243,182.8063805621603,COMPLETE
6,0.29031288623809814,2023-09-04 11:58:07.824119,2023-09-04 11:58:14.014223,0 days 00:00:06.190104,Sigmoid,,,,30,4,,,,0.00033482352149318516,1,140,0.662619838744997,0.00047991441978154314,151.33995443071638,COMPLETE
7,0.32458242774009705,2023-09-04 11:58:14.014711,2023-09-04 11:58:14.316154,0 days 00:00:00.301443,Sigmoid,Leaky,,,87,21,12.0,,,0.0033746614225641505,2,448,0.150578051070499,0.011913877730438298,140.0641552318226,COMPLETE
8,0.2484077513217926,2023-09-04 11:58:14.316621,2023-09-04 11:58:17.630394,0 days 00:00:03.313773,Leaky,Sigmoid,Tanh,Leaky,83,6,12.0,17.0,18.0,0.0008668940053741,4,425,0.35341617598768155,3.936438692954762e-05,162.3702409686464,COMPLETE
9,0.5648865103721619,2023-09-04 11:58:17.630889,2023-09-04 11:58:21.030163,0 days 00:00:03.399274,Sigmoid,,,,54,21,,,,6.825655201657844e-05,1,488,0.13876734140970212,2.2528562314907398e-05,102.29544075199816,COMPLETE
10,0.23853307962417603,2023-09-04 11:58:21.030601,2023-09-04 11:58:23.647777,0 days 00:00:02.617176,Sigmoid,Tanh,Leaky,Sigmoid,13,13,24.0,4.0,23.0,0.08238034820653349,4,53,0.23289844848467398,0.00015056825660237692,128.5848023550851,COMPLETE
11,0.2547491192817688,2023-09-04 11:58:23.648305,2023-09-04 11:58:23.992590,0 days 00:00:00.344285,Tanh,ReLU,Tanh,,61,13,8.0,9.0,,0.06955899638314629,3,331,0.2303414577037023,0.0019418163255234685,105.87734549386161,COMPLETE
12,0.24904195964336395,2023-09-04 11:58:23.993066,2023-09-04 11:58:24.579847,0 days 00:00:00.586781,Tanh,ReLU,ReLU,,56,10,18.0,24.0,,0.023076621130709154,3,345,0.11095435574536817,0.002292331868905125,473.27373953426587,COMPLETE
13,0.23171550035476685,2023-09-04 11:58:24.580328,2023-09-04 11:58:25.599406,0 days 00:00:01.019078,Tanh,ReLU,Tanh,Sigmoid,68,16,9.0,24.0,4.0,0.017050209268782472,4,334,0.27356742644693405,0.0001360286520193246,93.55161505479079,COMPLETE
14,0.20524632930755615,2023-09-04 11:58:25.599896,2023-09-04 11:58:28.568056,0 days 00:00:02.968160,Sigmoid,ReLU,Tanh,Sigmoid,74,16,17.0,23.0,2.0,0.01389281927388756,4,61,0.7939639654937334,0.00010635166661475375,98.38798335341157,COMPLETE
15,0.3268079161643982,2023-09-04 11:58:28.568529,2023-09-04 11:58:36.930483,0 days 00:00:08.361954,Sigmoid,ReLU,Tanh,Sigmoid,42,1,18.0,18.0,1.0,0.0019161163853797453,4,103,0.7776157546473622,8.703480490190251e-05,115.09661487468237,COMPLETE
16,0.23566977679729462,2023-09-04 11:58:36.930998,2023-09-04 11:58:38.869530,0 days 00:00:01.938532,Sigmoid,Tanh,Tanh,,77,9,23.0,20.0,,0.013392503617065952,3,64,0.5649466437724929,0.0005232082875046243,102.95616519451141,COMPLETE
17,0.2259809672832489,2023-09-04 11:58:38.870000,2023-09-04 11:58:41.184872,0 days 00:00:02.314872,Sigmoid,ReLU,ReLU,ReLU,45,16,15.0,12.0,10.0,0.00858651293905512,4,109,0.5466915111592018,5.253395938330227e-05,266.76210703748336,COMPLETE
18,0.19598683714866638,2023-09-04 11:58:41.185360,2023-09-04 11:58:43.527171,0 days 00:00:02.341811,Sigmoid,ReLU,Sigmoid,Tanh,72,17,21.0,21.0,11.0,0.02645588184701439,4,178,0.7542227599529383,0.00025417380647440734,109.55027633666992,COMPLETE
19,0.156742662191391,2023-09-04 11:58:43.527652,2023-09-04 11:58:48.749191,0 days 00:00:05.221539,ReLU,ReLU,Sigmoid,,75,16,20.0,14.0,,0.0013011488035955345,3,186,0.7822456368519642,0.00024295541041028892,72.84590761680303,COMPLETE
20,0.19388437271118164,2023-09-04 11:58:48.749642,2023-09-04 11:58:52.660966,0 days 00:00:03.911324,ReLU,Tanh,Sigmoid,,98,24,22.0,14.0,,0.0010126914771183193,3,190,0.6333868169610569,0.0003121735893877264,113.8499014875014,COMPLETE
21,0.18282094597816467,2023-09-04 11:58:52.661426,2023-09-04 11:58:55.772626,0 days 00:00:03.111200,ReLU,Tanh,Sigmoid,,100,18,21.0,13.0,,0.0011983957979667997,3,199,0.6554780723767741,0.00032530767897202573,124.96561977841438,COMPLETE
22,0.17761988937854767,2023-09-04 11:58:55.773080,2023-09-04 11:59:01.004223,0 days 00:00:05.231143,ReLU,Tanh,Sigmoid,,98,24,21.0,13.0,,0.0010588746752915187,3,226,0.6422322832731376,0.00046566224947535497,74.11511583225702,COMPLETE
23,0.23347978293895721,2023-09-04 11:59:01.004688,2023-09-04 11:59:04.155143,0 days 00:00:03.150455,ReLU,Tanh,Sigmoid,,90,18,20.0,11.0,,0.0008565026678226383,3,258,0.46253417845104056,0.0010382103568590576,127.63956653050013,COMPLETE
24,0.2323571741580963,2023-09-04 11:59:04.155608,2023-09-04 11:59:10.738680,0 days 00:00:06.583072,ReLU,Tanh,Sigmoid,,92,14,20.0,8.0,,0.00039957557006392076,3,231,0.6256614264354686,0.000829781312455192,130.27883062321385,COMPLETE
25,0.21110035479068756,2023-09-04 11:59:10.739135,2023-09-04 11:59:13.007044,0 days 00:00:02.267909,ReLU,Tanh,Sigmoid,,81,11,24.0,15.0,,0.0023424651032378447,3,152,0.5170123127071792,0.00026676398206003675,158.93583519514218,COMPLETE
26,0.19152137637138367,2023-09-04 11:59:13.007490,2023-09-04 11:59:15.656943,0 days 00:00:02.649453,ReLU,Tanh,,,100,22,20.0,,,0.002206937670661993,2,300,0.7948004170875752,0.0011495707419777775,118.27424107240827,COMPLETE
27,0.2254088670015335,2023-09-04 11:59:15.657392,2023-09-04 11:59:17.207564,0 days 00:00:01.550172,ReLU,Tanh,Sigmoid,,92,24,15.0,15.0,,0.001410506251599546,3,247,0.6475162255959913,0.00021098144319736843,97.31152508305568,COMPLETE
28,0.2265430986881256,2023-09-04 11:59:17.208169,2023-09-04 11:59:23.444950,0 days 00:00:06.236781,ReLU,Sigmoid,,,85,19,22.0,,,0.0005138380339424432,2,381,0.3964197939209874,0.0004358242539058603,99.18248876937105,COMPLETE
29,0.36050498485565186,2023-09-04 11:59:23.445380,2023-09-04 11:59:31.373716,0 days 00:00:07.928336,Leaky,Tanh,Leaky,,78,15,19.0,8.0,,1.83523280115884e-05,3,225,0.6914096622304445,0.0006226161522194842,115.64984656439887,COMPLETE
30,0.3003504276275635,2023-09-04 11:59:31.374169,2023-09-04 11:59:35.146295,0 days 00:00:03.772126,ReLU,Tanh,Sigmoid,,94,11,22.0,5.0,,0.00016594083757833937,3,167,0.5088929231377616,0.00018315020373834806,156.8803079570839,COMPLETE
31,0.21709638833999634,2023-09-04 11:59:35.146761,2023-09-04 11:59:36.305316,0 days 00:00:01.158555,ReLU,Tanh,,,100,21,20.0,,,0.0023400392731777646,2,293,0.7807129482616297,0.0012826234973667106,65.67343570024539,COMPLETE
32,0.19233444333076477,2023-09-04 11:59:36.305765,2023-09-04 11:59:37.751471,0 days 00:00:01.445706,ReLU,Tanh,,,99,22,16.0,,,0.003683157898723671,2,280,0.5930620280292526,0.002369196692490778,298.28880310058594,COMPLETE
33,0.2050507813692093,2023-09-04 11:59:37.751916,2023-09-04 11:59:38.663419,0 days 00:00:00.911503,ReLU,Leaky,,,86,19,21.0,,,0.0014726809912849975,2,309,0.7003950462545672,0.0003538747296732602,147.21424570391255,COMPLETE
34,0.1930960863828659,2023-09-04 11:59:38.663888,2023-09-04 11:59:42.902777,0 days 00:00:04.238889,ReLU,Tanh,Sigmoid,,94,23,19.0,11.0,,0.0007977523874088585,3,259,0.6862945473154282,0.0009151266303718407,74.69002404706231,COMPLETE
35,0.20380161702632904,2023-09-04 11:59:42.903045,2023-09-04 11:59:43.709087,0 days 00:00:00.806042,Leaky,Tanh,,,89,22,24.0,,,0.0014394234110339042,2,203,0.5809359836227205,0.0047521295453131895,479.61028533935547,COMPLETE
36,0.19537308812141418,2023-09-04 11:59:43.709351,2023-09-04 11:59:44.276081,0 days 00:00:00.566730,ReLU,Sigmoid,Sigmoid,,95,18,13.0,14.0,,0.005607055858922619,3,120,0.722125153242159,0.001563866593193869,176.52036784245416,COMPLETE
37,0.19817747175693512,2023-09-04 11:59:44.276346,2023-09-04 11:59:45.100499,0 days 00:00:00.824153,ReLU,,,,67,20,,,,0.0025310079720951696,1,232,0.6164579884299082,0.0006632858336068744,87.57631367384785,COMPLETE
38,0.20150217413902283,2023-09-04 11:59:45.100752,2023-09-04 11:59:45.836076,0 days 00:00:00.735324,ReLU,Tanh,,,81,23,17.0,,,0.005103363998358364,2,379,0.7935843918182046,0.00043267963573806006,88.23064184188843,COMPLETE
39,0.19989155232906342,2023-09-04 11:59:45.836348,2023-09-04 11:59:46.638964,0 days 00:00:00.802616,ReLU,Leaky,Leaky,,99,20,19.0,10.0,,0.0033982969927852723,3,128,0.4957366839686253,0.003195880704916278,257.2963190431948,COMPLETE
40,0.2361324578523636,2023-09-04 11:59:46.639243,2023-09-04 11:59:48.222515,0 days 00:00:01.583272,Leaky,Tanh,,,88,18,21.0,,,0.00022904280038992466,2,168,0.6858919238826184,0.0011406002661505557,101.61483446756999,COMPLETE
41,0.19830511510372162,2023-09-04 11:59:48.222794,2023-09-04 11:59:48.914875,0 days 00:00:00.692081,ReLU,Tanh,,,100,22,16.0,,,0.0033117962512402644,2,277,0.5957592986685819,0.002212953850255419,104.60929809917103,COMPLETE
42,0.21480441093444824,2023-09-04 11:59:48.915139,2023-09-04 11:59:50.799118,0 days 00:00:01.883979,ReLU,Tanh,,,96,22,14.0,,,0.0006263569092772858,2,296,0.5495288190918345,0.0006518964147792184,104.21256259015499,COMPLETE
43,0.19266805052757263,2023-09-04 11:59:50.799390,2023-09-04 11:59:52.190844,0 days 00:00:01.391454,ReLU,,,,100,24,,,,0.0011623931537349489,1,204,0.7098368211142336,0.003257883914293234,112.46703355119035,COMPLETE
44,0.24002625048160553,2023-09-04 11:59:52.191098,2023-09-04 11:59:52.711269,0 days 00:00:00.520171,ReLU,Tanh,,,90,21,18.0,,,0.0037014031567080725,2,313,0.6103967797309348,0.007574471830806098,99.44218469838627,COMPLETE
45,0.2006376087665558,2023-09-04 11:59:52.711534,2023-09-04 11:59:53.224735,0 days 00:00:00.513201,ReLU,Sigmoid,ReLU,,84,23,23.0,16.0,,0.006854539408540283,3,270,0.6600815514947763,0.0013307894679174522,123.89774695502388,COMPLETE
46,0.23048201203346252,2023-09-04 11:59:53.225274,2023-09-04 11:59:57.259807,0 days 00:00:04.034533,Tanh,Leaky,,,96,19,4.0,,,0.0017678758083094716,2,241,0.7344855396749624,0.0003605256384762938,168.2719181008535,COMPLETE
47,0.2304324209690094,2023-09-04 11:59:57.260248,2023-09-04 12:00:02.387256,0 days 00:00:05.127008,ReLU,Tanh,,,60,15,16.0,,,0.0006535752667504984,2,362,0.4633826308816768,0.011975708312454312,86.16037489904612,COMPLETE
48,0.19799566268920898,2023-09-04 12:00:02.387698,2023-09-04 12:00:07.517508,0 days 00:00:05.129810,ReLU,ReLU,Sigmoid,,51,20,11.0,6.0,,0.001123378752360667,3,216,0.7979235745883972,0.00022105899317384852,90.93652954101563,COMPLETE
49,0.22443626821041107,2023-09-04 12:00:07.517978,2023-09-04 12:00:10.017406,0 days 00:00:02.499428,Tanh,,,,77,17,,,,0.002208739009481137,1,151,0.5622066328579642,0.0008145900954638876,97.87618237157022,COMPLETE
50,0.2364211529493332,2023-09-04 12:00:10.017825,2023-09-04 12:00:13.353404,0 days 00:00:03.335579,ReLU,Tanh,Sigmoid,,68,21,23.0,13.0,,0.0004845940500374953,3,184,0.42366504286258816,0.00015883749499177337,2911.290469952484,COMPLETE
51,0.20406046509742737,2023-09-04 12:00:13.353882,2023-09-04 12:00:17.508771,0 days 00:00:04.154889,ReLU,,,,96,24,,,,0.0014165280146331695,1,198,0.7330288814263644,0.0031569177301889336,116.53256340247358,COMPLETE
52,0.19715972244739532,2023-09-04 12:00:17.509198,2023-09-04 12:00:22.020275,0 days 00:00:04.511077,ReLU,,,,100,23,,,,0.0007481855097670944,1,214,0.6557568814357434,0.002108032434780611,150.38842752046673,COMPLETE
53,0.22643662989139557,2023-09-04 12:00:22.020691,2023-09-04 12:00:24.708956,0 days 00:00:02.688265,ReLU,,,,92,24,,,,0.0011431895018375736,1,284,0.7230345671519173,0.0015275809923972529,81.88898954720332,COMPLETE
54,0.22233259677886963,2023-09-04 12:00:24.709382,2023-09-04 12:00:26.272935,0 days 00:00:01.563553,ReLU,,,,87,22,,,,0.0029973923469250145,1,249,0.6059091168699832,0.0034141234508384176,101.97353373075786,COMPLETE
55,0.21050283312797546,2023-09-04 12:00:26.273370,2023-09-04 12:00:28.648060,0 days 00:00:02.374690,Leaky,ReLU,Sigmoid,,97,21,17.0,1.0,,0.0046604513745593925,3,79,0.6837007253974292,0.0006016954384704442,87.69330210625371,COMPLETE
56,0.21150751411914825,2023-09-04 12:00:28.648535,2023-09-04 12:00:33.158418,0 days 00:00:04.509883,ReLU,Tanh,Sigmoid,,20,23,20.0,13.0,,0.0009928040873943853,3,208,0.5271109976691859,0.00011983650273892384,162.30165004730225,COMPLETE
57,0.22079311311244965,2023-09-04 12:00:33.158876,2023-09-04 12:00:37.750428,0 days 00:00:04.591552,ReLU,Sigmoid,,,37,17,18.0,,,0.0018018377866452883,2,318,0.7430774386769584,0.00044750733479976217,80.5557062966483,COMPLETE
58,0.19460949301719666,2023-09-04 12:00:37.750871,2023-09-04 12:00:42.838316,0 days 00:00:05.087445,ReLU,ReLU,ReLU,Tanh,92,24,11.0,16.0,16.0,0.0003245080694507435,4,168,0.5618923083979385,0.00028238111405638836,176.98639197576614,COMPLETE
59,0.22523146867752075,2023-09-04 12:00:42.838803,2023-09-04 12:00:45.369254,0 days 00:00:02.530451,Tanh,Leaky,Leaky,,82,14,1.0,19.0,,0.002702170128193742,3,270,0.6350665442710828,0.000886545239892509,199.79774158756908,COMPLETE
60,0.29170799255371094,2023-09-04 12:00:45.369722,2023-09-04 12:00:48.529081,0 days 00:00:03.159359,ReLU,,,,73,3,,,,0.0018586451400081252,1,345,0.5834196691520716,0.001860137419225753,138.9695653852248,COMPLETE
61,0.20934957265853882,2023-09-04 12:00:48.529509,2023-09-04 12:00:55.553599,0 days 00:00:07.024090,ReLU,Tanh,Sigmoid,,94,22,19.0,11.0,,0.0007831776312432878,3,266,0.6807736156114492,0.0010264414207028134,93.2279764811198,COMPLETE
62,0.2036895453929901,2023-09-04 12:00:55.554063,2023-09-04 12:00:58.702255,0 days 00:00:03.148192,ReLU,Tanh,Sigmoid,,98,23,21.0,11.0,,0.0010693061573594485,3,244,0.7516016724097802,0.0009482399338497415,188.95956208533846,COMPLETE
63,0.22432634234428406,2023-09-04 12:00:58.702722,2023-09-04 12:01:03.998717,0 days 00:00:05.295995,ReLU,Tanh,Sigmoid,,94,24,19.0,12.0,,0.0005934513312767214,3,225,0.6592055684604355,0.0005149184030263477,118.92196836309918,COMPLETE
64,0.21090371906757355,2023-09-04 12:01:03.999196,2023-09-04 12:01:08.076083,0 days 00:00:04.076887,ReLU,Tanh,Sigmoid,,91,22,22.0,9.0,,0.0012285512405342974,3,253,0.7089000807686064,0.0016847296535032242,90.49051165771485,COMPLETE
65,0.1792304366827011,2023-09-04 12:01:08.076544,2023-09-04 12:01:12.169006,0 days 00:00:04.092462,ReLU,ReLU,Sigmoid,,100,12,16.0,17.0,,0.001769534012803938,3,195,0.7993383526421792,0.0003188522409277633,131.4732235142442,COMPLETE
66,0.2478611022233963,2023-09-04 12:01:12.169457,2023-09-04 12:01:16.461248,0 days 00:00:04.291791,Sigmoid,ReLU,Sigmoid,,99,7,16.0,17.0,,0.0040163398013408295,3,189,0.797999027531211,0.0002610745693902194,145.23021823070087,COMPLETE
67,0.17394578456878662,2023-09-04 12:01:16.461724,2023-09-04 12:01:21.252809,0 days 00:00:04.791085,ReLU,ReLU,,,88,12,13.0,,,0.0018407768719342075,2,172,0.747151606552684,8.296961581766152e-05,125.93567235721565,COMPLETE
68,0.1908770650625229,2023-09-04 12:01:21.253253,2023-09-04 12:01:24.879699,0 days 00:00:03.626446,Leaky,ReLU,,,88,12,14.0,,,0.0018318359747198979,2,136,0.7667380575178316,9.484740055728037e-05,88.94005061378164,COMPLETE
69,0.20628374814987183,2023-09-04 12:01:24.880170,2023-09-04 12:01:26.725386,0 days 00:00:01.845216,Leaky,ReLU,,,86,12,13.0,,,0.001853068545416526,2,137,0.7552120573511244,8.410725247280378e-05,107.4027936299642,COMPLETE
70,0.1863851100206375,2023-09-04 12:01:26.725847,2023-09-04 12:01:30.491115,0 days 00:00:03.765268,Leaky,ReLU,,,80,9,14.0,,,0.002501463655176157,2,156,0.6431549496631574,0.0001666480469923352,392.0622549874442,COMPLETE
71,0.21191546320915222,2023-09-04 12:01:30.491565,2023-09-04 12:01:31.799518,0 days 00:00:01.307953,Leaky,ReLU,,,80,10,11.0,,,0.002647922631911895,2,155,0.6362273462682648,0.0001411792343821529,134.01229937871298,COMPLETE
72,0.20394963026046753,2023-09-04 12:01:31.799961,2023-09-04 12:01:34.908148,0 days 00:00:03.108187,Leaky,ReLU,,,84,12,14.0,,,0.0014684656659875513,2,100,0.7641208654371114,0.00017670709101904,104.26266654968262,COMPLETE
73,0.24624060094356537,2023-09-04 12:01:34.908594,2023-09-04 12:01:38.293727,0 days 00:00:03.385133,Leaky,ReLU,,,89,8,14.0,,,0.0008444390931649795,2,115,0.7544928287916978,9.060473927787506e-05,114.09141089397929,COMPLETE
74,0.23328113555908203,2023-09-04 12:01:38.294169,2023-09-04 12:01:41.608557,0 days 00:00:03.314388,Leaky,ReLU,,,71,13,9.0,,,0.002091467767249153,2,172,0.6646687240661494,0.00020378062257005557,87.60627877175271,COMPLETE
75,0.1803102344274521,2023-09-04 12:01:41.609009,2023-09-04 12:01:44.725884,0 days 00:00:03.116875,Leaky,ReLU,,,76,10,15.0,,,0.002672850311778769,2,138,0.7981740139748265,0.0003692981399212176,102.66494516225961,COMPLETE
76,0.22382117807865143,2023-09-04 12:01:44.726337,2023-09-04 12:01:47.033235,0 days 00:00:02.306898,Leaky,ReLU,,,78,9,12.0,,,0.001676868048610619,2,139,0.6297386773708867,0.0003167873931635752,102.60937993666705,COMPLETE
77,0.20039454102516174,2023-09-04 12:01:47.033687,2023-09-04 12:01:48.309992,0 days 00:00:01.276305,Leaky,ReLU,,,76,11,15.0,,,0.002879138070646191,2,92,0.7164264718523946,6.222763227975232e-05,113.73032024294831,COMPLETE
78,0.17746518552303314,2023-09-04 12:01:48.310280,2023-09-04 12:01:48.877785,0 days 00:00:00.567505,Leaky,ReLU,Leaky,,65,10,12.0,17.0,,0.004899357202036555,3,154,0.799738001019444,0.00012487099737840314,105.61219656808036,COMPLETE
79,0.193097323179245,2023-09-04 12:01:48.878059,2023-09-04 12:01:49.516986,0 days 00:00:00.638927,Leaky,ReLU,Leaky,,65,10,12.0,17.0,,0.009180758277250517,3,160,0.6937819852796974,0.00011880549156528672,79.34974965182218,COMPLETE
80,0.19624052941799164,2023-09-04 12:01:49.517268,2023-09-04 12:01:50.614869,0 days 00:00:01.097601,Leaky,ReLU,Leaky,,71,9,13.0,15.0,,0.004870529117965133,3,181,0.5930024033228825,0.00023241186728751193,85.23029055453763,COMPLETE
81,0.18242070078849792,2023-09-04 12:01:50.615162,2023-09-04 12:01:51.135853,0 days 00:00:00.520691,Leaky,ReLU,Leaky,,75,11,14.0,19.0,,0.003926559562544455,3,130,0.7898780687393473,0.00016029725421689157,118.96306906806097,COMPLETE
82,0.22189147770404816,2023-09-04 12:01:51.136164,2023-09-04 12:01:51.486828,0 days 00:00:00.350664,Leaky,ReLU,Leaky,,75,8,15.0,21.0,,0.006160956551503673,3,125,0.7968856572819004,0.00017223548800214032,91.09998852273692,COMPLETE
83,0.17981776595115662,2023-09-04 12:01:51.487128,2023-09-04 12:01:52.095768,0 days 00:00:00.608640,Leaky,ReLU,Leaky,,61,10,12.0,17.0,,0.0035641984686707075,3,190,0.724843098430272,0.0003217728071076203,90.2504493713379,COMPLETE
84,0.18099665641784668,2023-09-04 12:01:52.096060,2023-09-04 12:01:52.966702,0 days 00:00:00.870642,Leaky,ReLU,Leaky,,62,10,10.0,19.0,,0.0044112932348939855,3,199,0.7252611172748411,0.00037837998750236854,83.05410214128166,COMPLETE
85,0.19900129735469818,2023-09-04 12:01:52.966977,2023-09-04 12:01:53.518557,0 days 00:00:00.551580,Leaky,ReLU,Leaky,,56,10,10.0,19.0,,0.0040854477834821636,3,193,0.7270994582440591,0.0003916447235336337,89.66417581894818,COMPLETE
86,0.17889979481697083,2023-09-04 12:01:53.518863,2023-09-04 12:01:54.403780,0 days 00:00:00.884917,Leaky,ReLU,Leaky,,62,11,8.0,18.0,,0.007870274931789448,3,178,0.7596250332769418,0.00031193192681597476,202.8642150878906,COMPLETE
87,0.19327972829341888,2023-09-04 12:01:54.404063,2023-09-04 12:01:54.981756,0 days 00:00:00.577693,Leaky,ReLU,Leaky,,61,13,8.0,18.0,,0.008171039870771503,3,179,0.6976412143782215,0.0003337714911620246,123.40040568816356,COMPLETE
88,0.19280296564102173,2023-09-04 12:01:54.982046,2023-09-04 12:01:55.944749,0 days 00:00:00.962703,Leaky,ReLU,Leaky,,58,10,5.0,18.0,,0.005933346771258009,3,216,0.7463405595313755,0.00025394952092859286,96.21257106593397,COMPLETE
89,0.2005501091480255,2023-09-04 12:01:55.945057,2023-09-04 12:01:56.770227,0 days 00:00:00.825170,Leaky,ReLU,Leaky,Leaky,63,14,7.0,22.0,7.0,0.010099478038741195,4,194,0.6716200524722541,0.0005226671150268565,77.87977959974756,COMPLETE
90,0.21882446110248566,2023-09-04 12:01:56.770509,2023-09-04 12:01:59.254914,0 days 00:00:02.484405,Sigmoid,ReLU,Leaky,,52,7,10.0,17.0,,0.0050517288967638985,3,490,0.7194241757752124,0.00037289464191074464,123.35516651698521,COMPLETE
91,0.20717953145503998,2023-09-04 12:01:59.255199,2023-09-04 12:01:59.791808,0 days 00:00:00.536609,Leaky,ReLU,Leaky,,68,11,9.0,19.0,,0.00330993933999552,3,145,0.7965479559898548,0.00021061456598058686,123.11700069543087,COMPLETE
92,0.23467010259628296,2023-09-04 12:01:59.792398,2023-09-04 12:02:00.233816,0 days 00:00:00.441418,Leaky,ReLU,Leaky,,64,11,12.0,21.0,,0.006940757835092018,3,179,0.7690766601474388,0.0003097009023845697,99.26534356011285,COMPLETE
93,0.18158864974975586,2023-09-04 12:02:00.234103,2023-09-04 12:02:01.487212,0 days 00:00:01.253109,Leaky,ReLU,Leaky,,59,12,6.0,20.0,,0.00423338710629276,3,164,0.7567277616284275,0.000134132325586263,94.84551258830281,COMPLETE
