number,value,datetime_start,datetime_complete,duration,params_activation1,params_activation2,params_activation3,params_activation4,params_batch_size,params_fl1,params_fl2,params_fl3,params_fl4,params_learning_rate,params_n_layers,params_num_epochs,params_train_size,params_weight_decay,user_attrs_mre,state
284,0.19503921270370483,2023-09-04 11:52:39.996323,2023-09-04 11:52:40.381234,0 days 00:00:00.384911,Tanh,Leaky,ReLU,,83,23,18.0,16.0,,0.014576345080289477,3,142,0.7035115822909938,2.816801130652443e-05,76.30968017578125,COMPLETE
285,0.18963906168937683,2023-09-04 11:52:40.381554,2023-09-04 11:52:40.812217,0 days 00:00:00.430663,Tanh,Tanh,ReLU,,90,18,17.0,19.0,,0.01893441105670016,3,154,0.49528897650784853,1.88756579940859e-05,85.85787403340242,COMPLETE
286,0.18161927163600922,2023-09-04 11:52:40.812545,2023-09-04 11:52:41.348237,0 days 00:00:00.535692,Leaky,Leaky,ReLU,,85,23,18.0,18.0,,0.015428689492139113,3,172,0.6762408327608818,1.3647294901704309e-05,73.26885223388672,COMPLETE
287,0.16536182165145874,2023-09-04 11:52:41.348543,2023-09-04 11:52:42.007551,0 days 00:00:00.659008,Tanh,Leaky,ReLU,,86,13,15.0,20.0,,0.01069776633326233,3,133,0.7332534519286311,3.426008599399308e-05,72.94262500978866,COMPLETE
288,0.1880391538143158,2023-09-04 11:52:42.007861,2023-09-04 11:52:42.368572,0 days 00:00:00.360711,Tanh,Leaky,ReLU,,89,15,15.0,20.0,,0.007724999280125092,3,141,0.7302373202796645,3.221096121172693e-05,92.78125871930804,COMPLETE
289,0.3735351264476776,2023-09-04 11:52:42.368894,2023-09-04 11:52:43.289423,0 days 00:00:00.920529,ReLU,Leaky,ReLU,,87,11,16.0,20.0,,6.516427706796535e-05,3,119,0.4632789726971073,3.700248008131616e-05,113.42860803684266,COMPLETE
290,0.21814049780368805,2023-09-04 11:52:43.289725,2023-09-04 11:52:43.746486,0 days 00:00:00.456761,Tanh,Leaky,ReLU,,87,22,16.0,19.0,,0.010794971099808641,3,136,0.7984598031077403,0.00027298187313099247,99.59918559681286,COMPLETE
291,0.20353549718856812,2023-09-04 11:52:43.746796,2023-09-04 11:52:44.257260,0 days 00:00:00.510464,Tanh,Leaky,ReLU,,85,9,15.0,17.0,,0.01055831005105996,3,186,0.756799173295364,4.513415997027159e-05,111.32659383920523,COMPLETE
292,0.17994557321071625,2023-09-04 11:52:44.257593,2023-09-04 11:52:44.625942,0 days 00:00:00.368349,Tanh,Leaky,ReLU,,83,24,17.0,21.0,,0.01294128594753504,3,129,0.7069770557096123,1.0068927073713098e-05,91.23958560398647,COMPLETE
293,0.21742187440395355,2023-09-04 11:52:44.626272,2023-09-04 11:52:45.494616,0 days 00:00:00.868344,Tanh,Tanh,ReLU,,16,23,16.0,18.0,,0.004666508054684709,3,160,0.2987036731713889,0.0001785948160197274,82.6680906544561,COMPLETE
294,0.178986057639122,2023-09-04 11:52:45.494931,2023-09-04 11:52:46.279654,0 days 00:00:00.784723,Tanh,Leaky,ReLU,,86,22,17.0,22.0,,0.01671906744169929,3,148,0.7724286004070801,0.001993870424390205,100.28008664449057,COMPLETE
295,0.17084766924381256,2023-09-04 11:52:46.279967,2023-09-04 11:52:46.770636,0 days 00:00:00.490669,Tanh,Leaky,ReLU,,89,22,19.0,22.0,,0.018320103319296076,3,178,0.77917170327385,0.00157121389218121,90.43092923550992,COMPLETE
296,0.2284935861825943,2023-09-04 11:52:46.770936,2023-09-04 11:52:47.055952,0 days 00:00:00.285016,Tanh,Leaky,Sigmoid,,87,22,14.0,24.0,,0.021248590917502325,3,177,0.35987183142400453,0.0014419108150413972,81.05284004211425,COMPLETE
297,0.24473659694194794,2023-09-04 11:52:47.056272,2023-09-04 11:52:47.552897,0 days 00:00:00.496625,Tanh,,,,91,4,,,,0.025977478694835295,1,169,0.7459624982191413,3.659418480773379e-05,83.83316789593613,COMPLETE
298,0.17148923873901367,2023-09-04 11:52:47.553207,2023-09-04 11:52:47.992131,0 days 00:00:00.438924,Tanh,Leaky,ReLU,,89,21,19.0,22.0,,0.01992483262727908,3,158,0.7782306483262574,2.495460536941195e-05,84.02929456306227,COMPLETE
299,0.17159952223300934,2023-09-04 11:52:47.992446,2023-09-04 11:52:48.518703,0 days 00:00:00.526257,Tanh,Leaky,ReLU,,89,21,19.0,22.0,,0.017629042842322418,3,152,0.7954850250686947,0.0009160296089381261,121.31785426995692,COMPLETE
300,0.19673685729503632,2023-09-04 11:52:48.519010,2023-09-04 11:52:48.877321,0 days 00:00:00.358311,Tanh,Leaky,ReLU,,93,21,20.0,23.0,,0.004105064308915832,3,163,0.7794293160369166,0.0013343342935216193,86.67871037235966,COMPLETE
301,0.1805972307920456,2023-09-04 11:52:48.877628,2023-09-04 11:52:49.497299,0 days 00:00:00.619671,Tanh,Leaky,ReLU,,92,21,19.0,3.0,,0.018455304580677123,3,154,0.7980584466049695,0.0007568644360653357,90.23030503590901,COMPLETE
302,0.22563809156417847,2023-09-04 11:52:49.497607,2023-09-04 11:52:50.351293,0 days 00:00:00.853686,Tanh,Leaky,ReLU,,88,20,19.0,22.0,,0.02815971899839526,3,159,0.7693719490265131,0.0018280295803214115,133.15181164031333,COMPLETE
303,0.18763630092144012,2023-09-04 11:52:50.351613,2023-09-04 11:52:51.745267,0 days 00:00:01.393654,ReLU,Leaky,ReLU,,90,19,19.0,21.0,,0.006276430226021945,3,144,0.7954859112638063,2.3816140394982654e-05,82.1846227231233,COMPLETE
304,0.2563111186027527,2023-09-04 11:52:51.745813,2023-09-04 11:52:52.628774,0 days 00:00:00.882961,Tanh,Leaky,ReLU,,95,20,20.0,22.0,,0.03970093573940399,3,186,0.7480824422888765,0.014533158821449881,90.64733034021714,COMPLETE
305,0.17968100309371948,2023-09-04 11:52:52.629081,2023-09-04 11:52:53.026884,0 days 00:00:00.397803,Tanh,Leaky,ReLU,,91,21,20.0,23.0,,0.02329782455432404,3,177,0.799914238833021,0.0009360814743025136,96.40398597717285,COMPLETE
306,0.21688543260097504,2023-09-04 11:52:53.027199,2023-09-04 11:52:54.449170,0 days 00:00:01.421971,Tanh,Leaky,ReLU,,88,12,19.0,22.0,,0.0009323164638886754,3,148,0.7395200553514363,0.0033605097012527883,98.69316813151042,COMPLETE
307,0.22363457083702087,2023-09-04 11:52:54.449465,2023-09-04 11:52:54.703774,0 days 00:00:00.254309,Tanh,Leaky,ReLU,,85,22,19.0,23.0,,0.01719997013806112,3,154,0.2700369185238542,0.0018955771050675587,90.97779642740885,COMPLETE
308,0.21035072207450867,2023-09-04 11:52:54.704080,2023-09-04 11:52:54.941047,0 days 00:00:00.236967,Leaky,Leaky,ReLU,,89,21,21.0,21.0,,0.04998234498156633,3,165,0.4300170994093568,2.7622562370959524e-05,372.6577164786203,COMPLETE
309,0.15466158092021942,2023-09-04 11:52:54.941353,2023-09-04 11:52:55.498887,0 days 00:00:00.557534,Tanh,Leaky,ReLU,,89,13,19.0,22.0,,0.009119866727921783,3,136,0.7521038233110577,2.1105377536286656e-05,85.04441638325535,COMPLETE
310,0.18964192271232605,2023-09-04 11:52:55.499202,2023-09-04 11:52:56.121539,0 days 00:00:00.622337,Tanh,Leaky,ReLU,,90,13,19.0,22.0,,0.006680758844964432,3,151,0.7677386433381607,0.00043343111091986104,120.13863134384155,COMPLETE
311,0.1993473470211029,2023-09-04 11:52:56.121839,2023-09-04 11:52:56.778851,0 days 00:00:00.657012,Tanh,Leaky,ReLU,,93,14,19.0,20.0,,0.010422174907343257,3,133,0.7372433228714059,0.00045250276102670224,104.60962330211292,COMPLETE
312,0.20365667343139648,2023-09-04 11:52:56.779181,2023-09-04 11:52:57.206853,0 days 00:00:00.427672,Tanh,Leaky,ReLU,,89,13,18.0,23.0,,0.008762558299449929,3,132,0.7713126980383253,0.002800910392426142,85.68684697151184,COMPLETE
313,0.19733396172523499,2023-09-04 11:52:57.207192,2023-09-04 11:52:58.427266,0 days 00:00:01.220074,Tanh,Tanh,ReLU,,88,14,18.0,21.0,,0.008993166809560672,3,202,0.7340952384602506,0.000623098867043416,82.0700972366333,COMPLETE
314,0.2481747418642044,2023-09-04 11:52:58.427604,2023-09-04 11:52:58.740743,0 days 00:00:00.313139,Tanh,Leaky,ReLU,,86,13,19.0,24.0,,0.005361542696989927,3,138,0.7686377376521148,0.007799156700447842,110.63687549937855,COMPLETE
315,0.20251984894275665,2023-09-04 11:52:58.741060,2023-09-04 11:52:59.327422,0 days 00:00:00.586362,Tanh,Leaky,ReLU,,90,7,18.0,22.0,,0.012093147561645147,3,145,0.692804330879983,0.0010924569728263892,104.64691615104675,COMPLETE
316,0.18962740898132324,2023-09-04 11:52:59.327971,2023-09-04 11:52:59.995202,0 days 00:00:00.667231,Tanh,Leaky,Leaky,,84,22,19.0,23.0,,0.029717188680734176,3,224,0.7990783496841596,2.0522232500372288e-05,101.53008670806885,COMPLETE
317,0.2142687737941742,2023-09-04 11:52:59.995517,2023-09-04 11:53:00.427528,0 days 00:00:00.432011,ReLU,Leaky,ReLU,,87,12,16.0,21.0,,0.03921847387325363,3,141,0.7243646332570164,2.2991013651673413e-05,81.02885197230748,COMPLETE
318,0.2944902181625366,2023-09-04 11:53:00.427867,2023-09-04 11:53:00.881145,0 days 00:00:00.453278,Tanh,Leaky,ReLU,,96,21,17.0,1.0,,0.002913754671783757,3,169,0.20800629146024177,3.055073013033889e-05,133.47653166974177,COMPLETE
319,0.20509354770183563,2023-09-04 11:53:00.881487,2023-09-04 11:53:01.158592,0 days 00:00:00.277105,Tanh,Leaky,Leaky,,83,22,18.0,17.0,,0.007531121840728631,3,125,0.34824757602959505,1.7778353730809212e-05,103.46517690022786,COMPLETE
320,0.1718837022781372,2023-09-04 11:53:01.158916,2023-09-04 11:53:01.669705,0 days 00:00:00.510789,Tanh,Leaky,ReLU,,89,23,20.0,19.0,,0.02449274155929667,3,157,0.7519035521862942,0.001690528896552191,120.04518205691606,COMPLETE
321,0.21205826103687286,2023-09-04 11:53:01.670024,2023-09-04 11:53:02.121114,0 days 00:00:00.451090,Tanh,Leaky,ReLU,,90,17,20.0,20.0,,0.022919509932442593,3,154,0.40202099879901004,0.0014659295067457917,130.78291796074538,COMPLETE
322,0.22164639830589294,2023-09-04 11:53:02.121424,2023-09-04 11:53:02.364357,0 days 00:00:00.242933,Tanh,Leaky,ReLU,,86,22,21.0,19.0,,0.016669076792749846,3,162,0.384781621084313,0.0021225398922766537,133.1511744837607,COMPLETE
323,0.23001672327518463,2023-09-04 11:53:02.364664,2023-09-04 11:53:02.789955,0 days 00:00:00.425291,Tanh,Leaky,Leaky,,92,22,20.0,22.0,,0.02015128385727235,3,175,0.7552748266959235,0.0015910654852661365,99.73350039395419,COMPLETE
324,0.20789098739624023,2023-09-04 11:53:02.790262,2023-09-04 11:53:03.115235,0 days 00:00:00.324973,Tanh,Leaky,ReLU,,89,6,20.0,19.0,,0.06434494015175131,3,165,0.7248404228734625,0.0026082337090313035,141.51092254638672,COMPLETE
325,0.19666758179664612,2023-09-04 11:53:03.115552,2023-09-04 11:53:04.018191,0 days 00:00:00.902639,Tanh,Leaky,ReLU,Tanh,88,2,19.0,2.0,10.0,0.013940417664539163,4,195,0.7677600341850583,0.0010466291469415495,76.87565053304037,COMPLETE
326,0.18721449375152588,2023-09-04 11:53:04.018744,2023-09-04 11:53:07.231904,0 days 00:00:03.213160,Tanh,Leaky,Sigmoid,,85,23,15.0,20.0,,0.002136254532888119,3,397,0.7474167404038532,0.00028232746524474087,83.76853042773986,COMPLETE
327,0.20805613696575165,2023-09-04 11:53:07.232433,2023-09-04 11:53:08.284371,0 days 00:00:01.051938,ReLU,Tanh,ReLU,,82,13,7.0,19.0,,0.02463639954698195,3,159,0.7088512784637,0.0017681826153659263,92.49048667118467,COMPLETE
328,0.24177628755569458,2023-09-04 11:53:08.284916,2023-09-04 11:53:09.470876,0 days 00:00:01.185960,Tanh,Leaky,Leaky,,91,23,19.0,21.0,,0.011369310364096375,3,94,0.7690605635793498,0.0023571507395048928,84.63849067687988,COMPLETE
329,0.219357430934906,2023-09-04 11:53:09.471411,2023-09-04 11:53:14.527781,0 days 00:00:05.056370,Tanh,Leaky,ReLU,,14,22,20.0,24.0,,0.03475336839213484,3,111,0.682176607541583,0.003136204667493135,180.5229310428395,COMPLETE
330,0.25259295105934143,2023-09-04 11:53:14.528330,2023-09-04 11:53:15.384330,0 days 00:00:00.856000,Leaky,Leaky,Tanh,,87,21,8.0,14.0,,0.091771957299375,3,149,0.7337687929011074,0.0021464212306820194,105.7340144281802,COMPLETE
331,0.22062434256076813,2023-09-04 11:53:15.384863,2023-09-04 11:53:16.418437,0 days 00:00:01.033574,Tanh,Leaky,ReLU,,85,23,16.0,8.0,,0.018319732410817954,3,134,0.7951165898144795,0.0011916039553602337,164.37430836604193,COMPLETE
332,0.185078427195549,2023-09-04 11:53:16.418983,2023-09-04 11:53:22.694269,0 days 00:00:06.275286,Tanh,Leaky,ReLU,,93,22,17.0,7.0,,0.0006284907496811669,3,379,0.705962218234993,0.0012758012406686814,135.17490943908692,COMPLETE
333,0.22488322854042053,2023-09-04 11:53:22.694797,2023-09-04 11:53:23.489990,0 days 00:00:00.795193,Tanh,Leaky,Leaky,,17,23,19.0,22.0,,0.025344268943004195,3,150,0.1682267246067417,0.00023179846976728287,204.38475481669107,COMPLETE
334,0.22308777272701263,2023-09-04 11:53:23.490522,2023-09-04 11:53:24.416711,0 days 00:00:00.926189,Tanh,,,,89,11,,,,0.007949315910596529,1,158,0.3694831212417302,1.5230641266032925e-05,198.1776688266808,COMPLETE
335,0.1842048168182373,2023-09-04 11:53:24.417225,2023-09-04 11:53:25.516279,0 days 00:00:01.099054,Tanh,Leaky,ReLU,,84,14,20.0,20.0,,0.01488683205373696,3,269,0.7486148283725155,0.0017012286631248852,124.97331527183796,COMPLETE
336,0.18266412615776062,2023-09-04 11:53:25.516825,2023-09-04 11:53:26.559531,0 days 00:00:01.042706,Tanh,Leaky,Tanh,,86,20,18.0,19.0,,0.04472155259713696,3,173,0.7992765758819328,0.000517935573639495,96.38130657489484,COMPLETE
337,0.2005564421415329,2023-09-04 11:53:26.560083,2023-09-04 11:53:27.394765,0 days 00:00:00.834682,Tanh,Tanh,ReLU,,82,21,3.0,15.0,,0.054469149099132814,3,249,0.4173910674259583,3.378838913187741e-05,84.59516163876182,COMPLETE
338,0.1817917674779892,2023-09-04 11:53:27.395299,2023-09-04 11:53:29.322114,0 days 00:00:01.926815,Tanh,Leaky,ReLU,,88,22,9.0,18.0,,0.009584685163278478,3,102,0.6822539966684539,0.0016324668636917095,79.20737573655985,COMPLETE
339,0.21968811750411987,2023-09-04 11:53:29.322670,2023-09-04 11:53:31.352993,0 days 00:00:02.030323,ReLU,Leaky,ReLU,,22,23,16.0,12.0,,0.02052695991067987,3,138,0.7246710827290517,0.0050695240959032235,924.930078125,COMPLETE
340,0.26902538537979126,2023-09-04 11:53:31.353538,2023-09-04 11:53:31.782196,0 days 00:00:00.428658,Tanh,Leaky,Tanh,,91,22,7.0,6.0,,0.005779151106311932,3,389,0.11111051134526628,0.0008422289917526371,113.03419775711863,COMPLETE
341,0.1795707643032074,2023-09-04 11:53:31.782734,2023-09-04 11:53:34.728151,0 days 00:00:02.945417,Sigmoid,Leaky,Leaky,,41,23,17.0,4.0,,0.028460977929250345,3,375,0.7683877754600901,2.752636264668859e-05,109.36651903517703,COMPLETE
342,0.20446443557739258,2023-09-04 11:53:34.728686,2023-09-04 11:53:38.047869,0 days 00:00:03.319183,Tanh,Leaky,ReLU,,24,23,17.0,21.0,,0.001341627734484625,3,452,0.3329115679395508,1.9769260241521644e-05,133.40615162096526,COMPLETE
343,0.22698825597763062,2023-09-04 11:53:38.048424,2023-09-04 11:53:42.860534,0 days 00:00:04.812110,Tanh,Leaky,ReLU,,19,22,19.0,22.0,,0.013171529972104658,3,90,0.7457590319603563,3.6649814183382803e-05,77.69942533052884,COMPLETE
344,0.18810604512691498,2023-09-04 11:53:42.861083,2023-09-04 11:53:45.255813,0 days 00:00:02.394730,Tanh,Leaky,Sigmoid,,87,15,6.0,5.0,,0.0035981365930484828,3,278,0.7096274298588657,0.00019395059645971262,133.0381211417062,COMPLETE
345,0.23552396893501282,2023-09-04 11:53:45.256350,2023-09-04 11:53:46.294240,0 days 00:00:01.037890,Tanh,Tanh,ReLU,,84,21,18.0,23.0,,0.01606678044516652,3,119,0.7986675755113549,0.003979639209472292,279.5213940429687,COMPLETE
346,0.20383603870868683,2023-09-04 11:53:46.294777,2023-09-04 11:53:47.412520,0 days 00:00:01.117743,Tanh,Leaky,Tanh,,89,19,20.0,20.0,,0.03528372219842771,3,129,0.5341440550879432,0.00017130508003303224,232.18642643519811,COMPLETE
347,0.19961558282375336,2023-09-04 11:53:47.413067,2023-09-04 11:54:03.365907,0 days 00:00:15.952840,Sigmoid,Leaky,Leaky,,13,12,14.0,8.0,,0.001842815122201067,3,148,0.49336866158195214,1.5955349681966426e-05,131.2200492137187,COMPLETE
348,0.17396597564220428,2023-09-04 11:54:03.366458,2023-09-04 11:54:04.373652,0 days 00:00:01.007194,Tanh,Leaky,ReLU,,82,23,21.0,19.0,,0.023095957614528987,3,181,0.7670436928945501,1.2354362920307703e-05,81.0804458618164,COMPLETE
349,0.23205187916755676,2023-09-04 11:54:04.374191,2023-09-04 11:54:04.816980,0 days 00:00:00.442789,Tanh,Leaky,ReLU,,81,23,21.0,19.0,,0.024613983828394113,3,184,0.29806329515031205,1.1541532158144289e-05,121.84169736115828,COMPLETE
350,0.2156810760498047,2023-09-04 11:54:04.817526,2023-09-04 11:54:05.481732,0 days 00:00:00.664206,Tanh,Leaky,ReLU,,83,10,20.0,19.0,,0.01969022948585088,3,167,0.2443598161544123,0.0003633248590868128,93.26115848707116,COMPLETE
351,0.17596594989299774,2023-09-04 11:54:05.482276,2023-09-04 11:54:07.032532,0 days 00:00:01.550256,Tanh,Leaky,ReLU,,82,23,15.0,20.0,,0.012027485027930239,3,157,0.7655014067056537,1.2331702552760269e-05,70.7928189277649,COMPLETE
352,0.1655867099761963,2023-09-04 11:54:07.033073,2023-09-04 11:54:08.851581,0 days 00:00:01.818508,Tanh,Leaky,ReLU,,82,23,22.0,20.0,,0.010536787530880996,3,160,0.7711509411201898,1.4902035282612238e-05,111.24423704756067,COMPLETE
353,0.1453886479139328,2023-09-04 11:54:08.852142,2023-09-04 11:54:11.264380,0 days 00:00:02.412238,Tanh,Leaky,ReLU,,85,23,23.0,21.0,,0.009953406182580995,3,175,0.7997323771135021,1.8085969356842615e-05,87.36953944544638,COMPLETE
354,0.17595060169696808,2023-09-04 11:54:11.264918,2023-09-04 11:54:12.759026,0 days 00:00:01.494108,Tanh,Leaky,ReLU,,85,23,21.0,21.0,,0.007958464176716215,3,165,0.772640355605061,1.4661179033963613e-05,72.13734484941531,COMPLETE
355,0.20328593254089355,2023-09-04 11:54:12.759579,2023-09-04 11:54:13.810452,0 days 00:00:01.050873,Tanh,Leaky,ReLU,,86,16,21.0,20.0,,0.009824245126955674,3,183,0.7996524089599581,1.7636456229634372e-05,72.34272017845741,COMPLETE
356,0.19731706380844116,2023-09-04 11:54:13.810996,2023-09-04 11:54:14.620540,0 days 00:00:00.809544,Tanh,Leaky,ReLU,,84,23,24.0,21.0,,0.010437493302888397,3,166,0.4494773828337526,1.3429850304711482e-05,70.51924780643347,COMPLETE
357,0.22048653662204742,2023-09-04 11:54:14.621086,2023-09-04 11:54:15.273779,0 days 00:00:00.652693,Tanh,Leaky,ReLU,,87,23,23.0,21.0,,0.008780729917256832,3,173,0.31580877664939006,1.7664254360855064e-05,76.54520777652138,COMPLETE
358,0.20685048401355743,2023-09-04 11:54:15.274327,2023-09-04 11:54:16.611371,0 days 00:00:01.337044,Tanh,Leaky,ReLU,,83,23,22.0,22.0,,0.006323950648896906,3,181,0.7451492703824631,2.0956987428234217e-05,186.68397870744977,COMPLETE
359,0.22007495164871216,2023-09-04 11:54:16.611923,2023-09-04 11:54:17.298107,0 days 00:00:00.686184,Tanh,Leaky,ReLU,,90,23,23.0,18.0,,0.013051514467692442,3,190,0.7673270714049729,1.2010838993938841e-05,779.7793255974265,COMPLETE
360,0.20933665335178375,2023-09-04 11:54:17.298660,2023-09-04 11:54:18.292648,0 days 00:00:00.993988,Tanh,Leaky,ReLU,Tanh,86,24,24.0,20.0,1.0,0.011161530386952083,4,179,0.7352558711209074,1.568184678316331e-05,81.9189743373705,COMPLETE
361,0.20063164830207825,2023-09-04 11:54:18.293205,2023-09-04 11:54:20.068362,0 days 00:00:01.775157,ReLU,Leaky,ReLU,,88,23,22.0,19.0,,0.004621098135552912,3,155,0.7721707359836497,1.998995414971859e-05,70.21972477689702,COMPLETE
362,0.1801282912492752,2023-09-04 11:54:20.068905,2023-09-04 11:54:21.944394,0 days 00:00:01.875489,Tanh,Leaky,ReLU,,84,22,22.0,20.0,,0.006936957222927316,3,208,0.7275065206897768,1.3768630746462589e-05,186.43507678692157,COMPLETE
363,0.23505647480487823,2023-09-04 11:54:21.944931,2023-09-04 11:54:22.870403,0 days 00:00:00.925472,Leaky,Leaky,ReLU,,81,24,23.0,21.0,,0.016263127192285294,3,196,0.77407530939171,0.04187098879848845,110.42270521684127,COMPLETE
364,0.19148363173007965,2023-09-04 11:54:22.871027,2023-09-04 11:54:25.464191,0 days 00:00:02.593164,Tanh,Leaky,ReLU,,16,23,23.0,19.0,,0.013639584655821104,3,170,0.7994656615204712,0.0001475945342136775,81.48703120304988,COMPLETE
365,0.18033158779144287,2023-09-04 11:54:25.464508,2023-09-04 11:54:25.906398,0 days 00:00:00.441890,Tanh,Leaky,Leaky,,93,24,22.0,22.0,,0.00866976793875616,3,145,0.7383256411739668,0.0024678546907453192,98.84210793631418,COMPLETE
366,0.23113074898719788,2023-09-04 11:54:25.906718,2023-09-04 11:54:28.269421,0 days 00:00:02.362703,Tanh,Leaky,ReLU,,34,22,1.0,20.0,,0.01052630395024517,3,159,0.7046998936294541,1.0246319564210905e-05,100.18958384195963,COMPLETE
367,0.21128220856189728,2023-09-04 11:54:28.269749,2023-09-04 11:54:29.235761,0 days 00:00:00.966012,Tanh,Leaky,ReLU,,91,23,21.0,23.0,,0.002807210101479772,3,79,0.7609571216133694,2.2808325653143384e-05,93.63121474416633,COMPLETE
368,0.2084675431251526,2023-09-04 11:54:29.236088,2023-09-04 11:54:29.539552,0 days 00:00:00.303464,Tanh,Leaky,ReLU,,85,24,22.0,20.0,,0.016655411592236512,3,143,0.417284102367216,0.0014880114880119514,102.88535084443934,COMPLETE
369,0.19509601593017578,2023-09-04 11:54:29.539925,2023-09-04 11:54:30.217417,0 days 00:00:00.677492,Tanh,Leaky,Leaky,,88,22,21.0,22.0,,0.004070222512177971,3,177,0.7191715884937003,0.0007473545795110533,86.61420723243997,COMPLETE
370,0.21849119663238525,2023-09-04 11:54:30.217733,2023-09-04 11:54:31.468436,0 days 00:00:01.250703,Tanh,Leaky,ReLU,,10,23,19.0,18.0,,0.012101480327577312,3,149,0.7471874812814073,0.0009681629625253656,95.47516497443704,COMPLETE
371,0.30177098512649536,2023-09-04 11:54:31.468896,2023-09-04 11:54:31.913371,0 days 00:00:00.444475,Tanh,Leaky,ReLU,,82,24,17.0,19.0,,0.07687083672555327,3,159,0.6884725891801935,0.03235361935269201,175.14617550011837,COMPLETE
372,0.23343339562416077,2023-09-04 11:54:31.913725,2023-09-04 11:54:33.329003,0 days 00:00:01.415278,Tanh,Leaky,ReLU,,86,22,22.0,21.0,,0.0002697797627409613,3,167,0.4765458798142546,0.0004110018285234033,93.52528701142637,COMPLETE
373,0.17035330832004547,2023-09-04 11:54:33.329311,2023-09-04 11:54:34.700812,0 days 00:00:01.371501,ReLU,Leaky,ReLU,,18,23,18.0,19.0,,0.0145155954317456,3,136,0.77574509075637,2.5732249576996043e-05,78.49613356590271,COMPLETE
374,0.17483165860176086,2023-09-04 11:54:34.701161,2023-09-04 11:54:38.934727,0 days 00:00:04.233566,ReLU,Leaky,ReLU,,18,23,18.0,7.0,,0.01432482681080855,3,136,0.7978124810665546,2.4995031615933982e-05,81.78751627604167,COMPLETE
375,0.2030024528503418,2023-09-04 11:54:38.935044,2023-09-04 11:54:40.776636,0 days 00:00:01.841592,ReLU,Tanh,Leaky,,17,24,19.0,19.0,,0.009328943125779652,3,127,0.7697669512428661,0.00021894996065894193,120.9295783269973,COMPLETE
376,0.16941051185131073,2023-09-04 11:54:40.776960,2023-09-04 11:54:42.172015,0 days 00:00:01.395055,ReLU,Leaky,Sigmoid,,15,23,20.0,18.0,,0.007693467703248836,3,145,0.7500043025866889,2.8936591799785953e-05,79.95059756574959,COMPLETE
377,0.2223663628101349,2023-09-04 11:54:42.172338,2023-09-04 11:54:42.655108,0 days 00:00:00.482770,ReLU,Leaky,Sigmoid,,16,23,20.0,18.0,,0.00525713410005642,3,141,0.2800799557651824,3.139658659433309e-05,100.86615692138672,COMPLETE
