number,value,datetime_start,datetime_complete,duration,params_activation1,params_activation2,params_activation3,params_activation4,params_batch_size,params_fl1,params_fl2,params_fl3,params_fl4,params_learning_rate,params_n_layers,params_num_epochs,params_train_size,params_weight_decay,user_attrs_mre,state
485,0.16373705863952637,2023-09-04 12:05:46.900216,2023-09-04 12:05:47.867877,0 days 00:00:00.967661,ReLU,Tanh,,,86,20,24.0,,,0.006338549918571596,2,500,0.735682105244805,9.261254408100814e-05,141.1745347764757,COMPLETE
486,0.26768243312835693,2023-09-04 12:05:47.868198,2023-09-04 12:05:49.286091,0 days 00:00:01.417893,ReLU,ReLU,,,84,17,16.0,,,0.001202179701438377,2,454,0.5697991402626105,0.02505882337605645,174.7034229410106,COMPLETE
487,0.18477663397789001,2023-09-04 12:05:49.286422,2023-09-04 12:05:53.530811,0 days 00:00:04.244389,ReLU,Tanh,,,81,18,21.0,,,0.0005265812502114487,2,367,0.7982106886093292,0.00023674302918258398,107.43409658322867,COMPLETE
488,0.34974539279937744,2023-09-04 12:05:53.531128,2023-09-04 12:05:53.641498,0 days 00:00:00.110370,Tanh,ReLU,,,94,19,15.0,,,0.03488026869490489,2,446,0.1532880185552577,0.0005011783211691689,205.66933059692383,COMPLETE
489,0.20040248334407806,2023-09-04 12:05:53.641899,2023-09-04 12:05:54.856769,0 days 00:00:01.214870,ReLU,Sigmoid,,,74,16,13.0,,,0.002392958708765248,2,476,0.7050221107415081,0.0008734393228242405,89.71122169494629,COMPLETE
490,0.20364871621131897,2023-09-04 12:05:54.857089,2023-09-04 12:05:56.674857,0 days 00:00:01.817768,ReLU,Tanh,Leaky,,79,17,22.0,1.0,,0.0008881478623512624,3,435,0.6560695680354773,0.0006409662160025136,162.8298687724947,COMPLETE
491,0.22843122482299805,2023-09-04 12:05:56.675214,2023-09-04 12:05:56.839858,0 days 00:00:00.164644,Leaky,ReLU,,,96,15,14.0,,,0.018434951117117997,2,417,0.23091022165586678,3.526062368205637e-05,73.25382325455949,COMPLETE
492,0.35712653398513794,2023-09-04 12:05:56.840197,2023-09-04 12:05:57.723979,0 days 00:00:00.883782,ReLU,Tanh,,,56,21,24.0,,,0.013109308007556403,2,59,0.7657109740206465,0.04063078769409865,101.65322151830641,COMPLETE
493,0.17390139400959015,2023-09-04 12:05:57.724299,2023-09-04 12:05:58.411036,0 days 00:00:00.686737,ReLU,ReLU,,,87,18,22.0,,,0.007904385318159946,2,181,0.7395018793316537,0.00019108001119854122,78.29212533859979,COMPLETE
494,0.1832035332918167,2023-09-04 12:05:58.411385,2023-09-04 12:05:58.666553,0 days 00:00:00.255168,ReLU,Leaky,,,82,16,15.0,,,0.011513292507088393,2,485,0.23497230232144145,0.00040679258872004207,104.84267612925747,COMPLETE
495,0.19359610974788666,2023-09-04 12:05:58.666947,2023-09-04 12:05:59.346319,0 days 00:00:00.679372,ReLU,Tanh,,,91,22,13.0,,,0.02700300340770796,2,466,0.6822793990372431,0.0010317834400990703,90.06361042369495,COMPLETE
496,0.2960854768753052,2023-09-04 12:05:59.346859,2023-09-04 12:06:01.359837,0 days 00:00:02.012978,ReLU,,,,85,17,,,,0.0013719242557725083,1,426,0.7685011659690586,0.00837017500044444,100.21944916923091,COMPLETE
497,0.28849273920059204,2023-09-04 12:06:01.360157,2023-09-04 12:06:01.835575,0 days 00:00:00.475418,Sigmoid,ReLU,,,72,14,21.0,,,0.016064938318345635,2,459,0.4807268975167988,1.821106961410281e-05,226.0154660782724,COMPLETE
498,0.20433738827705383,2023-09-04 12:06:01.835912,2023-09-04 12:06:03.453011,0 days 00:00:01.617099,ReLU,Tanh,,,77,20,16.0,,,0.001882710206645123,2,160,0.5963411533535478,0.0001451841173487303,3502.5769912719725,COMPLETE
499,0.17867685854434967,2023-09-04 12:06:03.453345,2023-09-04 12:06:04.260019,0 days 00:00:00.806674,Leaky,ReLU,,,89,16,23.0,,,0.009290306428228678,2,449,0.7998833302122461,2.9760307383050125e-05,78.40881956869097,COMPLETE
