number,value,datetime_start,datetime_complete,duration,params_activation1,params_activation2,params_activation3,params_activation4,params_batch_size,params_fl1,params_fl2,params_fl3,params_fl4,params_learning_rate,params_n_layers,params_num_epochs,params_train_size,params_weight_decay,user_attrs_mre,state
189,0.1930416226387024,2023-09-04 11:50:51.559764,2023-09-04 11:50:52.594520,0 days 00:00:01.034756,Tanh,Sigmoid,,,43,21,5.0,,,0.014838823327017601,2,343,0.5543258782556733,0.000115427365390321,86.3686008217894,COMPLETE
190,0.36411339044570923,2023-09-04 11:50:52.594810,2023-09-04 11:50:53.197101,0 days 00:00:00.602291,ReLU,ReLU,Tanh,ReLU,15,24,20.0,17.0,19.0,0.09557913415214803,4,60,0.7065487510068929,1.9438577544676904e-05,139.00445209849966,COMPLETE
191,0.1899770051240921,2023-09-04 11:50:53.197437,2023-09-04 11:50:53.597223,0 days 00:00:00.399786,Tanh,Sigmoid,,,79,22,12.0,,,0.01776289447771077,2,353,0.612419863031948,6.418368601953272e-05,74.56295736212479,COMPLETE
192,0.17843979597091675,2023-09-04 11:50:53.597575,2023-09-04 11:50:54.288546,0 days 00:00:00.690971,Tanh,Sigmoid,,,76,22,12.0,,,0.02135688163157945,2,358,0.6521704152256351,4.8250606311285284e-05,81.28017664667385,COMPLETE
193,0.20438143610954285,2023-09-04 11:50:54.288852,2023-09-04 11:50:55.081637,0 days 00:00:00.792785,Tanh,Sigmoid,,,74,21,12.0,,,0.022064491868987846,2,360,0.6540808715742704,5.099346057843673e-05,83.7363876543547,COMPLETE
194,0.17592677474021912,2023-09-04 11:50:55.081962,2023-09-04 11:50:55.511154,0 days 00:00:00.429192,Tanh,Sigmoid,,,77,12,6.0,,,0.037016602131071386,2,365,0.6389477088145712,4.0455147981376574e-05,117.11035369163336,COMPLETE
195,0.18587929010391235,2023-09-04 11:50:55.511441,2023-09-04 11:50:55.865702,0 days 00:00:00.354261,Tanh,Sigmoid,,,72,24,8.0,,,0.03535886661684415,2,373,0.6376793608964533,3.834586292362918e-05,114.04762637976444,COMPLETE
196,0.21196316182613373,2023-09-04 11:50:55.865996,2023-09-04 11:50:56.126203,0 days 00:00:00.260207,Tanh,Sigmoid,,,76,13,10.0,,,0.025655123344047865,2,360,0.5945719890166996,3.300507620224621e-05,125.75516510009766,COMPLETE
197,0.19385701417922974,2023-09-04 11:50:56.126494,2023-09-04 11:50:56.579594,0 days 00:00:00.453100,Tanh,Leaky,,,70,12,11.0,,,0.031699477506231054,2,390,0.42459683597776593,4.2923345027262486e-05,85.64184860956101,COMPLETE
198,0.16111810505390167,2023-09-04 11:50:56.579887,2023-09-04 11:50:57.258607,0 days 00:00:00.678720,Tanh,Tanh,,,80,23,17.0,,,0.020746123389944054,2,369,0.686142062149244,1.4898234567245595e-05,76.85806016188401,COMPLETE
199,0.197052463889122,2023-09-04 11:50:57.258900,2023-09-04 11:50:57.934389,0 days 00:00:00.675489,Tanh,Tanh,,,80,12,15.0,,,0.013478932189402697,2,370,0.6707630635482069,2.509113951572975e-05,110.5777151444379,COMPLETE
200,0.21598440408706665,2023-09-04 11:50:57.934709,2023-09-04 11:50:58.215586,0 days 00:00:00.280877,Tanh,Tanh,,,82,3,16.0,,,0.02004292799855248,2,367,0.6935497884922445,2.863820741895234e-05,149.3815948486328,COMPLETE
201,0.19481562077999115,2023-09-04 11:50:58.215883,2023-09-04 11:50:58.613308,0 days 00:00:00.397425,Tanh,Tanh,,,78,12,17.0,,,0.024120807318640157,2,401,0.6363722496448193,1.3193880198399271e-05,110.80228521885016,COMPLETE
202,0.1835639625787735,2023-09-04 11:50:58.613610,2023-09-04 11:50:59.053853,0 days 00:00:00.440243,Tanh,Tanh,,,76,13,17.0,,,0.04016885158994936,2,348,0.6629382412989815,1.5730386353924527e-05,93.13039143880208,COMPLETE
203,0.19674821197986603,2023-09-04 11:50:59.054144,2023-09-04 11:50:59.451203,0 days 00:00:00.397059,Tanh,Sigmoid,,,74,23,18.0,,,0.028864938444155698,2,376,0.614981403860483,1.0061847477484325e-05,91.02738815698868,COMPLETE
204,0.20806074142456055,2023-09-04 11:50:59.451499,2023-09-04 11:50:59.871279,0 days 00:00:00.419780,Tanh,Tanh,,,81,11,17.0,,,0.016656329842147228,2,334,0.7339256381949057,2.1860640411730683e-05,77.88212113631398,COMPLETE
205,0.1853064000606537,2023-09-04 11:50:59.871589,2023-09-04 11:51:00.160438,0 days 00:00:00.288849,Tanh,Leaky,,,85,11,20.0,,,0.023242779067972875,2,381,0.5878785429346887,1.5013241291869357e-05,110.15475344657898,COMPLETE
206,0.20583057403564453,2023-09-04 11:51:00.160725,2023-09-04 11:51:00.556938,0 days 00:00:00.396213,Tanh,Sigmoid,,,51,23,13.0,,,0.03582476765895352,2,354,0.7708889101995569,4.852314097385816e-05,106.29567443847657,COMPLETE
207,0.2286372184753418,2023-09-04 11:51:00.557237,2023-09-04 11:51:00.989448,0 days 00:00:00.432211,Tanh,Leaky,,,77,10,6.0,,,0.00811327378745039,2,70,0.6915325457749237,3.159849067040301e-05,219.92499809265138,COMPLETE
208,0.1862754374742508,2023-09-04 11:51:00.989756,2023-09-04 11:51:01.730978,0 days 00:00:00.741222,Tanh,Sigmoid,,,73,22,11.0,,,0.020040935401269822,2,364,0.6512107830023552,1.798584084003808e-05,88.89674237748267,COMPLETE
209,0.1425512433052063,2023-09-04 11:51:01.731270,2023-09-04 11:51:02.198436,0 days 00:00:00.467166,Tanh,Leaky,,,80,24,19.0,,,0.026271297441800567,2,83,0.7977471981820574,3.7643102972578556e-05,71.39181759482936,COMPLETE
210,0.199797123670578,2023-09-04 11:51:02.198721,2023-09-04 11:51:02.712873,0 days 00:00:00.514152,Tanh,Leaky,,,79,23,19.0,,,0.02803371853435156,2,96,0.7906438136245219,3.8444866665827896e-05,143.1710016159784,COMPLETE
211,0.18953418731689453,2023-09-04 11:51:02.713170,2023-09-04 11:51:03.208771,0 days 00:00:00.495601,Tanh,Leaky,,,84,24,18.0,,,0.019767754562045447,2,86,0.799155437546705,5.7452659659049185e-05,95.08648272258479,COMPLETE
212,0.20581497251987457,2023-09-04 11:51:03.209073,2023-09-04 11:51:03.580217,0 days 00:00:00.371144,Tanh,Leaky,,,81,24,19.0,,,0.015251511671147612,2,80,0.745674069168003,0.0029148375171238927,129.1334952077558,COMPLETE
213,0.19101779162883759,2023-09-04 11:51:03.580502,2023-09-04 11:51:04.036764,0 days 00:00:00.456262,Tanh,Leaky,,,83,24,18.0,,,0.027151440222643326,2,98,0.7153323211562187,4.3572154499529105e-05,294.24133375214365,COMPLETE
214,0.19602565467357635,2023-09-04 11:51:04.037054,2023-09-04 11:51:04.319765,0 days 00:00:00.282711,Tanh,Leaky,,,75,23,19.0,,,0.03417616543239476,2,340,0.7525324472577011,3.380487142659745e-05,100.29526346380061,COMPLETE
215,0.2115914672613144,2023-09-04 11:51:04.320067,2023-09-04 11:51:04.644471,0 days 00:00:00.324404,Leaky,Sigmoid,,,79,24,21.0,,,0.02239679064857816,2,71,0.6252691902367117,1.1644280914419261e-05,4980.1875,COMPLETE
216,0.1999076008796692,2023-09-04 11:51:04.644781,2023-09-04 11:51:05.002726,0 days 00:00:00.357945,Tanh,Leaky,,,77,22,5.0,,,0.04359492352732434,2,178,0.6706731334727898,2.527248056932854e-05,121.83712421764027,COMPLETE
217,0.22272038459777832,2023-09-04 11:51:05.003025,2023-09-04 11:51:05.322216,0 days 00:00:00.319191,Tanh,Sigmoid,ReLU,,80,23,17.0,19.0,,0.031049102236926234,3,491,0.39096082064969556,0.0002833571935374147,166.21524326975754,COMPLETE
218,0.2780429720878601,2023-09-04 11:51:05.322523,2023-09-04 11:51:05.474743,0 days 00:00:00.152220,Tanh,ReLU,Tanh,,86,22,12.0,6.0,,0.012444938837709271,3,358,0.12044390215003187,4.9978308556201946e-05,91.30536959721492,COMPLETE
219,0.2325906604528427,2023-09-04 11:51:05.475044,2023-09-04 11:51:05.718116,0 days 00:00:00.243072,Tanh,Leaky,,,23,24,18.0,,,0.01825629849376448,2,272,0.18434470325279323,9.84016921071929e-05,234.9425536124937,COMPLETE
220,0.21099650859832764,2023-09-04 11:51:05.718403,2023-09-04 11:51:06.156345,0 days 00:00:00.437942,Tanh,Sigmoid,Tanh,,78,24,20.0,3.0,,0.02509224682669437,3,84,0.5385012801377024,3.692233647653663e-05,242.24189168756658,COMPLETE
221,0.19477814435958862,2023-09-04 11:51:06.156644,2023-09-04 11:51:07.615297,0 days 00:00:01.458653,Sigmoid,Sigmoid,Leaky,,19,22,5.0,13.0,,0.06713019474637365,3,300,0.7174172345799797,5.689982416926873e-05,171.84515342712402,COMPLETE
222,0.20961415767669678,2023-09-04 11:51:07.615607,2023-09-04 11:51:08.058065,0 days 00:00:00.442458,Sigmoid,Sigmoid,Leaky,,17,23,6.0,8.0,,0.0472603150063561,3,289,0.28906010741471627,4.555233324360993e-05,90.67502990722656,COMPLETE
223,0.31222113966941833,2023-09-04 11:51:08.058359,2023-09-04 11:51:08.823911,0 days 00:00:00.765552,Sigmoid,Sigmoid,ReLU,,21,21,4.0,16.0,,0.03905242067523725,3,310,0.7525447898720699,0.010984791272029873,121.41043635777065,COMPLETE
224,0.20764732360839844,2023-09-04 11:51:08.824217,2023-09-04 11:51:10.071492,0 days 00:00:01.247275,Sigmoid,Sigmoid,Tanh,,17,22,5.0,18.0,,0.05189452114283735,3,323,0.6886703722269872,6.489432818549623e-05,392.6521017551422,COMPLETE
225,0.21019425988197327,2023-09-04 11:51:10.071798,2023-09-04 11:51:10.961301,0 days 00:00:00.889503,Tanh,Sigmoid,Leaky,,72,23,19.0,5.0,,0.0305719005317686,3,366,0.7266716691814165,7.473054083235405e-05,125.9252218202103,COMPLETE
226,0.2253158688545227,2023-09-04 11:51:10.961800,2023-09-04 11:51:16.274143,0 days 00:00:05.312343,Sigmoid,Leaky,,,75,23,6.0,,,0.0032293460639517702,2,346,0.7740899879003726,4.125448467615802e-05,105.13218693793574,COMPLETE
227,0.20645761489868164,2023-09-04 11:51:16.274636,2023-09-04 11:51:19.296217,0 days 00:00:03.021581,Tanh,Sigmoid,ReLU,,20,22,4.0,9.0,,0.021678735674974678,3,59,0.5059478444597848,2.0166075773712655e-05,150.3892681121826,COMPLETE
228,0.23780393600463867,2023-09-04 11:51:19.296728,2023-09-04 11:51:20.306005,0 days 00:00:01.009277,Tanh,Leaky,Tanh,,48,24,5.0,10.0,,0.016180326737087556,3,295,0.6439474331585612,0.006596691765459098,75.92175910586403,COMPLETE
229,0.191273495554924,2023-09-04 11:51:20.306496,2023-09-04 11:51:21.545306,0 days 00:00:01.238810,Tanh,Sigmoid,,,66,16,17.0,,,0.03882265675731566,2,283,0.4720147556887259,3.009215696588848e-05,78.4734710117556,COMPLETE
230,0.2188279926776886,2023-09-04 11:51:21.545801,2023-09-04 11:51:22.713686,0 days 00:00:01.167885,Sigmoid,Tanh,Leaky,,83,23,18.0,15.0,,0.06030096301252479,3,333,0.79933791332894,5.4871821623707794e-05,107.55725939520474,COMPLETE
231,0.18120762705802917,2023-09-04 11:51:22.714189,2023-09-04 11:51:24.397519,0 days 00:00:01.683330,Tanh,Sigmoid,,,77,22,12.0,,,0.0182197512181589,2,354,0.6085649414931021,7.385892260244081e-05,71.63203636048333,COMPLETE
232,0.21974042057991028,2023-09-04 11:51:24.398008,2023-09-04 11:51:25.360494,0 days 00:00:00.962486,Tanh,Sigmoid,,,78,22,12.0,,,0.024061481993853617,2,353,0.6069607711352887,8.867911688904449e-05,109.35217001778739,COMPLETE
233,0.20264063775539398,2023-09-04 11:51:25.360985,2023-09-04 11:51:26.426404,0 days 00:00:01.065419,Tanh,Sigmoid,,,73,21,12.0,,,0.021119567729517317,2,370,0.5772850802960146,0.0005896744903048355,217.7960684360602,COMPLETE
234,0.21533244848251343,2023-09-04 11:51:26.426883,2023-09-04 11:51:28.558114,0 days 00:00:02.131231,Tanh,Sigmoid,,,81,14,13.0,,,0.0047730860557556294,2,381,0.6276895391992423,7.216786275636172e-05,82.5140919745723,COMPLETE
235,0.18749181926250458,2023-09-04 11:51:28.558601,2023-09-04 11:51:29.830890,0 days 00:00:01.272289,Tanh,Sigmoid,,,76,23,11.0,,,0.017458307576443878,2,361,0.665259921280655,4.849923776264803e-05,80.19942172738008,COMPLETE
236,0.23186837136745453,2023-09-04 11:51:29.831381,2023-09-04 11:51:31.612973,0 days 00:00:01.781592,ReLU,Sigmoid,,,22,22,20.0,,,0.014280818979345373,2,343,0.7008284158001512,0.001234644463864398,79.77278033169833,COMPLETE
237,0.2148866504430771,2023-09-04 11:51:31.613483,2023-09-04 11:51:32.604473,0 days 00:00:00.990990,Tanh,Leaky,,,69,24,9.0,,,0.01032036441047233,2,75,0.33621766171241774,3.834929080914727e-05,76.11513104355126,COMPLETE
238,0.3219274580478668,2023-09-04 11:51:32.604961,2023-09-04 11:51:33.944878,0 days 00:00:01.339917,Tanh,ReLU,Tanh,,18,22,7.0,11.0,,0.02750884816765639,3,318,0.6099184628365545,0.043654361529480865,538.4516272911659,COMPLETE
239,0.23943214118480682,2023-09-04 11:51:33.945386,2023-09-04 11:51:34.759555,0 days 00:00:00.814169,Sigmoid,Sigmoid,,,26,21,14.0,,,0.03256371029605235,2,168,0.14441105517054945,6.214575700545692e-05,89.14223749497357,COMPLETE
240,0.3556327223777771,2023-09-04 11:51:34.760060,2023-09-04 11:51:36.190805,0 days 00:00:01.430745,Tanh,Leaky,Sigmoid,,15,24,10.0,9.0,,0.07627652418333658,3,372,0.6509577011921299,1.477925302129779e-05,103.84231012517756,COMPLETE
241,0.19947807490825653,2023-09-04 11:51:36.191307,2023-09-04 11:51:36.908540,0 days 00:00:00.717233,Tanh,Sigmoid,,,77,21,12.0,,,0.017749819624122042,2,357,0.6052064592714116,7.290205344951105e-05,140.6917288208008,COMPLETE
242,0.18356803059577942,2023-09-04 11:51:36.909088,2023-09-04 11:51:38.780339,0 days 00:00:01.871251,Tanh,Sigmoid,,,75,22,11.0,,,0.020790705919108053,2,347,0.5627985682840692,5.862215909362632e-05,75.47409266641695,COMPLETE
243,0.18386150896549225,2023-09-04 11:51:38.780829,2023-09-04 11:51:40.552957,0 days 00:00:01.772128,Tanh,Sigmoid,,,79,22,12.0,,,0.015008674868358544,2,350,0.5892308780878407,7.902751812385412e-05,627.2737377391142,COMPLETE
244,0.18051399290561676,2023-09-04 11:51:40.553455,2023-09-04 11:51:43.312936,0 days 00:00:02.759481,Tanh,Sigmoid,,,81,23,5.0,,,0.007027035136825943,2,333,0.6346906495031821,0.0001395156189622176,76.3115660723518,COMPLETE
245,0.2149866372346878,2023-09-04 11:51:43.313439,2023-09-04 11:51:45.110356,0 days 00:00:01.796917,Tanh,Sigmoid,,,83,23,5.0,,,0.006737691969113095,2,335,0.6318359290118029,9.660681651578954e-05,113.35194509169635,COMPLETE
246,0.2218201905488968,2023-09-04 11:51:45.110849,2023-09-04 11:51:46.532580,0 days 00:00:01.421731,Tanh,Sigmoid,,,82,23,4.0,,,0.009249805391108234,2,324,0.6783695215872962,4.8241625990619e-05,91.41526576450893,COMPLETE
247,0.18653325736522675,2023-09-04 11:51:46.533065,2023-09-04 11:51:47.734317,0 days 00:00:01.201252,Tanh,Leaky,,,81,24,4.0,,,0.02527618805353249,2,330,0.7315278587815304,0.00012441367341471898,105.39061235126697,COMPLETE
248,0.2508161664009094,2023-09-04 11:51:47.734814,2023-09-04 11:51:48.410674,0 days 00:00:00.675860,Leaky,Sigmoid,ReLU,,85,23,16.0,20.0,,0.01189238384695232,3,306,0.7639753221479839,3.473313522583524e-05,152.0842877556296,COMPLETE
249,0.22938895225524902,2023-09-04 11:51:48.411174,2023-09-04 11:51:51.173700,0 days 00:00:02.762526,Sigmoid,Sigmoid,,,19,24,5.0,,,0.005909681477813267,2,90,0.23264158966744783,0.00013682916234617748,95.42836238561051,COMPLETE
250,0.20941202342510223,2023-09-04 11:51:51.174194,2023-09-04 11:51:52.265612,0 days 00:00:01.091418,Tanh,Leaky,Tanh,,80,23,6.0,23.0,,0.025966954306094782,3,68,0.6432267141472217,0.00017733620628851277,95.46241450309753,COMPLETE
251,0.1933382749557495,2023-09-04 11:51:52.266107,2023-09-04 11:51:53.485983,0 days 00:00:01.219876,Tanh,Sigmoid,,,89,22,19.0,,,0.019981797051446887,2,81,0.693771603770101,2.7378682810067637e-05,119.69948051089332,COMPLETE
252,0.22997941076755524,2023-09-04 11:51:53.486485,2023-09-04 11:51:55.232137,0 days 00:00:01.745652,Tanh,Tanh,Leaky,,12,22,6.0,7.0,,0.0387966942703449,3,339,0.32491178381767527,0.0003391356894454977,180.02459786155006,COMPLETE
253,0.23364900052547455,2023-09-04 11:51:55.232648,2023-09-04 11:51:58.621090,0 days 00:00:03.388442,Sigmoid,Leaky,,,78,23,5.0,,,0.0023402113110151342,2,386,0.6180816734835708,4.101800891836723e-05,117.76561017540412,COMPLETE
254,0.1766958087682724,2023-09-04 11:51:58.621628,2023-09-04 11:51:59.633491,0 days 00:00:01.011863,Tanh,Sigmoid,ReLU,,74,24,18.0,17.0,,0.030810546568966254,3,142,0.6618007707067458,2.3638230783909896e-05,92.53734295184796,COMPLETE
255,0.1928054541349411,2023-09-04 11:51:59.634067,2023-09-04 11:52:01.740829,0 days 00:00:02.106762,Tanh,Sigmoid,ReLU,,70,24,18.0,14.0,,0.029409970022840876,3,261,0.667595108876088,2.3494465374995422e-05,90.72219848632812,COMPLETE
256,0.19290804862976074,2023-09-04 11:52:01.741360,2023-09-04 11:52:02.612146,0 days 00:00:00.870786,Tanh,Leaky,,,73,24,17.0,,,0.032630543249800414,2,140,0.5726017782366859,1.764758631729685e-05,80.11892774028163,COMPLETE
257,0.18724828958511353,2023-09-04 11:52:02.612656,2023-09-04 11:52:03.822341,0 days 00:00:01.209685,Tanh,ReLU,ReLU,,75,24,18.0,17.0,,0.02350660806808277,3,365,0.6395338751508527,2.807350659137406e-05,115.01540419634651,COMPLETE
258,0.1920037567615509,2023-09-04 11:52:03.822850,2023-09-04 11:52:04.641592,0 days 00:00:00.818742,Tanh,Sigmoid,,,71,24,19.0,,,0.01738337763614455,2,133,0.5966430024305216,2.117398793530931e-05,140.23101615905762,COMPLETE
259,0.20565582811832428,2023-09-04 11:52:04.642120,2023-09-04 11:52:06.101738,0 days 00:00:01.459618,Tanh,Sigmoid,ReLU,,76,23,20.0,21.0,,0.007699096165713041,3,359,0.7993261955634957,3.105069403054963e-05,239.00246070413027,COMPLETE
260,0.8606580495834351,2023-09-04 11:52:06.102255,2023-09-04 11:52:10.907787,0 days 00:00:04.805532,Tanh,Leaky,,,74,23,8.0,,,1.0628680033724733e-05,2,161,0.6629556958352654,0.00010528874022445501,104.70231893788214,COMPLETE
261,0.17929275333881378,2023-09-04 11:52:10.908298,2023-09-04 11:52:12.791196,0 days 00:00:01.882898,Tanh,Sigmoid,ReLU,,78,24,17.0,18.0,,0.013117343798531331,3,121,0.7109938743299692,1.3032773694299984e-05,87.48277387432023,COMPLETE
262,0.202523335814476,2023-09-04 11:52:12.791711,2023-09-04 11:52:15.020117,0 days 00:00:02.228406,Tanh,Leaky,ReLU,,37,24,16.0,18.0,,0.012768416227086578,3,102,0.7038952372131189,1.286725584098441e-05,80.7056801739861,COMPLETE
263,0.19116446375846863,2023-09-04 11:52:15.020648,2023-09-04 11:52:16.276768,0 days 00:00:01.256120,Tanh,Sigmoid,ReLU,,80,24,17.0,20.0,,0.03374327165763087,3,125,0.7449012123206937,1.6681597669945458e-05,81.43618893623352,COMPLETE
264,0.1740580052137375,2023-09-04 11:52:16.277281,2023-09-04 11:52:17.564054,0 days 00:00:01.286773,Tanh,Leaky,ReLU,,87,24,17.0,19.0,,0.011393580753238606,3,153,0.7202534684978389,1.2782239426151523e-05,1758.9509684244792,COMPLETE
265,0.1622937172651291,2023-09-04 11:52:17.564561,2023-09-04 11:52:19.132744,0 days 00:00:01.568183,Tanh,Leaky,ReLU,,87,24,17.0,19.0,,0.010786359337701218,3,149,0.7261519818859999,1.1211933254407939e-05,107.80881136113948,COMPLETE
266,0.1925550401210785,2023-09-04 11:52:19.133283,2023-09-04 11:52:20.293803,0 days 00:00:01.160520,Tanh,Leaky,ReLU,,92,24,17.0,19.0,,0.012587343751107335,3,148,0.7230737863504915,1.2474015551601276e-05,74.64534389611447,COMPLETE
267,0.19446629285812378,2023-09-04 11:52:20.294326,2023-09-04 11:52:21.498055,0 days 00:00:01.203729,Tanh,Leaky,ReLU,,88,24,17.0,19.0,,0.01006954625497871,3,144,0.7580400927979128,1.2190172642708252e-05,73.46486902236938,COMPLETE
268,0.19291290640830994,2023-09-04 11:52:21.498581,2023-09-04 11:52:22.803167,0 days 00:00:01.304586,Tanh,Leaky,ReLU,,86,24,16.0,18.0,,0.009129995958641451,3,153,0.7101063746301338,1.1059789421954896e-05,142.47994953877216,COMPLETE
269,0.20121429860591888,2023-09-04 11:52:22.803681,2023-09-04 11:52:24.405342,0 days 00:00:01.601661,Tanh,Leaky,ReLU,,91,24,18.0,19.0,,0.011453072133556638,3,161,0.7671695426828407,1.4221583873969841e-05,100.63809452500455,COMPLETE
270,0.188182070851326,2023-09-04 11:52:24.405859,2023-09-04 11:52:25.977434,0 days 00:00:01.571575,Tanh,Leaky,ReLU,,84,23,17.0,20.0,,0.014531768835144425,3,134,0.6870608698671483,1.851192329652549e-05,72.0783807542589,COMPLETE
271,0.17288757860660553,2023-09-04 11:52:25.977977,2023-09-04 11:52:27.753030,0 days 00:00:01.775053,Tanh,Leaky,ReLU,,86,23,18.0,17.0,,0.00798579092532357,3,151,0.731386906899698,2.359694475536944e-05,103.36004684448243,COMPLETE
272,0.21088279783725739,2023-09-04 11:52:27.753548,2023-09-04 11:52:29.429104,0 days 00:00:01.675556,Tanh,Leaky,ReLU,,86,12,18.0,17.0,,0.009321167817662374,3,155,0.7466342332768859,1.0754958537184392e-05,85.70836119956158,COMPLETE
273,0.18766868114471436,2023-09-04 11:52:29.429618,2023-09-04 11:52:30.263681,0 days 00:00:00.834063,Tanh,Leaky,ReLU,,87,24,18.0,18.0,,0.013337053922255733,3,116,0.7245530557198238,1.5588882826243486e-05,105.85735387387483,COMPLETE
274,0.20377038419246674,2023-09-04 11:52:30.264211,2023-09-04 11:52:30.950419,0 days 00:00:00.686208,Tanh,Leaky,ReLU,,89,24,17.0,17.0,,0.010790609577642949,3,147,0.44224725812570836,2.368105854272405e-05,102.62997589111328,COMPLETE
275,0.17099057137966156,2023-09-04 11:52:30.950942,2023-09-04 11:52:32.611133,0 days 00:00:01.660191,ReLU,Leaky,ReLU,,88,23,17.0,19.0,,0.01507227704671558,3,139,0.7706848171433905,2.0524164860948744e-05,72.39098955237347,COMPLETE
276,0.22578014433383942,2023-09-04 11:52:32.611657,2023-09-04 11:52:33.427967,0 days 00:00:00.816310,ReLU,Leaky,ReLU,,88,23,16.0,19.0,,0.014289636225940127,3,141,0.7736708996825636,2.0264437873433663e-05,91.38595581054688,COMPLETE
277,0.18657809495925903,2023-09-04 11:52:33.428494,2023-09-04 11:52:34.764510,0 days 00:00:01.336016,ReLU,Leaky,ReLU,,94,24,17.0,20.0,,0.0160829975003273,3,165,0.7434059468743817,1.7249455786612778e-05,89.50518608093262,COMPLETE
278,0.19751058518886566,2023-09-04 11:52:34.764818,2023-09-04 11:52:35.120756,0 days 00:00:00.355938,ReLU,Leaky,ReLU,,91,23,17.0,18.0,,0.011542133967918046,3,131,0.7994442214498038,2.3310911015475327e-05,92.49157421405499,COMPLETE
279,0.19912788271903992,2023-09-04 11:52:35.121059,2023-09-04 11:52:35.731273,0 days 00:00:00.610214,ReLU,Leaky,ReLU,,98,24,18.0,17.0,,0.008457410332375891,3,150,0.7227094248795359,1.446485907832463e-05,139.30727272033693,COMPLETE
280,0.19960914552211761,2023-09-04 11:52:35.731795,2023-09-04 11:52:38.202485,0 days 00:00:02.470690,ReLU,Leaky,ReLU,,88,23,16.0,18.0,,0.00047251016747713734,3,137,0.7653042427264691,2.02908988551342e-05,215.7762570467862,COMPLETE
281,0.1986473798751831,2023-09-04 11:52:38.202803,2023-09-04 11:52:38.603131,0 days 00:00:00.400328,Tanh,Leaky,ReLU,,84,24,17.0,21.0,,0.0461513467889831,3,155,0.6989294780250535,1.0189778657064437e-05,100.52925300598145,COMPLETE
282,0.1986413449048996,2023-09-04 11:52:38.603452,2023-09-04 11:52:39.464747,0 days 00:00:00.861295,Tanh,Leaky,ReLU,,87,23,21.0,16.0,,0.0016120081015061228,3,125,0.7361629209029115,2.4948850784431836e-05,72.65129487173898,COMPLETE
283,0.2255927175283432,2023-09-04 11:52:39.465052,2023-09-04 11:52:39.996019,0 days 00:00:00.530967,Tanh,Leaky,ReLU,,85,24,18.0,19.0,,0.020962100113072785,3,110,0.7685477268127767,1.5883403882839767e-05,86.77277870178223,COMPLETE
