number,value,datetime_start,datetime_complete,duration,params_activation1,params_activation2,params_activation3,params_activation4,params_batch_size,params_fl1,params_fl2,params_fl3,params_fl4,params_learning_rate,params_n_layers,params_num_epochs,params_train_size,params_weight_decay,user_attrs_mre,state
362,0.20201539993286133,2023-09-04 12:11:51.552014,2023-09-04 12:11:51.937920,0 days 00:00:00.385906,Tanh,ReLU,Leaky,Sigmoid,90,9,11.0,22.0,22.0,0.05627394512991624,4,399,0.45727397432474254,5.517896535336061e-05,101.90609321594238,COMPLETE
363,0.10438022017478943,2023-09-04 12:11:51.938317,2023-09-04 12:11:52.536959,0 days 00:00:00.598642,Tanh,Tanh,Leaky,Leaky,77,11,12.0,21.0,19.0,0.01579079683875975,4,386,0.6653575788382471,0.000519608738502532,65.90493955612183,COMPLETE
364,0.16835497319698334,2023-09-04 12:11:52.537425,2023-09-04 12:11:53.262521,0 days 00:00:00.725096,Tanh,Tanh,Leaky,Leaky,77,11,17.0,7.0,7.0,0.0161021026799911,4,308,0.671801302681026,0.0005159616067809282,87.47792182922363,COMPLETE
365,0.1517634391784668,2023-09-04 12:11:53.263007,2023-09-04 12:11:53.772058,0 days 00:00:00.509051,Tanh,Tanh,Leaky,Leaky,75,10,15.0,11.0,9.0,0.022698995237205227,4,383,0.6486565022406293,0.0004213520428776066,113.1736645418055,COMPLETE
366,0.20988225936889648,2023-09-04 12:11:53.772514,2023-09-04 12:11:54.497767,0 days 00:00:00.725253,Tanh,Tanh,Leaky,Leaky,77,11,13.0,21.0,18.0,0.015193817192273086,4,362,0.6018582232351338,0.0006031560989039857,161.2097384366122,COMPLETE
367,0.16371634602546692,2023-09-04 12:11:54.498151,2023-09-04 12:11:55.429960,0 days 00:00:00.931809,Tanh,Tanh,Sigmoid,Leaky,79,12,12.0,21.0,19.0,0.018106658246754313,4,376,0.770201281329377,0.0003318019085618338,78.24243779768024,COMPLETE
368,0.2664126455783844,2023-09-04 12:11:55.430338,2023-09-04 12:11:55.608693,0 days 00:00:00.178355,Tanh,Tanh,Leaky,Sigmoid,75,11,14.0,22.0,19.0,0.029205939482312763,4,368,0.15394380687561304,0.0004965532581148216,84.41178385416667,COMPLETE
369,0.28661322593688965,2023-09-04 12:11:55.609076,2023-09-04 12:11:55.824341,0 days 00:00:00.215265,Tanh,Tanh,Leaky,Leaky,81,11,13.0,21.0,5.0,0.037592478546443334,4,388,0.2455113532087199,0.0006404555608470494,128.2148927961077,COMPLETE
370,0.17275026440620422,2023-09-04 12:11:55.824785,2023-09-04 12:11:56.221331,0 days 00:00:00.396546,Tanh,Tanh,Leaky,Leaky,77,12,24.0,22.0,20.0,0.07144768532461397,4,349,0.7402786463415252,0.0003909631612803236,79.14023739358653,COMPLETE
371,0.2456476390361786,2023-09-04 12:11:56.221780,2023-09-04 12:11:56.805977,0 days 00:00:00.584197,Tanh,Sigmoid,Leaky,Sigmoid,79,10,18.0,21.0,19.0,0.01391015114074805,4,419,0.6908385966384392,0.00011013752973874452,148.36295612041766,COMPLETE
372,0.18340487778186798,2023-09-04 12:11:56.806454,2023-09-04 12:11:57.706779,0 days 00:00:00.900325,Tanh,Leaky,Leaky,Sigmoid,82,13,12.0,23.0,20.0,0.023683055841505898,4,179,0.7715764603707347,0.0005328251163571398,330.995066412564,COMPLETE
373,0.28399622440338135,2023-09-04 12:11:57.707226,2023-09-04 12:12:03.334374,0 days 00:00:05.627148,Sigmoid,Tanh,ReLU,Sigmoid,92,12,17.0,22.0,21.0,0.00036016019849862205,4,381,0.7276940922066192,0.0007421108815393137,121.23457090122493,COMPLETE
374,0.11726319789886475,2023-09-04 12:12:03.334774,2023-09-04 12:12:04.538177,0 days 00:00:01.203403,Tanh,Tanh,Tanh,Sigmoid,84,11,14.0,20.0,23.0,0.01225759036540253,4,407,0.6700586284191097,0.00026971477297766934,89.27273392095799,COMPLETE
375,0.22252966463565826,2023-09-04 12:12:04.538552,2023-09-04 12:12:05.140980,0 days 00:00:00.602428,Tanh,Tanh,,,84,10,14.0,,,0.011832841051443195,2,405,0.6755853613568189,0.000266628442758037,140.49343032836913,COMPLETE
376,0.21116504073143005,2023-09-04 12:12:05.141460,2023-09-04 12:12:05.872372,0 days 00:00:00.730912,Tanh,Tanh,Tanh,Sigmoid,88,13,14.0,24.0,24.0,0.010031185049452123,4,410,0.6254344567712532,0.00029484022054786344,131.65267181396484,COMPLETE
377,0.24855220317840576,2023-09-04 12:12:05.872839,2023-09-04 12:12:06.458188,0 days 00:00:00.585349,Tanh,Tanh,Sigmoid,Leaky,85,11,2.0,20.0,23.0,0.009160701041272652,4,393,0.6439975484379501,0.0001853805420750573,102.06446693057106,COMPLETE
378,0.2355354279279709,2023-09-04 12:12:06.458634,2023-09-04 12:12:06.881795,0 days 00:00:00.423161,Tanh,Tanh,Tanh,Sigmoid,83,12,15.0,21.0,24.0,0.012475637555535195,4,437,0.5183783110674676,0.0002597651921960292,110.42433885846819,COMPLETE
379,0.20471332967281342,2023-09-04 12:12:06.882258,2023-09-04 12:12:07.276100,0 days 00:00:00.393842,Tanh,Tanh,Tanh,Sigmoid,87,15,19.0,21.0,23.0,0.012897262950773154,4,424,0.2804434469152057,0.00021110441002344994,249.34802701396328,COMPLETE
380,0.22500790655612946,2023-09-04 12:12:07.276560,2023-09-04 12:12:07.842555,0 days 00:00:00.565995,Tanh,Tanh,Tanh,Sigmoid,95,14,15.0,23.0,23.0,0.010531672380545446,4,401,0.31028850569234967,0.00046857031856835997,148.06644585427273,COMPLETE
381,0.2537306249141693,2023-09-04 12:12:07.842945,2023-09-04 12:12:09.349160,0 days 00:00:01.506215,Tanh,,,,90,12,,,,0.0025839643882680334,1,415,0.6631063268763453,0.0003444974015079269,111.10844320468802,COMPLETE
382,0.24959447979927063,2023-09-04 12:12:09.349497,2023-09-04 12:12:09.856408,0 days 00:00:00.506911,Tanh,Tanh,Tanh,Sigmoid,85,11,14.0,22.0,18.0,0.01513744843458005,4,406,0.4084773149799135,0.002906257306291541,113.68370804419884,COMPLETE
383,0.10655179619789124,2023-09-04 12:12:09.856777,2023-09-04 12:12:11.603099,0 days 00:00:01.746322,Tanh,Tanh,Tanh,Sigmoid,35,13,13.0,20.0,22.0,0.007683020170875158,4,391,0.7997285409235078,0.00015514694335755637,78.25704081305142,COMPLETE
384,0.17248399555683136,2023-09-04 12:12:11.603591,2023-09-04 12:12:14.919264,0 days 00:00:03.315673,ReLU,Tanh,Tanh,Sigmoid,11,13,6.0,20.0,22.0,0.0055764621304000605,4,385,0.7981666957239589,0.0001543274591293042,91.13623737644505,COMPLETE
385,0.1338348090648651,2023-09-04 12:12:14.919617,2023-09-04 12:12:18.737932,0 days 00:00:03.818315,Tanh,Tanh,Sigmoid,ReLU,36,13,16.0,20.0,22.0,0.007286968042215709,4,391,0.699707146810192,0.00018900435310117798,88.52555731278431,COMPLETE
386,0.14963386952877045,2023-09-04 12:12:18.738551,2023-09-04 12:12:22.736349,0 days 00:00:03.997798,Tanh,Tanh,Tanh,ReLU,35,13,16.0,20.0,23.0,0.004100741361727733,4,392,0.48344170486946403,0.00021900640604091383,87.52499135335286,COMPLETE
387,0.15726825594902039,2023-09-04 12:12:22.736977,2023-09-04 12:12:25.547682,0 days 00:00:02.810705,Tanh,Tanh,Tanh,ReLU,55,13,20.0,19.0,23.0,0.007077090109707285,4,399,0.5945307845694483,0.00017786613546797846,69.22924002954515,COMPLETE
388,0.13027559220790863,2023-09-04 12:12:25.548328,2023-09-04 12:12:29.596501,0 days 00:00:04.048173,Tanh,Tanh,Tanh,ReLU,37,13,16.0,20.0,22.0,0.006468556606353622,4,384,0.6996012904704367,0.00021691269895584675,72.35857721475455,COMPLETE
389,0.1669318825006485,2023-09-04 12:12:29.597144,2023-09-04 12:12:34.604298,0 days 00:00:05.007154,Tanh,Tanh,Tanh,ReLU,39,13,16.0,20.0,23.0,0.004993488925695641,4,376,0.6557595999379795,0.0002195035974664065,195.37952068490043,COMPLETE
390,0.16230864822864532,2023-09-04 12:12:34.604953,2023-09-04 12:12:39.758314,0 days 00:00:05.153361,Tanh,Tanh,Tanh,ReLU,38,3,16.0,19.0,22.0,0.006024931320848851,4,386,0.7004560656853183,0.00016092252681173923,83.77594529336957,COMPLETE
391,0.19945193827152252,2023-09-04 12:12:39.758952,2023-09-04 12:12:43.278522,0 days 00:00:03.519570,Tanh,Tanh,Tanh,ReLU,33,13,15.0,20.0,22.0,0.006795434037341765,4,372,0.38631558230605156,0.00023146380550725064,102.15396086374919,COMPLETE
392,0.11739019304513931,2023-09-04 12:12:43.279154,2023-09-04 12:12:48.592348,0 days 00:00:05.313194,Tanh,Tanh,Tanh,ReLU,36,13,16.0,20.0,22.0,0.005422710076855625,4,484,0.6135832544560312,0.0002524454949569146,91.15245472301136,COMPLETE
393,0.19157642126083374,2023-09-04 12:12:48.592993,2023-09-04 12:12:51.640574,0 days 00:00:03.047581,Tanh,Tanh,Tanh,ReLU,34,14,15.0,19.0,24.0,0.003955835227914312,4,475,0.5962963044963908,0.0002710970734129452,103.91582613213117,COMPLETE
394,0.15871302783489227,2023-09-04 12:12:51.641232,2023-09-04 12:12:55.917629,0 days 00:00:04.276397,Tanh,Tanh,Tanh,ReLU,25,14,16.0,20.0,23.0,0.005133421160307581,4,431,0.6451943584699629,0.0002481846739051974,66.5636012942292,COMPLETE
395,0.17954881489276886,2023-09-04 12:12:55.918250,2023-09-04 12:12:59.955204,0 days 00:00:04.036954,Tanh,Tanh,Tanh,ReLU,38,13,15.0,14.0,22.0,0.004340996756187945,4,497,0.6167279708532376,0.0002917367012096156,67.1065857794977,COMPLETE
396,0.21185901761054993,2023-09-04 12:12:59.955872,2023-09-04 12:13:02.372273,0 days 00:00:02.416401,Tanh,Tanh,Tanh,ReLU,45,13,16.0,20.0,18.0,0.006086725515149237,4,459,0.35349579029674577,0.00032376736346157586,150.74173650607256,COMPLETE
397,0.3599522113800049,2023-09-04 12:13:02.372914,2023-09-04 12:13:03.557260,0 days 00:00:01.184346,Tanh,Tanh,Tanh,ReLU,30,12,17.0,19.0,4.0,0.050334085983197135,4,422,0.5513821371291808,0.00012975535694478716,129.02537441253662,COMPLETE
398,0.23245812952518463,2023-09-04 12:13:03.557864,2023-09-04 12:13:08.115064,0 days 00:00:04.557200,Sigmoid,Tanh,Tanh,Tanh,36,13,15.0,21.0,23.0,0.0032918708522456253,4,468,0.6753368273497589,0.00022526811121054597,120.18994453305103,COMPLETE
399,0.13419075310230255,2023-09-04 12:13:08.115741,2023-09-04 12:13:10.496967,0 days 00:00:02.381226,Tanh,Tanh,Tanh,ReLU,41,12,14.0,19.0,22.0,0.02068656301651314,4,479,0.6187237211967022,0.00019216908704479415,103.22480959211077,COMPLETE
400,0.14384615421295166,2023-09-04 12:13:10.497611,2023-09-04 12:13:16.427928,0 days 00:00:05.930317,Tanh,Tanh,Tanh,Leaky,32,14,15.0,18.0,19.0,0.005075018115297701,4,144,0.7099849389809993,0.0003188626141353293,116.87325833448723,COMPLETE
401,0.2293785959482193,2023-09-04 12:13:16.428532,2023-09-04 12:13:19.726427,0 days 00:00:03.297895,Tanh,Tanh,Tanh,ReLU,32,10,16.0,10.0,19.0,0.05680013071194311,4,490,0.6759429005972225,0.0001574026745085329,183.32944297790527,COMPLETE
402,0.3404417037963867,2023-09-04 12:13:19.727051,2023-09-04 12:13:20.423943,0 days 00:00:00.696892,Tanh,Tanh,Tanh,Sigmoid,40,12,9.0,21.0,18.0,0.007976864805010819,4,414,0.23210921540025303,0.0003924916439406277,134.9410971069336,COMPLETE
403,0.5286704897880554,2023-09-04 12:13:20.424582,2023-09-04 12:13:47.056193,0 days 00:00:26.631611,Tanh,Tanh,Tanh,Sigmoid,35,6,14.0,20.0,22.0,2.5147157582668097e-05,4,380,0.633176140723114,0.0002685426472576045,143.94791163394325,COMPLETE
404,0.22268354892730713,2023-09-04 12:13:47.056834,2023-09-04 12:13:50.261936,0 days 00:00:03.205102,Tanh,Tanh,Tanh,Sigmoid,37,14,17.0,21.0,17.0,0.01664062524230746,4,499,0.5771019995068559,0.00033861192727422144,93.38162201526119,COMPLETE
405,0.5599562525749207,2023-09-04 12:13:50.262566,2023-09-04 12:13:51.133731,0 days 00:00:00.871165,Tanh,Tanh,Tanh,Sigmoid,91,12,10.0,24.0,8.0,0.042363530460982624,4,454,0.7235729917557713,0.04247121931272953,155.99687881469725,COMPLETE
406,0.17537303268909454,2023-09-04 12:13:51.134353,2023-09-04 12:13:54.351978,0 days 00:00:03.217625,Tanh,Tanh,Tanh,Sigmoid,35,13,13.0,20.0,22.0,0.028452371527585587,4,484,0.4716625069168095,0.0001346903022759192,102.70108025760975,COMPLETE
407,0.22898833453655243,2023-09-04 12:13:54.352601,2023-09-04 12:14:00.318487,0 days 00:00:05.965886,Tanh,Tanh,ReLU,Sigmoid,23,10,24.0,19.0,23.0,0.0027679243661023517,4,369,0.43621347036561214,0.0004011885905787102,788.1138695406627,COMPLETE
408,0.15378962457180023,2023-09-04 12:14:00.319131,2023-09-04 12:14:20.696580,0 days 00:00:20.377449,ReLU,Tanh,Tanh,Sigmoid,34,11,16.0,23.0,19.0,0.000510109885398088,4,446,0.5640649627223981,0.0008703431799228148,158.31838571572607,COMPLETE
409,0.28362151980400085,2023-09-04 12:14:20.697203,2023-09-04 12:14:21.836927,0 days 00:00:01.139724,Tanh,Tanh,Sigmoid,Sigmoid,88,5,22.0,20.0,5.0,0.006086841510342928,4,403,0.26006111685139777,0.0002532908459882788,312.85772196451825,COMPLETE
410,0.6720916032791138,2023-09-04 12:14:21.837558,2023-09-04 12:14:22.591409,0 days 00:00:00.753851,Tanh,Tanh,Tanh,Leaky,89,17,14.0,21.0,18.0,0.008045509213511945,4,409,0.7408897813547772,0.07636685083646844,112.75372743606567,COMPLETE
411,0.18504472076892853,2023-09-04 12:14:22.592069,2023-09-04 12:14:25.273839,0 days 00:00:02.681770,Tanh,Leaky,Sigmoid,Tanh,37,14,15.0,18.0,22.0,0.018934137251268312,4,380,0.36343463802986253,0.0002180004285855157,110.22457931980942,COMPLETE
412,0.1144128069281578,2023-09-04 12:14:25.274495,2023-09-04 12:14:26.674282,0 days 00:00:01.399787,Tanh,Tanh,Tanh,Sigmoid,87,13,13.0,20.0,19.0,0.03602372723140805,4,211,0.7997947090405787,9.860834087936923e-05,84.41548801290578,COMPLETE
413,0.29966607689857483,2023-09-04 12:14:26.674949,2023-09-04 12:14:28.693789,0 days 00:00:02.018840,Tanh,Tanh,Leaky,Sigmoid,16,9,13.0,21.0,19.0,0.03961638567512608,4,198,0.2983037270351375,0.0001139010641797511,130.82584039096176,COMPLETE
414,0.17293795943260193,2023-09-04 12:14:28.694431,2023-09-04 12:14:30.028196,0 days 00:00:01.333765,Tanh,Tanh,Tanh,Sigmoid,87,12,5.0,22.0,19.0,0.023769765042330252,4,74,0.46564811003478723,0.00010477775923967943,85.99039248202709,COMPLETE
415,0.1918894201517105,2023-09-04 12:14:30.028823,2023-09-04 12:14:35.278693,0 days 00:00:05.249870,Tanh,Tanh,Leaky,Sigmoid,86,11,13.0,17.0,6.0,0.0012974503666800395,4,486,0.794370963584059,0.0009205157724370969,103.52480974767963,COMPLETE
416,0.22277311980724335,2023-09-04 12:14:35.279323,2023-09-04 12:14:36.125648,0 days 00:00:00.846325,Tanh,ReLU,Leaky,Sigmoid,90,15,11.0,20.0,18.0,0.059148650142453595,4,234,0.42370766369897,9.047154956346689e-05,115.37572011639995,COMPLETE
417,0.15237346291542053,2023-09-04 12:14:36.126288,2023-09-04 12:14:39.076021,0 days 00:00:02.949733,Tanh,Tanh,Sigmoid,Sigmoid,52,12,12.0,19.0,20.0,0.03362531805307913,4,438,0.7711552104266798,0.0004632737422917368,85.40218834255053,COMPLETE
418,0.1785598248243332,2023-09-04 12:14:39.076655,2023-09-04 12:14:40.728935,0 days 00:00:01.652280,Tanh,ReLU,Leaky,Sigmoid,88,6,13.0,21.0,19.0,0.03179033860939654,4,363,0.5119817469665936,7.671207663001508e-05,74.35084804188122,COMPLETE
419,0.17560653388500214,2023-09-04 12:14:40.729579,2023-09-04 12:14:46.151600,0 days 00:00:05.422021,Tanh,Leaky,Leaky,Sigmoid,93,10,13.0,23.0,10.0,0.0010493221956836042,4,127,0.7998490730485488,0.0007478846906490387,77.85781472874439,COMPLETE
420,0.22280126810073853,2023-09-04 12:14:46.152243,2023-09-04 12:14:47.369491,0 days 00:00:01.217248,Tanh,Tanh,Leaky,Sigmoid,85,7,12.0,20.0,18.0,0.04152069797826485,4,399,0.7589111577724501,0.0015617298004202316,101.59269890418419,COMPLETE
421,1.0638718605041504,2023-09-04 12:14:47.370104,2023-09-04 12:14:48.161075,0 days 00:00:00.790971,Sigmoid,ReLU,ReLU,Sigmoid,29,16,14.0,22.0,19.0,0.015497782436169182,4,474,0.30083106051956715,0.007194333381539252,167.5881379071404,COMPLETE
422,0.2913871109485626,2023-09-04 12:14:48.161718,2023-09-04 12:14:50.421325,0 days 00:00:02.259607,Tanh,Tanh,Leaky,Sigmoid,91,11,11.0,19.0,20.0,0.012609911784080956,4,421,0.7454927283768193,0.01445675017173952,106.26433337176287,COMPLETE
423,0.6769916415214539,2023-09-04 12:14:50.421974,2023-09-04 12:14:51.830824,0 days 00:00:01.408850,Tanh,Tanh,Tanh,Sigmoid,18,13,8.0,21.0,19.0,0.08226342049964201,4,412,0.3867206000400977,0.0351808498019855,258.37997975068936,COMPLETE
424,0.11137116700410843,2023-09-04 12:14:51.831465,2023-09-04 12:14:54.095305,0 days 00:00:02.263840,Tanh,ReLU,Leaky,Sigmoid,89,12,13.0,23.0,24.0,0.02549008567333691,4,205,0.7291530623351707,0.0005440252066431415,70.5068957010905,COMPLETE
425,0.3077334463596344,2023-09-04 12:14:54.095946,2023-09-04 12:14:54.562370,0 days 00:00:00.466424,Tanh,ReLU,Leaky,Sigmoid,89,12,13.0,24.0,23.0,0.025991416211152175,4,216,0.18884620880694306,0.0004311380506194048,152.5954258441925,COMPLETE
426,0.18476179242134094,2023-09-04 12:14:54.563018,2023-09-04 12:14:55.446189,0 days 00:00:00.883171,Tanh,Tanh,Leaky,Sigmoid,91,12,14.0,23.0,23.0,0.020639734657177326,4,204,0.29412928827895546,0.0005224828473635144,67.69594387297934,COMPLETE
427,0.21450987458229065,2023-09-04 12:14:55.446826,2023-09-04 12:14:56.393612,0 days 00:00:00.946786,Tanh,ReLU,Sigmoid,Sigmoid,89,13,13.0,23.0,24.0,0.036568705153550964,4,404,0.27126398695176723,0.0005537653410209537,84.45346480149489,COMPLETE
428,0.13078659772872925,2023-09-04 12:14:56.394265,2023-09-04 12:14:58.556668,0 days 00:00:02.162403,Tanh,Tanh,Leaky,Sigmoid,87,12,12.0,24.0,20.0,0.02377352714961046,4,102,0.7984146154413619,0.00035738543401401786,111.1402587890625,COMPLETE
429,0.268153578042984,2023-09-04 12:14:58.557377,2023-09-04 12:14:59.951192,0 days 00:00:01.393815,Tanh,ReLU,Leaky,Sigmoid,93,11,13.0,22.0,23.0,0.01800018255418343,4,221,0.7326312857431047,0.005215440810750338,125.02747922955137,COMPLETE
430,0.17976483702659607,2023-09-04 12:14:59.951836,2023-09-04 12:15:05.609547,0 days 00:00:05.657711,Tanh,Tanh,Tanh,Sigmoid,74,11,14.0,23.0,24.0,0.0006496467676621716,4,164,0.5333750293530042,6.687966259443991e-05,95.13382511604124,COMPLETE
431,0.21069520711898804,2023-09-04 12:15:05.610209,2023-09-04 12:15:07.485358,0 days 00:00:01.875149,Tanh,Sigmoid,Leaky,Leaky,87,12,12.0,22.0,24.0,0.0034550856116888884,4,228,0.33477985245925057,0.0006696361805368705,111.17692839581034,COMPLETE
432,0.23390550911426544,2023-09-04 12:15:07.485999,2023-09-04 12:15:08.243555,0 days 00:00:00.757556,ReLU,Tanh,Leaky,Sigmoid,89,14,13.0,23.0,17.0,0.027589516461346223,4,183,0.2109449009780047,0.00044198865009634816,126.55538656197342,COMPLETE
433,0.14115950465202332,2023-09-04 12:15:08.244211,2023-09-04 12:15:09.940905,0 days 00:00:01.696694,Tanh,ReLU,Leaky,Sigmoid,85,10,12.0,21.0,24.0,0.014411016366687558,4,212,0.7593165902644546,0.0005418199376105944,73.7316424395587,COMPLETE
434,0.14354169368743896,2023-09-04 12:15:09.941551,2023-09-04 12:15:12.359887,0 days 00:00:02.418336,Tanh,Tanh,Leaky,Sigmoid,91,13,14.0,22.0,2.0,0.021196362678418734,4,394,0.7711100053151893,0.00037750620223574063,133.4905561719622,COMPLETE
435,0.18199458718299866,2023-09-04 12:15:12.360529,2023-09-04 12:15:13.625741,0 days 00:00:01.265212,Tanh,ReLU,Tanh,Sigmoid,86,12,13.0,24.0,24.0,0.031248814828603,4,199,0.7219431662570835,0.0006357672192897998,118.70606573696794,COMPLETE
436,0.27471616864204407,2023-09-04 12:15:13.626388,2023-09-04 12:15:14.331028,0 days 00:00:00.704640,Tanh,Tanh,Leaky,Sigmoid,88,15,12.0,21.0,3.0,0.012471220003657593,4,204,0.14249230016142808,0.0001295291187167797,138.8630385178786,COMPLETE
437,0.17445188760757446,2023-09-04 12:15:14.331675,2023-09-04 12:15:22.936424,0 days 00:00:08.604749,Tanh,ReLU,Sigmoid,Sigmoid,90,23,14.0,20.0,5.0,0.0007264022910198203,4,191,0.7991051130721354,0.0007753312800416515,99.71597138250061,COMPLETE
438,0.1634899079799652,2023-09-04 12:15:22.937071,2023-09-04 12:15:25.250500,0 days 00:00:02.313429,Tanh,Tanh,Leaky,Sigmoid,84,13,13.0,23.0,14.0,0.008748411026313059,4,426,0.7455405788465558,0.0003100032865690781,105.48483261695274,COMPLETE
439,0.13947975635528564,2023-09-04 12:15:25.251138,2023-09-04 12:15:29.246153,0 days 00:00:03.995015,Tanh,ReLU,Leaky,Sigmoid,92,11,21.0,22.0,21.0,0.004486793594189349,4,464,0.6679832637687108,0.0004759666551520253,82.38888571812556,COMPLETE
440,0.347921758890152,2023-09-04 12:15:29.246800,2023-09-04 12:15:34.853988,0 days 00:00:05.607188,Tanh,Tanh,,,87,9,12.0,,,0.0004398281462416235,2,191,0.7129786050301404,0.0011790529610634477,133.5914862667703,COMPLETE
441,0.21805264055728912,2023-09-04 12:15:34.854591,2023-09-04 12:15:39.220329,0 days 00:00:04.365738,Tanh,Sigmoid,Leaky,Sigmoid,84,11,14.0,21.0,9.0,0.015690998474952374,4,395,0.7707876199031835,0.0006277238604000696,129.6074030768011,COMPLETE
442,0.20013925433158875,2023-09-04 12:15:39.220981,2023-09-04 12:15:44.031655,0 days 00:00:04.810674,Tanh,ReLU,Tanh,Sigmoid,88,14,11.0,20.0,20.0,0.00148259272422638,4,210,0.5989220528828444,0.0001570318990451431,74.28286846705845,COMPLETE
443,0.22657784819602966,2023-09-04 12:15:44.032307,2023-09-04 12:15:51.215236,0 days 00:00:07.182929,Tanh,Tanh,Leaky,Tanh,81,12,13.0,23.0,23.0,0.000333627104526445,4,412,0.6891411191947782,1.420248723012789e-05,112.92651737758092,COMPLETE
444,0.30127623677253723,2023-09-04 12:15:51.215890,2023-09-04 12:16:07.787812,0 days 00:00:16.571922,Tanh,Tanh,Leaky,Sigmoid,86,13,15.0,22.0,15.0,9.033142581302282e-05,4,374,0.7992226788514478,0.0001034617179370355,129.2342782862046,COMPLETE
445,0.16327178478240967,2023-09-04 12:16:07.788458,2023-09-04 12:16:09.355579,0 days 00:00:01.567121,Sigmoid,Leaky,Leaky,Leaky,78,10,23.0,21.0,16.0,0.0187443423402605,4,388,0.7405908336212084,0.0003904476180897631,103.8961628184599,COMPLETE
446,0.9498483538627625,2023-09-04 12:16:09.356237,2023-09-04 12:16:16.494553,0 days 00:00:07.138316,Tanh,ReLU,Sigmoid,Sigmoid,94,12,13.0,16.0,4.0,1.142432496839955e-05,4,404,0.31969273492345757,0.0009272025080350031,140.45176083026547,COMPLETE
447,0.18656635284423828,2023-09-04 12:16:16.495200,2023-09-04 12:16:19.500571,0 days 00:00:03.005371,Tanh,,,,76,11,,,,0.011185128256968881,1,451,0.5745909648065767,0.0007322244225839853,94.48176195981691,COMPLETE
448,0.3062373101711273,2023-09-04 12:16:19.501161,2023-09-04 12:16:20.380414,0 days 00:00:00.879253,Tanh,Tanh,Leaky,Sigmoid,83,13,12.0,20.0,18.0,0.009118173716573343,4,381,0.7171902383511178,0.0034910332556300516,97.57876586914062,COMPLETE
449,0.15454734861850739,2023-09-04 12:16:20.381059,2023-09-04 12:16:21.582472,0 days 00:00:01.201413,Tanh,ReLU,Tanh,Sigmoid,90,12,24.0,21.0,22.0,0.044515110819940036,4,254,0.6569983604759438,0.00048643799461191853,275.9950657506143,COMPLETE
450,0.13527879118919373,2023-09-04 12:16:21.583111,2023-09-04 12:16:25.462591,0 days 00:00:03.879480,Tanh,Tanh,Leaky,Sigmoid,50,11,14.0,21.0,7.0,0.013270421244849276,4,397,0.7586609008979048,0.00031501963626575096,96.98426155965836,COMPLETE
451,1.0663695335388184,2023-09-04 12:16:25.463256,2023-09-04 12:16:26.309820,0 days 00:00:00.846564,Tanh,Sigmoid,ReLU,Sigmoid,92,15,15.0,22.0,19.0,0.0002452942610581727,4,418,0.2916036510540221,0.02335809048473633,98.74786766899956,COMPLETE
