number,value,datetime_start,datetime_complete,duration,params_activation1,params_activation2,params_activation3,params_activation4,params_batch_size,params_fl1,params_fl2,params_fl3,params_fl4,params_learning_rate,params_n_layers,params_num_epochs,params_train_size,params_weight_decay,user_attrs_mre,state
363,1.0288417339324951,2023-09-04 11:56:24.169877,2023-09-04 11:56:24.692466,0 days 00:00:00.522589,Leaky,Tanh,Tanh,ReLU,30,22,20.0,5.0,2.0,0.0026962232577468024,4,482,0.6871659395885001,6.351657158887598e-05,101.22951372931985,COMPLETE
364,0.18390396237373352,2023-09-04 11:56:24.692797,2023-09-04 11:56:25.316869,0 days 00:00:00.624072,Leaky,ReLU,Sigmoid,Leaky,33,22,21.0,6.0,6.0,0.01271564964582361,4,124,0.7500149946608043,3.767090677845633e-05,127.34231458391461,COMPLETE
365,0.17280331254005432,2023-09-04 11:56:25.317208,2023-09-04 11:56:26.076074,0 days 00:00:00.758866,Leaky,Tanh,Tanh,,36,23,20.0,9.0,,0.010207849521122745,3,123,0.718336989518087,4.452361186987557e-05,79.36094867481904,COMPLETE
366,0.2308187037706375,2023-09-04 11:56:26.076439,2023-09-04 11:56:26.342881,0 days 00:00:00.266442,Leaky,Tanh,Tanh,,91,24,21.0,10.0,,0.08176226505635038,3,110,0.6286416671022911,4.729484815606995e-05,90.74449190886125,COMPLETE
367,0.19211192429065704,2023-09-04 11:56:26.343221,2023-09-04 11:56:27.332123,0 days 00:00:00.988902,Leaky,Tanh,,,36,23,20.0,,,0.009971951958681089,2,122,0.7064297142295913,5.478111982274439e-05,68.21630371941461,COMPLETE
368,0.20033608376979828,2023-09-04 11:56:27.332454,2023-09-04 11:56:28.050222,0 days 00:00:00.717768,Tanh,Tanh,Leaky,,35,23,20.0,9.0,,0.00827560660673337,3,94,0.6729944737607105,4.2845836773299624e-05,128.05016951127485,COMPLETE
369,0.20594419538974762,2023-09-04 11:56:28.050570,2023-09-04 11:56:28.328567,0 days 00:00:00.277997,Leaky,Tanh,,,38,23,12.0,,,0.01111067859084038,2,133,0.31967310710289965,7.498659178175786e-05,112.14281743367513,COMPLETE
370,0.30129384994506836,2023-09-04 11:56:28.328887,2023-09-04 11:56:28.711903,0 days 00:00:00.383016,Leaky,Tanh,Tanh,,31,24,21.0,9.0,,0.08092869543627958,3,288,0.7280511086654977,3.32459362274323e-05,83.14314869471959,COMPLETE
371,0.26876482367515564,2023-09-04 11:56:28.712262,2023-09-04 11:56:29.584741,0 days 00:00:00.872479,Leaky,Tanh,Tanh,,39,3,23.0,4.0,,0.00562513106075196,3,115,0.7687788924223313,9.113941137004387e-05,140.1765350341797,COMPLETE
372,0.1786947250366211,2023-09-04 11:56:29.585095,2023-09-04 11:56:31.323541,0 days 00:00:01.738446,Leaky,Tanh,Tanh,Sigmoid,36,22,20.0,6.0,22.0,0.0032923856509390784,4,130,0.6446358614246113,6.0123016081107685e-05,80.10298767089844,COMPLETE
373,0.23143479228019714,2023-09-04 11:56:31.323993,2023-09-04 11:56:31.700897,0 days 00:00:00.376904,Leaky,Tanh,,,40,23,19.0,,,0.007379199193003114,2,468,0.2786755724426871,0.0032214826500085707,98.70453488096899,COMPLETE
374,0.19666694104671478,2023-09-04 11:56:31.701235,2023-09-04 11:56:32.389168,0 days 00:00:00.687933,Leaky,Leaky,Tanh,Sigmoid,33,22,19.0,10.0,7.0,0.013221465102385442,4,151,0.698494936676393,0.0001120261390157319,86.90369354248047,COMPLETE
375,0.2373114675283432,2023-09-04 11:56:32.389510,2023-09-04 11:56:34.140235,0 days 00:00:01.750725,Tanh,Tanh,Tanh,Sigmoid,37,23,24.0,11.0,19.0,0.0009906365066023601,4,460,0.5075049076832526,4.062179033052552e-05,111.23094130535515,COMPLETE
376,0.22798393666744232,2023-09-04 11:56:34.140590,2023-09-04 11:56:35.004160,0 days 00:00:00.863570,Leaky,Tanh,Sigmoid,Sigmoid,35,22,20.0,9.0,16.0,0.0619227025460421,4,122,0.769085331657002,0.00020388718111459062,150.93938802083332,COMPLETE
377,0.20106908679008484,2023-09-04 11:56:35.004502,2023-09-04 11:56:40.532855,0 days 00:00:05.528353,Leaky,Tanh,Tanh,Leaky,39,24,22.0,8.0,8.0,0.00029673607926548326,4,128,0.73114107190637,3.265595757393805e-05,96.78417350832096,COMPLETE
378,0.16101373732089996,2023-09-04 11:56:40.533223,2023-09-04 11:56:42.107614,0 days 00:00:01.574391,Leaky,Tanh,Leaky,Sigmoid,37,23,21.0,10.0,5.0,0.010199536052328288,4,147,0.7998114695111825,4.657426321249928e-05,97.66592326917146,COMPLETE
379,0.25703802704811096,2023-09-04 11:56:42.107964,2023-09-04 11:56:43.991018,0 days 00:00:01.883054,Leaky,Tanh,Leaky,Sigmoid,37,10,21.0,7.0,5.0,0.00046652975479189915,4,212,0.24147965859445722,0.00019490429496120775,103.11380127241027,COMPLETE
380,0.22861404716968536,2023-09-04 11:56:43.991364,2023-09-04 11:56:47.290611,0 days 00:00:03.299247,Sigmoid,Tanh,Leaky,Sigmoid,34,22,20.0,6.0,5.0,0.0007067394546448586,4,247,0.3602851815706704,4.7412903929107e-05,97.26410313656456,COMPLETE
381,0.19941210746765137,2023-09-04 11:56:47.290960,2023-09-04 11:56:47.875451,0 days 00:00:00.584491,Leaky,Tanh,Leaky,,41,12,21.0,9.0,,0.01044912861086469,3,457,0.7925008645833419,4.113468729279611e-05,75.68781295189491,COMPLETE
382,0.19508443772792816,2023-09-04 11:56:47.875801,2023-09-04 11:56:48.345305,0 days 00:00:00.469504,Tanh,Tanh,,,38,21,20.0,,,0.014487668015728563,2,398,0.42138456060085516,0.0002945095238695339,111.2875736781529,COMPLETE
383,0.20834554731845856,2023-09-04 11:56:48.345625,2023-09-04 11:56:48.801817,0 days 00:00:00.456192,Leaky,Tanh,Leaky,Sigmoid,32,20,19.0,8.0,3.0,0.011923820514174602,4,328,0.4259728671108954,0.00035828831347856294,105.53847595214843,COMPLETE
384,0.23390288650989532,2023-09-04 11:56:48.802161,2023-09-04 11:56:49.271013,0 days 00:00:00.468852,Leaky,Tanh,Leaky,Sigmoid,35,20,21.0,9.0,4.0,0.019122745022071234,4,500,0.7981313022680273,0.020346439017805022,173.98800252278645,COMPLETE
385,0.17353476583957672,2023-09-04 11:56:49.271374,2023-09-04 11:56:49.968133,0 days 00:00:00.696759,Leaky,ReLU,Leaky,Sigmoid,40,21,19.0,5.0,5.0,0.01503516558387829,4,414,0.6183877506899907,3.496479467561071e-05,80.95746693466648,COMPLETE
386,0.1787422001361847,2023-09-04 11:56:49.968489,2023-09-04 11:56:50.786027,0 days 00:00:00.817538,Leaky,ReLU,Leaky,Sigmoid,40,22,20.0,5.0,5.0,0.014243534605441971,4,422,0.6532320181871434,3.484086487785375e-05,96.83309256063926,COMPLETE
387,0.1673898547887802,2023-09-04 11:56:50.786381,2023-09-04 11:56:51.772824,0 days 00:00:00.986443,Leaky,ReLU,Leaky,Sigmoid,29,21,19.0,5.0,5.0,0.010536431137671583,4,411,0.6024572782361868,0.0004371317162977785,83.68007536192198,COMPLETE
388,0.20598609745502472,2023-09-04 11:56:51.773183,2023-09-04 11:56:52.740367,0 days 00:00:00.967184,Leaky,ReLU,Leaky,Sigmoid,29,21,18.0,4.0,2.0,0.010243727327306466,4,430,0.6813043447420174,0.00048473671712679896,105.09718253395774,COMPLETE
389,0.20693425834178925,2023-09-04 11:56:52.740721,2023-09-04 11:56:53.739530,0 days 00:00:00.998809,Tanh,ReLU,Leaky,Sigmoid,29,22,21.0,6.0,4.0,0.009574108158595792,4,169,0.6181816761187897,0.0007356216609333058,132.45522060909786,COMPLETE
390,0.18745157122612,2023-09-04 11:56:53.739902,2023-09-04 11:56:54.408178,0 days 00:00:00.668276,Leaky,ReLU,,,32,24,19.0,,,0.006542720906931301,2,103,0.6590537690555185,0.0001555750221146578,70.49341441563197,COMPLETE
391,0.20089790225028992,2023-09-04 11:56:54.408524,2023-09-04 11:56:55.262332,0 days 00:00:00.853808,Leaky,ReLU,Leaky,Sigmoid,28,21,18.0,5.0,7.0,0.011573605809545405,4,446,0.7103389742787029,0.00042040440116277795,124.71984552454066,COMPLETE
392,0.20458975434303284,2023-09-04 11:56:55.262671,2023-09-04 11:56:56.356828,0 days 00:00:01.094157,Leaky,ReLU,Leaky,Sigmoid,31,22,20.0,18.0,4.0,0.007785065876949099,4,432,0.751954582496505,0.0007251061858554323,111.55469294956752,COMPLETE
393,0.159135103225708,2023-09-04 11:56:56.357170,2023-09-04 11:56:57.905547,0 days 00:00:01.548377,Leaky,Tanh,Leaky,Sigmoid,27,13,19.0,6.0,12.0,0.0122580527902899,4,417,0.7988162708059954,1.4766269082594926e-05,74.28647084669633,COMPLETE
394,0.2027938961982727,2023-09-04 11:56:57.905894,2023-09-04 11:56:58.613078,0 days 00:00:00.707184,Leaky,Tanh,Leaky,Sigmoid,25,13,19.0,6.0,12.0,0.012463989857196933,4,407,0.5688366806242252,0.00021091633936269993,88.69408081054688,COMPLETE
395,0.21774795651435852,2023-09-04 11:56:58.613429,2023-09-04 11:56:59.115112,0 days 00:00:00.501683,Leaky,Leaky,Leaky,Sigmoid,28,22,19.0,5.0,13.0,0.009702467941867706,4,412,0.3540318243222339,1.4532259536829523e-05,119.55599975585938,COMPLETE
396,0.19394932687282562,2023-09-04 11:56:59.115471,2023-09-04 11:57:02.284918,0 days 00:00:03.169447,Leaky,Tanh,Leaky,Sigmoid,30,13,19.0,6.0,11.0,0.0006128204766136448,4,423,0.7722438934806819,0.0004901722635664721,192.42566584614875,COMPLETE
397,0.21046647429466248,2023-09-04 11:57:02.285262,2023-09-04 11:57:05.718941,0 days 00:00:03.433679,Leaky,Tanh,Leaky,Sigmoid,26,14,20.0,6.0,12.0,0.0008170392088428691,4,407,0.7978962725736238,0.0003439067543203989,96.88326644897461,COMPLETE
398,0.17255444824695587,2023-09-04 11:57:05.719315,2023-09-04 11:57:07.378373,0 days 00:00:01.659058,Leaky,Tanh,Leaky,Sigmoid,27,13,18.0,4.0,21.0,0.011844745461167424,4,419,0.798588210117342,0.0011906186647390837,118.21532224572223,COMPLETE
399,0.20462894439697266,2023-09-04 11:57:07.378739,2023-09-04 11:57:08.383129,0 days 00:00:01.004390,Leaky,Tanh,Leaky,Sigmoid,26,13,18.0,4.0,12.0,0.012874189377589934,4,392,0.7970960263746423,0.0009764528428995336,455.7225906937211,COMPLETE
400,0.2309037744998932,2023-09-04 11:57:08.383482,2023-09-04 11:57:09.403146,0 days 00:00:01.019664,Leaky,ReLU,Leaky,Sigmoid,28,14,18.0,6.0,11.0,0.015080854494449058,4,413,0.7666582135536666,0.0015448354763373338,87.99378712972005,COMPLETE
401,0.1690681278705597,2023-09-04 11:57:09.403499,2023-09-04 11:57:10.214938,0 days 00:00:00.811439,Leaky,Tanh,Leaky,Sigmoid,27,14,18.0,5.0,21.0,0.01677131223431062,4,402,0.7999025128951133,1.661804813319181e-05,79.22857423262163,COMPLETE
402,0.22233261168003082,2023-09-04 11:57:10.215295,2023-09-04 11:57:11.066677,0 days 00:00:00.851382,Leaky,Tanh,Leaky,Sigmoid,22,15,18.0,5.0,22.0,0.016652293903871823,4,423,0.43819992138971414,1.5650758764340157e-05,215.35257568359376,COMPLETE
403,0.23466050624847412,2023-09-04 11:57:11.067039,2023-09-04 11:57:11.835902,0 days 00:00:00.768863,Leaky,Tanh,Leaky,Sigmoid,28,21,19.0,3.0,11.0,0.0047537019620169495,4,400,0.3316075676419073,1.7567727855884985e-05,84.83261596679688,COMPLETE
404,0.20414961874485016,2023-09-04 11:57:11.836277,2023-09-04 11:57:12.470023,0 days 00:00:00.633746,Leaky,Tanh,Leaky,Sigmoid,29,14,19.0,5.0,21.0,0.018247320573330606,4,387,0.7613413936785418,0.0002240546269818452,94.70162522165398,COMPLETE
405,0.1542137861251831,2023-09-04 11:57:12.470386,2023-09-04 11:57:14.004574,0 days 00:00:01.534188,Leaky,Tanh,Leaky,Sigmoid,46,14,17.0,5.0,21.0,0.008457822380928364,4,431,0.7506525923232801,1.2296190419317742e-05,74.18484534680003,COMPLETE
406,0.19577687978744507,2023-09-04 11:57:14.004923,2023-09-04 11:57:14.766232,0 days 00:00:00.761309,Leaky,Tanh,Leaky,Sigmoid,47,14,17.0,5.0,21.0,0.006925378355339786,4,428,0.4675229042880104,1.194868282480828e-05,106.55438571506076,COMPLETE
407,0.23817715048789978,2023-09-04 11:57:14.766592,2023-09-04 11:57:16.304897,0 days 00:00:01.538305,Leaky,Tanh,Leaky,Sigmoid,24,14,17.0,4.0,20.0,0.0011362446495831115,4,379,0.38860788209057284,1.166733426096726e-05,92.63998866986624,COMPLETE
408,0.19520507752895355,2023-09-04 11:57:16.305266,2023-09-04 11:57:20.096240,0 days 00:00:03.790974,Leaky,Tanh,Leaky,Sigmoid,46,13,17.0,5.0,20.0,0.0005635185351275564,4,414,0.7678983086741026,1.2948309389504132e-05,84.06816508553244,COMPLETE
409,0.24642986059188843,2023-09-04 11:57:20.096582,2023-09-04 11:57:20.375023,0 days 00:00:00.278441,Leaky,Tanh,Leaky,Sigmoid,44,14,18.0,5.0,20.0,0.00807425201006122,4,402,0.18332608986791277,1.4211435250970763e-05,106.2384254259941,COMPLETE
410,0.20404675602912903,2023-09-04 11:57:20.375370,2023-09-04 11:57:21.823838,0 days 00:00:01.448468,Sigmoid,ReLU,Leaky,Sigmoid,48,15,18.0,6.0,22.0,0.0055042792855203755,4,438,0.7403456579081182,1.7187692027475905e-05,122.28935186413752,COMPLETE
411,0.21791820228099823,2023-09-04 11:57:21.824181,2023-09-04 11:57:22.749156,0 days 00:00:00.924975,Leaky,Leaky,Leaky,Sigmoid,46,12,17.0,6.0,21.0,0.009135474846861228,4,434,0.5836869761364673,0.0003057274030390178,80.35281004729094,COMPLETE
412,0.17909882962703705,2023-09-04 11:57:22.749505,2023-09-04 11:57:23.551463,0 days 00:00:00.801958,Leaky,Sigmoid,Leaky,Sigmoid,45,14,19.0,5.0,23.0,0.021502795720107788,4,425,0.6041762029566218,0.0005273611519926016,107.93108680031516,COMPLETE
413,0.18291233479976654,2023-09-04 11:57:23.551810,2023-09-04 11:57:27.638075,0 days 00:00:04.086265,Leaky,Tanh,Leaky,Sigmoid,48,14,13.0,7.0,21.0,0.00044074595110856656,4,447,0.7980813473068219,1.056362513948623e-05,87.0685744472056,COMPLETE
414,0.20404435694217682,2023-09-04 11:57:27.638441,2023-09-04 11:57:39.468917,0 days 00:00:11.830476,Leaky,Tanh,ReLU,Sigmoid,27,12,17.0,4.0,21.0,0.00015315026013489012,4,414,0.6955100067169322,1.9569131740329178e-05,170.92587896493765,COMPLETE
415,1.010147213935852,2023-09-04 11:57:39.469293,2023-09-04 11:57:40.036472,0 days 00:00:00.567179,Leaky,Sigmoid,Leaky,Sigmoid,23,14,18.0,6.0,19.0,0.017006556208421092,4,333,0.6397801496649165,0.09013860098318739,114.67346649169922,COMPLETE
416,0.21864546835422516,2023-09-04 11:57:40.036831,2023-09-04 11:57:40.877070,0 days 00:00:00.840239,Leaky,Tanh,Sigmoid,Sigmoid,30,13,17.0,7.0,7.0,0.008014880734232066,4,437,0.3051123091532943,1.4906001060742156e-05,115.61880000945061,COMPLETE
417,0.1987771838903427,2023-09-04 11:57:40.877435,2023-09-04 11:57:42.676637,0 days 00:00:01.799202,Leaky,Sigmoid,Leaky,Sigmoid,44,13,19.0,6.0,20.0,0.0026780361971852303,4,453,0.7520303445012688,1.894825764893387e-05,90.89786954469318,COMPLETE
418,0.17654527723789215,2023-09-04 11:57:42.677004,2023-09-04 11:57:43.980160,0 days 00:00:01.303156,Leaky,Tanh,Leaky,Leaky,50,11,14.0,7.0,22.0,0.01475274601627265,4,428,0.684279017609334,0.0005538300443127899,69.69629181132598,COMPLETE
419,0.26447615027427673,2023-09-04 11:57:43.980515,2023-09-04 11:57:44.285372,0 days 00:00:00.304857,Leaky,Sigmoid,Leaky,Sigmoid,26,15,11.0,6.0,6.0,0.01030258360925777,4,444,0.1500700219472319,0.00023426726607098195,120.97969556535993,COMPLETE
420,0.18063658475875854,2023-09-04 11:57:44.285726,2023-09-04 11:57:45.470610,0 days 00:00:01.184884,Leaky,Tanh,Sigmoid,Sigmoid,46,14,18.0,4.0,13.0,0.006406392690413917,4,419,0.7989504450852395,1.0022638590137775e-05,85.5516544342041,COMPLETE
421,0.21758735179901123,2023-09-04 11:57:45.471220,2023-09-04 11:57:47.814485,0 days 00:00:02.343265,ReLU,Sigmoid,Leaky,Sigmoid,43,15,18.0,5.0,7.0,0.0034788686071370333,4,408,0.22429319583604293,1.3520753775976321e-05,126.75516086816788,COMPLETE
422,0.17165283858776093,2023-09-04 11:57:47.814841,2023-09-04 11:57:48.841466,0 days 00:00:01.026625,Leaky,Tanh,Leaky,Sigmoid,31,21,19.0,7.0,21.0,0.013261034754152462,4,436,0.7198940274109156,0.00017329095438054434,77.367883570054,COMPLETE
423,0.20946532487869263,2023-09-04 11:57:48.841816,2023-09-04 11:57:49.585052,0 days 00:00:00.743236,Leaky,Tanh,Leaky,Sigmoid,31,7,19.0,5.0,22.0,0.013196475631979074,4,367,0.5515988861199874,0.00028782827075918884,125.7928295135498,COMPLETE
424,0.18279454112052917,2023-09-04 11:57:49.585424,2023-09-04 11:57:51.144413,0 days 00:00:01.558989,Leaky,Sigmoid,Leaky,Sigmoid,31,13,20.0,7.0,21.0,0.017608180208507095,4,449,0.7184150688837657,0.0001503057340370968,113.2517952109283,COMPLETE
425,0.31219610571861267,2023-09-04 11:57:51.144759,2023-09-04 11:57:51.280296,0 days 00:00:00.135537,Leaky,Tanh,Leaky,Leaky,29,21,19.0,6.0,20.0,0.011670118241537308,4,458,0.10381064384527827,0.0001824838631997413,105.09652530445771,COMPLETE
426,0.22578397393226624,2023-09-04 11:57:51.280647,2023-09-04 11:57:51.660093,0 days 00:00:00.379446,Leaky,ReLU,Leaky,Sigmoid,18,14,19.0,10.0,22.0,0.008908639181481914,4,440,0.2044579552626685,0.00017839836524770182,248.3416379292806,COMPLETE
427,0.22971554100513458,2023-09-04 11:57:51.660500,2023-09-04 11:57:51.989676,0 days 00:00:00.329176,Leaky,Sigmoid,Leaky,Sigmoid,33,21,23.0,11.0,20.0,0.023055588992802876,4,432,0.24852848053301146,0.00012452109690336258,143.5887407575335,COMPLETE
428,0.20520581305027008,2023-09-04 11:57:51.990049,2023-09-04 11:57:52.693793,0 days 00:00:00.703744,Leaky,Tanh,Leaky,Sigmoid,31,22,20.0,7.0,8.0,0.014292683981538623,4,184,0.3751235534873821,0.00026477934354503767,86.05940482729957,COMPLETE
429,0.21643781661987305,2023-09-04 11:57:52.694266,2023-09-04 11:57:53.770419,0 days 00:00:01.076153,Leaky,Tanh,Leaky,Sigmoid,27,21,19.0,8.0,21.0,0.01928579326246627,4,462,0.6612157649911793,0.000123319073995061,128.5142344306497,COMPLETE
430,1.0022220611572266,2023-09-04 11:57:53.770787,2023-09-04 11:57:54.359230,0 days 00:00:00.588443,Sigmoid,Sigmoid,Sigmoid,Sigmoid,24,22,21.0,10.0,10.0,0.0041015553222771275,4,278,0.6931846852833564,0.0054284017696007115,99.90757649739584,COMPLETE
431,0.20317041873931885,2023-09-04 11:57:54.359603,2023-09-04 11:57:55.100474,0 days 00:00:00.740871,Leaky,Tanh,ReLU,Sigmoid,14,21,22.0,6.0,21.0,0.010669132335841491,4,440,0.2709422363305782,0.00035498266484900804,185.766478753859,COMPLETE
432,0.20792745053768158,2023-09-04 11:57:55.100915,2023-09-04 11:57:56.453115,0 days 00:00:01.352200,Leaky,,,,32,15,,,,0.0020163566138316296,1,450,0.7208182507307881,9.769065056862074e-05,120.329309351304,COMPLETE
433,0.2023540735244751,2023-09-04 11:57:56.453536,2023-09-04 11:57:57.878786,0 days 00:00:01.425250,ReLU,Sigmoid,Leaky,Leaky,30,14,19.0,7.0,12.0,0.001288660868550297,4,437,0.5298023041580413,1.7250104741275382e-05,197.88351186116537,COMPLETE
434,0.2108897566795349,2023-09-04 11:57:57.879255,2023-09-04 11:57:59.950003,0 days 00:00:02.070748,Leaky,Tanh,Leaky,Sigmoid,28,12,12.0,6.0,23.0,0.0016701125536069074,4,423,0.739827217897288,1.2625999636742686e-05,109.49170672704302,COMPLETE
435,0.19901520013809204,2023-09-04 11:57:59.950454,2023-09-04 11:58:01.589758,0 days 00:00:01.639304,Leaky,Sigmoid,Sigmoid,Sigmoid,34,16,18.0,3.0,9.0,0.013807349015421777,4,455,0.6446530166270549,0.00015269989798733015,94.12979810378131,COMPLETE
436,0.19058659672737122,2023-09-04 11:58:01.590201,2023-09-04 11:58:02.817203,0 days 00:00:01.227002,Leaky,Tanh,Leaky,Sigmoid,25,21,20.0,5.0,14.0,0.007596254038102523,4,346,0.6847696527098293,1.5755847153059034e-05,92.68300285339356,COMPLETE
437,0.1945599466562271,2023-09-04 11:58:02.817559,2023-09-04 11:58:04.661219,0 days 00:00:01.843660,Leaky,Tanh,Leaky,Sigmoid,33,24,19.0,10.0,9.0,0.009366366329730005,4,446,0.7634812207644256,0.000224582718999704,94.47284162044525,COMPLETE
438,0.23732616007328033,2023-09-04 11:58:04.661671,2023-09-04 11:58:05.079542,0 days 00:00:00.417871,Leaky,Leaky,Leaky,Sigmoid,29,22,18.0,8.0,11.0,0.01111712457615429,4,79,0.2845698749939205,0.0004244006123857239,101.87726051576676,COMPLETE
439,0.2078164666891098,2023-09-04 11:58:05.079901,2023-09-04 11:58:05.473869,0 days 00:00:00.393968,Leaky,Sigmoid,Sigmoid,Sigmoid,51,13,18.0,7.0,10.0,0.01725215473649417,4,398,0.40633326923342705,2.2746586025432644e-05,94.68326258659363,COMPLETE
440,0.21579812467098236,2023-09-04 11:58:05.474214,2023-09-04 11:58:05.921768,0 days 00:00:00.447554,Leaky,ReLU,Leaky,Sigmoid,42,20,7.0,5.0,21.0,0.012895333439630135,4,465,0.5937548283065731,1.2386192863162957e-05,102.79069969870828,COMPLETE
441,0.17862741649150848,2023-09-04 11:58:05.922123,2023-09-04 11:58:06.505765,0 days 00:00:00.583642,Leaky,Tanh,Tanh,Leaky,48,18,18.0,10.0,8.0,0.021213707459770213,4,299,0.7263634270696249,1.9603553029510683e-05,115.84816685429325,COMPLETE
442,0.1679774969816208,2023-09-04 11:58:06.506112,2023-09-04 11:58:07.353201,0 days 00:00:00.847089,Leaky,Sigmoid,Leaky,Sigmoid,83,21,15.0,8.0,7.0,0.016389695923455322,4,433,0.7637095740523651,1.5416806928790144e-05,151.51337031314247,COMPLETE
443,0.2570233643054962,2023-09-04 11:58:07.353567,2023-09-04 11:58:07.857619,0 days 00:00:00.504052,Leaky,Sigmoid,Tanh,Sigmoid,99,8,14.0,9.0,7.0,0.026259243095699117,4,415,0.7583324846159387,0.0020276812386583,115.18128376622354,COMPLETE
444,0.36409491300582886,2023-09-04 11:58:07.857963,2023-09-04 11:58:11.747806,0 days 00:00:03.889843,Leaky,Sigmoid,ReLU,Sigmoid,83,23,16.0,8.0,7.0,6.509149892540909e-05,4,427,0.47655372544432784,1.4643369224919954e-05,144.82677540120253,COMPLETE
445,0.20265653729438782,2023-09-04 11:58:11.748158,2023-09-04 11:58:14.803677,0 days 00:00:03.055519,ReLU,Sigmoid,Tanh,Sigmoid,10,21,15.0,9.0,8.0,0.005350480027881126,4,449,0.764589608000813,0.0005897639209469731,120.83389199746621,COMPLETE
446,0.19623702764511108,2023-09-04 11:58:14.804034,2023-09-04 11:58:15.397938,0 days 00:00:00.593904,Leaky,Sigmoid,Leaky,Sigmoid,96,20,15.0,8.0,7.0,0.016452744496030947,4,461,0.7436827183160019,1.6106318174587745e-05,108.53053283691406,COMPLETE
447,0.1682661920785904,2023-09-04 11:58:15.398303,2023-09-04 11:58:16.826126,0 days 00:00:01.427823,Leaky,Sigmoid,Tanh,Sigmoid,53,22,14.0,9.0,3.0,0.019954172588406847,4,420,0.7999506976587567,2.008386185474826e-05,98.30853563196519,COMPLETE
448,0.20526380836963654,2023-09-04 11:58:16.826488,2023-09-04 11:58:17.674751,0 days 00:00:00.848263,Leaky,Sigmoid,Tanh,Leaky,53,23,14.0,12.0,4.0,0.025276175844013975,4,406,0.7704653365431947,0.0009540544109493756,112.7176034109933,COMPLETE
449,0.23300406336784363,2023-09-04 11:58:17.675130,2023-09-04 11:58:19.847993,0 days 00:00:02.172863,Leaky,Sigmoid,Sigmoid,Sigmoid,53,22,14.0,11.0,2.0,0.0015093413756051839,4,416,0.7970540411096017,2.1516940862751226e-05,243.04102681477863,COMPLETE
450,0.17812427878379822,2023-09-04 11:58:19.848363,2023-09-04 11:58:20.534850,0 days 00:00:00.686487,Leaky,Sigmoid,Tanh,Sigmoid,56,22,15.0,9.0,2.0,0.0196813354271612,4,421,0.7697537676359444,1.1653120124326022e-05,133.48599332921646,COMPLETE
451,0.24143777787685394,2023-09-04 11:58:20.535231,2023-09-04 11:58:21.251697,0 days 00:00:00.716466,Leaky,Sigmoid,Leaky,Sigmoid,54,23,13.0,10.0,4.0,0.007243097799238179,4,430,0.2967287920236245,2.5604524441957222e-05,116.99470065888904,COMPLETE
452,0.20205093920230865,2023-09-04 11:58:21.252070,2023-09-04 11:58:22.650753,0 days 00:00:01.398683,Leaky,Sigmoid,Tanh,Sigmoid,52,24,14.0,4.0,3.0,0.008839305424269053,4,394,0.799578948146745,1.01647286488156e-05,106.01026176683831,COMPLETE
