number,value,datetime_start,datetime_complete,duration,params_activation1,params_activation2,params_activation3,params_activation4,params_batch_size,params_fl1,params_fl2,params_fl3,params_fl4,params_learning_rate,params_n_layers,params_num_epochs,params_train_size,params_weight_decay,user_attrs_mre,state
373,0.16753974556922913,2023-09-04 11:54:02.739679,2023-09-04 11:54:03.587879,0 days 00:00:00.848200,Tanh,Tanh,ReLU,Sigmoid,72,21,10.0,16.0,24.0,0.004957404632445998,4,487,0.5943216028412784,0.0006242595668639516,121.74496107835036,COMPLETE
374,0.24124950170516968,2023-09-04 11:54:03.588250,2023-09-04 11:54:04.313874,0 days 00:00:00.725624,Tanh,Tanh,Sigmoid,Leaky,74,23,8.0,17.0,21.0,0.0033710858930804145,4,461,0.5670975295766684,0.0009678095175629982,163.93315467834472,COMPLETE
375,0.1307544708251953,2023-09-04 11:54:04.314216,2023-09-04 11:54:05.153034,0 days 00:00:00.838818,Leaky,Tanh,ReLU,Leaky,77,22,11.0,14.0,23.0,0.004338623032790902,4,480,0.6287857332186976,0.0005285148356843322,79.38164179875301,COMPLETE
376,0.21112185716629028,2023-09-04 11:54:05.153371,2023-09-04 11:54:05.882015,0 days 00:00:00.728644,Leaky,Tanh,ReLU,Leaky,77,22,11.0,14.0,23.0,0.0017504599563854363,4,481,0.6242430172595831,0.001333709702049753,86.31806346348354,COMPLETE
377,0.305831640958786,2023-09-04 11:54:05.882357,2023-09-04 11:54:06.688425,0 days 00:00:00.806068,Leaky,Tanh,ReLU,Leaky,78,22,3.0,14.0,22.0,0.004340621290356985,4,472,0.6583977415914528,0.07761217657140286,127.4464298830194,COMPLETE
378,0.22568385303020477,2023-09-04 11:54:06.688758,2023-09-04 11:54:07.402784,0 days 00:00:00.714026,Leaky,Tanh,ReLU,Leaky,75,22,11.0,15.0,23.0,0.0012675916811778147,4,423,0.5643101357674658,0.0005926616914118443,77.74099013010661,COMPLETE
379,0.2569091320037842,2023-09-04 11:54:07.403128,2023-09-04 11:54:08.091126,0 days 00:00:00.687998,Leaky,Tanh,ReLU,Sigmoid,80,21,1.0,17.0,24.0,0.0024789688905643573,4,465,0.6238455501652016,0.0008103374199850837,163.35574651647497,COMPLETE
380,0.15112976729869843,2023-09-04 11:54:08.091494,2023-09-04 11:54:09.111843,0 days 00:00:01.020349,Leaky,Tanh,ReLU,Leaky,71,23,9.0,16.0,21.0,0.0033611703915725536,4,450,0.6859280625086748,0.0005434349346441715,82.68950050464575,COMPLETE
381,0.17837685346603394,2023-09-04 11:54:09.112272,2023-09-04 11:54:09.941016,0 days 00:00:00.828744,Tanh,Tanh,ReLU,Leaky,56,22,11.0,18.0,20.0,0.005071188943913159,4,489,0.7612213852095527,0.0007130960050460656,111.69630559285481,COMPLETE
382,0.17464202642440796,2023-09-04 11:54:09.941350,2023-09-04 11:54:11.016648,0 days 00:00:01.075298,Tanh,Tanh,ReLU,Sigmoid,78,21,11.0,14.0,18.0,0.004003400344050761,4,500,0.653933848041848,0.0011186041481221086,93.22299157567771,COMPLETE
383,0.11506849527359009,2023-09-04 11:54:11.017068,2023-09-04 11:54:11.959290,0 days 00:00:00.942222,Leaky,Tanh,,,69,23,10.0,,,0.00697669572817365,2,475,0.7694531961554419,0.0004742222580850204,608.2939444986979,COMPLETE
384,0.24426479637622833,2023-09-04 11:54:11.959633,2023-09-04 11:54:12.900644,0 days 00:00:00.941011,Leaky,Tanh,Leaky,Leaky,69,24,2.0,15.0,23.0,0.005907363047354365,4,458,0.7616556173725203,0.0004756240000599874,399.7594176701137,COMPLETE
385,0.17908309400081635,2023-09-04 11:54:12.900986,2023-09-04 11:54:18.055390,0 days 00:00:05.154404,Leaky,Tanh,,,69,13,11.0,,,0.000667557522547943,2,473,0.7149993605656834,0.000337756282320898,101.98309939218146,COMPLETE
386,0.1984807252883911,2023-09-04 11:54:18.055751,2023-09-04 11:54:18.872471,0 days 00:00:00.816720,Leaky,Tanh,,,68,23,10.0,,,0.0072755393286513415,2,440,0.771167223414027,5.167205617799908e-05,70.97863285125248,COMPLETE
387,0.21753396093845367,2023-09-04 11:54:18.872799,2023-09-04 11:54:19.550802,0 days 00:00:00.678003,Leaky,Tanh,,,72,23,12.0,,,0.004456478526004032,2,463,0.739644726173378,0.0005000999080917489,130.17026575261897,COMPLETE
388,0.16862648725509644,2023-09-04 11:54:19.551139,2023-09-04 11:54:20.928412,0 days 00:00:01.377273,Leaky,Tanh,,,66,23,10.0,,,0.002103988548125645,2,476,0.7063336178306537,0.0005947928702326499,102.20990062582082,COMPLETE
389,0.24198293685913086,2023-09-04 11:54:20.928736,2023-09-04 11:54:22.820111,0 days 00:00:01.891375,Sigmoid,,,,67,11,,,,0.0054358387512059994,1,450,0.7989858921836348,0.00046238293563676984,133.503706851248,COMPLETE
390,0.21098214387893677,2023-09-04 11:54:22.820428,2023-09-04 11:54:24.780854,0 days 00:00:01.960426,Leaky,Tanh,,,81,22,11.0,,,0.0028490490246272995,2,466,0.7647386201080144,0.00034486987758722634,93.80112752749052,COMPLETE
391,0.2749883532524109,2023-09-04 11:54:24.781168,2023-09-04 11:54:25.002046,0 days 00:00:00.220878,Leaky,Tanh,,,74,22,12.0,,,0.007278127119610184,2,479,0.19818545556326422,0.0006858326541231593,461.0964738325639,COMPLETE
392,0.1559087336063385,2023-09-04 11:54:25.002356,2023-09-04 11:54:26.127377,0 days 00:00:01.125021,Tanh,Tanh,ReLU,Tanh,80,23,12.0,16.0,24.0,0.0036980313898408966,4,458,0.7382924205492833,0.0005374763539080044,72.97545598682605,COMPLETE
393,0.16073884069919586,2023-09-04 11:54:26.127726,2023-09-04 11:54:26.884539,0 days 00:00:00.756813,Tanh,Tanh,Sigmoid,ReLU,73,24,13.0,13.0,19.0,0.00554513547762059,4,327,0.6864230777003275,0.0003866956321829634,100.90770427997296,COMPLETE
394,0.2056708186864853,2023-09-04 11:54:26.884888,2023-09-04 11:54:28.338817,0 days 00:00:01.453929,Tanh,,,,52,21,,,,0.0046266170357204366,1,472,0.7702749874933487,0.000763975669265083,162.42052175230899,COMPLETE
395,0.30456456542015076,2023-09-04 11:54:28.339124,2023-09-04 11:54:28.518670,0 days 00:00:00.179546,Tanh,Tanh,ReLU,Leaky,70,22,23.0,17.0,22.0,0.006622804234403335,4,468,0.1910269393590749,0.0006020879135518105,115.43158590382544,COMPLETE
396,0.13462282717227936,2023-09-04 11:54:28.518994,2023-09-04 11:54:29.246182,0 days 00:00:00.727188,Tanh,Tanh,ReLU,Leaky,76,21,10.0,15.0,17.0,0.039867916411505055,4,484,0.7173330292919438,0.0009297614834507347,532.3435376485189,COMPLETE
397,0.1691976636648178,2023-09-04 11:54:29.246590,2023-09-04 11:54:30.054593,0 days 00:00:00.808003,Leaky,Tanh,,,84,23,23.0,,,0.004128499334266364,2,449,0.7418285098587588,0.0004503135186888934,80.7077318297492,COMPLETE
398,0.2995891869068146,2023-09-04 11:54:30.054919,2023-09-04 11:54:30.477798,0 days 00:00:00.422879,Tanh,Tanh,ReLU,Leaky,79,23,11.0,16.0,21.0,0.0030661388606318314,4,460,0.1728105911565268,2.4080614448809117e-05,490.72737393520845,COMPLETE
399,0.1676688939332962,2023-09-04 11:54:30.478151,2023-09-04 11:54:31.375612,0 days 00:00:00.897461,Sigmoid,Tanh,ReLU,Leaky,82,20,12.0,15.0,12.0,0.006927524528087421,4,481,0.6048386084433321,0.0003257488566675995,95.36531283404376,COMPLETE
400,0.22828765213489532,2023-09-04 11:54:31.375962,2023-09-04 11:54:32.598830,0 days 00:00:01.222868,Tanh,Tanh,ReLU,Leaky,71,22,23.0,19.0,8.0,0.005466943258324371,4,491,0.68012898724943,0.005174403987818494,118.14101400493104,COMPLETE
401,0.2924363613128662,2023-09-04 11:54:32.599178,2023-09-04 11:54:32.994806,0 days 00:00:00.395628,Tanh,ReLU,ReLU,Leaky,64,21,23.0,12.0,23.0,0.06979023870637882,4,357,0.709273509623033,1.6529291219941866e-05,106.12678770585494,COMPLETE
402,0.28456929326057434,2023-09-04 11:54:32.995150,2023-09-04 11:54:33.246896,0 days 00:00:00.251746,Tanh,Tanh,ReLU,Leaky,75,22,7.0,17.0,15.0,0.08887463676939533,4,470,0.7994914501954268,0.0005156251692253829,135.18137829120343,COMPLETE
403,0.12606148421764374,2023-09-04 11:54:33.247229,2023-09-04 11:54:34.396967,0 days 00:00:01.149738,Tanh,Tanh,ReLU,Tanh,79,20,17.0,13.0,2.0,0.004794915606138623,4,458,0.7683674998937791,0.0006721723087476096,93.98221003544795,COMPLETE
404,0.5075767040252686,2023-09-04 11:54:34.397316,2023-09-04 11:54:40.686885,0 days 00:00:06.289569,Leaky,Tanh,ReLU,Tanh,81,20,17.0,13.0,24.0,1.1036959236716023e-05,4,441,0.7650075701798685,0.0008324306986406104,122.95448531585485,COMPLETE
405,0.25123530626296997,2023-09-04 11:54:40.687218,2023-09-04 11:54:46.850593,0 days 00:00:06.163375,Tanh,Tanh,ReLU,Tanh,79,8,11.0,15.0,3.0,9.914749077942901e-05,4,448,0.7446698665814523,0.00038818042207880004,140.48424986430578,COMPLETE
406,0.18320147693157196,2023-09-04 11:54:46.850924,2023-09-04 11:54:47.721306,0 days 00:00:00.870382,Tanh,Tanh,Leaky,Tanh,84,9,14.0,14.0,22.0,0.0036335632655083287,4,452,0.7998787341796016,0.000710196039215768,98.62505558558873,COMPLETE
407,0.3511146605014801,2023-09-04 11:54:47.721648,2023-09-04 11:54:48.191222,0 days 00:00:00.469574,Tanh,Tanh,Sigmoid,Tanh,78,20,10.0,13.0,6.0,0.004777789933536073,4,371,0.22504427792696086,0.00029446731491910563,295.96304561780846,COMPLETE
408,0.24272574484348297,2023-09-04 11:54:48.191561,2023-09-04 11:54:49.235695,0 days 00:00:01.044134,Tanh,Tanh,ReLU,Tanh,60,20,13.0,13.0,22.0,0.004283823573388413,4,428,0.7702154921762373,0.00043998859914920414,159.2979326248169,COMPLETE
409,0.2523139417171478,2023-09-04 11:54:49.236074,2023-09-04 11:54:49.819595,0 days 00:00:00.583521,Leaky,Tanh,ReLU,Leaky,81,20,15.0,14.0,1.0,0.0027320028654158157,4,462,0.7239300208190022,0.0005577160800611534,144.8750482559204,COMPLETE
410,0.12648428976535797,2023-09-04 11:54:49.819953,2023-09-04 11:54:50.948499,0 days 00:00:01.128546,Tanh,Tanh,ReLU,ReLU,83,23,9.0,14.0,9.0,0.005716444641232331,4,458,0.741021194127167,1.3652782618471103e-05,53.942109441757204,COMPLETE
411,0.2279844433069229,2023-09-04 11:54:50.948839,2023-09-04 11:54:51.517289,0 days 00:00:00.568450,Tanh,,,,83,24,,,,0.005814847915295246,1,457,0.7011844508929017,3.83854535585514e-05,128.6484590768814,COMPLETE
412,0.18689991533756256,2023-09-04 11:54:51.517636,2023-09-04 11:54:57.562368,0 days 00:00:06.044732,Tanh,Tanh,ReLU,ReLU,82,23,9.0,14.0,8.0,0.0002224791024625027,4,446,0.7342490134159797,0.0003576166745677652,112.51655640195838,COMPLETE
413,0.33854514360427856,2023-09-04 11:54:57.562707,2023-09-04 11:54:57.788784,0 days 00:00:00.226077,Sigmoid,Tanh,ReLU,ReLU,80,24,10.0,14.0,10.0,0.00814606114440437,4,438,0.1660631952263547,2.849189115607103e-05,136.58115372003294,COMPLETE
414,0.5116038918495178,2023-09-04 11:54:57.789160,2023-09-04 11:54:58.008509,0 days 00:00:00.219349,Tanh,Tanh,ReLU,ReLU,84,20,9.0,13.0,2.0,0.00514744005417647,4,456,0.10026601935077134,1.2450357833528805e-05,164.41787375866528,COMPLETE
415,0.1470889002084732,2023-09-04 11:54:58.008872,2023-09-04 11:54:58.613683,0 days 00:00:00.604811,Tanh,Tanh,ReLU,ReLU,79,23,23.0,15.0,5.0,0.0061904048504170415,4,471,0.6813826428790153,0.00027792022153074565,641.0486542457758,COMPLETE
416,0.20557790994644165,2023-09-04 11:54:58.614022,2023-09-04 11:54:59.362528,0 days 00:00:00.748506,Tanh,Tanh,,,48,21,24.0,,,0.007363228040863878,2,472,0.7407420035367603,1.1962799556610572e-05,81.30074938138326,COMPLETE
417,0.18141548335552216,2023-09-04 11:54:59.362856,2023-09-04 11:55:00.237104,0 days 00:00:00.874248,Leaky,Tanh,Leaky,ReLU,82,10,24.0,12.0,13.0,0.010571727902049015,4,478,0.7048695405780134,0.0004569715110205375,68.81785476207733,COMPLETE
418,0.27780380845069885,2023-09-04 11:55:00.237444,2023-09-04 11:55:00.932262,0 days 00:00:00.694818,Tanh,Tanh,ReLU,Tanh,77,20,10.0,14.0,3.0,0.00184421728554081,4,464,0.18208374552922527,0.002010947267305633,156.8745027867759,COMPLETE
419,0.2555367946624756,2023-09-04 11:55:00.932599,2023-09-04 11:55:01.772962,0 days 00:00:00.840363,Tanh,Tanh,ReLU,Sigmoid,80,23,19.0,16.0,7.0,0.0014702529768291113,4,457,0.14799197900263691,4.966016560012078e-05,151.90667005170855,COMPLETE
420,0.29583969712257385,2023-09-04 11:55:01.773315,2023-09-04 11:55:02.000420,0 days 00:00:00.227105,Tanh,Tanh,ReLU,ReLU,83,20,8.0,15.0,9.0,0.00468869263259262,4,434,0.13921463763920935,8.153862421880032e-05,114.83251571655273,COMPLETE
421,0.328748881816864,2023-09-04 11:55:02.000774,2023-09-04 11:55:06.833858,0 days 00:00:04.833084,Leaky,Tanh,Sigmoid,Leaky,85,21,23.0,14.0,16.0,3.944561171168412e-05,4,346,0.7722341765753923,0.0006030198955672708,126.64020172295542,COMPLETE
422,0.2131819725036621,2023-09-04 11:55:06.834196,2023-09-04 11:55:07.385013,0 days 00:00:00.550817,Tanh,Tanh,ReLU,Leaky,77,5,24.0,16.0,12.0,0.009620381590274096,4,467,0.67543127975694,2.4975903028046417e-05,77.90114563389828,COMPLETE
423,0.21349656581878662,2023-09-04 11:55:07.385363,2023-09-04 11:55:08.038523,0 days 00:00:00.653160,Tanh,ReLU,,,79,22,23.0,,,0.005676012371994352,2,478,0.744944555027416,4.13227030598725e-05,92.5773462663617,COMPLETE
424,0.13842613995075226,2023-09-04 11:55:08.038846,2023-09-04 11:55:08.864523,0 days 00:00:00.825677,Tanh,Tanh,ReLU,Sigmoid,81,23,24.0,16.0,11.0,0.007811411726792159,4,452,0.7233167226337813,0.0003557345251420975,66.59758142839398,COMPLETE
425,0.13015593588352203,2023-09-04 11:55:08.864861,2023-09-04 11:55:10.037913,0 days 00:00:01.173052,Tanh,Tanh,ReLU,,84,21,12.0,15.0,,0.004369339499143419,3,443,0.525589969655461,1.6767572561458874e-05,83.13588071969839,COMPLETE
426,0.1568640172481537,2023-09-04 11:55:10.038251,2023-09-04 11:55:10.736612,0 days 00:00:00.698361,Tanh,Tanh,ReLU,,85,21,12.0,15.0,,0.00438885572118112,3,405,0.7655095804621038,3.71019176565856e-05,411.4800642508048,COMPLETE
427,0.16431401669979095,2023-09-04 11:55:10.736965,2023-09-04 11:55:11.657075,0 days 00:00:00.920110,Tanh,Tanh,ReLU,Leaky,83,21,13.0,15.0,6.0,0.003956329738426807,4,444,0.5729587911461347,2.504594051454675e-05,479.3397235180958,COMPLETE
428,0.5937473773956299,2023-09-04 11:55:11.657445,2023-09-04 11:55:12.036411,0 days 00:00:00.378966,Tanh,Tanh,ReLU,,81,1,7.0,13.0,,0.005090991925285357,3,455,0.7049715053124833,1.0204290642442121e-05,286.3018463134766,COMPLETE
429,0.2054987996816635,2023-09-04 11:55:12.036764,2023-09-04 11:55:12.552946,0 days 00:00:00.516182,Tanh,Tanh,ReLU,,84,22,12.0,14.0,,0.0032862892325383614,3,446,0.6711323749759835,2.1155553682239705e-05,94.03247399763627,COMPLETE
430,0.5359559059143066,2023-09-04 11:55:12.553292,2023-09-04 11:55:19.140264,0 days 00:00:06.586972,Tanh,Tanh,ReLU,Tanh,78,21,11.0,14.0,14.0,1.4970737575695153e-05,4,460,0.741168501204567,1.6137617021453216e-05,111.13860515096913,COMPLETE
431,0.19724677503108978,2023-09-04 11:55:19.140606,2023-09-04 11:55:20.601988,0 days 00:00:01.461382,Tanh,Tanh,ReLU,,82,21,12.0,15.0,,0.000829294625640193,3,437,0.6618502003922836,2.0983048460507785e-05,97.1170627300556,COMPLETE
432,0.15657970309257507,2023-09-04 11:55:20.602346,2023-09-04 11:55:20.917717,0 days 00:00:00.315371,Tanh,Tanh,ReLU,,80,22,11.0,16.0,,0.06069789026683517,3,471,0.5253365315506703,1.2927494273026872e-05,119.46969653714088,COMPLETE
433,0.1553240418434143,2023-09-04 11:55:20.918081,2023-09-04 11:55:21.601222,0 days 00:00:00.683141,Tanh,Tanh,ReLU,ReLU,85,24,13.0,15.0,20.0,0.006217602929974314,4,480,0.6027015684659061,1.4450354281581415e-05,66.00381055371514,COMPLETE
434,0.2616901695728302,2023-09-04 11:55:21.601577,2023-09-04 11:55:21.947881,0 days 00:00:00.346304,Leaky,Tanh,ReLU,,76,20,10.0,13.0,,0.0037357933640533468,3,429,0.5442246336296621,0.004187756731408474,93.09261107444763,COMPLETE
435,0.21893078088760376,2023-09-04 11:55:21.948219,2023-09-04 11:55:22.582050,0 days 00:00:00.633831,Tanh,Tanh,ReLU,,79,20,2.0,16.0,,0.004994836537039137,3,465,0.7706291282784058,1.6110654223606024e-05,94.49462906857754,COMPLETE
436,0.23190738260746002,2023-09-04 11:55:22.582397,2023-09-04 11:55:23.330558,0 days 00:00:00.748161,Tanh,Tanh,ReLU,Leaky,83,22,24.0,12.0,24.0,0.006221605724449851,4,452,0.707036519081098,0.011218609241658954,133.30347097144937,COMPLETE
437,0.15174774825572968,2023-09-04 11:55:23.330902,2023-09-04 11:55:24.494227,0 days 00:00:01.163325,Tanh,Tanh,,,81,21,14.0,,,0.004299595493177752,2,469,0.7288943710890807,1.1163324912154149e-05,92.07999371615323,COMPLETE
438,0.28447163105010986,2023-09-04 11:55:24.494551,2023-09-04 11:55:26.252327,0 days 00:00:01.757776,Sigmoid,Tanh,ReLU,,78,23,12.0,15.0,,0.0012457968910956068,3,491,0.767689464178749,0.0017092842158175055,97.61602364999277,COMPLETE
439,0.15172433853149414,2023-09-04 11:55:26.252671,2023-09-04 11:55:26.898357,0 days 00:00:00.645686,Tanh,Tanh,Leaky,,76,20,8.0,17.0,,0.0075773212658462544,3,478,0.5582538335379494,1.0188978376404593e-05,80.3219402067123,COMPLETE
440,0.2577240467071533,2023-09-04 11:55:26.898717,2023-09-04 11:55:27.048638,0 days 00:00:00.149921,Leaky,Tanh,ReLU,Leaky,57,21,24.0,14.0,23.0,0.04324486368179622,4,443,0.11200364838068132,0.0016243007957348818,78.54874636332194,COMPLETE
441,0.23728014528751373,2023-09-04 11:55:27.048990,2023-09-04 11:55:27.928452,0 days 00:00:00.879462,Tanh,Tanh,ReLU,,82,22,23.0,18.0,,0.0026251203811144025,3,460,0.6927922771989582,1.7213503138662128e-05,155.923892127143,COMPLETE
442,0.22490407526493073,2023-09-04 11:55:27.928798,2023-09-04 11:55:29.155549,0 days 00:00:01.226751,Tanh,Sigmoid,ReLU,Sigmoid,80,23,11.0,16.0,21.0,0.002340423935797495,4,473,0.6341766618291561,6.300342917731221e-05,89.14849005805121,COMPLETE
443,0.20965011417865753,2023-09-04 11:55:29.155895,2023-09-04 11:55:30.309600,0 days 00:00:01.153705,Tanh,Tanh,Sigmoid,,85,22,16.0,17.0,,0.0053376702258834665,3,462,0.7425989551993034,0.009115596254579339,85.6043412057977,COMPLETE
444,0.19777315855026245,2023-09-04 11:55:30.309918,2023-09-04 11:55:30.812615,0 days 00:00:00.502697,Tanh,Tanh,ReLU,,78,21,12.0,19.0,,0.0064517817432496495,3,454,0.7730544971708305,3.427980452022552e-05,91.9121810913086,COMPLETE
445,0.14811205863952637,2023-09-04 11:55:30.812957,2023-09-04 11:55:31.880021,0 days 00:00:01.067064,Tanh,Tanh,ReLU,Leaky,83,20,9.0,15.0,24.0,0.0032849486812538196,4,484,0.7182496460176823,4.337497770342024e-05,70.13551984514508,COMPLETE
446,0.19999666512012482,2023-09-04 11:55:31.880368,2023-09-04 11:55:32.292310,0 days 00:00:00.411942,Leaky,Tanh,ReLU,,81,22,24.0,16.0,,0.004130600547686144,3,468,0.798167440116039,0.00755147537586741,74.95383712223598,COMPLETE
447,0.1686602234840393,2023-09-04 11:55:32.292637,2023-09-04 11:55:33.018489,0 days 00:00:00.725852,Tanh,Tanh,ReLU,,76,21,24.0,18.0,,0.0020628769732265392,3,308,0.5919030693364583,1.4538262450142121e-05,87.76142319899338,COMPLETE
448,0.3809974491596222,2023-09-04 11:55:33.018831,2023-09-04 11:55:33.305207,0 days 00:00:00.286376,Tanh,Tanh,Tanh,Leaky,80,3,23.0,14.0,9.0,0.09896456853631623,4,451,0.6651212563248706,1.8160168448296282e-05,171.66108181602075,COMPLETE
449,0.3532995283603668,2023-09-04 11:55:33.305546,2023-09-04 11:55:34.464515,0 days 00:00:01.158969,Sigmoid,Tanh,Tanh,,84,6,24.0,15.0,,0.008841419777160332,3,478,0.6972008286201467,0.01796668111175932,133.83035044150776,COMPLETE
450,0.290785014629364,2023-09-04 11:55:34.464851,2023-09-04 11:55:34.698552,0 days 00:00:00.233701,Tanh,Tanh,ReLU,Tanh,78,24,10.0,17.0,19.0,0.03460108938817268,4,492,0.7378392415441847,0.006106764641782819,125.11250305175781,COMPLETE
451,0.20946092903614044,2023-09-04 11:55:34.698898,2023-09-04 11:55:35.191381,0 days 00:00:00.492483,Leaky,Tanh,Tanh,,82,20,23.0,16.0,,0.005149776399863192,3,420,0.5136838760336075,5.0496019175925495e-05,109.36076414818858,COMPLETE
452,0.15854668617248535,2023-09-04 11:55:35.191761,2023-09-04 11:55:35.873429,0 days 00:00:00.681668,Tanh,ReLU,ReLU,,79,21,15.0,19.0,,0.0066991333997812,3,459,0.7677478727765561,0.0009206907360280092,73.08975204467774,COMPLETE
453,0.17518141865730286,2023-09-04 11:55:35.873801,2023-09-04 11:55:36.690834,0 days 00:00:00.817033,Tanh,Tanh,Tanh,Leaky,62,23,11.0,18.0,23.0,0.0038339590173998906,4,471,0.7192115154061631,1.956433559061389e-05,74.7205794652303,COMPLETE
454,0.12925170361995697,2023-09-04 11:55:36.691196,2023-09-04 11:55:37.398306,0 days 00:00:00.707110,Tanh,Tanh,ReLU,,75,20,14.0,14.0,,0.010178593987194512,3,440,0.7994633305112706,1.2559338632902414e-05,84.34217516581218,COMPLETE
455,0.18506357073783875,2023-09-04 11:55:37.398643,2023-09-04 11:55:37.733879,0 days 00:00:00.335236,Tanh,Tanh,ReLU,,75,20,14.0,14.0,,0.009015156528685096,3,437,0.20766898339632717,3.0817569953263425e-05,77.04073067233988,COMPLETE
456,0.2552807927131653,2023-09-04 11:55:37.734220,2023-09-04 11:55:37.968116,0 days 00:00:00.233896,Tanh,Tanh,ReLU,,74,20,12.0,13.0,,0.011044327837949367,3,444,0.2483844567620688,1.4311950761139e-05,120.75993229792668,COMPLETE
457,0.19245655834674835,2023-09-04 11:55:37.968455,2023-09-04 11:55:38.622460,0 days 00:00:00.654005,Tanh,Tanh,,,76,21,13.0,,,0.007401238876885043,2,447,0.766936330888743,1.540901001710045e-05,114.62129710804332,COMPLETE
458,0.17192941904067993,2023-09-04 11:55:38.622792,2023-09-04 11:55:39.372886,0 days 00:00:00.750094,Tanh,Tanh,ReLU,ReLU,77,21,13.0,14.0,21.0,0.010156669822591021,4,430,0.7958435926112215,1.140317279087605e-05,76.61856021051821,COMPLETE
459,0.14866022765636444,2023-09-04 11:55:39.373235,2023-09-04 11:55:40.281296,0 days 00:00:00.908061,Tanh,Tanh,ReLU,Sigmoid,73,21,13.0,13.0,18.0,0.005691013779110391,4,462,0.7977255461507717,1.3779323276094621e-05,94.6559194391424,COMPLETE
460,0.20429356396198273,2023-09-04 11:55:40.281662,2023-09-04 11:55:41.607621,0 days 00:00:01.325959,Tanh,Tanh,ReLU,,77,22,13.0,15.0,,0.0005122584438049781,3,409,0.750228879686462,1.2263949818183956e-05,243.04425318100874,COMPLETE
461,0.13957983255386353,2023-09-04 11:55:41.607963,2023-09-04 11:55:42.288652,0 days 00:00:00.680689,Tanh,Tanh,ReLU,,75,20,14.0,14.0,,0.008485551272530548,3,440,0.613254567416266,5.531958653809494e-05,63.966238021850586,COMPLETE
462,0.18069776892662048,2023-09-04 11:55:42.288987,2023-09-04 11:55:43.263889,0 days 00:00:00.974902,Tanh,Tanh,ReLU,Leaky,54,20,11.0,15.0,22.0,0.0046639576802500375,4,450,0.6809099780160878,0.002606690997943126,81.3446226640181,COMPLETE
463,0.12983186542987823,2023-09-04 11:55:43.264227,2023-09-04 11:55:44.273079,0 days 00:00:01.008852,Tanh,Tanh,ReLU,,79,22,17.0,16.0,,0.00718890351868823,3,484,0.7502058433195167,0.0007435380441390277,83.85864130655925,COMPLETE
464,0.10602188855409622,2023-09-04 11:55:44.273419,2023-09-04 11:55:45.325693,0 days 00:00:01.052274,Tanh,Tanh,ReLU,,79,22,17.0,16.0,,0.007868032573202644,3,494,0.7719847882233551,1.9206501204307016e-05,122.06456418580646,COMPLETE
465,0.14436854422092438,2023-09-04 11:55:45.326047,2023-09-04 11:55:45.793277,0 days 00:00:00.467230,Tanh,Tanh,ReLU,,79,23,17.0,16.0,,0.01006850074638216,3,500,0.7697174306228801,1.5968510588924087e-05,75.40145388516513,COMPLETE
