number,value,datetime_start,datetime_complete,duration,params_activation1,params_activation2,params_activation3,params_activation4,params_batch_size,params_fl1,params_fl2,params_fl3,params_fl4,params_learning_rate,params_n_layers,params_num_epochs,params_train_size,params_weight_decay,user_attrs_mre,state
0,0.25788530707359314,2023-09-04 11:48:01.948361,2023-09-04 11:48:03.782896,0 days 00:00:01.834535,ReLU,,,,19,19,,,,0.00011217295885349223,1,275,0.1937571675756237,1.3829053482492678e-05,112.32614035866477,COMPLETE
1,0.34209486842155457,2023-09-04 11:48:03.783170,2023-09-04 11:48:05.648504,0 days 00:00:01.865334,Sigmoid,ReLU,ReLU,,66,6,12.0,18.0,,0.00013224132279304068,3,431,0.1979528293648257,0.00014478104888563975,275.27662701175274,COMPLETE
2,0.19887638092041016,2023-09-04 11:48:05.648804,2023-09-04 11:48:06.301480,0 days 00:00:00.652676,Leaky,Sigmoid,ReLU,,61,17,3.0,23.0,,0.005971277249398176,3,102,0.5757829441363482,0.0010723733493665762,90.70412861217152,COMPLETE
3,0.2906074821949005,2023-09-04 11:48:06.301795,2023-09-04 11:48:06.469241,0 days 00:00:00.167446,Leaky,Leaky,Leaky,Sigmoid,75,16,20.0,18.0,10.0,0.08400779925255274,4,241,0.17825823165034776,0.013436108569980423,109.26485988071987,COMPLETE
4,0.9733514785766602,2023-09-04 11:48:06.469547,2023-09-04 11:48:06.820289,0 days 00:00:00.350742,Leaky,Tanh,Leaky,Sigmoid,85,2,1.0,5.0,5.0,0.00022709924996607437,4,336,0.3046847593759846,0.08505628292062777,100.04799127578735,COMPLETE
5,0.2160729020833969,2023-09-04 11:48:06.820601,2023-09-04 11:48:07.229615,0 days 00:00:00.409014,Tanh,ReLU,,,62,11,15.0,,,0.004315608325517295,2,286,0.43440396983000873,7.460289404220884e-05,140.0084620666504,COMPLETE
6,0.36894160509109497,2023-09-04 11:48:07.229901,2023-09-04 11:48:07.582395,0 days 00:00:00.352494,Sigmoid,Sigmoid,,,11,21,21.0,,,0.04827548234604374,2,275,0.21377962124096028,0.038647249827888835,140.3391834894816,COMPLETE
7,0.262388676404953,2023-09-04 11:48:07.582694,2023-09-04 11:48:08.568498,0 days 00:00:00.985804,Leaky,ReLU,Tanh,Sigmoid,17,7,10.0,20.0,4.0,0.035339093395281754,4,97,0.44840755206773847,9.99530314325983e-05,193.67862963676453,COMPLETE
8,0.998626708984375,2023-09-04 11:48:08.568794,2023-09-04 11:48:08.716230,0 days 00:00:00.147436,Sigmoid,ReLU,Sigmoid,Leaky,66,18,2.0,5.0,7.0,0.07756465640204709,4,296,0.1814589110830874,0.018380300850099663,102.11116169117115,COMPLETE
9,0.2847471833229065,2023-09-04 11:48:08.716533,2023-09-04 11:48:09.027935,0 days 00:00:00.311402,Leaky,ReLU,,,65,20,3.0,,,0.0007316038713214335,2,474,0.12147664634187466,0.010675126405028263,140.1850339904312,COMPLETE
10,0.9204997420310974,2023-09-04 11:48:09.028191,2023-09-04 11:48:10.289942,0 days 00:00:01.261751,ReLU,Sigmoid,ReLU,,42,24,7.0,24.0,,2.1785727440754954e-05,3,63,0.7489646398789055,0.001415766721670497,99.05759684244792,COMPLETE
11,0.22200816869735718,2023-09-04 11:48:10.290268,2023-09-04 11:48:11.173052,0 days 00:00:00.882784,Tanh,,,,44,13,,,,0.007180548864034356,1,178,0.5238938457093624,0.0010370076685026792,104.5883143881093,COMPLETE
12,0.20862406492233276,2023-09-04 11:48:11.173455,2023-09-04 11:48:12.526178,0 days 00:00:01.352723,Tanh,Sigmoid,,,98,11,16.0,,,0.004126122660126143,2,174,0.42767407002437097,0.00022309594515327507,171.1691795797909,COMPLETE
13,0.22269821166992188,2023-09-04 11:48:12.526613,2023-09-04 11:48:13.865634,0 days 00:00:01.339021,Tanh,Sigmoid,ReLU,,92,13,16.0,13.0,,0.004622927535278881,3,148,0.7968265890673757,0.0004243521073603492,115.27807227048007,COMPLETE
14,0.24051916599273682,2023-09-04 11:48:13.865919,2023-09-04 11:48:14.235032,0 days 00:00:00.369113,Tanh,Sigmoid,,,100,9,24.0,,,0.01280443361784401,2,173,0.35571175725061616,0.0038206420701861863,180.54718062456917,COMPLETE
15,0.22273384034633636,2023-09-04 11:48:14.235291,2023-09-04 11:48:15.890513,0 days 00:00:01.655222,Leaky,Sigmoid,Sigmoid,,42,16,7.0,24.0,,0.001877132150567036,3,117,0.5492243246309811,0.0004530512171428526,88.56030084452497,COMPLETE
16,0.2841167151927948,2023-09-04 11:48:15.890785,2023-09-04 11:48:16.280056,0 days 00:00:00.389271,Tanh,,,,82,3,,,,0.01283658089422945,1,213,0.613588736749902,0.0020561527778886184,132.2951339085897,COMPLETE
17,0.2276429533958435,2023-09-04 11:48:16.280361,2023-09-04 11:48:17.053224,0 days 00:00:00.772863,ReLU,Tanh,,,48,15,17.0,,,0.0007601384881633931,2,84,0.41013052119407506,0.00411795388926314,123.94924063909622,COMPLETE
18,0.26185372471809387,2023-09-04 11:48:17.053492,2023-09-04 11:48:17.486408,0 days 00:00:00.432916,Leaky,Leaky,Tanh,,31,10,7.0,12.0,,0.002196190211699741,3,52,0.31699574451025975,0.0003814467960822235,103.14449375697545,COMPLETE
19,0.1807045340538025,2023-09-04 11:48:17.486688,2023-09-04 11:48:18.013102,0 days 00:00:00.526414,Tanh,Sigmoid,,,76,22,11.0,,,0.022037381585217727,2,369,0.6009003428766344,4.6147085393296665e-05,95.19439610895121,COMPLETE
20,0.18772609531879425,2023-09-04 11:48:18.018911,2023-09-04 11:48:18.530043,0 days 00:00:00.511132,Tanh,Sigmoid,ReLU,,54,23,5.0,1.0,,0.02129576222218487,3,335,0.6432881129293885,3.199714119175969e-05,74.6079090833664,COMPLETE
21,0.9543535709381104,2023-09-04 11:48:18.530326,2023-09-04 11:48:18.841170,0 days 00:00:00.310844,Tanh,Sigmoid,ReLU,,55,24,5.0,1.0,,0.015996234451517054,3,378,0.648066956694497,2.4154513077797706e-05,111.94193496704102,COMPLETE
22,0.17606790363788605,2023-09-04 11:48:18.841441,2023-09-04 11:48:19.350106,0 days 00:00:00.508665,Tanh,Sigmoid,ReLU,,73,22,10.0,11.0,,0.024212191799460492,3,376,0.6248381286805256,4.133713658773758e-05,76.3809461349096,COMPLETE
23,0.20448438823223114,2023-09-04 11:48:19.350503,2023-09-04 11:48:19.678688,0 days 00:00:00.328185,Tanh,Sigmoid,ReLU,,75,22,10.0,10.0,,0.03399375047807332,3,385,0.697107712381331,3.884911941463459e-05,111.83473570450492,COMPLETE
24,0.196054607629776,2023-09-04 11:48:19.678974,2023-09-04 11:48:20.086366,0 days 00:00:00.407392,Tanh,Sigmoid,,,76,22,10.0,,,0.02212695902220328,2,361,0.5192079328152918,1.2264403293892757e-05,103.42622683910614,COMPLETE
25,0.26847100257873535,2023-09-04 11:48:20.086632,2023-09-04 11:48:20.540124,0 days 00:00:00.453492,Tanh,Tanh,ReLU,,51,24,12.0,1.0,,0.0932378412820845,3,427,0.7948062031065953,4.253625183919148e-05,129.4194164276123,COMPLETE
26,0.20916210114955902,2023-09-04 11:48:20.540400,2023-09-04 11:48:21.533635,0 days 00:00:00.993235,Tanh,Leaky,ReLU,ReLU,33,22,5.0,8.0,24.0,0.022191060251227492,4,330,0.6638640237649419,5.5681167526049596e-05,97.91330357601768,COMPLETE
27,0.23676706850528717,2023-09-04 11:48:21.533919,2023-09-04 11:48:21.800158,0 days 00:00:00.266239,Tanh,Sigmoid,,,84,20,14.0,,,0.010466128269044112,2,424,0.4980354244219445,2.4505133174365233e-05,93.29446859920726,COMPLETE
28,0.21962952613830566,2023-09-04 11:48:21.800429,2023-09-04 11:48:22.005987,0 days 00:00:00.205558,Tanh,,,,71,19,,,,0.039544886693878935,1,332,0.6266651396952132,1.0305638743369019e-05,106.04108362612517,COMPLETE
29,0.21526257693767548,2023-09-04 11:48:22.006254,2023-09-04 11:48:22.325458,0 days 00:00:00.319204,ReLU,,,,56,18,,,,0.008976280784454546,1,498,0.6835560514907809,2.1585888532593345e-05,103.91522013346354,COMPLETE
30,0.1922358274459839,2023-09-04 11:48:22.325723,2023-09-04 11:48:23.313277,0 days 00:00:00.987554,Tanh,Sigmoid,Tanh,,34,23,9.0,14.0,,0.019548899864231167,3,388,0.5801754473459693,0.00012206527469931851,89.32075140611181,COMPLETE
31,0.22199581563472748,2023-09-04 11:48:23.313556,2023-09-04 11:48:24.011213,0 days 00:00:00.697657,Tanh,Sigmoid,Tanh,,28,23,9.0,15.0,,0.02036083036523843,3,399,0.5984415933326505,9.728481528893954e-05,82.4500491234564,COMPLETE
32,0.2282729595899582,2023-09-04 11:48:24.011490,2023-09-04 11:48:24.330854,0 days 00:00:00.319364,Tanh,Sigmoid,Tanh,,35,20,8.0,7.0,,0.04584070735689692,3,451,0.49182509619740516,0.00015460810143682032,150.46156272888183,COMPLETE
33,0.1765575259923935,2023-09-04 11:48:24.331139,2023-09-04 11:48:25.959945,0 days 00:00:01.628806,Sigmoid,Sigmoid,Tanh,,24,22,5.0,15.0,,0.022188815021639954,3,353,0.7206728334089656,4.782844102186795e-05,92.3579123461688,COMPLETE
34,0.1812642216682434,2023-09-04 11:48:25.960227,2023-09-04 11:48:27.538577,0 days 00:00:01.578350,Sigmoid,Sigmoid,Leaky,,18,21,5.0,16.0,,0.05405247591515999,3,308,0.7225860037650995,5.352854498982946e-05,84.77342391595607,COMPLETE
35,0.22668083012104034,2023-09-04 11:48:27.538860,2023-09-04 11:48:28.884996,0 days 00:00:01.346136,Sigmoid,Sigmoid,Leaky,Tanh,25,21,12.0,17.0,19.0,0.09862778361295563,4,240,0.7867537471199384,5.570935552206073e-05,144.0445147620307,COMPLETE
36,0.18883834779262543,2023-09-04 11:48:28.885282,2023-09-04 11:48:30.052654,0 days 00:00:01.167372,Sigmoid,Sigmoid,Leaky,,19,18,13.0,11.0,,0.05308365192110004,3,310,0.7047388732893971,1.4745967061146648e-05,86.5566186615915,COMPLETE
37,0.1922324001789093,2023-09-04 11:48:30.052934,2023-09-04 11:48:35.275436,0 days 00:00:05.222502,Sigmoid,Leaky,,,10,15,4.0,,,0.00840714694211891,2,354,0.5701908223902271,6.422361200738246e-05,89.19457570968136,COMPLETE
38,0.1986229568719864,2023-09-04 11:48:35.275717,2023-09-04 11:48:36.593793,0 days 00:00:01.318076,Sigmoid,Sigmoid,Leaky,Tanh,15,21,11.0,16.0,16.0,0.06110015909677994,4,268,0.7196523103022522,1.7865986707599828e-05,80.04201965332031,COMPLETE
39,0.21206197142601013,2023-09-04 11:48:36.594092,2023-09-04 11:48:37.443638,0 days 00:00:00.849546,Sigmoid,Tanh,,,23,19,1.0,,,0.030181790228334476,2,411,0.4686914787032716,3.0587608792296594e-05,115.42736098345588,COMPLETE
40,0.19191037118434906,2023-09-04 11:48:37.443919,2023-09-04 11:48:37.944075,0 days 00:00:00.500156,Sigmoid,Sigmoid,Sigmoid,,80,16,7.0,20.0,,0.06294144840854714,3,366,0.5696085679119798,5.896418378832777e-05,170.99959160299863,COMPLETE
41,0.17972669005393982,2023-09-04 11:48:37.944345,2023-09-04 11:48:38.620311,0 days 00:00:00.675966,Sigmoid,Sigmoid,Tanh,,60,23,5.0,9.0,,0.030333565303526502,3,320,0.6436449701986264,3.30053403061695e-05,88.2821668737075,COMPLETE
42,0.1930171251296997,2023-09-04 11:48:38.620586,2023-09-04 11:48:39.309507,0 days 00:00:00.688921,Sigmoid,Sigmoid,Tanh,,61,21,3.0,9.0,,0.031831153195045134,3,308,0.6820677986640921,3.716652440241717e-05,342.4673666381836,COMPLETE
43,0.20830683410167694,2023-09-04 11:48:39.309790,2023-09-04 11:48:39.868842,0 days 00:00:00.559052,Sigmoid,Sigmoid,Tanh,,71,22,6.0,13.0,,0.05796610080876575,3,254,0.7260595195183784,8.682627532290271e-05,136.57532446725028,COMPLETE
44,0.18838506937026978,2023-09-04 11:48:39.869129,2023-09-04 11:48:40.429867,0 days 00:00:00.560738,Sigmoid,Sigmoid,Tanh,,69,24,4.0,11.0,,0.03050674769708895,3,293,0.5542181700108999,1.6240877825196986e-05,96.98411079689309,COMPLETE
45,0.20255450904369354,2023-09-04 11:48:40.430146,2023-09-04 11:48:41.689485,0 days 00:00:01.259339,Sigmoid,ReLU,,,89,20,8.0,,,0.012972929563326404,2,450,0.6104734890218217,0.00013284834679756907,75.2182052056521,COMPLETE
46,0.23597195744514465,2023-09-04 11:48:41.689777,2023-09-04 11:48:43.294211,0 days 00:00:01.604434,Sigmoid,Leaky,Leaky,Leaky,61,17,2.0,15.0,1.0,0.007364968038637062,4,350,0.7556412264624689,7.625549998548298e-05,113.58265423774719,COMPLETE
47,0.21978120505809784,2023-09-04 11:48:43.294524,2023-09-04 11:48:43.746990,0 days 00:00:00.452466,ReLU,Sigmoid,Tanh,,67,23,6.0,20.0,,0.07007029398971407,3,316,0.5472079371342574,1.0434876973274446e-05,91.9907599229079,COMPLETE
48,0.23572222888469696,2023-09-04 11:48:43.747454,2023-09-04 11:48:45.449750,0 days 00:00:01.702296,Sigmoid,ReLU,,,15,19,14.0,,,0.005058520799330419,2,277,0.47489149272411674,4.4639118010592317e-05,86.9209964086139,COMPLETE
49,0.20281058549880981,2023-09-04 11:48:45.450039,2023-09-04 11:48:46.649823,0 days 00:00:01.199784,Sigmoid,Tanh,Tanh,ReLU,76,4,11.0,7.0,14.0,0.045776779659907875,4,235,0.6380648132340022,0.00022410017596471247,103.01668484336452,COMPLETE
50,0.1984647512435913,2023-09-04 11:48:46.650132,2023-09-04 11:48:47.094679,0 days 00:00:00.444547,Leaky,Sigmoid,Leaky,,37,21,4.0,12.0,,0.0155916328801461,3,406,0.4058268266903652,2.546154591387008e-05,109.83140389578683,COMPLETE
51,0.20389023423194885,2023-09-04 11:48:47.094958,2023-09-04 11:48:47.514011,0 days 00:00:00.419053,Tanh,Sigmoid,ReLU,,51,23,5.0,3.0,,0.023407530328601236,3,343,0.6505786431314968,2.9513550804912812e-05,76.65754275851779,COMPLETE
52,0.19693921506404877,2023-09-04 11:48:47.514312,2023-09-04 11:48:48.788769,0 days 00:00:01.274457,Sigmoid,Sigmoid,ReLU,,89,24,2.0,18.0,,0.026372762338640988,3,328,0.7345170025239147,1.758798033559561e-05,80.73581862449646,COMPLETE
53,0.20994362235069275,2023-09-04 11:48:48.789234,2023-09-04 11:48:49.338200,0 days 00:00:00.548966,ReLU,Sigmoid,ReLU,,64,22,6.0,15.0,,0.016605816279020982,3,372,0.5179962876712891,3.202659317854905e-05,108.53658384435317,COMPLETE
54,0.1719353348016739,2023-09-04 11:48:49.338664,2023-09-04 11:48:51.993577,0 days 00:00:02.654913,Tanh,Sigmoid,Leaky,,21,23,18.0,17.0,,0.036261692497441794,3,295,0.7990078304690672,4.7401602676055934e-05,86.81934847150531,COMPLETE
55,0.31419485807418823,2023-09-04 11:48:51.993857,2023-09-04 11:48:52.982455,0 days 00:00:00.988598,Sigmoid,Sigmoid,Leaky,,21,1,20.0,22.0,,0.04225082199989236,3,296,0.7856147631682053,7.791005627634199e-05,177.88962131076389,COMPLETE
56,0.21530728042125702,2023-09-04 11:48:52.982732,2023-09-04 11:48:53.502461,0 days 00:00:00.519729,Leaky,Sigmoid,,,27,20,17.0,,,0.0779546287733359,2,313,0.7269159800022273,5.910734534861537e-05,879.566464510831,COMPLETE
57,0.19479075074195862,2023-09-04 11:48:53.502797,2023-09-04 11:48:54.465056,0 days 00:00:00.962259,Tanh,ReLU,Leaky,,13,22,18.0,17.0,,0.01195219999540123,3,260,0.6197211070714304,3.876640288883791e-05,87.81548672630673,COMPLETE
58,0.17137573659420013,2023-09-04 11:48:54.465331,2023-09-04 11:48:55.339291,0 days 00:00:00.873960,Tanh,Sigmoid,Leaky,,19,24,8.0,19.0,,0.037279070036385815,3,283,0.7978119804992975,1.940971022103039e-05,257.5459463936942,COMPLETE
59,0.21060548722743988,2023-09-04 11:48:55.339589,2023-09-04 11:48:55.739196,0 days 00:00:00.399607,Tanh,Sigmoid,Sigmoid,,58,24,9.0,19.0,,0.035660157663815764,3,362,0.6761320710605139,1.9887215950341642e-05,79.60165546558521,COMPLETE
60,0.18427738547325134,2023-09-04 11:48:55.739481,2023-09-04 11:48:56.901310,0 days 00:00:01.161829,Tanh,Sigmoid,,,39,23,23.0,,,0.005534574756513259,2,207,0.7599472115945033,1.2700498458532922e-05,88.57853901386261,COMPLETE
61,0.18711033463478088,2023-09-04 11:48:56.901581,2023-09-04 11:48:58.200279,0 days 00:00:01.298698,Tanh,Sigmoid,Leaky,,18,21,8.0,17.0,,0.027505940376304598,3,322,0.7853272239024989,5.081807910993868e-05,97.73075226814517,COMPLETE
62,0.19073070585727692,2023-09-04 11:48:58.200559,2023-09-04 11:48:58.843857,0 days 00:00:00.643298,Tanh,Sigmoid,Leaky,,30,23,11.0,14.0,,0.04723456132895469,3,281,0.6973261870993983,2.4063776513736937e-05,120.50282757098859,COMPLETE
63,0.18672332167625427,2023-09-04 11:48:58.844137,2023-09-04 11:49:00.201790,0 days 00:00:01.357653,Tanh,Sigmoid,Leaky,,22,24,13.0,22.0,,0.016106634248598588,3,294,0.5864518456722707,4.346065528775108e-05,70.21188406850777,COMPLETE
64,0.20402412116527557,2023-09-04 11:49:00.202070,2023-09-04 11:49:00.522383,0 days 00:00:00.320313,Tanh,Sigmoid,Leaky,,46,22,10.0,19.0,,0.09615361580204607,3,347,0.6604053947484619,0.0001006949152521389,121.1899897257487,COMPLETE
65,0.1961720734834671,2023-09-04 11:49:00.522669,2023-09-04 11:49:01.039055,0 days 00:00:00.516386,Tanh,Tanh,Leaky,,79,23,8.0,16.0,,0.038471226176365655,3,397,0.7992636420834105,3.3328901290287286e-05,99.74727919295027,COMPLETE
66,0.23675194382667542,2023-09-04 11:49:01.039411,2023-09-04 11:49:01.793654,0 days 00:00:00.754243,ReLU,Leaky,Tanh,,25,21,6.0,10.0,,0.06574661052896034,3,222,0.6040825078198114,1.6086974690827315e-05,108.65344416300455,COMPLETE
67,0.22073590755462646,2023-09-04 11:49:01.793948,2023-09-04 11:49:02.718588,0 days 00:00:00.924640,Leaky,Sigmoid,Leaky,,13,8,3.0,13.0,,0.021098750549402218,3,381,0.7266711732846384,2.162738527725442e-05,127.88059658474393,COMPLETE
68,0.1977682262659073,2023-09-04 11:49:02.718865,2023-09-04 11:49:04.375037,0 days 00:00:01.656172,Tanh,Sigmoid,,,17,19,7.0,,,0.010527586326156843,2,304,0.6624550155461814,4.6574250988042265e-05,83.67734131989656,COMPLETE
69,0.20377260446548462,2023-09-04 11:49:04.375393,2023-09-04 11:49:05.282501,0 days 00:00:00.907108,Sigmoid,Sigmoid,Sigmoid,Leaky,73,20,9.0,18.0,24.0,0.025836015626951283,4,341,0.5472343119691633,7.4449107269664e-05,105.96272306804416,COMPLETE
70,0.21574679017066956,2023-09-04 11:49:05.282794,2023-09-04 11:49:05.982658,0 days 00:00:00.699864,Tanh,Sigmoid,Tanh,,20,22,4.0,14.0,,0.074787813836884,3,252,0.7444467520932417,2.807111006663438e-05,134.6576196770919,COMPLETE
71,0.1844053715467453,2023-09-04 11:49:05.982948,2023-09-04 11:49:06.508526,0 days 00:00:00.525578,Tanh,Sigmoid,,,39,23,24.0,,,0.03813777173966152,2,185,0.7589372071375075,1.1803039563959283e-05,116.97054999215263,COMPLETE
72,0.1960633099079132,2023-09-04 11:49:06.508857,2023-09-04 11:49:08.298926,0 days 00:00:01.790069,Tanh,Sigmoid,,,30,12,22.0,,,0.005863160011105975,2,272,0.6981800891926305,1.9708171380570127e-05,103.38208246231079,COMPLETE
73,0.16633081436157227,2023-09-04 11:49:08.299284,2023-09-04 11:49:09.066252,0 days 00:00:00.766968,Tanh,Sigmoid,,,24,24,20.0,,,0.05384407391567624,2,141,0.6400228014936034,1.5864465514738373e-05,120.09318026374368,COMPLETE
74,0.21800220012664795,2023-09-04 11:49:09.066612,2023-09-04 11:49:09.793966,0 days 00:00:00.727354,Tanh,Sigmoid,,,25,24,20.0,,,0.05653073562053693,2,155,0.6317740099911824,1.4197584762984642e-05,75.53226759939483,COMPLETE
75,0.2212364822626114,2023-09-04 11:49:09.794324,2023-09-04 11:49:10.557080,0 days 00:00:00.762756,Tanh,,,,17,24,,,,0.050656225634388936,1,117,0.5940690673590234,3.741756240139482e-05,111.68509913853237,COMPLETE
76,0.2277774214744568,2023-09-04 11:49:10.557434,2023-09-04 11:49:11.871671,0 days 00:00:01.314237,Sigmoid,Sigmoid,Leaky,,10,21,19.0,21.0,,0.031717469897493696,3,323,0.6933647361194263,6.328290507631844e-05,90.37250337146577,COMPLETE
77,0.2033161073923111,2023-09-04 11:49:11.872039,2023-09-04 11:49:12.733329,0 days 00:00:00.861290,Tanh,Sigmoid,Tanh,,23,22,21.0,16.0,,0.017634961973161205,3,359,0.646410674503455,2.406757535073899e-05,124.24234085083008,COMPLETE
78,0.18098121881484985,2023-09-04 11:49:12.733705,2023-09-04 11:49:13.931518,0 days 00:00:01.197813,Sigmoid,ReLU,,,27,24,19.0,,,0.024845209729495703,2,287,0.6167355515642242,1.3323699453786553e-05,86.61537868693723,COMPLETE
79,0.1947198212146759,2023-09-04 11:49:13.931885,2023-09-04 11:49:14.872058,0 days 00:00:00.940173,Tanh,ReLU,,,27,24,19.0,,,0.02613756675027098,2,387,0.5208869614544975,1.0405172486948042e-05,104.47570570125136,COMPLETE
80,0.2533685564994812,2023-09-04 11:49:14.872485,2023-09-04 11:49:16.303909,0 days 00:00:01.431424,Sigmoid,ReLU,,,32,23,16.0,,,0.014773325335554165,2,419,0.5927555383825408,1.362518538812364e-05,89.49472929302014,COMPLETE
81,0.18225915729999542,2023-09-04 11:49:16.304179,2023-09-04 11:49:17.116632,0 days 00:00:00.812453,Sigmoid,ReLU,,,14,22,21.0,,,0.019806966744054032,2,290,0.6797271677679941,1.900853805595863e-05,94.94311269124348,COMPLETE
82,0.18834693729877472,2023-09-04 11:49:17.116918,2023-09-04 11:49:17.937674,0 days 00:00:00.820756,Sigmoid,ReLU,,,24,23,19.0,,,0.04541161058491841,2,265,0.6363182879383183,2.9689368142852815e-05,76.62286202566965,COMPLETE
83,0.22212077677249908,2023-09-04 11:49:17.937947,2023-09-04 11:49:18.347402,0 days 00:00:00.409455,Sigmoid,,,,19,24,,,,0.08133920157417485,1,305,0.7139292841348616,4.689472109619073e-05,122.79264337876263,COMPLETE
84,0.1513817310333252,2023-09-04 11:49:18.347668,2023-09-04 11:49:18.998477,0 days 00:00:00.650809,Sigmoid,Leaky,ReLU,,85,22,18.0,9.0,,0.03645010049160392,3,79,0.7661793958215877,3.571592775978227e-05,67.44821032355813,COMPLETE
85,0.22178567945957184,2023-09-04 11:49:18.998768,2023-09-04 11:49:19.532321,0 days 00:00:00.533553,Sigmoid,Leaky,,,82,23,18.0,,,0.033301056337095444,2,75,0.7999288795747296,1.5292429609390958e-05,84.95145212809244,COMPLETE
86,0.19847379624843597,2023-09-04 11:49:19.532600,2023-09-04 11:49:19.839661,0 days 00:00:00.307061,ReLU,Leaky,ReLU,,95,22,17.0,6.0,,0.023758479326900547,3,110,0.5669550876735099,3.5591981480477395e-05,131.1693888697131,COMPLETE
87,0.20578491687774658,2023-09-04 11:49:19.839966,2023-09-04 11:49:21.069354,0 days 00:00:01.229388,Sigmoid,Leaky,ReLU,,85,21,22.0,9.0,,0.010789357908588442,3,141,0.752621783240696,2.044004158238778e-05,199.1066652235094,COMPLETE
88,0.17943912744522095,2023-09-04 11:49:21.069644,2023-09-04 11:49:21.512035,0 days 00:00:00.442391,Tanh,Leaky,,,77,24,18.0,,,0.03418836549058444,2,76,0.6110620813169695,2.7204286564834876e-05,88.40137752956814,COMPLETE
89,0.22264307737350464,2023-09-04 11:49:21.512350,2023-09-04 11:49:22.077345,0 days 00:00:00.564995,Tanh,Leaky,ReLU,,78,5,18.0,11.0,,0.060869898884683214,3,53,0.6625830965097584,2.631712565459758e-05,90.76577510004458,COMPLETE
90,0.1997227817773819,2023-09-04 11:49:22.077652,2023-09-04 11:49:22.544501,0 days 00:00:00.466849,Tanh,Leaky,ReLU,,86,20,15.0,8.0,,0.039704824176002386,3,101,0.544098485942132,4.227244140483351e-05,113.73082907994588,COMPLETE
91,0.17247512936592102,2023-09-04 11:49:22.544790,2023-09-04 11:49:22.919106,0 days 00:00:00.374316,Tanh,Leaky,,,72,24,20.0,,,0.03163835356811334,2,83,0.6172802211029935,3.0130295367455677e-05,90.11168452671596,COMPLETE
92,0.1871429979801178,2023-09-04 11:49:22.919404,2023-09-04 11:49:23.350672,0 days 00:00:00.431268,Tanh,Leaky,,,73,23,21.0,,,0.02962275545531358,2,88,0.6906269634015834,3.312652902673565e-05,82.70001481708728,COMPLETE
93,0.17750994861125946,2023-09-04 11:49:23.350958,2023-09-04 11:49:23.922349,0 days 00:00:00.571391,Tanh,Leaky,,,70,24,20.0,,,0.01956030437300688,2,70,0.6217881602762998,6.686878148036292e-05,116.37792516637731,COMPLETE
